{
  "date": "2025-07-02",
  "date_of_scrape": "2025-07-03T04:20:31.388Z",
  "tool_version": "0.2.0",
  "number_of_announcements": 171,
  "announcements": [
    {
      "date": "2025-07-02",
      "id": "114194",
      "original_text": "Registerbekanntmachung nach dem Umwandlungsgesetz\nBayern Amtsgericht München HRB 145484\nBILUDIS Beteiligungs GmbH – Pullach i. Isartal, Lkr. München",
      "type": "Registerbekanntmachung nach dem Umwandlungsgesetz",
      "state": "Bayern",
      "amtsgericht": "Amtsgericht München",
      "registernummer": "HRB 145484",
      "registerart": "HRB",
      "company_name": "BILUDIS Beteiligungs GmbH",
      "company_seat": "Pullach i. Isartal, Lkr. München",
      "details": "02.07.2025 (Bekanntmachungsdatum)\n\nBayern Amtsgericht München HRB 145484\nRegisterbekanntmachung nach dem Umwandlungsgesetz 01.07.2025 (Eintragungsdatum)\n\nBILUDIS Beteiligungs GmbH\nGesellschaft mit beschränkter Haftung\nPullach i. Isartal, Lkr. München\n\nDen Gläubigern der an der Verschmelzung beteiligten Rechtsträger ist, wenn sie binnen sechs Monaten nach dem Tag, an dem die Eintragung der Verschmelzung in das Register des Sitzes desjenigen Rechtsträgers, dessen Gläubiger sie sind, nach § 19 Abs. 3 UmwG als bekannt gemacht gilt, ihren Anspruch nach Grund und Höhe in Textform anmelden, Sicherheit zu leisten, soweit sie nicht Befriedigung verlangen können. Dieses Recht steht den Gläubigern jedoch nur zu, wenn sie glaubhaft machen, dass durch die Verschmelzung die Erfüllung ihrer Forderung gefährdet wird."
    },
    {
      "date": "2025-07-02",
      "id": "114195",
      "original_text": "Registerbekanntmachung nach dem Umwandlungsgesetz\nBayern Amtsgericht München HRB 112719\nESTA-Druck GmbH – Huglfing",
      "type": "Registerbekanntmachung nach dem Umwandlungsgesetz",
      "state": "Bayern",
      "amtsgericht": "Amtsgericht München",
      "registernummer": "HRB 112719",
      "registerart": "HRB",
      "company_name": "ESTA-Druck GmbH",
      "company_seat": "Huglfing",
      "details": "02.07.2025 (Bekanntmachungsdatum)\n\nBayern Amtsgericht München HRB 112719\nRegisterbekanntmachung nach dem Umwandlungsgesetz 01.07.2025 (Eintragungsdatum)\n\nESTA-Druck GmbH\nGesellschaft mit beschränkter Haftung\nHuglfing\n\nDen Gläubigern der an der Verschmelzung beteiligten Rechtsträger ist, wenn sie binnen sechs Monaten nach dem Tag, an dem die Eintragung der Verschmelzung in das Register des Sitzes desjenigen Rechtsträgers, dessen Gläubiger sie sind, nach § 19 Abs. 3 UmwG als bekannt gemacht gilt, ihren Anspruch nach Grund und Höhe in Textform anmelden, Sicherheit zu leisten, soweit sie nicht Befriedigung verlangen können. Dieses Recht steht den Gläubigern jedoch nur zu, wenn sie glaubhaft machen, dass durch die Verschmelzung die Erfüllung ihrer Forderung gefährdet wird."
    },
    {
      "date": "2025-07-02",
      "id": "114196",
      "original_text": "Registerbekanntmachung nach dem Umwandlungsgesetz\nBayern Amtsgericht Nürnberg HRB 14547\nRockefeller Trading Company Nürnberg GmbH – Nürnberg",
      "type": "Registerbekanntmachung nach dem Umwandlungsgesetz",
      "state": "Bayern",
      "amtsgericht": "Amtsgericht Nürnberg",
      "registernummer": "HRB 14547",
      "registerart": "HRB",
      "company_name": "Rockefeller Trading Company Nürnberg GmbH",
      "company_seat": "Nürnberg",
      "details": "02.07.2025 (Bekanntmachungsdatum)\n\nBayern Amtsgericht Nürnberg HRB 14547\nRegisterbekanntmachung nach dem Umwandlungsgesetz 01.07.2025 (Eintragungsdatum)\n\nRockefeller Trading Company Nürnberg GmbH\nGesellschaft mit beschränkter Haftung\nNürnberg\n\nDen Gläubigern der an der Verschmelzung beteiligten Rechtsträger ist, wenn sie binnen sechs Monaten nach dem Tag, an dem die Eintragung der Verschmelzung in das Register des Sitzes desjenigen Rechtsträgers, dessen Gläubiger sie sind, nach § 19 Abs. 3 UmwG als bekannt gemacht gilt, ihren Anspruch nach Grund und Höhe in Textform anmelden, Sicherheit zu leisten, soweit sie nicht Befriedigung verlangen können. Dieses Recht steht den Gläubigern jedoch nur zu, wenn sie glaubhaft machen, dass durch die Verschmelzung die Erfüllung ihrer Forderung gefährdet wird."
    },
    {
      "date": "2025-07-02",
      "id": "114197",
      "original_text": "Registerbekanntmachung nach dem Umwandlungsgesetz\nBayern Amtsgericht Weiden i. d. OPf. HRB 1435\nJosef Witt GmbH – Weiden i.d.OPf.",
      "type": "Registerbekanntmachung nach dem Umwandlungsgesetz",
      "state": "Bayern",
      "amtsgericht": "Amtsgericht Weiden i. d. OPf.",
      "registernummer": "HRB 1435",
      "registerart": "HRB",
      "company_name": "Josef Witt GmbH",
      "company_seat": "Weiden i.d.OPf.",
      "details": "02.07.2025 (Bekanntmachungsdatum)\n\nBayern Amtsgericht Weiden i. d. OPf. HRB 1435\nRegisterbekanntmachung nach dem Umwandlungsgesetz 01.07.2025 (Eintragungsdatum)\n\nJosef Witt GmbH\nGesellschaft mit beschränkter Haftung\nWeiden i.d.OPf.\n\nDen Gläubigernder an der Verschmelzung beteiligten Rechtsträger ist, wenn sie binnen sechs Monaten nach dem Tag, an dem die Eintragung der Verschmelzung in das Register des Sitzes desjenigen Rechtsträgers, dessen Gläubiger sie sind, nach § 19 Abs. 3 UmwG als bekannt gemacht gilt, ihren Anspruch nach Grund und Höhe in Textform anmelden, Sicherheit zu leisten, soweit sie nicht Befriedigung verlangen können. Dieses Recht steht den Gläubigern jedoch nur zu, wenn sie glaubhaft machen, dass durch die Verschmelzung die Erfüllung ihrer Forderung gefährdet wird."
    },
    {
      "date": "2025-07-02",
      "id": "114198",
      "original_text": "Registerbekanntmachung nach dem Umwandlungsgesetz\nBayern Amtsgericht München HRB 196375\nBoosta GmbH – Tutzing",
      "type": "Registerbekanntmachung nach dem Umwandlungsgesetz",
      "state": "Bayern",
      "amtsgericht": "Amtsgericht München",
      "registernummer": "HRB 196375",
      "registerart": "HRB",
      "company_name": "Boosta GmbH",
      "company_seat": "Tutzing",
      "details": "02.07.2025 (Bekanntmachungsdatum)\n\nBayern Amtsgericht München HRB 196375\nRegisterbekanntmachung nach dem Umwandlungsgesetz 01.07.2025 (Eintragungsdatum)\n\nBoosta GmbH\nGesellschaft mit beschränkter Haftung\nTutzing\n\nDen Gläubigern der an der Verschmelzung beteiligten Rechtsträger ist, wenn sie binnen sechs Monaten nach dem Tag, an dem die Eintragung der Verschmelzung in das Register des Sitzes desjenigen Rechtsträgers, dessen Gläubiger sie sind, nach § 19 Abs. 3 UmwG als bekannt gemacht gilt, ihren Anspruch nach Grund und Höhe in Textform anmelden, Sicherheit zu leisten, soweit sie nicht Befriedigung verlangen können. Dieses Recht steht den Gläubigern jedoch nur zu, wenn sie glaubhaft machen, dass durch die Verschmelzung die Erfüllung ihrer Forderung gefährdet wird."
    },
    {
      "date": "2025-07-02",
      "id": "114199",
      "original_text": "Registerbekanntmachung nach dem Umwandlungsgesetz\nBayern Amtsgericht München HRB 144881\nHADES Fünfte Verwaltung GmbH – Pullach i. Isartal",
      "type": "Registerbekanntmachung nach dem Umwandlungsgesetz",
      "state": "Bayern",
      "amtsgericht": "Amtsgericht München",
      "registernummer": "HRB 144881",
      "registerart": "HRB",
      "company_name": "HADES Fünfte Verwaltung GmbH",
      "company_seat": "Pullach i. Isartal",
      "details": "02.07.2025 (Bekanntmachungsdatum)\n\nBayern Amtsgericht München HRB 144881\nRegisterbekanntmachung nach dem Umwandlungsgesetz 01.07.2025 (Eintragungsdatum)\n\nHADES Fünfte Verwaltung GmbH\nGesellschaft mit beschränkter Haftung\nPullach i. Isartal\n\nDen Gläubigern der an der Verschmelzung beteiligten Rechtsträger ist, wenn sie binnen sechs Monaten nach dem Tag, an dem die Eintragung der Verschmelzung in das Register des Sitzes desjenigen Rechtsträgers, dessen Gläubiger sie sind, nach § 19 Abs. 3 UmwG als bekannt gemacht gilt, ihren Anspruch nach Grund und Höhe in Textform anmelden, Sicherheit zu leisten, soweit sie nicht Befriedigung verlangen können. Dieses Recht steht den Gläubigern jedoch nur zu, wenn sie glaubhaft machen, dass durch die Verschmelzung die Erfüllung ihrer Forderung gefährdet wird."
    },
    {
      "date": "2025-07-02",
      "id": "114200",
      "original_text": "Registerbekanntmachung nach dem Umwandlungsgesetz\nBayern Amtsgericht München HRA 120211\nGeorg Brunner \"FlyCol\" e.K. – Rudelzhausen",
      "type": "Registerbekanntmachung nach dem Umwandlungsgesetz",
      "state": "Bayern",
      "amtsgericht": "Amtsgericht München",
      "registernummer": "HRA 120211",
      "registerart": "HRA",
      "company_name": "Georg Brunner \"FlyCol\" e.K.",
      "company_seat": "Rudelzhausen",
      "details": "02.07.2025 (Bekanntmachungsdatum)\n\nBayern Amtsgericht München HRA 120211\nRegisterbekanntmachung nach dem Umwandlungsgesetz 01.07.2025 (Eintragungsdatum)\n\nGeorg Brunner \"FlyCol\" e.K.\nEinzelkaufmann / Einzelkauffrau\nRudelzhausen\n\nDen Gläubigern der an der Ausgliederung beteiligten Rechtsträger ist, wenn sie binnen sechs Monaten nach dem Tag, an dem die Eintragung der Ausgliederung in das Register des Sitzes desjenigen Rechtsträgers, dessen Gläubiger sie sind, nach §§ 125, 19 Abs. 3 UmwG als bekannt gemacht gilt, ihren Anspruch nach Grund und Höhe in Textform anmelden, Sicherheit zu leisten, soweit sie nicht Befriedigung verlangen können. Dieses Recht steht den Gläubigern jedoch nur zu, wenn sie glaubhaft machen, dass durch die Ausgliederung die Erfüllung ihrer Forderung gefährdet wird."
    },
    {
      "date": "2025-07-02",
      "id": "114201",
      "original_text": "Löschungsankündigung\nBayern Amtsgericht Bayreuth VR 200136\nFMJ 2007 e.V. (Förderverein Musikalischer Jugendarbeit 2007 e.V.) – Untersteinach",
      "type": "Löschungsankündigung",
      "state": "Bayern",
      "amtsgericht": "Amtsgericht Bayreuth",
      "registernummer": "VR 200136",
      "registerart": "VR",
      "company_name": "FMJ 2007 e.V. (Förderverein Musikalischer Jugendarbeit 2007 e.V.)",
      "company_seat": "Untersteinach",
      "details": "02.07.2025 (Bekanntmachungsdatum)\n\nBayern Amtsgericht Bayreuth VR 200136\nLöschungsankündigung\n\nFMJ 2007 e.V. (Förderverein Musikalischer Jugendarbeit 2007 e.V.)\neingetragener Verein\nUntersteinach\n\nDas Registergericht beabsichtigt, den im Vereinsregister eingetragenen Verein von Amts wegen nach § 395 FamFG wegen Wegfalls aller Mitglieder zu löschen. Die Frist zur Erhebung eines Widerspruchs ist auf einen Monat festgesetzt."
    },
    {
      "date": "2025-07-02",
      "id": "114202",
      "original_text": "Registerbekanntmachung nach dem Umwandlungsgesetz\nBayern Amtsgericht Nürnberg HRB 15956\nRockefeller Industries Europe GmbH – Nürnberg",
      "type": "Registerbekanntmachung nach dem Umwandlungsgesetz",
      "state": "Bayern",
      "amtsgericht": "Amtsgericht Nürnberg",
      "registernummer": "HRB 15956",
      "registerart": "HRB",
      "company_name": "Rockefeller Industries Europe GmbH",
      "company_seat": "Nürnberg",
      "details": "02.07.2025 (Bekanntmachungsdatum)\n\nBayern Amtsgericht Nürnberg HRB 15956\nRegisterbekanntmachung nach dem Umwandlungsgesetz 01.07.2025 (Eintragungsdatum)\n\nRockefeller Industries Europe GmbH\nGesellschaft mit beschränkter Haftung\nNürnberg\n\nDen Gläubigern der an der Verschmelzung beteiligten Rechtsträger ist, wenn sie binnen sechs Monaten nach dem Tag, an dem die Eintragung der Verschmelzung in das Register des Sitzes desjenigen Rechtsträgers, dessen Gläubiger sie sind, nach § 19 Abs. 3 UmwG als bekannt gemacht gilt, ihren Anspruch nach Grund und Höhe in Textform anmelden, Sicherheit zu leisten, soweit sie nicht Befriedigung verlangen können. Dieses Recht steht den Gläubigern jedoch nur zu, wenn sie glaubhaft machen, dass durch die Verschmelzung die Erfüllung ihrer Forderung gefährdet wird."
    },
    {
      "date": "2025-07-02",
      "id": "114203",
      "original_text": "Registerbekanntmachung nach dem Umwandlungsgesetz\nBayern Amtsgericht Ingolstadt HRB 5565\nNephrocare Ingolstadt Schrobenhausen GmbH – Ingolstadt",
      "type": "Registerbekanntmachung nach dem Umwandlungsgesetz",
      "state": "Bayern",
      "amtsgericht": "Amtsgericht Ingolstadt",
      "registernummer": "HRB 5565",
      "registerart": "HRB",
      "company_name": "Nephrocare Ingolstadt Schrobenhausen GmbH",
      "company_seat": "Ingolstadt",
      "details": "02.07.2025 (Bekanntmachungsdatum)\n\nBayern Amtsgericht Ingolstadt HRB 5565\nRegisterbekanntmachung nach dem Umwandlungsgesetz 01.07.2025 (Eintragungsdatum)\n\nNephrocare Ingolstadt Schrobenhausen GmbH\nGesellschaft mit beschränkter Haftung\nIngolstadt\n\nDen Gläubigern der an der Verschmelzung beteiligten Rechtsträger ist, wenn sie binnen sechs Monaten nach dem Tag, an dem die Eintragung der Verschmelzung in das Register des Sitzes desjenigen Rechtsträgers, dessen Gläubiger sie sind, nach § 19 Abs. 3 UmwG als bekannt gemacht gilt, ihren Anspruch nach Grund und Höhe in Textform anmelden, Sicherheit zu leisten, soweit sie nicht Befriedigung verlangen können. Dieses Recht steht den Gläubigern jedoch nur zu, wenn sie glaubhaft machen, dass durch die Verschmelzung die Erfüllung ihrer Forderung gefährdet wird."
    },
    {
      "date": "2025-07-02",
      "id": "114204",
      "original_text": "Einreichung neuer Dokumente\nBayern Amtsgericht Nürnberg HRB 18824\nNÜRNBERGER Pensionsfonds Aktiengesellschaft – Nürnberg",
      "type": "Einreichung neuer Dokumente",
      "state": "Bayern",
      "amtsgericht": "Amtsgericht Nürnberg",
      "registernummer": "HRB 18824",
      "registerart": "HRB",
      "company_name": "NÜRNBERGER Pensionsfonds Aktiengesellschaft",
      "company_seat": "Nürnberg",
      "details": "02.07.2025 (Bekanntmachungsdatum)\n\nBayern Amtsgericht Nürnberg HRB 18824\nEinreichung neuer Dokumente 01.07.2025 (Eintragungsdatum)\n\nNÜRNBERGER Pensionsfonds Aktiengesellschaft\nAktiengesellschaft\nNürnberg\n\nDem Amtsgericht Nürnberg -Registergericht- ist eine Liste der Mitglieder des Aufsichtsrats eingereicht worden, § 106 AktG."
    },
    {
      "date": "2025-07-02",
      "id": "114205",
      "original_text": "Registerbekanntmachung nach dem Umwandlungsgesetz\nBayern Amtsgericht München HRB 173784\nTANIAM Verwaltung GmbH – Pullach i. Isartal",
      "type": "Registerbekanntmachung nach dem Umwandlungsgesetz",
      "state": "Bayern",
      "amtsgericht": "Amtsgericht München",
      "registernummer": "HRB 173784",
      "registerart": "HRB",
      "company_name": "TANIAM Verwaltung GmbH",
      "company_seat": "Pullach i. Isartal",
      "details": "02.07.2025 (Bekanntmachungsdatum)\n\nBayern Amtsgericht München HRB 173784\nRegisterbekanntmachung nach dem Umwandlungsgesetz 01.07.2025 (Eintragungsdatum)\n\nTANIAM Verwaltung GmbH\nGesellschaft mit beschränkter Haftung\nPullach i. Isartal\n\nDen Gläubigern der an der Verschmelzung beteiligten Rechtsträger ist, wenn sie binnen sechs Monaten nach dem Tag, an dem die Eintragung der Verschmelzung in das Register des Sitzes desjenigen Rechtsträgers, dessen Gläubiger sie sind, nach § 19 Abs. 3 UmwG als bekannt gemacht gilt, ihren Anspruch nach Grund und Höhe in Textform anmelden, Sicherheit zu leisten, soweit sie nicht Befriedigung verlangen können. Dieses Recht steht den Gläubigern jedoch nur zu, wenn sie glaubhaft machen, dass durch die Verschmelzung die Erfüllung ihrer Forderung gefährdet wird."
    },
    {
      "date": "2025-07-02",
      "id": "114206",
      "original_text": "Registerbekanntmachung nach dem Umwandlungsgesetz\nBayern Amtsgericht München HRB 55579\nElektro Saegmüller GmbH – Starnberg",
      "type": "Registerbekanntmachung nach dem Umwandlungsgesetz",
      "state": "Bayern",
      "amtsgericht": "Amtsgericht München",
      "registernummer": "HRB 55579",
      "registerart": "HRB",
      "company_name": "Elektro Saegmüller GmbH",
      "company_seat": "Starnberg",
      "details": "02.07.2025 (Bekanntmachungsdatum)\n\nBayern Amtsgericht München HRB 55579\nRegisterbekanntmachung nach dem Umwandlungsgesetz 01.07.2025 (Eintragungsdatum)\n\nElektro Saegmüller GmbH\nGesellschaft mit beschränkter Haftung\nStarnberg\n\nDen Gläubigern des formwechselnden Rechtsträgers ist, wenn sie binnen sechs Monaten nach dem Tag, an dem die Eintragung des Formwechsels nach § 201 UmwG als bekannt gemacht gilt, ihren Anspruch nach Grund und Höhe in Textform anmelden, Sicherheit zu leisten, soweit sie nicht Befriedigung verlangen können. Dieses Recht steht den Gläubigern jedoch nur zu, wenn sie glaubhaft machen, dass durch den Formwechsel die Erfüllung ihrer Forderung gefährdet wird."
    },
    {
      "date": "2025-07-02",
      "id": "114207",
      "original_text": "Registerbekanntmachung nach dem Umwandlungsgesetz\nBayern Amtsgericht München HRB 97603\nLife Fitness Europe GmbH – Unterschleißheim",
      "type": "Registerbekanntmachung nach dem Umwandlungsgesetz",
      "state": "Bayern",
      "amtsgericht": "Amtsgericht München",
      "registernummer": "HRB 97603",
      "registerart": "HRB",
      "company_name": "Life Fitness Europe GmbH",
      "company_seat": "Unterschleißheim",
      "details": "02.07.2025 (Bekanntmachungsdatum)\n\nBayern Amtsgericht München HRB 97603\nRegisterbekanntmachung nach dem Umwandlungsgesetz 01.07.2025 (Eintragungsdatum)\n\nLife Fitness Europe GmbH\nGesellschaft mit beschränkter Haftung\nUnterschleißheim\n\nDen Gläubigern der an der Verschmelzung beteiligten Rechtsträger ist, wenn sie binnen sechs Monaten nach dem Tag, an dem die Eintragung der Verschmelzung in das Register des Sitzes desjenigen Rechtsträgers, dessen Gläubiger sie sind, nach § 19 Abs. 3 UmwG als bekannt gemacht gilt, ihren Anspruch nach Grund und Höhe in Textform anmelden, Sicherheit zu leisten, soweit sie nicht Befriedigung verlangen können. Dieses Recht steht den Gläubigern jedoch nur zu, wenn sie glaubhaft machen, dass durch die Verschmelzung die Erfüllung ihrer Forderung gefährdet wird."
    },
    {
      "date": "2025-07-02",
      "id": "114208",
      "original_text": "Registerbekanntmachung nach dem Umwandlungsgesetz\nBayern Amtsgericht Ingolstadt HRB 7740\nByK Bayern Kabel GmbH – Nassenfels",
      "type": "Registerbekanntmachung nach dem Umwandlungsgesetz",
      "state": "Bayern",
      "amtsgericht": "Amtsgericht Ingolstadt",
      "registernummer": "HRB 7740",
      "registerart": "HRB",
      "company_name": "ByK Bayern Kabel GmbH",
      "company_seat": "Nassenfels",
      "details": "02.07.2025 (Bekanntmachungsdatum)\n\nBayern Amtsgericht Ingolstadt HRB 7740\nRegisterbekanntmachung nach dem Umwandlungsgesetz 01.07.2025 (Eintragungsdatum)\n\nByK Bayern Kabel GmbH\nGesellschaft mit beschränkter Haftung\nNassenfels\n\nDen Gläubigern der an der Verschmelzung beteiligten Rechtsträger ist, wenn sie binnen sechs Monaten nach dem Tag, an dem die Eintragung der Verschmelzung in das Register des Sitzes desjenigen Rechtsträgers, dessen Gläubiger sie sind, nach § 19 Abs. 3 UmwG als bekannt gemacht gilt, ihren Anspruch nach Grund und Höhe in Textform anmelden, Sicherheit zu leisten, soweit sie nicht Befriedigung verlangen können. Dieses Recht steht den Gläubigern jedoch nur zu, wenn sie glaubhaft machen, dass durch die Verschmelzung die Erfüllung ihrer Forderung gefährdet wird."
    },
    {
      "date": "2025-07-02",
      "id": "114209",
      "original_text": "Löschungsankündigung\nBayern Amtsgericht München HRB 274271\nmio La Parmigiana GmbH – München",
      "type": "Löschungsankündigung",
      "state": "Bayern",
      "amtsgericht": "Amtsgericht München",
      "registernummer": "HRB 274271",
      "registerart": "HRB",
      "company_name": "mio La Parmigiana GmbH",
      "company_seat": "München",
      "details": "02.07.2025 (Bekanntmachungsdatum)\n\nBayern Amtsgericht München HRB 274271\nLöschungsankündigung\n\nmio La Parmigiana GmbH\nGesellschaft mit beschränkter Haftung\nMünchen\n\nDas Registergericht beabsichtigt, die im Handelsregister eingetragene Gesellschaft wegen Vermögenslosigkeit von Amts wegen nach § 394 FamFG zu löschen. Die Frist zur Erhebung eines Widerspruchs ist auf drei Monate festgesetzt."
    },
    {
      "date": "2025-07-02",
      "id": "114210",
      "original_text": "Registerbekanntmachung nach dem Umwandlungsgesetz\nBayern Amtsgericht Ingolstadt HRB 1268\nKabel Sterner GmbH – Gaimersheim",
      "type": "Registerbekanntmachung nach dem Umwandlungsgesetz",
      "state": "Bayern",
      "amtsgericht": "Amtsgericht Ingolstadt",
      "registernummer": "HRB 1268",
      "registerart": "HRB",
      "company_name": "Kabel Sterner GmbH",
      "company_seat": "Gaimersheim",
      "details": "02.07.2025 (Bekanntmachungsdatum)\n\nBayern Amtsgericht Ingolstadt HRB 1268\nRegisterbekanntmachung nach dem Umwandlungsgesetz 01.07.2025 (Eintragungsdatum)\n\nKabel Sterner GmbH\nGesellschaft mit beschränkter Haftung\nGaimersheim\n\nDen Gläubigern der an der Verschmelzung beteiligten Rechtsträger ist, wenn sie binnen sechs Monaten nach dem Tag, an dem die Eintragung der Verschmelzung in das Register des Sitzes desjenigen Rechtsträgers, dessen Gläubiger sie sind, nach § 19 Abs. 3 UmwG als bekannt gemacht gilt, ihren Anspruch nach Grund und Höhe in Textform anmelden, Sicherheit zu leisten, soweit sie nicht Befriedigung verlangen können. Dieses Recht steht den Gläubigern jedoch nur zu, wenn sie glaubhaft machen, dass durch die Verschmelzung die Erfüllung ihrer Forderung gefährdet wird."
    },
    {
      "date": "2025-07-02",
      "id": "114211",
      "original_text": "Registerbekanntmachung nach dem Umwandlungsgesetz\nBayern Amtsgericht Ingolstadt HRB 6383\nNephrocare Ingolstadt GmbH – Ingolstadt",
      "type": "Registerbekanntmachung nach dem Umwandlungsgesetz",
      "state": "Bayern",
      "amtsgericht": "Amtsgericht Ingolstadt",
      "registernummer": "HRB 6383",
      "registerart": "HRB",
      "company_name": "Nephrocare Ingolstadt GmbH",
      "company_seat": "Ingolstadt",
      "details": "02.07.2025 (Bekanntmachungsdatum)\n\nBayern Amtsgericht Ingolstadt HRB 6383\nRegisterbekanntmachung nach dem Umwandlungsgesetz 01.07.2025 (Eintragungsdatum)\n\nNephrocare Ingolstadt GmbH\nGesellschaft mit beschränkter Haftung\nIngolstadt\n\nDen Gläubigern der an der Verschmelzung beteiligten Rechtsträger ist, wenn sie binnen sechs Monaten nach dem Tag, an dem die Eintragung der Verschmelzung in das Register des Sitzes desjenigen Rechtsträgers, dessen Gläubiger sie sind, nach § 19 Abs. 3 UmwG als bekannt gemacht gilt, ihren Anspruch nach Grund und Höhe in Textform anmelden, Sicherheit zu leisten, soweit sie nicht Befriedigung verlangen können. Dieses Recht steht den Gläubigern jedoch nur zu, wenn sie glaubhaft machen, dass durch die Verschmelzung die Erfüllung ihrer Forderung gefährdet wird."
    },
    {
      "date": "2025-07-02",
      "id": "114212",
      "original_text": "Registerbekanntmachung nach dem Umwandlungsgesetz\nBayern Amtsgericht Ingolstadt HRB 7879\nNephrocare Schrobenhausen GmbH – Schrobenhausen",
      "type": "Registerbekanntmachung nach dem Umwandlungsgesetz",
      "state": "Bayern",
      "amtsgericht": "Amtsgericht Ingolstadt",
      "registernummer": "HRB 7879",
      "registerart": "HRB",
      "company_name": "Nephrocare Schrobenhausen GmbH",
      "company_seat": "Schrobenhausen",
      "details": "02.07.2025 (Bekanntmachungsdatum)\n\nBayern Amtsgericht Ingolstadt HRB 7879\nRegisterbekanntmachung nach dem Umwandlungsgesetz 01.07.2025 (Eintragungsdatum)\n\nNephrocare Schrobenhausen GmbH\nGesellschaft mit beschränkter Haftung\nSchrobenhausen\n\nDen Gläubigern der an der Verschmelzung beteiligten Rechtsträger ist, wenn sie binnen sechs Monaten nach dem Tag, an dem die Eintragung der Verschmelzung in das Register des Sitzes desjenigen Rechtsträgers, dessen Gläubiger sie sind, nach § 19 Abs. 3 UmwG als bekannt gemacht gilt, ihren Anspruch nach Grund und Höhe in Textform anmelden, Sicherheit zu leisten, soweit sie nicht Befriedigung verlangen können. Dieses Recht steht den Gläubigern jedoch nur zu, wenn sie glaubhaft machen, dass durch die Verschmelzung die Erfüllung ihrer Forderung gefährdet wird."
    },
    {
      "date": "2025-07-02",
      "id": "114213",
      "original_text": "Registerbekanntmachung nach dem Umwandlungsgesetz\nBayern Amtsgericht Nürnberg HRB 36492\nSopra Financial Technology GmbH – Nürnberg",
      "type": "Registerbekanntmachung nach dem Umwandlungsgesetz",
      "state": "Bayern",
      "amtsgericht": "Amtsgericht Nürnberg",
      "registernummer": "HRB 36492",
      "registerart": "HRB",
      "company_name": "Sopra Financial Technology GmbH",
      "company_seat": "Nürnberg",
      "details": "02.07.2025 (Bekanntmachungsdatum)\n\nBayern Amtsgericht Nürnberg HRB 36492\nRegisterbekanntmachung nach dem Umwandlungsgesetz 01.07.2025 (Eintragungsdatum)\n\nSopra Financial Technology GmbH\nGesellschaft mit beschränkter Haftung\nNürnberg\n\nDen Gläubigern der an der Verschmelzung beteiligten Rechtsträger ist, wenn sie binnen sechs Monaten nach dem Tag, an dem die Eintragung der Verschmelzung in das Register des Sitzes desjenigen Rechtsträgers, dessen Gläubiger sie sind, nach § 19 Abs. 3 UmwG als bekannt gemacht gilt, ihren Anspruch nach Grund und Höhe in Textform anmelden, Sicherheit zu leisten, soweit sie nicht Befriedigung verlangen können. Dieses Recht steht den Gläubigern jedoch nur zu, wenn sie glaubhaft machen, dass durch die Verschmelzung die Erfüllung ihrer Forderung gefährdet wird."
    },
    {
      "date": "2025-07-02",
      "id": "114214",
      "original_text": "Registerbekanntmachung nach dem Umwandlungsgesetz\nBayern Amtsgericht Bayreuth VR 200834\nDartverband Nordostbayern e. V. – Bayreuth",
      "type": "Registerbekanntmachung nach dem Umwandlungsgesetz",
      "state": "Bayern",
      "amtsgericht": "Amtsgericht Bayreuth",
      "registernummer": "VR 200834",
      "registerart": "VR",
      "company_name": "Dartverband Nordostbayern e. V.",
      "company_seat": "Bayreuth",
      "details": "02.07.2025 (Bekanntmachungsdatum)\n\nBayern Amtsgericht Bayreuth VR 200834\nRegisterbekanntmachung nach dem Umwandlungsgesetz 01.07.2025 (Eintragungsdatum)\n\nDartverband Nordostbayern e. V.\neingetragener Verein\nBayreuth\n\nDen Gläubigern der an der Verschmelzung beteiligten Rechtsträger ist, wenn sie binnen sechs Monaten nach dem Tag, an dem die Eintragung der Verschmelzung in das Register des Sitzes desjenigen Rechtsträgers, dessen Gläubiger sie sind, nach § 19 Abs. 3 UmwG als bekannt gemacht gilt, ihren Anspruch nach Grund und Höhe in Textform anmelden, Sicherheit zu leisten, soweit sie nicht Befriedigung verlangen können. Dieses Recht steht den Gläubigern jedoch nur zu, wenn sie glaubhaft machen, dass durch die Verschmelzung die Erfüllung ihrer Forderung gefährdet wird."
    },
    {
      "date": "2025-07-02",
      "id": "114215",
      "original_text": "Registerbekanntmachung nach dem Umwandlungsgesetz\nBayern Amtsgericht München HRB 267938\nVortex Europe GmbH – München",
      "type": "Registerbekanntmachung nach dem Umwandlungsgesetz",
      "state": "Bayern",
      "amtsgericht": "Amtsgericht München",
      "registernummer": "HRB 267938",
      "registerart": "HRB",
      "company_name": "Vortex Europe GmbH",
      "company_seat": "München",
      "details": "02.07.2025 (Bekanntmachungsdatum)\n\nBayern Amtsgericht München HRB 267938\nRegisterbekanntmachung nach dem Umwandlungsgesetz 01.07.2025 (Eintragungsdatum)\n\nVortex Europe GmbH\nGesellschaft mit beschränkter Haftung\nMünchen\n\nDen Gläubigern der an der Verschmelzung beteiligten Rechtsträger ist, wenn sie binnen sechs Monaten nach dem Tag, an dem die Eintragung der Verschmelzung in das Register des Sitzes desjenigen Rechtsträgers, dessen Gläubiger sie sind, nach § 19 Abs. 3 UmwG als bekannt gemacht gilt, ihren Anspruch nach Grund und Höhe in Textform anmelden, Sicherheit zu leisten, soweit sie nicht Befriedigung verlangen können. Dieses Recht steht den Gläubigern jedoch nur zu, wenn sie glaubhaft machen, dass durch die Verschmelzung die Erfüllung ihrer Forderung gefährdet wird."
    },
    {
      "date": "2025-07-02",
      "id": "114216",
      "original_text": "Registerbekanntmachung nach dem Umwandlungsgesetz\nBayern Amtsgericht München HRB 235116\nSPIE Digital Services GmbH – München",
      "type": "Registerbekanntmachung nach dem Umwandlungsgesetz",
      "state": "Bayern",
      "amtsgericht": "Amtsgericht München",
      "registernummer": "HRB 235116",
      "registerart": "HRB",
      "company_name": "SPIE Digital Services GmbH",
      "company_seat": "München",
      "details": "02.07.2025 (Bekanntmachungsdatum)\n\nBayern Amtsgericht München HRB 235116\nRegisterbekanntmachung nach dem Umwandlungsgesetz 01.07.2025 (Eintragungsdatum)\n\nSPIE Digital Services GmbH\nGesellschaft mit beschränkter Haftung\nMünchen\n\nDen Gläubigern der an der Verschmelzung beteiligten Rechtsträger ist, wenn sie binnen sechs Monaten nach dem Tag, an dem die Eintragung der Verschmelzung in das Register des Sitzes desjenigen Rechtsträgers, dessen Gläubiger sie sind, nach § 19 Abs. 3 UmwG als bekannt gemacht gilt, ihren Anspruch nach Grund und Höhe in Textform anmelden, Sicherheit zu leisten, soweit sie nicht Befriedigung verlangen können. Dieses Recht steht den Gläubigern jedoch nur zu, wenn sie glaubhaft machen, dass durch die Verschmelzung die Erfüllung ihrer Forderung gefährdet wird."
    },
    {
      "date": "2025-07-02",
      "id": "114217",
      "original_text": "Registerbekanntmachung nach dem Umwandlungsgesetz\nBayern Amtsgericht München HRB 142283\nLEANDA Beteiligungs GmbH – Pullach i. Isartal",
      "type": "Registerbekanntmachung nach dem Umwandlungsgesetz",
      "state": "Bayern",
      "amtsgericht": "Amtsgericht München",
      "registernummer": "HRB 142283",
      "registerart": "HRB",
      "company_name": "LEANDA Beteiligungs GmbH",
      "company_seat": "Pullach i. Isartal",
      "details": "02.07.2025 (Bekanntmachungsdatum)\n\nBayern Amtsgericht München HRB 142283\nRegisterbekanntmachung nach dem Umwandlungsgesetz 01.07.2025 (Eintragungsdatum)\n\nLEANDA Beteiligungs GmbH\nGesellschaft mit beschränkter Haftung\nPullach i. Isartal\n\nDen Gläubigern der an der Verschmelzung beteiligten Rechtsträger ist, wenn sie binnen sechs Monaten nach dem Tag, an dem die Eintragung der Verschmelzung in das Register des Sitzes desjenigen Rechtsträgers, dessen Gläubiger sie sind, nach § 19 Abs. 3 UmwG als bekannt gemacht gilt, ihren Anspruch nach Grund und Höhe in Textform anmelden, Sicherheit zu leisten, soweit sie nicht Befriedigung verlangen können. Dieses Recht steht den Gläubigern jedoch nur zu, wenn sie glaubhaft machen, dass durch die Verschmelzung die Erfüllung ihrer Forderung gefährdet wird."
    },
    {
      "date": "2025-07-02",
      "id": "114218",
      "original_text": "Löschungsankündigung\nBayern Amtsgericht Ansbach HRB 7005\nVAV Management GmbH – Dinkelsbühl",
      "type": "Löschungsankündigung",
      "state": "Bayern",
      "amtsgericht": "Amtsgericht Ansbach",
      "registernummer": "HRB 7005",
      "registerart": "HRB",
      "company_name": "VAV Management GmbH",
      "company_seat": "Dinkelsbühl",
      "details": "02.07.2025 (Bekanntmachungsdatum)\n\nBayern Amtsgericht Ansbach HRB 7005\nLöschungsankündigung\n\nVAV Management GmbH\nGesellschaft mit beschränkter Haftung\nDinkelsbühl\n\nDas Registergericht beabsichtigt, die im Handelsregister eingetragene Gesellschaft wegen Vermögenslosigkeit von Amts wegen nach § 394 FamFG zu löschen. Die Frist zur Erhebung eines Widerspruchs ist auf sechs Wochen festgesetzt."
    },
    {
      "date": "2025-07-02",
      "id": "114219",
      "original_text": "Löschungsankündigung\nBayern Amtsgericht München HRB 240626\nBakhtiyar GmbH – München",
      "type": "Löschungsankündigung",
      "state": "Bayern",
      "amtsgericht": "Amtsgericht München",
      "registernummer": "HRB 240626",
      "registerart": "HRB",
      "company_name": "Bakhtiyar GmbH",
      "company_seat": "München",
      "details": "02.07.2025 (Bekanntmachungsdatum)\n\nBayern Amtsgericht München HRB 240626\nLöschungsankündigung\n\nBakhtiyar GmbH\nGesellschaft mit beschränkter Haftung\nMünchen\n\nDas Registergericht beabsichtigt, die im Handelsregister eingetragene Gesellschaft wegen Vermögenslosigkeit von Amts wegen nach § 394 FamFG zu löschen. Die Frist zur Erhebung eines Widerspruchs ist auf drei Monate festgesetzt."
    },
    {
      "date": "2025-07-02",
      "id": "114220",
      "original_text": "Registerbekanntmachung nach dem Umwandlungsgesetz\nBayern Amtsgericht München HRB 241007\nSeniorenheim an der Paar GmbH – München",
      "type": "Registerbekanntmachung nach dem Umwandlungsgesetz",
      "state": "Bayern",
      "amtsgericht": "Amtsgericht München",
      "registernummer": "HRB 241007",
      "registerart": "HRB",
      "company_name": "Seniorenheim an der Paar GmbH",
      "company_seat": "München",
      "details": "02.07.2025 (Bekanntmachungsdatum)\n\nBayern Amtsgericht München HRB 241007\nRegisterbekanntmachung nach dem Umwandlungsgesetz 01.07.2025 (Eintragungsdatum)\n\nSeniorenheim an der Paar GmbH\nGesellschaft mit beschränkter Haftung\nMünchen\n\nDen Gläubigern der an der Verschmelzung beteiligten Rechtsträger ist, wenn sie binnen sechs Monaten nach dem Tag, an dem die Eintragung der Verschmelzung in das Register des Sitzes desjenigen Rechtsträgers, dessen Gläubiger sie sind, nach § 19 Abs. 3 UmwG als bekannt gemacht gilt, ihren Anspruch nach Grund und Höhe in Textform anmelden, Sicherheit zu leisten, soweit sie nicht Befriedigung verlangen können. Dieses Recht steht den Gläubigern jedoch nur zu, wenn sie glaubhaft machen, dass durch die Verschmelzung die Erfüllung ihrer Forderung gefährdet wird."
    },
    {
      "date": "2025-07-02",
      "id": "114221",
      "original_text": "Registerbekanntmachung nach dem Umwandlungsgesetz\nBayern Amtsgericht Ingolstadt HRB 101738\nBAUER Maschinen GmbH – Schrobenhausen",
      "type": "Registerbekanntmachung nach dem Umwandlungsgesetz",
      "state": "Bayern",
      "amtsgericht": "Amtsgericht Ingolstadt",
      "registernummer": "HRB 101738",
      "registerart": "HRB",
      "company_name": "BAUER Maschinen GmbH",
      "company_seat": "Schrobenhausen",
      "details": "02.07.2025 (Bekanntmachungsdatum)\n\nBayern Amtsgericht Ingolstadt HRB 101738\nRegisterbekanntmachung nach dem Umwandlungsgesetz 01.07.2025 (Eintragungsdatum)\n\nBAUER Maschinen GmbH\nGesellschaft mit beschränkter Haftung\nSchrobenhausen\n\nDen Gläubigern der an der Verschmelzung beteiligten Rechtsträger ist, wenn sie binnen sechs Monaten nach dem Tag, an dem die Eintragung der Verschmelzung in das Register des Sitzes desjenigen Rechtsträgers, dessen Gläubiger sie sind, nach § 19 Abs. 3 UmwG als bekannt gemacht gilt, ihren Anspruch nach Grund und Höhe in Textform anmelden, Sicherheit zu leisten, soweit sie nicht Befriedigung verlangen können. Dieses Recht steht den Gläubigern jedoch nur zu, wenn sie glaubhaft machen, dass durch die Verschmelzung die Erfüllung ihrer Forderung gefährdet wird."
    },
    {
      "date": "2025-07-02",
      "id": "114222",
      "original_text": "Registerbekanntmachung nach dem Umwandlungsgesetz\nBayern Amtsgericht Regensburg VR 40192\n1. Spielgemeinschaft Regental eingetragener Verein – Walderbach",
      "type": "Registerbekanntmachung nach dem Umwandlungsgesetz",
      "state": "Bayern",
      "amtsgericht": "Amtsgericht Regensburg",
      "registernummer": "VR 40192",
      "registerart": "VR",
      "company_name": "1. Spielgemeinschaft Regental eingetragener Verein",
      "company_seat": "Walderbach",
      "details": "02.07.2025 (Bekanntmachungsdatum)\n\nBayern Amtsgericht Regensburg VR 40192\nRegisterbekanntmachung nach dem Umwandlungsgesetz 01.07.2025 (Eintragungsdatum)\n\n1. Spielgemeinschaft Regental eingetragener Verein\neingetragener Verein\nWalderbach\n\nDen Gläubigern der an der Verschmelzung beteiligten Rechtsträger ist, wenn sie binnen sechs Monaten nach dem Tag, an dem die Eintragung der Verschmelzung in das Register des Sitzes desjenigen Rechtsträgers, dessen Gläubiger sie sind, nach § 19 Abs. 3 UmwG als bekannt gemacht gilt, ihren Anspruch nach Grund und Höhe in Textform anmelden, Sicherheit zu leisten, soweit sie nicht Befriedigung verlangen können. Dieses Recht steht den Gläubigern jedoch nur zu, wenn sie glaubhaft machen, dass durch die Verschmelzung die Erfüllung ihrer Forderung gefährdet wird."
    },
    {
      "date": "2025-07-02",
      "id": "114223",
      "original_text": "Einreichung neuer Dokumente\nBayern Amtsgericht München HRB 3487\nBaugesellschaft München-Land GmbH – Haar",
      "type": "Einreichung neuer Dokumente",
      "state": "Bayern",
      "amtsgericht": "Amtsgericht München",
      "registernummer": "HRB 3487",
      "registerart": "HRB",
      "company_name": "Baugesellschaft München-Land GmbH",
      "company_seat": "Haar",
      "details": "02.07.2025 (Bekanntmachungsdatum)\n\nBayern Amtsgericht München HRB 3487\nEinreichung neuer Dokumente\n\nBaugesellschaft München-Land GmbH\nGesellschaft mit beschränkter Haftung\nHaar\n\nDem Amtsgericht München -Registergericht- ist eine Liste der Mitglieder des Aufsichtsrats eingereicht worden, § 52 Abs. 3 S. 2 GmbHG."
    },
    {
      "date": "2025-07-02",
      "id": "114224",
      "original_text": "Registerbekanntmachung nach dem Umwandlungsgesetz\nBayern Amtsgericht Ingolstadt HRB 101449\nRTG Rammtechnik GmbH – Schrobenhausen",
      "type": "Registerbekanntmachung nach dem Umwandlungsgesetz",
      "state": "Bayern",
      "amtsgericht": "Amtsgericht Ingolstadt",
      "registernummer": "HRB 101449",
      "registerart": "HRB",
      "company_name": "RTG Rammtechnik GmbH",
      "company_seat": "Schrobenhausen",
      "details": "02.07.2025 (Bekanntmachungsdatum)\n\nBayern Amtsgericht Ingolstadt HRB 101449\nRegisterbekanntmachung nach dem Umwandlungsgesetz 01.07.2025 (Eintragungsdatum)\n\nRTG Rammtechnik GmbH\nGesellschaft mit beschränkter Haftung\nSchrobenhausen\n\nDen Gläubigern der an der Verschmelzung beteiligten Rechtsträger ist, wenn sie binnen sechs Monaten nach dem Tag, an dem die Eintragung der Verschmelzung in das Register des Sitzes desjenigen Rechtsträgers, dessen Gläubiger sie sind, nach § 19 Abs. 3 UmwG als bekannt gemacht gilt, ihren Anspruch nach Grund und Höhe in Textform anmelden, Sicherheit zu leisten, soweit sie nicht Befriedigung verlangen können. Dieses Recht steht den Gläubigern jedoch nur zu, wenn sie glaubhaft machen, dass durch die Verschmelzung die Erfüllung ihrer Forderung gefährdet wird."
    },
    {
      "date": "2025-07-02",
      "id": "114225",
      "original_text": "Registerbekanntmachung nach dem Umwandlungsgesetz\nBayern Amtsgericht Nürnberg HRB 40878\nJoh. Leupold GmbH – Schwabach",
      "type": "Registerbekanntmachung nach dem Umwandlungsgesetz",
      "state": "Bayern",
      "amtsgericht": "Amtsgericht Nürnberg",
      "registernummer": "HRB 40878",
      "registerart": "HRB",
      "company_name": "Joh. Leupold GmbH",
      "company_seat": "Schwabach",
      "details": "02.07.2025 (Bekanntmachungsdatum)\n\nBayern Amtsgericht Nürnberg HRB 40878\nRegisterbekanntmachung nach dem Umwandlungsgesetz 01.07.2025 (Eintragungsdatum)\n\nJoh. Leupold GmbH\nGesellschaft mit beschränkter Haftung\nSchwabach\n\nDen Gläubigern der an der Verschmelzung beteiligten Rechtsträger ist, wenn sie binnen sechs Monaten nach dem Tag, an dem die Eintragung der Verschmelzung in das Register des Sitzes desjenigen Rechtsträgers, dessen Gläubiger sie sind, nach § 19 Abs. 3 UmwG als bekannt gemacht gilt, ihren Anspruch nach Grund und Höhe in Textform anmelden, Sicherheit zu leisten, soweit sie nicht Befriedigung verlangen können. Dieses Recht steht den Gläubigern jedoch nur zu, wenn sie glaubhaft machen, dass durch die Verschmelzung die Erfüllung ihrer Forderung gefährdet wird."
    },
    {
      "date": "2025-07-02",
      "id": "114226",
      "original_text": "Registerbekanntmachung nach dem Umwandlungsgesetz\nBayern Amtsgericht Nürnberg HRA 3926\nJoh. Leupold GmbH & Co. KG – Schwabach",
      "type": "Registerbekanntmachung nach dem Umwandlungsgesetz",
      "state": "Bayern",
      "amtsgericht": "Amtsgericht Nürnberg",
      "registernummer": "HRA 3926",
      "registerart": "HRA",
      "company_name": "Joh. Leupold GmbH & Co. KG",
      "company_seat": "Schwabach",
      "details": "02.07.2025 (Bekanntmachungsdatum)\n\nBayern Amtsgericht Nürnberg HRA 3926\nRegisterbekanntmachung nach dem Umwandlungsgesetz 01.07.2025 (Eintragungsdatum)\n\nJoh. Leupold GmbH & Co. KG\nKommanditgesellschaft\nSchwabach\n\nDen Gläubigern der an der Verschmelzung beteiligten Rechtsträger ist, wenn sie binnen sechs Monaten nach dem Tag, an dem die Eintragung der Verschmelzung in das Register des Sitzes desjenigen Rechtsträgers, dessen Gläubiger sie sind, nach § 19 Abs. 3 UmwG als bekannt gemacht gilt, ihren Anspruch nach Grund und Höhe in Textform anmelden, Sicherheit zu leisten, soweit sie nicht Befriedigung verlangen können. Dieses Recht steht den Gläubigern jedoch nur zu, wenn sie glaubhaft machen, dass durch die Verschmelzung die Erfüllung ihrer Forderung gefährdet wird."
    },
    {
      "date": "2025-07-02",
      "id": "114227",
      "original_text": "Registerbekanntmachung nach dem Umwandlungsgesetz\nBayern Amtsgericht Augsburg HRB 28092\nZÜBLIN Timber GmbH – Aichach",
      "type": "Registerbekanntmachung nach dem Umwandlungsgesetz",
      "state": "Bayern",
      "amtsgericht": "Amtsgericht Augsburg",
      "registernummer": "HRB 28092",
      "registerart": "HRB",
      "company_name": "ZÜBLIN Timber GmbH",
      "company_seat": "Aichach",
      "details": "02.07.2025 (Bekanntmachungsdatum)\n\nBayern Amtsgericht Augsburg HRB 28092\nRegisterbekanntmachung nach dem Umwandlungsgesetz 01.07.2025 (Eintragungsdatum)\n\nZÜBLIN Timber GmbH\nGesellschaft mit beschränkter Haftung\nAichach\n\nDen Gläubigern der an der Verschmelzung beteiligten Rechtsträger ist, wenn sie binnen sechs Monaten nach dem Tag, an dem die Eintragung der Verschmelzung in das Register des Sitzes desjenigen Rechtsträgers, dessen Gläubiger sie sind, nach § 19 Abs. 3 UmwG als bekannt gemacht gilt, ihren Anspruch nach Grund und Höhe in Textform anmelden, Sicherheit zu leisten, soweit sie nicht Befriedigung verlangen können. Dieses Recht steht den Gläubigern jedoch nur zu, wenn sie glaubhaft machen, dass durch die Verschmelzung die Erfüllung ihrer Forderung gefährdet wird."
    },
    {
      "date": "2025-07-02",
      "id": "114228",
      "original_text": "Registerbekanntmachung nach dem Umwandlungsgesetz\nBayern Amtsgericht München HRB 223300\nCape Analytics GmbH – München",
      "type": "Registerbekanntmachung nach dem Umwandlungsgesetz",
      "state": "Bayern",
      "amtsgericht": "Amtsgericht München",
      "registernummer": "HRB 223300",
      "registerart": "HRB",
      "company_name": "Cape Analytics GmbH",
      "company_seat": "München",
      "details": "02.07.2025 (Bekanntmachungsdatum)\n\nBayern Amtsgericht München HRB 223300\nRegisterbekanntmachung nach dem Umwandlungsgesetz 01.07.2025 (Eintragungsdatum)\n\nCape Analytics GmbH\nGesellschaft mit beschränkter Haftung\nMünchen\n\nDen Gläubigern der an der Verschmelzung beteiligten Rechtsträger ist, wenn sie binnen sechs Monaten nach dem Tag, an dem die Eintragung der Verschmelzung in das Register des Sitzes desjenigen Rechtsträgers, dessen Gläubiger sie sind, nach § 19 Abs. 3 UmwG als bekannt gemacht gilt, ihren Anspruch nach Grund und Höhe in Textform anmelden, Sicherheit zu leisten, soweit sie nicht Befriedigung verlangen können. Dieses Recht steht den Gläubigern jedoch nur zu, wenn sie glaubhaft machen, dass durch die Verschmelzung die Erfüllung ihrer Forderung gefährdet wird."
    },
    {
      "date": "2025-07-02",
      "id": "114229",
      "original_text": "Einreichung neuer Dokumente\nBayern Amtsgericht München HRB 140509\nGAF AG – München",
      "type": "Einreichung neuer Dokumente",
      "state": "Bayern",
      "amtsgericht": "Amtsgericht München",
      "registernummer": "HRB 140509",
      "registerart": "HRB",
      "company_name": "GAF AG",
      "company_seat": "München",
      "details": "02.07.2025 (Bekanntmachungsdatum)\n\nBayern Amtsgericht München HRB 140509\nEinreichung neuer Dokumente 01.07.2025 (Eintragungsdatum)\n\nGAF AG\nAktiengesellschaft\nMünchen\n\nDem Amtsgericht München -Registergericht- ist eine Liste der Mitglieder des Aufsichtsrats eingereicht worden, § 106 AktG."
    },
    {
      "date": "2025-07-02",
      "id": "114230",
      "original_text": "Registerbekanntmachung nach dem Umwandlungsgesetz\nBayern Amtsgericht Regensburg VR 40122\nSportverein Kirchenrohrbach eingetragener Verein – Kirchenrohrbach, Gemeinde Walderbach",
      "type": "Registerbekanntmachung nach dem Umwandlungsgesetz",
      "state": "Bayern",
      "amtsgericht": "Amtsgericht Regensburg",
      "registernummer": "VR 40122",
      "registerart": "VR",
      "company_name": "Sportverein Kirchenrohrbach eingetragener Verein",
      "company_seat": "Kirchenrohrbach, Gemeinde Walderbach",
      "details": "02.07.2025 (Bekanntmachungsdatum)\n\nBayern Amtsgericht Regensburg VR 40122\nRegisterbekanntmachung nach dem Umwandlungsgesetz 01.07.2025 (Eintragungsdatum)\n\nSportverein Kirchenrohrbach eingetragener Verein\neingetragener Verein\nKirchenrohrbach, Gemeinde Walderbach\n\nDen Gläubigern der an der Verschmelzung beteiligten Rechtsträger ist, wenn sie binnen sechs Monaten nach dem Tag, an dem die Eintragung der Verschmelzung in das Register des Sitzes desjenigen Rechtsträgers, dessen Gläubiger sie sind, nach § 19 Abs. 3 UmwG als bekannt gemacht gilt, ihren Anspruch nach Grund und Höhe in Textform anmelden, Sicherheit zu leisten, soweit sie nicht Befriedigung verlangen können. Dieses Recht steht den Gläubigern jedoch nur zu, wenn sie glaubhaft machen, dass durch die Verschmelzung die Erfüllung ihrer Forderung gefährdet wird."
    },
    {
      "date": "2025-07-02",
      "id": "114231",
      "original_text": "Registerbekanntmachung nach dem Umwandlungsgesetz\nBayern Amtsgericht München HRA 72582\nRespironics Deutschland GmbH & Co. KG – München",
      "type": "Registerbekanntmachung nach dem Umwandlungsgesetz",
      "state": "Bayern",
      "amtsgericht": "Amtsgericht München",
      "registernummer": "HRA 72582",
      "registerart": "HRA",
      "company_name": "Respironics Deutschland GmbH & Co. KG",
      "company_seat": "München",
      "details": "02.07.2025 (Bekanntmachungsdatum)\n\nBayern Amtsgericht München HRA 72582\nRegisterbekanntmachung nach dem Umwandlungsgesetz 01.07.2025 (Eintragungsdatum)\n\nRespironics Deutschland GmbH & Co. KG\nKommanditgesellschaft\nMünchen\n\nDen Gläubigern der an der Verschmelzung beteiligten Rechtsträger ist, wenn sie binnen sechs Monaten nach dem Tag, an dem die Eintragung der Verschmelzung in das Register des Sitzes desjenigen Rechtsträgers, dessen Gläubiger sie sind, nach § 19 Abs. 3 UmwG als bekannt gemacht gilt, ihren Anspruch nach Grund und Höhe in Textform anmelden, Sicherheit zu leisten, soweit sie nicht Befriedigung verlangen können. Dieses Recht steht den Gläubigern jedoch nur zu, wenn sie glaubhaft machen, dass durch die Verschmelzung die Erfüllung ihrer Forderung gefährdet wird."
    },
    {
      "date": "2025-07-02",
      "id": "114232",
      "original_text": "Einreichung neuer Dokumente\nBaden-Württemberg Amtsgericht Stuttgart HRB 755869\nTELENORMA AG – Albstadt",
      "type": "Einreichung neuer Dokumente",
      "state": "Baden-Württemberg",
      "amtsgericht": "Amtsgericht Stuttgart",
      "registernummer": "HRB 755869",
      "registerart": "HRB",
      "company_name": "TELENORMA AG",
      "company_seat": "Albstadt",
      "details": "02.07.2025 (Bekanntmachungsdatum)\n\nBaden-Württemberg Amtsgericht Stuttgart HRB 755869\nEinreichung neuer Dokumente\n\nTELENORMA AG\nAktiengesellschaft\nAlbstadt\n\nDie Gesellschaft hat am 28.06.2025 die Liste über die Zusammensetzung des Aufsichtsrats zum Handelsregister eingereicht."
    },
    {
      "date": "2025-07-02",
      "id": "114233",
      "original_text": "Einreichung neuer Dokumente\nBaden-Württemberg Amtsgericht Stuttgart HRB 280684\nStadtbau GmbH Schorndorf – Schorndorf",
      "type": "Einreichung neuer Dokumente",
      "state": "Baden-Württemberg",
      "amtsgericht": "Amtsgericht Stuttgart",
      "registernummer": "HRB 280684",
      "registerart": "HRB",
      "company_name": "Stadtbau GmbH Schorndorf",
      "company_seat": "Schorndorf",
      "details": "02.07.2025 (Bekanntmachungsdatum)\n\nBaden-Württemberg Amtsgericht Stuttgart HRB 280684\nEinreichung neuer Dokumente\n\nStadtbau GmbH Schorndorf\nGesellschaft mit beschränkter Haftung\nSchorndorf\n\nDie Gesellschaft hat am 01.07.2025 die Liste über die Zusammensetzung des Aufsichtsrats zum Handelsregister eingereicht."
    },
    {
      "date": "2025-07-02",
      "id": "114234",
      "original_text": "Löschungsankündigung\nBerlin Amtsgericht Berlin (Charlottenburg) HRB 239368\nGlovel UG (haftungsbeschränkt) – Berlin",
      "type": "Löschungsankündigung",
      "state": "Berlin",
      "amtsgericht": "Amtsgericht Berlin (Charlottenburg)",
      "registernummer": "HRB 239368",
      "registerart": "HRB",
      "company_name": "Glovel UG (haftungsbeschränkt)",
      "company_seat": "Berlin",
      "details": "02.07.2025 (Bekanntmachungsdatum)\n\nBerlin Amtsgericht Berlin (Charlottenburg) HRB 239368\nLöschungsankündigung\n\nGlovel UG (haftungsbeschränkt)\nGesellschaft mit beschränkter Haftung\nBerlin\n\nBei der nachstehenden Gesellschaft wird das Amtslöschungsverfahren gemäß § 394 FamFG eingeleitet. Widerspruchsfrist 6 Wochen"
    },
    {
      "date": "2025-07-02",
      "id": "114235",
      "original_text": "Registerbekanntmachung nach dem Umwandlungsgesetz\nHamburg Amtsgericht Hamburg HRB 11788\nBerendsohn Aktiengesellschaft – Hamburg",
      "type": "Registerbekanntmachung nach dem Umwandlungsgesetz",
      "state": "Hamburg",
      "amtsgericht": "Amtsgericht Hamburg",
      "registernummer": "HRB 11788",
      "registerart": "HRB",
      "company_name": "Berendsohn Aktiengesellschaft",
      "company_seat": "Hamburg",
      "details": "02.07.2025 (Bekanntmachungsdatum)\n\nHamburg Amtsgericht Hamburg HRB 11788\nRegisterbekanntmachung nach dem Umwandlungsgesetz 02.07.2025 (Eintragungsdatum)\n\nBerendsohn Aktiengesellschaft\nAktiengesellschaft\nHamburg\n\nBerichtigung zur Bekanntmachung vom 18.06.2025:\n\nDie Gesellschaft hat als übernehmender Rechtsträger gemäß § 61 Satz 1 UmwG die Verschmelzungsverträge mit folgenden Gesellschaften als übertragende Rechtsträger zum Handelsregister eingereicht:\na) HAA Hanseatische Außendienst Akademie GmbH mit Sitz in Hamburg (Amtsgericht Hamburg, HRB 38679);\nb) Euro-Gesellschaft für Verkaufsförderung mit beschränkter Haftung mit Sitz in Hamburg (Amtsgericht Hamburg, HRB 67849);\nc) Kleine & Jockers GmbH mit Sitz in Hamburg (Amtsgericht Hamburg, HRB 108936)."
    },
    {
      "date": "2025-07-02",
      "id": "114236",
      "original_text": "Registerbekanntmachung nach dem Umwandlungsgesetz\nSchleswig-Holstein Amtsgericht Lübeck HRB 13862\nReidel Vermögensverwaltungsgesellschaft mbH – Wentorf",
      "type": "Registerbekanntmachung nach dem Umwandlungsgesetz",
      "state": "Schleswig-Holstein",
      "amtsgericht": "Amtsgericht Lübeck",
      "registernummer": "HRB 13862",
      "registerart": "HRB",
      "company_name": "Reidel Vermögensverwaltungsgesellschaft mbH",
      "company_seat": "Wentorf",
      "details": "02.07.2025 (Bekanntmachungsdatum)\n\nSchleswig-Holstein Amtsgericht Lübeck HRB 13862\nRegisterbekanntmachung nach dem Umwandlungsgesetz 01.07.2025 (Eintragungsdatum)\n\nReidel Vermögensverwaltungsgesellschaft mbH\nGesellschaft mit beschränkter Haftung\nWentorf\n\nZu Eintragungsnummer 10 vom 01.07.2025 wird als nicht eingetragen veröffentlicht:  Als nicht eingetragen wird veröffentlicht: Den Gläubigern der an der Verschmelzung beteiligten Rechtsträger ist, wenn sie binnen sechs Monaten nach dem Tag, an dem die Eintragung der Verschmelzung in das Register des Sitzes desjenigen Rechtsträgers, dessen Gläubiger sie sind, als bekannt gemacht gilt, ihren Anspruch nach Grund und Höhe schriftlich anmelden, Sicherheit zu leisten, soweit sie nicht Befriedigung verlangen können. Dieses Recht steht den Gläubigern jedoch nur zu, wenn sie glaubhaft machen, dass durch die Verschmelzung die Erfüllung ihrer Forderung gefährdet wird."
    },
    {
      "date": "2025-07-02",
      "id": "114237",
      "original_text": "Löschungsankündigung\nBerlin Amtsgericht Berlin (Charlottenburg) HRB 213506\nManuel & B Immobilien GmbH – Berlin",
      "type": "Löschungsankündigung",
      "state": "Berlin",
      "amtsgericht": "Amtsgericht Berlin (Charlottenburg)",
      "registernummer": "HRB 213506",
      "registerart": "HRB",
      "company_name": "Manuel & B Immobilien GmbH",
      "company_seat": "Berlin",
      "details": "02.07.2025 (Bekanntmachungsdatum)\n\nBerlin Amtsgericht Berlin (Charlottenburg) HRB 213506\nLöschungsankündigung\n\nManuel & B Immobilien GmbH\nGesellschaft mit beschränkter Haftung\nBerlin\n\nBei der nachstehenden Gesellschaft wird das Amtslöschungsverfahren gemäß § 394 FamFG eingeleitet. Widerspruchsfrist 6 Wochen"
    },
    {
      "date": "2025-07-02",
      "id": "114238",
      "original_text": "Löschungsankündigung\nBerlin Amtsgericht Berlin (Charlottenburg) HRB 259745\nMB Transport GmbH – Berlin",
      "type": "Löschungsankündigung",
      "state": "Berlin",
      "amtsgericht": "Amtsgericht Berlin (Charlottenburg)",
      "registernummer": "HRB 259745",
      "registerart": "HRB",
      "company_name": "MB Transport GmbH",
      "company_seat": "Berlin",
      "details": "02.07.2025 (Bekanntmachungsdatum)\n\nBerlin Amtsgericht Berlin (Charlottenburg) HRB 259745\nLöschungsankündigung\n\nMB Transport GmbH\nGesellschaft mit beschränkter Haftung\nBerlin\n\nBei der nachstehenden Gesellschaft wird das Amtslöschungsverfahren gemäß § 394 FamFG eingeleitet. Widerspruchsfrist 6 Wochen"
    },
    {
      "date": "2025-07-02",
      "id": "114239",
      "original_text": "Löschungsankündigung\nBaden-Württemberg Amtsgericht Mannheim HRB 720784\nKoenig Reiter Brewery GmbH – Achern",
      "type": "Löschungsankündigung",
      "state": "Baden-Württemberg",
      "amtsgericht": "Amtsgericht Mannheim",
      "registernummer": "HRB 720784",
      "registerart": "HRB",
      "company_name": "Koenig Reiter Brewery GmbH",
      "company_seat": "Achern",
      "details": "02.07.2025 (Bekanntmachungsdatum)\n\nBaden-Württemberg Amtsgericht Mannheim HRB 720784\nLöschungsankündigung\n\nKoenig Reiter Brewery GmbH\nGesellschaft mit beschränkter Haftung\nAchern\n\nDas Gericht beabsichtigt, die Gesellschaft wegen Vermögenslosigkeit im Handelsregister von Amts wegen nach § 394 FamFG zu löschen. Die Frist zur Geltendmachung eines Widerspruchs gegen die beabsichtigte Löschung ist auf einen Monat ab Veröffentlichung bestimmt."
    },
    {
      "date": "2025-07-02",
      "id": "114240",
      "original_text": "Registerbekanntmachung nach dem Umwandlungsgesetz\nBerlin Amtsgericht Berlin (Charlottenburg) HRB 248756\nDPF GmbH – Berlin",
      "type": "Registerbekanntmachung nach dem Umwandlungsgesetz",
      "state": "Berlin",
      "amtsgericht": "Amtsgericht Berlin (Charlottenburg)",
      "registernummer": "HRB 248756",
      "registerart": "HRB",
      "company_name": "DPF GmbH",
      "company_seat": "Berlin",
      "details": "02.07.2025 (Bekanntmachungsdatum)\n\nBerlin Amtsgericht Berlin (Charlottenburg) HRB 248756\nRegisterbekanntmachung nach dem Umwandlungsgesetz 01.07.2025 (Eintragungsdatum)\n\nDPF GmbH\nGesellschaft mit beschränkter Haftung\nBerlin\n\nZu Eintragungsnummer 2 vom 01.07.2025 wird als nicht eingetragen veröffentlicht:\n\nDen Gläubigern der an der Verschmelzung beteiligten Rechtsträger ist, wenn sie binnen sechs Monaten nach dem Tag, an dem die Eintragung der Verschmelzung in das Register des Sitzes desjenigen Rechtsträgers, dessen Gläubiger sie sind, als bekannt gemacht gilt, ihren Anspruch nach Grund und Höhe schriftlich anmelden, Sicherheit zu leisten, soweit sie nicht Befriedigung verlangen können. Dieses Recht steht den Gläubigern jedoch nur zu, wenn sie glaubhaft machen, dass durch die Verschmelzung die Erfüllung ihrer Forderung gefährdet wird. Das Recht, Sicherheitsleistung zu verlangen, steht Gläubigern nicht zu, die im Falle der Insolvenz ein Recht auf vorzugsweise Befriedigung aus einer Deckungsmasse haben, die nach gesetzlicher Vorschrift zu ihrem Schutz errichtet und staatlich überwacht ist."
    },
    {
      "date": "2025-07-02",
      "id": "114241",
      "original_text": "Registerbekanntmachung nach dem Umwandlungsgesetz\nBerlin Amtsgericht Berlin (Charlottenburg) HRB 208359\nDPF Komplementär GmbH – Berlin",
      "type": "Registerbekanntmachung nach dem Umwandlungsgesetz",
      "state": "Berlin",
      "amtsgericht": "Amtsgericht Berlin (Charlottenburg)",
      "registernummer": "HRB 208359",
      "registerart": "HRB",
      "company_name": "DPF Komplementär GmbH",
      "company_seat": "Berlin",
      "details": "02.07.2025 (Bekanntmachungsdatum)\n\nBerlin Amtsgericht Berlin (Charlottenburg) HRB 208359\nRegisterbekanntmachung nach dem Umwandlungsgesetz 01.07.2025 (Eintragungsdatum)\n\nDPF Komplementär GmbH\nGesellschaft mit beschränkter Haftung\nBerlin\n\nZu Eintragungsnummer 3 vom 01.07.2025 wird als nicht eingetragen veröffentlicht:\n\nDen Gläubigern der an der Verschmelzung beteiligten Rechtsträger ist, wenn sie binnen sechs Monaten nach dem Tag, an dem die Eintragung der Verschmelzung in das Register des Sitzes desjenigen Rechtsträgers, dessen Gläubiger sie sind, als bekannt gemacht gilt, ihren Anspruch nach Grund und Höhe schriftlich anmelden, Sicherheit zu leisten, soweit sie nicht Befriedigung verlangen können. Dieses Recht steht den Gläubigern jedoch nur zu, wenn sie glaubhaft machen, dass durch die Verschmelzung die Erfüllung ihrer Forderung gefährdet wird. Das Recht, Sicherheitsleistung zu verlangen, steht Gläubigern nicht zu, die im Falle der Insolvenz ein Recht auf vorzugsweise Befriedigung aus einer Deckungsmasse haben, die nach gesetzlicher Vorschrift zu ihrem Schutz errichtet und staatlich überwacht ist."
    },
    {
      "date": "2025-07-02",
      "id": "114242",
      "original_text": "Registerbekanntmachung nach dem Umwandlungsgesetz\nBaden-Württemberg Amtsgericht Stuttgart HRB 781838\nThomas Kern Projekt GmbH – Reutlingen",
      "type": "Registerbekanntmachung nach dem Umwandlungsgesetz",
      "state": "Baden-Württemberg",
      "amtsgericht": "Amtsgericht Stuttgart",
      "registernummer": "HRB 781838",
      "registerart": "HRB",
      "company_name": "Thomas Kern Projekt GmbH",
      "company_seat": "Reutlingen",
      "details": "02.07.2025 (Bekanntmachungsdatum)\n\nBaden-Württemberg Amtsgericht Stuttgart HRB 781838\nRegisterbekanntmachung nach dem Umwandlungsgesetz 02.07.2025 (Eintragungsdatum)\n\nThomas Kern Projekt GmbH\nGesellschaft mit beschränkter Haftung\nReutlingen\n\nDen Gläubigern der an der Verschmelzung beteiligten Rechtsträger ist, wenn sie binnen sechs Monaten nach dem Tag, an dem die Eintragung der Verschmelzung in das Register des Sitzes desjenigen Rechtsträgers, dessen Gläubiger sie sind, nach § 19 Abs. 3 UmwG als bekanntgemacht gilt, ihren Anspruch nach Grund und Höhe schriftlich anmelden, Sicherheit zu leisten, soweit sie nicht Befriedigung verlangen können. Dieses Recht steht den Gläubigern jedoch nur zu, wenn sie glaubhaft machen, dass durch die Verschmelzung die Erfüllung ihrer Forderung gefährdet wird."
    },
    {
      "date": "2025-07-02",
      "id": "114243",
      "original_text": "Löschungsankündigung\nSchleswig-Holstein Amtsgericht Kiel HRA 9400\nDokan Service 21 Winterdienst Inh. Idris Kadir e.K. – Kiel",
      "type": "Löschungsankündigung",
      "state": "Schleswig-Holstein",
      "amtsgericht": "Amtsgericht Kiel",
      "registernummer": "HRA 9400",
      "registerart": "HRA",
      "company_name": "Dokan Service 21 Winterdienst Inh. Idris Kadir e.K.",
      "company_seat": "Kiel",
      "details": "02.07.2025 (Bekanntmachungsdatum)\n\nSchleswig-Holstein Amtsgericht Kiel HRA 9400\nLöschungsankündigung\n\nDokan Service 21 Winterdienst Inh. Idris Kadir e.K.\nEinzelkaufmann / Einzelkauffrau\nKiel\n\nBei der nachstehenden Firma wird das Amtslöschungsverfahren gemäß § 31 Abs. 2 HGB eingeleitet. Widerspruchsfrist: 2 Monate."
    },
    {
      "date": "2025-07-02",
      "id": "114244",
      "original_text": "Registerbekanntmachung nach dem Umwandlungsgesetz\nBerlin Amtsgericht Berlin (Charlottenburg) HRB 202656\nBeans Software GmbH – Berlin",
      "type": "Registerbekanntmachung nach dem Umwandlungsgesetz",
      "state": "Berlin",
      "amtsgericht": "Amtsgericht Berlin (Charlottenburg)",
      "registernummer": "HRB 202656",
      "registerart": "HRB",
      "company_name": "Beans Software GmbH",
      "company_seat": "Berlin",
      "details": "02.07.2025 (Bekanntmachungsdatum)\n\nBerlin Amtsgericht Berlin (Charlottenburg) HRB 202656\nRegisterbekanntmachung nach dem Umwandlungsgesetz 01.07.2025 (Eintragungsdatum)\n\nBeans Software GmbH\nGesellschaft mit beschränkter Haftung\nBerlin\n\nZu Eintragungsnummer 3 vom 01.07.2025 wird als nicht eingetragen veröffentlicht: Den Gläubigern der an der Verschmelzung beteiligten Rechtsträger ist, wenn sie binnen sechs Monaten nach dem Tag, an dem die Eintragung der Verschmelzung in das Register des Sitzes desjenigen Rechtsträgers, dessen Gläubiger sie sind, als bekannt gemacht gilt, ihren Anspruch nach Grund und Höhe schriftlich anmelden, Sicherheit zu leisten, soweit sie nicht Befriedigung verlangen können. Dieses Recht steht den Gläubigern jedoch nur zu, wenn sie glaubhaft machen, dass durch die Verschmelzung die Erfüllung ihrer Forderung gefährdet wird. Das Recht, Sicherheitsleistung zu verlangen, steht Gläubigern nicht zu, die im Falle der Insolvenz ein Recht auf vorzugsweise Befriedigung aus einer Deckungsmasse haben, die nach gesetzlicher Vorschrift zu ihrem Schutz errichtet und staatlich überwacht ist."
    },
    {
      "date": "2025-07-02",
      "id": "114245",
      "original_text": "Löschungsankündigung\nBerlin Amtsgericht Berlin (Charlottenburg) HRB 117162\nBeate Kahlcke Cosmetic GmbH – Berlin",
      "type": "Löschungsankündigung",
      "state": "Berlin",
      "amtsgericht": "Amtsgericht Berlin (Charlottenburg)",
      "registernummer": "HRB 117162",
      "registerart": "HRB",
      "company_name": "Beate Kahlcke Cosmetic GmbH",
      "company_seat": "Berlin",
      "details": "02.07.2025 (Bekanntmachungsdatum)\n\nBerlin Amtsgericht Berlin (Charlottenburg) HRB 117162\nLöschungsankündigung\n\nBeate Kahlcke Cosmetic GmbH\nGesellschaft mit beschränkter Haftung\nBerlin\n\nBei der nachstehenden Gesellschaft wird das Amtslöschungsverfahren gemäß § 394 FamFG eingeleitet. Widerspruchsfrist 6 Wochen"
    },
    {
      "date": "2025-07-02",
      "id": "114246",
      "original_text": "Einreichung neuer Dokumente\nBaden-Württemberg Amtsgericht Stuttgart HRB 20427\nLIGADIGITAL AG – Stuttgart",
      "type": "Einreichung neuer Dokumente",
      "state": "Baden-Württemberg",
      "amtsgericht": "Amtsgericht Stuttgart",
      "registernummer": "HRB 20427",
      "registerart": "HRB",
      "company_name": "LIGADIGITAL AG",
      "company_seat": "Stuttgart",
      "details": "02.07.2025 (Bekanntmachungsdatum)\n\nBaden-Württemberg Amtsgericht Stuttgart HRB 20427\nEinreichung neuer Dokumente\n\nLIGADIGITAL AG\nAktiengesellschaft\nStuttgart\n\nDie Gesellschaft hat am 27.06.2025 die Liste über die Zusammensetzung des Aufsichtsrats zum Handelsregister eingereicht."
    },
    {
      "date": "2025-07-02",
      "id": "114247",
      "original_text": "Registerbekanntmachung nach dem Umwandlungsgesetz\nBaden-Württemberg Amtsgericht Stuttgart HRB 745799\nSPIE comcross GmbH – Leonberg",
      "type": "Registerbekanntmachung nach dem Umwandlungsgesetz",
      "state": "Baden-Württemberg",
      "amtsgericht": "Amtsgericht Stuttgart",
      "registernummer": "HRB 745799",
      "registerart": "HRB",
      "company_name": "SPIE comcross GmbH",
      "company_seat": "Leonberg",
      "details": "02.07.2025 (Bekanntmachungsdatum)\n\nBaden-Württemberg Amtsgericht Stuttgart HRB 745799\nRegisterbekanntmachung nach dem Umwandlungsgesetz 02.07.2025 (Eintragungsdatum)\n\nSPIE comcross GmbH\nGesellschaft mit beschränkter Haftung\nLeonberg\n\nDen Gläubigern der an der Verschmelzung beteiligten Rechtsträger ist, wenn sie binnen sechs Monaten nach dem Tag, an dem die Eintragung der Verschmelzung in das Register des Sitzes desjenigen Rechtsträgers, dessen Gläubiger sie sind, nach § 19 Abs. 3 UmwG als bekanntgemacht gilt, ihren Anspruch nach Grund und Höhe schriftlich anmelden, Sicherheit zu leisten, soweit sie nicht Befriedigung verlangen können. Dieses Recht steht den Gläubigern jedoch nur zu, wenn sie glaubhaft machen, dass durch die Verschmelzung die Erfüllung ihrer Forderung gefährdet wird."
    },
    {
      "date": "2025-07-02",
      "id": "114248",
      "original_text": "Registerbekanntmachung nach dem Umwandlungsgesetz\nBerlin Amtsgericht Berlin (Charlottenburg) HRB 272200\nias MPU GmbH – Berlin",
      "type": "Registerbekanntmachung nach dem Umwandlungsgesetz",
      "state": "Berlin",
      "amtsgericht": "Amtsgericht Berlin (Charlottenburg)",
      "registernummer": "HRB 272200",
      "registerart": "HRB",
      "company_name": "ias MPU GmbH",
      "company_seat": "Berlin",
      "details": "02.07.2025 (Bekanntmachungsdatum)\n\nBerlin Amtsgericht Berlin (Charlottenburg) HRB 272200\nRegisterbekanntmachung nach dem Umwandlungsgesetz 01.07.2025 (Eintragungsdatum)\n\nias MPU GmbH\nGesellschaft mit beschränkter Haftung\nBerlin\n\nZu Eintragungsnummer 2 vom 01.07.2025 wird als nicht eingetragen veröffentlicht:Den Gläubigern der an der Spaltung beteiligten Rechtsträger ist, wenn sie binnen sechs Monaten nach dem Tag, an dem die Eintragung der Spaltung in das Register des Sitzes desjenigen Rechtsträgers, dessen Gläubiger sie sind, als bekannt gemacht gilt, ihren Anspruch nach Grund und Höhe schriftlich anmelden, Sicherheit zu leisten, soweit sie nicht Befriedigung verlangen können. Dieses Recht steht den Gläubigern jedoch nur zu, wenn sie glaubhaft machen, dass durch die Spaltung die Erfüllung ihrer Forderung gefährdet wird. Das Recht, Sicherheitsleistung zu verlangen, steht Gläubigern nicht zu, die im Falle der Insolvenz ein Recht auf vorzugsweise Befriedigung aus einer Deckungsmasse haben, die nach gesetzlicher Vorschrift zu ihrem Schutz errichtet und staatlich überwacht ist."
    },
    {
      "date": "2025-07-02",
      "id": "114249",
      "original_text": "Registerbekanntmachung nach dem Umwandlungsgesetz\nSchleswig-Holstein Amtsgericht Kiel HRA 10690\nLukas Asset Management SE & Co. KG – Norderstedt",
      "type": "Registerbekanntmachung nach dem Umwandlungsgesetz",
      "state": "Schleswig-Holstein",
      "amtsgericht": "Amtsgericht Kiel",
      "registernummer": "HRA 10690",
      "registerart": "HRA",
      "company_name": "Lukas Asset Management SE & Co. KG",
      "company_seat": "Norderstedt",
      "details": "02.07.2025 (Bekanntmachungsdatum)\n\nSchleswig-Holstein Amtsgericht Kiel HRA 10690\nRegisterbekanntmachung nach dem Umwandlungsgesetz 01.07.2025 (Eintragungsdatum)\n\nLukas Asset Management SE & Co. KG\nKommanditgesellschaft\nNorderstedt\n\nZu Eintragungsnummer 5 vom 01.07.2025 wird als nicht eingetragen veröffentlicht:\nDen Gläubigern ist, wenn sie binnen sechs Monaten nach dem Tag, an dem die Eintragung der Umwandlung bekannt gemacht worden ist, ihren Anspruch nach Grund und Höhe schriftlich anmelden, Sicherheit zu leisten, soweit sie nicht Befriedigung verlangen können. Dieses Recht steht den Gläubigern jedoch nur zu, wenn sie glaubhaft machen, dass durch die Umwandlung die Erfüllung ihrer Forderung gefährdet wird."
    },
    {
      "date": "2025-07-02",
      "id": "114250",
      "original_text": "Einreichung neuer Dokumente\nBaden-Württemberg Amtsgericht Stuttgart HRB 24542\nSV SparkassenVersicherung Lebensversicherung Aktiengesellschaft – Stuttgart",
      "type": "Einreichung neuer Dokumente",
      "state": "Baden-Württemberg",
      "amtsgericht": "Amtsgericht Stuttgart",
      "registernummer": "HRB 24542",
      "registerart": "HRB",
      "company_name": "SV SparkassenVersicherung Lebensversicherung Aktiengesellschaft",
      "company_seat": "Stuttgart",
      "details": "02.07.2025 (Bekanntmachungsdatum)\n\nBaden-Württemberg Amtsgericht Stuttgart HRB 24542\nEinreichung neuer Dokumente\n\nSV SparkassenVersicherung Lebensversicherung Aktiengesellschaft\nAktiengesellschaft\nStuttgart\n\nDie Gesellschaft hat am 30.06.2025 die Liste über die Zusammensetzung des Aufsichtsrats zum Handelsregister eingereicht."
    },
    {
      "date": "2025-07-02",
      "id": "114251",
      "original_text": "Löschungsankündigung\nSaarland Amtsgericht Saarbrücken HRB 105985\nJKT Estate Immobilien GmbH – Mettlach",
      "type": "Löschungsankündigung",
      "state": "Saarland",
      "amtsgericht": "Amtsgericht Saarbrücken",
      "registernummer": "HRB 105985",
      "registerart": "HRB",
      "company_name": "JKT Estate Immobilien GmbH",
      "company_seat": "Mettlach",
      "details": "02.07.2025 (Bekanntmachungsdatum)\n\nSaarland Amtsgericht Saarbrücken HRB 105985\nLöschungsankündigung\n\nJKT Estate Immobilien GmbH\nGesellschaft mit beschränkter Haftung\nMettlach\n\nEs ist beabsichtigt, die Gesellschaft von Amts wegen gemäß § 394 FamFG wegen Vermögenslosigkeit zu löschen.\nGegen die Löschung von Amts wegen ist das Rechtsmittel des Widerspruchs statthaft. Der Widerspruch ist binnen einer Frist zwei Monaten beginnend mit dem Tag dieser Veröffentlichung durch Einreichen eines Widerspruchsschreibens -schriftlich oder zur Niederschrift der Geschäftsstelle beim Amtsgericht Saarbrücken, -zentrales Handelsregister-, Mainzerstr.178, 66121 Saarbrücken einzulegen.\nDer Widerspruch muss die Bezeichnung der angefochtenen Löschungsankündigung enthalten sowie die Erklärung, dass Widerspruch eingelegt wird. Er ist vom Widerspruchsführer oder seinem Bevollmächtigten zu unterzeichnen.\nDas Widerspruchsschreiben kann auch in der Form eines elektronischen Dokumentes eingereicht werden, das mit einer qualifizierten elektronischen Signatur nach dem Signaturgesetz versehen sein muss (§§ 14 Abs. 2 FamFG, 130a, 298 ZPO)."
    },
    {
      "date": "2025-07-02",
      "id": "114252",
      "original_text": "Registerbekanntmachung nach dem Umwandlungsgesetz\nBrandenburg Amtsgericht Potsdam HRB 32873\nSiebenundvierzigste Babelsberg Film GmbH – Potsdam",
      "type": "Registerbekanntmachung nach dem Umwandlungsgesetz",
      "state": "Brandenburg",
      "amtsgericht": "Amtsgericht Potsdam",
      "registernummer": "HRB 32873",
      "registerart": "HRB",
      "company_name": "Siebenundvierzigste Babelsberg Film GmbH",
      "company_seat": "Potsdam",
      "details": "02.07.2025 (Bekanntmachungsdatum)\n\nBrandenburg Amtsgericht Potsdam HRB 32873\nRegisterbekanntmachung nach dem Umwandlungsgesetz 01.07.2025 (Eintragungsdatum)\n\nSiebenundvierzigste Babelsberg Film GmbH\nGesellschaft mit beschränkter Haftung\nPotsdam\n\nZu Eintragungsnummer 6 vom 01.07.2025 wird als nicht eingetragen veröffentlicht:\nDen Gläubigern der an der Verschmelzung beteiligten Rechtsträger ist, wenn sie binnen sechs Monaten nach dem Tag, an dem die Eintragung der Verschmelzung in das Register des Sitzes desjenigen Rechtsträgers, dessen Gläubiger sie sind, als bekannt gemacht gilt, ihren Anspruch nach Grund und Höhe schriftlich anmelden, Sicherheit zu leisten, soweit sie nicht Befriedigung verlangen können. Dieses Recht steht den Gläubigern jedoch nur zu, wenn sie glaubhaft machen, dass durch die Verschmelzung die Erfüllung ihrer Forderung gefährdet wird"
    },
    {
      "date": "2025-07-02",
      "id": "114253",
      "original_text": "Registerbekanntmachung nach dem Umwandlungsgesetz\nBrandenburg Amtsgericht Potsdam HRB 35352\nFünfzigste Babelsberg Film GmbH – Potsdam",
      "type": "Registerbekanntmachung nach dem Umwandlungsgesetz",
      "state": "Brandenburg",
      "amtsgericht": "Amtsgericht Potsdam",
      "registernummer": "HRB 35352",
      "registerart": "HRB",
      "company_name": "Fünfzigste Babelsberg Film GmbH",
      "company_seat": "Potsdam",
      "details": "02.07.2025 (Bekanntmachungsdatum)\n\nBrandenburg Amtsgericht Potsdam HRB 35352\nRegisterbekanntmachung nach dem Umwandlungsgesetz 01.07.2025 (Eintragungsdatum)\n\nFünfzigste Babelsberg Film GmbH\nGesellschaft mit beschränkter Haftung\nPotsdam\n\nZu Eintragungsnummer 7 vom 01.07.2025 wird als nicht eingetragen veröffentlicht:\nDen Gläubigern der an der Verschmelzung beteiligten Rechtsträger ist, wenn sie binnen sechs Monaten nach dem Tag, an dem die Eintragung der Verschmelzung in das Register des Sitzes desjenigen Rechtsträgers, dessen Gläubiger sie sind, als bekannt gemacht gilt, ihren Anspruch nach Grund und Höhe schriftlich anmelden, Sicherheit zu leisten, soweit sie nicht Befriedigung verlangen können. Dieses Recht steht den Gläubigern jedoch nur zu, wenn sie glaubhaft machen, dass durch die Verschmelzung die Erfüllung ihrer Forderung gefährdet wird"
    },
    {
      "date": "2025-07-02",
      "id": "114254",
      "original_text": "Registerbekanntmachung nach dem Umwandlungsgesetz\nNordrhein-Westfalen Amtsgericht Coesfeld HRB 2057\nBäder- und Parkhausgesellschaft der Stadt Coesfeld GmbH – Coesfeld",
      "type": "Registerbekanntmachung nach dem Umwandlungsgesetz",
      "state": "Nordrhein-Westfalen",
      "amtsgericht": "Amtsgericht Coesfeld",
      "registernummer": "HRB 2057",
      "registerart": "HRB",
      "company_name": "Bäder- und Parkhausgesellschaft der Stadt Coesfeld GmbH",
      "company_seat": "Coesfeld",
      "details": "02.07.2025 (Bekanntmachungsdatum)\n\nNordrhein-Westfalen Amtsgericht Coesfeld HRB 2057\nRegisterbekanntmachung nach dem Umwandlungsgesetz 02.07.2025 (Eintragungsdatum)\n\nBäder- und Parkhausgesellschaft der Stadt Coesfeld GmbH\nGesellschaft mit beschränkter Haftung\nCoesfeld\n\nDen Gläubigern der an der Verschmelzung beteiligten Rechtsträger ist, wenn sie binnen sechs Monaten nach dem Tag, an dem die Eintragung der Verschmelzung in das Register des Sitzes desjenigen Rechtsträgers, dessen Gläubiger sie sind, nach § 19 Absatz 3 UmwG als bekanntgemacht gilt, ihren Anspruch nach Grund und Höhe schriftlich anmelden, Sicherheit zu leisten, soweit sie nicht Befriedigung verlangen können. Dieses Recht steht den Gläubigern jedoch nur zu, wenn sie glaubhaft machen, dass durch die Verschmelzung die Erfüllung ihrer Forderung gefährdet wird."
    },
    {
      "date": "2025-07-02",
      "id": "114255",
      "original_text": "Registerbekanntmachung nach dem Umwandlungsgesetz\nBrandenburg Amtsgericht Potsdam HRB 30587\nVierzigste Babelsberg Film GmbH – Potsdam",
      "type": "Registerbekanntmachung nach dem Umwandlungsgesetz",
      "state": "Brandenburg",
      "amtsgericht": "Amtsgericht Potsdam",
      "registernummer": "HRB 30587",
      "registerart": "HRB",
      "company_name": "Vierzigste Babelsberg Film GmbH",
      "company_seat": "Potsdam",
      "details": "02.07.2025 (Bekanntmachungsdatum)\n\nBrandenburg Amtsgericht Potsdam HRB 30587\nRegisterbekanntmachung nach dem Umwandlungsgesetz 01.07.2025 (Eintragungsdatum)\n\nVierzigste Babelsberg Film GmbH\nGesellschaft mit beschränkter Haftung\nPotsdam\n\nZu Eintragungsnummer 6 vom 01.07.2025 wird als nicht eingetragen veröffentlicht:\nDen Gläubigern der an der Verschmelzung beteiligten Rechtsträger ist, wenn sie binnen sechs Monaten nach dem Tag, an dem die Eintragung der Verschmelzung in das Register des Sitzes desjenigen Rechtsträgers, dessen Gläubiger sie sind, als bekannt gemacht gilt, ihren Anspruch nach Grund und Höhe schriftlich anmelden, Sicherheit zu leisten, soweit sie nicht Befriedigung verlangen können. Dieses Recht steht den Gläubigern jedoch nur zu, wenn sie glaubhaft machen, dass durch die Verschmelzung die Erfüllung ihrer Forderung gefährdet wird"
    },
    {
      "date": "2025-07-02",
      "id": "114256",
      "original_text": "Registerbekanntmachung nach dem Umwandlungsgesetz\nBrandenburg Amtsgericht Potsdam HRB 32666\nVierundvierzigste Babelsberg Film GmbH – Potsdam",
      "type": "Registerbekanntmachung nach dem Umwandlungsgesetz",
      "state": "Brandenburg",
      "amtsgericht": "Amtsgericht Potsdam",
      "registernummer": "HRB 32666",
      "registerart": "HRB",
      "company_name": "Vierundvierzigste Babelsberg Film GmbH",
      "company_seat": "Potsdam",
      "details": "02.07.2025 (Bekanntmachungsdatum)\n\nBrandenburg Amtsgericht Potsdam HRB 32666\nRegisterbekanntmachung nach dem Umwandlungsgesetz 01.07.2025 (Eintragungsdatum)\n\nVierundvierzigste Babelsberg Film GmbH\nGesellschaft mit beschränkter Haftung\nPotsdam\n\nZu Eintragungsnummer 6 vom 01.07.2025 wird als nicht eingetragen veröffentlicht:\nDen Gläubigern der an der Verschmelzung beteiligten Rechtsträger ist, wenn sie binnen sechs Monaten nach dem Tag, an dem die Eintragung der Verschmelzung in das Register des Sitzes desjenigen Rechtsträgers, dessen Gläubiger sie sind, als bekannt gemacht gilt, ihren Anspruch nach Grund und Höhe schriftlich anmelden, Sicherheit zu leisten, soweit sie nicht Befriedigung verlangen können. Dieses Recht steht den Gläubigern jedoch nur zu, wenn sie glaubhaft machen, dass durch die Verschmelzung die Erfüllung ihrer Forderung gefährdet wird"
    },
    {
      "date": "2025-07-02",
      "id": "114257",
      "original_text": "Löschungsankündigung\nBerlin Amtsgericht Berlin (Charlottenburg) HRB 120105\nS4U Marketing Unternehmergesellschaft (haftungsbeschränkt) – Berlin",
      "type": "Löschungsankündigung",
      "state": "Berlin",
      "amtsgericht": "Amtsgericht Berlin (Charlottenburg)",
      "registernummer": "HRB 120105",
      "registerart": "HRB",
      "company_name": "S4U Marketing Unternehmergesellschaft (haftungsbeschränkt)",
      "company_seat": "Berlin",
      "details": "02.07.2025 (Bekanntmachungsdatum)\n\nBerlin Amtsgericht Berlin (Charlottenburg) HRB 120105\nLöschungsankündigung\n\nS4U Marketing Unternehmergesellschaft (haftungsbeschränkt)\nGesellschaft mit beschränkter Haftung\nBerlin\n\nBei der nachstehenden Gesellschaft wird das Amtslöschungsverfahren gemäß § 394 FamFG eingeleitet. Widerspruchsfrist 6 Wochen"
    },
    {
      "date": "2025-07-02",
      "id": "114258",
      "original_text": "Löschungsankündigung\nBerlin Amtsgericht Berlin (Charlottenburg) HRB 141123\nBadeWolke Badsysteme UG (haftungsbeschränkt) – Berlin",
      "type": "Löschungsankündigung",
      "state": "Berlin",
      "amtsgericht": "Amtsgericht Berlin (Charlottenburg)",
      "registernummer": "HRB 141123",
      "registerart": "HRB",
      "company_name": "BadeWolke Badsysteme UG (haftungsbeschränkt)",
      "company_seat": "Berlin",
      "details": "02.07.2025 (Bekanntmachungsdatum)\n\nBerlin Amtsgericht Berlin (Charlottenburg) HRB 141123\nLöschungsankündigung\n\nBadeWolke Badsysteme UG (haftungsbeschränkt)\nGesellschaft mit beschränkter Haftung\nBerlin\n\nBei der nachstehenden Gesellschaft wird das Amtslöschungsverfahren gemäß § 394 FamFG eingeleitet. Widerspruchsfrist 6 Wochen"
    },
    {
      "date": "2025-07-02",
      "id": "114259",
      "original_text": "Registerbekanntmachung nach dem Umwandlungsgesetz\nBaden-Württemberg Amtsgericht Mannheim HRB 754927\nBruker Optik Holding SE – Ettlingen",
      "type": "Registerbekanntmachung nach dem Umwandlungsgesetz",
      "state": "Baden-Württemberg",
      "amtsgericht": "Amtsgericht Mannheim",
      "registernummer": "HRB 754927",
      "registerart": "HRB",
      "company_name": "Bruker Optik Holding SE",
      "company_seat": "Ettlingen",
      "details": "02.07.2025 (Bekanntmachungsdatum)\n\nBaden-Württemberg Amtsgericht Mannheim HRB 754927\nRegisterbekanntmachung nach dem Umwandlungsgesetz 02.07.2025 (Eintragungsdatum)\n\nBruker Optik Holding SE\nEuropäische Aktiengesellschaft (SE)\nEttlingen\n\nDen Gläubigern der an der Verschmelzung beteiligten Rechtsträger ist, wenn sie binnen sechs Monaten nach dem Tag, an dem die Eintragung der Verschmelzung in das Register des Sitzes desjenigen Rechtsträgers, dessen Gläubiger sie sind, nach § 19 Abs. 3 UmwG als bekanntgemacht gilt, ihren Anspruch nach Grund und Höhe schriftlich anmelden, Sicherheit zu leisten, soweit sie nicht Befriedigung verlangen können. Dieses Recht steht den Gläubigern jedoch nur zu, wenn sie glaubhaft machen, dass durch die Verschmelzung die Erfüllung ihrer Forderung gefährdet wird."
    },
    {
      "date": "2025-07-02",
      "id": "114260",
      "original_text": "Löschungsankündigung\nBerlin Amtsgericht Berlin (Charlottenburg) HRB 122556\nJoker's Automaten GmbH – Berlin",
      "type": "Löschungsankündigung",
      "state": "Berlin",
      "amtsgericht": "Amtsgericht Berlin (Charlottenburg)",
      "registernummer": "HRB 122556",
      "registerart": "HRB",
      "company_name": "Joker's Automaten GmbH",
      "company_seat": "Berlin",
      "details": "02.07.2025 (Bekanntmachungsdatum)\n\nBerlin Amtsgericht Berlin (Charlottenburg) HRB 122556\nLöschungsankündigung\n\nJoker's Automaten GmbH\nGesellschaft mit beschränkter Haftung\nBerlin\n\nBei der nachstehenden Gesellschaft wird das Amtslöschungsverfahren gemäß § 394 FamFG eingeleitet. Widerspruchsfrist 6 Wochen"
    },
    {
      "date": "2025-07-02",
      "id": "114261",
      "original_text": "Registerbekanntmachung nach dem Umwandlungsgesetz\nBaden-Württemberg Amtsgericht Mannheim HRB 753388\nBruker Optik Holding AG – Ettlingen",
      "type": "Registerbekanntmachung nach dem Umwandlungsgesetz",
      "state": "Baden-Württemberg",
      "amtsgericht": "Amtsgericht Mannheim",
      "registernummer": "HRB 753388",
      "registerart": "HRB",
      "company_name": "Bruker Optik Holding AG",
      "company_seat": "Ettlingen",
      "details": "02.07.2025 (Bekanntmachungsdatum)\n\nBaden-Württemberg Amtsgericht Mannheim HRB 753388\nRegisterbekanntmachung nach dem Umwandlungsgesetz 02.07.2025 (Eintragungsdatum)\n\nBruker Optik Holding AG\nAktiengesellschaft\nEttlingen\n\nDen Gläubigern der an der Verschmelzung beteiligten Rechtsträger ist, wenn sie binnen sechs Monaten nach dem Tag, an dem die Eintragung der Verschmelzung in das Register des Sitzes desjenigen Rechtsträgers, dessen Gläubiger sie sind, nach § 19 Abs. 3 UmwG als bekanntgemacht gilt, ihren Anspruch nach Grund und Höhe schriftlich anmelden, Sicherheit zu leisten, soweit sie nicht Befriedigung verlangen können. Dieses Recht steht den Gläubigern jedoch nur zu, wenn sie glaubhaft machen, dass durch die Verschmelzung die Erfüllung ihrer Forderung gefährdet wird."
    },
    {
      "date": "2025-07-02",
      "id": "114262",
      "original_text": "Registerbekanntmachung nach dem Umwandlungsgesetz\nBrandenburg Amtsgericht Potsdam HRB 29175\nNeununddreißigste Babelsberg Film GmbH – Potsdam",
      "type": "Registerbekanntmachung nach dem Umwandlungsgesetz",
      "state": "Brandenburg",
      "amtsgericht": "Amtsgericht Potsdam",
      "registernummer": "HRB 29175",
      "registerart": "HRB",
      "company_name": "Neununddreißigste Babelsberg Film GmbH",
      "company_seat": "Potsdam",
      "details": "02.07.2025 (Bekanntmachungsdatum)\n\nBrandenburg Amtsgericht Potsdam HRB 29175\nRegisterbekanntmachung nach dem Umwandlungsgesetz 01.07.2025 (Eintragungsdatum)\n\nNeununddreißigste Babelsberg Film GmbH\nGesellschaft mit beschränkter Haftung\nPotsdam\n\nZu Eintragungsnummer 6 vom 01.07.2025 wird als nicht eingetragen veröffentlicht:\nDen Gläubigern der an der Verschmelzung beteiligten Rechtsträger ist, wenn sie binnen sechs Monaten nach dem Tag, an dem die Eintragung der Verschmelzung in das Register des Sitzes desjenigen Rechtsträgers, dessen Gläubiger sie sind, als bekannt gemacht gilt, ihren Anspruch nach Grund und Höhe schriftlich anmelden, Sicherheit zu leisten, soweit sie nicht Befriedigung verlangen können. Dieses Recht steht den Gläubigern jedoch nur zu, wenn sie glaubhaft machen, dass durch die Verschmelzung die Erfüllung ihrer Forderung gefährdet wird"
    },
    {
      "date": "2025-07-02",
      "id": "114263",
      "original_text": "Registerbekanntmachung nach dem Umwandlungsgesetz\nBrandenburg Amtsgericht Potsdam HRB 31829\nZweiundvierzigste Babelsberg Film GmbH – Potsdam",
      "type": "Registerbekanntmachung nach dem Umwandlungsgesetz",
      "state": "Brandenburg",
      "amtsgericht": "Amtsgericht Potsdam",
      "registernummer": "HRB 31829",
      "registerart": "HRB",
      "company_name": "Zweiundvierzigste Babelsberg Film GmbH",
      "company_seat": "Potsdam",
      "details": "02.07.2025 (Bekanntmachungsdatum)\n\nBrandenburg Amtsgericht Potsdam HRB 31829\nRegisterbekanntmachung nach dem Umwandlungsgesetz 01.07.2025 (Eintragungsdatum)\n\nZweiundvierzigste Babelsberg Film GmbH\nGesellschaft mit beschränkter Haftung\nPotsdam\n\nZu Eintragungsnummer 6 vom 01.07.2025 wird als nicht eingetragen veröffentlicht:\nDen Gläubigern der an der Verschmelzung beteiligten Rechtsträger ist, wenn sie binnen sechs Monaten nach dem Tag, an dem die Eintragung der Verschmelzung in das Register des Sitzes desjenigen Rechtsträgers, dessen Gläubiger sie sind, als bekannt gemacht gilt, ihren Anspruch nach Grund und Höhe schriftlich anmelden, Sicherheit zu leisten, soweit sie nicht Befriedigung verlangen können. Dieses Recht steht den Gläubigern jedoch nur zu, wenn sie glaubhaft machen, dass durch die Verschmelzung die Erfüllung ihrer Forderung gefährdet wird"
    },
    {
      "date": "2025-07-02",
      "id": "114264",
      "original_text": "Registerbekanntmachung nach dem Umwandlungsgesetz\nBerlin Amtsgericht Berlin (Charlottenburg) HRB 69873\nF.O.D. Grundstücksverwaltungs- und Handelsgesellschaft Friedrich-Olbricht-Damm mbH – Berlin",
      "type": "Registerbekanntmachung nach dem Umwandlungsgesetz",
      "state": "Berlin",
      "amtsgericht": "Amtsgericht Berlin (Charlottenburg)",
      "registernummer": "HRB 69873",
      "registerart": "HRB",
      "company_name": "F.O.D. Grundstücksverwaltungs- und Handelsgesellschaft Friedrich-Olbricht-Damm mbH",
      "company_seat": "Berlin",
      "details": "02.07.2025 (Bekanntmachungsdatum)\n\nBerlin Amtsgericht Berlin (Charlottenburg) HRB 69873\nRegisterbekanntmachung nach dem Umwandlungsgesetz 02.07.2025 (Eintragungsdatum)\n\nF.O.D. Grundstücksverwaltungs- und Handelsgesellschaft Friedrich-Olbricht-Damm mbH\nGesellschaft mit beschränkter Haftung\nBerlin\n\nZu Eintragungsnummer 5 vom 02.07.2025 wird als nicht eingetragen veröffentlicht: Den Gläubigern der an der Verschmelzung beteiligten Rechtsträger ist, wenn sie binnen sechs Monaten nach dem Tag, an dem die Eintragung der Verschmelzung in das Register des Sitzes desjenigen Rechtsträgers, dessen Gläubiger sie sind, als bekannt gemacht gilt, ihren Anspruch nach Grund und Höhe schriftlich anmelden, Sicherheit zu leisten, soweit sie nicht Befriedigung verlangen können. Dieses Recht steht den Gläubigern jedoch nur zu, wenn sie glaubhaft machen, dass durch die Verschmelzung die Erfüllung ihrer Forderung gefährdet wird. Das Recht, Sicherheitsleistung zu verlangen, steht Gläubigern nicht zu, die im Falle der Insolvenz ein Recht auf vorzugsweise Befriedigung aus einer Deckungsmasse haben, die nach gesetzlicher Vorschrift zu ihrem Schutz errichtet und staatlich überwacht ist."
    },
    {
      "date": "2025-07-02",
      "id": "114265",
      "original_text": "Einreichung neuer Dokumente\nBerlin Amtsgericht Berlin (Charlottenburg) HRB 102442\nVitanas Holding GmbH – Berlin",
      "type": "Einreichung neuer Dokumente",
      "state": "Berlin",
      "amtsgericht": "Amtsgericht Berlin (Charlottenburg)",
      "registernummer": "HRB 102442",
      "registerart": "HRB",
      "company_name": "Vitanas Holding GmbH",
      "company_seat": "Berlin",
      "details": "02.07.2025 (Bekanntmachungsdatum)\n\nBerlin Amtsgericht Berlin (Charlottenburg) HRB 102442\nEinreichung neuer Dokumente\n\nVitanas Holding GmbH\nGesellschaft mit beschränkter Haftung\nBerlin\n\nAls nicht eingetragen wird veröffentlicht: Es wurde eine neue Liste der Aufsichtsratsmitglieder eingereicht (§52 GmbHG)."
    },
    {
      "date": "2025-07-02",
      "id": "114266",
      "original_text": "Registerbekanntmachung nach dem Umwandlungsgesetz\nBrandenburg Amtsgericht Potsdam HRB 32876\nSechsundvierzigste Babelsberg Film GmbH – Potsdam",
      "type": "Registerbekanntmachung nach dem Umwandlungsgesetz",
      "state": "Brandenburg",
      "amtsgericht": "Amtsgericht Potsdam",
      "registernummer": "HRB 32876",
      "registerart": "HRB",
      "company_name": "Sechsundvierzigste Babelsberg Film GmbH",
      "company_seat": "Potsdam",
      "details": "02.07.2025 (Bekanntmachungsdatum)\n\nBrandenburg Amtsgericht Potsdam HRB 32876\nRegisterbekanntmachung nach dem Umwandlungsgesetz 01.07.2025 (Eintragungsdatum)\n\nSechsundvierzigste Babelsberg Film GmbH\nGesellschaft mit beschränkter Haftung\nPotsdam\n\nZu Eintragungsnummer 6 vom 01.07.2025 wird als nicht eingetragen veröffentlicht:\nDen Gläubigern der an der Verschmelzung beteiligten Rechtsträger ist, wenn sie binnen sechs Monaten nach dem Tag, an dem die Eintragung der Verschmelzung in das Register des Sitzes desjenigen Rechtsträgers, dessen Gläubiger sie sind, als bekannt gemacht gilt, ihren Anspruch nach Grund und Höhe schriftlich anmelden, Sicherheit zu leisten, soweit sie nicht Befriedigung verlangen können. Dieses Recht steht den Gläubigern jedoch nur zu, wenn sie glaubhaft machen, dass durch die Verschmelzung die Erfüllung ihrer Forderung gefährdet wird"
    },
    {
      "date": "2025-07-02",
      "id": "114267",
      "original_text": "Registerbekanntmachung nach dem Umwandlungsgesetz\nBaden-Württemberg Amtsgericht Ulm HRA 729483\nDollabeck GmbH & Co. KG – Munderkingen",
      "type": "Registerbekanntmachung nach dem Umwandlungsgesetz",
      "state": "Baden-Württemberg",
      "amtsgericht": "Amtsgericht Ulm",
      "registernummer": "HRA 729483",
      "registerart": "HRA",
      "company_name": "Dollabeck GmbH & Co. KG",
      "company_seat": "Munderkingen",
      "details": "02.07.2025 (Bekanntmachungsdatum)\n\nBaden-Württemberg Amtsgericht Ulm HRA 729483\nRegisterbekanntmachung nach dem Umwandlungsgesetz 02.07.2025 (Eintragungsdatum)\n\nDollabeck GmbH & Co. KG\nKommanditgesellschaft\nMunderkingen\n\nAls nicht eingetragen wird bekanntgemacht:\nDen Gläubigern der an der Ausgliederung beteiligten Rechtsträger ist, wenn sie binnen sechs Monaten nach dem Tag, an dem die Eintragung der Ausgliederung in das Register des Sitzes desjenigen Rechtsträgers, dessen Gläubiger sie sind, nach § 19 Abs. 3 UmwG als bekanntgemacht gilt, ihren Anspruch nach Grund und Höhe schriftlich anmelden, Sicherheit zu leisten, soweit sie nicht Befriedigung verlangen können. Dieses Recht steht den Gläubigern jedoch nur zu, wenn sie glaubhaft machen, dass durch die Ausgliederung die Erfüllung ihrer Forderung gefährdet wird."
    },
    {
      "date": "2025-07-02",
      "id": "114268",
      "original_text": "Registerbekanntmachung nach dem Umwandlungsgesetz\nBaden-Württemberg Amtsgericht Ulm HRA 729419\nBäckerei Doll e.K. – Munderkingen",
      "type": "Registerbekanntmachung nach dem Umwandlungsgesetz",
      "state": "Baden-Württemberg",
      "amtsgericht": "Amtsgericht Ulm",
      "registernummer": "HRA 729419",
      "registerart": "HRA",
      "company_name": "Bäckerei Doll e.K.",
      "company_seat": "Munderkingen",
      "details": "02.07.2025 (Bekanntmachungsdatum)\n\nBaden-Württemberg Amtsgericht Ulm HRA 729419\nRegisterbekanntmachung nach dem Umwandlungsgesetz 02.07.2025 (Eintragungsdatum)\n\nBäckerei Doll e.K.\nEinzelkaufmann / Einzelkauffrau\nMunderkingen\n\nDen Gläubigern der an der Ausgliederung beteiligten Rechtsträger ist, wenn sie binnen sechs Monaten nach dem Tag, an dem die Eintragung der Ausgliederung in das Register des Sitzes desjenigen Rechtsträgers, dessen Gläubiger sie sind, nach § 19 Abs. 3 UmwG als bekanntgemacht gilt, ihren Anspruch nach Grund und Höhe schriftlich anmelden, Sicherheit zu leisten, soweit sie nicht Befriedigung verlangen können. Dieses Recht steht den Gläubigern jedoch nur zu, wenn sie glaubhaft machen, dass durch die Ausgliederung die Erfüllung ihrer Forderung gefährdet wird."
    },
    {
      "date": "2025-07-02",
      "id": "114269",
      "original_text": "Registerbekanntmachung nach dem Umwandlungsgesetz\nBerlin Amtsgericht Berlin (Charlottenburg) HRB 82820\nSpantec GmbH – Berlin",
      "type": "Registerbekanntmachung nach dem Umwandlungsgesetz",
      "state": "Berlin",
      "amtsgericht": "Amtsgericht Berlin (Charlottenburg)",
      "registernummer": "HRB 82820",
      "registerart": "HRB",
      "company_name": "Spantec GmbH",
      "company_seat": "Berlin",
      "details": "02.07.2025 (Bekanntmachungsdatum)\n\nBerlin Amtsgericht Berlin (Charlottenburg) HRB 82820\nRegisterbekanntmachung nach dem Umwandlungsgesetz 02.07.2025 (Eintragungsdatum)\n\nSpantec GmbH\nGesellschaft mit beschränkter Haftung\nBerlin\n\nZu Eintragungsnummer 4 vom 02.07.2025 wird als nicht eingetragen veröffentlicht: Den Gläubigern der an der Verschmelzung beteiligten Rechtsträger ist, wenn sie binnen sechs Monaten nach dem Tag, an dem die Eintragung der Verschmelzung in das Register des Sitzes desjenigen Rechtsträgers, dessen Gläubiger sie sind, als bekannt gemacht gilt, ihren Anspruch nach Grund und Höhe schriftlich anmelden, Sicherheit zu leisten, soweit sie nicht Befriedigung verlangen können. Dieses Recht steht den Gläubigern jedoch nur zu, wenn sie glaubhaft machen, dass durch die Verschmelzung die Erfüllung ihrer Forderung gefährdet wird. Das Recht, Sicherheitsleistung zu verlangen, steht Gläubigern nicht zu, die im Falle der Insolvenz ein Recht auf vorzugsweise Befriedigung aus einer Deckungsmasse haben, die nach gesetzlicher Vorschrift zu ihrem Schutz errichtet und staatlich überwacht ist."
    },
    {
      "date": "2025-07-02",
      "id": "114270",
      "original_text": "Löschungsankündigung\nBerlin Amtsgericht Berlin (Charlottenburg) HRB 76573\neokomma Aktiengesellschaft Biosupermarkt – Berlin",
      "type": "Löschungsankündigung",
      "state": "Berlin",
      "amtsgericht": "Amtsgericht Berlin (Charlottenburg)",
      "registernummer": "HRB 76573",
      "registerart": "HRB",
      "company_name": "eokomma Aktiengesellschaft Biosupermarkt",
      "company_seat": "Berlin",
      "details": "02.07.2025 (Bekanntmachungsdatum)\n\nBerlin Amtsgericht Berlin (Charlottenburg) HRB 76573\nLöschungsankündigung\n\neokomma Aktiengesellschaft Biosupermarkt\nAktiengesellschaft\nBerlin\n\nBei der nachstehenden Gesellschaft wird das Amtslöschungsverfahren gemäß § 394 FamFG eingeleitet. Widerspruchsfrist 6 Wochen"
    },
    {
      "date": "2025-07-02",
      "id": "114271",
      "original_text": "Registerbekanntmachung nach dem Umwandlungsgesetz\nSchleswig-Holstein Amtsgericht Kiel HRB 28284\nLukas Asset Management GmbH – Norderstedt",
      "type": "Registerbekanntmachung nach dem Umwandlungsgesetz",
      "state": "Schleswig-Holstein",
      "amtsgericht": "Amtsgericht Kiel",
      "registernummer": "HRB 28284",
      "registerart": "HRB",
      "company_name": "Lukas Asset Management GmbH",
      "company_seat": "Norderstedt",
      "details": "02.07.2025 (Bekanntmachungsdatum)\n\nSchleswig-Holstein Amtsgericht Kiel HRB 28284\nRegisterbekanntmachung nach dem Umwandlungsgesetz 01.07.2025 (Eintragungsdatum)\n\nLukas Asset Management GmbH\nGesellschaft mit beschränkter Haftung\nNorderstedt\n\nZu Eintragungsnummer 1 vom 01.07.2025 wird als nicht eingetragen veröffentlicht:\nDen Gläubigern ist, wenn sie binnen sechs Monaten nach dem Tag, an dem die Eintragung der Umwandlung bekannt gemacht worden ist, ihren Anspruch nach Grund und Höhe schriftlich anmelden, Sicherheit zu leisten, soweit sie nicht Befriedigung verlangen können. Dieses Recht steht den Gläubigern jedoch nur zu, wenn sie glaubhaft machen, dass durch die Umwandlung die Erfüllung ihrer Forderung gefährdet wird."
    },
    {
      "date": "2025-07-02",
      "id": "114272",
      "original_text": "Löschungsankündigung\nThüringen Amtsgericht Jena HRB 110916\nBCV Agenturgemeinschaft Erfurt GmbH – Erfurt",
      "type": "Löschungsankündigung",
      "state": "Thüringen",
      "amtsgericht": "Amtsgericht Jena",
      "registernummer": "HRB 110916",
      "registerart": "HRB",
      "company_name": "BCV Agenturgemeinschaft Erfurt GmbH",
      "company_seat": "Erfurt",
      "details": "02.07.2025 (Bekanntmachungsdatum)\n\nThüringen Amtsgericht Jena HRB 110916\nLöschungsankündigung\n\nBCV Agenturgemeinschaft Erfurt GmbH\nGesellschaft mit beschränkter Haftung\nErfurt\n\nDas Registergericht beabsichtigt, die im Handelsregister eingetragene Gesellschaft wegen Vermögenslosigkeit nach § 394 FamFG von Amts wegen zu löschen. Die Frist zur Erhebung eines Widerspruchs gegen die beabsichtigte Löschung wird auf 6 Wochen festgesetzt."
    },
    {
      "date": "2025-07-02",
      "id": "114273",
      "original_text": "Löschungsankündigung\nBerlin Amtsgericht Berlin (Charlottenburg) HRA 19034\nSEGMENT GmbH & Co. Hermannstraße KG – Berlin",
      "type": "Löschungsankündigung",
      "state": "Berlin",
      "amtsgericht": "Amtsgericht Berlin (Charlottenburg)",
      "registernummer": "HRA 19034",
      "registerart": "HRA",
      "company_name": "SEGMENT GmbH & Co. Hermannstraße KG",
      "company_seat": "Berlin",
      "details": "02.07.2025 (Bekanntmachungsdatum)\n\nBerlin Amtsgericht Berlin (Charlottenburg) HRA 19034\nLöschungsankündigung\n\nSEGMENT GmbH & Co. Hermannstraße KG\nKommanditgesellschaft\nBerlin\n\nBei dem nachstehenden Unternehmen / der nachstehenden Gesellschaft wird das Amtslöschungsverfahren gemäß § 31 Abs. 2 HGB eingeleitet. Widerspruchsfrist 1 Monat"
    },
    {
      "date": "2025-07-02",
      "id": "114274",
      "original_text": "Einreichung neuer Dokumente\nBerlin Amtsgericht Berlin (Charlottenburg) HRB 182382\nHelloFresh SE – Berlin",
      "type": "Einreichung neuer Dokumente",
      "state": "Berlin",
      "amtsgericht": "Amtsgericht Berlin (Charlottenburg)",
      "registernummer": "HRB 182382",
      "registerart": "HRB",
      "company_name": "HelloFresh SE",
      "company_seat": "Berlin",
      "details": "02.07.2025 (Bekanntmachungsdatum)\n\nBerlin Amtsgericht Berlin (Charlottenburg) HRB 182382\nEinreichung neuer Dokumente\n\nHelloFresh SE\nEuropäische Aktiengesellschaft (SE)\nBerlin\n\nAls nicht eingetragen wird veröffentlicht:\nEs wurde eine neue Liste der Aufsichtsratsmitglieder eingereicht (§ 106 AktG)."
    },
    {
      "date": "2025-07-02",
      "id": "114275",
      "original_text": "Registerbekanntmachung nach dem Umwandlungsgesetz\nBrandenburg Amtsgericht Potsdam HRB 35169\nQUARTERBACK Projekt 40 GmbH – Zossen",
      "type": "Registerbekanntmachung nach dem Umwandlungsgesetz",
      "state": "Brandenburg",
      "amtsgericht": "Amtsgericht Potsdam",
      "registernummer": "HRB 35169",
      "registerart": "HRB",
      "company_name": "QUARTERBACK Projekt 40 GmbH",
      "company_seat": "Zossen",
      "details": "02.07.2025 (Bekanntmachungsdatum)\n\nBrandenburg Amtsgericht Potsdam HRB 35169\nRegisterbekanntmachung nach dem Umwandlungsgesetz 27.06.2025 (Eintragungsdatum)\n\nQUARTERBACK Projekt 40 GmbH\nGesellschaft mit beschränkter Haftung\nZossen\n\nZu Eintragungsnummer 6 vom 27.06.2025 wird als nicht eingetragen veröffentlicht:\nDen Gläubigern der an der Verschmelzung beteiligten Rechtsträger ist, wenn sie binnen sechs Monaten nach dem Tag, an dem die Eintragung der Verschmelzung in das Register des Sitzes desjenigen Rechtsträgers, dessen Gläubiger sie sind, als bekannt gemacht gilt, ihren Anspruch nach Grund und Höhe schriftlich anmelden, Sicherheit zu leisten, soweit sie nicht Befriedigung verlangen können. Dieses Recht steht den Gläubigern jedoch nur zu, wenn sie glaubhaft machen, dass durch die Verschmelzung die Erfüllung ihrer Forderung gefährdet wird"
    },
    {
      "date": "2025-07-02",
      "id": "114276",
      "original_text": "Einreichung neuer Dokumente\nBaden-Württemberg Amtsgericht Stuttgart HRB 771980\nDeutsche Immobilien-Renten AG – Stuttgart",
      "type": "Einreichung neuer Dokumente",
      "state": "Baden-Württemberg",
      "amtsgericht": "Amtsgericht Stuttgart",
      "registernummer": "HRB 771980",
      "registerart": "HRB",
      "company_name": "Deutsche Immobilien-Renten AG",
      "company_seat": "Stuttgart",
      "details": "02.07.2025 (Bekanntmachungsdatum)\n\nBaden-Württemberg Amtsgericht Stuttgart HRB 771980\nEinreichung neuer Dokumente 02.07.2025 (Eintragungsdatum)\n\nDeutsche Immobilien-Renten AG\nAktiengesellschaft\nStuttgart\n\nAls nicht eingetragen wird bekanntgemacht:\nDie Gesellschaft hat am 13.06.2025 die Liste über die Zusammensetzung des Aufsichtsrats zum Handelsregister eingereicht."
    },
    {
      "date": "2025-07-02",
      "id": "114277",
      "original_text": "Löschungsankündigung\nSchleswig-Holstein Amtsgericht Flensburg HRB 10252\nHerbert Florian Buchholzer Verwaltungs GmbH – Simonsberg",
      "type": "Löschungsankündigung",
      "state": "Schleswig-Holstein",
      "amtsgericht": "Amtsgericht Flensburg",
      "registernummer": "HRB 10252",
      "registerart": "HRB",
      "company_name": "Herbert Florian Buchholzer Verwaltungs GmbH",
      "company_seat": "Simonsberg",
      "details": "02.07.2025 (Bekanntmachungsdatum)\n\nSchleswig-Holstein Amtsgericht Flensburg HRB 10252\nLöschungsankündigung\n\nHerbert Florian Buchholzer Verwaltungs GmbH\nGesellschaft mit beschränkter Haftung\nSimonsberg\n\nEs ist die Löschung der nachstehenden Gesellschaft wegen Vermögenslosigkeit gemäß § 394 FamFG beabsichtigt.\nWiderspruchsfrist: 2 Monate"
    },
    {
      "date": "2025-07-02",
      "id": "114278",
      "original_text": "Löschungsankündigung\nSchleswig-Holstein Amtsgericht Lübeck HRB 23957\nEnergiesysteme Rosenzweig Verwaltungs GmbH – Stockelsdorf",
      "type": "Löschungsankündigung",
      "state": "Schleswig-Holstein",
      "amtsgericht": "Amtsgericht Lübeck",
      "registernummer": "HRB 23957",
      "registerart": "HRB",
      "company_name": "Energiesysteme Rosenzweig Verwaltungs GmbH",
      "company_seat": "Stockelsdorf",
      "details": "02.07.2025 (Bekanntmachungsdatum)\n\nSchleswig-Holstein Amtsgericht Lübeck HRB 23957\nLöschungsankündigung\n\nEnergiesysteme Rosenzweig Verwaltungs GmbH\nGesellschaft mit beschränkter Haftung\nStockelsdorf\n\nEs ist die Löschung der nachstehenden Gesellschaft wegen Vermögenslosigkeit gemäß § 394 FamFG beabsichtigt. Widerspruchsfrist: 1 Monat."
    },
    {
      "date": "2025-07-02",
      "id": "114279",
      "original_text": "Löschungsankündigung\nBerlin Amtsgericht Berlin (Charlottenburg) HRB 220343\nBK Fahrzeugveredelung UG (haftungsbeschränkt) – Berlin",
      "type": "Löschungsankündigung",
      "state": "Berlin",
      "amtsgericht": "Amtsgericht Berlin (Charlottenburg)",
      "registernummer": "HRB 220343",
      "registerart": "HRB",
      "company_name": "BK Fahrzeugveredelung UG (haftungsbeschränkt)",
      "company_seat": "Berlin",
      "details": "02.07.2025 (Bekanntmachungsdatum)\n\nBerlin Amtsgericht Berlin (Charlottenburg) HRB 220343\nLöschungsankündigung\n\nBK Fahrzeugveredelung UG (haftungsbeschränkt)\nGesellschaft mit beschränkter Haftung\nBerlin\n\nBei der nachstehenden Gesellschaft wird das Amtslöschungsverfahren gemäß § 394 FamFG eingeleitet. Widerspruchsfrist\n6 Wochen."
    },
    {
      "date": "2025-07-02",
      "id": "114280",
      "original_text": "Registerbekanntmachung nach dem Umwandlungsgesetz\nBaden-Württemberg Amtsgericht Ulm HRB 730918\nAgrarhandel Erhardt GmbH – Ulm",
      "type": "Registerbekanntmachung nach dem Umwandlungsgesetz",
      "state": "Baden-Württemberg",
      "amtsgericht": "Amtsgericht Ulm",
      "registernummer": "HRB 730918",
      "registerart": "HRB",
      "company_name": "Agrarhandel Erhardt GmbH",
      "company_seat": "Ulm",
      "details": "02.07.2025 (Bekanntmachungsdatum)\n\nBaden-Württemberg Amtsgericht Ulm HRB 730918\nRegisterbekanntmachung nach dem Umwandlungsgesetz 02.07.2025 (Eintragungsdatum)\n\nAgrarhandel Erhardt GmbH\nGesellschaft mit beschränkter Haftung\nUlm\n\nAls nicht eingetragen wird bekanntgemacht:\nDen Gläubigern der an der Verschmelzung beteiligten Rechtsträger ist, wenn sie binnen sechs Monaten nach dem Tag, an dem die Eintragung der Verschmelzung in das Register des Sitzes desjenigen Rechtsträgers, dessen Gläubiger sie sind, nach § 19 Abs. 3 UmwG als bekanntgemacht gilt, ihren Anspruch nach Grund und Höhe schriftlich anmelden, Sicherheit zu leisten, soweit sie nicht Befriedigung verlangen können. Dieses Recht steht den Gläubigern jedoch nur zu, wenn sie glaubhaft machen, dass durch die Verschmelzung die Erfüllung ihrer Forderung gefährdet wird."
    },
    {
      "date": "2025-07-02",
      "id": "114281",
      "original_text": "Registerbekanntmachung nach dem Umwandlungsgesetz\nBaden-Württemberg Amtsgericht Ulm HRB 1892\nBeiselen GmbH – Ulm",
      "type": "Registerbekanntmachung nach dem Umwandlungsgesetz",
      "state": "Baden-Württemberg",
      "amtsgericht": "Amtsgericht Ulm",
      "registernummer": "HRB 1892",
      "registerart": "HRB",
      "company_name": "Beiselen GmbH",
      "company_seat": "Ulm",
      "details": "02.07.2025 (Bekanntmachungsdatum)\n\nBaden-Württemberg Amtsgericht Ulm HRB 1892\nRegisterbekanntmachung nach dem Umwandlungsgesetz 02.07.2025 (Eintragungsdatum)\n\nBeiselen GmbH\nGesellschaft mit beschränkter Haftung\nUlm\n\nAls nicht eingetragen wird bekanntgemacht:\nDen Gläubigern der an der Verschmelzung beteiligten Rechtsträger ist, wenn sie binnen sechs Monaten nach dem Tag, an dem die Eintragung der Verschmelzung in das Register des Sitzes desjenigen Rechtsträgers, dessen Gläubiger sie sind, nach § 19 Abs. 3 UmwG als bekanntgemacht gilt, ihren Anspruch nach Grund und Höhe schriftlich anmelden, Sicherheit zu leisten, soweit sie nicht Befriedigung verlangen können. Dieses Recht steht den Gläubigern jedoch nur zu, wenn sie glaubhaft machen, dass durch die Verschmelzung die Erfüllung ihrer Forderung gefährdet wird."
    },
    {
      "date": "2025-07-02",
      "id": "114282",
      "original_text": "Löschungsankündigung\nBerlin Amtsgericht Berlin (Charlottenburg) HRB 224836\nElttro Elektrotechnik UG (haftungsbeschränkt) – Berlin",
      "type": "Löschungsankündigung",
      "state": "Berlin",
      "amtsgericht": "Amtsgericht Berlin (Charlottenburg)",
      "registernummer": "HRB 224836",
      "registerart": "HRB",
      "company_name": "Elttro Elektrotechnik UG (haftungsbeschränkt)",
      "company_seat": "Berlin",
      "details": "02.07.2025 (Bekanntmachungsdatum)\n\nBerlin Amtsgericht Berlin (Charlottenburg) HRB 224836\nLöschungsankündigung\n\nElttro Elektrotechnik UG (haftungsbeschränkt)\nGesellschaft mit beschränkter Haftung\nBerlin\n\nBei der nachstehenden Gesellschaft wird das Amtslöschungsverfahren gemäß § 394 FamFG eingeleitet. Widerspruchsfrist 6 Wochen"
    },
    {
      "date": "2025-07-02",
      "id": "114283",
      "original_text": "Einreichung neuer Dokumente\nBerlin Amtsgericht Berlin (Charlottenburg) HRB 245375\nBudimex Bau GmbH – Berlin",
      "type": "Einreichung neuer Dokumente",
      "state": "Berlin",
      "amtsgericht": "Amtsgericht Berlin (Charlottenburg)",
      "registernummer": "HRB 245375",
      "registerart": "HRB",
      "company_name": "Budimex Bau GmbH",
      "company_seat": "Berlin",
      "details": "02.07.2025 (Bekanntmachungsdatum)\n\nBerlin Amtsgericht Berlin (Charlottenburg) HRB 245375\nEinreichung neuer Dokumente\n\nBudimex Bau GmbH\nGesellschaft mit beschränkter Haftung\nBerlin\n\nAls nicht eingetragen wird veröffentlicht: Es wurde eine neue Liste der Aufsichtsratsmitglieder eingereicht (§52 GmbHG)."
    },
    {
      "date": "2025-07-02",
      "id": "114284",
      "original_text": "Registerbekanntmachung nach dem Umwandlungsgesetz\nSchleswig-Holstein Amtsgericht Kiel HRB 10296\nScopevisio FibuNet GmbH – Kaltenkirchen",
      "type": "Registerbekanntmachung nach dem Umwandlungsgesetz",
      "state": "Schleswig-Holstein",
      "amtsgericht": "Amtsgericht Kiel",
      "registernummer": "HRB 10296",
      "registerart": "HRB",
      "company_name": "Scopevisio FibuNet GmbH",
      "company_seat": "Kaltenkirchen",
      "details": "02.07.2025 (Bekanntmachungsdatum)\n\nSchleswig-Holstein Amtsgericht Kiel HRB 10296\nRegisterbekanntmachung nach dem Umwandlungsgesetz 01.07.2025 (Eintragungsdatum)\n\nScopevisio FibuNet GmbH\nGesellschaft mit beschränkter Haftung\nKaltenkirchen\n\nZu Eintragungsnummer 11 vom 01.07.2025 wird als nicht eingetragen veröffentlicht: Den Gläubigern der an der Verschmelzung beteiligten Rechtsträger ist, wenn sie binnen sechs Monaten nach dem Tag, an dem die Eintragung der Verschmelzung in das Register des Sitzes desjenigen Rechtsträgers, dessen Gläubiger sie sind, nach § 19 Abs. 3 UmwG bekannt gemacht worden ist, ihren Anspruch nach Grund und Höhe schriftlich anmelden, Sicherheit zu leisten, soweit sie nicht Befriedigung verlangen können. Dieses Recht steht den Gläubigern jedoch nur zu, wenn sie glaubhaft machen, dass durch die Verschmelzung die Erfüllung ihrer Forderung gefährdet wird."
    },
    {
      "date": "2025-07-02",
      "id": "114285",
      "original_text": "Löschungsankündigung\nSchleswig-Holstein Amtsgericht Pinneberg HRB 15256\nHarbort & Söhne UG (haftungsbeschränkt) – Halstenbek",
      "type": "Löschungsankündigung",
      "state": "Schleswig-Holstein",
      "amtsgericht": "Amtsgericht Pinneberg",
      "registernummer": "HRB 15256",
      "registerart": "HRB",
      "company_name": "Harbort & Söhne UG (haftungsbeschränkt)",
      "company_seat": "Halstenbek",
      "details": "02.07.2025 (Bekanntmachungsdatum)\n\nSchleswig-Holstein Amtsgericht Pinneberg HRB 15256\nLöschungsankündigung\n\nHarbort & Söhne UG (haftungsbeschränkt)\nGesellschaft mit beschränkter Haftung\nHalstenbek\n\nEs ist die Löschung der nachstehenden Gesellschaft wegen Vermögenslosigkeit gemäß § 394 FamFG beabsichtigt. Widerspruchsfrist: 2 Monate."
    },
    {
      "date": "2025-07-02",
      "id": "114286",
      "original_text": "Einreichung neuer Dokumente\nBerlin Amtsgericht Berlin (Charlottenburg) HRB 321\nTUI AG – Berlin und Hannover",
      "type": "Einreichung neuer Dokumente",
      "state": "Berlin",
      "amtsgericht": "Amtsgericht Berlin (Charlottenburg)",
      "registernummer": "HRB 321",
      "registerart": "HRB",
      "company_name": "TUI AG",
      "company_seat": "Berlin und Hannover",
      "details": "02.07.2025 (Bekanntmachungsdatum)\n\nBerlin Amtsgericht Berlin (Charlottenburg) HRB 321\nEinreichung neuer Dokumente\n\nTUI AG\nAktiengesellschaft\nBerlin und Hannover\n\nAls nicht eingetragen wird veröffentlicht: Es wurde eine neue Liste der Aufsichtsratsmitglieder eingereicht (§ 106 AktG)."
    },
    {
      "date": "2025-07-02",
      "id": "114287",
      "original_text": "Löschungsankündigung\nBerlin Amtsgericht Berlin (Charlottenburg) HRB 246665\nSecure & more GmbH – Berlin",
      "type": "Löschungsankündigung",
      "state": "Berlin",
      "amtsgericht": "Amtsgericht Berlin (Charlottenburg)",
      "registernummer": "HRB 246665",
      "registerart": "HRB",
      "company_name": "Secure & more GmbH",
      "company_seat": "Berlin",
      "details": "02.07.2025 (Bekanntmachungsdatum)\n\nBerlin Amtsgericht Berlin (Charlottenburg) HRB 246665\nLöschungsankündigung\n\nSecure & more GmbH\nGesellschaft mit beschränkter Haftung\nBerlin\n\nBei der nachstehenden Gesellschaft wird das Amtslöschungsverfahren gemäß § 394 FamFG eingeleitet. Widerspruchsfrist 6 Wochen"
    },
    {
      "date": "2025-07-02",
      "id": "114288",
      "original_text": "Löschungsankündigung\nBerlin Amtsgericht Berlin (Charlottenburg) HRB 162464\nj & t Designkiosk GmbH – Berlin",
      "type": "Löschungsankündigung",
      "state": "Berlin",
      "amtsgericht": "Amtsgericht Berlin (Charlottenburg)",
      "registernummer": "HRB 162464",
      "registerart": "HRB",
      "company_name": "j & t Designkiosk GmbH",
      "company_seat": "Berlin",
      "details": "02.07.2025 (Bekanntmachungsdatum)\n\nBerlin Amtsgericht Berlin (Charlottenburg) HRB 162464\nLöschungsankündigung\n\nj & t Designkiosk GmbH\nGesellschaft mit beschränkter Haftung\nBerlin\n\nBei der nachstehenden Gesellschaft wird das Amtslöschungsverfahren gemäß § 394 FamFG eingeleitet. Widerspruchsfrist 8 Wochen"
    },
    {
      "date": "2025-07-02",
      "id": "114289",
      "original_text": "Registerbekanntmachung nach dem Umwandlungsgesetz\nBerlin Amtsgericht Berlin (Charlottenburg) HRB 221423\nF E N - Fascination Education Network GmbH – Berlin",
      "type": "Registerbekanntmachung nach dem Umwandlungsgesetz",
      "state": "Berlin",
      "amtsgericht": "Amtsgericht Berlin (Charlottenburg)",
      "registernummer": "HRB 221423",
      "registerart": "HRB",
      "company_name": "F E N - Fascination Education Network GmbH",
      "company_seat": "Berlin",
      "details": "02.07.2025 (Bekanntmachungsdatum)\n\nBerlin Amtsgericht Berlin (Charlottenburg) HRB 221423\nRegisterbekanntmachung nach dem Umwandlungsgesetz 01.07.2025 (Eintragungsdatum)\n\nF E N - Fascination Education Network GmbH\nGesellschaft mit beschränkter Haftung\nBerlin\n\nZu Eintragungsnummer 3 vom 01.07.2025 wird als nicht eingetragen veröffentlicht: Den Gläubigern der an der Verschmelzung beteiligten Rechtsträger ist, wenn sie binnen sechs Monaten nach dem Tag, an dem die Eintragung der Verschmelzung in das Register des Sitzes desjenigen Rechtsträgers, dessen Gläubiger sie sind, als bekannt gemacht gilt, ihren Anspruch nach Grund und Höhe schriftlich anmelden, Sicherheit zu leisten, soweit sie nicht Befriedigung verlangen können. Dieses Recht steht den Gläubigern jedoch nur zu, wenn sie glaubhaft machen, dass durch die Verschmelzung die Erfüllung ihrer Forderung gefährdet wird. Das Recht, Sicherheitsleistung zu verlangen, steht Gläubigern nicht zu, die im Falle der Insolvenz ein Recht auf vorzugsweise Befriedigung aus einer Deckungsmasse haben, die nach gesetzlicher Vorschrift zu ihrem Schutz errichtet und staatlich überwacht ist."
    },
    {
      "date": "2025-07-02",
      "id": "114290",
      "original_text": "Registerbekanntmachung nach dem Umwandlungsgesetz\nBerlin Amtsgericht Berlin (Charlottenburg) HRB 82709\nMilner Vermögensverwaltungs GmbH – Berlin",
      "type": "Registerbekanntmachung nach dem Umwandlungsgesetz",
      "state": "Berlin",
      "amtsgericht": "Amtsgericht Berlin (Charlottenburg)",
      "registernummer": "HRB 82709",
      "registerart": "HRB",
      "company_name": "Milner Vermögensverwaltungs GmbH",
      "company_seat": "Berlin",
      "details": "02.07.2025 (Bekanntmachungsdatum)\n\nBerlin Amtsgericht Berlin (Charlottenburg) HRB 82709\nRegisterbekanntmachung nach dem Umwandlungsgesetz\n\nMilner Vermögensverwaltungs GmbH\nGesellschaft mit beschränkter Haftung\nBerlin\n\nAls nicht eingetragen wird veröffentlicht: 1) Die Gesellschaft hat einen Plan betreffend eine grenzüberschreitende Verschmelzung einer niederländischen Gesellschaft auf die Gesellschaft beim Handelsregister eingereicht.\n\n2) An der Verschmelzung beteiligt sind die MVV Dutch Solar B.V., eine Gesellschaft mit beschränkter Haftung nach niederländischem Recht mit Sitz in Amsterdam, Niederlande, als übertragende Gesellschaft und die Milner Vermögensverwaltungs GmbH, eine Gesellschaft mit beschränkter Haftung nach deutschem Recht mit Sitz in Berlin, Deutschland, als übernehmende Gesellschaft.\n\n3) Die übertragende Gesellschaft ist eingetragen im von der niederländischen\nHandelskammer (\"Kamer van Koophandel\") geführten Handelsregister unter der Nummer CCI 76610470. Die übernehmende Gesellschaft ist eingetragen im Handelsregister des Amtsgerichts Charlottenburg unter HRB 82709 B.\n\n4) Am 6. Oktober 2025 soll die Gesellschafterversammlung der Milner\nVermögensverwaltungs GmbH über die Zustimmung zu dem Verschmelzungsplan beschließen.\n\nBis spätestens fünf Arbeitstage vor dem 6. Oktober 2025 können daher\n\na) die Gesellschafter der Milner Vermögensverwaltungs GmbH und die Gesellschafter der MVV Dutch Solar B.V.,\nb) die Gläubiger der an der grenzüberschreitenden Verschmelzung beteiligten Gesellschaften und\nc) die Arbeitnehmer der Milner Vermögensverwaltungs GmbH und der MVV Dutch Solar B.V.\n\nder jeweiligen Gesellschaft Bemerkungen zum Verschmelzungsplan übermitteln.\n\nDie Bemerkungen können an die Milner Vermögensverwaltungs GmbH unter der Geschäftsanschrift Ernst-Ring-Straße 4, 14129 Berlin, Deutschland, gerichtet werden."
    },
    {
      "date": "2025-07-02",
      "id": "114291",
      "original_text": "Löschungsankündigung\nBrandenburg Amtsgericht Potsdam HRB 28799\nRS Grill & Genuss UG (haftungsbeschränkt) – Potsdam",
      "type": "Löschungsankündigung",
      "state": "Brandenburg",
      "amtsgericht": "Amtsgericht Potsdam",
      "registernummer": "HRB 28799",
      "registerart": "HRB",
      "company_name": "RS Grill & Genuss UG (haftungsbeschränkt)",
      "company_seat": "Potsdam",
      "details": "02.07.2025 (Bekanntmachungsdatum)\n\nBrandenburg Amtsgericht Potsdam HRB 28799\nLöschungsankündigung\n\nRS Grill & Genuss UG (haftungsbeschränkt)\nGesellschaft mit beschränkter Haftung\nPotsdam\n\nBei der nachstehenden Gesellschaft wird das Amtslöschungsverfahren gemäß § 394 FamFG eingeleitet. Widerspruchsfrist: 8 Wochen."
    },
    {
      "date": "2025-07-02",
      "id": "114292",
      "original_text": "Registerbekanntmachung nach dem Umwandlungsgesetz\nBerlin Amtsgericht Berlin (Charlottenburg) HRB 90761\nDeufol Berlin GmbH – Berlin",
      "type": "Registerbekanntmachung nach dem Umwandlungsgesetz",
      "state": "Berlin",
      "amtsgericht": "Amtsgericht Berlin (Charlottenburg)",
      "registernummer": "HRB 90761",
      "registerart": "HRB",
      "company_name": "Deufol Berlin GmbH",
      "company_seat": "Berlin",
      "details": "02.07.2025 (Bekanntmachungsdatum)\n\nBerlin Amtsgericht Berlin (Charlottenburg) HRB 90761\nRegisterbekanntmachung nach dem Umwandlungsgesetz 01.07.2025 (Eintragungsdatum)\n\nDeufol Berlin GmbH\nGesellschaft mit beschränkter Haftung\nBerlin\n\nZu Eintragungsnummer 22 vom 01.07.2025 wird als nicht eingetragen veröffentlicht: Den Gläubigern der an der Verschmelzung beteiligten Rechtsträger ist, wenn sie binnen sechs Monaten nach dem Tag, an dem die Eintragung der Verschmelzung in das Register des Sitzes desjenigen Rechtsträgers, dessen Gläubiger sie sind, als bekannt gemacht gilt, ihren Anspruch nach Grund und Höhe schriftlich anmelden, Sicherheit zu leisten, soweit sie nicht Befriedigung verlangen können. Dieses Recht steht den Gläubigern jedoch nur zu, wenn sie glaubhaft machen, dass durch die Verschmelzung die Erfüllung ihrer Forderung gefährdet wird. Das Recht, Sicherheitsleistung zu verlangen, steht Gläubigern nicht zu, die im Falle der Insolvenz ein Recht auf vorzugsweise Befriedigung aus einer Deckungsmasse haben, die nach gesetzlicher Vorschrift zu ihrem Schutz errichtet und staatlich überwacht ist."
    },
    {
      "date": "2025-07-02",
      "id": "114293",
      "original_text": "Sonstige Registerbekanntmachung\nBaden-Württemberg Amtsgericht Mannheim HRB 712634\nABC Technologies Karl Etzel GmbH – Mühlacker",
      "type": "Sonstige Registerbekanntmachung",
      "state": "Baden-Württemberg",
      "amtsgericht": "Amtsgericht Mannheim",
      "registernummer": "HRB 712634",
      "registerart": "HRB",
      "company_name": "ABC Technologies Karl Etzel GmbH",
      "company_seat": "Mühlacker",
      "details": "02.07.2025 (Bekanntmachungsdatum)\n\nBaden-Württemberg Amtsgericht Mannheim HRB 712634\nSonstige Registerbekanntmachung 02.07.2025 (Eintragungsdatum)\n\nABC Technologies Karl Etzel GmbH\nGesellschaft mit beschränkter Haftung\nMühlacker\n\nDen Gläubigern der Gesellschaft, deren Forderungen begründet worden sind, bevor die Eintragung der Beendigung des Vertrages in das Handelsregister nach § 10 HGB als bekanntgemacht gilt, ist vom anderen Vertragsteil Sicherheit zu leisten, wenn sie sich binnen sechs Monaten nach der Bekanntmachung zu diesem Zweck bei ihm melden."
    },
    {
      "date": "2025-07-02",
      "id": "114294",
      "original_text": "Einreichung neuer Dokumente\nSchleswig-Holstein Amtsgericht Pinneberg HRB 11290\nStadtwerke Wedel BeteiligungsGmbH – Wedel",
      "type": "Einreichung neuer Dokumente",
      "state": "Schleswig-Holstein",
      "amtsgericht": "Amtsgericht Pinneberg",
      "registernummer": "HRB 11290",
      "registerart": "HRB",
      "company_name": "Stadtwerke Wedel BeteiligungsGmbH",
      "company_seat": "Wedel",
      "details": "02.07.2025 (Bekanntmachungsdatum)\n\nSchleswig-Holstein Amtsgericht Pinneberg HRB 11290\nEinreichung neuer Dokumente\n\nStadtwerke Wedel BeteiligungsGmbH\nGesellschaft mit beschränkter Haftung\nWedel\n\nAls nicht eingetragen wird veröffentlicht: Gemäß § 10 HGB wurde eine neue Liste der Aufsichtsratsmitglieder eingereicht."
    },
    {
      "date": "2025-07-02",
      "id": "114295",
      "original_text": "Einreichung neuer Dokumente\nSchleswig-Holstein Amtsgericht Pinneberg HRB 11289\nStadtwerke Wedel Service GmbH – Wedel",
      "type": "Einreichung neuer Dokumente",
      "state": "Schleswig-Holstein",
      "amtsgericht": "Amtsgericht Pinneberg",
      "registernummer": "HRB 11289",
      "registerart": "HRB",
      "company_name": "Stadtwerke Wedel Service GmbH",
      "company_seat": "Wedel",
      "details": "02.07.2025 (Bekanntmachungsdatum)\n\nSchleswig-Holstein Amtsgericht Pinneberg HRB 11289\nEinreichung neuer Dokumente\n\nStadtwerke Wedel Service GmbH\nGesellschaft mit beschränkter Haftung\nWedel\n\nAls nicht eingetragen wird veröffentlicht: Gemäß § 10 HGB wurde eine neue Liste der Aufsichtsratsmitglieder zum Register eingereicht."
    },
    {
      "date": "2025-07-02",
      "id": "114296",
      "original_text": "Sonstige Registerbekanntmachung\nSchleswig-Holstein Amtsgericht Pinneberg HRB 5985\nKombibad Wedel GmbH – Wedel",
      "type": "Sonstige Registerbekanntmachung",
      "state": "Schleswig-Holstein",
      "amtsgericht": "Amtsgericht Pinneberg",
      "registernummer": "HRB 5985",
      "registerart": "HRB",
      "company_name": "Kombibad Wedel GmbH",
      "company_seat": "Wedel",
      "details": "02.07.2025 (Bekanntmachungsdatum)\n\nSchleswig-Holstein Amtsgericht Pinneberg HRB 5985\nSonstige Registerbekanntmachung\n\nKombibad Wedel GmbH\nGesellschaft mit beschränkter Haftung\nWedel\n\nAls nicht eingetragen wird veröffentlicht: Eine neue Liste der Aufsichtsratmitglieder wurde zum Handelsregister eingereicht."
    },
    {
      "date": "2025-07-02",
      "id": "114297",
      "original_text": "Registerbekanntmachung nach dem Umwandlungsgesetz\nBerlin Amtsgericht Berlin (Charlottenburg) HRB 140490\nias Aktiengesellschaft – Berlin",
      "type": "Registerbekanntmachung nach dem Umwandlungsgesetz",
      "state": "Berlin",
      "amtsgericht": "Amtsgericht Berlin (Charlottenburg)",
      "registernummer": "HRB 140490",
      "registerart": "HRB",
      "company_name": "ias Aktiengesellschaft",
      "company_seat": "Berlin",
      "details": "02.07.2025 (Bekanntmachungsdatum)\n\nBerlin Amtsgericht Berlin (Charlottenburg) HRB 140490\nRegisterbekanntmachung nach dem Umwandlungsgesetz 01.07.2025 (Eintragungsdatum)\n\nias Aktiengesellschaft\nAktiengesellschaft\nBerlin\n\nZu Eintragungsnummer 31 vom 01.07.2025 wird als nicht eingetragen veröffentlicht:Den Gläubigern der an der Spaltung beteiligten Rechtsträger ist, wenn sie binnen sechs Monaten nach dem Tag, an dem die Eintragung der Spaltung in das Register des Sitzes desjenigen Rechtsträgers, dessen Gläubiger sie sind, als bekannt gemacht gilt, ihren Anspruch nach Grund und Höhe schriftlich anmelden, Sicherheit zu leisten, soweit sie nicht Befriedigung verlangen können. Dieses Recht steht den Gläubigern jedoch nur zu, wenn sie glaubhaft machen, dass durch die Spaltung die Erfüllung ihrer Forderung gefährdet wird. Das Recht, Sicherheitsleistung zu verlangen, steht Gläubigern nicht zu, die im Falle der Insolvenz ein Recht auf vorzugsweise Befriedigung aus einer Deckungsmasse haben, die nach gesetzlicher Vorschrift zu ihrem Schutz errichtet und staatlich überwacht ist."
    },
    {
      "date": "2025-07-02",
      "id": "114298",
      "original_text": "Registerbekanntmachung nach dem Umwandlungsgesetz\nBaden-Württemberg Amtsgericht Freiburg HRB 611606\nMETZ CONNECT GmbH – Blumberg",
      "type": "Registerbekanntmachung nach dem Umwandlungsgesetz",
      "state": "Baden-Württemberg",
      "amtsgericht": "Amtsgericht Freiburg",
      "registernummer": "HRB 611606",
      "registerart": "HRB",
      "company_name": "METZ CONNECT GmbH",
      "company_seat": "Blumberg",
      "details": "02.07.2025 (Bekanntmachungsdatum)\n\nBaden-Württemberg Amtsgericht Freiburg HRB 611606\nRegisterbekanntmachung nach dem Umwandlungsgesetz 02.07.2025 (Eintragungsdatum)\n\nMETZ CONNECT GmbH\nGesellschaft mit beschränkter Haftung\nBlumberg\n\nAls nicht eingetragen wird bekanntgemacht:\nDen Gläubigern der an der Verschmelzung beteiligten Rechtsträger ist, wenn sie binnen sechs Monaten nach dem Tag, an dem die Eintragung der Verschmelzung in das Register des Sitzes desjenigen Rechtsträgers, dessen Gläubiger sie sind, nach § 19 Abs. 3 UmwG als bekanntgemacht gilt, ihren Anspruch nach Grund und Höhe schriftlich anmelden, Sicherheit zu leisten, soweit sie nicht Befriedigung verlangen können. Dieses Recht steht den Gläubigern jedoch nur zu, wenn sie glaubhaft machen, dass durch die Verschmelzung die Erfüllung ihrer Forderung gefährdet wird."
    },
    {
      "date": "2025-07-02",
      "id": "114299",
      "original_text": "Registerbekanntmachung nach dem Umwandlungsgesetz\nBaden-Württemberg Amtsgericht Freiburg HRB 611650\nMETZ CONNECT TECH GmbH – Blumberg",
      "type": "Registerbekanntmachung nach dem Umwandlungsgesetz",
      "state": "Baden-Württemberg",
      "amtsgericht": "Amtsgericht Freiburg",
      "registernummer": "HRB 611650",
      "registerart": "HRB",
      "company_name": "METZ CONNECT TECH GmbH",
      "company_seat": "Blumberg",
      "details": "02.07.2025 (Bekanntmachungsdatum)\n\nBaden-Württemberg Amtsgericht Freiburg HRB 611650\nRegisterbekanntmachung nach dem Umwandlungsgesetz 02.07.2025 (Eintragungsdatum)\n\nMETZ CONNECT TECH GmbH\nGesellschaft mit beschränkter Haftung\nBlumberg\n\nDen Gläubigern der an der Verschmelzung beteiligten Rechtsträger ist, wenn sie binnen sechs Monaten nach dem Tag, an dem die Eintragung der Verschmelzung in das Register des Sitzes desjenigen Rechtsträgers, dessen Gläubiger sie sind, nach § 19 Abs. 3 UmwG als bekanntgemacht gilt, ihren Anspruch nach Grund und Höhe schriftlich anmelden, Sicherheit zu leisten, soweit sie nicht Befriedigung verlangen können. Dieses Recht steht den Gläubigern jedoch nur zu, wenn sie glaubhaft machen, dass durch die Verschmelzung die Erfüllung ihrer Forderung gefährdet wird."
    },
    {
      "date": "2025-07-02",
      "id": "114300",
      "original_text": "Registerbekanntmachung nach dem Umwandlungsgesetz\nSachsen Amtsgericht Leipzig HRA 19364\nS. K. Reinigungsservice Leipzig e. K. – Leipzig",
      "type": "Registerbekanntmachung nach dem Umwandlungsgesetz",
      "state": "Sachsen",
      "amtsgericht": "Amtsgericht Leipzig",
      "registernummer": "HRA 19364",
      "registerart": "HRA",
      "company_name": "S. K. Reinigungsservice Leipzig e. K.",
      "company_seat": "Leipzig",
      "details": "02.07.2025 (Bekanntmachungsdatum)\n\nSachsen Amtsgericht Leipzig HRA 19364\nRegisterbekanntmachung nach dem Umwandlungsgesetz 02.07.2025 (Eintragungsdatum)\n\nS. K. Reinigungsservice Leipzig e. K.\nEinzelkaufmann / Einzelkauffrau\nLeipzig\n\nDen Gläubigern der Gesellschaft, deren Forderungen begründet worden sind, bevor die Eintragung des Kapitalherabsetzungsbeschlusses in das Handelsregister bekanntgemacht worden ist, ist gemäß § 225 AktG, wenn sie sich binnen sechs Monaten nach der Bekanntmachung bei der Gesellschaft zu diesem Zweck melden, Sicherheit zu leisten, soweit sie nicht Befriedigung verlangen können.Den Gläubigern der an der Ausgliederung beteiligten Rechtsträger ist, wenn sie binnen sechs Monaten nach dem Tag, an dem die Eintragung der Ausgliederung in das Register des Sitzes desjenigen Rechtsträgers, dessen Gläubiger sie sind, nach § 19 Abs. 3 UmwG als bekannt gemacht gilt, ihren Anspruch nach Grund und Höhe in Textform anmelden, Sicherheit zu leisten, soweit sie nicht Befriedigung verlangen können. Dieses Recht steht den Gläubigern jedoch nur zu, wenn sie glaubhaft machen, dass durch die Ausgliederung die Erfüllung der Forderung gefährdet wird."
    },
    {
      "date": "2025-07-02",
      "id": "114301",
      "original_text": "Registerbekanntmachung nach dem Umwandlungsgesetz\nSachsen Amtsgericht Leipzig HRB 738\nLandmaschinenvertrieb Deuben GmbH – Bennewitz",
      "type": "Registerbekanntmachung nach dem Umwandlungsgesetz",
      "state": "Sachsen",
      "amtsgericht": "Amtsgericht Leipzig",
      "registernummer": "HRB 738",
      "registerart": "HRB",
      "company_name": "Landmaschinenvertrieb Deuben GmbH",
      "company_seat": "Bennewitz",
      "details": "02.07.2025 (Bekanntmachungsdatum)\n\nSachsen Amtsgericht Leipzig HRB 738\nRegisterbekanntmachung nach dem Umwandlungsgesetz 02.07.2025 (Eintragungsdatum)\n\nLandmaschinenvertrieb Deuben GmbH\nGesellschaft mit beschränkter Haftung\nBennewitz\n\nDen Gläubigern der an der Verschmelzung beteiligten Rechtsträger ist, wenn sie binnen sechs Monaten nach dem Tag, an dem die Eintragung der Verschmelzung in das Register des Sitzes desjenigen Rechtsträgers, dessen Gläubiger sie sind, nach § 19 Abs. 3 UmwG als bekannt gemacht gilt, ihren Anspruch nach Grund und Höhe in Textform anmelden, Sicherheit zu leisten, soweit sie nicht Befriedigung verlangen können. Dieses Recht steht den Gläubigern jedoch nur zu, wenn sie glaubhaft machen, dass durch die Verschmelzung die Erfüllung der Forderung gefährdet wird."
    },
    {
      "date": "2025-07-02",
      "id": "114302",
      "original_text": "Registerbekanntmachung nach dem Umwandlungsgesetz\nSachsen Amtsgericht Dresden HRB 24395\nAstella GmbH – Dresden",
      "type": "Registerbekanntmachung nach dem Umwandlungsgesetz",
      "state": "Sachsen",
      "amtsgericht": "Amtsgericht Dresden",
      "registernummer": "HRB 24395",
      "registerart": "HRB",
      "company_name": "Astella GmbH",
      "company_seat": "Dresden",
      "details": "02.07.2025 (Bekanntmachungsdatum)\n\nSachsen Amtsgericht Dresden HRB 24395\nRegisterbekanntmachung nach dem Umwandlungsgesetz 02.07.2025 (Eintragungsdatum)\n\nAstella GmbH\nGesellschaft mit beschränkter Haftung\nDresden\n\nDen Gläubigern der an der Verschmelzung beteiligten Rechtsträger ist, wenn sie binnen sechs Monaten nach dem Tag, an dem die Eintragung der Verschmelzung in das Register des Sitzes desjenigen Rechtsträgers, dessen Gläubiger sie sind, nach § 19 Abs. 3 UmwG als bekannt gemacht gilt, ihren Anspruch nach Grund und Höhe in Textform anmelden, Sicherheit zu leisten, soweit sie nicht Befriedigung verlangen können. Dieses Recht steht den Gläubigern jedoch nur zu, wenn sie glaubhaft machen, dass durch die Verschmelzung die Erfüllung der Forderung gefährdet wird."
    },
    {
      "date": "2025-07-02",
      "id": "114303",
      "original_text": "Einreichung neuer Dokumente\nSachsen Amtsgericht Dresden HRB 8092\nSparkassen-Versicherung Sachsen Lebensversicherung Aktiengesellschaft – Dresden",
      "type": "Einreichung neuer Dokumente",
      "state": "Sachsen",
      "amtsgericht": "Amtsgericht Dresden",
      "registernummer": "HRB 8092",
      "registerart": "HRB",
      "company_name": "Sparkassen-Versicherung Sachsen Lebensversicherung Aktiengesellschaft",
      "company_seat": "Dresden",
      "details": "02.07.2025 (Bekanntmachungsdatum)\n\nSachsen Amtsgericht Dresden HRB 8092\nEinreichung neuer Dokumente\n\nSparkassen-Versicherung Sachsen Lebensversicherung Aktiengesellschaft\nAktiengesellschaft\nDresden\n\nAm 01.07.2025 wurde beim Handelsregister des Amtsgerichts Dresden die Liste der Mitglieder des Aufsichtsrats gemäß § 106 AktG eingereicht."
    },
    {
      "date": "2025-07-02",
      "id": "114304",
      "original_text": "Registerbekanntmachung nach dem Umwandlungsgesetz\nSachsen Amtsgericht Leipzig HRB 25475\nMIB Projektentwicklung GmbH – Leipzig",
      "type": "Registerbekanntmachung nach dem Umwandlungsgesetz",
      "state": "Sachsen",
      "amtsgericht": "Amtsgericht Leipzig",
      "registernummer": "HRB 25475",
      "registerart": "HRB",
      "company_name": "MIB Projektentwicklung GmbH",
      "company_seat": "Leipzig",
      "details": "02.07.2025 (Bekanntmachungsdatum)\n\nSachsen Amtsgericht Leipzig HRB 25475\nRegisterbekanntmachung nach dem Umwandlungsgesetz 02.07.2025 (Eintragungsdatum)\n\nMIB Projektentwicklung GmbH\nGesellschaft mit beschränkter Haftung\nLeipzig\n\nDen Gläubigern der an der Verschmelzung beteiligten Rechtsträger ist, wenn sie binnen sechs Monaten nach dem Tag, an dem die Eintragung der Verschmelzung in das Register des Sitzes desjenigen Rechtsträgers, dessen Gläubiger sie sind, nach § 19 Abs. 3 UmwG als bekannt gemacht gilt, ihren Anspruch nach Grund und Höhe in Textform anmelden, Sicherheit zu leisten, soweit sie nicht Befriedigung verlangen können. Dieses Recht steht den Gläubigern jedoch nur zu, wenn sie glaubhaft machen, dass durch die Verschmelzung die Erfüllung der Forderung gefährdet wird."
    },
    {
      "date": "2025-07-02",
      "id": "114305",
      "original_text": "Löschungsankündigung\nSachsen Amtsgericht Dresden HRB 32098\nSaxonia - Real Estate Consulting & Partnership GmbH – Dresden",
      "type": "Löschungsankündigung",
      "state": "Sachsen",
      "amtsgericht": "Amtsgericht Dresden",
      "registernummer": "HRB 32098",
      "registerart": "HRB",
      "company_name": "Saxonia - Real Estate Consulting & Partnership GmbH",
      "company_seat": "Dresden",
      "details": "02.07.2025 (Bekanntmachungsdatum)\n\nSachsen Amtsgericht Dresden HRB 32098\nLöschungsankündigung\n\nSaxonia - Real Estate Consulting & Partnership GmbH\nGesellschaft mit beschränkter Haftung\nDresden\n\nDas Registergericht beabsichtigt, die im Handelsregister eingetragene Gesellschaft von Amts wegen nach § 394 FamFG zu löschen. Die Frist zu Erhebung eines Widerspruchs gegen die beabsichtigte Löschung wird auf einen Monat festgesetzt."
    },
    {
      "date": "2025-07-02",
      "id": "114306",
      "original_text": "Löschungsankündigung\nSachsen Amtsgericht Dresden HRB 31810\nPaulick & Subzda GmbH – Groß Düben",
      "type": "Löschungsankündigung",
      "state": "Sachsen",
      "amtsgericht": "Amtsgericht Dresden",
      "registernummer": "HRB 31810",
      "registerart": "HRB",
      "company_name": "Paulick & Subzda GmbH",
      "company_seat": "Groß Düben",
      "details": "02.07.2025 (Bekanntmachungsdatum)\n\nSachsen Amtsgericht Dresden HRB 31810\nLöschungsankündigung\n\nPaulick & Subzda GmbH\nGesellschaft mit beschränkter Haftung\nGroß Düben\n\nDas Registergericht beabsichtigt, die im Handelsregister eingetragene Gesellschaft von Amts wegen nach § 394 FamFG zu löschen. Die Frist zu Erhebung eines Widerspruchs gegen die beabsichtigte Löschung wird auf einen Monat festgesetzt."
    },
    {
      "date": "2025-07-02",
      "id": "114307",
      "original_text": "Löschungsankündigung\nSachsen Amtsgericht Leipzig HRB 43270\nQUEST-ROOM Entertainment GmbH – Leipzig",
      "type": "Löschungsankündigung",
      "state": "Sachsen",
      "amtsgericht": "Amtsgericht Leipzig",
      "registernummer": "HRB 43270",
      "registerart": "HRB",
      "company_name": "QUEST-ROOM Entertainment GmbH",
      "company_seat": "Leipzig",
      "details": "02.07.2025 (Bekanntmachungsdatum)\n\nSachsen Amtsgericht Leipzig HRB 43270\nLöschungsankündigung\n\nQUEST-ROOM Entertainment GmbH\nGesellschaft mit beschränkter Haftung\nLeipzig\n\nDas Registergericht beabsichtigt, die im Handelsregister eingetragene Gesellschaft von Amts wegen nach § 394 FamFG zu löschen. Die Frist zu Erhebung eines Widerspruchs gegen die beabsichtigte Löschung wird auf einen Monat festgesetzt."
    },
    {
      "date": "2025-07-02",
      "id": "114308",
      "original_text": "Registerbekanntmachung nach dem Umwandlungsgesetz\nSachsen Amtsgericht Dresden HRB 18309\nAstacura GmbH – Dresden",
      "type": "Registerbekanntmachung nach dem Umwandlungsgesetz",
      "state": "Sachsen",
      "amtsgericht": "Amtsgericht Dresden",
      "registernummer": "HRB 18309",
      "registerart": "HRB",
      "company_name": "Astacura GmbH",
      "company_seat": "Dresden",
      "details": "02.07.2025 (Bekanntmachungsdatum)\n\nSachsen Amtsgericht Dresden HRB 18309\nRegisterbekanntmachung nach dem Umwandlungsgesetz 02.07.2025 (Eintragungsdatum)\n\nAstacura GmbH\nGesellschaft mit beschränkter Haftung\nDresden\n\nDen Gläubigern der an der Verschmelzung beteiligten Rechtsträger ist, wenn sie binnen sechs Monaten nach dem Tag, an dem die Eintragung der Verschmelzung in das Register des Sitzes desjenigen Rechtsträgers, dessen Gläubiger sie sind, nach § 19 Abs. 3 UmwG als bekannt gemacht gilt, ihren Anspruch nach Grund und Höhe in Textform anmelden, Sicherheit zu leisten, soweit sie nicht Befriedigung verlangen können. Dieses Recht steht den Gläubigern jedoch nur zu, wenn sie glaubhaft machen, dass durch die Verschmelzung die Erfüllung der Forderung gefährdet wird."
    },
    {
      "date": "2025-07-02",
      "id": "114309",
      "original_text": "Registerbekanntmachung nach dem Umwandlungsgesetz\nSachsen Amtsgericht Leipzig HRB 23291\nATL-Agrar-Beteiligungs GmbH – Wiedemar",
      "type": "Registerbekanntmachung nach dem Umwandlungsgesetz",
      "state": "Sachsen",
      "amtsgericht": "Amtsgericht Leipzig",
      "registernummer": "HRB 23291",
      "registerart": "HRB",
      "company_name": "ATL-Agrar-Beteiligungs GmbH",
      "company_seat": "Wiedemar",
      "details": "02.07.2025 (Bekanntmachungsdatum)\n\nSachsen Amtsgericht Leipzig HRB 23291\nRegisterbekanntmachung nach dem Umwandlungsgesetz 02.07.2025 (Eintragungsdatum)\n\nATL-Agrar-Beteiligungs GmbH\nGesellschaft mit beschränkter Haftung\nWiedemar\n\nDen Gläubigern der an der Verschmelzung beteiligten Rechtsträger ist, wenn sie binnen sechs Monaten nach dem Tag, an dem die Eintragung der Verschmelzung in das Register des Sitzes desjenigen Rechtsträgers, dessen Gläubiger sie sind, nach § 19 Abs. 3 UmwG als bekannt gemacht gilt, ihren Anspruch nach Grund und Höhe in Textform anmelden, Sicherheit zu leisten, soweit sie nicht Befriedigung verlangen können. Dieses Recht steht den Gläubigern jedoch nur zu, wenn sie glaubhaft machen, dass durch die Verschmelzung die Erfüllung der Forderung gefährdet wird."
    },
    {
      "date": "2025-07-02",
      "id": "114310",
      "original_text": "Registerbekanntmachung nach dem Umwandlungsgesetz\nSachsen Amtsgericht Leipzig HRB 31955\nMIB Fünfzehnte Investitionsgesellschaft mbH – Leipzig",
      "type": "Registerbekanntmachung nach dem Umwandlungsgesetz",
      "state": "Sachsen",
      "amtsgericht": "Amtsgericht Leipzig",
      "registernummer": "HRB 31955",
      "registerart": "HRB",
      "company_name": "MIB Fünfzehnte Investitionsgesellschaft mbH",
      "company_seat": "Leipzig",
      "details": "02.07.2025 (Bekanntmachungsdatum)\n\nSachsen Amtsgericht Leipzig HRB 31955\nRegisterbekanntmachung nach dem Umwandlungsgesetz 02.07.2025 (Eintragungsdatum)\n\nMIB Fünfzehnte Investitionsgesellschaft mbH\nGesellschaft mit beschränkter Haftung\nLeipzig\n\nDen Gläubigern der an der Verschmelzung beteiligten Rechtsträger ist, wenn sie binnen sechs Monaten nach dem Tag, an dem die Eintragung der Verschmelzung in das Register des Sitzes desjenigen Rechtsträgers, dessen Gläubiger sie sind, nach § 19 Abs. 3 UmwG als bekannt gemacht gilt, ihren Anspruch nach Grund und Höhe in Textform anmelden, Sicherheit zu leisten, soweit sie nicht Befriedigung verlangen können. Dieses Recht steht den Gläubigern jedoch nur zu, wenn sie glaubhaft machen, dass durch die Verschmelzung die Erfüllung der Forderung gefährdet wird."
    },
    {
      "date": "2025-07-02",
      "id": "114311",
      "original_text": "Registerbekanntmachung nach dem Umwandlungsgesetz\nSachsen Amtsgericht Dresden HRA 8021\nOriginal Oberlausitzer Baumkuchen GmbH & Co. KG – Zittau",
      "type": "Registerbekanntmachung nach dem Umwandlungsgesetz",
      "state": "Sachsen",
      "amtsgericht": "Amtsgericht Dresden",
      "registernummer": "HRA 8021",
      "registerart": "HRA",
      "company_name": "Original Oberlausitzer Baumkuchen GmbH & Co. KG",
      "company_seat": "Zittau",
      "details": "02.07.2025 (Bekanntmachungsdatum)\n\nSachsen Amtsgericht Dresden HRA 8021\nRegisterbekanntmachung nach dem Umwandlungsgesetz 02.07.2025 (Eintragungsdatum)\n\nOriginal Oberlausitzer Baumkuchen GmbH & Co. KG\nKommanditgesellschaft\nZittau\n\nDen Gläubigern der an der Umwandlung beteiligten Rechtsträger ist, wenn sie binnen sechs Monaten nach dem Tag, an dem die Eintragung der Umwandlung in das Register des Sitzes desjenigen Rechtsträgers, dessen Gläubiger sie sind, nach § 19 Abs. 3 UmwG als bekannt gemacht gilt, ihren Anspruch nach Grund und Höhe in Textform anmelden, Sicherheit zu leisten, soweit sie nicht Befriedigung verlangen können. Dieses Recht steht den Gläubigern jedoch nur zu, wenn sie glaubhaft machen, dass durch die Umwandlung die Erfüllung der Forderung gefährdet wird."
    },
    {
      "date": "2025-07-02",
      "id": "114312",
      "original_text": "Löschungsankündigung\nNiedersachsen Amtsgericht Aurich HRB 204111\nNordstrandperle - Aparthotel - Immobilienverwaltungs- GmbH – Norderney",
      "type": "Löschungsankündigung",
      "state": "Niedersachsen",
      "amtsgericht": "Amtsgericht Aurich",
      "registernummer": "HRB 204111",
      "registerart": "HRB",
      "company_name": "Nordstrandperle - Aparthotel - Immobilienverwaltungs- GmbH",
      "company_seat": "Norderney",
      "details": "02.07.2025 (Bekanntmachungsdatum)\n\nNiedersachsen Amtsgericht Aurich HRB 204111\nLöschungsankündigung\n\nNordstrandperle - Aparthotel - Immobilienverwaltungs- GmbH\nGesellschaft mit beschränkter Haftung\nNorderney\n\nDas Registergericht beabsichtigt, die Gesellschaft von Amts wegen nach § 394 FamFG zu löschen. Die Frist zur Erhebung eines Widerspruchs ist auf 1 Monat ab dieser Registerbekanntmachung festgesetzt."
    },
    {
      "date": "2025-07-02",
      "id": "114313",
      "original_text": "Löschungsankündigung\nNiedersachsen Amtsgericht Tostedt HRB 110566 früher Amtsgericht Langen\nGerd Buck GmbH – Lamstedt",
      "type": "Löschungsankündigung",
      "state": "Niedersachsen",
      "amtsgericht": "Amtsgericht Tostedt",
      "registernummer": "HRB 110566",
      "registerart": "HRB",
      "company_name": "Gerd Buck GmbH",
      "company_seat": "Lamstedt",
      "former_amtsgericht": "Langen",
      "details": "02.07.2025 (Bekanntmachungsdatum)\n\nNiedersachsen Amtsgericht Tostedt HRB 110566 früher Amtsgericht Langen\nLöschungsankündigung\n\nGerd Buck GmbH\nGesellschaft mit beschränkter Haftung\nLamstedt\n\nDas Registergericht beabsichtigt, die Gesellschaft von Amts wegen nach § 394 FamFG zu löschen. Die Frist zur Erhebung eines Widerspruchs ist auf 1 Monat ab dieser Registerbekanntmachung festgesetzt."
    },
    {
      "date": "2025-07-02",
      "id": "114314",
      "original_text": "Registerbekanntmachung nach dem Umwandlungsgesetz\nNiedersachsen Amtsgericht Osnabrück HRA 204936\nVIUS Ingenieure GmbH & Co. KG – Melle",
      "type": "Registerbekanntmachung nach dem Umwandlungsgesetz",
      "state": "Niedersachsen",
      "amtsgericht": "Amtsgericht Osnabrück",
      "registernummer": "HRA 204936",
      "registerart": "HRA",
      "company_name": "VIUS Ingenieure GmbH & Co. KG",
      "company_seat": "Melle",
      "details": "02.07.2025 (Bekanntmachungsdatum)\n\nNiedersachsen Amtsgericht Osnabrück HRA 204936\nRegisterbekanntmachung nach dem Umwandlungsgesetz 02.07.2025 (Eintragungsdatum)\n\nVIUS Ingenieure GmbH & Co. KG\nKommanditgesellschaft\nMelle\n\nDen Gläubigern der an der Verschmelzung beteiligten Rechtsträger ist, wenn sie binnen sechs Monaten nach dem Tag, an dem die Eintragung der Verschmelzung in das Register des Sitzes desjenigen Rechtsträgers, dessen Gläubiger sie sind, nach § 19  Abs.  3 UmwG als bekannt gemacht gilt, ihren Anspruch nach Grund und Höhe schriftlich anmelden, Sicherheit zu leisten, soweit sie nicht Befriedigung verlangen können. Dieses Recht steht den Gläubigern jedoch nur zu, wenn sie glaubhaft machen, dass durch die Verschmelzung die Erfüllung der Forderung gefährdet wird."
    },
    {
      "date": "2025-07-02",
      "id": "114315",
      "original_text": "Registerbekanntmachung nach dem Umwandlungsgesetz\nNiedersachsen Amtsgericht Osnabrück VR 100154\nKatholische Erwachsenenbildung Emsland Süd e.V. – Lingen (Ems)",
      "type": "Registerbekanntmachung nach dem Umwandlungsgesetz",
      "state": "Niedersachsen",
      "amtsgericht": "Amtsgericht Osnabrück",
      "registernummer": "VR 100154",
      "registerart": "VR",
      "company_name": "Katholische Erwachsenenbildung Emsland Süd e.V.",
      "company_seat": "Lingen (Ems)",
      "details": "02.07.2025 (Bekanntmachungsdatum)\n\nNiedersachsen Amtsgericht Osnabrück VR 100154\nRegisterbekanntmachung nach dem Umwandlungsgesetz 02.07.2025 (Eintragungsdatum)\n\nKatholische Erwachsenenbildung Emsland Süd e.V.\neingetragener Verein\nLingen (Ems)\n\nDen Gläubigern der an der Verschmelzung beteiligten Rechtsträger ist, wenn sie binnen sechs Monaten nach dem Tag, an dem die Eintragung der Verschmelzung in das Register des Sitzes desjenigen Rechtsträgers, dessen Gläubiger sie sind, nach § 19  Abs.  3 UmwG als bekannt gemacht gilt, ihren Anspruch nach Grund und Höhe schriftlich anmelden, Sicherheit zu leisten, soweit sie nicht Befriedigung verlangen können. Dieses Recht steht den Gläubigern jedoch nur zu, wenn sie glaubhaft machen, dass durch die Verschmelzung die Erfüllung der Forderung gefährdet wird."
    },
    {
      "date": "2025-07-02",
      "id": "114316",
      "original_text": "Registerbekanntmachung nach dem Umwandlungsgesetz\nNiedersachsen Amtsgericht Hannover HRB 61871\nHmcS Gesellschaft für Forderungsmanagement mbH – Hannover",
      "type": "Registerbekanntmachung nach dem Umwandlungsgesetz",
      "state": "Niedersachsen",
      "amtsgericht": "Amtsgericht Hannover",
      "registernummer": "HRB 61871",
      "registerart": "HRB",
      "company_name": "HmcS Gesellschaft für Forderungsmanagement mbH",
      "company_seat": "Hannover",
      "details": "02.07.2025 (Bekanntmachungsdatum)\n\nNiedersachsen Amtsgericht Hannover HRB 61871\nRegisterbekanntmachung nach dem Umwandlungsgesetz 02.07.2025 (Eintragungsdatum)\n\nHmcS Gesellschaft für Forderungsmanagement mbH\nGesellschaft mit beschränkter Haftung\nHannover\n\nDen Gläubigern der an der Verschmelzung beteiligten Rechtsträger ist, wenn sie binnen sechs Monaten nach dem Tag, an dem die Eintragung der Verschmelzung in das Register des Sitzes desjenigen Rechtsträgers, dessen Gläubiger sie sind, nach § 19  Abs.  3 UmwG als bekannt gemacht gilt, ihren Anspruch nach Grund und Höhe schriftlich anmelden, Sicherheit zu leisten, soweit sie nicht Befriedigung verlangen können. Dieses Recht steht den Gläubigern jedoch nur zu, wenn sie glaubhaft machen, dass durch die Verschmelzung die Erfüllung der Forderung gefährdet wird."
    },
    {
      "date": "2025-07-02",
      "id": "114317",
      "original_text": "Registerbekanntmachung nach dem Umwandlungsgesetz\nNiedersachsen Amtsgericht Lüneburg HRB 201465\nAutohaus Wolter-Lüchow GmbH – Lüchow",
      "type": "Registerbekanntmachung nach dem Umwandlungsgesetz",
      "state": "Niedersachsen",
      "amtsgericht": "Amtsgericht Lüneburg",
      "registernummer": "HRB 201465",
      "registerart": "HRB",
      "company_name": "Autohaus Wolter-Lüchow GmbH",
      "company_seat": "Lüchow",
      "details": "02.07.2025 (Bekanntmachungsdatum)\n\nNiedersachsen Amtsgericht Lüneburg HRB 201465\nRegisterbekanntmachung nach dem Umwandlungsgesetz 02.07.2025 (Eintragungsdatum)\n\nAutohaus Wolter-Lüchow GmbH\nGesellschaft mit beschränkter Haftung\nLüchow\n\nDen Gläubigern der an der Verschmelzung beteiligten Rechtsträger ist, wenn sie binnen sechs Monaten nach dem Tag, an dem die Eintragung der Verschmelzung in das Register des Sitzes desjenigen Rechtsträgers, dessen Gläubiger sie sind, nach § 19  Abs.  3 UmwG als bekannt gemacht gilt, ihren Anspruch nach Grund und Höhe schriftlich anmelden, Sicherheit zu leisten, soweit sie nicht Befriedigung verlangen können. Dieses Recht steht den Gläubigern jedoch nur zu, wenn sie glaubhaft machen, dass durch die Verschmelzung die Erfüllung der Forderung gefährdet wird."
    },
    {
      "date": "2025-07-02",
      "id": "114318",
      "original_text": "Registerbekanntmachung nach dem Umwandlungsgesetz\nNiedersachsen Amtsgericht Lüneburg HRB 120270 früher Amtsgericht Dannenberg (Elbe)\nAutohaus Wolter GmbH – Uelzen",
      "type": "Registerbekanntmachung nach dem Umwandlungsgesetz",
      "state": "Niedersachsen",
      "amtsgericht": "Amtsgericht Lüneburg",
      "registernummer": "HRB 120270",
      "registerart": "HRB",
      "company_name": "Autohaus Wolter GmbH",
      "company_seat": "Uelzen",
      "former_amtsgericht": "Dannenberg (Elbe)",
      "details": "02.07.2025 (Bekanntmachungsdatum)\n\nNiedersachsen Amtsgericht Lüneburg HRB 120270 früher Amtsgericht Dannenberg (Elbe)\nRegisterbekanntmachung nach dem Umwandlungsgesetz 02.07.2025 (Eintragungsdatum)\n\nAutohaus Wolter GmbH\nGesellschaft mit beschränkter Haftung\nUelzen\n\nDen Gläubigern der an der Verschmelzung beteiligten Rechtsträger ist, wenn sie binnen sechs Monaten nach dem Tag, an dem die Eintragung der Verschmelzung in das Register des Sitzes desjenigen Rechtsträgers, dessen Gläubiger sie sind, nach § 19  Abs.  3 UmwG als bekannt gemacht gilt, ihren Anspruch nach Grund und Höhe schriftlich anmelden, Sicherheit zu leisten, soweit sie nicht Befriedigung verlangen können. Dieses Recht steht den Gläubigern jedoch nur zu, wenn sie glaubhaft machen, dass durch die Verschmelzung die Erfüllung der Forderung gefährdet wird."
    },
    {
      "date": "2025-07-02",
      "id": "114319",
      "original_text": "Löschungsankündigung\nNiedersachsen Amtsgericht Lüneburg HRB 207102\nMotorenschmiede Knoblich UG (haftungsbeschränkt) – Garstedt",
      "type": "Löschungsankündigung",
      "state": "Niedersachsen",
      "amtsgericht": "Amtsgericht Lüneburg",
      "registernummer": "HRB 207102",
      "registerart": "HRB",
      "company_name": "Motorenschmiede Knoblich UG (haftungsbeschränkt)",
      "company_seat": "Garstedt",
      "details": "02.07.2025 (Bekanntmachungsdatum)\n\nNiedersachsen Amtsgericht Lüneburg HRB 207102\nLöschungsankündigung\n\nMotorenschmiede Knoblich UG (haftungsbeschränkt)\nGesellschaft mit beschränkter Haftung\nGarstedt\n\nDas Registergericht beabsichtigt, die Gesellschaft von Amts wegen nach § 394 FamFG zu löschen. Die Frist zur Erhebung eines Widerspruchs ist auf 1 Monat ab dieser Registerbekanntmachung festgesetzt."
    },
    {
      "date": "2025-07-02",
      "id": "114320",
      "original_text": "Löschungsankündigung\nNiedersachsen Amtsgericht Hildesheim HRB 208997\nSaMiJo UG (haftungsbeschränkt) – Elze",
      "type": "Löschungsankündigung",
      "state": "Niedersachsen",
      "amtsgericht": "Amtsgericht Hildesheim",
      "registernummer": "HRB 208997",
      "registerart": "HRB",
      "company_name": "SaMiJo UG (haftungsbeschränkt)",
      "company_seat": "Elze",
      "details": "02.07.2025 (Bekanntmachungsdatum)\n\nNiedersachsen Amtsgericht Hildesheim HRB 208997\nLöschungsankündigung 02.07.2025 (Eintragungsdatum)\n\nSaMiJo UG (haftungsbeschränkt)\nGesellschaft mit beschränkter Haftung\nElze\n\nDas Registergericht beabsichtigt, die Gesellschaft von Amts wegen nach § 394 FamFG zu löschen. Die Frist zur Erhebung eines Widerspruchs ist auf 1 Monat ab dieser Registerbekanntmachung festgesetzt."
    },
    {
      "date": "2025-07-02",
      "id": "114321",
      "original_text": "Registerbekanntmachung nach dem Umwandlungsgesetz\nNiedersachsen Amtsgericht Osnabrück VR 120025\nKatholische Erwachsenenbildung für das Dekanat Emsland Mitte im Landkreis Emsland e.V. – Meppen",
      "type": "Registerbekanntmachung nach dem Umwandlungsgesetz",
      "state": "Niedersachsen",
      "amtsgericht": "Amtsgericht Osnabrück",
      "registernummer": "VR 120025",
      "registerart": "VR",
      "company_name": "Katholische Erwachsenenbildung für das Dekanat Emsland Mitte im Landkreis Emsland e.V.",
      "company_seat": "Meppen",
      "details": "02.07.2025 (Bekanntmachungsdatum)\n\nNiedersachsen Amtsgericht Osnabrück VR 120025\nRegisterbekanntmachung nach dem Umwandlungsgesetz 02.07.2025 (Eintragungsdatum)\n\nKatholische Erwachsenenbildung für das Dekanat Emsland Mitte im Landkreis Emsland e.V.\neingetragener Verein\nMeppen\n\nDen Gläubigern der an der Verschmelzung beteiligten Rechtsträger ist, wenn sie binnen sechs Monaten nach dem Tag, an dem die Eintragung der Verschmelzung in das Register des Sitzes desjenigen Rechtsträgers, dessen Gläubiger sie sind, nach § 19  Abs.  3 UmwG als bekannt gemacht gilt, ihren Anspruch nach Grund und Höhe schriftlich anmelden, Sicherheit zu leisten, soweit sie nicht Befriedigung verlangen können. Dieses Recht steht den Gläubigern jedoch nur zu, wenn sie glaubhaft machen, dass durch die Verschmelzung die Erfüllung der Forderung gefährdet wird."
    },
    {
      "date": "2025-07-02",
      "id": "114322",
      "original_text": "Löschungsankündigung\nNiedersachsen Amtsgericht Osnabrück HRB 215787\nISON Beteiligungsgesellschaft mbH – Osnabrück",
      "type": "Löschungsankündigung",
      "state": "Niedersachsen",
      "amtsgericht": "Amtsgericht Osnabrück",
      "registernummer": "HRB 215787",
      "registerart": "HRB",
      "company_name": "ISON Beteiligungsgesellschaft mbH",
      "company_seat": "Osnabrück",
      "details": "02.07.2025 (Bekanntmachungsdatum)\n\nNiedersachsen Amtsgericht Osnabrück HRB 215787\nLöschungsankündigung\n\nISON Beteiligungsgesellschaft mbH\nGesellschaft mit beschränkter Haftung\nOsnabrück\n\nDas Registergericht beabsichtigt, die Gesellschaft von Amts wegen nach § 394 FamFG wegen Vermögenslosigkeit zu löschen. Die Frist zur Erhebung eines Widerspruchs ist auf 1 Monat ab dieser Registerbekanntmachung festgesetzt."
    },
    {
      "date": "2025-07-02",
      "id": "114323",
      "original_text": "Löschungsankündigung\nNiedersachsen Amtsgericht Braunschweig HRB 210577\nFuchserde UG (haftungsbeschränkt) – Goslar",
      "type": "Löschungsankündigung",
      "state": "Niedersachsen",
      "amtsgericht": "Amtsgericht Braunschweig",
      "registernummer": "HRB 210577",
      "registerart": "HRB",
      "company_name": "Fuchserde UG (haftungsbeschränkt)",
      "company_seat": "Goslar",
      "details": "02.07.2025 (Bekanntmachungsdatum)\n\nNiedersachsen Amtsgericht Braunschweig HRB 210577\nLöschungsankündigung\n\nFuchserde UG (haftungsbeschränkt)\nGesellschaft mit beschränkter Haftung\nGoslar\n\nDas Registergericht beabsichtigt, die Gesellschaft von Amts wegen nach § 394 FamFG zu löschen. Die Frist zur Erhebung eines Widerspruchs ist auf 1 Monat ab dieser Registerbekanntmachung festgesetzt."
    },
    {
      "date": "2025-07-02",
      "id": "114324",
      "original_text": "Löschungsankündigung\nNiedersachsen Amtsgericht Lüneburg HRB 207246\nRSL UG (haftungsbeschränkt) – Neuenkirchen",
      "type": "Löschungsankündigung",
      "state": "Niedersachsen",
      "amtsgericht": "Amtsgericht Lüneburg",
      "registernummer": "HRB 207246",
      "registerart": "HRB",
      "company_name": "RSL UG (haftungsbeschränkt)",
      "company_seat": "Neuenkirchen",
      "details": "02.07.2025 (Bekanntmachungsdatum)\n\nNiedersachsen Amtsgericht Lüneburg HRB 207246\nLöschungsankündigung\n\nRSL UG (haftungsbeschränkt)\nGesellschaft mit beschränkter Haftung\nNeuenkirchen\n\nDas Registergericht beabsichtigt, die Gesellschaft von Amts wegen nach § 394 FamFG zu löschen. Die Frist zur Erhebung eines Widerspruchs ist auf 1 Monat ab dieser Registerbekanntmachung festgesetzt."
    },
    {
      "date": "2025-07-02",
      "id": "114325",
      "original_text": "Registerbekanntmachung nach dem Umwandlungsgesetz\nNiedersachsen Amtsgericht Hannover HRB 200366\nHmcS Consulting GmbH – Hannover",
      "type": "Registerbekanntmachung nach dem Umwandlungsgesetz",
      "state": "Niedersachsen",
      "amtsgericht": "Amtsgericht Hannover",
      "registernummer": "HRB 200366",
      "registerart": "HRB",
      "company_name": "HmcS Consulting GmbH",
      "company_seat": "Hannover",
      "details": "02.07.2025 (Bekanntmachungsdatum)\n\nNiedersachsen Amtsgericht Hannover HRB 200366\nRegisterbekanntmachung nach dem Umwandlungsgesetz 02.07.2025 (Eintragungsdatum)\n\nHmcS Consulting GmbH\nGesellschaft mit beschränkter Haftung\nHannover\n\nDen Gläubigern der an der Verschmelzung beteiligten Rechtsträger ist, wenn sie binnen sechs Monaten nach dem Tag, an dem die Eintragung der Verschmelzung in das Register des Sitzes desjenigen Rechtsträgers, dessen Gläubiger sie sind, nach § 19  Abs.  3 UmwG als bekannt gemacht gilt, ihren Anspruch nach Grund und Höhe schriftlich anmelden, Sicherheit zu leisten, soweit sie nicht Befriedigung verlangen können. Dieses Recht steht den Gläubigern jedoch nur zu, wenn sie glaubhaft machen, dass durch die Verschmelzung die Erfüllung der Forderung gefährdet wird."
    },
    {
      "date": "2025-07-02",
      "id": "114326",
      "original_text": "Löschungsankündigung\nNiedersachsen Amtsgericht Oldenburg (Oldenburg) HRB 210524\nJosef-Hospital Delmenhorst HOLDING gGmbH – Delmenhorst",
      "type": "Löschungsankündigung",
      "state": "Niedersachsen",
      "amtsgericht": "Amtsgericht Oldenburg (Oldenburg)",
      "registernummer": "HRB 210524",
      "registerart": "HRB",
      "company_name": "Josef-Hospital Delmenhorst HOLDING gGmbH",
      "company_seat": "Delmenhorst",
      "details": "02.07.2025 (Bekanntmachungsdatum)\n\nNiedersachsen Amtsgericht Oldenburg (Oldenburg) HRB 210524\nLöschungsankündigung\n\nJosef-Hospital Delmenhorst HOLDING gGmbH\nGesellschaft mit beschränkter Haftung\nDelmenhorst\n\nDas Registergericht beabsichtigt, die Gesellschaft von Amts wegen nach § 394 FamFG zu löschen. Die Frist zur Erhebung eines Widerspruchs ist auf 1 Monat ab dieser Registerbekanntmachung festgesetzt."
    },
    {
      "date": "2025-07-02",
      "id": "114327",
      "original_text": "Löschungsankündigung\nRheinland-Pfalz Amtsgericht Montabaur HRB 27628\nÖZ-PA Handels GmbH – Neuwied",
      "type": "Löschungsankündigung",
      "state": "Rheinland-Pfalz",
      "amtsgericht": "Amtsgericht Montabaur",
      "registernummer": "HRB 27628",
      "registerart": "HRB",
      "company_name": "ÖZ-PA Handels GmbH",
      "company_seat": "Neuwied",
      "details": "02.07.2025 (Bekanntmachungsdatum)\n\nRheinland-Pfalz Amtsgericht Montabaur HRB 27628\nLöschungsankündigung 02.07.2025 (Eintragungsdatum)\n\nÖZ-PA Handels GmbH\nGesellschaft mit beschränkter Haftung\nNeuwied\n\nDas Registergericht beabsichtigt die Gesellschaft von Amts wegen nach § 394 FamFG zu löschen. Die Frist zur Erhebung eines Widerspruchs ist auf 1 Monat festgesetzt."
    },
    {
      "date": "2025-07-02",
      "id": "114328",
      "original_text": "Löschungsankündigung\nRheinland-Pfalz Amtsgericht Montabaur HRB 27428\nNotabene Immobilien GmbH – Katzenelnbogen",
      "type": "Löschungsankündigung",
      "state": "Rheinland-Pfalz",
      "amtsgericht": "Amtsgericht Montabaur",
      "registernummer": "HRB 27428",
      "registerart": "HRB",
      "company_name": "Notabene Immobilien GmbH",
      "company_seat": "Katzenelnbogen",
      "details": "02.07.2025 (Bekanntmachungsdatum)\n\nRheinland-Pfalz Amtsgericht Montabaur HRB 27428\nLöschungsankündigung\n\nNotabene Immobilien GmbH\nGesellschaft mit beschränkter Haftung\nKatzenelnbogen\n\nDas Registergericht beabsichtigt die Gesellschaft von Amts wegen nach § 394 FamFG zu löschen. Die Frist zur Erhebung eines Widerspruchs ist auf 1 Monat festgesetzt."
    },
    {
      "date": "2025-07-02",
      "id": "114329",
      "original_text": "Löschungsankündigung\nRheinland-Pfalz Amtsgericht Ludwigshafen a.Rhein (Ludwigshafen) HRB 68232\nMascada GmbH – Ludwigshafen am Rhein",
      "type": "Löschungsankündigung",
      "state": "Rheinland-Pfalz",
      "amtsgericht": "Amtsgericht Ludwigshafen a.Rhein (Ludwigshafen)",
      "registernummer": "HRB 68232",
      "registerart": "HRB",
      "company_name": "Mascada GmbH",
      "company_seat": "Ludwigshafen am Rhein",
      "details": "02.07.2025 (Bekanntmachungsdatum)\n\nRheinland-Pfalz Amtsgericht Ludwigshafen a.Rhein (Ludwigshafen) HRB 68232\nLöschungsankündigung\n\nMascada GmbH\nGesellschaft mit beschränkter Haftung\nLudwigshafen am Rhein\n\nDas Registergericht beabsichtigt die Gesellschaft von Amts wegen nach § 394 FamFG zu löschen. Die Frist zur Erhebung eines Widerspruchs ist auf einen Monat festgesetzt."
    },
    {
      "date": "2025-07-02",
      "id": "114330",
      "original_text": "Löschungsankündigung\nRheinland-Pfalz Amtsgericht Ludwigshafen a.Rhein (Ludwigshafen) HRA 60442\nCasadom GmbH & Co. KG – Speyer",
      "type": "Löschungsankündigung",
      "state": "Rheinland-Pfalz",
      "amtsgericht": "Amtsgericht Ludwigshafen a.Rhein (Ludwigshafen)",
      "registernummer": "HRA 60442",
      "registerart": "HRA",
      "company_name": "Casadom GmbH & Co. KG",
      "company_seat": "Speyer",
      "details": "02.07.2025 (Bekanntmachungsdatum)\n\nRheinland-Pfalz Amtsgericht Ludwigshafen a.Rhein (Ludwigshafen) HRA 60442\nLöschungsankündigung\n\nCasadom GmbH & Co. KG\nKommanditgesellschaft\nSpeyer\n\nDas Registergericht beabsichtigt die Firma von Amts wegen nach § 394 FamFG zu löschen. Die Frist zur Erhebung eines Widerspruchs ist auf einen Monat festgesetzt."
    },
    {
      "date": "2025-07-02",
      "id": "114331",
      "original_text": "Registerbekanntmachung nach dem Umwandlungsgesetz\nRheinland-Pfalz Amtsgericht Koblenz HRB 26279\nOntex Vertrieb GmbH – Mayen",
      "type": "Registerbekanntmachung nach dem Umwandlungsgesetz",
      "state": "Rheinland-Pfalz",
      "amtsgericht": "Amtsgericht Koblenz",
      "registernummer": "HRB 26279",
      "registerart": "HRB",
      "company_name": "Ontex Vertrieb GmbH",
      "company_seat": "Mayen",
      "details": "02.07.2025 (Bekanntmachungsdatum)\n\nRheinland-Pfalz Amtsgericht Koblenz HRB 26279\nRegisterbekanntmachung nach dem Umwandlungsgesetz 02.07.2025 (Eintragungsdatum)\n\nOntex Vertrieb GmbH\nGesellschaft mit beschränkter Haftung\nMayen\n\nAls nicht eingetragen wird veröffentlicht: Den Gläubigern der an der Verschmelzung beteiligten Rechtsträger ist, wenn sie binnen sechs Monaten nach dem Tag, an dem die Eintragung der Verschmelzung in das Register des Sitzes desjenigen Rechtsträgers,dessen Gläubiger sie sind, nach § 19 Abs. 3 UmwG als bekannt gemacht gilt, ihren Anspruch nach Grund und Höhe schriftlich anmelden, Sicherheit zu leisten, soweit sie nicht Befriedigung verlangen können. Dieses Recht steht den Gläubigern jedoch nur zu, wenn sie glaubhaft machen, dass durch die Verschmelzung die Erfüllungd er Forderung gefährdet wird."
    },
    {
      "date": "2025-07-02",
      "id": "114332",
      "original_text": "Löschungsankündigung\nRheinland-Pfalz Amtsgericht Ludwigshafen a.Rhein (Ludwigshafen) HRB 67392\nSHKODRA UG (haftungsbeschränkt) – Ludwigshafen am Rhein",
      "type": "Löschungsankündigung",
      "state": "Rheinland-Pfalz",
      "amtsgericht": "Amtsgericht Ludwigshafen a.Rhein (Ludwigshafen)",
      "registernummer": "HRB 67392",
      "registerart": "HRB",
      "company_name": "SHKODRA UG (haftungsbeschränkt)",
      "company_seat": "Ludwigshafen am Rhein",
      "details": "02.07.2025 (Bekanntmachungsdatum)\n\nRheinland-Pfalz Amtsgericht Ludwigshafen a.Rhein (Ludwigshafen) HRB 67392\nLöschungsankündigung\n\nSHKODRA UG (haftungsbeschränkt)\nGesellschaft mit beschränkter Haftung\nLudwigshafen am Rhein\n\nDas Registergericht beabsichtigt die Gesellschaft von Amts wegen nach § 394 FamFG zu löschen. Die Frist zur Erhebung eines Widerspruchs ist auf einen Monat festgesetzt."
    },
    {
      "date": "2025-07-02",
      "id": "114333",
      "original_text": "Löschungsankündigung\nRheinland-Pfalz Amtsgericht Montabaur HRB 27358\nAbSaKon GmbH – Neustadt/Wied",
      "type": "Löschungsankündigung",
      "state": "Rheinland-Pfalz",
      "amtsgericht": "Amtsgericht Montabaur",
      "registernummer": "HRB 27358",
      "registerart": "HRB",
      "company_name": "AbSaKon GmbH",
      "company_seat": "Neustadt/Wied",
      "details": "02.07.2025 (Bekanntmachungsdatum)\n\nRheinland-Pfalz Amtsgericht Montabaur HRB 27358\nLöschungsankündigung 20.02.2025 (Eintragungsdatum)\n\nAbSaKon GmbH\nGesellschaft mit beschränkter Haftung\nNeustadt/Wied\n\nDas Registergericht beabsichtigt die Gesellschaft von Amts wegen nach § 394 FamFG zu löschen. Die Frist zur Erhebung eines Widerspruchs ist auf 1 Monat festgesetzt."
    },
    {
      "date": "2025-07-02",
      "id": "114334",
      "original_text": "Löschungsankündigung\nBremen Amtsgericht Bremen HRB 36416\nAsad KSR GmbH – Bremen",
      "type": "Löschungsankündigung",
      "state": "Bremen",
      "amtsgericht": "Amtsgericht Bremen",
      "registernummer": "HRB 36416",
      "registerart": "HRB",
      "company_name": "Asad KSR GmbH",
      "company_seat": "Bremen",
      "details": "02.07.2025 (Bekanntmachungsdatum)\n\nBremen Amtsgericht Bremen HRB 36416\nLöschungsankündigung\n\nAsad KSR GmbH\nGesellschaft mit beschränkter Haftung\nBremen\n\nEs ist beabsichtigt die im Handelsregister eingetragene Gesellschaft von Amts wegen gemäß § 394 FamFG zu löschen. Gegen die Löschung kann beim AG Bremen schriftlich oder zu Protokoll der Geschäftsstelle Widerspruch eingelegt werden. Widerspruchsfrist 4 Wochen."
    },
    {
      "date": "2025-07-02",
      "id": "114335",
      "original_text": "Sonstige Registerbekanntmachung\nNordrhein-Westfalen Amtsgericht Köln HRB 68395\nMadcom Limited Zweigniederlassung Deutschland – Köln",
      "type": "Sonstige Registerbekanntmachung",
      "state": "Nordrhein-Westfalen",
      "amtsgericht": "Amtsgericht Köln",
      "registernummer": "HRB 68395",
      "registerart": "HRB",
      "company_name": "Madcom Limited Zweigniederlassung Deutschland",
      "company_seat": "Köln",
      "details": "02.07.2025 (Bekanntmachungsdatum)\n\nNordrhein-Westfalen Amtsgericht Köln HRB 68395\nSonstige Registerbekanntmachung\n\nMadcom Limited Zweigniederlassung Deutschland\nRechtsform ausländischen Rechts HRB\nKöln\n\nDas Registergericht beabsichtigt die Gesellschaft von Amts wegen nach § 395 FamFG zu löschen. Die Frist zur Erhebung eines Widerspruchs ist auf einen Monat festgesetzt."
    },
    {
      "date": "2025-07-02",
      "id": "114336",
      "original_text": "Registerbekanntmachung nach dem Umwandlungsgesetz\nNordrhein-Westfalen Amtsgericht Mönchengladbach HRB 19484\nErste Dornieden Beteiligung Verwaltungs GmbH – Mönchengladbach",
      "type": "Registerbekanntmachung nach dem Umwandlungsgesetz",
      "state": "Nordrhein-Westfalen",
      "amtsgericht": "Amtsgericht Mönchengladbach",
      "registernummer": "HRB 19484",
      "registerart": "HRB",
      "company_name": "Erste Dornieden Beteiligung Verwaltungs GmbH",
      "company_seat": "Mönchengladbach",
      "details": "02.07.2025 (Bekanntmachungsdatum)\n\nNordrhein-Westfalen Amtsgericht Mönchengladbach HRB 19484\nRegisterbekanntmachung nach dem Umwandlungsgesetz 02.07.2025 (Eintragungsdatum)\n\nErste Dornieden Beteiligung Verwaltungs GmbH\nGesellschaft mit beschränkter Haftung\nMönchengladbach\n\nDen Gläubigern der an der Verschmelzung beteiligten Rechtsträger ist, wenn sie binnen sechs Monaten nach dem Tag, an dem die Eintragung der Verschmelzung in das Register des Sitzes desjenigen Rechtsträgers, dessen Gläubiger sie sind, nach § 19 Absatz 3 UmwG als bekanntgemacht gilt, ihren Anspruch nach Grund und Höhe schriftlich anmelden, Sicherheit zu leisten, soweit sie nicht Befriedigung verlangen können. Dieses Recht steht den Gläubigern jedoch nur zu, wenn sie glaubhaft machen, dass durch die Verschmelzung die Erfüllung ihrer Forderung gefährdet wird."
    },
    {
      "date": "2025-07-02",
      "id": "114337",
      "original_text": "Registerbekanntmachung nach dem Umwandlungsgesetz\nNordrhein-Westfalen Amtsgericht Essen HRB 20231\nANEXAR GmbH – Essen",
      "type": "Registerbekanntmachung nach dem Umwandlungsgesetz",
      "state": "Nordrhein-Westfalen",
      "amtsgericht": "Amtsgericht Essen",
      "registernummer": "HRB 20231",
      "registerart": "HRB",
      "company_name": "ANEXAR GmbH",
      "company_seat": "Essen",
      "details": "02.07.2025 (Bekanntmachungsdatum)\n\nNordrhein-Westfalen Amtsgericht Essen HRB 20231\nRegisterbekanntmachung nach dem Umwandlungsgesetz 27.06.2025 (Eintragungsdatum)\n\nANEXAR GmbH\nGesellschaft mit beschränkter Haftung\nEssen\n\nDen Gläubigern der an der Verschmelzung beteiligten Rechtsträger ist, wenn sie binnen sechs Monaten nach dem Tag, an dem die Eintragung der Verschmelzung in das Register des Sitzes derjenigen Rechtsträger deren Gläubiger sie sind, nach § 19 Absatz 3 UmwG als bekanntgemacht gilt, ihren Anspruch nach Grund und Höhe schriftlich anmelden, Sicherheit zu leisten, soweit sie nicht Befriedigung verlangen können. Dieses Recht steht den Gläubigern jedoch nur zu, wenn sie glaubhaft machen, dass durch die Verschmelzung die Erfüllung ihrer Forderung gefährdet wird."
    },
    {
      "date": "2025-07-02",
      "id": "114338",
      "original_text": "Registerbekanntmachung nach dem Umwandlungsgesetz\nNordrhein-Westfalen Amtsgericht Köln HRB 123808\neye-level consulting GmbH – Frechen",
      "type": "Registerbekanntmachung nach dem Umwandlungsgesetz",
      "state": "Nordrhein-Westfalen",
      "amtsgericht": "Amtsgericht Köln",
      "registernummer": "HRB 123808",
      "registerart": "HRB",
      "company_name": "eye-level consulting GmbH",
      "company_seat": "Frechen",
      "details": "02.07.2025 (Bekanntmachungsdatum)\n\nNordrhein-Westfalen Amtsgericht Köln HRB 123808\nRegisterbekanntmachung nach dem Umwandlungsgesetz 02.07.2025 (Eintragungsdatum)\n\neye-level consulting GmbH\nGesellschaft mit beschränkter Haftung\nFrechen\n\nDen Gläubigern der an der Ausgliederung beteiligten Rechtsträger ist, wenn sie binnen sechs Monaten nach dem Tag, an dem die Eintragung der Ausgliederung in das Register des Sitzes desjenigen Rechtsträgers, dessen Gläubiger sie sind, nach § 19 Absatz 3 UmwG als bekanntgemacht gilt, ihren Anspruch nach Grund und Höhe schriftlich anmelden, Sicherheit zu leisten, soweit sie nicht Befriedigung verlangen können. Dieses Recht steht den Gläubigern jedoch nur zu, wenn sie glaubhaft machen, dass durch die Ausgliederung die Erfüllung ihrer Forderung gefährdet wird."
    },
    {
      "date": "2025-07-02",
      "id": "114339",
      "original_text": "Einreichung neuer Dokumente\nNordrhein-Westfalen Amtsgericht Dortmund HRB 2220\nSIGNAL IDUNA Unfallversicherung a. G. – Dortmund.",
      "type": "Einreichung neuer Dokumente",
      "state": "Nordrhein-Westfalen",
      "amtsgericht": "Amtsgericht Dortmund",
      "registernummer": "HRB 2220",
      "registerart": "HRB",
      "company_name": "SIGNAL IDUNA Unfallversicherung a. G.",
      "company_seat": "Dortmund.",
      "details": "02.07.2025 (Bekanntmachungsdatum)\n\nNordrhein-Westfalen Amtsgericht Dortmund HRB 2220\nEinreichung neuer Dokumente 02.07.2025 (Eintragungsdatum)\n\nSIGNAL IDUNA Unfallversicherung a. G.\nVersicherungsverein auf Gegenseitigkeit\nDortmund.\n\nDem Registergericht ist eine neue Liste der Mitglieder des Aufsichtsrates eingereicht worden."
    },
    {
      "date": "2025-07-02",
      "id": "114340",
      "original_text": "Registerbekanntmachung nach dem Umwandlungsgesetz\nNordrhein-Westfalen Amtsgericht Aachen HRB 24967\nALDI West Verwaltungs-SE – Eschweiler",
      "type": "Registerbekanntmachung nach dem Umwandlungsgesetz",
      "state": "Nordrhein-Westfalen",
      "amtsgericht": "Amtsgericht Aachen",
      "registernummer": "HRB 24967",
      "registerart": "HRB",
      "company_name": "ALDI West Verwaltungs-SE",
      "company_seat": "Eschweiler",
      "details": "02.07.2025 (Bekanntmachungsdatum)\n\nNordrhein-Westfalen Amtsgericht Aachen HRB 24967\nRegisterbekanntmachung nach dem Umwandlungsgesetz 02.07.2025 (Eintragungsdatum)\n\nALDI West Verwaltungs-SE\nEuropäische Aktiengesellschaft (SE)\nEschweiler\n\nDen Gläubigern der an der Verschmelzung beteiligten Rechtsträger ist, wenn sie binnen sechs Monaten nach dem Tag, an dem die Eintragung der Verschmelzung in das Register des Sitzes desjenigen Rechtsträgers, dessen Gläubiger sie sind, nach § 19 Absatz 3 UmwG als bekanntgemacht gilt, ihren Anspruch nach Grund und Höhe schriftlich anmelden, Sicherheit zu leisten, soweit sie nicht Befriedigung verlangen können. Dieses Recht steht den Gläubigern jedoch nur zu, wenn sie glaubhaft machen, dass durch die Verschmelzung die Erfüllung ihrer Forderung gefährdet wird."
    },
    {
      "date": "2025-07-02",
      "id": "114341",
      "original_text": "Registerbekanntmachung nach dem Umwandlungsgesetz\nNordrhein-Westfalen Amtsgericht Neuss HRA 7298\nHermann-Josef Cleve Sanitär- und Heizungstechnik e.K. Inh. Michael Cleve – Neuss",
      "type": "Registerbekanntmachung nach dem Umwandlungsgesetz",
      "state": "Nordrhein-Westfalen",
      "amtsgericht": "Amtsgericht Neuss",
      "registernummer": "HRA 7298",
      "registerart": "HRA",
      "company_name": "Hermann-Josef Cleve Sanitär- und Heizungstechnik e.K. Inh. Michael Cleve",
      "company_seat": "Neuss",
      "details": "02.07.2025 (Bekanntmachungsdatum)\n\nNordrhein-Westfalen Amtsgericht Neuss HRA 7298\nRegisterbekanntmachung nach dem Umwandlungsgesetz 02.07.2025 (Eintragungsdatum)\n\nHermann-Josef Cleve Sanitär- und Heizungstechnik e.K. Inh. Michael Cleve\nEinzelkaufmann / Einzelkauffrau\nNeuss\n\nDen Gläubigern der an der Ausgliederung beteiligten Rechtsträger ist, wenn sie binnen sechs Monaten nach dem Tag, an dem die Eintragung der Ausgliederung in das Register des Sitzes desjenigen Rechtsträgers, dessen Gläubiger sie sind, nach § 19 Absatz 3 UmwG als bekanntgemacht gilt, ihren Anspruch nach Grund und Höhe schriftlich anmelden, Sicherheit zu leisten, soweit sie nicht Befriedigung verlangen können. Dieses Recht steht den Gläubigern jedoch nur zu, wenn sie glaubhaft machen, dass durch die Ausgliederung die Erfüllung ihrer Forderung gefährdet wird."
    },
    {
      "date": "2025-07-02",
      "id": "114342",
      "original_text": "Registerbekanntmachung nach dem Umwandlungsgesetz\nNordrhein-Westfalen Amtsgericht Düsseldorf HRB 97737\nINZEPTA Properties Budengasse GmbH – Düsseldorf",
      "type": "Registerbekanntmachung nach dem Umwandlungsgesetz",
      "state": "Nordrhein-Westfalen",
      "amtsgericht": "Amtsgericht Düsseldorf",
      "registernummer": "HRB 97737",
      "registerart": "HRB",
      "company_name": "INZEPTA Properties Budengasse GmbH",
      "company_seat": "Düsseldorf",
      "details": "02.07.2025 (Bekanntmachungsdatum)\n\nNordrhein-Westfalen Amtsgericht Düsseldorf HRB 97737\nRegisterbekanntmachung nach dem Umwandlungsgesetz 02.07.2025 (Eintragungsdatum)\n\nINZEPTA Properties Budengasse GmbH\nGesellschaft mit beschränkter Haftung\nDüsseldorf\n\nDen Gläubigern der an der Verschmelzung beteiligten Rechtsträger ist, wenn sie binnen sechs Monaten nach dem Tag, an dem die Eintragung der Verschmelzung in das Register des Sitzes desjenigen Rechtsträgers, dessen Gläubiger sie sind, nach § 19 Absatz 3 UmwG als bekanntgemacht gilt, ihren Anspruch nach Grund und Höhe schriftlich anmelden, Sicherheit zu leisten, soweit sie nicht Befriedigung verlangen können. Dieses Recht steht den Gläubigern jedoch nur zu, wenn sie glaubhaft machen, dass durch die Verschmelzung die Erfüllung ihrer Forderung gefährdet wird."
    },
    {
      "date": "2025-07-02",
      "id": "114343",
      "original_text": "Registerbekanntmachung nach dem Umwandlungsgesetz\nNordrhein-Westfalen Amtsgericht Siegburg HRB 12607\nFlohr Konferenztechnik GmbH – Niederkassel",
      "type": "Registerbekanntmachung nach dem Umwandlungsgesetz",
      "state": "Nordrhein-Westfalen",
      "amtsgericht": "Amtsgericht Siegburg",
      "registernummer": "HRB 12607",
      "registerart": "HRB",
      "company_name": "Flohr Konferenztechnik GmbH",
      "company_seat": "Niederkassel",
      "details": "02.07.2025 (Bekanntmachungsdatum)\n\nNordrhein-Westfalen Amtsgericht Siegburg HRB 12607\nRegisterbekanntmachung nach dem Umwandlungsgesetz 02.07.2025 (Eintragungsdatum)\n\nFlohr Konferenztechnik GmbH\nGesellschaft mit beschränkter Haftung\nNiederkassel\n\nDen Gläubigern der an der Verschmelzung beteiligten Rechtsträger ist, wenn sie binnen sechs Monaten nach dem Tag, an dem die Eintragung der Verschmelzung in das Register des Sitzes desjenigen Rechtsträgers, dessen Gläubiger sie sind, nach § 19 Absatz 3 UmwG als bekanntgemacht gilt, ihren Anspruch nach Grund und Höhe schriftlich anmelden, Sicherheit zu leisten, soweit sie nicht Befriedigung verlangen können. Dieses Recht steht den Gläubigern jedoch nur zu, wenn sie glaubhaft machen, dass durch die Verschmelzung die Erfüllung ihrer Forderung gefährdet wird."
    },
    {
      "date": "2025-07-02",
      "id": "114344",
      "original_text": "Registerbekanntmachung nach dem Umwandlungsgesetz\nNordrhein-Westfalen Amtsgericht Mönchengladbach HRA 10155\nOhlrogge Advisory e.K. – Erkelenz",
      "type": "Registerbekanntmachung nach dem Umwandlungsgesetz",
      "state": "Nordrhein-Westfalen",
      "amtsgericht": "Amtsgericht Mönchengladbach",
      "registernummer": "HRA 10155",
      "registerart": "HRA",
      "company_name": "Ohlrogge Advisory e.K.",
      "company_seat": "Erkelenz",
      "details": "02.07.2025 (Bekanntmachungsdatum)\n\nNordrhein-Westfalen Amtsgericht Mönchengladbach HRA 10155\nRegisterbekanntmachung nach dem Umwandlungsgesetz 02.07.2025 (Eintragungsdatum)\n\nOhlrogge Advisory e.K.\nEinzelkaufmann / Einzelkauffrau\nErkelenz\n\nDen Gläubigern der an der Ausgliederung beteiligten Rechtsträger ist, wenn sie binnen sechs Monaten nach dem Tag, an dem die Eintragung der Ausgliederung in das Register des Sitzes desjenigen Rechtsträgers, dessen Gläubiger sie sind, nach § 19 Absatz 3 UmwG als bekanntgemacht gilt, ihren Anspruch nach Grund und Höhe schriftlich anmelden, Sicherheit zu leisten, soweit sie nicht Befriedigung verlangen können. Dieses Recht steht den Gläubigern jedoch nur zu, wenn sie glaubhaft machen, dass durch die Ausgliederung die Erfüllung ihrer Forderung gefährdet wird."
    },
    {
      "date": "2025-07-02",
      "id": "114345",
      "original_text": "Registerbekanntmachung nach dem Umwandlungsgesetz\nNordrhein-Westfalen Amtsgericht Mönchengladbach HRB 16889\nGERO Immobilien Management GmbH – Mönchengladbach",
      "type": "Registerbekanntmachung nach dem Umwandlungsgesetz",
      "state": "Nordrhein-Westfalen",
      "amtsgericht": "Amtsgericht Mönchengladbach",
      "registernummer": "HRB 16889",
      "registerart": "HRB",
      "company_name": "GERO Immobilien Management GmbH",
      "company_seat": "Mönchengladbach",
      "details": "02.07.2025 (Bekanntmachungsdatum)\n\nNordrhein-Westfalen Amtsgericht Mönchengladbach HRB 16889\nRegisterbekanntmachung nach dem Umwandlungsgesetz 02.07.2025 (Eintragungsdatum)\n\nGERO Immobilien Management GmbH\nGesellschaft mit beschränkter Haftung\nMönchengladbach\n\nDen Gläubigern der an der Verschmelzung beteiligten Rechtsträger ist, wenn sie binnen sechs Monaten nach dem Tag, an dem die Eintragung der Verschmelzung in das Register des Sitzes desjenigen Rechtsträgers, dessen Gläubiger sie sind, nach § 19 Absatz 3 UmwG als bekanntgemacht gilt, ihren Anspruch nach Grund und Höhe schriftlich anmelden, Sicherheit zu leisten, soweit sie nicht Befriedigung verlangen können. Dieses Recht steht den Gläubigern jedoch nur zu, wenn sie glaubhaft machen, dass durch die Verschmelzung die Erfüllung ihrer Forderung gefährdet wird."
    },
    {
      "date": "2025-07-02",
      "id": "114346",
      "original_text": "Einreichung neuer Dokumente\nNordrhein-Westfalen Amtsgericht Dortmund HRB 25818\nHolzLand GmbH – Dortmund",
      "type": "Einreichung neuer Dokumente",
      "state": "Nordrhein-Westfalen",
      "amtsgericht": "Amtsgericht Dortmund",
      "registernummer": "HRB 25818",
      "registerart": "HRB",
      "company_name": "HolzLand GmbH",
      "company_seat": "Dortmund",
      "details": "02.07.2025 (Bekanntmachungsdatum)\n\nNordrhein-Westfalen Amtsgericht Dortmund HRB 25818\nEinreichung neuer Dokumente\n\nHolzLand GmbH\nGesellschaft mit beschränkter Haftung\nDortmund\n\nDem Registergericht ist eine neue Liste der Mitglieder des Aufsichtsrates eingereicht worden."
    },
    {
      "date": "2025-07-02",
      "id": "114347",
      "original_text": "Registerbekanntmachung nach dem Umwandlungsgesetz\nNordrhein-Westfalen Amtsgericht Köln HRB 103675\nCM Immobilienprojekt GmbH – Pulheim",
      "type": "Registerbekanntmachung nach dem Umwandlungsgesetz",
      "state": "Nordrhein-Westfalen",
      "amtsgericht": "Amtsgericht Köln",
      "registernummer": "HRB 103675",
      "registerart": "HRB",
      "company_name": "CM Immobilienprojekt GmbH",
      "company_seat": "Pulheim",
      "details": "02.07.2025 (Bekanntmachungsdatum)\n\nNordrhein-Westfalen Amtsgericht Köln HRB 103675\nRegisterbekanntmachung nach dem Umwandlungsgesetz 02.07.2025 (Eintragungsdatum)\n\nCM Immobilienprojekt GmbH\nGesellschaft mit beschränkter Haftung\nPulheim\n\nDen Gläubigern der an der Verschmelzung beteiligten Rechtsträger ist, wenn sie binnen sechs Monaten nach dem Tag, an dem die Eintragung der Verschmelzung in das Register des Sitzes desjenigen Rechtsträgers, dessen Gläubiger sie sind, nach § 19 Absatz 3 UmwG als bekanntgemacht gilt, ihren Anspruch nach Grund und Höhe schriftlich anmelden, Sicherheit zu leisten, soweit sie nicht Befriedigung verlangen können. Dieses Recht steht den Gläubigern jedoch nur zu, wenn sie glaubhaft machen, dass durch die Verschmelzung die Erfüllung ihrer Forderung gefährdet wird."
    },
    {
      "date": "2025-07-02",
      "id": "114348",
      "original_text": "Registerbekanntmachung nach dem Umwandlungsgesetz\nNordrhein-Westfalen Amtsgericht Duisburg HRB 21407\nkm credit consulting GmbH – Hünxe",
      "type": "Registerbekanntmachung nach dem Umwandlungsgesetz",
      "state": "Nordrhein-Westfalen",
      "amtsgericht": "Amtsgericht Duisburg",
      "registernummer": "HRB 21407",
      "registerart": "HRB",
      "company_name": "km credit consulting GmbH",
      "company_seat": "Hünxe",
      "details": "02.07.2025 (Bekanntmachungsdatum)\n\nNordrhein-Westfalen Amtsgericht Duisburg HRB 21407\nRegisterbekanntmachung nach dem Umwandlungsgesetz 02.07.2025 (Eintragungsdatum)\n\nkm credit consulting GmbH\nGesellschaft mit beschränkter Haftung\nHünxe\n\nDie Gesellschaft hat Gläubigern, deren Forderungen vor dieser Bekanntmachung begründet worden sind, Sicherheit zu leisten, soweit sie nicht Befriedigung verlangen können, wenn sie sich binnen sechs Monaten zu diesem Zweck melden."
    },
    {
      "date": "2025-07-02",
      "id": "114349",
      "original_text": "Löschungsankündigung\nNordrhein-Westfalen Amtsgericht Mönchengladbach HRA 1398\nLorenz Schmitt Schnitthölzer u. Furniere GmbH & Co. KG – Mönchengladbach",
      "type": "Löschungsankündigung",
      "state": "Nordrhein-Westfalen",
      "amtsgericht": "Amtsgericht Mönchengladbach",
      "registernummer": "HRA 1398",
      "registerart": "HRA",
      "company_name": "Lorenz Schmitt Schnitthölzer u. Furniere GmbH & Co. KG",
      "company_seat": "Mönchengladbach",
      "details": "02.07.2025 (Bekanntmachungsdatum)\n\nNordrhein-Westfalen Amtsgericht Mönchengladbach HRA 1398\nLöschungsankündigung\n\nLorenz Schmitt Schnitthölzer u. Furniere GmbH & Co. KG\nKommanditgesellschaft\nMönchengladbach\n\nLorenz Schmitt Schnitthölzler u. Furniere GmbH & Co. KG (Amtsgericht Mönchengladbach, HRA 1398)\n\nDas Registergericht beabsichtigt die Firma von Amts wegen nach § 394 FamFG zu löschen. Die Frist zur Erhebung eines Widerspruchs ist auf drei Monate festgesetzt."
    },
    {
      "date": "2025-07-02",
      "id": "114350",
      "original_text": "Registerbekanntmachung nach dem Umwandlungsgesetz\nThüringen Amtsgericht Jena HRA 507015\nAmthor Heizung-Sanitär-Service, Inh. Alexander Amthor e.K. – Weimar",
      "type": "Registerbekanntmachung nach dem Umwandlungsgesetz",
      "state": "Thüringen",
      "amtsgericht": "Amtsgericht Jena",
      "registernummer": "HRA 507015",
      "registerart": "HRA",
      "company_name": "Amthor Heizung-Sanitär-Service, Inh. Alexander Amthor e.K.",
      "company_seat": "Weimar",
      "details": "02.07.2025 (Bekanntmachungsdatum)\n\nThüringen Amtsgericht Jena HRA 507015\nRegisterbekanntmachung nach dem Umwandlungsgesetz 02.07.2025 (Eintragungsdatum)\n\nAmthor Heizung-Sanitär-Service, Inh. Alexander Amthor e.K.\nEinzelkaufmann / Einzelkauffrau\nWeimar\n\nDas von dem Einzelkaufmann Amthor, Alexander, Weimar, *10.11.1990 unter der Firma Amthor Heizung-Sanitär-Service, Inh. Alexander Amthor e.K. mit dem Sitz in Weimar betriebene Unternehmen ist aus dem Vermögen gemäß Ausgliederungsplans vom 02.05.2025 auf die neu gegründete  Amthor Heizung-Sanitär-Service GmbH mit dem Sitz in Weimar (Amtsgericht Jena HRB 523441) ausgegliedert. Die Firma ist erloschen. Von Amts wegen eingetragen aufgrund § 155 UmwG.\nNicht eingetragen: Den Gläubigern der an der Ausgliederung beteiligten Rechtsträger, ist wenn sie binnen sechs Monaten nach dem Tag, an dem die Eintragung der Ausgliederung in das Register des Sitzes desjenigen Rechtsträgers, dessen Gläubiger sie sind, nach §§125, 19 Abs. 3 UmwG als bekanntgemacht gilt, ihren Anspruch nach Grund und Höhe schriftlich anmelden, Sicherheit zu leisten, soweit sie nicht Befriedigung verlangen können. Dieses Recht steht ihnen jedoch nur zu, wenn sie glaubhaft machen, daß durch die Ausgliederung die Erfüllung ihrer Forderung gefährdet wird."
    },
    {
      "date": "2025-07-02",
      "id": "114351",
      "original_text": "Löschungsankündigung\nThüringen Amtsgericht Jena HRB 509279\nMalerfachbetrieb Markus Gille GmbH – Heiligenstadt",
      "type": "Löschungsankündigung",
      "state": "Thüringen",
      "amtsgericht": "Amtsgericht Jena",
      "registernummer": "HRB 509279",
      "registerart": "HRB",
      "company_name": "Malerfachbetrieb Markus Gille GmbH",
      "company_seat": "Heiligenstadt",
      "details": "02.07.2025 (Bekanntmachungsdatum)\n\nThüringen Amtsgericht Jena HRB 509279\nLöschungsankündigung\n\nMalerfachbetrieb Markus Gille GmbH\nGesellschaft mit beschränkter Haftung\nHeiligenstadt\n\nDas Registergericht beabsichtigt, die im Handelsregister eingetragene Gesellschaft wegen Vermögenslosigkeit nach § 394 FamFG von Amts wegen zu löschen. Die Frist zur Erhebung eines Widerspruchs gegen die beabsichtigte Löschung wird auf 6 Wochen festgesetzt."
    },
    {
      "date": "2025-07-02",
      "id": "114352",
      "original_text": "Sonstige Registerbekanntmachung\nHessen Amtsgericht Wiesbaden HRB 2376\nRHI Magnesita Deutschland AG – Wiesbaden",
      "type": "Sonstige Registerbekanntmachung",
      "state": "Hessen",
      "amtsgericht": "Amtsgericht Wiesbaden",
      "registernummer": "HRB 2376",
      "registerart": "HRB",
      "company_name": "RHI Magnesita Deutschland AG",
      "company_seat": "Wiesbaden",
      "details": "02.07.2025 (Bekanntmachungsdatum)\n\nHessen Amtsgericht Wiesbaden HRB 2376\nSonstige Registerbekanntmachung\n\nRHI Magnesita Deutschland AG\nAktiengesellschaft\nWiesbaden\n\nDie Gesellschaft hat den Entwurf des Verschmelzungsvertrages zwischen ihr und der Dr.-Ing. Petri & Co. Unterstützungs-Gesellschaft mit beschränkter Haftung , Wiesbaden (Amtsgericht Wiesbaden HRB 27837) beim Amtsgericht Wiesbaden (Registergericht) zur Einsichtnahme eingereicht."
    },
    {
      "date": "2025-07-02",
      "id": "114353",
      "original_text": "Sonstige Registerbekanntmachung\nHessen Amtsgericht Frankfurt am Main HRB 78036\nAKBANK AG – Eschborn",
      "type": "Sonstige Registerbekanntmachung",
      "state": "Hessen",
      "amtsgericht": "Amtsgericht Frankfurt am Main",
      "registernummer": "HRB 78036",
      "registerart": "HRB",
      "company_name": "AKBANK AG",
      "company_seat": "Eschborn",
      "details": "02.07.2025 (Bekanntmachungsdatum)\n\nHessen Amtsgericht Frankfurt am Main HRB 78036\nSonstige Registerbekanntmachung\n\nAKBANK AG\nAktiengesellschaft\nEschborn\n\nDurch eine Änderung in den Personen der Aufsichtsratsmitglieder ist eine Liste der Mitglieder des Aufsichtsrates zum Handelsregister eingereicht worden."
    },
    {
      "date": "2025-07-02",
      "id": "114354",
      "original_text": "Registerbekanntmachung nach dem Umwandlungsgesetz\nHessen Amtsgericht Offenbach am Main HRB 33354\nCommunication Systems Gesellschaft für Netzwerktechnik mit beschränkter Haftung – Neu-Isenburg",
      "type": "Registerbekanntmachung nach dem Umwandlungsgesetz",
      "state": "Hessen",
      "amtsgericht": "Amtsgericht Offenbach am Main",
      "registernummer": "HRB 33354",
      "registerart": "HRB",
      "company_name": "Communication Systems Gesellschaft für Netzwerktechnik mit beschränkter Haftung",
      "company_seat": "Neu-Isenburg",
      "details": "02.07.2025 (Bekanntmachungsdatum)\n\nHessen Amtsgericht Offenbach am Main HRB 33354\nRegisterbekanntmachung nach dem Umwandlungsgesetz 02.07.2025 (Eintragungsdatum)\n\nCommunication Systems Gesellschaft für Netzwerktechnik mit beschränkter Haftung\nGesellschaft mit beschränkter Haftung\nNeu-Isenburg\n\nDen Gläubigern der an der Abspaltung beteiligten Rechtsträger ist, wenn sie binnen sechs Monaten nach dem Tag, an dem die Eintragung der Abspaltung in das Register des Sitzes desjenigen Rechtsträgers, dessen Gläubiger sie sind, nach §§ 125, 19 Absatz 3 UmwG bekannt gemacht worden ist, ihren Anspruch nach Grund und Höhe schriftlich anmelden, Sicherheit zu leisten, soweit sie nicht Befriedigung verlangen können. Dieses Recht steht den Gläubigern jedoch nur zu, wenn sie glaubhaft machen, dass durch die Abspaltung die Erfüllung ihrer Forderung gefährdet wird."
    },
    {
      "date": "2025-07-02",
      "id": "114355",
      "original_text": "Registerbekanntmachung nach dem Umwandlungsgesetz\nHessen Amtsgericht Darmstadt HRB 101198\nFFD Handels GmbH – Riedstadt",
      "type": "Registerbekanntmachung nach dem Umwandlungsgesetz",
      "state": "Hessen",
      "amtsgericht": "Amtsgericht Darmstadt",
      "registernummer": "HRB 101198",
      "registerart": "HRB",
      "company_name": "FFD Handels GmbH",
      "company_seat": "Riedstadt",
      "details": "02.07.2025 (Bekanntmachungsdatum)\n\nHessen Amtsgericht Darmstadt HRB 101198\nRegisterbekanntmachung nach dem Umwandlungsgesetz 02.07.2025 (Eintragungsdatum)\n\nFFD Handels GmbH\nGesellschaft mit beschränkter Haftung\nRiedstadt\n\nDen Gläubigern der an der Verschmelzung beteiligten Rechtsträger ist, wenn sie binnen sechs Monaten nach dem Tag, an dem die Eintragung der Verschmelzung in das Register des Sitzes desjenigen Rechtsträgers, dessen Gläubiger sie sind, nach § 19 Absatz 3 UmwG bekannt gemacht worden ist, ihren Anspruch nach Grund und Höhe schriftlich anmelden, Sicherheit zu leisten, soweit sie nicht Befriedigung verlangen können. Dieses Recht steht den Gläubigern jedoch nur zu, wenn sie glaubhaft machen, dass durch die Verschmelzung die Erfüllung ihrer Forderung gefährdet wird."
    },
    {
      "date": "2025-07-02",
      "id": "114356",
      "original_text": "Registerbekanntmachung nach dem Umwandlungsgesetz\nHessen Amtsgericht Darmstadt GsR 726\nGalina und Arno Claßen eGbR – Roßdorf",
      "type": "Registerbekanntmachung nach dem Umwandlungsgesetz",
      "state": "Hessen",
      "amtsgericht": "Amtsgericht Darmstadt",
      "registernummer": "GsR 726",
      "registerart": "GsR",
      "company_name": "Galina und Arno Claßen eGbR",
      "company_seat": "Roßdorf",
      "details": "02.07.2025 (Bekanntmachungsdatum)\n\nHessen Amtsgericht Darmstadt GsR 726\nRegisterbekanntmachung nach dem Umwandlungsgesetz 02.07.2025 (Eintragungsdatum)\n\nGalina und Arno Claßen eGbR\nGesellschaft bürgerlichen Rechts\nRoßdorf\n\nDen Gläubigern der an der formwechselnden Umwandlung beteiligten Rechtsträger ist, wenn sie binnen sechs Monaten nach dem Tag, an dem die Eintragung der formwechselnden Umwandlung in das Register des Sitzes desjenigen Rechtsträgers, dessen Gläubiger sie sind, nach § 201 UmwG bekannt gemacht worden ist, ihren Anspruch nach Grund und Höhe schriftlich anmelden, Sicherheit zu leisten, soweit sie nicht Befriedigung verlangen können. Dieses Recht steht den Gläubigern jedoch nur zu, wenn sie glaubhaft machen, dass durch die formwechselnden Umwandlung die Erfüllung ihrer Forderung gefährdet wird."
    },
    {
      "date": "2025-07-02",
      "id": "114357",
      "original_text": "Registerbekanntmachung nach dem Umwandlungsgesetz\nHessen Amtsgericht Darmstadt HRB 98434\nClaßen GmbH – Roßdorf",
      "type": "Registerbekanntmachung nach dem Umwandlungsgesetz",
      "state": "Hessen",
      "amtsgericht": "Amtsgericht Darmstadt",
      "registernummer": "HRB 98434",
      "registerart": "HRB",
      "company_name": "Claßen GmbH",
      "company_seat": "Roßdorf",
      "details": "02.07.2025 (Bekanntmachungsdatum)\n\nHessen Amtsgericht Darmstadt HRB 98434\nRegisterbekanntmachung nach dem Umwandlungsgesetz 02.07.2025 (Eintragungsdatum)\n\nClaßen GmbH\nGesellschaft mit beschränkter Haftung\nRoßdorf\n\nDen Gläubigern der an der formwechselnden Umwandlung beteiligten Rechtsträger ist, wenn sie binnen sechs Monaten nach dem Tag, an dem die Eintragung der formwechselnden Umwandlung in das Register des Sitzes desjenigen Rechtsträgers, dessen Gläubiger sie sind, nach § 201 UmwG bekannt gemacht worden ist, ihren Anspruch nach Grund und Höhe schriftlich anmelden, Sicherheit zu leisten, soweit sie nicht Befriedigung verlangen können. Dieses Recht steht den Gläubigern jedoch nur zu, wenn sie glaubhaft machen, dass durch die formwechselnden Umwandlung die Erfüllung ihrer Forderung gefährdet wird."
    },
    {
      "date": "2025-07-02",
      "id": "114358",
      "original_text": "Registerbekanntmachung nach dem Umwandlungsgesetz\nHessen Amtsgericht Darmstadt HRB 90592\nFFD-Frisch Fruchtig Delp GmbH, Obst und Gemüse – Riedstadt",
      "type": "Registerbekanntmachung nach dem Umwandlungsgesetz",
      "state": "Hessen",
      "amtsgericht": "Amtsgericht Darmstadt",
      "registernummer": "HRB 90592",
      "registerart": "HRB",
      "company_name": "FFD-Frisch Fruchtig Delp GmbH, Obst und Gemüse",
      "company_seat": "Riedstadt",
      "details": "02.07.2025 (Bekanntmachungsdatum)\n\nHessen Amtsgericht Darmstadt HRB 90592\nRegisterbekanntmachung nach dem Umwandlungsgesetz 02.07.2025 (Eintragungsdatum)\n\nFFD-Frisch Fruchtig Delp GmbH, Obst und Gemüse\nGesellschaft mit beschränkter Haftung\nRiedstadt\n\nDen Gläubigern der an der Verschmelzung beteiligten Rechtsträger ist, wenn sie binnen sechs Monaten nach dem Tag, an dem die Eintragung der Verschmelzung in das Register des Sitzes desjenigen Rechtsträgers, dessen Gläubiger sie sind, nach § 19 Absatz 3 UmwG bekannt gemacht worden ist, ihren Anspruch nach Grund und Höhe schriftlich anmelden, Sicherheit zu leisten, soweit sie nicht Befriedigung verlangen können. Dieses Recht steht den Gläubigern jedoch nur zu, wenn sie glaubhaft machen, dass durch die Verschmelzung die Erfüllung ihrer Forderung gefährdet wird."
    },
    {
      "date": "2025-07-02",
      "id": "114359",
      "original_text": "Löschungsankündigung\nHessen Amtsgericht Frankfurt am Main HRB 121613\nSECURY POINT GmbH – Frankfurt am Main",
      "type": "Löschungsankündigung",
      "state": "Hessen",
      "amtsgericht": "Amtsgericht Frankfurt am Main",
      "registernummer": "HRB 121613",
      "registerart": "HRB",
      "company_name": "SECURY POINT GmbH",
      "company_seat": "Frankfurt am Main",
      "details": "02.07.2025 (Bekanntmachungsdatum)\n\nHessen Amtsgericht Frankfurt am Main HRB 121613\nLöschungsankündigung 02.07.2025 (Eintragungsdatum)\n\nSECURY POINT GmbH\nGesellschaft mit beschränkter Haftung\nFrankfurt am Main\n\nEs ist beabsichtigt die Gesellschaft wegen Vermögenslosigkeit gemäß § 394 FamFG von Amts wegen zu löschen. Hiergegen kann innerhalb eines Monats nach dieser Veröffentlichung Widerspruch bei dem Amtsgericht Frankfurt am Main eingelegt werden."
    },
    {
      "date": "2025-07-02",
      "id": "114360",
      "original_text": "Löschungsankündigung\nHessen Amtsgericht Offenbach am Main HRB 51356\nDEMIR Hoch- und Tiefbau GmbH – Offenbach am Main",
      "type": "Löschungsankündigung",
      "state": "Hessen",
      "amtsgericht": "Amtsgericht Offenbach am Main",
      "registernummer": "HRB 51356",
      "registerart": "HRB",
      "company_name": "DEMIR Hoch- und Tiefbau GmbH",
      "company_seat": "Offenbach am Main",
      "details": "02.07.2025 (Bekanntmachungsdatum)\n\nHessen Amtsgericht Offenbach am Main HRB 51356\nLöschungsankündigung\n\nDEMIR Hoch- und Tiefbau GmbH\nGesellschaft mit beschränkter Haftung\nOffenbach am Main\n\nDas Registergericht beabsichtigt die im Handelsregister eingetragene Gesellschaft von Amts wegen nach § 394 FamFG zu löschen. Die Frist zur Erhebung eines Widerspruchs gegen die beabsichtigte Löschung wird auf 3 Monate festgesetzt."
    },
    {
      "date": "2025-07-02",
      "id": "114361",
      "original_text": "Registerbekanntmachung nach dem Umwandlungsgesetz\nHessen Amtsgericht Frankfurt am Main HRB 120015\nScannell Deutschland No. 009 GmbH – Frankfurt am Main",
      "type": "Registerbekanntmachung nach dem Umwandlungsgesetz",
      "state": "Hessen",
      "amtsgericht": "Amtsgericht Frankfurt am Main",
      "registernummer": "HRB 120015",
      "registerart": "HRB",
      "company_name": "Scannell Deutschland No. 009 GmbH",
      "company_seat": "Frankfurt am Main",
      "details": "02.07.2025 (Bekanntmachungsdatum)\n\nHessen Amtsgericht Frankfurt am Main HRB 120015\nRegisterbekanntmachung nach dem Umwandlungsgesetz 02.07.2025 (Eintragungsdatum)\n\nScannell Deutschland No. 009 GmbH\nGesellschaft mit beschränkter Haftung\nFrankfurt am Main\n\n1.\tDer Entwurf des Verschmelzungsplanes wurde am 10. Juni 2025 beim Handelsregister eingereicht.\n2.\tAn der grenzüberschreitenden Verschmelzung sind die folgenden Gesellschaften beteiligt (Rechtsform, Firma und Sitz)\na.\tScannell Properties Europe S.a.r.l. eine Gesellschaft mit beschränkter Haftung (sociéte a responsabilite limitee) nach dem Recht des Staates Luxemburg mit Sitz und Geschäftsanschrift 8, Rue Dicks, L-1417 Herzogtum Luxembourg, Luxemburg (Übernehmende Gesellschaft)\nb.\tScannell Deutschland No. 009 GmbH mit Sitz in Frankfurt am Main und Geschäftsanschrift c/o Mazars GmbH & Co. KG, Theodor-Stern-Kai 1, 60596 Frankfurt am Main (Übertragende Gesellschaft)\n3.\tDie an der grenzüberschreitenden Verschmelzung beteiligten Gesellschaften sind in folgenden Registern eingetragen (nebst jeweiliger Registernummer)\na.\tScannell Properties Europe S.a.r.l.\neingetragen im Handelsregister von Luxemburg (Registre de Commerce et des Societes, Luxembourg) unter der Registernummer B245273\nb.\tScannell Deutschland No. 009 GmbH\neingetragen im Handelsregister des Amtsgerichts Frankfurt Main unter HRB 120015\n4.\tDie Anteilsinhaber und Gläubiger der an der grenzüberschreitenden Verschmelzung beteiligten Gesellschaften sind\na.\tScannell Properties Europe LLC, Handelsregisternummer 201909031343665, eingetragen beim Secretary of State von Indiana mit Sitz und Geschäftsanschrift 8801 River Crossing Blvd. Suite 300, 46240 Indiana, Vereinigte Staaten von Amerika ist der Gesellschafter der übernehmenden Gesellschaft\nb.\tScannell Properties Europe S.a.r.l.\neingetragen im Handelsregister von Luxemburg (Registre de Commerce et des Societes, Luxembourg) unter der Registernummer B245273 ist der Gesellschafter der übertragenden Gesellschaft.\n5.\tEs erfolgt ein Hinweis an folgende Personen, dass sie der jeweiligen Gesellschaft spätestens bis zum 20. Juli 2025 Bemerkungen zum Verschmelzungsplan übermitteln können:\nAn die Anteilsinhaber und Gläubiger der an der grenzüberschreitenden Verschmelzung beteiligten Gesellschaften\nDa es weder einen Betriebsrat bei den beteiligten Gesellschaften gibt, noch Arbeitnehmer, ist ein Hinweis an diese nicht erforderlich."
    },
    {
      "date": "2025-07-02",
      "id": "114362",
      "original_text": "Löschungsankündigung\nHessen Amtsgericht Frankfurt am Main HRB 96112\nEnsis GmbH – Frankfurt am Main",
      "type": "Löschungsankündigung",
      "state": "Hessen",
      "amtsgericht": "Amtsgericht Frankfurt am Main",
      "registernummer": "HRB 96112",
      "registerart": "HRB",
      "company_name": "Ensis GmbH",
      "company_seat": "Frankfurt am Main",
      "details": "02.07.2025 (Bekanntmachungsdatum)\n\nHessen Amtsgericht Frankfurt am Main HRB 96112\nLöschungsankündigung 02.07.2025 (Eintragungsdatum)\n\nEnsis GmbH\nGesellschaft mit beschränkter Haftung\nFrankfurt am Main\n\nEs ist beabsichtigt die Gesellschaft wegen Vermögenslosigkeit gemäß § 394 FamFG von Amts wegen zu löschen. Hiergegen kann innerhalb eines Monats nach dieser Veröffentlichung Widerspruch bei dem Amtsgericht Frankfurt am Main eingelegt werden."
    },
    {
      "date": "2025-07-02",
      "id": "114363",
      "original_text": "Einreichung neuer Dokumente\nHessen Amtsgericht Wiesbaden HRB 2376\nRHI Magnesita Deutschland AG – Wiesbaden",
      "type": "Einreichung neuer Dokumente",
      "state": "Hessen",
      "amtsgericht": "Amtsgericht Wiesbaden",
      "registernummer": "HRB 2376",
      "registerart": "HRB",
      "company_name": "RHI Magnesita Deutschland AG",
      "company_seat": "Wiesbaden",
      "details": "02.07.2025 (Bekanntmachungsdatum)\n\nHessen Amtsgericht Wiesbaden HRB 2376\nEinreichung neuer Dokumente\n\nRHI Magnesita Deutschland AG\nAktiengesellschaft\nWiesbaden\n\nDie Gesellschaft hat den Entwurf des Verschmelzungsvertrages zwischen ihr und der Zimmermann & Jansen GmbH, Wiesbaden (Amtsgericht Wiesbaden HRB 31044) beim Amtsgericht Wiesbaden (Registergericht) zur Einsichtnahme eingereicht."
    },
    {
      "date": "2025-07-02",
      "id": "114364",
      "original_text": "Löschungsankündigung\nHessen Amtsgericht Darmstadt HRB 103134\nsecsafe GmbH – Rüsselsheim am Main",
      "type": "Löschungsankündigung",
      "state": "Hessen",
      "amtsgericht": "Amtsgericht Darmstadt",
      "registernummer": "HRB 103134",
      "registerart": "HRB",
      "company_name": "secsafe GmbH",
      "company_seat": "Rüsselsheim am Main",
      "details": "02.07.2025 (Bekanntmachungsdatum)\n\nHessen Amtsgericht Darmstadt HRB 103134\nLöschungsankündigung 02.07.2025 (Eintragungsdatum)\n\nsecsafe GmbH\nGesellschaft mit beschränkter Haftung\nRüsselsheim am Main\n\nDas Registergericht beabsichtigt die im Handelsregister eingetragene Gesellschaft von Amts wegen nach § 394 FamFG zu löschen. Die Frist zur Erhebung eines Widerspruchs gegen die beabsichtigte Löschung wird auf 3 Monate festgesetzt."
    }
  ]
}