{
  "date": "2025-07-10",
  "date_of_scrape": "2025-08-26T12:42:47.142Z",
  "tool_version": "0.2.0",
  "number_of_announcements": 217,
  "announcements": [
    {
      "date": "2025-07-10",
      "id": "115240",
      "original_text": "Löschungsankündigung\nBayern Amtsgericht Nürnberg HRB 31425\nATGI-UG (haftungsbeschränkt) – Nürnberg",
      "type": "Löschungsankündigung",
      "state": "Bayern",
      "amtsgericht": "Amtsgericht Nürnberg",
      "registernummer": "HRB 31425",
      "registerart": "HRB",
      "company_name": "ATGI-UG (haftungsbeschränkt)",
      "company_seat": "Nürnberg",
      "details": "10.07.2025 (Bekanntmachungsdatum)\n\nBayern Amtsgericht Nürnberg HRB 31425\nLöschungsankündigung\n\nATGI-UG (haftungsbeschränkt)\nGesellschaft mit beschränkter Haftung\nNürnberg\n\nDas Registergericht beabsichtigt, die im Handelsregister eingetragene Gesellschaft wegen Vermögenslosigkeit von Amts wegen nach § 394 FamFG zu löschen. Die Frist zur Erhebung eines Widerspruchs ist auf einen Monat festgesetzt."
    },
    {
      "date": "2025-07-10",
      "id": "115241",
      "original_text": "Registerbekanntmachung nach dem Umwandlungsgesetz\nBayern Amtsgericht München HRB 259559\nSozialkonzept Lorettahof GmbH Betriebsgesellschaft sozialer Einrichtungen – München",
      "type": "Registerbekanntmachung nach dem Umwandlungsgesetz",
      "state": "Bayern",
      "amtsgericht": "Amtsgericht München",
      "registernummer": "HRB 259559",
      "registerart": "HRB",
      "company_name": "Sozialkonzept Lorettahof GmbH Betriebsgesellschaft sozialer Einrichtungen",
      "company_seat": "München",
      "details": "10.07.2025 (Bekanntmachungsdatum)\n\nBayern Amtsgericht München HRB 259559\nRegisterbekanntmachung nach dem Umwandlungsgesetz 09.07.2025 (Eintragungsdatum)\n\nSozialkonzept Lorettahof GmbH Betriebsgesellschaft sozialer Einrichtungen\nGesellschaft mit beschränkter Haftung\nMünchen\n\nDen Gläubigern der an der Verschmelzung beteiligten Rechtsträger ist, wenn sie binnen sechs Monaten nach dem Tag, an dem die Eintragung der Verschmelzung in das Register des Sitzes desjenigen Rechtsträgers, dessen Gläubiger sie sind, nach § 19 Abs. 3 UmwG als bekannt gemacht gilt, ihren Anspruch nach Grund und Höhe in Textform anmelden, Sicherheit zu leisten, soweit sie nicht Befriedigung verlangen können. Dieses Recht steht den Gläubigern jedoch nur zu, wenn sie glaubhaft machen, dass durch die Verschmelzung die Erfüllung ihrer Forderung gefährdet wird."
    },
    {
      "date": "2025-07-10",
      "id": "115242",
      "original_text": "Registerbekanntmachung nach dem Umwandlungsgesetz\nBayern Amtsgericht Schweinfurt HRB 5837\nMezger Sicherheits- und Kommunikationstechnik GmbH – Schweinfurt",
      "type": "Registerbekanntmachung nach dem Umwandlungsgesetz",
      "state": "Bayern",
      "amtsgericht": "Amtsgericht Schweinfurt",
      "registernummer": "HRB 5837",
      "registerart": "HRB",
      "company_name": "Mezger Sicherheits- und Kommunikationstechnik GmbH",
      "company_seat": "Schweinfurt",
      "details": "10.07.2025 (Bekanntmachungsdatum)\n\nBayern Amtsgericht Schweinfurt HRB 5837\nRegisterbekanntmachung nach dem Umwandlungsgesetz 09.07.2025 (Eintragungsdatum)\n\nMezger Sicherheits- und Kommunikationstechnik GmbH\nGesellschaft mit beschränkter Haftung\nSchweinfurt\n\nDen Gläubigern der an der Verschmelzung beteiligten Rechtsträger ist, wenn sie binnen sechs Monaten nach dem Tag, an dem die Eintragung der Verschmelzung in das Register des Sitzes desjenigen Rechtsträgers, dessen Gläubiger sie sind, nach § 19 Abs. 3 UmwG als bekannt gemacht gilt, ihren Anspruch nach Grund und Höhe in Textform anmelden, Sicherheit zu leisten, soweit sie nicht Befriedigung verlangen können. Dieses Recht steht den Gläubigern jedoch nur zu, wenn sie glaubhaft machen, dass durch die Verschmelzung die Erfüllung ihrer Forderung gefährdet wird."
    },
    {
      "date": "2025-07-10",
      "id": "115243",
      "original_text": "Löschungsankündigung\nBayern Amtsgericht Traunstein HRB 29661\nParcel7 UG (haftungsbeschränkt) – Freilassing",
      "type": "Löschungsankündigung",
      "state": "Bayern",
      "amtsgericht": "Amtsgericht Traunstein",
      "registernummer": "HRB 29661",
      "registerart": "HRB",
      "company_name": "Parcel7 UG (haftungsbeschränkt)",
      "company_seat": "Freilassing",
      "details": "10.07.2025 (Bekanntmachungsdatum)\n\nBayern Amtsgericht Traunstein HRB 29661\nLöschungsankündigung 09.07.2025 (Eintragungsdatum)\n\nParcel7 UG (haftungsbeschränkt)\nGesellschaft mit beschränkter Haftung\nFreilassing\n\nDas Registergericht beabsichtigt, die im Handelsregister eingetragene Gesellschaft auf Antrag des Finanzamtes wegen Vermögenslosigkeit von Amts wegen nach § 394 FamFG zu löschen. Die Frist zur Erhebung eines Widerspruchs ist auf einen Monat festgesetzt."
    },
    {
      "date": "2025-07-10",
      "id": "115244",
      "original_text": "Löschungsankündigung\nBayern Amtsgericht Würzburg HRB 12107\nCreative Communication UG (haftungsbeschränkt) – Gerbrunn",
      "type": "Löschungsankündigung",
      "state": "Bayern",
      "amtsgericht": "Amtsgericht Würzburg",
      "registernummer": "HRB 12107",
      "registerart": "HRB",
      "company_name": "Creative Communication UG (haftungsbeschränkt)",
      "company_seat": "Gerbrunn",
      "details": "10.07.2025 (Bekanntmachungsdatum)\n\nBayern Amtsgericht Würzburg HRB 12107\nLöschungsankündigung\n\nCreative Communication UG (haftungsbeschränkt)\nGesellschaft mit beschränkter Haftung\nGerbrunn\n\nDas Registergericht beabsichtigt, die im Handelsregister eingetragene Firma von Amts wegen nach § 31 Abs. 2 HGB, § 393 FamFG zu löschen. Die Frist zur Erhebung eines Widerspruchs ist auf drei Monate festgesetzt."
    },
    {
      "date": "2025-07-10",
      "id": "115245",
      "original_text": "Löschungsankündigung\nBayern Amtsgericht Würzburg HRB 15306\nJ&S Wohnbau GmbH – Volkach",
      "type": "Löschungsankündigung",
      "state": "Bayern",
      "amtsgericht": "Amtsgericht Würzburg",
      "registernummer": "HRB 15306",
      "registerart": "HRB",
      "company_name": "J&S Wohnbau GmbH",
      "company_seat": "Volkach",
      "details": "10.07.2025 (Bekanntmachungsdatum)\n\nBayern Amtsgericht Würzburg HRB 15306\nLöschungsankündigung 15.11.2022 (Eintragungsdatum)\n\nJ&S Wohnbau GmbH\nGesellschaft mit beschränkter Haftung\nVolkach\n\nDas Registergericht beabsichtigt, die im Handelsregister eingetragene Gesellschaft wegen Vermögenslosigkeit von Amts wegen nach § 394 FamFG zu löschen.\nDie Widerspruchsfrist beträgt 3 Monate."
    },
    {
      "date": "2025-07-10",
      "id": "115246",
      "original_text": "Registerbekanntmachung nach dem Umwandlungsgesetz\nBayern Amtsgericht Kempten (Allgäu) HRB 10117\nErdgas Kempten-Oberallgäu Netz GmbH – Kempten (Allgäu)",
      "type": "Registerbekanntmachung nach dem Umwandlungsgesetz",
      "state": "Bayern",
      "amtsgericht": "Amtsgericht Kempten (Allgäu)",
      "registernummer": "HRB 10117",
      "registerart": "HRB",
      "company_name": "Erdgas Kempten-Oberallgäu Netz GmbH",
      "company_seat": "Kempten (Allgäu)",
      "details": "10.07.2025 (Bekanntmachungsdatum)\n\nBayern Amtsgericht Kempten (Allgäu) HRB 10117\nRegisterbekanntmachung nach dem Umwandlungsgesetz 09.07.2025 (Eintragungsdatum)\n\nErdgas Kempten-Oberallgäu Netz GmbH\nGesellschaft mit beschränkter Haftung\nKempten (Allgäu)\n\nDen Gläubigern der an der Verschmelzung beteiligten Rechtsträger ist, wenn sie binnen sechs Monaten nach dem Tag, an dem die Eintragung der Verschmelzung in das Register des Sitzes desjenigen Rechtsträgers, dessen Gläubiger sie sind, nach § 19 Abs. 3 UmwG als bekannt gemacht gilt, ihren Anspruch nach Grund und Höhe in Textform anmelden, Sicherheit zu leisten, soweit sie nicht Befriedigung verlangen können. Dieses Recht steht den Gläubigern jedoch nur zu, wenn sie glaubhaft machen, dass durch die Verschmelzung die Erfüllung ihrer Forderung gefährdet wird."
    },
    {
      "date": "2025-07-10",
      "id": "115247",
      "original_text": "Registerbekanntmachung nach dem Umwandlungsgesetz\nBayern Amtsgericht München HRB 293301\nBaywobau Real Estate Holding GmbH – Grünwald",
      "type": "Registerbekanntmachung nach dem Umwandlungsgesetz",
      "state": "Bayern",
      "amtsgericht": "Amtsgericht München",
      "registernummer": "HRB 293301",
      "registerart": "HRB",
      "company_name": "Baywobau Real Estate Holding GmbH",
      "company_seat": "Grünwald",
      "details": "10.07.2025 (Bekanntmachungsdatum)\n\nBayern Amtsgericht München HRB 293301\nRegisterbekanntmachung nach dem Umwandlungsgesetz 09.07.2025 (Eintragungsdatum)\n\nBaywobau Real Estate Holding GmbH\nGesellschaft mit beschränkter Haftung\nGrünwald\n\nDen Gläubigern der an der Spaltung beteiligten Rechtsträger ist, wenn sie binnen sechs Monaten nach dem Tag, an dem die Eintragung der Spaltung in das Register des Sitzes desjenigen Rechtsträgers, dessen Gläubiger sie sind, nach §§ 125, 19 Abs. 3 UmwG als bekannt gemacht gilt, ihren Anspruch nach Grund und Höhe in Textform anmelden, Sicherheit zu leisten, soweit sie nicht Befriedigung verlangen können. Dieses Recht steht den Gläubigern jedoch nur zu, wenn sie glaubhaft machen, dass durch die Spaltung die Erfüllung ihrer Forderung gefährdet wird."
    },
    {
      "date": "2025-07-10",
      "id": "115248",
      "original_text": "Sonstige Registerbekanntmachung\nBayern Amtsgericht Nürnberg HRB 30556\nJurpex GmbH – Nürnberg",
      "type": "Sonstige Registerbekanntmachung",
      "state": "Bayern",
      "amtsgericht": "Amtsgericht Nürnberg",
      "registernummer": "HRB 30556",
      "registerart": "HRB",
      "company_name": "Jurpex GmbH",
      "company_seat": "Nürnberg",
      "details": "10.07.2025 (Bekanntmachungsdatum)\n\nBayern Amtsgericht Nürnberg HRB 30556\nSonstige Registerbekanntmachung 09.07.2025 (Eintragungsdatum)\n\nJurpex GmbH\nGesellschaft mit beschränkter Haftung\nNürnberg\n\nDen Gläubigern der Gesellschaft, deren Forderungen begründet worden sind, bevor die Eintragung der Beendigung des Beherrschungs- und Gewinnabführungsvertrages in das Handelsregister nach § 10 des Handelsgesetzbuches als bekanntgemacht gilt, hat der andere Vertragsteil Sicherheit zu leisten, wenn sie sich binnen sechs Monaten nach der Bekanntmachung der Eintragung zu diesem Zweck bei ihm melden."
    },
    {
      "date": "2025-07-10",
      "id": "115249",
      "original_text": "Löschungsankündigung\nBayern Amtsgericht Nürnberg HRB 27129\nIPS Sicherheitsdienst Nürnberg UG (haftungsbeschränkt) – Nürnberg",
      "type": "Löschungsankündigung",
      "state": "Bayern",
      "amtsgericht": "Amtsgericht Nürnberg",
      "registernummer": "HRB 27129",
      "registerart": "HRB",
      "company_name": "IPS Sicherheitsdienst Nürnberg UG (haftungsbeschränkt)",
      "company_seat": "Nürnberg",
      "details": "10.07.2025 (Bekanntmachungsdatum)\n\nBayern Amtsgericht Nürnberg HRB 27129\nLöschungsankündigung\n\nIPS Sicherheitsdienst Nürnberg UG (haftungsbeschränkt)\nGesellschaft mit beschränkter Haftung\nNürnberg\n\nDas Registergericht beabsichtigt, die im Handelsregister eingetragene Gesellschaft wegen Vermögenslosigkeit von Amts wegen nach § 394 FamFG zu löschen. Die Frist zur Erhebung eines Widerspruchs ist auf einen Monat festgesetzt."
    },
    {
      "date": "2025-07-10",
      "id": "115250",
      "original_text": "Einreichung neuer Dokumente\nBayern Amtsgericht München HRB 186737\nEntelios AG – München",
      "type": "Einreichung neuer Dokumente",
      "state": "Bayern",
      "amtsgericht": "Amtsgericht München",
      "registernummer": "HRB 186737",
      "registerart": "HRB",
      "company_name": "Entelios AG",
      "company_seat": "München",
      "details": "10.07.2025 (Bekanntmachungsdatum)\n\nBayern Amtsgericht München HRB 186737\nEinreichung neuer Dokumente\n\nEntelios AG\nAktiengesellschaft\nMünchen\n\nDem Amtsgericht München -Registergericht- ist eine Liste der Mitglieder des Aufsichtsrats eingereicht worden, § 106 AktG."
    },
    {
      "date": "2025-07-10",
      "id": "115251",
      "original_text": "Einreichung neuer Dokumente\nBayern Amtsgericht Würzburg HRB 9579\nUKW Service GmbH – Würzburg",
      "type": "Einreichung neuer Dokumente",
      "state": "Bayern",
      "amtsgericht": "Amtsgericht Würzburg",
      "registernummer": "HRB 9579",
      "registerart": "HRB",
      "company_name": "UKW Service GmbH",
      "company_seat": "Würzburg",
      "details": "10.07.2025 (Bekanntmachungsdatum)\n\nBayern Amtsgericht Würzburg HRB 9579\nEinreichung neuer Dokumente 09.07.2025 (Eintragungsdatum)\n\nUKW Service GmbH\nGesellschaft mit beschränkter Haftung\nWürzburg\n\nDem Amtsgericht Würzburg -Registergericht- ist eine Liste der Mitglieder des Aufsichtsrats eingereicht worden, § 52 Abs. 3 S. 2 GmbHG."
    },
    {
      "date": "2025-07-10",
      "id": "115252",
      "original_text": "Registerbekanntmachung nach dem Umwandlungsgesetz\nBayern Amtsgericht München HRB 220268\nGoja Design GmbH – Irschenberg",
      "type": "Registerbekanntmachung nach dem Umwandlungsgesetz",
      "state": "Bayern",
      "amtsgericht": "Amtsgericht München",
      "registernummer": "HRB 220268",
      "registerart": "HRB",
      "company_name": "Goja Design GmbH",
      "company_seat": "Irschenberg",
      "details": "10.07.2025 (Bekanntmachungsdatum)\n\nBayern Amtsgericht München HRB 220268\nRegisterbekanntmachung nach dem Umwandlungsgesetz 09.07.2025 (Eintragungsdatum)\n\nGoja Design GmbH\nGesellschaft mit beschränkter Haftung\nIrschenberg\n\nDen Gläubigern des formwechselnden Rechtsträgers ist, wenn sie binnen sechs Monaten nach dem Tag, an dem die Eintragung des Formwechsels nach § 201 UmwG als bekannt gemacht gilt, ihren Anspruch nach Grund und Höhe in Textform anmelden, Sicherheit zu leisten, soweit sie nicht Befriedigung verlangen können. Dieses Recht steht den Gläubigern jedoch nur zu, wenn sie glaubhaft machen, dass durch den Formwechsel die Erfüllung ihrer Forderung gefährdet wird."
    },
    {
      "date": "2025-07-10",
      "id": "115253",
      "original_text": "Registerbekanntmachung nach dem Umwandlungsgesetz\nBayern Amtsgericht München HRB 297540\nNeo Intermediate Three GmbH – München",
      "type": "Registerbekanntmachung nach dem Umwandlungsgesetz",
      "state": "Bayern",
      "amtsgericht": "Amtsgericht München",
      "registernummer": "HRB 297540",
      "registerart": "HRB",
      "company_name": "Neo Intermediate Three GmbH",
      "company_seat": "München",
      "details": "10.07.2025 (Bekanntmachungsdatum)\n\nBayern Amtsgericht München HRB 297540\nRegisterbekanntmachung nach dem Umwandlungsgesetz 09.07.2025 (Eintragungsdatum)\n\nNeo Intermediate Three GmbH\nGesellschaft mit beschränkter Haftung\nMünchen\n\nDen Gläubigern der an der Verschmelzung beteiligten Rechtsträger ist, wenn sie binnen sechs Monaten nach dem Tag, an dem die Eintragung der Verschmelzung in das Register des Sitzes desjenigen Rechtsträgers, dessen Gläubiger sie sind, nach § 19 Abs. 3 UmwG als bekannt gemacht gilt, ihren Anspruch nach Grund und Höhe in Textform anmelden, Sicherheit zu leisten, soweit sie nicht Befriedigung verlangen können. Dieses Recht steht den Gläubigern jedoch nur zu, wenn sie glaubhaft machen, dass durch die Verschmelzung die Erfüllung ihrer Forderung gefährdet wird."
    },
    {
      "date": "2025-07-10",
      "id": "115254",
      "original_text": "Registerbekanntmachung nach dem Umwandlungsgesetz\nBayern Amtsgericht Memmingen HRB 7300\nKulanz + Service Immobilien GmbH, Vermittlung und Bewertung – Illertissen",
      "type": "Registerbekanntmachung nach dem Umwandlungsgesetz",
      "state": "Bayern",
      "amtsgericht": "Amtsgericht Memmingen",
      "registernummer": "HRB 7300",
      "registerart": "HRB",
      "company_name": "Kulanz + Service Immobilien GmbH, Vermittlung und Bewertung",
      "company_seat": "Illertissen",
      "details": "10.07.2025 (Bekanntmachungsdatum)\n\nBayern Amtsgericht Memmingen HRB 7300\nRegisterbekanntmachung nach dem Umwandlungsgesetz 09.07.2025 (Eintragungsdatum)\n\nKulanz + Service Immobilien GmbH, Vermittlung und Bewertung\nGesellschaft mit beschränkter Haftung\nIllertissen\n\nDen Gläubigern der an der Verschmelzung beteiligten Rechtsträger ist, wenn sie binnen sechs Monaten nach dem Tag, an dem die Eintragung der Verschmelzung in das Register des Sitzes desjenigen Rechtsträgers, dessen Gläubiger sie sind, nach § 19 Abs. 3 UmwG als bekannt gemacht gilt, ihren Anspruch nach Grund und Höhe in Textform anmelden, Sicherheit zu leisten, soweit sie nicht Befriedigung verlangen können. Dieses Recht steht den Gläubigern jedoch nur zu, wenn sie glaubhaft machen, dass durch die Verschmelzung die Erfüllung ihrer Forderung gefährdet wird."
    },
    {
      "date": "2025-07-10",
      "id": "115255",
      "original_text": "Registerbekanntmachung nach dem Umwandlungsgesetz\nBayern Amtsgericht Fürth HRB 21707\nCyberfeld GmbH – Oberasbach",
      "type": "Registerbekanntmachung nach dem Umwandlungsgesetz",
      "state": "Bayern",
      "amtsgericht": "Amtsgericht Fürth",
      "registernummer": "HRB 21707",
      "registerart": "HRB",
      "company_name": "Cyberfeld GmbH",
      "company_seat": "Oberasbach",
      "details": "10.07.2025 (Bekanntmachungsdatum)\n\nBayern Amtsgericht Fürth HRB 21707\nRegisterbekanntmachung nach dem Umwandlungsgesetz 09.07.2025 (Eintragungsdatum)\n\nCyberfeld GmbH\nGesellschaft mit beschränkter Haftung\nOberasbach\n\nDen Gläubigern der an der Verschmelzung beteiligten Rechtsträger ist, wenn sie binnen sechs Monaten nach dem Tag, an dem die Eintragung der Verschmelzung in das Register des Sitzes desjenigen Rechtsträgers, dessen Gläubiger sie sind, nach § 19 Abs. 3 UmwG als bekannt gemacht gilt, ihren Anspruch nach Grund und Höhe in Textform anmelden, Sicherheit zu leisten, soweit sie nicht Befriedigung verlangen können. Dieses Recht steht den Gläubigern jedoch nur zu, wenn sie glaubhaft machen, dass durch die Verschmelzung die Erfüllung ihrer Forderung gefährdet wird."
    },
    {
      "date": "2025-07-10",
      "id": "115256",
      "original_text": "Sonstige Registerbekanntmachung\nBayern Amtsgericht München HRB 226213\nPHÖNIX-Seniorenresidenz Am Teichberg GmbH – München",
      "type": "Sonstige Registerbekanntmachung",
      "state": "Bayern",
      "amtsgericht": "Amtsgericht München",
      "registernummer": "HRB 226213",
      "registerart": "HRB",
      "company_name": "PHÖNIX-Seniorenresidenz Am Teichberg GmbH",
      "company_seat": "München",
      "details": "10.07.2025 (Bekanntmachungsdatum)\n\nBayern Amtsgericht München HRB 226213\nSonstige Registerbekanntmachung 09.07.2025 (Eintragungsdatum)\n\nPHÖNIX-Seniorenresidenz Am Teichberg GmbH\nGesellschaft mit beschränkter Haftung\nMünchen\n\nDen Gläubigern der Gesellschaft, deren Forderungen begründet worden sind, bevor die Eintragung der Beendigung des Beherrschungs- und Gewinnabführungsvertrages in das Handelsregister nach § 10 des Handelsgesetzbuches als bekanntgemacht gilt, hat der andere Vertragsteil Sicherheit zu leisten, wenn sie sich binnen sechs Monaten nach der Bekanntmachung der Eintragung zu diesem Zweck bei ihm melden."
    },
    {
      "date": "2025-07-10",
      "id": "115257",
      "original_text": "Registerbekanntmachung nach dem Umwandlungsgesetz\nBayern Amtsgericht München HRB 297413\nAlexC.Onsulting GmbH – München",
      "type": "Registerbekanntmachung nach dem Umwandlungsgesetz",
      "state": "Bayern",
      "amtsgericht": "Amtsgericht München",
      "registernummer": "HRB 297413",
      "registerart": "HRB",
      "company_name": "AlexC.Onsulting GmbH",
      "company_seat": "München",
      "details": "10.07.2025 (Bekanntmachungsdatum)\n\nBayern Amtsgericht München HRB 297413\nRegisterbekanntmachung nach dem Umwandlungsgesetz 09.07.2025 (Eintragungsdatum)\n\nAlexC.Onsulting GmbH\nGesellschaft mit beschränkter Haftung\nMünchen\n\nDen Gläubigern der an der Verschmelzung beteiligten Rechtsträger ist, wenn sie binnen sechs Monaten nach dem Tag, an dem die Eintragung der Verschmelzung in das Register des Sitzes desjenigen Rechtsträgers, dessen Gläubiger sie sind, nach § 19 Abs. 3 UmwG als bekannt gemacht gilt, ihren Anspruch nach Grund und Höhe in Textform anmelden, Sicherheit zu leisten, soweit sie nicht Befriedigung verlangen können. Dieses Recht steht den Gläubigern jedoch nur zu, wenn sie glaubhaft machen, dass durch die Verschmelzung die Erfüllung ihrer Forderung gefährdet wird."
    },
    {
      "date": "2025-07-10",
      "id": "115258",
      "original_text": "Registerbekanntmachung nach dem Umwandlungsgesetz\nBayern Amtsgericht München HRB 271995\nEURAS MedTech GmbH – Gräfelfing",
      "type": "Registerbekanntmachung nach dem Umwandlungsgesetz",
      "state": "Bayern",
      "amtsgericht": "Amtsgericht München",
      "registernummer": "HRB 271995",
      "registerart": "HRB",
      "company_name": "EURAS MedTech GmbH",
      "company_seat": "Gräfelfing",
      "details": "10.07.2025 (Bekanntmachungsdatum)\n\nBayern Amtsgericht München HRB 271995\nRegisterbekanntmachung nach dem Umwandlungsgesetz 09.07.2025 (Eintragungsdatum)\n\nEURAS MedTech GmbH\nGesellschaft mit beschränkter Haftung\nGräfelfing\n\nDen Gläubigern der an der Verschmelzung beteiligten Rechtsträger ist, wenn sie binnen sechs Monaten nach dem Tag, an dem die Eintragung der Verschmelzung in das Register des Sitzes desjenigen Rechtsträgers, dessen Gläubiger sie sind, nach § 19 Abs. 3 UmwG als bekannt gemacht gilt, ihren Anspruch nach Grund und Höhe in Textform anmelden, Sicherheit zu leisten, soweit sie nicht Befriedigung verlangen können. Dieses Recht steht den Gläubigern jedoch nur zu, wenn sie glaubhaft machen, dass durch die Verschmelzung die Erfüllung ihrer Forderung gefährdet wird."
    },
    {
      "date": "2025-07-10",
      "id": "115259",
      "original_text": "Einreichung neuer Dokumente\nBayern Amtsgericht München HRB 158981\nPaulaner Brauerei Gruppe GmbH & Co. KGaA – München",
      "type": "Einreichung neuer Dokumente",
      "state": "Bayern",
      "amtsgericht": "Amtsgericht München",
      "registernummer": "HRB 158981",
      "registerart": "HRB",
      "company_name": "Paulaner Brauerei Gruppe GmbH & Co. KGaA",
      "company_seat": "München",
      "details": "10.07.2025 (Bekanntmachungsdatum)\n\nBayern Amtsgericht München HRB 158981\nEinreichung neuer Dokumente 09.07.2025 (Eintragungsdatum)\n\nPaulaner Brauerei Gruppe GmbH & Co. KGaA\nKommanditgesellschaft auf Aktien\nMünchen\n\nDem Amtsgericht München -Registergericht- isteine Liste der Mitglieder des Aufsichtsrats eingereicht worden, §§ 278 Abs. 3, 106 AktG.Dem Amtsgericht München -Registergericht- isteine Liste der Mitglieder des Aufsichtsrats eingereicht worden, §§ 278 Abs. 3, 106 AktG."
    },
    {
      "date": "2025-07-10",
      "id": "115260",
      "original_text": "Sonstige Registerbekanntmachung\nBayern Amtsgericht Bayreuth HRB 6146\nDEVINA Sechsundfünfzigste Beteiligungs GmbH – Kulmbach",
      "type": "Sonstige Registerbekanntmachung",
      "state": "Bayern",
      "amtsgericht": "Amtsgericht Bayreuth",
      "registernummer": "HRB 6146",
      "registerart": "HRB",
      "company_name": "DEVINA Sechsundfünfzigste Beteiligungs GmbH",
      "company_seat": "Kulmbach",
      "details": "10.07.2025 (Bekanntmachungsdatum)\n\nBayern Amtsgericht Bayreuth HRB 6146\nSonstige Registerbekanntmachung 09.07.2025 (Eintragungsdatum)\n\nDEVINA Sechsundfünfzigste Beteiligungs GmbH\nGesellschaft mit beschränkter Haftung\nKulmbach\n\nDen Gläubigern der an der Verschmelzung beteiligten Rechtsträger ist, wenn sie binnen sechs Monaten nach dem Tag, an dem die Eintragung der Verschmelzung in das Register des Sitzes desjenigen Rechtsträgers, dessen Gläubiger sie sind, nach § 19 Abs. 3 UmwG als bekannt gemacht gilt, ihren Anspruch nach Grund und Höhe in Textform anmelden, Sicherheit zu leisten, soweit sie nicht Befriedigung verlangen können. Dieses Recht steht den Gläubigern jedoch nur zu, wenn sie glaubhaft machen, dass durch die Verschmelzung die Erfüllung ihrer Forderung gefährdet wird."
    },
    {
      "date": "2025-07-10",
      "id": "115261",
      "original_text": "Registerbekanntmachung nach dem Umwandlungsgesetz\nBayern Amtsgericht Memmingen HRB 21662\nGÖK Bauüberwachung Bahn GmbH – Senden",
      "type": "Registerbekanntmachung nach dem Umwandlungsgesetz",
      "state": "Bayern",
      "amtsgericht": "Amtsgericht Memmingen",
      "registernummer": "HRB 21662",
      "registerart": "HRB",
      "company_name": "GÖK Bauüberwachung Bahn GmbH",
      "company_seat": "Senden",
      "details": "10.07.2025 (Bekanntmachungsdatum)\n\nBayern Amtsgericht Memmingen HRB 21662\nRegisterbekanntmachung nach dem Umwandlungsgesetz 09.07.2025 (Eintragungsdatum)\n\nGÖK Bauüberwachung Bahn GmbH\nGesellschaft mit beschränkter Haftung\nSenden\n\nDen Gläubigern der an der Ausgliederung beteiligten Rechtsträger ist, wenn sie binnen sechs Monaten nach dem Tag, an dem die Eintragung der Ausgliederung in das Register des Sitzes desjenigen Rechtsträgers, dessen Gläubiger sie sind, nach §§ 125, 19 Abs. 3 UmwG als bekannt gemacht gilt, ihren Anspruch nach Grund und Höhe in Textform anmelden, Sicherheit zu leisten, soweit sie nicht Befriedigung verlangen können. Dieses Recht steht den Gläubigern jedoch nur zu, wenn sie glaubhaft machen, dass durch die Ausgliederung die Erfüllung ihrer Forderung gefährdet wird."
    },
    {
      "date": "2025-07-10",
      "id": "115262",
      "original_text": "Registerbekanntmachung nach dem Umwandlungsgesetz\nBayern Amtsgericht München HRB 103879\nImmoplan Immobilien Vermögensplanungsgesellschaft mbH – Neubiberg",
      "type": "Registerbekanntmachung nach dem Umwandlungsgesetz",
      "state": "Bayern",
      "amtsgericht": "Amtsgericht München",
      "registernummer": "HRB 103879",
      "registerart": "HRB",
      "company_name": "Immoplan Immobilien Vermögensplanungsgesellschaft mbH",
      "company_seat": "Neubiberg",
      "details": "10.07.2025 (Bekanntmachungsdatum)\n\nBayern Amtsgericht München HRB 103879\nRegisterbekanntmachung nach dem Umwandlungsgesetz 09.07.2025 (Eintragungsdatum)\n\nImmoplan Immobilien Vermögensplanungsgesellschaft mbH\nGesellschaft mit beschränkter Haftung\nNeubiberg\n\nDen Gläubigern der an der Verschmelzung beteiligten Rechtsträger ist, wenn sie binnen sechs Monaten nach dem Tag, an dem die Eintragung der Verschmelzung in das Register des Sitzes desjenigen Rechtsträgers, dessen Gläubiger sie sind, nach § 19 Abs. 3 UmwG als bekannt gemacht gilt, ihren Anspruch nach Grund und Höhe in Textform anmelden, Sicherheit zu leisten, soweit sie nicht Befriedigung verlangen können. Dieses Recht steht den Gläubigern jedoch nur zu, wenn sie glaubhaft machen, dass durch die Verschmelzung die Erfüllung ihrer Forderung gefährdet wird."
    },
    {
      "date": "2025-07-10",
      "id": "115263",
      "original_text": "Registerbekanntmachung nach dem Umwandlungsgesetz\nBayern Amtsgericht Nürnberg HRB 42159\nDrinks Union Deutschland GmbH – Nürnberg",
      "type": "Registerbekanntmachung nach dem Umwandlungsgesetz",
      "state": "Bayern",
      "amtsgericht": "Amtsgericht Nürnberg",
      "registernummer": "HRB 42159",
      "registerart": "HRB",
      "company_name": "Drinks Union Deutschland GmbH",
      "company_seat": "Nürnberg",
      "details": "10.07.2025 (Bekanntmachungsdatum)\n\nBayern Amtsgericht Nürnberg HRB 42159\nRegisterbekanntmachung nach dem Umwandlungsgesetz\n\nDrinks Union Deutschland GmbH\nGesellschaft mit beschränkter Haftung\nNürnberg\n\nDem Amtsgericht Nürnberg - Registergericht- ist am 07.07.2025 der Entwurf eines Verschmelzungsplanes über die geplante grenzüberschreitende Verschmelzung der Drinks Union Deutschland GmbH mit Sitz in Nürnberg, eingetragen im Handeslregister des Amtsgerichts Nürnberg unter HRB 42159, als übertragender Rechtsträger auf die Heineken Ceská republika, a.s., mit Sitz in Krusovice / Tschechische Republik, eingetragen im Handelsregister des Amtsgerichts Prag unter B 1515 als übernehmender Rechtsträger eingereicht worden.\n\nDie Anteilsinhaber, Gläubiger sowie die Arbeitnehmer der an der Verschmelzung beteiligten Rechtsträger werden darauf hingewiesen, dass sie der jeweiligen Gesellschaft spätestens fünf Arbeitstage vor dem Tag der entsprechenden Gesellschafterversammlung Bemerkungen zum Verschmelzungsplan übermitteln können. Die Gesellschafterversammlung darf frühestens einen Monat nach der Bekanntmachung stattfinden."
    },
    {
      "date": "2025-07-10",
      "id": "115264",
      "original_text": "Löschungsankündigung\nBayern Amtsgericht Kempten (Allgäu) VR 200570\nProjekt Hilfe für Afrika e.V. – Sonthofen",
      "type": "Löschungsankündigung",
      "state": "Bayern",
      "amtsgericht": "Amtsgericht Kempten (Allgäu)",
      "registernummer": "VR 200570",
      "registerart": "VR",
      "company_name": "Projekt Hilfe für Afrika e.V.",
      "company_seat": "Sonthofen",
      "details": "10.07.2025 (Bekanntmachungsdatum)\n\nBayern Amtsgericht Kempten (Allgäu) VR 200570\nLöschungsankündigung\n\nProjekt Hilfe für Afrika e.V.\neingetragener Verein\nSonthofen\n\nDas Registergericht beabsichtgt, den im Vereinsregister eingetragenen vertretungsberechtigten Vorstand Herr Jürgen Albert Kaiser von Amts wegen nach § 395 FamFG zu löschen. Die Frist zur Erhebung eines Widerspruchs ist auf einen Monat festgesetzt."
    },
    {
      "date": "2025-07-10",
      "id": "115265",
      "original_text": "Registerbekanntmachung nach dem Umwandlungsgesetz\nBayern Amtsgericht Memmingen HRA 14292\nKulanz + Service Immobilien e.K. – Illertissen",
      "type": "Registerbekanntmachung nach dem Umwandlungsgesetz",
      "state": "Bayern",
      "amtsgericht": "Amtsgericht Memmingen",
      "registernummer": "HRA 14292",
      "registerart": "HRA",
      "company_name": "Kulanz + Service Immobilien e.K.",
      "company_seat": "Illertissen",
      "details": "10.07.2025 (Bekanntmachungsdatum)\n\nBayern Amtsgericht Memmingen HRA 14292\nRegisterbekanntmachung nach dem Umwandlungsgesetz 09.07.2025 (Eintragungsdatum)\n\nKulanz + Service Immobilien e.K.\nEinzelkaufmann / Einzelkauffrau\nIllertissen\n\nDen Gläubigern der an der Verschmelzung beteiligten Rechtsträger ist, wenn sie binnen sechs Monaten nach dem Tag, an dem die Eintragung der Verschmelzung in das Register des Sitzes desjenigen Rechtsträgers, dessen Gläubiger sie sind, nach § 19 Abs. 3 UmwG als bekannt gemacht gilt, ihren Anspruch nach Grund und Höhe in Textform anmelden, Sicherheit zu leisten, soweit sie nicht Befriedigung verlangen können. Dieses Recht steht den Gläubigern jedoch nur zu, wenn sie glaubhaft machen, dass durch die Verschmelzung die Erfüllung ihrer Forderung gefährdet wird."
    },
    {
      "date": "2025-07-10",
      "id": "115266",
      "original_text": "Registerbekanntmachung nach dem Umwandlungsgesetz\nBayern Amtsgericht München HRB 141846\nMKS German Holding GmbH – München",
      "type": "Registerbekanntmachung nach dem Umwandlungsgesetz",
      "state": "Bayern",
      "amtsgericht": "Amtsgericht München",
      "registernummer": "HRB 141846",
      "registerart": "HRB",
      "company_name": "MKS German Holding GmbH",
      "company_seat": "München",
      "details": "10.07.2025 (Bekanntmachungsdatum)\n\nBayern Amtsgericht München HRB 141846\nRegisterbekanntmachung nach dem Umwandlungsgesetz 09.07.2025 (Eintragungsdatum)\n\nMKS German Holding GmbH\nGesellschaft mit beschränkter Haftung\nMünchen\n\nDen Gläubigern der an der Verschmelzung beteiligten Rechtsträger ist, wenn sie binnen sechs Monaten nach dem Tag, an dem die Eintragung der Verschmelzung in das Register des Sitzes desjenigen Rechtsträgers, dessen Gläubiger sie sind, nach § 19 Abs. 3 UmwG als bekannt gemacht gilt, ihren Anspruch nach Grund und Höhe in Textform anmelden, Sicherheit zu leisten, soweit sie nicht Befriedigung verlangen können. Dieses Recht steht den Gläubigern jedoch nur zu, wenn sie glaubhaft machen, dass durch die Verschmelzung die Erfüllung ihrer Forderung gefährdet wird."
    },
    {
      "date": "2025-07-10",
      "id": "115267",
      "original_text": "Registerbekanntmachung nach dem Umwandlungsgesetz\nBayern Amtsgericht Memmingen HRA 14278\nDeniz Gök Bauüberwachung Bahn e.K. – Senden",
      "type": "Registerbekanntmachung nach dem Umwandlungsgesetz",
      "state": "Bayern",
      "amtsgericht": "Amtsgericht Memmingen",
      "registernummer": "HRA 14278",
      "registerart": "HRA",
      "company_name": "Deniz Gök Bauüberwachung Bahn e.K.",
      "company_seat": "Senden",
      "details": "10.07.2025 (Bekanntmachungsdatum)\n\nBayern Amtsgericht Memmingen HRA 14278\nRegisterbekanntmachung nach dem Umwandlungsgesetz 09.07.2025 (Eintragungsdatum)\n\nDeniz Gök Bauüberwachung Bahn e.K.\nEinzelkaufmann / Einzelkauffrau\nSenden\n\nDen Gläubigern der an der Ausgliederung beteiligten Rechtsträger ist, wenn sie binnen sechs Monaten nach dem Tag, an dem die Eintragung der Ausgliederung in das Register des Sitzes desjenigen Rechtsträgers, dessen Gläubiger sie sind, nach §§ 125, 19 Abs. 3 UmwG als bekannt gemacht gilt, ihren Anspruch nach Grund und Höhe in Textform anmelden, Sicherheit zu leisten, soweit sie nicht Befriedigung verlangen können. Dieses Recht steht den Gläubigern jedoch nur zu, wenn sie glaubhaft machen, dass durch die Ausgliederung die Erfüllung ihrer Forderung gefährdet wird."
    },
    {
      "date": "2025-07-10",
      "id": "115268",
      "original_text": "Registerbekanntmachung nach dem Umwandlungsgesetz\nBayern Amtsgericht Nürnberg HRB 6803\nKonrad Müller GmbH – Nürnberg",
      "type": "Registerbekanntmachung nach dem Umwandlungsgesetz",
      "state": "Bayern",
      "amtsgericht": "Amtsgericht Nürnberg",
      "registernummer": "HRB 6803",
      "registerart": "HRB",
      "company_name": "Konrad Müller GmbH",
      "company_seat": "Nürnberg",
      "details": "10.07.2025 (Bekanntmachungsdatum)\n\nBayern Amtsgericht Nürnberg HRB 6803\nRegisterbekanntmachung nach dem Umwandlungsgesetz 09.07.2025 (Eintragungsdatum)\n\nKonrad Müller GmbH\nGesellschaft mit beschränkter Haftung\nNürnberg\n\nDen Gläubigern der an der Verschmelzung beteiligten Rechtsträger ist, wenn sie binnen sechs Monaten nach dem Tag, an dem die Eintragung der Verschmelzung in das Register des Sitzes desjenigen Rechtsträgers, dessen Gläubiger sie sind, nach § 19 Abs. 3 UmwG als bekannt gemacht gilt, ihren Anspruch nach Grund und Höhe in Textform anmelden, Sicherheit zu leisten, soweit sie nicht Befriedigung verlangen können. Dieses Recht steht den Gläubigern jedoch nur zu, wenn sie glaubhaft machen, dass durch die Verschmelzung die Erfüllung ihrer Forderung gefährdet wird."
    },
    {
      "date": "2025-07-10",
      "id": "115269",
      "original_text": "Löschungsankündigung\nBayern Amtsgericht Kempten (Allgäu) HRB 13740\nTOPU-Top-Verputz UG (haftungsbeschränkt) – Kempten (Allgäu)",
      "type": "Löschungsankündigung",
      "state": "Bayern",
      "amtsgericht": "Amtsgericht Kempten (Allgäu)",
      "registernummer": "HRB 13740",
      "registerart": "HRB",
      "company_name": "TOPU-Top-Verputz UG (haftungsbeschränkt)",
      "company_seat": "Kempten (Allgäu)",
      "details": "10.07.2025 (Bekanntmachungsdatum)\n\nBayern Amtsgericht Kempten (Allgäu) HRB 13740\nLöschungsankündigung\n\nTOPU-Top-Verputz UG (haftungsbeschränkt)\nGesellschaft mit beschränkter Haftung\nKempten (Allgäu)\n\nDas Registergericht beabsichtigt, die im Handelsregister eingetragene Gesellschaft von Amts wegen nach § 395 FamFG zu löschen. Die Frist zur Erhebung eines Widerspruchs ist auf einen Monat festgesetzt."
    },
    {
      "date": "2025-07-10",
      "id": "115270",
      "original_text": "Registerbekanntmachung nach dem Umwandlungsgesetz\nBayern Amtsgericht Traunstein HRB 17537\nB&O Service AG – Bad Aibling",
      "type": "Registerbekanntmachung nach dem Umwandlungsgesetz",
      "state": "Bayern",
      "amtsgericht": "Amtsgericht Traunstein",
      "registernummer": "HRB 17537",
      "registerart": "HRB",
      "company_name": "B&O Service AG",
      "company_seat": "Bad Aibling",
      "details": "10.07.2025 (Bekanntmachungsdatum)\n\nBayern Amtsgericht Traunstein HRB 17537\nRegisterbekanntmachung nach dem Umwandlungsgesetz\n\nB&O Service AG\nAktiengesellschaft\nBad Aibling\n\nDem Amtsgericht Traunstein -Registergericht- ist am 30.06.2025 ein Umwandlungsplan über die geplante Umwandlung der Gesellschaft in die B&O Service SE mit Sitz in Bad Aibling/Deutschland (zuständiges Registergericht AG Traunstein) eingereicht worden."
    },
    {
      "date": "2025-07-10",
      "id": "115271",
      "original_text": "Löschungsankündigung\nBayern Amtsgericht Kempten (Allgäu) VR 651\nGolf- und Land-Club Oberallgäu zu Wiggensbach-Waldegg eingetragener Verein – Wiggensbach",
      "type": "Löschungsankündigung",
      "state": "Bayern",
      "amtsgericht": "Amtsgericht Kempten (Allgäu)",
      "registernummer": "VR 651",
      "registerart": "VR",
      "company_name": "Golf- und Land-Club Oberallgäu zu Wiggensbach-Waldegg eingetragener Verein",
      "company_seat": "Wiggensbach",
      "details": "10.07.2025 (Bekanntmachungsdatum)\n\nBayern Amtsgericht Kempten (Allgäu) VR 651\nLöschungsankündigung\n\nGolf- und Land-Club Oberallgäu zu Wiggensbach-Waldegg eingetragener Verein\neingetragener Verein\nWiggensbach\n\nDas Registergericht beabsichtigt, den im Vereinsregister eingetragenen vertretungsberechtigten Vorstand Dr. Wohlfahrt-Fischbergg infolge des Versterbens von Amts wegen nach  § 395 FamFG zu löschen. Die Frist zur Erhebung eines Widerspruchs ist auf einen Monat festgesetzt."
    },
    {
      "date": "2025-07-10",
      "id": "115272",
      "original_text": "Registerbekanntmachung nach dem Umwandlungsgesetz\nBerlin Amtsgericht Berlin (Charlottenburg) HRB 91703\nDDB Group GmbH – Berlin",
      "type": "Registerbekanntmachung nach dem Umwandlungsgesetz",
      "state": "Berlin",
      "amtsgericht": "Amtsgericht Berlin (Charlottenburg)",
      "registernummer": "HRB 91703",
      "registerart": "HRB",
      "company_name": "DDB Group GmbH",
      "company_seat": "Berlin",
      "details": "10.07.2025 (Bekanntmachungsdatum)\n\nBerlin Amtsgericht Berlin (Charlottenburg) HRB 91703\nRegisterbekanntmachung nach dem Umwandlungsgesetz 09.07.2025 (Eintragungsdatum)\n\nDDB Group GmbH\nGesellschaft mit beschränkter Haftung\nBerlin\n\nZu Eintragungsnummer 50 vom 09.07.2025 wird als nicht eingetragen veröffentlicht: Den Gläubigern der an der Verschmelzung beteiligten Rechtsträger ist, wenn sie binnen sechs Monaten nach dem Tag, an dem die Eintragung der Verschmelzung in das Register des Sitzes desjenigen Rechtsträgers, dessen Gläubiger sie sind, als bekannt gemacht gilt, ihren Anspruch nach Grund und Höhe schriftlich anmelden, Sicherheit zu leisten, soweit sie nicht Befriedigung verlangen können. Dieses Recht steht den Gläubigern jedoch nur zu, wenn sie glaubhaft machen, dass durch die Verschmelzung die Erfüllung ihrer Forderung gefährdet wird. Das Recht, Sicherheitsleistung zu verlangen, steht Gläubigern nicht zu, die im Falle der Insolvenz ein Recht auf vorzugsweise Befriedigung aus einer Deckungsmasse haben, die nach gesetzlicher Vorschrift zu ihrem Schutz errichtet und staatlich überwacht ist."
    },
    {
      "date": "2025-07-10",
      "id": "115273",
      "original_text": "Einreichung neuer Dokumente\nBerlin Amtsgericht Berlin (Charlottenburg) HRB 182382\nHelloFresh SE – Berlin",
      "type": "Einreichung neuer Dokumente",
      "state": "Berlin",
      "amtsgericht": "Amtsgericht Berlin (Charlottenburg)",
      "registernummer": "HRB 182382",
      "registerart": "HRB",
      "company_name": "HelloFresh SE",
      "company_seat": "Berlin",
      "details": "10.07.2025 (Bekanntmachungsdatum)\n\nBerlin Amtsgericht Berlin (Charlottenburg) HRB 182382\nEinreichung neuer Dokumente\n\nHelloFresh SE\nEuropäische Aktiengesellschaft (SE)\nBerlin\n\nAls nicht eingetragen wird veröffentlicht: Es wurde eine neue Liste der Aufsichtsratsmitglieder eingereicht (§ 106 AktG)."
    },
    {
      "date": "2025-07-10",
      "id": "115274",
      "original_text": "Einreichung neuer Dokumente\nBerlin Amtsgericht Berlin (Charlottenburg) HRB 107541\nGermany Trade and Invest - Gesellschaft für Außenwirtschaft und Standortmarketing mbH – Berlin",
      "type": "Einreichung neuer Dokumente",
      "state": "Berlin",
      "amtsgericht": "Amtsgericht Berlin (Charlottenburg)",
      "registernummer": "HRB 107541",
      "registerart": "HRB",
      "company_name": "Germany Trade and Invest - Gesellschaft für Außenwirtschaft und Standortmarketing mbH",
      "company_seat": "Berlin",
      "details": "10.07.2025 (Bekanntmachungsdatum)\n\nBerlin Amtsgericht Berlin (Charlottenburg) HRB 107541\nEinreichung neuer Dokumente\n\nGermany Trade and Invest - Gesellschaft für Außenwirtschaft und Standortmarketing mbH\nGesellschaft mit beschränkter Haftung\nBerlin\n\nAls nicht eingetragen wird veröffentlicht: Es wurde eine neue Liste der Aufsichtsratsmitglieder eingereicht (§52 GmbHG)."
    },
    {
      "date": "2025-07-10",
      "id": "115275",
      "original_text": "Sonstige Registerbekanntmachung\nHamburg Amtsgericht Hamburg HRB 190986\nQ-nnect AG – Hamburg",
      "type": "Sonstige Registerbekanntmachung",
      "state": "Hamburg",
      "amtsgericht": "Amtsgericht Hamburg",
      "registernummer": "HRB 190986",
      "registerart": "HRB",
      "company_name": "Q-nnect AG",
      "company_seat": "Hamburg",
      "details": "10.07.2025 (Bekanntmachungsdatum)\n\nHamburg Amtsgericht Hamburg HRB 190986\nSonstige Registerbekanntmachung\n\nQ-nnect AG\nAktiengesellschaft\nHamburg\n\nAls nicht eingetragen wird bekannt gemacht: Liste des Aufsichtsrats wurde eingereicht."
    },
    {
      "date": "2025-07-10",
      "id": "115276",
      "original_text": "Einreichung neuer Dokumente\nBaden-Württemberg Amtsgericht Stuttgart HRB 777882\nLeibinger SE – Ditzingen",
      "type": "Einreichung neuer Dokumente",
      "state": "Baden-Württemberg",
      "amtsgericht": "Amtsgericht Stuttgart",
      "registernummer": "HRB 777882",
      "registerart": "HRB",
      "company_name": "Leibinger SE",
      "company_seat": "Ditzingen",
      "details": "10.07.2025 (Bekanntmachungsdatum)\n\nBaden-Württemberg Amtsgericht Stuttgart HRB 777882\nEinreichung neuer Dokumente\n\nLeibinger SE\nEuropäische Aktiengesellschaft (SE)\nDitzingen\n\nDie Gesellschaft hat am 08.07.2025 die Liste über die Zusammensetzung des Aufsichtsrats zum Handelsregister eingereicht."
    },
    {
      "date": "2025-07-10",
      "id": "115277",
      "original_text": "Sonstige Registerbekanntmachung\nBaden-Württemberg Amtsgericht Mannheim HRB 336136\nServa Electrophoresis GmbH – Heidelberg",
      "type": "Sonstige Registerbekanntmachung",
      "state": "Baden-Württemberg",
      "amtsgericht": "Amtsgericht Mannheim",
      "registernummer": "HRB 336136",
      "registerart": "HRB",
      "company_name": "Serva Electrophoresis GmbH",
      "company_seat": "Heidelberg",
      "details": "10.07.2025 (Bekanntmachungsdatum)\n\nBaden-Württemberg Amtsgericht Mannheim HRB 336136\nSonstige Registerbekanntmachung 10.07.2025 (Eintragungsdatum)\n\nServa Electrophoresis GmbH\nGesellschaft mit beschränkter Haftung\nHeidelberg\n\nAls nicht eingetragen wird bekanntgemacht:\nDen Gläubigern der Gesellschaft, deren Forderungen begründet worden sind, bevor die Eintragung der Beendigung des Vertrages in das Handelsregister nach § 10 HGB als bekanntgemacht gilt, ist vom anderen Vertragsteil Sicherheit zu leisten, wenn sie sich binnen sechs Monaten nach der Bekanntmachung zu diesem Zweck bei ihm melden."
    },
    {
      "date": "2025-07-10",
      "id": "115278",
      "original_text": "Registerbekanntmachung nach dem Umwandlungsgesetz\nHamburg Amtsgericht Hamburg HRB 90055\nVerwaltung MS \"E.R. CANNES\" Schiffahrtsgesellschaft mbH – Hamburg",
      "type": "Registerbekanntmachung nach dem Umwandlungsgesetz",
      "state": "Hamburg",
      "amtsgericht": "Amtsgericht Hamburg",
      "registernummer": "HRB 90055",
      "registerart": "HRB",
      "company_name": "Verwaltung MS \"E.R. CANNES\" Schiffahrtsgesellschaft mbH",
      "company_seat": "Hamburg",
      "details": "10.07.2025 (Bekanntmachungsdatum)\n\nHamburg Amtsgericht Hamburg HRB 90055\nRegisterbekanntmachung nach dem Umwandlungsgesetz 10.07.2025 (Eintragungsdatum)\n\nVerwaltung MS \"E.R. CANNES\" Schiffahrtsgesellschaft mbH\nGesellschaft mit beschränkter Haftung\nHamburg\n\nAls nicht eingetragen wird bekannt gemacht:\nDen Gläubigern der an der Verschmelzung beteiligten Gesellschaften ist, wenn sie binnen sechs Monaten nach dem Tag, an dem die Eintragung der Verschmelzung in das Register des Sitzes desjenigen Rechtsträgers, dessen Gläubiger sie sind, nach § 19 Absatz 3 UmwG als bekannt gemacht gilt, ihren Anspruch nach Grund und Höhe schriftlich anmelden, Sicherheit zu leisten, soweit sie nicht Befriedigung verlangen können. Dieses Recht steht den Gläubigern jedoch nur zu, wenn sie glaubhaft machen, dass durch die Verschmelzung die Erfüllung ihrer Forderung gefährdet wird."
    },
    {
      "date": "2025-07-10",
      "id": "115279",
      "original_text": "Registerbekanntmachung nach dem Umwandlungsgesetz\nHamburg Amtsgericht Hamburg HRB 90056\nVerwaltung MS \"E.R. CALAIS\" Schiffahrtsgesellschaft mbH – Hamburg",
      "type": "Registerbekanntmachung nach dem Umwandlungsgesetz",
      "state": "Hamburg",
      "amtsgericht": "Amtsgericht Hamburg",
      "registernummer": "HRB 90056",
      "registerart": "HRB",
      "company_name": "Verwaltung MS \"E.R. CALAIS\" Schiffahrtsgesellschaft mbH",
      "company_seat": "Hamburg",
      "details": "10.07.2025 (Bekanntmachungsdatum)\n\nHamburg Amtsgericht Hamburg HRB 90056\nRegisterbekanntmachung nach dem Umwandlungsgesetz 10.07.2025 (Eintragungsdatum)\n\nVerwaltung MS \"E.R. CALAIS\" Schiffahrtsgesellschaft mbH\nGesellschaft mit beschränkter Haftung\nHamburg\n\nAls nicht eingetragen wird bekannt gemacht:\nDen Gläubigern der an der Verschmelzung beteiligten Gesellschaften ist, wenn sie binnen sechs Monaten nach dem Tag, an dem die Eintragung der Verschmelzung in das Register des Sitzes desjenigen Rechtsträgers, dessen Gläubiger sie sind, nach § 19 Absatz 3 UmwG als bekannt gemacht gilt, ihren Anspruch nach Grund und Höhe schriftlich anmelden, Sicherheit zu leisten, soweit sie nicht Befriedigung verlangen können. Dieses Recht steht den Gläubigern jedoch nur zu, wenn sie glaubhaft machen, dass durch die Verschmelzung die Erfüllung ihrer Forderung gefährdet wird."
    },
    {
      "date": "2025-07-10",
      "id": "115280",
      "original_text": "Registerbekanntmachung nach dem Umwandlungsgesetz\nHamburg Amtsgericht Hamburg HRB 90057\nVerwaltung NC ERB Global Schiffs GmbH – Hamburg",
      "type": "Registerbekanntmachung nach dem Umwandlungsgesetz",
      "state": "Hamburg",
      "amtsgericht": "Amtsgericht Hamburg",
      "registernummer": "HRB 90057",
      "registerart": "HRB",
      "company_name": "Verwaltung NC ERB Global Schiffs GmbH",
      "company_seat": "Hamburg",
      "details": "10.07.2025 (Bekanntmachungsdatum)\n\nHamburg Amtsgericht Hamburg HRB 90057\nRegisterbekanntmachung nach dem Umwandlungsgesetz 10.07.2025 (Eintragungsdatum)\n\nVerwaltung NC ERB Global Schiffs GmbH\nGesellschaft mit beschränkter Haftung\nHamburg\n\nAls nicht eingetragen wird bekannt gemacht:\nDen Gläubigern der an der Verschmelzung beteiligten Gesellschaften ist, wenn sie binnen sechs Monaten nach dem Tag, an dem die Eintragung der Verschmelzung in das Register des Sitzes desjenigen Rechtsträgers, dessen Gläubiger sie sind, nach § 19 Absatz 3 UmwG als bekannt gemacht gilt, ihren Anspruch nach Grund und Höhe schriftlich anmelden, Sicherheit zu leisten, soweit sie nicht Befriedigung verlangen können. Dieses Recht steht den Gläubigern jedoch nur zu, wenn sie glaubhaft machen, dass durch die Verschmelzung die Erfüllung ihrer Forderung gefährdet wird."
    },
    {
      "date": "2025-07-10",
      "id": "115281",
      "original_text": "Registerbekanntmachung nach dem Umwandlungsgesetz\nHamburg Amtsgericht Hamburg HRB 88063\nVerwaltung MS \"E.R. DENVER\" Schiffahrtsgesellschaft mbH – Hamburg",
      "type": "Registerbekanntmachung nach dem Umwandlungsgesetz",
      "state": "Hamburg",
      "amtsgericht": "Amtsgericht Hamburg",
      "registernummer": "HRB 88063",
      "registerart": "HRB",
      "company_name": "Verwaltung MS \"E.R. DENVER\" Schiffahrtsgesellschaft mbH",
      "company_seat": "Hamburg",
      "details": "10.07.2025 (Bekanntmachungsdatum)\n\nHamburg Amtsgericht Hamburg HRB 88063\nRegisterbekanntmachung nach dem Umwandlungsgesetz 10.07.2025 (Eintragungsdatum)\n\nVerwaltung MS \"E.R. DENVER\" Schiffahrtsgesellschaft mbH\nGesellschaft mit beschränkter Haftung\nHamburg\n\nAls nicht eingetragen wird bekannt gemacht:\nDen Gläubigern der an der Verschmelzung beteiligten Gesellschaften ist, wenn sie binnen sechs Monaten nach dem Tag, an dem die Eintragung der Verschmelzung in das Register des Sitzes desjenigen Rechtsträgers, dessen Gläubiger sie sind, nach § 19 Absatz 3 UmwG als bekannt gemacht gilt, ihren Anspruch nach Grund und Höhe schriftlich anmelden, Sicherheit zu leisten, soweit sie nicht Befriedigung verlangen können. Dieses Recht steht den Gläubigern jedoch nur zu, wenn sie glaubhaft machen, dass durch die Verschmelzung die Erfüllung ihrer Forderung gefährdet wird."
    },
    {
      "date": "2025-07-10",
      "id": "115282",
      "original_text": "Sonstige Registerbekanntmachung\nSaarland Amtsgericht Saarbrücken GnR 1\nVereinigte Volksbank eG Saarlouis - Losheim am See - Sulzbach/Saar – Saarlouis",
      "type": "Sonstige Registerbekanntmachung",
      "state": "Saarland",
      "amtsgericht": "Amtsgericht Saarbrücken",
      "registernummer": "GnR 1",
      "registerart": "GnR",
      "company_name": "Vereinigte Volksbank eG Saarlouis - Losheim am See - Sulzbach/Saar",
      "company_seat": "Saarlouis",
      "details": "10.07.2025 (Bekanntmachungsdatum)\n\nSaarland Amtsgericht Saarbrücken GnR 1\nSonstige Registerbekanntmachung 10.07.2025 (Eintragungsdatum)\n\nVereinigte Volksbank eG Saarlouis - Losheim am See - Sulzbach/Saar\neingetragene Genossenschaft\nSaarlouis\n\nDie Vertreterversammlung vom 12.06.2025 hat eine Änderung der Satzung in §§ 3 (Erwerb der Mitgliedschaft), 5 (Kündigung), 6 (Übertragung des Geschäftsguthabens), 16 (Aufgaben und Pflichten des Vorstands), 19 (Willensbildung), 23 (Gemeinsame Sitzungen von Vorstand und Aufsichtsrat), 24 (Zusammensetzung und Wahl des Aufsichtsrats), 25 (Konstituierung, Beschlussfassung), 26 d (Aktives Wahlrecht), 26 f (Amtsdauer, Beginn und Ende des Vertreteramtes), 27 (Frist und Tagungsort), 28 (Einberufung und Tagesordnung), 33 (Abstimmung und Wahlen), 35 (Versammlungsniederschrift), 36 a (Virtuelle Versammlung, hybride Versammlung und Versammlung im gestreckten Verfahren), 36 c (Teilnahme von Aufsichtsratsmitgliedern an einer Präsenzveranstaltung in Bild und Ton und Übertragung der Vertreterversammlung in Bild und Ton), 40 (Nachschusspflicht) und 46 (Bekanntmachungen) und damit die Änderung der Nachschusspflicht beschlossen. Neue Regelung: Die Nachschusspflicht der Mitglieder ausgeschlossen. Den Gläubigern der Genossenschaft ist, wenn sie sich binnen sechs Monaten nach dieser Bekanntmachung zu diesem Zweck bei der Genossenschaft melden, Sicherheit zu leisten, soweit sie nicht Befriedigung verlangen können."
    },
    {
      "date": "2025-07-10",
      "id": "115283",
      "original_text": "Registerbekanntmachung nach dem Umwandlungsgesetz\nBaden-Württemberg Amtsgericht Ulm HRB 552650\nsüdmail GmbH – Weingarten",
      "type": "Registerbekanntmachung nach dem Umwandlungsgesetz",
      "state": "Baden-Württemberg",
      "amtsgericht": "Amtsgericht Ulm",
      "registernummer": "HRB 552650",
      "registerart": "HRB",
      "company_name": "südmail GmbH",
      "company_seat": "Weingarten",
      "details": "10.07.2025 (Bekanntmachungsdatum)\n\nBaden-Württemberg Amtsgericht Ulm HRB 552650\nRegisterbekanntmachung nach dem Umwandlungsgesetz 09.07.2025 (Eintragungsdatum)\n\nsüdmail GmbH\nGesellschaft mit beschränkter Haftung\nWeingarten\n\nDen Gläubigern der an der Verschmelzung beteiligten Rechtsträger ist, wenn sie binnen sechs Monaten nach dem Tag, an dem die Eintragung der Verschmelzung in das Register des Sitzes desjenigen Rechtsträgers, dessen Gläubiger sie sind, nach § 19 Abs. 3 UmwG als bekanntgemacht gilt, ihren Anspruch nach Grund und Höhe schriftlich anmelden, Sicherheit zu leisten, soweit sie nicht Befriedigung verlangen können. Dieses Recht steht den Gläubigern jedoch nur zu, wenn sie glaubhaft machen, dass durch die Verschmelzung die Erfüllung ihrer Forderung gefährdet wird."
    },
    {
      "date": "2025-07-10",
      "id": "115284",
      "original_text": "Registerbekanntmachung nach dem Umwandlungsgesetz\nMecklenburg-Vorpommern Amtsgericht Schwerin HRB 9630\nStover Service GmbH – Boiensdorf OT Stove",
      "type": "Registerbekanntmachung nach dem Umwandlungsgesetz",
      "state": "Mecklenburg-Vorpommern",
      "amtsgericht": "Amtsgericht Schwerin",
      "registernummer": "HRB 9630",
      "registerart": "HRB",
      "company_name": "Stover Service GmbH",
      "company_seat": "Boiensdorf OT Stove",
      "details": "10.07.2025 (Bekanntmachungsdatum)\n\nMecklenburg-Vorpommern Amtsgericht Schwerin HRB 9630\nRegisterbekanntmachung nach dem Umwandlungsgesetz 10.07.2025 (Eintragungsdatum)\n\nStover Service GmbH\nGesellschaft mit beschränkter Haftung\nBoiensdorf OT Stove\n\nDen Gläubigern der an der Verschmelzung beteiligten Gesellschaften ist, wenn sie binnen sechs Monaten nach dem Tag, an dem die Eintragung der Verschmelzungen in das Register des Sitzes desjenigen Rechtsträgers, dessen Gläubiger sie sind, nach § 19 Absatz 3 UmwG als bekanntgemacht gilt, ihren Anspruch nach Grund und Höhe schriftlich anmelden, Sicherheit zu leisten, soweit sie nicht Befriedigung verlangen können. Dieses Recht steht den Gläubigern jedoch nur zu, wenn sie glaubhaft machen, dass durch die Verschmelzung die Erfüllung ihrer Forderung gefährdet wird."
    },
    {
      "date": "2025-07-10",
      "id": "115285",
      "original_text": "Registerbekanntmachung nach dem Umwandlungsgesetz\nMecklenburg-Vorpommern Amtsgericht Schwerin HRB 3650\nStover Wärme- und Sanitärtechnik GmbH – Boiensdorf",
      "type": "Registerbekanntmachung nach dem Umwandlungsgesetz",
      "state": "Mecklenburg-Vorpommern",
      "amtsgericht": "Amtsgericht Schwerin",
      "registernummer": "HRB 3650",
      "registerart": "HRB",
      "company_name": "Stover Wärme- und Sanitärtechnik GmbH",
      "company_seat": "Boiensdorf",
      "details": "10.07.2025 (Bekanntmachungsdatum)\n\nMecklenburg-Vorpommern Amtsgericht Schwerin HRB 3650\nRegisterbekanntmachung nach dem Umwandlungsgesetz 10.07.2025 (Eintragungsdatum)\n\nStover Wärme- und Sanitärtechnik GmbH\nGesellschaft mit beschränkter Haftung\nBoiensdorf\n\nDen Gläubigern der an der Verschmelzung beteiligten Gesellschaften ist, wenn sie binnen sechs Monaten nach dem Tag, an dem die Eintragung der Verschmelzungen in das Register des Sitzes desjenigen Rechtsträgers, dessen Gläubiger sie sind, nach § 19 Absatz 3 UmwG als bekanntgemacht gilt, ihren Anspruch nach Grund und Höhe schriftlich anmelden, Sicherheit zu leisten, soweit sie nicht Befriedigung verlangen können. Dieses Recht steht den Gläubigern jedoch nur zu, wenn sie glaubhaft machen, dass durch die Verschmelzung die Erfüllung ihrer Forderung gefährdet wird."
    },
    {
      "date": "2025-07-10",
      "id": "115286",
      "original_text": "Registerbekanntmachung nach dem Umwandlungsgesetz\nBaden-Württemberg Amtsgericht Stuttgart HRA 738410\nVereina GmbH & Co. KG – Ditzingen",
      "type": "Registerbekanntmachung nach dem Umwandlungsgesetz",
      "state": "Baden-Württemberg",
      "amtsgericht": "Amtsgericht Stuttgart",
      "registernummer": "HRA 738410",
      "registerart": "HRA",
      "company_name": "Vereina GmbH & Co. KG",
      "company_seat": "Ditzingen",
      "details": "10.07.2025 (Bekanntmachungsdatum)\n\nBaden-Württemberg Amtsgericht Stuttgart HRA 738410\nRegisterbekanntmachung nach dem Umwandlungsgesetz 10.07.2025 (Eintragungsdatum)\n\nVereina GmbH & Co. KG\nKommanditgesellschaft\nDitzingen\n\nDen Gläubigern der an der Verschmelzung beteiligten Rechtsträger ist, wenn sie binnen sechs Monaten nach dem Tag, an dem die Eintragung der Verschmelzung in das Register des Sitzes desjenigen Rechtsträgers, dessen Gläubiger sie sind, nach § 19 Abs. 3 UmwG als bekanntgemacht gilt, ihren Anspruch nach Grund und Höhe schriftlich anmelden, Sicherheit zu leisten, soweit sie nicht Befriedigung verlangen können. Dieses Recht steht den Gläubigern jedoch nur zu, wenn sie glaubhaft machen, dass durch die Verschmelzung die Erfüllung ihrer Forderung gefährdet wird."
    },
    {
      "date": "2025-07-10",
      "id": "115287",
      "original_text": "Registerbekanntmachung nach dem Umwandlungsgesetz\nBaden-Württemberg Amtsgericht Stuttgart HRB 749103\ndiconium data GmbH – Stuttgart",
      "type": "Registerbekanntmachung nach dem Umwandlungsgesetz",
      "state": "Baden-Württemberg",
      "amtsgericht": "Amtsgericht Stuttgart",
      "registernummer": "HRB 749103",
      "registerart": "HRB",
      "company_name": "diconium data GmbH",
      "company_seat": "Stuttgart",
      "details": "10.07.2025 (Bekanntmachungsdatum)\n\nBaden-Württemberg Amtsgericht Stuttgart HRB 749103\nRegisterbekanntmachung nach dem Umwandlungsgesetz 10.07.2025 (Eintragungsdatum)\n\ndiconium data GmbH\nGesellschaft mit beschränkter Haftung\nStuttgart\n\nDen Gläubigern der an der Verschmelzung beteiligten Rechtsträger ist, wenn sie binnen sechs Monaten nach dem Tag, an dem die Eintragung der Verschmelzung in das Register des Sitzes desjenigen Rechtsträgers, dessen Gläubiger sie sind, nach § 19 Abs. 3 UmwG als bekanntgemacht gilt, ihren Anspruch nach Grund und Höhe schriftlich anmelden, Sicherheit zu leisten, soweit sie nicht Befriedigung verlangen können. Dieses Recht steht den Gläubigern jedoch nur zu, wenn sie glaubhaft machen, dass durch die Verschmelzung die Erfüllung ihrer Forderung gefährdet wird."
    },
    {
      "date": "2025-07-10",
      "id": "115288",
      "original_text": "Registerbekanntmachung nach dem Umwandlungsgesetz\nBerlin Amtsgericht Berlin (Charlottenburg) HRB 174932\nEquity P. Deutschland UG (haftungsbeschränkt) – Berlin",
      "type": "Registerbekanntmachung nach dem Umwandlungsgesetz",
      "state": "Berlin",
      "amtsgericht": "Amtsgericht Berlin (Charlottenburg)",
      "registernummer": "HRB 174932",
      "registerart": "HRB",
      "company_name": "Equity P. Deutschland UG (haftungsbeschränkt)",
      "company_seat": "Berlin",
      "details": "10.07.2025 (Bekanntmachungsdatum)\n\nBerlin Amtsgericht Berlin (Charlottenburg) HRB 174932\nRegisterbekanntmachung nach dem Umwandlungsgesetz\n\nEquity P. Deutschland UG (haftungsbeschränkt)\nGesellschaft mit beschränkter Haftung\nBerlin\n\nAls nicht eingetragen wird veröffentlicht:\n\nDie Gesellschaft hat den Verschmelzungsplan einer grenzüberschreitenden Verschmelzung nach Österreich auf die Equity Partner GmbH mit Sitz in Wien/Österreich, (Firmenbuch der Republik Österreich -Justiz- zur Nummer FN 423024 w) eingereicht, der im elektronischen Registerordner eingesehen werden kann. Dazu hat die Gesellschaft dem Registergericht die folgenden Angaben übermittelt, verbunden mit dem Antrag, diese bekannt zu machen:\n\nDie sich verschmelzenden Gesellschaften haben folgende Rechtsform:\nÜbertragende Gesellschaft:\nEquity P. Deutschland UG (haftungsbeschränkt), Sitz Berlin (AG Berlin -Charlottenburg - HRB 174932 B)\nÜbernehmende Gesellschaft:\nEquity Partner GmbH, mit Sitz in Wien/Österreich,\nFirmenbuch der Republik Österreich -Justiz- zur Nummer FN 423024 w\n\nIm Verschmelzungsplan werden die folgenden Sicherheiten angeboten:\n\n„Den Gläubigern der übertragenden Gesellschaft, die binnen eines Monats nach dem Tag, an dem der Plan für die grenzüberschreitende Verschmelzung bekannt gemacht worden ist, einen Anspruch nach Grund und Höhe schriftlich anmelden, ist\nSicherheit zu leisten, soweit sie nicht Befriedigung verlangen können. Dieses Recht steht den Gläubigern jedoch nur zu, wenn sie glaubhaft machen, dass durch die grenzüberschreitende Verschmelzung die Erfüllung ihrer Forderung gefährdet wird. Das Recht auf Sicherheitsleistung steht Gläubigern nur im Hinblick auf solche Forderungen zu, die vor oder bis zu 15 Tage nach Bekanntmachung des Plans für die grenzüberschreitende Verschmelzung entstanden sind.“\n\nEs wird seitens der Gesellschaft klargestellt, dass es sich dabei lediglich um im Verschmelzungsplan angebotene Sicherheitsleistungen handelt und darüber hinaus zu Gunsten der Gläubiger aber in jedem Fall die gesetzlichen Ansprüche auf Sicherheitsleistung gem. § 314 UmwG bestehen.\n\nDie Gesellschaft erteilt einen Hinweis an die Gläubiger der an der grenzüberschreitenden Verschmelzung beteiligten Gesellschaften, dass sie der jeweiligen Gesellschaft spätestens fünf Arbeitstage vor dem Tag der Gesellschafterversammlung Bemerkungen zum Verschmelzungsplan übermitteln können.\nHinweis zum Bekanntmachungsinhalt gem. § 308 Abs. 1 Ziff. 4 b UmwG.\nDie Gesellschaften haben keine Arbeitnehmer."
    },
    {
      "date": "2025-07-10",
      "id": "115289",
      "original_text": "Einreichung neuer Dokumente\nBaden-Württemberg Amtsgericht Stuttgart HRB 791385\nConBrio Beteiligungen AG – Stuttgart",
      "type": "Einreichung neuer Dokumente",
      "state": "Baden-Württemberg",
      "amtsgericht": "Amtsgericht Stuttgart",
      "registernummer": "HRB 791385",
      "registerart": "HRB",
      "company_name": "ConBrio Beteiligungen AG",
      "company_seat": "Stuttgart",
      "details": "10.07.2025 (Bekanntmachungsdatum)\n\nBaden-Württemberg Amtsgericht Stuttgart HRB 791385\nEinreichung neuer Dokumente\n\nConBrio Beteiligungen AG\nAktiengesellschaft\nStuttgart\n\nDie Gesellschaft hat am 09.07.2025 die Liste über die Zusammensetzung des Aufsichtsrats zum Handelsregister eingereicht."
    },
    {
      "date": "2025-07-10",
      "id": "115290",
      "original_text": "Sonstige Registerbekanntmachung\nBerlin Amtsgericht Berlin (Charlottenburg) HRB 226048\nelXchange Aktiengesellschaft – Berlin",
      "type": "Sonstige Registerbekanntmachung",
      "state": "Berlin",
      "amtsgericht": "Amtsgericht Berlin (Charlottenburg)",
      "registernummer": "HRB 226048",
      "registerart": "HRB",
      "company_name": "elXchange Aktiengesellschaft",
      "company_seat": "Berlin",
      "details": "10.07.2025 (Bekanntmachungsdatum)\n\nBerlin Amtsgericht Berlin (Charlottenburg) HRB 226048\nSonstige Registerbekanntmachung\n\nelXchange Aktiengesellschaft\nAktiengesellschaft\nBerlin\n\nAls nicht eingetragen wird veröffentlicht:Es wurde eine neue Liste der Aufsichtsratsmitglieder eingereicht (§ 106 AktG)."
    },
    {
      "date": "2025-07-10",
      "id": "115291",
      "original_text": "Einreichung neuer Dokumente\nSachsen-Anhalt Amtsgericht Stendal HRB 206124\nEVH GmbH – Halle (Saale)",
      "type": "Einreichung neuer Dokumente",
      "state": "Sachsen-Anhalt",
      "amtsgericht": "Amtsgericht Stendal",
      "registernummer": "HRB 206124",
      "registerart": "HRB",
      "company_name": "EVH GmbH",
      "company_seat": "Halle (Saale)",
      "details": "10.07.2025 (Bekanntmachungsdatum)\n\nSachsen-Anhalt Amtsgericht Stendal HRB 206124\nEinreichung neuer Dokumente\n\nEVH GmbH\nGesellschaft mit beschränkter Haftung\nHalle (Saale)\n\nEine Liste der Mitglieder des Aufsichtsrates wurde zum Handelsregister eingereicht."
    },
    {
      "date": "2025-07-10",
      "id": "115292",
      "original_text": "Löschungsankündigung\nSchleswig-Holstein Amtsgericht Lübeck HRB 21417\nGPL-Bauservice UG (haftungsbeschränkt) – Bad Oldesloe",
      "type": "Löschungsankündigung",
      "state": "Schleswig-Holstein",
      "amtsgericht": "Amtsgericht Lübeck",
      "registernummer": "HRB 21417",
      "registerart": "HRB",
      "company_name": "GPL-Bauservice UG (haftungsbeschränkt)",
      "company_seat": "Bad Oldesloe",
      "details": "10.07.2025 (Bekanntmachungsdatum)\n\nSchleswig-Holstein Amtsgericht Lübeck HRB 21417\nLöschungsankündigung\n\nGPL-Bauservice UG (haftungsbeschränkt)\nGesellschaft mit beschränkter Haftung\nBad Oldesloe\n\n- An Herrn Piotr Lahuta per Veröffentlichung -\n\nSehr geehrter Herr Lahuta,\n\nin der Handelsregistersache der\nGPL-Bauservice UG (haftungsbeschränkt)\n\nhaben Sie mit Schreiben vom 02.12.2024 und ergänzendem Schreiben vom 15.06.2025 die Löschung der Firma von Amts wegen aufgrund Vermögenslosigkeit beantragt.\n\nEs ist daher beabsichtigt, die Gesellschaft wegen Vermögenslosigkeit gemäß § 394 FamFG zu löschen.\n\nEs wird eine Frist von drei Monaten zur Geltendmachung eines Widerspruchs gegen die Löschung bestimmt, § 394 Abs. 2 S. 1 FamFG.\n\nNach Fristablauf ohne Widerspruch von Ihnen oder anderer Seite wird die Gesellschaft gelöscht.\n\nMit freundlichen Grüßen\n\nSchuppenhauer\nDipl.-Rechtspflegerin (FH)\n\nAuf Anordnung\n\nFriese-Fischer, Justizfachangestellter"
    },
    {
      "date": "2025-07-10",
      "id": "115293",
      "original_text": "Registerbekanntmachung nach dem Umwandlungsgesetz\nSachsen-Anhalt Amtsgericht Stendal HRB 13412\nGÜTEC GmbH – Annaburg",
      "type": "Registerbekanntmachung nach dem Umwandlungsgesetz",
      "state": "Sachsen-Anhalt",
      "amtsgericht": "Amtsgericht Stendal",
      "registernummer": "HRB 13412",
      "registerart": "HRB",
      "company_name": "GÜTEC GmbH",
      "company_seat": "Annaburg",
      "details": "10.07.2025 (Bekanntmachungsdatum)\n\nSachsen-Anhalt Amtsgericht Stendal HRB 13412\nRegisterbekanntmachung nach dem Umwandlungsgesetz 10.07.2025 (Eintragungsdatum)\n\nGÜTEC GmbH\nGesellschaft mit beschränkter Haftung\nAnnaburg\n\nNicht eingetragen:\nDen Gläubigern der an der Verschmelzung beteiligten Rechtsträger ist, wenn sie binnen sechs Monaten nach dem Tag, an dem die Eintragung der Verschmelzung nach § 19 Abs. 3 UmwG als bekanntgemacht gilt, ihren Anspruch nach Grund und Höhe schriftlich anmelden, Sicherheit zu leisten, soweit sie nicht Befriedigung verlangen können. Dieses Recht steht ihnen jedoch nur zu, wenn sie glaubhaft machen, dass durch die Verschmelzung die Erfüllung ihrer Forderung gefährdet wird."
    },
    {
      "date": "2025-07-10",
      "id": "115294",
      "original_text": "Einreichung neuer Dokumente\nBaden-Württemberg Amtsgericht Stuttgart HRB 730623\nDr. Ing. h.c. F. Porsche Aktiengesellschaft – Stuttgart",
      "type": "Einreichung neuer Dokumente",
      "state": "Baden-Württemberg",
      "amtsgericht": "Amtsgericht Stuttgart",
      "registernummer": "HRB 730623",
      "registerart": "HRB",
      "company_name": "Dr. Ing. h.c. F. Porsche Aktiengesellschaft",
      "company_seat": "Stuttgart",
      "details": "10.07.2025 (Bekanntmachungsdatum)\n\nBaden-Württemberg Amtsgericht Stuttgart HRB 730623\nEinreichung neuer Dokumente 09.07.2025 (Eintragungsdatum)\n\nDr. Ing. h.c. F. Porsche Aktiengesellschaft\nAktiengesellschaft\nStuttgart\n\nDie Gesellschaft hat am 09.07.2025 die Liste über die Zusammensetzung des Aufsichtsrats zum Handelsregister eingereicht."
    },
    {
      "date": "2025-07-10",
      "id": "115295",
      "original_text": "Löschungsankündigung\nBerlin Amtsgericht Berlin (Charlottenburg) HRB 120905\nFrüchtekorb GmbH – Berlin",
      "type": "Löschungsankündigung",
      "state": "Berlin",
      "amtsgericht": "Amtsgericht Berlin (Charlottenburg)",
      "registernummer": "HRB 120905",
      "registerart": "HRB",
      "company_name": "Früchtekorb GmbH",
      "company_seat": "Berlin",
      "details": "10.07.2025 (Bekanntmachungsdatum)\n\nBerlin Amtsgericht Berlin (Charlottenburg) HRB 120905\nLöschungsankündigung\n\nFrüchtekorb GmbH\nGesellschaft mit beschränkter Haftung\nBerlin\n\nBei der nachstehenden Gesellschaft wird das Amtslöschungsverfahren gemäß § 394 FamFG eingeleitet. Widerspruchsfrist 6 Wochen"
    },
    {
      "date": "2025-07-10",
      "id": "115296",
      "original_text": "Registerbekanntmachung nach dem Umwandlungsgesetz\nBaden-Württemberg Amtsgericht Stuttgart HRB 799975\nHelco Autoteile GmbH – Neckarsulm",
      "type": "Registerbekanntmachung nach dem Umwandlungsgesetz",
      "state": "Baden-Württemberg",
      "amtsgericht": "Amtsgericht Stuttgart",
      "registernummer": "HRB 799975",
      "registerart": "HRB",
      "company_name": "Helco Autoteile GmbH",
      "company_seat": "Neckarsulm",
      "details": "10.07.2025 (Bekanntmachungsdatum)\n\nBaden-Württemberg Amtsgericht Stuttgart HRB 799975\nRegisterbekanntmachung nach dem Umwandlungsgesetz 10.07.2025 (Eintragungsdatum)\n\nHelco Autoteile GmbH\nGesellschaft mit beschränkter Haftung\nNeckarsulm\n\nDen Gläubigern der an der Ausgliederung beteiligten Rechtsträger ist, wenn sie binnen sechs Monaten nach dem Tag, an dem die Eintragung der Ausgliederung in das Register des Sitzes desjenigen Rechtsträgers, dessen Gläubiger sie sind, nach § 19 Abs. 3 UmwG als bekanntgemacht gilt, ihren Anspruch nach Grund und Höhe schriftlich anmelden, Sicherheit zu leisten, soweit sie nicht Befriedigung verlangen können. Dieses Recht steht den Gläubigern jedoch nur zu, wenn sie glaubhaft machen, dass durch die Ausgliederung die Erfüllung ihrer Forderung gefährdet wird."
    },
    {
      "date": "2025-07-10",
      "id": "115297",
      "original_text": "Registerbekanntmachung nach dem Umwandlungsgesetz\nBrandenburg Amtsgericht Cottbus HRA 4426\nVigelahn BauTeam GmbH & Co KG – Königs Wusterhausen",
      "type": "Registerbekanntmachung nach dem Umwandlungsgesetz",
      "state": "Brandenburg",
      "amtsgericht": "Amtsgericht Cottbus",
      "registernummer": "HRA 4426",
      "registerart": "HRA",
      "company_name": "Vigelahn BauTeam GmbH & Co KG",
      "company_seat": "Königs Wusterhausen",
      "details": "10.07.2025 (Bekanntmachungsdatum)\n\nBrandenburg Amtsgericht Cottbus HRA 4426\nRegisterbekanntmachung nach dem Umwandlungsgesetz 09.07.2025 (Eintragungsdatum)\n\nVigelahn BauTeam GmbH & Co KG\nKommanditgesellschaft\nKönigs Wusterhausen\n\nZu Eintragungsnummer 2 vom 09.07.2025 wird als nicht eingetragen veröffentlicht:\nAls nicht eingetragen wird veröffentlicht:\nDen Gläubigern der an der Spaltung beteiligten Rechtsträger ist, wenn sie binnen sechs Monaten nach dem Tag, an dem die Eintragung der Spaltung in das Register des Sitzes desjenigen Rechtsträgers, dessen Gläubiger sie sind, als bekannt gemacht gilt, ihren Anspruch nach Grund und Höhe schriftlich anmelden, Sicherheit zu leisten, soweit sie nicht Befriedigung verlangen können. Dieses Recht steht den Gläubigern jedoch nur zu, wenn sie glaubhaft machen, dass durch die Spaltung die Erfüllung ihrer Forderung gefährdet wird"
    },
    {
      "date": "2025-07-10",
      "id": "115298",
      "original_text": "Einreichung neuer Dokumente\nBaden-Württemberg Amtsgericht Mannheim HRB 338007\nHeidelberger Beteiligungsholding AG – Heidelberg",
      "type": "Einreichung neuer Dokumente",
      "state": "Baden-Württemberg",
      "amtsgericht": "Amtsgericht Mannheim",
      "registernummer": "HRB 338007",
      "registerart": "HRB",
      "company_name": "Heidelberger Beteiligungsholding AG",
      "company_seat": "Heidelberg",
      "details": "10.07.2025 (Bekanntmachungsdatum)\n\nBaden-Württemberg Amtsgericht Mannheim HRB 338007\nEinreichung neuer Dokumente\n\nHeidelberger Beteiligungsholding AG\nAktiengesellschaft\nHeidelberg\n\nDie Gesellschaft hat am 09.07.2025 die Liste über die Zusammensetzung des Aufsichtsrats zum Handelsregister eingereicht."
    },
    {
      "date": "2025-07-10",
      "id": "115299",
      "original_text": "Registerbekanntmachung nach dem Umwandlungsgesetz\nBaden-Württemberg Amtsgericht Stuttgart HRB 18974\nDiconium Germany GmbH – Stuttgart",
      "type": "Registerbekanntmachung nach dem Umwandlungsgesetz",
      "state": "Baden-Württemberg",
      "amtsgericht": "Amtsgericht Stuttgart",
      "registernummer": "HRB 18974",
      "registerart": "HRB",
      "company_name": "Diconium Germany GmbH",
      "company_seat": "Stuttgart",
      "details": "10.07.2025 (Bekanntmachungsdatum)\n\nBaden-Württemberg Amtsgericht Stuttgart HRB 18974\nRegisterbekanntmachung nach dem Umwandlungsgesetz 10.07.2025 (Eintragungsdatum)\n\nDiconium Germany GmbH\nGesellschaft mit beschränkter Haftung\nStuttgart\n\nDen Gläubigern der an der Verschmelzung beteiligten Rechtsträger ist, wenn sie binnen sechs Monaten nach dem Tag, an dem die Eintragung der Verschmelzung in das Register des Sitzes desjenigen Rechtsträgers, dessen Gläubiger sie sind, nach § 19 Abs. 3 UmwG als bekanntgemacht gilt, ihren Anspruch nach Grund und Höhe schriftlich anmelden, Sicherheit zu leisten, soweit sie nicht Befriedigung verlangen können. Dieses Recht steht den Gläubigern jedoch nur zu, wenn sie glaubhaft machen, dass durch die Verschmelzung die Erfüllung ihrer Forderung gefährdet wird."
    },
    {
      "date": "2025-07-10",
      "id": "115300",
      "original_text": "Sonstige Registerbekanntmachung\nHamburg Amtsgericht Hamburg HRB 63197\nENCAVIS AG – Hamburg",
      "type": "Sonstige Registerbekanntmachung",
      "state": "Hamburg",
      "amtsgericht": "Amtsgericht Hamburg",
      "registernummer": "HRB 63197",
      "registerart": "HRB",
      "company_name": "ENCAVIS AG",
      "company_seat": "Hamburg",
      "details": "10.07.2025 (Bekanntmachungsdatum)\n\nHamburg Amtsgericht Hamburg HRB 63197\nSonstige Registerbekanntmachung\n\nENCAVIS AG\nAktiengesellschaft\nHamburg\n\nAls nicht eingetragen wird bekannt gemacht: Liste des Aufsichtsrats wurde eingereicht."
    },
    {
      "date": "2025-07-10",
      "id": "115301",
      "original_text": "Sonstige Registerbekanntmachung\nHamburg Amtsgericht Hamburg HRB 91830\nUnilever Deutschland Holding GmbH – Hamburg",
      "type": "Sonstige Registerbekanntmachung",
      "state": "Hamburg",
      "amtsgericht": "Amtsgericht Hamburg",
      "registernummer": "HRB 91830",
      "registerart": "HRB",
      "company_name": "Unilever Deutschland Holding GmbH",
      "company_seat": "Hamburg",
      "details": "10.07.2025 (Bekanntmachungsdatum)\n\nHamburg Amtsgericht Hamburg HRB 91830\nSonstige Registerbekanntmachung 10.07.2025 (Eintragungsdatum)\n\nUnilever Deutschland Holding GmbH\nGesellschaft mit beschränkter Haftung\nHamburg\n\nAls nicht eingetragen wird bekannt gemacht: Liste des Aufsichtsrats wurde eingereicht."
    },
    {
      "date": "2025-07-10",
      "id": "115302",
      "original_text": "Löschungsankündigung\nBrandenburg Amtsgericht Potsdam VR 8662\nMensch - SEIN e.V. – Brück/Mark",
      "type": "Löschungsankündigung",
      "state": "Brandenburg",
      "amtsgericht": "Amtsgericht Potsdam",
      "registernummer": "VR 8662",
      "registerart": "VR",
      "company_name": "Mensch - SEIN e.V.",
      "company_seat": "Brück/Mark",
      "details": "10.07.2025 (Bekanntmachungsdatum)\n\nBrandenburg Amtsgericht Potsdam VR 8662\nLöschungsankündigung\n\nMensch - SEIN e.V.\neingetragener Verein\nBrück/Mark\n\nBei dem nachstehenden Verein wird das Amtslöschungsverfahren gemäß § 395 FamFG eingeleitet.\nSollte binnen 2 Monaten ab Erhalt dieses Schreibens kein Widerspruch eingehen, erfolgt die Löschung des Vereins im Register."
    },
    {
      "date": "2025-07-10",
      "id": "115303",
      "original_text": "Registerbekanntmachung nach dem Umwandlungsgesetz\nBaden-Württemberg Amtsgericht Freiburg HRB 470376\nAlemannen-Brennerei Gesellschaft mit beschränkter Haftung – Durbach",
      "type": "Registerbekanntmachung nach dem Umwandlungsgesetz",
      "state": "Baden-Württemberg",
      "amtsgericht": "Amtsgericht Freiburg",
      "registernummer": "HRB 470376",
      "registerart": "HRB",
      "company_name": "Alemannen-Brennerei Gesellschaft mit beschränkter Haftung",
      "company_seat": "Durbach",
      "details": "10.07.2025 (Bekanntmachungsdatum)\n\nBaden-Württemberg Amtsgericht Freiburg HRB 470376\nRegisterbekanntmachung nach dem Umwandlungsgesetz 10.07.2025 (Eintragungsdatum)\n\nAlemannen-Brennerei Gesellschaft mit beschränkter Haftung\nGesellschaft mit beschränkter Haftung\nDurbach\n\nDen Gläubigern der an der Verschmelzung beteiligten Rechtsträger ist, wenn sie binnen sechs Monaten nach dem Tag, an dem die Eintragung der Verschmelzung in das Register des Sitzes desjenigen Rechtsträgers, dessen Gläubiger sie sind, nach § 19 Abs. 3 UmwG als bekanntgemacht gilt, ihren Anspruch nach Grund und Höhe schriftlich anmelden, Sicherheit zu leisten, soweit sie nicht Befriedigung verlangen können. Dieses Recht steht den Gläubigern jedoch nur zu, wenn sie glaubhaft machen, dass durch die Verschmelzung die Erfüllung ihrer Forderung gefährdet wird."
    },
    {
      "date": "2025-07-10",
      "id": "115304",
      "original_text": "Löschungsankündigung\nThüringen Amtsgericht Jena HRA 506895\nVitaQuant GmbH & Co. KG – Gebesee",
      "type": "Löschungsankündigung",
      "state": "Thüringen",
      "amtsgericht": "Amtsgericht Jena",
      "registernummer": "HRA 506895",
      "registerart": "HRA",
      "company_name": "VitaQuant GmbH & Co. KG",
      "company_seat": "Gebesee",
      "details": "10.07.2025 (Bekanntmachungsdatum)\n\nThüringen Amtsgericht Jena HRA 506895\nLöschungsankündigung\n\nVitaQuant GmbH & Co. KG\nKommanditgesellschaft\nGebesee\n\nDas Registergericht beabsichtigt, die im Handelsregister eingetragene Gesellschaft wegen Vermögenslosigkeit nach § 394 FamFG von Amts wegen zu löschen. Die Frist zur Erhebung eines Widerspruchs gegen die beabsichtigte Löschung wird auf 6 Wochen festgesetzt."
    },
    {
      "date": "2025-07-10",
      "id": "115305",
      "original_text": "Löschungsankündigung\nBerlin Amtsgericht Berlin (Charlottenburg) HRB 115817\nWood GmbH Fleisch- und Wurstwarenhandel und Partyservice – Berlin",
      "type": "Löschungsankündigung",
      "state": "Berlin",
      "amtsgericht": "Amtsgericht Berlin (Charlottenburg)",
      "registernummer": "HRB 115817",
      "registerart": "HRB",
      "company_name": "Wood GmbH Fleisch- und Wurstwarenhandel und Partyservice",
      "company_seat": "Berlin",
      "details": "10.07.2025 (Bekanntmachungsdatum)\n\nBerlin Amtsgericht Berlin (Charlottenburg) HRB 115817\nLöschungsankündigung\n\nWood GmbH Fleisch- und Wurstwarenhandel und Partyservice\nGesellschaft mit beschränkter Haftung\nBerlin\n\nBei der nachstehenden Gesellschaft wird das Amtslöschungsverfahren gemäß § 394 FamFG eingeleitet. Widerspruchsfrist 6 Wochen"
    },
    {
      "date": "2025-07-10",
      "id": "115306",
      "original_text": "Registerbekanntmachung nach dem Umwandlungsgesetz\nHamburg Amtsgericht Hamburg HRB 172793\nMorGen Mobility GmbH – Hamburg",
      "type": "Registerbekanntmachung nach dem Umwandlungsgesetz",
      "state": "Hamburg",
      "amtsgericht": "Amtsgericht Hamburg",
      "registernummer": "HRB 172793",
      "registerart": "HRB",
      "company_name": "MorGen Mobility GmbH",
      "company_seat": "Hamburg",
      "details": "10.07.2025 (Bekanntmachungsdatum)\n\nHamburg Amtsgericht Hamburg HRB 172793\nRegisterbekanntmachung nach dem Umwandlungsgesetz\n\nMorGen Mobility GmbH\nGesellschaft mit beschränkter Haftung\nHamburg\n\nAls nicht eingetragen wird bekanntgemacht:\nEs wird darauf hingewiesen, dass ein Verschmelzungsplan oder sein Entwurf über eine grenzüberschreitende Verschmelzung zur Aufnahme mit der Mint Hydrogen GmbH mit Sitz in Salzburg/Österreich (Firmenbuch des Landgerichts Salzburg unter 579810m) (Gesellschaft mit beschränkter Haftung nach österreichischem Recht) beim Handelsregister eingereicht worden ist.\nDie Anteilsinhaber, die Gläubiger sowie die zuständigen Betriebsräte der an der grenzüberschreitenden Verschmelzung beteiligten Gesellschaften oder, soweit es keinen Betriebsrat gibt, die Arbeitnehmer der an der grenzüberschreitenden Verschmelzung beteiligten Gesellschaften, können der jeweiligen Gesellschaft spätestens fünf Arbeitstage vor dem Tag der Gesellschafterversammlung Bemerkungen zum Verschmelzungsplan übermitteln."
    },
    {
      "date": "2025-07-10",
      "id": "115307",
      "original_text": "Löschungsankündigung\nBerlin Amtsgericht Berlin (Charlottenburg) HRB 174816\nRenetti GmbH – Berlin",
      "type": "Löschungsankündigung",
      "state": "Berlin",
      "amtsgericht": "Amtsgericht Berlin (Charlottenburg)",
      "registernummer": "HRB 174816",
      "registerart": "HRB",
      "company_name": "Renetti GmbH",
      "company_seat": "Berlin",
      "details": "10.07.2025 (Bekanntmachungsdatum)\n\nBerlin Amtsgericht Berlin (Charlottenburg) HRB 174816\nLöschungsankündigung\n\nRenetti GmbH\nGesellschaft mit beschränkter Haftung\nBerlin\n\nBei der nachstehenden Gesellschaft wird das Amtslöschungsverfahren gemäß § 394 FamFG eingeleitet. Widerspruchsfrist 6 Wochen"
    },
    {
      "date": "2025-07-10",
      "id": "115308",
      "original_text": "Registerbekanntmachung nach dem Umwandlungsgesetz\nBrandenburg Amtsgericht Potsdam HRB 23554\nSTERNAUTO Ludwigsfelde GmbH – Ludwigsfelde",
      "type": "Registerbekanntmachung nach dem Umwandlungsgesetz",
      "state": "Brandenburg",
      "amtsgericht": "Amtsgericht Potsdam",
      "registernummer": "HRB 23554",
      "registerart": "HRB",
      "company_name": "STERNAUTO Ludwigsfelde GmbH",
      "company_seat": "Ludwigsfelde",
      "details": "10.07.2025 (Bekanntmachungsdatum)\n\nBrandenburg Amtsgericht Potsdam HRB 23554\nRegisterbekanntmachung nach dem Umwandlungsgesetz 24.06.2025 (Eintragungsdatum)\n\nSTERNAUTO Ludwigsfelde GmbH\nGesellschaft mit beschränkter Haftung\nLudwigsfelde\n\nZu Eintragungsnummer 8 vom 24.06.2025 wird als nicht eingetragen veröffentlicht:\nDen Gläubigern der an der Verschmelzung beteiligten Rechtsträger ist, wenn sie binnen sechs Monaten nach dem Tag, an dem die Eintragung der Verschmelzung in das Register des Sitzes desjenigen Rechtsträgers, dessen Gläubiger sie sind, als bekannt gemacht gilt, ihren Anspruch nach Grund und Höhe schriftlich anmelden, Sicherheit zu leisten, soweit sie nicht Befriedigung verlangen können. Dieses Recht steht den Gläubigern jedoch nur zu, wenn sie glaubhaft machen, dass durch die Verschmelzung die Erfüllung ihrer Forderung gefährdet wird"
    },
    {
      "date": "2025-07-10",
      "id": "115309",
      "original_text": "Registerbekanntmachung nach dem Umwandlungsgesetz\nSachsen-Anhalt Amtsgericht Stendal HRA 7026\nPOLKA GmbH & Co. KG – Naumburg (Saale)",
      "type": "Registerbekanntmachung nach dem Umwandlungsgesetz",
      "state": "Sachsen-Anhalt",
      "amtsgericht": "Amtsgericht Stendal",
      "registernummer": "HRA 7026",
      "registerart": "HRA",
      "company_name": "POLKA GmbH & Co. KG",
      "company_seat": "Naumburg (Saale)",
      "details": "10.07.2025 (Bekanntmachungsdatum)\n\nSachsen-Anhalt Amtsgericht Stendal HRA 7026\nRegisterbekanntmachung nach dem Umwandlungsgesetz 10.07.2025 (Eintragungsdatum)\n\nPOLKA GmbH & Co. KG\nKommanditgesellschaft\nNaumburg (Saale)\n\nNicht eingetragen:\nDen Gläubigern der an der Verschmelzung beteiligten Rechtsträger ist, wenn sie binnen sechs Monaten nach dem Tag, an dem die Eintragung der Verschmelzung nach § 19 Abs. 3 UmwG als bekanntgemacht gilt, ihren Anspruch nach Grund und Höhe schriftlich anmelden, Sicherheit zu leisten, soweit sie nicht Befriedigung verlangen können. Dieses Recht steht ihnen jedoch nur zu, wenn sie glaubhaft machen, dass durch die Verschmelzung die Erfüllung ihrer Forderung gefährdet wird."
    },
    {
      "date": "2025-07-10",
      "id": "115310",
      "original_text": "Registerbekanntmachung nach dem Umwandlungsgesetz\nHamburg Amtsgericht Hamburg HRB 77342\nVerwaltung MS \"E. R. CANADA\" Schiffahrtsgesellschaft mbH – Hamburg",
      "type": "Registerbekanntmachung nach dem Umwandlungsgesetz",
      "state": "Hamburg",
      "amtsgericht": "Amtsgericht Hamburg",
      "registernummer": "HRB 77342",
      "registerart": "HRB",
      "company_name": "Verwaltung MS \"E. R. CANADA\" Schiffahrtsgesellschaft mbH",
      "company_seat": "Hamburg",
      "details": "10.07.2025 (Bekanntmachungsdatum)\n\nHamburg Amtsgericht Hamburg HRB 77342\nRegisterbekanntmachung nach dem Umwandlungsgesetz 10.07.2025 (Eintragungsdatum)\n\nVerwaltung MS \"E. R. CANADA\" Schiffahrtsgesellschaft mbH\nGesellschaft mit beschränkter Haftung\nHamburg\n\nAls nicht eingetragen wird bekannt gemacht:\nDen Gläubigern der an der Verschmelzung beteiligten Gesellschaften ist, wenn sie binnen sechs Monaten nach dem Tag, an dem die Eintragung der Verschmelzung in das Register des Sitzes desjenigen Rechtsträgers, dessen Gläubiger sie sind, nach § 19 Absatz 3 UmwG als bekannt gemacht gilt, ihren Anspruch nach Grund und Höhe schriftlich anmelden, Sicherheit zu leisten, soweit sie nicht Befriedigung verlangen können. Dieses Recht steht den Gläubigern jedoch nur zu, wenn sie glaubhaft machen, dass durch die Verschmelzung die Erfüllung ihrer Forderung gefährdet wird."
    },
    {
      "date": "2025-07-10",
      "id": "115311",
      "original_text": "Registerbekanntmachung nach dem Umwandlungsgesetz\nHamburg Amtsgericht Hamburg HRB 62878\nVerwaltung MS \"E. R. AMSTERDAM\" Schiffahrtsgesellschaft mbH – Hamburg",
      "type": "Registerbekanntmachung nach dem Umwandlungsgesetz",
      "state": "Hamburg",
      "amtsgericht": "Amtsgericht Hamburg",
      "registernummer": "HRB 62878",
      "registerart": "HRB",
      "company_name": "Verwaltung MS \"E. R. AMSTERDAM\" Schiffahrtsgesellschaft mbH",
      "company_seat": "Hamburg",
      "details": "10.07.2025 (Bekanntmachungsdatum)\n\nHamburg Amtsgericht Hamburg HRB 62878\nRegisterbekanntmachung nach dem Umwandlungsgesetz 10.07.2025 (Eintragungsdatum)\n\nVerwaltung MS \"E. R. AMSTERDAM\" Schiffahrtsgesellschaft mbH\nGesellschaft mit beschränkter Haftung\nHamburg\n\nAls nicht eingetragen wird bekannt gemacht:\nDen Gläubigern der an der Verschmelzung beteiligten Gesellschaften ist, wenn sie binnen sechs Monaten nach dem Tag, an dem die Eintragung der Verschmelzung in das Register des Sitzes desjenigen Rechtsträgers, dessen Gläubiger sie sind, nach § 19 Absatz 3 UmwG als bekannt gemacht gilt, ihren Anspruch nach Grund und Höhe schriftlich anmelden, Sicherheit zu leisten, soweit sie nicht Befriedigung verlangen können. Dieses Recht steht den Gläubigern jedoch nur zu, wenn sie glaubhaft machen, dass durch die Verschmelzung die Erfüllung ihrer Forderung gefährdet wird."
    },
    {
      "date": "2025-07-10",
      "id": "115312",
      "original_text": "Registerbekanntmachung nach dem Umwandlungsgesetz\nHamburg Amtsgericht Hamburg HRB 70041\nVerwaltung NC ERB Post Panamax Schiffs GmbH – Hamburg",
      "type": "Registerbekanntmachung nach dem Umwandlungsgesetz",
      "state": "Hamburg",
      "amtsgericht": "Amtsgericht Hamburg",
      "registernummer": "HRB 70041",
      "registerart": "HRB",
      "company_name": "Verwaltung NC ERB Post Panamax Schiffs GmbH",
      "company_seat": "Hamburg",
      "details": "10.07.2025 (Bekanntmachungsdatum)\n\nHamburg Amtsgericht Hamburg HRB 70041\nRegisterbekanntmachung nach dem Umwandlungsgesetz 10.07.2025 (Eintragungsdatum)\n\nVerwaltung NC ERB Post Panamax Schiffs GmbH\nGesellschaft mit beschränkter Haftung\nHamburg\n\nAls nicht eingetragen wird bekannt gemacht:\nDen Gläubigern der an der Verschmelzung beteiligten Gesellschaften ist, wenn sie binnen sechs Monaten nach dem Tag, an dem die Eintragung der Verschmelzung in das Register des Sitzes desjenigen Rechtsträgers, dessen Gläubiger sie sind, nach § 19 Absatz 3 UmwG als bekannt gemacht gilt, ihren Anspruch nach Grund und Höhe schriftlich anmelden, Sicherheit zu leisten, soweit sie nicht Befriedigung verlangen können. Dieses Recht steht den Gläubigern jedoch nur zu, wenn sie glaubhaft machen, dass durch die Verschmelzung die Erfüllung ihrer Forderung gefährdet wird."
    },
    {
      "date": "2025-07-10",
      "id": "115313",
      "original_text": "Registerbekanntmachung nach dem Umwandlungsgesetz\nHamburg Amtsgericht Hamburg HRB 77345\nVerwaltung NC ERB Schiffs GmbH – Hamburg",
      "type": "Registerbekanntmachung nach dem Umwandlungsgesetz",
      "state": "Hamburg",
      "amtsgericht": "Amtsgericht Hamburg",
      "registernummer": "HRB 77345",
      "registerart": "HRB",
      "company_name": "Verwaltung NC ERB Schiffs GmbH",
      "company_seat": "Hamburg",
      "details": "10.07.2025 (Bekanntmachungsdatum)\n\nHamburg Amtsgericht Hamburg HRB 77345\nRegisterbekanntmachung nach dem Umwandlungsgesetz 10.07.2025 (Eintragungsdatum)\n\nVerwaltung NC ERB Schiffs GmbH\nGesellschaft mit beschränkter Haftung\nHamburg\n\nAls nicht eingetragen wird bekannt gemacht:\nDen Gläubigern der an der Verschmelzung beteiligten Gesellschaften ist, wenn sie binnen sechs Monaten nach dem Tag, an dem die Eintragung der Verschmelzung in das Register des Sitzes desjenigen Rechtsträgers, dessen Gläubiger sie sind, nach § 19 Absatz 3 UmwG als bekannt gemacht gilt, ihren Anspruch nach Grund und Höhe schriftlich anmelden, Sicherheit zu leisten, soweit sie nicht Befriedigung verlangen können. Dieses Recht steht den Gläubigern jedoch nur zu, wenn sie glaubhaft machen, dass durch die Verschmelzung die Erfüllung ihrer Forderung gefährdet wird."
    },
    {
      "date": "2025-07-10",
      "id": "115314",
      "original_text": "Registerbekanntmachung nach dem Umwandlungsgesetz\nHamburg Amtsgericht Hamburg HRB 74724\nVerwaltung Reederei MS \"E.R. KOBE\" Beteiligungsgesellschaft mbH – Hamburg",
      "type": "Registerbekanntmachung nach dem Umwandlungsgesetz",
      "state": "Hamburg",
      "amtsgericht": "Amtsgericht Hamburg",
      "registernummer": "HRB 74724",
      "registerart": "HRB",
      "company_name": "Verwaltung Reederei MS \"E.R. KOBE\" Beteiligungsgesellschaft mbH",
      "company_seat": "Hamburg",
      "details": "10.07.2025 (Bekanntmachungsdatum)\n\nHamburg Amtsgericht Hamburg HRB 74724\nRegisterbekanntmachung nach dem Umwandlungsgesetz 10.07.2025 (Eintragungsdatum)\n\nVerwaltung Reederei MS \"E.R. KOBE\" Beteiligungsgesellschaft mbH\nGesellschaft mit beschränkter Haftung\nHamburg\n\nAls nicht eingetragen wird bekannt gemacht:\nDen Gläubigern der an der Verschmelzung beteiligten Gesellschaften ist, wenn sie binnen sechs Monaten nach dem Tag, an dem die Eintragung der Verschmelzung in das Register des Sitzes desjenigen Rechtsträgers, dessen Gläubiger sie sind, nach § 19 Absatz 3 UmwG als bekannt gemacht gilt, ihren Anspruch nach Grund und Höhe schriftlich anmelden, Sicherheit zu leisten, soweit sie nicht Befriedigung verlangen können. Dieses Recht steht den Gläubigern jedoch nur zu, wenn sie glaubhaft machen, dass durch die Verschmelzung die Erfüllung ihrer Forderung gefährdet wird."
    },
    {
      "date": "2025-07-10",
      "id": "115315",
      "original_text": "Registerbekanntmachung nach dem Umwandlungsgesetz\nMecklenburg-Vorpommern Amtsgericht Rostock HRA 5258\nTransport- & Speditions Unternehmen Jens Bode e.K. – Bützow",
      "type": "Registerbekanntmachung nach dem Umwandlungsgesetz",
      "state": "Mecklenburg-Vorpommern",
      "amtsgericht": "Amtsgericht Rostock",
      "registernummer": "HRA 5258",
      "registerart": "HRA",
      "company_name": "Transport- & Speditions Unternehmen Jens Bode e.K.",
      "company_seat": "Bützow",
      "details": "10.07.2025 (Bekanntmachungsdatum)\n\nMecklenburg-Vorpommern Amtsgericht Rostock HRA 5258\nRegisterbekanntmachung nach dem Umwandlungsgesetz 10.07.2025 (Eintragungsdatum)\n\nTransport- & Speditions Unternehmen Jens Bode e.K.\nEinzelkaufmann / Einzelkauffrau\nBützow\n\nDen Gläubigern der an der Ausgliederung beteiligten Rechtsträger ist, wenn sie binnen sechs Monaten nach dem Tag, an dem die Eintragung der Ausgliederung in das Register des Sitzes desjenigen Rechtsträgers, dessen Gläubiger sie sind, nach § 19 Abs. 3 UmwG als bekannt gemacht gilt, ihren Anspruch nach Grund und Höhe in Textform anmelden, Sicherheit zu leisten, soweit sie nicht Befriedigung verlangen können. Dieses Recht steht den Gläubigern jedoch nur zu, wenn sie glaubhaft machen, dass durch die Ausgliederung die Erfüllung der Forderung gefährdet wird."
    },
    {
      "date": "2025-07-10",
      "id": "115316",
      "original_text": "Registerbekanntmachung nach dem Umwandlungsgesetz\nSchleswig-Holstein Amtsgericht Lübeck HRB 584 SB\nHAY Computing Service GmbH – Wentorf bei Hamburg",
      "type": "Registerbekanntmachung nach dem Umwandlungsgesetz",
      "state": "Schleswig-Holstein",
      "amtsgericht": "Amtsgericht Lübeck",
      "registernummer": "HRB 584 SB",
      "registerart": "HRB",
      "company_name": "HAY Computing Service GmbH",
      "company_seat": "Wentorf bei Hamburg",
      "details": "10.07.2025 (Bekanntmachungsdatum)\n\nSchleswig-Holstein Amtsgericht Lübeck HRB 584 SB\nRegisterbekanntmachung nach dem Umwandlungsgesetz 10.07.2025 (Eintragungsdatum)\n\nHAY Computing Service GmbH\nGesellschaft mit beschränkter Haftung\nWentorf bei Hamburg\n\nZu Eintragungsnummer 13 vom 10.07.2025 wird als nicht eingetragen veröffentlicht: Den Gläubigern der an der Verschmelzung beteiligten Rechtsträger ist, wenn sie binnen sechs Monaten nach dem Tag, an dem die Eintragung der Verschmelzung in das Register des Sitzes desjenigen Rechtsträgers, dessen Gläubiger sie sind, als bekannt gemacht gilt, ihren Anspruch nach Grund und Höhe schriftlich anmelden, Sicherheit zu leisten, soweit sie nicht Befriedigung verlangen können. Dieses Recht steht den Gläubigern jedoch nur zu, wenn sie glaubhaft machen, dass durch die Verschmelzung die Erfüllung ihrer Forderung gefährdet wird."
    },
    {
      "date": "2025-07-10",
      "id": "115317",
      "original_text": "Registerbekanntmachung nach dem Umwandlungsgesetz\nHamburg Amtsgericht Hamburg HRB 68147\nVerwaltung MS \"E. R. SEOUL\" Schiffahrtsgesellschaft mbH – Hamburg",
      "type": "Registerbekanntmachung nach dem Umwandlungsgesetz",
      "state": "Hamburg",
      "amtsgericht": "Amtsgericht Hamburg",
      "registernummer": "HRB 68147",
      "registerart": "HRB",
      "company_name": "Verwaltung MS \"E. R. SEOUL\" Schiffahrtsgesellschaft mbH",
      "company_seat": "Hamburg",
      "details": "10.07.2025 (Bekanntmachungsdatum)\n\nHamburg Amtsgericht Hamburg HRB 68147\nRegisterbekanntmachung nach dem Umwandlungsgesetz 10.07.2025 (Eintragungsdatum)\n\nVerwaltung MS \"E. R. SEOUL\" Schiffahrtsgesellschaft mbH\nGesellschaft mit beschränkter Haftung\nHamburg\n\nAls nicht eingetragen wird bekannt gemacht:\nDen Gläubigern der an der Verschmelzung beteiligten Gesellschaften ist, wenn sie binnen sechs Monaten nach dem Tag, an dem die Eintragung der Verschmelzung in das Register des Sitzes desjenigen Rechtsträgers, dessen Gläubiger sie sind, nach § 19 Absatz 3 UmwG als bekannt gemacht gilt, ihren Anspruch nach Grund und Höhe schriftlich anmelden, Sicherheit zu leisten, soweit sie nicht Befriedigung verlangen können. Dieses Recht steht den Gläubigern jedoch nur zu, wenn sie glaubhaft machen, dass durch die Verschmelzung die Erfüllung ihrer Forderung gefährdet wird."
    },
    {
      "date": "2025-07-10",
      "id": "115318",
      "original_text": "Registerbekanntmachung nach dem Umwandlungsgesetz\nHamburg Amtsgericht Hamburg HRB 74722\nVerwaltung MS \"E. R. FRANCE\" Schiffahrtsgesellschaft mbH – Hamburg",
      "type": "Registerbekanntmachung nach dem Umwandlungsgesetz",
      "state": "Hamburg",
      "amtsgericht": "Amtsgericht Hamburg",
      "registernummer": "HRB 74722",
      "registerart": "HRB",
      "company_name": "Verwaltung MS \"E. R. FRANCE\" Schiffahrtsgesellschaft mbH",
      "company_seat": "Hamburg",
      "details": "10.07.2025 (Bekanntmachungsdatum)\n\nHamburg Amtsgericht Hamburg HRB 74722\nRegisterbekanntmachung nach dem Umwandlungsgesetz 10.07.2025 (Eintragungsdatum)\n\nVerwaltung MS \"E. R. FRANCE\" Schiffahrtsgesellschaft mbH\nGesellschaft mit beschränkter Haftung\nHamburg\n\nAls nicht eingetragen wird bekannt gemacht:\nDen Gläubigern der an der Verschmelzung beteiligten Gesellschaften ist, wenn sie binnen sechs Monaten nach dem Tag, an dem die Eintragung der Verschmelzung in das Register des Sitzes desjenigen Rechtsträgers, dessen Gläubiger sie sind, nach § 19 Absatz 3 UmwG als bekannt gemacht gilt, ihren Anspruch nach Grund und Höhe schriftlich anmelden, Sicherheit zu leisten, soweit sie nicht Befriedigung verlangen können. Dieses Recht steht den Gläubigern jedoch nur zu, wenn sie glaubhaft machen, dass durch die Verschmelzung die Erfüllung ihrer Forderung gefährdet wird."
    },
    {
      "date": "2025-07-10",
      "id": "115319",
      "original_text": "Registerbekanntmachung nach dem Umwandlungsgesetz\nHamburg Amtsgericht Hamburg HRB 77343\nVerwaltung Reederei MS \"E. R. LONDON\" Beteiligungsgesellschaft mbH – Hamburg",
      "type": "Registerbekanntmachung nach dem Umwandlungsgesetz",
      "state": "Hamburg",
      "amtsgericht": "Amtsgericht Hamburg",
      "registernummer": "HRB 77343",
      "registerart": "HRB",
      "company_name": "Verwaltung Reederei MS \"E. R. LONDON\" Beteiligungsgesellschaft mbH",
      "company_seat": "Hamburg",
      "details": "10.07.2025 (Bekanntmachungsdatum)\n\nHamburg Amtsgericht Hamburg HRB 77343\nRegisterbekanntmachung nach dem Umwandlungsgesetz 10.07.2025 (Eintragungsdatum)\n\nVerwaltung Reederei MS \"E. R. LONDON\" Beteiligungsgesellschaft mbH\nGesellschaft mit beschränkter Haftung\nHamburg\n\nAls nicht eingetragen wird bekannt gemacht:\nDen Gläubigern der an der Verschmelzung beteiligten Gesellschaften ist, wenn sie binnen sechs Monaten nach dem Tag, an dem die Eintragung der Verschmelzung in das Register des Sitzes desjenigen Rechtsträgers, dessen Gläubiger sie sind, nach § 19 Absatz 3 UmwG als bekannt gemacht gilt, ihren Anspruch nach Grund und Höhe schriftlich anmelden, Sicherheit zu leisten, soweit sie nicht Befriedigung verlangen können. Dieses Recht steht den Gläubigern jedoch nur zu, wenn sie glaubhaft machen, dass durch die Verschmelzung die Erfüllung ihrer Forderung gefährdet wird."
    },
    {
      "date": "2025-07-10",
      "id": "115320",
      "original_text": "Registerbekanntmachung nach dem Umwandlungsgesetz\nHamburg Amtsgericht Hamburg HRB 68146\nVerwaltung MS \"E. R. PUSAN\" Schiffahrtsgesellschaft mbH – Hamburg",
      "type": "Registerbekanntmachung nach dem Umwandlungsgesetz",
      "state": "Hamburg",
      "amtsgericht": "Amtsgericht Hamburg",
      "registernummer": "HRB 68146",
      "registerart": "HRB",
      "company_name": "Verwaltung MS \"E. R. PUSAN\" Schiffahrtsgesellschaft mbH",
      "company_seat": "Hamburg",
      "details": "10.07.2025 (Bekanntmachungsdatum)\n\nHamburg Amtsgericht Hamburg HRB 68146\nRegisterbekanntmachung nach dem Umwandlungsgesetz 10.07.2025 (Eintragungsdatum)\n\nVerwaltung MS \"E. R. PUSAN\" Schiffahrtsgesellschaft mbH\nGesellschaft mit beschränkter Haftung\nHamburg\n\nAls nicht eingetragen wird bekannt gemacht:\nDen Gläubigern der an der Verschmelzung beteiligten Gesellschaften ist, wenn sie binnen sechs Monaten nach dem Tag, an dem die Eintragung der Verschmelzung in das Register des Sitzes desjenigen Rechtsträgers, dessen Gläubiger sie sind, nach § 19 Absatz 3 UmwG als bekannt gemacht gilt, ihren Anspruch nach Grund und Höhe schriftlich anmelden, Sicherheit zu leisten, soweit sie nicht Befriedigung verlangen können. Dieses Recht steht den Gläubigern jedoch nur zu, wenn sie glaubhaft machen, dass durch die Verschmelzung die Erfüllung ihrer Forderung gefährdet wird."
    },
    {
      "date": "2025-07-10",
      "id": "115321",
      "original_text": "Registerbekanntmachung nach dem Umwandlungsgesetz\nHamburg Amtsgericht Hamburg HRB 77416\nVerwaltung Reederei MS \"E. R. SWEDEN\" Beteiligungsgesellschaft mbH – Hamburg",
      "type": "Registerbekanntmachung nach dem Umwandlungsgesetz",
      "state": "Hamburg",
      "amtsgericht": "Amtsgericht Hamburg",
      "registernummer": "HRB 77416",
      "registerart": "HRB",
      "company_name": "Verwaltung Reederei MS \"E. R. SWEDEN\" Beteiligungsgesellschaft mbH",
      "company_seat": "Hamburg",
      "details": "10.07.2025 (Bekanntmachungsdatum)\n\nHamburg Amtsgericht Hamburg HRB 77416\nRegisterbekanntmachung nach dem Umwandlungsgesetz 10.07.2025 (Eintragungsdatum)\n\nVerwaltung Reederei MS \"E. R. SWEDEN\" Beteiligungsgesellschaft mbH\nGesellschaft mit beschränkter Haftung\nHamburg\n\nAls nicht eingetragen wird bekannt gemacht:\nDen Gläubigern der an der Verschmelzung beteiligten Gesellschaften ist, wenn sie binnen sechs Monaten nach dem Tag, an dem die Eintragung der Verschmelzung in das Register des Sitzes desjenigen Rechtsträgers, dessen Gläubiger sie sind, nach § 19 Absatz 3 UmwG als bekannt gemacht gilt, ihren Anspruch nach Grund und Höhe schriftlich anmelden, Sicherheit zu leisten, soweit sie nicht Befriedigung verlangen können. Dieses Recht steht den Gläubigern jedoch nur zu, wenn sie glaubhaft machen, dass durch die Verschmelzung die Erfüllung ihrer Forderung gefährdet wird."
    },
    {
      "date": "2025-07-10",
      "id": "115322",
      "original_text": "Registerbekanntmachung nach dem Umwandlungsgesetz\nHamburg Amtsgericht Hamburg HRB 77346\nVerwaltung Reederei MS \"E.R.DENMARK\" Beteiligungsgesellschaft mbH – Hamburg",
      "type": "Registerbekanntmachung nach dem Umwandlungsgesetz",
      "state": "Hamburg",
      "amtsgericht": "Amtsgericht Hamburg",
      "registernummer": "HRB 77346",
      "registerart": "HRB",
      "company_name": "Verwaltung Reederei MS \"E.R.DENMARK\" Beteiligungsgesellschaft mbH",
      "company_seat": "Hamburg",
      "details": "10.07.2025 (Bekanntmachungsdatum)\n\nHamburg Amtsgericht Hamburg HRB 77346\nRegisterbekanntmachung nach dem Umwandlungsgesetz 10.07.2025 (Eintragungsdatum)\n\nVerwaltung Reederei MS \"E.R.DENMARK\" Beteiligungsgesellschaft mbH\nGesellschaft mit beschränkter Haftung\nHamburg\n\nAls nicht eingetragen wird bekannt gemacht:\nDen Gläubigern der an der Verschmelzung beteiligten Gesellschaften ist, wenn sie binnen sechs Monaten nach dem Tag, an dem die Eintragung der Verschmelzung in das Register des Sitzes desjenigen Rechtsträgers, dessen Gläubiger sie sind, nach § 19 Absatz 3 UmwG als bekannt gemacht gilt, ihren Anspruch nach Grund und Höhe schriftlich anmelden, Sicherheit zu leisten, soweit sie nicht Befriedigung verlangen können. Dieses Recht steht den Gläubigern jedoch nur zu, wenn sie glaubhaft machen, dass durch die Verschmelzung die Erfüllung ihrer Forderung gefährdet wird."
    },
    {
      "date": "2025-07-10",
      "id": "115323",
      "original_text": "Registerbekanntmachung nach dem Umwandlungsgesetz\nHamburg Amtsgericht Hamburg HRB 61126\nVerwaltung MS \"E. R. FELIXSTOWE\" Schiffahrtsgesellschaft mbH – Hamburg",
      "type": "Registerbekanntmachung nach dem Umwandlungsgesetz",
      "state": "Hamburg",
      "amtsgericht": "Amtsgericht Hamburg",
      "registernummer": "HRB 61126",
      "registerart": "HRB",
      "company_name": "Verwaltung MS \"E. R. FELIXSTOWE\" Schiffahrtsgesellschaft mbH",
      "company_seat": "Hamburg",
      "details": "10.07.2025 (Bekanntmachungsdatum)\n\nHamburg Amtsgericht Hamburg HRB 61126\nRegisterbekanntmachung nach dem Umwandlungsgesetz 10.07.2025 (Eintragungsdatum)\n\nVerwaltung MS \"E. R. FELIXSTOWE\" Schiffahrtsgesellschaft mbH\nGesellschaft mit beschränkter Haftung\nHamburg\n\nAls nicht eingetragen wird bekannt gemacht:\nDen Gläubigern der an der Verschmelzung beteiligten Gesellschaften ist, wenn sie binnen sechs Monaten nach dem Tag, an dem die Eintragung der Verschmelzung in das Register des Sitzes desjenigen Rechtsträgers, dessen Gläubiger sie sind, nach § 19 Absatz 3 UmwG als bekannt gemacht gilt, ihren Anspruch nach Grund und Höhe schriftlich anmelden, Sicherheit zu leisten, soweit sie nicht Befriedigung verlangen können. Dieses Recht steht den Gläubigern jedoch nur zu, wenn sie glaubhaft machen, dass durch die Verschmelzung die Erfüllung ihrer Forderung gefährdet wird."
    },
    {
      "date": "2025-07-10",
      "id": "115324",
      "original_text": "Löschungsankündigung\nBerlin Amtsgericht Berlin (Charlottenburg) HRB 240647\nIVBB Falkensee Living GmbH – Berlin",
      "type": "Löschungsankündigung",
      "state": "Berlin",
      "amtsgericht": "Amtsgericht Berlin (Charlottenburg)",
      "registernummer": "HRB 240647",
      "registerart": "HRB",
      "company_name": "IVBB Falkensee Living GmbH",
      "company_seat": "Berlin",
      "details": "10.07.2025 (Bekanntmachungsdatum)\n\nBerlin Amtsgericht Berlin (Charlottenburg) HRB 240647\nLöschungsankündigung\n\nIVBB Falkensee Living GmbH\nGesellschaft mit beschränkter Haftung\nBerlin\n\nBei der nachstehenden Gesellschaft wird das Amtslöschungsverfahren gemäß § 394 FamFG eingeleitet. Widerspruchsfrist 6 Wochen"
    },
    {
      "date": "2025-07-10",
      "id": "115325",
      "original_text": "Registerbekanntmachung nach dem Umwandlungsgesetz\nBerlin Amtsgericht Berlin (Charlottenburg) HRB 178196\nPS Wertschutz GmbH – Berlin",
      "type": "Registerbekanntmachung nach dem Umwandlungsgesetz",
      "state": "Berlin",
      "amtsgericht": "Amtsgericht Berlin (Charlottenburg)",
      "registernummer": "HRB 178196",
      "registerart": "HRB",
      "company_name": "PS Wertschutz GmbH",
      "company_seat": "Berlin",
      "details": "10.07.2025 (Bekanntmachungsdatum)\n\nBerlin Amtsgericht Berlin (Charlottenburg) HRB 178196\nRegisterbekanntmachung nach dem Umwandlungsgesetz 09.07.2025 (Eintragungsdatum)\n\nPS Wertschutz GmbH\nGesellschaft mit beschränkter Haftung\nBerlin\n\nZu Eintragungsnummer 11 vom 09.07.2025 wird als nicht eingetragen veröffentlicht:Den Gläubigern der an der Verschmelzung beteiligten Rechtsträger ist, wenn sie binnen sechs Monaten nach dem Tag, an dem die Eintragung der Verschmelzung in das Register des Sitzes desjenigen Rechtsträgers, dessen Gläubiger sie sind, als bekannt gemacht gilt, ihren Anspruch nach Grund und Höhe schriftlich anmelden, Sicherheit zu leisten, soweit sie nicht Befriedigung verlangen können. Dieses Recht steht den Gläubigern jedoch nur zu, wenn sie glaubhaft machen, dass durch die Verschmelzung die Erfüllung ihrer Forderung gefährdet wird. Das Recht, Sicherheitsleistung zu verlangen, steht Gläubigern nicht zu, die im Falle der Insolvenz ein Recht auf vorzugsweise Befriedigung aus einer Deckungsmasse haben, die nach gesetzlicher Vorschrift zu ihrem Schutz errichtet und staatlich überwacht ist."
    },
    {
      "date": "2025-07-10",
      "id": "115326",
      "original_text": "Registerbekanntmachung nach dem Umwandlungsgesetz\nBrandenburg Amtsgericht Cottbus HRA 4444\nVigelahn BauTeam Hoch- und Tiefbau e. K. – Königs Wusterhausen",
      "type": "Registerbekanntmachung nach dem Umwandlungsgesetz",
      "state": "Brandenburg",
      "amtsgericht": "Amtsgericht Cottbus",
      "registernummer": "HRA 4444",
      "registerart": "HRA",
      "company_name": "Vigelahn BauTeam Hoch- und Tiefbau e. K.",
      "company_seat": "Königs Wusterhausen",
      "details": "10.07.2025 (Bekanntmachungsdatum)\n\nBrandenburg Amtsgericht Cottbus HRA 4444\nRegisterbekanntmachung nach dem Umwandlungsgesetz 09.07.2025 (Eintragungsdatum)\n\nVigelahn BauTeam Hoch- und Tiefbau e. K.\nEinzelkaufmann / Einzelkauffrau\nKönigs Wusterhausen\n\nAls nicht eingetragen wird veröffentlicht:\nDen Gläubigern der an der Spaltung beteiligten Rechtsträger ist, wenn sie binnen sechs Monaten nach dem Tag, an dem die Eintragung der Spaltung in das Register des Sitzes desjenigen Rechtsträgers, dessen Gläubiger sie sind, als bekannt gemacht gilt, ihren Anspruch nach Grund und Höhe schriftlich anmelden, Sicherheit zu leisten, soweit sie nicht Befriedigung verlangen können. Dieses Recht steht den Gläubigern jedoch nur zu, wenn sie glaubhaft machen, dass durch die Spaltung die Erfüllung ihrer Forderung gefährdet wird"
    },
    {
      "date": "2025-07-10",
      "id": "115327",
      "original_text": "Einreichung neuer Dokumente\nBerlin Amtsgericht Berlin (Charlottenburg) HRB 125681\nUniversum Kommunikation und Medien AG – Berlin",
      "type": "Einreichung neuer Dokumente",
      "state": "Berlin",
      "amtsgericht": "Amtsgericht Berlin (Charlottenburg)",
      "registernummer": "HRB 125681",
      "registerart": "HRB",
      "company_name": "Universum Kommunikation und Medien AG",
      "company_seat": "Berlin",
      "details": "10.07.2025 (Bekanntmachungsdatum)\n\nBerlin Amtsgericht Berlin (Charlottenburg) HRB 125681\nEinreichung neuer Dokumente\n\nUniversum Kommunikation und Medien AG\nAktiengesellschaft\nBerlin\n\nAls nicht eingetragen wird veröffentlicht: Es wurde eine neue Liste der Aufsichtsratsmitglieder eingereicht (§ 106 AktG)."
    },
    {
      "date": "2025-07-10",
      "id": "115328",
      "original_text": "Einreichung neuer Dokumente\nBaden-Württemberg Amtsgericht Ulm HRB 726621\nSHW AG – Aalen",
      "type": "Einreichung neuer Dokumente",
      "state": "Baden-Württemberg",
      "amtsgericht": "Amtsgericht Ulm",
      "registernummer": "HRB 726621",
      "registerart": "HRB",
      "company_name": "SHW AG",
      "company_seat": "Aalen",
      "details": "10.07.2025 (Bekanntmachungsdatum)\n\nBaden-Württemberg Amtsgericht Ulm HRB 726621\nEinreichung neuer Dokumente 10.07.2025 (Eintragungsdatum)\n\nSHW AG\nAktiengesellschaft\nAalen\n\nDie Gesellschaft hat am 03.07.2025 die Liste über die Zusammensetzung des Aufsichtsrats zum Handelsregister eingereicht."
    },
    {
      "date": "2025-07-10",
      "id": "115329",
      "original_text": "Registerbekanntmachung nach dem Umwandlungsgesetz\nHamburg Amtsgericht Hamburg HRB 62879\nVerwaltung MS \"E. R. HAMBURG\" Schiffahrtsgesellschaft mbH – Hamburg",
      "type": "Registerbekanntmachung nach dem Umwandlungsgesetz",
      "state": "Hamburg",
      "amtsgericht": "Amtsgericht Hamburg",
      "registernummer": "HRB 62879",
      "registerart": "HRB",
      "company_name": "Verwaltung MS \"E. R. HAMBURG\" Schiffahrtsgesellschaft mbH",
      "company_seat": "Hamburg",
      "details": "10.07.2025 (Bekanntmachungsdatum)\n\nHamburg Amtsgericht Hamburg HRB 62879\nRegisterbekanntmachung nach dem Umwandlungsgesetz 10.07.2025 (Eintragungsdatum)\n\nVerwaltung MS \"E. R. HAMBURG\" Schiffahrtsgesellschaft mbH\nGesellschaft mit beschränkter Haftung\nHamburg\n\nAls nicht eingetragen wird bekannt gemacht:\nDen Gläubigern der an der Verschmelzung beteiligten Gesellschaften ist, wenn sie binnen sechs Monaten nach dem Tag, an dem die Eintragung der Verschmelzung in das Register des Sitzes desjenigen Rechtsträgers, dessen Gläubiger sie sind, nach § 19 Absatz 3 UmwG als bekannt gemacht gilt, ihren Anspruch nach Grund und Höhe schriftlich anmelden, Sicherheit zu leisten, soweit sie nicht Befriedigung verlangen können. Dieses Recht steht den Gläubigern jedoch nur zu, wenn sie glaubhaft machen, dass durch die Verschmelzung die Erfüllung ihrer Forderung gefährdet wird."
    },
    {
      "date": "2025-07-10",
      "id": "115330",
      "original_text": "Registerbekanntmachung nach dem Umwandlungsgesetz\nHamburg Amtsgericht Hamburg HRB 68148\nVerwaltung MS \"E. R. DURBAN\" Schiffahrtsgesellschaft mbH – Hamburg",
      "type": "Registerbekanntmachung nach dem Umwandlungsgesetz",
      "state": "Hamburg",
      "amtsgericht": "Amtsgericht Hamburg",
      "registernummer": "HRB 68148",
      "registerart": "HRB",
      "company_name": "Verwaltung MS \"E. R. DURBAN\" Schiffahrtsgesellschaft mbH",
      "company_seat": "Hamburg",
      "details": "10.07.2025 (Bekanntmachungsdatum)\n\nHamburg Amtsgericht Hamburg HRB 68148\nRegisterbekanntmachung nach dem Umwandlungsgesetz 10.07.2025 (Eintragungsdatum)\n\nVerwaltung MS \"E. R. DURBAN\" Schiffahrtsgesellschaft mbH\nGesellschaft mit beschränkter Haftung\nHamburg\n\nAls nicht eingetragen wird bekannt gemacht:\nDen Gläubigern der an der Verschmelzung beteiligten Gesellschaften ist, wenn sie binnen sechs Monaten nach dem Tag, an dem die Eintragung der Verschmelzung in das Register des Sitzes desjenigen Rechtsträgers, dessen Gläubiger sie sind, nach § 19 Absatz 3 UmwG als bekannt gemacht gilt, ihren Anspruch nach Grund und Höhe schriftlich anmelden, Sicherheit zu leisten, soweit sie nicht Befriedigung verlangen können. Dieses Recht steht den Gläubigern jedoch nur zu, wenn sie glaubhaft machen, dass durch die Verschmelzung die Erfüllung ihrer Forderung gefährdet wird."
    },
    {
      "date": "2025-07-10",
      "id": "115331",
      "original_text": "Registerbekanntmachung nach dem Umwandlungsgesetz\nHamburg Amtsgericht Hamburg HRB 68151\nVerwaltung MS \"E. R. LÜBECK\" Schiffahrtsgesellschaft mbH – Hamburg",
      "type": "Registerbekanntmachung nach dem Umwandlungsgesetz",
      "state": "Hamburg",
      "amtsgericht": "Amtsgericht Hamburg",
      "registernummer": "HRB 68151",
      "registerart": "HRB",
      "company_name": "Verwaltung MS \"E. R. LÜBECK\" Schiffahrtsgesellschaft mbH",
      "company_seat": "Hamburg",
      "details": "10.07.2025 (Bekanntmachungsdatum)\n\nHamburg Amtsgericht Hamburg HRB 68151\nRegisterbekanntmachung nach dem Umwandlungsgesetz 10.07.2025 (Eintragungsdatum)\n\nVerwaltung MS \"E. R. LÜBECK\" Schiffahrtsgesellschaft mbH\nGesellschaft mit beschränkter Haftung\nHamburg\n\nAls nicht eingetragen wird bekannt gemacht:\nDen Gläubigern der an der Verschmelzung beteiligten Gesellschaften ist, wenn sie binnen sechs Monaten nach dem Tag, an dem die Eintragung der Verschmelzung in das Register des Sitzes desjenigen Rechtsträgers, dessen Gläubiger sie sind, nach § 19 Absatz 3 UmwG als bekannt gemacht gilt, ihren Anspruch nach Grund und Höhe schriftlich anmelden, Sicherheit zu leisten, soweit sie nicht Befriedigung verlangen können. Dieses Recht steht den Gläubigern jedoch nur zu, wenn sie glaubhaft machen, dass durch die Verschmelzung die Erfüllung ihrer Forderung gefährdet wird."
    },
    {
      "date": "2025-07-10",
      "id": "115332",
      "original_text": "Registerbekanntmachung nach dem Umwandlungsgesetz\nHamburg Amtsgericht Hamburg HRB 68143\nVerwaltung MS \"E. R. CAPE TOWN\" Schiffahrtsgesellschaft mbH – Hamburg",
      "type": "Registerbekanntmachung nach dem Umwandlungsgesetz",
      "state": "Hamburg",
      "amtsgericht": "Amtsgericht Hamburg",
      "registernummer": "HRB 68143",
      "registerart": "HRB",
      "company_name": "Verwaltung MS \"E. R. CAPE TOWN\" Schiffahrtsgesellschaft mbH",
      "company_seat": "Hamburg",
      "details": "10.07.2025 (Bekanntmachungsdatum)\n\nHamburg Amtsgericht Hamburg HRB 68143\nRegisterbekanntmachung nach dem Umwandlungsgesetz 10.07.2025 (Eintragungsdatum)\n\nVerwaltung MS \"E. R. CAPE TOWN\" Schiffahrtsgesellschaft mbH\nGesellschaft mit beschränkter Haftung\nHamburg\n\nAls nicht eingetragen wird bekannt gemacht:\nDen Gläubigern der an der Verschmelzung beteiligten Gesellschaften ist, wenn sie binnen sechs Monaten nach dem Tag, an dem die Eintragung der Verschmelzung in das Register des Sitzes desjenigen Rechtsträgers, dessen Gläubiger sie sind, nach § 19 Absatz 3 UmwG als bekannt gemacht gilt, ihren Anspruch nach Grund und Höhe schriftlich anmelden, Sicherheit zu leisten, soweit sie nicht Befriedigung verlangen können. Dieses Recht steht den Gläubigern jedoch nur zu, wenn sie glaubhaft machen, dass durch die Verschmelzung die Erfüllung ihrer Forderung gefährdet wird."
    },
    {
      "date": "2025-07-10",
      "id": "115333",
      "original_text": "Registerbekanntmachung nach dem Umwandlungsgesetz\nHamburg Amtsgericht Hamburg HRB 62920\nVerwaltung MS \"E.R.STRALSUND\" Schiffahrtsgesellschaft mbH – Hamburg",
      "type": "Registerbekanntmachung nach dem Umwandlungsgesetz",
      "state": "Hamburg",
      "amtsgericht": "Amtsgericht Hamburg",
      "registernummer": "HRB 62920",
      "registerart": "HRB",
      "company_name": "Verwaltung MS \"E.R.STRALSUND\" Schiffahrtsgesellschaft mbH",
      "company_seat": "Hamburg",
      "details": "10.07.2025 (Bekanntmachungsdatum)\n\nHamburg Amtsgericht Hamburg HRB 62920\nRegisterbekanntmachung nach dem Umwandlungsgesetz\n\nVerwaltung MS \"E.R.STRALSUND\" Schiffahrtsgesellschaft mbH\nGesellschaft mit beschränkter Haftung\nHamburg\n\nAls nicht eingetragen wird bekannt gemacht:\nDen Gläubigern der an der Verschmelzung beteiligten Gesellschaften ist, wenn sie binnen sechs Monaten nach dem Tag, an dem die Eintragung der Verschmelzung in das Register des Sitzes desjenigen Rechtsträgers, dessen Gläubiger sie sind, nach § 19 Absatz 3 UmwG als bekannt gemacht gilt, ihren Anspruch nach Grund und Höhe schriftlich anmelden, Sicherheit zu leisten, soweit sie nicht Befriedigung verlangen können. Dieses Recht steht den Gläubigern jedoch nur zu, wenn sie glaubhaft machen, dass durch die Verschmelzung die Erfüllung ihrer Forderung gefährdet wird."
    },
    {
      "date": "2025-07-10",
      "id": "115334",
      "original_text": "Registerbekanntmachung nach dem Umwandlungsgesetz\nHamburg Amtsgericht Hamburg HRB 62921\nVerwaltung NC ERB 2.000 TEU Schiffs GmbH – Hamburg",
      "type": "Registerbekanntmachung nach dem Umwandlungsgesetz",
      "state": "Hamburg",
      "amtsgericht": "Amtsgericht Hamburg",
      "registernummer": "HRB 62921",
      "registerart": "HRB",
      "company_name": "Verwaltung NC ERB 2.000 TEU Schiffs GmbH",
      "company_seat": "Hamburg",
      "details": "10.07.2025 (Bekanntmachungsdatum)\n\nHamburg Amtsgericht Hamburg HRB 62921\nRegisterbekanntmachung nach dem Umwandlungsgesetz 10.07.2025 (Eintragungsdatum)\n\nVerwaltung NC ERB 2.000 TEU Schiffs GmbH\nGesellschaft mit beschränkter Haftung\nHamburg\n\nAls nicht eingetragen wird bekannt gemacht:\nDen Gläubigern der an der Verschmelzung beteiligten Gesellschaften ist, wenn sie binnen sechs Monaten nach dem Tag, an dem die Eintragung der Verschmelzung in das Register des Sitzes desjenigen Rechtsträgers, dessen Gläubiger sie sind, nach § 19 Absatz 3 UmwG als bekannt gemacht gilt, ihren Anspruch nach Grund und Höhe schriftlich anmelden, Sicherheit zu leisten, soweit sie nicht Befriedigung verlangen können. Dieses Recht steht den Gläubigern jedoch nur zu, wenn sie glaubhaft machen, dass durch die Verschmelzung die Erfüllung ihrer Forderung gefährdet wird."
    },
    {
      "date": "2025-07-10",
      "id": "115335",
      "original_text": "Sonstige Registerbekanntmachung\nMecklenburg-Vorpommern Amtsgericht Rostock HRB 14425\nTourismus, Freizeit & Kultur GmbH Kühlungsborn – Kühlungsborn",
      "type": "Sonstige Registerbekanntmachung",
      "state": "Mecklenburg-Vorpommern",
      "amtsgericht": "Amtsgericht Rostock",
      "registernummer": "HRB 14425",
      "registerart": "HRB",
      "company_name": "Tourismus, Freizeit & Kultur GmbH Kühlungsborn",
      "company_seat": "Kühlungsborn",
      "details": "10.07.2025 (Bekanntmachungsdatum)\n\nMecklenburg-Vorpommern Amtsgericht Rostock HRB 14425\nSonstige Registerbekanntmachung\n\nTourismus, Freizeit & Kultur GmbH Kühlungsborn\nGesellschaft mit beschränkter Haftung\nKühlungsborn\n\nEine Liste der Mitglieder des Aufsichtsrats ist zum Handelsregister eingereicht worden."
    },
    {
      "date": "2025-07-10",
      "id": "115336",
      "original_text": "Registerbekanntmachung nach dem Umwandlungsgesetz\nBaden-Württemberg Amtsgericht Stuttgart HRB 766532\nICP Deutschland GmbH – Reutlingen",
      "type": "Registerbekanntmachung nach dem Umwandlungsgesetz",
      "state": "Baden-Württemberg",
      "amtsgericht": "Amtsgericht Stuttgart",
      "registernummer": "HRB 766532",
      "registerart": "HRB",
      "company_name": "ICP Deutschland GmbH",
      "company_seat": "Reutlingen",
      "details": "10.07.2025 (Bekanntmachungsdatum)\n\nBaden-Württemberg Amtsgericht Stuttgart HRB 766532\nRegisterbekanntmachung nach dem Umwandlungsgesetz 10.07.2025 (Eintragungsdatum)\n\nICP Deutschland GmbH\nGesellschaft mit beschränkter Haftung\nReutlingen\n\nDen Gläubigern der an der Verschmelzung beteiligten Rechtsträger ist, wenn sie binnen sechs Monaten nach dem Tag, an dem die Eintragung der Verschmelzung in das Register des Sitzes desjenigen Rechtsträgers, dessen Gläubiger sie sind, nach § 19 Abs. 3 UmwG als bekanntgemacht gilt, ihren Anspruch nach Grund und Höhe schriftlich anmelden, Sicherheit zu leisten, soweit sie nicht Befriedigung verlangen können. Dieses Recht steht den Gläubigern jedoch nur zu, wenn sie glaubhaft machen, dass durch die Verschmelzung die Erfüllung ihrer Forderung gefährdet wird."
    },
    {
      "date": "2025-07-10",
      "id": "115337",
      "original_text": "Registerbekanntmachung nach dem Umwandlungsgesetz\nBaden-Württemberg Amtsgericht Stuttgart HRB 781838\nThomas Kern Projekt GmbH – Reutlingen",
      "type": "Registerbekanntmachung nach dem Umwandlungsgesetz",
      "state": "Baden-Württemberg",
      "amtsgericht": "Amtsgericht Stuttgart",
      "registernummer": "HRB 781838",
      "registerart": "HRB",
      "company_name": "Thomas Kern Projekt GmbH",
      "company_seat": "Reutlingen",
      "details": "10.07.2025 (Bekanntmachungsdatum)\n\nBaden-Württemberg Amtsgericht Stuttgart HRB 781838\nRegisterbekanntmachung nach dem Umwandlungsgesetz 10.07.2025 (Eintragungsdatum)\n\nThomas Kern Projekt GmbH\nGesellschaft mit beschränkter Haftung\nReutlingen\n\nDen Gläubigern der an der Verschmelzung beteiligten Rechtsträger ist, wenn sie binnen sechs Monaten nach dem Tag, an dem die Eintragung der Verschmelzung in das Register des Sitzes desjenigen Rechtsträgers, dessen Gläubiger sie sind, nach § 19 Abs. 3 UmwG als bekanntgemacht gilt, ihren Anspruch nach Grund und Höhe schriftlich anmelden, Sicherheit zu leisten, soweit sie nicht Befriedigung verlangen können. Dieses Recht steht den Gläubigern jedoch nur zu, wenn sie glaubhaft machen, dass durch die Verschmelzung die Erfüllung ihrer Forderung gefährdet wird."
    },
    {
      "date": "2025-07-10",
      "id": "115338",
      "original_text": "Registerbekanntmachung nach dem Umwandlungsgesetz\nBrandenburg Amtsgericht Cottbus HRB 13294\nKrieger Handel SE – Schönefeld",
      "type": "Registerbekanntmachung nach dem Umwandlungsgesetz",
      "state": "Brandenburg",
      "amtsgericht": "Amtsgericht Cottbus",
      "registernummer": "HRB 13294",
      "registerart": "HRB",
      "company_name": "Krieger Handel SE",
      "company_seat": "Schönefeld",
      "details": "10.07.2025 (Bekanntmachungsdatum)\n\nBrandenburg Amtsgericht Cottbus HRB 13294\nRegisterbekanntmachung nach dem Umwandlungsgesetz 10.07.2025 (Eintragungsdatum)\n\nKrieger Handel SE\nEuropäische Aktiengesellschaft (SE)\nSchönefeld\n\nAls nicht eingetragen wird veröffentlicht:\nDen Gläubigern der an der Verschmelzung beteiligten Rechtsträger ist, wenn sie binnen sechs Monaten nach dem Tag, an dem die Eintragung der Verschmelzung in das Register des Sitzes desjenigen Rechtsträgers, dessen Gläubiger sie sind, als bekannt gemacht gilt, ihren Anspruch nach Grund und Höhe schriftlich anmelden, Sicherheit zu leisten, soweit sie nicht Befriedigung verlangen können. Dieses Recht steht den Gläubigern jedoch nur zu, wenn sie glaubhaft machen, dass durch die Verschmelzung die Erfüllung ihrer Forderung gefährdet wird"
    },
    {
      "date": "2025-07-10",
      "id": "115339",
      "original_text": "Registerbekanntmachung nach dem Umwandlungsgesetz\nBaden-Württemberg Amtsgericht Mannheim HRB 742734\nYOOD Concept GmbH – Pforzheim",
      "type": "Registerbekanntmachung nach dem Umwandlungsgesetz",
      "state": "Baden-Württemberg",
      "amtsgericht": "Amtsgericht Mannheim",
      "registernummer": "HRB 742734",
      "registerart": "HRB",
      "company_name": "YOOD Concept GmbH",
      "company_seat": "Pforzheim",
      "details": "10.07.2025 (Bekanntmachungsdatum)\n\nBaden-Württemberg Amtsgericht Mannheim HRB 742734\nRegisterbekanntmachung nach dem Umwandlungsgesetz 10.07.2025 (Eintragungsdatum)\n\nYOOD Concept GmbH\nGesellschaft mit beschränkter Haftung\nPforzheim\n\nDen Gläubigern der an der Verschmelzung beteiligten Rechtsträger ist, wenn sie binnen sechs Monaten nach dem Tag, an dem die Eintragung der Verschmelzung in das Register des Sitzes desjenigen Rechtsträgers, dessen Gläubiger sie sind, nach § 19 Abs. 3 UmwG als bekanntgemacht gilt, ihren Anspruch nach Grund und Höhe schriftlich anmelden, Sicherheit zu leisten, soweit sie nicht Befriedigung verlangen können. Dieses Recht steht den Gläubigern jedoch nur zu, wenn sie glaubhaft machen, dass durch die Verschmelzung die Erfüllung ihrer Forderung gefährdet wird."
    },
    {
      "date": "2025-07-10",
      "id": "115340",
      "original_text": "Registerbekanntmachung nach dem Umwandlungsgesetz\nBrandenburg Amtsgericht Cottbus HRB 12107\nSconto Europa GmbH – Schönefeld",
      "type": "Registerbekanntmachung nach dem Umwandlungsgesetz",
      "state": "Brandenburg",
      "amtsgericht": "Amtsgericht Cottbus",
      "registernummer": "HRB 12107",
      "registerart": "HRB",
      "company_name": "Sconto Europa GmbH",
      "company_seat": "Schönefeld",
      "details": "10.07.2025 (Bekanntmachungsdatum)\n\nBrandenburg Amtsgericht Cottbus HRB 12107\nRegisterbekanntmachung nach dem Umwandlungsgesetz 10.07.2025 (Eintragungsdatum)\n\nSconto Europa GmbH\nGesellschaft mit beschränkter Haftung\nSchönefeld\n\nAls nicht eingetragen wird veröffentlicht:\nDen Gläubigern der an der Verschmelzung beteiligten Rechtsträger ist, wenn sie binnen sechs Monaten nach dem Tag, an dem die Eintragung der Verschmelzung in das Register des Sitzes desjenigen Rechtsträgers, dessen Gläubiger sie sind, als bekannt gemacht gilt, ihren Anspruch nach Grund und Höhe schriftlich anmelden, Sicherheit zu leisten, soweit sie nicht Befriedigung verlangen können. Dieses Recht steht den Gläubigern jedoch nur zu, wenn sie glaubhaft machen, dass durch die Verschmelzung die Erfüllung ihrer Forderung gefährdet wird"
    },
    {
      "date": "2025-07-10",
      "id": "115341",
      "original_text": "Registerbekanntmachung nach dem Umwandlungsgesetz\nSchleswig-Holstein Amtsgericht Kiel HRA 12549\nPeter Kowalski Malereibetrieb Inh. Sabine Kowalski e. K. – Mielkendorf",
      "type": "Registerbekanntmachung nach dem Umwandlungsgesetz",
      "state": "Schleswig-Holstein",
      "amtsgericht": "Amtsgericht Kiel",
      "registernummer": "HRA 12549",
      "registerart": "HRA",
      "company_name": "Peter Kowalski Malereibetrieb Inh. Sabine Kowalski e. K.",
      "company_seat": "Mielkendorf",
      "details": "10.07.2025 (Bekanntmachungsdatum)\n\nSchleswig-Holstein Amtsgericht Kiel HRA 12549\nRegisterbekanntmachung nach dem Umwandlungsgesetz 10.07.2025 (Eintragungsdatum)\n\nPeter Kowalski Malereibetrieb Inh. Sabine Kowalski e. K.\nEinzelkaufmann / Einzelkauffrau\nMielkendorf\n\nZu Eintragungsnummer 2 vom 10.07.2025 wird als nicht eingetragen veröffentlicht: Den Gläubigern ist, wenn sie binnen sechs Monaten nach dem Tag, an dem die Eintragung der Umwandlung bekannt gemacht worden ist, ihren Anspruch nach Grund und Höhe schriftlich anmelden, Sicherheit zu leisten, soweit sie nicht Befriedigung verlangen können. Dieses Recht steht den Gläubigern jedoch nur zu, wenn sie glaubhaft machen, dass durch die Umwandlung die Erfüllung ihrer Forderung gefährdet wird."
    },
    {
      "date": "2025-07-10",
      "id": "115342",
      "original_text": "Löschungsankündigung\nBaden-Württemberg Amtsgericht Stuttgart HRB 763959\nKA & GR Automation UG (haftungsbeschränkt) – Hildrizhausen",
      "type": "Löschungsankündigung",
      "state": "Baden-Württemberg",
      "amtsgericht": "Amtsgericht Stuttgart",
      "registernummer": "HRB 763959",
      "registerart": "HRB",
      "company_name": "KA & GR Automation UG (haftungsbeschränkt)",
      "company_seat": "Hildrizhausen",
      "details": "10.07.2025 (Bekanntmachungsdatum)\n\nBaden-Württemberg Amtsgericht Stuttgart HRB 763959\nLöschungsankündigung\n\nKA & GR Automation UG (haftungsbeschränkt)\nGesellschaft mit beschränkter Haftung\nHildrizhausen\n\nAls nicht eingetragen wird bekanntgemacht:\nDas Gericht beabsichtigt, die Gesellschaft wegen Vermögenslosigkeit im Handelsregister von Amts wegen nach § 394 FamFG zu löschen. Die Frist zur Geltendmachung eines Widerspruchs gegen die beabsichtigte Löschung ist auf zwei Monate ab Veröffentlichung bestimmt."
    },
    {
      "date": "2025-07-10",
      "id": "115343",
      "original_text": "Registerbekanntmachung nach dem Umwandlungsgesetz\nBaden-Württemberg Amtsgericht Mannheim HRB 740665\nHTH Logistic GmbH – Heddesheim",
      "type": "Registerbekanntmachung nach dem Umwandlungsgesetz",
      "state": "Baden-Württemberg",
      "amtsgericht": "Amtsgericht Mannheim",
      "registernummer": "HRB 740665",
      "registerart": "HRB",
      "company_name": "HTH Logistic GmbH",
      "company_seat": "Heddesheim",
      "details": "10.07.2025 (Bekanntmachungsdatum)\n\nBaden-Württemberg Amtsgericht Mannheim HRB 740665\nRegisterbekanntmachung nach dem Umwandlungsgesetz 10.07.2025 (Eintragungsdatum)\n\nHTH Logistic GmbH\nGesellschaft mit beschränkter Haftung\nHeddesheim\n\nDen Gläubigern der an der Verschmelzung beteiligten Rechtsträger ist, wenn sie binnen sechs Monaten nach dem Tag, an dem die Eintragung der Verschmelzung in das Register des Sitzes desjenigen Rechtsträgers, dessen Gläubiger sie sind, nach § 19 Abs. 3 UmwG als bekanntgemacht gilt, ihren Anspruch nach Grund und Höhe schriftlich anmelden, Sicherheit zu leisten, soweit sie nicht Befriedigung verlangen können. Dieses Recht steht den Gläubigern jedoch nur zu, wenn sie glaubhaft machen, dass durch die Verschmelzung die Erfüllung ihrer Forderung gefährdet wird."
    },
    {
      "date": "2025-07-10",
      "id": "115344",
      "original_text": "Einreichung neuer Dokumente\nBaden-Württemberg Amtsgericht Freiburg HRB 3997\nTreuBau Freiburg Aktiengesellschaft – Freiburg im Breisgau",
      "type": "Einreichung neuer Dokumente",
      "state": "Baden-Württemberg",
      "amtsgericht": "Amtsgericht Freiburg",
      "registernummer": "HRB 3997",
      "registerart": "HRB",
      "company_name": "TreuBau Freiburg Aktiengesellschaft",
      "company_seat": "Freiburg im Breisgau",
      "details": "10.07.2025 (Bekanntmachungsdatum)\n\nBaden-Württemberg Amtsgericht Freiburg HRB 3997\nEinreichung neuer Dokumente 10.07.2025 (Eintragungsdatum)\n\nTreuBau Freiburg Aktiengesellschaft\nAktiengesellschaft\nFreiburg im Breisgau\n\nAls nicht eingetragen wird bekanntgemacht:\nDie Gesellschaft hat am 09.07.2025 die Liste über die Zusammensetzung des Aufsichtsrats zum Handelsregister eingereicht."
    },
    {
      "date": "2025-07-10",
      "id": "115345",
      "original_text": "Registerbekanntmachung nach dem Umwandlungsgesetz\nBaden-Württemberg Amtsgericht Stuttgart HRB 2666\nNadella GmbH – Nufringen",
      "type": "Registerbekanntmachung nach dem Umwandlungsgesetz",
      "state": "Baden-Württemberg",
      "amtsgericht": "Amtsgericht Stuttgart",
      "registernummer": "HRB 2666",
      "registerart": "HRB",
      "company_name": "Nadella GmbH",
      "company_seat": "Nufringen",
      "details": "10.07.2025 (Bekanntmachungsdatum)\n\nBaden-Württemberg Amtsgericht Stuttgart HRB 2666\nRegisterbekanntmachung nach dem Umwandlungsgesetz 10.07.2025 (Eintragungsdatum)\n\nNadella GmbH\nGesellschaft mit beschränkter Haftung\nNufringen\n\nAls nicht eingetragen wird bekanntgemacht:\nDen Gläubigern der an der Verschmelzung beteiligten Rechtsträger ist, wenn sie binnen sechs Monaten nach dem Tag, an dem die Eintragung der Verschmelzung in das Register des Sitzes desjenigen Rechtsträgers, dessen Gläubiger sie sind, nach § 19 Abs. 3 UmwG als bekanntgemacht gilt, ihren Anspruch nach Grund und Höhe schriftlich anmelden, Sicherheit zu leisten, soweit sie nicht Befriedigung verlangen können. Dieses Recht steht den Gläubigern jedoch nur zu, wenn sie glaubhaft machen, dass durch die Verschmelzung die Erfüllung ihrer Forderung gefährdet wird."
    },
    {
      "date": "2025-07-10",
      "id": "115346",
      "original_text": "Registerbekanntmachung nach dem Umwandlungsgesetz\nBaden-Württemberg Amtsgericht Stuttgart HRB 390522\nRB Bechtle Verwaltungs-GmbH – Rottenburg am Neckar",
      "type": "Registerbekanntmachung nach dem Umwandlungsgesetz",
      "state": "Baden-Württemberg",
      "amtsgericht": "Amtsgericht Stuttgart",
      "registernummer": "HRB 390522",
      "registerart": "HRB",
      "company_name": "RB Bechtle Verwaltungs-GmbH",
      "company_seat": "Rottenburg am Neckar",
      "details": "10.07.2025 (Bekanntmachungsdatum)\n\nBaden-Württemberg Amtsgericht Stuttgart HRB 390522\nRegisterbekanntmachung nach dem Umwandlungsgesetz 10.07.2025 (Eintragungsdatum)\n\nRB Bechtle Verwaltungs-GmbH\nGesellschaft mit beschränkter Haftung\nRottenburg am Neckar\n\nAls nicht eingetragen wird bekanntgemacht:\nDen Gläubigern der an der Verschmelzung beteiligten Rechtsträger ist, wenn sie binnen sechs Monaten nach dem Tag, an dem die Eintragung der Verschmelzung in das Register des Sitzes desjenigen Rechtsträgers, dessen Gläubiger sie sind, nach § 19 Abs. 3 UmwG als bekanntgemacht gilt, ihren Anspruch nach Grund und Höhe schriftlich anmelden, Sicherheit zu leisten, soweit sie nicht Befriedigung verlangen können. Dieses Recht steht den Gläubigern jedoch nur zu, wenn sie glaubhaft machen, dass durch die Verschmelzung die Erfüllung ihrer Forderung gefährdet wird."
    },
    {
      "date": "2025-07-10",
      "id": "115347",
      "original_text": "Registerbekanntmachung nach dem Umwandlungsgesetz\nSachsen Amtsgericht Leipzig HRB 41760\nPREQTEC Advisory GmbH – Leipzig",
      "type": "Registerbekanntmachung nach dem Umwandlungsgesetz",
      "state": "Sachsen",
      "amtsgericht": "Amtsgericht Leipzig",
      "registernummer": "HRB 41760",
      "registerart": "HRB",
      "company_name": "PREQTEC Advisory GmbH",
      "company_seat": "Leipzig",
      "details": "10.07.2025 (Bekanntmachungsdatum)\n\nSachsen Amtsgericht Leipzig HRB 41760\nRegisterbekanntmachung nach dem Umwandlungsgesetz 10.07.2025 (Eintragungsdatum)\n\nPREQTEC Advisory GmbH\nGesellschaft mit beschränkter Haftung\nLeipzig\n\nDen Gläubigern der an der Verschmelzung beteiligten Rechtsträger ist, wenn sie binnen sechs Monaten nach dem Tag, an dem die Eintragung der Verschmelzung in das Register des Sitzes desjenigen Rechtsträgers, dessen Gläubiger sie sind, nach § 19 Abs. 3 UmwG als bekannt gemacht gilt, ihren Anspruch nach Grund und Höhe in Textform anmelden, Sicherheit zu leisten, soweit sie nicht Befriedigung verlangen können. Dieses Recht steht den Gläubigern jedoch nur zu, wenn sie glaubhaft machen, dass durch die Verschmelzung die Erfüllung der Forderung gefährdet wird."
    },
    {
      "date": "2025-07-10",
      "id": "115348",
      "original_text": "Registerbekanntmachung nach dem Umwandlungsgesetz\nSachsen Amtsgericht Dresden HRB 6024\nLEHNERT BAU Bauträger GmbH – Dresden",
      "type": "Registerbekanntmachung nach dem Umwandlungsgesetz",
      "state": "Sachsen",
      "amtsgericht": "Amtsgericht Dresden",
      "registernummer": "HRB 6024",
      "registerart": "HRB",
      "company_name": "LEHNERT BAU Bauträger GmbH",
      "company_seat": "Dresden",
      "details": "10.07.2025 (Bekanntmachungsdatum)\n\nSachsen Amtsgericht Dresden HRB 6024\nRegisterbekanntmachung nach dem Umwandlungsgesetz 10.07.2025 (Eintragungsdatum)\n\nLEHNERT BAU  Bauträger GmbH\nGesellschaft mit beschränkter Haftung\nDresden\n\nDen Gläubigern der an der Verschmelzung beteiligten Rechtsträger ist, wenn sie binnen sechs Monaten nach dem Tag, an dem die Eintragung der Verschmelzung in das Register des Sitzes desjenigen Rechtsträgers, dessen Gläubiger sie sind, nach § 19 Abs. 3 UmwG als bekannt gemacht gilt, ihren Anspruch nach Grund und Höhe in Textform anmelden, Sicherheit zu leisten, soweit sie nicht Befriedigung verlangen können. Dieses Recht steht den Gläubigern jedoch nur zu, wenn sie glaubhaft machen, dass durch die Verschmelzung die Erfüllung der Forderung gefährdet wird."
    },
    {
      "date": "2025-07-10",
      "id": "115349",
      "original_text": "Löschungsankündigung\nSachsen Amtsgericht Dresden HRB 38627\nSergo Bau UG (haftungsbeschränkt) – Radeberg",
      "type": "Löschungsankündigung",
      "state": "Sachsen",
      "amtsgericht": "Amtsgericht Dresden",
      "registernummer": "HRB 38627",
      "registerart": "HRB",
      "company_name": "Sergo Bau UG (haftungsbeschränkt)",
      "company_seat": "Radeberg",
      "details": "10.07.2025 (Bekanntmachungsdatum)\n\nSachsen Amtsgericht Dresden HRB 38627\nLöschungsankündigung\n\nSergo Bau UG (haftungsbeschränkt)\nGesellschaft mit beschränkter Haftung\nRadeberg\n\nDas Registergericht beabsichtigt, die im Handelsregister eingetragene Gesellschaft von Amts wegen nach § 394 FamFG zu löschen. Die Frist zu Erhebung eines Widerspruchs gegen die beabsichtigte Löschung wird auf einen Monat festgesetzt."
    },
    {
      "date": "2025-07-10",
      "id": "115350",
      "original_text": "Registerbekanntmachung nach dem Umwandlungsgesetz\nSachsen Amtsgericht Leipzig HRB 41628\nPREQTEC GmbH – Leipzig",
      "type": "Registerbekanntmachung nach dem Umwandlungsgesetz",
      "state": "Sachsen",
      "amtsgericht": "Amtsgericht Leipzig",
      "registernummer": "HRB 41628",
      "registerart": "HRB",
      "company_name": "PREQTEC GmbH",
      "company_seat": "Leipzig",
      "details": "10.07.2025 (Bekanntmachungsdatum)\n\nSachsen Amtsgericht Leipzig HRB 41628\nRegisterbekanntmachung nach dem Umwandlungsgesetz 10.07.2025 (Eintragungsdatum)\n\nPREQTEC GmbH\nGesellschaft mit beschränkter Haftung\nLeipzig\n\nDen Gläubigern der an der Verschmelzung beteiligten Rechtsträger ist, wenn sie binnen sechs Monaten nach dem Tag, an dem die Eintragung der Verschmelzung in das Register des Sitzes desjenigen Rechtsträgers, dessen Gläubiger sie sind, nach § 19 Abs. 3 UmwG als bekannt gemacht gilt, ihren Anspruch nach Grund und Höhe in Textform anmelden, Sicherheit zu leisten, soweit sie nicht Befriedigung verlangen können. Dieses Recht steht den Gläubigern jedoch nur zu, wenn sie glaubhaft machen, dass durch die Verschmelzung die Erfüllung der Forderung gefährdet wird."
    },
    {
      "date": "2025-07-10",
      "id": "115351",
      "original_text": "Registerbekanntmachung nach dem Umwandlungsgesetz\nSachsen Amtsgericht Leipzig HRB 37559\nColditzer Stadt, Land, Schloss gGmbH – Colditz",
      "type": "Registerbekanntmachung nach dem Umwandlungsgesetz",
      "state": "Sachsen",
      "amtsgericht": "Amtsgericht Leipzig",
      "registernummer": "HRB 37559",
      "registerart": "HRB",
      "company_name": "Colditzer Stadt, Land, Schloss gGmbH",
      "company_seat": "Colditz",
      "details": "10.07.2025 (Bekanntmachungsdatum)\n\nSachsen Amtsgericht Leipzig HRB 37559\nRegisterbekanntmachung nach dem Umwandlungsgesetz 10.07.2025 (Eintragungsdatum)\n\nColditzer Stadt, Land, Schloss gGmbH\nGesellschaft mit beschränkter Haftung\nColditz\n\nDen Gläubigern der an der Spaltung beteiligten Rechtsträger ist, wenn sie binnen sechs Monaten nach dem Tag, an dem die Eintragung der Spaltung in das Register des Sitzes desjenigen Rechtsträgers, dessen Gläubiger sie sind, nach § 19 Abs. 3 UmwG als bekannt gemacht gilt, ihren Anspruch nach Grund und Höhe in Textform anmelden, Sicherheit zu leisten, soweit sie nicht Befriedigung verlangen können. Dieses Recht steht den Gläubigern jedoch nur zu, wenn sie glaubhaft machen, dass durch die Spaltung die Erfüllung der Forderung gefährdet wird."
    },
    {
      "date": "2025-07-10",
      "id": "115352",
      "original_text": "Registerbekanntmachung nach dem Umwandlungsgesetz\nSachsen Amtsgericht Leipzig VR 20897\nLändliches Leben e.V. – Colditz OT Hausdorf",
      "type": "Registerbekanntmachung nach dem Umwandlungsgesetz",
      "state": "Sachsen",
      "amtsgericht": "Amtsgericht Leipzig",
      "registernummer": "VR 20897",
      "registerart": "VR",
      "company_name": "Ländliches Leben e.V.",
      "company_seat": "Colditz OT Hausdorf",
      "details": "10.07.2025 (Bekanntmachungsdatum)\n\nSachsen Amtsgericht Leipzig VR 20897\nRegisterbekanntmachung nach dem Umwandlungsgesetz 10.07.2025 (Eintragungsdatum)\n\nLändliches Leben e.V.\neingetragener Verein\nColditz OT Hausdorf\n\nDen Gläubigern der an der Spaltung beteiligten Rechtsträger ist, wenn sie binnen sechs Monaten nach dem Tag, an dem die Eintragung der Spaltung in das Register des Sitzes desjenigen Rechtsträgers, dessen Gläubiger sie sind, nach § 19 Abs. 3 UmwG als bekannt gemacht gilt, ihren Anspruch nach Grund und Höhe in Textform anmelden, Sicherheit zu leisten, soweit sie nicht Befriedigung verlangen können. Dieses Recht steht den Gläubigern jedoch nur zu, wenn sie glaubhaft machen, dass durch die Spaltung die Erfüllung der Forderung gefährdet wird."
    },
    {
      "date": "2025-07-10",
      "id": "115353",
      "original_text": "Registerbekanntmachung nach dem Umwandlungsgesetz\nSachsen Amtsgericht Dresden HRB 35207\nLEHNERT BAU Dienstleistungs GmbH – Dresden",
      "type": "Registerbekanntmachung nach dem Umwandlungsgesetz",
      "state": "Sachsen",
      "amtsgericht": "Amtsgericht Dresden",
      "registernummer": "HRB 35207",
      "registerart": "HRB",
      "company_name": "LEHNERT BAU Dienstleistungs GmbH",
      "company_seat": "Dresden",
      "details": "10.07.2025 (Bekanntmachungsdatum)\n\nSachsen Amtsgericht Dresden HRB 35207\nRegisterbekanntmachung nach dem Umwandlungsgesetz 10.07.2025 (Eintragungsdatum)\n\nLEHNERT BAU Dienstleistungs GmbH\nGesellschaft mit beschränkter Haftung\nDresden\n\nDen Gläubigern der an der Verschmelzung beteiligten Rechtsträger ist, wenn sie binnen sechs Monaten nach dem Tag, an dem die Eintragung der Verschmelzung in das Register des Sitzes desjenigen Rechtsträgers, dessen Gläubiger sie sind, nach § 19 Abs. 3 UmwG als bekannt gemacht gilt, ihren Anspruch nach Grund und Höhe in Textform anmelden, Sicherheit zu leisten, soweit sie nicht Befriedigung verlangen können. Dieses Recht steht den Gläubigern jedoch nur zu, wenn sie glaubhaft machen, dass durch die Verschmelzung die Erfüllung der Forderung gefährdet wird."
    },
    {
      "date": "2025-07-10",
      "id": "115354",
      "original_text": "Registerbekanntmachung nach dem Umwandlungsgesetz\nNiedersachsen Amtsgericht Hannover HRB 203425\nLindschulte Ingenieurgesellschaft mbH – Hannover",
      "type": "Registerbekanntmachung nach dem Umwandlungsgesetz",
      "state": "Niedersachsen",
      "amtsgericht": "Amtsgericht Hannover",
      "registernummer": "HRB 203425",
      "registerart": "HRB",
      "company_name": "Lindschulte Ingenieurgesellschaft mbH",
      "company_seat": "Hannover",
      "details": "10.07.2025 (Bekanntmachungsdatum)\n\nNiedersachsen Amtsgericht Hannover HRB 203425\nRegisterbekanntmachung nach dem Umwandlungsgesetz 10.07.2025 (Eintragungsdatum)\n\nLindschulte Ingenieurgesellschaft mbH\nGesellschaft mit beschränkter Haftung\nHannover\n\nDen Gläubigern der an der Verschmelzung beteiligten Rechtsträger ist, wenn sie binnen sechs Monaten nach dem Tag, an dem die Eintragung der Verschmelzung in das Register des Sitzes desjenigen Rechtsträgers, dessen Gläubiger sie sind, nach § 19  Abs.  3 UmwG als bekannt gemacht gilt, ihren Anspruch nach Grund und Höhe schriftlich anmelden, Sicherheit zu leisten, soweit sie nicht Befriedigung verlangen können. Dieses Recht steht den Gläubigern jedoch nur zu, wenn sie glaubhaft machen, dass durch die Verschmelzung die Erfüllung der Forderung gefährdet wird."
    },
    {
      "date": "2025-07-10",
      "id": "115355",
      "original_text": "Löschungsankündigung\nNiedersachsen Amtsgericht Oldenburg (Oldenburg) HRA 203358\nOstendorf Ferkelproduktion GmbH & Co. KG – Garrel",
      "type": "Löschungsankündigung",
      "state": "Niedersachsen",
      "amtsgericht": "Amtsgericht Oldenburg (Oldenburg)",
      "registernummer": "HRA 203358",
      "registerart": "HRA",
      "company_name": "Ostendorf Ferkelproduktion GmbH & Co. KG",
      "company_seat": "Garrel",
      "details": "10.07.2025 (Bekanntmachungsdatum)\n\nNiedersachsen Amtsgericht Oldenburg (Oldenburg) HRA 203358\nLöschungsankündigung\n\nOstendorf Ferkelproduktion GmbH & Co. KG\nKommanditgesellschaft\nGarrel\n\nDas Registergericht beabsichtigt, die Firma von Amts wegen nach § 394 FamFG zu löschen. Die Frist zur Erhebung eines Widerspruchs ist auf 1 Monat ab dieser Registerbekanntmachung festgesetzt."
    },
    {
      "date": "2025-07-10",
      "id": "115356",
      "original_text": "Löschungsankündigung\nNiedersachsen Amtsgericht Göttingen HRB 205517\nMASAM Hausmeisterservice GmbH – Bovenden",
      "type": "Löschungsankündigung",
      "state": "Niedersachsen",
      "amtsgericht": "Amtsgericht Göttingen",
      "registernummer": "HRB 205517",
      "registerart": "HRB",
      "company_name": "MASAM Hausmeisterservice GmbH",
      "company_seat": "Bovenden",
      "details": "10.07.2025 (Bekanntmachungsdatum)\n\nNiedersachsen Amtsgericht Göttingen HRB 205517\nLöschungsankündigung\n\nMASAM Hausmeisterservice GmbH\nGesellschaft mit beschränkter Haftung\nBovenden\n\nEs ist beabsichtigt die Gesellschaft von Amts wegen zu löschen, § 394 FamFG. Es wird Gelegenheit gegeben binnen 1 Monats Widerspruch gegen die beabsichtigte Löschung zu erheben."
    },
    {
      "date": "2025-07-10",
      "id": "115357",
      "original_text": "Registerbekanntmachung nach dem Umwandlungsgesetz\nNiedersachsen Amtsgericht Hannover HRB 223245\nECB Holding GmbH – Pattensen",
      "type": "Registerbekanntmachung nach dem Umwandlungsgesetz",
      "state": "Niedersachsen",
      "amtsgericht": "Amtsgericht Hannover",
      "registernummer": "HRB 223245",
      "registerart": "HRB",
      "company_name": "ECB Holding GmbH",
      "company_seat": "Pattensen",
      "details": "10.07.2025 (Bekanntmachungsdatum)\n\nNiedersachsen Amtsgericht Hannover HRB 223245\nRegisterbekanntmachung nach dem Umwandlungsgesetz 10.07.2025 (Eintragungsdatum)\n\nECB Holding GmbH\nGesellschaft mit beschränkter Haftung\nPattensen\n\nDen Gläubigern der an der Ausgliederung beteiligten Rechtsträger ist, wenn sie binnen sechs Monaten nach dem Tag, an dem die Eintragung der Spaltung in das Register des Sitzes desjenigen Rechtsträgers, dessen Gläubiger sie sind, nach § 19 Abs. 3 UmwG als bekannt gemacht gilt, ihren Anspruch nach Grund und Höhe schriftlich anmelden, Sicherheit zu leisten, soweit sie nicht Befriedigung verlangen können. Dieses Recht steht den Gläubigern jedoch nur zu, wenn sie glaubhaft machen, dass durch die Ausgliederung die Erfüllung der Forderung gefährdet wird."
    },
    {
      "date": "2025-07-10",
      "id": "115358",
      "original_text": "Löschungsankündigung\nNiedersachsen Amtsgericht Hannover HRB 216708\nConcept-Neubauprojekte u. Immobilien H & S GmbH – Hannover",
      "type": "Löschungsankündigung",
      "state": "Niedersachsen",
      "amtsgericht": "Amtsgericht Hannover",
      "registernummer": "HRB 216708",
      "registerart": "HRB",
      "company_name": "Concept-Neubauprojekte u. Immobilien H & S GmbH",
      "company_seat": "Hannover",
      "details": "10.07.2025 (Bekanntmachungsdatum)\n\nNiedersachsen Amtsgericht Hannover HRB 216708\nLöschungsankündigung 07.05.2025 (Eintragungsdatum)\n\nConcept-Neubauprojekte u. Immobilien H & S GmbH\nGesellschaft mit beschränkter Haftung\nHannover\n\nDas Registergericht beabsichtigt, die Gesellschaft von Amts wegen nach § 394  Abs. 1 FamFG zu löschen. Die Frist zur Erhebung eines Widerspruchs ist auf 1 Monat ab dieser Registerbekanntmachung festgesetzt."
    },
    {
      "date": "2025-07-10",
      "id": "115359",
      "original_text": "Registerbekanntmachung nach dem Umwandlungsgesetz\nNiedersachsen Amtsgericht Walsrode HRB 210976\nAdron GmbH – Ottersberg",
      "type": "Registerbekanntmachung nach dem Umwandlungsgesetz",
      "state": "Niedersachsen",
      "amtsgericht": "Amtsgericht Walsrode",
      "registernummer": "HRB 210976",
      "registerart": "HRB",
      "company_name": "Adron GmbH",
      "company_seat": "Ottersberg",
      "details": "10.07.2025 (Bekanntmachungsdatum)\n\nNiedersachsen Amtsgericht Walsrode HRB 210976\nRegisterbekanntmachung nach dem Umwandlungsgesetz 10.07.2025 (Eintragungsdatum)\n\nAdron GmbH\nGesellschaft mit beschränkter Haftung\nOttersberg\n\nDen Gläubigern der an der Verschmelzung beteiligten Rechtsträger ist, wenn sie binnen sechs Monaten nach dem Tag, an dem die Eintragung der Verschmelzung in das Register des Sitzes desjenigen Rechtsträgers, dessen Gläubiger sie sind, nach § 19  Abs.  3 UmwG als bekannt gemacht gilt, ihren Anspruch nach Grund und Höhe schriftlich anmelden, Sicherheit zu leisten, soweit sie nicht Befriedigung verlangen können. Dieses Recht steht den Gläubigern jedoch nur zu, wenn sie glaubhaft machen, dass durch die Verschmelzung die Erfüllung der Forderung gefährdet wird."
    },
    {
      "date": "2025-07-10",
      "id": "115360",
      "original_text": "Löschungsankündigung\nNiedersachsen Amtsgericht Hannover HRB 217904\nRad-Pol GmbH – Wedemark",
      "type": "Löschungsankündigung",
      "state": "Niedersachsen",
      "amtsgericht": "Amtsgericht Hannover",
      "registernummer": "HRB 217904",
      "registerart": "HRB",
      "company_name": "Rad-Pol GmbH",
      "company_seat": "Wedemark",
      "details": "10.07.2025 (Bekanntmachungsdatum)\n\nNiedersachsen Amtsgericht Hannover HRB 217904\nLöschungsankündigung 09.07.2025 (Eintragungsdatum)\n\nRad-Pol GmbH\nGesellschaft mit beschränkter Haftung\nWedemark\n\nDas Registergericht beabsichtigt, die Gesellschaft von Amts wegen nach § 394 FamFG zu löschen. Die Frist zur Erhebung eines Widerspruchs ist auf 1 Monat ab dieser Registerbekanntmachung festgesetzt."
    },
    {
      "date": "2025-07-10",
      "id": "115361",
      "original_text": "Registerbekanntmachung nach dem Umwandlungsgesetz\nNiedersachsen Amtsgericht Braunschweig HRB 203271\nNeuerkeröder Wohnen und Betreuen GmbH – Sickte",
      "type": "Registerbekanntmachung nach dem Umwandlungsgesetz",
      "state": "Niedersachsen",
      "amtsgericht": "Amtsgericht Braunschweig",
      "registernummer": "HRB 203271",
      "registerart": "HRB",
      "company_name": "Neuerkeröder Wohnen und Betreuen GmbH",
      "company_seat": "Sickte",
      "details": "10.07.2025 (Bekanntmachungsdatum)\n\nNiedersachsen Amtsgericht Braunschweig HRB 203271\nRegisterbekanntmachung nach dem Umwandlungsgesetz 10.07.2025 (Eintragungsdatum)\n\nNeuerkeröder Wohnen und Betreuen GmbH\nGesellschaft mit beschränkter Haftung\nSickte\n\nDen Gläubigern der an der Abspaltung beteiligten Rechtsträger ist, wenn sie binnen sechs Monaten nach dem Tag, an dem die Eintragung der Abspaltung in das Register des Sitzes desjenigen Rechtsträgers, dessen Gläubiger sie sind, nach § 19 Abs. 3 UmwG als bekannt gemacht gilt, ihren Anspruch nach Grund und Höhe schriftlich anmelden, Sicherheit zu leisten, soweit sie nicht Befriedigung verlangen können. Dieses Recht steht den Gläubigern jedoch nur zu, wenn sie glaubhaft machen, dass durch die Abspaltung die Erfüllung der Forderung gefährdet wird."
    },
    {
      "date": "2025-07-10",
      "id": "115362",
      "original_text": "Registerbekanntmachung nach dem Umwandlungsgesetz\nNiedersachsen Amtsgericht Braunschweig HRB 209720\nBau Company HAUKA GmbH – Braunschweig",
      "type": "Registerbekanntmachung nach dem Umwandlungsgesetz",
      "state": "Niedersachsen",
      "amtsgericht": "Amtsgericht Braunschweig",
      "registernummer": "HRB 209720",
      "registerart": "HRB",
      "company_name": "Bau Company HAUKA GmbH",
      "company_seat": "Braunschweig",
      "details": "10.07.2025 (Bekanntmachungsdatum)\n\nNiedersachsen Amtsgericht Braunschweig HRB 209720\nRegisterbekanntmachung nach dem Umwandlungsgesetz 10.07.2025 (Eintragungsdatum)\n\nBau Company HAUKA GmbH\nGesellschaft mit beschränkter Haftung\nBraunschweig\n\nDen Gläubigern der an der Verschmelzung beteiligten Rechtsträger ist, wenn sie binnen sechs Monaten nach dem Tag, an dem die Eintragung der Verschmelzung in das Register des Sitzes desjenigen Rechtsträgers, dessen Gläubiger sie sind, nach § 19  Abs.  3 UmwG als bekannt gemacht gilt, ihren Anspruch nach Grund und Höhe schriftlich anmelden, Sicherheit zu leisten, soweit sie nicht Befriedigung verlangen können. Dieses Recht steht den Gläubigern jedoch nur zu, wenn sie glaubhaft machen, dass durch die Verschmelzung die Erfüllung der Forderung gefährdet wird."
    },
    {
      "date": "2025-07-10",
      "id": "115363",
      "original_text": "Registerbekanntmachung nach dem Umwandlungsgesetz\nNiedersachsen Amtsgericht Braunschweig HRB 202262\nMehrwerk gGmbH – Sickte/OT Neuerkerode",
      "type": "Registerbekanntmachung nach dem Umwandlungsgesetz",
      "state": "Niedersachsen",
      "amtsgericht": "Amtsgericht Braunschweig",
      "registernummer": "HRB 202262",
      "registerart": "HRB",
      "company_name": "Mehrwerk gGmbH",
      "company_seat": "Sickte/OT Neuerkerode",
      "details": "10.07.2025 (Bekanntmachungsdatum)\n\nNiedersachsen Amtsgericht Braunschweig HRB 202262\nRegisterbekanntmachung nach dem Umwandlungsgesetz 10.07.2025 (Eintragungsdatum)\n\nMehrwerk gGmbH\nGesellschaft mit beschränkter Haftung\nSickte/OT Neuerkerode\n\nDen Gläubigern der an der Abspaltung beteiligten Rechtsträger ist, wenn sie binnen sechs Monaten nach dem Tag, an dem die Eintragung der Abspaltung in das Register des Sitzes desjenigen Rechtsträgers, dessen Gläubiger sie sind, nach § 19 Abs. 3 UmwG als bekannt gemacht gilt, ihren Anspruch nach Grund und Höhe schriftlich anmelden, Sicherheit zu leisten, soweit sie nicht Befriedigung verlangen können. Dieses Recht steht den Gläubigern jedoch nur zu, wenn sie glaubhaft machen, dass durch die Abspaltung die Erfüllung der Forderung gefährdet wird."
    },
    {
      "date": "2025-07-10",
      "id": "115364",
      "original_text": "Registerbekanntmachung nach dem Umwandlungsgesetz\nNiedersachsen Amtsgericht Hannover HRB 229157\nInvestiere dich frei GmbH – Pattensen",
      "type": "Registerbekanntmachung nach dem Umwandlungsgesetz",
      "state": "Niedersachsen",
      "amtsgericht": "Amtsgericht Hannover",
      "registernummer": "HRB 229157",
      "registerart": "HRB",
      "company_name": "Investiere dich frei GmbH",
      "company_seat": "Pattensen",
      "details": "10.07.2025 (Bekanntmachungsdatum)\n\nNiedersachsen Amtsgericht Hannover HRB 229157\nRegisterbekanntmachung nach dem Umwandlungsgesetz 10.07.2025 (Eintragungsdatum)\n\nInvestiere dich frei GmbH\nGesellschaft mit beschränkter Haftung\nPattensen\n\nDen Gläubigern der an der Ausgliederung beteiligten Rechtsträger ist, wenn sie binnen sechs Monaten nach dem Tag, an dem die Eintragung der Ausgliederung in das Register des Sitzes desjenigen Rechtsträgers, dessen Gläubiger sie sind, nach § 19 Abs. 3 UmwG als bekannt gemacht gilt, ihren Anspruch nach Grund und Höhe schriftlich anmelden, Sicherheit zu leisten, soweit sie nicht Befriedigung verlangen können. Dieses Recht steht den Gläubigern jedoch nur zu, wenn sie glaubhaft machen, dass durch die Ausgliederung die Erfüllung der Forderung gefährdet wird."
    },
    {
      "date": "2025-07-10",
      "id": "115365",
      "original_text": "Löschungsankündigung\nRheinland-Pfalz Amtsgericht Koblenz HRA 497\nEulen Apotheke Inh. Issa Abudayyeh e.K. – Koblenz",
      "type": "Löschungsankündigung",
      "state": "Rheinland-Pfalz",
      "amtsgericht": "Amtsgericht Koblenz",
      "registernummer": "HRA 497",
      "registerart": "HRA",
      "company_name": "Eulen Apotheke Inh. Issa Abudayyeh e.K.",
      "company_seat": "Koblenz",
      "details": "10.07.2025 (Bekanntmachungsdatum)\n\nRheinland-Pfalz Amtsgericht Koblenz HRA 497\nLöschungsankündigung\n\nEulen Apotheke Inh. Issa Abudayyeh e.K.\nEinzelkaufmann / Einzelkauffrau\nKoblenz\n\nDas Registergericht beabsichtigt die Firma von Amts wegen nach § 31 Abs. 2 HGB, § 393 FamFG zu löschen. Die Frist zur Erhebung eines Widerspruchs ist auf  zwei Monate festgesetzt."
    },
    {
      "date": "2025-07-10",
      "id": "115366",
      "original_text": "Sonstige Registerbekanntmachung\nRheinland-Pfalz Amtsgericht Landau HRB 2985\nRH Objektbau GmbH – Kirrweiler (Pfalz)",
      "type": "Sonstige Registerbekanntmachung",
      "state": "Rheinland-Pfalz",
      "amtsgericht": "Amtsgericht Landau",
      "registernummer": "HRB 2985",
      "registerart": "HRB",
      "company_name": "RH Objektbau GmbH",
      "company_seat": "Kirrweiler (Pfalz)",
      "details": "10.07.2025 (Bekanntmachungsdatum)\n\nRheinland-Pfalz Amtsgericht Landau HRB 2985\nSonstige Registerbekanntmachung 10.07.2025 (Eintragungsdatum)\n\nRH Objektbau GmbH\nGesellschaft mit beschränkter Haftung\nKirrweiler (Pfalz)\n\nAls nicht eingetragen wird veröffentlicht: Den Gläubigern der Gesellschaft, deren Forderungen begründet worden sind, bevor die Eintragung der Beendigung des Beherrschungs- und Gewinnabführungsvertrages in das Handelsregister nach § 10 des Handelsgesetzbuches als bekanntgemacht gilt, hat der andere Vertragsteil Sicherheit zu leisten, wenn sie sich binnen sechs Monaten nach der Bekanntmachung der Eintragung zu diesem Zweck bei ihm melden."
    },
    {
      "date": "2025-07-10",
      "id": "115367",
      "original_text": "Löschungsankündigung\nRheinland-Pfalz Amtsgericht Montabaur HRB 26034\nRheinland Autoteile UG (haftungsbeschränkt) – Neuwied",
      "type": "Löschungsankündigung",
      "state": "Rheinland-Pfalz",
      "amtsgericht": "Amtsgericht Montabaur",
      "registernummer": "HRB 26034",
      "registerart": "HRB",
      "company_name": "Rheinland Autoteile UG (haftungsbeschränkt)",
      "company_seat": "Neuwied",
      "details": "10.07.2025 (Bekanntmachungsdatum)\n\nRheinland-Pfalz Amtsgericht Montabaur HRB 26034\nLöschungsankündigung\n\nRheinland Autoteile UG (haftungsbeschränkt)\nGesellschaft mit beschränkter Haftung\nNeuwied\n\nDas Registergericht beabsichtigt die Gesellschaft von Amts wegen nach § 394 FamFG zu löschen. Die Frist zur Erhebung eines Widerspruchs ist auf einen Monat festgesetzt."
    },
    {
      "date": "2025-07-10",
      "id": "115368",
      "original_text": "Registerbekanntmachung nach dem Umwandlungsgesetz\nBremen Amtsgericht Bremen VR 7434\nDrachenkinder e.V. – Bremen",
      "type": "Registerbekanntmachung nach dem Umwandlungsgesetz",
      "state": "Bremen",
      "amtsgericht": "Amtsgericht Bremen",
      "registernummer": "VR 7434",
      "registerart": "VR",
      "company_name": "Drachenkinder e.V.",
      "company_seat": "Bremen",
      "details": "10.07.2025 (Bekanntmachungsdatum)\n\nBremen Amtsgericht Bremen VR 7434\nRegisterbekanntmachung nach dem Umwandlungsgesetz 04.07.2025 (Eintragungsdatum)\n\nDrachenkinder e.V.\neingetragener Verein\nBremen\n\nZu Eintragungsnummer 7 vom 04.07.2025 wird als nicht eingetragen veröffentlicht:\nDen Gläubigern ist, wenn sie binnen sechs Monaten nach dem Tag, an dem die Eintragung der Umwandlung als bekannt gemacht gilt, ihren Anspruch nach Grund und Höhe schriftlich anmelden, Sicherheit zu leisten, soweit sie nicht Befriedigung verlangen können. Dieses Recht steht den Gläubigern jedoch nur zu, wenn sie glaubhaft machen, dass durch die Umwandlung die Erfüllung ihrer Forderung gefährdet wird. Das Recht, Sicherheitsleistung zu verlangen, steht Gläubigern nicht zu, die im Falle der Insolvenz ein Recht auf vorzugsweise Befriedigung aus einer Deckungsmasse haben, die nach gesetzlicher Vorschrift zu ihrem Schutz errichtet und staatlich überwacht ist."
    },
    {
      "date": "2025-07-10",
      "id": "115369",
      "original_text": "Registerbekanntmachung nach dem Umwandlungsgesetz\nBremen Amtsgericht Bremen HRB 41638\nDraki gGmbH – Bremen",
      "type": "Registerbekanntmachung nach dem Umwandlungsgesetz",
      "state": "Bremen",
      "amtsgericht": "Amtsgericht Bremen",
      "registernummer": "HRB 41638",
      "registerart": "HRB",
      "company_name": "Draki gGmbH",
      "company_seat": "Bremen",
      "details": "10.07.2025 (Bekanntmachungsdatum)\n\nBremen Amtsgericht Bremen HRB 41638\nRegisterbekanntmachung nach dem Umwandlungsgesetz 04.07.2025 (Eintragungsdatum)\n\nDraki gGmbH\nGesellschaft mit beschränkter Haftung\nBremen\n\nZu Eintragungsnummer 1 vom 04.07.2025 wird als nicht eingetragen veröffentlicht:\nDen Gläubigern ist, wenn sie binnen sechs Monaten nach dem Tag, an dem die Eintragung der Umwandlung als bekannt gemacht gilt, ihren Anspruch nach Grund und Höhe schriftlich anmelden, Sicherheit zu leisten, soweit sie nicht Befriedigung verlangen können. Dieses Recht steht den Gläubigern jedoch nur zu, wenn sie glaubhaft machen, dass durch die Umwandlung die Erfüllung ihrer Forderung gefährdet wird. Das Recht, Sicherheitsleistung zu verlangen, steht Gläubigern nicht zu, die im Falle der Insolvenz ein Recht auf vorzugsweise Befriedigung aus einer Deckungsmasse haben, die nach gesetzlicher Vorschrift zu ihrem Schutz errichtet und staatlich überwacht ist."
    },
    {
      "date": "2025-07-10",
      "id": "115370",
      "original_text": "Registerbekanntmachung nach dem Umwandlungsgesetz\nBremen Amtsgericht Bremen HRB 39208\nFulfillment-Box GmbH – Bremen",
      "type": "Registerbekanntmachung nach dem Umwandlungsgesetz",
      "state": "Bremen",
      "amtsgericht": "Amtsgericht Bremen",
      "registernummer": "HRB 39208",
      "registerart": "HRB",
      "company_name": "Fulfillment-Box GmbH",
      "company_seat": "Bremen",
      "details": "10.07.2025 (Bekanntmachungsdatum)\n\nBremen Amtsgericht Bremen HRB 39208\nRegisterbekanntmachung nach dem Umwandlungsgesetz 03.07.2025 (Eintragungsdatum)\n\nFulfillment-Box GmbH\nGesellschaft mit beschränkter Haftung\nBremen\n\nZu Eintragungsnummer 2 vom 03.07.2025 wird als nicht eingetragen veröffentlicht:\nDen Gläubigern der an der Verschmelzung beteiligten Rechtsträger ist, wenn sie binnen sechs Monaten nach dem Tag, an dem die Eintragung der Verschmelzung in das Register des Sitzes desjenigen Rechtsträgers, dessen Gläubiger sie sind, als bekannt gemacht gilt, ihren Anspruch nach Grund und Höhe schriftlich anmelden, Sicherheit zu leisten, soweit sie nicht Befriedigung verlangen können. Dieses Recht steht den Gläubigern jedoch nur zu, wenn sie glaubhaft machen, dass durch die Verschmelzung die Erfüllung ihrer Forderung gefährdet wird. Das Recht, Sicherheitsleistung zu verlangen, steht Gläubigern nicht zu, die im Falle der Insolvenz ein Recht auf vorzugsweise Befriedigung aus einer Deckungsmasse haben, die nach gesetzlicher Vorschrift zu ihrem Schutz errichtet und staatlich überwacht ist."
    },
    {
      "date": "2025-07-10",
      "id": "115371",
      "original_text": "Sonstige Registerbekanntmachung\nBremen Amtsgericht Bremen HRB 21071\nSikora Aktiengesellschaft – Bremen",
      "type": "Sonstige Registerbekanntmachung",
      "state": "Bremen",
      "amtsgericht": "Amtsgericht Bremen",
      "registernummer": "HRB 21071",
      "registerart": "HRB",
      "company_name": "Sikora Aktiengesellschaft",
      "company_seat": "Bremen",
      "details": "10.07.2025 (Bekanntmachungsdatum)\n\nBremen Amtsgericht Bremen HRB 21071\nSonstige Registerbekanntmachung\n\nSikora Aktiengesellschaft\nAktiengesellschaft\nBremen\n\nAls nicht eingetragen wird bekannt gemacht: Liste des Aufsichtsrats wurde eingereicht."
    },
    {
      "date": "2025-07-10",
      "id": "115372",
      "original_text": "Registerbekanntmachung nach dem Umwandlungsgesetz\nBremen Amtsgericht Bremen HRB 27185\nbag cert gmbh - bildung, arbeit, gesundheit & soziales – Bremen",
      "type": "Registerbekanntmachung nach dem Umwandlungsgesetz",
      "state": "Bremen",
      "amtsgericht": "Amtsgericht Bremen",
      "registernummer": "HRB 27185",
      "registerart": "HRB",
      "company_name": "bag cert gmbh - bildung, arbeit, gesundheit & soziales",
      "company_seat": "Bremen",
      "details": "10.07.2025 (Bekanntmachungsdatum)\n\nBremen Amtsgericht Bremen HRB 27185\nRegisterbekanntmachung nach dem Umwandlungsgesetz 03.07.2025 (Eintragungsdatum)\n\nbag cert gmbh - bildung, arbeit, gesundheit & soziales\nGesellschaft mit beschränkter Haftung\nBremen\n\nZu Eintragungsnummer 4 vom 03.07.2025 wird als nicht eingetragen veröffentlicht: Den Gläubigern der an der Verschmelzung beteiligten Rechtsträger ist, wenn sie binnen sechs Monaten nach dem Tag, an dem die Eintragung der Verschmelzung in das Register des Sitzes desjenigen Rechtsträgers, dessen Gläubiger sie sind, als bekannt gemacht gilt, ihren Anspruch nach Grund und Höhe schriftlich anmelden, Sicherheit zu leisten, soweit sie nicht Befriedigung verlangen können. Dieses Recht steht den Gläubigern jedoch nur zu, wenn sie glaubhaft machen, dass durch die Verschmelzung die Erfüllung ihrer Forderung gefährdet wird. Das Recht, Sicherheitsleistung zu verlangen, steht Gläubigern nicht zu, die im Falle der Insolvenz ein Recht auf vorzugsweise Befriedigung aus einer Deckungsmasse haben, die nach gesetzlicher Vorschrift zu ihrem Schutz errichtet und staatlich überwacht ist."
    },
    {
      "date": "2025-07-10",
      "id": "115373",
      "original_text": "Registerbekanntmachung nach dem Umwandlungsgesetz\nBremen Amtsgericht Bremen HRB 18416\nNORDCONSULT Gesellschaft für Mittelstandsberatung mbH – Bremen",
      "type": "Registerbekanntmachung nach dem Umwandlungsgesetz",
      "state": "Bremen",
      "amtsgericht": "Amtsgericht Bremen",
      "registernummer": "HRB 18416",
      "registerart": "HRB",
      "company_name": "NORDCONSULT Gesellschaft für Mittelstandsberatung mbH",
      "company_seat": "Bremen",
      "details": "10.07.2025 (Bekanntmachungsdatum)\n\nBremen Amtsgericht Bremen HRB 18416\nRegisterbekanntmachung nach dem Umwandlungsgesetz 02.07.2025 (Eintragungsdatum)\n\nNORDCONSULT Gesellschaft für Mittelstandsberatung mbH\nGesellschaft mit beschränkter Haftung\nBremen\n\nZu Eintragungsnummer 6 vom 02.07.2025 wird als nicht eingetragen veröffentlicht: Den Gläubigern der an der Verschmelzung beteiligten Rechtsträger ist, wenn sie binnen sechs Monaten nach dem Tag, an dem die Eintragung der Verschmelzung in das Register des Sitzes desjenigen Rechtsträgers, dessen Gläubiger sie sind, als bekannt gemacht gilt, ihren Anspruch nach Grund und Höhe schriftlich anmelden, Sicherheit zu leisten, soweit sie nicht Befriedigung verlangen können. Dieses Recht steht den Gläubigern jedoch nur zu, wenn sie glaubhaft machen, dass durch die Verschmelzung die Erfüllung ihrer Forderung gefährdet wird. Das Recht, Sicherheitsleistung zu verlangen, steht Gläubigern nicht zu, die im Falle der Insolvenz ein Recht auf vorzugsweise Befriedigung aus einer Deckungsmasse haben, die nach gesetzlicher Vorschrift zu ihrem Schutz errichtet und staatlich überwacht ist."
    },
    {
      "date": "2025-07-10",
      "id": "115374",
      "original_text": "Registerbekanntmachung nach dem Umwandlungsgesetz\nBremen Amtsgericht Bremen HRB 17932\nFriedrich von Hof Beteiligungs GmbH – Bremen",
      "type": "Registerbekanntmachung nach dem Umwandlungsgesetz",
      "state": "Bremen",
      "amtsgericht": "Amtsgericht Bremen",
      "registernummer": "HRB 17932",
      "registerart": "HRB",
      "company_name": "Friedrich von Hof Beteiligungs GmbH",
      "company_seat": "Bremen",
      "details": "10.07.2025 (Bekanntmachungsdatum)\n\nBremen Amtsgericht Bremen HRB 17932\nRegisterbekanntmachung nach dem Umwandlungsgesetz 02.07.2025 (Eintragungsdatum)\n\nFriedrich von Hof Beteiligungs GmbH\nGesellschaft mit beschränkter Haftung\nBremen\n\nZu Eintragungsnummer 6 vom 02.07.2025 wird als nicht eingetragen veröffentlicht: Den Gläubigern der an der Verschmelzung beteiligten Rechtsträger ist, wenn sie binnen sechs Monaten nach dem Tag, an dem die Eintragung der Verschmelzung in das Register des Sitzes desjenigen Rechtsträgers, dessen Gläubiger sie sind, als bekannt gemacht gilt, ihren Anspruch nach Grund und Höhe schriftlich anmelden, Sicherheit zu leisten, soweit sie nicht Befriedigung verlangen können. Dieses Recht steht den Gläubigern jedoch nur zu, wenn sie glaubhaft machen, dass durch die Verschmelzung die Erfüllung ihrer Forderung gefährdet wird. Das Recht, Sicherheitsleistung zu verlangen, steht Gläubigern nicht zu, die im Falle der Insolvenz ein Recht auf vorzugsweise Befriedigung aus einer Deckungsmasse haben, die nach gesetzlicher Vorschrift zu ihrem Schutz errichtet und staatlich überwacht ist."
    },
    {
      "date": "2025-07-10",
      "id": "115375",
      "original_text": "Registerbekanntmachung nach dem Umwandlungsgesetz\nBremen Amtsgericht Bremen HRB 31614\nFulfillment-Box GmbH – Bremen",
      "type": "Registerbekanntmachung nach dem Umwandlungsgesetz",
      "state": "Bremen",
      "amtsgericht": "Amtsgericht Bremen",
      "registernummer": "HRB 31614",
      "registerart": "HRB",
      "company_name": "Fulfillment-Box GmbH",
      "company_seat": "Bremen",
      "details": "10.07.2025 (Bekanntmachungsdatum)\n\nBremen Amtsgericht Bremen HRB 31614\nRegisterbekanntmachung nach dem Umwandlungsgesetz 03.07.2025 (Eintragungsdatum)\n\nFulfillment-Box GmbH\nGesellschaft mit beschränkter Haftung\nBremen\n\nZu Eintragungsnummer 4 vom 03.07.2025 wird als nicht eingetragen veröffentlicht: Den Gläubigern der an der Verschmelzung beteiligten Rechtsträger ist, wenn sie binnen sechs Monaten nach dem Tag, an dem die Eintragung der Verschmelzung in das Register des Sitzes desjenigen Rechtsträgers, dessen Gläubiger sie sind, als bekannt gemacht gilt, ihren Anspruch nach Grund und Höhe schriftlich anmelden, Sicherheit zu leisten, soweit sie nicht Befriedigung verlangen können. Dieses Recht steht den Gläubigern jedoch nur zu, wenn sie glaubhaft machen, dass durch die Verschmelzung die Erfüllung ihrer Forderung gefährdet wird. Das Recht, Sicherheitsleistung zu verlangen, steht Gläubigern nicht zu, die im Falle der Insolvenz ein Recht auf vorzugsweise Befriedigung aus einer Deckungsmasse haben, die nach gesetzlicher Vorschrift zu ihrem Schutz errichtet und staatlich überwacht ist."
    },
    {
      "date": "2025-07-10",
      "id": "115376",
      "original_text": "Registerbekanntmachung nach dem Umwandlungsgesetz\nNordrhein-Westfalen Amtsgericht Köln HRB 123938\nSeapoint Studios GmbH – Köln",
      "type": "Registerbekanntmachung nach dem Umwandlungsgesetz",
      "state": "Nordrhein-Westfalen",
      "amtsgericht": "Amtsgericht Köln",
      "registernummer": "HRB 123938",
      "registerart": "HRB",
      "company_name": "Seapoint Studios GmbH",
      "company_seat": "Köln",
      "details": "10.07.2025 (Bekanntmachungsdatum)\n\nNordrhein-Westfalen Amtsgericht Köln HRB 123938\nRegisterbekanntmachung nach dem Umwandlungsgesetz 10.07.2025 (Eintragungsdatum)\n\nSeapoint Studios GmbH\nGesellschaft mit beschränkter Haftung\nKöln\n\nDen Gläubigern der an der formwechselnden Umwandlung beteiligten Rechtsträger ist, wenn sie binnen sechs Monaten nach dem Tag, an dem die Eintragung der formwechselnden Umwandlung in das Register des Sitzes desjenigen Rechtsträgers, dessen Gläubiger sie sind, nach § 19 Absatz 3 UmwG als bekanntgemacht gilt, ihren Anspruch nach Grund und Höhe schriftlich anmelden, Sicherheit zu leisten, soweit sie nicht Befriedigung verlangen können. Dieses Recht steht den Gläubigern jedoch nur zu, wenn sie glaubhaft machen, dass durch die formwechselnden Umwandlung die Erfüllung ihrer Forderung gefährdet wird."
    },
    {
      "date": "2025-07-10",
      "id": "115377",
      "original_text": "Registerbekanntmachung nach dem Umwandlungsgesetz\nNordrhein-Westfalen Amtsgericht Düsseldorf HRA 28202\nMillion Watches GmbH & Co. KG – Düsseldorf",
      "type": "Registerbekanntmachung nach dem Umwandlungsgesetz",
      "state": "Nordrhein-Westfalen",
      "amtsgericht": "Amtsgericht Düsseldorf",
      "registernummer": "HRA 28202",
      "registerart": "HRA",
      "company_name": "Million Watches GmbH & Co. KG",
      "company_seat": "Düsseldorf",
      "details": "10.07.2025 (Bekanntmachungsdatum)\n\nNordrhein-Westfalen Amtsgericht Düsseldorf HRA 28202\nRegisterbekanntmachung nach dem Umwandlungsgesetz 10.07.2025 (Eintragungsdatum)\n\nMillion Watches GmbH & Co. KG\nKommanditgesellschaft\nDüsseldorf\n\nDen Gläubigern der an der Ausgliederung beteiligten Rechtsträger ist, wenn sie binnen sechs Monaten nach dem Tag, an dem die Eintragung der Ausgliederung in das Register des Sitzes desjenigen Rechtsträgers, dessen Gläubiger sie sind, nach § 19 Absatz 3 UmwG als bekanntgemacht gilt, ihren Anspruch nach Grund und Höhe schriftlich anmelden, Sicherheit zu leisten, soweit sie nicht Befriedigung verlangen können. Dieses Recht steht den Gläubigern jedoch nur zu, wenn sie glaubhaft machen, dass durch die Ausgliederung die Erfüllung ihrer Forderung gefährdet wird."
    },
    {
      "date": "2025-07-10",
      "id": "115378",
      "original_text": "Einreichung neuer Dokumente\nNordrhein-Westfalen Amtsgericht Köln HRB 73574\nArt-Invest Real Estate Funds GmbH – Köln",
      "type": "Einreichung neuer Dokumente",
      "state": "Nordrhein-Westfalen",
      "amtsgericht": "Amtsgericht Köln",
      "registernummer": "HRB 73574",
      "registerart": "HRB",
      "company_name": "Art-Invest Real Estate Funds GmbH",
      "company_seat": "Köln",
      "details": "10.07.2025 (Bekanntmachungsdatum)\n\nNordrhein-Westfalen Amtsgericht Köln HRB 73574\nEinreichung neuer Dokumente\n\nArt-Invest Real Estate Funds GmbH\nGesellschaft mit beschränkter Haftung\nKöln\n\nDem Registergericht ist eine neue Liste der Mitglieder des Aufsichtsrates eingereicht worden."
    },
    {
      "date": "2025-07-10",
      "id": "115379",
      "original_text": "Einreichung neuer Dokumente\nNordrhein-Westfalen Amtsgericht Köln HRB 65\nBank-Verlag GmbH – Köln",
      "type": "Einreichung neuer Dokumente",
      "state": "Nordrhein-Westfalen",
      "amtsgericht": "Amtsgericht Köln",
      "registernummer": "HRB 65",
      "registerart": "HRB",
      "company_name": "Bank-Verlag GmbH",
      "company_seat": "Köln",
      "details": "10.07.2025 (Bekanntmachungsdatum)\n\nNordrhein-Westfalen Amtsgericht Köln HRB 65\nEinreichung neuer Dokumente 10.07.2025 (Eintragungsdatum)\n\nBank-Verlag GmbH\nGesellschaft mit beschränkter Haftung\nKöln\n\nDem Registergericht ist eine neue Liste der Mitglieder des Aufsichtsrates eingereicht worden."
    },
    {
      "date": "2025-07-10",
      "id": "115380",
      "original_text": "Löschungsankündigung\nNordrhein-Westfalen Amtsgericht Düsseldorf HRB 103089\nRheinTrade GmbH – Monheim am Rhein",
      "type": "Löschungsankündigung",
      "state": "Nordrhein-Westfalen",
      "amtsgericht": "Amtsgericht Düsseldorf",
      "registernummer": "HRB 103089",
      "registerart": "HRB",
      "company_name": "RheinTrade GmbH",
      "company_seat": "Monheim am Rhein",
      "details": "10.07.2025 (Bekanntmachungsdatum)\n\nNordrhein-Westfalen Amtsgericht Düsseldorf HRB 103089\nLöschungsankündigung\n\nRheinTrade GmbH\nGesellschaft mit beschränkter Haftung\nMonheim am Rhein\n\nDas Registergericht beabsichtigt die Gesellschaft von Amts wegen nach § 394 FamFG zu löschen. Die Frist zur Erhebung eines Widerspruchs ist auf 3 Wochen festgesetzt.\n\nRechtsbehelfsbelehrung:\nDas Widerspruchsrecht steht jedem zu, der an der Unterlassung der Löschung ein berechtigtes Interesse hat. Der Widerspruch ist bei dem Amtsgericht Düsseldorf -Registergericht-, Werdener Straße 1, 40227 Düsseldorf schriftlich in deutscher Sprache oder zur Niederschrift der Geschäftsstelle einzulegen. Der Widerspruch kann auch zur Niederschrift der Geschäftsstelle eines jeden Amtsgerichtes abgegeben werden. Die Einlegung ist auch durch Übertragung eines elektronischen Dokuments an die elektronische Poststelle des Gerichts möglich. Das elektronische Dokument muss für die Bearbeitung durch das Gericht geeignet und mit einer qualifizierten elektronischen Signatur der verantwortenden Person versehen sein oder von der verantwortenden Person signiert und auf einem sicheren Übermittlungsweg gemäß § 130a ZPO nach näherer Maßgabe der Verordnung über die technischen Rahmenbedingungen des elektronischen Rechtsverkehrs und über das besondere elektronische Behördenpostfach (BGBl. I, S.3803) eingereicht werden. Weitere Informationen erhalten Sie auf der Internetseite www.justiz.de.\nDer Widerspruch muss spätestens innerhalb der gesetzten Frist nach dem Datum der Bekanntmachung der Löschungsankündigung bei dem Amtsgericht - Registergericht - Düsseldorf eingegangen sein.  Dies gilt auch dann, wenn der Widerspruch zur Niederschrift der Geschäftsstelle eines anderen Amtsgerichtes abgegeben wurde. Die Frist beginnt mit dem Tage der Bekanntmachung der Löschungsankündigung in dem für die Bekanntmachung der Eintragungen in das Handelsregister bestimmten elektronischen Informations- und Kommunikationssystem nach § 10 des Handelsgesetzbuches. Fällt das Ende der Frist auf einen Sonntag, einen allgemeinen Feiertag oder Sonnabend, so endet die Frist mit Ablauf des nächsten Werktages.\nDer Widerspruch muss die Bezeichnung der angefochtenen Löschungsankündigung sowie die Erklärung enthalten, dass Widerspruch gegen diese Löschungsankündigung eingelegt wird. Er ist zu unterzeichnen und soll begründet werden."
    },
    {
      "date": "2025-07-10",
      "id": "115381",
      "original_text": "Einreichung neuer Dokumente\nNordrhein-Westfalen Amtsgericht Bonn HRB 6792\nDeutsche Post AG – Bonn",
      "type": "Einreichung neuer Dokumente",
      "state": "Nordrhein-Westfalen",
      "amtsgericht": "Amtsgericht Bonn",
      "registernummer": "HRB 6792",
      "registerart": "HRB",
      "company_name": "Deutsche Post AG",
      "company_seat": "Bonn",
      "details": "10.07.2025 (Bekanntmachungsdatum)\n\nNordrhein-Westfalen Amtsgericht Bonn HRB 6792\nEinreichung neuer Dokumente\n\nDeutsche Post AG\nAktiengesellschaft\nBonn\n\nDem Registergericht ist eine neue Liste der Mitglieder des Aufsichtsrates eingereicht worden."
    },
    {
      "date": "2025-07-10",
      "id": "115382",
      "original_text": "Registerbekanntmachung nach dem Umwandlungsgesetz\nNordrhein-Westfalen Amtsgericht Duisburg HRB 4574\nRhenus Back- und Vertriebs- Gesellschaft mit beschränkter Haftung – Duisburg",
      "type": "Registerbekanntmachung nach dem Umwandlungsgesetz",
      "state": "Nordrhein-Westfalen",
      "amtsgericht": "Amtsgericht Duisburg",
      "registernummer": "HRB 4574",
      "registerart": "HRB",
      "company_name": "Rhenus Back- und Vertriebs- Gesellschaft mit beschränkter Haftung",
      "company_seat": "Duisburg",
      "details": "10.07.2025 (Bekanntmachungsdatum)\n\nNordrhein-Westfalen Amtsgericht Duisburg HRB 4574\nRegisterbekanntmachung nach dem Umwandlungsgesetz 10.07.2025 (Eintragungsdatum)\n\nRhenus Back- und Vertriebs- Gesellschaft mit beschränkter Haftung\nGesellschaft mit beschränkter Haftung\nDuisburg\n\nDie Gesellschaft hat Gläubigern, deren Forderungen vor dieser Bekanntmachung begründet worden sind, Sicherheit zu leisten, soweit sie nicht Befriedigung verlangen können, wenn sie sich binnen sechs Monaten zu diesem Zweck melden."
    },
    {
      "date": "2025-07-10",
      "id": "115383",
      "original_text": "Registerbekanntmachung nach dem Umwandlungsgesetz\nNordrhein-Westfalen Amtsgericht Duisburg HRB 11855\nVan Leeuwen Deutschland Beteiligungs GmbH – Duisburg",
      "type": "Registerbekanntmachung nach dem Umwandlungsgesetz",
      "state": "Nordrhein-Westfalen",
      "amtsgericht": "Amtsgericht Duisburg",
      "registernummer": "HRB 11855",
      "registerart": "HRB",
      "company_name": "Van Leeuwen Deutschland Beteiligungs GmbH",
      "company_seat": "Duisburg",
      "details": "10.07.2025 (Bekanntmachungsdatum)\n\nNordrhein-Westfalen Amtsgericht Duisburg HRB 11855\nRegisterbekanntmachung nach dem Umwandlungsgesetz 10.07.2025 (Eintragungsdatum)\n\nVan Leeuwen Deutschland Beteiligungs GmbH\nGesellschaft mit beschränkter Haftung\nDuisburg\n\nDie Gesellschaft hat Gläubigern, deren Forderungen vor dieser Bekanntmachung begründet worden sind, Sicherheit zu leisten, soweit sie nicht Befriedigung verlangen können, wenn sie sich binnen sechs Monaten zu diesem Zweck melden."
    },
    {
      "date": "2025-07-10",
      "id": "115384",
      "original_text": "Registerbekanntmachung nach dem Umwandlungsgesetz\nNordrhein-Westfalen Amtsgericht Siegen HRA 10016\ntmd Malerbetrieb Rainer Monno e.K. – Siegen",
      "type": "Registerbekanntmachung nach dem Umwandlungsgesetz",
      "state": "Nordrhein-Westfalen",
      "amtsgericht": "Amtsgericht Siegen",
      "registernummer": "HRA 10016",
      "registerart": "HRA",
      "company_name": "tmd Malerbetrieb Rainer Monno e.K.",
      "company_seat": "Siegen",
      "details": "10.07.2025 (Bekanntmachungsdatum)\n\nNordrhein-Westfalen Amtsgericht Siegen HRA 10016\nRegisterbekanntmachung nach dem Umwandlungsgesetz 10.07.2025 (Eintragungsdatum)\n\ntmd Malerbetrieb Rainer Monno e.K.\nEinzelkaufmann / Einzelkauffrau\nSiegen\n\nDie Gesellschaft hat Gläubigern, deren Forderungen vor dieser Bekanntmachung begründet worden sind, Sicherheit zu leisten, soweit sie nicht Befriedigung verlangen können, wenn sie sich binnen sechs Monaten zu diesem Zweck melden.Den Gläubigern der an der Ausgliederung beteiligten Rechtsträger ist, wenn sie binnen sechs Monaten nach dem Tag, an dem die Eintragung der Ausgliederung in das Register des Sitzes desjenigen Rechtsträgers, dessen Gläubiger sie sind, nach § 19 Absatz 3 UmwG als bekanntgemacht gilt, ihren Anspruch nach Grund und Höhe schriftlich anmelden, Sicherheit zu leisten, soweit sie nicht Befriedigung verlangen können. Dieses Recht steht den Gläubigern jedoch nur zu, wenn sie glaubhaft machen, dass durch die Ausgliederung die Erfüllung ihrer Forderung gefährdet wird."
    },
    {
      "date": "2025-07-10",
      "id": "115385",
      "original_text": "Löschungsankündigung\nNordrhein-Westfalen Amtsgericht Mönchengladbach VR 2382\nFörderverein des Neuwerker Brauchtums – Mönchengladbach",
      "type": "Löschungsankündigung",
      "state": "Nordrhein-Westfalen",
      "amtsgericht": "Amtsgericht Mönchengladbach",
      "registernummer": "VR 2382",
      "registerart": "VR",
      "company_name": "Förderverein des Neuwerker Brauchtums",
      "company_seat": "Mönchengladbach",
      "details": "10.07.2025 (Bekanntmachungsdatum)\n\nNordrhein-Westfalen Amtsgericht Mönchengladbach VR 2382\nLöschungsankündigung 10.07.2025 (Eintragungsdatum)\n\nFörderverein des Neuwerker Brauchtums\neingetragener Verein\nMönchengladbach\n\nIn der Vereinsregistersache Förderverein des Neuwerker Brauchtums beabsichtigt das Gericht, den Verein  von Amts wegen aus dem Vereinsregister zu löschen, da davon ausgegangen wird, dass der Verein keine Mitglieder mehr hat.\nEs  wird hiermit eine Frist von 3 Monaten eingeräumt, um einen Widerspruch gegen die beabsichtigte Löschung geltend zu machen. Dieser kann nur damit begründet werden, dass der Verein noch ausreichend Mitglieder hat oder alsbald haben wird."
    },
    {
      "date": "2025-07-10",
      "id": "115386",
      "original_text": "Registerbekanntmachung nach dem Umwandlungsgesetz\nNordrhein-Westfalen Amtsgericht Köln HRB 33448\nKSK-Real Estate Management GmbH – Köln",
      "type": "Registerbekanntmachung nach dem Umwandlungsgesetz",
      "state": "Nordrhein-Westfalen",
      "amtsgericht": "Amtsgericht Köln",
      "registernummer": "HRB 33448",
      "registerart": "HRB",
      "company_name": "KSK-Real Estate Management GmbH",
      "company_seat": "Köln",
      "details": "10.07.2025 (Bekanntmachungsdatum)\n\nNordrhein-Westfalen Amtsgericht Köln HRB 33448\nRegisterbekanntmachung nach dem Umwandlungsgesetz 10.07.2025 (Eintragungsdatum)\n\nKSK-Real Estate Management GmbH\nGesellschaft mit beschränkter Haftung\nKöln\n\nDen Gläubigern der an der Verschmelzung beteiligten Rechtsträger ist, wenn sie binnen sechs Monaten nach dem Tag, an dem die Eintragung der Verschmelzung in das Register des Sitzes desjenigen Rechtsträgers, dessen Gläubiger sie sind, nach § 19 Absatz 3 UmwG als bekanntgemacht gilt, ihren Anspruch nach Grund und Höhe schriftlich anmelden, Sicherheit zu leisten, soweit sie nicht Befriedigung verlangen können. Dieses Recht steht den Gläubigern jedoch nur zu, wenn sie glaubhaft machen, dass durch die Verschmelzung die Erfüllung ihrer Forderung gefährdet wird."
    },
    {
      "date": "2025-07-10",
      "id": "115387",
      "original_text": "Sonstige Registerbekanntmachung\nNordrhein-Westfalen Amtsgericht Düsseldorf HRB 54127\nISS Facility Services Holding GmbH – Düsseldorf",
      "type": "Sonstige Registerbekanntmachung",
      "state": "Nordrhein-Westfalen",
      "amtsgericht": "Amtsgericht Düsseldorf",
      "registernummer": "HRB 54127",
      "registerart": "HRB",
      "company_name": "ISS Facility Services Holding GmbH",
      "company_seat": "Düsseldorf",
      "details": "10.07.2025 (Bekanntmachungsdatum)\n\nNordrhein-Westfalen Amtsgericht Düsseldorf HRB 54127\nSonstige Registerbekanntmachung\n\nISS Facility Services Holding GmbH\nGesellschaft mit beschränkter Haftung\nDüsseldorf\n\nDem Registergericht ist eine Liste der Mitglieder des Aufsichtsrates eingereicht worden."
    },
    {
      "date": "2025-07-10",
      "id": "115388",
      "original_text": "Registerbekanntmachung nach dem Umwandlungsgesetz\nNordrhein-Westfalen Amtsgericht Köln HRB 123930\nBaumpflege Bach GmbH – Overath",
      "type": "Registerbekanntmachung nach dem Umwandlungsgesetz",
      "state": "Nordrhein-Westfalen",
      "amtsgericht": "Amtsgericht Köln",
      "registernummer": "HRB 123930",
      "registerart": "HRB",
      "company_name": "Baumpflege Bach GmbH",
      "company_seat": "Overath",
      "details": "10.07.2025 (Bekanntmachungsdatum)\n\nNordrhein-Westfalen Amtsgericht Köln HRB 123930\nRegisterbekanntmachung nach dem Umwandlungsgesetz 10.07.2025 (Eintragungsdatum)\n\nBaumpflege Bach GmbH\nGesellschaft mit beschränkter Haftung\nOverath\n\nDen Gläubigern der an der Ausgliederung beteiligten Rechtsträger ist, wenn sie binnen sechs Monaten nach dem Tag, an dem die Eintragung der Ausgliederung in das Register des Sitzes desjenigen Rechtsträgers, dessen Gläubiger sie sind, nach § 19 Absatz 3 UmwG als bekanntgemacht gilt, ihren Anspruch nach Grund und Höhe schriftlich anmelden, Sicherheit zu leisten, soweit sie nicht Befriedigung verlangen können. Dieses Recht steht den Gläubigern jedoch nur zu, wenn sie glaubhaft machen, dass durch die Ausgliederung die Erfüllung ihrer Forderung gefährdet wird."
    },
    {
      "date": "2025-07-10",
      "id": "115389",
      "original_text": "Löschungsankündigung\nNordrhein-Westfalen Amtsgericht Aachen HRB 18015\naixGlobal Trade GmbH – Aachen",
      "type": "Löschungsankündigung",
      "state": "Nordrhein-Westfalen",
      "amtsgericht": "Amtsgericht Aachen",
      "registernummer": "HRB 18015",
      "registerart": "HRB",
      "company_name": "aixGlobal Trade GmbH",
      "company_seat": "Aachen",
      "details": "10.07.2025 (Bekanntmachungsdatum)\n\nNordrhein-Westfalen Amtsgericht Aachen HRB 18015\nLöschungsankündigung\n\naixGlobal Trade GmbH\nGesellschaft mit beschränkter Haftung\nAachen\n\nDas Registergericht beabsichtigt, von Amts wegen die Gesellschaft wegen Vermögenslosigkeit nach § 394 FamFG zu löschen,  weil das Finanzamt  Aachen-Stadt  mit Schreiben vom 01.07.2025 Umstände mitgeteilt hat, aufgrund derer das Gericht davon überzeugt ist, dass die Gesellschaft vollständig vermögenslos ist.\nZur Geltendmachung des Widerspruchs gegen die beabsichtigte Löschung wird hiermit eine Frist von einem Monat ab Veröffentlichung dieser Ankündigung bestimmt.Rechtsbehelfsbelehrung:  Gegen diese Verfügung kann Widerspruch eingelegt werden. Zum Widerspruch ist jeder berechtigt, der an der Unterlassung der Löschung ein berechtigtes Interesse hat. Der Widerspruch ist bei dem Amtsgericht Aachen, Adalbertsteinweg 92, 52070 Aachen schriftlich in deutscher Sprache oder zur Niederschrift der Geschäftsstelle einzulegen. Der Widerspruch kann auch zur Niederschrift der Geschäftsstelle eines jeden Amtsgerichtes abgegeben werden.\nDer Widerspruch muss spätestens innerhalb der gesetzten Frist nach der Bekanntgabe der Verfügung bei dem Amtsgericht Aachen eingegangen sein. Dies gilt auch dann, wenn der Widerspruch zur Niederschrift der Geschäftsstelle eines anderen Amtsgerichtes abgegeben wurde. Die Frist beginnt mit der Bekanntgabe der Verfügung durch Veröffentlichung. Fällt das Ende der Frist auf einen Sonntag, einen allgemeinen Feiertag oder Sonnabend, so endet die Frist mit Ablauf des nächsten Werktages.\nDer Widerspruch muss die Bezeichnung der angefochtenen Verfügung sowie die Erklärung enthalten, dass Widerspruch gegen diese Verfügung eingelegt wird. Er ist zu unterzeichnen und soll begründet werden.\nDie Einlegung ist auch durch Übertragung eines elektronischen Dokuments an die elektronische Poststelle des Gerichts möglich. Das elektronische Dokument muss für die Bearbeitung durch das Gericht geeignet und mit einer qualifizierten elektronischen Signatur der verantwortenden Person versehen sein oder von der verantwortenden Person signiert und auf einem sicheren Übermittlungsweg gemäß § 130 a ZPO nach näherer Maßgabe der Verordnung über die technischen Rahmenbedingungen des elektronischen Rechtsverkehrs und über das besondere elektronische Behördenpostfach (BGBl. I, S. 3803) eingereicht werden. Weitere Informationen erhalten Sie auf der Internetseite www.justiz.de."
    },
    {
      "date": "2025-07-10",
      "id": "115390",
      "original_text": "Löschungsankündigung\nNordrhein-Westfalen Amtsgericht Hagen HRB 11747\nMW Bausanierung GmbH – Schwelm",
      "type": "Löschungsankündigung",
      "state": "Nordrhein-Westfalen",
      "amtsgericht": "Amtsgericht Hagen",
      "registernummer": "HRB 11747",
      "registerart": "HRB",
      "company_name": "MW Bausanierung GmbH",
      "company_seat": "Schwelm",
      "details": "10.07.2025 (Bekanntmachungsdatum)\n\nNordrhein-Westfalen Amtsgericht Hagen HRB 11747\nLöschungsankündigung\n\nMW Bausanierung GmbH\nGesellschaft mit beschränkter Haftung\nSchwelm\n\nin obiger Handelsregistersache\nwird bekannt gemacht:\nDas Registergericht beabsichtigt, die im Handelsregister eingetragene Gesellschaft gemäß § 394 I FamFG wegen Vermögenslosigkeit von Amts wegen zu löschen. Gegen diese Verfügung kann Widerspruch eingelegt werden. Die Frist zur Erhebung eines Widerspruchs gegen die beabsichtigte Löschung von Amts wegen ist auf drei Monate festgesetzt.\n\nRechtsbehelfsbelehrung:\nGegen diese Verfügung können Sie Widerspruch einlegen.\n\nDer Widerspruch ist bei dem Amtsgericht Hagen, Heinitzstraße 42, 58097 Hagen schriftlich in deutscher Sprache oder zur Niederschrift der Geschäftsstelle einzulegen. Der Widerspruch kann auch zur Niederschrift der Geschäftsstelle eines jeden Amtsgerichts abgegeben werden.\n\nDer Widerspruch muss spätestens innerhalb der gesetzten Frist bei dem Amtsgericht Hagen eingegangen sein. Dies gilt auch dann, wenn der Widerspruch zur Geschäftsstelle eines anderen Amtsgerichtes abgegeben wurde. Die Frist beginnt mit der Veröffentlichung. Fällt das Ende der Frist auf einen Sonntag, einen allgemeinen Feiertag oder Sonnabend, so endet die Frist mit Ablauf des nächsten Werktages.\n\nDer Widerspruch muss die Bezeichnung der angefochtenen Verfügung sowie die Erklärung erhalten, dass Widerspruch gegen diese Verfügung eingelegt wird. Er ist zu unterzeichnen und soll begründet werden."
    },
    {
      "date": "2025-07-10",
      "id": "115391",
      "original_text": "Registerbekanntmachung nach dem Umwandlungsgesetz\nNordrhein-Westfalen Amtsgericht Köln HRB 110397\nStröer Content Group X GmbH – Köln",
      "type": "Registerbekanntmachung nach dem Umwandlungsgesetz",
      "state": "Nordrhein-Westfalen",
      "amtsgericht": "Amtsgericht Köln",
      "registernummer": "HRB 110397",
      "registerart": "HRB",
      "company_name": "Ströer Content Group X GmbH",
      "company_seat": "Köln",
      "details": "10.07.2025 (Bekanntmachungsdatum)\n\nNordrhein-Westfalen Amtsgericht Köln HRB 110397\nRegisterbekanntmachung nach dem Umwandlungsgesetz 10.07.2025 (Eintragungsdatum)\n\nStröer Content Group X GmbH\nGesellschaft mit beschränkter Haftung\nKöln\n\nDen Gläubigern der an der Verschmelzung beteiligten Rechtsträger ist, wenn sie binnen sechs Monaten nach dem Tag, an dem die Eintragung der Verschmelzung in das Register des Sitzes desjenigen Rechtsträgers, dessen Gläubiger sie sind, nach § 19 Absatz 3 UmwG als bekanntgemacht gilt, ihren Anspruch nach Grund und Höhe schriftlich anmelden, Sicherheit zu leisten, soweit sie nicht Befriedigung verlangen können. Dieses Recht steht den Gläubigern jedoch nur zu, wenn sie glaubhaft machen, dass durch die Verschmelzung die Erfüllung ihrer Forderung gefährdet wird."
    },
    {
      "date": "2025-07-10",
      "id": "115392",
      "original_text": "Registerbekanntmachung nach dem Umwandlungsgesetz\nNordrhein-Westfalen Amtsgericht Lemgo HRB 7018\nBlum & Lesemann GmbH KFZ-Überwachung – Lemgo",
      "type": "Registerbekanntmachung nach dem Umwandlungsgesetz",
      "state": "Nordrhein-Westfalen",
      "amtsgericht": "Amtsgericht Lemgo",
      "registernummer": "HRB 7018",
      "registerart": "HRB",
      "company_name": "Blum & Lesemann GmbH KFZ-Überwachung",
      "company_seat": "Lemgo",
      "details": "10.07.2025 (Bekanntmachungsdatum)\n\nNordrhein-Westfalen Amtsgericht Lemgo HRB 7018\nRegisterbekanntmachung nach dem Umwandlungsgesetz 10.07.2025 (Eintragungsdatum)\n\nBlum & Lesemann GmbH KFZ-Überwachung\nGesellschaft mit beschränkter Haftung\nLemgo\n\nDen Gläubigern der an der Verschmelzung beteiligten Rechtsträger ist, wenn sie binnen sechs Monaten nach dem Tag, an dem die Eintragung der Verschmelzung in das Register des Sitzes desjenigen Rechtsträgers, dessen Gläubiger sie sind, nach § 19 Absatz 3 UmwG als bekanntgemacht gilt, ihren Anspruch nach Grund und Höhe schriftlich anmelden, Sicherheit zu leisten, soweit sie nicht Befriedigung verlangen können. Dieses Recht steht den Gläubigern jedoch nur zu, wenn sie glaubhaft machen, dass durch die Verschmelzung die Erfüllung ihrer Forderung gefährdet wird."
    },
    {
      "date": "2025-07-10",
      "id": "115393",
      "original_text": "Einreichung neuer Dokumente\nNordrhein-Westfalen Amtsgericht Duisburg HRB 20198\nMannesmann Precision Tubes GmbH – Mülheim an der Ruhr",
      "type": "Einreichung neuer Dokumente",
      "state": "Nordrhein-Westfalen",
      "amtsgericht": "Amtsgericht Duisburg",
      "registernummer": "HRB 20198",
      "registerart": "HRB",
      "company_name": "Mannesmann Precision Tubes GmbH",
      "company_seat": "Mülheim an der Ruhr",
      "details": "10.07.2025 (Bekanntmachungsdatum)\n\nNordrhein-Westfalen Amtsgericht Duisburg HRB 20198\nEinreichung neuer Dokumente\n\nMannesmann Precision Tubes GmbH\nGesellschaft mit beschränkter Haftung\nMülheim an der Ruhr\n\nDem Registergericht ist eine neue Liste der Mitglieder des Aufsichtsrates eingereicht worden."
    },
    {
      "date": "2025-07-10",
      "id": "115394",
      "original_text": "Löschungsankündigung\nNordrhein-Westfalen Amtsgericht Düsseldorf HRB 83264\nGlobex Trade UG (haftungsbeschränkt) – Düsseldorf",
      "type": "Löschungsankündigung",
      "state": "Nordrhein-Westfalen",
      "amtsgericht": "Amtsgericht Düsseldorf",
      "registernummer": "HRB 83264",
      "registerart": "HRB",
      "company_name": "Globex Trade UG (haftungsbeschränkt)",
      "company_seat": "Düsseldorf",
      "details": "10.07.2025 (Bekanntmachungsdatum)\n\nNordrhein-Westfalen Amtsgericht Düsseldorf HRB 83264\nLöschungsankündigung\n\nGlobex Trade UG (haftungsbeschränkt)\nGesellschaft mit beschränkter Haftung\nDüsseldorf\n\nDas Registergericht beabsichtigt die Gesellschaft von Amts wegen nach § 394 FamFG zu löschen. Die Frist zur Erhebung eines Widerspruchs ist auf #DV.Fr(Text=\"Bitte wählen Sie die Widerspruchsfrist aus!\",Eingabe=\"einen Monat\",\"zwei Monate\",\"drei Monate\",\"#insert(Text=\"Freitext\")\"|\"freier Text\") festgesetzt.\n\nRechtsbehelfsbelehrung:\nDas Widerspruchsrecht steht jedem zu, der an der Unterlassung der Löschung ein berechtigtes Interesse hat. Der Widerspruch ist bei dem Amtsgericht Düsseldorf -Registergericht-, Werdener Straße 1, 40227 Düsseldorf schriftlich in deutscher Sprache oder zur Niederschrift der Geschäftsstelle einzulegen. Der Widerspruch kann auch zur Niederschrift der Geschäftsstelle eines jeden Amtsgerichtes abgegeben werden. Die Einlegung ist auch durch Übertragung eines elektronischen Dokuments an die elektronische Poststelle des Gerichts möglich. Das elektronische Dokument muss für die Bearbeitung durch das Gericht geeignet und mit einer qualifizierten elektronischen Signatur der verantwortenden Person versehen sein oder von der verantwortenden Person signiert und auf einem sicheren Übermittlungsweg gemäß § 130a ZPO nach näherer Maßgabe der Verordnung über die technischen Rahmenbedingungen des elektronischen Rechtsverkehrs und über das besondere elektronische Behördenpostfach (BGBl. I, S.3803) eingereicht werden. Weitere Informationen erhalten Sie auf der Internetseite www.justiz.de.\nDer Widerspruch muss spätestens innerhalb der gesetzten Frist nach dem Datum der Bekanntmachung der Löschungsankündigung bei dem Amtsgericht - Registergericht - Düsseldorf eingegangen sein.  Dies gilt auch dann, wenn der Widerspruch zur Niederschrift der Geschäftsstelle eines anderen Amtsgerichtes abgegeben wurde. Die Frist beginnt mit dem Tage der Bekanntmachung der Löschungsankündigung in dem für die Bekanntmachung der Eintragungen in das Handelsregister bestimmten elektronischen Informations- und Kommunikationssystem nach § 10 des Handelsgesetzbuches. Fällt das Ende der Frist auf einen Sonntag, einen allgemeinen Feiertag oder Sonnabend, so endet die Frist mit Ablauf des nächsten Werktages.\nDer Widerspruch muss die Bezeichnung der angefochtenen Löschungsankündigung sowie die Erklärung enthalten, dass Widerspruch gegen diese Löschungsankündigung eingelegt wird. Er ist zu unterzeichnen und soll begründet werden."
    },
    {
      "date": "2025-07-10",
      "id": "115395",
      "original_text": "Registerbekanntmachung nach dem Umwandlungsgesetz\nNordrhein-Westfalen Amtsgericht Duisburg HRB 5468\nBÄKO-LAGERHÄUSER Ost GmbH – Duisburg",
      "type": "Registerbekanntmachung nach dem Umwandlungsgesetz",
      "state": "Nordrhein-Westfalen",
      "amtsgericht": "Amtsgericht Duisburg",
      "registernummer": "HRB 5468",
      "registerart": "HRB",
      "company_name": "BÄKO-LAGERHÄUSER Ost GmbH",
      "company_seat": "Duisburg",
      "details": "10.07.2025 (Bekanntmachungsdatum)\n\nNordrhein-Westfalen Amtsgericht Duisburg HRB 5468\nRegisterbekanntmachung nach dem Umwandlungsgesetz 10.07.2025 (Eintragungsdatum)\n\nBÄKO-LAGERHÄUSER Ost GmbH\nGesellschaft mit beschränkter Haftung\nDuisburg\n\nDie Gesellschaft hat Gläubigern, deren Forderungen vor dieser Bekanntmachung begründet worden sind, Sicherheit zu leisten, soweit sie nicht Befriedigung verlangen können, wenn sie sich binnen sechs Monaten zu diesem Zweck melden."
    },
    {
      "date": "2025-07-10",
      "id": "115396",
      "original_text": "Registerbekanntmachung nach dem Umwandlungsgesetz\nNordrhein-Westfalen Amtsgericht Köln HRB 123956\nSSC Capital GmbH – Bergisch Gladbach",
      "type": "Registerbekanntmachung nach dem Umwandlungsgesetz",
      "state": "Nordrhein-Westfalen",
      "amtsgericht": "Amtsgericht Köln",
      "registernummer": "HRB 123956",
      "registerart": "HRB",
      "company_name": "SSC Capital GmbH",
      "company_seat": "Bergisch Gladbach",
      "details": "10.07.2025 (Bekanntmachungsdatum)\n\nNordrhein-Westfalen Amtsgericht Köln HRB 123956\nRegisterbekanntmachung nach dem Umwandlungsgesetz 10.07.2025 (Eintragungsdatum)\n\nSSC Capital GmbH\nGesellschaft mit beschränkter Haftung\nBergisch Gladbach\n\nDie Gesellschaft hat Gläubigern, deren Forderungen vor dieser Bekanntmachung begründet worden sind, Sicherheit zu leisten, soweit sie nicht Befriedigung verlangen können, wenn sie sich binnen sechs Monaten zu diesem Zweck melden."
    },
    {
      "date": "2025-07-10",
      "id": "115397",
      "original_text": "Einreichung neuer Dokumente\nNordrhein-Westfalen Amtsgericht Münster HRB 9982\nProvinzial Holding Aktiengesellschaft – Münster",
      "type": "Einreichung neuer Dokumente",
      "state": "Nordrhein-Westfalen",
      "amtsgericht": "Amtsgericht Münster",
      "registernummer": "HRB 9982",
      "registerart": "HRB",
      "company_name": "Provinzial Holding Aktiengesellschaft",
      "company_seat": "Münster",
      "details": "10.07.2025 (Bekanntmachungsdatum)\n\nNordrhein-Westfalen Amtsgericht Münster HRB 9982\nEinreichung neuer Dokumente\n\nProvinzial Holding Aktiengesellschaft\nAktiengesellschaft\nMünster\n\nDem Registergericht ist eine neue Liste der Mitglieder des Aufsichtsrates eingereicht worden."
    },
    {
      "date": "2025-07-10",
      "id": "115398",
      "original_text": "Registerbekanntmachung nach dem Umwandlungsgesetz\nNordrhein-Westfalen Amtsgericht Lemgo HRA 2738\nIng.-Büro Blum & Lesemann GmbH & Co. KG – Lemgo",
      "type": "Registerbekanntmachung nach dem Umwandlungsgesetz",
      "state": "Nordrhein-Westfalen",
      "amtsgericht": "Amtsgericht Lemgo",
      "registernummer": "HRA 2738",
      "registerart": "HRA",
      "company_name": "Ing.-Büro Blum & Lesemann GmbH & Co. KG",
      "company_seat": "Lemgo",
      "details": "10.07.2025 (Bekanntmachungsdatum)\n\nNordrhein-Westfalen Amtsgericht Lemgo HRA 2738\nRegisterbekanntmachung nach dem Umwandlungsgesetz 10.07.2025 (Eintragungsdatum)\n\nIng.-Büro Blum & Lesemann GmbH & Co. KG\nKommanditgesellschaft\nLemgo\n\nDen Gläubigern der an der Verschmelzung beteiligten Rechtsträger ist, wenn sie binnen sechs Monaten nach dem Tag, an dem die Eintragung der Verschmelzung in das Register des Sitzes desjenigen Rechtsträgers, dessen Gläubiger sie sind, nach § 19 Absatz 3 UmwG als bekanntgemacht gilt, ihren Anspruch nach Grund und Höhe schriftlich anmelden, Sicherheit zu leisten, soweit sie nicht Befriedigung verlangen können. Dieses Recht steht den Gläubigern jedoch nur zu, wenn sie glaubhaft machen, dass durch die Verschmelzung die Erfüllung ihrer Forderung gefährdet wird."
    },
    {
      "date": "2025-07-10",
      "id": "115399",
      "original_text": "Registerbekanntmachung nach dem Umwandlungsgesetz\nNordrhein-Westfalen Amtsgericht Arnsberg HRB 14433\nRV RET Haus und Garten GmbH – Wickede",
      "type": "Registerbekanntmachung nach dem Umwandlungsgesetz",
      "state": "Nordrhein-Westfalen",
      "amtsgericht": "Amtsgericht Arnsberg",
      "registernummer": "HRB 14433",
      "registerart": "HRB",
      "company_name": "RV RET Haus und Garten GmbH",
      "company_seat": "Wickede",
      "details": "10.07.2025 (Bekanntmachungsdatum)\n\nNordrhein-Westfalen Amtsgericht Arnsberg HRB 14433\nRegisterbekanntmachung nach dem Umwandlungsgesetz 10.07.2025 (Eintragungsdatum)\n\nRV RET Haus und Garten GmbH\nGesellschaft mit beschränkter Haftung\nWickede\n\nDen Gläubigern der an der formwechselnden Umwandlung beteiligten Rechtsträger ist, wenn sie binnen sechs Monaten nach dem Tag, an dem die Eintragung der formwechselnden Umwandlung in das Register des Sitzes desjenigen Rechtsträgers, dessen Gläubiger sie sind, nach § 19 Absatz 3 UmwG als bekanntgemacht gilt, ihren Anspruch nach Grund und Höhe schriftlich anmelden, Sicherheit zu leisten, soweit sie nicht Befriedigung verlangen können. Dieses Recht steht den Gläubigern jedoch nur zu, wenn sie glaubhaft machen, dass durch die formwechselnden Umwandlung die Erfüllung ihrer Forderung gefährdet wird."
    },
    {
      "date": "2025-07-10",
      "id": "115400",
      "original_text": "Registerbekanntmachung nach dem Umwandlungsgesetz\nNordrhein-Westfalen Amtsgericht Mönchengladbach HRB 14695\nLufttechnik Schalm GmbH – Viersen",
      "type": "Registerbekanntmachung nach dem Umwandlungsgesetz",
      "state": "Nordrhein-Westfalen",
      "amtsgericht": "Amtsgericht Mönchengladbach",
      "registernummer": "HRB 14695",
      "registerart": "HRB",
      "company_name": "Lufttechnik Schalm GmbH",
      "company_seat": "Viersen",
      "details": "10.07.2025 (Bekanntmachungsdatum)\n\nNordrhein-Westfalen Amtsgericht Mönchengladbach HRB 14695\nRegisterbekanntmachung nach dem Umwandlungsgesetz 10.07.2025 (Eintragungsdatum)\n\nLufttechnik Schalm GmbH\nGesellschaft mit beschränkter Haftung\nViersen\n\nDen Gläubigern der an der Verschmelzung beteiligten Rechtsträger ist, wenn sie binnen sechs Monaten nach dem Tag, an dem die Eintragung der Verschmelzung in das Register des Sitzes desjenigen Rechtsträgers, dessen Gläubiger sie sind, nach § 19 Absatz 3 UmwG als bekanntgemacht gilt, ihren Anspruch nach Grund und Höhe schriftlich anmelden, Sicherheit zu leisten, soweit sie nicht Befriedigung verlangen können. Dieses Recht steht den Gläubigern jedoch nur zu, wenn sie glaubhaft machen, dass durch die Verschmelzung die Erfüllung ihrer Forderung gefährdet wird."
    },
    {
      "date": "2025-07-10",
      "id": "115401",
      "original_text": "Registerbekanntmachung nach dem Umwandlungsgesetz\nNordrhein-Westfalen Amtsgericht Duisburg HRB 8332\nReederei Jaegers GmbH – Duisburg",
      "type": "Registerbekanntmachung nach dem Umwandlungsgesetz",
      "state": "Nordrhein-Westfalen",
      "amtsgericht": "Amtsgericht Duisburg",
      "registernummer": "HRB 8332",
      "registerart": "HRB",
      "company_name": "Reederei Jaegers GmbH",
      "company_seat": "Duisburg",
      "details": "10.07.2025 (Bekanntmachungsdatum)\n\nNordrhein-Westfalen Amtsgericht Duisburg HRB 8332\nRegisterbekanntmachung nach dem Umwandlungsgesetz 10.07.2025 (Eintragungsdatum)\n\nReederei Jaegers GmbH\nGesellschaft mit beschränkter Haftung\nDuisburg\n\nDie Gesellschaft hat Gläubigern, deren Forderungen vor dieser Bekanntmachung begründet worden sind, Sicherheit zu leisten, soweit sie nicht Befriedigung verlangen können, wenn sie sich binnen sechs Monaten zu diesem Zweck melden."
    },
    {
      "date": "2025-07-10",
      "id": "115402",
      "original_text": "Sonstige Registerbekanntmachung\nNordrhein-Westfalen Amtsgericht Essen HRB 3151\nTief- und Rohrleitungsbau Weymann Gesellschaft mit beschränkter Haftung – Essen",
      "type": "Sonstige Registerbekanntmachung",
      "state": "Nordrhein-Westfalen",
      "amtsgericht": "Amtsgericht Essen",
      "registernummer": "HRB 3151",
      "registerart": "HRB",
      "company_name": "Tief- und Rohrleitungsbau Weymann Gesellschaft mit beschränkter Haftung",
      "company_seat": "Essen",
      "details": "10.07.2025 (Bekanntmachungsdatum)\n\nNordrhein-Westfalen Amtsgericht Essen HRB 3151\nSonstige Registerbekanntmachung 10.07.2025 (Eintragungsdatum)\n\nTief- und Rohrleitungsbau Weymann Gesellschaft mit beschränkter Haftung\nGesellschaft mit beschränkter Haftung\nEssen\n\nAls nicht eingetragen wird veröffentlicht: Den Gläubigern der Gesellschaft, deren Forderungen begründet worden sind bevor die Eintragung der Beendigung des Gewinnabführungsvertrages  in das Handelsregister nach § 10 des Handelsgesetzbuches als bekanntgemacht gilt, hat der andere Vertragsteil Sicherheit zu leisten, wenn sie sich binnen sechs Monaten nach der Bekanntmachung der Eintragung zu diesem Zweck bei ihm melden."
    },
    {
      "date": "2025-07-10",
      "id": "115403",
      "original_text": "Registerbekanntmachung nach dem Umwandlungsgesetz\nNordrhein-Westfalen Amtsgericht Duisburg HRB 33654\nVan Leeuwen Distribution International GmbH – Duisburg",
      "type": "Registerbekanntmachung nach dem Umwandlungsgesetz",
      "state": "Nordrhein-Westfalen",
      "amtsgericht": "Amtsgericht Duisburg",
      "registernummer": "HRB 33654",
      "registerart": "HRB",
      "company_name": "Van Leeuwen Distribution International GmbH",
      "company_seat": "Duisburg",
      "details": "10.07.2025 (Bekanntmachungsdatum)\n\nNordrhein-Westfalen Amtsgericht Duisburg HRB 33654\nRegisterbekanntmachung nach dem Umwandlungsgesetz 10.07.2025 (Eintragungsdatum)\n\nVan Leeuwen Distribution International GmbH\nGesellschaft mit beschränkter Haftung\nDuisburg\n\nDie Gesellschaft hat Gläubigern, deren Forderungen vor dieser Bekanntmachung begründet worden sind, Sicherheit zu leisten, soweit sie nicht Befriedigung verlangen können, wenn sie sich binnen sechs Monaten zu diesem Zweck melden."
    },
    {
      "date": "2025-07-10",
      "id": "115404",
      "original_text": "Löschungsankündigung\nNordrhein-Westfalen Amtsgericht Mönchengladbach HRA 5032\nWilhelm Güsken Eisengießerei GmbH & Co. KG. – Viersen",
      "type": "Löschungsankündigung",
      "state": "Nordrhein-Westfalen",
      "amtsgericht": "Amtsgericht Mönchengladbach",
      "registernummer": "HRA 5032",
      "registerart": "HRA",
      "company_name": "Wilhelm Güsken Eisengießerei GmbH & Co. KG.",
      "company_seat": "Viersen",
      "details": "10.07.2025 (Bekanntmachungsdatum)\n\nNordrhein-Westfalen Amtsgericht Mönchengladbach HRA 5032\nLöschungsankündigung 10.07.2025 (Eintragungsdatum)\n\nWilhelm Güsken Eisengießerei GmbH & Co. KG.\nKommanditgesellschaft\nViersen\n\nDas Registergericht beabsichtigt die Firma von Amts wegen nach § 394 FamFG zu löschen. Die Frist zur Erhebung eines Widerspruchs ist auf drei Monate festgesetzt."
    },
    {
      "date": "2025-07-10",
      "id": "115405",
      "original_text": "Registerbekanntmachung nach dem Umwandlungsgesetz\nNordrhein-Westfalen Amtsgericht Köln HRA 37341\nAppycron Interactive e.K. – Köln",
      "type": "Registerbekanntmachung nach dem Umwandlungsgesetz",
      "state": "Nordrhein-Westfalen",
      "amtsgericht": "Amtsgericht Köln",
      "registernummer": "HRA 37341",
      "registerart": "HRA",
      "company_name": "Appycron Interactive e.K.",
      "company_seat": "Köln",
      "details": "10.07.2025 (Bekanntmachungsdatum)\n\nNordrhein-Westfalen Amtsgericht Köln HRA 37341\nRegisterbekanntmachung nach dem Umwandlungsgesetz 10.07.2025 (Eintragungsdatum)\n\nAppycron Interactive e.K.\nEinzelkaufmann / Einzelkauffrau\nKöln\n\nDen Gläubigern der an der Verschmelzung beteiligten Rechtsträger ist, wenn sie binnen sechs Monaten nach dem Tag, an dem die Eintragung der Verschmelzung in das Register des Sitzes desjenigen Rechtsträgers, dessen Gläubiger sie sind, nach § 19 Absatz 3 UmwG als bekanntgemacht gilt, ihren Anspruch nach Grund und Höhe schriftlich anmelden, Sicherheit zu leisten, soweit sie nicht Befriedigung verlangen können. Dieses Recht steht den Gläubigern jedoch nur zu, wenn sie glaubhaft machen, dass durch die Verschmelzung die Erfüllung ihrer Forderung gefährdet wird."
    },
    {
      "date": "2025-07-10",
      "id": "115406",
      "original_text": "Registerbekanntmachung nach dem Umwandlungsgesetz\nNordrhein-Westfalen Amtsgericht Mönchengladbach HRB 1288\nH. Schalm GmbH – Mönchengladbach",
      "type": "Registerbekanntmachung nach dem Umwandlungsgesetz",
      "state": "Nordrhein-Westfalen",
      "amtsgericht": "Amtsgericht Mönchengladbach",
      "registernummer": "HRB 1288",
      "registerart": "HRB",
      "company_name": "H. Schalm GmbH",
      "company_seat": "Mönchengladbach",
      "details": "10.07.2025 (Bekanntmachungsdatum)\n\nNordrhein-Westfalen Amtsgericht Mönchengladbach HRB 1288\nRegisterbekanntmachung nach dem Umwandlungsgesetz 10.07.2025 (Eintragungsdatum)\n\nH. Schalm GmbH\nGesellschaft mit beschränkter Haftung\nMönchengladbach\n\nDen Gläubigern der an der Verschmelzung beteiligten Rechtsträger ist, wenn sie binnen sechs Monaten nach dem Tag, an dem die Eintragung der Verschmelzung in das Register des Sitzes desjenigen Rechtsträgers, dessen Gläubiger sie sind, nach § 19 Absatz 3 UmwG als bekanntgemacht gilt, ihren Anspruch nach Grund und Höhe schriftlich anmelden, Sicherheit zu leisten, soweit sie nicht Befriedigung verlangen können. Dieses Recht steht den Gläubigern jedoch nur zu, wenn sie glaubhaft machen, dass durch die Verschmelzung die Erfüllung ihrer Forderung gefährdet wird."
    },
    {
      "date": "2025-07-10",
      "id": "115407",
      "original_text": "Löschungsankündigung\nNordrhein-Westfalen Amtsgericht Köln HRB 119444\nED Trading&Sales GmbH – Köln",
      "type": "Löschungsankündigung",
      "state": "Nordrhein-Westfalen",
      "amtsgericht": "Amtsgericht Köln",
      "registernummer": "HRB 119444",
      "registerart": "HRB",
      "company_name": "ED Trading&Sales GmbH",
      "company_seat": "Köln",
      "details": "10.07.2025 (Bekanntmachungsdatum)\n\nNordrhein-Westfalen Amtsgericht Köln HRB 119444\nLöschungsankündigung\n\nED Trading&Sales GmbH\nGesellschaft mit beschränkter Haftung\nKöln\n\nDas Registergericht beabsichtigt die Gesellschaft von Amts wegen nach § 394 FamFG zu löschen. Die Frist zur Erhebung eines Widerspruchs ist auf einen Monat festgesetzt."
    },
    {
      "date": "2025-07-10",
      "id": "115408",
      "original_text": "Löschungsankündigung\nNordrhein-Westfalen Amtsgericht Wuppertal HRB 5312\nBünger - Holding GmbH – Wuppertal",
      "type": "Löschungsankündigung",
      "state": "Nordrhein-Westfalen",
      "amtsgericht": "Amtsgericht Wuppertal",
      "registernummer": "HRB 5312",
      "registerart": "HRB",
      "company_name": "Bünger - Holding GmbH",
      "company_seat": "Wuppertal",
      "details": "10.07.2025 (Bekanntmachungsdatum)\n\nNordrhein-Westfalen Amtsgericht Wuppertal HRB 5312\nLöschungsankündigung\n\nBünger - Holding GmbH\nGesellschaft mit beschränkter Haftung\nWuppertal\n\nDas Registergericht beabsichtigt die Gesellschaft von Amts wegen nach § 394 FamFG zu löschen. Die Frist zur Erhebung eines Widerspruchs ist auf einen Monat festgesetzt."
    },
    {
      "date": "2025-07-10",
      "id": "115409",
      "original_text": "Einreichung neuer Dokumente\nNordrhein-Westfalen Amtsgericht Bielefeld HRB 7478\nEinrichtungspartnerring VME Verwaltungsgesellschaft mbH – Bielefeld",
      "type": "Einreichung neuer Dokumente",
      "state": "Nordrhein-Westfalen",
      "amtsgericht": "Amtsgericht Bielefeld",
      "registernummer": "HRB 7478",
      "registerart": "HRB",
      "company_name": "Einrichtungspartnerring VME Verwaltungsgesellschaft mbH",
      "company_seat": "Bielefeld",
      "details": "10.07.2025 (Bekanntmachungsdatum)\n\nNordrhein-Westfalen Amtsgericht Bielefeld HRB 7478\nEinreichung neuer Dokumente 10.07.2025 (Eintragungsdatum)\n\nEinrichtungspartnerring VME Verwaltungsgesellschaft mbH\nGesellschaft mit beschränkter Haftung\nBielefeld\n\nDem Registergericht ist eine neue Liste der Mitglieder des Aufsichtsrates eingereicht worden."
    },
    {
      "date": "2025-07-10",
      "id": "115410",
      "original_text": "Einreichung neuer Dokumente\nNordrhein-Westfalen Amtsgericht Köln HRB 112841\nINU - Innovative University AG – Köln",
      "type": "Einreichung neuer Dokumente",
      "state": "Nordrhein-Westfalen",
      "amtsgericht": "Amtsgericht Köln",
      "registernummer": "HRB 112841",
      "registerart": "HRB",
      "company_name": "INU - Innovative University AG",
      "company_seat": "Köln",
      "details": "10.07.2025 (Bekanntmachungsdatum)\n\nNordrhein-Westfalen Amtsgericht Köln HRB 112841\nEinreichung neuer Dokumente\n\nINU - Innovative University AG\nAktiengesellschaft\nKöln\n\nDem Registergericht ist eine Liste der Mitglieder des Aufsichtsrates eingereicht worden."
    },
    {
      "date": "2025-07-10",
      "id": "115411",
      "original_text": "Registerbekanntmachung nach dem Umwandlungsgesetz\nNordrhein-Westfalen Amtsgericht Mönchengladbach HRB 1288\nH. Schalm GmbH – Mönchengladbach",
      "type": "Registerbekanntmachung nach dem Umwandlungsgesetz",
      "state": "Nordrhein-Westfalen",
      "amtsgericht": "Amtsgericht Mönchengladbach",
      "registernummer": "HRB 1288",
      "registerart": "HRB",
      "company_name": "H. Schalm GmbH",
      "company_seat": "Mönchengladbach",
      "details": "10.07.2025 (Bekanntmachungsdatum)\n\nNordrhein-Westfalen Amtsgericht Mönchengladbach HRB 1288\nRegisterbekanntmachung nach dem Umwandlungsgesetz 10.07.2025 (Eintragungsdatum)\n\nH. Schalm GmbH\nGesellschaft mit beschränkter Haftung\nMönchengladbach\n\nDen Gläubigern der an der Verschmelzung beteiligten Rechtsträger ist, wenn sie binnen sechs Monaten nach dem Tag, an dem die Eintragung der Verschmelzung in das Register des Sitzes desjenigen Rechtsträgers, dessen Gläubiger sie sind, nach § 19 Absatz 3 UmwG als bekanntgemacht gilt, ihren Anspruch nach Grund und Höhe schriftlich anmelden, Sicherheit zu leisten, soweit sie nicht Befriedigung verlangen können. Dieses Recht steht den Gläubigern jedoch nur zu, wenn sie glaubhaft machen, dass durch die Verschmelzung die Erfüllung ihrer Forderung gefährdet wird."
    },
    {
      "date": "2025-07-10",
      "id": "115412",
      "original_text": "Löschungsankündigung\nNordrhein-Westfalen Amtsgericht Dortmund HRA 18679\nUBS universal Bauservice UG (haftungsbeschränkt) & Co. KG – Dortmund",
      "type": "Löschungsankündigung",
      "state": "Nordrhein-Westfalen",
      "amtsgericht": "Amtsgericht Dortmund",
      "registernummer": "HRA 18679",
      "registerart": "HRA",
      "company_name": "UBS universal Bauservice UG (haftungsbeschränkt) & Co. KG",
      "company_seat": "Dortmund",
      "details": "10.07.2025 (Bekanntmachungsdatum)\n\nNordrhein-Westfalen Amtsgericht Dortmund HRA 18679\nLöschungsankündigung\n\nUBS universal Bauservice UG (haftungsbeschränkt) & Co. KG\nKommanditgesellschaft\nDortmund\n\nDas Registergericht beabsichtigt die Firma von Amts wegen nach § 394 FamFG zu löschen. Die Frist zur Erhebung eines Widerspruchs ist auf zwei Monate festgesetzt."
    },
    {
      "date": "2025-07-10",
      "id": "115413",
      "original_text": "Registerbekanntmachung nach dem Umwandlungsgesetz\nNordrhein-Westfalen Amtsgericht Mönchengladbach HRB 11660\nIsoliertechnik Schalm GmbH – Mönchengladbach",
      "type": "Registerbekanntmachung nach dem Umwandlungsgesetz",
      "state": "Nordrhein-Westfalen",
      "amtsgericht": "Amtsgericht Mönchengladbach",
      "registernummer": "HRB 11660",
      "registerart": "HRB",
      "company_name": "Isoliertechnik Schalm GmbH",
      "company_seat": "Mönchengladbach",
      "details": "10.07.2025 (Bekanntmachungsdatum)\n\nNordrhein-Westfalen Amtsgericht Mönchengladbach HRB 11660\nRegisterbekanntmachung nach dem Umwandlungsgesetz 10.07.2025 (Eintragungsdatum)\n\nIsoliertechnik Schalm GmbH\nGesellschaft mit beschränkter Haftung\nMönchengladbach\n\nDen Gläubigern der an der Verschmelzung beteiligten Rechtsträger ist, wenn sie binnen sechs Monaten nach dem Tag, an dem die Eintragung der Verschmelzung in das Register des Sitzes desjenigen Rechtsträgers, dessen Gläubiger sie sind, nach § 19 Absatz 3 UmwG als bekanntgemacht gilt, ihren Anspruch nach Grund und Höhe schriftlich anmelden, Sicherheit zu leisten, soweit sie nicht Befriedigung verlangen können. Dieses Recht steht den Gläubigern jedoch nur zu, wenn sie glaubhaft machen, dass durch die Verschmelzung die Erfüllung ihrer Forderung gefährdet wird."
    },
    {
      "date": "2025-07-10",
      "id": "115414",
      "original_text": "Registerbekanntmachung nach dem Umwandlungsgesetz\nNordrhein-Westfalen Amtsgericht Düsseldorf HRB 32463\nArenberg Beteiligungs GmbH – Düsseldorf",
      "type": "Registerbekanntmachung nach dem Umwandlungsgesetz",
      "state": "Nordrhein-Westfalen",
      "amtsgericht": "Amtsgericht Düsseldorf",
      "registernummer": "HRB 32463",
      "registerart": "HRB",
      "company_name": "Arenberg Beteiligungs GmbH",
      "company_seat": "Düsseldorf",
      "details": "10.07.2025 (Bekanntmachungsdatum)\n\nNordrhein-Westfalen Amtsgericht Düsseldorf HRB 32463\nRegisterbekanntmachung nach dem Umwandlungsgesetz 10.07.2025 (Eintragungsdatum)\n\nArenberg Beteiligungs GmbH\nGesellschaft mit beschränkter Haftung\nDüsseldorf\n\nDen Gläubigern der an der Verschmelzung beteiligten Rechtsträger ist, wenn sie binnen sechs Monaten nach dem Tag, an dem die Eintragung der Verschmelzung in das Register des Sitzes desjenigen Rechtsträgers, dessen Gläubiger sie sind, nach § 19 Absatz 3 UmwG als bekanntgemacht gilt, ihren Anspruch nach Grund und Höhe schriftlich anmelden, Sicherheit zu leisten, soweit sie nicht Befriedigung verlangen können. Dieses Recht steht den Gläubigern jedoch nur zu, wenn sie glaubhaft machen, dass durch die Verschmelzung die Erfüllung ihrer Forderung gefährdet wird."
    },
    {
      "date": "2025-07-10",
      "id": "115415",
      "original_text": "Löschungsankündigung\nNordrhein-Westfalen Amtsgericht Wuppertal HRB 7197\nImmobilienverwaltung Müller & Purpur GmbH – Wuppertal",
      "type": "Löschungsankündigung",
      "state": "Nordrhein-Westfalen",
      "amtsgericht": "Amtsgericht Wuppertal",
      "registernummer": "HRB 7197",
      "registerart": "HRB",
      "company_name": "Immobilienverwaltung Müller & Purpur GmbH",
      "company_seat": "Wuppertal",
      "details": "10.07.2025 (Bekanntmachungsdatum)\n\nNordrhein-Westfalen Amtsgericht Wuppertal HRB 7197\nLöschungsankündigung\n\nImmobilienverwaltung Müller & Purpur GmbH\nGesellschaft mit beschränkter Haftung\nWuppertal\n\nDas Registergericht beabsichtigt die Gesellschaft von Amts wegen nach § 394 FamFG zu löschen. Die Frist zur Erhebung eines Widerspruchs ist auf einen Monat festgesetzt."
    },
    {
      "date": "2025-07-10",
      "id": "115416",
      "original_text": "Löschungsankündigung\nNordrhein-Westfalen Amtsgericht Gelsenkirchen HRB 15493\nVIA Bau Hoch- und Tief GmbH – Gelsenkirchen",
      "type": "Löschungsankündigung",
      "state": "Nordrhein-Westfalen",
      "amtsgericht": "Amtsgericht Gelsenkirchen",
      "registernummer": "HRB 15493",
      "registerart": "HRB",
      "company_name": "VIA Bau Hoch- und Tief GmbH",
      "company_seat": "Gelsenkirchen",
      "details": "10.07.2025 (Bekanntmachungsdatum)\n\nNordrhein-Westfalen Amtsgericht Gelsenkirchen HRB 15493\nLöschungsankündigung\n\nVIA Bau Hoch- und Tief GmbH\nGesellschaft mit beschränkter Haftung\nGelsenkirchen\n\nDas Gericht beabsichtigt, die Gesellschaft VIA Bau Hoch- und Tief GmbH mit Sitz in Gelsenkirchen, HRB 15493 Amtsgericht Gelsenkirchen, wegen Vermögenslosigkeit zu löschen.\n\nHiermit wird denjenigen, die an der Unterlassung der Löschung ein berechtigtes Interesse haben, gem. § 394 Abs. 2 FamFG Gelegenheit gegeben, gegen dieses Vorhaben binnen eines Monats nach dieser Bekanntmachung Widerspruch einzulegen. Der Widerspruch kann schriftlich oder zu Protokoll der Geschäftsstelle erhoben werden."
    },
    {
      "date": "2025-07-10",
      "id": "115417",
      "original_text": "Registerbekanntmachung nach dem Umwandlungsgesetz\nNordrhein-Westfalen Amtsgericht Siegen HRA 10025\ntmd Malerbetrieb GmbH & Co. KG – Siegen",
      "type": "Registerbekanntmachung nach dem Umwandlungsgesetz",
      "state": "Nordrhein-Westfalen",
      "amtsgericht": "Amtsgericht Siegen",
      "registernummer": "HRA 10025",
      "registerart": "HRA",
      "company_name": "tmd Malerbetrieb GmbH & Co. KG",
      "company_seat": "Siegen",
      "details": "10.07.2025 (Bekanntmachungsdatum)\n\nNordrhein-Westfalen Amtsgericht Siegen HRA 10025\nRegisterbekanntmachung nach dem Umwandlungsgesetz 10.07.2025 (Eintragungsdatum)\n\ntmd Malerbetrieb GmbH & Co. KG\nKommanditgesellschaft\nSiegen\n\nDen Gläubigern der an der Ausgliederung beteiligten Rechtsträger ist, wenn sie binnen sechs Monaten nach dem Tag, an dem die Eintragung der Ausgliederung in das Register des Sitzes desjenigen Rechtsträgers, dessen Gläubiger sie sind, nach § 19 Absatz 3 UmwG als bekanntgemacht gilt, ihren Anspruch nach Grund und Höhe schriftlich anmelden, Sicherheit zu leisten, soweit sie nicht Befriedigung verlangen können. Dieses Recht steht den Gläubigern jedoch nur zu, wenn sie glaubhaft machen, dass durch die Ausgliederung die Erfüllung ihrer Forderung gefährdet wird."
    },
    {
      "date": "2025-07-10",
      "id": "115418",
      "original_text": "Registerbekanntmachung nach dem Umwandlungsgesetz\nNordrhein-Westfalen Amtsgericht Köln HRB 53482\nAusbildungsinitiative Rheinland GmbH – Leverkusen",
      "type": "Registerbekanntmachung nach dem Umwandlungsgesetz",
      "state": "Nordrhein-Westfalen",
      "amtsgericht": "Amtsgericht Köln",
      "registernummer": "HRB 53482",
      "registerart": "HRB",
      "company_name": "Ausbildungsinitiative Rheinland GmbH",
      "company_seat": "Leverkusen",
      "details": "10.07.2025 (Bekanntmachungsdatum)\n\nNordrhein-Westfalen Amtsgericht Köln HRB 53482\nRegisterbekanntmachung nach dem Umwandlungsgesetz 10.07.2025 (Eintragungsdatum)\n\nAusbildungsinitiative Rheinland GmbH\nGesellschaft mit beschränkter Haftung\nLeverkusen\n\nDen Gläubigern der an der Verschmelzung beteiligten Rechtsträger ist, wenn sie binnen sechs Monaten nach dem Tag, an dem die Eintragung der Verschmelzung in das Register des Sitzes desjenigen Rechtsträgers, dessen Gläubiger sie sind, nach § 19 Absatz 3 UmwG als bekanntgemacht gilt, ihren Anspruch nach Grund und Höhe schriftlich anmelden, Sicherheit zu leisten, soweit sie nicht Befriedigung verlangen können. Dieses Recht steht den Gläubigern jedoch nur zu, wenn sie glaubhaft machen, dass durch die Verschmelzung die Erfüllung ihrer Forderung gefährdet wird."
    },
    {
      "date": "2025-07-10",
      "id": "115419",
      "original_text": "Löschungsankündigung\nNordrhein-Westfalen Amtsgericht Mönchengladbach HRB 16010\nFarbflotte GmbH – Mönchengladbach",
      "type": "Löschungsankündigung",
      "state": "Nordrhein-Westfalen",
      "amtsgericht": "Amtsgericht Mönchengladbach",
      "registernummer": "HRB 16010",
      "registerart": "HRB",
      "company_name": "Farbflotte GmbH",
      "company_seat": "Mönchengladbach",
      "details": "10.07.2025 (Bekanntmachungsdatum)\n\nNordrhein-Westfalen Amtsgericht Mönchengladbach HRB 16010\nLöschungsankündigung 10.07.2025 (Eintragungsdatum)\n\nFarbflotte GmbH\nGesellschaft mit beschränkter Haftung\nMönchengladbach\n\nDas Registergericht beabsichtigt die Gesellschaft von Amts wegen nach § 394 FamFG zu löschen. Die Frist zur Erhebung eines Widerspruchs ist auf drei Monate festgesetzt."
    },
    {
      "date": "2025-07-10",
      "id": "115420",
      "original_text": "Einreichung neuer Dokumente\nNordrhein-Westfalen Amtsgericht Duisburg HRB 25\nFranz Haniel & Cie. GmbH – Duisburg",
      "type": "Einreichung neuer Dokumente",
      "state": "Nordrhein-Westfalen",
      "amtsgericht": "Amtsgericht Duisburg",
      "registernummer": "HRB 25",
      "registerart": "HRB",
      "company_name": "Franz Haniel & Cie. GmbH",
      "company_seat": "Duisburg",
      "details": "10.07.2025 (Bekanntmachungsdatum)\n\nNordrhein-Westfalen Amtsgericht Duisburg HRB 25\nEinreichung neuer Dokumente\n\nFranz Haniel & Cie. GmbH\nGesellschaft mit beschränkter Haftung\nDuisburg\n\nDem Registergericht ist eine neue Liste der Mitglieder des Aufsichtsrates eingereicht worden."
    },
    {
      "date": "2025-07-10",
      "id": "115421",
      "original_text": "Einreichung neuer Dokumente\nNordrhein-Westfalen Amtsgericht Münster HRB 1429\nWESTFLEISCH FINANZ AG – Münster",
      "type": "Einreichung neuer Dokumente",
      "state": "Nordrhein-Westfalen",
      "amtsgericht": "Amtsgericht Münster",
      "registernummer": "HRB 1429",
      "registerart": "HRB",
      "company_name": "WESTFLEISCH FINANZ AG",
      "company_seat": "Münster",
      "details": "10.07.2025 (Bekanntmachungsdatum)\n\nNordrhein-Westfalen Amtsgericht Münster HRB 1429\nEinreichung neuer Dokumente\n\nWESTFLEISCH FINANZ AG\nAktiengesellschaft\nMünster\n\nDem Registergericht ist eine neue Liste der Mitglieder des Aufsichtsrates eingereicht worden."
    },
    {
      "date": "2025-07-10",
      "id": "115422",
      "original_text": "Registerbekanntmachung nach dem Umwandlungsgesetz\nNordrhein-Westfalen Amtsgericht Köln HRB 80410\nRosebank AG – Köln",
      "type": "Registerbekanntmachung nach dem Umwandlungsgesetz",
      "state": "Nordrhein-Westfalen",
      "amtsgericht": "Amtsgericht Köln",
      "registernummer": "HRB 80410",
      "registerart": "HRB",
      "company_name": "Rosebank AG",
      "company_seat": "Köln",
      "details": "10.07.2025 (Bekanntmachungsdatum)\n\nNordrhein-Westfalen Amtsgericht Köln HRB 80410\nRegisterbekanntmachung nach dem Umwandlungsgesetz 10.07.2025 (Eintragungsdatum)\n\nRosebank AG\nAktiengesellschaft\nKöln\n\nDen Gläubigern der an der formwechselnden Umwandlung beteiligten Rechtsträger ist, wenn sie binnen sechs Monaten nach dem Tag, an dem die Eintragung der formwechselnden Umwandlung in das Register des Sitzes desjenigen Rechtsträgers, dessen Gläubiger sie sind, nach § 19 Absatz 3 UmwG als bekanntgemacht gilt, ihren Anspruch nach Grund und Höhe schriftlich anmelden, Sicherheit zu leisten, soweit sie nicht Befriedigung verlangen können. Dieses Recht steht den Gläubigern jedoch nur zu, wenn sie glaubhaft machen, dass durch die formwechselnden Umwandlung die Erfüllung ihrer Forderung gefährdet wird."
    },
    {
      "date": "2025-07-10",
      "id": "115423",
      "original_text": "Registerbekanntmachung nach dem Umwandlungsgesetz\nNordrhein-Westfalen Amtsgericht Duisburg HRB 14993\nBACKRING RHEIN-RUHR Gesellschaft mit beschränkter Haftung – Duisburg",
      "type": "Registerbekanntmachung nach dem Umwandlungsgesetz",
      "state": "Nordrhein-Westfalen",
      "amtsgericht": "Amtsgericht Duisburg",
      "registernummer": "HRB 14993",
      "registerart": "HRB",
      "company_name": "BACKRING RHEIN-RUHR Gesellschaft mit beschränkter Haftung",
      "company_seat": "Duisburg",
      "details": "10.07.2025 (Bekanntmachungsdatum)\n\nNordrhein-Westfalen Amtsgericht Duisburg HRB 14993\nRegisterbekanntmachung nach dem Umwandlungsgesetz 10.07.2025 (Eintragungsdatum)\n\nBACKRING RHEIN-RUHR Gesellschaft mit beschränkter Haftung\nGesellschaft mit beschränkter Haftung\nDuisburg\n\nDie Gesellschaft hat Gläubigern, deren Forderungen vor dieser Bekanntmachung begründet worden sind, Sicherheit zu leisten, soweit sie nicht Befriedigung verlangen können, wenn sie sich binnen sechs Monaten zu diesem Zweck melden."
    },
    {
      "date": "2025-07-10",
      "id": "115424",
      "original_text": "Löschungsankündigung\nNordrhein-Westfalen Amtsgericht Düsseldorf HRB 98689\nFOT Transport GmbH – Düsseldorf",
      "type": "Löschungsankündigung",
      "state": "Nordrhein-Westfalen",
      "amtsgericht": "Amtsgericht Düsseldorf",
      "registernummer": "HRB 98689",
      "registerart": "HRB",
      "company_name": "FOT Transport GmbH",
      "company_seat": "Düsseldorf",
      "details": "10.07.2025 (Bekanntmachungsdatum)\n\nNordrhein-Westfalen Amtsgericht Düsseldorf HRB 98689\nLöschungsankündigung\n\nFOT Transport GmbH\nGesellschaft mit beschränkter Haftung\nDüsseldorf\n\nDas Registergericht beabsichtigt die Gesellschaft von Amts wegen nach § 394 FamFG zu löschen. Die Frist zur Erhebung eines Widerspruchs ist auf 3 Wochen festgesetzt.\n\nRechtsbehelfsbelehrung:\nDas Widerspruchsrecht steht jedem zu, der an der Unterlassung der Löschung ein berechtigtes Interesse hat. Der Widerspruch ist bei dem Amtsgericht Düsseldorf -Registergericht-, Werdener Straße 1, 40227 Düsseldorf schriftlich in deutscher Sprache oder zur Niederschrift der Geschäftsstelle einzulegen. Der Widerspruch kann auch zur Niederschrift der Geschäftsstelle eines jeden Amtsgerichtes abgegeben werden. Die Einlegung ist auch durch Übertragung eines elektronischen Dokuments an die elektronische Poststelle des Gerichts möglich. Das elektronische Dokument muss für die Bearbeitung durch das Gericht geeignet und mit einer qualifizierten elektronischen Signatur der verantwortenden Person versehen sein oder von der verantwortenden Person signiert und auf einem sicheren Übermittlungsweg gemäß § 130a ZPO nach näherer Maßgabe der Verordnung über die technischen Rahmenbedingungen des elektronischen Rechtsverkehrs und über das besondere elektronische Behördenpostfach (BGBl. I, S.3803) eingereicht werden. Weitere Informationen erhalten Sie auf der Internetseite www.justiz.de.\nDer Widerspruch muss spätestens innerhalb der gesetzten Frist nach dem Datum der Bekanntmachung der Löschungsankündigung bei dem Amtsgericht - Registergericht - Düsseldorf eingegangen sein.  Dies gilt auch dann, wenn der Widerspruch zur Niederschrift der Geschäftsstelle eines anderen Amtsgerichtes abgegeben wurde. Die Frist beginnt mit dem Tage der Bekanntmachung der Löschungsankündigung in dem für die Bekanntmachung der Eintragungen in das Handelsregister bestimmten elektronischen Informations- und Kommunikationssystem nach § 10 des Handelsgesetzbuches. Fällt das Ende der Frist auf einen Sonntag, einen allgemeinen Feiertag oder Sonnabend, so endet die Frist mit Ablauf des nächsten Werktages.\nDer Widerspruch muss die Bezeichnung der angefochtenen Löschungsankündigung sowie die Erklärung enthalten, dass Widerspruch gegen diese Löschungsankündigung eingelegt wird. Er ist zu unterzeichnen und soll begründet werden."
    },
    {
      "date": "2025-07-10",
      "id": "115425",
      "original_text": "Registerbekanntmachung nach dem Umwandlungsgesetz\nNordrhein-Westfalen Amtsgericht Köln HRB 80860\nStröer Content Group GmbH – Köln",
      "type": "Registerbekanntmachung nach dem Umwandlungsgesetz",
      "state": "Nordrhein-Westfalen",
      "amtsgericht": "Amtsgericht Köln",
      "registernummer": "HRB 80860",
      "registerart": "HRB",
      "company_name": "Ströer Content Group GmbH",
      "company_seat": "Köln",
      "details": "10.07.2025 (Bekanntmachungsdatum)\n\nNordrhein-Westfalen Amtsgericht Köln HRB 80860\nRegisterbekanntmachung nach dem Umwandlungsgesetz 10.07.2025 (Eintragungsdatum)\n\nStröer Content Group GmbH\nGesellschaft mit beschränkter Haftung\nKöln\n\nDen Gläubigern der an der Verschmelzung beteiligten Rechtsträger ist, wenn sie binnen sechs Monaten nach dem Tag, an dem die Eintragung der Verschmelzung in das Register des Sitzes desjenigen Rechtsträgers, dessen Gläubiger sie sind, nach § 19 Absatz 3 UmwG als bekanntgemacht gilt, ihren Anspruch nach Grund und Höhe schriftlich anmelden, Sicherheit zu leisten, soweit sie nicht Befriedigung verlangen können. Dieses Recht steht den Gläubigern jedoch nur zu, wenn sie glaubhaft machen, dass durch die Verschmelzung die Erfüllung ihrer Forderung gefährdet wird."
    },
    {
      "date": "2025-07-10",
      "id": "115426",
      "original_text": "Löschungsankündigung\nNordrhein-Westfalen Amtsgericht Mönchengladbach HRA 5582\nLemon Gaststättenbetriebe GmbH & Co. KG – Viersen",
      "type": "Löschungsankündigung",
      "state": "Nordrhein-Westfalen",
      "amtsgericht": "Amtsgericht Mönchengladbach",
      "registernummer": "HRA 5582",
      "registerart": "HRA",
      "company_name": "Lemon Gaststättenbetriebe GmbH & Co. KG",
      "company_seat": "Viersen",
      "details": "10.07.2025 (Bekanntmachungsdatum)\n\nNordrhein-Westfalen Amtsgericht Mönchengladbach HRA 5582\nLöschungsankündigung 10.07.2025 (Eintragungsdatum)\n\nLemon Gaststättenbetriebe GmbH & Co. KG\nKommanditgesellschaft\nViersen\n\nDas Registergericht beabsichtigt die Firma von Amts wegen nach § 394 FamFG zu löschen. Die Frist zur Erhebung eines Widerspruchs ist auf drei Monate festgesetzt."
    },
    {
      "date": "2025-07-10",
      "id": "115427",
      "original_text": "Registerbekanntmachung nach dem Umwandlungsgesetz\nNordrhein-Westfalen Amtsgericht Duisburg HRB 14993\nBACKRING RHEIN-RUHR Gesellschaft mit beschränkter Haftung – Duisburg",
      "type": "Registerbekanntmachung nach dem Umwandlungsgesetz",
      "state": "Nordrhein-Westfalen",
      "amtsgericht": "Amtsgericht Duisburg",
      "registernummer": "HRB 14993",
      "registerart": "HRB",
      "company_name": "BACKRING RHEIN-RUHR Gesellschaft mit beschränkter Haftung",
      "company_seat": "Duisburg",
      "details": "10.07.2025 (Bekanntmachungsdatum)\n\nNordrhein-Westfalen Amtsgericht Duisburg HRB 14993\nRegisterbekanntmachung nach dem Umwandlungsgesetz 10.07.2025 (Eintragungsdatum)\n\nBACKRING RHEIN-RUHR Gesellschaft mit beschränkter Haftung\nGesellschaft mit beschränkter Haftung\nDuisburg\n\nDie Gesellschaft hat Gläubigern, deren Forderungen vor dieser Bekanntmachung begründet worden sind, Sicherheit zu leisten, soweit sie nicht Befriedigung verlangen können, wenn sie sich binnen sechs Monaten zu diesem Zweck melden."
    },
    {
      "date": "2025-07-10",
      "id": "115428",
      "original_text": "Löschungsankündigung\nNordrhein-Westfalen Amtsgericht Krefeld HRB 18698\nAgim's Car Service GmbH – Grefrath",
      "type": "Löschungsankündigung",
      "state": "Nordrhein-Westfalen",
      "amtsgericht": "Amtsgericht Krefeld",
      "registernummer": "HRB 18698",
      "registerart": "HRB",
      "company_name": "Agim's Car Service GmbH",
      "company_seat": "Grefrath",
      "details": "10.07.2025 (Bekanntmachungsdatum)\n\nNordrhein-Westfalen Amtsgericht Krefeld HRB 18698\nLöschungsankündigung\n\nAgim's Car Service GmbH\nGesellschaft mit beschränkter Haftung\nGrefrath\n\nDas Registergericht beabsichtigt die Gesellschaft von Amts wegen nach § 394 FamFG zu löschen. Die Frist zur Erhebung eines Widerspruchs ist auf einen Monat festgesetzt."
    },
    {
      "date": "2025-07-10",
      "id": "115429",
      "original_text": "Sonstige Registerbekanntmachung\nNordrhein-Westfalen Amtsgericht Mönchengladbach HRB 14840\nBabcock Support Services GmbH – Schwalmtal",
      "type": "Sonstige Registerbekanntmachung",
      "state": "Nordrhein-Westfalen",
      "amtsgericht": "Amtsgericht Mönchengladbach",
      "registernummer": "HRB 14840",
      "registerart": "HRB",
      "company_name": "Babcock Support Services GmbH",
      "company_seat": "Schwalmtal",
      "details": "10.07.2025 (Bekanntmachungsdatum)\n\nNordrhein-Westfalen Amtsgericht Mönchengladbach HRB 14840\nSonstige Registerbekanntmachung 10.07.2025 (Eintragungsdatum)\n\nBabcock Support Services GmbH\nGesellschaft mit beschränkter Haftung\nSchwalmtal\n\nAls nicht eingetragen wird veröffentlicht: Den Gläubigern der Gesellschaft, deren Forderungen begründet worden sind bevor die Eintragung der Beendigung des Beherrschungs- und Gewinnabführungsvertrages  in das Handelsregister nach § 10 des Handelsgesetzbuches als bekanntgemacht gilt, hat der andere Vertragsteil Sicherheit zu leisten, wenn sie sich binnen sechs Monaten nach der Bekanntmachung der Eintragung zu diesem Zweck bei ihm melden."
    },
    {
      "date": "2025-07-10",
      "id": "115430",
      "original_text": "Registerbekanntmachung nach dem Umwandlungsgesetz\nNordrhein-Westfalen Amtsgericht Arnsberg HRB 14394\nRV RET Holding GmbH – Wickede",
      "type": "Registerbekanntmachung nach dem Umwandlungsgesetz",
      "state": "Nordrhein-Westfalen",
      "amtsgericht": "Amtsgericht Arnsberg",
      "registernummer": "HRB 14394",
      "registerart": "HRB",
      "company_name": "RV RET Holding GmbH",
      "company_seat": "Wickede",
      "details": "10.07.2025 (Bekanntmachungsdatum)\n\nNordrhein-Westfalen Amtsgericht Arnsberg HRB 14394\nRegisterbekanntmachung nach dem Umwandlungsgesetz 10.07.2025 (Eintragungsdatum)\n\nRV RET Holding GmbH\nGesellschaft mit beschränkter Haftung\nWickede\n\nDen Gläubigern der an der formwechselnden Umwandlung beteiligten Rechtsträger ist, wenn sie binnen sechs Monaten nach dem Tag, an dem die Eintragung der formwechselnden Umwandlung in das Register des Sitzes desjenigen Rechtsträgers, dessen Gläubiger sie sind, nach § 19 Absatz 3 UmwG als bekanntgemacht gilt, ihren Anspruch nach Grund und Höhe schriftlich anmelden, Sicherheit zu leisten, soweit sie nicht Befriedigung verlangen können. Dieses Recht steht den Gläubigern jedoch nur zu, wenn sie glaubhaft machen, dass durch die formwechselnden Umwandlung die Erfüllung ihrer Forderung gefährdet wird."
    },
    {
      "date": "2025-07-10",
      "id": "115431",
      "original_text": "Löschungsankündigung\nNordrhein-Westfalen Amtsgericht Hagen HRB 9976\nVIVF GmbH – Hagen",
      "type": "Löschungsankündigung",
      "state": "Nordrhein-Westfalen",
      "amtsgericht": "Amtsgericht Hagen",
      "registernummer": "HRB 9976",
      "registerart": "HRB",
      "company_name": "VIVF GmbH",
      "company_seat": "Hagen",
      "details": "10.07.2025 (Bekanntmachungsdatum)\n\nNordrhein-Westfalen Amtsgericht Hagen HRB 9976\nLöschungsankündigung\n\nVIVF GmbH\nGesellschaft mit beschränkter Haftung\nHagen\n\nIn obiger Handelsregistersache wird bekannt gemacht:\nDas Registergericht beabsichtigt, die im Handelsregister eingetragene Gesellschaft gemäß § 394 I FamFG wegen Vermögenslosigkeit von Amts wegen zu löschen. Gegen diese Verfügung kann Widerspruch eingelegt werden. Die Frist zur Erhebung eines Widerspruchs gegen die beabsichtigte Löschung von Amts wegen ist auf drei Monate festgesetzt.\n\nRechtsbehelfsbelehrung:\nGegen diese Verfügung können Sie Widerspruch einlegen.\n\nDer Widerspruch ist bei dem Amtsgericht Hagen, Heinitzstraße 42, 58097 Hagen schriftlich in deutscher Sprache oder zur Niederschrift der Geschäftsstelle einzulegen. Der Widerspruch kann auch zur Niederschrift der Geschäftsstelle eines jeden Amtsgerichts abgegeben werden.\n\nDer Widerspruch muss spätestens innerhalb der gesetzten Frist bei dem Amtsgericht Hagen eingegangen sein. Dies gilt auch dann, wenn der Widerspruch zur Geschäftsstelle eines anderen Amtsgerichtes abgegeben wurde. Die Frist beginnt mit der Veröffentlichung. Fällt das Ende der Frist auf einen Sonntag, einen allgemeinen Feiertag oder Sonnabend, so endet die Frist mit Ablauf des nächsten Werktages.\n\nDer Widerspruch muss die Bezeichnung der angefochtenen Verfügung sowie die Erklärung erhalten, dass Widerspruch gegen diese Verfügung eingelegt wird. Er ist zu unterzeichnen und soll begründet werden."
    },
    {
      "date": "2025-07-10",
      "id": "115432",
      "original_text": "Einreichung neuer Dokumente\nNordrhein-Westfalen Amtsgericht Köln HRB 107212\nBinect AG – Köln",
      "type": "Einreichung neuer Dokumente",
      "state": "Nordrhein-Westfalen",
      "amtsgericht": "Amtsgericht Köln",
      "registernummer": "HRB 107212",
      "registerart": "HRB",
      "company_name": "Binect AG",
      "company_seat": "Köln",
      "details": "10.07.2025 (Bekanntmachungsdatum)\n\nNordrhein-Westfalen Amtsgericht Köln HRB 107212\nEinreichung neuer Dokumente\n\nBinect AG\nAktiengesellschaft\nKöln\n\nDem Registergericht ist eine Liste der Mitglieder des Aufsichtsrates eingereicht worden."
    },
    {
      "date": "2025-07-10",
      "id": "115433",
      "original_text": "Registerbekanntmachung nach dem Umwandlungsgesetz\nNordrhein-Westfalen Amtsgericht Lemgo HRB 3390\nEcclesia Gruppe Vorsorgemanagement GmbH – Detmold",
      "type": "Registerbekanntmachung nach dem Umwandlungsgesetz",
      "state": "Nordrhein-Westfalen",
      "amtsgericht": "Amtsgericht Lemgo",
      "registernummer": "HRB 3390",
      "registerart": "HRB",
      "company_name": "Ecclesia Gruppe Vorsorgemanagement GmbH",
      "company_seat": "Detmold",
      "details": "10.07.2025 (Bekanntmachungsdatum)\n\nNordrhein-Westfalen Amtsgericht Lemgo HRB 3390\nRegisterbekanntmachung nach dem Umwandlungsgesetz 10.07.2025 (Eintragungsdatum)\n\nEcclesia Gruppe Vorsorgemanagement GmbH\nGesellschaft mit beschränkter Haftung\nDetmold\n\nDen Gläubigern der an der Verschmelzung beteiligten Rechtsträger ist, wenn sie binnen sechs Monaten nach dem Tag, an dem die Eintragung der Verschmelzung in das Register des Sitzes desjenigen Rechtsträgers, dessen Gläubiger sie sind, nach § 19 Absatz 3 UmwG als bekanntgemacht gilt, ihren Anspruch nach Grund und Höhe schriftlich anmelden, Sicherheit zu leisten, soweit sie nicht Befriedigung verlangen können. Dieses Recht steht den Gläubigern jedoch nur zu, wenn sie glaubhaft machen, dass durch die Verschmelzung die Erfüllung ihrer Forderung gefährdet wird."
    },
    {
      "date": "2025-07-10",
      "id": "115434",
      "original_text": "Einreichung neuer Dokumente\nNordrhein-Westfalen Amtsgericht Münster HRB 9404\nStädtische Wirtschaftsbetriebe Telgte Gesellschaft mit beschränkter Haftung – Telgte",
      "type": "Einreichung neuer Dokumente",
      "state": "Nordrhein-Westfalen",
      "amtsgericht": "Amtsgericht Münster",
      "registernummer": "HRB 9404",
      "registerart": "HRB",
      "company_name": "Städtische Wirtschaftsbetriebe Telgte Gesellschaft mit beschränkter Haftung",
      "company_seat": "Telgte",
      "details": "10.07.2025 (Bekanntmachungsdatum)\n\nNordrhein-Westfalen Amtsgericht Münster HRB 9404\nEinreichung neuer Dokumente 10.07.2025 (Eintragungsdatum)\n\nStädtische Wirtschaftsbetriebe Telgte Gesellschaft mit beschränkter Haftung\nGesellschaft mit beschränkter Haftung\nTelgte\n\nDem Registergericht ist eine neue Liste der Mitglieder des Aufsichtsrates eingereicht worden."
    },
    {
      "date": "2025-07-10",
      "id": "115435",
      "original_text": "Einreichung neuer Dokumente\nNordrhein-Westfalen Amtsgericht Münster HRB 22125\nProvinzial Next Aktiengesellschaft – Münster",
      "type": "Einreichung neuer Dokumente",
      "state": "Nordrhein-Westfalen",
      "amtsgericht": "Amtsgericht Münster",
      "registernummer": "HRB 22125",
      "registerart": "HRB",
      "company_name": "Provinzial Next Aktiengesellschaft",
      "company_seat": "Münster",
      "details": "10.07.2025 (Bekanntmachungsdatum)\n\nNordrhein-Westfalen Amtsgericht Münster HRB 22125\nEinreichung neuer Dokumente\n\nProvinzial Next Aktiengesellschaft\nAktiengesellschaft\nMünster\n\nDem Registergericht ist eine neue Liste der Mitglieder des Aufsichtsrates eingereicht worden."
    },
    {
      "date": "2025-07-10",
      "id": "115436",
      "original_text": "Registerbekanntmachung nach dem Umwandlungsgesetz\nThüringen Amtsgericht Jena HRB 502085\nBrauhaushotel GmbH – Arnstadt",
      "type": "Registerbekanntmachung nach dem Umwandlungsgesetz",
      "state": "Thüringen",
      "amtsgericht": "Amtsgericht Jena",
      "registernummer": "HRB 502085",
      "registerart": "HRB",
      "company_name": "Brauhaushotel GmbH",
      "company_seat": "Arnstadt",
      "details": "10.07.2025 (Bekanntmachungsdatum)\n\nThüringen Amtsgericht Jena HRB 502085\nRegisterbekanntmachung nach dem Umwandlungsgesetz 10.07.2025 (Eintragungsdatum)\n\nBrauhaushotel GmbH\nGesellschaft mit beschränkter Haftung\nArnstadt\n\nNicht eingetragen: Den Gläubigern der an der Verschmelzung beteiligten Rechtsträger, ist wenn sie binnen sechs Monaten nach dem Tag, an dem die Eintragung der Verschmelzung in das Register des Sitzes desjenigen Rechtsträgers, dessen Gläubiger sie sind,  nach § 19 Abs. 3 UmwG als bekanntgemacht gilt, ihren Anspruch nach Grund und Höhe schriftlich anmelden, Sicherheit zu leisten, soweit sie nicht Befriedigung verlangen können. Dieses Recht steht ihnen jedoch nur zu, wenn sie glaubhaft machen, daß durch die Verschmelzung die Erfüllung ihrer Forderung gefährdet wird."
    },
    {
      "date": "2025-07-10",
      "id": "115437",
      "original_text": "Registerbekanntmachung nach dem Umwandlungsgesetz\nThüringen Amtsgericht Jena HRB 109090\nHotelpark Stadtbrauerei Arnstadt GmbH – Arnstadt",
      "type": "Registerbekanntmachung nach dem Umwandlungsgesetz",
      "state": "Thüringen",
      "amtsgericht": "Amtsgericht Jena",
      "registernummer": "HRB 109090",
      "registerart": "HRB",
      "company_name": "Hotelpark Stadtbrauerei Arnstadt GmbH",
      "company_seat": "Arnstadt",
      "details": "10.07.2025 (Bekanntmachungsdatum)\n\nThüringen Amtsgericht Jena HRB 109090\nRegisterbekanntmachung nach dem Umwandlungsgesetz 10.07.2025 (Eintragungsdatum)\n\nHotelpark Stadtbrauerei Arnstadt GmbH\nGesellschaft mit beschränkter Haftung\nArnstadt\n\nNicht eingetragen: Den Gläubigern der an der Verschmelzung beteiligten Rechtsträger, ist wenn sie binnen sechs Monaten nach dem Tag, an dem die Eintragung der Verschmelzung in das Register des Sitzes desjenigen Rechtsträgers, dessen Gläubiger sie sind,  nach § 19 Abs. 3 UmwG als bekanntgemacht gilt, ihren Anspruch nach Grund und Höhe schriftlich anmelden, Sicherheit zu leisten, soweit sie nicht Befriedigung verlangen können. Dieses Recht steht ihnen jedoch nur zu, wenn sie glaubhaft machen, daß durch die Verschmelzung die Erfüllung ihrer Forderung gefährdet wird."
    },
    {
      "date": "2025-07-10",
      "id": "115438",
      "original_text": "Registerbekanntmachung nach dem Umwandlungsgesetz\nThüringen Amtsgericht Jena HRB 109090\nHotelpark Stadtbrauerei Arnstadt GmbH – Arnstadt",
      "type": "Registerbekanntmachung nach dem Umwandlungsgesetz",
      "state": "Thüringen",
      "amtsgericht": "Amtsgericht Jena",
      "registernummer": "HRB 109090",
      "registerart": "HRB",
      "company_name": "Hotelpark Stadtbrauerei Arnstadt GmbH",
      "company_seat": "Arnstadt",
      "details": "10.07.2025 (Bekanntmachungsdatum)\n\nThüringen Amtsgericht Jena HRB 109090\nRegisterbekanntmachung nach dem Umwandlungsgesetz 10.07.2025 (Eintragungsdatum)\n\nHotelpark Stadtbrauerei Arnstadt GmbH\nGesellschaft mit beschränkter Haftung\nArnstadt\n\nNicht eingetragen: Den Gläubigern der an der Verschmelzung beteiligten Rechtsträger, ist wenn sie binnen sechs Monaten nach dem Tag, an dem die Eintragung der Verschmelzung in das Register des Sitzes desjenigen Rechtsträgers, dessen Gläubiger sie sind,  nach § 19 Abs. 3 UmwG als bekanntgemacht gilt, ihren Anspruch nach Grund und Höhe schriftlich anmelden, Sicherheit zu leisten, soweit sie nicht Befriedigung verlangen können. Dieses Recht steht ihnen jedoch nur zu, wenn sie glaubhaft machen, daß durch die Verschmelzung die Erfüllung ihrer Forderung gefährdet wird."
    },
    {
      "date": "2025-07-10",
      "id": "115439",
      "original_text": "Registerbekanntmachung nach dem Umwandlungsgesetz\nHessen Amtsgericht Frankfurt am Main HRB 116113\nSchulatus GmbH – Frankfurt am Main",
      "type": "Registerbekanntmachung nach dem Umwandlungsgesetz",
      "state": "Hessen",
      "amtsgericht": "Amtsgericht Frankfurt am Main",
      "registernummer": "HRB 116113",
      "registerart": "HRB",
      "company_name": "Schulatus GmbH",
      "company_seat": "Frankfurt am Main",
      "details": "10.07.2025 (Bekanntmachungsdatum)\n\nHessen Amtsgericht Frankfurt am Main HRB 116113\nRegisterbekanntmachung nach dem Umwandlungsgesetz 10.07.2025 (Eintragungsdatum)\n\nSchulatus GmbH\nGesellschaft mit beschränkter Haftung\nFrankfurt am Main\n\nDen Gläubigern der an der Verschmelzung beteiligten Rechtsträger ist, wenn sie binnen sechs Monaten nach dem Tag, an dem die Eintragung der Verschmelzung in das Register des Sitzes desjenigen Rechtsträgers, dessen Gläubiger sie sind, nach § 19 Absatz 3 UmwG bekannt gemacht worden ist, ihren Anspruch nach Grund und Höhe schriftlich anmelden, Sicherheit zu leisten, soweit sie nicht Befriedigung verlangen können. Dieses Recht steht den Gläubigern jedoch nur zu, wenn sie glaubhaft machen, dass durch die Verschmelzung die Erfüllung ihrer Forderung gefährdet wird."
    },
    {
      "date": "2025-07-10",
      "id": "115440",
      "original_text": "Einreichung neuer Dokumente\nHessen Amtsgericht Darmstadt HRB 94927\nCoty Beauty Germany GmbH – Darmstadt",
      "type": "Einreichung neuer Dokumente",
      "state": "Hessen",
      "amtsgericht": "Amtsgericht Darmstadt",
      "registernummer": "HRB 94927",
      "registerart": "HRB",
      "company_name": "Coty Beauty Germany GmbH",
      "company_seat": "Darmstadt",
      "details": "10.07.2025 (Bekanntmachungsdatum)\n\nHessen Amtsgericht Darmstadt HRB 94927\nEinreichung neuer Dokumente 10.07.2025 (Eintragungsdatum)\n\nCoty Beauty Germany GmbH\nGesellschaft mit beschränkter Haftung\nDarmstadt\n\nWegen Änderungen in den Personen der Aufsichtsratsmitglieder ist eine Liste der Mitglieder des Aufsichtsrates zum Handelsregister eingereicht worden."
    },
    {
      "date": "2025-07-10",
      "id": "115441",
      "original_text": "Einreichung neuer Dokumente\nHessen Amtsgericht Darmstadt HRB 6164\nMERCK Kommanditgesellschaft auf Aktien – Darmstadt",
      "type": "Einreichung neuer Dokumente",
      "state": "Hessen",
      "amtsgericht": "Amtsgericht Darmstadt",
      "registernummer": "HRB 6164",
      "registerart": "HRB",
      "company_name": "MERCK Kommanditgesellschaft auf Aktien",
      "company_seat": "Darmstadt",
      "details": "10.07.2025 (Bekanntmachungsdatum)\n\nHessen Amtsgericht Darmstadt HRB 6164\nEinreichung neuer Dokumente\n\nMERCK Kommanditgesellschaft auf Aktien\nKommanditgesellschaft auf Aktien\nDarmstadt\n\nDurch eine Änderung in den Personen der Aufsichtsratsmitglieder ist eine Liste der Mitglieder des Aufsichtsrates zum Handelsregister eingereicht worden."
    },
    {
      "date": "2025-07-10",
      "id": "115442",
      "original_text": "Registerbekanntmachung nach dem Umwandlungsgesetz\nHessen Amtsgericht Wiesbaden HRB 10784\nElektrotechnisches Planungsbüro Laber Gesellschaft mit beschränkter Haftung – Wiesbaden",
      "type": "Registerbekanntmachung nach dem Umwandlungsgesetz",
      "state": "Hessen",
      "amtsgericht": "Amtsgericht Wiesbaden",
      "registernummer": "HRB 10784",
      "registerart": "HRB",
      "company_name": "Elektrotechnisches Planungsbüro Laber Gesellschaft mit beschränkter Haftung",
      "company_seat": "Wiesbaden",
      "details": "10.07.2025 (Bekanntmachungsdatum)\n\nHessen Amtsgericht Wiesbaden HRB 10784\nRegisterbekanntmachung nach dem Umwandlungsgesetz 10.07.2025 (Eintragungsdatum)\n\nElektrotechnisches Planungsbüro Laber Gesellschaft mit beschränkter Haftung\nGesellschaft mit beschränkter Haftung\nWiesbaden\n\nDen Gläubigern der an der Abspaltung beteiligten Rechtsträger ist, wenn sie binnen sechs Monaten nach dem Tag, an dem die Eintragung der Abspaltung in das Register des Sitzes desjenigen Rechtsträgers, dessen Gläubiger sie sind, nach §§ 125, 19 Absatz 3 UmwG bekannt gemacht worden ist, ihren Anspruch nach Grund und Höhe schriftlich anmelden, Sicherheit zu leisten, soweit sie nicht Befriedigung verlangen können. Dieses Recht steht den Gläubigern jedoch nur zu, wenn sie glaubhaft machen, dass durch die Abspaltung die Erfüllung ihrer Forderung gefährdet wird."
    },
    {
      "date": "2025-07-10",
      "id": "115443",
      "original_text": "Sonstige Registerbekanntmachung\nHessen Amtsgericht Frankfurt am Main HRB 56913\nDeutsche WertpapierService Bank AG – Frankfurt am Main",
      "type": "Sonstige Registerbekanntmachung",
      "state": "Hessen",
      "amtsgericht": "Amtsgericht Frankfurt am Main",
      "registernummer": "HRB 56913",
      "registerart": "HRB",
      "company_name": "Deutsche WertpapierService Bank AG",
      "company_seat": "Frankfurt am Main",
      "details": "10.07.2025 (Bekanntmachungsdatum)\n\nHessen Amtsgericht Frankfurt am Main HRB 56913\nSonstige Registerbekanntmachung 10.07.2025 (Eintragungsdatum)\n\nDeutsche WertpapierService Bank AG\nAktiengesellschaft\nFrankfurt am Main\n\nDurch eine Änderung in den Personen der Aufsichtsratsmitglieder ist eine Liste der Mitglieder des Aufsichtsrates zum Handelsregister eingereicht worden."
    },
    {
      "date": "2025-07-10",
      "id": "115444",
      "original_text": "Einreichung neuer Dokumente\nHessen Amtsgericht Frankfurt am Main HRB 90359\nt.e.a.m. Unternehmensberatung Aktiengesellschaft – Eschborn",
      "type": "Einreichung neuer Dokumente",
      "state": "Hessen",
      "amtsgericht": "Amtsgericht Frankfurt am Main",
      "registernummer": "HRB 90359",
      "registerart": "HRB",
      "company_name": "t.e.a.m. Unternehmensberatung Aktiengesellschaft",
      "company_seat": "Eschborn",
      "details": "10.07.2025 (Bekanntmachungsdatum)\n\nHessen Amtsgericht Frankfurt am Main HRB 90359\nEinreichung neuer Dokumente 10.07.2025 (Eintragungsdatum)\n\nt.e.a.m. Unternehmensberatung Aktiengesellschaft\nAktiengesellschaft\nEschborn\n\nDurch eine Änderung in den Personen der Aufsichtsratsmitglieder ist eine Liste der Mitglieder des Aufsichtsrates zum Handelsregister eingereicht worden."
    },
    {
      "date": "2025-07-10",
      "id": "115445",
      "original_text": "Löschungsankündigung\nHessen Amtsgericht Frankfurt am Main HRB 123897\nKobra Logistik GmbH – Frankfurt am Main",
      "type": "Löschungsankündigung",
      "state": "Hessen",
      "amtsgericht": "Amtsgericht Frankfurt am Main",
      "registernummer": "HRB 123897",
      "registerart": "HRB",
      "company_name": "Kobra Logistik GmbH",
      "company_seat": "Frankfurt am Main",
      "details": "10.07.2025 (Bekanntmachungsdatum)\n\nHessen Amtsgericht Frankfurt am Main HRB 123897\nLöschungsankündigung\n\nKobra Logistik GmbH\nGesellschaft mit beschränkter Haftung\nFrankfurt am Main\n\nDas Registergericht beabsichtigt die im Handelsregister eingetragene Gesellschaft von Amts wegen nach § 394 FamFG zu löschen. Die Frist zur Erhebung eines Widerspruchs gegen die beabsichtigte Löschung wird auf 1 Monate festgesetzt."
    },
    {
      "date": "2025-07-10",
      "id": "115446",
      "original_text": "Einreichung neuer Dokumente\nHessen Amtsgericht Frankfurt am Main HRB 93761\nMuseumsBausteine Frankfurt GmbH – Frankfurt am Main",
      "type": "Einreichung neuer Dokumente",
      "state": "Hessen",
      "amtsgericht": "Amtsgericht Frankfurt am Main",
      "registernummer": "HRB 93761",
      "registerart": "HRB",
      "company_name": "MuseumsBausteine Frankfurt GmbH",
      "company_seat": "Frankfurt am Main",
      "details": "10.07.2025 (Bekanntmachungsdatum)\n\nHessen Amtsgericht Frankfurt am Main HRB 93761\nEinreichung neuer Dokumente\n\nMuseumsBausteine Frankfurt GmbH\nGesellschaft mit beschränkter Haftung\nFrankfurt am Main\n\nDurch eine Änderung in den Personen der Aufsichtsratsmitglieder ist eine Liste der Mitglieder des Aufsichtsrates zum Handelsregister eingereicht worden."
    },
    {
      "date": "2025-07-10",
      "id": "115447",
      "original_text": "Einreichung neuer Dokumente\nHessen Amtsgericht Bad Homburg v.d.H. HRB 3474\nALTE LEIPZIGER Trust Investment-Gesellschaft mbH – Oberursel (Taunus)",
      "type": "Einreichung neuer Dokumente",
      "state": "Hessen",
      "amtsgericht": "Amtsgericht Bad Homburg v.d.H.",
      "registernummer": "HRB 3474",
      "registerart": "HRB",
      "company_name": "ALTE LEIPZIGER Trust Investment-Gesellschaft mbH",
      "company_seat": "Oberursel (Taunus)",
      "details": "10.07.2025 (Bekanntmachungsdatum)\n\nHessen Amtsgericht Bad Homburg v.d.H. HRB 3474\nEinreichung neuer Dokumente\n\nALTE LEIPZIGER Trust Investment-Gesellschaft mbH\nGesellschaft mit beschränkter Haftung\nOberursel (Taunus)\n\nDurch eine Änderung in den Personen der Aufsichtsratsmitglieder ist eine Liste der Mitglieder des Aufsichtsrates zum Handelsregister eingereicht worden."
    },
    {
      "date": "2025-07-10",
      "id": "115448",
      "original_text": "Sonstige Registerbekanntmachung\nHessen Amtsgericht Bad Hersfeld VR 330\nSpielvereinigung 1924 Bad Hersfeld e.V. – Bad Hersfeld",
      "type": "Sonstige Registerbekanntmachung",
      "state": "Hessen",
      "amtsgericht": "Amtsgericht Bad Hersfeld",
      "registernummer": "VR 330",
      "registerart": "VR",
      "company_name": "Spielvereinigung 1924 Bad Hersfeld e.V.",
      "company_seat": "Bad Hersfeld",
      "details": "10.07.2025 (Bekanntmachungsdatum)\n\nHessen Amtsgericht Bad Hersfeld VR 330\nSonstige Registerbekanntmachung 10.07.2025 (Eintragungsdatum)\n\nSpielvereinigung 1924 Bad Hersfeld e.V.\neingetragener Verein\nBad Hersfeld\n\nDer Verein ist aufgelöst.."
    },
    {
      "date": "2025-07-10",
      "id": "115449",
      "original_text": "Löschungsankündigung\nHessen Amtsgericht Fulda HRB 7075\nAmbitio Inkasso UG (haftungsbeschränkt) – Fulda",
      "type": "Löschungsankündigung",
      "state": "Hessen",
      "amtsgericht": "Amtsgericht Fulda",
      "registernummer": "HRB 7075",
      "registerart": "HRB",
      "company_name": "Ambitio Inkasso UG (haftungsbeschränkt)",
      "company_seat": "Fulda",
      "details": "10.07.2025 (Bekanntmachungsdatum)\n\nHessen Amtsgericht Fulda HRB 7075\nLöschungsankündigung 10.07.2025 (Eintragungsdatum)\n\nAmbitio Inkasso UG (haftungsbeschränkt)\nGesellschaft mit beschränkter Haftung\nFulda\n\nDas Registergericht beabsichtigt die im Handelsregister eingetragene Gesellschaft von Amts wegen nach § 394 FamFG zu löschen. Die Frist zur Erhebung eines Widerspruchs gegen die beabsichtigte Löschung wird auf 3 Monate festgesetzt."
    },
    {
      "date": "2025-07-10",
      "id": "115450",
      "original_text": "Einreichung neuer Dokumente\nHessen Amtsgericht Frankfurt am Main HRB 55933\nT-Systems International GmbH – Frankfurt am Main",
      "type": "Einreichung neuer Dokumente",
      "state": "Hessen",
      "amtsgericht": "Amtsgericht Frankfurt am Main",
      "registernummer": "HRB 55933",
      "registerart": "HRB",
      "company_name": "T-Systems International GmbH",
      "company_seat": "Frankfurt am Main",
      "details": "10.07.2025 (Bekanntmachungsdatum)\n\nHessen Amtsgericht Frankfurt am Main HRB 55933\nEinreichung neuer Dokumente\n\nT-Systems International GmbH\nGesellschaft mit beschränkter Haftung\nFrankfurt am Main\n\nDurch eine Änderung in den Personen der Aufsichtsratsmitglieder ist eine Liste der Mitglieder des Aufsichtsrates zum Handelsregister eingereicht worden."
    },
    {
      "date": "2025-07-10",
      "id": "115451",
      "original_text": "Registerbekanntmachung nach dem Umwandlungsgesetz\nHessen Amtsgericht Frankfurt am Main HRB 132436\nLATUS TEAM GmbH – Frankfurt am Main",
      "type": "Registerbekanntmachung nach dem Umwandlungsgesetz",
      "state": "Hessen",
      "amtsgericht": "Amtsgericht Frankfurt am Main",
      "registernummer": "HRB 132436",
      "registerart": "HRB",
      "company_name": "LATUS TEAM GmbH",
      "company_seat": "Frankfurt am Main",
      "details": "10.07.2025 (Bekanntmachungsdatum)\n\nHessen Amtsgericht Frankfurt am Main HRB 132436\nRegisterbekanntmachung nach dem Umwandlungsgesetz 10.07.2025 (Eintragungsdatum)\n\nLATUS TEAM GmbH\nGesellschaft mit beschränkter Haftung\nFrankfurt am Main\n\nDen Gläubigern der an der Verschmelzung beteiligten Rechtsträger ist, wenn sie binnen sechs Monaten nach dem Tag, an dem die Eintragung der Verschmelzung in das Register des Sitzes desjenigen Rechtsträgers, dessen Gläubiger sie sind, nach § 19 Absatz 3 UmwG bekannt gemacht worden ist, ihren Anspruch nach Grund und Höhe schriftlich anmelden, Sicherheit zu leisten, soweit sie nicht Befriedigung verlangen können. Dieses Recht steht den Gläubigern jedoch nur zu, wenn sie glaubhaft machen, dass durch die Verschmelzung die Erfüllung ihrer Forderung gefährdet wird."
    },
    {
      "date": "2025-07-10",
      "id": "115452",
      "original_text": "Registerbekanntmachung nach dem Umwandlungsgesetz\nHessen Amtsgericht Bad Homburg v.d.H. HRB 7267\nMSU Management Beratung GmbH – Bad Homburg v. d. Höhe",
      "type": "Registerbekanntmachung nach dem Umwandlungsgesetz",
      "state": "Hessen",
      "amtsgericht": "Amtsgericht Bad Homburg v.d.H.",
      "registernummer": "HRB 7267",
      "registerart": "HRB",
      "company_name": "MSU Management Beratung GmbH",
      "company_seat": "Bad Homburg v. d. Höhe",
      "details": "10.07.2025 (Bekanntmachungsdatum)\n\nHessen Amtsgericht Bad Homburg v.d.H. HRB 7267\nRegisterbekanntmachung nach dem Umwandlungsgesetz 10.07.2025 (Eintragungsdatum)\n\nMSU Management Beratung GmbH\nGesellschaft mit beschränkter Haftung\nBad Homburg v. d. Höhe\n\nDen Gläubigern der an der Verschmelzung beteiligten Rechtsträger ist, wenn sie binnen sechs Monaten nach dem Tag, an dem die Eintragung der Verschmelzung in das Register des Sitzes desjenigen Rechtsträgers, dessen Gläubiger sie sind, nach § 19 Absatz 3 UmwG bekannt gemacht worden ist, ihren Anspruch nach Grund und Höhe schriftlich anmelden, Sicherheit zu leisten, soweit sie nicht Befriedigung verlangen können. Dieses Recht steht den Gläubigern jedoch nur zu, wenn sie glaubhaft machen, dass durch die Verschmelzung die Erfüllung ihrer Forderung gefährdet wird."
    },
    {
      "date": "2025-07-10",
      "id": "115453",
      "original_text": "Registerbekanntmachung nach dem Umwandlungsgesetz\nHessen Amtsgericht Frankfurt am Main HRB 122187\nRebic Handelsgesellschaft mbH – Frankfurt am Main",
      "type": "Registerbekanntmachung nach dem Umwandlungsgesetz",
      "state": "Hessen",
      "amtsgericht": "Amtsgericht Frankfurt am Main",
      "registernummer": "HRB 122187",
      "registerart": "HRB",
      "company_name": "Rebic Handelsgesellschaft mbH",
      "company_seat": "Frankfurt am Main",
      "details": "10.07.2025 (Bekanntmachungsdatum)\n\nHessen Amtsgericht Frankfurt am Main HRB 122187\nRegisterbekanntmachung nach dem Umwandlungsgesetz 10.07.2025 (Eintragungsdatum)\n\nRebic Handelsgesellschaft mbH\nGesellschaft mit beschränkter Haftung\nFrankfurt am Main\n\nDen Gläubigern der an der formwechselnden Umwandlung beteiligten Rechtsträger ist, wenn sie binnen sechs Monaten nach dem Tag, an dem die Eintragung der formwechselnden Umwandlung in das Register des Sitzes desjenigen Rechtsträgers, dessen Gläubiger sie sind, nach § 201 UmwG bekannt gemacht worden ist, ihren Anspruch nach Grund und Höhe schriftlich anmelden, Sicherheit zu leisten, soweit sie nicht Befriedigung verlangen können. Dieses Recht steht den Gläubigern jedoch nur zu, wenn sie glaubhaft machen, dass durch die formwechselnden Umwandlung die Erfüllung ihrer Forderung gefährdet wird."
    },
    {
      "date": "2025-07-10",
      "id": "115454",
      "original_text": "Registerbekanntmachung nach dem Umwandlungsgesetz\nHessen Amtsgericht Königstein HRB 7696\nKlinkow Solar GmbH – Bad Soden am Taunus",
      "type": "Registerbekanntmachung nach dem Umwandlungsgesetz",
      "state": "Hessen",
      "amtsgericht": "Amtsgericht Königstein",
      "registernummer": "HRB 7696",
      "registerart": "HRB",
      "company_name": "Klinkow Solar GmbH",
      "company_seat": "Bad Soden am Taunus",
      "details": "10.07.2025 (Bekanntmachungsdatum)\n\nHessen Amtsgericht Königstein HRB 7696\nRegisterbekanntmachung nach dem Umwandlungsgesetz 10.07.2025 (Eintragungsdatum)\n\nKlinkow Solar GmbH\nGesellschaft mit beschränkter Haftung\nBad Soden am Taunus\n\nDen Gläubigern der an der Verschmelzung beteiligten Rechtsträger ist, wenn sie binnen sechs Monaten nach dem Tag, an dem die Eintragung der Verschmelzung in das Register des Sitzes desjenigen Rechtsträgers, dessen Gläubiger sie sind, nach § 19 Absatz 3 UmwG bekannt gemacht worden ist, ihren Anspruch nach Grund und Höhe schriftlich anmelden, Sicherheit zu leisten, soweit sie nicht Befriedigung verlangen können. Dieses Recht steht den Gläubigern jedoch nur zu, wenn sie glaubhaft machen, dass durch die Verschmelzung die Erfüllung ihrer Forderung gefährdet wird."
    },
    {
      "date": "2025-07-10",
      "id": "115455",
      "original_text": "Registerbekanntmachung nach dem Umwandlungsgesetz\nHessen Amtsgericht Bad Homburg v.d.H. HRB 7118\nMSU Consulting GmbH. – Bad Homburg v. d. Höhe",
      "type": "Registerbekanntmachung nach dem Umwandlungsgesetz",
      "state": "Hessen",
      "amtsgericht": "Amtsgericht Bad Homburg v.d.H.",
      "registernummer": "HRB 7118",
      "registerart": "HRB",
      "company_name": "MSU Consulting GmbH.",
      "company_seat": "Bad Homburg v. d. Höhe",
      "details": "10.07.2025 (Bekanntmachungsdatum)\n\nHessen Amtsgericht Bad Homburg v.d.H. HRB 7118\nRegisterbekanntmachung nach dem Umwandlungsgesetz 10.07.2025 (Eintragungsdatum)\n\nMSU Consulting GmbH.\nGesellschaft mit beschränkter Haftung\nBad Homburg v. d. Höhe\n\nDen Gläubigern der an der Verschmelzung beteiligten Rechtsträger ist, wenn sie binnen sechs Monaten nach dem Tag, an dem die Eintragung der Verschmelzung in das Register des Sitzes desjenigen Rechtsträgers, dessen Gläubiger sie sind, nach § 19 Absatz 3 UmwG bekannt gemacht worden ist, ihren Anspruch nach Grund und Höhe schriftlich anmelden, Sicherheit zu leisten, soweit sie nicht Befriedigung verlangen können. Dieses Recht steht den Gläubigern jedoch nur zu, wenn sie glaubhaft machen, dass durch die Verschmelzung die Erfüllung ihrer Forderung gefährdet wird."
    },
    {
      "date": "2025-07-10",
      "id": "115456",
      "original_text": "Registerbekanntmachung nach dem Umwandlungsgesetz\nHessen Amtsgericht Frankfurt am Main HRA 54271\nRebic Handelsgesellschaft d.o.o & Co. KG – Frankfurt am Main",
      "type": "Registerbekanntmachung nach dem Umwandlungsgesetz",
      "state": "Hessen",
      "amtsgericht": "Amtsgericht Frankfurt am Main",
      "registernummer": "HRA 54271",
      "registerart": "HRA",
      "company_name": "Rebic Handelsgesellschaft d.o.o & Co. KG",
      "company_seat": "Frankfurt am Main",
      "details": "10.07.2025 (Bekanntmachungsdatum)\n\nHessen Amtsgericht Frankfurt am Main HRA 54271\nRegisterbekanntmachung nach dem Umwandlungsgesetz 10.07.2025 (Eintragungsdatum)\n\nRebic Handelsgesellschaft d.o.o & Co. KG\nKommanditgesellschaft\nFrankfurt am Main\n\nDen Gläubigern der an der formwechselnden Umwandlung beteiligten Rechtsträger ist, wenn sie binnen sechs Monaten nach dem Tag, an dem die Eintragung der formwechselnden Umwandlung in das Register des Sitzes desjenigen Rechtsträgers, dessen Gläubiger sie sind, nach § 201 UmwG bekannt gemacht worden ist, ihren Anspruch nach Grund und Höhe schriftlich anmelden, Sicherheit zu leisten, soweit sie nicht Befriedigung verlangen können. Dieses Recht steht den Gläubigern jedoch nur zu, wenn sie glaubhaft machen, dass durch die formwechselnden Umwandlung die Erfüllung ihrer Forderung gefährdet wird."
    }
  ]
}