{
  "date": "2025-07-08",
  "date_of_scrape": "2025-07-09T04:22:23.328Z",
  "tool_version": "0.2.0",
  "number_of_announcements": 187,
  "announcements": [
    {
      "date": "2025-07-08",
      "id": "114891",
      "original_text": "Registerbekanntmachung nach dem Umwandlungsgesetz\nBayern Amtsgericht München HRB 226365\nPHÖNIX-Seniorenzentrum Am Schlossteich GmbH – München",
      "type": "Registerbekanntmachung nach dem Umwandlungsgesetz",
      "state": "Bayern",
      "amtsgericht": "Amtsgericht München",
      "registernummer": "HRB 226365",
      "registerart": "HRB",
      "company_name": "PHÖNIX-Seniorenzentrum Am Schlossteich GmbH",
      "company_seat": "München",
      "details": "08.07.2025 (Bekanntmachungsdatum)\n\nBayern Amtsgericht München HRB 226365\nRegisterbekanntmachung nach dem Umwandlungsgesetz 07.07.2025 (Eintragungsdatum)\n\nPHÖNIX-Seniorenzentrum Am Schlossteich GmbH\nGesellschaft mit beschränkter Haftung\nMünchen\n\nDen Gläubigern der an der Verschmelzung beteiligten Rechtsträger ist, wenn sie binnen sechs Monaten nach dem Tag, an dem die Eintragung der Verschmelzung in das Register des Sitzes desjenigen Rechtsträgers, dessen Gläubiger sie sind, nach § 19 Abs. 3 UmwG als bekannt gemacht gilt, ihren Anspruch nach Grund und Höhe in Textform anmelden, Sicherheit zu leisten, soweit sie nicht Befriedigung verlangen können. Dieses Recht steht den Gläubigern jedoch nur zu, wenn sie glaubhaft machen, dass durch die Verschmelzung die Erfüllung ihrer Forderung gefährdet wird."
    },
    {
      "date": "2025-07-08",
      "id": "114892",
      "original_text": "Registerbekanntmachung nach dem Umwandlungsgesetz\nBayern Amtsgericht München HRB 234120\nTHEON Data Solutions GmbH – München",
      "type": "Registerbekanntmachung nach dem Umwandlungsgesetz",
      "state": "Bayern",
      "amtsgericht": "Amtsgericht München",
      "registernummer": "HRB 234120",
      "registerart": "HRB",
      "company_name": "THEON Data Solutions GmbH",
      "company_seat": "München",
      "details": "08.07.2025 (Bekanntmachungsdatum)\n\nBayern Amtsgericht München HRB 234120\nRegisterbekanntmachung nach dem Umwandlungsgesetz 07.07.2025 (Eintragungsdatum)\n\nTHEON Data Solutions GmbH\nGesellschaft mit beschränkter Haftung\nMünchen\n\nDen Gläubigern der an der Verschmelzung beteiligten Rechtsträger ist, wenn sie binnen sechs Monaten nach dem Tag, an dem die Eintragung der Verschmelzung in das Register des Sitzes desjenigen Rechtsträgers, dessen Gläubiger sie sind, nach § 19 Abs. 3 UmwG als bekannt gemacht gilt, ihren Anspruch nach Grund und Höhe in Textform anmelden, Sicherheit zu leisten, soweit sie nicht Befriedigung verlangen können. Dieses Recht steht den Gläubigern jedoch nur zu, wenn sie glaubhaft machen, dass durch die Verschmelzung die Erfüllung ihrer Forderung gefährdet wird."
    },
    {
      "date": "2025-07-08",
      "id": "114893",
      "original_text": "Registerbekanntmachung nach dem Umwandlungsgesetz\nBayern Amtsgericht München HRB 259566\nSozialkonzept Betriebs- und Beteiligungs GmbH – München",
      "type": "Registerbekanntmachung nach dem Umwandlungsgesetz",
      "state": "Bayern",
      "amtsgericht": "Amtsgericht München",
      "registernummer": "HRB 259566",
      "registerart": "HRB",
      "company_name": "Sozialkonzept Betriebs- und Beteiligungs GmbH",
      "company_seat": "München",
      "details": "08.07.2025 (Bekanntmachungsdatum)\n\nBayern Amtsgericht München HRB 259566\nRegisterbekanntmachung nach dem Umwandlungsgesetz 07.07.2025 (Eintragungsdatum)\n\nSozialkonzept Betriebs- und Beteiligungs GmbH\nGesellschaft mit beschränkter Haftung\nMünchen\n\nDen Gläubigern der an der Verschmelzung beteiligten Rechtsträger ist, wenn sie binnen sechs Monaten nach dem Tag, an dem die Eintragung der Verschmelzung in das Register des Sitzes desjenigen Rechtsträgers, dessen Gläubiger sie sind, nach § 19 Abs. 3 UmwG als bekannt gemacht gilt, ihren Anspruch nach Grund und Höhe in Textform anmelden, Sicherheit zu leisten, soweit sie nicht Befriedigung verlangen können. Dieses Recht steht den Gläubigern jedoch nur zu, wenn sie glaubhaft machen, dass durch die Verschmelzung die Erfüllung ihrer Forderung gefährdet wird."
    },
    {
      "date": "2025-07-08",
      "id": "114894",
      "original_text": "Registerbekanntmachung nach dem Umwandlungsgesetz\nBayern Amtsgericht München HRB 238100\nWunderhut GmbH – München",
      "type": "Registerbekanntmachung nach dem Umwandlungsgesetz",
      "state": "Bayern",
      "amtsgericht": "Amtsgericht München",
      "registernummer": "HRB 238100",
      "registerart": "HRB",
      "company_name": "Wunderhut GmbH",
      "company_seat": "München",
      "details": "08.07.2025 (Bekanntmachungsdatum)\n\nBayern Amtsgericht München HRB 238100\nRegisterbekanntmachung nach dem Umwandlungsgesetz 07.07.2025 (Eintragungsdatum)\n\nWunderhut GmbH\nGesellschaft mit beschränkter Haftung\nMünchen\n\nDen Gläubigern der an der Verschmelzung beteiligten Rechtsträger ist, wenn sie binnen sechs Monaten nach dem Tag, an dem die Eintragung der Verschmelzung in das Register des Sitzes desjenigen Rechtsträgers, dessen Gläubiger sie sind, nach § 19 Abs. 3 UmwG als bekannt gemacht gilt, ihren Anspruch nach Grund und Höhe in Textform anmelden, Sicherheit zu leisten, soweit sie nicht Befriedigung verlangen können. Dieses Recht steht den Gläubigern jedoch nur zu, wenn sie glaubhaft machen, dass durch die Verschmelzung die Erfüllung ihrer Forderung gefährdet wird."
    },
    {
      "date": "2025-07-08",
      "id": "114895",
      "original_text": "Registerbekanntmachung nach dem Umwandlungsgesetz\nBayern Amtsgericht München HRB 259566\nSozialkonzept Betriebs- und Beteiligungs GmbH – München",
      "type": "Registerbekanntmachung nach dem Umwandlungsgesetz",
      "state": "Bayern",
      "amtsgericht": "Amtsgericht München",
      "registernummer": "HRB 259566",
      "registerart": "HRB",
      "company_name": "Sozialkonzept Betriebs- und Beteiligungs GmbH",
      "company_seat": "München",
      "details": "08.07.2025 (Bekanntmachungsdatum)\n\nBayern Amtsgericht München HRB 259566\nRegisterbekanntmachung nach dem Umwandlungsgesetz 07.07.2025 (Eintragungsdatum)\n\nSozialkonzept Betriebs- und Beteiligungs GmbH\nGesellschaft mit beschränkter Haftung\nMünchen\n\nDen Gläubigern der an der Verschmelzung beteiligten Rechtsträger ist, wenn sie binnen sechs Monaten nach dem Tag, an dem die Eintragung der Verschmelzung in das Register des Sitzes desjenigen Rechtsträgers, dessen Gläubiger sie sind, nach § 19 Abs. 3 UmwG als bekannt gemacht gilt, ihren Anspruch nach Grund und Höhe in Textform anmelden, Sicherheit zu leisten, soweit sie nicht Befriedigung verlangen können. Dieses Recht steht den Gläubigern jedoch nur zu, wenn sie glaubhaft machen, dass durch die Verschmelzung die Erfüllung ihrer Forderung gefährdet wird."
    },
    {
      "date": "2025-07-08",
      "id": "114896",
      "original_text": "Registerbekanntmachung nach dem Umwandlungsgesetz\nBayern Amtsgericht München HRB 196374\nMarcs kleine Welt GmbH – Tutzing",
      "type": "Registerbekanntmachung nach dem Umwandlungsgesetz",
      "state": "Bayern",
      "amtsgericht": "Amtsgericht München",
      "registernummer": "HRB 196374",
      "registerart": "HRB",
      "company_name": "Marcs kleine Welt GmbH",
      "company_seat": "Tutzing",
      "details": "08.07.2025 (Bekanntmachungsdatum)\n\nBayern Amtsgericht München HRB 196374\nRegisterbekanntmachung nach dem Umwandlungsgesetz 07.07.2025 (Eintragungsdatum)\n\nMarcs kleine Welt GmbH\nGesellschaft mit beschränkter Haftung\nTutzing\n\nDen Gläubigern der an der Verschmelzung beteiligten Rechtsträger ist, wenn sie binnen sechs Monaten nach dem Tag, an dem die Eintragung der Verschmelzung in das Register des Sitzes desjenigen Rechtsträgers, dessen Gläubiger sie sind, nach § 19 Abs. 3 UmwG als bekannt gemacht gilt, ihren Anspruch nach Grund und Höhe in Textform anmelden, Sicherheit zu leisten, soweit sie nicht Befriedigung verlangen können. Dieses Recht steht den Gläubigern jedoch nur zu, wenn sie glaubhaft machen, dass durch die Verschmelzung die Erfüllung ihrer Forderung gefährdet wird."
    },
    {
      "date": "2025-07-08",
      "id": "114897",
      "original_text": "Einreichung neuer Dokumente\nBayern Amtsgericht Augsburg HRB 2033\nAventus Versicherungsmakler Augsburg AG – Gersthofen",
      "type": "Einreichung neuer Dokumente",
      "state": "Bayern",
      "amtsgericht": "Amtsgericht Augsburg",
      "registernummer": "HRB 2033",
      "registerart": "HRB",
      "company_name": "Aventus Versicherungsmakler Augsburg AG",
      "company_seat": "Gersthofen",
      "details": "08.07.2025 (Bekanntmachungsdatum)\n\nBayern Amtsgericht Augsburg HRB 2033\nEinreichung neuer Dokumente 07.07.2025 (Eintragungsdatum)\n\nAventus Versicherungsmakler Augsburg AG\nAktiengesellschaft\nGersthofen\n\nDem Registergericht Augsburg ist eine Liste der Mitglieder des Aufsichtsrats eingereicht worden, § 106 AktG."
    },
    {
      "date": "2025-07-08",
      "id": "114898",
      "original_text": "Registerbekanntmachung nach dem Umwandlungsgesetz\nBayern Amtsgericht München HRB 301055\n1st generation holding GmbH – München",
      "type": "Registerbekanntmachung nach dem Umwandlungsgesetz",
      "state": "Bayern",
      "amtsgericht": "Amtsgericht München",
      "registernummer": "HRB 301055",
      "registerart": "HRB",
      "company_name": "1st generation holding GmbH",
      "company_seat": "München",
      "details": "08.07.2025 (Bekanntmachungsdatum)\n\nBayern Amtsgericht München HRB 301055\nRegisterbekanntmachung nach dem Umwandlungsgesetz 07.07.2025 (Eintragungsdatum)\n\n1st generation holding GmbH\nGesellschaft mit beschränkter Haftung\nMünchen\n\nDen Gläubigern der an der Verschmelzung beteiligten Rechtsträger ist, wenn sie binnen sechs Monaten nach dem Tag, an dem die Eintragung der Verschmelzung in das Register des Sitzes desjenigen Rechtsträgers, dessen Gläubiger sie sind, nach § 19 Abs. 3 UmwG als bekannt gemacht gilt, ihren Anspruch nach Grund und Höhe in Textform anmelden, Sicherheit zu leisten, soweit sie nicht Befriedigung verlangen können. Dieses Recht steht den Gläubigern jedoch nur zu, wenn sie glaubhaft machen, dass durch die Verschmelzung die Erfüllung ihrer Forderung gefährdet wird."
    },
    {
      "date": "2025-07-08",
      "id": "114899",
      "original_text": "Registerbekanntmachung nach dem Umwandlungsgesetz\nBayern Amtsgericht Nürnberg HRA 14778\nPD Vermögensverwaltungs GmbH & Co. KG – Röthenbach a.d.Pegnitz",
      "type": "Registerbekanntmachung nach dem Umwandlungsgesetz",
      "state": "Bayern",
      "amtsgericht": "Amtsgericht Nürnberg",
      "registernummer": "HRA 14778",
      "registerart": "HRA",
      "company_name": "PD Vermögensverwaltungs GmbH & Co. KG",
      "company_seat": "Röthenbach a.d.Pegnitz",
      "details": "08.07.2025 (Bekanntmachungsdatum)\n\nBayern Amtsgericht Nürnberg HRA 14778\nRegisterbekanntmachung nach dem Umwandlungsgesetz 07.07.2025 (Eintragungsdatum)\n\nPD Vermögensverwaltungs GmbH & Co. KG\nKommanditgesellschaft\nRöthenbach a.d.Pegnitz\n\nDen Gläubigern der an der Verschmelzung beteiligten Rechtsträger ist, wenn sie binnen sechs Monaten nach dem Tag, an dem die Eintragung der Verschmelzung in das Register des Sitzes desjenigen Rechtsträgers, dessen Gläubiger sie sind, nach § 19 Abs. 3 UmwG als bekannt gemacht gilt, ihren Anspruch nach Grund und Höhe in Textform anmelden, Sicherheit zu leisten, soweit sie nicht Befriedigung verlangen können. Dieses Recht steht den Gläubigern jedoch nur zu, wenn sie glaubhaft machen, dass durch die Verschmelzung die Erfüllung ihrer Forderung gefährdet wird."
    },
    {
      "date": "2025-07-08",
      "id": "114900",
      "original_text": "Löschungsankündigung\nBayern Amtsgericht Kempten (Allgäu) HRA 8249\nKunert Abwicklungsgesellschaft GmbH & Co. KG – Immenstadt",
      "type": "Löschungsankündigung",
      "state": "Bayern",
      "amtsgericht": "Amtsgericht Kempten (Allgäu)",
      "registernummer": "HRA 8249",
      "registerart": "HRA",
      "company_name": "Kunert Abwicklungsgesellschaft GmbH & Co. KG",
      "company_seat": "Immenstadt",
      "details": "08.07.2025 (Bekanntmachungsdatum)\n\nBayern Amtsgericht Kempten (Allgäu) HRA 8249\nLöschungsankündigung\n\nKunert Abwicklungsgesellschaft GmbH & Co. KG\nKommanditgesellschaft\nImmenstadt\n\nDas Registergericht beabsichtigt, die im Handelsregister eingetragene Firma von Amts wegen nach § 395 FamFG zu löschen. Die Frist zur Erhebung eines Widerspruchs ist auf einen Monat festgesetzt."
    },
    {
      "date": "2025-07-08",
      "id": "114901",
      "original_text": "Löschungsankündigung\nBayern Amtsgericht Nürnberg HRB 5201\nBillhöfer Verwaltungs GmbH – Nürnberg",
      "type": "Löschungsankündigung",
      "state": "Bayern",
      "amtsgericht": "Amtsgericht Nürnberg",
      "registernummer": "HRB 5201",
      "registerart": "HRB",
      "company_name": "Billhöfer Verwaltungs GmbH",
      "company_seat": "Nürnberg",
      "details": "08.07.2025 (Bekanntmachungsdatum)\n\nBayern Amtsgericht Nürnberg HRB 5201\nLöschungsankündigung\n\nBillhöfer Verwaltungs GmbH\nGesellschaft mit beschränkter Haftung\nNürnberg\n\nDas Registergericht beabsichtigt, die im Handelsregister eingetragene Gesellschaft wegen Vermögenslosigkeit von Amts wegen nach § 394 FamFG zu löschen. Die Frist zur Erhebung eines Widerspruchs ist auf einen Monat festgesetzt."
    },
    {
      "date": "2025-07-08",
      "id": "114902",
      "original_text": "Registerbekanntmachung nach dem Umwandlungsgesetz\nBayern Amtsgericht Aschaffenburg HRB 9895\nMentomedia GmbH – Niedernberg",
      "type": "Registerbekanntmachung nach dem Umwandlungsgesetz",
      "state": "Bayern",
      "amtsgericht": "Amtsgericht Aschaffenburg",
      "registernummer": "HRB 9895",
      "registerart": "HRB",
      "company_name": "Mentomedia GmbH",
      "company_seat": "Niedernberg",
      "details": "08.07.2025 (Bekanntmachungsdatum)\n\nBayern Amtsgericht Aschaffenburg HRB 9895\nRegisterbekanntmachung nach dem Umwandlungsgesetz 07.07.2025 (Eintragungsdatum)\n\nMentomedia GmbH\nGesellschaft mit beschränkter Haftung\nNiedernberg\n\nDen Gläubigern der an der Verschmelzung beteiligten Rechtsträger ist, wenn sie binnen sechs Monaten nach dem Tag, an dem die Eintragung der Verschmelzung in das Register des Sitzes desjenigen Rechtsträgers, dessen Gläubiger sie sind, nach § 19 Abs. 3 UmwG als bekannt gemacht gilt, ihren Anspruch nach Grund und Höhe in Textform anmelden, Sicherheit zu leisten, soweit sie nicht Befriedigung verlangen können. Dieses Recht steht den Gläubigern jedoch nur zu, wenn sie glaubhaft machen, dass durch die Verschmelzung die Erfüllung ihrer Forderung gefährdet wird."
    },
    {
      "date": "2025-07-08",
      "id": "114903",
      "original_text": "Registerbekanntmachung nach dem Umwandlungsgesetz\nBayern Amtsgericht München HRB 225124\nIBP Verwaltungs GmbH – München",
      "type": "Registerbekanntmachung nach dem Umwandlungsgesetz",
      "state": "Bayern",
      "amtsgericht": "Amtsgericht München",
      "registernummer": "HRB 225124",
      "registerart": "HRB",
      "company_name": "IBP Verwaltungs GmbH",
      "company_seat": "München",
      "details": "08.07.2025 (Bekanntmachungsdatum)\n\nBayern Amtsgericht München HRB 225124\nRegisterbekanntmachung nach dem Umwandlungsgesetz 07.07.2025 (Eintragungsdatum)\n\nIBP Verwaltungs GmbH\nGesellschaft mit beschränkter Haftung\nMünchen\n\nDen Gläubigern der an der Verschmelzung beteiligten Rechtsträger ist, wenn sie binnen sechs Monaten nach dem Tag, an dem die Eintragung der Verschmelzung in das Register des Sitzes desjenigen Rechtsträgers, dessen Gläubiger sie sind, nach § 19 Abs. 3 UmwG als bekannt gemacht gilt, ihren Anspruch nach Grund und Höhe in Textform anmelden, Sicherheit zu leisten, soweit sie nicht Befriedigung verlangen können. Dieses Recht steht den Gläubigern jedoch nur zu, wenn sie glaubhaft machen, dass durch die Verschmelzung die Erfüllung ihrer Forderung gefährdet wird."
    },
    {
      "date": "2025-07-08",
      "id": "114904",
      "original_text": "Löschungsankündigung\nBayern Amtsgericht Nürnberg HRB 41134\nACE Matthäus GmbH – Nürnberg",
      "type": "Löschungsankündigung",
      "state": "Bayern",
      "amtsgericht": "Amtsgericht Nürnberg",
      "registernummer": "HRB 41134",
      "registerart": "HRB",
      "company_name": "ACE Matthäus GmbH",
      "company_seat": "Nürnberg",
      "details": "08.07.2025 (Bekanntmachungsdatum)\n\nBayern Amtsgericht Nürnberg HRB 41134\nLöschungsankündigung\n\nACE Matthäus GmbH\nGesellschaft mit beschränkter Haftung\nNürnberg\n\nDas Registergericht beabsichtigt, die im Handelsregister eingetragene Gesellschaft wegen Vermögenslosigkeit von Amts wegen nach § 394 FamFG zu löschen. Die Frist zur Erhebung eines Widerspruchs ist auf einen Monat festgesetzt."
    },
    {
      "date": "2025-07-08",
      "id": "114905",
      "original_text": "Registerbekanntmachung nach dem Umwandlungsgesetz\nBayern Amtsgericht Memmingen HRB 17164\nQMS Mannes GmbH – Burtenbach",
      "type": "Registerbekanntmachung nach dem Umwandlungsgesetz",
      "state": "Bayern",
      "amtsgericht": "Amtsgericht Memmingen",
      "registernummer": "HRB 17164",
      "registerart": "HRB",
      "company_name": "QMS Mannes GmbH",
      "company_seat": "Burtenbach",
      "details": "08.07.2025 (Bekanntmachungsdatum)\n\nBayern Amtsgericht Memmingen HRB 17164\nRegisterbekanntmachung nach dem Umwandlungsgesetz 07.07.2025 (Eintragungsdatum)\n\nQMS Mannes GmbH\nGesellschaft mit beschränkter Haftung\nBurtenbach\n\nDen Gläubigern der an der Verschmelzung beteiligten Rechtsträger ist, wenn sie binnen sechs Monaten nach dem Tag, an dem die Eintragung der Verschmelzung in das Register des Sitzes desjenigen Rechtsträgers, dessen Gläubiger sie sind, nach § 19 Abs. 3 UmwG als bekannt gemacht gilt, ihren Anspruch nach Grund und Höhe in Textform anmelden, Sicherheit zu leisten, soweit sie nicht Befriedigung verlangen können. Dieses Recht steht den Gläubigern jedoch nur zu, wenn sie glaubhaft machen, dass durch die Verschmelzung die Erfüllung ihrer Forderung gefährdet wird."
    },
    {
      "date": "2025-07-08",
      "id": "114906",
      "original_text": "Registerbekanntmachung nach dem Umwandlungsgesetz\nBayern Amtsgericht Aschaffenburg HRB 5548\nMentopolis Consulting & Software Concepts GmbH – Niedernberg",
      "type": "Registerbekanntmachung nach dem Umwandlungsgesetz",
      "state": "Bayern",
      "amtsgericht": "Amtsgericht Aschaffenburg",
      "registernummer": "HRB 5548",
      "registerart": "HRB",
      "company_name": "Mentopolis Consulting & Software Concepts GmbH",
      "company_seat": "Niedernberg",
      "details": "08.07.2025 (Bekanntmachungsdatum)\n\nBayern Amtsgericht Aschaffenburg HRB 5548\nRegisterbekanntmachung nach dem Umwandlungsgesetz 07.07.2025 (Eintragungsdatum)\n\nMentopolis Consulting & Software Concepts GmbH\nGesellschaft mit beschränkter Haftung\nNiedernberg\n\nDen Gläubigern der an der Verschmelzung beteiligten Rechtsträger ist, wenn sie binnen sechs Monaten nach dem Tag, an dem die Eintragung der Verschmelzung in das Register des Sitzes desjenigen Rechtsträgers, dessen Gläubiger sie sind, nach § 19 Abs. 3 UmwG als bekannt gemacht gilt, ihren Anspruch nach Grund und Höhe in Textform anmelden, Sicherheit zu leisten, soweit sie nicht Befriedigung verlangen können. Dieses Recht steht den Gläubigern jedoch nur zu, wenn sie glaubhaft machen, dass durch die Verschmelzung die Erfüllung ihrer Forderung gefährdet wird."
    },
    {
      "date": "2025-07-08",
      "id": "114907",
      "original_text": "Einreichung neuer Dokumente\nBayern Amtsgericht Augsburg HRB 16508\nAIRBUS HELICOPTERS DEUTSCHLAND GmbH – Donauwörth",
      "type": "Einreichung neuer Dokumente",
      "state": "Bayern",
      "amtsgericht": "Amtsgericht Augsburg",
      "registernummer": "HRB 16508",
      "registerart": "HRB",
      "company_name": "AIRBUS HELICOPTERS DEUTSCHLAND GmbH",
      "company_seat": "Donauwörth",
      "details": "08.07.2025 (Bekanntmachungsdatum)\n\nBayern Amtsgericht Augsburg HRB 16508\nEinreichung neuer Dokumente 07.07.2025 (Eintragungsdatum)\n\nAIRBUS HELICOPTERS DEUTSCHLAND GmbH\nGesellschaft mit beschränkter Haftung\nDonauwörth\n\nDem Registergericht Augsburg ist eine Liste der Mitglieder des Aufsichtsrats eingereicht worden, § 52 Abs. 3 S. 2 GmbHG."
    },
    {
      "date": "2025-07-08",
      "id": "114908",
      "original_text": "Registerbekanntmachung nach dem Umwandlungsgesetz\nBayern Amtsgericht München HRB 226373\nKorian Akazienpark GmbH – München",
      "type": "Registerbekanntmachung nach dem Umwandlungsgesetz",
      "state": "Bayern",
      "amtsgericht": "Amtsgericht München",
      "registernummer": "HRB 226373",
      "registerart": "HRB",
      "company_name": "Korian Akazienpark GmbH",
      "company_seat": "München",
      "details": "08.07.2025 (Bekanntmachungsdatum)\n\nBayern Amtsgericht München HRB 226373\nRegisterbekanntmachung nach dem Umwandlungsgesetz 07.07.2025 (Eintragungsdatum)\n\nKorian Akazienpark GmbH\nGesellschaft mit beschränkter Haftung\nMünchen\n\nDen Gläubigern der an der Verschmelzung beteiligten Rechtsträger ist, wenn sie binnen sechs Monaten nach dem Tag, an dem die Eintragung der Verschmelzung in das Register des Sitzes desjenigen Rechtsträgers, dessen Gläubiger sie sind, nach § 19 Abs. 3 UmwG als bekannt gemacht gilt, ihren Anspruch nach Grund und Höhe in Textform anmelden, Sicherheit zu leisten, soweit sie nicht Befriedigung verlangen können. Dieses Recht steht den Gläubigern jedoch nur zu, wenn sie glaubhaft machen, dass durch die Verschmelzung die Erfüllung ihrer Forderung gefährdet wird."
    },
    {
      "date": "2025-07-08",
      "id": "114909",
      "original_text": "Löschungsankündigung\nBayern Amtsgericht München HRA 91841\nCarpe Diem Vermögensverwaltungs GmbH & Co. KG – München",
      "type": "Löschungsankündigung",
      "state": "Bayern",
      "amtsgericht": "Amtsgericht München",
      "registernummer": "HRA 91841",
      "registerart": "HRA",
      "company_name": "Carpe Diem Vermögensverwaltungs GmbH & Co. KG",
      "company_seat": "München",
      "details": "08.07.2025 (Bekanntmachungsdatum)\n\nBayern Amtsgericht München HRA 91841\nLöschungsankündigung 07.07.2025 (Eintragungsdatum)\n\nCarpe Diem Vermögensverwaltungs GmbH & Co. KG\nKommanditgesellschaft\nMünchen\n\nDas Registergericht beabsichtigt, die im Handelsregister eingetragene Firma von Amts wegen nach § 31 Abs. 2 HGB zu löschen. Die Frist zur Erhebung eines Widerspruchs ist auf einen Monat festgesetzt."
    },
    {
      "date": "2025-07-08",
      "id": "114910",
      "original_text": "Einreichung neuer Dokumente\nBayern Amtsgericht München HRB 301745\nEhret+Klein AG – Starnberg",
      "type": "Einreichung neuer Dokumente",
      "state": "Bayern",
      "amtsgericht": "Amtsgericht München",
      "registernummer": "HRB 301745",
      "registerart": "HRB",
      "company_name": "Ehret+Klein AG",
      "company_seat": "Starnberg",
      "details": "08.07.2025 (Bekanntmachungsdatum)\n\nBayern Amtsgericht München HRB 301745\nEinreichung neuer Dokumente\n\nEhret+Klein AG\nAktiengesellschaft\nStarnberg\n\nDem Amtsgericht München -Registergericht- ist eine Liste der Mitglieder des Aufsichtsrats eingereicht worden, § 106 AktG."
    },
    {
      "date": "2025-07-08",
      "id": "114911",
      "original_text": "Registerbekanntmachung nach dem Umwandlungsgesetz\nBayern Amtsgericht München HRB 177023\nXINTECON GmbH – Zorneding",
      "type": "Registerbekanntmachung nach dem Umwandlungsgesetz",
      "state": "Bayern",
      "amtsgericht": "Amtsgericht München",
      "registernummer": "HRB 177023",
      "registerart": "HRB",
      "company_name": "XINTECON GmbH",
      "company_seat": "Zorneding",
      "details": "08.07.2025 (Bekanntmachungsdatum)\n\nBayern Amtsgericht München HRB 177023\nRegisterbekanntmachung nach dem Umwandlungsgesetz 07.07.2025 (Eintragungsdatum)\n\nXINTECON GmbH\nGesellschaft mit beschränkter Haftung\nZorneding\n\nDen Gläubigern der an der Spaltung beteiligten Rechtsträger ist, wenn sie binnen sechs Monaten nach dem Tag, an dem die Eintragung der Spaltung in das Register des Sitzes desjenigen Rechtsträgers, dessen Gläubiger sie sind, nach §§ 125, 19 Abs. 3 UmwG als bekannt gemacht gilt, ihren Anspruch nach Grund und Höhe in Textform anmelden, Sicherheit zu leisten, soweit sie nicht Befriedigung verlangen können. Dieses Recht steht den Gläubigern jedoch nur zu, wenn sie glaubhaft machen, dass durch die Spaltung die Erfüllung ihrer Forderung gefährdet wird."
    },
    {
      "date": "2025-07-08",
      "id": "114912",
      "original_text": "Registerbekanntmachung nach dem Umwandlungsgesetz\nBayern Amtsgericht München HRB 259574\nCR Korian Holding GmbH – München",
      "type": "Registerbekanntmachung nach dem Umwandlungsgesetz",
      "state": "Bayern",
      "amtsgericht": "Amtsgericht München",
      "registernummer": "HRB 259574",
      "registerart": "HRB",
      "company_name": "CR Korian Holding GmbH",
      "company_seat": "München",
      "details": "08.07.2025 (Bekanntmachungsdatum)\n\nBayern Amtsgericht München HRB 259574\nRegisterbekanntmachung nach dem Umwandlungsgesetz 07.07.2025 (Eintragungsdatum)\n\nCR Korian Holding GmbH\nGesellschaft mit beschränkter Haftung\nMünchen\n\nDen Gläubigern der an der Verschmelzung beteiligten Rechtsträger ist, wenn sie binnen sechs Monaten nach dem Tag, an dem die Eintragung der Verschmelzung in das Register des Sitzes desjenigen Rechtsträgers, dessen Gläubiger sie sind, nach § 19 Abs. 3 UmwG als bekannt gemacht gilt, ihren Anspruch nach Grund und Höhe in Textform anmelden, Sicherheit zu leisten, soweit sie nicht Befriedigung verlangen können. Dieses Recht steht den Gläubigern jedoch nur zu, wenn sie glaubhaft machen, dass durch die Verschmelzung die Erfüllung ihrer Forderung gefährdet wird."
    },
    {
      "date": "2025-07-08",
      "id": "114913",
      "original_text": "Einreichung neuer Dokumente\nBayern Amtsgericht München HRB 170700\nSana Kliniken AG – Ismaning",
      "type": "Einreichung neuer Dokumente",
      "state": "Bayern",
      "amtsgericht": "Amtsgericht München",
      "registernummer": "HRB 170700",
      "registerart": "HRB",
      "company_name": "Sana Kliniken AG",
      "company_seat": "Ismaning",
      "details": "08.07.2025 (Bekanntmachungsdatum)\n\nBayern Amtsgericht München HRB 170700\nEinreichung neuer Dokumente 07.07.2025 (Eintragungsdatum)\n\nSana Kliniken AG\nAktiengesellschaft\nIsmaning\n\nDem Amtsgericht München -Registergericht- ist eine Liste der Mitglieder des Aufsichtsrats eingereicht worden, § 106 AktG."
    },
    {
      "date": "2025-07-08",
      "id": "114914",
      "original_text": "Registerbekanntmachung nach dem Umwandlungsgesetz\nBayern Amtsgericht Nürnberg HRB 44346\nRossaro Kanaltechnik GmbH – Röthenbach a.d. Pegnitz",
      "type": "Registerbekanntmachung nach dem Umwandlungsgesetz",
      "state": "Bayern",
      "amtsgericht": "Amtsgericht Nürnberg",
      "registernummer": "HRB 44346",
      "registerart": "HRB",
      "company_name": "Rossaro Kanaltechnik GmbH",
      "company_seat": "Röthenbach a.d. Pegnitz",
      "details": "08.07.2025 (Bekanntmachungsdatum)\n\nBayern Amtsgericht Nürnberg HRB 44346\nRegisterbekanntmachung nach dem Umwandlungsgesetz 06.07.2025 (Eintragungsdatum)\n\nRossaro Kanaltechnik GmbH\nGesellschaft mit beschränkter Haftung\nRöthenbach a.d. Pegnitz\n\nDen Gläubigern der an der Verschmelzung beteiligten Rechtsträger ist, wenn sie binnen sechs Monaten nach dem Tag, an dem die Eintragung der Verschmelzung in das Register des Sitzes desjenigen Rechtsträgers, dessen Gläubiger sie sind, nach § 19 Abs. 3 UmwG als bekannt gemacht gilt, ihren Anspruch nach Grund und Höhe in Textform anmelden, Sicherheit zu leisten, soweit sie nicht Befriedigung verlangen können. Dieses Recht steht den Gläubigern jedoch nur zu, wenn sie glaubhaft machen, dass durch die Verschmelzung die Erfüllung ihrer Forderung gefährdet wird."
    },
    {
      "date": "2025-07-08",
      "id": "114915",
      "original_text": "Registerbekanntmachung nach dem Umwandlungsgesetz\nBayern Amtsgericht München HRB 189933\nPhilipp Roesch-Schlanderer Investments GmbH – Grünwald",
      "type": "Registerbekanntmachung nach dem Umwandlungsgesetz",
      "state": "Bayern",
      "amtsgericht": "Amtsgericht München",
      "registernummer": "HRB 189933",
      "registerart": "HRB",
      "company_name": "Philipp Roesch-Schlanderer Investments GmbH",
      "company_seat": "Grünwald",
      "details": "08.07.2025 (Bekanntmachungsdatum)\n\nBayern Amtsgericht München HRB 189933\nRegisterbekanntmachung nach dem Umwandlungsgesetz\n\nPhilipp Roesch-Schlanderer Investments GmbH\nGesellschaft mit beschränkter Haftung\nGrünwald\n\nDem Amtsgericht München -Registergericht- ist am 02.07.2025 der Entwurf eines Verschmelzungsplanes über die geplante Verschmelzung der deutschen Gesellschaft mit beschränkter Haftung Philipp Roesch-Schlanderer Investments GmbH mit Sitz in Grünwald, Deutschland (Amtsgericht München HRB 189933) als übertragendem Rechtsträger mit  der Gesellschaft mit beschränkter Haftung nach liechtensteinischem Recht  unter Firma Philipp Roesch-Schlanderer Investments GmbH mit Sitz in Vaduz, Liechtenstein (Handelsregister des Fürstentums Liechtenstein unter Nr. FL-0002.742.344-4) als übernehmendem Rechtsträger eingereicht worden, § 308 Abs. 1 Satz 2 Nr. 2 UmwG.\nDie Anteilsinhaber und Gläubiger der Philipp Roesch-Schlanderer Investments\nGmbH mit Sitz in Grünwald, Deutschland und der Philipp Roesch-Schlanderer\nInvestments GmbH mit Sitz in Vaduz, Liechtenstein werden darauf hingewiesen, dass\nsie der jeweiligen Gesellschaft spätestens fünf Arbeitstage vor dem Tag der notariellen\nBeurkundung des Verschmelizungsplans Bemerkungen zum Verschmelzungsplan\nübermitteln können (§ 308 Abs. 1 Satz 2 Nr. 4 lit. a) UmwG).\nDiese Bemerkungen können an die Gesellschaft (Portenlängerstraße 4, 82031 Grünwald)\noder an die Philipp Roesch-Schlanderer Investments GmbH mit Sitz in Vaduz,\nLiechtenstein (Lettstrasse 10, 9490 Vaduz, Fürstentum Liechtenstein) übermittelt\nwerden.\nDie Übermittlungsfrist für etwaige Bemerkungen zum Verschmelzungsplan endet fünf\nArbeitstage vor dem Tag der notariellen Beurkundung des Verschmelzungsplans.\nDiese ist für den 18. August 2025 vorgesehen.\nEin Hinweis an den Betriebsrat bzw. die Arbeitnehmer der an der grenzüberschreitenden Verschmelzung beteiligten Gesellschaften (§ 308 Abs. 1 Satz 2 Nr. 4 lit. b) UmwG;) ist entbehrlich, da weder die übertragende Gesellschaft noch die übernehmende Gesellschaft einen Betriebsrat oder Arbeitnehmer hat.. Die vollständigen Auskünfte über diese Modalitäten können kostenlos eingeholt werden bei der Philipp Roesch-Schlanderer Investments GmbH, Portenlängerstraße 4, 82031 Grünwald."
    },
    {
      "date": "2025-07-08",
      "id": "114916",
      "original_text": "Löschungsankündigung\nBayern Amtsgericht München HRB 259824\nAL Bauconsult GmbH – Gauting",
      "type": "Löschungsankündigung",
      "state": "Bayern",
      "amtsgericht": "Amtsgericht München",
      "registernummer": "HRB 259824",
      "registerart": "HRB",
      "company_name": "AL Bauconsult GmbH",
      "company_seat": "Gauting",
      "details": "08.07.2025 (Bekanntmachungsdatum)\n\nBayern Amtsgericht München HRB 259824\nLöschungsankündigung 07.07.2025 (Eintragungsdatum)\n\nAL Bauconsult GmbH\nGesellschaft mit beschränkter Haftung\nGauting\n\nDas Registergericht beabsichtigt, die im Handelsregister eingetragene Gesellschaft wegen Vermögenslosigkeit von Amts wegen nach § 394 FamFG zu löschen. Die Frist zur Erhebung eines Widerspruchs ist auf drei Monate festgesetzt."
    },
    {
      "date": "2025-07-08",
      "id": "114917",
      "original_text": "Sonstige Registerbekanntmachung\nBayern Amtsgericht München HRB 133502\nBavaria Parkgaragen GmbH – München",
      "type": "Sonstige Registerbekanntmachung",
      "state": "Bayern",
      "amtsgericht": "Amtsgericht München",
      "registernummer": "HRB 133502",
      "registerart": "HRB",
      "company_name": "Bavaria Parkgaragen GmbH",
      "company_seat": "München",
      "details": "08.07.2025 (Bekanntmachungsdatum)\n\nBayern Amtsgericht München HRB 133502\nSonstige Registerbekanntmachung 07.07.2025 (Eintragungsdatum)\n\nBavaria Parkgaragen GmbH\nGesellschaft mit beschränkter Haftung\nMünchen\n\nDen Gläubigern der Gesellschaft, deren Forderungen begründet worden sind, bevor die Eintragung der Beendigung des Beherrschungs- und Gewinnabführungsvertrages in das Handelsregister nach § 10 des Handelsgesetzbuches als bekanntgemacht gilt, hat der andere Vertragsteil Sicherheit zu leisten, wenn sie sich binnen sechs Monaten nach der Bekanntmachung der Eintragung zu diesem Zweck bei ihm melden."
    },
    {
      "date": "2025-07-08",
      "id": "114918",
      "original_text": "Löschungsankündigung\nBayern Amtsgericht Kempten (Allgäu) HRB 9796\nMedieninsel Verwaltungs GmbH – Lindau (Bodensee)",
      "type": "Löschungsankündigung",
      "state": "Bayern",
      "amtsgericht": "Amtsgericht Kempten (Allgäu)",
      "registernummer": "HRB 9796",
      "registerart": "HRB",
      "company_name": "Medieninsel Verwaltungs GmbH",
      "company_seat": "Lindau (Bodensee)",
      "details": "08.07.2025 (Bekanntmachungsdatum)\n\nBayern Amtsgericht Kempten (Allgäu) HRB 9796\nLöschungsankündigung\n\nMedieninsel Verwaltungs GmbH\nGesellschaft mit beschränkter Haftung\nLindau (Bodensee)\n\nDas Registergericht beabsichtigt, die im Handelsregister eingetragene Gesellschaft wegen Vermögenslosigkeit von Amts wegen nach § 394 FamFG zu löschen. Die Frist zur Erhebung eines Widerspruchs ist auf einen Monat festgesetzt."
    },
    {
      "date": "2025-07-08",
      "id": "114919",
      "original_text": "Registerbekanntmachung nach dem Umwandlungsgesetz\nBayern Amtsgericht Nürnberg HRA 15546\nLCK Beteiligungen GmbH & Co. KG – Röthenbach a.d. Pegnitz",
      "type": "Registerbekanntmachung nach dem Umwandlungsgesetz",
      "state": "Bayern",
      "amtsgericht": "Amtsgericht Nürnberg",
      "registernummer": "HRA 15546",
      "registerart": "HRA",
      "company_name": "LCK Beteiligungen GmbH & Co. KG",
      "company_seat": "Röthenbach a.d. Pegnitz",
      "details": "08.07.2025 (Bekanntmachungsdatum)\n\nBayern Amtsgericht Nürnberg HRA 15546\nRegisterbekanntmachung nach dem Umwandlungsgesetz 07.07.2025 (Eintragungsdatum)\n\nLCK Beteiligungen GmbH & Co. KG\nKommanditgesellschaft\nRöthenbach a.d. Pegnitz\n\nDen Gläubigern der an der Verschmelzung beteiligten Rechtsträger ist, wenn sie binnen sechs Monaten nach dem Tag, an dem die Eintragung der Verschmelzung in das Register des Sitzes desjenigen Rechtsträgers, dessen Gläubiger sie sind, nach § 19 Abs. 3 UmwG als bekannt gemacht gilt, ihren Anspruch nach Grund und Höhe in Textform anmelden, Sicherheit zu leisten, soweit sie nicht Befriedigung verlangen können. Dieses Recht steht den Gläubigern jedoch nur zu, wenn sie glaubhaft machen, dass durch die Verschmelzung die Erfüllung ihrer Forderung gefährdet wird."
    },
    {
      "date": "2025-07-08",
      "id": "114920",
      "original_text": "Registerbekanntmachung nach dem Umwandlungsgesetz\nBayern Amtsgericht München HRB 226398\nPHÖNIX-ambulante intensive Pflege GmbH – München",
      "type": "Registerbekanntmachung nach dem Umwandlungsgesetz",
      "state": "Bayern",
      "amtsgericht": "Amtsgericht München",
      "registernummer": "HRB 226398",
      "registerart": "HRB",
      "company_name": "PHÖNIX-ambulante intensive Pflege GmbH",
      "company_seat": "München",
      "details": "08.07.2025 (Bekanntmachungsdatum)\n\nBayern Amtsgericht München HRB 226398\nRegisterbekanntmachung nach dem Umwandlungsgesetz 07.07.2025 (Eintragungsdatum)\n\nPHÖNIX-ambulante intensive Pflege GmbH\nGesellschaft mit beschränkter Haftung\nMünchen\n\nDen Gläubigern der an der Verschmelzung beteiligten Rechtsträger ist, wenn sie binnen sechs Monaten nach dem Tag, an dem die Eintragung der Verschmelzung in das Register des Sitzes desjenigen Rechtsträgers, dessen Gläubiger sie sind, nach § 19 Abs. 3 UmwG als bekannt gemacht gilt, ihren Anspruch nach Grund und Höhe in Textform anmelden, Sicherheit zu leisten, soweit sie nicht Befriedigung verlangen können. Dieses Recht steht den Gläubigern jedoch nur zu, wenn sie glaubhaft machen, dass durch die Verschmelzung die Erfüllung ihrer Forderung gefährdet wird."
    },
    {
      "date": "2025-07-08",
      "id": "114921",
      "original_text": "Einreichung neuer Dokumente\nBayern Amtsgericht Augsburg HRB 22709\nKUKA Aktiengesellschaft – Augsburg",
      "type": "Einreichung neuer Dokumente",
      "state": "Bayern",
      "amtsgericht": "Amtsgericht Augsburg",
      "registernummer": "HRB 22709",
      "registerart": "HRB",
      "company_name": "KUKA Aktiengesellschaft",
      "company_seat": "Augsburg",
      "details": "08.07.2025 (Bekanntmachungsdatum)\n\nBayern Amtsgericht Augsburg HRB 22709\nEinreichung neuer Dokumente 07.07.2025 (Eintragungsdatum)\n\nKUKA Aktiengesellschaft\nAktiengesellschaft\nAugsburg\n\nDem Registergericht Augsburg ist eine Liste der Mitglieder des Aufsichtsrats eingereicht worden, § 106 AktG."
    },
    {
      "date": "2025-07-08",
      "id": "114922",
      "original_text": "Registerbekanntmachung nach dem Umwandlungsgesetz\nBayern Amtsgericht München HRB 263644\nAllergoSkin GmbH – Wolfratshausen",
      "type": "Registerbekanntmachung nach dem Umwandlungsgesetz",
      "state": "Bayern",
      "amtsgericht": "Amtsgericht München",
      "registernummer": "HRB 263644",
      "registerart": "HRB",
      "company_name": "AllergoSkin GmbH",
      "company_seat": "Wolfratshausen",
      "details": "08.07.2025 (Bekanntmachungsdatum)\n\nBayern Amtsgericht München HRB 263644\nRegisterbekanntmachung nach dem Umwandlungsgesetz 07.07.2025 (Eintragungsdatum)\n\nAllergoSkin GmbH\nGesellschaft mit beschränkter Haftung\nWolfratshausen\n\nDen Gläubigern der an der Verschmelzung beteiligten Rechtsträger ist, wenn sie binnen sechs Monaten nach dem Tag, an dem die Eintragung der Verschmelzung in das Register des Sitzes desjenigen Rechtsträgers, dessen Gläubiger sie sind, nach § 19 Abs. 3 UmwG als bekannt gemacht gilt, ihren Anspruch nach Grund und Höhe in Textform anmelden, Sicherheit zu leisten, soweit sie nicht Befriedigung verlangen können. Dieses Recht steht den Gläubigern jedoch nur zu, wenn sie glaubhaft machen, dass durch die Verschmelzung die Erfüllung ihrer Forderung gefährdet wird."
    },
    {
      "date": "2025-07-08",
      "id": "114923",
      "original_text": "Registerbekanntmachung nach dem Umwandlungsgesetz\nBayern Amtsgericht München HRA 121302\nBranislav Vidic e.K. – München",
      "type": "Registerbekanntmachung nach dem Umwandlungsgesetz",
      "state": "Bayern",
      "amtsgericht": "Amtsgericht München",
      "registernummer": "HRA 121302",
      "registerart": "HRA",
      "company_name": "Branislav Vidic e.K.",
      "company_seat": "München",
      "details": "08.07.2025 (Bekanntmachungsdatum)\n\nBayern Amtsgericht München HRA 121302\nRegisterbekanntmachung nach dem Umwandlungsgesetz 07.07.2025 (Eintragungsdatum)\n\nBranislav Vidic e.K.\nEinzelkaufmann / Einzelkauffrau\nMünchen\n\nDen Gläubigern der an der Verschmelzung beteiligten Rechtsträger ist, wenn sie binnen sechs Monaten nach dem Tag, an dem die Eintragung der Verschmelzung in das Register des Sitzes desjenigen Rechtsträgers, dessen Gläubiger sie sind, nach § 19 Abs. 3 UmwG als bekannt gemacht gilt, ihren Anspruch nach Grund und Höhe in Textform anmelden, Sicherheit zu leisten, soweit sie nicht Befriedigung verlangen können. Dieses Recht steht den Gläubigern jedoch nur zu, wenn sie glaubhaft machen, dass durch die Verschmelzung die Erfüllung ihrer Forderung gefährdet wird."
    },
    {
      "date": "2025-07-08",
      "id": "114924",
      "original_text": "Registerbekanntmachung nach dem Umwandlungsgesetz\nBayern Amtsgericht München HRB 259566\nSozialkonzept Betriebs- und Beteiligungs GmbH – München",
      "type": "Registerbekanntmachung nach dem Umwandlungsgesetz",
      "state": "Bayern",
      "amtsgericht": "Amtsgericht München",
      "registernummer": "HRB 259566",
      "registerart": "HRB",
      "company_name": "Sozialkonzept Betriebs- und Beteiligungs GmbH",
      "company_seat": "München",
      "details": "08.07.2025 (Bekanntmachungsdatum)\n\nBayern Amtsgericht München HRB 259566\nRegisterbekanntmachung nach dem Umwandlungsgesetz 07.07.2025 (Eintragungsdatum)\n\nSozialkonzept Betriebs- und Beteiligungs GmbH\nGesellschaft mit beschränkter Haftung\nMünchen\n\nDen Gläubigern der an der Verschmelzung beteiligten Rechtsträger ist, wenn sie binnen sechs Monaten nach dem Tag, an dem die Eintragung der Verschmelzung in das Register des Sitzes desjenigen Rechtsträgers, dessen Gläubiger sie sind, nach § 19 Abs. 3 UmwG als bekannt gemacht gilt, ihren Anspruch nach Grund und Höhe in Textform anmelden, Sicherheit zu leisten, soweit sie nicht Befriedigung verlangen können. Dieses Recht steht den Gläubigern jedoch nur zu, wenn sie glaubhaft machen, dass durch die Verschmelzung die Erfüllung ihrer Forderung gefährdet wird."
    },
    {
      "date": "2025-07-08",
      "id": "114925",
      "original_text": "Registerbekanntmachung nach dem Umwandlungsgesetz\nBerlin Amtsgericht Berlin (Charlottenburg) HRB 82263\nDDB Berlin GmbH – Berlin",
      "type": "Registerbekanntmachung nach dem Umwandlungsgesetz",
      "state": "Berlin",
      "amtsgericht": "Amtsgericht Berlin (Charlottenburg)",
      "registernummer": "HRB 82263",
      "registerart": "HRB",
      "company_name": "DDB Berlin GmbH",
      "company_seat": "Berlin",
      "details": "08.07.2025 (Bekanntmachungsdatum)\n\nBerlin Amtsgericht Berlin (Charlottenburg) HRB 82263\nRegisterbekanntmachung nach dem Umwandlungsgesetz 07.07.2025 (Eintragungsdatum)\n\nDDB Berlin GmbH\nGesellschaft mit beschränkter Haftung\nBerlin\n\nZu Eintragungsnummer 51 vom 07.07.2025 wird als nicht eingetragen veröffentlicht: Den Gläubigern der an der Verschmelzung beteiligten Rechtsträger ist, wenn sie binnen sechs Monaten nach dem Tag, an dem die Eintragung der Verschmelzung in das Register des Sitzes desjenigen Rechtsträgers, dessen Gläubiger sie sind, als bekannt gemacht gilt, ihren Anspruch nach Grund und Höhe schriftlich anmelden, Sicherheit zu leisten, soweit sie nicht Befriedigung verlangen können. Dieses Recht steht den Gläubigern jedoch nur zu, wenn sie glaubhaft machen, dass durch die Verschmelzung die Erfüllung ihrer Forderung gefährdet wird. Das Recht, Sicherheitsleistung zu verlangen, steht Gläubigern nicht zu, die im Falle der Insolvenz ein Recht auf vorzugsweise Befriedigung aus einer Deckungsmasse haben, die nach gesetzlicher Vorschrift zu ihrem Schutz errichtet und staatlich überwacht ist."
    },
    {
      "date": "2025-07-08",
      "id": "114926",
      "original_text": "Registerbekanntmachung nach dem Umwandlungsgesetz\nBerlin Amtsgericht Berlin (Charlottenburg) HRB 190618\nEagle Rock GmbH – Berlin",
      "type": "Registerbekanntmachung nach dem Umwandlungsgesetz",
      "state": "Berlin",
      "amtsgericht": "Amtsgericht Berlin (Charlottenburg)",
      "registernummer": "HRB 190618",
      "registerart": "HRB",
      "company_name": "Eagle Rock GmbH",
      "company_seat": "Berlin",
      "details": "08.07.2025 (Bekanntmachungsdatum)\n\nBerlin Amtsgericht Berlin (Charlottenburg) HRB 190618\nRegisterbekanntmachung nach dem Umwandlungsgesetz 03.07.2025 (Eintragungsdatum)\n\nEagle Rock GmbH\nGesellschaft mit beschränkter Haftung\nBerlin\n\nZu Eintragungsnummer 4 vom 03.07.2025 wird als nicht eingetragen veröffentlicht: Den Gläubigern der an der Verschmelzung beteiligten Rechtsträger ist, wenn sie binnen sechs Monaten nach dem Tag, an dem die Eintragung der Verschmelzung in das Register des Sitzes desjenigen Rechtsträgers, dessen Gläubiger sie sind, als bekannt gemacht gilt, ihren Anspruch nach Grund und Höhe schriftlich anmelden, Sicherheit zu leisten, soweit sie nicht Befriedigung verlangen können. Dieses Recht steht den Gläubigern jedoch nur zu, wenn sie glaubhaft machen, dass durch die Verschmelzung die Erfüllung ihrer Forderung gefährdet wird. Das Recht, Sicherheitsleistung zu verlangen, steht Gläubigern nicht zu, die im Falle der Insolvenz ein Recht auf vorzugsweise Befriedigung aus einer Deckungsmasse haben, die nach gesetzlicher Vorschrift zu ihrem Schutz errichtet und staatlich überwacht ist."
    },
    {
      "date": "2025-07-08",
      "id": "114927",
      "original_text": "Registerbekanntmachung nach dem Umwandlungsgesetz\nBerlin Amtsgericht Berlin (Charlottenburg) HRB 215828\nBest Equity GmbH – Berlin",
      "type": "Registerbekanntmachung nach dem Umwandlungsgesetz",
      "state": "Berlin",
      "amtsgericht": "Amtsgericht Berlin (Charlottenburg)",
      "registernummer": "HRB 215828",
      "registerart": "HRB",
      "company_name": "Best Equity GmbH",
      "company_seat": "Berlin",
      "details": "08.07.2025 (Bekanntmachungsdatum)\n\nBerlin Amtsgericht Berlin (Charlottenburg) HRB 215828\nRegisterbekanntmachung nach dem Umwandlungsgesetz 03.07.2025 (Eintragungsdatum)\n\nBest Equity GmbH\nGesellschaft mit beschränkter Haftung\nBerlin\n\nZu Eintragungsnummer 2 vom 03.07.2025 wird als nicht eingetragen veröffentlicht: Den Gläubigern der an der Verschmelzung beteiligten Rechtsträger ist, wenn sie binnen sechs Monaten nach dem Tag, an dem die Eintragung der Verschmelzung in das Register des Sitzes desjenigen Rechtsträgers, dessen Gläubiger sie sind, als bekannt gemacht gilt, ihren Anspruch nach Grund und Höhe schriftlich anmelden, Sicherheit zu leisten, soweit sie nicht Befriedigung verlangen können. Dieses Recht steht den Gläubigern jedoch nur zu, wenn sie glaubhaft machen, dass durch die Verschmelzung die Erfüllung ihrer Forderung gefährdet wird. Das Recht, Sicherheitsleistung zu verlangen, steht Gläubigern nicht zu, die im Falle der Insolvenz ein Recht auf vorzugsweise Befriedigung aus einer Deckungsmasse haben, die nach gesetzlicher Vorschrift zu ihrem Schutz errichtet und staatlich überwacht ist."
    },
    {
      "date": "2025-07-08",
      "id": "114928",
      "original_text": "Registerbekanntmachung nach dem Umwandlungsgesetz\nBerlin Amtsgericht Berlin (Charlottenburg) HRB 31774\nAltersvorsorge- und Krankenversicherungsbüro Schare & Mendyka GmbH – Berlin",
      "type": "Registerbekanntmachung nach dem Umwandlungsgesetz",
      "state": "Berlin",
      "amtsgericht": "Amtsgericht Berlin (Charlottenburg)",
      "registernummer": "HRB 31774",
      "registerart": "HRB",
      "company_name": "Altersvorsorge- und Krankenversicherungsbüro Schare & Mendyka GmbH",
      "company_seat": "Berlin",
      "details": "08.07.2025 (Bekanntmachungsdatum)\n\nBerlin Amtsgericht Berlin (Charlottenburg) HRB 31774\nRegisterbekanntmachung nach dem Umwandlungsgesetz 07.07.2025 (Eintragungsdatum)\n\nAltersvorsorge- und Krankenversicherungsbüro Schare & Mendyka GmbH\nGesellschaft mit beschränkter Haftung\nBerlin\n\nZu Eintragungsnummer 7 vom 07.07.2025 wird als nicht eingetragen veröffentlicht:Den Gläubigern der an der Verschmelzung beteiligten Rechtsträger ist, wenn sie binnen sechs Monaten nach dem Tag, an dem die Eintragung der Verschmelzung in das Register des Sitzes desjenigen Rechtsträgers, dessen Gläubiger sie sind, als bekannt gemacht gilt, ihren Anspruch nach Grund und Höhe schriftlich anmelden, Sicherheit zu leisten, soweit sie nicht Befriedigung verlangen können. Dieses Recht steht den Gläubigern jedoch nur zu, wenn sie glaubhaft machen, dass durch die Verschmelzung die Erfüllung ihrer Forderung gefährdet wird. Das Recht, Sicherheitsleistung zu verlangen, steht Gläubigern nicht zu, die im Falle der Insolvenz ein Recht auf vorzugsweise Befriedigung aus einer Deckungsmasse haben, die nach gesetzlicher Vorschrift zu ihrem Schutz errichtet und staatlich überwacht ist."
    },
    {
      "date": "2025-07-08",
      "id": "114929",
      "original_text": "Einreichung neuer Dokumente\nBaden-Württemberg Amtsgericht Stuttgart HRB 728793\nHitachi Rail GTS Deutschland GmbH – Stuttgart",
      "type": "Einreichung neuer Dokumente",
      "state": "Baden-Württemberg",
      "amtsgericht": "Amtsgericht Stuttgart",
      "registernummer": "HRB 728793",
      "registerart": "HRB",
      "company_name": "Hitachi Rail GTS Deutschland GmbH",
      "company_seat": "Stuttgart",
      "details": "08.07.2025 (Bekanntmachungsdatum)\n\nBaden-Württemberg Amtsgericht Stuttgart HRB 728793\nEinreichung neuer Dokumente\n\nHitachi Rail GTS Deutschland GmbH\nGesellschaft mit beschränkter Haftung\nStuttgart\n\nDie Gesellschaft hat am 05.06.2025 die Liste über die Zusammensetzung des Aufsichtsrats zum Handelsregister eingereicht."
    },
    {
      "date": "2025-07-08",
      "id": "114930",
      "original_text": "Registerbekanntmachung nach dem Umwandlungsgesetz\nBaden-Württemberg Amtsgericht Stuttgart HRA 742165\nMassa Brandschutz GmbH & Co. KG – Ludwigsburg",
      "type": "Registerbekanntmachung nach dem Umwandlungsgesetz",
      "state": "Baden-Württemberg",
      "amtsgericht": "Amtsgericht Stuttgart",
      "registernummer": "HRA 742165",
      "registerart": "HRA",
      "company_name": "Massa Brandschutz GmbH & Co. KG",
      "company_seat": "Ludwigsburg",
      "details": "08.07.2025 (Bekanntmachungsdatum)\n\nBaden-Württemberg Amtsgericht Stuttgart HRA 742165\nRegisterbekanntmachung nach dem Umwandlungsgesetz 08.07.2025 (Eintragungsdatum)\n\nMassa Brandschutz GmbH & Co. KG\nKommanditgesellschaft\nLudwigsburg\n\nAls nicht eingetragen wird bekanntgemacht:\nDen Gläubigern der an der Ausgliederung beteiligten Rechtsträger ist, wenn sie binnen sechs Monaten nach dem Tag, an dem die Eintragung der Ausgliederung in das Register des Sitzes desjenigen Rechtsträgers, dessen Gläubiger sie sind, nach § 19 Abs. 3 UmwG als bekanntgemacht gilt, ihren Anspruch nach Grund und Höhe schriftlich anmelden, Sicherheit zu leisten, soweit sie nicht Befriedigung verlangen können. Dieses Recht steht den Gläubigern jedoch nur zu, wenn sie glaubhaft machen, dass durch die Ausgliederung die Erfüllung ihrer Forderung gefährdet wird."
    },
    {
      "date": "2025-07-08",
      "id": "114931",
      "original_text": "Löschungsankündigung\nSchleswig-Holstein Amtsgericht Lübeck HRB 16726\nConcept Ausbau GmbH – Oststeinbek",
      "type": "Löschungsankündigung",
      "state": "Schleswig-Holstein",
      "amtsgericht": "Amtsgericht Lübeck",
      "registernummer": "HRB 16726",
      "registerart": "HRB",
      "company_name": "Concept Ausbau GmbH",
      "company_seat": "Oststeinbek",
      "details": "08.07.2025 (Bekanntmachungsdatum)\n\nSchleswig-Holstein Amtsgericht Lübeck HRB 16726\nLöschungsankündigung\n\nConcept Ausbau GmbH\nGesellschaft mit beschränkter Haftung\nOststeinbek\n\nEs ist die Löschung der nachstehenden Gesellschaft wegen Vermögenslosigkeit gemäß § 394 FamFG beabsichtigt.\nWiderspruchsfrist: 1 Monat"
    },
    {
      "date": "2025-07-08",
      "id": "114932",
      "original_text": "Löschungsankündigung\nBrandenburg Amtsgericht Potsdam HRB 37747\nM&S MoveSmooth GmbH – Großbeeren",
      "type": "Löschungsankündigung",
      "state": "Brandenburg",
      "amtsgericht": "Amtsgericht Potsdam",
      "registernummer": "HRB 37747",
      "registerart": "HRB",
      "company_name": "M&S MoveSmooth GmbH",
      "company_seat": "Großbeeren",
      "details": "08.07.2025 (Bekanntmachungsdatum)\n\nBrandenburg Amtsgericht Potsdam HRB 37747\nLöschungsankündigung\n\nM&S MoveSmooth GmbH\nGesellschaft mit beschränkter Haftung\nGroßbeeren\n\nBei der nachstehenden Gesellschaft wird das Amtslöschungsverfahren gemäß § 394 FamFG eingeleitet. Widerspruchsfrist: 8 Wochen."
    },
    {
      "date": "2025-07-08",
      "id": "114933",
      "original_text": "Einreichung neuer Dokumente\nBaden-Württemberg Amtsgericht Stuttgart HRB 722941\nexperimenta gGmbH – Heilbronn",
      "type": "Einreichung neuer Dokumente",
      "state": "Baden-Württemberg",
      "amtsgericht": "Amtsgericht Stuttgart",
      "registernummer": "HRB 722941",
      "registerart": "HRB",
      "company_name": "experimenta gGmbH",
      "company_seat": "Heilbronn",
      "details": "08.07.2025 (Bekanntmachungsdatum)\n\nBaden-Württemberg Amtsgericht Stuttgart HRB 722941\nEinreichung neuer Dokumente\n\nexperimenta gGmbH\nGesellschaft mit beschränkter Haftung\nHeilbronn\n\nDie Gesellschaft hat am 07.07.2025 die Liste über die Zusammensetzung des Aufsichtsrats zum Handelsregister eingereicht."
    },
    {
      "date": "2025-07-08",
      "id": "114934",
      "original_text": "Registerbekanntmachung nach dem Umwandlungsgesetz\nBaden-Württemberg Amtsgericht Stuttgart HRA 231175\nAsphalt-Mischwerk Waggershauser GmbH + Co. KG – Kirchheim unter Teck",
      "type": "Registerbekanntmachung nach dem Umwandlungsgesetz",
      "state": "Baden-Württemberg",
      "amtsgericht": "Amtsgericht Stuttgart",
      "registernummer": "HRA 231175",
      "registerart": "HRA",
      "company_name": "Asphalt-Mischwerk Waggershauser GmbH + Co. KG",
      "company_seat": "Kirchheim unter Teck",
      "details": "08.07.2025 (Bekanntmachungsdatum)\n\nBaden-Württemberg Amtsgericht Stuttgart HRA 231175\nRegisterbekanntmachung nach dem Umwandlungsgesetz 08.07.2025 (Eintragungsdatum)\n\nAsphalt-Mischwerk Waggershauser GmbH + Co. KG\nKommanditgesellschaft\nKirchheim unter Teck\n\nDen Gläubigern des an dem Formwechsel beteiligten Rechtsträgers ist, wenn sie binnen sechs Monaten nach dem Tag, an dem die Eintragung des Formwechsels in das Register des Sitzes desjenigen Rechtsträgers, dessen Gläubiger sie sind, nach § 19 Abs. 3 UmwG als bekanntgemacht gilt, ihren Anspruch nach Grund und Höhe schriftlich anmelden, Sicherheit zu leisten, soweit sie nicht Befriedigung verlangen können. Dieses Recht steht den Gläubigern jedoch nur zu, wenn sie glaubhaft machen, dass durch den Formwechsel die Erfüllung ihrer Forderung gefährdet wird."
    },
    {
      "date": "2025-07-08",
      "id": "114935",
      "original_text": "Registerbekanntmachung nach dem Umwandlungsgesetz\nBaden-Württemberg Amtsgericht Stuttgart HRA 742006\nMassa e. K. – Ludwigsburg",
      "type": "Registerbekanntmachung nach dem Umwandlungsgesetz",
      "state": "Baden-Württemberg",
      "amtsgericht": "Amtsgericht Stuttgart",
      "registernummer": "HRA 742006",
      "registerart": "HRA",
      "company_name": "Massa e. K.",
      "company_seat": "Ludwigsburg",
      "details": "08.07.2025 (Bekanntmachungsdatum)\n\nBaden-Württemberg Amtsgericht Stuttgart HRA 742006\nRegisterbekanntmachung nach dem Umwandlungsgesetz 08.07.2025 (Eintragungsdatum)\n\nMassa e. K.\nEinzelkaufmann / Einzelkauffrau\nLudwigsburg\n\nAls nicht eingetragen wird bekanntgemacht:\nDen Gläubigern der an der Ausgliederung beteiligten Rechtsträger ist, wenn sie binnen sechs Monaten nach dem Tag, an dem die Eintragung der Ausgliederung in das Register des Sitzes desjenigen Rechtsträgers, dessen Gläubiger sie sind, nach § 19 Abs. 3 UmwG als bekanntgemacht gilt, ihren Anspruch nach Grund und Höhe schriftlich anmelden, Sicherheit zu leisten, soweit sie nicht Befriedigung verlangen können. Dieses Recht steht den Gläubigern jedoch nur zu, wenn sie glaubhaft machen, dass durch die Ausgliederung die Erfüllung ihrer Forderung gefährdet wird."
    },
    {
      "date": "2025-07-08",
      "id": "114936",
      "original_text": "Registerbekanntmachung nach dem Umwandlungsgesetz\nBaden-Württemberg Amtsgericht Freiburg HRA 471147\nWACKERBAU GmbH & Co. KG – Offenburg",
      "type": "Registerbekanntmachung nach dem Umwandlungsgesetz",
      "state": "Baden-Württemberg",
      "amtsgericht": "Amtsgericht Freiburg",
      "registernummer": "HRA 471147",
      "registerart": "HRA",
      "company_name": "WACKERBAU GmbH & Co. KG",
      "company_seat": "Offenburg",
      "details": "08.07.2025 (Bekanntmachungsdatum)\n\nBaden-Württemberg Amtsgericht Freiburg HRA 471147\nRegisterbekanntmachung nach dem Umwandlungsgesetz 08.07.2025 (Eintragungsdatum)\n\nWACKERBAU GmbH & Co. KG\nKommanditgesellschaft\nOffenburg\n\nAls nicht eingetragen wird bekanntgemacht:\nDen Gläubigern der an der Verschmelzung beteiligten Rechtsträger ist, wenn sie binnen sechs Monaten nach dem Tag, an dem die Eintragung der Verschmelzung in das Register des Sitzes desjenigen Rechtsträgers, dessen Gläubiger sie sind, nach § 19 Abs. 3 UmwG als bekanntgemacht gilt, ihren Anspruch nach Grund und Höhe schriftlich anmelden, Sicherheit zu leisten, soweit sie nicht Befriedigung verlangen können. Dieses Recht steht den Gläubigern jedoch nur zu, wenn sie glaubhaft machen, dass durch die Verschmelzung die Erfüllung ihrer Forderung gefährdet wird."
    },
    {
      "date": "2025-07-08",
      "id": "114937",
      "original_text": "Registerbekanntmachung nach dem Umwandlungsgesetz\nBaden-Württemberg Amtsgericht Freiburg HRB 723108\nB8 GmbH – Offenburg",
      "type": "Registerbekanntmachung nach dem Umwandlungsgesetz",
      "state": "Baden-Württemberg",
      "amtsgericht": "Amtsgericht Freiburg",
      "registernummer": "HRB 723108",
      "registerart": "HRB",
      "company_name": "B8 GmbH",
      "company_seat": "Offenburg",
      "details": "08.07.2025 (Bekanntmachungsdatum)\n\nBaden-Württemberg Amtsgericht Freiburg HRB 723108\nRegisterbekanntmachung nach dem Umwandlungsgesetz 08.07.2025 (Eintragungsdatum)\n\nB8 GmbH\nGesellschaft mit beschränkter Haftung\nOffenburg\n\nAls nicht eingetragen wird bekanntgemacht:\nDen Gläubigern der an der Verschmelzung beteiligten Rechtsträger ist, wenn sie binnen sechs Monaten nach dem Tag, an dem die Eintragung der Verschmelzung in das Register des Sitzes desjenigen Rechtsträgers, dessen Gläubiger sie sind, nach § 19 Abs. 3 UmwG als bekanntgemacht gilt, ihren Anspruch nach Grund und Höhe schriftlich anmelden, Sicherheit zu leisten, soweit sie nicht Befriedigung verlangen können. Dieses Recht steht den Gläubigern jedoch nur zu, wenn sie glaubhaft machen, dass durch die Verschmelzung die Erfüllung ihrer Forderung gefährdet wird."
    },
    {
      "date": "2025-07-08",
      "id": "114938",
      "original_text": "Löschungsankündigung\nBrandenburg Amtsgericht Potsdam HRB 4125\nWITA GmbH Wittmann Institute of Technology and Analysis of Biomolecules – Teltow",
      "type": "Löschungsankündigung",
      "state": "Brandenburg",
      "amtsgericht": "Amtsgericht Potsdam",
      "registernummer": "HRB 4125",
      "registerart": "HRB",
      "company_name": "WITA GmbH Wittmann Institute of Technology and Analysis of Biomolecules",
      "company_seat": "Teltow",
      "details": "08.07.2025 (Bekanntmachungsdatum)\n\nBrandenburg Amtsgericht Potsdam HRB 4125\nLöschungsankündigung\n\nWITA GmbH Wittmann Institute of Technology and Analysis of Biomolecules\nGesellschaft mit beschränkter Haftung\nTeltow\n\nBei der nachstehenden Gesellschaft wird das Amtslöschungsverfahren gemäß § 394 FamFG eingeleitet."
    },
    {
      "date": "2025-07-08",
      "id": "114939",
      "original_text": "Registerbekanntmachung nach dem Umwandlungsgesetz\nSachsen-Anhalt Amtsgericht Stendal HRB 36092\nSilicon Products Bitterfeld GmbH – Bitterfeld-Wolfen",
      "type": "Registerbekanntmachung nach dem Umwandlungsgesetz",
      "state": "Sachsen-Anhalt",
      "amtsgericht": "Amtsgericht Stendal",
      "registernummer": "HRB 36092",
      "registerart": "HRB",
      "company_name": "Silicon Products Bitterfeld GmbH",
      "company_seat": "Bitterfeld-Wolfen",
      "details": "08.07.2025 (Bekanntmachungsdatum)\n\nSachsen-Anhalt Amtsgericht Stendal HRB 36092\nRegisterbekanntmachung nach dem Umwandlungsgesetz 08.07.2025 (Eintragungsdatum)\n\nSilicon Products Bitterfeld GmbH\nGesellschaft mit beschränkter Haftung\nBitterfeld-Wolfen\n\nNicht eingetragen:\nDen Gläubigern des formwechselnden  Rechtsträgers, ist wenn sie binnen sechs Monaten nach dem Tag, an dem die Eintragung des Formwechsels nach § 201 UmwG als bekanntgemacht gilt, ihren Anspruch nach Grund und Höhe schriftlich anmelden, Sicherheit zu leisten, soweit sie nicht Befriedigung verlangen können. Dieses Recht steht ihnen jedoch nur zu, wenn sie glaubhaft machen, dass durch den Formwechsel die Erfüllung ihrer Forderung gefährdet wird."
    },
    {
      "date": "2025-07-08",
      "id": "114940",
      "original_text": "Sonstige Registerbekanntmachung\nSachsen-Anhalt Amtsgericht Stendal HRB 31785\nTESVOLT AG – Lutherstadt Wittenberg",
      "type": "Sonstige Registerbekanntmachung",
      "state": "Sachsen-Anhalt",
      "amtsgericht": "Amtsgericht Stendal",
      "registernummer": "HRB 31785",
      "registerart": "HRB",
      "company_name": "TESVOLT AG",
      "company_seat": "Lutherstadt Wittenberg",
      "details": "08.07.2025 (Bekanntmachungsdatum)\n\nSachsen-Anhalt Amtsgericht Stendal HRB 31785\nSonstige Registerbekanntmachung\n\nTESVOLT AG\nAktiengesellschaft\nLutherstadt Wittenberg\n\nEine Liste der Mitglieder des Aufsichtsrates wurde zum Handelsregister eingereicht."
    },
    {
      "date": "2025-07-08",
      "id": "114941",
      "original_text": "Registerbekanntmachung nach dem Umwandlungsgesetz\nSachsen-Anhalt Amtsgericht Stendal HRA 3992\nSilicon Products Bitterfeld GmbH & Co. KG – Bitterfeld-Wolfen",
      "type": "Registerbekanntmachung nach dem Umwandlungsgesetz",
      "state": "Sachsen-Anhalt",
      "amtsgericht": "Amtsgericht Stendal",
      "registernummer": "HRA 3992",
      "registerart": "HRA",
      "company_name": "Silicon Products Bitterfeld GmbH & Co. KG",
      "company_seat": "Bitterfeld-Wolfen",
      "details": "08.07.2025 (Bekanntmachungsdatum)\n\nSachsen-Anhalt Amtsgericht Stendal HRA 3992\nRegisterbekanntmachung nach dem Umwandlungsgesetz 08.07.2025 (Eintragungsdatum)\n\nSilicon Products Bitterfeld GmbH & Co. KG\nKommanditgesellschaft\nBitterfeld-Wolfen\n\nNicht eingetragen:\nDen Gläubigern des formwechselnden  Rechtsträgers, ist wenn sie binnen sechs Monaten nach dem Tag, an dem die Eintragung des Formwechsels nach § 201 UmwG als bekanntgemacht gilt, ihren Anspruch nach Grund und Höhe schriftlich anmelden, Sicherheit zu leisten, soweit sie nicht Befriedigung verlangen können. Dieses Recht steht ihnen jedoch nur zu, wenn sie glaubhaft machen, dass durch den Formwechsel die Erfüllung ihrer Forderung gefährdet wird."
    },
    {
      "date": "2025-07-08",
      "id": "114942",
      "original_text": "Löschungsankündigung\nSchleswig-Holstein Amtsgericht Kiel HRB 5235 NO\nYoung Man Automobile Deutschland GmbH – Kaltenkirchen",
      "type": "Löschungsankündigung",
      "state": "Schleswig-Holstein",
      "amtsgericht": "Amtsgericht Kiel",
      "registernummer": "HRB 5235 NO",
      "registerart": "HRB",
      "company_name": "Young Man Automobile Deutschland GmbH",
      "company_seat": "Kaltenkirchen",
      "details": "08.07.2025 (Bekanntmachungsdatum)\n\nSchleswig-Holstein Amtsgericht Kiel HRB 5235 NO\nLöschungsankündigung\n\nYoung Man Automobile Deutschland GmbH\nGesellschaft mit beschränkter Haftung\nKaltenkirchen\n\nEs ist die Löschung der nachstehenden Gesellschaft wegen Vermögenslosigkeit gemäß § 394 FamFG beabsichtigt. Widerspruchsfrist: 2 Monate."
    },
    {
      "date": "2025-07-08",
      "id": "114943",
      "original_text": "Sonstige Registerbekanntmachung\nSchleswig-Holstein Amtsgericht Flensburg HRB 2760\nRobbe & Berking Silbermanufaktur International GmbH – Flensburg",
      "type": "Sonstige Registerbekanntmachung",
      "state": "Schleswig-Holstein",
      "amtsgericht": "Amtsgericht Flensburg",
      "registernummer": "HRB 2760",
      "registerart": "HRB",
      "company_name": "Robbe & Berking Silbermanufaktur International GmbH",
      "company_seat": "Flensburg",
      "details": "08.07.2025 (Bekanntmachungsdatum)\n\nSchleswig-Holstein Amtsgericht Flensburg HRB 2760\nSonstige Registerbekanntmachung\n\nRobbe & Berking Silbermanufaktur International GmbH\nGesellschaft mit beschränkter Haftung\nFlensburg\n\nAls nicht eingetragen wird veröffentlicht: Der andere Vertragsteil hat den Gläubigern dieses Rechtsträgers, dessen Forderungen begründet worden sind, bevor die Eintragung der Beendigung dieses Vertrages in das Handelsregister nach § 10 des Handelsgesetzbuches als bekannt gemacht gilt, Sicherheit zu leisten, wenn sie sich binnen sechs Monaten nach der Bekanntmachung der Eintragung zu diesem Zweck bei ihm melden. Dieses Recht steht den Gläubigern nicht zu, die im Fall des Insolvenzverfahrens ein Recht auf vorzugsweise Befriedigung aus der Deckungsmasse haben, die nach gesetzlicher Vorschrift zu ihrem Schutz errichtet und staatlich überwacht ist."
    },
    {
      "date": "2025-07-08",
      "id": "114944",
      "original_text": "Registerbekanntmachung nach dem Umwandlungsgesetz\nBaden-Württemberg Amtsgericht Stuttgart HRB 781533\ndiconium auto GmbH – Stuttgart",
      "type": "Registerbekanntmachung nach dem Umwandlungsgesetz",
      "state": "Baden-Württemberg",
      "amtsgericht": "Amtsgericht Stuttgart",
      "registernummer": "HRB 781533",
      "registerart": "HRB",
      "company_name": "diconium auto GmbH",
      "company_seat": "Stuttgart",
      "details": "08.07.2025 (Bekanntmachungsdatum)\n\nBaden-Württemberg Amtsgericht Stuttgart HRB 781533\nRegisterbekanntmachung nach dem Umwandlungsgesetz 08.07.2025 (Eintragungsdatum)\n\ndiconium auto GmbH\nGesellschaft mit beschränkter Haftung\nStuttgart\n\nAls nicht eingetragen wird bekanntgemacht:\nDen Gläubigern der an der Verschmelzung beteiligten Rechtsträger ist, wenn sie binnen sechs Monaten nach dem Tag, an dem die Eintragung der Verschmelzung in das Register des Sitzes desjenigen Rechtsträgers, dessen Gläubiger sie sind, nach § 19 Abs. 3 UmwG als bekanntgemacht gilt, ihren Anspruch nach Grund und Höhe schriftlich anmelden, Sicherheit zu leisten, soweit sie nicht Befriedigung verlangen können. Dieses Recht steht den Gläubigern jedoch nur zu, wenn sie glaubhaft machen, dass durch die Verschmelzung die Erfüllung ihrer Forderung gefährdet wird."
    },
    {
      "date": "2025-07-08",
      "id": "114945",
      "original_text": "Löschungsankündigung\nBaden-Württemberg Amtsgericht Freiburg HRB 728117\nFlorea M&P GmbH – Schluchsee",
      "type": "Löschungsankündigung",
      "state": "Baden-Württemberg",
      "amtsgericht": "Amtsgericht Freiburg",
      "registernummer": "HRB 728117",
      "registerart": "HRB",
      "company_name": "Florea M&P GmbH",
      "company_seat": "Schluchsee",
      "details": "08.07.2025 (Bekanntmachungsdatum)\n\nBaden-Württemberg Amtsgericht Freiburg HRB 728117\nLöschungsankündigung\n\nFlorea M&P GmbH\nGesellschaft mit beschränkter Haftung\nSchluchsee\n\nAls nicht eingetragen wird bekanntgemacht:\nDas Gericht beabsichtigt, die Gesellschaft wegen Vermögenslosigkeit im Handelsregister von Amts wegen nach § 394 FamFG zu löschen. Die Frist zur Geltendmachung eines Widerspruchs gegen die beabsichtigte Löschung ist auf einen Monat ab Veröffentlichung bestimmt."
    },
    {
      "date": "2025-07-08",
      "id": "114946",
      "original_text": "Registerbekanntmachung nach dem Umwandlungsgesetz\nBerlin Amtsgericht Berlin (Charlottenburg) HRB 24240\nKRIEGER Patientenversorgung Homecare GmbH – Berlin",
      "type": "Registerbekanntmachung nach dem Umwandlungsgesetz",
      "state": "Berlin",
      "amtsgericht": "Amtsgericht Berlin (Charlottenburg)",
      "registernummer": "HRB 24240",
      "registerart": "HRB",
      "company_name": "KRIEGER Patientenversorgung Homecare GmbH",
      "company_seat": "Berlin",
      "details": "08.07.2025 (Bekanntmachungsdatum)\n\nBerlin Amtsgericht Berlin (Charlottenburg) HRB 24240\nRegisterbekanntmachung nach dem Umwandlungsgesetz 07.07.2025 (Eintragungsdatum)\n\nKRIEGER Patientenversorgung Homecare  GmbH\nGesellschaft mit beschränkter Haftung\nBerlin\n\nZu Eintragungsnummer 29 vom 07.07.2025 wird als nicht eingetragen veröffentlicht:Den Gläubigern der an der Verschmelzung beteiligten Rechtsträger ist, wenn sie binnen sechs Monaten nach dem Tag, an dem die Eintragung der Verschmelzung in das Register des Sitzes desjenigen Rechtsträgers, dessen Gläubiger sie sind, als bekannt gemacht gilt, ihren Anspruch nach Grund und Höhe schriftlich anmelden, Sicherheit zu leisten, soweit sie nicht Befriedigung verlangen können. Dieses Recht steht den Gläubigern jedoch nur zu, wenn sie glaubhaft machen, dass durch die Verschmelzung die Erfüllung ihrer Forderung gefährdet wird. Das Recht, Sicherheitsleistung zu verlangen, steht Gläubigern nicht zu, die im Falle der Insolvenz ein Recht auf vorzugsweise Befriedigung aus einer Deckungsmasse haben, die nach gesetzlicher Vorschrift zu ihrem Schutz errichtet und staatlich überwacht ist."
    },
    {
      "date": "2025-07-08",
      "id": "114947",
      "original_text": "Registerbekanntmachung nach dem Umwandlungsgesetz\nBaden-Württemberg Amtsgericht Freiburg HRA 700731\nKarl Schleicher GmbH & Co. KG – Bad Dürrheim",
      "type": "Registerbekanntmachung nach dem Umwandlungsgesetz",
      "state": "Baden-Württemberg",
      "amtsgericht": "Amtsgericht Freiburg",
      "registernummer": "HRA 700731",
      "registerart": "HRA",
      "company_name": "Karl Schleicher GmbH & Co. KG",
      "company_seat": "Bad Dürrheim",
      "details": "08.07.2025 (Bekanntmachungsdatum)\n\nBaden-Württemberg Amtsgericht Freiburg HRA 700731\nRegisterbekanntmachung nach dem Umwandlungsgesetz 08.07.2025 (Eintragungsdatum)\n\nKarl Schleicher GmbH & Co. KG\nKommanditgesellschaft\nBad Dürrheim\n\nAls nicht eingetragen wird bekanntgemacht:\nDen Gläubigern der an der Verschmelzung beteiligten Rechtsträger ist, wenn sie binnen sechs Monaten nach dem Tag, an dem die Eintragung der Verschmelzung in das Register des Sitzes desjenigen Rechtsträgers, dessen Gläubiger sie sind, nach § 19 Abs. 3 UmwG als bekanntgemacht gilt, ihren Anspruch nach Grund und Höhe schriftlich anmelden, Sicherheit zu leisten, soweit sie nicht Befriedigung verlangen können. Dieses Recht steht den Gläubigern jedoch nur zu, wenn sie glaubhaft machen, dass durch die Verschmelzung die Erfüllung ihrer Forderung gefährdet wird."
    },
    {
      "date": "2025-07-08",
      "id": "114948",
      "original_text": "Registerbekanntmachung nach dem Umwandlungsgesetz\nHamburg Amtsgericht Hamburg HRB 127902\nTRUE2 GmbH – Hamburg",
      "type": "Registerbekanntmachung nach dem Umwandlungsgesetz",
      "state": "Hamburg",
      "amtsgericht": "Amtsgericht Hamburg",
      "registernummer": "HRB 127902",
      "registerart": "HRB",
      "company_name": "TRUE2 GmbH",
      "company_seat": "Hamburg",
      "details": "08.07.2025 (Bekanntmachungsdatum)\n\nHamburg Amtsgericht Hamburg HRB 127902\nRegisterbekanntmachung nach dem Umwandlungsgesetz 08.07.2025 (Eintragungsdatum)\n\nTRUE2 GmbH\nGesellschaft mit beschränkter Haftung\nHamburg\n\nAls nicht eingetragen wird bekannt gemacht:\nDen Gläubigern der an der Verschmelzung beteiligten Gesellschaften ist, wenn sie binnen sechs Monaten nach dem Tag, an dem die Eintragung der Verschmelzung in das Register des Sitzes desjenigen Rechtsträgers, dessen Gläubiger sie sind, nach § 19 Absatz 3 UmwG als bekannt gemacht gilt, ihren Anspruch nach Grund und Höhe schriftlich anmelden, Sicherheit zu leisten, soweit sie nicht Befriedigung verlangen können. Dieses Recht steht den Gläubigern jedoch nur zu, wenn sie glaubhaft machen, dass durch die Verschmelzung die Erfüllung ihrer Forderung gefährdet wird."
    },
    {
      "date": "2025-07-08",
      "id": "114949",
      "original_text": "Sonstige Registerbekanntmachung\nSachsen-Anhalt Amtsgericht Stendal HRB 110553\nBetriebsgesellschaft Freizeit- und Sportzentrum Halberstadt mbH – Halberstadt",
      "type": "Sonstige Registerbekanntmachung",
      "state": "Sachsen-Anhalt",
      "amtsgericht": "Amtsgericht Stendal",
      "registernummer": "HRB 110553",
      "registerart": "HRB",
      "company_name": "Betriebsgesellschaft Freizeit- und Sportzentrum Halberstadt mbH",
      "company_seat": "Halberstadt",
      "details": "08.07.2025 (Bekanntmachungsdatum)\n\nSachsen-Anhalt Amtsgericht Stendal HRB 110553\nSonstige Registerbekanntmachung\n\nBetriebsgesellschaft Freizeit- und Sportzentrum Halberstadt mbH\nGesellschaft mit beschränkter Haftung\nHalberstadt\n\nEine Liste der Mitglieder des Aufsichtsrates wurde zum Handelsregister eingereicht."
    },
    {
      "date": "2025-07-08",
      "id": "114950",
      "original_text": "Registerbekanntmachung nach dem Umwandlungsgesetz\nBaden-Württemberg Amtsgericht Freiburg HRB 706179\nBUSCH AG – Freiburg im Breisgau",
      "type": "Registerbekanntmachung nach dem Umwandlungsgesetz",
      "state": "Baden-Württemberg",
      "amtsgericht": "Amtsgericht Freiburg",
      "registernummer": "HRB 706179",
      "registerart": "HRB",
      "company_name": "BUSCH AG",
      "company_seat": "Freiburg im Breisgau",
      "details": "08.07.2025 (Bekanntmachungsdatum)\n\nBaden-Württemberg Amtsgericht Freiburg HRB 706179\nRegisterbekanntmachung nach dem Umwandlungsgesetz 08.07.2025 (Eintragungsdatum)\n\nBUSCH AG\nAktiengesellschaft\nFreiburg im Breisgau\n\nDen Gläubigern der an der Verschmelzung beteiligten Rechtsträger ist, wenn sie binnen sechs Monaten nach dem Tag, an dem die Eintragung der Verschmelzung in das Register des Sitzes desjenigen Rechtsträgers, dessen Gläubiger sie sind, nach § 19 Abs. 3 UmwG als bekanntgemacht gilt, ihren Anspruch nach Grund und Höhe schriftlich anmelden, Sicherheit zu leisten, soweit sie nicht Befriedigung verlangen können. Dieses Recht steht den Gläubigern jedoch nur zu, wenn sie glaubhaft machen, dass durch die Verschmelzung die Erfüllung ihrer Forderung gefährdet wird."
    },
    {
      "date": "2025-07-08",
      "id": "114951",
      "original_text": "Einreichung neuer Dokumente\nSchleswig-Holstein Amtsgericht Lübeck HRB 9\nL. Possehl & Co. mit beschränkter Haftung – Lübeck",
      "type": "Einreichung neuer Dokumente",
      "state": "Schleswig-Holstein",
      "amtsgericht": "Amtsgericht Lübeck",
      "registernummer": "HRB 9",
      "registerart": "HRB",
      "company_name": "L. Possehl & Co. mit beschränkter Haftung",
      "company_seat": "Lübeck",
      "details": "08.07.2025 (Bekanntmachungsdatum)\n\nSchleswig-Holstein Amtsgericht Lübeck HRB 9\nEinreichung neuer Dokumente\n\nL. Possehl & Co. mit beschränkter Haftung\nGesellschaft mit beschränkter Haftung\nLübeck\n\nAls nicht eingetragen wird veröffentlicht: Es wurde eine aktuelle Liste der Aufsichtsratsmitglieder zum Handelsregister eingereicht."
    },
    {
      "date": "2025-07-08",
      "id": "114952",
      "original_text": "Registerbekanntmachung nach dem Umwandlungsgesetz\nSchleswig-Holstein Amtsgericht Lübeck HRB 24018\nVerwaltung König & Cie. Britische Leben GmbH – Ratzeburg",
      "type": "Registerbekanntmachung nach dem Umwandlungsgesetz",
      "state": "Schleswig-Holstein",
      "amtsgericht": "Amtsgericht Lübeck",
      "registernummer": "HRB 24018",
      "registerart": "HRB",
      "company_name": "Verwaltung König & Cie. Britische Leben GmbH",
      "company_seat": "Ratzeburg",
      "details": "08.07.2025 (Bekanntmachungsdatum)\n\nSchleswig-Holstein Amtsgericht Lübeck HRB 24018\nRegisterbekanntmachung nach dem Umwandlungsgesetz 07.07.2025 (Eintragungsdatum)\n\nVerwaltung König & Cie. Britische Leben GmbH\nGesellschaft mit beschränkter Haftung\nRatzeburg\n\nZu Eintragungsnummer 3 vom 07.07.2025 wird als nicht eingetragen veröffentlicht:\nDen Gläubigern der an der Verschmelzung beteiligten Rechtsträger ist, wenn sie binnen sechs Monaten nach dem Tag, an dem die Eintragung der Verschmelzung in das Register des Sitzes desjenigen Rechtsträgers, dessen Gläubiger sie sind, als bekannt gemacht gilt, ihren Anspruch nach Grund und Höhe schriftlich anmelden, Sicherheit zu leisten, soweit sie nicht Befriedigung verlangen können. Dieses Recht steht den Gläubigern jedoch nur zu, wenn sie glaubhaft machen, dass durch die Verschmelzung die Erfüllung ihrer Forderung gefährdet wird."
    },
    {
      "date": "2025-07-08",
      "id": "114953",
      "original_text": "Registerbekanntmachung nach dem Umwandlungsgesetz\nBaden-Württemberg Amtsgericht Mannheim HRB 732946\ncf Fitness Bretten GmbH – Bretten",
      "type": "Registerbekanntmachung nach dem Umwandlungsgesetz",
      "state": "Baden-Württemberg",
      "amtsgericht": "Amtsgericht Mannheim",
      "registernummer": "HRB 732946",
      "registerart": "HRB",
      "company_name": "cf Fitness Bretten GmbH",
      "company_seat": "Bretten",
      "details": "08.07.2025 (Bekanntmachungsdatum)\n\nBaden-Württemberg Amtsgericht Mannheim HRB 732946\nRegisterbekanntmachung nach dem Umwandlungsgesetz 08.07.2025 (Eintragungsdatum)\n\ncf Fitness Bretten GmbH\nGesellschaft mit beschränkter Haftung\nBretten\n\nDen Gläubigern der an der Verschmelzung beteiligten Rechtsträger ist, wenn sie binnen sechs Monaten nach dem Tag, an dem die Eintragung der Verschmelzung in das Register des Sitzes desjenigen Rechtsträgers, dessen Gläubiger sie sind, nach § 19 Abs. 3 UmwG als bekanntgemacht gilt, ihren Anspruch nach Grund und Höhe schriftlich anmelden, Sicherheit zu leisten, soweit sie nicht Befriedigung verlangen können. Dieses Recht steht den Gläubigern jedoch nur zu, wenn sie glaubhaft machen, dass durch die Verschmelzung die Erfüllung ihrer Forderung gefährdet wird."
    },
    {
      "date": "2025-07-08",
      "id": "114954",
      "original_text": "Sonstige Registerbekanntmachung\nHamburg Amtsgericht Hamburg HRB 81346\nSyndicate Design AG – Hamburg",
      "type": "Sonstige Registerbekanntmachung",
      "state": "Hamburg",
      "amtsgericht": "Amtsgericht Hamburg",
      "registernummer": "HRB 81346",
      "registerart": "HRB",
      "company_name": "Syndicate Design AG",
      "company_seat": "Hamburg",
      "details": "08.07.2025 (Bekanntmachungsdatum)\n\nHamburg Amtsgericht Hamburg HRB 81346\nSonstige Registerbekanntmachung\n\nSyndicate Design AG\nAktiengesellschaft\nHamburg\n\nAls nicht eingetragen wird bekannt gemacht: Liste des Aufsichtsrats wurde eingereicht."
    },
    {
      "date": "2025-07-08",
      "id": "114955",
      "original_text": "Löschungsankündigung\nBaden-Württemberg Amtsgericht Stuttgart HRB 729274\nMetallbau EJE Kehrer Unternehmergesellschaft (haftungsbeschränkt) – Ofterdingen",
      "type": "Löschungsankündigung",
      "state": "Baden-Württemberg",
      "amtsgericht": "Amtsgericht Stuttgart",
      "registernummer": "HRB 729274",
      "registerart": "HRB",
      "company_name": "Metallbau EJE Kehrer Unternehmergesellschaft (haftungsbeschränkt)",
      "company_seat": "Ofterdingen",
      "details": "08.07.2025 (Bekanntmachungsdatum)\n\nBaden-Württemberg Amtsgericht Stuttgart HRB 729274\nLöschungsankündigung 08.07.2025 (Eintragungsdatum)\n\nMetallbau EJE Kehrer Unternehmergesellschaft (haftungsbeschränkt)\nGesellschaft mit beschränkter Haftung\nOfterdingen\n\nAls nicht eingetragen wird bekanntgemacht:\nDas Gericht beabsichtigt, die Gesellschaft wegen Vermögenslosigkeit im Handelsregister von Amts wegen nach § 394 FamFG zu löschen. Die Frist zur Geltendmachung eines Widerspruchs gegen die beabsichtigte Löschung ist auf zwei Monate ab Veröffentlichung bestimmt."
    },
    {
      "date": "2025-07-08",
      "id": "114956",
      "original_text": "Registerbekanntmachung nach dem Umwandlungsgesetz\nBrandenburg Amtsgericht Potsdam HRB 26316\nFremantleMedia International Germany GmbH – Potsdam",
      "type": "Registerbekanntmachung nach dem Umwandlungsgesetz",
      "state": "Brandenburg",
      "amtsgericht": "Amtsgericht Potsdam",
      "registernummer": "HRB 26316",
      "registerart": "HRB",
      "company_name": "FremantleMedia International Germany GmbH",
      "company_seat": "Potsdam",
      "details": "08.07.2025 (Bekanntmachungsdatum)\n\nBrandenburg Amtsgericht Potsdam HRB 26316\nRegisterbekanntmachung nach dem Umwandlungsgesetz 02.07.2025 (Eintragungsdatum)\n\nFremantleMedia International Germany GmbH\nGesellschaft mit beschränkter Haftung\nPotsdam\n\nZu Eintragungsnummer 10 vom 02.07.2025 wird als nicht eingetragen veröffentlicht:\nDen Gläubigern der an der Verschmelzung beteiligten Rechtsträger ist, wenn sie binnen sechs Monaten nach dem Tag, an dem die Eintragung der Verschmelzung in das Register des Sitzes desjenigen Rechtsträgers, dessen Gläubiger sie sind, als bekannt gemacht gilt, ihren Anspruch nach Grund und Höhe schriftlich anmelden, Sicherheit zu leisten, soweit sie nicht Befriedigung verlangen können. Dieses Recht steht den Gläubigern jedoch nur zu, wenn sie glaubhaft machen, dass durch die Verschmelzung die Erfüllung ihrer Forderung gefährdet wird."
    },
    {
      "date": "2025-07-08",
      "id": "114957",
      "original_text": "Löschungsankündigung\nBrandenburg Amtsgericht Neuruppin HRB 12963\nBau- und Immobilien GmbH Oranienburg – Oranienburg",
      "type": "Löschungsankündigung",
      "state": "Brandenburg",
      "amtsgericht": "Amtsgericht Neuruppin",
      "registernummer": "HRB 12963",
      "registerart": "HRB",
      "company_name": "Bau- und Immobilien GmbH Oranienburg",
      "company_seat": "Oranienburg",
      "details": "08.07.2025 (Bekanntmachungsdatum)\n\nBrandenburg Amtsgericht Neuruppin HRB 12963\nLöschungsankündigung\n\nBau- und Immobilien GmbH Oranienburg\nGesellschaft mit beschränkter Haftung\nOranienburg\n\nBei der nachstehenden Gesellschaft wird das Amtslöschungsverfahren gemäß § 394 FamFG eingeleitet.\nWiderspruchsfrist: 1 Monat"
    },
    {
      "date": "2025-07-08",
      "id": "114958",
      "original_text": "Registerbekanntmachung nach dem Umwandlungsgesetz\nHamburg Amtsgericht Hamburg HRB 64041\nRichard Schulte Consult Personalmanagement GmbH – Hamburg",
      "type": "Registerbekanntmachung nach dem Umwandlungsgesetz",
      "state": "Hamburg",
      "amtsgericht": "Amtsgericht Hamburg",
      "registernummer": "HRB 64041",
      "registerart": "HRB",
      "company_name": "Richard Schulte Consult Personalmanagement GmbH",
      "company_seat": "Hamburg",
      "details": "08.07.2025 (Bekanntmachungsdatum)\n\nHamburg Amtsgericht Hamburg HRB 64041\nRegisterbekanntmachung nach dem Umwandlungsgesetz 08.07.2025 (Eintragungsdatum)\n\nRichard Schulte Consult Personalmanagement GmbH\nGesellschaft mit beschränkter Haftung\nHamburg\n\nAls nicht eingetragen wird bekannt gemacht:\nDen Gläubigern der an der Verschmelzung beteiligten Gesellschaften ist, wenn sie binnen sechs Monaten nach dem Tag, an dem die Eintragung der Verschmelzung in das Register des Sitzes desjenigen Rechtsträgers, dessen Gläubiger sie sind, nach § 19 Absatz 3 UmwG als bekannt gemacht gilt, ihren Anspruch nach Grund und Höhe schriftlich anmelden, Sicherheit zu leisten, soweit sie nicht Befriedigung verlangen können. Dieses Recht steht den Gläubigern jedoch nur zu, wenn sie glaubhaft machen, dass durch die Verschmelzung die Erfüllung ihrer Forderung gefährdet wird."
    },
    {
      "date": "2025-07-08",
      "id": "114959",
      "original_text": "Registerbekanntmachung nach dem Umwandlungsgesetz\nHamburg Amtsgericht Hamburg HRB 177200\nWECOYA SPECIALTY Underwriting GmbH – Hamburg",
      "type": "Registerbekanntmachung nach dem Umwandlungsgesetz",
      "state": "Hamburg",
      "amtsgericht": "Amtsgericht Hamburg",
      "registernummer": "HRB 177200",
      "registerart": "HRB",
      "company_name": "WECOYA SPECIALTY Underwriting GmbH",
      "company_seat": "Hamburg",
      "details": "08.07.2025 (Bekanntmachungsdatum)\n\nHamburg Amtsgericht Hamburg HRB 177200\nRegisterbekanntmachung nach dem Umwandlungsgesetz 08.07.2025 (Eintragungsdatum)\n\nWECOYA SPECIALTY Underwriting GmbH\nGesellschaft mit beschränkter Haftung\nHamburg\n\nAls nicht eingetragen wird bekannt gemacht:\nDen Gläubigern der an der Verschmelzung beteiligten Gesellschaften ist, wenn sie binnen sechs Monaten nach dem Tag, an dem die Eintragung der Verschmelzung in das Register des Sitzes desjenigen Rechtsträgers, dessen Gläubiger sie sind, nach § 19 Absatz 3 UmwG als bekannt gemacht gilt, ihren Anspruch nach Grund und Höhe schriftlich anmelden, Sicherheit zu leisten, soweit sie nicht Befriedigung verlangen können. Dieses Recht steht den Gläubigern jedoch nur zu, wenn sie glaubhaft machen, dass durch die Verschmelzung die Erfüllung ihrer Forderung gefährdet wird."
    },
    {
      "date": "2025-07-08",
      "id": "114960",
      "original_text": "Löschungsankündigung\nBaden-Württemberg Amtsgericht Stuttgart HRA 723373\nIdima GmbH & Co. KG – Waiblingen",
      "type": "Löschungsankündigung",
      "state": "Baden-Württemberg",
      "amtsgericht": "Amtsgericht Stuttgart",
      "registernummer": "HRA 723373",
      "registerart": "HRA",
      "company_name": "Idima GmbH & Co. KG",
      "company_seat": "Waiblingen",
      "details": "08.07.2025 (Bekanntmachungsdatum)\n\nBaden-Württemberg Amtsgericht Stuttgart HRA 723373\nLöschungsankündigung\n\nIdima GmbH & Co. KG\nKommanditgesellschaft\nWaiblingen\n\nDas Gericht beabsichtigt, die Gesellschaft wegen Vermögenslosigkeit im Handelsregister von Amts wegen nach § 394 FamFG zu löschen. Die Frist zur Geltendmachung eines Widerspruchs gegen die beabsichtigte Löschung ist auf zwei Monate ab Veröffentlichung bestimmt."
    },
    {
      "date": "2025-07-08",
      "id": "114961",
      "original_text": "Registerbekanntmachung nach dem Umwandlungsgesetz\nThüringen Amtsgericht Jena HRB 519767\nBWI - Bildungswerk Invest GmbH – Gera",
      "type": "Registerbekanntmachung nach dem Umwandlungsgesetz",
      "state": "Thüringen",
      "amtsgericht": "Amtsgericht Jena",
      "registernummer": "HRB 519767",
      "registerart": "HRB",
      "company_name": "BWI - Bildungswerk Invest GmbH",
      "company_seat": "Gera",
      "details": "08.07.2025 (Bekanntmachungsdatum)\n\nThüringen Amtsgericht Jena HRB 519767\nRegisterbekanntmachung nach dem Umwandlungsgesetz 08.07.2025 (Eintragungsdatum)\n\nBWI - Bildungswerk Invest GmbH\nGesellschaft mit beschränkter Haftung\nGera\n\nNicht eingetragen: Den Gläubigern der an der Ausgliederung beteiligten Rechtsträger, ist wenn sie binnen sechs Monaten nach dem Tag, an dem die Eintragung der Ausgliederung in das Register des Sitzes desjenigen Rechtsträgers, dessen Gläubiger sie sind, nach §§125, 19 Abs. 3 UmwG als bekanntgemacht gilt, ihren Anspruch nach Grund und Höhe schriftlich anmelden, Sicherheit zu leisten, soweit sie nicht Befriedigung verlangen können. Dieses Recht steht ihnen jedoch nur zu, wenn sie glaubhaft machen, daß durch die Ausgliederung die Erfüllung ihrer Forderung gefährdet wird."
    },
    {
      "date": "2025-07-08",
      "id": "114962",
      "original_text": "Registerbekanntmachung nach dem Umwandlungsgesetz\nThüringen Amtsgericht Jena HRA 505241\nProjekt & Kommunikation Stöhr GmbH & Co. KG – Gera",
      "type": "Registerbekanntmachung nach dem Umwandlungsgesetz",
      "state": "Thüringen",
      "amtsgericht": "Amtsgericht Jena",
      "registernummer": "HRA 505241",
      "registerart": "HRA",
      "company_name": "Projekt & Kommunikation Stöhr GmbH & Co. KG",
      "company_seat": "Gera",
      "details": "08.07.2025 (Bekanntmachungsdatum)\n\nThüringen Amtsgericht Jena HRA 505241\nRegisterbekanntmachung nach dem Umwandlungsgesetz 08.07.2025 (Eintragungsdatum)\n\nProjekt & Kommunikation Stöhr GmbH & Co. KG\nKommanditgesellschaft\nGera\n\nNicht eingetragen: Den Gläubigern der an der Ausgliederung beteiligten Rechtsträger, ist wenn sie binnen sechs Monaten nach dem Tag, an dem die Eintragung der Ausgliederung in das Register des Sitzes desjenigen Rechtsträgers, dessen Gläubiger sie sind, nach §§125, 19 Abs. 3 UmwG als bekanntgemacht gilt, ihren Anspruch nach Grund und Höhe schriftlich anmelden, Sicherheit zu leisten, soweit sie nicht Befriedigung verlangen können. Dieses Recht steht ihnen jedoch nur zu, wenn sie glaubhaft machen, daß durch die Ausgliederung die Erfüllung ihrer Forderung gefährdet wird."
    },
    {
      "date": "2025-07-08",
      "id": "114963",
      "original_text": "Einreichung neuer Dokumente\nBaden-Württemberg Amtsgericht Stuttgart HRB 107207\nHeilbronn Marketing GmbH – Heilbronn",
      "type": "Einreichung neuer Dokumente",
      "state": "Baden-Württemberg",
      "amtsgericht": "Amtsgericht Stuttgart",
      "registernummer": "HRB 107207",
      "registerart": "HRB",
      "company_name": "Heilbronn Marketing GmbH",
      "company_seat": "Heilbronn",
      "details": "08.07.2025 (Bekanntmachungsdatum)\n\nBaden-Württemberg Amtsgericht Stuttgart HRB 107207\nEinreichung neuer Dokumente\n\nHeilbronn Marketing GmbH\nGesellschaft mit beschränkter Haftung\nHeilbronn\n\nDie Gesellschaft hat am 07.07.2025 die Liste über die Zusammensetzung des Aufsichtsrats zum Handelsregister eingereicht."
    },
    {
      "date": "2025-07-08",
      "id": "114964",
      "original_text": "Registerbekanntmachung nach dem Umwandlungsgesetz\nHamburg Amtsgericht Hamburg HRB 130095\nConceptIF PRO & BIZ Underwriting GmbH – Hamburg",
      "type": "Registerbekanntmachung nach dem Umwandlungsgesetz",
      "state": "Hamburg",
      "amtsgericht": "Amtsgericht Hamburg",
      "registernummer": "HRB 130095",
      "registerart": "HRB",
      "company_name": "ConceptIF PRO & BIZ Underwriting GmbH",
      "company_seat": "Hamburg",
      "details": "08.07.2025 (Bekanntmachungsdatum)\n\nHamburg Amtsgericht Hamburg HRB 130095\nRegisterbekanntmachung nach dem Umwandlungsgesetz 08.07.2025 (Eintragungsdatum)\n\nConceptIF PRO & BIZ Underwriting GmbH\nGesellschaft mit beschränkter Haftung\nHamburg\n\nAls nicht eingetragen wird bekannt gemacht:\nDen Gläubigern der an der Verschmelzung beteiligten Gesellschaften ist, wenn sie binnen sechs Monaten nach dem Tag, an dem die Eintragung der Verschmelzung in das Register des Sitzes desjenigen Rechtsträgers, dessen Gläubiger sie sind, nach § 19 Absatz 3 UmwG als bekannt gemacht gilt, ihren Anspruch nach Grund und Höhe schriftlich anmelden, Sicherheit zu leisten, soweit sie nicht Befriedigung verlangen können. Dieses Recht steht den Gläubigern jedoch nur zu, wenn sie glaubhaft machen, dass durch die Verschmelzung die Erfüllung ihrer Forderung gefährdet wird."
    },
    {
      "date": "2025-07-08",
      "id": "114965",
      "original_text": "Einreichung neuer Dokumente\nSchleswig-Holstein Amtsgericht Lübeck HRB 7395\nDrägerwerk Verwaltungs AG – Lübeck",
      "type": "Einreichung neuer Dokumente",
      "state": "Schleswig-Holstein",
      "amtsgericht": "Amtsgericht Lübeck",
      "registernummer": "HRB 7395",
      "registerart": "HRB",
      "company_name": "Drägerwerk Verwaltungs AG",
      "company_seat": "Lübeck",
      "details": "08.07.2025 (Bekanntmachungsdatum)\n\nSchleswig-Holstein Amtsgericht Lübeck HRB 7395\nEinreichung neuer Dokumente\n\nDrägerwerk Verwaltungs AG\nAktiengesellschaft\nLübeck\n\nAls nicht eingetragen wird veröffentlicht:\nEs wurde eine neue Liste der Aufsichtsratsmitglieder zum Handelsregister eingereicht."
    },
    {
      "date": "2025-07-08",
      "id": "114966",
      "original_text": "Einreichung neuer Dokumente\nBrandenburg Amtsgericht Potsdam HRB 2807\nTechnische Werke Brandenburg an der Havel GmbH – Brandenburg an der Havel",
      "type": "Einreichung neuer Dokumente",
      "state": "Brandenburg",
      "amtsgericht": "Amtsgericht Potsdam",
      "registernummer": "HRB 2807",
      "registerart": "HRB",
      "company_name": "Technische Werke Brandenburg an der Havel GmbH",
      "company_seat": "Brandenburg an der Havel",
      "details": "08.07.2025 (Bekanntmachungsdatum)\n\nBrandenburg Amtsgericht Potsdam HRB 2807\nEinreichung neuer Dokumente\n\nTechnische Werke Brandenburg an der Havel GmbH\nGesellschaft mit beschränkter Haftung\nBrandenburg an der Havel\n\nAls nicht eingetragen wird bekanntgemacht: Eine Liste der Mitglieder des Aufsichtsrates wurde zum Handelsregister eingereicht."
    },
    {
      "date": "2025-07-08",
      "id": "114967",
      "original_text": "Einreichung neuer Dokumente\nSchleswig-Holstein Amtsgericht Lübeck HRB 4097\nDräger Safety AG & Co. KGaA – Lübeck",
      "type": "Einreichung neuer Dokumente",
      "state": "Schleswig-Holstein",
      "amtsgericht": "Amtsgericht Lübeck",
      "registernummer": "HRB 4097",
      "registerart": "HRB",
      "company_name": "Dräger Safety AG & Co. KGaA",
      "company_seat": "Lübeck",
      "details": "08.07.2025 (Bekanntmachungsdatum)\n\nSchleswig-Holstein Amtsgericht Lübeck HRB 4097\nEinreichung neuer Dokumente\n\nDräger Safety AG & Co. KGaA\nKommanditgesellschaft auf Aktien\nLübeck\n\nAls nicht eingetragen wird veröffentlicht:\nEs wurde eine neue Liste der Aufsichtsratsmitglieder zum Handelsregister eingereicht."
    },
    {
      "date": "2025-07-08",
      "id": "114968",
      "original_text": "Registerbekanntmachung nach dem Umwandlungsgesetz\nBaden-Württemberg Amtsgericht Stuttgart HRB 742325\nRTS Gebäude-Management GmbH – Kupferzell",
      "type": "Registerbekanntmachung nach dem Umwandlungsgesetz",
      "state": "Baden-Württemberg",
      "amtsgericht": "Amtsgericht Stuttgart",
      "registernummer": "HRB 742325",
      "registerart": "HRB",
      "company_name": "RTS Gebäude-Management GmbH",
      "company_seat": "Kupferzell",
      "details": "08.07.2025 (Bekanntmachungsdatum)\n\nBaden-Württemberg Amtsgericht Stuttgart HRB 742325\nRegisterbekanntmachung nach dem Umwandlungsgesetz 08.07.2025 (Eintragungsdatum)\n\nRTS Gebäude-Management GmbH\nGesellschaft mit beschränkter Haftung\nKupferzell\n\nAls nicht eingetragen wird bekanntgemacht:\nDen Gläubigern der an der Verschmelzung beteiligten Rechtsträger ist, wenn sie binnen sechs Monaten nach dem Tag, an dem die Eintragung der Verschmelzung in das Register des Sitzes desjenigen Rechtsträgers, dessen Gläubiger sie sind, nach § 19 Abs. 3 UmwG als bekanntgemacht gilt, ihren Anspruch nach Grund und Höhe schriftlich anmelden, Sicherheit zu leisten, soweit sie nicht Befriedigung verlangen können. Dieses Recht steht den Gläubigern jedoch nur zu, wenn sie glaubhaft machen, dass durch die Verschmelzung die Erfüllung ihrer Forderung gefährdet wird."
    },
    {
      "date": "2025-07-08",
      "id": "114969",
      "original_text": "Registerbekanntmachung nach dem Umwandlungsgesetz\nNordrhein-Westfalen Amtsgericht Coesfeld HRB 10919\nRudolf Schmitz Verwaltungs GmbH – Südlohn",
      "type": "Registerbekanntmachung nach dem Umwandlungsgesetz",
      "state": "Nordrhein-Westfalen",
      "amtsgericht": "Amtsgericht Coesfeld",
      "registernummer": "HRB 10919",
      "registerart": "HRB",
      "company_name": "Rudolf Schmitz Verwaltungs GmbH",
      "company_seat": "Südlohn",
      "details": "08.07.2025 (Bekanntmachungsdatum)\n\nNordrhein-Westfalen Amtsgericht Coesfeld HRB 10919\nRegisterbekanntmachung nach dem Umwandlungsgesetz 08.07.2025 (Eintragungsdatum)\n\nRudolf Schmitz Verwaltungs GmbH\nGesellschaft mit beschränkter Haftung\nSüdlohn\n\nDen Gläubigern der an der Verschmelzung beteiligten Rechtsträger ist, wenn sie binnen sechs Monaten nach dem Tag, an dem die Eintragung der Verschmelzung in das Register des Sitzes desjenigen Rechtsträgers, dessen Gläubiger sie sind, nach § 19 Absatz 3 UmwG als bekanntgemacht gilt, ihren Anspruch nach Grund und Höhe schriftlich anmelden, Sicherheit zu leisten, soweit sie nicht Befriedigung verlangen können. Dieses Recht steht den Gläubigern jedoch nur zu, wenn sie glaubhaft machen, dass durch die Verschmelzung die Erfüllung ihrer Forderung gefährdet wird."
    },
    {
      "date": "2025-07-08",
      "id": "114970",
      "original_text": "Einreichung neuer Dokumente\nBaden-Württemberg Amtsgericht Freiburg HRB 702469\nHUMMEL AG – Denzlingen",
      "type": "Einreichung neuer Dokumente",
      "state": "Baden-Württemberg",
      "amtsgericht": "Amtsgericht Freiburg",
      "registernummer": "HRB 702469",
      "registerart": "HRB",
      "company_name": "HUMMEL AG",
      "company_seat": "Denzlingen",
      "details": "08.07.2025 (Bekanntmachungsdatum)\n\nBaden-Württemberg Amtsgericht Freiburg HRB 702469\nEinreichung neuer Dokumente\n\nHUMMEL AG\nAktiengesellschaft\nDenzlingen\n\nDie Gesellschaft hat am 05.06.2025 die Liste über die Zusammensetzung des Aufsichtsrats zum Handelsregister eingereicht."
    },
    {
      "date": "2025-07-08",
      "id": "114971",
      "original_text": "Löschungsankündigung\nSchleswig-Holstein Amtsgericht Flensburg HRB 8157\nDiedrichsen Sanierungs GmbH – Havetoft",
      "type": "Löschungsankündigung",
      "state": "Schleswig-Holstein",
      "amtsgericht": "Amtsgericht Flensburg",
      "registernummer": "HRB 8157",
      "registerart": "HRB",
      "company_name": "Diedrichsen Sanierungs GmbH",
      "company_seat": "Havetoft",
      "details": "08.07.2025 (Bekanntmachungsdatum)\n\nSchleswig-Holstein Amtsgericht Flensburg HRB 8157\nLöschungsankündigung\n\nDiedrichsen Sanierungs GmbH\nGesellschaft mit beschränkter Haftung\nHavetoft\n\nEs ist die Löschung der nachstehenden Gesellschaft wegen Vermögenslosigkeit gemäß § 394 FamFG beabsichtigt.\nWiderspruchsfrist: 2 Monate"
    },
    {
      "date": "2025-07-08",
      "id": "114972",
      "original_text": "Registerbekanntmachung nach dem Umwandlungsgesetz\nBerlin Amtsgericht Berlin (Charlottenburg) HRB 188442\nBBQ - Baumann Bildung und Qualifizierung GmbH – Berlin",
      "type": "Registerbekanntmachung nach dem Umwandlungsgesetz",
      "state": "Berlin",
      "amtsgericht": "Amtsgericht Berlin (Charlottenburg)",
      "registernummer": "HRB 188442",
      "registerart": "HRB",
      "company_name": "BBQ - Baumann Bildung und Qualifizierung GmbH",
      "company_seat": "Berlin",
      "details": "08.07.2025 (Bekanntmachungsdatum)\n\nBerlin Amtsgericht Berlin (Charlottenburg) HRB 188442\nRegisterbekanntmachung nach dem Umwandlungsgesetz 07.07.2025 (Eintragungsdatum)\n\nBBQ - Baumann Bildung und Qualifizierung GmbH\nGesellschaft mit beschränkter Haftung\nBerlin\n\nZu Eintragungsnummer 10 vom 07.07.2025 wird als nicht eingetragen veröffentlicht: Den Gläubigern der an der Verschmelzung beteiligten Rechtsträger ist, wenn sie binnen sechs Monaten nach dem Tag, an dem die Eintragung der Verschmelzung in das Register des Sitzes desjenigen Rechtsträgers, dessen Gläubiger sie sind, als bekannt gemacht gilt, ihren Anspruch nach Grund und Höhe schriftlich anmelden, Sicherheit zu leisten, soweit sie nicht Befriedigung verlangen können. Dieses Recht steht den Gläubigern jedoch nur zu, wenn sie glaubhaft machen, dass durch die Verschmelzung die Erfüllung ihrer Forderung gefährdet wird. Das Recht, Sicherheitsleistung zu verlangen, steht Gläubigern nicht zu, die im Falle der Insolvenz ein Recht auf vorzugsweise Befriedigung aus einer Deckungsmasse haben, die nach gesetzlicher Vorschrift zu ihrem Schutz errichtet und staatlich überwacht ist."
    },
    {
      "date": "2025-07-08",
      "id": "114973",
      "original_text": "Registerbekanntmachung nach dem Umwandlungsgesetz\nNordrhein-Westfalen Amtsgericht Coesfeld HRB 1488\nStadtwerke Coesfeld Gesellschaft mit beschränkter Haftung – Coesfeld",
      "type": "Registerbekanntmachung nach dem Umwandlungsgesetz",
      "state": "Nordrhein-Westfalen",
      "amtsgericht": "Amtsgericht Coesfeld",
      "registernummer": "HRB 1488",
      "registerart": "HRB",
      "company_name": "Stadtwerke Coesfeld Gesellschaft mit beschränkter Haftung",
      "company_seat": "Coesfeld",
      "details": "08.07.2025 (Bekanntmachungsdatum)\n\nNordrhein-Westfalen Amtsgericht Coesfeld HRB 1488\nRegisterbekanntmachung nach dem Umwandlungsgesetz 08.07.2025 (Eintragungsdatum)\n\nStadtwerke Coesfeld Gesellschaft mit beschränkter Haftung\nGesellschaft mit beschränkter Haftung\nCoesfeld\n\nDen Gläubigern der an der Verschmelzung beteiligten Rechtsträger ist, wenn sie binnen sechs Monaten nach dem Tag, an dem die Eintragung der Verschmelzung in das Register des Sitzes derjenigen Rechtsträger deren Gläubiger sie sind, nach § 19 Absatz 3 UmwG als bekanntgemacht gilt, ihren Anspruch nach Grund und Höhe schriftlich anmelden, Sicherheit zu leisten, soweit sie nicht Befriedigung verlangen können. Dieses Recht steht den Gläubigern jedoch nur zu, wenn sie glaubhaft machen, dass durch die Verschmelzung die Erfüllung ihrer Forderung gefährdet wird."
    },
    {
      "date": "2025-07-08",
      "id": "114974",
      "original_text": "Registerbekanntmachung nach dem Umwandlungsgesetz\nNordrhein-Westfalen Amtsgericht Coesfeld HRB 2056\nWirtschaftsbetriebe der Stadt Coesfeld GmbH – Coesfeld",
      "type": "Registerbekanntmachung nach dem Umwandlungsgesetz",
      "state": "Nordrhein-Westfalen",
      "amtsgericht": "Amtsgericht Coesfeld",
      "registernummer": "HRB 2056",
      "registerart": "HRB",
      "company_name": "Wirtschaftsbetriebe der Stadt Coesfeld GmbH",
      "company_seat": "Coesfeld",
      "details": "08.07.2025 (Bekanntmachungsdatum)\n\nNordrhein-Westfalen Amtsgericht Coesfeld HRB 2056\nRegisterbekanntmachung nach dem Umwandlungsgesetz 08.07.2025 (Eintragungsdatum)\n\nWirtschaftsbetriebe der Stadt Coesfeld GmbH\nGesellschaft mit beschränkter Haftung\nCoesfeld\n\nDen Gläubigern der an der Verschmelzung beteiligten Rechtsträger ist, wenn sie binnen sechs Monaten nach dem Tag, an dem die Eintragung der Verschmelzung in das Register des Sitzes derjenigen Rechtsträger deren Gläubiger sie sind, nach § 19 Absatz 3 UmwG als bekanntgemacht gilt, ihren Anspruch nach Grund und Höhe schriftlich anmelden, Sicherheit zu leisten, soweit sie nicht Befriedigung verlangen können. Dieses Recht steht den Gläubigern jedoch nur zu, wenn sie glaubhaft machen, dass durch die Verschmelzung die Erfüllung ihrer Forderung gefährdet wird."
    },
    {
      "date": "2025-07-08",
      "id": "114975",
      "original_text": "Registerbekanntmachung nach dem Umwandlungsgesetz\nSchleswig-Holstein Amtsgericht Lübeck HRB 23986\nVerwaltung König & Cie. Zweite Britische Leben GmbH – Ratzeburg",
      "type": "Registerbekanntmachung nach dem Umwandlungsgesetz",
      "state": "Schleswig-Holstein",
      "amtsgericht": "Amtsgericht Lübeck",
      "registernummer": "HRB 23986",
      "registerart": "HRB",
      "company_name": "Verwaltung König & Cie. Zweite Britische Leben GmbH",
      "company_seat": "Ratzeburg",
      "details": "08.07.2025 (Bekanntmachungsdatum)\n\nSchleswig-Holstein Amtsgericht Lübeck HRB 23986\nRegisterbekanntmachung nach dem Umwandlungsgesetz 07.07.2025 (Eintragungsdatum)\n\nVerwaltung König & Cie. Zweite Britische Leben GmbH\nGesellschaft mit beschränkter Haftung\nRatzeburg\n\nZu Eintragungsnummer 2 vom 07.07.2025 wird als nicht eingetragen veröffentlicht: Den Gläubigern der an der Verschmelzung beteiligten Rechtsträger ist, wenn sie binnen sechs Monaten nach dem Tag, an dem die Eintragung der Verschmelzung in das Register des Sitzes desjenigen Rechtsträgers, dessen Gläubiger sie sind, als bekannt gemacht gilt, ihren Anspruch nach Grund und Höhe schriftlich anmelden, Sicherheit zu leisten, soweit sie nicht Befriedigung verlangen können. Dieses Recht steht den Gläubigern jedoch nur zu, wenn sie glaubhaft machen, dass durch die Verschmelzung die Erfüllung ihrer Forderung gefährdet wird."
    },
    {
      "date": "2025-07-08",
      "id": "114976",
      "original_text": "Registerbekanntmachung nach dem Umwandlungsgesetz\nMecklenburg-Vorpommern Amtsgericht Stralsund HRB 22907\nThomas Bau Nord GmbH – Greifswald",
      "type": "Registerbekanntmachung nach dem Umwandlungsgesetz",
      "state": "Mecklenburg-Vorpommern",
      "amtsgericht": "Amtsgericht Stralsund",
      "registernummer": "HRB 22907",
      "registerart": "HRB",
      "company_name": "Thomas Bau Nord GmbH",
      "company_seat": "Greifswald",
      "details": "08.07.2025 (Bekanntmachungsdatum)\n\nMecklenburg-Vorpommern Amtsgericht Stralsund HRB 22907\nRegisterbekanntmachung nach dem Umwandlungsgesetz 08.07.2025 (Eintragungsdatum)\n\nThomas Bau Nord GmbH\nGesellschaft mit beschränkter Haftung\nGreifswald\n\nAls nicht eingetragen wird veröffentlicht: Den Gläubigern der an der Umwandlung beteiligten Rechtsträger ist, wenn sie binnen sechs\nMonaten nach dem Tag, an dem die Eintragung der Umwandlung in das Register des Sitzes desjenigen Rechtsträgers, dessen Gläubiger sie sind, nach § 19 Abs. 3 UmwG als bekannt gemacht gilt, ihren Anspruch nach Grund und Höhe in Textform anmelden, Sicherheit zu leisten, soweit sie nicht Befriedigung verlangen können. Dieses Recht steht den Gläubigern jedoch nur zu, wenn sie glaubhaft machen, dass durch die Umwandlung die Erfüllung der Forderung gefährdet wird."
    },
    {
      "date": "2025-07-08",
      "id": "114977",
      "original_text": "Registerbekanntmachung nach dem Umwandlungsgesetz\nMecklenburg-Vorpommern Amtsgericht Stralsund HRA 2474\nThomas Bau Nord GmbH & Co. KG – Greifswald",
      "type": "Registerbekanntmachung nach dem Umwandlungsgesetz",
      "state": "Mecklenburg-Vorpommern",
      "amtsgericht": "Amtsgericht Stralsund",
      "registernummer": "HRA 2474",
      "registerart": "HRA",
      "company_name": "Thomas Bau Nord GmbH & Co. KG",
      "company_seat": "Greifswald",
      "details": "08.07.2025 (Bekanntmachungsdatum)\n\nMecklenburg-Vorpommern Amtsgericht Stralsund HRA 2474\nRegisterbekanntmachung nach dem Umwandlungsgesetz 08.07.2025 (Eintragungsdatum)\n\nThomas Bau Nord GmbH & Co. KG\nKommanditgesellschaft\nGreifswald\n\nAls nicht eingetragen wird veröffentlicht: Den Gläubigern der an der Umwandlung beteiligten Rechtsträger ist, wenn sie binnen sechs\nMonaten nach dem Tag, an dem die Eintragung der Umwandlung in das Register des Sitzes desjenigen Rechtsträgers, dessen Gläubiger sie sind, nach § 19 Abs. 3 UmwG als bekannt gemacht gilt, ihren Anspruch nach Grund und Höhe in Textform anmelden, Sicherheit zu leisten, soweit sie nicht Befriedigung verlangen können. Dieses Recht steht den Gläubigern jedoch nur zu, wenn sie glaubhaft machen, dass durch die Umwandlung die Erfüllung der Forderung gefährdet wird."
    },
    {
      "date": "2025-07-08",
      "id": "114978",
      "original_text": "Löschungsankündigung\nSchleswig-Holstein Amtsgericht Pinneberg HRB 2265 EL\nWCT World Container Trading GmbH – Elmshorn",
      "type": "Löschungsankündigung",
      "state": "Schleswig-Holstein",
      "amtsgericht": "Amtsgericht Pinneberg",
      "registernummer": "HRB 2265 EL",
      "registerart": "HRB",
      "company_name": "WCT World Container Trading GmbH",
      "company_seat": "Elmshorn",
      "details": "08.07.2025 (Bekanntmachungsdatum)\n\nSchleswig-Holstein Amtsgericht Pinneberg HRB 2265 EL\nLöschungsankündigung\n\nWCT World Container Trading GmbH\nGesellschaft mit beschränkter Haftung\nElmshorn\n\nEs ist die Löschung der nachstehenden Gesellschaft wegen Vermögenslosigkeit gemäß § 394 FamFG beabsichtigt. Widerspruchsfrist: 2 Monate."
    },
    {
      "date": "2025-07-08",
      "id": "114979",
      "original_text": "Registerbekanntmachung nach dem Umwandlungsgesetz\nHamburg Amtsgericht Hamburg HRB 111651\nTriathlon III Beteiligungen GmbH – Hamburg",
      "type": "Registerbekanntmachung nach dem Umwandlungsgesetz",
      "state": "Hamburg",
      "amtsgericht": "Amtsgericht Hamburg",
      "registernummer": "HRB 111651",
      "registerart": "HRB",
      "company_name": "Triathlon III Beteiligungen GmbH",
      "company_seat": "Hamburg",
      "details": "08.07.2025 (Bekanntmachungsdatum)\n\nHamburg Amtsgericht Hamburg HRB 111651\nRegisterbekanntmachung nach dem Umwandlungsgesetz 08.07.2025 (Eintragungsdatum)\n\nTriathlon III Beteiligungen GmbH\nGesellschaft mit beschränkter Haftung\nHamburg\n\nAls nicht eingetragen wird bekannt gemacht:\nDen Gläubigern der an der Verschmelzung beteiligten Gesellschaften ist, wenn sie binnen sechs Monaten nach dem Tag, an dem die Eintragung der Verschmelzung in das Register des Sitzes desjenigen Rechtsträgers, dessen Gläubiger sie sind, nach § 19 Absatz 3 UmwG als bekannt gemacht gilt, ihren Anspruch nach Grund und Höhe schriftlich anmelden, Sicherheit zu leisten, soweit sie nicht Befriedigung verlangen können. Dieses Recht steht den Gläubigern jedoch nur zu, wenn sie glaubhaft machen, dass durch die Verschmelzung die Erfüllung ihrer Forderung gefährdet wird."
    },
    {
      "date": "2025-07-08",
      "id": "114980",
      "original_text": "Registerbekanntmachung nach dem Umwandlungsgesetz\nHamburg Amtsgericht Hamburg HRB 111651\nTriathlon III Beteiligungen GmbH – Hamburg",
      "type": "Registerbekanntmachung nach dem Umwandlungsgesetz",
      "state": "Hamburg",
      "amtsgericht": "Amtsgericht Hamburg",
      "registernummer": "HRB 111651",
      "registerart": "HRB",
      "company_name": "Triathlon III Beteiligungen GmbH",
      "company_seat": "Hamburg",
      "details": "08.07.2025 (Bekanntmachungsdatum)\n\nHamburg Amtsgericht Hamburg HRB 111651\nRegisterbekanntmachung nach dem Umwandlungsgesetz 08.07.2025 (Eintragungsdatum)\n\nTriathlon III Beteiligungen GmbH\nGesellschaft mit beschränkter Haftung\nHamburg\n\nAls nicht eingetragen wird bekannt gemacht:\nDen Gläubigern der an der Verschmelzung beteiligten Gesellschaften ist, wenn sie binnen sechs Monaten nach dem Tag, an dem die Eintragung der Verschmelzung in das Register des Sitzes desjenigen Rechtsträgers, dessen Gläubiger sie sind, nach § 19 Absatz 3 UmwG als bekannt gemacht gilt, ihren Anspruch nach Grund und Höhe schriftlich anmelden, Sicherheit zu leisten, soweit sie nicht Befriedigung verlangen können. Dieses Recht steht den Gläubigern jedoch nur zu, wenn sie glaubhaft machen, dass durch die Verschmelzung die Erfüllung ihrer Forderung gefährdet wird."
    },
    {
      "date": "2025-07-08",
      "id": "114981",
      "original_text": "Registerbekanntmachung nach dem Umwandlungsgesetz\nHamburg Amtsgericht Hamburg HRB 125534\nGrindelhof 87a Verwaltungs GmbH – Hamburg",
      "type": "Registerbekanntmachung nach dem Umwandlungsgesetz",
      "state": "Hamburg",
      "amtsgericht": "Amtsgericht Hamburg",
      "registernummer": "HRB 125534",
      "registerart": "HRB",
      "company_name": "Grindelhof 87a Verwaltungs GmbH",
      "company_seat": "Hamburg",
      "details": "08.07.2025 (Bekanntmachungsdatum)\n\nHamburg Amtsgericht Hamburg HRB 125534\nRegisterbekanntmachung nach dem Umwandlungsgesetz 08.07.2025 (Eintragungsdatum)\n\nGrindelhof 87a Verwaltungs GmbH\nGesellschaft mit beschränkter Haftung\nHamburg\n\nAls nicht eingetragen wird bekannt gemacht:\nDen Gläubigern der an der Verschmelzung beteiligten Gesellschaften ist, wenn sie binnen sechs Monaten nach dem Tag, an dem die Eintragung der Verschmelzung in das Register des Sitzes derjenigen Rechtsträger deren Gläubiger sie sind, nach § 19 Absatz 3 UmwG als bekannt gemacht gilt, ihren Anspruch nach Grund und Höhe schriftlich anmelden, Sicherheit zu leisten, soweit sie nicht Befriedigung verlangen können. Dieses Recht steht den Gläubigern jedoch nur zu, wenn sie glaubhaft machen, dass durch die Verschmelzung die Erfüllung ihrer Forderung gefährdet wird."
    },
    {
      "date": "2025-07-08",
      "id": "114982",
      "original_text": "Registerbekanntmachung nach dem Umwandlungsgesetz\nHamburg Amtsgericht Hamburg HRB 168608\nGordon Funding GmbH – Hamburg",
      "type": "Registerbekanntmachung nach dem Umwandlungsgesetz",
      "state": "Hamburg",
      "amtsgericht": "Amtsgericht Hamburg",
      "registernummer": "HRB 168608",
      "registerart": "HRB",
      "company_name": "Gordon Funding GmbH",
      "company_seat": "Hamburg",
      "details": "08.07.2025 (Bekanntmachungsdatum)\n\nHamburg Amtsgericht Hamburg HRB 168608\nRegisterbekanntmachung nach dem Umwandlungsgesetz 08.07.2025 (Eintragungsdatum)\n\nGordon Funding GmbH\nGesellschaft mit beschränkter Haftung\nHamburg\n\nAls nicht eingetragen wird bekannt gemacht:\nDen Gläubigern der an der Verschmelzung beteiligten Gesellschaften ist, wenn sie binnen sechs Monaten nach dem Tag, an dem die Eintragung der Verschmelzung in das Register des Sitzes desjenigen Rechtsträgers, dessen Gläubiger sie sind, nach § 19 Absatz 3 UmwG als bekannt gemacht gilt, ihren Anspruch nach Grund und Höhe schriftlich anmelden, Sicherheit zu leisten, soweit sie nicht Befriedigung verlangen können. Dieses Recht steht den Gläubigern jedoch nur zu, wenn sie glaubhaft machen, dass durch die Verschmelzung die Erfüllung ihrer Forderung gefährdet wird."
    },
    {
      "date": "2025-07-08",
      "id": "114983",
      "original_text": "Registerbekanntmachung nach dem Umwandlungsgesetz\nBaden-Württemberg Amtsgericht Freiburg HRA 709055\nElektro Rotärmel e.K., Inhaber Waldemar Rotärmel – Lahr",
      "type": "Registerbekanntmachung nach dem Umwandlungsgesetz",
      "state": "Baden-Württemberg",
      "amtsgericht": "Amtsgericht Freiburg",
      "registernummer": "HRA 709055",
      "registerart": "HRA",
      "company_name": "Elektro Rotärmel e.K., Inhaber Waldemar Rotärmel",
      "company_seat": "Lahr",
      "details": "08.07.2025 (Bekanntmachungsdatum)\n\nBaden-Württemberg Amtsgericht Freiburg HRA 709055\nRegisterbekanntmachung nach dem Umwandlungsgesetz 08.07.2025 (Eintragungsdatum)\n\nElektro Rotärmel e.K., Inhaber Waldemar Rotärmel\nEinzelkaufmann / Einzelkauffrau\nLahr\n\nDen Gläubigern der an der Ausgliederung beteiligten Rechtsträger ist, wenn sie binnen sechs Monaten nach dem Tag, an dem die Eintragung der Ausgliederung in das Register des Sitzes desjenigen Rechtsträgers, dessen Gläubiger sie sind, nach § 19 Abs. 3 UmwG als bekanntgemacht gilt, ihren Anspruch nach Grund und Höhe schriftlich anmelden, Sicherheit zu leisten, soweit sie nicht Befriedigung verlangen können. Dieses Recht steht den Gläubigern jedoch nur zu, wenn sie glaubhaft machen, dass durch die Ausgliederung die Erfüllung ihrer Forderung gefährdet wird."
    },
    {
      "date": "2025-07-08",
      "id": "114984",
      "original_text": "Löschungsankündigung\nBerlin Amtsgericht Berlin (Charlottenburg) HRB 109287\nMagic Cut Ihr FriseurTeam GmbH – Berlin",
      "type": "Löschungsankündigung",
      "state": "Berlin",
      "amtsgericht": "Amtsgericht Berlin (Charlottenburg)",
      "registernummer": "HRB 109287",
      "registerart": "HRB",
      "company_name": "Magic Cut Ihr FriseurTeam GmbH",
      "company_seat": "Berlin",
      "details": "08.07.2025 (Bekanntmachungsdatum)\n\nBerlin Amtsgericht Berlin (Charlottenburg) HRB 109287\nLöschungsankündigung\n\nMagic Cut Ihr FriseurTeam GmbH\nGesellschaft mit beschränkter Haftung\nBerlin\n\nBei der nachstehenden Gesellschaft wird das Amtslöschungsverfahren gemäß § 394 FamFG eingeleitet. Widerspruchsfrist: 6 Wochen."
    },
    {
      "date": "2025-07-08",
      "id": "114985",
      "original_text": "Löschungsankündigung\nBerlin Amtsgericht Berlin (Charlottenburg) HRB 129615\nPension-Mitte HKK UG (haftungsbeschränkt) – Berlin",
      "type": "Löschungsankündigung",
      "state": "Berlin",
      "amtsgericht": "Amtsgericht Berlin (Charlottenburg)",
      "registernummer": "HRB 129615",
      "registerart": "HRB",
      "company_name": "Pension-Mitte HKK UG (haftungsbeschränkt)",
      "company_seat": "Berlin",
      "details": "08.07.2025 (Bekanntmachungsdatum)\n\nBerlin Amtsgericht Berlin (Charlottenburg) HRB 129615\nLöschungsankündigung\n\nPension-Mitte HKK UG (haftungsbeschränkt)\nGesellschaft mit beschränkter Haftung\nBerlin\n\nBei der nachstehenden Gesellschaft wird das Amtslöschungsverfahren gemäß § 394 FamFG eingeleitet. Widerspruchsfrist 6 Wochen"
    },
    {
      "date": "2025-07-08",
      "id": "114986",
      "original_text": "Registerbekanntmachung nach dem Umwandlungsgesetz\nBaden-Württemberg Amtsgericht Freiburg HRA 709106\nElektro Rotärmel GmbH & Co. KG – Lahr",
      "type": "Registerbekanntmachung nach dem Umwandlungsgesetz",
      "state": "Baden-Württemberg",
      "amtsgericht": "Amtsgericht Freiburg",
      "registernummer": "HRA 709106",
      "registerart": "HRA",
      "company_name": "Elektro Rotärmel GmbH & Co. KG",
      "company_seat": "Lahr",
      "details": "08.07.2025 (Bekanntmachungsdatum)\n\nBaden-Württemberg Amtsgericht Freiburg HRA 709106\nRegisterbekanntmachung nach dem Umwandlungsgesetz 08.07.2025 (Eintragungsdatum)\n\nElektro Rotärmel GmbH & Co. KG\nKommanditgesellschaft\nLahr\n\nAls nicht eingetragen wird bekanntgemacht:\nDen Gläubigern der an der Ausgliederung beteiligten Rechtsträger ist, wenn sie binnen sechs Monaten nach dem Tag, an dem die Eintragung der Ausgliederung in das Register des Sitzes desjenigen Rechtsträgers, dessen Gläubiger sie sind, nach § 19 Abs. 3 UmwG als bekanntgemacht gilt, ihren Anspruch nach Grund und Höhe schriftlich anmelden, Sicherheit zu leisten, soweit sie nicht Befriedigung verlangen können. Dieses Recht steht den Gläubigern jedoch nur zu, wenn sie glaubhaft machen, dass durch die Ausgliederung die Erfüllung ihrer Forderung gefährdet wird."
    },
    {
      "date": "2025-07-08",
      "id": "114987",
      "original_text": "Löschungsankündigung\nBerlin Amtsgericht Berlin (Charlottenburg) HRB 165288\nSportsbar21 UG (haftungsbeschränkt) – Berlin",
      "type": "Löschungsankündigung",
      "state": "Berlin",
      "amtsgericht": "Amtsgericht Berlin (Charlottenburg)",
      "registernummer": "HRB 165288",
      "registerart": "HRB",
      "company_name": "Sportsbar21 UG (haftungsbeschränkt)",
      "company_seat": "Berlin",
      "details": "08.07.2025 (Bekanntmachungsdatum)\n\nBerlin Amtsgericht Berlin (Charlottenburg) HRB 165288\nLöschungsankündigung\n\nSportsbar21 UG (haftungsbeschränkt)\nGesellschaft mit beschränkter Haftung\nBerlin\n\nBei der nachstehenden Gesellschaft wird das Amtslöschungsverfahren gemäß § 394 FamFG eingeleitet. Widerspruchsfrist: 6 Wochen."
    },
    {
      "date": "2025-07-08",
      "id": "114988",
      "original_text": "Sonstige Registerbekanntmachung\nBrandenburg Amtsgericht Neuruppin HRB 14608\nEichenschild Immobilien GmbH – Pinnow",
      "type": "Sonstige Registerbekanntmachung",
      "state": "Brandenburg",
      "amtsgericht": "Amtsgericht Neuruppin",
      "registernummer": "HRB 14608",
      "registerart": "HRB",
      "company_name": "Eichenschild Immobilien GmbH",
      "company_seat": "Pinnow",
      "details": "08.07.2025 (Bekanntmachungsdatum)\n\nBrandenburg Amtsgericht Neuruppin HRB 14608\nSonstige Registerbekanntmachung\n\nEichenschild Immobilien GmbH\nGesellschaft mit beschränkter Haftung\nPinnow\n\nAls nicht eingetragen wird veröffentlicht: Das Löschungsverfahren wird nicht weiter betrieben und eingestellt."
    },
    {
      "date": "2025-07-08",
      "id": "114989",
      "original_text": "Sonstige Registerbekanntmachung\nBerlin Amtsgericht Berlin (Charlottenburg) HRB 239815\nEV Digital Invest AG – Berlin",
      "type": "Sonstige Registerbekanntmachung",
      "state": "Berlin",
      "amtsgericht": "Amtsgericht Berlin (Charlottenburg)",
      "registernummer": "HRB 239815",
      "registerart": "HRB",
      "company_name": "EV Digital Invest AG",
      "company_seat": "Berlin",
      "details": "08.07.2025 (Bekanntmachungsdatum)\n\nBerlin Amtsgericht Berlin (Charlottenburg) HRB 239815\nSonstige Registerbekanntmachung\n\nEV Digital Invest AG\nAktiengesellschaft\nBerlin\n\nAls nicht eingetragen wird veröffentlicht:\nGläubigern, deren Forderungen begründet worden sind, bevor die Eintragung des Beschlusses als nach § 10 des Handelsgesetzbuches bekannt gemacht gilt, ist, wenn sie sich binnen sechs Monaten nach der Bekanntmachung zu diesem Zweck melden, Sicherheit zu leisten, soweit sie nicht Befriedigung verlangen können. Dieses Recht steht den Gläubigern nicht zu, die im Fall des Insolvenzverfahrens ein Recht auf vorzugsweise Befriedigung aus der Deckungsmasse haben, die nach gesetzlicher Vorschrift zu ihrem Schutz errichtet und staatlich überwacht ist."
    },
    {
      "date": "2025-07-08",
      "id": "114990",
      "original_text": "Sonstige Registerbekanntmachung\nHamburg Amtsgericht Hamburg HRB 100052\nSIGNAL IDUNA Pensionskasse Aktiengesellschaft – Hamburg",
      "type": "Sonstige Registerbekanntmachung",
      "state": "Hamburg",
      "amtsgericht": "Amtsgericht Hamburg",
      "registernummer": "HRB 100052",
      "registerart": "HRB",
      "company_name": "SIGNAL IDUNA Pensionskasse Aktiengesellschaft",
      "company_seat": "Hamburg",
      "details": "08.07.2025 (Bekanntmachungsdatum)\n\nHamburg Amtsgericht Hamburg HRB 100052\nSonstige Registerbekanntmachung\n\nSIGNAL IDUNA Pensionskasse Aktiengesellschaft\nAktiengesellschaft\nHamburg\n\nAls nicht eingetragen wird bekannt gemacht: Liste des Aufsichtsrats wurde eingereicht."
    },
    {
      "date": "2025-07-08",
      "id": "114991",
      "original_text": "Registerbekanntmachung nach dem Umwandlungsgesetz\nBaden-Württemberg Amtsgericht Stuttgart HRB 580475\nRTS-GmbH Gebäudedienstleistungen – Kupferzell",
      "type": "Registerbekanntmachung nach dem Umwandlungsgesetz",
      "state": "Baden-Württemberg",
      "amtsgericht": "Amtsgericht Stuttgart",
      "registernummer": "HRB 580475",
      "registerart": "HRB",
      "company_name": "RTS-GmbH Gebäudedienstleistungen",
      "company_seat": "Kupferzell",
      "details": "08.07.2025 (Bekanntmachungsdatum)\n\nBaden-Württemberg Amtsgericht Stuttgart HRB 580475\nRegisterbekanntmachung nach dem Umwandlungsgesetz 08.07.2025 (Eintragungsdatum)\n\nRTS-GmbH Gebäudedienstleistungen\nGesellschaft mit beschränkter Haftung\nKupferzell\n\nDen Gläubigern der an der Verschmelzung beteiligten Rechtsträger ist, wenn sie binnen sechs Monaten nach dem Tag, an dem die Eintragung der Verschmelzung in das Register des Sitzes desjenigen Rechtsträgers, dessen Gläubiger sie sind, nach § 19 Abs. 3 UmwG als bekanntgemacht gilt, ihren Anspruch nach Grund und Höhe schriftlich anmelden, Sicherheit zu leisten, soweit sie nicht Befriedigung verlangen können. Dieses Recht steht den Gläubigern jedoch nur zu, wenn sie glaubhaft machen, dass durch die Verschmelzung die Erfüllung ihrer Forderung gefährdet wird."
    },
    {
      "date": "2025-07-08",
      "id": "114992",
      "original_text": "Registerbekanntmachung nach dem Umwandlungsgesetz\nBaden-Württemberg Amtsgericht Freiburg HRB 660107\nSteinebrunner Druck GmbH – Schopfheim",
      "type": "Registerbekanntmachung nach dem Umwandlungsgesetz",
      "state": "Baden-Württemberg",
      "amtsgericht": "Amtsgericht Freiburg",
      "registernummer": "HRB 660107",
      "registerart": "HRB",
      "company_name": "Steinebrunner Druck GmbH",
      "company_seat": "Schopfheim",
      "details": "08.07.2025 (Bekanntmachungsdatum)\n\nBaden-Württemberg Amtsgericht Freiburg HRB 660107\nRegisterbekanntmachung nach dem Umwandlungsgesetz 08.07.2025 (Eintragungsdatum)\n\nSteinebrunner Druck GmbH\nGesellschaft mit beschränkter Haftung\nSchopfheim\n\nAls nicht eingetragen wird bekanntgemacht:\nDen Gläubigern der an der Verschmelzung beteiligten Rechtsträger ist, wenn sie binnen sechs Monaten nach dem Tag, an dem die Eintragung der Verschmelzung in das Register des Sitzes desjenigen Rechtsträgers, dessen Gläubiger sie sind, nach § 19 Abs. 3 UmwG als bekanntgemacht gilt, ihren Anspruch nach Grund und Höhe schriftlich anmelden, Sicherheit zu leisten, soweit sie nicht Befriedigung verlangen können. Dieses Recht steht den Gläubigern jedoch nur zu, wenn sie glaubhaft machen, dass durch die Verschmelzung die Erfüllung ihrer Forderung gefährdet wird."
    },
    {
      "date": "2025-07-08",
      "id": "114993",
      "original_text": "Registerbekanntmachung nach dem Umwandlungsgesetz\nBaden-Württemberg Amtsgericht Freiburg HRB 670088\nDruckerei Beil GmbH – Schopfheim",
      "type": "Registerbekanntmachung nach dem Umwandlungsgesetz",
      "state": "Baden-Württemberg",
      "amtsgericht": "Amtsgericht Freiburg",
      "registernummer": "HRB 670088",
      "registerart": "HRB",
      "company_name": "Druckerei Beil GmbH",
      "company_seat": "Schopfheim",
      "details": "08.07.2025 (Bekanntmachungsdatum)\n\nBaden-Württemberg Amtsgericht Freiburg HRB 670088\nRegisterbekanntmachung nach dem Umwandlungsgesetz 08.07.2025 (Eintragungsdatum)\n\nDruckerei Beil GmbH\nGesellschaft mit beschränkter Haftung\nSchopfheim\n\nAls nicht eingetragen wird bekanntgemacht:\nDen Gläubigern der an der Verschmelzung beteiligten Rechtsträger ist, wenn sie binnen sechs Monaten nach dem Tag, an dem die Eintragung der Verschmelzung in das Register des Sitzes desjenigen Rechtsträgers, dessen Gläubiger sie sind, nach § 19 Abs. 3 UmwG als bekanntgemacht gilt, ihren Anspruch nach Grund und Höhe schriftlich anmelden, Sicherheit zu leisten, soweit sie nicht Befriedigung verlangen können. Dieses Recht steht den Gläubigern jedoch nur zu, wenn sie glaubhaft machen, dass durch die Verschmelzung die Erfüllung ihrer Forderung gefährdet wird."
    },
    {
      "date": "2025-07-08",
      "id": "114994",
      "original_text": "Einreichung neuer Dokumente\nBerlin Amtsgericht Berlin (Charlottenburg) HRB 87492\nVivantes Rehabilitation GmbH – Berlin",
      "type": "Einreichung neuer Dokumente",
      "state": "Berlin",
      "amtsgericht": "Amtsgericht Berlin (Charlottenburg)",
      "registernummer": "HRB 87492",
      "registerart": "HRB",
      "company_name": "Vivantes Rehabilitation GmbH",
      "company_seat": "Berlin",
      "details": "08.07.2025 (Bekanntmachungsdatum)\n\nBerlin Amtsgericht Berlin (Charlottenburg) HRB 87492\nEinreichung neuer Dokumente\n\nVivantes Rehabilitation GmbH\nGesellschaft mit beschränkter Haftung\nBerlin\n\nAls nicht eingetragen wird veröffentlicht: Es wurde eine neue Liste der Aufsichtsratsmitglieder eingereicht (§52 GmbHG)."
    },
    {
      "date": "2025-07-08",
      "id": "114995",
      "original_text": "Registerbekanntmachung nach dem Umwandlungsgesetz\nHamburg Amtsgericht Hamburg HRB 178465\nKlaus Hildebrandt AG – Hamburg",
      "type": "Registerbekanntmachung nach dem Umwandlungsgesetz",
      "state": "Hamburg",
      "amtsgericht": "Amtsgericht Hamburg",
      "registernummer": "HRB 178465",
      "registerart": "HRB",
      "company_name": "Klaus Hildebrandt AG",
      "company_seat": "Hamburg",
      "details": "08.07.2025 (Bekanntmachungsdatum)\n\nHamburg Amtsgericht Hamburg HRB 178465\nRegisterbekanntmachung nach dem Umwandlungsgesetz 08.07.2025 (Eintragungsdatum)\n\nKlaus Hildebrandt AG\nAktiengesellschaft\nHamburg\n\nAls nicht eingetragen wird bekannt gemacht:\nDen Gläubigern der an der formwechselnden Umwandlung beteiligten Gesellschaften ist, wenn sie binnen sechs Monaten nach dem Tag, an dem die Eintragung der formwechselnden Umwandlung in das Register des Sitzes desjenigen Rechtsträgers, dessen Gläubiger sie sind, nach § 19 Absatz 3 UmwG als bekannt gemacht gilt, ihren Anspruch nach Grund und Höhe schriftlich anmelden, Sicherheit zu leisten, soweit sie nicht Befriedigung verlangen können. Dieses Recht steht den Gläubigern jedoch nur zu, wenn sie glaubhaft machen, dass durch die formwechselnde Umwandlung die Erfüllung ihrer Forderung gefährdet wird."
    },
    {
      "date": "2025-07-08",
      "id": "114996",
      "original_text": "Registerbekanntmachung nach dem Umwandlungsgesetz\nSachsen Amtsgericht Chemnitz HRB 9935\nNK - Normkies Verwaltungs-GmbH – Zwickau",
      "type": "Registerbekanntmachung nach dem Umwandlungsgesetz",
      "state": "Sachsen",
      "amtsgericht": "Amtsgericht Chemnitz",
      "registernummer": "HRB 9935",
      "registerart": "HRB",
      "company_name": "NK - Normkies Verwaltungs-GmbH",
      "company_seat": "Zwickau",
      "details": "08.07.2025 (Bekanntmachungsdatum)\n\nSachsen Amtsgericht Chemnitz HRB 9935\nRegisterbekanntmachung nach dem Umwandlungsgesetz 08.07.2025 (Eintragungsdatum)\n\nNK - Normkies Verwaltungs-GmbH\nGesellschaft mit beschränkter Haftung\nZwickau\n\nDen Gläubigern der an der Verschmelzung beteiligten Rechtsträger ist, wenn sie binnen sechs Monaten nach dem Tag, an dem die Eintragung der Verschmelzung in das Register des Sitzes desjenigen Rechtsträgers, dessen Gläubiger sie sind, nach § 19 Abs. 3 UmwG als bekannt gemacht gilt, ihren Anspruch nach Grund und Höhe in Textform anmelden, Sicherheit zu leisten, soweit sie nicht Befriedigung verlangen können. Dieses Recht steht den Gläubigern jedoch nur zu, wenn sie glaubhaft machen, dass durch die Verschmelzung die Erfüllung der Forderung gefährdet wird."
    },
    {
      "date": "2025-07-08",
      "id": "114997",
      "original_text": "Registerbekanntmachung nach dem Umwandlungsgesetz\nSachsen Amtsgericht Dresden HRB 35111\nkkt Marken UG (haftungsbeschränkt) – Dresden",
      "type": "Registerbekanntmachung nach dem Umwandlungsgesetz",
      "state": "Sachsen",
      "amtsgericht": "Amtsgericht Dresden",
      "registernummer": "HRB 35111",
      "registerart": "HRB",
      "company_name": "kkt Marken UG (haftungsbeschränkt)",
      "company_seat": "Dresden",
      "details": "08.07.2025 (Bekanntmachungsdatum)\n\nSachsen Amtsgericht Dresden HRB 35111\nRegisterbekanntmachung nach dem Umwandlungsgesetz 08.07.2025 (Eintragungsdatum)\n\nkkt Marken UG (haftungsbeschränkt)\nGesellschaft mit beschränkter Haftung\nDresden\n\nDen Gläubigern der an der Verschmelzung beteiligten Rechtsträger ist, wenn sie binnen sechs Monaten nach dem Tag, an dem die Eintragung der Verschmelzung in das Register des Sitzes desjenigen Rechtsträgers, dessen Gläubiger sie sind, nach § 19 Abs. 3 UmwG als bekannt gemacht gilt, ihren Anspruch nach Grund und Höhe in Textform anmelden, Sicherheit zu leisten, soweit sie nicht Befriedigung verlangen können. Dieses Recht steht den Gläubigern jedoch nur zu, wenn sie glaubhaft machen, dass durch die Verschmelzung die Erfüllung der Forderung gefährdet wird."
    },
    {
      "date": "2025-07-08",
      "id": "114998",
      "original_text": "Registerbekanntmachung nach dem Umwandlungsgesetz\nSachsen Amtsgericht Dresden HRB 29083\nMedienvertrieb Riesa GmbH – Riesa",
      "type": "Registerbekanntmachung nach dem Umwandlungsgesetz",
      "state": "Sachsen",
      "amtsgericht": "Amtsgericht Dresden",
      "registernummer": "HRB 29083",
      "registerart": "HRB",
      "company_name": "Medienvertrieb Riesa GmbH",
      "company_seat": "Riesa",
      "details": "08.07.2025 (Bekanntmachungsdatum)\n\nSachsen Amtsgericht Dresden HRB 29083\nRegisterbekanntmachung nach dem Umwandlungsgesetz 08.07.2025 (Eintragungsdatum)\n\nMedienvertrieb Riesa GmbH\nGesellschaft mit beschränkter Haftung\nRiesa\n\nDen Gläubigern der an der Verschmelzung beteiligten Rechtsträger ist, wenn sie binnen sechs Monaten nach dem Tag, an dem die Eintragung der Verschmelzung in das Register des Sitzes desjenigen Rechtsträgers, dessen Gläubiger sie sind, nach § 19 Abs. 3 UmwG als bekannt gemacht gilt, ihren Anspruch nach Grund und Höhe in Textform anmelden, Sicherheit zu leisten, soweit sie nicht Befriedigung verlangen können. Dieses Recht steht den Gläubigern jedoch nur zu, wenn sie glaubhaft machen, dass durch die Verschmelzung die Erfüllung der Forderung gefährdet wird."
    },
    {
      "date": "2025-07-08",
      "id": "114999",
      "original_text": "Registerbekanntmachung nach dem Umwandlungsgesetz\nSachsen Amtsgericht Dresden HRB 35110\nkkt WEB UG (haftungsbeschränkt) – Dresden",
      "type": "Registerbekanntmachung nach dem Umwandlungsgesetz",
      "state": "Sachsen",
      "amtsgericht": "Amtsgericht Dresden",
      "registernummer": "HRB 35110",
      "registerart": "HRB",
      "company_name": "kkt WEB UG (haftungsbeschränkt)",
      "company_seat": "Dresden",
      "details": "08.07.2025 (Bekanntmachungsdatum)\n\nSachsen Amtsgericht Dresden HRB 35110\nRegisterbekanntmachung nach dem Umwandlungsgesetz 08.07.2025 (Eintragungsdatum)\n\nkkt WEB UG (haftungsbeschränkt)\nGesellschaft mit beschränkter Haftung\nDresden\n\nDen Gläubigern der an der Verschmelzung beteiligten Rechtsträger ist, wenn sie binnen sechs Monaten nach dem Tag, an dem die Eintragung der Verschmelzung in das Register des Sitzes desjenigen Rechtsträgers, dessen Gläubiger sie sind, nach § 19 Abs. 3 UmwG als bekannt gemacht gilt, ihren Anspruch nach Grund und Höhe in Textform anmelden, Sicherheit zu leisten, soweit sie nicht Befriedigung verlangen können. Dieses Recht steht den Gläubigern jedoch nur zu, wenn sie glaubhaft machen, dass durch die Verschmelzung die Erfüllung der Forderung gefährdet wird."
    },
    {
      "date": "2025-07-08",
      "id": "115000",
      "original_text": "Löschungsankündigung\nSachsen Amtsgericht Dresden HRB 30368\nAT Security GmbH – Zittau",
      "type": "Löschungsankündigung",
      "state": "Sachsen",
      "amtsgericht": "Amtsgericht Dresden",
      "registernummer": "HRB 30368",
      "registerart": "HRB",
      "company_name": "AT Security GmbH",
      "company_seat": "Zittau",
      "details": "08.07.2025 (Bekanntmachungsdatum)\n\nSachsen Amtsgericht Dresden HRB 30368\nLöschungsankündigung\n\nAT Security GmbH\nGesellschaft mit beschränkter Haftung\nZittau\n\nDas Registergericht beabsichtigt, die im Handelsregister eingetragene Gesellschaft von Amts wegen nach § 394 FamFG zu löschen. Die Frist zu Erhebung eines Widerspruchs gegen die beabsichtigte Löschung wird auf einen Monat festgesetzt."
    },
    {
      "date": "2025-07-08",
      "id": "115001",
      "original_text": "Registerbekanntmachung nach dem Umwandlungsgesetz\nSachsen Amtsgericht Chemnitz HRB 1398\nTIP-TOP Dienstleistungen GmbH – Zwickau",
      "type": "Registerbekanntmachung nach dem Umwandlungsgesetz",
      "state": "Sachsen",
      "amtsgericht": "Amtsgericht Chemnitz",
      "registernummer": "HRB 1398",
      "registerart": "HRB",
      "company_name": "TIP-TOP Dienstleistungen GmbH",
      "company_seat": "Zwickau",
      "details": "08.07.2025 (Bekanntmachungsdatum)\n\nSachsen Amtsgericht Chemnitz HRB 1398\nRegisterbekanntmachung nach dem Umwandlungsgesetz 08.07.2025 (Eintragungsdatum)\n\nTIP-TOP Dienstleistungen GmbH\nGesellschaft mit beschränkter Haftung\nZwickau\n\nDen Gläubigern der an der Verschmelzung beteiligten Rechtsträger ist, wenn sie binnen sechs Monaten nach dem Tag, an dem die Eintragung der Verschmelzung in das Register des Sitzes desjenigen Rechtsträgers, dessen Gläubiger sie sind, nach § 19 Abs. 3 UmwG als bekannt gemacht gilt, ihren Anspruch nach Grund und Höhe in Textform anmelden, Sicherheit zu leisten, soweit sie nicht Befriedigung verlangen können. Dieses Recht steht den Gläubigern jedoch nur zu, wenn sie glaubhaft machen, dass durch die Verschmelzung die Erfüllung der Forderung gefährdet wird."
    },
    {
      "date": "2025-07-08",
      "id": "115002",
      "original_text": "Registerbekanntmachung nach dem Umwandlungsgesetz\nSachsen Amtsgericht Chemnitz HRB 9007\nTIP-TOP Haus & Hof Dienste GmbH – Zwickau",
      "type": "Registerbekanntmachung nach dem Umwandlungsgesetz",
      "state": "Sachsen",
      "amtsgericht": "Amtsgericht Chemnitz",
      "registernummer": "HRB 9007",
      "registerart": "HRB",
      "company_name": "TIP-TOP Haus & Hof Dienste GmbH",
      "company_seat": "Zwickau",
      "details": "08.07.2025 (Bekanntmachungsdatum)\n\nSachsen Amtsgericht Chemnitz HRB 9007\nRegisterbekanntmachung nach dem Umwandlungsgesetz 08.07.2025 (Eintragungsdatum)\n\nTIP-TOP Haus & Hof Dienste GmbH\nGesellschaft mit beschränkter Haftung\nZwickau\n\nDen Gläubigern der an der Verschmelzung beteiligten Rechtsträger ist, wenn sie binnen sechs Monaten nach dem Tag, an dem die Eintragung der Verschmelzung in das Register des Sitzes desjenigen Rechtsträgers, dessen Gläubiger sie sind, nach § 19 Abs. 3 UmwG als bekannt gemacht gilt, ihren Anspruch nach Grund und Höhe in Textform anmelden, Sicherheit zu leisten, soweit sie nicht Befriedigung verlangen können. Dieses Recht steht den Gläubigern jedoch nur zu, wenn sie glaubhaft machen, dass durch die Verschmelzung die Erfüllung der Forderung gefährdet wird."
    },
    {
      "date": "2025-07-08",
      "id": "115003",
      "original_text": "Registerbekanntmachung nach dem Umwandlungsgesetz\nSachsen Amtsgericht Dresden HRB 7775\nMVD Medien Vertrieb Dresden GmbH – Dresden",
      "type": "Registerbekanntmachung nach dem Umwandlungsgesetz",
      "state": "Sachsen",
      "amtsgericht": "Amtsgericht Dresden",
      "registernummer": "HRB 7775",
      "registerart": "HRB",
      "company_name": "MVD Medien Vertrieb Dresden GmbH",
      "company_seat": "Dresden",
      "details": "08.07.2025 (Bekanntmachungsdatum)\n\nSachsen Amtsgericht Dresden HRB 7775\nRegisterbekanntmachung nach dem Umwandlungsgesetz 08.07.2025 (Eintragungsdatum)\n\nMVD Medien Vertrieb Dresden GmbH\nGesellschaft mit beschränkter Haftung\nDresden\n\nDen Gläubigern der an der Verschmelzung beteiligten Rechtsträger ist, wenn sie binnen sechs Monaten nach dem Tag, an dem die Eintragung der Verschmelzung in das Register des Sitzes desjenigen Rechtsträgers, dessen Gläubiger sie sind, nach § 19 Abs. 3 UmwG als bekannt gemacht gilt, ihren Anspruch nach Grund und Höhe in Textform anmelden, Sicherheit zu leisten, soweit sie nicht Befriedigung verlangen können. Dieses Recht steht den Gläubigern jedoch nur zu, wenn sie glaubhaft machen, dass durch die Verschmelzung die Erfüllung der Forderung gefährdet wird."
    },
    {
      "date": "2025-07-08",
      "id": "115004",
      "original_text": "Einreichung neuer Dokumente\nSachsen Amtsgericht Dresden HRB 1187\nFlughafen Dresden Gesellschaft mit beschränkter Haftung – Dresden",
      "type": "Einreichung neuer Dokumente",
      "state": "Sachsen",
      "amtsgericht": "Amtsgericht Dresden",
      "registernummer": "HRB 1187",
      "registerart": "HRB",
      "company_name": "Flughafen Dresden Gesellschaft mit beschränkter Haftung",
      "company_seat": "Dresden",
      "details": "08.07.2025 (Bekanntmachungsdatum)\n\nSachsen Amtsgericht Dresden HRB 1187\nEinreichung neuer Dokumente\n\nFlughafen Dresden Gesellschaft mit beschränkter Haftung\nGesellschaft mit beschränkter Haftung\nDresden\n\nAm 07.07.2025 wurde beim Handelsregister des Amtsgerichts Dresden die Liste der Mitglieder des Aufsichtsrats gemäß § 52 GmbHG eingereicht."
    },
    {
      "date": "2025-07-08",
      "id": "115005",
      "original_text": "Sonstige Registerbekanntmachung\nSachsen Amtsgericht Leipzig VR 7711\nGlück für Kinder e.V. – Wurzen",
      "type": "Sonstige Registerbekanntmachung",
      "state": "Sachsen",
      "amtsgericht": "Amtsgericht Leipzig",
      "registernummer": "VR 7711",
      "registerart": "VR",
      "company_name": "Glück für Kinder e.V.",
      "company_seat": "Wurzen",
      "details": "08.07.2025 (Bekanntmachungsdatum)\n\nSachsen Amtsgericht Leipzig VR 7711\nSonstige Registerbekanntmachung\n\nGlück für Kinder e.V.\neingetragener Verein\nWurzen\n\nDas Gericht beabsichtigt, gemäß § 4 Absatz 2 Ziffer 1 der Verordnung über das Vereinsregister das Registerblatt  des Vereins zu schließen, da nach den Ermittlungen des Gerichts sämtliche Mitglieder aus dem Verein ausgeschieden sind. Zur Geltendmachung eines Widerspruchs gegen die beabsichtigte Schließung wird eine Frist von einem Monat nach der Veröffentlichung bestimmt."
    },
    {
      "date": "2025-07-08",
      "id": "115006",
      "original_text": "Registerbekanntmachung nach dem Umwandlungsgesetz\nNiedersachsen Amtsgericht Braunschweig HRB 203386\nSusanna Vermögensverwaltungs GmbH – Wolfenbüttel",
      "type": "Registerbekanntmachung nach dem Umwandlungsgesetz",
      "state": "Niedersachsen",
      "amtsgericht": "Amtsgericht Braunschweig",
      "registernummer": "HRB 203386",
      "registerart": "HRB",
      "company_name": "Susanna Vermögensverwaltungs GmbH",
      "company_seat": "Wolfenbüttel",
      "details": "08.07.2025 (Bekanntmachungsdatum)\n\nNiedersachsen Amtsgericht Braunschweig HRB 203386\nRegisterbekanntmachung nach dem Umwandlungsgesetz 08.07.2025 (Eintragungsdatum)\n\nSusanna Vermögensverwaltungs GmbH\nGesellschaft mit beschränkter Haftung\nWolfenbüttel\n\nDen Gläubigern der an der Verschmelzung beteiligten Rechtsträger ist, wenn sie binnen sechs Monaten nach dem Tag, an dem die Eintragung der Verschmelzung in das Register des Sitzes desjenigen Rechtsträgers, dessen Gläubiger sie sind, nach § 19  Abs.  3 UmwG als bekannt gemacht gilt, ihren Anspruch nach Grund und Höhe schriftlich anmelden, Sicherheit zu leisten, soweit sie nicht Befriedigung verlangen können. Dieses Recht steht den Gläubigern jedoch nur zu, wenn sie glaubhaft machen, dass durch die Verschmelzung die Erfüllung der Forderung gefährdet wird."
    },
    {
      "date": "2025-07-08",
      "id": "115007",
      "original_text": "Löschungsankündigung\nNiedersachsen Amtsgericht Oldenburg (Oldenburg) HRA 204054\nBiogas Rieniets UG (haftungsbeschränkt) & Co. KG – Jever",
      "type": "Löschungsankündigung",
      "state": "Niedersachsen",
      "amtsgericht": "Amtsgericht Oldenburg (Oldenburg)",
      "registernummer": "HRA 204054",
      "registerart": "HRA",
      "company_name": "Biogas Rieniets UG (haftungsbeschränkt) & Co. KG",
      "company_seat": "Jever",
      "details": "08.07.2025 (Bekanntmachungsdatum)\n\nNiedersachsen Amtsgericht Oldenburg (Oldenburg) HRA 204054\nLöschungsankündigung\n\nBiogas Rieniets UG (haftungsbeschränkt) & Co. KG\nKommanditgesellschaft\nJever\n\nDas Registergericht beabsichtigt, die Firma von Amts wegen nach § 394 FamFG zu löschen. Die Frist zur Erhebung eines Widerspruchs ist auf 1 Monat ab dieser Registerbekanntmachung festgesetzt."
    },
    {
      "date": "2025-07-08",
      "id": "115008",
      "original_text": "Löschungsankündigung\nNiedersachsen Amtsgericht Walsrode HRB 204412\nVD Transport GmbH – Syke",
      "type": "Löschungsankündigung",
      "state": "Niedersachsen",
      "amtsgericht": "Amtsgericht Walsrode",
      "registernummer": "HRB 204412",
      "registerart": "HRB",
      "company_name": "VD Transport GmbH",
      "company_seat": "Syke",
      "details": "08.07.2025 (Bekanntmachungsdatum)\n\nNiedersachsen Amtsgericht Walsrode HRB 204412\nLöschungsankündigung\n\nVD Transport GmbH\nGesellschaft mit beschränkter Haftung\nSyke\n\nEs ist beabsichtigt, die Gesellschaft wegen Vermögenslosigkeit von Amts wegen im Handelsregister zu löschen (§ 394 FamFG).\nBis zum 08.08.2025 können Sie beim Amtsgericht Walsrode gegen die angekündigte Löschung schriftlich oder zu Protokoll der Geschäftsstelle Widerspruch unter Angabe von Gründen erheben."
    },
    {
      "date": "2025-07-08",
      "id": "115009",
      "original_text": "Sonstige Registerbekanntmachung\nNiedersachsen Amtsgericht Hildesheim HRB 312\nStadtwerke Hildesheim Aktiengesellschaft – Hildesheim",
      "type": "Sonstige Registerbekanntmachung",
      "state": "Niedersachsen",
      "amtsgericht": "Amtsgericht Hildesheim",
      "registernummer": "HRB 312",
      "registerart": "HRB",
      "company_name": "Stadtwerke Hildesheim Aktiengesellschaft",
      "company_seat": "Hildesheim",
      "details": "08.07.2025 (Bekanntmachungsdatum)\n\nNiedersachsen Amtsgericht Hildesheim HRB 312\nSonstige Registerbekanntmachung\n\nStadtwerke Hildesheim Aktiengesellschaft\nAktiengesellschaft\nHildesheim\n\nDie Liste der Mitglieder des Aufsichtsrats wurde beim Registergericht eingereicht."
    },
    {
      "date": "2025-07-08",
      "id": "115010",
      "original_text": "Löschungsankündigung\nNiedersachsen Amtsgericht Tostedt HRB 110739 früher Amtsgericht Langen\nDive-Station Hemmoor GmbH – Hemmoor",
      "type": "Löschungsankündigung",
      "state": "Niedersachsen",
      "amtsgericht": "Amtsgericht Tostedt",
      "registernummer": "HRB 110739",
      "registerart": "HRB",
      "company_name": "Dive-Station Hemmoor GmbH",
      "company_seat": "Hemmoor",
      "former_amtsgericht": "Langen",
      "details": "08.07.2025 (Bekanntmachungsdatum)\n\nNiedersachsen Amtsgericht Tostedt HRB 110739 früher Amtsgericht Langen\nLöschungsankündigung 08.07.2025 (Eintragungsdatum)\n\nDive-Station Hemmoor GmbH\nGesellschaft mit beschränkter Haftung\nHemmoor\n\nDas Registergericht beabsichtigt, die Gesellschaft von Amts wegen nach § 394 FamFG zu löschen. Die Frist zur Erhebung eines Widerspruchs ist auf 1 Monat ab dieser Registerbekanntmachung festgesetzt."
    },
    {
      "date": "2025-07-08",
      "id": "115011",
      "original_text": "Löschungsankündigung\nNiedersachsen Amtsgericht Osnabrück HRA 121159 früher Amtsgericht Meppen\nMS \"Berta\" Schiffahrtsgesellschaft mbH & Co. Reederei KG – Haren (Ems)",
      "type": "Löschungsankündigung",
      "state": "Niedersachsen",
      "amtsgericht": "Amtsgericht Osnabrück",
      "registernummer": "HRA 121159",
      "registerart": "HRA",
      "company_name": "MS \"Berta\" Schiffahrtsgesellschaft mbH & Co. Reederei KG",
      "company_seat": "Haren (Ems)",
      "former_amtsgericht": "Meppen",
      "details": "08.07.2025 (Bekanntmachungsdatum)\n\nNiedersachsen Amtsgericht Osnabrück HRA 121159 früher Amtsgericht Meppen\nLöschungsankündigung\n\nMS \"Berta\" Schiffahrtsgesellschaft mbH & Co. Reederei KG\nKommanditgesellschaft\nHaren (Ems)\n\nDas Registergericht beabsichtigt, die Firma von Amts wegen nach § 394 FamFG wegen Vermögenslosigkeit zu löschen. Die Frist zur Erhebung eines Widerspruchs ist auf 1 Monat ab dieser Registerbekanntmachung festgesetzt."
    },
    {
      "date": "2025-07-08",
      "id": "115012",
      "original_text": "Registerbekanntmachung nach dem Umwandlungsgesetz\nNiedersachsen Amtsgericht Braunschweig HRB 205488\nPutessa GmbH – Wolfenbüttel",
      "type": "Registerbekanntmachung nach dem Umwandlungsgesetz",
      "state": "Niedersachsen",
      "amtsgericht": "Amtsgericht Braunschweig",
      "registernummer": "HRB 205488",
      "registerart": "HRB",
      "company_name": "Putessa GmbH",
      "company_seat": "Wolfenbüttel",
      "details": "08.07.2025 (Bekanntmachungsdatum)\n\nNiedersachsen Amtsgericht Braunschweig HRB 205488\nRegisterbekanntmachung nach dem Umwandlungsgesetz 08.07.2025 (Eintragungsdatum)\n\nPutessa GmbH\nGesellschaft mit beschränkter Haftung\nWolfenbüttel\n\nDen Gläubigern der an der Verschmelzung beteiligten Rechtsträger ist, wenn sie binnen sechs Monaten nach dem Tag, an dem die Eintragung der Verschmelzung in das Register des Sitzes desjenigen Rechtsträgers, dessen Gläubiger sie sind, nach § 19  Abs.  3 UmwG als bekannt gemacht gilt, ihren Anspruch nach Grund und Höhe schriftlich anmelden, Sicherheit zu leisten, soweit sie nicht Befriedigung verlangen können. Dieses Recht steht den Gläubigern jedoch nur zu, wenn sie glaubhaft machen, dass durch die Verschmelzung die Erfüllung der Forderung gefährdet wird."
    },
    {
      "date": "2025-07-08",
      "id": "115013",
      "original_text": "Einreichung neuer Dokumente\nNiedersachsen Amtsgericht Osnabrück HRB 218106\nSievert Baustoffe Beteiligungen SE – Osnabrück",
      "type": "Einreichung neuer Dokumente",
      "state": "Niedersachsen",
      "amtsgericht": "Amtsgericht Osnabrück",
      "registernummer": "HRB 218106",
      "registerart": "HRB",
      "company_name": "Sievert Baustoffe Beteiligungen SE",
      "company_seat": "Osnabrück",
      "details": "08.07.2025 (Bekanntmachungsdatum)\n\nNiedersachsen Amtsgericht Osnabrück HRB 218106\nEinreichung neuer Dokumente 08.07.2025 (Eintragungsdatum)\n\nSievert Baustoffe Beteiligungen SE\nEuropäische Aktiengesellschaft (SE)\nOsnabrück\n\nDie Liste der Mitglieder des Verwaltungsrats wurde beim Registergericht eingereicht."
    },
    {
      "date": "2025-07-08",
      "id": "115014",
      "original_text": "Registerbekanntmachung nach dem Umwandlungsgesetz\nNiedersachsen Amtsgericht Braunschweig HRA 203283\nPohl Planen und Beraten e. K. – Goslar",
      "type": "Registerbekanntmachung nach dem Umwandlungsgesetz",
      "state": "Niedersachsen",
      "amtsgericht": "Amtsgericht Braunschweig",
      "registernummer": "HRA 203283",
      "registerart": "HRA",
      "company_name": "Pohl Planen und Beraten e. K.",
      "company_seat": "Goslar",
      "details": "08.07.2025 (Bekanntmachungsdatum)\n\nNiedersachsen Amtsgericht Braunschweig HRA 203283\nRegisterbekanntmachung nach dem Umwandlungsgesetz 08.07.2025 (Eintragungsdatum)\n\nPohl Planen und Beraten e. K.\nEinzelkaufmann / Einzelkauffrau\nGoslar\n\nDen Gläubigern der an der Ausgliederung beteiligten Rechtsträger ist, wenn sie binnen sechs Monaten nach dem Tag, an dem die Eintragung der Ausgliederung in das Register des Sitzes desjenigen Rechtsträgers, dessen Gläubiger sie sind, nach § 19 Abs. 3 UmwG als bekannt gemacht gilt, ihren Anspruch nach Grund und Höhe schriftlich anmelden, Sicherheit zu leisten, soweit sie nicht Befriedigung verlangen können. Dieses Recht steht den Gläubigern jedoch nur zu, wenn sie glaubhaft machen, dass durch die Ausgliederung die Erfüllung der Forderung gefährdet wird."
    },
    {
      "date": "2025-07-08",
      "id": "115015",
      "original_text": "Registerbekanntmachung nach dem Umwandlungsgesetz\nNiedersachsen Amtsgericht Osnabrück HRA 209518\nYvonne Zeidler e.Kfr. – Osnabrück",
      "type": "Registerbekanntmachung nach dem Umwandlungsgesetz",
      "state": "Niedersachsen",
      "amtsgericht": "Amtsgericht Osnabrück",
      "registernummer": "HRA 209518",
      "registerart": "HRA",
      "company_name": "Yvonne Zeidler e.Kfr.",
      "company_seat": "Osnabrück",
      "details": "08.07.2025 (Bekanntmachungsdatum)\n\nNiedersachsen Amtsgericht Osnabrück HRA 209518\nRegisterbekanntmachung nach dem Umwandlungsgesetz 08.07.2025 (Eintragungsdatum)\n\nYvonne Zeidler e.Kfr.\nEinzelkaufmann / Einzelkauffrau\nOsnabrück\n\nDen Gläubigern der an der Ausgliederung beteiligten Rechtsträger ist, wenn sie binnen sechs Monaten nach dem Tag, an dem die Eintragung der Ausgliederung in das Register des Sitzes desjenigen Rechtsträgers, dessen Gläubiger sie sind, nach § 19 Abs. 3 UmwG als bekannt gemacht gilt, ihren Anspruch nach Grund und Höhe schriftlich anmelden, Sicherheit zu leisten, soweit sie nicht Befriedigung verlangen können. Dieses Recht steht den Gläubigern jedoch nur zu, wenn sie glaubhaft machen, dass durch die Ausgliederung die Erfüllung der Forderung gefährdet wird."
    },
    {
      "date": "2025-07-08",
      "id": "115016",
      "original_text": "Registerbekanntmachung nach dem Umwandlungsgesetz\nNiedersachsen Amtsgericht Braunschweig HRB 203362\nAnna Vermögensverwaltungs GmbH – Wolfenbüttel",
      "type": "Registerbekanntmachung nach dem Umwandlungsgesetz",
      "state": "Niedersachsen",
      "amtsgericht": "Amtsgericht Braunschweig",
      "registernummer": "HRB 203362",
      "registerart": "HRB",
      "company_name": "Anna Vermögensverwaltungs GmbH",
      "company_seat": "Wolfenbüttel",
      "details": "08.07.2025 (Bekanntmachungsdatum)\n\nNiedersachsen Amtsgericht Braunschweig HRB 203362\nRegisterbekanntmachung nach dem Umwandlungsgesetz 08.07.2025 (Eintragungsdatum)\n\nAnna Vermögensverwaltungs GmbH\nGesellschaft mit beschränkter Haftung\nWolfenbüttel\n\nDen Gläubigern der an der Verschmelzung beteiligten Rechtsträger ist, wenn sie binnen sechs Monaten nach dem Tag, an dem die Eintragung der Verschmelzung in das Register des Sitzes desjenigen Rechtsträgers, dessen Gläubiger sie sind, nach § 19  Abs.  3 UmwG als bekannt gemacht gilt, ihren Anspruch nach Grund und Höhe schriftlich anmelden, Sicherheit zu leisten, soweit sie nicht Befriedigung verlangen können. Dieses Recht steht den Gläubigern jedoch nur zu, wenn sie glaubhaft machen, dass durch die Verschmelzung die Erfüllung der Forderung gefährdet wird."
    },
    {
      "date": "2025-07-08",
      "id": "115017",
      "original_text": "Löschungsankündigung\nRheinland-Pfalz Amtsgericht Zweibrücken HRB 32347\nDeli Bejta UG (haftungsbeschränkt) – Hauenstein",
      "type": "Löschungsankündigung",
      "state": "Rheinland-Pfalz",
      "amtsgericht": "Amtsgericht Zweibrücken",
      "registernummer": "HRB 32347",
      "registerart": "HRB",
      "company_name": "Deli Bejta UG (haftungsbeschränkt)",
      "company_seat": "Hauenstein",
      "details": "08.07.2025 (Bekanntmachungsdatum)\n\nRheinland-Pfalz Amtsgericht Zweibrücken HRB 32347\nLöschungsankündigung\n\nDeli Bejta UG (haftungsbeschränkt)\nGesellschaft mit beschränkter Haftung\nHauenstein\n\nDas Registergericht beabsichtigt die Gesellschaft von Amts wegen nach § 394 FamFG zu löschen. Die Frist zur Erhebung eines Widerspruchs ist auf einen Monat festgesetzt."
    },
    {
      "date": "2025-07-08",
      "id": "115018",
      "original_text": "Registerbekanntmachung nach dem Umwandlungsgesetz\nRheinland-Pfalz Amtsgericht Montabaur GsR 505\nSommer & Sommer Immobilien eGbR – Straßenhaus",
      "type": "Registerbekanntmachung nach dem Umwandlungsgesetz",
      "state": "Rheinland-Pfalz",
      "amtsgericht": "Amtsgericht Montabaur",
      "registernummer": "GsR 505",
      "registerart": "GsR",
      "company_name": "Sommer & Sommer Immobilien eGbR",
      "company_seat": "Straßenhaus",
      "details": "08.07.2025 (Bekanntmachungsdatum)\n\nRheinland-Pfalz Amtsgericht Montabaur GsR 505\nRegisterbekanntmachung nach dem Umwandlungsgesetz 08.07.2025 (Eintragungsdatum)\n\nSommer & Sommer Immobilien eGbR\nGesellschaft bürgerlichen Rechts\nStraßenhaus\n\nAls nicht eingetragen wird veröffentlicht:\nDen Gläubigern des formwechselnden Rechtsträgers ist, wenn sie binnen sechs Monaten nach dem Tag, an dem die Eintragung des Formwechsels nach § 201 UmwG als bekannt gemacht gilt, ihren Anspruch nach Grund und Höhe schriftlich anmelden, Sicherheit zu leisten, soweit sie nicht Befriedigung verlangen können. Dieses Recht steht den Gläubigern jedoch nur zu, wenn sie glaubhaft machen, dass durch den Formwechsel die Erfüllung der Forderung gefährdet wird."
    },
    {
      "date": "2025-07-08",
      "id": "115019",
      "original_text": "Löschungsankündigung\nRheinland-Pfalz Amtsgericht Ludwigshafen a.Rhein (Ludwigshafen) HRB 65842\nZezelj - TOJA - GmbH – Speyer",
      "type": "Löschungsankündigung",
      "state": "Rheinland-Pfalz",
      "amtsgericht": "Amtsgericht Ludwigshafen a.Rhein (Ludwigshafen)",
      "registernummer": "HRB 65842",
      "registerart": "HRB",
      "company_name": "Zezelj - TOJA - GmbH",
      "company_seat": "Speyer",
      "details": "08.07.2025 (Bekanntmachungsdatum)\n\nRheinland-Pfalz Amtsgericht Ludwigshafen a.Rhein (Ludwigshafen) HRB 65842\nLöschungsankündigung\n\nZezelj - TOJA - GmbH\nGesellschaft mit beschränkter Haftung\nSpeyer\n\nDas Registergericht beabsichtigt die Gesellschaft von Amts wegen nach § 394 FamFG zu löschen. Die Frist zur Erhebung eines Widerspruchs ist auf einen Monat festgesetzt."
    },
    {
      "date": "2025-07-08",
      "id": "115020",
      "original_text": "Löschungsankündigung\nRheinland-Pfalz Amtsgericht Kaiserslautern HRB 32969\nI + A Montage UG (haftungsbeschränkt) – Hirschhorn",
      "type": "Löschungsankündigung",
      "state": "Rheinland-Pfalz",
      "amtsgericht": "Amtsgericht Kaiserslautern",
      "registernummer": "HRB 32969",
      "registerart": "HRB",
      "company_name": "I + A Montage UG (haftungsbeschränkt)",
      "company_seat": "Hirschhorn",
      "details": "08.07.2025 (Bekanntmachungsdatum)\n\nRheinland-Pfalz Amtsgericht Kaiserslautern HRB 32969\nLöschungsankündigung 08.07.2025 (Eintragungsdatum)\n\nI + A Montage UG (haftungsbeschränkt)\nGesellschaft mit beschränkter Haftung\nHirschhorn\n\nDas Registergericht beabsichtigt die vorgenannte Firma gemäß § 394 FamFG wegen Vermögenslosigkeit zu löschen. Widerspruch gegen die Löschung kann nur binnen 3 Monaten ab Veröffentlichung dieser Verfügung eingelegt werden."
    },
    {
      "date": "2025-07-08",
      "id": "115021",
      "original_text": "Löschungsankündigung\nRheinland-Pfalz Amtsgericht Kaiserslautern HRB 32969\nI + A Montage UG (haftungsbeschränkt) – Hirschhorn",
      "type": "Löschungsankündigung",
      "state": "Rheinland-Pfalz",
      "amtsgericht": "Amtsgericht Kaiserslautern",
      "registernummer": "HRB 32969",
      "registerart": "HRB",
      "company_name": "I + A Montage UG (haftungsbeschränkt)",
      "company_seat": "Hirschhorn",
      "details": "08.07.2025 (Bekanntmachungsdatum)\n\nRheinland-Pfalz Amtsgericht Kaiserslautern HRB 32969\nLöschungsankündigung 08.07.2025 (Eintragungsdatum)\n\nI + A Montage UG (haftungsbeschränkt)\nGesellschaft mit beschränkter Haftung\nHirschhorn\n\nDas Registergericht beabsichtigt die vorgenannte Firma gemäß § 394 FamFG wegen Vermögenslosigkeit zu löschen. Widerspruch gegen die Löschung kann nur binnen 3 Monaten ab Veröffentlichung dieser Verfügung eingelegt werden."
    },
    {
      "date": "2025-07-08",
      "id": "115022",
      "original_text": "Löschungsankündigung\nRheinland-Pfalz Amtsgericht Ludwigshafen a.Rhein (Ludwigshafen) HRB 66326\nRullo Dienstleistungen GmbH – Beindersheim",
      "type": "Löschungsankündigung",
      "state": "Rheinland-Pfalz",
      "amtsgericht": "Amtsgericht Ludwigshafen a.Rhein (Ludwigshafen)",
      "registernummer": "HRB 66326",
      "registerart": "HRB",
      "company_name": "Rullo Dienstleistungen GmbH",
      "company_seat": "Beindersheim",
      "details": "08.07.2025 (Bekanntmachungsdatum)\n\nRheinland-Pfalz Amtsgericht Ludwigshafen a.Rhein (Ludwigshafen) HRB 66326\nLöschungsankündigung\n\nRullo Dienstleistungen GmbH\nGesellschaft mit beschränkter Haftung\nBeindersheim\n\nDas Registergericht beabsichtigt die Gesellschaft von Amts wegen nach § 394 FamFG zu löschen. Die Frist zur Erhebung eines Widerspruchs ist auf einen Monat festgesetzt."
    },
    {
      "date": "2025-07-08",
      "id": "115023",
      "original_text": "Einreichung neuer Dokumente\nRheinland-Pfalz Amtsgericht Bad Kreuznach HRB 10947\nLEBENSHILFE Obere Nahe gemeinnützige GmbH Soziale Dienste und Einrichtungen – Idar-Oberstein",
      "type": "Einreichung neuer Dokumente",
      "state": "Rheinland-Pfalz",
      "amtsgericht": "Amtsgericht Bad Kreuznach",
      "registernummer": "HRB 10947",
      "registerart": "HRB",
      "company_name": "LEBENSHILFE Obere Nahe gemeinnützige GmbH Soziale Dienste und Einrichtungen",
      "company_seat": "Idar-Oberstein",
      "details": "08.07.2025 (Bekanntmachungsdatum)\n\nRheinland-Pfalz Amtsgericht Bad Kreuznach HRB 10947\nEinreichung neuer Dokumente\n\nLEBENSHILFE Obere Nahe gemeinnützige GmbH Soziale Dienste und Einrichtungen\nGesellschaft mit beschränkter Haftung\nIdar-Oberstein\n\nDem Registergericht ist eine neue Liste der Mitglieder des Aufsichtsrates eingereicht worden."
    },
    {
      "date": "2025-07-08",
      "id": "115024",
      "original_text": "Registerbekanntmachung nach dem Umwandlungsgesetz\nBremen Amtsgericht Bremen HRB 5512 BHV\nPetram Beteiligungs GmbH – Bremerhaven",
      "type": "Registerbekanntmachung nach dem Umwandlungsgesetz",
      "state": "Bremen",
      "amtsgericht": "Amtsgericht Bremen",
      "registernummer": "HRB 5512 BHV",
      "registerart": "HRB",
      "company_name": "Petram Beteiligungs GmbH",
      "company_seat": "Bremerhaven",
      "details": "08.07.2025 (Bekanntmachungsdatum)\n\nBremen Amtsgericht Bremen HRB 5512 BHV\nRegisterbekanntmachung nach dem Umwandlungsgesetz 27.06.2025 (Eintragungsdatum)\n\nPetram Beteiligungs GmbH\nGesellschaft mit beschränkter Haftung\nBremerhaven\n\nZu Eintragungsnummer 12 vom 27.06.2025 wird als nicht eingetragen veröffentlicht:\nDen Gläubigern der an der Verschmelzung beteiligten Rechtsträger ist, wenn sie binnen sechs Monaten nach dem Tag, an dem die Eintragung der Verschmelzung in das Register des Sitzes desjenigen Rechtsträgers, dessen Gläubiger sie sind, als bekannt gemacht gilt, ihren Anspruch nach Grund und Höhe schriftlich anmelden, Sicherheit zu leisten, soweit sie nicht Befriedigung verlangen können. Dieses Recht steht den Gläubigern jedoch nur zu, wenn sie glaubhaft machen, dass durch die Verschmelzung die Erfüllung ihrer Forderung gefährdet wird. Das Recht, Sicherheitsleistung zu verlangen, steht Gläubigern nicht zu, die im Falle der Insolvenz ein Recht auf vorzugsweise Befriedigung aus einer Deckungsmasse haben, die nach gesetzlicher Vorschrift zu ihrem Schutz errichtet und staatlich überwacht ist."
    },
    {
      "date": "2025-07-08",
      "id": "115025",
      "original_text": "Registerbekanntmachung nach dem Umwandlungsgesetz\nBremen Amtsgericht Bremen HRB 36389\nHirschfeld Beteiligungs-GmbH – Bremen",
      "type": "Registerbekanntmachung nach dem Umwandlungsgesetz",
      "state": "Bremen",
      "amtsgericht": "Amtsgericht Bremen",
      "registernummer": "HRB 36389",
      "registerart": "HRB",
      "company_name": "Hirschfeld Beteiligungs-GmbH",
      "company_seat": "Bremen",
      "details": "08.07.2025 (Bekanntmachungsdatum)\n\nBremen Amtsgericht Bremen HRB 36389\nRegisterbekanntmachung nach dem Umwandlungsgesetz 27.06.2025 (Eintragungsdatum)\n\nHirschfeld Beteiligungs-GmbH\nGesellschaft mit beschränkter Haftung\nBremen\n\nZu Eintragungsnummer 2 vom 27.06.2025 wird als nicht eingetragen veröffentlicht:\nDen Gläubigern der an der Verschmelzung beteiligten Rechtsträger ist, wenn sie binnen sechs Monaten nach dem Tag, an dem die Eintragung der Verschmelzung in das Register des Sitzes desjenigen Rechtsträgers, dessen Gläubiger sie sind, als bekannt gemacht gilt, ihren Anspruch nach Grund und Höhe schriftlich anmelden, Sicherheit zu leisten, soweit sie nicht Befriedigung verlangen können. Dieses Recht steht den Gläubigern jedoch nur zu, wenn sie glaubhaft machen, dass durch die Verschmelzung die Erfüllung ihrer Forderung gefährdet wird. Das Recht, Sicherheitsleistung zu verlangen, steht Gläubigern nicht zu, die im Falle der Insolvenz ein Recht auf vorzugsweise Befriedigung aus einer Deckungsmasse haben, die nach gesetzlicher Vorschrift zu ihrem Schutz errichtet und staatlich überwacht ist."
    },
    {
      "date": "2025-07-08",
      "id": "115026",
      "original_text": "Löschungsankündigung\nBremen Amtsgericht Bremen HRB 23949\ndie firma b+s Zeitarbeit GmbH – Bremen",
      "type": "Löschungsankündigung",
      "state": "Bremen",
      "amtsgericht": "Amtsgericht Bremen",
      "registernummer": "HRB 23949",
      "registerart": "HRB",
      "company_name": "die firma b+s Zeitarbeit GmbH",
      "company_seat": "Bremen",
      "details": "08.07.2025 (Bekanntmachungsdatum)\n\nBremen Amtsgericht Bremen HRB 23949\nLöschungsankündigung\n\ndie firma b+s Zeitarbeit GmbH\nGesellschaft mit beschränkter Haftung\nBremen\n\nEs ist beabsichtigt die im Handelsregister eingetragene Gesellschaft von Amts wegen gemäß § 394 FamFG zu löschen. Gegen die Löschung kann beim AG Bremen schriftlich oder zu Protokoll der Geschäftsstelle Widerspruch eingelegt werden. Widerspruchsfrist 4 Wochen."
    },
    {
      "date": "2025-07-08",
      "id": "115027",
      "original_text": "Löschungsankündigung\nBremen Amtsgericht Bremen HRA 25379\nMarketing und Medien Nordwest GmbH & Co. KG – Bremen",
      "type": "Löschungsankündigung",
      "state": "Bremen",
      "amtsgericht": "Amtsgericht Bremen",
      "registernummer": "HRA 25379",
      "registerart": "HRA",
      "company_name": "Marketing und Medien Nordwest GmbH & Co. KG",
      "company_seat": "Bremen",
      "details": "08.07.2025 (Bekanntmachungsdatum)\n\nBremen Amtsgericht Bremen HRA 25379\nLöschungsankündigung\n\nMarketing und Medien Nordwest GmbH & Co. KG\nKommanditgesellschaft\nBremen\n\nEs ist beabsichtigt die im Handelsregister eingetragene Gesellschaft von Amts wegen gemäß § 394 FamFG zu löschen. Gegen die Löschung kann beim AG Bremen schriftlich oder zu Protokoll der Geschäftsstelle Widerspruch eingelegt werden. Widerspruchsfrist 4 Wochen."
    },
    {
      "date": "2025-07-08",
      "id": "115028",
      "original_text": "Löschungsankündigung\nBremen Amtsgericht Bremen HRB 28835\nDenov Bauunternehmen UG (haftungsbeschränkt) – Bremen",
      "type": "Löschungsankündigung",
      "state": "Bremen",
      "amtsgericht": "Amtsgericht Bremen",
      "registernummer": "HRB 28835",
      "registerart": "HRB",
      "company_name": "Denov Bauunternehmen UG (haftungsbeschränkt)",
      "company_seat": "Bremen",
      "details": "08.07.2025 (Bekanntmachungsdatum)\n\nBremen Amtsgericht Bremen HRB 28835\nLöschungsankündigung\n\nDenov Bauunternehmen UG (haftungsbeschränkt)\nGesellschaft mit beschränkter Haftung\nBremen\n\nEs ist beabsichtigt die im Handelsregister eingetragene Gesellschaft von Amts wegen gemäß § 394 FamFG zu löschen. Gegen die Löschung kann beim AG Bremen schriftlich oder zu Protokoll der Geschäftsstelle Widerspruch eingelegt werden. Widerspruchsfrist 4 Wochen."
    },
    {
      "date": "2025-07-08",
      "id": "115029",
      "original_text": "Löschungsankündigung\nNordrhein-Westfalen Amtsgericht Dortmund HRB 31420\nDCD GmbH – Dortmund",
      "type": "Löschungsankündigung",
      "state": "Nordrhein-Westfalen",
      "amtsgericht": "Amtsgericht Dortmund",
      "registernummer": "HRB 31420",
      "registerart": "HRB",
      "company_name": "DCD GmbH",
      "company_seat": "Dortmund",
      "details": "08.07.2025 (Bekanntmachungsdatum)\n\nNordrhein-Westfalen Amtsgericht Dortmund HRB 31420\nLöschungsankündigung\n\nDCD GmbH\nGesellschaft mit beschränkter Haftung\nDortmund\n\nDas Registergericht beabsichtigt die Gesellschaft von Amts wegen nach § 394 FamFG zu löschen. Die Frist zur Erhebung eines Widerspruchs ist auf zwei Monate festgesetzt."
    },
    {
      "date": "2025-07-08",
      "id": "115030",
      "original_text": "Registerbekanntmachung nach dem Umwandlungsgesetz\nNordrhein-Westfalen Amtsgericht Köln HRB 73217\nHÄVG Hausärztliche Vertragsgemeinschaft Aktiengesellschaft – Köln",
      "type": "Registerbekanntmachung nach dem Umwandlungsgesetz",
      "state": "Nordrhein-Westfalen",
      "amtsgericht": "Amtsgericht Köln",
      "registernummer": "HRB 73217",
      "registerart": "HRB",
      "company_name": "HÄVG Hausärztliche Vertragsgemeinschaft Aktiengesellschaft",
      "company_seat": "Köln",
      "details": "08.07.2025 (Bekanntmachungsdatum)\n\nNordrhein-Westfalen Amtsgericht Köln HRB 73217\nRegisterbekanntmachung nach dem Umwandlungsgesetz 08.07.2025 (Eintragungsdatum)\n\nHÄVG Hausärztliche Vertragsgemeinschaft Aktiengesellschaft\nAktiengesellschaft\nKöln\n\nDen Gläubigern der an der Verschmelzung beteiligten Rechtsträger ist, wenn sie binnen sechs Monaten nach dem Tag, an dem die Eintragung der Verschmelzung in das Register des Sitzes desjenigen Rechtsträgers, dessen Gläubiger sie sind, nach § 19 Absatz 3 UmwG als bekanntgemacht gilt, ihren Anspruch nach Grund und Höhe schriftlich anmelden, Sicherheit zu leisten, soweit sie nicht Befriedigung verlangen können. Dieses Recht steht den Gläubigern jedoch nur zu, wenn sie glaubhaft machen, dass durch die Verschmelzung die Erfüllung ihrer Forderung gefährdet wird."
    },
    {
      "date": "2025-07-08",
      "id": "115031",
      "original_text": "Registerbekanntmachung nach dem Umwandlungsgesetz\nNordrhein-Westfalen Amtsgericht Münster HRA 11979\nMG GmbH & Co. KG – Warendorf",
      "type": "Registerbekanntmachung nach dem Umwandlungsgesetz",
      "state": "Nordrhein-Westfalen",
      "amtsgericht": "Amtsgericht Münster",
      "registernummer": "HRA 11979",
      "registerart": "HRA",
      "company_name": "MG GmbH & Co. KG",
      "company_seat": "Warendorf",
      "details": "08.07.2025 (Bekanntmachungsdatum)\n\nNordrhein-Westfalen Amtsgericht Münster HRA 11979\nRegisterbekanntmachung nach dem Umwandlungsgesetz 08.07.2025 (Eintragungsdatum)\n\nMG GmbH & Co. KG\nKommanditgesellschaft\nWarendorf\n\nDen Gläubigern der an der Verschmelzung beteiligten Rechtsträger ist, wenn sie binnen sechs Monaten nach dem Tag, an dem die Eintragung der Verschmelzung in das Register des Sitzes desjenigen Rechtsträgers, dessen Gläubiger sie sind, nach § 19 Absatz 3 UmwG als bekanntgemacht gilt, ihren Anspruch nach Grund und Höhe schriftlich anmelden, Sicherheit zu leisten, soweit sie nicht Befriedigung verlangen können. Dieses Recht steht den Gläubigern jedoch nur zu, wenn sie glaubhaft machen, dass durch die Verschmelzung die Erfüllung ihrer Forderung gefährdet wird."
    },
    {
      "date": "2025-07-08",
      "id": "115032",
      "original_text": "Registerbekanntmachung nach dem Umwandlungsgesetz\nNordrhein-Westfalen Amtsgericht Krefeld HRB 21084\nVTR Verbindungs-Techniken Rüther GmbH – Tönisvorst",
      "type": "Registerbekanntmachung nach dem Umwandlungsgesetz",
      "state": "Nordrhein-Westfalen",
      "amtsgericht": "Amtsgericht Krefeld",
      "registernummer": "HRB 21084",
      "registerart": "HRB",
      "company_name": "VTR Verbindungs-Techniken Rüther GmbH",
      "company_seat": "Tönisvorst",
      "details": "08.07.2025 (Bekanntmachungsdatum)\n\nNordrhein-Westfalen Amtsgericht Krefeld HRB 21084\nRegisterbekanntmachung nach dem Umwandlungsgesetz 08.07.2025 (Eintragungsdatum)\n\nVTR Verbindungs-Techniken Rüther GmbH\nGesellschaft mit beschränkter Haftung\nTönisvorst\n\nDen Gläubigern der an der Ausgliederung beteiligten Rechtsträger ist, wenn sie binnen sechs Monaten nach dem Tag, an dem die Eintragung der Ausgliederung in das Register des Sitzes desjenigen Rechtsträgers, dessen Gläubiger sie sind, nach § 19 Absatz 3 UmwG als bekanntgemacht gilt, ihren Anspruch nach Grund und Höhe schriftlich anmelden, Sicherheit zu leisten, soweit sie nicht Befriedigung verlangen können. Dieses Recht steht den Gläubigern jedoch nur zu, wenn sie glaubhaft machen, dass durch die Ausgliederung die Erfüllung ihrer Forderung gefährdet wird."
    },
    {
      "date": "2025-07-08",
      "id": "115033",
      "original_text": "Registerbekanntmachung nach dem Umwandlungsgesetz\nNordrhein-Westfalen Amtsgericht Münster HRA 11858\nMG Vermietung OHG – Warendorf",
      "type": "Registerbekanntmachung nach dem Umwandlungsgesetz",
      "state": "Nordrhein-Westfalen",
      "amtsgericht": "Amtsgericht Münster",
      "registernummer": "HRA 11858",
      "registerart": "HRA",
      "company_name": "MG Vermietung OHG",
      "company_seat": "Warendorf",
      "details": "08.07.2025 (Bekanntmachungsdatum)\n\nNordrhein-Westfalen Amtsgericht Münster HRA 11858\nRegisterbekanntmachung nach dem Umwandlungsgesetz 08.07.2025 (Eintragungsdatum)\n\nMG Vermietung OHG\nOffene Handelsgesellschaft\nWarendorf\n\nDen Gläubigern der an der Verschmelzung beteiligten Rechtsträger ist, wenn sie binnen sechs Monaten nach dem Tag, an dem die Eintragung der Verschmelzung in das Register des Sitzes derjenigen Rechtsträger deren Gläubiger sie sind, nach § 19 Absatz 3 UmwG als bekanntgemacht gilt, ihren Anspruch nach Grund und Höhe schriftlich anmelden, Sicherheit zu leisten, soweit sie nicht Befriedigung verlangen können. Dieses Recht steht den Gläubigern jedoch nur zu, wenn sie glaubhaft machen, dass durch die Verschmelzung die Erfüllung ihrer Forderung gefährdet wird."
    },
    {
      "date": "2025-07-08",
      "id": "115034",
      "original_text": "Löschungsankündigung\nNordrhein-Westfalen Amtsgericht Krefeld HRB 15549\nRBS Rhein-Bausicherheitstechnik GmbH – Krefeld",
      "type": "Löschungsankündigung",
      "state": "Nordrhein-Westfalen",
      "amtsgericht": "Amtsgericht Krefeld",
      "registernummer": "HRB 15549",
      "registerart": "HRB",
      "company_name": "RBS Rhein-Bausicherheitstechnik GmbH",
      "company_seat": "Krefeld",
      "details": "08.07.2025 (Bekanntmachungsdatum)\n\nNordrhein-Westfalen Amtsgericht Krefeld HRB 15549\nLöschungsankündigung\n\nRBS Rhein-Bausicherheitstechnik GmbH\nGesellschaft mit beschränkter Haftung\nKrefeld\n\nDas Registergericht beabsichtigt die Gesellschaft von Amts wegen nach § 394 FamFG zu löschen. Die Frist zur Erhebung eines Widerspruchs ist auf einen Monat festgesetzt."
    },
    {
      "date": "2025-07-08",
      "id": "115035",
      "original_text": "Löschungsankündigung\nNordrhein-Westfalen Amtsgericht Köln HRB 90528\nMovino Gastro GmbH – Bergheim",
      "type": "Löschungsankündigung",
      "state": "Nordrhein-Westfalen",
      "amtsgericht": "Amtsgericht Köln",
      "registernummer": "HRB 90528",
      "registerart": "HRB",
      "company_name": "Movino Gastro GmbH",
      "company_seat": "Bergheim",
      "details": "08.07.2025 (Bekanntmachungsdatum)\n\nNordrhein-Westfalen Amtsgericht Köln HRB 90528\nLöschungsankündigung\n\nMovino Gastro GmbH\nGesellschaft mit beschränkter Haftung\nBergheim\n\nDas Registergericht beabsichtigt, die im Handelsregister eingetragene Gesellschaft gemäß § 394 Absatz 1 FamFG wegen Vermögenslosigkeit von Amts wegen zu löschen. Gegen diese Verfügung kann Widerspruch eingelegt werden. Die Frist zur Erhebung eines Widerspruchs gegen die beabsichtigte Löschung von Amts wegen ist auf einen Monat festgesetzt. Rechtsbehelfsbelehrung: Gegen diese Verfügung können Sie Widerspruch einlegen. Der Widerspruch ist bei dem Amtsgericht Köln, Reichenspergerplatz 1, 50670 Köln schriftlich in deutscher Sprache oder zur Niederschrift der Geschäftsstelle einzulegen. Der Widerspruch kann auch zur Niederschrift der Geschäftsstelle eines jeden Amtsgerichtes abgegeben werden. Die Einlegung ist auch durch Übertragung eines elektronischen Dokuments an die elektronische Poststelle des Gerichts möglich. Das elektronische Dokument muss für die Bearbeitung durch das Gericht geeignet und mit einer qualifizierten elektronischen Signatur der verantwortenden Person versehen sein oder von der verantwortenden Person signiert und auf einem sicheren Übermittlungsweg gemäß § 130a ZPO nach näherer Maßgabe der Verordnung über die technischen Rahmenbedingungen des elektronischen Rechtsverkehrs und über das besondere elektronische Behördenpostfach (BGBl. I, S.3803) eingereicht werden. Weitere Informationen erhalten Sie auf der Internetseite www.justiz.de.Der Widerspruch muss spätestens innerhalb der gesetzten Frist bei dem Amtsgericht Köln eingegangen sein. Dies gilt auch dann, wenn der Widerspruch zur Niederschrift der Geschäftsstelle eines anderen Amtsgerichtes abgegeben wurde. Die Frist beginnt mit der Veröffentlichung. Fällt das Ende der Frist auf einen Sonntag, einen allgemeinen Feiertag oder Sonnabend, so endet die Frist mit Ablauf des nächsten Werktages.\n\nDer Widerspruch muss die Bezeichnung der angefochtenen Verfügung sowie die Erklärung enthalten, dass Widerspruch gegen diese Verfügung eingelegt wird. Er ist zu unterzeichnen und soll begründet werden."
    },
    {
      "date": "2025-07-08",
      "id": "115036",
      "original_text": "Einreichung neuer Dokumente\nNordrhein-Westfalen Amtsgericht Köln HRB 7474\nEUROPA Versicherung Aktiengesellschaft – Köln",
      "type": "Einreichung neuer Dokumente",
      "state": "Nordrhein-Westfalen",
      "amtsgericht": "Amtsgericht Köln",
      "registernummer": "HRB 7474",
      "registerart": "HRB",
      "company_name": "EUROPA Versicherung Aktiengesellschaft",
      "company_seat": "Köln",
      "details": "08.07.2025 (Bekanntmachungsdatum)\n\nNordrhein-Westfalen Amtsgericht Köln HRB 7474\nEinreichung neuer Dokumente\n\nEUROPA Versicherung Aktiengesellschaft\nAktiengesellschaft\nKöln\n\nDem Registergericht ist eine neue Liste der Mitglieder des Aufsichtsrates eingereicht worden."
    },
    {
      "date": "2025-07-08",
      "id": "115037",
      "original_text": "Registerbekanntmachung nach dem Umwandlungsgesetz\nNordrhein-Westfalen Amtsgericht Duisburg HRB 25066\nphial Immobilien Oberhausen ILF 33/35 GmbH – Oberhausen",
      "type": "Registerbekanntmachung nach dem Umwandlungsgesetz",
      "state": "Nordrhein-Westfalen",
      "amtsgericht": "Amtsgericht Duisburg",
      "registernummer": "HRB 25066",
      "registerart": "HRB",
      "company_name": "phial Immobilien Oberhausen ILF 33/35 GmbH",
      "company_seat": "Oberhausen",
      "details": "08.07.2025 (Bekanntmachungsdatum)\n\nNordrhein-Westfalen Amtsgericht Duisburg HRB 25066\nRegisterbekanntmachung nach dem Umwandlungsgesetz 08.07.2025 (Eintragungsdatum)\n\nphial Immobilien Oberhausen ILF 33/35 GmbH\nGesellschaft mit beschränkter Haftung\nOberhausen\n\nDen Gläubigern der an der Verschmelzung beteiligten Rechtsträger ist, wenn sie binnen sechs Monaten nach dem Tag, an dem die Eintragung der Verschmelzung in das Register des Sitzes desjenigen Rechtsträgers, dessen Gläubiger sie sind, nach § 19 Absatz 3 UmwG als bekanntgemacht gilt, ihren Anspruch nach Grund und Höhe schriftlich anmelden, Sicherheit zu leisten, soweit sie nicht Befriedigung verlangen können. Dieses Recht steht den Gläubigern jedoch nur zu, wenn sie glaubhaft machen, dass durch die Verschmelzung die Erfüllung ihrer Forderung gefährdet wird."
    },
    {
      "date": "2025-07-08",
      "id": "115038",
      "original_text": "Registerbekanntmachung nach dem Umwandlungsgesetz\nNordrhein-Westfalen Amtsgericht Köln HRB 113177\nAvenga Platinum Holding II GmbH – Köln",
      "type": "Registerbekanntmachung nach dem Umwandlungsgesetz",
      "state": "Nordrhein-Westfalen",
      "amtsgericht": "Amtsgericht Köln",
      "registernummer": "HRB 113177",
      "registerart": "HRB",
      "company_name": "Avenga Platinum Holding II GmbH",
      "company_seat": "Köln",
      "details": "08.07.2025 (Bekanntmachungsdatum)\n\nNordrhein-Westfalen Amtsgericht Köln HRB 113177\nRegisterbekanntmachung nach dem Umwandlungsgesetz 08.07.2025 (Eintragungsdatum)\n\nAvenga Platinum Holding II GmbH\nGesellschaft mit beschränkter Haftung\nKöln\n\nDen Gläubigern der an der Verschmelzung beteiligten Rechtsträger ist, wenn sie binnen sechs Monaten nach dem Tag, an dem die Eintragung der Verschmelzung in das Register des Sitzes desjenigen Rechtsträgers, dessen Gläubiger sie sind, nach § 19 Absatz 3 UmwG als bekanntgemacht gilt, ihren Anspruch nach Grund und Höhe schriftlich anmelden, Sicherheit zu leisten, soweit sie nicht Befriedigung verlangen können. Dieses Recht steht den Gläubigern jedoch nur zu, wenn sie glaubhaft machen, dass durch die Verschmelzung die Erfüllung ihrer Forderung gefährdet wird."
    },
    {
      "date": "2025-07-08",
      "id": "115039",
      "original_text": "Sonstige Registerbekanntmachung\nNordrhein-Westfalen Amtsgericht Bochum HRB 9537\nWaterkotte GmbH – Herne",
      "type": "Sonstige Registerbekanntmachung",
      "state": "Nordrhein-Westfalen",
      "amtsgericht": "Amtsgericht Bochum",
      "registernummer": "HRB 9537",
      "registerart": "HRB",
      "company_name": "Waterkotte GmbH",
      "company_seat": "Herne",
      "details": "08.07.2025 (Bekanntmachungsdatum)\n\nNordrhein-Westfalen Amtsgericht Bochum HRB 9537\nSonstige Registerbekanntmachung 07.07.2025 (Eintragungsdatum)\n\nWaterkotte GmbH\nGesellschaft mit beschränkter Haftung\nHerne"
    },
    {
      "date": "2025-07-08",
      "id": "115040",
      "original_text": "Registerbekanntmachung nach dem Umwandlungsgesetz\nNordrhein-Westfalen Amtsgericht Lemgo HRB 3661\nVMD Versicherungsdienst GmbH – Detmold",
      "type": "Registerbekanntmachung nach dem Umwandlungsgesetz",
      "state": "Nordrhein-Westfalen",
      "amtsgericht": "Amtsgericht Lemgo",
      "registernummer": "HRB 3661",
      "registerart": "HRB",
      "company_name": "VMD Versicherungsdienst GmbH",
      "company_seat": "Detmold",
      "details": "08.07.2025 (Bekanntmachungsdatum)\n\nNordrhein-Westfalen Amtsgericht Lemgo HRB 3661\nRegisterbekanntmachung nach dem Umwandlungsgesetz 08.07.2025 (Eintragungsdatum)\n\nVMD Versicherungsdienst GmbH\nGesellschaft mit beschränkter Haftung\nDetmold\n\nDen Gläubigern der an der Abspaltung beteiligten Rechtsträger ist, wenn sie binnen sechs Monaten nach dem Tag, an dem die Eintragung der Abspaltung in das Register des Sitzes desjenigen Rechtsträgers, dessen Gläubiger sie sind, nach § 19 Absatz 3 UmwG als bekanntgemacht gilt, ihren Anspruch nach Grund und Höhe schriftlich anmelden, Sicherheit zu leisten, soweit sie nicht Befriedigung verlangen können. Dieses Recht steht den Gläubigern jedoch nur zu, wenn sie glaubhaft machen, dass durch die Abspaltung die Erfüllung ihrer Forderung gefährdet wird."
    },
    {
      "date": "2025-07-08",
      "id": "115041",
      "original_text": "Einreichung neuer Dokumente\nNordrhein-Westfalen Amtsgericht Dortmund HRB 20214\nADLER Versicherung AG – Dortmund",
      "type": "Einreichung neuer Dokumente",
      "state": "Nordrhein-Westfalen",
      "amtsgericht": "Amtsgericht Dortmund",
      "registernummer": "HRB 20214",
      "registerart": "HRB",
      "company_name": "ADLER Versicherung AG",
      "company_seat": "Dortmund",
      "details": "08.07.2025 (Bekanntmachungsdatum)\n\nNordrhein-Westfalen Amtsgericht Dortmund HRB 20214\nEinreichung neuer Dokumente 08.07.2025 (Eintragungsdatum)\n\nADLER Versicherung AG\nAktiengesellschaft\nDortmund\n\nDem Registergericht ist eine neue Liste der Mitglieder des Aufsichtsrates eingereicht worden."
    },
    {
      "date": "2025-07-08",
      "id": "115042",
      "original_text": "Registerbekanntmachung nach dem Umwandlungsgesetz\nNordrhein-Westfalen Amtsgericht Lemgo HRB 10052\nEcclesia Specialty Holding GmbH – Detmold",
      "type": "Registerbekanntmachung nach dem Umwandlungsgesetz",
      "state": "Nordrhein-Westfalen",
      "amtsgericht": "Amtsgericht Lemgo",
      "registernummer": "HRB 10052",
      "registerart": "HRB",
      "company_name": "Ecclesia Specialty Holding GmbH",
      "company_seat": "Detmold",
      "details": "08.07.2025 (Bekanntmachungsdatum)\n\nNordrhein-Westfalen Amtsgericht Lemgo HRB 10052\nRegisterbekanntmachung nach dem Umwandlungsgesetz 08.07.2025 (Eintragungsdatum)\n\nEcclesia Specialty Holding GmbH\nGesellschaft mit beschränkter Haftung\nDetmold\n\nDen Gläubigern der an der Abspaltung beteiligten Rechtsträger ist, wenn sie binnen sechs Monaten nach dem Tag, an dem die Eintragung der Abspaltung in das Register des Sitzes desjenigen Rechtsträgers, dessen Gläubiger sie sind, nach § 19 Absatz 3 UmwG als bekanntgemacht gilt, ihren Anspruch nach Grund und Höhe schriftlich anmelden, Sicherheit zu leisten, soweit sie nicht Befriedigung verlangen können. Dieses Recht steht den Gläubigern jedoch nur zu, wenn sie glaubhaft machen, dass durch die Abspaltung die Erfüllung ihrer Forderung gefährdet wird."
    },
    {
      "date": "2025-07-08",
      "id": "115043",
      "original_text": "Registerbekanntmachung nach dem Umwandlungsgesetz\nNordrhein-Westfalen Amtsgericht Duisburg HRB 28075\nphial Immobilien Solingen B245 GmbH – Oberhausen",
      "type": "Registerbekanntmachung nach dem Umwandlungsgesetz",
      "state": "Nordrhein-Westfalen",
      "amtsgericht": "Amtsgericht Duisburg",
      "registernummer": "HRB 28075",
      "registerart": "HRB",
      "company_name": "phial Immobilien Solingen B245 GmbH",
      "company_seat": "Oberhausen",
      "details": "08.07.2025 (Bekanntmachungsdatum)\n\nNordrhein-Westfalen Amtsgericht Duisburg HRB 28075\nRegisterbekanntmachung nach dem Umwandlungsgesetz 08.07.2025 (Eintragungsdatum)\n\nphial Immobilien Solingen B245 GmbH\nGesellschaft mit beschränkter Haftung\nOberhausen\n\nDen Gläubigern der an der Verschmelzung beteiligten Rechtsträger ist, wenn sie binnen sechs Monaten nach dem Tag, an dem die Eintragung der Verschmelzung in das Register des Sitzes desjenigen Rechtsträgers, dessen Gläubiger sie sind, nach § 19 Absatz 3 UmwG als bekanntgemacht gilt, ihren Anspruch nach Grund und Höhe schriftlich anmelden, Sicherheit zu leisten, soweit sie nicht Befriedigung verlangen können. Dieses Recht steht den Gläubigern jedoch nur zu, wenn sie glaubhaft machen, dass durch die Verschmelzung die Erfüllung ihrer Forderung gefährdet wird."
    },
    {
      "date": "2025-07-08",
      "id": "115044",
      "original_text": "Registerbekanntmachung nach dem Umwandlungsgesetz\nNordrhein-Westfalen Amtsgericht Köln HRB 99054\nTuringX UG (haftungsbeschränkt) – Köln",
      "type": "Registerbekanntmachung nach dem Umwandlungsgesetz",
      "state": "Nordrhein-Westfalen",
      "amtsgericht": "Amtsgericht Köln",
      "registernummer": "HRB 99054",
      "registerart": "HRB",
      "company_name": "TuringX UG (haftungsbeschränkt)",
      "company_seat": "Köln",
      "details": "08.07.2025 (Bekanntmachungsdatum)\n\nNordrhein-Westfalen Amtsgericht Köln HRB 99054\nRegisterbekanntmachung nach dem Umwandlungsgesetz 08.07.2025 (Eintragungsdatum)\n\nTuringX UG (haftungsbeschränkt)\nGesellschaft mit beschränkter Haftung\nKöln\n\nDen Gläubigern der an der Verschmelzung beteiligten Rechtsträger ist, wenn sie binnen sechs Monaten nach dem Tag, an dem die Eintragung der Verschmelzung in das Register des Sitzes desjenigen Rechtsträgers, dessen Gläubiger sie sind, nach § 19 Absatz 3 UmwG als bekanntgemacht gilt, ihren Anspruch nach Grund und Höhe schriftlich anmelden, Sicherheit zu leisten, soweit sie nicht Befriedigung verlangen können. Dieses Recht steht den Gläubigern jedoch nur zu, wenn sie glaubhaft machen, dass durch die Verschmelzung die Erfüllung ihrer Forderung gefährdet wird."
    },
    {
      "date": "2025-07-08",
      "id": "115045",
      "original_text": "Einreichung neuer Dokumente\nNordrhein-Westfalen Amtsgericht Münster HRB 5706\nFacility Care AG – Münster",
      "type": "Einreichung neuer Dokumente",
      "state": "Nordrhein-Westfalen",
      "amtsgericht": "Amtsgericht Münster",
      "registernummer": "HRB 5706",
      "registerart": "HRB",
      "company_name": "Facility Care AG",
      "company_seat": "Münster",
      "details": "08.07.2025 (Bekanntmachungsdatum)\n\nNordrhein-Westfalen Amtsgericht Münster HRB 5706\nEinreichung neuer Dokumente\n\nFacility Care AG\nAktiengesellschaft\nMünster\n\nDem Registergericht ist eine neue Liste der Mitglieder des Aufsichtsrates eingereicht worden."
    },
    {
      "date": "2025-07-08",
      "id": "115046",
      "original_text": "Registerbekanntmachung nach dem Umwandlungsgesetz\nNordrhein-Westfalen Amtsgericht Duisburg HRB 36941\nduisport logistics & port services GmbH – Duisburg",
      "type": "Registerbekanntmachung nach dem Umwandlungsgesetz",
      "state": "Nordrhein-Westfalen",
      "amtsgericht": "Amtsgericht Duisburg",
      "registernummer": "HRB 36941",
      "registerart": "HRB",
      "company_name": "duisport logistics & port services GmbH",
      "company_seat": "Duisburg",
      "details": "08.07.2025 (Bekanntmachungsdatum)\n\nNordrhein-Westfalen Amtsgericht Duisburg HRB 36941\nRegisterbekanntmachung nach dem Umwandlungsgesetz 08.07.2025 (Eintragungsdatum)\n\nduisport logistics & port services GmbH\nGesellschaft mit beschränkter Haftung\nDuisburg\n\nDie Gesellschaft hat Gläubigern, deren Forderungen vor dieser Bekanntmachung begründet worden sind, Sicherheit zu leisten, soweit sie nicht Befriedigung verlangen können, wenn sie sich binnen sechs Monaten zu diesem Zweck melden."
    },
    {
      "date": "2025-07-08",
      "id": "115047",
      "original_text": "Registerbekanntmachung nach dem Umwandlungsgesetz\nNordrhein-Westfalen Amtsgericht Düsseldorf HRB 107797\nKüpper Shared Service Center GmbH – Düsseldorf",
      "type": "Registerbekanntmachung nach dem Umwandlungsgesetz",
      "state": "Nordrhein-Westfalen",
      "amtsgericht": "Amtsgericht Düsseldorf",
      "registernummer": "HRB 107797",
      "registerart": "HRB",
      "company_name": "Küpper Shared Service Center GmbH",
      "company_seat": "Düsseldorf",
      "details": "08.07.2025 (Bekanntmachungsdatum)\n\nNordrhein-Westfalen Amtsgericht Düsseldorf HRB 107797\nRegisterbekanntmachung nach dem Umwandlungsgesetz 08.07.2025 (Eintragungsdatum)\n\nKüpper Shared Service Center GmbH\nGesellschaft mit beschränkter Haftung\nDüsseldorf\n\nDen Gläubigern der an der Verschmelzung beteiligten Rechtsträger ist, wenn sie binnen sechs Monaten nach dem Tag, an dem die Eintragung der Verschmelzung in das Register des Sitzes desjenigen Rechtsträgers, dessen Gläubiger sie sind, nach § 19 Absatz 3 UmwG als bekanntgemacht gilt, ihren Anspruch nach Grund und Höhe schriftlich anmelden, Sicherheit zu leisten, soweit sie nicht Befriedigung verlangen können. Dieses Recht steht den Gläubigern jedoch nur zu, wenn sie glaubhaft machen, dass durch die Verschmelzung die Erfüllung ihrer Forderung gefährdet wird."
    },
    {
      "date": "2025-07-08",
      "id": "115048",
      "original_text": "Sonstige Registerbekanntmachung\nNordrhein-Westfalen Amtsgericht Lemgo HRB 9974\nLippische Landesbrandversicherung Aktiengesellschaft – Detmold",
      "type": "Sonstige Registerbekanntmachung",
      "state": "Nordrhein-Westfalen",
      "amtsgericht": "Amtsgericht Lemgo",
      "registernummer": "HRB 9974",
      "registerart": "HRB",
      "company_name": "Lippische Landesbrandversicherung Aktiengesellschaft",
      "company_seat": "Detmold",
      "details": "08.07.2025 (Bekanntmachungsdatum)\n\nNordrhein-Westfalen Amtsgericht Lemgo HRB 9974\nSonstige Registerbekanntmachung\n\nLippische Landesbrandversicherung Aktiengesellschaft\nAktiengesellschaft\nDetmold\n\nDem Registergericht ist eine neue Liste der Mitglieder des Aufsichtsrates eingereicht worden."
    },
    {
      "date": "2025-07-08",
      "id": "115049",
      "original_text": "Registerbekanntmachung nach dem Umwandlungsgesetz\nNordrhein-Westfalen Amtsgericht Duisburg HRB 9131\nMASSLOG GmbH – Duisburg",
      "type": "Registerbekanntmachung nach dem Umwandlungsgesetz",
      "state": "Nordrhein-Westfalen",
      "amtsgericht": "Amtsgericht Duisburg",
      "registernummer": "HRB 9131",
      "registerart": "HRB",
      "company_name": "MASSLOG GmbH",
      "company_seat": "Duisburg",
      "details": "08.07.2025 (Bekanntmachungsdatum)\n\nNordrhein-Westfalen Amtsgericht Duisburg HRB 9131\nRegisterbekanntmachung nach dem Umwandlungsgesetz 08.07.2025 (Eintragungsdatum)\n\nMASSLOG GmbH\nGesellschaft mit beschränkter Haftung\nDuisburg\n\nDie Gesellschaft hat Gläubigern, deren Forderungen vor dieser Bekanntmachung begründet worden sind, Sicherheit zu leisten, soweit sie nicht Befriedigung verlangen können, wenn sie sich binnen sechs Monaten zu diesem Zweck melden."
    },
    {
      "date": "2025-07-08",
      "id": "115050",
      "original_text": "Einreichung neuer Dokumente\nNordrhein-Westfalen Amtsgericht Essen HRB 11122\nBITMARCK Holding GmbH – Essen",
      "type": "Einreichung neuer Dokumente",
      "state": "Nordrhein-Westfalen",
      "amtsgericht": "Amtsgericht Essen",
      "registernummer": "HRB 11122",
      "registerart": "HRB",
      "company_name": "BITMARCK Holding GmbH",
      "company_seat": "Essen",
      "details": "08.07.2025 (Bekanntmachungsdatum)\n\nNordrhein-Westfalen Amtsgericht Essen HRB 11122\nEinreichung neuer Dokumente 08.07.2025 (Eintragungsdatum)\n\nBITMARCK Holding GmbH\nGesellschaft mit beschränkter Haftung\nEssen\n\nDem Registergericht ist eine neue Liste der Mitglieder des Aufsichtsrates eingereicht worden."
    },
    {
      "date": "2025-07-08",
      "id": "115051",
      "original_text": "Löschungsankündigung\nNordrhein-Westfalen Amtsgericht Bad Oeynhausen HRB 12725\nTaJa Gaststätten & Vertriebs- UG (haftungsbeschränkt) – Hiddenhausen",
      "type": "Löschungsankündigung",
      "state": "Nordrhein-Westfalen",
      "amtsgericht": "Amtsgericht Bad Oeynhausen",
      "registernummer": "HRB 12725",
      "registerart": "HRB",
      "company_name": "TaJa Gaststätten & Vertriebs- UG (haftungsbeschränkt)",
      "company_seat": "Hiddenhausen",
      "details": "08.07.2025 (Bekanntmachungsdatum)\n\nNordrhein-Westfalen Amtsgericht Bad Oeynhausen HRB 12725\nLöschungsankündigung\n\nTaJa Gaststätten & Vertriebs- UG (haftungsbeschränkt)\nGesellschaft mit beschränkter Haftung\nHiddenhausen\n\nDas Registergericht beabsichtigt die Gesellschaft von Amts wegen nach § 394 FamFG zu löschen. Die Frist zur Erhebung eines Widerspruchs ist auf drei Monate festgesetzt."
    },
    {
      "date": "2025-07-08",
      "id": "115052",
      "original_text": "Registerbekanntmachung nach dem Umwandlungsgesetz\nNordrhein-Westfalen Amtsgericht Krefeld HRA 7518\nKarl Rainer Rüther e.K – Tönisvorst",
      "type": "Registerbekanntmachung nach dem Umwandlungsgesetz",
      "state": "Nordrhein-Westfalen",
      "amtsgericht": "Amtsgericht Krefeld",
      "registernummer": "HRA 7518",
      "registerart": "HRA",
      "company_name": "Karl Rainer Rüther e.K",
      "company_seat": "Tönisvorst",
      "details": "08.07.2025 (Bekanntmachungsdatum)\n\nNordrhein-Westfalen Amtsgericht Krefeld HRA 7518\nRegisterbekanntmachung nach dem Umwandlungsgesetz 08.07.2025 (Eintragungsdatum)\n\nKarl Rainer Rüther e.K\nEinzelkaufmann / Einzelkauffrau\nTönisvorst\n\nDen Gläubigern der an der Ausgliederung beteiligten Rechtsträger ist, wenn sie binnen sechs Monaten nach dem Tag, an dem die Eintragung der Ausgliederung in das Register des Sitzes desjenigen Rechtsträgers, dessen Gläubiger sie sind, nach § 19 Absatz 3 UmwG als bekanntgemacht gilt, ihren Anspruch nach Grund und Höhe schriftlich anmelden, Sicherheit zu leisten, soweit sie nicht Befriedigung verlangen können. Dieses Recht steht den Gläubigern jedoch nur zu, wenn sie glaubhaft machen, dass durch die Ausgliederung die Erfüllung ihrer Forderung gefährdet wird."
    },
    {
      "date": "2025-07-08",
      "id": "115053",
      "original_text": "Registerbekanntmachung nach dem Umwandlungsgesetz\nNordrhein-Westfalen Amtsgericht Köln HRB 107505\nAvenga International Holding GmbH – Köln",
      "type": "Registerbekanntmachung nach dem Umwandlungsgesetz",
      "state": "Nordrhein-Westfalen",
      "amtsgericht": "Amtsgericht Köln",
      "registernummer": "HRB 107505",
      "registerart": "HRB",
      "company_name": "Avenga International Holding GmbH",
      "company_seat": "Köln",
      "details": "08.07.2025 (Bekanntmachungsdatum)\n\nNordrhein-Westfalen Amtsgericht Köln HRB 107505\nRegisterbekanntmachung nach dem Umwandlungsgesetz 08.07.2025 (Eintragungsdatum)\n\nAvenga International Holding GmbH\nGesellschaft mit beschränkter Haftung\nKöln\n\nDen Gläubigern der an der Verschmelzung beteiligten Rechtsträger ist, wenn sie binnen sechs Monaten nach dem Tag, an dem die Eintragung der Verschmelzung in das Register des Sitzes desjenigen Rechtsträgers, dessen Gläubiger sie sind, nach § 19 Absatz 3 UmwG als bekanntgemacht gilt, ihren Anspruch nach Grund und Höhe schriftlich anmelden, Sicherheit zu leisten, soweit sie nicht Befriedigung verlangen können. Dieses Recht steht den Gläubigern jedoch nur zu, wenn sie glaubhaft machen, dass durch die Verschmelzung die Erfüllung ihrer Forderung gefährdet wird."
    },
    {
      "date": "2025-07-08",
      "id": "115054",
      "original_text": "Einreichung neuer Dokumente\nNordrhein-Westfalen Amtsgericht Köln HRB 61776\nDRH Deutsche Reihenhaus AG – Köln",
      "type": "Einreichung neuer Dokumente",
      "state": "Nordrhein-Westfalen",
      "amtsgericht": "Amtsgericht Köln",
      "registernummer": "HRB 61776",
      "registerart": "HRB",
      "company_name": "DRH Deutsche Reihenhaus AG",
      "company_seat": "Köln",
      "details": "08.07.2025 (Bekanntmachungsdatum)\n\nNordrhein-Westfalen Amtsgericht Köln HRB 61776\nEinreichung neuer Dokumente 13.06.2025 (Eintragungsdatum)\n\nDRH Deutsche Reihenhaus AG\nAktiengesellschaft\nKöln\n\nDem Registergericht ist eine Liste der Mitglieder des Aufsichtsrates eingereicht worden."
    },
    {
      "date": "2025-07-08",
      "id": "115055",
      "original_text": "Registerbekanntmachung nach dem Umwandlungsgesetz\nNordrhein-Westfalen Amtsgericht Köln HRB 123890\nKappe Gärtner von Eden GmbH – Bergisch Gladbach",
      "type": "Registerbekanntmachung nach dem Umwandlungsgesetz",
      "state": "Nordrhein-Westfalen",
      "amtsgericht": "Amtsgericht Köln",
      "registernummer": "HRB 123890",
      "registerart": "HRB",
      "company_name": "Kappe Gärtner von Eden GmbH",
      "company_seat": "Bergisch Gladbach",
      "details": "08.07.2025 (Bekanntmachungsdatum)\n\nNordrhein-Westfalen Amtsgericht Köln HRB 123890\nRegisterbekanntmachung nach dem Umwandlungsgesetz 08.07.2025 (Eintragungsdatum)\n\nKappe Gärtner von Eden GmbH\nGesellschaft mit beschränkter Haftung\nBergisch Gladbach\n\nDen Gläubigern der an der Ausgliederung beteiligten Rechtsträger ist, wenn sie binnen sechs Monaten nach dem Tag, an dem die Eintragung der Ausgliederung in das Register des Sitzes desjenigen Rechtsträgers, dessen Gläubiger sie sind, nach § 19 Absatz 3 UmwG als bekanntgemacht gilt, ihren Anspruch nach Grund und Höhe schriftlich anmelden, Sicherheit zu leisten, soweit sie nicht Befriedigung verlangen können. Dieses Recht steht den Gläubigern jedoch nur zu, wenn sie glaubhaft machen, dass durch die Ausgliederung die Erfüllung ihrer Forderung gefährdet wird."
    },
    {
      "date": "2025-07-08",
      "id": "115056",
      "original_text": "Einreichung neuer Dokumente\nNordrhein-Westfalen Amtsgericht Duisburg HRB 17177\nOryx Stainless AG – Mülheim an der Ruhr",
      "type": "Einreichung neuer Dokumente",
      "state": "Nordrhein-Westfalen",
      "amtsgericht": "Amtsgericht Duisburg",
      "registernummer": "HRB 17177",
      "registerart": "HRB",
      "company_name": "Oryx Stainless AG",
      "company_seat": "Mülheim an der Ruhr",
      "details": "08.07.2025 (Bekanntmachungsdatum)\n\nNordrhein-Westfalen Amtsgericht Duisburg HRB 17177\nEinreichung neuer Dokumente\n\nOryx Stainless AG\nAktiengesellschaft\nMülheim an der Ruhr\n\nDem Registergericht ist eine neue Liste der Mitglieder des Aufsichtsrates eingereicht worden."
    },
    {
      "date": "2025-07-08",
      "id": "115057",
      "original_text": "Löschungsankündigung\nNordrhein-Westfalen Amtsgericht Münster HRB 18037\nNETPHONE GmbH – Münster",
      "type": "Löschungsankündigung",
      "state": "Nordrhein-Westfalen",
      "amtsgericht": "Amtsgericht Münster",
      "registernummer": "HRB 18037",
      "registerart": "HRB",
      "company_name": "NETPHONE GmbH",
      "company_seat": "Münster",
      "details": "08.07.2025 (Bekanntmachungsdatum)\n\nNordrhein-Westfalen Amtsgericht Münster HRB 18037\nLöschungsankündigung\n\nNETPHONE GmbH\nGesellschaft mit beschränkter Haftung\nMünster\n\nDas Registergericht beabsichtigt die Gesellschaft von Amts wegen nach § 394 FamFG zu löschen. Die Frist zur Erhebung eines Widerspruchs ist auf drei Wochen festgesetzt.\n\nRechtbehelfsbelehrung:\n\nGegen diese Verfügung können Sie Widerspruch einlegen.\n\nDer Widerspruch ist bei dem Amtsgericht Münster, Gerichtsstraße 2 bis 6, 48149 Münster schriftlich in deutscher Sprache oder zur Niederschrift der Geschäftsstelle eines jeden Amtsgerichtes abgegeben werden.\nDie Einlegung ist auch durch Übertragung eines elektronischen Dokuments an die elektronische Poststelle des Gerichts möglich. Das elektronische Dokument muss für die Bearbeitung durch das Gericht geeignet und mit einer qualifizierten elektronischen Signatur der verantwortenden Person versehen sein oder von der verantwortenden Person signiert und auf einem sicheren Übermittlungsweg gem. § 130a ZPO nach nähere Maßgabe der Verordnung über die technischen Rahmenbedingungen des elektronischen Rechtsverkehrs und über das besondere elektronische Behördenpostfach (BGBI. I. S.3808) eingereicht werden. Weitere Informationen erhalten Sie auf der Internetseite www.justiz.de.\n\nDer Widerspruch muss spätestens innerhalb der gesetzten Frist nach der schriftlichen Bekanntgabe der Verfügung bei dem Amtsgericht Münster eingegangen sein. Dies gilt auch dann, wenn der Widerspruch zur Niederschrift der Geschäftsstelle eines anderen Amtsgerichtes abgegeben wurde. Die Frist beginnt mit der schriftlichen Bekanntgabe der Verfügung, spätestens mit Ablauf von fünf Monaten nach Erlass der Verfügung. Die Bekanntgabe ist entweder durch Zustellung oder am dritten Tage nach Aufgabe zur Post bewirkt. Fällt das Ende der First auf einen Sonntag, einen allgemeinen Feiertag oder Sonnabend, so endet die Frist mit Ablauf des nächsten Werktages.\n\nDer Widerspruch muss die Bezeichnung der angefochtenen Verfügung sowie die Erklärung enthalten, dass Widerspruch gegen diese Verfügung eingelegt wird. Er ist zu unterzeichnen  und soll begründet werden."
    },
    {
      "date": "2025-07-08",
      "id": "115058",
      "original_text": "Registerbekanntmachung nach dem Umwandlungsgesetz\nNordrhein-Westfalen Amtsgericht Mönchengladbach HRB 19529\nMFT Tellers GmbH – Mönchengladbach",
      "type": "Registerbekanntmachung nach dem Umwandlungsgesetz",
      "state": "Nordrhein-Westfalen",
      "amtsgericht": "Amtsgericht Mönchengladbach",
      "registernummer": "HRB 19529",
      "registerart": "HRB",
      "company_name": "MFT Tellers GmbH",
      "company_seat": "Mönchengladbach",
      "details": "08.07.2025 (Bekanntmachungsdatum)\n\nNordrhein-Westfalen Amtsgericht Mönchengladbach HRB 19529\nRegisterbekanntmachung nach dem Umwandlungsgesetz 08.07.2025 (Eintragungsdatum)\n\nMFT Tellers GmbH\nGesellschaft mit beschränkter Haftung\nMönchengladbach\n\nDen Gläubigern der an der Verschmelzung beteiligten Rechtsträger ist, wenn sie binnen sechs Monaten nach dem Tag, an dem die Eintragung der Verschmelzung in das Register des Sitzes desjenigen Rechtsträgers, dessen Gläubiger sie sind, nach § 19 Absatz 3 UmwG als bekanntgemacht gilt, ihren Anspruch nach Grund und Höhe schriftlich anmelden, Sicherheit zu leisten, soweit sie nicht Befriedigung verlangen können. Dieses Recht steht den Gläubigern jedoch nur zu, wenn sie glaubhaft machen, dass durch die Verschmelzung die Erfüllung ihrer Forderung gefährdet wird."
    },
    {
      "date": "2025-07-08",
      "id": "115059",
      "original_text": "Registerbekanntmachung nach dem Umwandlungsgesetz\nNordrhein-Westfalen Amtsgericht Köln HRB 121006\nFischfeinkost Albert GmbH – Erftstadt",
      "type": "Registerbekanntmachung nach dem Umwandlungsgesetz",
      "state": "Nordrhein-Westfalen",
      "amtsgericht": "Amtsgericht Köln",
      "registernummer": "HRB 121006",
      "registerart": "HRB",
      "company_name": "Fischfeinkost Albert GmbH",
      "company_seat": "Erftstadt",
      "details": "08.07.2025 (Bekanntmachungsdatum)\n\nNordrhein-Westfalen Amtsgericht Köln HRB 121006\nRegisterbekanntmachung nach dem Umwandlungsgesetz 08.07.2025 (Eintragungsdatum)\n\nFischfeinkost Albert GmbH\nGesellschaft mit beschränkter Haftung\nErftstadt\n\nDen Gläubigern der an der Ausgliederung beteiligten Rechtsträger ist, wenn sie binnen sechs Monaten nach dem Tag, an dem die Eintragung der Ausgliederung in das Register des Sitzes desjenigen Rechtsträgers, dessen Gläubiger sie sind, nach § 19 Absatz 3 UmwG als bekanntgemacht gilt, ihren Anspruch nach Grund und Höhe schriftlich anmelden, Sicherheit zu leisten, soweit sie nicht Befriedigung verlangen können. Dieses Recht steht den Gläubigern jedoch nur zu, wenn sie glaubhaft machen, dass durch die Ausgliederung die Erfüllung ihrer Forderung gefährdet wird."
    },
    {
      "date": "2025-07-08",
      "id": "115060",
      "original_text": "Registerbekanntmachung nach dem Umwandlungsgesetz\nNordrhein-Westfalen Amtsgericht Köln HRB 79242\nHÄVG Rechenzentrum GmbH – Köln",
      "type": "Registerbekanntmachung nach dem Umwandlungsgesetz",
      "state": "Nordrhein-Westfalen",
      "amtsgericht": "Amtsgericht Köln",
      "registernummer": "HRB 79242",
      "registerart": "HRB",
      "company_name": "HÄVG Rechenzentrum GmbH",
      "company_seat": "Köln",
      "details": "08.07.2025 (Bekanntmachungsdatum)\n\nNordrhein-Westfalen Amtsgericht Köln HRB 79242\nRegisterbekanntmachung nach dem Umwandlungsgesetz 08.07.2025 (Eintragungsdatum)\n\nHÄVG Rechenzentrum GmbH\nGesellschaft mit beschränkter Haftung\nKöln\n\nDen Gläubigern der an der Verschmelzung beteiligten Rechtsträger ist, wenn sie binnen sechs Monaten nach dem Tag, an dem die Eintragung der Verschmelzung in das Register des Sitzes desjenigen Rechtsträgers, dessen Gläubiger sie sind, nach § 19 Absatz 3 UmwG als bekanntgemacht gilt, ihren Anspruch nach Grund und Höhe schriftlich anmelden, Sicherheit zu leisten, soweit sie nicht Befriedigung verlangen können. Dieses Recht steht den Gläubigern jedoch nur zu, wenn sie glaubhaft machen, dass durch die Verschmelzung die Erfüllung ihrer Forderung gefährdet wird."
    },
    {
      "date": "2025-07-08",
      "id": "115061",
      "original_text": "Registerbekanntmachung nach dem Umwandlungsgesetz\nNordrhein-Westfalen Amtsgericht Köln HRA 18975\nFisch-Feinkost Albert e.K. – Erftstadt",
      "type": "Registerbekanntmachung nach dem Umwandlungsgesetz",
      "state": "Nordrhein-Westfalen",
      "amtsgericht": "Amtsgericht Köln",
      "registernummer": "HRA 18975",
      "registerart": "HRA",
      "company_name": "Fisch-Feinkost Albert e.K.",
      "company_seat": "Erftstadt",
      "details": "08.07.2025 (Bekanntmachungsdatum)\n\nNordrhein-Westfalen Amtsgericht Köln HRA 18975\nRegisterbekanntmachung nach dem Umwandlungsgesetz 08.07.2025 (Eintragungsdatum)\n\nFisch-Feinkost Albert e.K.\nEinzelkaufmann / Einzelkauffrau\nErftstadt\n\nDen Gläubigern der an der Ausgliederung beteiligten Rechtsträger ist, wenn sie binnen sechs Monaten nach dem Tag, an dem die Eintragung der Ausgliederung in das Register des Sitzes derjenigen Rechtsträger deren Gläubiger sie sind, nach § 19 Absatz 3 UmwG als bekanntgemacht gilt, ihren Anspruch nach Grund und Höhe schriftlich anmelden, Sicherheit zu leisten, soweit sie nicht Befriedigung verlangen können. Dieses Recht steht den Gläubigern jedoch nur zu, wenn sie glaubhaft machen, dass durch die Ausgliederung die Erfüllung ihrer Forderung gefährdet wird."
    },
    {
      "date": "2025-07-08",
      "id": "115062",
      "original_text": "Einreichung neuer Dokumente\nNordrhein-Westfalen Amtsgericht Düsseldorf HRB 66846\nARAG SE – Düsseldorf",
      "type": "Einreichung neuer Dokumente",
      "state": "Nordrhein-Westfalen",
      "amtsgericht": "Amtsgericht Düsseldorf",
      "registernummer": "HRB 66846",
      "registerart": "HRB",
      "company_name": "ARAG SE",
      "company_seat": "Düsseldorf",
      "details": "08.07.2025 (Bekanntmachungsdatum)\n\nNordrhein-Westfalen Amtsgericht Düsseldorf HRB 66846\nEinreichung neuer Dokumente 08.07.2025 (Eintragungsdatum)\n\nARAG SE\nEuropäische Aktiengesellschaft (SE)\nDüsseldorf\n\nDem Registergericht ist eine Liste der Mitglieder des Aufsichtsrates eingereicht worden."
    },
    {
      "date": "2025-07-08",
      "id": "115063",
      "original_text": "Einreichung neuer Dokumente\nNordrhein-Westfalen Amtsgericht Dortmund HRB 2783\nContinentale Sachversicherung Aktiengesellschaft – Dortmund",
      "type": "Einreichung neuer Dokumente",
      "state": "Nordrhein-Westfalen",
      "amtsgericht": "Amtsgericht Dortmund",
      "registernummer": "HRB 2783",
      "registerart": "HRB",
      "company_name": "Continentale Sachversicherung Aktiengesellschaft",
      "company_seat": "Dortmund",
      "details": "08.07.2025 (Bekanntmachungsdatum)\n\nNordrhein-Westfalen Amtsgericht Dortmund HRB 2783\nEinreichung neuer Dokumente\n\nContinentale Sachversicherung Aktiengesellschaft\nAktiengesellschaft\nDortmund\n\nDem Registergericht ist eine neue Liste der Mitglieder des Aufsichtsrates eingereicht worden."
    },
    {
      "date": "2025-07-08",
      "id": "115064",
      "original_text": "Einreichung neuer Dokumente\nNordrhein-Westfalen Amtsgericht Dortmund HRB 19076\nSIGNAL IDUNA Holding Aktiengesellschaft – Dortmund",
      "type": "Einreichung neuer Dokumente",
      "state": "Nordrhein-Westfalen",
      "amtsgericht": "Amtsgericht Dortmund",
      "registernummer": "HRB 19076",
      "registerart": "HRB",
      "company_name": "SIGNAL IDUNA Holding Aktiengesellschaft",
      "company_seat": "Dortmund",
      "details": "08.07.2025 (Bekanntmachungsdatum)\n\nNordrhein-Westfalen Amtsgericht Dortmund HRB 19076\nEinreichung neuer Dokumente\n\nSIGNAL IDUNA Holding Aktiengesellschaft\nAktiengesellschaft\nDortmund\n\nDem Registergericht ist eine neue Liste der Mitglieder des Aufsichtsrates eingereicht worden."
    },
    {
      "date": "2025-07-08",
      "id": "115065",
      "original_text": "Löschungsankündigung\nThüringen Amtsgericht Rudolstadt VR 270411\nFörderkreis Morassina e.V. – Schmiedefeld",
      "type": "Löschungsankündigung",
      "state": "Thüringen",
      "amtsgericht": "Amtsgericht Rudolstadt",
      "registernummer": "VR 270411",
      "registerart": "VR",
      "company_name": "Förderkreis Morassina e.V.",
      "company_seat": "Schmiedefeld",
      "details": "08.07.2025 (Bekanntmachungsdatum)\n\nThüringen Amtsgericht Rudolstadt VR 270411\nLöschungsankündigung\n\nFörderkreis Morassina e.V.\neingetragener Verein\nSchmiedefeld\n\nDas Gericht beabsichtigt, den im Vereinsregister eingetragenen Verein Förderkreis Morassina e.V. gemäß § 395 FamFG wegen unzulässiger Eintragung von Amts wegen zu löschen. Der Verein ist infolge Wegfalls sämtlicher Mitglieder erloschen. Die Frist zur Geltendmachung eines Widerspruch gegen die beabsichtigte Löschung wird auf einen Monat ab dieser Veröffentlichung festgesetzt."
    },
    {
      "date": "2025-07-08",
      "id": "115066",
      "original_text": "Einreichung neuer Dokumente\nThüringen Amtsgericht Jena HRB 209440\nSOMAG AG Jena – Jena",
      "type": "Einreichung neuer Dokumente",
      "state": "Thüringen",
      "amtsgericht": "Amtsgericht Jena",
      "registernummer": "HRB 209440",
      "registerart": "HRB",
      "company_name": "SOMAG AG Jena",
      "company_seat": "Jena",
      "details": "08.07.2025 (Bekanntmachungsdatum)\n\nThüringen Amtsgericht Jena HRB 209440\nEinreichung neuer Dokumente 01.07.2025 (Eintragungsdatum)\n\nSOMAG AG Jena\nAktiengesellschaft\nJena\n\nBekanntmachung gem. § 106 AktG: Aufgrund einer Veränderung in den Personen der Aufsichtsratsmitglieder ist durch den Vorstand eine neue Liste zum Handelsregister eingereicht worden."
    },
    {
      "date": "2025-07-08",
      "id": "115067",
      "original_text": "Einreichung neuer Dokumente\nHessen Amtsgericht Frankfurt am Main HRB 95470\nDeufol SE – Hofheim am Taunus",
      "type": "Einreichung neuer Dokumente",
      "state": "Hessen",
      "amtsgericht": "Amtsgericht Frankfurt am Main",
      "registernummer": "HRB 95470",
      "registerart": "HRB",
      "company_name": "Deufol SE",
      "company_seat": "Hofheim am Taunus",
      "details": "08.07.2025 (Bekanntmachungsdatum)\n\nHessen Amtsgericht Frankfurt am Main HRB 95470\nEinreichung neuer Dokumente\n\nDeufol SE\nEuropäische Aktiengesellschaft (SE)\nHofheim am Taunus\n\nDurch eine Änderung in den Personen der Aufsichtsratsmitglieder ist eine Liste der Mitglieder des Aufsichtsrates zum Handelsregister eingereicht worden."
    },
    {
      "date": "2025-07-08",
      "id": "115068",
      "original_text": "Registerbekanntmachung nach dem Umwandlungsgesetz\nHessen Amtsgericht Darmstadt HRB 107753\nCONSULTING Wolfstetter GmbH – Lützelbach",
      "type": "Registerbekanntmachung nach dem Umwandlungsgesetz",
      "state": "Hessen",
      "amtsgericht": "Amtsgericht Darmstadt",
      "registernummer": "HRB 107753",
      "registerart": "HRB",
      "company_name": "CONSULTING Wolfstetter GmbH",
      "company_seat": "Lützelbach",
      "details": "08.07.2025 (Bekanntmachungsdatum)\n\nHessen Amtsgericht Darmstadt HRB 107753\nRegisterbekanntmachung nach dem Umwandlungsgesetz 08.07.2025 (Eintragungsdatum)\n\nCONSULTING Wolfstetter GmbH\nGesellschaft mit beschränkter Haftung\nLützelbach\n\nDen Gläubigern der an der Ausgliederung beteiligten Rechtsträger ist, wenn sie binnen sechs Monaten nach dem Tag, an dem die Eintragung der Ausgliederung in das Register des Sitzes derjenigen Rechtsträger deren Gläubiger sie sind, nach §§ 125, 19 Absatz 3 UmwG bekannt gemacht worden ist, ihren Anspruch nach Grund und Höhe schriftlich anmelden, Sicherheit zu leisten, soweit sie nicht Befriedigung verlangen können. Dieses Recht steht den Gläubigern jedoch nur zu, wenn sie glaubhaft machen, dass durch die Ausgliederung die Erfüllung ihrer Forderung gefährdet wird."
    },
    {
      "date": "2025-07-08",
      "id": "115069",
      "original_text": "Einreichung neuer Dokumente\nHessen Amtsgericht Darmstadt HRB 5151\nENTEGA AG – Darmstadt",
      "type": "Einreichung neuer Dokumente",
      "state": "Hessen",
      "amtsgericht": "Amtsgericht Darmstadt",
      "registernummer": "HRB 5151",
      "registerart": "HRB",
      "company_name": "ENTEGA AG",
      "company_seat": "Darmstadt",
      "details": "08.07.2025 (Bekanntmachungsdatum)\n\nHessen Amtsgericht Darmstadt HRB 5151\nEinreichung neuer Dokumente 08.07.2025 (Eintragungsdatum)\n\nENTEGA AG\nAktiengesellschaft\nDarmstadt\n\nDie Gesellschaft hat den Entwurf des Verschmelzungsvertrages zwischen ihr und der HSE Beteiligungs-GmbH, Darmstadt (Amtsgericht Darmstadt HRB 92333) beim Amtsgericht Darmstadt (Registergericht) zur Einsichtnahme eingereicht."
    },
    {
      "date": "2025-07-08",
      "id": "115070",
      "original_text": "Sonstige Registerbekanntmachung\nHessen Amtsgericht Frankfurt am Main HRB 51069\nShareholder Value Beteiligungen AG – Frankfurt am Main",
      "type": "Sonstige Registerbekanntmachung",
      "state": "Hessen",
      "amtsgericht": "Amtsgericht Frankfurt am Main",
      "registernummer": "HRB 51069",
      "registerart": "HRB",
      "company_name": "Shareholder Value Beteiligungen AG",
      "company_seat": "Frankfurt am Main",
      "details": "08.07.2025 (Bekanntmachungsdatum)\n\nHessen Amtsgericht Frankfurt am Main HRB 51069\nSonstige Registerbekanntmachung 08.07.2025 (Eintragungsdatum)\n\nShareholder Value Beteiligungen AG\nAktiengesellschaft\nFrankfurt am Main\n\nDurch eine Änderung in den Personen der Aufsichtsratsmitglieder ist eine Liste der Mitglieder des Aufsichtsrates zum Handelsregister eingereicht worden."
    },
    {
      "date": "2025-07-08",
      "id": "115071",
      "original_text": "Sonstige Registerbekanntmachung\nHessen Amtsgericht Darmstadt VR 84332\nLebensSixtant e.V. – Brombachtal",
      "type": "Sonstige Registerbekanntmachung",
      "state": "Hessen",
      "amtsgericht": "Amtsgericht Darmstadt",
      "registernummer": "VR 84332",
      "registerart": "VR",
      "company_name": "LebensSixtant e.V.",
      "company_seat": "Brombachtal",
      "details": "08.07.2025 (Bekanntmachungsdatum)\n\nHessen Amtsgericht Darmstadt VR 84332\nSonstige Registerbekanntmachung 08.07.2025 (Eintragungsdatum)\n\nLebensSixtant e.V.\neingetragener Verein\nBrombachtal\n\nDer Verein ist aufgelöst."
    },
    {
      "date": "2025-07-08",
      "id": "115072",
      "original_text": "Registerbekanntmachung nach dem Umwandlungsgesetz\nHessen Amtsgericht Frankfurt am Main HRB 97164\nplenum Aktiengesellschaft – Frankfurt am Main",
      "type": "Registerbekanntmachung nach dem Umwandlungsgesetz",
      "state": "Hessen",
      "amtsgericht": "Amtsgericht Frankfurt am Main",
      "registernummer": "HRB 97164",
      "registerart": "HRB",
      "company_name": "plenum Aktiengesellschaft",
      "company_seat": "Frankfurt am Main",
      "details": "08.07.2025 (Bekanntmachungsdatum)\n\nHessen Amtsgericht Frankfurt am Main HRB 97164\nRegisterbekanntmachung nach dem Umwandlungsgesetz\n\nplenum Aktiengesellschaft\nAktiengesellschaft\nFrankfurt am Main\n\nDie Gesellschaft hat den Entwurf des Verschmelzungsvertrages zwischen ihr und der RFC Professionals GmbH, Oestrich-Winkel (Amtsgericht Wiesbaden HRB 26592) beim Amtsgericht Frankfurt am Main (Registergericht) zur Einsichtnahme eingereicht."
    },
    {
      "date": "2025-07-08",
      "id": "115073",
      "original_text": "Registerbekanntmachung nach dem Umwandlungsgesetz\nHessen Amtsgericht Frankfurt am Main HRB 31901\nBureau van Dijk Electronic Publishing GmbH – Frankfurt am Main",
      "type": "Registerbekanntmachung nach dem Umwandlungsgesetz",
      "state": "Hessen",
      "amtsgericht": "Amtsgericht Frankfurt am Main",
      "registernummer": "HRB 31901",
      "registerart": "HRB",
      "company_name": "Bureau van Dijk Electronic Publishing GmbH",
      "company_seat": "Frankfurt am Main",
      "details": "08.07.2025 (Bekanntmachungsdatum)\n\nHessen Amtsgericht Frankfurt am Main HRB 31901\nRegisterbekanntmachung nach dem Umwandlungsgesetz 08.07.2025 (Eintragungsdatum)\n\nBureau van Dijk Electronic Publishing GmbH\nGesellschaft mit beschränkter Haftung\nFrankfurt am Main\n\nDen Gläubigern der an der Verschmelzung beteiligten Rechtsträger ist, wenn sie binnen sechs Monaten nach dem Tag, an dem die Eintragung der Verschmelzung in das Register des Sitzes desjenigen Rechtsträgers, dessen Gläubiger sie sind, nach § 19 Absatz 3 UmwG bekannt gemacht worden ist, ihren Anspruch nach Grund und Höhe schriftlich anmelden, Sicherheit zu leisten, soweit sie nicht Befriedigung verlangen können. Dieses Recht steht den Gläubigern jedoch nur zu, wenn sie glaubhaft machen, dass durch die Verschmelzung die Erfüllung ihrer Forderung gefährdet wird."
    },
    {
      "date": "2025-07-08",
      "id": "115074",
      "original_text": "Löschungsankündigung\nHessen Amtsgericht Frankfurt am Main HRB 123172\nMaliSEN Handel UG (haftungsbeschränkt) – Frankfurt am Main",
      "type": "Löschungsankündigung",
      "state": "Hessen",
      "amtsgericht": "Amtsgericht Frankfurt am Main",
      "registernummer": "HRB 123172",
      "registerart": "HRB",
      "company_name": "MaliSEN Handel UG (haftungsbeschränkt)",
      "company_seat": "Frankfurt am Main",
      "details": "08.07.2025 (Bekanntmachungsdatum)\n\nHessen Amtsgericht Frankfurt am Main HRB 123172\nLöschungsankündigung\n\nMaliSEN Handel UG (haftungsbeschränkt)\nGesellschaft mit beschränkter Haftung\nFrankfurt am Main\n\nEs ist beabsichtig, die Gesellschaft wegen Vermögenslosigkeit gemäß § 394 FamFG von Amts wegen im Handelsregister zu löschen. Hiergegen kann innerhalb eines Zeitraums von 1 Monat nach dieser Veröffentlichung Widerspruch bei dem Amtsgericht Frankfurt am Main eingelegt werden."
    },
    {
      "date": "2025-07-08",
      "id": "115075",
      "original_text": "Registerbekanntmachung nach dem Umwandlungsgesetz\nHessen Amtsgericht Darmstadt HRA 87775\nHagen Wolfstetter e. K. – Lützelbach",
      "type": "Registerbekanntmachung nach dem Umwandlungsgesetz",
      "state": "Hessen",
      "amtsgericht": "Amtsgericht Darmstadt",
      "registernummer": "HRA 87775",
      "registerart": "HRA",
      "company_name": "Hagen Wolfstetter e. K.",
      "company_seat": "Lützelbach",
      "details": "08.07.2025 (Bekanntmachungsdatum)\n\nHessen Amtsgericht Darmstadt HRA 87775\nRegisterbekanntmachung nach dem Umwandlungsgesetz 08.07.2025 (Eintragungsdatum)\n\nHagen Wolfstetter e. K.\nEinzelkaufmann / Einzelkauffrau\nLützelbach\n\nDen Gläubigern der an der Ausgliederung beteiligten Rechtsträger ist, wenn sie binnen sechs Monaten nach dem Tag, an dem die Eintragung der Ausgliederung in das Register des Sitzes derjenigen Rechtsträger deren Gläubiger sie sind, nach §§ 125, 19 Absatz 3 UmwG bekannt gemacht worden ist, ihren Anspruch nach Grund und Höhe schriftlich anmelden, Sicherheit zu leisten, soweit sie nicht Befriedigung verlangen können. Dieses Recht steht den Gläubigern jedoch nur zu, wenn sie glaubhaft machen, dass durch die Ausgliederung die Erfüllung ihrer Forderung gefährdet wird."
    },
    {
      "date": "2025-07-08",
      "id": "115076",
      "original_text": "Registerbekanntmachung nach dem Umwandlungsgesetz\nHessen Amtsgericht Wiesbaden HRB 24993\nLUXEDIA GmbH – Wiesbaden",
      "type": "Registerbekanntmachung nach dem Umwandlungsgesetz",
      "state": "Hessen",
      "amtsgericht": "Amtsgericht Wiesbaden",
      "registernummer": "HRB 24993",
      "registerart": "HRB",
      "company_name": "LUXEDIA GmbH",
      "company_seat": "Wiesbaden",
      "details": "08.07.2025 (Bekanntmachungsdatum)\n\nHessen Amtsgericht Wiesbaden HRB 24993\nRegisterbekanntmachung nach dem Umwandlungsgesetz 08.07.2025 (Eintragungsdatum)\n\nLUXEDIA GmbH\nGesellschaft mit beschränkter Haftung\nWiesbaden\n\nDen Gläubigern der an der Verschmelzung beteiligten Rechtsträger ist, wenn sie binnen sechs Monaten nach dem Tag, an dem die Eintragung der Verschmelzung in das Register des Sitzes desjenigen Rechtsträgers, dessen Gläubiger sie sind, nach § 19 Absatz 3 UmwG bekannt gemacht worden ist, ihren Anspruch nach Grund und Höhe schriftlich anmelden, Sicherheit zu leisten, soweit sie nicht Befriedigung verlangen können. Dieses Recht steht den Gläubigern jedoch nur zu, wenn sie glaubhaft machen, dass durch die Verschmelzung die Erfüllung ihrer Forderung gefährdet wird."
    },
    {
      "date": "2025-07-08",
      "id": "115077",
      "original_text": "Einreichung neuer Dokumente\nHessen Amtsgericht Frankfurt am Main HRB 115867\nAktivbank Aktiengesellschaft – Frankfurt am Main",
      "type": "Einreichung neuer Dokumente",
      "state": "Hessen",
      "amtsgericht": "Amtsgericht Frankfurt am Main",
      "registernummer": "HRB 115867",
      "registerart": "HRB",
      "company_name": "Aktivbank Aktiengesellschaft",
      "company_seat": "Frankfurt am Main",
      "details": "08.07.2025 (Bekanntmachungsdatum)\n\nHessen Amtsgericht Frankfurt am Main HRB 115867\nEinreichung neuer Dokumente\n\nAktivbank Aktiengesellschaft\nAktiengesellschaft\nFrankfurt am Main\n\nDurch eine Änderung in den Personen der Aufsichtsratsmitglieder ist eine Liste der Mitglieder des Aufsichtsrates zum Handelsregister eingereicht worden."
    }
  ]
}