{
  "date": "2025-07-26",
  "date_of_scrape": "2025-08-26T15:49:16.678Z",
  "tool_version": "0.2.0",
  "number_of_announcements": 31,
  "announcements": [
    {
      "date": "2025-07-26",
      "id": "117680",
      "original_text": "Löschungsankündigung\nBayern Amtsgericht Nürnberg HRB 38673\nEstrich plus Bau GmbH – Nürnberg",
      "type": "Löschungsankündigung",
      "state": "Bayern",
      "amtsgericht": "Amtsgericht Nürnberg",
      "registernummer": "HRB 38673",
      "registerart": "HRB",
      "company_name": "Estrich plus Bau GmbH",
      "company_seat": "Nürnberg",
      "details": "26.07.2025 (Bekanntmachungsdatum)\n\nBayern Amtsgericht Nürnberg HRB 38673\nLöschungsankündigung\n\nEstrich plus Bau GmbH\nGesellschaft mit beschränkter Haftung\nNürnberg\n\nDas Registergericht beabsichtigt, die im Handelsregister eingetragene Gesellschaft wegen Vermögenslosigkeit von Amts wegen nach § 394 FamFG zu löschen. Die Frist zur Erhebung eines Widerspruchs ist auf einen Monat festgesetzt."
    },
    {
      "date": "2025-07-26",
      "id": "117681",
      "original_text": "Registerbekanntmachung nach dem Umwandlungsgesetz\nBayern Amtsgericht München HRB 191140\nCustodia Holding SE – München",
      "type": "Registerbekanntmachung nach dem Umwandlungsgesetz",
      "state": "Bayern",
      "amtsgericht": "Amtsgericht München",
      "registernummer": "HRB 191140",
      "registerart": "HRB",
      "company_name": "Custodia Holding SE",
      "company_seat": "München",
      "details": "26.07.2025 (Bekanntmachungsdatum)\n\nBayern Amtsgericht München HRB 191140\nRegisterbekanntmachung nach dem Umwandlungsgesetz 25.07.2025 (Eintragungsdatum)\n\nCustodia Holding SE\nEuropäische Aktiengesellschaft (SE)\nMünchen\n\nDen Gläubigern der an der Spaltung beteiligten Rechtsträger ist, wenn sie binnen sechs Monaten nach dem Tag, an dem die Eintragung der Spaltung in das Register des Sitzes desjenigen Rechtsträgers, dessen Gläubiger sie sind, nach §§ 125, 19 Abs. 3 UmwG als bekannt gemacht gilt, ihren Anspruch nach Grund und Höhe in Textform anmelden, Sicherheit zu leisten, soweit sie nicht Befriedigung verlangen können. Dieses Recht steht den Gläubigern jedoch nur zu, wenn sie glaubhaft machen, dass durch die Spaltung die Erfüllung ihrer Forderung gefährdet wird."
    },
    {
      "date": "2025-07-26",
      "id": "117682",
      "original_text": "Löschungsankündigung\nBayern Amtsgericht München HRB 243036\nBlitz 18-535 GmbH – München",
      "type": "Löschungsankündigung",
      "state": "Bayern",
      "amtsgericht": "Amtsgericht München",
      "registernummer": "HRB 243036",
      "registerart": "HRB",
      "company_name": "Blitz 18-535 GmbH",
      "company_seat": "München",
      "details": "26.07.2025 (Bekanntmachungsdatum)\n\nBayern Amtsgericht München HRB 243036\nLöschungsankündigung 24.07.2025 (Eintragungsdatum)\n\nBlitz 18-535 GmbH\nGesellschaft mit beschränkter Haftung\nMünchen\n\nDas Registergericht beabsichtigt, die im Handelsregister eingetragene Gesellschaft wegen Vermögenslosigkeit von Amts wegen nach § 394 FamFG zu löschen. Die Frist zur Erhebung eines Widerspruchs ist auf drei Monate festgesetzt."
    },
    {
      "date": "2025-07-26",
      "id": "117683",
      "original_text": "Einreichung neuer Dokumente\nBayern Amtsgericht München HRB 121920\nStadtwerke München GmbH – München",
      "type": "Einreichung neuer Dokumente",
      "state": "Bayern",
      "amtsgericht": "Amtsgericht München",
      "registernummer": "HRB 121920",
      "registerart": "HRB",
      "company_name": "Stadtwerke München GmbH",
      "company_seat": "München",
      "details": "26.07.2025 (Bekanntmachungsdatum)\n\nBayern Amtsgericht München HRB 121920\nEinreichung neuer Dokumente\n\nStadtwerke München GmbH\nGesellschaft mit beschränkter Haftung\nMünchen\n\nDem Amtsgericht München -Registergericht- ist eine Liste der Mitglieder des Aufsichtsrats eingereicht worden, § 52 Abs. 3 S. 2 GmbHG."
    },
    {
      "date": "2025-07-26",
      "id": "117684",
      "original_text": "Registerbekanntmachung nach dem Umwandlungsgesetz\nBayern Amtsgericht München HRB 234658\ngood goods tegernsee GmbH – München",
      "type": "Registerbekanntmachung nach dem Umwandlungsgesetz",
      "state": "Bayern",
      "amtsgericht": "Amtsgericht München",
      "registernummer": "HRB 234658",
      "registerart": "HRB",
      "company_name": "good goods tegernsee GmbH",
      "company_seat": "München",
      "details": "26.07.2025 (Bekanntmachungsdatum)\n\nBayern Amtsgericht München HRB 234658\nRegisterbekanntmachung nach dem Umwandlungsgesetz 25.07.2025 (Eintragungsdatum)\n\ngood goods tegernsee GmbH\nGesellschaft mit beschränkter Haftung\nMünchen\n\nDen Gläubigern der an der Verschmelzung beteiligten Rechtsträger ist, wenn sie binnen sechs Monaten nach dem Tag, an dem die Eintragung der Verschmelzung in das Register des Sitzes desjenigen Rechtsträgers, dessen Gläubiger sie sind, nach § 19 Abs. 3 UmwG als bekannt gemacht gilt, ihren Anspruch nach Grund und Höhe in Textform anmelden, Sicherheit zu leisten, soweit sie nicht Befriedigung verlangen können. Dieses Recht steht den Gläubigern jedoch nur zu, wenn sie glaubhaft machen, dass durch die Verschmelzung die Erfüllung ihrer Forderung gefährdet wird."
    },
    {
      "date": "2025-07-26",
      "id": "117685",
      "original_text": "Registerbekanntmachung nach dem Umwandlungsgesetz\nBayern Amtsgericht München HRB 255706\nAMBIA Grundstücks-Verwaltungsgesellschaft Projekt 2 mbH – Grünwald",
      "type": "Registerbekanntmachung nach dem Umwandlungsgesetz",
      "state": "Bayern",
      "amtsgericht": "Amtsgericht München",
      "registernummer": "HRB 255706",
      "registerart": "HRB",
      "company_name": "AMBIA Grundstücks-Verwaltungsgesellschaft Projekt 2 mbH",
      "company_seat": "Grünwald",
      "details": "26.07.2025 (Bekanntmachungsdatum)\n\nBayern Amtsgericht München HRB 255706\nRegisterbekanntmachung nach dem Umwandlungsgesetz 25.07.2025 (Eintragungsdatum)\n\nAMBIA Grundstücks-Verwaltungsgesellschaft Projekt 2 mbH\nGesellschaft mit beschränkter Haftung\nGrünwald\n\nEs wird darauf hingewiesen, dass ein Formwechselplan oder sein Entwurf über einen grenzüberschreitenden Formwechsel in die Raaks KANSA B.V. mit Sitz in Amsterdam beim Handelsregister eingereicht worden ist.\nAn dem grenzüberschreitenden Formwechsel ist beteiligt als formwechselnde Gesellschaft die AMBIA Grundstücks- Verwaltungsgesellschaft Projekt 2 mbH mit Sitz in Grünwald, Landkreis München, eine Gesellschaft mit beschränkter Haftung nach deutschem Recht, welche in die Raaks KANSA B.V. mit Sitz in Amsterdam, eine Besloten Vennootschap met beperkte aansprakelijkheid (B.V.) nach dem Recht des Staates Niederlande, umgewandelt werden soll.\nDie AMBIA Grundstücks-Verwaltungsgesellschaft Projekt 2 mbH ist eingetragen im Handelsregister des Amtsgerichts München unter HRB 255706. Die Gesellschaft soll nach dem Formwechsel im niederländischen Handelsregister (Kamer van Koophandel) registriert sein.\nDie Anteilsinhaber, die Gläubiger sowie die zuständigen Betriebsräte der an dem grenzüberschreitenden Formwechsel beteiligten Gesellschaft oder, soweit es keinen Betriebsrat gibt, die Arbeitnehmer der an dem grenzüberschreitenden Formwechsel beteiligten Gesellschaft, können der Gesellschaft spätestens fünf Arbeitstage vor dem Tag der Gesellschafterversammlung Bemerkungen zum Formwechselplan übermitteln.\nEin Hinweis an Gesellschafter ist entbehrlich, da die STADT MORGEN Holding GmbH mit Sitz in Grünwald, Landkreis München (AG München HRB 202439) die alleinige Gesellschafterin der AMBIA Grundstücks- Verwaltungsgesellschaft Projekt 2 mbH ist.\nDa die AMBIA Grundstücks-Verwaltungsgesellschaft Projekt 2 mbH keinen Betriebsrat und keine Arbeitnehmer hat, ist der Hinweis an den Betriebsrat und die Arbeitnehmer entbehrlich."
    },
    {
      "date": "2025-07-26",
      "id": "117686",
      "original_text": "Registerbekanntmachung nach dem Umwandlungsgesetz\nBayern Amtsgericht Regensburg HRB 11542\niS Software Application Providing-Service GmbH – Regensburg",
      "type": "Registerbekanntmachung nach dem Umwandlungsgesetz",
      "state": "Bayern",
      "amtsgericht": "Amtsgericht Regensburg",
      "registernummer": "HRB 11542",
      "registerart": "HRB",
      "company_name": "iS Software Application Providing-Service GmbH",
      "company_seat": "Regensburg",
      "details": "26.07.2025 (Bekanntmachungsdatum)\n\nBayern Amtsgericht Regensburg HRB 11542\nRegisterbekanntmachung nach dem Umwandlungsgesetz 25.07.2025 (Eintragungsdatum)\n\niS Software Application Providing-Service GmbH\nGesellschaft mit beschränkter Haftung\nRegensburg\n\nDen Gläubigern der an der Verschmelzung beteiligten Rechtsträger ist, wenn sie binnen sechs Monaten nach dem Tag, an dem die Eintragung der Verschmelzung in das Register des Sitzes desjenigen Rechtsträgers, dessen Gläubiger sie sind, nach § 19 Abs. 3 UmwG als bekannt gemacht gilt, ihren Anspruch nach Grund und Höhe in Textform anmelden, Sicherheit zu leisten, soweit sie nicht Befriedigung verlangen können. Dieses Recht steht den Gläubigern jedoch nur zu, wenn sie glaubhaft machen, dass durch die Verschmelzung die Erfüllung ihrer Forderung gefährdet wird."
    },
    {
      "date": "2025-07-26",
      "id": "117687",
      "original_text": "Registerbekanntmachung nach dem Umwandlungsgesetz\nBayern Amtsgericht Traunstein HRB 34182\nLohmaier Bau GmbH – Obertaufkirchen",
      "type": "Registerbekanntmachung nach dem Umwandlungsgesetz",
      "state": "Bayern",
      "amtsgericht": "Amtsgericht Traunstein",
      "registernummer": "HRB 34182",
      "registerart": "HRB",
      "company_name": "Lohmaier Bau GmbH",
      "company_seat": "Obertaufkirchen",
      "details": "26.07.2025 (Bekanntmachungsdatum)\n\nBayern Amtsgericht Traunstein HRB 34182\nRegisterbekanntmachung nach dem Umwandlungsgesetz 25.07.2025 (Eintragungsdatum)\n\nLohmaier Bau GmbH\nGesellschaft mit beschränkter Haftung\nObertaufkirchen\n\nDen Gläubigern der an der Ausgliederung beteiligten Rechtsträger ist, wenn sie binnen sechs Monaten nach dem Tag, an dem die Eintragung der Ausgliederung in das Register des Sitzes desjenigen Rechtsträgers, dessen Gläubiger sie sind, nach §§ 125, 19 Abs. 3 UmwG als bekannt gemacht gilt, ihren Anspruch nach Grund und Höhe in Textform anmelden, Sicherheit zu leisten, soweit sie nicht Befriedigung verlangen können. Dieses Recht steht den Gläubigern jedoch nur zu, wenn sie glaubhaft machen, dass durch die Ausgliederung die Erfüllung ihrer Forderung gefährdet wird."
    },
    {
      "date": "2025-07-26",
      "id": "117688",
      "original_text": "Registerbekanntmachung nach dem Umwandlungsgesetz\nBayern Amtsgericht München HRB 291904\nNextaim Group GmbH – München",
      "type": "Registerbekanntmachung nach dem Umwandlungsgesetz",
      "state": "Bayern",
      "amtsgericht": "Amtsgericht München",
      "registernummer": "HRB 291904",
      "registerart": "HRB",
      "company_name": "Nextaim Group GmbH",
      "company_seat": "München",
      "details": "26.07.2025 (Bekanntmachungsdatum)\n\nBayern Amtsgericht München HRB 291904\nRegisterbekanntmachung nach dem Umwandlungsgesetz 25.07.2025 (Eintragungsdatum)\n\nNextaim Group GmbH\nGesellschaft mit beschränkter Haftung\nMünchen\n\nDen Gläubigern der an der Verschmelzung beteiligten Rechtsträger ist, wenn sie binnen sechs Monaten nach dem Tag, an dem die Eintragung der Verschmelzung in das Register des Sitzes desjenigen Rechtsträgers, dessen Gläubiger sie sind, nach § 19 Abs. 3 UmwG als bekannt gemacht gilt, ihren Anspruch nach Grund und Höhe in Textform anmelden, Sicherheit zu leisten, soweit sie nicht Befriedigung verlangen können. Dieses Recht steht den Gläubigern jedoch nur zu, wenn sie glaubhaft machen, dass durch die Verschmelzung die Erfüllung ihrer Forderung gefährdet wird."
    },
    {
      "date": "2025-07-26",
      "id": "117689",
      "original_text": "Registerbekanntmachung nach dem Umwandlungsgesetz\nBayern Amtsgericht München HRB 173089\nDSI Schönbrunn gemeinnützige GmbH – Röhrmoos, Ortsteil Schönbrunn",
      "type": "Registerbekanntmachung nach dem Umwandlungsgesetz",
      "state": "Bayern",
      "amtsgericht": "Amtsgericht München",
      "registernummer": "HRB 173089",
      "registerart": "HRB",
      "company_name": "DSI Schönbrunn gemeinnützige GmbH",
      "company_seat": "Röhrmoos, Ortsteil Schönbrunn",
      "details": "26.07.2025 (Bekanntmachungsdatum)\n\nBayern Amtsgericht München HRB 173089\nRegisterbekanntmachung nach dem Umwandlungsgesetz 25.07.2025 (Eintragungsdatum)\n\nDSI Schönbrunn gemeinnützige GmbH\nGesellschaft mit beschränkter Haftung\nRöhrmoos, Ortsteil Schönbrunn\n\nDen Gläubigern der an der Verschmelzung beteiligten Rechtsträger ist, wenn sie binnen sechs Monaten nach dem Tag, an dem die Eintragung der Verschmelzung in das Register des Sitzes desjenigen Rechtsträgers, dessen Gläubiger sie sind, nach § 19 Abs. 3 UmwG als bekannt gemacht gilt, ihren Anspruch nach Grund und Höhe in Textform anmelden, Sicherheit zu leisten, soweit sie nicht Befriedigung verlangen können. Dieses Recht steht den Gläubigern jedoch nur zu, wenn sie glaubhaft machen, dass durch die Verschmelzung die Erfüllung ihrer Forderung gefährdet wird."
    },
    {
      "date": "2025-07-26",
      "id": "117690",
      "original_text": "Einreichung neuer Dokumente\nBayern Amtsgericht Kempten (Allgäu) HRB 16478\nABT SE – Kempten (Allgäu)",
      "type": "Einreichung neuer Dokumente",
      "state": "Bayern",
      "amtsgericht": "Amtsgericht Kempten (Allgäu)",
      "registernummer": "HRB 16478",
      "registerart": "HRB",
      "company_name": "ABT SE",
      "company_seat": "Kempten (Allgäu)",
      "details": "26.07.2025 (Bekanntmachungsdatum)\n\nBayern Amtsgericht Kempten (Allgäu) HRB 16478\nEinreichung neuer Dokumente 25.07.2025 (Eintragungsdatum)\n\nABT SE\nEuropäische Aktiengesellschaft (SE)\nKempten (Allgäu)\n\nDem Amtsgericht Kempten (Allgäu) -Registergericht- ist eine Liste der Mitglieder des Verwaltungsrats eingereicht worden, Art. 9 Abs. 1 Buchst. c (ii) SE-VO i.V.m. § 106 AktG."
    },
    {
      "date": "2025-07-26",
      "id": "117691",
      "original_text": "Registerbekanntmachung nach dem Umwandlungsgesetz\nBayern Amtsgericht Traunstein HRA 15104\nAndreas Lohmaier e.K. – Obertaufkirchen",
      "type": "Registerbekanntmachung nach dem Umwandlungsgesetz",
      "state": "Bayern",
      "amtsgericht": "Amtsgericht Traunstein",
      "registernummer": "HRA 15104",
      "registerart": "HRA",
      "company_name": "Andreas Lohmaier e.K.",
      "company_seat": "Obertaufkirchen",
      "details": "26.07.2025 (Bekanntmachungsdatum)\n\nBayern Amtsgericht Traunstein HRA 15104\nRegisterbekanntmachung nach dem Umwandlungsgesetz 25.07.2025 (Eintragungsdatum)\n\nAndreas Lohmaier e.K.\nEinzelkaufmann / Einzelkauffrau\nObertaufkirchen\n\nDen Gläubigern der an der Ausgliederung beteiligten Rechtsträger ist, wenn sie binnen sechs Monaten nach dem Tag, an dem die Eintragung der Ausgliederung in das Register des Sitzes desjenigen Rechtsträgers, dessen Gläubiger sie sind, nach §§ 125, 19 Abs. 3 UmwG als bekannt gemacht gilt, ihren Anspruch nach Grund und Höhe in Textform anmelden, Sicherheit zu leisten, soweit sie nicht Befriedigung verlangen können. Dieses Recht steht den Gläubigern jedoch nur zu, wenn sie glaubhaft machen, dass durch die Ausgliederung die Erfüllung ihrer Forderung gefährdet wird."
    },
    {
      "date": "2025-07-26",
      "id": "117692",
      "original_text": "Einreichung neuer Dokumente\nBayern Amtsgericht Aschaffenburg HRB 120\nTB Deu Abwicklungs-Aktiengesellschaft – Aschaffenburg",
      "type": "Einreichung neuer Dokumente",
      "state": "Bayern",
      "amtsgericht": "Amtsgericht Aschaffenburg",
      "registernummer": "HRB 120",
      "registerart": "HRB",
      "company_name": "TB Deu Abwicklungs-Aktiengesellschaft",
      "company_seat": "Aschaffenburg",
      "details": "26.07.2025 (Bekanntmachungsdatum)\n\nBayern Amtsgericht Aschaffenburg HRB 120\nEinreichung neuer Dokumente 25.07.2025 (Eintragungsdatum)\n\nTB Deu Abwicklungs-Aktiengesellschaft\nAktiengesellschaft\nAschaffenburg\n\nDem Amtsgericht Aschaffenburg -Registergericht- ist eine Liste der Mitglieder des Aufsichtsrats eingereicht worden, § 106 AktG."
    },
    {
      "date": "2025-07-26",
      "id": "117693",
      "original_text": "Registerbekanntmachung nach dem Umwandlungsgesetz\nBayern Amtsgericht Schweinfurt HRB 3648\nMüller Software & Service GmbH – Großbardorf",
      "type": "Registerbekanntmachung nach dem Umwandlungsgesetz",
      "state": "Bayern",
      "amtsgericht": "Amtsgericht Schweinfurt",
      "registernummer": "HRB 3648",
      "registerart": "HRB",
      "company_name": "Müller Software & Service GmbH",
      "company_seat": "Großbardorf",
      "details": "26.07.2025 (Bekanntmachungsdatum)\n\nBayern Amtsgericht Schweinfurt HRB 3648\nRegisterbekanntmachung nach dem Umwandlungsgesetz 25.07.2025 (Eintragungsdatum)\n\nMüller Software & Service GmbH\nGesellschaft mit beschränkter Haftung\nGroßbardorf\n\nDen Gläubigern der an der Verschmelzung beteiligten Rechtsträger ist, wenn sie binnen sechs Monaten nach dem Tag, an dem die Eintragung der Verschmelzung in das Register des Sitzes desjenigen Rechtsträgers, dessen Gläubiger sie sind, nach § 19 Abs. 3 UmwG als bekannt gemacht gilt, ihren Anspruch nach Grund und Höhe in Textform anmelden, Sicherheit zu leisten, soweit sie nicht Befriedigung verlangen können. Dieses Recht steht den Gläubigern jedoch nur zu, wenn sie glaubhaft machen, dass durch die Verschmelzung die Erfüllung ihrer Forderung gefährdet wird."
    },
    {
      "date": "2025-07-26",
      "id": "117694",
      "original_text": "Löschungsankündigung\nBayern Amtsgericht Nürnberg HRB 36902\n1A Leipziger Wohnbau GmbH – Nürnberg",
      "type": "Löschungsankündigung",
      "state": "Bayern",
      "amtsgericht": "Amtsgericht Nürnberg",
      "registernummer": "HRB 36902",
      "registerart": "HRB",
      "company_name": "1A Leipziger Wohnbau GmbH",
      "company_seat": "Nürnberg",
      "details": "26.07.2025 (Bekanntmachungsdatum)\n\nBayern Amtsgericht Nürnberg HRB 36902\nLöschungsankündigung\n\n1A Leipziger Wohnbau GmbH\nGesellschaft mit beschränkter Haftung\nNürnberg\n\nDas Registergericht beabsichtigt, die im Handelsregister eingetragene Gesellschaft wegen Vermögenslosigkeit von Amts wegen nach § 394 FamFG zu löschen. Die Frist zur Erhebung eines Widerspruchs ist auf einen Monat festgesetzt."
    },
    {
      "date": "2025-07-26",
      "id": "117695",
      "original_text": "Registerbekanntmachung nach dem Umwandlungsgesetz\nBayern Amtsgericht München HRB 93981\nCybernex Software GmbH – München",
      "type": "Registerbekanntmachung nach dem Umwandlungsgesetz",
      "state": "Bayern",
      "amtsgericht": "Amtsgericht München",
      "registernummer": "HRB 93981",
      "registerart": "HRB",
      "company_name": "Cybernex Software GmbH",
      "company_seat": "München",
      "details": "26.07.2025 (Bekanntmachungsdatum)\n\nBayern Amtsgericht München HRB 93981\nRegisterbekanntmachung nach dem Umwandlungsgesetz 25.07.2025 (Eintragungsdatum)\n\nCybernex Software GmbH\nGesellschaft mit beschränkter Haftung\nMünchen\n\nDen Gläubigern der an der Verschmelzung beteiligten Rechtsträger ist, wenn sie binnen sechs Monaten nach dem Tag, an dem die Eintragung der Verschmelzung in das Register des Sitzes desjenigen Rechtsträgers, dessen Gläubiger sie sind, nach § 19 Abs. 3 UmwG als bekannt gemacht gilt, ihren Anspruch nach Grund und Höhe in Textform anmelden, Sicherheit zu leisten, soweit sie nicht Befriedigung verlangen können. Dieses Recht steht den Gläubigern jedoch nur zu, wenn sie glaubhaft machen, dass durch die Verschmelzung die Erfüllung ihrer Forderung gefährdet wird."
    },
    {
      "date": "2025-07-26",
      "id": "117696",
      "original_text": "Registerbekanntmachung nach dem Umwandlungsgesetz\nBayern Amtsgericht Würzburg HRB 580\nNikolaus Sorg Gesellschaft mit beschränkter Haftung – Lohr a. Main",
      "type": "Registerbekanntmachung nach dem Umwandlungsgesetz",
      "state": "Bayern",
      "amtsgericht": "Amtsgericht Würzburg",
      "registernummer": "HRB 580",
      "registerart": "HRB",
      "company_name": "Nikolaus Sorg Gesellschaft mit beschränkter Haftung",
      "company_seat": "Lohr a. Main",
      "details": "26.07.2025 (Bekanntmachungsdatum)\n\nBayern Amtsgericht Würzburg HRB 580\nRegisterbekanntmachung nach dem Umwandlungsgesetz 25.07.2025 (Eintragungsdatum)\n\nNikolaus Sorg Gesellschaft mit beschränkter Haftung\nGesellschaft mit beschränkter Haftung\nLohr a. Main\n\nDen Gläubigern der an der Verschmelzung beteiligten Rechtsträger ist, wenn sie binnen sechs Monaten nach dem Tag, an dem die Eintragung der Verschmelzung in das Register des Sitzes desjenigen Rechtsträgers, dessen Gläubiger sie sind, nach § 19 Abs. 3 UmwG als bekannt gemacht gilt, ihren Anspruch nach Grund und Höhe in Textform anmelden, Sicherheit zu leisten, soweit sie nicht Befriedigung verlangen können. Dieses Recht steht den Gläubigern jedoch nur zu, wenn sie glaubhaft machen, dass durch die Verschmelzung die Erfüllung ihrer Forderung gefährdet wird."
    },
    {
      "date": "2025-07-26",
      "id": "117697",
      "original_text": "Registerbekanntmachung nach dem Umwandlungsgesetz\nBayern Amtsgericht München HRB 274435\nhp&p concept GmbH – München",
      "type": "Registerbekanntmachung nach dem Umwandlungsgesetz",
      "state": "Bayern",
      "amtsgericht": "Amtsgericht München",
      "registernummer": "HRB 274435",
      "registerart": "HRB",
      "company_name": "hp&p concept GmbH",
      "company_seat": "München",
      "details": "26.07.2025 (Bekanntmachungsdatum)\n\nBayern Amtsgericht München HRB 274435\nRegisterbekanntmachung nach dem Umwandlungsgesetz 25.07.2025 (Eintragungsdatum)\n\nhp&p concept GmbH\nGesellschaft mit beschränkter Haftung\nMünchen\n\nDen Gläubigern der an der Verschmelzung beteiligten Rechtsträger ist, wenn sie binnen sechs Monaten nach dem Tag, an dem die Eintragung der Verschmelzung in das Register des Sitzes desjenigen Rechtsträgers, dessen Gläubiger sie sind, nach § 19 Abs. 3 UmwG als bekannt gemacht gilt, ihren Anspruch nach Grund und Höhe in Textform anmelden, Sicherheit zu leisten, soweit sie nicht Befriedigung verlangen können. Dieses Recht steht den Gläubigern jedoch nur zu, wenn sie glaubhaft machen, dass durch die Verschmelzung die Erfüllung ihrer Forderung gefährdet wird."
    },
    {
      "date": "2025-07-26",
      "id": "117698",
      "original_text": "Registerbekanntmachung nach dem Umwandlungsgesetz\nBayern Amtsgericht München HRB 190936\nOMMAX GmbH – München",
      "type": "Registerbekanntmachung nach dem Umwandlungsgesetz",
      "state": "Bayern",
      "amtsgericht": "Amtsgericht München",
      "registernummer": "HRB 190936",
      "registerart": "HRB",
      "company_name": "OMMAX GmbH",
      "company_seat": "München",
      "details": "26.07.2025 (Bekanntmachungsdatum)\n\nBayern Amtsgericht München HRB 190936\nRegisterbekanntmachung nach dem Umwandlungsgesetz 25.07.2025 (Eintragungsdatum)\n\nOMMAX GmbH\nGesellschaft mit beschränkter Haftung\nMünchen\n\nDen Gläubigern der an der Verschmelzung beteiligten Rechtsträger ist, wenn sie binnen sechs Monaten nach dem Tag, an dem die Eintragung der Verschmelzung in das Register des Sitzes desjenigen Rechtsträgers, dessen Gläubiger sie sind, nach § 19 Abs. 3 UmwG als bekannt gemacht gilt, ihren Anspruch nach Grund und Höhe in Textform anmelden, Sicherheit zu leisten, soweit sie nicht Befriedigung verlangen können. Dieses Recht steht den Gläubigern jedoch nur zu, wenn sie glaubhaft machen, dass durch die Verschmelzung die Erfüllung ihrer Forderung gefährdet wird."
    },
    {
      "date": "2025-07-26",
      "id": "117699",
      "original_text": "Registerbekanntmachung nach dem Umwandlungsgesetz\nBayern Amtsgericht München HRB 299086\nKirschner Holding & Unternehmerberatung AG Wirtschaftsprüfungsgesellschaft Steuerberatungsgesellschaft – München",
      "type": "Registerbekanntmachung nach dem Umwandlungsgesetz",
      "state": "Bayern",
      "amtsgericht": "Amtsgericht München",
      "registernummer": "HRB 299086",
      "registerart": "HRB",
      "company_name": "Kirschner Holding & Unternehmerberatung AG Wirtschaftsprüfungsgesellschaft Steuerberatungsgesellschaft",
      "company_seat": "München",
      "details": "26.07.2025 (Bekanntmachungsdatum)\n\nBayern Amtsgericht München HRB 299086\nRegisterbekanntmachung nach dem Umwandlungsgesetz 25.07.2025 (Eintragungsdatum)\n\nKirschner Holding & Unternehmerberatung AG Wirtschaftsprüfungsgesellschaft Steuerberatungsgesellschaft\nAktiengesellschaft\nMünchen\n\nDen Gläubigern der an der Verschmelzung beteiligten Rechtsträger ist, wenn sie binnen sechs Monaten nach dem Tag, an dem die Eintragung der Verschmelzung in das Register des Sitzes desjenigen Rechtsträgers, dessen Gläubiger sie sind, nach § 19 Abs. 3 UmwG als bekannt gemacht gilt, ihren Anspruch nach Grund und Höhe in Textform anmelden, Sicherheit zu leisten, soweit sie nicht Befriedigung verlangen können. Dieses Recht steht den Gläubigern jedoch nur zu, wenn sie glaubhaft machen, dass durch die Verschmelzung die Erfüllung ihrer Forderung gefährdet wird."
    },
    {
      "date": "2025-07-26",
      "id": "117700",
      "original_text": "Einreichung neuer Dokumente\nBayern Amtsgericht München HRB 144217\nHVB Immobilien AG – München",
      "type": "Einreichung neuer Dokumente",
      "state": "Bayern",
      "amtsgericht": "Amtsgericht München",
      "registernummer": "HRB 144217",
      "registerart": "HRB",
      "company_name": "HVB Immobilien AG",
      "company_seat": "München",
      "details": "26.07.2025 (Bekanntmachungsdatum)\n\nBayern Amtsgericht München HRB 144217\nEinreichung neuer Dokumente 25.02.2025 (Eintragungsdatum)\n\nHVB Immobilien AG\nAktiengesellschaft\nMünchen\n\nDem Amtsgericht München -Registergericht- ist eine Liste der Mitglieder des Aufsichtsrats eingereicht worden, § 106 AktG."
    },
    {
      "date": "2025-07-26",
      "id": "117701",
      "original_text": "Registerbekanntmachung nach dem Umwandlungsgesetz\nBayern Amtsgericht Nürnberg HRA 19558\nKomjan Praxismanagement GmbH & Co. KG – Nürnberg",
      "type": "Registerbekanntmachung nach dem Umwandlungsgesetz",
      "state": "Bayern",
      "amtsgericht": "Amtsgericht Nürnberg",
      "registernummer": "HRA 19558",
      "registerart": "HRA",
      "company_name": "Komjan Praxismanagement GmbH & Co. KG",
      "company_seat": "Nürnberg",
      "details": "26.07.2025 (Bekanntmachungsdatum)\n\nBayern Amtsgericht Nürnberg HRA 19558\nRegisterbekanntmachung nach dem Umwandlungsgesetz 25.07.2025 (Eintragungsdatum)\n\nKomjan Praxismanagement GmbH & Co. KG\nKommanditgesellschaft\nNürnberg\n\nDen Gläubigern des formwechselnden Rechtsträgers ist, wenn sie binnen sechs Monaten nach dem Tag, an dem die Eintragung des Formwechsels nach § 201 UmwG als bekannt gemacht gilt, ihren Anspruch nach Grund und Höhe in Textform anmelden, Sicherheit zu leisten, soweit sie nicht Befriedigung verlangen können. Dieses Recht steht den Gläubigern jedoch nur zu, wenn sie glaubhaft machen, dass durch den Formwechsel die Erfüllung ihrer Forderung gefährdet wird."
    },
    {
      "date": "2025-07-26",
      "id": "117702",
      "original_text": "Registerbekanntmachung nach dem Umwandlungsgesetz\nBayern Amtsgericht Deggendorf HRA 3717\nDrexler Trockenbau e.K. – Hengersberg",
      "type": "Registerbekanntmachung nach dem Umwandlungsgesetz",
      "state": "Bayern",
      "amtsgericht": "Amtsgericht Deggendorf",
      "registernummer": "HRA 3717",
      "registerart": "HRA",
      "company_name": "Drexler Trockenbau e.K.",
      "company_seat": "Hengersberg",
      "details": "26.07.2025 (Bekanntmachungsdatum)\n\nBayern Amtsgericht Deggendorf HRA 3717\nRegisterbekanntmachung nach dem Umwandlungsgesetz 25.07.2025 (Eintragungsdatum)\n\nDrexler Trockenbau e.K.\nEinzelkaufmann / Einzelkauffrau\nHengersberg\n\nDen Gläubigern der an der Ausgliederung beteiligten Rechtsträger ist, wenn sie binnen sechs Monaten nach dem Tag, an dem die Eintragung der Ausgliederung in das Register des Sitzes desjenigen Rechtsträgers, dessen Gläubiger sie sind, nach §§ 125, 19 Abs. 3 UmwG als bekannt gemacht gilt, ihren Anspruch nach Grund und Höhe in Textform anmelden, Sicherheit zu leisten, soweit sie nicht Befriedigung verlangen können. Dieses Recht steht den Gläubigern jedoch nur zu, wenn sie glaubhaft machen, dass durch die Ausgliederung die Erfüllung ihrer Forderung gefährdet wird."
    },
    {
      "date": "2025-07-26",
      "id": "117703",
      "original_text": "Registerbekanntmachung nach dem Umwandlungsgesetz\nBayern Amtsgericht Regensburg HRB 7542\nIS Software GmbH – Regensburg",
      "type": "Registerbekanntmachung nach dem Umwandlungsgesetz",
      "state": "Bayern",
      "amtsgericht": "Amtsgericht Regensburg",
      "registernummer": "HRB 7542",
      "registerart": "HRB",
      "company_name": "IS Software GmbH",
      "company_seat": "Regensburg",
      "details": "26.07.2025 (Bekanntmachungsdatum)\n\nBayern Amtsgericht Regensburg HRB 7542\nRegisterbekanntmachung nach dem Umwandlungsgesetz 25.07.2025 (Eintragungsdatum)\n\nIS Software GmbH\nGesellschaft mit beschränkter Haftung\nRegensburg\n\nDen Gläubigern der an der Verschmelzung beteiligten Rechtsträger ist, wenn sie binnen sechs Monaten nach dem Tag, an dem die Eintragung der Verschmelzung in das Register des Sitzes desjenigen Rechtsträgers, dessen Gläubiger sie sind, nach § 19 Abs. 3 UmwG als bekannt gemacht gilt, ihren Anspruch nach Grund und Höhe in Textform anmelden, Sicherheit zu leisten, soweit sie nicht Befriedigung verlangen können. Dieses Recht steht den Gläubigern jedoch nur zu, wenn sie glaubhaft machen, dass durch die Verschmelzung die Erfüllung ihrer Forderung gefährdet wird."
    },
    {
      "date": "2025-07-26",
      "id": "117704",
      "original_text": "Registerbekanntmachung nach dem Umwandlungsgesetz\nBayern Amtsgericht München HRB 289810\nHalisdemir-Abrechnungs UG (haftungsbeschränkt) – Adelshofen",
      "type": "Registerbekanntmachung nach dem Umwandlungsgesetz",
      "state": "Bayern",
      "amtsgericht": "Amtsgericht München",
      "registernummer": "HRB 289810",
      "registerart": "HRB",
      "company_name": "Halisdemir-Abrechnungs UG (haftungsbeschränkt)",
      "company_seat": "Adelshofen",
      "details": "26.07.2025 (Bekanntmachungsdatum)\n\nBayern Amtsgericht München HRB 289810\nRegisterbekanntmachung nach dem Umwandlungsgesetz 25.07.2025 (Eintragungsdatum)\n\nHalisdemir-Abrechnungs UG (haftungsbeschränkt)\nGesellschaft mit beschränkter Haftung\nAdelshofen\n\nDen Gläubigern der an der Verschmelzung beteiligten Rechtsträger ist, wenn sie binnen sechs Monaten nach dem Tag, an dem die Eintragung der Verschmelzung in das Register des Sitzes desjenigen Rechtsträgers, dessen Gläubiger sie sind, nach § 19 Abs. 3 UmwG als bekannt gemacht gilt, ihren Anspruch nach Grund und Höhe in Textform anmelden, Sicherheit zu leisten, soweit sie nicht Befriedigung verlangen können. Dieses Recht steht den Gläubigern jedoch nur zu, wenn sie glaubhaft machen, dass durch die Verschmelzung die Erfüllung ihrer Forderung gefährdet wird."
    },
    {
      "date": "2025-07-26",
      "id": "117705",
      "original_text": "Löschungsankündigung\nBayern Amtsgericht Nürnberg HRB 37279\nCONAI - EUROPE GmbH – Allersberg",
      "type": "Löschungsankündigung",
      "state": "Bayern",
      "amtsgericht": "Amtsgericht Nürnberg",
      "registernummer": "HRB 37279",
      "registerart": "HRB",
      "company_name": "CONAI - EUROPE GmbH",
      "company_seat": "Allersberg",
      "details": "26.07.2025 (Bekanntmachungsdatum)\n\nBayern Amtsgericht Nürnberg HRB 37279\nLöschungsankündigung\n\nCONAI - EUROPE GmbH\nGesellschaft mit beschränkter Haftung\nAllersberg\n\nDas Registergericht beabsichtigt, die im Handelsregister eingetragene Gesellschaft wegen Vermögenslosigkeit von Amts wegen nach § 394 FamFG zu löschen. Die Frist zur Erhebung eines Widerspruchs ist auf einen Monat festgesetzt."
    },
    {
      "date": "2025-07-26",
      "id": "117706",
      "original_text": "Registerbekanntmachung nach dem Umwandlungsgesetz\nBayern Amtsgericht München HRB 218583\nStrange Consult GmbH – Tutzing",
      "type": "Registerbekanntmachung nach dem Umwandlungsgesetz",
      "state": "Bayern",
      "amtsgericht": "Amtsgericht München",
      "registernummer": "HRB 218583",
      "registerart": "HRB",
      "company_name": "Strange Consult GmbH",
      "company_seat": "Tutzing",
      "details": "26.07.2025 (Bekanntmachungsdatum)\n\nBayern Amtsgericht München HRB 218583\nRegisterbekanntmachung nach dem Umwandlungsgesetz 25.07.2025 (Eintragungsdatum)\n\nStrange Consult GmbH\nGesellschaft mit beschränkter Haftung\nTutzing\n\nDen Gläubigern der an der Verschmelzung beteiligten Rechtsträger ist, wenn sie binnen sechs Monaten nach dem Tag, an dem die Eintragung der Verschmelzung in das Register des Sitzes desjenigen Rechtsträgers, dessen Gläubiger sie sind, nach § 19 Abs. 3 UmwG als bekannt gemacht gilt, ihren Anspruch nach Grund und Höhe in Textform anmelden, Sicherheit zu leisten, soweit sie nicht Befriedigung verlangen können. Dieses Recht steht den Gläubigern jedoch nur zu, wenn sie glaubhaft machen, dass durch die Verschmelzung die Erfüllung ihrer Forderung gefährdet wird."
    },
    {
      "date": "2025-07-26",
      "id": "117707",
      "original_text": "Registerbekanntmachung nach dem Umwandlungsgesetz\nBayern Amtsgericht München HRB 297551\nNeo German Holdco GmbH – München",
      "type": "Registerbekanntmachung nach dem Umwandlungsgesetz",
      "state": "Bayern",
      "amtsgericht": "Amtsgericht München",
      "registernummer": "HRB 297551",
      "registerart": "HRB",
      "company_name": "Neo German Holdco GmbH",
      "company_seat": "München",
      "details": "26.07.2025 (Bekanntmachungsdatum)\n\nBayern Amtsgericht München HRB 297551\nRegisterbekanntmachung nach dem Umwandlungsgesetz 25.07.2025 (Eintragungsdatum)\n\nNeo German Holdco GmbH\nGesellschaft mit beschränkter Haftung\nMünchen\n\nDen Gläubigern der an der Verschmelzung beteiligten Rechtsträger ist, wenn sie binnen sechs Monaten nach dem Tag, an dem die Eintragung der Verschmelzung in das Register des Sitzes desjenigen Rechtsträgers, dessen Gläubiger sie sind, nach § 19 Abs. 3 UmwG als bekannt gemacht gilt, ihren Anspruch nach Grund und Höhe in Textform anmelden, Sicherheit zu leisten, soweit sie nicht Befriedigung verlangen können. Dieses Recht steht den Gläubigern jedoch nur zu, wenn sie glaubhaft machen, dass durch die Verschmelzung die Erfüllung ihrer Forderung gefährdet wird."
    },
    {
      "date": "2025-07-26",
      "id": "117708",
      "original_text": "Registerbekanntmachung nach dem Umwandlungsgesetz\nBayern Amtsgericht Regensburg HRB 9476\nBayernwerk Netz GmbH – Regensburg",
      "type": "Registerbekanntmachung nach dem Umwandlungsgesetz",
      "state": "Bayern",
      "amtsgericht": "Amtsgericht Regensburg",
      "registernummer": "HRB 9476",
      "registerart": "HRB",
      "company_name": "Bayernwerk Netz GmbH",
      "company_seat": "Regensburg",
      "details": "26.07.2025 (Bekanntmachungsdatum)\n\nBayern Amtsgericht Regensburg HRB 9476\nRegisterbekanntmachung nach dem Umwandlungsgesetz 25.07.2025 (Eintragungsdatum)\n\nBayernwerk Netz GmbH\nGesellschaft mit beschränkter Haftung\nRegensburg\n\nDen Gläubigern der an der Verschmelzung beteiligten Rechtsträger ist, wenn sie binnen sechs Monaten nach dem Tag, an dem die Eintragung der Verschmelzung in das Register des Sitzes desjenigen Rechtsträgers, dessen Gläubiger sie sind, nach § 19 Abs. 3 UmwG als bekannt gemacht gilt, ihren Anspruch nach Grund und Höhe in Textform anmelden, Sicherheit zu leisten, soweit sie nicht Befriedigung verlangen können. Dieses Recht steht den Gläubigern jedoch nur zu, wenn sie glaubhaft machen, dass durch die Verschmelzung die Erfüllung ihrer Forderung gefährdet wird."
    },
    {
      "date": "2025-07-26",
      "id": "117709",
      "original_text": "Registerbekanntmachung nach dem Umwandlungsgesetz\nBayern Amtsgericht München HRB 297551\nNeo German Holdco GmbH – München",
      "type": "Registerbekanntmachung nach dem Umwandlungsgesetz",
      "state": "Bayern",
      "amtsgericht": "Amtsgericht München",
      "registernummer": "HRB 297551",
      "registerart": "HRB",
      "company_name": "Neo German Holdco GmbH",
      "company_seat": "München",
      "details": "26.07.2025 (Bekanntmachungsdatum)\n\nBayern Amtsgericht München HRB 297551\nRegisterbekanntmachung nach dem Umwandlungsgesetz 25.07.2025 (Eintragungsdatum)\n\nNeo German Holdco GmbH\nGesellschaft mit beschränkter Haftung\nMünchen\n\nDen Gläubigern der an der Verschmelzung beteiligten Rechtsträger ist, wenn sie binnen sechs Monaten nach dem Tag, an dem die Eintragung der Verschmelzung in das Register des Sitzes desjenigen Rechtsträgers, dessen Gläubiger sie sind, nach § 19 Abs. 3 UmwG als bekannt gemacht gilt, ihren Anspruch nach Grund und Höhe in Textform anmelden, Sicherheit zu leisten, soweit sie nicht Befriedigung verlangen können. Dieses Recht steht den Gläubigern jedoch nur zu, wenn sie glaubhaft machen, dass durch die Verschmelzung die Erfüllung ihrer Forderung gefährdet wird."
    },
    {
      "date": "2025-07-26",
      "id": "117710",
      "original_text": "Löschungsankündigung\nBaden-Württemberg Amtsgericht Freiburg HRB 726679\nPulsar Glas- und Gebäudereinigung GmbH – Lörrach",
      "type": "Löschungsankündigung",
      "state": "Baden-Württemberg",
      "amtsgericht": "Amtsgericht Freiburg",
      "registernummer": "HRB 726679",
      "registerart": "HRB",
      "company_name": "Pulsar Glas- und Gebäudereinigung GmbH",
      "company_seat": "Lörrach",
      "details": "26.07.2025 (Bekanntmachungsdatum)\n\nBaden-Württemberg Amtsgericht Freiburg HRB 726679\nLöschungsankündigung\n\nPulsar Glas- und Gebäudereinigung GmbH\nGesellschaft mit beschränkter Haftung\nLörrach\n\nAls nicht eingetragen wird bekanntgemacht:\nDas Gericht beabsichtigt, die Gesellschaft wegen Vermögenslosigkeit im Handelsregister von Amts wegen nach § 394 FamFG zu löschen. Die Frist zur Geltendmachung eines Widerspruchs gegen die beabsichtigte Löschung ist auf einen Monat ab Veröffentlichung bestimmt."
    }
  ]
}