{
  "date": "2025-07-18",
  "date_of_scrape": "2025-08-26T14:13:37.261Z",
  "tool_version": "0.2.0",
  "number_of_announcements": 256,
  "announcements": [
    {
      "date": "2025-07-18",
      "id": "116433",
      "original_text": "Registerbekanntmachung nach dem Umwandlungsgesetz\nBayern Amtsgericht München HRB 293906\nJUWL GmbH – München",
      "type": "Registerbekanntmachung nach dem Umwandlungsgesetz",
      "state": "Bayern",
      "amtsgericht": "Amtsgericht München",
      "registernummer": "HRB 293906",
      "registerart": "HRB",
      "company_name": "JUWL GmbH",
      "company_seat": "München",
      "details": "18.07.2025 (Bekanntmachungsdatum)\n\nBayern Amtsgericht München HRB 293906\nRegisterbekanntmachung nach dem Umwandlungsgesetz 17.07.2025 (Eintragungsdatum)\n\nJUWL GmbH\nGesellschaft mit beschränkter Haftung\nMünchen\n\nDen Gläubigern der an der Verschmelzung beteiligten Rechtsträger ist, wenn sie binnen sechs Monaten nach dem Tag, an dem die Eintragung der Verschmelzung in das Register des Sitzes desjenigen Rechtsträgers, dessen Gläubiger sie sind, nach § 19 Abs. 3 UmwG als bekannt gemacht gilt, ihren Anspruch nach Grund und Höhe in Textform anmelden, Sicherheit zu leisten, soweit sie nicht Befriedigung verlangen können. Dieses Recht steht den Gläubigern jedoch nur zu, wenn sie glaubhaft machen, dass durch die Verschmelzung die Erfüllung ihrer Forderung gefährdet wird."
    },
    {
      "date": "2025-07-18",
      "id": "116434",
      "original_text": "Sonstige Registerbekanntmachung\nBayern Amtsgericht München HRB 299977\nBlitz 25-908 GmbH – München",
      "type": "Sonstige Registerbekanntmachung",
      "state": "Bayern",
      "amtsgericht": "Amtsgericht München",
      "registernummer": "HRB 299977",
      "registerart": "HRB",
      "company_name": "Blitz 25-908 GmbH",
      "company_seat": "München",
      "details": "18.07.2025 (Bekanntmachungsdatum)\n\nBayern Amtsgericht München HRB 299977\nSonstige Registerbekanntmachung 17.07.2025 (Eintragungsdatum)\n\nBlitz 25-908 GmbH\nGesellschaft mit beschränkter Haftung\nMünchen\n\nDen Gläubigern der an der Verschmelzung beteiligten Rechtsträger ist, wenn sie binnen sechs Monaten nach dem Tag, an dem die Eintragung der Verschmelzung in das Register des Sitzes desjenigen Rechtsträgers, dessen Gläubiger sie sind, nach § 19 Abs. 3 UmwG als bekannt gemacht gilt, ihren Anspruch nach Grund und Höhe in Textform anmelden, Sicherheit zu leisten, soweit sie nicht Befriedigung verlangen können. Dieses Recht steht den Gläubigern jedoch nur zu, wenn sie glaubhaft machen, dass durch die Verschmelzung die Erfüllung ihrer Forderung gefährdet wird."
    },
    {
      "date": "2025-07-18",
      "id": "116435",
      "original_text": "Registerbekanntmachung nach dem Umwandlungsgesetz\nBayern Amtsgericht Bayreuth HRA 2836\nVA Verkehrsakademie Holding GmbH & Co. KG – Kulmbach",
      "type": "Registerbekanntmachung nach dem Umwandlungsgesetz",
      "state": "Bayern",
      "amtsgericht": "Amtsgericht Bayreuth",
      "registernummer": "HRA 2836",
      "registerart": "HRA",
      "company_name": "VA Verkehrsakademie Holding GmbH & Co. KG",
      "company_seat": "Kulmbach",
      "details": "18.07.2025 (Bekanntmachungsdatum)\n\nBayern Amtsgericht Bayreuth HRA 2836\nRegisterbekanntmachung nach dem Umwandlungsgesetz 17.07.2025 (Eintragungsdatum)\n\nVA Verkehrsakademie Holding GmbH & Co. KG\nKommanditgesellschaft\nKulmbach\n\nDen Gläubigern der an der Verschmelzung beteiligten Rechtsträger ist, wenn sie binnen sechs Monaten nach dem Tag, an dem die Eintragung der Verschmelzung in das Register des Sitzes desjenigen Rechtsträgers, dessen Gläubiger sie sind, nach § 19 Abs. 3 UmwG als bekannt gemacht gilt, ihren Anspruch nach Grund und Höhe in Textform anmelden, Sicherheit zu leisten, soweit sie nicht Befriedigung verlangen können. Dieses Recht steht den Gläubigern jedoch nur zu, wenn sie glaubhaft machen, dass durch die Verschmelzung die Erfüllung ihrer Forderung gefährdet wird."
    },
    {
      "date": "2025-07-18",
      "id": "116436",
      "original_text": "Löschungsankündigung\nBayern Amtsgericht Coburg HRB 4706\nFWZ Coburg GmbH – Coburg",
      "type": "Löschungsankündigung",
      "state": "Bayern",
      "amtsgericht": "Amtsgericht Coburg",
      "registernummer": "HRB 4706",
      "registerart": "HRB",
      "company_name": "FWZ Coburg GmbH",
      "company_seat": "Coburg",
      "details": "18.07.2025 (Bekanntmachungsdatum)\n\nBayern Amtsgericht Coburg HRB 4706\nLöschungsankündigung 16.07.2025 (Eintragungsdatum)\n\nFWZ Coburg GmbH\nGesellschaft mit beschränkter Haftung\nCoburg\n\nDas Registergericht beabsichtigt, die im Handelsregister eingetragene Gesellschaft wegen Vermögenslosigkeit von Amts wegen nach § 394 FamFG zu löschen. Die Frist zur Erhebung eines Widerspruchs ist auf sechs Wochen festgesetzt."
    },
    {
      "date": "2025-07-18",
      "id": "116437",
      "original_text": "Löschungsankündigung\nBayern Amtsgericht Passau HRB 11139\nDC Carport Systeme GmbH – Waldkirchen",
      "type": "Löschungsankündigung",
      "state": "Bayern",
      "amtsgericht": "Amtsgericht Passau",
      "registernummer": "HRB 11139",
      "registerart": "HRB",
      "company_name": "DC Carport Systeme GmbH",
      "company_seat": "Waldkirchen",
      "details": "18.07.2025 (Bekanntmachungsdatum)\n\nBayern Amtsgericht Passau HRB 11139\nLöschungsankündigung\n\nDC Carport Systeme GmbH\nGesellschaft mit beschränkter Haftung\nWaldkirchen\n\nDas Registergericht beabsichtigt, die im Handelsregister eingetragene Gesellschaft wegen Vermögenslosigkeit von Amts wegen nach § 394 FamFG zu löschen. Die Frist zur Erhebung eines Widerspruchs ist auf einen Monat festgesetzt."
    },
    {
      "date": "2025-07-18",
      "id": "116438",
      "original_text": "Einreichung neuer Dokumente\nBayern Amtsgericht München HRB 209454\nREMA TIP TOP AG – Poing",
      "type": "Einreichung neuer Dokumente",
      "state": "Bayern",
      "amtsgericht": "Amtsgericht München",
      "registernummer": "HRB 209454",
      "registerart": "HRB",
      "company_name": "REMA TIP TOP AG",
      "company_seat": "Poing",
      "details": "18.07.2025 (Bekanntmachungsdatum)\n\nBayern Amtsgericht München HRB 209454\nEinreichung neuer Dokumente\n\nREMA TIP TOP AG\nAktiengesellschaft\nPoing\n\nDem Amtsgericht München -Registergericht- ist eine Liste der Mitglieder des Aufsichtsrats eingereicht worden, § 106 AktG."
    },
    {
      "date": "2025-07-18",
      "id": "116439",
      "original_text": "Registerbekanntmachung nach dem Umwandlungsgesetz\nBayern Amtsgericht München HRB 303988\nKraftanlagen E&S SE – München",
      "type": "Registerbekanntmachung nach dem Umwandlungsgesetz",
      "state": "Bayern",
      "amtsgericht": "Amtsgericht München",
      "registernummer": "HRB 303988",
      "registerart": "HRB",
      "company_name": "Kraftanlagen E&S SE",
      "company_seat": "München",
      "details": "18.07.2025 (Bekanntmachungsdatum)\n\nBayern Amtsgericht München HRB 303988\nRegisterbekanntmachung nach dem Umwandlungsgesetz 17.07.2025 (Eintragungsdatum)\n\nKraftanlagen E&S SE\nEuropäische Aktiengesellschaft (SE)\nMünchen\n\nDen Gläubigern der an der Ausgliederung beteiligten Rechtsträger ist, wenn sie binnen sechs Monaten nach dem Tag, an dem die Eintragung der Ausgliederung in das Register des Sitzes desjenigen Rechtsträgers, dessen Gläubiger sie sind, nach §§ 125, 19 Abs. 3 UmwG als bekannt gemacht gilt, ihren Anspruch nach Grund und Höhe in Textform anmelden, Sicherheit zu leisten, soweit sie nicht Befriedigung verlangen können. Dieses Recht steht den Gläubigern jedoch nur zu, wenn sie glaubhaft machen, dass durch die Ausgliederung die Erfüllung ihrer Forderung gefährdet wird."
    },
    {
      "date": "2025-07-18",
      "id": "116440",
      "original_text": "Löschungsankündigung\nBayern Amtsgericht Augsburg HRB 28570\nRSF Management GmbH – Augsburg",
      "type": "Löschungsankündigung",
      "state": "Bayern",
      "amtsgericht": "Amtsgericht Augsburg",
      "registernummer": "HRB 28570",
      "registerart": "HRB",
      "company_name": "RSF Management GmbH",
      "company_seat": "Augsburg",
      "details": "18.07.2025 (Bekanntmachungsdatum)\n\nBayern Amtsgericht Augsburg HRB 28570\nLöschungsankündigung\n\nRSF Management GmbH\nGesellschaft mit beschränkter Haftung\nAugsburg\n\nDas Registergericht beabsichtigt, die im Handelsregister eingetragene Gesellschaft wegen Vermögenslosigkeit von Amts wegen nach § 394 FamFG zu löschen. Die Frist zur Erhebung eines Widerspruchs ist auf einen Monat festgesetzt."
    },
    {
      "date": "2025-07-18",
      "id": "116441",
      "original_text": "Registerbekanntmachung nach dem Umwandlungsgesetz\nBayern Amtsgericht München HRB 208877\ninfinit.cx GmbH – München",
      "type": "Registerbekanntmachung nach dem Umwandlungsgesetz",
      "state": "Bayern",
      "amtsgericht": "Amtsgericht München",
      "registernummer": "HRB 208877",
      "registerart": "HRB",
      "company_name": "infinit.cx GmbH",
      "company_seat": "München",
      "details": "18.07.2025 (Bekanntmachungsdatum)\n\nBayern Amtsgericht München HRB 208877\nRegisterbekanntmachung nach dem Umwandlungsgesetz 17.07.2025 (Eintragungsdatum)\n\ninfinit.cx GmbH\nGesellschaft mit beschränkter Haftung\nMünchen\n\nDen Gläubigern der an der Verschmelzung beteiligten Rechtsträger ist, wenn sie binnen sechs Monaten nach dem Tag, an dem die Eintragung der Verschmelzung in das Register des Sitzes desjenigen Rechtsträgers, dessen Gläubiger sie sind, nach § 19 Abs. 3 UmwG als bekannt gemacht gilt, ihren Anspruch nach Grund und Höhe in Textform anmelden, Sicherheit zu leisten, soweit sie nicht Befriedigung verlangen können. Dieses Recht steht den Gläubigern jedoch nur zu, wenn sie glaubhaft machen, dass durch die Verschmelzung die Erfüllung ihrer Forderung gefährdet wird."
    },
    {
      "date": "2025-07-18",
      "id": "116442",
      "original_text": "Löschungsankündigung\nBayern Amtsgericht München HRB 222631\nALP - Bau & Services GmbH – Baldham",
      "type": "Löschungsankündigung",
      "state": "Bayern",
      "amtsgericht": "Amtsgericht München",
      "registernummer": "HRB 222631",
      "registerart": "HRB",
      "company_name": "ALP - Bau & Services GmbH",
      "company_seat": "Baldham",
      "details": "18.07.2025 (Bekanntmachungsdatum)\n\nBayern Amtsgericht München HRB 222631\nLöschungsankündigung 17.07.2025 (Eintragungsdatum)\n\nALP - Bau & Services GmbH\nGesellschaft mit beschränkter Haftung\nBaldham\n\nDas Registergericht beabsichtigt, die im Handelsregister eingetragene Gesellschaft wegen Vermögenslosigkeit von Amts wegen nach § 394 FamFG zu löschen. Die Frist zur Erhebung eines Widerspruchs ist auf drei Monate festgesetzt."
    },
    {
      "date": "2025-07-18",
      "id": "116443",
      "original_text": "Registerbekanntmachung nach dem Umwandlungsgesetz\nBayern Amtsgericht München HRB 293645\nAW Beteiligungs-GmbH – München",
      "type": "Registerbekanntmachung nach dem Umwandlungsgesetz",
      "state": "Bayern",
      "amtsgericht": "Amtsgericht München",
      "registernummer": "HRB 293645",
      "registerart": "HRB",
      "company_name": "AW Beteiligungs-GmbH",
      "company_seat": "München",
      "details": "18.07.2025 (Bekanntmachungsdatum)\n\nBayern Amtsgericht München HRB 293645\nRegisterbekanntmachung nach dem Umwandlungsgesetz 17.07.2025 (Eintragungsdatum)\n\nAW Beteiligungs-GmbH\nGesellschaft mit beschränkter Haftung\nMünchen\n\nDen Gläubigern der an der Verschmelzung beteiligten Rechtsträger ist, wenn sie binnen sechs Monaten nach dem Tag, an dem die Eintragung der Verschmelzung in das Register des Sitzes desjenigen Rechtsträgers, dessen Gläubiger sie sind, nach § 19 Abs. 3 UmwG als bekannt gemacht gilt, ihren Anspruch nach Grund und Höhe in Textform anmelden, Sicherheit zu leisten, soweit sie nicht Befriedigung verlangen können. Dieses Recht steht den Gläubigern jedoch nur zu, wenn sie glaubhaft machen, dass durch die Verschmelzung die Erfüllung ihrer Forderung gefährdet wird."
    },
    {
      "date": "2025-07-18",
      "id": "116444",
      "original_text": "Registerbekanntmachung nach dem Umwandlungsgesetz\nBayern Amtsgericht Würzburg HRA 6446\nL.T. Cases GmbH & Co. KG – Hausen bei Würzburg",
      "type": "Registerbekanntmachung nach dem Umwandlungsgesetz",
      "state": "Bayern",
      "amtsgericht": "Amtsgericht Würzburg",
      "registernummer": "HRA 6446",
      "registerart": "HRA",
      "company_name": "L.T. Cases GmbH & Co. KG",
      "company_seat": "Hausen bei Würzburg",
      "details": "18.07.2025 (Bekanntmachungsdatum)\n\nBayern Amtsgericht Würzburg HRA 6446\nRegisterbekanntmachung nach dem Umwandlungsgesetz 17.07.2025 (Eintragungsdatum)\n\nL.T. Cases GmbH & Co. KG\nKommanditgesellschaft\nHausen bei Würzburg\n\nDen Gläubigern des formwechselnden Rechtsträgers ist, wenn sie binnen sechs Monaten nach dem Tag, an dem die Eintragung des Formwechsels nach § 201 UmwG als bekannt gemacht gilt, ihren Anspruch nach Grund und Höhe in Textform anmelden, Sicherheit zu leisten, soweit sie nicht Befriedigung verlangen können. Dieses Recht steht den Gläubigern jedoch nur zu, wenn sie glaubhaft machen, dass durch den Formwechsel die Erfüllung ihrer Forderung gefährdet wird."
    },
    {
      "date": "2025-07-18",
      "id": "116445",
      "original_text": "Einreichung neuer Dokumente\nBayern Amtsgericht München HRB 281696\nEviden Germany GmbH – München",
      "type": "Einreichung neuer Dokumente",
      "state": "Bayern",
      "amtsgericht": "Amtsgericht München",
      "registernummer": "HRB 281696",
      "registerart": "HRB",
      "company_name": "Eviden Germany GmbH",
      "company_seat": "München",
      "details": "18.07.2025 (Bekanntmachungsdatum)\n\nBayern Amtsgericht München HRB 281696\nEinreichung neuer Dokumente\n\nEviden Germany GmbH\nGesellschaft mit beschränkter Haftung\nMünchen\n\nDem #Re.Name ist eine Liste der Mitglieder des Aufsichtsrats eingereicht worden, § 52 Abs. 3 S. 2 GmbHG."
    },
    {
      "date": "2025-07-18",
      "id": "116446",
      "original_text": "Registerbekanntmachung nach dem Umwandlungsgesetz\nBayern Amtsgericht München HRB 233222\nSatyr Rytas Verwaltung GmbH – München",
      "type": "Registerbekanntmachung nach dem Umwandlungsgesetz",
      "state": "Bayern",
      "amtsgericht": "Amtsgericht München",
      "registernummer": "HRB 233222",
      "registerart": "HRB",
      "company_name": "Satyr Rytas Verwaltung GmbH",
      "company_seat": "München",
      "details": "18.07.2025 (Bekanntmachungsdatum)\n\nBayern Amtsgericht München HRB 233222\nRegisterbekanntmachung nach dem Umwandlungsgesetz 17.07.2025 (Eintragungsdatum)\n\nSatyr Rytas Verwaltung GmbH\nGesellschaft mit beschränkter Haftung\nMünchen\n\nDen Gläubigern #dv.auswahl(Text=\"Bitte zutreffendes auswählen:\",Eingabe=\n\n\"der an der Verschmelzung beteiligten Rechtsträger ist, wenn sie binnen sechs Monaten nach dem Tag, an dem die Eintragung der Verschmelzung in das Register des Sitzes desjenigen Rechtsträgers, dessen Gläubiger sie sind, nach § 19 Abs. 3 UmwG als bekannt gemacht gilt, ihren Anspruch nach Grund und Höhe in Textform anmelden, Sicherheit zu leisten, soweit sie nicht Befriedigung verlangen können. Dieses Recht steht den Gläubigern jedoch nur zu, wenn sie glaubhaft machen, dass durch die Verschmelzung die Erfüllung ihrer Forderung gefährdet wird.\"|\"Verschmelzung\",\n\n\"der an der Spaltung beteiligten Rechtsträger ist, wenn sie binnen sechs Monaten nach dem Tag, an dem die Eintragung der Spaltung in das Register des Sitzes desjenigen Rechtsträgers, dessen Gläubiger sie sind, nach §§ 125, 19 Abs. 3 UmwG als bekannt gemacht gilt, ihren Anspruch nach Grund und Höhe in Textform anmelden, Sicherheit zu leisten, soweit sie nicht Befriedigung verlangen können. Dieses Recht steht den Gläubigern jedoch nur zu, wenn sie glaubhaft machen, dass durch die Spaltung die Erfüllung ihrer Forderung gefährdet wird.\"|\"Spaltung\",\n\n\"des formwechselnden Rechtsträgers ist, wenn sie binnen sechs Monaten nach dem Tag, an dem die Eintragung des Formwechsels nach § 201 UmwG als bekannt gemacht gilt, ihren Anspruch nach Grund und Höhe in Textform anmelden, Sicherheit zu leisten, soweit sie nicht Befriedigung verlangen können. Dieses Recht steht den Gläubigern jedoch nur zu, wenn sie glaubhaft machen, dass durch den Formwechsel die Erfüllung ihrer Forderung gefährdet wird.\"|\"formwechselnde Umwandlung\",\n\n\"der an der Ausgliederung beteiligten Rechtsträger ist, wenn sie binnen sechs Monaten nach dem Tag, an dem die Eintragung der Ausgliederung in das Register des Sitzes desjenigen Rechtsträgers, dessen Gläubiger sie sind, nach §§ 125, 19 Abs. 3 UmwG als bekannt gemacht gilt, ihren Anspruch nach Grund und Höhe in Textform anmelden, Sicherheit zu leisten, soweit sie nicht Befriedigung verlangen können. Dieses Recht steht den Gläubigern jedoch nur zu, wenn sie glaubhaft machen, dass durch die Ausgliederung die Erfüllung ihrer Forderung gefährdet wird.\"|\"Ausgliederung\")"
    },
    {
      "date": "2025-07-18",
      "id": "116447",
      "original_text": "Registerbekanntmachung nach dem Umwandlungsgesetz\nBayern Amtsgericht München HRB 205753\nAWO Frauenhaus Dachau gemeinnützige GmbH – Dachau",
      "type": "Registerbekanntmachung nach dem Umwandlungsgesetz",
      "state": "Bayern",
      "amtsgericht": "Amtsgericht München",
      "registernummer": "HRB 205753",
      "registerart": "HRB",
      "company_name": "AWO Frauenhaus Dachau gemeinnützige GmbH",
      "company_seat": "Dachau",
      "details": "18.07.2025 (Bekanntmachungsdatum)\n\nBayern Amtsgericht München HRB 205753\nRegisterbekanntmachung nach dem Umwandlungsgesetz 17.07.2025 (Eintragungsdatum)\n\nAWO Frauenhaus Dachau gemeinnützige GmbH\nGesellschaft mit beschränkter Haftung\nDachau\n\nDen Gläubigern der an der Verschmelzung beteiligten Rechtsträger ist, wenn sie binnen sechs Monaten nach dem Tag, an dem die Eintragung der Verschmelzung in das Register des Sitzes desjenigen Rechtsträgers, dessen Gläubiger sie sind, nach § 19 Abs. 3 UmwG als bekannt gemacht gilt, ihren Anspruch nach Grund und Höhe in Textform anmelden, Sicherheit zu leisten, soweit sie nicht Befriedigung verlangen können. Dieses Recht steht den Gläubigern jedoch nur zu, wenn sie glaubhaft machen, dass durch die Verschmelzung die Erfüllung ihrer Forderung gefährdet wird."
    },
    {
      "date": "2025-07-18",
      "id": "116448",
      "original_text": "Registerbekanntmachung nach dem Umwandlungsgesetz\nBayern Amtsgericht Fürth HRB 14998\nS&P Stadtbau Projekt 3 GmbH – Erlangen",
      "type": "Registerbekanntmachung nach dem Umwandlungsgesetz",
      "state": "Bayern",
      "amtsgericht": "Amtsgericht Fürth",
      "registernummer": "HRB 14998",
      "registerart": "HRB",
      "company_name": "S&P Stadtbau Projekt 3 GmbH",
      "company_seat": "Erlangen",
      "details": "18.07.2025 (Bekanntmachungsdatum)\n\nBayern Amtsgericht Fürth HRB 14998\nRegisterbekanntmachung nach dem Umwandlungsgesetz 17.07.2025 (Eintragungsdatum)\n\nS&P Stadtbau Projekt 3 GmbH\nGesellschaft mit beschränkter Haftung\nErlangen\n\nDen Gläubigern der an der Verschmelzung beteiligten Rechtsträger ist, wenn sie binnen sechs Monaten nach dem Tag, an dem die Eintragung der Verschmelzung in das Register des Sitzes desjenigen Rechtsträgers, dessen Gläubiger sie sind, nach § 19 Abs. 3 UmwG als bekannt gemacht gilt, ihren Anspruch nach Grund und Höhe in Textform anmelden, Sicherheit zu leisten, soweit sie nicht Befriedigung verlangen können. Dieses Recht steht den Gläubigern jedoch nur zu, wenn sie glaubhaft machen, dass durch die Verschmelzung die Erfüllung ihrer Forderung gefährdet wird."
    },
    {
      "date": "2025-07-18",
      "id": "116449",
      "original_text": "Registerbekanntmachung nach dem Umwandlungsgesetz\nBayern Amtsgericht München HRB 195519\nmehappy GmbH – München",
      "type": "Registerbekanntmachung nach dem Umwandlungsgesetz",
      "state": "Bayern",
      "amtsgericht": "Amtsgericht München",
      "registernummer": "HRB 195519",
      "registerart": "HRB",
      "company_name": "mehappy GmbH",
      "company_seat": "München",
      "details": "18.07.2025 (Bekanntmachungsdatum)\n\nBayern Amtsgericht München HRB 195519\nRegisterbekanntmachung nach dem Umwandlungsgesetz 17.07.2025 (Eintragungsdatum)\n\nmehappy GmbH\nGesellschaft mit beschränkter Haftung\nMünchen\n\nDen Gläubigern der an der Verschmelzung beteiligten Rechtsträger ist, wenn sie binnen sechs Monaten nach dem Tag, an dem die Eintragung der Verschmelzung in das Register des Sitzes desjenigen Rechtsträgers, dessen Gläubiger sie sind, nach § 19 Abs. 3 UmwG als bekannt gemacht gilt, ihren Anspruch nach Grund und Höhe in Textform anmelden, Sicherheit zu leisten, soweit sie nicht Befriedigung verlangen können. Dieses Recht steht den Gläubigern jedoch nur zu, wenn sie glaubhaft machen, dass durch die Verschmelzung die Erfüllung ihrer Forderung gefährdet wird."
    },
    {
      "date": "2025-07-18",
      "id": "116450",
      "original_text": "Registerbekanntmachung nach dem Umwandlungsgesetz\nBayern Amtsgericht München HRB 290170\nKraftanlagen Energies & Services SE – München",
      "type": "Registerbekanntmachung nach dem Umwandlungsgesetz",
      "state": "Bayern",
      "amtsgericht": "Amtsgericht München",
      "registernummer": "HRB 290170",
      "registerart": "HRB",
      "company_name": "Kraftanlagen Energies & Services SE",
      "company_seat": "München",
      "details": "18.07.2025 (Bekanntmachungsdatum)\n\nBayern Amtsgericht München HRB 290170\nRegisterbekanntmachung nach dem Umwandlungsgesetz 17.07.2025 (Eintragungsdatum)\n\nKraftanlagen Energies & Services SE\nEuropäische Aktiengesellschaft (SE)\nMünchen\n\nDen Gläubigern der an der Ausgliederung beteiligten Rechtsträger ist, wenn sie binnen sechs Monaten nach dem Tag, an dem die Eintragung der Ausgliederung in das Register des Sitzes desjenigen Rechtsträgers, dessen Gläubiger sie sind, nach §§ 125, 19 Abs. 3 UmwG als bekannt gemacht gilt, ihren Anspruch nach Grund und Höhe in Textform anmelden, Sicherheit zu leisten, soweit sie nicht Befriedigung verlangen können. Dieses Recht steht den Gläubigern jedoch nur zu, wenn sie glaubhaft machen, dass durch die Ausgliederung die Erfüllung ihrer Forderung gefährdet wird."
    },
    {
      "date": "2025-07-18",
      "id": "116451",
      "original_text": "Registerbekanntmachung nach dem Umwandlungsgesetz\nBayern Amtsgericht Traunstein HRB 16001\nCheckpoint GmbH – Kiefersfelden",
      "type": "Registerbekanntmachung nach dem Umwandlungsgesetz",
      "state": "Bayern",
      "amtsgericht": "Amtsgericht Traunstein",
      "registernummer": "HRB 16001",
      "registerart": "HRB",
      "company_name": "Checkpoint GmbH",
      "company_seat": "Kiefersfelden",
      "details": "18.07.2025 (Bekanntmachungsdatum)\n\nBayern Amtsgericht Traunstein HRB 16001\nRegisterbekanntmachung nach dem Umwandlungsgesetz 17.07.2025 (Eintragungsdatum)\n\nCheckpoint GmbH\nGesellschaft mit beschränkter Haftung\nKiefersfelden\n\nDen Gläubigern der an der Verschmelzung beteiligten Rechtsträger ist, wenn sie binnen sechs Monaten nach dem Tag, an dem die Eintragung der Verschmelzung in das Register des Sitzes desjenigen Rechtsträgers, dessen Gläubiger sie sind, nach § 19 Abs. 3 UmwG als bekannt gemacht gilt, ihren Anspruch nach Grund und Höhe in Textform anmelden, Sicherheit zu leisten, soweit sie nicht Befriedigung verlangen können. Dieses Recht steht den Gläubigern jedoch nur zu, wenn sie glaubhaft machen, dass durch die Verschmelzung die Erfüllung ihrer Forderung gefährdet wird."
    },
    {
      "date": "2025-07-18",
      "id": "116452",
      "original_text": "Löschungsankündigung\nBayern Amtsgericht Landshut HRB 13092\nSENI Fassadensysteme & Malerei GmbH – Triftern",
      "type": "Löschungsankündigung",
      "state": "Bayern",
      "amtsgericht": "Amtsgericht Landshut",
      "registernummer": "HRB 13092",
      "registerart": "HRB",
      "company_name": "SENI Fassadensysteme & Malerei GmbH",
      "company_seat": "Triftern",
      "details": "18.07.2025 (Bekanntmachungsdatum)\n\nBayern Amtsgericht Landshut HRB 13092\nLöschungsankündigung\n\nSENI Fassadensysteme & Malerei GmbH\nGesellschaft mit beschränkter Haftung\nTriftern\n\nDas Registergericht beabsichtigt, die im Handelsregister eingetragene Gesellschaft wegen Vermögenslosigkeit von Amts wegen nach § 394 FamFG zu löschen. Die Frist zur Erhebung eines Widerspruchs ist auf einen Monat festgesetzt."
    },
    {
      "date": "2025-07-18",
      "id": "116453",
      "original_text": "Löschungsankündigung\nBayern Amtsgericht München HRA 90382\nDG Stadthaus Grundstücksentwicklung GmbH & Co. KG – Reichersbeuern",
      "type": "Löschungsankündigung",
      "state": "Bayern",
      "amtsgericht": "Amtsgericht München",
      "registernummer": "HRA 90382",
      "registerart": "HRA",
      "company_name": "DG Stadthaus Grundstücksentwicklung GmbH & Co. KG",
      "company_seat": "Reichersbeuern",
      "details": "18.07.2025 (Bekanntmachungsdatum)\n\nBayern Amtsgericht München HRA 90382\nLöschungsankündigung\n\nDG Stadthaus Grundstücksentwicklung GmbH & Co. KG\nKommanditgesellschaft\nReichersbeuern\n\nDas Registergericht beabsichtigt, die im Handelsregister eingetragene Firma von Amts wegen nach § 31 Abs. 2 HGB zu löschen. Die Frist zur Erhebung eines Widerspruchs ist auf drei Monate festgesetzt."
    },
    {
      "date": "2025-07-18",
      "id": "116454",
      "original_text": "Registerbekanntmachung nach dem Umwandlungsgesetz\nBayern Amtsgericht Traunstein HRA 14989\nVersicherungsmakler Philipp Oberkandler e. K. – Traunstein",
      "type": "Registerbekanntmachung nach dem Umwandlungsgesetz",
      "state": "Bayern",
      "amtsgericht": "Amtsgericht Traunstein",
      "registernummer": "HRA 14989",
      "registerart": "HRA",
      "company_name": "Versicherungsmakler Philipp Oberkandler e. K.",
      "company_seat": "Traunstein",
      "details": "18.07.2025 (Bekanntmachungsdatum)\n\nBayern Amtsgericht Traunstein HRA 14989\nRegisterbekanntmachung nach dem Umwandlungsgesetz 17.07.2025 (Eintragungsdatum)\n\nVersicherungsmakler Philipp Oberkandler e. K.\nEinzelkaufmann / Einzelkauffrau\nTraunstein\n\nDen Gläubigern der an der Ausgliederung beteiligten Rechtsträger ist, wenn sie binnen sechs Monaten nach dem Tag, an dem die Eintragung der Ausgliederung in das Register des Sitzes desjenigen Rechtsträgers, dessen Gläubiger sie sind, nach §§ 125, 19 Abs. 3 UmwG als bekannt gemacht gilt, ihren Anspruch nach Grund und Höhe in Textform anmelden, Sicherheit zu leisten, soweit sie nicht Befriedigung verlangen können. Dieses Recht steht den Gläubigern jedoch nur zu, wenn sie glaubhaft machen, dass durch die Ausgliederung die Erfüllung ihrer Forderung gefährdet wird."
    },
    {
      "date": "2025-07-18",
      "id": "116455",
      "original_text": "Registerbekanntmachung nach dem Umwandlungsgesetz\nBayern Amtsgericht München HRB 203075\nLamoda GmbH – Grünwald",
      "type": "Registerbekanntmachung nach dem Umwandlungsgesetz",
      "state": "Bayern",
      "amtsgericht": "Amtsgericht München",
      "registernummer": "HRB 203075",
      "registerart": "HRB",
      "company_name": "Lamoda GmbH",
      "company_seat": "Grünwald",
      "details": "18.07.2025 (Bekanntmachungsdatum)\n\nBayern Amtsgericht München HRB 203075\nRegisterbekanntmachung nach dem Umwandlungsgesetz 17.07.2025 (Eintragungsdatum)\n\nLamoda GmbH\nGesellschaft mit beschränkter Haftung\nGrünwald\n\nDen Gläubigern der an der Verschmelzung beteiligten Rechtsträger ist, wenn sie binnen sechs Monaten nach dem Tag, an dem die Eintragung der Verschmelzung in das Register des Sitzes desjenigen Rechtsträgers, dessen Gläubiger sie sind, nach § 19 Abs. 3 UmwG als bekannt gemacht gilt, ihren Anspruch nach Grund und Höhe in Textform anmelden, Sicherheit zu leisten, soweit sie nicht Befriedigung verlangen können. Dieses Recht steht den Gläubigern jedoch nur zu, wenn sie glaubhaft machen, dass durch die Verschmelzung die Erfüllung ihrer Forderung gefährdet wird."
    },
    {
      "date": "2025-07-18",
      "id": "116456",
      "original_text": "Registerbekanntmachung nach dem Umwandlungsgesetz\nBayern Amtsgericht München HRB 253575\nWunderFlix GmbH – München",
      "type": "Registerbekanntmachung nach dem Umwandlungsgesetz",
      "state": "Bayern",
      "amtsgericht": "Amtsgericht München",
      "registernummer": "HRB 253575",
      "registerart": "HRB",
      "company_name": "WunderFlix GmbH",
      "company_seat": "München",
      "details": "18.07.2025 (Bekanntmachungsdatum)\n\nBayern Amtsgericht München HRB 253575\nRegisterbekanntmachung nach dem Umwandlungsgesetz 17.07.2025 (Eintragungsdatum)\n\nWunderFlix GmbH\nGesellschaft mit beschränkter Haftung\nMünchen\n\nDen Gläubigern der an der Verschmelzung beteiligten Rechtsträger ist, wenn sie binnen sechs Monaten nach dem Tag, an dem die Eintragung der Verschmelzung in das Register des Sitzes desjenigen Rechtsträgers, dessen Gläubiger sie sind, nach § 19 Abs. 3 UmwG als bekannt gemacht gilt, ihren Anspruch nach Grund und Höhe in Textform anmelden, Sicherheit zu leisten, soweit sie nicht Befriedigung verlangen können. Dieses Recht steht den Gläubigern jedoch nur zu, wenn sie glaubhaft machen, dass durch die Verschmelzung die Erfüllung ihrer Forderung gefährdet wird."
    },
    {
      "date": "2025-07-18",
      "id": "116457",
      "original_text": "Registerbekanntmachung nach dem Umwandlungsgesetz\nBayern Amtsgericht München HRA 121208\nAstrit Isakaj Gartenbau e.K. – Fürstenfeldbruck",
      "type": "Registerbekanntmachung nach dem Umwandlungsgesetz",
      "state": "Bayern",
      "amtsgericht": "Amtsgericht München",
      "registernummer": "HRA 121208",
      "registerart": "HRA",
      "company_name": "Astrit Isakaj Gartenbau e.K.",
      "company_seat": "Fürstenfeldbruck",
      "details": "18.07.2025 (Bekanntmachungsdatum)\n\nBayern Amtsgericht München HRA 121208\nRegisterbekanntmachung nach dem Umwandlungsgesetz 17.07.2025 (Eintragungsdatum)\n\nAstrit Isakaj Gartenbau e.K.\nEinzelkaufmann / Einzelkauffrau\nFürstenfeldbruck\n\nDen Gläubigern der an der Ausgliederung beteiligten Rechtsträger ist, wenn sie binnen sechs Monaten nach dem Tag, an dem die Eintragung der Ausgliederung in das Register des Sitzes desjenigen Rechtsträgers, dessen Gläubiger sie sind, nach §§ 125, 19 Abs. 3 UmwG als bekannt gemacht gilt, ihren Anspruch nach Grund und Höhe in Textform anmelden, Sicherheit zu leisten, soweit sie nicht Befriedigung verlangen können. Dieses Recht steht den Gläubigern jedoch nur zu, wenn sie glaubhaft machen, dass durch die Ausgliederung die Erfüllung ihrer Forderung gefährdet wird."
    },
    {
      "date": "2025-07-18",
      "id": "116458",
      "original_text": "Registerbekanntmachung nach dem Umwandlungsgesetz\nBayern Amtsgericht Hof HRA 4965\nFahrschule Kirchner Thomas e.K. – Hof",
      "type": "Registerbekanntmachung nach dem Umwandlungsgesetz",
      "state": "Bayern",
      "amtsgericht": "Amtsgericht Hof",
      "registernummer": "HRA 4965",
      "registerart": "HRA",
      "company_name": "Fahrschule Kirchner Thomas e.K.",
      "company_seat": "Hof",
      "details": "18.07.2025 (Bekanntmachungsdatum)\n\nBayern Amtsgericht Hof HRA 4965\nRegisterbekanntmachung nach dem Umwandlungsgesetz 17.07.2025 (Eintragungsdatum)\n\nFahrschule Kirchner Thomas e.K.\nEinzelkaufmann / Einzelkauffrau\nHof\n\nDen Gläubigern der an der Ausgliederung beteiligten Rechtsträger ist, wenn sie binnen sechs Monaten nach dem Tag, an dem die Eintragung der Ausgliederung in das Register des Sitzes desjenigen Rechtsträgers, dessen Gläubiger sie sind, nach §§ 125, 19 Abs. 3 UmwG als bekannt gemacht gilt, ihren Anspruch nach Grund und Höhe in Textform anmelden, Sicherheit zu leisten, soweit sie nicht Befriedigung verlangen können. Dieses Recht steht den Gläubigern jedoch nur zu, wenn sie glaubhaft machen, dass durch die Ausgliederung die Erfüllung ihrer Forderung gefährdet wird."
    },
    {
      "date": "2025-07-18",
      "id": "116459",
      "original_text": "Registerbekanntmachung nach dem Umwandlungsgesetz\nBayern Amtsgericht München HRB 64400\nHeimkreiter GmbH – Bad Tölz",
      "type": "Registerbekanntmachung nach dem Umwandlungsgesetz",
      "state": "Bayern",
      "amtsgericht": "Amtsgericht München",
      "registernummer": "HRB 64400",
      "registerart": "HRB",
      "company_name": "Heimkreiter GmbH",
      "company_seat": "Bad Tölz",
      "details": "18.07.2025 (Bekanntmachungsdatum)\n\nBayern Amtsgericht München HRB 64400\nRegisterbekanntmachung nach dem Umwandlungsgesetz 17.07.2025 (Eintragungsdatum)\n\nHeimkreiter GmbH\nGesellschaft mit beschränkter Haftung\nBad Tölz\n\nDen Gläubigern der an der Verschmelzung beteiligten Rechtsträger ist, wenn sie binnen sechs Monaten nach dem Tag, an dem die Eintragung der Verschmelzung in das Register des Sitzes desjenigen Rechtsträgers, dessen Gläubiger sie sind, nach § 19 Abs. 3 UmwG als bekannt gemacht gilt, ihren Anspruch nach Grund und Höhe in Textform anmelden, Sicherheit zu leisten, soweit sie nicht Befriedigung verlangen können. Dieses Recht steht den Gläubigern jedoch nur zu, wenn sie glaubhaft machen, dass durch die Verschmelzung die Erfüllung ihrer Forderung gefährdet wird."
    },
    {
      "date": "2025-07-18",
      "id": "116460",
      "original_text": "Registerbekanntmachung nach dem Umwandlungsgesetz\nBayern Amtsgericht Amberg HRA 4210\nHausverwaltung Schiegerl GmbH & Co. KG – Sulzbach-Rosenberg",
      "type": "Registerbekanntmachung nach dem Umwandlungsgesetz",
      "state": "Bayern",
      "amtsgericht": "Amtsgericht Amberg",
      "registernummer": "HRA 4210",
      "registerart": "HRA",
      "company_name": "Hausverwaltung Schiegerl GmbH & Co. KG",
      "company_seat": "Sulzbach-Rosenberg",
      "details": "18.07.2025 (Bekanntmachungsdatum)\n\nBayern Amtsgericht Amberg HRA 4210\nRegisterbekanntmachung nach dem Umwandlungsgesetz 17.07.2025 (Eintragungsdatum)\n\nHausverwaltung Schiegerl GmbH & Co. KG\nKommanditgesellschaft\nSulzbach-Rosenberg\n\nDen Gläubigern der an der Ausgliederung beteiligten Rechtsträger ist, wenn sie binnen sechs Monaten nach dem Tag, an dem die Eintragung der Ausgliederung in das Register des Sitzes desjenigen Rechtsträgers, dessen Gläubiger sie sind, nach §§ 125, 19 Abs. 3 UmwG als bekannt gemacht gilt, ihren Anspruch nach Grund und Höhe in Textform anmelden, Sicherheit zu leisten, soweit sie nicht Befriedigung verlangen können. Dieses Recht steht den Gläubigern jedoch nur zu, wenn sie glaubhaft machen, dass durch die Ausgliederung die Erfüllung ihrer Forderung gefährdet wird."
    },
    {
      "date": "2025-07-18",
      "id": "116461",
      "original_text": "Registerbekanntmachung nach dem Umwandlungsgesetz\nBayern Amtsgericht München HRB 74755\nWittmann Entsorgungswirtschaft GmbH – Gräfelfing",
      "type": "Registerbekanntmachung nach dem Umwandlungsgesetz",
      "state": "Bayern",
      "amtsgericht": "Amtsgericht München",
      "registernummer": "HRB 74755",
      "registerart": "HRB",
      "company_name": "Wittmann Entsorgungswirtschaft GmbH",
      "company_seat": "Gräfelfing",
      "details": "18.07.2025 (Bekanntmachungsdatum)\n\nBayern Amtsgericht München HRB 74755\nRegisterbekanntmachung nach dem Umwandlungsgesetz 17.07.2025 (Eintragungsdatum)\n\nWittmann Entsorgungswirtschaft GmbH\nGesellschaft mit beschränkter Haftung\nGräfelfing\n\nDen Gläubigern der an der Verschmelzung beteiligten Rechtsträger ist, wenn sie binnen sechs Monaten nach dem Tag, an dem die Eintragung der Verschmelzung in das Register des Sitzes desjenigen Rechtsträgers, dessen Gläubiger sie sind, nach § 19 Abs. 3 UmwG als bekannt gemacht gilt, ihren Anspruch nach Grund und Höhe in Textform anmelden, Sicherheit zu leisten, soweit sie nicht Befriedigung verlangen können. Dieses Recht steht den Gläubigern jedoch nur zu, wenn sie glaubhaft machen, dass durch die Verschmelzung die Erfüllung ihrer Forderung gefährdet wird."
    },
    {
      "date": "2025-07-18",
      "id": "116462",
      "original_text": "Registerbekanntmachung nach dem Umwandlungsgesetz\nBayern Amtsgericht München HRB 274020\nIteanova Consult GmbH – Ismaning",
      "type": "Registerbekanntmachung nach dem Umwandlungsgesetz",
      "state": "Bayern",
      "amtsgericht": "Amtsgericht München",
      "registernummer": "HRB 274020",
      "registerart": "HRB",
      "company_name": "Iteanova Consult GmbH",
      "company_seat": "Ismaning",
      "details": "18.07.2025 (Bekanntmachungsdatum)\n\nBayern Amtsgericht München HRB 274020\nRegisterbekanntmachung nach dem Umwandlungsgesetz 17.07.2025 (Eintragungsdatum)\n\nIteanova Consult GmbH\nGesellschaft mit beschränkter Haftung\nIsmaning\n\nDen Gläubigern der an der Verschmelzung beteiligten Rechtsträger ist, wenn sie binnen sechs Monaten nach dem Tag, an dem die Eintragung der Verschmelzung in das Register des Sitzes desjenigen Rechtsträgers, dessen Gläubiger sie sind, nach § 19 Abs. 3 UmwG als bekannt gemacht gilt, ihren Anspruch nach Grund und Höhe in Textform anmelden, Sicherheit zu leisten, soweit sie nicht Befriedigung verlangen können. Dieses Recht steht den Gläubigern jedoch nur zu, wenn sie glaubhaft machen, dass durch die Verschmelzung die Erfüllung ihrer Forderung gefährdet wird."
    },
    {
      "date": "2025-07-18",
      "id": "116463",
      "original_text": "Registerbekanntmachung nach dem Umwandlungsgesetz\nBayern Amtsgericht Traunstein HRA 15042\nVersicherungsmakler Oberkandler GmbH & Co. KG – Traunstein",
      "type": "Registerbekanntmachung nach dem Umwandlungsgesetz",
      "state": "Bayern",
      "amtsgericht": "Amtsgericht Traunstein",
      "registernummer": "HRA 15042",
      "registerart": "HRA",
      "company_name": "Versicherungsmakler Oberkandler GmbH & Co. KG",
      "company_seat": "Traunstein",
      "details": "18.07.2025 (Bekanntmachungsdatum)\n\nBayern Amtsgericht Traunstein HRA 15042\nRegisterbekanntmachung nach dem Umwandlungsgesetz 17.07.2025 (Eintragungsdatum)\n\nVersicherungsmakler Oberkandler GmbH & Co. KG\nKommanditgesellschaft\nTraunstein\n\nDen Gläubigern der an der Ausgliederung beteiligten Rechtsträger ist, wenn sie binnen sechs Monaten nach dem Tag, an dem die Eintragung der Ausgliederung in das Register des Sitzes desjenigen Rechtsträgers, dessen Gläubiger sie sind, nach §§ 125, 19 Abs. 3 UmwG als bekannt gemacht gilt, ihren Anspruch nach Grund und Höhe in Textform anmelden, Sicherheit zu leisten, soweit sie nicht Befriedigung verlangen können. Dieses Recht steht den Gläubigern jedoch nur zu, wenn sie glaubhaft machen, dass durch die Ausgliederung die Erfüllung ihrer Forderung gefährdet wird."
    },
    {
      "date": "2025-07-18",
      "id": "116464",
      "original_text": "Registerbekanntmachung nach dem Umwandlungsgesetz\nBayern Amtsgericht München HRB 231452\nABCON Vermögensverwaltung GmbH – München",
      "type": "Registerbekanntmachung nach dem Umwandlungsgesetz",
      "state": "Bayern",
      "amtsgericht": "Amtsgericht München",
      "registernummer": "HRB 231452",
      "registerart": "HRB",
      "company_name": "ABCON Vermögensverwaltung GmbH",
      "company_seat": "München",
      "details": "18.07.2025 (Bekanntmachungsdatum)\n\nBayern Amtsgericht München HRB 231452\nRegisterbekanntmachung nach dem Umwandlungsgesetz 17.07.2025 (Eintragungsdatum)\n\nABCON Vermögensverwaltung GmbH\nGesellschaft mit beschränkter Haftung\nMünchen\n\nDen Gläubigern der an der Verschmelzung beteiligten Rechtsträger ist, wenn sie binnen sechs Monaten nach dem Tag, an dem die Eintragung der Verschmelzung in das Register des Sitzes desjenigen Rechtsträgers, dessen Gläubiger sie sind, nach § 19 Abs. 3 UmwG als bekannt gemacht gilt, ihren Anspruch nach Grund und Höhe in Textform anmelden, Sicherheit zu leisten, soweit sie nicht Befriedigung verlangen können. Dieses Recht steht den Gläubigern jedoch nur zu, wenn sie glaubhaft machen, dass durch die Verschmelzung die Erfüllung ihrer Forderung gefährdet wird."
    },
    {
      "date": "2025-07-18",
      "id": "116465",
      "original_text": "Registerbekanntmachung nach dem Umwandlungsgesetz\nBayern Amtsgericht Hof HRB 7156\nFahrschule Kirchner GmbH – Hof",
      "type": "Registerbekanntmachung nach dem Umwandlungsgesetz",
      "state": "Bayern",
      "amtsgericht": "Amtsgericht Hof",
      "registernummer": "HRB 7156",
      "registerart": "HRB",
      "company_name": "Fahrschule Kirchner GmbH",
      "company_seat": "Hof",
      "details": "18.07.2025 (Bekanntmachungsdatum)\n\nBayern Amtsgericht Hof HRB 7156\nRegisterbekanntmachung nach dem Umwandlungsgesetz 17.07.2025 (Eintragungsdatum)\n\nFahrschule Kirchner GmbH\nGesellschaft mit beschränkter Haftung\nHof\n\nDen Gläubigern der an der Ausgliederung beteiligten Rechtsträger ist, wenn sie binnen sechs Monaten nach dem Tag, an dem die Eintragung der Ausgliederung in das Register des Sitzes desjenigen Rechtsträgers, dessen Gläubiger sie sind, nach §§ 125, 19 Abs. 3 UmwG als bekannt gemacht gilt, ihren Anspruch nach Grund und Höhe in Textform anmelden, Sicherheit zu leisten, soweit sie nicht Befriedigung verlangen können. Dieses Recht steht den Gläubigern jedoch nur zu, wenn sie glaubhaft machen, dass durch die Ausgliederung die Erfüllung ihrer Forderung gefährdet wird."
    },
    {
      "date": "2025-07-18",
      "id": "116466",
      "original_text": "Sonstige Registerbekanntmachung\nBayern Amtsgericht Bayreuth HRB 4837\nVerkehrsakademie Südwest GmbH – Kulmbach",
      "type": "Sonstige Registerbekanntmachung",
      "state": "Bayern",
      "amtsgericht": "Amtsgericht Bayreuth",
      "registernummer": "HRB 4837",
      "registerart": "HRB",
      "company_name": "Verkehrsakademie Südwest GmbH",
      "company_seat": "Kulmbach",
      "details": "18.07.2025 (Bekanntmachungsdatum)\n\nBayern Amtsgericht Bayreuth HRB 4837\nSonstige Registerbekanntmachung 17.07.2025 (Eintragungsdatum)\n\nVerkehrsakademie Südwest GmbH\nGesellschaft mit beschränkter Haftung\nKulmbach\n\nDen Gläubigern der an der Verschmelzung beteiligten Rechtsträger ist, wenn sie binnen sechs Monaten nach dem Tag, an dem die Eintragung der Verschmelzung in das Register des Sitzes desjenigen Rechtsträgers, dessen Gläubiger sie sind, nach § 19 Abs. 3 UmwG als bekannt gemacht gilt, ihren Anspruch nach Grund und Höhe in Textform anmelden, Sicherheit zu leisten, soweit sie nicht Befriedigung verlangen können. Dieses Recht steht den Gläubigern jedoch nur zu, wenn sie glaubhaft machen, dass durch die Verschmelzung die Erfüllung ihrer Forderung gefährdet wird."
    },
    {
      "date": "2025-07-18",
      "id": "116467",
      "original_text": "Registerbekanntmachung nach dem Umwandlungsgesetz\nBayern Amtsgericht München HRB 269504\nWALL-E GmbH – München",
      "type": "Registerbekanntmachung nach dem Umwandlungsgesetz",
      "state": "Bayern",
      "amtsgericht": "Amtsgericht München",
      "registernummer": "HRB 269504",
      "registerart": "HRB",
      "company_name": "WALL-E GmbH",
      "company_seat": "München",
      "details": "18.07.2025 (Bekanntmachungsdatum)\n\nBayern Amtsgericht München HRB 269504\nRegisterbekanntmachung nach dem Umwandlungsgesetz 17.07.2025 (Eintragungsdatum)\n\nWALL-E GmbH\nGesellschaft mit beschränkter Haftung\nMünchen\n\nDen Gläubigern der an der Ausgliederung beteiligten Rechtsträger ist, wenn sie binnen sechs Monaten nach dem Tag, an dem die Eintragung der Ausgliederung in das Register des Sitzes desjenigen Rechtsträgers, dessen Gläubiger sie sind, nach §§ 125, 19 Abs. 3 UmwG als bekannt gemacht gilt, ihren Anspruch nach Grund und Höhe in Textform anmelden, Sicherheit zu leisten, soweit sie nicht Befriedigung verlangen können. Dieses Recht steht den Gläubigern jedoch nur zu, wenn sie glaubhaft machen, dass durch die Ausgliederung die Erfüllung ihrer Forderung gefährdet wird."
    },
    {
      "date": "2025-07-18",
      "id": "116468",
      "original_text": "Löschungsankündigung\nBayern Amtsgericht München HRA 108907\nFlamacon oHG – München",
      "type": "Löschungsankündigung",
      "state": "Bayern",
      "amtsgericht": "Amtsgericht München",
      "registernummer": "HRA 108907",
      "registerart": "HRA",
      "company_name": "Flamacon oHG",
      "company_seat": "München",
      "details": "18.07.2025 (Bekanntmachungsdatum)\n\nBayern Amtsgericht München HRA 108907\nLöschungsankündigung 17.07.2025 (Eintragungsdatum)\n\nFlamacon oHG\nOffene Handelsgesellschaft\nMünchen\n\nDas Registergericht beabsichtigt, die im Handelsregister eingetragene Firma wegen Vermögenslosigkeit von Amts wegen nach § 394 FamFG zu löschen. Die Frist zur Erhebung eines Widerspruchs ist auf drei Monate festgesetzt."
    },
    {
      "date": "2025-07-18",
      "id": "116469",
      "original_text": "Registerbekanntmachung nach dem Umwandlungsgesetz\nBayern Amtsgericht München HRB 302891\ndpmed GmbH – Germering",
      "type": "Registerbekanntmachung nach dem Umwandlungsgesetz",
      "state": "Bayern",
      "amtsgericht": "Amtsgericht München",
      "registernummer": "HRB 302891",
      "registerart": "HRB",
      "company_name": "dpmed GmbH",
      "company_seat": "Germering",
      "details": "18.07.2025 (Bekanntmachungsdatum)\n\nBayern Amtsgericht München HRB 302891\nRegisterbekanntmachung nach dem Umwandlungsgesetz 17.07.2025 (Eintragungsdatum)\n\ndpmed GmbH\nGesellschaft mit beschränkter Haftung\nGermering\n\nDen Gläubigern der an der Verschmelzung beteiligten Rechtsträger ist, wenn sie binnen sechs Monaten nach dem Tag, an dem die Eintragung der Verschmelzung in das Register des Sitzes desjenigen Rechtsträgers, dessen Gläubiger sie sind, nach § 19 Abs. 3 UmwG als bekannt gemacht gilt, ihren Anspruch nach Grund und Höhe in Textform anmelden, Sicherheit zu leisten, soweit sie nicht Befriedigung verlangen können. Dieses Recht steht den Gläubigern jedoch nur zu, wenn sie glaubhaft machen, dass durch die Verschmelzung die Erfüllung ihrer Forderung gefährdet wird."
    },
    {
      "date": "2025-07-18",
      "id": "116470",
      "original_text": "Registerbekanntmachung nach dem Umwandlungsgesetz\nBayern Amtsgericht München HRB 131326\nHelmut Schweyer Feinmechanik GmbH – Krailling",
      "type": "Registerbekanntmachung nach dem Umwandlungsgesetz",
      "state": "Bayern",
      "amtsgericht": "Amtsgericht München",
      "registernummer": "HRB 131326",
      "registerart": "HRB",
      "company_name": "Helmut Schweyer Feinmechanik GmbH",
      "company_seat": "Krailling",
      "details": "18.07.2025 (Bekanntmachungsdatum)\n\nBayern Amtsgericht München HRB 131326\nRegisterbekanntmachung nach dem Umwandlungsgesetz 17.07.2025 (Eintragungsdatum)\n\nHelmut Schweyer Feinmechanik GmbH\nGesellschaft mit beschränkter Haftung\nKrailling\n\nDen Gläubigern der an der Verschmelzung beteiligten Rechtsträger ist, wenn sie binnen sechs Monaten nach dem Tag, an dem die Eintragung der Verschmelzung in das Register des Sitzes desjenigen Rechtsträgers, dessen Gläubiger sie sind, nach § 19 Abs. 3 UmwG als bekannt gemacht gilt, ihren Anspruch nach Grund und Höhe in Textform anmelden, Sicherheit zu leisten, soweit sie nicht Befriedigung verlangen können. Dieses Recht steht den Gläubigern jedoch nur zu, wenn sie glaubhaft machen, dass durch die Verschmelzung die Erfüllung ihrer Forderung gefährdet wird."
    },
    {
      "date": "2025-07-18",
      "id": "116471",
      "original_text": "Registerbekanntmachung nach dem Umwandlungsgesetz\nBayern Amtsgericht München HRB 217120\nSüddeutsche Getränkedistribution GmbH – München",
      "type": "Registerbekanntmachung nach dem Umwandlungsgesetz",
      "state": "Bayern",
      "amtsgericht": "Amtsgericht München",
      "registernummer": "HRB 217120",
      "registerart": "HRB",
      "company_name": "Süddeutsche Getränkedistribution GmbH",
      "company_seat": "München",
      "details": "18.07.2025 (Bekanntmachungsdatum)\n\nBayern Amtsgericht München HRB 217120\nRegisterbekanntmachung nach dem Umwandlungsgesetz 17.07.2025 (Eintragungsdatum)\n\nSüddeutsche Getränkedistribution GmbH\nGesellschaft mit beschränkter Haftung\nMünchen\n\nDen Gläubigern der an der Spaltung beteiligten Rechtsträger ist, wenn sie binnen sechs Monaten nach dem Tag, an dem die Eintragung der Spaltung in das Register des Sitzes desjenigen Rechtsträgers, dessen Gläubiger sie sind, nach §§ 125, 19 Abs. 3 UmwG als bekannt gemacht gilt, ihren Anspruch nach Grund und Höhe in Textform anmelden, Sicherheit zu leisten, soweit sie nicht Befriedigung verlangen können. Dieses Recht steht den Gläubigern jedoch nur zu, wenn sie glaubhaft machen, dass durch die Spaltung die Erfüllung ihrer Forderung gefährdet wird."
    },
    {
      "date": "2025-07-18",
      "id": "116472",
      "original_text": "Registerbekanntmachung nach dem Umwandlungsgesetz\nBayern Amtsgericht München HRB 76002\nKUROS Verwaltung GmbH – Pullach i. Isartal",
      "type": "Registerbekanntmachung nach dem Umwandlungsgesetz",
      "state": "Bayern",
      "amtsgericht": "Amtsgericht München",
      "registernummer": "HRB 76002",
      "registerart": "HRB",
      "company_name": "KUROS Verwaltung GmbH",
      "company_seat": "Pullach i. Isartal",
      "details": "18.07.2025 (Bekanntmachungsdatum)\n\nBayern Amtsgericht München HRB 76002\nRegisterbekanntmachung nach dem Umwandlungsgesetz 17.07.2025 (Eintragungsdatum)\n\nKUROS Verwaltung GmbH\nGesellschaft mit beschränkter Haftung\nPullach i. Isartal\n\nDen Gläubigern #dv.auswahl(Text=\"Bitte zutreffendes auswählen:\",Eingabe=\n\n\"der an der Verschmelzung beteiligten Rechtsträger ist, wenn sie binnen sechs Monaten nach dem Tag, an dem die Eintragung der Verschmelzung in das Register des Sitzes desjenigen Rechtsträgers, dessen Gläubiger sie sind, nach § 19 Abs. 3 UmwG als bekannt gemacht gilt, ihren Anspruch nach Grund und Höhe in Textform anmelden, Sicherheit zu leisten, soweit sie nicht Befriedigung verlangen können. Dieses Recht steht den Gläubigern jedoch nur zu, wenn sie glaubhaft machen, dass durch die Verschmelzung die Erfüllung ihrer Forderung gefährdet wird.\"|\"Verschmelzung\",\n\n\"der an der Spaltung beteiligten Rechtsträger ist, wenn sie binnen sechs Monaten nach dem Tag, an dem die Eintragung der Spaltung in das Register des Sitzes desjenigen Rechtsträgers, dessen Gläubiger sie sind, nach §§ 125, 19 Abs. 3 UmwG als bekannt gemacht gilt, ihren Anspruch nach Grund und Höhe in Textform anmelden, Sicherheit zu leisten, soweit sie nicht Befriedigung verlangen können. Dieses Recht steht den Gläubigern jedoch nur zu, wenn sie glaubhaft machen, dass durch die Spaltung die Erfüllung ihrer Forderung gefährdet wird.\"|\"Spaltung\",\n\n\"des formwechselnden Rechtsträgers ist, wenn sie binnen sechs Monaten nach dem Tag, an dem die Eintragung des Formwechsels nach § 201 UmwG als bekannt gemacht gilt, ihren Anspruch nach Grund und Höhe in Textform anmelden, Sicherheit zu leisten, soweit sie nicht Befriedigung verlangen können. Dieses Recht steht den Gläubigern jedoch nur zu, wenn sie glaubhaft machen, dass durch den Formwechsel die Erfüllung ihrer Forderung gefährdet wird.\"|\"formwechselnde Umwandlung\",\n\n\"der an der Ausgliederung beteiligten Rechtsträger ist, wenn sie binnen sechs Monaten nach dem Tag, an dem die Eintragung der Ausgliederung in das Register des Sitzes desjenigen Rechtsträgers, dessen Gläubiger sie sind, nach §§ 125, 19 Abs. 3 UmwG als bekannt gemacht gilt, ihren Anspruch nach Grund und Höhe in Textform anmelden, Sicherheit zu leisten, soweit sie nicht Befriedigung verlangen können. Dieses Recht steht den Gläubigern jedoch nur zu, wenn sie glaubhaft machen, dass durch die Ausgliederung die Erfüllung ihrer Forderung gefährdet wird.\"|\"Ausgliederung\")"
    },
    {
      "date": "2025-07-18",
      "id": "116473",
      "original_text": "Registerbekanntmachung nach dem Umwandlungsgesetz\nBayern Amtsgericht München HRA 116118\nWagners Juicery & Health Food e.K. – München",
      "type": "Registerbekanntmachung nach dem Umwandlungsgesetz",
      "state": "Bayern",
      "amtsgericht": "Amtsgericht München",
      "registernummer": "HRA 116118",
      "registerart": "HRA",
      "company_name": "Wagners Juicery & Health Food e.K.",
      "company_seat": "München",
      "details": "18.07.2025 (Bekanntmachungsdatum)\n\nBayern Amtsgericht München HRA 116118\nRegisterbekanntmachung nach dem Umwandlungsgesetz 17.07.2025 (Eintragungsdatum)\n\nWagners Juicery & Health Food e.K.\nEinzelkaufmann / Einzelkauffrau\nMünchen\n\nDen Gläubigern der an der Ausgliederung beteiligten Rechtsträger ist, wenn sie binnen sechs Monaten nach dem Tag, an dem die Eintragung der Ausgliederung in das Register des Sitzes desjenigen Rechtsträgers, dessen Gläubiger sie sind, nach §§ 125, 19 Abs. 3 UmwG als bekannt gemacht gilt, ihren Anspruch nach Grund und Höhe in Textform anmelden, Sicherheit zu leisten, soweit sie nicht Befriedigung verlangen können. Dieses Recht steht den Gläubigern jedoch nur zu, wenn sie glaubhaft machen, dass durch die Ausgliederung die Erfüllung ihrer Forderung gefährdet wird."
    },
    {
      "date": "2025-07-18",
      "id": "116474",
      "original_text": "Einreichung neuer Dokumente\nBayern Amtsgericht Hof HRB 50\nHOFTEX GROUP AG – Hof",
      "type": "Einreichung neuer Dokumente",
      "state": "Bayern",
      "amtsgericht": "Amtsgericht Hof",
      "registernummer": "HRB 50",
      "registerart": "HRB",
      "company_name": "HOFTEX GROUP AG",
      "company_seat": "Hof",
      "details": "18.07.2025 (Bekanntmachungsdatum)\n\nBayern Amtsgericht Hof HRB 50\nEinreichung neuer Dokumente\n\nHOFTEX GROUP AG\nAktiengesellschaft\nHof\n\nDem Amtsgericht Hof -Registergericht- ist eine Liste der Mitglieder des Aufsichtsrats eingereicht worden, § 106 AktG."
    },
    {
      "date": "2025-07-18",
      "id": "116475",
      "original_text": "Registerbekanntmachung nach dem Umwandlungsgesetz\nBayern Amtsgericht Regensburg HRB 18052\nMEGIST Consulting GmbH – Regensburg",
      "type": "Registerbekanntmachung nach dem Umwandlungsgesetz",
      "state": "Bayern",
      "amtsgericht": "Amtsgericht Regensburg",
      "registernummer": "HRB 18052",
      "registerart": "HRB",
      "company_name": "MEGIST Consulting GmbH",
      "company_seat": "Regensburg",
      "details": "18.07.2025 (Bekanntmachungsdatum)\n\nBayern Amtsgericht Regensburg HRB 18052\nRegisterbekanntmachung nach dem Umwandlungsgesetz 17.07.2025 (Eintragungsdatum)\n\nMEGIST Consulting GmbH\nGesellschaft mit beschränkter Haftung\nRegensburg\n\nDen Gläubigern der an der Verschmelzung beteiligten Rechtsträger ist, wenn sie binnen sechs Monaten nach dem Tag, an dem die Eintragung der Verschmelzung in das Register des Sitzes desjenigen Rechtsträgers, dessen Gläubiger sie sind, nach § 19 Abs. 3 UmwG als bekannt gemacht gilt, ihren Anspruch nach Grund und Höhe in Textform anmelden, Sicherheit zu leisten, soweit sie nicht Befriedigung verlangen können. Dieses Recht steht den Gläubigern jedoch nur zu, wenn sie glaubhaft machen, dass durch die Verschmelzung die Erfüllung ihrer Forderung gefährdet wird."
    },
    {
      "date": "2025-07-18",
      "id": "116476",
      "original_text": "Registerbekanntmachung nach dem Umwandlungsgesetz\nBayern Amtsgericht Regensburg HRB 18069\nMEGIST Services GmbH – Regensburg",
      "type": "Registerbekanntmachung nach dem Umwandlungsgesetz",
      "state": "Bayern",
      "amtsgericht": "Amtsgericht Regensburg",
      "registernummer": "HRB 18069",
      "registerart": "HRB",
      "company_name": "MEGIST Services GmbH",
      "company_seat": "Regensburg",
      "details": "18.07.2025 (Bekanntmachungsdatum)\n\nBayern Amtsgericht Regensburg HRB 18069\nRegisterbekanntmachung nach dem Umwandlungsgesetz 17.07.2025 (Eintragungsdatum)\n\nMEGIST Services GmbH\nGesellschaft mit beschränkter Haftung\nRegensburg\n\nDen Gläubigern der an der Verschmelzung beteiligten Rechtsträger ist, wenn sie binnen sechs Monaten nach dem Tag, an dem die Eintragung der Verschmelzung in das Register des Sitzes desjenigen Rechtsträgers, dessen Gläubiger sie sind, nach § 19 Abs. 3 UmwG als bekannt gemacht gilt, ihren Anspruch nach Grund und Höhe in Textform anmelden, Sicherheit zu leisten, soweit sie nicht Befriedigung verlangen können. Dieses Recht steht den Gläubigern jedoch nur zu, wenn sie glaubhaft machen, dass durch die Verschmelzung die Erfüllung ihrer Forderung gefährdet wird."
    },
    {
      "date": "2025-07-18",
      "id": "116477",
      "original_text": "Registerbekanntmachung nach dem Umwandlungsgesetz\nBayern Amtsgericht München HRA 121241\nFIT STAR Sportsclub Holding GmbH & Co. KG – München",
      "type": "Registerbekanntmachung nach dem Umwandlungsgesetz",
      "state": "Bayern",
      "amtsgericht": "Amtsgericht München",
      "registernummer": "HRA 121241",
      "registerart": "HRA",
      "company_name": "FIT STAR Sportsclub Holding GmbH & Co. KG",
      "company_seat": "München",
      "details": "18.07.2025 (Bekanntmachungsdatum)\n\nBayern Amtsgericht München HRA 121241\nRegisterbekanntmachung nach dem Umwandlungsgesetz 17.07.2025 (Eintragungsdatum)\n\nFIT STAR Sportsclub Holding GmbH & Co. KG\nKommanditgesellschaft\nMünchen\n\nDen Gläubigern der an der Spaltung beteiligten Rechtsträger ist, wenn sie binnen sechs Monaten nach dem Tag, an dem die Eintragung der Spaltung in das Register des Sitzes desjenigen Rechtsträgers, dessen Gläubiger sie sind, nach §§ 125, 19 Abs. 3 UmwG als bekannt gemacht gilt, ihren Anspruch nach Grund und Höhe in Textform anmelden, Sicherheit zu leisten, soweit sie nicht Befriedigung verlangen können. Dieses Recht steht den Gläubigern jedoch nur zu, wenn sie glaubhaft machen, dass durch die Spaltung die Erfüllung ihrer Forderung gefährdet wird."
    },
    {
      "date": "2025-07-18",
      "id": "116478",
      "original_text": "Registerbekanntmachung nach dem Umwandlungsgesetz\nBayern Amtsgericht München HRB 274020\nIteanova Consult GmbH – Ismaning",
      "type": "Registerbekanntmachung nach dem Umwandlungsgesetz",
      "state": "Bayern",
      "amtsgericht": "Amtsgericht München",
      "registernummer": "HRB 274020",
      "registerart": "HRB",
      "company_name": "Iteanova Consult GmbH",
      "company_seat": "Ismaning",
      "details": "18.07.2025 (Bekanntmachungsdatum)\n\nBayern Amtsgericht München HRB 274020\nRegisterbekanntmachung nach dem Umwandlungsgesetz 17.07.2025 (Eintragungsdatum)\n\nIteanova Consult GmbH\nGesellschaft mit beschränkter Haftung\nIsmaning\n\nDen Gläubigern der an der Verschmelzung beteiligten Rechtsträger ist, wenn sie binnen sechs Monaten nach dem Tag, an dem die Eintragung der Verschmelzung in das Register des Sitzes desjenigen Rechtsträgers, dessen Gläubiger sie sind, nach § 19 Abs. 3 UmwG als bekannt gemacht gilt, ihren Anspruch nach Grund und Höhe in Textform anmelden, Sicherheit zu leisten, soweit sie nicht Befriedigung verlangen können. Dieses Recht steht den Gläubigern jedoch nur zu, wenn sie glaubhaft machen, dass durch die Verschmelzung die Erfüllung ihrer Forderung gefährdet wird."
    },
    {
      "date": "2025-07-18",
      "id": "116479",
      "original_text": "Registerbekanntmachung nach dem Umwandlungsgesetz\nBayern Amtsgericht München HRB 166513\nFortinet GmbH – München",
      "type": "Registerbekanntmachung nach dem Umwandlungsgesetz",
      "state": "Bayern",
      "amtsgericht": "Amtsgericht München",
      "registernummer": "HRB 166513",
      "registerart": "HRB",
      "company_name": "Fortinet GmbH",
      "company_seat": "München",
      "details": "18.07.2025 (Bekanntmachungsdatum)\n\nBayern Amtsgericht München HRB 166513\nRegisterbekanntmachung nach dem Umwandlungsgesetz 17.07.2025 (Eintragungsdatum)\n\nFortinet GmbH\nGesellschaft mit beschränkter Haftung\nMünchen\n\nDen Gläubigern der an der Verschmelzung beteiligten Rechtsträger ist, wenn sie binnen sechs Monaten nach dem Tag, an dem die Eintragung der Verschmelzung in das Register des Sitzes desjenigen Rechtsträgers, dessen Gläubiger sie sind, nach § 19 Abs. 3 UmwG als bekannt gemacht gilt, ihren Anspruch nach Grund und Höhe in Textform anmelden, Sicherheit zu leisten, soweit sie nicht Befriedigung verlangen können. Dieses Recht steht den Gläubigern jedoch nur zu, wenn sie glaubhaft machen, dass durch die Verschmelzung die Erfüllung ihrer Forderung gefährdet wird."
    },
    {
      "date": "2025-07-18",
      "id": "116480",
      "original_text": "Registerbekanntmachung nach dem Umwandlungsgesetz\nBayern Amtsgericht Nürnberg HRB 32574\nHELSPORT GmbH – Nürnberg",
      "type": "Registerbekanntmachung nach dem Umwandlungsgesetz",
      "state": "Bayern",
      "amtsgericht": "Amtsgericht Nürnberg",
      "registernummer": "HRB 32574",
      "registerart": "HRB",
      "company_name": "HELSPORT GmbH",
      "company_seat": "Nürnberg",
      "details": "18.07.2025 (Bekanntmachungsdatum)\n\nBayern Amtsgericht Nürnberg HRB 32574\nRegisterbekanntmachung nach dem Umwandlungsgesetz 17.07.2025 (Eintragungsdatum)\n\nHELSPORT GmbH\nGesellschaft mit beschränkter Haftung\nNürnberg\n\nDen Gläubigern der an der Verschmelzung beteiligten Rechtsträger ist, wenn sie binnen sechs Monaten nach dem Tag, an dem die Eintragung der Verschmelzung in das Register des Sitzes desjenigen Rechtsträgers, dessen Gläubiger sie sind, nach § 19 Abs. 3 UmwG als bekannt gemacht gilt, ihren Anspruch nach Grund und Höhe in Textform anmelden, Sicherheit zu leisten, soweit sie nicht Befriedigung verlangen können. Dieses Recht steht den Gläubigern jedoch nur zu, wenn sie glaubhaft machen, dass durch die Verschmelzung die Erfüllung ihrer Forderung gefährdet wird."
    },
    {
      "date": "2025-07-18",
      "id": "116481",
      "original_text": "Einreichung neuer Dokumente\nBaden-Württemberg Amtsgericht Stuttgart HRB 739623\nasano AG – Böblingen",
      "type": "Einreichung neuer Dokumente",
      "state": "Baden-Württemberg",
      "amtsgericht": "Amtsgericht Stuttgart",
      "registernummer": "HRB 739623",
      "registerart": "HRB",
      "company_name": "asano AG",
      "company_seat": "Böblingen",
      "details": "18.07.2025 (Bekanntmachungsdatum)\n\nBaden-Württemberg Amtsgericht Stuttgart HRB 739623\nEinreichung neuer Dokumente 18.07.2025 (Eintragungsdatum)\n\nasano AG\nAktiengesellschaft\nBöblingen\n\nDie Gesellschaft hat am 18.06.2025 die Liste über die Zusammensetzung des Aufsichtsrats zum Handelsregister eingereicht."
    },
    {
      "date": "2025-07-18",
      "id": "116482",
      "original_text": "Sonstige Registerbekanntmachung\nBerlin Amtsgericht Berlin (Charlottenburg) HRB 198280\nEpicode Germany GmbH – Berlin",
      "type": "Sonstige Registerbekanntmachung",
      "state": "Berlin",
      "amtsgericht": "Amtsgericht Berlin (Charlottenburg)",
      "registernummer": "HRB 198280",
      "registerart": "HRB",
      "company_name": "Epicode Germany GmbH",
      "company_seat": "Berlin",
      "details": "18.07.2025 (Bekanntmachungsdatum)\n\nBerlin Amtsgericht Berlin (Charlottenburg) HRB 198280\nSonstige Registerbekanntmachung\n\nEpicode Germany GmbH\nGesellschaft mit beschränkter Haftung\nBerlin\n\nAls nicht eingetragen wird gemäß §§ 308 UmwG, § 10 HGB veröffentlicht:\nDie Gesellschaft hat einen Entwurf eines Verschmelzungsplan vom 26.06.2025 betreffend die grenzüberschreitende Verschmelzung der Gesellschaft auf die Epic Education S.r.l. mit Sitz in Rom, Italien, Handelsregister von Rom unter der Nr. 15878411006 und R.E.A. Nr. 1620997 gemäß §§ 305 ff. UmwG zum Handelsregister des Amtsgerichts Charlottenburg eingereicht.\nAn der Verschmelzung sind die Epicode Germany GmbH, eine Gesellschaft mit beschränkter Haftung nach deutschem Recht mit Sitz in Berlin, Deutschland, als übertragende Gesellschaft und Epic Education S.r.l., eine Gesellschaft mit beschränkter Haftung nach Italienischem Recht mit Sitz in Rom, Italien, als übernehmende Gesellschaft beteiligt.\nDie übernehmende Gesellschaft ist eingetragen im Handelsregister von Rom unter der Nr. 15878411006 und im R.E.A. (Repertorio Economico Amministrativo) unter Nr. 1620997.\nDie übertragende Gesellschaft ist eingetragen im Handelsregister des Amtsgerichts Berlin (Charlottenburg) unter HRB 198280 B.\nEs wird darauf hingewiesen, dass die Anteilsinhaber und die Gläubiger der an der Verschmelzung jeweilig beteiligten Gesellschaften bis fünf Arbeitstage vor dem Tag der Gesellschafterversammlung, voraussichtlich am 18. August 2025, in welcher über die Verschmelzung entschieden wird, Bemerkungen zum Verschmelzungsplan übermitteln können. Es wird darauf hingewiesen, dass die Arbeitnehmer der an der Verschmelzung jeweilig beteiligten Gesellschaften bis fünf Arbeitstage vor dem Tag der Gesellschafterversammlung, voraussichtlich am 18. August 2025, in welcher über die Verschmelzung entschieden wird, Bemerkungen zum Verschmelzungsplan übermitteln zu können. Weder bei der übernehmenden noch bei der übertragenden Gesellschaft besteht ein Betriebsrat."
    },
    {
      "date": "2025-07-18",
      "id": "116483",
      "original_text": "Einreichung neuer Dokumente\nBerlin Amtsgericht Berlin (Charlottenburg) HRB 527\nBSK 1818 Holding AG – Berlin",
      "type": "Einreichung neuer Dokumente",
      "state": "Berlin",
      "amtsgericht": "Amtsgericht Berlin (Charlottenburg)",
      "registernummer": "HRB 527",
      "registerart": "HRB",
      "company_name": "BSK 1818 Holding AG",
      "company_seat": "Berlin",
      "details": "18.07.2025 (Bekanntmachungsdatum)\n\nBerlin Amtsgericht Berlin (Charlottenburg) HRB 527\nEinreichung neuer Dokumente\n\nBSK 1818 Holding AG\nAktiengesellschaft\nBerlin\n\nAls nicht eingetragen wird veröffentlicht:Es wurde eine neue Liste der Aufsichtsratsmitglieder eingereicht (§ 106 AktG)."
    },
    {
      "date": "2025-07-18",
      "id": "116484",
      "original_text": "Registerbekanntmachung nach dem Umwandlungsgesetz\nBaden-Württemberg Amtsgericht Stuttgart HRB 780813\nNagarro ATCS GmbH – Stuttgart",
      "type": "Registerbekanntmachung nach dem Umwandlungsgesetz",
      "state": "Baden-Württemberg",
      "amtsgericht": "Amtsgericht Stuttgart",
      "registernummer": "HRB 780813",
      "registerart": "HRB",
      "company_name": "Nagarro ATCS GmbH",
      "company_seat": "Stuttgart",
      "details": "18.07.2025 (Bekanntmachungsdatum)\n\nBaden-Württemberg Amtsgericht Stuttgart HRB 780813\nRegisterbekanntmachung nach dem Umwandlungsgesetz 18.07.2025 (Eintragungsdatum)\n\nNagarro ATCS GmbH\nGesellschaft mit beschränkter Haftung\nStuttgart\n\nAls nicht eingetragen wird bekanntgemacht:\nDen Gläubigern der an der Verschmelzung beteiligten Rechtsträger ist, wenn sie binnen sechs Monaten nach dem Tag, an dem die Eintragung der Verschmelzung in das Register des Sitzes desjenigen Rechtsträgers, dessen Gläubiger sie sind, nach § 19 Abs. 3 UmwG als bekanntgemacht gilt, ihren Anspruch nach Grund und Höhe schriftlich anmelden, Sicherheit zu leisten, soweit sie nicht Befriedigung verlangen können. Dieses Recht steht den Gläubigern jedoch nur zu, wenn sie glaubhaft machen, dass durch die Verschmelzung die Erfüllung ihrer Forderung gefährdet wird."
    },
    {
      "date": "2025-07-18",
      "id": "116485",
      "original_text": "Registerbekanntmachung nach dem Umwandlungsgesetz\nBaden-Württemberg Amtsgericht Stuttgart HRB 775448\nmayer-technology Beteiligungsgesellschaft mit beschränkter Haftung – Heilbronn",
      "type": "Registerbekanntmachung nach dem Umwandlungsgesetz",
      "state": "Baden-Württemberg",
      "amtsgericht": "Amtsgericht Stuttgart",
      "registernummer": "HRB 775448",
      "registerart": "HRB",
      "company_name": "mayer-technology Beteiligungsgesellschaft mit beschränkter Haftung",
      "company_seat": "Heilbronn",
      "details": "18.07.2025 (Bekanntmachungsdatum)\n\nBaden-Württemberg Amtsgericht Stuttgart HRB 775448\nRegisterbekanntmachung nach dem Umwandlungsgesetz 18.07.2025 (Eintragungsdatum)\n\nmayer-technology Beteiligungsgesellschaft mit beschränkter Haftung\nGesellschaft mit beschränkter Haftung\nHeilbronn\n\nAls nicht eingetragen wird bekanntgemacht:\nDen Gläubigern der an der Verschmelzung beteiligten Rechtsträger ist, wenn sie binnen sechs Monaten nach dem Tag, an dem die Eintragung der Verschmelzung in das Register des Sitzes desjenigen Rechtsträgers, dessen Gläubiger sie sind, nach § 19 Abs. 3 UmwG als bekanntgemacht gilt, ihren Anspruch nach Grund und Höhe schriftlich anmelden, Sicherheit zu leisten, soweit sie nicht Befriedigung verlangen können. Dieses Recht steht den Gläubigern jedoch nur zu, wenn sie glaubhaft machen, dass durch die Verschmelzung die Erfüllung ihrer Forderung gefährdet wird."
    },
    {
      "date": "2025-07-18",
      "id": "116486",
      "original_text": "Registerbekanntmachung nach dem Umwandlungsgesetz\nBaden-Württemberg Amtsgericht Stuttgart HRB 800787\nFierthbauer GmbH – Esslingen am Neckar",
      "type": "Registerbekanntmachung nach dem Umwandlungsgesetz",
      "state": "Baden-Württemberg",
      "amtsgericht": "Amtsgericht Stuttgart",
      "registernummer": "HRB 800787",
      "registerart": "HRB",
      "company_name": "Fierthbauer GmbH",
      "company_seat": "Esslingen am Neckar",
      "details": "18.07.2025 (Bekanntmachungsdatum)\n\nBaden-Württemberg Amtsgericht Stuttgart HRB 800787\nRegisterbekanntmachung nach dem Umwandlungsgesetz 18.07.2025 (Eintragungsdatum)\n\nFierthbauer GmbH\nGesellschaft mit beschränkter Haftung\nEsslingen am Neckar\n\nAls nicht eingetragen wird bekanntgemacht:\nDen Gläubigern der an der Verschmelzung beteiligten Rechtsträger ist, wenn sie binnen sechs Monaten nach dem Tag, an dem die Eintragung der Verschmelzung in das Register des Sitzes desjenigen Rechtsträgers, dessen Gläubiger sie sind, nach § 19 Abs. 3 UmwG als bekanntgemacht gilt, ihren Anspruch nach Grund und Höhe schriftlich anmelden, Sicherheit zu leisten, soweit sie nicht Befriedigung verlangen können. Dieses Recht steht den Gläubigern jedoch nur zu, wenn sie glaubhaft machen, dass durch die Verschmelzung die Erfüllung ihrer Forderung gefährdet wird."
    },
    {
      "date": "2025-07-18",
      "id": "116487",
      "original_text": "Einreichung neuer Dokumente\nBerlin Amtsgericht Berlin (Charlottenburg) HRB 162402\nYUKKA AG – Berlin",
      "type": "Einreichung neuer Dokumente",
      "state": "Berlin",
      "amtsgericht": "Amtsgericht Berlin (Charlottenburg)",
      "registernummer": "HRB 162402",
      "registerart": "HRB",
      "company_name": "YUKKA AG",
      "company_seat": "Berlin",
      "details": "18.07.2025 (Bekanntmachungsdatum)\n\nBerlin Amtsgericht Berlin (Charlottenburg) HRB 162402\nEinreichung neuer Dokumente\n\nYUKKA AG\nAktiengesellschaft\nBerlin\n\nAls nicht eingetragen wird veröffentlicht: Es wurde eine neue Liste der Aufsichtsratsmitglieder eingereicht (§ 106 AktG)."
    },
    {
      "date": "2025-07-18",
      "id": "116488",
      "original_text": "Löschungsankündigung\nBerlin Amtsgericht Berlin (Charlottenburg) HRB 144309\nSomewhere Collaborative Media GmbH – Berlin",
      "type": "Löschungsankündigung",
      "state": "Berlin",
      "amtsgericht": "Amtsgericht Berlin (Charlottenburg)",
      "registernummer": "HRB 144309",
      "registerart": "HRB",
      "company_name": "Somewhere Collaborative Media GmbH",
      "company_seat": "Berlin",
      "details": "18.07.2025 (Bekanntmachungsdatum)\n\nBerlin Amtsgericht Berlin (Charlottenburg) HRB 144309\nLöschungsankündigung\n\nSomewhere Collaborative Media GmbH\nGesellschaft mit beschränkter Haftung\nBerlin\n\nBei der nachstehenden Gesellschaft wird das Amtslöschungsverfahren gemäß § 394 FamFG eingeleitet. Widerspruchsfrist 6 Wochen"
    },
    {
      "date": "2025-07-18",
      "id": "116489",
      "original_text": "Löschungsankündigung\nSchleswig-Holstein Amtsgericht Lübeck HRB 12658\nF & F Abbruch GmbH – Bad Malente OT Nüchel",
      "type": "Löschungsankündigung",
      "state": "Schleswig-Holstein",
      "amtsgericht": "Amtsgericht Lübeck",
      "registernummer": "HRB 12658",
      "registerart": "HRB",
      "company_name": "F & F Abbruch GmbH",
      "company_seat": "Bad Malente OT Nüchel",
      "details": "18.07.2025 (Bekanntmachungsdatum)\n\nSchleswig-Holstein Amtsgericht Lübeck HRB 12658\nLöschungsankündigung\n\nF & F Abbruch GmbH\nGesellschaft mit beschränkter Haftung\nBad Malente OT Nüchel\n\nEs ist die Löschung der nachstehenden Gesellschaft wegen Vermögenslosigkeit gemäß § 394 FamFG beabsichtigt. Widerspruchsfrist: 1 Monat."
    },
    {
      "date": "2025-07-18",
      "id": "116490",
      "original_text": "Löschungsankündigung\nSchleswig-Holstein Amtsgericht Lübeck HRB 16066\nReisebüro Urlaubsreif Lübeck UG (haftungsbeschränkt) – Lübeck",
      "type": "Löschungsankündigung",
      "state": "Schleswig-Holstein",
      "amtsgericht": "Amtsgericht Lübeck",
      "registernummer": "HRB 16066",
      "registerart": "HRB",
      "company_name": "Reisebüro Urlaubsreif Lübeck UG (haftungsbeschränkt)",
      "company_seat": "Lübeck",
      "details": "18.07.2025 (Bekanntmachungsdatum)\n\nSchleswig-Holstein Amtsgericht Lübeck HRB 16066\nLöschungsankündigung\n\nReisebüro Urlaubsreif Lübeck UG (haftungsbeschränkt)\nGesellschaft mit beschränkter Haftung\nLübeck\n\nEs ist die Löschung der nachstehenden Gesellschaft wegen Vermögenslosigkeit gemäß § 394 FamFG beabsichtigt. Widerspruchsfrist:  1 Monat."
    },
    {
      "date": "2025-07-18",
      "id": "116491",
      "original_text": "Registerbekanntmachung nach dem Umwandlungsgesetz\nBaden-Württemberg Amtsgericht Mannheim HRB 713556\nIST - Ingenieurgesellschaft für Strassen- und Tiefbau GmbH – Sinsheim",
      "type": "Registerbekanntmachung nach dem Umwandlungsgesetz",
      "state": "Baden-Württemberg",
      "amtsgericht": "Amtsgericht Mannheim",
      "registernummer": "HRB 713556",
      "registerart": "HRB",
      "company_name": "IST - Ingenieurgesellschaft für Strassen- und Tiefbau GmbH",
      "company_seat": "Sinsheim",
      "details": "18.07.2025 (Bekanntmachungsdatum)\n\nBaden-Württemberg Amtsgericht Mannheim HRB 713556\nRegisterbekanntmachung nach dem Umwandlungsgesetz 18.07.2025 (Eintragungsdatum)\n\nIST - Ingenieurgesellschaft für Strassen- und Tiefbau GmbH\nGesellschaft mit beschränkter Haftung\nSinsheim\n\nAls nicht eingetragen wird bekanntgemacht:\nDen Gläubigern der an der Verschmelzung beteiligten Rechtsträger ist, wenn sie binnen sechs Monaten nach dem Tag, an dem die Eintragung der Verschmelzung in das Register des Sitzes desjenigen Rechtsträgers, dessen Gläubiger sie sind, nach § 19 Abs. 3 UmwG als bekanntgemacht gilt, ihren Anspruch nach Grund und Höhe schriftlich anmelden, Sicherheit zu leisten, soweit sie nicht Befriedigung verlangen können. Dieses Recht steht den Gläubigern jedoch nur zu, wenn sie glaubhaft machen, dass durch die Verschmelzung die Erfüllung ihrer Forderung gefährdet wird."
    },
    {
      "date": "2025-07-18",
      "id": "116492",
      "original_text": "Registerbekanntmachung nach dem Umwandlungsgesetz\nBerlin Amtsgericht Berlin (Charlottenburg) HRB 179931\nARBIP Deutschland Beteiligungen GmbH – Berlin",
      "type": "Registerbekanntmachung nach dem Umwandlungsgesetz",
      "state": "Berlin",
      "amtsgericht": "Amtsgericht Berlin (Charlottenburg)",
      "registernummer": "HRB 179931",
      "registerart": "HRB",
      "company_name": "ARBIP Deutschland Beteiligungen GmbH",
      "company_seat": "Berlin",
      "details": "18.07.2025 (Bekanntmachungsdatum)\n\nBerlin Amtsgericht Berlin (Charlottenburg) HRB 179931\nRegisterbekanntmachung nach dem Umwandlungsgesetz\n\nARBIP Deutschland Beteiligungen GmbH\nGesellschaft mit beschränkter Haftung\nBerlin\n\nAls nicht eingetragen wird veröffentlicht:\n\nDie Gesellschaft hat den Entwurf eines Formwechselplans bezüglich eines grenzüberschreitenden Formwechsels nach Luxemburg bei dem Registergericht eingereicht, der in den elektronischen Registerordner zur Einsichtnahme eingestellt wurde.\n\nGemäß §§ 336, 308 UmwG werden die folgenden Angaben hierzu bekannt gemacht, die von der Gesellschaft übermittelt wurden:\n\n„Die formwechselnde Gesellschaft, ARBIP Deutschland Beteiligungen GmbH, ist eine Gesellschaft mit beschränkter Haftung nach dem Recht der Bundesrepublik Deutschland (GmbH) mit Sitz in Berlin, Deutschland.\nDie Gesellschaft soll identitätswahrend in eine Gesellschaft mit beschränkter Haftung nach luxemburgischem Recht (société à responsabilité limitée, S.à.r.l.) unter der Firma ARBIP Deutschland Beteiligungen S.à.r.l. mit dem Sitz in Luxemburg, Großherzogtum Luxemburg, umgewandelt werden.\nDie Gesellschaft ist eingetragen im Handelsregister des Amtsgerichts Charlottenburg unter HRB 179931 B. Nach Vollzug des Formwechsels wird die Gesellschaft in das luxemburgische Handels- und Firmenregister (Registre de Commerce et des Sociétés) eingetragen.\nDer Gesellschafter und die Gläubiger der Gesellschaft (Betriebsräte und Arbeitnehmer gibt es nicht) werden darauf hingewiesen, dass sie der Gesellschaft spätestens fünf Arbeitstage vor dem Tag der Gesellschafterversammlung, die über die Zustimmung zu dem Formwechselplan beschließen soll, Bemerkungen zu dem Formwechselplan übermitteln können. Die Gesellschafterversammlung findet am 25. August 2025 statt.“\n\nDas Registergericht weist ergänzend auf die folgende Vorschrift des UmwG zum Gläubigerschutz bei grenzüberschreitenden Formwechseln hin:\n§§ 341 Abs. 1, 314 UmwG"
    },
    {
      "date": "2025-07-18",
      "id": "116493",
      "original_text": "Sonstige Registerbekanntmachung\nBerlin Amtsgericht Berlin (Charlottenburg) HRB 157037\nThe Jodel Venture GmbH – Berlin",
      "type": "Sonstige Registerbekanntmachung",
      "state": "Berlin",
      "amtsgericht": "Amtsgericht Berlin (Charlottenburg)",
      "registernummer": "HRB 157037",
      "registerart": "HRB",
      "company_name": "The Jodel Venture GmbH",
      "company_seat": "Berlin",
      "details": "18.07.2025 (Bekanntmachungsdatum)\n\nBerlin Amtsgericht Berlin (Charlottenburg) HRB 157037\nSonstige Registerbekanntmachung\n\nThe Jodel Venture GmbH\nGesellschaft mit beschränkter Haftung\nBerlin\n\nAls nicht eingetragen wird veröffentlicht: Es wurde eine neue Liste der Beiratsmitglieder eingereicht (§52 GmbHG)."
    },
    {
      "date": "2025-07-18",
      "id": "116494",
      "original_text": "Sonstige Registerbekanntmachung\nBrandenburg Amtsgericht Frankfurt/Oder HRA 4446\nPhilipp Dienstleistungen e. K. – Bernau bei Berlin",
      "type": "Sonstige Registerbekanntmachung",
      "state": "Brandenburg",
      "amtsgericht": "Amtsgericht Frankfurt/Oder",
      "registernummer": "HRA 4446",
      "registerart": "HRA",
      "company_name": "Philipp Dienstleistungen e. K.",
      "company_seat": "Bernau bei Berlin",
      "details": "18.07.2025 (Bekanntmachungsdatum)\n\nBrandenburg Amtsgericht Frankfurt/Oder HRA 4446\nSonstige Registerbekanntmachung 17.07.2025 (Eintragungsdatum)\n\nPhilipp Dienstleistungen e. K.\nEinzelkaufmann / Einzelkauffrau\nBernau bei Berlin\n\nAls nicht eingetragen wird veröffentlicht:\nDen Gläubigern der an der Spaltung beteiligten Rechtsträger ist, wenn sie binnen sechs Monaten nach dem Tag, an dem die Eintragung der Spaltung in das Register des Sitzes desjenigen Rechtsträgers, dessen Gläubiger sie sind, als bekannt gemacht gilt, ihren Anspruch nach Grund und Höhe schriftlich anmelden, Sicherheit zu leisten, soweit sie nicht Befriedigung verlangen können. Dieses Recht steht den Gläubigern jedoch nur zu, wenn sie glaubhaft machen, dass durch die Spaltung die Erfüllung ihrer Forderung gefährdet wird"
    },
    {
      "date": "2025-07-18",
      "id": "116495",
      "original_text": "Registerbekanntmachung nach dem Umwandlungsgesetz\nHamburg Amtsgericht Hamburg HRB 161986\nJebagro USA GmbH – Hamburg",
      "type": "Registerbekanntmachung nach dem Umwandlungsgesetz",
      "state": "Hamburg",
      "amtsgericht": "Amtsgericht Hamburg",
      "registernummer": "HRB 161986",
      "registerart": "HRB",
      "company_name": "Jebagro USA GmbH",
      "company_seat": "Hamburg",
      "details": "18.07.2025 (Bekanntmachungsdatum)\n\nHamburg Amtsgericht Hamburg HRB 161986\nRegisterbekanntmachung nach dem Umwandlungsgesetz 18.07.2025 (Eintragungsdatum)\n\nJebagro USA GmbH\nGesellschaft mit beschränkter Haftung\nHamburg\n\nAls nicht eingetragen wird bekannt gemacht:\nDen Gläubigern der an der Verschmelzung beteiligten Gesellschaften ist, wenn sie binnen sechs Monaten nach dem Tag, an dem die Eintragung der Verschmelzung in das Register des Sitzes desjenigen Rechtsträgers, dessen Gläubiger sie sind, nach § 19 Absatz 3 UmwG als bekannt gemacht gilt, ihren Anspruch nach Grund und Höhe schriftlich anmelden, Sicherheit zu leisten, soweit sie nicht Befriedigung verlangen können. Dieses Recht steht den Gläubigern jedoch nur zu, wenn sie glaubhaft machen, dass durch die Verschmelzung die Erfüllung ihrer Forderung gefährdet wird."
    },
    {
      "date": "2025-07-18",
      "id": "116496",
      "original_text": "Registerbekanntmachung nach dem Umwandlungsgesetz\nBaden-Württemberg Amtsgericht Mannheim HRA 710819\nNK - Normkies GmbH & Co KG – Bad Schönborn",
      "type": "Registerbekanntmachung nach dem Umwandlungsgesetz",
      "state": "Baden-Württemberg",
      "amtsgericht": "Amtsgericht Mannheim",
      "registernummer": "HRA 710819",
      "registerart": "HRA",
      "company_name": "NK - Normkies GmbH & Co KG",
      "company_seat": "Bad Schönborn",
      "details": "18.07.2025 (Bekanntmachungsdatum)\n\nBaden-Württemberg Amtsgericht Mannheim HRA 710819\nRegisterbekanntmachung nach dem Umwandlungsgesetz 18.07.2025 (Eintragungsdatum)\n\nNK - Normkies GmbH & Co KG\nKommanditgesellschaft\nBad Schönborn\n\nAls nicht eingetragen wird bekanntgemacht: Den Gläubigern der an der Verschmelzung beteiligten Rechtsträger ist, wenn sie binnen sechs Monaten nach dem Tag, an dem die Eintragung der Verschmelzung in das Register des Sitzes desjenigen Rechtsträgers, dessen Gläubiger sie sind, nach § 19 Abs. 3 UmwG als bekanntgemacht gilt, ihren Anspruch nach Grund und Höhe schriftlich anmelden, Sicherheit zu leisten, soweit sie nicht Befriedigung verlangen können. Dieses Recht steht den Gläubigern jedoch nur zu, wenn sie glaubhaft machen, dass durch die Verschmelzung die Erfüllung ihrer Forderung gefährdet wird."
    },
    {
      "date": "2025-07-18",
      "id": "116497",
      "original_text": "Einreichung neuer Dokumente\nBaden-Württemberg Amtsgericht Stuttgart HRB 451000\nTuttlinger Bäder GmbH – Tuttlingen",
      "type": "Einreichung neuer Dokumente",
      "state": "Baden-Württemberg",
      "amtsgericht": "Amtsgericht Stuttgart",
      "registernummer": "HRB 451000",
      "registerart": "HRB",
      "company_name": "Tuttlinger Bäder GmbH",
      "company_seat": "Tuttlingen",
      "details": "18.07.2025 (Bekanntmachungsdatum)\n\nBaden-Württemberg Amtsgericht Stuttgart HRB 451000\nEinreichung neuer Dokumente 18.07.2025 (Eintragungsdatum)\n\nTuttlinger Bäder GmbH\nGesellschaft mit beschränkter Haftung\nTuttlingen\n\nDie Gesellschaft hat am 16.07.2025 die Liste über die Zusammensetzung des Aufsichtsrats zum Handelsregister eingereicht."
    },
    {
      "date": "2025-07-18",
      "id": "116498",
      "original_text": "Registerbekanntmachung nach dem Umwandlungsgesetz\nBerlin Amtsgericht Berlin (Charlottenburg) HRB 149683\nStonecub GmbH – Berlin",
      "type": "Registerbekanntmachung nach dem Umwandlungsgesetz",
      "state": "Berlin",
      "amtsgericht": "Amtsgericht Berlin (Charlottenburg)",
      "registernummer": "HRB 149683",
      "registerart": "HRB",
      "company_name": "Stonecub GmbH",
      "company_seat": "Berlin",
      "details": "18.07.2025 (Bekanntmachungsdatum)\n\nBerlin Amtsgericht Berlin (Charlottenburg) HRB 149683\nRegisterbekanntmachung nach dem Umwandlungsgesetz 17.07.2025 (Eintragungsdatum)\n\nStonecub GmbH\nGesellschaft mit beschränkter Haftung\nBerlin\n\nZu Eintragungsnummer 4 vom 17.07.2025 wird als nicht eingetragen veröffentlicht: Den Gläubigern der an der Verschmelzung beteiligten Rechtsträger ist, wenn sie binnen sechs Monaten nach dem Tag, an dem die Eintragung der Verschmelzung in das Register des Sitzes desjenigen Rechtsträgers, dessen Gläubiger sie sind, als bekannt gemacht gilt, ihren Anspruch nach Grund und Höhe schriftlich anmelden, Sicherheit zu leisten, soweit sie nicht Befriedigung verlangen können. Dieses Recht steht den Gläubigern jedoch nur zu, wenn sie glaubhaft machen, dass durch die Verschmelzung die Erfüllung ihrer Forderung gefährdet wird. Das Recht, Sicherheitsleistung zu verlangen, steht Gläubigern nicht zu, die im Falle der Insolvenz ein Recht auf vorzugsweise Befriedigung aus einer Deckungsmasse haben, die nach gesetzlicher Vorschrift zu ihrem Schutz errichtet und staatlich überwacht ist."
    },
    {
      "date": "2025-07-18",
      "id": "116499",
      "original_text": "Registerbekanntmachung nach dem Umwandlungsgesetz\nBerlin Amtsgericht Berlin (Charlottenburg) HRB 220319\nAuxilium Portfolio Investment GmbH – Berlin",
      "type": "Registerbekanntmachung nach dem Umwandlungsgesetz",
      "state": "Berlin",
      "amtsgericht": "Amtsgericht Berlin (Charlottenburg)",
      "registernummer": "HRB 220319",
      "registerart": "HRB",
      "company_name": "Auxilium Portfolio Investment GmbH",
      "company_seat": "Berlin",
      "details": "18.07.2025 (Bekanntmachungsdatum)\n\nBerlin Amtsgericht Berlin (Charlottenburg) HRB 220319\nRegisterbekanntmachung nach dem Umwandlungsgesetz 17.07.2025 (Eintragungsdatum)\n\nAuxilium Portfolio Investment GmbH\nGesellschaft mit beschränkter Haftung\nBerlin\n\nZu Eintragungsnummer 3 vom 17.07.2025 wird als nicht eingetragen veröffentlicht: Den Gläubigern der an der Verschmelzung beteiligten Rechtsträger ist, wenn sie binnen sechs Monaten nach dem Tag, an dem die Eintragung der Verschmelzung in das Register des Sitzes desjenigen Rechtsträgers, dessen Gläubiger sie sind, als bekannt gemacht gilt, ihren Anspruch nach Grund und Höhe schriftlich anmelden, Sicherheit zu leisten, soweit sie nicht Befriedigung verlangen können. Dieses Recht steht den Gläubigern jedoch nur zu, wenn sie glaubhaft machen, dass durch die Verschmelzung die Erfüllung ihrer Forderung gefährdet wird. Das Recht, Sicherheitsleistung zu verlangen, steht Gläubigern nicht zu, die im Falle der Insolvenz ein Recht auf vorzugsweise Befriedigung aus einer Deckungsmasse haben, die nach gesetzlicher Vorschrift zu ihrem Schutz errichtet und staatlich überwacht ist."
    },
    {
      "date": "2025-07-18",
      "id": "116500",
      "original_text": "Registerbekanntmachung nach dem Umwandlungsgesetz\nBaden-Württemberg Amtsgericht Mannheim HRA 712333\nSFM - Sascha Fritz Mechatronik GmbH & Co. KG – Bühlertal",
      "type": "Registerbekanntmachung nach dem Umwandlungsgesetz",
      "state": "Baden-Württemberg",
      "amtsgericht": "Amtsgericht Mannheim",
      "registernummer": "HRA 712333",
      "registerart": "HRA",
      "company_name": "SFM - Sascha Fritz Mechatronik GmbH & Co. KG",
      "company_seat": "Bühlertal",
      "details": "18.07.2025 (Bekanntmachungsdatum)\n\nBaden-Württemberg Amtsgericht Mannheim HRA 712333\nRegisterbekanntmachung nach dem Umwandlungsgesetz 18.07.2025 (Eintragungsdatum)\n\nSFM - Sascha Fritz Mechatronik GmbH & Co. KG\nKommanditgesellschaft\nBühlertal\n\nAls nicht eingetragen wird bekanntgemacht:\nDen Gläubigern der an der Ausgliederung beteiligten Rechtsträger ist, wenn sie binnen sechs Monaten nach dem Tag, an dem die Eintragung der Ausgliederung in das Register des Sitzes desjenigen Rechtsträgers, dessen Gläubiger sie sind, nach § 19 Abs. 3 UmwG als bekanntgemacht gilt, ihren Anspruch nach Grund und Höhe schriftlich anmelden, Sicherheit zu leisten, soweit sie nicht Befriedigung verlangen können. Dieses Recht steht den Gläubigern jedoch nur zu, wenn sie glaubhaft machen, dass durch die Ausgliederung die Erfüllung ihrer Forderung gefährdet wird."
    },
    {
      "date": "2025-07-18",
      "id": "116501",
      "original_text": "Registerbekanntmachung nach dem Umwandlungsgesetz\nHamburg Amtsgericht Hamburg HRB 164285\nDE2 Logimac GmbH – Hamburg",
      "type": "Registerbekanntmachung nach dem Umwandlungsgesetz",
      "state": "Hamburg",
      "amtsgericht": "Amtsgericht Hamburg",
      "registernummer": "HRB 164285",
      "registerart": "HRB",
      "company_name": "DE2 Logimac GmbH",
      "company_seat": "Hamburg",
      "details": "18.07.2025 (Bekanntmachungsdatum)\n\nHamburg Amtsgericht Hamburg HRB 164285\nRegisterbekanntmachung nach dem Umwandlungsgesetz\n\nDE2 Logimac GmbH\nGesellschaft mit beschränkter Haftung\nHamburg\n\nAls nicht eingetragen wird bekannt gemacht:\nEs wird darauf hingewiesen, dass ein Formwechselplan oder sein Entwurf über einen grenzüberschreitenden Formwechsel in die Rosa Propco Müllendorf S.à r.l. mit Sitz in Luxemburg/Luxemburg (société à responsabilité limitée - Gesellschaft mit beschränkter Haftung  nach luxemburgischem Recht) beim Handelsregister eingereicht worden ist.\nDie Anteilsinhaber, die Gläubiger sowie die zuständigen Betriebsräte der an dem grenzüberschreitenden Formwechsel beteiligten Gesellschaft oder, soweit es keinen Betriebsrat gibt, die Arbeitnehmer der an dem grenzüberschreitenden Formwechsel beteiligten Gesellschaft, können der Gesellschaft spätestens fünf Arbeitstage vor dem Tag der Gesellschafterversammlung vom 29.08.2025 Bemerkungen zum Formwechselplan übermitteln."
    },
    {
      "date": "2025-07-18",
      "id": "116502",
      "original_text": "Registerbekanntmachung nach dem Umwandlungsgesetz\nHamburg Amtsgericht Hamburg HRB 156777\nKumagro Europe GmbH – Hamburg",
      "type": "Registerbekanntmachung nach dem Umwandlungsgesetz",
      "state": "Hamburg",
      "amtsgericht": "Amtsgericht Hamburg",
      "registernummer": "HRB 156777",
      "registerart": "HRB",
      "company_name": "Kumagro Europe GmbH",
      "company_seat": "Hamburg",
      "details": "18.07.2025 (Bekanntmachungsdatum)\n\nHamburg Amtsgericht Hamburg HRB 156777\nRegisterbekanntmachung nach dem Umwandlungsgesetz 18.07.2025 (Eintragungsdatum)\n\nKumagro Europe GmbH\nGesellschaft mit beschränkter Haftung\nHamburg\n\nAls nicht eingetragen wird bekannt gemacht:\nDen Gläubigern der an der Verschmelzung beteiligten Gesellschaften ist, wenn sie binnen sechs Monaten nach dem Tag, an dem die Eintragung der Verschmelzung in das Register des Sitzes desjenigen Rechtsträgers, dessen Gläubiger sie sind, nach § 19 Absatz 3 UmwG als bekannt gemacht gilt, ihren Anspruch nach Grund und Höhe schriftlich anmelden, Sicherheit zu leisten, soweit sie nicht Befriedigung verlangen können. Dieses Recht steht den Gläubigern jedoch nur zu, wenn sie glaubhaft machen, dass durch die Verschmelzung die Erfüllung ihrer Forderung gefährdet wird."
    },
    {
      "date": "2025-07-18",
      "id": "116503",
      "original_text": "Registerbekanntmachung nach dem Umwandlungsgesetz\nHamburg Amtsgericht Hamburg HRB 173627\nDE27 Logimac GmbH – Hamburg",
      "type": "Registerbekanntmachung nach dem Umwandlungsgesetz",
      "state": "Hamburg",
      "amtsgericht": "Amtsgericht Hamburg",
      "registernummer": "HRB 173627",
      "registerart": "HRB",
      "company_name": "DE27 Logimac GmbH",
      "company_seat": "Hamburg",
      "details": "18.07.2025 (Bekanntmachungsdatum)\n\nHamburg Amtsgericht Hamburg HRB 173627\nRegisterbekanntmachung nach dem Umwandlungsgesetz\n\nDE27 Logimac GmbH\nGesellschaft mit beschränkter Haftung\nHamburg\n\nAls nicht eingetragen wird bekannt gemacht:\nEs wird darauf hingewiesen, dass ein Formwechselplan oder sein Entwurf über einen grenzüberschreitenden Formwechsel in die Rosa Propco Coswig S.à r.l. mit Sitz in Luxemburg/Luxemburg (société à responsabilité limitée - Gesellschaft mit beschränkter Haftung  nach luxemburgischem Recht) beim Handelsregister eingereicht worden ist.\nDie Anteilsinhaber, die Gläubiger sowie die zuständigen Betriebsräte der an dem grenzüberschreitenden Formwechsel beteiligten Gesellschaft oder, soweit es keinen Betriebsrat gibt, die Arbeitnehmer der an dem grenzüberschreitenden Formwechsel beteiligten Gesellschaft, können der Gesellschaft spätestens fünf Arbeitstage vor dem Tag der Gesellschafterversammlung vom 29.08.2025 Bemerkungen zum Formwechselplan übermitteln."
    },
    {
      "date": "2025-07-18",
      "id": "116504",
      "original_text": "Registerbekanntmachung nach dem Umwandlungsgesetz\nHamburg Amtsgericht Hamburg HRB 144810\nJebsen & Jessen International GmbH – Hamburg",
      "type": "Registerbekanntmachung nach dem Umwandlungsgesetz",
      "state": "Hamburg",
      "amtsgericht": "Amtsgericht Hamburg",
      "registernummer": "HRB 144810",
      "registerart": "HRB",
      "company_name": "Jebsen & Jessen International GmbH",
      "company_seat": "Hamburg",
      "details": "18.07.2025 (Bekanntmachungsdatum)\n\nHamburg Amtsgericht Hamburg HRB 144810\nRegisterbekanntmachung nach dem Umwandlungsgesetz 18.07.2025 (Eintragungsdatum)\n\nJebsen & Jessen International GmbH\nGesellschaft mit beschränkter Haftung\nHamburg\n\nAls nicht eingetragen wird bekannt gemacht:\nDen Gläubigern der an der Verschmelzung beteiligten Gesellschaften ist, wenn sie binnen sechs Monaten nach dem Tag, an dem die Eintragung der Verschmelzung in das Register des Sitzes desjenigen Rechtsträgers, dessen Gläubiger sie sind, nach § 19 Absatz 3 UmwG als bekannt gemacht gilt, ihren Anspruch nach Grund und Höhe schriftlich anmelden, Sicherheit zu leisten, soweit sie nicht Befriedigung verlangen können. Dieses Recht steht den Gläubigern jedoch nur zu, wenn sie glaubhaft machen, dass durch die Verschmelzung die Erfüllung ihrer Forderung gefährdet wird."
    },
    {
      "date": "2025-07-18",
      "id": "116505",
      "original_text": "Registerbekanntmachung nach dem Umwandlungsgesetz\nHamburg Amtsgericht Hamburg HRB 158650\nDreiundachtzigste LOGIMAC Logistic Grundbesitz GmbH – Hamburg",
      "type": "Registerbekanntmachung nach dem Umwandlungsgesetz",
      "state": "Hamburg",
      "amtsgericht": "Amtsgericht Hamburg",
      "registernummer": "HRB 158650",
      "registerart": "HRB",
      "company_name": "Dreiundachtzigste LOGIMAC Logistic Grundbesitz GmbH",
      "company_seat": "Hamburg",
      "details": "18.07.2025 (Bekanntmachungsdatum)\n\nHamburg Amtsgericht Hamburg HRB 158650\nRegisterbekanntmachung nach dem Umwandlungsgesetz\n\nDreiundachtzigste LOGIMAC Logistic Grundbesitz GmbH\nGesellschaft mit beschränkter Haftung\nHamburg\n\nAls nicht eingetragen wird bekannt gemacht:\nEs wird darauf hingewiesen, dass ein Formwechselplan oder sein Entwurf über einen grenzüberschreitenden Formwechsel in die Rosa Propco Langenhagen S.à r.l. mit Sitz in Luxemburg/Luxemburg (société à responsabilité limitée - Gesellschaft mit beschränkter Haftung  nach luxemburgischem Recht) beim Handelsregister eingereicht worden ist.\nDie Anteilsinhaber, die Gläubiger sowie die zuständigen Betriebsräte der an dem grenzüberschreitenden Formwechsel beteiligten Gesellschaft oder, soweit es keinen Betriebsrat gibt, die Arbeitnehmer der an dem grenzüberschreitenden Formwechsel beteiligten Gesellschaft, können der Gesellschaft spätestens fünf Arbeitstage vor dem Tag der Gesellschafterversammlung vom 29.08.2025 Bemerkungen zum Formwechselplan übermitteln."
    },
    {
      "date": "2025-07-18",
      "id": "116506",
      "original_text": "Registerbekanntmachung nach dem Umwandlungsgesetz\nHamburg Amtsgericht Hamburg HRB 166846\nDE8 Logimac GmbH – Hamburg",
      "type": "Registerbekanntmachung nach dem Umwandlungsgesetz",
      "state": "Hamburg",
      "amtsgericht": "Amtsgericht Hamburg",
      "registernummer": "HRB 166846",
      "registerart": "HRB",
      "company_name": "DE8 Logimac GmbH",
      "company_seat": "Hamburg",
      "details": "18.07.2025 (Bekanntmachungsdatum)\n\nHamburg Amtsgericht Hamburg HRB 166846\nRegisterbekanntmachung nach dem Umwandlungsgesetz\n\nDE8 Logimac GmbH\nGesellschaft mit beschränkter Haftung\nHamburg\n\nAls nicht eingetragen wird bekannt gemacht:\nEs wird darauf hingewiesen, dass ein Formwechselplan oder sein Entwurf über einen grenzüberschreitenden Formwechsel in die Rosa Propco Ludwigsfelde S.à r.l. mit Sitz in Luxemburg/Luxemburg (société à responsabilité limitée - Gesellschaft mit beschränkter Haftung  nach luxemburgischem Recht) beim Handelsregister eingereicht worden ist.\nDie Anteilsinhaber, die Gläubiger sowie die zuständigen Betriebsräte der an dem grenzüberschreitenden Formwechsel beteiligten Gesellschaft oder, soweit es keinen Betriebsrat gibt, die Arbeitnehmer der an dem grenzüberschreitenden Formwechsel beteiligten Gesellschaft, können der Gesellschaft spätestens fünf Arbeitstage vor dem Tag der Gesellschafterversammlung vom 29.08.2025 Bemerkungen zum Formwechselplan übermitteln."
    },
    {
      "date": "2025-07-18",
      "id": "116507",
      "original_text": "Registerbekanntmachung nach dem Umwandlungsgesetz\nHamburg Amtsgericht Hamburg HRB 168308\nDE12 Logimac GmbH – Hamburg",
      "type": "Registerbekanntmachung nach dem Umwandlungsgesetz",
      "state": "Hamburg",
      "amtsgericht": "Amtsgericht Hamburg",
      "registernummer": "HRB 168308",
      "registerart": "HRB",
      "company_name": "DE12 Logimac GmbH",
      "company_seat": "Hamburg",
      "details": "18.07.2025 (Bekanntmachungsdatum)\n\nHamburg Amtsgericht Hamburg HRB 168308\nRegisterbekanntmachung nach dem Umwandlungsgesetz\n\nDE12 Logimac GmbH\nGesellschaft mit beschränkter Haftung\nHamburg\n\nAls nicht eingetragen wird bekannt gemacht:\nEs wird darauf hingewiesen, dass ein Formwechselplan oder sein Entwurf über einen grenzüberschreitenden Formwechsel in die Rosa Propco Bodenheim S.à r.l. mit Sitz in Luxemburg/Luxemburg (société à responsabilité limitée - Gesellschaft mit beschränkter Haftung  nach luxemburgischem Recht) beim Handelsregister eingereicht worden ist.\nDie Anteilsinhaber, die Gläubiger sowie die zuständigen Betriebsräte der an dem grenzüberschreitenden Formwechsel beteiligten Gesellschaft oder, soweit es keinen Betriebsrat gibt, die Arbeitnehmer der an dem grenzüberschreitenden Formwechsel beteiligten Gesellschaft, können der Gesellschaft spätestens fünf Arbeitstage vor dem Tag der Gesellschafterversammlung vom 29.08.205 Bemerkungen zum Formwechselplan übermitteln."
    },
    {
      "date": "2025-07-18",
      "id": "116508",
      "original_text": "Registerbekanntmachung nach dem Umwandlungsgesetz\nHamburg Amtsgericht Hamburg HRB 181103\nDE38 Logimac GmbH – Hamburg",
      "type": "Registerbekanntmachung nach dem Umwandlungsgesetz",
      "state": "Hamburg",
      "amtsgericht": "Amtsgericht Hamburg",
      "registernummer": "HRB 181103",
      "registerart": "HRB",
      "company_name": "DE38 Logimac GmbH",
      "company_seat": "Hamburg",
      "details": "18.07.2025 (Bekanntmachungsdatum)\n\nHamburg Amtsgericht Hamburg HRB 181103\nRegisterbekanntmachung nach dem Umwandlungsgesetz\n\nDE38 Logimac GmbH\nGesellschaft mit beschränkter Haftung\nHamburg\n\nAls nicht eingetragen wird bekannt gemacht:\nEs wird darauf hingewiesen, dass ein Formwechselplan oder sein Entwurf über einen grenzüberschreitenden Formwechsel in die Rosa Propco Gera S.à r.l. mit Sitz in Luxemburg/Luxemburg (société à responsabilité limitée - Gesellschaft mit beschränkter Haftung  nach luxemburgischem Recht) beim Handelsregister eingereicht worden ist.\nDie Anteilsinhaber, die Gläubiger sowie die zuständigen Betriebsräte der an dem grenzüberschreitenden Formwechsel beteiligten Gesellschaft oder, soweit es keinen Betriebsrat gibt, die Arbeitnehmer der an dem grenzüberschreitenden Formwechsel beteiligten Gesellschaft, können der Gesellschaft spätestens fünf Arbeitstage vor dem Tag der Gesellschafterversammlung am 29.08.2025 Bemerkungen zum Formwechselplan übermitteln."
    },
    {
      "date": "2025-07-18",
      "id": "116509",
      "original_text": "Registerbekanntmachung nach dem Umwandlungsgesetz\nBerlin Amtsgericht Berlin (Charlottenburg) HRB 146744\nDDB Germany Group of Companies GmbH – Berlin",
      "type": "Registerbekanntmachung nach dem Umwandlungsgesetz",
      "state": "Berlin",
      "amtsgericht": "Amtsgericht Berlin (Charlottenburg)",
      "registernummer": "HRB 146744",
      "registerart": "HRB",
      "company_name": "DDB Germany Group of Companies GmbH",
      "company_seat": "Berlin",
      "details": "18.07.2025 (Bekanntmachungsdatum)\n\nBerlin Amtsgericht Berlin (Charlottenburg) HRB 146744\nRegisterbekanntmachung nach dem Umwandlungsgesetz 17.07.2025 (Eintragungsdatum)\n\nDDB Germany Group of Companies GmbH\nGesellschaft mit beschränkter Haftung\nBerlin\n\nZu Eintragungsnummer 40 vom 17.07.2025 wird als nicht eingetragen veröffentlicht:\n\nDen Gläubigern der an der Verschmelzung beteiligten Rechtsträger ist, wenn sie binnen sechs Monaten nach dem Tag, an dem die Eintragung der Verschmelzung in das Register des Sitzes desjenigen Rechtsträgers, dessen Gläubiger sie sind, als bekannt gemacht gilt, ihren Anspruch nach Grund und Höhe schriftlich anmelden, Sicherheit zu leisten, soweit sie nicht Befriedigung verlangen können. Dieses Recht steht den Gläubigern jedoch nur zu, wenn sie glaubhaft machen, dass durch die Verschmelzung die Erfüllung ihrer Forderung gefährdet wird. Das Recht, Sicherheitsleistung zu verlangen, steht Gläubigern nicht zu, die im Falle der Insolvenz ein Recht auf vorzugsweise Befriedigung aus einer Deckungsmasse haben, die nach gesetzlicher Vorschrift zu ihrem Schutz errichtet und staatlich überwacht ist."
    },
    {
      "date": "2025-07-18",
      "id": "116510",
      "original_text": "Registerbekanntmachung nach dem Umwandlungsgesetz\nSaarland Amtsgericht Saarbrücken HRA 10971\nSBKS GmbH & Co. KG – St. Wendel",
      "type": "Registerbekanntmachung nach dem Umwandlungsgesetz",
      "state": "Saarland",
      "amtsgericht": "Amtsgericht Saarbrücken",
      "registernummer": "HRA 10971",
      "registerart": "HRA",
      "company_name": "SBKS GmbH & Co. KG",
      "company_seat": "St. Wendel",
      "details": "18.07.2025 (Bekanntmachungsdatum)\n\nSaarland Amtsgericht Saarbrücken HRA 10971\nRegisterbekanntmachung nach dem Umwandlungsgesetz 18.07.2025 (Eintragungsdatum)\n\nSBKS GmbH & Co. KG\nKommanditgesellschaft\nSt. Wendel\n\nAls nicht eingetragen wird bekannt gemacht: Den Gläubigern der an der formwechselnden Umwandlung beteiligten Gesellschaften ist, wenn sie binnen sechs Monaten nach dem Tag, an dem die Eintragung der formwechselnden Umwandlung in das Register des Sitzes desjenigen Rechtsträgers, dessen Gläubiger sie sind, nach § 19 Absatz 3 UmwG bekannt gemacht worden ist, ihren Anspruch nach Grund und Höhe schriftlich anmelden, Sicherheit zu leisten, soweit sie nicht Befriedigung verlangen können. Dieses Recht steht den Gläubigern jedoch nur zu, wenn sie glaubhaft machen, dass durch die formwechselnden Umwandlung die Erfüllung ihrer Forderung gefährdet wird."
    },
    {
      "date": "2025-07-18",
      "id": "116511",
      "original_text": "Registerbekanntmachung nach dem Umwandlungsgesetz\nBerlin Amtsgericht Berlin (Charlottenburg) HRB 210915\nReal GF-GE GmbH – Berlin",
      "type": "Registerbekanntmachung nach dem Umwandlungsgesetz",
      "state": "Berlin",
      "amtsgericht": "Amtsgericht Berlin (Charlottenburg)",
      "registernummer": "HRB 210915",
      "registerart": "HRB",
      "company_name": "Real GF-GE GmbH",
      "company_seat": "Berlin",
      "details": "18.07.2025 (Bekanntmachungsdatum)\n\nBerlin Amtsgericht Berlin (Charlottenburg) HRB 210915\nRegisterbekanntmachung nach dem Umwandlungsgesetz 17.07.2025 (Eintragungsdatum)\n\nReal GF-GE GmbH\nGesellschaft mit beschränkter Haftung\nBerlin\n\nZu Eintragungsnummer 3 vom 17.07.2025 wird als nicht eingetragen veröffentlicht: Den Gläubigern der an der Verschmelzung beteiligten Rechtsträger ist, wenn sie binnen sechs Monaten nach dem Tag, an dem die Eintragung der Verschmelzung in das Register des Sitzes desjenigen Rechtsträgers, dessen Gläubiger sie sind, als bekannt gemacht gilt, ihren Anspruch nach Grund und Höhe schriftlich anmelden, Sicherheit zu leisten, soweit sie nicht Befriedigung verlangen können. Dieses Recht steht den Gläubigern jedoch nur zu, wenn sie glaubhaft machen, dass durch die Verschmelzung die Erfüllung ihrer Forderung gefährdet wird. Das Recht, Sicherheitsleistung zu verlangen, steht Gläubigern nicht zu, die im Falle der Insolvenz ein Recht auf vorzugsweise Befriedigung aus einer Deckungsmasse haben, die nach gesetzlicher Vorschrift zu ihrem Schutz errichtet und staatlich überwacht ist."
    },
    {
      "date": "2025-07-18",
      "id": "116512",
      "original_text": "Registerbekanntmachung nach dem Umwandlungsgesetz\nBerlin Amtsgericht Berlin (Charlottenburg) HRA 63966\nthe operator UG (haftungsbeschränkt) & Co. KG – Berlin",
      "type": "Registerbekanntmachung nach dem Umwandlungsgesetz",
      "state": "Berlin",
      "amtsgericht": "Amtsgericht Berlin (Charlottenburg)",
      "registernummer": "HRA 63966",
      "registerart": "HRA",
      "company_name": "the operator UG (haftungsbeschränkt) & Co. KG",
      "company_seat": "Berlin",
      "details": "18.07.2025 (Bekanntmachungsdatum)\n\nBerlin Amtsgericht Berlin (Charlottenburg) HRA 63966\nRegisterbekanntmachung nach dem Umwandlungsgesetz 17.07.2025 (Eintragungsdatum)\n\nthe operator UG (haftungsbeschränkt) & Co. KG\nKommanditgesellschaft\nBerlin\n\nZu Eintragungsnummer 4 vom 17.07.2025 wird als nicht eingetragen veröffentlicht:Den Gläubigern der an der Verschmelzung beteiligten Rechtsträger ist, wenn sie binnen sechs Monaten nach dem Tag, an dem die Eintragung der Verschmelzung in das Register des Sitzes desjenigen Rechtsträgers, dessen Gläubiger sie sind, als bekannt gemacht gilt, ihren Anspruch nach Grund und Höhe schriftlich anmelden, Sicherheit zu leisten, soweit sie nicht Befriedigung verlangen können. Dieses Recht steht den Gläubigern jedoch nur zu, wenn sie glaubhaft machen, dass durch die Verschmelzung die Erfüllung ihrer Forderung gefährdet wird. Das Recht, Sicherheitsleistung zu verlangen, steht Gläubigern nicht zu, die im Falle der Insolvenz ein Recht auf vorzugsweise Befriedigung aus einer Deckungsmasse haben, die nach gesetzlicher Vorschrift zu ihrem Schutz errichtet und staatlich überwacht ist."
    },
    {
      "date": "2025-07-18",
      "id": "116513",
      "original_text": "Registerbekanntmachung nach dem Umwandlungsgesetz\nBaden-Württemberg Amtsgericht Stuttgart HRB 25127\nAllianz Global Benefits GmbH – Stuttgart",
      "type": "Registerbekanntmachung nach dem Umwandlungsgesetz",
      "state": "Baden-Württemberg",
      "amtsgericht": "Amtsgericht Stuttgart",
      "registernummer": "HRB 25127",
      "registerart": "HRB",
      "company_name": "Allianz Global Benefits GmbH",
      "company_seat": "Stuttgart",
      "details": "18.07.2025 (Bekanntmachungsdatum)\n\nBaden-Württemberg Amtsgericht Stuttgart HRB 25127\nRegisterbekanntmachung nach dem Umwandlungsgesetz 18.07.2025 (Eintragungsdatum)\n\nAllianz Global Benefits GmbH\nGesellschaft mit beschränkter Haftung\nStuttgart\n\nDen Gläubigern der an der Verschmelzung beteiligten Rechtsträger ist, wenn sie binnen sechs Monaten nach dem Tag, an dem die Eintragung der Verschmelzung in das Register des Sitzes desjenigen Rechtsträgers, dessen Gläubiger sie sind, nach § 19 Abs. 3 UmwG als bekanntgemacht gilt, ihren Anspruch nach Grund und Höhe schriftlich anmelden, Sicherheit zu leisten, soweit sie nicht Befriedigung verlangen können. Dieses Recht steht den Gläubigern jedoch nur zu, wenn sie glaubhaft machen, dass durch die Verschmelzung die Erfüllung ihrer Forderung gefährdet wird."
    },
    {
      "date": "2025-07-18",
      "id": "116514",
      "original_text": "Registerbekanntmachung nach dem Umwandlungsgesetz\nBaden-Württemberg Amtsgericht Mannheim HRA 712296\nSascha Fritz e.K. – Bühlertal",
      "type": "Registerbekanntmachung nach dem Umwandlungsgesetz",
      "state": "Baden-Württemberg",
      "amtsgericht": "Amtsgericht Mannheim",
      "registernummer": "HRA 712296",
      "registerart": "HRA",
      "company_name": "Sascha Fritz e.K.",
      "company_seat": "Bühlertal",
      "details": "18.07.2025 (Bekanntmachungsdatum)\n\nBaden-Württemberg Amtsgericht Mannheim HRA 712296\nRegisterbekanntmachung nach dem Umwandlungsgesetz 18.07.2025 (Eintragungsdatum)\n\nSascha Fritz e.K.\nEinzelkaufmann / Einzelkauffrau\nBühlertal\n\nAls nicht eingetragen wird bekanntgemacht:\nDen Gläubigern der an der Ausgliederung beteiligten Rechtsträger ist, wenn sie binnen sechs Monaten nach dem Tag, an dem die Eintragung der Ausgliederung in das Register des Sitzes desjenigen Rechtsträgers, dessen Gläubiger sie sind, nach § 19 Abs. 3 UmwG als bekanntgemacht gilt, ihren Anspruch nach Grund und Höhe schriftlich anmelden, Sicherheit zu leisten, soweit sie nicht Befriedigung verlangen können. Dieses Recht steht den Gläubigern jedoch nur zu, wenn sie glaubhaft machen, dass durch die Ausgliederung die Erfüllung ihrer Forderung gefährdet wird."
    },
    {
      "date": "2025-07-18",
      "id": "116515",
      "original_text": "Registerbekanntmachung nach dem Umwandlungsgesetz\nBaden-Württemberg Amtsgericht Stuttgart HRB 381373\nCHT Germany GmbH – Tübingen",
      "type": "Registerbekanntmachung nach dem Umwandlungsgesetz",
      "state": "Baden-Württemberg",
      "amtsgericht": "Amtsgericht Stuttgart",
      "registernummer": "HRB 381373",
      "registerart": "HRB",
      "company_name": "CHT Germany GmbH",
      "company_seat": "Tübingen",
      "details": "18.07.2025 (Bekanntmachungsdatum)\n\nBaden-Württemberg Amtsgericht Stuttgart HRB 381373\nRegisterbekanntmachung nach dem Umwandlungsgesetz 18.07.2025 (Eintragungsdatum)\n\nCHT Germany GmbH\nGesellschaft mit beschränkter Haftung\nTübingen\n\nDen Gläubigern der an der Verschmelzung beteiligten Rechtsträger ist, wenn sie binnen sechs Monaten nach dem Tag, an dem die Eintragung der Verschmelzung in das Register des Sitzes desjenigen Rechtsträgers, dessen Gläubiger sie sind, nach § 19 Abs. 3 UmwG als bekanntgemacht gilt, ihren Anspruch nach Grund und Höhe schriftlich anmelden, Sicherheit zu leisten, soweit sie nicht Befriedigung verlangen können. Dieses Recht steht den Gläubigern jedoch nur zu, wenn sie glaubhaft machen, dass durch die Verschmelzung die Erfüllung ihrer Forderung gefährdet wird."
    },
    {
      "date": "2025-07-18",
      "id": "116516",
      "original_text": "Einreichung neuer Dokumente\nHamburg Amtsgericht Hamburg HRB 6391\nKRAVAG-SACH Versicherung des Deutschen Kraftverkehrs Versicherungsverein auf Gegenseitigkeit – Hamburg",
      "type": "Einreichung neuer Dokumente",
      "state": "Hamburg",
      "amtsgericht": "Amtsgericht Hamburg",
      "registernummer": "HRB 6391",
      "registerart": "HRB",
      "company_name": "KRAVAG-SACH Versicherung des Deutschen Kraftverkehrs Versicherungsverein auf Gegenseitigkeit",
      "company_seat": "Hamburg",
      "details": "18.07.2025 (Bekanntmachungsdatum)\n\nHamburg Amtsgericht Hamburg HRB 6391\nEinreichung neuer Dokumente 18.07.2025 (Eintragungsdatum)\n\nKRAVAG-SACH Versicherung des Deutschen Kraftverkehrs Versicherungsverein auf Gegenseitigkeit\nVersicherungsverein auf Gegenseitigkeit\nHamburg\n\nAls nicht eingetragen wird bekannt gemacht: Liste des Aufsichtsrats wurde eingereicht."
    },
    {
      "date": "2025-07-18",
      "id": "116517",
      "original_text": "Registerbekanntmachung nach dem Umwandlungsgesetz\nBaden-Württemberg Amtsgericht Stuttgart HRA 734000\nEuromat e.K. Inh. Basil Yannopoulos – Vaihingen an der Enz",
      "type": "Registerbekanntmachung nach dem Umwandlungsgesetz",
      "state": "Baden-Württemberg",
      "amtsgericht": "Amtsgericht Stuttgart",
      "registernummer": "HRA 734000",
      "registerart": "HRA",
      "company_name": "Euromat e.K. Inh. Basil Yannopoulos",
      "company_seat": "Vaihingen an der Enz",
      "details": "18.07.2025 (Bekanntmachungsdatum)\n\nBaden-Württemberg Amtsgericht Stuttgart HRA 734000\nRegisterbekanntmachung nach dem Umwandlungsgesetz 18.07.2025 (Eintragungsdatum)\n\nEuromat e.K. Inh. Basil Yannopoulos\nEinzelkaufmann / Einzelkauffrau\nVaihingen an der Enz\n\nDen Gläubigern der an der Ausgliederung beteiligten Rechtsträger ist, wenn sie binnen sechs Monaten nach dem Tag, an dem die Eintragung der Ausgliederung in das Register des Sitzes desjenigen Rechtsträgers, dessen Gläubiger sie sind, nach § 19 Abs. 3 UmwG als bekanntgemacht gilt, ihren Anspruch nach Grund und Höhe schriftlich anmelden, Sicherheit zu leisten, soweit sie nicht Befriedigung verlangen können. Dieses Recht steht den Gläubigern jedoch nur zu, wenn sie glaubhaft machen, dass durch die Ausgliederung die Erfüllung ihrer Forderung gefährdet wird."
    },
    {
      "date": "2025-07-18",
      "id": "116518",
      "original_text": "Registerbekanntmachung nach dem Umwandlungsgesetz\nBaden-Württemberg Amtsgericht Stuttgart HRB 763453\nNY Automaten GmbH – Vaihingen an der Enz",
      "type": "Registerbekanntmachung nach dem Umwandlungsgesetz",
      "state": "Baden-Württemberg",
      "amtsgericht": "Amtsgericht Stuttgart",
      "registernummer": "HRB 763453",
      "registerart": "HRB",
      "company_name": "NY Automaten GmbH",
      "company_seat": "Vaihingen an der Enz",
      "details": "18.07.2025 (Bekanntmachungsdatum)\n\nBaden-Württemberg Amtsgericht Stuttgart HRB 763453\nRegisterbekanntmachung nach dem Umwandlungsgesetz 18.07.2025 (Eintragungsdatum)\n\nNY Automaten GmbH\nGesellschaft mit beschränkter Haftung\nVaihingen an der Enz\n\nAls nicht eingetragen wird bekanntgemacht:\nDen Gläubigern der an der Ausgliederung beteiligten Rechtsträger ist, wenn sie binnen sechs Monaten nach dem Tag, an dem die Eintragung der Ausgliederung in das Register des Sitzes desjenigen Rechtsträgers, dessen Gläubiger sie sind, nach § 19 Abs. 3 UmwG als bekanntgemacht gilt, ihren Anspruch nach Grund und Höhe schriftlich anmelden, Sicherheit zu leisten, soweit sie nicht Befriedigung verlangen können. Dieses Recht steht den Gläubigern jedoch nur zu, wenn sie glaubhaft machen, dass durch die Ausgliederung die Erfüllung ihrer Forderung gefährdet wird."
    },
    {
      "date": "2025-07-18",
      "id": "116519",
      "original_text": "Einreichung neuer Dokumente\nHamburg Amtsgericht Hamburg HRB 64830\nKRAVAG-ALLGEMEINE Versicherungs-Aktiengesellschaft – Hamburg",
      "type": "Einreichung neuer Dokumente",
      "state": "Hamburg",
      "amtsgericht": "Amtsgericht Hamburg",
      "registernummer": "HRB 64830",
      "registerart": "HRB",
      "company_name": "KRAVAG-ALLGEMEINE Versicherungs-Aktiengesellschaft",
      "company_seat": "Hamburg",
      "details": "18.07.2025 (Bekanntmachungsdatum)\n\nHamburg Amtsgericht Hamburg HRB 64830\nEinreichung neuer Dokumente 18.07.2025 (Eintragungsdatum)\n\nKRAVAG-ALLGEMEINE Versicherungs-Aktiengesellschaft\nAktiengesellschaft\nHamburg\n\nAls nicht eingetragen wird bekannt gemacht: Liste des Aufsichtsrats wurde eingereicht."
    },
    {
      "date": "2025-07-18",
      "id": "116520",
      "original_text": "Registerbekanntmachung nach dem Umwandlungsgesetz\nBaden-Württemberg Amtsgericht Freiburg HRA 610202\nFürstlich Fürstenbergische Brauerei GmbH & Co. KG – Donaueschingen",
      "type": "Registerbekanntmachung nach dem Umwandlungsgesetz",
      "state": "Baden-Württemberg",
      "amtsgericht": "Amtsgericht Freiburg",
      "registernummer": "HRA 610202",
      "registerart": "HRA",
      "company_name": "Fürstlich Fürstenbergische Brauerei GmbH & Co. KG",
      "company_seat": "Donaueschingen",
      "details": "18.07.2025 (Bekanntmachungsdatum)\n\nBaden-Württemberg Amtsgericht Freiburg HRA 610202\nRegisterbekanntmachung nach dem Umwandlungsgesetz 18.07.2025 (Eintragungsdatum)\n\nFürstlich Fürstenbergische Brauerei GmbH & Co. KG\nKommanditgesellschaft\nDonaueschingen\n\nDen Gläubigern der an der Ausgliederung beteiligten Rechtsträger ist, wenn sie binnen sechs Monaten nach dem Tag, an dem die Eintragung der Ausgliederung in das Register des Sitzes desjenigen Rechtsträgers, dessen Gläubiger sie sind, nach § 19 Abs. 3 UmwG als bekanntgemacht gilt, ihren Anspruch nach Grund und Höhe schriftlich anmelden, Sicherheit zu leisten, soweit sie nicht Befriedigung verlangen können. Dieses Recht steht den Gläubigern jedoch nur zu, wenn sie glaubhaft machen, dass durch die Ausgliederung die Erfüllung ihrer Forderung gefährdet wird."
    },
    {
      "date": "2025-07-18",
      "id": "116521",
      "original_text": "Einreichung neuer Dokumente\nBaden-Württemberg Amtsgericht Mannheim HRB 109922\nAudials AG – Karlsruhe",
      "type": "Einreichung neuer Dokumente",
      "state": "Baden-Württemberg",
      "amtsgericht": "Amtsgericht Mannheim",
      "registernummer": "HRB 109922",
      "registerart": "HRB",
      "company_name": "Audials AG",
      "company_seat": "Karlsruhe",
      "details": "18.07.2025 (Bekanntmachungsdatum)\n\nBaden-Württemberg Amtsgericht Mannheim HRB 109922\nEinreichung neuer Dokumente 18.07.2025 (Eintragungsdatum)\n\nAudials AG\nAktiengesellschaft\nKarlsruhe\n\nDie Gesellschaft hat am 17.07.2025 die Liste über die Zusammensetzung des Aufsichtsrats zum Handelsregister eingereicht."
    },
    {
      "date": "2025-07-18",
      "id": "116522",
      "original_text": "Einreichung neuer Dokumente\nBaden-Württemberg Amtsgericht Stuttgart HRB 728000\nThales Deutschland GmbH – Stuttgart",
      "type": "Einreichung neuer Dokumente",
      "state": "Baden-Württemberg",
      "amtsgericht": "Amtsgericht Stuttgart",
      "registernummer": "HRB 728000",
      "registerart": "HRB",
      "company_name": "Thales Deutschland GmbH",
      "company_seat": "Stuttgart",
      "details": "18.07.2025 (Bekanntmachungsdatum)\n\nBaden-Württemberg Amtsgericht Stuttgart HRB 728000\nEinreichung neuer Dokumente\n\nThales Deutschland GmbH\nGesellschaft mit beschränkter Haftung\nStuttgart\n\nDie Gesellschaft hat am 17.07.2025 die Liste über die Zusammensetzung des Aufsichtsrats zum Handelsregister eingereicht."
    },
    {
      "date": "2025-07-18",
      "id": "116523",
      "original_text": "Registerbekanntmachung nach dem Umwandlungsgesetz\nBrandenburg Amtsgericht Cottbus HRA 4396\nSchützenpunkt Inh, Michael Noack e.K. – Märkische Heide",
      "type": "Registerbekanntmachung nach dem Umwandlungsgesetz",
      "state": "Brandenburg",
      "amtsgericht": "Amtsgericht Cottbus",
      "registernummer": "HRA 4396",
      "registerart": "HRA",
      "company_name": "Schützenpunkt Inh, Michael Noack e.K.",
      "company_seat": "Märkische Heide",
      "details": "18.07.2025 (Bekanntmachungsdatum)\n\nBrandenburg Amtsgericht Cottbus HRA 4396\nRegisterbekanntmachung nach dem Umwandlungsgesetz 17.07.2025 (Eintragungsdatum)\n\nSchützenpunkt Inh, Michael Noack e.K.\nEinzelkaufmann / Einzelkauffrau\nMärkische Heide\n\nDen Gläubigern der an der Spaltung beteiligten Rechtsträger ist, wenn sie binnen sechs Monaten nach dem Tag, an dem die Eintragung der Spaltung in das Register des Sitzes desjenigen Rechtsträgers, dessen Gläubiger sie sind, als bekannt gemacht gilt, ihren Anspruch nach Grund und Höhe schriftlich anmelden, Sicherheit zu leisten, soweit sie nicht Befriedigung verlangen können. Dieses Recht steht den Gläubigern jedoch nur zu, wenn sie glaubhaft machen, dass durch die Spaltung die Erfüllung ihrer Forderung gefährdet wird"
    },
    {
      "date": "2025-07-18",
      "id": "116524",
      "original_text": "Registerbekanntmachung nach dem Umwandlungsgesetz\nSchleswig-Holstein Amtsgericht Pinneberg HRB 2147 IZ\nMay & Olde GmbH – Itzehoe",
      "type": "Registerbekanntmachung nach dem Umwandlungsgesetz",
      "state": "Schleswig-Holstein",
      "amtsgericht": "Amtsgericht Pinneberg",
      "registernummer": "HRB 2147 IZ",
      "registerart": "HRB",
      "company_name": "May & Olde GmbH",
      "company_seat": "Itzehoe",
      "details": "18.07.2025 (Bekanntmachungsdatum)\n\nSchleswig-Holstein Amtsgericht Pinneberg HRB 2147 IZ\nRegisterbekanntmachung nach dem Umwandlungsgesetz 18.07.2025 (Eintragungsdatum)\n\nMay & Olde GmbH\nGesellschaft mit beschränkter Haftung\nItzehoe\n\nZu Eintragungsnummer 10 vom 18.07.2025 wird als nicht eingetragen veröffentlicht:  Als nicht eingetragen wird veröffentlicht: Den Gläubigern der an der Verschmelzung beteiligten Rechtsträger ist, wenn sie binnen sechs Monaten nach dem Tag, an dem die Eintragung der Verschmelzung in das Register des Sitzes desjenigen Rechtsträgers, dessen Gläubiger sie sind, als bekannt gemacht gilt, ihren Anspruch nach Grund und Höhe schriftlich anmelden, Sicherheit zu leisten, soweit sie nicht Befriedigung verlangen können. Dieses Recht steht den Gläubigern jedoch nur zu, wenn sie glaubhaft machen, dass durch die Verschmelzung die Erfüllung ihrer Forderung gefährdet wird. Das Recht, Sicherheitsleistung zu verlangen, steht Gläubigern nicht zu, die im Falle der Insolvenz ein Recht auf vorzugsweise Befriedigung aus einer Deckungsmasse haben, die nach gesetzlicher Vorschrift zu ihrem Schutz errichtet und staatlich überwacht ist."
    },
    {
      "date": "2025-07-18",
      "id": "116525",
      "original_text": "Einreichung neuer Dokumente\nBaden-Württemberg Amtsgericht Freiburg HRB 5230\nTAXI Freiburg 55 55 55 GmbH – Freiburg im Breisgau",
      "type": "Einreichung neuer Dokumente",
      "state": "Baden-Württemberg",
      "amtsgericht": "Amtsgericht Freiburg",
      "registernummer": "HRB 5230",
      "registerart": "HRB",
      "company_name": "TAXI Freiburg 55 55 55 GmbH",
      "company_seat": "Freiburg im Breisgau",
      "details": "18.07.2025 (Bekanntmachungsdatum)\n\nBaden-Württemberg Amtsgericht Freiburg HRB 5230\nEinreichung neuer Dokumente 18.07.2025 (Eintragungsdatum)\n\nTAXI Freiburg 55 55 55 GmbH\nGesellschaft mit beschränkter Haftung\nFreiburg im Breisgau\n\nDie Gesellschaft hat am 17.07.2025 die Liste über die Zusammensetzung des Aufsichtsrats zum Handelsregister eingereicht."
    },
    {
      "date": "2025-07-18",
      "id": "116526",
      "original_text": "Registerbekanntmachung nach dem Umwandlungsgesetz\nSchleswig-Holstein Amtsgericht Pinneberg HRB 17388\nStrandfloh Management GmbH – Kollmar",
      "type": "Registerbekanntmachung nach dem Umwandlungsgesetz",
      "state": "Schleswig-Holstein",
      "amtsgericht": "Amtsgericht Pinneberg",
      "registernummer": "HRB 17388",
      "registerart": "HRB",
      "company_name": "Strandfloh Management GmbH",
      "company_seat": "Kollmar",
      "details": "18.07.2025 (Bekanntmachungsdatum)\n\nSchleswig-Holstein Amtsgericht Pinneberg HRB 17388\nRegisterbekanntmachung nach dem Umwandlungsgesetz 17.07.2025 (Eintragungsdatum)\n\nStrandfloh Management GmbH\nGesellschaft mit beschränkter Haftung\nKollmar\n\nZu Eintragungsnummer 5 vom 17.07.2025 wird als nicht eingetragen veröffentlicht:  Als nicht eingetragen wird veröffentlicht: Den Gläubigern der an der Verschmelzung beteiligten Rechtsträger ist, wenn sie binnen sechs Monaten nach dem Tag, an dem die Eintragung der Verschmelzung in das Register des Sitzes desjenigen Rechtsträgers, dessen Gläubiger sie sind, als bekannt gemacht gilt, ihren Anspruch nach Grund und Höhe schriftlich anmelden, Sicherheit zu leisten, soweit sie nicht Befriedigung verlangen können. Dieses Recht steht den Gläubigern jedoch nur zu, wenn sie glaubhaft machen, dass durch die Verschmelzung die Erfüllung ihrer Forderung gefährdet wird. Das Recht, Sicherheitsleistung zu verlangen, steht Gläubigern nicht zu, die im Falle der Insolvenz ein Recht auf vorzugsweise Befriedigung aus einer Deckungsmasse haben, die nach gesetzlicher Vorschrift zu ihrem Schutz errichtet und staatlich überwacht ist."
    },
    {
      "date": "2025-07-18",
      "id": "116527",
      "original_text": "Registerbekanntmachung nach dem Umwandlungsgesetz\nSchleswig-Holstein Amtsgericht Pinneberg HRB 17436\nStrandfloh Bielenberg GmbH – Kollmar",
      "type": "Registerbekanntmachung nach dem Umwandlungsgesetz",
      "state": "Schleswig-Holstein",
      "amtsgericht": "Amtsgericht Pinneberg",
      "registernummer": "HRB 17436",
      "registerart": "HRB",
      "company_name": "Strandfloh Bielenberg GmbH",
      "company_seat": "Kollmar",
      "details": "18.07.2025 (Bekanntmachungsdatum)\n\nSchleswig-Holstein Amtsgericht Pinneberg HRB 17436\nRegisterbekanntmachung nach dem Umwandlungsgesetz 17.07.2025 (Eintragungsdatum)\n\nStrandfloh Bielenberg GmbH\nGesellschaft mit beschränkter Haftung\nKollmar\n\nZu Eintragungsnummer 5 vom 17.07.2025 wird als nicht eingetragen veröffentlicht: Den Gläubigern der an der Verschmelzung beteiligten Rechtsträger ist, wenn sie binnen sechs Monaten nach dem Tag, an dem die Eintragung der Verschmelzung in das Register des Sitzes desjenigen Rechtsträgers, dessen Gläubiger sie sind, als bekannt gemacht gilt, ihren Anspruch nach Grund und Höhe schriftlich anmelden, Sicherheit zu leisten, soweit sie nicht Befriedigung verlangen können. Dieses Recht steht den Gläubigern jedoch nur zu, wenn sie glaubhaft machen, dass durch die Verschmelzung die Erfüllung ihrer Forderung gefährdet wird. Das Recht, Sicherheitsleistung zu verlangen, steht Gläubigern nicht zu, die im Falle der Insolvenz ein Recht auf vorzugsweise Befriedigung aus einer Deckungsmasse haben, die nach gesetzlicher Vorschrift zu ihrem Schutz errichtet und staatlich überwacht ist."
    },
    {
      "date": "2025-07-18",
      "id": "116528",
      "original_text": "Registerbekanntmachung nach dem Umwandlungsgesetz\nBaden-Württemberg Amtsgericht Stuttgart HRB 775407\nAUDERE LC-Invest No. 1 GmbH – Fellbach",
      "type": "Registerbekanntmachung nach dem Umwandlungsgesetz",
      "state": "Baden-Württemberg",
      "amtsgericht": "Amtsgericht Stuttgart",
      "registernummer": "HRB 775407",
      "registerart": "HRB",
      "company_name": "AUDERE LC-Invest No. 1 GmbH",
      "company_seat": "Fellbach",
      "details": "18.07.2025 (Bekanntmachungsdatum)\n\nBaden-Württemberg Amtsgericht Stuttgart HRB 775407\nRegisterbekanntmachung nach dem Umwandlungsgesetz 18.07.2025 (Eintragungsdatum)\n\nAUDERE LC-Invest No. 1 GmbH\nGesellschaft mit beschränkter Haftung\nFellbach\n\nDen Gläubigern der an der Verschmelzung beteiligten Rechtsträger ist, wenn sie binnen sechs Monaten nach dem Tag, an dem die Eintragung der Verschmelzung in das Register des Sitzes desjenigen Rechtsträgers, dessen Gläubiger sie sind, nach § 19 Abs. 3 UmwG als bekanntgemacht gilt, ihren Anspruch nach Grund und Höhe schriftlich anmelden, Sicherheit zu leisten, soweit sie nicht Befriedigung verlangen können. Dieses Recht steht den Gläubigern jedoch nur zu, wenn sie glaubhaft machen, dass durch die Verschmelzung die Erfüllung ihrer Forderung gefährdet wird."
    },
    {
      "date": "2025-07-18",
      "id": "116529",
      "original_text": "Registerbekanntmachung nach dem Umwandlungsgesetz\nBaden-Württemberg Amtsgericht Mannheim HRA 712513\nOculus Medicina GmbH & Co. KG – Ubstadt-Weiher",
      "type": "Registerbekanntmachung nach dem Umwandlungsgesetz",
      "state": "Baden-Württemberg",
      "amtsgericht": "Amtsgericht Mannheim",
      "registernummer": "HRA 712513",
      "registerart": "HRA",
      "company_name": "Oculus Medicina GmbH & Co. KG",
      "company_seat": "Ubstadt-Weiher",
      "details": "18.07.2025 (Bekanntmachungsdatum)\n\nBaden-Württemberg Amtsgericht Mannheim HRA 712513\nRegisterbekanntmachung nach dem Umwandlungsgesetz 18.07.2025 (Eintragungsdatum)\n\nOculus Medicina GmbH & Co. KG\nKommanditgesellschaft\nUbstadt-Weiher\n\nAls nicht eingetragen wird bekanntgemacht:\nDen Gläubigern der an der Verschmelzung beteiligten Rechtsträger ist, wenn sie binnen sechs Monaten nach dem Tag, an dem die Eintragung der Verschmelzung in das Register des Sitzes desjenigen Rechtsträgers, dessen Gläubiger sie sind, nach § 19 Abs. 3 UmwG als bekanntgemacht gilt, ihren Anspruch nach Grund und Höhe schriftlich anmelden, Sicherheit zu leisten, soweit sie nicht Befriedigung verlangen können. Dieses Recht steht den Gläubigern jedoch nur zu, wenn sie glaubhaft machen, dass durch die Verschmelzung die Erfüllung ihrer Forderung gefährdet wird."
    },
    {
      "date": "2025-07-18",
      "id": "116530",
      "original_text": "Sonstige Registerbekanntmachung\nHamburg Amtsgericht Hamburg HRB 161722\nWintershall Dea Deutschland GmbH – Hamburg",
      "type": "Sonstige Registerbekanntmachung",
      "state": "Hamburg",
      "amtsgericht": "Amtsgericht Hamburg",
      "registernummer": "HRB 161722",
      "registerart": "HRB",
      "company_name": "Wintershall Dea Deutschland GmbH",
      "company_seat": "Hamburg",
      "details": "18.07.2025 (Bekanntmachungsdatum)\n\nHamburg Amtsgericht Hamburg HRB 161722\nSonstige Registerbekanntmachung\n\nWintershall Dea Deutschland GmbH\nGesellschaft mit beschränkter Haftung\nHamburg\n\nAls nicht eingetragen wird bekannt gemacht: Liste des Aufsichtsrats wurde eingereicht."
    },
    {
      "date": "2025-07-18",
      "id": "116531",
      "original_text": "Löschungsankündigung\nBerlin Amtsgericht Berlin (Charlottenburg) HRA 25373\nOctave und Lücke Grundstücksverwaltungs GmbH & Co. Bundesallee 159 KG – Berlin",
      "type": "Löschungsankündigung",
      "state": "Berlin",
      "amtsgericht": "Amtsgericht Berlin (Charlottenburg)",
      "registernummer": "HRA 25373",
      "registerart": "HRA",
      "company_name": "Octave und Lücke Grundstücksverwaltungs GmbH & Co. Bundesallee 159 KG",
      "company_seat": "Berlin",
      "details": "18.07.2025 (Bekanntmachungsdatum)\n\nBerlin Amtsgericht Berlin (Charlottenburg) HRA 25373\nLöschungsankündigung\n\nOctave und Lücke Grundstücksverwaltungs GmbH & Co. Bundesallee 159 KG\nKommanditgesellschaft\nBerlin\n\nBei dem nachstehenden Unternehmen / der nachstehenden Gesellschaft wird das Amtslöschungsverfahren gemäß § 31 Abs. 2 HGB eingeleitet. Widerspruchsfrist 2  Monate"
    },
    {
      "date": "2025-07-18",
      "id": "116532",
      "original_text": "Löschungsankündigung\nBaden-Württemberg Amtsgericht Mannheim HRB 210391\nMUNDART GmbH Dentallabor Oliver Frank – Bühl",
      "type": "Löschungsankündigung",
      "state": "Baden-Württemberg",
      "amtsgericht": "Amtsgericht Mannheim",
      "registernummer": "HRB 210391",
      "registerart": "HRB",
      "company_name": "MUNDART GmbH Dentallabor Oliver Frank",
      "company_seat": "Bühl",
      "details": "18.07.2025 (Bekanntmachungsdatum)\n\nBaden-Württemberg Amtsgericht Mannheim HRB 210391\nLöschungsankündigung\n\nMUNDART GmbH Dentallabor Oliver Frank\nGesellschaft mit beschränkter Haftung\nBühl\n\nDas Gericht beabsichtigt, die Gesellschaft wegen Vermögenslosigkeit im Handelsregister von Amts wegen nach § 394 FamFG zu löschen. Die Frist zur Geltendmachung eines Widerspruchs gegen die beabsichtigte Löschung ist auf einen Monat ab Veröffentlichung bestimmt."
    },
    {
      "date": "2025-07-18",
      "id": "116533",
      "original_text": "Löschungsankündigung\nBerlin Amtsgericht Berlin (Charlottenburg) HRB 187544\nAS-Berlin Service GmbH – Berlin",
      "type": "Löschungsankündigung",
      "state": "Berlin",
      "amtsgericht": "Amtsgericht Berlin (Charlottenburg)",
      "registernummer": "HRB 187544",
      "registerart": "HRB",
      "company_name": "AS-Berlin Service GmbH",
      "company_seat": "Berlin",
      "details": "18.07.2025 (Bekanntmachungsdatum)\n\nBerlin Amtsgericht Berlin (Charlottenburg) HRB 187544\nLöschungsankündigung\n\nAS-Berlin Service GmbH\nGesellschaft mit beschränkter Haftung\nBerlin\n\nBei der nachstehenden Gesellschaft wird das Amtslöschungsverfahren gemäß § 394 FamFG eingeleitet. Widerspruchsfrist 6 Wochen"
    },
    {
      "date": "2025-07-18",
      "id": "116534",
      "original_text": "Sonstige Registerbekanntmachung\nBerlin Amtsgericht Berlin (Charlottenburg) HRB 180168\nSAPCORDA SERVICES GmbH – Berlin",
      "type": "Sonstige Registerbekanntmachung",
      "state": "Berlin",
      "amtsgericht": "Amtsgericht Berlin (Charlottenburg)",
      "registernummer": "HRB 180168",
      "registerart": "HRB",
      "company_name": "SAPCORDA SERVICES GmbH",
      "company_seat": "Berlin",
      "details": "18.07.2025 (Bekanntmachungsdatum)\n\nBerlin Amtsgericht Berlin (Charlottenburg) HRB 180168\nSonstige Registerbekanntmachung\n\nSAPCORDA SERVICES GmbH\nGesellschaft mit beschränkter Haftung\nBerlin\n\nAls nicht eingetragen wird veröffentlicht: Den Gläubigern der an der Verschmelzung beteiligten Rechtsträger ist, wenn sie binnen sechs Monaten nach dem Tag, an dem die Eintragung der Verschmelzung in das Register des Sitzes desjenigen Rechtsträgers, dessen Gläubiger sie sind, als bekannt gemacht gilt, ihren Anspruch nach Grund und Höhe schriftlich anmelden, Sicherheit zu leisten, soweit sie nicht Befriedigung verlangen können. Dieses Recht steht den Gläubigern jedoch nur zu, wenn sie glaubhaft machen, dass durch die Verschmelzung die Erfüllung ihrer Forderung gefährdet wird. Das Recht, Sicherheitsleistung zu verlangen, steht Gläubigern nicht zu, die im Falle der Insolvenz ein Recht auf vorzugsweise Befriedigung aus einer Deckungsmasse haben, die nach gesetzlicher Vorschrift zu ihrem Schutz errichtet und staatlich überwacht ist."
    },
    {
      "date": "2025-07-18",
      "id": "116535",
      "original_text": "Registerbekanntmachung nach dem Umwandlungsgesetz\nHamburg Amtsgericht Hamburg HRB 159976\nHSP7 Elbe GmbH – Hamburg",
      "type": "Registerbekanntmachung nach dem Umwandlungsgesetz",
      "state": "Hamburg",
      "amtsgericht": "Amtsgericht Hamburg",
      "registernummer": "HRB 159976",
      "registerart": "HRB",
      "company_name": "HSP7 Elbe GmbH",
      "company_seat": "Hamburg",
      "details": "18.07.2025 (Bekanntmachungsdatum)\n\nHamburg Amtsgericht Hamburg HRB 159976\nRegisterbekanntmachung nach dem Umwandlungsgesetz 18.07.2025 (Eintragungsdatum)\n\nHSP7 Elbe GmbH\nGesellschaft mit beschränkter Haftung\nHamburg\n\nAls nicht eingetragen wird bekannt gemacht:\nDen Gläubigern der an der Verschmelzung beteiligten Gesellschaften ist, wenn sie binnen sechs Monaten nach dem Tag, an dem die Eintragung der Verschmelzung in das Register des Sitzes desjenigen Rechtsträgers, dessen Gläubiger sie sind, nach § 19 Absatz 3 UmwG als bekannt gemacht gilt, ihren Anspruch nach Grund und Höhe schriftlich anmelden, Sicherheit zu leisten, soweit sie nicht Befriedigung verlangen können. Dieses Recht steht den Gläubigern jedoch nur zu, wenn sie glaubhaft machen, dass durch die Verschmelzung die Erfüllung ihrer Forderung gefährdet wird."
    },
    {
      "date": "2025-07-18",
      "id": "116536",
      "original_text": "Registerbekanntmachung nach dem Umwandlungsgesetz\nHamburg Amtsgericht Hamburg HRB 160738\nHSP7 Bramfeld GmbH – Hamburg",
      "type": "Registerbekanntmachung nach dem Umwandlungsgesetz",
      "state": "Hamburg",
      "amtsgericht": "Amtsgericht Hamburg",
      "registernummer": "HRB 160738",
      "registerart": "HRB",
      "company_name": "HSP7 Bramfeld GmbH",
      "company_seat": "Hamburg",
      "details": "18.07.2025 (Bekanntmachungsdatum)\n\nHamburg Amtsgericht Hamburg HRB 160738\nRegisterbekanntmachung nach dem Umwandlungsgesetz 18.07.2025 (Eintragungsdatum)\n\nHSP7 Bramfeld GmbH\nGesellschaft mit beschränkter Haftung\nHamburg\n\nAls nicht eingetragen wird bekannt gemacht:\nDen Gläubigern der an der Verschmelzung beteiligten Gesellschaften ist, wenn sie binnen sechs Monaten nach dem Tag, an dem die Eintragung der Verschmelzung in das Register des Sitzes desjenigen Rechtsträgers, dessen Gläubiger sie sind, nach § 19 Absatz 3 UmwG als bekannt gemacht gilt, ihren Anspruch nach Grund und Höhe schriftlich anmelden, Sicherheit zu leisten, soweit sie nicht Befriedigung verlangen können. Dieses Recht steht den Gläubigern jedoch nur zu, wenn sie glaubhaft machen, dass durch die Verschmelzung die Erfüllung ihrer Forderung gefährdet wird."
    },
    {
      "date": "2025-07-18",
      "id": "116537",
      "original_text": "Einreichung neuer Dokumente\nBerlin Amtsgericht Berlin (Charlottenburg) HRB 99726\nBSK 1818 AG – Berlin",
      "type": "Einreichung neuer Dokumente",
      "state": "Berlin",
      "amtsgericht": "Amtsgericht Berlin (Charlottenburg)",
      "registernummer": "HRB 99726",
      "registerart": "HRB",
      "company_name": "BSK 1818 AG",
      "company_seat": "Berlin",
      "details": "18.07.2025 (Bekanntmachungsdatum)\n\nBerlin Amtsgericht Berlin (Charlottenburg) HRB 99726\nEinreichung neuer Dokumente\n\nBSK 1818 AG\nAktiengesellschaft\nBerlin\n\nAls nicht eingetragen wird veröffentlicht: Es wurde eine neue Liste der Aufsichtsratsmitglieder eingereicht (§ 106 AktG)."
    },
    {
      "date": "2025-07-18",
      "id": "116538",
      "original_text": "Löschungsankündigung\nHamburg Amtsgericht Hamburg HRB 91483\nMM Simson Logistik GmbH – Hamburg",
      "type": "Löschungsankündigung",
      "state": "Hamburg",
      "amtsgericht": "Amtsgericht Hamburg",
      "registernummer": "HRB 91483",
      "registerart": "HRB",
      "company_name": "MM Simson Logistik GmbH",
      "company_seat": "Hamburg",
      "details": "18.07.2025 (Bekanntmachungsdatum)\n\nHamburg Amtsgericht Hamburg HRB 91483\nLöschungsankündigung\n\nMM Simson Logistik GmbH\nGesellschaft mit beschränkter Haftung\nHamburg\n\nDas Registergericht beabsichtigt, die im Handelsregister eingetragene Gesellschaft von Amts wegen nach § 394 FamFG zu löschen. Die Frist zur Erhebung eines Widerspruchs gegen die beabsichtigte Löschung wird auf 3 Monate festgesetzt."
    },
    {
      "date": "2025-07-18",
      "id": "116539",
      "original_text": "Registerbekanntmachung nach dem Umwandlungsgesetz\nHamburg Amtsgericht Hamburg HRB 156340\nDeutsche Gesellschaft für Kreuzfahrtmedizin mbH – Hamburg",
      "type": "Registerbekanntmachung nach dem Umwandlungsgesetz",
      "state": "Hamburg",
      "amtsgericht": "Amtsgericht Hamburg",
      "registernummer": "HRB 156340",
      "registerart": "HRB",
      "company_name": "Deutsche Gesellschaft für Kreuzfahrtmedizin mbH",
      "company_seat": "Hamburg",
      "details": "18.07.2025 (Bekanntmachungsdatum)\n\nHamburg Amtsgericht Hamburg HRB 156340\nRegisterbekanntmachung nach dem Umwandlungsgesetz 18.07.2025 (Eintragungsdatum)\n\nDeutsche Gesellschaft für Kreuzfahrtmedizin mbH\nGesellschaft mit beschränkter Haftung\nHamburg\n\nAls nicht eingetragen wird bekannt gemacht:\nDen Gläubigern der an der Verschmelzung beteiligten Gesellschaften ist, wenn sie binnen sechs Monaten nach dem Tag, an dem die Eintragung der Verschmelzung in das Register des Sitzes desjenigen Rechtsträgers, dessen Gläubiger sie sind, nach § 19 Absatz 3 UmwG als bekannt gemacht gilt, ihren Anspruch nach Grund und Höhe schriftlich anmelden, Sicherheit zu leisten, soweit sie nicht Befriedigung verlangen können. Dieses Recht steht den Gläubigern jedoch nur zu, wenn sie glaubhaft machen, dass durch die Verschmelzung die Erfüllung ihrer Forderung gefährdet wird."
    },
    {
      "date": "2025-07-18",
      "id": "116540",
      "original_text": "Löschungsankündigung\nHamburg Amtsgericht Hamburg HRA 104791\nO.S.T. Olaf Smoczynski Transporte e.K. – Hamburg",
      "type": "Löschungsankündigung",
      "state": "Hamburg",
      "amtsgericht": "Amtsgericht Hamburg",
      "registernummer": "HRA 104791",
      "registerart": "HRA",
      "company_name": "O.S.T. Olaf Smoczynski Transporte e.K.",
      "company_seat": "Hamburg",
      "details": "18.07.2025 (Bekanntmachungsdatum)\n\nHamburg Amtsgericht Hamburg HRA 104791\nLöschungsankündigung\n\nO.S.T. Olaf Smoczynski Transporte e.K.\nEinzelkaufmann\nHamburg\n\nDas Registergericht beabsichtigt, die im Handelsregister eingetragene Firma von Amts wegen nach § 31 Abs. 2 HBG zu löschen. Die Frist zur Erhebung eines Widerspruchs gegen die beabsichtigte Löschung wird auf 3 Monate festgesetzt."
    },
    {
      "date": "2025-07-18",
      "id": "116541",
      "original_text": "Löschungsankündigung\nHamburg Amtsgericht Hamburg HRB 116428\nMEHRI Immobilien GmbH – Hamburg",
      "type": "Löschungsankündigung",
      "state": "Hamburg",
      "amtsgericht": "Amtsgericht Hamburg",
      "registernummer": "HRB 116428",
      "registerart": "HRB",
      "company_name": "MEHRI Immobilien GmbH",
      "company_seat": "Hamburg",
      "details": "18.07.2025 (Bekanntmachungsdatum)\n\nHamburg Amtsgericht Hamburg HRB 116428\nLöschungsankündigung\n\nMEHRI Immobilien GmbH\nGesellschaft mit beschränkter Haftung\nHamburg\n\nDas Registergericht beabsichtigt, die im Handelsregister eingetragene Gesellschaft von Amts wegen nach § 394 FamFG zu löschen. Die Frist zur Erhebung eines Widerspruchs gegen die beabsichtigte Löschung wird auf 3 Monate festgesetzt."
    },
    {
      "date": "2025-07-18",
      "id": "116542",
      "original_text": "Löschungsankündigung\nHamburg Amtsgericht Hamburg HRB 96220\nSOLUTIONS Branding & Design Companies AG – Hamburg",
      "type": "Löschungsankündigung",
      "state": "Hamburg",
      "amtsgericht": "Amtsgericht Hamburg",
      "registernummer": "HRB 96220",
      "registerart": "HRB",
      "company_name": "SOLUTIONS Branding & Design Companies AG",
      "company_seat": "Hamburg",
      "details": "18.07.2025 (Bekanntmachungsdatum)\n\nHamburg Amtsgericht Hamburg HRB 96220\nLöschungsankündigung\n\nSOLUTIONS Branding & Design Companies AG\nAktiengesellschaft\nHamburg\n\nDas Registergericht beabsichtigt, die im Handelsregister eingetragene Gesellschaft von Amts wegen nach § 394 FamFG zu löschen. Die Frist zur Erhebung eines Widerspruchs gegen die beabsichtigte Löschung wird auf 3 Monate festgesetzt."
    },
    {
      "date": "2025-07-18",
      "id": "116543",
      "original_text": "Löschungsankündigung\nHamburg Amtsgericht Hamburg HRB 108856\nMalikzada Vertriebs- und Warenhandelsgesellschaft mbH – Hamburg",
      "type": "Löschungsankündigung",
      "state": "Hamburg",
      "amtsgericht": "Amtsgericht Hamburg",
      "registernummer": "HRB 108856",
      "registerart": "HRB",
      "company_name": "Malikzada Vertriebs- und Warenhandelsgesellschaft mbH",
      "company_seat": "Hamburg",
      "details": "18.07.2025 (Bekanntmachungsdatum)\n\nHamburg Amtsgericht Hamburg HRB 108856\nLöschungsankündigung\n\nMalikzada Vertriebs- und Warenhandelsgesellschaft mbH\nGesellschaft mit beschränkter Haftung\nHamburg\n\nDas Registergericht beabsichtigt, die im Handelsregister eingetragene Gesellschaft von Amts wegen nach § 394 FamFG zu löschen. Die Frist zur Erhebung eines Widerspruchs gegen die beabsichtigte Löschung wird auf 3 Monate festgesetzt."
    },
    {
      "date": "2025-07-18",
      "id": "116544",
      "original_text": "Löschungsankündigung\nHamburg Amtsgericht Hamburg HRB 146548\nMTE-Food Logistik GmbH – Hamburg",
      "type": "Löschungsankündigung",
      "state": "Hamburg",
      "amtsgericht": "Amtsgericht Hamburg",
      "registernummer": "HRB 146548",
      "registerart": "HRB",
      "company_name": "MTE-Food Logistik GmbH",
      "company_seat": "Hamburg",
      "details": "18.07.2025 (Bekanntmachungsdatum)\n\nHamburg Amtsgericht Hamburg HRB 146548\nLöschungsankündigung\n\nMTE-Food Logistik GmbH\nGesellschaft mit beschränkter Haftung\nHamburg\n\nDas Registergericht beabsichtigt, die im Handelsregister eingetragene Gesellschaft von Amts wegen nach § 394 FamFG zu löschen. Die Frist zur Erhebung eines Widerspruchs gegen die beabsichtigte Löschung wird auf 3 Monate festgesetzt."
    },
    {
      "date": "2025-07-18",
      "id": "116545",
      "original_text": "Löschungsankündigung\nHamburg Amtsgericht Hamburg HRB 153583\nCMH Dienstleistung GmbH – Hamburg",
      "type": "Löschungsankündigung",
      "state": "Hamburg",
      "amtsgericht": "Amtsgericht Hamburg",
      "registernummer": "HRB 153583",
      "registerart": "HRB",
      "company_name": "CMH Dienstleistung GmbH",
      "company_seat": "Hamburg",
      "details": "18.07.2025 (Bekanntmachungsdatum)\n\nHamburg Amtsgericht Hamburg HRB 153583\nLöschungsankündigung\n\nCMH Dienstleistung GmbH\nGesellschaft mit beschränkter Haftung\nHamburg\n\nNach Mitteilung des Bezirksamtes Hamburg-Mitte wurde dem Geschäftsführer Colin Williams durch Bescheid vom 19.05.2025, bestandskräftig seit dem 23.06.2025, (M/VS 1111/736.00-05/13/14/25), der Betrieb eines Sicherheitsdienste, Ordnerdienste, Event-Management, Veranstaltungs- und Eventschutz, Setsicherheit und Nachtwachen, Objekt- und Baustellenüberwachung, Bereitstellung von Servicekräften für Events- und Veranstaltugen, sowie jeden Gewerbes, für das § 35 Gewerbeordnung (GewO) gilt, sowie ihm auch die Tätigkeit als mit der Leitung eines Gewerbebetriebes und als Vertretungsberechtigter eines Gewerbetreibenden untersagt.\n\nGemäß § 6 Abs. 2 S. 2 Nr. 2 des Gesetzes betreffend die Gesellschaften mit beschränkter Haftung (GmbHG) kann er infolgedessen kein Geschäftsführer der CMH Dienstleistung GmbH mehr sein.\n\nSeine Eintragung als Geschäftsführer ist damit wegen des Mangels einer wesentlichen Voraussetzung unzulässig geworden.\n\nDas Registergericht beabsichtigt daher, die Eintragung des Geschäftsführers Colin Williams als Geschäftsführer gemäß § 395 des Gesetzes über das Verfahren in Familiensachen und in Angelegenheiten der freiwilligen Gerichtsbarkeit (FamFG) von Amts wegen aus dem Handelsregister zu löschen.\n\nHiermit erfolgt die Benachrichtigung über die beabsichtigte Löschung.\n\nEs wird Gelegenheit gegeben, gegen die beabsichtigte Löschung innerhalb von einem Monat seit ihrer schriftlichen Bekanntgabe Widerspruch beim\n\nAmtsgericht Hamburg - Registergericht -, Caffamacherreihe 20, 20355 Hamburg,\n\nschriftlich oder zur Niederschrift der Geschäftsstelle oder des Rechtspflegers einzulegen.\nDer Widerspruch kann auch zu Protokoll der Geschäftsstelle eines anderen Amtsgerichtes erfolgen. In diesem Falle ist die Frist nur dann gewahrt, wenn das den Widerspruch enthaltende Protokoll innerhalb der Frist bei dem Registergericht eingeht.\n\nSofern hier binnen der genannten Frist kein Widerspruch eingeht, wird das Gericht die genannte Eintragung von Amts wegen löschen."
    },
    {
      "date": "2025-07-18",
      "id": "116546",
      "original_text": "Löschungsankündigung\nHamburg Amtsgericht Hamburg HRB 131458\nHamburg Vanport GmbH – Hamburg",
      "type": "Löschungsankündigung",
      "state": "Hamburg",
      "amtsgericht": "Amtsgericht Hamburg",
      "registernummer": "HRB 131458",
      "registerart": "HRB",
      "company_name": "Hamburg Vanport GmbH",
      "company_seat": "Hamburg",
      "details": "18.07.2025 (Bekanntmachungsdatum)\n\nHamburg Amtsgericht Hamburg HRB 131458\nLöschungsankündigung\n\nHamburg Vanport GmbH\nGesellschaft mit beschränkter Haftung\nHamburg\n\nDas Registergericht beabsichtigt, die im Handelsregister eingetragene Gesellschaft von Amts wegen nach § 394 FamFG zu löschen. Die Frist zur Erhebung eines Widerspruchs gegen die beabsichtigte Löschung wird auf 3 Monate festgesetzt."
    },
    {
      "date": "2025-07-18",
      "id": "116547",
      "original_text": "Löschungsankündigung\nHamburg Amtsgericht Hamburg HRB 122457\nWORLD OF FITNESS GmbH Vertrieb von Mode- und Sportartikeln – Hamburg",
      "type": "Löschungsankündigung",
      "state": "Hamburg",
      "amtsgericht": "Amtsgericht Hamburg",
      "registernummer": "HRB 122457",
      "registerart": "HRB",
      "company_name": "WORLD OF FITNESS GmbH Vertrieb von Mode- und Sportartikeln",
      "company_seat": "Hamburg",
      "details": "18.07.2025 (Bekanntmachungsdatum)\n\nHamburg Amtsgericht Hamburg HRB 122457\nLöschungsankündigung\n\nWORLD OF FITNESS GmbH Vertrieb von Mode- und Sportartikeln\nGesellschaft mit beschränkter Haftung\nHamburg\n\nDas Registergericht beabsichtigt, die im Handelsregister eingetragene Gesellschaft von Amts wegen nach § 394 FamFG zu löschen. Die Frist zur Erhebung eines Widerspruchs gegen die beabsichtigte Löschung wird auf 3 Monate festgesetzt."
    },
    {
      "date": "2025-07-18",
      "id": "116548",
      "original_text": "Löschungsankündigung\nHamburg Amtsgericht Hamburg HRB 138285\nURFALI GmbH – Hamburg",
      "type": "Löschungsankündigung",
      "state": "Hamburg",
      "amtsgericht": "Amtsgericht Hamburg",
      "registernummer": "HRB 138285",
      "registerart": "HRB",
      "company_name": "URFALI GmbH",
      "company_seat": "Hamburg",
      "details": "18.07.2025 (Bekanntmachungsdatum)\n\nHamburg Amtsgericht Hamburg HRB 138285\nLöschungsankündigung\n\nURFALI GmbH\nGesellschaft mit beschränkter Haftung\nHamburg\n\nDas Registergericht beabsichtigt, die im Handelsregister eingetragene Gesellschaft von Amts wegen nach § 394 FamFG zu löschen. Die Frist zur Erhebung eines Widerspruchs gegen die beabsichtigte Löschung wird auf 3 Monate festgesetzt."
    },
    {
      "date": "2025-07-18",
      "id": "116549",
      "original_text": "Löschungsankündigung\nHamburg Amtsgericht Hamburg HRB 145208\ne.s.t. bau GmbH – Hamburg",
      "type": "Löschungsankündigung",
      "state": "Hamburg",
      "amtsgericht": "Amtsgericht Hamburg",
      "registernummer": "HRB 145208",
      "registerart": "HRB",
      "company_name": "e.s.t. bau GmbH",
      "company_seat": "Hamburg",
      "details": "18.07.2025 (Bekanntmachungsdatum)\n\nHamburg Amtsgericht Hamburg HRB 145208\nLöschungsankündigung\n\ne.s.t. bau GmbH\nGesellschaft mit beschränkter Haftung\nHamburg\n\nDas Registergericht beabsichtigt, die im Handelsregister eingetragene Gesellschaft von Amts wegen nach § 394 FamFG zu löschen. Die Frist zur Erhebung eines Widerspruchs gegen die beabsichtigte Löschung wird auf 3 Monate festgesetzt."
    },
    {
      "date": "2025-07-18",
      "id": "116550",
      "original_text": "Löschungsankündigung\nHamburg Amtsgericht Hamburg HRB 152014\nStichting Ithaca GmbH – Hamburg",
      "type": "Löschungsankündigung",
      "state": "Hamburg",
      "amtsgericht": "Amtsgericht Hamburg",
      "registernummer": "HRB 152014",
      "registerart": "HRB",
      "company_name": "Stichting Ithaca GmbH",
      "company_seat": "Hamburg",
      "details": "18.07.2025 (Bekanntmachungsdatum)\n\nHamburg Amtsgericht Hamburg HRB 152014\nLöschungsankündigung\n\nStichting Ithaca GmbH\nGesellschaft mit beschränkter Haftung\nHamburg\n\nDas Registergericht beabsichtigt, die im Handelsregister eingetragene Gesellschaft von Amts wegen nach § 394 FamFG zu löschen. Die Frist zur Erhebung eines Widerspruchs gegen die beabsichtigte Löschung wird auf 3 Monate festgesetzt."
    },
    {
      "date": "2025-07-18",
      "id": "116551",
      "original_text": "Sonstige Registerbekanntmachung\nBerlin Amtsgericht Berlin (Charlottenburg) HRB 158222\nEDO Deutschland Beteiligung GmbH – Berlin",
      "type": "Sonstige Registerbekanntmachung",
      "state": "Berlin",
      "amtsgericht": "Amtsgericht Berlin (Charlottenburg)",
      "registernummer": "HRB 158222",
      "registerart": "HRB",
      "company_name": "EDO Deutschland Beteiligung GmbH",
      "company_seat": "Berlin",
      "details": "18.07.2025 (Bekanntmachungsdatum)\n\nBerlin Amtsgericht Berlin (Charlottenburg) HRB 158222\nSonstige Registerbekanntmachung\n\nEDO Deutschland Beteiligung GmbH\nGesellschaft mit beschränkter Haftung\nBerlin\n\nAls nicht eingetragen wird veröffentlicht: 1. Die Gesellschaft hat den Entwurf eines Formwechselplans (grenzüberschreitender Formwechsel) beim Handelsregister eingereicht.2. Die formwechselnde Gesellschaft, EDO Deutschland Beteiligung GmbH, ist eine Gesellschaft mit beschränkter Haftung nach dem Recht der Bundesrepublik Deutschland (GmbH) mit Sitz in Berlin, Deutschland.\nDie Gesellschaft soll identitätswahrend in eine Gesellschaft mit beschränkter Haftung nach luxemburgischem Recht (société à responsabilité limitée, S. à r. l.) unter der Firma EDO Deutschland Beteiligung S. à r. l. mit Sitz in Luxemburg, Großherzogtum Luxemburg, umgewandelt werden. 3. Die Gesellschaft ist eingetragen im Handelsregister des Amtsgerichts Charlottenburg unter HRB 158222 B. Nach Vollzug des Formwechsels wird die Gesellschaft in das luxemburgische Handels- und Firmenregister (Registre de Commerce et des Sociétés) eingetragen.4. Der Gesellschafter und die Gläubiger der Gesellschaft (Betriebsräte und Arbeitnehmer gibt es nicht) werden darauf hingewiesen, dass sie der Gesellschaft spätestens fünf Arbeitstage vor dem Tag der Gesellschafterversammlung, die über die Zustimmung zu dem Formwechselplan beschließen soll, Bemerkungen zu dem Formwechselplan übermitteln können. Die Gesellschafterversammlung findet am 25. August 2025 statt."
    },
    {
      "date": "2025-07-18",
      "id": "116552",
      "original_text": "Einreichung neuer Dokumente\nBerlin Amtsgericht Berlin (Charlottenburg) HRB 194425\nDSC Versicherungsmakler AG – Berlin",
      "type": "Einreichung neuer Dokumente",
      "state": "Berlin",
      "amtsgericht": "Amtsgericht Berlin (Charlottenburg)",
      "registernummer": "HRB 194425",
      "registerart": "HRB",
      "company_name": "DSC Versicherungsmakler AG",
      "company_seat": "Berlin",
      "details": "18.07.2025 (Bekanntmachungsdatum)\n\nBerlin Amtsgericht Berlin (Charlottenburg) HRB 194425\nEinreichung neuer Dokumente\n\nDSC Versicherungsmakler AG\nAktiengesellschaft\nBerlin\n\nAls nicht eingetragen wird veröffentlicht: Es wurde eine neue Liste der Aufsichtsratsmitglieder eingereicht (§ 106 AktG)."
    },
    {
      "date": "2025-07-18",
      "id": "116553",
      "original_text": "Löschungsankündigung\nHamburg Amtsgericht Hamburg HRB 166171\nMORA TransLog UG (haftungsbeschränkt) – Hamburg",
      "type": "Löschungsankündigung",
      "state": "Hamburg",
      "amtsgericht": "Amtsgericht Hamburg",
      "registernummer": "HRB 166171",
      "registerart": "HRB",
      "company_name": "MORA TransLog UG (haftungsbeschränkt)",
      "company_seat": "Hamburg",
      "details": "18.07.2025 (Bekanntmachungsdatum)\n\nHamburg Amtsgericht Hamburg HRB 166171\nLöschungsankündigung\n\nMORA TransLog UG (haftungsbeschränkt)\nGesellschaft mit beschränkter Haftung\nHamburg\n\nDas Registergericht beabsichtigt, die im Handelsregister eingetragene Gesellschaft von Amts wegen nach § 394 FamFG zu löschen. Die Frist zur Erhebung eines Widerspruchs gegen die beabsichtigte Löschung wird auf 3 Monate festgesetzt."
    },
    {
      "date": "2025-07-18",
      "id": "116554",
      "original_text": "Löschungsankündigung\nHamburg Amtsgericht Hamburg HRB 168610\nHelmel Remont UG (haftungsbeschränkt) – Hamburg",
      "type": "Löschungsankündigung",
      "state": "Hamburg",
      "amtsgericht": "Amtsgericht Hamburg",
      "registernummer": "HRB 168610",
      "registerart": "HRB",
      "company_name": "Helmel Remont UG (haftungsbeschränkt)",
      "company_seat": "Hamburg",
      "details": "18.07.2025 (Bekanntmachungsdatum)\n\nHamburg Amtsgericht Hamburg HRB 168610\nLöschungsankündigung\n\nHelmel Remont UG (haftungsbeschränkt)\nGesellschaft mit beschränkter Haftung\nHamburg\n\nDas Registergericht beabsichtigt, die im Handelsregister eingetragene Gesellschaft von Amts wegen nach § 394 FamFG zu löschen. Die Frist zur Erhebung eines Widerspruchs gegen die beabsichtigte Löschung wird auf 3 Monate festgesetzt."
    },
    {
      "date": "2025-07-18",
      "id": "116555",
      "original_text": "Löschungsankündigung\nHamburg Amtsgericht Hamburg HRB 159440\nGF Bau GmbH – Hamburg",
      "type": "Löschungsankündigung",
      "state": "Hamburg",
      "amtsgericht": "Amtsgericht Hamburg",
      "registernummer": "HRB 159440",
      "registerart": "HRB",
      "company_name": "GF Bau GmbH",
      "company_seat": "Hamburg",
      "details": "18.07.2025 (Bekanntmachungsdatum)\n\nHamburg Amtsgericht Hamburg HRB 159440\nLöschungsankündigung\n\nGF Bau GmbH\nGesellschaft mit beschränkter Haftung\nHamburg\n\nDas Registergericht beabsichtigt, die im Handelsregister eingetragene Gesellschaft von Amts wegen nach § 394 FamFG zu löschen. Die Frist zur Erhebung eines Widerspruchs gegen die beabsichtigte Löschung wird auf 3 Monate festgesetzt."
    },
    {
      "date": "2025-07-18",
      "id": "116556",
      "original_text": "Löschungsankündigung\nHamburg Amtsgericht Hamburg HRB 162554\nVIBRINGS electronics GmbH – Hamburg",
      "type": "Löschungsankündigung",
      "state": "Hamburg",
      "amtsgericht": "Amtsgericht Hamburg",
      "registernummer": "HRB 162554",
      "registerart": "HRB",
      "company_name": "VIBRINGS electronics GmbH",
      "company_seat": "Hamburg",
      "details": "18.07.2025 (Bekanntmachungsdatum)\n\nHamburg Amtsgericht Hamburg HRB 162554\nLöschungsankündigung\n\nVIBRINGS electronics GmbH\nGesellschaft mit beschränkter Haftung\nHamburg\n\nDas Registergericht beabsichtigt, die im Handelsregister eingetragene Gesellschaft von Amts wegen nach § 394 FamFG zu löschen. Die Frist zur Erhebung eines Widerspruchs gegen die beabsichtigte Löschung wird auf 3 Monate festgesetzt."
    },
    {
      "date": "2025-07-18",
      "id": "116557",
      "original_text": "Löschungsankündigung\nHamburg Amtsgericht Hamburg HRB 164628\nMISO GmbH – Hamburg",
      "type": "Löschungsankündigung",
      "state": "Hamburg",
      "amtsgericht": "Amtsgericht Hamburg",
      "registernummer": "HRB 164628",
      "registerart": "HRB",
      "company_name": "MISO GmbH",
      "company_seat": "Hamburg",
      "details": "18.07.2025 (Bekanntmachungsdatum)\n\nHamburg Amtsgericht Hamburg HRB 164628\nLöschungsankündigung\n\nMISO GmbH\nGesellschaft mit beschränkter Haftung\nHamburg\n\nDas Registergericht beabsichtigt, die im Handelsregister eingetragene Gesellschaft von Amts wegen nach § 394 FamFG zu löschen. Die Frist zur Erhebung eines Widerspruchs gegen die beabsichtigte Löschung wird auf 3 Monate festgesetzt."
    },
    {
      "date": "2025-07-18",
      "id": "116558",
      "original_text": "Löschungsankündigung\nHamburg Amtsgericht Hamburg HRB 166329\nDécence GmbH – Hamburg",
      "type": "Löschungsankündigung",
      "state": "Hamburg",
      "amtsgericht": "Amtsgericht Hamburg",
      "registernummer": "HRB 166329",
      "registerart": "HRB",
      "company_name": "Décence GmbH",
      "company_seat": "Hamburg",
      "details": "18.07.2025 (Bekanntmachungsdatum)\n\nHamburg Amtsgericht Hamburg HRB 166329\nLöschungsankündigung\n\nDécence GmbH\nGesellschaft mit beschränkter Haftung\nHamburg\n\nDas Registergericht beabsichtigt, die im Handelsregister eingetragene Gesellschaft von Amts wegen nach § 394 FamFG zu löschen. Die Frist zur Erhebung eines Widerspruchs gegen die beabsichtigte Löschung wird auf 3 Monate festgesetzt."
    },
    {
      "date": "2025-07-18",
      "id": "116559",
      "original_text": "Löschungsankündigung\nHamburg Amtsgericht Hamburg HRB 169287\nSBF Transport GmbH – Hamburg",
      "type": "Löschungsankündigung",
      "state": "Hamburg",
      "amtsgericht": "Amtsgericht Hamburg",
      "registernummer": "HRB 169287",
      "registerart": "HRB",
      "company_name": "SBF Transport GmbH",
      "company_seat": "Hamburg",
      "details": "18.07.2025 (Bekanntmachungsdatum)\n\nHamburg Amtsgericht Hamburg HRB 169287\nLöschungsankündigung\n\nSBF Transport GmbH\nGesellschaft mit beschränkter Haftung\nHamburg\n\nDas Registergericht beabsichtigt, die im Handelsregister eingetragene Gesellschaft von Amts wegen nach § 394 FamFG zu löschen. Die Frist zur Erhebung eines Widerspruchs gegen die beabsichtigte Löschung wird auf 3 Monate festgesetzt."
    },
    {
      "date": "2025-07-18",
      "id": "116560",
      "original_text": "Löschungsankündigung\nHamburg Amtsgericht Hamburg HRB 169590\nOlma Solutions GmbH – Hamburg",
      "type": "Löschungsankündigung",
      "state": "Hamburg",
      "amtsgericht": "Amtsgericht Hamburg",
      "registernummer": "HRB 169590",
      "registerart": "HRB",
      "company_name": "Olma Solutions GmbH",
      "company_seat": "Hamburg",
      "details": "18.07.2025 (Bekanntmachungsdatum)\n\nHamburg Amtsgericht Hamburg HRB 169590\nLöschungsankündigung\n\nOlma Solutions GmbH\nGesellschaft mit beschränkter Haftung\nHamburg\n\nDas Registergericht beabsichtigt, die im Handelsregister eingetragene Gesellschaft von Amts wegen nach § 394 FamFG zu löschen. Die Frist zur Erhebung eines Widerspruchs gegen die beabsichtigte Löschung wird auf 3 Monate festgesetzt."
    },
    {
      "date": "2025-07-18",
      "id": "116561",
      "original_text": "Löschungsankündigung\nHamburg Amtsgericht Hamburg HRB 156491\nHanseatic Bakart GmbH – Hamburg",
      "type": "Löschungsankündigung",
      "state": "Hamburg",
      "amtsgericht": "Amtsgericht Hamburg",
      "registernummer": "HRB 156491",
      "registerart": "HRB",
      "company_name": "Hanseatic Bakart GmbH",
      "company_seat": "Hamburg",
      "details": "18.07.2025 (Bekanntmachungsdatum)\n\nHamburg Amtsgericht Hamburg HRB 156491\nLöschungsankündigung\n\nHanseatic Bakart GmbH\nGesellschaft mit beschränkter Haftung\nHamburg\n\nDas Registergericht beabsichtigt, die im Handelsregister eingetragene Gesellschaft von Amts wegen nach § 394 FamFG zu löschen. Die Frist zur Erhebung eines Widerspruchs gegen die beabsichtigte Löschung wird auf 3 Monate festgesetzt."
    },
    {
      "date": "2025-07-18",
      "id": "116562",
      "original_text": "Löschungsankündigung\nHamburg Amtsgericht Hamburg HRB 160670\nHair Point GmbH – Hamburg",
      "type": "Löschungsankündigung",
      "state": "Hamburg",
      "amtsgericht": "Amtsgericht Hamburg",
      "registernummer": "HRB 160670",
      "registerart": "HRB",
      "company_name": "Hair Point GmbH",
      "company_seat": "Hamburg",
      "details": "18.07.2025 (Bekanntmachungsdatum)\n\nHamburg Amtsgericht Hamburg HRB 160670\nLöschungsankündigung\n\nHair Point GmbH\nGesellschaft mit beschränkter Haftung\nHamburg\n\nDas Registergericht beabsichtigt, die im Handelsregister eingetragene Gesellschaft von Amts wegen nach § 394 FamFG zu löschen. Die Frist zur Erhebung eines Widerspruchs gegen die beabsichtigte Löschung wird auf 3 Monate festgesetzt."
    },
    {
      "date": "2025-07-18",
      "id": "116563",
      "original_text": "Löschungsankündigung\nHamburg Amtsgericht Hamburg HRB 163553\nLHV Logistik-Handel & Vermietungs GmbH – Hamburg",
      "type": "Löschungsankündigung",
      "state": "Hamburg",
      "amtsgericht": "Amtsgericht Hamburg",
      "registernummer": "HRB 163553",
      "registerart": "HRB",
      "company_name": "LHV Logistik-Handel & Vermietungs GmbH",
      "company_seat": "Hamburg",
      "details": "18.07.2025 (Bekanntmachungsdatum)\n\nHamburg Amtsgericht Hamburg HRB 163553\nLöschungsankündigung\n\nLHV Logistik-Handel & Vermietungs GmbH\nGesellschaft mit beschränkter Haftung\nHamburg\n\nDas Registergericht beabsichtigt, die im Handelsregister eingetragene Gesellschaft von Amts wegen nach § 394 FamFG zu löschen. Die Frist zur Erhebung eines Widerspruchs gegen die beabsichtigte Löschung wird auf 3 Monate festgesetzt."
    },
    {
      "date": "2025-07-18",
      "id": "116564",
      "original_text": "Einreichung neuer Dokumente\nBerlin Amtsgericht Berlin (Charlottenburg) HRB 244712\nAmazon CS Management SE – Berlin",
      "type": "Einreichung neuer Dokumente",
      "state": "Berlin",
      "amtsgericht": "Amtsgericht Berlin (Charlottenburg)",
      "registernummer": "HRB 244712",
      "registerart": "HRB",
      "company_name": "Amazon CS Management SE",
      "company_seat": "Berlin",
      "details": "18.07.2025 (Bekanntmachungsdatum)\n\nBerlin Amtsgericht Berlin (Charlottenburg) HRB 244712\nEinreichung neuer Dokumente\n\nAmazon CS Management SE\nEuropäische Aktiengesellschaft (SE)\nBerlin\n\nAls nicht eingetragen wird veröffentlicht: Es wurde eine neue Liste der Aufsichtsratsmitglieder eingereicht (§ 106 AktG)."
    },
    {
      "date": "2025-07-18",
      "id": "116565",
      "original_text": "Löschungsankündigung\nHamburg Amtsgericht Hamburg HRB 174294\nSaCu Solutions UG (haftungsbeschränkt) – Hamburg",
      "type": "Löschungsankündigung",
      "state": "Hamburg",
      "amtsgericht": "Amtsgericht Hamburg",
      "registernummer": "HRB 174294",
      "registerart": "HRB",
      "company_name": "SaCu Solutions UG (haftungsbeschränkt)",
      "company_seat": "Hamburg",
      "details": "18.07.2025 (Bekanntmachungsdatum)\n\nHamburg Amtsgericht Hamburg HRB 174294\nLöschungsankündigung\n\nSaCu Solutions UG (haftungsbeschränkt)\nGesellschaft mit beschränkter Haftung\nHamburg\n\nDas Registergericht beabsichtigt, die im Handelsregister eingetragene Gesellschaft von Amts wegen nach § 394 FamFG zu löschen. Die Frist zur Erhebung eines Widerspruchs gegen die beabsichtigte Löschung wird auf 3 Monate festgesetzt."
    },
    {
      "date": "2025-07-18",
      "id": "116566",
      "original_text": "Löschungsankündigung\nHamburg Amtsgericht Hamburg HRB 176239\nUFS Logistik GmbH – Hamburg",
      "type": "Löschungsankündigung",
      "state": "Hamburg",
      "amtsgericht": "Amtsgericht Hamburg",
      "registernummer": "HRB 176239",
      "registerart": "HRB",
      "company_name": "UFS Logistik GmbH",
      "company_seat": "Hamburg",
      "details": "18.07.2025 (Bekanntmachungsdatum)\n\nHamburg Amtsgericht Hamburg HRB 176239\nLöschungsankündigung\n\nUFS Logistik GmbH\nGesellschaft mit beschränkter Haftung\nHamburg\n\nDas Registergericht beabsichtigt, die im Handelsregister eingetragene Gesellschaft von Amts wegen nach § 394 FamFG zu löschen. Die Frist zur Erhebung eines Widerspruchs gegen die beabsichtigte Löschung wird auf 3 Monate festgesetzt."
    },
    {
      "date": "2025-07-18",
      "id": "116567",
      "original_text": "Löschungsankündigung\nHamburg Amtsgericht Hamburg HRB 176949\nALPIT SUPPLIER UG (haftungsbeschränkt) – Hamburg",
      "type": "Löschungsankündigung",
      "state": "Hamburg",
      "amtsgericht": "Amtsgericht Hamburg",
      "registernummer": "HRB 176949",
      "registerart": "HRB",
      "company_name": "ALPIT SUPPLIER UG (haftungsbeschränkt)",
      "company_seat": "Hamburg",
      "details": "18.07.2025 (Bekanntmachungsdatum)\n\nHamburg Amtsgericht Hamburg HRB 176949\nLöschungsankündigung\n\nALPIT SUPPLIER UG (haftungsbeschränkt)\nGesellschaft mit beschränkter Haftung\nHamburg\n\nDas Registergericht beabsichtigt, die im Handelsregister eingetragene Gesellschaft von Amts wegen nach § 394 FamFG zu löschen. Die Frist zur Erhebung eines Widerspruchs gegen die beabsichtigte Löschung wird auf 3 Monate festgesetzt."
    },
    {
      "date": "2025-07-18",
      "id": "116568",
      "original_text": "Löschungsankündigung\nHamburg Amtsgericht Hamburg HRB 177740\nTunde Bau GmbH – Hamburg",
      "type": "Löschungsankündigung",
      "state": "Hamburg",
      "amtsgericht": "Amtsgericht Hamburg",
      "registernummer": "HRB 177740",
      "registerart": "HRB",
      "company_name": "Tunde Bau GmbH",
      "company_seat": "Hamburg",
      "details": "18.07.2025 (Bekanntmachungsdatum)\n\nHamburg Amtsgericht Hamburg HRB 177740\nLöschungsankündigung\n\nTunde Bau GmbH\nGesellschaft mit beschränkter Haftung\nHamburg\n\nDas Registergericht beabsichtigt, die im Handelsregister eingetragene Gesellschaft von Amts wegen nach § 394 FamFG zu löschen. Die Frist zur Erhebung eines Widerspruchs gegen die beabsichtigte Löschung wird auf 3 Monate festgesetzt."
    },
    {
      "date": "2025-07-18",
      "id": "116569",
      "original_text": "Löschungsankündigung\nHamburg Amtsgericht Hamburg HRB 172353\ngreen & clean Reinigungsservice GmbH – Hamburg",
      "type": "Löschungsankündigung",
      "state": "Hamburg",
      "amtsgericht": "Amtsgericht Hamburg",
      "registernummer": "HRB 172353",
      "registerart": "HRB",
      "company_name": "green & clean Reinigungsservice GmbH",
      "company_seat": "Hamburg",
      "details": "18.07.2025 (Bekanntmachungsdatum)\n\nHamburg Amtsgericht Hamburg HRB 172353\nLöschungsankündigung\n\ngreen & clean Reinigungsservice GmbH\nGesellschaft mit beschränkter Haftung\nHamburg\n\nDas Registergericht beabsichtigt, die im Handelsregister eingetragene Gesellschaft von Amts wegen nach § 394 FamFG zu löschen. Die Frist zur Erhebung eines Widerspruchs gegen die beabsichtigte Löschung wird auf 3 Monate festgesetzt."
    },
    {
      "date": "2025-07-18",
      "id": "116570",
      "original_text": "Löschungsankündigung\nHamburg Amtsgericht Hamburg HRB 154517\nE & N Bauservice GmbH – Hamburg",
      "type": "Löschungsankündigung",
      "state": "Hamburg",
      "amtsgericht": "Amtsgericht Hamburg",
      "registernummer": "HRB 154517",
      "registerart": "HRB",
      "company_name": "E & N Bauservice GmbH",
      "company_seat": "Hamburg",
      "details": "18.07.2025 (Bekanntmachungsdatum)\n\nHamburg Amtsgericht Hamburg HRB 154517\nLöschungsankündigung\n\nE & N Bauservice GmbH\nGesellschaft mit beschränkter Haftung\nHamburg\n\nDas Registergericht beabsichtigt, die im Handelsregister eingetragene Gesellschaft von Amts wegen nach § 394 FamFG zu löschen. Die Frist zur Erhebung eines Widerspruchs gegen die beabsichtigte Löschung wird auf 3 Monate festgesetzt."
    },
    {
      "date": "2025-07-18",
      "id": "116571",
      "original_text": "Löschungsankündigung\nHamburg Amtsgericht Hamburg HRB 171098\nGoldKader - Personalservice GmbH – Hamburg",
      "type": "Löschungsankündigung",
      "state": "Hamburg",
      "amtsgericht": "Amtsgericht Hamburg",
      "registernummer": "HRB 171098",
      "registerart": "HRB",
      "company_name": "GoldKader - Personalservice GmbH",
      "company_seat": "Hamburg",
      "details": "18.07.2025 (Bekanntmachungsdatum)\n\nHamburg Amtsgericht Hamburg HRB 171098\nLöschungsankündigung\n\nGoldKader - Personalservice GmbH\nGesellschaft mit beschränkter Haftung\nHamburg\n\nDas Registergericht beabsichtigt, die im Handelsregister eingetragene Gesellschaft von Amts wegen nach § 394 FamFG zu löschen. Die Frist zur Erhebung eines Widerspruchs gegen die beabsichtigte Löschung wird auf 3 Monate festgesetzt."
    },
    {
      "date": "2025-07-18",
      "id": "116572",
      "original_text": "Löschungsankündigung\nHamburg Amtsgericht Hamburg HRB 173681\nVitality 4 Life Europa GmbH – Hamburg",
      "type": "Löschungsankündigung",
      "state": "Hamburg",
      "amtsgericht": "Amtsgericht Hamburg",
      "registernummer": "HRB 173681",
      "registerart": "HRB",
      "company_name": "Vitality 4 Life Europa GmbH",
      "company_seat": "Hamburg",
      "details": "18.07.2025 (Bekanntmachungsdatum)\n\nHamburg Amtsgericht Hamburg HRB 173681\nLöschungsankündigung\n\nVitality 4 Life Europa GmbH\nGesellschaft mit beschränkter Haftung\nHamburg\n\nDas Registergericht beabsichtigt, die im Handelsregister eingetragene Gesellschaft von Amts wegen nach § 394 FamFG zu löschen. Die Frist zur Erhebung eines Widerspruchs gegen die beabsichtigte Löschung wird auf 3 Monate festgesetzt."
    },
    {
      "date": "2025-07-18",
      "id": "116573",
      "original_text": "Löschungsankündigung\nHamburg Amtsgericht Hamburg HRB 176815\nnovomyo UG (haftungsbeschränkt) – Hamburg",
      "type": "Löschungsankündigung",
      "state": "Hamburg",
      "amtsgericht": "Amtsgericht Hamburg",
      "registernummer": "HRB 176815",
      "registerart": "HRB",
      "company_name": "novomyo UG (haftungsbeschränkt)",
      "company_seat": "Hamburg",
      "details": "18.07.2025 (Bekanntmachungsdatum)\n\nHamburg Amtsgericht Hamburg HRB 176815\nLöschungsankündigung\n\nnovomyo UG (haftungsbeschränkt)\nGesellschaft mit beschränkter Haftung\nHamburg\n\nDas Registergericht beabsichtigt, die im Handelsregister eingetragene Gesellschaft von Amts wegen nach § 394 FamFG zu löschen. Die Frist zur Erhebung eines Widerspruchs gegen die beabsichtigte Löschung wird auf 3 Monate festgesetzt."
    },
    {
      "date": "2025-07-18",
      "id": "116574",
      "original_text": "Löschungsankündigung\nHamburg Amtsgericht Hamburg HRB 177330\nNORTHJOBS ASM GmbH – Hamburg",
      "type": "Löschungsankündigung",
      "state": "Hamburg",
      "amtsgericht": "Amtsgericht Hamburg",
      "registernummer": "HRB 177330",
      "registerart": "HRB",
      "company_name": "NORTHJOBS ASM GmbH",
      "company_seat": "Hamburg",
      "details": "18.07.2025 (Bekanntmachungsdatum)\n\nHamburg Amtsgericht Hamburg HRB 177330\nLöschungsankündigung\n\nNORTHJOBS ASM GmbH\nGesellschaft mit beschränkter Haftung\nHamburg\n\nDas Registergericht beabsichtigt, die im Handelsregister eingetragene Gesellschaft von Amts wegen nach § 394 FamFG zu löschen. Die Frist zur Erhebung eines Widerspruchs gegen die beabsichtigte Löschung wird auf 3 Monate festgesetzt."
    },
    {
      "date": "2025-07-18",
      "id": "116575",
      "original_text": "Löschungsankündigung\nHamburg Amtsgericht Hamburg HRB 174472\nB & D Agency GmbH – Hamburg",
      "type": "Löschungsankündigung",
      "state": "Hamburg",
      "amtsgericht": "Amtsgericht Hamburg",
      "registernummer": "HRB 174472",
      "registerart": "HRB",
      "company_name": "B & D Agency GmbH",
      "company_seat": "Hamburg",
      "details": "18.07.2025 (Bekanntmachungsdatum)\n\nHamburg Amtsgericht Hamburg HRB 174472\nLöschungsankündigung\n\nB & D Agency GmbH\nGesellschaft mit beschränkter Haftung\nHamburg\n\nDas Registergericht beabsichtigt, die im Handelsregister eingetragene Gesellschaft von Amts wegen nach § 394 FamFG zu löschen. Die Frist zur Erhebung eines Widerspruchs gegen die beabsichtigte Löschung wird auf 3 Monate festgesetzt."
    },
    {
      "date": "2025-07-18",
      "id": "116576",
      "original_text": "Registerbekanntmachung nach dem Umwandlungsgesetz\nBerlin Amtsgericht Berlin (Charlottenburg) HRB 260043\nDr. Gerhard Mann Verwaltungs GmbH – Berlin",
      "type": "Registerbekanntmachung nach dem Umwandlungsgesetz",
      "state": "Berlin",
      "amtsgericht": "Amtsgericht Berlin (Charlottenburg)",
      "registernummer": "HRB 260043",
      "registerart": "HRB",
      "company_name": "Dr. Gerhard Mann Verwaltungs GmbH",
      "company_seat": "Berlin",
      "details": "18.07.2025 (Bekanntmachungsdatum)\n\nBerlin Amtsgericht Berlin (Charlottenburg) HRB 260043\nRegisterbekanntmachung nach dem Umwandlungsgesetz 15.07.2025 (Eintragungsdatum)\n\nDr. Gerhard Mann Verwaltungs GmbH\nGesellschaft mit beschränkter Haftung\nBerlin\n\nZu Eintragungsnummer 3 vom 15.07.2025 wird als nicht eingetragen veröffentlicht: Den Gläubigern der an der Verschmelzung beteiligten Rechtsträger ist, wenn sie binnen sechs Monaten nach dem Tag, an dem die Eintragung der Verschmelzung in das Register des Sitzes desjenigen Rechtsträgers, dessen Gläubiger sie sind, als bekannt gemacht gilt, ihren Anspruch nach Grund und Höhe schriftlich anmelden, Sicherheit zu leisten, soweit sie nicht Befriedigung verlangen können. Dieses Recht steht den Gläubigern jedoch nur zu, wenn sie glaubhaft machen, dass durch die Verschmelzung die Erfüllung ihrer Forderung gefährdet wird. Das Recht, Sicherheitsleistung zu verlangen, steht Gläubigern nicht zu, die im Falle der Insolvenz ein Recht auf vorzugsweise Befriedigung aus einer Deckungsmasse haben, die nach gesetzlicher Vorschrift zu ihrem Schutz errichtet und staatlich überwacht ist."
    },
    {
      "date": "2025-07-18",
      "id": "116577",
      "original_text": "Löschungsankündigung\nHamburg Amtsgericht Hamburg HRB 178318\nHamburger Bahndienste (HBD) GmbH – Hamburg",
      "type": "Löschungsankündigung",
      "state": "Hamburg",
      "amtsgericht": "Amtsgericht Hamburg",
      "registernummer": "HRB 178318",
      "registerart": "HRB",
      "company_name": "Hamburger Bahndienste (HBD) GmbH",
      "company_seat": "Hamburg",
      "details": "18.07.2025 (Bekanntmachungsdatum)\n\nHamburg Amtsgericht Hamburg HRB 178318\nLöschungsankündigung\n\nHamburger Bahndienste (HBD) GmbH\nGesellschaft mit beschränkter Haftung\nHamburg\n\nDas Registergericht beabsichtigt, die im Handelsregister eingetragene Gesellschaft von Amts wegen nach § 394 FamFG zu löschen. Die Frist zur Erhebung eines Widerspruchs gegen die beabsichtigte Löschung wird auf 3 Monate festgesetzt."
    },
    {
      "date": "2025-07-18",
      "id": "116578",
      "original_text": "Löschungsankündigung\nHamburg Amtsgericht Hamburg HRB 182466\nGelami UG (haftungsbeschränkt) – Hamburg",
      "type": "Löschungsankündigung",
      "state": "Hamburg",
      "amtsgericht": "Amtsgericht Hamburg",
      "registernummer": "HRB 182466",
      "registerart": "HRB",
      "company_name": "Gelami UG (haftungsbeschränkt)",
      "company_seat": "Hamburg",
      "details": "18.07.2025 (Bekanntmachungsdatum)\n\nHamburg Amtsgericht Hamburg HRB 182466\nLöschungsankündigung\n\nGelami UG (haftungsbeschränkt)\nGesellschaft mit beschränkter Haftung\nHamburg\n\nDas Registergericht beabsichtigt, die im Handelsregister eingetragene Gesellschaft von Amts wegen nach § 394 FamFG zu löschen. Die Frist zur Erhebung eines Widerspruchs gegen die beabsichtigte Löschung wird auf 3 Monate festgesetzt."
    },
    {
      "date": "2025-07-18",
      "id": "116579",
      "original_text": "Löschungsankündigung\nHamburg Amtsgericht Hamburg HRB 177922\nLina Bau & Handwerk GmbH – Hamburg",
      "type": "Löschungsankündigung",
      "state": "Hamburg",
      "amtsgericht": "Amtsgericht Hamburg",
      "registernummer": "HRB 177922",
      "registerart": "HRB",
      "company_name": "Lina Bau & Handwerk GmbH",
      "company_seat": "Hamburg",
      "details": "18.07.2025 (Bekanntmachungsdatum)\n\nHamburg Amtsgericht Hamburg HRB 177922\nLöschungsankündigung\n\nLina Bau & Handwerk GmbH\nGesellschaft mit beschränkter Haftung\nHamburg\n\nDas Registergericht beabsichtigt, die im Handelsregister eingetragene Gesellschaft von Amts wegen nach § 394 FamFG zu löschen. Die Frist zur Erhebung eines Widerspruchs gegen die beabsichtigte Löschung wird auf 3 Monate festgesetzt."
    },
    {
      "date": "2025-07-18",
      "id": "116580",
      "original_text": "Löschungsankündigung\nHamburg Amtsgericht Hamburg HRB 180523\nGfR Gesellschaft für Ressourcenökonomie GmbH – Hamburg",
      "type": "Löschungsankündigung",
      "state": "Hamburg",
      "amtsgericht": "Amtsgericht Hamburg",
      "registernummer": "HRB 180523",
      "registerart": "HRB",
      "company_name": "GfR Gesellschaft für Ressourcenökonomie GmbH",
      "company_seat": "Hamburg",
      "details": "18.07.2025 (Bekanntmachungsdatum)\n\nHamburg Amtsgericht Hamburg HRB 180523\nLöschungsankündigung\n\nGfR Gesellschaft für Ressourcenökonomie GmbH\nGesellschaft mit beschränkter Haftung\nHamburg\n\nDas Registergericht beabsichtigt, die im Handelsregister eingetragene Gesellschaft von Amts wegen nach § 394 FamFG zu löschen. Die Frist zur Erhebung eines Widerspruchs gegen die beabsichtigte Löschung wird auf 3 Monate festgesetzt."
    },
    {
      "date": "2025-07-18",
      "id": "116581",
      "original_text": "Löschungsankündigung\nHamburg Amtsgericht Hamburg HRB 182907\nReo28 Electronic UG (haftungsbeschränkt) – Hamburg",
      "type": "Löschungsankündigung",
      "state": "Hamburg",
      "amtsgericht": "Amtsgericht Hamburg",
      "registernummer": "HRB 182907",
      "registerart": "HRB",
      "company_name": "Reo28 Electronic UG (haftungsbeschränkt)",
      "company_seat": "Hamburg",
      "details": "18.07.2025 (Bekanntmachungsdatum)\n\nHamburg Amtsgericht Hamburg HRB 182907\nLöschungsankündigung\n\nReo28 Electronic UG (haftungsbeschränkt)\nGesellschaft mit beschränkter Haftung\nHamburg\n\nDas Registergericht beabsichtigt, die im Handelsregister eingetragene Gesellschaft von Amts wegen nach § 394 FamFG zu löschen. Die Frist zur Erhebung eines Widerspruchs gegen die beabsichtigte Löschung wird auf 3 Monate festgesetzt."
    },
    {
      "date": "2025-07-18",
      "id": "116582",
      "original_text": "Einreichung neuer Dokumente\nHamburg Amtsgericht Hamburg HRB 56098\nFielmann Group AG – Hamburg",
      "type": "Einreichung neuer Dokumente",
      "state": "Hamburg",
      "amtsgericht": "Amtsgericht Hamburg",
      "registernummer": "HRB 56098",
      "registerart": "HRB",
      "company_name": "Fielmann Group AG",
      "company_seat": "Hamburg",
      "details": "18.07.2025 (Bekanntmachungsdatum)\n\nHamburg Amtsgericht Hamburg HRB 56098\nEinreichung neuer Dokumente\n\nFielmann Group AG\nAktiengesellschaft\nHamburg\n\nAls nicht eingetragen wird bekannt gemacht: Liste des Aufsichtsrats wurde eingereicht."
    },
    {
      "date": "2025-07-18",
      "id": "116583",
      "original_text": "Löschungsankündigung\nHamburg Amtsgericht Hamburg HRB 188466\nDrei Prozent GmbH – Hamburg",
      "type": "Löschungsankündigung",
      "state": "Hamburg",
      "amtsgericht": "Amtsgericht Hamburg",
      "registernummer": "HRB 188466",
      "registerart": "HRB",
      "company_name": "Drei Prozent GmbH",
      "company_seat": "Hamburg",
      "details": "18.07.2025 (Bekanntmachungsdatum)\n\nHamburg Amtsgericht Hamburg HRB 188466\nLöschungsankündigung\n\nDrei Prozent GmbH\nGesellschaft mit beschränkter Haftung\nHamburg\n\nDas Registergericht beabsichtigt, die im Handelsregister eingetragene Gesellschaft von Amts wegen nach § 394 FamFG zu löschen. Die Frist zur Erhebung eines Widerspruchs gegen die beabsichtigte Löschung wird auf 3 Monate festgesetzt."
    },
    {
      "date": "2025-07-18",
      "id": "116584",
      "original_text": "Löschungsankündigung\nHamburg Amtsgericht Hamburg HRB 189454\nDDC Hochbau GmbH – Hamburg",
      "type": "Löschungsankündigung",
      "state": "Hamburg",
      "amtsgericht": "Amtsgericht Hamburg",
      "registernummer": "HRB 189454",
      "registerart": "HRB",
      "company_name": "DDC Hochbau GmbH",
      "company_seat": "Hamburg",
      "details": "18.07.2025 (Bekanntmachungsdatum)\n\nHamburg Amtsgericht Hamburg HRB 189454\nLöschungsankündigung\n\nDDC Hochbau GmbH\nGesellschaft mit beschränkter Haftung\nHamburg\n\nDas Registergericht beabsichtigt, die im Handelsregister eingetragene Gesellschaft von Amts wegen nach § 394 FamFG zu löschen. Die Frist zur Erhebung eines Widerspruchs gegen die beabsichtigte Löschung wird auf 3 Monate festgesetzt."
    },
    {
      "date": "2025-07-18",
      "id": "116585",
      "original_text": "Löschungsankündigung\nHamburg Amtsgericht Hamburg HRA 117420\nKeklikci Transporte e.K. – Hamburg",
      "type": "Löschungsankündigung",
      "state": "Hamburg",
      "amtsgericht": "Amtsgericht Hamburg",
      "registernummer": "HRA 117420",
      "registerart": "HRA",
      "company_name": "Keklikci Transporte e.K.",
      "company_seat": "Hamburg",
      "details": "18.07.2025 (Bekanntmachungsdatum)\n\nHamburg Amtsgericht Hamburg HRA 117420\nLöschungsankündigung\n\nKeklikci Transporte e.K.\nEinzelkaufmann\nHamburg\n\nDas Registergericht beabsichtigt, die im Handelsregister eingetragene Firma von Amts wegen nach § 31 Abs. 2 HBG zu löschen. Die Frist zur Erhebung eines Widerspruchs gegen die beabsichtigte Löschung wird auf 3 Monate festgesetzt."
    },
    {
      "date": "2025-07-18",
      "id": "116586",
      "original_text": "Löschungsankündigung\nHamburg Amtsgericht Hamburg HRB 182771\nHHGB GmbH – Hamburg",
      "type": "Löschungsankündigung",
      "state": "Hamburg",
      "amtsgericht": "Amtsgericht Hamburg",
      "registernummer": "HRB 182771",
      "registerart": "HRB",
      "company_name": "HHGB GmbH",
      "company_seat": "Hamburg",
      "details": "18.07.2025 (Bekanntmachungsdatum)\n\nHamburg Amtsgericht Hamburg HRB 182771\nLöschungsankündigung\n\nHHGB GmbH\nGesellschaft mit beschränkter Haftung\nHamburg\n\nDas Registergericht beabsichtigt, die im Handelsregister eingetragene Gesellschaft von Amts wegen nach § 394 FamFG zu löschen. Die Frist zur Erhebung eines Widerspruchs gegen die beabsichtigte Löschung wird auf 3 Monate festgesetzt."
    },
    {
      "date": "2025-07-18",
      "id": "116587",
      "original_text": "Löschungsankündigung\nHamburg Amtsgericht Hamburg HRB 186750\nHeadline Solution UG (haftungsbeschränkt) – Hamburg",
      "type": "Löschungsankündigung",
      "state": "Hamburg",
      "amtsgericht": "Amtsgericht Hamburg",
      "registernummer": "HRB 186750",
      "registerart": "HRB",
      "company_name": "Headline Solution UG (haftungsbeschränkt)",
      "company_seat": "Hamburg",
      "details": "18.07.2025 (Bekanntmachungsdatum)\n\nHamburg Amtsgericht Hamburg HRB 186750\nLöschungsankündigung\n\nHeadline Solution UG (haftungsbeschränkt)\nGesellschaft mit beschränkter Haftung\nHamburg\n\nDas Registergericht beabsichtigt, die im Handelsregister eingetragene Gesellschaft von Amts wegen nach § 394 FamFG zu löschen. Die Frist zur Erhebung eines Widerspruchs gegen die beabsichtigte Löschung wird auf 3 Monate festgesetzt."
    },
    {
      "date": "2025-07-18",
      "id": "116588",
      "original_text": "Löschungsankündigung\nHamburg Amtsgericht Hamburg HRB 189315\nAIVisionary Systems UG (haftungsbeschränkt) – Hamburg",
      "type": "Löschungsankündigung",
      "state": "Hamburg",
      "amtsgericht": "Amtsgericht Hamburg",
      "registernummer": "HRB 189315",
      "registerart": "HRB",
      "company_name": "AIVisionary Systems UG (haftungsbeschränkt)",
      "company_seat": "Hamburg",
      "details": "18.07.2025 (Bekanntmachungsdatum)\n\nHamburg Amtsgericht Hamburg HRB 189315\nLöschungsankündigung\n\nAIVisionary Systems UG (haftungsbeschränkt)\nGesellschaft mit beschränkter Haftung\nHamburg\n\nDas Registergericht beabsichtigt, die im Handelsregister eingetragene Gesellschaft von Amts wegen nach § 394 FamFG zu löschen. Die Frist zur Erhebung eines Widerspruchs gegen die beabsichtigte Löschung wird auf 3 Monate festgesetzt."
    },
    {
      "date": "2025-07-18",
      "id": "116589",
      "original_text": "Löschungsankündigung\nHamburg Amtsgericht Hamburg HRA 96119\nVermont Music Publishing Armin Wenzl e.K. – Hamburg",
      "type": "Löschungsankündigung",
      "state": "Hamburg",
      "amtsgericht": "Amtsgericht Hamburg",
      "registernummer": "HRA 96119",
      "registerart": "HRA",
      "company_name": "Vermont Music Publishing Armin Wenzl e.K.",
      "company_seat": "Hamburg",
      "details": "18.07.2025 (Bekanntmachungsdatum)\n\nHamburg Amtsgericht Hamburg HRA 96119\nLöschungsankündigung\n\nVermont Music Publishing Armin Wenzl e.K.\nEinzelkaufmann\nHamburg\n\nDas Registergericht beabsichtigt, die im Handelsregister eingetragene Firma von Amts wegen nach § 31 Abs. 2 HBG zu löschen. Die Frist zur Erhebung eines Widerspruchs gegen die beabsichtigte Löschung wird auf 3 Monate festgesetzt."
    },
    {
      "date": "2025-07-18",
      "id": "116590",
      "original_text": "Löschungsankündigung\nHamburg Amtsgericht Hamburg HRA 99330\nTrebeß & Lange GmbH & Co.KG – Hamburg",
      "type": "Löschungsankündigung",
      "state": "Hamburg",
      "amtsgericht": "Amtsgericht Hamburg",
      "registernummer": "HRA 99330",
      "registerart": "HRA",
      "company_name": "Trebeß & Lange GmbH & Co.KG",
      "company_seat": "Hamburg",
      "details": "18.07.2025 (Bekanntmachungsdatum)\n\nHamburg Amtsgericht Hamburg HRA 99330\nLöschungsankündigung\n\nTrebeß & Lange GmbH & Co.KG\nKommanditgesellschaft\nHamburg\n\nDas Registergericht beabsichtigt, die im Handelsregister eingetragene Firma von Amts wegen nach § 31 Abs. 2 HBG zu löschen. Die Frist zur Erhebung eines Widerspruchs gegen die beabsichtigte Löschung wird auf 3 Monate festgesetzt."
    },
    {
      "date": "2025-07-18",
      "id": "116591",
      "original_text": "Löschungsankündigung\nHamburg Amtsgericht Hamburg VR 22442\nIslamischer Studentenbund (ISB) e.V. – Hamburg",
      "type": "Löschungsankündigung",
      "state": "Hamburg",
      "amtsgericht": "Amtsgericht Hamburg",
      "registernummer": "VR 22442",
      "registerart": "VR",
      "company_name": "Islamischer Studentenbund (ISB) e.V.",
      "company_seat": "Hamburg",
      "details": "18.07.2025 (Bekanntmachungsdatum)\n\nHamburg Amtsgericht Hamburg VR 22442\nLöschungsankündigung\n\nIslamischer Studentenbund (ISB) e.V.\neingetragener Verein\nHamburg\n\nDas Registergericht beabsichtigt, den im Vereinsregister eingetragenen Verein von Amts wegen nach § 395 FamFG zu löschen, da nach den angestellten  Ermittlungen dieser Verein offenbar nicht mehr besteht. Die Frist zur Erhebung eines Widerspruchs gegen die beabsichtigte Löschung wird auf 3 Monate festgesetzt."
    },
    {
      "date": "2025-07-18",
      "id": "116592",
      "original_text": "Löschungsankündigung\nHamburg Amtsgericht Hamburg HRA 123136\nLincolnstraße 12-14 Hamburg GmbH & Co. KG – Hamburg",
      "type": "Löschungsankündigung",
      "state": "Hamburg",
      "amtsgericht": "Amtsgericht Hamburg",
      "registernummer": "HRA 123136",
      "registerart": "HRA",
      "company_name": "Lincolnstraße 12-14 Hamburg GmbH & Co. KG",
      "company_seat": "Hamburg",
      "details": "18.07.2025 (Bekanntmachungsdatum)\n\nHamburg Amtsgericht Hamburg HRA 123136\nLöschungsankündigung\n\nLincolnstraße 12-14 Hamburg GmbH & Co. KG\nKommanditgesellschaft\nHamburg\n\nDas Registergericht beabsichtigt, die im Handelsregister eingetragene Gesellschaft von Amts wegen nach § 394 FamFG zu löschen. Die Frist zur Erhebung eines Widerspruchs gegen die beabsichtigte Löschung wird auf 3 Monate festgesetzt."
    },
    {
      "date": "2025-07-18",
      "id": "116593",
      "original_text": "Löschungsankündigung\nHamburg Amtsgericht Hamburg VR 15732\nHamburgische Gesellschaft für Verhaltensbiologie e.V. – Hamburg",
      "type": "Löschungsankündigung",
      "state": "Hamburg",
      "amtsgericht": "Amtsgericht Hamburg",
      "registernummer": "VR 15732",
      "registerart": "VR",
      "company_name": "Hamburgische Gesellschaft für Verhaltensbiologie e.V.",
      "company_seat": "Hamburg",
      "details": "18.07.2025 (Bekanntmachungsdatum)\n\nHamburg Amtsgericht Hamburg VR 15732\nLöschungsankündigung\n\nHamburgische Gesellschaft für Verhaltensbiologie e.V.\neingetragener Verein\nHamburg\n\nDas Registergericht beabsichtigt, den im Vereinsregister eingetragenen Verein von Amts wegen nach § 395 FamFG zu löschen, da nach den angestellten  Ermittlungen dieser Verein offenbar nicht mehr besteht. Die Frist zur Erhebung eines Widerspruchs gegen die beabsichtigte Löschung wird auf 3 Monate festgesetzt."
    },
    {
      "date": "2025-07-18",
      "id": "116594",
      "original_text": "Registerbekanntmachung nach dem Umwandlungsgesetz\nBerlin Amtsgericht Berlin (Charlottenburg) HRB 221669\nFiBS RILLL Research Institute on Lifelong Learning gGmbH – Berlin",
      "type": "Registerbekanntmachung nach dem Umwandlungsgesetz",
      "state": "Berlin",
      "amtsgericht": "Amtsgericht Berlin (Charlottenburg)",
      "registernummer": "HRB 221669",
      "registerart": "HRB",
      "company_name": "FiBS RILLL Research Institute on Lifelong Learning gGmbH",
      "company_seat": "Berlin",
      "details": "18.07.2025 (Bekanntmachungsdatum)\n\nBerlin Amtsgericht Berlin (Charlottenburg) HRB 221669\nRegisterbekanntmachung nach dem Umwandlungsgesetz 18.07.2025 (Eintragungsdatum)\n\nFiBS RILLL Research Institute on Lifelong Learning gGmbH\nGesellschaft mit beschränkter Haftung\nBerlin\n\nZu Eintragungsnummer 2 vom 18.07.2025 wird als nicht eingetragen veröffentlicht: Den Gläubigern der an der Verschmelzung beteiligten Rechtsträger ist, wenn sie binnen sechs Monaten nach dem Tag, an dem die Eintragung der Verschmelzung in das Register des Sitzes desjenigen Rechtsträgers, dessen Gläubiger sie sind, als bekannt gemacht gilt, ihren Anspruch nach Grund und Höhe schriftlich anmelden, Sicherheit zu leisten, soweit sie nicht Befriedigung verlangen können. Dieses Recht steht den Gläubigern jedoch nur zu, wenn sie glaubhaft machen, dass durch die Verschmelzung die Erfüllung ihrer Forderung gefährdet wird. Das Recht, Sicherheitsleistung zu verlangen, steht Gläubigern nicht zu, die im Falle der Insolvenz ein Recht auf vorzugsweise Befriedigung aus einer Deckungsmasse haben, die nach gesetzlicher Vorschrift zu ihrem Schutz errichtet und staatlich überwacht ist."
    },
    {
      "date": "2025-07-18",
      "id": "116595",
      "original_text": "Registerbekanntmachung nach dem Umwandlungsgesetz\nBerlin Amtsgericht Berlin (Charlottenburg) HRB 217621\nFiBS ElternHotline gGmbH – Berlin",
      "type": "Registerbekanntmachung nach dem Umwandlungsgesetz",
      "state": "Berlin",
      "amtsgericht": "Amtsgericht Berlin (Charlottenburg)",
      "registernummer": "HRB 217621",
      "registerart": "HRB",
      "company_name": "FiBS ElternHotline gGmbH",
      "company_seat": "Berlin",
      "details": "18.07.2025 (Bekanntmachungsdatum)\n\nBerlin Amtsgericht Berlin (Charlottenburg) HRB 217621\nRegisterbekanntmachung nach dem Umwandlungsgesetz 18.07.2025 (Eintragungsdatum)\n\nFiBS ElternHotline gGmbH\nGesellschaft mit beschränkter Haftung\nBerlin\n\nZu Eintragungsnummer 2 vom 18.07.2025 wird als nicht eingetragen veröffentlicht: Den Gläubigern der an der Verschmelzung beteiligten Rechtsträger ist, wenn sie binnen sechs Monaten nach dem Tag, an dem die Eintragung der Verschmelzung in das Register des Sitzes desjenigen Rechtsträgers, dessen Gläubiger sie sind, als bekannt gemacht gilt, ihren Anspruch nach Grund und Höhe schriftlich anmelden, Sicherheit zu leisten, soweit sie nicht Befriedigung verlangen können. Dieses Recht steht den Gläubigern jedoch nur zu, wenn sie glaubhaft machen, dass durch die Verschmelzung die Erfüllung ihrer Forderung gefährdet wird. Das Recht, Sicherheitsleistung zu verlangen, steht Gläubigern nicht zu, die im Falle der Insolvenz ein Recht auf vorzugsweise Befriedigung aus einer Deckungsmasse haben, die nach gesetzlicher Vorschrift zu ihrem Schutz errichtet und staatlich überwacht ist."
    },
    {
      "date": "2025-07-18",
      "id": "116596",
      "original_text": "Registerbekanntmachung nach dem Umwandlungsgesetz\nBaden-Württemberg Amtsgericht Stuttgart HRB 791542\nAIF Capital AG – Stuttgart",
      "type": "Registerbekanntmachung nach dem Umwandlungsgesetz",
      "state": "Baden-Württemberg",
      "amtsgericht": "Amtsgericht Stuttgart",
      "registernummer": "HRB 791542",
      "registerart": "HRB",
      "company_name": "AIF Capital AG",
      "company_seat": "Stuttgart",
      "details": "18.07.2025 (Bekanntmachungsdatum)\n\nBaden-Württemberg Amtsgericht Stuttgart HRB 791542\nRegisterbekanntmachung nach dem Umwandlungsgesetz\n\nAIF Capital AG\nAktiengesellschaft\nStuttgart\n\nDie Gesellschaft hat am 16.07.2025 den Entwurf des Verschmelzungsvertrages zwischen der  \"AIF Corporate Services GmbH\", Stuttgart (Amtsgericht Stuttgart HRB 768203) und der hiesigen Gesellschaft (übernehmender Rechtsträger) zum Handelsregister eingereicht."
    },
    {
      "date": "2025-07-18",
      "id": "116597",
      "original_text": "Registerbekanntmachung nach dem Umwandlungsgesetz\nBerlin Amtsgericht Berlin (Charlottenburg) HRB 25425\nDr. Gerhard Mann chem.-pharm. Fabrik Gesellschaft mit beschränkter Haftung – Berlin",
      "type": "Registerbekanntmachung nach dem Umwandlungsgesetz",
      "state": "Berlin",
      "amtsgericht": "Amtsgericht Berlin (Charlottenburg)",
      "registernummer": "HRB 25425",
      "registerart": "HRB",
      "company_name": "Dr. Gerhard Mann chem.-pharm. Fabrik Gesellschaft mit beschränkter Haftung",
      "company_seat": "Berlin",
      "details": "18.07.2025 (Bekanntmachungsdatum)\n\nBerlin Amtsgericht Berlin (Charlottenburg) HRB 25425\nRegisterbekanntmachung nach dem Umwandlungsgesetz 15.07.2025 (Eintragungsdatum)\n\nDr. Gerhard Mann chem.-pharm. Fabrik Gesellschaft mit beschränkter Haftung\nGesellschaft mit beschränkter Haftung\nBerlin\n\nZu Eintragungsnummer 60 vom 15.07.2025 wird als nicht eingetragen veröffentlicht: Den Gläubigern der an der Verschmelzung beteiligten Rechtsträger ist, wenn sie binnen sechs Monaten nach dem Tag, an dem die Eintragung der Verschmelzung in das Register des Sitzes desjenigen Rechtsträgers, dessen Gläubiger sie sind, als bekannt gemacht gilt, ihren Anspruch nach Grund und Höhe schriftlich anmelden, Sicherheit zu leisten, soweit sie nicht Befriedigung verlangen können. Dieses Recht steht den Gläubigern jedoch nur zu, wenn sie glaubhaft machen, dass durch die Verschmelzung die Erfüllung ihrer Forderung gefährdet wird. Das Recht, Sicherheitsleistung zu verlangen, steht Gläubigern nicht zu, die im Falle der Insolvenz ein Recht auf vorzugsweise Befriedigung aus einer Deckungsmasse haben, die nach gesetzlicher Vorschrift zu ihrem Schutz errichtet und staatlich überwacht ist."
    },
    {
      "date": "2025-07-18",
      "id": "116598",
      "original_text": "Registerbekanntmachung nach dem Umwandlungsgesetz\nBaden-Württemberg Amtsgericht Stuttgart HRB 748541\nCTG Cleanteam Gebäudemanagement GmbH – Schramberg",
      "type": "Registerbekanntmachung nach dem Umwandlungsgesetz",
      "state": "Baden-Württemberg",
      "amtsgericht": "Amtsgericht Stuttgart",
      "registernummer": "HRB 748541",
      "registerart": "HRB",
      "company_name": "CTG Cleanteam Gebäudemanagement GmbH",
      "company_seat": "Schramberg",
      "details": "18.07.2025 (Bekanntmachungsdatum)\n\nBaden-Württemberg Amtsgericht Stuttgart HRB 748541\nRegisterbekanntmachung nach dem Umwandlungsgesetz 18.07.2025 (Eintragungsdatum)\n\nCTG Cleanteam Gebäudemanagement GmbH\nGesellschaft mit beschränkter Haftung\nSchramberg\n\nAls nicht eingetragen wird bekanntgemacht: Den Gläubigern der an der Verschmelzung beteiligten Rechtsträger ist, wenn sie binnen sechs Monaten nach dem Tag, an dem die Eintragung der Verschmelzung in das Register des Sitzes desjenigen Rechtsträgers, dessen Gläubiger sie sind, nach § 19 Abs. 3 UmwG als bekanntgemacht gilt, ihren Anspruch nach Grund und Höhe schriftlich anmelden, Sicherheit zu leisten, soweit sie nicht Befriedigung verlangen können. Dieses Recht steht den Gläubigern jedoch nur zu, wenn sie glaubhaft machen, dass durch die Verschmelzung die Erfüllung ihrer Forderung gefährdet wird."
    },
    {
      "date": "2025-07-18",
      "id": "116599",
      "original_text": "Registerbekanntmachung nach dem Umwandlungsgesetz\nSchleswig-Holstein Amtsgericht Flensburg HRB 7990\nEuroScience Productions GmbH – Kappeln",
      "type": "Registerbekanntmachung nach dem Umwandlungsgesetz",
      "state": "Schleswig-Holstein",
      "amtsgericht": "Amtsgericht Flensburg",
      "registernummer": "HRB 7990",
      "registerart": "HRB",
      "company_name": "EuroScience Productions GmbH",
      "company_seat": "Kappeln",
      "details": "18.07.2025 (Bekanntmachungsdatum)\n\nSchleswig-Holstein Amtsgericht Flensburg HRB 7990\nRegisterbekanntmachung nach dem Umwandlungsgesetz 17.07.2025 (Eintragungsdatum)\n\nEuroScience Productions GmbH\nGesellschaft mit beschränkter Haftung\nKappeln\n\nZu Eintragungsnummer 3 vom 17.07.2025 wird als nicht eingetragen veröffentlicht: Den Gläubigern der an der Verschmelzung beteiligten Rechtsträger ist, wenn sie binnen sechs Monaten nach dem Tag, an dem die Eintragung der Verschmelzung in das Register des Sitzes desjenigen Rechtsträgers, dessen Gläubiger sie sind, als bekannt gemacht gilt, ihren Anspruch nach Grund und Höhe schriftlich anmelden, Sicherheit zu leisten, soweit sie nicht Befriedigung verlangen können. Dieses Recht steht den Gläubigern jedoch nur zu, wenn sie glaubhaft machen, dass durch die Verschmelzung die Erfüllung ihrer Forderung gefährdet wird. Das Recht, Sicherheitsleistung zu verlangen, steht Gläubigern nicht zu, die im Falle der Insolvenz ein Recht auf vorzugsweise Befriedigung aus einer Deckungsmasse haben, die nach gesetzlicher Vorschrift zu ihrem Schutz errichtet und staatlich überwacht ist."
    },
    {
      "date": "2025-07-18",
      "id": "116600",
      "original_text": "Einreichung neuer Dokumente\nBaden-Württemberg Amtsgericht Stuttgart HRB 451002\nTuttlinger Parkhaus GmbH – Tuttlingen",
      "type": "Einreichung neuer Dokumente",
      "state": "Baden-Württemberg",
      "amtsgericht": "Amtsgericht Stuttgart",
      "registernummer": "HRB 451002",
      "registerart": "HRB",
      "company_name": "Tuttlinger Parkhaus GmbH",
      "company_seat": "Tuttlingen",
      "details": "18.07.2025 (Bekanntmachungsdatum)\n\nBaden-Württemberg Amtsgericht Stuttgart HRB 451002\nEinreichung neuer Dokumente\n\nTuttlinger Parkhaus GmbH\nGesellschaft mit beschränkter Haftung\nTuttlingen\n\nDie Gesellschaft hat am 16.07.2025 die Liste über die Zusammensetzung des Aufsichtsrats zum Handelsregister eingereicht."
    },
    {
      "date": "2025-07-18",
      "id": "116601",
      "original_text": "Registerbekanntmachung nach dem Umwandlungsgesetz\nSachsen Amtsgericht Chemnitz HRB 22611\nSSA - Sächsische Sozialakademie gemeinnützige GmbH – Chemnitz",
      "type": "Registerbekanntmachung nach dem Umwandlungsgesetz",
      "state": "Sachsen",
      "amtsgericht": "Amtsgericht Chemnitz",
      "registernummer": "HRB 22611",
      "registerart": "HRB",
      "company_name": "SSA - Sächsische Sozialakademie gemeinnützige GmbH",
      "company_seat": "Chemnitz",
      "details": "18.07.2025 (Bekanntmachungsdatum)\n\nSachsen Amtsgericht Chemnitz HRB 22611\nRegisterbekanntmachung nach dem Umwandlungsgesetz 18.07.2025 (Eintragungsdatum)\n\nSSA - Sächsische Sozialakademie gemeinnützige GmbH\nGesellschaft mit beschränkter Haftung\nChemnitz\n\nDen Gläubigern der an der Ausgliederung beteiligten Rechtsträger ist, wenn sie binnen sechs Monaten nach dem Tag, an dem die Eintragung der Ausgliederung in das Register des Sitzes desjenigen Rechtsträgers, dessen Gläubiger sie sind, nach § 19 Abs. 3 UmwG als bekannt gemacht gilt, ihren Anspruch nach Grund und Höhe in Textform anmelden, Sicherheit zu leisten, soweit sie nicht Befriedigung verlangen können. Dieses Recht steht den Gläubigern jedoch nur zu, wenn sie glaubhaft machen, dass durch die Ausgliederung die Erfüllung der Forderung gefährdet wird."
    },
    {
      "date": "2025-07-18",
      "id": "116602",
      "original_text": "Registerbekanntmachung nach dem Umwandlungsgesetz\nSachsen Amtsgericht Chemnitz HRB 37558\nSSA gGmbH - Jugendhilfe – Chemnitz",
      "type": "Registerbekanntmachung nach dem Umwandlungsgesetz",
      "state": "Sachsen",
      "amtsgericht": "Amtsgericht Chemnitz",
      "registernummer": "HRB 37558",
      "registerart": "HRB",
      "company_name": "SSA gGmbH - Jugendhilfe",
      "company_seat": "Chemnitz",
      "details": "18.07.2025 (Bekanntmachungsdatum)\n\nSachsen Amtsgericht Chemnitz HRB 37558\nRegisterbekanntmachung nach dem Umwandlungsgesetz 18.07.2025 (Eintragungsdatum)\n\nSSA gGmbH - Jugendhilfe\nGesellschaft mit beschränkter Haftung\nChemnitz\n\nDen Gläubigern der an der Ausgliederung beteiligten Rechtsträger ist, wenn sie binnen sechs Monaten nach dem Tag, an dem die Eintragung der Ausgliederung in das Register des Sitzes desjenigen Rechtsträgers, dessen Gläubiger sie sind, nach § 19 Abs. 3 UmwG als bekannt gemacht gilt, ihren Anspruch nach Grund und Höhe in Textform anmelden, Sicherheit zu leisten, soweit sie nicht Befriedigung verlangen können. Dieses Recht steht den Gläubigern jedoch nur zu, wenn sie glaubhaft machen, dass durch die Ausgliederung die Erfüllung der Forderung gefährdet wird."
    },
    {
      "date": "2025-07-18",
      "id": "116603",
      "original_text": "Registerbekanntmachung nach dem Umwandlungsgesetz\nSachsen Amtsgericht Chemnitz HRB 3056\nReisebüro West-Sax-Tours-GmbH – Chemnitz",
      "type": "Registerbekanntmachung nach dem Umwandlungsgesetz",
      "state": "Sachsen",
      "amtsgericht": "Amtsgericht Chemnitz",
      "registernummer": "HRB 3056",
      "registerart": "HRB",
      "company_name": "Reisebüro West-Sax-Tours-GmbH",
      "company_seat": "Chemnitz",
      "details": "18.07.2025 (Bekanntmachungsdatum)\n\nSachsen Amtsgericht Chemnitz HRB 3056\nRegisterbekanntmachung nach dem Umwandlungsgesetz 18.07.2025 (Eintragungsdatum)\n\nReisebüro West-Sax-Tours-GmbH\nGesellschaft mit beschränkter Haftung\nChemnitz\n\nDen Gläubigern der an der Verschmelzung beteiligten Rechtsträger ist, wenn sie binnen sechs Monaten nach dem Tag, an dem die Eintragung der Verschmelzung in das Register des Sitzes desjenigen Rechtsträgers, dessen Gläubiger sie sind, nach § 19 Abs. 3 UmwG als bekannt gemacht gilt, ihren Anspruch nach Grund und Höhe in Textform anmelden, Sicherheit zu leisten, soweit sie nicht Befriedigung verlangen können. Dieses Recht steht den Gläubigern jedoch nur zu, wenn sie glaubhaft machen, dass durch die Verschmelzung die Erfüllung der Forderung gefährdet wird."
    },
    {
      "date": "2025-07-18",
      "id": "116604",
      "original_text": "Einreichung neuer Dokumente\nSachsen Amtsgericht Chemnitz HRB 19159\nMogatec GmbH – Drebach",
      "type": "Einreichung neuer Dokumente",
      "state": "Sachsen",
      "amtsgericht": "Amtsgericht Chemnitz",
      "registernummer": "HRB 19159",
      "registerart": "HRB",
      "company_name": "Mogatec GmbH",
      "company_seat": "Drebach",
      "details": "18.07.2025 (Bekanntmachungsdatum)\n\nSachsen Amtsgericht Chemnitz HRB 19159\nEinreichung neuer Dokumente\n\nMogatec GmbH\nGesellschaft mit beschränkter Haftung\nDrebach\n\nAm 16.07.2025 wurde beim Handelsregister des Amtsgerichts Chemnitz die Liste der Mitglieder des Aufsichtsrats gemäß § 52 GmbHG eingereicht."
    },
    {
      "date": "2025-07-18",
      "id": "116605",
      "original_text": "Registerbekanntmachung nach dem Umwandlungsgesetz\nSachsen Amtsgericht Chemnitz HRB 15294\nAutohaus Thomas Schneider GmbH – Reichenbach im Vogtland",
      "type": "Registerbekanntmachung nach dem Umwandlungsgesetz",
      "state": "Sachsen",
      "amtsgericht": "Amtsgericht Chemnitz",
      "registernummer": "HRB 15294",
      "registerart": "HRB",
      "company_name": "Autohaus Thomas Schneider GmbH",
      "company_seat": "Reichenbach im Vogtland",
      "details": "18.07.2025 (Bekanntmachungsdatum)\n\nSachsen Amtsgericht Chemnitz HRB 15294\nRegisterbekanntmachung nach dem Umwandlungsgesetz 18.07.2025 (Eintragungsdatum)\n\nAutohaus Thomas Schneider GmbH\nGesellschaft mit beschränkter Haftung\nReichenbach im Vogtland\n\nDen Gläubigern der an der Verschmelzung beteiligten Rechtsträger ist, wenn sie binnen sechs Monaten nach dem Tag, an dem die Eintragung der Verschmelzung in das Register des Sitzes desjenigen Rechtsträgers, dessen Gläubiger sie sind, nach § 19 Abs. 3 UmwG als bekannt gemacht gilt, ihren Anspruch nach Grund und Höhe in Textform anmelden, Sicherheit zu leisten, soweit sie nicht Befriedigung verlangen können. Dieses Recht steht den Gläubigern jedoch nur zu, wenn sie glaubhaft machen, dass durch die Verschmelzung die Erfüllung der Forderung gefährdet wird."
    },
    {
      "date": "2025-07-18",
      "id": "116606",
      "original_text": "Sonstige Registerbekanntmachung\nSachsen Amtsgericht Chemnitz HRB 15294\nAutohaus Thomas Schneider GmbH – Reichenbach im Vogtland",
      "type": "Sonstige Registerbekanntmachung",
      "state": "Sachsen",
      "amtsgericht": "Amtsgericht Chemnitz",
      "registernummer": "HRB 15294",
      "registerart": "HRB",
      "company_name": "Autohaus Thomas Schneider GmbH",
      "company_seat": "Reichenbach im Vogtland",
      "details": "18.07.2025 (Bekanntmachungsdatum)\n\nSachsen Amtsgericht Chemnitz HRB 15294\nSonstige Registerbekanntmachung 18.07.2025 (Eintragungsdatum)\n\nAutohaus Thomas Schneider GmbH\nGesellschaft mit beschränkter Haftung\nReichenbach im Vogtland\n\nDen Gläubigern der Gesellschaft, deren Forderungen begründet worden sind bevor die Eintragung der Beendigung des Beherrschungs- und Gewinnabführungsvertrages in das Handelsregister nach § 10 des Handelsgesetzbuches als bekanntgemacht gilt, hat der andere Vertragsteil Sicherheit zu leisten, wenn sie sich binnen sechs Monaten nach der Bekanntmachung der Eintragung zu diesem Zweck bei ihm melden."
    },
    {
      "date": "2025-07-18",
      "id": "116607",
      "original_text": "Registerbekanntmachung nach dem Umwandlungsgesetz\nSachsen Amtsgericht Chemnitz HRB 19685\nACC AutoCentrum Carl GmbH – Plauen",
      "type": "Registerbekanntmachung nach dem Umwandlungsgesetz",
      "state": "Sachsen",
      "amtsgericht": "Amtsgericht Chemnitz",
      "registernummer": "HRB 19685",
      "registerart": "HRB",
      "company_name": "ACC AutoCentrum Carl GmbH",
      "company_seat": "Plauen",
      "details": "18.07.2025 (Bekanntmachungsdatum)\n\nSachsen Amtsgericht Chemnitz HRB 19685\nRegisterbekanntmachung nach dem Umwandlungsgesetz 18.07.2025 (Eintragungsdatum)\n\nACC AutoCentrum Carl GmbH\nGesellschaft mit beschränkter Haftung\nPlauen\n\nDen Gläubigern der an der Verschmelzung beteiligten Rechtsträger ist, wenn sie binnen sechs Monaten nach dem Tag, an dem die Eintragung der Verschmelzung in das Register des Sitzes desjenigen Rechtsträgers, dessen Gläubiger sie sind, nach § 19 Abs. 3 UmwG als bekannt gemacht gilt, ihren Anspruch nach Grund und Höhe in Textform anmelden, Sicherheit zu leisten, soweit sie nicht Befriedigung verlangen können. Dieses Recht steht den Gläubigern jedoch nur zu, wenn sie glaubhaft machen, dass durch die Verschmelzung die Erfüllung der Forderung gefährdet wird."
    },
    {
      "date": "2025-07-18",
      "id": "116608",
      "original_text": "Registerbekanntmachung nach dem Umwandlungsgesetz\nSachsen Amtsgericht Chemnitz HRA 10254\nRB West-Sax-Tours Barbara Lottig e.K. – Chemnitz",
      "type": "Registerbekanntmachung nach dem Umwandlungsgesetz",
      "state": "Sachsen",
      "amtsgericht": "Amtsgericht Chemnitz",
      "registernummer": "HRA 10254",
      "registerart": "HRA",
      "company_name": "RB West-Sax-Tours Barbara Lottig e.K.",
      "company_seat": "Chemnitz",
      "details": "18.07.2025 (Bekanntmachungsdatum)\n\nSachsen Amtsgericht Chemnitz HRA 10254\nRegisterbekanntmachung nach dem Umwandlungsgesetz 18.07.2025 (Eintragungsdatum)\n\nRB West-Sax-Tours Barbara Lottig e.K.\nEinzelkaufmann / Einzelkauffrau\nChemnitz\n\nDen Gläubigern der an der Verschmelzung beteiligten Rechtsträger ist, wenn sie binnen sechs Monaten nach dem Tag, an dem die Eintragung der Verschmelzung in das Register des Sitzes desjenigen Rechtsträgers, dessen Gläubiger sie sind, nach § 19 Abs. 3 UmwG als bekannt gemacht gilt, ihren Anspruch nach Grund und Höhe in Textform anmelden, Sicherheit zu leisten, soweit sie nicht Befriedigung verlangen können. Dieses Recht steht den Gläubigern jedoch nur zu, wenn sie glaubhaft machen, dass durch die Verschmelzung die Erfüllung der Forderung gefährdet wird."
    },
    {
      "date": "2025-07-18",
      "id": "116609",
      "original_text": "Registerbekanntmachung nach dem Umwandlungsgesetz\nSachsen Amtsgericht Dresden HRB 38510\nAufzugbau Dresden GmbH – Dresden",
      "type": "Registerbekanntmachung nach dem Umwandlungsgesetz",
      "state": "Sachsen",
      "amtsgericht": "Amtsgericht Dresden",
      "registernummer": "HRB 38510",
      "registerart": "HRB",
      "company_name": "Aufzugbau Dresden GmbH",
      "company_seat": "Dresden",
      "details": "18.07.2025 (Bekanntmachungsdatum)\n\nSachsen Amtsgericht Dresden HRB 38510\nRegisterbekanntmachung nach dem Umwandlungsgesetz 18.07.2025 (Eintragungsdatum)\n\nAufzugbau Dresden GmbH\nGesellschaft mit beschränkter Haftung\nDresden\n\nDen Gläubigern der an der Verschmelzung beteiligten Rechtsträger ist, wenn sie binnen sechs Monaten nach dem Tag, an dem die Eintragung der Verschmelzung in das Register des Sitzes desjenigen Rechtsträgers, dessen Gläubiger sie sind, nach § 19 Abs. 3 UmwG als bekannt gemacht gilt, ihren Anspruch nach Grund und Höhe in Textform anmelden, Sicherheit zu leisten, soweit sie nicht Befriedigung verlangen können. Dieses Recht steht den Gläubigern jedoch nur zu, wenn sie glaubhaft machen, dass durch die Verschmelzung die Erfüllung der Forderung gefährdet wird."
    },
    {
      "date": "2025-07-18",
      "id": "116610",
      "original_text": "Einreichung neuer Dokumente\nNiedersachsen Amtsgericht Osnabrück HRB 214664\nKME Germany GmbH – Osnabrück",
      "type": "Einreichung neuer Dokumente",
      "state": "Niedersachsen",
      "amtsgericht": "Amtsgericht Osnabrück",
      "registernummer": "HRB 214664",
      "registerart": "HRB",
      "company_name": "KME Germany GmbH",
      "company_seat": "Osnabrück",
      "details": "18.07.2025 (Bekanntmachungsdatum)\n\nNiedersachsen Amtsgericht Osnabrück HRB 214664\nEinreichung neuer Dokumente 18.07.2025 (Eintragungsdatum)\n\nKME Germany GmbH\nGesellschaft mit beschränkter Haftung\nOsnabrück\n\nDie Liste der Mitglieder des Aufsichtsrats wurde beim Registergericht eingereicht."
    },
    {
      "date": "2025-07-18",
      "id": "116611",
      "original_text": "Registerbekanntmachung nach dem Umwandlungsgesetz\nNiedersachsen Amtsgericht Hildesheim HRB 209744\nMetsch Technik GmbH – Lehrte",
      "type": "Registerbekanntmachung nach dem Umwandlungsgesetz",
      "state": "Niedersachsen",
      "amtsgericht": "Amtsgericht Hildesheim",
      "registernummer": "HRB 209744",
      "registerart": "HRB",
      "company_name": "Metsch Technik GmbH",
      "company_seat": "Lehrte",
      "details": "18.07.2025 (Bekanntmachungsdatum)\n\nNiedersachsen Amtsgericht Hildesheim HRB 209744\nRegisterbekanntmachung nach dem Umwandlungsgesetz 18.07.2025 (Eintragungsdatum)\n\nMetsch Technik GmbH\nGesellschaft mit beschränkter Haftung\nLehrte\n\nDen Gläubigern der an der Verschmelzung beteiligten Rechtsträger ist, wenn sie binnen sechs Monaten nach dem Tag, an dem die Eintragung der Verschmelzung in das Register des Sitzes desjenigen Rechtsträgers, dessen Gläubiger sie sind, nach § 19  Abs.  3 UmwG als bekannt gemacht gilt, ihren Anspruch nach Grund und Höhe schriftlich anmelden, Sicherheit zu leisten, soweit sie nicht Befriedigung verlangen können. Dieses Recht steht den Gläubigern jedoch nur zu, wenn sie glaubhaft machen, dass durch die Verschmelzung die Erfüllung der Forderung gefährdet wird."
    },
    {
      "date": "2025-07-18",
      "id": "116612",
      "original_text": "Löschungsankündigung\nNiedersachsen Amtsgericht Osnabrück HRA 204014\nElektrotechnik Rüschen GmbH & Co. KG - Systemtechnik - – Sustrum",
      "type": "Löschungsankündigung",
      "state": "Niedersachsen",
      "amtsgericht": "Amtsgericht Osnabrück",
      "registernummer": "HRA 204014",
      "registerart": "HRA",
      "company_name": "Elektrotechnik Rüschen GmbH & Co. KG - Systemtechnik -",
      "company_seat": "Sustrum",
      "details": "18.07.2025 (Bekanntmachungsdatum)\n\nNiedersachsen Amtsgericht Osnabrück HRA 204014\nLöschungsankündigung\n\nElektrotechnik Rüschen GmbH & Co. KG - Systemtechnik -\nKommanditgesellschaft\nSustrum\n\nDas Registergericht beabsichtigt, die Firma von Amts wegen nach § 394 FamFG wegen Vermögenslosigkeit zu löschen. Die Frist zur Erhebung eines Widerspruchs ist auf 1 Monat ab dieser Registerbekanntmachung festgesetzt."
    },
    {
      "date": "2025-07-18",
      "id": "116613",
      "original_text": "Registerbekanntmachung nach dem Umwandlungsgesetz\nNiedersachsen Amtsgericht Hildesheim HRB 207348\nELTEC Solutions UG (haftungsbeschränkt) – Lehrte",
      "type": "Registerbekanntmachung nach dem Umwandlungsgesetz",
      "state": "Niedersachsen",
      "amtsgericht": "Amtsgericht Hildesheim",
      "registernummer": "HRB 207348",
      "registerart": "HRB",
      "company_name": "ELTEC Solutions UG (haftungsbeschränkt)",
      "company_seat": "Lehrte",
      "details": "18.07.2025 (Bekanntmachungsdatum)\n\nNiedersachsen Amtsgericht Hildesheim HRB 207348\nRegisterbekanntmachung nach dem Umwandlungsgesetz 18.07.2025 (Eintragungsdatum)\n\nELTEC Solutions UG (haftungsbeschränkt)\nGesellschaft mit beschränkter Haftung\nLehrte\n\nDen Gläubigern der an der Verschmelzung beteiligten Rechtsträger ist, wenn sie binnen sechs Monaten nach dem Tag, an dem die Eintragung der Verschmelzung in das Register des Sitzes desjenigen Rechtsträgers, dessen Gläubiger sie sind, nach § 19  Abs.  3 UmwG als bekannt gemacht gilt, ihren Anspruch nach Grund und Höhe schriftlich anmelden, Sicherheit zu leisten, soweit sie nicht Befriedigung verlangen können. Dieses Recht steht den Gläubigern jedoch nur zu, wenn sie glaubhaft machen, dass durch die Verschmelzung die Erfüllung der Forderung gefährdet wird."
    },
    {
      "date": "2025-07-18",
      "id": "116614",
      "original_text": "Einreichung neuer Dokumente\nNiedersachsen Amtsgericht Lüneburg HRB 220\nHafen Lüneburg GmbH – Lüneburg",
      "type": "Einreichung neuer Dokumente",
      "state": "Niedersachsen",
      "amtsgericht": "Amtsgericht Lüneburg",
      "registernummer": "HRB 220",
      "registerart": "HRB",
      "company_name": "Hafen Lüneburg GmbH",
      "company_seat": "Lüneburg",
      "details": "18.07.2025 (Bekanntmachungsdatum)\n\nNiedersachsen Amtsgericht Lüneburg HRB 220\nEinreichung neuer Dokumente\n\nHafen Lüneburg GmbH\nGesellschaft mit beschränkter Haftung\nLüneburg\n\nDie Liste der Mitglieder des Aufsichtsrats wurde beim Registergericht eingereicht."
    },
    {
      "date": "2025-07-18",
      "id": "116615",
      "original_text": "Registerbekanntmachung nach dem Umwandlungsgesetz\nRheinland-Pfalz Amtsgericht Ludwigshafen a.Rhein (Ludwigshafen) HRB 70305\nVERWA Bau-GmbH – Ludwigshafen am Rhein",
      "type": "Registerbekanntmachung nach dem Umwandlungsgesetz",
      "state": "Rheinland-Pfalz",
      "amtsgericht": "Amtsgericht Ludwigshafen a.Rhein (Ludwigshafen)",
      "registernummer": "HRB 70305",
      "registerart": "HRB",
      "company_name": "VERWA Bau-GmbH",
      "company_seat": "Ludwigshafen am Rhein",
      "details": "18.07.2025 (Bekanntmachungsdatum)\n\nRheinland-Pfalz Amtsgericht Ludwigshafen a.Rhein (Ludwigshafen) HRB 70305\nRegisterbekanntmachung nach dem Umwandlungsgesetz 18.07.2025 (Eintragungsdatum)\n\nVERWA Bau-GmbH\nGesellschaft mit beschränkter Haftung\nLudwigshafen am Rhein\n\nAls nicht eingetragen wird veröffentlicht: Den Gläubiger*innen der an der Verschmelzung beteiligten Rechtsträger ist, wenn sie binnen sechs Monaten nach dem Tag, an dem die Eintragung der Verschmelzung in das Register des Sitzes desjenigen Rechtsträgers, dessen Gläubiger*in sie sind, nach § 19 Abs. 3 UmwG als bekannt gemacht gilt, ihren Anspruch nach Grund und Höhe schriftlich anmelden, Sicherheit zu leisten, soweit sie nicht Befriedigung verlangen können. Dieses Recht steht den Gläubiger*innen jedoch nur zu, wenn sie glaubhaft machen, dass durch die Verschmelzung die Erfüllung der Forderung gefährdet wird."
    },
    {
      "date": "2025-07-18",
      "id": "116616",
      "original_text": "Registerbekanntmachung nach dem Umwandlungsgesetz\nNordrhein-Westfalen Amtsgericht Steinfurt HRB 4040\napetito Aktiengesellschaft – Rheine",
      "type": "Registerbekanntmachung nach dem Umwandlungsgesetz",
      "state": "Nordrhein-Westfalen",
      "amtsgericht": "Amtsgericht Steinfurt",
      "registernummer": "HRB 4040",
      "registerart": "HRB",
      "company_name": "apetito Aktiengesellschaft",
      "company_seat": "Rheine",
      "details": "18.07.2025 (Bekanntmachungsdatum)\n\nNordrhein-Westfalen Amtsgericht Steinfurt HRB 4040\nRegisterbekanntmachung nach dem Umwandlungsgesetz\n\napetito Aktiengesellschaft\nAktiengesellschaft\nRheine\n\nDem Registergericht ist ein Vertrag über die geplante Verschmelzung der Petito´s Bistro Gastronomie GmbH mit der apetito Aktiengesellschaft eingereicht worden."
    },
    {
      "date": "2025-07-18",
      "id": "116617",
      "original_text": "Registerbekanntmachung nach dem Umwandlungsgesetz\nNordrhein-Westfalen Amtsgericht Essen HRB 37052\nKOMOTO GmbH – Essen",
      "type": "Registerbekanntmachung nach dem Umwandlungsgesetz",
      "state": "Nordrhein-Westfalen",
      "amtsgericht": "Amtsgericht Essen",
      "registernummer": "HRB 37052",
      "registerart": "HRB",
      "company_name": "KOMOTO GmbH",
      "company_seat": "Essen",
      "details": "18.07.2025 (Bekanntmachungsdatum)\n\nNordrhein-Westfalen Amtsgericht Essen HRB 37052\nRegisterbekanntmachung nach dem Umwandlungsgesetz 18.07.2025 (Eintragungsdatum)\n\nKOMOTO GmbH\nGesellschaft mit beschränkter Haftung\nEssen\n\nDen Gläubigern der an der formwechselnden Umwandlung beteiligten Rechtsträger ist, wenn sie binnen sechs Monaten nach dem Tag, an dem die Eintragung der formwechselnden Umwandlung in das Register des Sitzes desjenigen Rechtsträgers, dessen Gläubiger sie sind, nach § 19 Absatz 3 UmwG als bekanntgemacht gilt, ihren Anspruch nach Grund und Höhe schriftlich anmelden, Sicherheit zu leisten, soweit sie nicht Befriedigung verlangen können. Dieses Recht steht den Gläubigern jedoch nur zu, wenn sie glaubhaft machen, dass durch die formwechselnden Umwandlung die Erfüllung ihrer Forderung gefährdet wird."
    },
    {
      "date": "2025-07-18",
      "id": "116618",
      "original_text": "Registerbekanntmachung nach dem Umwandlungsgesetz\nNordrhein-Westfalen Amtsgericht Bielefeld HRB 46270\nh + p hachmeister + partner GmbH – Bielefeld",
      "type": "Registerbekanntmachung nach dem Umwandlungsgesetz",
      "state": "Nordrhein-Westfalen",
      "amtsgericht": "Amtsgericht Bielefeld",
      "registernummer": "HRB 46270",
      "registerart": "HRB",
      "company_name": "h + p hachmeister + partner GmbH",
      "company_seat": "Bielefeld",
      "details": "18.07.2025 (Bekanntmachungsdatum)\n\nNordrhein-Westfalen Amtsgericht Bielefeld HRB 46270\nRegisterbekanntmachung nach dem Umwandlungsgesetz 18.07.2025 (Eintragungsdatum)\n\nh + p hachmeister + partner GmbH\nGesellschaft mit beschränkter Haftung\nBielefeld\n\nDen Gläubigern der an der Verschmelzung beteiligten Rechtsträger ist, wenn sie binnen sechs Monaten nach dem Tag, an dem die Eintragung der Verschmelzung in das Register des Sitzes desjenigen Rechtsträgers, dessen Gläubiger sie sind, nach § 19 Absatz 3 UmwG als bekanntgemacht gilt, ihren Anspruch nach Grund und Höhe schriftlich anmelden, Sicherheit zu leisten, soweit sie nicht Befriedigung verlangen können. Dieses Recht steht den Gläubigern jedoch nur zu, wenn sie glaubhaft machen, dass durch die Verschmelzung die Erfüllung ihrer Forderung gefährdet wird."
    },
    {
      "date": "2025-07-18",
      "id": "116619",
      "original_text": "Registerbekanntmachung nach dem Umwandlungsgesetz\nNordrhein-Westfalen Amtsgericht Essen HRA 11900\nKomoto OHG – Essen",
      "type": "Registerbekanntmachung nach dem Umwandlungsgesetz",
      "state": "Nordrhein-Westfalen",
      "amtsgericht": "Amtsgericht Essen",
      "registernummer": "HRA 11900",
      "registerart": "HRA",
      "company_name": "Komoto OHG",
      "company_seat": "Essen",
      "details": "18.07.2025 (Bekanntmachungsdatum)\n\nNordrhein-Westfalen Amtsgericht Essen HRA 11900\nRegisterbekanntmachung nach dem Umwandlungsgesetz 18.07.2025 (Eintragungsdatum)\n\nKomoto OHG\nOffene Handelsgesellschaft\nEssen\n\nDen Gläubigern der an der formwechselnden Umwandlung beteiligten Rechtsträger ist, wenn sie binnen sechs Monaten nach dem Tag, an dem die Eintragung der formwechselnden Umwandlung in das Register des Sitzes desjenigen Rechtsträgers, dessen Gläubiger sie sind, nach § 19 Absatz 3 UmwG als bekanntgemacht gilt, ihren Anspruch nach Grund und Höhe schriftlich anmelden, Sicherheit zu leisten, soweit sie nicht Befriedigung verlangen können. Dieses Recht steht den Gläubigern jedoch nur zu, wenn sie glaubhaft machen, dass durch die formwechselnden Umwandlung die Erfüllung ihrer Forderung gefährdet wird."
    },
    {
      "date": "2025-07-18",
      "id": "116620",
      "original_text": "Registerbekanntmachung nach dem Umwandlungsgesetz\nBremen Amtsgericht Bremen HRB 20742\nDeutsche Angestellten-Akademie Bremen GmbH – Bremen",
      "type": "Registerbekanntmachung nach dem Umwandlungsgesetz",
      "state": "Bremen",
      "amtsgericht": "Amtsgericht Bremen",
      "registernummer": "HRB 20742",
      "registerart": "HRB",
      "company_name": "Deutsche Angestellten-Akademie Bremen GmbH",
      "company_seat": "Bremen",
      "details": "18.07.2025 (Bekanntmachungsdatum)\n\nBremen Amtsgericht Bremen HRB 20742\nRegisterbekanntmachung nach dem Umwandlungsgesetz 11.07.2025 (Eintragungsdatum)\n\nDeutsche Angestellten-Akademie Bremen GmbH\nGesellschaft mit beschränkter Haftung\nBremen\n\nZu Eintragungsnummer 8 vom 11.07.2025 wird als nicht eingetragen veröffentlicht: Den Gläubigern der an der Verschmelzung beteiligten Rechtsträger ist, wenn sie binnen sechs Monaten nach dem Tag, an dem die Eintragung der Verschmelzung in das Register des Sitzes desjenigen Rechtsträgers, dessen Gläubiger sie sind, als bekannt gemacht gilt, ihren Anspruch nach Grund und Höhe schriftlich anmelden, Sicherheit zu leisten, soweit sie nicht Befriedigung verlangen können. Dieses Recht steht den Gläubigern jedoch nur zu, wenn sie glaubhaft machen, dass durch die Verschmelzung die Erfüllung ihrer Forderung gefährdet wird. Das Recht, Sicherheitsleistung zu verlangen, steht Gläubigern nicht zu, die im Falle der Insolvenz ein Recht auf vorzugsweise Befriedigung aus einer Deckungsmasse haben, die nach gesetzlicher Vorschrift zu ihrem Schutz errichtet und staatlich überwacht ist."
    },
    {
      "date": "2025-07-18",
      "id": "116621",
      "original_text": "Löschungsankündigung\nBremen Amtsgericht Bremen HRA 30458\nPV PROJEKT 24 UG (haftungsbeschränkt) & Co. KG – Bremen",
      "type": "Löschungsankündigung",
      "state": "Bremen",
      "amtsgericht": "Amtsgericht Bremen",
      "registernummer": "HRA 30458",
      "registerart": "HRA",
      "company_name": "PV PROJEKT 24 UG (haftungsbeschränkt) & Co. KG",
      "company_seat": "Bremen",
      "details": "18.07.2025 (Bekanntmachungsdatum)\n\nBremen Amtsgericht Bremen HRA 30458\nLöschungsankündigung\n\nPV PROJEKT 24 UG (haftungsbeschränkt) & Co. KG\nKommanditgesellschaft\nBremen\n\nEs ist beabsichtigt die im Handelsregister eingetragene Firma von Amts wegen gemäß § 31 Abs.2 HGB zu löschen. Gegen die Löschung kann beim AG Bremen schriftlich oder zu Protokoll der Geschäftsstelle Widerspruch eingelegt werden. Widerspruchsfrist 4 Wochen."
    },
    {
      "date": "2025-07-18",
      "id": "116622",
      "original_text": "Registerbekanntmachung nach dem Umwandlungsgesetz\nNordrhein-Westfalen Amtsgericht Bielefeld HRB 38206\nh + p hachmeister Verwaltungs-GmbH – Bielefeld",
      "type": "Registerbekanntmachung nach dem Umwandlungsgesetz",
      "state": "Nordrhein-Westfalen",
      "amtsgericht": "Amtsgericht Bielefeld",
      "registernummer": "HRB 38206",
      "registerart": "HRB",
      "company_name": "h + p hachmeister Verwaltungs-GmbH",
      "company_seat": "Bielefeld",
      "details": "18.07.2025 (Bekanntmachungsdatum)\n\nNordrhein-Westfalen Amtsgericht Bielefeld HRB 38206\nRegisterbekanntmachung nach dem Umwandlungsgesetz 18.07.2025 (Eintragungsdatum)\n\nh + p hachmeister Verwaltungs-GmbH\nGesellschaft mit beschränkter Haftung\nBielefeld\n\nDen Gläubigern der an der Verschmelzung beteiligten Rechtsträger ist, wenn sie binnen sechs Monaten nach dem Tag, an dem die Eintragung der Verschmelzung in das Register des Sitzes desjenigen Rechtsträgers, dessen Gläubiger sie sind, nach § 19 Absatz 3 UmwG als bekanntgemacht gilt, ihren Anspruch nach Grund und Höhe schriftlich anmelden, Sicherheit zu leisten, soweit sie nicht Befriedigung verlangen können. Dieses Recht steht den Gläubigern jedoch nur zu, wenn sie glaubhaft machen, dass durch die Verschmelzung die Erfüllung ihrer Forderung gefährdet wird."
    },
    {
      "date": "2025-07-18",
      "id": "116623",
      "original_text": "Registerbekanntmachung nach dem Umwandlungsgesetz\nNordrhein-Westfalen Amtsgericht Düsseldorf HRA 25913\nBorodimos Immobilien UG (haftungsbeschränkt) & Co. KG – Düsseldorf",
      "type": "Registerbekanntmachung nach dem Umwandlungsgesetz",
      "state": "Nordrhein-Westfalen",
      "amtsgericht": "Amtsgericht Düsseldorf",
      "registernummer": "HRA 25913",
      "registerart": "HRA",
      "company_name": "Borodimos Immobilien UG (haftungsbeschränkt) & Co. KG",
      "company_seat": "Düsseldorf",
      "details": "18.07.2025 (Bekanntmachungsdatum)\n\nNordrhein-Westfalen Amtsgericht Düsseldorf HRA 25913\nRegisterbekanntmachung nach dem Umwandlungsgesetz 18.07.2025 (Eintragungsdatum)\n\nBorodimos Immobilien UG (haftungsbeschränkt) & Co. KG\nKommanditgesellschaft\nDüsseldorf\n\nDen Gläubigern der an der Verschmelzung beteiligten Rechtsträger ist, wenn sie binnen sechs Monaten nach dem Tag, an dem die Eintragung der Verschmelzung in das Register des Sitzes desjenigen Rechtsträgers, dessen Gläubiger sie sind, nach § 19 Absatz 3 UmwG als bekanntgemacht gilt, ihren Anspruch nach Grund und Höhe schriftlich anmelden, Sicherheit zu leisten, soweit sie nicht Befriedigung verlangen können. Dieses Recht steht den Gläubigern jedoch nur zu, wenn sie glaubhaft machen, dass durch die Verschmelzung die Erfüllung ihrer Forderung gefährdet wird."
    },
    {
      "date": "2025-07-18",
      "id": "116624",
      "original_text": "Löschungsankündigung\nNordrhein-Westfalen Amtsgericht Gelsenkirchen HRB 14195\nERNANI GmbH – Gelsenkirchen",
      "type": "Löschungsankündigung",
      "state": "Nordrhein-Westfalen",
      "amtsgericht": "Amtsgericht Gelsenkirchen",
      "registernummer": "HRB 14195",
      "registerart": "HRB",
      "company_name": "ERNANI GmbH",
      "company_seat": "Gelsenkirchen",
      "details": "18.07.2025 (Bekanntmachungsdatum)\n\nNordrhein-Westfalen Amtsgericht Gelsenkirchen HRB 14195\nLöschungsankündigung\n\nERNANI GmbH\nGesellschaft mit beschränkter Haftung\nGelsenkirchen\n\nDas Gericht beabsichtigt, die im Handelsregister eingetragene ERNANI GmbH mit Sitz in Gelsenkirchen, HRB 14195, Amtsgericht Gelsenkirchen, wegen Vermögenslosigkeit zu löschen.\nHiermit wird denjenigen, die an der Unterlassung der Löschung ein berechtigtes Interesse haben, gem. § 394 Abs. 2 FamFG Gelegenheit gegeben, gegen dieses Vorhaben binnen eines Monats nach dieser Bekanntmachung Widerspruch einzulegen. Der Widerspruch kann schriftlich oder zu Protokoll der Geschäftsstelle erhoben werden."
    },
    {
      "date": "2025-07-18",
      "id": "116625",
      "original_text": "Registerbekanntmachung nach dem Umwandlungsgesetz\nNordrhein-Westfalen Amtsgericht Köln HRA 37348\nHappyversum GmbH & Co. KG – Brühl",
      "type": "Registerbekanntmachung nach dem Umwandlungsgesetz",
      "state": "Nordrhein-Westfalen",
      "amtsgericht": "Amtsgericht Köln",
      "registernummer": "HRA 37348",
      "registerart": "HRA",
      "company_name": "Happyversum GmbH & Co. KG",
      "company_seat": "Brühl",
      "details": "18.07.2025 (Bekanntmachungsdatum)\n\nNordrhein-Westfalen Amtsgericht Köln HRA 37348\nRegisterbekanntmachung nach dem Umwandlungsgesetz 18.07.2025 (Eintragungsdatum)\n\nHappyversum GmbH & Co. KG\nKommanditgesellschaft\nBrühl\n\nDen Gläubigern der an der Abspaltung beteiligten Rechtsträger ist, wenn sie binnen sechs Monaten nach dem Tag, an dem die Eintragung der Abspaltung in das Register des Sitzes desjenigen Rechtsträgers, dessen Gläubiger sie sind, nach § 19 Absatz 3 UmwG als bekanntgemacht gilt, ihren Anspruch nach Grund und Höhe schriftlich anmelden, Sicherheit zu leisten, soweit sie nicht Befriedigung verlangen können. Dieses Recht steht den Gläubigern jedoch nur zu, wenn sie glaubhaft machen, dass durch die Abspaltung die Erfüllung ihrer Forderung gefährdet wird."
    },
    {
      "date": "2025-07-18",
      "id": "116626",
      "original_text": "Registerbekanntmachung nach dem Umwandlungsgesetz\nNordrhein-Westfalen Amtsgericht Münster HRB 14689\n[pma:] Nord GmbH – Münster",
      "type": "Registerbekanntmachung nach dem Umwandlungsgesetz",
      "state": "Nordrhein-Westfalen",
      "amtsgericht": "Amtsgericht Münster",
      "registernummer": "HRB 14689",
      "registerart": "HRB",
      "company_name": "[pma:] Nord GmbH",
      "company_seat": "Münster",
      "details": "18.07.2025 (Bekanntmachungsdatum)\n\nNordrhein-Westfalen Amtsgericht Münster HRB 14689\nRegisterbekanntmachung nach dem Umwandlungsgesetz 18.07.2025 (Eintragungsdatum)\n\n[pma:] Nord GmbH\nGesellschaft mit beschränkter Haftung\nMünster\n\nDen Gläubigern der an der Verschmelzung beteiligten Rechtsträger ist, wenn sie binnen sechs Monaten nach dem Tag, an dem die Eintragung der Verschmelzung in das Register des Sitzes desjenigen Rechtsträgers, dessen Gläubiger sie sind, nach § 19 Absatz 3 UmwG als bekanntgemacht gilt, ihren Anspruch nach Grund und Höhe schriftlich anmelden, Sicherheit zu leisten, soweit sie nicht Befriedigung verlangen können. Dieses Recht steht den Gläubigern jedoch nur zu, wenn sie glaubhaft machen, dass durch die Verschmelzung die Erfüllung ihrer Forderung gefährdet wird."
    },
    {
      "date": "2025-07-18",
      "id": "116627",
      "original_text": "Registerbekanntmachung nach dem Umwandlungsgesetz\nNordrhein-Westfalen Amtsgericht Düsseldorf HRA 28284\nRolf Heinz Otto Prost Vermittlung von Versicherungsverträgen e.K. – Düsseldorf",
      "type": "Registerbekanntmachung nach dem Umwandlungsgesetz",
      "state": "Nordrhein-Westfalen",
      "amtsgericht": "Amtsgericht Düsseldorf",
      "registernummer": "HRA 28284",
      "registerart": "HRA",
      "company_name": "Rolf Heinz Otto Prost Vermittlung von Versicherungsverträgen e.K.",
      "company_seat": "Düsseldorf",
      "details": "18.07.2025 (Bekanntmachungsdatum)\n\nNordrhein-Westfalen Amtsgericht Düsseldorf HRA 28284\nRegisterbekanntmachung nach dem Umwandlungsgesetz 18.07.2025 (Eintragungsdatum)\n\nRolf Heinz Otto Prost Vermittlung von Versicherungsverträgen e.K.\nEinzelkaufmann / Einzelkauffrau\nDüsseldorf\n\nDen Gläubigern der an der Ausgliederung beteiligten Rechtsträger ist, wenn sie binnen sechs Monaten nach dem Tag, an dem die Eintragung der Ausgliederung in das Register des Sitzes desjenigen Rechtsträgers, dessen Gläubiger sie sind, nach § 19 Absatz 3 UmwG als bekanntgemacht gilt, ihren Anspruch nach Grund und Höhe schriftlich anmelden, Sicherheit zu leisten, soweit sie nicht Befriedigung verlangen können. Dieses Recht steht den Gläubigern jedoch nur zu, wenn sie glaubhaft machen, dass durch die Ausgliederung die Erfüllung ihrer Forderung gefährdet wird."
    },
    {
      "date": "2025-07-18",
      "id": "116628",
      "original_text": "Registerbekanntmachung nach dem Umwandlungsgesetz\nNordrhein-Westfalen Amtsgericht Münster HRB 16010\n(pma:) consult GmbH – Münster",
      "type": "Registerbekanntmachung nach dem Umwandlungsgesetz",
      "state": "Nordrhein-Westfalen",
      "amtsgericht": "Amtsgericht Münster",
      "registernummer": "HRB 16010",
      "registerart": "HRB",
      "company_name": "(pma:) consult GmbH",
      "company_seat": "Münster",
      "details": "18.07.2025 (Bekanntmachungsdatum)\n\nNordrhein-Westfalen Amtsgericht Münster HRB 16010\nRegisterbekanntmachung nach dem Umwandlungsgesetz 18.07.2025 (Eintragungsdatum)\n\n(pma:) consult GmbH\nGesellschaft mit beschränkter Haftung\nMünster\n\nDen Gläubigern der an der Verschmelzung beteiligten Rechtsträger ist, wenn sie binnen sechs Monaten nach dem Tag, an dem die Eintragung der Verschmelzung in das Register des Sitzes desjenigen Rechtsträgers, dessen Gläubiger sie sind, nach § 19 Absatz 3 UmwG als bekanntgemacht gilt, ihren Anspruch nach Grund und Höhe schriftlich anmelden, Sicherheit zu leisten, soweit sie nicht Befriedigung verlangen können. Dieses Recht steht den Gläubigern jedoch nur zu, wenn sie glaubhaft machen, dass durch die Verschmelzung die Erfüllung ihrer Forderung gefährdet wird."
    },
    {
      "date": "2025-07-18",
      "id": "116629",
      "original_text": "Löschungsankündigung\nNordrhein-Westfalen Amtsgericht Münster HRB 18098\n3L Immobilien Verwaltungs GmbH – Münster",
      "type": "Löschungsankündigung",
      "state": "Nordrhein-Westfalen",
      "amtsgericht": "Amtsgericht Münster",
      "registernummer": "HRB 18098",
      "registerart": "HRB",
      "company_name": "3L Immobilien Verwaltungs GmbH",
      "company_seat": "Münster",
      "details": "18.07.2025 (Bekanntmachungsdatum)\n\nNordrhein-Westfalen Amtsgericht Münster HRB 18098\nLöschungsankündigung 15.07.2025 (Eintragungsdatum)\n\n3L Immobilien Verwaltungs GmbH\nGesellschaft mit beschränkter Haftung\nMünster\n\nDas Registergericht beabsichtigt die Gesellschaft von Amts wegen nach § 394 FamFG zu löschen. Die Frist zur Erhebung eines Widerspruchs ist auf 3 Wochen festgesetzt."
    },
    {
      "date": "2025-07-18",
      "id": "116630",
      "original_text": "Einreichung neuer Dokumente\nNordrhein-Westfalen Amtsgericht Köln HRB 119374\n123fahrschule SE – Köln",
      "type": "Einreichung neuer Dokumente",
      "state": "Nordrhein-Westfalen",
      "amtsgericht": "Amtsgericht Köln",
      "registernummer": "HRB 119374",
      "registerart": "HRB",
      "company_name": "123fahrschule SE",
      "company_seat": "Köln",
      "details": "18.07.2025 (Bekanntmachungsdatum)\n\nNordrhein-Westfalen Amtsgericht Köln HRB 119374\nEinreichung neuer Dokumente\n\n123fahrschule SE\nEuropäische Aktiengesellschaft (SE)\nKöln\n\nDem Registergericht ist eine neue Liste der Mitglieder des Aufsichtsrates eingereicht worden."
    },
    {
      "date": "2025-07-18",
      "id": "116631",
      "original_text": "Registerbekanntmachung nach dem Umwandlungsgesetz\nNordrhein-Westfalen Amtsgericht Bielefeld HRB 42468\nh + p solutions GmbH – Bielefeld",
      "type": "Registerbekanntmachung nach dem Umwandlungsgesetz",
      "state": "Nordrhein-Westfalen",
      "amtsgericht": "Amtsgericht Bielefeld",
      "registernummer": "HRB 42468",
      "registerart": "HRB",
      "company_name": "h + p solutions GmbH",
      "company_seat": "Bielefeld",
      "details": "18.07.2025 (Bekanntmachungsdatum)\n\nNordrhein-Westfalen Amtsgericht Bielefeld HRB 42468\nRegisterbekanntmachung nach dem Umwandlungsgesetz 18.07.2025 (Eintragungsdatum)\n\nh + p solutions GmbH\nGesellschaft mit beschränkter Haftung\nBielefeld\n\nDen Gläubigern der an der Verschmelzung beteiligten Rechtsträger ist, wenn sie binnen sechs Monaten nach dem Tag, an dem die Eintragung der Verschmelzung in das Register des Sitzes desjenigen Rechtsträgers, dessen Gläubiger sie sind, nach § 19 Absatz 3 UmwG als bekanntgemacht gilt, ihren Anspruch nach Grund und Höhe schriftlich anmelden, Sicherheit zu leisten, soweit sie nicht Befriedigung verlangen können. Dieses Recht steht den Gläubigern jedoch nur zu, wenn sie glaubhaft machen, dass durch die Verschmelzung die Erfüllung ihrer Forderung gefährdet wird."
    },
    {
      "date": "2025-07-18",
      "id": "116632",
      "original_text": "Löschungsankündigung\nNordrhein-Westfalen Amtsgericht Kleve HRB 19524\nE.L.E. GmbH – Geldern",
      "type": "Löschungsankündigung",
      "state": "Nordrhein-Westfalen",
      "amtsgericht": "Amtsgericht Kleve",
      "registernummer": "HRB 19524",
      "registerart": "HRB",
      "company_name": "E.L.E. GmbH",
      "company_seat": "Geldern",
      "details": "18.07.2025 (Bekanntmachungsdatum)\n\nNordrhein-Westfalen Amtsgericht Kleve HRB 19524\nLöschungsankündigung\n\nE.L.E. GmbH\nGesellschaft mit beschränkter Haftung\nGeldern\n\nDas Registergericht beabsichtigt die Gesellschaft von Amts wegen nach § 394 FamFG zu löschen. Die Frist zur Erhebung eines Widerspruchs ist auf einen Monat festgesetzt."
    },
    {
      "date": "2025-07-18",
      "id": "116633",
      "original_text": "Löschungsankündigung\nNordrhein-Westfalen Amtsgericht Münster HRB 21011\nEcom Labs Factory UG (haftungsbeschränkt) – Beckum",
      "type": "Löschungsankündigung",
      "state": "Nordrhein-Westfalen",
      "amtsgericht": "Amtsgericht Münster",
      "registernummer": "HRB 21011",
      "registerart": "HRB",
      "company_name": "Ecom Labs Factory UG (haftungsbeschränkt)",
      "company_seat": "Beckum",
      "details": "18.07.2025 (Bekanntmachungsdatum)\n\nNordrhein-Westfalen Amtsgericht Münster HRB 21011\nLöschungsankündigung 16.07.2025 (Eintragungsdatum)\n\nEcom Labs Factory UG (haftungsbeschränkt)\nGesellschaft mit beschränkter Haftung\nBeckum\n\nDas Registergericht beabsichtigt die Gesellschaft von Amts wegen nach § 394 FamFG zu löschen. Die Frist zur Erhebung eines Widerspruchs ist auf 3 Wochen festgesetzt."
    },
    {
      "date": "2025-07-18",
      "id": "116634",
      "original_text": "Registerbekanntmachung nach dem Umwandlungsgesetz\nNordrhein-Westfalen Amtsgericht Köln HRA 38011\nKappe Gärtner von Eden e.K. – Bergisch Gladbach",
      "type": "Registerbekanntmachung nach dem Umwandlungsgesetz",
      "state": "Nordrhein-Westfalen",
      "amtsgericht": "Amtsgericht Köln",
      "registernummer": "HRA 38011",
      "registerart": "HRA",
      "company_name": "Kappe Gärtner von Eden e.K.",
      "company_seat": "Bergisch Gladbach",
      "details": "18.07.2025 (Bekanntmachungsdatum)\n\nNordrhein-Westfalen Amtsgericht Köln HRA 38011\nRegisterbekanntmachung nach dem Umwandlungsgesetz 18.07.2025 (Eintragungsdatum)\n\nKappe Gärtner von Eden e.K.\nEinzelkaufmann / Einzelkauffrau\nBergisch Gladbach\n\nDen Gläubigern der an der formwechselnden Umwandlung beteiligten Rechtsträger ist, wenn sie binnen sechs Monaten nach dem Tag, an dem die Eintragung der formwechselnden Umwandlung in das Register des Sitzes desjenigen Rechtsträgers, dessen Gläubiger sie sind, nach § 19 Absatz 3 UmwG als bekanntgemacht gilt, ihren Anspruch nach Grund und Höhe schriftlich anmelden, Sicherheit zu leisten, soweit sie nicht Befriedigung verlangen können. Dieses Recht steht den Gläubigern jedoch nur zu, wenn sie glaubhaft machen, dass durch die formwechselnden Umwandlung die Erfüllung ihrer Forderung gefährdet wird."
    },
    {
      "date": "2025-07-18",
      "id": "116635",
      "original_text": "Registerbekanntmachung nach dem Umwandlungsgesetz\nNordrhein-Westfalen Amtsgericht Essen HRB 16429\nNikolaus Groß-Altenwohn- und Pflegeheime GmbH, Essen – Essen",
      "type": "Registerbekanntmachung nach dem Umwandlungsgesetz",
      "state": "Nordrhein-Westfalen",
      "amtsgericht": "Amtsgericht Essen",
      "registernummer": "HRB 16429",
      "registerart": "HRB",
      "company_name": "Nikolaus Groß-Altenwohn- und Pflegeheime GmbH, Essen",
      "company_seat": "Essen",
      "details": "18.07.2025 (Bekanntmachungsdatum)\n\nNordrhein-Westfalen Amtsgericht Essen HRB 16429\nRegisterbekanntmachung nach dem Umwandlungsgesetz 18.07.2025 (Eintragungsdatum)\n\nNikolaus Groß-Altenwohn- und Pflegeheime GmbH, Essen\nGesellschaft mit beschränkter Haftung\nEssen\n\nDen Gläubigern der an der Verschmelzung beteiligten Rechtsträger ist, wenn sie binnen sechs Monaten nach dem Tag, an dem die Eintragung der Verschmelzung in das Register des Sitzes desjenigen Rechtsträgers, dessen Gläubiger sie sind, nach § 19 Absatz 3 UmwG als bekanntgemacht gilt, ihren Anspruch nach Grund und Höhe schriftlich anmelden, Sicherheit zu leisten, soweit sie nicht Befriedigung verlangen können. Dieses Recht steht den Gläubigern jedoch nur zu, wenn sie glaubhaft machen, dass durch die Verschmelzung die Erfüllung ihrer Forderung gefährdet wird."
    },
    {
      "date": "2025-07-18",
      "id": "116636",
      "original_text": "Löschungsankündigung\nNordrhein-Westfalen Amtsgericht Essen HRB 36021\nSE Holding UG (haftungsbeschränkt) – Essen",
      "type": "Löschungsankündigung",
      "state": "Nordrhein-Westfalen",
      "amtsgericht": "Amtsgericht Essen",
      "registernummer": "HRB 36021",
      "registerart": "HRB",
      "company_name": "SE Holding UG (haftungsbeschränkt)",
      "company_seat": "Essen",
      "details": "18.07.2025 (Bekanntmachungsdatum)\n\nNordrhein-Westfalen Amtsgericht Essen HRB 36021\nLöschungsankündigung 18.07.2025 (Eintragungsdatum)\n\nSE Holding UG (haftungsbeschränkt)\nGesellschaft mit beschränkter Haftung\nEssen\n\nDas Registergericht beabsichtigt die Gesellschaft von Amts wegen nach § 394 FamFG zu löschen. Die Frist zur Erhebung eines Widerspruchs ist auf einen Monat festgesetzt."
    },
    {
      "date": "2025-07-18",
      "id": "116637",
      "original_text": "Registerbekanntmachung nach dem Umwandlungsgesetz\nNordrhein-Westfalen Amtsgericht Recklinghausen HRB 9715\nSenft GmbH – Herten",
      "type": "Registerbekanntmachung nach dem Umwandlungsgesetz",
      "state": "Nordrhein-Westfalen",
      "amtsgericht": "Amtsgericht Recklinghausen",
      "registernummer": "HRB 9715",
      "registerart": "HRB",
      "company_name": "Senft GmbH",
      "company_seat": "Herten",
      "details": "18.07.2025 (Bekanntmachungsdatum)\n\nNordrhein-Westfalen Amtsgericht Recklinghausen HRB 9715\nRegisterbekanntmachung nach dem Umwandlungsgesetz 20.06.2025 (Eintragungsdatum)\n\nSenft GmbH\nGesellschaft mit beschränkter Haftung\nHerten\n\nDen Gläubigern der an der Verschmelzung beteiligten Rechtsträger ist, wenn sie binnen sechs Monaten nach dem Tag, an dem die Eintragung der Verschmelzung in das Register des Sitzes desjenigen Rechtsträgers, dessen Gläubiger sie sind, nach § 19 Absatz 3 UmwG als bekanntgemacht gilt, ihren Anspruch nach Grund und Höhe schriftlich anmelden, Sicherheit zu leisten, soweit sie nicht Befriedigung verlangen können. Dieses Recht steht den Gläubigern jedoch nur zu, wenn sie glaubhaft machen, dass durch die Verschmelzung die Erfüllung ihrer Forderung gefährdet wird."
    },
    {
      "date": "2025-07-18",
      "id": "116638",
      "original_text": "Registerbekanntmachung nach dem Umwandlungsgesetz\nNordrhein-Westfalen Amtsgericht Recklinghausen HRB 9989\nSenft Holding GmbH – Herten",
      "type": "Registerbekanntmachung nach dem Umwandlungsgesetz",
      "state": "Nordrhein-Westfalen",
      "amtsgericht": "Amtsgericht Recklinghausen",
      "registernummer": "HRB 9989",
      "registerart": "HRB",
      "company_name": "Senft Holding GmbH",
      "company_seat": "Herten",
      "details": "18.07.2025 (Bekanntmachungsdatum)\n\nNordrhein-Westfalen Amtsgericht Recklinghausen HRB 9989\nRegisterbekanntmachung nach dem Umwandlungsgesetz 20.06.2025 (Eintragungsdatum)\n\nSenft Holding GmbH\nGesellschaft mit beschränkter Haftung\nHerten\n\nDen Gläubigern der an der Verschmelzung beteiligten Rechtsträger ist, wenn sie binnen sechs Monaten nach dem Tag, an dem die Eintragung der Verschmelzung in das Register des Sitzes desjenigen Rechtsträgers, dessen Gläubiger sie sind, nach § 19 Absatz 3 UmwG als bekanntgemacht gilt, ihren Anspruch nach Grund und Höhe schriftlich anmelden, Sicherheit zu leisten, soweit sie nicht Befriedigung verlangen können. Dieses Recht steht den Gläubigern jedoch nur zu, wenn sie glaubhaft machen, dass durch die Verschmelzung die Erfüllung ihrer Forderung gefährdet wird."
    },
    {
      "date": "2025-07-18",
      "id": "116639",
      "original_text": "Registerbekanntmachung nach dem Umwandlungsgesetz\nNordrhein-Westfalen Amtsgericht Bochum HRB 18302\nopta data Innovation Lab GmbH – Bochum",
      "type": "Registerbekanntmachung nach dem Umwandlungsgesetz",
      "state": "Nordrhein-Westfalen",
      "amtsgericht": "Amtsgericht Bochum",
      "registernummer": "HRB 18302",
      "registerart": "HRB",
      "company_name": "opta data Innovation Lab GmbH",
      "company_seat": "Bochum",
      "details": "18.07.2025 (Bekanntmachungsdatum)\n\nNordrhein-Westfalen Amtsgericht Bochum HRB 18302\nRegisterbekanntmachung nach dem Umwandlungsgesetz 17.07.2025 (Eintragungsdatum)\n\nopta data Innovation Lab GmbH\nGesellschaft mit beschränkter Haftung\nBochum\n\nDen Gläubigern der an der Verschmelzung beteiligten Rechtsträger ist, wenn sie binnen sechs Monaten nach dem Tag, an dem die Eintragung der Verschmelzung in das Register des Sitzes desjenigen Rechtsträgers, dessen Gläubiger sie sind, nach § 19 Absatz 3 UmwG als bekanntgemacht gilt, ihren Anspruch nach Grund und Höhe schriftlich anmelden, Sicherheit zu leisten, soweit sie nicht Befriedigung verlangen können. Dieses Recht steht den Gläubigern jedoch nur zu, wenn sie glaubhaft machen, dass durch die Verschmelzung die Erfüllung ihrer Forderung gefährdet wird."
    },
    {
      "date": "2025-07-18",
      "id": "116640",
      "original_text": "Einreichung neuer Dokumente\nNordrhein-Westfalen Amtsgericht Köln HRB 75958\nOBI Group Holding SE & Co. KGaA – Wermelskirchen",
      "type": "Einreichung neuer Dokumente",
      "state": "Nordrhein-Westfalen",
      "amtsgericht": "Amtsgericht Köln",
      "registernummer": "HRB 75958",
      "registerart": "HRB",
      "company_name": "OBI Group Holding SE & Co. KGaA",
      "company_seat": "Wermelskirchen",
      "details": "18.07.2025 (Bekanntmachungsdatum)\n\nNordrhein-Westfalen Amtsgericht Köln HRB 75958\nEinreichung neuer Dokumente 18.07.2025 (Eintragungsdatum)\n\nOBI Group Holding SE & Co. KGaA\nKommanditgesellschaft auf Aktien\nWermelskirchen\n\nDem Registergericht ist eine neue Liste der Mitglieder des Aufsichtsrates eingereicht worden."
    },
    {
      "date": "2025-07-18",
      "id": "116641",
      "original_text": "Registerbekanntmachung nach dem Umwandlungsgesetz\nNordrhein-Westfalen Amtsgericht Mönchengladbach HRB 10874\nNEW Niederrhein Energie und Wasser GmbH – Mönchengladbach",
      "type": "Registerbekanntmachung nach dem Umwandlungsgesetz",
      "state": "Nordrhein-Westfalen",
      "amtsgericht": "Amtsgericht Mönchengladbach",
      "registernummer": "HRB 10874",
      "registerart": "HRB",
      "company_name": "NEW Niederrhein Energie und Wasser GmbH",
      "company_seat": "Mönchengladbach",
      "details": "18.07.2025 (Bekanntmachungsdatum)\n\nNordrhein-Westfalen Amtsgericht Mönchengladbach HRB 10874\nRegisterbekanntmachung nach dem Umwandlungsgesetz 18.07.2025 (Eintragungsdatum)\n\nNEW Niederrhein Energie und Wasser GmbH\nGesellschaft mit beschränkter Haftung\nMönchengladbach\n\nDen Gläubigern der an der Aufspaltung beteiligten Rechtsträger ist, wenn sie binnen sechs Monaten nach dem Tag, an dem die Eintragung der Aufspaltung in das Register des Sitzes desjenigen Rechtsträgers, dessen Gläubiger sie sind, nach § 19 Absatz 3 UmwG als bekanntgemacht gilt, ihren Anspruch nach Grund und Höhe schriftlich anmelden, Sicherheit zu leisten, soweit sie nicht Befriedigung verlangen können. Dieses Recht steht den Gläubigern jedoch nur zu, wenn sie glaubhaft machen, dass durch die Aufspaltung die Erfüllung ihrer Forderung gefährdet wird."
    },
    {
      "date": "2025-07-18",
      "id": "116642",
      "original_text": "Registerbekanntmachung nach dem Umwandlungsgesetz\nNordrhein-Westfalen Amtsgericht Lemgo HRB 11687\nMVZ Labor Krone GmbH – Bad Salzuflen",
      "type": "Registerbekanntmachung nach dem Umwandlungsgesetz",
      "state": "Nordrhein-Westfalen",
      "amtsgericht": "Amtsgericht Lemgo",
      "registernummer": "HRB 11687",
      "registerart": "HRB",
      "company_name": "MVZ Labor Krone GmbH",
      "company_seat": "Bad Salzuflen",
      "details": "18.07.2025 (Bekanntmachungsdatum)\n\nNordrhein-Westfalen Amtsgericht Lemgo HRB 11687\nRegisterbekanntmachung nach dem Umwandlungsgesetz 18.07.2025 (Eintragungsdatum)\n\nMVZ Labor Krone GmbH\nGesellschaft mit beschränkter Haftung\nBad Salzuflen\n\nDen Gläubigern der an der formwechselnden Umwandlung beteiligten Rechtsträger ist, wenn sie binnen sechs Monaten nach dem Tag, an dem die Eintragung der formwechselnden Umwandlung in das Register des Sitzes desjenigen Rechtsträgers, dessen Gläubiger sie sind, nach § 19 Absatz 3 UmwG als bekanntgemacht gilt, ihren Anspruch nach Grund und Höhe schriftlich anmelden, Sicherheit zu leisten, soweit sie nicht Befriedigung verlangen können. Dieses Recht steht den Gläubigern jedoch nur zu, wenn sie glaubhaft machen, dass durch die formwechselnden Umwandlung die Erfüllung ihrer Forderung gefährdet wird."
    },
    {
      "date": "2025-07-18",
      "id": "116643",
      "original_text": "Registerbekanntmachung nach dem Umwandlungsgesetz\nNordrhein-Westfalen Amtsgericht Lemgo GsR 34\nMVZ Labor Krone eGbR – Bad Salzuflen",
      "type": "Registerbekanntmachung nach dem Umwandlungsgesetz",
      "state": "Nordrhein-Westfalen",
      "amtsgericht": "Amtsgericht Lemgo",
      "registernummer": "GsR 34",
      "registerart": "GsR",
      "company_name": "MVZ Labor Krone eGbR",
      "company_seat": "Bad Salzuflen",
      "details": "18.07.2025 (Bekanntmachungsdatum)\n\nNordrhein-Westfalen Amtsgericht Lemgo GsR 34\nRegisterbekanntmachung nach dem Umwandlungsgesetz 18.07.2025 (Eintragungsdatum)\n\nMVZ Labor Krone eGbR\nGesellschaft bürgerlichen Rechts\nBad Salzuflen\n\nDen Gläubigern der an der formwechselnden Umwandlung beteiligten Rechtsträger ist, wenn sie binnen sechs Monaten nach dem Tag, an dem die Eintragung der formwechselnden Umwandlung in das Register des Sitzes desjenigen Rechtsträgers, dessen Gläubiger sie sind, nach § 19 Absatz 3 UmwG als bekanntgemacht gilt, ihren Anspruch nach Grund und Höhe schriftlich anmelden, Sicherheit zu leisten, soweit sie nicht Befriedigung verlangen können. Dieses Recht steht den Gläubigern jedoch nur zu, wenn sie glaubhaft machen, dass durch die formwechselnden Umwandlung die Erfüllung ihrer Forderung gefährdet wird."
    },
    {
      "date": "2025-07-18",
      "id": "116644",
      "original_text": "Einreichung neuer Dokumente\nNordrhein-Westfalen Amtsgericht Bochum HRB 17204\nVfL Bochum 1848 GmbH & Co. KGaA – Bochum",
      "type": "Einreichung neuer Dokumente",
      "state": "Nordrhein-Westfalen",
      "amtsgericht": "Amtsgericht Bochum",
      "registernummer": "HRB 17204",
      "registerart": "HRB",
      "company_name": "VfL Bochum 1848 GmbH & Co. KGaA",
      "company_seat": "Bochum",
      "details": "18.07.2025 (Bekanntmachungsdatum)\n\nNordrhein-Westfalen Amtsgericht Bochum HRB 17204\nEinreichung neuer Dokumente 18.07.2025 (Eintragungsdatum)\n\nVfL Bochum 1848 GmbH & Co. KGaA\nKommanditgesellschaft auf Aktien\nBochum\n\nDem Registergericht ist eine neue Liste der Mitglieder des Aufsichtsrates eingereicht worden."
    },
    {
      "date": "2025-07-18",
      "id": "116645",
      "original_text": "Registerbekanntmachung nach dem Umwandlungsgesetz\nNordrhein-Westfalen Amtsgericht Mönchengladbach HRB 11388\nNEW NiederrheinWasser GmbH – Viersen",
      "type": "Registerbekanntmachung nach dem Umwandlungsgesetz",
      "state": "Nordrhein-Westfalen",
      "amtsgericht": "Amtsgericht Mönchengladbach",
      "registernummer": "HRB 11388",
      "registerart": "HRB",
      "company_name": "NEW NiederrheinWasser GmbH",
      "company_seat": "Viersen",
      "details": "18.07.2025 (Bekanntmachungsdatum)\n\nNordrhein-Westfalen Amtsgericht Mönchengladbach HRB 11388\nRegisterbekanntmachung nach dem Umwandlungsgesetz 18.07.2025 (Eintragungsdatum)\n\nNEW NiederrheinWasser GmbH\nGesellschaft mit beschränkter Haftung\nViersen\n\nDen Gläubigern der an der Aufspaltung beteiligten Rechtsträger ist, wenn sie binnen sechs Monaten nach dem Tag, an dem die Eintragung der Aufspaltung in das Register des Sitzes desjenigen Rechtsträgers, dessen Gläubiger sie sind, nach § 19 Absatz 3 UmwG als bekanntgemacht gilt, ihren Anspruch nach Grund und Höhe schriftlich anmelden, Sicherheit zu leisten, soweit sie nicht Befriedigung verlangen können. Dieses Recht steht den Gläubigern jedoch nur zu, wenn sie glaubhaft machen, dass durch die Aufspaltung die Erfüllung ihrer Forderung gefährdet wird."
    },
    {
      "date": "2025-07-18",
      "id": "116646",
      "original_text": "Registerbekanntmachung nach dem Umwandlungsgesetz\nNordrhein-Westfalen Amtsgericht Bielefeld HRB 46270\nh + p hachmeister + partner GmbH – Bielefeld",
      "type": "Registerbekanntmachung nach dem Umwandlungsgesetz",
      "state": "Nordrhein-Westfalen",
      "amtsgericht": "Amtsgericht Bielefeld",
      "registernummer": "HRB 46270",
      "registerart": "HRB",
      "company_name": "h + p hachmeister + partner GmbH",
      "company_seat": "Bielefeld",
      "details": "18.07.2025 (Bekanntmachungsdatum)\n\nNordrhein-Westfalen Amtsgericht Bielefeld HRB 46270\nRegisterbekanntmachung nach dem Umwandlungsgesetz 18.07.2025 (Eintragungsdatum)\n\nh + p hachmeister + partner GmbH\nGesellschaft mit beschränkter Haftung\nBielefeld\n\nDen Gläubigern der an der Verschmelzung beteiligten Rechtsträger ist, wenn sie binnen sechs Monaten nach dem Tag, an dem die Eintragung der Verschmelzung in das Register des Sitzes desjenigen Rechtsträgers, dessen Gläubiger sie sind, nach § 19 Absatz 3 UmwG als bekanntgemacht gilt, ihren Anspruch nach Grund und Höhe schriftlich anmelden, Sicherheit zu leisten, soweit sie nicht Befriedigung verlangen können. Dieses Recht steht den Gläubigern jedoch nur zu, wenn sie glaubhaft machen, dass durch die Verschmelzung die Erfüllung ihrer Forderung gefährdet wird."
    },
    {
      "date": "2025-07-18",
      "id": "116647",
      "original_text": "Registerbekanntmachung nach dem Umwandlungsgesetz\nNordrhein-Westfalen Amtsgericht Mönchengladbach HRB 1434\nOQEMA GmbH – Mönchengladbach",
      "type": "Registerbekanntmachung nach dem Umwandlungsgesetz",
      "state": "Nordrhein-Westfalen",
      "amtsgericht": "Amtsgericht Mönchengladbach",
      "registernummer": "HRB 1434",
      "registerart": "HRB",
      "company_name": "OQEMA GmbH",
      "company_seat": "Mönchengladbach",
      "details": "18.07.2025 (Bekanntmachungsdatum)\n\nNordrhein-Westfalen Amtsgericht Mönchengladbach HRB 1434\nRegisterbekanntmachung nach dem Umwandlungsgesetz 18.07.2025 (Eintragungsdatum)\n\nOQEMA GmbH\nGesellschaft mit beschränkter Haftung\nMönchengladbach\n\nDen Gläubigern der an der Verschmelzung beteiligten Rechtsträger ist, wenn sie binnen sechs Monaten nach dem Tag, an dem die Eintragung der Verschmelzung in das Register des Sitzes desjenigen Rechtsträgers, dessen Gläubiger sie sind, nach § 19 Absatz 3 UmwG als bekanntgemacht gilt, ihren Anspruch nach Grund und Höhe schriftlich anmelden, Sicherheit zu leisten, soweit sie nicht Befriedigung verlangen können. Dieses Recht steht den Gläubigern jedoch nur zu, wenn sie glaubhaft machen, dass durch die Verschmelzung die Erfüllung ihrer Forderung gefährdet wird."
    },
    {
      "date": "2025-07-18",
      "id": "116648",
      "original_text": "Registerbekanntmachung nach dem Umwandlungsgesetz\nNordrhein-Westfalen Amtsgericht Duisburg HRA 7173\nRhenus Port Logistics Management & Services GmbH & Co. KG – Duisburg",
      "type": "Registerbekanntmachung nach dem Umwandlungsgesetz",
      "state": "Nordrhein-Westfalen",
      "amtsgericht": "Amtsgericht Duisburg",
      "registernummer": "HRA 7173",
      "registerart": "HRA",
      "company_name": "Rhenus Port Logistics Management & Services GmbH & Co. KG",
      "company_seat": "Duisburg",
      "details": "18.07.2025 (Bekanntmachungsdatum)\n\nNordrhein-Westfalen Amtsgericht Duisburg HRA 7173\nRegisterbekanntmachung nach dem Umwandlungsgesetz 18.07.2025 (Eintragungsdatum)\n\nRhenus Port Logistics Management & Services GmbH & Co. KG\nKommanditgesellschaft\nDuisburg\n\nDen Gläubigern der an der Verschmelzung beteiligten Rechtsträger ist, wenn sie binnen sechs Monaten nach dem Tag, an dem die Eintragung der Verschmelzung in das Register des Sitzes desjenigen Rechtsträgers, dessen Gläubiger sie sind, nach § 19 Absatz 3 UmwG als bekanntgemacht gilt, ihren Anspruch nach Grund und Höhe schriftlich anmelden, Sicherheit zu leisten, soweit sie nicht Befriedigung verlangen können. Dieses Recht steht den Gläubigern jedoch nur zu, wenn sie glaubhaft machen, dass durch die Verschmelzung die Erfüllung ihrer Forderung gefährdet wird.\n."
    },
    {
      "date": "2025-07-18",
      "id": "116649",
      "original_text": "Registerbekanntmachung nach dem Umwandlungsgesetz\nNordrhein-Westfalen Amtsgericht Bad Oeynhausen HRA 10616\nKlüter Immobilien GmbH & Co. KG – Bünde",
      "type": "Registerbekanntmachung nach dem Umwandlungsgesetz",
      "state": "Nordrhein-Westfalen",
      "amtsgericht": "Amtsgericht Bad Oeynhausen",
      "registernummer": "HRA 10616",
      "registerart": "HRA",
      "company_name": "Klüter Immobilien GmbH & Co. KG",
      "company_seat": "Bünde",
      "details": "18.07.2025 (Bekanntmachungsdatum)\n\nNordrhein-Westfalen Amtsgericht Bad Oeynhausen HRA 10616\nRegisterbekanntmachung nach dem Umwandlungsgesetz 18.07.2025 (Eintragungsdatum)\n\nKlüter Immobilien GmbH & Co. KG\nKommanditgesellschaft\nBünde\n\nDen Gläubigern der an der Ausgliederung beteiligten Rechtsträger ist, wenn sie binnen sechs Monaten nach dem Tag, an dem die Eintragung der Ausgliederung in das Register des Sitzes desjenigen Rechtsträgers, dessen Gläubiger sie sind, nach § 19 Absatz 3 UmwG als bekanntgemacht gilt, ihren Anspruch nach Grund und Höhe schriftlich anmelden, Sicherheit zu leisten, soweit sie nicht Befriedigung verlangen können. Dieses Recht steht den Gläubigern jedoch nur zu, wenn sie glaubhaft machen, dass durch die Ausgliederung die Erfüllung ihrer Forderung gefährdet wird."
    },
    {
      "date": "2025-07-18",
      "id": "116650",
      "original_text": "Registerbekanntmachung nach dem Umwandlungsgesetz\nNordrhein-Westfalen Amtsgericht Münster HRB 17455\n[pma:] Assekuranzmakler GmbH – Münster",
      "type": "Registerbekanntmachung nach dem Umwandlungsgesetz",
      "state": "Nordrhein-Westfalen",
      "amtsgericht": "Amtsgericht Münster",
      "registernummer": "HRB 17455",
      "registerart": "HRB",
      "company_name": "[pma:] Assekuranzmakler GmbH",
      "company_seat": "Münster",
      "details": "18.07.2025 (Bekanntmachungsdatum)\n\nNordrhein-Westfalen Amtsgericht Münster HRB 17455\nRegisterbekanntmachung nach dem Umwandlungsgesetz 18.07.2025 (Eintragungsdatum)\n\n[pma:] Assekuranzmakler GmbH\nGesellschaft mit beschränkter Haftung\nMünster\n\nDen Gläubigern der an der Verschmelzung beteiligten Rechtsträger ist, wenn sie binnen sechs Monaten nach dem Tag, an dem die Eintragung der Verschmelzung in das Register des Sitzes desjenigen Rechtsträgers, dessen Gläubiger sie sind, nach § 19 Absatz 3 UmwG als bekanntgemacht gilt, ihren Anspruch nach Grund und Höhe schriftlich anmelden, Sicherheit zu leisten, soweit sie nicht Befriedigung verlangen können. Dieses Recht steht den Gläubigern jedoch nur zu, wenn sie glaubhaft machen, dass durch die Verschmelzung die Erfüllung ihrer Forderung gefährdet wird."
    },
    {
      "date": "2025-07-18",
      "id": "116651",
      "original_text": "Einreichung neuer Dokumente\nNordrhein-Westfalen Amtsgericht Köln HRB 78264\ntalentsconnect AG – Köln",
      "type": "Einreichung neuer Dokumente",
      "state": "Nordrhein-Westfalen",
      "amtsgericht": "Amtsgericht Köln",
      "registernummer": "HRB 78264",
      "registerart": "HRB",
      "company_name": "talentsconnect AG",
      "company_seat": "Köln",
      "details": "18.07.2025 (Bekanntmachungsdatum)\n\nNordrhein-Westfalen Amtsgericht Köln HRB 78264\nEinreichung neuer Dokumente\n\ntalentsconnect AG\nAktiengesellschaft\nKöln\n\nDem Registergericht ist eine Liste der Mitglieder des Aufsichtsrates eingereicht worden."
    },
    {
      "date": "2025-07-18",
      "id": "116652",
      "original_text": "Registerbekanntmachung nach dem Umwandlungsgesetz\nNordrhein-Westfalen Amtsgericht Aachen HRA 6253\nAuto Thüllen Baesweiler GmbH & Co. KG – Baesweiler",
      "type": "Registerbekanntmachung nach dem Umwandlungsgesetz",
      "state": "Nordrhein-Westfalen",
      "amtsgericht": "Amtsgericht Aachen",
      "registernummer": "HRA 6253",
      "registerart": "HRA",
      "company_name": "Auto Thüllen Baesweiler GmbH & Co. KG",
      "company_seat": "Baesweiler",
      "details": "18.07.2025 (Bekanntmachungsdatum)\n\nNordrhein-Westfalen Amtsgericht Aachen HRA 6253\nRegisterbekanntmachung nach dem Umwandlungsgesetz 18.07.2025 (Eintragungsdatum)\n\nAuto Thüllen Baesweiler GmbH & Co. KG\nKommanditgesellschaft\nBaesweiler\n\nDen Gläubigern der an der Verschmelzung beteiligten Rechtsträger ist, wenn sie binnen sechs Monaten nach dem Tag, an dem die Eintragung der Verschmelzung in das Register des Sitzes desjenigen Rechtsträgers, dessen Gläubiger sie sind, nach § 19 Absatz 3 UmwG als bekanntgemacht gilt, ihren Anspruch nach Grund und Höhe schriftlich anmelden, Sicherheit zu leisten, soweit sie nicht Befriedigung verlangen können. Dieses Recht steht den Gläubigern jedoch nur zu, wenn sie glaubhaft machen, dass durch die Verschmelzung die Erfüllung ihrer Forderung gefährdet wird."
    },
    {
      "date": "2025-07-18",
      "id": "116653",
      "original_text": "Löschungsankündigung\nNordrhein-Westfalen Amtsgericht Hamm HRB 9742\nAKTI Verwaltungs GmbH – Hamm",
      "type": "Löschungsankündigung",
      "state": "Nordrhein-Westfalen",
      "amtsgericht": "Amtsgericht Hamm",
      "registernummer": "HRB 9742",
      "registerart": "HRB",
      "company_name": "AKTI Verwaltungs GmbH",
      "company_seat": "Hamm",
      "details": "18.07.2025 (Bekanntmachungsdatum)\n\nNordrhein-Westfalen Amtsgericht Hamm HRB 9742\nLöschungsankündigung\n\nAKTI Verwaltungs GmbH\nGesellschaft mit beschränkter Haftung\nHamm\n\nDas Registergericht beabsichtigt die Gesellschaft von Amts wegen nach § 394 FamFG zu löschen. Die Frist zur Erhebung eines Widerspruchs ist auf drei Monate festgesetzt."
    },
    {
      "date": "2025-07-18",
      "id": "116654",
      "original_text": "Registerbekanntmachung nach dem Umwandlungsgesetz\nNordrhein-Westfalen Amtsgericht Düsseldorf HRB 101991\nDigitalbubbles Holding UG (haftungsbeschränkt) – Langenfeld",
      "type": "Registerbekanntmachung nach dem Umwandlungsgesetz",
      "state": "Nordrhein-Westfalen",
      "amtsgericht": "Amtsgericht Düsseldorf",
      "registernummer": "HRB 101991",
      "registerart": "HRB",
      "company_name": "Digitalbubbles Holding UG (haftungsbeschränkt)",
      "company_seat": "Langenfeld",
      "details": "18.07.2025 (Bekanntmachungsdatum)\n\nNordrhein-Westfalen Amtsgericht Düsseldorf HRB 101991\nRegisterbekanntmachung nach dem Umwandlungsgesetz 18.07.2025 (Eintragungsdatum)\n\nDigitalbubbles Holding UG (haftungsbeschränkt)\nGesellschaft mit beschränkter Haftung\nLangenfeld\n\nDen Gläubigern der an der Verschmelzung beteiligten Rechtsträger ist, wenn sie binnen sechs Monaten nach dem Tag, an dem die Eintragung der Verschmelzung in das Register des Sitzes desjenigen Rechtsträgers, dessen Gläubiger sie sind, nach § 19 Absatz 3 UmwG als bekanntgemacht gilt, ihren Anspruch nach Grund und Höhe schriftlich anmelden, Sicherheit zu leisten, soweit sie nicht Befriedigung verlangen können. Dieses Recht steht den Gläubigern jedoch nur zu, wenn sie glaubhaft machen, dass durch die Verschmelzung die Erfüllung ihrer Forderung gefährdet wird."
    },
    {
      "date": "2025-07-18",
      "id": "116655",
      "original_text": "Sonstige Registerbekanntmachung\nNordrhein-Westfalen Amtsgericht Köln HRB 90616\nImmobilien Mitte Grundstücksgesellschaft mbH – Köln",
      "type": "Sonstige Registerbekanntmachung",
      "state": "Nordrhein-Westfalen",
      "amtsgericht": "Amtsgericht Köln",
      "registernummer": "HRB 90616",
      "registerart": "HRB",
      "company_name": "Immobilien Mitte Grundstücksgesellschaft mbH",
      "company_seat": "Köln",
      "details": "18.07.2025 (Bekanntmachungsdatum)\n\nNordrhein-Westfalen Amtsgericht Köln HRB 90616\nSonstige Registerbekanntmachung 18.07.2025 (Eintragungsdatum)\n\nImmobilien Mitte Grundstücksgesellschaft mbH\nGesellschaft mit beschränkter Haftung\nKöln\n\nAls nicht eingetragen wird veröffentlicht: Den Gläubigern der Gesellschaft, deren Forderungen begründet worden sind bevor die Eintragung der Beendigung des Beherrschungs- und Gewinnabführungsvertrages  in das Handelsregister nach § 10 des Handelsgesetzbuches als bekanntgemacht gilt, hat der andere Vertragsteil Sicherheit zu leisten, wenn sie sich binnen sechs Monaten nach der Bekanntmachung der Eintragung zu diesem Zweck bei ihm melden."
    },
    {
      "date": "2025-07-18",
      "id": "116656",
      "original_text": "Löschungsankündigung\nNordrhein-Westfalen Amtsgericht Essen HRB 29042\nKarapetyan UG (haftungsbeschränkt) – Essen",
      "type": "Löschungsankündigung",
      "state": "Nordrhein-Westfalen",
      "amtsgericht": "Amtsgericht Essen",
      "registernummer": "HRB 29042",
      "registerart": "HRB",
      "company_name": "Karapetyan UG (haftungsbeschränkt)",
      "company_seat": "Essen",
      "details": "18.07.2025 (Bekanntmachungsdatum)\n\nNordrhein-Westfalen Amtsgericht Essen HRB 29042\nLöschungsankündigung 18.07.2025 (Eintragungsdatum)\n\nKarapetyan UG (haftungsbeschränkt)\nGesellschaft mit beschränkter Haftung\nEssen\n\nDas Registergericht beabsichtigt die Gesellschaft von Amts wegen nach § 394 FamFG zu löschen. Die Frist zur Erhebung eines Widerspruchs ist auf einen Monat festgesetzt."
    },
    {
      "date": "2025-07-18",
      "id": "116657",
      "original_text": "Löschungsankündigung\nNordrhein-Westfalen Amtsgericht Wuppertal HRB 30847\nGolden Shuttle GmbH – Erkrath",
      "type": "Löschungsankündigung",
      "state": "Nordrhein-Westfalen",
      "amtsgericht": "Amtsgericht Wuppertal",
      "registernummer": "HRB 30847",
      "registerart": "HRB",
      "company_name": "Golden Shuttle GmbH",
      "company_seat": "Erkrath",
      "details": "18.07.2025 (Bekanntmachungsdatum)\n\nNordrhein-Westfalen Amtsgericht Wuppertal HRB 30847\nLöschungsankündigung\n\nGolden Shuttle GmbH\nGesellschaft mit beschränkter Haftung\nErkrath\n\nDas Registergericht beabsichtigt die Gesellschaft von Amts wegen nach § 394 FamFG zu löschen. Die Frist zur Erhebung eines Widerspruchs ist auf einen Monat festgesetzt."
    },
    {
      "date": "2025-07-18",
      "id": "116658",
      "original_text": "Löschungsankündigung\nNordrhein-Westfalen Amtsgericht Essen HRB 29847\nTOM technisches Objektmanagement GmbH – Essen",
      "type": "Löschungsankündigung",
      "state": "Nordrhein-Westfalen",
      "amtsgericht": "Amtsgericht Essen",
      "registernummer": "HRB 29847",
      "registerart": "HRB",
      "company_name": "TOM technisches Objektmanagement GmbH",
      "company_seat": "Essen",
      "details": "18.07.2025 (Bekanntmachungsdatum)\n\nNordrhein-Westfalen Amtsgericht Essen HRB 29847\nLöschungsankündigung\n\nTOM technisches Objektmanagement GmbH\nGesellschaft mit beschränkter Haftung\nEssen\n\nDas Registergericht beabsichtigt die Gesellschaft von Amts wegen nach § 394 FamFG zu löschen. Die Frist zur Erhebung eines Widerspruchs ist auf einen Monat festgesetzt."
    },
    {
      "date": "2025-07-18",
      "id": "116659",
      "original_text": "Registerbekanntmachung nach dem Umwandlungsgesetz\nNordrhein-Westfalen Amtsgericht Köln HRA 32054\nBureau Akkurat GmbH & Co. KG – Brühl",
      "type": "Registerbekanntmachung nach dem Umwandlungsgesetz",
      "state": "Nordrhein-Westfalen",
      "amtsgericht": "Amtsgericht Köln",
      "registernummer": "HRA 32054",
      "registerart": "HRA",
      "company_name": "Bureau Akkurat GmbH & Co. KG",
      "company_seat": "Brühl",
      "details": "18.07.2025 (Bekanntmachungsdatum)\n\nNordrhein-Westfalen Amtsgericht Köln HRA 32054\nRegisterbekanntmachung nach dem Umwandlungsgesetz 18.07.2025 (Eintragungsdatum)\n\nBureau Akkurat GmbH & Co. KG\nKommanditgesellschaft\nBrühl\n\nDen Gläubigern der an der Abspaltung beteiligten Rechtsträger ist, wenn sie binnen sechs Monaten nach dem Tag, an dem die Eintragung der Abspaltung in das Register des Sitzes desjenigen Rechtsträgers, dessen Gläubiger sie sind, nach § 19 Absatz 3 UmwG als bekanntgemacht gilt, ihren Anspruch nach Grund und Höhe schriftlich anmelden, Sicherheit zu leisten, soweit sie nicht Befriedigung verlangen können. Dieses Recht steht den Gläubigern jedoch nur zu, wenn sie glaubhaft machen, dass durch die Abspaltung die Erfüllung ihrer Forderung gefährdet wird."
    },
    {
      "date": "2025-07-18",
      "id": "116660",
      "original_text": "Registerbekanntmachung nach dem Umwandlungsgesetz\nNordrhein-Westfalen Amtsgericht Duisburg HRA 12518\nRhenus Transport GmbH & Co. KG – Duisburg",
      "type": "Registerbekanntmachung nach dem Umwandlungsgesetz",
      "state": "Nordrhein-Westfalen",
      "amtsgericht": "Amtsgericht Duisburg",
      "registernummer": "HRA 12518",
      "registerart": "HRA",
      "company_name": "Rhenus Transport GmbH & Co. KG",
      "company_seat": "Duisburg",
      "details": "18.07.2025 (Bekanntmachungsdatum)\n\nNordrhein-Westfalen Amtsgericht Duisburg HRA 12518\nRegisterbekanntmachung nach dem Umwandlungsgesetz 18.07.2025 (Eintragungsdatum)\n\nRhenus Transport GmbH & Co. KG\nKommanditgesellschaft\nDuisburg\n\nDen Gläubigern der an der Verschmelzung beteiligten Rechtsträger ist, wenn sie binnen sechs Monaten nach dem Tag, an dem die Eintragung der Verschmelzung in das Register des Sitzes desjenigen Rechtsträgers, dessen Gläubiger sie sind, nach § 19 Absatz 3 UmwG als bekanntgemacht gilt, ihren Anspruch nach Grund und Höhe schriftlich anmelden, Sicherheit zu leisten, soweit sie nicht Befriedigung verlangen können. Dieses Recht steht den Gläubigern jedoch nur zu, wenn sie glaubhaft machen, dass durch die Verschmelzung die Erfüllung ihrer Forderung gefährdet wird."
    },
    {
      "date": "2025-07-18",
      "id": "116661",
      "original_text": "Registerbekanntmachung nach dem Umwandlungsgesetz\nNordrhein-Westfalen Amtsgericht Köln HRA 36417\nEmons Spedition GmbH & Co. KG – Köln",
      "type": "Registerbekanntmachung nach dem Umwandlungsgesetz",
      "state": "Nordrhein-Westfalen",
      "amtsgericht": "Amtsgericht Köln",
      "registernummer": "HRA 36417",
      "registerart": "HRA",
      "company_name": "Emons Spedition GmbH & Co. KG",
      "company_seat": "Köln",
      "details": "18.07.2025 (Bekanntmachungsdatum)\n\nNordrhein-Westfalen Amtsgericht Köln HRA 36417\nRegisterbekanntmachung nach dem Umwandlungsgesetz 18.07.2025 (Eintragungsdatum)\n\nEmons Spedition GmbH & Co. KG\nKommanditgesellschaft\nKöln\n\nDen Gläubigern der an der Verschmelzung beteiligten Rechtsträger ist, wenn sie binnen sechs Monaten nach dem Tag, an dem die Eintragung der Verschmelzung in das Register des Sitzes desjenigen Rechtsträgers, dessen Gläubiger sie sind, nach § 19 Absatz 3 UmwG als bekanntgemacht gilt, ihren Anspruch nach Grund und Höhe schriftlich anmelden, Sicherheit zu leisten, soweit sie nicht Befriedigung verlangen können. Dieses Recht steht den Gläubigern jedoch nur zu, wenn sie glaubhaft machen, dass durch die Verschmelzung die Erfüllung ihrer Forderung gefährdet wird."
    },
    {
      "date": "2025-07-18",
      "id": "116662",
      "original_text": "Registerbekanntmachung nach dem Umwandlungsgesetz\nNordrhein-Westfalen Amtsgericht Gelsenkirchen HRB 9699\nUNIKA Kalksandstein Westfalen GmbH – Haltern am See",
      "type": "Registerbekanntmachung nach dem Umwandlungsgesetz",
      "state": "Nordrhein-Westfalen",
      "amtsgericht": "Amtsgericht Gelsenkirchen",
      "registernummer": "HRB 9699",
      "registerart": "HRB",
      "company_name": "UNIKA Kalksandstein Westfalen GmbH",
      "company_seat": "Haltern am See",
      "details": "18.07.2025 (Bekanntmachungsdatum)\n\nNordrhein-Westfalen Amtsgericht Gelsenkirchen HRB 9699\nRegisterbekanntmachung nach dem Umwandlungsgesetz 18.07.2025 (Eintragungsdatum)\n\nUNIKA Kalksandstein Westfalen GmbH\nGesellschaft mit beschränkter Haftung\nHaltern am See\n\nDen Gläubigern der an der Verschmelzung beteiligten Rechtsträger ist, wenn sie binnen sechs Monaten nach dem Tag, an dem die Eintragung der Verschmelzung in das Register des Sitzes desjenigen Rechtsträgers, dessen Gläubiger sie sind, nach § 19 Absatz 3 UmwG als bekanntgemacht gilt, ihren Anspruch nach Grund und Höhe schriftlich anmelden, Sicherheit zu leisten, soweit sie nicht Befriedigung verlangen können. Dieses Recht steht den Gläubigern jedoch nur zu, wenn sie glaubhaft machen, dass durch die Verschmelzung die Erfüllung ihrer Forderung gefährdet wird."
    },
    {
      "date": "2025-07-18",
      "id": "116663",
      "original_text": "Registerbekanntmachung nach dem Umwandlungsgesetz\nNordrhein-Westfalen Amtsgericht Bochum HRA 3718\nREMONDIS GmbH & Co. KG – Bochum",
      "type": "Registerbekanntmachung nach dem Umwandlungsgesetz",
      "state": "Nordrhein-Westfalen",
      "amtsgericht": "Amtsgericht Bochum",
      "registernummer": "HRA 3718",
      "registerart": "HRA",
      "company_name": "REMONDIS GmbH & Co. KG",
      "company_seat": "Bochum",
      "details": "18.07.2025 (Bekanntmachungsdatum)\n\nNordrhein-Westfalen Amtsgericht Bochum HRA 3718\nRegisterbekanntmachung nach dem Umwandlungsgesetz 18.07.2025 (Eintragungsdatum)\n\nREMONDIS GmbH & Co. KG\nKommanditgesellschaft\nBochum\n\nDen Gläubigern der an der Verschmelzung beteiligten Rechtsträger ist, wenn sie binnen sechs Monaten nach dem Tag, an dem die Eintragung der Verschmelzung in das Register des Sitzes desjenigen Rechtsträgers, dessen Gläubiger sie sind, nach § 19 Absatz 3 UmwG als bekanntgemacht gilt, ihren Anspruch nach Grund und Höhe schriftlich anmelden, Sicherheit zu leisten, soweit sie nicht Befriedigung verlangen können. Dieses Recht steht den Gläubigern jedoch nur zu, wenn sie glaubhaft machen, dass durch die Verschmelzung die Erfüllung ihrer Forderung gefährdet wird."
    },
    {
      "date": "2025-07-18",
      "id": "116664",
      "original_text": "Sonstige Registerbekanntmachung\nThüringen Amtsgericht Jena HRB 301951\nWohnungsbau- und Wohnungsförderungsgesellschaft der Stadt Neuhaus am Rennweg mit beschränkter Haftung – Neuhaus a. Rennweg",
      "type": "Sonstige Registerbekanntmachung",
      "state": "Thüringen",
      "amtsgericht": "Amtsgericht Jena",
      "registernummer": "HRB 301951",
      "registerart": "HRB",
      "company_name": "Wohnungsbau- und Wohnungsförderungsgesellschaft der Stadt Neuhaus am Rennweg mit beschränkter Haftung",
      "company_seat": "Neuhaus a. Rennweg",
      "details": "18.07.2025 (Bekanntmachungsdatum)\n\nThüringen Amtsgericht Jena HRB 301951\nSonstige Registerbekanntmachung\n\nWohnungsbau- und Wohnungsförderungsgesellschaft der Stadt Neuhaus am Rennweg mit beschränkter Haftung\nGesellschaft mit beschränkter Haftung\nNeuhaus a. Rennweg\n\nBekanntmachung gem. § 52 Abs. 3 Satz 2 GmbHG: Aufgrund einer Veränderung in den Personen der Aufsichtsratsmitglieder ist durch die Geschäftsführer eine neue Liste zum Handelsregister eingereicht worden."
    },
    {
      "date": "2025-07-18",
      "id": "116665",
      "original_text": "Registerbekanntmachung nach dem Umwandlungsgesetz\nThüringen Amtsgericht Jena HRB 104221\nPLAN-TECHNIK Bürosysteme GmbH – Erfurt",
      "type": "Registerbekanntmachung nach dem Umwandlungsgesetz",
      "state": "Thüringen",
      "amtsgericht": "Amtsgericht Jena",
      "registernummer": "HRB 104221",
      "registerart": "HRB",
      "company_name": "PLAN-TECHNIK Bürosysteme GmbH",
      "company_seat": "Erfurt",
      "details": "18.07.2025 (Bekanntmachungsdatum)\n\nThüringen Amtsgericht Jena HRB 104221\nRegisterbekanntmachung nach dem Umwandlungsgesetz 18.07.2025 (Eintragungsdatum)\n\nPLAN-TECHNIK Bürosysteme GmbH\nGesellschaft mit beschränkter Haftung\nErfurt\n\nNicht eingetragen: Den Gläubigern der an der Ausgliederung beteiligten Rechtsträger, ist wenn sie binnen sechs Monaten nach dem Tag, an dem die Eintragung der Ausgliederung in das Register des Sitzes desjenigen Rechtsträgers, dessen Gläubiger sie sind, nach §§125, 19 Abs. 3 UmwG als bekanntgemacht gilt, ihren Anspruch nach Grund und Höhe schriftlich anmelden, Sicherheit zu leisten, soweit sie nicht Befriedigung verlangen können. Dieses Recht steht ihnen jedoch nur zu, wenn sie glaubhaft machen, daß durch die Ausgliederung die Erfüllung ihrer Forderung gefährdet wird."
    },
    {
      "date": "2025-07-18",
      "id": "116666",
      "original_text": "Löschungsankündigung\nNordrhein-Westfalen Amtsgericht Gelsenkirchen HRB 16192\nMK-Bauservice UG (haftungsbeschränkt) – Gelsenkirchen",
      "type": "Löschungsankündigung",
      "state": "Nordrhein-Westfalen",
      "amtsgericht": "Amtsgericht Gelsenkirchen",
      "registernummer": "HRB 16192",
      "registerart": "HRB",
      "company_name": "MK-Bauservice UG (haftungsbeschränkt)",
      "company_seat": "Gelsenkirchen",
      "details": "18.07.2025 (Bekanntmachungsdatum)\n\nNordrhein-Westfalen Amtsgericht Gelsenkirchen HRB 16192\nLöschungsankündigung 18.07.2025 (Eintragungsdatum)\n\nMK-Bauservice UG (haftungsbeschränkt)\nGesellschaft mit beschränkter Haftung\nGelsenkirchen\n\nDas Gericht beabsichtigt, die Gesellschaft MK-Bauservice UG (haftungsbeschränkt) i. L. mit Sitz in Gelsenkirchen, HRB 16192 Amtsgericht Gelsenkirchen, wegen Vermögenslosigkeit zu löschen.\n\nHiermit wird denjenigen, die an der Unterlassung der Löschung ein berechtigtes Interesse haben, gem. § 394 Abs. 2 FamFG Gelegenheit gegeben, gegen dieses Vorhaben binnen eines Monats nach dieser Bekanntmachung Widerspruch einzulegen. Der Widerspruch kann schriftlich oder zu Protokoll der Geschäftsstelle erhoben werden."
    },
    {
      "date": "2025-07-18",
      "id": "116667",
      "original_text": "Registerbekanntmachung nach dem Umwandlungsgesetz\nHessen Amtsgericht Fulda HRA 6655\nMalerbetrieb Daniel Jörges e.K. – Tann",
      "type": "Registerbekanntmachung nach dem Umwandlungsgesetz",
      "state": "Hessen",
      "amtsgericht": "Amtsgericht Fulda",
      "registernummer": "HRA 6655",
      "registerart": "HRA",
      "company_name": "Malerbetrieb Daniel Jörges e.K.",
      "company_seat": "Tann",
      "details": "18.07.2025 (Bekanntmachungsdatum)\n\nHessen Amtsgericht Fulda HRA 6655\nRegisterbekanntmachung nach dem Umwandlungsgesetz 18.07.2025 (Eintragungsdatum)\n\nMalerbetrieb Daniel Jörges e.K.\nEinzelkaufmann / Einzelkauffrau\nTann\n\nDen Gläubigern der an der Ausgliederung beteiligten Rechtsträger ist, wenn sie binnen sechs Monaten nach dem Tag, an dem die Eintragung der Ausgliederung in das Register des Sitzes desjenigen Rechtsträgers, dessen Gläubiger sie sind, nach §§ 125, 19 Absatz 3 UmwG bekannt gemacht worden ist, ihren Anspruch nach Grund und Höhe schriftlich anmelden, Sicherheit zu leisten, soweit sie nicht Befriedigung verlangen können. Dieses Recht steht den Gläubigern jedoch nur zu, wenn sie glaubhaft machen, dass durch die Ausgliederung die Erfüllung ihrer Forderung gefährdet wird."
    },
    {
      "date": "2025-07-18",
      "id": "116668",
      "original_text": "Löschungsankündigung\nHessen Amtsgericht Wiesbaden HRB 27691\nBrasserie am Luisenplatz UG (haftungsbeschränkt) – Wiesbaden",
      "type": "Löschungsankündigung",
      "state": "Hessen",
      "amtsgericht": "Amtsgericht Wiesbaden",
      "registernummer": "HRB 27691",
      "registerart": "HRB",
      "company_name": "Brasserie am Luisenplatz UG (haftungsbeschränkt)",
      "company_seat": "Wiesbaden",
      "details": "18.07.2025 (Bekanntmachungsdatum)\n\nHessen Amtsgericht Wiesbaden HRB 27691\nLöschungsankündigung\n\nBrasserie am Luisenplatz UG (haftungsbeschränkt)\nGesellschaft mit beschränkter Haftung\nWiesbaden\n\nDas Registergericht beabsichtigt die im Handelsregister eingetragene Gesellschaft von Amts wegen nach § 394 FamFG zu löschen. Die Frist zur Erhebung eines Widerspruchs gegen die beabsichtigte Löschung wird auf 3 Monate festgesetzt."
    },
    {
      "date": "2025-07-18",
      "id": "116669",
      "original_text": "Löschungsankündigung\nHessen Amtsgericht Hanau HRB 13242\nObjektgesellschaft Warenhaus Gelnhausen GmbH – Gelnhausen",
      "type": "Löschungsankündigung",
      "state": "Hessen",
      "amtsgericht": "Amtsgericht Hanau",
      "registernummer": "HRB 13242",
      "registerart": "HRB",
      "company_name": "Objektgesellschaft Warenhaus Gelnhausen GmbH",
      "company_seat": "Gelnhausen",
      "details": "18.07.2025 (Bekanntmachungsdatum)\n\nHessen Amtsgericht Hanau HRB 13242\nLöschungsankündigung\n\nObjektgesellschaft Warenhaus Gelnhausen GmbH\nGesellschaft mit beschränkter Haftung\nGelnhausen\n\nDas Registergericht beabsichtigt die im Handelsregister eingetragene Gesellschaft von Amts wegen nach § 394 FamFG zu löschen. Die Frist zur Erhebung eines Widerspruchs gegen die beabsichtigte Löschung wird auf 3 Monate festgesetzt."
    },
    {
      "date": "2025-07-18",
      "id": "116670",
      "original_text": "Einreichung neuer Dokumente\nHessen Amtsgericht Frankfurt am Main HRB 75707\nHoechst GmbH – Frankfurt am Main",
      "type": "Einreichung neuer Dokumente",
      "state": "Hessen",
      "amtsgericht": "Amtsgericht Frankfurt am Main",
      "registernummer": "HRB 75707",
      "registerart": "HRB",
      "company_name": "Hoechst GmbH",
      "company_seat": "Frankfurt am Main",
      "details": "18.07.2025 (Bekanntmachungsdatum)\n\nHessen Amtsgericht Frankfurt am Main HRB 75707\nEinreichung neuer Dokumente 18.07.2025 (Eintragungsdatum)\n\nHoechst GmbH\nGesellschaft mit beschränkter Haftung\nFrankfurt am Main\n\nDurch eine Änderung in den Personen der Aufsichtsratsmitglieder ist eine Liste der Mitglieder des Aufsichtsrates zum Handelsregister eingereicht worden."
    },
    {
      "date": "2025-07-18",
      "id": "116671",
      "original_text": "Löschungsankündigung\nHessen Amtsgericht Darmstadt HRB 98264\nEXACTA Forderungsmanagement Unternehmergesellschaft (haftungsbeschränkt) – Zwingenberg",
      "type": "Löschungsankündigung",
      "state": "Hessen",
      "amtsgericht": "Amtsgericht Darmstadt",
      "registernummer": "HRB 98264",
      "registerart": "HRB",
      "company_name": "EXACTA Forderungsmanagement Unternehmergesellschaft (haftungsbeschränkt)",
      "company_seat": "Zwingenberg",
      "details": "18.07.2025 (Bekanntmachungsdatum)\n\nHessen Amtsgericht Darmstadt HRB 98264\nLöschungsankündigung\n\nEXACTA Forderungsmanagement Unternehmergesellschaft (haftungsbeschränkt)\nGesellschaft mit beschränkter Haftung\nZwingenberg\n\nDas Registergericht beabsichtigt die im Handelsregister eingetragene Gesellschaft von Amts wegen nach § 394 FamFG zu löschen. Die Frist zur Erhebung eines Widerspruchs gegen die beabsichtigte Löschung wird auf 3 Monate festgesetzt."
    },
    {
      "date": "2025-07-18",
      "id": "116672",
      "original_text": "Einreichung neuer Dokumente\nHessen Amtsgericht Fulda HRB 5147\nFuldaEnergie Immobilienservice GmbH – Fulda",
      "type": "Einreichung neuer Dokumente",
      "state": "Hessen",
      "amtsgericht": "Amtsgericht Fulda",
      "registernummer": "HRB 5147",
      "registerart": "HRB",
      "company_name": "FuldaEnergie Immobilienservice GmbH",
      "company_seat": "Fulda",
      "details": "18.07.2025 (Bekanntmachungsdatum)\n\nHessen Amtsgericht Fulda HRB 5147\nEinreichung neuer Dokumente 18.07.2025 (Eintragungsdatum)\n\nFuldaEnergie Immobilienservice GmbH\nGesellschaft mit beschränkter Haftung\nFulda\n\nDurch eine Änderung in den Personen der Aufsichtsratsmitglieder ist eine Liste der Mitglieder des Aufsichtsrates zum Handelsregister eingereicht worden."
    },
    {
      "date": "2025-07-18",
      "id": "116673",
      "original_text": "Löschungsankündigung\nHessen Amtsgericht Frankfurt am Main HRB 126302\nAdSec-Adler Sicherheits- und Wachdienst GmbH – Frankfurt am Main",
      "type": "Löschungsankündigung",
      "state": "Hessen",
      "amtsgericht": "Amtsgericht Frankfurt am Main",
      "registernummer": "HRB 126302",
      "registerart": "HRB",
      "company_name": "AdSec-Adler Sicherheits- und Wachdienst GmbH",
      "company_seat": "Frankfurt am Main",
      "details": "18.07.2025 (Bekanntmachungsdatum)\n\nHessen Amtsgericht Frankfurt am Main HRB 126302\nLöschungsankündigung\n\nAdSec-Adler Sicherheits- und Wachdienst GmbH\nGesellschaft mit beschränkter Haftung\nFrankfurt am Main\n\nEs ist beabsichtigt die Gesellschaft wegen Vermögenslosigkeit gemäß § 394 FamFG von Amts wegen zu löschen. Hiergegen kann innerhalb eines Monats nach dieser Veröffentlichung Widerspruch bei dem Amtsgericht Frankfurt am Main eingelegt werden."
    },
    {
      "date": "2025-07-18",
      "id": "116674",
      "original_text": "Einreichung neuer Dokumente\nHessen Amtsgericht Frankfurt am Main HRB 109334\nBauland - Offensive Hessen Gesellschaft mit beschränkter Haftung – Frankfurt am Main",
      "type": "Einreichung neuer Dokumente",
      "state": "Hessen",
      "amtsgericht": "Amtsgericht Frankfurt am Main",
      "registernummer": "HRB 109334",
      "registerart": "HRB",
      "company_name": "Bauland - Offensive Hessen Gesellschaft mit beschränkter Haftung",
      "company_seat": "Frankfurt am Main",
      "details": "18.07.2025 (Bekanntmachungsdatum)\n\nHessen Amtsgericht Frankfurt am Main HRB 109334\nEinreichung neuer Dokumente\n\nBauland - Offensive Hessen Gesellschaft mit beschränkter Haftung\nGesellschaft mit beschränkter Haftung\nFrankfurt am Main\n\nDurch eine Änderung in den Personen der Aufsichtsratsmitglieder ist eine Liste der Mitglieder des Aufsichtsrates zum Handelsregister eingereicht worden."
    },
    {
      "date": "2025-07-18",
      "id": "116675",
      "original_text": "Einreichung neuer Dokumente\nHessen Amtsgericht Limburg HRB 6308\nTM Real Estate AG – Limburg an der Lahn",
      "type": "Einreichung neuer Dokumente",
      "state": "Hessen",
      "amtsgericht": "Amtsgericht Limburg",
      "registernummer": "HRB 6308",
      "registerart": "HRB",
      "company_name": "TM Real Estate AG",
      "company_seat": "Limburg an der Lahn",
      "details": "18.07.2025 (Bekanntmachungsdatum)\n\nHessen Amtsgericht Limburg HRB 6308\nEinreichung neuer Dokumente\n\nTM Real Estate AG\nAktiengesellschaft\nLimburg an der Lahn\n\nDurch eine Änderung in den Personen der Aufsichtsratsmitglieder ist eine Liste der Mitglieder des Aufsichtsrates zum Handelsregister eingereicht worden."
    },
    {
      "date": "2025-07-18",
      "id": "116676",
      "original_text": "Einreichung neuer Dokumente\nHessen Amtsgericht Frankfurt am Main HRB 55695\nWCM Beteiligungs- und Grundbesitz-Aktiengesellschaft – Frankfurt am Main",
      "type": "Einreichung neuer Dokumente",
      "state": "Hessen",
      "amtsgericht": "Amtsgericht Frankfurt am Main",
      "registernummer": "HRB 55695",
      "registerart": "HRB",
      "company_name": "WCM Beteiligungs- und Grundbesitz-Aktiengesellschaft",
      "company_seat": "Frankfurt am Main",
      "details": "18.07.2025 (Bekanntmachungsdatum)\n\nHessen Amtsgericht Frankfurt am Main HRB 55695\nEinreichung neuer Dokumente\n\nWCM Beteiligungs- und Grundbesitz-Aktiengesellschaft\nAktiengesellschaft\nFrankfurt am Main\n\nDurch eine Änderung in den Personen der Aufsichtsratsmitglieder ist eine Liste der Mitglieder des Aufsichtsrates zum Handelsregister eingereicht worden."
    },
    {
      "date": "2025-07-18",
      "id": "116677",
      "original_text": "Registerbekanntmachung nach dem Umwandlungsgesetz\nHessen Amtsgericht Wiesbaden HRB 9569\nAVL Deutschland GmbH – Wiesbaden",
      "type": "Registerbekanntmachung nach dem Umwandlungsgesetz",
      "state": "Hessen",
      "amtsgericht": "Amtsgericht Wiesbaden",
      "registernummer": "HRB 9569",
      "registerart": "HRB",
      "company_name": "AVL Deutschland GmbH",
      "company_seat": "Wiesbaden",
      "details": "18.07.2025 (Bekanntmachungsdatum)\n\nHessen Amtsgericht Wiesbaden HRB 9569\nRegisterbekanntmachung nach dem Umwandlungsgesetz 18.07.2025 (Eintragungsdatum)\n\nAVL Deutschland GmbH\nGesellschaft mit beschränkter Haftung\nWiesbaden\n\nDen Gläubigern der an der Verschmelzung beteiligten Rechtsträger ist, wenn sie binnen sechs Monaten nach dem Tag, an dem die Eintragung der Verschmelzung in das Register des Sitzes derjenigen Rechtsträger deren Gläubiger sie sind, nach § 19 Absatz 3 UmwG bekannt gemacht worden ist, ihren Anspruch nach Grund und Höhe schriftlich anmelden, Sicherheit zu leisten, soweit sie nicht Befriedigung verlangen können. Dieses Recht steht den Gläubigern jedoch nur zu, wenn sie glaubhaft machen, dass durch die Verschmelzung die Erfüllung ihrer Forderung gefährdet wird."
    },
    {
      "date": "2025-07-18",
      "id": "116678",
      "original_text": "Einreichung neuer Dokumente\nHessen Amtsgericht Darmstadt HRB 5151\nENTEGA AG – Darmstadt",
      "type": "Einreichung neuer Dokumente",
      "state": "Hessen",
      "amtsgericht": "Amtsgericht Darmstadt",
      "registernummer": "HRB 5151",
      "registerart": "HRB",
      "company_name": "ENTEGA AG",
      "company_seat": "Darmstadt",
      "details": "18.07.2025 (Bekanntmachungsdatum)\n\nHessen Amtsgericht Darmstadt HRB 5151\nEinreichung neuer Dokumente 18.07.2025 (Eintragungsdatum)\n\nENTEGA AG\nAktiengesellschaft\nDarmstadt\n\nDurch eine Änderung in den Personen der Aufsichtsratsmitglieder ist eine Liste der Mitglieder des Aufsichtsrates zum Handelsregister eingereicht worden."
    },
    {
      "date": "2025-07-18",
      "id": "116679",
      "original_text": "Sonstige Registerbekanntmachung\nHessen Amtsgericht Frankfurt am Main HRB 139459\nDEVARIS SE – Frankfurt am Main",
      "type": "Sonstige Registerbekanntmachung",
      "state": "Hessen",
      "amtsgericht": "Amtsgericht Frankfurt am Main",
      "registernummer": "HRB 139459",
      "registerart": "HRB",
      "company_name": "DEVARIS SE",
      "company_seat": "Frankfurt am Main",
      "details": "18.07.2025 (Bekanntmachungsdatum)\n\nHessen Amtsgericht Frankfurt am Main HRB 139459\nSonstige Registerbekanntmachung 18.07.2025 (Eintragungsdatum)\n\nDEVARIS SE\nEuropäische Aktiengesellschaft (SE)\nFrankfurt am Main\n\nEine Liste der Mitglieder des Aufsichtsrates zum Handelsregister eingereicht worden."
    },
    {
      "date": "2025-07-18",
      "id": "116680",
      "original_text": "Sonstige Registerbekanntmachung\nHessen Amtsgericht Frankfurt am Main HRB 94922\nSedico Management GmbH – Frankfurt am Main",
      "type": "Sonstige Registerbekanntmachung",
      "state": "Hessen",
      "amtsgericht": "Amtsgericht Frankfurt am Main",
      "registernummer": "HRB 94922",
      "registerart": "HRB",
      "company_name": "Sedico Management GmbH",
      "company_seat": "Frankfurt am Main",
      "details": "18.07.2025 (Bekanntmachungsdatum)\n\nHessen Amtsgericht Frankfurt am Main HRB 94922\nSonstige Registerbekanntmachung 18.07.2025 (Eintragungsdatum)\n\nSedico Management GmbH\nGesellschaft mit beschränkter Haftung\nFrankfurt am Main\n\nDie Gesellschaft hat Gläubigern, deren Forderungen vor dieser Bekanntmachung begründet worden sind, Sicherheit zu leisten, soweit sie nicht Befriedigung verlangen können, wenn sie sich binnen sechs Monaten nach dieser Bekanntmachung zu diesem Zweck melden."
    },
    {
      "date": "2025-07-18",
      "id": "116681",
      "original_text": "Löschungsankündigung\nHessen Amtsgericht Hanau HRB 97084\nPietät-Eden UG (haftungsbechränkt) – Wächtersbach",
      "type": "Löschungsankündigung",
      "state": "Hessen",
      "amtsgericht": "Amtsgericht Hanau",
      "registernummer": "HRB 97084",
      "registerart": "HRB",
      "company_name": "Pietät-Eden UG (haftungsbechränkt)",
      "company_seat": "Wächtersbach",
      "details": "18.07.2025 (Bekanntmachungsdatum)\n\nHessen Amtsgericht Hanau HRB 97084\nLöschungsankündigung\n\nPietät-Eden UG (haftungsbechränkt)\nGesellschaft mit beschränkter Haftung\nWächtersbach\n\nDas Registergericht beabsichtigt die im Handelsregister eingetragene Gesellschaft von Amts wegen nach § 394 FamFG zu löschen. Die Frist zur Erhebung eines Widerspruchs gegen die beabsichtigte Löschung wird auf 3 Monate festgesetzt."
    },
    {
      "date": "2025-07-18",
      "id": "116682",
      "original_text": "Registerbekanntmachung nach dem Umwandlungsgesetz\nHessen Amtsgericht Wiesbaden HRB 34224\nBücher Sachwert GmbH – Wiesbaden",
      "type": "Registerbekanntmachung nach dem Umwandlungsgesetz",
      "state": "Hessen",
      "amtsgericht": "Amtsgericht Wiesbaden",
      "registernummer": "HRB 34224",
      "registerart": "HRB",
      "company_name": "Bücher Sachwert GmbH",
      "company_seat": "Wiesbaden",
      "details": "18.07.2025 (Bekanntmachungsdatum)\n\nHessen Amtsgericht Wiesbaden HRB 34224\nRegisterbekanntmachung nach dem Umwandlungsgesetz 18.07.2025 (Eintragungsdatum)\n\nBücher Sachwert GmbH\nGesellschaft mit beschränkter Haftung\nWiesbaden\n\nDen Gläubigern der an der Verschmelzung beteiligten Rechtsträger ist, wenn sie binnen sechs Monaten nach dem Tag, an dem die Eintragung der Verschmelzung in das Register des Sitzes desjenigen Rechtsträgers, dessen Gläubiger sie sind, nach § 19 Absatz 3 UmwG bekannt gemacht worden ist, ihren Anspruch nach Grund und Höhe schriftlich anmelden, Sicherheit zu leisten, soweit sie nicht Befriedigung verlangen können. Dieses Recht steht den Gläubigern jedoch nur zu, wenn sie glaubhaft machen, dass durch die Verschmelzung die Erfüllung ihrer Forderung gefährdet wird."
    },
    {
      "date": "2025-07-18",
      "id": "116683",
      "original_text": "Registerbekanntmachung nach dem Umwandlungsgesetz\nHessen Amtsgericht Wiesbaden HRB 33494\nCN Beteiligungsgesellschaft mbH – Wiesbaden",
      "type": "Registerbekanntmachung nach dem Umwandlungsgesetz",
      "state": "Hessen",
      "amtsgericht": "Amtsgericht Wiesbaden",
      "registernummer": "HRB 33494",
      "registerart": "HRB",
      "company_name": "CN Beteiligungsgesellschaft mbH",
      "company_seat": "Wiesbaden",
      "details": "18.07.2025 (Bekanntmachungsdatum)\n\nHessen Amtsgericht Wiesbaden HRB 33494\nRegisterbekanntmachung nach dem Umwandlungsgesetz 18.07.2025 (Eintragungsdatum)\n\nCN Beteiligungsgesellschaft mbH\nGesellschaft mit beschränkter Haftung\nWiesbaden\n\nDen Gläubigern der an der Verschmelzung beteiligten Rechtsträger ist, wenn sie binnen sechs Monaten nach dem Tag, an dem die Eintragung der Verschmelzung in das Register des Sitzes desjenigen Rechtsträgers, dessen Gläubiger sie sind, nach § 19 Absatz 3 UmwG bekannt gemacht worden ist, ihren Anspruch nach Grund und Höhe schriftlich anmelden, Sicherheit zu leisten, soweit sie nicht Befriedigung verlangen können. Dieses Recht steht den Gläubigern jedoch nur zu, wenn sie glaubhaft machen, dass durch die Verschmelzung die Erfüllung ihrer Forderung gefährdet wird."
    },
    {
      "date": "2025-07-18",
      "id": "116684",
      "original_text": "Löschungsankündigung\nHessen Amtsgericht Frankfurt am Main HRB 108706\nCogniX GmbH – Frankfurt am Main",
      "type": "Löschungsankündigung",
      "state": "Hessen",
      "amtsgericht": "Amtsgericht Frankfurt am Main",
      "registernummer": "HRB 108706",
      "registerart": "HRB",
      "company_name": "CogniX GmbH",
      "company_seat": "Frankfurt am Main",
      "details": "18.07.2025 (Bekanntmachungsdatum)\n\nHessen Amtsgericht Frankfurt am Main HRB 108706\nLöschungsankündigung\n\nCogniX GmbH\nGesellschaft mit beschränkter Haftung\nFrankfurt am Main\n\nEs ist beabsichtigt die Gesellschaft wegen Vermögenslosigkeit gemäß § 394 FamFG von Amts wegen zu löschen. Hiergegen kann innerhalb eines Monats nach dieser Veröffentlichung Widerspruch bei dem Amtsgericht Frankfurt am Main eingelegt werden."
    },
    {
      "date": "2025-07-18",
      "id": "116685",
      "original_text": "Löschungsankündigung\nHessen Amtsgericht Frankfurt am Main HRB 128388\nKATA Bau GmbH – Frankfurt am Main",
      "type": "Löschungsankündigung",
      "state": "Hessen",
      "amtsgericht": "Amtsgericht Frankfurt am Main",
      "registernummer": "HRB 128388",
      "registerart": "HRB",
      "company_name": "KATA Bau GmbH",
      "company_seat": "Frankfurt am Main",
      "details": "18.07.2025 (Bekanntmachungsdatum)\n\nHessen Amtsgericht Frankfurt am Main HRB 128388\nLöschungsankündigung\n\nKATA Bau GmbH\nGesellschaft mit beschränkter Haftung\nFrankfurt am Main\n\nDas Registergericht beabsichtigt die im Handelsregister eingetragene Gesellschaft von Amts wegen nach § 394 FamFG zu löschen. Die Frist zur Erhebung eines Widerspruchs gegen die beabsichtigte Löschung wird auf 1 Monat festgesetzt."
    },
    {
      "date": "2025-07-18",
      "id": "116686",
      "original_text": "Sonstige Registerbekanntmachung\nHessen Amtsgericht Offenbach am Main VR 5846\n10/20er Mofa-Klub – Seligenstadt",
      "type": "Sonstige Registerbekanntmachung",
      "state": "Hessen",
      "amtsgericht": "Amtsgericht Offenbach am Main",
      "registernummer": "VR 5846",
      "registerart": "VR",
      "company_name": "10/20er Mofa-Klub",
      "company_seat": "Seligenstadt",
      "details": "18.07.2025 (Bekanntmachungsdatum)\n\nHessen Amtsgericht Offenbach am Main VR 5846\nSonstige Registerbekanntmachung 18.07.2025 (Eintragungsdatum)\n\n10/20er Mofa-Klub\neingetragener Verein\nSeligenstadt\n\nDer Verein ist aufgelöst."
    },
    {
      "date": "2025-07-18",
      "id": "116687",
      "original_text": "Löschungsankündigung\nHessen Amtsgericht Hanau HRB 91792\nB & W GmbH Elektroanlagen von A-Z – Hanau",
      "type": "Löschungsankündigung",
      "state": "Hessen",
      "amtsgericht": "Amtsgericht Hanau",
      "registernummer": "HRB 91792",
      "registerart": "HRB",
      "company_name": "B & W GmbH Elektroanlagen von A-Z",
      "company_seat": "Hanau",
      "details": "18.07.2025 (Bekanntmachungsdatum)\n\nHessen Amtsgericht Hanau HRB 91792\nLöschungsankündigung\n\nB & W GmbH Elektroanlagen von A-Z\nGesellschaft mit beschränkter Haftung\nHanau\n\nDas Registergericht beabsichtigt die im Handelsregister eingetragene Gesellschaft von Amts wegen nach § 394 FamFG zu löschen. Die Frist zur Erhebung eines Widerspruchs gegen die beabsichtigte Löschung wird auf 3 Monate festgesetzt."
    },
    {
      "date": "2025-07-18",
      "id": "88",
      "original_text": "Sonderregisterbekanntmachung OHNE Bezug zum elektr. Register\nBrandenburg Amtsgericht Neuruppin\nHRB 5426 NP\nKreiskrankenhaus Prignitz Servicegesellschaft GmbH",
      "type": "Sonderregisterbekanntmachung OHNE Bezug zum elektr. Register",
      "state": "Brandenburg",
      "amtsgericht": "Amtsgericht Neuruppin",
      "company_name": "Kreiskrankenhaus Prignitz Servicegesellschaft GmbH",
      "sonderegister_referenz": "HRB 5426 NP",
      "details": "18.07.2025 (Bekanntmachungsdatum)\n\nBrandenburg Amtsgericht Neuruppin\nHRB 5426 NP\nSonderregisterbekanntmachung OHNE Bezug zum elektr. Register\n\nKreiskrankenhaus Prignitz Servicegesellschaft GmbH\n\nAls nicht eingetragen wird bekannt gemacht: Eine Liste der Mitglieder des Aufsichtsrates wurde zum Handelsregister eingereicht."
    }
  ]
}