{
  "date": "2025-07-04",
  "date_of_scrape": "2025-07-05T04:13:18.366Z",
  "tool_version": "0.2.0",
  "number_of_announcements": 146,
  "announcements": [
    {
      "date": "2025-07-04",
      "id": "114559",
      "original_text": "Registerbekanntmachung nach dem Umwandlungsgesetz\nBayern Amtsgericht München HRB 263303\nJohannes Seniorendienste GmbH – München",
      "type": "Registerbekanntmachung nach dem Umwandlungsgesetz",
      "state": "Bayern",
      "amtsgericht": "Amtsgericht München",
      "registernummer": "HRB 263303",
      "registerart": "HRB",
      "company_name": "Johannes Seniorendienste GmbH",
      "company_seat": "München",
      "details": "04.07.2025 (Bekanntmachungsdatum)\n\nBayern Amtsgericht München HRB 263303\nRegisterbekanntmachung nach dem Umwandlungsgesetz 03.07.2025 (Eintragungsdatum)\n\nJohannes Seniorendienste GmbH\nGesellschaft mit beschränkter Haftung\nMünchen\n\nDen Gläubigern der an der Verschmelzung beteiligten Rechtsträger ist, wenn sie binnen sechs Monaten nach dem Tag, an dem die Eintragung der Verschmelzung in das Register des Sitzes desjenigen Rechtsträgers, dessen Gläubiger sie sind, nach § 19 Abs. 3 UmwG als bekannt gemacht gilt, ihren Anspruch nach Grund und Höhe in Textform anmelden, Sicherheit zu leisten, soweit sie nicht Befriedigung verlangen können. Dieses Recht steht den Gläubigern jedoch nur zu, wenn sie glaubhaft machen, dass durch die Verschmelzung die Erfüllung ihrer Forderung gefährdet wird."
    },
    {
      "date": "2025-07-04",
      "id": "114560",
      "original_text": "Sonstige Registerbekanntmachung\nBayern Amtsgericht München HRB 58671\nComputershare Communication Services GmbH – München",
      "type": "Sonstige Registerbekanntmachung",
      "state": "Bayern",
      "amtsgericht": "Amtsgericht München",
      "registernummer": "HRB 58671",
      "registerart": "HRB",
      "company_name": "Computershare Communication Services GmbH",
      "company_seat": "München",
      "details": "04.07.2025 (Bekanntmachungsdatum)\n\nBayern Amtsgericht München HRB 58671\nSonstige Registerbekanntmachung 03.07.2025 (Eintragungsdatum)\n\nComputershare Communication Services GmbH\nGesellschaft mit beschränkter Haftung\nMünchen\n\nDen Gläubigern der Gesellschaft, deren Forderungen begründet worden sind, bevor die Eintragung der Beendigung des #DV.art(Text=\"Bitte Art des Vertrages auswählen\",Eingabe=\n\"Beherrschungs- und Gewinnabführungsvertrages\",\n\"Beherrschungsvertrages\",\n\"Gewinnabführungsvertrages\",\n\"Teilgewinnabführungsvertrages\") in das Handelsregister nach § 10 des Handelsgesetzbuches als bekanntgemacht gilt, hat der andere Vertragsteil Sicherheit zu leisten, wenn sie sich binnen sechs Monaten nach der Bekanntmachung der Eintragung zu diesem Zweck bei ihm melden."
    },
    {
      "date": "2025-07-04",
      "id": "114561",
      "original_text": "Registerbekanntmachung nach dem Umwandlungsgesetz\nBayern Amtsgericht München HRB 226340\nPHÖNIX-Seniorenzentrum im Brühl GmbH – München",
      "type": "Registerbekanntmachung nach dem Umwandlungsgesetz",
      "state": "Bayern",
      "amtsgericht": "Amtsgericht München",
      "registernummer": "HRB 226340",
      "registerart": "HRB",
      "company_name": "PHÖNIX-Seniorenzentrum im Brühl GmbH",
      "company_seat": "München",
      "details": "04.07.2025 (Bekanntmachungsdatum)\n\nBayern Amtsgericht München HRB 226340\nRegisterbekanntmachung nach dem Umwandlungsgesetz 03.07.2025 (Eintragungsdatum)\n\nPHÖNIX-Seniorenzentrum im Brühl GmbH\nGesellschaft mit beschränkter Haftung\nMünchen\n\nDen Gläubigern der an der Verschmelzung beteiligten Rechtsträger ist, wenn sie binnen sechs Monaten nach dem Tag, an dem die Eintragung der Verschmelzung in das Register des Sitzes desjenigen Rechtsträgers, dessen Gläubiger sie sind, nach § 19 Abs. 3 UmwG als bekannt gemacht gilt, ihren Anspruch nach Grund und Höhe in Textform anmelden, Sicherheit zu leisten, soweit sie nicht Befriedigung verlangen können. Dieses Recht steht den Gläubigern jedoch nur zu, wenn sie glaubhaft machen, dass durch die Verschmelzung die Erfüllung ihrer Forderung gefährdet wird."
    },
    {
      "date": "2025-07-04",
      "id": "114562",
      "original_text": "Einreichung neuer Dokumente\nBayern Amtsgericht Nürnberg HRB 25279\nPfleiderer Deutschland GmbH – Neumarkt i.d.OPf.",
      "type": "Einreichung neuer Dokumente",
      "state": "Bayern",
      "amtsgericht": "Amtsgericht Nürnberg",
      "registernummer": "HRB 25279",
      "registerart": "HRB",
      "company_name": "Pfleiderer Deutschland GmbH",
      "company_seat": "Neumarkt i.d.OPf.",
      "details": "04.07.2025 (Bekanntmachungsdatum)\n\nBayern Amtsgericht Nürnberg HRB 25279\nEinreichung neuer Dokumente\n\nPfleiderer Deutschland GmbH\nGesellschaft mit beschränkter Haftung\nNeumarkt i.d.OPf.\n\nDem Amtsgericht Nürnberg -Registergericht- ist eine Liste der Mitglieder des Aufsichtsrats eingereicht worden, § 52 Abs. 3 S. 2 GmbHG."
    },
    {
      "date": "2025-07-04",
      "id": "114563",
      "original_text": "Registerbekanntmachung nach dem Umwandlungsgesetz\nBayern Amtsgericht München HRB 226307\nPHÖNIX-Seniorenzentrum Herzog Albrecht GmbH – München",
      "type": "Registerbekanntmachung nach dem Umwandlungsgesetz",
      "state": "Bayern",
      "amtsgericht": "Amtsgericht München",
      "registernummer": "HRB 226307",
      "registerart": "HRB",
      "company_name": "PHÖNIX-Seniorenzentrum Herzog Albrecht GmbH",
      "company_seat": "München",
      "details": "04.07.2025 (Bekanntmachungsdatum)\n\nBayern Amtsgericht München HRB 226307\nRegisterbekanntmachung nach dem Umwandlungsgesetz 03.07.2025 (Eintragungsdatum)\n\nPHÖNIX-Seniorenzentrum Herzog Albrecht GmbH\nGesellschaft mit beschränkter Haftung\nMünchen\n\nDen Gläubigern der an der Verschmelzung beteiligten Rechtsträger ist, wenn sie binnen sechs Monaten nach dem Tag, an dem die Eintragung der Verschmelzung in das Register des Sitzes desjenigen Rechtsträgers, dessen Gläubiger sie sind, nach § 19 Abs. 3 UmwG als bekannt gemacht gilt, ihren Anspruch nach Grund und Höhe in Textform anmelden, Sicherheit zu leisten, soweit sie nicht Befriedigung verlangen können. Dieses Recht steht den Gläubigern jedoch nur zu, wenn sie glaubhaft machen, dass durch die Verschmelzung die Erfüllung ihrer Forderung gefährdet wird."
    },
    {
      "date": "2025-07-04",
      "id": "114564",
      "original_text": "Registerbekanntmachung nach dem Umwandlungsgesetz\nBayern Amtsgericht München HRB 297432\nTRUSTEQ GmbH – München",
      "type": "Registerbekanntmachung nach dem Umwandlungsgesetz",
      "state": "Bayern",
      "amtsgericht": "Amtsgericht München",
      "registernummer": "HRB 297432",
      "registerart": "HRB",
      "company_name": "TRUSTEQ GmbH",
      "company_seat": "München",
      "details": "04.07.2025 (Bekanntmachungsdatum)\n\nBayern Amtsgericht München HRB 297432\nRegisterbekanntmachung nach dem Umwandlungsgesetz 03.07.2025 (Eintragungsdatum)\n\nTRUSTEQ GmbH\nGesellschaft mit beschränkter Haftung\nMünchen\n\nDen Gläubigern der an der Verschmelzung beteiligten Rechtsträger ist, wenn sie binnen sechs Monaten nach dem Tag, an dem die Eintragung der Verschmelzung in das Register des Sitzes desjenigen Rechtsträgers, dessen Gläubiger sie sind, nach § 19 Abs. 3 UmwG als bekannt gemacht gilt, ihren Anspruch nach Grund und Höhe in Textform anmelden, Sicherheit zu leisten, soweit sie nicht Befriedigung verlangen können. Dieses Recht steht den Gläubigern jedoch nur zu, wenn sie glaubhaft machen, dass durch die Verschmelzung die Erfüllung ihrer Forderung gefährdet wird."
    },
    {
      "date": "2025-07-04",
      "id": "114565",
      "original_text": "Registerbekanntmachung nach dem Umwandlungsgesetz\nBayern Amtsgericht München VR 204010\n\"ESCMID-Förderverein\" (Association for the promotion of Research and Education in Clinical Microbiology and Infectious Diseases-Förderverein) e.V. – München",
      "type": "Registerbekanntmachung nach dem Umwandlungsgesetz",
      "state": "Bayern",
      "amtsgericht": "Amtsgericht München",
      "registernummer": "VR 204010",
      "registerart": "VR",
      "company_name": "\"ESCMID-Förderverein\" (Association for the promotion of Research and Education in Clinical Microbiology and Infectious Diseases-Förderverein) e.V.",
      "company_seat": "München",
      "details": "04.07.2025 (Bekanntmachungsdatum)\n\nBayern Amtsgericht München VR 204010\nRegisterbekanntmachung nach dem Umwandlungsgesetz 03.07.2025 (Eintragungsdatum)\n\n\"ESCMID-Förderverein\" (Association for the promotion of Research and Education in Clinical Microbiology and Infectious Diseases-Förderverein) e.V.\neingetragener Verein\nMünchen\n\nDen Gläubigern des formwechselnden Rechtsträgers ist, wenn sie binnen sechs Monaten nach dem Tag, an dem die Eintragung des Formwechsels nach § 201 UmwG als bekannt gemacht gilt, ihren Anspruch nach Grund und Höhe in Textform anmelden, Sicherheit zu leisten, soweit sie nicht Befriedigung verlangen können. Dieses Recht steht den Gläubigern jedoch nur zu, wenn sie glaubhaft machen, dass durch den Formwechsel die Erfüllung ihrer Forderung gefährdet wird."
    },
    {
      "date": "2025-07-04",
      "id": "114566",
      "original_text": "Registerbekanntmachung nach dem Umwandlungsgesetz\nBayern Amtsgericht Hof HRB 3630\nKunststoff Helmbrechts AG – Helmbrechts",
      "type": "Registerbekanntmachung nach dem Umwandlungsgesetz",
      "state": "Bayern",
      "amtsgericht": "Amtsgericht Hof",
      "registernummer": "HRB 3630",
      "registerart": "HRB",
      "company_name": "Kunststoff Helmbrechts AG",
      "company_seat": "Helmbrechts",
      "details": "04.07.2025 (Bekanntmachungsdatum)\n\nBayern Amtsgericht Hof HRB 3630\nRegisterbekanntmachung nach dem Umwandlungsgesetz\n\nKunststoff Helmbrechts AG\nAktiengesellschaft\nHelmbrechts\n\nDem Amtsgericht Hof -Registergericht- ist der Entwurf eines Verschmelzungsvertrages zwischen der Gesellschaft als übernehmendem Rechtsträger und der KH Foliotec GmbH, Sparneck (Amtsgericht Hof HRB 3098) zur Einsichtnahme eingereicht worden."
    },
    {
      "date": "2025-07-04",
      "id": "114567",
      "original_text": "Einreichung neuer Dokumente\nBayern Amtsgericht Augsburg HRB 21022\nHOSOKAWA ALPINE Aktiengesellschaft – Augsburg",
      "type": "Einreichung neuer Dokumente",
      "state": "Bayern",
      "amtsgericht": "Amtsgericht Augsburg",
      "registernummer": "HRB 21022",
      "registerart": "HRB",
      "company_name": "HOSOKAWA ALPINE Aktiengesellschaft",
      "company_seat": "Augsburg",
      "details": "04.07.2025 (Bekanntmachungsdatum)\n\nBayern Amtsgericht Augsburg HRB 21022\nEinreichung neuer Dokumente 03.07.2025 (Eintragungsdatum)\n\nHOSOKAWA ALPINE Aktiengesellschaft\nAktiengesellschaft\nAugsburg\n\nDem Amtsgericht Augsburg -Registergericht- ist eine Liste der Mitglieder des Aufsichtsrats eingereicht worden, § 106 AktG."
    },
    {
      "date": "2025-07-04",
      "id": "114568",
      "original_text": "Einreichung neuer Dokumente\nBayern Amtsgericht Bayreuth HRB 4203\nSana Klinik Pegnitz GmbH – Pegnitz",
      "type": "Einreichung neuer Dokumente",
      "state": "Bayern",
      "amtsgericht": "Amtsgericht Bayreuth",
      "registernummer": "HRB 4203",
      "registerart": "HRB",
      "company_name": "Sana Klinik Pegnitz GmbH",
      "company_seat": "Pegnitz",
      "details": "04.07.2025 (Bekanntmachungsdatum)\n\nBayern Amtsgericht Bayreuth HRB 4203\nEinreichung neuer Dokumente\n\nSana Klinik Pegnitz GmbH\nGesellschaft mit beschränkter Haftung\nPegnitz\n\nDem Amtsgericht Bayreuth -Registergericht- ist eine Liste der Mitglieder des Aufsichtsrats eingereicht worden, § 52 Abs. 3 S. 2 GmbHG."
    },
    {
      "date": "2025-07-04",
      "id": "114569",
      "original_text": "Registerbekanntmachung nach dem Umwandlungsgesetz\nBayern Amtsgericht München HRB 123493\nFraundorfer & Ritter Steuerberatungsgesellschaft mbH – München",
      "type": "Registerbekanntmachung nach dem Umwandlungsgesetz",
      "state": "Bayern",
      "amtsgericht": "Amtsgericht München",
      "registernummer": "HRB 123493",
      "registerart": "HRB",
      "company_name": "Fraundorfer & Ritter Steuerberatungsgesellschaft mbH",
      "company_seat": "München",
      "details": "04.07.2025 (Bekanntmachungsdatum)\n\nBayern Amtsgericht München HRB 123493\nRegisterbekanntmachung nach dem Umwandlungsgesetz 03.07.2025 (Eintragungsdatum)\n\nFraundorfer & Ritter Steuerberatungsgesellschaft mbH\nGesellschaft mit beschränkter Haftung\nMünchen\n\nDen Gläubigern der an der Verschmelzung beteiligten Rechtsträger ist, wenn sie binnen sechs Monaten nach dem Tag, an dem die Eintragung der Verschmelzung in das Register des Sitzes desjenigen Rechtsträgers, dessen Gläubiger sie sind, nach § 19 Abs. 3 UmwG als bekannt gemacht gilt, ihren Anspruch nach Grund und Höhe in Textform anmelden, Sicherheit zu leisten, soweit sie nicht Befriedigung verlangen können. Dieses Recht steht den Gläubigern jedoch nur zu, wenn sie glaubhaft machen, dass durch die Verschmelzung die Erfüllung ihrer Forderung gefährdet wird."
    },
    {
      "date": "2025-07-04",
      "id": "114570",
      "original_text": "Registerbekanntmachung nach dem Umwandlungsgesetz\nBayern Amtsgericht Ingolstadt HRB 10695\nCropz Ingolstadt GmbH – Ingolstadt",
      "type": "Registerbekanntmachung nach dem Umwandlungsgesetz",
      "state": "Bayern",
      "amtsgericht": "Amtsgericht Ingolstadt",
      "registernummer": "HRB 10695",
      "registerart": "HRB",
      "company_name": "Cropz Ingolstadt GmbH",
      "company_seat": "Ingolstadt",
      "details": "04.07.2025 (Bekanntmachungsdatum)\n\nBayern Amtsgericht Ingolstadt HRB 10695\nRegisterbekanntmachung nach dem Umwandlungsgesetz 03.07.2025 (Eintragungsdatum)\n\nCropz Ingolstadt GmbH\nGesellschaft mit beschränkter Haftung\nIngolstadt\n\nDen Gläubigern der an der Verschmelzung beteiligten Rechtsträger ist, wenn sie binnen sechs Monaten nach dem Tag, an dem die Eintragung der Verschmelzung in das Register des Sitzes desjenigen Rechtsträgers, dessen Gläubiger sie sind, nach § 19 Abs. 3 UmwG als bekannt gemacht gilt, ihren Anspruch nach Grund und Höhe in Textform anmelden, Sicherheit zu leisten, soweit sie nicht Befriedigung verlangen können. Dieses Recht steht den Gläubigern jedoch nur zu, wenn sie glaubhaft machen, dass durch die Verschmelzung die Erfüllung ihrer Forderung gefährdet wird."
    },
    {
      "date": "2025-07-04",
      "id": "114571",
      "original_text": "Registerbekanntmachung nach dem Umwandlungsgesetz\nBayern Amtsgericht München HRB 259536\nSozialkonzept Schulze-Kathrinhof GmbH Betriebsgesellschaft sozialer Einrichtungen – München",
      "type": "Registerbekanntmachung nach dem Umwandlungsgesetz",
      "state": "Bayern",
      "amtsgericht": "Amtsgericht München",
      "registernummer": "HRB 259536",
      "registerart": "HRB",
      "company_name": "Sozialkonzept Schulze-Kathrinhof GmbH Betriebsgesellschaft sozialer Einrichtungen",
      "company_seat": "München",
      "details": "04.07.2025 (Bekanntmachungsdatum)\n\nBayern Amtsgericht München HRB 259536\nRegisterbekanntmachung nach dem Umwandlungsgesetz 03.07.2025 (Eintragungsdatum)\n\nSozialkonzept Schulze-Kathrinhof GmbH Betriebsgesellschaft sozialer Einrichtungen\nGesellschaft mit beschränkter Haftung\nMünchen\n\nDen Gläubigern der an der Verschmelzung beteiligten Rechtsträger ist, wenn sie binnen sechs Monaten nach dem Tag, an dem die Eintragung der Verschmelzung in das Register des Sitzes desjenigen Rechtsträgers, dessen Gläubiger sie sind, nach § 19 Abs. 3 UmwG als bekannt gemacht gilt, ihren Anspruch nach Grund und Höhe in Textform anmelden, Sicherheit zu leisten, soweit sie nicht Befriedigung verlangen können. Dieses Recht steht den Gläubigern jedoch nur zu, wenn sie glaubhaft machen, dass durch die Verschmelzung die Erfüllung ihrer Forderung gefährdet wird."
    },
    {
      "date": "2025-07-04",
      "id": "114572",
      "original_text": "Registerbekanntmachung nach dem Umwandlungsgesetz\nBayern Amtsgericht München HRB 257652\nEnergreen Capital Management GmbH – Unterhaching",
      "type": "Registerbekanntmachung nach dem Umwandlungsgesetz",
      "state": "Bayern",
      "amtsgericht": "Amtsgericht München",
      "registernummer": "HRB 257652",
      "registerart": "HRB",
      "company_name": "Energreen Capital Management GmbH",
      "company_seat": "Unterhaching",
      "details": "04.07.2025 (Bekanntmachungsdatum)\n\nBayern Amtsgericht München HRB 257652\nRegisterbekanntmachung nach dem Umwandlungsgesetz 03.07.2025 (Eintragungsdatum)\n\nEnergreen Capital Management GmbH\nGesellschaft mit beschränkter Haftung\nUnterhaching\n\nDen Gläubigern der an der Verschmelzung beteiligten Rechtsträger ist, wenn sie binnen sechs Monaten nach dem Tag, an dem die Eintragung der Verschmelzung in das Register des Sitzes desjenigen Rechtsträgers, dessen Gläubiger sie sind, nach § 19 Abs. 3 UmwG als bekannt gemacht gilt, ihren Anspruch nach Grund und Höhe in Textform anmelden, Sicherheit zu leisten, soweit sie nicht Befriedigung verlangen können. Dieses Recht steht den Gläubigern jedoch nur zu, wenn sie glaubhaft machen, dass durch die Verschmelzung die Erfüllung ihrer Forderung gefährdet wird."
    },
    {
      "date": "2025-07-04",
      "id": "114573",
      "original_text": "Registerbekanntmachung nach dem Umwandlungsgesetz\nBayern Amtsgericht Fürth HRB 20638\nCuP Versicherungsmakler GmbH – Fürth",
      "type": "Registerbekanntmachung nach dem Umwandlungsgesetz",
      "state": "Bayern",
      "amtsgericht": "Amtsgericht Fürth",
      "registernummer": "HRB 20638",
      "registerart": "HRB",
      "company_name": "CuP Versicherungsmakler GmbH",
      "company_seat": "Fürth",
      "details": "04.07.2025 (Bekanntmachungsdatum)\n\nBayern Amtsgericht Fürth HRB 20638\nRegisterbekanntmachung nach dem Umwandlungsgesetz 03.07.2025 (Eintragungsdatum)\n\nCuP Versicherungsmakler GmbH\nGesellschaft mit beschränkter Haftung\nFürth\n\nDen Gläubigern der an der Verschmelzung beteiligten Rechtsträger ist, wenn sie binnen sechs Monaten nach dem Tag, an dem die Eintragung der Verschmelzung in das Register des Sitzes desjenigen Rechtsträgers, dessen Gläubiger sie sind, nach § 19 Abs. 3 UmwG als bekannt gemacht gilt, ihren Anspruch nach Grund und Höhe in Textform anmelden, Sicherheit zu leisten, soweit sie nicht Befriedigung verlangen können. Dieses Recht steht den Gläubigern jedoch nur zu, wenn sie glaubhaft machen, dass durch die Verschmelzung die Erfüllung ihrer Forderung gefährdet wird."
    },
    {
      "date": "2025-07-04",
      "id": "114574",
      "original_text": "Einreichung neuer Dokumente\nBayern Amtsgericht München HRB 250347\nMutares SE & Co. KGaA – München",
      "type": "Einreichung neuer Dokumente",
      "state": "Bayern",
      "amtsgericht": "Amtsgericht München",
      "registernummer": "HRB 250347",
      "registerart": "HRB",
      "company_name": "Mutares SE & Co. KGaA",
      "company_seat": "München",
      "details": "04.07.2025 (Bekanntmachungsdatum)\n\nBayern Amtsgericht München HRB 250347\nEinreichung neuer Dokumente\n\nMutares SE & Co. KGaA\nKommanditgesellschaft auf Aktien\nMünchen\n\nDem Amtsgericht München -Registergericht- isteine Liste der Mitglieder des Aufsichtsrats eingereicht worden, §§ 278 Abs. 3, 106 AktG."
    },
    {
      "date": "2025-07-04",
      "id": "114575",
      "original_text": "Löschungsankündigung\nBayern Amtsgericht Ansbach HRB 7196\nACACIA Bau und Handels GmbH – Dinkelsbühl",
      "type": "Löschungsankündigung",
      "state": "Bayern",
      "amtsgericht": "Amtsgericht Ansbach",
      "registernummer": "HRB 7196",
      "registerart": "HRB",
      "company_name": "ACACIA Bau und Handels GmbH",
      "company_seat": "Dinkelsbühl",
      "details": "04.07.2025 (Bekanntmachungsdatum)\n\nBayern Amtsgericht Ansbach HRB 7196\nLöschungsankündigung\n\nACACIA Bau und Handels GmbH\nGesellschaft mit beschränkter Haftung\nDinkelsbühl\n\nDas Registergericht beabsichtigt, die im Handelsregister eingetragene Gesellschaft wegen Vermögenslosigkeit von Amts wegen nach § 394 FamFG zu löschen. Die Frist zur Erhebung eines Widerspruchs ist auf sechs Wochen festgesetzt."
    },
    {
      "date": "2025-07-04",
      "id": "114576",
      "original_text": "Registerbekanntmachung nach dem Umwandlungsgesetz\nBayern Amtsgericht München HRB 203437\nVidic Handels & Service GmbH – München",
      "type": "Registerbekanntmachung nach dem Umwandlungsgesetz",
      "state": "Bayern",
      "amtsgericht": "Amtsgericht München",
      "registernummer": "HRB 203437",
      "registerart": "HRB",
      "company_name": "Vidic Handels & Service GmbH",
      "company_seat": "München",
      "details": "04.07.2025 (Bekanntmachungsdatum)\n\nBayern Amtsgericht München HRB 203437\nRegisterbekanntmachung nach dem Umwandlungsgesetz 03.07.2025 (Eintragungsdatum)\n\nVidic Handels & Service GmbH\nGesellschaft mit beschränkter Haftung\nMünchen\n\nDen Gläubigern der an der Verschmelzung beteiligten Rechtsträger ist, wenn sie binnen sechs Monaten nach dem Tag, an dem die Eintragung der Verschmelzung in das Register des Sitzes desjenigen Rechtsträgers, dessen Gläubiger sie sind, nach § 19 Abs. 3 UmwG als bekannt gemacht gilt, ihren Anspruch nach Grund und Höhe in Textform anmelden, Sicherheit zu leisten, soweit sie nicht Befriedigung verlangen können. Dieses Recht steht den Gläubigern jedoch nur zu, wenn sie glaubhaft machen, dass durch die Verschmelzung die Erfüllung ihrer Forderung gefährdet wird."
    },
    {
      "date": "2025-07-04",
      "id": "114577",
      "original_text": "Registerbekanntmachung nach dem Umwandlungsgesetz\nBayern Amtsgericht München HRB 259569\nSozialkonzept Dorotheenhof GmbH Betriebgesellschaft sozialer Einrichtungen – München",
      "type": "Registerbekanntmachung nach dem Umwandlungsgesetz",
      "state": "Bayern",
      "amtsgericht": "Amtsgericht München",
      "registernummer": "HRB 259569",
      "registerart": "HRB",
      "company_name": "Sozialkonzept Dorotheenhof GmbH Betriebgesellschaft sozialer Einrichtungen",
      "company_seat": "München",
      "details": "04.07.2025 (Bekanntmachungsdatum)\n\nBayern Amtsgericht München HRB 259569\nRegisterbekanntmachung nach dem Umwandlungsgesetz 03.07.2025 (Eintragungsdatum)\n\nSozialkonzept Dorotheenhof GmbH Betriebgesellschaft sozialer Einrichtungen\nGesellschaft mit beschränkter Haftung\nMünchen\n\nDen Gläubigern der an der Verschmelzung beteiligten Rechtsträger ist, wenn sie binnen sechs Monaten nach dem Tag, an dem die Eintragung der Verschmelzung in das Register des Sitzes desjenigen Rechtsträgers, dessen Gläubiger sie sind, nach § 19 Abs. 3 UmwG als bekannt gemacht gilt, ihren Anspruch nach Grund und Höhe in Textform anmelden, Sicherheit zu leisten, soweit sie nicht Befriedigung verlangen können. Dieses Recht steht den Gläubigern jedoch nur zu, wenn sie glaubhaft machen, dass durch die Verschmelzung die Erfüllung ihrer Forderung gefährdet wird."
    },
    {
      "date": "2025-07-04",
      "id": "114578",
      "original_text": "Einreichung neuer Dokumente\nBayern Amtsgericht Ingolstadt HRB 101008\nBAUER Spezialtiefbau GmbH – Schrobenhausen",
      "type": "Einreichung neuer Dokumente",
      "state": "Bayern",
      "amtsgericht": "Amtsgericht Ingolstadt",
      "registernummer": "HRB 101008",
      "registerart": "HRB",
      "company_name": "BAUER Spezialtiefbau GmbH",
      "company_seat": "Schrobenhausen",
      "details": "04.07.2025 (Bekanntmachungsdatum)\n\nBayern Amtsgericht Ingolstadt HRB 101008\nEinreichung neuer Dokumente\n\nBAUER Spezialtiefbau GmbH\nGesellschaft mit beschränkter Haftung\nSchrobenhausen\n\nDem Amtsgericht Ingolstadt -Registergericht- ist eine Liste der Mitglieder des Aufsichtsrats eingereicht worden, § 52 Abs. 3 S. 2 GmbHG."
    },
    {
      "date": "2025-07-04",
      "id": "114579",
      "original_text": "Registerbekanntmachung nach dem Umwandlungsgesetz\nBayern Amtsgericht Nürnberg HRB 25345\nnetfabb GmbH – Parsberg",
      "type": "Registerbekanntmachung nach dem Umwandlungsgesetz",
      "state": "Bayern",
      "amtsgericht": "Amtsgericht Nürnberg",
      "registernummer": "HRB 25345",
      "registerart": "HRB",
      "company_name": "netfabb GmbH",
      "company_seat": "Parsberg",
      "details": "04.07.2025 (Bekanntmachungsdatum)\n\nBayern Amtsgericht Nürnberg HRB 25345\nRegisterbekanntmachung nach dem Umwandlungsgesetz 03.07.2025 (Eintragungsdatum)\n\nnetfabb GmbH\nGesellschaft mit beschränkter Haftung\nParsberg\n\nDen Gläubigern der an der Verschmelzung beteiligten Rechtsträger ist, wenn sie binnen sechs Monaten nach dem Tag, an dem die Eintragung der Verschmelzung in das Register des Sitzes desjenigen Rechtsträgers, dessen Gläubiger sie sind, nach § 19 Abs. 3 UmwG als bekannt gemacht gilt, ihren Anspruch nach Grund und Höhe in Textform anmelden, Sicherheit zu leisten, soweit sie nicht Befriedigung verlangen können. Dieses Recht steht den Gläubigern jedoch nur zu, wenn sie glaubhaft machen, dass durch die Verschmelzung die Erfüllung ihrer Forderung gefährdet wird."
    },
    {
      "date": "2025-07-04",
      "id": "114580",
      "original_text": "Registerbekanntmachung nach dem Umwandlungsgesetz\nBayern Amtsgericht München HRB 217583\nSPIE Industry Service GmbH – München",
      "type": "Registerbekanntmachung nach dem Umwandlungsgesetz",
      "state": "Bayern",
      "amtsgericht": "Amtsgericht München",
      "registernummer": "HRB 217583",
      "registerart": "HRB",
      "company_name": "SPIE Industry Service GmbH",
      "company_seat": "München",
      "details": "04.07.2025 (Bekanntmachungsdatum)\n\nBayern Amtsgericht München HRB 217583\nRegisterbekanntmachung nach dem Umwandlungsgesetz 03.07.2025 (Eintragungsdatum)\n\nSPIE Industry Service GmbH\nGesellschaft mit beschränkter Haftung\nMünchen\n\nDen Gläubigern der an der Verschmelzung beteiligten Rechtsträger ist, wenn sie binnen sechs Monaten nach dem Tag, an dem die Eintragung der Verschmelzung in das Register des Sitzes desjenigen Rechtsträgers, dessen Gläubiger sie sind, nach § 19 Abs. 3 UmwG als bekannt gemacht gilt, ihren Anspruch nach Grund und Höhe in Textform anmelden, Sicherheit zu leisten, soweit sie nicht Befriedigung verlangen können. Dieses Recht steht den Gläubigern jedoch nur zu, wenn sie glaubhaft machen, dass durch die Verschmelzung die Erfüllung ihrer Forderung gefährdet wird."
    },
    {
      "date": "2025-07-04",
      "id": "114581",
      "original_text": "Löschungsankündigung\nBayern Amtsgericht München HRB 161748\nHaus Sendlinger-Tor Verwaltungs GmbH – München",
      "type": "Löschungsankündigung",
      "state": "Bayern",
      "amtsgericht": "Amtsgericht München",
      "registernummer": "HRB 161748",
      "registerart": "HRB",
      "company_name": "Haus Sendlinger-Tor Verwaltungs GmbH",
      "company_seat": "München",
      "details": "04.07.2025 (Bekanntmachungsdatum)\n\nBayern Amtsgericht München HRB 161748\nLöschungsankündigung 03.07.2025 (Eintragungsdatum)\n\nHaus Sendlinger-Tor Verwaltungs GmbH\nGesellschaft mit beschränkter Haftung\nMünchen\n\nDas Registergericht beabsichtigt, die im Handelsregister eingetragene Gesellschaft wegen Vermögenslosigkeit von Amts wegen nach § 394 FamFG zu löschen. Die Frist zur Erhebung eines Widerspruchs ist auf drei Monate festgesetzt."
    },
    {
      "date": "2025-07-04",
      "id": "114582",
      "original_text": "Registerbekanntmachung nach dem Umwandlungsgesetz\nBayern Amtsgericht München HRB 296167\nWittenzellner GmbH – Glonn",
      "type": "Registerbekanntmachung nach dem Umwandlungsgesetz",
      "state": "Bayern",
      "amtsgericht": "Amtsgericht München",
      "registernummer": "HRB 296167",
      "registerart": "HRB",
      "company_name": "Wittenzellner GmbH",
      "company_seat": "Glonn",
      "details": "04.07.2025 (Bekanntmachungsdatum)\n\nBayern Amtsgericht München HRB 296167\nRegisterbekanntmachung nach dem Umwandlungsgesetz 03.07.2025 (Eintragungsdatum)\n\nWittenzellner GmbH\nGesellschaft mit beschränkter Haftung\nGlonn\n\nDen Gläubigern der an der Spaltung beteiligten Rechtsträger ist, wenn sie binnen sechs Monaten nach dem Tag, an dem die Eintragung der Spaltung in das Register des Sitzes desjenigen Rechtsträgers, dessen Gläubiger sie sind, nach §§ 125, 19 Abs. 3 UmwG als bekannt gemacht gilt, ihren Anspruch nach Grund und Höhe in Textform anmelden, Sicherheit zu leisten, soweit sie nicht Befriedigung verlangen können. Dieses Recht steht den Gläubigern jedoch nur zu, wenn sie glaubhaft machen, dass durch die Spaltung die Erfüllung ihrer Forderung gefährdet wird."
    },
    {
      "date": "2025-07-04",
      "id": "114583",
      "original_text": "Löschungsankündigung\nBayern Amtsgericht Würzburg HRB 16309\nT.A.D. Hub UG (haftungsbeschränkt) – Estenfeld",
      "type": "Löschungsankündigung",
      "state": "Bayern",
      "amtsgericht": "Amtsgericht Würzburg",
      "registernummer": "HRB 16309",
      "registerart": "HRB",
      "company_name": "T.A.D. Hub UG (haftungsbeschränkt)",
      "company_seat": "Estenfeld",
      "details": "04.07.2025 (Bekanntmachungsdatum)\n\nBayern Amtsgericht Würzburg HRB 16309\nLöschungsankündigung\n\nT.A.D. Hub UG (haftungsbeschränkt)\nGesellschaft mit beschränkter Haftung\nEstenfeld\n\nDas Registergericht beabsichtigt, die im Handelsregister eingetragene Gesellschaft wegen Vermögenslosigkeit von Amts wegen nach § 394 FamFG zu löschen. Die Frist zur Erhebung eines Widerspruchs ist auf drei Monate festgesetzt."
    },
    {
      "date": "2025-07-04",
      "id": "114584",
      "original_text": "Registerbekanntmachung nach dem Umwandlungsgesetz\nBaden-Württemberg Amtsgericht Stuttgart HRB 721790\ncrossbase mediasolution GmbH – Böblingen",
      "type": "Registerbekanntmachung nach dem Umwandlungsgesetz",
      "state": "Baden-Württemberg",
      "amtsgericht": "Amtsgericht Stuttgart",
      "registernummer": "HRB 721790",
      "registerart": "HRB",
      "company_name": "crossbase mediasolution GmbH",
      "company_seat": "Böblingen",
      "details": "04.07.2025 (Bekanntmachungsdatum)\n\nBaden-Württemberg Amtsgericht Stuttgart HRB 721790\nRegisterbekanntmachung nach dem Umwandlungsgesetz 04.07.2025 (Eintragungsdatum)\n\ncrossbase mediasolution GmbH\nGesellschaft mit beschränkter Haftung\nBöblingen\n\nAls nicht eingetragen wird bekanntgemacht:\nDen Gläubigern der an der Verschmelzung beteiligten Rechtsträger ist, wenn sie binnen sechs Monaten nach dem Tag, an dem die Eintragung der Verschmelzung in das Register des Sitzes desjenigen Rechtsträgers, dessen Gläubiger sie sind, nach § 19 Abs. 3 UmwG als bekanntgemacht gilt, ihren Anspruch nach Grund und Höhe schriftlich anmelden, Sicherheit zu leisten, soweit sie nicht Befriedigung verlangen können. Dieses Recht steht den Gläubigern jedoch nur zu, wenn sie glaubhaft machen, dass durch die Verschmelzung die Erfüllung ihrer Forderung gefährdet wird."
    },
    {
      "date": "2025-07-04",
      "id": "114585",
      "original_text": "Registerbekanntmachung nach dem Umwandlungsgesetz\nBaden-Württemberg Amtsgericht Stuttgart HRB 768434\nGlatthaar Management GmbH – Schramberg",
      "type": "Registerbekanntmachung nach dem Umwandlungsgesetz",
      "state": "Baden-Württemberg",
      "amtsgericht": "Amtsgericht Stuttgart",
      "registernummer": "HRB 768434",
      "registerart": "HRB",
      "company_name": "Glatthaar Management GmbH",
      "company_seat": "Schramberg",
      "details": "04.07.2025 (Bekanntmachungsdatum)\n\nBaden-Württemberg Amtsgericht Stuttgart HRB 768434\nRegisterbekanntmachung nach dem Umwandlungsgesetz 04.07.2025 (Eintragungsdatum)\n\nGlatthaar Management GmbH\nGesellschaft mit beschränkter Haftung\nSchramberg\n\nAls nicht eingetragen wird bekanntgemacht:\nDen Gläubigern der an der Verschmelzung beteiligten Rechtsträger ist, wenn sie binnen sechs Monaten nach dem Tag, an dem die Eintragung der Verschmelzung in das Register des Sitzes desjenigen Rechtsträgers, dessen Gläubiger sie sind, nach § 19 Abs. 3 UmwG als bekanntgemacht gilt, ihren Anspruch nach Grund und Höhe schriftlich anmelden, Sicherheit zu leisten, soweit sie nicht Befriedigung verlangen können. Dieses Recht steht den Gläubigern jedoch nur zu, wenn sie glaubhaft machen, dass durch die Verschmelzung die Erfüllung ihrer Forderung gefährdet wird."
    },
    {
      "date": "2025-07-04",
      "id": "114586",
      "original_text": "Löschungsankündigung\nBerlin Amtsgericht Berlin (Charlottenburg) HRB 182613\nVLM Health GmbH – Berlin",
      "type": "Löschungsankündigung",
      "state": "Berlin",
      "amtsgericht": "Amtsgericht Berlin (Charlottenburg)",
      "registernummer": "HRB 182613",
      "registerart": "HRB",
      "company_name": "VLM Health GmbH",
      "company_seat": "Berlin",
      "details": "04.07.2025 (Bekanntmachungsdatum)\n\nBerlin Amtsgericht Berlin (Charlottenburg) HRB 182613\nLöschungsankündigung\n\nVLM Health GmbH\nGesellschaft mit beschränkter Haftung\nBerlin\n\nBei der nachstehenden Gesellschaft wird das Amtslöschungsverfahren gemäß § 394 FamFG eingeleitet. Widerspruchsfrist 6 Wochen"
    },
    {
      "date": "2025-07-04",
      "id": "114587",
      "original_text": "Registerbekanntmachung nach dem Umwandlungsgesetz\nBrandenburg Amtsgericht Potsdam HRB 7458\nRecyclingpark Brandenburg an der Havel GmbH – Brandenburg an der Havel",
      "type": "Registerbekanntmachung nach dem Umwandlungsgesetz",
      "state": "Brandenburg",
      "amtsgericht": "Amtsgericht Potsdam",
      "registernummer": "HRB 7458",
      "registerart": "HRB",
      "company_name": "Recyclingpark Brandenburg an der Havel GmbH",
      "company_seat": "Brandenburg an der Havel",
      "details": "04.07.2025 (Bekanntmachungsdatum)\n\nBrandenburg Amtsgericht Potsdam HRB 7458\nRegisterbekanntmachung nach dem Umwandlungsgesetz 02.07.2025 (Eintragungsdatum)\n\nRecyclingpark Brandenburg an der Havel GmbH\nGesellschaft mit beschränkter Haftung\nBrandenburg an der Havel\n\nZu Eintragungsnummer 18 vom 02.07.2025 wird als nicht eingetragen veröffentlicht: Den Gläubigern der an der Verschmelzung beteiligten Rechtsträger ist, wenn sie binnen sechs Monaten nach dem Tag, an dem die Eintragung der Verschmelzung in das Register des Sitzes desjenigen Rechtsträgers, dessen Gläubiger sie sind, als bekannt gemacht gilt, ihren Anspruch nach Grund und Höhe schriftlich anmelden, Sicherheit zu leisten, soweit sie nicht Befriedigung verlangen können. Dieses Recht steht den Gläubigern jedoch nur zu, wenn sie glaubhaft machen, dass durch die Verschmelzung die Erfüllung ihrer Forderung gefährdet wird."
    },
    {
      "date": "2025-07-04",
      "id": "114588",
      "original_text": "Registerbekanntmachung nach dem Umwandlungsgesetz\nBrandenburg Amtsgericht Potsdam HRA 8598\nGW Holding GmbH & Co. KG – Brück",
      "type": "Registerbekanntmachung nach dem Umwandlungsgesetz",
      "state": "Brandenburg",
      "amtsgericht": "Amtsgericht Potsdam",
      "registernummer": "HRA 8598",
      "registerart": "HRA",
      "company_name": "GW Holding GmbH & Co. KG",
      "company_seat": "Brück",
      "details": "04.07.2025 (Bekanntmachungsdatum)\n\nBrandenburg Amtsgericht Potsdam HRA 8598\nRegisterbekanntmachung nach dem Umwandlungsgesetz 03.07.2025 (Eintragungsdatum)\n\nGW Holding GmbH & Co. KG\nKommanditgesellschaft\nBrück\n\nZu Eintragungsnummer 2 vom 03.07.2025 wird als nicht eingetragen veröffentlicht: Den Gläubigern der an der Umwandlung beteiligten Rechtsträger ist, wenn sie binnen sechs Monaten nach dem Tag, an dem die Eintragung der Umwandlung in das Register des Sitzes desjenigen Rechtsträgers, dessen Gläubiger sie sind, als bekannt gemacht gilt, ihren Anspruch nach Grund und Höhe schriftlich anmelden, Sicherheit zu leisten, soweit sie nicht Befriedigung verlangen können. Dieses Recht steht den Gläubigern jedoch nur zu, wenn sie glaubhaft machen, dass durch die Umwandlung die Erfüllung ihrer Forderung gefährdet wird."
    },
    {
      "date": "2025-07-04",
      "id": "114589",
      "original_text": "Sonstige Registerbekanntmachung\nBerlin Amtsgericht Berlin (Charlottenburg) HRB 34165\nDeutsche Kreditbank Aktiengesellschaft – Berlin",
      "type": "Sonstige Registerbekanntmachung",
      "state": "Berlin",
      "amtsgericht": "Amtsgericht Berlin (Charlottenburg)",
      "registernummer": "HRB 34165",
      "registerart": "HRB",
      "company_name": "Deutsche Kreditbank Aktiengesellschaft",
      "company_seat": "Berlin",
      "details": "04.07.2025 (Bekanntmachungsdatum)\n\nBerlin Amtsgericht Berlin (Charlottenburg) HRB 34165\nSonstige Registerbekanntmachung\n\nDeutsche Kreditbank Aktiengesellschaft\nAktiengesellschaft\nBerlin\n\nAls nicht eingetragen wird veröffentlicht:Es wurde eine neue Liste der Aufsichtsratsmitglieder eingereicht (§ 106 AktG)."
    },
    {
      "date": "2025-07-04",
      "id": "114590",
      "original_text": "Registerbekanntmachung nach dem Umwandlungsgesetz\nBrandenburg Amtsgericht Potsdam HRB 1267\nMärkische Entsorgungsgesellschaft Brandenburg mbH – Brandenburg an der Havel",
      "type": "Registerbekanntmachung nach dem Umwandlungsgesetz",
      "state": "Brandenburg",
      "amtsgericht": "Amtsgericht Potsdam",
      "registernummer": "HRB 1267",
      "registerart": "HRB",
      "company_name": "Märkische Entsorgungsgesellschaft Brandenburg mbH",
      "company_seat": "Brandenburg an der Havel",
      "details": "04.07.2025 (Bekanntmachungsdatum)\n\nBrandenburg Amtsgericht Potsdam HRB 1267\nRegisterbekanntmachung nach dem Umwandlungsgesetz 02.07.2025 (Eintragungsdatum)\n\nMärkische Entsorgungsgesellschaft Brandenburg mbH\nGesellschaft mit beschränkter Haftung\nBrandenburg an der Havel\n\nZu Eintragungsnummer 17 vom 02.07.2025 wird als nicht eingetragen veröffentlicht: Den Gläubigern der an der Verschmelzung beteiligten Rechtsträger ist, wenn sie binnen sechs Monaten nach dem Tag, an dem die Eintragung der Verschmelzung in das Register des Sitzes desjenigen Rechtsträgers, dessen Gläubiger sie sind, als bekannt gemacht gilt, ihren Anspruch nach Grund und Höhe schriftlich anmelden, Sicherheit zu leisten, soweit sie nicht Befriedigung verlangen können. Dieses Recht steht den Gläubigern jedoch nur zu, wenn sie glaubhaft machen, dass durch die Verschmelzung die Erfüllung ihrer Forderung gefährdet wird."
    },
    {
      "date": "2025-07-04",
      "id": "114591",
      "original_text": "Löschungsankündigung\nBerlin Amtsgericht Berlin (Charlottenburg) HRB 233181\nLast Will UG (haftungsbeschränkt) – Berlin",
      "type": "Löschungsankündigung",
      "state": "Berlin",
      "amtsgericht": "Amtsgericht Berlin (Charlottenburg)",
      "registernummer": "HRB 233181",
      "registerart": "HRB",
      "company_name": "Last Will UG (haftungsbeschränkt)",
      "company_seat": "Berlin",
      "details": "04.07.2025 (Bekanntmachungsdatum)\n\nBerlin Amtsgericht Berlin (Charlottenburg) HRB 233181\nLöschungsankündigung\n\nLast Will UG (haftungsbeschränkt)\nGesellschaft mit beschränkter Haftung\nBerlin\n\nBei der nachstehenden Gesellschaft wird das Amtslöschungsverfahren gemäß § 394 FamFG eingeleitet. Widerspruchsfrist 6 Wochen"
    },
    {
      "date": "2025-07-04",
      "id": "114592",
      "original_text": "Registerbekanntmachung nach dem Umwandlungsgesetz\nMecklenburg-Vorpommern Amtsgericht Neubrandenburg HRB 2866\nZ.A.S. Zentral Archiv Service GmbH – Neubrandenburg",
      "type": "Registerbekanntmachung nach dem Umwandlungsgesetz",
      "state": "Mecklenburg-Vorpommern",
      "amtsgericht": "Amtsgericht Neubrandenburg",
      "registernummer": "HRB 2866",
      "registerart": "HRB",
      "company_name": "Z.A.S. Zentral Archiv Service GmbH",
      "company_seat": "Neubrandenburg",
      "details": "04.07.2025 (Bekanntmachungsdatum)\n\nMecklenburg-Vorpommern Amtsgericht Neubrandenburg HRB 2866\nRegisterbekanntmachung nach dem Umwandlungsgesetz 04.07.2025 (Eintragungsdatum)\n\nZ.A.S. Zentral Archiv Service GmbH\nGesellschaft mit beschränkter Haftung\nNeubrandenburg\n\nAls nicht eingetragen wird veröffentlicht: Den Gläubigern der an der Verschmelzung beteiligten Rechtsträger ist, wenn sie binnen sechs Monaten nach dem Tag, an dem die Eintragung der Verschmelzung in das Register des Sitzes desjenigen Rechtsträgers, dessen Gläubiger sie sind, nach § 19 Abs. 3 UmwG als bekannt gemacht gilt,\nihren Anspruch nach Grund und Höhe in Textform anmelden, Sicherheit zu leisten, soweit sie nicht Befriedigung verlangen können. Dieses Recht steht den Gläubigern jedoch nur zu, wenn sie glaubhaft machen, dass durch die Verschmelzung die Erfüllung der Forderung gefährdet wird."
    },
    {
      "date": "2025-07-04",
      "id": "114593",
      "original_text": "Sonstige Registerbekanntmachung\nBaden-Württemberg Amtsgericht Stuttgart HRB 206827\nTrans-Logo-Tech (TLT) GmbH – Markgröningen",
      "type": "Sonstige Registerbekanntmachung",
      "state": "Baden-Württemberg",
      "amtsgericht": "Amtsgericht Stuttgart",
      "registernummer": "HRB 206827",
      "registerart": "HRB",
      "company_name": "Trans-Logo-Tech (TLT) GmbH",
      "company_seat": "Markgröningen",
      "details": "04.07.2025 (Bekanntmachungsdatum)\n\nBaden-Württemberg Amtsgericht Stuttgart HRB 206827\nSonstige Registerbekanntmachung 04.07.2025 (Eintragungsdatum)\n\nTrans-Logo-Tech (TLT) GmbH\nGesellschaft mit beschränkter Haftung\nMarkgröningen\n\nDen Gläubigern der Gesellschaft, deren Forderungen begründet worden sind, bevor die Eintragung der Beendigung des Vertrages in das Handelsregister nach § 10 HGB als bekanntgemacht gilt, ist vom anderen Vertragsteil Sicherheit zu leisten, wenn sie sich binnen sechs Monaten nach der Bekanntmachung zu diesem Zweck bei ihm melden."
    },
    {
      "date": "2025-07-04",
      "id": "114594",
      "original_text": "Sonstige Registerbekanntmachung\nBaden-Württemberg Amtsgericht Ulm HRB 722559\nSchwäbische Hüttenwerke Automotive GmbH – Aalen",
      "type": "Sonstige Registerbekanntmachung",
      "state": "Baden-Württemberg",
      "amtsgericht": "Amtsgericht Ulm",
      "registernummer": "HRB 722559",
      "registerart": "HRB",
      "company_name": "Schwäbische Hüttenwerke Automotive GmbH",
      "company_seat": "Aalen",
      "details": "04.07.2025 (Bekanntmachungsdatum)\n\nBaden-Württemberg Amtsgericht Ulm HRB 722559\nSonstige Registerbekanntmachung\n\nSchwäbische Hüttenwerke Automotive GmbH\nGesellschaft mit beschränkter Haftung\nAalen\n\nDie Gesellschaft hat am 03.07.2025 die Liste über die Zusammensetzung des Aufsichtsrats zum Handelsregister eingereicht."
    },
    {
      "date": "2025-07-04",
      "id": "114595",
      "original_text": "Einreichung neuer Dokumente\nHamburg Amtsgericht Hamburg HRB 43371\nEDEKABANK Aktiengesellschaft – Hamburg",
      "type": "Einreichung neuer Dokumente",
      "state": "Hamburg",
      "amtsgericht": "Amtsgericht Hamburg",
      "registernummer": "HRB 43371",
      "registerart": "HRB",
      "company_name": "EDEKABANK Aktiengesellschaft",
      "company_seat": "Hamburg",
      "details": "04.07.2025 (Bekanntmachungsdatum)\n\nHamburg Amtsgericht Hamburg HRB 43371\nEinreichung neuer Dokumente\n\nEDEKABANK Aktiengesellschaft\nAktiengesellschaft\nHamburg\n\nAls nicht eingetragen wird bekannt gemacht: Liste des Aufsichtsrats wurde eingereicht."
    },
    {
      "date": "2025-07-04",
      "id": "114596",
      "original_text": "Löschungsankündigung\nBerlin Amtsgericht Berlin (Charlottenburg) HRB 249326\nOpl Kfz Werkstatt GmbH – Berlin",
      "type": "Löschungsankündigung",
      "state": "Berlin",
      "amtsgericht": "Amtsgericht Berlin (Charlottenburg)",
      "registernummer": "HRB 249326",
      "registerart": "HRB",
      "company_name": "Opl Kfz Werkstatt GmbH",
      "company_seat": "Berlin",
      "details": "04.07.2025 (Bekanntmachungsdatum)\n\nBerlin Amtsgericht Berlin (Charlottenburg) HRB 249326\nLöschungsankündigung\n\nOpl Kfz Werkstatt GmbH\nGesellschaft mit beschränkter Haftung\nBerlin\n\nBei der nachstehenden Gesellschaft wird das Amtslöschungsverfahren gemäß § 394 FamFG eingeleitet. Widerspruchsfrist\n6 Wochen."
    },
    {
      "date": "2025-07-04",
      "id": "114597",
      "original_text": "Einreichung neuer Dokumente\nBerlin Amtsgericht Berlin (Charlottenburg) HRB 116594\nFoucault-Hemmersteen AG – Berlin",
      "type": "Einreichung neuer Dokumente",
      "state": "Berlin",
      "amtsgericht": "Amtsgericht Berlin (Charlottenburg)",
      "registernummer": "HRB 116594",
      "registerart": "HRB",
      "company_name": "Foucault-Hemmersteen AG",
      "company_seat": "Berlin",
      "details": "04.07.2025 (Bekanntmachungsdatum)\n\nBerlin Amtsgericht Berlin (Charlottenburg) HRB 116594\nEinreichung neuer Dokumente\n\nFoucault-Hemmersteen AG\nAktiengesellschaft\nBerlin\n\nAls nicht eingetragen wird veröffentlicht: Es wurde eine neue Liste der Aufsichtsratsmitglieder eingereicht (§ 106 AktG)."
    },
    {
      "date": "2025-07-04",
      "id": "114598",
      "original_text": "Löschungsankündigung\nBerlin Amtsgericht Berlin (Charlottenburg) HRB 204570\nCIFH GRUPPE UG (haftungsbeschränkt) – Berlin",
      "type": "Löschungsankündigung",
      "state": "Berlin",
      "amtsgericht": "Amtsgericht Berlin (Charlottenburg)",
      "registernummer": "HRB 204570",
      "registerart": "HRB",
      "company_name": "CIFH GRUPPE UG (haftungsbeschränkt)",
      "company_seat": "Berlin",
      "details": "04.07.2025 (Bekanntmachungsdatum)\n\nBerlin Amtsgericht Berlin (Charlottenburg) HRB 204570\nLöschungsankündigung\n\nCIFH GRUPPE UG (haftungsbeschränkt)\nGesellschaft mit beschränkter Haftung\nBerlin\n\nBei der nachstehenden Gesellschaft wird das Amtslöschungsverfahren gemäß § 394 FamFG eingeleitet. Widerspruchsfrist 6 Wochen"
    },
    {
      "date": "2025-07-04",
      "id": "114599",
      "original_text": "Löschungsankündigung\nBerlin Amtsgericht Berlin (Charlottenburg) HRB 200663\nGLOBUS PROTECT GmbH – Berlin",
      "type": "Löschungsankündigung",
      "state": "Berlin",
      "amtsgericht": "Amtsgericht Berlin (Charlottenburg)",
      "registernummer": "HRB 200663",
      "registerart": "HRB",
      "company_name": "GLOBUS PROTECT GmbH",
      "company_seat": "Berlin",
      "details": "04.07.2025 (Bekanntmachungsdatum)\n\nBerlin Amtsgericht Berlin (Charlottenburg) HRB 200663\nLöschungsankündigung\n\nGLOBUS PROTECT GmbH\nGesellschaft mit beschränkter Haftung\nBerlin\n\nBei der nachstehenden Gesellschaft wird das Amtslöschungsverfahren gemäß § 394 FamFG eingeleitet. Widerspruchsfrist 6 Wochen"
    },
    {
      "date": "2025-07-04",
      "id": "114600",
      "original_text": "Registerbekanntmachung nach dem Umwandlungsgesetz\nBaden-Württemberg Amtsgericht Stuttgart HRB 738032\nInfoniqa Deutschland GmbH – Böblingen",
      "type": "Registerbekanntmachung nach dem Umwandlungsgesetz",
      "state": "Baden-Württemberg",
      "amtsgericht": "Amtsgericht Stuttgart",
      "registernummer": "HRB 738032",
      "registerart": "HRB",
      "company_name": "Infoniqa Deutschland GmbH",
      "company_seat": "Böblingen",
      "details": "04.07.2025 (Bekanntmachungsdatum)\n\nBaden-Württemberg Amtsgericht Stuttgart HRB 738032\nRegisterbekanntmachung nach dem Umwandlungsgesetz\n\nInfoniqa Deutschland GmbH\nGesellschaft mit beschränkter Haftung\nBöblingen\n\nGrenzüberschreitende Verschmelzung der WP GG Holdings VI B.V., Amsterdam,\nNiederlande, auf die Infoniqa Group Holding GmbH, Böblingen,\nDeutschland\n- Bekanntmachung gemäß § 308 Abs. 1 Satz 2, 3 UmwG, § 10 HGB -\nDas Leitungsorgan der WP GG Holdings VI B.V. mit satzungsmäßigem Sitz in Amsterdam,\nNiederlande, eingetragen im Handelsregister der niederländischen Handelskammer\n(Kamer van Koophandel) unter Registernummer 77468309, mit\neingetragener Geschäftsanschrift in Eduard van Beinumstraat 8 Unit 6, 1077CZ\nAmsterdam, Niederlande, und die Geschäftsführung der Infoniqa Group Holding\nGmbH mit Sitz in Böblingen, Deutschland, eingetragen im Handelsregister des\nAmtsgerichts Stuttgart unter HRB 799536, mit Geschäftsadresse in Wolfgang\nBrumme-Allee 3, 71034 Böblingen, Deutschland, beabsichtigen, die WP GG Holdings\nVI B.V. als übertragende Gesellschaft auf die Infoniqa Group Holding GmbH\nals übernehmende Gesellschaft im Wege der Verschmelzung durch Aufnahme\ngrenzüberschreitend zu verschmelzen.\nEs werden daher gemäß § 308 Abs. 1 Satz 2, 3 Umwandlungsgesetz (UmwG) in\nVerbindung mit § 10 Handelsgesetzbuch (HGB) die folgenden Angaben bekanntgemacht:\n1. Der gemeinsame Verschmelzungsplan betreffend die grenzüberschreitende\nVerschmelzung der WP GG Holdings VI B.V. (übertragende Gesellschaft)\nauf die Infoniqa Group Holding GmbH (übernehmende\nGesellschaft) ist im Entwurf gemäß § 308 Abs. 1 Satz 1 UmwG beim\nHandelsregister eingereicht worden (§ 308 Abs. 1 Satz 2 Nr. 1\nUmwG).\n2. Rechtsform, Firma und Sitz der an der grenzüberschreitenden Verschmelzung\nbeteiligten Gesellschaften (§ 308 Abs. 1 Satz 2 Nr. 2\nUmwG)\n(a) WP GG Holdings VI B.V.\nRechtsform: besloten vennootschap niederländischen Rechts\nFirma: WP GG Holdings VI B.V.\nSitz: Eduard van Beinumstraat 8 Unit 6, 1077CZ Amsterdam, Niederlande\n(b) Infoniqa Group Holding GmbH\nRechtsform: Gesellschaft mit beschränkter Haftung\nFirma: Infoniqa Group Holding GmbH\n2 | 2\nSitz: Wolfgang Brumme-Allee 3, 71034 Böblingen, Deutschland\n3. Register, bei denen die an der grenzüberschreitenden Verschmelzung\nbeteiligten Gesellschaften eingetragen sind, sowie die jeweilige Registernummer\n(§ 308 Abs. 1 Satz 2 Nr. 3 UmwG)\n(a) WP GG Holdings VI B.V.\nHandelsregister der niederländischen Handelskammer (Kamer van Koophandel)\nunter Registernummer 77468309\n(b) Infoniqa Group Holding GmbH\nHandelsregister des Amtsgerichts Stuttgart unter HRB 799536\n4. Hinweis an folgende Personen, dass sie der jeweiligen Gesellschaft\nspätestens fünf Arbeitstage vor dem Tag der Gesellschafterversammlung\nder übernehmenden Gesellschaft Bemerkungen zum Verschmelzungsplan\nübermitteln können:\na) an die Anteilsinhaber und Gläubiger der an der grenzüberschreitenden\nVerschmelzung beteiligten Gesellschaften sowie\nb) an die zuständigen Betriebsräte der an der grenzüberschreitenden\nVerschmelzung beteiligten Gesellschaften oder, soweit es\nkeinen Betriebsrat gibt, an die Arbeitnehmer der an der grenzüberschreitenden\nVerschmelzung beteiligten Gesellschaften\n(§ 308 Abs. 1 Satz 2 Nr. 4 UmwG).\nDie Gesellschafterversammlung der Infoniqa Group Holding GmbH, in der über\ndie Zustimmung zum gemeinsamen Verschmelzungsplan Beschluss gefasst\nwerden soll, soll voraussichtlich in der Woche vom 18. August 2025 stattfinden.\nAnteilsinhaber, Gläubiger sowie die zuständigen Betriebsräte und, soweit einschlägig,\ndie Arbeitnehmer der Infoniqa Group Holding GmbH und der WP GG\nHoldings VI B.V. können der jeweiligen Gesellschaft spätestens fünf Arbeitstage\nvor dem Tag der Gesellschafterversammlung der übernehmenden Gesellschaft,\nin der über die Zustimmung zum gemeinsamen Verschmelzungsplan\nBeschluss gefasst werden soll, Bemerkungen zum Entwurf des gemeinsamen\nVerschmelzungsplans übermitteln.\nBöblingen, den 1. Juli 2025\nInfoniqa Group Holding GmbH\nDie Geschäftsführung"
    },
    {
      "date": "2025-07-04",
      "id": "114601",
      "original_text": "Registerbekanntmachung nach dem Umwandlungsgesetz\nBerlin Amtsgericht Berlin (Charlottenburg) HRB 98642\nQuintoo marketingpool GmbH – Berlin",
      "type": "Registerbekanntmachung nach dem Umwandlungsgesetz",
      "state": "Berlin",
      "amtsgericht": "Amtsgericht Berlin (Charlottenburg)",
      "registernummer": "HRB 98642",
      "registerart": "HRB",
      "company_name": "Quintoo marketingpool GmbH",
      "company_seat": "Berlin",
      "details": "04.07.2025 (Bekanntmachungsdatum)\n\nBerlin Amtsgericht Berlin (Charlottenburg) HRB 98642\nRegisterbekanntmachung nach dem Umwandlungsgesetz 03.07.2025 (Eintragungsdatum)\n\nQuintoo marketingpool GmbH\nGesellschaft mit beschränkter Haftung\nBerlin\n\nZu Eintragungsnummer 11 vom 03.07.2025 wird als nicht eingetragen veröffentlicht: Den Gläubigern der an der Verschmelzung beteiligten Rechtsträger ist, wenn sie binnen sechs Monaten nach dem Tag, an dem die Eintragung der Verschmelzung in das Register des Sitzes desjenigen Rechtsträgers, dessen Gläubiger sie sind, als bekannt gemacht gilt, ihren Anspruch nach Grund und Höhe schriftlich anmelden, Sicherheit zu leisten, soweit sie nicht Befriedigung verlangen können. Dieses Recht steht den Gläubigern jedoch nur zu, wenn sie glaubhaft machen, dass durch die Verschmelzung die Erfüllung ihrer Forderung gefährdet wird. Das Recht, Sicherheitsleistung zu verlangen, steht Gläubigern nicht zu, die im Falle der Insolvenz ein Recht auf vorzugsweise Befriedigung aus einer Deckungsmasse haben, die nach gesetzlicher Vorschrift zu ihrem Schutz errichtet und staatlich überwacht ist."
    },
    {
      "date": "2025-07-04",
      "id": "114602",
      "original_text": "Sonstige Registerbekanntmachung\nBerlin Amtsgericht Berlin (Charlottenburg) HRB 263771\nNordost-Security & Rail GmbH – Berlin",
      "type": "Sonstige Registerbekanntmachung",
      "state": "Berlin",
      "amtsgericht": "Amtsgericht Berlin (Charlottenburg)",
      "registernummer": "HRB 263771",
      "registerart": "HRB",
      "company_name": "Nordost-Security & Rail GmbH",
      "company_seat": "Berlin",
      "details": "04.07.2025 (Bekanntmachungsdatum)\n\nBerlin Amtsgericht Berlin (Charlottenburg) HRB 263771\nSonstige Registerbekanntmachung\n\nNordost-Security & Rail GmbH\nGesellschaft mit beschränkter Haftung\nBerlin\n\nAls nicht eingetragen wird veröffentlicht:\n\nEs ist beabsichtigt, die Nichtigkeit der Gesellschaft gemäß § 397 FamFG einzutragen, da der Unternehmensgegenstand wegen fehlender Erlaubnis für die Ausübung des Gewerbes nur noch rein fiktiv und nichtig ist. Widerspruchsfrist: 6 Wochen."
    },
    {
      "date": "2025-07-04",
      "id": "114603",
      "original_text": "Registerbekanntmachung nach dem Umwandlungsgesetz\nBerlin Amtsgericht Berlin (Charlottenburg) HRB 101618\nINTEGRATE marketingpool GmbH – Berlin",
      "type": "Registerbekanntmachung nach dem Umwandlungsgesetz",
      "state": "Berlin",
      "amtsgericht": "Amtsgericht Berlin (Charlottenburg)",
      "registernummer": "HRB 101618",
      "registerart": "HRB",
      "company_name": "INTEGRATE marketingpool GmbH",
      "company_seat": "Berlin",
      "details": "04.07.2025 (Bekanntmachungsdatum)\n\nBerlin Amtsgericht Berlin (Charlottenburg) HRB 101618\nRegisterbekanntmachung nach dem Umwandlungsgesetz 03.07.2025 (Eintragungsdatum)\n\nINTEGRATE marketingpool GmbH\nGesellschaft mit beschränkter Haftung\nBerlin\n\nZu Eintragungsnummer 6 vom 03.07.2025 wird als nicht eingetragen veröffentlicht: Den Gläubigern der an der Verschmelzung beteiligten Rechtsträger ist, wenn sie binnen sechs Monaten nach dem Tag, an dem die Eintragung der Verschmelzung in das Register des Sitzes desjenigen Rechtsträgers, dessen Gläubiger sie sind, als bekannt gemacht gilt, ihren Anspruch nach Grund und Höhe schriftlich anmelden, Sicherheit zu leisten, soweit sie nicht Befriedigung verlangen können. Dieses Recht steht den Gläubigern jedoch nur zu, wenn sie glaubhaft machen, dass durch die Verschmelzung die Erfüllung ihrer Forderung gefährdet wird. Das Recht, Sicherheitsleistung zu verlangen, steht Gläubigern nicht zu, die im Falle der Insolvenz ein Recht auf vorzugsweise Befriedigung aus einer Deckungsmasse haben, die nach gesetzlicher Vorschrift zu ihrem Schutz errichtet und staatlich überwacht ist."
    },
    {
      "date": "2025-07-04",
      "id": "114604",
      "original_text": "Registerbekanntmachung nach dem Umwandlungsgesetz\nNordrhein-Westfalen Amtsgericht Coesfeld HRB 1488\nStadtwerke Coesfeld Gesellschaft mit beschränkter Haftung – Coesfeld",
      "type": "Registerbekanntmachung nach dem Umwandlungsgesetz",
      "state": "Nordrhein-Westfalen",
      "amtsgericht": "Amtsgericht Coesfeld",
      "registernummer": "HRB 1488",
      "registerart": "HRB",
      "company_name": "Stadtwerke Coesfeld Gesellschaft mit beschränkter Haftung",
      "company_seat": "Coesfeld",
      "details": "04.07.2025 (Bekanntmachungsdatum)\n\nNordrhein-Westfalen Amtsgericht Coesfeld HRB 1488\nRegisterbekanntmachung nach dem Umwandlungsgesetz 04.07.2025 (Eintragungsdatum)\n\nStadtwerke Coesfeld Gesellschaft mit beschränkter Haftung\nGesellschaft mit beschränkter Haftung\nCoesfeld\n\nDen Gläubigern der an der Verschmelzung beteiligten Rechtsträger ist, wenn sie binnen sechs Monaten nach dem Tag, an dem die Eintragung der Verschmelzung in das Register des Sitzes derjenigen Rechtsträger deren Gläubiger sie sind, nach § 19 Absatz 3 UmwG als bekanntgemacht gilt, ihren Anspruch nach Grund und Höhe schriftlich anmelden, Sicherheit zu leisten, soweit sie nicht Befriedigung verlangen können. Dieses Recht steht den Gläubigern jedoch nur zu, wenn sie glaubhaft machen, dass durch die Verschmelzung die Erfüllung ihrer Forderung gefährdet wird."
    },
    {
      "date": "2025-07-04",
      "id": "114605",
      "original_text": "Sonstige Registerbekanntmachung\nSachsen-Anhalt Amtsgericht Stendal GnR 1012\nVolksbank eG – Köthen",
      "type": "Sonstige Registerbekanntmachung",
      "state": "Sachsen-Anhalt",
      "amtsgericht": "Amtsgericht Stendal",
      "registernummer": "GnR 1012",
      "registerart": "GnR",
      "company_name": "Volksbank eG",
      "company_seat": "Köthen",
      "details": "04.07.2025 (Bekanntmachungsdatum)\n\nSachsen-Anhalt Amtsgericht Stendal GnR 1012\nSonstige Registerbekanntmachung 04.07.2025 (Eintragungsdatum)\n\nVolksbank eG\neingetragene Genossenschaft\nKöthen\n\nDie Nachschusspflicht ist aufgehoben.\nAls nicht eingetragen wird veröffentlicht:\n\nDen Gläubigern der Genossenschaft ist, wenn sie sich binnen 6 Monaten nach der Bekanntmachung bei der Genossenschaft zu diesem Zweck melden, Sicherheit zu leisten, soweit sie nicht Befriedigung verlangen können (§ 22 Abs. 1 bis 3 GenG)."
    },
    {
      "date": "2025-07-04",
      "id": "114606",
      "original_text": "Sonstige Registerbekanntmachung\nHamburg Amtsgericht Hamburg HRB 115442\nDNV SE – Hamburg",
      "type": "Sonstige Registerbekanntmachung",
      "state": "Hamburg",
      "amtsgericht": "Amtsgericht Hamburg",
      "registernummer": "HRB 115442",
      "registerart": "HRB",
      "company_name": "DNV SE",
      "company_seat": "Hamburg",
      "details": "04.07.2025 (Bekanntmachungsdatum)\n\nHamburg Amtsgericht Hamburg HRB 115442\nSonstige Registerbekanntmachung\n\nDNV SE\nEuropäische Aktiengesellschaft (SE)\nHamburg\n\nAls nicht eingetragen wird bekannt gemacht: Liste des Aufsichtsrats wurde eingereicht."
    },
    {
      "date": "2025-07-04",
      "id": "114607",
      "original_text": "Sonstige Registerbekanntmachung\nBerlin Amtsgericht Berlin (Charlottenburg) HRB 107867\nINNOVARTEC AG – Berlin",
      "type": "Sonstige Registerbekanntmachung",
      "state": "Berlin",
      "amtsgericht": "Amtsgericht Berlin (Charlottenburg)",
      "registernummer": "HRB 107867",
      "registerart": "HRB",
      "company_name": "INNOVARTEC AG",
      "company_seat": "Berlin",
      "details": "04.07.2025 (Bekanntmachungsdatum)\n\nBerlin Amtsgericht Berlin (Charlottenburg) HRB 107867\nSonstige Registerbekanntmachung\n\nINNOVARTEC AG\nAktiengesellschaft\nBerlin\n\nAls nicht eingetragen wird veröffentlicht: Es wurde eine neue Liste der Aufsichtsratsmitglieder eingereicht (§ 106 AktG)."
    },
    {
      "date": "2025-07-04",
      "id": "114608",
      "original_text": "Registerbekanntmachung nach dem Umwandlungsgesetz\nBaden-Württemberg Amtsgericht Stuttgart HRB 765547\nSchlössle GmbH – Vaihingen an der Enz",
      "type": "Registerbekanntmachung nach dem Umwandlungsgesetz",
      "state": "Baden-Württemberg",
      "amtsgericht": "Amtsgericht Stuttgart",
      "registernummer": "HRB 765547",
      "registerart": "HRB",
      "company_name": "Schlössle GmbH",
      "company_seat": "Vaihingen an der Enz",
      "details": "04.07.2025 (Bekanntmachungsdatum)\n\nBaden-Württemberg Amtsgericht Stuttgart HRB 765547\nRegisterbekanntmachung nach dem Umwandlungsgesetz 04.07.2025 (Eintragungsdatum)\n\nSchlössle GmbH\nGesellschaft mit beschränkter Haftung\nVaihingen an der Enz\n\nAls nicht eingetragen wird bekanntgemacht: Den Gläubigern der an der Verschmelzung beteiligten Rechtsträger ist, wenn sie binnen sechs Monaten nach dem Tag, an dem die Eintragung der Verschmelzung in das Register des Sitzes desjenigen Rechtsträgers, dessen Gläubiger sie sind, nach § 19 Abs. 3 UmwG als bekanntgemacht gilt, ihren Anspruch nach Grund und Höhe schriftlich anmelden, Sicherheit zu leisten, soweit sie nicht Befriedigung verlangen können. Dieses Recht steht den Gläubigern jedoch nur zu, wenn sie glaubhaft machen, dass durch die Verschmelzung die Erfüllung ihrer Forderung gefährdet wird."
    },
    {
      "date": "2025-07-04",
      "id": "114609",
      "original_text": "Sonstige Registerbekanntmachung\nBaden-Württemberg Amtsgericht Stuttgart HRB 310786\nITronic GmbH Mess-, Prüf- und Automatisierungstechnik – Erdmannhausen",
      "type": "Sonstige Registerbekanntmachung",
      "state": "Baden-Württemberg",
      "amtsgericht": "Amtsgericht Stuttgart",
      "registernummer": "HRB 310786",
      "registerart": "HRB",
      "company_name": "ITronic GmbH Mess-, Prüf- und Automatisierungstechnik",
      "company_seat": "Erdmannhausen",
      "details": "04.07.2025 (Bekanntmachungsdatum)\n\nBaden-Württemberg Amtsgericht Stuttgart HRB 310786\nSonstige Registerbekanntmachung 04.07.2025 (Eintragungsdatum)\n\nITronic GmbH Mess-, Prüf- und Automatisierungstechnik\nGesellschaft mit beschränkter Haftung\nErdmannhausen\n\nAls nicht eingetragen wird bekanntgemacht:\nDen Gläubigern der Gesellschaft, deren Forderungen begründet worden sind, bevor die Eintragung der Beendigung des Vertrages in das Handelsregister nach § 10 HGB als bekanntgemacht gilt, ist vom anderen Vertragsteil Sicherheit zu leisten, wenn sie sich binnen sechs Monaten nach der Bekanntmachung zu diesem Zweck bei ihm melden."
    },
    {
      "date": "2025-07-04",
      "id": "114610",
      "original_text": "Löschungsankündigung\nBaden-Württemberg Amtsgericht Mannheim HRB 732196\nCar.renta GmbH – Mannheim",
      "type": "Löschungsankündigung",
      "state": "Baden-Württemberg",
      "amtsgericht": "Amtsgericht Mannheim",
      "registernummer": "HRB 732196",
      "registerart": "HRB",
      "company_name": "Car.renta GmbH",
      "company_seat": "Mannheim",
      "details": "04.07.2025 (Bekanntmachungsdatum)\n\nBaden-Württemberg Amtsgericht Mannheim HRB 732196\nLöschungsankündigung\n\nCar.renta GmbH\nGesellschaft mit beschränkter Haftung\nMannheim\n\nDas Registergericht beabsichtigt, die am 19.12.2018 vorgenommene Eintragung des Geschäftsführers Monili, Alessandro, *26.01.1981 gemäß § 395 FamFG von Amts wegen im Handelsregister zu löschen."
    },
    {
      "date": "2025-07-04",
      "id": "114611",
      "original_text": "Einreichung neuer Dokumente\nHamburg Amtsgericht Hamburg HRB 188101\nOtto GmbH & Co. KGaA – Hamburg",
      "type": "Einreichung neuer Dokumente",
      "state": "Hamburg",
      "amtsgericht": "Amtsgericht Hamburg",
      "registernummer": "HRB 188101",
      "registerart": "HRB",
      "company_name": "Otto GmbH & Co. KGaA",
      "company_seat": "Hamburg",
      "details": "04.07.2025 (Bekanntmachungsdatum)\n\nHamburg Amtsgericht Hamburg HRB 188101\nEinreichung neuer Dokumente 04.07.2025 (Eintragungsdatum)\n\nOtto GmbH & Co. KGaA\nKommanditgesellschaft auf Aktien\nHamburg\n\nAls nicht eingetragen wird bekannt gemacht: Liste des Aufsichtsrats wurde eingereicht."
    },
    {
      "date": "2025-07-04",
      "id": "114612",
      "original_text": "Registerbekanntmachung nach dem Umwandlungsgesetz\nBaden-Württemberg Amtsgericht Freiburg HRA 700729\nHeinz Müller GmbH & Co. KG – Tuningen",
      "type": "Registerbekanntmachung nach dem Umwandlungsgesetz",
      "state": "Baden-Württemberg",
      "amtsgericht": "Amtsgericht Freiburg",
      "registernummer": "HRA 700729",
      "registerart": "HRA",
      "company_name": "Heinz Müller GmbH & Co. KG",
      "company_seat": "Tuningen",
      "details": "04.07.2025 (Bekanntmachungsdatum)\n\nBaden-Württemberg Amtsgericht Freiburg HRA 700729\nRegisterbekanntmachung nach dem Umwandlungsgesetz 04.07.2025 (Eintragungsdatum)\n\nHeinz Müller GmbH & Co. KG\nKommanditgesellschaft\nTuningen\n\nAls nicht eingetragen wird bekanntgemacht:\nDen Gläubigern der an der Verschmelzung beteiligten Rechtsträger ist, wenn sie binnen sechs Monaten nach dem Tag, an dem die Eintragung der Verschmelzung in das Register des Sitzes desjenigen Rechtsträgers, dessen Gläubiger sie sind, nach § 19 Abs. 3 UmwG als bekanntgemacht gilt, ihren Anspruch nach Grund und Höhe schriftlich anmelden, Sicherheit zu leisten, soweit sie nicht Befriedigung verlangen können. Dieses Recht steht den Gläubigern jedoch nur zu, wenn sie glaubhaft machen, dass durch die Verschmelzung die Erfüllung ihrer Forderung gefährdet wird."
    },
    {
      "date": "2025-07-04",
      "id": "114613",
      "original_text": "Registerbekanntmachung nach dem Umwandlungsgesetz\nBerlin Amtsgericht Berlin (Charlottenburg) HRB 151005\nTP lnfinity Germany GmbH – Berlin",
      "type": "Registerbekanntmachung nach dem Umwandlungsgesetz",
      "state": "Berlin",
      "amtsgericht": "Amtsgericht Berlin (Charlottenburg)",
      "registernummer": "HRB 151005",
      "registerart": "HRB",
      "company_name": "TP lnfinity Germany GmbH",
      "company_seat": "Berlin",
      "details": "04.07.2025 (Bekanntmachungsdatum)\n\nBerlin Amtsgericht Berlin (Charlottenburg) HRB 151005\nRegisterbekanntmachung nach dem Umwandlungsgesetz 03.07.2025 (Eintragungsdatum)\n\nTP lnfinity Germany GmbH\nGesellschaft mit beschränkter Haftung\nBerlin\n\nZu Eintragungsnummer 18 vom 03.07.2025 wird als nicht eingetragen veröffentlicht: Den Gläubigern der an der Verschmelzung beteiligten Rechtsträger ist, wenn sie binnen sechs Monaten nach dem Tag, an dem die Eintragung der Verschmelzung in das Register des Sitzes desjenigen Rechtsträgers, dessen Gläubiger sie sind, als bekannt gemacht gilt, ihren Anspruch nach Grund und Höhe schriftlich anmelden, Sicherheit zu leisten, soweit sie nicht Befriedigung verlangen können. Dieses Recht steht den Gläubigern jedoch nur zu, wenn sie glaubhaft machen, dass durch die Verschmelzung die Erfüllung ihrer Forderung gefährdet wird. Das Recht, Sicherheitsleistung zu verlangen, steht Gläubigern nicht zu, die im Falle der Insolvenz ein Recht auf vorzugsweise Befriedigung aus einer Deckungsmasse haben, die nach gesetzlicher Vorschrift zu ihrem Schutz errichtet und staatlich überwacht ist."
    },
    {
      "date": "2025-07-04",
      "id": "114614",
      "original_text": "Registerbekanntmachung nach dem Umwandlungsgesetz\nBaden-Württemberg Amtsgericht Stuttgart HRB 460842\nKlaiber-Verwaltungs-GmbH – Spaichingen",
      "type": "Registerbekanntmachung nach dem Umwandlungsgesetz",
      "state": "Baden-Württemberg",
      "amtsgericht": "Amtsgericht Stuttgart",
      "registernummer": "HRB 460842",
      "registerart": "HRB",
      "company_name": "Klaiber-Verwaltungs-GmbH",
      "company_seat": "Spaichingen",
      "details": "04.07.2025 (Bekanntmachungsdatum)\n\nBaden-Württemberg Amtsgericht Stuttgart HRB 460842\nRegisterbekanntmachung nach dem Umwandlungsgesetz 04.07.2025 (Eintragungsdatum)\n\nKlaiber-Verwaltungs-GmbH\nGesellschaft mit beschränkter Haftung\nSpaichingen\n\nAls nicht eingetragen wird bekanntgemacht: Den Gläubigern der an der Verschmelzung beteiligten Rechtsträger ist, wenn sie binnen sechs Monaten nach dem Tag, an dem die Eintragung der Verschmelzung in das Register des Sitzes desjenigen Rechtsträgers, dessen Gläubiger sie sind, nach § 19 Abs. 3 UmwG als bekanntgemacht gilt, ihren Anspruch nach Grund und Höhe schriftlich anmelden, Sicherheit zu leisten, soweit sie nicht Befriedigung verlangen können. Dieses Recht steht den Gläubigern jedoch nur zu, wenn sie glaubhaft machen, dass durch die Verschmelzung die Erfüllung ihrer Forderung gefährdet wird."
    },
    {
      "date": "2025-07-04",
      "id": "114615",
      "original_text": "Registerbekanntmachung nach dem Umwandlungsgesetz\nHamburg Amtsgericht Hamburg HRB 117865\nt8y.com gmbh – Hamburg",
      "type": "Registerbekanntmachung nach dem Umwandlungsgesetz",
      "state": "Hamburg",
      "amtsgericht": "Amtsgericht Hamburg",
      "registernummer": "HRB 117865",
      "registerart": "HRB",
      "company_name": "t8y.com gmbh",
      "company_seat": "Hamburg",
      "details": "04.07.2025 (Bekanntmachungsdatum)\n\nHamburg Amtsgericht Hamburg HRB 117865\nRegisterbekanntmachung nach dem Umwandlungsgesetz 04.07.2025 (Eintragungsdatum)\n\nt8y.com gmbh\nGesellschaft mit beschränkter Haftung\nHamburg\n\nAls nicht eingetragen wird bekannt gemacht:\nDen Gläubigern der an der Verschmelzung beteiligten Gesellschaften ist, wenn sie binnen sechs Monaten nach dem Tag, an dem die Eintragung der Verschmelzung in das Register des Sitzes desjenigen Rechtsträgers, dessen Gläubiger sie sind, nach § 19 Absatz 3 UmwG als bekannt gemacht gilt, ihren Anspruch nach Grund und Höhe schriftlich anmelden, Sicherheit zu leisten, soweit sie nicht Befriedigung verlangen können. Dieses Recht steht den Gläubigern jedoch nur zu, wenn sie glaubhaft machen, dass durch die Verschmelzung die Erfüllung ihrer Forderung gefährdet wird."
    },
    {
      "date": "2025-07-04",
      "id": "114616",
      "original_text": "Sonstige Registerbekanntmachung\nHamburg Amtsgericht Hamburg HRB 188964\nTechstarter GmbH – Hamburg",
      "type": "Sonstige Registerbekanntmachung",
      "state": "Hamburg",
      "amtsgericht": "Amtsgericht Hamburg",
      "registernummer": "HRB 188964",
      "registerart": "HRB",
      "company_name": "Techstarter GmbH",
      "company_seat": "Hamburg",
      "details": "04.07.2025 (Bekanntmachungsdatum)\n\nHamburg Amtsgericht Hamburg HRB 188964\nSonstige Registerbekanntmachung 01.07.2025 (Eintragungsdatum)\n\nTechstarter GmbH\nGesellschaft mit beschränkter Haftung\nHamburg\n\nAls nicht eingetragen wird bekannt gemacht:  Den Gläubigern der Gesellschaft, deren Forderungen begründet worden sind, bevor die Eintragung der Vertragsbeendigung in das Handelsregister nach § 10 HGB als bekannt gemacht gilt, ist vom anderen Vertragsteil Sicherheit zu leisten, wenn sie sich binnen 6 Monaten nach Bekanntmachung der Eintragung zu diesem Zweck bei ihm melden."
    },
    {
      "date": "2025-07-04",
      "id": "114617",
      "original_text": "Registerbekanntmachung nach dem Umwandlungsgesetz\nHamburg Amtsgericht Hamburg HRB 43863\nTRACK GmbH – Hamburg",
      "type": "Registerbekanntmachung nach dem Umwandlungsgesetz",
      "state": "Hamburg",
      "amtsgericht": "Amtsgericht Hamburg",
      "registernummer": "HRB 43863",
      "registerart": "HRB",
      "company_name": "TRACK GmbH",
      "company_seat": "Hamburg",
      "details": "04.07.2025 (Bekanntmachungsdatum)\n\nHamburg Amtsgericht Hamburg HRB 43863\nRegisterbekanntmachung nach dem Umwandlungsgesetz 04.07.2025 (Eintragungsdatum)\n\nTRACK GmbH\nGesellschaft mit beschränkter Haftung\nHamburg\n\nAls nicht eingetragen wird bekannt gemacht:\nDen Gläubigern der an der Verschmelzung beteiligten Gesellschaften ist, wenn sie binnen sechs Monaten nach dem Tag, an dem die Eintragung der Verschmelzung in das Register des Sitzes desjenigen Rechtsträgers, dessen Gläubiger sie sind, nach § 19 Absatz 3 UmwG als bekannt gemacht gilt, ihren Anspruch nach Grund und Höhe schriftlich anmelden, Sicherheit zu leisten, soweit sie nicht Befriedigung verlangen können. Dieses Recht steht den Gläubigern jedoch nur zu, wenn sie glaubhaft machen, dass durch die Verschmelzung die Erfüllung ihrer Forderung gefährdet wird."
    },
    {
      "date": "2025-07-04",
      "id": "114618",
      "original_text": "Löschungsankündigung\nBerlin Amtsgericht Berlin (Charlottenburg) HRB 91197\nFHZ Fliesenhaus Zehlendorf GmbH – Berlin",
      "type": "Löschungsankündigung",
      "state": "Berlin",
      "amtsgericht": "Amtsgericht Berlin (Charlottenburg)",
      "registernummer": "HRB 91197",
      "registerart": "HRB",
      "company_name": "FHZ Fliesenhaus Zehlendorf GmbH",
      "company_seat": "Berlin",
      "details": "04.07.2025 (Bekanntmachungsdatum)\n\nBerlin Amtsgericht Berlin (Charlottenburg) HRB 91197\nLöschungsankündigung\n\nFHZ Fliesenhaus Zehlendorf GmbH\nGesellschaft mit beschränkter Haftung\nBerlin\n\nBei der nachstehenden Gesellschaft wird das Amtslöschungsverfahren gemäß § 394 FamFG eingeleitet. Widerspruchsfrist: 6 Wochen."
    },
    {
      "date": "2025-07-04",
      "id": "114619",
      "original_text": "Registerbekanntmachung nach dem Umwandlungsgesetz\nBaden-Württemberg Amtsgericht Stuttgart HRB 798342\nMax Walz Energie GmbH – Vaihingen an der Enz",
      "type": "Registerbekanntmachung nach dem Umwandlungsgesetz",
      "state": "Baden-Württemberg",
      "amtsgericht": "Amtsgericht Stuttgart",
      "registernummer": "HRB 798342",
      "registerart": "HRB",
      "company_name": "Max Walz Energie GmbH",
      "company_seat": "Vaihingen an der Enz",
      "details": "04.07.2025 (Bekanntmachungsdatum)\n\nBaden-Württemberg Amtsgericht Stuttgart HRB 798342\nRegisterbekanntmachung nach dem Umwandlungsgesetz 04.07.2025 (Eintragungsdatum)\n\nMax Walz Energie GmbH\nGesellschaft mit beschränkter Haftung\nVaihingen an der Enz\n\nAls nicht eingetragen wird bekanntgemacht: Den Gläubigern der an der Ausgliederung beteiligten Rechtsträger ist, wenn sie binnen sechs Monaten nach dem Tag, an dem die Eintragung der Ausgliederung in das Register des Sitzes desjenigen Rechtsträgers, dessen Gläubiger sie sind, nach § 19 Abs. 3 UmwG als bekanntgemacht gilt, ihren Anspruch nach Grund und Höhe schriftlich anmelden, Sicherheit zu leisten, soweit sie nicht Befriedigung verlangen können. Dieses Recht steht den Gläubigern jedoch nur zu, wenn sie glaubhaft machen, dass durch die Ausgliederung die Erfüllung ihrer Forderung gefährdet wird."
    },
    {
      "date": "2025-07-04",
      "id": "114620",
      "original_text": "Löschungsankündigung\nBrandenburg Amtsgericht Frankfurt/Oder HRB 15356\nWest Foods GmbH – Eberswalde",
      "type": "Löschungsankündigung",
      "state": "Brandenburg",
      "amtsgericht": "Amtsgericht Frankfurt/Oder",
      "registernummer": "HRB 15356",
      "registerart": "HRB",
      "company_name": "West Foods GmbH",
      "company_seat": "Eberswalde",
      "details": "04.07.2025 (Bekanntmachungsdatum)\n\nBrandenburg Amtsgericht Frankfurt/Oder HRB 15356\nLöschungsankündigung\n\nWest Foods GmbH\nGesellschaft mit beschränkter Haftung\nEberswalde\n\nBei der nachstehenden Gesellschaft wird das Amtslöschungsverfahren gemäß § 394 Abs. 1 FamFG eingeleitet."
    },
    {
      "date": "2025-07-04",
      "id": "114621",
      "original_text": "Registerbekanntmachung nach dem Umwandlungsgesetz\nBrandenburg Amtsgericht Frankfurt/Oder HRB 20447\nAntares Im- und Export GmbH – Ahrensfelde",
      "type": "Registerbekanntmachung nach dem Umwandlungsgesetz",
      "state": "Brandenburg",
      "amtsgericht": "Amtsgericht Frankfurt/Oder",
      "registernummer": "HRB 20447",
      "registerart": "HRB",
      "company_name": "Antares Im- und Export GmbH",
      "company_seat": "Ahrensfelde",
      "details": "04.07.2025 (Bekanntmachungsdatum)\n\nBrandenburg Amtsgericht Frankfurt/Oder HRB 20447\nRegisterbekanntmachung nach dem Umwandlungsgesetz 02.07.2025 (Eintragungsdatum)\n\nAntares Im- und Export GmbH\nGesellschaft mit beschränkter Haftung\nAhrensfelde\n\nZu Eintragungsnummer 3 vom 02.07.2025 wird als nicht eingetragen veröffentlicht:\nDen Gläubigern der an der Verschmelzung beteiligten Rechtsträger ist, wenn sie binnen sechs Monaten nach dem Tag, an dem die Eintragung der Verschmelzung in das Register des Sitzes desjenigen Rechtsträgers, dessen Gläubiger sie sind, als bekannt gemacht gilt, ihren Anspruch nach Grund und Höhe schriftlich anmelden, Sicherheit zu leisten, soweit sie nicht Befriedigung verlangen können. Dieses Recht steht den Gläubigern jedoch nur zu, wenn sie glaubhaft machen, dass durch die Verschmelzung die Erfüllung ihrer Forderung gefährdet wird."
    },
    {
      "date": "2025-07-04",
      "id": "114622",
      "original_text": "Registerbekanntmachung nach dem Umwandlungsgesetz\nBerlin Amtsgericht Berlin (Charlottenburg) HRB 222353\nLUNA Immobilienbesitz GmbH – Berlin",
      "type": "Registerbekanntmachung nach dem Umwandlungsgesetz",
      "state": "Berlin",
      "amtsgericht": "Amtsgericht Berlin (Charlottenburg)",
      "registernummer": "HRB 222353",
      "registerart": "HRB",
      "company_name": "LUNA Immobilienbesitz GmbH",
      "company_seat": "Berlin",
      "details": "04.07.2025 (Bekanntmachungsdatum)\n\nBerlin Amtsgericht Berlin (Charlottenburg) HRB 222353\nRegisterbekanntmachung nach dem Umwandlungsgesetz 02.07.2025 (Eintragungsdatum)\n\nLUNA Immobilienbesitz GmbH\nGesellschaft mit beschränkter Haftung\nBerlin\n\nZu Eintragungsnummer 3 vom 02.07.2025 wird als nicht eingetragen veröffentlicht: Den Gläubigern der an der Verschmelzung beteiligten Rechtsträger ist, wenn sie binnen sechs Monaten nach dem Tag, an dem die Eintragung der Verschmelzung in das Register des Sitzes desjenigen Rechtsträgers, dessen Gläubiger sie sind, als bekannt gemacht gilt, ihren Anspruch nach Grund und Höhe schriftlich anmelden, Sicherheit zu leisten, soweit sie nicht Befriedigung verlangen können. Dieses Recht steht den Gläubigern jedoch nur zu, wenn sie glaubhaft machen, dass durch die Verschmelzung die Erfüllung ihrer Forderung gefährdet wird. Das Recht, Sicherheitsleistung zu verlangen, steht Gläubigern nicht zu, die im Falle der Insolvenz ein Recht auf vorzugsweise Befriedigung aus einer Deckungsmasse haben, die nach gesetzlicher Vorschrift zu ihrem Schutz errichtet und staatlich überwacht ist."
    },
    {
      "date": "2025-07-04",
      "id": "114623",
      "original_text": "Registerbekanntmachung nach dem Umwandlungsgesetz\nBerlin Amtsgericht Berlin (Charlottenburg) HRB 224297\nBI Grundstücksgesellschaft mbH – Berlin",
      "type": "Registerbekanntmachung nach dem Umwandlungsgesetz",
      "state": "Berlin",
      "amtsgericht": "Amtsgericht Berlin (Charlottenburg)",
      "registernummer": "HRB 224297",
      "registerart": "HRB",
      "company_name": "BI Grundstücksgesellschaft mbH",
      "company_seat": "Berlin",
      "details": "04.07.2025 (Bekanntmachungsdatum)\n\nBerlin Amtsgericht Berlin (Charlottenburg) HRB 224297\nRegisterbekanntmachung nach dem Umwandlungsgesetz 02.07.2025 (Eintragungsdatum)\n\nBI Grundstücksgesellschaft mbH\nGesellschaft mit beschränkter Haftung\nBerlin\n\nZu Eintragungsnummer 4 vom 02.07.2025 wird als nicht eingetragen veröffentlicht: Den Gläubigern der an der Verschmelzung beteiligten Rechtsträger ist, wenn sie binnen sechs Monaten nach dem Tag, an dem die Eintragung der Verschmelzung in das Register des Sitzes desjenigen Rechtsträgers, dessen Gläubiger sie sind, als bekannt gemacht gilt, ihren Anspruch nach Grund und Höhe schriftlich anmelden, Sicherheit zu leisten, soweit sie nicht Befriedigung verlangen können. Dieses Recht steht den Gläubigern jedoch nur zu, wenn sie glaubhaft machen, dass durch die Verschmelzung die Erfüllung ihrer Forderung gefährdet wird. Das Recht, Sicherheitsleistung zu verlangen, steht Gläubigern nicht zu, die im Falle der Insolvenz ein Recht auf vorzugsweise Befriedigung aus einer Deckungsmasse haben, die nach gesetzlicher Vorschrift zu ihrem Schutz errichtet und staatlich überwacht ist."
    },
    {
      "date": "2025-07-04",
      "id": "114624",
      "original_text": "Einreichung neuer Dokumente\nBerlin Amtsgericht Berlin (Charlottenburg) HRB 140490\nias Aktiengesellschaft – Berlin",
      "type": "Einreichung neuer Dokumente",
      "state": "Berlin",
      "amtsgericht": "Amtsgericht Berlin (Charlottenburg)",
      "registernummer": "HRB 140490",
      "registerart": "HRB",
      "company_name": "ias Aktiengesellschaft",
      "company_seat": "Berlin",
      "details": "04.07.2025 (Bekanntmachungsdatum)\n\nBerlin Amtsgericht Berlin (Charlottenburg) HRB 140490\nEinreichung neuer Dokumente\n\nias Aktiengesellschaft\nAktiengesellschaft\nBerlin\n\nAls nicht eingetragen wird veröffentlicht: Es wurde eine neue Liste der Aufsichtsratsmitglieder eingereicht (§ 106 AktG)."
    },
    {
      "date": "2025-07-04",
      "id": "114625",
      "original_text": "Registerbekanntmachung nach dem Umwandlungsgesetz\nBerlin Amtsgericht Berlin (Charlottenburg) HRA 27414\nDr. Upmeier Tiriotstr. 101 KG – Berlin",
      "type": "Registerbekanntmachung nach dem Umwandlungsgesetz",
      "state": "Berlin",
      "amtsgericht": "Amtsgericht Berlin (Charlottenburg)",
      "registernummer": "HRA 27414",
      "registerart": "HRA",
      "company_name": "Dr. Upmeier Tiriotstr. 101 KG",
      "company_seat": "Berlin",
      "details": "04.07.2025 (Bekanntmachungsdatum)\n\nBerlin Amtsgericht Berlin (Charlottenburg) HRA 27414\nRegisterbekanntmachung nach dem Umwandlungsgesetz 01.07.2025 (Eintragungsdatum)\n\nDr. Upmeier Tiriotstr. 101 KG\nKommanditgesellschaft\nBerlin\n\nZu Eintragungsnummer 10 vom 01.07.2025 wird als nicht eingetragen veröffentlicht:Den Gläubigern der an der Verschmelzung beteiligten Rechtsträger ist, wenn sie binnen sechs Monaten nach dem Tag, an dem die Eintragung der Verschmelzung in das Register des Sitzes desjenigen Rechtsträgers, dessen Gläubiger sie sind, als bekannt gemacht gilt, ihren Anspruch nach Grund und Höhe schriftlich anmelden, Sicherheit zu leisten, soweit sie nicht Befriedigung verlangen können. Dieses Recht steht den Gläubigern jedoch nur zu, wenn sie glaubhaft machen, dass durch die Verschmelzung die Erfüllung ihrer Forderung gefährdet wird. Das Recht, Sicherheitsleistung zu verlangen, steht Gläubigern nicht zu, die im Falle der Insolvenz ein Recht auf vorzugsweise Befriedigung aus einer Deckungsmasse haben, die nach gesetzlicher Vorschrift zu ihrem Schutz errichtet und staatlich überwacht ist."
    },
    {
      "date": "2025-07-04",
      "id": "114626",
      "original_text": "Registerbekanntmachung nach dem Umwandlungsgesetz\nBerlin Amtsgericht Berlin (Charlottenburg) HRA 38795\nLanro Immobilien GmbH & Co. KG – Berlin",
      "type": "Registerbekanntmachung nach dem Umwandlungsgesetz",
      "state": "Berlin",
      "amtsgericht": "Amtsgericht Berlin (Charlottenburg)",
      "registernummer": "HRA 38795",
      "registerart": "HRA",
      "company_name": "Lanro Immobilien GmbH & Co. KG",
      "company_seat": "Berlin",
      "details": "04.07.2025 (Bekanntmachungsdatum)\n\nBerlin Amtsgericht Berlin (Charlottenburg) HRA 38795\nRegisterbekanntmachung nach dem Umwandlungsgesetz 01.07.2025 (Eintragungsdatum)\n\nLanro Immobilien GmbH & Co. KG\nKommanditgesellschaft\nBerlin\n\nZu Eintragungsnummer 9 vom 01.07.2025 wird als nicht eingetragen veröffentlicht:Den Gläubigern der an der Verschmelzung beteiligten Rechtsträger ist, wenn sie binnen sechs Monaten nach dem Tag, an dem die Eintragung der Verschmelzung in das Register des Sitzes desjenigen Rechtsträgers, dessen Gläubiger sie sind, als bekannt gemacht gilt, ihren Anspruch nach Grund und Höhe schriftlich anmelden, Sicherheit zu leisten, soweit sie nicht Befriedigung verlangen können. Dieses Recht steht den Gläubigern jedoch nur zu, wenn sie glaubhaft machen, dass durch die Verschmelzung die Erfüllung ihrer Forderung gefährdet wird. Das Recht, Sicherheitsleistung zu verlangen, steht Gläubigern nicht zu, die im Falle der Insolvenz ein Recht auf vorzugsweise Befriedigung aus einer Deckungsmasse haben, die nach gesetzlicher Vorschrift zu ihrem Schutz errichtet und staatlich überwacht ist."
    },
    {
      "date": "2025-07-04",
      "id": "114627",
      "original_text": "Sonstige Registerbekanntmachung\nHamburg Amtsgericht Hamburg HRB 164838\nASCAVO AG – Hamburg",
      "type": "Sonstige Registerbekanntmachung",
      "state": "Hamburg",
      "amtsgericht": "Amtsgericht Hamburg",
      "registernummer": "HRB 164838",
      "registerart": "HRB",
      "company_name": "ASCAVO AG",
      "company_seat": "Hamburg",
      "details": "04.07.2025 (Bekanntmachungsdatum)\n\nHamburg Amtsgericht Hamburg HRB 164838\nSonstige Registerbekanntmachung\n\nASCAVO AG\nAktiengesellschaft\nHamburg\n\nAls nicht eingetragen wird bekannt gemacht: Liste des Aufsichtsrats wurde eingereicht."
    },
    {
      "date": "2025-07-04",
      "id": "114628",
      "original_text": "Registerbekanntmachung nach dem Umwandlungsgesetz\nBerlin Amtsgericht Berlin (Charlottenburg) HRA 23717\nDr. Upmeier Wohnbau Schweizer Tal 15 - 19 KG – Berlin",
      "type": "Registerbekanntmachung nach dem Umwandlungsgesetz",
      "state": "Berlin",
      "amtsgericht": "Amtsgericht Berlin (Charlottenburg)",
      "registernummer": "HRA 23717",
      "registerart": "HRA",
      "company_name": "Dr. Upmeier Wohnbau Schweizer Tal 15 - 19 KG",
      "company_seat": "Berlin",
      "details": "04.07.2025 (Bekanntmachungsdatum)\n\nBerlin Amtsgericht Berlin (Charlottenburg) HRA 23717\nRegisterbekanntmachung nach dem Umwandlungsgesetz 01.07.2025 (Eintragungsdatum)\n\nDr. Upmeier Wohnbau Schweizer Tal 15 - 19 KG\nKommanditgesellschaft\nBerlin\n\nZu Eintragungsnummer 7 vom 01.07.2025 wird als nicht eingetragen veröffentlicht:Den Gläubigern der an der Verschmelzung beteiligten Rechtsträger ist, wenn sie binnen sechs Monaten nach dem Tag, an dem die Eintragung der Verschmelzung in das Register des Sitzes desjenigen Rechtsträgers, dessen Gläubiger sie sind, als bekannt gemacht gilt, ihren Anspruch nach Grund und Höhe schriftlich anmelden, Sicherheit zu leisten, soweit sie nicht Befriedigung verlangen können. Dieses Recht steht den Gläubigern jedoch nur zu, wenn sie glaubhaft machen, dass durch die Verschmelzung die Erfüllung ihrer Forderung gefährdet wird. Das Recht, Sicherheitsleistung zu verlangen, steht Gläubigern nicht zu, die im Falle der Insolvenz ein Recht auf vorzugsweise Befriedigung aus einer Deckungsmasse haben, die nach gesetzlicher Vorschrift zu ihrem Schutz errichtet und staatlich überwacht ist."
    },
    {
      "date": "2025-07-04",
      "id": "114629",
      "original_text": "Registerbekanntmachung nach dem Umwandlungsgesetz\nBrandenburg Amtsgericht Potsdam HRB 2665\nSTERNAUTO Potsdam GmbH – Potsdam",
      "type": "Registerbekanntmachung nach dem Umwandlungsgesetz",
      "state": "Brandenburg",
      "amtsgericht": "Amtsgericht Potsdam",
      "registernummer": "HRB 2665",
      "registerart": "HRB",
      "company_name": "STERNAUTO Potsdam GmbH",
      "company_seat": "Potsdam",
      "details": "04.07.2025 (Bekanntmachungsdatum)\n\nBrandenburg Amtsgericht Potsdam HRB 2665\nRegisterbekanntmachung nach dem Umwandlungsgesetz 01.07.2025 (Eintragungsdatum)\n\nSTERNAUTO Potsdam GmbH\nGesellschaft mit beschränkter Haftung\nPotsdam\n\nZu Eintragungsnummer 14 vom 01.07.2025 wird als nicht eingetragen veröffentlicht:\nDen Gläubigern der an der Verschmelzung beteiligten Rechtsträger ist, wenn sie binnen sechs Monaten nach dem Tag, an dem die Eintragung der Verschmelzung in das Register des Sitzes desjenigen Rechtsträgers, dessen Gläubiger sie sind, als bekannt gemacht gilt, ihren Anspruch nach Grund und Höhe schriftlich anmelden, Sicherheit zu leisten, soweit sie nicht Befriedigung verlangen können. Dieses Recht steht den Gläubigern jedoch nur zu, wenn sie glaubhaft machen, dass durch die Verschmelzung die Erfüllung ihrer Forderung gefährdet wird."
    },
    {
      "date": "2025-07-04",
      "id": "114630",
      "original_text": "Registerbekanntmachung nach dem Umwandlungsgesetz\nBerlin Amtsgericht Berlin (Charlottenburg) HRA 28256\nLange Schiffahrt Halbinsel Köpenick GmbH & Co. KG – Berlin",
      "type": "Registerbekanntmachung nach dem Umwandlungsgesetz",
      "state": "Berlin",
      "amtsgericht": "Amtsgericht Berlin (Charlottenburg)",
      "registernummer": "HRA 28256",
      "registerart": "HRA",
      "company_name": "Lange Schiffahrt Halbinsel Köpenick GmbH & Co. KG",
      "company_seat": "Berlin",
      "details": "04.07.2025 (Bekanntmachungsdatum)\n\nBerlin Amtsgericht Berlin (Charlottenburg) HRA 28256\nRegisterbekanntmachung nach dem Umwandlungsgesetz 01.07.2025 (Eintragungsdatum)\n\nLange Schiffahrt Halbinsel Köpenick GmbH & Co. KG\nKommanditgesellschaft\nBerlin\n\nZu Eintragungsnummer 5 vom 01.07.2025 wird als nicht eingetragen veröffentlicht:\nDen Gläubigern der an der Verschmelzung beteiligten Rechtsträger ist, wenn sie binnen sechs Monaten nach dem Tag, an dem die Eintragung der Verschmelzung in das Register des Sitzes desjenigen Rechtsträgers, dessen Gläubiger sie sind, als bekannt gemacht gilt, ihren Anspruch nach Grund und Höhe schriftlich anmelden, Sicherheit zu leisten, soweit sie nicht Befriedigung verlangen können. Dieses Recht steht den Gläubigern jedoch nur zu, wenn sie glaubhaft machen, dass durch die Verschmelzung die Erfüllung ihrer Forderung gefährdet wird. Das Recht, Sicherheitsleistung zu verlangen, steht Gläubigern nicht zu, die im Falle der Insolvenz ein Recht auf vorzugsweise Befriedigung aus einer Deckungsmasse haben, die nach gesetzlicher Vorschrift zu ihrem Schutz errichtet und staatlich überwacht ist."
    },
    {
      "date": "2025-07-04",
      "id": "114631",
      "original_text": "Registerbekanntmachung nach dem Umwandlungsgesetz\nBerlin Amtsgericht Berlin (Charlottenburg) HRA 37678\nLange Handels - GmbH & Co. Grundstücksgesellschaft Lichterfelde-Süd KG – Berlin",
      "type": "Registerbekanntmachung nach dem Umwandlungsgesetz",
      "state": "Berlin",
      "amtsgericht": "Amtsgericht Berlin (Charlottenburg)",
      "registernummer": "HRA 37678",
      "registerart": "HRA",
      "company_name": "Lange Handels - GmbH & Co. Grundstücksgesellschaft Lichterfelde-Süd KG",
      "company_seat": "Berlin",
      "details": "04.07.2025 (Bekanntmachungsdatum)\n\nBerlin Amtsgericht Berlin (Charlottenburg) HRA 37678\nRegisterbekanntmachung nach dem Umwandlungsgesetz 01.07.2025 (Eintragungsdatum)\n\nLange Handels - GmbH & Co. Grundstücksgesellschaft Lichterfelde-Süd KG\nKommanditgesellschaft\nBerlin\n\nZu Eintragungsnummer 8 vom 01.07.2025 wird als nicht eingetragen veröffentlicht:\nDen Gläubigern der an der Verschmelzung beteiligten Rechtsträger ist, wenn sie binnen sechs Monaten nach dem Tag, an dem die Eintragung der Verschmelzung in das Register des Sitzes desjenigen Rechtsträgers, dessen Gläubiger sie sind, als bekannt gemacht gilt, ihren Anspruch nach Grund und Höhe schriftlich anmelden, Sicherheit zu leisten, soweit sie nicht Befriedigung verlangen können. Dieses Recht steht den Gläubigern jedoch nur zu, wenn sie glaubhaft machen, dass durch die Verschmelzung die Erfüllung ihrer Forderung gefährdet wird. Das Recht, Sicherheitsleistung zu verlangen, steht Gläubigern nicht zu, die im Falle der Insolvenz ein Recht auf vorzugsweise Befriedigung aus einer Deckungsmasse haben, die nach gesetzlicher Vorschrift zu ihrem Schutz errichtet und staatlich überwacht ist."
    },
    {
      "date": "2025-07-04",
      "id": "114632",
      "original_text": "Registerbekanntmachung nach dem Umwandlungsgesetz\nBerlin Amtsgericht Berlin (Charlottenburg) HRA 39482\nBoxhagener Ensemble Grundstücks GmbH & Co. KG – Berlin",
      "type": "Registerbekanntmachung nach dem Umwandlungsgesetz",
      "state": "Berlin",
      "amtsgericht": "Amtsgericht Berlin (Charlottenburg)",
      "registernummer": "HRA 39482",
      "registerart": "HRA",
      "company_name": "Boxhagener Ensemble Grundstücks GmbH & Co. KG",
      "company_seat": "Berlin",
      "details": "04.07.2025 (Bekanntmachungsdatum)\n\nBerlin Amtsgericht Berlin (Charlottenburg) HRA 39482\nRegisterbekanntmachung nach dem Umwandlungsgesetz 01.07.2025 (Eintragungsdatum)\n\nBoxhagener Ensemble Grundstücks GmbH & Co. KG\nKommanditgesellschaft\nBerlin\n\nZu Eintragungsnummer 7 vom 01.07.2025 wird als nicht eingetragen veröffentlicht:\nDen Gläubigern der an der Verschmelzung beteiligten Rechtsträger ist, wenn sie binnen sechs Monaten nach dem Tag, an dem die Eintragung der Verschmelzung in das Register des Sitzes desjenigen Rechtsträgers, dessen Gläubiger sie sind, als bekannt gemacht gilt, ihren Anspruch nach Grund und Höhe schriftlich anmelden, Sicherheit zu leisten, soweit sie nicht Befriedigung verlangen können. Dieses Recht steht den Gläubigern jedoch nur zu, wenn sie glaubhaft machen, dass durch die Verschmelzung die Erfüllung ihrer Forderung gefährdet wird. Das Recht, Sicherheitsleistung zu verlangen, steht Gläubigern nicht zu, die im Falle der Insolvenz ein Recht auf vorzugsweise Befriedigung aus einer Deckungsmasse haben, die nach gesetzlicher Vorschrift zu ihrem Schutz errichtet und staatlich überwacht ist."
    },
    {
      "date": "2025-07-04",
      "id": "114633",
      "original_text": "Registerbekanntmachung nach dem Umwandlungsgesetz\nNordrhein-Westfalen Amtsgericht Coesfeld HRA 5616\nAuto Schröer, Nachf. Tim Weßels e.K. – Isselburg",
      "type": "Registerbekanntmachung nach dem Umwandlungsgesetz",
      "state": "Nordrhein-Westfalen",
      "amtsgericht": "Amtsgericht Coesfeld",
      "registernummer": "HRA 5616",
      "registerart": "HRA",
      "company_name": "Auto Schröer, Nachf. Tim Weßels e.K.",
      "company_seat": "Isselburg",
      "details": "04.07.2025 (Bekanntmachungsdatum)\n\nNordrhein-Westfalen Amtsgericht Coesfeld HRA 5616\nRegisterbekanntmachung nach dem Umwandlungsgesetz 04.07.2025 (Eintragungsdatum)\n\nAuto Schröer, Nachf. Tim Weßels e.K.\nEinzelkaufmann\nIsselburg\n\nDen Gläubigern der an der Ausgliederung beteiligten Rechtsträger ist, wenn sie binnen sechs Monaten nach dem Tag, an dem die Eintragung der Ausgliederung in das Register des Sitzes desjenigen Rechtsträgers, dessen Gläubiger sie sind, nach § 19 Absatz 3 UmwG als bekanntgemacht gilt, ihren Anspruch nach Grund und Höhe schriftlich anmelden, Sicherheit zu leisten, soweit sie nicht Befriedigung verlangen können. Dieses Recht steht den Gläubigern jedoch nur zu, wenn sie glaubhaft machen, dass durch die Ausgliederung die Erfüllung ihrer Forderung gefährdet wird."
    },
    {
      "date": "2025-07-04",
      "id": "114634",
      "original_text": "Einreichung neuer Dokumente\nBaden-Württemberg Amtsgericht Stuttgart HRB 16367\nSV SparkassenVersicherung Holding Aktiengesellschaft – Stuttgart",
      "type": "Einreichung neuer Dokumente",
      "state": "Baden-Württemberg",
      "amtsgericht": "Amtsgericht Stuttgart",
      "registernummer": "HRB 16367",
      "registerart": "HRB",
      "company_name": "SV SparkassenVersicherung Holding Aktiengesellschaft",
      "company_seat": "Stuttgart",
      "details": "04.07.2025 (Bekanntmachungsdatum)\n\nBaden-Württemberg Amtsgericht Stuttgart HRB 16367\nEinreichung neuer Dokumente\n\nSV SparkassenVersicherung Holding Aktiengesellschaft\nAktiengesellschaft\nStuttgart\n\nDie Gesellschaft hat am 30.06.2025 die Liste über die Zusammensetzung des Aufsichtsrats zum Handelsregister eingereicht."
    },
    {
      "date": "2025-07-04",
      "id": "114635",
      "original_text": "Registerbekanntmachung nach dem Umwandlungsgesetz\nSchleswig-Holstein Amtsgericht Kiel HRB 2418 BB\nJPM Holding GmbH – Henstedt-Ulzburg",
      "type": "Registerbekanntmachung nach dem Umwandlungsgesetz",
      "state": "Schleswig-Holstein",
      "amtsgericht": "Amtsgericht Kiel",
      "registernummer": "HRB 2418 BB",
      "registerart": "HRB",
      "company_name": "JPM Holding GmbH",
      "company_seat": "Henstedt-Ulzburg",
      "details": "04.07.2025 (Bekanntmachungsdatum)\n\nSchleswig-Holstein Amtsgericht Kiel HRB 2418 BB\nRegisterbekanntmachung nach dem Umwandlungsgesetz 02.07.2025 (Eintragungsdatum)\n\nJPM Holding GmbH\nGesellschaft mit beschränkter Haftung\nHenstedt-Ulzburg\n\nZu Eintragungsnummer 15 vom 02.07.2025 wird als nicht eingetragen veröffentlicht: Als nicht eingetragen wird veröffentlicht: Den Gläubigern der an der Spaltung beteiligten Rechtsträger ist, wenn sie binnen sechs Monaten nach dem Tag, an dem die Eintragung der Spaltung in das Register des Sitzes desjenigen Rechtsträgers, dessen Gläubiger sie sind,  bekannt gemacht worden ist, ihren Anspruch nach Grund und Höhe schriftlich anmelden, Sicherheit zu leisten, soweit sie nicht Befriedigung verlangen können. Dieses Recht steht den Gläubigern jedoch nur zu, wenn sie glaubhaft machen, dass durch die Spaltung die Erfüllung ihrer Forderung gefährdet wird."
    },
    {
      "date": "2025-07-04",
      "id": "114636",
      "original_text": "Einreichung neuer Dokumente\nBerlin Amtsgericht Berlin (Charlottenburg) HRB 88486\nVitanas GmbH & Co. KGaA – Berlin",
      "type": "Einreichung neuer Dokumente",
      "state": "Berlin",
      "amtsgericht": "Amtsgericht Berlin (Charlottenburg)",
      "registernummer": "HRB 88486",
      "registerart": "HRB",
      "company_name": "Vitanas GmbH & Co. KGaA",
      "company_seat": "Berlin",
      "details": "04.07.2025 (Bekanntmachungsdatum)\n\nBerlin Amtsgericht Berlin (Charlottenburg) HRB 88486\nEinreichung neuer Dokumente\n\nVitanas GmbH & Co. KGaA\nKommanditgesellschaft auf Aktien\nBerlin\n\nAls nicht eingetragen wird veröffentlicht: Es wurde eine neue Liste der Aufsichtsratsmitglieder eingereicht (§52 GmbHG)."
    },
    {
      "date": "2025-07-04",
      "id": "114637",
      "original_text": "Sonstige Registerbekanntmachung\nBerlin Amtsgericht Berlin (Charlottenburg) HRB 136070\nSunglow Malope Property GmbH – Berlin",
      "type": "Sonstige Registerbekanntmachung",
      "state": "Berlin",
      "amtsgericht": "Amtsgericht Berlin (Charlottenburg)",
      "registernummer": "HRB 136070",
      "registerart": "HRB",
      "company_name": "Sunglow Malope Property GmbH",
      "company_seat": "Berlin",
      "details": "04.07.2025 (Bekanntmachungsdatum)\n\nBerlin Amtsgericht Berlin (Charlottenburg) HRB 136070\nSonstige Registerbekanntmachung\n\nSunglow Malope Property GmbH\nGesellschaft mit beschränkter Haftung\nBerlin\n\nAls nicht eingetragen wird veröffentlicht: Den Gläubigern ist, wenn sie binnen sechs Monaten nach dem Tag, an dem die Eintragung der Umwandlung als bekannt gemacht gilt, ihren Anspruch nach Grund und Höhe schriftlich anmelden, Sicherheit zu leisten, soweit sie nicht Befriedigung verlangen können. Dieses Recht steht den Gläubigern jedoch nur zu, wenn sie glaubhaft machen, dass durch die Umwandlung die Erfüllung ihrer Forderung gefährdet wird. Das Recht, Sicherheitsleistung zu verlangen, steht Gläubigern nicht zu, die im Falle der Insolvenz ein Recht auf vorzugsweise Befriedigung aus einer Deckungsmasse haben, die nach gesetzlicher Vorschrift zu ihrem Schutz errichtet und staatlich überwacht ist."
    },
    {
      "date": "2025-07-04",
      "id": "114638",
      "original_text": "Löschungsankündigung\nBrandenburg Amtsgericht Frankfurt/Oder HRB 14155\nKALAJA 2012 UG (haftungsbeschränkt) Cafe-Ristorante-Pizzeria – Biesenthal",
      "type": "Löschungsankündigung",
      "state": "Brandenburg",
      "amtsgericht": "Amtsgericht Frankfurt/Oder",
      "registernummer": "HRB 14155",
      "registerart": "HRB",
      "company_name": "KALAJA 2012 UG (haftungsbeschränkt) Cafe-Ristorante-Pizzeria",
      "company_seat": "Biesenthal",
      "details": "04.07.2025 (Bekanntmachungsdatum)\n\nBrandenburg Amtsgericht Frankfurt/Oder HRB 14155\nLöschungsankündigung\n\nKALAJA 2012 UG (haftungsbeschränkt) Cafe-Ristorante-Pizzeria\nGesellschaft mit beschränkter Haftung\nBiesenthal\n\nBei der nachstehenden Gesellschaft wird das Amtslöschungsverfahren gemäß § 394 Abs. 1 FamFG eingeleitet."
    },
    {
      "date": "2025-07-04",
      "id": "114639",
      "original_text": "Registerbekanntmachung nach dem Umwandlungsgesetz\nBaden-Württemberg Amtsgericht Stuttgart HRB 724204\nStaufen.AG Beratung Akademie Beteiligung – Köngen",
      "type": "Registerbekanntmachung nach dem Umwandlungsgesetz",
      "state": "Baden-Württemberg",
      "amtsgericht": "Amtsgericht Stuttgart",
      "registernummer": "HRB 724204",
      "registerart": "HRB",
      "company_name": "Staufen.AG Beratung Akademie Beteiligung",
      "company_seat": "Köngen",
      "details": "04.07.2025 (Bekanntmachungsdatum)\n\nBaden-Württemberg Amtsgericht Stuttgart HRB 724204\nRegisterbekanntmachung nach dem Umwandlungsgesetz\n\nStaufen.AG Beratung Akademie Beteiligung\nAktiengesellschaft\nKöngen\n\nDie Gesellschaft hat am 04.07.2025 den Entwurf des Verschmelzungsvertrages zwischen \"Accenture GmbH\", Kronberg im Taunus (Amtsgericht Königstein im Taunus HRB 5920) und der hiesigen Gesellschaft (übertragender Rechtsträger) zum Handelsregister eingereicht."
    },
    {
      "date": "2025-07-04",
      "id": "114640",
      "original_text": "Registerbekanntmachung nach dem Umwandlungsgesetz\nBerlin Amtsgericht Berlin (Charlottenburg) HRA 2631\nSeniorenhaus Lerchenweg GmbH & Co. KG – Berlin",
      "type": "Registerbekanntmachung nach dem Umwandlungsgesetz",
      "state": "Berlin",
      "amtsgericht": "Amtsgericht Berlin (Charlottenburg)",
      "registernummer": "HRA 2631",
      "registerart": "HRA",
      "company_name": "Seniorenhaus Lerchenweg GmbH & Co. KG",
      "company_seat": "Berlin",
      "details": "04.07.2025 (Bekanntmachungsdatum)\n\nBerlin Amtsgericht Berlin (Charlottenburg) HRA 2631\nRegisterbekanntmachung nach dem Umwandlungsgesetz 03.07.2025 (Eintragungsdatum)\n\nSeniorenhaus Lerchenweg GmbH & Co. KG\nKommanditgesellschaft\nBerlin\n\nZu Eintragungsnummer 28 vom 03.07.2025 wird als nicht eingetragen veröffentlicht: Den Gläubigern der an der Verschmelzung beteiligten Rechtsträger ist, wenn sie binnen sechs Monaten nach dem Tag, an dem die Eintragung der Verschmelzung in das Register des Sitzes desjenigen Rechtsträgers, dessen Gläubiger sie sind, als bekannt gemacht gilt, ihren Anspruch nach Grund und Höhe schriftlich anmelden, Sicherheit zu leisten, soweit sie nicht Befriedigung verlangen können. Dieses Recht steht den Gläubigern jedoch nur zu, wenn sie glaubhaft machen, dass durch die Verschmelzung die Erfüllung ihrer Forderung gefährdet wird. Das Recht, Sicherheitsleistung zu verlangen, steht Gläubigern nicht zu, die im Falle der Insolvenz ein Recht auf vorzugsweise Befriedigung aus einer Deckungsmasse haben, die nach gesetzlicher Vorschrift zu ihrem Schutz errichtet und staatlich überwacht ist."
    },
    {
      "date": "2025-07-04",
      "id": "114641",
      "original_text": "Registerbekanntmachung nach dem Umwandlungsgesetz\nBerlin Amtsgericht Berlin (Charlottenburg) HRB 2276\nSeniorenhaus Siegfriedshof GmbH – Berlin",
      "type": "Registerbekanntmachung nach dem Umwandlungsgesetz",
      "state": "Berlin",
      "amtsgericht": "Amtsgericht Berlin (Charlottenburg)",
      "registernummer": "HRB 2276",
      "registerart": "HRB",
      "company_name": "Seniorenhaus Siegfriedshof GmbH",
      "company_seat": "Berlin",
      "details": "04.07.2025 (Bekanntmachungsdatum)\n\nBerlin Amtsgericht Berlin (Charlottenburg) HRB 2276\nRegisterbekanntmachung nach dem Umwandlungsgesetz 03.07.2025 (Eintragungsdatum)\n\nSeniorenhaus Siegfriedshof GmbH\nGesellschaft mit beschränkter Haftung\nBerlin\n\nZu Eintragungsnummer 19 vom 03.07.2025 wird als nicht eingetragen veröffentlicht: Den Gläubigern der an der Verschmelzung beteiligten Rechtsträger ist, wenn sie binnen sechs Monaten nach dem Tag, an dem die Eintragung der Verschmelzung in das Register des Sitzes desjenigen Rechtsträgers, dessen Gläubiger sie sind, als bekannt gemacht gilt, ihren Anspruch nach Grund und Höhe schriftlich anmelden, Sicherheit zu leisten, soweit sie nicht Befriedigung verlangen können. Dieses Recht steht den Gläubigern jedoch nur zu, wenn sie glaubhaft machen, dass durch die Verschmelzung die Erfüllung ihrer Forderung gefährdet wird. Das Recht, Sicherheitsleistung zu verlangen, steht Gläubigern nicht zu, die im Falle der Insolvenz ein Recht auf vorzugsweise Befriedigung aus einer Deckungsmasse haben, die nach gesetzlicher Vorschrift zu ihrem Schutz errichtet und staatlich überwacht ist."
    },
    {
      "date": "2025-07-04",
      "id": "114642",
      "original_text": "Registerbekanntmachung nach dem Umwandlungsgesetz\nHamburg Amtsgericht Hamburg HRA 88886\nWilhelmsen Ahrenkiel Bulk GmbH & Co. KG – Hamburg",
      "type": "Registerbekanntmachung nach dem Umwandlungsgesetz",
      "state": "Hamburg",
      "amtsgericht": "Amtsgericht Hamburg",
      "registernummer": "HRA 88886",
      "registerart": "HRA",
      "company_name": "Wilhelmsen Ahrenkiel Bulk GmbH & Co. KG",
      "company_seat": "Hamburg",
      "details": "04.07.2025 (Bekanntmachungsdatum)\n\nHamburg Amtsgericht Hamburg HRA 88886\nRegisterbekanntmachung nach dem Umwandlungsgesetz 04.07.2025 (Eintragungsdatum)\n\nWilhelmsen Ahrenkiel Bulk GmbH & Co. KG\nKommanditgesellschaft\nHamburg\n\nAls nicht eingetragen wird bekannt gemacht:\nDen Gläubigern der an der Verschmelzung beteiligten Gesellschaften ist, wenn sie binnen sechs Monaten nach dem Tag, an dem die Eintragung der Verschmelzung in das Register des Sitzes desjenigen Rechtsträgers, dessen Gläubiger sie sind, nach § 19 Absatz 3 UmwG als bekannt gemacht gilt, ihren Anspruch nach Grund und Höhe schriftlich anmelden, Sicherheit zu leisten, soweit sie nicht Befriedigung verlangen können. Dieses Recht steht den Gläubigern jedoch nur zu, wenn sie glaubhaft machen, dass durch die Verschmelzung die Erfüllung ihrer Forderung gefährdet wird."
    },
    {
      "date": "2025-07-04",
      "id": "114643",
      "original_text": "Löschungsankündigung\nBerlin Amtsgericht Berlin (Charlottenburg) HRB 202404\nGF Gastro Friedrichshain UG (haftungsbeschränkt) – Berlin",
      "type": "Löschungsankündigung",
      "state": "Berlin",
      "amtsgericht": "Amtsgericht Berlin (Charlottenburg)",
      "registernummer": "HRB 202404",
      "registerart": "HRB",
      "company_name": "GF Gastro Friedrichshain UG (haftungsbeschränkt)",
      "company_seat": "Berlin",
      "details": "04.07.2025 (Bekanntmachungsdatum)\n\nBerlin Amtsgericht Berlin (Charlottenburg) HRB 202404\nLöschungsankündigung\n\nGF Gastro Friedrichshain UG (haftungsbeschränkt)\nGesellschaft mit beschränkter Haftung\nBerlin\n\nBei der nachstehenden Gesellschaft wird das Amtslöschungsverfahren gemäß § 394 FamFG eingeleitet. Widerspruchsfrist\n6 Wochen."
    },
    {
      "date": "2025-07-04",
      "id": "114644",
      "original_text": "Registerbekanntmachung nach dem Umwandlungsgesetz\nHamburg Amtsgericht Hamburg HRB 58718\nVerwaltung ZEABORN Ship Management GmbH – Hamburg",
      "type": "Registerbekanntmachung nach dem Umwandlungsgesetz",
      "state": "Hamburg",
      "amtsgericht": "Amtsgericht Hamburg",
      "registernummer": "HRB 58718",
      "registerart": "HRB",
      "company_name": "Verwaltung ZEABORN Ship Management GmbH",
      "company_seat": "Hamburg",
      "details": "04.07.2025 (Bekanntmachungsdatum)\n\nHamburg Amtsgericht Hamburg HRB 58718\nRegisterbekanntmachung nach dem Umwandlungsgesetz 04.07.2025 (Eintragungsdatum)\n\nVerwaltung ZEABORN Ship Management GmbH\nGesellschaft mit beschränkter Haftung\nHamburg\n\nAls nicht eingetragen wird bekannt gemacht:\nDen Gläubigern der an der Verschmelzung beteiligten Gesellschaften ist, wenn sie binnen sechs Monaten nach dem Tag, an dem die Eintragung der Verschmelzung in das Register des Sitzes desjenigen Rechtsträgers, dessen Gläubiger sie sind, nach § 19 Absatz 3 UmwG als bekannt gemacht gilt, ihren Anspruch nach Grund und Höhe schriftlich anmelden, Sicherheit zu leisten, soweit sie nicht Befriedigung verlangen können. Dieses Recht steht den Gläubigern jedoch nur zu, wenn sie glaubhaft machen, dass durch die Verschmelzung die Erfüllung ihrer Forderung gefährdet wird."
    },
    {
      "date": "2025-07-04",
      "id": "114645",
      "original_text": "Löschungsankündigung\nBaden-Württemberg Amtsgericht Mannheim HRB 107172\nSandkorn Theater gGmbH – Karlsruhe",
      "type": "Löschungsankündigung",
      "state": "Baden-Württemberg",
      "amtsgericht": "Amtsgericht Mannheim",
      "registernummer": "HRB 107172",
      "registerart": "HRB",
      "company_name": "Sandkorn Theater gGmbH",
      "company_seat": "Karlsruhe",
      "details": "04.07.2025 (Bekanntmachungsdatum)\n\nBaden-Württemberg Amtsgericht Mannheim HRB 107172\nLöschungsankündigung\n\nSandkorn Theater gGmbH\nGesellschaft mit beschränkter Haftung\nKarlsruhe\n\nDas Gericht beabsichtigt, die Gesellschaft wegen Vermögenslosigkeit im Handelsregister von Amts wegen nach § 394 FamFG zu löschen. Die Frist zur Geltendmachung eines Widerspruchs gegen die beabsichtigte Löschung ist auf einen Monat ab Veröffentlichung bestimmt."
    },
    {
      "date": "2025-07-04",
      "id": "114646",
      "original_text": "Registerbekanntmachung nach dem Umwandlungsgesetz\nBaden-Württemberg Amtsgericht Freiburg HRB 722592\nWiehn Elektrotechnik UG (haftungsbeschränkt) – Rheinau",
      "type": "Registerbekanntmachung nach dem Umwandlungsgesetz",
      "state": "Baden-Württemberg",
      "amtsgericht": "Amtsgericht Freiburg",
      "registernummer": "HRB 722592",
      "registerart": "HRB",
      "company_name": "Wiehn Elektrotechnik UG (haftungsbeschränkt)",
      "company_seat": "Rheinau",
      "details": "04.07.2025 (Bekanntmachungsdatum)\n\nBaden-Württemberg Amtsgericht Freiburg HRB 722592\nRegisterbekanntmachung nach dem Umwandlungsgesetz 04.07.2025 (Eintragungsdatum)\n\nWiehn Elektrotechnik UG (haftungsbeschränkt)\nGesellschaft mit beschränkter Haftung\nRheinau\n\nAls nicht eingetragen wird bekanntgemacht:\nDen Gläubigern der an der Verschmelzung beteiligten Rechtsträger ist, wenn sie binnen sechs Monaten nach dem Tag, an dem die Eintragung der Verschmelzung in das Register des Sitzes desjenigen Rechtsträgers, dessen Gläubiger sie sind, nach § 19 Abs. 3 UmwG als bekanntgemacht gilt, ihren Anspruch nach Grund und Höhe schriftlich anmelden, Sicherheit zu leisten, soweit sie nicht Befriedigung verlangen können. Dieses Recht steht den Gläubigern jedoch nur zu, wenn sie glaubhaft machen, dass durch die Verschmelzung die Erfüllung ihrer Forderung gefährdet wird."
    },
    {
      "date": "2025-07-04",
      "id": "114647",
      "original_text": "Registerbekanntmachung nach dem Umwandlungsgesetz\nBerlin Amtsgericht Berlin (Charlottenburg) HRB 233620\nCosmo MidCo 2 (AFP3) GmbH – Berlin",
      "type": "Registerbekanntmachung nach dem Umwandlungsgesetz",
      "state": "Berlin",
      "amtsgericht": "Amtsgericht Berlin (Charlottenburg)",
      "registernummer": "HRB 233620",
      "registerart": "HRB",
      "company_name": "Cosmo MidCo 2 (AFP3) GmbH",
      "company_seat": "Berlin",
      "details": "04.07.2025 (Bekanntmachungsdatum)\n\nBerlin Amtsgericht Berlin (Charlottenburg) HRB 233620\nRegisterbekanntmachung nach dem Umwandlungsgesetz 03.07.2025 (Eintragungsdatum)\n\nCosmo MidCo 2 (AFP3) GmbH\nGesellschaft mit beschränkter Haftung\nBerlin\n\nZu Eintragungsnummer 11 vom 03.07.2025 wird als nicht eingetragen veröffentlicht: Den Gläubigern der an der Spaltung beteiligten Rechtsträger ist, wenn sie binnen sechs Monaten nach dem Tag, an dem die Eintragung der Spaltung in das Register des Sitzes desjenigen Rechtsträgers, dessen Gläubiger sie sind, als bekannt gemacht gilt, ihren Anspruch nach Grund und Höhe schriftlich anmelden, Sicherheit zu leisten, soweit sie nicht Befriedigung verlangen können. Dieses Recht steht den Gläubigern jedoch nur zu, wenn sie glaubhaft machen, dass durch die Spaltung die Erfüllung ihrer Forderung gefährdet wird. Das Recht, Sicherheitsleistung zu verlangen, steht Gläubigern nicht zu, die im Falle der Insolvenz ein Recht auf vorzugsweise Befriedigung aus einer Deckungsmasse haben, die nach gesetzlicher Vorschrift zu ihrem Schutz errichtet und staatlich überwacht ist."
    },
    {
      "date": "2025-07-04",
      "id": "114648",
      "original_text": "Löschungsankündigung\nSchleswig-Holstein Amtsgericht Pinneberg HRA 7744\nNordsport GmbH & Co. KG – Elmshorn",
      "type": "Löschungsankündigung",
      "state": "Schleswig-Holstein",
      "amtsgericht": "Amtsgericht Pinneberg",
      "registernummer": "HRA 7744",
      "registerart": "HRA",
      "company_name": "Nordsport GmbH & Co. KG",
      "company_seat": "Elmshorn",
      "details": "04.07.2025 (Bekanntmachungsdatum)\n\nSchleswig-Holstein Amtsgericht Pinneberg HRA 7744\nLöschungsankündigung\n\nNordsport GmbH & Co. KG\nKommanditgesellschaft\nElmshorn\n\nEs ist die Löschung der nachstehenden Gesellschaft wegen Vermögenslosigkeit gemäß § 394 FamFG beabsichtigt. Widerspruchsfrist: 2 Monate."
    },
    {
      "date": "2025-07-04",
      "id": "114649",
      "original_text": "Registerbekanntmachung nach dem Umwandlungsgesetz\nSchleswig-Holstein Amtsgericht Flensburg HRB 1332 HU\nnetpart service GmbH – Husum",
      "type": "Registerbekanntmachung nach dem Umwandlungsgesetz",
      "state": "Schleswig-Holstein",
      "amtsgericht": "Amtsgericht Flensburg",
      "registernummer": "HRB 1332 HU",
      "registerart": "HRB",
      "company_name": "netpart service GmbH",
      "company_seat": "Husum",
      "details": "04.07.2025 (Bekanntmachungsdatum)\n\nSchleswig-Holstein Amtsgericht Flensburg HRB 1332 HU\nRegisterbekanntmachung nach dem Umwandlungsgesetz 04.07.2025 (Eintragungsdatum)\n\nnetpart service GmbH\nGesellschaft mit beschränkter Haftung\nHusum\n\nZu Eintragungsnummer 3 vom 04.07.2025 wird als nicht eingetragen veröffentlicht: Den Gläubigern der an der Verschmelzung beteiligten Rechtsträger ist, wenn sie binnen sechs Monaten nach dem Tag, an dem die Eintragung der Verschmelzung in das Register des Sitzes desjenigen Rechtsträgers, dessen Gläubiger sie sind, als bekannt gemacht gilt, ihren Anspruch nach Grund und Höhe schriftlich anmelden, Sicherheit zu leisten, soweit sie nicht Befriedigung verlangen können. Dieses Recht steht den Gläubigern jedoch nur zu, wenn sie glaubhaft machen, dass durch die Verschmelzung die Erfüllung ihrer Forderung gefährdet wird. Das Recht, Sicherheitsleistung zu verlangen, steht Gläubigern nicht zu, die im Falle der Insolvenz ein Recht auf vorzugsweise Befriedigung aus einer Deckungsmasse haben, die nach gesetzlicher Vorschrift zu ihrem Schutz errichtet und staatlich überwacht ist."
    },
    {
      "date": "2025-07-04",
      "id": "114650",
      "original_text": "Löschungsankündigung\nBerlin Amtsgericht Berlin (Charlottenburg) HRB 100483\nSpielewerkstatt Kerber GmbH – Berlin",
      "type": "Löschungsankündigung",
      "state": "Berlin",
      "amtsgericht": "Amtsgericht Berlin (Charlottenburg)",
      "registernummer": "HRB 100483",
      "registerart": "HRB",
      "company_name": "Spielewerkstatt Kerber GmbH",
      "company_seat": "Berlin",
      "details": "04.07.2025 (Bekanntmachungsdatum)\n\nBerlin Amtsgericht Berlin (Charlottenburg) HRB 100483\nLöschungsankündigung\n\nSpielewerkstatt Kerber GmbH\nGesellschaft mit beschränkter Haftung\nBerlin\n\nBei der nachstehenden Gesellschaft wird das Amtslöschungsverfahren gemäß § 394 FamFG eingeleitet. Widerspruchsfrist 6 Wochen"
    },
    {
      "date": "2025-07-04",
      "id": "114651",
      "original_text": "Registerbekanntmachung nach dem Umwandlungsgesetz\nBaden-Württemberg Amtsgericht Freiburg HRB 711354\nBadische Grundbesitz GmbH – Freiburg im Breisgau",
      "type": "Registerbekanntmachung nach dem Umwandlungsgesetz",
      "state": "Baden-Württemberg",
      "amtsgericht": "Amtsgericht Freiburg",
      "registernummer": "HRB 711354",
      "registerart": "HRB",
      "company_name": "Badische Grundbesitz GmbH",
      "company_seat": "Freiburg im Breisgau",
      "details": "04.07.2025 (Bekanntmachungsdatum)\n\nBaden-Württemberg Amtsgericht Freiburg HRB 711354\nRegisterbekanntmachung nach dem Umwandlungsgesetz 04.07.2025 (Eintragungsdatum)\n\nBadische Grundbesitz GmbH\nGesellschaft mit beschränkter Haftung\nFreiburg im Breisgau\n\nDen Gläubigern der an der Verschmelzung beteiligten Rechtsträger ist, wenn sie binnen sechs Monaten nach dem Tag, an dem die Eintragung der Verschmelzung in das Register des Sitzes desjenigen Rechtsträgers, dessen Gläubiger sie sind, nach § 19 Abs. 3 UmwG als bekanntgemacht gilt, ihren Anspruch nach Grund und Höhe schriftlich anmelden, Sicherheit zu leisten, soweit sie nicht Befriedigung verlangen können. Dieses Recht steht den Gläubigern jedoch nur zu, wenn sie glaubhaft machen, dass durch die Verschmelzung die Erfüllung ihrer Forderung gefährdet wird."
    },
    {
      "date": "2025-07-04",
      "id": "114652",
      "original_text": "Registerbekanntmachung nach dem Umwandlungsgesetz\nBaden-Württemberg Amtsgericht Freiburg HRB 350\nGisinger GmbH – Freiburg im Breisgau",
      "type": "Registerbekanntmachung nach dem Umwandlungsgesetz",
      "state": "Baden-Württemberg",
      "amtsgericht": "Amtsgericht Freiburg",
      "registernummer": "HRB 350",
      "registerart": "HRB",
      "company_name": "Gisinger GmbH",
      "company_seat": "Freiburg im Breisgau",
      "details": "04.07.2025 (Bekanntmachungsdatum)\n\nBaden-Württemberg Amtsgericht Freiburg HRB 350\nRegisterbekanntmachung nach dem Umwandlungsgesetz 04.07.2025 (Eintragungsdatum)\n\nGisinger GmbH\nGesellschaft mit beschränkter Haftung\nFreiburg im Breisgau\n\nDen Gläubigern der an der Verschmelzung beteiligten Rechtsträger ist, wenn sie binnen sechs Monaten nach dem Tag, an dem die Eintragung der Verschmelzung in das Register des Sitzes desjenigen Rechtsträgers, dessen Gläubiger sie sind, nach § 19 Abs. 3 UmwG als bekanntgemacht gilt, ihren Anspruch nach Grund und Höhe schriftlich anmelden, Sicherheit zu leisten, soweit sie nicht Befriedigung verlangen können. Dieses Recht steht den Gläubigern jedoch nur zu, wenn sie glaubhaft machen, dass durch die Verschmelzung die Erfüllung ihrer Forderung gefährdet wird."
    },
    {
      "date": "2025-07-04",
      "id": "114653",
      "original_text": "Registerbekanntmachung nach dem Umwandlungsgesetz\nSachsen Amtsgericht Chemnitz HRB 19354\nSüGa-Gruppe Versicherungsmakler AG – Chemnitz",
      "type": "Registerbekanntmachung nach dem Umwandlungsgesetz",
      "state": "Sachsen",
      "amtsgericht": "Amtsgericht Chemnitz",
      "registernummer": "HRB 19354",
      "registerart": "HRB",
      "company_name": "SüGa-Gruppe Versicherungsmakler AG",
      "company_seat": "Chemnitz",
      "details": "04.07.2025 (Bekanntmachungsdatum)\n\nSachsen Amtsgericht Chemnitz HRB 19354\nRegisterbekanntmachung nach dem Umwandlungsgesetz 04.07.2025 (Eintragungsdatum)\n\nSüGa-Gruppe Versicherungsmakler AG\nAktiengesellschaft\nChemnitz\n\nHRB 19354\nSüGa-Gruppe Versicherungsmakler AG, Chemnitz\nErfenschlager Straße 19 09125 Chemnitz\nGemäß §§ 62 Abs. 3 Satz 2, § 61 UmwG wird bekanntgemacht, dass die Gesellschaft den Verschmelzungsvertrag zwischen der Gesellschaft und der RATFINANZ Makler UG (haftungsbeschränkt) mit Sitz in Steinbach-Hallenberg (Amtsgericht Jena HRB 512990) beim Handelsregister eingereicht."
    },
    {
      "date": "2025-07-04",
      "id": "114654",
      "original_text": "Registerbekanntmachung nach dem Umwandlungsgesetz\nSachsen Amtsgericht Dresden HRB 25264\nAurig Consulting GmbH – Dresden",
      "type": "Registerbekanntmachung nach dem Umwandlungsgesetz",
      "state": "Sachsen",
      "amtsgericht": "Amtsgericht Dresden",
      "registernummer": "HRB 25264",
      "registerart": "HRB",
      "company_name": "Aurig Consulting GmbH",
      "company_seat": "Dresden",
      "details": "04.07.2025 (Bekanntmachungsdatum)\n\nSachsen Amtsgericht Dresden HRB 25264\nRegisterbekanntmachung nach dem Umwandlungsgesetz 04.07.2025 (Eintragungsdatum)\n\nAurig Consulting GmbH\nGesellschaft mit beschränkter Haftung\nDresden\n\nDen Gläubigern der an der Verschmelzung beteiligten Rechtsträger ist, wenn sie binnen sechs Monaten nach dem Tag, an dem die Eintragung der Verschmelzung in das Register des Sitzes desjenigen Rechtsträgers, dessen Gläubiger sie sind, nach § 19 Abs. 3 UmwG als bekannt gemacht gilt, ihren Anspruch nach Grund und Höhe in Textform anmelden, Sicherheit zu leisten, soweit sie nicht Befriedigung verlangen können. Dieses Recht steht den Gläubigern jedoch nur zu, wenn sie glaubhaft machen, dass durch die Verschmelzung die Erfüllung der Forderung gefährdet wird."
    },
    {
      "date": "2025-07-04",
      "id": "114655",
      "original_text": "Einreichung neuer Dokumente\nSachsen Amtsgericht Dresden HRB 31116\nLandesbühnen Sachsen GmbH – Radebeul",
      "type": "Einreichung neuer Dokumente",
      "state": "Sachsen",
      "amtsgericht": "Amtsgericht Dresden",
      "registernummer": "HRB 31116",
      "registerart": "HRB",
      "company_name": "Landesbühnen Sachsen GmbH",
      "company_seat": "Radebeul",
      "details": "04.07.2025 (Bekanntmachungsdatum)\n\nSachsen Amtsgericht Dresden HRB 31116\nEinreichung neuer Dokumente\n\nLandesbühnen Sachsen GmbH\nGesellschaft mit beschränkter Haftung\nRadebeul\n\nAm 03.07.2025 wurde beim Handelsregister des Amtsgerichts Dresden die Liste der Mitglieder des Aufsichtsrats gemäß § 52 GmbHG eingereicht."
    },
    {
      "date": "2025-07-04",
      "id": "114656",
      "original_text": "Registerbekanntmachung nach dem Umwandlungsgesetz\nSachsen Amtsgericht Dresden HRB 43314\nM & A Immobilien Verwaltungs UG (haftungsbeschränkt) – Dresden",
      "type": "Registerbekanntmachung nach dem Umwandlungsgesetz",
      "state": "Sachsen",
      "amtsgericht": "Amtsgericht Dresden",
      "registernummer": "HRB 43314",
      "registerart": "HRB",
      "company_name": "M & A Immobilien Verwaltungs UG (haftungsbeschränkt)",
      "company_seat": "Dresden",
      "details": "04.07.2025 (Bekanntmachungsdatum)\n\nSachsen Amtsgericht Dresden HRB 43314\nRegisterbekanntmachung nach dem Umwandlungsgesetz 04.07.2025 (Eintragungsdatum)\n\nM & A Immobilien Verwaltungs UG (haftungsbeschränkt)\nGesellschaft mit beschränkter Haftung\nDresden\n\nDen Gläubigern der an der Verschmelzung beteiligten Rechtsträger ist, wenn sie binnen sechs Monaten nach dem Tag, an dem die Eintragung der Verschmelzung in das Register des Sitzes desjenigen Rechtsträgers, dessen Gläubiger sie sind, nach § 19 Abs. 3 UmwG als bekannt gemacht gilt, ihren Anspruch nach Grund und Höhe in Textform anmelden, Sicherheit zu leisten, soweit sie nicht Befriedigung verlangen können. Dieses Recht steht den Gläubigern jedoch nur zu, wenn sie glaubhaft machen, dass durch die Verschmelzung die Erfüllung der Forderung gefährdet wird."
    },
    {
      "date": "2025-07-04",
      "id": "114657",
      "original_text": "Registerbekanntmachung nach dem Umwandlungsgesetz\nSachsen Amtsgericht Leipzig HRB 28867\nHELENA-MED GmbH – Leipzig",
      "type": "Registerbekanntmachung nach dem Umwandlungsgesetz",
      "state": "Sachsen",
      "amtsgericht": "Amtsgericht Leipzig",
      "registernummer": "HRB 28867",
      "registerart": "HRB",
      "company_name": "HELENA-MED GmbH",
      "company_seat": "Leipzig",
      "details": "04.07.2025 (Bekanntmachungsdatum)\n\nSachsen Amtsgericht Leipzig HRB 28867\nRegisterbekanntmachung nach dem Umwandlungsgesetz 04.07.2025 (Eintragungsdatum)\n\nHELENA-MED GmbH\nGesellschaft mit beschränkter Haftung\nLeipzig\n\nDen Gläubigern der an der Verschmelzung beteiligten Rechtsträger ist, wenn sie binnen sechs Monaten nach dem Tag, an dem die Eintragung der Verschmelzung in das Register des Sitzes desjenigen Rechtsträgers, dessen Gläubiger sie sind, nach § 19 Abs. 3 UmwG als bekannt gemacht gilt, ihren Anspruch nach Grund und Höhe in Textform anmelden, Sicherheit zu leisten, soweit sie nicht Befriedigung verlangen können. Dieses Recht steht den Gläubigern jedoch nur zu, wenn sie glaubhaft machen, dass durch die Verschmelzung die Erfüllung der Forderung gefährdet wird."
    },
    {
      "date": "2025-07-04",
      "id": "114658",
      "original_text": "Einreichung neuer Dokumente\nSachsen Amtsgericht Chemnitz HRB 33282\nKlärschlammmanagement Westsachsen GmbH – Zwickau",
      "type": "Einreichung neuer Dokumente",
      "state": "Sachsen",
      "amtsgericht": "Amtsgericht Chemnitz",
      "registernummer": "HRB 33282",
      "registerart": "HRB",
      "company_name": "Klärschlammmanagement Westsachsen GmbH",
      "company_seat": "Zwickau",
      "details": "04.07.2025 (Bekanntmachungsdatum)\n\nSachsen Amtsgericht Chemnitz HRB 33282\nEinreichung neuer Dokumente\n\nKlärschlammmanagement Westsachsen GmbH\nGesellschaft mit beschränkter Haftung\nZwickau\n\nAm 03.07.2025 wurde beim Handelsregister des Amtsgerichts Chemnitz die Liste der Mitglieder des Aufsichtsrats gemäß § 52 GmbHG eingereicht."
    },
    {
      "date": "2025-07-04",
      "id": "114659",
      "original_text": "Einreichung neuer Dokumente\nNiedersachsen Amtsgericht Osnabrück HRB 219297\nGE Wind Energy GmbH – Salzbergen",
      "type": "Einreichung neuer Dokumente",
      "state": "Niedersachsen",
      "amtsgericht": "Amtsgericht Osnabrück",
      "registernummer": "HRB 219297",
      "registerart": "HRB",
      "company_name": "GE Wind Energy GmbH",
      "company_seat": "Salzbergen",
      "details": "04.07.2025 (Bekanntmachungsdatum)\n\nNiedersachsen Amtsgericht Osnabrück HRB 219297\nEinreichung neuer Dokumente\n\nGE Wind Energy GmbH\nGesellschaft mit beschränkter Haftung\nSalzbergen\n\nDie Liste der Mitglieder des Aufsichtsrats wurde beim Registergericht eingereicht."
    },
    {
      "date": "2025-07-04",
      "id": "114660",
      "original_text": "Löschungsankündigung\nNiedersachsen Amtsgericht Braunschweig HRA 201363\nBrowntown Media e.K. – Braunschweig",
      "type": "Löschungsankündigung",
      "state": "Niedersachsen",
      "amtsgericht": "Amtsgericht Braunschweig",
      "registernummer": "HRA 201363",
      "registerart": "HRA",
      "company_name": "Browntown Media e.K.",
      "company_seat": "Braunschweig",
      "details": "04.07.2025 (Bekanntmachungsdatum)\n\nNiedersachsen Amtsgericht Braunschweig HRA 201363\nLöschungsankündigung\n\nBrowntown Media e.K.\nEinzelkaufmann / Einzelkauffrau\nBraunschweig\n\nDas Registergericht beabsichtigt, die Firma von Amts wegen nach § 31 Abs. 2 Satz 2 HGB, § 393 FamFG zu löschen. Die Frist zur Erhebung eines Widerspruchs ist auf 1 Monat ab dieser Registerbekanntmachung festgesetzt."
    },
    {
      "date": "2025-07-04",
      "id": "114661",
      "original_text": "Löschungsankündigung\nNiedersachsen Amtsgericht Braunschweig HRA 6245\nJosef Brodmann KG – Braunschweig",
      "type": "Löschungsankündigung",
      "state": "Niedersachsen",
      "amtsgericht": "Amtsgericht Braunschweig",
      "registernummer": "HRA 6245",
      "registerart": "HRA",
      "company_name": "Josef Brodmann KG",
      "company_seat": "Braunschweig",
      "details": "04.07.2025 (Bekanntmachungsdatum)\n\nNiedersachsen Amtsgericht Braunschweig HRA 6245\nLöschungsankündigung 04.07.2025 (Eintragungsdatum)\n\nJosef Brodmann KG\nKommanditgesellschaft\nBraunschweig\n\nDas Registergericht beabsichtigt, die Firma von Amts wegen nach § 31 HGB i. V. m § 393 FamFG zu löschen. Die Frist zur Erhebung eines Widerspruchs ist auf 1 Monat ab dieser Registerbekanntmachung festgesetzt."
    },
    {
      "date": "2025-07-04",
      "id": "114662",
      "original_text": "Registerbekanntmachung nach dem Umwandlungsgesetz\nNiedersachsen Amtsgericht Osnabrück VR 200731\nKatholische Erwachsenenbildung Ostfriesland e.V. – Sögel",
      "type": "Registerbekanntmachung nach dem Umwandlungsgesetz",
      "state": "Niedersachsen",
      "amtsgericht": "Amtsgericht Osnabrück",
      "registernummer": "VR 200731",
      "registerart": "VR",
      "company_name": "Katholische Erwachsenenbildung Ostfriesland e.V.",
      "company_seat": "Sögel",
      "details": "04.07.2025 (Bekanntmachungsdatum)\n\nNiedersachsen Amtsgericht Osnabrück VR 200731\nRegisterbekanntmachung nach dem Umwandlungsgesetz 04.07.2025 (Eintragungsdatum)\n\nKatholische Erwachsenenbildung Ostfriesland e.V.\neingetragener Verein\nSögel\n\nDen Gläubigern der an der Verschmelzung beteiligten Rechtsträger ist, wenn sie binnen sechs Monaten nach dem Tag, an dem die Eintragung der Verschmelzung in das Register des Sitzes desjenigen Rechtsträgers, dessen Gläubiger sie sind, nach § 19  Abs.  3 UmwG als bekannt gemacht gilt, ihren Anspruch nach Grund und Höhe schriftlich anmelden, Sicherheit zu leisten, soweit sie nicht Befriedigung verlangen können. Dieses Recht steht den Gläubigern jedoch nur zu, wenn sie glaubhaft machen, dass durch die Verschmelzung die Erfüllung der Forderung gefährdet wird."
    },
    {
      "date": "2025-07-04",
      "id": "114663",
      "original_text": "Registerbekanntmachung nach dem Umwandlungsgesetz\nNiedersachsen Amtsgericht Osnabrück HRB 121142 früher Amtsgericht Meppen\nHeinz Sanders GmbH – Papenburg",
      "type": "Registerbekanntmachung nach dem Umwandlungsgesetz",
      "state": "Niedersachsen",
      "amtsgericht": "Amtsgericht Osnabrück",
      "registernummer": "HRB 121142",
      "registerart": "HRB",
      "company_name": "Heinz Sanders GmbH",
      "company_seat": "Papenburg",
      "former_amtsgericht": "Meppen",
      "details": "04.07.2025 (Bekanntmachungsdatum)\n\nNiedersachsen Amtsgericht Osnabrück HRB 121142 früher Amtsgericht Meppen\nRegisterbekanntmachung nach dem Umwandlungsgesetz 04.07.2025 (Eintragungsdatum)\n\nHeinz Sanders GmbH\nGesellschaft mit beschränkter Haftung\nPapenburg\n\nDen Gläubigern der an der Verschmelzung beteiligten Rechtsträger ist, wenn sie binnen sechs Monaten nach dem Tag, an dem die Eintragung der Verschmelzung in das Register des Sitzes desjenigen Rechtsträgers, dessen Gläubiger sie sind, nach § 19  Abs.  3 UmwG als bekannt gemacht gilt, ihren Anspruch nach Grund und Höhe schriftlich anmelden, Sicherheit zu leisten, soweit sie nicht Befriedigung verlangen können. Dieses Recht steht den Gläubigern jedoch nur zu, wenn sie glaubhaft machen, dass durch die Verschmelzung die Erfüllung der Forderung gefährdet wird."
    },
    {
      "date": "2025-07-04",
      "id": "114664",
      "original_text": "Löschungsankündigung\nNiedersachsen Amtsgericht Hildesheim HRB 200122\nELKA-Systems GmbH – Lehrte",
      "type": "Löschungsankündigung",
      "state": "Niedersachsen",
      "amtsgericht": "Amtsgericht Hildesheim",
      "registernummer": "HRB 200122",
      "registerart": "HRB",
      "company_name": "ELKA-Systems GmbH",
      "company_seat": "Lehrte",
      "details": "04.07.2025 (Bekanntmachungsdatum)\n\nNiedersachsen Amtsgericht Hildesheim HRB 200122\nLöschungsankündigung\n\nELKA-Systems GmbH\nGesellschaft mit beschränkter Haftung\nLehrte\n\nDas Registergericht beabsichtigt, die Gesellschaft von Amts wegen nach § 394 FamFG zu löschen. Die Frist zur Erhebung eines Widerspruchs ist auf 1 Monat ab dieser Registerbekanntmachung festgesetzt."
    },
    {
      "date": "2025-07-04",
      "id": "114665",
      "original_text": "Löschungsankündigung\nNiedersachsen Amtsgericht Hildesheim HRB 35938\nElektro Bode GmbH – Lehrte",
      "type": "Löschungsankündigung",
      "state": "Niedersachsen",
      "amtsgericht": "Amtsgericht Hildesheim",
      "registernummer": "HRB 35938",
      "registerart": "HRB",
      "company_name": "Elektro Bode GmbH",
      "company_seat": "Lehrte",
      "details": "04.07.2025 (Bekanntmachungsdatum)\n\nNiedersachsen Amtsgericht Hildesheim HRB 35938\nLöschungsankündigung\n\nElektro Bode GmbH\nGesellschaft mit beschränkter Haftung\nLehrte\n\nDas Registergericht beabsichtigt, die Gesellschaft von Amts wegen nach § 394 FamFG zu löschen. Die Frist zur Erhebung eines Widerspruchs ist auf 1 Monat ab dieser Registerbekanntmachung festgesetzt."
    },
    {
      "date": "2025-07-04",
      "id": "114666",
      "original_text": "Einreichung neuer Dokumente\nNiedersachsen Amtsgericht Aurich HRB 110929 früher Amtsgericht Leer (Ostfriesland) (Leer)\nORGADATA Software- Dienstleistungen Aktiengesellschaft – Leer",
      "type": "Einreichung neuer Dokumente",
      "state": "Niedersachsen",
      "amtsgericht": "Amtsgericht Aurich",
      "registernummer": "HRB 110929",
      "registerart": "HRB",
      "company_name": "ORGADATA Software- Dienstleistungen Aktiengesellschaft",
      "company_seat": "Leer",
      "former_amtsgericht": "Leer (Ostfriesland) (Leer)",
      "details": "04.07.2025 (Bekanntmachungsdatum)\n\nNiedersachsen Amtsgericht Aurich HRB 110929 früher Amtsgericht Leer (Ostfriesland) (Leer)\nEinreichung neuer Dokumente\n\nORGADATA Software- Dienstleistungen Aktiengesellschaft\nAktiengesellschaft\nLeer\n\nBeim Handelsregister ist der Entwurf eines Verschmelzungsvertrages eingereicht worden. Danach soll die Gesellschaft  - als übernehmende Gesellschaft - mit der ORGADATA Consulting GmbH, Sitz: Leer,  (Amtsgericht Aurich  HRB 205632) verschmolzen werden."
    },
    {
      "date": "2025-07-04",
      "id": "114667",
      "original_text": "Registerbekanntmachung nach dem Umwandlungsgesetz\nNiedersachsen Amtsgericht Hannover HRA 206625\nHannoversche Tischlerei GmbH & Co. KG – Hannover",
      "type": "Registerbekanntmachung nach dem Umwandlungsgesetz",
      "state": "Niedersachsen",
      "amtsgericht": "Amtsgericht Hannover",
      "registernummer": "HRA 206625",
      "registerart": "HRA",
      "company_name": "Hannoversche Tischlerei GmbH & Co. KG",
      "company_seat": "Hannover",
      "details": "04.07.2025 (Bekanntmachungsdatum)\n\nNiedersachsen Amtsgericht Hannover HRA 206625\nRegisterbekanntmachung nach dem Umwandlungsgesetz 04.07.2025 (Eintragungsdatum)\n\nHannoversche Tischlerei GmbH & Co. KG\nKommanditgesellschaft\nHannover\n\nDen Gläubigern der an der Ausgliederung beteiligten Rechtsträger ist, wenn sie binnen sechs Monaten nach dem Tag, an dem die Eintragung der Ausgliederung in das Register des Sitzes desjenigen Rechtsträgers, dessen Gläubiger sie sind, nach § 19 Abs. 3 UmwG als bekannt gemacht gilt, ihren Anspruch nach Grund und Höhe schriftlich anmelden, Sicherheit zu leisten, soweit sie nicht Befriedigung verlangen können. Dieses Recht steht den Gläubigern jedoch nur zu, wenn sie glaubhaft machen, dass durch die Ausgliederung die Erfüllung der Forderung gefährdet wird."
    },
    {
      "date": "2025-07-04",
      "id": "114668",
      "original_text": "Registerbekanntmachung nach dem Umwandlungsgesetz\nNiedersachsen Amtsgericht Hannover HRB 201333\nHannoversche Zimmerei GmbH – Hannover",
      "type": "Registerbekanntmachung nach dem Umwandlungsgesetz",
      "state": "Niedersachsen",
      "amtsgericht": "Amtsgericht Hannover",
      "registernummer": "HRB 201333",
      "registerart": "HRB",
      "company_name": "Hannoversche Zimmerei GmbH",
      "company_seat": "Hannover",
      "details": "04.07.2025 (Bekanntmachungsdatum)\n\nNiedersachsen Amtsgericht Hannover HRB 201333\nRegisterbekanntmachung nach dem Umwandlungsgesetz 04.07.2025 (Eintragungsdatum)\n\nHannoversche Zimmerei GmbH\nGesellschaft mit beschränkter Haftung\nHannover\n\nDen Gläubigern der an der Den Gläubigern der an der Ausgliederung beteiligten Rechtsträger ist, wenn sie binnen sechs Monaten nach dem Tag, an dem die Eintragung der Spaltung in das Register des Sitzes desjenigen Rechtsträgers, dessen Gläubiger sie sind, nach § 19 Abs. 3 UmwG als bekannt gemacht gilt, ihren Anspruch nach Grund und Höhe schriftlich anmelden, Sicherheit zu leisten, soweit sie nicht Befriedigung verlangen können. Dieses Recht steht den Gläubigern jedoch nur zu, wenn sie glaubhaft machen, dass durch die Ausgliederung die Erfüllung der Forderung gefährdet wird."
    },
    {
      "date": "2025-07-04",
      "id": "114669",
      "original_text": "Löschungsankündigung\nNiedersachsen Amtsgericht Braunschweig HRA 202419\nTP-ZOB-Braunschweig UG (haftungsbeschränkt) & Co. KG – Braunschweig",
      "type": "Löschungsankündigung",
      "state": "Niedersachsen",
      "amtsgericht": "Amtsgericht Braunschweig",
      "registernummer": "HRA 202419",
      "registerart": "HRA",
      "company_name": "TP-ZOB-Braunschweig UG (haftungsbeschränkt) & Co. KG",
      "company_seat": "Braunschweig",
      "details": "04.07.2025 (Bekanntmachungsdatum)\n\nNiedersachsen Amtsgericht Braunschweig HRA 202419\nLöschungsankündigung 04.07.2025 (Eintragungsdatum)\n\nTP-ZOB-Braunschweig UG (haftungsbeschränkt) & Co. KG\nKommanditgesellschaft\nBraunschweig\n\nDas Registergericht beabsichtigt, die Firma von Amts wegen nach § 394 Abs. 4 FamFG zu löschen. Die Frist zur Erhebung eines Widerspruchs ist auf 1 Monat ab dieser Registerbekanntmachung festgesetzt."
    },
    {
      "date": "2025-07-04",
      "id": "114670",
      "original_text": "Registerbekanntmachung nach dem Umwandlungsgesetz\nRheinland-Pfalz Amtsgericht Mainz HRB 50443\nALDI Bingen Verwaltungs-SE – Bingen am Rhein",
      "type": "Registerbekanntmachung nach dem Umwandlungsgesetz",
      "state": "Rheinland-Pfalz",
      "amtsgericht": "Amtsgericht Mainz",
      "registernummer": "HRB 50443",
      "registerart": "HRB",
      "company_name": "ALDI Bingen Verwaltungs-SE",
      "company_seat": "Bingen am Rhein",
      "details": "04.07.2025 (Bekanntmachungsdatum)\n\nRheinland-Pfalz Amtsgericht Mainz HRB 50443\nRegisterbekanntmachung nach dem Umwandlungsgesetz 04.07.2025 (Eintragungsdatum)\n\nALDI Bingen Verwaltungs-SE\nEuropäische Aktiengesellschaft (SE)\nBingen am Rhein\n\nAls nicht eingetragen wird veröffentlicht: Den Gläubigern der an der Verschmelzung beteiligten Rechtsträger ist, wenn sie binnen sechs Monaten nach dem Tag, an dem die Eintragung der Verschmelzung in das Register des Sitzes desjenigen Rechtsträgers, dessen Gläubiger sie sind, nach § 19 Abs. 3 UmwG als bekannt gemacht gilt, ihren Anspruch nach Grund und Höhe schriftlich anmelden, Sicherheit zu leisten, soweit sie nicht Befriedigung verlangen können. Dieses Recht steht den Gläubigern jedoch nur zu, wenn sie glaubhaft machen, dass durch die Verschmelzung die Erfüllung der Forderung gefährdet wird."
    },
    {
      "date": "2025-07-04",
      "id": "114671",
      "original_text": "Einreichung neuer Dokumente\nRheinland-Pfalz Amtsgericht Montabaur HRB 20065\nPLANOPTIK AG – Elsoff-Mittelhofen",
      "type": "Einreichung neuer Dokumente",
      "state": "Rheinland-Pfalz",
      "amtsgericht": "Amtsgericht Montabaur",
      "registernummer": "HRB 20065",
      "registerart": "HRB",
      "company_name": "PLANOPTIK AG",
      "company_seat": "Elsoff-Mittelhofen",
      "details": "04.07.2025 (Bekanntmachungsdatum)\n\nRheinland-Pfalz Amtsgericht Montabaur HRB 20065\nEinreichung neuer Dokumente\n\nPLANOPTIK AG\nAktiengesellschaft\nElsoff-Mittelhofen\n\nDem Registergericht ist eine neue Liste der Mitglieder des Aufsichtsrates eingereicht worden."
    },
    {
      "date": "2025-07-04",
      "id": "114672",
      "original_text": "Registerbekanntmachung nach dem Umwandlungsgesetz\nRheinland-Pfalz Amtsgericht Ludwigshafen a.Rhein (Ludwigshafen) HRB 62262\nMC MANAGEMENT COOPERATION AG – Speyer",
      "type": "Registerbekanntmachung nach dem Umwandlungsgesetz",
      "state": "Rheinland-Pfalz",
      "amtsgericht": "Amtsgericht Ludwigshafen a.Rhein (Ludwigshafen)",
      "registernummer": "HRB 62262",
      "registerart": "HRB",
      "company_name": "MC MANAGEMENT COOPERATION AG",
      "company_seat": "Speyer",
      "details": "04.07.2025 (Bekanntmachungsdatum)\n\nRheinland-Pfalz Amtsgericht Ludwigshafen a.Rhein (Ludwigshafen) HRB 62262\nRegisterbekanntmachung nach dem Umwandlungsgesetz 04.07.2025 (Eintragungsdatum)\n\nMC MANAGEMENT COOPERATION AG\nAktiengesellschaft\nSpeyer\n\nAls nicht eingetragen wird veröffentlicht: Den Gläubigern der an der Verschmelzung beteiligten Rechtsträger ist, wenn sie binnen sechs Monaten nach dem Tag, an dem die Eintragung der Verschmelzung in das Register des Sitzes desjenigen Rechtsträgers, dessen Gläubiger sie sind, nach § 19 Abs. 3 UmwG als bekannt gemacht gilt, ihren Anspruch nach Grund und Höhe schriftlich anmelden, Sicherheit zu leisten, soweit sie nicht Befriedigung verlangen können. Dieses Recht steht den Gläubigern jedoch nur zu, wenn sie glaubhaft machen, dass durch die Verschmelzung die Erfüllung der Forderung gefährdet wird."
    },
    {
      "date": "2025-07-04",
      "id": "114673",
      "original_text": "Registerbekanntmachung nach dem Umwandlungsgesetz\nRheinland-Pfalz Amtsgericht Ludwigshafen a.Rhein (Ludwigshafen) HRA 62202\nAaron Marquardt e.K. – Ludwigshafen",
      "type": "Registerbekanntmachung nach dem Umwandlungsgesetz",
      "state": "Rheinland-Pfalz",
      "amtsgericht": "Amtsgericht Ludwigshafen a.Rhein (Ludwigshafen)",
      "registernummer": "HRA 62202",
      "registerart": "HRA",
      "company_name": "Aaron Marquardt e.K.",
      "company_seat": "Ludwigshafen",
      "details": "04.07.2025 (Bekanntmachungsdatum)\n\nRheinland-Pfalz Amtsgericht Ludwigshafen a.Rhein (Ludwigshafen) HRA 62202\nRegisterbekanntmachung nach dem Umwandlungsgesetz 04.07.2025 (Eintragungsdatum)\n\nAaron Marquardt e.K.\nEinzelkaufmann / Einzelkauffrau\nLudwigshafen\n\nAls nicht eingetragen wird veröffentlicht: Den Gläubigern der an der Ausgliederung beteiligten Rechtsträger ist, wenn sie binnen sechs Monaten nach dem Tag, an dem die Eintragung der Ausgliederung in das Register des Sitzes desjenigen Rechtsträgers,dessen Gläubiger sie sind, nach § 19 Abs. 3 UmwG als bekannt gemacht gilt, ihren Anspruch nach Grund und Höhe schriftlich anmelden, Sicherheit zu leisten, soweit sie nicht Befriedigung verlangen können. Dieses Recht steht den Gläubigern jedoch nur zu, wenn sie glaubhaft machen, dass durch die Ausgliederung die Erfüllung der Forderung gefährdet wird."
    },
    {
      "date": "2025-07-04",
      "id": "114674",
      "original_text": "Einreichung neuer Dokumente\nRheinland-Pfalz Amtsgericht Kaiserslautern HRB 11870\nBorgWarner Turbo Systems GmbH – Kirchheimbolanden",
      "type": "Einreichung neuer Dokumente",
      "state": "Rheinland-Pfalz",
      "amtsgericht": "Amtsgericht Kaiserslautern",
      "registernummer": "HRB 11870",
      "registerart": "HRB",
      "company_name": "BorgWarner Turbo Systems GmbH",
      "company_seat": "Kirchheimbolanden",
      "details": "04.07.2025 (Bekanntmachungsdatum)\n\nRheinland-Pfalz Amtsgericht Kaiserslautern HRB 11870\nEinreichung neuer Dokumente 04.07.2025 (Eintragungsdatum)\n\nBorgWarner Turbo Systems GmbH\nGesellschaft mit beschränkter Haftung\nKirchheimbolanden\n\nDem Registergericht ist eine neue Liste der Mitglieder des Aufsichtsrates eingereicht worden."
    },
    {
      "date": "2025-07-04",
      "id": "114675",
      "original_text": "Registerbekanntmachung nach dem Umwandlungsgesetz\nNordrhein-Westfalen Amtsgericht Düsseldorf HRB 36809\nDDB Düsseldorf GmbH – Düsseldorf",
      "type": "Registerbekanntmachung nach dem Umwandlungsgesetz",
      "state": "Nordrhein-Westfalen",
      "amtsgericht": "Amtsgericht Düsseldorf",
      "registernummer": "HRB 36809",
      "registerart": "HRB",
      "company_name": "DDB Düsseldorf GmbH",
      "company_seat": "Düsseldorf",
      "details": "04.07.2025 (Bekanntmachungsdatum)\n\nNordrhein-Westfalen Amtsgericht Düsseldorf HRB 36809\nRegisterbekanntmachung nach dem Umwandlungsgesetz 04.07.2025 (Eintragungsdatum)\n\nDDB Düsseldorf GmbH\nGesellschaft mit beschränkter Haftung\nDüsseldorf\n\nDen Gläubigern der an der Verschmelzung beteiligten Rechtsträger ist, wenn sie binnen sechs Monaten nach dem Tag, an dem die Eintragung der Verschmelzung in das Register des Sitzes desjenigen Rechtsträgers, dessen Gläubiger sie sind, nach § 19 Absatz 3 UmwG als bekanntgemacht gilt, ihren Anspruch nach Grund und Höhe schriftlich anmelden, Sicherheit zu leisten, soweit sie nicht Befriedigung verlangen können. Dieses Recht steht den Gläubigern jedoch nur zu, wenn sie glaubhaft machen, dass durch die Verschmelzung die Erfüllung ihrer Forderung gefährdet wird."
    },
    {
      "date": "2025-07-04",
      "id": "114676",
      "original_text": "Registerbekanntmachung nach dem Umwandlungsgesetz\nNordrhein-Westfalen Amtsgericht Gelsenkirchen HRB 6069\nMTE GmbH – Marl",
      "type": "Registerbekanntmachung nach dem Umwandlungsgesetz",
      "state": "Nordrhein-Westfalen",
      "amtsgericht": "Amtsgericht Gelsenkirchen",
      "registernummer": "HRB 6069",
      "registerart": "HRB",
      "company_name": "MTE GmbH",
      "company_seat": "Marl",
      "details": "04.07.2025 (Bekanntmachungsdatum)\n\nNordrhein-Westfalen Amtsgericht Gelsenkirchen HRB 6069\nRegisterbekanntmachung nach dem Umwandlungsgesetz 04.07.2025 (Eintragungsdatum)\n\nMTE GmbH\nGesellschaft mit beschränkter Haftung\nMarl\n\nDen Gläubigern der an der Verschmelzung beteiligten Rechtsträger ist, wenn sie binnen sechs Monaten nach dem Tag, an dem die Eintragung der Verschmelzung in das Register des Sitzes desjenigen Rechtsträgers, dessen Gläubiger sie sind, nach § 19 Absatz 3 UmwG als bekanntgemacht gilt, ihren Anspruch nach Grund und Höhe schriftlich anmelden, Sicherheit zu leisten, soweit sie nicht Befriedigung verlangen können. Dieses Recht steht den Gläubigern jedoch nur zu, wenn sie glaubhaft machen, dass durch die Verschmelzung die Erfüllung ihrer Forderung gefährdet wird."
    },
    {
      "date": "2025-07-04",
      "id": "114677",
      "original_text": "Löschungsankündigung\nNordrhein-Westfalen Amtsgericht Bad Oeynhausen HRA 10015\nGafnerImmo Holding UG (haftungsbeschränkt) & Co. KG – Kirchlengern",
      "type": "Löschungsankündigung",
      "state": "Nordrhein-Westfalen",
      "amtsgericht": "Amtsgericht Bad Oeynhausen",
      "registernummer": "HRA 10015",
      "registerart": "HRA",
      "company_name": "GafnerImmo Holding UG (haftungsbeschränkt) & Co. KG",
      "company_seat": "Kirchlengern",
      "details": "04.07.2025 (Bekanntmachungsdatum)\n\nNordrhein-Westfalen Amtsgericht Bad Oeynhausen HRA 10015\nLöschungsankündigung\n\nGafnerImmo Holding UG (haftungsbeschränkt) & Co. KG\nKommanditgesellschaft\nKirchlengern\n\nDas Registergericht beabsichtigt die Firma von Amts wegen nach §§ 6 Abs.1, 31 Abs.2 HGB, 393 FamFG zu löschen. Die Frist zur Erhebung eines Widerspruchs ist auf einen Monat festgesetzt."
    },
    {
      "date": "2025-07-04",
      "id": "114678",
      "original_text": "Registerbekanntmachung nach dem Umwandlungsgesetz\nNordrhein-Westfalen Amtsgericht Gelsenkirchen HRB 6164\nENDRES Gesellschaft mit beschränkter Haftung – Marl",
      "type": "Registerbekanntmachung nach dem Umwandlungsgesetz",
      "state": "Nordrhein-Westfalen",
      "amtsgericht": "Amtsgericht Gelsenkirchen",
      "registernummer": "HRB 6164",
      "registerart": "HRB",
      "company_name": "ENDRES Gesellschaft mit beschränkter Haftung",
      "company_seat": "Marl",
      "details": "04.07.2025 (Bekanntmachungsdatum)\n\nNordrhein-Westfalen Amtsgericht Gelsenkirchen HRB 6164\nRegisterbekanntmachung nach dem Umwandlungsgesetz 04.07.2025 (Eintragungsdatum)\n\nENDRES Gesellschaft mit beschränkter Haftung\nGesellschaft mit beschränkter Haftung\nMarl\n\nDen Gläubigern der an der Verschmelzung beteiligten Rechtsträger ist, wenn sie binnen sechs Monaten nach dem Tag, an dem die Eintragung der Verschmelzung in das Register des Sitzes desjenigen Rechtsträgers, dessen Gläubiger sie sind, nach § 19 Absatz 3 UmwG als bekanntgemacht gilt, ihren Anspruch nach Grund und Höhe schriftlich anmelden, Sicherheit zu leisten, soweit sie nicht Befriedigung verlangen können. Dieses Recht steht den Gläubigern jedoch nur zu, wenn sie glaubhaft machen, dass durch die Verschmelzung die Erfüllung ihrer Forderung gefährdet wird."
    },
    {
      "date": "2025-07-04",
      "id": "114679",
      "original_text": "Löschungsankündigung\nNordrhein-Westfalen Amtsgericht Hamm HRB 9901\nVier Verwaltung UG (haftungsbeschränkt) – Hamm",
      "type": "Löschungsankündigung",
      "state": "Nordrhein-Westfalen",
      "amtsgericht": "Amtsgericht Hamm",
      "registernummer": "HRB 9901",
      "registerart": "HRB",
      "company_name": "Vier Verwaltung UG (haftungsbeschränkt)",
      "company_seat": "Hamm",
      "details": "04.07.2025 (Bekanntmachungsdatum)\n\nNordrhein-Westfalen Amtsgericht Hamm HRB 9901\nLöschungsankündigung\n\nVier Verwaltung UG (haftungsbeschränkt)\nGesellschaft mit beschränkter Haftung\nHamm\n\nDas Registergericht beabsichtigt die Gesellschaft von Amts wegen nach § 394 FamFG zu löschen. Die Frist zur Erhebung eines Widerspruchs ist auf drei Monate festgesetzt."
    },
    {
      "date": "2025-07-04",
      "id": "114680",
      "original_text": "Löschungsankündigung\nNordrhein-Westfalen Amtsgericht Düsseldorf HRB 78663\nTaxiDus24 GmbH – Düsseldorf",
      "type": "Löschungsankündigung",
      "state": "Nordrhein-Westfalen",
      "amtsgericht": "Amtsgericht Düsseldorf",
      "registernummer": "HRB 78663",
      "registerart": "HRB",
      "company_name": "TaxiDus24 GmbH",
      "company_seat": "Düsseldorf",
      "details": "04.07.2025 (Bekanntmachungsdatum)\n\nNordrhein-Westfalen Amtsgericht Düsseldorf HRB 78663\nLöschungsankündigung\n\nTaxiDus24 GmbH\nGesellschaft mit beschränkter Haftung\nDüsseldorf\n\nDas Registergericht beabsichtigt die Gesellschaft von Amts wegen nach § 394 FamFG zu löschen. Die Frist zur Erhebung eines Widerspruchs ist auf 3 Wochen festgesetzt.\n\nRechtsbehelfsbelehrung:\nDas Widerspruchsrecht steht jedem zu, der an der Unterlassung der Löschung ein berechtigtes Interesse hat. Der Widerspruch ist bei dem Amtsgericht Düsseldorf -Registergericht-, Werdener Straße 1, 40227 Düsseldorf schriftlich in deutscher Sprache oder zur Niederschrift der Geschäftsstelle einzulegen. Der Widerspruch kann auch zur Niederschrift der Geschäftsstelle eines jeden Amtsgerichtes abgegeben werden. Die Einlegung ist auch durch Übertragung eines elektronischen Dokuments an die elektronische Poststelle des Gerichts möglich. Das elektronische Dokument muss für die Bearbeitung durch das Gericht geeignet und mit einer qualifizierten elektronischen Signatur der verantwortenden Person versehen sein oder von der verantwortenden Person signiert und auf einem sicheren Übermittlungsweg gemäß § 130a ZPO nach näherer Maßgabe der Verordnung über die technischen Rahmenbedingungen des elektronischen Rechtsverkehrs und über das besondere elektronische Behördenpostfach (BGBl. I, S.3803) eingereicht werden. Weitere Informationen erhalten Sie auf der Internetseite www.justiz.de.\nDer Widerspruch muss spätestens innerhalb der gesetzten Frist nach dem Datum der Bekanntmachung der Löschungsankündigung bei dem Amtsgericht - Registergericht - Düsseldorf eingegangen sein.  Dies gilt auch dann, wenn der Widerspruch zur Niederschrift der Geschäftsstelle eines anderen Amtsgerichtes abgegeben wurde. Die Frist beginnt mit dem Tage der Bekanntmachung der Löschungsankündigung in dem für die Bekanntmachung der Eintragungen in das Handelsregister bestimmten elektronischen Informations- und Kommunikationssystem nach § 10 des Handelsgesetzbuches. Fällt das Ende der Frist auf einen Sonntag, einen allgemeinen Feiertag oder Sonnabend, so endet die Frist mit Ablauf des nächsten Werktages.\nDer Widerspruch muss die Bezeichnung der angefochtenen Löschungsankündigung sowie die Erklärung enthalten, dass Widerspruch gegen diese Löschungsankündigung eingelegt wird. Er ist zu unterzeichnen und soll begründet werden."
    },
    {
      "date": "2025-07-04",
      "id": "114681",
      "original_text": "Löschungsankündigung\nNordrhein-Westfalen Amtsgericht Hamm HRA 100\nAbwicklungsgesellschaft KIFFE Hamm GmbH & Co. KG – Hamm",
      "type": "Löschungsankündigung",
      "state": "Nordrhein-Westfalen",
      "amtsgericht": "Amtsgericht Hamm",
      "registernummer": "HRA 100",
      "registerart": "HRA",
      "company_name": "Abwicklungsgesellschaft KIFFE Hamm GmbH & Co. KG",
      "company_seat": "Hamm",
      "details": "04.07.2025 (Bekanntmachungsdatum)\n\nNordrhein-Westfalen Amtsgericht Hamm HRA 100\nLöschungsankündigung\n\nAbwicklungsgesellschaft KIFFE Hamm GmbH & Co. KG\nKommanditgesellschaft\nHamm\n\nDas Registergericht beabsichtigt die Firma von Amts wegen nach § 394 FamFG zu löschen. Die Frist zur Erhebung eines Widerspruchs ist auf einen Monat festgesetzt."
    },
    {
      "date": "2025-07-04",
      "id": "114682",
      "original_text": "Löschungsankündigung\nNordrhein-Westfalen Amtsgericht Aachen HRB 20893\nStark Bauunternehmung GmbH – Stolberg",
      "type": "Löschungsankündigung",
      "state": "Nordrhein-Westfalen",
      "amtsgericht": "Amtsgericht Aachen",
      "registernummer": "HRB 20893",
      "registerart": "HRB",
      "company_name": "Stark Bauunternehmung GmbH",
      "company_seat": "Stolberg",
      "details": "04.07.2025 (Bekanntmachungsdatum)\n\nNordrhein-Westfalen Amtsgericht Aachen HRB 20893\nLöschungsankündigung\n\nStark Bauunternehmung GmbH\nGesellschaft mit beschränkter Haftung\nStolberg\n\nDas Registergericht beabsichtigt, von Amts wegen die Gesellschaft wegen Vermögenslosigkeit nach § 394 FamFG zu löschen, weil das Insolvenzverfahren Amtsgericht Aachen (Az.: 93 IN 102/19) beendet und Vermögen der Gesellschaft nicht mehr erkennbar ist.\n\nZur Geltendmachung des Widerspruchs gegen die beabsichtigte Löschung wird hiermit eine Frist von einem Monat ab Veröffentlichung dieser Ankündigung bestimmt.\n\nRechtsbehelfsbelehrung:\n\nGegen diese Verfügung kann Widerspruch eingelegt werden. Zum Widerspruch ist jeder berechtigt, der an der Unterlassung der Löschung ein berechtigtes Interesse hat.\n\nDer Widerspruch ist bei dem Amtsgericht Aachen, Adalbertsteinweg 92, 52070 Aachen schriftlich in deutscher Sprache oder zur Niederschrift der Geschäftsstelle einzulegen. Der Widerspruch kann auch zur Niederschrift der Geschäftsstelle eines jeden Amtsgerichtes abgegeben werden.\n\nDer Widerspruch muss spätestens innerhalb der gesetzten Frist nach der Bekanntgabe der Verfügung bei dem Amtsgericht Aachen eingegangen sein. Dies gilt auch dann, wenn der Widerspruch zur Niederschrift der Geschäftsstelle eines anderen Amtsgerichtes abgegeben wurde. Die Frist beginnt mit der Bekanntgabe der Verfügung durch Veröffentlichung. Fällt das Ende der Frist auf einen Sonntag, einen allgemeinen Feiertag oder Sonnabend, so endet die Frist mit Ablauf des nächsten Werktages.\n\nDer Widerspruch muss die Bezeichnung der angefochtenen Verfügung sowie die Erklärung enthalten, dass Widerspruch gegen diese Verfügung eingelegt wird. Er ist zu unterzeichnen und soll begründet werden.\n\nDie Einlegung ist auch durch Übertragung eines elektronischen Dokuments an die elektronische Poststelle des Gerichts möglich. Das elektronische Dokument muss für die Bearbeitung durch das Gericht geeignet und mit einer qualifizierten elektronischen Signatur der verantwortenden Person versehen sein oder von der verantwortenden Person signiert und auf einem sicheren Übermittlungsweg gemäß § 130 a ZPO nach näherer Maßgabe der Verordnung über die technischen Rahmenbedingungen des elektronischen Rechtsverkehrs und über das besondere elektronische Behördenpostfach (BGBl. I, S. 3803) eingereicht werden. Weitere Informationen erhalten Sie auf der Internetseite www.justiz.de."
    },
    {
      "date": "2025-07-04",
      "id": "114683",
      "original_text": "Registerbekanntmachung nach dem Umwandlungsgesetz\nBremen Amtsgericht Bremen HRB 41617\nAm Geestebogen GmbH – Bremerhaven",
      "type": "Registerbekanntmachung nach dem Umwandlungsgesetz",
      "state": "Bremen",
      "amtsgericht": "Amtsgericht Bremen",
      "registernummer": "HRB 41617",
      "registerart": "HRB",
      "company_name": "Am Geestebogen GmbH",
      "company_seat": "Bremerhaven",
      "details": "04.07.2025 (Bekanntmachungsdatum)\n\nBremen Amtsgericht Bremen HRB 41617\nRegisterbekanntmachung nach dem Umwandlungsgesetz 27.06.2025 (Eintragungsdatum)\n\nAm Geestebogen GmbH\nGesellschaft mit beschränkter Haftung\nBremerhaven\n\nZu Eintragungsnummer 1 vom 27.06.2025 wird als nicht eingetragen veröffentlicht: Den Gläubigern der an der Spaltung beteiligten Rechtsträger ist, wenn sie binnen sechs Monaten nach dem Tag, an dem die Eintragung der Spaltung in das Register des Sitzes desjenigen Rechtsträgers, dessen Gläubiger sie sind, als bekannt gemacht gilt, ihren Anspruch nach Grund und Höhe schriftlich anmelden, Sicherheit zu leisten, soweit sie nicht Befriedigung verlangen können. Dieses Recht steht den Gläubigern jedoch nur zu, wenn sie glaubhaft machen, dass durch die Spaltung die Erfüllung ihrer Forderung gefährdet wird. Das Recht, Sicherheitsleistung zu verlangen, steht Gläubigern nicht zu, die im Falle der Insolvenz ein Recht auf vorzugsweise Befriedigung aus einer Deckungsmasse haben, die nach gesetzlicher Vorschrift zu ihrem Schutz errichtet und staatlich überwacht ist."
    },
    {
      "date": "2025-07-04",
      "id": "114684",
      "original_text": "Registerbekanntmachung nach dem Umwandlungsgesetz\nNordrhein-Westfalen Amtsgericht Düsseldorf HRA 16023\nGünther Schramm e.K. Inhaber Jörg Schröder – Langenfeld",
      "type": "Registerbekanntmachung nach dem Umwandlungsgesetz",
      "state": "Nordrhein-Westfalen",
      "amtsgericht": "Amtsgericht Düsseldorf",
      "registernummer": "HRA 16023",
      "registerart": "HRA",
      "company_name": "Günther Schramm e.K. Inhaber Jörg Schröder",
      "company_seat": "Langenfeld",
      "details": "04.07.2025 (Bekanntmachungsdatum)\n\nNordrhein-Westfalen Amtsgericht Düsseldorf HRA 16023\nRegisterbekanntmachung nach dem Umwandlungsgesetz 04.07.2025 (Eintragungsdatum)\n\nGünther Schramm e.K. Inhaber Jörg Schröder\nEinzelkaufmann / Einzelkauffrau\nLangenfeld\n\nDen Gläubigern der an der Ausgliederung beteiligten Rechtsträger ist, wenn sie binnen sechs Monaten nach dem Tag, an dem die Eintragung der Ausgliederung in das Register des Sitzes desjenigen Rechtsträgers, dessen Gläubiger sie sind, nach § 19 Absatz 3 UmwG als bekanntgemacht gilt, ihren Anspruch nach Grund und Höhe schriftlich anmelden, Sicherheit zu leisten, soweit sie nicht Befriedigung verlangen können. Dieses Recht steht den Gläubigern jedoch nur zu, wenn sie glaubhaft machen, dass durch die Ausgliederung die Erfüllung ihrer Forderung gefährdet wird."
    },
    {
      "date": "2025-07-04",
      "id": "114685",
      "original_text": "Registerbekanntmachung nach dem Umwandlungsgesetz\nNordrhein-Westfalen Amtsgericht Bielefeld HRB 41016\nSEK-Management GmbH – Schloß Holte-Stukenbrock",
      "type": "Registerbekanntmachung nach dem Umwandlungsgesetz",
      "state": "Nordrhein-Westfalen",
      "amtsgericht": "Amtsgericht Bielefeld",
      "registernummer": "HRB 41016",
      "registerart": "HRB",
      "company_name": "SEK-Management GmbH",
      "company_seat": "Schloß Holte-Stukenbrock",
      "details": "04.07.2025 (Bekanntmachungsdatum)\n\nNordrhein-Westfalen Amtsgericht Bielefeld HRB 41016\nRegisterbekanntmachung nach dem Umwandlungsgesetz 04.07.2025 (Eintragungsdatum)\n\nSEK-Management GmbH\nGesellschaft mit beschränkter Haftung\nSchloß Holte-Stukenbrock\n\nDen Gläubigern der an der Verschmelzung beteiligten Rechtsträger ist, wenn sie binnen sechs Monaten nach dem Tag, an dem die Eintragung der Verschmelzung in das Register des Sitzes desjenigen Rechtsträgers, dessen Gläubiger sie sind, nach § 19 Absatz 3 UmwG als bekanntgemacht gilt, ihren Anspruch nach Grund und Höhe schriftlich anmelden, Sicherheit zu leisten, soweit sie nicht Befriedigung verlangen können. Dieses Recht steht den Gläubigern jedoch nur zu, wenn sie glaubhaft machen, dass durch die Verschmelzung die Erfüllung ihrer Forderung gefährdet wird."
    },
    {
      "date": "2025-07-04",
      "id": "114686",
      "original_text": "Registerbekanntmachung nach dem Umwandlungsgesetz\nNordrhein-Westfalen Amtsgericht Bielefeld HRB 40772\nMIG Management GmbH – Schloß Holte-Stukenbrock",
      "type": "Registerbekanntmachung nach dem Umwandlungsgesetz",
      "state": "Nordrhein-Westfalen",
      "amtsgericht": "Amtsgericht Bielefeld",
      "registernummer": "HRB 40772",
      "registerart": "HRB",
      "company_name": "MIG Management GmbH",
      "company_seat": "Schloß Holte-Stukenbrock",
      "details": "04.07.2025 (Bekanntmachungsdatum)\n\nNordrhein-Westfalen Amtsgericht Bielefeld HRB 40772\nRegisterbekanntmachung nach dem Umwandlungsgesetz 04.07.2025 (Eintragungsdatum)\n\nMIG Management GmbH\nGesellschaft mit beschränkter Haftung\nSchloß Holte-Stukenbrock\n\nDen Gläubigern der an der Verschmelzung beteiligten Rechtsträger ist, wenn sie binnen sechs Monaten nach dem Tag, an dem die Eintragung der Verschmelzung in das Register des Sitzes desjenigen Rechtsträgers, dessen Gläubiger sie sind, nach § 19 Absatz 3 UmwG als bekanntgemacht gilt, ihren Anspruch nach Grund und Höhe schriftlich anmelden, Sicherheit zu leisten, soweit sie nicht Befriedigung verlangen können. Dieses Recht steht den Gläubigern jedoch nur zu, wenn sie glaubhaft machen, dass durch die Verschmelzung die Erfüllung ihrer Forderung gefährdet wird."
    },
    {
      "date": "2025-07-04",
      "id": "114687",
      "original_text": "Registerbekanntmachung nach dem Umwandlungsgesetz\nNordrhein-Westfalen Amtsgericht Steinfurt HRB 14665\nThemaX Holding GmbH – Rheine",
      "type": "Registerbekanntmachung nach dem Umwandlungsgesetz",
      "state": "Nordrhein-Westfalen",
      "amtsgericht": "Amtsgericht Steinfurt",
      "registernummer": "HRB 14665",
      "registerart": "HRB",
      "company_name": "ThemaX Holding GmbH",
      "company_seat": "Rheine",
      "details": "04.07.2025 (Bekanntmachungsdatum)\n\nNordrhein-Westfalen Amtsgericht Steinfurt HRB 14665\nRegisterbekanntmachung nach dem Umwandlungsgesetz 04.07.2025 (Eintragungsdatum)\n\nThemaX Holding GmbH\nGesellschaft mit beschränkter Haftung\nRheine\n\nDen Gläubigern der an der Verschmelzung beteiligten Rechtsträger ist, wenn sie binnen sechs Monaten nach dem Tag, an dem die Eintragung der Verschmelzung in das Register des Sitzes desjenigen Rechtsträgers, dessen Gläubiger sie sind, nach § 19 Absatz 3 UmwG als bekanntgemacht gilt, ihren Anspruch nach Grund und Höhe schriftlich anmelden, Sicherheit zu leisten, soweit sie nicht Befriedigung verlangen können. Dieses Recht steht den Gläubigern jedoch nur zu, wenn sie glaubhaft machen, dass durch die Verschmelzung die Erfüllung ihrer Forderung gefährdet wird."
    },
    {
      "date": "2025-07-04",
      "id": "114688",
      "original_text": "Registerbekanntmachung nach dem Umwandlungsgesetz\nNordrhein-Westfalen Amtsgericht Köln HRB 58848\nSMS Handels- und Vermietungsgesellschaft für Kraftfahrzeuge mbH – Köln",
      "type": "Registerbekanntmachung nach dem Umwandlungsgesetz",
      "state": "Nordrhein-Westfalen",
      "amtsgericht": "Amtsgericht Köln",
      "registernummer": "HRB 58848",
      "registerart": "HRB",
      "company_name": "SMS Handels- und Vermietungsgesellschaft für Kraftfahrzeuge mbH",
      "company_seat": "Köln",
      "details": "04.07.2025 (Bekanntmachungsdatum)\n\nNordrhein-Westfalen Amtsgericht Köln HRB 58848\nRegisterbekanntmachung nach dem Umwandlungsgesetz 04.07.2025 (Eintragungsdatum)\n\nSMS Handels- und Vermietungsgesellschaft für Kraftfahrzeuge mbH\nGesellschaft mit beschränkter Haftung\nKöln\n\nDen Gläubigern der an der Verschmelzung beteiligten Rechtsträger ist, wenn sie binnen sechs Monaten nach dem Tag, an dem die Eintragung der Verschmelzung in das Register des Sitzes desjenigen Rechtsträgers, dessen Gläubiger sie sind, nach § 19 Absatz 3 UmwG als bekanntgemacht gilt, ihren Anspruch nach Grund und Höhe schriftlich anmelden, Sicherheit zu leisten, soweit sie nicht Befriedigung verlangen können. Dieses Recht steht den Gläubigern jedoch nur zu, wenn sie glaubhaft machen, dass durch die Verschmelzung die Erfüllung ihrer Forderung gefährdet wird."
    },
    {
      "date": "2025-07-04",
      "id": "114689",
      "original_text": "Registerbekanntmachung nach dem Umwandlungsgesetz\nNordrhein-Westfalen Amtsgericht Essen HRB 31164\nBildenhouse GmbH – Essen",
      "type": "Registerbekanntmachung nach dem Umwandlungsgesetz",
      "state": "Nordrhein-Westfalen",
      "amtsgericht": "Amtsgericht Essen",
      "registernummer": "HRB 31164",
      "registerart": "HRB",
      "company_name": "Bildenhouse GmbH",
      "company_seat": "Essen",
      "details": "04.07.2025 (Bekanntmachungsdatum)\n\nNordrhein-Westfalen Amtsgericht Essen HRB 31164\nRegisterbekanntmachung nach dem Umwandlungsgesetz 04.07.2025 (Eintragungsdatum)\n\nBildenhouse GmbH\nGesellschaft mit beschränkter Haftung\nEssen\n\nDen Gläubigern der an der Verschmelzung beteiligten Rechtsträger ist, wenn sie binnen sechs Monaten nach dem Tag, an dem die Eintragung der Verschmelzung in das Register des Sitzes desjenigen Rechtsträgers, dessen Gläubiger sie sind, nach § 19 Absatz 3 UmwG als bekanntgemacht gilt, ihren Anspruch nach Grund und Höhe schriftlich anmelden, Sicherheit zu leisten, soweit sie nicht Befriedigung verlangen können. Dieses Recht steht den Gläubigern jedoch nur zu, wenn sie glaubhaft machen, dass durch die Verschmelzung die Erfüllung ihrer Forderung gefährdet wird."
    },
    {
      "date": "2025-07-04",
      "id": "114690",
      "original_text": "Registerbekanntmachung nach dem Umwandlungsgesetz\nNordrhein-Westfalen Amtsgericht Düsseldorf HRB 74140\nCWT Immobilienmanagement UG (haftungsbeschränkt) – Düsseldorf",
      "type": "Registerbekanntmachung nach dem Umwandlungsgesetz",
      "state": "Nordrhein-Westfalen",
      "amtsgericht": "Amtsgericht Düsseldorf",
      "registernummer": "HRB 74140",
      "registerart": "HRB",
      "company_name": "CWT Immobilienmanagement UG (haftungsbeschränkt)",
      "company_seat": "Düsseldorf",
      "details": "04.07.2025 (Bekanntmachungsdatum)\n\nNordrhein-Westfalen Amtsgericht Düsseldorf HRB 74140\nRegisterbekanntmachung nach dem Umwandlungsgesetz 04.07.2025 (Eintragungsdatum)\n\nCWT Immobilienmanagement UG (haftungsbeschränkt)\nGesellschaft mit beschränkter Haftung\nDüsseldorf\n\nDen Gläubigern der an der Verschmelzung beteiligten Rechtsträger ist, wenn sie binnen sechs Monaten nach dem Tag, an dem die Eintragung der Verschmelzung in das Register des Sitzes desjenigen Rechtsträgers, dessen Gläubiger sie sind, nach § 19 Absatz 3 UmwG als bekanntgemacht gilt, ihren Anspruch nach Grund und Höhe schriftlich anmelden, Sicherheit zu leisten, soweit sie nicht Befriedigung verlangen können. Dieses Recht steht den Gläubigern jedoch nur zu, wenn sie glaubhaft machen, dass durch die Verschmelzung die Erfüllung ihrer Forderung gefährdet wird."
    },
    {
      "date": "2025-07-04",
      "id": "114691",
      "original_text": "Löschungsankündigung\nNordrhein-Westfalen Amtsgericht Wuppertal HRB 26297\nEu-Best Handelsservice GmbH – Wuppertal",
      "type": "Löschungsankündigung",
      "state": "Nordrhein-Westfalen",
      "amtsgericht": "Amtsgericht Wuppertal",
      "registernummer": "HRB 26297",
      "registerart": "HRB",
      "company_name": "Eu-Best Handelsservice GmbH",
      "company_seat": "Wuppertal",
      "details": "04.07.2025 (Bekanntmachungsdatum)\n\nNordrhein-Westfalen Amtsgericht Wuppertal HRB 26297\nLöschungsankündigung\n\nEu-Best Handelsservice GmbH\nGesellschaft mit beschränkter Haftung\nWuppertal\n\nDas Registergericht beabsichtigt die Gesellschaft von Amts wegen nach § 394 FamFG zu löschen. Die Frist zur Erhebung eines Widerspruchs ist auf einen Monat festgesetzt."
    },
    {
      "date": "2025-07-04",
      "id": "114692",
      "original_text": "Registerbekanntmachung nach dem Umwandlungsgesetz\nThüringen Amtsgericht Jena HRB 522705\nKöhler Fliegengitter GmbH – Mellingen",
      "type": "Registerbekanntmachung nach dem Umwandlungsgesetz",
      "state": "Thüringen",
      "amtsgericht": "Amtsgericht Jena",
      "registernummer": "HRB 522705",
      "registerart": "HRB",
      "company_name": "Köhler Fliegengitter GmbH",
      "company_seat": "Mellingen",
      "details": "04.07.2025 (Bekanntmachungsdatum)\n\nThüringen Amtsgericht Jena HRB 522705\nRegisterbekanntmachung nach dem Umwandlungsgesetz 04.07.2025 (Eintragungsdatum)\n\nKöhler Fliegengitter GmbH\nGesellschaft mit beschränkter Haftung\nMellingen\n\nDie Gesellschaft hat im Wege der Ausgliederung gemäß Ausgliederungsvertrag vom 25.04.2025 sowie Beschluss ihrer Gesellschafterversammlung vom 25.04.2025 das Vermögen von der Insektenschutz Stefan Köhler e.K. mit dem Sitz in Mellingen (Amtsgericht Jena HRA 506914) übernommen. Die Ausgliederung ist mit zeitgleicher Eintragung im Register des Sitzes des übertragenden Rechtsträgers wirksam geworden.\nNicht eingetragen: Den Gläubigern der an der Ausgliederung beteiligten Rechtsträger, ist wenn sie binnen sechs Monaten nach dem Tag, an dem die Eintragung der Ausgliederung in das Register des Sitzes desjenigen Rechtsträgers, dessen Gläubiger sie sind, nach §§125, 19 Abs. 3 UmwG als bekanntgemacht gilt, ihren Anspruch nach Grund und Höhe schriftlich anmelden, Sicherheit zu leisten, soweit sie nicht Befriedigung verlangen können. Dieses Recht steht ihnen jedoch nur zu, wenn sie glaubhaft machen, daß durch die Ausgliederung die Erfüllung ihrer Forderung gefährdet wird."
    },
    {
      "date": "2025-07-04",
      "id": "114693",
      "original_text": "Registerbekanntmachung nach dem Umwandlungsgesetz\nThüringen Amtsgericht Jena HRA 506914\nInsektenschutz Stefan Köhler e.K. – Mellingen",
      "type": "Registerbekanntmachung nach dem Umwandlungsgesetz",
      "state": "Thüringen",
      "amtsgericht": "Amtsgericht Jena",
      "registernummer": "HRA 506914",
      "registerart": "HRA",
      "company_name": "Insektenschutz Stefan Köhler e.K.",
      "company_seat": "Mellingen",
      "details": "04.07.2025 (Bekanntmachungsdatum)\n\nThüringen Amtsgericht Jena HRA 506914\nRegisterbekanntmachung nach dem Umwandlungsgesetz 04.07.2025 (Eintragungsdatum)\n\nInsektenschutz Stefan Köhler e.K.\nEinzelkaufmann / Einzelkauffrau\nMellingen\n\nDas von dem Einzelkaufmann Köhler, Stefan, Bad Berka, *16.08.1984 unter der Firma Insektenschutz Stefan Köhler e.K. mit dem Sitz in Mellingen betriebene Unternehmen ist aus dem Vermögen gemäß Ausgliederungsvertrag vom 25.04.2025 auf die Köhler Fliegengitter GmbH mit dem Sitz in Mellingen (Amtsgericht Jena HRB 522705) ausgegliedert. Die Firma ist erloschen. Von Amts wegen eingetragen aufgrund § 155 UmwG.\nNicht eingetragen: Den Gläubigern der an der Ausgliederung beteiligten Rechtsträger, ist wenn sie binnen sechs Monaten nach dem Tag, an dem die Eintragung der Ausgliederung in das Register des Sitzes desjenigen Rechtsträgers, dessen Gläubiger sie sind, nach §§125, 19 Abs. 3 UmwG als bekanntgemacht gilt, ihren Anspruch nach Grund und Höhe schriftlich anmelden, Sicherheit zu leisten, soweit sie nicht Befriedigung verlangen können. Dieses Recht steht ihnen jedoch nur zu, wenn sie glaubhaft machen, daß durch die Ausgliederung die Erfüllung ihrer Forderung gefährdet wird."
    },
    {
      "date": "2025-07-04",
      "id": "114694",
      "original_text": "Registerbekanntmachung nach dem Umwandlungsgesetz\nThüringen Amtsgericht Jena HRB 511632\nImmobilienbüro Gundhild Hennicke UG (haftungsbeschränkt) – Arnstadt",
      "type": "Registerbekanntmachung nach dem Umwandlungsgesetz",
      "state": "Thüringen",
      "amtsgericht": "Amtsgericht Jena",
      "registernummer": "HRB 511632",
      "registerart": "HRB",
      "company_name": "Immobilienbüro Gundhild Hennicke UG (haftungsbeschränkt)",
      "company_seat": "Arnstadt",
      "details": "04.07.2025 (Bekanntmachungsdatum)\n\nThüringen Amtsgericht Jena HRB 511632\nRegisterbekanntmachung nach dem Umwandlungsgesetz 04.07.2025 (Eintragungsdatum)\n\nImmobilienbüro Gundhild Hennicke UG (haftungsbeschränkt)\nGesellschaft mit beschränkter Haftung\nArnstadt\n\nDie Gesellschaft ist aufgrund des Verschmelzungsvertrages vom 21.08.2024, mit Nachtrag vom 25.11.2024 und 15.05.2025 sowie der Beschlüsse der Gesellschafterversammlung von den selben Tagen mit dem Vermögen des Alleingesellschafterin Hennicke, Gundhild Ulrike, Arnstadt, *12.03.1957 verschmolzen. Das Unternehmen wird als Einzelfirma unter der Firma Gundhild Hennicke mit dem Sitz in Arnstadt geführt.\nicht eingetragen: Den Gläubigern der an der Verschmelzung beteiligten Rechtsträger, ist wenn sie binnen sechs Monaten nach dem Tag, an dem die Eintragung der Verschmelzung in das Register des Sitzes desjenigen Rechtsträgers, dessen Gläubiger sie sind,  nach § 19 Abs. 3 UmwG als bekanntgemacht gilt, ihren Anspruch nach Grund und Höhe schriftlich anmelden, Sicherheit zu leisten, soweit sie nicht Befriedigung verlangen können. Dieses Recht steht ihnen jedoch nur zu, wenn sie glaubhaft machen, daß durch die Verschmelzung die Erfüllung ihrer Forderung gefährdet wird."
    },
    {
      "date": "2025-07-04",
      "id": "114695",
      "original_text": "Registerbekanntmachung nach dem Umwandlungsgesetz\nHessen Amtsgericht Frankfurt am Main HRB 53505\nCA Immo Deutschland GmbH – Frankfurt am Main",
      "type": "Registerbekanntmachung nach dem Umwandlungsgesetz",
      "state": "Hessen",
      "amtsgericht": "Amtsgericht Frankfurt am Main",
      "registernummer": "HRB 53505",
      "registerart": "HRB",
      "company_name": "CA Immo Deutschland GmbH",
      "company_seat": "Frankfurt am Main",
      "details": "04.07.2025 (Bekanntmachungsdatum)\n\nHessen Amtsgericht Frankfurt am Main HRB 53505\nRegisterbekanntmachung nach dem Umwandlungsgesetz 04.07.2025 (Eintragungsdatum)\n\nCA Immo Deutschland GmbH\nGesellschaft mit beschränkter Haftung\nFrankfurt am Main\n\nDen Gläubigern der an der Ausgliederung beteiligten Rechtsträger ist, wenn sie binnen sechs Monaten nach dem Tag, an dem die Eintragung der Ausgliederung in das Register des Sitzes desjenigen Rechtsträgers, dessen Gläubiger sie sind, nach §§ 125, 19 Absatz 3 UmwG bekannt gemacht worden ist, ihren Anspruch nach Grund und Höhe schriftlich anmelden, Sicherheit zu leisten, soweit sie nicht Befriedigung verlangen können. Dieses Recht steht den Gläubigern jedoch nur zu, wenn sie glaubhaft machen, dass durch die Ausgliederung die Erfüllung ihrer Forderung gefährdet wird."
    },
    {
      "date": "2025-07-04",
      "id": "114696",
      "original_text": "Registerbekanntmachung nach dem Umwandlungsgesetz\nHessen Amtsgericht Frankfurt am Main HRB 77169\nCorestate Capital Advisors GmbH – Frankfurt am Main",
      "type": "Registerbekanntmachung nach dem Umwandlungsgesetz",
      "state": "Hessen",
      "amtsgericht": "Amtsgericht Frankfurt am Main",
      "registernummer": "HRB 77169",
      "registerart": "HRB",
      "company_name": "Corestate Capital Advisors GmbH",
      "company_seat": "Frankfurt am Main",
      "details": "04.07.2025 (Bekanntmachungsdatum)\n\nHessen Amtsgericht Frankfurt am Main HRB 77169\nRegisterbekanntmachung nach dem Umwandlungsgesetz 04.07.2025 (Eintragungsdatum)\n\nCorestate Capital Advisors GmbH\nGesellschaft mit beschränkter Haftung\nFrankfurt am Main\n\nDen Gläubigern der an der Verschmelzung beteiligten Rechtsträger ist, wenn sie binnen sechs Monaten nach dem Tag, an dem die Eintragung der Verschmelzung in das Register des Sitzes desjenigen Rechtsträgers, dessen Gläubiger sie sind, nach § 19 Absatz 3 UmwG bekannt gemacht worden ist, ihren Anspruch nach Grund und Höhe schriftlich anmelden, Sicherheit zu leisten, soweit sie nicht Befriedigung verlangen können. Dieses Recht steht den Gläubigern jedoch nur zu, wenn sie glaubhaft machen, dass durch die Verschmelzung die Erfüllung ihrer Forderung gefährdet wird."
    },
    {
      "date": "2025-07-04",
      "id": "114697",
      "original_text": "Registerbekanntmachung nach dem Umwandlungsgesetz\nHessen Amtsgericht Frankfurt am Main HRB 28163\nNestlé Deutschland Aktiengesellschaft – Frankfurt am Main",
      "type": "Registerbekanntmachung nach dem Umwandlungsgesetz",
      "state": "Hessen",
      "amtsgericht": "Amtsgericht Frankfurt am Main",
      "registernummer": "HRB 28163",
      "registerart": "HRB",
      "company_name": "Nestlé Deutschland Aktiengesellschaft",
      "company_seat": "Frankfurt am Main",
      "details": "04.07.2025 (Bekanntmachungsdatum)\n\nHessen Amtsgericht Frankfurt am Main HRB 28163\nRegisterbekanntmachung nach dem Umwandlungsgesetz 04.07.2025 (Eintragungsdatum)\n\nNestlé Deutschland Aktiengesellschaft\nAktiengesellschaft\nFrankfurt am Main\n\nDen Gläubigern der an der Verschmelzung beteiligten Rechtsträger ist, wenn sie binnen sechs Monaten nach dem Tag, an dem die Eintragung der Verschmelzung in das Register des Sitzes desjenigen Rechtsträgers, dessen Gläubiger sie sind, nach § 19 Absatz 3 UmwG bekannt gemacht worden ist, ihren Anspruch nach Grund und Höhe schriftlich anmelden, Sicherheit zu leisten, soweit sie nicht Befriedigung verlangen können. Dieses Recht steht den Gläubigern jedoch nur zu, wenn sie glaubhaft machen, dass durch die Verschmelzung die Erfüllung ihrer Forderung gefährdet wird."
    },
    {
      "date": "2025-07-04",
      "id": "114698",
      "original_text": "Einreichung neuer Dokumente\nHessen Amtsgericht Hanau HRB 1125\nHanauer Parkhaus GmbH – Hanau",
      "type": "Einreichung neuer Dokumente",
      "state": "Hessen",
      "amtsgericht": "Amtsgericht Hanau",
      "registernummer": "HRB 1125",
      "registerart": "HRB",
      "company_name": "Hanauer Parkhaus GmbH",
      "company_seat": "Hanau",
      "details": "04.07.2025 (Bekanntmachungsdatum)\n\nHessen Amtsgericht Hanau HRB 1125\nEinreichung neuer Dokumente\n\nHanauer Parkhaus GmbH\nGesellschaft mit beschränkter Haftung\nHanau\n\nDurch eine Änderung in den Personen der Aufsichtsratsmitglieder ist eine Liste der Mitglieder des Aufsichtsrates zum Handelsregister eingereicht worden."
    },
    {
      "date": "2025-07-04",
      "id": "114699",
      "original_text": "Einreichung neuer Dokumente\nHessen Amtsgericht Frankfurt am Main HRB 132494\nKanAm Grund Real Estate Asset Services GmbH – Frankfurt am Main",
      "type": "Einreichung neuer Dokumente",
      "state": "Hessen",
      "amtsgericht": "Amtsgericht Frankfurt am Main",
      "registernummer": "HRB 132494",
      "registerart": "HRB",
      "company_name": "KanAm Grund Real Estate Asset Services GmbH",
      "company_seat": "Frankfurt am Main",
      "details": "04.07.2025 (Bekanntmachungsdatum)\n\nHessen Amtsgericht Frankfurt am Main HRB 132494\nEinreichung neuer Dokumente 04.07.2025 (Eintragungsdatum)\n\nKanAm Grund Real Estate Asset Services GmbH\nGesellschaft mit beschränkter Haftung\nFrankfurt am Main\n\nDurch eine Änderung in den Personen der Aufsichtsratsmitglieder ist eine Liste der Mitglieder des Aufsichtsrates zum Handelsregister eingereicht worden."
    },
    {
      "date": "2025-07-04",
      "id": "114700",
      "original_text": "Einreichung neuer Dokumente\nHessen Amtsgericht Friedberg HRB 1434\nSUBARU-Deutschland Gesellschaft mit beschränkter Haftung – Friedberg",
      "type": "Einreichung neuer Dokumente",
      "state": "Hessen",
      "amtsgericht": "Amtsgericht Friedberg",
      "registernummer": "HRB 1434",
      "registerart": "HRB",
      "company_name": "SUBARU-Deutschland Gesellschaft mit beschränkter Haftung",
      "company_seat": "Friedberg",
      "details": "04.07.2025 (Bekanntmachungsdatum)\n\nHessen Amtsgericht Friedberg HRB 1434\nEinreichung neuer Dokumente 04.07.2025 (Eintragungsdatum)\n\nSUBARU-Deutschland Gesellschaft mit beschränkter Haftung\nGesellschaft mit beschränkter Haftung\nFriedberg\n\nDurch eine Änderung in den Personen der Aufsichtsratsmitglieder ist eine Liste der Mitglieder des Aufsichtsrates zum Handelsregister eingereicht worden."
    },
    {
      "date": "2025-07-04",
      "id": "114701",
      "original_text": "Sonstige Registerbekanntmachung\nHessen Amtsgericht Darmstadt VR 941\nAltherrenverband der Technischen Verbindung Teutonia an der Staatlichen Ingenieurschule, Darmstadt, eingetragener Verein – Darmstadt",
      "type": "Sonstige Registerbekanntmachung",
      "state": "Hessen",
      "amtsgericht": "Amtsgericht Darmstadt",
      "registernummer": "VR 941",
      "registerart": "VR",
      "company_name": "Altherrenverband der Technischen Verbindung Teutonia an der Staatlichen Ingenieurschule, Darmstadt, eingetragener Verein",
      "company_seat": "Darmstadt",
      "details": "04.07.2025 (Bekanntmachungsdatum)\n\nHessen Amtsgericht Darmstadt VR 941\nSonstige Registerbekanntmachung 04.07.2025 (Eintragungsdatum)\n\nAltherrenverband der Technischen Verbindung Teutonia an der Staatlichen Ingenieurschule, Darmstadt, eingetragener Verein\neingetragener Verein\nDarmstadt\n\nDer Verein ist aufgelöst."
    },
    {
      "date": "2025-07-04",
      "id": "114702",
      "original_text": "Löschungsankündigung\nHessen Amtsgericht Wiesbaden VR 4036\nVolksbildungswerk Hochheim/Main e.V. – Hochheim am Main",
      "type": "Löschungsankündigung",
      "state": "Hessen",
      "amtsgericht": "Amtsgericht Wiesbaden",
      "registernummer": "VR 4036",
      "registerart": "VR",
      "company_name": "Volksbildungswerk Hochheim/Main e.V.",
      "company_seat": "Hochheim am Main",
      "details": "04.07.2025 (Bekanntmachungsdatum)\n\nHessen Amtsgericht Wiesbaden VR 4036\nLöschungsankündigung 04.07.2025 (Eintragungsdatum)\n\nVolksbildungswerk Hochheim/Main e.V.\neingetragener Verein\nHochheim am Main\n\nDer Verein ist aufgelöst."
    },
    {
      "date": "2025-07-04",
      "id": "114703",
      "original_text": "Einreichung neuer Dokumente\nHessen Amtsgericht Kassel HRB 3972\nSMA Solar Technology AG – Niestetal",
      "type": "Einreichung neuer Dokumente",
      "state": "Hessen",
      "amtsgericht": "Amtsgericht Kassel",
      "registernummer": "HRB 3972",
      "registerart": "HRB",
      "company_name": "SMA Solar Technology AG",
      "company_seat": "Niestetal",
      "details": "04.07.2025 (Bekanntmachungsdatum)\n\nHessen Amtsgericht Kassel HRB 3972\nEinreichung neuer Dokumente\n\nSMA Solar Technology AG\nAktiengesellschaft\nNiestetal\n\nDurch eine Änderung in den Personen der Aufsichtsratsmitglieder ist eine Liste der Mitglieder des Aufsichtsrates zum Handelsregister eingereicht worden."
    },
    {
      "date": "2025-07-04",
      "id": "114704",
      "original_text": "Löschungsankündigung\nHessen Amtsgericht Wiesbaden HRB 30290\nCasadax Consult GmbH – Taunusstein",
      "type": "Löschungsankündigung",
      "state": "Hessen",
      "amtsgericht": "Amtsgericht Wiesbaden",
      "registernummer": "HRB 30290",
      "registerart": "HRB",
      "company_name": "Casadax Consult GmbH",
      "company_seat": "Taunusstein",
      "details": "04.07.2025 (Bekanntmachungsdatum)\n\nHessen Amtsgericht Wiesbaden HRB 30290\nLöschungsankündigung\n\nCasadax Consult GmbH\nGesellschaft mit beschränkter Haftung\nTaunusstein\n\nDas Registergericht beabsichtigt die im Handelsregister eingetragene Gesellschaft von Amts wegen nach § 394 FamFG zu löschen. Die Frist zur Erhebung eines Widerspruchs gegen die beabsichtigte Löschung wird auf 3 Monate festgesetzt."
    }
  ]
}