{
  "date": "2025-07-25",
  "date_of_scrape": "2025-08-26T15:46:45.217Z",
  "tool_version": "0.2.0",
  "number_of_announcements": 190,
  "announcements": [
    {
      "date": "2025-07-25",
      "id": "117490",
      "original_text": "Registerbekanntmachung nach dem Umwandlungsgesetz\nBayern Amtsgericht München HRB 247100\nHIC Beteiligungen GmbH – Baiern",
      "type": "Registerbekanntmachung nach dem Umwandlungsgesetz",
      "state": "Bayern",
      "amtsgericht": "Amtsgericht München",
      "registernummer": "HRB 247100",
      "registerart": "HRB",
      "company_name": "HIC Beteiligungen GmbH",
      "company_seat": "Baiern",
      "details": "25.07.2025 (Bekanntmachungsdatum)\n\nBayern Amtsgericht München HRB 247100\nRegisterbekanntmachung nach dem Umwandlungsgesetz 24.07.2025 (Eintragungsdatum)\n\nHIC Beteiligungen GmbH\nGesellschaft mit beschränkter Haftung\nBaiern\n\nDen Gläubigern der an der Verschmelzung beteiligten Rechtsträger ist, wenn sie binnen sechs Monaten nach dem Tag, an dem die Eintragung der Verschmelzung in das Register des Sitzes desjenigen Rechtsträgers, dessen Gläubiger sie sind, nach § 19 Abs. 3 UmwG als bekannt gemacht gilt, ihren Anspruch nach Grund und Höhe in Textform anmelden, Sicherheit zu leisten, soweit sie nicht Befriedigung verlangen können. Dieses Recht steht den Gläubigern jedoch nur zu, wenn sie glaubhaft machen, dass durch die Verschmelzung die Erfüllung ihrer Forderung gefährdet wird."
    },
    {
      "date": "2025-07-25",
      "id": "117491",
      "original_text": "Registerbekanntmachung nach dem Umwandlungsgesetz\nBayern Amtsgericht Augsburg HRB 13859\nAugsburger Fernsehfenster Verwaltungs-GmbH – Augsburg",
      "type": "Registerbekanntmachung nach dem Umwandlungsgesetz",
      "state": "Bayern",
      "amtsgericht": "Amtsgericht Augsburg",
      "registernummer": "HRB 13859",
      "registerart": "HRB",
      "company_name": "Augsburger Fernsehfenster Verwaltungs-GmbH",
      "company_seat": "Augsburg",
      "details": "25.07.2025 (Bekanntmachungsdatum)\n\nBayern Amtsgericht Augsburg HRB 13859\nRegisterbekanntmachung nach dem Umwandlungsgesetz 24.07.2025 (Eintragungsdatum)\n\nAugsburger Fernsehfenster Verwaltungs-GmbH\nGesellschaft mit beschränkter Haftung\nAugsburg\n\nDen Gläubigern der an der Verschmelzung beteiligten Rechtsträger ist, wenn sie binnen sechs Monaten nach dem Tag, an dem die Eintragung der Verschmelzung in das Register des Sitzes desjenigen Rechtsträgers, dessen Gläubiger sie sind, nach § 19 Abs. 3 UmwG als bekannt gemacht gilt, ihren Anspruch nach Grund und Höhe in Textform anmelden, Sicherheit zu leisten, soweit sie nicht Befriedigung verlangen können. Dieses Recht steht den Gläubigern jedoch nur zu, wenn sie glaubhaft machen, dass durch die Verschmelzung die Erfüllung ihrer Forderung gefährdet wird."
    },
    {
      "date": "2025-07-25",
      "id": "117492",
      "original_text": "Registerbekanntmachung nach dem Umwandlungsgesetz\nBayern Amtsgericht München HRB 194352\nAMIRA VERWALTUNGS SE – München",
      "type": "Registerbekanntmachung nach dem Umwandlungsgesetz",
      "state": "Bayern",
      "amtsgericht": "Amtsgericht München",
      "registernummer": "HRB 194352",
      "registerart": "HRB",
      "company_name": "AMIRA VERWALTUNGS SE",
      "company_seat": "München",
      "details": "25.07.2025 (Bekanntmachungsdatum)\n\nBayern Amtsgericht München HRB 194352\nRegisterbekanntmachung nach dem Umwandlungsgesetz 24.07.2025 (Eintragungsdatum)\n\nAMIRA VERWALTUNGS SE\nEuropäische Aktiengesellschaft (SE)\nMünchen\n\nDen Gläubigern der an der Spaltung beteiligten Rechtsträger ist, wenn sie binnen sechs Monaten nach dem Tag, an dem die Eintragung der Spaltung in das Register des Sitzes desjenigen Rechtsträgers, dessen Gläubiger sie sind, nach §§ 125, 19 Abs. 3 UmwG als bekannt gemacht gilt, ihren Anspruch nach Grund und Höhe in Textform anmelden, Sicherheit zu leisten, soweit sie nicht Befriedigung verlangen können. Dieses Recht steht den Gläubigern jedoch nur zu, wenn sie glaubhaft machen, dass durch die Spaltung die Erfüllung ihrer Forderung gefährdet wird."
    },
    {
      "date": "2025-07-25",
      "id": "117493",
      "original_text": "Registerbekanntmachung nach dem Umwandlungsgesetz\nBayern Amtsgericht München HRB 136154\nproject partners management GmbH – Grünwald",
      "type": "Registerbekanntmachung nach dem Umwandlungsgesetz",
      "state": "Bayern",
      "amtsgericht": "Amtsgericht München",
      "registernummer": "HRB 136154",
      "registerart": "HRB",
      "company_name": "project partners management GmbH",
      "company_seat": "Grünwald",
      "details": "25.07.2025 (Bekanntmachungsdatum)\n\nBayern Amtsgericht München HRB 136154\nRegisterbekanntmachung nach dem Umwandlungsgesetz 24.07.2025 (Eintragungsdatum)\n\nproject partners management GmbH\nGesellschaft mit beschränkter Haftung\nGrünwald\n\nDen Gläubigern der an der Verschmelzung beteiligten Rechtsträger ist, wenn sie binnen sechs Monaten nach dem Tag, an dem die Eintragung der Verschmelzung in das Register des Sitzes desjenigen Rechtsträgers, dessen Gläubiger sie sind, nach § 19 Abs. 3 UmwG als bekannt gemacht gilt, ihren Anspruch nach Grund und Höhe in Textform anmelden, Sicherheit zu leisten, soweit sie nicht Befriedigung verlangen können. Dieses Recht steht den Gläubigern jedoch nur zu, wenn sie glaubhaft machen, dass durch die Verschmelzung die Erfüllung ihrer Forderung gefährdet wird."
    },
    {
      "date": "2025-07-25",
      "id": "117494",
      "original_text": "Löschungsankündigung\nBayern Amtsgericht München HRB 252799\nAR Anlagenbau UG (haftungsbeschränkt) – Glonn",
      "type": "Löschungsankündigung",
      "state": "Bayern",
      "amtsgericht": "Amtsgericht München",
      "registernummer": "HRB 252799",
      "registerart": "HRB",
      "company_name": "AR Anlagenbau UG (haftungsbeschränkt)",
      "company_seat": "Glonn",
      "details": "25.07.2025 (Bekanntmachungsdatum)\n\nBayern Amtsgericht München HRB 252799\nLöschungsankündigung\n\nAR Anlagenbau UG (haftungsbeschränkt)\nGesellschaft mit beschränkter Haftung\nGlonn\n\nDas Registergericht beabsichtigt, die im Handelsregister eingetragene Gesellschaft wegen Vermögenslosigkeit von Amts wegen nach § 394 FamFG zu löschen. Die Frist zur Erhebung eines Widerspruchs ist auf drei Monate festgesetzt."
    },
    {
      "date": "2025-07-25",
      "id": "117495",
      "original_text": "Registerbekanntmachung nach dem Umwandlungsgesetz\nBayern Amtsgericht München HRB 144367\nSpirit-Testing Software & Services GmbH – München",
      "type": "Registerbekanntmachung nach dem Umwandlungsgesetz",
      "state": "Bayern",
      "amtsgericht": "Amtsgericht München",
      "registernummer": "HRB 144367",
      "registerart": "HRB",
      "company_name": "Spirit-Testing Software & Services GmbH",
      "company_seat": "München",
      "details": "25.07.2025 (Bekanntmachungsdatum)\n\nBayern Amtsgericht München HRB 144367\nRegisterbekanntmachung nach dem Umwandlungsgesetz 24.07.2025 (Eintragungsdatum)\n\nSpirit-Testing Software & Services GmbH\nGesellschaft mit beschränkter Haftung\nMünchen\n\nDen Gläubigern der an der Verschmelzung beteiligten Rechtsträger ist, wenn sie binnen sechs Monaten nach dem Tag, an dem die Eintragung der Verschmelzung in das Register des Sitzes desjenigen Rechtsträgers, dessen Gläubiger sie sind, nach § 19 Abs. 3 UmwG als bekannt gemacht gilt, ihren Anspruch nach Grund und Höhe in Textform anmelden, Sicherheit zu leisten, soweit sie nicht Befriedigung verlangen können. Dieses Recht steht den Gläubigern jedoch nur zu, wenn sie glaubhaft machen, dass durch die Verschmelzung die Erfüllung ihrer Forderung gefährdet wird."
    },
    {
      "date": "2025-07-25",
      "id": "117496",
      "original_text": "Löschungsankündigung\nBayern Amtsgericht München HRB 206304\nADNP GmbH – Inning a.Ammersee",
      "type": "Löschungsankündigung",
      "state": "Bayern",
      "amtsgericht": "Amtsgericht München",
      "registernummer": "HRB 206304",
      "registerart": "HRB",
      "company_name": "ADNP GmbH",
      "company_seat": "Inning a.Ammersee",
      "details": "25.07.2025 (Bekanntmachungsdatum)\n\nBayern Amtsgericht München HRB 206304\nLöschungsankündigung 24.07.2025 (Eintragungsdatum)\n\nADNP GmbH\nGesellschaft mit beschränkter Haftung\nInning a.Ammersee\n\nDas Registergericht beabsichtigt, den im Handelsregister eingetragenen Geschäftsführer Reiz Florian wegen fehlender Eignung nach § 395 FamFG zu löschen. Die Frist zur Erhebung eines Widerspruchs ist auf drei Monate festgesetzt."
    },
    {
      "date": "2025-07-25",
      "id": "117497",
      "original_text": "Registerbekanntmachung nach dem Umwandlungsgesetz\nBayern Amtsgericht München HRB 126733\nSTUDIOCANAL TV GmbH – München",
      "type": "Registerbekanntmachung nach dem Umwandlungsgesetz",
      "state": "Bayern",
      "amtsgericht": "Amtsgericht München",
      "registernummer": "HRB 126733",
      "registerart": "HRB",
      "company_name": "STUDIOCANAL TV GmbH",
      "company_seat": "München",
      "details": "25.07.2025 (Bekanntmachungsdatum)\n\nBayern Amtsgericht München HRB 126733\nRegisterbekanntmachung nach dem Umwandlungsgesetz\n\nSTUDIOCANAL TV GmbH\nGesellschaft mit beschränkter Haftung\nMünchen\n\nEs wird darauf hingewiesen, dass ein Verschmelzungsplan oder sein Entwurf über eine grenzüberschreitende Verschmelzung zur Aufnahme mit der StudioCanal Series SAS mit Sitz in Issy-Les Moulineaux Cedex/Frankreich (Registre du Commerce et des Sociétés de Nanterre 421384470) (Société par Actions Simplifiée - Vereinfachte Aktiengesellschaft nach französischem Recht) beim Handelsregister eingereicht worden ist.\nDie Anteilsinhaber, die Gläubiger sowie die zuständigen Betriebsräte der an der grenzüberschreitenden Verschmelzung beteiligten Gesellschaften oder, soweit es keinen Betriebsrat gibt, die Arbeitnehmer der an der grenzüberschreitenden Verschmelzung beteiligten Gesellschaften, können der jeweiligen Gesellschaft spätestens fünf Arbeitstage vor dem Tag der Gesellschafterversammlung Bemerkungen zum Verschmelzungsplan übermitteln."
    },
    {
      "date": "2025-07-25",
      "id": "117498",
      "original_text": "Registerbekanntmachung nach dem Umwandlungsgesetz\nBayern Amtsgericht München HRB 173641\nmehappy promotion & design GmbH – Grünwald",
      "type": "Registerbekanntmachung nach dem Umwandlungsgesetz",
      "state": "Bayern",
      "amtsgericht": "Amtsgericht München",
      "registernummer": "HRB 173641",
      "registerart": "HRB",
      "company_name": "mehappy promotion & design GmbH",
      "company_seat": "Grünwald",
      "details": "25.07.2025 (Bekanntmachungsdatum)\n\nBayern Amtsgericht München HRB 173641\nRegisterbekanntmachung nach dem Umwandlungsgesetz 24.07.2025 (Eintragungsdatum)\n\nmehappy promotion & design GmbH\nGesellschaft mit beschränkter Haftung\nGrünwald\n\nDen Gläubigern der an der Verschmelzung beteiligten Rechtsträger ist, wenn sie binnen sechs Monaten nach dem Tag, an dem die Eintragung der Verschmelzung in das Register des Sitzes desjenigen Rechtsträgers, dessen Gläubiger sie sind, nach § 19 Abs. 3 UmwG als bekannt gemacht gilt, ihren Anspruch nach Grund und Höhe in Textform anmelden, Sicherheit zu leisten, soweit sie nicht Befriedigung verlangen können. Dieses Recht steht den Gläubigern jedoch nur zu, wenn sie glaubhaft machen, dass durch die Verschmelzung die Erfüllung ihrer Forderung gefährdet wird."
    },
    {
      "date": "2025-07-25",
      "id": "117499",
      "original_text": "Registerbekanntmachung nach dem Umwandlungsgesetz\nBayern Amtsgericht Augsburg HRB 32687\nCREATON GmbH – Wertingen",
      "type": "Registerbekanntmachung nach dem Umwandlungsgesetz",
      "state": "Bayern",
      "amtsgericht": "Amtsgericht Augsburg",
      "registernummer": "HRB 32687",
      "registerart": "HRB",
      "company_name": "CREATON GmbH",
      "company_seat": "Wertingen",
      "details": "25.07.2025 (Bekanntmachungsdatum)\n\nBayern Amtsgericht Augsburg HRB 32687\nRegisterbekanntmachung nach dem Umwandlungsgesetz 24.07.2025 (Eintragungsdatum)\n\nCREATON GmbH\nGesellschaft mit beschränkter Haftung\nWertingen\n\nDen Gläubigern der an der Verschmelzung beteiligten Rechtsträger ist, wenn sie binnen sechs Monaten nach dem Tag, an dem die Eintragung der Verschmelzung in das Register des Sitzes desjenigen Rechtsträgers, dessen Gläubiger sie sind, nach § 19 Abs. 3 UmwG als bekannt gemacht gilt, ihren Anspruch nach Grund und Höhe in Textform anmelden, Sicherheit zu leisten, soweit sie nicht Befriedigung verlangen können. Dieses Recht steht den Gläubigern jedoch nur zu, wenn sie glaubhaft machen, dass durch die Verschmelzung die Erfüllung ihrer Forderung gefährdet wird."
    },
    {
      "date": "2025-07-25",
      "id": "117500",
      "original_text": "Löschungsankündigung\nBayern Amtsgericht München HRB 260339\nClean Charge Solutions GmbH – Gräfelfing",
      "type": "Löschungsankündigung",
      "state": "Bayern",
      "amtsgericht": "Amtsgericht München",
      "registernummer": "HRB 260339",
      "registerart": "HRB",
      "company_name": "Clean Charge Solutions GmbH",
      "company_seat": "Gräfelfing",
      "details": "25.07.2025 (Bekanntmachungsdatum)\n\nBayern Amtsgericht München HRB 260339\nLöschungsankündigung 23.07.2025 (Eintragungsdatum)\n\nClean Charge Solutions GmbH\nGesellschaft mit beschränkter Haftung\nGräfelfing\n\nDas Registergericht beabsichtigt, die im Handelsregister eingetragene Gesellschaft wegen Vermögenslosigkeit von Amts wegen nach § 394 FamFG zu löschen. Die Frist zur Erhebung eines Widerspruchs ist auf drei Monate festgesetzt."
    },
    {
      "date": "2025-07-25",
      "id": "117501",
      "original_text": "Einreichung neuer Dokumente\nBayern Amtsgericht München HRB 250347\nMutares SE & Co. KGaA – München",
      "type": "Einreichung neuer Dokumente",
      "state": "Bayern",
      "amtsgericht": "Amtsgericht München",
      "registernummer": "HRB 250347",
      "registerart": "HRB",
      "company_name": "Mutares SE & Co. KGaA",
      "company_seat": "München",
      "details": "25.07.2025 (Bekanntmachungsdatum)\n\nBayern Amtsgericht München HRB 250347\nEinreichung neuer Dokumente\n\nMutares SE & Co. KGaA\nKommanditgesellschaft auf Aktien\nMünchen\n\nDem Amtsgericht München -Registergericht- isteine Liste der Mitglieder des Aufsichtsrats eingereicht worden, §§ 278 Abs. 3, 106 AktG."
    },
    {
      "date": "2025-07-25",
      "id": "117502",
      "original_text": "Registerbekanntmachung nach dem Umwandlungsgesetz\nBayern Amtsgericht Regensburg HRB 19438\nKRONES Holding GmbH – Neutraubling",
      "type": "Registerbekanntmachung nach dem Umwandlungsgesetz",
      "state": "Bayern",
      "amtsgericht": "Amtsgericht Regensburg",
      "registernummer": "HRB 19438",
      "registerart": "HRB",
      "company_name": "KRONES Holding GmbH",
      "company_seat": "Neutraubling",
      "details": "25.07.2025 (Bekanntmachungsdatum)\n\nBayern Amtsgericht Regensburg HRB 19438\nRegisterbekanntmachung nach dem Umwandlungsgesetz 24.07.2025 (Eintragungsdatum)\n\nKRONES Holding GmbH\nGesellschaft mit beschränkter Haftung\nNeutraubling\n\nDen Gläubigern der an der Verschmelzung beteiligten Rechtsträger ist, wenn sie binnen sechs Monaten nach dem Tag, an dem die Eintragung der Verschmelzung in das Register des Sitzes desjenigen Rechtsträgers, dessen Gläubiger sie sind, nach § 19 Abs. 3 UmwG als bekannt gemacht gilt, ihren Anspruch nach Grund und Höhe in Textform anmelden, Sicherheit zu leisten, soweit sie nicht Befriedigung verlangen können. Dieses Recht steht den Gläubigern jedoch nur zu, wenn sie glaubhaft machen, dass durch die Verschmelzung die Erfüllung ihrer Forderung gefährdet wird."
    },
    {
      "date": "2025-07-25",
      "id": "117503",
      "original_text": "Löschungsankündigung\nBayern Amtsgericht München HRB 162534\nK.D.I. Dienstleistungs- & Immobilienmanagement Holz- & Bautenschutz Verwaltungs GmbH – München",
      "type": "Löschungsankündigung",
      "state": "Bayern",
      "amtsgericht": "Amtsgericht München",
      "registernummer": "HRB 162534",
      "registerart": "HRB",
      "company_name": "K.D.I. Dienstleistungs- & Immobilienmanagement Holz- & Bautenschutz Verwaltungs GmbH",
      "company_seat": "München",
      "details": "25.07.2025 (Bekanntmachungsdatum)\n\nBayern Amtsgericht München HRB 162534\nLöschungsankündigung 23.07.2025 (Eintragungsdatum)\n\nK.D.I. Dienstleistungs- & Immobilienmanagement Holz- & Bautenschutz Verwaltungs GmbH\nGesellschaft mit beschränkter Haftung\nMünchen\n\nDas Registergericht beabsichtigt, die im Handelsregister eingetragene Gesellschaft wegen Vermögenslosigkeit von Amts wegen nach § 394 FamFG zu löschen. Die Frist zur Erhebung eines Widerspruchs ist auf drei Monate festgesetzt."
    },
    {
      "date": "2025-07-25",
      "id": "117504",
      "original_text": "Registerbekanntmachung nach dem Umwandlungsgesetz\nBayern Amtsgericht Landshut HRB 4456\nGT Gewerbe-Treuhand Holding GmbH - Steuerberatungsgesellschaft- – Eggenfelden",
      "type": "Registerbekanntmachung nach dem Umwandlungsgesetz",
      "state": "Bayern",
      "amtsgericht": "Amtsgericht Landshut",
      "registernummer": "HRB 4456",
      "registerart": "HRB",
      "company_name": "GT Gewerbe-Treuhand Holding GmbH - Steuerberatungsgesellschaft-",
      "company_seat": "Eggenfelden",
      "details": "25.07.2025 (Bekanntmachungsdatum)\n\nBayern Amtsgericht Landshut HRB 4456\nRegisterbekanntmachung nach dem Umwandlungsgesetz 24.07.2025 (Eintragungsdatum)\n\nGT Gewerbe-Treuhand Holding GmbH - Steuerberatungsgesellschaft-\nGesellschaft mit beschränkter Haftung\nEggenfelden\n\nDen Gläubigern der an der Verschmelzung beteiligten Rechtsträger ist, wenn sie binnen sechs Monaten nach dem Tag, an dem die Eintragung der Verschmelzung in das Register des Sitzes desjenigen Rechtsträgers, dessen Gläubiger sie sind, nach § 19 Abs. 3 UmwG als bekannt gemacht gilt, ihren Anspruch nach Grund und Höhe in Textform anmelden, Sicherheit zu leisten, soweit sie nicht Befriedigung verlangen können. Dieses Recht steht den Gläubigern jedoch nur zu, wenn sie glaubhaft machen, dass durch die Verschmelzung die Erfüllung ihrer Forderung gefährdet wird."
    },
    {
      "date": "2025-07-25",
      "id": "117505",
      "original_text": "Registerbekanntmachung nach dem Umwandlungsgesetz\nBayern Amtsgericht Augsburg HRB 32927\nCREATON Produktions GmbH – Wertingen",
      "type": "Registerbekanntmachung nach dem Umwandlungsgesetz",
      "state": "Bayern",
      "amtsgericht": "Amtsgericht Augsburg",
      "registernummer": "HRB 32927",
      "registerart": "HRB",
      "company_name": "CREATON Produktions GmbH",
      "company_seat": "Wertingen",
      "details": "25.07.2025 (Bekanntmachungsdatum)\n\nBayern Amtsgericht Augsburg HRB 32927\nRegisterbekanntmachung nach dem Umwandlungsgesetz 24.07.2025 (Eintragungsdatum)\n\nCREATON Produktions GmbH\nGesellschaft mit beschränkter Haftung\nWertingen\n\nDen Gläubigern der an der Verschmelzung beteiligten Rechtsträger ist, wenn sie binnen sechs Monaten nach dem Tag, an dem die Eintragung der Verschmelzung in das Register des Sitzes desjenigen Rechtsträgers, dessen Gläubiger sie sind, nach § 19 Abs. 3 UmwG als bekannt gemacht gilt, ihren Anspruch nach Grund und Höhe in Textform anmelden, Sicherheit zu leisten, soweit sie nicht Befriedigung verlangen können. Dieses Recht steht den Gläubigern jedoch nur zu, wenn sie glaubhaft machen, dass durch die Verschmelzung die Erfüllung ihrer Forderung gefährdet wird."
    },
    {
      "date": "2025-07-25",
      "id": "117506",
      "original_text": "Registerbekanntmachung nach dem Umwandlungsgesetz\nBayern Amtsgericht Bayreuth HRB 8490\nVitrulan Scandic Holding GmbH – Marktschorgast",
      "type": "Registerbekanntmachung nach dem Umwandlungsgesetz",
      "state": "Bayern",
      "amtsgericht": "Amtsgericht Bayreuth",
      "registernummer": "HRB 8490",
      "registerart": "HRB",
      "company_name": "Vitrulan Scandic Holding GmbH",
      "company_seat": "Marktschorgast",
      "details": "25.07.2025 (Bekanntmachungsdatum)\n\nBayern Amtsgericht Bayreuth HRB 8490\nRegisterbekanntmachung nach dem Umwandlungsgesetz 24.07.2025 (Eintragungsdatum)\n\nVitrulan Scandic Holding GmbH\nGesellschaft mit beschränkter Haftung\nMarktschorgast\n\nDen Gläubigern der an der Spaltung beteiligten Rechtsträger ist, wenn sie binnen sechs Monaten nach dem Tag, an dem die Eintragung der Spaltung in das Register des Sitzes desjenigen Rechtsträgers, dessen Gläubiger sie sind, nach §§ 125, 19 Abs. 3 UmwG als bekannt gemacht gilt, ihren Anspruch nach Grund und Höhe in Textform anmelden, Sicherheit zu leisten, soweit sie nicht Befriedigung verlangen können. Dieses Recht steht den Gläubigern jedoch nur zu, wenn sie glaubhaft machen, dass durch die Spaltung die Erfüllung ihrer Forderung gefährdet wird."
    },
    {
      "date": "2025-07-25",
      "id": "117507",
      "original_text": "Registerbekanntmachung nach dem Umwandlungsgesetz\nBayern Amtsgericht Landshut HRB 12955\nGt Gewerbe-Treuhand GmbH -Steuerberatungsgesellschaft- – Eggenfelden",
      "type": "Registerbekanntmachung nach dem Umwandlungsgesetz",
      "state": "Bayern",
      "amtsgericht": "Amtsgericht Landshut",
      "registernummer": "HRB 12955",
      "registerart": "HRB",
      "company_name": "Gt Gewerbe-Treuhand GmbH -Steuerberatungsgesellschaft-",
      "company_seat": "Eggenfelden",
      "details": "25.07.2025 (Bekanntmachungsdatum)\n\nBayern Amtsgericht Landshut HRB 12955\nRegisterbekanntmachung nach dem Umwandlungsgesetz 24.07.2025 (Eintragungsdatum)\n\nGt Gewerbe-Treuhand GmbH -Steuerberatungsgesellschaft-\nGesellschaft mit beschränkter Haftung\nEggenfelden\n\nDen Gläubigern der an der Verschmelzung beteiligten Rechtsträger ist, wenn sie binnen sechs Monaten nach dem Tag, an dem die Eintragung der Verschmelzung in das Register des Sitzes desjenigen Rechtsträgers, dessen Gläubiger sie sind, nach § 19 Abs. 3 UmwG als bekannt gemacht gilt, ihren Anspruch nach Grund und Höhe in Textform anmelden, Sicherheit zu leisten, soweit sie nicht Befriedigung verlangen können. Dieses Recht steht den Gläubigern jedoch nur zu, wenn sie glaubhaft machen, dass durch die Verschmelzung die Erfüllung ihrer Forderung gefährdet wird."
    },
    {
      "date": "2025-07-25",
      "id": "117508",
      "original_text": "Registerbekanntmachung nach dem Umwandlungsgesetz\nBayern Amtsgericht München GsR 2496\nGoja Design eGbR – Irschenberg",
      "type": "Registerbekanntmachung nach dem Umwandlungsgesetz",
      "state": "Bayern",
      "amtsgericht": "Amtsgericht München",
      "registernummer": "GsR 2496",
      "registerart": "GsR",
      "company_name": "Goja Design eGbR",
      "company_seat": "Irschenberg",
      "details": "25.07.2025 (Bekanntmachungsdatum)\n\nBayern Amtsgericht München GsR 2496\nRegisterbekanntmachung nach dem Umwandlungsgesetz 24.07.2025 (Eintragungsdatum)\n\nGoja Design eGbR\nGesellschaft bürgerlichen Rechts\nIrschenberg\n\nDen Gläubigern des formwechselnden Rechtsträgers ist, wenn sie binnen sechs Monaten nach dem Tag, an dem die Eintragung des Formwechsels nach § 201 UmwG als bekannt gemacht gilt, ihren Anspruch nach Grund und Höhe in Textform anmelden, Sicherheit zu leisten, soweit sie nicht Befriedigung verlangen können. Dieses Recht steht den Gläubigern jedoch nur zu, wenn sie glaubhaft machen, dass durch den Formwechsel die Erfüllung ihrer Forderung gefährdet wird."
    },
    {
      "date": "2025-07-25",
      "id": "117509",
      "original_text": "Einreichung neuer Dokumente\nBayern Amtsgericht München HRB 259763\nInstaltec AG – Grünwald",
      "type": "Einreichung neuer Dokumente",
      "state": "Bayern",
      "amtsgericht": "Amtsgericht München",
      "registernummer": "HRB 259763",
      "registerart": "HRB",
      "company_name": "Instaltec AG",
      "company_seat": "Grünwald",
      "details": "25.07.2025 (Bekanntmachungsdatum)\n\nBayern Amtsgericht München HRB 259763\nEinreichung neuer Dokumente\n\nInstaltec AG\nAktiengesellschaft\nGrünwald\n\nDem Amtsgericht München -Registergericht- ist eine Liste der Mitglieder des Aufsichtsrats eingereicht worden, § 106 AktG."
    },
    {
      "date": "2025-07-25",
      "id": "117510",
      "original_text": "Löschungsankündigung\nBayern Amtsgericht Kempten (Allgäu) HRB 16574\nVereinte24 Versicherungsmakler UG (haftungsbeschränkt) – Waltenhofen",
      "type": "Löschungsankündigung",
      "state": "Bayern",
      "amtsgericht": "Amtsgericht Kempten (Allgäu)",
      "registernummer": "HRB 16574",
      "registerart": "HRB",
      "company_name": "Vereinte24 Versicherungsmakler UG (haftungsbeschränkt)",
      "company_seat": "Waltenhofen",
      "details": "25.07.2025 (Bekanntmachungsdatum)\n\nBayern Amtsgericht Kempten (Allgäu) HRB 16574\nLöschungsankündigung\n\nVereinte24 Versicherungsmakler UG (haftungsbeschränkt)\nGesellschaft mit beschränkter Haftung\nWaltenhofen\n\nDas Registergericht beabsichtigt, die im Handelsregister eingetragene Gesellschaft wegen Vermögenslosigkeit von Amts wegen nach § 394 FamFG zu löschen. Die Frist zur Erhebung eines Widerspruchs ist auf einen Monat festgesetzt."
    },
    {
      "date": "2025-07-25",
      "id": "117511",
      "original_text": "Einreichung neuer Dokumente\nBayern Amtsgericht München HRB 5448\nFlughafen München Gesellschaft mit beschränkter Haftung – München",
      "type": "Einreichung neuer Dokumente",
      "state": "Bayern",
      "amtsgericht": "Amtsgericht München",
      "registernummer": "HRB 5448",
      "registerart": "HRB",
      "company_name": "Flughafen München Gesellschaft mit beschränkter Haftung",
      "company_seat": "München",
      "details": "25.07.2025 (Bekanntmachungsdatum)\n\nBayern Amtsgericht München HRB 5448\nEinreichung neuer Dokumente\n\nFlughafen München Gesellschaft mit beschränkter Haftung\nGesellschaft mit beschränkter Haftung\nMünchen\n\nDem Amtsgericht München -Registergericht- ist eine Liste der Mitglieder des Aufsichtsrats eingereicht worden, § 52 Abs. 3 S. 2 GmbHG."
    },
    {
      "date": "2025-07-25",
      "id": "117512",
      "original_text": "Einreichung neuer Dokumente\nBayern Amtsgericht München HRB 265513\nAllianz ONE - Business Solutions GmbH – München",
      "type": "Einreichung neuer Dokumente",
      "state": "Bayern",
      "amtsgericht": "Amtsgericht München",
      "registernummer": "HRB 265513",
      "registerart": "HRB",
      "company_name": "Allianz ONE - Business Solutions GmbH",
      "company_seat": "München",
      "details": "25.07.2025 (Bekanntmachungsdatum)\n\nBayern Amtsgericht München HRB 265513\nEinreichung neuer Dokumente\n\nAllianz ONE - Business Solutions GmbH\nGesellschaft mit beschränkter Haftung\nMünchen\n\nDem Amtsgericht München -Registergericht- ist eine Liste der Mitglieder des Aufsichtsrats eingereicht worden, § 52 Abs. 3 S. 2 GmbHG."
    },
    {
      "date": "2025-07-25",
      "id": "117513",
      "original_text": "Registerbekanntmachung nach dem Umwandlungsgesetz\nBayern Amtsgericht Hof HRB 6250\nElektrizitätswerk Heinrich Schirmer GmbH – Schauenstein",
      "type": "Registerbekanntmachung nach dem Umwandlungsgesetz",
      "state": "Bayern",
      "amtsgericht": "Amtsgericht Hof",
      "registernummer": "HRB 6250",
      "registerart": "HRB",
      "company_name": "Elektrizitätswerk Heinrich Schirmer GmbH",
      "company_seat": "Schauenstein",
      "details": "25.07.2025 (Bekanntmachungsdatum)\n\nBayern Amtsgericht Hof HRB 6250\nRegisterbekanntmachung nach dem Umwandlungsgesetz 24.07.2025 (Eintragungsdatum)\n\nElektrizitätswerk Heinrich Schirmer GmbH\nGesellschaft mit beschränkter Haftung\nSchauenstein\n\nDen Gläubigern der an der Verschmelzung beteiligten Rechtsträger ist, wenn sie binnen sechs Monaten nach dem Tag, an dem die Eintragung der Verschmelzung in das Register des Sitzes desjenigen Rechtsträgers, dessen Gläubiger sie sind, nach § 19 Abs. 3 UmwG als bekannt gemacht gilt, ihren Anspruch nach Grund und Höhe in Textform anmelden, Sicherheit zu leisten, soweit sie nicht Befriedigung verlangen können. Dieses Recht steht den Gläubigern jedoch nur zu, wenn sie glaubhaft machen, dass durch die Verschmelzung die Erfüllung ihrer Forderung gefährdet wird."
    },
    {
      "date": "2025-07-25",
      "id": "117514",
      "original_text": "Registerbekanntmachung nach dem Umwandlungsgesetz\nBayern Amtsgericht Bayreuth HRB 6477\nVitrulan Holding GmbH – Marktschorgast",
      "type": "Registerbekanntmachung nach dem Umwandlungsgesetz",
      "state": "Bayern",
      "amtsgericht": "Amtsgericht Bayreuth",
      "registernummer": "HRB 6477",
      "registerart": "HRB",
      "company_name": "Vitrulan Holding GmbH",
      "company_seat": "Marktschorgast",
      "details": "25.07.2025 (Bekanntmachungsdatum)\n\nBayern Amtsgericht Bayreuth HRB 6477\nRegisterbekanntmachung nach dem Umwandlungsgesetz 24.07.2025 (Eintragungsdatum)\n\nVitrulan Holding GmbH\nGesellschaft mit beschränkter Haftung\nMarktschorgast\n\nDen Gläubigern der an der Spaltung beteiligten Rechtsträger ist, wenn sie binnen sechs Monaten nach dem Tag, an dem die Eintragung der Spaltung in das Register des Sitzes desjenigen Rechtsträgers, dessen Gläubiger sie sind, nach §§ 125, 19 Abs. 3 UmwG als bekannt gemacht gilt, ihren Anspruch nach Grund und Höhe in Textform anmelden, Sicherheit zu leisten, soweit sie nicht Befriedigung verlangen können. Dieses Recht steht den Gläubigern jedoch nur zu, wenn sie glaubhaft machen, dass durch die Spaltung die Erfüllung ihrer Forderung gefährdet wird."
    },
    {
      "date": "2025-07-25",
      "id": "117515",
      "original_text": "Einreichung neuer Dokumente\nBayern Amtsgericht München HRB 280577\nNotrix AG – München",
      "type": "Einreichung neuer Dokumente",
      "state": "Bayern",
      "amtsgericht": "Amtsgericht München",
      "registernummer": "HRB 280577",
      "registerart": "HRB",
      "company_name": "Notrix AG",
      "company_seat": "München",
      "details": "25.07.2025 (Bekanntmachungsdatum)\n\nBayern Amtsgericht München HRB 280577\nEinreichung neuer Dokumente 24.07.2025 (Eintragungsdatum)\n\nNotrix AG\nAktiengesellschaft\nMünchen\n\nDem Amtsgericht München -Registergericht- ist eine Liste der Mitglieder des Aufsichtsrats eingereicht worden, § 106 AktG."
    },
    {
      "date": "2025-07-25",
      "id": "117516",
      "original_text": "Registerbekanntmachung nach dem Umwandlungsgesetz\nBayern Amtsgericht Fürth HRB 8502\nPS-Pension Solutions GmbH – Erlangen",
      "type": "Registerbekanntmachung nach dem Umwandlungsgesetz",
      "state": "Bayern",
      "amtsgericht": "Amtsgericht Fürth",
      "registernummer": "HRB 8502",
      "registerart": "HRB",
      "company_name": "PS-Pension Solutions GmbH",
      "company_seat": "Erlangen",
      "details": "25.07.2025 (Bekanntmachungsdatum)\n\nBayern Amtsgericht Fürth HRB 8502\nRegisterbekanntmachung nach dem Umwandlungsgesetz 24.07.2025 (Eintragungsdatum)\n\nPS-Pension Solutions GmbH\nGesellschaft mit beschränkter Haftung\nErlangen\n\nDen Gläubigern der an der Verschmelzung beteiligten Rechtsträger ist, wenn sie binnen sechs Monaten nach dem Tag, an dem die Eintragung der Verschmelzung in das Register des Sitzes desjenigen Rechtsträgers, dessen Gläubiger sie sind, nach § 19 Abs. 3 UmwG als bekannt gemacht gilt, ihren Anspruch nach Grund und Höhe in Textform anmelden, Sicherheit zu leisten, soweit sie nicht Befriedigung verlangen können. Dieses Recht steht den Gläubigern jedoch nur zu, wenn sie glaubhaft machen, dass durch die Verschmelzung die Erfüllung ihrer Forderung gefährdet wird."
    },
    {
      "date": "2025-07-25",
      "id": "117517",
      "original_text": "Löschungsankündigung\nBayern Amtsgericht München HRA 110300\nSDS Dreizehn Immobilien GmbH & Co. KG – München",
      "type": "Löschungsankündigung",
      "state": "Bayern",
      "amtsgericht": "Amtsgericht München",
      "registernummer": "HRA 110300",
      "registerart": "HRA",
      "company_name": "SDS Dreizehn Immobilien GmbH & Co. KG",
      "company_seat": "München",
      "details": "25.07.2025 (Bekanntmachungsdatum)\n\nBayern Amtsgericht München HRA 110300\nLöschungsankündigung 24.07.2025 (Eintragungsdatum)\n\nSDS Dreizehn Immobilien GmbH & Co. KG\nKommanditgesellschaft\nMünchen\n\nDas Registergericht beabsichtigt, die im Handelsregister eingetragene Firma von Amts wegen nach § 31 Abs. 2 HGB zu löschen. Die Frist zur Erhebung eines Widerspruchs ist auf drei Monate festgesetzt."
    },
    {
      "date": "2025-07-25",
      "id": "117518",
      "original_text": "Registerbekanntmachung nach dem Umwandlungsgesetz\nBayern Amtsgericht München HRB 200715\nInformation Quality Institute GmbH – München",
      "type": "Registerbekanntmachung nach dem Umwandlungsgesetz",
      "state": "Bayern",
      "amtsgericht": "Amtsgericht München",
      "registernummer": "HRB 200715",
      "registerart": "HRB",
      "company_name": "Information Quality Institute GmbH",
      "company_seat": "München",
      "details": "25.07.2025 (Bekanntmachungsdatum)\n\nBayern Amtsgericht München HRB 200715\nRegisterbekanntmachung nach dem Umwandlungsgesetz 24.07.2025 (Eintragungsdatum)\n\nInformation Quality Institute GmbH\nGesellschaft mit beschränkter Haftung\nMünchen\n\nDen Gläubigern der an der Verschmelzung beteiligten Rechtsträger ist, wenn sie binnen sechs Monaten nach dem Tag, an dem die Eintragung der Verschmelzung in das Register des Sitzes desjenigen Rechtsträgers, dessen Gläubiger sie sind, nach § 19 Abs. 3 UmwG als bekannt gemacht gilt, ihren Anspruch nach Grund und Höhe in Textform anmelden, Sicherheit zu leisten, soweit sie nicht Befriedigung verlangen können. Dieses Recht steht den Gläubigern jedoch nur zu, wenn sie glaubhaft machen, dass durch die Verschmelzung die Erfüllung ihrer Forderung gefährdet wird."
    },
    {
      "date": "2025-07-25",
      "id": "117519",
      "original_text": "Registerbekanntmachung nach dem Umwandlungsgesetz\nBayern Amtsgericht München HRB 246672\nmyhumanity gUG (haftungsbeschränkt) – München",
      "type": "Registerbekanntmachung nach dem Umwandlungsgesetz",
      "state": "Bayern",
      "amtsgericht": "Amtsgericht München",
      "registernummer": "HRB 246672",
      "registerart": "HRB",
      "company_name": "myhumanity gUG (haftungsbeschränkt)",
      "company_seat": "München",
      "details": "25.07.2025 (Bekanntmachungsdatum)\n\nBayern Amtsgericht München HRB 246672\nRegisterbekanntmachung nach dem Umwandlungsgesetz 24.07.2025 (Eintragungsdatum)\n\nmyhumanity gUG (haftungsbeschränkt)\nGesellschaft mit beschränkter Haftung\nMünchen\n\nDen Gläubigern des formwechselnden Rechtsträgers ist, wenn sie binnen sechs Monaten nach dem Tag, an dem die Eintragung des Formwechsels nach § 201 UmwG als bekannt gemacht gilt, ihren Anspruch nach Grund und Höhe in Textform anmelden, Sicherheit zu leisten, soweit sie nicht Befriedigung verlangen können. Dieses Recht steht den Gläubigern jedoch nur zu, wenn sie glaubhaft machen, dass durch den Formwechsel die Erfüllung ihrer Forderung gefährdet wird."
    },
    {
      "date": "2025-07-25",
      "id": "117520",
      "original_text": "Registerbekanntmachung nach dem Umwandlungsgesetz\nBayern Amtsgericht Augsburg HRB 9173\nrt1.media group GmbH – Augsburg",
      "type": "Registerbekanntmachung nach dem Umwandlungsgesetz",
      "state": "Bayern",
      "amtsgericht": "Amtsgericht Augsburg",
      "registernummer": "HRB 9173",
      "registerart": "HRB",
      "company_name": "rt1.media group GmbH",
      "company_seat": "Augsburg",
      "details": "25.07.2025 (Bekanntmachungsdatum)\n\nBayern Amtsgericht Augsburg HRB 9173\nRegisterbekanntmachung nach dem Umwandlungsgesetz 24.07.2025 (Eintragungsdatum)\n\nrt1.media group GmbH\nGesellschaft mit beschränkter Haftung\nAugsburg\n\nDen Gläubigern der an der Verschmelzung beteiligten Rechtsträger ist, wenn sie binnen sechs Monaten nach dem Tag, an dem die Eintragung der Verschmelzung in das Register des Sitzes desjenigen Rechtsträgers, dessen Gläubiger sie sind, nach § 19 Abs. 3 UmwG als bekannt gemacht gilt, ihren Anspruch nach Grund und Höhe in Textform anmelden, Sicherheit zu leisten, soweit sie nicht Befriedigung verlangen können. Dieses Recht steht den Gläubigern jedoch nur zu, wenn sie glaubhaft machen, dass durch die Verschmelzung die Erfüllung ihrer Forderung gefährdet wird."
    },
    {
      "date": "2025-07-25",
      "id": "117521",
      "original_text": "Löschungsankündigung\nBayern Amtsgericht Traunstein HRB 13546\nUB-Welt GmbH – Neubeuern",
      "type": "Löschungsankündigung",
      "state": "Bayern",
      "amtsgericht": "Amtsgericht Traunstein",
      "registernummer": "HRB 13546",
      "registerart": "HRB",
      "company_name": "UB-Welt GmbH",
      "company_seat": "Neubeuern",
      "details": "25.07.2025 (Bekanntmachungsdatum)\n\nBayern Amtsgericht Traunstein HRB 13546\nLöschungsankündigung\n\nUB-Welt GmbH\nGesellschaft mit beschränkter Haftung\nNeubeuern\n\nDas Registergericht beabsichtigt, die im Handelsregister eingetragene Gesellschaft wegen Vermögenslosigkeit von Amts wegen nach § 394 FamFG zu löschen. Die Frist zur Erhebung eines Widerspruchs ist auf drei Monate festgesetzt."
    },
    {
      "date": "2025-07-25",
      "id": "117522",
      "original_text": "Registerbekanntmachung nach dem Umwandlungsgesetz\nBayern Amtsgericht München HRB 227690\nDer verrückte Eismacher GmbH – München",
      "type": "Registerbekanntmachung nach dem Umwandlungsgesetz",
      "state": "Bayern",
      "amtsgericht": "Amtsgericht München",
      "registernummer": "HRB 227690",
      "registerart": "HRB",
      "company_name": "Der verrückte Eismacher GmbH",
      "company_seat": "München",
      "details": "25.07.2025 (Bekanntmachungsdatum)\n\nBayern Amtsgericht München HRB 227690\nRegisterbekanntmachung nach dem Umwandlungsgesetz 24.07.2025 (Eintragungsdatum)\n\nDer verrückte Eismacher GmbH\nGesellschaft mit beschränkter Haftung\nMünchen\n\nDen Gläubigern der an der Verschmelzung beteiligten Rechtsträger ist, wenn sie binnen sechs Monaten nach dem Tag, an dem die Eintragung der Verschmelzung in das Register des Sitzes desjenigen Rechtsträgers, dessen Gläubiger sie sind, nach § 19 Abs. 3 UmwG als bekannt gemacht gilt, ihren Anspruch nach Grund und Höhe in Textform anmelden, Sicherheit zu leisten, soweit sie nicht Befriedigung verlangen können. Dieses Recht steht den Gläubigern jedoch nur zu, wenn sie glaubhaft machen, dass durch die Verschmelzung die Erfüllung ihrer Forderung gefährdet wird."
    },
    {
      "date": "2025-07-25",
      "id": "117523",
      "original_text": "Registerbekanntmachung nach dem Umwandlungsgesetz\nBayern Amtsgericht München HRB 299086\nKirschner Holding & Unternehmerberatung AG Wirtschaftsprüfungsgesellschaft Steuerberatungsgesellschaft – München",
      "type": "Registerbekanntmachung nach dem Umwandlungsgesetz",
      "state": "Bayern",
      "amtsgericht": "Amtsgericht München",
      "registernummer": "HRB 299086",
      "registerart": "HRB",
      "company_name": "Kirschner Holding & Unternehmerberatung AG Wirtschaftsprüfungsgesellschaft Steuerberatungsgesellschaft",
      "company_seat": "München",
      "details": "25.07.2025 (Bekanntmachungsdatum)\n\nBayern Amtsgericht München HRB 299086\nRegisterbekanntmachung nach dem Umwandlungsgesetz 24.07.2025 (Eintragungsdatum)\n\nKirschner Holding & Unternehmerberatung AG Wirtschaftsprüfungsgesellschaft Steuerberatungsgesellschaft\nAktiengesellschaft\nMünchen\n\nDen Gläubigern der an der Verschmelzung beteiligten Rechtsträger ist, wenn sie binnen sechs Monaten nach dem Tag, an dem die Eintragung der Verschmelzung in das Register des Sitzes desjenigen Rechtsträgers, dessen Gläubiger sie sind, nach § 19 Abs. 3 UmwG als bekannt gemacht gilt, ihren Anspruch nach Grund und Höhe in Textform anmelden, Sicherheit zu leisten, soweit sie nicht Befriedigung verlangen können. Dieses Recht steht den Gläubigern jedoch nur zu, wenn sie glaubhaft machen, dass durch die Verschmelzung die Erfüllung ihrer Forderung gefährdet wird."
    },
    {
      "date": "2025-07-25",
      "id": "117524",
      "original_text": "Registerbekanntmachung nach dem Umwandlungsgesetz\nBayern Amtsgericht Weiden i. d. OPf. HRB 3875\nThoma Transporte UG (haftungsbeschränkt) – Wiesau",
      "type": "Registerbekanntmachung nach dem Umwandlungsgesetz",
      "state": "Bayern",
      "amtsgericht": "Amtsgericht Weiden i. d. OPf.",
      "registernummer": "HRB 3875",
      "registerart": "HRB",
      "company_name": "Thoma Transporte UG (haftungsbeschränkt)",
      "company_seat": "Wiesau",
      "details": "25.07.2025 (Bekanntmachungsdatum)\n\nBayern Amtsgericht Weiden i. d. OPf. HRB 3875\nRegisterbekanntmachung nach dem Umwandlungsgesetz 24.07.2025 (Eintragungsdatum)\n\nThoma Transporte UG (haftungsbeschränkt)\nGesellschaft mit beschränkter Haftung\nWiesau\n\nDen Gläubigern der an der Verschmelzung beteiligten Rechtsträger ist, wenn sie binnen sechs Monaten nach dem Tag, an dem die Eintragung der Verschmelzung in das Register des Sitzes desjenigen Rechtsträgers, dessen Gläubiger sie sind, nach § 19 Abs. 3 UmwG als bekannt gemacht gilt, ihren Anspruch nach Grund und Höhe in Textform anmelden, Sicherheit zu leisten, soweit sie nicht Befriedigung verlangen können. Dieses Recht steht den Gläubigern jedoch nur zu, wenn sie glaubhaft machen, dass durch die Verschmelzung die Erfüllung ihrer Forderung gefährdet wird."
    },
    {
      "date": "2025-07-25",
      "id": "117525",
      "original_text": "Registerbekanntmachung nach dem Umwandlungsgesetz\nBayern Amtsgericht München HRB 288414\nBlitz 23-488 GmbH – München",
      "type": "Registerbekanntmachung nach dem Umwandlungsgesetz",
      "state": "Bayern",
      "amtsgericht": "Amtsgericht München",
      "registernummer": "HRB 288414",
      "registerart": "HRB",
      "company_name": "Blitz 23-488 GmbH",
      "company_seat": "München",
      "details": "25.07.2025 (Bekanntmachungsdatum)\n\nBayern Amtsgericht München HRB 288414\nRegisterbekanntmachung nach dem Umwandlungsgesetz 24.07.2025 (Eintragungsdatum)\n\nBlitz 23-488 GmbH\nGesellschaft mit beschränkter Haftung\nMünchen\n\nDen Gläubigern der an den Verschmelzungen beteiligten Rechtsträger ist, wenn sie binnen sechs Monaten nach dem Tag, an dem die Eintragung der Verschmelzung in das Register des Sitzes desjenigen Rechtsträgers, dessen Gläubiger sie sind, nach § 19 Abs. 3 UmwG als bekannt gemacht gilt, ihren Anspruch nach Grund und Höhe in Textform anmelden, Sicherheit zu leisten, soweit sie nicht Befriedigung verlangen können. Dieses Recht steht den Gläubigern jedoch nur zu, wenn sie glaubhaft machen, dass durch die Verschmelzung die Erfüllung ihrer Forderung gefährdet wird."
    },
    {
      "date": "2025-07-25",
      "id": "117526",
      "original_text": "Registerbekanntmachung nach dem Umwandlungsgesetz\nBayern Amtsgericht München HRB 226309\nKorian Birkenpark GmbH – München",
      "type": "Registerbekanntmachung nach dem Umwandlungsgesetz",
      "state": "Bayern",
      "amtsgericht": "Amtsgericht München",
      "registernummer": "HRB 226309",
      "registerart": "HRB",
      "company_name": "Korian Birkenpark GmbH",
      "company_seat": "München",
      "details": "25.07.2025 (Bekanntmachungsdatum)\n\nBayern Amtsgericht München HRB 226309\nRegisterbekanntmachung nach dem Umwandlungsgesetz 24.07.2025 (Eintragungsdatum)\n\nKorian Birkenpark GmbH\nGesellschaft mit beschränkter Haftung\nMünchen\n\nDen Gläubigern der an der Verschmelzung beteiligten Rechtsträger ist, wenn sie binnen sechs Monaten nach dem Tag, an dem die Eintragung der Verschmelzung in das Register des Sitzes desjenigen Rechtsträgers, dessen Gläubiger sie sind, nach § 19 Abs. 3 UmwG als bekannt gemacht gilt, ihren Anspruch nach Grund und Höhe in Textform anmelden, Sicherheit zu leisten, soweit sie nicht Befriedigung verlangen können. Dieses Recht steht den Gläubigern jedoch nur zu, wenn sie glaubhaft machen, dass durch die Verschmelzung die Erfüllung ihrer Forderung gefährdet wird."
    },
    {
      "date": "2025-07-25",
      "id": "117527",
      "original_text": "Einreichung neuer Dokumente\nBayern Amtsgericht München HRB 172247\nCONTEXT AG – München",
      "type": "Einreichung neuer Dokumente",
      "state": "Bayern",
      "amtsgericht": "Amtsgericht München",
      "registernummer": "HRB 172247",
      "registerart": "HRB",
      "company_name": "CONTEXT AG",
      "company_seat": "München",
      "details": "25.07.2025 (Bekanntmachungsdatum)\n\nBayern Amtsgericht München HRB 172247\nEinreichung neuer Dokumente\n\nCONTEXT AG\nAktiengesellschaft\nMünchen\n\nDem Amtsgericht München -Registergericht- ist eine Liste der Mitglieder des Aufsichtsrats eingereicht worden, § 106 AktG."
    },
    {
      "date": "2025-07-25",
      "id": "117528",
      "original_text": "Registerbekanntmachung nach dem Umwandlungsgesetz\nBayern Amtsgericht München HRB 150774\nAccor Purchasing Solutions GmbH – München",
      "type": "Registerbekanntmachung nach dem Umwandlungsgesetz",
      "state": "Bayern",
      "amtsgericht": "Amtsgericht München",
      "registernummer": "HRB 150774",
      "registerart": "HRB",
      "company_name": "Accor Purchasing Solutions GmbH",
      "company_seat": "München",
      "details": "25.07.2025 (Bekanntmachungsdatum)\n\nBayern Amtsgericht München HRB 150774\nRegisterbekanntmachung nach dem Umwandlungsgesetz 24.07.2025 (Eintragungsdatum)\n\nAccor Purchasing Solutions GmbH\nGesellschaft mit beschränkter Haftung\nMünchen\n\nDen Gläubigern der an der Verschmelzung beteiligten Rechtsträger ist, wenn sie binnen sechs Monaten nach dem Tag, an dem die Eintragung der Verschmelzung in das Register des Sitzes desjenigen Rechtsträgers, dessen Gläubiger sie sind, nach § 19 Abs. 3 UmwG als bekannt gemacht gilt, ihren Anspruch nach Grund und Höhe in Textform anmelden, Sicherheit zu leisten, soweit sie nicht Befriedigung verlangen können. Dieses Recht steht den Gläubigern jedoch nur zu, wenn sie glaubhaft machen, dass durch die Verschmelzung die Erfüllung ihrer Forderung gefährdet wird."
    },
    {
      "date": "2025-07-25",
      "id": "117529",
      "original_text": "Einreichung neuer Dokumente\nBayern Amtsgericht Kempten (Allgäu) HRB 16478\nABT SE – Kempten (Allgäu)",
      "type": "Einreichung neuer Dokumente",
      "state": "Bayern",
      "amtsgericht": "Amtsgericht Kempten (Allgäu)",
      "registernummer": "HRB 16478",
      "registerart": "HRB",
      "company_name": "ABT SE",
      "company_seat": "Kempten (Allgäu)",
      "details": "25.07.2025 (Bekanntmachungsdatum)\n\nBayern Amtsgericht Kempten (Allgäu) HRB 16478\nEinreichung neuer Dokumente 24.07.2025 (Eintragungsdatum)\n\nABT SE\nEuropäische Aktiengesellschaft (SE)\nKempten (Allgäu)\n\nDem Amtsgericht Kempten (Allgäu) -Registergericht- ist eine Liste der Mitglieder des Verwaltungsrats eingereicht worden, Art. 9 Abs. 1 Buchst. c (ii) SE-VO i.V.m. § 106 AktG."
    },
    {
      "date": "2025-07-25",
      "id": "117530",
      "original_text": "Einreichung neuer Dokumente\nBayern Amtsgericht München HRB 228434\nPlastic Omnium Automotive Exteriors GmbH – München",
      "type": "Einreichung neuer Dokumente",
      "state": "Bayern",
      "amtsgericht": "Amtsgericht München",
      "registernummer": "HRB 228434",
      "registerart": "HRB",
      "company_name": "Plastic Omnium Automotive Exteriors GmbH",
      "company_seat": "München",
      "details": "25.07.2025 (Bekanntmachungsdatum)\n\nBayern Amtsgericht München HRB 228434\nEinreichung neuer Dokumente\n\nPlastic Omnium Automotive Exteriors GmbH\nGesellschaft mit beschränkter Haftung\nMünchen\n\nDem Amtsgericht München -Registergericht- ist eine Liste der Mitglieder des Aufsichtsrats eingereicht worden, § 52 Abs. 3 S. 2 GmbHG."
    },
    {
      "date": "2025-07-25",
      "id": "117531",
      "original_text": "Registerbekanntmachung nach dem Umwandlungsgesetz\nBayern Amtsgericht München HRB 282180\nRasmus & Rasmus GmbH – München",
      "type": "Registerbekanntmachung nach dem Umwandlungsgesetz",
      "state": "Bayern",
      "amtsgericht": "Amtsgericht München",
      "registernummer": "HRB 282180",
      "registerart": "HRB",
      "company_name": "Rasmus & Rasmus GmbH",
      "company_seat": "München",
      "details": "25.07.2025 (Bekanntmachungsdatum)\n\nBayern Amtsgericht München HRB 282180\nRegisterbekanntmachung nach dem Umwandlungsgesetz 24.07.2025 (Eintragungsdatum)\n\nRasmus & Rasmus GmbH\nGesellschaft mit beschränkter Haftung\nMünchen\n\nDen Gläubigern der an der Verschmelzung beteiligten Rechtsträger ist, wenn sie binnen sechs Monaten nach dem Tag, an dem die Eintragung der Verschmelzung in das Register des Sitzes desjenigen Rechtsträgers, dessen Gläubiger sie sind, nach § 19 Abs. 3 UmwG als bekannt gemacht gilt, ihren Anspruch nach Grund und Höhe in Textform anmelden, Sicherheit zu leisten, soweit sie nicht Befriedigung verlangen können. Dieses Recht steht den Gläubigern jedoch nur zu, wenn sie glaubhaft machen, dass durch die Verschmelzung die Erfüllung ihrer Forderung gefährdet wird."
    },
    {
      "date": "2025-07-25",
      "id": "117532",
      "original_text": "Registerbekanntmachung nach dem Umwandlungsgesetz\nBayern Amtsgericht München HRB 297178\nIgloo AcquiCo GmbH – München",
      "type": "Registerbekanntmachung nach dem Umwandlungsgesetz",
      "state": "Bayern",
      "amtsgericht": "Amtsgericht München",
      "registernummer": "HRB 297178",
      "registerart": "HRB",
      "company_name": "Igloo AcquiCo GmbH",
      "company_seat": "München",
      "details": "25.07.2025 (Bekanntmachungsdatum)\n\nBayern Amtsgericht München HRB 297178\nRegisterbekanntmachung nach dem Umwandlungsgesetz 24.07.2025 (Eintragungsdatum)\n\nIgloo AcquiCo GmbH\nGesellschaft mit beschränkter Haftung\nMünchen\n\nDen Gläubigern der an der Verschmelzung beteiligten Rechtsträger ist, wenn sie binnen sechs Monaten nach dem Tag, an dem die Eintragung der Verschmelzung in das Register des Sitzes desjenigen Rechtsträgers, dessen Gläubiger sie sind, nach § 19 Abs. 3 UmwG als bekannt gemacht gilt, ihren Anspruch nach Grund und Höhe in Textform anmelden, Sicherheit zu leisten, soweit sie nicht Befriedigung verlangen können. Dieses Recht steht den Gläubigern jedoch nur zu, wenn sie glaubhaft machen, dass durch die Verschmelzung die Erfüllung ihrer Forderung gefährdet wird."
    },
    {
      "date": "2025-07-25",
      "id": "117533",
      "original_text": "Registerbekanntmachung nach dem Umwandlungsgesetz\nBayern Amtsgericht München HRB 226309\nKorian COMO Betriebs GmbH – München",
      "type": "Registerbekanntmachung nach dem Umwandlungsgesetz",
      "state": "Bayern",
      "amtsgericht": "Amtsgericht München",
      "registernummer": "HRB 226309",
      "registerart": "HRB",
      "company_name": "Korian COMO Betriebs GmbH",
      "company_seat": "München",
      "details": "25.07.2025 (Bekanntmachungsdatum)\n\nBayern Amtsgericht München HRB 226309\nRegisterbekanntmachung nach dem Umwandlungsgesetz 24.07.2025 (Eintragungsdatum)\n\nKorian COMO Betriebs GmbH\nGesellschaft mit beschränkter Haftung\nMünchen\n\nDen Gläubigern der an der Verschmelzung beteiligten Rechtsträger ist, wenn sie binnen sechs Monaten nach dem Tag, an dem die Eintragung der Verschmelzung in das Register des Sitzes desjenigen Rechtsträgers, dessen Gläubiger sie sind, nach § 19 Abs. 3 UmwG als bekannt gemacht gilt, ihren Anspruch nach Grund und Höhe in Textform anmelden, Sicherheit zu leisten, soweit sie nicht Befriedigung verlangen können. Dieses Recht steht den Gläubigern jedoch nur zu, wenn sie glaubhaft machen, dass durch die Verschmelzung die Erfüllung ihrer Forderung gefährdet wird."
    },
    {
      "date": "2025-07-25",
      "id": "117534",
      "original_text": "Registerbekanntmachung nach dem Umwandlungsgesetz\nBerlin Amtsgericht Berlin (Charlottenburg) HRB 94600\nAHAB-Akademie GmbH – Berlin",
      "type": "Registerbekanntmachung nach dem Umwandlungsgesetz",
      "state": "Berlin",
      "amtsgericht": "Amtsgericht Berlin (Charlottenburg)",
      "registernummer": "HRB 94600",
      "registerart": "HRB",
      "company_name": "AHAB-Akademie GmbH",
      "company_seat": "Berlin",
      "details": "25.07.2025 (Bekanntmachungsdatum)\n\nBerlin Amtsgericht Berlin (Charlottenburg) HRB 94600\nRegisterbekanntmachung nach dem Umwandlungsgesetz 24.07.2025 (Eintragungsdatum)\n\nAHAB-Akademie GmbH\nGesellschaft mit beschränkter Haftung\nBerlin\n\nZu Eintragungsnummer 10 vom 24.07.2025 wird als nicht eingetragen veröffentlicht: Den Gläubigern der an der Verschmelzung beteiligten Rechtsträger ist, wenn sie binnen sechs Monaten nach dem Tag, an dem die Eintragung der Verschmelzung in das Register des Sitzes desjenigen Rechtsträgers, dessen Gläubiger sie sind, als bekannt gemacht gilt, ihren Anspruch nach Grund und Höhe schriftlich anmelden, Sicherheit zu leisten, soweit sie nicht Befriedigung verlangen können. Dieses Recht steht den Gläubigern jedoch nur zu, wenn sie glaubhaft machen, dass durch die Verschmelzung die Erfüllung ihrer Forderung gefährdet wird. Das Recht, Sicherheitsleistung zu verlangen, steht Gläubigern nicht zu, die im Falle der Insolvenz ein Recht auf vorzugsweise Befriedigung aus einer Deckungsmasse haben, die nach gesetzlicher Vorschrift zu ihrem Schutz errichtet und staatlich überwacht ist."
    },
    {
      "date": "2025-07-25",
      "id": "117535",
      "original_text": "Registerbekanntmachung nach dem Umwandlungsgesetz\nBerlin Amtsgericht Berlin (Charlottenburg) HRB 164430\nESUNA GmbH – Berlin",
      "type": "Registerbekanntmachung nach dem Umwandlungsgesetz",
      "state": "Berlin",
      "amtsgericht": "Amtsgericht Berlin (Charlottenburg)",
      "registernummer": "HRB 164430",
      "registerart": "HRB",
      "company_name": "ESUNA GmbH",
      "company_seat": "Berlin",
      "details": "25.07.2025 (Bekanntmachungsdatum)\n\nBerlin Amtsgericht Berlin (Charlottenburg) HRB 164430\nRegisterbekanntmachung nach dem Umwandlungsgesetz 24.07.2025 (Eintragungsdatum)\n\nESUNA GmbH\nGesellschaft mit beschränkter Haftung\nBerlin\n\nZu Eintragungsnummer 6 vom 24.07.2025 wird als nicht eingetragen veröffentlicht: Den Gläubigern der an der Verschmelzung beteiligten Rechtsträger ist, wenn sie binnen sechs Monaten nach dem Tag, an dem die Eintragung der Verschmelzung in das Register des Sitzes desjenigen Rechtsträgers, dessen Gläubiger sie sind, als bekannt gemacht gilt, ihren Anspruch nach Grund und Höhe schriftlich anmelden, Sicherheit zu leisten, soweit sie nicht Befriedigung verlangen können. Dieses Recht steht den Gläubigern jedoch nur zu, wenn sie glaubhaft machen, dass durch die Verschmelzung die Erfüllung ihrer Forderung gefährdet wird. Das Recht, Sicherheitsleistung zu verlangen, steht Gläubigern nicht zu, die im Falle der Insolvenz ein Recht auf vorzugsweise Befriedigung aus einer Deckungsmasse haben, die nach gesetzlicher Vorschrift zu ihrem Schutz errichtet und staatlich überwacht ist."
    },
    {
      "date": "2025-07-25",
      "id": "117536",
      "original_text": "Registerbekanntmachung nach dem Umwandlungsgesetz\nBerlin Amtsgericht Berlin (Charlottenburg) HRB 174932\nEquity P. Deutschland UG (haftungsbeschränkt) – Berlin",
      "type": "Registerbekanntmachung nach dem Umwandlungsgesetz",
      "state": "Berlin",
      "amtsgericht": "Amtsgericht Berlin (Charlottenburg)",
      "registernummer": "HRB 174932",
      "registerart": "HRB",
      "company_name": "Equity P. Deutschland UG (haftungsbeschränkt)",
      "company_seat": "Berlin",
      "details": "25.07.2025 (Bekanntmachungsdatum)\n\nBerlin Amtsgericht Berlin (Charlottenburg) HRB 174932\nRegisterbekanntmachung nach dem Umwandlungsgesetz\n\nEquity P. Deutschland UG (haftungsbeschränkt)\nGesellschaft mit beschränkter Haftung\nBerlin\n\nAls nicht eingetragen wird veröffentlicht:\n\nDie Gesellschaft hat den Verschmelzungsplan vom 03. Juli 2025 mit Neufassung vom 23.07.2025 einer grenzüberschreitenden Verschmelzung nach Österreich auf die Equity Partner GmbH mit Sitz in Wien/Österreich,\n(Firmenbuch der Republik Österreich -Justiz- zur Nummer FN 423024 w) eingereicht, der einschließlich der Neufassung im elektronischen Registerordner eingesehen werden kann. Dazu hat die Gesellschaft dem Registergericht die folgenden Angaben übermittelt, verbunden mit dem Antrag, diese bekannt zu machen:\n\nDie sich verschmelzenden Gesellschaften haben folgende Rechtsform:\nÜbertragende Gesellschaft:\nEquity P. Deutschland UG (haftungsbeschränkt), Sitz Berlin (AG Berlin -Charlottenburg - HRB 174932 B)\nÜbernehmende Gesellschaft:\nEquity Partner GmbH, mit Sitz in Wien/Österreich,\nFirmenbuch der Republik Österreich -Justiz- zur Nummer FN 423024 w\n\nIm Verschmelzungsplan werden die folgenden Sicherheiten angeboten:\n\n„Den Gläubigern der übertragenden Gesellschaft, die binnen eines Monats nach dem Tag, an dem der Plan für die grenzüberschreitende Verschmelzung bekannt gemacht worden ist, einen Anspruch nach Grund und Höhe schriftlich anmelden, ist\nSicherheit zu leisten, soweit sie nicht Befriedigung verlangen können. Dieses Recht steht den Gläubigern jedoch nur zu, wenn sie glaubhaft machen, dass durch die grenzüberschreitende Verschmelzung die Erfüllung ihrer Forderung gefährdet wird. Das Recht auf Sicherheitsleistung steht Gläubigern nur im Hinblick auf solche Forderungen zu, die vor oder bis zu 15 Tage nach Bekanntmachung des Plans für die grenzüberschreitende Verschmelzung entstanden sind. Vollständige Auskunft zu den Modalitäten des Gläubigerschutzes kann bei der übertragenden Gesellschaft unter der inländischen Geschäftsanschrift kostenfrei eingeholt werden.“\n\nEs wird seitens der Gesellschaft klargestellt, dass es sich dabei lediglich um im Verschmelzungsplan angebotene Sicherheitsleistungen handelt und darüber hinaus zu Gunsten der Gläubiger aber in jedem Fall die gesetzlichen Ansprüche auf Sicherheitsleistung gem. § 314 UmwG bestehen.\n\nDie Gesellschaft erteilt einen Hinweis an die Gläubiger der an der grenzüberschreitenden Verschmelzung beteiligten Gesellschaften, dass sie der jeweiligen Gesellschaft spätestens fünf Arbeitstage vor dem Tag der Gesellschafterversammlung Bemerkungen zum Verschmelzungsplan übermitteln können.\nHinweis zum Bekanntmachungsinhalt gem. § 308 Abs. 1 Ziff. 4 b UmwG:\nDie Gesellschaften haben keine Arbeitnehmer."
    },
    {
      "date": "2025-07-25",
      "id": "117537",
      "original_text": "Registerbekanntmachung nach dem Umwandlungsgesetz\nSaarland Amtsgericht Saarbrücken HRB 101564\nPatrik Spengler Verwaltungs-GmbH – St. Wendel",
      "type": "Registerbekanntmachung nach dem Umwandlungsgesetz",
      "state": "Saarland",
      "amtsgericht": "Amtsgericht Saarbrücken",
      "registernummer": "HRB 101564",
      "registerart": "HRB",
      "company_name": "Patrik Spengler Verwaltungs-GmbH",
      "company_seat": "St. Wendel",
      "details": "25.07.2025 (Bekanntmachungsdatum)\n\nSaarland Amtsgericht Saarbrücken HRB 101564\nRegisterbekanntmachung nach dem Umwandlungsgesetz 25.07.2025 (Eintragungsdatum)\n\nPatrik Spengler Verwaltungs-GmbH\nGesellschaft mit beschränkter Haftung\nSt. Wendel\n\nAls nicht eingetragen wird bekannt gemacht: Den Gläubigern der an der Verschmelzung beteiligten Gesellschaften ist, wenn sie binnen sechs Monaten nach dem Tag, an dem die Eintragung der Verschmelzung in das Register des Sitzes desjenigen Rechtsträgers, dessen Gläubiger sie sind, nach § 19 Absatz 3 UmwG bekannt gemacht worden ist, ihren Anspruch nach Grund und Höhe schriftlich anmelden, Sicherheit zu leisten, soweit sie nicht Befriedigung verlangen können. Dieses Recht steht den Gläubigern jedoch nur zu, wenn sie glaubhaft machen, dass durch die Verschmelzung die Erfüllung ihrer Forderung gefährdet wird."
    },
    {
      "date": "2025-07-25",
      "id": "117538",
      "original_text": "Registerbekanntmachung nach dem Umwandlungsgesetz\nNordrhein-Westfalen Amtsgericht Coesfeld HRB 11203\nKrusen Verwaltungs GmbH – Olfen",
      "type": "Registerbekanntmachung nach dem Umwandlungsgesetz",
      "state": "Nordrhein-Westfalen",
      "amtsgericht": "Amtsgericht Coesfeld",
      "registernummer": "HRB 11203",
      "registerart": "HRB",
      "company_name": "Krusen Verwaltungs GmbH",
      "company_seat": "Olfen",
      "details": "25.07.2025 (Bekanntmachungsdatum)\n\nNordrhein-Westfalen Amtsgericht Coesfeld HRB 11203\nRegisterbekanntmachung nach dem Umwandlungsgesetz 17.07.2025 (Eintragungsdatum)\n\nKrusen Verwaltungs GmbH\nGesellschaft mit beschränkter Haftung\nOlfen\n\nDen Gläubigern der an der Verschmelzung beteiligten Rechtsträger ist, wenn sie binnen sechs Monaten nach dem Tag, an dem die Eintragung der Verschmelzung in das Register des Sitzes derjenigen Rechtsträger deren Gläubiger sie sind, nach § 19 Absatz 3 UmwG als bekanntgemacht gilt, ihren Anspruch nach Grund und Höhe schriftlich anmelden, Sicherheit zu leisten, soweit sie nicht Befriedigung verlangen können. Dieses Recht steht den Gläubigern jedoch nur zu, wenn sie glaubhaft machen, dass durch die Verschmelzung die Erfüllung ihrer Forderung gefährdet wird."
    },
    {
      "date": "2025-07-25",
      "id": "117539",
      "original_text": "Registerbekanntmachung nach dem Umwandlungsgesetz\nBaden-Württemberg Amtsgericht Freiburg HRB 721777\nBlue Internet GmbH – Konstanz",
      "type": "Registerbekanntmachung nach dem Umwandlungsgesetz",
      "state": "Baden-Württemberg",
      "amtsgericht": "Amtsgericht Freiburg",
      "registernummer": "HRB 721777",
      "registerart": "HRB",
      "company_name": "Blue Internet GmbH",
      "company_seat": "Konstanz",
      "details": "25.07.2025 (Bekanntmachungsdatum)\n\nBaden-Württemberg Amtsgericht Freiburg HRB 721777\nRegisterbekanntmachung nach dem Umwandlungsgesetz 25.07.2025 (Eintragungsdatum)\n\nBlue Internet GmbH\nGesellschaft mit beschränkter Haftung\nKonstanz\n\nAls nicht eingetragen wird bekanntgemach (HRB 721777)t:\nDen Gläubigern der an der Verschmelzung beteiligten Rechtsträger ist, wenn sie binnen sechs Monaten nach dem Tag, an dem die Eintragung der Verschmelzung in das Register des Sitzes desjenigen Rechtsträgers, dessen Gläubiger sie sind, nach § 19 Abs. 3 UmwG als bekanntgemacht gilt, ihren Anspruch nach Grund und Höhe schriftlich anmelden, Sicherheit zu leisten, soweit sie nicht Befriedigung verlangen können. Dieses Recht steht den Gläubigern jedoch nur zu, wenn sie glaubhaft machen, dass durch die Verschmelzung die Erfüllung ihrer Forderung gefährdet wird."
    },
    {
      "date": "2025-07-25",
      "id": "117540",
      "original_text": "Registerbekanntmachung nach dem Umwandlungsgesetz\nSaarland Amtsgericht Saarbrücken HRB 16434\nHager SE – Blieskastel",
      "type": "Registerbekanntmachung nach dem Umwandlungsgesetz",
      "state": "Saarland",
      "amtsgericht": "Amtsgericht Saarbrücken",
      "registernummer": "HRB 16434",
      "registerart": "HRB",
      "company_name": "Hager SE",
      "company_seat": "Blieskastel",
      "details": "25.07.2025 (Bekanntmachungsdatum)\n\nSaarland Amtsgericht Saarbrücken HRB 16434\nRegisterbekanntmachung nach dem Umwandlungsgesetz\n\nHager SE\nEuropäische Aktiengesellschaft (SE)\nBlieskastel\n\nDem Registergericht ist der Entwurf eines Verschmelzungsplanes über die geplante Verschmelzung der Hager North & Central Europe GmbH mit Sitz in Heltersberg, Amtsgericht Zweibrücken HRB 23224, der Hager Systems Beteiligung GmbH, mit Sitz in Blieskastel, Amtsgericht Saarbrücken, HRB 11177 und der NORIS Verwaltungsgesellschaft mbH, mit Sitz in Blieskastel, Amtsgericht Saarbrücken HRB 11294\nmit der Hager SE mit Sitz in Blieskastel, Amtsgericht Saarbrüken HRB 16434 eingereicht worden.\nBesondere Rechte und Vorteile nach § 5 Abs. 1 Nr. 7 und 8 UmwG bestehen  nicht und werden im Rahmen der Verschmelzung auch nicht gewährt. Die vollständigen Auskünfte über diese Modalitäten können kostenlos eingeholt werden bei dem Amtsgericht Saarbrücken."
    },
    {
      "date": "2025-07-25",
      "id": "117541",
      "original_text": "Registerbekanntmachung nach dem Umwandlungsgesetz\nSaarland Amtsgericht Saarbrücken HRB 100517\nAltes Stadtbad Projekt GmbH – Merzig",
      "type": "Registerbekanntmachung nach dem Umwandlungsgesetz",
      "state": "Saarland",
      "amtsgericht": "Amtsgericht Saarbrücken",
      "registernummer": "HRB 100517",
      "registerart": "HRB",
      "company_name": "Altes Stadtbad Projekt GmbH",
      "company_seat": "Merzig",
      "details": "25.07.2025 (Bekanntmachungsdatum)\n\nSaarland Amtsgericht Saarbrücken HRB 100517\nRegisterbekanntmachung nach dem Umwandlungsgesetz\n\nAltes Stadtbad Projekt GmbH\nGesellschaft mit beschränkter Haftung\nMerzig\n\nDem Registergericht ist ein Verschmelzungsplan über die geplante Verschmelzung der Gesellschaft mit beschränkter Haftung nach deutschem Recht unter der Firma Altes Stadtbad Projekt GmbH mit Sitz in Merzig (HRB 100517) mit der Aktiengesellschaft nach luxemburgischen Recht unter der Firma EUROFERTIGBAU A.G. mit Sitz in Schwebsingen (RCS Luxemburg, B86311) eingereicht worden.\nGläubiger der zu verschmelzenden Gesellschaften, deren Forderungen vor Veröffentlichung des Verschmelzungsplans entstanden, aber im Zeitpunkt der Bekanntmachung an diesem Tag der Veröffentlichung noch nicht fällig geworden sind, bietet die EUROFERTIGBAU A.G. eine Bankbürgschaft eines deutschen Kreditinstituts an. Diese Gläubiger können- nach vorheriger Mitteilung an die Schuldnergesellschaft - innerhalb von drei Monaten nach dieser Veröffentlichung bei dem Richter, der der Kammer des Bezirksgerichts vorsteht, die für die Handelssachen zuständig ist, beantragen, eine angemessene Sicherheitsleistung zu erhalten, wenn sie glaubhaft machen könne, dass sie Befriedigung ihrer Forderungen aufgrund der Verschmelzung gefährdet ist und sie von der jeweiligen  Gesellschaft keine angemessene Sicherheitsleistung erhalten haben."
    },
    {
      "date": "2025-07-25",
      "id": "117542",
      "original_text": "Registerbekanntmachung nach dem Umwandlungsgesetz\nSachsen-Anhalt Amtsgericht Stendal HRB 14240\nSide by Side GmbH – Stendal",
      "type": "Registerbekanntmachung nach dem Umwandlungsgesetz",
      "state": "Sachsen-Anhalt",
      "amtsgericht": "Amtsgericht Stendal",
      "registernummer": "HRB 14240",
      "registerart": "HRB",
      "company_name": "Side by Side GmbH",
      "company_seat": "Stendal",
      "details": "25.07.2025 (Bekanntmachungsdatum)\n\nSachsen-Anhalt Amtsgericht Stendal HRB 14240\nRegisterbekanntmachung nach dem Umwandlungsgesetz 25.07.2025 (Eintragungsdatum)\n\nSide by Side GmbH\nGesellschaft mit beschränkter Haftung\nStendal\n\nNicht eingetragen:\nDen Gläubigern der an der Verschmelzung beteiligten Rechtsträger ist, wenn sie binnen sechs Monaten nach dem Tag, an dem die Eintragung der Verschmelzung nach § 19 Abs. 3 UmwG als bekanntgemacht gilt, ihren Anspruch nach Grund und Höhe schriftlich anmelden, Sicherheit zu leisten, soweit sie nicht Befriedigung verlangen können. Dieses Recht steht ihnen jedoch nur zu, wenn sie glaubhaft machen, dass durch die Verschmelzung die Erfüllung ihrer Forderung gefährdet wird."
    },
    {
      "date": "2025-07-25",
      "id": "117543",
      "original_text": "Registerbekanntmachung nach dem Umwandlungsgesetz\nBaden-Württemberg Amtsgericht Stuttgart VR 230054\nMusikverein Stadtkapelle Weilheim a.d.Teck, eingetragener Verein. – Weilheim an der Teck",
      "type": "Registerbekanntmachung nach dem Umwandlungsgesetz",
      "state": "Baden-Württemberg",
      "amtsgericht": "Amtsgericht Stuttgart",
      "registernummer": "VR 230054",
      "registerart": "VR",
      "company_name": "Musikverein Stadtkapelle Weilheim a.d.Teck, eingetragener Verein.",
      "company_seat": "Weilheim an der Teck",
      "details": "25.07.2025 (Bekanntmachungsdatum)\n\nBaden-Württemberg Amtsgericht Stuttgart VR 230054\nRegisterbekanntmachung nach dem Umwandlungsgesetz 25.07.2025 (Eintragungsdatum)\n\nMusikverein Stadtkapelle Weilheim a.d.Teck, eingetragener Verein.\neingetragener Verein\nWeilheim an der Teck\n\nAls nicht eingetragen wird bekanntgemacht:\nDen Gläubigern der an der Verschmelzung beteiligten Rechtsträger ist, wenn sie binnen sechs Monaten nach dem Tag, an dem die Eintragung der Verschmelzung in das Register des Sitzes desjenigen Rechtsträgers, dessen Gläubiger sie sind, nach § 19 Abs. 3 UmwG als bekanntgemacht gilt, ihren Anspruch nach Grund und Höhe schriftlich anmelden, Sicherheit zu leisten, soweit sie nicht Befriedigung verlangen können. Dieses Recht steht den Gläubigern jedoch nur zu, wenn sie glaubhaft machen, dass durch die Verschmelzung die Erfüllung ihrer Forderung gefährdet wird."
    },
    {
      "date": "2025-07-25",
      "id": "117544",
      "original_text": "Registerbekanntmachung nach dem Umwandlungsgesetz\nBaden-Württemberg Amtsgericht Stuttgart VR 230077\nMusikverein Holzmaden-Weilheim e.V. – Holzmaden",
      "type": "Registerbekanntmachung nach dem Umwandlungsgesetz",
      "state": "Baden-Württemberg",
      "amtsgericht": "Amtsgericht Stuttgart",
      "registernummer": "VR 230077",
      "registerart": "VR",
      "company_name": "Musikverein Holzmaden-Weilheim e.V.",
      "company_seat": "Holzmaden",
      "details": "25.07.2025 (Bekanntmachungsdatum)\n\nBaden-Württemberg Amtsgericht Stuttgart VR 230077\nRegisterbekanntmachung nach dem Umwandlungsgesetz 25.07.2025 (Eintragungsdatum)\n\nMusikverein Holzmaden-Weilheim e.V.\neingetragener Verein\nHolzmaden\n\nDen Gläubigern der an der Verschmelzung beteiligten Rechtsträger ist, wenn sie binnen sechs Monaten nach dem Tag, an dem die Eintragung der Verschmelzung in das Register des Sitzes desjenigen Rechtsträgers, dessen Gläubiger sie sind, nach § 19 Abs. 3 UmwG als bekanntgemacht gilt, ihren Anspruch nach Grund und Höhe schriftlich anmelden, Sicherheit zu leisten, soweit sie nicht Befriedigung verlangen können. Dieses Recht steht den Gläubigern jedoch nur zu, wenn sie glaubhaft machen, dass durch die Verschmelzung die Erfüllung ihrer Forderung gefährdet wird."
    },
    {
      "date": "2025-07-25",
      "id": "117545",
      "original_text": "Registerbekanntmachung nach dem Umwandlungsgesetz\nBerlin Amtsgericht Berlin (Charlottenburg) HRB 222957\nTCP Vermietung u. Verwaltung GmbH – Berlin",
      "type": "Registerbekanntmachung nach dem Umwandlungsgesetz",
      "state": "Berlin",
      "amtsgericht": "Amtsgericht Berlin (Charlottenburg)",
      "registernummer": "HRB 222957",
      "registerart": "HRB",
      "company_name": "TCP Vermietung u. Verwaltung GmbH",
      "company_seat": "Berlin",
      "details": "25.07.2025 (Bekanntmachungsdatum)\n\nBerlin Amtsgericht Berlin (Charlottenburg) HRB 222957\nRegisterbekanntmachung nach dem Umwandlungsgesetz 24.07.2025 (Eintragungsdatum)\n\nTCP Vermietung u. Verwaltung GmbH\nGesellschaft mit beschränkter Haftung\nBerlin\n\nZu Eintragungsnummer 3 vom 24.07.2025 wird als nicht eingetragen veröffentlicht:\n\nDen Gläubigern der an der Verschmelzung beteiligten Rechtsträger ist, wenn sie binnen sechs Monaten nach dem Tag, an dem die Eintragung der Verschmelzung in das Register des Sitzes desjenigen Rechtsträgers, dessen Gläubiger sie sind, als bekannt gemacht gilt, ihren Anspruch nach Grund und Höhe schriftlich anmelden, Sicherheit zu leisten, soweit sie nicht Befriedigung verlangen können. Dieses Recht steht den Gläubigern jedoch nur zu, wenn sie glaubhaft machen, dass durch die Verschmelzung die Erfüllung ihrer Forderung gefährdet wird. Das Recht, Sicherheitsleistung zu verlangen, steht Gläubigern nicht zu, die im Falle der Insolvenz ein Recht auf vorzugsweise Befriedigung aus einer Deckungsmasse haben, die nach gesetzlicher Vorschrift zu ihrem Schutz errichtet und staatlich überwacht ist."
    },
    {
      "date": "2025-07-25",
      "id": "117546",
      "original_text": "Einreichung neuer Dokumente\nSchleswig-Holstein Amtsgericht Flensburg HRB 1072 SL\nSchleswiger Stadtwerke GmbH – Schleswig",
      "type": "Einreichung neuer Dokumente",
      "state": "Schleswig-Holstein",
      "amtsgericht": "Amtsgericht Flensburg",
      "registernummer": "HRB 1072 SL",
      "registerart": "HRB",
      "company_name": "Schleswiger Stadtwerke GmbH",
      "company_seat": "Schleswig",
      "details": "25.07.2025 (Bekanntmachungsdatum)\n\nSchleswig-Holstein Amtsgericht Flensburg HRB 1072 SL\nEinreichung neuer Dokumente\n\nSchleswiger Stadtwerke GmbH\nGesellschaft mit beschränkter Haftung\nSchleswig\n\nAls nicht eingetragen wird veröffentlicht: Neue Aufsichtsratsliste nach Änderung eingereicht am 24.07.2025."
    },
    {
      "date": "2025-07-25",
      "id": "117547",
      "original_text": "Registerbekanntmachung nach dem Umwandlungsgesetz\nBaden-Württemberg Amtsgericht Stuttgart HRB 264472\nBurgaflex Deutschland GmbH – Leutenbach",
      "type": "Registerbekanntmachung nach dem Umwandlungsgesetz",
      "state": "Baden-Württemberg",
      "amtsgericht": "Amtsgericht Stuttgart",
      "registernummer": "HRB 264472",
      "registerart": "HRB",
      "company_name": "Burgaflex Deutschland GmbH",
      "company_seat": "Leutenbach",
      "details": "25.07.2025 (Bekanntmachungsdatum)\n\nBaden-Württemberg Amtsgericht Stuttgart HRB 264472\nRegisterbekanntmachung nach dem Umwandlungsgesetz 25.07.2025 (Eintragungsdatum)\n\nBurgaflex Deutschland GmbH\nGesellschaft mit beschränkter Haftung\nLeutenbach\n\nAls nicht eingetragen wird bekanntgemacht:\nDen Gläubigern der an der Verschmelzung beteiligten Rechtsträger ist, wenn sie binnen sechs Monaten nach dem Tag, an dem die Eintragung der Verschmelzung in das Register des Sitzes desjenigen Rechtsträgers, dessen Gläubiger sie sind, nach § 19 Abs. 3 UmwG als bekanntgemacht gilt, ihren Anspruch nach Grund und Höhe schriftlich anmelden, Sicherheit zu leisten, soweit sie nicht Befriedigung verlangen können. Dieses Recht steht den Gläubigern jedoch nur zu, wenn sie glaubhaft machen, dass durch die Verschmelzung die Erfüllung ihrer Forderung gefährdet wird."
    },
    {
      "date": "2025-07-25",
      "id": "117548",
      "original_text": "Einreichung neuer Dokumente\nSchleswig-Holstein Amtsgericht Flensburg HRB 1073 SL\nSchleswiger Kommunalbetriebe GmbH – Schleswig",
      "type": "Einreichung neuer Dokumente",
      "state": "Schleswig-Holstein",
      "amtsgericht": "Amtsgericht Flensburg",
      "registernummer": "HRB 1073 SL",
      "registerart": "HRB",
      "company_name": "Schleswiger Kommunalbetriebe GmbH",
      "company_seat": "Schleswig",
      "details": "25.07.2025 (Bekanntmachungsdatum)\n\nSchleswig-Holstein Amtsgericht Flensburg HRB 1073 SL\nEinreichung neuer Dokumente\n\nSchleswiger Kommunalbetriebe GmbH\nGesellschaft mit beschränkter Haftung\nSchleswig\n\nAls nicht eingetragen wird veröffentlicht: Neue Aufsichtsratsliste nach Änderung eingereicht am 23.07.2025."
    },
    {
      "date": "2025-07-25",
      "id": "117549",
      "original_text": "Registerbekanntmachung nach dem Umwandlungsgesetz\nBaden-Württemberg Amtsgericht Ulm HRB 743289\nANDRITZ Deutschland Holding GmbH – Göppingen",
      "type": "Registerbekanntmachung nach dem Umwandlungsgesetz",
      "state": "Baden-Württemberg",
      "amtsgericht": "Amtsgericht Ulm",
      "registernummer": "HRB 743289",
      "registerart": "HRB",
      "company_name": "ANDRITZ Deutschland Holding GmbH",
      "company_seat": "Göppingen",
      "details": "25.07.2025 (Bekanntmachungsdatum)\n\nBaden-Württemberg Amtsgericht Ulm HRB 743289\nRegisterbekanntmachung nach dem Umwandlungsgesetz 25.07.2025 (Eintragungsdatum)\n\nANDRITZ Deutschland Holding GmbH\nGesellschaft mit beschränkter Haftung\nGöppingen\n\nAls nicht eingetragen wird bekanntgemacht:\nDen Gläubigern der an der Verschmelzung beteiligten Rechtsträger ist, wenn sie binnen sechs Monaten nach dem Tag, an dem die Eintragung der Verschmelzung in das Register des Sitzes desjenigen Rechtsträgers, dessen Gläubiger sie sind, nach § 19 Abs. 3 UmwG als bekanntgemacht gilt, ihren Anspruch nach Grund und Höhe schriftlich anmelden, Sicherheit zu leisten, soweit sie nicht Befriedigung verlangen können. Dieses Recht steht den Gläubigern jedoch nur zu, wenn sie glaubhaft machen, dass durch die Verschmelzung die Erfüllung ihrer Forderung gefährdet wird."
    },
    {
      "date": "2025-07-25",
      "id": "117550",
      "original_text": "Registerbekanntmachung nach dem Umwandlungsgesetz\nBerlin Amtsgericht Berlin (Charlottenburg) HRB 166951\nTP eHealth.partners Holding GmbH – Berlin",
      "type": "Registerbekanntmachung nach dem Umwandlungsgesetz",
      "state": "Berlin",
      "amtsgericht": "Amtsgericht Berlin (Charlottenburg)",
      "registernummer": "HRB 166951",
      "registerart": "HRB",
      "company_name": "TP eHealth.partners Holding GmbH",
      "company_seat": "Berlin",
      "details": "25.07.2025 (Bekanntmachungsdatum)\n\nBerlin Amtsgericht Berlin (Charlottenburg) HRB 166951\nRegisterbekanntmachung nach dem Umwandlungsgesetz 24.07.2025 (Eintragungsdatum)\n\nTP eHealth.partners Holding GmbH\nGesellschaft mit beschränkter Haftung\nBerlin\n\nZu Eintragungsnummer 9 vom 24.07.2025 wird als nicht eingetragen veröffentlicht:\n\nDen Gläubigern der an der Verschmelzung beteiligten Rechtsträger ist, wenn sie binnen sechs Monaten nach dem Tag, an dem die Eintragung der Verschmelzung in das Register des Sitzes desjenigen Rechtsträgers, dessen Gläubiger sie sind, als bekannt gemacht gilt, ihren Anspruch nach Grund und Höhe schriftlich anmelden, Sicherheit zu leisten, soweit sie nicht Befriedigung verlangen können. Dieses Recht steht den Gläubigern jedoch nur zu, wenn sie glaubhaft machen, dass durch die Verschmelzung die Erfüllung ihrer Forderung gefährdet wird. Das Recht, Sicherheitsleistung zu verlangen, steht Gläubigern nicht zu, die im Falle der Insolvenz ein Recht auf vorzugsweise Befriedigung aus einer Deckungsmasse haben, die nach gesetzlicher Vorschrift zu ihrem Schutz errichtet und staatlich überwacht ist."
    },
    {
      "date": "2025-07-25",
      "id": "117551",
      "original_text": "Registerbekanntmachung nach dem Umwandlungsgesetz\nBaden-Württemberg Amtsgericht Stuttgart HRA 741879\nSchukrafft Hausverwaltung e. K. – Neuenstein",
      "type": "Registerbekanntmachung nach dem Umwandlungsgesetz",
      "state": "Baden-Württemberg",
      "amtsgericht": "Amtsgericht Stuttgart",
      "registernummer": "HRA 741879",
      "registerart": "HRA",
      "company_name": "Schukrafft Hausverwaltung e. K.",
      "company_seat": "Neuenstein",
      "details": "25.07.2025 (Bekanntmachungsdatum)\n\nBaden-Württemberg Amtsgericht Stuttgart HRA 741879\nRegisterbekanntmachung nach dem Umwandlungsgesetz 25.07.2025 (Eintragungsdatum)\n\nSchukrafft Hausverwaltung e. K.\nEinzelkaufmann / Einzelkauffrau\nNeuenstein\n\nAls nicht eingetragen wird bekanntgemacht:\nDen Gläubigern der an der Ausgliederung beteiligten Rechtsträger ist, wenn sie binnen sechs Monaten nach dem Tag, an dem die Eintragung der Ausgliederung in das Register des Sitzes desjenigen Rechtsträgers, dessen Gläubiger sie sind, nach § 19 Abs. 3 UmwG als bekanntgemacht gilt, ihren Anspruch nach Grund und Höhe schriftlich anmelden, Sicherheit zu leisten, soweit sie nicht Befriedigung verlangen können. Dieses Recht steht den Gläubigern jedoch nur zu, wenn sie glaubhaft machen, dass durch die Ausgliederung die Erfüllung ihrer Forderung gefährdet wird."
    },
    {
      "date": "2025-07-25",
      "id": "117552",
      "original_text": "Registerbekanntmachung nach dem Umwandlungsgesetz\nBaden-Württemberg Amtsgericht Stuttgart HRB 757027\nBurgaflex Deutschland GmbH – Leutenbach",
      "type": "Registerbekanntmachung nach dem Umwandlungsgesetz",
      "state": "Baden-Württemberg",
      "amtsgericht": "Amtsgericht Stuttgart",
      "registernummer": "HRB 757027",
      "registerart": "HRB",
      "company_name": "Burgaflex Deutschland GmbH",
      "company_seat": "Leutenbach",
      "details": "25.07.2025 (Bekanntmachungsdatum)\n\nBaden-Württemberg Amtsgericht Stuttgart HRB 757027\nRegisterbekanntmachung nach dem Umwandlungsgesetz 25.07.2025 (Eintragungsdatum)\n\nBurgaflex Deutschland GmbH\nGesellschaft mit beschränkter Haftung\nLeutenbach\n\nDen Gläubigern der an der Verschmelzung beteiligten Rechtsträger ist, wenn sie binnen sechs Monaten nach dem Tag, an dem die Eintragung der Verschmelzung in das Register des Sitzes desjenigen Rechtsträgers, dessen Gläubiger sie sind, nach § 19 Abs. 3 UmwG als bekanntgemacht gilt, ihren Anspruch nach Grund und Höhe schriftlich anmelden, Sicherheit zu leisten, soweit sie nicht Befriedigung verlangen können. Dieses Recht steht den Gläubigern jedoch nur zu, wenn sie glaubhaft machen, dass durch die Verschmelzung die Erfüllung ihrer Forderung gefährdet wird."
    },
    {
      "date": "2025-07-25",
      "id": "117553",
      "original_text": "Löschungsankündigung\nBrandenburg Amtsgericht Potsdam HRB 32748\nKuMeMa GmbH – Potsdam",
      "type": "Löschungsankündigung",
      "state": "Brandenburg",
      "amtsgericht": "Amtsgericht Potsdam",
      "registernummer": "HRB 32748",
      "registerart": "HRB",
      "company_name": "KuMeMa GmbH",
      "company_seat": "Potsdam",
      "details": "25.07.2025 (Bekanntmachungsdatum)\n\nBrandenburg Amtsgericht Potsdam HRB 32748\nLöschungsankündigung\n\nKuMeMa GmbH\nGesellschaft mit beschränkter Haftung\nPotsdam\n\nBei der nachstehenden Gesellschaft wird das Amtslöschungsverfahren gemäß § 394 FamFG eingeleitet. Widerspruchsfrist: 8 Wochen"
    },
    {
      "date": "2025-07-25",
      "id": "117554",
      "original_text": "Sonstige Registerbekanntmachung\nMecklenburg-Vorpommern Amtsgericht Rostock HRB 3815\nNatur- und Umweltpark Güstrow g GmbH (NUP Güstrow g GmbH) – Güstrow",
      "type": "Sonstige Registerbekanntmachung",
      "state": "Mecklenburg-Vorpommern",
      "amtsgericht": "Amtsgericht Rostock",
      "registernummer": "HRB 3815",
      "registerart": "HRB",
      "company_name": "Natur- und Umweltpark Güstrow g GmbH (NUP Güstrow g GmbH)",
      "company_seat": "Güstrow",
      "details": "25.07.2025 (Bekanntmachungsdatum)\n\nMecklenburg-Vorpommern Amtsgericht Rostock HRB 3815\nSonstige Registerbekanntmachung\n\nNatur- und Umweltpark Güstrow g GmbH (NUP Güstrow g GmbH)\nGesellschaft mit beschränkter Haftung\nGüstrow\n\nEine Liste der Mitglieder des Aufsichtsrats ist zum Handelsregister eingereicht worden."
    },
    {
      "date": "2025-07-25",
      "id": "117555",
      "original_text": "Registerbekanntmachung nach dem Umwandlungsgesetz\nHamburg Amtsgericht Hamburg HRB 162022\nDashport GmbH – Hamburg",
      "type": "Registerbekanntmachung nach dem Umwandlungsgesetz",
      "state": "Hamburg",
      "amtsgericht": "Amtsgericht Hamburg",
      "registernummer": "HRB 162022",
      "registerart": "HRB",
      "company_name": "Dashport GmbH",
      "company_seat": "Hamburg",
      "details": "25.07.2025 (Bekanntmachungsdatum)\n\nHamburg Amtsgericht Hamburg HRB 162022\nRegisterbekanntmachung nach dem Umwandlungsgesetz 25.07.2025 (Eintragungsdatum)\n\nDashport GmbH\nGesellschaft mit beschränkter Haftung\nHamburg\n\nAls nicht eingetragen wird bekannt gemacht:\nDen Gläubigern der an der Verschmelzung beteiligten Gesellschaften ist, wenn sie binnen sechs Monaten nach dem Tag, an dem die Eintragung der Verschmelzung in das Register des Sitzes desjenigen Rechtsträgers, dessen Gläubiger sie sind, nach § 19 Absatz 3 UmwG als bekannt gemacht gilt, ihren Anspruch nach Grund und Höhe schriftlich anmelden, Sicherheit zu leisten, soweit sie nicht Befriedigung verlangen können. Dieses Recht steht den Gläubigern jedoch nur zu, wenn sie glaubhaft machen, dass durch die Verschmelzung die Erfüllung ihrer Forderung gefährdet wird."
    },
    {
      "date": "2025-07-25",
      "id": "117556",
      "original_text": "Registerbekanntmachung nach dem Umwandlungsgesetz\nHamburg Amtsgericht Hamburg HRB 156748\nJebsen & Jessen Invest GmbH – Hamburg",
      "type": "Registerbekanntmachung nach dem Umwandlungsgesetz",
      "state": "Hamburg",
      "amtsgericht": "Amtsgericht Hamburg",
      "registernummer": "HRB 156748",
      "registerart": "HRB",
      "company_name": "Jebsen & Jessen Invest GmbH",
      "company_seat": "Hamburg",
      "details": "25.07.2025 (Bekanntmachungsdatum)\n\nHamburg Amtsgericht Hamburg HRB 156748\nRegisterbekanntmachung nach dem Umwandlungsgesetz 25.07.2025 (Eintragungsdatum)\n\nJebsen & Jessen Invest GmbH\nGesellschaft mit beschränkter Haftung\nHamburg\n\nAls nicht eingetragen wird bekannt gemacht:\nDen Gläubigern der an der Verschmelzung beteiligten Gesellschaften ist, wenn sie binnen sechs Monaten nach dem Tag, an dem die Eintragung der Verschmelzung in das Register des Sitzes desjenigen Rechtsträgers, dessen Gläubiger sie sind, nach § 19 Absatz 3 UmwG als bekannt gemacht gilt, ihren Anspruch nach Grund und Höhe schriftlich anmelden, Sicherheit zu leisten, soweit sie nicht Befriedigung verlangen können. Dieses Recht steht den Gläubigern jedoch nur zu, wenn sie glaubhaft machen, dass durch die Verschmelzung die Erfüllung ihrer Forderung gefährdet wird."
    },
    {
      "date": "2025-07-25",
      "id": "117557",
      "original_text": "Registerbekanntmachung nach dem Umwandlungsgesetz\nSachsen-Anhalt Amtsgericht Stendal HRB 209792\nHallesche Maschinen- und Dampfkesselarmaturenfabrik Dicker Werneburg Gesellschaft mit beschränkter Haftung – Halle (Saale)",
      "type": "Registerbekanntmachung nach dem Umwandlungsgesetz",
      "state": "Sachsen-Anhalt",
      "amtsgericht": "Amtsgericht Stendal",
      "registernummer": "HRB 209792",
      "registerart": "HRB",
      "company_name": "Hallesche Maschinen- und Dampfkesselarmaturenfabrik Dicker Werneburg Gesellschaft mit beschränkter Haftung",
      "company_seat": "Halle (Saale)",
      "details": "25.07.2025 (Bekanntmachungsdatum)\n\nSachsen-Anhalt Amtsgericht Stendal HRB 209792\nRegisterbekanntmachung nach dem Umwandlungsgesetz 25.07.2025 (Eintragungsdatum)\n\nHallesche Maschinen- und Dampfkesselarmaturenfabrik Dicker Werneburg Gesellschaft mit beschränkter Haftung\nGesellschaft mit beschränkter Haftung\nHalle (Saale)\n\nNicht eingetragen:\nDen Gläubigern der an der Verschmelzung beteiligten Rechtsträger ist, wenn sie binnen sechs Monaten nach dem Tag, an dem die Eintragung der Verschmelzung nach § 19 Abs. 3 UmwG als bekanntgemacht gilt, ihren Anspruch nach Grund und Höhe schriftlich anmelden, Sicherheit zu leisten, soweit sie nicht Befriedigung verlangen können. Dieses Recht steht ihnen jedoch nur zu, wenn sie glaubhaft machen, dass durch die Verschmelzung die Erfüllung ihrer Forderung gefährdet wird."
    },
    {
      "date": "2025-07-25",
      "id": "117558",
      "original_text": "Registerbekanntmachung nach dem Umwandlungsgesetz\nSachsen-Anhalt Amtsgericht Stendal HRB 35569\nTeam Pflege GmbH – Dessau-Roßlau",
      "type": "Registerbekanntmachung nach dem Umwandlungsgesetz",
      "state": "Sachsen-Anhalt",
      "amtsgericht": "Amtsgericht Stendal",
      "registernummer": "HRB 35569",
      "registerart": "HRB",
      "company_name": "Team Pflege GmbH",
      "company_seat": "Dessau-Roßlau",
      "details": "25.07.2025 (Bekanntmachungsdatum)\n\nSachsen-Anhalt Amtsgericht Stendal HRB 35569\nRegisterbekanntmachung nach dem Umwandlungsgesetz 25.07.2025 (Eintragungsdatum)\n\nTeam Pflege GmbH\nGesellschaft mit beschränkter Haftung\nDessau-Roßlau\n\nNicht eingetragen:\nDen Gläubigern der an der Ausgliederung beteiligten Rechtsträger, ist wenn sie binnen sechs Monaten nach dem Tag, an dem die Eintragung der Ausgliederung nach §§125, 19 Abs. 3 UmwG als bekanntgemacht gilt, ihren Anspruch nach Grund und Höhe schriftlich anmelden, Sicherheit zu leisten, soweit sie nicht Befriedigung verlangen können. Diese Recht steht ihnen jedoch nur zu, wenn sie glaubhaft machen, dass durch die Ausgliederung die Erfüllung ihrer Forderung gefährdet wird."
    },
    {
      "date": "2025-07-25",
      "id": "117559",
      "original_text": "Registerbekanntmachung nach dem Umwandlungsgesetz\nBaden-Württemberg Amtsgericht Mannheim HRB 717981\nConradia Medical Prevention GmbH – Heidelberg",
      "type": "Registerbekanntmachung nach dem Umwandlungsgesetz",
      "state": "Baden-Württemberg",
      "amtsgericht": "Amtsgericht Mannheim",
      "registernummer": "HRB 717981",
      "registerart": "HRB",
      "company_name": "Conradia Medical Prevention GmbH",
      "company_seat": "Heidelberg",
      "details": "25.07.2025 (Bekanntmachungsdatum)\n\nBaden-Württemberg Amtsgericht Mannheim HRB 717981\nRegisterbekanntmachung nach dem Umwandlungsgesetz 25.07.2025 (Eintragungsdatum)\n\nConradia Medical Prevention GmbH\nGesellschaft mit beschränkter Haftung\nHeidelberg\n\nAls nicht eingetragen wird bekanntgemacht:\nDen Gläubigern der an der Verschmelzung beteiligten Rechtsträger ist, wenn sie binnen sechs Monaten nach dem Tag, an dem die Eintragung der Verschmelzung in das Register des Sitzes desjenigen Rechtsträgers, dessen Gläubiger sie sind, nach § 19 Abs. 3 UmwG als bekanntgemacht gilt, ihren Anspruch nach Grund und Höhe schriftlich anmelden, Sicherheit zu leisten, soweit sie nicht Befriedigung verlangen können. Dieses Recht steht den Gläubigern jedoch nur zu, wenn sie glaubhaft machen, dass durch die Verschmelzung die Erfüllung ihrer Forderung gefährdet wird."
    },
    {
      "date": "2025-07-25",
      "id": "117560",
      "original_text": "Löschungsankündigung\nBaden-Württemberg Amtsgericht Stuttgart HRB 739392\nNew Feeling Versandhandelsgesellschaft mbH – Lenningen",
      "type": "Löschungsankündigung",
      "state": "Baden-Württemberg",
      "amtsgericht": "Amtsgericht Stuttgart",
      "registernummer": "HRB 739392",
      "registerart": "HRB",
      "company_name": "New Feeling Versandhandelsgesellschaft mbH",
      "company_seat": "Lenningen",
      "details": "25.07.2025 (Bekanntmachungsdatum)\n\nBaden-Württemberg Amtsgericht Stuttgart HRB 739392\nLöschungsankündigung\n\nNew Feeling Versandhandelsgesellschaft mbH\nGesellschaft mit beschränkter Haftung\nLenningen\n\nDas Gericht beabsichtigt, die Gesellschaft wegen Vermögenslosigkeit im Handelsregister von Amts wegen nach § 394 FamFG zu löschen. Die Frist zur Geltendmachung eines Widerspruchs gegen die beabsichtigte Löschung ist auf zwei Monate ab Veröffentlichung bestimmt."
    },
    {
      "date": "2025-07-25",
      "id": "117561",
      "original_text": "Registerbekanntmachung nach dem Umwandlungsgesetz\nBaden-Württemberg Amtsgericht Ulm HRB 741138\nArea 46 GmbH – Ellwangen Jagst",
      "type": "Registerbekanntmachung nach dem Umwandlungsgesetz",
      "state": "Baden-Württemberg",
      "amtsgericht": "Amtsgericht Ulm",
      "registernummer": "HRB 741138",
      "registerart": "HRB",
      "company_name": "Area 46 GmbH",
      "company_seat": "Ellwangen Jagst",
      "details": "25.07.2025 (Bekanntmachungsdatum)\n\nBaden-Württemberg Amtsgericht Ulm HRB 741138\nRegisterbekanntmachung nach dem Umwandlungsgesetz 25.07.2025 (Eintragungsdatum)\n\nArea 46 GmbH\nGesellschaft mit beschränkter Haftung\nEllwangen Jagst\n\nAls nicht eingetragen wird bekanntgemacht:\nDen Gläubigern der an der Verschmelzung beteiligten Rechtsträger ist, wenn sie binnen sechs Monaten nach dem Tag, an dem die Eintragung der Verschmelzung in das Register des Sitzes desjenigen Rechtsträgers, dessen Gläubiger sie sind, nach § 19 Abs. 3 UmwG als bekanntgemacht gilt, ihren Anspruch nach Grund und Höhe schriftlich anmelden, Sicherheit zu leisten, soweit sie nicht Befriedigung verlangen können. Dieses Recht steht den Gläubigern jedoch nur zu, wenn sie glaubhaft machen, dass durch die Verschmelzung die Erfüllung ihrer Forderung gefährdet wird."
    },
    {
      "date": "2025-07-25",
      "id": "117562",
      "original_text": "Registerbekanntmachung nach dem Umwandlungsgesetz\nBaden-Württemberg Amtsgericht Ulm HRB 741890\nAsimmo GmbH – Ellwangen Jagst",
      "type": "Registerbekanntmachung nach dem Umwandlungsgesetz",
      "state": "Baden-Württemberg",
      "amtsgericht": "Amtsgericht Ulm",
      "registernummer": "HRB 741890",
      "registerart": "HRB",
      "company_name": "Asimmo GmbH",
      "company_seat": "Ellwangen Jagst",
      "details": "25.07.2025 (Bekanntmachungsdatum)\n\nBaden-Württemberg Amtsgericht Ulm HRB 741890\nRegisterbekanntmachung nach dem Umwandlungsgesetz 25.07.2025 (Eintragungsdatum)\n\nAsimmo GmbH\nGesellschaft mit beschränkter Haftung\nEllwangen Jagst\n\nDen Gläubigern der an der Verschmelzung beteiligten Rechtsträger ist, wenn sie binnen sechs Monaten nach dem Tag, an dem die Eintragung der Verschmelzung in das Register des Sitzes desjenigen Rechtsträgers, dessen Gläubiger sie sind, nach § 19 Abs. 3 UmwG als bekanntgemacht gilt, ihren Anspruch nach Grund und Höhe schriftlich anmelden, Sicherheit zu leisten, soweit sie nicht Befriedigung verlangen können. Dieses Recht steht den Gläubigern jedoch nur zu, wenn sie glaubhaft machen, dass durch die Verschmelzung die Erfüllung ihrer Forderung gefährdet wird."
    },
    {
      "date": "2025-07-25",
      "id": "117563",
      "original_text": "Registerbekanntmachung nach dem Umwandlungsgesetz\nBaden-Württemberg Amtsgericht Ulm HRB 738618\nMAT Montage GmbH – Salach",
      "type": "Registerbekanntmachung nach dem Umwandlungsgesetz",
      "state": "Baden-Württemberg",
      "amtsgericht": "Amtsgericht Ulm",
      "registernummer": "HRB 738618",
      "registerart": "HRB",
      "company_name": "MAT Montage GmbH",
      "company_seat": "Salach",
      "details": "25.07.2025 (Bekanntmachungsdatum)\n\nBaden-Württemberg Amtsgericht Ulm HRB 738618\nRegisterbekanntmachung nach dem Umwandlungsgesetz 25.07.2025 (Eintragungsdatum)\n\nMAT Montage GmbH\nGesellschaft mit beschränkter Haftung\nSalach\n\nAls nicht eingetragen wird bekanntgemacht:\nDen Gläubigern der an der Verschmelzung beteiligten Rechtsträger ist, wenn sie binnen sechs Monaten nach dem Tag, an dem die Eintragung der Verschmelzung in das Register des Sitzes desjenigen Rechtsträgers, dessen Gläubiger sie sind, nach § 19 Abs. 3 UmwG als bekanntgemacht gilt, ihren Anspruch nach Grund und Höhe schriftlich anmelden, Sicherheit zu leisten, soweit sie nicht Befriedigung verlangen können. Dieses Recht steht den Gläubigern jedoch nur zu, wenn sie glaubhaft machen, dass durch die Verschmelzung die Erfüllung ihrer Forderung gefährdet wird."
    },
    {
      "date": "2025-07-25",
      "id": "117564",
      "original_text": "Registerbekanntmachung nach dem Umwandlungsgesetz\nBaden-Württemberg Amtsgericht Ulm HRB 734690\nMETALLART Treppen GmbH – Salach",
      "type": "Registerbekanntmachung nach dem Umwandlungsgesetz",
      "state": "Baden-Württemberg",
      "amtsgericht": "Amtsgericht Ulm",
      "registernummer": "HRB 734690",
      "registerart": "HRB",
      "company_name": "METALLART Treppen GmbH",
      "company_seat": "Salach",
      "details": "25.07.2025 (Bekanntmachungsdatum)\n\nBaden-Württemberg Amtsgericht Ulm HRB 734690\nRegisterbekanntmachung nach dem Umwandlungsgesetz 25.07.2025 (Eintragungsdatum)\n\nMETALLART Treppen GmbH\nGesellschaft mit beschränkter Haftung\nSalach\n\nDen Gläubigern der an der Verschmelzung beteiligten Rechtsträger ist, wenn sie binnen sechs Monaten nach dem Tag, an dem die Eintragung der Verschmelzung in das Register des Sitzes desjenigen Rechtsträgers, dessen Gläubiger sie sind, nach § 19 Abs. 3 UmwG als bekanntgemacht gilt, ihren Anspruch nach Grund und Höhe schriftlich anmelden, Sicherheit zu leisten, soweit sie nicht Befriedigung verlangen können. Dieses Recht steht den Gläubigern jedoch nur zu, wenn sie glaubhaft machen, dass durch die Verschmelzung die Erfüllung ihrer Forderung gefährdet wird."
    },
    {
      "date": "2025-07-25",
      "id": "117565",
      "original_text": "Registerbekanntmachung nach dem Umwandlungsgesetz\nHamburg Amtsgericht Hamburg HRB 192756\nDP Hamburg GmbH – Hamburg",
      "type": "Registerbekanntmachung nach dem Umwandlungsgesetz",
      "state": "Hamburg",
      "amtsgericht": "Amtsgericht Hamburg",
      "registernummer": "HRB 192756",
      "registerart": "HRB",
      "company_name": "DP Hamburg GmbH",
      "company_seat": "Hamburg",
      "details": "25.07.2025 (Bekanntmachungsdatum)\n\nHamburg Amtsgericht Hamburg HRB 192756\nRegisterbekanntmachung nach dem Umwandlungsgesetz 25.07.2025 (Eintragungsdatum)\n\nDP Hamburg GmbH\nGesellschaft mit beschränkter Haftung\nHamburg\n\nAls nicht eingetragen wird bekannt gemacht:\nDen Gläubigern der an der Verschmelzung beteiligten Gesellschaften ist, wenn sie binnen sechs Monaten nach dem Tag, an dem die Eintragung der Verschmelzung in das Register des Sitzes desjenigen Rechtsträgers, dessen Gläubiger sie sind, nach § 19 Absatz 3 UmwG als bekannt gemacht gilt, ihren Anspruch nach Grund und Höhe schriftlich anmelden, Sicherheit zu leisten, soweit sie nicht Befriedigung verlangen können. Dieses Recht steht den Gläubigern jedoch nur zu, wenn sie glaubhaft machen, dass durch die Verschmelzung die Erfüllung ihrer Forderung gefährdet wird."
    },
    {
      "date": "2025-07-25",
      "id": "117566",
      "original_text": "Registerbekanntmachung nach dem Umwandlungsgesetz\nHamburg Amtsgericht Hamburg HRA 132435\nÖzcelik oHG – Hamburg",
      "type": "Registerbekanntmachung nach dem Umwandlungsgesetz",
      "state": "Hamburg",
      "amtsgericht": "Amtsgericht Hamburg",
      "registernummer": "HRA 132435",
      "registerart": "HRA",
      "company_name": "Özcelik oHG",
      "company_seat": "Hamburg",
      "details": "25.07.2025 (Bekanntmachungsdatum)\n\nHamburg Amtsgericht Hamburg HRA 132435\nRegisterbekanntmachung nach dem Umwandlungsgesetz 25.07.2025 (Eintragungsdatum)\n\nÖzcelik oHG\nOffene Handelsgesellschaft\nHamburg\n\nAls nicht eingetragen wird bekannt gemacht:\nDen Gläubigern der an der Verschmelzung beteiligten Gesellschaften ist, wenn sie binnen sechs Monaten nach dem Tag, an dem die Eintragung der Verschmelzung in das Register des Sitzes desjenigen Rechtsträgers, dessen Gläubiger sie sind, nach § 19 Absatz 3 UmwG als bekannt gemacht gilt, ihren Anspruch nach Grund und Höhe schriftlich anmelden, Sicherheit zu leisten, soweit sie nicht Befriedigung verlangen können. Dieses Recht steht den Gläubigern jedoch nur zu, wenn sie glaubhaft machen, dass durch die Verschmelzung die Erfüllung ihrer Forderung gefährdet wird."
    },
    {
      "date": "2025-07-25",
      "id": "117567",
      "original_text": "Registerbekanntmachung nach dem Umwandlungsgesetz\nSachsen-Anhalt Amtsgericht Stendal HRA 8135\nNicole Kersten e.K. – Dessau-Roßlau",
      "type": "Registerbekanntmachung nach dem Umwandlungsgesetz",
      "state": "Sachsen-Anhalt",
      "amtsgericht": "Amtsgericht Stendal",
      "registernummer": "HRA 8135",
      "registerart": "HRA",
      "company_name": "Nicole Kersten e.K.",
      "company_seat": "Dessau-Roßlau",
      "details": "25.07.2025 (Bekanntmachungsdatum)\n\nSachsen-Anhalt Amtsgericht Stendal HRA 8135\nRegisterbekanntmachung nach dem Umwandlungsgesetz 25.07.2025 (Eintragungsdatum)\n\nNicole Kersten e.K.\nEinzelkaufmann / Einzelkauffrau\nDessau-Roßlau\n\nNicht eingetragen:\nDen Gläubigern der an der Ausgliederung beteiligten Rechtsträger, ist wenn sie binnen sechs Monaten nach dem Tag, an dem die Eintragung der Ausgliederung nach §§125, 19 Abs. 3 UmwG als bekanntgemacht gilt, ihren Anspruch nach Grund und Höhe schriftlich anmelden, Sicherheit zu leisten, soweit sie nicht Befriedigung verlangen können. Diese Recht steht ihnen jedoch nur zu, wenn sie glaubhaft machen, dass durch die Ausgliederung die Erfüllung ihrer Forderung gefährdet wird."
    },
    {
      "date": "2025-07-25",
      "id": "117568",
      "original_text": "Registerbekanntmachung nach dem Umwandlungsgesetz\nHamburg Amtsgericht Hamburg HRA 131926\nKabul Fire Records e.K. – Hamburg",
      "type": "Registerbekanntmachung nach dem Umwandlungsgesetz",
      "state": "Hamburg",
      "amtsgericht": "Amtsgericht Hamburg",
      "registernummer": "HRA 131926",
      "registerart": "HRA",
      "company_name": "Kabul Fire Records e.K.",
      "company_seat": "Hamburg",
      "details": "25.07.2025 (Bekanntmachungsdatum)\n\nHamburg Amtsgericht Hamburg HRA 131926\nRegisterbekanntmachung nach dem Umwandlungsgesetz 25.07.2025 (Eintragungsdatum)\n\nKabul Fire Records e.K.\nEinzelkaufmann\nHamburg\n\nAls nicht eingetragen wird bekannt gemacht:\nDen Gläubigern der an der Ausgliederung beteiligten Gesellschaften ist, wenn sie binnen sechs Monaten nach dem Tag, an dem die Eintragung der Ausgliederung in das Register des Sitzes desjenigen Rechtsträgers, dessen Gläubiger sie sind, nach § 19 Absatz 3 UmwG als bekannt gemacht gilt, ihren Anspruch nach Grund und Höhe schriftlich anmelden, Sicherheit zu leisten, soweit sie nicht Befriedigung verlangen können. Dieses Recht steht den Gläubigern jedoch nur zu, wenn sie glaubhaft machen, dass durch die Ausgliederung die Erfüllung ihrer Forderung gefährdet wird."
    },
    {
      "date": "2025-07-25",
      "id": "117569",
      "original_text": "Löschungsankündigung\nSchleswig-Holstein Amtsgericht Kiel HRB 24259\nAviin Service GmbH – Rendsburg",
      "type": "Löschungsankündigung",
      "state": "Schleswig-Holstein",
      "amtsgericht": "Amtsgericht Kiel",
      "registernummer": "HRB 24259",
      "registerart": "HRB",
      "company_name": "Aviin Service GmbH",
      "company_seat": "Rendsburg",
      "details": "25.07.2025 (Bekanntmachungsdatum)\n\nSchleswig-Holstein Amtsgericht Kiel HRB 24259\nLöschungsankündigung\n\nAviin Service GmbH\nGesellschaft mit beschränkter Haftung\nRendsburg\n\nEs ist die Löschung der nachstehenden Gesellschaft wegen Vermögenslosigkeit gemäß § 394 FamFG beabsichtigt. Widerspruchsfrist: 2 Monate."
    },
    {
      "date": "2025-07-25",
      "id": "117570",
      "original_text": "Löschungsankündigung\nSchleswig-Holstein Amtsgericht Flensburg HRB 17039\nZero One UG (haftungsbeschränkt) – Flensburg",
      "type": "Löschungsankündigung",
      "state": "Schleswig-Holstein",
      "amtsgericht": "Amtsgericht Flensburg",
      "registernummer": "HRB 17039",
      "registerart": "HRB",
      "company_name": "Zero One UG (haftungsbeschränkt)",
      "company_seat": "Flensburg",
      "details": "25.07.2025 (Bekanntmachungsdatum)\n\nSchleswig-Holstein Amtsgericht Flensburg HRB 17039\nLöschungsankündigung\n\nZero One UG (haftungsbeschränkt)\nGesellschaft mit beschränkter Haftung\nFlensburg\n\nEs ist die Löschung der nachstehenden Gesellschaft wegen Vermögenslosigkeit gemäß § 394 FamFG beabsichtigt.\nWiderspruchsfrist: 2 Monate"
    },
    {
      "date": "2025-07-25",
      "id": "117571",
      "original_text": "Registerbekanntmachung nach dem Umwandlungsgesetz\nBrandenburg Amtsgericht Potsdam HRB 4313\nela mechanische Sicherheitstechnik GmbH – Beelitz",
      "type": "Registerbekanntmachung nach dem Umwandlungsgesetz",
      "state": "Brandenburg",
      "amtsgericht": "Amtsgericht Potsdam",
      "registernummer": "HRB 4313",
      "registerart": "HRB",
      "company_name": "ela mechanische Sicherheitstechnik GmbH",
      "company_seat": "Beelitz",
      "details": "25.07.2025 (Bekanntmachungsdatum)\n\nBrandenburg Amtsgericht Potsdam HRB 4313\nRegisterbekanntmachung nach dem Umwandlungsgesetz 24.07.2025 (Eintragungsdatum)\n\nela mechanische Sicherheitstechnik GmbH\nGesellschaft mit beschränkter Haftung\nBeelitz\n\nZu Eintragungsnummer 13 vom 24.07.2025 wird als nicht eingetragen veröffentlicht: Den Gläubigern der an der Verschmelzung beteiligten Rechtsträger ist, wenn sie binnen sechs Monaten nach dem Tag, an dem die Eintragung der Verschmelzung in das Register des Sitzes desjenigen Rechtsträgers, dessen Gläubiger sie sind, als bekannt gemacht gilt, ihren Anspruch nach Grund und Höhe schriftlich anmelden, Sicherheit zu leisten, soweit sie nicht Befriedigung verlangen können. Dieses Recht steht den Gläubigern jedoch nur zu, wenn sie glaubhaft machen, dass durch die Verschmelzung die Erfüllung ihrer Forderung gefährdet wird."
    },
    {
      "date": "2025-07-25",
      "id": "117572",
      "original_text": "Registerbekanntmachung nach dem Umwandlungsgesetz\nMecklenburg-Vorpommern Amtsgericht Schwerin HRB 6252\nS.M.R. Industrie- und Schiffsservice GmbH – Boizenburg",
      "type": "Registerbekanntmachung nach dem Umwandlungsgesetz",
      "state": "Mecklenburg-Vorpommern",
      "amtsgericht": "Amtsgericht Schwerin",
      "registernummer": "HRB 6252",
      "registerart": "HRB",
      "company_name": "S.M.R. Industrie- und Schiffsservice GmbH",
      "company_seat": "Boizenburg",
      "details": "25.07.2025 (Bekanntmachungsdatum)\n\nMecklenburg-Vorpommern Amtsgericht Schwerin HRB 6252\nRegisterbekanntmachung nach dem Umwandlungsgesetz 25.07.2025 (Eintragungsdatum)\n\nS.M.R. Industrie- und Schiffsservice GmbH\nGesellschaft mit beschränkter Haftung\nBoizenburg\n\nDen Gläubigern der an der Verschmelzung beteiligten Gesellschaften ist, wenn sie binnen sechs Monaten nach dem Tag, an dem die Eintragung der Verschmelzungen in das Register des Sitzes desjenigen Rechtsträgers, dessen Gläubiger sie sind, nach § 19 Absatz 3 UmwG als bekanntgemacht gilt, ihren Anspruch nach Grund und Höhe schriftlich anmelden, Sicherheit zu leisten, soweit sie nicht Befriedigung verlangen können. Dieses Recht steht den Gläubigern jedoch nur zu, wenn sie glaubhaft machen, dass durch die Verschmelzung die Erfüllung ihrer Forderung gefährdet wird."
    },
    {
      "date": "2025-07-25",
      "id": "117573",
      "original_text": "Einreichung neuer Dokumente\nSchleswig-Holstein Amtsgericht Kiel HRB 18025\nBreedijk Real Estate GmbH – Plön",
      "type": "Einreichung neuer Dokumente",
      "state": "Schleswig-Holstein",
      "amtsgericht": "Amtsgericht Kiel",
      "registernummer": "HRB 18025",
      "registerart": "HRB",
      "company_name": "Breedijk Real Estate GmbH",
      "company_seat": "Plön",
      "details": "25.07.2025 (Bekanntmachungsdatum)\n\nSchleswig-Holstein Amtsgericht Kiel HRB 18025\nEinreichung neuer Dokumente\n\nBreedijk Real Estate GmbH\nGesellschaft mit beschränkter Haftung\nPlön\n\nAls nicht eingetragen wird veröffentlicht:\n\nl. Angaben gemäß § 308 Abs. (l) Nrn. l bis 3 UmwG:\nDem Registergericht ist der Entwurf eines Verschmelzungsplans über die geplante Verschmelzung der D. Breedijk Holding B.V., eine Gesellschaft mit beschränkter Haftung gegründet nach niederländischem Recht, mit Sitz in Warmond/Niederlande, sowie mit Geschäftsanschrift Eutiner Straße 9a, 24306 Plön/Deutschland, eingetragen im niederländischen Handelsregister\nunter der Nummer 280453836 auf die Breedijk Real Estate GmbH, eine Gesellschaft mit beschränkter Haftung, gegründet nach deutschem Recht und mit Sitz in Plön, Deutschland, sowie mit Geschäftsanschrift Eutiner Straße 9 a, 24306 Plön, Deutschland, eingetragen beim Handelsregister des Amtsgerichts Kiel unter HRB 18025 Kl eingereicht worden.\n\n2. Angaben gemäß § 308 Abs. l Nr. 4 UmwG\nDie Gesellschafterversammlung der Breedijk Real Estate GmbH wird voraussichtlich am 8. Oktober 2025 über die Zustimmung zu dem Plan für die grenzüberschreitende Verschmelzung beschließen. Anteilsinhaber und Gläubiger der an der grenzüberschreitenden Verschmelzung beteiligten Gesellschaften können der Gesellschaft bis spätestens fünf Arbeitstage vor dem Tag der Gesellschafterversammlung, also bis zum 3. Oktober 2025, 24:00 Uhr, Bemerkungen zum Verschmelzungsplan an die Geschäftsanschrift der Gesellschaft Eutiner Straße 9 a, 24306 Plön, Deutschland, oder per Email an brdijk@t-online.de übermitteln. Da die Gesellschaft keine Arbeitnehmer hat, unterbleibt darüber hinaus ein Hinweis gemäß § 308 Abs. l Satz 2 Nr. 4 b) UmwG."
    },
    {
      "date": "2025-07-25",
      "id": "117574",
      "original_text": "Registerbekanntmachung nach dem Umwandlungsgesetz\nBerlin Amtsgericht Berlin (Charlottenburg) HRB 44819\nHOWOGE Wohnungsbaugesellschaft mit beschränkter Haftung – Berlin",
      "type": "Registerbekanntmachung nach dem Umwandlungsgesetz",
      "state": "Berlin",
      "amtsgericht": "Amtsgericht Berlin (Charlottenburg)",
      "registernummer": "HRB 44819",
      "registerart": "HRB",
      "company_name": "HOWOGE Wohnungsbaugesellschaft mit beschränkter Haftung",
      "company_seat": "Berlin",
      "details": "25.07.2025 (Bekanntmachungsdatum)\n\nBerlin Amtsgericht Berlin (Charlottenburg) HRB 44819\nRegisterbekanntmachung nach dem Umwandlungsgesetz 23.07.2025 (Eintragungsdatum)\n\nHOWOGE Wohnungsbaugesellschaft mit beschränkter Haftung\nGesellschaft mit beschränkter Haftung\nBerlin\n\nZu Eintragungsnummer 34 vom 23.07.2025 wird als nicht eingetragen veröffentlicht: Den Gläubigern der an der Verschmelzung beteiligten Rechtsträger ist, wenn sie binnen sechs Monaten nach dem Tag, an dem die Eintragung der Verschmelzung in das Register des Sitzes desjenigen Rechtsträgers, dessen Gläubiger sie sind, als bekannt gemacht gilt, ihren Anspruch nach Grund und Höhe schriftlich anmelden, Sicherheit zu leisten, soweit sie nicht Befriedigung verlangen können. Dieses Recht steht den Gläubigern jedoch nur zu, wenn sie glaubhaft machen, dass durch die Verschmelzung die Erfüllung ihrer Forderung gefährdet wird. Das Recht, Sicherheitsleistung zu verlangen, steht Gläubigern nicht zu, die im Falle der Insolvenz ein Recht auf vorzugsweise Befriedigung aus einer Deckungsmasse haben, die nach gesetzlicher Vorschrift zu ihrem Schutz errichtet und staatlich überwacht ist."
    },
    {
      "date": "2025-07-25",
      "id": "117575",
      "original_text": "Einreichung neuer Dokumente\nBaden-Württemberg Amtsgericht Stuttgart HRB 20227\nFichtner Bauconsulting GmbH – Stuttgart",
      "type": "Einreichung neuer Dokumente",
      "state": "Baden-Württemberg",
      "amtsgericht": "Amtsgericht Stuttgart",
      "registernummer": "HRB 20227",
      "registerart": "HRB",
      "company_name": "Fichtner Bauconsulting GmbH",
      "company_seat": "Stuttgart",
      "details": "25.07.2025 (Bekanntmachungsdatum)\n\nBaden-Württemberg Amtsgericht Stuttgart HRB 20227\nEinreichung neuer Dokumente\n\nFichtner Bauconsulting GmbH\nGesellschaft mit beschränkter Haftung\nStuttgart\n\nDie Gesellschaft hat am 24.07.2025 die Liste über die Zusammensetzung des Aufsichtsrats zum Handelsregister eingereicht."
    },
    {
      "date": "2025-07-25",
      "id": "117576",
      "original_text": "Registerbekanntmachung nach dem Umwandlungsgesetz\nBerlin Amtsgericht Berlin (Charlottenburg) HRB 236811\nRapid Data GmbH Unternehmensberatung – Berlin",
      "type": "Registerbekanntmachung nach dem Umwandlungsgesetz",
      "state": "Berlin",
      "amtsgericht": "Amtsgericht Berlin (Charlottenburg)",
      "registernummer": "HRB 236811",
      "registerart": "HRB",
      "company_name": "Rapid Data GmbH Unternehmensberatung",
      "company_seat": "Berlin",
      "details": "25.07.2025 (Bekanntmachungsdatum)\n\nBerlin Amtsgericht Berlin (Charlottenburg) HRB 236811\nRegisterbekanntmachung nach dem Umwandlungsgesetz 23.07.2025 (Eintragungsdatum)\n\nRapid Data GmbH Unternehmensberatung\nGesellschaft mit beschränkter Haftung\nBerlin\n\nZu Eintragungsnummer 8 vom 23.07.2025 wird als nicht eingetragen veröffentlicht: Den Gläubigern der an der Verschmelzung beteiligten Rechtsträger ist, wenn sie binnen sechs Monaten nach dem Tag, an dem die Eintragung der Verschmelzung in das Register des Sitzes desjenigen Rechtsträgers, dessen Gläubiger sie sind, als bekannt gemacht gilt, ihren Anspruch nach Grund und Höhe schriftlich anmelden, Sicherheit zu leisten, soweit sie nicht Befriedigung verlangen können. Dieses Recht steht den Gläubigern jedoch nur zu, wenn sie glaubhaft machen, dass durch die Verschmelzung die Erfüllung ihrer Forderung gefährdet wird. Das Recht, Sicherheitsleistung zu verlangen, steht Gläubigern nicht zu, die im Falle der Insolvenz ein Recht auf vorzugsweise Befriedigung aus einer Deckungsmasse haben, die nach gesetzlicher Vorschrift zu ihrem Schutz errichtet und staatlich überwacht ist."
    },
    {
      "date": "2025-07-25",
      "id": "117577",
      "original_text": "Registerbekanntmachung nach dem Umwandlungsgesetz\nSachsen-Anhalt Amtsgericht Stendal HRB 19469\nCerturia Certification Germany GmbH – Halle (Saale)",
      "type": "Registerbekanntmachung nach dem Umwandlungsgesetz",
      "state": "Sachsen-Anhalt",
      "amtsgericht": "Amtsgericht Stendal",
      "registernummer": "HRB 19469",
      "registerart": "HRB",
      "company_name": "Certuria Certification Germany GmbH",
      "company_seat": "Halle (Saale)",
      "details": "25.07.2025 (Bekanntmachungsdatum)\n\nSachsen-Anhalt Amtsgericht Stendal HRB 19469\nRegisterbekanntmachung nach dem Umwandlungsgesetz 25.07.2025 (Eintragungsdatum)\n\nCerturia Certification Germany GmbH\nGesellschaft mit beschränkter Haftung\nHalle (Saale)\n\nNicht eingetragen:\nDen Gläubigern der an der Verschmelzung beteiligten Rechtsträger ist, wenn sie binnen sechs Monaten nach dem Tag, an dem die Eintragung der Verschmelzung nach § 19 Abs. 3 UmwG als bekanntgemacht gilt, ihren Anspruch nach Grund und Höhe schriftlich anmelden, Sicherheit zu leisten, soweit sie nicht Befriedigung verlangen können. Dieses Recht steht ihnen jedoch nur zu, wenn sie glaubhaft machen, dass durch die Verschmelzung die Erfüllung ihrer Forderung gefährdet wird."
    },
    {
      "date": "2025-07-25",
      "id": "117578",
      "original_text": "Registerbekanntmachung nach dem Umwandlungsgesetz\nHamburg Amtsgericht Hamburg HRB 56865\nLufthansa Technik Aktiengesellschaft – Hamburg",
      "type": "Registerbekanntmachung nach dem Umwandlungsgesetz",
      "state": "Hamburg",
      "amtsgericht": "Amtsgericht Hamburg",
      "registernummer": "HRB 56865",
      "registerart": "HRB",
      "company_name": "Lufthansa Technik Aktiengesellschaft",
      "company_seat": "Hamburg",
      "details": "25.07.2025 (Bekanntmachungsdatum)\n\nHamburg Amtsgericht Hamburg HRB 56865\nRegisterbekanntmachung nach dem Umwandlungsgesetz\n\nLufthansa Technik Aktiengesellschaft\nAktiengesellschaft\nHamburg\n\nAls nicht eingetragen wird bekanntgemacht:\nEs wird darauf hingewiesen, dass ein Spaltungsplan oder sein Entwurf über eine Spaltung zur Aufnahme mit der Lufthansa Commercial Holding Gesellschaft mit beschränkter Haftung mit Sitz in Frankfurt am Main (Amtsgericht Frankfurt am Main HRB 109979) beim Handelsregister eingereicht worden ist.\nDie Hauptversammlung darf frühestes einen Monat nach der Bekanntmachung über die Zustimmung zum Verschmelzungsvertrag beschließen."
    },
    {
      "date": "2025-07-25",
      "id": "117579",
      "original_text": "Registerbekanntmachung nach dem Umwandlungsgesetz\nNordrhein-Westfalen Amtsgericht Coesfeld HRB 4254\nLokalWerke GmbH – Ahaus",
      "type": "Registerbekanntmachung nach dem Umwandlungsgesetz",
      "state": "Nordrhein-Westfalen",
      "amtsgericht": "Amtsgericht Coesfeld",
      "registernummer": "HRB 4254",
      "registerart": "HRB",
      "company_name": "LokalWerke GmbH",
      "company_seat": "Ahaus",
      "details": "25.07.2025 (Bekanntmachungsdatum)\n\nNordrhein-Westfalen Amtsgericht Coesfeld HRB 4254\nRegisterbekanntmachung nach dem Umwandlungsgesetz 25.07.2025 (Eintragungsdatum)\n\nLokalWerke GmbH\nGesellschaft mit beschränkter Haftung\nAhaus\n\nDen Gläubigern der an der Verschmelzung beteiligten Rechtsträger ist, wenn sie binnen sechs Monaten nach dem Tag, an dem die Eintragung der Verschmelzung in das Register des Sitzes desjenigen Rechtsträgers, dessen Gläubiger sie sind, nach § 19 Absatz 3 UmwG als bekanntgemacht gilt, ihren Anspruch nach Grund und Höhe schriftlich anmelden, Sicherheit zu leisten, soweit sie nicht Befriedigung verlangen können. Dieses Recht steht den Gläubigern jedoch nur zu, wenn sie glaubhaft machen, dass durch die Verschmelzung die Erfüllung ihrer Forderung gefährdet wird."
    },
    {
      "date": "2025-07-25",
      "id": "117580",
      "original_text": "Registerbekanntmachung nach dem Umwandlungsgesetz\nBerlin Amtsgericht Berlin (Charlottenburg) HRB 269181\nMEC - Innovative Conceptionen in EDV GmbH – Berlin",
      "type": "Registerbekanntmachung nach dem Umwandlungsgesetz",
      "state": "Berlin",
      "amtsgericht": "Amtsgericht Berlin (Charlottenburg)",
      "registernummer": "HRB 269181",
      "registerart": "HRB",
      "company_name": "MEC - Innovative Conceptionen in EDV GmbH",
      "company_seat": "Berlin",
      "details": "25.07.2025 (Bekanntmachungsdatum)\n\nBerlin Amtsgericht Berlin (Charlottenburg) HRB 269181\nRegisterbekanntmachung nach dem Umwandlungsgesetz 23.07.2025 (Eintragungsdatum)\n\nMEC - Innovative Conceptionen in EDV GmbH\nGesellschaft mit beschränkter Haftung\nBerlin\n\nZu Eintragungsnummer 3 vom 23.07.2025 wird als nicht eingetragen veröffentlicht: Den Gläubigern der an der Verschmelzung beteiligten Rechtsträger ist, wenn sie binnen sechs Monaten nach dem Tag, an dem die Eintragung der Verschmelzung in das Register des Sitzes desjenigen Rechtsträgers, dessen Gläubiger sie sind, als bekannt gemacht gilt, ihren Anspruch nach Grund und Höhe schriftlich anmelden, Sicherheit zu leisten, soweit sie nicht Befriedigung verlangen können. Dieses Recht steht den Gläubigern jedoch nur zu, wenn sie glaubhaft machen, dass durch die Verschmelzung die Erfüllung ihrer Forderung gefährdet wird. Das Recht, Sicherheitsleistung zu verlangen, steht Gläubigern nicht zu, die im Falle der Insolvenz ein Recht auf vorzugsweise Befriedigung aus einer Deckungsmasse haben, die nach gesetzlicher Vorschrift zu ihrem Schutz errichtet und staatlich überwacht ist."
    },
    {
      "date": "2025-07-25",
      "id": "117581",
      "original_text": "Registerbekanntmachung nach dem Umwandlungsgesetz\nSachsen-Anhalt Amtsgericht Stendal HRB 212148\nPallas GmbH – Merseburg",
      "type": "Registerbekanntmachung nach dem Umwandlungsgesetz",
      "state": "Sachsen-Anhalt",
      "amtsgericht": "Amtsgericht Stendal",
      "registernummer": "HRB 212148",
      "registerart": "HRB",
      "company_name": "Pallas GmbH",
      "company_seat": "Merseburg",
      "details": "25.07.2025 (Bekanntmachungsdatum)\n\nSachsen-Anhalt Amtsgericht Stendal HRB 212148\nRegisterbekanntmachung nach dem Umwandlungsgesetz 25.07.2025 (Eintragungsdatum)\n\nPallas GmbH\nGesellschaft mit beschränkter Haftung\nMerseburg\n\nNicht eingetragen:\nDen Gläubigern der an der Verschmelzung beteiligten Rechtsträger ist, wenn sie binnen sechs Monaten nach dem Tag, an dem die Eintragung der Verschmelzung nach § 19 Abs. 3 UmwG als bekanntgemacht gilt, ihren Anspruch nach Grund und Höhe schriftlich anmelden, Sicherheit zu leisten, soweit sie nicht Befriedigung verlangen können. Dieses Recht steht ihnen jedoch nur zu, wenn sie glaubhaft machen, dass durch die Verschmelzung die Erfüllung ihrer Forderung gefährdet wird."
    },
    {
      "date": "2025-07-25",
      "id": "117582",
      "original_text": "Löschungsankündigung\nBrandenburg Amtsgericht Frankfurt/Oder HRB 9380\nHörnchen`s Bau GmbH – Rehfelde",
      "type": "Löschungsankündigung",
      "state": "Brandenburg",
      "amtsgericht": "Amtsgericht Frankfurt/Oder",
      "registernummer": "HRB 9380",
      "registerart": "HRB",
      "company_name": "Hörnchen`s Bau GmbH",
      "company_seat": "Rehfelde",
      "details": "25.07.2025 (Bekanntmachungsdatum)\n\nBrandenburg Amtsgericht Frankfurt/Oder HRB 9380\nLöschungsankündigung\n\nHörnchen`s Bau GmbH\nGesellschaft mit beschränkter Haftung\nRehfelde\n\nBei der nachstehenden Gesellschaft wird das Amtslöschungsverfahren gemäß § 394 FamFG eingeleitet."
    },
    {
      "date": "2025-07-25",
      "id": "117583",
      "original_text": "Einreichung neuer Dokumente\nSchleswig-Holstein Amtsgericht Kiel HRB 2202 RD\nStadtwerke Rendsburg GmbH – Rendsburg",
      "type": "Einreichung neuer Dokumente",
      "state": "Schleswig-Holstein",
      "amtsgericht": "Amtsgericht Kiel",
      "registernummer": "HRB 2202 RD",
      "registerart": "HRB",
      "company_name": "Stadtwerke Rendsburg GmbH",
      "company_seat": "Rendsburg",
      "details": "25.07.2025 (Bekanntmachungsdatum)\n\nSchleswig-Holstein Amtsgericht Kiel HRB 2202 RD\nEinreichung neuer Dokumente\n\nStadtwerke Rendsburg GmbH\nGesellschaft mit beschränkter Haftung\nRendsburg\n\nAls nicht eingetragen wird veröffentlicht: Eine neue Liste der Aufsichtsratsmitglieder ist eingereicht worden."
    },
    {
      "date": "2025-07-25",
      "id": "117584",
      "original_text": "Registerbekanntmachung nach dem Umwandlungsgesetz\nHamburg Amtsgericht Hamburg HRB 146553\nklar Getränke GmbH – Hamburg",
      "type": "Registerbekanntmachung nach dem Umwandlungsgesetz",
      "state": "Hamburg",
      "amtsgericht": "Amtsgericht Hamburg",
      "registernummer": "HRB 146553",
      "registerart": "HRB",
      "company_name": "klar Getränke GmbH",
      "company_seat": "Hamburg",
      "details": "25.07.2025 (Bekanntmachungsdatum)\n\nHamburg Amtsgericht Hamburg HRB 146553\nRegisterbekanntmachung nach dem Umwandlungsgesetz 25.07.2025 (Eintragungsdatum)\n\nklar Getränke GmbH\nGesellschaft mit beschränkter Haftung\nHamburg\n\nAls nicht eingetragen wird bekannt gemacht:\nDen Gläubigern der an der Verschmelzung beteiligten Gesellschaften ist, wenn sie binnen sechs Monaten nach dem Tag, an dem die Eintragung der Verschmelzung in das Register des Sitzes desjenigen Rechtsträgers, dessen Gläubiger sie sind, nach § 19 Absatz 3 UmwG als bekannt gemacht gilt, ihren Anspruch nach Grund und Höhe schriftlich anmelden, Sicherheit zu leisten, soweit sie nicht Befriedigung verlangen können. Dieses Recht steht den Gläubigern jedoch nur zu, wenn sie glaubhaft machen, dass durch die Verschmelzung die Erfüllung ihrer Forderung gefährdet wird."
    },
    {
      "date": "2025-07-25",
      "id": "117585",
      "original_text": "Registerbekanntmachung nach dem Umwandlungsgesetz\nBerlin Amtsgericht Berlin (Charlottenburg) HRB 236811\nRapid Data GmbH Unternehmensberatung – Berlin",
      "type": "Registerbekanntmachung nach dem Umwandlungsgesetz",
      "state": "Berlin",
      "amtsgericht": "Amtsgericht Berlin (Charlottenburg)",
      "registernummer": "HRB 236811",
      "registerart": "HRB",
      "company_name": "Rapid Data GmbH Unternehmensberatung",
      "company_seat": "Berlin",
      "details": "25.07.2025 (Bekanntmachungsdatum)\n\nBerlin Amtsgericht Berlin (Charlottenburg) HRB 236811\nRegisterbekanntmachung nach dem Umwandlungsgesetz 24.07.2025 (Eintragungsdatum)\n\nRapid Data GmbH Unternehmensberatung\nGesellschaft mit beschränkter Haftung\nBerlin\n\nZu Eintragungsnummer 9 vom 24.07.2025 wird als nicht eingetragen veröffentlicht: Den Gläubigern der an der Verschmelzung beteiligten Rechtsträger ist, wenn sie binnen sechs Monaten nach dem Tag, an dem die Eintragung der Verschmelzung in das Register des Sitzes desjenigen Rechtsträgers, dessen Gläubiger sie sind, als bekannt gemacht gilt, ihren Anspruch nach Grund und Höhe schriftlich anmelden, Sicherheit zu leisten, soweit sie nicht Befriedigung verlangen können. Dieses Recht steht den Gläubigern jedoch nur zu, wenn sie glaubhaft machen, dass durch die Verschmelzung die Erfüllung ihrer Forderung gefährdet wird. Das Recht, Sicherheitsleistung zu verlangen, steht Gläubigern nicht zu, die im Falle der Insolvenz ein Recht auf vorzugsweise Befriedigung aus einer Deckungsmasse haben, die nach gesetzlicher Vorschrift zu ihrem Schutz errichtet und staatlich überwacht ist."
    },
    {
      "date": "2025-07-25",
      "id": "117586",
      "original_text": "Löschungsankündigung\nBaden-Württemberg Amtsgericht Mannheim HRB 738473\nLorberg Vermögensverwaltung UG (haftungsbeschränkt) – Achern",
      "type": "Löschungsankündigung",
      "state": "Baden-Württemberg",
      "amtsgericht": "Amtsgericht Mannheim",
      "registernummer": "HRB 738473",
      "registerart": "HRB",
      "company_name": "Lorberg Vermögensverwaltung UG (haftungsbeschränkt)",
      "company_seat": "Achern",
      "details": "25.07.2025 (Bekanntmachungsdatum)\n\nBaden-Württemberg Amtsgericht Mannheim HRB 738473\nLöschungsankündigung\n\nLorberg Vermögensverwaltung UG (haftungsbeschränkt)\nGesellschaft mit beschränkter Haftung\nAchern\n\nDas Gericht beabsichtigt, die Gesellschaft wegen Vermögenslosigkeit im Handelsregister von Amts wegen nach § 394 FamFG zu löschen. Die Frist zur Geltendmachung eines Widerspruchs gegen die beabsichtigte Löschung ist auf einen Monat ab Veröffentlichung bestimmt."
    },
    {
      "date": "2025-07-25",
      "id": "117587",
      "original_text": "Registerbekanntmachung nach dem Umwandlungsgesetz\nBrandenburg Amtsgericht Neuruppin GnR 118\nAgrargenossenschaft Gerdshagen eG – Gerdshagen",
      "type": "Registerbekanntmachung nach dem Umwandlungsgesetz",
      "state": "Brandenburg",
      "amtsgericht": "Amtsgericht Neuruppin",
      "registernummer": "GnR 118",
      "registerart": "GnR",
      "company_name": "Agrargenossenschaft Gerdshagen eG",
      "company_seat": "Gerdshagen",
      "details": "25.07.2025 (Bekanntmachungsdatum)\n\nBrandenburg Amtsgericht Neuruppin GnR 118\nRegisterbekanntmachung nach dem Umwandlungsgesetz 23.07.2025 (Eintragungsdatum)\n\nAgrargenossenschaft Gerdshagen eG\neingetragene Genossenschaft\nGerdshagen\n\nZu Eintragungsnummer 11 vom 23.07.2025 wird als nicht eingetragen veröffentlicht:\nDen Gläubigern der an der Umwandlung beteiligten Rechtsträger ist, wenn sie binnen sechs Monaten nach dem Tag, an dem die Eintragung der Umwandlung in das Register des Sitzes desjenigen Rechtsträgers, dessen Gläubiger sie sind, als bekannt gemacht gilt, ihren Anspruch nach Grund und Höhe schriftlich anmelden, Sicherheit zu leisten, soweit sie nicht Befriedigung verlangen können. Dieses Recht steht den Gläubigern jedoch nur zu, wenn sie glaubhaft machen, dass durch die Umwandlung die Erfüllung ihrer Forderung gefährdet wird"
    },
    {
      "date": "2025-07-25",
      "id": "117588",
      "original_text": "Löschungsankündigung\nBerlin Amtsgericht Berlin (Charlottenburg) HRB 184159\nKuchenrausch's Feinbäckerei UG (haftungsbeschränkt) – Berlin",
      "type": "Löschungsankündigung",
      "state": "Berlin",
      "amtsgericht": "Amtsgericht Berlin (Charlottenburg)",
      "registernummer": "HRB 184159",
      "registerart": "HRB",
      "company_name": "Kuchenrausch's Feinbäckerei UG (haftungsbeschränkt)",
      "company_seat": "Berlin",
      "details": "25.07.2025 (Bekanntmachungsdatum)\n\nBerlin Amtsgericht Berlin (Charlottenburg) HRB 184159\nLöschungsankündigung\n\nKuchenrausch's Feinbäckerei UG (haftungsbeschränkt)\nGesellschaft mit beschränkter Haftung\nBerlin\n\nBei der nachstehenden Gesellschaft wird das Amtslöschungsverfahren gemäß § 394 FamFG eingeleitet. Widerspruchsfrist 6 Wochen"
    },
    {
      "date": "2025-07-25",
      "id": "117589",
      "original_text": "Einreichung neuer Dokumente\nBaden-Württemberg Amtsgericht Mannheim HRB 42\nSüdzucker AG – Mannheim",
      "type": "Einreichung neuer Dokumente",
      "state": "Baden-Württemberg",
      "amtsgericht": "Amtsgericht Mannheim",
      "registernummer": "HRB 42",
      "registerart": "HRB",
      "company_name": "Südzucker AG",
      "company_seat": "Mannheim",
      "details": "25.07.2025 (Bekanntmachungsdatum)\n\nBaden-Württemberg Amtsgericht Mannheim HRB 42\nEinreichung neuer Dokumente\n\nSüdzucker AG\nAktiengesellschaft\nMannheim\n\nDie Gesellschaft hat am 24.07.2025 das Hauptversammlungsprotokoll vom 17.07.2025 beim Registergericht eingereicht."
    },
    {
      "date": "2025-07-25",
      "id": "117590",
      "original_text": "Registerbekanntmachung nach dem Umwandlungsgesetz\nHamburg Amtsgericht Hamburg HRB 71439\nKraemer & Feldmann GmbH – Hamburg",
      "type": "Registerbekanntmachung nach dem Umwandlungsgesetz",
      "state": "Hamburg",
      "amtsgericht": "Amtsgericht Hamburg",
      "registernummer": "HRB 71439",
      "registerart": "HRB",
      "company_name": "Kraemer & Feldmann GmbH",
      "company_seat": "Hamburg",
      "details": "25.07.2025 (Bekanntmachungsdatum)\n\nHamburg Amtsgericht Hamburg HRB 71439\nRegisterbekanntmachung nach dem Umwandlungsgesetz 25.07.2025 (Eintragungsdatum)\n\nKraemer & Feldmann GmbH\nGesellschaft mit beschränkter Haftung\nHamburg\n\nAls nicht eingetragen wird bekannt gemacht:\nDen Gläubigern der an der Verschmelzung beteiligten Gesellschaften ist, wenn sie binnen sechs Monaten nach dem Tag, an dem die Eintragung der Verschmelzung in das Register des Sitzes desjenigen Rechtsträgers, dessen Gläubiger sie sind, nach § 19 Absatz 3 UmwG als bekannt gemacht gilt, ihren Anspruch nach Grund und Höhe schriftlich anmelden, Sicherheit zu leisten, soweit sie nicht Befriedigung verlangen können. Dieses Recht steht den Gläubigern jedoch nur zu, wenn sie glaubhaft machen, dass durch die Verschmelzung die Erfüllung ihrer Forderung gefährdet wird."
    },
    {
      "date": "2025-07-25",
      "id": "117591",
      "original_text": "Einreichung neuer Dokumente\nBaden-Württemberg Amtsgericht Freiburg HRB 714535\nIMS Gear Management SE – Donaueschingen",
      "type": "Einreichung neuer Dokumente",
      "state": "Baden-Württemberg",
      "amtsgericht": "Amtsgericht Freiburg",
      "registernummer": "HRB 714535",
      "registerart": "HRB",
      "company_name": "IMS Gear Management SE",
      "company_seat": "Donaueschingen",
      "details": "25.07.2025 (Bekanntmachungsdatum)\n\nBaden-Württemberg Amtsgericht Freiburg HRB 714535\nEinreichung neuer Dokumente 25.07.2025 (Eintragungsdatum)\n\nIMS Gear Management SE\nEuropäische Aktiengesellschaft (SE)\nDonaueschingen\n\nDie Gesellschaft hat am 23.07.2025 die Liste über die Zusammensetzung des Aufsichtsrats zum Handelsregister eingereicht."
    },
    {
      "date": "2025-07-25",
      "id": "117592",
      "original_text": "Löschungsankündigung\nBerlin Amtsgericht Berlin (Charlottenburg) HRB 246216\nCipalje Bau GmbH – Berlin",
      "type": "Löschungsankündigung",
      "state": "Berlin",
      "amtsgericht": "Amtsgericht Berlin (Charlottenburg)",
      "registernummer": "HRB 246216",
      "registerart": "HRB",
      "company_name": "Cipalje Bau GmbH",
      "company_seat": "Berlin",
      "details": "25.07.2025 (Bekanntmachungsdatum)\n\nBerlin Amtsgericht Berlin (Charlottenburg) HRB 246216\nLöschungsankündigung\n\nCipalje Bau GmbH\nGesellschaft mit beschränkter Haftung\nBerlin\n\nBei der nachstehenden Gesellschaft wird das Amtslöschungsverfahren gemäß § 394 FamFG eingeleitet. Widerspruchsfrist 6 Wochen"
    },
    {
      "date": "2025-07-25",
      "id": "117593",
      "original_text": "Einreichung neuer Dokumente\nThüringen Amtsgericht Jena HRB 206397\nDienstleistungsgesellschaft Neustadt an der Orla mbH – Neustadt an der Orla",
      "type": "Einreichung neuer Dokumente",
      "state": "Thüringen",
      "amtsgericht": "Amtsgericht Jena",
      "registernummer": "HRB 206397",
      "registerart": "HRB",
      "company_name": "Dienstleistungsgesellschaft Neustadt an der Orla mbH",
      "company_seat": "Neustadt an der Orla",
      "details": "25.07.2025 (Bekanntmachungsdatum)\n\nThüringen Amtsgericht Jena HRB 206397\nEinreichung neuer Dokumente\n\nDienstleistungsgesellschaft Neustadt an der Orla mbH\nGesellschaft mit beschränkter Haftung\nNeustadt an der Orla\n\nBekanntmachung gem. § 52 Abs. 3 Satz 2 GmbHG: Aufgrund einer Veränderung in den Personen der Aufsichtsratsmitglieder ist durch die Geschäftsführer eine neue Liste zum Handelsregister eingereicht worden."
    },
    {
      "date": "2025-07-25",
      "id": "117594",
      "original_text": "Registerbekanntmachung nach dem Umwandlungsgesetz\nBrandenburg Amtsgericht Potsdam HRA 8380\nBäckerei-Konditorei Robert Lenz e.K. – Werder (Havel)",
      "type": "Registerbekanntmachung nach dem Umwandlungsgesetz",
      "state": "Brandenburg",
      "amtsgericht": "Amtsgericht Potsdam",
      "registernummer": "HRA 8380",
      "registerart": "HRA",
      "company_name": "Bäckerei-Konditorei Robert Lenz e.K.",
      "company_seat": "Werder (Havel)",
      "details": "25.07.2025 (Bekanntmachungsdatum)\n\nBrandenburg Amtsgericht Potsdam HRA 8380\nRegisterbekanntmachung nach dem Umwandlungsgesetz 24.07.2025 (Eintragungsdatum)\n\nBäckerei-Konditorei Robert Lenz e.K.\nEinzelkaufmann / Einzelkauffrau\nWerder (Havel)\n\nAls nicht eingetragen wird veröffentlicht:\nDen Gläubigern der an der Verschmelzung beteiligten Rechtsträger ist, wenn sie binnen sechs Monaten nach dem Tag, an dem die Eintragung der Verschmelzung in das Register des Sitzes desjenigen Rechtsträgers, dessen Gläubiger sie sind, als bekannt gemacht gilt, ihren Anspruch nach Grund und Höhe schriftlich anmelden, Sicherheit zu leisten, soweit sie nicht Befriedigung verlangen können. Dieses Recht steht den Gläubigern jedoch nur zu, wenn sie glaubhaft machen, dass durch die Verschmelzung die Erfüllung ihrer Forderung gefährdet wird"
    },
    {
      "date": "2025-07-25",
      "id": "117595",
      "original_text": "Registerbekanntmachung nach dem Umwandlungsgesetz\nBerlin Amtsgericht Berlin (Charlottenburg) HRB 158847\nCellphenomics GmbH – Berlin",
      "type": "Registerbekanntmachung nach dem Umwandlungsgesetz",
      "state": "Berlin",
      "amtsgericht": "Amtsgericht Berlin (Charlottenburg)",
      "registernummer": "HRB 158847",
      "registerart": "HRB",
      "company_name": "Cellphenomics GmbH",
      "company_seat": "Berlin",
      "details": "25.07.2025 (Bekanntmachungsdatum)\n\nBerlin Amtsgericht Berlin (Charlottenburg) HRB 158847\nRegisterbekanntmachung nach dem Umwandlungsgesetz 25.07.2025 (Eintragungsdatum)\n\nCellphenomics GmbH\nGesellschaft mit beschränkter Haftung\nBerlin\n\nZu Eintragungsnummer 8 vom 25.07.2025 wird als nicht eingetragen veröffentlicht: Den Gläubigern der an der Verschmelzung beteiligten Rechtsträger ist, wenn sie binnen sechs Monaten nach dem Tag, an dem die Eintragung der Verschmelzung in das Register des Sitzes desjenigen Rechtsträgers, dessen Gläubiger sie sind, als bekannt gemacht gilt, ihren Anspruch nach Grund und Höhe schriftlich anmelden, Sicherheit zu leisten, soweit sie nicht Befriedigung verlangen können. Dieses Recht steht den Gläubigern jedoch nur zu, wenn sie glaubhaft machen, dass durch die Verschmelzung die Erfüllung ihrer Forderung gefährdet wird. Das Recht, Sicherheitsleistung zu verlangen, steht Gläubigern nicht zu, die im Falle der Insolvenz ein Recht auf vorzugsweise Befriedigung aus einer Deckungsmasse haben, die nach gesetzlicher Vorschrift zu ihrem Schutz errichtet und staatlich überwacht ist."
    },
    {
      "date": "2025-07-25",
      "id": "117596",
      "original_text": "Einreichung neuer Dokumente\nHamburg Amtsgericht Hamburg HRB 91799\nDeutsche EuroShop AG – Hamburg",
      "type": "Einreichung neuer Dokumente",
      "state": "Hamburg",
      "amtsgericht": "Amtsgericht Hamburg",
      "registernummer": "HRB 91799",
      "registerart": "HRB",
      "company_name": "Deutsche EuroShop AG",
      "company_seat": "Hamburg",
      "details": "25.07.2025 (Bekanntmachungsdatum)\n\nHamburg Amtsgericht Hamburg HRB 91799\nEinreichung neuer Dokumente\n\nDeutsche EuroShop AG\nAktiengesellschaft\nHamburg\n\nAls nicht eingetragen wird bekannt gemacht: Liste des Aufsichtsrats wurde eingereicht."
    },
    {
      "date": "2025-07-25",
      "id": "117597",
      "original_text": "Registerbekanntmachung nach dem Umwandlungsgesetz\nBrandenburg Amtsgericht Neuruppin HRA 3804\nDetlef Klockow - Verpachtungsunternehmen Malz e.K. – Oranienburg OT Malz",
      "type": "Registerbekanntmachung nach dem Umwandlungsgesetz",
      "state": "Brandenburg",
      "amtsgericht": "Amtsgericht Neuruppin",
      "registernummer": "HRA 3804",
      "registerart": "HRA",
      "company_name": "Detlef Klockow - Verpachtungsunternehmen Malz e.K.",
      "company_seat": "Oranienburg OT Malz",
      "details": "25.07.2025 (Bekanntmachungsdatum)\n\nBrandenburg Amtsgericht Neuruppin HRA 3804\nRegisterbekanntmachung nach dem Umwandlungsgesetz 25.07.2025 (Eintragungsdatum)\n\nDetlef Klockow - Verpachtungsunternehmen Malz e.K.\nEinzelkaufmann / Einzelkauffrau\nOranienburg OT Malz\n\nZu Eintragungsnummer 2 vom 25.07.2025 wird als nicht eingetragen veröffentlicht:\nDen Gläubigern der an der Umwandlung beteiligten Rechtsträger ist, wenn sie binnen sechs Monaten nach dem Tag, an dem die Eintragung der Umwandlung in das Register des Sitzes desjenigen Rechtsträgers, dessen Gläubiger sie sind, als bekannt gemacht gilt, ihren Anspruch nach Grund und Höhe schriftlich anmelden, Sicherheit zu leisten, soweit sie nicht Befriedigung verlangen können. Dieses Recht steht den Gläubigern jedoch nur zu, wenn sie glaubhaft machen, dass durch die Umwandlung die Erfüllung ihrer Forderung gefährdet wird"
    },
    {
      "date": "2025-07-25",
      "id": "117598",
      "original_text": "Registerbekanntmachung nach dem Umwandlungsgesetz\nBerlin Amtsgericht Berlin (Charlottenburg) HRB 211782\nSpoony GmbH – Berlin",
      "type": "Registerbekanntmachung nach dem Umwandlungsgesetz",
      "state": "Berlin",
      "amtsgericht": "Amtsgericht Berlin (Charlottenburg)",
      "registernummer": "HRB 211782",
      "registerart": "HRB",
      "company_name": "Spoony GmbH",
      "company_seat": "Berlin",
      "details": "25.07.2025 (Bekanntmachungsdatum)\n\nBerlin Amtsgericht Berlin (Charlottenburg) HRB 211782\nRegisterbekanntmachung nach dem Umwandlungsgesetz 24.07.2025 (Eintragungsdatum)\n\nSpoony GmbH\nGesellschaft mit beschränkter Haftung\nBerlin\n\nZu Eintragungsnummer 4 vom 24.07.2025 wird als nicht eingetragen veröffentlicht: Den Gläubigern der an der Verschmelzung beteiligten Rechtsträger ist, wenn sie binnen sechs Monaten nach dem Tag, an dem die Eintragung der Verschmelzung in das Register des Sitzes desjenigen Rechtsträgers, dessen Gläubiger sie sind, als bekannt gemacht gilt, ihren Anspruch nach Grund und Höhe schriftlich anmelden, Sicherheit zu leisten, soweit sie nicht Befriedigung verlangen können. Dieses Recht steht den Gläubigern jedoch nur zu, wenn sie glaubhaft machen, dass durch die Verschmelzung die Erfüllung ihrer Forderung gefährdet wird. Das Recht, Sicherheitsleistung zu verlangen, steht Gläubigern nicht zu, die im Falle der Insolvenz ein Recht auf vorzugsweise Befriedigung aus einer Deckungsmasse haben, die nach gesetzlicher Vorschrift zu ihrem Schutz errichtet und staatlich überwacht ist."
    },
    {
      "date": "2025-07-25",
      "id": "117599",
      "original_text": "Löschungsankündigung\nBerlin Amtsgericht Berlin (Charlottenburg) HRB 201441\nhotpatch one UG (haftungsbeschränkt) – Berlin",
      "type": "Löschungsankündigung",
      "state": "Berlin",
      "amtsgericht": "Amtsgericht Berlin (Charlottenburg)",
      "registernummer": "HRB 201441",
      "registerart": "HRB",
      "company_name": "hotpatch one UG (haftungsbeschränkt)",
      "company_seat": "Berlin",
      "details": "25.07.2025 (Bekanntmachungsdatum)\n\nBerlin Amtsgericht Berlin (Charlottenburg) HRB 201441\nLöschungsankündigung\n\nhotpatch one UG (haftungsbeschränkt)\nGesellschaft mit beschränkter Haftung\nBerlin\n\nBei der nachstehenden Gesellschaft wird das Amtslöschungsverfahren gemäß § 394 FamFG eingeleitet. Widerspruchsfrist 6 Wochen"
    },
    {
      "date": "2025-07-25",
      "id": "117600",
      "original_text": "Registerbekanntmachung nach dem Umwandlungsgesetz\nBaden-Württemberg Amtsgericht Mannheim HRB 752893\nVermessung3D GmbH – Mannheim",
      "type": "Registerbekanntmachung nach dem Umwandlungsgesetz",
      "state": "Baden-Württemberg",
      "amtsgericht": "Amtsgericht Mannheim",
      "registernummer": "HRB 752893",
      "registerart": "HRB",
      "company_name": "Vermessung3D GmbH",
      "company_seat": "Mannheim",
      "details": "25.07.2025 (Bekanntmachungsdatum)\n\nBaden-Württemberg Amtsgericht Mannheim HRB 752893\nRegisterbekanntmachung nach dem Umwandlungsgesetz 25.07.2025 (Eintragungsdatum)\n\nVermessung3D GmbH\nGesellschaft mit beschränkter Haftung\nMannheim\n\nAls nicht eingetragen wird bekanntgemacht:\nDen Gläubigern der an der Ausgliederung beteiligten Rechtsträger ist, wenn sie binnen sechs Monaten nach dem Tag, an dem die Eintragung der Ausgliederung in das Register des Sitzes desjenigen Rechtsträgers, dessen Gläubiger sie sind, nach § 19 Abs. 3 UmwG als bekanntgemacht gilt, ihren Anspruch nach Grund und Höhe schriftlich anmelden, Sicherheit zu leisten, soweit sie nicht Befriedigung verlangen können. Dieses Recht steht den Gläubigern jedoch nur zu, wenn sie glaubhaft machen, dass durch die Ausgliederung die Erfüllung ihrer Forderung gefährdet wird."
    },
    {
      "date": "2025-07-25",
      "id": "117601",
      "original_text": "Löschungsankündigung\nBerlin Amtsgericht Berlin (Charlottenburg) HRB 196394\nBullonerosso GmbH – Berlin",
      "type": "Löschungsankündigung",
      "state": "Berlin",
      "amtsgericht": "Amtsgericht Berlin (Charlottenburg)",
      "registernummer": "HRB 196394",
      "registerart": "HRB",
      "company_name": "Bullonerosso GmbH",
      "company_seat": "Berlin",
      "details": "25.07.2025 (Bekanntmachungsdatum)\n\nBerlin Amtsgericht Berlin (Charlottenburg) HRB 196394\nLöschungsankündigung\n\nBullonerosso GmbH\nGesellschaft mit beschränkter Haftung\nBerlin\n\nBei der nachstehenden Gesellschaft wird das Amtslöschungsverfahren gemäß § 394 FamFG eingeleitet. Widerspruchsfrist 6 Wochen"
    },
    {
      "date": "2025-07-25",
      "id": "117602",
      "original_text": "Löschungsankündigung\nBerlin Amtsgericht Berlin (Charlottenburg) HRB 227435\nESM Bau GmbH – Berlin",
      "type": "Löschungsankündigung",
      "state": "Berlin",
      "amtsgericht": "Amtsgericht Berlin (Charlottenburg)",
      "registernummer": "HRB 227435",
      "registerart": "HRB",
      "company_name": "ESM Bau GmbH",
      "company_seat": "Berlin",
      "details": "25.07.2025 (Bekanntmachungsdatum)\n\nBerlin Amtsgericht Berlin (Charlottenburg) HRB 227435\nLöschungsankündigung\n\nESM Bau GmbH\nGesellschaft mit beschränkter Haftung\nBerlin\n\nBei der nachstehenden Gesellschaft wird das Amtslöschungsverfahren gemäß § 394 FamFG eingeleitet. Widerspruchsfrist 6 Wochen"
    },
    {
      "date": "2025-07-25",
      "id": "117603",
      "original_text": "Registerbekanntmachung nach dem Umwandlungsgesetz\nBerlin Amtsgericht Berlin (Charlottenburg) HRB 173349\nflat-mate GmbH – Berlin",
      "type": "Registerbekanntmachung nach dem Umwandlungsgesetz",
      "state": "Berlin",
      "amtsgericht": "Amtsgericht Berlin (Charlottenburg)",
      "registernummer": "HRB 173349",
      "registerart": "HRB",
      "company_name": "flat-mate GmbH",
      "company_seat": "Berlin",
      "details": "25.07.2025 (Bekanntmachungsdatum)\n\nBerlin Amtsgericht Berlin (Charlottenburg) HRB 173349\nRegisterbekanntmachung nach dem Umwandlungsgesetz 24.07.2025 (Eintragungsdatum)\n\nflat-mate GmbH\nGesellschaft mit beschränkter Haftung\nBerlin\n\nZu Eintragungsnummer 8 vom 24.07.2025 wird als nicht eingetragen veröffentlicht: Den Gläubigern der an der Verschmelzung beteiligten Rechtsträger ist, wenn sie binnen sechs Monaten nach dem Tag, an dem die Eintragung der Verschmelzung in das Register des Sitzes desjenigen Rechtsträgers, dessen Gläubiger sie sind, als bekannt gemacht gilt, ihren Anspruch nach Grund und Höhe schriftlich anmelden, Sicherheit zu leisten, soweit sie nicht Befriedigung verlangen können. Dieses Recht steht den Gläubigern jedoch nur zu, wenn sie glaubhaft machen, dass durch die Verschmelzung die Erfüllung ihrer Forderung gefährdet wird. Das Recht, Sicherheitsleistung zu verlangen, steht Gläubigern nicht zu, die im Falle der Insolvenz ein Recht auf vorzugsweise Befriedigung aus einer Deckungsmasse haben, die nach gesetzlicher Vorschrift zu ihrem Schutz errichtet und staatlich überwacht ist."
    },
    {
      "date": "2025-07-25",
      "id": "117604",
      "original_text": "Löschungsankündigung\nBrandenburg Amtsgericht Potsdam HRA 7232\nNEY Norderneyer Grundbesitz LTD & Co. KG – Zossen",
      "type": "Löschungsankündigung",
      "state": "Brandenburg",
      "amtsgericht": "Amtsgericht Potsdam",
      "registernummer": "HRA 7232",
      "registerart": "HRA",
      "company_name": "NEY Norderneyer Grundbesitz LTD & Co. KG",
      "company_seat": "Zossen",
      "details": "25.07.2025 (Bekanntmachungsdatum)\n\nBrandenburg Amtsgericht Potsdam HRA 7232\nLöschungsankündigung\n\nNEY Norderneyer Grundbesitz LTD & Co. KG\nKommanditgesellschaft\nZossen\n\nBei der nachstehenden Gesellschaft/dem nachstehenden Verein wird das Amtslöschungsverfahren gemäß § 395 FamFG eingeleitet. Widerspruchsfrist: 8 Wochen"
    },
    {
      "date": "2025-07-25",
      "id": "117605",
      "original_text": "Registerbekanntmachung nach dem Umwandlungsgesetz\nBrandenburg Amtsgericht Potsdam HRB 33291\nFlötgen Projekt & IT GmbH – Nuthe-Urstromtal",
      "type": "Registerbekanntmachung nach dem Umwandlungsgesetz",
      "state": "Brandenburg",
      "amtsgericht": "Amtsgericht Potsdam",
      "registernummer": "HRB 33291",
      "registerart": "HRB",
      "company_name": "Flötgen Projekt & IT GmbH",
      "company_seat": "Nuthe-Urstromtal",
      "details": "25.07.2025 (Bekanntmachungsdatum)\n\nBrandenburg Amtsgericht Potsdam HRB 33291\nRegisterbekanntmachung nach dem Umwandlungsgesetz 18.07.2025 (Eintragungsdatum)\n\nFlötgen Projekt & IT GmbH\nGesellschaft mit beschränkter Haftung\nNuthe-Urstromtal\n\nZu Eintragungsnummer 2 vom 18.07.2025 wird als nicht eingetragen veröffentlicht:\nDen Gläubigern der an der Verschmelzung beteiligten Rechtsträger ist, wenn sie binnen sechs Monaten nach dem Tag, an dem die Eintragung der Verschmelzung in das Register des Sitzes desjenigen Rechtsträgers, dessen Gläubiger sie sind, als bekannt gemacht gilt, ihren Anspruch nach Grund und Höhe schriftlich anmelden, Sicherheit zu leisten, soweit sie nicht Befriedigung verlangen können. Dieses Recht steht den Gläubigern jedoch nur zu, wenn sie glaubhaft machen, dass durch die Verschmelzung die Erfüllung ihrer Forderung gefährdet wird."
    },
    {
      "date": "2025-07-25",
      "id": "117606",
      "original_text": "Sonstige Registerbekanntmachung\nBerlin Amtsgericht Berlin (Charlottenburg) HRB 264191\nTierarzt Plus Weilheim GmbH – Berlin",
      "type": "Sonstige Registerbekanntmachung",
      "state": "Berlin",
      "amtsgericht": "Amtsgericht Berlin (Charlottenburg)",
      "registernummer": "HRB 264191",
      "registerart": "HRB",
      "company_name": "Tierarzt Plus Weilheim GmbH",
      "company_seat": "Berlin",
      "details": "25.07.2025 (Bekanntmachungsdatum)\n\nBerlin Amtsgericht Berlin (Charlottenburg) HRB 264191\nSonstige Registerbekanntmachung\n\nTierarzt Plus Weilheim GmbH\nGesellschaft mit beschränkter Haftung\nBerlin\n\nAls nicht eingetragen wird veröffentlicht:Der andere Vertragsteil hat den Gläubigern dieses Rechtsträgers, deren Forderungen begründet worden sind, bevor die Eintragung der Beendigung dieses Vertrages in das Handelsregister nach § 10 des Handelsgesetzbuches als bekannt gemacht gilt, Sicherheit zu leisten, wenn sie sich binnen sechs Monaten nach der Bekanntmachung der Eintragung zu diesem Zweck bei ihm melden. Dieses Recht steht den Gläubigern nicht zu, die im Fall des Insolvenzverfahrens ein Recht auf vorzugsweise Befriedigung aus der Deckungsmasse haben, die nach gesetzlicher Vorschrift zu ihrem Schutz errichtet und staatlich überwacht ist."
    },
    {
      "date": "2025-07-25",
      "id": "117607",
      "original_text": "Registerbekanntmachung nach dem Umwandlungsgesetz\nHamburg Amtsgericht Hamburg HRB 132746\nDZ-4 Betriebsgesellschaft II mbH – Hamburg",
      "type": "Registerbekanntmachung nach dem Umwandlungsgesetz",
      "state": "Hamburg",
      "amtsgericht": "Amtsgericht Hamburg",
      "registernummer": "HRB 132746",
      "registerart": "HRB",
      "company_name": "DZ-4 Betriebsgesellschaft II mbH",
      "company_seat": "Hamburg",
      "details": "25.07.2025 (Bekanntmachungsdatum)\n\nHamburg Amtsgericht Hamburg HRB 132746\nRegisterbekanntmachung nach dem Umwandlungsgesetz 25.07.2025 (Eintragungsdatum)\n\nDZ-4 Betriebsgesellschaft II mbH\nGesellschaft mit beschränkter Haftung\nHamburg\n\nAls nicht eingetragen wird bekannt gemacht:\nDen Gläubigern der an der Verschmelzung beteiligten Gesellschaften ist, wenn sie binnen sechs Monaten nach dem Tag, an dem die Eintragung der Verschmelzung in das Register des Sitzes desjenigen Rechtsträgers, dessen Gläubiger sie sind, nach § 19 Absatz 3 UmwG als bekannt gemacht gilt, ihren Anspruch nach Grund und Höhe schriftlich anmelden, Sicherheit zu leisten, soweit sie nicht Befriedigung verlangen können. Dieses Recht steht den Gläubigern jedoch nur zu, wenn sie glaubhaft machen, dass durch die Verschmelzung die Erfüllung ihrer Forderung gefährdet wird."
    },
    {
      "date": "2025-07-25",
      "id": "117608",
      "original_text": "Registerbekanntmachung nach dem Umwandlungsgesetz\nHamburg Amtsgericht Hamburg HRB 126275\nDZ-4 Betriebsgesellschaft I mbH – Hamburg",
      "type": "Registerbekanntmachung nach dem Umwandlungsgesetz",
      "state": "Hamburg",
      "amtsgericht": "Amtsgericht Hamburg",
      "registernummer": "HRB 126275",
      "registerart": "HRB",
      "company_name": "DZ-4 Betriebsgesellschaft I mbH",
      "company_seat": "Hamburg",
      "details": "25.07.2025 (Bekanntmachungsdatum)\n\nHamburg Amtsgericht Hamburg HRB 126275\nRegisterbekanntmachung nach dem Umwandlungsgesetz 25.07.2025 (Eintragungsdatum)\n\nDZ-4 Betriebsgesellschaft I mbH\nGesellschaft mit beschränkter Haftung\nHamburg\n\nAls nicht eingetragen wird bekannt gemacht:\nDen Gläubigern der an der Verschmelzung beteiligten Gesellschaften ist, wenn sie binnen sechs Monaten nach dem Tag, an dem die Eintragung der Verschmelzung in das Register des Sitzes desjenigen Rechtsträgers, dessen Gläubiger sie sind, nach § 19 Absatz 3 UmwG als bekannt gemacht gilt, ihren Anspruch nach Grund und Höhe schriftlich anmelden, Sicherheit zu leisten, soweit sie nicht Befriedigung verlangen können. Dieses Recht steht den Gläubigern jedoch nur zu, wenn sie glaubhaft machen, dass durch die Verschmelzung die Erfüllung ihrer Forderung gefährdet wird."
    },
    {
      "date": "2025-07-25",
      "id": "117609",
      "original_text": "Löschungsankündigung\nSchleswig-Holstein Amtsgericht Lübeck HRB 19353\nSalishome Holstein GmbH – Neustadt in Holstein",
      "type": "Löschungsankündigung",
      "state": "Schleswig-Holstein",
      "amtsgericht": "Amtsgericht Lübeck",
      "registernummer": "HRB 19353",
      "registerart": "HRB",
      "company_name": "Salishome Holstein GmbH",
      "company_seat": "Neustadt in Holstein",
      "details": "25.07.2025 (Bekanntmachungsdatum)\n\nSchleswig-Holstein Amtsgericht Lübeck HRB 19353\nLöschungsankündigung\n\nSalishome Holstein GmbH\nGesellschaft mit beschränkter Haftung\nNeustadt in Holstein\n\nEs ist die Löschung der nachstehenden Gesellschaft wegen Vermögenslosigkeit gemäß § 394 FamFG beabsichtigt. Widerspruchsfrist: 1 Monat"
    },
    {
      "date": "2025-07-25",
      "id": "117610",
      "original_text": "Registerbekanntmachung nach dem Umwandlungsgesetz\nSchleswig-Holstein Amtsgericht Pinneberg HRA 10008\nClaus Müller e.K. – Ostrohe",
      "type": "Registerbekanntmachung nach dem Umwandlungsgesetz",
      "state": "Schleswig-Holstein",
      "amtsgericht": "Amtsgericht Pinneberg",
      "registernummer": "HRA 10008",
      "registerart": "HRA",
      "company_name": "Claus Müller e.K.",
      "company_seat": "Ostrohe",
      "details": "25.07.2025 (Bekanntmachungsdatum)\n\nSchleswig-Holstein Amtsgericht Pinneberg HRA 10008\nRegisterbekanntmachung nach dem Umwandlungsgesetz 25.07.2025 (Eintragungsdatum)\n\nClaus Müller e.K.\nEinzelkaufmann / Einzelkauffrau\nOstrohe\n\nAls nicht eingetragen wird veröffentlicht: Den Gläubigern der an der Verschmelzung beteiligten Rechtsträger ist, wenn sie binnen sechs Monaten nach dem Tag, an dem die Eintragung der Verschmelzung in das Register des Sitzes desjenigen Rechtsträgers, dessen Gläubiger sie sind, als bekannt gemacht gilt, ihren Anspruch nach Grund und Höhe schriftlich anmelden, Sicherheit zu leisten, soweit sie nicht Befriedigung verlangen können. Dieses Recht steht den Gläubigern jedoch nur zu, wenn sie glaubhaft machen, dass durch die Verschmelzung die Erfüllung ihrer Forderung gefährdet wird. Das Recht, Sicherheitsleistung zu verlangen, steht Gläubigern nicht zu, die im Falle der Insolvenz ein Recht auf vorzugsweise Befriedigung aus einer Deckungsmasse haben, die nach gesetzlicher Vorschrift zu ihrem Schutz errichtet und staatlich überwacht ist."
    },
    {
      "date": "2025-07-25",
      "id": "117611",
      "original_text": "Registerbekanntmachung nach dem Umwandlungsgesetz\nBrandenburg Amtsgericht Frankfurt/Oder HRB 12787\nHaus des Abschieds GmbH – Eisenhüttenstadt",
      "type": "Registerbekanntmachung nach dem Umwandlungsgesetz",
      "state": "Brandenburg",
      "amtsgericht": "Amtsgericht Frankfurt/Oder",
      "registernummer": "HRB 12787",
      "registerart": "HRB",
      "company_name": "Haus des Abschieds GmbH",
      "company_seat": "Eisenhüttenstadt",
      "details": "25.07.2025 (Bekanntmachungsdatum)\n\nBrandenburg Amtsgericht Frankfurt/Oder HRB 12787\nRegisterbekanntmachung nach dem Umwandlungsgesetz 17.07.2025 (Eintragungsdatum)\n\nHaus des Abschieds GmbH\nGesellschaft mit beschränkter Haftung\nEisenhüttenstadt\n\nZu Eintragungsnummer 7 vom 17.07.2025 wird als nicht eingetragen veröffentlicht:\n\nDen Gläubigern der an der Verschmelzung beteiligten Rechtsträger ist, wenn sie binnen sechs Monaten nach dem Tag, an dem die Eintragung der Verschmelzung in das Register des Sitzes desjenigen Rechtsträgers, dessen Gläubiger sie sind, als bekannt gemacht gilt, ihren Anspruch nach Grund und Höhe schriftlich anmelden, Sicherheit zu leisten, soweit sie nicht Befriedigung verlangen können. Dieses Recht steht den Gläubigern jedoch nur zu, wenn sie glaubhaft machen, dass durch die Verschmelzung die Erfüllung ihrer Forderung gefährdet wird"
    },
    {
      "date": "2025-07-25",
      "id": "117612",
      "original_text": "Einreichung neuer Dokumente\nBerlin Amtsgericht Berlin (Charlottenburg) HRB 239114\nWestwing Group SE – Berlin",
      "type": "Einreichung neuer Dokumente",
      "state": "Berlin",
      "amtsgericht": "Amtsgericht Berlin (Charlottenburg)",
      "registernummer": "HRB 239114",
      "registerart": "HRB",
      "company_name": "Westwing Group SE",
      "company_seat": "Berlin",
      "details": "25.07.2025 (Bekanntmachungsdatum)\n\nBerlin Amtsgericht Berlin (Charlottenburg) HRB 239114\nEinreichung neuer Dokumente\n\nWestwing Group SE\nEuropäische Aktiengesellschaft (SE)\nBerlin\n\nAls nicht eingetragen wird gem. § 10 UmwG veröffentlicht:\nEs ist je der Entwurf eines Verschmelzungsvertrags für die geplante Aufnahme von HRB 158223 B und von HRB 135098 B (beide Amtsgericht Charlottenburg) beim Handelsregister eingereicht worden."
    },
    {
      "date": "2025-07-25",
      "id": "117613",
      "original_text": "Registerbekanntmachung nach dem Umwandlungsgesetz\nHamburg Amtsgericht Hamburg HRA 132521\nOliver Weinmann HyAdvice e.K. – Hamburg",
      "type": "Registerbekanntmachung nach dem Umwandlungsgesetz",
      "state": "Hamburg",
      "amtsgericht": "Amtsgericht Hamburg",
      "registernummer": "HRA 132521",
      "registerart": "HRA",
      "company_name": "Oliver Weinmann HyAdvice e.K.",
      "company_seat": "Hamburg",
      "details": "25.07.2025 (Bekanntmachungsdatum)\n\nHamburg Amtsgericht Hamburg HRA 132521\nRegisterbekanntmachung nach dem Umwandlungsgesetz 25.07.2025 (Eintragungsdatum)\n\nOliver Weinmann HyAdvice e.K.\nEinzelkaufmann\nHamburg\n\nAls nicht eingetragen wird bekannt gemacht:\nDen Gläubigern der an der Ausgliederung beteiligten Gesellschaften ist, wenn sie binnen sechs Monaten nach dem Tag, an dem die Eintragung der Ausgliederung in das Register des Sitzes desjenigen Rechtsträgers, dessen Gläubiger sie sind, nach § 19 Absatz 3 UmwG als bekannt gemacht gilt, ihren Anspruch nach Grund und Höhe schriftlich anmelden, Sicherheit zu leisten, soweit sie nicht Befriedigung verlangen können. Dieses Recht steht den Gläubigern jedoch nur zu, wenn sie glaubhaft machen, dass durch die Ausgliederung die Erfüllung ihrer Forderung gefährdet wird."
    },
    {
      "date": "2025-07-25",
      "id": "117614",
      "original_text": "Registerbekanntmachung nach dem Umwandlungsgesetz\nSchleswig-Holstein Amtsgericht Pinneberg HRA 1280 EL\nKühl Haus- und Grundstücksverwaltung Inh. Ulrich Kühl e. K. – Uetersen",
      "type": "Registerbekanntmachung nach dem Umwandlungsgesetz",
      "state": "Schleswig-Holstein",
      "amtsgericht": "Amtsgericht Pinneberg",
      "registernummer": "HRA 1280 EL",
      "registerart": "HRA",
      "company_name": "Kühl Haus- und Grundstücksverwaltung Inh. Ulrich Kühl e. K.",
      "company_seat": "Uetersen",
      "details": "25.07.2025 (Bekanntmachungsdatum)\n\nSchleswig-Holstein Amtsgericht Pinneberg HRA 1280 EL\nRegisterbekanntmachung nach dem Umwandlungsgesetz 25.07.2025 (Eintragungsdatum)\n\nKühl  Haus- und Grundstücksverwaltung Inh. Ulrich Kühl e. K.\nEinzelkaufmann / Einzelkauffrau\nUetersen\n\nAls nicht eingetragen wird veröffentlicht: Den Gläubigern der an der Spaltung beteiligten Rechtsträger ist, wenn sie binnen sechs Monaten nach dem Tag, an dem die Eintragung der Spaltung in das Register des Sitzes desjenigen Rechtsträgers, dessen Gläubiger sie sind, als bekannt gemacht gilt, ihren Anspruch nach Grund und Höhe schriftlich anmelden, Sicherheit zu leisten, soweit sie nicht Befriedigung verlangen können. Dieses Recht steht den Gläubigern jedoch nur zu, wenn sie glaubhaft machen, dass durch die Spaltung die Erfüllung ihrer Forderung gefährdet wird. Das Recht, Sicherheitsleistung zu verlangen, steht Gläubigern nicht zu, die im Falle der Insolvenz ein Recht auf vorzugsweise Befriedigung aus einer Deckungsmasse haben, die nach gesetzlicher Vorschrift zu ihrem Schutz errichtet und staatlich überwacht ist."
    },
    {
      "date": "2025-07-25",
      "id": "117615",
      "original_text": "Registerbekanntmachung nach dem Umwandlungsgesetz\nBaden-Württemberg Amtsgericht Stuttgart HRB 571802\nWolfgang Munz Holding GmbH – Gaildorf",
      "type": "Registerbekanntmachung nach dem Umwandlungsgesetz",
      "state": "Baden-Württemberg",
      "amtsgericht": "Amtsgericht Stuttgart",
      "registernummer": "HRB 571802",
      "registerart": "HRB",
      "company_name": "Wolfgang Munz Holding GmbH",
      "company_seat": "Gaildorf",
      "details": "25.07.2025 (Bekanntmachungsdatum)\n\nBaden-Württemberg Amtsgericht Stuttgart HRB 571802\nRegisterbekanntmachung nach dem Umwandlungsgesetz 25.07.2025 (Eintragungsdatum)\n\nWolfgang Munz Holding GmbH\nGesellschaft mit beschränkter Haftung\nGaildorf\n\nDen Gläubigern der an der Verschmelzung beteiligten Rechtsträger ist, wenn sie binnen sechs Monaten nach dem Tag, an dem die Eintragung der Verschmelzung in das Register des Sitzes desjenigen Rechtsträgers, dessen Gläubiger sie sind, nach § 19 Abs. 3 UmwG als bekanntgemacht gilt, ihren Anspruch nach Grund und Höhe schriftlich anmelden, Sicherheit zu leisten, soweit sie nicht Befriedigung verlangen können. Dieses Recht steht den Gläubigern jedoch nur zu, wenn sie glaubhaft machen, dass durch die Verschmelzung die Erfüllung ihrer Forderung gefährdet wird."
    },
    {
      "date": "2025-07-25",
      "id": "117616",
      "original_text": "Registerbekanntmachung nach dem Umwandlungsgesetz\nBerlin Amtsgericht Berlin (Charlottenburg) HRB 185619\nERAIKIN Gebäudedienstleistungen UG (haftungsbeschränkt) – Berlin",
      "type": "Registerbekanntmachung nach dem Umwandlungsgesetz",
      "state": "Berlin",
      "amtsgericht": "Amtsgericht Berlin (Charlottenburg)",
      "registernummer": "HRB 185619",
      "registerart": "HRB",
      "company_name": "ERAIKIN Gebäudedienstleistungen UG (haftungsbeschränkt)",
      "company_seat": "Berlin",
      "details": "25.07.2025 (Bekanntmachungsdatum)\n\nBerlin Amtsgericht Berlin (Charlottenburg) HRB 185619\nRegisterbekanntmachung nach dem Umwandlungsgesetz 24.07.2025 (Eintragungsdatum)\n\nERAIKIN Gebäudedienstleistungen UG (haftungsbeschränkt)\nGesellschaft mit beschränkter Haftung\nBerlin\n\nZu Eintragungsnummer 5 vom 24.07.2025 wird als nicht eingetragen veröffentlicht:Den Gläubigern der an der Verschmelzung beteiligten Rechtsträger ist, wenn sie binnen sechs Monaten nach dem Tag, an dem die Eintragung der Verschmelzung in das Register des Sitzes desjenigen Rechtsträgers, dessen Gläubiger sie sind, als bekannt gemacht gilt, ihren Anspruch nach Grund und Höhe schriftlich anmelden, Sicherheit zu leisten, soweit sie nicht Befriedigung verlangen können. Dieses Recht steht den Gläubigern jedoch nur zu, wenn sie glaubhaft machen, dass durch die Verschmelzung die Erfüllung ihrer Forderung gefährdet wird. Das Recht, Sicherheitsleistung zu verlangen, steht Gläubigern nicht zu, die im Falle der Insolvenz ein Recht auf vorzugsweise Befriedigung aus einer Deckungsmasse haben, die nach gesetzlicher Vorschrift zu ihrem Schutz errichtet und staatlich überwacht ist."
    },
    {
      "date": "2025-07-25",
      "id": "117617",
      "original_text": "Registerbekanntmachung nach dem Umwandlungsgesetz\nHamburg Amtsgericht Hamburg HRB 191995\nHyAdvice GmbH – Hamburg",
      "type": "Registerbekanntmachung nach dem Umwandlungsgesetz",
      "state": "Hamburg",
      "amtsgericht": "Amtsgericht Hamburg",
      "registernummer": "HRB 191995",
      "registerart": "HRB",
      "company_name": "HyAdvice GmbH",
      "company_seat": "Hamburg",
      "details": "25.07.2025 (Bekanntmachungsdatum)\n\nHamburg Amtsgericht Hamburg HRB 191995\nRegisterbekanntmachung nach dem Umwandlungsgesetz 25.07.2025 (Eintragungsdatum)\n\nHyAdvice GmbH\nGesellschaft mit beschränkter Haftung\nHamburg\n\nAls nicht eingetragen wird bekannt gemacht:\nDen Gläubigern der an der Ausgliederung beteiligten Gesellschaften ist, wenn sie binnen sechs Monaten nach dem Tag, an dem die Eintragung der Ausgliederung in das Register des Sitzes desjenigen Rechtsträgers, dessen Gläubiger sie sind, nach § 19 Absatz 3 UmwG als bekannt gemacht gilt, ihren Anspruch nach Grund und Höhe schriftlich anmelden, Sicherheit zu leisten, soweit sie nicht Befriedigung verlangen können. Dieses Recht steht den Gläubigern jedoch nur zu, wenn sie glaubhaft machen, dass durch die Ausgliederung die Erfüllung ihrer Forderung gefährdet wird."
    },
    {
      "date": "2025-07-25",
      "id": "117618",
      "original_text": "Registerbekanntmachung nach dem Umwandlungsgesetz\nHamburg Amtsgericht Hamburg HRB 94205\nB & L Verwaltung Hotelprojekt UKE Martinistraße GmbH – Hamburg",
      "type": "Registerbekanntmachung nach dem Umwandlungsgesetz",
      "state": "Hamburg",
      "amtsgericht": "Amtsgericht Hamburg",
      "registernummer": "HRB 94205",
      "registerart": "HRB",
      "company_name": "B & L Verwaltung Hotelprojekt UKE Martinistraße GmbH",
      "company_seat": "Hamburg",
      "details": "25.07.2025 (Bekanntmachungsdatum)\n\nHamburg Amtsgericht Hamburg HRB 94205\nRegisterbekanntmachung nach dem Umwandlungsgesetz 25.07.2025 (Eintragungsdatum)\n\nB & L Verwaltung Hotelprojekt UKE Martinistraße GmbH\nGesellschaft mit beschränkter Haftung\nHamburg\n\nAls nicht eingetragen wird bekannt gemacht:\nDen Gläubigern der an der Verschmelzung beteiligten Gesellschaften ist, wenn sie binnen sechs Monaten nach dem Tag, an dem die Eintragung der Verschmelzung in das Register des Sitzes desjenigen Rechtsträgers, dessen Gläubiger sie sind, nach § 19 Absatz 3 UmwG als bekannt gemacht gilt, ihren Anspruch nach Grund und Höhe schriftlich anmelden, Sicherheit zu leisten, soweit sie nicht Befriedigung verlangen können. Dieses Recht steht den Gläubigern jedoch nur zu, wenn sie glaubhaft machen, dass durch die Verschmelzung die Erfüllung ihrer Forderung gefährdet wird."
    },
    {
      "date": "2025-07-25",
      "id": "117619",
      "original_text": "Registerbekanntmachung nach dem Umwandlungsgesetz\nHamburg Amtsgericht Hamburg HRB 39840\nB & L Real Estate GmbH – Hamburg",
      "type": "Registerbekanntmachung nach dem Umwandlungsgesetz",
      "state": "Hamburg",
      "amtsgericht": "Amtsgericht Hamburg",
      "registernummer": "HRB 39840",
      "registerart": "HRB",
      "company_name": "B & L Real Estate GmbH",
      "company_seat": "Hamburg",
      "details": "25.07.2025 (Bekanntmachungsdatum)\n\nHamburg Amtsgericht Hamburg HRB 39840\nRegisterbekanntmachung nach dem Umwandlungsgesetz 25.07.2025 (Eintragungsdatum)\n\nB & L Real Estate GmbH\nGesellschaft mit beschränkter Haftung\nHamburg\n\nAls nicht eingetragen wird bekannt gemacht:\nDen Gläubigern der an der Verschmelzung beteiligten Gesellschaften ist, wenn sie binnen sechs Monaten nach dem Tag, an dem die Eintragung der Verschmelzung in das Register des Sitzes desjenigen Rechtsträgers, dessen Gläubiger sie sind, nach § 19 Absatz 3 UmwG als bekannt gemacht gilt, ihren Anspruch nach Grund und Höhe schriftlich anmelden, Sicherheit zu leisten, soweit sie nicht Befriedigung verlangen können. Dieses Recht steht den Gläubigern jedoch nur zu, wenn sie glaubhaft machen, dass durch die Verschmelzung die Erfüllung ihrer Forderung gefährdet wird."
    },
    {
      "date": "2025-07-25",
      "id": "117620",
      "original_text": "Einreichung neuer Dokumente\nBerlin Amtsgericht Berlin (Charlottenburg) HRB 65553\nTME Pharma Aktiengesellschaft – Berlin",
      "type": "Einreichung neuer Dokumente",
      "state": "Berlin",
      "amtsgericht": "Amtsgericht Berlin (Charlottenburg)",
      "registernummer": "HRB 65553",
      "registerart": "HRB",
      "company_name": "TME Pharma Aktiengesellschaft",
      "company_seat": "Berlin",
      "details": "25.07.2025 (Bekanntmachungsdatum)\n\nBerlin Amtsgericht Berlin (Charlottenburg) HRB 65553\nEinreichung neuer Dokumente\n\nTME Pharma Aktiengesellschaft\nAktiengesellschaft\nBerlin\n\nAls nicht eingetragen wird veröffentlicht: Es wurde eine neue Liste der Aufsichtsratsmitglieder eingereicht (§ 106 AktG)."
    },
    {
      "date": "2025-07-25",
      "id": "117621",
      "original_text": "Registerbekanntmachung nach dem Umwandlungsgesetz\nBaden-Württemberg Amtsgericht Stuttgart HRB 790566\noccasii GmbH – Löchgau",
      "type": "Registerbekanntmachung nach dem Umwandlungsgesetz",
      "state": "Baden-Württemberg",
      "amtsgericht": "Amtsgericht Stuttgart",
      "registernummer": "HRB 790566",
      "registerart": "HRB",
      "company_name": "occasii GmbH",
      "company_seat": "Löchgau",
      "details": "25.07.2025 (Bekanntmachungsdatum)\n\nBaden-Württemberg Amtsgericht Stuttgart HRB 790566\nRegisterbekanntmachung nach dem Umwandlungsgesetz 25.07.2025 (Eintragungsdatum)\n\noccasii GmbH\nGesellschaft mit beschränkter Haftung\nLöchgau\n\nAls nicht eingetragen wird bekanntgemacht:\nDen Gläubigern der an der Verschmelzung beteiligten Rechtsträger ist, wenn sie binnen sechs Monaten nach dem Tag, an dem die Eintragung der Verschmelzung in das Register des Sitzes desjenigen Rechtsträgers, dessen Gläubiger sie sind, nach § 19 Abs. 3 UmwG als bekanntgemacht gilt, ihren Anspruch nach Grund und Höhe schriftlich anmelden, Sicherheit zu leisten, soweit sie nicht Befriedigung verlangen können. Dieses Recht steht den Gläubigern jedoch nur zu, wenn sie glaubhaft machen, dass durch die Verschmelzung die Erfüllung ihrer Forderung gefährdet wird."
    },
    {
      "date": "2025-07-25",
      "id": "117622",
      "original_text": "Registerbekanntmachung nach dem Umwandlungsgesetz\nSchleswig-Holstein Amtsgericht Kiel HRB 11608\nMöbel Kraft AG – Bad Segeberg",
      "type": "Registerbekanntmachung nach dem Umwandlungsgesetz",
      "state": "Schleswig-Holstein",
      "amtsgericht": "Amtsgericht Kiel",
      "registernummer": "HRB 11608",
      "registerart": "HRB",
      "company_name": "Möbel Kraft AG",
      "company_seat": "Bad Segeberg",
      "details": "25.07.2025 (Bekanntmachungsdatum)\n\nSchleswig-Holstein Amtsgericht Kiel HRB 11608\nRegisterbekanntmachung nach dem Umwandlungsgesetz 24.07.2025 (Eintragungsdatum)\n\nMöbel Kraft AG\nAktiengesellschaft\nBad Segeberg\n\nZu Eintragungsnummer 19 vom 24.07.2025 wird als nicht eingetragen veröffentlicht: Den Gläubigern ist, wenn sie binnen sechs Monaten nach dem Tag, an dem die Eintragung der Umwandlung bekannt gemacht worden ist, ihren Anspruch nach Grund und Höhe schriftlich anmelden, Sicherheit zu leisten, soweit sie nicht Befriedigung verlangen können. Dieses Recht steht den Gläubigern jedoch nur zu, wenn sie glaubhaft machen, dass durch die Umwandlung die Erfüllung ihrer Forderung gefährdet wird."
    },
    {
      "date": "2025-07-25",
      "id": "117623",
      "original_text": "Löschungsankündigung\nSachsen Amtsgericht Chemnitz HRB 26667\nHentschel Bau-Leister UG (haftungsbeschränkt) – Werdau",
      "type": "Löschungsankündigung",
      "state": "Sachsen",
      "amtsgericht": "Amtsgericht Chemnitz",
      "registernummer": "HRB 26667",
      "registerart": "HRB",
      "company_name": "Hentschel Bau-Leister UG (haftungsbeschränkt)",
      "company_seat": "Werdau",
      "details": "25.07.2025 (Bekanntmachungsdatum)\n\nSachsen Amtsgericht Chemnitz HRB 26667\nLöschungsankündigung\n\nHentschel Bau-Leister UG (haftungsbeschränkt)\nGesellschaft mit beschränkter Haftung\nWerdau\n\nDas Registergericht beabsichtigt, die im Handelsregister eingetragene Gesellschaft von Amts wegen nach § 394 FamFG zu löschen. Die Frist zu Erhebung eines Widerspruchs gegen die beabsichtigte Löschung wird auf einen Monat festgesetzt."
    },
    {
      "date": "2025-07-25",
      "id": "117624",
      "original_text": "Einreichung neuer Dokumente\nSachsen Amtsgericht Dresden HRB 38889\nKuravisma Holding AG – Dresden",
      "type": "Einreichung neuer Dokumente",
      "state": "Sachsen",
      "amtsgericht": "Amtsgericht Dresden",
      "registernummer": "HRB 38889",
      "registerart": "HRB",
      "company_name": "Kuravisma Holding AG",
      "company_seat": "Dresden",
      "details": "25.07.2025 (Bekanntmachungsdatum)\n\nSachsen Amtsgericht Dresden HRB 38889\nEinreichung neuer Dokumente 25.07.2025 (Eintragungsdatum)\n\nKuravisma Holding AG\nAktiengesellschaft\nDresden\n\nAm 24.07.2025 wurde beim Handelsregister des Amtsgerichts Dresden die Liste der Mitglieder des Aufsichtsrats gemäß § 106 AktG eingereicht."
    },
    {
      "date": "2025-07-25",
      "id": "117625",
      "original_text": "Registerbekanntmachung nach dem Umwandlungsgesetz\nSachsen Amtsgericht Chemnitz HRB 29025\nPhysio-Vital-Reha GmbH – Glauchau",
      "type": "Registerbekanntmachung nach dem Umwandlungsgesetz",
      "state": "Sachsen",
      "amtsgericht": "Amtsgericht Chemnitz",
      "registernummer": "HRB 29025",
      "registerart": "HRB",
      "company_name": "Physio-Vital-Reha GmbH",
      "company_seat": "Glauchau",
      "details": "25.07.2025 (Bekanntmachungsdatum)\n\nSachsen Amtsgericht Chemnitz HRB 29025\nRegisterbekanntmachung nach dem Umwandlungsgesetz 25.07.2025 (Eintragungsdatum)\n\nPhysio-Vital-Reha GmbH\nGesellschaft mit beschränkter Haftung\nGlauchau\n\nDen Gläubigern der an der Verschmelzung beteiligten Rechtsträger ist, wenn sie binnen sechs Monaten nach dem Tag, an dem die Eintragung der Verschmelzung in das Register des Sitzes desjenigen Rechtsträgers, dessen Gläubiger sie sind, nach § 19 Abs. 3 UmwG als bekannt gemacht gilt, ihren Anspruch nach Grund und Höhe in Textform anmelden, Sicherheit zu leisten, soweit sie nicht Befriedigung verlangen können. Dieses Recht steht den Gläubigern jedoch nur zu, wenn sie glaubhaft machen, dass durch die Verschmelzung die Erfüllung der Forderung gefährdet wird."
    },
    {
      "date": "2025-07-25",
      "id": "117626",
      "original_text": "Registerbekanntmachung nach dem Umwandlungsgesetz\nSachsen Amtsgericht Dresden HRA 12227\nPension am Großen Garten e. K. Inhaberin Andrea Schmitt – Dresden",
      "type": "Registerbekanntmachung nach dem Umwandlungsgesetz",
      "state": "Sachsen",
      "amtsgericht": "Amtsgericht Dresden",
      "registernummer": "HRA 12227",
      "registerart": "HRA",
      "company_name": "Pension am Großen Garten e. K. Inhaberin Andrea Schmitt",
      "company_seat": "Dresden",
      "details": "25.07.2025 (Bekanntmachungsdatum)\n\nSachsen Amtsgericht Dresden HRA 12227\nRegisterbekanntmachung nach dem Umwandlungsgesetz 25.07.2025 (Eintragungsdatum)\n\nPension am Großen Garten e. K. Inhaberin Andrea Schmitt\nEinzelkaufmann / Einzelkauffrau\nDresden\n\nDen Gläubigern der an der Ausgliederung beteiligten Rechtsträger ist, wenn sie binnen sechs Monaten nach dem Tag, an dem die Eintragung der Ausgliederung in das Register des Sitzes desjenigen Rechtsträgers, dessen Gläubiger sie sind, nach § 19 Abs. 3 UmwG als bekannt gemacht gilt, ihren Anspruch nach Grund und Höhe in Textform anmelden, Sicherheit zu leisten, soweit sie nicht Befriedigung verlangen können. Dieses Recht steht den Gläubigern jedoch nur zu, wenn sie glaubhaft machen, dass durch die Ausgliederung die Erfüllung der Forderung gefährdet wird."
    },
    {
      "date": "2025-07-25",
      "id": "117627",
      "original_text": "Löschungsankündigung\nSachsen Amtsgericht Chemnitz HRB 27035\nBL Media GmbH – Chemnitz",
      "type": "Löschungsankündigung",
      "state": "Sachsen",
      "amtsgericht": "Amtsgericht Chemnitz",
      "registernummer": "HRB 27035",
      "registerart": "HRB",
      "company_name": "BL Media GmbH",
      "company_seat": "Chemnitz",
      "details": "25.07.2025 (Bekanntmachungsdatum)\n\nSachsen Amtsgericht Chemnitz HRB 27035\nLöschungsankündigung 25.07.2025 (Eintragungsdatum)\n\nBL Media GmbH\nGesellschaft mit beschränkter Haftung\nChemnitz\n\nDas Registergericht beabsichtigt, die im Handelsregister eingetragene Gesellschaft von Amts wegen nach § 394 FamFG zu löschen. Die Frist zu Erhebung eines Widerspruchs gegen die beabsichtigte Löschung wird auf einen Monat festgesetzt."
    },
    {
      "date": "2025-07-25",
      "id": "117628",
      "original_text": "Löschungsankündigung\nNiedersachsen Amtsgericht Osnabrück HRA 100677\nKS immobilien GmbH & Co. KG – Emsbüren",
      "type": "Löschungsankündigung",
      "state": "Niedersachsen",
      "amtsgericht": "Amtsgericht Osnabrück",
      "registernummer": "HRA 100677",
      "registerart": "HRA",
      "company_name": "KS immobilien GmbH & Co. KG",
      "company_seat": "Emsbüren",
      "details": "25.07.2025 (Bekanntmachungsdatum)\n\nNiedersachsen Amtsgericht Osnabrück HRA 100677\nLöschungsankündigung\n\nKS immobilien GmbH & Co. KG\nKommanditgesellschaft\nEmsbüren\n\nDas Registergericht beabsichtigt, die Firma von Amts wegen nach § 394 FamFG wegen Vermögenslosigkeit zu löschen. Die Frist zur Erhebung eines Widerspruchs ist auf 1 Monat ab dieser Registerbekanntmachung festgesetzt."
    },
    {
      "date": "2025-07-25",
      "id": "117629",
      "original_text": "Registerbekanntmachung nach dem Umwandlungsgesetz\nNiedersachsen Amtsgericht Hannover HRB 58535\numwelttechnik & ingenieure GmbH – Hannover",
      "type": "Registerbekanntmachung nach dem Umwandlungsgesetz",
      "state": "Niedersachsen",
      "amtsgericht": "Amtsgericht Hannover",
      "registernummer": "HRB 58535",
      "registerart": "HRB",
      "company_name": "umwelttechnik & ingenieure GmbH",
      "company_seat": "Hannover",
      "details": "25.07.2025 (Bekanntmachungsdatum)\n\nNiedersachsen Amtsgericht Hannover HRB 58535\nRegisterbekanntmachung nach dem Umwandlungsgesetz 25.07.2025 (Eintragungsdatum)\n\numwelttechnik & ingenieure GmbH\nGesellschaft mit beschränkter Haftung\nHannover\n\nDen Gläubigern der an der Verschmelzung beteiligten Rechtsträger ist, wenn sie binnen sechs Monaten nach dem Tag, an dem die Eintragung der Verschmelzung in das Register des Sitzes desjenigen Rechtsträgers, dessen Gläubiger sie sind, nach § 19  Abs.  3 UmwG als bekannt gemacht gilt, ihren Anspruch nach Grund und Höhe schriftlich anmelden, Sicherheit zu leisten, soweit sie nicht Befriedigung verlangen können. Dieses Recht steht den Gläubigern jedoch nur zu, wenn sie glaubhaft machen, dass durch die Verschmelzung die Erfüllung der Forderung gefährdet wird."
    },
    {
      "date": "2025-07-25",
      "id": "117630",
      "original_text": "Registerbekanntmachung nach dem Umwandlungsgesetz\nNiedersachsen Amtsgericht Hannover HRB 229227\nBrand GmbH – Wunstorf",
      "type": "Registerbekanntmachung nach dem Umwandlungsgesetz",
      "state": "Niedersachsen",
      "amtsgericht": "Amtsgericht Hannover",
      "registernummer": "HRB 229227",
      "registerart": "HRB",
      "company_name": "Brand GmbH",
      "company_seat": "Wunstorf",
      "details": "25.07.2025 (Bekanntmachungsdatum)\n\nNiedersachsen Amtsgericht Hannover HRB 229227\nRegisterbekanntmachung nach dem Umwandlungsgesetz 25.07.2025 (Eintragungsdatum)\n\nBrand GmbH\nGesellschaft mit beschränkter Haftung\nWunstorf\n\nDen Gläubigern der an der Ausgliederung beteiligten Rechtsträger ist, wenn sie binnen sechs Monaten nach dem Tag, an dem die Eintragung der Ausgliederung in das Register des Sitzes desjenigen Rechtsträgers, dessen Gläubiger sie sind, nach § 19 Abs. 3 UmwG als bekannt gemacht gilt, ihren Anspruch nach Grund und Höhe schriftlich anmelden, Sicherheit zu leisten, soweit sie nicht Befriedigung verlangen können. Dieses Recht steht den Gläubigern jedoch nur zu, wenn sie glaubhaft machen, dass durch die Ausgliederung die Erfüllung der Forderung gefährdet wird."
    },
    {
      "date": "2025-07-25",
      "id": "117631",
      "original_text": "Löschungsankündigung\nNiedersachsen Amtsgericht Braunschweig HRA 201911\nMarktplatz e // e Braunschweig UG (haftungsbeschränkt) & Co. KG – Braunschweig",
      "type": "Löschungsankündigung",
      "state": "Niedersachsen",
      "amtsgericht": "Amtsgericht Braunschweig",
      "registernummer": "HRA 201911",
      "registerart": "HRA",
      "company_name": "Marktplatz e // e Braunschweig UG (haftungsbeschränkt) & Co. KG",
      "company_seat": "Braunschweig",
      "details": "25.07.2025 (Bekanntmachungsdatum)\n\nNiedersachsen Amtsgericht Braunschweig HRA 201911\nLöschungsankündigung 25.07.2025 (Eintragungsdatum)\n\nMarktplatz e // e Braunschweig UG (haftungsbeschränkt) & Co. KG\nKommanditgesellschaft\nBraunschweig\n\nDas Registergericht beabsichtigt, die Firma von Amts wegen nach § 394 Abs. 4 FamFG zu löschen. Die Frist zur Erhebung eines Widerspruchs ist auf 1 Monat ab dieser Registerbekanntmachung festgesetzt."
    },
    {
      "date": "2025-07-25",
      "id": "117632",
      "original_text": "Löschungsankündigung\nNiedersachsen Amtsgericht Braunschweig HRB 204292\nBautechnik Palluch GmbH – Braunschweig",
      "type": "Löschungsankündigung",
      "state": "Niedersachsen",
      "amtsgericht": "Amtsgericht Braunschweig",
      "registernummer": "HRB 204292",
      "registerart": "HRB",
      "company_name": "Bautechnik Palluch GmbH",
      "company_seat": "Braunschweig",
      "details": "25.07.2025 (Bekanntmachungsdatum)\n\nNiedersachsen Amtsgericht Braunschweig HRB 204292\nLöschungsankündigung 25.07.2025 (Eintragungsdatum)\n\nBautechnik Palluch GmbH\nGesellschaft mit beschränkter Haftung\nBraunschweig\n\nDas Registergericht beabsichtigt, die Gesellschaft von Amts wegen nach § 394 FamFG zu löschen. Die Frist zur Erhebung eines Widerspruchs ist auf 1 Monat ab dieser Registerbekanntmachung festgesetzt."
    },
    {
      "date": "2025-07-25",
      "id": "117633",
      "original_text": "Registerbekanntmachung nach dem Umwandlungsgesetz\nNiedersachsen Amtsgericht Hannover HRB 51739\nIngenieurbüro für Abfallwirtschaft und Energietechnik GmbH (IBA) – Hannover",
      "type": "Registerbekanntmachung nach dem Umwandlungsgesetz",
      "state": "Niedersachsen",
      "amtsgericht": "Amtsgericht Hannover",
      "registernummer": "HRB 51739",
      "registerart": "HRB",
      "company_name": "Ingenieurbüro für Abfallwirtschaft und Energietechnik GmbH (IBA)",
      "company_seat": "Hannover",
      "details": "25.07.2025 (Bekanntmachungsdatum)\n\nNiedersachsen Amtsgericht Hannover HRB 51739\nRegisterbekanntmachung nach dem Umwandlungsgesetz 25.07.2025 (Eintragungsdatum)\n\nIngenieurbüro für Abfallwirtschaft und Energietechnik GmbH (IBA)\nGesellschaft mit beschränkter Haftung\nHannover\n\nDen Gläubigern der an der Verschmelzung beteiligten Rechtsträger ist, wenn sie binnen sechs Monaten nach dem Tag, an dem die Eintragung der Verschmelzung in das Register des Sitzes desjenigen Rechtsträgers, dessen Gläubiger sie sind, nach § 19  Abs.  3 UmwG als bekannt gemacht gilt, ihren Anspruch nach Grund und Höhe schriftlich anmelden, Sicherheit zu leisten, soweit sie nicht Befriedigung verlangen können. Dieses Recht steht den Gläubigern jedoch nur zu, wenn sie glaubhaft machen, dass durch die Verschmelzung die Erfüllung der Forderung gefährdet wird."
    },
    {
      "date": "2025-07-25",
      "id": "117634",
      "original_text": "Registerbekanntmachung nach dem Umwandlungsgesetz\nNiedersachsen Amtsgericht Tostedt HRB 202825\nAakamp GmbH – Breddorf",
      "type": "Registerbekanntmachung nach dem Umwandlungsgesetz",
      "state": "Niedersachsen",
      "amtsgericht": "Amtsgericht Tostedt",
      "registernummer": "HRB 202825",
      "registerart": "HRB",
      "company_name": "Aakamp GmbH",
      "company_seat": "Breddorf",
      "details": "25.07.2025 (Bekanntmachungsdatum)\n\nNiedersachsen Amtsgericht Tostedt HRB 202825\nRegisterbekanntmachung nach dem Umwandlungsgesetz 25.07.2025 (Eintragungsdatum)\n\nAakamp GmbH\nGesellschaft mit beschränkter Haftung\nBreddorf\n\nDen Gläubigern der an der Verschmelzung beteiligten Rechtsträger ist, wenn sie binnen sechs Monaten nach dem Tag, an dem die Eintragung der Verschmelzung in das Register des Sitzes desjenigen Rechtsträgers, dessen Gläubiger sie sind, nach § 19  Abs.  3 UmwG als bekannt gemacht gilt, ihren Anspruch nach Grund und Höhe schriftlich anmelden, Sicherheit zu leisten, soweit sie nicht Befriedigung verlangen können. Dieses Recht steht den Gläubigern jedoch nur zu, wenn sie glaubhaft machen, dass durch die Verschmelzung die Erfüllung der Forderung gefährdet wird."
    },
    {
      "date": "2025-07-25",
      "id": "117635",
      "original_text": "Löschungsankündigung\nNiedersachsen Amtsgericht Osnabrück HRB 206444\nWFK Fleischspezialitäten GmbH – Georgsdorf",
      "type": "Löschungsankündigung",
      "state": "Niedersachsen",
      "amtsgericht": "Amtsgericht Osnabrück",
      "registernummer": "HRB 206444",
      "registerart": "HRB",
      "company_name": "WFK Fleischspezialitäten GmbH",
      "company_seat": "Georgsdorf",
      "details": "25.07.2025 (Bekanntmachungsdatum)\n\nNiedersachsen Amtsgericht Osnabrück HRB 206444\nLöschungsankündigung 25.07.2025 (Eintragungsdatum)\n\nWFK Fleischspezialitäten GmbH\nGesellschaft mit beschränkter Haftung\nGeorgsdorf\n\nDas Registergericht beabsichtigt, die Gesellschaft von Amts wegen nach § 394 FamFG wegen Vermögenslosigkeit zu löschen. Die Frist zur Erhebung eines Widerspruchs ist auf 1 Monat ab dieser Registerbekanntmachung festgesetzt."
    },
    {
      "date": "2025-07-25",
      "id": "117636",
      "original_text": "Registerbekanntmachung nach dem Umwandlungsgesetz\nNiedersachsen Amtsgericht Hannover HRA 206739\nHarald Brand Dienstleistungen e.K. – Wunstorf",
      "type": "Registerbekanntmachung nach dem Umwandlungsgesetz",
      "state": "Niedersachsen",
      "amtsgericht": "Amtsgericht Hannover",
      "registernummer": "HRA 206739",
      "registerart": "HRA",
      "company_name": "Harald Brand Dienstleistungen e.K.",
      "company_seat": "Wunstorf",
      "details": "25.07.2025 (Bekanntmachungsdatum)\n\nNiedersachsen Amtsgericht Hannover HRA 206739\nRegisterbekanntmachung nach dem Umwandlungsgesetz 25.07.2025 (Eintragungsdatum)\n\nHarald Brand Dienstleistungen e.K.\nEinzelkaufmann / Einzelkauffrau\nWunstorf\n\nDen Gläubigern der an der Ausgliederung beteiligten Rechtsträger ist, wenn sie binnen sechs Monaten nach dem Tag, an dem die Eintragung der Ausgliederung in das Register des Sitzes desjenigen Rechtsträgers, dessen Gläubiger sie sind, nach § 19 Abs. 3 UmwG als bekannt gemacht gilt, ihren Anspruch nach Grund und Höhe schriftlich anmelden, Sicherheit zu leisten, soweit sie nicht Befriedigung verlangen können. Dieses Recht steht den Gläubigern jedoch nur zu, wenn sie glaubhaft machen, dass durch die Ausgliederung die Erfüllung der Forderung gefährdet wird."
    },
    {
      "date": "2025-07-25",
      "id": "117637",
      "original_text": "Löschungsankündigung\nNiedersachsen Amtsgericht Braunschweig HRB 206302\nWanted Food UG (haftungsbeschränkt) – Braunschweig",
      "type": "Löschungsankündigung",
      "state": "Niedersachsen",
      "amtsgericht": "Amtsgericht Braunschweig",
      "registernummer": "HRB 206302",
      "registerart": "HRB",
      "company_name": "Wanted Food UG (haftungsbeschränkt)",
      "company_seat": "Braunschweig",
      "details": "25.07.2025 (Bekanntmachungsdatum)\n\nNiedersachsen Amtsgericht Braunschweig HRB 206302\nLöschungsankündigung\n\nWanted Food UG (haftungsbeschränkt)\nGesellschaft mit beschränkter Haftung\nBraunschweig\n\nDas Registergericht beabsichtigt, die Gesellschaft von Amts wegen nach § 394 FamFG zu löschen. Die Frist zur Erhebung eines Widerspruchs ist auf 1 Monat ab dieser Registerbekanntmachung festgesetzt."
    },
    {
      "date": "2025-07-25",
      "id": "117638",
      "original_text": "Einreichung neuer Dokumente\nNiedersachsen Amtsgericht Hannover HRB 58026\nDelticom AG – Hannover",
      "type": "Einreichung neuer Dokumente",
      "state": "Niedersachsen",
      "amtsgericht": "Amtsgericht Hannover",
      "registernummer": "HRB 58026",
      "registerart": "HRB",
      "company_name": "Delticom AG",
      "company_seat": "Hannover",
      "details": "25.07.2025 (Bekanntmachungsdatum)\n\nNiedersachsen Amtsgericht Hannover HRB 58026\nEinreichung neuer Dokumente 25.07.2025 (Eintragungsdatum)\n\nDelticom AG\nAktiengesellschaft\nHannover\n\nDie Liste der Mitglieder des Aufsichtsrats wurde beim Registergericht eingereicht."
    },
    {
      "date": "2025-07-25",
      "id": "117639",
      "original_text": "Registerbekanntmachung nach dem Umwandlungsgesetz\nNiedersachsen Amtsgericht Osnabrück HRB 218962\nHeytex Corporate Services GmbH – Bramsche",
      "type": "Registerbekanntmachung nach dem Umwandlungsgesetz",
      "state": "Niedersachsen",
      "amtsgericht": "Amtsgericht Osnabrück",
      "registernummer": "HRB 218962",
      "registerart": "HRB",
      "company_name": "Heytex Corporate Services GmbH",
      "company_seat": "Bramsche",
      "details": "25.07.2025 (Bekanntmachungsdatum)\n\nNiedersachsen Amtsgericht Osnabrück HRB 218962\nRegisterbekanntmachung nach dem Umwandlungsgesetz 25.07.2025 (Eintragungsdatum)\n\nHeytex Corporate Services GmbH\nGesellschaft mit beschränkter Haftung\nBramsche\n\nDen Gläubigern der an der Verschmelzung beteiligten Rechtsträger ist, wenn sie binnen sechs Monaten nach dem Tag, an dem die Eintragung der Verschmelzung in das Register des Sitzes desjenigen Rechtsträgers, dessen Gläubiger sie sind, nach § 19  Abs.  3 UmwG als bekannt gemacht gilt, ihren Anspruch nach Grund und Höhe schriftlich anmelden, Sicherheit zu leisten, soweit sie nicht Befriedigung verlangen können. Dieses Recht steht den Gläubigern jedoch nur zu, wenn sie glaubhaft machen, dass durch die Verschmelzung die Erfüllung der Forderung gefährdet wird."
    },
    {
      "date": "2025-07-25",
      "id": "117640",
      "original_text": "Einreichung neuer Dokumente\nNiedersachsen Amtsgericht Hildesheim HRB 110416 früher Amtsgericht Alfeld\nPorzellanmanufaktur FÜRSTENBERG GmbH – Fürstenberg a. d. Weser",
      "type": "Einreichung neuer Dokumente",
      "state": "Niedersachsen",
      "amtsgericht": "Amtsgericht Hildesheim",
      "registernummer": "HRB 110416",
      "registerart": "HRB",
      "company_name": "Porzellanmanufaktur FÜRSTENBERG GmbH",
      "company_seat": "Fürstenberg a. d. Weser",
      "former_amtsgericht": "Alfeld",
      "details": "25.07.2025 (Bekanntmachungsdatum)\n\nNiedersachsen Amtsgericht Hildesheim HRB 110416 früher Amtsgericht Alfeld\nEinreichung neuer Dokumente 25.07.0205 (Eintragungsdatum)\n\nPorzellanmanufaktur FÜRSTENBERG GmbH\nGesellschaft mit beschränkter Haftung\nFürstenberg a. d. Weser\n\nDie Liste der Mitglieder des Aufsichtsrats wurde beim Registergericht eingereicht."
    },
    {
      "date": "2025-07-25",
      "id": "117641",
      "original_text": "Registerbekanntmachung nach dem Umwandlungsgesetz\nRheinland-Pfalz Amtsgericht Landau HRB 2548\nHubert Eichenlaub Transporte und Spedition GmbH – Herxheim bei Landau",
      "type": "Registerbekanntmachung nach dem Umwandlungsgesetz",
      "state": "Rheinland-Pfalz",
      "amtsgericht": "Amtsgericht Landau",
      "registernummer": "HRB 2548",
      "registerart": "HRB",
      "company_name": "Hubert Eichenlaub Transporte und Spedition GmbH",
      "company_seat": "Herxheim bei Landau",
      "details": "25.07.2025 (Bekanntmachungsdatum)\n\nRheinland-Pfalz Amtsgericht Landau HRB 2548\nRegisterbekanntmachung nach dem Umwandlungsgesetz 25.07.2025 (Eintragungsdatum)\n\nHubert Eichenlaub Transporte und Spedition GmbH\nGesellschaft mit beschränkter Haftung\nHerxheim bei Landau\n\nAls nicht eingetragen wird veröffentlicht: Den Gläubigern der an der Verschmelzung beteiligten Rechtsträger ist, wenn sie binnen sechs Monaten nach dem Tag, an dem die Eintragung der Verschmelzung in das Register des Sitzes desjenigen Rechtsträgers, dessen Gläubiger sie sind, nach § 19 Abs. 3 UmwG als bekannt gemacht gilt, ihren Anspruch nach Grund und Höhe schriftlich anmelden, Sicherheit zu leisten, soweit sie nicht Befriedigung verlangen können. Dieses Recht steht den Gläubigern jedoch nur zu, wenn sie glaubhaft machen, dass durch die Verschmelzung die Erfüllung der Forderung gefährdet wird."
    },
    {
      "date": "2025-07-25",
      "id": "117642",
      "original_text": "Löschungsankündigung\nRheinland-Pfalz Amtsgericht Ludwigshafen a.Rhein (Ludwigshafen) HRB 65985\nModern Chocolate GmbH – Neustadt/Wstr.",
      "type": "Löschungsankündigung",
      "state": "Rheinland-Pfalz",
      "amtsgericht": "Amtsgericht Ludwigshafen a.Rhein (Ludwigshafen)",
      "registernummer": "HRB 65985",
      "registerart": "HRB",
      "company_name": "Modern Chocolate GmbH",
      "company_seat": "Neustadt/Wstr.",
      "details": "25.07.2025 (Bekanntmachungsdatum)\n\nRheinland-Pfalz Amtsgericht Ludwigshafen a.Rhein (Ludwigshafen) HRB 65985\nLöschungsankündigung 25.07.2025 (Eintragungsdatum)\n\nModern Chocolate GmbH\nGesellschaft mit beschränkter Haftung\nNeustadt/Wstr.\n\nDas Registergericht beabsichtigt die Gesellschaft von Amts wegen nach § 394 FamFG zu löschen. Die Frist zur Erhebung eines Widerspruchs ist auf drei Monate festgesetzt."
    },
    {
      "date": "2025-07-25",
      "id": "117643",
      "original_text": "Registerbekanntmachung nach dem Umwandlungsgesetz\nRheinland-Pfalz Amtsgericht Landau HRB 2512\nEichenlaub Dienstleistungs-GmbH – Herxheim bei Landau",
      "type": "Registerbekanntmachung nach dem Umwandlungsgesetz",
      "state": "Rheinland-Pfalz",
      "amtsgericht": "Amtsgericht Landau",
      "registernummer": "HRB 2512",
      "registerart": "HRB",
      "company_name": "Eichenlaub Dienstleistungs-GmbH",
      "company_seat": "Herxheim bei Landau",
      "details": "25.07.2025 (Bekanntmachungsdatum)\n\nRheinland-Pfalz Amtsgericht Landau HRB 2512\nRegisterbekanntmachung nach dem Umwandlungsgesetz 25.07.2025 (Eintragungsdatum)\n\nEichenlaub Dienstleistungs-GmbH\nGesellschaft mit beschränkter Haftung\nHerxheim bei Landau\n\nAls nicht eingetragen wird veröffentlicht: Den Gläubigern der an der Verschmelzung beteiligten Rechtsträger ist, wenn sie binnen sechs Monaten nach dem Tag, an dem die Eintragung der Verschmelzung in das Register des Sitzes desjenigen Rechtsträgers, dessen Gläubiger sie sind, nach § 19 Abs. 3 UmwG als bekannt gemacht gilt, ihren Anspruch nach Grund und Höhe schriftlich anmelden, Sicherheit zu leisten, soweit sie nicht Befriedigung verlangen können. Dieses Recht steht den Gläubigern jedoch nur zu, wenn sie glaubhaft machen, dass durch die Verschmelzung die Erfüllun der Forderung gefährdet wird."
    },
    {
      "date": "2025-07-25",
      "id": "117644",
      "original_text": "Registerbekanntmachung nach dem Umwandlungsgesetz\nBremen Amtsgericht Bremen HRA 10902\nGebrüder Specht GmbH & Co.KG – Bremen",
      "type": "Registerbekanntmachung nach dem Umwandlungsgesetz",
      "state": "Bremen",
      "amtsgericht": "Amtsgericht Bremen",
      "registernummer": "HRA 10902",
      "registerart": "HRA",
      "company_name": "Gebrüder Specht GmbH & Co.KG",
      "company_seat": "Bremen",
      "details": "25.07.2025 (Bekanntmachungsdatum)\n\nBremen Amtsgericht Bremen HRA 10902\nRegisterbekanntmachung nach dem Umwandlungsgesetz 18.07.2025 (Eintragungsdatum)\n\nGebrüder Specht GmbH & Co.KG\nKommanditgesellschaft\nBremen\n\nZu Eintragungsnummer 14 vom 18.07.2025 wird als nicht eingetragen veröffentlicht: Den Gläubigern der an der Verschmelzung beteiligten Rechtsträger ist, wenn sie binnen sechs Monaten nach dem Tag, an dem die Eintragung der Verschmelzung in das Register des Sitzes desjenigen Rechtsträgers, dessen Gläubiger sie sind, als bekannt gemacht gilt, ihren Anspruch nach Grund und Höhe schriftlich anmelden, Sicherheit zu leisten, soweit sie nicht Befriedigung verlangen können. Dieses Recht steht den Gläubigern jedoch nur zu, wenn sie glaubhaft machen, dass durch die Verschmelzung die Erfüllung ihrer Forderung gefährdet wird. Das Recht, Sicherheitsleistung zu verlangen, steht Gläubigern nicht zu, die im Falle der Insolvenz ein Recht auf vorzugsweise Befriedigung aus einer Deckungsmasse haben, die nach gesetzlicher Vorschrift zu ihrem Schutz errichtet und staatlich überwacht ist."
    },
    {
      "date": "2025-07-25",
      "id": "117645",
      "original_text": "Löschungsankündigung\nBremen Amtsgericht Bremen HRB 35167\nBSM UG (haftungsbeschränkt) – Bremen",
      "type": "Löschungsankündigung",
      "state": "Bremen",
      "amtsgericht": "Amtsgericht Bremen",
      "registernummer": "HRB 35167",
      "registerart": "HRB",
      "company_name": "BSM UG (haftungsbeschränkt)",
      "company_seat": "Bremen",
      "details": "25.07.2025 (Bekanntmachungsdatum)\n\nBremen Amtsgericht Bremen HRB 35167\nLöschungsankündigung\n\nBSM UG (haftungsbeschränkt)\nGesellschaft mit beschränkter Haftung\nBremen\n\nEs ist beabsichtigt die im Handelsregister eingetragene Gesellschaft von Amts wegen gemäß § 394 FamFG zu löschen. Gegen die Löschung kann beim AG Bremen schriftlich oder zu Protokoll der Geschäftsstelle Widerspruch eingelegt werden. Widerspruchsfrist 4 Wochen."
    },
    {
      "date": "2025-07-25",
      "id": "117646",
      "original_text": "Registerbekanntmachung nach dem Umwandlungsgesetz\nRheinland-Pfalz Amtsgericht Mainz HRA 44851\nLittle Brick - Lukas Bengyik e. K. – Nierstein",
      "type": "Registerbekanntmachung nach dem Umwandlungsgesetz",
      "state": "Rheinland-Pfalz",
      "amtsgericht": "Amtsgericht Mainz",
      "registernummer": "HRA 44851",
      "registerart": "HRA",
      "company_name": "Little Brick - Lukas Bengyik e. K.",
      "company_seat": "Nierstein",
      "details": "25.07.2025 (Bekanntmachungsdatum)\n\nRheinland-Pfalz Amtsgericht Mainz HRA 44851\nRegisterbekanntmachung nach dem Umwandlungsgesetz 25.07.2025 (Eintragungsdatum)\n\nLittle Brick - Lukas Bengyik e. K.\nEinzelkaufmann / Einzelkauffrau\nNierstein\n\nAls nicht eingetragen wird veröffentlicht: Den Gläubigern der an der Ausgliederung beteiligten Rechtsträger ist, wenn sie binnen sechs Monaten nach dem Tag, an dem die Eintragung der Ausgliederung in das Register des Sitzes desjenigen Rechtsträgers, dessen Gläubiger sie sind, nach § 19 Abs. 3 UmwG als bekannt gemacht gilt, ihren Anspruch nach Grund und Höhe schriftlich anmelden, Sicherheit zu leisten, soweit sie nicht Befriedigung verlangen können. Dieses Recht steht den Gläubigern jedoch nur zu, wenn sie glaubhaft machen, dass durch die Ausgliederung die Erfüllung der Forderung gefährdet wird."
    },
    {
      "date": "2025-07-25",
      "id": "117647",
      "original_text": "Einreichung neuer Dokumente\nNordrhein-Westfalen Amtsgericht Siegburg HRB 10327\nscapos AG – Sankt Augustin",
      "type": "Einreichung neuer Dokumente",
      "state": "Nordrhein-Westfalen",
      "amtsgericht": "Amtsgericht Siegburg",
      "registernummer": "HRB 10327",
      "registerart": "HRB",
      "company_name": "scapos AG",
      "company_seat": "Sankt Augustin",
      "details": "25.07.2025 (Bekanntmachungsdatum)\n\nNordrhein-Westfalen Amtsgericht Siegburg HRB 10327\nEinreichung neuer Dokumente\n\nscapos AG\nAktiengesellschaft\nSankt Augustin\n\nDem Registergericht ist eine Niederschrift der ordentlichen Hauptversammlung vom 07.07.2025 eingereicht worden."
    },
    {
      "date": "2025-07-25",
      "id": "117648",
      "original_text": "Einreichung neuer Dokumente\nNordrhein-Westfalen Amtsgericht Dortmund HRB 26278\nNordrheinische Erdgastransportleitungs-Verwaltungs-GmbH – Dortmund",
      "type": "Einreichung neuer Dokumente",
      "state": "Nordrhein-Westfalen",
      "amtsgericht": "Amtsgericht Dortmund",
      "registernummer": "HRB 26278",
      "registerart": "HRB",
      "company_name": "Nordrheinische Erdgastransportleitungs-Verwaltungs-GmbH",
      "company_seat": "Dortmund",
      "details": "25.07.2025 (Bekanntmachungsdatum)\n\nNordrhein-Westfalen Amtsgericht Dortmund HRB 26278\nEinreichung neuer Dokumente\n\nNordrheinische Erdgastransportleitungs-Verwaltungs-GmbH\nGesellschaft mit beschränkter Haftung\nDortmund\n\nDem Registergericht ist eine neue Liste der Mitglieder des Aufsichtsrates eingereicht worden."
    },
    {
      "date": "2025-07-25",
      "id": "117649",
      "original_text": "Sonstige Registerbekanntmachung\nNordrhein-Westfalen Amtsgericht Siegburg HRB 15663\nPflegeimmobilie Lindscheid GmbH – Bad Honnef",
      "type": "Sonstige Registerbekanntmachung",
      "state": "Nordrhein-Westfalen",
      "amtsgericht": "Amtsgericht Siegburg",
      "registernummer": "HRB 15663",
      "registerart": "HRB",
      "company_name": "Pflegeimmobilie Lindscheid GmbH",
      "company_seat": "Bad Honnef",
      "details": "25.07.2025 (Bekanntmachungsdatum)\n\nNordrhein-Westfalen Amtsgericht Siegburg HRB 15663\nSonstige Registerbekanntmachung 25.07.2025 (Eintragungsdatum)\n\nPflegeimmobilie Lindscheid GmbH\nGesellschaft mit beschränkter Haftung\nBad Honnef\n\nAls nicht eingetragen wird veröffentlicht: Den Gläubigern der Gesellschaft, deren Forderungen begründet worden sind bevor die Eintragung der Beendigung des Beherrschungs- und Gewinnabführungsvertrages  in das Handelsregister nach § 10 des Handelsgesetzbuches als bekanntgemacht gilt, hat der andere Vertragsteil Sicherheit zu leisten, wenn sie sich binnen sechs Monaten nach der Bekanntmachung der Eintragung zu diesem Zweck bei ihm melden."
    },
    {
      "date": "2025-07-25",
      "id": "117650",
      "original_text": "Registerbekanntmachung nach dem Umwandlungsgesetz\nNordrhein-Westfalen Amtsgericht Köln HRA 20833\nCurrenta GmbH & Co. OHG – Leverkusen",
      "type": "Registerbekanntmachung nach dem Umwandlungsgesetz",
      "state": "Nordrhein-Westfalen",
      "amtsgericht": "Amtsgericht Köln",
      "registernummer": "HRA 20833",
      "registerart": "HRA",
      "company_name": "Currenta GmbH & Co. OHG",
      "company_seat": "Leverkusen",
      "details": "25.07.2025 (Bekanntmachungsdatum)\n\nNordrhein-Westfalen Amtsgericht Köln HRA 20833\nRegisterbekanntmachung nach dem Umwandlungsgesetz 25.07.2025 (Eintragungsdatum)\n\nCurrenta GmbH & Co. OHG\nOffene Handelsgesellschaft\nLeverkusen\n\nDen Gläubigern der an der Verschmelzung beteiligten Rechtsträger ist, wenn sie binnen sechs Monaten nach dem Tag, an dem die Eintragung der Verschmelzung in das Register des Sitzes desjenigen Rechtsträgers, dessen Gläubiger sie sind, nach § 19 Absatz 3 UmwG als bekanntgemacht gilt, ihren Anspruch nach Grund und Höhe schriftlich anmelden, Sicherheit zu leisten, soweit sie nicht Befriedigung verlangen können. Dieses Recht steht den Gläubigern jedoch nur zu, wenn sie glaubhaft machen, dass durch die Verschmelzung die Erfüllung ihrer Forderung gefährdet wird."
    },
    {
      "date": "2025-07-25",
      "id": "117651",
      "original_text": "Registerbekanntmachung nach dem Umwandlungsgesetz\nNordrhein-Westfalen Amtsgericht Bielefeld HRB 36443\nLobster PIM GmbH – Bielefeld",
      "type": "Registerbekanntmachung nach dem Umwandlungsgesetz",
      "state": "Nordrhein-Westfalen",
      "amtsgericht": "Amtsgericht Bielefeld",
      "registernummer": "HRB 36443",
      "registerart": "HRB",
      "company_name": "Lobster PIM GmbH",
      "company_seat": "Bielefeld",
      "details": "25.07.2025 (Bekanntmachungsdatum)\n\nNordrhein-Westfalen Amtsgericht Bielefeld HRB 36443\nRegisterbekanntmachung nach dem Umwandlungsgesetz 25.07.2025 (Eintragungsdatum)\n\nLobster PIM GmbH\nGesellschaft mit beschränkter Haftung\nBielefeld\n\nDen Gläubigern der an der Verschmelzung beteiligten Rechtsträger ist, wenn sie binnen sechs Monaten nach dem Tag, an dem die Eintragung der Verschmelzung in das Register des Sitzes desjenigen Rechtsträgers, dessen Gläubiger sie sind, nach § 19 Absatz 3 UmwG als bekanntgemacht gilt, ihren Anspruch nach Grund und Höhe schriftlich anmelden, Sicherheit zu leisten, soweit sie nicht Befriedigung verlangen können. Dieses Recht steht den Gläubigern jedoch nur zu, wenn sie glaubhaft machen, dass durch die Verschmelzung die Erfüllung ihrer Forderung gefährdet wird."
    },
    {
      "date": "2025-07-25",
      "id": "117652",
      "original_text": "Löschungsankündigung\nNordrhein-Westfalen Amtsgericht Wuppertal HRA 16834\nProjektgesellschaft Planen + Bauen GmbH & Co. KG – Wuppertal",
      "type": "Löschungsankündigung",
      "state": "Nordrhein-Westfalen",
      "amtsgericht": "Amtsgericht Wuppertal",
      "registernummer": "HRA 16834",
      "registerart": "HRA",
      "company_name": "Projektgesellschaft Planen + Bauen GmbH & Co. KG",
      "company_seat": "Wuppertal",
      "details": "25.07.2025 (Bekanntmachungsdatum)\n\nNordrhein-Westfalen Amtsgericht Wuppertal HRA 16834\nLöschungsankündigung 25.07.2025 (Eintragungsdatum)\n\nProjektgesellschaft Planen + Bauen GmbH & Co. KG\nKommanditgesellschaft\nWuppertal\n\nDas Registergericht beabsichtigt die Firma von Amts wegen nach § 393 FamFG zu löschen. Die Frist zur Erhebung eines Widerspruchs ist auf drei Monate festgesetzt."
    },
    {
      "date": "2025-07-25",
      "id": "117653",
      "original_text": "Löschungsankündigung\nNordrhein-Westfalen Amtsgericht Köln HRB 95731\nVHD Security Station GmbH – Köln",
      "type": "Löschungsankündigung",
      "state": "Nordrhein-Westfalen",
      "amtsgericht": "Amtsgericht Köln",
      "registernummer": "HRB 95731",
      "registerart": "HRB",
      "company_name": "VHD Security Station GmbH",
      "company_seat": "Köln",
      "details": "25.07.2025 (Bekanntmachungsdatum)\n\nNordrhein-Westfalen Amtsgericht Köln HRB 95731\nLöschungsankündigung\n\nVHD Security Station GmbH\nGesellschaft mit beschränkter Haftung\nKöln\n\nDas Registergericht beabsichtigt, die im Handelsregister eingetragene Gesellschaft gemäß § 394 Absatz 1 FamFG wegen Vermögenslosigkeit von Amts wegen zu löschen. Gegen diese Verfügung kann Widerspruch eingelegt werden. Die Frist zur Erhebung eines Widerspruchs gegen die beabsichtigte Löschung von Amts wegen ist auf einen Monat festgesetzt. Rechtsbehelfsbelehrung: Gegen diese Verfügung können Sie Widerspruch einlegen. Der Widerspruch ist bei dem Amtsgericht Köln, Reichenspergerplatz 1, 50670 Köln schriftlich in deutscher Sprache oder zur Niederschrift der Geschäftsstelle einzulegen. Der Widerspruch kann auch zur Niederschrift der Geschäftsstelle eines jeden Amtsgerichtes abgegeben werden. Die Einlegung ist auch durch Übertragung eines elektronischen Dokuments an die elektronische Poststelle des Gerichts möglich. Das elektronische Dokument muss für die Bearbeitung durch das Gericht geeignet und mit einer qualifizierten elektronischen Signatur der verantwortenden Person versehen sein oder von der verantwortenden Person signiert und auf einem sicheren Übermittlungsweg gemäß § 130a ZPO nach näherer Maßgabe der Verordnung über die technischen Rahmenbedingungen des elektronischen Rechtsverkehrs und über das besondere elektronische Behördenpostfach (BGBl. I, S.3803) eingereicht werden. Weitere Informationen erhalten Sie auf der Internetseite www.justiz.de.Der Widerspruch muss spätestens innerhalb der gesetzten Frist bei dem Amtsgericht Köln eingegangen sein. Dies gilt auch dann, wenn der Widerspruch zur Niederschrift der Geschäftsstelle eines anderen Amtsgerichtes abgegeben wurde. Die Frist beginnt mit der Veröffentlichung. Fällt das Ende der Frist auf einen Sonntag, einen allgemeinen Feiertag oder Sonnabend, so endet die Frist mit Ablauf des nächsten Werktages.\n\nDer Widerspruch muss die Bezeichnung der angefochtenen Verfügung sowie die Erklärung enthalten, dass Widerspruch gegen diese Verfügung eingelegt wird. Er ist zu unterzeichnen und soll begründet werden."
    },
    {
      "date": "2025-07-25",
      "id": "117654",
      "original_text": "Registerbekanntmachung nach dem Umwandlungsgesetz\nNordrhein-Westfalen Amtsgericht Düsseldorf HRB 29097\nNERVUS Beteiligungsgesellschaft mbH – Düsseldorf",
      "type": "Registerbekanntmachung nach dem Umwandlungsgesetz",
      "state": "Nordrhein-Westfalen",
      "amtsgericht": "Amtsgericht Düsseldorf",
      "registernummer": "HRB 29097",
      "registerart": "HRB",
      "company_name": "NERVUS Beteiligungsgesellschaft mbH",
      "company_seat": "Düsseldorf",
      "details": "25.07.2025 (Bekanntmachungsdatum)\n\nNordrhein-Westfalen Amtsgericht Düsseldorf HRB 29097\nRegisterbekanntmachung nach dem Umwandlungsgesetz 25.07.2025 (Eintragungsdatum)\n\nNERVUS Beteiligungsgesellschaft mbH\nGesellschaft mit beschränkter Haftung\nDüsseldorf\n\nDen Gläubigern der an der Verschmelzung beteiligten Rechtsträger ist, wenn sie binnen sechs Monaten nach dem Tag, an dem die Eintragung der Verschmelzung in das Register des Sitzes desjenigen Rechtsträgers, dessen Gläubiger sie sind, nach § 19 Absatz 3 UmwG als bekanntgemacht gilt, ihren Anspruch nach Grund und Höhe schriftlich anmelden, Sicherheit zu leisten, soweit sie nicht Befriedigung verlangen können. Dieses Recht steht den Gläubigern jedoch nur zu, wenn sie glaubhaft machen, dass durch die Verschmelzung die Erfüllung ihrer Forderung gefährdet wird."
    },
    {
      "date": "2025-07-25",
      "id": "117655",
      "original_text": "Registerbekanntmachung nach dem Umwandlungsgesetz\nNordrhein-Westfalen Amtsgericht Iserlohn HRB 449\nPIGALLE Gaststättenbetriebe, Gesellschaft mit beschränkter Haftung – Iserlohn",
      "type": "Registerbekanntmachung nach dem Umwandlungsgesetz",
      "state": "Nordrhein-Westfalen",
      "amtsgericht": "Amtsgericht Iserlohn",
      "registernummer": "HRB 449",
      "registerart": "HRB",
      "company_name": "PIGALLE Gaststättenbetriebe, Gesellschaft mit beschränkter Haftung",
      "company_seat": "Iserlohn",
      "details": "25.07.2025 (Bekanntmachungsdatum)\n\nNordrhein-Westfalen Amtsgericht Iserlohn HRB 449\nRegisterbekanntmachung nach dem Umwandlungsgesetz 24.07.2025 (Eintragungsdatum)\n\nPIGALLE Gaststättenbetriebe, Gesellschaft mit beschränkter Haftung\nGesellschaft mit beschränkter Haftung\nIserlohn\n\nDen Gläubigern der an der Verschmelzung beteiligten Rechtsträger ist, wenn sie binnen sechs Monaten nach dem Tag, an dem die Eintragung der Verschmelzung in das Register des Sitzes desjenigen Rechtsträgers, dessen Gläubiger sie sind, nach § 19 Absatz 3 UmwG als bekanntgemacht gilt, ihren Anspruch nach Grund und Höhe schriftlich anmelden, Sicherheit zu leisten, soweit sie nicht Befriedigung verlangen können. Dieses Recht steht den Gläubigern jedoch nur zu, wenn sie glaubhaft machen, dass durch die Verschmelzung die Erfüllung ihrer Forderung gefährdet wird."
    },
    {
      "date": "2025-07-25",
      "id": "117656",
      "original_text": "Registerbekanntmachung nach dem Umwandlungsgesetz\nNordrhein-Westfalen Amtsgericht Köln HRB 120410\ntalentsconnect finance GmbH – Köln",
      "type": "Registerbekanntmachung nach dem Umwandlungsgesetz",
      "state": "Nordrhein-Westfalen",
      "amtsgericht": "Amtsgericht Köln",
      "registernummer": "HRB 120410",
      "registerart": "HRB",
      "company_name": "talentsconnect finance GmbH",
      "company_seat": "Köln",
      "details": "25.07.2025 (Bekanntmachungsdatum)\n\nNordrhein-Westfalen Amtsgericht Köln HRB 120410\nRegisterbekanntmachung nach dem Umwandlungsgesetz 25.07.2025 (Eintragungsdatum)\n\ntalentsconnect finance GmbH\nGesellschaft mit beschränkter Haftung\nKöln\n\nDen Gläubigern der an der Ausgliederung beteiligten Rechtsträger ist, wenn sie binnen sechs Monaten nach dem Tag, an dem die Eintragung der Ausgliederung in das Register des Sitzes desjenigen Rechtsträgers, dessen Gläubiger sie sind, nach § 19 Absatz 3 UmwG als bekanntgemacht gilt, ihren Anspruch nach Grund und Höhe schriftlich anmelden, Sicherheit zu leisten, soweit sie nicht Befriedigung verlangen können. Dieses Recht steht den Gläubigern jedoch nur zu, wenn sie glaubhaft machen, dass durch die Ausgliederung die Erfüllung ihrer Forderung gefährdet wird."
    },
    {
      "date": "2025-07-25",
      "id": "117657",
      "original_text": "Einreichung neuer Dokumente\nNordrhein-Westfalen Amtsgericht Iserlohn HRB 4783\nInsta GmbH – Lüdenscheid",
      "type": "Einreichung neuer Dokumente",
      "state": "Nordrhein-Westfalen",
      "amtsgericht": "Amtsgericht Iserlohn",
      "registernummer": "HRB 4783",
      "registerart": "HRB",
      "company_name": "Insta GmbH",
      "company_seat": "Lüdenscheid",
      "details": "25.07.2025 (Bekanntmachungsdatum)\n\nNordrhein-Westfalen Amtsgericht Iserlohn HRB 4783\nEinreichung neuer Dokumente\n\nInsta GmbH\nGesellschaft mit beschränkter Haftung\nLüdenscheid\n\nDem Registergericht ist eine geänderte Liste der Mitglieder des Aufsichtsrates eingereicht worden."
    },
    {
      "date": "2025-07-25",
      "id": "117658",
      "original_text": "Löschungsankündigung\nNordrhein-Westfalen Amtsgericht Arnsberg HRB 12581\nFerienpark Winterberg Niedersfeld GmbH – Winterberg",
      "type": "Löschungsankündigung",
      "state": "Nordrhein-Westfalen",
      "amtsgericht": "Amtsgericht Arnsberg",
      "registernummer": "HRB 12581",
      "registerart": "HRB",
      "company_name": "Ferienpark Winterberg Niedersfeld GmbH",
      "company_seat": "Winterberg",
      "details": "25.07.2025 (Bekanntmachungsdatum)\n\nNordrhein-Westfalen Amtsgericht Arnsberg HRB 12581\nLöschungsankündigung\n\nFerienpark Winterberg Niedersfeld GmbH\nGesellschaft mit beschränkter Haftung\nWinterberg\n\nDas Registergericht beabsichtigt, die im Handelsregister eingetragene Gesellschaft gemäß § 394 Absatz 1 FamFG wegen Vermögenslosigkeit von Amts wegen zu löschen. Gegen diese Verfügung kann Widerspruch eingelegt werden. Die Frist zur Erhebung eines Widerspruchs gegen die beabsichtigte Löschung von Amts wegen ist auf einen Monat festgesetzt.\n\nRechtsbehelfsbelehrung: Gegen diese Verfügung können Sie Widerspruch einlegen. Der Widerspruch ist bei dem Amtsgericht Arnsberg, Eichholzstraße 4, 59821 Arnsberg schriftlich in deutscher Sprache oder zur Niederschrift der Geschäftsstelle einzulegen. Der Widerspruch kann auch zur Niederschrift der Geschäftsstelle eines jeden Amtsgerichtes abgegeben werden. Die Einlegung ist auch durch Übertragung eines elektronischen Dokuments an die elektronische Poststelle des Gerichts möglich. Das elektronische Dokument muss für die Bearbeitung durch das Gericht geeignet und mit einer qualifizierten elektronischen Signatur der verantwortenden Person versehen sein oder von der verantwortenden Person signiert und auf einem sicheren Übermittlungsweg gemäß § 130a ZPO nach näherer Maßgabe der Verordnung über die technischen Rahmenbedingungen des elektronischen Rechtsverkehrs und über das besondere elektronische Behördenpostfach (BGBl. I, S.3803) eingereicht werden. Weitere Informationen erhalten Sie auf der Internetseite www.justiz.de.Der Widerspruch muss spätestens innerhalb der gesetzten Frist bei dem Amtsgericht Arnsberg eingegangen sein. Dies gilt auch dann, wenn der Widerspruch zur Niederschrift der Geschäftsstelle eines anderen Amtsgerichtes abgegeben wurde. Die Frist beginnt mit der Veröffentlichung. Fällt das Ende der Frist auf einen Sonntag, einen allgemeinen Feiertag oder Sonnabend, so endet die Frist mit Ablauf des nächsten Werktages. Der Widerspruch muss die Bezeichnung der angefochtenen Verfügung sowie die Erklärung enthalten, dass Widerspruch gegen diese Verfügung eingelegt wird. Er ist zu unterzeichnen und soll begründet werden."
    },
    {
      "date": "2025-07-25",
      "id": "117659",
      "original_text": "Löschungsankündigung\nNordrhein-Westfalen Amtsgericht Düsseldorf HRB 72497\nVita Schnitt Fruchtgrosshandel GmbH – Düsseldorf",
      "type": "Löschungsankündigung",
      "state": "Nordrhein-Westfalen",
      "amtsgericht": "Amtsgericht Düsseldorf",
      "registernummer": "HRB 72497",
      "registerart": "HRB",
      "company_name": "Vita Schnitt Fruchtgrosshandel GmbH",
      "company_seat": "Düsseldorf",
      "details": "25.07.2025 (Bekanntmachungsdatum)\n\nNordrhein-Westfalen Amtsgericht Düsseldorf HRB 72497\nLöschungsankündigung\n\nVita Schnitt Fruchtgrosshandel GmbH\nGesellschaft mit beschränkter Haftung\nDüsseldorf\n\nDas Registergericht beabsichtigt die Gesellschaft von Amts wegen nach § 394 FamFG zu löschen. Die Frist zur Erhebung eines Widerspruchs ist auf 3 Wochen festgesetzt.\n\nRechtsbehelfsbelehrung:\nDas Widerspruchsrecht steht jedem zu, der an der Unterlassung der Löschung ein berechtigtes Interesse hat. Der Widerspruch ist bei dem Amtsgericht Düsseldorf -Registergericht-, Werdener Straße 1, 40227 Düsseldorf schriftlich in deutscher Sprache oder zur Niederschrift der Geschäftsstelle einzulegen. Der Widerspruch kann auch zur Niederschrift der Geschäftsstelle eines jeden Amtsgerichtes abgegeben werden. Die Einlegung ist auch durch Übertragung eines elektronischen Dokuments an die elektronische Poststelle des Gerichts möglich. Das elektronische Dokument muss für die Bearbeitung durch das Gericht geeignet und mit einer qualifizierten elektronischen Signatur der verantwortenden Person versehen sein oder von der verantwortenden Person signiert und auf einem sicheren Übermittlungsweg gemäß § 130a ZPO nach näherer Maßgabe der Verordnung über die technischen Rahmenbedingungen des elektronischen Rechtsverkehrs und über das besondere elektronische Behördenpostfach (BGBl. I, S.3803) eingereicht werden. Weitere Informationen erhalten Sie auf der Internetseite www.justiz.de.\nDer Widerspruch muss spätestens innerhalb der gesetzten Frist nach dem Datum der Bekanntmachung der Löschungsankündigung bei dem Amtsgericht - Registergericht - Düsseldorf eingegangen sein.  Dies gilt auch dann, wenn der Widerspruch zur Niederschrift der Geschäftsstelle eines anderen Amtsgerichtes abgegeben wurde. Die Frist beginnt mit dem Tage der Bekanntmachung der Löschungsankündigung in dem für die Bekanntmachung der Eintragungen in das Handelsregister bestimmten elektronischen Informations- und Kommunikationssystem nach § 10 des Handelsgesetzbuches. Fällt das Ende der Frist auf einen Sonntag, einen allgemeinen Feiertag oder Sonnabend, so endet die Frist mit Ablauf des nächsten Werktages.\nDer Widerspruch muss die Bezeichnung der angefochtenen Löschungsankündigung sowie die Erklärung enthalten, dass Widerspruch gegen diese Löschungsankündigung eingelegt wird. Er ist zu unterzeichnen und soll begründet werden."
    },
    {
      "date": "2025-07-25",
      "id": "117660",
      "original_text": "Registerbekanntmachung nach dem Umwandlungsgesetz\nNordrhein-Westfalen Amtsgericht Bochum HRB 11906\nKairos GmbH – Bochum",
      "type": "Registerbekanntmachung nach dem Umwandlungsgesetz",
      "state": "Nordrhein-Westfalen",
      "amtsgericht": "Amtsgericht Bochum",
      "registernummer": "HRB 11906",
      "registerart": "HRB",
      "company_name": "Kairos GmbH",
      "company_seat": "Bochum",
      "details": "25.07.2025 (Bekanntmachungsdatum)\n\nNordrhein-Westfalen Amtsgericht Bochum HRB 11906\nRegisterbekanntmachung nach dem Umwandlungsgesetz 24.07.2025 (Eintragungsdatum)\n\nKairos GmbH\nGesellschaft mit beschränkter Haftung\nBochum\n\nDen Gläubigern der an der Verschmelzung beteiligten Rechtsträger ist, wenn sie binnen sechs Monaten nach dem Tag, an dem die Eintragung der Verschmelzung in das Register des Sitzes derjenigen Rechtsträger deren Gläubiger sie sind, nach § 19 Absatz 3 UmwG als bekanntgemacht gilt, ihren Anspruch nach Grund und Höhe schriftlich anmelden, Sicherheit zu leisten, soweit sie nicht Befriedigung verlangen können. Dieses Recht steht den Gläubigern jedoch nur zu, wenn sie glaubhaft machen, dass durch die Verschmelzung die Erfüllung ihrer Forderung gefährdet wird."
    },
    {
      "date": "2025-07-25",
      "id": "117661",
      "original_text": "Registerbekanntmachung nach dem Umwandlungsgesetz\nNordrhein-Westfalen Amtsgericht Dortmund HRB 30783\nDr. Ausbüttel Chancen GmbH – Dortmund",
      "type": "Registerbekanntmachung nach dem Umwandlungsgesetz",
      "state": "Nordrhein-Westfalen",
      "amtsgericht": "Amtsgericht Dortmund",
      "registernummer": "HRB 30783",
      "registerart": "HRB",
      "company_name": "Dr. Ausbüttel Chancen GmbH",
      "company_seat": "Dortmund",
      "details": "25.07.2025 (Bekanntmachungsdatum)\n\nNordrhein-Westfalen Amtsgericht Dortmund HRB 30783\nRegisterbekanntmachung nach dem Umwandlungsgesetz 17.07.2025 (Eintragungsdatum)\n\nDr. Ausbüttel Chancen GmbH\nGesellschaft mit beschränkter Haftung\nDortmund\n\nDie Gesellschaft hat Gläubigern, deren Forderungen vor dieser Bekanntmachung begründet worden sind, Sicherheit zu leisten, soweit sie nicht Befriedigung verlangen können, wenn sie sich binnen sechs Monaten zu diesem Zweck melden."
    },
    {
      "date": "2025-07-25",
      "id": "117662",
      "original_text": "Registerbekanntmachung nach dem Umwandlungsgesetz\nNordrhein-Westfalen Amtsgericht Düsseldorf HRB 104555\nMVZ Rheinlandärzte Düsseldorf GmbH – Düsseldorf",
      "type": "Registerbekanntmachung nach dem Umwandlungsgesetz",
      "state": "Nordrhein-Westfalen",
      "amtsgericht": "Amtsgericht Düsseldorf",
      "registernummer": "HRB 104555",
      "registerart": "HRB",
      "company_name": "MVZ Rheinlandärzte Düsseldorf GmbH",
      "company_seat": "Düsseldorf",
      "details": "25.07.2025 (Bekanntmachungsdatum)\n\nNordrhein-Westfalen Amtsgericht Düsseldorf HRB 104555\nRegisterbekanntmachung nach dem Umwandlungsgesetz 25.07.2025 (Eintragungsdatum)\n\nMVZ Rheinlandärzte Düsseldorf GmbH\nGesellschaft mit beschränkter Haftung\nDüsseldorf\n\nDen Gläubigern der an der Abspaltung beteiligten Rechtsträger ist, wenn sie binnen sechs Monaten nach dem Tag, an dem die Eintragung der Abspaltung in das Register des Sitzes desjenigen Rechtsträgers, dessen Gläubiger sie sind, nach § 19 Absatz 3 UmwG als bekanntgemacht gilt, ihren Anspruch nach Grund und Höhe schriftlich anmelden, Sicherheit zu leisten, soweit sie nicht Befriedigung verlangen können. Dieses Recht steht den Gläubigern jedoch nur zu, wenn sie glaubhaft machen, dass durch die Abspaltung die Erfüllung ihrer Forderung gefährdet wird."
    },
    {
      "date": "2025-07-25",
      "id": "117663",
      "original_text": "Registerbekanntmachung nach dem Umwandlungsgesetz\nNordrhein-Westfalen Amtsgericht Köln HRB 78264\ntalentsconnect AG – Köln",
      "type": "Registerbekanntmachung nach dem Umwandlungsgesetz",
      "state": "Nordrhein-Westfalen",
      "amtsgericht": "Amtsgericht Köln",
      "registernummer": "HRB 78264",
      "registerart": "HRB",
      "company_name": "talentsconnect AG",
      "company_seat": "Köln",
      "details": "25.07.2025 (Bekanntmachungsdatum)\n\nNordrhein-Westfalen Amtsgericht Köln HRB 78264\nRegisterbekanntmachung nach dem Umwandlungsgesetz 25.07.2025 (Eintragungsdatum)\n\ntalentsconnect AG\nAktiengesellschaft\nKöln\n\nDen Gläubigern der an der Ausgliederung beteiligten Rechtsträger ist, wenn sie binnen sechs Monaten nach dem Tag, an dem die Eintragung der Ausgliederung in das Register des Sitzes desjenigen Rechtsträgers, dessen Gläubiger sie sind, nach § 19 Absatz 3 UmwG als bekanntgemacht gilt, ihren Anspruch nach Grund und Höhe schriftlich anmelden, Sicherheit zu leisten, soweit sie nicht Befriedigung verlangen können. Dieses Recht steht den Gläubigern jedoch nur zu, wenn sie glaubhaft machen, dass durch die Ausgliederung die Erfüllung ihrer Forderung gefährdet wird."
    },
    {
      "date": "2025-07-25",
      "id": "117664",
      "original_text": "Registerbekanntmachung nach dem Umwandlungsgesetz\nNordrhein-Westfalen Amtsgericht Münster HRB 10910\nWAL GmbH – Warendorf",
      "type": "Registerbekanntmachung nach dem Umwandlungsgesetz",
      "state": "Nordrhein-Westfalen",
      "amtsgericht": "Amtsgericht Münster",
      "registernummer": "HRB 10910",
      "registerart": "HRB",
      "company_name": "WAL GmbH",
      "company_seat": "Warendorf",
      "details": "25.07.2025 (Bekanntmachungsdatum)\n\nNordrhein-Westfalen Amtsgericht Münster HRB 10910\nRegisterbekanntmachung nach dem Umwandlungsgesetz 25.07.2025 (Eintragungsdatum)\n\nWAL GmbH\nGesellschaft mit beschränkter Haftung\nWarendorf\n\nDen Gläubigern der an der Verschmelzung beteiligten Rechtsträger ist, wenn sie binnen sechs Monaten nach dem Tag, an dem die Eintragung der Verschmelzung in das Register des Sitzes desjenigen Rechtsträgers, dessen Gläubiger sie sind, nach § 19 Absatz 3 UmwG als bekanntgemacht gilt, ihren Anspruch nach Grund und Höhe schriftlich anmelden, Sicherheit zu leisten, soweit sie nicht Befriedigung verlangen können. Dieses Recht steht den Gläubigern jedoch nur zu, wenn sie glaubhaft machen, dass durch die Verschmelzung die Erfüllung ihrer Forderung gefährdet wird."
    },
    {
      "date": "2025-07-25",
      "id": "117665",
      "original_text": "Löschungsankündigung\nNordrhein-Westfalen Amtsgericht Düsseldorf HRB 95287\nRocco Food GmbH – Düsseldorf",
      "type": "Löschungsankündigung",
      "state": "Nordrhein-Westfalen",
      "amtsgericht": "Amtsgericht Düsseldorf",
      "registernummer": "HRB 95287",
      "registerart": "HRB",
      "company_name": "Rocco Food GmbH",
      "company_seat": "Düsseldorf",
      "details": "25.07.2025 (Bekanntmachungsdatum)\n\nNordrhein-Westfalen Amtsgericht Düsseldorf HRB 95287\nLöschungsankündigung\n\nRocco Food GmbH\nGesellschaft mit beschränkter Haftung\nDüsseldorf\n\nDas Registergericht beabsichtigt die Gesellschaft von Amts wegen nach § 394 FamFG zu löschen. Die Frist zur Erhebung eines Widerspruchs ist auf 3 Wochen festgesetzt.\n\nRechtsbehelfsbelehrung:\nDas Widerspruchsrecht steht jedem zu, der an der Unterlassung der Löschung ein berechtigtes Interesse hat. Der Widerspruch ist bei dem Amtsgericht Düsseldorf -Registergericht-, Werdener Straße 1, 40227 Düsseldorf schriftlich in deutscher Sprache oder zur Niederschrift der Geschäftsstelle einzulegen. Der Widerspruch kann auch zur Niederschrift der Geschäftsstelle eines jeden Amtsgerichtes abgegeben werden. Die Einlegung ist auch durch Übertragung eines elektronischen Dokuments an die elektronische Poststelle des Gerichts möglich. Das elektronische Dokument muss für die Bearbeitung durch das Gericht geeignet und mit einer qualifizierten elektronischen Signatur der verantwortenden Person versehen sein oder von der verantwortenden Person signiert und auf einem sicheren Übermittlungsweg gemäß § 130a ZPO nach näherer Maßgabe der Verordnung über die technischen Rahmenbedingungen des elektronischen Rechtsverkehrs und über das besondere elektronische Behördenpostfach (BGBl. I, S.3803) eingereicht werden. Weitere Informationen erhalten Sie auf der Internetseite www.justiz.de.\nDer Widerspruch muss spätestens innerhalb der gesetzten Frist nach dem Datum der Bekanntmachung der Löschungsankündigung bei dem Amtsgericht - Registergericht - Düsseldorf eingegangen sein.  Dies gilt auch dann, wenn der Widerspruch zur Niederschrift der Geschäftsstelle eines anderen Amtsgerichtes abgegeben wurde. Die Frist beginnt mit dem Tage der Bekanntmachung der Löschungsankündigung in dem für die Bekanntmachung der Eintragungen in das Handelsregister bestimmten elektronischen Informations- und Kommunikationssystem nach § 10 des Handelsgesetzbuches. Fällt das Ende der Frist auf einen Sonntag, einen allgemeinen Feiertag oder Sonnabend, so endet die Frist mit Ablauf des nächsten Werktages.\nDer Widerspruch muss die Bezeichnung der angefochtenen Löschungsankündigung sowie die Erklärung enthalten, dass Widerspruch gegen diese Löschungsankündigung eingelegt wird. Er ist zu unterzeichnen und soll begründet werden."
    },
    {
      "date": "2025-07-25",
      "id": "117666",
      "original_text": "Registerbekanntmachung nach dem Umwandlungsgesetz\nNordrhein-Westfalen Amtsgericht Bad Oeynhausen HRA 10507\nR. & S. Kanther Immobilien e. K. Inhaber: Ralf Kanther – Bünde",
      "type": "Registerbekanntmachung nach dem Umwandlungsgesetz",
      "state": "Nordrhein-Westfalen",
      "amtsgericht": "Amtsgericht Bad Oeynhausen",
      "registernummer": "HRA 10507",
      "registerart": "HRA",
      "company_name": "R. & S. Kanther Immobilien e. K. Inhaber: Ralf Kanther",
      "company_seat": "Bünde",
      "details": "25.07.2025 (Bekanntmachungsdatum)\n\nNordrhein-Westfalen Amtsgericht Bad Oeynhausen HRA 10507\nRegisterbekanntmachung nach dem Umwandlungsgesetz 25.07.2025 (Eintragungsdatum)\n\nR. & S. Kanther Immobilien e. K. Inhaber: Ralf Kanther\nEinzelkaufmann / Einzelkauffrau\nBünde\n\nDen Gläubigern der an der Ausgliederung beteiligten Rechtsträger ist, wenn sie binnen sechs Monaten nach dem Tag, an dem die Eintragung der Ausgliederung in das Register des Sitzes desjenigen Rechtsträgers, dessen Gläubiger sie sind, nach § 19 Absatz 3 UmwG als bekanntgemacht gilt, ihren Anspruch nach Grund und Höhe schriftlich anmelden, Sicherheit zu leisten, soweit sie nicht Befriedigung verlangen können. Dieses Recht steht den Gläubigern jedoch nur zu, wenn sie glaubhaft machen, dass durch die Ausgliederung die Erfüllung ihrer Forderung gefährdet wird."
    },
    {
      "date": "2025-07-25",
      "id": "117667",
      "original_text": "Registerbekanntmachung nach dem Umwandlungsgesetz\nHessen Amtsgericht Wiesbaden HRB 30420\nCommerz Real AG – Wiesbaden",
      "type": "Registerbekanntmachung nach dem Umwandlungsgesetz",
      "state": "Hessen",
      "amtsgericht": "Amtsgericht Wiesbaden",
      "registernummer": "HRB 30420",
      "registerart": "HRB",
      "company_name": "Commerz Real AG",
      "company_seat": "Wiesbaden",
      "details": "25.07.2025 (Bekanntmachungsdatum)\n\nHessen Amtsgericht Wiesbaden HRB 30420\nRegisterbekanntmachung nach dem Umwandlungsgesetz\n\nCommerz Real AG\nAktiengesellschaft\nWiesbaden\n\nDie Gesellschaft hat den Entwurf des Verschmelzungsvertrages zwischen ihr und der COMUNITHY Immobilien GmbH, Düsseldorf (Amtsgericht AG Düsseldorf HRB 54300) beim Amtsgericht Wiesbaden (Registergericht) zur Einsichtnahme eingereicht."
    },
    {
      "date": "2025-07-25",
      "id": "117668",
      "original_text": "Registerbekanntmachung nach dem Umwandlungsgesetz\nHessen Amtsgericht Frankfurt am Main HRB 103677\nMRH Trowe Credit & Finance GmbH – Frankfurt am Main",
      "type": "Registerbekanntmachung nach dem Umwandlungsgesetz",
      "state": "Hessen",
      "amtsgericht": "Amtsgericht Frankfurt am Main",
      "registernummer": "HRB 103677",
      "registerart": "HRB",
      "company_name": "MRH Trowe Credit & Finance GmbH",
      "company_seat": "Frankfurt am Main",
      "details": "25.07.2025 (Bekanntmachungsdatum)\n\nHessen Amtsgericht Frankfurt am Main HRB 103677\nRegisterbekanntmachung nach dem Umwandlungsgesetz 25.07.2025 (Eintragungsdatum)\n\nMRH Trowe Credit & Finance GmbH\nGesellschaft mit beschränkter Haftung\nFrankfurt am Main\n\nDen Gläubigern der an der Verschmelzung beteiligten Rechtsträger ist, wenn sie binnen sechs Monaten nach dem Tag, an dem die Eintragung der Verschmelzung in das Register des Sitzes desjenigen Rechtsträgers, dessen Gläubiger sie sind, nach § 19 Absatz 3 UmwG bekannt gemacht worden ist, ihren Anspruch nach Grund und Höhe schriftlich anmelden, Sicherheit zu leisten, soweit sie nicht Befriedigung verlangen können. Dieses Recht steht den Gläubigern jedoch nur zu, wenn sie glaubhaft machen, dass durch die Verschmelzung die Erfüllung ihrer Forderung gefährdet wird."
    },
    {
      "date": "2025-07-25",
      "id": "117669",
      "original_text": "Registerbekanntmachung nach dem Umwandlungsgesetz\nHessen Amtsgericht Darmstadt HRB 104596\nJONETAT Mittelstandsberatung GmbH – Darmstadt",
      "type": "Registerbekanntmachung nach dem Umwandlungsgesetz",
      "state": "Hessen",
      "amtsgericht": "Amtsgericht Darmstadt",
      "registernummer": "HRB 104596",
      "registerart": "HRB",
      "company_name": "JONETAT Mittelstandsberatung GmbH",
      "company_seat": "Darmstadt",
      "details": "25.07.2025 (Bekanntmachungsdatum)\n\nHessen Amtsgericht Darmstadt HRB 104596\nRegisterbekanntmachung nach dem Umwandlungsgesetz 25.07.2025 (Eintragungsdatum)\n\nJONETAT Mittelstandsberatung GmbH\nGesellschaft mit beschränkter Haftung\nDarmstadt\n\nDen Gläubigern der an der Verschmelzung beteiligten Rechtsträger ist, wenn sie binnen sechs Monaten nach dem Tag, an dem die Eintragung der Verschmelzung in das Register des Sitzes desjenigen Rechtsträgers, dessen Gläubiger sie sind, nach § 19 Absatz 3 UmwG bekannt gemacht worden ist, ihren Anspruch nach Grund und Höhe schriftlich anmelden, Sicherheit zu leisten, soweit sie nicht Befriedigung verlangen können. Dieses Recht steht den Gläubigern jedoch nur zu, wenn sie glaubhaft machen, dass durch die Verschmelzung die Erfüllung ihrer Forderung gefährdet wird."
    },
    {
      "date": "2025-07-25",
      "id": "117670",
      "original_text": "Registerbekanntmachung nach dem Umwandlungsgesetz\nHessen Amtsgericht Frankfurt am Main HRB 112717\nLPA Holding Germany GmbH – Frankfurt am Main",
      "type": "Registerbekanntmachung nach dem Umwandlungsgesetz",
      "state": "Hessen",
      "amtsgericht": "Amtsgericht Frankfurt am Main",
      "registernummer": "HRB 112717",
      "registerart": "HRB",
      "company_name": "LPA Holding Germany GmbH",
      "company_seat": "Frankfurt am Main",
      "details": "25.07.2025 (Bekanntmachungsdatum)\n\nHessen Amtsgericht Frankfurt am Main HRB 112717\nRegisterbekanntmachung nach dem Umwandlungsgesetz 25.07.2025 (Eintragungsdatum)\n\nLPA Holding Germany GmbH\nGesellschaft mit beschränkter Haftung\nFrankfurt am Main\n\nDen Gläubigern der an der Abspaltung beteiligten Rechtsträger ist, wenn sie binnen sechs Monaten nach dem Tag, an dem die Eintragung der Abspaltung in das Register des Sitzes desjenigen Rechtsträgers, dessen Gläubiger sie sind, nach §§ 125, 19 Absatz 3 UmwG bekannt gemacht worden ist, ihren Anspruch nach Grund und Höhe schriftlich anmelden, Sicherheit zu leisten, soweit sie nicht Befriedigung verlangen können. Dieses Recht steht den Gläubigern jedoch nur zu, wenn sie glaubhaft machen, dass durch die Abspaltung die Erfüllung ihrer Forderung gefährdet wird."
    },
    {
      "date": "2025-07-25",
      "id": "117671",
      "original_text": "Registerbekanntmachung nach dem Umwandlungsgesetz\nHessen Amtsgericht Darmstadt HRA 87828\nJONETAT Mittelstandsberatung e.K. – Darmstadt",
      "type": "Registerbekanntmachung nach dem Umwandlungsgesetz",
      "state": "Hessen",
      "amtsgericht": "Amtsgericht Darmstadt",
      "registernummer": "HRA 87828",
      "registerart": "HRA",
      "company_name": "JONETAT Mittelstandsberatung e.K.",
      "company_seat": "Darmstadt",
      "details": "25.07.2025 (Bekanntmachungsdatum)\n\nHessen Amtsgericht Darmstadt HRA 87828\nRegisterbekanntmachung nach dem Umwandlungsgesetz 25.07.2025 (Eintragungsdatum)\n\nJONETAT Mittelstandsberatung e.K.\nEinzelkaufmann / Einzelkauffrau\nDarmstadt\n\nDen Gläubigern der an der Verschmelzung beteiligten Rechtsträger ist, wenn sie binnen sechs Monaten nach dem Tag, an dem die Eintragung der Verschmelzung in das Register des Sitzes desjenigen Rechtsträgers, dessen Gläubiger sie sind, nach § 19 Absatz 3 UmwG bekannt gemacht worden ist, ihren Anspruch nach Grund und Höhe schriftlich anmelden, Sicherheit zu leisten, soweit sie nicht Befriedigung verlangen können. Dieses Recht steht den Gläubigern jedoch nur zu, wenn sie glaubhaft machen, dass durch die Verschmelzung die Erfüllung ihrer Forderung gefährdet wird."
    },
    {
      "date": "2025-07-25",
      "id": "117672",
      "original_text": "Einreichung neuer Dokumente\nHessen Amtsgericht Frankfurt am Main HRB 78119\nKuraray Europe GmbH – Hattersheim am Main",
      "type": "Einreichung neuer Dokumente",
      "state": "Hessen",
      "amtsgericht": "Amtsgericht Frankfurt am Main",
      "registernummer": "HRB 78119",
      "registerart": "HRB",
      "company_name": "Kuraray Europe GmbH",
      "company_seat": "Hattersheim am Main",
      "details": "25.07.2025 (Bekanntmachungsdatum)\n\nHessen Amtsgericht Frankfurt am Main HRB 78119\nEinreichung neuer Dokumente 25.07.2025 (Eintragungsdatum)\n\nKuraray Europe GmbH\nGesellschaft mit beschränkter Haftung\nHattersheim am Main\n\nDurch eine Änderung in den Personen der Aufsichtsratsmitglieder ist eine Liste der Mitglieder des Aufsichtsrates zum Handelsregister eingereicht worden."
    },
    {
      "date": "2025-07-25",
      "id": "117673",
      "original_text": "Sonstige Registerbekanntmachung\nHessen Amtsgericht Frankfurt am Main HRB 133102\nPavilius AG – Frankfurt am Main",
      "type": "Sonstige Registerbekanntmachung",
      "state": "Hessen",
      "amtsgericht": "Amtsgericht Frankfurt am Main",
      "registernummer": "HRB 133102",
      "registerart": "HRB",
      "company_name": "Pavilius AG",
      "company_seat": "Frankfurt am Main",
      "details": "25.07.2025 (Bekanntmachungsdatum)\n\nHessen Amtsgericht Frankfurt am Main HRB 133102\nSonstige Registerbekanntmachung 25.07.2025 (Eintragungsdatum)\n\nPavilius AG\nAktiengesellschaft\nFrankfurt am Main\n\nDurch eine Änderung in den Personen der Aufsichtsratsmitglieder ist eine Liste der Mitglieder des Aufsichtsrates zum Handelsregister eingereicht worden."
    },
    {
      "date": "2025-07-25",
      "id": "117674",
      "original_text": "Einreichung neuer Dokumente\nHessen Amtsgericht Darmstadt HRB 24758\nBRAIN Biotech AG – Zwingenberg",
      "type": "Einreichung neuer Dokumente",
      "state": "Hessen",
      "amtsgericht": "Amtsgericht Darmstadt",
      "registernummer": "HRB 24758",
      "registerart": "HRB",
      "company_name": "BRAIN Biotech AG",
      "company_seat": "Zwingenberg",
      "details": "25.07.2025 (Bekanntmachungsdatum)\n\nHessen Amtsgericht Darmstadt HRB 24758\nEinreichung neuer Dokumente 25.07.2025 (Eintragungsdatum)\n\nBRAIN Biotech AG\nAktiengesellschaft\nZwingenberg\n\nDurch eine Änderung in den Personen der Aufsichtsratsmitglieder ist eine Liste der Mitglieder des Aufsichtsrates zum Handelsregister eingereicht worden."
    },
    {
      "date": "2025-07-25",
      "id": "117675",
      "original_text": "Registerbekanntmachung nach dem Umwandlungsgesetz\nHessen Amtsgericht Darmstadt HRB 98410\nB&C Vermögensverwaltungsgesellschaft mbH – Darmstadt",
      "type": "Registerbekanntmachung nach dem Umwandlungsgesetz",
      "state": "Hessen",
      "amtsgericht": "Amtsgericht Darmstadt",
      "registernummer": "HRB 98410",
      "registerart": "HRB",
      "company_name": "B&C Vermögensverwaltungsgesellschaft mbH",
      "company_seat": "Darmstadt",
      "details": "25.07.2025 (Bekanntmachungsdatum)\n\nHessen Amtsgericht Darmstadt HRB 98410\nRegisterbekanntmachung nach dem Umwandlungsgesetz 25.07.2025 (Eintragungsdatum)\n\nB&C Vermögensverwaltungsgesellschaft mbH\nGesellschaft mit beschränkter Haftung\nDarmstadt\n\nDen Gläubigern der an der Verschmelzung beteiligten Rechtsträger ist, wenn sie binnen sechs Monaten nach dem Tag, an dem die Eintragung der Verschmelzung in das Register des Sitzes desjenigen Rechtsträgers, dessen Gläubiger sie sind, nach § 19 Absatz 3 UmwG bekannt gemacht worden ist, ihren Anspruch nach Grund und Höhe schriftlich anmelden, Sicherheit zu leisten, soweit sie nicht Befriedigung verlangen können. Dieses Recht steht den Gläubigern jedoch nur zu, wenn sie glaubhaft machen, dass durch die Verschmelzung die Erfüllung ihrer Forderung gefährdet wird."
    },
    {
      "date": "2025-07-25",
      "id": "117676",
      "original_text": "Löschungsankündigung\nHessen Amtsgericht Darmstadt HRB 97743\nLGS International GmbH – Kelsterbach",
      "type": "Löschungsankündigung",
      "state": "Hessen",
      "amtsgericht": "Amtsgericht Darmstadt",
      "registernummer": "HRB 97743",
      "registerart": "HRB",
      "company_name": "LGS International GmbH",
      "company_seat": "Kelsterbach",
      "details": "25.07.2025 (Bekanntmachungsdatum)\n\nHessen Amtsgericht Darmstadt HRB 97743\nLöschungsankündigung\n\nLGS International GmbH\nGesellschaft mit beschränkter Haftung\nKelsterbach\n\nDas Registergericht beabsichtigt die im Handelsregister eingetragene Gesellschaft von Amts wegen nach § 394 FamFG zu löschen. Die Frist zur Erhebung eines Widerspruchs gegen die beabsichtigte Löschung wird auf 3 Monate festgesetzt."
    },
    {
      "date": "2025-07-25",
      "id": "117677",
      "original_text": "Sonstige Registerbekanntmachung\nHessen Amtsgericht Wiesbaden VR 7170\nFörderverein Kita St. Jakobus e.V. – Rüdesheim am Rhein",
      "type": "Sonstige Registerbekanntmachung",
      "state": "Hessen",
      "amtsgericht": "Amtsgericht Wiesbaden",
      "registernummer": "VR 7170",
      "registerart": "VR",
      "company_name": "Förderverein Kita St. Jakobus e.V.",
      "company_seat": "Rüdesheim am Rhein",
      "details": "25.07.2025 (Bekanntmachungsdatum)\n\nHessen Amtsgericht Wiesbaden VR 7170\nSonstige Registerbekanntmachung 25.07.2025 (Eintragungsdatum)\n\nFörderverein Kita St. Jakobus e.V.\neingetragener Verein\nRüdesheim am Rhein\n\nDer Verein ist aufgelöst."
    },
    {
      "date": "2025-07-25",
      "id": "117678",
      "original_text": "Einreichung neuer Dokumente\nHessen Amtsgericht Frankfurt am Main HRB 129665\nAI Quality & Testing Hub GmbH – Frankfurt am Main",
      "type": "Einreichung neuer Dokumente",
      "state": "Hessen",
      "amtsgericht": "Amtsgericht Frankfurt am Main",
      "registernummer": "HRB 129665",
      "registerart": "HRB",
      "company_name": "AI Quality & Testing Hub GmbH",
      "company_seat": "Frankfurt am Main",
      "details": "25.07.2025 (Bekanntmachungsdatum)\n\nHessen Amtsgericht Frankfurt am Main HRB 129665\nEinreichung neuer Dokumente\n\nAI Quality & Testing Hub GmbH\nGesellschaft mit beschränkter Haftung\nFrankfurt am Main\n\nDurch eine Änderung in den Personen der Aufsichtsratsmitglieder ist eine Liste der Mitglieder des Aufsichtsrates zum Handelsregister eingereicht worden."
    },
    {
      "date": "2025-07-25",
      "id": "117679",
      "original_text": "Registerbekanntmachung nach dem Umwandlungsgesetz\nHessen Amtsgericht Frankfurt am Main HRB 136962\nMagpie Projects Holding GmbH – Frankfurt am Main",
      "type": "Registerbekanntmachung nach dem Umwandlungsgesetz",
      "state": "Hessen",
      "amtsgericht": "Amtsgericht Frankfurt am Main",
      "registernummer": "HRB 136962",
      "registerart": "HRB",
      "company_name": "Magpie Projects Holding GmbH",
      "company_seat": "Frankfurt am Main",
      "details": "25.07.2025 (Bekanntmachungsdatum)\n\nHessen Amtsgericht Frankfurt am Main HRB 136962\nRegisterbekanntmachung nach dem Umwandlungsgesetz 25.07.2025 (Eintragungsdatum)\n\nMagpie Projects Holding GmbH\nGesellschaft mit beschränkter Haftung\nFrankfurt am Main\n\nDen Gläubigern der an der Abspaltung beteiligten Rechtsträger ist, wenn sie binnen sechs Monaten nach dem Tag, an dem die Eintragung der Abspaltung in das Register des Sitzes desjenigen Rechtsträgers, dessen Gläubiger sie sind, nach §§ 125, 19 Absatz 3 UmwG bekannt gemacht worden ist, ihren Anspruch nach Grund und Höhe schriftlich anmelden, Sicherheit zu leisten, soweit sie nicht Befriedigung verlangen können. Dieses Recht steht den Gläubigern jedoch nur zu, wenn sie glaubhaft machen, dass durch die Abspaltung die Erfüllung ihrer Forderung gefährdet wird."
    }
  ]
}