{
  "date": "2025-07-30",
  "date_of_scrape": "2025-08-26T16:41:44.510Z",
  "tool_version": "0.2.0",
  "number_of_announcements": 278,
  "announcements": [
    {
      "date": "2025-07-30",
      "id": "118145",
      "original_text": "Registerbekanntmachung nach dem Umwandlungsgesetz\nBayern Amtsgericht München HRB 167410\nApollo Trend Edition GmbH – Markt Schwaben",
      "type": "Registerbekanntmachung nach dem Umwandlungsgesetz",
      "state": "Bayern",
      "amtsgericht": "Amtsgericht München",
      "registernummer": "HRB 167410",
      "registerart": "HRB",
      "company_name": "Apollo Trend Edition GmbH",
      "company_seat": "Markt Schwaben",
      "details": "30.07.2025 (Bekanntmachungsdatum)\n\nBayern Amtsgericht München HRB 167410\nRegisterbekanntmachung nach dem Umwandlungsgesetz 29.07.2025 (Eintragungsdatum)\n\nApollo Trend Edition GmbH\nGesellschaft mit beschränkter Haftung\nMarkt Schwaben\n\nDen Gläubigern der an der Verschmelzung beteiligten Rechtsträger ist, wenn sie binnen sechs Monaten nach dem Tag, an dem die Eintragung der Verschmelzung in das Register des Sitzes desjenigen Rechtsträgers, dessen Gläubiger sie sind, nach § 19 Abs. 3 UmwG als bekannt gemacht gilt, ihren Anspruch nach Grund und Höhe schriftlich anmelden, Sicherheit zu leisten, soweit sie nicht Befriedigung verlangen können. Dieses Recht steht den Gläubigern jedoch nur zu, wenn sie glaubhaft machen, dass durch die Verschmelzung die Erfüllung ihrer Forderung gefährdet wird."
    },
    {
      "date": "2025-07-30",
      "id": "118146",
      "original_text": "Registerbekanntmachung nach dem Umwandlungsgesetz\nBayern Amtsgericht München HRB 199201\nADJUVA Treuhand GmbH Wirtschaftsprüfungsgesellschaft Steuerberatungsgesellschaft – München",
      "type": "Registerbekanntmachung nach dem Umwandlungsgesetz",
      "state": "Bayern",
      "amtsgericht": "Amtsgericht München",
      "registernummer": "HRB 199201",
      "registerart": "HRB",
      "company_name": "ADJUVA Treuhand GmbH Wirtschaftsprüfungsgesellschaft Steuerberatungsgesellschaft",
      "company_seat": "München",
      "details": "30.07.2025 (Bekanntmachungsdatum)\n\nBayern Amtsgericht München HRB 199201\nRegisterbekanntmachung nach dem Umwandlungsgesetz 29.07.2025 (Eintragungsdatum)\n\nADJUVA Treuhand GmbH Wirtschaftsprüfungsgesellschaft Steuerberatungsgesellschaft\nGesellschaft mit beschränkter Haftung\nMünchen\n\nDen Gläubigern des formwechselnden Rechtsträgers ist, wenn sie binnen sechs Monaten nach dem Tag, an dem die Eintragung des Formwechsels nach § 201 UmwG als bekannt gemacht gilt, ihren Anspruch nach Grund und Höhe in Textform anmelden, Sicherheit zu leisten, soweit sie nicht Befriedigung verlangen können. Dieses Recht steht den Gläubigern jedoch nur zu, wenn sie glaubhaft machen, dass durch den Formwechsel die Erfüllung ihrer Forderung gefährdet wird."
    },
    {
      "date": "2025-07-30",
      "id": "118147",
      "original_text": "Registerbekanntmachung nach dem Umwandlungsgesetz\nBayern Amtsgericht Nürnberg HRB 41135\nCONTIS GmbH – Nürnberg",
      "type": "Registerbekanntmachung nach dem Umwandlungsgesetz",
      "state": "Bayern",
      "amtsgericht": "Amtsgericht Nürnberg",
      "registernummer": "HRB 41135",
      "registerart": "HRB",
      "company_name": "CONTIS GmbH",
      "company_seat": "Nürnberg",
      "details": "30.07.2025 (Bekanntmachungsdatum)\n\nBayern Amtsgericht Nürnberg HRB 41135\nRegisterbekanntmachung nach dem Umwandlungsgesetz 29.07.2025 (Eintragungsdatum)\n\nCONTIS GmbH\nGesellschaft mit beschränkter Haftung\nNürnberg\n\nDen Gläubigern der an der Verschmelzung beteiligten Rechtsträger ist, wenn sie binnen sechs Monaten nach dem Tag, an dem die Eintragung der Verschmelzung in das Register des Sitzes desjenigen Rechtsträgers, dessen Gläubiger sie sind, nach § 19 Abs. 3 UmwG als bekannt gemacht gilt, ihren Anspruch nach Grund und Höhe in Textform anmelden, Sicherheit zu leisten, soweit sie nicht Befriedigung verlangen können. Dieses Recht steht den Gläubigern jedoch nur zu, wenn sie glaubhaft machen, dass durch die Verschmelzung die Erfüllung ihrer Forderung gefährdet wird."
    },
    {
      "date": "2025-07-30",
      "id": "118148",
      "original_text": "Registerbekanntmachung nach dem Umwandlungsgesetz\nBayern Amtsgericht München HRB 140149\nmsg systems AG – Ismaning",
      "type": "Registerbekanntmachung nach dem Umwandlungsgesetz",
      "state": "Bayern",
      "amtsgericht": "Amtsgericht München",
      "registernummer": "HRB 140149",
      "registerart": "HRB",
      "company_name": "msg systems AG",
      "company_seat": "Ismaning",
      "details": "30.07.2025 (Bekanntmachungsdatum)\n\nBayern Amtsgericht München HRB 140149\nRegisterbekanntmachung nach dem Umwandlungsgesetz 29.07.2025 (Eintragungsdatum)\n\nmsg systems AG\nAktiengesellschaft\nIsmaning\n\nDen Gläubigern der an der Verschmelzung beteiligten Rechtsträger ist, wenn sie binnen sechs Monaten nach dem Tag, an dem die Eintragung der Verschmelzung in das Register des Sitzes desjenigen Rechtsträgers, dessen Gläubiger sie sind, nach § 19 Abs. 3 UmwG als bekannt gemacht gilt, ihren Anspruch nach Grund und Höhe in Textform anmelden, Sicherheit zu leisten, soweit sie nicht Befriedigung verlangen können. Dieses Recht steht den Gläubigern jedoch nur zu, wenn sie glaubhaft machen, dass durch die Verschmelzung die Erfüllung ihrer Forderung gefährdet wird."
    },
    {
      "date": "2025-07-30",
      "id": "118149",
      "original_text": "Registerbekanntmachung nach dem Umwandlungsgesetz\nBayern Amtsgericht Augsburg HRB 36328\nAS Drone Services Verwaltungs GmbH – Gersthofen",
      "type": "Registerbekanntmachung nach dem Umwandlungsgesetz",
      "state": "Bayern",
      "amtsgericht": "Amtsgericht Augsburg",
      "registernummer": "HRB 36328",
      "registerart": "HRB",
      "company_name": "AS Drone Services Verwaltungs GmbH",
      "company_seat": "Gersthofen",
      "details": "30.07.2025 (Bekanntmachungsdatum)\n\nBayern Amtsgericht Augsburg HRB 36328\nRegisterbekanntmachung nach dem Umwandlungsgesetz 29.07.2025 (Eintragungsdatum)\n\nAS Drone Services Verwaltungs GmbH\nGesellschaft mit beschränkter Haftung\nGersthofen\n\nDen Gläubigern der an der Verschmelzung beteiligten Rechtsträger ist, wenn sie binnen sechs Monaten nach dem Tag, an dem die Eintragung der Verschmelzung in das Register des Sitzes desjenigen Rechtsträgers, dessen Gläubiger sie sind, nach § 19 Abs. 3 UmwG als bekannt gemacht gilt, ihren Anspruch nach Grund und Höhe in Textform anmelden, Sicherheit zu leisten, soweit sie nicht Befriedigung verlangen können. Dieses Recht steht den Gläubigern jedoch nur zu, wenn sie glaubhaft machen, dass durch die Verschmelzung die Erfüllung ihrer Forderung gefährdet wird."
    },
    {
      "date": "2025-07-30",
      "id": "118150",
      "original_text": "Registerbekanntmachung nach dem Umwandlungsgesetz\nBayern Amtsgericht Augsburg HRA 19156\nGartengestaltung Wetzstein GmbH & Co. KG – Nordendorf",
      "type": "Registerbekanntmachung nach dem Umwandlungsgesetz",
      "state": "Bayern",
      "amtsgericht": "Amtsgericht Augsburg",
      "registernummer": "HRA 19156",
      "registerart": "HRA",
      "company_name": "Gartengestaltung Wetzstein GmbH & Co. KG",
      "company_seat": "Nordendorf",
      "details": "30.07.2025 (Bekanntmachungsdatum)\n\nBayern Amtsgericht Augsburg HRA 19156\nRegisterbekanntmachung nach dem Umwandlungsgesetz 29.07.2025 (Eintragungsdatum)\n\nGartengestaltung Wetzstein GmbH & Co. KG\nKommanditgesellschaft\nNordendorf\n\nDen Gläubigern der an der Verschmelzung beteiligten Rechtsträger ist, wenn sie binnen sechs Monaten nach dem Tag, an dem die Eintragung der Verschmelzung in das Register des Sitzes desjenigen Rechtsträgers, dessen Gläubiger sie sind, nach § 19 Abs. 3 UmwG als bekannt gemacht gilt, ihren Anspruch nach Grund und Höhe in Textform anmelden, Sicherheit zu leisten, soweit sie nicht Befriedigung verlangen können. Dieses Recht steht den Gläubigern jedoch nur zu, wenn sie glaubhaft machen, dass durch die Verschmelzung die Erfüllung ihrer Forderung gefährdet wird."
    },
    {
      "date": "2025-07-30",
      "id": "118151",
      "original_text": "Registerbekanntmachung nach dem Umwandlungsgesetz\nBayern Amtsgericht Regensburg HRB 9119\nBayernwerk AG – Regensburg",
      "type": "Registerbekanntmachung nach dem Umwandlungsgesetz",
      "state": "Bayern",
      "amtsgericht": "Amtsgericht Regensburg",
      "registernummer": "HRB 9119",
      "registerart": "HRB",
      "company_name": "Bayernwerk AG",
      "company_seat": "Regensburg",
      "details": "30.07.2025 (Bekanntmachungsdatum)\n\nBayern Amtsgericht Regensburg HRB 9119\nRegisterbekanntmachung nach dem Umwandlungsgesetz 29.07.2025 (Eintragungsdatum)\n\nBayernwerk AG\nAktiengesellschaft\nRegensburg\n\nDen Gläubigern der an der Verschmelzung beteiligten Rechtsträger ist, wenn sie binnen sechs Monaten nach dem Tag, an dem die Eintragung der Verschmelzung in das Register des Sitzes desjenigen Rechtsträgers, dessen Gläubiger sie sind, nach § 19 Abs. 3 UmwG als bekannt gemacht gilt, ihren Anspruch nach Grund und Höhe in Textform anmelden, Sicherheit zu leisten, soweit sie nicht Befriedigung verlangen können. Dieses Recht steht den Gläubigern jedoch nur zu, wenn sie glaubhaft machen, dass durch die Verschmelzung die Erfüllung ihrer Forderung gefährdet wird."
    },
    {
      "date": "2025-07-30",
      "id": "118152",
      "original_text": "Registerbekanntmachung nach dem Umwandlungsgesetz\nBayern Amtsgericht München HRB 225124\nIBP Verwaltungs GmbH – München",
      "type": "Registerbekanntmachung nach dem Umwandlungsgesetz",
      "state": "Bayern",
      "amtsgericht": "Amtsgericht München",
      "registernummer": "HRB 225124",
      "registerart": "HRB",
      "company_name": "IBP Verwaltungs GmbH",
      "company_seat": "München",
      "details": "30.07.2025 (Bekanntmachungsdatum)\n\nBayern Amtsgericht München HRB 225124\nRegisterbekanntmachung nach dem Umwandlungsgesetz 29.07.2025 (Eintragungsdatum)\n\nIBP Verwaltungs GmbH\nGesellschaft mit beschränkter Haftung\nMünchen\n\nDen Gläubigern der an der Verschmelzung beteiligten Rechtsträger ist, wenn sie binnen sechs Monaten nach dem Tag, an dem die Eintragung der Verschmelzung in das Register des Sitzes desjenigen Rechtsträgers, dessen Gläubiger sie sind, nach § 19 Abs. 3 UmwG als bekannt gemacht gilt, ihren Anspruch nach Grund und Höhe in Textform anmelden, Sicherheit zu leisten, soweit sie nicht Befriedigung verlangen können. Dieses Recht steht den Gläubigern jedoch nur zu, wenn sie glaubhaft machen, dass durch die Verschmelzung die Erfüllung ihrer Forderung gefährdet wird."
    },
    {
      "date": "2025-07-30",
      "id": "118153",
      "original_text": "Registerbekanntmachung nach dem Umwandlungsgesetz\nBayern Amtsgericht München PR 2552\nADJUVA Treuhand Steuerberatungsgesellschaft PartG mbB – München",
      "type": "Registerbekanntmachung nach dem Umwandlungsgesetz",
      "state": "Bayern",
      "amtsgericht": "Amtsgericht München",
      "registernummer": "PR 2552",
      "registerart": "PR",
      "company_name": "ADJUVA Treuhand Steuerberatungsgesellschaft PartG mbB",
      "company_seat": "München",
      "details": "30.07.2025 (Bekanntmachungsdatum)\n\nBayern Amtsgericht München PR 2552\nRegisterbekanntmachung nach dem Umwandlungsgesetz 29.07.2025 (Eintragungsdatum)\n\nADJUVA Treuhand Steuerberatungsgesellschaft PartG mbB\nPartnerschaftsgesellschaft\nMünchen\n\nZum Formwechsel der ADJUVA Treuhand GmbH Wirtschaftsprüfungsgesellschaft Steuerberatungsgesellschaft mit dem Sitz in München (Amtsgericht München, HRB 199201), in die ADJUVA Treuhand Steuerberatungsgesellschaft PartG mbB mit Sitz in München (Amtsgericht München PR 2552): Den Gläubigern des formwechselnden Rechtsträgers ist, wenn sie binnen sechs Monaten nach dem Tag, an dem die Eintragung des Formwechsels nach § 201 UmwG als bekannt gemacht gilt, ihren Anspruch nach Grund und Höhe in Textform anmelden, Sicherheit zu leisten, soweit sie nicht Befriedigung verlangen können. Dieses Recht steht den Gläubigern jedoch nur zu, wenn sie glaubhaft machen, dass durch den Formwechsel die Erfüllung ihrer Forderung gefährdet wird."
    },
    {
      "date": "2025-07-30",
      "id": "118154",
      "original_text": "Löschungsankündigung\nBayern Amtsgericht Nürnberg HRB 6507\nDS Abwicklungsgesellschaft mbH – Heideck",
      "type": "Löschungsankündigung",
      "state": "Bayern",
      "amtsgericht": "Amtsgericht Nürnberg",
      "registernummer": "HRB 6507",
      "registerart": "HRB",
      "company_name": "DS Abwicklungsgesellschaft mbH",
      "company_seat": "Heideck",
      "details": "30.07.2025 (Bekanntmachungsdatum)\n\nBayern Amtsgericht Nürnberg HRB 6507\nLöschungsankündigung\n\nDS Abwicklungsgesellschaft mbH\nGesellschaft mit beschränkter Haftung\nHeideck\n\nDas Registergericht beabsichtigt, die im Handelsregister eingetragene Gesellschaft wegen Vermögenslosigkeit von Amts wegen nach § 394 FamFG zu löschen. Die Frist zur Erhebung eines Widerspruchs ist auf einen Monat festgesetzt."
    },
    {
      "date": "2025-07-30",
      "id": "118155",
      "original_text": "Registerbekanntmachung nach dem Umwandlungsgesetz\nBayern Amtsgericht München HRB 290988\nVINC HEALTHCARE GmbH – München",
      "type": "Registerbekanntmachung nach dem Umwandlungsgesetz",
      "state": "Bayern",
      "amtsgericht": "Amtsgericht München",
      "registernummer": "HRB 290988",
      "registerart": "HRB",
      "company_name": "VINC HEALTHCARE GmbH",
      "company_seat": "München",
      "details": "30.07.2025 (Bekanntmachungsdatum)\n\nBayern Amtsgericht München HRB 290988\nRegisterbekanntmachung nach dem Umwandlungsgesetz 29.07.2025 (Eintragungsdatum)\n\nVINC HEALTHCARE GmbH\nGesellschaft mit beschränkter Haftung\nMünchen\n\nDen Gläubigern der an der Verschmelzung beteiligten Rechtsträger ist, wenn sie binnen sechs Monaten nach dem Tag, an dem die Eintragung der Verschmelzung in das Register des Sitzes desjenigen Rechtsträgers, dessen Gläubiger sie sind, nach § 19 Abs. 3 UmwG als bekannt gemacht gilt, ihren Anspruch nach Grund und Höhe in Textform anmelden, Sicherheit zu leisten, soweit sie nicht Befriedigung verlangen können. Dieses Recht steht den Gläubigern jedoch nur zu, wenn sie glaubhaft machen, dass durch die Verschmelzung die Erfüllung ihrer Forderung gefährdet wird."
    },
    {
      "date": "2025-07-30",
      "id": "118156",
      "original_text": "Löschungsankündigung\nBayern Amtsgericht Nürnberg HRB 38256\nSchmidt & Kunze GmbH – Nürnberg",
      "type": "Löschungsankündigung",
      "state": "Bayern",
      "amtsgericht": "Amtsgericht Nürnberg",
      "registernummer": "HRB 38256",
      "registerart": "HRB",
      "company_name": "Schmidt & Kunze GmbH",
      "company_seat": "Nürnberg",
      "details": "30.07.2025 (Bekanntmachungsdatum)\n\nBayern Amtsgericht Nürnberg HRB 38256\nLöschungsankündigung\n\nSchmidt & Kunze GmbH\nGesellschaft mit beschränkter Haftung\nNürnberg\n\nDas Registergericht beabsichtigt, den im Handelsregister eingetragenen Geschäftsführer wegen fehlender Eignung nach § 395 FamFG zu löschen. Die Frist zur Erhebung eines Widerspruchs ist auf sechs Wochen festgesetzt."
    },
    {
      "date": "2025-07-30",
      "id": "118157",
      "original_text": "Löschungsankündigung\nBayern Amtsgericht Nürnberg HRB 33509\nPLZ Ideenwerkstatt UG (haftungsbeschränkt) – Nürnberg",
      "type": "Löschungsankündigung",
      "state": "Bayern",
      "amtsgericht": "Amtsgericht Nürnberg",
      "registernummer": "HRB 33509",
      "registerart": "HRB",
      "company_name": "PLZ Ideenwerkstatt UG (haftungsbeschränkt)",
      "company_seat": "Nürnberg",
      "details": "30.07.2025 (Bekanntmachungsdatum)\n\nBayern Amtsgericht Nürnberg HRB 33509\nLöschungsankündigung\n\nPLZ Ideenwerkstatt UG (haftungsbeschränkt)\nGesellschaft mit beschränkter Haftung\nNürnberg\n\nDas Registergericht beabsichtigt, die im Handelsregister eingetragene Gesellschaft wegen Vermögenslosigkeit von Amts wegen nach § 394 FamFG zu löschen. Die Frist zur Erhebung eines Widerspruchs ist auf einen Monat festgesetzt."
    },
    {
      "date": "2025-07-30",
      "id": "118158",
      "original_text": "Registerbekanntmachung nach dem Umwandlungsgesetz\nBayern Amtsgericht Nürnberg HRB 44788\nOCL Beteiligungs GmbH – Schwabach",
      "type": "Registerbekanntmachung nach dem Umwandlungsgesetz",
      "state": "Bayern",
      "amtsgericht": "Amtsgericht Nürnberg",
      "registernummer": "HRB 44788",
      "registerart": "HRB",
      "company_name": "OCL Beteiligungs GmbH",
      "company_seat": "Schwabach",
      "details": "30.07.2025 (Bekanntmachungsdatum)\n\nBayern Amtsgericht Nürnberg HRB 44788\nRegisterbekanntmachung nach dem Umwandlungsgesetz 29.07.2025 (Eintragungsdatum)\n\nOCL Beteiligungs GmbH\nGesellschaft mit beschränkter Haftung\nSchwabach\n\nDen Gläubigern der an der Spaltung beteiligten Rechtsträger ist, wenn sie binnen sechs Monaten nach dem Tag, an dem die Eintragung der Spaltung in das Register des Sitzes desjenigen Rechtsträgers, dessen Gläubiger sie sind, nach §§ 125, 19 Abs. 3 UmwG als bekannt gemacht gilt, ihren Anspruch nach Grund und Höhe in Textform anmelden, Sicherheit zu leisten, soweit sie nicht Befriedigung verlangen können. Dieses Recht steht den Gläubigern jedoch nur zu, wenn sie glaubhaft machen, dass durch die Spaltung die Erfüllung ihrer Forderung gefährdet wird."
    },
    {
      "date": "2025-07-30",
      "id": "118159",
      "original_text": "Registerbekanntmachung nach dem Umwandlungsgesetz\nBayern Amtsgericht München HRB 266875\nSelenite Consulting UG (haftungsbeschränkt) – Grünwald",
      "type": "Registerbekanntmachung nach dem Umwandlungsgesetz",
      "state": "Bayern",
      "amtsgericht": "Amtsgericht München",
      "registernummer": "HRB 266875",
      "registerart": "HRB",
      "company_name": "Selenite Consulting UG (haftungsbeschränkt)",
      "company_seat": "Grünwald",
      "details": "30.07.2025 (Bekanntmachungsdatum)\n\nBayern Amtsgericht München HRB 266875\nRegisterbekanntmachung nach dem Umwandlungsgesetz 29.07.2025 (Eintragungsdatum)\n\nSelenite Consulting UG (haftungsbeschränkt)\nGesellschaft mit beschränkter Haftung\nGrünwald\n\nDen Gläubigern der an der Verschmelzung beteiligten Rechtsträger ist, wenn sie binnen sechs Monaten nach dem Tag, an dem die Eintragung der Verschmelzung in das Register des Sitzes desjenigen Rechtsträgers, dessen Gläubiger sie sind, nach § 19 Abs. 3 UmwG als bekannt gemacht gilt, ihren Anspruch nach Grund und Höhe in Textform anmelden, Sicherheit zu leisten, soweit sie nicht Befriedigung verlangen können. Dieses Recht steht den Gläubigern jedoch nur zu, wenn sie glaubhaft machen, dass durch die Verschmelzung die Erfüllung ihrer Forderung gefährdet wird."
    },
    {
      "date": "2025-07-30",
      "id": "118160",
      "original_text": "Registerbekanntmachung nach dem Umwandlungsgesetz\nBayern Amtsgericht München HRB 201252\nBaade Vermögens GmbH – Ottobrunn",
      "type": "Registerbekanntmachung nach dem Umwandlungsgesetz",
      "state": "Bayern",
      "amtsgericht": "Amtsgericht München",
      "registernummer": "HRB 201252",
      "registerart": "HRB",
      "company_name": "Baade Vermögens GmbH",
      "company_seat": "Ottobrunn",
      "details": "30.07.2025 (Bekanntmachungsdatum)\n\nBayern Amtsgericht München HRB 201252\nRegisterbekanntmachung nach dem Umwandlungsgesetz 29.07.2025 (Eintragungsdatum)\n\nBaade Vermögens GmbH\nGesellschaft mit beschränkter Haftung\nOttobrunn\n\nDen Gläubigern der an der Verschmelzung beteiligten Rechtsträger ist, wenn sie binnen sechs Monaten nach dem Tag, an dem die Eintragung der Verschmelzung in das Register des Sitzes desjenigen Rechtsträgers, dessen Gläubiger sie sind, nach § 19 Abs. 3 UmwG als bekannt gemacht gilt, ihren Anspruch nach Grund und Höhe in Textform anmelden, Sicherheit zu leisten, soweit sie nicht Befriedigung verlangen können. Dieses Recht steht den Gläubigern jedoch nur zu, wenn sie glaubhaft machen, dass durch die Verschmelzung die Erfüllung ihrer Forderung gefährdet wird."
    },
    {
      "date": "2025-07-30",
      "id": "118161",
      "original_text": "Registerbekanntmachung nach dem Umwandlungsgesetz\nBayern Amtsgericht Nürnberg HRB 4572\nEUGEN HERRMANN GMBH – Schwabach",
      "type": "Registerbekanntmachung nach dem Umwandlungsgesetz",
      "state": "Bayern",
      "amtsgericht": "Amtsgericht Nürnberg",
      "registernummer": "HRB 4572",
      "registerart": "HRB",
      "company_name": "EUGEN HERRMANN GMBH",
      "company_seat": "Schwabach",
      "details": "30.07.2025 (Bekanntmachungsdatum)\n\nBayern Amtsgericht Nürnberg HRB 4572\nRegisterbekanntmachung nach dem Umwandlungsgesetz 29.07.2025 (Eintragungsdatum)\n\nEUGEN HERRMANN GMBH\nGesellschaft mit beschränkter Haftung\nSchwabach\n\nDen Gläubigern der an der Verschmelzung beteiligten Rechtsträger ist, wenn sie binnen sechs Monaten nach dem Tag, an dem die Eintragung der Verschmelzung in das Register des Sitzes desjenigen Rechtsträgers, dessen Gläubiger sie sind, nach § 19 Abs. 3 UmwG als bekannt gemacht gilt, ihren Anspruch nach Grund und Höhe in Textform anmelden, Sicherheit zu leisten, soweit sie nicht Befriedigung verlangen können. Dieses Recht steht den Gläubigern jedoch nur zu, wenn sie glaubhaft machen, dass durch die Verschmelzung die Erfüllung ihrer Forderung gefährdet wird."
    },
    {
      "date": "2025-07-30",
      "id": "118162",
      "original_text": "Registerbekanntmachung nach dem Umwandlungsgesetz\nBayern Amtsgericht München HRB 274186\nATP Zero GmbH – München",
      "type": "Registerbekanntmachung nach dem Umwandlungsgesetz",
      "state": "Bayern",
      "amtsgericht": "Amtsgericht München",
      "registernummer": "HRB 274186",
      "registerart": "HRB",
      "company_name": "ATP Zero GmbH",
      "company_seat": "München",
      "details": "30.07.2025 (Bekanntmachungsdatum)\n\nBayern Amtsgericht München HRB 274186\nRegisterbekanntmachung nach dem Umwandlungsgesetz 29.07.2025 (Eintragungsdatum)\n\nATP Zero GmbH\nGesellschaft mit beschränkter Haftung\nMünchen\n\nDen Gläubigern der an der Verschmelzung beteiligten Rechtsträger ist, wenn sie binnen sechs Monaten nach dem Tag, an dem die Eintragung der Verschmelzung in das Register des Sitzes desjenigen Rechtsträgers, dessen Gläubiger sie sind, nach § 19 Abs. 3 UmwG als bekannt gemacht gilt, ihren Anspruch nach Grund und Höhe in Textform anmelden, Sicherheit zu leisten, soweit sie nicht Befriedigung verlangen können. Dieses Recht steht den Gläubigern jedoch nur zu, wenn sie glaubhaft machen, dass durch die Verschmelzung die Erfüllung ihrer Forderung gefährdet wird."
    },
    {
      "date": "2025-07-30",
      "id": "118163",
      "original_text": "Einreichung neuer Dokumente\nBayern Amtsgericht Traunstein HRB 19160\nKliniken der Stadt und des Landkreises Rosenheim GmbH – Rosenheim",
      "type": "Einreichung neuer Dokumente",
      "state": "Bayern",
      "amtsgericht": "Amtsgericht Traunstein",
      "registernummer": "HRB 19160",
      "registerart": "HRB",
      "company_name": "Kliniken der Stadt und des Landkreises Rosenheim GmbH",
      "company_seat": "Rosenheim",
      "details": "30.07.2025 (Bekanntmachungsdatum)\n\nBayern Amtsgericht Traunstein HRB 19160\nEinreichung neuer Dokumente\n\nKliniken der Stadt und des Landkreises Rosenheim GmbH\nGesellschaft mit beschränkter Haftung\nRosenheim\n\nDem Amtsgericht Traunstein -Registergericht- ist eine Liste der Mitglieder des Aufsichtsrats eingereicht worden, § 52 Abs. 3 S. 2 GmbHG."
    },
    {
      "date": "2025-07-30",
      "id": "118164",
      "original_text": "Einreichung neuer Dokumente\nBayern Amtsgericht Aschaffenburg HRB 15646\nSAF-HOLLAND SE – Bessenbach",
      "type": "Einreichung neuer Dokumente",
      "state": "Bayern",
      "amtsgericht": "Amtsgericht Aschaffenburg",
      "registernummer": "HRB 15646",
      "registerart": "HRB",
      "company_name": "SAF-HOLLAND SE",
      "company_seat": "Bessenbach",
      "details": "30.07.2025 (Bekanntmachungsdatum)\n\nBayern Amtsgericht Aschaffenburg HRB 15646\nEinreichung neuer Dokumente 29.07.2025 (Eintragungsdatum)\n\nSAF-HOLLAND SE\nEuropäische Aktiengesellschaft (SE)\nBessenbach\n\nDem Amtsgericht Aschaffenburg -Registergericht- ist eine Liste der Mitglieder des Aufsichtsrats eingereicht worden, Art. 9 Abs. 1 Buchst. c (ii) SE-VO i.V.m. § 106 AktG."
    },
    {
      "date": "2025-07-30",
      "id": "118165",
      "original_text": "Registerbekanntmachung nach dem Umwandlungsgesetz\nBayern Amtsgericht Kempten (Allgäu) HRB 12407\nDACHSER SE – Kempten (Allgäu)",
      "type": "Registerbekanntmachung nach dem Umwandlungsgesetz",
      "state": "Bayern",
      "amtsgericht": "Amtsgericht Kempten (Allgäu)",
      "registernummer": "HRB 12407",
      "registerart": "HRB",
      "company_name": "DACHSER SE",
      "company_seat": "Kempten (Allgäu)",
      "details": "30.07.2025 (Bekanntmachungsdatum)\n\nBayern Amtsgericht Kempten (Allgäu) HRB 12407\nRegisterbekanntmachung nach dem Umwandlungsgesetz 29.07.2025 (Eintragungsdatum)\n\nDACHSER SE\nEuropäische Aktiengesellschaft (SE)\nKempten (Allgäu)\n\nDen Gläubigern der an der Verschmelzung beteiligten Rechtsträger ist, wenn sie binnen sechs Monaten nach dem Tag, an dem die Eintragung der Verschmelzung in das Register des Sitzes desjenigen Rechtsträgers, dessen Gläubiger sie sind, nach § 19 Abs. 3 UmwG als bekannt gemacht gilt, ihren Anspruch nach Grund und Höhe in Textform anmelden, Sicherheit zu leisten, soweit sie nicht Befriedigung verlangen können. Dieses Recht steht den Gläubigern jedoch nur zu, wenn sie glaubhaft machen, dass durch die Verschmelzung die Erfüllung ihrer Forderung gefährdet wird."
    },
    {
      "date": "2025-07-30",
      "id": "118166",
      "original_text": "Registerbekanntmachung nach dem Umwandlungsgesetz\nBayern Amtsgericht Kempten (Allgäu) HRB 7885\nJet-Speed GmbH – Kempten (Allgäu)",
      "type": "Registerbekanntmachung nach dem Umwandlungsgesetz",
      "state": "Bayern",
      "amtsgericht": "Amtsgericht Kempten (Allgäu)",
      "registernummer": "HRB 7885",
      "registerart": "HRB",
      "company_name": "Jet-Speed GmbH",
      "company_seat": "Kempten (Allgäu)",
      "details": "30.07.2025 (Bekanntmachungsdatum)\n\nBayern Amtsgericht Kempten (Allgäu) HRB 7885\nRegisterbekanntmachung nach dem Umwandlungsgesetz 29.07.2025 (Eintragungsdatum)\n\nJet-Speed GmbH\nGesellschaft mit beschränkter Haftung\nKempten (Allgäu)\n\nDen Gläubigern der an der Verschmelzung beteiligten Rechtsträger ist, wenn sie binnen sechs Monaten nach dem Tag, an dem die Eintragung der Verschmelzung in das Register des Sitzes desjenigen Rechtsträgers, dessen Gläubiger sie sind, nach § 19 Abs. 3 UmwG als bekannt gemacht gilt, ihren Anspruch nach Grund und Höhe in Textform anmelden, Sicherheit zu leisten, soweit sie nicht Befriedigung verlangen können. Dieses Recht steht den Gläubigern jedoch nur zu, wenn sie glaubhaft machen, dass durch die Verschmelzung die Erfüllung ihrer Forderung gefährdet wird."
    },
    {
      "date": "2025-07-30",
      "id": "118167",
      "original_text": "Einreichung neuer Dokumente\nBayern Amtsgericht München HRB 254410\nNagarro SE – München",
      "type": "Einreichung neuer Dokumente",
      "state": "Bayern",
      "amtsgericht": "Amtsgericht München",
      "registernummer": "HRB 254410",
      "registerart": "HRB",
      "company_name": "Nagarro SE",
      "company_seat": "München",
      "details": "30.07.2025 (Bekanntmachungsdatum)\n\nBayern Amtsgericht München HRB 254410\nEinreichung neuer Dokumente\n\nNagarro SE\nEuropäische Aktiengesellschaft (SE)\nMünchen\n\nDem Amtsgericht München -Registergericht- ist eine Liste der Mitglieder des Aufsichtsrats eingereicht worden, Art. 9 Abs. 1 Buchst. c (ii) SE-VO i.V.m. § 106 AktG."
    },
    {
      "date": "2025-07-30",
      "id": "118168",
      "original_text": "Registerbekanntmachung nach dem Umwandlungsgesetz\nBayern Amtsgericht München HRB 255705\nAMBIA Grundstücks-Verwaltungsgesellschaft Projekt 1 mbH – Grünwald",
      "type": "Registerbekanntmachung nach dem Umwandlungsgesetz",
      "state": "Bayern",
      "amtsgericht": "Amtsgericht München",
      "registernummer": "HRB 255705",
      "registerart": "HRB",
      "company_name": "AMBIA Grundstücks-Verwaltungsgesellschaft Projekt 1 mbH",
      "company_seat": "Grünwald",
      "details": "30.07.2025 (Bekanntmachungsdatum)\n\nBayern Amtsgericht München HRB 255705\nRegisterbekanntmachung nach dem Umwandlungsgesetz\n\nAMBIA Grundstücks-Verwaltungsgesellschaft Projekt 1 mbH\nGesellschaft mit beschränkter Haftung\nGrünwald\n\nEs wird darauf hingewiesen, dass ein Formwechselplan oder sein Entwurf über einen grenzüberschreitenden Formwechsel durch Umwandlung der AMBIA Grundstücks-Verwaltungsgesellschaft Projekt 1 mbH mit dem Sitz in Grünwald, Landkreis München, (Amtsgericht München, HRB 255705), einer Gesellschaft mit beschränkter Haftung nach deutschem Recht,\nin die Terminal M DEMIAS B.V. mit Sitz in Amsterdam, Niederlande, eine Besloten Vennootschap met beperkte aansprakelijkheid (B.V.) nach dem Recht des Staates Niederlande, welche beim niederländischen Handelsregister (Kamer van Koophandel) registriert werden wird, beim Handelsregister eingereicht worden ist.\nDie Anteilsinhaber, die Gläubiger sowie die zuständigen Betriebsräte der an dem grenzüberschreitenden Formwechsel beteiligten Gesellschaft oder, soweit es keinen Betriebsrat gibt, die Arbeitnehmer der an dem grenzüberschreitenden Formwechsel beteiligten Gesellschaft, können der Gesellschaft spätestens fünf Arbeitstage vor dem Tag der Gesellschafterversammlung Bemerkungen zum Formwechselplan übermitteln."
    },
    {
      "date": "2025-07-30",
      "id": "118169",
      "original_text": "Registerbekanntmachung nach dem Umwandlungsgesetz\nBayern Amtsgericht Augsburg HRB 38669\nEXELTS Verwaltungs GmbH – Gersthofen",
      "type": "Registerbekanntmachung nach dem Umwandlungsgesetz",
      "state": "Bayern",
      "amtsgericht": "Amtsgericht Augsburg",
      "registernummer": "HRB 38669",
      "registerart": "HRB",
      "company_name": "EXELTS Verwaltungs GmbH",
      "company_seat": "Gersthofen",
      "details": "30.07.2025 (Bekanntmachungsdatum)\n\nBayern Amtsgericht Augsburg HRB 38669\nRegisterbekanntmachung nach dem Umwandlungsgesetz 29.07.2025 (Eintragungsdatum)\n\nEXELTS Verwaltungs GmbH\nGesellschaft mit beschränkter Haftung\nGersthofen\n\nDen Gläubigern der an der Verschmelzung beteiligten Rechtsträger ist, wenn sie binnen sechs Monaten nach dem Tag, an dem die Eintragung der Verschmelzung in das Register des Sitzes desjenigen Rechtsträgers, dessen Gläubiger sie sind, nach § 19 Abs. 3 UmwG als bekannt gemacht gilt, ihren Anspruch nach Grund und Höhe in Textform anmelden, Sicherheit zu leisten, soweit sie nicht Befriedigung verlangen können. Dieses Recht steht den Gläubigern jedoch nur zu, wenn sie glaubhaft machen, dass durch die Verschmelzung die Erfüllung ihrer Forderung gefährdet wird."
    },
    {
      "date": "2025-07-30",
      "id": "118170",
      "original_text": "Registerbekanntmachung nach dem Umwandlungsgesetz\nBayern Amtsgericht München HRB 130023\nOptik am Eck GmbH – Taufkirchen/Vils",
      "type": "Registerbekanntmachung nach dem Umwandlungsgesetz",
      "state": "Bayern",
      "amtsgericht": "Amtsgericht München",
      "registernummer": "HRB 130023",
      "registerart": "HRB",
      "company_name": "Optik am Eck GmbH",
      "company_seat": "Taufkirchen/Vils",
      "details": "30.07.2025 (Bekanntmachungsdatum)\n\nBayern Amtsgericht München HRB 130023\nRegisterbekanntmachung nach dem Umwandlungsgesetz 29.07.2025 (Eintragungsdatum)\n\nOptik am Eck GmbH\nGesellschaft mit beschränkter Haftung\nTaufkirchen/Vils\n\nDen Gläubigern der an der Verschmelzung beteiligten Rechtsträger ist, wenn sie binnen sechs Monaten nach dem Tag, an dem die Eintragung der Verschmelzung in das Register des Sitzes desjenigen Rechtsträgers, dessen Gläubiger sie sind, nach § 19 Abs. 3 UmwG als bekannt gemacht gilt, ihren Anspruch nach Grund und Höhe in Textform anmelden, Sicherheit zu leisten, soweit sie nicht Befriedigung verlangen können. Dieses Recht steht den Gläubigern jedoch nur zu, wenn sie glaubhaft machen, dass durch die Verschmelzung die Erfüllung ihrer Forderung gefährdet wird."
    },
    {
      "date": "2025-07-30",
      "id": "118171",
      "original_text": "Registerbekanntmachung nach dem Umwandlungsgesetz\nBayern Amtsgericht Nürnberg HRB 37663\nThePlantButchers GmbH – Spalt",
      "type": "Registerbekanntmachung nach dem Umwandlungsgesetz",
      "state": "Bayern",
      "amtsgericht": "Amtsgericht Nürnberg",
      "registernummer": "HRB 37663",
      "registerart": "HRB",
      "company_name": "ThePlantButchers GmbH",
      "company_seat": "Spalt",
      "details": "30.07.2025 (Bekanntmachungsdatum)\n\nBayern Amtsgericht Nürnberg HRB 37663\nRegisterbekanntmachung nach dem Umwandlungsgesetz 29.07.2025 (Eintragungsdatum)\n\nThePlantButchers GmbH\nGesellschaft mit beschränkter Haftung\nSpalt\n\nDen Gläubigern der an der Verschmelzung beteiligten Rechtsträger ist, wenn sie binnen sechs Monaten nach dem Tag, an dem die Eintragung der Verschmelzung in das Register des Sitzes desjenigen Rechtsträgers, dessen Gläubiger sie sind, nach § 19 Abs. 3 UmwG als bekannt gemacht gilt, ihren Anspruch nach Grund und Höhe in Textform anmelden, Sicherheit zu leisten, soweit sie nicht Befriedigung verlangen können. Dieses Recht steht den Gläubigern jedoch nur zu, wenn sie glaubhaft machen, dass durch die Verschmelzung die Erfüllung ihrer Forderung gefährdet wird."
    },
    {
      "date": "2025-07-30",
      "id": "118172",
      "original_text": "Registerbekanntmachung nach dem Umwandlungsgesetz\nBayern Amtsgericht München HRA 121256\nTrachten-Stube \"Inge\" GmbH Co. KG – Penzberg",
      "type": "Registerbekanntmachung nach dem Umwandlungsgesetz",
      "state": "Bayern",
      "amtsgericht": "Amtsgericht München",
      "registernummer": "HRA 121256",
      "registerart": "HRA",
      "company_name": "Trachten-Stube \"Inge\" GmbH Co. KG",
      "company_seat": "Penzberg",
      "details": "30.07.2025 (Bekanntmachungsdatum)\n\nBayern Amtsgericht München HRA 121256\nRegisterbekanntmachung nach dem Umwandlungsgesetz 29.07.2025 (Eintragungsdatum)\n\nTrachten-Stube \"Inge\" GmbH Co. KG\nKommanditgesellschaft\nPenzberg\n\nDen Gläubigern der an der Ausgliederung beteiligten Rechtsträger ist, wenn sie binnen sechs Monaten nach dem Tag, an dem die Eintragung der Ausgliederung in das Register des Sitzes desjenigen Rechtsträgers, dessen Gläubiger sie sind, nach §§ 125, 19 Abs. 3 UmwG als bekannt gemacht gilt, ihren Anspruch nach Grund und Höhe in Textform anmelden, Sicherheit zu leisten, soweit sie nicht Befriedigung verlangen können. Dieses Recht steht den Gläubigern jedoch nur zu, wenn sie glaubhaft machen, dass durch die Ausgliederung die Erfüllung ihrer Forderung gefährdet wird."
    },
    {
      "date": "2025-07-30",
      "id": "118173",
      "original_text": "Registerbekanntmachung nach dem Umwandlungsgesetz\nBayern Amtsgericht Nürnberg HRB 35871\nlinego group GmbH – Schwabach",
      "type": "Registerbekanntmachung nach dem Umwandlungsgesetz",
      "state": "Bayern",
      "amtsgericht": "Amtsgericht Nürnberg",
      "registernummer": "HRB 35871",
      "registerart": "HRB",
      "company_name": "linego group GmbH",
      "company_seat": "Schwabach",
      "details": "30.07.2025 (Bekanntmachungsdatum)\n\nBayern Amtsgericht Nürnberg HRB 35871\nRegisterbekanntmachung nach dem Umwandlungsgesetz 29.07.2025 (Eintragungsdatum)\n\nlinego group GmbH\nGesellschaft mit beschränkter Haftung\nSchwabach\n\nDen Gläubigern der an der Spaltung beteiligten Rechtsträger ist, wenn sie binnen sechs Monaten nach dem Tag, an dem die Eintragung der Spaltung in das Register des Sitzes desjenigen Rechtsträgers, dessen Gläubiger sie sind, nach §§ 125, 19 Abs. 3 UmwG als bekannt gemacht gilt, ihren Anspruch nach Grund und Höhe in Textform anmelden, Sicherheit zu leisten, soweit sie nicht Befriedigung verlangen können. Dieses Recht steht den Gläubigern jedoch nur zu, wenn sie glaubhaft machen, dass durch die Spaltung die Erfüllung ihrer Forderung gefährdet wird."
    },
    {
      "date": "2025-07-30",
      "id": "118174",
      "original_text": "Registerbekanntmachung nach dem Umwandlungsgesetz\nBayern Amtsgericht München HRB 187988\nPartners Group (EU) GmbH – München",
      "type": "Registerbekanntmachung nach dem Umwandlungsgesetz",
      "state": "Bayern",
      "amtsgericht": "Amtsgericht München",
      "registernummer": "HRB 187988",
      "registerart": "HRB",
      "company_name": "Partners Group (EU) GmbH",
      "company_seat": "München",
      "details": "30.07.2025 (Bekanntmachungsdatum)\n\nBayern Amtsgericht München HRB 187988\nRegisterbekanntmachung nach dem Umwandlungsgesetz\n\nPartners Group (EU) GmbH\nGesellschaft mit beschränkter Haftung\nMünchen\n\nEs wird darauf hingewiesen, dass ein Entwurf des Spaltungsplans über eine grenzüberschreitende Spaltung zur Aufnahme mit der Partners Group (Luxembourg) S.A. mit Sitz in Luxemburg/Luxemburg (Registre de commerce et des sociétés B107523) (société anonyme - Aktiengesellschaft nach luxemburgischem Recht) als übertragender Gesellschaft beim Handelsregister eingereicht worden ist.\nDie Anteilsinhaber, die Gläubiger sowie die zuständigen Betriebsräte der an der grenzüberschreitenden Spaltung beteiligten Gesellschaft oder, soweit es keinen Betriebsrat gibt, die Arbeitnehmer der an der grenzüberschreitenden Spaltung beteiligten Gesellschaft, können der Gesellschaft spätestens fünf Arbeitstage vor dem Tag der Gesellschafterversammlung, die am 05.09.2025 stattfinden soll, Bemerkungen zum Spaltungsplan übermitteln. Die Übermittlungsfrist für etwaige Bemerkungen zum Spaltungsplan endet damit am 29.08.2025."
    },
    {
      "date": "2025-07-30",
      "id": "118175",
      "original_text": "Registerbekanntmachung nach dem Umwandlungsgesetz\nBayern Amtsgericht München HRB 266278\nGeno-Insure GmbH – München",
      "type": "Registerbekanntmachung nach dem Umwandlungsgesetz",
      "state": "Bayern",
      "amtsgericht": "Amtsgericht München",
      "registernummer": "HRB 266278",
      "registerart": "HRB",
      "company_name": "Geno-Insure GmbH",
      "company_seat": "München",
      "details": "30.07.2025 (Bekanntmachungsdatum)\n\nBayern Amtsgericht München HRB 266278\nRegisterbekanntmachung nach dem Umwandlungsgesetz 29.07.2025 (Eintragungsdatum)\n\nGeno-Insure GmbH\nGesellschaft mit beschränkter Haftung\nMünchen\n\nDen Gläubigern der an der Verschmelzung beteiligten Rechtsträger ist, wenn sie binnen sechs Monaten nach dem Tag, an dem die Eintragung der Verschmelzung in das Register des Sitzes desjenigen Rechtsträgers, dessen Gläubiger sie sind, nach § 19 Abs. 3 UmwG als bekannt gemacht gilt, ihren Anspruch nach Grund und Höhe in Textform anmelden, Sicherheit zu leisten, soweit sie nicht Befriedigung verlangen können. Dieses Recht steht den Gläubigern jedoch nur zu, wenn sie glaubhaft machen, dass durch die Verschmelzung die Erfüllung ihrer Forderung gefährdet wird."
    },
    {
      "date": "2025-07-30",
      "id": "118176",
      "original_text": "Registerbekanntmachung nach dem Umwandlungsgesetz\nBayern Amtsgericht Nürnberg HRB 35313\nBurgerBar Kuhmuhne GmbH – Nürnberg",
      "type": "Registerbekanntmachung nach dem Umwandlungsgesetz",
      "state": "Bayern",
      "amtsgericht": "Amtsgericht Nürnberg",
      "registernummer": "HRB 35313",
      "registerart": "HRB",
      "company_name": "BurgerBar Kuhmuhne GmbH",
      "company_seat": "Nürnberg",
      "details": "30.07.2025 (Bekanntmachungsdatum)\n\nBayern Amtsgericht Nürnberg HRB 35313\nRegisterbekanntmachung nach dem Umwandlungsgesetz 29.07.2025 (Eintragungsdatum)\n\nBurgerBar Kuhmuhne GmbH\nGesellschaft mit beschränkter Haftung\nNürnberg\n\nDen Gläubigern der an der Verschmelzung beteiligten Rechtsträger ist, wenn sie binnen sechs Monaten nach dem Tag, an dem die Eintragung der Verschmelzung in das Register des Sitzes desjenigen Rechtsträgers, dessen Gläubiger sie sind, nach § 19 Abs. 3 UmwG als bekannt gemacht gilt, ihren Anspruch nach Grund und Höhe in Textform anmelden, Sicherheit zu leisten, soweit sie nicht Befriedigung verlangen können. Dieses Recht steht den Gläubigern jedoch nur zu, wenn sie glaubhaft machen, dass durch die Verschmelzung die Erfüllung ihrer Forderung gefährdet wird."
    },
    {
      "date": "2025-07-30",
      "id": "118177",
      "original_text": "Registerbekanntmachung nach dem Umwandlungsgesetz\nBayern Amtsgericht München HRB 283082\nJebsen Capital Investment Management GmbH – München",
      "type": "Registerbekanntmachung nach dem Umwandlungsgesetz",
      "state": "Bayern",
      "amtsgericht": "Amtsgericht München",
      "registernummer": "HRB 283082",
      "registerart": "HRB",
      "company_name": "Jebsen Capital Investment Management GmbH",
      "company_seat": "München",
      "details": "30.07.2025 (Bekanntmachungsdatum)\n\nBayern Amtsgericht München HRB 283082\nRegisterbekanntmachung nach dem Umwandlungsgesetz 28.07.2025 (Eintragungsdatum)\n\nJebsen Capital Investment Management GmbH\nGesellschaft mit beschränkter Haftung\nMünchen\n\nDen Gläubigern der an der Verschmelzung beteiligten Rechtsträger ist, wenn sie binnen sechs Monaten nach dem Tag, an dem die Eintragung der Verschmelzung in das Register des Sitzes desjenigen Rechtsträgers, dessen Gläubiger sie sind, nach § 19 Abs. 3 UmwG als bekannt gemacht gilt, ihren Anspruch nach Grund und Höhe in Textform anmelden, Sicherheit zu leisten, soweit sie nicht Befriedigung verlangen können. Dieses Recht steht den Gläubigern jedoch nur zu, wenn sie glaubhaft machen, dass durch die Verschmelzung die Erfüllung ihrer Forderung gefährdet wird."
    },
    {
      "date": "2025-07-30",
      "id": "118178",
      "original_text": "Registerbekanntmachung nach dem Umwandlungsgesetz\nBayern Amtsgericht München HRB 88881\nFeuer und Form - Kachelofen- und Luftheizungsbau Zoth GmbH – Wolfersdorf",
      "type": "Registerbekanntmachung nach dem Umwandlungsgesetz",
      "state": "Bayern",
      "amtsgericht": "Amtsgericht München",
      "registernummer": "HRB 88881",
      "registerart": "HRB",
      "company_name": "Feuer und Form - Kachelofen- und Luftheizungsbau Zoth GmbH",
      "company_seat": "Wolfersdorf",
      "details": "30.07.2025 (Bekanntmachungsdatum)\n\nBayern Amtsgericht München HRB 88881\nRegisterbekanntmachung nach dem Umwandlungsgesetz 29.07.2025 (Eintragungsdatum)\n\nFeuer und Form - Kachelofen- und Luftheizungsbau Zoth GmbH\nGesellschaft mit beschränkter Haftung\nWolfersdorf\n\nDen Gläubigern der an der Verschmelzung beteiligten Rechtsträger ist, wenn sie binnen sechs Monaten nach dem Tag, an dem die Eintragung der Verschmelzung in das Register des Sitzes desjenigen Rechtsträgers, dessen Gläubiger sie sind, nach § 19 Abs. 3 UmwG als bekannt gemacht gilt, ihren Anspruch nach Grund und Höhe in Textform anmelden, Sicherheit zu leisten, soweit sie nicht Befriedigung verlangen können. Dieses Recht steht den Gläubigern jedoch nur zu, wenn sie glaubhaft machen, dass durch die Verschmelzung die Erfüllung ihrer Forderung gefährdet wird."
    },
    {
      "date": "2025-07-30",
      "id": "118179",
      "original_text": "Registerbekanntmachung nach dem Umwandlungsgesetz\nBayern Amtsgericht Nürnberg HRB 19872\niconec GmbH – Schwabach",
      "type": "Registerbekanntmachung nach dem Umwandlungsgesetz",
      "state": "Bayern",
      "amtsgericht": "Amtsgericht Nürnberg",
      "registernummer": "HRB 19872",
      "registerart": "HRB",
      "company_name": "iconec GmbH",
      "company_seat": "Schwabach",
      "details": "30.07.2025 (Bekanntmachungsdatum)\n\nBayern Amtsgericht Nürnberg HRB 19872\nRegisterbekanntmachung nach dem Umwandlungsgesetz 29.07.2025 (Eintragungsdatum)\n\niconec GmbH\nGesellschaft mit beschränkter Haftung\nSchwabach\n\nDen Gläubigern der an der Verschmelzung beteiligten Rechtsträger ist, wenn sie binnen sechs Monaten nach dem Tag, an dem die Eintragung der Verschmelzung in das Register des Sitzes desjenigen Rechtsträgers, dessen Gläubiger sie sind, nach § 19 Abs. 3 UmwG als bekannt gemacht gilt, ihren Anspruch nach Grund und Höhe in Textform anmelden, Sicherheit zu leisten, soweit sie nicht Befriedigung verlangen können. Dieses Recht steht den Gläubigern jedoch nur zu, wenn sie glaubhaft machen, dass durch die Verschmelzung die Erfüllung ihrer Forderung gefährdet wird."
    },
    {
      "date": "2025-07-30",
      "id": "118180",
      "original_text": "Registerbekanntmachung nach dem Umwandlungsgesetz\nBayern Amtsgericht München HRB 247503\nPhillian GmbH – Neubiberg",
      "type": "Registerbekanntmachung nach dem Umwandlungsgesetz",
      "state": "Bayern",
      "amtsgericht": "Amtsgericht München",
      "registernummer": "HRB 247503",
      "registerart": "HRB",
      "company_name": "Phillian GmbH",
      "company_seat": "Neubiberg",
      "details": "30.07.2025 (Bekanntmachungsdatum)\n\nBayern Amtsgericht München HRB 247503\nRegisterbekanntmachung nach dem Umwandlungsgesetz 29.07.2025 (Eintragungsdatum)\n\nPhillian GmbH\nGesellschaft mit beschränkter Haftung\nNeubiberg\n\nDen Gläubigern der an der Verschmelzung beteiligten Rechtsträger ist, wenn sie binnen sechs Monaten nach dem Tag, an dem die Eintragung der Verschmelzung in das Register des Sitzes desjenigen Rechtsträgers, dessen Gläubiger sie sind, nach § 19 Abs. 3 UmwG als bekannt gemacht gilt, ihren Anspruch nach Grund und Höhe in Textform anmelden, Sicherheit zu leisten, soweit sie nicht Befriedigung verlangen können. Dieses Recht steht den Gläubigern jedoch nur zu, wenn sie glaubhaft machen, dass durch die Verschmelzung die Erfüllung ihrer Forderung gefährdet wird."
    },
    {
      "date": "2025-07-30",
      "id": "118181",
      "original_text": "Registerbekanntmachung nach dem Umwandlungsgesetz\nBayern Amtsgericht Nürnberg HRB 15662\nHerrmann + Altinger Lack- und Design GmbH – Schwabach",
      "type": "Registerbekanntmachung nach dem Umwandlungsgesetz",
      "state": "Bayern",
      "amtsgericht": "Amtsgericht Nürnberg",
      "registernummer": "HRB 15662",
      "registerart": "HRB",
      "company_name": "Herrmann + Altinger Lack- und Design GmbH",
      "company_seat": "Schwabach",
      "details": "30.07.2025 (Bekanntmachungsdatum)\n\nBayern Amtsgericht Nürnberg HRB 15662\nRegisterbekanntmachung nach dem Umwandlungsgesetz 29.07.2025 (Eintragungsdatum)\n\nHerrmann + Altinger Lack- und Design GmbH\nGesellschaft mit beschränkter Haftung\nSchwabach\n\nDen Gläubigern der an der Verschmelzung beteiligten Rechtsträger ist, wenn sie binnen sechs Monaten nach dem Tag, an dem die Eintragung der Verschmelzung in das Register des Sitzes desjenigen Rechtsträgers, dessen Gläubiger sie sind, nach § 19 Abs. 3 UmwG als bekannt gemacht gilt, ihren Anspruch nach Grund und Höhe in Textform anmelden, Sicherheit zu leisten, soweit sie nicht Befriedigung verlangen können. Dieses Recht steht den Gläubigern jedoch nur zu, wenn sie glaubhaft machen, dass durch die Verschmelzung die Erfüllung ihrer Forderung gefährdet wird."
    },
    {
      "date": "2025-07-30",
      "id": "118182",
      "original_text": "Registerbekanntmachung nach dem Umwandlungsgesetz\nBayern Amtsgericht Augsburg HRB 36847\nDriveLytics Verwaltungs GmbH – Gersthofen",
      "type": "Registerbekanntmachung nach dem Umwandlungsgesetz",
      "state": "Bayern",
      "amtsgericht": "Amtsgericht Augsburg",
      "registernummer": "HRB 36847",
      "registerart": "HRB",
      "company_name": "DriveLytics Verwaltungs GmbH",
      "company_seat": "Gersthofen",
      "details": "30.07.2025 (Bekanntmachungsdatum)\n\nBayern Amtsgericht Augsburg HRB 36847\nRegisterbekanntmachung nach dem Umwandlungsgesetz 29.07.2025 (Eintragungsdatum)\n\nDriveLytics Verwaltungs GmbH\nGesellschaft mit beschränkter Haftung\nGersthofen\n\nDen Gläubigern der an der Verschmelzung beteiligten Rechtsträger ist, wenn sie binnen sechs Monaten nach dem Tag, an dem die Eintragung der Verschmelzung in das Register des Sitzes desjenigen Rechtsträgers, dessen Gläubiger sie sind, nach § 19 Abs. 3 UmwG als bekannt gemacht gilt, ihren Anspruch nach Grund und Höhe in Textform anmelden, Sicherheit zu leisten, soweit sie nicht Befriedigung verlangen können. Dieses Recht steht den Gläubigern jedoch nur zu, wenn sie glaubhaft machen, dass durch die Verschmelzung die Erfüllung ihrer Forderung gefährdet wird."
    },
    {
      "date": "2025-07-30",
      "id": "118183",
      "original_text": "Registerbekanntmachung nach dem Umwandlungsgesetz\nBayern Amtsgericht Augsburg HRA 21940\nMünzinger GmbH & Co. KG – Harburg (Schwaben)",
      "type": "Registerbekanntmachung nach dem Umwandlungsgesetz",
      "state": "Bayern",
      "amtsgericht": "Amtsgericht Augsburg",
      "registernummer": "HRA 21940",
      "registerart": "HRA",
      "company_name": "Münzinger GmbH & Co. KG",
      "company_seat": "Harburg (Schwaben)",
      "details": "30.07.2025 (Bekanntmachungsdatum)\n\nBayern Amtsgericht Augsburg HRA 21940\nRegisterbekanntmachung nach dem Umwandlungsgesetz 29.07.2025 (Eintragungsdatum)\n\nMünzinger GmbH & Co. KG\nKommanditgesellschaft\nHarburg (Schwaben)\n\nDen Gläubigern der an der Ausgliederung beteiligten Rechtsträger ist, wenn sie binnen sechs Monaten nach dem Tag, an dem die Eintragung der Ausgliederung in das Register des Sitzes desjenigen Rechtsträgers, dessen Gläubiger sie sind, nach §§ 125, 19 Abs. 3 UmwG als bekannt gemacht gilt, ihren Anspruch nach Grund und Höhe in Textform anmelden, Sicherheit zu leisten, soweit sie nicht Befriedigung verlangen können. Dieses Recht steht den Gläubigern jedoch nur zu, wenn sie glaubhaft machen, dass durch die Ausgliederung die Erfüllung ihrer Forderung gefährdet wird."
    },
    {
      "date": "2025-07-30",
      "id": "118184",
      "original_text": "Einreichung neuer Dokumente\nBayern Amtsgericht München HRB 199543\nApollo 5 GmbH – Starnberg",
      "type": "Einreichung neuer Dokumente",
      "state": "Bayern",
      "amtsgericht": "Amtsgericht München",
      "registernummer": "HRB 199543",
      "registerart": "HRB",
      "company_name": "Apollo 5 GmbH",
      "company_seat": "Starnberg",
      "details": "30.07.2025 (Bekanntmachungsdatum)\n\nBayern Amtsgericht München HRB 199543\nEinreichung neuer Dokumente\n\nApollo 5 GmbH\nGesellschaft mit beschränkter Haftung\nStarnberg\n\nDem Amtsgericht München -Registergericht- ist eine Liste der Mitglieder des Aufsichtsrats eingereicht worden, § 52 Abs. 3 S. 2 GmbHG."
    },
    {
      "date": "2025-07-30",
      "id": "118185",
      "original_text": "Registerbekanntmachung nach dem Umwandlungsgesetz\nBayern Amtsgericht München HRB 147121\nBRINA Trend GmbH – Markt Schwaben",
      "type": "Registerbekanntmachung nach dem Umwandlungsgesetz",
      "state": "Bayern",
      "amtsgericht": "Amtsgericht München",
      "registernummer": "HRB 147121",
      "registerart": "HRB",
      "company_name": "BRINA Trend GmbH",
      "company_seat": "Markt Schwaben",
      "details": "30.07.2025 (Bekanntmachungsdatum)\n\nBayern Amtsgericht München HRB 147121\nRegisterbekanntmachung nach dem Umwandlungsgesetz 29.07.2025 (Eintragungsdatum)\n\nBRINA Trend GmbH\nGesellschaft mit beschränkter Haftung\nMarkt Schwaben\n\nDen Gläubigern der an der Verschmelzung beteiligten Rechtsträger ist, wenn sie binnen sechs Monaten nach dem Tag, an dem die Eintragung der Verschmelzung in das Register des Sitzes desjenigen Rechtsträgers, dessen Gläubiger sie sind, nach § 19 Abs. 3 UmwG als bekannt gemacht gilt, ihren Anspruch nach Grund und Höhe schriftlich anmelden, Sicherheit zu leisten, soweit sie nicht Befriedigung verlangen können. Dieses Recht steht den Gläubigern jedoch nur zu, wenn sie glaubhaft machen, dass durch die Verschmelzung die Erfüllung ihrer Forderung gefährdet wird."
    },
    {
      "date": "2025-07-30",
      "id": "118186",
      "original_text": "Löschungsankündigung\nBayern Amtsgericht Nürnberg HRB 30979\nMix Möbel GmbH – Nürnberg",
      "type": "Löschungsankündigung",
      "state": "Bayern",
      "amtsgericht": "Amtsgericht Nürnberg",
      "registernummer": "HRB 30979",
      "registerart": "HRB",
      "company_name": "Mix Möbel GmbH",
      "company_seat": "Nürnberg",
      "details": "30.07.2025 (Bekanntmachungsdatum)\n\nBayern Amtsgericht Nürnberg HRB 30979\nLöschungsankündigung\n\nMix Möbel GmbH\nGesellschaft mit beschränkter Haftung\nNürnberg\n\nDas Registergericht beabsichtigt, die im Handelsregister eingetragene Gesellschaft wegen Vermögenslosigkeit von Amts wegen nach § 394 FamFG zu löschen. Die Frist zur Erhebung eines Widerspruchs ist auf einen Monat festgesetzt."
    },
    {
      "date": "2025-07-30",
      "id": "118187",
      "original_text": "Löschungsankündigung\nBayern Amtsgericht München HRB 167730\nV8 and more GmbH – Eichenau",
      "type": "Löschungsankündigung",
      "state": "Bayern",
      "amtsgericht": "Amtsgericht München",
      "registernummer": "HRB 167730",
      "registerart": "HRB",
      "company_name": "V8 and more GmbH",
      "company_seat": "Eichenau",
      "details": "30.07.2025 (Bekanntmachungsdatum)\n\nBayern Amtsgericht München HRB 167730\nLöschungsankündigung 29.07.2025 (Eintragungsdatum)\n\nV8 and more GmbH\nGesellschaft mit beschränkter Haftung\nEichenau\n\nDas Registergericht beabsichtigt, die im Handelsregister eingetragene Gesellschaft wegen Vermögenslosigkeit von Amts wegen nach § 394 FamFG zu löschen. Die Frist zur Erhebung eines Widerspruchs ist auf drei Monate festgesetzt."
    },
    {
      "date": "2025-07-30",
      "id": "118188",
      "original_text": "Registerbekanntmachung nach dem Umwandlungsgesetz\nBayern Amtsgericht München HRB 204528\nRALOSA Verwaltung GmbH – Pullach i.Isartal",
      "type": "Registerbekanntmachung nach dem Umwandlungsgesetz",
      "state": "Bayern",
      "amtsgericht": "Amtsgericht München",
      "registernummer": "HRB 204528",
      "registerart": "HRB",
      "company_name": "RALOSA Verwaltung GmbH",
      "company_seat": "Pullach i.Isartal",
      "details": "30.07.2025 (Bekanntmachungsdatum)\n\nBayern Amtsgericht München HRB 204528\nRegisterbekanntmachung nach dem Umwandlungsgesetz 29.07.2025 (Eintragungsdatum)\n\nRALOSA Verwaltung GmbH\nGesellschaft mit beschränkter Haftung\nPullach i.Isartal\n\nDen Gläubigern der an der Verschmelzung beteiligten Rechtsträger ist, wenn sie binnen sechs Monaten nach dem Tag, an dem die Eintragung der Verschmelzung in das Register des Sitzes desjenigen Rechtsträgers, dessen Gläubiger sie sind, nach § 19 Abs. 3 UmwG als bekannt gemacht gilt, ihren Anspruch nach Grund und Höhe in Textform anmelden, Sicherheit zu leisten, soweit sie nicht Befriedigung verlangen können. Dieses Recht steht den Gläubigern jedoch nur zu, wenn sie glaubhaft machen, dass durch die Verschmelzung die Erfüllung ihrer Forderung gefährdet wird."
    },
    {
      "date": "2025-07-30",
      "id": "118189",
      "original_text": "Registerbekanntmachung nach dem Umwandlungsgesetz\nBayern Amtsgericht Landshut HRB 5481\nOptik Kronwinkler GmbH Landau a. d. Isar. – Landau a. d. Isar",
      "type": "Registerbekanntmachung nach dem Umwandlungsgesetz",
      "state": "Bayern",
      "amtsgericht": "Amtsgericht Landshut",
      "registernummer": "HRB 5481",
      "registerart": "HRB",
      "company_name": "Optik Kronwinkler GmbH Landau a. d. Isar.",
      "company_seat": "Landau a. d. Isar",
      "details": "30.07.2025 (Bekanntmachungsdatum)\n\nBayern Amtsgericht Landshut HRB 5481\nRegisterbekanntmachung nach dem Umwandlungsgesetz 29.07.2025 (Eintragungsdatum)\n\nOptik Kronwinkler GmbH Landau a. d. Isar.\nGesellschaft mit beschränkter Haftung\nLandau a. d. Isar\n\nDen Gläubigern der an der Verschmelzung beteiligten Rechtsträger ist, wenn sie binnen sechs Monaten nach dem Tag, an dem die Eintragung der Verschmelzung in das Register des Sitzes desjenigen Rechtsträgers, dessen Gläubiger sie sind, nach § 19 Abs. 3 UmwG als bekannt gemacht gilt, ihren Anspruch nach Grund und Höhe in Textform anmelden, Sicherheit zu leisten, soweit sie nicht Befriedigung verlangen können. Dieses Recht steht den Gläubigern jedoch nur zu, wenn sie glaubhaft machen, dass durch die Verschmelzung die Erfüllung ihrer Forderung gefährdet wird."
    },
    {
      "date": "2025-07-30",
      "id": "118190",
      "original_text": "Registerbekanntmachung nach dem Umwandlungsgesetz\nBayern Amtsgericht München HRB 201255\nGonggong GmbH – Ottobrunn",
      "type": "Registerbekanntmachung nach dem Umwandlungsgesetz",
      "state": "Bayern",
      "amtsgericht": "Amtsgericht München",
      "registernummer": "HRB 201255",
      "registerart": "HRB",
      "company_name": "Gonggong GmbH",
      "company_seat": "Ottobrunn",
      "details": "30.07.2025 (Bekanntmachungsdatum)\n\nBayern Amtsgericht München HRB 201255\nRegisterbekanntmachung nach dem Umwandlungsgesetz 29.07.2025 (Eintragungsdatum)\n\nGonggong GmbH\nGesellschaft mit beschränkter Haftung\nOttobrunn\n\nDen Gläubigern der an der Verschmelzung beteiligten Rechtsträger ist, wenn sie binnen sechs Monaten nach dem Tag, an dem die Eintragung der Verschmelzung in das Register des Sitzes desjenigen Rechtsträgers, dessen Gläubiger sie sind, nach § 19 Abs. 3 UmwG als bekannt gemacht gilt, ihren Anspruch nach Grund und Höhe in Textform anmelden, Sicherheit zu leisten, soweit sie nicht Befriedigung verlangen können. Dieses Recht steht den Gläubigern jedoch nur zu, wenn sie glaubhaft machen, dass durch die Verschmelzung die Erfüllung ihrer Forderung gefährdet wird."
    },
    {
      "date": "2025-07-30",
      "id": "118191",
      "original_text": "Löschungsankündigung\nBayern Amtsgericht München HRB 254690\nUTL Trans-Rent UG (haftungsbeschränkt) – München",
      "type": "Löschungsankündigung",
      "state": "Bayern",
      "amtsgericht": "Amtsgericht München",
      "registernummer": "HRB 254690",
      "registerart": "HRB",
      "company_name": "UTL Trans-Rent UG (haftungsbeschränkt)",
      "company_seat": "München",
      "details": "30.07.2025 (Bekanntmachungsdatum)\n\nBayern Amtsgericht München HRB 254690\nLöschungsankündigung\n\nUTL Trans-Rent UG (haftungsbeschränkt)\nGesellschaft mit beschränkter Haftung\nMünchen\n\nDas Registergericht beabsichtigt, die im Handelsregister eingetragene Gesellschaft wegen Vermögenslosigkeit von Amts wegen nach § 394 FamFG zu löschen. Die Frist zur Erhebung eines Widerspruchs ist auf drei Monate festgesetzt. Dem #Re.Name ist eine Liste der Mitglieder des Aufsichtsrats eingereicht worden, § 52 Abs. 3 S. 2 GmbHG."
    },
    {
      "date": "2025-07-30",
      "id": "118192",
      "original_text": "Registerbekanntmachung nach dem Umwandlungsgesetz\nBayern Amtsgericht München HRA 59962\nTrachten-Stube \"Inge\" Inh. Isabella Oswald e.K. – Penzberg",
      "type": "Registerbekanntmachung nach dem Umwandlungsgesetz",
      "state": "Bayern",
      "amtsgericht": "Amtsgericht München",
      "registernummer": "HRA 59962",
      "registerart": "HRA",
      "company_name": "Trachten-Stube \"Inge\" Inh. Isabella Oswald e.K.",
      "company_seat": "Penzberg",
      "details": "30.07.2025 (Bekanntmachungsdatum)\n\nBayern Amtsgericht München HRA 59962\nRegisterbekanntmachung nach dem Umwandlungsgesetz 29.07.2025 (Eintragungsdatum)\n\nTrachten-Stube \"Inge\" Inh. Isabella Oswald e.K.\nEinzelkaufmann / Einzelkauffrau\nPenzberg\n\nDen Gläubigern der an der Ausgliederung beteiligten Rechtsträger ist, wenn sie binnen sechs Monaten nach dem Tag, an dem die Eintragung der Ausgliederung in das Register des Sitzes desjenigen Rechtsträgers, dessen Gläubiger sie sind, nach §§ 125, 19 Abs. 3 UmwG als bekannt gemacht gilt, ihren Anspruch nach Grund und Höhe in Textform anmelden, Sicherheit zu leisten, soweit sie nicht Befriedigung verlangen können. Dieses Recht steht den Gläubigern jedoch nur zu, wenn sie glaubhaft machen, dass durch die Ausgliederung die Erfüllung ihrer Forderung gefährdet wird."
    },
    {
      "date": "2025-07-30",
      "id": "118193",
      "original_text": "Registerbekanntmachung nach dem Umwandlungsgesetz\nBayern Amtsgericht Bamberg HRB 3084\nSPIE KAT GmbH – Haßfurt",
      "type": "Registerbekanntmachung nach dem Umwandlungsgesetz",
      "state": "Bayern",
      "amtsgericht": "Amtsgericht Bamberg",
      "registernummer": "HRB 3084",
      "registerart": "HRB",
      "company_name": "SPIE KAT GmbH",
      "company_seat": "Haßfurt",
      "details": "30.07.2025 (Bekanntmachungsdatum)\n\nBayern Amtsgericht Bamberg HRB 3084\nRegisterbekanntmachung nach dem Umwandlungsgesetz 28.07.2025 (Eintragungsdatum)\n\nSPIE KAT GmbH\nGesellschaft mit beschränkter Haftung\nHaßfurt\n\nDen Gläubigern der an der Verschmelzung beteiligten Rechtsträger ist, wenn sie binnen sechs Monaten nach dem Tag, an dem die Eintragung der Verschmelzung in das Register des Sitzes desjenigen Rechtsträgers, dessen Gläubiger sie sind, nach § 19 Abs. 3 UmwG als bekannt gemacht gilt, ihren Anspruch nach Grund und Höhe in Textform anmelden, Sicherheit zu leisten, soweit sie nicht Befriedigung verlangen können. Dieses Recht steht den Gläubigern jedoch nur zu, wenn sie glaubhaft machen, dass durch die Verschmelzung die Erfüllung ihrer Forderung gefährdet wird."
    },
    {
      "date": "2025-07-30",
      "id": "118194",
      "original_text": "Löschungsankündigung\nBayern Amtsgericht München HRB 285645\nM.Gaz UG (haftungsbeschränkt) – München",
      "type": "Löschungsankündigung",
      "state": "Bayern",
      "amtsgericht": "Amtsgericht München",
      "registernummer": "HRB 285645",
      "registerart": "HRB",
      "company_name": "M.Gaz UG (haftungsbeschränkt)",
      "company_seat": "München",
      "details": "30.07.2025 (Bekanntmachungsdatum)\n\nBayern Amtsgericht München HRB 285645\nLöschungsankündigung 29.07.2025 (Eintragungsdatum)\n\nM.Gaz UG (haftungsbeschränkt)\nGesellschaft mit beschränkter Haftung\nMünchen\n\nDas Registergericht beabsichtigt, die im Handelsregister eingetragene Gesellschaft wegen Vermögenslosigkeit von Amts wegen nach § 394 FamFG zu löschen. Die Frist zur Erhebung eines Widerspruchs ist auf drei Monate festgesetzt."
    },
    {
      "date": "2025-07-30",
      "id": "118195",
      "original_text": "Registerbekanntmachung nach dem Umwandlungsgesetz\nBayern Amtsgericht München HRB 170754\nAroma Trading GmbH – München",
      "type": "Registerbekanntmachung nach dem Umwandlungsgesetz",
      "state": "Bayern",
      "amtsgericht": "Amtsgericht München",
      "registernummer": "HRB 170754",
      "registerart": "HRB",
      "company_name": "Aroma Trading GmbH",
      "company_seat": "München",
      "details": "30.07.2025 (Bekanntmachungsdatum)\n\nBayern Amtsgericht München HRB 170754\nRegisterbekanntmachung nach dem Umwandlungsgesetz 29.07.2025 (Eintragungsdatum)\n\nAroma Trading GmbH\nGesellschaft mit beschränkter Haftung\nMünchen\n\nDen Gläubigern der an der Verschmelzung beteiligten Rechtsträger ist, wenn sie binnen sechs Monaten nach dem Tag, an dem die Eintragung der Verschmelzung in das Register des Sitzes desjenigen Rechtsträgers, dessen Gläubiger sie sind, nach § 19 Abs. 3 UmwG als bekannt gemacht gilt, ihren Anspruch nach Grund und Höhe in Textform anmelden, Sicherheit zu leisten, soweit sie nicht Befriedigung verlangen können. Dieses Recht steht den Gläubigern jedoch nur zu, wenn sie glaubhaft machen, dass durch die Verschmelzung die Erfüllung ihrer Forderung gefährdet wird."
    },
    {
      "date": "2025-07-30",
      "id": "118196",
      "original_text": "Einreichung neuer Dokumente\nBayern Amtsgericht München HRB 162137\nBlue Cap AG – München",
      "type": "Einreichung neuer Dokumente",
      "state": "Bayern",
      "amtsgericht": "Amtsgericht München",
      "registernummer": "HRB 162137",
      "registerart": "HRB",
      "company_name": "Blue Cap AG",
      "company_seat": "München",
      "details": "30.07.2025 (Bekanntmachungsdatum)\n\nBayern Amtsgericht München HRB 162137\nEinreichung neuer Dokumente\n\nBlue Cap AG\nAktiengesellschaft\nMünchen\n\nDem Amtsgericht München -Registergericht- ist eine Liste der Mitglieder des Aufsichtsrats eingereicht worden, § 106 AktG."
    },
    {
      "date": "2025-07-30",
      "id": "118197",
      "original_text": "Registerbekanntmachung nach dem Umwandlungsgesetz\nBayern Amtsgericht Augsburg HRA 21931\nHarald Münzinger e. K. – Harburg (Schwaben)",
      "type": "Registerbekanntmachung nach dem Umwandlungsgesetz",
      "state": "Bayern",
      "amtsgericht": "Amtsgericht Augsburg",
      "registernummer": "HRA 21931",
      "registerart": "HRA",
      "company_name": "Harald Münzinger e. K.",
      "company_seat": "Harburg (Schwaben)",
      "details": "30.07.2025 (Bekanntmachungsdatum)\n\nBayern Amtsgericht Augsburg HRA 21931\nRegisterbekanntmachung nach dem Umwandlungsgesetz 29.07.2025 (Eintragungsdatum)\n\nHarald Münzinger e. K.\nEinzelkaufmann / Einzelkauffrau\nHarburg (Schwaben)\n\nDen Gläubigern der an der Ausgliederung beteiligten Rechtsträger ist, wenn sie binnen sechs Monaten nach dem Tag, an dem die Eintragung der Ausgliederung in das Register des Sitzes desjenigen Rechtsträgers, dessen Gläubiger sie sind, nach §§ 125, 19 Abs. 3 UmwG als bekannt gemacht gilt, ihren Anspruch nach Grund und Höhe in Textform anmelden, Sicherheit zu leisten, soweit sie nicht Befriedigung verlangen können. Dieses Recht steht den Gläubigern jedoch nur zu, wenn sie glaubhaft machen, dass durch die Ausgliederung die Erfüllung ihrer Forderung gefährdet wird."
    },
    {
      "date": "2025-07-30",
      "id": "118198",
      "original_text": "Löschungsankündigung\nBayern Amtsgericht Fürth HRB 21172\nFocus GmbH – Fürth",
      "type": "Löschungsankündigung",
      "state": "Bayern",
      "amtsgericht": "Amtsgericht Fürth",
      "registernummer": "HRB 21172",
      "registerart": "HRB",
      "company_name": "Focus GmbH",
      "company_seat": "Fürth",
      "details": "30.07.2025 (Bekanntmachungsdatum)\n\nBayern Amtsgericht Fürth HRB 21172\nLöschungsankündigung\n\nFocus GmbH\nGesellschaft mit beschränkter Haftung\nFürth\n\nDas Registergericht beabsichtigt, die im Handelsregister eingetragene Gesellschaft wegen Vermögenslosigkeit von Amts wegen nach § 394 FamFG zu löschen. Die Frist zur Erhebung eines Widerspruchs ist auf drei Monate festgesetzt."
    },
    {
      "date": "2025-07-30",
      "id": "118199",
      "original_text": "Registerbekanntmachung nach dem Umwandlungsgesetz\nBayern Amtsgericht München HRB 218329\nAmmersee-Communication GmbH – Germering",
      "type": "Registerbekanntmachung nach dem Umwandlungsgesetz",
      "state": "Bayern",
      "amtsgericht": "Amtsgericht München",
      "registernummer": "HRB 218329",
      "registerart": "HRB",
      "company_name": "Ammersee-Communication GmbH",
      "company_seat": "Germering",
      "details": "30.07.2025 (Bekanntmachungsdatum)\n\nBayern Amtsgericht München HRB 218329\nRegisterbekanntmachung nach dem Umwandlungsgesetz 29.07.2025 (Eintragungsdatum)\n\nAmmersee-Communication GmbH\nGesellschaft mit beschränkter Haftung\nGermering\n\nDen Gläubigern der an der Verschmelzung beteiligten Rechtsträger ist, wenn sie binnen sechs Monaten nach dem Tag, an dem die Eintragung der Verschmelzung in das Register des Sitzes desjenigen Rechtsträgers, dessen Gläubiger sie sind, nach § 19 Abs. 3 UmwG als bekannt gemacht gilt, ihren Anspruch nach Grund und Höhe in Textform anmelden, Sicherheit zu leisten, soweit sie nicht Befriedigung verlangen können. Dieses Recht steht den Gläubigern jedoch nur zu, wenn sie glaubhaft machen, dass durch die Verschmelzung die Erfüllung ihrer Forderung gefährdet wird."
    },
    {
      "date": "2025-07-30",
      "id": "118200",
      "original_text": "Löschungsankündigung\nBayern Amtsgericht Traunstein HRB 27319\nMiTa Bau GmbH – Trostberg",
      "type": "Löschungsankündigung",
      "state": "Bayern",
      "amtsgericht": "Amtsgericht Traunstein",
      "registernummer": "HRB 27319",
      "registerart": "HRB",
      "company_name": "MiTa Bau GmbH",
      "company_seat": "Trostberg",
      "details": "30.07.2025 (Bekanntmachungsdatum)\n\nBayern Amtsgericht Traunstein HRB 27319\nLöschungsankündigung\n\nMiTa Bau GmbH\nGesellschaft mit beschränkter Haftung\nTrostberg\n\nDas Registergericht beabsichtigt, die im Handelsregister eingetragene Gesellschaft wegen Vermögenslosigkeit von Amts wegen nach § 394 FamFG zu löschen. Die Frist zur Erhebung eines Widerspruchs ist auf einen Monat festgesetzt."
    },
    {
      "date": "2025-07-30",
      "id": "118201",
      "original_text": "Registerbekanntmachung nach dem Umwandlungsgesetz\nBayern Amtsgericht München HRB 276011\nISEP Healthcare GmbH – München",
      "type": "Registerbekanntmachung nach dem Umwandlungsgesetz",
      "state": "Bayern",
      "amtsgericht": "Amtsgericht München",
      "registernummer": "HRB 276011",
      "registerart": "HRB",
      "company_name": "ISEP Healthcare GmbH",
      "company_seat": "München",
      "details": "30.07.2025 (Bekanntmachungsdatum)\n\nBayern Amtsgericht München HRB 276011\nRegisterbekanntmachung nach dem Umwandlungsgesetz 29.07.2025 (Eintragungsdatum)\n\nISEP Healthcare GmbH\nGesellschaft mit beschränkter Haftung\nMünchen\n\nDen Gläubigern der an der Verschmelzung beteiligten Rechtsträger ist, wenn sie binnen sechs Monaten nach dem Tag, an dem die Eintragung der Verschmelzung in das Register des Sitzes desjenigen Rechtsträgers, dessen Gläubiger sie sind, nach § 19 Abs. 3 UmwG als bekannt gemacht gilt, ihren Anspruch nach Grund und Höhe in Textform anmelden, Sicherheit zu leisten, soweit sie nicht Befriedigung verlangen können. Dieses Recht steht den Gläubigern jedoch nur zu, wenn sie glaubhaft machen, dass durch die Verschmelzung die Erfüllung ihrer Forderung gefährdet wird."
    },
    {
      "date": "2025-07-30",
      "id": "118202",
      "original_text": "Registerbekanntmachung nach dem Umwandlungsgesetz\nBayern Amtsgericht Traunstein HRB 18049\nKWH Netz GmbH – Haag i.OB",
      "type": "Registerbekanntmachung nach dem Umwandlungsgesetz",
      "state": "Bayern",
      "amtsgericht": "Amtsgericht Traunstein",
      "registernummer": "HRB 18049",
      "registerart": "HRB",
      "company_name": "KWH Netz GmbH",
      "company_seat": "Haag i.OB",
      "details": "30.07.2025 (Bekanntmachungsdatum)\n\nBayern Amtsgericht Traunstein HRB 18049\nRegisterbekanntmachung nach dem Umwandlungsgesetz 29.07.2025 (Eintragungsdatum)\n\nKWH Netz GmbH\nGesellschaft mit beschränkter Haftung\nHaag i.OB\n\nDen Gläubigern der an der Verschmelzung beteiligten Rechtsträger ist, wenn sie binnen sechs Monaten nach dem Tag, an dem die Eintragung der Verschmelzung in das Register des Sitzes desjenigen Rechtsträgers, dessen Gläubiger sie sind, nach § 19 Abs. 3 UmwG als bekannt gemacht gilt, ihren Anspruch nach Grund und Höhe in Textform anmelden, Sicherheit zu leisten, soweit sie nicht Befriedigung verlangen können. Dieses Recht steht den Gläubigern jedoch nur zu, wenn sie glaubhaft machen, dass durch die Verschmelzung die Erfüllung ihrer Forderung gefährdet wird."
    },
    {
      "date": "2025-07-30",
      "id": "118203",
      "original_text": "Einreichung neuer Dokumente\nBayern Amtsgericht München HRB 140669\nWavestone Germany AG – München",
      "type": "Einreichung neuer Dokumente",
      "state": "Bayern",
      "amtsgericht": "Amtsgericht München",
      "registernummer": "HRB 140669",
      "registerart": "HRB",
      "company_name": "Wavestone Germany AG",
      "company_seat": "München",
      "details": "30.07.2025 (Bekanntmachungsdatum)\n\nBayern Amtsgericht München HRB 140669\nEinreichung neuer Dokumente\n\nWavestone Germany AG\nAktiengesellschaft\nMünchen\n\nDem Amtsgericht München -Registergericht- ist eine Liste der Mitglieder des Aufsichtsrats eingereicht worden, § 106 AktG."
    },
    {
      "date": "2025-07-30",
      "id": "118204",
      "original_text": "Registerbekanntmachung nach dem Umwandlungsgesetz\nBayern Amtsgericht Augsburg HRA 19157\nLeDo Baustoffe GmbH & Co. KG – Nordendorf",
      "type": "Registerbekanntmachung nach dem Umwandlungsgesetz",
      "state": "Bayern",
      "amtsgericht": "Amtsgericht Augsburg",
      "registernummer": "HRA 19157",
      "registerart": "HRA",
      "company_name": "LeDo Baustoffe GmbH & Co. KG",
      "company_seat": "Nordendorf",
      "details": "30.07.2025 (Bekanntmachungsdatum)\n\nBayern Amtsgericht Augsburg HRA 19157\nRegisterbekanntmachung nach dem Umwandlungsgesetz 29.07.2025 (Eintragungsdatum)\n\nLeDo Baustoffe GmbH & Co. KG\nKommanditgesellschaft\nNordendorf\n\nDen Gläubigern der an der Verschmelzung beteiligten Rechtsträger ist, wenn sie binnen sechs Monaten nach dem Tag, an dem die Eintragung der Verschmelzung in das Register des Sitzes desjenigen Rechtsträgers, dessen Gläubiger sie sind, nach § 19 Abs. 3 UmwG als bekannt gemacht gilt, ihren Anspruch nach Grund und Höhe in Textform anmelden, Sicherheit zu leisten, soweit sie nicht Befriedigung verlangen können. Dieses Recht steht den Gläubigern jedoch nur zu, wenn sie glaubhaft machen, dass durch die Verschmelzung die Erfüllung ihrer Forderung gefährdet wird."
    },
    {
      "date": "2025-07-30",
      "id": "118205",
      "original_text": "Löschungsankündigung\nBayern Amtsgericht Augsburg HRB 33949\nLW-Shops UG (haftungsbeschränkt) – Augsburg",
      "type": "Löschungsankündigung",
      "state": "Bayern",
      "amtsgericht": "Amtsgericht Augsburg",
      "registernummer": "HRB 33949",
      "registerart": "HRB",
      "company_name": "LW-Shops UG (haftungsbeschränkt)",
      "company_seat": "Augsburg",
      "details": "30.07.2025 (Bekanntmachungsdatum)\n\nBayern Amtsgericht Augsburg HRB 33949\nLöschungsankündigung\n\nLW-Shops UG (haftungsbeschränkt)\nGesellschaft mit beschränkter Haftung\nAugsburg\n\nDas Registergericht beabsichtigt, die im Handelsregister eingetragene Gesellschaft wegen Vermögenslosigkeit von Amts wegen nach § 394 FamFG zu löschen. Die Frist zur Erhebung eines Widerspruchs ist auf einen Monat festgesetzt."
    },
    {
      "date": "2025-07-30",
      "id": "118206",
      "original_text": "Registerbekanntmachung nach dem Umwandlungsgesetz\nBayern Amtsgericht Nürnberg HRB 40878\nJoh. Leupold GmbH – Schwabach",
      "type": "Registerbekanntmachung nach dem Umwandlungsgesetz",
      "state": "Bayern",
      "amtsgericht": "Amtsgericht Nürnberg",
      "registernummer": "HRB 40878",
      "registerart": "HRB",
      "company_name": "Joh. Leupold GmbH",
      "company_seat": "Schwabach",
      "details": "30.07.2025 (Bekanntmachungsdatum)\n\nBayern Amtsgericht Nürnberg HRB 40878\nRegisterbekanntmachung nach dem Umwandlungsgesetz 29.07.2025 (Eintragungsdatum)\n\nJoh. Leupold GmbH\nGesellschaft mit beschränkter Haftung\nSchwabach\n\nDen Gläubigern der an der Verschmelzung beteiligten Rechtsträger ist, wenn sie binnen sechs Monaten nach dem Tag, an dem die Eintragung der Verschmelzung in das Register des Sitzes desjenigen Rechtsträgers, dessen Gläubiger sie sind, nach § 19 Abs. 3 UmwG als bekannt gemacht gilt, ihren Anspruch nach Grund und Höhe in Textform anmelden, Sicherheit zu leisten, soweit sie nicht Befriedigung verlangen können. Dieses Recht steht den Gläubigern jedoch nur zu, wenn sie glaubhaft machen, dass durch die Verschmelzung die Erfüllung ihrer Forderung gefährdet wird."
    },
    {
      "date": "2025-07-30",
      "id": "118207",
      "original_text": "Registerbekanntmachung nach dem Umwandlungsgesetz\nBayern Amtsgericht Nürnberg HRB 27368\nContis Verwaltungs GmbH – Nürnberg",
      "type": "Registerbekanntmachung nach dem Umwandlungsgesetz",
      "state": "Bayern",
      "amtsgericht": "Amtsgericht Nürnberg",
      "registernummer": "HRB 27368",
      "registerart": "HRB",
      "company_name": "Contis Verwaltungs GmbH",
      "company_seat": "Nürnberg",
      "details": "30.07.2025 (Bekanntmachungsdatum)\n\nBayern Amtsgericht Nürnberg HRB 27368\nRegisterbekanntmachung nach dem Umwandlungsgesetz 29.07.2025 (Eintragungsdatum)\n\nContis Verwaltungs GmbH\nGesellschaft mit beschränkter Haftung\nNürnberg\n\nDen Gläubigern der an der Verschmelzung beteiligten Rechtsträger ist, wenn sie binnen sechs Monaten nach dem Tag, an dem die Eintragung der Verschmelzung in das Register des Sitzes desjenigen Rechtsträgers, dessen Gläubiger sie sind, nach § 19 Abs. 3 UmwG als bekannt gemacht gilt, ihren Anspruch nach Grund und Höhe in Textform anmelden, Sicherheit zu leisten, soweit sie nicht Befriedigung verlangen können. Dieses Recht steht den Gläubigern jedoch nur zu, wenn sie glaubhaft machen, dass durch die Verschmelzung die Erfüllung ihrer Forderung gefährdet wird."
    },
    {
      "date": "2025-07-30",
      "id": "118208",
      "original_text": "Sonstige Registerbekanntmachung\nBayern Amtsgericht Nürnberg GnR 374\nID eG – Nürnberg",
      "type": "Sonstige Registerbekanntmachung",
      "state": "Bayern",
      "amtsgericht": "Amtsgericht Nürnberg",
      "registernummer": "GnR 374",
      "registerart": "GnR",
      "company_name": "ID eG",
      "company_seat": "Nürnberg",
      "details": "30.07.2025 (Bekanntmachungsdatum)\n\nBayern Amtsgericht Nürnberg GnR 374\nSonstige Registerbekanntmachung 29.07.2025 (Eintragungsdatum)\n\nID eG\neingetragene Genossenschaft\nNürnberg\n\nDie Generalversammlung vom 25.06.2024 hat die Änderung der Satzung beschlossen. Geändert wurde u.a. § 37 (Geschäftsanteil und Geschäftsguthaben).\nNeuer Text: § 37 Geschäftsanteil und Geschäftsguthaben\n1. Ein Geschäftsanteil beträgt grundsätzlich 500 €.\na. Menschen, die Lösungen zur Speicherung, Betrieb und Verwaltung ihrer eigenen qualifizierten digitalen Identität nutzen möchten,\nkönnen mindestens einen Geschäftsanteil zeichnen.\nb. Juristischen Personen, Personengesellschaften, Organisationen, Kommunen, öffentliche Stellen aller Art, Verbände und Anstalten\ndes öffentlichen Rechts sowie Berater mit Qualifikationen nach derGewO müssen immer mindestens 10 Geschäftsanteile zeichnen.\nc. Beide Mindestzeichnungen können von der Generalversammlung mit einfacher Mehrheit verändert werden.\n2.Geschäftsanteile sind sofort einzuzahlen...\nNicht eingetragen: Den Gläubigern der Genossenschaft ist gemäß § 22 GenG, wenn sie sich binnen sechs Monaten nach der Bekanntmachung bei der Genossenschaft zu diesem Zweck melden, Sicherheit zu leisten, soweit sie nicht Befriedigung verlangen können."
    },
    {
      "date": "2025-07-30",
      "id": "118209",
      "original_text": "Registerbekanntmachung nach dem Umwandlungsgesetz\nBayern Amtsgericht Coburg HRB 6357\nBAE GmbH – Coburg",
      "type": "Registerbekanntmachung nach dem Umwandlungsgesetz",
      "state": "Bayern",
      "amtsgericht": "Amtsgericht Coburg",
      "registernummer": "HRB 6357",
      "registerart": "HRB",
      "company_name": "BAE GmbH",
      "company_seat": "Coburg",
      "details": "30.07.2025 (Bekanntmachungsdatum)\n\nBayern Amtsgericht Coburg HRB 6357\nRegisterbekanntmachung nach dem Umwandlungsgesetz 25.07.2025 (Eintragungsdatum)\n\nBAE GmbH\nGesellschaft mit beschränkter Haftung\nCoburg\n\nDen Gläubigern der an der Verschmelzung beteiligten Rechtsträger ist, wenn sie binnen sechs Monaten nach dem Tag, an dem die Eintragung der Verschmelzung in das Register des Sitzes desjenigen Rechtsträgers, dessen Gläubiger sie sind, nach § 19 Abs. 3 UmwG als bekannt gemacht gilt, ihren Anspruch nach Grund und Höhe in Textform anmelden, Sicherheit zu leisten, soweit sie nicht Befriedigung verlangen können. Dieses Recht steht den Gläubigern jedoch nur zu, wenn sie glaubhaft machen, dass durch die Verschmelzung die Erfüllung ihrer Forderung gefährdet wird."
    },
    {
      "date": "2025-07-30",
      "id": "118210",
      "original_text": "Registerbekanntmachung nach dem Umwandlungsgesetz\nBayern Amtsgericht Augsburg HRB 23648\nEUROWIG AG – Thierhaupten",
      "type": "Registerbekanntmachung nach dem Umwandlungsgesetz",
      "state": "Bayern",
      "amtsgericht": "Amtsgericht Augsburg",
      "registernummer": "HRB 23648",
      "registerart": "HRB",
      "company_name": "EUROWIG AG",
      "company_seat": "Thierhaupten",
      "details": "30.07.2025 (Bekanntmachungsdatum)\n\nBayern Amtsgericht Augsburg HRB 23648\nRegisterbekanntmachung nach dem Umwandlungsgesetz 17.07.2025 (Eintragungsdatum)\n\nEUROWIG AG\nAktiengesellschaft\nThierhaupten\n\nDen Gläubigern des formwechselnden Rechtsträgers ist, wenn sie binnen sechs Monaten nach dem Tag, an dem die Eintragung des Formwechsels nach § 201 UmwG als bekannt gemacht gilt, ihren Anspruch nach Grund und Höhe in Textform anmelden, Sicherheit zu leisten, soweit sie nicht Befriedigung verlangen können. Dieses Recht steht den Gläubigern jedoch nur zu, wenn sie glaubhaft machen, dass durch den Formwechsel die Erfüllung ihrer Forderung gefährdet wird."
    },
    {
      "date": "2025-07-30",
      "id": "118211",
      "original_text": "Sonstige Registerbekanntmachung\nBayern Amtsgericht Aschaffenburg HRB 15516\nVISIORY Property GmbH – Glattbach",
      "type": "Sonstige Registerbekanntmachung",
      "state": "Bayern",
      "amtsgericht": "Amtsgericht Aschaffenburg",
      "registernummer": "HRB 15516",
      "registerart": "HRB",
      "company_name": "VISIORY Property GmbH",
      "company_seat": "Glattbach",
      "details": "30.07.2025 (Bekanntmachungsdatum)\n\nBayern Amtsgericht Aschaffenburg HRB 15516\nSonstige Registerbekanntmachung 29.07.2025 (Eintragungsdatum)\n\nVISIORY Property GmbH\nGesellschaft mit beschränkter Haftung\nGlattbach\n\nDen Gläubigern der Gesellschaft, deren Forderungen begründet worden sind, bevor die Eintragung der Beendigung des Gewinnabführungsvertrages in das Handelsregister nach § 10 des Handelsgesetzbuches als bekanntgemacht gilt, hat der andere Vertragsteil Sicherheit zu leisten, wenn sie sich binnen sechs Monaten nach der Bekanntmachung der Eintragung zu diesem Zweck bei ihm melden."
    },
    {
      "date": "2025-07-30",
      "id": "118212",
      "original_text": "Löschungsankündigung\nBayern Amtsgericht Nürnberg HRB 21806\nRoyal Autovermietung-Leasing GmbH – Nürnberg",
      "type": "Löschungsankündigung",
      "state": "Bayern",
      "amtsgericht": "Amtsgericht Nürnberg",
      "registernummer": "HRB 21806",
      "registerart": "HRB",
      "company_name": "Royal Autovermietung-Leasing GmbH",
      "company_seat": "Nürnberg",
      "details": "30.07.2025 (Bekanntmachungsdatum)\n\nBayern Amtsgericht Nürnberg HRB 21806\nLöschungsankündigung\n\nRoyal Autovermietung-Leasing GmbH\nGesellschaft mit beschränkter Haftung\nNürnberg\n\nDas Registergericht beabsichtigt, die im Handelsregister eingetragene Gesellschaft wegen Vermögenslosigkeit von Amts wegen nach § 394 FamFG zu löschen. Die Frist zur Erhebung eines Widerspruchs ist auf einen Monat festgesetzt."
    },
    {
      "date": "2025-07-30",
      "id": "118213",
      "original_text": "Registerbekanntmachung nach dem Umwandlungsgesetz\nBayern Amtsgericht München HRB 258670\nAmedov Holding UG (haftungsbeschränkt) – München",
      "type": "Registerbekanntmachung nach dem Umwandlungsgesetz",
      "state": "Bayern",
      "amtsgericht": "Amtsgericht München",
      "registernummer": "HRB 258670",
      "registerart": "HRB",
      "company_name": "Amedov Holding UG (haftungsbeschränkt)",
      "company_seat": "München",
      "details": "30.07.2025 (Bekanntmachungsdatum)\n\nBayern Amtsgericht München HRB 258670\nRegisterbekanntmachung nach dem Umwandlungsgesetz 29.07.2025 (Eintragungsdatum)\n\nAmedov Holding UG (haftungsbeschränkt)\nGesellschaft mit beschränkter Haftung\nMünchen\n\nDen Gläubigern der an der Verschmelzung beteiligten Rechtsträger ist, wenn sie binnen sechs Monaten nach dem Tag, an dem die Eintragung der Verschmelzung in das Register des Sitzes desjenigen Rechtsträgers, dessen Gläubiger sie sind, nach § 19 Abs. 3 UmwG als bekannt gemacht gilt, ihren Anspruch nach Grund und Höhe in Textform anmelden, Sicherheit zu leisten, soweit sie nicht Befriedigung verlangen können. Dieses Recht steht den Gläubigern jedoch nur zu, wenn sie glaubhaft machen, dass durch die Verschmelzung die Erfüllung ihrer Forderung gefährdet wird."
    },
    {
      "date": "2025-07-30",
      "id": "118214",
      "original_text": "Registerbekanntmachung nach dem Umwandlungsgesetz\nBayern Amtsgericht München HRB 303955\nMerl.Neiser.Maier Steuerberatungsgesellschaft mbH – Grasbrunn",
      "type": "Registerbekanntmachung nach dem Umwandlungsgesetz",
      "state": "Bayern",
      "amtsgericht": "Amtsgericht München",
      "registernummer": "HRB 303955",
      "registerart": "HRB",
      "company_name": "Merl.Neiser.Maier Steuerberatungsgesellschaft mbH",
      "company_seat": "Grasbrunn",
      "details": "30.07.2025 (Bekanntmachungsdatum)\n\nBayern Amtsgericht München HRB 303955\nRegisterbekanntmachung nach dem Umwandlungsgesetz 29.07.2025 (Eintragungsdatum)\n\nMerl.Neiser.Maier Steuerberatungsgesellschaft mbH\nGesellschaft mit beschränkter Haftung\nGrasbrunn\n\nDen Gläubigern der an der Verschmelzung beteiligten Rechtsträger ist, wenn sie binnen sechs Monaten nach dem Tag, an dem die Eintragung der Verschmelzung in das Register des Sitzes desjenigen Rechtsträgers, dessen Gläubiger sie sind, nach § 19 Abs. 3 UmwG als bekannt gemacht gilt, ihren Anspruch nach Grund und Höhe in Textform anmelden, Sicherheit zu leisten, soweit sie nicht Befriedigung verlangen können. Dieses Recht steht den Gläubigern jedoch nur zu, wenn sie glaubhaft machen, dass durch die Verschmelzung die Erfüllung ihrer Forderung gefährdet wird."
    },
    {
      "date": "2025-07-30",
      "id": "118215",
      "original_text": "Registerbekanntmachung nach dem Umwandlungsgesetz\nBayern Amtsgericht Landshut HRB 7776\nWEKO-Küchenfachmarkt Verwaltungs GmbH – Pfarrkirchen",
      "type": "Registerbekanntmachung nach dem Umwandlungsgesetz",
      "state": "Bayern",
      "amtsgericht": "Amtsgericht Landshut",
      "registernummer": "HRB 7776",
      "registerart": "HRB",
      "company_name": "WEKO-Küchenfachmarkt Verwaltungs GmbH",
      "company_seat": "Pfarrkirchen",
      "details": "30.07.2025 (Bekanntmachungsdatum)\n\nBayern Amtsgericht Landshut HRB 7776\nRegisterbekanntmachung nach dem Umwandlungsgesetz 29.07.2025 (Eintragungsdatum)\n\nWEKO-Küchenfachmarkt Verwaltungs GmbH\nGesellschaft mit beschränkter Haftung\nPfarrkirchen\n\nDen Gläubigern der an der Verschmelzung beteiligten Rechtsträger ist, wenn sie binnen sechs Monaten nach dem Tag, an dem die Eintragung der Verschmelzung in das Register des Sitzes desjenigen Rechtsträgers, dessen Gläubiger sie sind, nach § 19 Abs. 3 UmwG als bekannt gemacht gilt, ihren Anspruch nach Grund und Höhe in Textform anmelden, Sicherheit zu leisten, soweit sie nicht Befriedigung verlangen können. Dieses Recht steht den Gläubigern jedoch nur zu, wenn sie glaubhaft machen, dass durch die Verschmelzung die Erfüllung ihrer Forderung gefährdet wird."
    },
    {
      "date": "2025-07-30",
      "id": "118216",
      "original_text": "Registerbekanntmachung nach dem Umwandlungsgesetz\nBayern Amtsgericht München HRB 276103\nISP Healthcare GmbH – München",
      "type": "Registerbekanntmachung nach dem Umwandlungsgesetz",
      "state": "Bayern",
      "amtsgericht": "Amtsgericht München",
      "registernummer": "HRB 276103",
      "registerart": "HRB",
      "company_name": "ISP Healthcare GmbH",
      "company_seat": "München",
      "details": "30.07.2025 (Bekanntmachungsdatum)\n\nBayern Amtsgericht München HRB 276103\nRegisterbekanntmachung nach dem Umwandlungsgesetz 29.07.2025 (Eintragungsdatum)\n\nISP Healthcare GmbH\nGesellschaft mit beschränkter Haftung\nMünchen\n\nDen Gläubigern #dv.auswahl(Text=\"Bitte zutreffendes auswählen:\",Eingabe=\n\n\"der an der Verschmelzung beteiligten Rechtsträger ist, wenn sie binnen sechs Monaten nach dem Tag, an dem die Eintragung der Verschmelzung in das Register des Sitzes desjenigen Rechtsträgers, dessen Gläubiger sie sind, nach § 19 Abs. 3 UmwG als bekannt gemacht gilt, ihren Anspruch nach Grund und Höhe in Textform anmelden, Sicherheit zu leisten, soweit sie nicht Befriedigung verlangen können. Dieses Recht steht den Gläubigern jedoch nur zu, wenn sie glaubhaft machen, dass durch die Verschmelzung die Erfüllung ihrer Forderung gefährdet wird.\"|\"Verschmelzung\",\n\n\"der an der Spaltung beteiligten Rechtsträger ist, wenn sie binnen sechs Monaten nach dem Tag, an dem die Eintragung der Spaltung in das Register des Sitzes desjenigen Rechtsträgers, dessen Gläubiger sie sind, nach §§ 125, 19 Abs. 3 UmwG als bekannt gemacht gilt, ihren Anspruch nach Grund und Höhe in Textform anmelden, Sicherheit zu leisten, soweit sie nicht Befriedigung verlangen können. Dieses Recht steht den Gläubigern jedoch nur zu, wenn sie glaubhaft machen, dass durch die Spaltung die Erfüllung ihrer Forderung gefährdet wird.\"|\"Spaltung\",\n\n\"des formwechselnden Rechtsträgers ist, wenn sie binnen sechs Monaten nach dem Tag, an dem die Eintragung des Formwechsels nach § 201 UmwG als bekannt gemacht gilt, ihren Anspruch nach Grund und Höhe in Textform anmelden, Sicherheit zu leisten, soweit sie nicht Befriedigung verlangen können. Dieses Recht steht den Gläubigern jedoch nur zu, wenn sie glaubhaft machen, dass durch den Formwechsel die Erfüllung ihrer Forderung gefährdet wird.\"|\"formwechselnde Umwandlung\",\n\n\"der an der Ausgliederung beteiligten Rechtsträger ist, wenn sie binnen sechs Monaten nach dem Tag, an dem die Eintragung der Ausgliederung in das Register des Sitzes desjenigen Rechtsträgers, dessen Gläubiger sie sind, nach §§ 125, 19 Abs. 3 UmwG als bekannt gemacht gilt, ihren Anspruch nach Grund und Höhe in Textform anmelden, Sicherheit zu leisten, soweit sie nicht Befriedigung verlangen können. Dieses Recht steht den Gläubigern jedoch nur zu, wenn sie glaubhaft machen, dass durch die Ausgliederung die Erfüllung ihrer Forderung gefährdet wird.\"|\"Ausgliederung\")"
    },
    {
      "date": "2025-07-30",
      "id": "118217",
      "original_text": "Registerbekanntmachung nach dem Umwandlungsgesetz\nBayern Amtsgericht Nürnberg HRB 44787\nANNIMATA Group GmbH – Schwabach",
      "type": "Registerbekanntmachung nach dem Umwandlungsgesetz",
      "state": "Bayern",
      "amtsgericht": "Amtsgericht Nürnberg",
      "registernummer": "HRB 44787",
      "registerart": "HRB",
      "company_name": "ANNIMATA Group GmbH",
      "company_seat": "Schwabach",
      "details": "30.07.2025 (Bekanntmachungsdatum)\n\nBayern Amtsgericht Nürnberg HRB 44787\nRegisterbekanntmachung nach dem Umwandlungsgesetz 29.07.2025 (Eintragungsdatum)\n\nANNIMATA Group GmbH\nGesellschaft mit beschränkter Haftung\nSchwabach\n\nDen Gläubigern der an der Spaltung beteiligten Rechtsträger ist, wenn sie binnen sechs Monaten nach dem Tag, an dem die Eintragung der Spaltung in das Register des Sitzes desjenigen Rechtsträgers, dessen Gläubiger sie sind, nach §§ 125, 19 Abs. 3 UmwG als bekannt gemacht gilt, ihren Anspruch nach Grund und Höhe in Textform anmelden, Sicherheit zu leisten, soweit sie nicht Befriedigung verlangen können. Dieses Recht steht den Gläubigern jedoch nur zu, wenn sie glaubhaft machen, dass durch die Spaltung die Erfüllung ihrer Forderung gefährdet wird."
    },
    {
      "date": "2025-07-30",
      "id": "118218",
      "original_text": "Registerbekanntmachung nach dem Umwandlungsgesetz\nBayern Amtsgericht München HRB 297542\nNeo German JVco GmbH – München",
      "type": "Registerbekanntmachung nach dem Umwandlungsgesetz",
      "state": "Bayern",
      "amtsgericht": "Amtsgericht München",
      "registernummer": "HRB 297542",
      "registerart": "HRB",
      "company_name": "Neo German JVco GmbH",
      "company_seat": "München",
      "details": "30.07.2025 (Bekanntmachungsdatum)\n\nBayern Amtsgericht München HRB 297542\nRegisterbekanntmachung nach dem Umwandlungsgesetz 29.07.2025 (Eintragungsdatum)\n\nNeo German JVco GmbH\nGesellschaft mit beschränkter Haftung\nMünchen\n\nDen Gläubigern der an der Verschmelzung beteiligten Rechtsträger ist, wenn sie binnen sechs Monaten nach dem Tag, an dem die Eintragung der Verschmelzung in das Register des Sitzes desjenigen Rechtsträgers, dessen Gläubiger sie sind, nach § 19 Abs. 3 UmwG als bekannt gemacht gilt, ihren Anspruch nach Grund und Höhe in Textform anmelden, Sicherheit zu leisten, soweit sie nicht Befriedigung verlangen können. Dieses Recht steht den Gläubigern jedoch nur zu, wenn sie glaubhaft machen, dass durch die Verschmelzung die Erfüllung ihrer Forderung gefährdet wird."
    },
    {
      "date": "2025-07-30",
      "id": "118219",
      "original_text": "Registerbekanntmachung nach dem Umwandlungsgesetz\nBayern Amtsgericht München HRA 121390\nHopman Jens Onlineshop Haushaltswaren e.K. – Geretsried",
      "type": "Registerbekanntmachung nach dem Umwandlungsgesetz",
      "state": "Bayern",
      "amtsgericht": "Amtsgericht München",
      "registernummer": "HRA 121390",
      "registerart": "HRA",
      "company_name": "Hopman Jens Onlineshop Haushaltswaren e.K.",
      "company_seat": "Geretsried",
      "details": "30.07.2025 (Bekanntmachungsdatum)\n\nBayern Amtsgericht München HRA 121390\nRegisterbekanntmachung nach dem Umwandlungsgesetz 29.07.2025 (Eintragungsdatum)\n\nHopman Jens Onlineshop Haushaltswaren e.K.\nEinzelkaufmann / Einzelkauffrau\nGeretsried\n\nDen Gläubigern der an der Ausgliederung beteiligten Rechtsträger ist, wenn sie binnen sechs Monaten nach dem Tag, an dem die Eintragung der Ausgliederung in das Register des Sitzes desjenigen Rechtsträgers, dessen Gläubiger sie sind, nach §§ 125, 19 Abs. 3 UmwG als bekannt gemacht gilt, ihren Anspruch nach Grund und Höhe in Textform anmelden, Sicherheit zu leisten, soweit sie nicht Befriedigung verlangen können. Dieses Recht steht den Gläubigern jedoch nur zu, wenn sie glaubhaft machen, dass durch die Ausgliederung die Erfüllung ihrer Forderung gefährdet wird."
    },
    {
      "date": "2025-07-30",
      "id": "118220",
      "original_text": "Registerbekanntmachung nach dem Umwandlungsgesetz\nBayern Amtsgericht München HRB 276103\nISP Healthcare GmbH – München",
      "type": "Registerbekanntmachung nach dem Umwandlungsgesetz",
      "state": "Bayern",
      "amtsgericht": "Amtsgericht München",
      "registernummer": "HRB 276103",
      "registerart": "HRB",
      "company_name": "ISP Healthcare GmbH",
      "company_seat": "München",
      "details": "30.07.2025 (Bekanntmachungsdatum)\n\nBayern Amtsgericht München HRB 276103\nRegisterbekanntmachung nach dem Umwandlungsgesetz 29.07.2025 (Eintragungsdatum)\n\nISP Healthcare GmbH\nGesellschaft mit beschränkter Haftung\nMünchen\n\nDen Gläubigern #dv.auswahl(Text=\"Bitte zutreffendes auswählen:\",Eingabe=\n\n\"der an der Verschmelzung beteiligten Rechtsträger ist, wenn sie binnen sechs Monaten nach dem Tag, an dem die Eintragung der Verschmelzung in das Register des Sitzes desjenigen Rechtsträgers, dessen Gläubiger sie sind, nach § 19 Abs. 3 UmwG als bekannt gemacht gilt, ihren Anspruch nach Grund und Höhe in Textform anmelden, Sicherheit zu leisten, soweit sie nicht Befriedigung verlangen können. Dieses Recht steht den Gläubigern jedoch nur zu, wenn sie glaubhaft machen, dass durch die Verschmelzung die Erfüllung ihrer Forderung gefährdet wird.\"|\"Verschmelzung\",\n\n\"der an der Spaltung beteiligten Rechtsträger ist, wenn sie binnen sechs Monaten nach dem Tag, an dem die Eintragung der Spaltung in das Register des Sitzes desjenigen Rechtsträgers, dessen Gläubiger sie sind, nach §§ 125, 19 Abs. 3 UmwG als bekannt gemacht gilt, ihren Anspruch nach Grund und Höhe in Textform anmelden, Sicherheit zu leisten, soweit sie nicht Befriedigung verlangen können. Dieses Recht steht den Gläubigern jedoch nur zu, wenn sie glaubhaft machen, dass durch die Spaltung die Erfüllung ihrer Forderung gefährdet wird.\"|\"Spaltung\",\n\n\"des formwechselnden Rechtsträgers ist, wenn sie binnen sechs Monaten nach dem Tag, an dem die Eintragung des Formwechsels nach § 201 UmwG als bekannt gemacht gilt, ihren Anspruch nach Grund und Höhe in Textform anmelden, Sicherheit zu leisten, soweit sie nicht Befriedigung verlangen können. Dieses Recht steht den Gläubigern jedoch nur zu, wenn sie glaubhaft machen, dass durch den Formwechsel die Erfüllung ihrer Forderung gefährdet wird.\"|\"formwechselnde Umwandlung\",\n\n\"der an der Ausgliederung beteiligten Rechtsträger ist, wenn sie binnen sechs Monaten nach dem Tag, an dem die Eintragung der Ausgliederung in das Register des Sitzes desjenigen Rechtsträgers, dessen Gläubiger sie sind, nach §§ 125, 19 Abs. 3 UmwG als bekannt gemacht gilt, ihren Anspruch nach Grund und Höhe in Textform anmelden, Sicherheit zu leisten, soweit sie nicht Befriedigung verlangen können. Dieses Recht steht den Gläubigern jedoch nur zu, wenn sie glaubhaft machen, dass durch die Ausgliederung die Erfüllung ihrer Forderung gefährdet wird.\"|\"Ausgliederung\")"
    },
    {
      "date": "2025-07-30",
      "id": "118221",
      "original_text": "Registerbekanntmachung nach dem Umwandlungsgesetz\nBayern Amtsgericht München HRB 297746\nHovedal GmbH – Geretsried",
      "type": "Registerbekanntmachung nach dem Umwandlungsgesetz",
      "state": "Bayern",
      "amtsgericht": "Amtsgericht München",
      "registernummer": "HRB 297746",
      "registerart": "HRB",
      "company_name": "Hovedal GmbH",
      "company_seat": "Geretsried",
      "details": "30.07.2025 (Bekanntmachungsdatum)\n\nBayern Amtsgericht München HRB 297746\nRegisterbekanntmachung nach dem Umwandlungsgesetz 29.07.2025 (Eintragungsdatum)\n\nHovedal GmbH\nGesellschaft mit beschränkter Haftung\nGeretsried\n\nDen Gläubigern der an der Ausgliederung beteiligten Rechtsträger ist, wenn sie binnen sechs Monaten nach dem Tag, an dem die Eintragung der Ausgliederung in das Register des Sitzes desjenigen Rechtsträgers, dessen Gläubiger sie sind, nach §§ 125, 19 Abs. 3 UmwG als bekannt gemacht gilt, ihren Anspruch nach Grund und Höhe in Textform anmelden, Sicherheit zu leisten, soweit sie nicht Befriedigung verlangen können. Dieses Recht steht den Gläubigern jedoch nur zu, wenn sie glaubhaft machen, dass durch die Ausgliederung die Erfüllung ihrer Forderung gefährdet wird."
    },
    {
      "date": "2025-07-30",
      "id": "118222",
      "original_text": "Registerbekanntmachung nach dem Umwandlungsgesetz\nBayern Amtsgericht Nürnberg HRB 38283\nCarton Verwaltungs GmbH – Schwabach",
      "type": "Registerbekanntmachung nach dem Umwandlungsgesetz",
      "state": "Bayern",
      "amtsgericht": "Amtsgericht Nürnberg",
      "registernummer": "HRB 38283",
      "registerart": "HRB",
      "company_name": "Carton Verwaltungs GmbH",
      "company_seat": "Schwabach",
      "details": "30.07.2025 (Bekanntmachungsdatum)\n\nBayern Amtsgericht Nürnberg HRB 38283\nRegisterbekanntmachung nach dem Umwandlungsgesetz 29.07.2025 (Eintragungsdatum)\n\nCarton Verwaltungs GmbH\nGesellschaft mit beschränkter Haftung\nSchwabach\n\nDen Gläubigern der an der Verschmelzung beteiligten Rechtsträger ist, wenn sie binnen sechs Monaten nach dem Tag, an dem die Eintragung der Verschmelzung in das Register des Sitzes desjenigen Rechtsträgers, dessen Gläubiger sie sind, nach § 19 Abs. 3 UmwG als bekannt gemacht gilt, ihren Anspruch nach Grund und Höhe in Textform anmelden, Sicherheit zu leisten, soweit sie nicht Befriedigung verlangen können. Dieses Recht steht den Gläubigern jedoch nur zu, wenn sie glaubhaft machen, dass durch die Verschmelzung die Erfüllung ihrer Forderung gefährdet wird."
    },
    {
      "date": "2025-07-30",
      "id": "118223",
      "original_text": "Löschungsankündigung\nBayern Amtsgericht München HRB 185291\nGSR Technology Deutschland GmbH – München",
      "type": "Löschungsankündigung",
      "state": "Bayern",
      "amtsgericht": "Amtsgericht München",
      "registernummer": "HRB 185291",
      "registerart": "HRB",
      "company_name": "GSR Technology Deutschland GmbH",
      "company_seat": "München",
      "details": "30.07.2025 (Bekanntmachungsdatum)\n\nBayern Amtsgericht München HRB 185291\nLöschungsankündigung\n\nGSR Technology Deutschland GmbH\nGesellschaft mit beschränkter Haftung\nMünchen\n\nDas Registergericht beabsichtigt, die im Handelsregister eingetragene Gesellschaft wegen Vermögenslosigkeit von Amts wegen nach § 394 FamFG zu löschen. Die Frist zur Erhebung eines Widerspruchs ist auf drei Monate festgesetzt."
    },
    {
      "date": "2025-07-30",
      "id": "118224",
      "original_text": "Registerbekanntmachung nach dem Umwandlungsgesetz\nBayern Amtsgericht Traunstein HRB 23216\nModul Systeme Engineering GmbH – Laufen",
      "type": "Registerbekanntmachung nach dem Umwandlungsgesetz",
      "state": "Bayern",
      "amtsgericht": "Amtsgericht Traunstein",
      "registernummer": "HRB 23216",
      "registerart": "HRB",
      "company_name": "Modul Systeme Engineering GmbH",
      "company_seat": "Laufen",
      "details": "30.07.2025 (Bekanntmachungsdatum)\n\nBayern Amtsgericht Traunstein HRB 23216\nRegisterbekanntmachung nach dem Umwandlungsgesetz 29.07.2025 (Eintragungsdatum)\n\nModul Systeme Engineering GmbH\nGesellschaft mit beschränkter Haftung\nLaufen\n\nDen Gläubigern der an der Verschmelzung beteiligten Rechtsträger ist, wenn sie binnen sechs Monaten nach dem Tag, an dem die Eintragung der Verschmelzung in das Register des Sitzes desjenigen Rechtsträgers, dessen Gläubiger sie sind, nach § 19 Abs. 3 UmwG als bekannt gemacht gilt, ihren Anspruch nach Grund und Höhe in Textform anmelden, Sicherheit zu leisten, soweit sie nicht Befriedigung verlangen können. Dieses Recht steht den Gläubigern jedoch nur zu, wenn sie glaubhaft machen, dass durch die Verschmelzung die Erfüllung ihrer Forderung gefährdet wird."
    },
    {
      "date": "2025-07-30",
      "id": "118225",
      "original_text": "Einreichung neuer Dokumente\nBaden-Württemberg Amtsgericht Mannheim HRB 751872\npromedtheus Informationssysteme für die Medizin Aktiengesellschaft – Eppelheim",
      "type": "Einreichung neuer Dokumente",
      "state": "Baden-Württemberg",
      "amtsgericht": "Amtsgericht Mannheim",
      "registernummer": "HRB 751872",
      "registerart": "HRB",
      "company_name": "promedtheus Informationssysteme für die Medizin Aktiengesellschaft",
      "company_seat": "Eppelheim",
      "details": "30.07.2025 (Bekanntmachungsdatum)\n\nBaden-Württemberg Amtsgericht Mannheim HRB 751872\nEinreichung neuer Dokumente\n\npromedtheus Informationssysteme für die Medizin Aktiengesellschaft\nAktiengesellschaft\nEppelheim\n\nDie Gesellschaft hat am 29.07.2025 die Liste über die Zusammensetzung des Aufsichtsrats zum Handelsregister eingereicht."
    },
    {
      "date": "2025-07-30",
      "id": "118226",
      "original_text": "Registerbekanntmachung nach dem Umwandlungsgesetz\nMecklenburg-Vorpommern Amtsgericht Schwerin HRA 4682\nHML Grambow Holding GmbH & Co. KG – Grambow",
      "type": "Registerbekanntmachung nach dem Umwandlungsgesetz",
      "state": "Mecklenburg-Vorpommern",
      "amtsgericht": "Amtsgericht Schwerin",
      "registernummer": "HRA 4682",
      "registerart": "HRA",
      "company_name": "HML Grambow Holding GmbH & Co. KG",
      "company_seat": "Grambow",
      "details": "30.07.2025 (Bekanntmachungsdatum)\n\nMecklenburg-Vorpommern Amtsgericht Schwerin HRA 4682\nRegisterbekanntmachung nach dem Umwandlungsgesetz 29.07.2025 (Eintragungsdatum)\n\nHML Grambow Holding GmbH & Co. KG\nKommanditgesellschaft\nGrambow\n\nAls nicht eingetragen wird veröffentlicht: Den Gläubigern der an der Ausgliederung beteiligten Rechtsträger ist, wenn sie binnen sechs Monaten nach dem Tag, an dem die Eintragung der Ausgliederung in das Register des Sitzes desjenigen Rechtsträgers, dessen Gläubiger sie sind, nach § 19 Abs. 3 UmwG als bekannt gemacht gilt, ihren Anspruch nach Grund und Höhe in Textform anmelden,\nSicherheit zu leisten, soweit sie nicht Befriedigung verlangen können. Dieses Recht steht den Gläubigern jedoch nur zu, wenn sie glaubhaft machen, dass durch die Ausgliederung die Erfüllung der Forderung gefährdet wird."
    },
    {
      "date": "2025-07-30",
      "id": "118227",
      "original_text": "Registerbekanntmachung nach dem Umwandlungsgesetz\nMecklenburg-Vorpommern Amtsgericht Schwerin HRA 4776\nBesitzunternehmen Gut Grambow Hans Martin Lösch e.K. – Grambow",
      "type": "Registerbekanntmachung nach dem Umwandlungsgesetz",
      "state": "Mecklenburg-Vorpommern",
      "amtsgericht": "Amtsgericht Schwerin",
      "registernummer": "HRA 4776",
      "registerart": "HRA",
      "company_name": "Besitzunternehmen Gut Grambow Hans Martin Lösch e.K.",
      "company_seat": "Grambow",
      "details": "30.07.2025 (Bekanntmachungsdatum)\n\nMecklenburg-Vorpommern Amtsgericht Schwerin HRA 4776\nRegisterbekanntmachung nach dem Umwandlungsgesetz 29.07.2025 (Eintragungsdatum)\n\nBesitzunternehmen Gut Grambow Hans Martin Lösch e.K.\nEinzelkaufmann / Einzelkauffrau\nGrambow\n\nAls nicht eingetragen wird veröffentlicht: Den Gläubigern der an der Ausgliederung beteiligten Rechtsträger ist, wenn sie binnen sechs Monaten nach dem Tag, an dem die Eintragung der Ausgliederung in das Register des Sitzes desjenigen Rechtsträgers, dessen Gläubiger sie sind, nach § 19 Abs. 3 UmwG als bekannt gemacht gilt, ihren Anspruch nach Grund und Höhe in Textform anmelden,\nSicherheit zu leisten, soweit sie nicht Befriedigung verlangen können. Dieses Recht steht den Gläubigern jedoch nur zu, wenn sie glaubhaft machen, dass durch die Ausgliederung die Erfüllung der Forderung gefährdet wird."
    },
    {
      "date": "2025-07-30",
      "id": "118228",
      "original_text": "Registerbekanntmachung nach dem Umwandlungsgesetz\nSachsen-Anhalt Amtsgericht Stendal HRB 110536\nKrebs & Aulich GmbH – Wernigerode",
      "type": "Registerbekanntmachung nach dem Umwandlungsgesetz",
      "state": "Sachsen-Anhalt",
      "amtsgericht": "Amtsgericht Stendal",
      "registernummer": "HRB 110536",
      "registerart": "HRB",
      "company_name": "Krebs & Aulich GmbH",
      "company_seat": "Wernigerode",
      "details": "30.07.2025 (Bekanntmachungsdatum)\n\nSachsen-Anhalt Amtsgericht Stendal HRB 110536\nRegisterbekanntmachung nach dem Umwandlungsgesetz 30.07.2025 (Eintragungsdatum)\n\nKrebs & Aulich GmbH\nGesellschaft mit beschränkter Haftung\nWernigerode\n\nNicht eingetragen:\nDen Gläubigern der an der Verschmelzung beteiligten Rechtsträger ist, wenn sie binnen sechs Monaten nach dem Tag, an dem die Eintragung der Verschmelzung nach § 19 Abs. 3 UmwG als bekanntgemacht gilt, ihren Anspruch nach Grund und Höhe schriftlich anmelden, Sicherheit zu leisten, soweit sie nicht Befriedigung verlangen können. Dieses Recht steht ihnen jedoch nur zu, wenn sie glaubhaft machen, dass durch die Verschmelzung die Erfüllung ihrer Forderung gefährdet wird."
    },
    {
      "date": "2025-07-30",
      "id": "118229",
      "original_text": "Registerbekanntmachung nach dem Umwandlungsgesetz\nBaden-Württemberg Amtsgericht Stuttgart HRB 105505\nPeter Baustatik GmbH – Heilbronn",
      "type": "Registerbekanntmachung nach dem Umwandlungsgesetz",
      "state": "Baden-Württemberg",
      "amtsgericht": "Amtsgericht Stuttgart",
      "registernummer": "HRB 105505",
      "registerart": "HRB",
      "company_name": "Peter Baustatik GmbH",
      "company_seat": "Heilbronn",
      "details": "30.07.2025 (Bekanntmachungsdatum)\n\nBaden-Württemberg Amtsgericht Stuttgart HRB 105505\nRegisterbekanntmachung nach dem Umwandlungsgesetz 30.07.2025 (Eintragungsdatum)\n\nPeter Baustatik GmbH\nGesellschaft mit beschränkter Haftung\nHeilbronn\n\nDen Gläubigern der an der Verschmelzung beteiligten Rechtsträger ist, wenn sie binnen sechs Monaten nach dem Tag, an dem die Eintragung der Verschmelzung in das Register des Sitzes desjenigen Rechtsträgers, dessen Gläubiger sie sind, nach § 19 Abs. 3 UmwG als bekanntgemacht gilt, ihren Anspruch nach Grund und Höhe schriftlich anmelden, Sicherheit zu leisten, soweit sie nicht Befriedigung verlangen können. Dieses Recht steht den Gläubigern jedoch nur zu, wenn sie glaubhaft machen, dass durch die Verschmelzung die Erfüllung ihrer Forderung gefährdet wird."
    },
    {
      "date": "2025-07-30",
      "id": "118230",
      "original_text": "Registerbekanntmachung nach dem Umwandlungsgesetz\nBaden-Württemberg Amtsgericht Stuttgart HRB 782508\nLeingang Medien Consulting GmbH – Bietigheim-Bissingen",
      "type": "Registerbekanntmachung nach dem Umwandlungsgesetz",
      "state": "Baden-Württemberg",
      "amtsgericht": "Amtsgericht Stuttgart",
      "registernummer": "HRB 782508",
      "registerart": "HRB",
      "company_name": "Leingang Medien Consulting GmbH",
      "company_seat": "Bietigheim-Bissingen",
      "details": "30.07.2025 (Bekanntmachungsdatum)\n\nBaden-Württemberg Amtsgericht Stuttgart HRB 782508\nRegisterbekanntmachung nach dem Umwandlungsgesetz 30.07.2025 (Eintragungsdatum)\n\nLeingang Medien Consulting GmbH\nGesellschaft mit beschränkter Haftung\nBietigheim-Bissingen\n\nDen Gläubigern der an der Verschmelzung beteiligten Rechtsträger ist, wenn sie binnen sechs Monaten nach dem Tag, an dem die Eintragung der Verschmelzung in das Register des Sitzes desjenigen Rechtsträgers, dessen Gläubiger sie sind, nach § 19 Abs. 3 UmwG als bekanntgemacht gilt, ihren Anspruch nach Grund und Höhe schriftlich anmelden, Sicherheit zu leisten, soweit sie nicht Befriedigung verlangen können. Dieses Recht steht den Gläubigern jedoch nur zu, wenn sie glaubhaft machen, dass durch die Verschmelzung die Erfüllung ihrer Forderung gefährdet wird."
    },
    {
      "date": "2025-07-30",
      "id": "118231",
      "original_text": "Einreichung neuer Dokumente\nBaden-Württemberg Amtsgericht Stuttgart HRB 460034\nWohnbau Trossingen GmbH – Trossingen",
      "type": "Einreichung neuer Dokumente",
      "state": "Baden-Württemberg",
      "amtsgericht": "Amtsgericht Stuttgart",
      "registernummer": "HRB 460034",
      "registerart": "HRB",
      "company_name": "Wohnbau Trossingen GmbH",
      "company_seat": "Trossingen",
      "details": "30.07.2025 (Bekanntmachungsdatum)\n\nBaden-Württemberg Amtsgericht Stuttgart HRB 460034\nEinreichung neuer Dokumente\n\nWohnbau Trossingen GmbH\nGesellschaft mit beschränkter Haftung\nTrossingen\n\nDie Gesellschaft hat am 29.07.2025 die Liste über die Zusammensetzung des Aufsichtsrats zum Handelsregister eingereicht."
    },
    {
      "date": "2025-07-30",
      "id": "118232",
      "original_text": "Registerbekanntmachung nach dem Umwandlungsgesetz\nBaden-Württemberg Amtsgericht Stuttgart HRB 580793\nKuK Entlackungstechnik GmbH – Öhringen",
      "type": "Registerbekanntmachung nach dem Umwandlungsgesetz",
      "state": "Baden-Württemberg",
      "amtsgericht": "Amtsgericht Stuttgart",
      "registernummer": "HRB 580793",
      "registerart": "HRB",
      "company_name": "KuK Entlackungstechnik GmbH",
      "company_seat": "Öhringen",
      "details": "30.07.2025 (Bekanntmachungsdatum)\n\nBaden-Württemberg Amtsgericht Stuttgart HRB 580793\nRegisterbekanntmachung nach dem Umwandlungsgesetz 30.07.2025 (Eintragungsdatum)\n\nKuK Entlackungstechnik GmbH\nGesellschaft mit beschränkter Haftung\nÖhringen\n\nAls nicht eingetragen wird bekanntgemacht:\nDen Gläubigern der an der Verschmelzung beteiligten Rechtsträger ist, wenn sie binnen sechs Monaten nach dem Tag, an dem die Eintragung der Verschmelzung in das Register des Sitzes desjenigen Rechtsträgers, dessen Gläubiger sie sind, nach § 19 Abs. 3 UmwG als bekanntgemacht gilt, ihren Anspruch nach Grund und Höhe schriftlich anmelden, Sicherheit zu leisten, soweit sie nicht Befriedigung verlangen können. Dieses Recht steht den Gläubigern jedoch nur zu, wenn sie glaubhaft machen, dass durch die Verschmelzung die Erfüllung ihrer Forderung gefährdet wird."
    },
    {
      "date": "2025-07-30",
      "id": "118233",
      "original_text": "Registerbekanntmachung nach dem Umwandlungsgesetz\nHamburg Amtsgericht Hamburg VR 21879\nIG Biogasmotoren e.V. – Hamburg",
      "type": "Registerbekanntmachung nach dem Umwandlungsgesetz",
      "state": "Hamburg",
      "amtsgericht": "Amtsgericht Hamburg",
      "registernummer": "VR 21879",
      "registerart": "VR",
      "company_name": "IG Biogasmotoren e.V.",
      "company_seat": "Hamburg",
      "details": "30.07.2025 (Bekanntmachungsdatum)\n\nHamburg Amtsgericht Hamburg VR 21879\nRegisterbekanntmachung nach dem Umwandlungsgesetz 30.07.2025 (Eintragungsdatum)\n\nIG Biogasmotoren e.V.\neingetragener Verein\nHamburg\n\nAls nicht eingetragen wird bekannt gemacht:\nDen Gläubigern der an der formwechselnden Umwandlung beteiligten Gesellschaften ist, wenn sie binnen sechs Monaten nach dem Tag, an dem die Eintragung der formwechselnden Umwandlung in das Register des Sitzes desjenigen Rechtsträgers, dessen Gläubiger sie sind, nach § 19 Absatz 3 UmwG als bekannt gemacht gilt, ihren Anspruch nach Grund und Höhe schriftlich anmelden, Sicherheit zu leisten, soweit sie nicht Befriedigung verlangen können. Dieses Recht steht den Gläubigern jedoch nur zu, wenn sie glaubhaft machen, dass durch die formwechselnde Umwandlung die Erfüllung ihrer Forderung gefährdet wird."
    },
    {
      "date": "2025-07-30",
      "id": "118234",
      "original_text": "Registerbekanntmachung nach dem Umwandlungsgesetz\nBaden-Württemberg Amtsgericht Stuttgart HRB 13203\nWolf GmbH – Stuttgart",
      "type": "Registerbekanntmachung nach dem Umwandlungsgesetz",
      "state": "Baden-Württemberg",
      "amtsgericht": "Amtsgericht Stuttgart",
      "registernummer": "HRB 13203",
      "registerart": "HRB",
      "company_name": "Wolf GmbH",
      "company_seat": "Stuttgart",
      "details": "30.07.2025 (Bekanntmachungsdatum)\n\nBaden-Württemberg Amtsgericht Stuttgart HRB 13203\nRegisterbekanntmachung nach dem Umwandlungsgesetz 30.07.2025 (Eintragungsdatum)\n\nWolf GmbH\nGesellschaft mit beschränkter Haftung\nStuttgart\n\nDen Gläubigern der an der Verschmelzung beteiligten Rechtsträger ist, wenn sie binnen sechs Monaten nach dem Tag, an dem die Eintragung der Verschmelzung in das Register des Sitzes desjenigen Rechtsträgers, dessen Gläubiger sie sind, nach § 19 Abs. 3 UmwG als bekanntgemacht gilt, ihren Anspruch nach Grund und Höhe schriftlich anmelden, Sicherheit zu leisten, soweit sie nicht Befriedigung verlangen können. Dieses Recht steht den Gläubigern jedoch nur zu, wenn sie glaubhaft machen, dass durch die Verschmelzung die Erfüllung ihrer Forderung gefährdet wird."
    },
    {
      "date": "2025-07-30",
      "id": "118235",
      "original_text": "Löschungsankündigung\nSchleswig-Holstein Amtsgericht Flensburg HRB 15770\nKaiser Holding UG (haftungsbeschränkt) – Sylt OT Tinnum",
      "type": "Löschungsankündigung",
      "state": "Schleswig-Holstein",
      "amtsgericht": "Amtsgericht Flensburg",
      "registernummer": "HRB 15770",
      "registerart": "HRB",
      "company_name": "Kaiser Holding UG (haftungsbeschränkt)",
      "company_seat": "Sylt OT Tinnum",
      "details": "30.07.2025 (Bekanntmachungsdatum)\n\nSchleswig-Holstein Amtsgericht Flensburg HRB 15770\nLöschungsankündigung\n\nKaiser Holding UG (haftungsbeschränkt)\nGesellschaft mit beschränkter Haftung\nSylt OT Tinnum\n\nEs ist die Löschung der nachstehenden Gesellschaft wegen Vermögenslosigkeit gemäß § 394 FamFG beabsichtigt.\nWiderspruchsfrist: 2 Monate."
    },
    {
      "date": "2025-07-30",
      "id": "118236",
      "original_text": "Einreichung neuer Dokumente\nSchleswig-Holstein Amtsgericht Flensburg HRB 9367\nRichter GmbH – Schleswig",
      "type": "Einreichung neuer Dokumente",
      "state": "Schleswig-Holstein",
      "amtsgericht": "Amtsgericht Flensburg",
      "registernummer": "HRB 9367",
      "registerart": "HRB",
      "company_name": "Richter GmbH",
      "company_seat": "Schleswig",
      "details": "30.07.2025 (Bekanntmachungsdatum)\n\nSchleswig-Holstein Amtsgericht Flensburg HRB 9367\nEinreichung neuer Dokumente\n\nRichter GmbH\nGesellschaft mit beschränkter Haftung\nSchleswig\n\nNeue Aufsichtsratsliste nach Änderung eingereicht am 28.07.2025."
    },
    {
      "date": "2025-07-30",
      "id": "118237",
      "original_text": "Einreichung neuer Dokumente\nHamburg Amtsgericht Hamburg HRB 36799\nElbe-Werkstätten GmbH – Hamburg",
      "type": "Einreichung neuer Dokumente",
      "state": "Hamburg",
      "amtsgericht": "Amtsgericht Hamburg",
      "registernummer": "HRB 36799",
      "registerart": "HRB",
      "company_name": "Elbe-Werkstätten GmbH",
      "company_seat": "Hamburg",
      "details": "30.07.2025 (Bekanntmachungsdatum)\n\nHamburg Amtsgericht Hamburg HRB 36799\nEinreichung neuer Dokumente\n\nElbe-Werkstätten GmbH\nGesellschaft mit beschränkter Haftung\nHamburg\n\nAls nicht eingetragen wird bekannt gemacht: Liste des Aufsichtsrats wurde eingereicht."
    },
    {
      "date": "2025-07-30",
      "id": "118238",
      "original_text": "Registerbekanntmachung nach dem Umwandlungsgesetz\nBaden-Württemberg Amtsgericht Stuttgart HRB 776529\nMarkus Schmied Verwaltungs GmbH – Schönaich",
      "type": "Registerbekanntmachung nach dem Umwandlungsgesetz",
      "state": "Baden-Württemberg",
      "amtsgericht": "Amtsgericht Stuttgart",
      "registernummer": "HRB 776529",
      "registerart": "HRB",
      "company_name": "Markus Schmied Verwaltungs GmbH",
      "company_seat": "Schönaich",
      "details": "30.07.2025 (Bekanntmachungsdatum)\n\nBaden-Württemberg Amtsgericht Stuttgart HRB 776529\nRegisterbekanntmachung nach dem Umwandlungsgesetz 30.07.2025 (Eintragungsdatum)\n\nMarkus Schmied Verwaltungs GmbH\nGesellschaft mit beschränkter Haftung\nSchönaich\n\nDen Gläubigern der an der Verschmelzung beteiligten Rechtsträger ist, wenn sie binnen sechs Monaten nach dem Tag, an dem die Eintragung der Verschmelzung in das Register des Sitzes desjenigen Rechtsträgers, dessen Gläubiger sie sind, nach § 19 Abs. 3 UmwG als bekanntgemacht gilt, ihren Anspruch nach Grund und Höhe schriftlich anmelden, Sicherheit zu leisten, soweit sie nicht Befriedigung verlangen können. Dieses Recht steht den Gläubigern jedoch nur zu, wenn sie glaubhaft machen, dass durch die Verschmelzung die Erfüllung ihrer Forderung gefährdet wird."
    },
    {
      "date": "2025-07-30",
      "id": "118239",
      "original_text": "Registerbekanntmachung nach dem Umwandlungsgesetz\nBaden-Württemberg Amtsgericht Stuttgart HRB 18868\nHWP - MED GmbH Krankenhausplanung, medizinische Ausrüstung – Stuttgart",
      "type": "Registerbekanntmachung nach dem Umwandlungsgesetz",
      "state": "Baden-Württemberg",
      "amtsgericht": "Amtsgericht Stuttgart",
      "registernummer": "HRB 18868",
      "registerart": "HRB",
      "company_name": "HWP - MED GmbH Krankenhausplanung, medizinische Ausrüstung",
      "company_seat": "Stuttgart",
      "details": "30.07.2025 (Bekanntmachungsdatum)\n\nBaden-Württemberg Amtsgericht Stuttgart HRB 18868\nRegisterbekanntmachung nach dem Umwandlungsgesetz 30.07.2025 (Eintragungsdatum)\n\nHWP - MED GmbH Krankenhausplanung, medizinische Ausrüstung\nGesellschaft mit beschränkter Haftung\nStuttgart\n\nDen Gläubigern der an der Verschmelzung beteiligten Rechtsträger ist, wenn sie binnen sechs Monaten nach dem Tag, an dem die Eintragung der Verschmelzung in das Register des Sitzes desjenigen Rechtsträgers, dessen Gläubiger sie sind, nach § 19 Abs. 3 UmwG als bekanntgemacht gilt, ihren Anspruch nach Grund und Höhe schriftlich anmelden, Sicherheit zu leisten, soweit sie nicht Befriedigung verlangen können. Dieses Recht steht den Gläubigern jedoch nur zu, wenn sie glaubhaft machen, dass durch die Verschmelzung die Erfüllung ihrer Forderung gefährdet wird."
    },
    {
      "date": "2025-07-30",
      "id": "118240",
      "original_text": "Löschungsankündigung\nBaden-Württemberg Amtsgericht Freiburg HRB 724334\nADE GmbH – Kehl",
      "type": "Löschungsankündigung",
      "state": "Baden-Württemberg",
      "amtsgericht": "Amtsgericht Freiburg",
      "registernummer": "HRB 724334",
      "registerart": "HRB",
      "company_name": "ADE GmbH",
      "company_seat": "Kehl",
      "details": "30.07.2025 (Bekanntmachungsdatum)\n\nBaden-Württemberg Amtsgericht Freiburg HRB 724334\nLöschungsankündigung\n\nADE GmbH\nGesellschaft mit beschränkter Haftung\nKehl\n\nAls nicht eingetragen wird bekanntgemacht:\nDas Gericht beabsichtigt, die Gesellschaft wegen Vermögenslosigkeit im Handelsregister von Amts wegen nach § 394 FamFG zu löschen. Die Frist zur Geltendmachung eines Widerspruchs gegen die beabsichtigte Löschung ist auf einen Monat ab Veröffentlichung bestimmt."
    },
    {
      "date": "2025-07-30",
      "id": "118241",
      "original_text": "Registerbekanntmachung nach dem Umwandlungsgesetz\nBaden-Württemberg Amtsgericht Stuttgart HRB 751114\nFerdinand Gross Europa GmbH – Leinfelden-Echterdingen",
      "type": "Registerbekanntmachung nach dem Umwandlungsgesetz",
      "state": "Baden-Württemberg",
      "amtsgericht": "Amtsgericht Stuttgart",
      "registernummer": "HRB 751114",
      "registerart": "HRB",
      "company_name": "Ferdinand Gross Europa GmbH",
      "company_seat": "Leinfelden-Echterdingen",
      "details": "30.07.2025 (Bekanntmachungsdatum)\n\nBaden-Württemberg Amtsgericht Stuttgart HRB 751114\nRegisterbekanntmachung nach dem Umwandlungsgesetz 30.07.2025 (Eintragungsdatum)\n\nFerdinand Gross Europa GmbH\nGesellschaft mit beschränkter Haftung\nLeinfelden-Echterdingen\n\nDen Gläubigern der an der Verschmelzung beteiligten Rechtsträger ist, wenn sie binnen sechs Monaten nach dem Tag, an dem die Eintragung der Verschmelzung in das Register des Sitzes desjenigen Rechtsträgers, dessen Gläubiger sie sind, nach § 19 Abs. 3 UmwG als bekanntgemacht gilt, ihren Anspruch nach Grund und Höhe schriftlich anmelden, Sicherheit zu leisten, soweit sie nicht Befriedigung verlangen können. Dieses Recht steht den Gläubigern jedoch nur zu, wenn sie glaubhaft machen, dass durch die Verschmelzung die Erfüllung ihrer Forderung gefährdet wird."
    },
    {
      "date": "2025-07-30",
      "id": "118242",
      "original_text": "Registerbekanntmachung nach dem Umwandlungsgesetz\nSchleswig-Holstein Amtsgericht Kiel HRA 12753\nMEDIA-SIGN Lars Moldenhauer e. K. – Norderstedt",
      "type": "Registerbekanntmachung nach dem Umwandlungsgesetz",
      "state": "Schleswig-Holstein",
      "amtsgericht": "Amtsgericht Kiel",
      "registernummer": "HRA 12753",
      "registerart": "HRA",
      "company_name": "MEDIA-SIGN Lars Moldenhauer e. K.",
      "company_seat": "Norderstedt",
      "details": "30.07.2025 (Bekanntmachungsdatum)\n\nSchleswig-Holstein Amtsgericht Kiel HRA 12753\nRegisterbekanntmachung nach dem Umwandlungsgesetz 29.07.2025 (Eintragungsdatum)\n\nMEDIA-SIGN Lars Moldenhauer e. K.\nEinzelkaufmann / Einzelkauffrau\nNorderstedt\n\nZu Eintragungsnummer 2 vom 29.07.2025 wird als nicht eingetragen veröffentlicht:\nDen Gläubigern der an der Verschmelzung beteiligten Rechtsträger ist, wenn sie binnen sechs Monaten nach dem Tag, an dem die Eintragung der Verschmelzung in das Register des Sitzes desjenigen Rechtsträgers, dessen Gläubiger sie sind, nach § 19 Abs. 3 UmwG bekannt gemacht worden ist, ihren Anspruch nach Grund und Höhe schriftlich anmelden, Sicherheit zu leisten, soweit sie nicht Befriedigung verlangen können. Dieses Recht steht den Gläubigern jedoch nur zu, wenn sie glaubhaft machen, dass durch die Verschmelzung die Erfüllung ihrer Forderung gefährdet wird."
    },
    {
      "date": "2025-07-30",
      "id": "118243",
      "original_text": "Löschungsankündigung\nBerlin Amtsgericht Berlin (Charlottenburg) HRB 263136\nBREGAS GmbH – Berlin",
      "type": "Löschungsankündigung",
      "state": "Berlin",
      "amtsgericht": "Amtsgericht Berlin (Charlottenburg)",
      "registernummer": "HRB 263136",
      "registerart": "HRB",
      "company_name": "BREGAS GmbH",
      "company_seat": "Berlin",
      "details": "30.07.2025 (Bekanntmachungsdatum)\n\nBerlin Amtsgericht Berlin (Charlottenburg) HRB 263136\nLöschungsankündigung\n\nBREGAS GmbH\nGesellschaft mit beschränkter Haftung\nBerlin\n\nBei der nachstehenden Gesellschaft wird das Amtslöschungsverfahren gemäß § 394 FamFG eingeleitet. Widerspruchsfrist 6 Wochen"
    },
    {
      "date": "2025-07-30",
      "id": "118244",
      "original_text": "Registerbekanntmachung nach dem Umwandlungsgesetz\nHamburg Amtsgericht Hamburg HRB 166924\nArchix VV GmbH – Hamburg",
      "type": "Registerbekanntmachung nach dem Umwandlungsgesetz",
      "state": "Hamburg",
      "amtsgericht": "Amtsgericht Hamburg",
      "registernummer": "HRB 166924",
      "registerart": "HRB",
      "company_name": "Archix VV GmbH",
      "company_seat": "Hamburg",
      "details": "30.07.2025 (Bekanntmachungsdatum)\n\nHamburg Amtsgericht Hamburg HRB 166924\nRegisterbekanntmachung nach dem Umwandlungsgesetz 30.07.2025 (Eintragungsdatum)\n\nArchix VV GmbH\nGesellschaft mit beschränkter Haftung\nHamburg\n\nAls nicht eingetragen wird bekannt gemacht:\nDen Gläubigern der an der Verschmelzung beteiligten Gesellschaften ist, wenn sie binnen sechs Monaten nach dem Tag, an dem die Eintragung der Verschmelzung in das Register des Sitzes desjenigen Rechtsträgers, dessen Gläubiger sie sind, nach § 19 Absatz 3 UmwG als bekannt gemacht gilt, ihren Anspruch nach Grund und Höhe schriftlich anmelden, Sicherheit zu leisten, soweit sie nicht Befriedigung verlangen können. Dieses Recht steht den Gläubigern jedoch nur zu, wenn sie glaubhaft machen, dass durch die Verschmelzung die Erfüllung ihrer Forderung gefährdet wird."
    },
    {
      "date": "2025-07-30",
      "id": "118245",
      "original_text": "Einreichung neuer Dokumente\nSchleswig-Holstein Amtsgericht Flensburg HRB 517 NI\nEnergieversorgung Sylt GmbH – Westerland",
      "type": "Einreichung neuer Dokumente",
      "state": "Schleswig-Holstein",
      "amtsgericht": "Amtsgericht Flensburg",
      "registernummer": "HRB 517 NI",
      "registerart": "HRB",
      "company_name": "Energieversorgung Sylt GmbH",
      "company_seat": "Westerland",
      "details": "30.07.2025 (Bekanntmachungsdatum)\n\nSchleswig-Holstein Amtsgericht Flensburg HRB 517 NI\nEinreichung neuer Dokumente\n\nEnergieversorgung Sylt GmbH\nGesellschaft mit beschränkter Haftung\nWesterland\n\nAls nicht eingetragen wird veröffentlicht: Neue Aufsichtsratsliste nach Änderung eingereicht am 25.07.2025."
    },
    {
      "date": "2025-07-30",
      "id": "118246",
      "original_text": "Registerbekanntmachung nach dem Umwandlungsgesetz\nBaden-Württemberg Amtsgericht Stuttgart HRA 742487\nLaitenberger Elektrotechnik und Licht GmbH & Co. KG – Besigheim",
      "type": "Registerbekanntmachung nach dem Umwandlungsgesetz",
      "state": "Baden-Württemberg",
      "amtsgericht": "Amtsgericht Stuttgart",
      "registernummer": "HRA 742487",
      "registerart": "HRA",
      "company_name": "Laitenberger Elektrotechnik und Licht GmbH & Co. KG",
      "company_seat": "Besigheim",
      "details": "30.07.2025 (Bekanntmachungsdatum)\n\nBaden-Württemberg Amtsgericht Stuttgart HRA 742487\nRegisterbekanntmachung nach dem Umwandlungsgesetz 30.07.2025 (Eintragungsdatum)\n\nLaitenberger Elektrotechnik und Licht GmbH & Co. KG\nKommanditgesellschaft\nBesigheim\n\nAls nicht eingetragen wird bekanntgemacht:\nDen Gläubigern der an der Ausgliederung beteiligten Rechtsträger ist, wenn sie binnen sechs Monaten nach dem Tag, an dem die Eintragung der Ausgliederung in das Register des Sitzes desjenigen Rechtsträgers, dessen Gläubiger sie sind, nach § 19 Abs. 3 UmwG als bekanntgemacht gilt, ihren Anspruch nach Grund und Höhe schriftlich anmelden, Sicherheit zu leisten, soweit sie nicht Befriedigung verlangen können. Dieses Recht steht den Gläubigern jedoch nur zu, wenn sie glaubhaft machen, dass durch die Ausgliederung die Erfüllung ihrer Forderung gefährdet wird."
    },
    {
      "date": "2025-07-30",
      "id": "118247",
      "original_text": "Registerbekanntmachung nach dem Umwandlungsgesetz\nBaden-Württemberg Amtsgericht Mannheim HRA 712723\nManuel Arango Holding EOOD & Co. KG – Karlsruhe",
      "type": "Registerbekanntmachung nach dem Umwandlungsgesetz",
      "state": "Baden-Württemberg",
      "amtsgericht": "Amtsgericht Mannheim",
      "registernummer": "HRA 712723",
      "registerart": "HRA",
      "company_name": "Manuel Arango Holding EOOD & Co. KG",
      "company_seat": "Karlsruhe",
      "details": "30.07.2025 (Bekanntmachungsdatum)\n\nBaden-Württemberg Amtsgericht Mannheim HRA 712723\nRegisterbekanntmachung nach dem Umwandlungsgesetz 30.07.2025 (Eintragungsdatum)\n\nManuel Arango Holding EOOD & Co. KG\nKommanditgesellschaft\nKarlsruhe\n\nDen Gläubigern des an dem Formwechsel beteiligten Rechtsträgers ist, wenn sie binnen sechs Monaten nach dem Tag, an dem die Eintragung des Formwechsels in das Register des Sitzes desjenigen Rechtsträgers, dessen Gläubiger sie sind, nach § 19 Abs. 3 UmwG als bekanntgemacht gilt, ihren Anspruch nach Grund und Höhe schriftlich anmelden, Sicherheit zu leisten, soweit sie nicht Befriedigung verlangen können. Dieses Recht steht den Gläubigern jedoch nur zu, wenn sie glaubhaft machen, dass durch den Formwechsel die Erfüllung ihrer Forderung gefährdet wird."
    },
    {
      "date": "2025-07-30",
      "id": "118248",
      "original_text": "Registerbekanntmachung nach dem Umwandlungsgesetz\nBaden-Württemberg Amtsgericht Stuttgart HRA 741375\nLaitenberger Elektrotechnik & Licht e.K. – Besigheim",
      "type": "Registerbekanntmachung nach dem Umwandlungsgesetz",
      "state": "Baden-Württemberg",
      "amtsgericht": "Amtsgericht Stuttgart",
      "registernummer": "HRA 741375",
      "registerart": "HRA",
      "company_name": "Laitenberger Elektrotechnik & Licht e.K.",
      "company_seat": "Besigheim",
      "details": "30.07.2025 (Bekanntmachungsdatum)\n\nBaden-Württemberg Amtsgericht Stuttgart HRA 741375\nRegisterbekanntmachung nach dem Umwandlungsgesetz 30.07.2025 (Eintragungsdatum)\n\nLaitenberger Elektrotechnik & Licht e.K.\nEinzelkaufmann / Einzelkauffrau\nBesigheim\n\nAls nicht eingetragen wird bekanntgemacht:\nDen Gläubigern der an der Ausgliederung beteiligten Rechtsträger ist, wenn sie binnen sechs Monaten nach dem Tag, an dem die Eintragung der Ausgliederung in das Register des Sitzes desjenigen Rechtsträgers, dessen Gläubiger sie sind, nach § 19 Abs. 3 UmwG als bekanntgemacht gilt, ihren Anspruch nach Grund und Höhe schriftlich anmelden, Sicherheit zu leisten, soweit sie nicht Befriedigung verlangen können. Dieses Recht steht den Gläubigern jedoch nur zu, wenn sie glaubhaft machen, dass durch die Ausgliederung die Erfüllung ihrer Forderung gefährdet wird."
    },
    {
      "date": "2025-07-30",
      "id": "118249",
      "original_text": "Einreichung neuer Dokumente\nBaden-Württemberg Amtsgericht Freiburg HRB 714815\nIMS Gear SE & Co. KGaA – Donaueschingen",
      "type": "Einreichung neuer Dokumente",
      "state": "Baden-Württemberg",
      "amtsgericht": "Amtsgericht Freiburg",
      "registernummer": "HRB 714815",
      "registerart": "HRB",
      "company_name": "IMS Gear SE & Co. KGaA",
      "company_seat": "Donaueschingen",
      "details": "30.07.2025 (Bekanntmachungsdatum)\n\nBaden-Württemberg Amtsgericht Freiburg HRB 714815\nEinreichung neuer Dokumente\n\nIMS Gear SE & Co. KGaA\nKommanditgesellschaft auf Aktien\nDonaueschingen\n\nAls nicht eingetragen wird bekanntgemacht:\nDie Gesellschaft hat am 24.07.2025 die Liste über die Zusammensetzung des Aufsichtsrats zum Handelsregister eingereicht."
    },
    {
      "date": "2025-07-30",
      "id": "118250",
      "original_text": "Löschungsankündigung\nBerlin Amtsgericht Berlin (Charlottenburg) HRB 172163\nB. BT-Hoch- und Tiefbau GmbH – Berlin",
      "type": "Löschungsankündigung",
      "state": "Berlin",
      "amtsgericht": "Amtsgericht Berlin (Charlottenburg)",
      "registernummer": "HRB 172163",
      "registerart": "HRB",
      "company_name": "B. BT-Hoch- und Tiefbau GmbH",
      "company_seat": "Berlin",
      "details": "30.07.2025 (Bekanntmachungsdatum)\n\nBerlin Amtsgericht Berlin (Charlottenburg) HRB 172163\nLöschungsankündigung\n\nB. BT-Hoch- und Tiefbau GmbH\nGesellschaft mit beschränkter Haftung\nBerlin\n\nBei der nachstehenden Gesellschaft wird das Amtslöschungsverfahren gemäß § 394 FamFG eingeleitet. Widerspruchsfrist 6 Wochen"
    },
    {
      "date": "2025-07-30",
      "id": "118251",
      "original_text": "Registerbekanntmachung nach dem Umwandlungsgesetz\nBaden-Württemberg Amtsgericht Mannheim HRB 742816\nManuel Arango Holding GmbH – Karlsruhe",
      "type": "Registerbekanntmachung nach dem Umwandlungsgesetz",
      "state": "Baden-Württemberg",
      "amtsgericht": "Amtsgericht Mannheim",
      "registernummer": "HRB 742816",
      "registerart": "HRB",
      "company_name": "Manuel Arango Holding GmbH",
      "company_seat": "Karlsruhe",
      "details": "30.07.2025 (Bekanntmachungsdatum)\n\nBaden-Württemberg Amtsgericht Mannheim HRB 742816\nRegisterbekanntmachung nach dem Umwandlungsgesetz 30.07.2025 (Eintragungsdatum)\n\nManuel Arango Holding GmbH\nGesellschaft mit beschränkter Haftung\nKarlsruhe\n\nDen Gläubigern des an dem Formwechsel beteiligten Rechtsträgers ist, wenn sie binnen sechs Monaten nach dem Tag, an dem die Eintragung des Formwechsels in das Register des Sitzes desjenigen Rechtsträgers, dessen Gläubiger sie sind, nach § 19 Abs. 3 UmwG als bekanntgemacht gilt, ihren Anspruch nach Grund und Höhe schriftlich anmelden, Sicherheit zu leisten, soweit sie nicht Befriedigung verlangen können. Dieses Recht steht den Gläubigern jedoch nur zu, wenn sie glaubhaft machen, dass durch den Formwechsel die Erfüllung ihrer Forderung gefährdet wird."
    },
    {
      "date": "2025-07-30",
      "id": "118252",
      "original_text": "Einreichung neuer Dokumente\nSachsen-Anhalt Amtsgericht Stendal HRB 13171\nStadtwerke Jessen Gesellschaft mit beschränkter Haftung – Jessen (Elster)",
      "type": "Einreichung neuer Dokumente",
      "state": "Sachsen-Anhalt",
      "amtsgericht": "Amtsgericht Stendal",
      "registernummer": "HRB 13171",
      "registerart": "HRB",
      "company_name": "Stadtwerke Jessen Gesellschaft mit beschränkter Haftung",
      "company_seat": "Jessen (Elster)",
      "details": "30.07.2025 (Bekanntmachungsdatum)\n\nSachsen-Anhalt Amtsgericht Stendal HRB 13171\nEinreichung neuer Dokumente\n\nStadtwerke Jessen Gesellschaft mit beschränkter Haftung\nGesellschaft mit beschränkter Haftung\nJessen (Elster)\n\nEine Liste der Mitglieder des Aufsichtsrates wurde zum Handelsregister eingereicht."
    },
    {
      "date": "2025-07-30",
      "id": "118253",
      "original_text": "Einreichung neuer Dokumente\nBerlin Amtsgericht Berlin (Charlottenburg) HRB 108758\nWhite Owl Capital AG – Berlin",
      "type": "Einreichung neuer Dokumente",
      "state": "Berlin",
      "amtsgericht": "Amtsgericht Berlin (Charlottenburg)",
      "registernummer": "HRB 108758",
      "registerart": "HRB",
      "company_name": "White Owl Capital AG",
      "company_seat": "Berlin",
      "details": "30.07.2025 (Bekanntmachungsdatum)\n\nBerlin Amtsgericht Berlin (Charlottenburg) HRB 108758\nEinreichung neuer Dokumente\n\nWhite Owl Capital AG\nAktiengesellschaft\nBerlin\n\nAls nicht eingetragen wird veröffentlicht: Es wurde eine neue Liste der Aufsichtsratsmitglieder eingereicht (§ 106 AktG)."
    },
    {
      "date": "2025-07-30",
      "id": "118254",
      "original_text": "Einreichung neuer Dokumente\nSachsen-Anhalt Amtsgericht Stendal HRB 110853\nthyssenkrupp Dynamic Components GmbH – Ilsenburg (Harz)",
      "type": "Einreichung neuer Dokumente",
      "state": "Sachsen-Anhalt",
      "amtsgericht": "Amtsgericht Stendal",
      "registernummer": "HRB 110853",
      "registerart": "HRB",
      "company_name": "thyssenkrupp Dynamic Components GmbH",
      "company_seat": "Ilsenburg (Harz)",
      "details": "30.07.2025 (Bekanntmachungsdatum)\n\nSachsen-Anhalt Amtsgericht Stendal HRB 110853\nEinreichung neuer Dokumente\n\nthyssenkrupp Dynamic Components GmbH\nGesellschaft mit beschränkter Haftung\nIlsenburg (Harz)\n\nEine Liste der Mitglieder des Aufsichtsrates wurde zum Handelsregister eingereicht."
    },
    {
      "date": "2025-07-30",
      "id": "118255",
      "original_text": "Registerbekanntmachung nach dem Umwandlungsgesetz\nBaden-Württemberg Amtsgericht Freiburg HRA 709163\nG-CNC-Technik GmbH & Co. KG – Schopfheim",
      "type": "Registerbekanntmachung nach dem Umwandlungsgesetz",
      "state": "Baden-Württemberg",
      "amtsgericht": "Amtsgericht Freiburg",
      "registernummer": "HRA 709163",
      "registerart": "HRA",
      "company_name": "G-CNC-Technik GmbH & Co. KG",
      "company_seat": "Schopfheim",
      "details": "30.07.2025 (Bekanntmachungsdatum)\n\nBaden-Württemberg Amtsgericht Freiburg HRA 709163\nRegisterbekanntmachung nach dem Umwandlungsgesetz 30.07.2025 (Eintragungsdatum)\n\nG-CNC-Technik GmbH & Co. KG\nKommanditgesellschaft\nSchopfheim\n\nAls nicht eingetragen wird bekanntgemacht:\nDen Gläubigern der an der Ausgliederung beteiligten Rechtsträger ist, wenn sie binnen sechs Monaten nach dem Tag, an dem die Eintragung der Ausgliederung in das Register des Sitzes desjenigen Rechtsträgers, dessen Gläubiger sie sind, nach § 19 Abs. 3 UmwG als bekanntgemacht gilt, ihren Anspruch nach Grund und Höhe schriftlich anmelden, Sicherheit zu leisten, soweit sie nicht Befriedigung verlangen können. Dieses Recht steht den Gläubigern jedoch nur zu, wenn sie glaubhaft machen, dass durch die Ausgliederung die Erfüllung ihrer Forderung gefährdet wird."
    },
    {
      "date": "2025-07-30",
      "id": "118256",
      "original_text": "Registerbekanntmachung nach dem Umwandlungsgesetz\nBaden-Württemberg Amtsgericht Freiburg HRA 707455\nGarni Zerspanungstechnik e. K. – Steinen",
      "type": "Registerbekanntmachung nach dem Umwandlungsgesetz",
      "state": "Baden-Württemberg",
      "amtsgericht": "Amtsgericht Freiburg",
      "registernummer": "HRA 707455",
      "registerart": "HRA",
      "company_name": "Garni Zerspanungstechnik e. K.",
      "company_seat": "Steinen",
      "details": "30.07.2025 (Bekanntmachungsdatum)\n\nBaden-Württemberg Amtsgericht Freiburg HRA 707455\nRegisterbekanntmachung nach dem Umwandlungsgesetz 30.07.2025 (Eintragungsdatum)\n\nGarni Zerspanungstechnik e. K.\nEinzelkaufmann / Einzelkauffrau\nSteinen\n\nDen Gläubigern der an der Ausgliederung beteiligten Rechtsträger ist, wenn sie binnen sechs Monaten nach dem Tag, an dem die Eintragung der Ausgliederung in das Register des Sitzes desjenigen Rechtsträgers, dessen Gläubiger sie sind, nach § 19 Abs. 3 UmwG als bekanntgemacht gilt, ihren Anspruch nach Grund und Höhe schriftlich anmelden, Sicherheit zu leisten, soweit sie nicht Befriedigung verlangen können. Dieses Recht steht den Gläubigern jedoch nur zu, wenn sie glaubhaft machen, dass durch die Ausgliederung die Erfüllung ihrer Forderung gefährdet wird."
    },
    {
      "date": "2025-07-30",
      "id": "118257",
      "original_text": "Registerbekanntmachung nach dem Umwandlungsgesetz\nBaden-Württemberg Amtsgericht Mannheim HRB 727700\nWEISS.Accurate GmbH – Buchen Odenwald",
      "type": "Registerbekanntmachung nach dem Umwandlungsgesetz",
      "state": "Baden-Württemberg",
      "amtsgericht": "Amtsgericht Mannheim",
      "registernummer": "HRB 727700",
      "registerart": "HRB",
      "company_name": "WEISS.Accurate GmbH",
      "company_seat": "Buchen Odenwald",
      "details": "30.07.2025 (Bekanntmachungsdatum)\n\nBaden-Württemberg Amtsgericht Mannheim HRB 727700\nRegisterbekanntmachung nach dem Umwandlungsgesetz 30.07.2025 (Eintragungsdatum)\n\nWEISS.Accurate GmbH\nGesellschaft mit beschränkter Haftung\nBuchen Odenwald\n\nAls nicht eingetragen wird bekanntgemacht:\nDen Gläubigern der an der Verschmelzung beteiligten Rechtsträger ist, wenn sie binnen sechs Monaten nach dem Tag, an dem die Eintragung der Verschmelzung in das Register des Sitzes desjenigen Rechtsträgers, dessen Gläubiger sie sind, nach § 19 Abs. 3 UmwG als bekanntgemacht gilt, ihren Anspruch nach Grund und Höhe schriftlich anmelden, Sicherheit zu leisten, soweit sie nicht Befriedigung verlangen können. Dieses Recht steht den Gläubigern jedoch nur zu, wenn sie glaubhaft machen, dass durch die Verschmelzung die Erfüllung ihrer Forderung gefährdet wird."
    },
    {
      "date": "2025-07-30",
      "id": "118258",
      "original_text": "Registerbekanntmachung nach dem Umwandlungsgesetz\nBaden-Württemberg Amtsgericht Freiburg HRB 707269\nFDL Baden GmbH – Freiburg im Breisgau",
      "type": "Registerbekanntmachung nach dem Umwandlungsgesetz",
      "state": "Baden-Württemberg",
      "amtsgericht": "Amtsgericht Freiburg",
      "registernummer": "HRB 707269",
      "registerart": "HRB",
      "company_name": "FDL Baden GmbH",
      "company_seat": "Freiburg im Breisgau",
      "details": "30.07.2025 (Bekanntmachungsdatum)\n\nBaden-Württemberg Amtsgericht Freiburg HRB 707269\nRegisterbekanntmachung nach dem Umwandlungsgesetz 30.07.2025 (Eintragungsdatum)\n\nFDL Baden GmbH\nGesellschaft mit beschränkter Haftung\nFreiburg im Breisgau\n\nAls nicht eingetragen wird bekanntgemacht:\nDen Gläubigern der an der Verschmelzung beteiligten Rechtsträger ist, wenn sie binnen sechs Monaten nach dem Tag, an dem die Eintragung der Verschmelzung in das Register des Sitzes desjenigen Rechtsträgers, dessen Gläubiger sie sind, nach § 19 Abs. 3 UmwG als bekanntgemacht gilt, ihren Anspruch nach Grund und Höhe schriftlich anmelden, Sicherheit zu leisten, soweit sie nicht Befriedigung verlangen können. Dieses Recht steht den Gläubigern jedoch nur zu, wenn sie glaubhaft machen, dass durch die Verschmelzung die Erfüllung ihrer Forderung gefährdet wird."
    },
    {
      "date": "2025-07-30",
      "id": "118259",
      "original_text": "Einreichung neuer Dokumente\nBerlin Amtsgericht Berlin (Charlottenburg) HRB 83923\nToll Collect GmbH – Berlin",
      "type": "Einreichung neuer Dokumente",
      "state": "Berlin",
      "amtsgericht": "Amtsgericht Berlin (Charlottenburg)",
      "registernummer": "HRB 83923",
      "registerart": "HRB",
      "company_name": "Toll Collect GmbH",
      "company_seat": "Berlin",
      "details": "30.07.2025 (Bekanntmachungsdatum)\n\nBerlin Amtsgericht Berlin (Charlottenburg) HRB 83923\nEinreichung neuer Dokumente\n\nToll Collect GmbH\nGesellschaft mit beschränkter Haftung\nBerlin\n\nAls nicht eingetragen wird veröffentlicht:\n\nEs wurde eine neue Liste der Aufsichtsratsmitglieder eingereicht (§52 GmbHG)."
    },
    {
      "date": "2025-07-30",
      "id": "118260",
      "original_text": "Einreichung neuer Dokumente\nSchleswig-Holstein Amtsgericht Kiel HRB 26101\nNEANDER MARINE SE – Kiel",
      "type": "Einreichung neuer Dokumente",
      "state": "Schleswig-Holstein",
      "amtsgericht": "Amtsgericht Kiel",
      "registernummer": "HRB 26101",
      "registerart": "HRB",
      "company_name": "NEANDER MARINE SE",
      "company_seat": "Kiel",
      "details": "30.07.2025 (Bekanntmachungsdatum)\n\nSchleswig-Holstein Amtsgericht Kiel HRB 26101\nEinreichung neuer Dokumente\n\nNEANDER MARINE SE\nEuropäische Aktiengesellschaft (SE)\nKiel\n\nAls nicht eingetragen wird veröffentlicht:\nEine neue Liste der Aufsichtsratsmitglieder ist eingereicht worden."
    },
    {
      "date": "2025-07-30",
      "id": "118261",
      "original_text": "Registerbekanntmachung nach dem Umwandlungsgesetz\nBaden-Württemberg Amtsgericht Freiburg HRB 711076\nRC Baden GmbH – Freiburg im Breisgau",
      "type": "Registerbekanntmachung nach dem Umwandlungsgesetz",
      "state": "Baden-Württemberg",
      "amtsgericht": "Amtsgericht Freiburg",
      "registernummer": "HRB 711076",
      "registerart": "HRB",
      "company_name": "RC Baden GmbH",
      "company_seat": "Freiburg im Breisgau",
      "details": "30.07.2025 (Bekanntmachungsdatum)\n\nBaden-Württemberg Amtsgericht Freiburg HRB 711076\nRegisterbekanntmachung nach dem Umwandlungsgesetz 30.07.2025 (Eintragungsdatum)\n\nRC Baden GmbH\nGesellschaft mit beschränkter Haftung\nFreiburg im Breisgau\n\nAls nicht eingetragen wird bekanntgemacht:\nDen Gläubigern der an der Verschmelzung beteiligten Rechtsträger ist, wenn sie binnen sechs Monaten nach dem Tag, an dem die Eintragung der Verschmelzung in das Register des Sitzes desjenigen Rechtsträgers, dessen Gläubiger sie sind, nach § 19 Abs. 3 UmwG als bekanntgemacht gilt, ihren Anspruch nach Grund und Höhe schriftlich anmelden, Sicherheit zu leisten, soweit sie nicht Befriedigung verlangen können. Dieses Recht steht den Gläubigern jedoch nur zu, wenn sie glaubhaft machen, dass durch die Verschmelzung die Erfüllung ihrer Forderung gefährdet wird."
    },
    {
      "date": "2025-07-30",
      "id": "118262",
      "original_text": "Registerbekanntmachung nach dem Umwandlungsgesetz\nBrandenburg Amtsgericht Cottbus HRB 14458\n\"Mietho & Bär Kabelkom\" Kabelkommunikations-Betriebs GmbH – Cottbus",
      "type": "Registerbekanntmachung nach dem Umwandlungsgesetz",
      "state": "Brandenburg",
      "amtsgericht": "Amtsgericht Cottbus",
      "registernummer": "HRB 14458",
      "registerart": "HRB",
      "company_name": "\"Mietho & Bär Kabelkom\" Kabelkommunikations-Betriebs GmbH",
      "company_seat": "Cottbus",
      "details": "30.07.2025 (Bekanntmachungsdatum)\n\nBrandenburg Amtsgericht Cottbus HRB 14458\nRegisterbekanntmachung nach dem Umwandlungsgesetz 29.07.2025 (Eintragungsdatum)\n\n\"Mietho & Bär Kabelkom\" Kabelkommunikations-Betriebs GmbH\nGesellschaft mit beschränkter Haftung\nCottbus\n\nAls nicht eingetragen wird veröffentlicht:\nDen Gläubigern der an der Spaltung beteiligten Rechtsträger ist, wenn sie binnen sechs Monaten nach dem Tag, an dem die Eintragung der Spaltung in das Register des Sitzes desjenigen Rechtsträgers, dessen Gläubiger sie sind, als bekannt gemacht gilt, ihren Anspruch nach Grund und Höhe schriftlich anmelden, Sicherheit zu leisten, soweit sie nicht Befriedigung verlangen können. Dieses Recht steht den Gläubigern jedoch nur zu, wenn sie glaubhaft machen, dass durch die Spaltung die Erfüllung ihrer Forderung gefährdet wird."
    },
    {
      "date": "2025-07-30",
      "id": "118263",
      "original_text": "Löschungsankündigung\nBaden-Württemberg Amtsgericht Stuttgart HRB 742741\nElite Cars UG (haftungsbeschränkt) – Tübingen",
      "type": "Löschungsankündigung",
      "state": "Baden-Württemberg",
      "amtsgericht": "Amtsgericht Stuttgart",
      "registernummer": "HRB 742741",
      "registerart": "HRB",
      "company_name": "Elite Cars UG (haftungsbeschränkt)",
      "company_seat": "Tübingen",
      "details": "30.07.2025 (Bekanntmachungsdatum)\n\nBaden-Württemberg Amtsgericht Stuttgart HRB 742741\nLöschungsankündigung\n\nElite Cars UG (haftungsbeschränkt)\nGesellschaft mit beschränkter Haftung\nTübingen\n\nDas Gericht beabsichtigt, die Gesellschaft wegen Vermögenslosigkeit im Handelsregister von Amts wegen nach § 394 FamFG zu löschen. Die Frist zur Geltendmachung eines Widerspruchs gegen die beabsichtigte Löschung ist auf zwei Monate ab Veröffentlichung bestimmt."
    },
    {
      "date": "2025-07-30",
      "id": "118264",
      "original_text": "Sonstige Registerbekanntmachung\nSchleswig-Holstein Amtsgericht Pinneberg HRB 14820\nPflegezentrum Breite Straße Hohenlockstedt GmbH – Hohenlockstedt",
      "type": "Sonstige Registerbekanntmachung",
      "state": "Schleswig-Holstein",
      "amtsgericht": "Amtsgericht Pinneberg",
      "registernummer": "HRB 14820",
      "registerart": "HRB",
      "company_name": "Pflegezentrum Breite Straße Hohenlockstedt GmbH",
      "company_seat": "Hohenlockstedt",
      "details": "30.07.2025 (Bekanntmachungsdatum)\n\nSchleswig-Holstein Amtsgericht Pinneberg HRB 14820\nSonstige Registerbekanntmachung\n\nPflegezentrum Breite Straße Hohenlockstedt GmbH\nGesellschaft mit beschränkter Haftung\nHohenlockstedt\n\nAls nicht eingetragen wird veröffentlicht:  Gläubigern, deren Forderungen begründet worden sind, bevor die Eintragung des Beschlusses als nach § 10 des Handelsgesetzbuches bekannt gemacht gilt, ist, wenn sie sich binnen sechs Monaten nach der Bekanntmachung zu diesem Zweck melden, Sicherheit zu leisten, soweit sie nicht Befriedigung verlangen können. Dieses Recht steht den Gläubigern nicht zu, die im Fall des Insolvenzverfahrens ein Recht auf vorzugsweise Befriedigung aus der Deckungsmasse haben, die nach gesetzlicher Vorschrift zu ihrem Schutz errichtet und staatlich überwacht ist."
    },
    {
      "date": "2025-07-30",
      "id": "118265",
      "original_text": "Löschungsankündigung\nBaden-Württemberg Amtsgericht Freiburg HRB 723107\nTaste Food UG (haftungsbeschränkt) – Lörrach",
      "type": "Löschungsankündigung",
      "state": "Baden-Württemberg",
      "amtsgericht": "Amtsgericht Freiburg",
      "registernummer": "HRB 723107",
      "registerart": "HRB",
      "company_name": "Taste Food UG (haftungsbeschränkt)",
      "company_seat": "Lörrach",
      "details": "30.07.2025 (Bekanntmachungsdatum)\n\nBaden-Württemberg Amtsgericht Freiburg HRB 723107\nLöschungsankündigung\n\nTaste Food UG (haftungsbeschränkt)\nGesellschaft mit beschränkter Haftung\nLörrach\n\nAls nicht eingetragen wird bekanntgemacht:\nDas Gericht beabsichtigt, die Gesellschaft wegen Vermögenslosigkeit im Handelsregister von Amts wegen nach § 394 FamFG zu löschen. Die Frist zur Geltendmachung eines Widerspruchs gegen die beabsichtigte Löschung ist auf einen Monat ab Veröffentlichung bestimmt."
    },
    {
      "date": "2025-07-30",
      "id": "118266",
      "original_text": "Löschungsankündigung\nBerlin Amtsgericht Berlin (Charlottenburg) HRB 262420\nMuch Haussanierung GmbH – Berlin",
      "type": "Löschungsankündigung",
      "state": "Berlin",
      "amtsgericht": "Amtsgericht Berlin (Charlottenburg)",
      "registernummer": "HRB 262420",
      "registerart": "HRB",
      "company_name": "Much Haussanierung GmbH",
      "company_seat": "Berlin",
      "details": "30.07.2025 (Bekanntmachungsdatum)\n\nBerlin Amtsgericht Berlin (Charlottenburg) HRB 262420\nLöschungsankündigung\n\nMuch Haussanierung GmbH\nGesellschaft mit beschränkter Haftung\nBerlin\n\nBei der nachstehenden Gesellschaft wird das Amtslöschungsverfahren gemäß § 394 FamFG eingeleitet. Widerspruchsfrist\n6 Wochen."
    },
    {
      "date": "2025-07-30",
      "id": "118267",
      "original_text": "Registerbekanntmachung nach dem Umwandlungsgesetz\nBaden-Württemberg Amtsgericht Stuttgart HRB 245027\nWeber Verwaltungs-GmbH – Gäufelden",
      "type": "Registerbekanntmachung nach dem Umwandlungsgesetz",
      "state": "Baden-Württemberg",
      "amtsgericht": "Amtsgericht Stuttgart",
      "registernummer": "HRB 245027",
      "registerart": "HRB",
      "company_name": "Weber Verwaltungs-GmbH",
      "company_seat": "Gäufelden",
      "details": "30.07.2025 (Bekanntmachungsdatum)\n\nBaden-Württemberg Amtsgericht Stuttgart HRB 245027\nRegisterbekanntmachung nach dem Umwandlungsgesetz 30.07.2025 (Eintragungsdatum)\n\nWeber Verwaltungs-GmbH\nGesellschaft mit beschränkter Haftung\nGäufelden\n\nDen Gläubigern der an der Verschmelzung beteiligten Rechtsträger ist, wenn sie binnen sechs Monaten nach dem Tag, an dem die Eintragung der Verschmelzung in das Register des Sitzes desjenigen Rechtsträgers, dessen Gläubiger sie sind, nach § 19 Abs. 3 UmwG als bekanntgemacht gilt, ihren Anspruch nach Grund und Höhe schriftlich anmelden, Sicherheit zu leisten, soweit sie nicht Befriedigung verlangen können. Dieses Recht steht den Gläubigern jedoch nur zu, wenn sie glaubhaft machen, dass durch die Verschmelzung die Erfüllung ihrer Forderung gefährdet wird."
    },
    {
      "date": "2025-07-30",
      "id": "118268",
      "original_text": "Registerbekanntmachung nach dem Umwandlungsgesetz\nMecklenburg-Vorpommern Amtsgericht Schwerin HRB 2073\nStadtwerke Grevesmühlen GmbH – Grevesmühlen",
      "type": "Registerbekanntmachung nach dem Umwandlungsgesetz",
      "state": "Mecklenburg-Vorpommern",
      "amtsgericht": "Amtsgericht Schwerin",
      "registernummer": "HRB 2073",
      "registerart": "HRB",
      "company_name": "Stadtwerke Grevesmühlen GmbH",
      "company_seat": "Grevesmühlen",
      "details": "30.07.2025 (Bekanntmachungsdatum)\n\nMecklenburg-Vorpommern Amtsgericht Schwerin HRB 2073\nRegisterbekanntmachung nach dem Umwandlungsgesetz 30.07.2025 (Eintragungsdatum)\n\nStadtwerke Grevesmühlen GmbH\nGesellschaft mit beschränkter Haftung\nGrevesmühlen\n\nDie Gesellschaft hat Gläubigern, deren Forderungen vor dieser Bekanntmachung begründet worden sind, Sicherheit zu leisten, soweit sie nicht Befriedigung verlangen können, wenn sie sich binnen sechs Monaten zu diesem Zweck melden."
    },
    {
      "date": "2025-07-30",
      "id": "118269",
      "original_text": "Einreichung neuer Dokumente\nBaden-Württemberg Amtsgericht Stuttgart HRB 760294\nMetabo GmbH – Nürtingen",
      "type": "Einreichung neuer Dokumente",
      "state": "Baden-Württemberg",
      "amtsgericht": "Amtsgericht Stuttgart",
      "registernummer": "HRB 760294",
      "registerart": "HRB",
      "company_name": "Metabo GmbH",
      "company_seat": "Nürtingen",
      "details": "30.07.2025 (Bekanntmachungsdatum)\n\nBaden-Württemberg Amtsgericht Stuttgart HRB 760294\nEinreichung neuer Dokumente\n\nMetabo GmbH\nGesellschaft mit beschränkter Haftung\nNürtingen\n\nAls nicht eingetragen wird bekanntgemacht:\nDie Gesellschaft hat am 29.07.2025 die Liste über die Zusammensetzung des Aufsichtsrats zum Handelsregister eingereicht."
    },
    {
      "date": "2025-07-30",
      "id": "118270",
      "original_text": "Löschungsankündigung\nBerlin Amtsgericht Berlin (Charlottenburg) HRB 206957\nCCS Car Care Service UG (haftungsbeschränkt) – Berlin",
      "type": "Löschungsankündigung",
      "state": "Berlin",
      "amtsgericht": "Amtsgericht Berlin (Charlottenburg)",
      "registernummer": "HRB 206957",
      "registerart": "HRB",
      "company_name": "CCS Car Care Service UG (haftungsbeschränkt)",
      "company_seat": "Berlin",
      "details": "30.07.2025 (Bekanntmachungsdatum)\n\nBerlin Amtsgericht Berlin (Charlottenburg) HRB 206957\nLöschungsankündigung\n\nCCS Car Care Service UG (haftungsbeschränkt)\nGesellschaft mit beschränkter Haftung\nBerlin\n\nBei der nachstehenden Gesellschaft wird das Amtslöschungsverfahren gemäß § 394 FamFG eingeleitet. Widerspruchsfrist 6 Wochen"
    },
    {
      "date": "2025-07-30",
      "id": "118271",
      "original_text": "Registerbekanntmachung nach dem Umwandlungsgesetz\nHamburg Amtsgericht Hamburg HRB 18088\nBaker Tilly GmbH Wirtschaftsprüfungsgesellschaft Steuerberatungsgesellschaft – Hamburg",
      "type": "Registerbekanntmachung nach dem Umwandlungsgesetz",
      "state": "Hamburg",
      "amtsgericht": "Amtsgericht Hamburg",
      "registernummer": "HRB 18088",
      "registerart": "HRB",
      "company_name": "Baker Tilly GmbH Wirtschaftsprüfungsgesellschaft Steuerberatungsgesellschaft",
      "company_seat": "Hamburg",
      "details": "30.07.2025 (Bekanntmachungsdatum)\n\nHamburg Amtsgericht Hamburg HRB 18088\nRegisterbekanntmachung nach dem Umwandlungsgesetz 30.07.2025 (Eintragungsdatum)\n\nBaker Tilly GmbH Wirtschaftsprüfungsgesellschaft Steuerberatungsgesellschaft\nGesellschaft mit beschränkter Haftung\nHamburg\n\nAls nicht eingetragen wird bekannt gemacht:\nDen Gläubigern der an der Verschmelzung beteiligten Gesellschaften ist, wenn sie binnen sechs Monaten nach dem Tag, an dem die Eintragung der Verschmelzung in das Register des Sitzes desjenigen Rechtsträgers, dessen Gläubiger sie sind, nach § 19 Absatz 3 UmwG als bekannt gemacht gilt, ihren Anspruch nach Grund und Höhe schriftlich anmelden, Sicherheit zu leisten, soweit sie nicht Befriedigung verlangen können. Dieses Recht steht den Gläubigern jedoch nur zu, wenn sie glaubhaft machen, dass durch die Verschmelzung die Erfüllung ihrer Forderung gefährdet wird."
    },
    {
      "date": "2025-07-30",
      "id": "118272",
      "original_text": "Registerbekanntmachung nach dem Umwandlungsgesetz\nBerlin Amtsgericht Berlin (Charlottenburg) HRB 258659\nGoya GmbH – Berlin",
      "type": "Registerbekanntmachung nach dem Umwandlungsgesetz",
      "state": "Berlin",
      "amtsgericht": "Amtsgericht Berlin (Charlottenburg)",
      "registernummer": "HRB 258659",
      "registerart": "HRB",
      "company_name": "Goya GmbH",
      "company_seat": "Berlin",
      "details": "30.07.2025 (Bekanntmachungsdatum)\n\nBerlin Amtsgericht Berlin (Charlottenburg) HRB 258659\nRegisterbekanntmachung nach dem Umwandlungsgesetz 23.07.2025 (Eintragungsdatum)\n\nGoya GmbH\nGesellschaft mit beschränkter Haftung\nBerlin\n\nZu Eintragungsnummer 2 vom 23.07.2025 wird als nicht eingetragen veröffentlicht:Den Gläubigern der an der Verschmelzung beteiligten Rechtsträger ist, wenn sie binnen sechs Monaten nach dem Tag, an dem die Eintragung der Verschmelzung in das Register des Sitzes desjenigen Rechtsträgers, dessen Gläubiger sie sind, als bekannt gemacht gilt, ihren Anspruch nach Grund und Höhe schriftlich anmelden, Sicherheit zu leisten, soweit sie nicht Befriedigung verlangen können. Dieses Recht steht den Gläubigern jedoch nur zu, wenn sie glaubhaft machen, dass durch die Verschmelzung die Erfüllung ihrer Forderung gefährdet wird. Das Recht, Sicherheitsleistung zu verlangen, steht Gläubigern nicht zu, die im Falle der Insolvenz ein Recht auf vorzugsweise Befriedigung aus einer Deckungsmasse haben, die nach gesetzlicher Vorschrift zu ihrem Schutz errichtet und staatlich überwacht ist."
    },
    {
      "date": "2025-07-30",
      "id": "118273",
      "original_text": "Registerbekanntmachung nach dem Umwandlungsgesetz\nMecklenburg-Vorpommern Amtsgericht Schwerin HRB 3813\nGasversorgung Grevesmühlen GmbH – Grevesmühlen",
      "type": "Registerbekanntmachung nach dem Umwandlungsgesetz",
      "state": "Mecklenburg-Vorpommern",
      "amtsgericht": "Amtsgericht Schwerin",
      "registernummer": "HRB 3813",
      "registerart": "HRB",
      "company_name": "Gasversorgung Grevesmühlen GmbH",
      "company_seat": "Grevesmühlen",
      "details": "30.07.2025 (Bekanntmachungsdatum)\n\nMecklenburg-Vorpommern Amtsgericht Schwerin HRB 3813\nRegisterbekanntmachung nach dem Umwandlungsgesetz 30.07.2025 (Eintragungsdatum)\n\nGasversorgung Grevesmühlen GmbH\nGesellschaft mit beschränkter Haftung\nGrevesmühlen\n\nDie Gesellschaft hat Gläubigern, deren Forderungen vor dieser Bekanntmachung begründet worden sind, Sicherheit zu leisten, soweit sie nicht Befriedigung verlangen können, wenn sie sich binnen sechs Monaten zu diesem Zweck melden."
    },
    {
      "date": "2025-07-30",
      "id": "118274",
      "original_text": "Registerbekanntmachung nach dem Umwandlungsgesetz\nBerlin Amtsgericht Berlin (Charlottenburg) HRB 196159\nAxel Springer Deutschland GmbH – Berlin",
      "type": "Registerbekanntmachung nach dem Umwandlungsgesetz",
      "state": "Berlin",
      "amtsgericht": "Amtsgericht Berlin (Charlottenburg)",
      "registernummer": "HRB 196159",
      "registerart": "HRB",
      "company_name": "Axel Springer Deutschland GmbH",
      "company_seat": "Berlin",
      "details": "30.07.2025 (Bekanntmachungsdatum)\n\nBerlin Amtsgericht Berlin (Charlottenburg) HRB 196159\nRegisterbekanntmachung nach dem Umwandlungsgesetz 29.07.2025 (Eintragungsdatum)\n\nAxel Springer Deutschland GmbH\nGesellschaft mit beschränkter Haftung\nBerlin\n\nZu Eintragungsnummer 41 vom 29.07.2025 wird als nicht eingetragen veröffentlicht: Den Gläubigern der an der Verschmelzung beteiligten Rechtsträger ist, wenn sie binnen sechs Monaten nach dem Tag, an dem die Eintragung der Verschmelzung in das Register des Sitzes desjenigen Rechtsträgers, dessen Gläubiger sie sind, als bekannt gemacht gilt, ihren Anspruch nach Grund und Höhe schriftlich anmelden, Sicherheit zu leisten, soweit sie nicht Befriedigung verlangen können. Dieses Recht steht den Gläubigern jedoch nur zu, wenn sie glaubhaft machen, dass durch die Verschmelzung die Erfüllung ihrer Forderung gefährdet wird. Das Recht, Sicherheitsleistung zu verlangen, steht Gläubigern nicht zu, die im Falle der Insolvenz ein Recht auf vorzugsweise Befriedigung aus einer Deckungsmasse haben, die nach gesetzlicher Vorschrift zu ihrem Schutz errichtet und staatlich überwacht ist."
    },
    {
      "date": "2025-07-30",
      "id": "118275",
      "original_text": "Löschungsankündigung\nSchleswig-Holstein Amtsgericht Pinneberg HRA 1828 IZ\nErste RHW Schiffahrtsgesellschaft mbH & Co. KG – Glückstadt",
      "type": "Löschungsankündigung",
      "state": "Schleswig-Holstein",
      "amtsgericht": "Amtsgericht Pinneberg",
      "registernummer": "HRA 1828 IZ",
      "registerart": "HRA",
      "company_name": "Erste RHW Schiffahrtsgesellschaft mbH & Co. KG",
      "company_seat": "Glückstadt",
      "details": "30.07.2025 (Bekanntmachungsdatum)\n\nSchleswig-Holstein Amtsgericht Pinneberg HRA 1828 IZ\nLöschungsankündigung\n\nErste RHW Schiffahrtsgesellschaft mbH & Co. KG\nKommanditgesellschaft\nGlückstadt\n\nBei der nachstehenden Firma wird das Amtslöschungsverfahren gemäß § 31 Abs. 2 HGB eingeleitet. Widerspruchsfrist: 2 Monate."
    },
    {
      "date": "2025-07-30",
      "id": "118276",
      "original_text": "Sonstige Registerbekanntmachung\nBerlin Amtsgericht Berlin (Charlottenburg) GnR 320\nVerein für Erholungs- und Ferienstätten Berlin-Wilmersdorf eG – Berlin",
      "type": "Sonstige Registerbekanntmachung",
      "state": "Berlin",
      "amtsgericht": "Amtsgericht Berlin (Charlottenburg)",
      "registernummer": "GnR 320",
      "registerart": "GnR",
      "company_name": "Verein für Erholungs- und Ferienstätten Berlin-Wilmersdorf eG",
      "company_seat": "Berlin",
      "details": "30.07.2025 (Bekanntmachungsdatum)\n\nBerlin Amtsgericht Berlin (Charlottenburg) GnR 320\nSonstige Registerbekanntmachung\n\nVerein für Erholungs- und Ferienstätten Berlin-Wilmersdorf eG\neingetragene Genossenschaft\nBerlin\n\nAls nicht eingetragen wird veröffentlicht: Durch satzungsändernden Beschluss der Generalversammlung vom 12.12.2024 ist die Nachschusspflicht aufgehoben worden. Den Gläubigern der Genossenschaft ist, wenn sie sich binnen sechs Monaten nach der Bekanntmachung bei der Genossenschaft zu diesem Zweck melden, Sicherheit zu leisten, sowie sie nicht Befriedigung verlangen können."
    },
    {
      "date": "2025-07-30",
      "id": "118277",
      "original_text": "Löschungsankündigung\nBrandenburg Amtsgericht Frankfurt/Oder HRB 10075\nstarDöner Lebensmittel Handels GmbH – Panketal",
      "type": "Löschungsankündigung",
      "state": "Brandenburg",
      "amtsgericht": "Amtsgericht Frankfurt/Oder",
      "registernummer": "HRB 10075",
      "registerart": "HRB",
      "company_name": "starDöner Lebensmittel Handels GmbH",
      "company_seat": "Panketal",
      "details": "30.07.2025 (Bekanntmachungsdatum)\n\nBrandenburg Amtsgericht Frankfurt/Oder HRB 10075\nLöschungsankündigung\n\nstarDöner Lebensmittel Handels GmbH\nGesellschaft mit beschränkter Haftung\nPanketal\n\nBei der nachstehenden Gesellschaft wird das Amtslöschungsverfahren gemäß § 394 Abs. 1 FamFG eingeleitet."
    },
    {
      "date": "2025-07-30",
      "id": "118278",
      "original_text": "Registerbekanntmachung nach dem Umwandlungsgesetz\nSchleswig-Holstein Amtsgericht Lübeck HRB 22486\nRedfinn GmbH – Neukirchen",
      "type": "Registerbekanntmachung nach dem Umwandlungsgesetz",
      "state": "Schleswig-Holstein",
      "amtsgericht": "Amtsgericht Lübeck",
      "registernummer": "HRB 22486",
      "registerart": "HRB",
      "company_name": "Redfinn GmbH",
      "company_seat": "Neukirchen",
      "details": "30.07.2025 (Bekanntmachungsdatum)\n\nSchleswig-Holstein Amtsgericht Lübeck HRB 22486\nRegisterbekanntmachung nach dem Umwandlungsgesetz 29.07.2025 (Eintragungsdatum)\n\nRedfinn GmbH\nGesellschaft mit beschränkter Haftung\nNeukirchen\n\nZu Eintragungsnummer 3 vom 29.07.2025 wird als nicht eingetragen veröffentlicht:\nDen Gläubigern der an der Verschmelzung beteiligten Rechtsträger ist, wenn sie binnen sechs Monaten nach dem Tag, an dem die Eintragung der Verschmelzung in das Register des Sitzes desjenigen Rechtsträgers, dessen Gläubiger sie sind, als bekannt gemacht gilt, ihren Anspruch nach Grund und Höhe schriftlich anmelden, Sicherheit zu leisten, soweit sie nicht Befriedigung verlangen können. Dieses Recht steht den Gläubigern jedoch nur zu, wenn sie glaubhaft machen, dass durch die Verschmelzung die Erfüllung ihrer Forderung gefährdet wird."
    },
    {
      "date": "2025-07-30",
      "id": "118279",
      "original_text": "Registerbekanntmachung nach dem Umwandlungsgesetz\nBerlin Amtsgericht Berlin (Charlottenburg) HRB 271259\nAxel Springer Auto-Verlag GmbH – Berlin",
      "type": "Registerbekanntmachung nach dem Umwandlungsgesetz",
      "state": "Berlin",
      "amtsgericht": "Amtsgericht Berlin (Charlottenburg)",
      "registernummer": "HRB 271259",
      "registerart": "HRB",
      "company_name": "Axel Springer Auto-Verlag GmbH",
      "company_seat": "Berlin",
      "details": "30.07.2025 (Bekanntmachungsdatum)\n\nBerlin Amtsgericht Berlin (Charlottenburg) HRB 271259\nRegisterbekanntmachung nach dem Umwandlungsgesetz 29.07.2025 (Eintragungsdatum)\n\nAxel Springer Auto-Verlag GmbH\nGesellschaft mit beschränkter Haftung\nBerlin\n\nZu Eintragungsnummer 5 vom 29.07.2025 wird als nicht eingetragen veröffentlicht: Den Gläubigern der an der Verschmelzung beteiligten Rechtsträger ist, wenn sie binnen sechs Monaten nach dem Tag, an dem die Eintragung der Verschmelzung in das Register des Sitzes desjenigen Rechtsträgers, dessen Gläubiger sie sind, als bekannt gemacht gilt, ihren Anspruch nach Grund und Höhe schriftlich anmelden, Sicherheit zu leisten, soweit sie nicht Befriedigung verlangen können. Dieses Recht steht den Gläubigern jedoch nur zu, wenn sie glaubhaft machen, dass durch die Verschmelzung die Erfüllung ihrer Forderung gefährdet wird. Das Recht, Sicherheitsleistung zu verlangen, steht Gläubigern nicht zu, die im Falle der Insolvenz ein Recht auf vorzugsweise Befriedigung aus einer Deckungsmasse haben, die nach gesetzlicher Vorschrift zu ihrem Schutz errichtet und staatlich überwacht ist."
    },
    {
      "date": "2025-07-30",
      "id": "118280",
      "original_text": "Sonstige Registerbekanntmachung\nBerlin Amtsgericht Berlin (Charlottenburg) HRB 271259\nAxel Springer Auto-Verlag GmbH – Berlin",
      "type": "Sonstige Registerbekanntmachung",
      "state": "Berlin",
      "amtsgericht": "Amtsgericht Berlin (Charlottenburg)",
      "registernummer": "HRB 271259",
      "registerart": "HRB",
      "company_name": "Axel Springer Auto-Verlag GmbH",
      "company_seat": "Berlin",
      "details": "30.07.2025 (Bekanntmachungsdatum)\n\nBerlin Amtsgericht Berlin (Charlottenburg) HRB 271259\nSonstige Registerbekanntmachung\n\nAxel Springer Auto-Verlag GmbH\nGesellschaft mit beschränkter Haftung\nBerlin\n\nAls nicht eingetragen wird veröffentlicht: Der andere Vertragsteil hat den Gläubigern dieses Rechtsträgers, deren Forderungen begründet worden sind, bevor die Eintragung der Beendigung dieses Vertrages in das Handelsregister nach § 10 des Handelsgesetzbuches als bekannt gemacht gilt, Sicherheit zu leisten, wenn sie sich binnen sechs Monaten nach der Bekanntmachung der Eintragung zu diesem Zweck bei ihm melden. Dieses Recht steht den Gläubigern nicht zu, die im Fall des Insolvenzverfahrens ein Recht auf vorzugsweise Befriedigung aus der Deckungsmasse haben, die nach gesetzlicher Vorschrift zu ihrem Schutz errichtet und staatlich überwacht ist."
    },
    {
      "date": "2025-07-30",
      "id": "118281",
      "original_text": "Registerbekanntmachung nach dem Umwandlungsgesetz\nThüringen Amtsgericht Jena HRB 516133\nIU Internationale Hochschule GmbH – Erfurt",
      "type": "Registerbekanntmachung nach dem Umwandlungsgesetz",
      "state": "Thüringen",
      "amtsgericht": "Amtsgericht Jena",
      "registernummer": "HRB 516133",
      "registerart": "HRB",
      "company_name": "IU Internationale Hochschule GmbH",
      "company_seat": "Erfurt",
      "details": "30.07.2025 (Bekanntmachungsdatum)\n\nThüringen Amtsgericht Jena HRB 516133\nRegisterbekanntmachung nach dem Umwandlungsgesetz 30.07.2025 (Eintragungsdatum)\n\nIU Internationale Hochschule GmbH\nGesellschaft mit beschränkter Haftung\nErfurt\n\nNicht eingetragen: Den Gläubigern der an der Verschmelzung beteiligten Rechtsträger, ist wenn sie binnen sechs Monaten nach dem Tag, an dem die Eintragung der Verschmelzung in das Register des Sitzes desjenigen Rechtsträgers, dessen Gläubiger sie sind,  nach § 19 Abs. 3 UmwG als bekanntgemacht gilt, ihren Anspruch nach Grund und Höhe schriftlich anmelden, Sicherheit zu leisten, soweit sie nicht Befriedigung verlangen können. Dieses Recht steht ihnen jedoch nur zu, wenn sie glaubhaft machen, daß durch die Verschmelzung die Erfüllung ihrer Forderung gefährdet wird."
    },
    {
      "date": "2025-07-30",
      "id": "118282",
      "original_text": "Einreichung neuer Dokumente\nThüringen Amtsgericht Jena HRB 111457\nFunkwerk AG – Kölleda",
      "type": "Einreichung neuer Dokumente",
      "state": "Thüringen",
      "amtsgericht": "Amtsgericht Jena",
      "registernummer": "HRB 111457",
      "registerart": "HRB",
      "company_name": "Funkwerk AG",
      "company_seat": "Kölleda",
      "details": "30.07.2025 (Bekanntmachungsdatum)\n\nThüringen Amtsgericht Jena HRB 111457\nEinreichung neuer Dokumente 30.07.2025 (Eintragungsdatum)\n\nFunkwerk AG\nAktiengesellschaft\nKölleda\n\nBekanntmachung gem. § 106 AktG: Aufgrund einer Veränderung in den Personen der Aufsichtsratsmitglieder ist durch den Vorstand eine neue Liste zum Handelsregister eingereicht worden."
    },
    {
      "date": "2025-07-30",
      "id": "118283",
      "original_text": "Registerbekanntmachung nach dem Umwandlungsgesetz\nThüringen Amtsgericht Jena HRB 516133\nIU Internationale Hochschule GmbH – Erfurt",
      "type": "Registerbekanntmachung nach dem Umwandlungsgesetz",
      "state": "Thüringen",
      "amtsgericht": "Amtsgericht Jena",
      "registernummer": "HRB 516133",
      "registerart": "HRB",
      "company_name": "IU Internationale Hochschule GmbH",
      "company_seat": "Erfurt",
      "details": "30.07.2025 (Bekanntmachungsdatum)\n\nThüringen Amtsgericht Jena HRB 516133\nRegisterbekanntmachung nach dem Umwandlungsgesetz 30.07.2025 (Eintragungsdatum)\n\nIU Internationale Hochschule GmbH\nGesellschaft mit beschränkter Haftung\nErfurt\n\nNicht eingetragen: Den Gläubigern der an der Verschmelzung beteiligten Rechtsträger, ist wenn sie binnen sechs Monaten nach dem Tag, an dem die Eintragung der Verschmelzung in das Register des Sitzes desjenigen Rechtsträgers, dessen Gläubiger sie sind,  nach § 19 Abs. 3 UmwG als bekanntgemacht gilt, ihren Anspruch nach Grund und Höhe schriftlich anmelden, Sicherheit zu leisten, soweit sie nicht Befriedigung verlangen können. Dieses Recht steht ihnen jedoch nur zu, wenn sie glaubhaft machen, daß durch die Verschmelzung die Erfüllung ihrer Forderung gefährdet wird."
    },
    {
      "date": "2025-07-30",
      "id": "118284",
      "original_text": "Registerbekanntmachung nach dem Umwandlungsgesetz\nThüringen Amtsgericht Jena HRB 516133\nIU Internationale Hochschule GmbH – Erfurt",
      "type": "Registerbekanntmachung nach dem Umwandlungsgesetz",
      "state": "Thüringen",
      "amtsgericht": "Amtsgericht Jena",
      "registernummer": "HRB 516133",
      "registerart": "HRB",
      "company_name": "IU Internationale Hochschule GmbH",
      "company_seat": "Erfurt",
      "details": "30.07.2025 (Bekanntmachungsdatum)\n\nThüringen Amtsgericht Jena HRB 516133\nRegisterbekanntmachung nach dem Umwandlungsgesetz 30.07.2025 (Eintragungsdatum)\n\nIU Internationale Hochschule GmbH\nGesellschaft mit beschränkter Haftung\nErfurt\n\nNicht eingetragen: Den Gläubigern der an der Verschmelzung beteiligten Rechtsträger, ist wenn sie binnen sechs Monaten nach dem Tag, an dem die Eintragung der Verschmelzung in das Register des Sitzes desjenigen Rechtsträgers, dessen Gläubiger sie sind,  nach § 19 Abs. 3 UmwG als bekanntgemacht gilt, ihren Anspruch nach Grund und Höhe schriftlich anmelden, Sicherheit zu leisten, soweit sie nicht Befriedigung verlangen können. Dieses Recht steht ihnen jedoch nur zu, wenn sie glaubhaft machen, daß durch die Verschmelzung die Erfüllung ihrer Forderung gefährdet wird."
    },
    {
      "date": "2025-07-30",
      "id": "118285",
      "original_text": "Registerbekanntmachung nach dem Umwandlungsgesetz\nHamburg Amtsgericht Hamburg HRB 177498\nGGW GmbH – Hamburg",
      "type": "Registerbekanntmachung nach dem Umwandlungsgesetz",
      "state": "Hamburg",
      "amtsgericht": "Amtsgericht Hamburg",
      "registernummer": "HRB 177498",
      "registerart": "HRB",
      "company_name": "GGW GmbH",
      "company_seat": "Hamburg",
      "details": "30.07.2025 (Bekanntmachungsdatum)\n\nHamburg Amtsgericht Hamburg HRB 177498\nRegisterbekanntmachung nach dem Umwandlungsgesetz 30.07.2025 (Eintragungsdatum)\n\nGGW GmbH\nGesellschaft mit beschränkter Haftung\nHamburg\n\nAls nicht eingetragen wird bekannt gemacht:\nDen Gläubigern der an der Verschmelzung beteiligten Gesellschaften ist, wenn sie binnen sechs Monaten nach dem Tag, an dem die Eintragung der Verschmelzung in das Register des Sitzes desjenigen Rechtsträgers, dessen Gläubiger sie sind, nach § 19 Absatz 3 UmwG als bekannt gemacht gilt, ihren Anspruch nach Grund und Höhe schriftlich anmelden, Sicherheit zu leisten, soweit sie nicht Befriedigung verlangen können. Dieses Recht steht den Gläubigern jedoch nur zu, wenn sie glaubhaft machen, dass durch die Verschmelzung die Erfüllung ihrer Forderung gefährdet wird."
    },
    {
      "date": "2025-07-30",
      "id": "118286",
      "original_text": "Registerbekanntmachung nach dem Umwandlungsgesetz\nBerlin Amtsgericht Berlin (Charlottenburg) HRA 64354\nDominik Thele GabeMitFarbe e.K. – Berlin",
      "type": "Registerbekanntmachung nach dem Umwandlungsgesetz",
      "state": "Berlin",
      "amtsgericht": "Amtsgericht Berlin (Charlottenburg)",
      "registernummer": "HRA 64354",
      "registerart": "HRA",
      "company_name": "Dominik Thele GabeMitFarbe e.K.",
      "company_seat": "Berlin",
      "details": "30.07.2025 (Bekanntmachungsdatum)\n\nBerlin Amtsgericht Berlin (Charlottenburg) HRA 64354\nRegisterbekanntmachung nach dem Umwandlungsgesetz 29.07.2025 (Eintragungsdatum)\n\nDominik Thele GabeMitFarbe e.K.\nEinzelkaufmann / Einzelkauffrau\nBerlin\n\nZu Eintragungsnummer 2 vom 29.07.2025 wird als nicht eingetragen veröffentlicht: Den Gläubigern der an der Spaltung beteiligten Rechtsträger ist, wenn sie binnen sechs Monaten nach dem Tag, an dem die Eintragung der Spaltung in das Register des Sitzes desjenigen Rechtsträgers, dessen Gläubiger sie sind, als bekannt gemacht gilt, ihren Anspruch nach Grund und Höhe schriftlich anmelden, Sicherheit zu leisten, soweit sie nicht Befriedigung verlangen können. Dieses Recht steht den Gläubigern jedoch nur zu, wenn sie glaubhaft machen, dass durch die Spaltung die Erfüllung ihrer Forderung gefährdet wird. Das Recht, Sicherheitsleistung zu verlangen, steht Gläubigern nicht zu, die im Falle der Insolvenz ein Recht auf vorzugsweise Befriedigung aus einer Deckungsmasse haben, die nach gesetzlicher Vorschrift zu ihrem Schutz errichtet und staatlich überwacht ist."
    },
    {
      "date": "2025-07-30",
      "id": "118287",
      "original_text": "Registerbekanntmachung nach dem Umwandlungsgesetz\nSchleswig-Holstein Amtsgericht Lübeck HRB 25554\nBockholdt GmbH – Lübeck",
      "type": "Registerbekanntmachung nach dem Umwandlungsgesetz",
      "state": "Schleswig-Holstein",
      "amtsgericht": "Amtsgericht Lübeck",
      "registernummer": "HRB 25554",
      "registerart": "HRB",
      "company_name": "Bockholdt GmbH",
      "company_seat": "Lübeck",
      "details": "30.07.2025 (Bekanntmachungsdatum)\n\nSchleswig-Holstein Amtsgericht Lübeck HRB 25554\nRegisterbekanntmachung nach dem Umwandlungsgesetz 29.07.2025 (Eintragungsdatum)\n\nBockholdt GmbH\nGesellschaft mit beschränkter Haftung\nLübeck\n\nZu Eintragungsnummer 6 vom 29.07.2025 wird als nicht eingetragen veröffentlicht:  Den Gläubigern der an der Verschmelzung beteiligten Rechtsträger ist, wenn sie binnen sechs Monaten nach dem Tag, an dem die Eintragung der Verschmelzung in das Register des Sitzes desjenigen Rechtsträgers, dessen Gläubiger sie sind, als bekannt gemacht gilt, ihren Anspruch nach Grund und Höhe schriftlich anmelden, Sicherheit zu leisten, soweit sie nicht Befriedigung verlangen können. Dieses Recht steht den Gläubigern jedoch nur zu, wenn sie glaubhaft machen, dass durch die Verschmelzung die Erfüllung ihrer Forderung gefährdet wird."
    },
    {
      "date": "2025-07-30",
      "id": "118288",
      "original_text": "Registerbekanntmachung nach dem Umwandlungsgesetz\nMecklenburg-Vorpommern Amtsgericht Rostock HRB 16156\nCarl Zeiss Microscopy Software Center Rostock GmbH – Rostock",
      "type": "Registerbekanntmachung nach dem Umwandlungsgesetz",
      "state": "Mecklenburg-Vorpommern",
      "amtsgericht": "Amtsgericht Rostock",
      "registernummer": "HRB 16156",
      "registerart": "HRB",
      "company_name": "Carl Zeiss Microscopy Software Center Rostock GmbH",
      "company_seat": "Rostock",
      "details": "30.07.2025 (Bekanntmachungsdatum)\n\nMecklenburg-Vorpommern Amtsgericht Rostock HRB 16156\nRegisterbekanntmachung nach dem Umwandlungsgesetz 30.07.2025 (Eintragungsdatum)\n\nCarl Zeiss Microscopy Software Center Rostock GmbH\nGesellschaft mit beschränkter Haftung\nRostock\n\nAls nicht eingetragen wird veröffentlicht: Den Gläubigern der an der Verschmelzung beteiligten Rechtsträger ist, wenn sie binnen sechs Monaten nach dem Tag, an dem die Eintragung der Verschmelzung in das Register des Sitzes desjenigen Rechtsträgers, dessen Gläubiger sie sind, nach § 19 Abs. 3 UmwG als bekannt gemacht gilt,\nihren Anspruch nach Grund und Höhe in Textform anmelden, Sicherheit zu leisten, soweit sie nicht Befriedigung verlangen können. Dieses Recht steht den Gläubigern jedoch nur zu, wenn sie glaubhaft machen, dass durch die Verschmelzung die Erfüllung der Forderung gefährdet wird."
    },
    {
      "date": "2025-07-30",
      "id": "118289",
      "original_text": "Registerbekanntmachung nach dem Umwandlungsgesetz\nBerlin Amtsgericht Berlin (Charlottenburg) HRB 277544\nGabeMitFarbe GmbH – Berlin",
      "type": "Registerbekanntmachung nach dem Umwandlungsgesetz",
      "state": "Berlin",
      "amtsgericht": "Amtsgericht Berlin (Charlottenburg)",
      "registernummer": "HRB 277544",
      "registerart": "HRB",
      "company_name": "GabeMitFarbe GmbH",
      "company_seat": "Berlin",
      "details": "30.07.2025 (Bekanntmachungsdatum)\n\nBerlin Amtsgericht Berlin (Charlottenburg) HRB 277544\nRegisterbekanntmachung nach dem Umwandlungsgesetz 29.07.2025 (Eintragungsdatum)\n\nGabeMitFarbe GmbH\nGesellschaft mit beschränkter Haftung\nBerlin\n\nZu Eintragungsnummer 1 vom 29.07.2025 wird als nicht eingetragen veröffentlicht: Den Gläubigern der an der Spaltung beteiligten Rechtsträger ist, wenn sie binnen sechs Monaten nach dem Tag, an dem die Eintragung der Spaltung in das Register des Sitzes desjenigen Rechtsträgers, dessen Gläubiger sie sind, als bekannt gemacht gilt, ihren Anspruch nach Grund und Höhe schriftlich anmelden, Sicherheit zu leisten, soweit sie nicht Befriedigung verlangen können. Dieses Recht steht den Gläubigern jedoch nur zu, wenn sie glaubhaft machen, dass durch die Spaltung die Erfüllung ihrer Forderung gefährdet wird. Das Recht, Sicherheitsleistung zu verlangen, steht Gläubigern nicht zu, die im Falle der Insolvenz ein Recht auf vorzugsweise Befriedigung aus einer Deckungsmasse haben, die nach gesetzlicher Vorschrift zu ihrem Schutz errichtet und staatlich überwacht ist."
    },
    {
      "date": "2025-07-30",
      "id": "118290",
      "original_text": "Löschungsankündigung\nBerlin Amtsgericht Berlin (Charlottenburg) HRB 223582\nNeue Odessa Bar Gaststätten GmbH – Berlin",
      "type": "Löschungsankündigung",
      "state": "Berlin",
      "amtsgericht": "Amtsgericht Berlin (Charlottenburg)",
      "registernummer": "HRB 223582",
      "registerart": "HRB",
      "company_name": "Neue Odessa Bar Gaststätten GmbH",
      "company_seat": "Berlin",
      "details": "30.07.2025 (Bekanntmachungsdatum)\n\nBerlin Amtsgericht Berlin (Charlottenburg) HRB 223582\nLöschungsankündigung\n\nNeue Odessa Bar Gaststätten GmbH\nGesellschaft mit beschränkter Haftung\nBerlin\n\nBei der nachstehenden Gesellschaft wird das Amtslöschungsverfahren gemäß § 394 FamFG eingeleitet. Widerspruchsfrist 6 Wochen"
    },
    {
      "date": "2025-07-30",
      "id": "118291",
      "original_text": "Registerbekanntmachung nach dem Umwandlungsgesetz\nHamburg Amtsgericht Hamburg HRB 177498\nGGW GmbH – Hamburg",
      "type": "Registerbekanntmachung nach dem Umwandlungsgesetz",
      "state": "Hamburg",
      "amtsgericht": "Amtsgericht Hamburg",
      "registernummer": "HRB 177498",
      "registerart": "HRB",
      "company_name": "GGW GmbH",
      "company_seat": "Hamburg",
      "details": "30.07.2025 (Bekanntmachungsdatum)\n\nHamburg Amtsgericht Hamburg HRB 177498\nRegisterbekanntmachung nach dem Umwandlungsgesetz 30.07.2025 (Eintragungsdatum)\n\nGGW GmbH\nGesellschaft mit beschränkter Haftung\nHamburg\n\nAls nicht eingetragen wird bekannt gemacht:\nDen Gläubigern der an der Verschmelzung beteiligten Gesellschaften ist, wenn sie binnen sechs Monaten nach dem Tag, an dem die Eintragung der Verschmelzung in das Register des Sitzes desjenigen Rechtsträgers, dessen Gläubiger sie sind, nach § 19 Absatz 3 UmwG als bekannt gemacht gilt, ihren Anspruch nach Grund und Höhe schriftlich anmelden, Sicherheit zu leisten, soweit sie nicht Befriedigung verlangen können. Dieses Recht steht den Gläubigern jedoch nur zu, wenn sie glaubhaft machen, dass durch die Verschmelzung die Erfüllung ihrer Forderung gefährdet wird."
    },
    {
      "date": "2025-07-30",
      "id": "118292",
      "original_text": "Registerbekanntmachung nach dem Umwandlungsgesetz\nBerlin Amtsgericht Berlin (Charlottenburg) VR 29826\nKIDZ - Kinder- und Jugendhilfe im Dienst der Zukunft e.V. – Berlin",
      "type": "Registerbekanntmachung nach dem Umwandlungsgesetz",
      "state": "Berlin",
      "amtsgericht": "Amtsgericht Berlin (Charlottenburg)",
      "registernummer": "VR 29826",
      "registerart": "VR",
      "company_name": "KIDZ - Kinder- und Jugendhilfe im Dienst der Zukunft e.V.",
      "company_seat": "Berlin",
      "details": "30.07.2025 (Bekanntmachungsdatum)\n\nBerlin Amtsgericht Berlin (Charlottenburg) VR 29826\nRegisterbekanntmachung nach dem Umwandlungsgesetz 29.07.2025 (Eintragungsdatum)\n\nKIDZ - Kinder- und Jugendhilfe im Dienst der Zukunft e.V.\neingetragener Verein\nBerlin\n\nZu Eintragungsnummer 4 vom 29.07.2025 wird als nicht eingetragen veröffentlicht: Den Gläubigern ist, wenn sie binnen sechs Monaten nach dem Tag, an dem die Eintragung der Umwandlung als bekannt gemacht gilt, ihren Anspruch nach Grund und Höhe schriftlich anmelden, Sicherheit zu leisten, soweit sie nicht Befriedigung verlangen können. Dieses Recht steht den Gläubigern jedoch nur zu, wenn sie glaubhaft machen, dass durch die Umwandlung die Erfüllung ihrer Forderung gefährdet wird. Das Recht, Sicherheitsleistung zu verlangen, steht Gläubigern nicht zu, die im Falle der Insolvenz ein Recht auf vorzugsweise Befriedigung aus einer Deckungsmasse haben, die nach gesetzlicher Vorschrift zu ihrem Schutz errichtet und staatlich überwacht ist."
    },
    {
      "date": "2025-07-30",
      "id": "118293",
      "original_text": "Einreichung neuer Dokumente\nBaden-Württemberg Amtsgericht Mannheim HRB 715781\nesentri AG – Ettlingen",
      "type": "Einreichung neuer Dokumente",
      "state": "Baden-Württemberg",
      "amtsgericht": "Amtsgericht Mannheim",
      "registernummer": "HRB 715781",
      "registerart": "HRB",
      "company_name": "esentri AG",
      "company_seat": "Ettlingen",
      "details": "30.07.2025 (Bekanntmachungsdatum)\n\nBaden-Württemberg Amtsgericht Mannheim HRB 715781\nEinreichung neuer Dokumente\n\nesentri AG\nAktiengesellschaft\nEttlingen\n\nDie Gesellschaft hat am 30.07.2025 die Liste über die Zusammensetzung des Aufsichtsrats zum Handelsregister eingereicht."
    },
    {
      "date": "2025-07-30",
      "id": "118294",
      "original_text": "Löschungsankündigung\nSchleswig-Holstein Amtsgericht Lübeck HRB 23076\nBlue Services und Gastronomie GmbH – Lübeck",
      "type": "Löschungsankündigung",
      "state": "Schleswig-Holstein",
      "amtsgericht": "Amtsgericht Lübeck",
      "registernummer": "HRB 23076",
      "registerart": "HRB",
      "company_name": "Blue Services und Gastronomie GmbH",
      "company_seat": "Lübeck",
      "details": "30.07.2025 (Bekanntmachungsdatum)\n\nSchleswig-Holstein Amtsgericht Lübeck HRB 23076\nLöschungsankündigung\n\nBlue Services und Gastronomie GmbH\nGesellschaft mit beschränkter Haftung\nLübeck\n\nEs ist die Löschung der nachstehenden Gesellschaft wegen Vermögenslosigkeit gemäß § 394 FamFG beabsichtigt."
    },
    {
      "date": "2025-07-30",
      "id": "118295",
      "original_text": "Registerbekanntmachung nach dem Umwandlungsgesetz\nBaden-Württemberg Amtsgericht Stuttgart HRA 741861\nM. Kappel l. Entsorgung und Wiederverwertung (Inh. Roger Kappel) e.K. – Fellbach",
      "type": "Registerbekanntmachung nach dem Umwandlungsgesetz",
      "state": "Baden-Württemberg",
      "amtsgericht": "Amtsgericht Stuttgart",
      "registernummer": "HRA 741861",
      "registerart": "HRA",
      "company_name": "M. Kappel l. Entsorgung und Wiederverwertung (Inh. Roger Kappel) e.K.",
      "company_seat": "Fellbach",
      "details": "30.07.2025 (Bekanntmachungsdatum)\n\nBaden-Württemberg Amtsgericht Stuttgart HRA 741861\nRegisterbekanntmachung nach dem Umwandlungsgesetz 30.07.2025 (Eintragungsdatum)\n\nM. Kappel l. Entsorgung und Wiederverwertung (Inh. Roger Kappel) e.K.\nEinzelkaufmann / Einzelkauffrau\nFellbach\n\nAls nicht eingetragen wird bekanntgemacht:\nDen Gläubigern der an der Ausgliederung beteiligten Rechtsträger ist, wenn sie binnen sechs Monaten nach dem Tag, an dem die Eintragung der Ausgliederung in das Register des Sitzes desjenigen Rechtsträgers, dessen Gläubiger sie sind, nach § 19 Abs. 3 UmwG als bekanntgemacht gilt, ihren Anspruch nach Grund und Höhe schriftlich anmelden, Sicherheit zu leisten, soweit sie nicht Befriedigung verlangen können. Dieses Recht steht den Gläubigern jedoch nur zu, wenn sie glaubhaft machen, dass durch die Ausgliederung die Erfüllung ihrer Forderung gefährdet wird."
    },
    {
      "date": "2025-07-30",
      "id": "118296",
      "original_text": "Registerbekanntmachung nach dem Umwandlungsgesetz\nBrandenburg Amtsgericht Cottbus GsR 45\nTierärztliche Gemeinschaftspraxis Dr. R. Erler & FTA A. Wilsdorf eingetragene Gesellschaft bürgerlichen Rechts – Bestensee",
      "type": "Registerbekanntmachung nach dem Umwandlungsgesetz",
      "state": "Brandenburg",
      "amtsgericht": "Amtsgericht Cottbus",
      "registernummer": "GsR 45",
      "registerart": "GsR",
      "company_name": "Tierärztliche Gemeinschaftspraxis Dr. R. Erler & FTA A. Wilsdorf eingetragene Gesellschaft bürgerlichen Rechts",
      "company_seat": "Bestensee",
      "details": "30.07.2025 (Bekanntmachungsdatum)\n\nBrandenburg Amtsgericht Cottbus GsR 45\nRegisterbekanntmachung nach dem Umwandlungsgesetz 29.07.2025 (Eintragungsdatum)\n\nTierärztliche Gemeinschaftspraxis Dr. R. Erler & FTA A. Wilsdorf eingetragene Gesellschaft bürgerlichen Rechts\nGesellschaft bürgerlichen Rechts\nBestensee\n\nZu Eintragungsnummer 3 vom 29.07.2025 wird als nicht eingetragen veröffentlicht:\nDen Gläubigern der an der Umwandlung beteiligten Rechtsträger ist, wenn sie binnen sechs Monaten nach dem Tag, an dem die Eintragung der Umwandlung in das Register des Sitzes desjenigen Rechtsträgers, dessen Gläubiger sie sind, als bekannt gemacht gilt, ihren Anspruch nach Grund und Höhe schriftlich anmelden, Sicherheit zu leisten, soweit sie nicht Befriedigung verlangen können. Dieses Recht steht den Gläubigern jedoch nur zu, wenn sie glaubhaft machen, dass durch die Umwandlung die Erfüllung ihrer Forderung gefährdet wird"
    },
    {
      "date": "2025-07-30",
      "id": "118297",
      "original_text": "Registerbekanntmachung nach dem Umwandlungsgesetz\nSchleswig-Holstein Amtsgericht Pinneberg HRA 9811\nMöller Entsorgung GmbH & Co. KG – Heide",
      "type": "Registerbekanntmachung nach dem Umwandlungsgesetz",
      "state": "Schleswig-Holstein",
      "amtsgericht": "Amtsgericht Pinneberg",
      "registernummer": "HRA 9811",
      "registerart": "HRA",
      "company_name": "Möller Entsorgung GmbH & Co. KG",
      "company_seat": "Heide",
      "details": "30.07.2025 (Bekanntmachungsdatum)\n\nSchleswig-Holstein Amtsgericht Pinneberg HRA 9811\nRegisterbekanntmachung nach dem Umwandlungsgesetz 30.07.2025 (Eintragungsdatum)\n\nMöller Entsorgung GmbH & Co. KG\nKommanditgesellschaft\nHeide\n\nZu Eintragungsnummer 2 vom 30.07.2025 wird als nicht eingetragen veröffentlicht: Den Gläubigern der an der Spaltung beteiligten Rechtsträger ist, wenn sie binnen sechs Monaten nach dem Tag, an dem die Eintragung der Spaltung in das Register des Sitzes desjenigen Rechtsträgers, dessen Gläubiger sie sind, als bekannt gemacht gilt, ihren Anspruch nach Grund und Höhe schriftlich anmelden, Sicherheit zu leisten, soweit sie nicht Befriedigung verlangen können. Dieses Recht steht den Gläubigern jedoch nur zu, wenn sie glaubhaft machen, dass durch die Spaltung die Erfüllung ihrer Forderung gefährdet wird. Das Recht, Sicherheitsleistung zu verlangen, steht Gläubigern nicht zu, die im Falle der Insolvenz ein Recht auf vorzugsweise Befriedigung aus einer Deckungsmasse haben, die nach gesetzlicher Vorschrift zu ihrem Schutz errichtet und staatlich überwacht ist."
    },
    {
      "date": "2025-07-30",
      "id": "118298",
      "original_text": "Einreichung neuer Dokumente\nBerlin Amtsgericht Berlin (Charlottenburg) HRB 217435\nER45 GmbH – Berlin",
      "type": "Einreichung neuer Dokumente",
      "state": "Berlin",
      "amtsgericht": "Amtsgericht Berlin (Charlottenburg)",
      "registernummer": "HRB 217435",
      "registerart": "HRB",
      "company_name": "ER45 GmbH",
      "company_seat": "Berlin",
      "details": "30.07.2025 (Bekanntmachungsdatum)\n\nBerlin Amtsgericht Berlin (Charlottenburg) HRB 217435\nEinreichung neuer Dokumente\n\nER45 GmbH\nGesellschaft mit beschränkter Haftung\nBerlin\n\nAls nicht eingetragen wird veröffentlicht: Die Gesellschaft hat einen Entwurf vom 16.07.2025 eines notariell zu beurkundeten Formwechselplans betreffend die grenzüberschreitende Verlegung des Satzungssitzes der Gesellschaft in das Fürstentum Liechtenstein gemäß §§ 333 ff. UmwG zum Handelsregister des Amtsgerichts Charlottenburg eingereicht.\nDie an dem geplanten grenzüberschreitenden Formwechsel beteiligte Gesellschaft ist die ER45 GmbH, eine nach dem Recht der Bundesrepublik Deutschland errichtete und bestehende Gesellschaft mit beschränkter Haftung (GmbH) mit Sitz in Berlin, Deutschland.\nNach dem Formwechsel soll die Gesellschaft als Gesellschaft mit beschränkter Haftung (GmbH) nach dem Recht des Fürstentums Liechtenstein mit Sitz in Vaduz, Fürstentum Liechtenstein, unter dem Namen ER 45 GmbH firmieren.\nDie an dem geplanten grenzüberschreitenden Formwechsel beteiligte Gesellschaft ER45 GmbH ist im Handelsregister des Amtsgerichts Charlottenburg (Berlin) unter der Nummer HRB 217435 B eingetragen.\nEs ergeht Hinweis an folgende Personen, dass sie der formwechselnden Gesellschaft spätestens fünf Arbeitstage vor dem Tag der Gesellschafterversammlung, die über die Zustimmung zum Formwechselplan entscheidet, Bemerkungen zum Formwechselplan übermitteln können:\na) die Anteilsinhaber und Gläubiger der an dem grenzüberschreitenden Formwechsel beteiligten Gesellschaft sowie\nb) die zuständigen Betriebsräte der an dem grenzüberschreitenden Formwechsel beteiligten Gesellschaft oder, soweit es keinen Betriebsrat gibt, an die Arbeitnehmer der an dem grenzüberschreitenden Formwechsel beteiligten Gesellschaft.\n\nHierzu hat die Gesellschaft mitgeteilt:\nDie Gesellschafterversammlung, die über die Zustimmung zum Formwechselplan beschließen soll, darf nicht vor Ablauf eines Monats nach der Bekanntmachung des Entwurfs des Formwechselplans durch das Register stattfinden.\nDie Anteilsinhaber und Gläubiger sollen nach §§ 336, 308 Abs. 1 Nr. 4a UmwG den Hinweis erhalten, dass sie spätestens fünf Tage vor dem Tag der Gesellschafterversammlung der Gesellschaft Bemerkungen zum Entwurf des Formwechselplans übermitteln können. Es ist geplant, dass die Gesellschaftersammlung mehr als einen Monat nach der Bekanntmachung des Entwurfs des Formwechselplans über die Zustimmung zum Formwechselplan beschließt. Demnach endet die Übermittlungsfrist und erlischt das Anhörungsrecht im Sinne von §§ 336, 308 Abs. 1 Nr. 4 UmwG mit Ablauf des fünften Arbeitstages vor jener Gesellschafterversammlung.\nEinen Betriebsrat gibt es nicht und die Gesellschaft hat keine Arbeitnehmer. Höchst vorsorglich wird darauf hingewiesen, dass die zuständigen Betriebsräte der Gesellschaft oder, soweit es keinen Betriebsrat gibt, die Arbeitnehmer der Gesellschaft spätestens fünf Arbeitstage vor dem Tag der Gesellschafterversammlung der Gesellschaft Bemerkungen zum Entwurf des Formwechselplans übermitteln können. Es gilt dieselbe Frist wie im vorstehenden Absatz benannt.\n\nVorsorglich wird darauf hingewiesen, dass den Gläubigern der formwechselnden Gesellschaft ein Anspruch auf eine Sicherheitsleistung nach §§ 341 Abs. 1, 314 UmwG, §§ 232 ff. BGB zusteht, falls die Voraussetzungen hierfür gegeben sind und von den Gläubigern glaubhaft gemacht werden. Der Anspruch der Gläubiger auf Sicherheitsleistung erlischt mit Ablauf von drei Monaten nach Bekanntmachung des Entwurfs des Formwechselplans.“"
    },
    {
      "date": "2025-07-30",
      "id": "118299",
      "original_text": "Einreichung neuer Dokumente\nBaden-Württemberg Amtsgericht Stuttgart HRB 222698\nRoto Frank Holding AG – Leinfelden-Echterdingen",
      "type": "Einreichung neuer Dokumente",
      "state": "Baden-Württemberg",
      "amtsgericht": "Amtsgericht Stuttgart",
      "registernummer": "HRB 222698",
      "registerart": "HRB",
      "company_name": "Roto Frank Holding AG",
      "company_seat": "Leinfelden-Echterdingen",
      "details": "30.07.2025 (Bekanntmachungsdatum)\n\nBaden-Württemberg Amtsgericht Stuttgart HRB 222698\nEinreichung neuer Dokumente\n\nRoto Frank Holding AG\nAktiengesellschaft\nLeinfelden-Echterdingen\n\nDie Gesellschaft hat am 17.07.2025 die Liste über die Zusammensetzung des Aufsichtsrats zum Handelsregister eingereicht."
    },
    {
      "date": "2025-07-30",
      "id": "118300",
      "original_text": "Registerbekanntmachung nach dem Umwandlungsgesetz\nSchleswig-Holstein Amtsgericht Kiel HRB 19354\nMEDIA-SIGN GmbH – Norderstedt",
      "type": "Registerbekanntmachung nach dem Umwandlungsgesetz",
      "state": "Schleswig-Holstein",
      "amtsgericht": "Amtsgericht Kiel",
      "registernummer": "HRB 19354",
      "registerart": "HRB",
      "company_name": "MEDIA-SIGN GmbH",
      "company_seat": "Norderstedt",
      "details": "30.07.2025 (Bekanntmachungsdatum)\n\nSchleswig-Holstein Amtsgericht Kiel HRB 19354\nRegisterbekanntmachung nach dem Umwandlungsgesetz 29.07.2025 (Eintragungsdatum)\n\nMEDIA-SIGN GmbH\nGesellschaft mit beschränkter Haftung\nNorderstedt\n\nZu Eintragungsnummer 3 vom 29.07.2025 wird als nicht eingetragen veröffentlicht: Als nicht eingetragen wird veröffentlicht: Den Gläubigern der an der Verschmelzung beteiligten Rechtsträger ist, wenn sie binnen sechs Monaten nach dem Tag, an dem die Eintragung der Verschmelzung in das Register des Sitzes desjenigen Rechtsträgers, dessen Gläubiger sie sind, nach § 19 Abs. 3 UmwG bekannt gemacht worden ist, ihren Anspruch nach Grund und Höhe schriftlich anmelden, Sicherheit zu leisten, soweit sie nicht Befriedigung verlangen können. Dieses Recht steht den Gläubigern jedoch nur zu, wenn sie glaubhaft machen, dass durch die Verschmelzung die Erfüllung ihrer Forderung gefährdet wird."
    },
    {
      "date": "2025-07-30",
      "id": "118301",
      "original_text": "Löschungsankündigung\nBerlin Amtsgericht Berlin (Charlottenburg) HRB 156860\nCBI-Count Bernadotte International GmbH – Berlin",
      "type": "Löschungsankündigung",
      "state": "Berlin",
      "amtsgericht": "Amtsgericht Berlin (Charlottenburg)",
      "registernummer": "HRB 156860",
      "registerart": "HRB",
      "company_name": "CBI-Count Bernadotte International GmbH",
      "company_seat": "Berlin",
      "details": "30.07.2025 (Bekanntmachungsdatum)\n\nBerlin Amtsgericht Berlin (Charlottenburg) HRB 156860\nLöschungsankündigung\n\nCBI-Count Bernadotte International GmbH\nGesellschaft mit beschränkter Haftung\nBerlin\n\nBei der nachstehenden Gesellschaft wird das Amtslöschungsverfahren gemäß § 394 FamFG eingeleitet. Widerspruchsfrist 6 Wochen"
    },
    {
      "date": "2025-07-30",
      "id": "118302",
      "original_text": "Einreichung neuer Dokumente\nBaden-Württemberg Amtsgericht Freiburg HRB 680153\nWfB Werkstätten für Beteiligung gGmbH – Haslach im Kinzigtal",
      "type": "Einreichung neuer Dokumente",
      "state": "Baden-Württemberg",
      "amtsgericht": "Amtsgericht Freiburg",
      "registernummer": "HRB 680153",
      "registerart": "HRB",
      "company_name": "WfB Werkstätten für Beteiligung gGmbH",
      "company_seat": "Haslach im Kinzigtal",
      "details": "30.07.2025 (Bekanntmachungsdatum)\n\nBaden-Württemberg Amtsgericht Freiburg HRB 680153\nEinreichung neuer Dokumente 30.07.2025 (Eintragungsdatum)\n\nWfB Werkstätten für Beteiligung gGmbH\nGesellschaft mit beschränkter Haftung\nHaslach im Kinzigtal\n\nDie Gesellschaft hat am 29.07.2025 die Liste über die Zusammensetzung des Aufsichtsrats zum Handelsregister eingereicht."
    },
    {
      "date": "2025-07-30",
      "id": "118303",
      "original_text": "Registerbekanntmachung nach dem Umwandlungsgesetz\nNordrhein-Westfalen Amtsgericht Coesfeld HRA 10023\nMW|Effekt Mario Welz e. K. – Senden",
      "type": "Registerbekanntmachung nach dem Umwandlungsgesetz",
      "state": "Nordrhein-Westfalen",
      "amtsgericht": "Amtsgericht Coesfeld",
      "registernummer": "HRA 10023",
      "registerart": "HRA",
      "company_name": "MW|Effekt Mario Welz e. K.",
      "company_seat": "Senden",
      "details": "30.07.2025 (Bekanntmachungsdatum)\n\nNordrhein-Westfalen Amtsgericht Coesfeld HRA 10023\nRegisterbekanntmachung nach dem Umwandlungsgesetz 30.07.2025 (Eintragungsdatum)\n\nMW|Effekt Mario Welz e. K.\nEinzelkaufmann\nSenden\n\nDen Gläubigern der an der Ausgliederung beteiligten Rechtsträger ist, wenn sie binnen sechs Monaten nach dem Tag, an dem die Eintragung der Ausgliederung in das Register des Sitzes desjenigen Rechtsträgers, dessen Gläubiger sie sind, nach § 19 Absatz 3 UmwG als bekanntgemacht gilt, ihren Anspruch nach Grund und Höhe schriftlich anmelden, Sicherheit zu leisten, soweit sie nicht Befriedigung verlangen können. Dieses Recht steht den Gläubigern jedoch nur zu, wenn sie glaubhaft machen, dass durch die Ausgliederung die Erfüllung ihrer Forderung gefährdet wird."
    },
    {
      "date": "2025-07-30",
      "id": "118304",
      "original_text": "Registerbekanntmachung nach dem Umwandlungsgesetz\nBerlin Amtsgericht Berlin (Charlottenburg) HRB 170236\nwefox Germany Holding GmbH – Berlin",
      "type": "Registerbekanntmachung nach dem Umwandlungsgesetz",
      "state": "Berlin",
      "amtsgericht": "Amtsgericht Berlin (Charlottenburg)",
      "registernummer": "HRB 170236",
      "registerart": "HRB",
      "company_name": "wefox Germany Holding GmbH",
      "company_seat": "Berlin",
      "details": "30.07.2025 (Bekanntmachungsdatum)\n\nBerlin Amtsgericht Berlin (Charlottenburg) HRB 170236\nRegisterbekanntmachung nach dem Umwandlungsgesetz 29.07.2025 (Eintragungsdatum)\n\nwefox Germany Holding GmbH\nGesellschaft mit beschränkter Haftung\nBerlin\n\nZu Eintragungsnummer 25 vom 29.07.2025 wird als nicht eingetragen veröffentlicht:Den Gläubigern der an der Verschmelzung beteiligten Rechtsträger ist, wenn sie binnen sechs Monaten nach dem Tag, an dem die Eintragung der Verschmelzung in das Register des Sitzes desjenigen Rechtsträgers, dessen Gläubiger sie sind, als bekannt gemacht gilt, ihren Anspruch nach Grund und Höhe schriftlich anmelden, Sicherheit zu leisten, soweit sie nicht Befriedigung verlangen können. Dieses Recht steht den Gläubigern jedoch nur zu, wenn sie glaubhaft machen, dass durch die Verschmelzung die Erfüllung ihrer Forderung gefährdet wird. Das Recht, Sicherheitsleistung zu verlangen, steht Gläubigern nicht zu, die im Falle der Insolvenz ein Recht auf vorzugsweise Befriedigung aus einer Deckungsmasse haben, die nach gesetzlicher Vorschrift zu ihrem Schutz errichtet und staatlich überwacht ist."
    },
    {
      "date": "2025-07-30",
      "id": "118305",
      "original_text": "Registerbekanntmachung nach dem Umwandlungsgesetz\nMecklenburg-Vorpommern Amtsgericht Schwerin HRB 10078\nRausch Immobiliendienstleistungen GmbH – Selmsdorf",
      "type": "Registerbekanntmachung nach dem Umwandlungsgesetz",
      "state": "Mecklenburg-Vorpommern",
      "amtsgericht": "Amtsgericht Schwerin",
      "registernummer": "HRB 10078",
      "registerart": "HRB",
      "company_name": "Rausch Immobiliendienstleistungen GmbH",
      "company_seat": "Selmsdorf",
      "details": "30.07.2025 (Bekanntmachungsdatum)\n\nMecklenburg-Vorpommern Amtsgericht Schwerin HRB 10078\nRegisterbekanntmachung nach dem Umwandlungsgesetz 30.07.2025 (Eintragungsdatum)\n\nRausch Immobiliendienstleistungen GmbH\nGesellschaft mit beschränkter Haftung\nSelmsdorf\n\nDie Gesellschaft hat Gläubigern, deren Forderungen vor dieser Bekanntmachung begründet worden sind, Sicherheit zu leisten, soweit sie nicht Befriedigung verlangen können, wenn sie sich binnen sechs Monaten zu diesem Zweck melden."
    },
    {
      "date": "2025-07-30",
      "id": "118306",
      "original_text": "Registerbekanntmachung nach dem Umwandlungsgesetz\nMecklenburg-Vorpommern Amtsgericht Schwerin HRB 10344\nRausch Gebäudereinigung GmbH – Selmsdorf",
      "type": "Registerbekanntmachung nach dem Umwandlungsgesetz",
      "state": "Mecklenburg-Vorpommern",
      "amtsgericht": "Amtsgericht Schwerin",
      "registernummer": "HRB 10344",
      "registerart": "HRB",
      "company_name": "Rausch Gebäudereinigung GmbH",
      "company_seat": "Selmsdorf",
      "details": "30.07.2025 (Bekanntmachungsdatum)\n\nMecklenburg-Vorpommern Amtsgericht Schwerin HRB 10344\nRegisterbekanntmachung nach dem Umwandlungsgesetz 30.07.2025 (Eintragungsdatum)\n\nRausch Gebäudereinigung GmbH\nGesellschaft mit beschränkter Haftung\nSelmsdorf\n\nDie Gesellschaft hat Gläubigern, deren Forderungen vor dieser Bekanntmachung begründet worden sind, Sicherheit zu leisten, soweit sie nicht Befriedigung verlangen können, wenn sie sich binnen sechs Monaten zu diesem Zweck melden."
    },
    {
      "date": "2025-07-30",
      "id": "118307",
      "original_text": "Registerbekanntmachung nach dem Umwandlungsgesetz\nBaden-Württemberg Amtsgericht Ulm HRB 3860\nmoney - control GmbH – Heroldstatt",
      "type": "Registerbekanntmachung nach dem Umwandlungsgesetz",
      "state": "Baden-Württemberg",
      "amtsgericht": "Amtsgericht Ulm",
      "registernummer": "HRB 3860",
      "registerart": "HRB",
      "company_name": "money - control GmbH",
      "company_seat": "Heroldstatt",
      "details": "30.07.2025 (Bekanntmachungsdatum)\n\nBaden-Württemberg Amtsgericht Ulm HRB 3860\nRegisterbekanntmachung nach dem Umwandlungsgesetz 30.07.2025 (Eintragungsdatum)\n\nmoney - control GmbH\nGesellschaft mit beschränkter Haftung\nHeroldstatt\n\nDen Gläubigern der an der Verschmelzung beteiligten Rechtsträger ist, wenn sie binnen sechs Monaten nach dem Tag, an dem die Eintragung der Verschmelzung in das Register des Sitzes desjenigen Rechtsträgers, dessen Gläubiger sie sind, nach § 19 Abs. 3 UmwG als bekanntgemacht gilt, ihren Anspruch nach Grund und Höhe schriftlich anmelden, Sicherheit zu leisten, soweit sie nicht Befriedigung verlangen können. Dieses Recht steht den Gläubigern jedoch nur zu, wenn sie glaubhaft machen, dass durch die Verschmelzung die Erfüllung ihrer Forderung gefährdet wird."
    },
    {
      "date": "2025-07-30",
      "id": "118308",
      "original_text": "Registerbekanntmachung nach dem Umwandlungsgesetz\nBerlin Amtsgericht Berlin (Charlottenburg) HRB 261451\nberatungswerk24 GmbH – Berlin",
      "type": "Registerbekanntmachung nach dem Umwandlungsgesetz",
      "state": "Berlin",
      "amtsgericht": "Amtsgericht Berlin (Charlottenburg)",
      "registernummer": "HRB 261451",
      "registerart": "HRB",
      "company_name": "beratungswerk24 GmbH",
      "company_seat": "Berlin",
      "details": "30.07.2025 (Bekanntmachungsdatum)\n\nBerlin Amtsgericht Berlin (Charlottenburg) HRB 261451\nRegisterbekanntmachung nach dem Umwandlungsgesetz 29.07.2025 (Eintragungsdatum)\n\nberatungswerk24 GmbH\nGesellschaft mit beschränkter Haftung\nBerlin\n\nZu Eintragungsnummer 6 vom 29.07.2025 wird als nicht eingetragen veröffentlicht:Den Gläubigern der an der Verschmelzung beteiligten Rechtsträger ist, wenn sie binnen sechs Monaten nach dem Tag, an dem die Eintragung der Verschmelzung in das Register des Sitzes desjenigen Rechtsträgers, dessen Gläubiger sie sind, als bekannt gemacht gilt, ihren Anspruch nach Grund und Höhe schriftlich anmelden, Sicherheit zu leisten, soweit sie nicht Befriedigung verlangen können. Dieses Recht steht den Gläubigern jedoch nur zu, wenn sie glaubhaft machen, dass durch die Verschmelzung die Erfüllung ihrer Forderung gefährdet wird. Das Recht, Sicherheitsleistung zu verlangen, steht Gläubigern nicht zu, die im Falle der Insolvenz ein Recht auf vorzugsweise Befriedigung aus einer Deckungsmasse haben, die nach gesetzlicher Vorschrift zu ihrem Schutz errichtet und staatlich überwacht ist."
    },
    {
      "date": "2025-07-30",
      "id": "118309",
      "original_text": "Registerbekanntmachung nach dem Umwandlungsgesetz\nBaden-Württemberg Amtsgericht Stuttgart HRB 800978\nDRF Stiftung Luftrettung gemeinnützige GmbH – Filderstadt",
      "type": "Registerbekanntmachung nach dem Umwandlungsgesetz",
      "state": "Baden-Württemberg",
      "amtsgericht": "Amtsgericht Stuttgart",
      "registernummer": "HRB 800978",
      "registerart": "HRB",
      "company_name": "DRF Stiftung Luftrettung gemeinnützige GmbH",
      "company_seat": "Filderstadt",
      "details": "30.07.2025 (Bekanntmachungsdatum)\n\nBaden-Württemberg Amtsgericht Stuttgart HRB 800978\nRegisterbekanntmachung nach dem Umwandlungsgesetz 30.07.2025 (Eintragungsdatum)\n\nDRF Stiftung Luftrettung gemeinnützige GmbH\nGesellschaft mit beschränkter Haftung\nFilderstadt\n\nAls nicht eingetragen wird bekanntgemacht:\nDen Gläubigern des an dem Formwechsel beteiligten Rechtsträgers ist, wenn sie binnen sechs Monaten nach dem Tag, an dem die Eintragung des Formwechsels in das Register des Sitzes desjenigen Rechtsträgers, dessen Gläubiger sie sind, nach § 19 Abs. 3 UmwG als bekanntgemacht gilt, ihren Anspruch nach Grund und Höhe schriftlich anmelden, Sicherheit zu leisten, soweit sie nicht Befriedigung verlangen können. Dieses Recht steht den Gläubigern jedoch nur zu, wenn sie glaubhaft machen, dass durch den Formwechsel die Erfüllung ihrer Forderung gefährdet wird."
    },
    {
      "date": "2025-07-30",
      "id": "118310",
      "original_text": "Registerbekanntmachung nach dem Umwandlungsgesetz\nBaden-Württemberg Amtsgericht Ulm HRB 2223\nStüwer Holding GmbH – Heroldstatt",
      "type": "Registerbekanntmachung nach dem Umwandlungsgesetz",
      "state": "Baden-Württemberg",
      "amtsgericht": "Amtsgericht Ulm",
      "registernummer": "HRB 2223",
      "registerart": "HRB",
      "company_name": "Stüwer Holding GmbH",
      "company_seat": "Heroldstatt",
      "details": "30.07.2025 (Bekanntmachungsdatum)\n\nBaden-Württemberg Amtsgericht Ulm HRB 2223\nRegisterbekanntmachung nach dem Umwandlungsgesetz 30.07.2025 (Eintragungsdatum)\n\nStüwer Holding GmbH\nGesellschaft mit beschränkter Haftung\nHeroldstatt\n\nAls nicht eingetragen wird bekanntgemacht:\nDen Gläubigern der an der Verschmelzung beteiligten Rechtsträger ist, wenn sie binnen sechs Monaten nach dem Tag, an dem die Eintragung der Verschmelzung in das Register des Sitzes desjenigen Rechtsträgers, dessen Gläubiger sie sind, nach § 19 Abs. 3 UmwG als bekanntgemacht gilt, ihren Anspruch nach Grund und Höhe schriftlich anmelden, Sicherheit zu leisten, soweit sie nicht Befriedigung verlangen können. Dieses Recht steht den Gläubigern jedoch nur zu, wenn sie glaubhaft machen, dass durch die Verschmelzung die Erfüllung ihrer Forderung gefährdet wird."
    },
    {
      "date": "2025-07-30",
      "id": "118311",
      "original_text": "Registerbekanntmachung nach dem Umwandlungsgesetz\nHamburg Amtsgericht Hamburg HRB 177989\nTnT GmbH – Hamburg",
      "type": "Registerbekanntmachung nach dem Umwandlungsgesetz",
      "state": "Hamburg",
      "amtsgericht": "Amtsgericht Hamburg",
      "registernummer": "HRB 177989",
      "registerart": "HRB",
      "company_name": "TnT GmbH",
      "company_seat": "Hamburg",
      "details": "30.07.2025 (Bekanntmachungsdatum)\n\nHamburg Amtsgericht Hamburg HRB 177989\nRegisterbekanntmachung nach dem Umwandlungsgesetz 30.07.2025 (Eintragungsdatum)\n\nTnT GmbH\nGesellschaft mit beschränkter Haftung\nHamburg\n\nAls nicht eingetragen wird bekannt gemacht:\nDen Gläubigern der an der Verschmelzung beteiligten Gesellschaften ist, wenn sie binnen sechs Monaten nach dem Tag, an dem die Eintragung der Verschmelzung in das Register des Sitzes desjenigen Rechtsträgers, dessen Gläubiger sie sind, nach § 19 Absatz 3 UmwG als bekannt gemacht gilt, ihren Anspruch nach Grund und Höhe schriftlich anmelden, Sicherheit zu leisten, soweit sie nicht Befriedigung verlangen können. Dieses Recht steht den Gläubigern jedoch nur zu, wenn sie glaubhaft machen, dass durch die Verschmelzung die Erfüllung ihrer Forderung gefährdet wird."
    },
    {
      "date": "2025-07-30",
      "id": "118312",
      "original_text": "Registerbekanntmachung nach dem Umwandlungsgesetz\nHamburg Amtsgericht Hamburg HRB 177989\nTnT GmbH – Hamburg",
      "type": "Registerbekanntmachung nach dem Umwandlungsgesetz",
      "state": "Hamburg",
      "amtsgericht": "Amtsgericht Hamburg",
      "registernummer": "HRB 177989",
      "registerart": "HRB",
      "company_name": "TnT GmbH",
      "company_seat": "Hamburg",
      "details": "30.07.2025 (Bekanntmachungsdatum)\n\nHamburg Amtsgericht Hamburg HRB 177989\nRegisterbekanntmachung nach dem Umwandlungsgesetz 30.07.2025 (Eintragungsdatum)\n\nTnT GmbH\nGesellschaft mit beschränkter Haftung\nHamburg\n\nAls nicht eingetragen wird bekannt gemacht:\nDen Gläubigern der an der Verschmelzung beteiligten Gesellschaften ist, wenn sie binnen sechs Monaten nach dem Tag, an dem die Eintragung der Verschmelzung in das Register des Sitzes desjenigen Rechtsträgers, dessen Gläubiger sie sind, nach § 19 Absatz 3 UmwG als bekannt gemacht gilt, ihren Anspruch nach Grund und Höhe schriftlich anmelden, Sicherheit zu leisten, soweit sie nicht Befriedigung verlangen können. Dieses Recht steht den Gläubigern jedoch nur zu, wenn sie glaubhaft machen, dass durch die Verschmelzung die Erfüllung ihrer Forderung gefährdet wird."
    },
    {
      "date": "2025-07-30",
      "id": "118313",
      "original_text": "Registerbekanntmachung nach dem Umwandlungsgesetz\nBaden-Württemberg Amtsgericht Stuttgart HRB 727649\nDRF Stiftung Luftrettung gemeinnützige AG – Filderstadt",
      "type": "Registerbekanntmachung nach dem Umwandlungsgesetz",
      "state": "Baden-Württemberg",
      "amtsgericht": "Amtsgericht Stuttgart",
      "registernummer": "HRB 727649",
      "registerart": "HRB",
      "company_name": "DRF Stiftung Luftrettung gemeinnützige AG",
      "company_seat": "Filderstadt",
      "details": "30.07.2025 (Bekanntmachungsdatum)\n\nBaden-Württemberg Amtsgericht Stuttgart HRB 727649\nRegisterbekanntmachung nach dem Umwandlungsgesetz 30.07.2025 (Eintragungsdatum)\n\nDRF Stiftung Luftrettung gemeinnützige AG\nAktiengesellschaft\nFilderstadt\n\nAls nicht eingetragen wird bekanntgemacht:\nDen Gläubigern des an dem Formwechsel beteiligten Rechtsträgers ist, wenn sie binnen sechs Monaten nach dem Tag, an dem die Eintragung des Formwechsels in das Register des Sitzes desjenigen Rechtsträgers, dessen Gläubiger sie sind, nach § 19 Abs. 3 UmwG als bekanntgemacht gilt, ihren Anspruch nach Grund und Höhe schriftlich anmelden, Sicherheit zu leisten, soweit sie nicht Befriedigung verlangen können. Dieses Recht steht den Gläubigern jedoch nur zu, wenn sie glaubhaft machen, dass durch den Formwechsel die Erfüllung ihrer Forderung gefährdet wird."
    },
    {
      "date": "2025-07-30",
      "id": "118314",
      "original_text": "Registerbekanntmachung nach dem Umwandlungsgesetz\nSchleswig-Holstein Amtsgericht Pinneberg HRA 9687\nHans Ulrich Möller e.K. – Heide",
      "type": "Registerbekanntmachung nach dem Umwandlungsgesetz",
      "state": "Schleswig-Holstein",
      "amtsgericht": "Amtsgericht Pinneberg",
      "registernummer": "HRA 9687",
      "registerart": "HRA",
      "company_name": "Hans Ulrich Möller e.K.",
      "company_seat": "Heide",
      "details": "30.07.2025 (Bekanntmachungsdatum)\n\nSchleswig-Holstein Amtsgericht Pinneberg HRA 9687\nRegisterbekanntmachung nach dem Umwandlungsgesetz 30.07.2025 (Eintragungsdatum)\n\nHans Ulrich Möller e.K.\nEinzelkaufmann / Einzelkauffrau\nHeide\n\nZu Eintragungsnummer 2 vom 30.07.2025 wird als nicht eingetragen veröffentlicht:  Als nicht eingetragen wird veröffentlicht: Den Gläubigern ist, wenn sie binnen sechs Monaten nach dem Tag, an dem die Eintragung der Umwandlung als bekannt gemacht gilt, ihren Anspruch nach Grund und Höhe schriftlich anmelden, Sicherheit zu leisten, soweit sie nicht Befriedigung verlangen können. Dieses Recht steht den Gläubigern jedoch nur zu, wenn sie glaubhaft machen, dass durch die Umwandlung die Erfüllung ihrer Forderung gefährdet wird. Das Recht, Sicherheitsleistung zu verlangen, steht Gläubigern nicht zu, die im Falle der Insolvenz ein Recht auf vorzugsweise Befriedigung aus einer Deckungsmasse haben, die nach gesetzlicher Vorschrift zu ihrem Schutz errichtet und staatlich überwacht ist."
    },
    {
      "date": "2025-07-30",
      "id": "118315",
      "original_text": "Registerbekanntmachung nach dem Umwandlungsgesetz\nBerlin Amtsgericht Berlin (Charlottenburg) HRB 125022\nmfg Agentur UG (haftungsbeschränkt) – Berlin",
      "type": "Registerbekanntmachung nach dem Umwandlungsgesetz",
      "state": "Berlin",
      "amtsgericht": "Amtsgericht Berlin (Charlottenburg)",
      "registernummer": "HRB 125022",
      "registerart": "HRB",
      "company_name": "mfg Agentur UG (haftungsbeschränkt)",
      "company_seat": "Berlin",
      "details": "30.07.2025 (Bekanntmachungsdatum)\n\nBerlin Amtsgericht Berlin (Charlottenburg) HRB 125022\nRegisterbekanntmachung nach dem Umwandlungsgesetz 30.07.2025 (Eintragungsdatum)\n\nmfg Agentur UG (haftungsbeschränkt)\nGesellschaft mit beschränkter Haftung\nBerlin\n\nZu Eintragungsnummer 2 vom 30.07.2025 wird als nicht eingetragen veröffentlicht: Den Gläubigern der an der Verschmelzung beteiligten Rechtsträger ist, wenn sie binnen sechs Monaten nach dem Tag, an dem die Eintragung der Verschmelzung in das Register des Sitzes desjenigen Rechtsträgers, dessen Gläubiger sie sind, als bekannt gemacht gilt, ihren Anspruch nach Grund und Höhe schriftlich anmelden, Sicherheit zu leisten, soweit sie nicht Befriedigung verlangen können. Dieses Recht steht den Gläubigern jedoch nur zu, wenn sie glaubhaft machen, dass durch die Verschmelzung die Erfüllung ihrer Forderung gefährdet wird. Das Recht, Sicherheitsleistung zu verlangen, steht Gläubigern nicht zu, die im Falle der Insolvenz ein Recht auf vorzugsweise Befriedigung aus einer Deckungsmasse haben, die nach gesetzlicher Vorschrift zu ihrem Schutz errichtet und staatlich überwacht ist."
    },
    {
      "date": "2025-07-30",
      "id": "118316",
      "original_text": "Registerbekanntmachung nach dem Umwandlungsgesetz\nBaden-Württemberg Amtsgericht Freiburg GsR 1375\nLeimgrabenhof Direktvermarktung eGbR – Donaueschingen",
      "type": "Registerbekanntmachung nach dem Umwandlungsgesetz",
      "state": "Baden-Württemberg",
      "amtsgericht": "Amtsgericht Freiburg",
      "registernummer": "GsR 1375",
      "registerart": "GsR",
      "company_name": "Leimgrabenhof Direktvermarktung eGbR",
      "company_seat": "Donaueschingen",
      "details": "30.07.2025 (Bekanntmachungsdatum)\n\nBaden-Württemberg Amtsgericht Freiburg GsR 1375\nRegisterbekanntmachung nach dem Umwandlungsgesetz 30.07.2025 (Eintragungsdatum)\n\nLeimgrabenhof Direktvermarktung eGbR\nGesellschaft bürgerlichen Rechts\nDonaueschingen\n\nAls nicht eingetragen wird bekanntgemacht:\nDen Gläubigern des an dem Formwechsel beteiligten Rechtsträgers ist, wenn sie binnen sechs Monaten nach dem Tag, an dem die Eintragung des Formwechsels in das Register des Sitzes desjenigen Rechtsträgers, dessen Gläubiger sie sind, nach § 19 Abs. 3 UmwG als bekanntgemacht gilt, ihren Anspruch nach Grund und Höhe schriftlich anmelden, Sicherheit zu leisten, soweit sie nicht Befriedigung verlangen können. Dieses Recht steht den Gläubigern jedoch nur zu, wenn sie glaubhaft machen, dass durch den Formwechsel die Erfüllung ihrer Forderung gefährdet wird."
    },
    {
      "date": "2025-07-30",
      "id": "118317",
      "original_text": "Registerbekanntmachung nach dem Umwandlungsgesetz\nHamburg Amtsgericht Hamburg HRB 69761\nSchmitz WG Corporate Communication GmbH – Hamburg",
      "type": "Registerbekanntmachung nach dem Umwandlungsgesetz",
      "state": "Hamburg",
      "amtsgericht": "Amtsgericht Hamburg",
      "registernummer": "HRB 69761",
      "registerart": "HRB",
      "company_name": "Schmitz WG Corporate Communication GmbH",
      "company_seat": "Hamburg",
      "details": "30.07.2025 (Bekanntmachungsdatum)\n\nHamburg Amtsgericht Hamburg HRB 69761\nRegisterbekanntmachung nach dem Umwandlungsgesetz 30.07.2025 (Eintragungsdatum)\n\nSchmitz WG Corporate Communication GmbH\nGesellschaft mit beschränkter Haftung\nHamburg\n\nAls nicht eingetragen wird bekannt gemacht:\nDen Gläubigern der an der Verschmelzung beteiligten Gesellschaften ist, wenn sie binnen sechs Monaten nach dem Tag, an dem die Eintragung der Verschmelzung in das Register des Sitzes desjenigen Rechtsträgers, dessen Gläubiger sie sind, nach § 19 Absatz 3 UmwG als bekannt gemacht gilt, ihren Anspruch nach Grund und Höhe schriftlich anmelden, Sicherheit zu leisten, soweit sie nicht Befriedigung verlangen können. Dieses Recht steht den Gläubigern jedoch nur zu, wenn sie glaubhaft machen, dass durch die Verschmelzung die Erfüllung ihrer Forderung gefährdet wird."
    },
    {
      "date": "2025-07-30",
      "id": "118318",
      "original_text": "Registerbekanntmachung nach dem Umwandlungsgesetz\nHamburg Amtsgericht Hamburg HRB 93691\nRELEVANCE GmbH – Hamburg",
      "type": "Registerbekanntmachung nach dem Umwandlungsgesetz",
      "state": "Hamburg",
      "amtsgericht": "Amtsgericht Hamburg",
      "registernummer": "HRB 93691",
      "registerart": "HRB",
      "company_name": "RELEVANCE GmbH",
      "company_seat": "Hamburg",
      "details": "30.07.2025 (Bekanntmachungsdatum)\n\nHamburg Amtsgericht Hamburg HRB 93691\nRegisterbekanntmachung nach dem Umwandlungsgesetz 30.07.2025 (Eintragungsdatum)\n\nRELEVANCE GmbH\nGesellschaft mit beschränkter Haftung\nHamburg\n\nAls nicht eingetragen wird bekannt gemacht:\nDen Gläubigern der an der Verschmelzung beteiligten Gesellschaften ist, wenn sie binnen sechs Monaten nach dem Tag, an dem die Eintragung der Verschmelzung in das Register des Sitzes desjenigen Rechtsträgers, dessen Gläubiger sie sind, nach § 19 Absatz 3 UmwG als bekannt gemacht gilt, ihren Anspruch nach Grund und Höhe schriftlich anmelden, Sicherheit zu leisten, soweit sie nicht Befriedigung verlangen können. Dieses Recht steht den Gläubigern jedoch nur zu, wenn sie glaubhaft machen, dass durch die Verschmelzung die Erfüllung ihrer Forderung gefährdet wird."
    },
    {
      "date": "2025-07-30",
      "id": "118319",
      "original_text": "Sonstige Registerbekanntmachung\nBaden-Württemberg Amtsgericht Ulm HRB 552655\nWGV Holding AG – Ravensburg",
      "type": "Sonstige Registerbekanntmachung",
      "state": "Baden-Württemberg",
      "amtsgericht": "Amtsgericht Ulm",
      "registernummer": "HRB 552655",
      "registerart": "HRB",
      "company_name": "WGV Holding AG",
      "company_seat": "Ravensburg",
      "details": "30.07.2025 (Bekanntmachungsdatum)\n\nBaden-Württemberg Amtsgericht Ulm HRB 552655\nSonstige Registerbekanntmachung 28.07.2025 (Eintragungsdatum)\n\nWGV Holding AG\nAktiengesellschaft\nRavensburg\n\nDie Gesellschaft hat am 28.07.2025 die Liste über die Zusammensetzung des Aufsichtsrats zum Handelsregister eingereicht."
    },
    {
      "date": "2025-07-30",
      "id": "118320",
      "original_text": "Registerbekanntmachung nach dem Umwandlungsgesetz\nMecklenburg-Vorpommern Amtsgericht Schwerin HRB 11983\nK&H Zerspanung GmbH – Gallin",
      "type": "Registerbekanntmachung nach dem Umwandlungsgesetz",
      "state": "Mecklenburg-Vorpommern",
      "amtsgericht": "Amtsgericht Schwerin",
      "registernummer": "HRB 11983",
      "registerart": "HRB",
      "company_name": "K&H Zerspanung GmbH",
      "company_seat": "Gallin",
      "details": "30.07.2025 (Bekanntmachungsdatum)\n\nMecklenburg-Vorpommern Amtsgericht Schwerin HRB 11983\nRegisterbekanntmachung nach dem Umwandlungsgesetz 30.07.2025 (Eintragungsdatum)\n\nK&H Zerspanung GmbH\nGesellschaft mit beschränkter Haftung\nGallin\n\nDie Gesellschaft hat Gläubigern, deren Forderungen vor dieser Bekanntmachung begründet worden sind, Sicherheit zu leisten, soweit sie nicht Befriedigung verlangen können, wenn sie sich binnen sechs Monaten zu diesem Zweck melden."
    },
    {
      "date": "2025-07-30",
      "id": "118321",
      "original_text": "Registerbekanntmachung nach dem Umwandlungsgesetz\nMecklenburg-Vorpommern Amtsgericht Schwerin HRB 10244\nLaser Team Gesellschaft für innovative Schweiss- und Schneidtechnik mbH – Gallin",
      "type": "Registerbekanntmachung nach dem Umwandlungsgesetz",
      "state": "Mecklenburg-Vorpommern",
      "amtsgericht": "Amtsgericht Schwerin",
      "registernummer": "HRB 10244",
      "registerart": "HRB",
      "company_name": "Laser Team Gesellschaft für innovative Schweiss- und Schneidtechnik mbH",
      "company_seat": "Gallin",
      "details": "30.07.2025 (Bekanntmachungsdatum)\n\nMecklenburg-Vorpommern Amtsgericht Schwerin HRB 10244\nRegisterbekanntmachung nach dem Umwandlungsgesetz 30.07.2025 (Eintragungsdatum)\n\nLaser Team Gesellschaft für innovative Schweiss- und Schneidtechnik mbH\nGesellschaft mit beschränkter Haftung\nGallin\n\nDie Gesellschaft hat Gläubigern, deren Forderungen vor dieser Bekanntmachung begründet worden sind, Sicherheit zu leisten, soweit sie nicht Befriedigung verlangen können, wenn sie sich binnen sechs Monaten zu diesem Zweck melden."
    },
    {
      "date": "2025-07-30",
      "id": "118322",
      "original_text": "Registerbekanntmachung nach dem Umwandlungsgesetz\nBaden-Württemberg Amtsgericht Stuttgart HRB 580811\nHOI Prinz zu Hohenlohe-Oehringen Immobilien GmbH – Öhringen",
      "type": "Registerbekanntmachung nach dem Umwandlungsgesetz",
      "state": "Baden-Württemberg",
      "amtsgericht": "Amtsgericht Stuttgart",
      "registernummer": "HRB 580811",
      "registerart": "HRB",
      "company_name": "HOI Prinz zu Hohenlohe-Oehringen Immobilien GmbH",
      "company_seat": "Öhringen",
      "details": "30.07.2025 (Bekanntmachungsdatum)\n\nBaden-Württemberg Amtsgericht Stuttgart HRB 580811\nRegisterbekanntmachung nach dem Umwandlungsgesetz 30.07.2025 (Eintragungsdatum)\n\nHOI Prinz zu Hohenlohe-Oehringen Immobilien GmbH\nGesellschaft mit beschränkter Haftung\nÖhringen\n\nAls nicht eingetragen wird bekanntgemacht:\nDen Gläubigern der an der Verschmelzung beteiligten Rechtsträger ist, wenn sie binnen sechs Monaten nach dem Tag, an dem die Eintragung der Verschmelzung in das Register des Sitzes desjenigen Rechtsträgers, dessen Gläubiger sie sind, nach § 19 Abs. 3 UmwG als bekanntgemacht gilt, ihren Anspruch nach Grund und Höhe schriftlich anmelden, Sicherheit zu leisten, soweit sie nicht Befriedigung verlangen können. Dieses Recht steht den Gläubigern jedoch nur zu, wenn sie glaubhaft machen, dass durch die Verschmelzung die Erfüllung ihrer Forderung gefährdet wird."
    },
    {
      "date": "2025-07-30",
      "id": "118323",
      "original_text": "Registerbekanntmachung nach dem Umwandlungsgesetz\nBaden-Württemberg Amtsgericht Stuttgart HRB 12487\nRaff Sanitär GmbH – Stuttgart",
      "type": "Registerbekanntmachung nach dem Umwandlungsgesetz",
      "state": "Baden-Württemberg",
      "amtsgericht": "Amtsgericht Stuttgart",
      "registernummer": "HRB 12487",
      "registerart": "HRB",
      "company_name": "Raff Sanitär GmbH",
      "company_seat": "Stuttgart",
      "details": "30.07.2025 (Bekanntmachungsdatum)\n\nBaden-Württemberg Amtsgericht Stuttgart HRB 12487\nRegisterbekanntmachung nach dem Umwandlungsgesetz 30.07.2025 (Eintragungsdatum)\n\nRaff Sanitär GmbH\nGesellschaft mit beschränkter Haftung\nStuttgart\n\nAls nicht eingetragen wird bekanntgemacht:\nDen Gläubigern der an der Verschmelzung beteiligten Rechtsträger ist, wenn sie binnen sechs Monaten nach dem Tag, an dem die Eintragung der Verschmelzung in das Register des Sitzes desjenigen Rechtsträgers, dessen Gläubiger sie sind, nach § 19 Abs. 3 UmwG als bekanntgemacht gilt, ihren Anspruch nach Grund und Höhe schriftlich anmelden, Sicherheit zu leisten, soweit sie nicht Befriedigung verlangen können. Dieses Recht steht den Gläubigern jedoch nur zu, wenn sie glaubhaft machen, dass durch die Verschmelzung die Erfüllung ihrer Forderung gefährdet wird."
    },
    {
      "date": "2025-07-30",
      "id": "118324",
      "original_text": "Registerbekanntmachung nach dem Umwandlungsgesetz\nBaden-Württemberg Amtsgericht Stuttgart HRB 775754\nAR Energiesysteme GmbH – Stuttgart",
      "type": "Registerbekanntmachung nach dem Umwandlungsgesetz",
      "state": "Baden-Württemberg",
      "amtsgericht": "Amtsgericht Stuttgart",
      "registernummer": "HRB 775754",
      "registerart": "HRB",
      "company_name": "AR Energiesysteme GmbH",
      "company_seat": "Stuttgart",
      "details": "30.07.2025 (Bekanntmachungsdatum)\n\nBaden-Württemberg Amtsgericht Stuttgart HRB 775754\nRegisterbekanntmachung nach dem Umwandlungsgesetz 30.07.2025 (Eintragungsdatum)\n\nAR Energiesysteme GmbH\nGesellschaft mit beschränkter Haftung\nStuttgart\n\nAls nicht eingetragen wird bekanntgemacht:\nDen Gläubigern der an der Verschmelzung beteiligten Rechtsträger ist, wenn sie binnen sechs Monaten nach dem Tag, an dem die Eintragung der Verschmelzung in das Register des Sitzes desjenigen Rechtsträgers, dessen Gläubiger sie sind, nach § 19 Abs. 3 UmwG als bekanntgemacht gilt, ihren Anspruch nach Grund und Höhe schriftlich anmelden, Sicherheit zu leisten, soweit sie nicht Befriedigung verlangen können. Dieses Recht steht den Gläubigern jedoch nur zu, wenn sie glaubhaft machen, dass durch die Verschmelzung die Erfüllung ihrer Forderung gefährdet wird."
    },
    {
      "date": "2025-07-30",
      "id": "118325",
      "original_text": "Registerbekanntmachung nach dem Umwandlungsgesetz\nMecklenburg-Vorpommern Amtsgericht Stralsund HRB 21283\nCW Performance Wheels GmbH – Wendorf",
      "type": "Registerbekanntmachung nach dem Umwandlungsgesetz",
      "state": "Mecklenburg-Vorpommern",
      "amtsgericht": "Amtsgericht Stralsund",
      "registernummer": "HRB 21283",
      "registerart": "HRB",
      "company_name": "CW Performance Wheels GmbH",
      "company_seat": "Wendorf",
      "details": "30.07.2025 (Bekanntmachungsdatum)\n\nMecklenburg-Vorpommern Amtsgericht Stralsund HRB 21283\nRegisterbekanntmachung nach dem Umwandlungsgesetz 29.07.2025 (Eintragungsdatum)\n\nCW Performance Wheels GmbH\nGesellschaft mit beschränkter Haftung\nWendorf\n\nAls nicht eingetragen wird veröffentlicht: Den Gläubigern der an der Ausgliederung beteiligten Rechtsträger ist, wenn sie binnen sechs Monaten nach dem Tag, an dem die Eintragung der Ausgliederung in das Register des Sitzes desjenigen Rechtsträgers, dessen Gläubiger sie sind, nach § 19 Abs. 3 UmwG als bekannt gemacht gilt, ihren Anspruch nach Grund und Höhe in Textform anmelden,\nSicherheit zu leisten, soweit sie nicht Befriedigung verlangen können. Dieses Recht steht den Gläubigern jedoch nur zu, wenn sie glaubhaft machen, dass durch die Ausgliederung die Erfüllung der Forderung gefährdet wird."
    },
    {
      "date": "2025-07-30",
      "id": "118326",
      "original_text": "Registerbekanntmachung nach dem Umwandlungsgesetz\nMecklenburg-Vorpommern Amtsgericht Stralsund HRB 21151\nOriginal Räder 24 GmbH – Wendorf",
      "type": "Registerbekanntmachung nach dem Umwandlungsgesetz",
      "state": "Mecklenburg-Vorpommern",
      "amtsgericht": "Amtsgericht Stralsund",
      "registernummer": "HRB 21151",
      "registerart": "HRB",
      "company_name": "Original Räder 24 GmbH",
      "company_seat": "Wendorf",
      "details": "30.07.2025 (Bekanntmachungsdatum)\n\nMecklenburg-Vorpommern Amtsgericht Stralsund HRB 21151\nRegisterbekanntmachung nach dem Umwandlungsgesetz 29.07.2025 (Eintragungsdatum)\n\nOriginal Räder 24 GmbH\nGesellschaft mit beschränkter Haftung\nWendorf\n\nAls nicht eingetragen wird veröffentlicht: Den Gläubigern der an der Ausgliederung beteiligten Rechtsträger ist, wenn sie binnen sechs Monaten nach dem Tag, an dem die Eintragung der Ausgliederung in das Register des Sitzes desjenigen Rechtsträgers, dessen Gläubiger sie sind, nach § 19 Abs. 3 UmwG als bekannt gemacht gilt, ihren Anspruch nach Grund und Höhe in Textform anmelden,\nSicherheit zu leisten, soweit sie nicht Befriedigung verlangen können. Dieses Recht steht den Gläubigern jedoch nur zu, wenn sie glaubhaft machen, dass durch die Ausgliederung die Erfüllung der Forderung gefährdet wird."
    },
    {
      "date": "2025-07-30",
      "id": "118327",
      "original_text": "Registerbekanntmachung nach dem Umwandlungsgesetz\nMecklenburg-Vorpommern Amtsgericht Stralsund HRB 21806\nV8 Immobilien GmbH – Wustrow",
      "type": "Registerbekanntmachung nach dem Umwandlungsgesetz",
      "state": "Mecklenburg-Vorpommern",
      "amtsgericht": "Amtsgericht Stralsund",
      "registernummer": "HRB 21806",
      "registerart": "HRB",
      "company_name": "V8 Immobilien GmbH",
      "company_seat": "Wustrow",
      "details": "30.07.2025 (Bekanntmachungsdatum)\n\nMecklenburg-Vorpommern Amtsgericht Stralsund HRB 21806\nRegisterbekanntmachung nach dem Umwandlungsgesetz 30.07.2025 (Eintragungsdatum)\n\nV8 Immobilien GmbH\nGesellschaft mit beschränkter Haftung\nWustrow\n\nAls nicht eingetragen wird veröffentlicht: Den Gläubigern der an der Verschmelzung beteiligten Rechtsträger ist, wenn sie binnen sechs Monaten nach dem Tag, an dem die Eintragung der Verschmelzung in das Register des Sitzes desjenigen Rechtsträgers, dessen Gläubiger sie sind, nach § 19 Abs. 3 UmwG als bekannt gemacht gilt,\nihren Anspruch nach Grund und Höhe in Textform anmelden, Sicherheit zu leisten, soweit sie nicht Befriedigung verlangen können. Dieses Recht steht den Gläubigern jedoch nur zu, wenn sie glaubhaft machen, dass durch die Verschmelzung die Erfüllung der Forderung gefährdet wird."
    },
    {
      "date": "2025-07-30",
      "id": "118328",
      "original_text": "Registerbekanntmachung nach dem Umwandlungsgesetz\nHamburg Amtsgericht Hamburg HRB 183104\nNetzkontor GmbH – Hamburg",
      "type": "Registerbekanntmachung nach dem Umwandlungsgesetz",
      "state": "Hamburg",
      "amtsgericht": "Amtsgericht Hamburg",
      "registernummer": "HRB 183104",
      "registerart": "HRB",
      "company_name": "Netzkontor GmbH",
      "company_seat": "Hamburg",
      "details": "30.07.2025 (Bekanntmachungsdatum)\n\nHamburg Amtsgericht Hamburg HRB 183104\nRegisterbekanntmachung nach dem Umwandlungsgesetz 30.07.2025 (Eintragungsdatum)\n\nNetzkontor GmbH\nGesellschaft mit beschränkter Haftung\nHamburg\n\nAls nicht eingetragen wird bekannt gemacht:\nDen Gläubigern der an der Verschmelzung beteiligten Gesellschaften ist, wenn sie binnen sechs Monaten nach dem Tag, an dem die Eintragung der Verschmelzung in das Register des Sitzes desjenigen Rechtsträgers, dessen Gläubiger sie sind, nach § 19 Absatz 3 UmwG als bekannt gemacht gilt, ihren Anspruch nach Grund und Höhe schriftlich anmelden, Sicherheit zu leisten, soweit sie nicht Befriedigung verlangen können. Dieses Recht steht den Gläubigern jedoch nur zu, wenn sie glaubhaft machen, dass durch die Verschmelzung die Erfüllung ihrer Forderung gefährdet wird."
    },
    {
      "date": "2025-07-30",
      "id": "118329",
      "original_text": "Registerbekanntmachung nach dem Umwandlungsgesetz\nMecklenburg-Vorpommern Amtsgericht Stralsund HRB 20965\nEuV Ostsee GmbH – Binz",
      "type": "Registerbekanntmachung nach dem Umwandlungsgesetz",
      "state": "Mecklenburg-Vorpommern",
      "amtsgericht": "Amtsgericht Stralsund",
      "registernummer": "HRB 20965",
      "registerart": "HRB",
      "company_name": "EuV Ostsee GmbH",
      "company_seat": "Binz",
      "details": "30.07.2025 (Bekanntmachungsdatum)\n\nMecklenburg-Vorpommern Amtsgericht Stralsund HRB 20965\nRegisterbekanntmachung nach dem Umwandlungsgesetz\n\nEuV Ostsee GmbH\nGesellschaft mit beschränkter Haftung\nBinz\n\nAls nicht eingetragen wird veröffentlicht: Den Gläubigern der an der Verschmelzung beteiligten Rechtsträger ist, wenn sie binnen sechs Monaten nach dem Tag, an dem die Eintragung der Verschmelzung in das Register des Sitzes desjenigen Rechtsträgers, dessen Gläubiger sie sind, nach § 19 Abs. 3 UmwG als bekannt gemacht gilt,\nihren Anspruch nach Grund und Höhe in Textform anmelden, Sicherheit zu leisten, soweit sie nicht Befriedigung verlangen können. Dieses Recht steht den Gläubigern jedoch nur zu, wenn sie glaubhaft machen, dass durch die Verschmelzung die Erfüllung der Forderung gefährdet wird."
    },
    {
      "date": "2025-07-30",
      "id": "118330",
      "original_text": "Registerbekanntmachung nach dem Umwandlungsgesetz\nHamburg Amtsgericht Hamburg HRB 183648\nNetzkontor Fiberservice GmbH – Hamburg",
      "type": "Registerbekanntmachung nach dem Umwandlungsgesetz",
      "state": "Hamburg",
      "amtsgericht": "Amtsgericht Hamburg",
      "registernummer": "HRB 183648",
      "registerart": "HRB",
      "company_name": "Netzkontor Fiberservice GmbH",
      "company_seat": "Hamburg",
      "details": "30.07.2025 (Bekanntmachungsdatum)\n\nHamburg Amtsgericht Hamburg HRB 183648\nRegisterbekanntmachung nach dem Umwandlungsgesetz 30.07.2025 (Eintragungsdatum)\n\nNetzkontor Fiberservice GmbH\nGesellschaft mit beschränkter Haftung\nHamburg\n\nAls nicht eingetragen wird bekannt gemacht:\nDen Gläubigern der an der Verschmelzung beteiligten Gesellschaften ist, wenn sie binnen sechs Monaten nach dem Tag, an dem die Eintragung der Verschmelzung in das Register des Sitzes desjenigen Rechtsträgers, dessen Gläubiger sie sind, nach § 19 Absatz 3 UmwG als bekannt gemacht gilt, ihren Anspruch nach Grund und Höhe schriftlich anmelden, Sicherheit zu leisten, soweit sie nicht Befriedigung verlangen können. Dieses Recht steht den Gläubigern jedoch nur zu, wenn sie glaubhaft machen, dass durch die Verschmelzung die Erfüllung ihrer Forderung gefährdet wird."
    },
    {
      "date": "2025-07-30",
      "id": "118331",
      "original_text": "Registerbekanntmachung nach dem Umwandlungsgesetz\nBaden-Württemberg Amtsgericht Stuttgart HRB 748372\nEnBW Rückbauservice GmbH – Stuttgart",
      "type": "Registerbekanntmachung nach dem Umwandlungsgesetz",
      "state": "Baden-Württemberg",
      "amtsgericht": "Amtsgericht Stuttgart",
      "registernummer": "HRB 748372",
      "registerart": "HRB",
      "company_name": "EnBW Rückbauservice GmbH",
      "company_seat": "Stuttgart",
      "details": "30.07.2025 (Bekanntmachungsdatum)\n\nBaden-Württemberg Amtsgericht Stuttgart HRB 748372\nRegisterbekanntmachung nach dem Umwandlungsgesetz\n\nEnBW Rückbauservice GmbH\nGesellschaft mit beschränkter Haftung\nStuttgart\n\nDie Gesellschaft hat am 28.07.2025 den Verschmelzungsvertrag vom 28.07.2025 zwischen \"EnBW Energie Baden-Württemberg AG\", Karlsruhe (Amtsgericht Mannheim HRB 107956) und der hiesigen Gesellschaft (übertragender Rechtsträger) zum Handelsregister eingereicht."
    },
    {
      "date": "2025-07-30",
      "id": "118332",
      "original_text": "Registerbekanntmachung nach dem Umwandlungsgesetz\nSachsen Amtsgericht Chemnitz HRA 10059\ninszenium, Inh. Stefan Lehmann e. K. – Plauen",
      "type": "Registerbekanntmachung nach dem Umwandlungsgesetz",
      "state": "Sachsen",
      "amtsgericht": "Amtsgericht Chemnitz",
      "registernummer": "HRA 10059",
      "registerart": "HRA",
      "company_name": "inszenium, Inh. Stefan Lehmann e. K.",
      "company_seat": "Plauen",
      "details": "30.07.2025 (Bekanntmachungsdatum)\n\nSachsen Amtsgericht Chemnitz HRA 10059\nRegisterbekanntmachung nach dem Umwandlungsgesetz 30.07.2025 (Eintragungsdatum)\n\ninszenium, Inh. Stefan Lehmann e. K.\nEinzelkaufmann / Einzelkauffrau\nPlauen\n\nDen Gläubigern der an der Ausgliederung beteiligten Rechtsträger ist, wenn sie binnen sechs Monaten nach dem Tag, an dem die Eintragung der Ausgliederung in das Register des Sitzes desjenigen Rechtsträgers, dessen Gläubiger sie sind, nach § 19 Abs. 3 UmwG als bekannt gemacht gilt, ihren Anspruch nach Grund und Höhe in Textform anmelden, Sicherheit zu leisten, soweit sie nicht Befriedigung verlangen können. Dieses Recht steht den Gläubigern jedoch nur zu, wenn sie glaubhaft machen, dass durch die Ausgliederung die Erfüllung der Forderung gefährdet wird."
    },
    {
      "date": "2025-07-30",
      "id": "118333",
      "original_text": "Löschungsankündigung\nSachsen Amtsgericht Dresden HRB 41056\nNDS Records Unternehmergesellschaft (haftungsbeschränkt) – Steinigtwolmsdorf",
      "type": "Löschungsankündigung",
      "state": "Sachsen",
      "amtsgericht": "Amtsgericht Dresden",
      "registernummer": "HRB 41056",
      "registerart": "HRB",
      "company_name": "NDS Records Unternehmergesellschaft (haftungsbeschränkt)",
      "company_seat": "Steinigtwolmsdorf",
      "details": "30.07.2025 (Bekanntmachungsdatum)\n\nSachsen Amtsgericht Dresden HRB 41056\nLöschungsankündigung\n\nNDS Records Unternehmergesellschaft (haftungsbeschränkt)\nGesellschaft mit beschränkter Haftung\nSteinigtwolmsdorf\n\nDas Registergericht beabsichtigt, die im Handelsregister eingetragene Gesellschaft von Amts wegen nach § 394 FamFG zu löschen. Die Frist zu Erhebung eines Widerspruchs gegen die beabsichtigte Löschung wird auf einen Monat festgesetzt."
    },
    {
      "date": "2025-07-30",
      "id": "118334",
      "original_text": "Registerbekanntmachung nach dem Umwandlungsgesetz\nSachsen Amtsgericht Leipzig HRB 8123\nPAREO Kraftwerk-Beteiligungsgesellschaft mbH – Leipzig",
      "type": "Registerbekanntmachung nach dem Umwandlungsgesetz",
      "state": "Sachsen",
      "amtsgericht": "Amtsgericht Leipzig",
      "registernummer": "HRB 8123",
      "registerart": "HRB",
      "company_name": "PAREO Kraftwerk-Beteiligungsgesellschaft mbH",
      "company_seat": "Leipzig",
      "details": "30.07.2025 (Bekanntmachungsdatum)\n\nSachsen Amtsgericht Leipzig HRB 8123\nRegisterbekanntmachung nach dem Umwandlungsgesetz 30.07.2025 (Eintragungsdatum)\n\nPAREO Kraftwerk-Beteiligungsgesellschaft mbH\nGesellschaft mit beschränkter Haftung\nLeipzig\n\nDen Gläubigern der an der Verschmelzung beteiligten Rechtsträger ist, wenn sie binnen sechs Monaten nach dem Tag, an dem die Eintragung der Verschmelzung in das Register des Sitzes desjenigen Rechtsträgers, dessen Gläubiger sie sind, nach § 19 Abs. 3 UmwG als bekannt gemacht gilt, ihren Anspruch nach Grund und Höhe in Textform anmelden, Sicherheit zu leisten, soweit sie nicht Befriedigung verlangen können. Dieses Recht steht den Gläubigern jedoch nur zu, wenn sie glaubhaft machen, dass durch die Verschmelzung die Erfüllung der Forderung gefährdet wird."
    },
    {
      "date": "2025-07-30",
      "id": "118335",
      "original_text": "Löschungsankündigung\nSachsen Amtsgericht Chemnitz HRB 20487\nCupl Bau Niedersteinbach GmbH – Penig",
      "type": "Löschungsankündigung",
      "state": "Sachsen",
      "amtsgericht": "Amtsgericht Chemnitz",
      "registernummer": "HRB 20487",
      "registerart": "HRB",
      "company_name": "Cupl Bau Niedersteinbach GmbH",
      "company_seat": "Penig",
      "details": "30.07.2025 (Bekanntmachungsdatum)\n\nSachsen Amtsgericht Chemnitz HRB 20487\nLöschungsankündigung\n\nCupl Bau Niedersteinbach GmbH\nGesellschaft mit beschränkter Haftung\nPenig\n\nDas Registergericht beabsichtigt, die im Handelsregister eingetragene Gesellschaft von Amts wegen nach § 394 FamFG zu löschen. Die Frist zu Erhebung eines Widerspruchs gegen die beabsichtigte Löschung wird auf einen Monat festgesetzt."
    },
    {
      "date": "2025-07-30",
      "id": "118336",
      "original_text": "Registerbekanntmachung nach dem Umwandlungsgesetz\nSachsen Amtsgericht Chemnitz HRB 3685\nreisemax GmbH – Plauen",
      "type": "Registerbekanntmachung nach dem Umwandlungsgesetz",
      "state": "Sachsen",
      "amtsgericht": "Amtsgericht Chemnitz",
      "registernummer": "HRB 3685",
      "registerart": "HRB",
      "company_name": "reisemax GmbH",
      "company_seat": "Plauen",
      "details": "30.07.2025 (Bekanntmachungsdatum)\n\nSachsen Amtsgericht Chemnitz HRB 3685\nRegisterbekanntmachung nach dem Umwandlungsgesetz 30.07.2025 (Eintragungsdatum)\n\nreisemax GmbH\nGesellschaft mit beschränkter Haftung\nPlauen\n\nDen Gläubigern der an der Verschmelzung beteiligten Rechtsträger ist, wenn sie binnen sechs Monaten nach dem Tag, an dem die Eintragung der Verschmelzung in das Register des Sitzes desjenigen Rechtsträgers, dessen Gläubiger sie sind, nach § 19 Abs. 3 UmwG als bekannt gemacht gilt, ihren Anspruch nach Grund und Höhe in Textform anmelden, Sicherheit zu leisten, soweit sie nicht Befriedigung verlangen können. Dieses Recht steht den Gläubigern jedoch nur zu, wenn sie glaubhaft machen, dass durch die Verschmelzung die Erfüllung der Forderung gefährdet wird."
    },
    {
      "date": "2025-07-30",
      "id": "118337",
      "original_text": "Einreichung neuer Dokumente\nSachsen Amtsgericht Chemnitz HRB 8550\nOelsnitzer Wohnungsbaugesellschaft mbH - OEWOG - – Oelsnitz/Vogtl.",
      "type": "Einreichung neuer Dokumente",
      "state": "Sachsen",
      "amtsgericht": "Amtsgericht Chemnitz",
      "registernummer": "HRB 8550",
      "registerart": "HRB",
      "company_name": "Oelsnitzer Wohnungsbaugesellschaft mbH - OEWOG -",
      "company_seat": "Oelsnitz/Vogtl.",
      "details": "30.07.2025 (Bekanntmachungsdatum)\n\nSachsen Amtsgericht Chemnitz HRB 8550\nEinreichung neuer Dokumente\n\nOelsnitzer Wohnungsbaugesellschaft mbH - OEWOG -\nGesellschaft mit beschränkter Haftung\nOelsnitz/Vogtl.\n\nAm 28.07.2025 wurde beim Handelsregister des Amtsgerichts Chemnitz die Liste der Mitglieder des Aufsichtsrats gemäß § 52 GmbHG eingereicht."
    },
    {
      "date": "2025-07-30",
      "id": "118338",
      "original_text": "Registerbekanntmachung nach dem Umwandlungsgesetz\nSachsen Amtsgericht Chemnitz HRB 37583\ninszenium GmbH – Plauen",
      "type": "Registerbekanntmachung nach dem Umwandlungsgesetz",
      "state": "Sachsen",
      "amtsgericht": "Amtsgericht Chemnitz",
      "registernummer": "HRB 37583",
      "registerart": "HRB",
      "company_name": "inszenium GmbH",
      "company_seat": "Plauen",
      "details": "30.07.2025 (Bekanntmachungsdatum)\n\nSachsen Amtsgericht Chemnitz HRB 37583\nRegisterbekanntmachung nach dem Umwandlungsgesetz 30.07.2025 (Eintragungsdatum)\n\ninszenium GmbH\nGesellschaft mit beschränkter Haftung\nPlauen\n\nDen Gläubigern der an der Ausgliederung beteiligten Rechtsträger ist, wenn sie binnen sechs Monaten nach dem Tag, an dem die Eintragung der Ausgliederung in das Register des Sitzes desjenigen Rechtsträgers, dessen Gläubiger sie sind, nach § 19 Abs. 3 UmwG als bekannt gemacht gilt, ihren Anspruch nach Grund und Höhe in Textform anmelden, Sicherheit zu leisten, soweit sie nicht Befriedigung verlangen können. Dieses Recht steht den Gläubigern jedoch nur zu, wenn sie glaubhaft machen, dass durch die Ausgliederung die Erfüllung der Forderung gefährdet wird."
    },
    {
      "date": "2025-07-30",
      "id": "118339",
      "original_text": "Registerbekanntmachung nach dem Umwandlungsgesetz\nSachsen Amtsgericht Chemnitz HRB 31408\nVSTR AG Rodewisch – Rodewisch",
      "type": "Registerbekanntmachung nach dem Umwandlungsgesetz",
      "state": "Sachsen",
      "amtsgericht": "Amtsgericht Chemnitz",
      "registernummer": "HRB 31408",
      "registerart": "HRB",
      "company_name": "VSTR AG Rodewisch",
      "company_seat": "Rodewisch",
      "details": "30.07.2025 (Bekanntmachungsdatum)\n\nSachsen Amtsgericht Chemnitz HRB 31408\nRegisterbekanntmachung nach dem Umwandlungsgesetz 30.07.2025 (Eintragungsdatum)\n\nVSTR AG Rodewisch\nAktiengesellschaft\nRodewisch\n\nDen Gläubigern der an der Verschmelzung beteiligten Rechtsträger ist, wenn sie binnen sechs Monaten nach dem Tag, an dem die Eintragung der Verschmelzung in das Register des Sitzes desjenigen Rechtsträgers, dessen Gläubiger sie sind, nach § 19 Abs. 3 UmwG als bekannt gemacht gilt, ihren Anspruch nach Grund und Höhe in Textform anmelden, Sicherheit zu leisten, soweit sie nicht Befriedigung verlangen können. Dieses Recht steht den Gläubigern jedoch nur zu, wenn sie glaubhaft machen, dass durch die Verschmelzung die Erfüllung der Forderung gefährdet wird."
    },
    {
      "date": "2025-07-30",
      "id": "118340",
      "original_text": "Registerbekanntmachung nach dem Umwandlungsgesetz\nSachsen Amtsgericht Chemnitz HRB 12692\nVSTR Bauservice GmbH – Rodewisch",
      "type": "Registerbekanntmachung nach dem Umwandlungsgesetz",
      "state": "Sachsen",
      "amtsgericht": "Amtsgericht Chemnitz",
      "registernummer": "HRB 12692",
      "registerart": "HRB",
      "company_name": "VSTR Bauservice GmbH",
      "company_seat": "Rodewisch",
      "details": "30.07.2025 (Bekanntmachungsdatum)\n\nSachsen Amtsgericht Chemnitz HRB 12692\nRegisterbekanntmachung nach dem Umwandlungsgesetz 30.07.2025 (Eintragungsdatum)\n\nVSTR Bauservice GmbH\nGesellschaft mit beschränkter Haftung\nRodewisch\n\nDen Gläubigern der an der Verschmelzung beteiligten Rechtsträger ist, wenn sie binnen sechs Monaten nach dem Tag, an dem die Eintragung der Verschmelzung in das Register des Sitzes desjenigen Rechtsträgers, dessen Gläubiger sie sind, nach § 19 Abs. 3 UmwG als bekannt gemacht gilt, ihren Anspruch nach Grund und Höhe in Textform anmelden, Sicherheit zu leisten, soweit sie nicht Befriedigung verlangen können. Dieses Recht steht den Gläubigern jedoch nur zu, wenn sie glaubhaft machen, dass durch die Verschmelzung die Erfüllung der Forderung gefährdet wird."
    },
    {
      "date": "2025-07-30",
      "id": "118341",
      "original_text": "Registerbekanntmachung nach dem Umwandlungsgesetz\nSachsen Amtsgericht Chemnitz HRB 4745\ncosamia GmbH – Plauen",
      "type": "Registerbekanntmachung nach dem Umwandlungsgesetz",
      "state": "Sachsen",
      "amtsgericht": "Amtsgericht Chemnitz",
      "registernummer": "HRB 4745",
      "registerart": "HRB",
      "company_name": "cosamia GmbH",
      "company_seat": "Plauen",
      "details": "30.07.2025 (Bekanntmachungsdatum)\n\nSachsen Amtsgericht Chemnitz HRB 4745\nRegisterbekanntmachung nach dem Umwandlungsgesetz 30.07.2025 (Eintragungsdatum)\n\ncosamia GmbH\nGesellschaft mit beschränkter Haftung\nPlauen\n\nDen Gläubigern der an der Verschmelzung beteiligten Rechtsträger ist, wenn sie binnen sechs Monaten nach dem Tag, an dem die Eintragung der Verschmelzung in das Register des Sitzes desjenigen Rechtsträgers, dessen Gläubiger sie sind, nach § 19 Abs. 3 UmwG als bekannt gemacht gilt, ihren Anspruch nach Grund und Höhe in Textform anmelden, Sicherheit zu leisten, soweit sie nicht Befriedigung verlangen können. Dieses Recht steht den Gläubigern jedoch nur zu, wenn sie glaubhaft machen, dass durch die Verschmelzung die Erfüllung der Forderung gefährdet wird."
    },
    {
      "date": "2025-07-30",
      "id": "118342",
      "original_text": "Registerbekanntmachung nach dem Umwandlungsgesetz\nSachsen Amtsgericht Dresden HRB 36375\nYellow Tec Holding GmbH – Görlitz",
      "type": "Registerbekanntmachung nach dem Umwandlungsgesetz",
      "state": "Sachsen",
      "amtsgericht": "Amtsgericht Dresden",
      "registernummer": "HRB 36375",
      "registerart": "HRB",
      "company_name": "Yellow Tec Holding GmbH",
      "company_seat": "Görlitz",
      "details": "30.07.2025 (Bekanntmachungsdatum)\n\nSachsen Amtsgericht Dresden HRB 36375\nRegisterbekanntmachung nach dem Umwandlungsgesetz 30.07.2025 (Eintragungsdatum)\n\nYellow Tec Holding GmbH\nGesellschaft mit beschränkter Haftung\nGörlitz\n\nDen Gläubigern der an der Verschmelzung beteiligten Rechtsträger ist, wenn sie binnen sechs Monaten nach dem Tag, an dem die Eintragung der Verschmelzung in das Register des Sitzes desjenigen Rechtsträgers, dessen Gläubiger sie sind, nach § 19 Abs. 3 UmwG als bekannt gemacht gilt, ihren Anspruch nach Grund und Höhe in Textform anmelden, Sicherheit zu leisten, soweit sie nicht Befriedigung verlangen können. Dieses Recht steht den Gläubigern jedoch nur zu, wenn sie glaubhaft machen, dass durch die Verschmelzung die Erfüllung der Forderung gefährdet wird."
    },
    {
      "date": "2025-07-30",
      "id": "118343",
      "original_text": "Löschungsankündigung\nSachsen Amtsgericht Dresden HRB 41634\nLiebenau UG (haftungsbeschränkt) – Dresden",
      "type": "Löschungsankündigung",
      "state": "Sachsen",
      "amtsgericht": "Amtsgericht Dresden",
      "registernummer": "HRB 41634",
      "registerart": "HRB",
      "company_name": "Liebenau UG (haftungsbeschränkt)",
      "company_seat": "Dresden",
      "details": "30.07.2025 (Bekanntmachungsdatum)\n\nSachsen Amtsgericht Dresden HRB 41634\nLöschungsankündigung\n\nLiebenau UG (haftungsbeschränkt)\nGesellschaft mit beschränkter Haftung\nDresden\n\nDas Registergericht beabsichtigt, die im Handelsregister eingetragene Gesellschaft von Amts wegen nach § 394 FamFG zu löschen. Die Frist zu Erhebung eines Widerspruchs gegen die beabsichtigte Löschung wird auf einen Monat festgesetzt."
    },
    {
      "date": "2025-07-30",
      "id": "118344",
      "original_text": "Löschungsankündigung\nNiedersachsen Amtsgericht Osnabrück HRB 120730 früher Amtsgericht Meppen\nIFS GmbH – Börger",
      "type": "Löschungsankündigung",
      "state": "Niedersachsen",
      "amtsgericht": "Amtsgericht Osnabrück",
      "registernummer": "HRB 120730",
      "registerart": "HRB",
      "company_name": "IFS GmbH",
      "company_seat": "Börger",
      "former_amtsgericht": "Meppen",
      "details": "30.07.2025 (Bekanntmachungsdatum)\n\nNiedersachsen Amtsgericht Osnabrück HRB 120730 früher Amtsgericht Meppen\nLöschungsankündigung\n\nIFS GmbH\nGesellschaft mit beschränkter Haftung\nBörger\n\nDas Registergericht beabsichtigt, die Gesellschaft von Amts wegen nach § 394 FamFG wegen Vermögenslosigkeit zu löschen. Die Frist zur Erhebung eines Widerspruchs ist auf 1 Monat ab dieser Registerbekanntmachung festgesetzt."
    },
    {
      "date": "2025-07-30",
      "id": "118345",
      "original_text": "Löschungsankündigung\nNiedersachsen Amtsgericht Hildesheim HRB 206929\nAW Logistik Service GmbH – Sarstedt",
      "type": "Löschungsankündigung",
      "state": "Niedersachsen",
      "amtsgericht": "Amtsgericht Hildesheim",
      "registernummer": "HRB 206929",
      "registerart": "HRB",
      "company_name": "AW Logistik Service GmbH",
      "company_seat": "Sarstedt",
      "details": "30.07.2025 (Bekanntmachungsdatum)\n\nNiedersachsen Amtsgericht Hildesheim HRB 206929\nLöschungsankündigung\n\nAW Logistik Service GmbH\nGesellschaft mit beschränkter Haftung\nSarstedt\n\nDas Registergericht beabsichtigt, die Gesellschaft von Amts wegen nach § 394 FamFG zu löschen. Die Frist zur Erhebung eines Widerspruchs ist auf 1 Monat ab dieser Registerbekanntmachung festgesetzt."
    },
    {
      "date": "2025-07-30",
      "id": "118346",
      "original_text": "Löschungsankündigung\nNiedersachsen Amtsgericht Aurich HRA 200800\nMS \"Casablanca\" Reederei Bojen GmbH & Co. KG – Moormerland-Neermoor",
      "type": "Löschungsankündigung",
      "state": "Niedersachsen",
      "amtsgericht": "Amtsgericht Aurich",
      "registernummer": "HRA 200800",
      "registerart": "HRA",
      "company_name": "MS \"Casablanca\" Reederei Bojen GmbH & Co. KG",
      "company_seat": "Moormerland-Neermoor",
      "details": "30.07.2025 (Bekanntmachungsdatum)\n\nNiedersachsen Amtsgericht Aurich HRA 200800\nLöschungsankündigung\n\nMS \"Casablanca\" Reederei Bojen GmbH & Co. KG\nKommanditgesellschaft\nMoormerland-Neermoor\n\nDas Registergericht beabsichtigt, die Firma von Amts wegen nach § 395 FamFG zu löschen. Die Frist zur Erhebung eines Widerspruchs ist auf 3 Monate ab dieser Registerbekanntmachung festgesetzt."
    },
    {
      "date": "2025-07-30",
      "id": "118347",
      "original_text": "Einreichung neuer Dokumente\nNiedersachsen Amtsgericht Osnabrück GnR 200024\nBelegschaftsgenossenschaft der EZG Hümmling für regenerative Energieerzeugung eG – Lorup",
      "type": "Einreichung neuer Dokumente",
      "state": "Niedersachsen",
      "amtsgericht": "Amtsgericht Osnabrück",
      "registernummer": "GnR 200024",
      "registerart": "GnR",
      "company_name": "Belegschaftsgenossenschaft der EZG Hümmling für regenerative Energieerzeugung eG",
      "company_seat": "Lorup",
      "details": "30.07.2025 (Bekanntmachungsdatum)\n\nNiedersachsen Amtsgericht Osnabrück GnR 200024\nEinreichung neuer Dokumente 30.07.2025 (Eintragungsdatum)\n\nBelegschaftsgenossenschaft der EZG Hümmling für regenerative Energieerzeugung eG\neingetragene Genossenschaft\nLorup\n\nDie Liste der Mitglieder des Aufsichtsrats wurde beim Registergericht eingereicht."
    },
    {
      "date": "2025-07-30",
      "id": "118348",
      "original_text": "Einreichung neuer Dokumente\nNiedersachsen Amtsgericht Osnabrück HRB 20351\nNiels-Stensen-Kliniken Marienhospital Ankum-Bersenbrück GmbH – Ankum",
      "type": "Einreichung neuer Dokumente",
      "state": "Niedersachsen",
      "amtsgericht": "Amtsgericht Osnabrück",
      "registernummer": "HRB 20351",
      "registerart": "HRB",
      "company_name": "Niels-Stensen-Kliniken Marienhospital Ankum-Bersenbrück GmbH",
      "company_seat": "Ankum",
      "details": "30.07.2025 (Bekanntmachungsdatum)\n\nNiedersachsen Amtsgericht Osnabrück HRB 20351\nEinreichung neuer Dokumente\n\nNiels-Stensen-Kliniken Marienhospital Ankum-Bersenbrück GmbH\nGesellschaft mit beschränkter Haftung\nAnkum\n\nDie Liste der Mitglieder des Aufsichtsrats wurde beim Registergericht eingereicht."
    },
    {
      "date": "2025-07-30",
      "id": "118349",
      "original_text": "Registerbekanntmachung nach dem Umwandlungsgesetz\nNiedersachsen Amtsgericht Hannover HRB 215828\nWienerberger Deutschland Service GmbH – Hannover",
      "type": "Registerbekanntmachung nach dem Umwandlungsgesetz",
      "state": "Niedersachsen",
      "amtsgericht": "Amtsgericht Hannover",
      "registernummer": "HRB 215828",
      "registerart": "HRB",
      "company_name": "Wienerberger Deutschland Service GmbH",
      "company_seat": "Hannover",
      "details": "30.07.2025 (Bekanntmachungsdatum)\n\nNiedersachsen Amtsgericht Hannover HRB 215828\nRegisterbekanntmachung nach dem Umwandlungsgesetz 30.07.2025 (Eintragungsdatum)\n\nWienerberger Deutschland Service GmbH\nGesellschaft mit beschränkter Haftung\nHannover\n\nDen Gläubigern der an der Abspaltung beteiligten Rechtsträger ist, wenn sie binnen sechs Monaten nach dem Tag, an dem die Eintragung der Abspaltung in das Register des Sitzes desjenigen Rechtsträgers, dessen Gläubiger sie sind, nach § 19 Abs. 3 UmwG als bekannt gemacht gilt, ihren Anspruch nach Grund und Höhe schriftlich anmelden, Sicherheit zu leisten, soweit sie nicht Befriedigung verlangen können. Dieses Recht steht den Gläubigern jedoch nur zu, wenn sie glaubhaft machen, dass durch die Abspaltung die Erfüllung der Forderung gefährdet wird."
    },
    {
      "date": "2025-07-30",
      "id": "118350",
      "original_text": "Sonstige Registerbekanntmachung\nNiedersachsen Amtsgericht Göttingen HRB 130768 früher Amtsgericht Northeim\nHarz-Weser-Werke gGmbH – Osterode am Harz",
      "type": "Sonstige Registerbekanntmachung",
      "state": "Niedersachsen",
      "amtsgericht": "Amtsgericht Göttingen",
      "registernummer": "HRB 130768",
      "registerart": "HRB",
      "company_name": "Harz-Weser-Werke gGmbH",
      "company_seat": "Osterode am Harz",
      "former_amtsgericht": "Northeim",
      "details": "30.07.2025 (Bekanntmachungsdatum)\n\nNiedersachsen Amtsgericht Göttingen HRB 130768 früher Amtsgericht Northeim\nSonstige Registerbekanntmachung\n\nHarz-Weser-Werke gGmbH\nGesellschaft mit beschränkter Haftung\nOsterode am Harz\n\nDie Liste der Mitglieder des Verwaltungsrats wurde beim Registergericht eingereicht."
    },
    {
      "date": "2025-07-30",
      "id": "118351",
      "original_text": "Einreichung neuer Dokumente\nNiedersachsen Amtsgericht Hildesheim HRB 205311\nSVHI Stadtverkehr Hildesheim GmbH – Hildesheim",
      "type": "Einreichung neuer Dokumente",
      "state": "Niedersachsen",
      "amtsgericht": "Amtsgericht Hildesheim",
      "registernummer": "HRB 205311",
      "registerart": "HRB",
      "company_name": "SVHI Stadtverkehr Hildesheim GmbH",
      "company_seat": "Hildesheim",
      "details": "30.07.2025 (Bekanntmachungsdatum)\n\nNiedersachsen Amtsgericht Hildesheim HRB 205311\nEinreichung neuer Dokumente 30.07.2025 (Eintragungsdatum)\n\nSVHI Stadtverkehr Hildesheim GmbH\nGesellschaft mit beschränkter Haftung\nHildesheim\n\nDie Liste der Mitglieder des Aufsichtsrats wurde beim Registergericht eingereicht."
    },
    {
      "date": "2025-07-30",
      "id": "118352",
      "original_text": "Einreichung neuer Dokumente\nNiedersachsen Amtsgericht Hildesheim HRB 205075\nTradePool AG – Uetze",
      "type": "Einreichung neuer Dokumente",
      "state": "Niedersachsen",
      "amtsgericht": "Amtsgericht Hildesheim",
      "registernummer": "HRB 205075",
      "registerart": "HRB",
      "company_name": "TradePool AG",
      "company_seat": "Uetze",
      "details": "30.07.2025 (Bekanntmachungsdatum)\n\nNiedersachsen Amtsgericht Hildesheim HRB 205075\nEinreichung neuer Dokumente 30.07.2025 (Eintragungsdatum)\n\nTradePool AG\nAktiengesellschaft\nUetze\n\nDie Liste der Mitglieder des Aufsichtsrats wurde beim Registergericht eingereicht."
    },
    {
      "date": "2025-07-30",
      "id": "118353",
      "original_text": "Registerbekanntmachung nach dem Umwandlungsgesetz\nBremen Amtsgericht Bremen HRB 31148\nrepair-pedia AG – Bremen",
      "type": "Registerbekanntmachung nach dem Umwandlungsgesetz",
      "state": "Bremen",
      "amtsgericht": "Amtsgericht Bremen",
      "registernummer": "HRB 31148",
      "registerart": "HRB",
      "company_name": "repair-pedia AG",
      "company_seat": "Bremen",
      "details": "30.07.2025 (Bekanntmachungsdatum)\n\nBremen Amtsgericht Bremen HRB 31148\nRegisterbekanntmachung nach dem Umwandlungsgesetz 23.07.2025 (Eintragungsdatum)\n\nrepair-pedia AG\nAktiengesellschaft\nBremen\n\nZu Eintragungsnummer 6 vom 23.07.2025 wird als nicht eingetragen veröffentlicht: Den Gläubigern ist, wenn sie binnen sechs Monaten nach dem Tag, an dem die Eintragung der Umwandlung als bekannt gemacht gilt, ihren Anspruch nach Grund und Höhe schriftlich anmelden, Sicherheit zu leisten, soweit sie nicht Befriedigung verlangen können. Dieses Recht steht den Gläubigern jedoch nur zu, wenn sie glaubhaft machen, dass durch die Umwandlung die Erfüllung ihrer Forderung gefährdet wird. Das Recht, Sicherheitsleistung zu verlangen, steht Gläubigern nicht zu, die im Falle der Insolvenz ein Recht auf vorzugsweise Befriedigung aus einer Deckungsmasse haben, die nach gesetzlicher Vorschrift zu ihrem Schutz errichtet und staatlich überwacht ist."
    },
    {
      "date": "2025-07-30",
      "id": "118354",
      "original_text": "Registerbekanntmachung nach dem Umwandlungsgesetz\nRheinland-Pfalz Amtsgericht Mainz HRB 651\nMainzer Stadtwerke AG – Mainz",
      "type": "Registerbekanntmachung nach dem Umwandlungsgesetz",
      "state": "Rheinland-Pfalz",
      "amtsgericht": "Amtsgericht Mainz",
      "registernummer": "HRB 651",
      "registerart": "HRB",
      "company_name": "Mainzer Stadtwerke AG",
      "company_seat": "Mainz",
      "details": "30.07.2025 (Bekanntmachungsdatum)\n\nRheinland-Pfalz Amtsgericht Mainz HRB 651\nRegisterbekanntmachung nach dem Umwandlungsgesetz 30.07.2025 (Eintragungsdatum)\n\nMainzer Stadtwerke AG\nAktiengesellschaft\nMainz\n\nAls nicht eingetragen wird veröffentlicht: Den Gläubigern der an der Verschmelzung beteiligten Rechtsträger ist, wenn sie binnen sechs Monaten nach dem Tag, an dem die Eintragung der Verschmelzung in das Register des Sitzes desjenigen Rechtsträgers,dessen Gläubiger sie sind, nach § 19 Abs. 3 UmwG als bekannt gemacht gilt, ihren Anspruch nach Grund und Höhe schriftlich anmelden, Sicherheit zu leisten, soweit sie nicht Befriedigung verlangen können. Dieses Recht steht den Gläubigern jedoch nur zu, wenn sie glaubhaft machen, dass durch die Verschmelzung die Erfüllung der Forderung gefährdet wird.\""
    },
    {
      "date": "2025-07-30",
      "id": "118355",
      "original_text": "Registerbekanntmachung nach dem Umwandlungsgesetz\nRheinland-Pfalz Amtsgericht Mainz HRB 50012\nKIM GmbH – Mainz",
      "type": "Registerbekanntmachung nach dem Umwandlungsgesetz",
      "state": "Rheinland-Pfalz",
      "amtsgericht": "Amtsgericht Mainz",
      "registernummer": "HRB 50012",
      "registerart": "HRB",
      "company_name": "KIM GmbH",
      "company_seat": "Mainz",
      "details": "30.07.2025 (Bekanntmachungsdatum)\n\nRheinland-Pfalz Amtsgericht Mainz HRB 50012\nRegisterbekanntmachung nach dem Umwandlungsgesetz 30.07.2025 (Eintragungsdatum)\n\nKIM GmbH\nGesellschaft mit beschränkter Haftung\nMainz\n\nAls nicht eingetragen wird veröffentlicht: Den Gläubigern der an der Verschmelzung beteiligten Rechtsträger ist, wenn sie binnen sechs Monaten nach dem Tag, an dem die Eintragung der Verschmelzung in das Register des Sitzes desjenigen Rechtsträgers,dessen Gläubiger sie sind, nach § 19 Abs. 3 UmwG als bekannt gemacht gilt, ihren Anspruch nach Grund und Höhe schriftlich anmelden, Sicherheit zu leisten, soweit sie nicht Befriedigung verlangen können. Dieses Recht steht den Gläubigern jedoch nur zu, wenn sie glaubhaft machen, dass durch die Verschmelzung die Erfüllung der Forderung gefährdet wird."
    },
    {
      "date": "2025-07-30",
      "id": "118356",
      "original_text": "Registerbekanntmachung nach dem Umwandlungsgesetz\nRheinland-Pfalz Amtsgericht Wittlich HRB 12069\nSchlacht- und Zerlegebetrieb Peter Müller GmbH – Gerolstein-Bewingen",
      "type": "Registerbekanntmachung nach dem Umwandlungsgesetz",
      "state": "Rheinland-Pfalz",
      "amtsgericht": "Amtsgericht Wittlich",
      "registernummer": "HRB 12069",
      "registerart": "HRB",
      "company_name": "Schlacht- und Zerlegebetrieb Peter Müller GmbH",
      "company_seat": "Gerolstein-Bewingen",
      "details": "30.07.2025 (Bekanntmachungsdatum)\n\nRheinland-Pfalz Amtsgericht Wittlich HRB 12069\nRegisterbekanntmachung nach dem Umwandlungsgesetz 30.07.2025 (Eintragungsdatum)\n\nSchlacht- und Zerlegebetrieb Peter Müller GmbH\nGesellschaft mit beschränkter Haftung\nGerolstein-Bewingen\n\nAls nicht eingetragen wird veröffentlicht: Den Gläubigern der an der Verschmelzung beteiligten Rechtsträger ist, wenn sie binnen sechs Monaten nach dem Tag, an dem die Eintragung der Verschmelzung in das Register des Sitzes desjenigen Rechtsträgers,dessen Gläubiger sie sind, nach § 19 Abs. 3 UmwG als bekannt gemacht gilt, ihren Anspruch nach Grund und Höhe schriftlich anmelden, Sicherheit zu leisten, soweit sie nicht Befriedigung verlangen können. Dieses Recht steht den Gläubigern jedoch nur zu, wenn sie glaubhaft machen, dass durch die Verschmelzung die Erfüllung der Forderung gefährdet wird."
    },
    {
      "date": "2025-07-30",
      "id": "118357",
      "original_text": "Registerbekanntmachung nach dem Umwandlungsgesetz\nNordrhein-Westfalen Amtsgericht Düren HRB 9061\nGR Verwaltungs UG (haftungsbeschränkt) – Düren",
      "type": "Registerbekanntmachung nach dem Umwandlungsgesetz",
      "state": "Nordrhein-Westfalen",
      "amtsgericht": "Amtsgericht Düren",
      "registernummer": "HRB 9061",
      "registerart": "HRB",
      "company_name": "GR Verwaltungs UG (haftungsbeschränkt)",
      "company_seat": "Düren",
      "details": "30.07.2025 (Bekanntmachungsdatum)\n\nNordrhein-Westfalen Amtsgericht Düren HRB 9061\nRegisterbekanntmachung nach dem Umwandlungsgesetz 30.07.2025 (Eintragungsdatum)\n\nGR Verwaltungs UG (haftungsbeschränkt)\nGesellschaft mit beschränkter Haftung\nDüren\n\nDen Gläubigern der an der Abspaltung beteiligten Rechtsträger ist, wenn sie binnen sechs Monaten nach dem Tag, an dem die Eintragung der Abspaltung in das Register des Sitzes desjenigen Rechtsträgers, dessen Gläubiger sie sind, nach § 19 Absatz 3 UmwG als bekanntgemacht gilt, ihren Anspruch nach Grund und Höhe schriftlich anmelden, Sicherheit zu leisten, soweit sie nicht Befriedigung verlangen können. Dieses Recht steht den Gläubigern jedoch nur zu, wenn sie glaubhaft machen, dass durch die Abspaltung die Erfüllung ihrer Forderung gefährdet wird."
    },
    {
      "date": "2025-07-30",
      "id": "118358",
      "original_text": "Registerbekanntmachung nach dem Umwandlungsgesetz\nNordrhein-Westfalen Amtsgericht Düren HRB 5661\nRG Rurimmobilien UG (haftungsbeschränkt) – Nörvenich",
      "type": "Registerbekanntmachung nach dem Umwandlungsgesetz",
      "state": "Nordrhein-Westfalen",
      "amtsgericht": "Amtsgericht Düren",
      "registernummer": "HRB 5661",
      "registerart": "HRB",
      "company_name": "RG Rurimmobilien UG (haftungsbeschränkt)",
      "company_seat": "Nörvenich",
      "details": "30.07.2025 (Bekanntmachungsdatum)\n\nNordrhein-Westfalen Amtsgericht Düren HRB 5661\nRegisterbekanntmachung nach dem Umwandlungsgesetz 30.07.2025 (Eintragungsdatum)\n\nRG Rurimmobilien UG (haftungsbeschränkt)\nGesellschaft mit beschränkter Haftung\nNörvenich\n\nDen Gläubigern der an der Abspaltung beteiligten Rechtsträger ist, wenn sie binnen sechs Monaten nach dem Tag, an dem die Eintragung der Abspaltung in das Register des Sitzes desjenigen Rechtsträgers, dessen Gläubiger sie sind, nach § 19 Absatz 3 UmwG als bekanntgemacht gilt, ihren Anspruch nach Grund und Höhe schriftlich anmelden, Sicherheit zu leisten, soweit sie nicht Befriedigung verlangen können. Dieses Recht steht den Gläubigern jedoch nur zu, wenn sie glaubhaft machen, dass durch die Abspaltung die Erfüllung ihrer Forderung gefährdet wird."
    },
    {
      "date": "2025-07-30",
      "id": "118359",
      "original_text": "Registerbekanntmachung nach dem Umwandlungsgesetz\nNordrhein-Westfalen Amtsgericht Bochum HRB 3507\nOase GmbH – Bochum",
      "type": "Registerbekanntmachung nach dem Umwandlungsgesetz",
      "state": "Nordrhein-Westfalen",
      "amtsgericht": "Amtsgericht Bochum",
      "registernummer": "HRB 3507",
      "registerart": "HRB",
      "company_name": "Oase GmbH",
      "company_seat": "Bochum",
      "details": "30.07.2025 (Bekanntmachungsdatum)\n\nNordrhein-Westfalen Amtsgericht Bochum HRB 3507\nRegisterbekanntmachung nach dem Umwandlungsgesetz 29.07.2025 (Eintragungsdatum)\n\nOase GmbH\nGesellschaft mit beschränkter Haftung\nBochum\n\nDen Gläubigern der an der Verschmelzung beteiligten Rechtsträger ist, wenn sie binnen sechs Monaten nach dem Tag, an dem die Eintragung der Verschmelzung in das Register des Sitzes desjenigen Rechtsträgers, dessen Gläubiger sie sind, nach § 19 Absatz 3 UmwG als bekanntgemacht gilt, ihren Anspruch nach Grund und Höhe schriftlich anmelden, Sicherheit zu leisten, soweit sie nicht Befriedigung verlangen können. Dieses Recht steht den Gläubigern jedoch nur zu, wenn sie glaubhaft machen, dass durch die Verschmelzung die Erfüllung ihrer Forderung gefährdet wird."
    },
    {
      "date": "2025-07-30",
      "id": "118360",
      "original_text": "Registerbekanntmachung nach dem Umwandlungsgesetz\nNordrhein-Westfalen Amtsgericht Köln HRB 74941\nIEC Industrieservice für Energie- und Chemieanlagen GmbH – Pulheim",
      "type": "Registerbekanntmachung nach dem Umwandlungsgesetz",
      "state": "Nordrhein-Westfalen",
      "amtsgericht": "Amtsgericht Köln",
      "registernummer": "HRB 74941",
      "registerart": "HRB",
      "company_name": "IEC Industrieservice für Energie- und Chemieanlagen GmbH",
      "company_seat": "Pulheim",
      "details": "30.07.2025 (Bekanntmachungsdatum)\n\nNordrhein-Westfalen Amtsgericht Köln HRB 74941\nRegisterbekanntmachung nach dem Umwandlungsgesetz 30.07.2025 (Eintragungsdatum)\n\nIEC Industrieservice für Energie- und Chemieanlagen GmbH\nGesellschaft mit beschränkter Haftung\nPulheim\n\nDen Gläubigern der an der Verschmelzung beteiligten Rechtsträger ist, wenn sie binnen sechs Monaten nach dem Tag, an dem die Eintragung der Verschmelzung in das Register des Sitzes desjenigen Rechtsträgers, dessen Gläubiger sie sind, nach § 19 Absatz 3 UmwG als bekanntgemacht gilt, ihren Anspruch nach Grund und Höhe schriftlich anmelden, Sicherheit zu leisten, soweit sie nicht Befriedigung verlangen können. Dieses Recht steht den Gläubigern jedoch nur zu, wenn sie glaubhaft machen, dass durch die Verschmelzung die Erfüllung ihrer Forderung gefährdet wird."
    },
    {
      "date": "2025-07-30",
      "id": "118361",
      "original_text": "Registerbekanntmachung nach dem Umwandlungsgesetz\nNordrhein-Westfalen Amtsgericht Düsseldorf VR 3033\nMitternachtsmission Düsseldorf, Christlicher Dienst an Menschen mit Behinderungen e.V. – Düsseldorf",
      "type": "Registerbekanntmachung nach dem Umwandlungsgesetz",
      "state": "Nordrhein-Westfalen",
      "amtsgericht": "Amtsgericht Düsseldorf",
      "registernummer": "VR 3033",
      "registerart": "VR",
      "company_name": "Mitternachtsmission Düsseldorf, Christlicher Dienst an Menschen mit Behinderungen e.V.",
      "company_seat": "Düsseldorf",
      "details": "30.07.2025 (Bekanntmachungsdatum)\n\nNordrhein-Westfalen Amtsgericht Düsseldorf VR 3033\nRegisterbekanntmachung nach dem Umwandlungsgesetz 30.07.2025 (Eintragungsdatum)\n\nMitternachtsmission Düsseldorf, Christlicher Dienst an Menschen mit Behinderungen e.V.\neingetragener Verein\nDüsseldorf\n\nDen Gläubigern der an der Ausgliederung beteiligten Rechtsträger ist, wenn sie binnen sechs Monaten nach dem Tag, an dem die Eintragung der Ausgliederung in das Register des Sitzes desjenigen Rechtsträgers, dessen Gläubiger sie sind, nach § 19 Absatz 3 UmwG als bekanntgemacht gilt, ihren Anspruch nach Grund und Höhe schriftlich anmelden, Sicherheit zu leisten, soweit sie nicht Befriedigung verlangen können. Dieses Recht steht den Gläubigern jedoch nur zu, wenn sie glaubhaft machen, dass durch die Ausgliederung die Erfüllung ihrer Forderung gefährdet wird."
    },
    {
      "date": "2025-07-30",
      "id": "118362",
      "original_text": "Registerbekanntmachung nach dem Umwandlungsgesetz\nNordrhein-Westfalen Amtsgericht Münster HRB 10853\nPORR Verkehrswegebau GmbH – Münster",
      "type": "Registerbekanntmachung nach dem Umwandlungsgesetz",
      "state": "Nordrhein-Westfalen",
      "amtsgericht": "Amtsgericht Münster",
      "registernummer": "HRB 10853",
      "registerart": "HRB",
      "company_name": "PORR Verkehrswegebau GmbH",
      "company_seat": "Münster",
      "details": "30.07.2025 (Bekanntmachungsdatum)\n\nNordrhein-Westfalen Amtsgericht Münster HRB 10853\nRegisterbekanntmachung nach dem Umwandlungsgesetz 30.07.2025 (Eintragungsdatum)\n\nPORR Verkehrswegebau GmbH\nGesellschaft mit beschränkter Haftung\nMünster\n\nDen Gläubigern der an der Verschmelzung beteiligten Rechtsträger ist, wenn sie binnen sechs Monaten nach dem Tag, an dem die Eintragung der Verschmelzung in das Register des Sitzes desjenigen Rechtsträgers, dessen Gläubiger sie sind, nach § 19 Absatz 3 UmwG als bekanntgemacht gilt, ihren Anspruch nach Grund und Höhe schriftlich anmelden, Sicherheit zu leisten, soweit sie nicht Befriedigung verlangen können. Dieses Recht steht den Gläubigern jedoch nur zu, wenn sie glaubhaft machen, dass durch die Verschmelzung die Erfüllung ihrer Forderung gefährdet wird."
    },
    {
      "date": "2025-07-30",
      "id": "118363",
      "original_text": "Löschungsankündigung\nNordrhein-Westfalen Amtsgericht Bochum HRB 15557\n2N Solutions GmbH – Witten",
      "type": "Löschungsankündigung",
      "state": "Nordrhein-Westfalen",
      "amtsgericht": "Amtsgericht Bochum",
      "registernummer": "HRB 15557",
      "registerart": "HRB",
      "company_name": "2N Solutions GmbH",
      "company_seat": "Witten",
      "details": "30.07.2025 (Bekanntmachungsdatum)\n\nNordrhein-Westfalen Amtsgericht Bochum HRB 15557\nLöschungsankündigung\n\n2N Solutions GmbH\nGesellschaft mit beschränkter Haftung\nWitten\n\nDas Registergericht beabsichtigt die Gesellschaft von Amts wegen nach § 394 FamFG zu löschen. Die Frist zur Erhebung eines Widerspruchs ist auf drei Monate festgesetzt."
    },
    {
      "date": "2025-07-30",
      "id": "118364",
      "original_text": "Registerbekanntmachung nach dem Umwandlungsgesetz\nNordrhein-Westfalen Amtsgericht Köln HRB 24284\nIntercom GmbH Reisen/Kongresse/Marketing – Köln",
      "type": "Registerbekanntmachung nach dem Umwandlungsgesetz",
      "state": "Nordrhein-Westfalen",
      "amtsgericht": "Amtsgericht Köln",
      "registernummer": "HRB 24284",
      "registerart": "HRB",
      "company_name": "Intercom GmbH Reisen/Kongresse/Marketing",
      "company_seat": "Köln",
      "details": "30.07.2025 (Bekanntmachungsdatum)\n\nNordrhein-Westfalen Amtsgericht Köln HRB 24284\nRegisterbekanntmachung nach dem Umwandlungsgesetz 30.07.2025 (Eintragungsdatum)\n\nIntercom GmbH Reisen/Kongresse/Marketing\nGesellschaft mit beschränkter Haftung\nKöln\n\nDen Gläubigern der an der Verschmelzung beteiligten Rechtsträger ist, wenn sie binnen sechs Monaten nach dem Tag, an dem die Eintragung der Verschmelzung in das Register des Sitzes desjenigen Rechtsträgers, dessen Gläubiger sie sind, nach § 19 Absatz 3 UmwG als bekanntgemacht gilt, ihren Anspruch nach Grund und Höhe schriftlich anmelden, Sicherheit zu leisten, soweit sie nicht Befriedigung verlangen können. Dieses Recht steht den Gläubigern jedoch nur zu, wenn sie glaubhaft machen, dass durch die Verschmelzung die Erfüllung ihrer Forderung gefährdet wird."
    },
    {
      "date": "2025-07-30",
      "id": "118365",
      "original_text": "Registerbekanntmachung nach dem Umwandlungsgesetz\nNordrhein-Westfalen Amtsgericht Steinfurt HRB 6978\nSANIMED GmbH – Ibbenbüren",
      "type": "Registerbekanntmachung nach dem Umwandlungsgesetz",
      "state": "Nordrhein-Westfalen",
      "amtsgericht": "Amtsgericht Steinfurt",
      "registernummer": "HRB 6978",
      "registerart": "HRB",
      "company_name": "SANIMED GmbH",
      "company_seat": "Ibbenbüren",
      "details": "30.07.2025 (Bekanntmachungsdatum)\n\nNordrhein-Westfalen Amtsgericht Steinfurt HRB 6978\nRegisterbekanntmachung nach dem Umwandlungsgesetz 30.07.2025 (Eintragungsdatum)\n\nSANIMED GmbH\nGesellschaft mit beschränkter Haftung\nIbbenbüren\n\nDen Gläubigern der an der Verschmelzung beteiligten Rechtsträger ist, wenn sie binnen sechs Monaten nach dem Tag, an dem die Eintragung der Verschmelzung in das Register des Sitzes derjenigen Rechtsträger deren Gläubiger sie sind, nach § 19 Absatz 3 UmwG als bekanntgemacht gilt, ihren Anspruch nach Grund und Höhe schriftlich anmelden, Sicherheit zu leisten, soweit sie nicht Befriedigung verlangen können. Dieses Recht steht den Gläubigern jedoch nur zu, wenn sie glaubhaft machen, dass durch die Verschmelzung die Erfüllung ihrer Forderung gefährdet wird."
    },
    {
      "date": "2025-07-30",
      "id": "118366",
      "original_text": "Registerbekanntmachung nach dem Umwandlungsgesetz\nNordrhein-Westfalen Amtsgericht Münster HRA 12050\nLandhaus Eggert GmbH & Co. KG – Münster",
      "type": "Registerbekanntmachung nach dem Umwandlungsgesetz",
      "state": "Nordrhein-Westfalen",
      "amtsgericht": "Amtsgericht Münster",
      "registernummer": "HRA 12050",
      "registerart": "HRA",
      "company_name": "Landhaus Eggert GmbH & Co. KG",
      "company_seat": "Münster",
      "details": "30.07.2025 (Bekanntmachungsdatum)\n\nNordrhein-Westfalen Amtsgericht Münster HRA 12050\nRegisterbekanntmachung nach dem Umwandlungsgesetz 30.07.2025 (Eintragungsdatum)\n\nLandhaus Eggert GmbH & Co. KG\nKommanditgesellschaft\nMünster\n\nDen Gläubigern der an der Ausgliederung beteiligten Rechtsträger ist, wenn sie binnen sechs Monaten nach dem Tag, an dem die Eintragung der Ausgliederung in das Register des Sitzes desjenigen Rechtsträgers, dessen Gläubiger sie sind, nach § 19 Absatz 3 UmwG als bekanntgemacht gilt, ihren Anspruch nach Grund und Höhe schriftlich anmelden, Sicherheit zu leisten, soweit sie nicht Befriedigung verlangen können. Dieses Recht steht den Gläubigern jedoch nur zu, wenn sie glaubhaft machen, dass durch die Ausgliederung die Erfüllung ihrer Forderung gefährdet wird."
    },
    {
      "date": "2025-07-30",
      "id": "118367",
      "original_text": "Registerbekanntmachung nach dem Umwandlungsgesetz\nNordrhein-Westfalen Amtsgericht Köln HRB 65255\nINTERCOM Düsseldorf GmbH – Köln",
      "type": "Registerbekanntmachung nach dem Umwandlungsgesetz",
      "state": "Nordrhein-Westfalen",
      "amtsgericht": "Amtsgericht Köln",
      "registernummer": "HRB 65255",
      "registerart": "HRB",
      "company_name": "INTERCOM Düsseldorf GmbH",
      "company_seat": "Köln",
      "details": "30.07.2025 (Bekanntmachungsdatum)\n\nNordrhein-Westfalen Amtsgericht Köln HRB 65255\nRegisterbekanntmachung nach dem Umwandlungsgesetz 30.07.2025 (Eintragungsdatum)\n\nINTERCOM Düsseldorf GmbH\nGesellschaft mit beschränkter Haftung\nKöln\n\nDen Gläubigern der an der Verschmelzung beteiligten Rechtsträger ist, wenn sie binnen sechs Monaten nach dem Tag, an dem die Eintragung der Verschmelzung in das Register des Sitzes desjenigen Rechtsträgers, dessen Gläubiger sie sind, nach § 19 Absatz 3 UmwG als bekanntgemacht gilt, ihren Anspruch nach Grund und Höhe schriftlich anmelden, Sicherheit zu leisten, soweit sie nicht Befriedigung verlangen können. Dieses Recht steht den Gläubigern jedoch nur zu, wenn sie glaubhaft machen, dass durch die Verschmelzung die Erfüllung ihrer Forderung gefährdet wird."
    },
    {
      "date": "2025-07-30",
      "id": "118368",
      "original_text": "Registerbekanntmachung nach dem Umwandlungsgesetz\nNordrhein-Westfalen Amtsgericht Düsseldorf HRB 91304\nPflege Gambers GmbH – Langenfeld",
      "type": "Registerbekanntmachung nach dem Umwandlungsgesetz",
      "state": "Nordrhein-Westfalen",
      "amtsgericht": "Amtsgericht Düsseldorf",
      "registernummer": "HRB 91304",
      "registerart": "HRB",
      "company_name": "Pflege Gambers GmbH",
      "company_seat": "Langenfeld",
      "details": "30.07.2025 (Bekanntmachungsdatum)\n\nNordrhein-Westfalen Amtsgericht Düsseldorf HRB 91304\nRegisterbekanntmachung nach dem Umwandlungsgesetz 30.07.2025 (Eintragungsdatum)\n\nPflege Gambers GmbH\nGesellschaft mit beschränkter Haftung\nLangenfeld\n\nDen Gläubigern der an der Verschmelzung beteiligten Rechtsträger ist, wenn sie binnen sechs Monaten nach dem Tag, an dem die Eintragung der Verschmelzung in das Register des Sitzes desjenigen Rechtsträgers, dessen Gläubiger sie sind, nach § 19 Absatz 3 UmwG als bekanntgemacht gilt, ihren Anspruch nach Grund und Höhe schriftlich anmelden, Sicherheit zu leisten, soweit sie nicht Befriedigung verlangen können. Dieses Recht steht den Gläubigern jedoch nur zu, wenn sie glaubhaft machen, dass durch die Verschmelzung die Erfüllung ihrer Forderung gefährdet wird."
    },
    {
      "date": "2025-07-30",
      "id": "118369",
      "original_text": "Löschungsankündigung\nNordrhein-Westfalen Amtsgericht Duisburg HRA 8036\nConcordia Bau und Boden AG & Co. Objekt Berlin, Alte Jakobstraße KG – Oberhausen",
      "type": "Löschungsankündigung",
      "state": "Nordrhein-Westfalen",
      "amtsgericht": "Amtsgericht Duisburg",
      "registernummer": "HRA 8036",
      "registerart": "HRA",
      "company_name": "Concordia Bau und Boden AG & Co. Objekt Berlin, Alte Jakobstraße KG",
      "company_seat": "Oberhausen",
      "details": "30.07.2025 (Bekanntmachungsdatum)\n\nNordrhein-Westfalen Amtsgericht Duisburg HRA 8036\nLöschungsankündigung\n\nConcordia Bau und Boden AG & Co. Objekt Berlin, Alte Jakobstraße KG\nKommanditgesellschaft\nOberhausen\n\nAmtsgericht Duisburg\nHRA 8036\nConcordia Bau und Boden AG & Co. Objekt Berlin, Alte Jakobstraße KG\ndie bei dem Amtsgericht Duisburg unter HRA  8036 eingetragene Firma Concordia Bau und Boden AG & Co. Objekt Berlin, Alte Jakobstraße KG soll von Amts wegen gemäß § 31 Absatz 2, 6 HGB, § 393 FamFG gelöscht werden.\nHiergegen ist der Widerspruch binnen drei Monaten seit Zustellung zulässig. Geht innerhalb dieser Frist kein Widerspruch ein, wird die Firma gelöscht werden.\n\nRechtsbehelfsbelehrung\nGegen diese Verfügung können Sie Widerspruch einlegen.\n\nDer Widerspruch ist bei dem Amtsgericht Duisburg, Registergericht, Kardinal-Galen-Straße 124-132, 47058 Duisburg, schriftlich einzulegen. Der Widerspruch kann auch zur Niederschrift der Geschäftsstelle eines jeden Amtsgerichts abgegeben werden.\n\nDer Widerspruch muss spätestens innerhalb der gesetzten Frist nach der schriftlichen Bekanntgabe der Verfügung bei dem Amtsgericht eingegangen sein. Dies gilt auch dann, wenn der Widerspruch zur Niederschrift der Geschäftsstelle eines anderen Amtsgerichtes abgegeben wurde.\nDie Frist beginnt mit der schriftlichen Bekanntgabe der Verfügung.\n\nDer Widerspruch muss die Bezeichnung der angefochtenen Verfügung sowie die Erklärung enthalten, dass Widerspruch gegen diese Verfügung eingelegt wird. Er ist zu unterzeichnen und soll begründet werden.\n\nDie Einlegung ist auch durch Übertragung eines elektronischen Dokuments an die elektronische Poststelle des Gerichts möglich. Das elektronische Dokument muss für die Bearbeitung durch das Gericht geeignet und mit einer qualifizierten elektronischen Signatur der verantwortenden Person versehen sein oder von der verantwortenden Person signiert und auf einem sicheren Übermittlungsweg gemäß § 130 a ZPO nach näherer Maßgabe der Verordnung über die technischen Rahmenbedingungen des elektronischen Rechtsverkehrs und über das besondere elektronische Behördenpostfach (BGBl. I, S. 3803) eingereicht werden. Weitere Informationen erhalten Sie auf der Internetseite www.justiz.de."
    },
    {
      "date": "2025-07-30",
      "id": "118370",
      "original_text": "Registerbekanntmachung nach dem Umwandlungsgesetz\nNordrhein-Westfalen Amtsgericht Bad Oeynhausen HRB 13496\nExklusives Küchendesign GmbH – Löhne",
      "type": "Registerbekanntmachung nach dem Umwandlungsgesetz",
      "state": "Nordrhein-Westfalen",
      "amtsgericht": "Amtsgericht Bad Oeynhausen",
      "registernummer": "HRB 13496",
      "registerart": "HRB",
      "company_name": "Exklusives Küchendesign GmbH",
      "company_seat": "Löhne",
      "details": "30.07.2025 (Bekanntmachungsdatum)\n\nNordrhein-Westfalen Amtsgericht Bad Oeynhausen HRB 13496\nRegisterbekanntmachung nach dem Umwandlungsgesetz 30.07.2025 (Eintragungsdatum)\n\nExklusives Küchendesign GmbH\nGesellschaft mit beschränkter Haftung\nLöhne\n\nDen Gläubigern der an der Verschmelzung beteiligten Rechtsträger ist, wenn sie binnen sechs Monaten nach dem Tag, an dem die Eintragung der Verschmelzung in das Register des Sitzes desjenigen Rechtsträgers, dessen Gläubiger sie sind, nach § 19 Absatz 3 UmwG als bekanntgemacht gilt, ihren Anspruch nach Grund und Höhe schriftlich anmelden, Sicherheit zu leisten, soweit sie nicht Befriedigung verlangen können. Dieses Recht steht den Gläubigern jedoch nur zu, wenn sie glaubhaft machen, dass durch die Verschmelzung die Erfüllung ihrer Forderung gefährdet wird."
    },
    {
      "date": "2025-07-30",
      "id": "118371",
      "original_text": "Registerbekanntmachung nach dem Umwandlungsgesetz\nNordrhein-Westfalen Amtsgericht Bochum HRA 7697\nUlrich Jenderny Garten- und Landschaftsbau OHG – Bochum",
      "type": "Registerbekanntmachung nach dem Umwandlungsgesetz",
      "state": "Nordrhein-Westfalen",
      "amtsgericht": "Amtsgericht Bochum",
      "registernummer": "HRA 7697",
      "registerart": "HRA",
      "company_name": "Ulrich Jenderny Garten- und Landschaftsbau OHG",
      "company_seat": "Bochum",
      "details": "30.07.2025 (Bekanntmachungsdatum)\n\nNordrhein-Westfalen Amtsgericht Bochum HRA 7697\nRegisterbekanntmachung nach dem Umwandlungsgesetz 28.07.2025 (Eintragungsdatum)\n\nUlrich Jenderny Garten- und Landschaftsbau OHG\nOffene Handelsgesellschaft\nBochum\n\nDen Gläubigern der an der Verschmelzung beteiligten Rechtsträger ist, wenn sie binnen sechs Monaten nach dem Tag, an dem die Eintragung der Verschmelzung in das Register des Sitzes desjenigen Rechtsträgers, dessen Gläubiger sie sind, nach § 19 Absatz 3 UmwG als bekanntgemacht gilt, ihren Anspruch nach Grund und Höhe schriftlich anmelden, Sicherheit zu leisten, soweit sie nicht Befriedigung verlangen können. Dieses Recht steht den Gläubigern jedoch nur zu, wenn sie glaubhaft machen, dass durch die Verschmelzung die Erfüllung ihrer Forderung gefährdet wird."
    },
    {
      "date": "2025-07-30",
      "id": "118372",
      "original_text": "Registerbekanntmachung nach dem Umwandlungsgesetz\nNordrhein-Westfalen Amtsgericht Wuppertal HRB 7003\nHIDREX GmbH – Heiligenhaus",
      "type": "Registerbekanntmachung nach dem Umwandlungsgesetz",
      "state": "Nordrhein-Westfalen",
      "amtsgericht": "Amtsgericht Wuppertal",
      "registernummer": "HRB 7003",
      "registerart": "HRB",
      "company_name": "HIDREX GmbH",
      "company_seat": "Heiligenhaus",
      "details": "30.07.2025 (Bekanntmachungsdatum)\n\nNordrhein-Westfalen Amtsgericht Wuppertal HRB 7003\nRegisterbekanntmachung nach dem Umwandlungsgesetz 30.07.2025 (Eintragungsdatum)\n\nHIDREX GmbH\nGesellschaft mit beschränkter Haftung\nHeiligenhaus\n\nDen Gläubigern der an der Verschmelzung beteiligten Rechtsträger ist, wenn sie binnen sechs Monaten nach dem Tag, an dem die Eintragung der Verschmelzung in das Register des Sitzes desjenigen Rechtsträgers, dessen Gläubiger sie sind, nach § 19 Absatz 3 UmwG als bekanntgemacht gilt, ihren Anspruch nach Grund und Höhe schriftlich anmelden, Sicherheit zu leisten, soweit sie nicht Befriedigung verlangen können. Dieses Recht steht den Gläubigern jedoch nur zu, wenn sie glaubhaft machen, dass durch die Verschmelzung die Erfüllung ihrer Forderung gefährdet wird."
    },
    {
      "date": "2025-07-30",
      "id": "118373",
      "original_text": "Registerbekanntmachung nach dem Umwandlungsgesetz\nNordrhein-Westfalen Amtsgericht Köln HRB 120396\ntalentsconnect operations GmbH – Köln",
      "type": "Registerbekanntmachung nach dem Umwandlungsgesetz",
      "state": "Nordrhein-Westfalen",
      "amtsgericht": "Amtsgericht Köln",
      "registernummer": "HRB 120396",
      "registerart": "HRB",
      "company_name": "talentsconnect operations GmbH",
      "company_seat": "Köln",
      "details": "30.07.2025 (Bekanntmachungsdatum)\n\nNordrhein-Westfalen Amtsgericht Köln HRB 120396\nRegisterbekanntmachung nach dem Umwandlungsgesetz 30.07.2025 (Eintragungsdatum)\n\ntalentsconnect operations GmbH\nGesellschaft mit beschränkter Haftung\nKöln\n\nDen Gläubigern der an der Ausgliederung beteiligten Rechtsträger ist, wenn sie binnen sechs Monaten nach dem Tag, an dem die Eintragung der Ausgliederung in das Register des Sitzes desjenigen Rechtsträgers, dessen Gläubiger sie sind, nach § 19 Absatz 3 UmwG als bekanntgemacht gilt, ihren Anspruch nach Grund und Höhe schriftlich anmelden, Sicherheit zu leisten, soweit sie nicht Befriedigung verlangen können. Dieses Recht steht den Gläubigern jedoch nur zu, wenn sie glaubhaft machen, dass durch die Ausgliederung die Erfüllung ihrer Forderung gefährdet wird."
    },
    {
      "date": "2025-07-30",
      "id": "118374",
      "original_text": "Registerbekanntmachung nach dem Umwandlungsgesetz\nNordrhein-Westfalen Amtsgericht Köln HRB 35380\nAZ Augenchirurgische Zentren AG – Köln",
      "type": "Registerbekanntmachung nach dem Umwandlungsgesetz",
      "state": "Nordrhein-Westfalen",
      "amtsgericht": "Amtsgericht Köln",
      "registernummer": "HRB 35380",
      "registerart": "HRB",
      "company_name": "AZ Augenchirurgische Zentren AG",
      "company_seat": "Köln",
      "details": "30.07.2025 (Bekanntmachungsdatum)\n\nNordrhein-Westfalen Amtsgericht Köln HRB 35380\nRegisterbekanntmachung nach dem Umwandlungsgesetz\n\nAZ Augenchirurgische Zentren AG\nAktiengesellschaft\nKöln\n\nDem Registergericht ist der Entwurf eines Vertrages über die geplante Verschmelzung der AZ Augenchirugische Zentren AG mit der ARTEMIS MVZ Köln GmbH mit Sitz in Köln (Amtsgericht Köln, HRB 95953) eingereicht worden."
    },
    {
      "date": "2025-07-30",
      "id": "118375",
      "original_text": "Einreichung neuer Dokumente\nNordrhein-Westfalen Amtsgericht Bochum HRB 22058\nTiemeyer Holding SE – Bochum",
      "type": "Einreichung neuer Dokumente",
      "state": "Nordrhein-Westfalen",
      "amtsgericht": "Amtsgericht Bochum",
      "registernummer": "HRB 22058",
      "registerart": "HRB",
      "company_name": "Tiemeyer Holding SE",
      "company_seat": "Bochum",
      "details": "30.07.2025 (Bekanntmachungsdatum)\n\nNordrhein-Westfalen Amtsgericht Bochum HRB 22058\nEinreichung neuer Dokumente 30.07.2025 (Eintragungsdatum)\n\nTiemeyer Holding SE\nEuropäische Aktiengesellschaft (SE)\nBochum\n\nDem Registergericht ist eine neue Liste der Mitglieder des Aufsichtsrates eingereicht worden."
    },
    {
      "date": "2025-07-30",
      "id": "118376",
      "original_text": "Registerbekanntmachung nach dem Umwandlungsgesetz\nNordrhein-Westfalen Amtsgericht Münster HRB 18421\nFinne Gastro UG (haftungsbeschränkt) – Münster",
      "type": "Registerbekanntmachung nach dem Umwandlungsgesetz",
      "state": "Nordrhein-Westfalen",
      "amtsgericht": "Amtsgericht Münster",
      "registernummer": "HRB 18421",
      "registerart": "HRB",
      "company_name": "Finne Gastro UG (haftungsbeschränkt)",
      "company_seat": "Münster",
      "details": "30.07.2025 (Bekanntmachungsdatum)\n\nNordrhein-Westfalen Amtsgericht Münster HRB 18421\nRegisterbekanntmachung nach dem Umwandlungsgesetz 30.07.2025 (Eintragungsdatum)\n\nFinne Gastro UG (haftungsbeschränkt)\nGesellschaft mit beschränkter Haftung\nMünster\n\nDen Gläubigern der an der Verschmelzung beteiligten Rechtsträger ist, wenn sie binnen sechs Monaten nach dem Tag, an dem die Eintragung der Verschmelzung in das Register des Sitzes desjenigen Rechtsträgers, dessen Gläubiger sie sind, nach § 19 Absatz 3 UmwG als bekanntgemacht gilt, ihren Anspruch nach Grund und Höhe schriftlich anmelden, Sicherheit zu leisten, soweit sie nicht Befriedigung verlangen können. Dieses Recht steht den Gläubigern jedoch nur zu, wenn sie glaubhaft machen, dass durch die Verschmelzung die Erfüllung ihrer Forderung gefährdet wird."
    },
    {
      "date": "2025-07-30",
      "id": "118377",
      "original_text": "Registerbekanntmachung nach dem Umwandlungsgesetz\nNordrhein-Westfalen Amtsgericht Essen HRB 28700\nP.A.C. alpha GmbH – Essen",
      "type": "Registerbekanntmachung nach dem Umwandlungsgesetz",
      "state": "Nordrhein-Westfalen",
      "amtsgericht": "Amtsgericht Essen",
      "registernummer": "HRB 28700",
      "registerart": "HRB",
      "company_name": "P.A.C. alpha GmbH",
      "company_seat": "Essen",
      "details": "30.07.2025 (Bekanntmachungsdatum)\n\nNordrhein-Westfalen Amtsgericht Essen HRB 28700\nRegisterbekanntmachung nach dem Umwandlungsgesetz 30.07.2025 (Eintragungsdatum)\n\nP.A.C. alpha GmbH\nGesellschaft mit beschränkter Haftung\nEssen\n\nDen Gläubigern der an der Verschmelzung beteiligten Rechtsträger ist, wenn sie binnen sechs Monaten nach dem Tag, an dem die Eintragung der Verschmelzung in das Register des Sitzes desjenigen Rechtsträgers, dessen Gläubiger sie sind, nach § 19 Absatz 3 UmwG als bekanntgemacht gilt, ihren Anspruch nach Grund und Höhe schriftlich anmelden, Sicherheit zu leisten, soweit sie nicht Befriedigung verlangen können. Dieses Recht steht den Gläubigern jedoch nur zu, wenn sie glaubhaft machen, dass durch die Verschmelzung die Erfüllung ihrer Forderung gefährdet wird."
    },
    {
      "date": "2025-07-30",
      "id": "118378",
      "original_text": "Registerbekanntmachung nach dem Umwandlungsgesetz\nNordrhein-Westfalen Amtsgericht Hamm HRB 2915\nROWICOM GmbH – Hamm",
      "type": "Registerbekanntmachung nach dem Umwandlungsgesetz",
      "state": "Nordrhein-Westfalen",
      "amtsgericht": "Amtsgericht Hamm",
      "registernummer": "HRB 2915",
      "registerart": "HRB",
      "company_name": "ROWICOM GmbH",
      "company_seat": "Hamm",
      "details": "30.07.2025 (Bekanntmachungsdatum)\n\nNordrhein-Westfalen Amtsgericht Hamm HRB 2915\nRegisterbekanntmachung nach dem Umwandlungsgesetz 30.07.2025 (Eintragungsdatum)\n\nROWICOM GmbH\nGesellschaft mit beschränkter Haftung\nHamm\n\nDen Gläubigern der an der Verschmelzung beteiligten Rechtsträger ist, wenn sie binnen sechs Monaten nach dem Tag, an dem die Eintragung der Verschmelzung in das Register des Sitzes derjenigen Rechtsträger deren Gläubiger sie sind, nach § 19 Absatz 3 UmwG als bekanntgemacht gilt, ihren Anspruch nach Grund und Höhe schriftlich anmelden, Sicherheit zu leisten, soweit sie nicht Befriedigung verlangen können. Dieses Recht steht den Gläubigern jedoch nur zu, wenn sie glaubhaft machen, dass durch die Verschmelzung die Erfüllung ihrer Forderung gefährdet wird."
    },
    {
      "date": "2025-07-30",
      "id": "118379",
      "original_text": "Registerbekanntmachung nach dem Umwandlungsgesetz\nNordrhein-Westfalen Amtsgericht Essen HRB 28956\nKlärschlammverwertung Herne Julia GmbH – Essen",
      "type": "Registerbekanntmachung nach dem Umwandlungsgesetz",
      "state": "Nordrhein-Westfalen",
      "amtsgericht": "Amtsgericht Essen",
      "registernummer": "HRB 28956",
      "registerart": "HRB",
      "company_name": "Klärschlammverwertung Herne Julia GmbH",
      "company_seat": "Essen",
      "details": "30.07.2025 (Bekanntmachungsdatum)\n\nNordrhein-Westfalen Amtsgericht Essen HRB 28956\nRegisterbekanntmachung nach dem Umwandlungsgesetz 30.07.2025 (Eintragungsdatum)\n\nKlärschlammverwertung Herne Julia GmbH\nGesellschaft mit beschränkter Haftung\nEssen\n\nDen Gläubigern der an der Verschmelzung beteiligten Rechtsträger ist, wenn sie binnen sechs Monaten nach dem Tag, an dem die Eintragung der Verschmelzung in das Register des Sitzes desjenigen Rechtsträgers, dessen Gläubiger sie sind, nach § 19 Absatz 3 UmwG als bekanntgemacht gilt, ihren Anspruch nach Grund und Höhe schriftlich anmelden, Sicherheit zu leisten, soweit sie nicht Befriedigung verlangen können. Dieses Recht steht den Gläubigern jedoch nur zu, wenn sie glaubhaft machen, dass durch die Verschmelzung die Erfüllung ihrer Forderung gefährdet wird."
    },
    {
      "date": "2025-07-30",
      "id": "118380",
      "original_text": "Löschungsankündigung\nNordrhein-Westfalen Amtsgericht Duisburg HRB 32668\nGOLIATH Solutions GmbH – Oberhausen",
      "type": "Löschungsankündigung",
      "state": "Nordrhein-Westfalen",
      "amtsgericht": "Amtsgericht Duisburg",
      "registernummer": "HRB 32668",
      "registerart": "HRB",
      "company_name": "GOLIATH Solutions GmbH",
      "company_seat": "Oberhausen",
      "details": "30.07.2025 (Bekanntmachungsdatum)\n\nNordrhein-Westfalen Amtsgericht Duisburg HRB 32668\nLöschungsankündigung\n\nGOLIATH Solutions GmbH\nGesellschaft mit beschränkter Haftung\nOberhausen\n\nAmtsgericht Duisburg\nHRB 32668\nGOLIATH Solutions GmbH in Oberhausen\nDas Registergericht beabsichtigt, die im Handelsregister des Amtsgerichts Duisburg eingetragene Gesellschaft gemäß § 394 Absatz 1 FamFG wegen Vermögenslosigkeit von Amts wegen zu löschen. Gegen diese Verfügung kann Widerspruch eingelegt werden. Die Frist zur Erhebung eines Widerspruchs gegen die beabsichtigte Löschung von Amts wegen ist auf drei Monate festgesetzt. Rechtsbehelfsbelehrung Der Widerspruch ist bei dem Amtsgericht Duisburg, Kardinal-Galen-Str. 124-132, 47058 Duisburg schriftlich in deutscher Sprache oder zur Niederschrift der Geschäftsstelle einzulegen. Der Widerspruch kann auch zur Niederschrift der Geschäftsstelle eines jeden Amtsgerichtes abgegeben werden. Die Einlegung ist auch durch Übertragung eines elektronischen Dokuments an die elektronische Poststelle des Gerichts möglich. Das elektronische Dokument muss für die Bearbeitung durch das Gericht geeignet und mit einer qualifizierten elektronischen Signatur der verantwortenden Person versehen sein oder von der verantwortenden Person signiert und auf einem sicheren Übermittlungsweg gemäß § 130 a ZPO nach näherer Maßgabe der Verordnung über die technischen Rahmenbedingungen des elektronischen Rechtsverkehrs und über das besondere elektronische Behördenpostfach (BGBl. I, S. 3803) eingereicht werden. Weitere Informationen erhalten Sie auf der Internetseite www.justiz.de <http://www.justiz.de>. Der Widerspruch muss spätestens innerhalb der gesetzten Frist bei dem Amtsgericht Duisburg eingegangen sein. Dies gilt auch dann, wenn der Widerspruch zur Niederschrift der Geschäftsstelle eines anderen Amtsgerichtes abgegeben wurde. Die Frist beginnt mit der Veröffentlichung. Fällt das Ende der Frist auf einen Sonntag, einen allgemeinen Feiertag oder Sonnabend, so endet die Frist mit Ablauf des nächsten Werktages. Der Widerspruch muss die Bezeichnung der angefochtenen Verfügung sowie die Erklärung enthalten, dass Widerspruch gegen diese Verfügung eingelegt wird. Er ist zu unterzeichnen und soll begründet werden."
    },
    {
      "date": "2025-07-30",
      "id": "118381",
      "original_text": "Registerbekanntmachung nach dem Umwandlungsgesetz\nNordrhein-Westfalen Amtsgericht Neuss HRB 22961\nAcubat GmbH – Korschenbroich",
      "type": "Registerbekanntmachung nach dem Umwandlungsgesetz",
      "state": "Nordrhein-Westfalen",
      "amtsgericht": "Amtsgericht Neuss",
      "registernummer": "HRB 22961",
      "registerart": "HRB",
      "company_name": "Acubat GmbH",
      "company_seat": "Korschenbroich",
      "details": "30.07.2025 (Bekanntmachungsdatum)\n\nNordrhein-Westfalen Amtsgericht Neuss HRB 22961\nRegisterbekanntmachung nach dem Umwandlungsgesetz 30.07.2025 (Eintragungsdatum)\n\nAcubat GmbH\nGesellschaft mit beschränkter Haftung\nKorschenbroich\n\nDen Gläubigern der an der Verschmelzung beteiligten Rechtsträger ist, wenn sie binnen sechs Monaten nach dem Tag, an dem die Eintragung der Verschmelzung in das Register des Sitzes desjenigen Rechtsträgers, dessen Gläubiger sie sind, nach § 19 Absatz 3 UmwG als bekanntgemacht gilt, ihren Anspruch nach Grund und Höhe schriftlich anmelden, Sicherheit zu leisten, soweit sie nicht Befriedigung verlangen können. Dieses Recht steht den Gläubigern jedoch nur zu, wenn sie glaubhaft machen, dass durch die Verschmelzung die Erfüllung ihrer Forderung gefährdet wird."
    },
    {
      "date": "2025-07-30",
      "id": "118382",
      "original_text": "Löschungsankündigung\nNordrhein-Westfalen Amtsgericht Düsseldorf HRB 76931\nMy Carrara GmbH – Düsseldorf",
      "type": "Löschungsankündigung",
      "state": "Nordrhein-Westfalen",
      "amtsgericht": "Amtsgericht Düsseldorf",
      "registernummer": "HRB 76931",
      "registerart": "HRB",
      "company_name": "My Carrara GmbH",
      "company_seat": "Düsseldorf",
      "details": "30.07.2025 (Bekanntmachungsdatum)\n\nNordrhein-Westfalen Amtsgericht Düsseldorf HRB 76931\nLöschungsankündigung\n\nMy Carrara GmbH\nGesellschaft mit beschränkter Haftung\nDüsseldorf\n\nDas Registergericht beabsichtigt die Gesellschaft von Amts wegen nach § 394 FamFG zu löschen. Die Frist zur Erhebung eines Widerspruchs ist auf 3 Wochen festgesetzt.\n\nRechtsbehelfsbelehrung:\nDas Widerspruchsrecht steht jedem zu, der an der Unterlassung der Löschung ein berechtigtes Interesse hat. Der Widerspruch ist bei dem Amtsgericht Düsseldorf -Registergericht-, Werdener Straße 1, 40227 Düsseldorf schriftlich in deutscher Sprache oder zur Niederschrift der Geschäftsstelle einzulegen. Der Widerspruch kann auch zur Niederschrift der Geschäftsstelle eines jeden Amtsgerichtes abgegeben werden. Die Einlegung ist auch durch Übertragung eines elektronischen Dokuments an die elektronische Poststelle des Gerichts möglich. Das elektronische Dokument muss für die Bearbeitung durch das Gericht geeignet und mit einer qualifizierten elektronischen Signatur der verantwortenden Person versehen sein oder von der verantwortenden Person signiert und auf einem sicheren Übermittlungsweg gemäß § 130a ZPO nach näherer Maßgabe der Verordnung über die technischen Rahmenbedingungen des elektronischen Rechtsverkehrs und über das besondere elektronische Behördenpostfach (BGBl. I, S.3803) eingereicht werden. Weitere Informationen erhalten Sie auf der Internetseite www.justiz.de.\nDer Widerspruch muss spätestens innerhalb der gesetzten Frist nach dem Datum der Bekanntmachung der Löschungsankündigung bei dem Amtsgericht - Registergericht - Düsseldorf eingegangen sein.  Dies gilt auch dann, wenn der Widerspruch zur Niederschrift der Geschäftsstelle eines anderen Amtsgerichtes abgegeben wurde. Die Frist beginnt mit dem Tage der Bekanntmachung der Löschungsankündigung in dem für die Bekanntmachung der Eintragungen in das Handelsregister bestimmten elektronischen Informations- und Kommunikationssystem nach § 10 des Handelsgesetzbuches. Fällt das Ende der Frist auf einen Sonntag, einen allgemeinen Feiertag oder Sonnabend, so endet die Frist mit Ablauf des nächsten Werktages.\nDer Widerspruch muss die Bezeichnung der angefochtenen Löschungsankündigung sowie die Erklärung enthalten, dass Widerspruch gegen diese Löschungsankündigung eingelegt wird. Er ist zu unterzeichnen und soll begründet werden."
    },
    {
      "date": "2025-07-30",
      "id": "118383",
      "original_text": "Registerbekanntmachung nach dem Umwandlungsgesetz\nNordrhein-Westfalen Amtsgericht Münster HRB 5912\nInformationsfabrik GmbH – Münster",
      "type": "Registerbekanntmachung nach dem Umwandlungsgesetz",
      "state": "Nordrhein-Westfalen",
      "amtsgericht": "Amtsgericht Münster",
      "registernummer": "HRB 5912",
      "registerart": "HRB",
      "company_name": "Informationsfabrik GmbH",
      "company_seat": "Münster",
      "details": "30.07.2025 (Bekanntmachungsdatum)\n\nNordrhein-Westfalen Amtsgericht Münster HRB 5912\nRegisterbekanntmachung nach dem Umwandlungsgesetz 30.07.2025 (Eintragungsdatum)\n\nInformationsfabrik GmbH\nGesellschaft mit beschränkter Haftung\nMünster\n\nDen Gläubigern der an der Verschmelzung beteiligten Rechtsträger ist, wenn sie binnen sechs Monaten nach dem Tag, an dem die Eintragung der Verschmelzung in das Register des Sitzes desjenigen Rechtsträgers, dessen Gläubiger sie sind, nach § 19 Absatz 3 UmwG als bekanntgemacht gilt, ihren Anspruch nach Grund und Höhe schriftlich anmelden, Sicherheit zu leisten, soweit sie nicht Befriedigung verlangen können. Dieses Recht steht den Gläubigern jedoch nur zu, wenn sie glaubhaft machen, dass durch die Verschmelzung die Erfüllung ihrer Forderung gefährdet wird."
    },
    {
      "date": "2025-07-30",
      "id": "118384",
      "original_text": "Registerbekanntmachung nach dem Umwandlungsgesetz\nNordrhein-Westfalen Amtsgericht Münster HRA 3639\nLandhaus Eggert e.K. – Münster",
      "type": "Registerbekanntmachung nach dem Umwandlungsgesetz",
      "state": "Nordrhein-Westfalen",
      "amtsgericht": "Amtsgericht Münster",
      "registernummer": "HRA 3639",
      "registerart": "HRA",
      "company_name": "Landhaus Eggert e.K.",
      "company_seat": "Münster",
      "details": "30.07.2025 (Bekanntmachungsdatum)\n\nNordrhein-Westfalen Amtsgericht Münster HRA 3639\nRegisterbekanntmachung nach dem Umwandlungsgesetz 30.07.2025 (Eintragungsdatum)\n\nLandhaus Eggert e.K.\nEinzelkaufmann / Einzelkauffrau\nMünster\n\nDen Gläubigern der an der Ausgliederung beteiligten Rechtsträger ist, wenn sie binnen sechs Monaten nach dem Tag, an dem die Eintragung der Ausgliederung in das Register des Sitzes desjenigen Rechtsträgers, dessen Gläubiger sie sind, nach § 19 Absatz 3 UmwG als bekanntgemacht gilt, ihren Anspruch nach Grund und Höhe schriftlich anmelden, Sicherheit zu leisten, soweit sie nicht Befriedigung verlangen können. Dieses Recht steht den Gläubigern jedoch nur zu, wenn sie glaubhaft machen, dass durch die Ausgliederung die Erfüllung ihrer Forderung gefährdet wird."
    },
    {
      "date": "2025-07-30",
      "id": "118385",
      "original_text": "Einreichung neuer Dokumente\nNordrhein-Westfalen Amtsgericht Siegburg HRB 7108\nBAMAKA Aktiengesellschaft - Einkaufsgesellschaft der Bauwirtschaft – Bad Honnef",
      "type": "Einreichung neuer Dokumente",
      "state": "Nordrhein-Westfalen",
      "amtsgericht": "Amtsgericht Siegburg",
      "registernummer": "HRB 7108",
      "registerart": "HRB",
      "company_name": "BAMAKA Aktiengesellschaft - Einkaufsgesellschaft der Bauwirtschaft",
      "company_seat": "Bad Honnef",
      "details": "30.07.2025 (Bekanntmachungsdatum)\n\nNordrhein-Westfalen Amtsgericht Siegburg HRB 7108\nEinreichung neuer Dokumente\n\nBAMAKA Aktiengesellschaft - Einkaufsgesellschaft der Bauwirtschaft\nAktiengesellschaft\nBad Honnef\n\nDem Registergericht ist eine neue Liste der Mitglieder des Aufsichtsrates eingereicht worden."
    },
    {
      "date": "2025-07-30",
      "id": "118386",
      "original_text": "Sonstige Registerbekanntmachung\nNordrhein-Westfalen Amtsgericht Hamm HRA 1478\nVerlag Liboriusblatt GmbH & Co. Kommanditgesellschaft – Hamm",
      "type": "Sonstige Registerbekanntmachung",
      "state": "Nordrhein-Westfalen",
      "amtsgericht": "Amtsgericht Hamm",
      "registernummer": "HRA 1478",
      "registerart": "HRA",
      "company_name": "Verlag Liboriusblatt GmbH & Co. Kommanditgesellschaft",
      "company_seat": "Hamm",
      "details": "30.07.2025 (Bekanntmachungsdatum)\n\nNordrhein-Westfalen Amtsgericht Hamm HRA 1478\nSonstige Registerbekanntmachung 30.07.2025 (Eintragungsdatum)\n\nVerlag Liboriusblatt GmbH & Co. Kommanditgesellschaft\nKommanditgesellschaft\nHamm\n\nDen Gläubigern der an der Verschmelzung beteiligten Rechtsträger ist, wenn sie binnen sechs Monaten nach dem Tag, an dem die Eintragung der Verschmelzung in das Register des Sitzes derjenigen Rechtsträger deren Gläubiger sie sind, nach § 19 Absatz 3 UmwG als bekanntgemacht gilt, ihren Anspruch nach Grund und Höhe schriftlich anmelden, Sicherheit zu leisten, soweit sie nicht Befriedigung verlangen können. Dieses Recht steht den Gläubigern jedoch nur zu, wenn sie glaubhaft machen, dass durch die Verschmelzung die Erfüllung ihrer Forderung gefährdet wird."
    },
    {
      "date": "2025-07-30",
      "id": "118387",
      "original_text": "Registerbekanntmachung nach dem Umwandlungsgesetz\nNordrhein-Westfalen Amtsgericht Bad Oeynhausen HRB 14269\nKüchendesign Münster GmbH – Löhne",
      "type": "Registerbekanntmachung nach dem Umwandlungsgesetz",
      "state": "Nordrhein-Westfalen",
      "amtsgericht": "Amtsgericht Bad Oeynhausen",
      "registernummer": "HRB 14269",
      "registerart": "HRB",
      "company_name": "Küchendesign Münster GmbH",
      "company_seat": "Löhne",
      "details": "30.07.2025 (Bekanntmachungsdatum)\n\nNordrhein-Westfalen Amtsgericht Bad Oeynhausen HRB 14269\nRegisterbekanntmachung nach dem Umwandlungsgesetz 30.07.2025 (Eintragungsdatum)\n\nKüchendesign Münster GmbH\nGesellschaft mit beschränkter Haftung\nLöhne\n\nDen Gläubigern der an der Verschmelzung beteiligten Rechtsträger ist, wenn sie binnen sechs Monaten nach dem Tag, an dem die Eintragung der Verschmelzung in das Register des Sitzes desjenigen Rechtsträgers, dessen Gläubiger sie sind, nach § 19 Absatz 3 UmwG als bekanntgemacht gilt, ihren Anspruch nach Grund und Höhe schriftlich anmelden, Sicherheit zu leisten, soweit sie nicht Befriedigung verlangen können. Dieses Recht steht den Gläubigern jedoch nur zu, wenn sie glaubhaft machen, dass durch die Verschmelzung die Erfüllung ihrer Forderung gefährdet wird."
    },
    {
      "date": "2025-07-30",
      "id": "118388",
      "original_text": "Registerbekanntmachung nach dem Umwandlungsgesetz\nNordrhein-Westfalen Amtsgericht Münster HRB 16053\nMünsteraner Finne GmbH – Münster",
      "type": "Registerbekanntmachung nach dem Umwandlungsgesetz",
      "state": "Nordrhein-Westfalen",
      "amtsgericht": "Amtsgericht Münster",
      "registernummer": "HRB 16053",
      "registerart": "HRB",
      "company_name": "Münsteraner Finne GmbH",
      "company_seat": "Münster",
      "details": "30.07.2025 (Bekanntmachungsdatum)\n\nNordrhein-Westfalen Amtsgericht Münster HRB 16053\nRegisterbekanntmachung nach dem Umwandlungsgesetz 30.07.2025 (Eintragungsdatum)\n\nMünsteraner Finne GmbH\nGesellschaft mit beschränkter Haftung\nMünster\n\nDen Gläubigern der an der Verschmelzung beteiligten Rechtsträger ist, wenn sie binnen sechs Monaten nach dem Tag, an dem die Eintragung der Verschmelzung in das Register des Sitzes desjenigen Rechtsträgers, dessen Gläubiger sie sind, nach § 19 Absatz 3 UmwG als bekanntgemacht gilt, ihren Anspruch nach Grund und Höhe schriftlich anmelden, Sicherheit zu leisten, soweit sie nicht Befriedigung verlangen können. Dieses Recht steht den Gläubigern jedoch nur zu, wenn sie glaubhaft machen, dass durch die Verschmelzung die Erfüllung ihrer Forderung gefährdet wird."
    },
    {
      "date": "2025-07-30",
      "id": "118389",
      "original_text": "Registerbekanntmachung nach dem Umwandlungsgesetz\nHessen Amtsgericht Kassel HRA 18311\nUgljesa Dachdeckermeister e.K. – Kassel",
      "type": "Registerbekanntmachung nach dem Umwandlungsgesetz",
      "state": "Hessen",
      "amtsgericht": "Amtsgericht Kassel",
      "registernummer": "HRA 18311",
      "registerart": "HRA",
      "company_name": "Ugljesa Dachdeckermeister e.K.",
      "company_seat": "Kassel",
      "details": "30.07.2025 (Bekanntmachungsdatum)\n\nHessen Amtsgericht Kassel HRA 18311\nRegisterbekanntmachung nach dem Umwandlungsgesetz 30.07.2025 (Eintragungsdatum)\n\nUgljesa Dachdeckermeister e.K.\nEinzelkaufmann / Einzelkauffrau\nKassel\n\nDen Gläubigern der an der Ausgliederung beteiligten Rechtsträger ist, wenn sie binnen sechs Monaten nach dem Tag, an dem die Eintragung der Ausgliederung in das Register des Sitzes desjenigen Rechtsträgers, dessen Gläubiger sie sind, nach §§ 125, 19 Absatz 3 UmwG bekannt gemacht worden ist, ihren Anspruch nach Grund und Höhe schriftlich anmelden, Sicherheit zu leisten, soweit sie nicht Befriedigung verlangen können. Dieses Recht steht den Gläubigern jedoch nur zu, wenn sie glaubhaft machen, dass durch die Ausgliederung die Erfüllung ihrer Forderung gefährdet wird."
    },
    {
      "date": "2025-07-30",
      "id": "118390",
      "original_text": "Registerbekanntmachung nach dem Umwandlungsgesetz\nHessen Amtsgericht Frankfurt am Main HRB 127052\neinfachzahlen GmbH – Bad Vilbel",
      "type": "Registerbekanntmachung nach dem Umwandlungsgesetz",
      "state": "Hessen",
      "amtsgericht": "Amtsgericht Frankfurt am Main",
      "registernummer": "HRB 127052",
      "registerart": "HRB",
      "company_name": "einfachzahlen GmbH",
      "company_seat": "Bad Vilbel",
      "details": "30.07.2025 (Bekanntmachungsdatum)\n\nHessen Amtsgericht Frankfurt am Main HRB 127052\nRegisterbekanntmachung nach dem Umwandlungsgesetz 30.07.2025 (Eintragungsdatum)\n\neinfachzahlen GmbH\nGesellschaft mit beschränkter Haftung\nBad Vilbel\n\nDen Gläubigern der an der Verschmelzung beteiligten Rechtsträger ist, wenn sie binnen sechs Monaten nach dem Tag, an dem die Eintragung der Verschmelzung in das Register des Sitzes desjenigen Rechtsträgers, dessen Gläubiger sie sind, nach § 19 Absatz 3 UmwG bekannt gemacht worden ist, ihren Anspruch nach Grund und Höhe schriftlich anmelden, Sicherheit zu leisten, soweit sie nicht Befriedigung verlangen können. Dieses Recht steht den Gläubigern jedoch nur zu, wenn sie glaubhaft machen, dass durch die Verschmelzung die Erfüllung ihrer Forderung gefährdet wird."
    },
    {
      "date": "2025-07-30",
      "id": "118391",
      "original_text": "Registerbekanntmachung nach dem Umwandlungsgesetz\nHessen Amtsgericht Friedberg HRB 7173\nPolo Co-Investor Verwaltungs-GmbH – Bad Nauheim",
      "type": "Registerbekanntmachung nach dem Umwandlungsgesetz",
      "state": "Hessen",
      "amtsgericht": "Amtsgericht Friedberg",
      "registernummer": "HRB 7173",
      "registerart": "HRB",
      "company_name": "Polo Co-Investor Verwaltungs-GmbH",
      "company_seat": "Bad Nauheim",
      "details": "30.07.2025 (Bekanntmachungsdatum)\n\nHessen Amtsgericht Friedberg HRB 7173\nRegisterbekanntmachung nach dem Umwandlungsgesetz 30.07.2025 (Eintragungsdatum)\n\nPolo Co-Investor Verwaltungs-GmbH\nGesellschaft mit beschränkter Haftung\nBad Nauheim\n\nDen Gläubigern der an der Verschmelzung beteiligten Rechtsträger ist, wenn sie binnen sechs Monaten nach dem Tag, an dem die Eintragung der Verschmelzung in das Register des Sitzes desjenigen Rechtsträgers, dessen Gläubiger sie sind, nach § 19 Absatz 3 UmwG bekannt gemacht worden ist, ihren Anspruch nach Grund und Höhe schriftlich anmelden, Sicherheit zu leisten, soweit sie nicht Befriedigung verlangen können. Dieses Recht steht den Gläubigern jedoch nur zu, wenn sie glaubhaft machen, dass durch die Verschmelzung die Erfüllung ihrer Forderung gefährdet wird."
    },
    {
      "date": "2025-07-30",
      "id": "118392",
      "original_text": "Registerbekanntmachung nach dem Umwandlungsgesetz\nHessen Amtsgericht Darmstadt HRB 100704\nBaWiG GmbH Bildungsakademie und Wissenschaft und Gesundheitswesen – Kelsterbach",
      "type": "Registerbekanntmachung nach dem Umwandlungsgesetz",
      "state": "Hessen",
      "amtsgericht": "Amtsgericht Darmstadt",
      "registernummer": "HRB 100704",
      "registerart": "HRB",
      "company_name": "BaWiG GmbH Bildungsakademie und Wissenschaft und Gesundheitswesen",
      "company_seat": "Kelsterbach",
      "details": "30.07.2025 (Bekanntmachungsdatum)\n\nHessen Amtsgericht Darmstadt HRB 100704\nRegisterbekanntmachung nach dem Umwandlungsgesetz 30.07.2025 (Eintragungsdatum)\n\nBaWiG GmbH Bildungsakademie und Wissenschaft und Gesundheitswesen\nGesellschaft mit beschränkter Haftung\nKelsterbach\n\nDen Gläubigern der an der Verschmelzung beteiligten Rechtsträger ist, wenn sie binnen sechs Monaten nach dem Tag, an dem die Eintragung der Verschmelzung in das Register des Sitzes derjenigen Rechtsträger deren Gläubiger sie sind, nach § 19 Absatz 3 UmwG bekannt gemacht worden ist, ihren Anspruch nach Grund und Höhe schriftlich anmelden, Sicherheit zu leisten, soweit sie nicht Befriedigung verlangen können. Dieses Recht steht den Gläubigern jedoch nur zu, wenn sie glaubhaft machen, dass durch die Verschmelzung die Erfüllung ihrer Forderung gefährdet wird."
    },
    {
      "date": "2025-07-30",
      "id": "118393",
      "original_text": "Registerbekanntmachung nach dem Umwandlungsgesetz\nHessen Amtsgericht Wetzlar HRA 8076\nSchnurr Energieberatung e. K. – Dillenburg",
      "type": "Registerbekanntmachung nach dem Umwandlungsgesetz",
      "state": "Hessen",
      "amtsgericht": "Amtsgericht Wetzlar",
      "registernummer": "HRA 8076",
      "registerart": "HRA",
      "company_name": "Schnurr Energieberatung e. K.",
      "company_seat": "Dillenburg",
      "details": "30.07.2025 (Bekanntmachungsdatum)\n\nHessen Amtsgericht Wetzlar HRA 8076\nRegisterbekanntmachung nach dem Umwandlungsgesetz 30.07.2025 (Eintragungsdatum)\n\nSchnurr Energieberatung e. K.\nEinzelkaufmann / Einzelkauffrau\nDillenburg\n\nDen Gläubigern der an der Ausgliederung beteiligten Rechtsträger ist, wenn sie binnen sechs Monaten nach dem Tag, an dem die Eintragung der Ausgliederung in das Register des Sitzes desjenigen Rechtsträgers, dessen Gläubiger sie sind, nach §§ 125, 19 Absatz 3 UmwG bekannt gemacht worden ist, ihren Anspruch nach Grund und Höhe schriftlich anmelden, Sicherheit zu leisten, soweit sie nicht Befriedigung verlangen können. Dieses Recht steht den Gläubigern jedoch nur zu, wenn sie glaubhaft machen, dass durch die Ausgliederung die Erfüllung ihrer Forderung gefährdet wird."
    },
    {
      "date": "2025-07-30",
      "id": "118394",
      "original_text": "Registerbekanntmachung nach dem Umwandlungsgesetz\nHessen Amtsgericht Frankfurt am Main HRB 121087\nCard & Cash Concept GmbH – Bad Vilbel",
      "type": "Registerbekanntmachung nach dem Umwandlungsgesetz",
      "state": "Hessen",
      "amtsgericht": "Amtsgericht Frankfurt am Main",
      "registernummer": "HRB 121087",
      "registerart": "HRB",
      "company_name": "Card & Cash Concept GmbH",
      "company_seat": "Bad Vilbel",
      "details": "30.07.2025 (Bekanntmachungsdatum)\n\nHessen Amtsgericht Frankfurt am Main HRB 121087\nRegisterbekanntmachung nach dem Umwandlungsgesetz 30.07.2025 (Eintragungsdatum)\n\nCard & Cash Concept GmbH\nGesellschaft mit beschränkter Haftung\nBad Vilbel\n\nDen Gläubigern der an der Verschmelzung beteiligten Rechtsträger ist, wenn sie binnen sechs Monaten nach dem Tag, an dem die Eintragung der Verschmelzung in das Register des Sitzes desjenigen Rechtsträgers, dessen Gläubiger sie sind, nach § 19 Absatz 3 UmwG bekannt gemacht worden ist, ihren Anspruch nach Grund und Höhe schriftlich anmelden, Sicherheit zu leisten, soweit sie nicht Befriedigung verlangen können. Dieses Recht steht den Gläubigern jedoch nur zu, wenn sie glaubhaft machen, dass durch die Verschmelzung die Erfüllung ihrer Forderung gefährdet wird."
    },
    {
      "date": "2025-07-30",
      "id": "118395",
      "original_text": "Registerbekanntmachung nach dem Umwandlungsgesetz\nHessen Amtsgericht Frankfurt am Main HRB 82021\nUnifiedpost GmbH – Frankfurt am Main",
      "type": "Registerbekanntmachung nach dem Umwandlungsgesetz",
      "state": "Hessen",
      "amtsgericht": "Amtsgericht Frankfurt am Main",
      "registernummer": "HRB 82021",
      "registerart": "HRB",
      "company_name": "Unifiedpost GmbH",
      "company_seat": "Frankfurt am Main",
      "details": "30.07.2025 (Bekanntmachungsdatum)\n\nHessen Amtsgericht Frankfurt am Main HRB 82021\nRegisterbekanntmachung nach dem Umwandlungsgesetz 30.07.2025 (Eintragungsdatum)\n\nUnifiedpost GmbH\nGesellschaft mit beschränkter Haftung\nFrankfurt am Main\n\nDen Gläubigern der an der Verschmelzung beteiligten Rechtsträger ist, wenn sie binnen sechs Monaten nach dem Tag, an dem die Eintragung der Verschmelzung in das Register des Sitzes desjenigen Rechtsträgers, dessen Gläubiger sie sind, nach § 19 Absatz 3 UmwG bekannt gemacht worden ist, ihren Anspruch nach Grund und Höhe schriftlich anmelden, Sicherheit zu leisten, soweit sie nicht Befriedigung verlangen können. Dieses Recht steht den Gläubigern jedoch nur zu, wenn sie glaubhaft machen, dass durch die Verschmelzung die Erfüllung ihrer Forderung gefährdet wird."
    },
    {
      "date": "2025-07-30",
      "id": "118396",
      "original_text": "Registerbekanntmachung nach dem Umwandlungsgesetz\nHessen Amtsgericht Friedberg HRB 6316\nHD Serv GmbH – Butzbach",
      "type": "Registerbekanntmachung nach dem Umwandlungsgesetz",
      "state": "Hessen",
      "amtsgericht": "Amtsgericht Friedberg",
      "registernummer": "HRB 6316",
      "registerart": "HRB",
      "company_name": "HD Serv GmbH",
      "company_seat": "Butzbach",
      "details": "30.07.2025 (Bekanntmachungsdatum)\n\nHessen Amtsgericht Friedberg HRB 6316\nRegisterbekanntmachung nach dem Umwandlungsgesetz 30.07.2025 (Eintragungsdatum)\n\nHD Serv GmbH\nGesellschaft mit beschränkter Haftung\nButzbach\n\nDen Gläubigern der an der Verschmelzung beteiligten Rechtsträger ist, wenn sie binnen sechs Monaten nach dem Tag, an dem die Eintragung der Verschmelzung in das Register des Sitzes desjenigen Rechtsträgers, dessen Gläubiger sie sind, nach § 19 Absatz 3 UmwG bekannt gemacht worden ist, ihren Anspruch nach Grund und Höhe schriftlich anmelden, Sicherheit zu leisten, soweit sie nicht Befriedigung verlangen können. Dieses Recht steht den Gläubigern jedoch nur zu, wenn sie glaubhaft machen, dass durch die Verschmelzung die Erfüllung ihrer Forderung gefährdet wird."
    },
    {
      "date": "2025-07-30",
      "id": "118397",
      "original_text": "Registerbekanntmachung nach dem Umwandlungsgesetz\nHessen Amtsgericht Friedberg HRB 7165\nPolo Holding GmbH – Bad Nauheim",
      "type": "Registerbekanntmachung nach dem Umwandlungsgesetz",
      "state": "Hessen",
      "amtsgericht": "Amtsgericht Friedberg",
      "registernummer": "HRB 7165",
      "registerart": "HRB",
      "company_name": "Polo Holding GmbH",
      "company_seat": "Bad Nauheim",
      "details": "30.07.2025 (Bekanntmachungsdatum)\n\nHessen Amtsgericht Friedberg HRB 7165\nRegisterbekanntmachung nach dem Umwandlungsgesetz 30.07.2025 (Eintragungsdatum)\n\nPolo Holding GmbH\nGesellschaft mit beschränkter Haftung\nBad Nauheim\n\nDen Gläubigern der an der Verschmelzung beteiligten Rechtsträger ist, wenn sie binnen sechs Monaten nach dem Tag, an dem die Eintragung der Verschmelzung in das Register des Sitzes desjenigen Rechtsträgers, dessen Gläubiger sie sind, nach § 19 Absatz 3 UmwG bekannt gemacht worden ist, ihren Anspruch nach Grund und Höhe schriftlich anmelden, Sicherheit zu leisten, soweit sie nicht Befriedigung verlangen können. Dieses Recht steht den Gläubigern jedoch nur zu, wenn sie glaubhaft machen, dass durch die Verschmelzung die Erfüllung ihrer Forderung gefährdet wird."
    },
    {
      "date": "2025-07-30",
      "id": "118398",
      "original_text": "Registerbekanntmachung nach dem Umwandlungsgesetz\nHessen Amtsgericht Frankfurt am Main HRB 110797\nLE Quartier 200 GmbH – Frankfurt am Main",
      "type": "Registerbekanntmachung nach dem Umwandlungsgesetz",
      "state": "Hessen",
      "amtsgericht": "Amtsgericht Frankfurt am Main",
      "registernummer": "HRB 110797",
      "registerart": "HRB",
      "company_name": "LE Quartier 200 GmbH",
      "company_seat": "Frankfurt am Main",
      "details": "30.07.2025 (Bekanntmachungsdatum)\n\nHessen Amtsgericht Frankfurt am Main HRB 110797\nRegisterbekanntmachung nach dem Umwandlungsgesetz 30.07.2025 (Eintragungsdatum)\n\nLE Quartier 200 GmbH\nGesellschaft mit beschränkter Haftung\nFrankfurt am Main\n\nDen Gläubigern der an der Verschmelzung beteiligten Rechtsträger ist, wenn sie binnen sechs Monaten nach dem Tag, an dem die Eintragung der Verschmelzung in das Register des Sitzes desjenigen Rechtsträgers, dessen Gläubiger sie sind, nach § 19 Absatz 3 UmwG bekannt gemacht worden ist, ihren Anspruch nach Grund und Höhe schriftlich anmelden, Sicherheit zu leisten, soweit sie nicht Befriedigung verlangen können. Dieses Recht steht den Gläubigern jedoch nur zu, wenn sie glaubhaft machen, dass durch die Verschmelzung die Erfüllung ihrer Forderung gefährdet wird."
    },
    {
      "date": "2025-07-30",
      "id": "118399",
      "original_text": "Registerbekanntmachung nach dem Umwandlungsgesetz\nHessen Amtsgericht Königstein HRB 10376\nAmpro Projektmanagement GmbH – Eppstein",
      "type": "Registerbekanntmachung nach dem Umwandlungsgesetz",
      "state": "Hessen",
      "amtsgericht": "Amtsgericht Königstein",
      "registernummer": "HRB 10376",
      "registerart": "HRB",
      "company_name": "Ampro Projektmanagement GmbH",
      "company_seat": "Eppstein",
      "details": "30.07.2025 (Bekanntmachungsdatum)\n\nHessen Amtsgericht Königstein HRB 10376\nRegisterbekanntmachung nach dem Umwandlungsgesetz 30.07.2025 (Eintragungsdatum)\n\nAmpro Projektmanagement GmbH\nGesellschaft mit beschränkter Haftung\nEppstein\n\nDen Gläubigern der an der Verschmelzung beteiligten Rechtsträger ist, wenn sie binnen sechs Monaten nach dem Tag, an dem die Eintragung der Verschmelzung in das Register des Sitzes desjenigen Rechtsträgers, dessen Gläubiger sie sind, nach § 19 Absatz 3 UmwG bekannt gemacht worden ist, ihren Anspruch nach Grund und Höhe schriftlich anmelden, Sicherheit zu leisten, soweit sie nicht Befriedigung verlangen können. Dieses Recht steht den Gläubigern jedoch nur zu, wenn sie glaubhaft machen, dass durch die Verschmelzung die Erfüllung ihrer Forderung gefährdet wird."
    },
    {
      "date": "2025-07-30",
      "id": "118400",
      "original_text": "Registerbekanntmachung nach dem Umwandlungsgesetz\nHessen Amtsgericht Frankfurt am Main HRA 54187\nRosense-Sen Naturkosmetik e.K. – Eschborn",
      "type": "Registerbekanntmachung nach dem Umwandlungsgesetz",
      "state": "Hessen",
      "amtsgericht": "Amtsgericht Frankfurt am Main",
      "registernummer": "HRA 54187",
      "registerart": "HRA",
      "company_name": "Rosense-Sen Naturkosmetik e.K.",
      "company_seat": "Eschborn",
      "details": "30.07.2025 (Bekanntmachungsdatum)\n\nHessen Amtsgericht Frankfurt am Main HRA 54187\nRegisterbekanntmachung nach dem Umwandlungsgesetz 30.07.2025 (Eintragungsdatum)\n\nRosense-Sen Naturkosmetik e.K.\nEinzelkaufmann / Einzelkauffrau\nEschborn\n\nDen Gläubigern der an der Ausgliederung beteiligten Rechtsträger ist, wenn sie binnen sechs Monaten nach dem Tag, an dem die Eintragung der Ausgliederung in das Register des Sitzes desjenigen Rechtsträgers, dessen Gläubiger sie sind, nach §§ 125, 19 Absatz 3 UmwG bekannt gemacht worden ist, ihren Anspruch nach Grund und Höhe schriftlich anmelden, Sicherheit zu leisten, soweit sie nicht Befriedigung verlangen können. Dieses Recht steht den Gläubigern jedoch nur zu, wenn sie glaubhaft machen, dass durch die Ausgliederung die Erfüllung ihrer Forderung gefährdet wird."
    },
    {
      "date": "2025-07-30",
      "id": "118401",
      "original_text": "Registerbekanntmachung nach dem Umwandlungsgesetz\nHessen Amtsgericht Frankfurt am Main HRB 110797\nLE Quartier 200 GmbH – Frankfurt am Main",
      "type": "Registerbekanntmachung nach dem Umwandlungsgesetz",
      "state": "Hessen",
      "amtsgericht": "Amtsgericht Frankfurt am Main",
      "registernummer": "HRB 110797",
      "registerart": "HRB",
      "company_name": "LE Quartier 200 GmbH",
      "company_seat": "Frankfurt am Main",
      "details": "30.07.2025 (Bekanntmachungsdatum)\n\nHessen Amtsgericht Frankfurt am Main HRB 110797\nRegisterbekanntmachung nach dem Umwandlungsgesetz 30.07.2025 (Eintragungsdatum)\n\nLE Quartier 200 GmbH\nGesellschaft mit beschränkter Haftung\nFrankfurt am Main\n\nDen Gläubigern der an der Verschmelzung beteiligten Rechtsträger ist, wenn sie binnen sechs Monaten nach dem Tag, an dem die Eintragung der Verschmelzung in das Register des Sitzes desjenigen Rechtsträgers, dessen Gläubiger sie sind, nach § 19 Absatz 3 UmwG bekannt gemacht worden ist, ihren Anspruch nach Grund und Höhe schriftlich anmelden, Sicherheit zu leisten, soweit sie nicht Befriedigung verlangen können. Dieses Recht steht den Gläubigern jedoch nur zu, wenn sie glaubhaft machen, dass durch die Verschmelzung die Erfüllung ihrer Forderung gefährdet wird."
    },
    {
      "date": "2025-07-30",
      "id": "118402",
      "original_text": "Registerbekanntmachung nach dem Umwandlungsgesetz\nHessen Amtsgericht Frankfurt am Main HRB 130953\nDBR Gamma Pensions GmbH – Frankfurt am Main",
      "type": "Registerbekanntmachung nach dem Umwandlungsgesetz",
      "state": "Hessen",
      "amtsgericht": "Amtsgericht Frankfurt am Main",
      "registernummer": "HRB 130953",
      "registerart": "HRB",
      "company_name": "DBR Gamma Pensions GmbH",
      "company_seat": "Frankfurt am Main",
      "details": "30.07.2025 (Bekanntmachungsdatum)\n\nHessen Amtsgericht Frankfurt am Main HRB 130953\nRegisterbekanntmachung nach dem Umwandlungsgesetz 30.07.2025 (Eintragungsdatum)\n\nDBR Gamma Pensions GmbH\nGesellschaft mit beschränkter Haftung\nFrankfurt am Main\n\nDen Gläubigern der an der Abspaltung beteiligten Rechtsträger ist, wenn sie binnen sechs Monaten nach dem Tag, an dem die Eintragung der Abspaltung in das Register des Sitzes desjenigen Rechtsträgers, dessen Gläubiger sie sind, nach §§ 125, 19 Absatz 3 UmwG bekannt gemacht worden ist, ihren Anspruch nach Grund und Höhe schriftlich anmelden, Sicherheit zu leisten, soweit sie nicht Befriedigung verlangen können. Dieses Recht steht den Gläubigern jedoch nur zu, wenn sie glaubhaft machen, dass durch die Abspaltung die Erfüllung ihrer Forderung gefährdet wird."
    },
    {
      "date": "2025-07-30",
      "id": "118403",
      "original_text": "Registerbekanntmachung nach dem Umwandlungsgesetz\nHessen Amtsgericht Frankfurt am Main HRB 137200\nSencos GmbH – Frankfurt am Main",
      "type": "Registerbekanntmachung nach dem Umwandlungsgesetz",
      "state": "Hessen",
      "amtsgericht": "Amtsgericht Frankfurt am Main",
      "registernummer": "HRB 137200",
      "registerart": "HRB",
      "company_name": "Sencos GmbH",
      "company_seat": "Frankfurt am Main",
      "details": "30.07.2025 (Bekanntmachungsdatum)\n\nHessen Amtsgericht Frankfurt am Main HRB 137200\nRegisterbekanntmachung nach dem Umwandlungsgesetz 30.07.2025 (Eintragungsdatum)\n\nSencos GmbH\nGesellschaft mit beschränkter Haftung\nFrankfurt am Main\n\nDen Gläubigern der an der Ausgliederung beteiligten Rechtsträger ist, wenn sie binnen sechs Monaten nach dem Tag, an dem die Eintragung der Ausgliederung in das Register des Sitzes desjenigen Rechtsträgers, dessen Gläubiger sie sind, nach §§ 125, 19 Absatz 3 UmwG bekannt gemacht worden ist, ihren Anspruch nach Grund und Höhe schriftlich anmelden, Sicherheit zu leisten, soweit sie nicht Befriedigung verlangen können. Dieses Recht steht den Gläubigern jedoch nur zu, wenn sie glaubhaft machen, dass durch die Ausgliederung die Erfüllung ihrer Forderung gefährdet wird."
    },
    {
      "date": "2025-07-30",
      "id": "118404",
      "original_text": "Registerbekanntmachung nach dem Umwandlungsgesetz\nHessen Amtsgericht Frankfurt am Main HRB 124813\nPayIn GmbH – Frankfurt am Main",
      "type": "Registerbekanntmachung nach dem Umwandlungsgesetz",
      "state": "Hessen",
      "amtsgericht": "Amtsgericht Frankfurt am Main",
      "registernummer": "HRB 124813",
      "registerart": "HRB",
      "company_name": "PayIn GmbH",
      "company_seat": "Frankfurt am Main",
      "details": "30.07.2025 (Bekanntmachungsdatum)\n\nHessen Amtsgericht Frankfurt am Main HRB 124813\nRegisterbekanntmachung nach dem Umwandlungsgesetz 30.07.2025 (Eintragungsdatum)\n\nPayIn GmbH\nGesellschaft mit beschränkter Haftung\nFrankfurt am Main\n\nDen Gläubigern der an der Verschmelzung beteiligten Rechtsträger ist, wenn sie binnen sechs Monaten nach dem Tag, an dem die Eintragung der Verschmelzung in das Register des Sitzes desjenigen Rechtsträgers, dessen Gläubiger sie sind, nach § 19 Absatz 3 UmwG bekannt gemacht worden ist, ihren Anspruch nach Grund und Höhe schriftlich anmelden, Sicherheit zu leisten, soweit sie nicht Befriedigung verlangen können. Dieses Recht steht den Gläubigern jedoch nur zu, wenn sie glaubhaft machen, dass durch die Verschmelzung die Erfüllung ihrer Forderung gefährdet wird."
    },
    {
      "date": "2025-07-30",
      "id": "118405",
      "original_text": "Registerbekanntmachung nach dem Umwandlungsgesetz\nHessen Amtsgericht Friedberg HRB 6254\nCuratus Pflegeeinrichtungen Lindenpark GmbH – Butzbach",
      "type": "Registerbekanntmachung nach dem Umwandlungsgesetz",
      "state": "Hessen",
      "amtsgericht": "Amtsgericht Friedberg",
      "registernummer": "HRB 6254",
      "registerart": "HRB",
      "company_name": "Curatus Pflegeeinrichtungen Lindenpark GmbH",
      "company_seat": "Butzbach",
      "details": "30.07.2025 (Bekanntmachungsdatum)\n\nHessen Amtsgericht Friedberg HRB 6254\nRegisterbekanntmachung nach dem Umwandlungsgesetz 30.07.2025 (Eintragungsdatum)\n\nCuratus Pflegeeinrichtungen Lindenpark GmbH\nGesellschaft mit beschränkter Haftung\nButzbach\n\nDen Gläubigern der an der Verschmelzung beteiligten Rechtsträger ist, wenn sie binnen sechs Monaten nach dem Tag, an dem die Eintragung der Verschmelzung in das Register des Sitzes desjenigen Rechtsträgers, dessen Gläubiger sie sind, nach § 19 Absatz 3 UmwG bekannt gemacht worden ist, ihren Anspruch nach Grund und Höhe schriftlich anmelden, Sicherheit zu leisten, soweit sie nicht Befriedigung verlangen können. Dieses Recht steht den Gläubigern jedoch nur zu, wenn sie glaubhaft machen, dass durch die Verschmelzung die Erfüllung ihrer Forderung gefährdet wird."
    },
    {
      "date": "2025-07-30",
      "id": "118406",
      "original_text": "Löschungsankündigung\nHessen Amtsgericht Frankfurt am Main HRB 101642\nKIGERO GmbH – Frankfurt am Main",
      "type": "Löschungsankündigung",
      "state": "Hessen",
      "amtsgericht": "Amtsgericht Frankfurt am Main",
      "registernummer": "HRB 101642",
      "registerart": "HRB",
      "company_name": "KIGERO GmbH",
      "company_seat": "Frankfurt am Main",
      "details": "30.07.2025 (Bekanntmachungsdatum)\n\nHessen Amtsgericht Frankfurt am Main HRB 101642\nLöschungsankündigung 30.07.2025 (Eintragungsdatum)\n\nKIGERO GmbH\nGesellschaft mit beschränkter Haftung\nFrankfurt am Main\n\nDas Registergericht beabsichtigt, den Geschäftsführer der Gesellschaft, Herr Rolf Ludwig Ziemdorf, gemäß § 395 FamFG von Amts wegen im Handelsregister zu löschen.\nHiergegen kann innerhalb von vier Wochen nach dieser Veröffentlichung Widerspruch bei dem Amtsgericht Frankfurt am Main eingelegt werden. Nach Ablauf der Frist erfolgt die Löschung des Geschäftsführers."
    },
    {
      "date": "2025-07-30",
      "id": "118407",
      "original_text": "Registerbekanntmachung nach dem Umwandlungsgesetz\nHessen Amtsgericht Frankfurt am Main HRB 8633\nDeka Immobilien Investment GmbH – Frankfurt am Main",
      "type": "Registerbekanntmachung nach dem Umwandlungsgesetz",
      "state": "Hessen",
      "amtsgericht": "Amtsgericht Frankfurt am Main",
      "registernummer": "HRB 8633",
      "registerart": "HRB",
      "company_name": "Deka Immobilien Investment GmbH",
      "company_seat": "Frankfurt am Main",
      "details": "30.07.2025 (Bekanntmachungsdatum)\n\nHessen Amtsgericht Frankfurt am Main HRB 8633\nRegisterbekanntmachung nach dem Umwandlungsgesetz\n\nDeka Immobilien Investment GmbH\nGesellschaft mit beschränkter Haftung\nFrankfurt am Main\n\nDem Registergericht ist der Entwurf eines Verschmelzungsplans über die geplante grenzüberschreitende Verschmelzung der Deka Immobilien Investment GmbH mit Sitz in Frankfurt am Main (Gesellschaft mit beschränkter Haftung, eingetragen beim Amtsgericht Frankfurt am Main unter der HRB  8633) als übernehmender Rechtsträger mit der DEKA TAIBOUT mit Sitz in Tour Ariane, Frankreich (société par actions simplifée, eingetragen beim Registre du commerce et des sociétés, 818 280 398) als übertragender Rechtsträger eingereicht worden.\nDen Gläubigern der übertragenden Gesellschaft ist Sicherheit zu leisten, wenn sie innerhalb einer Frist von zwei Monaten nach Bekanntmachung des Verschmelzungsplans glaubhaft machen, dass durch die Verschmelzung die Erfüllung ihrer Forderung gefährdet wird. Die Anteilseigner der übertragenden Gesellschaft haben bei grenzüberschreitenden Verschmelzungen einen Anspruch auf angemessene Abfindung, sofern sie der Verschmelzung widersprochen haben; gegebenenfalls steht ihnen auch ein Anspruch auf bare Zuzahlung zu.\nAuflistung der nach § 308 Abs. 1 UmwG bekanntzumachenden Angaben für die grenzüberschreitende Verschmelzung der DEKA TAITBOUT mit Sitz (siége social) in Tour Ariane, 5 place de la Pyramide - 92800 Puteaux, Frankreich, auf die Deka Immobilien Investment GmbH, mit Sitz in Frankfurt am Main, Deutschland:\n\n1. Der Entwurf des gemeinsamen Verschmelzungsplans mit den Verschmelzungsbedingungen für eine grenzüberschreitende Verschmelzung zwischen der DEKA TAITBOUT (als übertragende Gesellschaft) und der Deka Immobilien Investment GmbH (als übernehmende Gesellschaft) ist beim Handelsregister der übernehmenden Gesellschaft eingereicht worden.\n\n2. An der grenzüberschreitenden Verschmelzung sind die folgenden Gesellschaften beteiligt:\na) als übertragende Gesellschaft:\nDie DEKA TAITBOUT mit Sitz (siége social) in Tour Ariane, 5 place de la Pyramide - 92800 Puteaux, Frankreich, eine vereinfachte Aktiengesellschaft nach französischem Recht (sogenannte societe par actions simplifiee);\nb) als übernehmende Gesellschaft:\nDie DEKA Immobilien Investment GmbH mit Sitz in Frankfurt am Main,\nDeutschland, eine Kapitalgesellschaft in Rechtsform der Gesellschaft mit beschränkter Haftung nach dem Recht der Bundesrepublik Deutschland.\n\n3. Die an der grenzüberschreitenden Verschmelzung beteiligten Gesellschaften sind in\nden folgenden Registern eingetragen:\na) Die übertragende Gesellschaft DEKA TAITBOUT ist eingetragen im Nanterre\nGesellschafts- und Handelsregister (Registre du commerce et des societes,\nR.C.S.) unter der Nummer 818 280 398;\nb) Die übernehmende Gesellschaft Deka Immobilien Investment GmbH ist eingetragen im Handelsregister des Amtsgerichts Frankfurt am Main unter der HRB 8633.\n\n4. Hinweis zur Möglichkeit der Übermittlung von Bemerkungen zum Verschmelzungsplan\nGläubiger und Anteilsinhaber sowie Betriebsräte oder - soweit es keine Betriebsräte gibt - Arbeitnehmer der an der grenzüberschreitenden Verschmelzung beteiligten Gesellschaften haben im Rahmen der grenzüberschreitenden Verschmelzung ein Anhörungsrecht.\nBei der übertragenden Gesellschaft, der DEKA TAITBOUT, sind keine Arbeitnehmer beschäftigt und demzufolge auch kein Betriebsrat etabliert. Die übernehmende Gesellschaft, die Deka Immobilien Investment GmbH, beschäftigt Arbeitnehmer und hat sowohl einen Betriebsrat in Frankfurt am Main und Düsseldorf sowie einen Gesamtbetriebsrat etabliert. Demzufolge gibt es bei der Deka Immobilien Investment GmbH zwei Betriebsräte sowie einen Gesamtbetriebsrat, die im Rahmen der Verschmelzung Rechte geltend machen können, insbesondere Bemerkungen zum Verschmelzungsplan oder dessen Entwurf übermitteln können.\nDie Gläubiger und Anteilsinhaber der an der Verschmelzung beteiligten Gesellschaften sowie die vorgenannten Betriebsräte und Gesamtbetriebsrat der Deka Immobilien Investment GmbH können bis spätestens fünf Arbeitstage vor dem Tag der Versammlung der Anteilsinhaber der jeweiligen verschmelzenden Gesellschaft, die über die Zustimmung zu dem Verschmelzungsplan beschließen, Bemerkungen zum Verschmelzungsplan bzw. dessen Entwurf übermitteln (vgl. § 308 Abs. 1 Satz 2 Nr. 4 UmwG).\nDie Beurkundung des Zustimmungsbeschlusses der Anteilsinhaber der Deka\nImmobilien Investment GmbH in Deutschland wird voraussichtlich am 22. September 2025, jedoch in keinem Fall vor diesem Tag erfolgen.\nDie Beurkundung des Zustimmungsbeschlusses der Anteilsinhaber der DEKA\nTAITBOUT in Frankreich wird voraussichtlich am 22. September 2025, jedoch in\nkeinem Fall vor diesem Tag erfolgen.\nVollständige Auskünfte über die Modalitäten der Ausübung der Rechte der Anteilsinhaber, Gläubiger sowie der Arbeitnehmervertreter und Arbeitnehmer der beteiligten Gesellschaften können unter den folgenden Adressen kostenlos angefordert werden. Dies sind zugleich die Zielanschriften für Bemerkungen zum Verschmelzungsplan:\n\nDeka Immobilien Investment GmbH\nLyoner Straße 13\n60528 Frankfurt am Main\nDeutschland\n\nDEKA TAITBOUT\nTour Ariane, 5 place de la Pyramide\n92800 Puteaux\nFrankreich"
    },
    {
      "date": "2025-07-30",
      "id": "118408",
      "original_text": "Registerbekanntmachung nach dem Umwandlungsgesetz\nHessen Amtsgericht Königstein HRB 4993\nAMPRO Medientechnik GmbH – Eppstein",
      "type": "Registerbekanntmachung nach dem Umwandlungsgesetz",
      "state": "Hessen",
      "amtsgericht": "Amtsgericht Königstein",
      "registernummer": "HRB 4993",
      "registerart": "HRB",
      "company_name": "AMPRO Medientechnik GmbH",
      "company_seat": "Eppstein",
      "details": "30.07.2025 (Bekanntmachungsdatum)\n\nHessen Amtsgericht Königstein HRB 4993\nRegisterbekanntmachung nach dem Umwandlungsgesetz 30.07.2025 (Eintragungsdatum)\n\nAMPRO Medientechnik GmbH\nGesellschaft mit beschränkter Haftung\nEppstein\n\nDen Gläubigern der an der Verschmelzung beteiligten Rechtsträger ist, wenn sie binnen sechs Monaten nach dem Tag, an dem die Eintragung der Verschmelzung in das Register des Sitzes desjenigen Rechtsträgers, dessen Gläubiger sie sind, nach § 19 Absatz 3 UmwG bekannt gemacht worden ist, ihren Anspruch nach Grund und Höhe schriftlich anmelden, Sicherheit zu leisten, soweit sie nicht Befriedigung verlangen können. Dieses Recht steht den Gläubigern jedoch nur zu, wenn sie glaubhaft machen, dass durch die Verschmelzung die Erfüllung ihrer Forderung gefährdet wird."
    },
    {
      "date": "2025-07-30",
      "id": "118409",
      "original_text": "Registerbekanntmachung nach dem Umwandlungsgesetz\nHessen Amtsgericht Frankfurt am Main HRB 104721\nPayment Management GmbH – Bad Vilbel",
      "type": "Registerbekanntmachung nach dem Umwandlungsgesetz",
      "state": "Hessen",
      "amtsgericht": "Amtsgericht Frankfurt am Main",
      "registernummer": "HRB 104721",
      "registerart": "HRB",
      "company_name": "Payment Management GmbH",
      "company_seat": "Bad Vilbel",
      "details": "30.07.2025 (Bekanntmachungsdatum)\n\nHessen Amtsgericht Frankfurt am Main HRB 104721\nRegisterbekanntmachung nach dem Umwandlungsgesetz 30.07.2025 (Eintragungsdatum)\n\nPayment Management GmbH\nGesellschaft mit beschränkter Haftung\nBad Vilbel\n\nDen Gläubigern der an der Verschmelzung beteiligten Rechtsträger ist, wenn sie binnen sechs Monaten nach dem Tag, an dem die Eintragung der Verschmelzung in das Register des Sitzes desjenigen Rechtsträgers, dessen Gläubiger sie sind, nach § 19 Absatz 3 UmwG bekannt gemacht worden ist, ihren Anspruch nach Grund und Höhe schriftlich anmelden, Sicherheit zu leisten, soweit sie nicht Befriedigung verlangen können. Dieses Recht steht den Gläubigern jedoch nur zu, wenn sie glaubhaft machen, dass durch die Verschmelzung die Erfüllung ihrer Forderung gefährdet wird."
    },
    {
      "date": "2025-07-30",
      "id": "118410",
      "original_text": "Registerbekanntmachung nach dem Umwandlungsgesetz\nHessen Amtsgericht Friedberg HRB 796\nPitzer GmbH – Bad Nauheim",
      "type": "Registerbekanntmachung nach dem Umwandlungsgesetz",
      "state": "Hessen",
      "amtsgericht": "Amtsgericht Friedberg",
      "registernummer": "HRB 796",
      "registerart": "HRB",
      "company_name": "Pitzer GmbH",
      "company_seat": "Bad Nauheim",
      "details": "30.07.2025 (Bekanntmachungsdatum)\n\nHessen Amtsgericht Friedberg HRB 796\nRegisterbekanntmachung nach dem Umwandlungsgesetz 30.07.2025 (Eintragungsdatum)\n\nPitzer GmbH\nGesellschaft mit beschränkter Haftung\nBad Nauheim\n\nDen Gläubigern der an der Verschmelzung beteiligten Rechtsträger ist, wenn sie binnen sechs Monaten nach dem Tag, an dem die Eintragung der Verschmelzung in das Register des Sitzes desjenigen Rechtsträgers, dessen Gläubiger sie sind, nach § 19 Absatz 3 UmwG bekannt gemacht worden ist, ihren Anspruch nach Grund und Höhe schriftlich anmelden, Sicherheit zu leisten, soweit sie nicht Befriedigung verlangen können. Dieses Recht steht den Gläubigern jedoch nur zu, wenn sie glaubhaft machen, dass durch die Verschmelzung die Erfüllung ihrer Forderung gefährdet wird."
    },
    {
      "date": "2025-07-30",
      "id": "118411",
      "original_text": "Registerbekanntmachung nach dem Umwandlungsgesetz\nHessen Amtsgericht Kassel HRB 19776\nBDS Bedachungssysteme GmbH – Kassel",
      "type": "Registerbekanntmachung nach dem Umwandlungsgesetz",
      "state": "Hessen",
      "amtsgericht": "Amtsgericht Kassel",
      "registernummer": "HRB 19776",
      "registerart": "HRB",
      "company_name": "BDS Bedachungssysteme GmbH",
      "company_seat": "Kassel",
      "details": "30.07.2025 (Bekanntmachungsdatum)\n\nHessen Amtsgericht Kassel HRB 19776\nRegisterbekanntmachung nach dem Umwandlungsgesetz 30.07.2025 (Eintragungsdatum)\n\nBDS Bedachungssysteme GmbH\nGesellschaft mit beschränkter Haftung\nKassel\n\nDen Gläubigern der an der Ausgliederung beteiligten Rechtsträger ist, wenn sie binnen sechs Monaten nach dem Tag, an dem die Eintragung der Ausgliederung in das Register des Sitzes desjenigen Rechtsträgers, dessen Gläubiger sie sind, nach §§ 125, 19 Absatz 3 UmwG bekannt gemacht worden ist, ihren Anspruch nach Grund und Höhe schriftlich anmelden, Sicherheit zu leisten, soweit sie nicht Befriedigung verlangen können. Dieses Recht steht den Gläubigern jedoch nur zu, wenn sie glaubhaft machen, dass durch die Ausgliederung die Erfüllung ihrer Forderung gefährdet wird."
    },
    {
      "date": "2025-07-30",
      "id": "118412",
      "original_text": "Registerbekanntmachung nach dem Umwandlungsgesetz\nHessen Amtsgericht Frankfurt am Main HRB 110797\nLE Quartier 200 GmbH – Frankfurt am Main",
      "type": "Registerbekanntmachung nach dem Umwandlungsgesetz",
      "state": "Hessen",
      "amtsgericht": "Amtsgericht Frankfurt am Main",
      "registernummer": "HRB 110797",
      "registerart": "HRB",
      "company_name": "LE Quartier 200 GmbH",
      "company_seat": "Frankfurt am Main",
      "details": "30.07.2025 (Bekanntmachungsdatum)\n\nHessen Amtsgericht Frankfurt am Main HRB 110797\nRegisterbekanntmachung nach dem Umwandlungsgesetz 30.07.2025 (Eintragungsdatum)\n\nLE Quartier 200 GmbH\nGesellschaft mit beschränkter Haftung\nFrankfurt am Main\n\nDen Gläubigern der an der Verschmelzung beteiligten Rechtsträger ist, wenn sie binnen sechs Monaten nach dem Tag, an dem die Eintragung der Verschmelzung in das Register des Sitzes desjenigen Rechtsträgers, dessen Gläubiger sie sind, nach § 19 Absatz 3 UmwG bekannt gemacht worden ist, ihren Anspruch nach Grund und Höhe schriftlich anmelden, Sicherheit zu leisten, soweit sie nicht Befriedigung verlangen können. Dieses Recht steht den Gläubigern jedoch nur zu, wenn sie glaubhaft machen, dass durch die Verschmelzung die Erfüllung ihrer Forderung gefährdet wird."
    },
    {
      "date": "2025-07-30",
      "id": "118413",
      "original_text": "Sonstige Registerbekanntmachung\nHessen Amtsgericht Darmstadt HRB 91467\nVita GmbH – Erbach",
      "type": "Sonstige Registerbekanntmachung",
      "state": "Hessen",
      "amtsgericht": "Amtsgericht Darmstadt",
      "registernummer": "HRB 91467",
      "registerart": "HRB",
      "company_name": "Vita GmbH",
      "company_seat": "Erbach",
      "details": "30.07.2025 (Bekanntmachungsdatum)\n\nHessen Amtsgericht Darmstadt HRB 91467\nSonstige Registerbekanntmachung 30.07.2025 (Eintragungsdatum)\n\nVita GmbH\nGesellschaft mit beschränkter Haftung\nErbach\n\nDen Gläubigern der Gesellschaft, deren Forderungen begründet worden sind, bevor die Eintragung der Beendigung des Vertrags in das Handelsregister nach § 10 HGB bekannt gemacht worden ist, ist vom anderen Vertragsteil Sicherheit zu leisten, wenn sie sich binnen sechs Monaten nach dieser Bekanntmachung zu diesem Zweck bei ihm melden."
    },
    {
      "date": "2025-07-30",
      "id": "118414",
      "original_text": "Registerbekanntmachung nach dem Umwandlungsgesetz\nHessen Amtsgericht Friedberg HRA 1508\nMEDIAN Kliniken Hessen GmbH & Co. KG – Bad Nauheim",
      "type": "Registerbekanntmachung nach dem Umwandlungsgesetz",
      "state": "Hessen",
      "amtsgericht": "Amtsgericht Friedberg",
      "registernummer": "HRA 1508",
      "registerart": "HRA",
      "company_name": "MEDIAN Kliniken Hessen GmbH & Co. KG",
      "company_seat": "Bad Nauheim",
      "details": "30.07.2025 (Bekanntmachungsdatum)\n\nHessen Amtsgericht Friedberg HRA 1508\nRegisterbekanntmachung nach dem Umwandlungsgesetz 30.07.2025 (Eintragungsdatum)\n\nMEDIAN Kliniken Hessen GmbH & Co. KG\nKommanditgesellschaft\nBad Nauheim\n\nDen Gläubigern der an der Verschmelzung beteiligten Rechtsträger ist, wenn sie binnen sechs Monaten nach dem Tag, an dem die Eintragung der Verschmelzung in das Register des Sitzes desjenigen Rechtsträgers, dessen Gläubiger sie sind, nach § 19 Absatz 3 UmwG bekannt gemacht worden ist, ihren Anspruch nach Grund und Höhe schriftlich anmelden, Sicherheit zu leisten, soweit sie nicht Befriedigung verlangen können. Dieses Recht steht den Gläubigern jedoch nur zu, wenn sie glaubhaft machen, dass durch die Verschmelzung die Erfüllung ihrer Forderung gefährdet wird."
    },
    {
      "date": "2025-07-30",
      "id": "118415",
      "original_text": "Löschungsankündigung\nHessen Amtsgericht Frankfurt am Main HRB 124709\nd. code GmbH – Eschborn",
      "type": "Löschungsankündigung",
      "state": "Hessen",
      "amtsgericht": "Amtsgericht Frankfurt am Main",
      "registernummer": "HRB 124709",
      "registerart": "HRB",
      "company_name": "d. code GmbH",
      "company_seat": "Eschborn",
      "details": "30.07.2025 (Bekanntmachungsdatum)\n\nHessen Amtsgericht Frankfurt am Main HRB 124709\nLöschungsankündigung 30.07.2025 (Eintragungsdatum)\n\nd. code GmbH\nGesellschaft mit beschränkter Haftung\nEschborn\n\nEs ist beabsichtigt die Gesellschaft wegen Vermögenslosigkeit gemäß § 394 FamFG von Amts wegen zu löschen. Hiergegen kann innerhalb eines Monats nach dieser Veröffentlichung Widerspruch bei dem Amtsgericht Frankfurt am Main eingelegt werden."
    },
    {
      "date": "2025-07-30",
      "id": "118416",
      "original_text": "Registerbekanntmachung nach dem Umwandlungsgesetz\nHessen Amtsgericht Frankfurt am Main HRB 130953\nDBR Gamma Pensions GmbH – Frankfurt am Main",
      "type": "Registerbekanntmachung nach dem Umwandlungsgesetz",
      "state": "Hessen",
      "amtsgericht": "Amtsgericht Frankfurt am Main",
      "registernummer": "HRB 130953",
      "registerart": "HRB",
      "company_name": "DBR Gamma Pensions GmbH",
      "company_seat": "Frankfurt am Main",
      "details": "30.07.2025 (Bekanntmachungsdatum)\n\nHessen Amtsgericht Frankfurt am Main HRB 130953\nRegisterbekanntmachung nach dem Umwandlungsgesetz 30.07.2025 (Eintragungsdatum)\n\nDBR Gamma Pensions GmbH\nGesellschaft mit beschränkter Haftung\nFrankfurt am Main\n\nDen Gläubigern der an der Abspaltung beteiligten Rechtsträger ist, wenn sie binnen sechs Monaten nach dem Tag, an dem die Eintragung der Abspaltung in das Register des Sitzes desjenigen Rechtsträgers, dessen Gläubiger sie sind, nach §§ 125, 19 Absatz 3 UmwG bekannt gemacht worden ist, ihren Anspruch nach Grund und Höhe schriftlich anmelden, Sicherheit zu leisten, soweit sie nicht Befriedigung verlangen können. Dieses Recht steht den Gläubigern jedoch nur zu, wenn sie glaubhaft machen, dass durch die Abspaltung die Erfüllung ihrer Forderung gefährdet wird."
    },
    {
      "date": "2025-07-30",
      "id": "118417",
      "original_text": "Registerbekanntmachung nach dem Umwandlungsgesetz\nHessen Amtsgericht Gießen HRB 1555\nBosch KWK Systeme GmbH – Lollar",
      "type": "Registerbekanntmachung nach dem Umwandlungsgesetz",
      "state": "Hessen",
      "amtsgericht": "Amtsgericht Gießen",
      "registernummer": "HRB 1555",
      "registerart": "HRB",
      "company_name": "Bosch KWK Systeme GmbH",
      "company_seat": "Lollar",
      "details": "30.07.2025 (Bekanntmachungsdatum)\n\nHessen Amtsgericht Gießen HRB 1555\nRegisterbekanntmachung nach dem Umwandlungsgesetz 30.07.2025 (Eintragungsdatum)\n\nBosch KWK Systeme GmbH\nGesellschaft mit beschränkter Haftung\nLollar\n\nDen Gläubigern der an der Verschmelzung beteiligten Rechtsträger ist, wenn sie binnen sechs Monaten nach dem Tag, an dem die Eintragung der Verschmelzung in das Register des Sitzes desjenigen Rechtsträgers, dessen Gläubiger sie sind, nach § 19 Absatz 3 UmwG bekannt gemacht worden ist, ihren Anspruch nach Grund und Höhe schriftlich anmelden, Sicherheit zu leisten, soweit sie nicht Befriedigung verlangen können. Dieses Recht steht den Gläubigern jedoch nur zu, wenn sie glaubhaft machen, dass durch die Verschmelzung die Erfüllung ihrer Forderung gefährdet wird."
    },
    {
      "date": "2025-07-30",
      "id": "118418",
      "original_text": "Löschungsankündigung\nHessen Amtsgericht Frankfurt am Main HRB 126281\nYRD Multi-modal Transport GmbH – Frankfurt am Main",
      "type": "Löschungsankündigung",
      "state": "Hessen",
      "amtsgericht": "Amtsgericht Frankfurt am Main",
      "registernummer": "HRB 126281",
      "registerart": "HRB",
      "company_name": "YRD Multi-modal Transport GmbH",
      "company_seat": "Frankfurt am Main",
      "details": "30.07.2025 (Bekanntmachungsdatum)\n\nHessen Amtsgericht Frankfurt am Main HRB 126281\nLöschungsankündigung 30.07.2025 (Eintragungsdatum)\n\nYRD Multi-modal Transport GmbH\nGesellschaft mit beschränkter Haftung\nFrankfurt am Main\n\nDas Registergericht beabsichtigt die im Handelsregister eingetragene Gesellschaft von Amts wegen nach § 394 FamFG zu löschen. Die Frist zur Erhebung eines Widerspruchs gegen die beabsichtigte Löschung wird auf 3 Monate festgesetzt."
    },
    {
      "date": "2025-07-30",
      "id": "118419",
      "original_text": "Registerbekanntmachung nach dem Umwandlungsgesetz\nHessen Amtsgericht Friedberg HRA 1508\nMEDIAN Kliniken Hessen GmbH & Co. KG – Bad Nauheim",
      "type": "Registerbekanntmachung nach dem Umwandlungsgesetz",
      "state": "Hessen",
      "amtsgericht": "Amtsgericht Friedberg",
      "registernummer": "HRA 1508",
      "registerart": "HRA",
      "company_name": "MEDIAN Kliniken Hessen GmbH & Co. KG",
      "company_seat": "Bad Nauheim",
      "details": "30.07.2025 (Bekanntmachungsdatum)\n\nHessen Amtsgericht Friedberg HRA 1508\nRegisterbekanntmachung nach dem Umwandlungsgesetz 30.07.2025 (Eintragungsdatum)\n\nMEDIAN Kliniken Hessen GmbH & Co. KG\nKommanditgesellschaft\nBad Nauheim\n\nDen Gläubigern der an der Verschmelzung beteiligten Rechtsträger ist, wenn sie binnen sechs Monaten nach dem Tag, an dem die Eintragung der Verschmelzung in das Register des Sitzes desjenigen Rechtsträgers, dessen Gläubiger sie sind, nach § 19 Absatz 3 UmwG bekannt gemacht worden ist, ihren Anspruch nach Grund und Höhe schriftlich anmelden, Sicherheit zu leisten, soweit sie nicht Befriedigung verlangen können. Dieses Recht steht den Gläubigern jedoch nur zu, wenn sie glaubhaft machen, dass durch die Verschmelzung die Erfüllung ihrer Forderung gefährdet wird."
    },
    {
      "date": "2025-07-30",
      "id": "118420",
      "original_text": "Registerbekanntmachung nach dem Umwandlungsgesetz\nHessen Amtsgericht Frankfurt am Main HRB 110797\nLE Quartier 200 GmbH – Frankfurt am Main",
      "type": "Registerbekanntmachung nach dem Umwandlungsgesetz",
      "state": "Hessen",
      "amtsgericht": "Amtsgericht Frankfurt am Main",
      "registernummer": "HRB 110797",
      "registerart": "HRB",
      "company_name": "LE Quartier 200 GmbH",
      "company_seat": "Frankfurt am Main",
      "details": "30.07.2025 (Bekanntmachungsdatum)\n\nHessen Amtsgericht Frankfurt am Main HRB 110797\nRegisterbekanntmachung nach dem Umwandlungsgesetz 30.07.2025 (Eintragungsdatum)\n\nLE Quartier 200 GmbH\nGesellschaft mit beschränkter Haftung\nFrankfurt am Main\n\nDen Gläubigern der an der Verschmelzung beteiligten Rechtsträger ist, wenn sie binnen sechs Monaten nach dem Tag, an dem die Eintragung der Verschmelzung in das Register des Sitzes desjenigen Rechtsträgers, dessen Gläubiger sie sind, nach § 19 Absatz 3 UmwG bekannt gemacht worden ist, ihren Anspruch nach Grund und Höhe schriftlich anmelden, Sicherheit zu leisten, soweit sie nicht Befriedigung verlangen können. Dieses Recht steht den Gläubigern jedoch nur zu, wenn sie glaubhaft machen, dass durch die Verschmelzung die Erfüllung ihrer Forderung gefährdet wird."
    },
    {
      "date": "2025-07-30",
      "id": "118421",
      "original_text": "Registerbekanntmachung nach dem Umwandlungsgesetz\nHessen Amtsgericht Wetzlar HRA 7757\nENERFECT GmbH & Co. KG – Dillenburg",
      "type": "Registerbekanntmachung nach dem Umwandlungsgesetz",
      "state": "Hessen",
      "amtsgericht": "Amtsgericht Wetzlar",
      "registernummer": "HRA 7757",
      "registerart": "HRA",
      "company_name": "ENERFECT GmbH & Co. KG",
      "company_seat": "Dillenburg",
      "details": "30.07.2025 (Bekanntmachungsdatum)\n\nHessen Amtsgericht Wetzlar HRA 7757\nRegisterbekanntmachung nach dem Umwandlungsgesetz 30.07.2025 (Eintragungsdatum)\n\nENERFECT GmbH & Co. KG\nKommanditgesellschaft\nDillenburg\n\nDen Gläubigern der an der Ausgliederung beteiligten Rechtsträger ist, wenn sie binnen sechs Monaten nach dem Tag, an dem die Eintragung der Ausgliederung in das Register des Sitzes desjenigen Rechtsträgers, dessen Gläubiger sie sind, nach §§ 125, 19 Absatz 3 UmwG bekannt gemacht worden ist, ihren Anspruch nach Grund und Höhe schriftlich anmelden, Sicherheit zu leisten, soweit sie nicht Befriedigung verlangen können. Dieses Recht steht den Gläubigern jedoch nur zu, wenn sie glaubhaft machen, dass durch die Ausgliederung die Erfüllung ihrer Forderung gefährdet wird."
    },
    {
      "date": "2025-07-30",
      "id": "118422",
      "original_text": "Registerbekanntmachung nach dem Umwandlungsgesetz\nHessen Amtsgericht Darmstadt HRB 7114\nFOCUS INFOCOM Gesellschaft für Informatik und Telekommunikation mbH – Darmstadt",
      "type": "Registerbekanntmachung nach dem Umwandlungsgesetz",
      "state": "Hessen",
      "amtsgericht": "Amtsgericht Darmstadt",
      "registernummer": "HRB 7114",
      "registerart": "HRB",
      "company_name": "FOCUS INFOCOM Gesellschaft für Informatik und Telekommunikation mbH",
      "company_seat": "Darmstadt",
      "details": "30.07.2025 (Bekanntmachungsdatum)\n\nHessen Amtsgericht Darmstadt HRB 7114\nRegisterbekanntmachung nach dem Umwandlungsgesetz 30.07.2025 (Eintragungsdatum)\n\nFOCUS INFOCOM Gesellschaft für Informatik und Telekommunikation mbH\nGesellschaft mit beschränkter Haftung\nDarmstadt\n\nDen Gläubigern der an der Verschmelzung beteiligten Rechtsträger ist, wenn sie binnen sechs Monaten nach dem Tag, an dem die Eintragung der Verschmelzung in das Register des Sitzes derjenigen Rechtsträger deren Gläubiger sie sind, nach § 19 Absatz 3 UmwG bekannt gemacht worden ist, ihren Anspruch nach Grund und Höhe schriftlich anmelden, Sicherheit zu leisten, soweit sie nicht Befriedigung verlangen können. Dieses Recht steht den Gläubigern jedoch nur zu, wenn sie glaubhaft machen, dass durch die Verschmelzung die Erfüllung ihrer Forderung gefährdet wird."
    }
  ]
}