{
  "date": "2025-07-09",
  "date_of_scrape": "2025-08-26T09:50:45.418Z",
  "tool_version": "0.2.0",
  "number_of_announcements": 162,
  "announcements": [
    {
      "date": "2025-07-09",
      "id": "115078",
      "original_text": "Löschungsankündigung\nBayern Amtsgericht München HRB 212094\nDS Connekt GmbH – München",
      "type": "Löschungsankündigung",
      "state": "Bayern",
      "amtsgericht": "Amtsgericht München",
      "registernummer": "HRB 212094",
      "registerart": "HRB",
      "company_name": "DS Connekt GmbH",
      "company_seat": "München",
      "details": "09.07.2025 (Bekanntmachungsdatum)\n\nBayern Amtsgericht München HRB 212094\nLöschungsankündigung\n\nDS Connekt GmbH\nGesellschaft mit beschränkter Haftung\nMünchen\n\nDas Registergericht beabsichtigt, die im Handelsregister eingetragene Gesellschaft wegen Vermögenslosigkeit von Amts wegen nach § 394 FamFG zu löschen. Die Frist zur Erhebung eines Widerspruchs ist auf drei Monate festgesetzt."
    },
    {
      "date": "2025-07-09",
      "id": "115079",
      "original_text": "Sonstige Registerbekanntmachung\nBayern Amtsgericht München HRB 203845\nCANCOM SE – München",
      "type": "Sonstige Registerbekanntmachung",
      "state": "Bayern",
      "amtsgericht": "Amtsgericht München",
      "registernummer": "HRB 203845",
      "registerart": "HRB",
      "company_name": "CANCOM SE",
      "company_seat": "München",
      "details": "09.07.2025 (Bekanntmachungsdatum)\n\nBayern Amtsgericht München HRB 203845\nSonstige Registerbekanntmachung 08.07.2025 (Eintragungsdatum)\n\nCANCOM SE\nEuropäische Aktiengesellschaft (SE)\nMünchen\n\nDen Gläubigern der Gesellschaft, deren Forderungen begründet worden sind, bevor die Eintragung des Beschlusses bekanntgemacht worden ist, ist, wenn sie sich binnen sechs Monaten nach der Bekanntmachung zu diesem Zweck melden, Sicherheit zu leisten, soweit sie nicht Befriedigung verlangen können. Das Recht, Sicherheitsleistung zu verlangen, steht Gläubigern nicht zu, die im Fall des Insolvenzverfahrens ein Recht auf vorzugsweise Befriedigung aus einer Deckungsmasse haben, die nach gesetzlicher Vorschrift zu ihrem Schutz errichtet und staatlich überwacht ist."
    },
    {
      "date": "2025-07-09",
      "id": "115080",
      "original_text": "Registerbekanntmachung nach dem Umwandlungsgesetz\nBayern Amtsgericht Bamberg VR 19\nBamberger Rudergesellschaft von 1884 e. V. – Bamberg",
      "type": "Registerbekanntmachung nach dem Umwandlungsgesetz",
      "state": "Bayern",
      "amtsgericht": "Amtsgericht Bamberg",
      "registernummer": "VR 19",
      "registerart": "VR",
      "company_name": "Bamberger Rudergesellschaft von 1884 e. V.",
      "company_seat": "Bamberg",
      "details": "09.07.2025 (Bekanntmachungsdatum)\n\nBayern Amtsgericht Bamberg VR 19\nRegisterbekanntmachung nach dem Umwandlungsgesetz 08.07.2025 (Eintragungsdatum)\n\nBamberger Rudergesellschaft von 1884 e. V.\neingetragener Verein\nBamberg\n\nDen Gläubigern der an der Verschmelzung beteiligten Rechtsträger ist, wenn sie binnen sechs Monaten nach dem Tag, an dem die Eintragung der Verschmelzung in das Register des Sitzes desjenigen Rechtsträgers, dessen Gläubiger sie sind, nach § 19 Abs. 3 UmwG als bekannt gemacht gilt, ihren Anspruch nach Grund und Höhe in Textform anmelden, Sicherheit zu leisten, soweit sie nicht Befriedigung verlangen können. Dieses Recht steht den Gläubigern jedoch nur zu, wenn sie glaubhaft machen, dass durch die Verschmelzung die Erfüllung ihrer Forderung gefährdet wird."
    },
    {
      "date": "2025-07-09",
      "id": "115081",
      "original_text": "Registerbekanntmachung nach dem Umwandlungsgesetz\nBayern Amtsgericht München HRB 259431\nSozialkonzept Barbarahof GmbH Betriebsgesellschaft sozialer Einrichtungen – München",
      "type": "Registerbekanntmachung nach dem Umwandlungsgesetz",
      "state": "Bayern",
      "amtsgericht": "Amtsgericht München",
      "registernummer": "HRB 259431",
      "registerart": "HRB",
      "company_name": "Sozialkonzept Barbarahof GmbH Betriebsgesellschaft sozialer Einrichtungen",
      "company_seat": "München",
      "details": "09.07.2025 (Bekanntmachungsdatum)\n\nBayern Amtsgericht München HRB 259431\nRegisterbekanntmachung nach dem Umwandlungsgesetz 08.07.2025 (Eintragungsdatum)\n\nSozialkonzept Barbarahof GmbH Betriebsgesellschaft sozialer Einrichtungen\nGesellschaft mit beschränkter Haftung\nMünchen\n\nDen Gläubigern der an der Verschmelzung beteiligten Rechtsträger ist, wenn sie binnen sechs Monaten nach dem Tag, an dem die Eintragung der Verschmelzung in das Register des Sitzes desjenigen Rechtsträgers, dessen Gläubiger sie sind, nach § 19 Abs. 3 UmwG als bekannt gemacht gilt, ihren Anspruch nach Grund und Höhe in Textform anmelden, Sicherheit zu leisten, soweit sie nicht Befriedigung verlangen können. Dieses Recht steht den Gläubigern jedoch nur zu, wenn sie glaubhaft machen, dass durch die Verschmelzung die Erfüllung ihrer Forderung gefährdet wird."
    },
    {
      "date": "2025-07-09",
      "id": "115082",
      "original_text": "Registerbekanntmachung nach dem Umwandlungsgesetz\nBayern Amtsgericht München HRB 96324\nAutodesk GmbH – München",
      "type": "Registerbekanntmachung nach dem Umwandlungsgesetz",
      "state": "Bayern",
      "amtsgericht": "Amtsgericht München",
      "registernummer": "HRB 96324",
      "registerart": "HRB",
      "company_name": "Autodesk GmbH",
      "company_seat": "München",
      "details": "09.07.2025 (Bekanntmachungsdatum)\n\nBayern Amtsgericht München HRB 96324\nRegisterbekanntmachung nach dem Umwandlungsgesetz 08.07.2025 (Eintragungsdatum)\n\nAutodesk GmbH\nGesellschaft mit beschränkter Haftung\nMünchen\n\nDen Gläubigern der an der Verschmelzung beteiligten Rechtsträger ist, wenn sie binnen sechs Monaten nach dem Tag, an dem die Eintragung der Verschmelzung in das Register des Sitzes desjenigen Rechtsträgers, dessen Gläubiger sie sind, nach § 19 Abs. 3 UmwG als bekannt gemacht gilt, ihren Anspruch nach Grund und Höhe in Textform anmelden, Sicherheit zu leisten, soweit sie nicht Befriedigung verlangen können. Dieses Recht steht den Gläubigern jedoch nur zu, wenn sie glaubhaft machen, dass durch die Verschmelzung die Erfüllung ihrer Forderung gefährdet wird."
    },
    {
      "date": "2025-07-09",
      "id": "115083",
      "original_text": "Registerbekanntmachung nach dem Umwandlungsgesetz\nBayern Amtsgericht Bamberg VR 253\nRegatta-Verein-Regnitz – Bamberg",
      "type": "Registerbekanntmachung nach dem Umwandlungsgesetz",
      "state": "Bayern",
      "amtsgericht": "Amtsgericht Bamberg",
      "registernummer": "VR 253",
      "registerart": "VR",
      "company_name": "Regatta-Verein-Regnitz",
      "company_seat": "Bamberg",
      "details": "09.07.2025 (Bekanntmachungsdatum)\n\nBayern Amtsgericht Bamberg VR 253\nRegisterbekanntmachung nach dem Umwandlungsgesetz 08.07.2025 (Eintragungsdatum)\n\nRegatta-Verein-Regnitz\neingetragener Verein\nBamberg\n\nDen Gläubigern der an der Verschmelzung beteiligten Rechtsträger ist, wenn sie binnen sechs Monaten nach dem Tag, an dem die Eintragung der Verschmelzung in das Register des Sitzes desjenigen Rechtsträgers, dessen Gläubiger sie sind, nach § 19 Abs. 3 UmwG als bekannt gemacht gilt, ihren Anspruch nach Grund und Höhe in Textform anmelden, Sicherheit zu leisten, soweit sie nicht Befriedigung verlangen können. Dieses Recht steht den Gläubigern jedoch nur zu, wenn sie glaubhaft machen, dass durch die Verschmelzung die Erfüllung ihrer Forderung gefährdet wird."
    },
    {
      "date": "2025-07-09",
      "id": "115084",
      "original_text": "Einreichung neuer Dokumente\nBayern Amtsgericht München HRB 174695\nViscovery AG – München",
      "type": "Einreichung neuer Dokumente",
      "state": "Bayern",
      "amtsgericht": "Amtsgericht München",
      "registernummer": "HRB 174695",
      "registerart": "HRB",
      "company_name": "Viscovery AG",
      "company_seat": "München",
      "details": "09.07.2025 (Bekanntmachungsdatum)\n\nBayern Amtsgericht München HRB 174695\nEinreichung neuer Dokumente\n\nViscovery AG\nAktiengesellschaft\nMünchen\n\nDem #Re.Name ist eine Liste der Mitglieder des Aufsichtsrats eingereicht worden, § 106 AktG."
    },
    {
      "date": "2025-07-09",
      "id": "115085",
      "original_text": "Registerbekanntmachung nach dem Umwandlungsgesetz\nBayern Amtsgericht München HRB 259463\nSozialkonzept Marienhof GmbH Betriebsgesellschaft sozialer Einrichtungen – München",
      "type": "Registerbekanntmachung nach dem Umwandlungsgesetz",
      "state": "Bayern",
      "amtsgericht": "Amtsgericht München",
      "registernummer": "HRB 259463",
      "registerart": "HRB",
      "company_name": "Sozialkonzept Marienhof GmbH Betriebsgesellschaft sozialer Einrichtungen",
      "company_seat": "München",
      "details": "09.07.2025 (Bekanntmachungsdatum)\n\nBayern Amtsgericht München HRB 259463\nRegisterbekanntmachung nach dem Umwandlungsgesetz 08.07.2025 (Eintragungsdatum)\n\nSozialkonzept Marienhof GmbH Betriebsgesellschaft sozialer Einrichtungen\nGesellschaft mit beschränkter Haftung\nMünchen\n\nDen Gläubigern der an der Verschmelzung beteiligten Rechtsträger ist, wenn sie binnen sechs Monaten nach dem Tag, an dem die Eintragung der Verschmelzung in das Register des Sitzes desjenigen Rechtsträgers, dessen Gläubiger sie sind, nach § 19 Abs. 3 UmwG als bekannt gemacht gilt, ihren Anspruch nach Grund und Höhe in Textform anmelden, Sicherheit zu leisten, soweit sie nicht Befriedigung verlangen können. Dieses Recht steht den Gläubigern jedoch nur zu, wenn sie glaubhaft machen, dass durch die Verschmelzung die Erfüllung ihrer Forderung gefährdet wird."
    },
    {
      "date": "2025-07-09",
      "id": "115086",
      "original_text": "Registerbekanntmachung nach dem Umwandlungsgesetz\nBayern Amtsgericht Augsburg HRA 18981\nUniTED Security Maurer e. K. – Augsburg",
      "type": "Registerbekanntmachung nach dem Umwandlungsgesetz",
      "state": "Bayern",
      "amtsgericht": "Amtsgericht Augsburg",
      "registernummer": "HRA 18981",
      "registerart": "HRA",
      "company_name": "UniTED Security Maurer e. K.",
      "company_seat": "Augsburg",
      "details": "09.07.2025 (Bekanntmachungsdatum)\n\nBayern Amtsgericht Augsburg HRA 18981\nRegisterbekanntmachung nach dem Umwandlungsgesetz 08.07.2025 (Eintragungsdatum)\n\nUniTED Security Maurer e. K.\nEinzelkaufmann / Einzelkauffrau\nAugsburg\n\nDen Gläubigern der an der Ausgliederung beteiligten Rechtsträger ist, wenn sie binnen sechs Monaten nach dem Tag, an dem die Eintragung der Ausgliederung in das Register des Sitzes desjenigen Rechtsträgers, dessen Gläubiger sie sind, nach §§ 125, 19 Abs. 3 UmwG als bekannt gemacht gilt, ihren Anspruch nach Grund und Höhe in Textform anmelden, Sicherheit zu leisten, soweit sie nicht Befriedigung verlangen können. Dieses Recht steht den Gläubigern jedoch nur zu, wenn sie glaubhaft machen, dass durch die Ausgliederung die Erfüllung ihrer Forderung gefährdet wird."
    },
    {
      "date": "2025-07-09",
      "id": "115087",
      "original_text": "Registerbekanntmachung nach dem Umwandlungsgesetz\nBayern Amtsgericht München HRB 176195\nGGS Consulting und Vertriebs GmbH – Eurasburg",
      "type": "Registerbekanntmachung nach dem Umwandlungsgesetz",
      "state": "Bayern",
      "amtsgericht": "Amtsgericht München",
      "registernummer": "HRB 176195",
      "registerart": "HRB",
      "company_name": "GGS Consulting und Vertriebs GmbH",
      "company_seat": "Eurasburg",
      "details": "09.07.2025 (Bekanntmachungsdatum)\n\nBayern Amtsgericht München HRB 176195\nRegisterbekanntmachung nach dem Umwandlungsgesetz 08.07.2025 (Eintragungsdatum)\n\nGGS Consulting und Vertriebs GmbH\nGesellschaft mit beschränkter Haftung\nEurasburg\n\nDen Gläubigern der an der Verschmelzung beteiligten Rechtsträger ist, wenn sie binnen sechs Monaten nach dem Tag, an dem die Eintragung der Verschmelzung in das Register des Sitzes desjenigen Rechtsträgers, dessen Gläubiger sie sind, nach § 19 Abs. 3 UmwG als bekannt gemacht gilt, ihren Anspruch nach Grund und Höhe in Textform anmelden, Sicherheit zu leisten, soweit sie nicht Befriedigung verlangen können. Dieses Recht steht den Gläubigern jedoch nur zu, wenn sie glaubhaft machen, dass durch die Verschmelzung die Erfüllung ihrer Forderung gefährdet wird."
    },
    {
      "date": "2025-07-09",
      "id": "115088",
      "original_text": "Sonstige Registerbekanntmachung\nBayern Amtsgericht München HRB 237558\nSiemens Healthineers AG – München",
      "type": "Sonstige Registerbekanntmachung",
      "state": "Bayern",
      "amtsgericht": "Amtsgericht München",
      "registernummer": "HRB 237558",
      "registerart": "HRB",
      "company_name": "Siemens Healthineers AG",
      "company_seat": "München",
      "details": "09.07.2025 (Bekanntmachungsdatum)\n\nBayern Amtsgericht München HRB 237558\nSonstige Registerbekanntmachung\n\nSiemens Healthineers AG\nAktiengesellschaft\nMünchen\n\nDem #Re.Name ist eine Liste der Mitglieder des Aufsichtsrats eingereicht worden, § 106 AktG."
    },
    {
      "date": "2025-07-09",
      "id": "115089",
      "original_text": "Registerbekanntmachung nach dem Umwandlungsgesetz\nBayern Amtsgericht Nürnberg HRB 3217\nElektro Hofmockel Verwaltungsgesellschaft mit beschränkter Haftung – Rohr",
      "type": "Registerbekanntmachung nach dem Umwandlungsgesetz",
      "state": "Bayern",
      "amtsgericht": "Amtsgericht Nürnberg",
      "registernummer": "HRB 3217",
      "registerart": "HRB",
      "company_name": "Elektro Hofmockel Verwaltungsgesellschaft mit beschränkter Haftung",
      "company_seat": "Rohr",
      "details": "09.07.2025 (Bekanntmachungsdatum)\n\nBayern Amtsgericht Nürnberg HRB 3217\nRegisterbekanntmachung nach dem Umwandlungsgesetz 08.07.2025 (Eintragungsdatum)\n\nElektro Hofmockel Verwaltungsgesellschaft mit beschränkter Haftung\nGesellschaft mit beschränkter Haftung\nRohr\n\nDen Gläubigern der an der Verschmelzung beteiligten Rechtsträger ist, wenn sie binnen sechs Monaten nach dem Tag, an dem die Eintragung der Verschmelzung in das Register des Sitzes desjenigen Rechtsträgers, dessen Gläubiger sie sind, nach § 19 Abs. 3 UmwG als bekannt gemacht gilt, ihren Anspruch nach Grund und Höhe in Textform anmelden, Sicherheit zu leisten, soweit sie nicht Befriedigung verlangen können. Dieses Recht steht den Gläubigern jedoch nur zu, wenn sie glaubhaft machen, dass durch die Verschmelzung die Erfüllung ihrer Forderung gefährdet wird."
    },
    {
      "date": "2025-07-09",
      "id": "115090",
      "original_text": "Löschungsankündigung\nBayern Amtsgericht München HRB 122311\nASITA Lebensmittelhandel GmbH – München",
      "type": "Löschungsankündigung",
      "state": "Bayern",
      "amtsgericht": "Amtsgericht München",
      "registernummer": "HRB 122311",
      "registerart": "HRB",
      "company_name": "ASITA Lebensmittelhandel GmbH",
      "company_seat": "München",
      "details": "09.07.2025 (Bekanntmachungsdatum)\n\nBayern Amtsgericht München HRB 122311\nLöschungsankündigung 08.07.2025 (Eintragungsdatum)\n\nASITA Lebensmittelhandel GmbH\nGesellschaft mit beschränkter Haftung\nMünchen\n\nDas Registergericht beabsichtigt, die im Handelsregister eingetragene Gesellschaft wegen Vermögenslosigkeit von Amts wegen nach § 394 FamFG zu löschen. Die Frist zur Erhebung eines Widerspruchs ist auf drei Monate festgesetzt."
    },
    {
      "date": "2025-07-09",
      "id": "115091",
      "original_text": "Registerbekanntmachung nach dem Umwandlungsgesetz\nBayern Amtsgericht München HRB 112427\nZEPAS Beteiligungs GmbH – Pullach i. Isartal",
      "type": "Registerbekanntmachung nach dem Umwandlungsgesetz",
      "state": "Bayern",
      "amtsgericht": "Amtsgericht München",
      "registernummer": "HRB 112427",
      "registerart": "HRB",
      "company_name": "ZEPAS Beteiligungs GmbH",
      "company_seat": "Pullach i. Isartal",
      "details": "09.07.2025 (Bekanntmachungsdatum)\n\nBayern Amtsgericht München HRB 112427\nRegisterbekanntmachung nach dem Umwandlungsgesetz 08.07.2025 (Eintragungsdatum)\n\nZEPAS Beteiligungs GmbH\nGesellschaft mit beschränkter Haftung\nPullach i. Isartal\n\nDen Gläubigern der an der Verschmelzung beteiligten Rechtsträger ist, wenn sie binnen sechs Monaten nach dem Tag, an dem die Eintragung der Verschmelzung in das Register des Sitzes desjenigen Rechtsträgers, dessen Gläubiger sie sind, nach § 19 Abs. 3 UmwG als bekannt gemacht gilt, ihren Anspruch nach Grund und Höhe in Textform anmelden, Sicherheit zu leisten, soweit sie nicht Befriedigung verlangen können. Dieses Recht steht den Gläubigern jedoch nur zu, wenn sie glaubhaft machen, dass durch die Verschmelzung die Erfüllung ihrer Forderung gefährdet wird."
    },
    {
      "date": "2025-07-09",
      "id": "115092",
      "original_text": "Registerbekanntmachung nach dem Umwandlungsgesetz\nBayern Amtsgericht München HRB 257271\nrehaneo GmbH – München",
      "type": "Registerbekanntmachung nach dem Umwandlungsgesetz",
      "state": "Bayern",
      "amtsgericht": "Amtsgericht München",
      "registernummer": "HRB 257271",
      "registerart": "HRB",
      "company_name": "rehaneo GmbH",
      "company_seat": "München",
      "details": "09.07.2025 (Bekanntmachungsdatum)\n\nBayern Amtsgericht München HRB 257271\nRegisterbekanntmachung nach dem Umwandlungsgesetz 08.07.2025 (Eintragungsdatum)\n\nrehaneo GmbH\nGesellschaft mit beschränkter Haftung\nMünchen\n\nDen Gläubigern der an der Verschmelzung beteiligten Rechtsträger ist, wenn sie binnen sechs Monaten nach dem Tag, an dem die Eintragung der Verschmelzung in das Register des Sitzes desjenigen Rechtsträgers, dessen Gläubiger sie sind, nach § 19 Abs. 3 UmwG als bekannt gemacht gilt, ihren Anspruch nach Grund und Höhe in Textform anmelden, Sicherheit zu leisten, soweit sie nicht Befriedigung verlangen können. Dieses Recht steht den Gläubigern jedoch nur zu, wenn sie glaubhaft machen, dass durch die Verschmelzung die Erfüllung ihrer Forderung gefährdet wird."
    },
    {
      "date": "2025-07-09",
      "id": "115093",
      "original_text": "Registerbekanntmachung nach dem Umwandlungsgesetz\nBayern Amtsgericht München HRB 303724\nESCMID-Fördergesellschaft gGmbH – München",
      "type": "Registerbekanntmachung nach dem Umwandlungsgesetz",
      "state": "Bayern",
      "amtsgericht": "Amtsgericht München",
      "registernummer": "HRB 303724",
      "registerart": "HRB",
      "company_name": "ESCMID-Fördergesellschaft gGmbH",
      "company_seat": "München",
      "details": "09.07.2025 (Bekanntmachungsdatum)\n\nBayern Amtsgericht München HRB 303724\nRegisterbekanntmachung nach dem Umwandlungsgesetz 08.07.2025 (Eintragungsdatum)\n\nESCMID-Fördergesellschaft gGmbH\nGesellschaft mit beschränkter Haftung\nMünchen\n\nDen Gläubigern des formwechselnden Rechtsträgers ist, wenn sie binnen sechs Monaten nach dem Tag, an dem die Eintragung des Formwechsels nach § 201 UmwG als bekannt gemacht gilt, ihren Anspruch nach Grund und Höhe in Textform anmelden, Sicherheit zu leisten, soweit sie nicht Befriedigung verlangen können. Dieses Recht steht den Gläubigern jedoch nur zu, wenn sie glaubhaft machen, dass durch den Formwechsel die Erfüllung ihrer Forderung gefährdet wird."
    },
    {
      "date": "2025-07-09",
      "id": "115094",
      "original_text": "Löschungsankündigung\nBayern Amtsgericht Würzburg HRB 16364\nKrosse-Krabbe-Pizza UG (haftungsbeschränkt) – Würzburg",
      "type": "Löschungsankündigung",
      "state": "Bayern",
      "amtsgericht": "Amtsgericht Würzburg",
      "registernummer": "HRB 16364",
      "registerart": "HRB",
      "company_name": "Krosse-Krabbe-Pizza UG (haftungsbeschränkt)",
      "company_seat": "Würzburg",
      "details": "09.07.2025 (Bekanntmachungsdatum)\n\nBayern Amtsgericht Würzburg HRB 16364\nLöschungsankündigung\n\nKrosse-Krabbe-Pizza UG (haftungsbeschränkt)\nGesellschaft mit beschränkter Haftung\nWürzburg\n\nDas Registergericht beabsichtigt, die im Handelsregister eingetragene Gesellschaft wegen Vermögenslosigkeit von Amts wegen nach § 394 FamFG zu löschen.\nDie Widerspruchsfrist wird auf 3 Monate festgesetzt."
    },
    {
      "date": "2025-07-09",
      "id": "115095",
      "original_text": "Registerbekanntmachung nach dem Umwandlungsgesetz\nBayern Amtsgericht Nürnberg HRB 32574\nHELSPORT GmbH – Nürnberg",
      "type": "Registerbekanntmachung nach dem Umwandlungsgesetz",
      "state": "Bayern",
      "amtsgericht": "Amtsgericht Nürnberg",
      "registernummer": "HRB 32574",
      "registerart": "HRB",
      "company_name": "HELSPORT GmbH",
      "company_seat": "Nürnberg",
      "details": "09.07.2025 (Bekanntmachungsdatum)\n\nBayern Amtsgericht Nürnberg HRB 32574\nRegisterbekanntmachung nach dem Umwandlungsgesetz 08.07.2025 (Eintragungsdatum)\n\nHELSPORT GmbH\nGesellschaft mit beschränkter Haftung\nNürnberg\n\nDen Gläubigern der an der Verschmelzung beteiligten Rechtsträger ist, wenn sie binnen sechs Monaten nach dem Tag, an dem die Eintragung der Verschmelzung in das Register des Sitzes desjenigen Rechtsträgers, dessen Gläubiger sie sind, nach § 19 Abs. 3 UmwG als bekannt gemacht gilt, ihren Anspruch nach Grund und Höhe in Textform anmelden, Sicherheit zu leisten, soweit sie nicht Befriedigung verlangen können. Dieses Recht steht den Gläubigern jedoch nur zu, wenn sie glaubhaft machen, dass durch die Verschmelzung die Erfüllung ihrer Forderung gefährdet wird."
    },
    {
      "date": "2025-07-09",
      "id": "115096",
      "original_text": "Registerbekanntmachung nach dem Umwandlungsgesetz\nBayern Amtsgericht Augsburg HRB 10523\nSchwäbische Neue Presse GmbH – Augsburg",
      "type": "Registerbekanntmachung nach dem Umwandlungsgesetz",
      "state": "Bayern",
      "amtsgericht": "Amtsgericht Augsburg",
      "registernummer": "HRB 10523",
      "registerart": "HRB",
      "company_name": "Schwäbische Neue Presse GmbH",
      "company_seat": "Augsburg",
      "details": "09.07.2025 (Bekanntmachungsdatum)\n\nBayern Amtsgericht Augsburg HRB 10523\nRegisterbekanntmachung nach dem Umwandlungsgesetz 08.07.2025 (Eintragungsdatum)\n\nSchwäbische Neue Presse GmbH\nGesellschaft mit beschränkter Haftung\nAugsburg\n\nDen Gläubigern der an der Verschmelzung beteiligten Rechtsträger ist, wenn sie binnen sechs Monaten nach dem Tag, an dem die Eintragung der Verschmelzung in das Register des Sitzes desjenigen Rechtsträgers, dessen Gläubiger sie sind, nach § 19 Abs. 3 UmwG als bekannt gemacht gilt, ihren Anspruch nach Grund und Höhe in Textform anmelden, Sicherheit zu leisten, soweit sie nicht Befriedigung verlangen können. Dieses Recht steht den Gläubigern jedoch nur zu, wenn sie glaubhaft machen, dass durch die Verschmelzung die Erfüllung ihrer Forderung gefährdet wird."
    },
    {
      "date": "2025-07-09",
      "id": "115097",
      "original_text": "Löschungsankündigung\nBayern Amtsgericht Weiden i. d. OPf. VR 200434\nFreundschaftsverein - Die 6 Germanen e.V. – Falkenberg",
      "type": "Löschungsankündigung",
      "state": "Bayern",
      "amtsgericht": "Amtsgericht Weiden i. d. OPf.",
      "registernummer": "VR 200434",
      "registerart": "VR",
      "company_name": "Freundschaftsverein - Die 6 Germanen e.V.",
      "company_seat": "Falkenberg",
      "details": "09.07.2025 (Bekanntmachungsdatum)\n\nBayern Amtsgericht Weiden i. d. OPf. VR 200434\nLöschungsankündigung\n\nFreundschaftsverein - Die 6 Germanen e.V.\neingetragener Verein\nFalkenberg\n\nDas Registergericht beabsichtigt, den im Vereinsregister eingetragenen Verein von Amts wegen wegen Wegfalls sämtlicher Mitglieder zu löschen. Die Frist zur Erhebung eines Widerspruchs ist auf einen Monat festgesetzt."
    },
    {
      "date": "2025-07-09",
      "id": "115098",
      "original_text": "Löschungsankündigung\nBayern Amtsgericht München HRB 253415\nHSM Transport GmbH – Garching b.München",
      "type": "Löschungsankündigung",
      "state": "Bayern",
      "amtsgericht": "Amtsgericht München",
      "registernummer": "HRB 253415",
      "registerart": "HRB",
      "company_name": "HSM Transport GmbH",
      "company_seat": "Garching b.München",
      "details": "09.07.2025 (Bekanntmachungsdatum)\n\nBayern Amtsgericht München HRB 253415\nLöschungsankündigung 08.07.2025 (Eintragungsdatum)\n\nHSM Transport GmbH\nGesellschaft mit beschränkter Haftung\nGarching b.München\n\nDas Registergericht beabsichtigt, den im Handelsregister eingetragenen Geschäftsführer Safa Samir Majid, geb. 01.09.1978, wegen fehlender Eignung nach § 395 FamFG zu löschen. Die Frist zur Erhebung eines Widerspruchs ist auf drei Monate festgesetzt."
    },
    {
      "date": "2025-07-09",
      "id": "115099",
      "original_text": "Registerbekanntmachung nach dem Umwandlungsgesetz\nBayern Amtsgericht Nürnberg HRB 43510\nHofmockel Automatisierungs- und Prozesstechnik GmbH – Rohr",
      "type": "Registerbekanntmachung nach dem Umwandlungsgesetz",
      "state": "Bayern",
      "amtsgericht": "Amtsgericht Nürnberg",
      "registernummer": "HRB 43510",
      "registerart": "HRB",
      "company_name": "Hofmockel Automatisierungs- und Prozesstechnik GmbH",
      "company_seat": "Rohr",
      "details": "09.07.2025 (Bekanntmachungsdatum)\n\nBayern Amtsgericht Nürnberg HRB 43510\nRegisterbekanntmachung nach dem Umwandlungsgesetz 08.07.2025 (Eintragungsdatum)\n\nHofmockel Automatisierungs- und Prozesstechnik GmbH\nGesellschaft mit beschränkter Haftung\nRohr\n\nDen Gläubigern der an der Verschmelzung beteiligten Rechtsträger ist, wenn sie binnen sechs Monaten nach dem Tag, an dem die Eintragung der Verschmelzung in das Register des Sitzes desjenigen Rechtsträgers, dessen Gläubiger sie sind, nach § 19 Abs. 3 UmwG als bekannt gemacht gilt, ihren Anspruch nach Grund und Höhe in Textform anmelden, Sicherheit zu leisten, soweit sie nicht Befriedigung verlangen können. Dieses Recht steht den Gläubigern jedoch nur zu, wenn sie glaubhaft machen, dass durch die Verschmelzung die Erfüllung ihrer Forderung gefährdet wird."
    },
    {
      "date": "2025-07-09",
      "id": "115100",
      "original_text": "Registerbekanntmachung nach dem Umwandlungsgesetz\nBayern Amtsgericht Augsburg HRB 40947\nUNI-TED Security GmbH – Augsburg",
      "type": "Registerbekanntmachung nach dem Umwandlungsgesetz",
      "state": "Bayern",
      "amtsgericht": "Amtsgericht Augsburg",
      "registernummer": "HRB 40947",
      "registerart": "HRB",
      "company_name": "UNI-TED Security GmbH",
      "company_seat": "Augsburg",
      "details": "09.07.2025 (Bekanntmachungsdatum)\n\nBayern Amtsgericht Augsburg HRB 40947\nRegisterbekanntmachung nach dem Umwandlungsgesetz 08.07.2025 (Eintragungsdatum)\n\nUNI-TED Security GmbH\nGesellschaft mit beschränkter Haftung\nAugsburg\n\nDen Gläubigern der an der Ausgliederung beteiligten Rechtsträger ist, wenn sie binnen sechs Monaten nach dem Tag, an dem die Eintragung der Ausgliederung in das Register des Sitzes desjenigen Rechtsträgers, dessen Gläubiger sie sind, nach §§ 125, 19 Abs. 3 UmwG als bekannt gemacht gilt, ihren Anspruch nach Grund und Höhe in Textform anmelden, Sicherheit zu leisten, soweit sie nicht Befriedigung verlangen können. Dieses Recht steht den Gläubigern jedoch nur zu, wenn sie glaubhaft machen, dass durch die Ausgliederung die Erfüllung ihrer Forderung gefährdet wird."
    },
    {
      "date": "2025-07-09",
      "id": "115101",
      "original_text": "Registerbekanntmachung nach dem Umwandlungsgesetz\nBayern Amtsgericht München HRB 303758\nKinderessen Krag GmbH – Garching b.München",
      "type": "Registerbekanntmachung nach dem Umwandlungsgesetz",
      "state": "Bayern",
      "amtsgericht": "Amtsgericht München",
      "registernummer": "HRB 303758",
      "registerart": "HRB",
      "company_name": "Kinderessen Krag GmbH",
      "company_seat": "Garching b.München",
      "details": "09.07.2025 (Bekanntmachungsdatum)\n\nBayern Amtsgericht München HRB 303758\nRegisterbekanntmachung nach dem Umwandlungsgesetz 08.07.2025 (Eintragungsdatum)\n\nKinderessen Krag GmbH\nGesellschaft mit beschränkter Haftung\nGarching b.München\n\nDen Gläubigern der an der Ausgliederung beteiligten Rechtsträger ist, wenn sie binnen sechs Monaten nach dem Tag, an dem die Eintragung der Ausgliederung in das Register des Sitzes desjenigen Rechtsträgers, dessen Gläubiger sie sind, nach §§ 125, 19 Abs. 3 UmwG als bekannt gemacht gilt, ihren Anspruch nach Grund und Höhe in Textform anmelden, Sicherheit zu leisten, soweit sie nicht Befriedigung verlangen können. Dieses Recht steht den Gläubigern jedoch nur zu, wenn sie glaubhaft machen, dass durch die Ausgliederung die Erfüllung ihrer Forderung gefährdet wird."
    },
    {
      "date": "2025-07-09",
      "id": "115102",
      "original_text": "Registerbekanntmachung nach dem Umwandlungsgesetz\nBayern Amtsgericht Augsburg HRB 24333\nAmmersee Kurier Verwaltungs-GmbH – Dießen am Ammersee",
      "type": "Registerbekanntmachung nach dem Umwandlungsgesetz",
      "state": "Bayern",
      "amtsgericht": "Amtsgericht Augsburg",
      "registernummer": "HRB 24333",
      "registerart": "HRB",
      "company_name": "Ammersee Kurier Verwaltungs-GmbH",
      "company_seat": "Dießen am Ammersee",
      "details": "09.07.2025 (Bekanntmachungsdatum)\n\nBayern Amtsgericht Augsburg HRB 24333\nRegisterbekanntmachung nach dem Umwandlungsgesetz 08.07.2025 (Eintragungsdatum)\n\nAmmersee Kurier Verwaltungs-GmbH\nGesellschaft mit beschränkter Haftung\nDießen am Ammersee\n\nDen Gläubigern der an der Verschmelzung beteiligten Rechtsträger ist, wenn sie binnen sechs Monaten nach dem Tag, an dem die Eintragung der Verschmelzung in das Register des Sitzes desjenigen Rechtsträgers, dessen Gläubiger sie sind, nach § 19 Abs. 3 UmwG als bekannt gemacht gilt, ihren Anspruch nach Grund und Höhe in Textform anmelden, Sicherheit zu leisten, soweit sie nicht Befriedigung verlangen können. Dieses Recht steht den Gläubigern jedoch nur zu, wenn sie glaubhaft machen, dass durch die Verschmelzung die Erfüllung ihrer Forderung gefährdet wird."
    },
    {
      "date": "2025-07-09",
      "id": "115103",
      "original_text": "Registerbekanntmachung nach dem Umwandlungsgesetz\nBayern Amtsgericht Augsburg HRB 18166\nPDV Vermögensverwaltungs GmbH – Augsburg",
      "type": "Registerbekanntmachung nach dem Umwandlungsgesetz",
      "state": "Bayern",
      "amtsgericht": "Amtsgericht Augsburg",
      "registernummer": "HRB 18166",
      "registerart": "HRB",
      "company_name": "PDV Vermögensverwaltungs GmbH",
      "company_seat": "Augsburg",
      "details": "09.07.2025 (Bekanntmachungsdatum)\n\nBayern Amtsgericht Augsburg HRB 18166\nRegisterbekanntmachung nach dem Umwandlungsgesetz 08.07.2025 (Eintragungsdatum)\n\nPDV Vermögensverwaltungs GmbH\nGesellschaft mit beschränkter Haftung\nAugsburg\n\nDen Gläubigern der an der Verschmelzung beteiligten Rechtsträger ist, wenn sie binnen sechs Monaten nach dem Tag, an dem die Eintragung der Verschmelzung in das Register des Sitzes desjenigen Rechtsträgers, dessen Gläubiger sie sind, nach § 19 Abs. 3 UmwG als bekannt gemacht gilt, ihren Anspruch nach Grund und Höhe in Textform anmelden, Sicherheit zu leisten, soweit sie nicht Befriedigung verlangen können. Dieses Recht steht den Gläubigern jedoch nur zu, wenn sie glaubhaft machen, dass durch die Verschmelzung die Erfüllung ihrer Forderung gefährdet wird."
    },
    {
      "date": "2025-07-09",
      "id": "115104",
      "original_text": "Registerbekanntmachung nach dem Umwandlungsgesetz\nBayern Amtsgericht Hof HRB 5189\nNeutex Betriebs GmbH – Münchberg",
      "type": "Registerbekanntmachung nach dem Umwandlungsgesetz",
      "state": "Bayern",
      "amtsgericht": "Amtsgericht Hof",
      "registernummer": "HRB 5189",
      "registerart": "HRB",
      "company_name": "Neutex Betriebs GmbH",
      "company_seat": "Münchberg",
      "details": "09.07.2025 (Bekanntmachungsdatum)\n\nBayern Amtsgericht Hof HRB 5189\nRegisterbekanntmachung nach dem Umwandlungsgesetz 08.07.2025 (Eintragungsdatum)\n\nNeutex Betriebs GmbH\nGesellschaft mit beschränkter Haftung\nMünchberg\n\nDen Gläubigern der an der Verschmelzung beteiligten Rechtsträger ist, wenn sie binnen sechs Monaten nach dem Tag, an dem die Eintragung der Verschmelzung in das Register des Sitzes desjenigen Rechtsträgers, dessen Gläubiger sie sind, nach § 19 Abs. 3 UmwG als bekannt gemacht gilt, ihren Anspruch nach Grund und Höhe in Textform anmelden, Sicherheit zu leisten, soweit sie nicht Befriedigung verlangen können. Dieses Recht steht den Gläubigern jedoch nur zu, wenn sie glaubhaft machen, dass durch die Verschmelzung die Erfüllung ihrer Forderung gefährdet wird."
    },
    {
      "date": "2025-07-09",
      "id": "115105",
      "original_text": "Registerbekanntmachung nach dem Umwandlungsgesetz\nBayern Amtsgericht Augsburg HRB 6034\nPresse-Druck- und Verlags-GmbH – Augsburg",
      "type": "Registerbekanntmachung nach dem Umwandlungsgesetz",
      "state": "Bayern",
      "amtsgericht": "Amtsgericht Augsburg",
      "registernummer": "HRB 6034",
      "registerart": "HRB",
      "company_name": "Presse-Druck- und Verlags-GmbH",
      "company_seat": "Augsburg",
      "details": "09.07.2025 (Bekanntmachungsdatum)\n\nBayern Amtsgericht Augsburg HRB 6034\nRegisterbekanntmachung nach dem Umwandlungsgesetz 08.07.2025 (Eintragungsdatum)\n\nPresse-Druck- und Verlags-GmbH\nGesellschaft mit beschränkter Haftung\nAugsburg\n\nDen Gläubigern der an der Verschmelzung beteiligten Rechtsträger ist, wenn sie binnen sechs Monaten nach dem Tag, an dem die Eintragung der Verschmelzung in das Register des Sitzes desjenigen Rechtsträgers, dessen Gläubiger sie sind, nach § 19 Abs. 3 UmwG als bekannt gemacht gilt, ihren Anspruch nach Grund und Höhe in Textform anmelden, Sicherheit zu leisten, soweit sie nicht Befriedigung verlangen können. Dieses Recht steht den Gläubigern jedoch nur zu, wenn sie glaubhaft machen, dass durch die Verschmelzung die Erfüllung ihrer Forderung gefährdet wird."
    },
    {
      "date": "2025-07-09",
      "id": "115106",
      "original_text": "Registerbekanntmachung nach dem Umwandlungsgesetz\nBayern Amtsgericht Hof HRB 2440\nNeutex Home Deco GmbH – Münchberg",
      "type": "Registerbekanntmachung nach dem Umwandlungsgesetz",
      "state": "Bayern",
      "amtsgericht": "Amtsgericht Hof",
      "registernummer": "HRB 2440",
      "registerart": "HRB",
      "company_name": "Neutex Home Deco GmbH",
      "company_seat": "Münchberg",
      "details": "09.07.2025 (Bekanntmachungsdatum)\n\nBayern Amtsgericht Hof HRB 2440\nRegisterbekanntmachung nach dem Umwandlungsgesetz 08.07.2025 (Eintragungsdatum)\n\nNeutex Home Deco GmbH\nGesellschaft mit beschränkter Haftung\nMünchberg\n\nDen Gläubigern der an der Verschmelzung beteiligten Rechtsträger ist, wenn sie binnen sechs Monaten nach dem Tag, an dem die Eintragung der Verschmelzung in das Register des Sitzes desjenigen Rechtsträgers, dessen Gläubiger sie sind, nach § 19 Abs. 3 UmwG als bekannt gemacht gilt, ihren Anspruch nach Grund und Höhe in Textform anmelden, Sicherheit zu leisten, soweit sie nicht Befriedigung verlangen können. Dieses Recht steht den Gläubigern jedoch nur zu, wenn sie glaubhaft machen, dass durch die Verschmelzung die Erfüllung ihrer Forderung gefährdet wird."
    },
    {
      "date": "2025-07-09",
      "id": "115107",
      "original_text": "Registerbekanntmachung nach dem Umwandlungsgesetz\nBayern Amtsgericht München HRB 285565\nWTS Tax AG – München",
      "type": "Registerbekanntmachung nach dem Umwandlungsgesetz",
      "state": "Bayern",
      "amtsgericht": "Amtsgericht München",
      "registernummer": "HRB 285565",
      "registerart": "HRB",
      "company_name": "WTS Tax AG",
      "company_seat": "München",
      "details": "09.07.2025 (Bekanntmachungsdatum)\n\nBayern Amtsgericht München HRB 285565\nRegisterbekanntmachung nach dem Umwandlungsgesetz 08.07.2025 (Eintragungsdatum)\n\nWTS Tax AG\nAktiengesellschaft\nMünchen\n\nDen Gläubigern der an der Ausgliederung beteiligten Rechtsträger ist, wenn sie binnen sechs Monaten nach dem Tag, an dem die Eintragung der Ausgliederung in das Register des Sitzes desjenigen Rechtsträgers, dessen Gläubiger sie sind, nach §§ 125, 19 Abs. 3 UmwG als bekannt gemacht gilt, ihren Anspruch nach Grund und Höhe in Textform anmelden, Sicherheit zu leisten, soweit sie nicht Befriedigung verlangen können. Dieses Recht steht den Gläubigern jedoch nur zu, wenn sie glaubhaft machen, dass durch die Ausgliederung die Erfüllung ihrer Forderung gefährdet wird."
    },
    {
      "date": "2025-07-09",
      "id": "115108",
      "original_text": "Registerbekanntmachung nach dem Umwandlungsgesetz\nBerlin Amtsgericht Berlin (Charlottenburg) HRB 260510\nWALL-E Fleet GmbH – Berlin",
      "type": "Registerbekanntmachung nach dem Umwandlungsgesetz",
      "state": "Berlin",
      "amtsgericht": "Amtsgericht Berlin (Charlottenburg)",
      "registernummer": "HRB 260510",
      "registerart": "HRB",
      "company_name": "WALL-E Fleet GmbH",
      "company_seat": "Berlin",
      "details": "09.07.2025 (Bekanntmachungsdatum)\n\nBerlin Amtsgericht Berlin (Charlottenburg) HRB 260510\nRegisterbekanntmachung nach dem Umwandlungsgesetz 08.07.2025 (Eintragungsdatum)\n\nWALL-E Fleet GmbH\nGesellschaft mit beschränkter Haftung\nBerlin\n\nZu Eintragungsnummer 4 vom 08.07.2025 wird als nicht eingetragen veröffentlicht: Den Gläubigern der an der Spaltung beteiligten Rechtsträger ist, wenn sie binnen sechs Monaten nach dem Tag, an dem die Eintragung der Spaltung in das Register des Sitzes desjenigen Rechtsträgers, dessen Gläubiger sie sind, als bekannt gemacht gilt, ihren Anspruch nach Grund und Höhe schriftlich anmelden, Sicherheit zu leisten, soweit sie nicht Befriedigung verlangen können. Dieses Recht steht den Gläubigern jedoch nur zu, wenn sie glaubhaft machen, dass durch die Spaltung die Erfüllung ihrer Forderung gefährdet wird. Das Recht, Sicherheitsleistung zu verlangen, steht Gläubigern nicht zu, die im Falle der Insolvenz ein Recht auf vorzugsweise Befriedigung aus einer Deckungsmasse haben, die nach gesetzlicher Vorschrift zu ihrem Schutz errichtet und staatlich überwacht ist."
    },
    {
      "date": "2025-07-09",
      "id": "115109",
      "original_text": "Registerbekanntmachung nach dem Umwandlungsgesetz\nBaden-Württemberg Amtsgericht Mannheim HRB 746906\nBIT Energy GmbH – Sternenfels",
      "type": "Registerbekanntmachung nach dem Umwandlungsgesetz",
      "state": "Baden-Württemberg",
      "amtsgericht": "Amtsgericht Mannheim",
      "registernummer": "HRB 746906",
      "registerart": "HRB",
      "company_name": "BIT Energy GmbH",
      "company_seat": "Sternenfels",
      "details": "09.07.2025 (Bekanntmachungsdatum)\n\nBaden-Württemberg Amtsgericht Mannheim HRB 746906\nRegisterbekanntmachung nach dem Umwandlungsgesetz 09.07.2025 (Eintragungsdatum)\n\nBIT Energy GmbH\nGesellschaft mit beschränkter Haftung\nSternenfels\n\nAls nicht eingetragen wird bekanntgemacht:\nDen Gläubigern der an der Verschmelzung beteiligten Rechtsträger ist, wenn sie binnen sechs Monaten nach dem Tag, an dem die Eintragung der Verschmelzung in das Register des Sitzes desjenigen Rechtsträgers, dessen Gläubiger sie sind, nach § 19 Abs. 3 UmwG als bekanntgemacht gilt, ihren Anspruch nach Grund und Höhe schriftlich anmelden, Sicherheit zu leisten, soweit sie nicht Befriedigung verlangen können. Dieses Recht steht den Gläubigern jedoch nur zu, wenn sie glaubhaft machen, dass durch die Verschmelzung die Erfüllung ihrer Forderung gefährdet wird."
    },
    {
      "date": "2025-07-09",
      "id": "115110",
      "original_text": "Registerbekanntmachung nach dem Umwandlungsgesetz\nBerlin Amtsgericht Berlin (Charlottenburg) HRB 151334\nVidRockz Media GmbH – Berlin",
      "type": "Registerbekanntmachung nach dem Umwandlungsgesetz",
      "state": "Berlin",
      "amtsgericht": "Amtsgericht Berlin (Charlottenburg)",
      "registernummer": "HRB 151334",
      "registerart": "HRB",
      "company_name": "VidRockz Media GmbH",
      "company_seat": "Berlin",
      "details": "09.07.2025 (Bekanntmachungsdatum)\n\nBerlin Amtsgericht Berlin (Charlottenburg) HRB 151334\nRegisterbekanntmachung nach dem Umwandlungsgesetz 08.07.2025 (Eintragungsdatum)\n\nVidRockz Media GmbH\nGesellschaft mit beschränkter Haftung\nBerlin\n\nZu Eintragungsnummer 8 vom 08.07.2025 wird als nicht eingetragen veröffentlicht: Den Gläubigern der an der Verschmelzung beteiligten Rechtsträger ist, wenn sie binnen sechs Monaten nach dem Tag, an dem die Eintragung der Verschmelzung in das Register des Sitzes desjenigen Rechtsträgers, dessen Gläubiger sie sind, als bekannt gemacht gilt, ihren Anspruch nach Grund und Höhe schriftlich anmelden, Sicherheit zu leisten, soweit sie nicht Befriedigung verlangen können. Dieses Recht steht den Gläubigern jedoch nur zu, wenn sie glaubhaft machen, dass durch die Verschmelzung die Erfüllung ihrer Forderung gefährdet wird. Das Recht, Sicherheitsleistung zu verlangen, steht Gläubigern nicht zu, die im Falle der Insolvenz ein Recht auf vorzugsweise Befriedigung aus einer Deckungsmasse haben, die nach gesetzlicher Vorschrift zu ihrem Schutz errichtet und staatlich überwacht ist."
    },
    {
      "date": "2025-07-09",
      "id": "115111",
      "original_text": "Löschungsankündigung\nBerlin Amtsgericht Berlin (Charlottenburg) HRB 239667\nKamen Hoch- und Tiefbau GmbH – Berlin",
      "type": "Löschungsankündigung",
      "state": "Berlin",
      "amtsgericht": "Amtsgericht Berlin (Charlottenburg)",
      "registernummer": "HRB 239667",
      "registerart": "HRB",
      "company_name": "Kamen Hoch- und Tiefbau GmbH",
      "company_seat": "Berlin",
      "details": "09.07.2025 (Bekanntmachungsdatum)\n\nBerlin Amtsgericht Berlin (Charlottenburg) HRB 239667\nLöschungsankündigung\n\nKamen Hoch- und Tiefbau GmbH\nGesellschaft mit beschränkter Haftung\nBerlin\n\nBei der nachstehenden Gesellschaft wird das Amtslöschungsverfahren gemäß § 394 FamFG eingeleitet. Widerspruchsfrist 6 Wochen"
    },
    {
      "date": "2025-07-09",
      "id": "115112",
      "original_text": "Sonstige Registerbekanntmachung\nSchleswig-Holstein Amtsgericht Flensburg HRB 17455\nnetworker variant GmbH – Wenningstedt-Braderup",
      "type": "Sonstige Registerbekanntmachung",
      "state": "Schleswig-Holstein",
      "amtsgericht": "Amtsgericht Flensburg",
      "registernummer": "HRB 17455",
      "registerart": "HRB",
      "company_name": "networker variant GmbH",
      "company_seat": "Wenningstedt-Braderup",
      "details": "09.07.2025 (Bekanntmachungsdatum)\n\nSchleswig-Holstein Amtsgericht Flensburg HRB 17455\nSonstige Registerbekanntmachung\n\nnetworker variant GmbH\nGesellschaft mit beschränkter Haftung\nWenningstedt-Braderup\n\nAls nicht eingetragen wird veröffentlicht: Den Gläubigern der an der Spaltung beteiligten Rechtsträger ist, wenn sie binnen sechs Monaten nach dem Tag, an dem die Eintragung der Spaltung in das Register des Sitzes desjenigen Rechtsträgers, dessen Gläubiger sie sind, als bekannt gemacht gilt, ihren Anspruch nach Grund und Höhe schriftlich anmelden, Sicherheit zu leisten, soweit sie nicht Befriedigung verlangen können. Dieses Recht steht den Gläubigern jedoch nur zu, wenn sie glaubhaft machen, dass durch die Spaltung die Erfüllung ihrer Forderung gefährdet wird. Das Recht, Sicherheitsleistung zu verlangen, steht Gläubigern nicht zu, die im Falle der Insolvenz ein Recht auf vorzugsweise Befriedigung aus einer Deckungsmasse haben, die nach gesetzlicher Vorschrift zu ihrem Schutz errichtet und staatlich überwacht ist."
    },
    {
      "date": "2025-07-09",
      "id": "115113",
      "original_text": "Registerbekanntmachung nach dem Umwandlungsgesetz\nBaden-Württemberg Amtsgericht Freiburg HRB 718967\nf.u.n.k.e. TOOLS & SERVICES GmbH – Teningen",
      "type": "Registerbekanntmachung nach dem Umwandlungsgesetz",
      "state": "Baden-Württemberg",
      "amtsgericht": "Amtsgericht Freiburg",
      "registernummer": "HRB 718967",
      "registerart": "HRB",
      "company_name": "f.u.n.k.e. TOOLS & SERVICES GmbH",
      "company_seat": "Teningen",
      "details": "09.07.2025 (Bekanntmachungsdatum)\n\nBaden-Württemberg Amtsgericht Freiburg HRB 718967\nRegisterbekanntmachung nach dem Umwandlungsgesetz 09.07.2025 (Eintragungsdatum)\n\nf.u.n.k.e. TOOLS & SERVICES GmbH\nGesellschaft mit beschränkter Haftung\nTeningen\n\nAls nicht eingetragen wird bekanntgemacht:\nDen Gläubigern der an der Verschmelzung beteiligten Rechtsträger ist, wenn sie binnen sechs Monaten nach dem Tag, an dem die Eintragung der Verschmelzung in das Register des Sitzes desjenigen Rechtsträgers, dessen Gläubiger sie sind, nach § 19 Abs. 3 UmwG als bekanntgemacht gilt, ihren Anspruch nach Grund und Höhe schriftlich anmelden, Sicherheit zu leisten, soweit sie nicht Befriedigung verlangen können. Dieses Recht steht den Gläubigern jedoch nur zu, wenn sie glaubhaft machen, dass durch die Verschmelzung die Erfüllung ihrer Forderung gefährdet wird."
    },
    {
      "date": "2025-07-09",
      "id": "115114",
      "original_text": "Registerbekanntmachung nach dem Umwandlungsgesetz\nBaden-Württemberg Amtsgericht Freiburg HRB 711367\nf.u.n.k.e. SENERGIE GmbH – Teningen",
      "type": "Registerbekanntmachung nach dem Umwandlungsgesetz",
      "state": "Baden-Württemberg",
      "amtsgericht": "Amtsgericht Freiburg",
      "registernummer": "HRB 711367",
      "registerart": "HRB",
      "company_name": "f.u.n.k.e. SENERGIE GmbH",
      "company_seat": "Teningen",
      "details": "09.07.2025 (Bekanntmachungsdatum)\n\nBaden-Württemberg Amtsgericht Freiburg HRB 711367\nRegisterbekanntmachung nach dem Umwandlungsgesetz 09.07.2025 (Eintragungsdatum)\n\nf.u.n.k.e. SENERGIE GmbH\nGesellschaft mit beschränkter Haftung\nTeningen\n\nAls nicht eingetragen wird bekanntgemacht:\nDen Gläubigern der an der Verschmelzung beteiligten Rechtsträger ist, wenn sie binnen sechs Monaten nach dem Tag, an dem die Eintragung der Verschmelzung in das Register des Sitzes desjenigen Rechtsträgers, dessen Gläubiger sie sind, nach § 19 Abs. 3 UmwG als bekanntgemacht gilt, ihren Anspruch nach Grund und Höhe schriftlich anmelden, Sicherheit zu leisten, soweit sie nicht Befriedigung verlangen können. Dieses Recht steht den Gläubigern jedoch nur zu, wenn sie glaubhaft machen, dass durch die Verschmelzung die Erfüllung ihrer Forderung gefährdet wird."
    },
    {
      "date": "2025-07-09",
      "id": "115115",
      "original_text": "Einreichung neuer Dokumente\nBaden-Württemberg Amtsgericht Stuttgart HRB 104627\nFG FINANZ-SERVICE Aktiengesellschaft – Heilbronn",
      "type": "Einreichung neuer Dokumente",
      "state": "Baden-Württemberg",
      "amtsgericht": "Amtsgericht Stuttgart",
      "registernummer": "HRB 104627",
      "registerart": "HRB",
      "company_name": "FG FINANZ-SERVICE Aktiengesellschaft",
      "company_seat": "Heilbronn",
      "details": "09.07.2025 (Bekanntmachungsdatum)\n\nBaden-Württemberg Amtsgericht Stuttgart HRB 104627\nEinreichung neuer Dokumente\n\nFG FINANZ-SERVICE Aktiengesellschaft\nAktiengesellschaft\nHeilbronn\n\nDie Gesellschaft hat am 04.07.2025 die Liste über die Zusammensetzung des Aufsichtsrats zum Handelsregister eingereicht."
    },
    {
      "date": "2025-07-09",
      "id": "115116",
      "original_text": "Löschungsankündigung\nSchleswig-Holstein Amtsgericht Flensburg HRB 13244\nNorth Worker Germany UG (haftungsbeschränkt) – Glücksburg",
      "type": "Löschungsankündigung",
      "state": "Schleswig-Holstein",
      "amtsgericht": "Amtsgericht Flensburg",
      "registernummer": "HRB 13244",
      "registerart": "HRB",
      "company_name": "North Worker Germany UG (haftungsbeschränkt)",
      "company_seat": "Glücksburg",
      "details": "09.07.2025 (Bekanntmachungsdatum)\n\nSchleswig-Holstein Amtsgericht Flensburg HRB 13244\nLöschungsankündigung\n\nNorth Worker Germany UG (haftungsbeschränkt)\nGesellschaft mit beschränkter Haftung\nGlücksburg\n\nEs ist die Löschung der nachstehenden Gesellschaft wegen Vermögenslosigkeit gemäß § 394 FamFG beabsichtigt.\nWiderspruchsfrist: 2 Monate"
    },
    {
      "date": "2025-07-09",
      "id": "115117",
      "original_text": "Registerbekanntmachung nach dem Umwandlungsgesetz\nSchleswig-Holstein Amtsgericht Kiel HRB 17127\nVOVIS Car Fleetmanagement GmbH – Rendsburg",
      "type": "Registerbekanntmachung nach dem Umwandlungsgesetz",
      "state": "Schleswig-Holstein",
      "amtsgericht": "Amtsgericht Kiel",
      "registernummer": "HRB 17127",
      "registerart": "HRB",
      "company_name": "VOVIS Car Fleetmanagement GmbH",
      "company_seat": "Rendsburg",
      "details": "09.07.2025 (Bekanntmachungsdatum)\n\nSchleswig-Holstein Amtsgericht Kiel HRB 17127\nRegisterbekanntmachung nach dem Umwandlungsgesetz 07.07.2025 (Eintragungsdatum)\n\nVOVIS Car Fleetmanagement GmbH\nGesellschaft mit beschränkter Haftung\nRendsburg\n\nZu Eintragungsnummer 7 vom 07.07.2025 wird als nicht eingetragen veröffentlicht: Den Gläubigern der an der Verschmelzung beteiligten Rechtsträger ist, wenn sie binnen sechs Monaten nach dem Tag, an dem die Eintragung der Verschmelzung in das Register des Sitzes desjenigen Rechtsträgers, dessen Gläubiger sie sind, nach § 19 Abs. 3 UmwG bekannt gemacht worden ist, ihren Anspruch nach Grund und Höhe schriftlich anmelden, Sicherheit zu leisten, soweit sie nicht Befriedigung verlangen können. Dieses Recht steht den Gläubigern jedoch nur zu, wenn sie glaubhaft machen, dass durch die Verschmelzung die Erfüllung ihrer Forderung gefährdet wird."
    },
    {
      "date": "2025-07-09",
      "id": "115118",
      "original_text": "Löschungsankündigung\nBerlin Amtsgericht Berlin (Charlottenburg) HRB 239182\nSayyara Line UG (haftungsbeschränkt) – Berlin",
      "type": "Löschungsankündigung",
      "state": "Berlin",
      "amtsgericht": "Amtsgericht Berlin (Charlottenburg)",
      "registernummer": "HRB 239182",
      "registerart": "HRB",
      "company_name": "Sayyara Line UG (haftungsbeschränkt)",
      "company_seat": "Berlin",
      "details": "09.07.2025 (Bekanntmachungsdatum)\n\nBerlin Amtsgericht Berlin (Charlottenburg) HRB 239182\nLöschungsankündigung\n\nSayyara Line UG (haftungsbeschränkt)\nGesellschaft mit beschränkter Haftung\nBerlin\n\nBei der nachstehenden Gesellschaft wird das Amtslöschungsverfahren gemäß § 394 FamFG eingeleitet. Widerspruchsfrist 6 Wochen"
    },
    {
      "date": "2025-07-09",
      "id": "115119",
      "original_text": "Registerbekanntmachung nach dem Umwandlungsgesetz\nBaden-Württemberg Amtsgericht Stuttgart HRB 481077\nJoachim Glatthaar GmbH – Schramberg",
      "type": "Registerbekanntmachung nach dem Umwandlungsgesetz",
      "state": "Baden-Württemberg",
      "amtsgericht": "Amtsgericht Stuttgart",
      "registernummer": "HRB 481077",
      "registerart": "HRB",
      "company_name": "Joachim Glatthaar GmbH",
      "company_seat": "Schramberg",
      "details": "09.07.2025 (Bekanntmachungsdatum)\n\nBaden-Württemberg Amtsgericht Stuttgart HRB 481077\nRegisterbekanntmachung nach dem Umwandlungsgesetz 09.07.2025 (Eintragungsdatum)\n\nJoachim Glatthaar GmbH\nGesellschaft mit beschränkter Haftung\nSchramberg\n\nDen Gläubigern der an der Verschmelzung beteiligten Rechtsträger ist, wenn sie binnen sechs Monaten nach dem Tag, an dem die Eintragung der Verschmelzung in das Register des Sitzes desjenigen Rechtsträgers, dessen Gläubiger sie sind, nach § 19 Abs. 3 UmwG als bekanntgemacht gilt, ihren Anspruch nach Grund und Höhe schriftlich anmelden, Sicherheit zu leisten, soweit sie nicht Befriedigung verlangen können. Dieses Recht steht den Gläubigern jedoch nur zu, wenn sie glaubhaft machen, dass durch die Verschmelzung die Erfüllung ihrer Forderung gefährdet wird."
    },
    {
      "date": "2025-07-09",
      "id": "115120",
      "original_text": "Registerbekanntmachung nach dem Umwandlungsgesetz\nMecklenburg-Vorpommern Amtsgericht Rostock HRA 5531\nUGE Kleinpaschleben Zwei GmbH & Co. KG Umweltgerechte Energie – Lohmen",
      "type": "Registerbekanntmachung nach dem Umwandlungsgesetz",
      "state": "Mecklenburg-Vorpommern",
      "amtsgericht": "Amtsgericht Rostock",
      "registernummer": "HRA 5531",
      "registerart": "HRA",
      "company_name": "UGE Kleinpaschleben Zwei GmbH & Co. KG Umweltgerechte Energie",
      "company_seat": "Lohmen",
      "details": "09.07.2025 (Bekanntmachungsdatum)\n\nMecklenburg-Vorpommern Amtsgericht Rostock HRA 5531\nRegisterbekanntmachung nach dem Umwandlungsgesetz 09.07.2025 (Eintragungsdatum)\n\nUGE Kleinpaschleben Zwei GmbH & Co. KG Umweltgerechte Energie\nKommanditgesellschaft\nLohmen\n\nDie Gesellschaft hat Gläubigern, deren Forderungen vor dieser Bekanntmachung begründet worden sind, Sicherheit zu leisten, soweit sie nicht Befriedigung verlangen können, wenn sie sich binnen sechs Monaten zu diesem Zweck melden."
    },
    {
      "date": "2025-07-09",
      "id": "115121",
      "original_text": "Registerbekanntmachung nach dem Umwandlungsgesetz\nHamburg Amtsgericht Hamburg HRB 183104\nNetzkontor GmbH – Hamburg",
      "type": "Registerbekanntmachung nach dem Umwandlungsgesetz",
      "state": "Hamburg",
      "amtsgericht": "Amtsgericht Hamburg",
      "registernummer": "HRB 183104",
      "registerart": "HRB",
      "company_name": "Netzkontor GmbH",
      "company_seat": "Hamburg",
      "details": "09.07.2025 (Bekanntmachungsdatum)\n\nHamburg Amtsgericht Hamburg HRB 183104\nRegisterbekanntmachung nach dem Umwandlungsgesetz 09.07.2025 (Eintragungsdatum)\n\nNetzkontor GmbH\nGesellschaft mit beschränkter Haftung\nHamburg\n\nAls nicht eingetragen wird bekannt gemacht:\nDen Gläubigern der an der Verschmelzung beteiligten Gesellschaften ist, wenn sie binnen sechs Monaten nach dem Tag, an dem die Eintragung der Verschmelzung in das Register des Sitzes desjenigen Rechtsträgers, dessen Gläubiger sie sind, nach § 19 Absatz 3 UmwG als bekannt gemacht gilt, ihren Anspruch nach Grund und Höhe schriftlich anmelden, Sicherheit zu leisten, soweit sie nicht Befriedigung verlangen können. Dieses Recht steht den Gläubigern jedoch nur zu, wenn sie glaubhaft machen, dass durch die Verschmelzung die Erfüllung ihrer Forderung gefährdet wird."
    },
    {
      "date": "2025-07-09",
      "id": "115122",
      "original_text": "Registerbekanntmachung nach dem Umwandlungsgesetz\nHamburg Amtsgericht Hamburg HRB 183425\nNetzkontor Engineering GmbH – Hamburg",
      "type": "Registerbekanntmachung nach dem Umwandlungsgesetz",
      "state": "Hamburg",
      "amtsgericht": "Amtsgericht Hamburg",
      "registernummer": "HRB 183425",
      "registerart": "HRB",
      "company_name": "Netzkontor Engineering GmbH",
      "company_seat": "Hamburg",
      "details": "09.07.2025 (Bekanntmachungsdatum)\n\nHamburg Amtsgericht Hamburg HRB 183425\nRegisterbekanntmachung nach dem Umwandlungsgesetz 09.07.2025 (Eintragungsdatum)\n\nNetzkontor Engineering GmbH\nGesellschaft mit beschränkter Haftung\nHamburg\n\nAls nicht eingetragen wird bekannt gemacht:\nDen Gläubigern der an der Verschmelzung beteiligten Gesellschaften ist, wenn sie binnen sechs Monaten nach dem Tag, an dem die Eintragung der Verschmelzung in das Register des Sitzes derjenigen Rechtsträger deren Gläubiger sie sind, nach § 19 Absatz 3 UmwG als bekannt gemacht gilt, ihren Anspruch nach Grund und Höhe schriftlich anmelden, Sicherheit zu leisten, soweit sie nicht Befriedigung verlangen können. Dieses Recht steht den Gläubigern jedoch nur zu, wenn sie glaubhaft machen, dass durch die Verschmelzung die Erfüllung ihrer Forderung gefährdet wird."
    },
    {
      "date": "2025-07-09",
      "id": "115123",
      "original_text": "Sonstige Registerbekanntmachung\nHamburg Amtsgericht Hamburg HRB 183425\nNetzkontor Engineering GmbH – Hamburg",
      "type": "Sonstige Registerbekanntmachung",
      "state": "Hamburg",
      "amtsgericht": "Amtsgericht Hamburg",
      "registernummer": "HRB 183425",
      "registerart": "HRB",
      "company_name": "Netzkontor Engineering GmbH",
      "company_seat": "Hamburg",
      "details": "09.07.2025 (Bekanntmachungsdatum)\n\nHamburg Amtsgericht Hamburg HRB 183425\nSonstige Registerbekanntmachung 09.07.2025 (Eintragungsdatum)\n\nNetzkontor Engineering GmbH\nGesellschaft mit beschränkter Haftung\nHamburg\n\nAls nicht eingetragen wird bekannt gemacht: Den Gläubigern der Gesellschaft, deren Forderungen begründet worden sind, bevor die Eintragung der Vertragsbeendigung in das Handelsregister nach § 10 HGB als bekannt gemacht gilt, ist vom anderen Vertragsteil Sicherheit zu leisten, wenn sie sich binnen 6 Monaten nach Bekanntmachung der Eintragung zu diesem Zweck bei ihm melden."
    },
    {
      "date": "2025-07-09",
      "id": "115124",
      "original_text": "Registerbekanntmachung nach dem Umwandlungsgesetz\nMecklenburg-Vorpommern Amtsgericht Rostock HRA 4599\nWindpark Drosa II GmbH & Co. KG – Lohmen",
      "type": "Registerbekanntmachung nach dem Umwandlungsgesetz",
      "state": "Mecklenburg-Vorpommern",
      "amtsgericht": "Amtsgericht Rostock",
      "registernummer": "HRA 4599",
      "registerart": "HRA",
      "company_name": "Windpark Drosa II GmbH & Co. KG",
      "company_seat": "Lohmen",
      "details": "09.07.2025 (Bekanntmachungsdatum)\n\nMecklenburg-Vorpommern Amtsgericht Rostock HRA 4599\nRegisterbekanntmachung nach dem Umwandlungsgesetz 09.07.2025 (Eintragungsdatum)\n\nWindpark Drosa II GmbH & Co. KG\nKommanditgesellschaft\nLohmen\n\nDie Gesellschaft hat Gläubigern, deren Forderungen vor dieser Bekanntmachung begründet worden sind, Sicherheit zu leisten, soweit sie nicht Befriedigung verlangen können, wenn sie sich binnen sechs Monaten zu diesem Zweck melden."
    },
    {
      "date": "2025-07-09",
      "id": "115125",
      "original_text": "Registerbekanntmachung nach dem Umwandlungsgesetz\nBaden-Württemberg Amtsgericht Mannheim HRB 726408\nticket2go Betreibergesellschaft mbH – Mannheim",
      "type": "Registerbekanntmachung nach dem Umwandlungsgesetz",
      "state": "Baden-Württemberg",
      "amtsgericht": "Amtsgericht Mannheim",
      "registernummer": "HRB 726408",
      "registerart": "HRB",
      "company_name": "ticket2go Betreibergesellschaft mbH",
      "company_seat": "Mannheim",
      "details": "09.07.2025 (Bekanntmachungsdatum)\n\nBaden-Württemberg Amtsgericht Mannheim HRB 726408\nRegisterbekanntmachung nach dem Umwandlungsgesetz 09.07.2025 (Eintragungsdatum)\n\nticket2go Betreibergesellschaft mbH\nGesellschaft mit beschränkter Haftung\nMannheim\n\nDen Gläubigern der an der Verschmelzung beteiligten Rechtsträger ist, wenn sie binnen sechs Monaten nach dem Tag, an dem die Eintragung der Verschmelzung in das Register des Sitzes desjenigen Rechtsträgers, dessen Gläubiger sie sind, nach § 19 Abs. 3 UmwG als bekanntgemacht gilt, ihren Anspruch nach Grund und Höhe schriftlich anmelden, Sicherheit zu leisten, soweit sie nicht Befriedigung verlangen können. Dieses Recht steht den Gläubigern jedoch nur zu, wenn sie glaubhaft machen, dass durch die Verschmelzung die Erfüllung ihrer Forderung gefährdet wird."
    },
    {
      "date": "2025-07-09",
      "id": "115126",
      "original_text": "Registerbekanntmachung nach dem Umwandlungsgesetz\nBaden-Württemberg Amtsgericht Mannheim HRB 5008\nVerkehrsverbund Rhein- Neckar GmbH (VRN GmbH) – Mannheim",
      "type": "Registerbekanntmachung nach dem Umwandlungsgesetz",
      "state": "Baden-Württemberg",
      "amtsgericht": "Amtsgericht Mannheim",
      "registernummer": "HRB 5008",
      "registerart": "HRB",
      "company_name": "Verkehrsverbund Rhein- Neckar GmbH (VRN GmbH)",
      "company_seat": "Mannheim",
      "details": "09.07.2025 (Bekanntmachungsdatum)\n\nBaden-Württemberg Amtsgericht Mannheim HRB 5008\nRegisterbekanntmachung nach dem Umwandlungsgesetz 09.07.2025 (Eintragungsdatum)\n\nVerkehrsverbund Rhein- Neckar GmbH (VRN GmbH)\nGesellschaft mit beschränkter Haftung\nMannheim\n\nDen Gläubigern der an der Verschmelzung beteiligten Rechtsträger ist, wenn sie binnen sechs Monaten nach dem Tag, an dem die Eintragung der Verschmelzung in das Register des Sitzes desjenigen Rechtsträgers, dessen Gläubiger sie sind, nach § 19 Abs. 3 UmwG als bekanntgemacht gilt, ihren Anspruch nach Grund und Höhe schriftlich anmelden, Sicherheit zu leisten, soweit sie nicht Befriedigung verlangen können. Dieses Recht steht den Gläubigern jedoch nur zu, wenn sie glaubhaft machen, dass durch die Verschmelzung die Erfüllung ihrer Forderung gefährdet wird."
    },
    {
      "date": "2025-07-09",
      "id": "115127",
      "original_text": "Löschungsankündigung\nSaarland Amtsgericht Saarbrücken HRB 105829\nTDL Mietwagenservice GmbH – Ottweiler",
      "type": "Löschungsankündigung",
      "state": "Saarland",
      "amtsgericht": "Amtsgericht Saarbrücken",
      "registernummer": "HRB 105829",
      "registerart": "HRB",
      "company_name": "TDL Mietwagenservice GmbH",
      "company_seat": "Ottweiler",
      "details": "09.07.2025 (Bekanntmachungsdatum)\n\nSaarland Amtsgericht Saarbrücken HRB 105829\nLöschungsankündigung\n\nTDL Mietwagenservice GmbH\nGesellschaft mit beschränkter Haftung\nOttweiler\n\nEs ist beabsichtigt, die Gesellschaft von Amts wegen gemäß § 394 FamFG wegen Vermögenslosigkeit zu löschen.\nGegen die Löschung von Amts wegen ist das Rechtsmittel des Widerspruchs statthaft. Der Widerspruch ist binnen einer Frist zwei Monaten beginnend mit dem Tag dieser Veröffentlichung durch Einreichen eines Widerspruchsschreibens -schriftlich oder zur Niederschrift der Geschäftsstelle beim Amtsgericht Saarbrücken, -zentrales Handelsregister-, Mainzerstr.178, 66121 Saarbrücken einzulegen.\nDer Widerspruch muss die Bezeichnung der angefochtenen Löschungsankündigung enthalten sowie die Erklärung, dass Widerspruch eingelegt wird. Er ist vom Widerspruchsführer oder seinem Bevollmächtigten zu unterzeichnen.\nDas Widerspruchsschreiben kann auch in der Form eines elektronischen Dokumentes eingereicht werden, das mit einer qualifizierten elektronischen Signatur nach dem Signaturgesetz versehen sein muss (§§ 14 Abs. 2 FamFG, 130a, 298 ZPO)."
    },
    {
      "date": "2025-07-09",
      "id": "115128",
      "original_text": "Registerbekanntmachung nach dem Umwandlungsgesetz\nBaden-Württemberg Amtsgericht Stuttgart HRB 800611\nas Hausverwaltung GmbH – Neuenstein",
      "type": "Registerbekanntmachung nach dem Umwandlungsgesetz",
      "state": "Baden-Württemberg",
      "amtsgericht": "Amtsgericht Stuttgart",
      "registernummer": "HRB 800611",
      "registerart": "HRB",
      "company_name": "as Hausverwaltung GmbH",
      "company_seat": "Neuenstein",
      "details": "09.07.2025 (Bekanntmachungsdatum)\n\nBaden-Württemberg Amtsgericht Stuttgart HRB 800611\nRegisterbekanntmachung nach dem Umwandlungsgesetz 09.07.2025 (Eintragungsdatum)\n\nas Hausverwaltung GmbH\nGesellschaft mit beschränkter Haftung\nNeuenstein\n\nDen Gläubigern der an der Ausgliederung beteiligten Rechtsträger ist, wenn sie binnen sechs Monaten nach dem Tag, an dem die Eintragung der Ausgliederung in das Register des Sitzes desjenigen Rechtsträgers, dessen Gläubiger sie sind, nach § 19 Abs. 3 UmwG als bekanntgemacht gilt, ihren Anspruch nach Grund und Höhe schriftlich anmelden, Sicherheit zu leisten, soweit sie nicht Befriedigung verlangen können. Dieses Recht steht den Gläubigern jedoch nur zu, wenn sie glaubhaft machen, dass durch die Ausgliederung die Erfüllung ihrer Forderung gefährdet wird."
    },
    {
      "date": "2025-07-09",
      "id": "115129",
      "original_text": "Löschungsankündigung\nBaden-Württemberg Amtsgericht Mannheim HRB 739041\nIlay Elmkies Gesellschaft mbH – Sinsheim",
      "type": "Löschungsankündigung",
      "state": "Baden-Württemberg",
      "amtsgericht": "Amtsgericht Mannheim",
      "registernummer": "HRB 739041",
      "registerart": "HRB",
      "company_name": "Ilay Elmkies Gesellschaft mbH",
      "company_seat": "Sinsheim",
      "details": "09.07.2025 (Bekanntmachungsdatum)\n\nBaden-Württemberg Amtsgericht Mannheim HRB 739041\nLöschungsankündigung\n\nIlay Elmkies Gesellschaft mbH\nGesellschaft mit beschränkter Haftung\nSinsheim\n\nDas Gericht beabsichtigt, die Gesellschaft wegen Vermögenslosigkeit im Handelsregister von Amts wegen nach § 394 FamFG zu löschen. Die Frist zur Geltendmachung eines Widerspruchs gegen die beabsichtigte Löschung ist auf einen Monat ab Veröffentlichung bestimmt."
    },
    {
      "date": "2025-07-09",
      "id": "115130",
      "original_text": "Registerbekanntmachung nach dem Umwandlungsgesetz\nBerlin Amtsgericht Berlin (Charlottenburg) HRB 109882\nhesena Care GmbH – Berlin",
      "type": "Registerbekanntmachung nach dem Umwandlungsgesetz",
      "state": "Berlin",
      "amtsgericht": "Amtsgericht Berlin (Charlottenburg)",
      "registernummer": "HRB 109882",
      "registerart": "HRB",
      "company_name": "hesena Care GmbH",
      "company_seat": "Berlin",
      "details": "09.07.2025 (Bekanntmachungsdatum)\n\nBerlin Amtsgericht Berlin (Charlottenburg) HRB 109882\nRegisterbekanntmachung nach dem Umwandlungsgesetz 08.07.2025 (Eintragungsdatum)\n\nhesena Care GmbH\nGesellschaft mit beschränkter Haftung\nBerlin\n\nZu Eintragungsnummer 13 vom 08.07.2025 wird als nicht eingetragen veröffentlicht:Den Gläubigern der an der Verschmelzung beteiligten Rechtsträger ist, wenn sie binnen sechs Monaten nach dem Tag, an dem die Eintragung der Verschmelzung in das Register des Sitzes desjenigen Rechtsträgers, dessen Gläubiger sie sind, als bekannt gemacht gilt, ihren Anspruch nach Grund und Höhe schriftlich anmelden, Sicherheit zu leisten, soweit sie nicht Befriedigung verlangen können. Dieses Recht steht den Gläubigern jedoch nur zu, wenn sie glaubhaft machen, dass durch die Verschmelzung die Erfüllung ihrer Forderung gefährdet wird. Das Recht, Sicherheitsleistung zu verlangen, steht Gläubigern nicht zu, die im Falle der Insolvenz ein Recht auf vorzugsweise Befriedigung aus einer Deckungsmasse haben, die nach gesetzlicher Vorschrift zu ihrem Schutz errichtet und staatlich überwacht ist."
    },
    {
      "date": "2025-07-09",
      "id": "115131",
      "original_text": "Registerbekanntmachung nach dem Umwandlungsgesetz\nBerlin Amtsgericht Berlin (Charlottenburg) HRB 189397\nhesena Pflegeheim GmbH – Berlin",
      "type": "Registerbekanntmachung nach dem Umwandlungsgesetz",
      "state": "Berlin",
      "amtsgericht": "Amtsgericht Berlin (Charlottenburg)",
      "registernummer": "HRB 189397",
      "registerart": "HRB",
      "company_name": "hesena Pflegeheim GmbH",
      "company_seat": "Berlin",
      "details": "09.07.2025 (Bekanntmachungsdatum)\n\nBerlin Amtsgericht Berlin (Charlottenburg) HRB 189397\nRegisterbekanntmachung nach dem Umwandlungsgesetz 08.07.2025 (Eintragungsdatum)\n\nhesena Pflegeheim GmbH\nGesellschaft mit beschränkter Haftung\nBerlin\n\nZu Eintragungsnummer 9 vom 08.07.2025 wird als nicht eingetragen veröffentlicht: Den Gläubigern der an der Verschmelzung beteiligten Rechtsträger ist, wenn sie binnen sechs Monaten nach dem Tag, an dem die Eintragung der Verschmelzung in das Register des Sitzes desjenigen Rechtsträgers, dessen Gläubiger sie sind, als bekannt gemacht gilt, ihren Anspruch nach Grund und Höhe schriftlich anmelden, Sicherheit zu leisten, soweit sie nicht Befriedigung verlangen können. Dieses Recht steht den Gläubigern jedoch nur zu, wenn sie glaubhaft machen, dass durch die Verschmelzung die Erfüllung ihrer Forderung gefährdet wird. Das Recht, Sicherheitsleistung zu verlangen, steht Gläubigern nicht zu, die im Falle der Insolvenz ein Recht auf vorzugsweise Befriedigung aus einer Deckungsmasse haben, die nach gesetzlicher Vorschrift zu ihrem Schutz errichtet und staatlich überwacht ist.\nDer andere Vertragsteil hat den Gläubigern dieses Rechtsträgers, deren Forderungen begründet worden sind, bevor die Eintragung der Beendigung dieses Vertrages in das Handelsregister nach § 10 des Handelsgesetzbuches als bekannt gemacht gilt, Sicherheit zu leisten, wenn sie sich binnen sechs Monaten nach der Bekanntmachung der Eintragung zu diesem Zweck bei ihm melden. Dieses Recht steht den Gläubigern nicht zu, die im Fall des Insolvenzverfahrens ein Recht auf vorzugsweise Befriedigung aus der Deckungsmasse haben, die nach gesetzlicher Vorschrift zu ihrem Schutz errichtet und staatlich überwacht ist."
    },
    {
      "date": "2025-07-09",
      "id": "115132",
      "original_text": "Einreichung neuer Dokumente\nSchleswig-Holstein Amtsgericht Lübeck HRB 4787 AH\nStadtwerke Ahrensburg GmbH – Ahrensburg",
      "type": "Einreichung neuer Dokumente",
      "state": "Schleswig-Holstein",
      "amtsgericht": "Amtsgericht Lübeck",
      "registernummer": "HRB 4787 AH",
      "registerart": "HRB",
      "company_name": "Stadtwerke Ahrensburg GmbH",
      "company_seat": "Ahrensburg",
      "details": "09.07.2025 (Bekanntmachungsdatum)\n\nSchleswig-Holstein Amtsgericht Lübeck HRB 4787 AH\nEinreichung neuer Dokumente\n\nStadtwerke Ahrensburg GmbH\nGesellschaft mit beschränkter Haftung\nAhrensburg\n\nAls nicht eingetragen wird veröffentlicht: Die Gesellschaft hat eine aktuelle Liste der Aufsichtsratsmitglieder zum Handelsregister eingereicht."
    },
    {
      "date": "2025-07-09",
      "id": "115133",
      "original_text": "Registerbekanntmachung nach dem Umwandlungsgesetz\nBaden-Württemberg Amtsgericht Freiburg HRA 709079\nKahl IT GmbH & Co. KG – Offenburg",
      "type": "Registerbekanntmachung nach dem Umwandlungsgesetz",
      "state": "Baden-Württemberg",
      "amtsgericht": "Amtsgericht Freiburg",
      "registernummer": "HRA 709079",
      "registerart": "HRA",
      "company_name": "Kahl IT GmbH & Co. KG",
      "company_seat": "Offenburg",
      "details": "09.07.2025 (Bekanntmachungsdatum)\n\nBaden-Württemberg Amtsgericht Freiburg HRA 709079\nRegisterbekanntmachung nach dem Umwandlungsgesetz 09.07.2025 (Eintragungsdatum)\n\nKahl IT GmbH & Co. KG\nKommanditgesellschaft\nOffenburg\n\nDen Gläubigern der an der Ausgliederung beteiligten Rechtsträger ist, wenn sie binnen sechs Monaten nach dem Tag, an dem die Eintragung der Ausgliederung in das Register des Sitzes desjenigen Rechtsträgers, dessen Gläubiger sie sind, nach § 19 Abs. 3 UmwG als bekanntgemacht gilt, ihren Anspruch nach Grund und Höhe schriftlich anmelden, Sicherheit zu leisten, soweit sie nicht Befriedigung verlangen können. Dieses Recht steht den Gläubigern jedoch nur zu, wenn sie glaubhaft machen, dass durch die Ausgliederung die Erfüllung ihrer Forderung gefährdet wird."
    },
    {
      "date": "2025-07-09",
      "id": "115134",
      "original_text": "Registerbekanntmachung nach dem Umwandlungsgesetz\nBaden-Württemberg Amtsgericht Freiburg HRA 709026\nChristian Kahl Computertechnik e.K. – Offenburg",
      "type": "Registerbekanntmachung nach dem Umwandlungsgesetz",
      "state": "Baden-Württemberg",
      "amtsgericht": "Amtsgericht Freiburg",
      "registernummer": "HRA 709026",
      "registerart": "HRA",
      "company_name": "Christian Kahl Computertechnik e.K.",
      "company_seat": "Offenburg",
      "details": "09.07.2025 (Bekanntmachungsdatum)\n\nBaden-Württemberg Amtsgericht Freiburg HRA 709026\nRegisterbekanntmachung nach dem Umwandlungsgesetz 09.07.2025 (Eintragungsdatum)\n\nChristian Kahl Computertechnik e.K.\nEinzelkaufmann / Einzelkauffrau\nOffenburg\n\nAls nicht eingetragen wird bekanntgemacht:\nDen Gläubigern der an der Ausgliederung beteiligten Rechtsträger ist, wenn sie binnen sechs Monaten nach dem Tag, an dem die Eintragung der Ausgliederung in das Register des Sitzes desjenigen Rechtsträgers, dessen Gläubiger sie sind, nach § 19 Abs. 3 UmwG als bekanntgemacht gilt, ihren Anspruch nach Grund und Höhe schriftlich anmelden, Sicherheit zu leisten, soweit sie nicht Befriedigung verlangen können. Dieses Recht steht den Gläubigern jedoch nur zu, wenn sie glaubhaft machen, dass durch die Ausgliederung die Erfüllung ihrer Forderung gefährdet wird."
    },
    {
      "date": "2025-07-09",
      "id": "115135",
      "original_text": "Sonstige Registerbekanntmachung\nBrandenburg Amtsgericht Frankfurt/Oder HRB 18019\nHundestaffel Churmark GmbH – Rietz-Neuendorf",
      "type": "Sonstige Registerbekanntmachung",
      "state": "Brandenburg",
      "amtsgericht": "Amtsgericht Frankfurt/Oder",
      "registernummer": "HRB 18019",
      "registerart": "HRB",
      "company_name": "Hundestaffel Churmark GmbH",
      "company_seat": "Rietz-Neuendorf",
      "details": "09.07.2025 (Bekanntmachungsdatum)\n\nBrandenburg Amtsgericht Frankfurt/Oder HRB 18019\nSonstige Registerbekanntmachung\n\nHundestaffel Churmark GmbH\nGesellschaft mit beschränkter Haftung\nRietz-Neuendorf\n\nAls nicht eingetragen wird veröffentlicht:\n\nDie Insolvenzverwalterin hat am 05.06.2025 die Änderung des Geschäftsjahres angezeigt."
    },
    {
      "date": "2025-07-09",
      "id": "115136",
      "original_text": "Registerbekanntmachung nach dem Umwandlungsgesetz\nBaden-Württemberg Amtsgericht Freiburg HRB 370356\nR M T Industrie- und Elektrotechnik GmbH – Kehl",
      "type": "Registerbekanntmachung nach dem Umwandlungsgesetz",
      "state": "Baden-Württemberg",
      "amtsgericht": "Amtsgericht Freiburg",
      "registernummer": "HRB 370356",
      "registerart": "HRB",
      "company_name": "R M T Industrie- und Elektrotechnik GmbH",
      "company_seat": "Kehl",
      "details": "09.07.2025 (Bekanntmachungsdatum)\n\nBaden-Württemberg Amtsgericht Freiburg HRB 370356\nRegisterbekanntmachung nach dem Umwandlungsgesetz 09.07.2025 (Eintragungsdatum)\n\nR M T Industrie- und Elektrotechnik GmbH\nGesellschaft mit beschränkter Haftung\nKehl\n\nDen Gläubigern der an der Verschmelzung beteiligten Rechtsträger ist, wenn sie binnen sechs Monaten nach dem Tag, an dem die Eintragung der Verschmelzung in das Register des Sitzes desjenigen Rechtsträgers, dessen Gläubiger sie sind, nach § 19 Abs. 3 UmwG als bekanntgemacht gilt, ihren Anspruch nach Grund und Höhe schriftlich anmelden, Sicherheit zu leisten, soweit sie nicht Befriedigung verlangen können. Dieses Recht steht den Gläubigern jedoch nur zu, wenn sie glaubhaft machen, dass durch die Verschmelzung die Erfüllung ihrer Forderung gefährdet wird."
    },
    {
      "date": "2025-07-09",
      "id": "115137",
      "original_text": "Löschungsankündigung\nSchleswig-Holstein Amtsgericht Kiel HRA 8444\nDokan Service 21 Bau Inh. Idris Kadir e. K. – Kiel",
      "type": "Löschungsankündigung",
      "state": "Schleswig-Holstein",
      "amtsgericht": "Amtsgericht Kiel",
      "registernummer": "HRA 8444",
      "registerart": "HRA",
      "company_name": "Dokan Service 21 Bau Inh. Idris Kadir e. K.",
      "company_seat": "Kiel",
      "details": "09.07.2025 (Bekanntmachungsdatum)\n\nSchleswig-Holstein Amtsgericht Kiel HRA 8444\nLöschungsankündigung\n\nDokan Service 21 Bau Inh. Idris Kadir e. K.\nEinzelkaufmann / Einzelkauffrau\nKiel\n\nBei der nachstehenden Firma wird das Amtslöschungsverfahren gemäß § 31 Abs. 2 HGB eingeleitet. Widerspruchsfrist: 2 Monate."
    },
    {
      "date": "2025-07-09",
      "id": "115138",
      "original_text": "Registerbekanntmachung nach dem Umwandlungsgesetz\nBaden-Württemberg Amtsgericht Freiburg HRB 371028\nCLEMESSY Industrie- und Elektrotechnik GmbH – Kehl",
      "type": "Registerbekanntmachung nach dem Umwandlungsgesetz",
      "state": "Baden-Württemberg",
      "amtsgericht": "Amtsgericht Freiburg",
      "registernummer": "HRB 371028",
      "registerart": "HRB",
      "company_name": "CLEMESSY Industrie- und Elektrotechnik GmbH",
      "company_seat": "Kehl",
      "details": "09.07.2025 (Bekanntmachungsdatum)\n\nBaden-Württemberg Amtsgericht Freiburg HRB 371028\nRegisterbekanntmachung nach dem Umwandlungsgesetz 09.07.2025 (Eintragungsdatum)\n\nCLEMESSY Industrie- und Elektrotechnik GmbH\nGesellschaft mit beschränkter Haftung\nKehl\n\nAls nicht eingetragen wird bekanntgemacht:\nDen Gläubigern der an der Verschmelzung beteiligten Rechtsträger ist, wenn sie binnen sechs Monaten nach dem Tag, an dem die Eintragung der Verschmelzung in das Register des Sitzes desjenigen Rechtsträgers, dessen Gläubiger sie sind, nach § 19 Abs. 3 UmwG als bekanntgemacht gilt, ihren Anspruch nach Grund und Höhe schriftlich anmelden, Sicherheit zu leisten, soweit sie nicht Befriedigung verlangen können. Dieses Recht steht den Gläubigern jedoch nur zu, wenn sie glaubhaft machen, dass durch die Verschmelzung die Erfüllung ihrer Forderung gefährdet wird."
    },
    {
      "date": "2025-07-09",
      "id": "115139",
      "original_text": "Einreichung neuer Dokumente\nBaden-Württemberg Amtsgericht Stuttgart HRB 767414\nAEB SE – Stuttgart",
      "type": "Einreichung neuer Dokumente",
      "state": "Baden-Württemberg",
      "amtsgericht": "Amtsgericht Stuttgart",
      "registernummer": "HRB 767414",
      "registerart": "HRB",
      "company_name": "AEB SE",
      "company_seat": "Stuttgart",
      "details": "09.07.2025 (Bekanntmachungsdatum)\n\nBaden-Württemberg Amtsgericht Stuttgart HRB 767414\nEinreichung neuer Dokumente 09.07.2025 (Eintragungsdatum)\n\nAEB SE\nEuropäische Aktiengesellschaft (SE)\nStuttgart\n\nDie Gesellschaft hat am 08.07.2025 die neue Liste der Aufsichtsratsmitglieder eingereicht."
    },
    {
      "date": "2025-07-09",
      "id": "115140",
      "original_text": "Löschungsankündigung\nMecklenburg-Vorpommern Amtsgericht Rostock HRB 5684\nAbwicklungsgesellschaft MGT Maschinen- und Gerätebau GmbH – Neu Wokern",
      "type": "Löschungsankündigung",
      "state": "Mecklenburg-Vorpommern",
      "amtsgericht": "Amtsgericht Rostock",
      "registernummer": "HRB 5684",
      "registerart": "HRB",
      "company_name": "Abwicklungsgesellschaft MGT Maschinen- und Gerätebau GmbH",
      "company_seat": "Neu Wokern",
      "details": "09.07.2025 (Bekanntmachungsdatum)\n\nMecklenburg-Vorpommern Amtsgericht Rostock HRB 5684\nLöschungsankündigung\n\nAbwicklungsgesellschaft MGT Maschinen- und Gerätebau GmbH\nGesellschaft mit beschränkter Haftung\nNeu Wokern\n\nDas Registergericht beabsichtigt, die im Handelsregister eingetragene Gesellschaft von Amts wegen nach § 394 FamFG zu löschen. Die Frist zur Erhebung eines Widerspruchs gegen die beabsichtigte Löschung wird auf 1 Monat festgesetzt."
    },
    {
      "date": "2025-07-09",
      "id": "115141",
      "original_text": "Einreichung neuer Dokumente\nThüringen Amtsgericht Jena HRB 200146\nJENOPTIK Aktiengesellschaft – Jena",
      "type": "Einreichung neuer Dokumente",
      "state": "Thüringen",
      "amtsgericht": "Amtsgericht Jena",
      "registernummer": "HRB 200146",
      "registerart": "HRB",
      "company_name": "JENOPTIK Aktiengesellschaft",
      "company_seat": "Jena",
      "details": "09.07.2025 (Bekanntmachungsdatum)\n\nThüringen Amtsgericht Jena HRB 200146\nEinreichung neuer Dokumente\n\nJENOPTIK Aktiengesellschaft\nAktiengesellschaft\nJena\n\nBekanntmachung gem. § 106 AktG: Aufgrund einer Veränderung in den Personen der Aufsichtsratsmitglieder ist durch den Vorstand eine neue Liste zum Handelsregister eingereicht worden."
    },
    {
      "date": "2025-07-09",
      "id": "115142",
      "original_text": "Löschungsankündigung\nSchleswig-Holstein Amtsgericht Lübeck HRA 5315\nAktivaLeben KG – Scharbeutz",
      "type": "Löschungsankündigung",
      "state": "Schleswig-Holstein",
      "amtsgericht": "Amtsgericht Lübeck",
      "registernummer": "HRA 5315",
      "registerart": "HRA",
      "company_name": "AktivaLeben KG",
      "company_seat": "Scharbeutz",
      "details": "09.07.2025 (Bekanntmachungsdatum)\n\nSchleswig-Holstein Amtsgericht Lübeck HRA 5315\nLöschungsankündigung\n\nAktivaLeben KG\nKommanditgesellschaft\nScharbeutz\n\nAn\nFrau Monika Ellenberger\nund\nHerrn Michael Franz-Josef Bussmann\n\n-per Veröffentlichung -\n\nSehr geehrte Frau Ellenberg,\nsehr geehrter Herr Bussmann,\n\nin der Handelsregistersache der\nAktivaLeben KG\n\nergeben sich aus den mir vorliegenden Unterlagen Anhaltspunkte dafür, dass die obige Gesellschaft erloschen ist. Das Gewerbe wurde am 30.03.2021 abgemeldet.\n\nEs ist daher beabsichtigt, die Gesellschaft gemäß § 32 Abs. 2 HGB iVm § 393 FamFG zu löschen.\n\nEs wird eine Frist von drei Monaten zur Geltendmachung eines Widerspruchs gegen die Löschung bestimmt, § 393 Abs. 1 S.2, Abs. 2 FamFG.\n\nNach Fristablauf ohne Widerspruch von Ihnen oder anderer Seite wird die Gesellschaft gelöscht.\n\nMit freundlichen Grüßen\n\nSchuppenhauer\nDipl.-Rechtspflegerin (FH)"
    },
    {
      "date": "2025-07-09",
      "id": "115143",
      "original_text": "Registerbekanntmachung nach dem Umwandlungsgesetz\nSchleswig-Holstein Amtsgericht Flensburg HRB 7124\nInsel Sylt Tourismus-Service GmbH – Sylt/Westerland",
      "type": "Registerbekanntmachung nach dem Umwandlungsgesetz",
      "state": "Schleswig-Holstein",
      "amtsgericht": "Amtsgericht Flensburg",
      "registernummer": "HRB 7124",
      "registerart": "HRB",
      "company_name": "Insel Sylt Tourismus-Service GmbH",
      "company_seat": "Sylt/Westerland",
      "details": "09.07.2025 (Bekanntmachungsdatum)\n\nSchleswig-Holstein Amtsgericht Flensburg HRB 7124\nRegisterbekanntmachung nach dem Umwandlungsgesetz 08.07.2025 (Eintragungsdatum)\n\nInsel Sylt Tourismus-Service GmbH\nGesellschaft mit beschränkter Haftung\nSylt/Westerland\n\nAls nicht eingetragen wird veröffentlicht: Den Gläubigern der an der Verschmelzung beteiligten Rechtsträger ist, wenn sie binnen sechs Monaten nach dem Tag, an dem die Eintragung der Verschmelzung in das Register des Sitzes desjenigen Rechtsträgers, dessen Gläubiger sie sind, als bekannt gemacht gilt, ihren Anspruch nach Grund und Höhe schriftlich anmelden, Sicherheit zu leisten, soweit sie nicht Befriedigung verlangen können. Dieses Recht steht den Gläubigern jedoch nur zu, wenn sie glaubhaft machen, dass durch die Verschmelzung die Erfüllung ihrer Forderung gefährdet wird. Das Recht, Sicherheitsleistung zu verlangen, steht Gläubigern nicht zu, die im Falle der Insolvenz ein Recht auf vorzugsweise Befriedigung aus einer Deckungsmasse haben, die nach gesetzlicher Vorschrift zu ihrem Schutz errichtet und staatlich überwacht ist."
    },
    {
      "date": "2025-07-09",
      "id": "115144",
      "original_text": "Registerbekanntmachung nach dem Umwandlungsgesetz\nHamburg Amtsgericht Hamburg HRB 164835\nnetworker, solutions GmbH – Hamburg",
      "type": "Registerbekanntmachung nach dem Umwandlungsgesetz",
      "state": "Hamburg",
      "amtsgericht": "Amtsgericht Hamburg",
      "registernummer": "HRB 164835",
      "registerart": "HRB",
      "company_name": "networker, solutions GmbH",
      "company_seat": "Hamburg",
      "details": "09.07.2025 (Bekanntmachungsdatum)\n\nHamburg Amtsgericht Hamburg HRB 164835\nRegisterbekanntmachung nach dem Umwandlungsgesetz 09.07.2025 (Eintragungsdatum)\n\nnetworker, solutions GmbH\nGesellschaft mit beschränkter Haftung\nHamburg\n\nAls nicht eingetragen wird bekannt gemacht:\nDen Gläubigern der an der Abspaltung beteiligten Gesellschaften ist, wenn sie binnen sechs Monaten nach dem Tag, an dem die Eintragung der Abspaltung in das Register des Sitzes desjenigen Rechtsträgers, dessen Gläubiger sie sind, nach § 19 Absatz 3 UmwG als bekannt gemacht gilt, ihren Anspruch nach Grund und Höhe schriftlich anmelden, Sicherheit zu leisten, soweit sie nicht Befriedigung verlangen können. Dieses Recht steht den Gläubigern jedoch nur zu, wenn sie glaubhaft machen, dass durch die Abspaltung die Erfüllung ihrer Forderung gefährdet wird."
    },
    {
      "date": "2025-07-09",
      "id": "115145",
      "original_text": "Einreichung neuer Dokumente\nMecklenburg-Vorpommern Amtsgericht Stralsund HRB 1048 früher Amtsgericht Rostock\nVorpommersche Land AG Reinkenhagen – Reinkenhagen",
      "type": "Einreichung neuer Dokumente",
      "state": "Mecklenburg-Vorpommern",
      "amtsgericht": "Amtsgericht Stralsund",
      "registernummer": "HRB 1048",
      "registerart": "HRB",
      "company_name": "Vorpommersche Land AG Reinkenhagen",
      "company_seat": "Reinkenhagen",
      "former_amtsgericht": "Rostock",
      "details": "09.07.2025 (Bekanntmachungsdatum)\n\nMecklenburg-Vorpommern Amtsgericht Stralsund HRB 1048 früher Amtsgericht Rostock\nEinreichung neuer Dokumente\n\nVorpommersche Land AG Reinkenhagen\nAktiengesellschaft\nReinkenhagen"
    },
    {
      "date": "2025-07-09",
      "id": "115146",
      "original_text": "Registerbekanntmachung nach dem Umwandlungsgesetz\nBerlin Amtsgericht Berlin (Charlottenburg) HRB 238316\nSmart & Green Materials Duben GmbH – Berlin",
      "type": "Registerbekanntmachung nach dem Umwandlungsgesetz",
      "state": "Berlin",
      "amtsgericht": "Amtsgericht Berlin (Charlottenburg)",
      "registernummer": "HRB 238316",
      "registerart": "HRB",
      "company_name": "Smart & Green Materials Duben GmbH",
      "company_seat": "Berlin",
      "details": "09.07.2025 (Bekanntmachungsdatum)\n\nBerlin Amtsgericht Berlin (Charlottenburg) HRB 238316\nRegisterbekanntmachung nach dem Umwandlungsgesetz 08.07.2025 (Eintragungsdatum)\n\nSmart & Green Materials Duben GmbH\nGesellschaft mit beschränkter Haftung\nBerlin\n\nZu Eintragungsnummer 6 vom 08.07.2025 wird als nicht eingetragen veröffentlicht:\nDen Gläubigern der an der Verschmelzung beteiligten Rechtsträger ist, wenn sie binnen sechs Monaten nach dem Tag, an dem die Eintragung der Verschmelzung in das Register des Sitzes desjenigen Rechtsträgers, dessen Gläubiger sie sind, als bekannt gemacht gilt, ihren Anspruch nach Grund und Höhe schriftlich anmelden, Sicherheit zu leisten, soweit sie nicht Befriedigung verlangen können. Dieses Recht steht den Gläubigern jedoch nur zu, wenn sie glaubhaft machen, dass durch die Verschmelzung die Erfüllung ihrer Forderung gefährdet wird. Das Recht, Sicherheitsleistung zu verlangen, steht Gläubigern nicht zu, die im Falle der Insolvenz ein Recht auf vorzugsweise Befriedigung aus einer Deckungsmasse haben, die nach gesetzlicher Vorschrift zu ihrem Schutz errichtet und staatlich überwacht ist."
    },
    {
      "date": "2025-07-09",
      "id": "115147",
      "original_text": "Registerbekanntmachung nach dem Umwandlungsgesetz\nBerlin Amtsgericht Berlin (Charlottenburg) HRA 63991\nprofessional technology UG (haftungsbeschränkt) & Co. KG – Berlin",
      "type": "Registerbekanntmachung nach dem Umwandlungsgesetz",
      "state": "Berlin",
      "amtsgericht": "Amtsgericht Berlin (Charlottenburg)",
      "registernummer": "HRA 63991",
      "registerart": "HRA",
      "company_name": "professional technology UG (haftungsbeschränkt) & Co. KG",
      "company_seat": "Berlin",
      "details": "09.07.2025 (Bekanntmachungsdatum)\n\nBerlin Amtsgericht Berlin (Charlottenburg) HRA 63991\nRegisterbekanntmachung nach dem Umwandlungsgesetz 08.07.2025 (Eintragungsdatum)\n\nprofessional technology UG (haftungsbeschränkt) & Co. KG\nKommanditgesellschaft\nBerlin\n\nZu Eintragungsnummer 4 vom 08.07.2025 wird als nicht eingetragen veröffentlicht:\nDen Gläubigern der an der Verschmelzung beteiligten Rechtsträger ist, wenn sie binnen sechs Monaten nach dem Tag, an dem die Eintragung der Verschmelzung in das Register des Sitzes desjenigen Rechtsträgers, dessen Gläubiger sie sind, als bekannt gemacht gilt, ihren Anspruch nach Grund und Höhe schriftlich anmelden, Sicherheit zu leisten, soweit sie nicht Befriedigung verlangen können. Dieses Recht steht den Gläubigern jedoch nur zu, wenn sie glaubhaft machen, dass durch die Verschmelzung die Erfüllung ihrer Forderung gefährdet wird. Das Recht, Sicherheitsleistung zu verlangen, steht Gläubigern nicht zu, die im Falle der Insolvenz ein Recht auf vorzugsweise Befriedigung aus einer Deckungsmasse haben, die nach gesetzlicher Vorschrift zu ihrem Schutz errichtet und staatlich überwacht ist."
    },
    {
      "date": "2025-07-09",
      "id": "115148",
      "original_text": "Löschungsankündigung\nBerlin Amtsgericht Berlin (Charlottenburg) HRA 53029\nPSB Real Estate GmbH & Co. KG – Berlin",
      "type": "Löschungsankündigung",
      "state": "Berlin",
      "amtsgericht": "Amtsgericht Berlin (Charlottenburg)",
      "registernummer": "HRA 53029",
      "registerart": "HRA",
      "company_name": "PSB Real Estate GmbH & Co. KG",
      "company_seat": "Berlin",
      "details": "09.07.2025 (Bekanntmachungsdatum)\n\nBerlin Amtsgericht Berlin (Charlottenburg) HRA 53029\nLöschungsankündigung\n\nPSB Real Estate GmbH & Co. KG\nKommanditgesellschaft\nBerlin\n\nBei dem nachstehenden Unternehmen / der nachstehenden Gesellschaft wird das Amtslöschungsverfahren gemäß § 31 Abs. 2 HGB eingeleitet. Widerspruchsfrist 2 Monate."
    },
    {
      "date": "2025-07-09",
      "id": "115149",
      "original_text": "Registerbekanntmachung nach dem Umwandlungsgesetz\nSchleswig-Holstein Amtsgericht Pinneberg HRB 9847\nfabfab GmbH – Schenefeld/Krs. Pinneberg",
      "type": "Registerbekanntmachung nach dem Umwandlungsgesetz",
      "state": "Schleswig-Holstein",
      "amtsgericht": "Amtsgericht Pinneberg",
      "registernummer": "HRB 9847",
      "registerart": "HRB",
      "company_name": "fabfab GmbH",
      "company_seat": "Schenefeld/Krs. Pinneberg",
      "details": "09.07.2025 (Bekanntmachungsdatum)\n\nSchleswig-Holstein Amtsgericht Pinneberg HRB 9847\nRegisterbekanntmachung nach dem Umwandlungsgesetz 08.07.2025 (Eintragungsdatum)\n\nfabfab GmbH\nGesellschaft mit beschränkter Haftung\nSchenefeld/Krs. Pinneberg\n\nZu Eintragungsnummer 36 vom 08.07.2025 wird als nicht eingetragen veröffentlicht: Den Gläubigern der an der Verschmelzung beteiligten Rechtsträger ist, wenn sie binnen sechs Monaten nach dem Tag, an dem die Eintragung der Verschmelzung in das Register des Sitzes desjenigen Rechtsträgers, dessen Gläubiger sie sind, als bekannt gemacht gilt, ihren Anspruch nach Grund und Höhe schriftlich anmelden, Sicherheit zu leisten, soweit sie nicht Befriedigung verlangen können. Dieses Recht steht den Gläubigern jedoch nur zu, wenn sie glaubhaft machen, dass durch die Verschmelzung die Erfüllung ihrer Forderung gefährdet wird. Das Recht, Sicherheitsleistung zu verlangen, steht Gläubigern nicht zu, die im Falle der Insolvenz ein Recht auf vorzugsweise Befriedigung aus einer Deckungsmasse haben, die nach gesetzlicher Vorschrift zu ihrem Schutz errichtet und staatlich überwacht ist."
    },
    {
      "date": "2025-07-09",
      "id": "115150",
      "original_text": "Registerbekanntmachung nach dem Umwandlungsgesetz\nBerlin Amtsgericht Berlin (Charlottenburg) HRA 63989\nAPL GmbH & Co. KG – Berlin",
      "type": "Registerbekanntmachung nach dem Umwandlungsgesetz",
      "state": "Berlin",
      "amtsgericht": "Amtsgericht Berlin (Charlottenburg)",
      "registernummer": "HRA 63989",
      "registerart": "HRA",
      "company_name": "APL GmbH & Co. KG",
      "company_seat": "Berlin",
      "details": "09.07.2025 (Bekanntmachungsdatum)\n\nBerlin Amtsgericht Berlin (Charlottenburg) HRA 63989\nRegisterbekanntmachung nach dem Umwandlungsgesetz 08.07.2025 (Eintragungsdatum)\n\nAPL GmbH & Co. KG\nKommanditgesellschaft\nBerlin\n\nZu Eintragungsnummer 3 vom 08.07.2025 wird als nicht eingetragen veröffentlicht:\nDen Gläubigern der an der Verschmelzung beteiligten Rechtsträger ist, wenn sie binnen sechs Monaten nach dem Tag, an dem die Eintragung der Verschmelzung in das Register des Sitzes desjenigen Rechtsträgers, dessen Gläubiger sie sind, als bekannt gemacht gilt, ihren Anspruch nach Grund und Höhe schriftlich anmelden, Sicherheit zu leisten, soweit sie nicht Befriedigung verlangen können. Dieses Recht steht den Gläubigern jedoch nur zu, wenn sie glaubhaft machen, dass durch die Verschmelzung die Erfüllung ihrer Forderung gefährdet wird. Das Recht, Sicherheitsleistung zu verlangen, steht Gläubigern nicht zu, die im Falle der Insolvenz ein Recht auf vorzugsweise Befriedigung aus einer Deckungsmasse haben, die nach gesetzlicher Vorschrift zu ihrem Schutz errichtet und staatlich überwacht ist."
    },
    {
      "date": "2025-07-09",
      "id": "115151",
      "original_text": "Registerbekanntmachung nach dem Umwandlungsgesetz\nBerlin Amtsgericht Berlin (Charlottenburg) HRB 210651\nBelle Époque Gehrensee Beteiligung GmbH – Berlin",
      "type": "Registerbekanntmachung nach dem Umwandlungsgesetz",
      "state": "Berlin",
      "amtsgericht": "Amtsgericht Berlin (Charlottenburg)",
      "registernummer": "HRB 210651",
      "registerart": "HRB",
      "company_name": "Belle Époque Gehrensee Beteiligung GmbH",
      "company_seat": "Berlin",
      "details": "09.07.2025 (Bekanntmachungsdatum)\n\nBerlin Amtsgericht Berlin (Charlottenburg) HRB 210651\nRegisterbekanntmachung nach dem Umwandlungsgesetz 08.07.2025 (Eintragungsdatum)\n\nBelle Époque Gehrensee Beteiligung GmbH\nGesellschaft mit beschränkter Haftung\nBerlin\n\nZu Eintragungsnummer 5 vom 08.07.2025 wird als nicht eingetragen veröffentlicht:\nDen Gläubigern der an der Verschmelzung beteiligten Rechtsträger ist, wenn sie binnen sechs Monaten nach dem Tag, an dem die Eintragung der Verschmelzung in das Register des Sitzes desjenigen Rechtsträgers, dessen Gläubiger sie sind, als bekannt gemacht gilt, ihren Anspruch nach Grund und Höhe schriftlich anmelden, Sicherheit zu leisten, soweit sie nicht Befriedigung verlangen können. Dieses Recht steht den Gläubigern jedoch nur zu, wenn sie glaubhaft machen, dass durch die Verschmelzung die Erfüllung ihrer Forderung gefährdet wird. Das Recht, Sicherheitsleistung zu verlangen, steht Gläubigern nicht zu, die im Falle der Insolvenz ein Recht auf vorzugsweise Befriedigung aus einer Deckungsmasse haben, die nach gesetzlicher Vorschrift zu ihrem Schutz errichtet und staatlich überwacht ist."
    },
    {
      "date": "2025-07-09",
      "id": "115152",
      "original_text": "Registerbekanntmachung nach dem Umwandlungsgesetz\nBaden-Württemberg Amtsgericht Stuttgart HRB 793305\naMoS KiTa Bavaria GmbH – Fellbach",
      "type": "Registerbekanntmachung nach dem Umwandlungsgesetz",
      "state": "Baden-Württemberg",
      "amtsgericht": "Amtsgericht Stuttgart",
      "registernummer": "HRB 793305",
      "registerart": "HRB",
      "company_name": "aMoS KiTa Bavaria GmbH",
      "company_seat": "Fellbach",
      "details": "09.07.2025 (Bekanntmachungsdatum)\n\nBaden-Württemberg Amtsgericht Stuttgart HRB 793305\nRegisterbekanntmachung nach dem Umwandlungsgesetz 09.07.2025 (Eintragungsdatum)\n\naMoS KiTa Bavaria GmbH\nGesellschaft mit beschränkter Haftung\nFellbach\n\nDen Gläubigern der an der Verschmelzung beteiligten Rechtsträger ist, wenn sie binnen sechs Monaten nach dem Tag, an dem die Eintragung der Verschmelzung in das Register des Sitzes desjenigen Rechtsträgers, dessen Gläubiger sie sind, nach § 19 Abs. 3 UmwG als bekanntgemacht gilt, ihren Anspruch nach Grund und Höhe schriftlich anmelden, Sicherheit zu leisten, soweit sie nicht Befriedigung verlangen können. Dieses Recht steht den Gläubigern jedoch nur zu, wenn sie glaubhaft machen, dass durch die Verschmelzung die Erfüllung ihrer Forderung gefährdet wird."
    },
    {
      "date": "2025-07-09",
      "id": "115153",
      "original_text": "Einreichung neuer Dokumente\nSchleswig-Holstein Amtsgericht Kiel HRB 17805\nCeravis AG – Rendsburg",
      "type": "Einreichung neuer Dokumente",
      "state": "Schleswig-Holstein",
      "amtsgericht": "Amtsgericht Kiel",
      "registernummer": "HRB 17805",
      "registerart": "HRB",
      "company_name": "Ceravis AG",
      "company_seat": "Rendsburg",
      "details": "09.07.2025 (Bekanntmachungsdatum)\n\nSchleswig-Holstein Amtsgericht Kiel HRB 17805\nEinreichung neuer Dokumente\n\nCeravis AG\nAktiengesellschaft\nRendsburg\n\nAls nicht eingetragen wird veröffentlicht: Eine neue Liste der Aufsichtsratsmitglieder ist eingereicht worden."
    },
    {
      "date": "2025-07-09",
      "id": "115154",
      "original_text": "Registerbekanntmachung nach dem Umwandlungsgesetz\nBaden-Württemberg Amtsgericht Stuttgart HRB 245104\nASID BONZ GmbH – Herrenberg",
      "type": "Registerbekanntmachung nach dem Umwandlungsgesetz",
      "state": "Baden-Württemberg",
      "amtsgericht": "Amtsgericht Stuttgart",
      "registernummer": "HRB 245104",
      "registerart": "HRB",
      "company_name": "ASID BONZ GmbH",
      "company_seat": "Herrenberg",
      "details": "09.07.2025 (Bekanntmachungsdatum)\n\nBaden-Württemberg Amtsgericht Stuttgart HRB 245104\nRegisterbekanntmachung nach dem Umwandlungsgesetz 09.07.2025 (Eintragungsdatum)\n\nASID BONZ GmbH\nGesellschaft mit beschränkter Haftung\nHerrenberg\n\nDen Gläubigern der an der Verschmelzung beteiligten Rechtsträger ist, wenn sie binnen sechs Monaten nach dem Tag, an dem die Eintragung der Verschmelzung in das Register des Sitzes desjenigen Rechtsträgers, dessen Gläubiger sie sind, nach § 19 Abs. 3 UmwG als bekanntgemacht gilt, ihren Anspruch nach Grund und Höhe schriftlich anmelden, Sicherheit zu leisten, soweit sie nicht Befriedigung verlangen können. Dieses Recht steht den Gläubigern jedoch nur zu, wenn sie glaubhaft machen, dass durch die Verschmelzung die Erfüllung ihrer Forderung gefährdet wird."
    },
    {
      "date": "2025-07-09",
      "id": "115155",
      "original_text": "Registerbekanntmachung nach dem Umwandlungsgesetz\nBerlin Amtsgericht Berlin (Charlottenburg) HRB 118304\nASI Asian Strategic Investment GmbH – Berlin",
      "type": "Registerbekanntmachung nach dem Umwandlungsgesetz",
      "state": "Berlin",
      "amtsgericht": "Amtsgericht Berlin (Charlottenburg)",
      "registernummer": "HRB 118304",
      "registerart": "HRB",
      "company_name": "ASI Asian Strategic Investment GmbH",
      "company_seat": "Berlin",
      "details": "09.07.2025 (Bekanntmachungsdatum)\n\nBerlin Amtsgericht Berlin (Charlottenburg) HRB 118304\nRegisterbekanntmachung nach dem Umwandlungsgesetz 08.07.2025 (Eintragungsdatum)\n\nASI Asian Strategic Investment GmbH\nGesellschaft mit beschränkter Haftung\nBerlin\n\nZu Eintragungsnummer 6 vom 08.07.2025 wird als nicht eingetragen veröffentlicht: Den Gläubigern der an der Verschmelzung beteiligten Rechtsträger ist, wenn sie binnen sechs Monaten nach dem Tag, an dem die Eintragung der Verschmelzung in das Register des Sitzes desjenigen Rechtsträgers, dessen Gläubiger sie sind, als bekannt gemacht gilt, ihren Anspruch nach Grund und Höhe schriftlich anmelden, Sicherheit zu leisten, soweit sie nicht Befriedigung verlangen können. Dieses Recht steht den Gläubigern jedoch nur zu, wenn sie glaubhaft machen, dass durch die Verschmelzung die Erfüllung ihrer Forderung gefährdet wird. Das Recht, Sicherheitsleistung zu verlangen, steht Gläubigern nicht zu, die im Falle der Insolvenz ein Recht auf vorzugsweise Befriedigung aus einer Deckungsmasse haben, die nach gesetzlicher Vorschrift zu ihrem Schutz errichtet und staatlich überwacht ist."
    },
    {
      "date": "2025-07-09",
      "id": "115156",
      "original_text": "Löschungsankündigung\nMecklenburg-Vorpommern Amtsgericht Rostock HRB 13281\nForm Schnitt Rostock GmbH - Gesellschaft für Messe- und Ausstellungsbau – Stäbelow",
      "type": "Löschungsankündigung",
      "state": "Mecklenburg-Vorpommern",
      "amtsgericht": "Amtsgericht Rostock",
      "registernummer": "HRB 13281",
      "registerart": "HRB",
      "company_name": "Form Schnitt Rostock GmbH - Gesellschaft für Messe- und Ausstellungsbau",
      "company_seat": "Stäbelow",
      "details": "09.07.2025 (Bekanntmachungsdatum)\n\nMecklenburg-Vorpommern Amtsgericht Rostock HRB 13281\nLöschungsankündigung\n\nForm Schnitt Rostock GmbH - Gesellschaft für Messe- und Ausstellungsbau\nGesellschaft mit beschränkter Haftung\nStäbelow\n\nDas Registergericht beabsichtigt, die im Handelsregister eingetragene Gesellschaft von Amts wegen nach § 394 FamFG zu löschen. Die Frist zur Erhebung eines Widerspruchs gegen die beabsichtigte Löschung wird auf 1 Monat festgesetzt."
    },
    {
      "date": "2025-07-09",
      "id": "115157",
      "original_text": "Registerbekanntmachung nach dem Umwandlungsgesetz\nBaden-Württemberg Amtsgericht Mannheim HRB 420707\nSeibert GmbH – Hockenheim",
      "type": "Registerbekanntmachung nach dem Umwandlungsgesetz",
      "state": "Baden-Württemberg",
      "amtsgericht": "Amtsgericht Mannheim",
      "registernummer": "HRB 420707",
      "registerart": "HRB",
      "company_name": "Seibert GmbH",
      "company_seat": "Hockenheim",
      "details": "09.07.2025 (Bekanntmachungsdatum)\n\nBaden-Württemberg Amtsgericht Mannheim HRB 420707\nRegisterbekanntmachung nach dem Umwandlungsgesetz 09.07.2025 (Eintragungsdatum)\n\nSeibert GmbH\nGesellschaft mit beschränkter Haftung\nHockenheim\n\nDen Gläubigern der an der Verschmelzung beteiligten Rechtsträger ist, wenn sie binnen sechs Monaten nach dem Tag, an dem die Eintragung der Verschmelzung in das Register des Sitzes desjenigen Rechtsträgers, dessen Gläubiger sie sind, nach § 19 Abs. 3 UmwG als bekanntgemacht gilt, ihren Anspruch nach Grund und Höhe schriftlich anmelden, Sicherheit zu leisten, soweit sie nicht Befriedigung verlangen können. Dieses Recht steht den Gläubigern jedoch nur zu, wenn sie glaubhaft machen, dass durch die Verschmelzung die Erfüllung ihrer Forderung gefährdet wird."
    },
    {
      "date": "2025-07-09",
      "id": "115158",
      "original_text": "Registerbekanntmachung nach dem Umwandlungsgesetz\nBerlin Amtsgericht Berlin (Charlottenburg) HRB 208995\nMillennium Bangkok 1 GmbH – Berlin",
      "type": "Registerbekanntmachung nach dem Umwandlungsgesetz",
      "state": "Berlin",
      "amtsgericht": "Amtsgericht Berlin (Charlottenburg)",
      "registernummer": "HRB 208995",
      "registerart": "HRB",
      "company_name": "Millennium Bangkok 1 GmbH",
      "company_seat": "Berlin",
      "details": "09.07.2025 (Bekanntmachungsdatum)\n\nBerlin Amtsgericht Berlin (Charlottenburg) HRB 208995\nRegisterbekanntmachung nach dem Umwandlungsgesetz 08.07.2025 (Eintragungsdatum)\n\nMillennium Bangkok 1 GmbH\nGesellschaft mit beschränkter Haftung\nBerlin\n\nZu Eintragungsnummer 3 vom 08.07.2025 wird als nicht eingetragen veröffentlicht: Den Gläubigern der an der Verschmelzung beteiligten Rechtsträger ist, wenn sie binnen sechs Monaten nach dem Tag, an dem die Eintragung der Verschmelzung in das Register des Sitzes desjenigen Rechtsträgers, dessen Gläubiger sie sind, als bekannt gemacht gilt, ihren Anspruch nach Grund und Höhe schriftlich anmelden, Sicherheit zu leisten, soweit sie nicht Befriedigung verlangen können. Dieses Recht steht den Gläubigern jedoch nur zu, wenn sie glaubhaft machen, dass durch die Verschmelzung die Erfüllung ihrer Forderung gefährdet wird. Das Recht, Sicherheitsleistung zu verlangen, steht Gläubigern nicht zu, die im Falle der Insolvenz ein Recht auf vorzugsweise Befriedigung aus einer Deckungsmasse haben, die nach gesetzlicher Vorschrift zu ihrem Schutz errichtet und staatlich überwacht ist."
    },
    {
      "date": "2025-07-09",
      "id": "115159",
      "original_text": "Registerbekanntmachung nach dem Umwandlungsgesetz\nBerlin Amtsgericht Berlin (Charlottenburg) HRB 208922\nMillennium Bangkok 2 GmbH – Berlin",
      "type": "Registerbekanntmachung nach dem Umwandlungsgesetz",
      "state": "Berlin",
      "amtsgericht": "Amtsgericht Berlin (Charlottenburg)",
      "registernummer": "HRB 208922",
      "registerart": "HRB",
      "company_name": "Millennium Bangkok 2 GmbH",
      "company_seat": "Berlin",
      "details": "09.07.2025 (Bekanntmachungsdatum)\n\nBerlin Amtsgericht Berlin (Charlottenburg) HRB 208922\nRegisterbekanntmachung nach dem Umwandlungsgesetz 08.07.2025 (Eintragungsdatum)\n\nMillennium Bangkok 2 GmbH\nGesellschaft mit beschränkter Haftung\nBerlin\n\nZu Eintragungsnummer 3 vom 08.07.2025 wird als nicht eingetragen veröffentlicht: Den Gläubigern der an der Verschmelzung beteiligten Rechtsträger ist, wenn sie binnen sechs Monaten nach dem Tag, an dem die Eintragung der Verschmelzung in das Register des Sitzes desjenigen Rechtsträgers, dessen Gläubiger sie sind, als bekannt gemacht gilt, ihren Anspruch nach Grund und Höhe schriftlich anmelden, Sicherheit zu leisten, soweit sie nicht Befriedigung verlangen können. Dieses Recht steht den Gläubigern jedoch nur zu, wenn sie glaubhaft machen, dass durch die Verschmelzung die Erfüllung ihrer Forderung gefährdet wird. Das Recht, Sicherheitsleistung zu verlangen, steht Gläubigern nicht zu, die im Falle der Insolvenz ein Recht auf vorzugsweise Befriedigung aus einer Deckungsmasse haben, die nach gesetzlicher Vorschrift zu ihrem Schutz errichtet und staatlich überwacht ist."
    },
    {
      "date": "2025-07-09",
      "id": "115160",
      "original_text": "Sonstige Registerbekanntmachung\nHamburg Amtsgericht Hamburg HRB 120594\nHamburger Energiewerke GmbH – Hamburg",
      "type": "Sonstige Registerbekanntmachung",
      "state": "Hamburg",
      "amtsgericht": "Amtsgericht Hamburg",
      "registernummer": "HRB 120594",
      "registerart": "HRB",
      "company_name": "Hamburger Energiewerke GmbH",
      "company_seat": "Hamburg",
      "details": "09.07.2025 (Bekanntmachungsdatum)\n\nHamburg Amtsgericht Hamburg HRB 120594\nSonstige Registerbekanntmachung\n\nHamburger Energiewerke GmbH\nGesellschaft mit beschränkter Haftung\nHamburg\n\nAls nicht eingetragen wird bekannt gemacht: Liste des Aufsichtsrats wurde eingereicht."
    },
    {
      "date": "2025-07-09",
      "id": "115161",
      "original_text": "Registerbekanntmachung nach dem Umwandlungsgesetz\nBerlin Amtsgericht Berlin (Charlottenburg) HRB 242006\nBelgravia Bangkok 1 GmbH – Berlin",
      "type": "Registerbekanntmachung nach dem Umwandlungsgesetz",
      "state": "Berlin",
      "amtsgericht": "Amtsgericht Berlin (Charlottenburg)",
      "registernummer": "HRB 242006",
      "registerart": "HRB",
      "company_name": "Belgravia Bangkok 1 GmbH",
      "company_seat": "Berlin",
      "details": "09.07.2025 (Bekanntmachungsdatum)\n\nBerlin Amtsgericht Berlin (Charlottenburg) HRB 242006\nRegisterbekanntmachung nach dem Umwandlungsgesetz 08.07.2025 (Eintragungsdatum)\n\nBelgravia Bangkok 1 GmbH\nGesellschaft mit beschränkter Haftung\nBerlin\n\nZu Eintragungsnummer 3 vom 08.07.2025 wird als nicht eingetragen veröffentlicht: Den Gläubigern der an der Verschmelzung beteiligten Rechtsträger ist, wenn sie binnen sechs Monaten nach dem Tag, an dem die Eintragung der Verschmelzung in das Register des Sitzes desjenigen Rechtsträgers, dessen Gläubiger sie sind, als bekannt gemacht gilt, ihren Anspruch nach Grund und Höhe schriftlich anmelden, Sicherheit zu leisten, soweit sie nicht Befriedigung verlangen können. Dieses Recht steht den Gläubigern jedoch nur zu, wenn sie glaubhaft machen, dass durch die Verschmelzung die Erfüllung ihrer Forderung gefährdet wird. Das Recht, Sicherheitsleistung zu verlangen, steht Gläubigern nicht zu, die im Falle der Insolvenz ein Recht auf vorzugsweise Befriedigung aus einer Deckungsmasse haben, die nach gesetzlicher Vorschrift zu ihrem Schutz errichtet und staatlich überwacht ist."
    },
    {
      "date": "2025-07-09",
      "id": "115162",
      "original_text": "Registerbekanntmachung nach dem Umwandlungsgesetz\nBaden-Württemberg Amtsgericht Mannheim HRB 421547\nHSP Verwaltungs GmbH – Hockenheim",
      "type": "Registerbekanntmachung nach dem Umwandlungsgesetz",
      "state": "Baden-Württemberg",
      "amtsgericht": "Amtsgericht Mannheim",
      "registernummer": "HRB 421547",
      "registerart": "HRB",
      "company_name": "HSP Verwaltungs GmbH",
      "company_seat": "Hockenheim",
      "details": "09.07.2025 (Bekanntmachungsdatum)\n\nBaden-Württemberg Amtsgericht Mannheim HRB 421547\nRegisterbekanntmachung nach dem Umwandlungsgesetz 09.07.2025 (Eintragungsdatum)\n\nHSP Verwaltungs GmbH\nGesellschaft mit beschränkter Haftung\nHockenheim\n\nDen Gläubigern der an der Verschmelzung beteiligten Rechtsträger ist, wenn sie binnen sechs Monaten nach dem Tag, an dem die Eintragung der Verschmelzung in das Register des Sitzes desjenigen Rechtsträgers, dessen Gläubiger sie sind, nach § 19 Abs. 3 UmwG als bekanntgemacht gilt, ihren Anspruch nach Grund und Höhe schriftlich anmelden, Sicherheit zu leisten, soweit sie nicht Befriedigung verlangen können. Dieses Recht steht den Gläubigern jedoch nur zu, wenn sie glaubhaft machen, dass durch die Verschmelzung die Erfüllung ihrer Forderung gefährdet wird."
    },
    {
      "date": "2025-07-09",
      "id": "115163",
      "original_text": "Registerbekanntmachung nach dem Umwandlungsgesetz\nBerlin Amtsgericht Berlin (Charlottenburg) HRB 209716\nMillennium Bangkok 3 GmbH – Berlin",
      "type": "Registerbekanntmachung nach dem Umwandlungsgesetz",
      "state": "Berlin",
      "amtsgericht": "Amtsgericht Berlin (Charlottenburg)",
      "registernummer": "HRB 209716",
      "registerart": "HRB",
      "company_name": "Millennium Bangkok 3 GmbH",
      "company_seat": "Berlin",
      "details": "09.07.2025 (Bekanntmachungsdatum)\n\nBerlin Amtsgericht Berlin (Charlottenburg) HRB 209716\nRegisterbekanntmachung nach dem Umwandlungsgesetz 08.07.2025 (Eintragungsdatum)\n\nMillennium Bangkok 3 GmbH\nGesellschaft mit beschränkter Haftung\nBerlin\n\nZu Eintragungsnummer 3 vom 08.07.2025 wird als nicht eingetragen veröffentlicht: Den Gläubigern der an der Verschmelzung beteiligten Rechtsträger ist, wenn sie binnen sechs Monaten nach dem Tag, an dem die Eintragung der Verschmelzung in das Register des Sitzes desjenigen Rechtsträgers, dessen Gläubiger sie sind, als bekannt gemacht gilt, ihren Anspruch nach Grund und Höhe schriftlich anmelden, Sicherheit zu leisten, soweit sie nicht Befriedigung verlangen können. Dieses Recht steht den Gläubigern jedoch nur zu, wenn sie glaubhaft machen, dass durch die Verschmelzung die Erfüllung ihrer Forderung gefährdet wird. Das Recht, Sicherheitsleistung zu verlangen, steht Gläubigern nicht zu, die im Falle der Insolvenz ein Recht auf vorzugsweise Befriedigung aus einer Deckungsmasse haben, die nach gesetzlicher Vorschrift zu ihrem Schutz errichtet und staatlich überwacht ist."
    },
    {
      "date": "2025-07-09",
      "id": "115164",
      "original_text": "Einreichung neuer Dokumente\nBaden-Württemberg Amtsgericht Stuttgart HRB 739366\nJürgen Friedl & Söhne AG – Filderstadt",
      "type": "Einreichung neuer Dokumente",
      "state": "Baden-Württemberg",
      "amtsgericht": "Amtsgericht Stuttgart",
      "registernummer": "HRB 739366",
      "registerart": "HRB",
      "company_name": "Jürgen Friedl & Söhne AG",
      "company_seat": "Filderstadt",
      "details": "09.07.2025 (Bekanntmachungsdatum)\n\nBaden-Württemberg Amtsgericht Stuttgart HRB 739366\nEinreichung neuer Dokumente\n\nJürgen Friedl & Söhne AG\nAktiengesellschaft\nFilderstadt\n\nDie Gesellschaft hat am 08.07.2025 die Liste über die Zusammensetzung des Aufsichtsrats zum Handelsregister eingereicht."
    },
    {
      "date": "2025-07-09",
      "id": "115165",
      "original_text": "Registerbekanntmachung nach dem Umwandlungsgesetz\nSchleswig-Holstein Amtsgericht Kiel HRB 13534\nEcho 4. Grundbesitzverwaltungsgesellschaft mbH – Norderstedt",
      "type": "Registerbekanntmachung nach dem Umwandlungsgesetz",
      "state": "Schleswig-Holstein",
      "amtsgericht": "Amtsgericht Kiel",
      "registernummer": "HRB 13534",
      "registerart": "HRB",
      "company_name": "Echo 4. Grundbesitzverwaltungsgesellschaft mbH",
      "company_seat": "Norderstedt",
      "details": "09.07.2025 (Bekanntmachungsdatum)\n\nSchleswig-Holstein Amtsgericht Kiel HRB 13534\nRegisterbekanntmachung nach dem Umwandlungsgesetz 08.07.2025 (Eintragungsdatum)\n\nEcho 4. Grundbesitzverwaltungsgesellschaft mbH\nGesellschaft mit beschränkter Haftung\nNorderstedt\n\nZu Eintragungsnummer 12 vom 08.07.2025 wird als nicht eingetragen veröffentlicht: Den Gläubigern der an der Verschmelzung beteiligten Rechtsträger ist, wenn sie binnen sechs Monaten nach dem Tag, an dem die Eintragung der Verschmelzung in das Register des Sitzes desjenigen Rechtsträgers, dessen Gläubiger sie sind, nach § 19 Abs. 3 UmwG bekannt gemacht worden ist, ihren Anspruch nach Grund und Höhe schriftlich anmelden, Sicherheit zu leisten, soweit sie nicht Befriedigung verlangen können. Dieses Recht steht den Gläubigern jedoch nur zu, wenn sie glaubhaft machen, dass durch die Verschmelzung die Erfüllung ihrer Forderung gefährdet wird."
    },
    {
      "date": "2025-07-09",
      "id": "115166",
      "original_text": "Registerbekanntmachung nach dem Umwandlungsgesetz\nBerlin Amtsgericht Berlin (Charlottenburg) HRB 205562\nFullerton Bangkok 3 GmbH – Berlin",
      "type": "Registerbekanntmachung nach dem Umwandlungsgesetz",
      "state": "Berlin",
      "amtsgericht": "Amtsgericht Berlin (Charlottenburg)",
      "registernummer": "HRB 205562",
      "registerart": "HRB",
      "company_name": "Fullerton Bangkok 3 GmbH",
      "company_seat": "Berlin",
      "details": "09.07.2025 (Bekanntmachungsdatum)\n\nBerlin Amtsgericht Berlin (Charlottenburg) HRB 205562\nRegisterbekanntmachung nach dem Umwandlungsgesetz 08.07.2025 (Eintragungsdatum)\n\nFullerton Bangkok 3 GmbH\nGesellschaft mit beschränkter Haftung\nBerlin\n\nZu Eintragungsnummer 3 vom 08.07.2025 wird als nicht eingetragen veröffentlicht: Den Gläubigern der an der Verschmelzung beteiligten Rechtsträger ist, wenn sie binnen sechs Monaten nach dem Tag, an dem die Eintragung der Verschmelzung in das Register des Sitzes desjenigen Rechtsträgers, dessen Gläubiger sie sind, als bekannt gemacht gilt, ihren Anspruch nach Grund und Höhe schriftlich anmelden, Sicherheit zu leisten, soweit sie nicht Befriedigung verlangen können. Dieses Recht steht den Gläubigern jedoch nur zu, wenn sie glaubhaft machen, dass durch die Verschmelzung die Erfüllung ihrer Forderung gefährdet wird. Das Recht, Sicherheitsleistung zu verlangen, steht Gläubigern nicht zu, die im Falle der Insolvenz ein Recht auf vorzugsweise Befriedigung aus einer Deckungsmasse haben, die nach gesetzlicher Vorschrift zu ihrem Schutz errichtet und staatlich überwacht ist."
    },
    {
      "date": "2025-07-09",
      "id": "115167",
      "original_text": "Einreichung neuer Dokumente\nBaden-Württemberg Amtsgericht Stuttgart HRB 59\nSchlossgartenbau-Aktiengesellschaft – Stuttgart",
      "type": "Einreichung neuer Dokumente",
      "state": "Baden-Württemberg",
      "amtsgericht": "Amtsgericht Stuttgart",
      "registernummer": "HRB 59",
      "registerart": "HRB",
      "company_name": "Schlossgartenbau-Aktiengesellschaft",
      "company_seat": "Stuttgart",
      "details": "09.07.2025 (Bekanntmachungsdatum)\n\nBaden-Württemberg Amtsgericht Stuttgart HRB 59\nEinreichung neuer Dokumente 09.07.2025 (Eintragungsdatum)\n\nSchlossgartenbau-Aktiengesellschaft\nAktiengesellschaft\nStuttgart\n\nDie Gesellschaft hat am 08.07.2025 die Liste über die Zusammensetzung des Aufsichtsrats zum Handelsregister eingereicht."
    },
    {
      "date": "2025-07-09",
      "id": "115168",
      "original_text": "Löschungsankündigung\nBaden-Württemberg Amtsgericht Freiburg HRB 718201\nFILTONEX GmbH – Mönchweiler",
      "type": "Löschungsankündigung",
      "state": "Baden-Württemberg",
      "amtsgericht": "Amtsgericht Freiburg",
      "registernummer": "HRB 718201",
      "registerart": "HRB",
      "company_name": "FILTONEX GmbH",
      "company_seat": "Mönchweiler",
      "details": "09.07.2025 (Bekanntmachungsdatum)\n\nBaden-Württemberg Amtsgericht Freiburg HRB 718201\nLöschungsankündigung\n\nFILTONEX GmbH\nGesellschaft mit beschränkter Haftung\nMönchweiler\n\nDas Gericht beabsichtigt, die Gesellschaft wegen Vermögenslosigkeit im Handelsregister von Amts wegen nach § 394 FamFG zu löschen. Die Frist zur Geltendmachung eines Widerspruchs gegen die beabsichtigte Löschung ist auf einen Monat ab Veröffentlichung bestimmt."
    },
    {
      "date": "2025-07-09",
      "id": "115169",
      "original_text": "Einreichung neuer Dokumente\nBaden-Württemberg Amtsgericht Stuttgart HRB 350061\nekz.bibliotheksservice GmbH – Reutlingen",
      "type": "Einreichung neuer Dokumente",
      "state": "Baden-Württemberg",
      "amtsgericht": "Amtsgericht Stuttgart",
      "registernummer": "HRB 350061",
      "registerart": "HRB",
      "company_name": "ekz.bibliotheksservice GmbH",
      "company_seat": "Reutlingen",
      "details": "09.07.2025 (Bekanntmachungsdatum)\n\nBaden-Württemberg Amtsgericht Stuttgart HRB 350061\nEinreichung neuer Dokumente 09.07.2025 (Eintragungsdatum)\n\nekz.bibliotheksservice GmbH\nGesellschaft mit beschränkter Haftung\nReutlingen\n\nDie Gesellschaft hat am 08.07.2025 die Liste über die Zusammensetzung des Aufsichtsrats zum Handelsregister eingereicht."
    },
    {
      "date": "2025-07-09",
      "id": "115170",
      "original_text": "Registerbekanntmachung nach dem Umwandlungsgesetz\nMecklenburg-Vorpommern Amtsgericht Stralsund HRB 22911\nTF Pensionsgesellschaft mbH – Breege",
      "type": "Registerbekanntmachung nach dem Umwandlungsgesetz",
      "state": "Mecklenburg-Vorpommern",
      "amtsgericht": "Amtsgericht Stralsund",
      "registernummer": "HRB 22911",
      "registerart": "HRB",
      "company_name": "TF Pensionsgesellschaft mbH",
      "company_seat": "Breege",
      "details": "09.07.2025 (Bekanntmachungsdatum)\n\nMecklenburg-Vorpommern Amtsgericht Stralsund HRB 22911\nRegisterbekanntmachung nach dem Umwandlungsgesetz 09.07.2025 (Eintragungsdatum)\n\nTF Pensionsgesellschaft mbH\nGesellschaft mit beschränkter Haftung\nBreege\n\nAls nicht eingetragen wird veröffentlicht: Den Gläubigern der an der Umwandlung beteiligten Rechtsträger ist, wenn sie binnen sechs\nMonaten nach dem Tag, an dem die Eintragung der Umwandlung in das Register des Sitzes desjenigen Rechtsträgers, dessen Gläubiger sie sind, nach § 19 Abs. 3 UmwG als bekannt gemacht gilt, ihren Anspruch nach Grund und Höhe in Textform anmelden, Sicherheit zu leisten, soweit sie nicht Befriedigung verlangen können. Dieses Recht steht den Gläubigern jedoch nur zu, wenn sie glaubhaft machen, dass durch die Umwandlung die Erfüllung der Forderung gefährdet wird."
    },
    {
      "date": "2025-07-09",
      "id": "115171",
      "original_text": "Registerbekanntmachung nach dem Umwandlungsgesetz\nMecklenburg-Vorpommern Amtsgericht Stralsund HRA 20989\nThomas Frankes Pension Hinter der Düne e.K. – Breege",
      "type": "Registerbekanntmachung nach dem Umwandlungsgesetz",
      "state": "Mecklenburg-Vorpommern",
      "amtsgericht": "Amtsgericht Stralsund",
      "registernummer": "HRA 20989",
      "registerart": "HRA",
      "company_name": "Thomas Frankes Pension Hinter der Düne e.K.",
      "company_seat": "Breege",
      "details": "09.07.2025 (Bekanntmachungsdatum)\n\nMecklenburg-Vorpommern Amtsgericht Stralsund HRA 20989\nRegisterbekanntmachung nach dem Umwandlungsgesetz 09.07.2025 (Eintragungsdatum)\n\nThomas Frankes Pension Hinter der Düne e.K.\nEinzelkaufmann / Einzelkauffrau\nBreege\n\nAls nicht eingetragen wird veröffentlicht: Den Gläubigern der an der Umwandlung beteiligten Rechtsträger ist, wenn sie binnen sechs\nMonaten nach dem Tag, an dem die Eintragung der Umwandlung in das Register des Sitzes desjenigen Rechtsträgers, dessen Gläubiger sie sind, nach § 19 Abs. 3 UmwG als bekannt gemacht gilt, ihren Anspruch nach Grund und Höhe in Textform anmelden, Sicherheit zu leisten, soweit sie nicht Befriedigung verlangen können. Dieses Recht steht den Gläubigern jedoch nur zu, wenn sie glaubhaft machen, dass durch die Umwandlung die Erfüllung der Forderung gefährdet wird."
    },
    {
      "date": "2025-07-09",
      "id": "115172",
      "original_text": "Registerbekanntmachung nach dem Umwandlungsgesetz\nSachsen Amtsgericht Dresden HRA 12244\nSenioren- und Alltagsbegleitung Antje Krämer e. K. – Dresden",
      "type": "Registerbekanntmachung nach dem Umwandlungsgesetz",
      "state": "Sachsen",
      "amtsgericht": "Amtsgericht Dresden",
      "registernummer": "HRA 12244",
      "registerart": "HRA",
      "company_name": "Senioren- und Alltagsbegleitung Antje Krämer e. K.",
      "company_seat": "Dresden",
      "details": "09.07.2025 (Bekanntmachungsdatum)\n\nSachsen Amtsgericht Dresden HRA 12244\nRegisterbekanntmachung nach dem Umwandlungsgesetz 09.07.2025 (Eintragungsdatum)\n\nSenioren- und Alltagsbegleitung Antje Krämer e. K.\nEinzelkaufmann / Einzelkauffrau\nDresden\n\nDen Gläubigern der an der Ausgliederung beteiligten Rechtsträger ist, wenn sie binnen sechs Monaten nach dem Tag, an dem die Eintragung der Ausgliederung in das Register des Sitzes desjenigen Rechtsträgers, dessen Gläubiger sie sind, nach § 19 Abs. 3 UmwG als bekannt gemacht gilt, ihren Anspruch nach Grund und Höhe in Textform anmelden, Sicherheit zu leisten, soweit sie nicht Befriedigung verlangen können. Dieses Recht steht den Gläubigern jedoch nur zu, wenn sie glaubhaft machen, dass durch die Ausgliederung die Erfüllung der Forderung gefährdet wird."
    },
    {
      "date": "2025-07-09",
      "id": "115173",
      "original_text": "Registerbekanntmachung nach dem Umwandlungsgesetz\nSachsen Amtsgericht Dresden HRB 15912\nBergsicherung Freital GmbH – Freital",
      "type": "Registerbekanntmachung nach dem Umwandlungsgesetz",
      "state": "Sachsen",
      "amtsgericht": "Amtsgericht Dresden",
      "registernummer": "HRB 15912",
      "registerart": "HRB",
      "company_name": "Bergsicherung Freital GmbH",
      "company_seat": "Freital",
      "details": "09.07.2025 (Bekanntmachungsdatum)\n\nSachsen Amtsgericht Dresden HRB 15912\nRegisterbekanntmachung nach dem Umwandlungsgesetz 09.07.2025 (Eintragungsdatum)\n\nBergsicherung Freital GmbH\nGesellschaft mit beschränkter Haftung\nFreital\n\nDen Gläubigern der an der Ausgliederung beteiligten Rechtsträger ist, wenn sie binnen sechs Monaten nach dem Tag, an dem die Eintragung der Ausgliederung in das Register des Sitzes desjenigen Rechtsträgers, dessen Gläubiger sie sind, nach § 19 Abs. 3 UmwG als bekannt gemacht gilt, ihren Anspruch nach Grund und Höhe in Textform anmelden, Sicherheit zu leisten, soweit sie nicht Befriedigung verlangen können. Dieses Recht steht den Gläubigern jedoch nur zu, wenn sie glaubhaft machen, dass durch die Ausgliederung die Erfüllung der Forderung gefährdet wird."
    },
    {
      "date": "2025-07-09",
      "id": "115174",
      "original_text": "Löschungsankündigung\nSachsen Amtsgericht Dresden HRB 33975\nPatientenbeförderung Rohnstock UG (haftungsbeschränkt) – Pirna",
      "type": "Löschungsankündigung",
      "state": "Sachsen",
      "amtsgericht": "Amtsgericht Dresden",
      "registernummer": "HRB 33975",
      "registerart": "HRB",
      "company_name": "Patientenbeförderung Rohnstock UG (haftungsbeschränkt)",
      "company_seat": "Pirna",
      "details": "09.07.2025 (Bekanntmachungsdatum)\n\nSachsen Amtsgericht Dresden HRB 33975\nLöschungsankündigung\n\nPatientenbeförderung Rohnstock UG (haftungsbeschränkt)\nGesellschaft mit beschränkter Haftung\nPirna\n\nDas Registergericht beabsichtigt, die im Handelsregister eingetragene Gesellschaft von Amts wegen nach § 394 FamFG zu löschen. Die Frist zu Erhebung eines Widerspruchs gegen die beabsichtigte Löschung wird auf einen Monat festgesetzt."
    },
    {
      "date": "2025-07-09",
      "id": "115175",
      "original_text": "Registerbekanntmachung nach dem Umwandlungsgesetz\nSachsen Amtsgericht Dresden HRB 26396\nAurig Kapitalverwaltungs GmbH – Dresden",
      "type": "Registerbekanntmachung nach dem Umwandlungsgesetz",
      "state": "Sachsen",
      "amtsgericht": "Amtsgericht Dresden",
      "registernummer": "HRB 26396",
      "registerart": "HRB",
      "company_name": "Aurig Kapitalverwaltungs GmbH",
      "company_seat": "Dresden",
      "details": "09.07.2025 (Bekanntmachungsdatum)\n\nSachsen Amtsgericht Dresden HRB 26396\nRegisterbekanntmachung nach dem Umwandlungsgesetz 09.07.2025 (Eintragungsdatum)\n\nAurig Kapitalverwaltungs GmbH\nGesellschaft mit beschränkter Haftung\nDresden\n\nDen Gläubigern der an der Verschmelzung beteiligten Rechtsträger ist, wenn sie binnen sechs Monaten nach dem Tag, an dem die Eintragung der Verschmelzung in das Register des Sitzes desjenigen Rechtsträgers, dessen Gläubiger sie sind, nach § 19 Abs. 3 UmwG als bekannt gemacht gilt, ihren Anspruch nach Grund und Höhe in Textform anmelden, Sicherheit zu leisten, soweit sie nicht Befriedigung verlangen können. Dieses Recht steht den Gläubigern jedoch nur zu, wenn sie glaubhaft machen, dass durch die Verschmelzung die Erfüllung der Forderung gefährdet wird."
    },
    {
      "date": "2025-07-09",
      "id": "115176",
      "original_text": "Registerbekanntmachung nach dem Umwandlungsgesetz\nSachsen Amtsgericht Dresden HRB 41671\ndescript Solutions GmbH – Dresden",
      "type": "Registerbekanntmachung nach dem Umwandlungsgesetz",
      "state": "Sachsen",
      "amtsgericht": "Amtsgericht Dresden",
      "registernummer": "HRB 41671",
      "registerart": "HRB",
      "company_name": "descript Solutions GmbH",
      "company_seat": "Dresden",
      "details": "09.07.2025 (Bekanntmachungsdatum)\n\nSachsen Amtsgericht Dresden HRB 41671\nRegisterbekanntmachung nach dem Umwandlungsgesetz 09.07.2025 (Eintragungsdatum)\n\ndescript Solutions GmbH\nGesellschaft mit beschränkter Haftung\nDresden\n\nDen Gläubigern der an der Verschmelzung beteiligten Rechtsträger ist, wenn sie binnen sechs Monaten nach dem Tag, an dem die Eintragung der Verschmelzung in das Register des Sitzes desjenigen Rechtsträgers, dessen Gläubiger sie sind, nach § 19 Abs. 3 UmwG als bekannt gemacht gilt, ihren Anspruch nach Grund und Höhe in Textform anmelden, Sicherheit zu leisten, soweit sie nicht Befriedigung verlangen können. Dieses Recht steht den Gläubigern jedoch nur zu, wenn sie glaubhaft machen, dass durch die Verschmelzung die Erfüllung der Forderung gefährdet wird."
    },
    {
      "date": "2025-07-09",
      "id": "115177",
      "original_text": "Einreichung neuer Dokumente\nSachsen Amtsgericht Leipzig HRB 1874\nFlughafen Leipzig/Halle Gesellschaft mit beschränkter Haftung – Leipzig",
      "type": "Einreichung neuer Dokumente",
      "state": "Sachsen",
      "amtsgericht": "Amtsgericht Leipzig",
      "registernummer": "HRB 1874",
      "registerart": "HRB",
      "company_name": "Flughafen Leipzig/Halle Gesellschaft mit beschränkter Haftung",
      "company_seat": "Leipzig",
      "details": "09.07.2025 (Bekanntmachungsdatum)\n\nSachsen Amtsgericht Leipzig HRB 1874\nEinreichung neuer Dokumente\n\nFlughafen Leipzig/Halle Gesellschaft mit beschränkter Haftung\nGesellschaft mit beschränkter Haftung\nLeipzig\n\nAm 07.07.2025 wurde beim Handelsregister des Amtsgerichts Leipzig die Liste der Mitglieder des Aufsichtsrats gemäß § 52 GmbHG eingereicht."
    },
    {
      "date": "2025-07-09",
      "id": "115178",
      "original_text": "Registerbekanntmachung nach dem Umwandlungsgesetz\nSachsen Amtsgericht Dresden HRB 25264\nAurig Kapitalverwaltungs GmbH – Dresden",
      "type": "Registerbekanntmachung nach dem Umwandlungsgesetz",
      "state": "Sachsen",
      "amtsgericht": "Amtsgericht Dresden",
      "registernummer": "HRB 25264",
      "registerart": "HRB",
      "company_name": "Aurig Kapitalverwaltungs GmbH",
      "company_seat": "Dresden",
      "details": "09.07.2025 (Bekanntmachungsdatum)\n\nSachsen Amtsgericht Dresden HRB 25264\nRegisterbekanntmachung nach dem Umwandlungsgesetz 09.07.2025 (Eintragungsdatum)\n\nAurig Kapitalverwaltungs GmbH\nGesellschaft mit beschränkter Haftung\nDresden\n\nDen Gläubigern der an der Verschmelzung beteiligten Rechtsträger ist, wenn sie binnen sechs Monaten nach dem Tag, an dem die Eintragung der Verschmelzung in das Register des Sitzes desjenigen Rechtsträgers, dessen Gläubiger sie sind, nach § 19 Abs. 3 UmwG als bekannt gemacht gilt, ihren Anspruch nach Grund und Höhe in Textform anmelden, Sicherheit zu leisten, soweit sie nicht Befriedigung verlangen können. Dieses Recht steht den Gläubigern jedoch nur zu, wenn sie glaubhaft machen, dass durch die Verschmelzung die Erfüllung der Forderung gefährdet wird."
    },
    {
      "date": "2025-07-09",
      "id": "115179",
      "original_text": "Registerbekanntmachung nach dem Umwandlungsgesetz\nSachsen Amtsgericht Dresden HRB 45424\nMarienschacht GmbH – Freital",
      "type": "Registerbekanntmachung nach dem Umwandlungsgesetz",
      "state": "Sachsen",
      "amtsgericht": "Amtsgericht Dresden",
      "registernummer": "HRB 45424",
      "registerart": "HRB",
      "company_name": "Marienschacht GmbH",
      "company_seat": "Freital",
      "details": "09.07.2025 (Bekanntmachungsdatum)\n\nSachsen Amtsgericht Dresden HRB 45424\nRegisterbekanntmachung nach dem Umwandlungsgesetz 09.07.2025 (Eintragungsdatum)\n\nMarienschacht GmbH\nGesellschaft mit beschränkter Haftung\nFreital\n\nDen Gläubigern der an der Ausgliederung beteiligten Rechtsträger ist, wenn sie binnen sechs Monaten nach dem Tag, an dem die Eintragung der Ausgliederung in das Register des Sitzes desjenigen Rechtsträgers, dessen Gläubiger sie sind, nach § 19 Abs. 3 UmwG als bekannt gemacht gilt, ihren Anspruch nach Grund und Höhe in Textform anmelden, Sicherheit zu leisten, soweit sie nicht Befriedigung verlangen können. Dieses Recht steht den Gläubigern jedoch nur zu, wenn sie glaubhaft machen, dass durch die Ausgliederung die Erfüllung der Forderung gefährdet wird."
    },
    {
      "date": "2025-07-09",
      "id": "115180",
      "original_text": "Registerbekanntmachung nach dem Umwandlungsgesetz\nSachsen Amtsgericht Dresden HRB 39678\nMataono GmbH – Dresden",
      "type": "Registerbekanntmachung nach dem Umwandlungsgesetz",
      "state": "Sachsen",
      "amtsgericht": "Amtsgericht Dresden",
      "registernummer": "HRB 39678",
      "registerart": "HRB",
      "company_name": "Mataono GmbH",
      "company_seat": "Dresden",
      "details": "09.07.2025 (Bekanntmachungsdatum)\n\nSachsen Amtsgericht Dresden HRB 39678\nRegisterbekanntmachung nach dem Umwandlungsgesetz 09.07.2025 (Eintragungsdatum)\n\nMataono GmbH\nGesellschaft mit beschränkter Haftung\nDresden\n\nDen Gläubigern der an der Verschmelzung beteiligten Rechtsträger ist, wenn sie binnen sechs Monaten nach dem Tag, an dem die Eintragung der Verschmelzung in das Register des Sitzes desjenigen Rechtsträgers, dessen Gläubiger sie sind, nach § 19 Abs. 3 UmwG als bekannt gemacht gilt, ihren Anspruch nach Grund und Höhe in Textform anmelden, Sicherheit zu leisten, soweit sie nicht Befriedigung verlangen können. Dieses Recht steht den Gläubigern jedoch nur zu, wenn sie glaubhaft machen, dass durch die Verschmelzung die Erfüllung der Forderung gefährdet wird."
    },
    {
      "date": "2025-07-09",
      "id": "115181",
      "original_text": "Registerbekanntmachung nach dem Umwandlungsgesetz\nSachsen Amtsgericht Dresden HRB 46598\nGoodFeelings GmbH – Dresden",
      "type": "Registerbekanntmachung nach dem Umwandlungsgesetz",
      "state": "Sachsen",
      "amtsgericht": "Amtsgericht Dresden",
      "registernummer": "HRB 46598",
      "registerart": "HRB",
      "company_name": "GoodFeelings GmbH",
      "company_seat": "Dresden",
      "details": "09.07.2025 (Bekanntmachungsdatum)\n\nSachsen Amtsgericht Dresden HRB 46598\nRegisterbekanntmachung nach dem Umwandlungsgesetz 09.07.2025 (Eintragungsdatum)\n\nGoodFeelings GmbH\nGesellschaft mit beschränkter Haftung\nDresden\n\nDen Gläubigern der an der Ausgliederung beteiligten Rechtsträger ist, wenn sie binnen sechs Monaten nach dem Tag, an dem die Eintragung der Ausgliederung in das Register des Sitzes desjenigen Rechtsträgers, dessen Gläubiger sie sind, nach § 19 Abs. 3 UmwG als bekannt gemacht gilt, ihren Anspruch nach Grund und Höhe in Textform anmelden, Sicherheit zu leisten, soweit sie nicht Befriedigung verlangen können. Dieses Recht steht den Gläubigern jedoch nur zu, wenn sie glaubhaft machen, dass durch die Ausgliederung die Erfüllung der Forderung gefährdet wird."
    },
    {
      "date": "2025-07-09",
      "id": "115182",
      "original_text": "Registerbekanntmachung nach dem Umwandlungsgesetz\nSachsen Amtsgericht Dresden HRB 3724\nINFRAPLAN MELIOR GmbH – Dresden",
      "type": "Registerbekanntmachung nach dem Umwandlungsgesetz",
      "state": "Sachsen",
      "amtsgericht": "Amtsgericht Dresden",
      "registernummer": "HRB 3724",
      "registerart": "HRB",
      "company_name": "INFRAPLAN MELIOR GmbH",
      "company_seat": "Dresden",
      "details": "09.07.2025 (Bekanntmachungsdatum)\n\nSachsen Amtsgericht Dresden HRB 3724\nRegisterbekanntmachung nach dem Umwandlungsgesetz 09.07.2025 (Eintragungsdatum)\n\nINFRAPLAN MELIOR GmbH\nGesellschaft mit beschränkter Haftung\nDresden\n\nDen Gläubigern der an der Verschmelzung beteiligten Rechtsträger ist, wenn sie binnen sechs Monaten nach dem Tag, an dem die Eintragung der Verschmelzung in das Register des Sitzes desjenigen Rechtsträgers, dessen Gläubiger sie sind, nach § 19 Abs. 3 UmwG als bekannt gemacht gilt, ihren Anspruch nach Grund und Höhe in Textform anmelden, Sicherheit zu leisten, soweit sie nicht Befriedigung verlangen können. Dieses Recht steht den Gläubigern jedoch nur zu, wenn sie glaubhaft machen, dass durch die Verschmelzung die Erfüllung der Forderung gefährdet wird."
    },
    {
      "date": "2025-07-09",
      "id": "115183",
      "original_text": "Registerbekanntmachung nach dem Umwandlungsgesetz\nNiedersachsen Amtsgericht Braunschweig HRB 200638\nRolleiwerke GmbH – Braunschweig",
      "type": "Registerbekanntmachung nach dem Umwandlungsgesetz",
      "state": "Niedersachsen",
      "amtsgericht": "Amtsgericht Braunschweig",
      "registernummer": "HRB 200638",
      "registerart": "HRB",
      "company_name": "Rolleiwerke GmbH",
      "company_seat": "Braunschweig",
      "details": "09.07.2025 (Bekanntmachungsdatum)\n\nNiedersachsen Amtsgericht Braunschweig HRB 200638\nRegisterbekanntmachung nach dem Umwandlungsgesetz 09.07.2025 (Eintragungsdatum)\n\nRolleiwerke GmbH\nGesellschaft mit beschränkter Haftung\nBraunschweig\n\nDen Gläubigern der an der Verschmelzung beteiligten Rechtsträger ist, wenn sie binnen sechs Monaten nach dem Tag, an dem die Eintragung der Verschmelzung in das Register des Sitzes desjenigen Rechtsträgers, dessen Gläubiger sie sind, nach § 19  Abs.  3 UmwG als bekannt gemacht gilt, ihren Anspruch nach Grund und Höhe schriftlich anmelden, Sicherheit zu leisten, soweit sie nicht Befriedigung verlangen können. Dieses Recht steht den Gläubigern jedoch nur zu, wenn sie glaubhaft machen, dass durch die Verschmelzung die Erfüllung der Forderung gefährdet wird."
    },
    {
      "date": "2025-07-09",
      "id": "115184",
      "original_text": "Einreichung neuer Dokumente\nNiedersachsen Amtsgericht Hannover HRB 4704\nFlughafen Hannover-Langenhagen Gesellschaft mit beschränkter Haftung – Hannover",
      "type": "Einreichung neuer Dokumente",
      "state": "Niedersachsen",
      "amtsgericht": "Amtsgericht Hannover",
      "registernummer": "HRB 4704",
      "registerart": "HRB",
      "company_name": "Flughafen Hannover-Langenhagen Gesellschaft mit beschränkter Haftung",
      "company_seat": "Hannover",
      "details": "09.07.2025 (Bekanntmachungsdatum)\n\nNiedersachsen Amtsgericht Hannover HRB 4704\nEinreichung neuer Dokumente\n\nFlughafen Hannover-Langenhagen Gesellschaft mit beschränkter Haftung\nGesellschaft mit beschränkter Haftung\nHannover\n\nDie Liste der Mitglieder des Aufsichtsrats wurde beim Registergericht eingereicht."
    },
    {
      "date": "2025-07-09",
      "id": "115185",
      "original_text": "Löschungsankündigung\nNiedersachsen Amtsgericht Braunschweig HRB 211682\nEco Bau GmbH – Braunschweig",
      "type": "Löschungsankündigung",
      "state": "Niedersachsen",
      "amtsgericht": "Amtsgericht Braunschweig",
      "registernummer": "HRB 211682",
      "registerart": "HRB",
      "company_name": "Eco Bau GmbH",
      "company_seat": "Braunschweig",
      "details": "09.07.2025 (Bekanntmachungsdatum)\n\nNiedersachsen Amtsgericht Braunschweig HRB 211682\nLöschungsankündigung\n\nEco Bau GmbH\nGesellschaft mit beschränkter Haftung\nBraunschweig\n\nDas Registergericht beabsichtigt, die Gesellschaft von Amts wegen nach § 394 FamFG zu löschen. Die Frist zur Erhebung eines Widerspruchs ist auf 1 Monat ab dieser Registerbekanntmachung festgesetzt."
    },
    {
      "date": "2025-07-09",
      "id": "115186",
      "original_text": "Löschungsankündigung\nNiedersachsen Amtsgericht Hildesheim HRB 15338\nA. Lambrecht Stahl und Metallbau GmbH – Gronau (Leine)",
      "type": "Löschungsankündigung",
      "state": "Niedersachsen",
      "amtsgericht": "Amtsgericht Hildesheim",
      "registernummer": "HRB 15338",
      "registerart": "HRB",
      "company_name": "A. Lambrecht Stahl und Metallbau GmbH",
      "company_seat": "Gronau (Leine)",
      "details": "09.07.2025 (Bekanntmachungsdatum)\n\nNiedersachsen Amtsgericht Hildesheim HRB 15338\nLöschungsankündigung\n\nA. Lambrecht Stahl und Metallbau GmbH\nGesellschaft mit beschränkter Haftung\nGronau (Leine)\n\nDas Registergericht beabsichtigt, die Gesellschaft von Amts wegen nach § 394 FamFG zu löschen. Die Frist zur Erhebung eines Widerspruchs ist auf 1 Monat ab dieser Registerbekanntmachung festgesetzt."
    },
    {
      "date": "2025-07-09",
      "id": "115187",
      "original_text": "Registerbekanntmachung nach dem Umwandlungsgesetz\nNiedersachsen Amtsgericht Aurich HRB 111572\nEvenburgh Shipping Beteiligungs GmbH – Leer",
      "type": "Registerbekanntmachung nach dem Umwandlungsgesetz",
      "state": "Niedersachsen",
      "amtsgericht": "Amtsgericht Aurich",
      "registernummer": "HRB 111572",
      "registerart": "HRB",
      "company_name": "Evenburgh Shipping Beteiligungs GmbH",
      "company_seat": "Leer",
      "details": "09.07.2025 (Bekanntmachungsdatum)\n\nNiedersachsen Amtsgericht Aurich HRB 111572\nRegisterbekanntmachung nach dem Umwandlungsgesetz 09.07.2025 (Eintragungsdatum)\n\nEvenburgh Shipping Beteiligungs GmbH\nGesellschaft mit beschränkter Haftung\nLeer\n\nEs wird darauf hingewiesen, dass ein Verschmelzungsplan oder sein Entwurf über eine grenzüberschreitende Verschmelzung zur Aufnahme mit der H & H Holding B.V. mit Sitz in Rotterdam/Niederlande (Kamer van Koophandel 24291623) (Besloten Vennootschap - Gesellschaft mit beschränkter Haftung nach niederländischem Recht) beim Handelsregister eingereicht worden ist.\n\nDie Anteilsinhaber, die Gläubiger sowie die zuständigen Betriebsräte der an der grenzüberschreitenden Verschmelzung beteiligten Gesellschaften oder, soweit es keinen Betriebsrat gibt, die Arbeitnehmer der an der grenzüberschreitenden Verschmelzung beteiligten Gesellschaften, können der jeweiligen Gesellschaft spätestens fünf Arbeitstage vor dem Tag der Gesellschafterversammlung Bemerkungen zum Verschmelzungsplan übermitteln."
    },
    {
      "date": "2025-07-09",
      "id": "115188",
      "original_text": "Registerbekanntmachung nach dem Umwandlungsgesetz\nNiedersachsen Amtsgericht Göttingen HRB 2461\nVerwaltungsgesellschaft Deppe GmbH – Bad Lauterberg",
      "type": "Registerbekanntmachung nach dem Umwandlungsgesetz",
      "state": "Niedersachsen",
      "amtsgericht": "Amtsgericht Göttingen",
      "registernummer": "HRB 2461",
      "registerart": "HRB",
      "company_name": "Verwaltungsgesellschaft Deppe GmbH",
      "company_seat": "Bad Lauterberg",
      "details": "09.07.2025 (Bekanntmachungsdatum)\n\nNiedersachsen Amtsgericht Göttingen HRB 2461\nRegisterbekanntmachung nach dem Umwandlungsgesetz 09.07.2025 (Eintragungsdatum)\n\nVerwaltungsgesellschaft Deppe GmbH\nGesellschaft mit beschränkter Haftung\nBad Lauterberg\n\nDen Gläubigern der an der Verschmelzung beteiligten Rechtsträger ist, wenn sie binnen sechs Monaten nach dem Tag, an dem die Eintragung der Verschmelzung in das Register des Sitzes desjenigen Rechtsträgers, dessen Gläubiger sie sind, nach § 19  Abs.  3 UmwG als bekannt gemacht gilt, ihren Anspruch nach Grund und Höhe schriftlich anmelden, Sicherheit zu leisten, soweit sie nicht Befriedigung verlangen können. Dieses Recht steht den Gläubigern jedoch nur zu, wenn sie glaubhaft machen, dass durch die Verschmelzung die Erfüllung der Forderung gefährdet wird."
    },
    {
      "date": "2025-07-09",
      "id": "115189",
      "original_text": "Registerbekanntmachung nach dem Umwandlungsgesetz\nNiedersachsen Amtsgericht Aurich HRB 207251\nLindner & Müller Industrie-Elektronik GmbH – Jemgum",
      "type": "Registerbekanntmachung nach dem Umwandlungsgesetz",
      "state": "Niedersachsen",
      "amtsgericht": "Amtsgericht Aurich",
      "registernummer": "HRB 207251",
      "registerart": "HRB",
      "company_name": "Lindner & Müller Industrie-Elektronik GmbH",
      "company_seat": "Jemgum",
      "details": "09.07.2025 (Bekanntmachungsdatum)\n\nNiedersachsen Amtsgericht Aurich HRB 207251\nRegisterbekanntmachung nach dem Umwandlungsgesetz 09.07.2025 (Eintragungsdatum)\n\nLindner & Müller Industrie-Elektronik GmbH\nGesellschaft mit beschränkter Haftung\nJemgum\n\nDen Gläubigern der an der Verschmelzung beteiligten Rechtsträger ist, wenn sie binnen sechs Monaten nach dem Tag, an dem die Eintragung der Verschmelzung in das Register des Sitzes desjenigen Rechtsträgers, dessen Gläubiger sie sind, nach § 19  Abs.  3 UmwG als bekannt gemacht gilt, ihren Anspruch nach Grund und Höhe schriftlich anmelden, Sicherheit zu leisten, soweit sie nicht Befriedigung verlangen können. Dieses Recht steht den Gläubigern jedoch nur zu, wenn sie glaubhaft machen, dass durch die Verschmelzung die Erfüllung der Forderung gefährdet wird."
    },
    {
      "date": "2025-07-09",
      "id": "115190",
      "original_text": "Löschungsankündigung\nNiedersachsen Amtsgericht Braunschweig HRB 200384\nImmobilien Service Wolfsburg GmbH – Wolfsburg",
      "type": "Löschungsankündigung",
      "state": "Niedersachsen",
      "amtsgericht": "Amtsgericht Braunschweig",
      "registernummer": "HRB 200384",
      "registerart": "HRB",
      "company_name": "Immobilien Service Wolfsburg GmbH",
      "company_seat": "Wolfsburg",
      "details": "09.07.2025 (Bekanntmachungsdatum)\n\nNiedersachsen Amtsgericht Braunschweig HRB 200384\nLöschungsankündigung\n\nImmobilien Service Wolfsburg GmbH\nGesellschaft mit beschränkter Haftung\nWolfsburg\n\nDas Registergericht beabsichtigt, die Gesellschaft von Amts wegen nach § 394 FamFG zu löschen. Die Frist zur Erhebung eines Widerspruchs ist auf 1 Monat ab dieser Registerbekanntmachung festgesetzt."
    },
    {
      "date": "2025-07-09",
      "id": "115191",
      "original_text": "Registerbekanntmachung nach dem Umwandlungsgesetz\nRheinland-Pfalz Amtsgericht Koblenz HRB 27660\nCDV Consulting GmbH – Koblenz",
      "type": "Registerbekanntmachung nach dem Umwandlungsgesetz",
      "state": "Rheinland-Pfalz",
      "amtsgericht": "Amtsgericht Koblenz",
      "registernummer": "HRB 27660",
      "registerart": "HRB",
      "company_name": "CDV Consulting GmbH",
      "company_seat": "Koblenz",
      "details": "09.07.2025 (Bekanntmachungsdatum)\n\nRheinland-Pfalz Amtsgericht Koblenz HRB 27660\nRegisterbekanntmachung nach dem Umwandlungsgesetz 09.07.2025 (Eintragungsdatum)\n\nCDV Consulting GmbH\nGesellschaft mit beschränkter Haftung\nKoblenz\n\nAls nicht eingetragen wird veröffentlicht:\nDen Gläubigern des formwechselnden Rechtsträgers ist, wenn sie binnen sechs Monaten nach dem Tag, an dem die Eintragung des Formwechsels nach § 201 UmwG als bekannt gemacht gilt, ihren Anspruch nach Grund und Höhe schriftlich anmelden, Sicherheit zu leisten, soweit sie nicht Befriedigung verlangen können. Dieses Recht steht den Gläubigern jedoch nur zu, wenn sie glaubhaft machen, dass durch den Formwechsel die Erfüllung der Forderung gefährdet wird."
    },
    {
      "date": "2025-07-09",
      "id": "115192",
      "original_text": "Löschungsankündigung\nRheinland-Pfalz Amtsgericht Ludwigshafen a.Rhein (Ludwigshafen) HRB 67980\nAnzalone Abbruch und Demontage GmbH – Ludwigshafen am Rhein",
      "type": "Löschungsankündigung",
      "state": "Rheinland-Pfalz",
      "amtsgericht": "Amtsgericht Ludwigshafen a.Rhein (Ludwigshafen)",
      "registernummer": "HRB 67980",
      "registerart": "HRB",
      "company_name": "Anzalone Abbruch und Demontage GmbH",
      "company_seat": "Ludwigshafen am Rhein",
      "details": "09.07.2025 (Bekanntmachungsdatum)\n\nRheinland-Pfalz Amtsgericht Ludwigshafen a.Rhein (Ludwigshafen) HRB 67980\nLöschungsankündigung\n\nAnzalone Abbruch und Demontage GmbH\nGesellschaft mit beschränkter Haftung\nLudwigshafen am Rhein\n\nDas Registergericht beabsichtigt die Gesellschaft von Amts wegen nach § 394 FamFG zu löschen. Die Frist zur Erhebung eines Widerspruchs ist auf einen Monat festgesetzt."
    },
    {
      "date": "2025-07-09",
      "id": "115193",
      "original_text": "Registerbekanntmachung nach dem Umwandlungsgesetz\nRheinland-Pfalz Amtsgericht Koblenz HRB 3882\nKRIEGER Patientenversorgung GmbH – Koblenz",
      "type": "Registerbekanntmachung nach dem Umwandlungsgesetz",
      "state": "Rheinland-Pfalz",
      "amtsgericht": "Amtsgericht Koblenz",
      "registernummer": "HRB 3882",
      "registerart": "HRB",
      "company_name": "KRIEGER Patientenversorgung GmbH",
      "company_seat": "Koblenz",
      "details": "09.07.2025 (Bekanntmachungsdatum)\n\nRheinland-Pfalz Amtsgericht Koblenz HRB 3882\nRegisterbekanntmachung nach dem Umwandlungsgesetz 09.07.2025 (Eintragungsdatum)\n\nKRIEGER Patientenversorgung GmbH\nGesellschaft mit beschränkter Haftung\nKoblenz\n\nAls nicht eingetragen wird veröffentlicht: Den Gläubigern der an der Verschmelzung beteiligten Rechtsträger ist, wenn sie binnen sechs Monaten nach dem Tag, an dem die Eintragung der Verschmelzung in das Register des Sitzes desjenigen Rechtsträgers,dessen Gläubiger sie sind, nach § 19 Abs. 3 UmwG als bekannt gemacht gilt, ihren Anspruch nach Grund und Höhe schriftlich anmelden, Sicherheit zu leisten, soweit sie nicht Befriedigung verlangen können. Dieses Recht steht den Gläubigern jedoch nur zu, wenn sie glaubhaft machen, dass durch die Verschmelzung die Erfüllungd er Forderung gefährdet wird."
    },
    {
      "date": "2025-07-09",
      "id": "115194",
      "original_text": "Löschungsankündigung\nRheinland-Pfalz Amtsgericht Ludwigshafen a.Rhein (Ludwigshafen) VR 20416\nKarnevalgesellschaft Hallodria 1954 Frankenthal – Frankenthal",
      "type": "Löschungsankündigung",
      "state": "Rheinland-Pfalz",
      "amtsgericht": "Amtsgericht Ludwigshafen a.Rhein (Ludwigshafen)",
      "registernummer": "VR 20416",
      "registerart": "VR",
      "company_name": "Karnevalgesellschaft Hallodria 1954 Frankenthal",
      "company_seat": "Frankenthal",
      "details": "09.07.2025 (Bekanntmachungsdatum)\n\nRheinland-Pfalz Amtsgericht Ludwigshafen a.Rhein (Ludwigshafen) VR 20416\nLöschungsankündigung\n\nKarnevalgesellschaft Hallodria 1954 Frankenthal\neingetragener Verein\nFrankenthal\n\nDas Gericht beabsichtigt, den Verein wegen Einstellung des Vereinszwecks von Amts wegen zu löschen. Die Frist zur Geltendmachung eines Widerspruchs gegen die beabsichtigte Löschung ist auf einen Monat ab Veröffentlichung bestimmt."
    },
    {
      "date": "2025-07-09",
      "id": "115195",
      "original_text": "Löschungsankündigung\nRheinland-Pfalz Amtsgericht Ludwigshafen a.Rhein (Ludwigshafen) HRB 68229\nMSG Industrieservice GmbH – Ludwigshafen / Rhein",
      "type": "Löschungsankündigung",
      "state": "Rheinland-Pfalz",
      "amtsgericht": "Amtsgericht Ludwigshafen a.Rhein (Ludwigshafen)",
      "registernummer": "HRB 68229",
      "registerart": "HRB",
      "company_name": "MSG Industrieservice GmbH",
      "company_seat": "Ludwigshafen / Rhein",
      "details": "09.07.2025 (Bekanntmachungsdatum)\n\nRheinland-Pfalz Amtsgericht Ludwigshafen a.Rhein (Ludwigshafen) HRB 68229\nLöschungsankündigung 09.07.2025 (Eintragungsdatum)\n\nMSG Industrieservice GmbH\nGesellschaft mit beschränkter Haftung\nLudwigshafen / Rhein\n\nDas Registergericht beabsichtigt die Gesellschaft von Amts wegen nach § 394 FamFG zu löschen. Die Frist zur Erhebung eines Widerspruchs ist auf einen Monat festgesetzt."
    },
    {
      "date": "2025-07-09",
      "id": "115196",
      "original_text": "Löschungsankündigung\nRheinland-Pfalz Amtsgericht Ludwigshafen a.Rhein (Ludwigshafen) HRB 65429\nAfitron GmbH – Frankenthal (Pfalz)",
      "type": "Löschungsankündigung",
      "state": "Rheinland-Pfalz",
      "amtsgericht": "Amtsgericht Ludwigshafen a.Rhein (Ludwigshafen)",
      "registernummer": "HRB 65429",
      "registerart": "HRB",
      "company_name": "Afitron GmbH",
      "company_seat": "Frankenthal (Pfalz)",
      "details": "09.07.2025 (Bekanntmachungsdatum)\n\nRheinland-Pfalz Amtsgericht Ludwigshafen a.Rhein (Ludwigshafen) HRB 65429\nLöschungsankündigung 09.07.2025 (Eintragungsdatum)\n\nAfitron GmbH\nGesellschaft mit beschränkter Haftung\nFrankenthal (Pfalz)\n\nDas Registergericht beabsichtigt die Gesellschaft von Amts wegen nach § 394 FamFG zu löschen. Die Frist zur Erhebung eines Widerspruchs ist auf einen Monat festgesetzt."
    },
    {
      "date": "2025-07-09",
      "id": "115197",
      "original_text": "Registerbekanntmachung nach dem Umwandlungsgesetz\nRheinland-Pfalz Amtsgericht Bad Kreuznach HRB 2440\nKeim-Additec-Surface GmbH – Kirchberg",
      "type": "Registerbekanntmachung nach dem Umwandlungsgesetz",
      "state": "Rheinland-Pfalz",
      "amtsgericht": "Amtsgericht Bad Kreuznach",
      "registernummer": "HRB 2440",
      "registerart": "HRB",
      "company_name": "Keim-Additec-Surface GmbH",
      "company_seat": "Kirchberg",
      "details": "09.07.2025 (Bekanntmachungsdatum)\n\nRheinland-Pfalz Amtsgericht Bad Kreuznach HRB 2440\nRegisterbekanntmachung nach dem Umwandlungsgesetz 09.07.2025 (Eintragungsdatum)\n\nKeim-Additec-Surface GmbH\nGesellschaft mit beschränkter Haftung\nKirchberg\n\nAls nicht eingetragen wird veröffentlicht: Den Gläubigern der an der Verschmelzung beteiligten Rechtsträger ist, wenn sie binnen sechs Monaten nach dem Tag, an dem die Eintragung der Verschmelzung in das Register des Sitzes desjenigen Rechtsträgers, dessen Gläubiger sie sind, nach § 19 Abs. 3 UmwG als bekannt gemacht gilt, ihren Anspruch nach Grund und Höhe schriftlich anmelden, Sicherheit zu leisten, soweit sie nicht Befriedigung verlangen können. Dieses Recht steht den Gläubigern jedoch nur zu, wenn sie glaubhaft machen, dass durch die Verschmelzung die Erfüllung der Forderung gefährdet wird."
    },
    {
      "date": "2025-07-09",
      "id": "115198",
      "original_text": "Löschungsankündigung\nRheinland-Pfalz Amtsgericht Ludwigshafen a.Rhein (Ludwigshafen) HRB 2758\nKneisel GmbH – Ludwigshafen/Rh.",
      "type": "Löschungsankündigung",
      "state": "Rheinland-Pfalz",
      "amtsgericht": "Amtsgericht Ludwigshafen a.Rhein (Ludwigshafen)",
      "registernummer": "HRB 2758",
      "registerart": "HRB",
      "company_name": "Kneisel GmbH",
      "company_seat": "Ludwigshafen/Rh.",
      "details": "09.07.2025 (Bekanntmachungsdatum)\n\nRheinland-Pfalz Amtsgericht Ludwigshafen a.Rhein (Ludwigshafen) HRB 2758\nLöschungsankündigung 09.07.2025 (Eintragungsdatum)\n\nKneisel GmbH\nGesellschaft mit beschränkter Haftung\nLudwigshafen/Rh.\n\nDas Registergericht beabsichtigt die Gesellschaft von Amts wegen nach § 394 FamFG zu löschen. Die Frist zur Erhebung eines Widerspruchs ist auf einen Monat festgesetzt."
    },
    {
      "date": "2025-07-09",
      "id": "115199",
      "original_text": "Registerbekanntmachung nach dem Umwandlungsgesetz\nRheinland-Pfalz Amtsgericht Ludwigshafen a.Rhein (Ludwigshafen) HRA 60354\nSandra Lehmeier Baumaschinen e.K. – Ludwigshafen",
      "type": "Registerbekanntmachung nach dem Umwandlungsgesetz",
      "state": "Rheinland-Pfalz",
      "amtsgericht": "Amtsgericht Ludwigshafen a.Rhein (Ludwigshafen)",
      "registernummer": "HRA 60354",
      "registerart": "HRA",
      "company_name": "Sandra Lehmeier Baumaschinen e.K.",
      "company_seat": "Ludwigshafen",
      "details": "09.07.2025 (Bekanntmachungsdatum)\n\nRheinland-Pfalz Amtsgericht Ludwigshafen a.Rhein (Ludwigshafen) HRA 60354\nRegisterbekanntmachung nach dem Umwandlungsgesetz 02.07.2025 (Eintragungsdatum)\n\nSandra Lehmeier Baumaschinen e.K.\nEinzelkaufmann / Einzelkauffrau\nLudwigshafen\n\nAls nicht eingetragen wird veröffentlicht: Den Gläubigern der an der Ausgliederung beteiligten Rechtsträger ist, wenn sie binnen sechs Monaten nac hdem Tag, an dem die Eintragung der Ausgliederung in das Register des Sitzes desjenigen Rechtsträgers,dessen Gläubiger sie sind, nach § 19 Abs. 3 UmwG als bekannt gemacht gilt, ihren Anspruch nach Grund und Höhe schriftlich anmelden, Sicherheit zu leisten, soweit sie nicht Befriedigung verlangen können. Dieses Recht steht den Gläubigern jedoch nur zu, wenn sie glaubhaft machen, dass durch die Ausgliederung die Erfüllung der Forderung gefährdet wird."
    },
    {
      "date": "2025-07-09",
      "id": "115200",
      "original_text": "Registerbekanntmachung nach dem Umwandlungsgesetz\nRheinland-Pfalz Amtsgericht Koblenz HRA 23315\nCDV Consulting GmbH & Co. KG – Koblenz",
      "type": "Registerbekanntmachung nach dem Umwandlungsgesetz",
      "state": "Rheinland-Pfalz",
      "amtsgericht": "Amtsgericht Koblenz",
      "registernummer": "HRA 23315",
      "registerart": "HRA",
      "company_name": "CDV Consulting GmbH & Co. KG",
      "company_seat": "Koblenz",
      "details": "09.07.2025 (Bekanntmachungsdatum)\n\nRheinland-Pfalz Amtsgericht Koblenz HRA 23315\nRegisterbekanntmachung nach dem Umwandlungsgesetz 09.07.2025 (Eintragungsdatum)\n\nCDV Consulting GmbH & Co. KG\nKommanditgesellschaft\nKoblenz\n\nAls nicht eingetragen wird veröffentlicht:\nDen Gläubigern des formwechselnden Rechtsträgers ist, wenn sie binnen sechs Monaten nach dem Tag, an dem die Eintragung des Formwechsels nach § 201 UmwG als bekannt gemacht gilt, ihren Anspruch nach Grund und Höhe schriftlich anmelden, Sicherheit zu leisten, soweit sie nicht Befriedigung verlangen können. Dieses Recht steht den Gläubigern jedoch nur zu, wenn sie glaubhaft machen, dass durch den Formwechsel die Erfüllung der Forderung gefährdet wird."
    },
    {
      "date": "2025-07-09",
      "id": "115201",
      "original_text": "Löschungsankündigung\nRheinland-Pfalz Amtsgericht Ludwigshafen a.Rhein (Ludwigshafen) HRB 64029\nTreff Edi UG (haftungsbeschränkt) – Ludwigshafen",
      "type": "Löschungsankündigung",
      "state": "Rheinland-Pfalz",
      "amtsgericht": "Amtsgericht Ludwigshafen a.Rhein (Ludwigshafen)",
      "registernummer": "HRB 64029",
      "registerart": "HRB",
      "company_name": "Treff Edi UG (haftungsbeschränkt)",
      "company_seat": "Ludwigshafen",
      "details": "09.07.2025 (Bekanntmachungsdatum)\n\nRheinland-Pfalz Amtsgericht Ludwigshafen a.Rhein (Ludwigshafen) HRB 64029\nLöschungsankündigung 09.07.2025 (Eintragungsdatum)\n\nTreff Edi UG (haftungsbeschränkt)\nGesellschaft mit beschränkter Haftung\nLudwigshafen\n\nDas Registergericht beabsichtigt die Gesellschaft von Amts wegen nach § 394 FamFG zu löschen. Die Frist zur Erhebung eines Widerspruchs ist auf einen Monat festgesetzt."
    },
    {
      "date": "2025-07-09",
      "id": "115202",
      "original_text": "Sonstige Registerbekanntmachung\nNordrhein-Westfalen Amtsgericht Mönchengladbach HRB 21471\nLynxeo Deutschland GmbH – Mönchengladbach",
      "type": "Sonstige Registerbekanntmachung",
      "state": "Nordrhein-Westfalen",
      "amtsgericht": "Amtsgericht Mönchengladbach",
      "registernummer": "HRB 21471",
      "registerart": "HRB",
      "company_name": "Lynxeo Deutschland GmbH",
      "company_seat": "Mönchengladbach",
      "details": "09.07.2025 (Bekanntmachungsdatum)\n\nNordrhein-Westfalen Amtsgericht Mönchengladbach HRB 21471\nSonstige Registerbekanntmachung 09.07.2025 (Eintragungsdatum)\n\nLynxeo Deutschland GmbH\nGesellschaft mit beschränkter Haftung\nMönchengladbach\n\nAls nicht eingetragen wird veröffentlicht: Den Gläubigern der Gesellschaft, deren Forderungen begründet worden sind bevor die Eintragung der Beendigung des Beherrschungs- und Ergebnisabführungsvertrages in das Handelsregister nach § 10 des Handelsgesetzbuches als bekanntgemacht gilt, hat der andere Vertragsteil Sicherheit zu leisten, wenn sie sich binnen sechs Monaten nach der Bekanntmachung der Eintragung zu diesem Zweck bei ihm melden."
    },
    {
      "date": "2025-07-09",
      "id": "115203",
      "original_text": "Registerbekanntmachung nach dem Umwandlungsgesetz\nNordrhein-Westfalen Amtsgericht Köln HRB 37482\nL. Bellingroth Verwaltungsgesellschaft mit beschränkter Haftung – Wipperfürth",
      "type": "Registerbekanntmachung nach dem Umwandlungsgesetz",
      "state": "Nordrhein-Westfalen",
      "amtsgericht": "Amtsgericht Köln",
      "registernummer": "HRB 37482",
      "registerart": "HRB",
      "company_name": "L. Bellingroth Verwaltungsgesellschaft mit beschränkter Haftung",
      "company_seat": "Wipperfürth",
      "details": "09.07.2025 (Bekanntmachungsdatum)\n\nNordrhein-Westfalen Amtsgericht Köln HRB 37482\nRegisterbekanntmachung nach dem Umwandlungsgesetz 09.07.2025 (Eintragungsdatum)\n\nL. Bellingroth Verwaltungsgesellschaft mit beschränkter Haftung\nGesellschaft mit beschränkter Haftung\nWipperfürth\n\nDen Gläubigern der an der Verschmelzung beteiligten Rechtsträger ist, wenn sie binnen sechs Monaten nach dem Tag, an dem die Eintragung der Verschmelzung in das Register des Sitzes desjenigen Rechtsträgers, dessen Gläubiger sie sind, nach § 19 Absatz 3 UmwG als bekanntgemacht gilt, ihren Anspruch nach Grund und Höhe schriftlich anmelden, Sicherheit zu leisten, soweit sie nicht Befriedigung verlangen können. Dieses Recht steht den Gläubigern jedoch nur zu, wenn sie glaubhaft machen, dass durch die Verschmelzung die Erfüllung ihrer Forderung gefährdet wird."
    },
    {
      "date": "2025-07-09",
      "id": "115204",
      "original_text": "Registerbekanntmachung nach dem Umwandlungsgesetz\nNordrhein-Westfalen Amtsgericht Bonn HRB 15257\nScopevisio AG – Bonn",
      "type": "Registerbekanntmachung nach dem Umwandlungsgesetz",
      "state": "Nordrhein-Westfalen",
      "amtsgericht": "Amtsgericht Bonn",
      "registernummer": "HRB 15257",
      "registerart": "HRB",
      "company_name": "Scopevisio AG",
      "company_seat": "Bonn",
      "details": "09.07.2025 (Bekanntmachungsdatum)\n\nNordrhein-Westfalen Amtsgericht Bonn HRB 15257\nRegisterbekanntmachung nach dem Umwandlungsgesetz\n\nScopevisio AG\nAktiengesellschaft\nBonn\n\nDem Registergericht ist der Entwurf eines Vertrages über die Verschmelzung der Scopevisio Content Solutions GmbH mit der Scopevisio AG eingereicht worden."
    },
    {
      "date": "2025-07-09",
      "id": "115205",
      "original_text": "Registerbekanntmachung nach dem Umwandlungsgesetz\nNordrhein-Westfalen Amtsgericht Neuss HRB 23948\nINZEPTA Management GmbH – Kaarst",
      "type": "Registerbekanntmachung nach dem Umwandlungsgesetz",
      "state": "Nordrhein-Westfalen",
      "amtsgericht": "Amtsgericht Neuss",
      "registernummer": "HRB 23948",
      "registerart": "HRB",
      "company_name": "INZEPTA Management GmbH",
      "company_seat": "Kaarst",
      "details": "09.07.2025 (Bekanntmachungsdatum)\n\nNordrhein-Westfalen Amtsgericht Neuss HRB 23948\nRegisterbekanntmachung nach dem Umwandlungsgesetz 09.07.2025 (Eintragungsdatum)\n\nINZEPTA Management GmbH\nGesellschaft mit beschränkter Haftung\nKaarst\n\nDen Gläubigern der an der Verschmelzung beteiligten Rechtsträger ist, wenn sie binnen sechs Monaten nach dem Tag, an dem die Eintragung der Verschmelzung in das Register des Sitzes desjenigen Rechtsträgers, dessen Gläubiger sie sind, nach § 19 Absatz 3 UmwG als bekanntgemacht gilt, ihren Anspruch nach Grund und Höhe schriftlich anmelden, Sicherheit zu leisten, soweit sie nicht Befriedigung verlangen können. Dieses Recht steht den Gläubigern jedoch nur zu, wenn sie glaubhaft machen, dass durch die Verschmelzung die Erfüllung ihrer Forderung gefährdet wird."
    },
    {
      "date": "2025-07-09",
      "id": "115206",
      "original_text": "Registerbekanntmachung nach dem Umwandlungsgesetz\nNordrhein-Westfalen Amtsgericht Köln HRB 45031\nBEMARO GmbH Beteiligungsmanagement – Hürth",
      "type": "Registerbekanntmachung nach dem Umwandlungsgesetz",
      "state": "Nordrhein-Westfalen",
      "amtsgericht": "Amtsgericht Köln",
      "registernummer": "HRB 45031",
      "registerart": "HRB",
      "company_name": "BEMARO GmbH Beteiligungsmanagement",
      "company_seat": "Hürth",
      "details": "09.07.2025 (Bekanntmachungsdatum)\n\nNordrhein-Westfalen Amtsgericht Köln HRB 45031\nRegisterbekanntmachung nach dem Umwandlungsgesetz 09.07.2025 (Eintragungsdatum)\n\nBEMARO GmbH Beteiligungsmanagement\nGesellschaft mit beschränkter Haftung\nHürth\n\nDen Gläubigern der an der Verschmelzung beteiligten Rechtsträger ist, wenn sie binnen sechs Monaten nach dem Tag, an dem die Eintragung der Verschmelzung in das Register des Sitzes desjenigen Rechtsträgers, dessen Gläubiger sie sind, nach § 19 Absatz 3 UmwG als bekanntgemacht gilt, ihren Anspruch nach Grund und Höhe schriftlich anmelden, Sicherheit zu leisten, soweit sie nicht Befriedigung verlangen können. Dieses Recht steht den Gläubigern jedoch nur zu, wenn sie glaubhaft machen, dass durch die Verschmelzung die Erfüllung ihrer Forderung gefährdet wird."
    },
    {
      "date": "2025-07-09",
      "id": "115207",
      "original_text": "Registerbekanntmachung nach dem Umwandlungsgesetz\nNordrhein-Westfalen Amtsgericht Düsseldorf HRB 48999\nArenberg Beteiligungs GmbH – Düsseldorf",
      "type": "Registerbekanntmachung nach dem Umwandlungsgesetz",
      "state": "Nordrhein-Westfalen",
      "amtsgericht": "Amtsgericht Düsseldorf",
      "registernummer": "HRB 48999",
      "registerart": "HRB",
      "company_name": "Arenberg Beteiligungs GmbH",
      "company_seat": "Düsseldorf",
      "details": "09.07.2025 (Bekanntmachungsdatum)\n\nNordrhein-Westfalen Amtsgericht Düsseldorf HRB 48999\nRegisterbekanntmachung nach dem Umwandlungsgesetz 09.07.2025 (Eintragungsdatum)\n\nArenberg Beteiligungs GmbH\nGesellschaft mit beschränkter Haftung\nDüsseldorf\n\nDen Gläubigern der an der Verschmelzung beteiligten Rechtsträger ist, wenn sie binnen sechs Monaten nach dem Tag, an dem die Eintragung der Verschmelzung in das Register des Sitzes desjenigen Rechtsträgers, dessen Gläubiger sie sind, nach § 19 Absatz 3 UmwG als bekanntgemacht gilt, ihren Anspruch nach Grund und Höhe schriftlich anmelden, Sicherheit zu leisten, soweit sie nicht Befriedigung verlangen können. Dieses Recht steht den Gläubigern jedoch nur zu, wenn sie glaubhaft machen, dass durch die Verschmelzung die Erfüllung ihrer Forderung gefährdet wird."
    },
    {
      "date": "2025-07-09",
      "id": "115208",
      "original_text": "Registerbekanntmachung nach dem Umwandlungsgesetz\nNordrhein-Westfalen Amtsgericht Dortmund HRB 2391\nDortmunder Stadtwerke Aktiengesellschaft – Dortmund",
      "type": "Registerbekanntmachung nach dem Umwandlungsgesetz",
      "state": "Nordrhein-Westfalen",
      "amtsgericht": "Amtsgericht Dortmund",
      "registernummer": "HRB 2391",
      "registerart": "HRB",
      "company_name": "Dortmunder Stadtwerke Aktiengesellschaft",
      "company_seat": "Dortmund",
      "details": "09.07.2025 (Bekanntmachungsdatum)\n\nNordrhein-Westfalen Amtsgericht Dortmund HRB 2391\nRegisterbekanntmachung nach dem Umwandlungsgesetz 09.07.2025 (Eintragungsdatum)\n\nDortmunder Stadtwerke Aktiengesellschaft\nAktiengesellschaft\nDortmund\n\nDen Gläubigern der an der Verschmelzung beteiligten Rechtsträger ist, wenn sie binnen sechs Monaten nach dem Tag, an dem die Eintragung der Verschmelzung in das Register des Sitzes desjenigen Rechtsträgers, dessen Gläubiger sie sind, nach § 19 Absatz 3 UmwG als bekanntgemacht gilt, ihren Anspruch nach Grund und Höhe schriftlich anmelden, Sicherheit zu leisten, soweit sie nicht Befriedigung verlangen können. Dieses Recht steht den Gläubigern jedoch nur zu, wenn sie glaubhaft machen, dass durch die Verschmelzung die Erfüllung ihrer Forderung gefährdet wird."
    },
    {
      "date": "2025-07-09",
      "id": "115209",
      "original_text": "Sonstige Registerbekanntmachung\nNordrhein-Westfalen Amtsgericht Köln HRB 51915\nDeutsche Ärzte Finanz Beratungs- und Vermittlungs-Aktiengesellschaft – Köln",
      "type": "Sonstige Registerbekanntmachung",
      "state": "Nordrhein-Westfalen",
      "amtsgericht": "Amtsgericht Köln",
      "registernummer": "HRB 51915",
      "registerart": "HRB",
      "company_name": "Deutsche Ärzte Finanz Beratungs- und Vermittlungs-Aktiengesellschaft",
      "company_seat": "Köln",
      "details": "09.07.2025 (Bekanntmachungsdatum)\n\nNordrhein-Westfalen Amtsgericht Köln HRB 51915\nSonstige Registerbekanntmachung 09.07.2025 (Eintragungsdatum)\n\nDeutsche Ärzte Finanz Beratungs- und Vermittlungs-Aktiengesellschaft\nAktiengesellschaft\nKöln\n\nAls nicht eingetragen wird veröffentlicht: Den Gläubigern der Gesellschaft, deren Forderungen begründet worden sind bevor die Eintragung der Beendigung des Beherrschungsvertrages  in das Handelsregister nach § 10 des Handelsgesetzbuches als bekanntgemacht gilt, hat der andere Vertragsteil Sicherheit zu leisten, wenn sie sich binnen sechs Monaten nach der Bekanntmachung der Eintragung zu diesem Zweck bei ihm melden."
    },
    {
      "date": "2025-07-09",
      "id": "115210",
      "original_text": "Registerbekanntmachung nach dem Umwandlungsgesetz\nNordrhein-Westfalen Amtsgericht Köln HRB 52094\nSchlosserei Kiwitt GmbH – Leverkusen",
      "type": "Registerbekanntmachung nach dem Umwandlungsgesetz",
      "state": "Nordrhein-Westfalen",
      "amtsgericht": "Amtsgericht Köln",
      "registernummer": "HRB 52094",
      "registerart": "HRB",
      "company_name": "Schlosserei Kiwitt GmbH",
      "company_seat": "Leverkusen",
      "details": "09.07.2025 (Bekanntmachungsdatum)\n\nNordrhein-Westfalen Amtsgericht Köln HRB 52094\nRegisterbekanntmachung nach dem Umwandlungsgesetz 09.07.2025 (Eintragungsdatum)\n\nSchlosserei Kiwitt GmbH\nGesellschaft mit beschränkter Haftung\nLeverkusen\n\nDen Gläubigern der an der Verschmelzung beteiligten Rechtsträger ist, wenn sie binnen sechs Monaten nach dem Tag, an dem die Eintragung der Verschmelzung in das Register des Sitzes desjenigen Rechtsträgers, dessen Gläubiger sie sind, nach § 19 Absatz 3 UmwG als bekanntgemacht gilt, ihren Anspruch nach Grund und Höhe schriftlich anmelden, Sicherheit zu leisten, soweit sie nicht Befriedigung verlangen können. Dieses Recht steht den Gläubigern jedoch nur zu, wenn sie glaubhaft machen, dass durch die Verschmelzung die Erfüllung ihrer Forderung gefährdet wird."
    },
    {
      "date": "2025-07-09",
      "id": "115211",
      "original_text": "Registerbekanntmachung nach dem Umwandlungsgesetz\nNordrhein-Westfalen Amtsgericht Bonn HRB 15257\nScopevisio AG – Bonn",
      "type": "Registerbekanntmachung nach dem Umwandlungsgesetz",
      "state": "Nordrhein-Westfalen",
      "amtsgericht": "Amtsgericht Bonn",
      "registernummer": "HRB 15257",
      "registerart": "HRB",
      "company_name": "Scopevisio AG",
      "company_seat": "Bonn",
      "details": "09.07.2025 (Bekanntmachungsdatum)\n\nNordrhein-Westfalen Amtsgericht Bonn HRB 15257\nRegisterbekanntmachung nach dem Umwandlungsgesetz\n\nScopevisio AG\nAktiengesellschaft\nBonn\n\nDem Registergericht ist der Entwurf eines Vertrages über die Verschmelzung der Scopevisio Retail Solutions GmbH mit der Scopevisio AG eingereicht worden."
    },
    {
      "date": "2025-07-09",
      "id": "115212",
      "original_text": "Löschungsankündigung\nNordrhein-Westfalen Amtsgericht Köln HRB 110965\ncolaboration personal GmbH – Köln",
      "type": "Löschungsankündigung",
      "state": "Nordrhein-Westfalen",
      "amtsgericht": "Amtsgericht Köln",
      "registernummer": "HRB 110965",
      "registerart": "HRB",
      "company_name": "colaboration personal GmbH",
      "company_seat": "Köln",
      "details": "09.07.2025 (Bekanntmachungsdatum)\n\nNordrhein-Westfalen Amtsgericht Köln HRB 110965\nLöschungsankündigung\n\ncolaboration personal GmbH\nGesellschaft mit beschränkter Haftung\nKöln\n\nDas Registergericht beabsichtigt die Gesellschaft von Amts wegen nach § 394 FamFG zu löschen. Die Frist zur Erhebung eines Widerspruchs ist auf einen Monat festgesetzt."
    },
    {
      "date": "2025-07-09",
      "id": "115213",
      "original_text": "Registerbekanntmachung nach dem Umwandlungsgesetz\nNordrhein-Westfalen Amtsgericht Hagen HRB 4541\nQuick Bauprodukte Gesellschaft mit beschränkter Haftung – Schwerte",
      "type": "Registerbekanntmachung nach dem Umwandlungsgesetz",
      "state": "Nordrhein-Westfalen",
      "amtsgericht": "Amtsgericht Hagen",
      "registernummer": "HRB 4541",
      "registerart": "HRB",
      "company_name": "Quick Bauprodukte Gesellschaft mit beschränkter Haftung",
      "company_seat": "Schwerte",
      "details": "09.07.2025 (Bekanntmachungsdatum)\n\nNordrhein-Westfalen Amtsgericht Hagen HRB 4541\nRegisterbekanntmachung nach dem Umwandlungsgesetz 09.07.2025 (Eintragungsdatum)\n\nQuick Bauprodukte Gesellschaft mit beschränkter Haftung\nGesellschaft mit beschränkter Haftung\nSchwerte\n\nDen Gläubigern der an der Verschmelzung beteiligten Rechtsträger ist, wenn sie binnen sechs Monaten nach dem Tag, an dem die Eintragung der Verschmelzung in das Register des Sitzes derjenigen Rechtsträger deren Gläubiger sie sind, nach § 19 Absatz 3 UmwG als bekanntgemacht gilt, ihren Anspruch nach Grund und Höhe schriftlich anmelden, Sicherheit zu leisten, soweit sie nicht Befriedigung verlangen können. Dieses Recht steht den Gläubigern jedoch nur zu, wenn sie glaubhaft machen, dass durch die Verschmelzung die Erfüllung ihrer Forderung gefährdet wird."
    },
    {
      "date": "2025-07-09",
      "id": "115214",
      "original_text": "Registerbekanntmachung nach dem Umwandlungsgesetz\nNordrhein-Westfalen Amtsgericht Köln HRB 97897\nCap-Invest Immo GmbH – Hürth",
      "type": "Registerbekanntmachung nach dem Umwandlungsgesetz",
      "state": "Nordrhein-Westfalen",
      "amtsgericht": "Amtsgericht Köln",
      "registernummer": "HRB 97897",
      "registerart": "HRB",
      "company_name": "Cap-Invest Immo GmbH",
      "company_seat": "Hürth",
      "details": "09.07.2025 (Bekanntmachungsdatum)\n\nNordrhein-Westfalen Amtsgericht Köln HRB 97897\nRegisterbekanntmachung nach dem Umwandlungsgesetz 09.07.2025 (Eintragungsdatum)\n\nCap-Invest Immo GmbH\nGesellschaft mit beschränkter Haftung\nHürth\n\nDen Gläubigern der an der Verschmelzung beteiligten Rechtsträger ist, wenn sie binnen sechs Monaten nach dem Tag, an dem die Eintragung der Verschmelzung in das Register des Sitzes desjenigen Rechtsträgers, dessen Gläubiger sie sind, nach § 19 Absatz 3 UmwG als bekanntgemacht gilt, ihren Anspruch nach Grund und Höhe schriftlich anmelden, Sicherheit zu leisten, soweit sie nicht Befriedigung verlangen können. Dieses Recht steht den Gläubigern jedoch nur zu, wenn sie glaubhaft machen, dass durch die Verschmelzung die Erfüllung ihrer Forderung gefährdet wird."
    },
    {
      "date": "2025-07-09",
      "id": "115215",
      "original_text": "Löschungsankündigung\nNordrhein-Westfalen Amtsgericht Düsseldorf HRB 86698\nBilad Al Sham für Import & Export GmbH – Düsseldorf",
      "type": "Löschungsankündigung",
      "state": "Nordrhein-Westfalen",
      "amtsgericht": "Amtsgericht Düsseldorf",
      "registernummer": "HRB 86698",
      "registerart": "HRB",
      "company_name": "Bilad Al Sham für Import & Export GmbH",
      "company_seat": "Düsseldorf",
      "details": "09.07.2025 (Bekanntmachungsdatum)\n\nNordrhein-Westfalen Amtsgericht Düsseldorf HRB 86698\nLöschungsankündigung\n\nBilad Al Sham für Import & Export GmbH\nGesellschaft mit beschränkter Haftung\nDüsseldorf\n\nDas Registergericht beabsichtigt die Gesellschaft von Amts wegen nach § 394 FamFG zu löschen. Die Frist zur Erhebung eines Widerspruchs ist auf 3 Wochen festgesetzt.\n\nRechtsbehelfsbelehrung:\nDas Widerspruchsrecht steht jedem zu, der an der Unterlassung der Löschung ein berechtigtes Interesse hat. Der Widerspruch ist bei dem Amtsgericht Düsseldorf -Registergericht-, Werdener Straße 1, 40227 Düsseldorf schriftlich in deutscher Sprache oder zur Niederschrift der Geschäftsstelle einzulegen. Der Widerspruch kann auch zur Niederschrift der Geschäftsstelle eines jeden Amtsgerichtes abgegeben werden. Die Einlegung ist auch durch Übertragung eines elektronischen Dokuments an die elektronische Poststelle des Gerichts möglich. Das elektronische Dokument muss für die Bearbeitung durch das Gericht geeignet und mit einer qualifizierten elektronischen Signatur der verantwortenden Person versehen sein oder von der verantwortenden Person signiert und auf einem sicheren Übermittlungsweg gemäß § 130a ZPO nach näherer Maßgabe der Verordnung über die technischen Rahmenbedingungen des elektronischen Rechtsverkehrs und über das besondere elektronische Behördenpostfach (BGBl. I, S.3803) eingereicht werden. Weitere Informationen erhalten Sie auf der Internetseite www.justiz.de.\nDer Widerspruch muss spätestens innerhalb der gesetzten Frist nach dem Datum der Bekanntmachung der Löschungsankündigung bei dem Amtsgericht - Registergericht - Düsseldorf eingegangen sein.  Dies gilt auch dann, wenn der Widerspruch zur Niederschrift der Geschäftsstelle eines anderen Amtsgerichtes abgegeben wurde. Die Frist beginnt mit dem Tage der Bekanntmachung der Löschungsankündigung in dem für die Bekanntmachung der Eintragungen in das Handelsregister bestimmten elektronischen Informations- und Kommunikationssystem nach § 10 des Handelsgesetzbuches. Fällt das Ende der Frist auf einen Sonntag, einen allgemeinen Feiertag oder Sonnabend, so endet die Frist mit Ablauf des nächsten Werktages.\nDer Widerspruch muss die Bezeichnung der angefochtenen Löschungsankündigung sowie die Erklärung enthalten, dass Widerspruch gegen diese Löschungsankündigung eingelegt wird. Er ist zu unterzeichnen und soll begründet werden."
    },
    {
      "date": "2025-07-09",
      "id": "115216",
      "original_text": "Löschungsankündigung\nNordrhein-Westfalen Amtsgericht Düsseldorf HRB 94288\nSorin Bau & Dienstleistungen GmbH – Hilden",
      "type": "Löschungsankündigung",
      "state": "Nordrhein-Westfalen",
      "amtsgericht": "Amtsgericht Düsseldorf",
      "registernummer": "HRB 94288",
      "registerart": "HRB",
      "company_name": "Sorin Bau & Dienstleistungen GmbH",
      "company_seat": "Hilden",
      "details": "09.07.2025 (Bekanntmachungsdatum)\n\nNordrhein-Westfalen Amtsgericht Düsseldorf HRB 94288\nLöschungsankündigung\n\nSorin Bau & Dienstleistungen GmbH\nGesellschaft mit beschränkter Haftung\nHilden\n\nDas Registergericht beabsichtigt die Gesellschaft von Amts wegen nach § 394 FamFG zu löschen. Die Frist zur Erhebung eines Widerspruchs ist auf 3 Wochen festgesetzt.\n\nRechtsbehelfsbelehrung:\nDas Widerspruchsrecht steht jedem zu, der an der Unterlassung der Löschung ein berechtigtes Interesse hat. Der Widerspruch ist bei dem Amtsgericht Düsseldorf -Registergericht-, Werdener Straße 1, 40227 Düsseldorf schriftlich in deutscher Sprache oder zur Niederschrift der Geschäftsstelle einzulegen. Der Widerspruch kann auch zur Niederschrift der Geschäftsstelle eines jeden Amtsgerichtes abgegeben werden. Die Einlegung ist auch durch Übertragung eines elektronischen Dokuments an die elektronische Poststelle des Gerichts möglich. Das elektronische Dokument muss für die Bearbeitung durch das Gericht geeignet und mit einer qualifizierten elektronischen Signatur der verantwortenden Person versehen sein oder von der verantwortenden Person signiert und auf einem sicheren Übermittlungsweg gemäß § 130a ZPO nach näherer Maßgabe der Verordnung über die technischen Rahmenbedingungen des elektronischen Rechtsverkehrs und über das besondere elektronische Behördenpostfach (BGBl. I, S.3803) eingereicht werden. Weitere Informationen erhalten Sie auf der Internetseite www.justiz.de.\nDer Widerspruch muss spätestens innerhalb der gesetzten Frist nach dem Datum der Bekanntmachung der Löschungsankündigung bei dem Amtsgericht - Registergericht - Düsseldorf eingegangen sein.  Dies gilt auch dann, wenn der Widerspruch zur Niederschrift der Geschäftsstelle eines anderen Amtsgerichtes abgegeben wurde. Die Frist beginnt mit dem Tage der Bekanntmachung der Löschungsankündigung in dem für die Bekanntmachung der Eintragungen in das Handelsregister bestimmten elektronischen Informations- und Kommunikationssystem nach § 10 des Handelsgesetzbuches. Fällt das Ende der Frist auf einen Sonntag, einen allgemeinen Feiertag oder Sonnabend, so endet die Frist mit Ablauf des nächsten Werktages.\nDer Widerspruch muss die Bezeichnung der angefochtenen Löschungsankündigung sowie die Erklärung enthalten, dass Widerspruch gegen diese Löschungsankündigung eingelegt wird. Er ist zu unterzeichnen und soll begründet werden."
    },
    {
      "date": "2025-07-09",
      "id": "115217",
      "original_text": "Registerbekanntmachung nach dem Umwandlungsgesetz\nNordrhein-Westfalen Amtsgericht Düsseldorf HRB 104188\nTrockenberg Immobilien GmbH – Düsseldorf",
      "type": "Registerbekanntmachung nach dem Umwandlungsgesetz",
      "state": "Nordrhein-Westfalen",
      "amtsgericht": "Amtsgericht Düsseldorf",
      "registernummer": "HRB 104188",
      "registerart": "HRB",
      "company_name": "Trockenberg Immobilien GmbH",
      "company_seat": "Düsseldorf",
      "details": "09.07.2025 (Bekanntmachungsdatum)\n\nNordrhein-Westfalen Amtsgericht Düsseldorf HRB 104188\nRegisterbekanntmachung nach dem Umwandlungsgesetz 09.07.2025 (Eintragungsdatum)\n\nTrockenberg Immobilien GmbH\nGesellschaft mit beschränkter Haftung\nDüsseldorf\n\nDen Gläubigern der an der Verschmelzung beteiligten Rechtsträger ist, wenn sie binnen sechs Monaten nach dem Tag, an dem die Eintragung der Verschmelzung in das Register des Sitzes desjenigen Rechtsträgers, dessen Gläubiger sie sind, nach § 19 Absatz 3 UmwG als bekanntgemacht gilt, ihren Anspruch nach Grund und Höhe schriftlich anmelden, Sicherheit zu leisten, soweit sie nicht Befriedigung verlangen können. Dieses Recht steht den Gläubigern jedoch nur zu, wenn sie glaubhaft machen, dass durch die Verschmelzung die Erfüllung ihrer Forderung gefährdet wird."
    },
    {
      "date": "2025-07-09",
      "id": "115218",
      "original_text": "Einreichung neuer Dokumente\nNordrhein-Westfalen Amtsgericht Mönchengladbach HRB 16777\nPLANPROTECT AG – Mönchengladbach",
      "type": "Einreichung neuer Dokumente",
      "state": "Nordrhein-Westfalen",
      "amtsgericht": "Amtsgericht Mönchengladbach",
      "registernummer": "HRB 16777",
      "registerart": "HRB",
      "company_name": "PLANPROTECT AG",
      "company_seat": "Mönchengladbach",
      "details": "09.07.2025 (Bekanntmachungsdatum)\n\nNordrhein-Westfalen Amtsgericht Mönchengladbach HRB 16777\nEinreichung neuer Dokumente 09.07.2025 (Eintragungsdatum)\n\nPLANPROTECT AG\nAktiengesellschaft\nMönchengladbach\n\nDem Registergericht ist eine neue Liste der Mitglieder des Aufsichtsrates eingereicht worden."
    },
    {
      "date": "2025-07-09",
      "id": "115219",
      "original_text": "Einreichung neuer Dokumente\nNordrhein-Westfalen Amtsgericht Münster HRB 17773\nflaschenpost SE – Münster",
      "type": "Einreichung neuer Dokumente",
      "state": "Nordrhein-Westfalen",
      "amtsgericht": "Amtsgericht Münster",
      "registernummer": "HRB 17773",
      "registerart": "HRB",
      "company_name": "flaschenpost SE",
      "company_seat": "Münster",
      "details": "09.07.2025 (Bekanntmachungsdatum)\n\nNordrhein-Westfalen Amtsgericht Münster HRB 17773\nEinreichung neuer Dokumente\n\nflaschenpost SE\nEuropäische Aktiengesellschaft (SE)\nMünster\n\nDem Registergericht ist eine neue Liste der Mitglieder des Aufsichtsrates eingereicht worden."
    },
    {
      "date": "2025-07-09",
      "id": "115220",
      "original_text": "Registerbekanntmachung nach dem Umwandlungsgesetz\nNordrhein-Westfalen Amtsgericht Bonn HRB 15257\nScopevisio AG – Bonn",
      "type": "Registerbekanntmachung nach dem Umwandlungsgesetz",
      "state": "Nordrhein-Westfalen",
      "amtsgericht": "Amtsgericht Bonn",
      "registernummer": "HRB 15257",
      "registerart": "HRB",
      "company_name": "Scopevisio AG",
      "company_seat": "Bonn",
      "details": "09.07.2025 (Bekanntmachungsdatum)\n\nNordrhein-Westfalen Amtsgericht Bonn HRB 15257\nRegisterbekanntmachung nach dem Umwandlungsgesetz\n\nScopevisio AG\nAktiengesellschaft\nBonn\n\nDem Registergericht ist der Entwurf eines Vertrages über die Verschmelzung der Scopevisio FibuNet GmbH mit der Scopevisio AG eingereicht worden."
    },
    {
      "date": "2025-07-09",
      "id": "115221",
      "original_text": "Registerbekanntmachung nach dem Umwandlungsgesetz\nNordrhein-Westfalen Amtsgericht Essen HRB 36294\nBartels Recruiting Experts GmbH – Essen",
      "type": "Registerbekanntmachung nach dem Umwandlungsgesetz",
      "state": "Nordrhein-Westfalen",
      "amtsgericht": "Amtsgericht Essen",
      "registernummer": "HRB 36294",
      "registerart": "HRB",
      "company_name": "Bartels Recruiting Experts GmbH",
      "company_seat": "Essen",
      "details": "09.07.2025 (Bekanntmachungsdatum)\n\nNordrhein-Westfalen Amtsgericht Essen HRB 36294\nRegisterbekanntmachung nach dem Umwandlungsgesetz 09.07.2025 (Eintragungsdatum)\n\nBartels Recruiting Experts GmbH\nGesellschaft mit beschränkter Haftung\nEssen\n\nDen Gläubigern der an der Verschmelzung beteiligten Rechtsträger ist, wenn sie binnen sechs Monaten nach dem Tag, an dem die Eintragung der Verschmelzung in das Register des Sitzes desjenigen Rechtsträgers, dessen Gläubiger sie sind, nach § 19 Absatz 3 UmwG als bekanntgemacht gilt, ihren Anspruch nach Grund und Höhe schriftlich anmelden, Sicherheit zu leisten, soweit sie nicht Befriedigung verlangen können. Dieses Recht steht den Gläubigern jedoch nur zu, wenn sie glaubhaft machen, dass durch die Verschmelzung die Erfüllung ihrer Forderung gefährdet wird."
    },
    {
      "date": "2025-07-09",
      "id": "115222",
      "original_text": "Registerbekanntmachung nach dem Umwandlungsgesetz\nNordrhein-Westfalen Amtsgericht Köln HRA 38174\neye-level consulting e.K. – Frechen",
      "type": "Registerbekanntmachung nach dem Umwandlungsgesetz",
      "state": "Nordrhein-Westfalen",
      "amtsgericht": "Amtsgericht Köln",
      "registernummer": "HRA 38174",
      "registerart": "HRA",
      "company_name": "eye-level consulting e.K.",
      "company_seat": "Frechen",
      "details": "09.07.2025 (Bekanntmachungsdatum)\n\nNordrhein-Westfalen Amtsgericht Köln HRA 38174\nRegisterbekanntmachung nach dem Umwandlungsgesetz 09.07.2025 (Eintragungsdatum)\n\neye-level consulting e.K.\nEinzelkaufmann / Einzelkauffrau\nFrechen\n\nDen Gläubigern der an der Ausgliederung beteiligten Rechtsträger ist, wenn sie binnen sechs Monaten nach dem Tag, an dem die Eintragung der Ausgliederung in das Register des Sitzes desjenigen Rechtsträgers, dessen Gläubiger sie sind, nach § 19 Absatz 3 UmwG als bekanntgemacht gilt, ihren Anspruch nach Grund und Höhe schriftlich anmelden, Sicherheit zu leisten, soweit sie nicht Befriedigung verlangen können. Dieses Recht steht den Gläubigern jedoch nur zu, wenn sie glaubhaft machen, dass durch die Ausgliederung die Erfüllung ihrer Forderung gefährdet wird."
    },
    {
      "date": "2025-07-09",
      "id": "115223",
      "original_text": "Registerbekanntmachung nach dem Umwandlungsgesetz\nNordrhein-Westfalen Amtsgericht Düsseldorf HRB 100960\nGreenvio GmbH – Düsseldorf",
      "type": "Registerbekanntmachung nach dem Umwandlungsgesetz",
      "state": "Nordrhein-Westfalen",
      "amtsgericht": "Amtsgericht Düsseldorf",
      "registernummer": "HRB 100960",
      "registerart": "HRB",
      "company_name": "Greenvio GmbH",
      "company_seat": "Düsseldorf",
      "details": "09.07.2025 (Bekanntmachungsdatum)\n\nNordrhein-Westfalen Amtsgericht Düsseldorf HRB 100960\nRegisterbekanntmachung nach dem Umwandlungsgesetz 09.07.2025 (Eintragungsdatum)\n\nGreenvio GmbH\nGesellschaft mit beschränkter Haftung\nDüsseldorf\n\nDen Gläubigern der an der Verschmelzung beteiligten Rechtsträger ist, wenn sie binnen sechs Monaten nach dem Tag, an dem die Eintragung der Verschmelzung in das Register des Sitzes desjenigen Rechtsträgers, dessen Gläubiger sie sind, nach § 19 Absatz 3 UmwG als bekanntgemacht gilt, ihren Anspruch nach Grund und Höhe schriftlich anmelden, Sicherheit zu leisten, soweit sie nicht Befriedigung verlangen können. Dieses Recht steht den Gläubigern jedoch nur zu, wenn sie glaubhaft machen, dass durch die Verschmelzung die Erfüllung ihrer Forderung gefährdet wird."
    },
    {
      "date": "2025-07-09",
      "id": "115224",
      "original_text": "Registerbekanntmachung nach dem Umwandlungsgesetz\nNordrhein-Westfalen Amtsgericht Bonn HRB 15257\nScopevisio AG – Bonn",
      "type": "Registerbekanntmachung nach dem Umwandlungsgesetz",
      "state": "Nordrhein-Westfalen",
      "amtsgericht": "Amtsgericht Bonn",
      "registernummer": "HRB 15257",
      "registerart": "HRB",
      "company_name": "Scopevisio AG",
      "company_seat": "Bonn",
      "details": "09.07.2025 (Bekanntmachungsdatum)\n\nNordrhein-Westfalen Amtsgericht Bonn HRB 15257\nRegisterbekanntmachung nach dem Umwandlungsgesetz\n\nScopevisio AG\nAktiengesellschaft\nBonn\n\nDem Registergericht ist der Entwurf eines Vertrages über die Verschmelzung der Scopevisio Extensions GmbH mit der Scopevisio AG eingereicht worden."
    },
    {
      "date": "2025-07-09",
      "id": "115225",
      "original_text": "Registerbekanntmachung nach dem Umwandlungsgesetz\nNordrhein-Westfalen Amtsgericht Bonn HRB 15257\nScopevisio AG – Bonn",
      "type": "Registerbekanntmachung nach dem Umwandlungsgesetz",
      "state": "Nordrhein-Westfalen",
      "amtsgericht": "Amtsgericht Bonn",
      "registernummer": "HRB 15257",
      "registerart": "HRB",
      "company_name": "Scopevisio AG",
      "company_seat": "Bonn",
      "details": "09.07.2025 (Bekanntmachungsdatum)\n\nNordrhein-Westfalen Amtsgericht Bonn HRB 15257\nRegisterbekanntmachung nach dem Umwandlungsgesetz\n\nScopevisio AG\nAktiengesellschaft\nBonn\n\nDem Registergericht ist der Entwurf eines Vertrages über die Verschmelzung der Scopevisio eurosoft GmbH mit der Scopevisio AG eingereicht worden."
    },
    {
      "date": "2025-07-09",
      "id": "115226",
      "original_text": "Einreichung neuer Dokumente\nNordrhein-Westfalen Amtsgericht Düsseldorf HRB 41241\nProvinzial Versicherung Aktiengesellschaft – Düsseldorf",
      "type": "Einreichung neuer Dokumente",
      "state": "Nordrhein-Westfalen",
      "amtsgericht": "Amtsgericht Düsseldorf",
      "registernummer": "HRB 41241",
      "registerart": "HRB",
      "company_name": "Provinzial Versicherung Aktiengesellschaft",
      "company_seat": "Düsseldorf",
      "details": "09.07.2025 (Bekanntmachungsdatum)\n\nNordrhein-Westfalen Amtsgericht Düsseldorf HRB 41241\nEinreichung neuer Dokumente 09.07.2025 (Eintragungsdatum)\n\nProvinzial Versicherung Aktiengesellschaft\nAktiengesellschaft\nDüsseldorf\n\nDem Registergericht ist eine Liste der Mitglieder des Aufsichtsrates eingereicht worden."
    },
    {
      "date": "2025-07-09",
      "id": "115227",
      "original_text": "Löschungsankündigung\nNordrhein-Westfalen Amtsgericht Bonn HRB 28729\nInvoice24 GmbH – Bonn",
      "type": "Löschungsankündigung",
      "state": "Nordrhein-Westfalen",
      "amtsgericht": "Amtsgericht Bonn",
      "registernummer": "HRB 28729",
      "registerart": "HRB",
      "company_name": "Invoice24 GmbH",
      "company_seat": "Bonn",
      "details": "09.07.2025 (Bekanntmachungsdatum)\n\nNordrhein-Westfalen Amtsgericht Bonn HRB 28729\nLöschungsankündigung\n\nInvoice24 GmbH\nGesellschaft mit beschränkter Haftung\nBonn\n\nDas Registergericht beabsichtigt die Gesellschaft von Amts wegen nach § 394 FamFG zu löschen. Die Frist zur Erhebung eines Widerspruchs ist auf einen Monat festgesetzt."
    },
    {
      "date": "2025-07-09",
      "id": "115228",
      "original_text": "Sonstige Registerbekanntmachung\nNordrhein-Westfalen Amtsgericht Köln HRB 4330\nEUROPA Lebensversicherung Aktiengesellschaft – Köln",
      "type": "Sonstige Registerbekanntmachung",
      "state": "Nordrhein-Westfalen",
      "amtsgericht": "Amtsgericht Köln",
      "registernummer": "HRB 4330",
      "registerart": "HRB",
      "company_name": "EUROPA Lebensversicherung Aktiengesellschaft",
      "company_seat": "Köln",
      "details": "09.07.2025 (Bekanntmachungsdatum)\n\nNordrhein-Westfalen Amtsgericht Köln HRB 4330\nSonstige Registerbekanntmachung 09.07.2025 (Eintragungsdatum)\n\nEUROPA Lebensversicherung Aktiengesellschaft\nAktiengesellschaft\nKöln\n\nDem Registergericht ist eine neue Liste der Mitglieder des Aufsichtsrates eingereicht worden."
    },
    {
      "date": "2025-07-09",
      "id": "115229",
      "original_text": "Löschungsankündigung\nThüringen Amtsgericht Jena HRB 516085\nHonest Merchant Salvation Beteiligungen UG (haftungsbeschränkt) – Weida",
      "type": "Löschungsankündigung",
      "state": "Thüringen",
      "amtsgericht": "Amtsgericht Jena",
      "registernummer": "HRB 516085",
      "registerart": "HRB",
      "company_name": "Honest Merchant Salvation Beteiligungen UG (haftungsbeschränkt)",
      "company_seat": "Weida",
      "details": "09.07.2025 (Bekanntmachungsdatum)\n\nThüringen Amtsgericht Jena HRB 516085\nLöschungsankündigung\n\nHonest Merchant Salvation Beteiligungen UG (haftungsbeschränkt)\nGesellschaft mit beschränkter Haftung\nWeida\n\nDas Registergericht beabsichtigt, die im Handelsregister eingetragene Gesellschaft wegen Vermögenslosigkeit nach § 394 FamFG von Amts wegen zu löschen. Die Frist zur Erhebung eines Widerspruchs gegen die beabsichtigte Löschung wird auf 6 Wochen festgesetzt."
    },
    {
      "date": "2025-07-09",
      "id": "115230",
      "original_text": "Einreichung neuer Dokumente\nThüringen Amtsgericht Jena HRB 516855\nIBYKUS Aktiengesellschaft für Informationstechnologie – Erfurt",
      "type": "Einreichung neuer Dokumente",
      "state": "Thüringen",
      "amtsgericht": "Amtsgericht Jena",
      "registernummer": "HRB 516855",
      "registerart": "HRB",
      "company_name": "IBYKUS Aktiengesellschaft für Informationstechnologie",
      "company_seat": "Erfurt",
      "details": "09.07.2025 (Bekanntmachungsdatum)\n\nThüringen Amtsgericht Jena HRB 516855\nEinreichung neuer Dokumente 09.07.2025 (Eintragungsdatum)\n\nIBYKUS Aktiengesellschaft für Informationstechnologie\nAktiengesellschaft\nErfurt\n\nBekanntmachung gem. § 106 AktG: Aufgrund einer Veränderung in den Personen der Aufsichtsratsmitglieder ist durch den Vorstand eine neue Liste zum Handelsregister eingereicht worden."
    },
    {
      "date": "2025-07-09",
      "id": "115231",
      "original_text": "Sonstige Registerbekanntmachung\nHessen Amtsgericht Kassel VR 4363\nArbeitsgemeinschaft der Vereine und Verbände Wolfsanger e. V. – Kassel",
      "type": "Sonstige Registerbekanntmachung",
      "state": "Hessen",
      "amtsgericht": "Amtsgericht Kassel",
      "registernummer": "VR 4363",
      "registerart": "VR",
      "company_name": "Arbeitsgemeinschaft der Vereine und Verbände Wolfsanger e. V.",
      "company_seat": "Kassel",
      "details": "09.07.2025 (Bekanntmachungsdatum)\n\nHessen Amtsgericht Kassel VR 4363\nSonstige Registerbekanntmachung 09.07.2025 (Eintragungsdatum)\n\nArbeitsgemeinschaft der Vereine und Verbände Wolfsanger e. V.\neingetragener Verein\nKassel\n\nDer Verein ist aufgelöst."
    },
    {
      "date": "2025-07-09",
      "id": "115232",
      "original_text": "Einreichung neuer Dokumente\nHessen Amtsgericht Frankfurt am Main HRB 108994\nKavalieris GmbH – Frankfurt am Main",
      "type": "Einreichung neuer Dokumente",
      "state": "Hessen",
      "amtsgericht": "Amtsgericht Frankfurt am Main",
      "registernummer": "HRB 108994",
      "registerart": "HRB",
      "company_name": "Kavalieris GmbH",
      "company_seat": "Frankfurt am Main",
      "details": "09.07.2025 (Bekanntmachungsdatum)\n\nHessen Amtsgericht Frankfurt am Main HRB 108994\nEinreichung neuer Dokumente\n\nKavalieris GmbH\nGesellschaft mit beschränkter Haftung\nFrankfurt am Main\n\nDurch eine Änderung in den Personen der Beiratsmitglieder ist eine Liste der Mitglieder des Beirates zum Handelsregister eingereicht worden."
    },
    {
      "date": "2025-07-09",
      "id": "115233",
      "original_text": "Einreichung neuer Dokumente\nHessen Amtsgericht Wetzlar HRB 13\nBosch Thermotechnik GmbH – Wetzlar",
      "type": "Einreichung neuer Dokumente",
      "state": "Hessen",
      "amtsgericht": "Amtsgericht Wetzlar",
      "registernummer": "HRB 13",
      "registerart": "HRB",
      "company_name": "Bosch Thermotechnik GmbH",
      "company_seat": "Wetzlar",
      "details": "09.07.2025 (Bekanntmachungsdatum)\n\nHessen Amtsgericht Wetzlar HRB 13\nEinreichung neuer Dokumente\n\nBosch Thermotechnik GmbH\nGesellschaft mit beschränkter Haftung\nWetzlar\n\nDurch eine Änderung in den Personen der Aufsichtsratsmitglieder ist eine Liste der Mitglieder des Aufsichtsrates zum Handelsregister eingereicht worden."
    },
    {
      "date": "2025-07-09",
      "id": "115234",
      "original_text": "Registerbekanntmachung nach dem Umwandlungsgesetz\nHessen Amtsgericht Frankfurt am Main HRA 54200\nCosmo Properties 6 (MBG Schwelm) B.V. & Co. KG – Frankfurt am Main",
      "type": "Registerbekanntmachung nach dem Umwandlungsgesetz",
      "state": "Hessen",
      "amtsgericht": "Amtsgericht Frankfurt am Main",
      "registernummer": "HRA 54200",
      "registerart": "HRA",
      "company_name": "Cosmo Properties 6 (MBG Schwelm) B.V. & Co. KG",
      "company_seat": "Frankfurt am Main",
      "details": "09.07.2025 (Bekanntmachungsdatum)\n\nHessen Amtsgericht Frankfurt am Main HRA 54200\nRegisterbekanntmachung nach dem Umwandlungsgesetz 09.07.2025 (Eintragungsdatum)\n\nCosmo Properties 6 (MBG Schwelm) B.V. & Co. KG\nKommanditgesellschaft\nFrankfurt am Main\n\nDen Gläubigern der an der Ausgliederung beteiligten Rechtsträger ist, wenn sie binnen sechs Monaten nach dem Tag, an dem die Eintragung der Ausgliederung in das Register des Sitzes desjenigen Rechtsträgers, dessen Gläubiger sie sind, nach §§ 125, 19 Absatz 3 UmwG bekannt gemacht worden ist, ihren Anspruch nach Grund und Höhe schriftlich anmelden, Sicherheit zu leisten, soweit sie nicht Befriedigung verlangen können. Dieses Recht steht den Gläubigern jedoch nur zu, wenn sie glaubhaft machen, dass durch die Ausgliederung die Erfüllung ihrer Forderung gefährdet wird."
    },
    {
      "date": "2025-07-09",
      "id": "115235",
      "original_text": "Einreichung neuer Dokumente\nHessen Amtsgericht Frankfurt am Main HRB 84069\nClariant SE – Frankfurt am Main",
      "type": "Einreichung neuer Dokumente",
      "state": "Hessen",
      "amtsgericht": "Amtsgericht Frankfurt am Main",
      "registernummer": "HRB 84069",
      "registerart": "HRB",
      "company_name": "Clariant SE",
      "company_seat": "Frankfurt am Main",
      "details": "09.07.2025 (Bekanntmachungsdatum)\n\nHessen Amtsgericht Frankfurt am Main HRB 84069\nEinreichung neuer Dokumente\n\nClariant SE\nEuropäische Aktiengesellschaft (SE)\nFrankfurt am Main\n\nDurch eine Änderung in den Personen der Aufsichtsratsmitglieder ist eine Liste der Mitglieder des Aufsichtsrates zum Handelsregister eingereicht worden."
    },
    {
      "date": "2025-07-09",
      "id": "115236",
      "original_text": "Registerbekanntmachung nach dem Umwandlungsgesetz\nHessen Amtsgericht Fulda HRB 8735\n3on IT GmbH – Fulda",
      "type": "Registerbekanntmachung nach dem Umwandlungsgesetz",
      "state": "Hessen",
      "amtsgericht": "Amtsgericht Fulda",
      "registernummer": "HRB 8735",
      "registerart": "HRB",
      "company_name": "3on IT GmbH",
      "company_seat": "Fulda",
      "details": "09.07.2025 (Bekanntmachungsdatum)\n\nHessen Amtsgericht Fulda HRB 8735\nRegisterbekanntmachung nach dem Umwandlungsgesetz 09.07.2025 (Eintragungsdatum)\n\n3on IT GmbH\nGesellschaft mit beschränkter Haftung\nFulda\n\nDen Gläubigern der an der Ausgliederung beteiligten Rechtsträger ist, wenn sie binnen sechs Monaten nach dem Tag, an dem die Eintragung der Ausgliederung in das Register des Sitzes desjenigen Rechtsträgers, dessen Gläubiger sie sind, nach §§ 125, 19 Absatz 3 UmwG bekannt gemacht worden ist, ihren Anspruch nach Grund und Höhe schriftlich anmelden, Sicherheit zu leisten, soweit sie nicht Befriedigung verlangen können. Dieses Recht steht den Gläubigern jedoch nur zu, wenn sie glaubhaft machen, dass durch die Ausgliederung die Erfüllung ihrer Forderung gefährdet wird."
    },
    {
      "date": "2025-07-09",
      "id": "115237",
      "original_text": "Einreichung neuer Dokumente\nHessen Amtsgericht Frankfurt am Main HRB 134695\nSidetrade AG – Frankfurt am Main",
      "type": "Einreichung neuer Dokumente",
      "state": "Hessen",
      "amtsgericht": "Amtsgericht Frankfurt am Main",
      "registernummer": "HRB 134695",
      "registerart": "HRB",
      "company_name": "Sidetrade AG",
      "company_seat": "Frankfurt am Main",
      "details": "09.07.2025 (Bekanntmachungsdatum)\n\nHessen Amtsgericht Frankfurt am Main HRB 134695\nEinreichung neuer Dokumente\n\nSidetrade AG\nAktiengesellschaft\nFrankfurt am Main\n\nDie Gesellschaft hat den Entwurf des Verschmelzungsvertrages zwischen ihr und der SHS Viveon AG, mit dem Sitz in München (Amtsgericht München HRB 118229 ) beim Amtsgericht Frankfurt am Main (Registergericht) zur Einsichtnahme eingereicht."
    },
    {
      "date": "2025-07-09",
      "id": "115238",
      "original_text": "Einreichung neuer Dokumente\nHessen Amtsgericht Frankfurt am Main HRB 120644\nPOLYVANTIS GmbH – Frankfurt am Main",
      "type": "Einreichung neuer Dokumente",
      "state": "Hessen",
      "amtsgericht": "Amtsgericht Frankfurt am Main",
      "registernummer": "HRB 120644",
      "registerart": "HRB",
      "company_name": "POLYVANTIS GmbH",
      "company_seat": "Frankfurt am Main",
      "details": "09.07.2025 (Bekanntmachungsdatum)\n\nHessen Amtsgericht Frankfurt am Main HRB 120644\nEinreichung neuer Dokumente\n\nPOLYVANTIS GmbH\nGesellschaft mit beschränkter Haftung\nFrankfurt am Main\n\nDurch eine Änderung in den Personen der Aufsichtsratsmitglieder ist eine Liste der Mitglieder des Aufsichtsrates zum Handelsregister eingereicht worden."
    },
    {
      "date": "2025-07-09",
      "id": "115239",
      "original_text": "Löschungsankündigung\nHessen Amtsgericht Bad Homburg v.d.H. HRB 16244\nSU Sales & IT Solutions GmbH – Steinbach (Taunus)",
      "type": "Löschungsankündigung",
      "state": "Hessen",
      "amtsgericht": "Amtsgericht Bad Homburg v.d.H.",
      "registernummer": "HRB 16244",
      "registerart": "HRB",
      "company_name": "SU Sales & IT Solutions GmbH",
      "company_seat": "Steinbach (Taunus)",
      "details": "09.07.2025 (Bekanntmachungsdatum)\n\nHessen Amtsgericht Bad Homburg v.d.H. HRB 16244\nLöschungsankündigung\n\nSU Sales & IT Solutions GmbH\nGesellschaft mit beschränkter Haftung\nSteinbach (Taunus)\n\nDas Registergericht beabsichtigt die im Handelsregister eingetragene Gesellschaft von Amts wegen nach § 394 FamFG zu löschen. Die Frist zur Erhebung eines Widerspruchs gegen die beabsichtigte Löschung wird auf 3 Monate festgesetzt."
    }
  ]
}