{
  "date": "2025-01-30",
  "date_of_scrape": "2025-01-31T04:10:17.440Z",
  "tool_version": "0.2.0",
  "number_of_announcements": 167,
  "announcements": [
    {
      "date": "2025-01-30",
      "id": "100000",
      "original_text": "Registerbekanntmachung nach dem Umwandlungsgesetz\nBerlin Amtsgericht Berlin (Charlottenburg) HRB 271552\nNaturensöhne GmbH – Berlin",
      "type": "Registerbekanntmachung nach dem Umwandlungsgesetz",
      "state": "Berlin",
      "amtsgericht": "Amtsgericht Berlin (Charlottenburg)",
      "registernummer": "HRB 271552",
      "registerart": "HRB",
      "company_name": "Naturensöhne GmbH",
      "company_seat": "Berlin",
      "details": "30.01.2025 (Bekanntmachungsdatum)\n\nBerlin Amtsgericht Berlin (Charlottenburg) HRB 271552\nRegisterbekanntmachung nach dem Umwandlungsgesetz 27.01.2025 (Eintragungsdatum)\n\nNaturensöhne GmbH\nGesellschaft mit beschränkter Haftung\nBerlin\n\nDen Gläubigern ist, wenn sie binnen sechs Monaten nach dem Tag, an dem die Eintragung der Umwandlung als bekannt gemacht gilt, ihren Anspruch nach Grund und Höhe schriftlich anmelden, Sicherheit zu leisten, soweit sie nicht Befriedigung verlangen können. Dieses Recht steht den Gläubigern jedoch nur zu, wenn sie glaubhaft machen, dass durch die Umwandlung die Erfüllung ihrer Forderung gefährdet wird. Das Recht, Sicherheitsleistung zu verlangen, steht Gläubigern nicht zu, die im Falle der Insolvenz ein Recht auf vorzugsweise Befriedigung aus einer Deckungsmasse haben, die nach gesetzlicher Vorschrift zu ihrem Schutz errichtet und staatlich überwacht ist."
    },
    {
      "date": "2025-01-30",
      "id": "100001",
      "original_text": "Löschungsankündigung\nBerlin Amtsgericht Berlin (Charlottenburg) HRB 214707\nOC Travel Connect UG (haftungsbeschränkt) – Berlin",
      "type": "Löschungsankündigung",
      "state": "Berlin",
      "amtsgericht": "Amtsgericht Berlin (Charlottenburg)",
      "registernummer": "HRB 214707",
      "registerart": "HRB",
      "company_name": "OC Travel Connect UG (haftungsbeschränkt)",
      "company_seat": "Berlin",
      "details": "30.01.2025 (Bekanntmachungsdatum)\n\nBerlin Amtsgericht Berlin (Charlottenburg) HRB 214707\nLöschungsankündigung\n\nOC Travel Connect UG (haftungsbeschränkt)\nGesellschaft mit beschränkter Haftung\nBerlin\n\nBei der nachstehenden Gesellschaft wird das Amtslöschungsverfahren gemäß § 394 FamFG eingeleitet. Widerspruchsfrist 6 Wochen"
    },
    {
      "date": "2025-01-30",
      "id": "100002",
      "original_text": "Löschungsankündigung\nBerlin Amtsgericht Berlin (Charlottenburg) HRB 144040\nQuartier am Nordbahnhof GmbH – Berlin",
      "type": "Löschungsankündigung",
      "state": "Berlin",
      "amtsgericht": "Amtsgericht Berlin (Charlottenburg)",
      "registernummer": "HRB 144040",
      "registerart": "HRB",
      "company_name": "Quartier am Nordbahnhof GmbH",
      "company_seat": "Berlin",
      "details": "30.01.2025 (Bekanntmachungsdatum)\n\nBerlin Amtsgericht Berlin (Charlottenburg) HRB 144040\nLöschungsankündigung\n\nQuartier am Nordbahnhof GmbH\nGesellschaft mit beschränkter Haftung\nBerlin\n\nBei der nachstehenden Gesellschaft wird das Amtslöschungsverfahren gemäß § 394 FamFG eingeleitet. Widerspruchsfrist 6 Wochen"
    },
    {
      "date": "2025-01-30",
      "id": "100003",
      "original_text": "Löschungsankündigung\nBerlin Amtsgericht Berlin (Charlottenburg) HRB 143661\nKellert Holding UG (haftungbeschränkt) – Berlin",
      "type": "Löschungsankündigung",
      "state": "Berlin",
      "amtsgericht": "Amtsgericht Berlin (Charlottenburg)",
      "registernummer": "HRB 143661",
      "registerart": "HRB",
      "company_name": "Kellert Holding UG (haftungbeschränkt)",
      "company_seat": "Berlin",
      "details": "30.01.2025 (Bekanntmachungsdatum)\n\nBerlin Amtsgericht Berlin (Charlottenburg) HRB 143661\nLöschungsankündigung\n\nKellert Holding UG (haftungbeschränkt)\nGesellschaft mit beschränkter Haftung\nBerlin\n\nBei der nachstehenden Gesellschaft wird das Amtslöschungsverfahren gemäß § 394 FamFG eingeleitet. Widerspruchsfrist 6 Wochen"
    },
    {
      "date": "2025-01-30",
      "id": "100004",
      "original_text": "Löschungsankündigung\nBerlin Amtsgericht Berlin (Charlottenburg) HRB 231569\nHB Truck & Trade GmbH – Berlin",
      "type": "Löschungsankündigung",
      "state": "Berlin",
      "amtsgericht": "Amtsgericht Berlin (Charlottenburg)",
      "registernummer": "HRB 231569",
      "registerart": "HRB",
      "company_name": "HB Truck & Trade GmbH",
      "company_seat": "Berlin",
      "details": "30.01.2025 (Bekanntmachungsdatum)\n\nBerlin Amtsgericht Berlin (Charlottenburg) HRB 231569\nLöschungsankündigung\n\nHB Truck & Trade GmbH\nGesellschaft mit beschränkter Haftung\nBerlin\n\nBei der nachstehenden Gesellschaft wird das Amtslöschungsverfahren gemäß § 394 FamFG eingeleitet. Widerspruchsfrist 6 Wochen"
    },
    {
      "date": "2025-01-30",
      "id": "100005",
      "original_text": "Löschungsankündigung\nBerlin Amtsgericht Berlin (Charlottenburg) HRB 238900\nIMMOBILIEN PARTNER BAU GmbH – Berlin",
      "type": "Löschungsankündigung",
      "state": "Berlin",
      "amtsgericht": "Amtsgericht Berlin (Charlottenburg)",
      "registernummer": "HRB 238900",
      "registerart": "HRB",
      "company_name": "IMMOBILIEN PARTNER BAU GmbH",
      "company_seat": "Berlin",
      "details": "30.01.2025 (Bekanntmachungsdatum)\n\nBerlin Amtsgericht Berlin (Charlottenburg) HRB 238900\nLöschungsankündigung\n\nIMMOBILIEN PARTNER BAU GmbH\nGesellschaft mit beschränkter Haftung\nBerlin\n\nBei der nachstehenden Gesellschaft wird das Amtslöschungsverfahren gemäß § 394 FamFG eingeleitet. Widerspruchsfrist 6 Wochen"
    },
    {
      "date": "2025-01-30",
      "id": "100006",
      "original_text": "Löschungsankündigung\nBerlin Amtsgericht Berlin (Charlottenburg) HRB 257718\nZakiewicz Immobilien GmbH – Berlin",
      "type": "Löschungsankündigung",
      "state": "Berlin",
      "amtsgericht": "Amtsgericht Berlin (Charlottenburg)",
      "registernummer": "HRB 257718",
      "registerart": "HRB",
      "company_name": "Zakiewicz Immobilien GmbH",
      "company_seat": "Berlin",
      "details": "30.01.2025 (Bekanntmachungsdatum)\n\nBerlin Amtsgericht Berlin (Charlottenburg) HRB 257718\nLöschungsankündigung\n\nZakiewicz Immobilien GmbH\nGesellschaft mit beschränkter Haftung\nBerlin\n\nBei der nachstehenden Gesellschaft wird das Amtslöschungsverfahren gemäß § 394 FamFG eingeleitet. Widerspruchsfrist 6 Wochen"
    },
    {
      "date": "2025-01-30",
      "id": "100007",
      "original_text": "Löschungsankündigung\nBerlin Amtsgericht Berlin (Charlottenburg) HRB 196288\nASF Asset Solutions Factory GmbH – Berlin",
      "type": "Löschungsankündigung",
      "state": "Berlin",
      "amtsgericht": "Amtsgericht Berlin (Charlottenburg)",
      "registernummer": "HRB 196288",
      "registerart": "HRB",
      "company_name": "ASF Asset Solutions Factory GmbH",
      "company_seat": "Berlin",
      "details": "30.01.2025 (Bekanntmachungsdatum)\n\nBerlin Amtsgericht Berlin (Charlottenburg) HRB 196288\nLöschungsankündigung\n\nASF Asset Solutions Factory GmbH\nGesellschaft mit beschränkter Haftung\nBerlin\n\nBei der nachstehenden Gesellschaft wird das Amtslöschungsverfahren gemäß § 394 FamFG eingeleitet. Widerspruchsfrist\n6 Wochen."
    },
    {
      "date": "2025-01-30",
      "id": "100008",
      "original_text": "Löschungsankündigung\nBerlin Amtsgericht Berlin (Charlottenburg) HRA 51862\nCY Immobilien zu Berlin GmbH & Co. KG – Berlin",
      "type": "Löschungsankündigung",
      "state": "Berlin",
      "amtsgericht": "Amtsgericht Berlin (Charlottenburg)",
      "registernummer": "HRA 51862",
      "registerart": "HRA",
      "company_name": "CY Immobilien zu Berlin GmbH & Co. KG",
      "company_seat": "Berlin",
      "details": "30.01.2025 (Bekanntmachungsdatum)\n\nBerlin Amtsgericht Berlin (Charlottenburg) HRA 51862\nLöschungsankündigung\n\nCY Immobilien zu Berlin GmbH & Co. KG\nKommanditgesellschaft\nBerlin\n\nBei dem nachstehenden Unternehmen / der nachstehenden Gesellschaft wird das Amtslöschungsverfahren gemäß § 31 Abs. 2 HGB eingeleitet. Widerspruchsfrist 6 Monate"
    },
    {
      "date": "2025-01-30",
      "id": "100009",
      "original_text": "Löschungsankündigung\nBerlin Amtsgericht Berlin (Charlottenburg) HRB 181882\nMK Beauty+Gesundheit Berlin GmbH – Berlin",
      "type": "Löschungsankündigung",
      "state": "Berlin",
      "amtsgericht": "Amtsgericht Berlin (Charlottenburg)",
      "registernummer": "HRB 181882",
      "registerart": "HRB",
      "company_name": "MK Beauty+Gesundheit Berlin GmbH",
      "company_seat": "Berlin",
      "details": "30.01.2025 (Bekanntmachungsdatum)\n\nBerlin Amtsgericht Berlin (Charlottenburg) HRB 181882\nLöschungsankündigung\n\nMK Beauty+Gesundheit Berlin GmbH\nGesellschaft mit beschränkter Haftung\nBerlin\n\nBei der nachstehenden Gesellschaft wird das Amtslöschungsverfahren gemäß § 394 FamFG eingeleitet. Widerspruchsfrist 6 Wochen"
    },
    {
      "date": "2025-01-30",
      "id": "100010",
      "original_text": "Löschungsankündigung\nBerlin Amtsgericht Berlin (Charlottenburg) HRB 158484\nP5BC GmbH – Berlin",
      "type": "Löschungsankündigung",
      "state": "Berlin",
      "amtsgericht": "Amtsgericht Berlin (Charlottenburg)",
      "registernummer": "HRB 158484",
      "registerart": "HRB",
      "company_name": "P5BC GmbH",
      "company_seat": "Berlin",
      "details": "30.01.2025 (Bekanntmachungsdatum)\n\nBerlin Amtsgericht Berlin (Charlottenburg) HRB 158484\nLöschungsankündigung\n\nP5BC GmbH\nGesellschaft mit beschränkter Haftung\nBerlin\n\nBei der nachstehenden Gesellschaft wird das Amtslöschungsverfahren gemäß § 394 FamFG eingeleitet. Widerspruchsfrist: 6 Wochen."
    },
    {
      "date": "2025-01-30",
      "id": "100011",
      "original_text": "Löschungsankündigung\nBerlin Amtsgericht Berlin (Charlottenburg) HRB 259895\nElisa GmbH – Berlin",
      "type": "Löschungsankündigung",
      "state": "Berlin",
      "amtsgericht": "Amtsgericht Berlin (Charlottenburg)",
      "registernummer": "HRB 259895",
      "registerart": "HRB",
      "company_name": "Elisa GmbH",
      "company_seat": "Berlin",
      "details": "30.01.2025 (Bekanntmachungsdatum)\n\nBerlin Amtsgericht Berlin (Charlottenburg) HRB 259895\nLöschungsankündigung\n\nElisa GmbH\nGesellschaft mit beschränkter Haftung\nBerlin\n\nBei der nachstehenden Gesellschaft wird das Amtslöschungsverfahren gemäß § 394 FamFG eingeleitet. Widerspruchsfrist 6 Wochen"
    },
    {
      "date": "2025-01-30",
      "id": "100012",
      "original_text": "Registerbekanntmachung nach dem Umwandlungsgesetz\nBerlin Amtsgericht Berlin (Charlottenburg) HRA 63592\nNaturensöhne oHG – Berlin",
      "type": "Registerbekanntmachung nach dem Umwandlungsgesetz",
      "state": "Berlin",
      "amtsgericht": "Amtsgericht Berlin (Charlottenburg)",
      "registernummer": "HRA 63592",
      "registerart": "HRA",
      "company_name": "Naturensöhne oHG",
      "company_seat": "Berlin",
      "details": "30.01.2025 (Bekanntmachungsdatum)\n\nBerlin Amtsgericht Berlin (Charlottenburg) HRA 63592\nRegisterbekanntmachung nach dem Umwandlungsgesetz 27.01.2025 (Eintragungsdatum)\n\nNaturensöhne oHG\nOffene Handelsgesellschaft\nBerlin\n\nZu Eintragungsnummer 2 vom 27.01.2025 wird als nicht eingetragen veröffentlicht:\nDen Gläubigern ist, wenn sie binnen sechs Monaten nach dem Tag, an dem die Eintragung der Umwandlung als bekannt gemacht gilt, ihren Anspruch nach Grund und Höhe schriftlich anmelden, Sicherheit zu leisten, soweit sie nicht Befriedigung verlangen können. Dieses Recht steht den Gläubigern jedoch nur zu, wenn sie glaubhaft machen, dass durch die Umwandlung die Erfüllung ihrer Forderung gefährdet wird. Das Recht, Sicherheitsleistung zu verlangen, steht Gläubigern nicht zu, die im Falle der Insolvenz ein Recht auf vorzugsweise Befriedigung aus einer Deckungsmasse haben, die nach gesetzlicher Vorschrift zu ihrem Schutz errichtet und staatlich überwacht ist."
    },
    {
      "date": "2025-01-30",
      "id": "100013",
      "original_text": "Registerbekanntmachung nach dem Umwandlungsgesetz\nBerlin Amtsgericht Berlin (Charlottenburg) PR 438\nMüller-Wrede Rechtsanwälte PartGmbB – Berlin",
      "type": "Registerbekanntmachung nach dem Umwandlungsgesetz",
      "state": "Berlin",
      "amtsgericht": "Amtsgericht Berlin (Charlottenburg)",
      "registernummer": "PR 438",
      "registerart": "PR",
      "company_name": "Müller-Wrede Rechtsanwälte PartGmbB",
      "company_seat": "Berlin",
      "details": "30.01.2025 (Bekanntmachungsdatum)\n\nBerlin Amtsgericht Berlin (Charlottenburg) PR 438\nRegisterbekanntmachung nach dem Umwandlungsgesetz 27.01.2025 (Eintragungsdatum)\n\nMüller-Wrede Rechtsanwälte PartGmbB\nPartnerschaftsgesellschaft\nBerlin\n\nZu Eintragungsnummer 7 vom 27.01.2025 wird als nicht eingetragen veröffentlicht: Den Gläubigern der an der Verschmelzung beteiligten Rechtsträger ist, wenn sie binnen sechs Monaten nach dem Tag, an dem die Eintragung der Verschmelzung in das Register des Sitzes desjenigen Rechtsträgers, dessen Gläubiger sie sind, als bekannt gemacht gilt, ihren Anspruch nach Grund und Höhe schriftlich anmelden, Sicherheit zu leisten, soweit sie nicht Befriedigung verlangen können. Dieses Recht steht den Gläubigern jedoch nur zu, wenn sie glaubhaft machen, dass durch die Verschmelzung die Erfüllung ihrer Forderung gefährdet wird. Das Recht, Sicherheitsleistung zu verlangen, steht Gläubigern nicht zu, die im Falle der Insolvenz ein Recht auf vorzugsweise Befriedigung aus einer Deckungsmasse haben, die nach gesetzlicher Vorschrift zu ihrem Schutz errichtet und staatlich überwacht ist."
    },
    {
      "date": "2025-01-30",
      "id": "100014",
      "original_text": "Sonstige Registerbekanntmachung\nBerlin Amtsgericht Berlin (Charlottenburg) HRB 252891\nForto SE – Berlin",
      "type": "Sonstige Registerbekanntmachung",
      "state": "Berlin",
      "amtsgericht": "Amtsgericht Berlin (Charlottenburg)",
      "registernummer": "HRB 252891",
      "registerart": "HRB",
      "company_name": "Forto SE",
      "company_seat": "Berlin",
      "details": "30.01.2025 (Bekanntmachungsdatum)\n\nBerlin Amtsgericht Berlin (Charlottenburg) HRB 252891\nSonstige Registerbekanntmachung\n\nForto SE\nEuropäische Aktiengesellschaft (SE)\nBerlin\n\nAls nicht eingetragen wird veröffentlicht:\nEs wurde eine neue Liste der Aufsichtsratsmitglieder eingereicht (§ 106 AktG)."
    },
    {
      "date": "2025-01-30",
      "id": "100015",
      "original_text": "Registerbekanntmachung nach dem Umwandlungsgesetz\nBerlin Amtsgericht Berlin (Charlottenburg) HRA 63865\nPR-Coffee-Company OHG – Berlin",
      "type": "Registerbekanntmachung nach dem Umwandlungsgesetz",
      "state": "Berlin",
      "amtsgericht": "Amtsgericht Berlin (Charlottenburg)",
      "registernummer": "HRA 63865",
      "registerart": "HRA",
      "company_name": "PR-Coffee-Company OHG",
      "company_seat": "Berlin",
      "details": "30.01.2025 (Bekanntmachungsdatum)\n\nBerlin Amtsgericht Berlin (Charlottenburg) HRA 63865\nRegisterbekanntmachung nach dem Umwandlungsgesetz 27.01.2025 (Eintragungsdatum)\n\nPR-Coffee-Company OHG\nOffene Handelsgesellschaft\nBerlin\n\nZu Eintragungsnummer 1 vom 27.01.2025 wird als nicht eingetragen veröffentlicht:Den Gläubigern ist, wenn sie binnen sechs Monaten nach dem Tag, an dem die Eintragung der Umwandlung als bekannt gemacht gilt, ihren Anspruch nach Grund und Höhe schriftlich anmelden, Sicherheit zu leisten, soweit sie nicht Befriedigung verlangen können. Dieses Recht steht den Gläubigern jedoch nur zu, wenn sie glaubhaft machen, dass durch die Umwandlung die Erfüllung ihrer Forderung gefährdet wird. Das Recht, Sicherheitsleistung zu verlangen, steht Gläubigern nicht zu, die im Falle der Insolvenz ein Recht auf vorzugsweise Befriedigung aus einer Deckungsmasse haben, die nach gesetzlicher Vorschrift zu ihrem Schutz errichtet und staatlich überwacht ist."
    },
    {
      "date": "2025-01-30",
      "id": "100016",
      "original_text": "Löschungsankündigung\nBerlin Amtsgericht Berlin (Charlottenburg) HRA 50778\nDoppel D Gastro GmbH & Co. KG – Berlin",
      "type": "Löschungsankündigung",
      "state": "Berlin",
      "amtsgericht": "Amtsgericht Berlin (Charlottenburg)",
      "registernummer": "HRA 50778",
      "registerart": "HRA",
      "company_name": "Doppel D Gastro GmbH & Co. KG",
      "company_seat": "Berlin",
      "details": "30.01.2025 (Bekanntmachungsdatum)\n\nBerlin Amtsgericht Berlin (Charlottenburg) HRA 50778\nLöschungsankündigung\n\nDoppel D Gastro GmbH & Co. KG\nKommanditgesellschaft\nBerlin\n\nBei dem nachstehenden Unternehmen / der nachstehenden Gesellschaft wird das Amtslöschungsverfahren gemäß § 31 Abs. 2 HGB eingeleitet. Widerspruchsfrist 1 Monat"
    },
    {
      "date": "2025-01-30",
      "id": "100017",
      "original_text": "Registerbekanntmachung nach dem Umwandlungsgesetz\nBerlin Amtsgericht Berlin (Charlottenburg) HRB 271651\nWCM Handelsmärkte XVI GmbH – Berlin",
      "type": "Registerbekanntmachung nach dem Umwandlungsgesetz",
      "state": "Berlin",
      "amtsgericht": "Amtsgericht Berlin (Charlottenburg)",
      "registernummer": "HRB 271651",
      "registerart": "HRB",
      "company_name": "WCM Handelsmärkte XVI GmbH",
      "company_seat": "Berlin",
      "details": "30.01.2025 (Bekanntmachungsdatum)\n\nBerlin Amtsgericht Berlin (Charlottenburg) HRB 271651\nRegisterbekanntmachung nach dem Umwandlungsgesetz 29.01.2025 (Eintragungsdatum)\n\nWCM Handelsmärkte XVI GmbH\nGesellschaft mit beschränkter Haftung\nBerlin\n\nZu Eintragungsnummer 1 vom 29.01.2025 wird als nicht eingetragen veröffentlicht: Den Gläubigern ist, wenn sie binnen sechs Monaten nach dem Tag, an dem die Eintragung der Umwandlung als bekannt gemacht gilt, ihren Anspruch nach Grund und Höhe schriftlich anmelden, Sicherheit zu leisten, soweit sie nicht Befriedigung verlangen können. Dieses Recht steht den Gläubigern jedoch nur zu, wenn sie glaubhaft machen, dass durch die Umwandlung die Erfüllung ihrer Forderung gefährdet wird. Das Recht, Sicherheitsleistung zu verlangen, steht Gläubigern nicht zu, die im Falle der Insolvenz ein Recht auf vorzugsweise Befriedigung aus einer Deckungsmasse haben, die nach gesetzlicher Vorschrift zu ihrem Schutz errichtet und staatlich überwacht ist."
    },
    {
      "date": "2025-01-30",
      "id": "100018",
      "original_text": "Sonstige Registerbekanntmachung\nBaden-Württemberg Amtsgericht Ulm HRB 650449\nErpo Möbelwerk GmbH – Ertingen",
      "type": "Sonstige Registerbekanntmachung",
      "state": "Baden-Württemberg",
      "amtsgericht": "Amtsgericht Ulm",
      "registernummer": "HRB 650449",
      "registerart": "HRB",
      "company_name": "Erpo Möbelwerk GmbH",
      "company_seat": "Ertingen",
      "details": "30.01.2025 (Bekanntmachungsdatum)\n\nBaden-Württemberg Amtsgericht Ulm HRB 650449\nSonstige Registerbekanntmachung 30.01.2025 (Eintragungsdatum)\n\nErpo Möbelwerk GmbH\nGesellschaft mit beschränkter Haftung\nErtingen\n\nAls nicht eingetragen wird bekanntgemacht:\nDen Gläubigern der Gesellschaft, deren Forderungen begründet worden sind, bevor die Eintragung der Beendigung des Vertrages in das Handelsregister nach § 10 HGB als bekanntgemacht gilt, ist vom anderen Vertragsteil Sicherheit zu leisten, wenn sie sich binnen sechs Monaten nach der Bekanntmachung zu diesem Zweck bei ihm melden."
    },
    {
      "date": "2025-01-30",
      "id": "100019",
      "original_text": "Einreichung neuer Dokumente\nBaden-Württemberg Amtsgericht Stuttgart HRB 20834\nBF.direkt AG – Stuttgart",
      "type": "Einreichung neuer Dokumente",
      "state": "Baden-Württemberg",
      "amtsgericht": "Amtsgericht Stuttgart",
      "registernummer": "HRB 20834",
      "registerart": "HRB",
      "company_name": "BF.direkt AG",
      "company_seat": "Stuttgart",
      "details": "30.01.2025 (Bekanntmachungsdatum)\n\nBaden-Württemberg Amtsgericht Stuttgart HRB 20834\nEinreichung neuer Dokumente\n\nBF.direkt AG\nAktiengesellschaft\nStuttgart\n\nDie Gesellschaft hat am 29.01.2025 die Liste über die Zusammensetzung des Aufsichtsrats zum Handelsregister eingereicht."
    },
    {
      "date": "2025-01-30",
      "id": "100020",
      "original_text": "Löschungsankündigung\nBaden-Württemberg Amtsgericht Stuttgart HRB 744766\nPerfekt Putz UG (haftungsbeschränkt) – Remseck am Neckar",
      "type": "Löschungsankündigung",
      "state": "Baden-Württemberg",
      "amtsgericht": "Amtsgericht Stuttgart",
      "registernummer": "HRB 744766",
      "registerart": "HRB",
      "company_name": "Perfekt Putz UG (haftungsbeschränkt)",
      "company_seat": "Remseck am Neckar",
      "details": "30.01.2025 (Bekanntmachungsdatum)\n\nBaden-Württemberg Amtsgericht Stuttgart HRB 744766\nLöschungsankündigung\n\nPerfekt Putz UG (haftungsbeschränkt)\nGesellschaft mit beschränkter Haftung\nRemseck am Neckar\n\nDas Gericht beabsichtigt, die Gesellschaft wegen Vermögenslosigkeit im Handelsregister von Amts wegen nach § 394 FamFG zu löschen. Die Frist zur Geltendmachung eines Widerspruchs gegen die beabsichtigte Löschung ist auf zwei Monate ab Veröffentlichung bestimmt."
    },
    {
      "date": "2025-01-30",
      "id": "100021",
      "original_text": "Registerbekanntmachung nach dem Umwandlungsgesetz\nSchleswig-Holstein Amtsgericht Kiel HRA 133 RD\nHeinrich Brandt Stahlbeton- und Tiefbau GmbH & Co. KG – Westerrönfeld",
      "type": "Registerbekanntmachung nach dem Umwandlungsgesetz",
      "state": "Schleswig-Holstein",
      "amtsgericht": "Amtsgericht Kiel",
      "registernummer": "HRA 133 RD",
      "registerart": "HRA",
      "company_name": "Heinrich Brandt Stahlbeton- und Tiefbau GmbH & Co. KG",
      "company_seat": "Westerrönfeld",
      "details": "30.01.2025 (Bekanntmachungsdatum)\n\nSchleswig-Holstein Amtsgericht Kiel HRA 133 RD\nRegisterbekanntmachung nach dem Umwandlungsgesetz 29.01.2025 (Eintragungsdatum)\n\nHeinrich Brandt Stahlbeton- und Tiefbau GmbH & Co. KG\nKommanditgesellschaft\nWesterrönfeld\n\nZu Eintragungsnummer 8 vom 29.01.2025 wird als nicht eingetragen veröffentlicht: Den Gläubigern der an der Verschmelzung beteiligten Rechtsträger ist, wenn sie binnen sechs Monaten nach dem Tag, an dem die Eintragung der Verschmelzung in das Register des Sitzes desjenigen Rechtsträgers, dessen Gläubiger sie sind, nach § 19 Abs. 3 UmwG bekannt gemacht worden ist, ihren Anspruch nach Grund und Höhe schriftlich anmelden, Sicherheit zu leisten, soweit sie nicht Befriedigung verlangen können. Dieses Recht steht den Gläubigern jedoch nur zu, wenn sie glaubhaft machen, dass durch die Verschmelzung die Erfüllung ihrer Forderung gefährdet wird."
    },
    {
      "date": "2025-01-30",
      "id": "100022",
      "original_text": "Registerbekanntmachung nach dem Umwandlungsgesetz\nNordrhein-Westfalen Amtsgericht Coesfeld VR 1414\nParitätischer Förderverein für soziale Arbeit in den Kreisen Borken und Coesfeld e.V. – Ahaus",
      "type": "Registerbekanntmachung nach dem Umwandlungsgesetz",
      "state": "Nordrhein-Westfalen",
      "amtsgericht": "Amtsgericht Coesfeld",
      "registernummer": "VR 1414",
      "registerart": "VR",
      "company_name": "Paritätischer Förderverein für soziale Arbeit in den Kreisen Borken und Coesfeld e.V.",
      "company_seat": "Ahaus",
      "details": "30.01.2025 (Bekanntmachungsdatum)\n\nNordrhein-Westfalen Amtsgericht Coesfeld VR 1414\nRegisterbekanntmachung nach dem Umwandlungsgesetz 24.01.2025 (Eintragungsdatum)\n\nParitätischer Förderverein für soziale Arbeit in den Kreisen Borken und Coesfeld e.V.\n???Global.Rechtsform.???\nAhaus\n\nAls nicht eingetragen wird bekanntgemacht: Den Gläubigern der an der Verschmelzung beteiligten Rechtsträger ist, wenn sie binnen sechs Monaten nach dem Tag, an dem die Eintragung der Verschmelzung in das Register des Sitzes derjenigen Rechtsträger deren Gläubiger sie sind, nach § 19 Absatz 3 UmwG als bekanntgemacht gilt, ihren Anspruch nach Grund und Höhe schriftlich anmelden, Sicherheit zu leisten, soweit sie nicht Befriedigung verlangen können. Dieses Recht steht den Gläubigern jedoch nur zu, wenn sie glaubhaft machen, dass durch die Verschmelzung die Erfüllung ihrer Forderung gefährdet wird. Das Recht, Sicherheitsleistung zu verlangen, steht Gläubigern nicht zu, die im Fall des Insolvenzverfahrens ein Recht auf vorzugsweise Befriedigung aus einer Deckungsmasse haben, die nach gesetzlicher Vorschrift zu ihrem Schutz errichtet und staatlich überwacht ist."
    },
    {
      "date": "2025-01-30",
      "id": "100023",
      "original_text": "Löschungsankündigung\nBerlin Amtsgericht Berlin (Charlottenburg) HRB 212799\nAK SCHORNI UG (haftungsbeschränkt) – Berlin",
      "type": "Löschungsankündigung",
      "state": "Berlin",
      "amtsgericht": "Amtsgericht Berlin (Charlottenburg)",
      "registernummer": "HRB 212799",
      "registerart": "HRB",
      "company_name": "AK SCHORNI UG (haftungsbeschränkt)",
      "company_seat": "Berlin",
      "details": "30.01.2025 (Bekanntmachungsdatum)\n\nBerlin Amtsgericht Berlin (Charlottenburg) HRB 212799\nLöschungsankündigung\n\nAK SCHORNI UG (haftungsbeschränkt)\nGesellschaft mit beschränkter Haftung\nBerlin\n\nBei der nachstehenden Gesellschaft wird das Amtslöschungsverfahren gemäß § 394 FamFG eingeleitet. Widerspruchsfrist 6 Wochen"
    },
    {
      "date": "2025-01-30",
      "id": "100024",
      "original_text": "Löschungsankündigung\nBerlin Amtsgericht Berlin (Charlottenburg) HRB 151797\nChronos Consulting GmbH – Berlin",
      "type": "Löschungsankündigung",
      "state": "Berlin",
      "amtsgericht": "Amtsgericht Berlin (Charlottenburg)",
      "registernummer": "HRB 151797",
      "registerart": "HRB",
      "company_name": "Chronos Consulting GmbH",
      "company_seat": "Berlin",
      "details": "30.01.2025 (Bekanntmachungsdatum)\n\nBerlin Amtsgericht Berlin (Charlottenburg) HRB 151797\nLöschungsankündigung\n\nChronos Consulting GmbH\nGesellschaft mit beschränkter Haftung\nBerlin\n\nBei der nachstehenden Gesellschaft wird das Amtslöschungsverfahren gemäß § 394 FamFG eingeleitet. Widerspruchsfrist 6 Wochen"
    },
    {
      "date": "2025-01-30",
      "id": "100025",
      "original_text": "Löschungsankündigung\nBerlin Amtsgericht Berlin (Charlottenburg) HRB 121404\nTEG-Berlin GmbH, Tanz-, Erlebnis- und Freizeitgastronomie – Berlin",
      "type": "Löschungsankündigung",
      "state": "Berlin",
      "amtsgericht": "Amtsgericht Berlin (Charlottenburg)",
      "registernummer": "HRB 121404",
      "registerart": "HRB",
      "company_name": "TEG-Berlin GmbH, Tanz-, Erlebnis- und Freizeitgastronomie",
      "company_seat": "Berlin",
      "details": "30.01.2025 (Bekanntmachungsdatum)\n\nBerlin Amtsgericht Berlin (Charlottenburg) HRB 121404\nLöschungsankündigung\n\nTEG-Berlin GmbH, Tanz-, Erlebnis- und Freizeitgastronomie\nGesellschaft mit beschränkter Haftung\nBerlin\n\nBei der nachstehenden Gesellschaft wird das Amtslöschungsverfahren gemäß § 394 FamFG eingeleitet. Widerspruchsfrist 6 Wochen"
    },
    {
      "date": "2025-01-30",
      "id": "100026",
      "original_text": "Registerbekanntmachung nach dem Umwandlungsgesetz\nBaden-Württemberg Amtsgericht Stuttgart HRB 742392\nSpiegel Institut Stuttgart GmbH – Sindelfingen",
      "type": "Registerbekanntmachung nach dem Umwandlungsgesetz",
      "state": "Baden-Württemberg",
      "amtsgericht": "Amtsgericht Stuttgart",
      "registernummer": "HRB 742392",
      "registerart": "HRB",
      "company_name": "Spiegel Institut Stuttgart GmbH",
      "company_seat": "Sindelfingen",
      "details": "30.01.2025 (Bekanntmachungsdatum)\n\nBaden-Württemberg Amtsgericht Stuttgart HRB 742392\nRegisterbekanntmachung nach dem Umwandlungsgesetz 30.01.2025 (Eintragungsdatum)\n\nSpiegel Institut Stuttgart GmbH\nGesellschaft mit beschränkter Haftung\nSindelfingen\n\nAls nicht eingetragen wird bekanntgemacht:\nDen Gläubigern der an der Verschmelzung beteiligten Rechtsträger ist, wenn sie binnen sechs Monaten nach dem Tag, an dem die Eintragung der Verschmelzung in das Register des Sitzes desjenigen Rechtsträgers, dessen Gläubiger sie sind, nach § 19 Abs. 3 UmwG als bekanntgemacht gilt, ihren Anspruch nach Grund und Höhe schriftlich anmelden, Sicherheit zu leisten, soweit sie nicht Befriedigung verlangen können. Dieses Recht steht den Gläubigern jedoch nur zu, wenn sie glaubhaft machen, dass durch die Verschmelzung die Erfüllung ihrer Forderung gefährdet wird."
    },
    {
      "date": "2025-01-30",
      "id": "100027",
      "original_text": "Sonstige Registerbekanntmachung\nBerlin Amtsgericht Berlin (Charlottenburg) HRB 211883\nPIN AG – Berlin",
      "type": "Sonstige Registerbekanntmachung",
      "state": "Berlin",
      "amtsgericht": "Amtsgericht Berlin (Charlottenburg)",
      "registernummer": "HRB 211883",
      "registerart": "HRB",
      "company_name": "PIN AG",
      "company_seat": "Berlin",
      "details": "30.01.2025 (Bekanntmachungsdatum)\n\nBerlin Amtsgericht Berlin (Charlottenburg) HRB 211883\nSonstige Registerbekanntmachung\n\nPIN AG\nAktiengesellschaft\nBerlin\n\nAls nicht eingetragen wird veröffentlicht:Es wurde eine neue Liste der Aufsichtsratsmitglieder eingereicht (§ 106 AktG)."
    },
    {
      "date": "2025-01-30",
      "id": "100028",
      "original_text": "Registerbekanntmachung nach dem Umwandlungsgesetz\nBaden-Württemberg Amtsgericht Ulm HRB 721364\nBirke Verwaltung GmbH – Allmendingen",
      "type": "Registerbekanntmachung nach dem Umwandlungsgesetz",
      "state": "Baden-Württemberg",
      "amtsgericht": "Amtsgericht Ulm",
      "registernummer": "HRB 721364",
      "registerart": "HRB",
      "company_name": "Birke Verwaltung GmbH",
      "company_seat": "Allmendingen",
      "details": "30.01.2025 (Bekanntmachungsdatum)\n\nBaden-Württemberg Amtsgericht Ulm HRB 721364\nRegisterbekanntmachung nach dem Umwandlungsgesetz 30.01.2025 (Eintragungsdatum)\n\nBirke Verwaltung GmbH\nGesellschaft mit beschränkter Haftung\nAllmendingen\n\nAls nicht eingetragen wird bekanntgemacht:\nDen Gläubigern der an der Verschmelzung beteiligten Rechtsträger ist, wenn sie binnen sechs Monaten nach dem Tag, an dem die Eintragung der Verschmelzung in das Register des Sitzes desjenigen Rechtsträgers, dessen Gläubiger sie sind, nach § 19 Abs. 3 UmwG als bekanntgemacht gilt, ihren Anspruch nach Grund und Höhe schriftlich anmelden, Sicherheit zu leisten, soweit sie nicht Befriedigung verlangen können. Dieses Recht steht den Gläubigern jedoch nur zu, wenn sie glaubhaft machen, dass durch die Verschmelzung die Erfüllung ihrer Forderung gefährdet wird."
    },
    {
      "date": "2025-01-30",
      "id": "100029",
      "original_text": "Löschungsankündigung\nBerlin Amtsgericht Berlin (Charlottenburg) HRB 133774\nOlymp Zimmervermietung UG (haftungsbeschränkt) – Berlin",
      "type": "Löschungsankündigung",
      "state": "Berlin",
      "amtsgericht": "Amtsgericht Berlin (Charlottenburg)",
      "registernummer": "HRB 133774",
      "registerart": "HRB",
      "company_name": "Olymp Zimmervermietung UG (haftungsbeschränkt)",
      "company_seat": "Berlin",
      "details": "30.01.2025 (Bekanntmachungsdatum)\n\nBerlin Amtsgericht Berlin (Charlottenburg) HRB 133774\nLöschungsankündigung\n\nOlymp Zimmervermietung UG (haftungsbeschränkt)\nGesellschaft mit beschränkter Haftung\nBerlin\n\nBei der nachstehenden Gesellschaft wird das Amtslöschungsverfahren gemäß § 394 FamFG eingeleitet. Widerspruchsfrist 6 Wochen"
    },
    {
      "date": "2025-01-30",
      "id": "100030",
      "original_text": "Registerbekanntmachung nach dem Umwandlungsgesetz\nBaden-Württemberg Amtsgericht Ulm HRB 727429\nBirke 2 Verwaltungs GmbH – Allmendingen",
      "type": "Registerbekanntmachung nach dem Umwandlungsgesetz",
      "state": "Baden-Württemberg",
      "amtsgericht": "Amtsgericht Ulm",
      "registernummer": "HRB 727429",
      "registerart": "HRB",
      "company_name": "Birke 2 Verwaltungs GmbH",
      "company_seat": "Allmendingen",
      "details": "30.01.2025 (Bekanntmachungsdatum)\n\nBaden-Württemberg Amtsgericht Ulm HRB 727429\nRegisterbekanntmachung nach dem Umwandlungsgesetz 30.01.2025 (Eintragungsdatum)\n\nBirke 2 Verwaltungs GmbH\nGesellschaft mit beschränkter Haftung\nAllmendingen\n\nAls nicht eingetragen wird bekanntgemacht:\nDen Gläubigern der an der Verschmelzung beteiligten Rechtsträger ist, wenn sie binnen sechs Monaten nach dem Tag, an dem die Eintragung der Verschmelzung in das Register des Sitzes desjenigen Rechtsträgers, dessen Gläubiger sie sind, nach § 19 Abs. 3 UmwG als bekanntgemacht gilt, ihren Anspruch nach Grund und Höhe schriftlich anmelden, Sicherheit zu leisten, soweit sie nicht Befriedigung verlangen können. Dieses Recht steht den Gläubigern jedoch nur zu, wenn sie glaubhaft machen, dass durch die Verschmelzung die Erfüllung ihrer Forderung gefährdet wird."
    },
    {
      "date": "2025-01-30",
      "id": "100031",
      "original_text": "Registerbekanntmachung nach dem Umwandlungsgesetz\nBaden-Württemberg Amtsgericht Freiburg HRB 714388\nGeospin GmbH – Freiburg im Breisgau",
      "type": "Registerbekanntmachung nach dem Umwandlungsgesetz",
      "state": "Baden-Württemberg",
      "amtsgericht": "Amtsgericht Freiburg",
      "registernummer": "HRB 714388",
      "registerart": "HRB",
      "company_name": "Geospin GmbH",
      "company_seat": "Freiburg im Breisgau",
      "details": "30.01.2025 (Bekanntmachungsdatum)\n\nBaden-Württemberg Amtsgericht Freiburg HRB 714388\nRegisterbekanntmachung nach dem Umwandlungsgesetz 30.01.2025 (Eintragungsdatum)\n\nGeospin GmbH\nGesellschaft mit beschränkter Haftung\nFreiburg im Breisgau\n\nAls nicht eingetragen wird bekanntgemacht:\nDen Gläubigern der an der Verschmelzung beteiligten Rechtsträger ist, wenn sie binnen sechs Monaten nach dem Tag, an dem die Eintragung der Verschmelzung in das Register des Sitzes desjenigen Rechtsträgers, dessen Gläubiger sie sind, nach § 19 Abs. 3 UmwG als bekanntgemacht gilt, ihren Anspruch nach Grund und Höhe schriftlich anmelden, Sicherheit zu leisten, soweit sie nicht Befriedigung verlangen können. Dieses Recht steht den Gläubigern jedoch nur zu, wenn sie glaubhaft machen, dass durch die Verschmelzung die Erfüllung ihrer Forderung gefährdet wird."
    },
    {
      "date": "2025-01-30",
      "id": "100032",
      "original_text": "Registerbekanntmachung nach dem Umwandlungsgesetz\nMecklenburg-Vorpommern Amtsgericht Rostock HRB 15612\nGreentech GmbH – Rostock",
      "type": "Registerbekanntmachung nach dem Umwandlungsgesetz",
      "state": "Mecklenburg-Vorpommern",
      "amtsgericht": "Amtsgericht Rostock",
      "registernummer": "HRB 15612",
      "registerart": "HRB",
      "company_name": "Greentech GmbH",
      "company_seat": "Rostock",
      "details": "30.01.2025 (Bekanntmachungsdatum)\n\nMecklenburg-Vorpommern Amtsgericht Rostock HRB 15612\nRegisterbekanntmachung nach dem Umwandlungsgesetz 30.01.2025 (Eintragungsdatum)\n\nGreentech GmbH\nGesellschaft mit beschränkter Haftung\nRostock\n\nDen Gläubigern der an der Verschmelzung beteiligten Rechtsträger ist, wenn sie binnen sechs Monaten nach dem Tag, an dem die Eintragung der Verschmelzung in das Register des Sitzes desjenigen Rechtsträgers, dessen Gläubiger sie sind, nach § 19 Abs. 3 UmwG als bekannt gemacht gilt, ihren Anspruch nach Grund und Höhe in Textform anmelden, Sicherheit zu leisten, soweit sie nicht Befriedigung verlangen können. Dieses Recht steht den Gläubigern jedoch nur zu, wenn sie glaubhaft machen, dass durch die Verschmelzung die Erfüllung der Forderung gefährdet wird."
    },
    {
      "date": "2025-01-30",
      "id": "100033",
      "original_text": "Einreichung neuer Dokumente\nBaden-Württemberg Amtsgericht Stuttgart HRB 107207\nHeilbronn Marketing GmbH – Heilbronn",
      "type": "Einreichung neuer Dokumente",
      "state": "Baden-Württemberg",
      "amtsgericht": "Amtsgericht Stuttgart",
      "registernummer": "HRB 107207",
      "registerart": "HRB",
      "company_name": "Heilbronn Marketing GmbH",
      "company_seat": "Heilbronn",
      "details": "30.01.2025 (Bekanntmachungsdatum)\n\nBaden-Württemberg Amtsgericht Stuttgart HRB 107207\nEinreichung neuer Dokumente\n\nHeilbronn Marketing GmbH\nGesellschaft mit beschränkter Haftung\nHeilbronn\n\nDie Gesellschaft hat am 30.01.2025 die Liste über die Zusammensetzung des Aufsichtsrats zum Handelsregister eingereicht."
    },
    {
      "date": "2025-01-30",
      "id": "100034",
      "original_text": "Löschungsankündigung\nBerlin Amtsgericht Berlin (Charlottenburg) HRB 156179\nEula Bau GmbH – Berlin",
      "type": "Löschungsankündigung",
      "state": "Berlin",
      "amtsgericht": "Amtsgericht Berlin (Charlottenburg)",
      "registernummer": "HRB 156179",
      "registerart": "HRB",
      "company_name": "Eula Bau GmbH",
      "company_seat": "Berlin",
      "details": "30.01.2025 (Bekanntmachungsdatum)\n\nBerlin Amtsgericht Berlin (Charlottenburg) HRB 156179\nLöschungsankündigung\n\nEula Bau GmbH\nGesellschaft mit beschränkter Haftung\nBerlin\n\nBei der nachstehenden Gesellschaft wird das Amtslöschungsverfahren gemäß § 394 FamFG eingeleitet. Widerspruchsfrist 6 Wochen"
    },
    {
      "date": "2025-01-30",
      "id": "100035",
      "original_text": "Einreichung neuer Dokumente\nSaarland Amtsgericht Saarbrücken HRB 100111\nKnappschaft Kliniken Saar GmbH – Püttlingen",
      "type": "Einreichung neuer Dokumente",
      "state": "Saarland",
      "amtsgericht": "Amtsgericht Saarbrücken",
      "registernummer": "HRB 100111",
      "registerart": "HRB",
      "company_name": "Knappschaft Kliniken Saar GmbH",
      "company_seat": "Püttlingen",
      "details": "30.01.2025 (Bekanntmachungsdatum)\n\nSaarland Amtsgericht Saarbrücken HRB 100111\nEinreichung neuer Dokumente 30.01.2025 (Eintragungsdatum)\n\nKnappschaft Kliniken Saar GmbH\nGesellschaft mit beschränkter Haftung\nPüttlingen\n\nDie Geschäftsführung der Gesellschaft hat eine Liste der Mitglieder des Aufsichtsrats zum Handelsregister eingereicht (§ 52 Abs. 3 Satz 2 GmbHG)."
    },
    {
      "date": "2025-01-30",
      "id": "100036",
      "original_text": "Löschungsankündigung\nBerlin Amtsgericht Berlin (Charlottenburg) HRB 22829\nIngenieurgesellschaft Kurfürstenstraße 79 mbH – Berlin",
      "type": "Löschungsankündigung",
      "state": "Berlin",
      "amtsgericht": "Amtsgericht Berlin (Charlottenburg)",
      "registernummer": "HRB 22829",
      "registerart": "HRB",
      "company_name": "Ingenieurgesellschaft Kurfürstenstraße 79 mbH",
      "company_seat": "Berlin",
      "details": "30.01.2025 (Bekanntmachungsdatum)\n\nBerlin Amtsgericht Berlin (Charlottenburg) HRB 22829\nLöschungsankündigung\n\nIngenieurgesellschaft Kurfürstenstraße 79 mbH\nGesellschaft mit beschränkter Haftung\nBerlin\n\nBei der nachstehenden Gesellschaft wird das Amtslöschungsverfahren gemäß § 394 FamFG eingeleitet. Widerspruchsfrist 6 Wochen"
    },
    {
      "date": "2025-01-30",
      "id": "100037",
      "original_text": "Registerbekanntmachung nach dem Umwandlungsgesetz\nBerlin Amtsgericht Berlin (Charlottenburg) HRA 63787\nWelter Facility Management e. K. – Beriln",
      "type": "Registerbekanntmachung nach dem Umwandlungsgesetz",
      "state": "Berlin",
      "amtsgericht": "Amtsgericht Berlin (Charlottenburg)",
      "registernummer": "HRA 63787",
      "registerart": "HRA",
      "company_name": "Welter Facility Management e. K.",
      "company_seat": "Beriln",
      "details": "30.01.2025 (Bekanntmachungsdatum)\n\nBerlin Amtsgericht Berlin (Charlottenburg) HRA 63787\nRegisterbekanntmachung nach dem Umwandlungsgesetz 29.01.2025 (Eintragungsdatum)\n\nWelter Facility Management e. K.\nEinzelkaufmann / Einzelkauffrau\nBeriln\n\nZu Eintragungsnummer 2 vom 29.01.2025 wird als nicht eingetragen veröffentlicht: Den Gläubigern der an der Spaltung beteiligten Rechtsträger ist, wenn sie binnen sechs Monaten nach dem Tag, an dem die Eintragung der Spaltung in das Register des Sitzes desjenigen Rechtsträgers, dessen Gläubiger sie sind, als bekannt gemacht gilt, ihren Anspruch nach Grund und Höhe schriftlich anmelden, Sicherheit zu leisten, soweit sie nicht Befriedigung verlangen können. Dieses Recht steht den Gläubigern jedoch nur zu, wenn sie glaubhaft machen, dass durch die Spaltung die Erfüllung ihrer Forderung gefährdet wird. Das Recht, Sicherheitsleistung zu verlangen, steht Gläubigern nicht zu, die im Falle der Insolvenz ein Recht auf vorzugsweise Befriedigung aus einer Deckungsmasse haben, die nach gesetzlicher Vorschrift zu ihrem Schutz errichtet und staatlich überwacht ist."
    },
    {
      "date": "2025-01-30",
      "id": "100038",
      "original_text": "Löschungsankündigung\nBaden-Württemberg Amtsgericht Stuttgart HRB 767915\nFP Business GmbH – Balingen",
      "type": "Löschungsankündigung",
      "state": "Baden-Württemberg",
      "amtsgericht": "Amtsgericht Stuttgart",
      "registernummer": "HRB 767915",
      "registerart": "HRB",
      "company_name": "FP Business GmbH",
      "company_seat": "Balingen",
      "details": "30.01.2025 (Bekanntmachungsdatum)\n\nBaden-Württemberg Amtsgericht Stuttgart HRB 767915\nLöschungsankündigung\n\nFP Business GmbH\nGesellschaft mit beschränkter Haftung\nBalingen\n\nAls nicht eingetragen wird bekanntgemacht:\nDas Gericht beabsichtigt, die Gesellschaft wegen Vermögenslosigkeit im Handelsregister von Amts wegen nach § 394 FamFG zu löschen. Die Frist zur Geltendmachung eines Widerspruchs gegen die beabsichtigte Löschung ist auf zwei Monate ab Veröffentlichung bestimmt."
    },
    {
      "date": "2025-01-30",
      "id": "100039",
      "original_text": "Einreichung neuer Dokumente\nThüringen Amtsgericht Jena HRB 112844\nDeutsches Nationaltheater und Staatskapelle Weimar Gesellschaft mit beschränkter Haftung - Staatstheater Thüringen - – Weimar",
      "type": "Einreichung neuer Dokumente",
      "state": "Thüringen",
      "amtsgericht": "Amtsgericht Jena",
      "registernummer": "HRB 112844",
      "registerart": "HRB",
      "company_name": "Deutsches Nationaltheater und Staatskapelle Weimar Gesellschaft mit beschränkter Haftung - Staatstheater Thüringen -",
      "company_seat": "Weimar",
      "details": "30.01.2025 (Bekanntmachungsdatum)\n\nThüringen Amtsgericht Jena HRB 112844\nEinreichung neuer Dokumente 09.12.2024 (Eintragungsdatum)\n\nDeutsches Nationaltheater und Staatskapelle Weimar Gesellschaft mit beschränkter Haftung - Staatstheater Thüringen -\nGesellschaft mit beschränkter Haftung\nWeimar\n\nBekanntmachung gem. § 52 Abs. 3 Satz 2 GmbHG: Aufgrund einer Veränderung in den Personen der Aufsichtsratsmitglieder ist durch die Geschäftsführer eine neue Liste zum Handelsregister eingereicht worden."
    },
    {
      "date": "2025-01-30",
      "id": "100040",
      "original_text": "Einreichung neuer Dokumente\nHamburg Amtsgericht Hamburg HRB 59437\nHafenCity Hamburg GmbH – Hamburg",
      "type": "Einreichung neuer Dokumente",
      "state": "Hamburg",
      "amtsgericht": "Amtsgericht Hamburg",
      "registernummer": "HRB 59437",
      "registerart": "HRB",
      "company_name": "HafenCity Hamburg GmbH",
      "company_seat": "Hamburg",
      "details": "30.01.2025 (Bekanntmachungsdatum)\n\nHamburg Amtsgericht Hamburg HRB 59437\nEinreichung neuer Dokumente 30.01.2025 (Eintragungsdatum)\n\nHafenCity Hamburg GmbH\nGesellschaft mit beschränkter Haftung\nHamburg\n\nals nicht eingetragen wird bekannt gemacht: Liste des Aufsichtsrats wurde eingereicht."
    },
    {
      "date": "2025-01-30",
      "id": "100041",
      "original_text": "Registerbekanntmachung nach dem Umwandlungsgesetz\nBaden-Württemberg Amtsgericht Ulm HRB 740565\nUBG Ulmer Beteiligungs GmbH – Ulm",
      "type": "Registerbekanntmachung nach dem Umwandlungsgesetz",
      "state": "Baden-Württemberg",
      "amtsgericht": "Amtsgericht Ulm",
      "registernummer": "HRB 740565",
      "registerart": "HRB",
      "company_name": "UBG Ulmer Beteiligungs GmbH",
      "company_seat": "Ulm",
      "details": "30.01.2025 (Bekanntmachungsdatum)\n\nBaden-Württemberg Amtsgericht Ulm HRB 740565\nRegisterbekanntmachung nach dem Umwandlungsgesetz 30.01.2025 (Eintragungsdatum)\n\nUBG Ulmer Beteiligungs GmbH\nGesellschaft mit beschränkter Haftung\nUlm\n\nAls nicht eingetragen wird bekanntgemacht:\nDen Gläubigern der an der Abspaltung beteiligten Rechtsträger ist, wenn sie binnen sechs Monaten nach dem Tag, an dem die Eintragung der Abspaltung in das Register des Sitzes desjenigen Rechtsträgers, dessen Gläubiger sie sind, nach § 19 Abs. 3 UmwG als bekanntgemacht gilt, ihren Anspruch nach Grund und Höhe schriftlich anmelden, Sicherheit zu leisten, soweit sie nicht Befriedigung verlangen können. Dieses Recht steht den Gläubigern jedoch nur zu, wenn sie glaubhaft machen, dass durch die Abspaltung die Erfüllung ihrer Forderung gefährdet wird."
    },
    {
      "date": "2025-01-30",
      "id": "100042",
      "original_text": "Einreichung neuer Dokumente\nBerlin Amtsgericht Berlin (Charlottenburg) HRB 86443\nBerliner Philharmonie gGmbH – Berlin",
      "type": "Einreichung neuer Dokumente",
      "state": "Berlin",
      "amtsgericht": "Amtsgericht Berlin (Charlottenburg)",
      "registernummer": "HRB 86443",
      "registerart": "HRB",
      "company_name": "Berliner Philharmonie gGmbH",
      "company_seat": "Berlin",
      "details": "30.01.2025 (Bekanntmachungsdatum)\n\nBerlin Amtsgericht Berlin (Charlottenburg) HRB 86443\nEinreichung neuer Dokumente\n\nBerliner Philharmonie gGmbH\nGesellschaft mit beschränkter Haftung\nBerlin\n\nAls nicht eingetragen wird veröffentlicht:Es wurde eine neue Liste der Aufsichtsratsmitglieder eingereicht (§52 GmbHG)."
    },
    {
      "date": "2025-01-30",
      "id": "100043",
      "original_text": "Registerbekanntmachung nach dem Umwandlungsgesetz\nBaden-Württemberg Amtsgericht Ulm HRB 725613\nFranz Geiger GmbH – Ulm",
      "type": "Registerbekanntmachung nach dem Umwandlungsgesetz",
      "state": "Baden-Württemberg",
      "amtsgericht": "Amtsgericht Ulm",
      "registernummer": "HRB 725613",
      "registerart": "HRB",
      "company_name": "Franz Geiger GmbH",
      "company_seat": "Ulm",
      "details": "30.01.2025 (Bekanntmachungsdatum)\n\nBaden-Württemberg Amtsgericht Ulm HRB 725613\nRegisterbekanntmachung nach dem Umwandlungsgesetz 30.01.2025 (Eintragungsdatum)\n\nFranz Geiger GmbH\nGesellschaft mit beschränkter Haftung\nUlm\n\nAls nicht eingetragen wird bekanntgemacht:\nDen Gläubigern der an der Abspaltung beteiligten Rechtsträger ist, wenn sie binnen sechs Monaten nach dem Tag, an dem die Eintragung der Abspaltung in das Register des Sitzes desjenigen Rechtsträgers, dessen Gläubiger sie sind, nach § 19 Abs. 3 UmwG als bekanntgemacht gilt, ihren Anspruch nach Grund und Höhe schriftlich anmelden, Sicherheit zu leisten, soweit sie nicht Befriedigung verlangen können. Dieses Recht steht den Gläubigern jedoch nur zu, wenn sie glaubhaft machen, dass durch die Abspaltung die Erfüllung ihrer Forderung gefährdet wird."
    },
    {
      "date": "2025-01-30",
      "id": "100044",
      "original_text": "Sonstige Registerbekanntmachung\nHamburg Amtsgericht Hamburg HRB 113611\nBP Europa SE – Hamburg",
      "type": "Sonstige Registerbekanntmachung",
      "state": "Hamburg",
      "amtsgericht": "Amtsgericht Hamburg",
      "registernummer": "HRB 113611",
      "registerart": "HRB",
      "company_name": "BP Europa SE",
      "company_seat": "Hamburg",
      "details": "30.01.2025 (Bekanntmachungsdatum)\n\nHamburg Amtsgericht Hamburg HRB 113611\nSonstige Registerbekanntmachung 30.01.2025 (Eintragungsdatum)\n\nBP Europa SE\nEuropäische Aktiengesellschaft (SE)\nHamburg\n\nAls nicht eingetragen wird bekannt gemacht: Liste des Aufsichtsrats wurde eingereicht."
    },
    {
      "date": "2025-01-30",
      "id": "100045",
      "original_text": "Registerbekanntmachung nach dem Umwandlungsgesetz\nSchleswig-Holstein Amtsgericht Pinneberg HRB 4277\npluss Personalmanagement Pinneberg GmbH – Pinneberg",
      "type": "Registerbekanntmachung nach dem Umwandlungsgesetz",
      "state": "Schleswig-Holstein",
      "amtsgericht": "Amtsgericht Pinneberg",
      "registernummer": "HRB 4277",
      "registerart": "HRB",
      "company_name": "pluss Personalmanagement Pinneberg GmbH",
      "company_seat": "Pinneberg",
      "details": "30.01.2025 (Bekanntmachungsdatum)\n\nSchleswig-Holstein Amtsgericht Pinneberg HRB 4277\nRegisterbekanntmachung nach dem Umwandlungsgesetz 30.01.2025 (Eintragungsdatum)\n\npluss Personalmanagement Pinneberg GmbH\nGesellschaft mit beschränkter Haftung\nPinneberg\n\nZu Eintragungsnummer 17 vom 30.01.2025 wird als nicht eingetragen veröffentlicht: Als nicht eingetragen wird veröffentlicht: Den Gläubigern der an der Spaltung beteiligten Rechtsträger ist, wenn sie binnen sechs Monaten nach dem Tag, an dem die Eintragung der Spaltung in das Register des Sitzes desjenigen Rechtsträgers, dessen Gläubiger sie sind, als bekannt gemacht gilt, ihren Anspruch nach Grund und Höhe schriftlich anmelden, Sicherheit zu leisten, soweit sie nicht Befriedigung verlangen können. Dieses Recht steht den Gläubigern jedoch nur zu, wenn sie glaubhaft machen, dass durch die Spaltung die Erfüllung ihrer Forderung gefährdet wird. Das Recht, Sicherheitsleistung zu verlangen, steht Gläubigern nicht zu, die im Falle der Insolvenz ein Recht auf vorzugsweise Befriedigung aus einer Deckungsmasse haben, die nach gesetzlicher Vorschrift zu ihrem Schutz errichtet und staatlich überwacht ist."
    },
    {
      "date": "2025-01-30",
      "id": "100046",
      "original_text": "Registerbekanntmachung nach dem Umwandlungsgesetz\nBaden-Württemberg Amtsgericht Ulm HRB 610192\nVerallia Deutschland AG – Bad Wurzach",
      "type": "Registerbekanntmachung nach dem Umwandlungsgesetz",
      "state": "Baden-Württemberg",
      "amtsgericht": "Amtsgericht Ulm",
      "registernummer": "HRB 610192",
      "registerart": "HRB",
      "company_name": "Verallia Deutschland AG",
      "company_seat": "Bad Wurzach",
      "details": "30.01.2025 (Bekanntmachungsdatum)\n\nBaden-Württemberg Amtsgericht Ulm HRB 610192\nRegisterbekanntmachung nach dem Umwandlungsgesetz 30.01.2025 (Eintragungsdatum)\n\nVerallia Deutschland AG\nAktiengesellschaft\nBad Wurzach\n\nAls nicht eingetragen wird bekanntgemacht:\nDen Gläubigern der an der Verschmelzung beteiligten Rechtsträger ist, wenn sie binnen sechs Monaten nach dem Tag, an dem die Eintragung der Verschmelzung in das Register des Sitzes desjenigen Rechtsträgers, dessen Gläubiger sie sind, nach § 19 Abs. 3 UmwG als bekanntgemacht gilt, ihren Anspruch nach Grund und Höhe schriftlich anmelden, Sicherheit zu leisten, soweit sie nicht Befriedigung verlangen können. Dieses Recht steht den Gläubigern jedoch nur zu, wenn sie glaubhaft machen, dass durch die Verschmelzung die Erfüllung ihrer Forderung gefährdet wird."
    },
    {
      "date": "2025-01-30",
      "id": "100047",
      "original_text": "Registerbekanntmachung nach dem Umwandlungsgesetz\nBaden-Württemberg Amtsgericht Ulm HRB 746751\nVerallia Mehrweg GmbH – Bad Wurzach",
      "type": "Registerbekanntmachung nach dem Umwandlungsgesetz",
      "state": "Baden-Württemberg",
      "amtsgericht": "Amtsgericht Ulm",
      "registernummer": "HRB 746751",
      "registerart": "HRB",
      "company_name": "Verallia Mehrweg GmbH",
      "company_seat": "Bad Wurzach",
      "details": "30.01.2025 (Bekanntmachungsdatum)\n\nBaden-Württemberg Amtsgericht Ulm HRB 746751\nRegisterbekanntmachung nach dem Umwandlungsgesetz 30.01.2025 (Eintragungsdatum)\n\nVerallia Mehrweg GmbH\nGesellschaft mit beschränkter Haftung\nBad Wurzach\n\nAls nicht eingetragen wird bekanntgemacht:\nDen Gläubigern der an der Verschmelzung beteiligten Rechtsträger ist, wenn sie binnen sechs Monaten nach dem Tag, an dem die Eintragung der Verschmelzung in das Register des Sitzes desjenigen Rechtsträgers, dessen Gläubiger sie sind, nach § 19 Abs. 3 UmwG als bekanntgemacht gilt, ihren Anspruch nach Grund und Höhe schriftlich anmelden, Sicherheit zu leisten, soweit sie nicht Befriedigung verlangen können. Dieses Recht steht den Gläubigern jedoch nur zu, wenn sie glaubhaft machen, dass durch die Verschmelzung die Erfüllung ihrer Forderung gefährdet wird."
    },
    {
      "date": "2025-01-30",
      "id": "100048",
      "original_text": "Registerbekanntmachung nach dem Umwandlungsgesetz\nBaden-Württemberg Amtsgericht Ulm HRB 725613\nFranz Geiger GmbH – Ulm",
      "type": "Registerbekanntmachung nach dem Umwandlungsgesetz",
      "state": "Baden-Württemberg",
      "amtsgericht": "Amtsgericht Ulm",
      "registernummer": "HRB 725613",
      "registerart": "HRB",
      "company_name": "Franz Geiger GmbH",
      "company_seat": "Ulm",
      "details": "30.01.2025 (Bekanntmachungsdatum)\n\nBaden-Württemberg Amtsgericht Ulm HRB 725613\nRegisterbekanntmachung nach dem Umwandlungsgesetz 30.01.2025 (Eintragungsdatum)\n\nFranz Geiger GmbH\nGesellschaft mit beschränkter Haftung\nUlm\n\nAls nicht eingetragen wird bekanntgemacht:\nDen Gläubigern der an der Abspaltung beteiligten Rechtsträger ist, wenn sie binnen sechs Monaten nach dem Tag, an dem die Eintragung der Abspaltung in das Register des Sitzes desjenigen Rechtsträgers, dessen Gläubiger sie sind, nach § 19 Abs. 3 UmwG als bekanntgemacht gilt, ihren Anspruch nach Grund und Höhe schriftlich anmelden, Sicherheit zu leisten, soweit sie nicht Befriedigung verlangen können. Dieses Recht steht den Gläubigern jedoch nur zu, wenn sie glaubhaft machen, dass durch die Abspaltung die Erfüllung ihrer Forderung gefährdet wird."
    },
    {
      "date": "2025-01-30",
      "id": "100049",
      "original_text": "Einreichung neuer Dokumente\nBaden-Württemberg Amtsgericht Ulm HRB 737130\ndoubleSlash Mitarbeiterbeteiligungs AG – Friedrichshafen",
      "type": "Einreichung neuer Dokumente",
      "state": "Baden-Württemberg",
      "amtsgericht": "Amtsgericht Ulm",
      "registernummer": "HRB 737130",
      "registerart": "HRB",
      "company_name": "doubleSlash Mitarbeiterbeteiligungs AG",
      "company_seat": "Friedrichshafen",
      "details": "30.01.2025 (Bekanntmachungsdatum)\n\nBaden-Württemberg Amtsgericht Ulm HRB 737130\nEinreichung neuer Dokumente\n\ndoubleSlash Mitarbeiterbeteiligungs AG\nAktiengesellschaft\nFriedrichshafen\n\nDie Gesellschaft hat am 29.01.2025 die Liste über die Zusammensetzung des Aufsichtsrats zum Handelsregister eingereicht."
    },
    {
      "date": "2025-01-30",
      "id": "100050",
      "original_text": "Registerbekanntmachung nach dem Umwandlungsgesetz\nBerlin Amtsgericht Berlin (Charlottenburg) HRB 116618\nHIJA Beteiligungs- u. Verwaltungsgesellschaft mbH – Berlin",
      "type": "Registerbekanntmachung nach dem Umwandlungsgesetz",
      "state": "Berlin",
      "amtsgericht": "Amtsgericht Berlin (Charlottenburg)",
      "registernummer": "HRB 116618",
      "registerart": "HRB",
      "company_name": "HIJA Beteiligungs- u. Verwaltungsgesellschaft mbH",
      "company_seat": "Berlin",
      "details": "30.01.2025 (Bekanntmachungsdatum)\n\nBerlin Amtsgericht Berlin (Charlottenburg) HRB 116618\nRegisterbekanntmachung nach dem Umwandlungsgesetz 29.01.2025 (Eintragungsdatum)\n\nHIJA Beteiligungs- u. Verwaltungsgesellschaft mbH\nGesellschaft mit beschränkter Haftung\nBerlin\n\nZu Eintragungsnummer 3 vom 29.01.2025 wird als nicht eingetragen veröffentlicht: Den Gläubigern der an der Verschmelzung beteiligten Rechtsträger ist, wenn sie binnen sechs Monaten nach dem Tag, an dem die Eintragung der Verschmelzung in das Register des Sitzes desjenigen Rechtsträgers, dessen Gläubiger sie sind, als bekannt gemacht gilt, ihren Anspruch nach Grund und Höhe schriftlich anmelden, Sicherheit zu leisten, soweit sie nicht Befriedigung verlangen können. Dieses Recht steht den Gläubigern jedoch nur zu, wenn sie glaubhaft machen, dass durch die Verschmelzung die Erfüllung ihrer Forderung gefährdet wird. Das Recht, Sicherheitsleistung zu verlangen, steht Gläubigern nicht zu, die im Falle der Insolvenz ein Recht auf vorzugsweise Befriedigung aus einer Deckungsmasse haben, die nach gesetzlicher Vorschrift zu ihrem Schutz errichtet und staatlich überwacht ist."
    },
    {
      "date": "2025-01-30",
      "id": "100051",
      "original_text": "Registerbekanntmachung nach dem Umwandlungsgesetz\nBaden-Württemberg Amtsgericht Freiburg HRB 400467\nMultiPart Garantie AG – Ringsheim",
      "type": "Registerbekanntmachung nach dem Umwandlungsgesetz",
      "state": "Baden-Württemberg",
      "amtsgericht": "Amtsgericht Freiburg",
      "registernummer": "HRB 400467",
      "registerart": "HRB",
      "company_name": "MultiPart Garantie AG",
      "company_seat": "Ringsheim",
      "details": "30.01.2025 (Bekanntmachungsdatum)\n\nBaden-Württemberg Amtsgericht Freiburg HRB 400467\nRegisterbekanntmachung nach dem Umwandlungsgesetz 30.01.2025 (Eintragungsdatum)\n\nMultiPart Garantie AG\nAktiengesellschaft\nRingsheim\n\nAls nicht eingetragen wird bekanntgemacht:\nDen Gläubigern des an dem Formwechsel beteiligten Rechtsträgers ist, wenn sie binnen sechs Monaten nach dem Tag, an dem die Eintragung des Formwechsels in das Register des Sitzes desjenigen Rechtsträgers, dessen Gläubiger sie sind, nach § 19 Abs. 3 UmwG als bekanntgemacht gilt, ihren Anspruch nach Grund und Höhe schriftlich anmelden, Sicherheit zu leisten, soweit sie nicht Befriedigung verlangen können. Dieses Recht steht den Gläubigern jedoch nur zu, wenn sie glaubhaft machen, dass durch den Formwechsel die Erfüllung ihrer Forderung gefährdet wird."
    },
    {
      "date": "2025-01-30",
      "id": "100052",
      "original_text": "Löschungsankündigung\nHamburg Amtsgericht Hamburg VR 21778\nAl-Mizan, Verein für islamische Religionsausübung und interkulturellen Dialog Hamburg West, e.V. – Hamburg",
      "type": "Löschungsankündigung",
      "state": "Hamburg",
      "amtsgericht": "Amtsgericht Hamburg",
      "registernummer": "VR 21778",
      "registerart": "VR",
      "company_name": "Al-Mizan, Verein für islamische Religionsausübung und interkulturellen Dialog Hamburg West, e.V.",
      "company_seat": "Hamburg",
      "details": "30.01.2025 (Bekanntmachungsdatum)\n\nHamburg Amtsgericht Hamburg VR 21778\nLöschungsankündigung\n\nAl-Mizan, Verein für islamische Religionsausübung und interkulturellen Dialog Hamburg West, e.V.\neingetragener Verein\nHamburg\n\nDas Registergericht beabsichtigt, den im Vereinsregister eingetragenen Verein von Amts wegen nach § 395 FamFG zu löschen, da nach den angestellten Ermittlungen dieser Verein offenbar nicht mehr besteht. Die Frist zur Erhebung eines Widerspruchs gegen die beabsichtigte Löschung wird auf 3 Monate festgesetzt."
    },
    {
      "date": "2025-01-30",
      "id": "100053",
      "original_text": "Löschungsankündigung\nBerlin Amtsgericht Berlin (Charlottenburg) HRB 223628\nHouse of Vapes Germany GmbH – Berlin",
      "type": "Löschungsankündigung",
      "state": "Berlin",
      "amtsgericht": "Amtsgericht Berlin (Charlottenburg)",
      "registernummer": "HRB 223628",
      "registerart": "HRB",
      "company_name": "House of Vapes Germany GmbH",
      "company_seat": "Berlin",
      "details": "30.01.2025 (Bekanntmachungsdatum)\n\nBerlin Amtsgericht Berlin (Charlottenburg) HRB 223628\nLöschungsankündigung\n\nHouse of Vapes Germany GmbH\nGesellschaft mit beschränkter Haftung\nBerlin\n\nBei der nachstehenden Gesellschaft wird das Amtslöschungsverfahren gemäß § 394 FamFG eingeleitet. Widerspruchsfrist 6 Wochen"
    },
    {
      "date": "2025-01-30",
      "id": "100054",
      "original_text": "Registerbekanntmachung nach dem Umwandlungsgesetz\nBaden-Württemberg Amtsgericht Ulm HRA 729218\nRiadi Kindertagespflege e.K. – Blaubeuren",
      "type": "Registerbekanntmachung nach dem Umwandlungsgesetz",
      "state": "Baden-Württemberg",
      "amtsgericht": "Amtsgericht Ulm",
      "registernummer": "HRA 729218",
      "registerart": "HRA",
      "company_name": "Riadi Kindertagespflege e.K.",
      "company_seat": "Blaubeuren",
      "details": "30.01.2025 (Bekanntmachungsdatum)\n\nBaden-Württemberg Amtsgericht Ulm HRA 729218\nRegisterbekanntmachung nach dem Umwandlungsgesetz 30.01.2025 (Eintragungsdatum)\n\nRiadi Kindertagespflege e.K.\nEinzelkaufmann / Einzelkauffrau\nBlaubeuren\n\nAls nicht eingetragen wird bekanntgemacht:\nDen Gläubigern der an der Ausgliederung beteiligten Rechtsträger ist, wenn sie binnen sechs Monaten nach dem Tag, an dem die Eintragung der Ausgliederung in das Register des Sitzes desjenigen Rechtsträgers, dessen Gläubiger sie sind, nach § 19 Abs. 3 UmwG als bekanntgemacht gilt, ihren Anspruch nach Grund und Höhe schriftlich anmelden, Sicherheit zu leisten, soweit sie nicht Befriedigung verlangen können. Dieses Recht steht den Gläubigern jedoch nur zu, wenn sie glaubhaft machen, dass durch die Ausgliederung die Erfüllung ihrer Forderung gefährdet wird."
    },
    {
      "date": "2025-01-30",
      "id": "100055",
      "original_text": "Registerbekanntmachung nach dem Umwandlungsgesetz\nBaden-Württemberg Amtsgericht Ulm HRB 749322\nHobbits Kinderbetreuung GmbH – Blaubeuren",
      "type": "Registerbekanntmachung nach dem Umwandlungsgesetz",
      "state": "Baden-Württemberg",
      "amtsgericht": "Amtsgericht Ulm",
      "registernummer": "HRB 749322",
      "registerart": "HRB",
      "company_name": "Hobbits Kinderbetreuung GmbH",
      "company_seat": "Blaubeuren",
      "details": "30.01.2025 (Bekanntmachungsdatum)\n\nBaden-Württemberg Amtsgericht Ulm HRB 749322\nRegisterbekanntmachung nach dem Umwandlungsgesetz 30.01.2025 (Eintragungsdatum)\n\nHobbits Kinderbetreuung GmbH\nGesellschaft mit beschränkter Haftung\nBlaubeuren\n\nAls nicht eingetragen wird bekanntgemacht:\nDen Gläubigern der an der Ausgliederung beteiligten Rechtsträger ist, wenn sie binnen sechs Monaten nach dem Tag, an dem die Eintragung der Ausgliederung in das Register des Sitzes desjenigen Rechtsträgers, dessen Gläubiger sie sind, nach § 19 Abs. 3 UmwG als bekanntgemacht gilt, ihren Anspruch nach Grund und Höhe schriftlich anmelden, Sicherheit zu leisten, soweit sie nicht Befriedigung verlangen können. Dieses Recht steht den Gläubigern jedoch nur zu, wenn sie glaubhaft machen, dass durch die Ausgliederung die Erfüllung ihrer Forderung gefährdet wird."
    },
    {
      "date": "2025-01-30",
      "id": "100056",
      "original_text": "Registerbekanntmachung nach dem Umwandlungsgesetz\nBaden-Württemberg Amtsgericht Ulm HRB 740572\nPIG Private Investitions GmbH – Ulm",
      "type": "Registerbekanntmachung nach dem Umwandlungsgesetz",
      "state": "Baden-Württemberg",
      "amtsgericht": "Amtsgericht Ulm",
      "registernummer": "HRB 740572",
      "registerart": "HRB",
      "company_name": "PIG Private Investitions GmbH",
      "company_seat": "Ulm",
      "details": "30.01.2025 (Bekanntmachungsdatum)\n\nBaden-Württemberg Amtsgericht Ulm HRB 740572\nRegisterbekanntmachung nach dem Umwandlungsgesetz 30.01.2025 (Eintragungsdatum)\n\nPIG Private Investitions GmbH\nGesellschaft mit beschränkter Haftung\nUlm\n\nDen Gläubigern der an der Abspaltung beteiligten Rechtsträger ist, wenn sie binnen sechs Monaten nach dem Tag, an dem die Eintragung der Abspaltung in das Register des Sitzes desjenigen Rechtsträgers, dessen Gläubiger sie sind, nach § 19 Abs. 3 UmwG als bekanntgemacht gilt, ihren Anspruch nach Grund und Höhe schriftlich anmelden, Sicherheit zu leisten, soweit sie nicht Befriedigung verlangen können. Dieses Recht steht den Gläubigern jedoch nur zu, wenn sie glaubhaft machen, dass durch die Abspaltung die Erfüllung ihrer Forderung gefährdet wird."
    },
    {
      "date": "2025-01-30",
      "id": "100057",
      "original_text": "Registerbekanntmachung nach dem Umwandlungsgesetz\nBerlin Amtsgericht Berlin (Charlottenburg) HRB 271619\nWelter Facility Management GmbH – Berlin",
      "type": "Registerbekanntmachung nach dem Umwandlungsgesetz",
      "state": "Berlin",
      "amtsgericht": "Amtsgericht Berlin (Charlottenburg)",
      "registernummer": "HRB 271619",
      "registerart": "HRB",
      "company_name": "Welter Facility Management GmbH",
      "company_seat": "Berlin",
      "details": "30.01.2025 (Bekanntmachungsdatum)\n\nBerlin Amtsgericht Berlin (Charlottenburg) HRB 271619\nRegisterbekanntmachung nach dem Umwandlungsgesetz 29.01.2025 (Eintragungsdatum)\n\nWelter Facility Management GmbH\nGesellschaft mit beschränkter Haftung\nBerlin\n\nZu Eintragungsnummer 1 vom 29.01.2025 wird als nicht eingetragen veröffentlicht: Den Gläubigern der an der Spaltung beteiligten Rechtsträger ist, wenn sie binnen sechs Monaten nach dem Tag, an dem die Eintragung der Spaltung in das Register des Sitzes desjenigen Rechtsträgers, dessen Gläubiger sie sind, als bekannt gemacht gilt, ihren Anspruch nach Grund und Höhe schriftlich anmelden, Sicherheit zu leisten, soweit sie nicht Befriedigung verlangen können. Dieses Recht steht den Gläubigern jedoch nur zu, wenn sie glaubhaft machen, dass durch die Spaltung die Erfüllung ihrer Forderung gefährdet wird. Das Recht, Sicherheitsleistung zu verlangen, steht Gläubigern nicht zu, die im Falle der Insolvenz ein Recht auf vorzugsweise Befriedigung aus einer Deckungsmasse haben, die nach gesetzlicher Vorschrift zu ihrem Schutz errichtet und staatlich überwacht ist."
    },
    {
      "date": "2025-01-30",
      "id": "100058",
      "original_text": "Einreichung neuer Dokumente\nBerlin Amtsgericht Berlin (Charlottenburg) HRB 270425\nRainhackers AG – Berlin",
      "type": "Einreichung neuer Dokumente",
      "state": "Berlin",
      "amtsgericht": "Amtsgericht Berlin (Charlottenburg)",
      "registernummer": "HRB 270425",
      "registerart": "HRB",
      "company_name": "Rainhackers AG",
      "company_seat": "Berlin",
      "details": "30.01.2025 (Bekanntmachungsdatum)\n\nBerlin Amtsgericht Berlin (Charlottenburg) HRB 270425\nEinreichung neuer Dokumente\n\nRainhackers AG\nAktiengesellschaft\nBerlin\n\nAls nicht eingetragen wird veröffentlicht: Es wurde eine neue Liste der Aufsichtsratsmitglieder eingereicht (§ 106 AktG)."
    },
    {
      "date": "2025-01-30",
      "id": "100059",
      "original_text": "Registerbekanntmachung nach dem Umwandlungsgesetz\nBaden-Württemberg Amtsgericht Stuttgart HRB 798228\nHochstetter Rent & Service GmbH – Brackenheim",
      "type": "Registerbekanntmachung nach dem Umwandlungsgesetz",
      "state": "Baden-Württemberg",
      "amtsgericht": "Amtsgericht Stuttgart",
      "registernummer": "HRB 798228",
      "registerart": "HRB",
      "company_name": "Hochstetter Rent & Service GmbH",
      "company_seat": "Brackenheim",
      "details": "30.01.2025 (Bekanntmachungsdatum)\n\nBaden-Württemberg Amtsgericht Stuttgart HRB 798228\nRegisterbekanntmachung nach dem Umwandlungsgesetz 30.01.2025 (Eintragungsdatum)\n\nHochstetter Rent & Service GmbH\nGesellschaft mit beschränkter Haftung\nBrackenheim\n\nAls nicht eingetragen wird bekanntgemacht:\nDen Gläubigern des an dem Formwechsel beteiligten Rechtsträgers ist, wenn sie binnen sechs Monaten nach dem Tag, an dem die Eintragung des Formwechsels in das Register des Sitzes desjenigen Rechtsträgers, dessen Gläubiger sie sind, nach § 19 Abs. 3 UmwG als bekanntgemacht gilt, ihren Anspruch nach Grund und Höhe schriftlich anmelden, Sicherheit zu leisten, soweit sie nicht Befriedigung verlangen können. Dieses Recht steht den Gläubigern jedoch nur zu, wenn sie glaubhaft machen, dass durch den Formwechsel die Erfüllung ihrer Forderung gefährdet wird."
    },
    {
      "date": "2025-01-30",
      "id": "100060",
      "original_text": "Registerbekanntmachung nach dem Umwandlungsgesetz\nBaden-Württemberg Amtsgericht Stuttgart HRA 726022\nHochstetter Vermietung & Handel KG – Brackenheim",
      "type": "Registerbekanntmachung nach dem Umwandlungsgesetz",
      "state": "Baden-Württemberg",
      "amtsgericht": "Amtsgericht Stuttgart",
      "registernummer": "HRA 726022",
      "registerart": "HRA",
      "company_name": "Hochstetter Vermietung & Handel KG",
      "company_seat": "Brackenheim",
      "details": "30.01.2025 (Bekanntmachungsdatum)\n\nBaden-Württemberg Amtsgericht Stuttgart HRA 726022\nRegisterbekanntmachung nach dem Umwandlungsgesetz 30.01.2025 (Eintragungsdatum)\n\nHochstetter Vermietung & Handel KG\nKommanditgesellschaft\nBrackenheim\n\nDen Gläubigern des an dem Formwechsel beteiligten Rechtsträgers ist, wenn sie binnen sechs Monaten nach dem Tag, an dem die Eintragung des Formwechsels in das Register des Sitzes desjenigen Rechtsträgers, dessen Gläubiger sie sind, nach § 19 Abs. 3 UmwG als bekanntgemacht gilt, ihren Anspruch nach Grund und Höhe schriftlich anmelden, Sicherheit zu leisten, soweit sie nicht Befriedigung verlangen können. Dieses Recht steht den Gläubigern jedoch nur zu, wenn sie glaubhaft machen, dass durch den Formwechsel die Erfüllung ihrer Forderung gefährdet wird."
    },
    {
      "date": "2025-01-30",
      "id": "100061",
      "original_text": "Einreichung neuer Dokumente\nBrandenburg Amtsgericht Frankfurt/Oder HRB 14344\nTeGeCe Infrastruktur und Logistik GmbH – Frankfurt (Oder)",
      "type": "Einreichung neuer Dokumente",
      "state": "Brandenburg",
      "amtsgericht": "Amtsgericht Frankfurt/Oder",
      "registernummer": "HRB 14344",
      "registerart": "HRB",
      "company_name": "TeGeCe Infrastruktur und Logistik GmbH",
      "company_seat": "Frankfurt (Oder)",
      "details": "30.01.2025 (Bekanntmachungsdatum)\n\nBrandenburg Amtsgericht Frankfurt/Oder HRB 14344\nEinreichung neuer Dokumente\n\nTeGeCe Infrastruktur und Logistik GmbH\nGesellschaft mit beschränkter Haftung\nFrankfurt (Oder)\n\nAls nicht eingetragen wird veröffentlicht:  Die Gesellschaft hat Änderungen im Aufsichtsrat angezeigt."
    },
    {
      "date": "2025-01-30",
      "id": "100062",
      "original_text": "Einreichung neuer Dokumente\nSachsen Amtsgericht Dresden HRB 40553\nDGI Deutsche Grundinvest AG – Dresden",
      "type": "Einreichung neuer Dokumente",
      "state": "Sachsen",
      "amtsgericht": "Amtsgericht Dresden",
      "registernummer": "HRB 40553",
      "registerart": "HRB",
      "company_name": "DGI Deutsche Grundinvest AG",
      "company_seat": "Dresden",
      "details": "30.01.2025 (Bekanntmachungsdatum)\n\nSachsen Amtsgericht Dresden HRB 40553\nEinreichung neuer Dokumente\n\nDGI Deutsche Grundinvest AG\nAktiengesellschaft\nDresden\n\nAm 29.01.2025 wurde beim Handelsregister des Amtsgerichts Dresden die Liste der Mitglieder des Aufsichtsrats gemäß § 106 AktG eingereicht."
    },
    {
      "date": "2025-01-30",
      "id": "100063",
      "original_text": "Sonstige Registerbekanntmachung\nSachsen Amtsgericht Dresden HRB 28534\nTischlerei Leskovitz GmbH – Bad Schandau",
      "type": "Sonstige Registerbekanntmachung",
      "state": "Sachsen",
      "amtsgericht": "Amtsgericht Dresden",
      "registernummer": "HRB 28534",
      "registerart": "HRB",
      "company_name": "Tischlerei Leskovitz GmbH",
      "company_seat": "Bad Schandau",
      "details": "30.01.2025 (Bekanntmachungsdatum)\n\nSachsen Amtsgericht Dresden HRB 28534\nSonstige Registerbekanntmachung 30.01.2025 (Eintragungsdatum)\n\nTischlerei Leskovitz GmbH\nGesellschaft mit beschränkter Haftung\nBad Schandau\n\nDen Gläubigern der Gesellschaft, deren Forderungen begründet worden sind bevor die Eintragung der Beendigung des Beherrschungs- und Gewinnabführungsvertrages in das Handelsregister nach § 10 des Handelsgesetzbuches als bekanntgemacht gilt, hat der andere Vertragsteil Sicherheit zu leisten, wenn sie sich binnen sechs Monaten nach der Bekanntmachung der Eintragung zu diesem Zweck bei ihm melden."
    },
    {
      "date": "2025-01-30",
      "id": "100064",
      "original_text": "Einreichung neuer Dokumente\nSachsen Amtsgericht Leipzig HRB 7735\nHHL gemeinnützige GmbH – Leipzig",
      "type": "Einreichung neuer Dokumente",
      "state": "Sachsen",
      "amtsgericht": "Amtsgericht Leipzig",
      "registernummer": "HRB 7735",
      "registerart": "HRB",
      "company_name": "HHL gemeinnützige GmbH",
      "company_seat": "Leipzig",
      "details": "30.01.2025 (Bekanntmachungsdatum)\n\nSachsen Amtsgericht Leipzig HRB 7735\nEinreichung neuer Dokumente\n\nHHL gemeinnützige GmbH\nGesellschaft mit beschränkter Haftung\nLeipzig\n\nAm 29.01.2025 wurde beim Handelsregister des Amtsgerichts Leipzig die Liste der Mitglieder des Aufsichtsrats gemäß § 52 GmbHG eingereicht."
    },
    {
      "date": "2025-01-30",
      "id": "100065",
      "original_text": "Registerbekanntmachung nach dem Umwandlungsgesetz\nSachsen Amtsgericht Leipzig GsR 259\nArea13 Leipzig eGbR – Leipzig",
      "type": "Registerbekanntmachung nach dem Umwandlungsgesetz",
      "state": "Sachsen",
      "amtsgericht": "Amtsgericht Leipzig",
      "registernummer": "GsR 259",
      "registerart": "GsR",
      "company_name": "Area13 Leipzig eGbR",
      "company_seat": "Leipzig",
      "details": "30.01.2025 (Bekanntmachungsdatum)\n\nSachsen Amtsgericht Leipzig GsR 259\nRegisterbekanntmachung nach dem Umwandlungsgesetz 30.01.2025 (Eintragungsdatum)\n\nArea13 Leipzig eGbR\nGesellschaft bürgerlichen Rechts\nLeipzig\n\nDen Gläubigern der an der Verschmelzung beteiligten Rechtsträger ist, wenn sie binnen sechs Monaten nach dem Tag, an dem die Eintragung der Verschmelzung in das Register des Sitzes desjenigen Rechtsträgers, dessen Gläubiger sie sind, nach § 19 Abs. 3 UmwG als bekannt gemacht gilt, ihren Anspruch nach Grund und Höhe in Textform anmelden, Sicherheit zu leisten, soweit sie nicht Befriedigung verlangen können. Dieses Recht steht den Gläubigern jedoch nur zu, wenn sie glaubhaft machen, dass durch die Verschmelzung die Erfüllung der Forderung gefährdet wird."
    },
    {
      "date": "2025-01-30",
      "id": "100066",
      "original_text": "Registerbekanntmachung nach dem Umwandlungsgesetz\nSachsen Amtsgericht Chemnitz HRB 27259\nWeimert Bedachungen Döbeln GmbH – Döbeln",
      "type": "Registerbekanntmachung nach dem Umwandlungsgesetz",
      "state": "Sachsen",
      "amtsgericht": "Amtsgericht Chemnitz",
      "registernummer": "HRB 27259",
      "registerart": "HRB",
      "company_name": "Weimert Bedachungen Döbeln GmbH",
      "company_seat": "Döbeln",
      "details": "30.01.2025 (Bekanntmachungsdatum)\n\nSachsen Amtsgericht Chemnitz HRB 27259\nRegisterbekanntmachung nach dem Umwandlungsgesetz 30.01.2025 (Eintragungsdatum)\n\nWeimert Bedachungen Döbeln GmbH\nGesellschaft mit beschränkter Haftung\nDöbeln\n\nDen Gläubigern der an der Verschmelzung beteiligten Rechtsträger ist, wenn sie binnen sechs Monaten nach dem Tag, an dem die Eintragung der Verschmelzung in das Register des Sitzes desjenigen Rechtsträgers, dessen Gläubiger sie sind, nach § 19 Abs. 3 UmwG als bekannt gemacht gilt, ihren Anspruch nach Grund und Höhe in Textform anmelden, Sicherheit zu leisten, soweit sie nicht Befriedigung verlangen können. Dieses Recht steht den Gläubigern jedoch nur zu, wenn sie glaubhaft machen, dass durch die Verschmelzung die Erfüllung der Forderung gefährdet wird."
    },
    {
      "date": "2025-01-30",
      "id": "100067",
      "original_text": "Einreichung neuer Dokumente\nSachsen Amtsgericht Chemnitz HRB 21300\nPleißental-Klinik GmbH – Werdau",
      "type": "Einreichung neuer Dokumente",
      "state": "Sachsen",
      "amtsgericht": "Amtsgericht Chemnitz",
      "registernummer": "HRB 21300",
      "registerart": "HRB",
      "company_name": "Pleißental-Klinik GmbH",
      "company_seat": "Werdau",
      "details": "30.01.2025 (Bekanntmachungsdatum)\n\nSachsen Amtsgericht Chemnitz HRB 21300\nEinreichung neuer Dokumente\n\nPleißental-Klinik GmbH\nGesellschaft mit beschränkter Haftung\nWerdau\n\nAm 29.01.2025 wurde beim Handelsregister des Amtsgerichts Chemnitz die Liste der Mitglieder des Aufsichtsrats gemäß § 52 GmbHG eingereicht."
    },
    {
      "date": "2025-01-30",
      "id": "100068",
      "original_text": "Registerbekanntmachung nach dem Umwandlungsgesetz\nSachsen Amtsgericht Chemnitz HRB 107746 früher Amtsgericht Leipzig\nDachdeckermeister Reinhard Weimert Bedachungen GmbH – Döbeln",
      "type": "Registerbekanntmachung nach dem Umwandlungsgesetz",
      "state": "Sachsen",
      "amtsgericht": "Amtsgericht Chemnitz",
      "registernummer": "HRB 107746",
      "registerart": "HRB",
      "company_name": "Dachdeckermeister Reinhard Weimert Bedachungen GmbH",
      "company_seat": "Döbeln",
      "former_amtsgericht": "Leipzig",
      "details": "30.01.2025 (Bekanntmachungsdatum)\n\nSachsen Amtsgericht Chemnitz HRB 107746 früher Amtsgericht Leipzig\nRegisterbekanntmachung nach dem Umwandlungsgesetz 30.01.2025 (Eintragungsdatum)\n\nDachdeckermeister Reinhard Weimert Bedachungen GmbH\nGesellschaft mit beschränkter Haftung\nDöbeln\n\nDen Gläubigern der an der Verschmelzung beteiligten Rechtsträger ist, wenn sie binnen sechs Monaten nach dem Tag, an dem die Eintragung der Verschmelzung in das Register des Sitzes desjenigen Rechtsträgers, dessen Gläubiger sie sind, nach § 19 Abs. 3 UmwG als bekannt gemacht gilt, ihren Anspruch nach Grund und Höhe in Textform anmelden, Sicherheit zu leisten, soweit sie nicht Befriedigung verlangen können. Dieses Recht steht den Gläubigern jedoch nur zu, wenn sie glaubhaft machen, dass durch die Verschmelzung die Erfüllung der Forderung gefährdet wird."
    },
    {
      "date": "2025-01-30",
      "id": "100069",
      "original_text": "Löschungsankündigung\nSachsen Amtsgericht Dresden HRB 38821\nTex GmbH – Weißwasser",
      "type": "Löschungsankündigung",
      "state": "Sachsen",
      "amtsgericht": "Amtsgericht Dresden",
      "registernummer": "HRB 38821",
      "registerart": "HRB",
      "company_name": "Tex GmbH",
      "company_seat": "Weißwasser",
      "details": "30.01.2025 (Bekanntmachungsdatum)\n\nSachsen Amtsgericht Dresden HRB 38821\nLöschungsankündigung\n\nTex GmbH\nGesellschaft mit beschränkter Haftung\nWeißwasser\n\nDas Registergericht beabsichtigt, die im Handelsregister eingetragene Gesellschaft von Amts wegen nach § 394 FamFG zu löschen. Die Frist zu Erhebung eines Widerspruchs gegen die beabsichtigte Löschung wird auf einen Monat festgesetzt."
    },
    {
      "date": "2025-01-30",
      "id": "100070",
      "original_text": "Löschungsankündigung\nSachsen Amtsgericht Leipzig HRB 38270\nLipsia Backstuben UG (haftungsbeschränkt) – Leipzig",
      "type": "Löschungsankündigung",
      "state": "Sachsen",
      "amtsgericht": "Amtsgericht Leipzig",
      "registernummer": "HRB 38270",
      "registerart": "HRB",
      "company_name": "Lipsia Backstuben UG (haftungsbeschränkt)",
      "company_seat": "Leipzig",
      "details": "30.01.2025 (Bekanntmachungsdatum)\n\nSachsen Amtsgericht Leipzig HRB 38270\nLöschungsankündigung\n\nLipsia Backstuben UG (haftungsbeschränkt)\nGesellschaft mit beschränkter Haftung\nLeipzig\n\nDas Registergericht beabsichtigt, die im Handelsregister eingetragene Gesellschaft von Amts wegen nach § 394 FamFG zu löschen. Die Frist zu Erhebung eines Widerspruchs gegen die beabsichtigte Löschung wird auf einen Monat festgesetzt."
    },
    {
      "date": "2025-01-30",
      "id": "100071",
      "original_text": "Löschungsankündigung\nNiedersachsen Amtsgericht Walsrode HRA 203408\nIntro Boden & Malerzentrum, Inhaber Jakob Schmalz e.K. – Bassum",
      "type": "Löschungsankündigung",
      "state": "Niedersachsen",
      "amtsgericht": "Amtsgericht Walsrode",
      "registernummer": "HRA 203408",
      "registerart": "HRA",
      "company_name": "Intro Boden & Malerzentrum, Inhaber Jakob Schmalz e.K.",
      "company_seat": "Bassum",
      "details": "30.01.2025 (Bekanntmachungsdatum)\n\nNiedersachsen Amtsgericht Walsrode HRA 203408\nLöschungsankündigung\n\nIntro Boden & Malerzentrum, Inhaber Jakob Schmalz e.K.\nEinzelkaufmann / Einzelkauffrau\nBassum\n\nDas Registergericht beabsichtigt, die Firma von Amts wegen nach § 395 FamFG zu löschen. Die Frist zur Erhebung eines Widerspruchs ist auf 1 Monat ab dieser Registerbekanntmachung festgesetzt."
    },
    {
      "date": "2025-01-30",
      "id": "100072",
      "original_text": "Sonstige Registerbekanntmachung\nNiedersachsen Amtsgericht Tostedt GnR 110004 früher Amtsgericht Langen\nMolkerei Hasenfleet eG – Oberndorf",
      "type": "Sonstige Registerbekanntmachung",
      "state": "Niedersachsen",
      "amtsgericht": "Amtsgericht Tostedt",
      "registernummer": "GnR 110004",
      "registerart": "GnR",
      "company_name": "Molkerei Hasenfleet eG",
      "company_seat": "Oberndorf",
      "former_amtsgericht": "Langen",
      "details": "30.01.2025 (Bekanntmachungsdatum)\n\nNiedersachsen Amtsgericht Tostedt GnR 110004 früher Amtsgericht Langen\nSonstige Registerbekanntmachung 13.08.2024 (Eintragungsdatum)\n\nMolkerei Hasenfleet eG\neingetragene Genossenschaft\nOberndorf\n\nNeue Regelung: Die Nachschusspflicht ist aufgehoben. Den Gläubigern der Genossenschaft ist, wenn sie sich binnen sechs Monaten nach dieser Bekanntmachung zu diesem Zweck bei der Genossenschaft melden, Sicherheit zu leisten, soweit sie nicht Befriedigung verlangen können."
    },
    {
      "date": "2025-01-30",
      "id": "100073",
      "original_text": "Löschungsankündigung\nNiedersachsen Amtsgericht Hildesheim HRB 101685\nADS Schridde GmbH – Peine",
      "type": "Löschungsankündigung",
      "state": "Niedersachsen",
      "amtsgericht": "Amtsgericht Hildesheim",
      "registernummer": "HRB 101685",
      "registerart": "HRB",
      "company_name": "ADS Schridde GmbH",
      "company_seat": "Peine",
      "details": "30.01.2025 (Bekanntmachungsdatum)\n\nNiedersachsen Amtsgericht Hildesheim HRB 101685\nLöschungsankündigung\n\nADS Schridde GmbH\nGesellschaft mit beschränkter Haftung\nPeine\n\nDas Registergericht beabsichtigt, die Gesellschaft von Amts wegen nach § 394 FamFG zu löschen. Die Frist zur Erhebung eines Widerspruchs ist auf 1 Monat ab dieser Registerbekanntmachung festgesetzt."
    },
    {
      "date": "2025-01-30",
      "id": "100074",
      "original_text": "Sonstige Registerbekanntmachung\nNiedersachsen Amtsgericht Tostedt GnR 120014 früher Amtsgericht Buxtehude\nAltländer Obst eG – Jork",
      "type": "Sonstige Registerbekanntmachung",
      "state": "Niedersachsen",
      "amtsgericht": "Amtsgericht Tostedt",
      "registernummer": "GnR 120014",
      "registerart": "GnR",
      "company_name": "Altländer Obst eG",
      "company_seat": "Jork",
      "former_amtsgericht": "Buxtehude",
      "details": "30.01.2025 (Bekanntmachungsdatum)\n\nNiedersachsen Amtsgericht Tostedt GnR 120014 früher Amtsgericht Buxtehude\nSonstige Registerbekanntmachung 30.07.2024 (Eintragungsdatum)\n\nAltländer Obst eG\neingetragene Genossenschaft\nJork\n\nNeue Regelung: Die Nachschusspflicht ist aufgehoben. Den Gläubigern der Genossenschaft ist, wenn sie sich binnen sechs Monaten nach dieser Bekanntmachung zu diesem Zweck bei der Genossenschaft melden, Sicherheit zu leisten, soweit sie nicht Befriedigung verlangen können."
    },
    {
      "date": "2025-01-30",
      "id": "100075",
      "original_text": "Registerbekanntmachung nach dem Umwandlungsgesetz\nNiedersachsen Amtsgericht Hildesheim VR 150193\nTurnverein Deutsche Eiche Holzminden von 1894 e.V. – Holzminden",
      "type": "Registerbekanntmachung nach dem Umwandlungsgesetz",
      "state": "Niedersachsen",
      "amtsgericht": "Amtsgericht Hildesheim",
      "registernummer": "VR 150193",
      "registerart": "VR",
      "company_name": "Turnverein Deutsche Eiche Holzminden von 1894 e.V.",
      "company_seat": "Holzminden",
      "details": "30.01.2025 (Bekanntmachungsdatum)\n\nNiedersachsen Amtsgericht Hildesheim VR 150193\nRegisterbekanntmachung nach dem Umwandlungsgesetz 30.01.2025 (Eintragungsdatum)\n\nTurnverein Deutsche Eiche Holzminden von 1894 e.V.\neingetragener Verein\nHolzminden\n\nDen Gläubigern der an der Verschmelzung beteiligten Rechtsträger ist, wenn sie binnen sechs Monaten nach dem Tag, an dem die Eintragung der Verschmelzung in das Register des Sitzes desjenigen Rechtsträgers, dessen Gläubiger sie sind, nach § 19  Abs.  3 UmwG als bekannt gemacht gilt, ihren Anspruch nach Grund und Höhe schriftlich anmelden, Sicherheit zu leisten, soweit sie nicht Befriedigung verlangen können. Dieses Recht steht den Gläubigern jedoch nur zu, wenn sie glaubhaft machen, dass durch die Verschmelzung die Erfüllung der Forderung gefährdet wird."
    },
    {
      "date": "2025-01-30",
      "id": "100076",
      "original_text": "Einreichung neuer Dokumente\nNiedersachsen Amtsgericht Oldenburg (Oldenburg) HRB 207052\nEWE VERTRIEB GmbH – Oldenburg",
      "type": "Einreichung neuer Dokumente",
      "state": "Niedersachsen",
      "amtsgericht": "Amtsgericht Oldenburg (Oldenburg)",
      "registernummer": "HRB 207052",
      "registerart": "HRB",
      "company_name": "EWE VERTRIEB GmbH",
      "company_seat": "Oldenburg",
      "details": "30.01.2025 (Bekanntmachungsdatum)\n\nNiedersachsen Amtsgericht Oldenburg (Oldenburg) HRB 207052\nEinreichung neuer Dokumente\n\nEWE VERTRIEB GmbH\nGesellschaft mit beschränkter Haftung\nOldenburg\n\nDie Liste der Mitglieder des Aufsichtsrats wurde beim Registergericht eingereicht."
    },
    {
      "date": "2025-01-30",
      "id": "100077",
      "original_text": "Einreichung neuer Dokumente\nNiedersachsen Amtsgericht Göttingen HRB 205722\nKWS SAAT SE & Co. KGaA – Einbeck",
      "type": "Einreichung neuer Dokumente",
      "state": "Niedersachsen",
      "amtsgericht": "Amtsgericht Göttingen",
      "registernummer": "HRB 205722",
      "registerart": "HRB",
      "company_name": "KWS SAAT SE & Co. KGaA",
      "company_seat": "Einbeck",
      "details": "30.01.2025 (Bekanntmachungsdatum)\n\nNiedersachsen Amtsgericht Göttingen HRB 205722\nEinreichung neuer Dokumente\n\nKWS SAAT SE & Co. KGaA\nKommanditgesellschaft auf Aktien\nEinbeck\n\nDie Liste der Mitglieder des Aufsichtsrats wurde beim Registergericht eingereicht."
    },
    {
      "date": "2025-01-30",
      "id": "100078",
      "original_text": "Registerbekanntmachung nach dem Umwandlungsgesetz\nNiedersachsen Amtsgericht Göttingen GsR 133\nMiletro eGbR – Hann.Münden",
      "type": "Registerbekanntmachung nach dem Umwandlungsgesetz",
      "state": "Niedersachsen",
      "amtsgericht": "Amtsgericht Göttingen",
      "registernummer": "GsR 133",
      "registerart": "GsR",
      "company_name": "Miletro eGbR",
      "company_seat": "Hann.Münden",
      "details": "30.01.2025 (Bekanntmachungsdatum)\n\nNiedersachsen Amtsgericht Göttingen GsR 133\nRegisterbekanntmachung nach dem Umwandlungsgesetz 30.01.2025 (Eintragungsdatum)\n\nMiletro eGbR\nGesellschaft bürgerlichen Rechts\nHann.Münden\n\nDen Gläubigern der an der formwechselnden Umwandlung beteiligten Rechtsträger ist, wenn sie binnen sechs Monaten nach dem Tag, an dem die Eintragung der Umwandlung in das Register des Sitzes desjenigen Rechtsträgers, dessen Gläubiger sie sind, nach § 19 Abs. 3 UmwG als bekannt gemacht gilt, ihren Anspruch nach Grund und Höhe schriftlich anmelden, Sicherheit zu leisten, soweit sie nicht Befriedigung verlangen können. Dieses Recht steht den Gläubigern jedoch nur zu, wenn sie glaubhaft machen, dass durch die formwechselnde Umwandlung die Erfüllung der Forderung gefährdet wird."
    },
    {
      "date": "2025-01-30",
      "id": "100079",
      "original_text": "Registerbekanntmachung nach dem Umwandlungsgesetz\nNiedersachsen Amtsgericht Göttingen HRB 207694\nMiletro GmbH – Hann. Münden",
      "type": "Registerbekanntmachung nach dem Umwandlungsgesetz",
      "state": "Niedersachsen",
      "amtsgericht": "Amtsgericht Göttingen",
      "registernummer": "HRB 207694",
      "registerart": "HRB",
      "company_name": "Miletro GmbH",
      "company_seat": "Hann. Münden",
      "details": "30.01.2025 (Bekanntmachungsdatum)\n\nNiedersachsen Amtsgericht Göttingen HRB 207694\nRegisterbekanntmachung nach dem Umwandlungsgesetz 30.01.2025 (Eintragungsdatum)\n\nMiletro GmbH\nGesellschaft mit beschränkter Haftung\nHann. Münden\n\nDen Gläubigern der an der formwechselnden Umwandlung beteiligten Rechtsträger ist, wenn sie binnen sechs Monaten nach dem Tag, an dem die Eintragung der Umwandlung in das Register des Sitzes desjenigen Rechtsträgers, dessen Gläubiger sie sind, nach § 19 Abs. 3 UmwG als bekannt gemacht gilt, ihren Anspruch nach Grund und Höhe schriftlich anmelden, Sicherheit zu leisten, soweit sie nicht Befriedigung verlangen können. Dieses Recht steht den Gläubigern jedoch nur zu, wenn sie glaubhaft machen, dass durch die formwechselnde Umwandlung die Erfüllung der Forderung gefährdet wird."
    },
    {
      "date": "2025-01-30",
      "id": "100080",
      "original_text": "Sonstige Registerbekanntmachung\nNiedersachsen Amtsgericht Tostedt GnR 100031 früher Amtsgericht Stade\nRAISA eG – Stade",
      "type": "Sonstige Registerbekanntmachung",
      "state": "Niedersachsen",
      "amtsgericht": "Amtsgericht Tostedt",
      "registernummer": "GnR 100031",
      "registerart": "GnR",
      "company_name": "RAISA eG",
      "company_seat": "Stade",
      "former_amtsgericht": "Stade",
      "details": "30.01.2025 (Bekanntmachungsdatum)\n\nNiedersachsen Amtsgericht Tostedt GnR 100031 früher Amtsgericht Stade\nSonstige Registerbekanntmachung 17.01.2022 (Eintragungsdatum)\n\nRAISA eG\neingetragene Genossenschaft\nStade\n\nNeue Regelung: Die Nachschusspflicht ist aufgehoben. Den Gläubigern der Genossenschaft ist, wenn sie sich binnen sechs Monaten nach dieser Bekanntmachung zu diesem Zweck bei der Genossenschaft melden, Sicherheit zu leisten, soweit sie nicht Befriedigung verlangen können."
    },
    {
      "date": "2025-01-30",
      "id": "100081",
      "original_text": "Löschungsankündigung\nNiedersachsen Amtsgericht Lüneburg HRB 211548\nXII Apostel Gastronomie Mitte GmbH – Ebstorf",
      "type": "Löschungsankündigung",
      "state": "Niedersachsen",
      "amtsgericht": "Amtsgericht Lüneburg",
      "registernummer": "HRB 211548",
      "registerart": "HRB",
      "company_name": "XII Apostel Gastronomie Mitte GmbH",
      "company_seat": "Ebstorf",
      "details": "30.01.2025 (Bekanntmachungsdatum)\n\nNiedersachsen Amtsgericht Lüneburg HRB 211548\nLöschungsankündigung 30.01.2025 (Eintragungsdatum)\n\nXII Apostel Gastronomie Mitte GmbH\nGesellschaft mit beschränkter Haftung\nEbstorf\n\nDas Registergericht beabsichtigt, die Gesellschaft von Amts wegen nach § 394 FamFG zu löschen. Die Frist zur Erhebung eines Widerspruchs ist auf 1 Monat ab dieser Registerbekanntmachung festgesetzt."
    },
    {
      "date": "2025-01-30",
      "id": "100082",
      "original_text": "Löschungsankündigung\nNiedersachsen Amtsgericht Hildesheim HRB 1803\nHelmut Oppermann GmbH – Hildesheim",
      "type": "Löschungsankündigung",
      "state": "Niedersachsen",
      "amtsgericht": "Amtsgericht Hildesheim",
      "registernummer": "HRB 1803",
      "registerart": "HRB",
      "company_name": "Helmut Oppermann GmbH",
      "company_seat": "Hildesheim",
      "details": "30.01.2025 (Bekanntmachungsdatum)\n\nNiedersachsen Amtsgericht Hildesheim HRB 1803\nLöschungsankündigung\n\nHelmut Oppermann GmbH\nGesellschaft mit beschränkter Haftung\nHildesheim\n\nDas Registergericht beabsichtigt, die Gesellschaft von Amts wegen nach § 394 FamFG zu löschen. Die Frist zur Erhebung eines Widerspruchs ist auf 1 Monat ab dieser Registerbekanntmachung festgesetzt."
    },
    {
      "date": "2025-01-30",
      "id": "100083",
      "original_text": "Registerbekanntmachung nach dem Umwandlungsgesetz\nNiedersachsen Amtsgericht Hildesheim VR 150092\nGesundheits-Sportgemeinschaft Holzminden e. V. – Holzminden",
      "type": "Registerbekanntmachung nach dem Umwandlungsgesetz",
      "state": "Niedersachsen",
      "amtsgericht": "Amtsgericht Hildesheim",
      "registernummer": "VR 150092",
      "registerart": "VR",
      "company_name": "Gesundheits-Sportgemeinschaft Holzminden e. V.",
      "company_seat": "Holzminden",
      "details": "30.01.2025 (Bekanntmachungsdatum)\n\nNiedersachsen Amtsgericht Hildesheim VR 150092\nRegisterbekanntmachung nach dem Umwandlungsgesetz 30.01.2025 (Eintragungsdatum)\n\nGesundheits-Sportgemeinschaft Holzminden e. V.\neingetragener Verein\nHolzminden\n\nDen Gläubigern der an der Verschmelzung beteiligten Rechtsträger ist, wenn sie binnen sechs Monaten nach dem Tag, an dem die Eintragung der Verschmelzung in das Register des Sitzes desjenigen Rechtsträgers, dessen Gläubiger sie sind, nach § 19  Abs.  3 UmwG als bekannt gemacht gilt, ihren Anspruch nach Grund und Höhe schriftlich anmelden, Sicherheit zu leisten, soweit sie nicht Befriedigung verlangen können. Dieses Recht steht den Gläubigern jedoch nur zu, wenn sie glaubhaft machen, dass durch die Verschmelzung die Erfüllung der Forderung gefährdet wird."
    },
    {
      "date": "2025-01-30",
      "id": "100084",
      "original_text": "Registerbekanntmachung nach dem Umwandlungsgesetz\nBremen Amtsgericht Bremen HRB 3225 BHV\nEUROGATE Container Terminal Bremerhaven GmbH – Bremerhaven",
      "type": "Registerbekanntmachung nach dem Umwandlungsgesetz",
      "state": "Bremen",
      "amtsgericht": "Amtsgericht Bremen",
      "registernummer": "HRB 3225 BHV",
      "registerart": "HRB",
      "company_name": "EUROGATE Container Terminal Bremerhaven GmbH",
      "company_seat": "Bremerhaven",
      "details": "30.01.2025 (Bekanntmachungsdatum)\n\nBremen Amtsgericht Bremen HRB 3225 BHV\nRegisterbekanntmachung nach dem Umwandlungsgesetz 29.01.2025 (Eintragungsdatum)\n\nEUROGATE Container Terminal Bremerhaven GmbH\nGesellschaft mit beschränkter Haftung\nBremerhaven\n\nZu Eintragungsnummer 26 vom 29.01.2025 wird als nicht eingetragen veröffentlicht: Den Gläubigern der an der Spaltung beteiligten Rechtsträger ist, wenn sie binnen sechs Monaten nach dem Tag, an dem die Eintragung der Spaltung in das Register des Sitzes desjenigen Rechtsträgers, dessen Gläubiger sie sind, als bekannt gemacht gilt, ihren Anspruch nach Grund und Höhe schriftlich anmelden, Sicherheit zu leisten, soweit sie nicht Befriedigung verlangen können. Dieses Recht steht den Gläubigern jedoch nur zu, wenn sie glaubhaft machen, dass durch die Spaltung die Erfüllung ihrer Forderung gefährdet wird. Das Recht, Sicherheitsleistung zu verlangen, steht Gläubigern nicht zu, die im Falle der Insolvenz ein Recht auf vorzugsweise Befriedigung aus einer Deckungsmasse haben, die nach gesetzlicher Vorschrift zu ihrem Schutz errichtet und staatlich überwacht ist."
    },
    {
      "date": "2025-01-30",
      "id": "100085",
      "original_text": "Einreichung neuer Dokumente\nBremen Amtsgericht Bremen HRB 35188\nZech Group SE – Bremen",
      "type": "Einreichung neuer Dokumente",
      "state": "Bremen",
      "amtsgericht": "Amtsgericht Bremen",
      "registernummer": "HRB 35188",
      "registerart": "HRB",
      "company_name": "Zech Group SE",
      "company_seat": "Bremen",
      "details": "30.01.2025 (Bekanntmachungsdatum)\n\nBremen Amtsgericht Bremen HRB 35188\nEinreichung neuer Dokumente\n\nZech Group SE\nEuropäische Aktiengesellschaft (SE)\nBremen\n\nAls nicht eingetragen wird bekannt gemacht: Liste des Aufsichtsrats wurde eingereicht."
    },
    {
      "date": "2025-01-30",
      "id": "100086",
      "original_text": "Löschungsankündigung\nRheinland-Pfalz Amtsgericht Landau HRB 33792\nEM-93 GmbH – Landau in der Pfalz",
      "type": "Löschungsankündigung",
      "state": "Rheinland-Pfalz",
      "amtsgericht": "Amtsgericht Landau",
      "registernummer": "HRB 33792",
      "registerart": "HRB",
      "company_name": "EM-93 GmbH",
      "company_seat": "Landau in der Pfalz",
      "details": "30.01.2025 (Bekanntmachungsdatum)\n\nRheinland-Pfalz Amtsgericht Landau HRB 33792\nLöschungsankündigung\n\nEM-93 GmbH\nGesellschaft mit beschränkter Haftung\nLandau in der Pfalz\n\nDas Registergericht beabsichtigt die Gesellschaft von Amts wegen nach § 394 FamFG zu löschen. Die Frist zur Erhebung eines Widerspruchs ist auf einen Monat festgesetzt."
    },
    {
      "date": "2025-01-30",
      "id": "100087",
      "original_text": "Löschungsankündigung\nRheinland-Pfalz Amtsgericht Ludwigshafen a.Rhein (Ludwigshafen) HRB 68249\nBLPD Montage und Bauservice GmbH – Ludwigshafen am Rhein",
      "type": "Löschungsankündigung",
      "state": "Rheinland-Pfalz",
      "amtsgericht": "Amtsgericht Ludwigshafen a.Rhein (Ludwigshafen)",
      "registernummer": "HRB 68249",
      "registerart": "HRB",
      "company_name": "BLPD Montage und Bauservice GmbH",
      "company_seat": "Ludwigshafen am Rhein",
      "details": "30.01.2025 (Bekanntmachungsdatum)\n\nRheinland-Pfalz Amtsgericht Ludwigshafen a.Rhein (Ludwigshafen) HRB 68249\nLöschungsankündigung\n\nBLPD Montage und Bauservice GmbH\nGesellschaft mit beschränkter Haftung\nLudwigshafen am Rhein\n\nDas Registergericht beabsichtigt die Gesellschaft von Amts wegen nach § 394 FamFG zu löschen. Die Frist zur Erhebung eines Widerspruchs ist auf einen Monat festgesetzt."
    },
    {
      "date": "2025-01-30",
      "id": "100088",
      "original_text": "Löschungsankündigung\nRheinland-Pfalz Amtsgericht Mainz HRB 52185\nBrands Beteiligungsgesellschaft mbH – Mainz",
      "type": "Löschungsankündigung",
      "state": "Rheinland-Pfalz",
      "amtsgericht": "Amtsgericht Mainz",
      "registernummer": "HRB 52185",
      "registerart": "HRB",
      "company_name": "Brands Beteiligungsgesellschaft mbH",
      "company_seat": "Mainz",
      "details": "30.01.2025 (Bekanntmachungsdatum)\n\nRheinland-Pfalz Amtsgericht Mainz HRB 52185\nLöschungsankündigung\n\nBrands Beteiligungsgesellschaft mbH\nGesellschaft mit beschränkter Haftung\nMainz\n\nDas Registergericht beabsichtigt die Gesellschaft von Amts wegen nach § 394 FamFG zu löschen. Die Frist zur Erhebung eines Widerspruchs ist auf einen Monat festgesetzt."
    },
    {
      "date": "2025-01-30",
      "id": "100089",
      "original_text": "Registerbekanntmachung nach dem Umwandlungsgesetz\nRheinland-Pfalz Amtsgericht Koblenz HRA 13304\nDieter Kirstgen e.K. Consultant – Mayen",
      "type": "Registerbekanntmachung nach dem Umwandlungsgesetz",
      "state": "Rheinland-Pfalz",
      "amtsgericht": "Amtsgericht Koblenz",
      "registernummer": "HRA 13304",
      "registerart": "HRA",
      "company_name": "Dieter Kirstgen e.K. Consultant",
      "company_seat": "Mayen",
      "details": "30.01.2025 (Bekanntmachungsdatum)\n\nRheinland-Pfalz Amtsgericht Koblenz HRA 13304\nRegisterbekanntmachung nach dem Umwandlungsgesetz 30.01.2025 (Eintragungsdatum)\n\nDieter Kirstgen e.K. Consultant\nEinzelkaufmann / Einzelkauffrau\nMayen\n\nGläubigern der an der Verschmelzung beteiligten Rechtsträger ist unter den Voraussetzungen des § 22 UmwG Sicherheit zu leisten."
    },
    {
      "date": "2025-01-30",
      "id": "100090",
      "original_text": "Registerbekanntmachung nach dem Umwandlungsgesetz\nNordrhein-Westfalen Amtsgericht Arnsberg HRA 9201\nKontierbüro Peter Lehwark e.K. – Medebach",
      "type": "Registerbekanntmachung nach dem Umwandlungsgesetz",
      "state": "Nordrhein-Westfalen",
      "amtsgericht": "Amtsgericht Arnsberg",
      "registernummer": "HRA 9201",
      "registerart": "HRA",
      "company_name": "Kontierbüro Peter Lehwark e.K.",
      "company_seat": "Medebach",
      "details": "30.01.2025 (Bekanntmachungsdatum)\n\nNordrhein-Westfalen Amtsgericht Arnsberg HRA 9201\nRegisterbekanntmachung nach dem Umwandlungsgesetz 30.01.2025 (Eintragungsdatum)\n\nKontierbüro Peter Lehwark e.K.\nEinzelkaufmann / Einzelkauffrau\nMedebach\n\nDen Gläubigern der an der Ausgliederung beteiligten Rechtsträger ist, wenn sie binnen sechs Monaten nach dem Tag, an dem die Eintragung der Ausgliederung in das Register des Sitzes desjenigen Rechtsträgers, dessen Gläubiger sie sind, nach § 19 Absatz 3 UmwG als bekanntgemacht gilt, ihren Anspruch nach Grund und Höhe schriftlich anmelden, Sicherheit zu leisten, soweit sie nicht Befriedigung verlangen können. Dieses Recht steht den Gläubigern jedoch nur zu, wenn sie glaubhaft machen, dass durch die Ausgliederung die Erfüllung ihrer Forderung gefährdet wird."
    },
    {
      "date": "2025-01-30",
      "id": "100091",
      "original_text": "Löschungsankündigung\nNordrhein-Westfalen Amtsgericht Dortmund HRB 16204\nUMS Unternehmens-Marketing-Service GmbH – Lünen",
      "type": "Löschungsankündigung",
      "state": "Nordrhein-Westfalen",
      "amtsgericht": "Amtsgericht Dortmund",
      "registernummer": "HRB 16204",
      "registerart": "HRB",
      "company_name": "UMS Unternehmens-Marketing-Service GmbH",
      "company_seat": "Lünen",
      "details": "30.01.2025 (Bekanntmachungsdatum)\n\nNordrhein-Westfalen Amtsgericht Dortmund HRB 16204\nLöschungsankündigung\n\nUMS Unternehmens-Marketing-Service GmbH\nGesellschaft mit beschränkter Haftung\nLünen\n\nDas Registergericht beabsichtigt die Gesellschaft von Amts wegen nach § 394 FamFG zu löschen. Die Frist zur Erhebung eines Widerspruchs ist auf zwei Monate festgesetzt."
    },
    {
      "date": "2025-01-30",
      "id": "100092",
      "original_text": "Löschungsankündigung\nNordrhein-Westfalen Amtsgericht Aachen HRB 19550\nNeos UG (haftungsbeschränkt) – Aachen",
      "type": "Löschungsankündigung",
      "state": "Nordrhein-Westfalen",
      "amtsgericht": "Amtsgericht Aachen",
      "registernummer": "HRB 19550",
      "registerart": "HRB",
      "company_name": "Neos UG (haftungsbeschränkt)",
      "company_seat": "Aachen",
      "details": "30.01.2025 (Bekanntmachungsdatum)\n\nNordrhein-Westfalen Amtsgericht Aachen HRB 19550\nLöschungsankündigung\n\nNeos UG (haftungsbeschränkt)\nGesellschaft mit beschränkter Haftung\nAachen\n\nDas Registergericht beabsichtigt, von Amts wegen die Gesellschaft wegen Vermögenslosigkeit nach § 394 FamFG zu löschen, weil das Insolvenzverfahren Amtsgericht Aachen (91 IN 21/24) beendet und Vermögen der Gesellschaft nicht mehr erkennbar ist.Zur Geltendmachung des Widerspruchs gegen die beabsichtigte Löschung wird hiermit eine Frist von einem Monat ab Veröffentlichung dieser Ankündigung bestimmt. Rechtsbehelfsbelehrung: Gegen diese Verfügung kann Widerspruch eingelegt werden. Zum Widerspruch ist jeder berechtigt, der an der Unterlassung der Löschung ein berechtigtes Interesse hat. Der Widerspruch ist bei dem Amtsgericht Aachen, Adalbertsteinweg 92, 52070 Aachen schriftlich in deutscher Sprache oder zur Niederschrift der Geschäftsstelle einzulegen. Der Widerspruch kann auch zur Niederschrift der Geschäftsstelle eines jeden Amtsgerichtes abgegeben werden.  Der Widerspruch muss spätestens innerhalb der gesetzten Frist nach der Bekanntgabe der Verfügung bei dem Amtsgericht Aachen eingegangen sein. Dies gilt auch dann, wenn der Widerspruch zur Niederschrift der Geschäftsstelle eines anderen Amtsgerichtes abgegeben wurde. Die Frist beginnt mit der Bekanntgabe der Verfügung durch Veröffentlichung. Fällt das Ende der Frist auf einen Sonntag, einen allgemeinen Feiertag oder Sonnabend, so endet die Frist mit Ablauf des nächsten Werktages.Der Widerspruch muss die Bezeichnung der angefochtenen Verfügung sowie die Erklärung enthalten, dass Widerspruch gegen diese Verfügung eingelegt wird. Er ist zu unterzeichnen und soll begründet werden. Die Einlegung ist auch durch Übertragung eines elektronischen Dokuments an die elektronische Poststelle des Gerichts möglich. Das elektronische Dokument muss für die Bearbeitung durch das Gericht geeignet und mit einer qualifizierten elektronischen Signatur der verantwortenden Person versehen sein oder von der verantwortenden Person signiert und auf einem sicheren Übermittlungsweg gemäß § 130 a ZPO nach näherer Maßgabe der Verordnung über die technischen Rahmenbedingungen des elektronischen Rechtsverkehrs und über das besondere elektronische Behördenpostfach (BGBl. I, S. 3803) eingereicht werden. Weitere Informationen erhalten Sie auf der Internetseite www.justiz.de."
    },
    {
      "date": "2025-01-30",
      "id": "100093",
      "original_text": "Sonstige Registerbekanntmachung\nNordrhein-Westfalen Amtsgericht Bonn HRB 13849\nDeutsche Post Direkt GmbH – Bonn",
      "type": "Sonstige Registerbekanntmachung",
      "state": "Nordrhein-Westfalen",
      "amtsgericht": "Amtsgericht Bonn",
      "registernummer": "HRB 13849",
      "registerart": "HRB",
      "company_name": "Deutsche Post Direkt GmbH",
      "company_seat": "Bonn",
      "details": "30.01.2025 (Bekanntmachungsdatum)\n\nNordrhein-Westfalen Amtsgericht Bonn HRB 13849\nSonstige Registerbekanntmachung 30.01.2025 (Eintragungsdatum)\n\nDeutsche Post Direkt GmbH\nGesellschaft mit beschränkter Haftung\nBonn\n\nAls nicht eingetragen wird veröffentlicht: Den Gläubigern der Gesellschaft, deren Forderungen begründet worden sind bevor die Eintragung der Beendigung des Beherrschungs- und Gewinnabführungsvertrages  in das Handelsregister nach § 10 des Handelsgesetzbuches als bekanntgemacht gilt, hat der andere Vertragsteil Sicherheit zu leisten, wenn sie sich binnen sechs Monaten nach der Bekanntmachung der Eintragung zu diesem Zweck bei ihm melden."
    },
    {
      "date": "2025-01-30",
      "id": "100094",
      "original_text": "Löschungsankündigung\nNordrhein-Westfalen Amtsgericht Düsseldorf HRB 30702\nGTI Travel GmbH – Düsseldorf",
      "type": "Löschungsankündigung",
      "state": "Nordrhein-Westfalen",
      "amtsgericht": "Amtsgericht Düsseldorf",
      "registernummer": "HRB 30702",
      "registerart": "HRB",
      "company_name": "GTI Travel GmbH",
      "company_seat": "Düsseldorf",
      "details": "30.01.2025 (Bekanntmachungsdatum)\n\nNordrhein-Westfalen Amtsgericht Düsseldorf HRB 30702\nLöschungsankündigung\n\nGTI Travel GmbH\nGesellschaft mit beschränkter Haftung\nDüsseldorf\n\nDas Registergericht beabsichtigt die Gesellschaft von Amts wegen nach § 394 FamFG zu löschen. Die Frist zur Erhebung eines Widerspruchs ist auf 3 Wochen festgesetzt.\n\nRechtsbehelfsbelehrung:\nDas Widerspruchsrecht steht jedem zu, der an der Unterlassung der Löschung ein berechtigtes Interesse hat. Der Widerspruch ist bei dem Amtsgericht Düsseldorf -Registergericht-, Werdener Straße 1, 40227 Düsseldorf schriftlich in deutscher Sprache oder zur Niederschrift der Geschäftsstelle einzulegen. Der Widerspruch kann auch zur Niederschrift der Geschäftsstelle eines jeden Amtsgerichtes abgegeben werden. Die Einlegung ist auch durch Übertragung eines elektronischen Dokuments an die elektronische Poststelle des Gerichts möglich. Das elektronische Dokument muss für die Bearbeitung durch das Gericht geeignet und mit einer qualifizierten elektronischen Signatur der verantwortenden Person versehen sein oder von der verantwortenden Person signiert und auf einem sicheren Übermittlungsweg gemäß § 130a ZPO nach näherer Maßgabe der Verordnung über die technischen Rahmenbedingungen des elektronischen Rechtsverkehrs und über das besondere elektronische Behördenpostfach (BGBl. I, S.3803) eingereicht werden. Weitere Informationen erhalten Sie auf der Internetseite www.justiz.de.\nDer Widerspruch muss spätestens innerhalb der gesetzten Frist nach dem Datum der Bekanntmachung der Löschungsankündigung bei dem Amtsgericht - Registergericht - Düsseldorf eingegangen sein.  Dies gilt auch dann, wenn der Widerspruch zur Niederschrift der Geschäftsstelle eines anderen Amtsgerichtes abgegeben wurde. Die Frist beginnt mit dem Tage der Bekanntmachung der Löschungsankündigung in dem für die Bekanntmachung der Eintragungen in das Handelsregister bestimmten elektronischen Informations- und Kommunikationssystem nach § 10 des Handelsgesetzbuches. Fällt das Ende der Frist auf einen Sonntag, einen allgemeinen Feiertag oder Sonnabend, so endet die Frist mit Ablauf des nächsten Werktages.\nDer Widerspruch muss die Bezeichnung der angefochtenen Löschungsankündigung sowie die Erklärung enthalten, dass Widerspruch gegen diese Löschungsankündigung eingelegt wird. Er ist zu unterzeichnen und soll begründet werden."
    },
    {
      "date": "2025-01-30",
      "id": "100095",
      "original_text": "Löschungsankündigung\nNordrhein-Westfalen Amtsgericht Krefeld HRB 14777\nPIVOS EUROPE GmbH – Willich",
      "type": "Löschungsankündigung",
      "state": "Nordrhein-Westfalen",
      "amtsgericht": "Amtsgericht Krefeld",
      "registernummer": "HRB 14777",
      "registerart": "HRB",
      "company_name": "PIVOS EUROPE GmbH",
      "company_seat": "Willich",
      "details": "30.01.2025 (Bekanntmachungsdatum)\n\nNordrhein-Westfalen Amtsgericht Krefeld HRB 14777\nLöschungsankündigung\n\nPIVOS EUROPE GmbH\nGesellschaft mit beschränkter Haftung\nWillich\n\nDas Registergericht beabsichtigt die Gesellschaft von Amts wegen nach § 394 FamFG zu löschen. Die Frist zur Erhebung eines Widerspruchs ist auf einen Monat festgesetzt."
    },
    {
      "date": "2025-01-30",
      "id": "100096",
      "original_text": "Löschungsankündigung\nNordrhein-Westfalen Amtsgericht Mönchengladbach HRB 20204\nAKGX Digital Services GmbH – Mönchengladbach",
      "type": "Löschungsankündigung",
      "state": "Nordrhein-Westfalen",
      "amtsgericht": "Amtsgericht Mönchengladbach",
      "registernummer": "HRB 20204",
      "registerart": "HRB",
      "company_name": "AKGX Digital Services GmbH",
      "company_seat": "Mönchengladbach",
      "details": "30.01.2025 (Bekanntmachungsdatum)\n\nNordrhein-Westfalen Amtsgericht Mönchengladbach HRB 20204\nLöschungsankündigung 30.01.2025 (Eintragungsdatum)\n\nAKGX Digital Services GmbH\nGesellschaft mit beschränkter Haftung\nMönchengladbach\n\nDas Registergericht beabsichtigt die Gesellschaft von Amts wegen nach § 394 FamFG zu löschen. Die Frist zur Erhebung eines Widerspruchs ist auf drei Monate festgesetzt."
    },
    {
      "date": "2025-01-30",
      "id": "100097",
      "original_text": "Löschungsankündigung\nNordrhein-Westfalen Amtsgericht Dortmund HRB 19520\nCOMPACT Power Generation Services GmbH – Dortmund",
      "type": "Löschungsankündigung",
      "state": "Nordrhein-Westfalen",
      "amtsgericht": "Amtsgericht Dortmund",
      "registernummer": "HRB 19520",
      "registerart": "HRB",
      "company_name": "COMPACT Power Generation Services GmbH",
      "company_seat": "Dortmund",
      "details": "30.01.2025 (Bekanntmachungsdatum)\n\nNordrhein-Westfalen Amtsgericht Dortmund HRB 19520\nLöschungsankündigung\n\nCOMPACT Power Generation Services GmbH\nGesellschaft mit beschränkter Haftung\nDortmund\n\nDas Registergericht beabsichtigt die Gesellschaft von Amts wegen nach § 394 FamFG zu löschen. Die Frist zur Erhebung eines Widerspruchs ist auf zwei Monate festgesetzt."
    },
    {
      "date": "2025-01-30",
      "id": "100098",
      "original_text": "Registerbekanntmachung nach dem Umwandlungsgesetz\nNordrhein-Westfalen Amtsgericht Paderborn HRB 7596\nMeyer Menü Büren Verwaltungs-GmbH – Büren",
      "type": "Registerbekanntmachung nach dem Umwandlungsgesetz",
      "state": "Nordrhein-Westfalen",
      "amtsgericht": "Amtsgericht Paderborn",
      "registernummer": "HRB 7596",
      "registerart": "HRB",
      "company_name": "Meyer Menü Büren Verwaltungs-GmbH",
      "company_seat": "Büren",
      "details": "30.01.2025 (Bekanntmachungsdatum)\n\nNordrhein-Westfalen Amtsgericht Paderborn HRB 7596\nRegisterbekanntmachung nach dem Umwandlungsgesetz 30.01.2025 (Eintragungsdatum)\n\nMeyer Menü Büren Verwaltungs-GmbH\nGesellschaft mit beschränkter Haftung\nBüren\n\nDen Gläubigern der an der Verschmelzung beteiligten Rechtsträger ist, wenn sie binnen sechs Monaten nach dem Tag, an dem die Eintragung der Verschmelzung in das Register des Sitzes desjenigen Rechtsträgers, dessen Gläubiger sie sind, nach § 19 Absatz 3 UmwG als bekanntgemacht gilt, ihren Anspruch nach Grund und Höhe schriftlich anmelden, Sicherheit zu leisten, soweit sie nicht Befriedigung verlangen können. Dieses Recht steht den Gläubigern jedoch nur zu, wenn sie glaubhaft machen, dass durch die Verschmelzung die Erfüllung ihrer Forderung gefährdet wird."
    },
    {
      "date": "2025-01-30",
      "id": "100099",
      "original_text": "Löschungsankündigung\nNordrhein-Westfalen Amtsgericht Wuppertal HRA 22944\nGeilenberg Birdie Island GmbH & Co. KG – Wuppertal",
      "type": "Löschungsankündigung",
      "state": "Nordrhein-Westfalen",
      "amtsgericht": "Amtsgericht Wuppertal",
      "registernummer": "HRA 22944",
      "registerart": "HRA",
      "company_name": "Geilenberg Birdie Island GmbH & Co. KG",
      "company_seat": "Wuppertal",
      "details": "30.01.2025 (Bekanntmachungsdatum)\n\nNordrhein-Westfalen Amtsgericht Wuppertal HRA 22944\nLöschungsankündigung 30.01.2025 (Eintragungsdatum)\n\nGeilenberg Birdie Island GmbH & Co. KG\nKommanditgesellschaft\nWuppertal\n\nDas Registergericht beabsichtigt die Firma von Amts wegen nach § 393 FamFG zu löschen. Die Frist zur Erhebung eines Widerspruchs ist auf drei Monate festgesetzt."
    },
    {
      "date": "2025-01-30",
      "id": "100100",
      "original_text": "Registerbekanntmachung nach dem Umwandlungsgesetz\nNordrhein-Westfalen Amtsgericht Köln HRB 60448\nKCS Beteiligungsgesellschaft mbH – Köln",
      "type": "Registerbekanntmachung nach dem Umwandlungsgesetz",
      "state": "Nordrhein-Westfalen",
      "amtsgericht": "Amtsgericht Köln",
      "registernummer": "HRB 60448",
      "registerart": "HRB",
      "company_name": "KCS Beteiligungsgesellschaft mbH",
      "company_seat": "Köln",
      "details": "30.01.2025 (Bekanntmachungsdatum)\n\nNordrhein-Westfalen Amtsgericht Köln HRB 60448\nRegisterbekanntmachung nach dem Umwandlungsgesetz 30.01.2025 (Eintragungsdatum)\n\nKCS Beteiligungsgesellschaft mbH\nGesellschaft mit beschränkter Haftung\nKöln\n\nDen Gläubigern der an der Verschmelzung beteiligten Rechtsträger ist, wenn sie binnen sechs Monaten nach dem Tag, an dem die Eintragung der Verschmelzung in das Register des Sitzes desjenigen Rechtsträgers, dessen Gläubiger sie sind, nach § 19 Absatz 3 UmwG als bekanntgemacht gilt, ihren Anspruch nach Grund und Höhe schriftlich anmelden, Sicherheit zu leisten, soweit sie nicht Befriedigung verlangen können. Dieses Recht steht den Gläubigern jedoch nur zu, wenn sie glaubhaft machen, dass durch die Verschmelzung die Erfüllung ihrer Forderung gefährdet wird."
    },
    {
      "date": "2025-01-30",
      "id": "100101",
      "original_text": "Registerbekanntmachung nach dem Umwandlungsgesetz\nNordrhein-Westfalen Amtsgericht Essen HRB 34018\nHomebase Vacation GmbH – Essen",
      "type": "Registerbekanntmachung nach dem Umwandlungsgesetz",
      "state": "Nordrhein-Westfalen",
      "amtsgericht": "Amtsgericht Essen",
      "registernummer": "HRB 34018",
      "registerart": "HRB",
      "company_name": "Homebase Vacation GmbH",
      "company_seat": "Essen",
      "details": "30.01.2025 (Bekanntmachungsdatum)\n\nNordrhein-Westfalen Amtsgericht Essen HRB 34018\nRegisterbekanntmachung nach dem Umwandlungsgesetz 30.01.2025 (Eintragungsdatum)\n\nHomebase Vacation GmbH\nGesellschaft mit beschränkter Haftung\nEssen\n\nDen Gläubigern der an der formwechselnden Umwandlung beteiligten Rechtsträger ist, wenn sie binnen sechs Monaten nach dem Tag, an dem die Eintragung der formwechselnden Umwandlung in das Register des Sitzes derjenigen Rechtsträger deren Gläubiger sie sind, nach § 19 Absatz 3 UmwG als bekanntgemacht gilt, ihren Anspruch nach Grund und Höhe schriftlich anmelden, Sicherheit zu leisten, soweit sie nicht Befriedigung verlangen können. Dieses Recht steht den Gläubigern jedoch nur zu, wenn sie glaubhaft machen, dass durch die formwechselnden Umwandlung die Erfüllung ihrer Forderung gefährdet wird."
    },
    {
      "date": "2025-01-30",
      "id": "100102",
      "original_text": "Registerbekanntmachung nach dem Umwandlungsgesetz\nNordrhein-Westfalen Amtsgericht Köln HRB 82618\nKCS Verwaltungs GmbH – Köln",
      "type": "Registerbekanntmachung nach dem Umwandlungsgesetz",
      "state": "Nordrhein-Westfalen",
      "amtsgericht": "Amtsgericht Köln",
      "registernummer": "HRB 82618",
      "registerart": "HRB",
      "company_name": "KCS Verwaltungs GmbH",
      "company_seat": "Köln",
      "details": "30.01.2025 (Bekanntmachungsdatum)\n\nNordrhein-Westfalen Amtsgericht Köln HRB 82618\nRegisterbekanntmachung nach dem Umwandlungsgesetz 30.01.2025 (Eintragungsdatum)\n\nKCS Verwaltungs GmbH\nGesellschaft mit beschränkter Haftung\nKöln\n\nDen Gläubigern der an der Verschmelzung beteiligten Rechtsträger ist, wenn sie binnen sechs Monaten nach dem Tag, an dem die Eintragung der Verschmelzung in das Register des Sitzes desjenigen Rechtsträgers, dessen Gläubiger sie sind, nach § 19 Absatz 3 UmwG als bekanntgemacht gilt, ihren Anspruch nach Grund und Höhe schriftlich anmelden, Sicherheit zu leisten, soweit sie nicht Befriedigung verlangen können. Dieses Recht steht den Gläubigern jedoch nur zu, wenn sie glaubhaft machen, dass durch die Verschmelzung die Erfüllung ihrer Forderung gefährdet wird."
    },
    {
      "date": "2025-01-30",
      "id": "100103",
      "original_text": "Sonstige Registerbekanntmachung\nNordrhein-Westfalen Amtsgericht Bonn HRB 19565\nDHL Paket GmbH – Bonn",
      "type": "Sonstige Registerbekanntmachung",
      "state": "Nordrhein-Westfalen",
      "amtsgericht": "Amtsgericht Bonn",
      "registernummer": "HRB 19565",
      "registerart": "HRB",
      "company_name": "DHL Paket GmbH",
      "company_seat": "Bonn",
      "details": "30.01.2025 (Bekanntmachungsdatum)\n\nNordrhein-Westfalen Amtsgericht Bonn HRB 19565\nSonstige Registerbekanntmachung 30.01.2025 (Eintragungsdatum)\n\nDHL Paket GmbH\nGesellschaft mit beschränkter Haftung\nBonn\n\nAls nicht eingetragen wird veröffentlicht: Den Gläubigern der Gesellschaft, deren Forderungen begründet worden sind bevor die Eintragung der Beendigung des Gewinnabführungsvertrages  in das Handelsregister nach § 10 des Handelsgesetzbuches als bekanntgemacht gilt, hat der andere Vertragsteil Sicherheit zu leisten, wenn sie sich binnen sechs Monaten nach der Bekanntmachung der Eintragung zu diesem Zweck bei ihm melden."
    },
    {
      "date": "2025-01-30",
      "id": "100104",
      "original_text": "Löschungsankündigung\nNordrhein-Westfalen Amtsgericht Aachen HRB 15056\nFengPing GmbH – Aachen",
      "type": "Löschungsankündigung",
      "state": "Nordrhein-Westfalen",
      "amtsgericht": "Amtsgericht Aachen",
      "registernummer": "HRB 15056",
      "registerart": "HRB",
      "company_name": "FengPing GmbH",
      "company_seat": "Aachen",
      "details": "30.01.2025 (Bekanntmachungsdatum)\n\nNordrhein-Westfalen Amtsgericht Aachen HRB 15056\nLöschungsankündigung\n\nFengPing GmbH\nGesellschaft mit beschränkter Haftung\nAachen\n\nDas Registergericht beabsichtigt, von Amts wegen die Gesellschaft wegen Vermögenslosigkeit nach § 394 FamFG zu löschen,  weil das Insolvenzverfahren Amtsgericht Aachen (Az.: 92 IN 155/18) beendet und Vermögen der Gesellschaft nicht mehr erkennbar ist.\n\nZur Geltendmachung des Widerspruchs gegen die beabsichtigte Löschung wird hiermit eine Frist von einem Monat ab Veröffentlichung dieser Ankündigung bestimmt.\n\nRechtsbehelfsbelehrung:\n\nGegen diese Verfügung kann Widerspruch eingelegt werden. Zum Widerspruch ist jeder berechtigt, der an der Unterlassung der Löschung ein berechtigtes Interesse hat.\n\nDer Widerspruch ist bei dem Amtsgericht Aachen, Adalbertsteinweg 92, 52070 Aachen schriftlich in deutscher Sprache oder zur Niederschrift der Geschäftsstelle einzulegen. Der Widerspruch kann auch zur Niederschrift der Geschäftsstelle eines jeden Amtsgerichtes abgegeben werden.\n\nDer Widerspruch muss spätestens innerhalb der gesetzten Frist nach der Bekanntgabe der Verfügung bei dem Amtsgericht Aachen eingegangen sein. Dies gilt auch dann, wenn der Widerspruch zur Niederschrift der Geschäftsstelle eines anderen Amtsgerichtes abgegeben wurde. Die Frist beginnt mit der Bekanntgabe der Verfügung durch Veröffentlichung. Fällt das Ende der Frist auf einen Sonntag, einen allgemeinen Feiertag oder Sonnabend, so endet die Frist mit Ablauf des nächsten Werktages.\n\nDer Widerspruch muss die Bezeichnung der angefochtenen Verfügung sowie die Erklärung enthalten, dass Widerspruch gegen diese Verfügung eingelegt wird. Er ist zu unterzeichnen und soll begründet werden.\n\nDie Einlegung ist auch durch Übertragung eines elektronischen Dokuments an die elektronische Poststelle des Gerichts möglich. Das elektronische Dokument muss für die Bearbeitung durch das Gericht geeignet und mit einer qualifizierten elektronischen Signatur der verantwortenden Person versehen sein oder von der verantwortenden Person signiert und auf einem sicheren Übermittlungsweg gemäß § 130 a ZPO nach näherer Maßgabe der Verordnung über die technischen Rahmenbedingungen des elektronischen Rechtsverkehrs und über das besondere elektronische Behördenpostfach (BGBl. I, S. 3803) eingereicht werden. Weitere Informationen erhalten Sie auf der Internetseite www.justiz.de."
    },
    {
      "date": "2025-01-30",
      "id": "100105",
      "original_text": "Einreichung neuer Dokumente\nNordrhein-Westfalen Amtsgericht Düsseldorf HRB 61123\nUniper Global Commodities SE – Düsseldorf",
      "type": "Einreichung neuer Dokumente",
      "state": "Nordrhein-Westfalen",
      "amtsgericht": "Amtsgericht Düsseldorf",
      "registernummer": "HRB 61123",
      "registerart": "HRB",
      "company_name": "Uniper Global Commodities SE",
      "company_seat": "Düsseldorf",
      "details": "30.01.2025 (Bekanntmachungsdatum)\n\nNordrhein-Westfalen Amtsgericht Düsseldorf HRB 61123\nEinreichung neuer Dokumente\n\nUniper Global Commodities SE\nEuropäische Aktiengesellschaft (SE)\nDüsseldorf\n\nDem Registergericht ist eine Liste der Mitglieder des Aufsichtsrates eingereicht worden."
    },
    {
      "date": "2025-01-30",
      "id": "100106",
      "original_text": "Sonstige Registerbekanntmachung\nNordrhein-Westfalen Amtsgericht Bonn HRB 15682\nDeutsche Post Adress Beteiligungsgesellschaft mbH – Bonn",
      "type": "Sonstige Registerbekanntmachung",
      "state": "Nordrhein-Westfalen",
      "amtsgericht": "Amtsgericht Bonn",
      "registernummer": "HRB 15682",
      "registerart": "HRB",
      "company_name": "Deutsche Post Adress Beteiligungsgesellschaft mbH",
      "company_seat": "Bonn",
      "details": "30.01.2025 (Bekanntmachungsdatum)\n\nNordrhein-Westfalen Amtsgericht Bonn HRB 15682\nSonstige Registerbekanntmachung 30.01.2025 (Eintragungsdatum)\n\nDeutsche Post Adress Beteiligungsgesellschaft mbH\nGesellschaft mit beschränkter Haftung\nBonn\n\nAls nicht eingetragen wird veröffentlicht: Den Gläubigern der Gesellschaft, deren Forderungen begründet worden sind bevor die Eintragung der Beendigung des Beherrschungs- und Ergebnisabführungsvertrages  in das Handelsregister nach § 10 des Handelsgesetzbuches als bekanntgemacht gilt, hat der andere Vertragsteil Sicherheit zu leisten, wenn sie sich binnen sechs Monaten nach der Bekanntmachung der Eintragung zu diesem Zweck bei ihm melden."
    },
    {
      "date": "2025-01-30",
      "id": "100107",
      "original_text": "Einreichung neuer Dokumente\nNordrhein-Westfalen Amtsgericht Düsseldorf HRB 3466\nStadtwerke Düsseldorf AG – Düsseldorf",
      "type": "Einreichung neuer Dokumente",
      "state": "Nordrhein-Westfalen",
      "amtsgericht": "Amtsgericht Düsseldorf",
      "registernummer": "HRB 3466",
      "registerart": "HRB",
      "company_name": "Stadtwerke Düsseldorf AG",
      "company_seat": "Düsseldorf",
      "details": "30.01.2025 (Bekanntmachungsdatum)\n\nNordrhein-Westfalen Amtsgericht Düsseldorf HRB 3466\nEinreichung neuer Dokumente\n\nStadtwerke Düsseldorf AG\nAktiengesellschaft\nDüsseldorf\n\nDem Registergericht ist eine Liste der Mitglieder des Aufsichtsrates eingereicht worden."
    },
    {
      "date": "2025-01-30",
      "id": "100108",
      "original_text": "Einreichung neuer Dokumente\nNordrhein-Westfalen Amtsgericht Dortmund HRB 17965 früher Amtsgericht Lünen\nfutec AG Agentur und Verlag – Dortmund",
      "type": "Einreichung neuer Dokumente",
      "state": "Nordrhein-Westfalen",
      "amtsgericht": "Amtsgericht Dortmund",
      "registernummer": "HRB 17965",
      "registerart": "HRB",
      "company_name": "futec AG Agentur und Verlag",
      "company_seat": "Dortmund",
      "former_amtsgericht": "Lünen",
      "details": "30.01.2025 (Bekanntmachungsdatum)\n\nNordrhein-Westfalen Amtsgericht Dortmund HRB 17965 früher Amtsgericht Lünen\nEinreichung neuer Dokumente\n\nfutec AG Agentur und Verlag\nAktiengesellschaft\nDortmund\n\nDem Registergericht ist eine neue Liste der Mitglieder des Aufsichtsrates eingereicht worden."
    },
    {
      "date": "2025-01-30",
      "id": "100109",
      "original_text": "Registerbekanntmachung nach dem Umwandlungsgesetz\nNordrhein-Westfalen Amtsgericht Arnsberg HRA 9283\nBüroservice Lehwark & Hartmann GmbH & Co. KG – Medebach",
      "type": "Registerbekanntmachung nach dem Umwandlungsgesetz",
      "state": "Nordrhein-Westfalen",
      "amtsgericht": "Amtsgericht Arnsberg",
      "registernummer": "HRA 9283",
      "registerart": "HRA",
      "company_name": "Büroservice Lehwark & Hartmann GmbH & Co. KG",
      "company_seat": "Medebach",
      "details": "30.01.2025 (Bekanntmachungsdatum)\n\nNordrhein-Westfalen Amtsgericht Arnsberg HRA 9283\nRegisterbekanntmachung nach dem Umwandlungsgesetz 30.01.2025 (Eintragungsdatum)\n\nBüroservice Lehwark & Hartmann GmbH & Co. KG\nKommanditgesellschaft\nMedebach\n\nDen Gläubigern der an der Ausgliederung beteiligten Rechtsträger ist, wenn sie binnen sechs Monaten nach dem Tag, an dem die Eintragung der Ausgliederung in das Register des Sitzes desjenigen Rechtsträgers, dessen Gläubiger sie sind, nach § 19 Absatz 3 UmwG als bekanntgemacht gilt, ihren Anspruch nach Grund und Höhe schriftlich anmelden, Sicherheit zu leisten, soweit sie nicht Befriedigung verlangen können. Dieses Recht steht den Gläubigern jedoch nur zu, wenn sie glaubhaft machen, dass durch die Ausgliederung die Erfüllung ihrer Forderung gefährdet wird."
    },
    {
      "date": "2025-01-30",
      "id": "100110",
      "original_text": "Registerbekanntmachung nach dem Umwandlungsgesetz\nNordrhein-Westfalen Amtsgericht Hagen HRB 11866\nTatmetics UG (haftungsbeschränkt) – Schwerte",
      "type": "Registerbekanntmachung nach dem Umwandlungsgesetz",
      "state": "Nordrhein-Westfalen",
      "amtsgericht": "Amtsgericht Hagen",
      "registernummer": "HRB 11866",
      "registerart": "HRB",
      "company_name": "Tatmetics UG (haftungsbeschränkt)",
      "company_seat": "Schwerte",
      "details": "30.01.2025 (Bekanntmachungsdatum)\n\nNordrhein-Westfalen Amtsgericht Hagen HRB 11866\nRegisterbekanntmachung nach dem Umwandlungsgesetz 30.01.2025 (Eintragungsdatum)\n\nTatmetics UG (haftungsbeschränkt)\nGesellschaft mit beschränkter Haftung\nSchwerte\n\nDen Gläubigern der an der Verschmelzung beteiligten Rechtsträger ist, wenn sie binnen sechs Monaten nach dem Tag, an dem die Eintragung der Verschmelzung in das Register des Sitzes desjenigen Rechtsträgers, dessen Gläubiger sie sind, nach § 19 Abs. 3 UmwG als bekannt gemacht gilt, ihren Anspruch nach Grund und Höhe schriftlich anmelden, Sicherheit zu leisten, soweit sie nicht Befriedigung verlangen können. Dieses Recht steht ihnen jedoch nur zu, wenn sie glaubhaft machen, dass durch die Verschmelzung die Erfüllung ihrer Forderung gefährdet wird."
    },
    {
      "date": "2025-01-30",
      "id": "100111",
      "original_text": "Einreichung neuer Dokumente\nNordrhein-Westfalen Amtsgericht Bad Oeynhausen HRB 9336\nAufbaugemeinschaft Espelkamp Gesellschaft m.b.H. – Espelkamp",
      "type": "Einreichung neuer Dokumente",
      "state": "Nordrhein-Westfalen",
      "amtsgericht": "Amtsgericht Bad Oeynhausen",
      "registernummer": "HRB 9336",
      "registerart": "HRB",
      "company_name": "Aufbaugemeinschaft Espelkamp Gesellschaft m.b.H.",
      "company_seat": "Espelkamp",
      "details": "30.01.2025 (Bekanntmachungsdatum)\n\nNordrhein-Westfalen Amtsgericht Bad Oeynhausen HRB 9336\nEinreichung neuer Dokumente\n\nAufbaugemeinschaft Espelkamp Gesellschaft m.b.H.\nGesellschaft mit beschränkter Haftung\nEspelkamp\n\nDem Registergericht ist eine neue Liste der Mitglieder des Aufsichtsrates eingereicht worden."
    },
    {
      "date": "2025-01-30",
      "id": "100112",
      "original_text": "Einreichung neuer Dokumente\nThüringen Amtsgericht Jena HRB 511554\nPräzisionstechnik Resources Altenburg GmbH – Altenburg",
      "type": "Einreichung neuer Dokumente",
      "state": "Thüringen",
      "amtsgericht": "Amtsgericht Jena",
      "registernummer": "HRB 511554",
      "registerart": "HRB",
      "company_name": "Präzisionstechnik Resources Altenburg GmbH",
      "company_seat": "Altenburg",
      "details": "30.01.2025 (Bekanntmachungsdatum)\n\nThüringen Amtsgericht Jena HRB 511554\nEinreichung neuer Dokumente 30.01.2025 (Eintragungsdatum)\n\nPräzisionstechnik Resources Altenburg GmbH\nGesellschaft mit beschränkter Haftung\nAltenburg\n\nNicht eingetragen: Den Gläubigern der Gesellschaft, deren Forderungen begründet worden sind, bevor die Eintragung der Beendigung des Vertrages in das Handelsregister nach § 10 des Handelsgesetzbuches als bekanntgemacht gilt, hat der andere Vertragsteil Sicherheit zu leisten, wenn sie sich binnen sechs Monaten nach der Bekanntmachung der Eintragung zu diesem Zweck bei ihm melden."
    },
    {
      "date": "2025-01-30",
      "id": "100113",
      "original_text": "Sonstige Registerbekanntmachung\nThüringen Amtsgericht Jena HRB 201081\nWohnungsbaugesellschaft Bad Lobenstein mbH – Bad Lobenstein",
      "type": "Sonstige Registerbekanntmachung",
      "state": "Thüringen",
      "amtsgericht": "Amtsgericht Jena",
      "registernummer": "HRB 201081",
      "registerart": "HRB",
      "company_name": "Wohnungsbaugesellschaft Bad Lobenstein mbH",
      "company_seat": "Bad Lobenstein",
      "details": "30.01.2025 (Bekanntmachungsdatum)\n\nThüringen Amtsgericht Jena HRB 201081\nSonstige Registerbekanntmachung\n\nWohnungsbaugesellschaft Bad Lobenstein mbH\nGesellschaft mit beschränkter Haftung\nBad Lobenstein\n\nBekanntmachung gem. § 52 Abs. 3 Satz 2 GmbHG: Aufgrund einer Veränderung in den Personen der Aufsichtsratsmitglieder ist durch die Geschäftsführer eine neue Liste zum Handelsregister eingereicht worden."
    },
    {
      "date": "2025-01-30",
      "id": "100114",
      "original_text": "Einreichung neuer Dokumente\nThüringen Amtsgericht Jena HRB 111469\nImmobilienservice Weimar Gesellschaft mit beschränkter Haftung – Weimar",
      "type": "Einreichung neuer Dokumente",
      "state": "Thüringen",
      "amtsgericht": "Amtsgericht Jena",
      "registernummer": "HRB 111469",
      "registerart": "HRB",
      "company_name": "Immobilienservice Weimar Gesellschaft mit beschränkter Haftung",
      "company_seat": "Weimar",
      "details": "30.01.2025 (Bekanntmachungsdatum)\n\nThüringen Amtsgericht Jena HRB 111469\nEinreichung neuer Dokumente 21.01.2025 (Eintragungsdatum)\n\nImmobilienservice Weimar Gesellschaft mit beschränkter Haftung\nGesellschaft mit beschränkter Haftung\nWeimar\n\nBekanntmachung gem. § 52 Abs. 3 Satz 2 GmbHG: Aufgrund einer Veränderung in den Personen der Aufsichtsratsmitglieder ist durch die Geschäftsführer eine neue Liste zum Handelsregister eingereicht worden."
    },
    {
      "date": "2025-01-30",
      "id": "100115",
      "original_text": "Einreichung neuer Dokumente\nThüringen Amtsgericht Jena HRB 104979\nWeimarer Wohnstätte Gesellschaft mit beschränkter Haftung – Weimar",
      "type": "Einreichung neuer Dokumente",
      "state": "Thüringen",
      "amtsgericht": "Amtsgericht Jena",
      "registernummer": "HRB 104979",
      "registerart": "HRB",
      "company_name": "Weimarer Wohnstätte Gesellschaft mit beschränkter Haftung",
      "company_seat": "Weimar",
      "details": "30.01.2025 (Bekanntmachungsdatum)\n\nThüringen Amtsgericht Jena HRB 104979\nEinreichung neuer Dokumente 21.01.2025 (Eintragungsdatum)\n\nWeimarer Wohnstätte Gesellschaft mit beschränkter Haftung\nGesellschaft mit beschränkter Haftung\nWeimar\n\nBekanntmachung gem. § 52 Abs. 3 Satz 2 GmbHG: Aufgrund einer Veränderung in den Personen der Aufsichtsratsmitglieder ist durch die Geschäftsführer eine neue Liste zum Handelsregister eingereicht worden."
    },
    {
      "date": "2025-01-30",
      "id": "100116",
      "original_text": "Löschungsankündigung\nHessen Amtsgericht Offenbach am Main HRB 48629\nNiko Bau UG (haftungsbeschränkt) – Neu-Isenburg",
      "type": "Löschungsankündigung",
      "state": "Hessen",
      "amtsgericht": "Amtsgericht Offenbach am Main",
      "registernummer": "HRB 48629",
      "registerart": "HRB",
      "company_name": "Niko Bau UG (haftungsbeschränkt)",
      "company_seat": "Neu-Isenburg",
      "details": "30.01.2025 (Bekanntmachungsdatum)\n\nHessen Amtsgericht Offenbach am Main HRB 48629\nLöschungsankündigung\n\nNiko Bau UG (haftungsbeschränkt)\nGesellschaft mit beschränkter Haftung\nNeu-Isenburg\n\nDas Registergericht beabsichtigt die im Handelsregister eingetragene Gesellschaft von Amts wegen nach § 394 FamFG zu löschen. Die Frist zur Erhebung eines Widerspruchs gegen die beabsichtigte Löschung wird auf 3 Monate festgesetzt."
    },
    {
      "date": "2025-01-30",
      "id": "100117",
      "original_text": "Registerbekanntmachung nach dem Umwandlungsgesetz\nHessen Amtsgericht Frankfurt am Main HRB 131553\nCCare GmbH – Frankfurt am Main",
      "type": "Registerbekanntmachung nach dem Umwandlungsgesetz",
      "state": "Hessen",
      "amtsgericht": "Amtsgericht Frankfurt am Main",
      "registernummer": "HRB 131553",
      "registerart": "HRB",
      "company_name": "CCare GmbH",
      "company_seat": "Frankfurt am Main",
      "details": "30.01.2025 (Bekanntmachungsdatum)\n\nHessen Amtsgericht Frankfurt am Main HRB 131553\nRegisterbekanntmachung nach dem Umwandlungsgesetz 30.01.2025 (Eintragungsdatum)\n\nCCare GmbH\nGesellschaft mit beschränkter Haftung\nFrankfurt am Main\n\nDen Gläubigern der an der formwechselnden Umwandlung beteiligten Rechtsträger ist, wenn sie binnen sechs Monaten nach dem Tag, an dem die Eintragung der formwechselnden Umwandlung in das Register des Sitzes desjenigen Rechtsträgers, dessen Gläubiger sie sind, nach § 201 UmwG bekannt gemacht worden ist, ihren Anspruch nach Grund und Höhe schriftlich anmelden, Sicherheit zu leisten, soweit sie nicht Befriedigung verlangen können. Dieses Recht steht den Gläubigern jedoch nur zu, wenn sie glaubhaft machen, dass durch die formwechselnden Umwandlung die Erfüllung ihrer Forderung gefährdet wird."
    },
    {
      "date": "2025-01-30",
      "id": "100118",
      "original_text": "Registerbekanntmachung nach dem Umwandlungsgesetz\nHessen Amtsgericht Gießen HRB 8003\nCOS Computer GmbH – Pohlheim",
      "type": "Registerbekanntmachung nach dem Umwandlungsgesetz",
      "state": "Hessen",
      "amtsgericht": "Amtsgericht Gießen",
      "registernummer": "HRB 8003",
      "registerart": "HRB",
      "company_name": "COS Computer GmbH",
      "company_seat": "Pohlheim",
      "details": "30.01.2025 (Bekanntmachungsdatum)\n\nHessen Amtsgericht Gießen HRB 8003\nRegisterbekanntmachung nach dem Umwandlungsgesetz 30.01.2025 (Eintragungsdatum)\n\nCOS Computer GmbH\nGesellschaft mit beschränkter Haftung\nPohlheim\n\nDie Gesellschaft hat Gläubigern, deren Forderungen vor dieser Bekanntmachung begründet worden sind, Sicherheit zu leisten, soweit sie nicht Befriedigung verlangen können, wenn sie sich binnen sechs Monaten nach dieser Bekanntmachung zu diesem Zweck melden.\nDen Gläubigern der an der Verschmelzung beteiligten Rechtsträger ist, wenn sie binnen sechs Monaten nach dem Tag, an dem die Eintragung der Verschmelzung in das Register des Sitzes desjenigen Rechtsträgers, dessen Gläubiger sie sind, nach § 19 Absatz 3 UmwG bekannt gemacht worden ist, ihren Anspruch nach Grund und Höhe schriftlich anmelden, Sicherheit zu leisten, soweit sie nicht Befriedigung verlangen können. Dieses Recht steht den Gläubigern jedoch nur zu, wenn sie glaubhaft machen, dass durch die Verschmelzung die Erfüllung ihrer Forderung gefährdet wird."
    },
    {
      "date": "2025-01-30",
      "id": "100119",
      "original_text": "Löschungsankündigung\nHessen Amtsgericht Frankfurt am Main HRB 128049\nMAGY Trading & Consulting GmbH – Frankfurt am Main",
      "type": "Löschungsankündigung",
      "state": "Hessen",
      "amtsgericht": "Amtsgericht Frankfurt am Main",
      "registernummer": "HRB 128049",
      "registerart": "HRB",
      "company_name": "MAGY Trading & Consulting GmbH",
      "company_seat": "Frankfurt am Main",
      "details": "30.01.2025 (Bekanntmachungsdatum)\n\nHessen Amtsgericht Frankfurt am Main HRB 128049\nLöschungsankündigung\n\nMAGY Trading & Consulting GmbH\nGesellschaft mit beschränkter Haftung\nFrankfurt am Main\n\nDas Registergericht beabsichtigt die im Handelsregister eingetragene Gesellschaft von Amts wegen nach § 394 FamFG zu löschen. Die Frist zur Erhebung eines Widerspruchs gegen die beabsichtigte Löschung wird auf 1 Monat festgesetzt."
    },
    {
      "date": "2025-01-30",
      "id": "100120",
      "original_text": "Registerbekanntmachung nach dem Umwandlungsgesetz\nHessen Amtsgericht Frankfurt am Main HRA 54052\nCCare S.R.L. & Co. KG – Frankfurt am Main",
      "type": "Registerbekanntmachung nach dem Umwandlungsgesetz",
      "state": "Hessen",
      "amtsgericht": "Amtsgericht Frankfurt am Main",
      "registernummer": "HRA 54052",
      "registerart": "HRA",
      "company_name": "CCare S.R.L. & Co. KG",
      "company_seat": "Frankfurt am Main",
      "details": "30.01.2025 (Bekanntmachungsdatum)\n\nHessen Amtsgericht Frankfurt am Main HRA 54052\nRegisterbekanntmachung nach dem Umwandlungsgesetz 30.01.2025 (Eintragungsdatum)\n\nCCare S.R.L. & Co. KG\nKommanditgesellschaft\nFrankfurt am Main\n\nDen Gläubigern der an der formwechselnden Umwandlung beteiligten Rechtsträger ist, wenn sie binnen sechs Monaten nach dem Tag, an dem die Eintragung der formwechselnden Umwandlung in das Register des Sitzes desjenigen Rechtsträgers, dessen Gläubiger sie sind, nach § 201 UmwG bekannt gemacht worden ist, ihren Anspruch nach Grund und Höhe schriftlich anmelden, Sicherheit zu leisten, soweit sie nicht Befriedigung verlangen können. Dieses Recht steht den Gläubigern jedoch nur zu, wenn sie glaubhaft machen, dass durch die formwechselnden Umwandlung die Erfüllung ihrer Forderung gefährdet wird."
    },
    {
      "date": "2025-01-30",
      "id": "100121",
      "original_text": "Sonstige Registerbekanntmachung\nHessen Amtsgericht Wiesbaden VR 4508\nSängerkreis Untertaunus e.V. – Aarbergen-Kettenbach",
      "type": "Sonstige Registerbekanntmachung",
      "state": "Hessen",
      "amtsgericht": "Amtsgericht Wiesbaden",
      "registernummer": "VR 4508",
      "registerart": "VR",
      "company_name": "Sängerkreis Untertaunus e.V.",
      "company_seat": "Aarbergen-Kettenbach",
      "details": "30.01.2025 (Bekanntmachungsdatum)\n\nHessen Amtsgericht Wiesbaden VR 4508\nSonstige Registerbekanntmachung 30.01.2025 (Eintragungsdatum)\n\nSängerkreis Untertaunus e.V.\neingetragener Verein\nAarbergen-Kettenbach\n\nDer Verein ist aufgelöst."
    },
    {
      "date": "2025-01-30",
      "id": "100122",
      "original_text": "Löschungsankündigung\nHessen Amtsgericht Frankfurt am Main HRB 98716\nGermany Unblocked GmbH – Frankfurt am Main",
      "type": "Löschungsankündigung",
      "state": "Hessen",
      "amtsgericht": "Amtsgericht Frankfurt am Main",
      "registernummer": "HRB 98716",
      "registerart": "HRB",
      "company_name": "Germany Unblocked GmbH",
      "company_seat": "Frankfurt am Main",
      "details": "30.01.2025 (Bekanntmachungsdatum)\n\nHessen Amtsgericht Frankfurt am Main HRB 98716\nLöschungsankündigung\n\nGermany Unblocked GmbH\nGesellschaft mit beschränkter Haftung\nFrankfurt am Main\n\nDas Registergericht beabsichtigt die im Handelsregister eingetragene Gesellschaft von Amts wegen nach § 394 FamFG zu löschen. Die Frist zur Erhebung eines Widerspruchs gegen die beabsichtigte Löschung wird auf 1 Monat festgesetzt."
    },
    {
      "date": "2025-01-30",
      "id": "100123",
      "original_text": "Registerbekanntmachung nach dem Umwandlungsgesetz\nHessen Amtsgericht Marburg HRA 5438\nMarbaum OHG – Marburg",
      "type": "Registerbekanntmachung nach dem Umwandlungsgesetz",
      "state": "Hessen",
      "amtsgericht": "Amtsgericht Marburg",
      "registernummer": "HRA 5438",
      "registerart": "HRA",
      "company_name": "Marbaum OHG",
      "company_seat": "Marburg",
      "details": "30.01.2025 (Bekanntmachungsdatum)\n\nHessen Amtsgericht Marburg HRA 5438\nRegisterbekanntmachung nach dem Umwandlungsgesetz 30.01.2025 (Eintragungsdatum)\n\nMarbaum OHG\nOffene Handelsgesellschaft\nMarburg\n\nDen Gläubigern der an der #DV.UmF(Text=\"Bitte wählen Sie die zutreffende Art nach UmwG aus!\",Eingabe=\"Verschmelzung\",\"Aufspaltung\",\"Abspaltung\",\"Ausgliederung\",\"Vermögensübertragung\",\"formwechselnden Umwandlung\") beteiligten Rechtsträger ist, wenn sie binnen sechs Monaten nach dem Tag, an dem die Eintragung der #DV.UmF in das Register des Sitzes #DV.RTr(Text=\"Bitte wählen Sie aus, ob ein oder mehrere andere Rechtsträger betroffen sind!\",Eingabe=\"desjenigen Rechtsträgers, dessen Gläubiger\",\"derjenigen Rechtsträger deren Gläubiger\") sie sind, nach #DV.Auswahl(Text=\"Bitte wählen Sie die zutreffende Vorschrift aus!\",Eingabe=\"§ 19 Absatz 3 UmwG\"|\"§ 19 Absatz 3 UmwG (=Verschmelzung)\",\"§§ 122a Absatz 2, 19 Absatz 3 UmwG\"|\"§§ 122a Absatz 2, 19 Absatz 3 UmwG (=grenzüberschreitende Verschmelzung)\",\"§§ 125, 19 Absatz 3 UmwG\"|\"§§ 125, 19 Absatz 3 UmwG (=Spaltung)\",\"§ 201 UmwG\"|\"§ 201 UmwG (=Formwechsel)\",\"#insert(Text=\"Freitext\") UmwG\"|\"freie Eingabe\") bekannt gemacht worden ist, ihren Anspruch nach Grund und Höhe schriftlich anmelden, Sicherheit zu leisten, soweit sie nicht Befriedigung verlangen können. Dieses Recht steht den Gläubigern jedoch nur zu, wenn sie glaubhaft machen, dass durch die #DV.UmF die Erfüllung ihrer Forderung gefährdet wird."
    },
    {
      "date": "2025-01-30",
      "id": "100124",
      "original_text": "Registerbekanntmachung nach dem Umwandlungsgesetz\nHessen Amtsgericht Marburg HRA 5438\nMarbaum OHG – Marburg",
      "type": "Registerbekanntmachung nach dem Umwandlungsgesetz",
      "state": "Hessen",
      "amtsgericht": "Amtsgericht Marburg",
      "registernummer": "HRA 5438",
      "registerart": "HRA",
      "company_name": "Marbaum OHG",
      "company_seat": "Marburg",
      "details": "30.01.2025 (Bekanntmachungsdatum)\n\nHessen Amtsgericht Marburg HRA 5438\nRegisterbekanntmachung nach dem Umwandlungsgesetz 30.01.2025 (Eintragungsdatum)\n\nMarbaum OHG\nOffene Handelsgesellschaft\nMarburg\n\nDen Gläubigern der an der formwechselnden Umwandlung beteiligten Rechtsträger ist, wenn sie binnen sechs Monaten nach dem Tag, an dem die Eintragung der formwechselnden Umwandlung in das Register des Sitzes desjenigen Rechtsträgers, dessen Gläubiger sie sind, nach § 201 UmwG bekannt gemacht worden ist, ihren Anspruch nach Grund und Höhe schriftlich anmelden, Sicherheit zu leisten, soweit sie nicht Befriedigung verlangen können. Dieses Recht steht den Gläubigern jedoch nur zu, wenn sie glaubhaft machen, dass durch die formwechselnden Umwandlung die Erfüllung ihrer Forderung gefährdet wird."
    },
    {
      "date": "2025-01-30",
      "id": "100125",
      "original_text": "Löschungsankündigung\nHessen Amtsgericht Offenbach am Main HRB 51969\nM&G LOGISTICS GmbH – Neu-Isenburg",
      "type": "Löschungsankündigung",
      "state": "Hessen",
      "amtsgericht": "Amtsgericht Offenbach am Main",
      "registernummer": "HRB 51969",
      "registerart": "HRB",
      "company_name": "M&G LOGISTICS GmbH",
      "company_seat": "Neu-Isenburg",
      "details": "30.01.2025 (Bekanntmachungsdatum)\n\nHessen Amtsgericht Offenbach am Main HRB 51969\nLöschungsankündigung\n\nM&G LOGISTICS GmbH\nGesellschaft mit beschränkter Haftung\nNeu-Isenburg\n\nDas Registergericht beabsichtigt die im Handelsregister eingetragene Gesellschaft von Amts wegen nach § 394 FamFG zu löschen. Die Frist zur Erhebung eines Widerspruchs gegen die beabsichtigte Löschung wird auf 3 Monate festgesetzt."
    },
    {
      "date": "2025-01-30",
      "id": "100126",
      "original_text": "Löschungsankündigung\nHessen Amtsgericht Offenbach am Main HRB 34955\nAMB Bau GmbH – Langen (Hessen)",
      "type": "Löschungsankündigung",
      "state": "Hessen",
      "amtsgericht": "Amtsgericht Offenbach am Main",
      "registernummer": "HRB 34955",
      "registerart": "HRB",
      "company_name": "AMB Bau GmbH",
      "company_seat": "Langen (Hessen)",
      "details": "30.01.2025 (Bekanntmachungsdatum)\n\nHessen Amtsgericht Offenbach am Main HRB 34955\nLöschungsankündigung\n\nAMB Bau GmbH\nGesellschaft mit beschränkter Haftung\nLangen (Hessen)\n\nDas Registergericht beabsichtigt die im Handelsregister eingetragene Gesellschaft von Amts wegen nach § 394 FamFG zu löschen. Die Frist zur Erhebung eines Widerspruchs gegen die beabsichtigte Löschung wird auf 3 Monate festgesetzt."
    },
    {
      "date": "2025-01-30",
      "id": "100127",
      "original_text": "Löschungsankündigung\nHessen Amtsgericht Offenbach am Main HRB 51455\nBridgeHeadBurg GmbH – Neu-Isenburg",
      "type": "Löschungsankündigung",
      "state": "Hessen",
      "amtsgericht": "Amtsgericht Offenbach am Main",
      "registernummer": "HRB 51455",
      "registerart": "HRB",
      "company_name": "BridgeHeadBurg GmbH",
      "company_seat": "Neu-Isenburg",
      "details": "30.01.2025 (Bekanntmachungsdatum)\n\nHessen Amtsgericht Offenbach am Main HRB 51455\nLöschungsankündigung\n\nBridgeHeadBurg GmbH\nGesellschaft mit beschränkter Haftung\nNeu-Isenburg\n\nDas Registergericht beabsichtigt die im Handelsregister eingetragene Gesellschaft von Amts wegen nach § 394 FamFG zu löschen. Die Frist zur Erhebung eines Widerspruchs gegen die beabsichtigte Löschung wird auf 3 Monate festgesetzt."
    },
    {
      "date": "2025-01-30",
      "id": "100128",
      "original_text": "Löschungsankündigung\nHessen Amtsgericht Offenbach am Main HRB 47599\nAdela Shoes GmbH – Dreieich",
      "type": "Löschungsankündigung",
      "state": "Hessen",
      "amtsgericht": "Amtsgericht Offenbach am Main",
      "registernummer": "HRB 47599",
      "registerart": "HRB",
      "company_name": "Adela Shoes GmbH",
      "company_seat": "Dreieich",
      "details": "30.01.2025 (Bekanntmachungsdatum)\n\nHessen Amtsgericht Offenbach am Main HRB 47599\nLöschungsankündigung\n\nAdela Shoes GmbH\nGesellschaft mit beschränkter Haftung\nDreieich\n\nDas Registergericht beabsichtigt die im Handelsregister eingetragene Gesellschaft von Amts wegen nach § 394 FamFG zu löschen. Die Frist zur Erhebung eines Widerspruchs gegen die beabsichtigte Löschung wird auf 3 Monate festgesetzt."
    },
    {
      "date": "2025-01-30",
      "id": "100129",
      "original_text": "Löschungsankündigung\nHessen Amtsgericht Frankfurt am Main HRB 96048\nRimgo GmbH – Frankfurt am Main",
      "type": "Löschungsankündigung",
      "state": "Hessen",
      "amtsgericht": "Amtsgericht Frankfurt am Main",
      "registernummer": "HRB 96048",
      "registerart": "HRB",
      "company_name": "Rimgo GmbH",
      "company_seat": "Frankfurt am Main",
      "details": "30.01.2025 (Bekanntmachungsdatum)\n\nHessen Amtsgericht Frankfurt am Main HRB 96048\nLöschungsankündigung\n\nRimgo GmbH\nGesellschaft mit beschränkter Haftung\nFrankfurt am Main\n\nDas Registergericht beabsichtigt die im Handelsregister eingetragene Gesellschaft von Amts wegen nach § 394 FamFG zu löschen. Die Frist zur Erhebung eines Widerspruchs gegen die beabsichtigte Löschung wird auf 1 Monat festgesetzt."
    },
    {
      "date": "2025-01-30",
      "id": "100130",
      "original_text": "Sonstige Registerbekanntmachung\nHessen Amtsgericht Darmstadt VR 70563\nGolf- und Landclub Buchenhof-Hetzbach e.V. – Oberzent",
      "type": "Sonstige Registerbekanntmachung",
      "state": "Hessen",
      "amtsgericht": "Amtsgericht Darmstadt",
      "registernummer": "VR 70563",
      "registerart": "VR",
      "company_name": "Golf- und Landclub Buchenhof-Hetzbach e.V.",
      "company_seat": "Oberzent",
      "details": "30.01.2025 (Bekanntmachungsdatum)\n\nHessen Amtsgericht Darmstadt VR 70563\nSonstige Registerbekanntmachung 30.01.2025 (Eintragungsdatum)\n\nGolf- und Landclub Buchenhof-Hetzbach e.V.\neingetragener Verein\nOberzent\n\nDer Verein ist aufgelöst."
    },
    {
      "date": "2025-01-30",
      "id": "100131",
      "original_text": "Sonstige Registerbekanntmachung\nHessen Amtsgericht Bad Hersfeld VR 459\nFörderkreis Museum e.V. – Bad Hersfeld",
      "type": "Sonstige Registerbekanntmachung",
      "state": "Hessen",
      "amtsgericht": "Amtsgericht Bad Hersfeld",
      "registernummer": "VR 459",
      "registerart": "VR",
      "company_name": "Förderkreis Museum e.V.",
      "company_seat": "Bad Hersfeld",
      "details": "30.01.2025 (Bekanntmachungsdatum)\n\nHessen Amtsgericht Bad Hersfeld VR 459\nSonstige Registerbekanntmachung 29.01.2025 (Eintragungsdatum)\n\nFörderkreis Museum e.V.\neingetragener Verein\nBad Hersfeld\n\nDer Verein ist aufgelöst."
    },
    {
      "date": "2025-01-30",
      "id": "100132",
      "original_text": "Löschungsankündigung\nHessen Amtsgericht Offenbach am Main HRB 49169\nML Main-Ausbau UG (haftungsbeschränkt) – Dietzenbach",
      "type": "Löschungsankündigung",
      "state": "Hessen",
      "amtsgericht": "Amtsgericht Offenbach am Main",
      "registernummer": "HRB 49169",
      "registerart": "HRB",
      "company_name": "ML Main-Ausbau UG (haftungsbeschränkt)",
      "company_seat": "Dietzenbach",
      "details": "30.01.2025 (Bekanntmachungsdatum)\n\nHessen Amtsgericht Offenbach am Main HRB 49169\nLöschungsankündigung\n\nML Main-Ausbau UG (haftungsbeschränkt)\nGesellschaft mit beschränkter Haftung\nDietzenbach\n\nDas Registergericht beabsichtigt die im Handelsregister eingetragene Gesellschaft von Amts wegen nach § 394 FamFG zu löschen. Die Frist zur Erhebung eines Widerspruchs gegen die beabsichtigte Löschung wird auf 3 Monate festgesetzt."
    },
    {
      "date": "2025-01-30",
      "id": "99966",
      "original_text": "Registerbekanntmachung nach dem Umwandlungsgesetz\nBayern Amtsgericht München HRB 86864\nIDG Communications Media Aktiengesellschaft – München",
      "type": "Registerbekanntmachung nach dem Umwandlungsgesetz",
      "state": "Bayern",
      "amtsgericht": "Amtsgericht München",
      "registernummer": "HRB 86864",
      "registerart": "HRB",
      "company_name": "IDG Communications Media Aktiengesellschaft",
      "company_seat": "München",
      "details": "30.01.2025 (Bekanntmachungsdatum)\n\nBayern Amtsgericht München HRB 86864\nRegisterbekanntmachung nach dem Umwandlungsgesetz 29.01.2025 (Eintragungsdatum)\n\nIDG Communications Media Aktiengesellschaft\nAktiengesellschaft\nMünchen\n\nDen Gläubigern des formwechselnden Rechtsträgers ist, wenn sie binnen sechs Monaten nach dem Tag, an dem die Eintragung des Formwechsels nach § 201 UmwG als bekannt gemacht gilt, ihren Anspruch nach Grund und Höhe in Textform anmelden, Sicherheit zu leisten, soweit sie nicht Befriedigung verlangen können. Dieses Recht steht den Gläubigern jedoch nur zu, wenn sie glaubhaft machen, dass durch den Formwechsel die Erfüllung ihrer Forderung gefährdet wird."
    },
    {
      "date": "2025-01-30",
      "id": "99967",
      "original_text": "Registerbekanntmachung nach dem Umwandlungsgesetz\nBayern Amtsgericht München HRB 204655\nAURELIUS Services Holding GmbH – München",
      "type": "Registerbekanntmachung nach dem Umwandlungsgesetz",
      "state": "Bayern",
      "amtsgericht": "Amtsgericht München",
      "registernummer": "HRB 204655",
      "registerart": "HRB",
      "company_name": "AURELIUS Services Holding GmbH",
      "company_seat": "München",
      "details": "30.01.2025 (Bekanntmachungsdatum)\n\nBayern Amtsgericht München HRB 204655\nRegisterbekanntmachung nach dem Umwandlungsgesetz 29.01.2025 (Eintragungsdatum)\n\nAURELIUS Services Holding GmbH\nGesellschaft mit beschränkter Haftung\nMünchen\n\nDen Gläubigern der an der Verschmelzung beteiligten Rechtsträger ist, wenn sie binnen sechs Monaten nach dem Tag, an dem die Eintragung der Verschmelzung in das Register des Sitzes desjenigen Rechtsträgers, dessen Gläubiger sie sind, nach § 19 Abs. 3 UmwG als bekannt gemacht gilt, ihren Anspruch nach Grund und Höhe in Textform anmelden, Sicherheit zu leisten, soweit sie nicht Befriedigung verlangen können. Dieses Recht steht den Gläubigern jedoch nur zu, wenn sie glaubhaft machen, dass durch die Verschmelzung die Erfüllung ihrer Forderung gefährdet wird."
    },
    {
      "date": "2025-01-30",
      "id": "99968",
      "original_text": "Registerbekanntmachung nach dem Umwandlungsgesetz\nBayern Amtsgericht München HRB 254963\nFressnapf Markt Schwaben GmbH – Markt Schwaben",
      "type": "Registerbekanntmachung nach dem Umwandlungsgesetz",
      "state": "Bayern",
      "amtsgericht": "Amtsgericht München",
      "registernummer": "HRB 254963",
      "registerart": "HRB",
      "company_name": "Fressnapf Markt Schwaben GmbH",
      "company_seat": "Markt Schwaben",
      "details": "30.01.2025 (Bekanntmachungsdatum)\n\nBayern Amtsgericht München HRB 254963\nRegisterbekanntmachung nach dem Umwandlungsgesetz 29.01.2025 (Eintragungsdatum)\n\nFressnapf Markt Schwaben GmbH\nGesellschaft mit beschränkter Haftung\nMarkt Schwaben\n\nDen Gläubigern der an der Verschmelzung beteiligten Rechtsträger ist, wenn sie binnen sechs Monaten nach dem Tag, an dem die Eintragung der Verschmelzung in das Register des Sitzes desjenigen Rechtsträgers, dessen Gläubiger sie sind, nach § 19 Abs. 3 UmwG als bekannt gemacht gilt, ihren Anspruch nach Grund und Höhe in Textform anmelden, Sicherheit zu leisten, soweit sie nicht Befriedigung verlangen können. Dieses Recht steht den Gläubigern jedoch nur zu, wenn sie glaubhaft machen, dass durch die Verschmelzung die Erfüllung ihrer Forderung gefährdet wird."
    },
    {
      "date": "2025-01-30",
      "id": "99969",
      "original_text": "Löschungsankündigung\nBayern Amtsgericht Würzburg HRB 16550\nIMA GmbH – Würzburg",
      "type": "Löschungsankündigung",
      "state": "Bayern",
      "amtsgericht": "Amtsgericht Würzburg",
      "registernummer": "HRB 16550",
      "registerart": "HRB",
      "company_name": "IMA GmbH",
      "company_seat": "Würzburg",
      "details": "30.01.2025 (Bekanntmachungsdatum)\n\nBayern Amtsgericht Würzburg HRB 16550\nLöschungsankündigung\n\nIMA GmbH\nGesellschaft mit beschränkter Haftung\nWürzburg\n\nDas Registergericht beabsichtigt, die im Handelsregister eingetragene Gesellschaft wegen Vermögenslosigkeit von Amts wegen nach § 394 FamFG zu löschen. Die Frist zur Erhebung eines Widerspruchs ist auf drei Monate festgesetzt."
    },
    {
      "date": "2025-01-30",
      "id": "99970",
      "original_text": "Löschungsankündigung\nBayern Amtsgericht Würzburg HRB 4398\nPVG Planungs- + Vertriebs- Gesellschaft mbH – Würzburg",
      "type": "Löschungsankündigung",
      "state": "Bayern",
      "amtsgericht": "Amtsgericht Würzburg",
      "registernummer": "HRB 4398",
      "registerart": "HRB",
      "company_name": "PVG Planungs- + Vertriebs- Gesellschaft mbH",
      "company_seat": "Würzburg",
      "details": "30.01.2025 (Bekanntmachungsdatum)\n\nBayern Amtsgericht Würzburg HRB 4398\nLöschungsankündigung\n\nPVG Planungs- + Vertriebs- Gesellschaft mbH\nGesellschaft mit beschränkter Haftung\nWürzburg\n\nDas Registergericht beabsichtigt, die im Handelsregister eingetragene Gesellschaft wegen Vermögenslosigkeit von Amts wegen nach § 394 FamFG zu löschen. Die Frist zur Erhebung eines Widerspruchs ist auf drei Monate festgesetzt."
    },
    {
      "date": "2025-01-30",
      "id": "99971",
      "original_text": "Registerbekanntmachung nach dem Umwandlungsgesetz\nBayern Amtsgericht München HRB 254900\nFressnapf Freising GmbH – Freising",
      "type": "Registerbekanntmachung nach dem Umwandlungsgesetz",
      "state": "Bayern",
      "amtsgericht": "Amtsgericht München",
      "registernummer": "HRB 254900",
      "registerart": "HRB",
      "company_name": "Fressnapf Freising GmbH",
      "company_seat": "Freising",
      "details": "30.01.2025 (Bekanntmachungsdatum)\n\nBayern Amtsgericht München HRB 254900\nRegisterbekanntmachung nach dem Umwandlungsgesetz 29.01.2025 (Eintragungsdatum)\n\nFressnapf Freising GmbH\nGesellschaft mit beschränkter Haftung\nFreising\n\nDen Gläubigern der an der Verschmelzung beteiligten Rechtsträger ist, wenn sie binnen sechs Monaten nach dem Tag, an dem die Eintragung der Verschmelzung in das Register des Sitzes desjenigen Rechtsträgers, dessen Gläubiger sie sind, nach § 19 Abs. 3 UmwG als bekannt gemacht gilt, ihren Anspruch nach Grund und Höhe in Textform anmelden, Sicherheit zu leisten, soweit sie nicht Befriedigung verlangen können. Dieses Recht steht den Gläubigern jedoch nur zu, wenn sie glaubhaft machen, dass durch die Verschmelzung die Erfüllung ihrer Forderung gefährdet wird."
    },
    {
      "date": "2025-01-30",
      "id": "99972",
      "original_text": "Registerbekanntmachung nach dem Umwandlungsgesetz\nBayern Amtsgericht Kempten (Allgäu) HRB 17400\nLiplex Holding GmbH – Kaufbeuren",
      "type": "Registerbekanntmachung nach dem Umwandlungsgesetz",
      "state": "Bayern",
      "amtsgericht": "Amtsgericht Kempten (Allgäu)",
      "registernummer": "HRB 17400",
      "registerart": "HRB",
      "company_name": "Liplex Holding GmbH",
      "company_seat": "Kaufbeuren",
      "details": "30.01.2025 (Bekanntmachungsdatum)\n\nBayern Amtsgericht Kempten (Allgäu) HRB 17400\nRegisterbekanntmachung nach dem Umwandlungsgesetz 29.01.2025 (Eintragungsdatum)\n\nLiplex Holding GmbH\nGesellschaft mit beschränkter Haftung\nKaufbeuren\n\nDen Gläubigern der an der Verschmelzung beteiligten Rechtsträger ist, wenn sie binnen sechs Monaten nach dem Tag, an dem die Eintragung der Verschmelzung in das Register des Sitzes desjenigen Rechtsträgers, dessen Gläubiger sie sind, nach § 19 Abs. 3 UmwG als bekannt gemacht gilt, ihren Anspruch nach Grund und Höhe in Textform anmelden, Sicherheit zu leisten, soweit sie nicht Befriedigung verlangen können. Dieses Recht steht den Gläubigern jedoch nur zu, wenn sie glaubhaft machen, dass durch die Verschmelzung die Erfüllung ihrer Forderung gefährdet wird."
    },
    {
      "date": "2025-01-30",
      "id": "99973",
      "original_text": "Sonstige Registerbekanntmachung\nBayern Amtsgericht München HRB 236560\nDornier No Limits GmbH – München",
      "type": "Sonstige Registerbekanntmachung",
      "state": "Bayern",
      "amtsgericht": "Amtsgericht München",
      "registernummer": "HRB 236560",
      "registerart": "HRB",
      "company_name": "Dornier No Limits GmbH",
      "company_seat": "München",
      "details": "30.01.2025 (Bekanntmachungsdatum)\n\nBayern Amtsgericht München HRB 236560\nSonstige Registerbekanntmachung 29.01.2025 (Eintragungsdatum)\n\nDornier No Limits GmbH\nGesellschaft mit beschränkter Haftung\nMünchen\n\nDen Gläubigern der Gesellschaft, deren Forderungen begründet worden sind, bevor die Eintragung der Beendigung des Beherrschungs- und Gewinnabführungsvertrages in das Handelsregister nach § 10 des Handelsgesetzbuches als bekanntgemacht gilt, hat der andere Vertragsteil Sicherheit zu leisten, wenn sie sich binnen sechs Monaten nach der Bekanntmachung der Eintragung zu diesem Zweck bei ihm melden."
    },
    {
      "date": "2025-01-30",
      "id": "99974",
      "original_text": "Registerbekanntmachung nach dem Umwandlungsgesetz\nBayern Amtsgericht Augsburg GsR 233\nLucas Bernhard und Tobias Huber, Sleepy Mole Games eGbR – Augsburg",
      "type": "Registerbekanntmachung nach dem Umwandlungsgesetz",
      "state": "Bayern",
      "amtsgericht": "Amtsgericht Augsburg",
      "registernummer": "GsR 233",
      "registerart": "GsR",
      "company_name": "Lucas Bernhard und Tobias Huber, Sleepy Mole Games eGbR",
      "company_seat": "Augsburg",
      "details": "30.01.2025 (Bekanntmachungsdatum)\n\nBayern Amtsgericht Augsburg GsR 233\nRegisterbekanntmachung nach dem Umwandlungsgesetz 29.01.2025 (Eintragungsdatum)\n\nLucas Bernhard und Tobias Huber, Sleepy Mole Games eGbR\nGesellschaft bürgerlichen Rechts\nAugsburg\n\nDen Gläubigern des formwechselnden Rechtsträgers ist, wenn sie binnen sechs Monaten nach dem Tag, an dem die Eintragung des Formwechsels nach § 201 UmwG als bekannt gemacht gilt, ihren Anspruch nach Grund und Höhe in Textform anmelden, Sicherheit zu leisten, soweit sie nicht Befriedigung verlangen können. Dieses Recht steht den Gläubigern jedoch nur zu, wenn sie glaubhaft machen, dass durch den Formwechsel die Erfüllung ihrer Forderung gefährdet wird."
    },
    {
      "date": "2025-01-30",
      "id": "99975",
      "original_text": "Löschungsankündigung\nBayern Amtsgericht München HRB 198988\nTimeless Projects GmbH – München",
      "type": "Löschungsankündigung",
      "state": "Bayern",
      "amtsgericht": "Amtsgericht München",
      "registernummer": "HRB 198988",
      "registerart": "HRB",
      "company_name": "Timeless Projects GmbH",
      "company_seat": "München",
      "details": "30.01.2025 (Bekanntmachungsdatum)\n\nBayern Amtsgericht München HRB 198988\nLöschungsankündigung\n\nTimeless Projects GmbH\nGesellschaft mit beschränkter Haftung\nMünchen\n\nDas Registergericht beabsichtigt, die im Handelsregister eingetragene Gesellschaft wegen Vermögenslosigkeit von Amts wegen nach § 394 FamFG zu löschen. Die Frist zur Erhebung eines Widerspruchs ist auf drei Monate festgesetzt."
    },
    {
      "date": "2025-01-30",
      "id": "99976",
      "original_text": "Löschungsankündigung\nBayern Amtsgericht Amberg HRB 5750\nJMG CRANES Deutschland GmbH – Nabburg",
      "type": "Löschungsankündigung",
      "state": "Bayern",
      "amtsgericht": "Amtsgericht Amberg",
      "registernummer": "HRB 5750",
      "registerart": "HRB",
      "company_name": "JMG CRANES Deutschland GmbH",
      "company_seat": "Nabburg",
      "details": "30.01.2025 (Bekanntmachungsdatum)\n\nBayern Amtsgericht Amberg HRB 5750\nLöschungsankündigung\n\nJMG CRANES Deutschland GmbH\nGesellschaft mit beschränkter Haftung\nNabburg\n\nDas Registergericht beabsichtigt, die im Handelsregister eingetragene Gesellschaft wegen Vermögenslosigkeit von Amts wegen nach § 394 FamFG zu löschen. Die Frist zur Erhebung eines Widerspruchs ist auf sechs Wochen festgesetzt."
    },
    {
      "date": "2025-01-30",
      "id": "99977",
      "original_text": "Löschungsankündigung\nBayern Amtsgericht Nürnberg HRB 26436\nH K Haus Komplett GmbH – Nürnberg",
      "type": "Löschungsankündigung",
      "state": "Bayern",
      "amtsgericht": "Amtsgericht Nürnberg",
      "registernummer": "HRB 26436",
      "registerart": "HRB",
      "company_name": "H K Haus Komplett GmbH",
      "company_seat": "Nürnberg",
      "details": "30.01.2025 (Bekanntmachungsdatum)\n\nBayern Amtsgericht Nürnberg HRB 26436\nLöschungsankündigung\n\nH K Haus Komplett GmbH\nGesellschaft mit beschränkter Haftung\nNürnberg\n\nDas Registergericht beabsichtigt, die im Handelsregister eingetragene Gesellschaft wegen Vermögenslosigkeit von Amts wegen nach § 394 FamFG zu löschen. Die Frist zur Erhebung eines Widerspruchs ist auf einen Monat festgesetzt."
    },
    {
      "date": "2025-01-30",
      "id": "99978",
      "original_text": "Löschungsankündigung\nBayern Amtsgericht Nürnberg HRB 26436\nH K Haus Komplett GmbH – Nürnberg",
      "type": "Löschungsankündigung",
      "state": "Bayern",
      "amtsgericht": "Amtsgericht Nürnberg",
      "registernummer": "HRB 26436",
      "registerart": "HRB",
      "company_name": "H K Haus Komplett GmbH",
      "company_seat": "Nürnberg",
      "details": "30.01.2025 (Bekanntmachungsdatum)\n\nBayern Amtsgericht Nürnberg HRB 26436\nLöschungsankündigung\n\nH K Haus Komplett GmbH\nGesellschaft mit beschränkter Haftung\nNürnberg\n\nDas Registergericht beabsichtigt, die im Handelsregister eingetragene Gesellschaft wegen Vermögenslosigkeit von Amts wegen nach § 394 FamFG zu löschen. Die Frist zur Erhebung eines Widerspruchs ist auf einen Monat festgesetzt."
    },
    {
      "date": "2025-01-30",
      "id": "99979",
      "original_text": "Löschungsankündigung\nBayern Amtsgericht Nürnberg HRB 31183\nW T C GmbH – Nürnberg",
      "type": "Löschungsankündigung",
      "state": "Bayern",
      "amtsgericht": "Amtsgericht Nürnberg",
      "registernummer": "HRB 31183",
      "registerart": "HRB",
      "company_name": "W T C GmbH",
      "company_seat": "Nürnberg",
      "details": "30.01.2025 (Bekanntmachungsdatum)\n\nBayern Amtsgericht Nürnberg HRB 31183\nLöschungsankündigung\n\nW T C GmbH\nGesellschaft mit beschränkter Haftung\nNürnberg\n\nDas Registergericht beabsichtigt, die im Handelsregister eingetragene Gesellschaft wegen Vermögenslosigkeit von Amts wegen nach § 394 FamFG zu löschen. Die Frist zur Erhebung eines Widerspruchs ist auf einen Monat festgesetzt."
    },
    {
      "date": "2025-01-30",
      "id": "99980",
      "original_text": "Löschungsankündigung\nBayern Amtsgericht München HRB 283765\nTruffle World GmbH – München",
      "type": "Löschungsankündigung",
      "state": "Bayern",
      "amtsgericht": "Amtsgericht München",
      "registernummer": "HRB 283765",
      "registerart": "HRB",
      "company_name": "Truffle World GmbH",
      "company_seat": "München",
      "details": "30.01.2025 (Bekanntmachungsdatum)\n\nBayern Amtsgericht München HRB 283765\nLöschungsankündigung\n\nTruffle World GmbH\nGesellschaft mit beschränkter Haftung\nMünchen\n\nDas Registergericht beabsichtigt, die im Handelsregister eingetragene Gesellschaft wegen Vermögenslosigkeit von Amts wegen nach § 394 FamFG zu löschen. Die Frist zur Erhebung eines Widerspruchs ist auf drei Monate festgesetzt."
    },
    {
      "date": "2025-01-30",
      "id": "99981",
      "original_text": "Löschungsankündigung\nBayern Amtsgericht München HRB 130173\nPrint & Mail Recovery GmbH – München",
      "type": "Löschungsankündigung",
      "state": "Bayern",
      "amtsgericht": "Amtsgericht München",
      "registernummer": "HRB 130173",
      "registerart": "HRB",
      "company_name": "Print & Mail Recovery GmbH",
      "company_seat": "München",
      "details": "30.01.2025 (Bekanntmachungsdatum)\n\nBayern Amtsgericht München HRB 130173\nLöschungsankündigung\n\nPrint & Mail Recovery GmbH\nGesellschaft mit beschränkter Haftung\nMünchen\n\nDas Registergericht beabsichtigt, die im Handelsregister eingetragene Gesellschaft wegen Vermögenslosigkeit von Amts wegen nach § 394 FamFG zu löschen. Die Frist zur Erhebung eines Widerspruchs ist auf drei Monate festgesetzt."
    },
    {
      "date": "2025-01-30",
      "id": "99982",
      "original_text": "Registerbekanntmachung nach dem Umwandlungsgesetz\nBayern Amtsgericht München HRB 144881\nHADES Fünfte Verwaltung GmbH – Pullach i. Isartal",
      "type": "Registerbekanntmachung nach dem Umwandlungsgesetz",
      "state": "Bayern",
      "amtsgericht": "Amtsgericht München",
      "registernummer": "HRB 144881",
      "registerart": "HRB",
      "company_name": "HADES Fünfte Verwaltung GmbH",
      "company_seat": "Pullach i. Isartal",
      "details": "30.01.2025 (Bekanntmachungsdatum)\n\nBayern Amtsgericht München HRB 144881\nRegisterbekanntmachung nach dem Umwandlungsgesetz 29.01.2025 (Eintragungsdatum)\n\nHADES Fünfte Verwaltung GmbH\nGesellschaft mit beschränkter Haftung\nPullach i. Isartal\n\nDen Gläubigern der an der Verschmelzung beteiligten Rechtsträger ist, wenn sie binnen sechs Monaten nach dem Tag, an dem die Eintragung der Verschmelzung in das Register des Sitzes desjenigen Rechtsträgers, dessen Gläubiger sie sind, nach § 19 Abs. 3 UmwG als bekannt gemacht gilt, ihren Anspruch nach Grund und Höhe in Textform anmelden, Sicherheit zu leisten, soweit sie nicht Befriedigung verlangen können. Dieses Recht steht den Gläubigern jedoch nur zu, wenn sie glaubhaft machen, dass durch die Verschmelzung die Erfüllung ihrer Forderung gefährdet wird."
    },
    {
      "date": "2025-01-30",
      "id": "99983",
      "original_text": "Löschungsankündigung\nBayern Amtsgericht Kempten (Allgäu) HRB 11471\nFliesen Ellrich GmbH – Pfronten",
      "type": "Löschungsankündigung",
      "state": "Bayern",
      "amtsgericht": "Amtsgericht Kempten (Allgäu)",
      "registernummer": "HRB 11471",
      "registerart": "HRB",
      "company_name": "Fliesen Ellrich GmbH",
      "company_seat": "Pfronten",
      "details": "30.01.2025 (Bekanntmachungsdatum)\n\nBayern Amtsgericht Kempten (Allgäu) HRB 11471\nLöschungsankündigung\n\nFliesen Ellrich GmbH\nGesellschaft mit beschränkter Haftung\nPfronten\n\nDas Registergericht beabsichtigt, die im Handelsregister eingetragene Gesellschaft wegen Vermögenslosigkeit von Amts wegen nach § 394 FamFG zu löschen. Die Frist zur Erhebung eines Widerspruchs ist auf einen Monat festgesetzt."
    },
    {
      "date": "2025-01-30",
      "id": "99984",
      "original_text": "Registerbekanntmachung nach dem Umwandlungsgesetz\nBayern Amtsgericht Ingolstadt HRB 101738\nBAUER Maschinen GmbH – Schrobenhausen",
      "type": "Registerbekanntmachung nach dem Umwandlungsgesetz",
      "state": "Bayern",
      "amtsgericht": "Amtsgericht Ingolstadt",
      "registernummer": "HRB 101738",
      "registerart": "HRB",
      "company_name": "BAUER Maschinen GmbH",
      "company_seat": "Schrobenhausen",
      "details": "30.01.2025 (Bekanntmachungsdatum)\n\nBayern Amtsgericht Ingolstadt HRB 101738\nRegisterbekanntmachung nach dem Umwandlungsgesetz 29.01.2025 (Eintragungsdatum)\n\nBAUER Maschinen GmbH\nGesellschaft mit beschränkter Haftung\nSchrobenhausen\n\nDen Gläubigern der an der Ausgliederung beteiligten Rechtsträger ist, wenn sie binnen sechs Monaten nach dem Tag, an dem die Eintragung der Ausgliederung in das Register des Sitzes desjenigen Rechtsträgers, dessen Gläubiger sie sind, nach §§ 125, 19 Abs. 3 UmwG als bekannt gemacht gilt, ihren Anspruch nach Grund und Höhe in Textform anmelden, Sicherheit zu leisten, soweit sie nicht Befriedigung verlangen können. Dieses Recht steht den Gläubigern jedoch nur zu, wenn sie glaubhaft machen, dass durch die Ausgliederung die Erfüllung ihrer Forderung gefährdet wird."
    },
    {
      "date": "2025-01-30",
      "id": "99985",
      "original_text": "Registerbekanntmachung nach dem Umwandlungsgesetz\nBayern Amtsgericht München HRB 292440\nCC Clever Chic UG (haftungsbeschränkt) – München",
      "type": "Registerbekanntmachung nach dem Umwandlungsgesetz",
      "state": "Bayern",
      "amtsgericht": "Amtsgericht München",
      "registernummer": "HRB 292440",
      "registerart": "HRB",
      "company_name": "CC Clever Chic UG (haftungsbeschränkt)",
      "company_seat": "München",
      "details": "30.01.2025 (Bekanntmachungsdatum)\n\nBayern Amtsgericht München HRB 292440\nRegisterbekanntmachung nach dem Umwandlungsgesetz 29.01.2025 (Eintragungsdatum)\n\nCC Clever Chic UG (haftungsbeschränkt)\nGesellschaft mit beschränkter Haftung\nMünchen\n\nDen Gläubigern der an der Verschmelzung beteiligten Rechtsträger ist, wenn sie binnen sechs Monaten nach dem Tag, an dem die Eintragung der Verschmelzung in das Register des Sitzes desjenigen Rechtsträgers, dessen Gläubiger sie sind, nach § 19 Abs. 3 UmwG als bekannt gemacht gilt, ihren Anspruch nach Grund und Höhe in Textform anmelden, Sicherheit zu leisten, soweit sie nicht Befriedigung verlangen können. Dieses Recht steht den Gläubigern jedoch nur zu, wenn sie glaubhaft machen, dass durch die Verschmelzung die Erfüllung ihrer Forderung gefährdet wird."
    },
    {
      "date": "2025-01-30",
      "id": "99986",
      "original_text": "Löschungsankündigung\nBayern Amtsgericht Traunstein HRB 24767\nPopper Power DE GmbH – Rosenheim",
      "type": "Löschungsankündigung",
      "state": "Bayern",
      "amtsgericht": "Amtsgericht Traunstein",
      "registernummer": "HRB 24767",
      "registerart": "HRB",
      "company_name": "Popper Power DE GmbH",
      "company_seat": "Rosenheim",
      "details": "30.01.2025 (Bekanntmachungsdatum)\n\nBayern Amtsgericht Traunstein HRB 24767\nLöschungsankündigung\n\nPopper Power DE GmbH\nGesellschaft mit beschränkter Haftung\nRosenheim\n\nDas Registergericht beabsichtigt, die im Handelsregister eingetragene Gesellschaft wegen Vermögenslosigkeit von Amts wegen nach § 394 FamFG zu löschen. Die Frist zur Erhebung eines Widerspruchs ist auf drei Monate festgesetzt."
    },
    {
      "date": "2025-01-30",
      "id": "99987",
      "original_text": "Registerbekanntmachung nach dem Umwandlungsgesetz\nBayern Amtsgericht Ingolstadt HRB 12082\nBMR Beteiligung GmbH – Schrobenhausen",
      "type": "Registerbekanntmachung nach dem Umwandlungsgesetz",
      "state": "Bayern",
      "amtsgericht": "Amtsgericht Ingolstadt",
      "registernummer": "HRB 12082",
      "registerart": "HRB",
      "company_name": "BMR Beteiligung GmbH",
      "company_seat": "Schrobenhausen",
      "details": "30.01.2025 (Bekanntmachungsdatum)\n\nBayern Amtsgericht Ingolstadt HRB 12082\nRegisterbekanntmachung nach dem Umwandlungsgesetz 29.01.2025 (Eintragungsdatum)\n\nBMR Beteiligung GmbH\nGesellschaft mit beschränkter Haftung\nSchrobenhausen\n\nDen Gläubigern der an der Ausgliederung beteiligten Rechtsträger ist, wenn sie binnen sechs Monaten nach dem Tag, an dem die Eintragung der Ausgliederung in das Register des Sitzes desjenigen Rechtsträgers, dessen Gläubiger sie sind, nach §§ 125, 19 Abs. 3 UmwG als bekannt gemacht gilt, ihren Anspruch nach Grund und Höhe in Textform anmelden, Sicherheit zu leisten, soweit sie nicht Befriedigung verlangen können. Dieses Recht steht den Gläubigern jedoch nur zu, wenn sie glaubhaft machen, dass durch die Ausgliederung die Erfüllung ihrer Forderung gefährdet wird."
    },
    {
      "date": "2025-01-30",
      "id": "99988",
      "original_text": "Registerbekanntmachung nach dem Umwandlungsgesetz\nBayern Amtsgericht München HRB 53490\nRS Maschinenvertrieb GmbH – Germering",
      "type": "Registerbekanntmachung nach dem Umwandlungsgesetz",
      "state": "Bayern",
      "amtsgericht": "Amtsgericht München",
      "registernummer": "HRB 53490",
      "registerart": "HRB",
      "company_name": "RS Maschinenvertrieb GmbH",
      "company_seat": "Germering",
      "details": "30.01.2025 (Bekanntmachungsdatum)\n\nBayern Amtsgericht München HRB 53490\nRegisterbekanntmachung nach dem Umwandlungsgesetz 29.01.2025 (Eintragungsdatum)\n\nRS Maschinenvertrieb GmbH\nGesellschaft mit beschränkter Haftung\nGermering\n\nDen Gläubigern der an der Verschmelzung beteiligten Rechtsträger ist, wenn sie binnen sechs Monaten nach dem Tag, an dem die Eintragung der Verschmelzung in das Register des Sitzes desjenigen Rechtsträgers, dessen Gläubiger sie sind, nach § 19 Abs. 3 UmwG als bekannt gemacht gilt, ihren Anspruch nach Grund und Höhe in Textform anmelden, Sicherheit zu leisten, soweit sie nicht Befriedigung verlangen können. Dieses Recht steht den Gläubigern jedoch nur zu, wenn sie glaubhaft machen, dass durch die Verschmelzung die Erfüllung ihrer Forderung gefährdet wird."
    },
    {
      "date": "2025-01-30",
      "id": "99989",
      "original_text": "Löschungsankündigung\nBayern Amtsgericht München HRB 111170\nW + W GmbH – München",
      "type": "Löschungsankündigung",
      "state": "Bayern",
      "amtsgericht": "Amtsgericht München",
      "registernummer": "HRB 111170",
      "registerart": "HRB",
      "company_name": "W + W GmbH",
      "company_seat": "München",
      "details": "30.01.2025 (Bekanntmachungsdatum)\n\nBayern Amtsgericht München HRB 111170\nLöschungsankündigung\n\nW + W GmbH\nGesellschaft mit beschränkter Haftung\nMünchen\n\nDas Registergericht beabsichtigt, die im Handelsregister eingetragene Gesellschaft wegen Vermögenslosigkeit von Amts wegen nach § 394 FamFG zu löschen. Die Frist zur Erhebung eines Widerspruchs ist auf drei Monate festgesetzt."
    },
    {
      "date": "2025-01-30",
      "id": "99990",
      "original_text": "Registerbekanntmachung nach dem Umwandlungsgesetz\nBayern Amtsgericht München HRB 299519\nIDG Communications Media GmbH – München",
      "type": "Registerbekanntmachung nach dem Umwandlungsgesetz",
      "state": "Bayern",
      "amtsgericht": "Amtsgericht München",
      "registernummer": "HRB 299519",
      "registerart": "HRB",
      "company_name": "IDG Communications Media GmbH",
      "company_seat": "München",
      "details": "30.01.2025 (Bekanntmachungsdatum)\n\nBayern Amtsgericht München HRB 299519\nRegisterbekanntmachung nach dem Umwandlungsgesetz 29.01.2025 (Eintragungsdatum)\n\nIDG Communications Media GmbH\nGesellschaft mit beschränkter Haftung\nMünchen\n\nDen Gläubigern des formwechselnden Rechtsträgers ist, wenn sie binnen sechs Monaten nach dem Tag, an dem die Eintragung des Formwechsels nach § 201 UmwG als bekannt gemacht gilt, ihren Anspruch nach Grund und Höhe in Textform anmelden, Sicherheit zu leisten, soweit sie nicht Befriedigung verlangen können. Dieses Recht steht den Gläubigern jedoch nur zu, wenn sie glaubhaft machen, dass durch den Formwechsel die Erfüllung ihrer Forderung gefährdet wird."
    },
    {
      "date": "2025-01-30",
      "id": "99991",
      "original_text": "Löschungsankündigung\nBayern Amtsgericht Aschaffenburg HRB 3825\nB & K Medizinbedarf GmbH – Sulzbach am Main",
      "type": "Löschungsankündigung",
      "state": "Bayern",
      "amtsgericht": "Amtsgericht Aschaffenburg",
      "registernummer": "HRB 3825",
      "registerart": "HRB",
      "company_name": "B & K Medizinbedarf GmbH",
      "company_seat": "Sulzbach am Main",
      "details": "30.01.2025 (Bekanntmachungsdatum)\n\nBayern Amtsgericht Aschaffenburg HRB 3825\nLöschungsankündigung\n\nB & K Medizinbedarf GmbH\nGesellschaft mit beschränkter Haftung\nSulzbach am Main\n\nDas Registergericht beabsichtigt, die im Handelsregister eingetragene Gesellschaft wegen Vermögenslosigkeit von Amts wegen nach § 394 FamFG zu löschen. Die Frist zur Erhebung eines Widerspruchs ist auf drei Monate festgesetzt."
    },
    {
      "date": "2025-01-30",
      "id": "99992",
      "original_text": "Löschungsankündigung\nBayern Amtsgericht Kempten (Allgäu) HRB 11762\nEkici Immobilien GmbH – Kempten (Allgäu)",
      "type": "Löschungsankündigung",
      "state": "Bayern",
      "amtsgericht": "Amtsgericht Kempten (Allgäu)",
      "registernummer": "HRB 11762",
      "registerart": "HRB",
      "company_name": "Ekici Immobilien GmbH",
      "company_seat": "Kempten (Allgäu)",
      "details": "30.01.2025 (Bekanntmachungsdatum)\n\nBayern Amtsgericht Kempten (Allgäu) HRB 11762\nLöschungsankündigung\n\nEkici Immobilien GmbH\nGesellschaft mit beschränkter Haftung\nKempten (Allgäu)\n\nDas Registergericht beabsichtigt, die im Handelsregister eingetragene Gesellschaft wegen Vermögenslosigkeit von Amts wegen nach § 394 FamFG zu löschen. Die Frist zur Erhebung eines Widerspruchs ist auf einen Monat festgesetzt."
    },
    {
      "date": "2025-01-30",
      "id": "99993",
      "original_text": "Registerbekanntmachung nach dem Umwandlungsgesetz\nBayern Amtsgericht Kempten (Allgäu) HRB 17394\nDigital Craftsman GmbH – Kaufbeuren",
      "type": "Registerbekanntmachung nach dem Umwandlungsgesetz",
      "state": "Bayern",
      "amtsgericht": "Amtsgericht Kempten (Allgäu)",
      "registernummer": "HRB 17394",
      "registerart": "HRB",
      "company_name": "Digital Craftsman GmbH",
      "company_seat": "Kaufbeuren",
      "details": "30.01.2025 (Bekanntmachungsdatum)\n\nBayern Amtsgericht Kempten (Allgäu) HRB 17394\nRegisterbekanntmachung nach dem Umwandlungsgesetz 29.01.2025 (Eintragungsdatum)\n\nDigital Craftsman GmbH\nGesellschaft mit beschränkter Haftung\nKaufbeuren\n\nDen Gläubigern der an der Verschmelzung beteiligten Rechtsträger ist, wenn sie binnen sechs Monaten nach dem Tag, an dem die Eintragung der Verschmelzung in das Register des Sitzes desjenigen Rechtsträgers, dessen Gläubiger sie sind, nach § 19 Abs. 3 UmwG als bekannt gemacht gilt, ihren Anspruch nach Grund und Höhe in Textform anmelden, Sicherheit zu leisten, soweit sie nicht Befriedigung verlangen können. Dieses Recht steht den Gläubigern jedoch nur zu, wenn sie glaubhaft machen, dass durch die Verschmelzung die Erfüllung ihrer Forderung gefährdet wird."
    },
    {
      "date": "2025-01-30",
      "id": "99994",
      "original_text": "Löschungsankündigung\nBaden-Württemberg Amtsgericht Stuttgart HRB 768890\nEMNA Media GmbH – Heilbronn",
      "type": "Löschungsankündigung",
      "state": "Baden-Württemberg",
      "amtsgericht": "Amtsgericht Stuttgart",
      "registernummer": "HRB 768890",
      "registerart": "HRB",
      "company_name": "EMNA Media GmbH",
      "company_seat": "Heilbronn",
      "details": "30.01.2025 (Bekanntmachungsdatum)\n\nBaden-Württemberg Amtsgericht Stuttgart HRB 768890\nLöschungsankündigung\n\nEMNA Media GmbH\nGesellschaft mit beschränkter Haftung\nHeilbronn\n\nAls nicht eingetragen wird bekanntgemacht:\nDas Gericht beabsichtigt, die Gesellschaft wegen Vermögenslosigkeit im Handelsregister von Amts wegen nach § 394 FamFG zu löschen. Die Frist zur Geltendmachung eines Widerspruchs gegen die beabsichtigte Löschung ist auf zwei Monate ab Veröffentlichung bestimmt."
    },
    {
      "date": "2025-01-30",
      "id": "99995",
      "original_text": "Registerbekanntmachung nach dem Umwandlungsgesetz\nMecklenburg-Vorpommern Amtsgericht Rostock HRA 5499\nSebastian Weiß Ankerbar e. K. – Rerik",
      "type": "Registerbekanntmachung nach dem Umwandlungsgesetz",
      "state": "Mecklenburg-Vorpommern",
      "amtsgericht": "Amtsgericht Rostock",
      "registernummer": "HRA 5499",
      "registerart": "HRA",
      "company_name": "Sebastian Weiß Ankerbar e. K.",
      "company_seat": "Rerik",
      "details": "30.01.2025 (Bekanntmachungsdatum)\n\nMecklenburg-Vorpommern Amtsgericht Rostock HRA 5499\nRegisterbekanntmachung nach dem Umwandlungsgesetz 29.01.2025 (Eintragungsdatum)\n\nSebastian Weiß Ankerbar e. K.\nEinzelkaufmann / Einzelkauffrau\nRerik\n\nDen Gläubigern der an der Ausgliederung beteiligten Rechtsträger ist, wenn sie binnen sechs Monaten nach dem Tag, an dem die Eintragung der Ausgliederung in das Register des Sitzes desjenigen Rechtsträgers, dessen Gläubiger sie sind, nach § 19 Abs. 3 UmwG als bekannt gemacht gilt, ihren Anspruch nach Grund und Höhe in Textform anmelden, Sicherheit zu leisten, soweit sie nicht Befriedigung verlangen können. Dieses Recht steht den Gläubigern jedoch nur zu, wenn sie glaubhaft machen, dass durch die Ausgliederung die Erfüllung der Forderung gefährdet wird."
    },
    {
      "date": "2025-01-30",
      "id": "99996",
      "original_text": "Registerbekanntmachung nach dem Umwandlungsgesetz\nMecklenburg-Vorpommern Amtsgericht Schwerin GsR 287\nLewitz Grundstücksgesellschaft eGbR – Lübesse",
      "type": "Registerbekanntmachung nach dem Umwandlungsgesetz",
      "state": "Mecklenburg-Vorpommern",
      "amtsgericht": "Amtsgericht Schwerin",
      "registernummer": "GsR 287",
      "registerart": "GsR",
      "company_name": "Lewitz Grundstücksgesellschaft eGbR",
      "company_seat": "Lübesse",
      "details": "30.01.2025 (Bekanntmachungsdatum)\n\nMecklenburg-Vorpommern Amtsgericht Schwerin GsR 287\nRegisterbekanntmachung nach dem Umwandlungsgesetz 29.01.2025 (Eintragungsdatum)\n\nLewitz Grundstücksgesellschaft eGbR\nGesellschaft bürgerlichen Rechts\nLübesse\n\nAls nicht eingetragen wird veröffentlicht: Den Gläubigern der an der Umwandlung(Form-/Statuswechsel) beteiligten Rechtsträger ist, wenn sie binnen sechs\nMonaten nach dem Tag, an dem die Eintragung der Umwandlung in das Register des Sitzes desjenigen Rechtsträgers, dessen Gläubiger sie sind, nach § 19 Abs. 3 UmwG als bekannt gemacht gilt, ihren Anspruch nach Grund und Höhe in Textform anmelden, Sicherheit zu leisten, soweit sie nicht Befriedigung verlangen können. Dieses Recht steht den Gläubigern jedoch nur zu, wenn sie glaubhaft machen, dass durch die Umwandlung die Erfüllung der Forderung gefährdet wird."
    },
    {
      "date": "2025-01-30",
      "id": "99997",
      "original_text": "Registerbekanntmachung nach dem Umwandlungsgesetz\nMecklenburg-Vorpommern Amtsgericht Schwerin HRA 2899\nLewitz Grundstücksgesellschaft OHG – Lübesse",
      "type": "Registerbekanntmachung nach dem Umwandlungsgesetz",
      "state": "Mecklenburg-Vorpommern",
      "amtsgericht": "Amtsgericht Schwerin",
      "registernummer": "HRA 2899",
      "registerart": "HRA",
      "company_name": "Lewitz Grundstücksgesellschaft OHG",
      "company_seat": "Lübesse",
      "details": "30.01.2025 (Bekanntmachungsdatum)\n\nMecklenburg-Vorpommern Amtsgericht Schwerin HRA 2899\nRegisterbekanntmachung nach dem Umwandlungsgesetz 29.01.2025 (Eintragungsdatum)\n\nLewitz Grundstücksgesellschaft OHG\nOffene Handelsgesellschaft\nLübesse\n\nAls nicht eingetragen wird veröffentlicht: Den Gläubigern der an der Umwandlung(Form-/Statuswechsel) beteiligten Rechtsträger ist, wenn sie binnen sechs\nMonaten nach dem Tag, an dem die Eintragung der Umwandlung in das Register des Sitzes desjenigen Rechtsträgers, dessen Gläubiger sie sind, nach § 19 Abs. 3 UmwG als bekannt gemacht gilt, ihren Anspruch nach Grund und Höhe in Textform anmelden, Sicherheit zu leisten, soweit sie nicht Befriedigung verlangen können. Dieses Recht steht den Gläubigern jedoch nur zu, wenn sie glaubhaft machen, dass durch die Umwandlung die Erfüllung der Forderung gefährdet wird."
    },
    {
      "date": "2025-01-30",
      "id": "99998",
      "original_text": "Einreichung neuer Dokumente\nBrandenburg Amtsgericht Cottbus HRB 9418\nWohnungsbaugesellschaft Königs Wusterhausen mbH – Königs Wusterhausen",
      "type": "Einreichung neuer Dokumente",
      "state": "Brandenburg",
      "amtsgericht": "Amtsgericht Cottbus",
      "registernummer": "HRB 9418",
      "registerart": "HRB",
      "company_name": "Wohnungsbaugesellschaft Königs Wusterhausen mbH",
      "company_seat": "Königs Wusterhausen",
      "details": "30.01.2025 (Bekanntmachungsdatum)\n\nBrandenburg Amtsgericht Cottbus HRB 9418\nEinreichung neuer Dokumente\n\nWohnungsbaugesellschaft Königs Wusterhausen mbH\nGesellschaft mit beschränkter Haftung\nKönigs Wusterhausen\n\nAls nicht eingetragen wird veröffentlicht:\nDer Geschäftsführer hat eine Liste der Aufsichtsratsmitglieder gem. § 52 Abs. 2 Satz 2 GmbHG zum Handelsregister eingereicht."
    },
    {
      "date": "2025-01-30",
      "id": "99999",
      "original_text": "Löschungsankündigung\nSchleswig-Holstein Amtsgericht Flensburg HRA 11232\nSylter Mineralwasser Manufaktur GmbH & Co. KG – Sylt/OT Rantum",
      "type": "Löschungsankündigung",
      "state": "Schleswig-Holstein",
      "amtsgericht": "Amtsgericht Flensburg",
      "registernummer": "HRA 11232",
      "registerart": "HRA",
      "company_name": "Sylter Mineralwasser Manufaktur GmbH & Co. KG",
      "company_seat": "Sylt/OT Rantum",
      "details": "30.01.2025 (Bekanntmachungsdatum)\n\nSchleswig-Holstein Amtsgericht Flensburg HRA 11232\nLöschungsankündigung\n\nSylter Mineralwasser Manufaktur GmbH & Co. KG\nKommanditgesellschaft\nSylt/OT Rantum\n\nEs ist beabsichtigt, die Firma gemäß § 31 Abs. 2 HGB von Amts wegen zu löschen. Widerspruchsfrist: 3 Monate"
    }
  ]
}