{
  "date": "2025-01-15",
  "date_of_scrape": "2025-01-16T04:06:26.847Z",
  "tool_version": "0.2.0",
  "number_of_announcements": 111,
  "announcements": [
    {
      "date": "2025-01-15",
      "id": "98599",
      "original_text": "Registerbekanntmachung nach dem Umwandlungsgesetz\nBayern Amtsgericht München HRB 139864\nImmobilien Sobe GmbH – München",
      "type": "Registerbekanntmachung nach dem Umwandlungsgesetz",
      "state": "Bayern",
      "amtsgericht": "Amtsgericht München",
      "registernummer": "HRB 139864",
      "registerart": "HRB",
      "company_name": "Immobilien Sobe GmbH",
      "company_seat": "München",
      "details": "15.01.2025 (Bekanntmachungsdatum)\n\nBayern Amtsgericht München HRB 139864\nRegisterbekanntmachung nach dem Umwandlungsgesetz 14.01.2025 (Eintragungsdatum)\n\nImmobilien Sobe GmbH\nGesellschaft mit beschränkter Haftung\nMünchen\n\nDen Gläubigern der an der Verschmelzung beteiligten Rechtsträger ist, wenn sie binnen sechs Monaten nach dem Tag, an dem die Eintragung der Verschmelzung in das Register des Sitzes desjenigen Rechtsträgers, dessen Gläubiger sie sind, nach § 19 Abs. 3 UmwG als bekannt gemacht gilt, ihren Anspruch nach Grund und Höhe in Textform anmelden, Sicherheit zu leisten, soweit sie nicht Befriedigung verlangen können. Dieses Recht steht den Gläubigern jedoch nur zu, wenn sie glaubhaft machen, dass durch die Verschmelzung die Erfüllung ihrer Forderung gefährdet wird."
    },
    {
      "date": "2025-01-15",
      "id": "98600",
      "original_text": "Registerbekanntmachung nach dem Umwandlungsgesetz\nBayern Amtsgericht Coburg HRB 7445\nFranz Fischer Holding AG – Neustadt bei Coburg",
      "type": "Registerbekanntmachung nach dem Umwandlungsgesetz",
      "state": "Bayern",
      "amtsgericht": "Amtsgericht Coburg",
      "registernummer": "HRB 7445",
      "registerart": "HRB",
      "company_name": "Franz Fischer Holding AG",
      "company_seat": "Neustadt bei Coburg",
      "details": "15.01.2025 (Bekanntmachungsdatum)\n\nBayern Amtsgericht Coburg HRB 7445\nRegisterbekanntmachung nach dem Umwandlungsgesetz 13.01.2025 (Eintragungsdatum)\n\nFranz Fischer Holding AG\nAktiengesellschaft\nNeustadt bei Coburg\n\nDen Gläubigern des formwechselnden Rechtsträgers ist, wenn sie binnen sechs Monaten nach dem Tag, an dem die Eintragung des Formwechsels nach § 201 UmwG als bekannt gemacht gilt, ihren Anspruch nach Grund und Höhe in Textform anmelden, Sicherheit zu leisten, soweit sie nicht Befriedigung verlangen können. Dieses Recht steht den Gläubigern jedoch nur zu, wenn sie glaubhaft machen, dass durch den Formwechsel die Erfüllung ihrer Forderung gefährdet wird."
    },
    {
      "date": "2025-01-15",
      "id": "98601",
      "original_text": "Löschungsankündigung\nBayern Amtsgericht Traunstein HRB 24684\nA.L.K. GmbH – Freilassing",
      "type": "Löschungsankündigung",
      "state": "Bayern",
      "amtsgericht": "Amtsgericht Traunstein",
      "registernummer": "HRB 24684",
      "registerart": "HRB",
      "company_name": "A.L.K. GmbH",
      "company_seat": "Freilassing",
      "details": "15.01.2025 (Bekanntmachungsdatum)\n\nBayern Amtsgericht Traunstein HRB 24684\nLöschungsankündigung\n\nA.L.K. GmbH\nGesellschaft mit beschränkter Haftung\nFreilassing\n\nDas Registergericht beabsichtigt, die im Handelsregister eingetragene Gesellschaft wegen Vermögenslosigkeit von Amts wegen nach § 394 FamFG zu löschen. Die Frist zur Erhebung eines Widerspruchs ist auf drei Monate festgesetzt."
    },
    {
      "date": "2025-01-15",
      "id": "98602",
      "original_text": "Löschungsankündigung\nBayern Amtsgericht München HRB 149739\nExtrapunkt Gesellschaft für Marketing und Vertrieb mbH – München",
      "type": "Löschungsankündigung",
      "state": "Bayern",
      "amtsgericht": "Amtsgericht München",
      "registernummer": "HRB 149739",
      "registerart": "HRB",
      "company_name": "Extrapunkt Gesellschaft für Marketing und Vertrieb mbH",
      "company_seat": "München",
      "details": "15.01.2025 (Bekanntmachungsdatum)\n\nBayern Amtsgericht München HRB 149739\nLöschungsankündigung 02.01.2025 (Eintragungsdatum)\n\nExtrapunkt Gesellschaft für Marketing und Vertrieb mbH\nGesellschaft mit beschränkter Haftung\nMünchen\n\nDas Registergericht beabsichtigt, die im Handelsregister eingetragene Gesellschaft wegen Vermögenslosigkeit von Amts wegen nach § 394 FamFG zu löschen. Die Frist zur Erhebung eines Widerspruchs ist auf drei Monate festgesetzt."
    },
    {
      "date": "2025-01-15",
      "id": "98603",
      "original_text": "Löschungsankündigung\nBayern Amtsgericht München HRB 231616\nArgon Redstone GmbH – Grünwald",
      "type": "Löschungsankündigung",
      "state": "Bayern",
      "amtsgericht": "Amtsgericht München",
      "registernummer": "HRB 231616",
      "registerart": "HRB",
      "company_name": "Argon Redstone GmbH",
      "company_seat": "Grünwald",
      "details": "15.01.2025 (Bekanntmachungsdatum)\n\nBayern Amtsgericht München HRB 231616\nLöschungsankündigung 14.01.2025 (Eintragungsdatum)\n\nArgon Redstone GmbH\nGesellschaft mit beschränkter Haftung\nGrünwald\n\nDas Registergericht beabsichtigt, die im Handelsregister eingetragene Gesellschaft wegen Vermögenslosigkeit von Amts wegen nach § 394 FamFG zu löschen. Die Frist zur Erhebung eines Widerspruchs ist auf drei Monate festgesetzt."
    },
    {
      "date": "2025-01-15",
      "id": "98604",
      "original_text": "Einreichung neuer Dokumente\nBayern Amtsgericht München HRB 244139\nAUREPA Advisors AG – München",
      "type": "Einreichung neuer Dokumente",
      "state": "Bayern",
      "amtsgericht": "Amtsgericht München",
      "registernummer": "HRB 244139",
      "registerart": "HRB",
      "company_name": "AUREPA Advisors AG",
      "company_seat": "München",
      "details": "15.01.2025 (Bekanntmachungsdatum)\n\nBayern Amtsgericht München HRB 244139\nEinreichung neuer Dokumente 19.12.2024 (Eintragungsdatum)\n\nAUREPA Advisors AG\nAktiengesellschaft\nMünchen\n\nDem Amtsgericht München -Registergericht- ist eine Liste der Mitglieder des Aufsichtsrats eingereicht worden, § 106 AktG."
    },
    {
      "date": "2025-01-15",
      "id": "98605",
      "original_text": "Einreichung neuer Dokumente\nBayern Amtsgericht München HRB 167849\nShirtinator AG – München",
      "type": "Einreichung neuer Dokumente",
      "state": "Bayern",
      "amtsgericht": "Amtsgericht München",
      "registernummer": "HRB 167849",
      "registerart": "HRB",
      "company_name": "Shirtinator AG",
      "company_seat": "München",
      "details": "15.01.2025 (Bekanntmachungsdatum)\n\nBayern Amtsgericht München HRB 167849\nEinreichung neuer Dokumente\n\nShirtinator AG\nAktiengesellschaft\nMünchen\n\nDem Amtsgericht München -Registergericht- ist eine Liste der Mitglieder des Aufsichtsrats eingereicht worden, § 106 AktG."
    },
    {
      "date": "2025-01-15",
      "id": "98606",
      "original_text": "Sonstige Registerbekanntmachung\nBayern Amtsgericht Fürth HRB 18080\nPropus GmbH – Erlangen",
      "type": "Sonstige Registerbekanntmachung",
      "state": "Bayern",
      "amtsgericht": "Amtsgericht Fürth",
      "registernummer": "HRB 18080",
      "registerart": "HRB",
      "company_name": "Propus GmbH",
      "company_seat": "Erlangen",
      "details": "15.01.2025 (Bekanntmachungsdatum)\n\nBayern Amtsgericht Fürth HRB 18080\nSonstige Registerbekanntmachung\n\nPropus GmbH\nGesellschaft mit beschränkter Haftung\nErlangen\n\nDas mit Verfügung vom 15.11.2023 eingeleitete Amtslöschungsverfahren wegen Vermögenslosigkeit wird aufgehoben, da die Vermögenslage der Gesellschaft nicht aufgeklärt werden konnte. Die Frist zur Erhebung eines Widerspruchs ist auf einen Monat festgesetzt."
    },
    {
      "date": "2025-01-15",
      "id": "98607",
      "original_text": "Registerbekanntmachung nach dem Umwandlungsgesetz\nBayern Amtsgericht München HRB 292653\nLogic Green Valley II GmbH – Gräfelfing",
      "type": "Registerbekanntmachung nach dem Umwandlungsgesetz",
      "state": "Bayern",
      "amtsgericht": "Amtsgericht München",
      "registernummer": "HRB 292653",
      "registerart": "HRB",
      "company_name": "Logic Green Valley II GmbH",
      "company_seat": "Gräfelfing",
      "details": "15.01.2025 (Bekanntmachungsdatum)\n\nBayern Amtsgericht München HRB 292653\nRegisterbekanntmachung nach dem Umwandlungsgesetz 14.01.2025 (Eintragungsdatum)\n\nLogic Green Valley II GmbH\nGesellschaft mit beschränkter Haftung\nGräfelfing\n\nHierzu wird gemäß § 308 Abs. 1 S. 3 UmwG der Inhalt der gemäß §§ 336, 308 Abs. 1 UmwG bekannt zu machenden Angaben wie folgt mitgeteilt: 1. Hinweis darauf, dass der Formwechsel beim Handelsregister München am oder um den 9. Januar 2025 eingereicht worden ist. 2. Rechtsform, Firma und Sitz der an dem grenzüberschreitenden Formwechsel beteiligten Gesellschaft An dem grenzüberschreitenden Formwechsel ist beteiligt: die LOGIC GREEN VALLEY II GmbH, eine Gesellschaft mit beschränkter Haftung nach deutschem Recht mit Sitz in Gräfelfing (Deutschland) als formwechselnde Gesellschaft, die in eine Gesellschaft mit beschränkter Haftung (societé à responsabilitité limitée) nach dem Recht des Großherzogtums Luxemburg mit Sitz in Bereldange (Großherzogtum Luxemburg) formgewechselt werden soll. 3. Register, bei dem die an dem grenzüberschreitenden Formwechsel beteiligte Gesellschaft eingetragen ist, sowie die Nummer der Eintragung a) Die Gesellschaft ist im Handelsregister des Amtsgerichts München unter der Nummer HRB 292653 eingetragen. b) Die Gesellschaft wird im Luxemburger Handels- und Gesellschaftsregister (Registre de Commerce et des Sociétés) eingetragen werden. 4. Hinweis an folgende Personen, dass sie der Gesellschaft spätestens fünf Arbeitstage vor dem Tag der Gesellschafterversammlung Bemerkungen zum Formwechselplan übermitteln können: a) die Gesellschafter und Gläubiger der Gesellschaft können bis spätestens fünf Arbeitstage vor dem Tag der Gesellschafterversammlung Bemerkungen zum Formwechselplan übermitteln (Seeholzenstraße 2, 82166 Gräfelfing); b) an den zuständigen Betriebsrat der an dem grenzüberschreitenden Formwechsel beteiligten Gesellschaft oder, soweit es keinen Betriebsrat gibt, an die Arbeitnehmer der an dem grenzüberschreitenden Formwechsel beteiligten Gesellschaft. Ein Hinweis auf die Modalitäten für die Ausübung der Rechte des zuständigen Betriebsrats bzw. der Arbeitnehmer der Gesellschaft entfällt, da die Gesellschaft weder Arbeitnehmer noch einen Betriebsrat hatte oder hat."
    },
    {
      "date": "2025-01-15",
      "id": "98608",
      "original_text": "Löschungsankündigung\nBayern Amtsgericht München HRB 279388\nVincas Baumannschaft UG (haftungsbeschränkt) – München",
      "type": "Löschungsankündigung",
      "state": "Bayern",
      "amtsgericht": "Amtsgericht München",
      "registernummer": "HRB 279388",
      "registerart": "HRB",
      "company_name": "Vincas Baumannschaft UG (haftungsbeschränkt)",
      "company_seat": "München",
      "details": "15.01.2025 (Bekanntmachungsdatum)\n\nBayern Amtsgericht München HRB 279388\nLöschungsankündigung\n\nVincas Baumannschaft UG (haftungsbeschränkt)\nGesellschaft mit beschränkter Haftung\nMünchen\n\nDas Registergericht beabsichtigt, die im Handelsregister eingetragene Gesellschaft wegen Vermögenslosigkeit von Amts wegen nach § 394 FamFG zu löschen. Die Frist zur Erhebung eines Widerspruchs ist auf drei Monate festgesetzt."
    },
    {
      "date": "2025-01-15",
      "id": "98609",
      "original_text": "Registerbekanntmachung nach dem Umwandlungsgesetz\nBayern Amtsgericht München GsR 433\nMedien Zentrum Berlin eGbR – München",
      "type": "Registerbekanntmachung nach dem Umwandlungsgesetz",
      "state": "Bayern",
      "amtsgericht": "Amtsgericht München",
      "registernummer": "GsR 433",
      "registerart": "GsR",
      "company_name": "Medien Zentrum Berlin eGbR",
      "company_seat": "München",
      "details": "15.01.2025 (Bekanntmachungsdatum)\n\nBayern Amtsgericht München GsR 433\nRegisterbekanntmachung nach dem Umwandlungsgesetz 14.01.2025 (Eintragungsdatum)\n\nMedien Zentrum Berlin eGbR\nGesellschaft bürgerlichen Rechts\nMünchen\n\nDen Gläubigern der an der Verschmelzung beteiligten Rechtsträger ist, wenn sie binnen sechs Monaten nach dem Tag, an dem die Eintragung der Verschmelzung in das Register des Sitzes desjenigen Rechtsträgers, dessen Gläubiger sie sind, nach § 19 Abs. 3 UmwG als bekannt gemacht gilt, ihren Anspruch nach Grund und Höhe schriftlich anmelden, Sicherheit zu leisten, soweit sie nicht Befriedigung verlangen können. Dieses Recht steht den Gläubigern jedoch nur zu, wenn sie glaubhaft machen, dass durch die Verschmelzung die Erfüllung ihrer Forderung gefährdet wird."
    },
    {
      "date": "2025-01-15",
      "id": "98610",
      "original_text": "Einreichung neuer Dokumente\nBayern Amtsgericht München HRB 280577\nNotrix AG – München",
      "type": "Einreichung neuer Dokumente",
      "state": "Bayern",
      "amtsgericht": "Amtsgericht München",
      "registernummer": "HRB 280577",
      "registerart": "HRB",
      "company_name": "Notrix AG",
      "company_seat": "München",
      "details": "15.01.2025 (Bekanntmachungsdatum)\n\nBayern Amtsgericht München HRB 280577\nEinreichung neuer Dokumente 14.01.2025 (Eintragungsdatum)\n\nNotrix AG\nAktiengesellschaft\nMünchen\n\nDem Amtsgericht München -Registergericht- ist eine Liste der Mitglieder des Aufsichtsrats eingereicht worden, § 106 AktG."
    },
    {
      "date": "2025-01-15",
      "id": "98611",
      "original_text": "Registerbekanntmachung nach dem Umwandlungsgesetz\nBayern Amtsgericht München HRB 79508\nSportScheck GmbH – München",
      "type": "Registerbekanntmachung nach dem Umwandlungsgesetz",
      "state": "Bayern",
      "amtsgericht": "Amtsgericht München",
      "registernummer": "HRB 79508",
      "registerart": "HRB",
      "company_name": "SportScheck GmbH",
      "company_seat": "München",
      "details": "15.01.2025 (Bekanntmachungsdatum)\n\nBayern Amtsgericht München HRB 79508\nRegisterbekanntmachung nach dem Umwandlungsgesetz 14.01.2025 (Eintragungsdatum)\n\nSportScheck GmbH\nGesellschaft mit beschränkter Haftung\nMünchen\n\nDen Gläubigern der an der Verschmelzung beteiligten Rechtsträger ist, wenn sie binnen sechs Monaten nach dem Tag, an dem die Eintragung der Verschmelzung in das Register des Sitzes desjenigen Rechtsträgers, dessen Gläubiger sie sind, nach § 19 Abs. 3 UmwG als bekannt gemacht gilt, ihren Anspruch nach Grund und Höhe in Textform anmelden, Sicherheit zu leisten, soweit sie nicht Befriedigung verlangen können. Dieses Recht steht den Gläubigern jedoch nur zu, wenn sie glaubhaft machen, dass durch die Verschmelzung die Erfüllung ihrer Forderung gefährdet wird."
    },
    {
      "date": "2025-01-15",
      "id": "98612",
      "original_text": "Einreichung neuer Dokumente\nBayern Amtsgericht München HRB 180782\nAURELIUS Transaktionsberatungs AG – München",
      "type": "Einreichung neuer Dokumente",
      "state": "Bayern",
      "amtsgericht": "Amtsgericht München",
      "registernummer": "HRB 180782",
      "registerart": "HRB",
      "company_name": "AURELIUS Transaktionsberatungs AG",
      "company_seat": "München",
      "details": "15.01.2025 (Bekanntmachungsdatum)\n\nBayern Amtsgericht München HRB 180782\nEinreichung neuer Dokumente\n\nAURELIUS Transaktionsberatungs AG\nAktiengesellschaft\nMünchen\n\nDem Amtsgericht München -Registergericht- ist eine Liste der Mitglieder des Aufsichtsrats eingereicht worden, § 106 AktG."
    },
    {
      "date": "2025-01-15",
      "id": "98613",
      "original_text": "Löschungsankündigung\nBayern Amtsgericht München HRB 259002\nDerma Secrets Medical & Trading GmbH – Fürstenfeldbruck",
      "type": "Löschungsankündigung",
      "state": "Bayern",
      "amtsgericht": "Amtsgericht München",
      "registernummer": "HRB 259002",
      "registerart": "HRB",
      "company_name": "Derma Secrets Medical & Trading GmbH",
      "company_seat": "Fürstenfeldbruck",
      "details": "15.01.2025 (Bekanntmachungsdatum)\n\nBayern Amtsgericht München HRB 259002\nLöschungsankündigung 14.01.2025 (Eintragungsdatum)\n\nDerma Secrets Medical & Trading GmbH\nGesellschaft mit beschränkter Haftung\nFürstenfeldbruck\n\nDas Registergericht beabsichtigt, die im Handelsregister eingetragene Gesellschaft wegen Vermögenslosigkeit von Amts wegen nach § 394 FamFG zu löschen. Die Frist zur Erhebung eines Widerspruchs ist auf drei Monate festgesetzt."
    },
    {
      "date": "2025-01-15",
      "id": "98614",
      "original_text": "Löschungsankündigung\nBayern Amtsgericht München HRA 70639\nEwert GmbH & Co. KG – Feldkirchen",
      "type": "Löschungsankündigung",
      "state": "Bayern",
      "amtsgericht": "Amtsgericht München",
      "registernummer": "HRA 70639",
      "registerart": "HRA",
      "company_name": "Ewert GmbH & Co. KG",
      "company_seat": "Feldkirchen",
      "details": "15.01.2025 (Bekanntmachungsdatum)\n\nBayern Amtsgericht München HRA 70639\nLöschungsankündigung 08.01.2025 (Eintragungsdatum)\n\nEwert GmbH & Co. KG\nKommanditgesellschaft\nFeldkirchen\n\nDas Registergericht beabsichtigt, die im Handelsregister eingetragene Firma von Amts wegen nach § 31 Abs. 2 HGB zu löschen. Die Frist zur Erhebung eines Widerspruchs ist auf drei Monate festgesetzt."
    },
    {
      "date": "2025-01-15",
      "id": "98615",
      "original_text": "Registerbekanntmachung nach dem Umwandlungsgesetz\nBayern Amtsgericht Traunstein HRA 9783\nMyHome München GmbH & Co. KG – Rohrdorf",
      "type": "Registerbekanntmachung nach dem Umwandlungsgesetz",
      "state": "Bayern",
      "amtsgericht": "Amtsgericht Traunstein",
      "registernummer": "HRA 9783",
      "registerart": "HRA",
      "company_name": "MyHome München GmbH & Co. KG",
      "company_seat": "Rohrdorf",
      "details": "15.01.2025 (Bekanntmachungsdatum)\n\nBayern Amtsgericht Traunstein HRA 9783\nRegisterbekanntmachung nach dem Umwandlungsgesetz 14.01.2025 (Eintragungsdatum)\n\nMyHome München GmbH & Co. KG\nKommanditgesellschaft\nRohrdorf\n\nDen Gläubigern des formwechselnden Rechtsträgers ist, wenn sie binnen sechs Monaten nach dem Tag, an dem die Eintragung des Formwechsels nach § 201 UmwG als bekannt gemacht gilt, ihren Anspruch nach Grund und Höhe in Textform anmelden, Sicherheit zu leisten, soweit sie nicht Befriedigung verlangen können. Dieses Recht steht den Gläubigern jedoch nur zu, wenn sie glaubhaft machen, dass durch den Formwechsel die Erfüllung ihrer Forderung gefährdet wird."
    },
    {
      "date": "2025-01-15",
      "id": "98616",
      "original_text": "Registerbekanntmachung nach dem Umwandlungsgesetz\nBayern Amtsgericht Memmingen HRA 12232\nGOLANI Vermögensverwaltung KG – Leipheim",
      "type": "Registerbekanntmachung nach dem Umwandlungsgesetz",
      "state": "Bayern",
      "amtsgericht": "Amtsgericht Memmingen",
      "registernummer": "HRA 12232",
      "registerart": "HRA",
      "company_name": "GOLANI Vermögensverwaltung KG",
      "company_seat": "Leipheim",
      "details": "15.01.2025 (Bekanntmachungsdatum)\n\nBayern Amtsgericht Memmingen HRA 12232\nRegisterbekanntmachung nach dem Umwandlungsgesetz 14.01.2025 (Eintragungsdatum)\n\nGOLANI Vermögensverwaltung KG\nKommanditgesellschaft\nLeipheim\n\nDen Gläubigern des formwechselnden Rechtsträgers ist, wenn sie binnen sechs Monaten nach dem Tag, an dem die Eintragung des Formwechsels nach § 201 UmwG als bekannt gemacht gilt, ihren Anspruch nach Grund und Höhe in Textform anmelden, Sicherheit zu leisten, soweit sie nicht Befriedigung verlangen können. Dieses Recht steht den Gläubigern jedoch nur zu, wenn sie glaubhaft machen, dass durch den Formwechsel die Erfüllung ihrer Forderung gefährdet wird."
    },
    {
      "date": "2025-01-15",
      "id": "98617",
      "original_text": "Einreichung neuer Dokumente\nBayern Amtsgericht München HRB 257807\nOne Touch Football AG – München",
      "type": "Einreichung neuer Dokumente",
      "state": "Bayern",
      "amtsgericht": "Amtsgericht München",
      "registernummer": "HRB 257807",
      "registerart": "HRB",
      "company_name": "One Touch Football AG",
      "company_seat": "München",
      "details": "15.01.2025 (Bekanntmachungsdatum)\n\nBayern Amtsgericht München HRB 257807\nEinreichung neuer Dokumente\n\nOne Touch Football AG\nAktiengesellschaft\nMünchen\n\nDem Amtsgericht München -Registergericht- ist eine Liste der Mitglieder des Aufsichtsrats eingereicht worden, § 106 AktG."
    },
    {
      "date": "2025-01-15",
      "id": "98618",
      "original_text": "Löschungsankündigung\nBayern Amtsgericht München HRB 280798\nContaintown Service GmbH – Gräfelfing",
      "type": "Löschungsankündigung",
      "state": "Bayern",
      "amtsgericht": "Amtsgericht München",
      "registernummer": "HRB 280798",
      "registerart": "HRB",
      "company_name": "Containtown Service GmbH",
      "company_seat": "Gräfelfing",
      "details": "15.01.2025 (Bekanntmachungsdatum)\n\nBayern Amtsgericht München HRB 280798\nLöschungsankündigung\n\nContaintown Service GmbH\nGesellschaft mit beschränkter Haftung\nGräfelfing\n\nDas Registergericht beabsichtigt, die im Handelsregister eingetragene Gesellschaft wegen Vermögenslosigkeit von Amts wegen nach § 394 FamFG zu löschen. Die Frist zur Erhebung eines Widerspruchs ist auf drei Monate festgesetzt."
    },
    {
      "date": "2025-01-15",
      "id": "98619",
      "original_text": "Einreichung neuer Dokumente\nBayern Amtsgericht München HRB 293920\nLSA Projekt 1 AG – Oberhaching",
      "type": "Einreichung neuer Dokumente",
      "state": "Bayern",
      "amtsgericht": "Amtsgericht München",
      "registernummer": "HRB 293920",
      "registerart": "HRB",
      "company_name": "LSA Projekt 1 AG",
      "company_seat": "Oberhaching",
      "details": "15.01.2025 (Bekanntmachungsdatum)\n\nBayern Amtsgericht München HRB 293920\nEinreichung neuer Dokumente 14.01.2025 (Eintragungsdatum)\n\nLSA Projekt 1 AG\nAktiengesellschaft\nOberhaching\n\nDem Amtsgericht München -Registergericht- ist eine Liste der Mitglieder des Aufsichtsrats eingereicht worden, § 106 AktG."
    },
    {
      "date": "2025-01-15",
      "id": "98620",
      "original_text": "Löschungsankündigung\nBayern Amtsgericht München HRB 182575\nAlex Autoteile GmbH – Murnau",
      "type": "Löschungsankündigung",
      "state": "Bayern",
      "amtsgericht": "Amtsgericht München",
      "registernummer": "HRB 182575",
      "registerart": "HRB",
      "company_name": "Alex Autoteile GmbH",
      "company_seat": "Murnau",
      "details": "15.01.2025 (Bekanntmachungsdatum)\n\nBayern Amtsgericht München HRB 182575\nLöschungsankündigung\n\nAlex Autoteile GmbH\nGesellschaft mit beschränkter Haftung\nMurnau\n\nDas Registergericht beabsichtigt, die im Handelsregister eingetragene Gesellschaft wegen Vermögenslosigkeit von Amts wegen nach § 394 FamFG zu löschen. Die Frist zur Erhebung eines Widerspruchs ist auf drei Monate festgesetzt."
    },
    {
      "date": "2025-01-15",
      "id": "98621",
      "original_text": "Registerbekanntmachung nach dem Umwandlungsgesetz\nBaden-Württemberg Amtsgericht Mannheim HRB 738497\nESG ENGEL Holding Steuerberatungsgesellschaft mbH – Karlsruhe",
      "type": "Registerbekanntmachung nach dem Umwandlungsgesetz",
      "state": "Baden-Württemberg",
      "amtsgericht": "Amtsgericht Mannheim",
      "registernummer": "HRB 738497",
      "registerart": "HRB",
      "company_name": "ESG ENGEL Holding Steuerberatungsgesellschaft mbH",
      "company_seat": "Karlsruhe",
      "details": "15.01.2025 (Bekanntmachungsdatum)\n\nBaden-Württemberg Amtsgericht Mannheim HRB 738497\nRegisterbekanntmachung nach dem Umwandlungsgesetz 15.01.2025 (Eintragungsdatum)\n\nESG ENGEL Holding Steuerberatungsgesellschaft mbH\nGesellschaft mit beschränkter Haftung\nKarlsruhe\n\nDen Gläubigern der an der Verschmelzung beteiligten Rechtsträger ist, wenn sie binnen sechs Monaten nach dem Tag, an dem die Eintragung der Verschmelzung in das Register des Sitzes desjenigen Rechtsträgers, dessen Gläubiger sie sind, nach § 19 Abs. 3 UmwG als bekanntgemacht gilt, ihren Anspruch nach Grund und Höhe schriftlich anmelden, Sicherheit zu leisten, soweit sie nicht Befriedigung verlangen können. Dieses Recht steht den Gläubigern jedoch nur zu, wenn sie glaubhaft machen, dass durch die Verschmelzung die Erfüllung ihrer Forderung gefährdet wird."
    },
    {
      "date": "2025-01-15",
      "id": "98622",
      "original_text": "Löschungsankündigung\nBrandenburg Amtsgericht Potsdam HRB 32991\nJA.KI GmbH – Blankenfelde-Mahlow",
      "type": "Löschungsankündigung",
      "state": "Brandenburg",
      "amtsgericht": "Amtsgericht Potsdam",
      "registernummer": "HRB 32991",
      "registerart": "HRB",
      "company_name": "JA.KI GmbH",
      "company_seat": "Blankenfelde-Mahlow",
      "details": "15.01.2025 (Bekanntmachungsdatum)\n\nBrandenburg Amtsgericht Potsdam HRB 32991\nLöschungsankündigung\n\nJA.KI GmbH\nGesellschaft mit beschränkter Haftung\nBlankenfelde-Mahlow\n\nBei der nachstehenden Gesellschaft wird das Amtslöschungsverfahren gemäß § 394 FamFG eingeleitet. Widerspruchsfrist: 8 Wochen"
    },
    {
      "date": "2025-01-15",
      "id": "98623",
      "original_text": "Sonstige Registerbekanntmachung\nBaden-Württemberg Amtsgericht Ulm HRB 738687\nBlue Infinity SE – Mühlhausen im Täle",
      "type": "Sonstige Registerbekanntmachung",
      "state": "Baden-Württemberg",
      "amtsgericht": "Amtsgericht Ulm",
      "registernummer": "HRB 738687",
      "registerart": "HRB",
      "company_name": "Blue Infinity SE",
      "company_seat": "Mühlhausen im Täle",
      "details": "15.01.2025 (Bekanntmachungsdatum)\n\nBaden-Württemberg Amtsgericht Ulm HRB 738687\nSonstige Registerbekanntmachung 15.01.2025 (Eintragungsdatum)\n\nBlue Infinity SE\nEuropäische Aktiengesellschaft (SE)\nMühlhausen im Täle\n\nDie Gesellschaft hat am 14.01.2025 die Liste über die Zusammensetzung des Verwaltungsrats zum Handelsregister eingereicht."
    },
    {
      "date": "2025-01-15",
      "id": "98624",
      "original_text": "Löschungsankündigung\nBerlin Amtsgericht Berlin (Charlottenburg) HRB 195225\nStreem.ai GmbH – Berlin",
      "type": "Löschungsankündigung",
      "state": "Berlin",
      "amtsgericht": "Amtsgericht Berlin (Charlottenburg)",
      "registernummer": "HRB 195225",
      "registerart": "HRB",
      "company_name": "Streem.ai GmbH",
      "company_seat": "Berlin",
      "details": "15.01.2025 (Bekanntmachungsdatum)\n\nBerlin Amtsgericht Berlin (Charlottenburg) HRB 195225\nLöschungsankündigung\n\nStreem.ai GmbH\nGesellschaft mit beschränkter Haftung\nBerlin\n\nBei der nachstehenden Gesellschaft wird das Amtslöschungsverfahren gemäß § 394 FamFG eingeleitet. Widerspruchsfrist 6 Wochen"
    },
    {
      "date": "2025-01-15",
      "id": "98625",
      "original_text": "Sonstige Registerbekanntmachung\nBaden-Württemberg Amtsgericht Freiburg HRB 717868\nHepp Sicherheit GmbH – Efringen-Kirchen",
      "type": "Sonstige Registerbekanntmachung",
      "state": "Baden-Württemberg",
      "amtsgericht": "Amtsgericht Freiburg",
      "registernummer": "HRB 717868",
      "registerart": "HRB",
      "company_name": "Hepp Sicherheit GmbH",
      "company_seat": "Efringen-Kirchen",
      "details": "15.01.2025 (Bekanntmachungsdatum)\n\nBaden-Württemberg Amtsgericht Freiburg HRB 717868\nSonstige Registerbekanntmachung 15.01.2025 (Eintragungsdatum)\n\nHepp Sicherheit GmbH\nGesellschaft mit beschränkter Haftung\nEfringen-Kirchen\n\nAls nicht eingetragen wird bekanntgemacht:\nDen Gläubigern der Gesellschaft, deren Forderungen begründet worden sind, bevor die Eintragung der Beendigung des Vertrages in das Handelsregister nach § 10 HGB als bekanntgemacht gilt, ist vom anderen Vertragsteil Sicherheit zu leisten, wenn sie sich binnen sechs Monaten nach der Bekanntmachung zu diesem Zweck bei ihm melden."
    },
    {
      "date": "2025-01-15",
      "id": "98626",
      "original_text": "Einreichung neuer Dokumente\nSachsen-Anhalt Amtsgericht Stendal HRB 110553\nBetriebsgesellschaft Freizeit- und Sportzentrum Halberstadt mbH – Halberstadt",
      "type": "Einreichung neuer Dokumente",
      "state": "Sachsen-Anhalt",
      "amtsgericht": "Amtsgericht Stendal",
      "registernummer": "HRB 110553",
      "registerart": "HRB",
      "company_name": "Betriebsgesellschaft Freizeit- und Sportzentrum Halberstadt mbH",
      "company_seat": "Halberstadt",
      "details": "15.01.2025 (Bekanntmachungsdatum)\n\nSachsen-Anhalt Amtsgericht Stendal HRB 110553\nEinreichung neuer Dokumente\n\nBetriebsgesellschaft Freizeit- und Sportzentrum Halberstadt mbH\nGesellschaft mit beschränkter Haftung\nHalberstadt\n\nEine Liste der Mitglieder des Aufsichtsrates wurde zum Handelsregister eingereicht."
    },
    {
      "date": "2025-01-15",
      "id": "98627",
      "original_text": "Löschungsankündigung\nSchleswig-Holstein Amtsgericht Kiel HRA 7350\nNorthdog - Equipment für den sportlichen Hund und seine Menschen, Inhaber Henry Gerard de Graaf e.K. – Schwissel",
      "type": "Löschungsankündigung",
      "state": "Schleswig-Holstein",
      "amtsgericht": "Amtsgericht Kiel",
      "registernummer": "HRA 7350",
      "registerart": "HRA",
      "company_name": "Northdog - Equipment für den sportlichen Hund und seine Menschen, Inhaber Henry Gerard de Graaf e.K.",
      "company_seat": "Schwissel",
      "details": "15.01.2025 (Bekanntmachungsdatum)\n\nSchleswig-Holstein Amtsgericht Kiel HRA 7350\nLöschungsankündigung\n\nNorthdog - Equipment für den sportlichen Hund und seine Menschen, Inhaber Henry Gerard de Graaf e.K.\nEinzelkaufmann / Einzelkauffrau\nSchwissel\n\nBei der nachstehenden Firma wird das Amtslöschungsverfahren gemäß § 31 Abs. 2 HGB eingeleitet. Widerspruchsfrist: 2 Monate."
    },
    {
      "date": "2025-01-15",
      "id": "98628",
      "original_text": "Einreichung neuer Dokumente\nBerlin Amtsgericht Berlin (Charlottenburg) HRB 87806\nBIM Berliner Immobilienmanagement GmbH – Berlin",
      "type": "Einreichung neuer Dokumente",
      "state": "Berlin",
      "amtsgericht": "Amtsgericht Berlin (Charlottenburg)",
      "registernummer": "HRB 87806",
      "registerart": "HRB",
      "company_name": "BIM Berliner Immobilienmanagement GmbH",
      "company_seat": "Berlin",
      "details": "15.01.2025 (Bekanntmachungsdatum)\n\nBerlin Amtsgericht Berlin (Charlottenburg) HRB 87806\nEinreichung neuer Dokumente\n\nBIM Berliner Immobilienmanagement GmbH\nGesellschaft mit beschränkter Haftung\nBerlin\n\nAls nicht eingetragen wird veröffentlicht:\n\nEs wurde eine neue Liste der Aufsichtsratsmitglieder eingereicht (§52 GmbHG)."
    },
    {
      "date": "2025-01-15",
      "id": "98629",
      "original_text": "Löschungsankündigung\nSchleswig-Holstein Amtsgericht Flensburg GnR 363\neE4mobile eG – Enge-Sande",
      "type": "Löschungsankündigung",
      "state": "Schleswig-Holstein",
      "amtsgericht": "Amtsgericht Flensburg",
      "registernummer": "GnR 363",
      "registerart": "GnR",
      "company_name": "eE4mobile eG",
      "company_seat": "Enge-Sande",
      "details": "15.01.2025 (Bekanntmachungsdatum)\n\nSchleswig-Holstein Amtsgericht Flensburg GnR 363\nLöschungsankündigung\n\neE4mobile eG\neingetragene Genossenschaft\nEnge-Sande\n\nEs ist die Löschung der nachstehenden Gesellschaft wegen Vermögenslosigkeit gemäß § 394 FamFG beabsichtigt.\nWiderspruchsfrist: 2 Monate"
    },
    {
      "date": "2025-01-15",
      "id": "98630",
      "original_text": "Sonstige Registerbekanntmachung\nBerlin Amtsgericht Berlin (Charlottenburg) HRB 137384\nGrundstücksgesellschaft Kablower Weg 89 mbH – Berlin",
      "type": "Sonstige Registerbekanntmachung",
      "state": "Berlin",
      "amtsgericht": "Amtsgericht Berlin (Charlottenburg)",
      "registernummer": "HRB 137384",
      "registerart": "HRB",
      "company_name": "Grundstücksgesellschaft Kablower Weg 89 mbH",
      "company_seat": "Berlin",
      "details": "15.01.2025 (Bekanntmachungsdatum)\n\nBerlin Amtsgericht Berlin (Charlottenburg) HRB 137384\nSonstige Registerbekanntmachung\n\nGrundstücksgesellschaft Kablower Weg 89 mbH\nGesellschaft mit beschränkter Haftung\nBerlin\n\nAls nicht eingetragen wird veröffentlicht: Der andere Vertragsteil hat den Gläubigern dieses Rechtsträgers, deren Forderungen begründet worden sind, bevor die Eintragung der Beendigung dieses Vertrages in das Handelsregister nach § 10 des Handelsgesetzbuches als bekannt gemacht gilt, Sicherheit zu leisten, wenn sie sich binnen sechs Monaten nach der Bekanntmachung der Eintragung zu diesem Zweck bei ihm melden. Dieses Recht steht den Gläubigern nicht zu, die im Fall des Insolvenzverfahrens ein Recht auf vorzugsweise Befriedigung aus der Deckungsmasse haben, die nach gesetzlicher Vorschrift zu ihrem Schutz errichtet und staatlich überwacht ist."
    },
    {
      "date": "2025-01-15",
      "id": "98631",
      "original_text": "Sonstige Registerbekanntmachung\nBerlin Amtsgericht Berlin (Charlottenburg) HRB 151381\nCRS Clinical Research Services Berlin GmbH – Berlin",
      "type": "Sonstige Registerbekanntmachung",
      "state": "Berlin",
      "amtsgericht": "Amtsgericht Berlin (Charlottenburg)",
      "registernummer": "HRB 151381",
      "registerart": "HRB",
      "company_name": "CRS Clinical Research Services Berlin GmbH",
      "company_seat": "Berlin",
      "details": "15.01.2025 (Bekanntmachungsdatum)\n\nBerlin Amtsgericht Berlin (Charlottenburg) HRB 151381\nSonstige Registerbekanntmachung\n\nCRS Clinical Research Services Berlin GmbH\nGesellschaft mit beschränkter Haftung\nBerlin\n\nAls nicht eingetragen wird veröffentlicht: Der andere Vertragsteil hat den Gläubigern dieses Rechtsträgers, deren Forderungen begründet worden sind, bevor die Eintragung der Beendigung dieses Vertrages in das Handelsregister nach § 10 des Handelsgesetzbuches als bekannt gemacht gilt, Sicherheit zu leisten, wenn sie sich binnen sechs Monaten nach der Bekanntmachung der Eintragung zu diesem Zweck bei ihm melden. Dieses Recht steht den Gläubigern nicht zu, die im Fall des Insolvenzverfahrens ein Recht auf vorzugsweise Befriedigung aus der Deckungsmasse haben, die nach gesetzlicher Vorschrift zu ihrem Schutz errichtet und staatlich überwacht ist."
    },
    {
      "date": "2025-01-15",
      "id": "98632",
      "original_text": "Einreichung neuer Dokumente\nBerlin Amtsgericht Berlin (Charlottenburg) HRB 171288\nMusikbunker Holding AG – Berlin",
      "type": "Einreichung neuer Dokumente",
      "state": "Berlin",
      "amtsgericht": "Amtsgericht Berlin (Charlottenburg)",
      "registernummer": "HRB 171288",
      "registerart": "HRB",
      "company_name": "Musikbunker Holding AG",
      "company_seat": "Berlin",
      "details": "15.01.2025 (Bekanntmachungsdatum)\n\nBerlin Amtsgericht Berlin (Charlottenburg) HRB 171288\nEinreichung neuer Dokumente\n\nMusikbunker Holding AG\nAktiengesellschaft\nBerlin\n\nAls nicht eingetragen wird veröffentlicht: Es wurde eine neue Liste der Aufsichtsratsmitglieder eingereicht (§ 106 AktG)."
    },
    {
      "date": "2025-01-15",
      "id": "98633",
      "original_text": "Einreichung neuer Dokumente\nBaden-Württemberg Amtsgericht Freiburg HRB 580611\nStadtwerke Überlingen GmbH – Überlingen",
      "type": "Einreichung neuer Dokumente",
      "state": "Baden-Württemberg",
      "amtsgericht": "Amtsgericht Freiburg",
      "registernummer": "HRB 580611",
      "registerart": "HRB",
      "company_name": "Stadtwerke Überlingen GmbH",
      "company_seat": "Überlingen",
      "details": "15.01.2025 (Bekanntmachungsdatum)\n\nBaden-Württemberg Amtsgericht Freiburg HRB 580611\nEinreichung neuer Dokumente 15.01.2025 (Eintragungsdatum)\n\nStadtwerke Überlingen  GmbH\nGesellschaft mit beschränkter Haftung\nÜberlingen\n\nDie Gesellschaft hat am 10.01.2025 die Liste über die Zusammensetzung des Aufsichtsrats zum Handelsregister eingereicht."
    },
    {
      "date": "2025-01-15",
      "id": "98634",
      "original_text": "Einreichung neuer Dokumente\nHamburg Amtsgericht Hamburg HRB 170792\nJFD Bank AG – Hamburg",
      "type": "Einreichung neuer Dokumente",
      "state": "Hamburg",
      "amtsgericht": "Amtsgericht Hamburg",
      "registernummer": "HRB 170792",
      "registerart": "HRB",
      "company_name": "JFD Bank AG",
      "company_seat": "Hamburg",
      "details": "15.01.2025 (Bekanntmachungsdatum)\n\nHamburg Amtsgericht Hamburg HRB 170792\nEinreichung neuer Dokumente\n\nJFD Bank AG\nAktiengesellschaft\nHamburg\n\nAls nicht eingetragen wird bekannt gemacht: Liste des Aufsichtsrats wurde eingereicht."
    },
    {
      "date": "2025-01-15",
      "id": "98635",
      "original_text": "Einreichung neuer Dokumente\nHamburg Amtsgericht Hamburg HRB 123037\nLotto24 AG – Hamburg",
      "type": "Einreichung neuer Dokumente",
      "state": "Hamburg",
      "amtsgericht": "Amtsgericht Hamburg",
      "registernummer": "HRB 123037",
      "registerart": "HRB",
      "company_name": "Lotto24 AG",
      "company_seat": "Hamburg",
      "details": "15.01.2025 (Bekanntmachungsdatum)\n\nHamburg Amtsgericht Hamburg HRB 123037\nEinreichung neuer Dokumente 15.01.2025 (Eintragungsdatum)\n\nLotto24 AG\nAktiengesellschaft\nHamburg\n\nAls nicht eingetragen wird bekannt gemacht: Liste des Aufsichtsrats wurde eingereicht."
    },
    {
      "date": "2025-01-15",
      "id": "98636",
      "original_text": "Löschungsankündigung\nBerlin Amtsgericht Berlin (Charlottenburg) HRB 125571\nLütticher Bau GmbH – Berlin",
      "type": "Löschungsankündigung",
      "state": "Berlin",
      "amtsgericht": "Amtsgericht Berlin (Charlottenburg)",
      "registernummer": "HRB 125571",
      "registerart": "HRB",
      "company_name": "Lütticher Bau GmbH",
      "company_seat": "Berlin",
      "details": "15.01.2025 (Bekanntmachungsdatum)\n\nBerlin Amtsgericht Berlin (Charlottenburg) HRB 125571\nLöschungsankündigung\n\nLütticher Bau GmbH\nGesellschaft mit beschränkter Haftung\nBerlin\n\nBei der nachstehenden Gesellschaft wird das Amtslöschungsverfahren gemäß § 394 FamFG eingeleitet. Widerspruchsfrist 6 Wochen"
    },
    {
      "date": "2025-01-15",
      "id": "98637",
      "original_text": "Sonstige Registerbekanntmachung\nBerlin Amtsgericht Berlin (Charlottenburg) HRB 168051\nDIE Deutsche Immobilien Entwicklungs AG – Berlin",
      "type": "Sonstige Registerbekanntmachung",
      "state": "Berlin",
      "amtsgericht": "Amtsgericht Berlin (Charlottenburg)",
      "registernummer": "HRB 168051",
      "registerart": "HRB",
      "company_name": "DIE Deutsche Immobilien Entwicklungs AG",
      "company_seat": "Berlin",
      "details": "15.01.2025 (Bekanntmachungsdatum)\n\nBerlin Amtsgericht Berlin (Charlottenburg) HRB 168051\nSonstige Registerbekanntmachung\n\nDIE Deutsche Immobilien Entwicklungs AG\nAktiengesellschaft\nBerlin\n\nAls nicht eingetragen wird veröffentlicht: Es wurde eine neue Liste der Aufsichtsratsmitglieder eingereicht (§ 106 AktG)."
    },
    {
      "date": "2025-01-15",
      "id": "98638",
      "original_text": "Löschungsankündigung\nBerlin Amtsgericht Berlin (Charlottenburg) HRB 191003\nLoky GmbH – Berlin",
      "type": "Löschungsankündigung",
      "state": "Berlin",
      "amtsgericht": "Amtsgericht Berlin (Charlottenburg)",
      "registernummer": "HRB 191003",
      "registerart": "HRB",
      "company_name": "Loky GmbH",
      "company_seat": "Berlin",
      "details": "15.01.2025 (Bekanntmachungsdatum)\n\nBerlin Amtsgericht Berlin (Charlottenburg) HRB 191003\nLöschungsankündigung\n\nLoky GmbH\nGesellschaft mit beschränkter Haftung\nBerlin\n\nBei der nachstehenden Gesellschaft wird das Amtslöschungsverfahren gemäß § 394 FamFG eingeleitet. Widerspruchsfrist 6 Wochen"
    },
    {
      "date": "2025-01-15",
      "id": "98639",
      "original_text": "Löschungsankündigung\nBaden-Württemberg Amtsgericht Mannheim HRB 341529\nPeimed GmbH – Sinsheim",
      "type": "Löschungsankündigung",
      "state": "Baden-Württemberg",
      "amtsgericht": "Amtsgericht Mannheim",
      "registernummer": "HRB 341529",
      "registerart": "HRB",
      "company_name": "Peimed GmbH",
      "company_seat": "Sinsheim",
      "details": "15.01.2025 (Bekanntmachungsdatum)\n\nBaden-Württemberg Amtsgericht Mannheim HRB 341529\nLöschungsankündigung\n\nPeimed GmbH\nGesellschaft mit beschränkter Haftung\nSinsheim\n\nDas Gericht beabsichtigt, die Gesellschaft wegen Vermögenslosigkeit im Handelsregister von Amts wegen nach § 394 FamFG zu löschen. Die Frist zur Geltendmachung eines Widerspruchs gegen die beabsichtigte Löschung ist auf einen Monat ab Veröffentlichung bestimmt."
    },
    {
      "date": "2025-01-15",
      "id": "98640",
      "original_text": "Registerbekanntmachung nach dem Umwandlungsgesetz\nSchleswig-Holstein Amtsgericht Flensburg HRA 11242\nMalte Westphal e. K. – Mildstedt",
      "type": "Registerbekanntmachung nach dem Umwandlungsgesetz",
      "state": "Schleswig-Holstein",
      "amtsgericht": "Amtsgericht Flensburg",
      "registernummer": "HRA 11242",
      "registerart": "HRA",
      "company_name": "Malte Westphal e. K.",
      "company_seat": "Mildstedt",
      "details": "15.01.2025 (Bekanntmachungsdatum)\n\nSchleswig-Holstein Amtsgericht Flensburg HRA 11242\nRegisterbekanntmachung nach dem Umwandlungsgesetz 14.01.2025 (Eintragungsdatum)\n\nMalte Westphal e. K.\nEinzelkaufmann / Einzelkauffrau\nMildstedt\n\nZu Eintragungsnummer 2 vom 14.01.2025 wird als nicht eingetragen veröffentlicht: Den Gläubigern der an der Spaltung beteiligten Rechtsträger ist, wenn sie binnen sechs Monaten nach dem Tag, an dem die Eintragung der Spaltung in das Register des Sitzes desjenigen Rechtsträgers, dessen Gläubiger sie sind, als bekannt gemacht gilt, ihren Anspruch nach Grund und Höhe schriftlich anmelden, Sicherheit zu leisten, soweit sie nicht Befriedigung verlangen können. Dieses Recht steht den Gläubigern jedoch nur zu, wenn sie glaubhaft machen, dass durch die Spaltung die Erfüllung ihrer Forderung gefährdet wird."
    },
    {
      "date": "2025-01-15",
      "id": "98641",
      "original_text": "Sonstige Registerbekanntmachung\nBerlin Amtsgericht Berlin (Charlottenburg) HRB 155320\nMimi Hearing Technologies GmbH – Berlin",
      "type": "Sonstige Registerbekanntmachung",
      "state": "Berlin",
      "amtsgericht": "Amtsgericht Berlin (Charlottenburg)",
      "registernummer": "HRB 155320",
      "registerart": "HRB",
      "company_name": "Mimi Hearing Technologies GmbH",
      "company_seat": "Berlin",
      "details": "15.01.2025 (Bekanntmachungsdatum)\n\nBerlin Amtsgericht Berlin (Charlottenburg) HRB 155320\nSonstige Registerbekanntmachung\n\nMimi Hearing Technologies GmbH\nGesellschaft mit beschränkter Haftung\nBerlin\n\nAls nicht eingetragen wird veröffentlicht: Den Gläubigern der an der Verschmelzung beteiligten Rechtsträger ist, wenn sie binnen sechs Monaten nach dem Tag, an dem die Eintragung der Verschmelzung in das Register des Sitzes desjenigen Rechtsträgers, dessen Gläubiger sie sind, als bekannt gemacht gilt, ihren Anspruch nach Grund und Höhe schriftlich anmelden, Sicherheit zu leisten, soweit sie nicht Befriedigung verlangen können. Dieses Recht steht den Gläubigern jedoch nur zu, wenn sie glaubhaft machen, dass durch die Verschmelzung die Erfüllung ihrer Forderung gefährdet wird. Das Recht, Sicherheitsleistung zu verlangen, steht Gläubigern nicht zu, die im Falle der Insolvenz ein Recht auf vorzugsweise Befriedigung aus einer Deckungsmasse haben, die nach gesetzlicher Vorschrift zu ihrem Schutz errichtet und staatlich überwacht ist."
    },
    {
      "date": "2025-01-15",
      "id": "98642",
      "original_text": "Einreichung neuer Dokumente\nBaden-Württemberg Amtsgericht Freiburg HRA 702913\nStadtwerk am See GmbH & Co. KG – Überlingen",
      "type": "Einreichung neuer Dokumente",
      "state": "Baden-Württemberg",
      "amtsgericht": "Amtsgericht Freiburg",
      "registernummer": "HRA 702913",
      "registerart": "HRA",
      "company_name": "Stadtwerk am See GmbH & Co. KG",
      "company_seat": "Überlingen",
      "details": "15.01.2025 (Bekanntmachungsdatum)\n\nBaden-Württemberg Amtsgericht Freiburg HRA 702913\nEinreichung neuer Dokumente\n\nStadtwerk am See GmbH & Co. KG\nKommanditgesellschaft\nÜberlingen\n\nAls nicht eingetragen wird bekanntgemacht:\nDie Gesellschaft hat am 13.01.2025 die Liste über die Zusammensetzung des Aufsichtsrats zum Handelsregister eingereicht."
    },
    {
      "date": "2025-01-15",
      "id": "98643",
      "original_text": "Sonstige Registerbekanntmachung\nHamburg Amtsgericht Hamburg HRB 17511\nSUBREI Unternehmen für Fenster- und Fassadenreinigung GmbH. – Hamburg",
      "type": "Sonstige Registerbekanntmachung",
      "state": "Hamburg",
      "amtsgericht": "Amtsgericht Hamburg",
      "registernummer": "HRB 17511",
      "registerart": "HRB",
      "company_name": "SUBREI Unternehmen für Fenster- und Fassadenreinigung GmbH.",
      "company_seat": "Hamburg",
      "details": "15.01.2025 (Bekanntmachungsdatum)\n\nHamburg Amtsgericht Hamburg HRB 17511\nSonstige Registerbekanntmachung 15.01.2025 (Eintragungsdatum)\n\nSUBREI Unternehmen für Fenster- und Fassadenreinigung GmbH.\nGesellschaft mit beschränkter Haftung\nHamburg\n\nAls nicht eingetragen wird bekannt gemacht:  Den Gläubigern der Gesellschaft, deren Forderungen begründet worden sind, bevor die Eintragung der Vertragsbeendigung in das Handelsregister nach § 10 HGB als bekannt gemacht gilt, ist vom anderen Vertragsteil Sicherheit zu leisten, wenn sie sich binnen 6 Monaten nach Bekanntmachung der Eintragung zu diesem Zweck bei ihm melden."
    },
    {
      "date": "2025-01-15",
      "id": "98644",
      "original_text": "Registerbekanntmachung nach dem Umwandlungsgesetz\nHamburg Amtsgericht Hamburg HRB 179340\nCommertunity F&S GmbH – Hamburg",
      "type": "Registerbekanntmachung nach dem Umwandlungsgesetz",
      "state": "Hamburg",
      "amtsgericht": "Amtsgericht Hamburg",
      "registernummer": "HRB 179340",
      "registerart": "HRB",
      "company_name": "Commertunity F&S GmbH",
      "company_seat": "Hamburg",
      "details": "15.01.2025 (Bekanntmachungsdatum)\n\nHamburg Amtsgericht Hamburg HRB 179340\nRegisterbekanntmachung nach dem Umwandlungsgesetz 15.01.2025 (Eintragungsdatum)\n\nCommertunity F&S GmbH\nGesellschaft mit beschränkter Haftung\nHamburg\n\nAls nicht eingetragen wird bekannt gemacht:\nDen Gläubigern der an der Verschmelzung beteiligten Gesellschaften ist, wenn sie binnen sechs Monaten nach dem Tag, an dem die Eintragung der Verschmelzung in das Register des Sitzes desjenigen Rechtsträgers, dessen Gläubiger sie sind, nach § 19 Absatz 3 UmwG als bekannt gemacht gilt, ihren Anspruch nach Grund und Höhe schriftlich anmelden, Sicherheit zu leisten, soweit sie nicht Befriedigung verlangen können. Dieses Recht steht den Gläubigern jedoch nur zu, wenn sie glaubhaft machen, dass durch die Verschmelzung die Erfüllung ihrer Forderung gefährdet wird."
    },
    {
      "date": "2025-01-15",
      "id": "98645",
      "original_text": "Registerbekanntmachung nach dem Umwandlungsgesetz\nHamburg Amtsgericht Hamburg HRB 178404\nS4S Commerce GmbH – Hamburg",
      "type": "Registerbekanntmachung nach dem Umwandlungsgesetz",
      "state": "Hamburg",
      "amtsgericht": "Amtsgericht Hamburg",
      "registernummer": "HRB 178404",
      "registerart": "HRB",
      "company_name": "S4S Commerce GmbH",
      "company_seat": "Hamburg",
      "details": "15.01.2025 (Bekanntmachungsdatum)\n\nHamburg Amtsgericht Hamburg HRB 178404\nRegisterbekanntmachung nach dem Umwandlungsgesetz 15.01.2025 (Eintragungsdatum)\n\nS4S Commerce GmbH\nGesellschaft mit beschränkter Haftung\nHamburg\n\nAls nicht eingetragen wird bekannt gemacht:\nDen Gläubigern der an der Verschmelzung beteiligten Gesellschaften ist, wenn sie binnen sechs Monaten nach dem Tag, an dem die Eintragung der Verschmelzung in das Register des Sitzes desjenigen Rechtsträgers, dessen Gläubiger sie sind, nach § 19 Absatz 3 UmwG als bekannt gemacht gilt, ihren Anspruch nach Grund und Höhe schriftlich anmelden, Sicherheit zu leisten, soweit sie nicht Befriedigung verlangen können. Dieses Recht steht den Gläubigern jedoch nur zu, wenn sie glaubhaft machen, dass durch die Verschmelzung die Erfüllung ihrer Forderung gefährdet wird."
    },
    {
      "date": "2025-01-15",
      "id": "98646",
      "original_text": "Sonstige Registerbekanntmachung\nBerlin Amtsgericht Berlin (Charlottenburg) HRB 205060\nMimi Health GmbH – Berlin",
      "type": "Sonstige Registerbekanntmachung",
      "state": "Berlin",
      "amtsgericht": "Amtsgericht Berlin (Charlottenburg)",
      "registernummer": "HRB 205060",
      "registerart": "HRB",
      "company_name": "Mimi Health GmbH",
      "company_seat": "Berlin",
      "details": "15.01.2025 (Bekanntmachungsdatum)\n\nBerlin Amtsgericht Berlin (Charlottenburg) HRB 205060\nSonstige Registerbekanntmachung\n\nMimi Health GmbH\nGesellschaft mit beschränkter Haftung\nBerlin\n\nAls nicht eingetragen wird veröffentlicht: Den Gläubigern der an der Verschmelzung beteiligten Rechtsträger ist, wenn sie binnen sechs Monaten nach dem Tag, an dem die Eintragung der Verschmelzung in das Register des Sitzes desjenigen Rechtsträgers, dessen Gläubiger sie sind, als bekannt gemacht gilt, ihren Anspruch nach Grund und Höhe schriftlich anmelden, Sicherheit zu leisten, soweit sie nicht Befriedigung verlangen können. Dieses Recht steht den Gläubigern jedoch nur zu, wenn sie glaubhaft machen, dass durch die Verschmelzung die Erfüllung ihrer Forderung gefährdet wird. Das Recht, Sicherheitsleistung zu verlangen, steht Gläubigern nicht zu, die im Falle der Insolvenz ein Recht auf vorzugsweise Befriedigung aus einer Deckungsmasse haben, die nach gesetzlicher Vorschrift zu ihrem Schutz errichtet und staatlich überwacht ist."
    },
    {
      "date": "2025-01-15",
      "id": "98647",
      "original_text": "Sonstige Registerbekanntmachung\nHamburg Amtsgericht Hamburg HRB 76009\nStrassburger Pflegedienst GmbH – Hamburg",
      "type": "Sonstige Registerbekanntmachung",
      "state": "Hamburg",
      "amtsgericht": "Amtsgericht Hamburg",
      "registernummer": "HRB 76009",
      "registerart": "HRB",
      "company_name": "Strassburger Pflegedienst GmbH",
      "company_seat": "Hamburg",
      "details": "15.01.2025 (Bekanntmachungsdatum)\n\nHamburg Amtsgericht Hamburg HRB 76009\nSonstige Registerbekanntmachung 15.01.2025 (Eintragungsdatum)\n\nStrassburger Pflegedienst GmbH\nGesellschaft mit beschränkter Haftung\nHamburg\n\nAls nicht eingetragen wird bekannt gemacht:  Den Gläubigern der Gesellschaft, deren Forderungen begründet worden sind, bevor die Eintragung der Vertragsbeendigung in das Handelsregister nach § 10 HGB als bekannt gemacht gilt, ist vom anderen Vertragsteil Sicherheit zu leisten, wenn sie sich binnen 6 Monaten nach Bekanntmachung der Eintragung zu diesem Zweck bei ihm melden."
    },
    {
      "date": "2025-01-15",
      "id": "98648",
      "original_text": "Registerbekanntmachung nach dem Umwandlungsgesetz\nThüringen Amtsgericht Jena HRB 401033\nMärkisches Werk GmbH, Großbodungen – Am Ohmberg",
      "type": "Registerbekanntmachung nach dem Umwandlungsgesetz",
      "state": "Thüringen",
      "amtsgericht": "Amtsgericht Jena",
      "registernummer": "HRB 401033",
      "registerart": "HRB",
      "company_name": "Märkisches Werk GmbH, Großbodungen",
      "company_seat": "Am Ohmberg",
      "details": "15.01.2025 (Bekanntmachungsdatum)\n\nThüringen Amtsgericht Jena HRB 401033\nRegisterbekanntmachung nach dem Umwandlungsgesetz 15.01.2025 (Eintragungsdatum)\n\nMärkisches Werk GmbH, Großbodungen\nGesellschaft mit beschränkter Haftung\nAm Ohmberg\n\nNicht eingetragen: Den Gläubigern der an der Verschmelzung beteiligten Rechtsträger, ist wenn sie binnen sechs Monaten nach dem Tag, an dem die Eintragung der Verschmelzung in das Register des Sitzes desjenigen Rechtsträgers, dessen Gläubiger sie sind,  nach § 19 Abs. 3 UmwG als bekanntgemacht gilt, ihren Anspruch nach Grund und Höhe schriftlich anmelden, Sicherheit zu leisten, soweit sie nicht Befriedigung verlangen können. Dieses Recht steht ihnen jedoch nur zu, wenn sie glaubhaft machen, daß durch die Verschmelzung die Erfüllung ihrer Forderung gefährdet wird."
    },
    {
      "date": "2025-01-15",
      "id": "98649",
      "original_text": "Einreichung neuer Dokumente\nSachsen-Anhalt Amtsgericht Stendal HRB 30261\nKreisentwicklungsgesellschaft Saalekreis mbH (KEG Saalekreis mbH) – Merseburg",
      "type": "Einreichung neuer Dokumente",
      "state": "Sachsen-Anhalt",
      "amtsgericht": "Amtsgericht Stendal",
      "registernummer": "HRB 30261",
      "registerart": "HRB",
      "company_name": "Kreisentwicklungsgesellschaft Saalekreis mbH (KEG Saalekreis mbH)",
      "company_seat": "Merseburg",
      "details": "15.01.2025 (Bekanntmachungsdatum)\n\nSachsen-Anhalt Amtsgericht Stendal HRB 30261\nEinreichung neuer Dokumente\n\nKreisentwicklungsgesellschaft Saalekreis mbH (KEG Saalekreis mbH)\nGesellschaft mit beschränkter Haftung\nMerseburg\n\nEine Liste der Mitglieder des Aufsichtsrates wurde zum Handelsregister eingereicht."
    },
    {
      "date": "2025-01-15",
      "id": "98650",
      "original_text": "Sonstige Registerbekanntmachung\nBaden-Württemberg Amtsgericht Mannheim HRB 722938\nInova DE GmbH – Heidelberg",
      "type": "Sonstige Registerbekanntmachung",
      "state": "Baden-Württemberg",
      "amtsgericht": "Amtsgericht Mannheim",
      "registernummer": "HRB 722938",
      "registerart": "HRB",
      "company_name": "Inova DE GmbH",
      "company_seat": "Heidelberg",
      "details": "15.01.2025 (Bekanntmachungsdatum)\n\nBaden-Württemberg Amtsgericht Mannheim HRB 722938\nSonstige Registerbekanntmachung 15.01.2025 (Eintragungsdatum)\n\nInova DE GmbH\nGesellschaft mit beschränkter Haftung\nHeidelberg\n\nAls nicht eingetragen wird bekanntgemacht: Den Gläubigern der Gesellschaft, deren Forderungen begründet worden sind, bevor die Eintragung der Beendigung des Vertrages in das Handelsregister nach § 10 HGB als bekanntgemacht gilt, ist vom anderen Vertragsteil Sicherheit zu leisten, wenn sie sich binnen sechs Monaten nach der Bekanntmachung zu diesem Zweck bei ihm melden."
    },
    {
      "date": "2025-01-15",
      "id": "98651",
      "original_text": "Löschungsankündigung\nBerlin Amtsgericht Berlin (Charlottenburg) HRA 48536\nEMTEC GmbH & Co. Mühlhofen KG – Berlin",
      "type": "Löschungsankündigung",
      "state": "Berlin",
      "amtsgericht": "Amtsgericht Berlin (Charlottenburg)",
      "registernummer": "HRA 48536",
      "registerart": "HRA",
      "company_name": "EMTEC GmbH & Co. Mühlhofen KG",
      "company_seat": "Berlin",
      "details": "15.01.2025 (Bekanntmachungsdatum)\n\nBerlin Amtsgericht Berlin (Charlottenburg) HRA 48536\nLöschungsankündigung\n\nEMTEC GmbH & Co. Mühlhofen KG\nKommanditgesellschaft\nBerlin\n\nBei dem nachstehenden Unternehmen / der nachstehenden Gesellschaft wird das Amtslöschungsverfahren gemäß § 31 Abs. 2 HGB eingeleitet. Widerspruchsfrist 1 Monat"
    },
    {
      "date": "2025-01-15",
      "id": "98652",
      "original_text": "Sonstige Registerbekanntmachung\nBerlin Amtsgericht Berlin (Charlottenburg) HRB 136078\nEuropace AG – Berlin",
      "type": "Sonstige Registerbekanntmachung",
      "state": "Berlin",
      "amtsgericht": "Amtsgericht Berlin (Charlottenburg)",
      "registernummer": "HRB 136078",
      "registerart": "HRB",
      "company_name": "Europace AG",
      "company_seat": "Berlin",
      "details": "15.01.2025 (Bekanntmachungsdatum)\n\nBerlin Amtsgericht Berlin (Charlottenburg) HRB 136078\nSonstige Registerbekanntmachung\n\nEuropace AG\nAktiengesellschaft\nBerlin\n\nAls nicht eingetragen wird veröffentlicht: Der andere Vertragsteil hat den Gläubigern dieses Rechtsträgers, deren Forderungen begründet worden sind, bevor die Eintragung der Beendigung dieses Vertrages in das Handelsregister nach § 10 des Handelsgesetzbuches als bekannt gemacht gilt, Sicherheit zu leisten, wenn sie sich binnen sechs Monaten nach der Bekanntmachung der Eintragung zu diesem Zweck bei ihm melden. Dieses Recht steht den Gläubigern nicht zu, die im Fall des Insolvenzverfahrens ein Recht auf vorzugsweise Befriedigung aus der Deckungsmasse haben, die nach gesetzlicher Vorschrift zu ihrem Schutz errichtet und staatlich überwacht ist."
    },
    {
      "date": "2025-01-15",
      "id": "98653",
      "original_text": "Registerbekanntmachung nach dem Umwandlungsgesetz\nBaden-Württemberg Amtsgericht Stuttgart HRB 782154\nMACH Smart Solutions GmbH – Stuttgart",
      "type": "Registerbekanntmachung nach dem Umwandlungsgesetz",
      "state": "Baden-Württemberg",
      "amtsgericht": "Amtsgericht Stuttgart",
      "registernummer": "HRB 782154",
      "registerart": "HRB",
      "company_name": "MACH Smart Solutions GmbH",
      "company_seat": "Stuttgart",
      "details": "15.01.2025 (Bekanntmachungsdatum)\n\nBaden-Württemberg Amtsgericht Stuttgart HRB 782154\nRegisterbekanntmachung nach dem Umwandlungsgesetz 15.01.2025 (Eintragungsdatum)\n\nMACH Smart Solutions GmbH\nGesellschaft mit beschränkter Haftung\nStuttgart\n\nAls nicht eingetragen wird bekanntgemacht:\nDen Gläubigern der an der Verschmelzung beteiligten Rechtsträger ist, wenn sie binnen sechs Monaten nach dem Tag, an dem die Eintragung der Verschmelzung in das Register des Sitzes desjenigen Rechtsträgers, dessen Gläubiger sie sind, nach § 19 Abs. 3 UmwG als bekanntgemacht gilt, ihren Anspruch nach Grund und Höhe schriftlich anmelden, Sicherheit zu leisten, soweit sie nicht Befriedigung verlangen können. Dieses Recht steht den Gläubigern jedoch nur zu, wenn sie glaubhaft machen, dass durch die Verschmelzung die Erfüllung ihrer Forderung gefährdet wird."
    },
    {
      "date": "2025-01-15",
      "id": "98654",
      "original_text": "Einreichung neuer Dokumente\nBaden-Württemberg Amtsgericht Stuttgart HRB 451002\nTuttlinger Parkhaus GmbH – Tuttlingen",
      "type": "Einreichung neuer Dokumente",
      "state": "Baden-Württemberg",
      "amtsgericht": "Amtsgericht Stuttgart",
      "registernummer": "HRB 451002",
      "registerart": "HRB",
      "company_name": "Tuttlinger Parkhaus GmbH",
      "company_seat": "Tuttlingen",
      "details": "15.01.2025 (Bekanntmachungsdatum)\n\nBaden-Württemberg Amtsgericht Stuttgart HRB 451002\nEinreichung neuer Dokumente\n\nTuttlinger Parkhaus GmbH\nGesellschaft mit beschränkter Haftung\nTuttlingen\n\nDie Gesellschaft hat am 13.01.2025 die Liste über die Zusammensetzung des Aufsichtsrats zum Handelsregister eingereicht."
    },
    {
      "date": "2025-01-15",
      "id": "98655",
      "original_text": "Löschungsankündigung\nSchleswig-Holstein Amtsgericht Flensburg HRB 1081 NI\nApp. Vermietung Klabautermann GmbH – Hörnum/Sylt",
      "type": "Löschungsankündigung",
      "state": "Schleswig-Holstein",
      "amtsgericht": "Amtsgericht Flensburg",
      "registernummer": "HRB 1081 NI",
      "registerart": "HRB",
      "company_name": "App. Vermietung Klabautermann GmbH",
      "company_seat": "Hörnum/Sylt",
      "details": "15.01.2025 (Bekanntmachungsdatum)\n\nSchleswig-Holstein Amtsgericht Flensburg HRB 1081 NI\nLöschungsankündigung\n\nApp. Vermietung Klabautermann GmbH\nGesellschaft mit beschränkter Haftung\nHörnum/Sylt\n\nEs ist die Löschung der nachstehenden Gesellschaft wegen Vermögenslosigkeit gemäß § 394 FamFG beabsichtigt.\nWiderspruchsfrist: 2 Monate."
    },
    {
      "date": "2025-01-15",
      "id": "98656",
      "original_text": "Löschungsankündigung\nBerlin Amtsgericht Berlin (Charlottenburg) HRB 207969\nJoRot - Service GmbH – Berlin",
      "type": "Löschungsankündigung",
      "state": "Berlin",
      "amtsgericht": "Amtsgericht Berlin (Charlottenburg)",
      "registernummer": "HRB 207969",
      "registerart": "HRB",
      "company_name": "JoRot - Service GmbH",
      "company_seat": "Berlin",
      "details": "15.01.2025 (Bekanntmachungsdatum)\n\nBerlin Amtsgericht Berlin (Charlottenburg) HRB 207969\nLöschungsankündigung\n\nJoRot - Service GmbH\nGesellschaft mit beschränkter Haftung\nBerlin\n\nBei der nachstehenden Gesellschaft wird das Amtslöschungsverfahren gemäß § 394 FamFG eingeleitet. Widerspruchsfrist 6 Wochen"
    },
    {
      "date": "2025-01-15",
      "id": "98657",
      "original_text": "Sonstige Registerbekanntmachung\nSchleswig-Holstein Amtsgericht Lübeck HRB 1314 OD\nHako GmbH – Bad Oldesloe",
      "type": "Sonstige Registerbekanntmachung",
      "state": "Schleswig-Holstein",
      "amtsgericht": "Amtsgericht Lübeck",
      "registernummer": "HRB 1314 OD",
      "registerart": "HRB",
      "company_name": "Hako GmbH",
      "company_seat": "Bad Oldesloe",
      "details": "15.01.2025 (Bekanntmachungsdatum)\n\nSchleswig-Holstein Amtsgericht Lübeck HRB 1314 OD\nSonstige Registerbekanntmachung\n\nHako GmbH\nGesellschaft mit beschränkter Haftung\nBad Oldesloe\n\nAls nicht eingetragen wird veröffentlicht:\nDie Gesellschaft hat eine neue Liste der Aufsichtsratsmitglieder beim Handelsregister hinterlegt."
    },
    {
      "date": "2025-01-15",
      "id": "98658",
      "original_text": "Einreichung neuer Dokumente\nBaden-Württemberg Amtsgericht Stuttgart HRB 450131\nStadtwerke Tuttlingen GmbH – Tuttlingen",
      "type": "Einreichung neuer Dokumente",
      "state": "Baden-Württemberg",
      "amtsgericht": "Amtsgericht Stuttgart",
      "registernummer": "HRB 450131",
      "registerart": "HRB",
      "company_name": "Stadtwerke Tuttlingen GmbH",
      "company_seat": "Tuttlingen",
      "details": "15.01.2025 (Bekanntmachungsdatum)\n\nBaden-Württemberg Amtsgericht Stuttgart HRB 450131\nEinreichung neuer Dokumente\n\nStadtwerke Tuttlingen GmbH\nGesellschaft mit beschränkter Haftung\nTuttlingen\n\nDie Gesellschaft hat am 13.01.2025 die Liste über die Zusammensetzung des Aufsichtsrats zum Handelsregister eingereicht."
    },
    {
      "date": "2025-01-15",
      "id": "98659",
      "original_text": "Löschungsankündigung\nSchleswig-Holstein Amtsgericht Kiel HRB 14716\nKieler Bau Verwaltungs UG (haftungsbeschränkt) – Lehmkuhlen",
      "type": "Löschungsankündigung",
      "state": "Schleswig-Holstein",
      "amtsgericht": "Amtsgericht Kiel",
      "registernummer": "HRB 14716",
      "registerart": "HRB",
      "company_name": "Kieler Bau Verwaltungs UG (haftungsbeschränkt)",
      "company_seat": "Lehmkuhlen",
      "details": "15.01.2025 (Bekanntmachungsdatum)\n\nSchleswig-Holstein Amtsgericht Kiel HRB 14716\nLöschungsankündigung\n\nKieler Bau Verwaltungs UG (haftungsbeschränkt)\nGesellschaft mit beschränkter Haftung\nLehmkuhlen\n\nBei der nachstehenden Gesellschaft wird das Amtslöschungsverfahren gemäß § 395 FamFG eingeleitet. Widerspruchsfrist: 1 Monat."
    },
    {
      "date": "2025-01-15",
      "id": "98660",
      "original_text": "Sonstige Registerbekanntmachung\nSchleswig-Holstein Amtsgericht Kiel HRB 15974\nPLANET-TIK AG – Kiel",
      "type": "Sonstige Registerbekanntmachung",
      "state": "Schleswig-Holstein",
      "amtsgericht": "Amtsgericht Kiel",
      "registernummer": "HRB 15974",
      "registerart": "HRB",
      "company_name": "PLANET-TIK AG",
      "company_seat": "Kiel",
      "details": "15.01.2025 (Bekanntmachungsdatum)\n\nSchleswig-Holstein Amtsgericht Kiel HRB 15974\nSonstige Registerbekanntmachung\n\nPLANET-TIK AG\nAktiengesellschaft\nKiel\n\nAls nicht eingetragen wird veröffentlicht:Eine neue Liste der Aufsichtsratsmitglieder ist eingereicht worden."
    },
    {
      "date": "2025-01-15",
      "id": "98661",
      "original_text": "Einreichung neuer Dokumente\nSachsen Amtsgericht Leipzig HRB 3589\nLeipziger Dok - Filmwochen GmbH – Leipzig",
      "type": "Einreichung neuer Dokumente",
      "state": "Sachsen",
      "amtsgericht": "Amtsgericht Leipzig",
      "registernummer": "HRB 3589",
      "registerart": "HRB",
      "company_name": "Leipziger Dok - Filmwochen GmbH",
      "company_seat": "Leipzig",
      "details": "15.01.2025 (Bekanntmachungsdatum)\n\nSachsen Amtsgericht Leipzig HRB 3589\nEinreichung neuer Dokumente\n\nLeipziger Dok - Filmwochen GmbH\nGesellschaft mit beschränkter Haftung\nLeipzig\n\nAm 14.01.2025 wurde beim Handelsregister des Amtsgerichts Leipzig die Liste der Mitglieder des Aufsichtsrats gemäß § 52 GmbHG eingereicht."
    },
    {
      "date": "2025-01-15",
      "id": "98662",
      "original_text": "Löschungsankündigung\nSachsen Amtsgericht Chemnitz HRB 18313\nHeliotron GmbH – Claußnitz",
      "type": "Löschungsankündigung",
      "state": "Sachsen",
      "amtsgericht": "Amtsgericht Chemnitz",
      "registernummer": "HRB 18313",
      "registerart": "HRB",
      "company_name": "Heliotron GmbH",
      "company_seat": "Claußnitz",
      "details": "15.01.2025 (Bekanntmachungsdatum)\n\nSachsen Amtsgericht Chemnitz HRB 18313\nLöschungsankündigung\n\nHeliotron GmbH\nGesellschaft mit beschränkter Haftung\nClaußnitz\n\nDas Registergericht beabsichtigt, die im Handelsregister eingetragene Gesellschaft von Amts wegen nach § 394 FamFG zu löschen. Die Frist zu Erhebung eines Widerspruchs gegen die beabsichtigte Löschung wird auf einen Monat festgesetzt."
    },
    {
      "date": "2025-01-15",
      "id": "98663",
      "original_text": "Löschungsankündigung\nSachsen Amtsgericht Dresden HRB 39268\nOTS - Oberlausitzer Transportservice UG (haftungsbeschränkt) – Weißwasser",
      "type": "Löschungsankündigung",
      "state": "Sachsen",
      "amtsgericht": "Amtsgericht Dresden",
      "registernummer": "HRB 39268",
      "registerart": "HRB",
      "company_name": "OTS - Oberlausitzer Transportservice UG (haftungsbeschränkt)",
      "company_seat": "Weißwasser",
      "details": "15.01.2025 (Bekanntmachungsdatum)\n\nSachsen Amtsgericht Dresden HRB 39268\nLöschungsankündigung\n\nOTS - Oberlausitzer Transportservice UG (haftungsbeschränkt)\nGesellschaft mit beschränkter Haftung\nWeißwasser\n\nDas Registergericht beabsichtigt, die im Handelsregister eingetragene Gesellschaft von Amts wegen nach § 394 FamFG zu löschen. Die Frist zu Erhebung eines Widerspruchs gegen die beabsichtigte Löschung wird auf einen Monat festgesetzt."
    },
    {
      "date": "2025-01-15",
      "id": "98664",
      "original_text": "Sonstige Registerbekanntmachung\nSachsen Amtsgericht Chemnitz HRB 32034\nKernWerk GmbH – Chemnitz",
      "type": "Sonstige Registerbekanntmachung",
      "state": "Sachsen",
      "amtsgericht": "Amtsgericht Chemnitz",
      "registernummer": "HRB 32034",
      "registerart": "HRB",
      "company_name": "KernWerk GmbH",
      "company_seat": "Chemnitz",
      "details": "15.01.2025 (Bekanntmachungsdatum)\n\nSachsen Amtsgericht Chemnitz HRB 32034\nSonstige Registerbekanntmachung 15.01.2025 (Eintragungsdatum)\n\nKernWerk GmbH\nGesellschaft mit beschränkter Haftung\nChemnitz\n\nDen Gläubigern der Gesellschaft, deren Forderungen begründet worden sind bevor die Eintragung der Beendigung des Gewinnabführungsvertrages in das Handelsregister nach § 10 des Handelsgesetzbuches als bekanntgemacht gilt, hat der andere Vertragsteil Sicherheit zu leisten, wenn sie sich binnen sechs Monaten nach der Bekanntmachung der Eintragung zu diesem Zweck bei ihm melden."
    },
    {
      "date": "2025-01-15",
      "id": "98665",
      "original_text": "Einreichung neuer Dokumente\nSachsen Amtsgericht Chemnitz HRB 23846\nKur- und Gesundheitszentrum Warmbad Wolkenstein GmbH – Wolkenstein",
      "type": "Einreichung neuer Dokumente",
      "state": "Sachsen",
      "amtsgericht": "Amtsgericht Chemnitz",
      "registernummer": "HRB 23846",
      "registerart": "HRB",
      "company_name": "Kur- und Gesundheitszentrum Warmbad Wolkenstein GmbH",
      "company_seat": "Wolkenstein",
      "details": "15.01.2025 (Bekanntmachungsdatum)\n\nSachsen Amtsgericht Chemnitz HRB 23846\nEinreichung neuer Dokumente\n\nKur- und Gesundheitszentrum Warmbad Wolkenstein GmbH\nGesellschaft mit beschränkter Haftung\nWolkenstein\n\nAm 14.01.2025 wurde beim Handelsregister des Amtsgerichts Chemnitz die Liste der Mitglieder des Aufsichtsrats gemäß § 52 GmbHG eingereicht."
    },
    {
      "date": "2025-01-15",
      "id": "98666",
      "original_text": "Sonstige Registerbekanntmachung\nSachsen Amtsgericht Dresden HRB 18485\nKURIER Direktservice Dresden GmbH – Dresden",
      "type": "Sonstige Registerbekanntmachung",
      "state": "Sachsen",
      "amtsgericht": "Amtsgericht Dresden",
      "registernummer": "HRB 18485",
      "registerart": "HRB",
      "company_name": "KURIER Direktservice Dresden GmbH",
      "company_seat": "Dresden",
      "details": "15.01.2025 (Bekanntmachungsdatum)\n\nSachsen Amtsgericht Dresden HRB 18485\nSonstige Registerbekanntmachung 15.01.2025 (Eintragungsdatum)\n\nKURIER Direktservice Dresden GmbH\nGesellschaft mit beschränkter Haftung\nDresden\n\nDen Gläubigern der Gesellschaft, deren Forderungen begründet worden sind bevor die Eintragung der Beendigung des Beherrschungs- und Gewinnabführungsvertrages in das Handelsregister nach § 10 des Handelsgesetzbuches als bekanntgemacht gilt, hat der andere Vertragsteil Sicherheit zu leisten, wenn sie sich binnen sechs Monaten nach der Bekanntmachung der Eintragung zu diesem Zweck bei ihm melden."
    },
    {
      "date": "2025-01-15",
      "id": "98667",
      "original_text": "Sonstige Registerbekanntmachung\nSachsen Amtsgericht Leipzig HRB 22056\nEuropean Air Transport Leipzig GmbH – Schkeuditz",
      "type": "Sonstige Registerbekanntmachung",
      "state": "Sachsen",
      "amtsgericht": "Amtsgericht Leipzig",
      "registernummer": "HRB 22056",
      "registerart": "HRB",
      "company_name": "European Air Transport Leipzig GmbH",
      "company_seat": "Schkeuditz",
      "details": "15.01.2025 (Bekanntmachungsdatum)\n\nSachsen Amtsgericht Leipzig HRB 22056\nSonstige Registerbekanntmachung 15.01.2025 (Eintragungsdatum)\n\nEuropean Air Transport Leipzig GmbH\nGesellschaft mit beschränkter Haftung\nSchkeuditz\n\nDen Gläubigern der Gesellschaft, deren Forderungen begründet worden sind bevor die Eintragung der Beendigung des Beherrschungs- und Gewinnabführungsvertrages in das Handelsregister nach § 10 des Handelsgesetzbuches als bekanntgemacht gilt, hat der andere Vertragsteil Sicherheit zu leisten, wenn sie sich binnen sechs Monaten nach der Bekanntmachung der Eintragung zu diesem Zweck bei ihm melden."
    },
    {
      "date": "2025-01-15",
      "id": "98668",
      "original_text": "Löschungsankündigung\nSachsen Amtsgericht Chemnitz HRB 8812\nE:B:G Wohn- und Gewerbebau Chemnitz GmbH – Chemnitz",
      "type": "Löschungsankündigung",
      "state": "Sachsen",
      "amtsgericht": "Amtsgericht Chemnitz",
      "registernummer": "HRB 8812",
      "registerart": "HRB",
      "company_name": "E:B:G Wohn- und Gewerbebau Chemnitz GmbH",
      "company_seat": "Chemnitz",
      "details": "15.01.2025 (Bekanntmachungsdatum)\n\nSachsen Amtsgericht Chemnitz HRB 8812\nLöschungsankündigung\n\nE:B:G Wohn- und Gewerbebau Chemnitz GmbH\nGesellschaft mit beschränkter Haftung\nChemnitz\n\nDas Registergericht beabsichtigt, die im Handelsregister eingetragene Gesellschaft von Amts wegen nach § 394 FamFG zu löschen. Die Frist zu Erhebung eines Widerspruchs gegen die beabsichtigte Löschung wird auf einen Monat festgesetzt."
    },
    {
      "date": "2025-01-15",
      "id": "98669",
      "original_text": "Löschungsankündigung\nNiedersachsen Amtsgericht Braunschweig HRB 207693\nKurt UG (haftungsbeschränkt) – Wolfenbüttel",
      "type": "Löschungsankündigung",
      "state": "Niedersachsen",
      "amtsgericht": "Amtsgericht Braunschweig",
      "registernummer": "HRB 207693",
      "registerart": "HRB",
      "company_name": "Kurt UG (haftungsbeschränkt)",
      "company_seat": "Wolfenbüttel",
      "details": "15.01.2025 (Bekanntmachungsdatum)\n\nNiedersachsen Amtsgericht Braunschweig HRB 207693\nLöschungsankündigung\n\nKurt UG (haftungsbeschränkt)\nGesellschaft mit beschränkter Haftung\nWolfenbüttel\n\nDas Registergericht beabsichtigt, die Gesellschaft von Amts wegen nach § 394 FamFG zu löschen. Die Frist zur Erhebung eines Widerspruchs ist auf 1 Monat ab dieser Registerbekanntmachung festgesetzt."
    },
    {
      "date": "2025-01-15",
      "id": "98670",
      "original_text": "Löschungsankündigung\nNiedersachsen Amtsgericht Braunschweig HRB 100238 früher Amtsgericht Wolfsburg\nErgo-Sun Sonnenstudio GmbH – Wolfsburg",
      "type": "Löschungsankündigung",
      "state": "Niedersachsen",
      "amtsgericht": "Amtsgericht Braunschweig",
      "registernummer": "HRB 100238",
      "registerart": "HRB",
      "company_name": "Ergo-Sun Sonnenstudio GmbH",
      "company_seat": "Wolfsburg",
      "former_amtsgericht": "Wolfsburg",
      "details": "15.01.2025 (Bekanntmachungsdatum)\n\nNiedersachsen Amtsgericht Braunschweig HRB 100238 früher Amtsgericht Wolfsburg\nLöschungsankündigung\n\nErgo-Sun Sonnenstudio GmbH\nGesellschaft mit beschränkter Haftung\nWolfsburg\n\nDas Registergericht beabsichtigt, die Gesellschaft von Amts wegen nach § 394 FamFG zu löschen. Die Frist zur Erhebung eines Widerspruchs ist auf 1 Monat ab dieser Registerbekanntmachung festgesetzt."
    },
    {
      "date": "2025-01-15",
      "id": "98671",
      "original_text": "Löschungsankündigung\nNiedersachsen Amtsgericht Lüneburg HRB 120576 früher Amtsgericht Dannenberg (Elbe)\nValue-it Gesellschaft für Beratung und Coaching GmbH – Uelzen",
      "type": "Löschungsankündigung",
      "state": "Niedersachsen",
      "amtsgericht": "Amtsgericht Lüneburg",
      "registernummer": "HRB 120576",
      "registerart": "HRB",
      "company_name": "Value-it Gesellschaft für Beratung und Coaching GmbH",
      "company_seat": "Uelzen",
      "former_amtsgericht": "Dannenberg (Elbe)",
      "details": "15.01.2025 (Bekanntmachungsdatum)\n\nNiedersachsen Amtsgericht Lüneburg HRB 120576 früher Amtsgericht Dannenberg (Elbe)\nLöschungsankündigung\n\nValue-it Gesellschaft für Beratung und Coaching GmbH\nGesellschaft mit beschränkter Haftung\nUelzen\n\nDas Registergericht beabsichtigt, vorstehende Gesellschaft von Amts wegen nach § 394 FamFG zu löschen. Die Frist zur Erhebung eines Widerspruchs ist auf 1 Monat ab Veröffentlichung festgesetzt."
    },
    {
      "date": "2025-01-15",
      "id": "98672",
      "original_text": "Einreichung neuer Dokumente\nNiedersachsen Amtsgericht Göttingen HRB 204829\nGJ GmbH & Co. KGaA – Hann. Münden",
      "type": "Einreichung neuer Dokumente",
      "state": "Niedersachsen",
      "amtsgericht": "Amtsgericht Göttingen",
      "registernummer": "HRB 204829",
      "registerart": "HRB",
      "company_name": "GJ GmbH & Co. KGaA",
      "company_seat": "Hann. Münden",
      "details": "15.01.2025 (Bekanntmachungsdatum)\n\nNiedersachsen Amtsgericht Göttingen HRB 204829\nEinreichung neuer Dokumente 15.01.2025 (Eintragungsdatum)\n\nGJ GmbH & Co. KGaA\nKommanditgesellschaft auf Aktien\nHann. Münden\n\nDie Liste der Mitglieder des Aufsichtsrats wurde beim Registergericht eingereicht."
    },
    {
      "date": "2025-01-15",
      "id": "98673",
      "original_text": "Löschungsankündigung\nNiedersachsen Amtsgericht Braunschweig HRB 203266\nKSZ-KraftverkehrsausbildungSalzgitter UG (haftungsbeschränkt) – Salzgitter",
      "type": "Löschungsankündigung",
      "state": "Niedersachsen",
      "amtsgericht": "Amtsgericht Braunschweig",
      "registernummer": "HRB 203266",
      "registerart": "HRB",
      "company_name": "KSZ-KraftverkehrsausbildungSalzgitter UG (haftungsbeschränkt)",
      "company_seat": "Salzgitter",
      "details": "15.01.2025 (Bekanntmachungsdatum)\n\nNiedersachsen Amtsgericht Braunschweig HRB 203266\nLöschungsankündigung\n\nKSZ-KraftverkehrsausbildungSalzgitter UG (haftungsbeschränkt)\nGesellschaft mit beschränkter Haftung\nSalzgitter\n\nDas Registergericht beabsichtigt, die Gesellschaft von Amts wegen nach § 394 FamFG zu löschen. Die Frist zur Erhebung eines Widerspruchs ist auf 1 Monat ab dieser Registerbekanntmachung festgesetzt."
    },
    {
      "date": "2025-01-15",
      "id": "98674",
      "original_text": "Registerbekanntmachung nach dem Umwandlungsgesetz\nNiedersachsen Amtsgericht Göttingen HRB 120538\nServicegesellschaft Bad Sachsa mbH – Bad Sachsa",
      "type": "Registerbekanntmachung nach dem Umwandlungsgesetz",
      "state": "Niedersachsen",
      "amtsgericht": "Amtsgericht Göttingen",
      "registernummer": "HRB 120538",
      "registerart": "HRB",
      "company_name": "Servicegesellschaft Bad Sachsa mbH",
      "company_seat": "Bad Sachsa",
      "details": "15.01.2025 (Bekanntmachungsdatum)\n\nNiedersachsen Amtsgericht Göttingen HRB 120538\nRegisterbekanntmachung nach dem Umwandlungsgesetz 15.01.2025 (Eintragungsdatum)\n\nServicegesellschaft Bad Sachsa mbH\nGesellschaft mit beschränkter Haftung\nBad Sachsa\n\nDen Gläubigern der an der Verschmelzung beteiligten Rechtsträger ist, wenn sie binnen sechs Monaten nach dem Tag, an dem die Eintragung der Verschmelzung in das Register des Sitzes desjenigen Rechtsträgers, dessen Gläubiger sie sind, nach § 19  Abs.  3 UmwG als bekannt gemacht gilt, ihren Anspruch nach Grund und Höhe schriftlich anmelden, Sicherheit zu leisten, soweit sie nicht Befriedigung verlangen können. Dieses Recht steht den Gläubigern jedoch nur zu, wenn sie glaubhaft machen, dass durch die Verschmelzung die Erfüllung der Forderung gefährdet wird."
    },
    {
      "date": "2025-01-15",
      "id": "98675",
      "original_text": "Löschungsankündigung\nNiedersachsen Amtsgericht Osnabrück HRA 100147 früher Amtsgericht Lingen (Ems)\nJosef Jost-Westendorf Bauunternehmung GmbH & Co – Emsbüren",
      "type": "Löschungsankündigung",
      "state": "Niedersachsen",
      "amtsgericht": "Amtsgericht Osnabrück",
      "registernummer": "HRA 100147",
      "registerart": "HRA",
      "company_name": "Josef Jost-Westendorf Bauunternehmung GmbH & Co",
      "company_seat": "Emsbüren",
      "former_amtsgericht": "Lingen (Ems)",
      "details": "15.01.2025 (Bekanntmachungsdatum)\n\nNiedersachsen Amtsgericht Osnabrück HRA 100147 früher Amtsgericht Lingen (Ems)\nLöschungsankündigung\n\nJosef Jost-Westendorf Bauunternehmung GmbH & Co\nKommanditgesellschaft\nEmsbüren\n\nDas Registergericht beabsichtigt, die Firma von Amts wegen nach § 394 FamFG wegen Vermögenslosigkeit zu löschen. Die Frist zur Erhebung eines Widerspruchs ist auf 1 Monat ab dieser Registerbekanntmachung festgesetzt."
    },
    {
      "date": "2025-01-15",
      "id": "98676",
      "original_text": "Einreichung neuer Dokumente\nNiedersachsen Amtsgericht Göttingen HRB 206039\nArineo Holding GmbH – Göttingen",
      "type": "Einreichung neuer Dokumente",
      "state": "Niedersachsen",
      "amtsgericht": "Amtsgericht Göttingen",
      "registernummer": "HRB 206039",
      "registerart": "HRB",
      "company_name": "Arineo Holding GmbH",
      "company_seat": "Göttingen",
      "details": "15.01.2025 (Bekanntmachungsdatum)\n\nNiedersachsen Amtsgericht Göttingen HRB 206039\nEinreichung neuer Dokumente\n\nArineo Holding GmbH\nGesellschaft mit beschränkter Haftung\nGöttingen\n\nDie Liste der Mitglieder des Aufsichtsrats wurde beim Registergericht eingereicht."
    },
    {
      "date": "2025-01-15",
      "id": "98677",
      "original_text": "Sonstige Registerbekanntmachung\nBremen Amtsgericht Bremen HRB 31428\nCityGrund Kapital GmbH – Bremen",
      "type": "Sonstige Registerbekanntmachung",
      "state": "Bremen",
      "amtsgericht": "Amtsgericht Bremen",
      "registernummer": "HRB 31428",
      "registerart": "HRB",
      "company_name": "CityGrund Kapital GmbH",
      "company_seat": "Bremen",
      "details": "15.01.2025 (Bekanntmachungsdatum)\n\nBremen Amtsgericht Bremen HRB 31428\nSonstige Registerbekanntmachung\n\nCityGrund Kapital GmbH\nGesellschaft mit beschränkter Haftung\nBremen\n\nAls nicht eingetragen wird veröffentlicht: Gläubigern, deren Forderungen begründet worden sind, bevor die Eintragung des Beschlusses als nach § 10 des Handelsgesetzbuches bekannt gemacht gilt, ist, wenn sie sich binnen sechs Monaten nach der Bekanntmachung zu diesem Zweck melden, Sicherheit zu leisten, soweit sie nicht Befriedigung verlangen können. Dieses Recht steht den Gläubigern nicht zu, die im Fall des Insolvenzverfahrens ein Recht auf vorzugsweise Befriedigung aus der Deckungsmasse haben, die nach gesetzlicher Vorschrift zu ihrem Schutz errichtet und staatlich überwacht ist."
    },
    {
      "date": "2025-01-15",
      "id": "98678",
      "original_text": "Sonstige Registerbekanntmachung\nBremen Amtsgericht Bremen HRB 31735\nFindorff Projekt 1 GmbH – Bremen",
      "type": "Sonstige Registerbekanntmachung",
      "state": "Bremen",
      "amtsgericht": "Amtsgericht Bremen",
      "registernummer": "HRB 31735",
      "registerart": "HRB",
      "company_name": "Findorff Projekt 1 GmbH",
      "company_seat": "Bremen",
      "details": "15.01.2025 (Bekanntmachungsdatum)\n\nBremen Amtsgericht Bremen HRB 31735\nSonstige Registerbekanntmachung 10.01.2025 (Eintragungsdatum)\n\nFindorff Projekt 1 GmbH\nGesellschaft mit beschränkter Haftung\nBremen\n\nDer mit der CityGrund Invest GmbH mit Sitz in Bremen (Amtsgericht Bremen HRB 26320 HB) bestehende Gewinnabführungsvertrag vom 19.10.2018 ist durch Aufhebungsvereinbarung vom 19.09.2024 mit Wirkung zum 31.12.2024 aufgehoben."
    },
    {
      "date": "2025-01-15",
      "id": "98679",
      "original_text": "Einreichung neuer Dokumente\nRheinland-Pfalz Amtsgericht Wittlich HRB 4344\nITMediaConsult AG – Züsch",
      "type": "Einreichung neuer Dokumente",
      "state": "Rheinland-Pfalz",
      "amtsgericht": "Amtsgericht Wittlich",
      "registernummer": "HRB 4344",
      "registerart": "HRB",
      "company_name": "ITMediaConsult AG",
      "company_seat": "Züsch",
      "details": "15.01.2025 (Bekanntmachungsdatum)\n\nRheinland-Pfalz Amtsgericht Wittlich HRB 4344\nEinreichung neuer Dokumente\n\nITMediaConsult AG\nAktiengesellschaft\nZüsch\n\nDem Registergericht ist eine neue Liste der Mitglieder des Aufsichtsrates eingereicht worden."
    },
    {
      "date": "2025-01-15",
      "id": "98680",
      "original_text": "Registerbekanntmachung nach dem Umwandlungsgesetz\nNordrhein-Westfalen Amtsgericht Arnsberg HRA 9316\nANH Hospitality GmbH & Co. KG – Arnsberg",
      "type": "Registerbekanntmachung nach dem Umwandlungsgesetz",
      "state": "Nordrhein-Westfalen",
      "amtsgericht": "Amtsgericht Arnsberg",
      "registernummer": "HRA 9316",
      "registerart": "HRA",
      "company_name": "ANH Hospitality GmbH & Co. KG",
      "company_seat": "Arnsberg",
      "details": "15.01.2025 (Bekanntmachungsdatum)\n\nNordrhein-Westfalen Amtsgericht Arnsberg HRA 9316\nRegisterbekanntmachung nach dem Umwandlungsgesetz 15.01.2025 (Eintragungsdatum)\n\nANH Hospitality GmbH & Co. KG\nKommanditgesellschaft\nArnsberg\n\nDen Gläubigern der an der formwechselnden Umwandlung beteiligten Rechtsträger ist, wenn sie binnen sechs Monaten nach dem Tag, an dem die Eintragung der formwechselnden Umwandlung in das Register des Sitzes derjenigen Rechtsträger deren Gläubiger sie sind, nach § 19 Absatz 3 UmwG als bekanntgemacht gilt, ihren Anspruch nach Grund und Höhe schriftlich anmelden, Sicherheit zu leisten, soweit sie nicht Befriedigung verlangen können. Dieses Recht steht den Gläubigern jedoch nur zu, wenn sie glaubhaft machen, dass durch die formwechselnden Umwandlung die Erfüllung ihrer Forderung gefährdet wird."
    },
    {
      "date": "2025-01-15",
      "id": "98681",
      "original_text": "Registerbekanntmachung nach dem Umwandlungsgesetz\nNordrhein-Westfalen Amtsgericht Arnsberg HRA 9254\nDaniel Hauke e.K. – Meschede",
      "type": "Registerbekanntmachung nach dem Umwandlungsgesetz",
      "state": "Nordrhein-Westfalen",
      "amtsgericht": "Amtsgericht Arnsberg",
      "registernummer": "HRA 9254",
      "registerart": "HRA",
      "company_name": "Daniel Hauke e.K.",
      "company_seat": "Meschede",
      "details": "15.01.2025 (Bekanntmachungsdatum)\n\nNordrhein-Westfalen Amtsgericht Arnsberg HRA 9254\nRegisterbekanntmachung nach dem Umwandlungsgesetz 15.01.2025 (Eintragungsdatum)\n\nDaniel Hauke e.K.\nEinzelkaufmann / Einzelkauffrau\nMeschede\n\nDen Gläubigern der an der Ausgliederung beteiligten Rechtsträger ist, wenn sie binnen sechs Monaten nach dem Tag, an dem die Eintragung der Ausgliederung in das Register des Sitzes derjenigen Rechtsträger deren Gläubiger sie sind, nach § 19 Absatz 3 UmwG als bekanntgemacht gilt, ihren Anspruch nach Grund und Höhe schriftlich anmelden, Sicherheit zu leisten, soweit sie nicht Befriedigung verlangen können. Dieses Recht steht den Gläubigern jedoch nur zu, wenn sie glaubhaft machen, dass durch die Ausgliederung die Erfüllung ihrer Forderung gefährdet wird."
    },
    {
      "date": "2025-01-15",
      "id": "98682",
      "original_text": "Löschungsankündigung\nNordrhein-Westfalen Amtsgericht Wuppertal HRB 12332\nF.S.P Company Gesellschaft für innovatives Facility-Management mbH – Remscheid",
      "type": "Löschungsankündigung",
      "state": "Nordrhein-Westfalen",
      "amtsgericht": "Amtsgericht Wuppertal",
      "registernummer": "HRB 12332",
      "registerart": "HRB",
      "company_name": "F.S.P Company Gesellschaft für innovatives Facility-Management mbH",
      "company_seat": "Remscheid",
      "details": "15.01.2025 (Bekanntmachungsdatum)\n\nNordrhein-Westfalen Amtsgericht Wuppertal HRB 12332\nLöschungsankündigung\n\nF.S.P Company Gesellschaft für innovatives Facility-Management mbH\nGesellschaft mit beschränkter Haftung\nRemscheid\n\nDas Registergericht beabsichtigt die Gesellschaft von Amts wegen nach § 394 FamFG zu löschen. Die Frist zur Erhebung eines Widerspruchs ist auf einen Monat festgesetzt."
    },
    {
      "date": "2025-01-15",
      "id": "98683",
      "original_text": "Löschungsankündigung\nNordrhein-Westfalen Amtsgericht Krefeld HRB 14549\nSESTO SENSO Aktiengesellschaft – Krefeld",
      "type": "Löschungsankündigung",
      "state": "Nordrhein-Westfalen",
      "amtsgericht": "Amtsgericht Krefeld",
      "registernummer": "HRB 14549",
      "registerart": "HRB",
      "company_name": "SESTO SENSO Aktiengesellschaft",
      "company_seat": "Krefeld",
      "details": "15.01.2025 (Bekanntmachungsdatum)\n\nNordrhein-Westfalen Amtsgericht Krefeld HRB 14549\nLöschungsankündigung\n\nSESTO SENSO Aktiengesellschaft\nAktiengesellschaft\nKrefeld\n\nDas Registergericht beabsichtigt die Gesellschaft von Amts wegen nach § 394 FamFG zu löschen. Die Frist zur Erhebung eines Widerspruchs ist auf einen Monat festgesetzt."
    },
    {
      "date": "2025-01-15",
      "id": "98684",
      "original_text": "Einreichung neuer Dokumente\nNordrhein-Westfalen Amtsgericht Aachen HRB 8716\nCemeCon AG. – Würselen",
      "type": "Einreichung neuer Dokumente",
      "state": "Nordrhein-Westfalen",
      "amtsgericht": "Amtsgericht Aachen",
      "registernummer": "HRB 8716",
      "registerart": "HRB",
      "company_name": "CemeCon AG.",
      "company_seat": "Würselen",
      "details": "15.01.2025 (Bekanntmachungsdatum)\n\nNordrhein-Westfalen Amtsgericht Aachen HRB 8716\nEinreichung neuer Dokumente\n\nCemeCon AG.\nAktiengesellschaft\nWürselen\n\nDem Registergericht ist eine neue Liste der Mitglieder des Aufsichtsrates eingereicht worden."
    },
    {
      "date": "2025-01-15",
      "id": "98685",
      "original_text": "Löschungsankündigung\nNordrhein-Westfalen Amtsgericht Aachen HRB 3882\nHelmut Belten Handelsvertretungs-GmbH – Aachen",
      "type": "Löschungsankündigung",
      "state": "Nordrhein-Westfalen",
      "amtsgericht": "Amtsgericht Aachen",
      "registernummer": "HRB 3882",
      "registerart": "HRB",
      "company_name": "Helmut Belten Handelsvertretungs-GmbH",
      "company_seat": "Aachen",
      "details": "15.01.2025 (Bekanntmachungsdatum)\n\nNordrhein-Westfalen Amtsgericht Aachen HRB 3882\nLöschungsankündigung\n\nHelmut Belten Handelsvertretungs-GmbH\nGesellschaft mit beschränkter Haftung\nAachen\n\nDas Registergericht beabsichtigt, von Amts wegen folgende Eintragung wegen Unzulässigkeit nach § 395 FamFG zu löschen:\n\nNach den Erkenntnissen des Gerichts ist der im Handelsregister eingetragene Geschäftsführer der Gesellschaft Herr Helmut Albert Belten am 01.10.2024 verstorben.\n\nGemäß § 395 FamFG kann eine Eintragung im Handelsregister von Amts wegen gelöscht werden, wenn sie wegen des Mangels einer wesentlichen Voraussetzung unzulässig ist. Dies ist nach obigen Ausführungen der Fall.\n\nEs besteht Gelegenheit, binnen eines Monats den Fortbestand der Geschäftsführerstellung von Herrn Belten nachzuweisen oder innerhalb der Frist die Unterlassung durch Widerspruch gegen diese Verfügung zu rechtfertigen. Andernfalls wird das Gericht die Löschung von Amts wegen vornehmen und im Handelsregister eintragen.\n\nRechtsbehelfsbelehrung:\n\nGegen diese Verfügung kann Widerspruch eingelegt werden. Zum Widerspruch ist jeder berechtigt, der an der Unterlassung der Löschung ein berechtigtes Interesse hat.\n\nDer Widerspruch ist bei dem Amtsgericht Aachen, Adalbertsteinweg 92, 52070 Aachen schriftlich in deutscher Sprache oder zur Niederschrift der Geschäftsstelle einzulegen. Der Widerspruch kann auch zur Niederschrift der Geschäftsstelle eines jeden Amtsgerichtes abgegeben werden.\n\nDer Widerspruch muss spätestens innerhalb der gesetzten Frist nach der Bekanntgabe der Verfügung bei dem Amtsgericht Aachen eingegangen sein. Dies gilt auch dann, wenn der Widerspruch zur Niederschrift der Geschäftsstelle eines anderen Amtsgerichtes abgegeben wurde. Die Frist beginnt mit der Bekanntgabe der Verfügung durch Veröffentlichung. Fällt das Ende der Frist auf einen Sonntag, einen allgemeinen Feiertag oder Sonnabend, so endet die Frist mit Ablauf des nächsten Werktages.\n\nDer Widerspruch muss die Bezeichnung der angefochtenen Verfügung sowie die Erklärung enthalten, dass Widerspruch gegen diese Verfügung eingelegt wird. Er ist zu unterzeichnen und soll begründet werden.\n\nDie Einlegung ist auch durch Übertragung eines elektronischen Dokuments an die elektronische Poststelle des Gerichts möglich. Das elektronische Dokument muss für die Bearbeitung durch das Gericht geeignet und mit einer qualifizierten elektronischen Signatur der verantwortenden Person versehen sein oder von der verantwortenden Person signiert und auf einem sicheren Übermittlungsweg gemäß § 130 a ZPO nach näherer Maßgabe der Verordnung über die technischen Rahmenbedingungen des elektronischen Rechtsverkehrs und über das besondere elektronische Behördenpostfach (BGBl. I, S. 3803) eingereicht werden. Weitere Informationen erhalten Sie auf der Internetseite www.justiz.de."
    },
    {
      "date": "2025-01-15",
      "id": "98686",
      "original_text": "Löschungsankündigung\nNordrhein-Westfalen Amtsgericht Mönchengladbach HRB 19059\nAK-AY Food GmbH – Viersen",
      "type": "Löschungsankündigung",
      "state": "Nordrhein-Westfalen",
      "amtsgericht": "Amtsgericht Mönchengladbach",
      "registernummer": "HRB 19059",
      "registerart": "HRB",
      "company_name": "AK-AY Food GmbH",
      "company_seat": "Viersen",
      "details": "15.01.2025 (Bekanntmachungsdatum)\n\nNordrhein-Westfalen Amtsgericht Mönchengladbach HRB 19059\nLöschungsankündigung\n\nAK-AY Food GmbH\nGesellschaft mit beschränkter Haftung\nViersen\n\nAK-AY Food GmbH, Viersen (Amtsgericht Mönchengladbach, HRB 19059).\nDas Registergericht beabsichtigt, die im Handelsregister eingetragene Gesellschaft gemäß § 394 Absatz 1 FamFG wegen Vermögenslosigkeit von Amts wegen zu löschen. Gegen diese Verfügung kann Widerspruch eingelegt werden. Die Frist zur Erhebung eines Widerspruchs gegen die beabsichtigte Löschung von Amts wegen ist auf drei Monate festgesetzt."
    },
    {
      "date": "2025-01-15",
      "id": "98687",
      "original_text": "Löschungsankündigung\nNordrhein-Westfalen Amtsgericht Bonn HRB 28726\nBauunternehmen KAAN GmbH – Bornheim",
      "type": "Löschungsankündigung",
      "state": "Nordrhein-Westfalen",
      "amtsgericht": "Amtsgericht Bonn",
      "registernummer": "HRB 28726",
      "registerart": "HRB",
      "company_name": "Bauunternehmen KAAN GmbH",
      "company_seat": "Bornheim",
      "details": "15.01.2025 (Bekanntmachungsdatum)\n\nNordrhein-Westfalen Amtsgericht Bonn HRB 28726\nLöschungsankündigung\n\nBauunternehmen KAAN GmbH\nGesellschaft mit beschränkter Haftung\nBornheim\n\nDas Registergericht beabsichtigt die Gesellschaft von Amts wegen nach § 394 FamFG zu löschen. Die Frist zur Erhebung eines Widerspruchs ist auf einen Monat festgesetzt."
    },
    {
      "date": "2025-01-15",
      "id": "98688",
      "original_text": "Löschungsankündigung\nNordrhein-Westfalen Amtsgericht Duisburg HRB 37078\nfoodigo GmbH – Duisburg",
      "type": "Löschungsankündigung",
      "state": "Nordrhein-Westfalen",
      "amtsgericht": "Amtsgericht Duisburg",
      "registernummer": "HRB 37078",
      "registerart": "HRB",
      "company_name": "foodigo GmbH",
      "company_seat": "Duisburg",
      "details": "15.01.2025 (Bekanntmachungsdatum)\n\nNordrhein-Westfalen Amtsgericht Duisburg HRB 37078\nLöschungsankündigung\n\nfoodigo GmbH\nGesellschaft mit beschränkter Haftung\nDuisburg\n\nHRB 37078:\nfoodigo GmbH,\nDuisburg,\nNeumarkt 12-14\n47119 Duisburg. Das Registergericht beabsichtigt, die im Handelsregister eingetragene Gesellschaft gemäß § 394 Absatz 1 FamFG wegen Vermögenslosigkeit von Amts wegen zu löschen. Gegen diese Verfügung kann Widerspruch eingelegt werden. Die Frist zur Erhebung eines Widerspruchs gegen die beabsichtigte Löschung von Amts wegen ist auf drei Monate festgesetzt. Rechtsbehelfsbelehrung Der Widerspruch ist bei dem Amtsgericht Duisburg, Kardinal-Galen-Str. 124-132, 47058 Duisburg schriftlich in deutscher Sprache oder zur Niederschrift der Geschäftsstelle einzulegen. Der Widerspruch kann auch zur Niederschrift der Geschäftsstelle eines jeden Amtsgerichtes abgegeben werden. Die Einlegung ist auch durch Übertragung eines elektronischen Dokuments an die elektronische Poststelle des Gerichts möglich. Das elektronische Dokument muss für die Bearbeitung durch das Gericht geeignet und mit einer qualifizierten elektronischen Signatur der verantwortenden Person versehen sein oder von der verantwortenden Person signiert und auf einem sicheren Übermittlungsweg gemäß § 130 a ZPO nach näherer Maßgabe der Verordnung über die technischen Rahmenbedingungen des elektronischen Rechtsverkehrs und über das besondere elektronische Behördenpostfach (BGBl. I, S. 3803) eingereicht werden. Weitere Informationen erhalten Sie auf der Internetseite www.justiz.de <http://www.justiz.de>. Der Widerspruch muss spätestens innerhalb der gesetzten Frist bei dem Amtsgericht Duisburg eingegangen sein. Dies gilt auch dann, wenn der Widerspruch zur Niederschrift der Geschäftsstelle eines anderen Amtsgerichtes abgegeben wurde. Die Frist beginnt mit der Veröffentlichung. Fällt das Ende der Frist auf einen Sonntag, einen allgemeinen Feiertag oder Sonnabend, so endet die Frist mit Ablauf des nächsten Werktages. Der Widerspruch muss die Bezeichnung der angefochtenen Verfügung sowie die Erklärung enthalten, dass Widerspruch gegen diese Verfügung eingelegt wird. Er ist zu unterzeichnen und soll begründet werden."
    },
    {
      "date": "2025-01-15",
      "id": "98689",
      "original_text": "Löschungsankündigung\nNordrhein-Westfalen Amtsgericht Duisburg HRB 28131\nMAF Service GmbH – Duisburg",
      "type": "Löschungsankündigung",
      "state": "Nordrhein-Westfalen",
      "amtsgericht": "Amtsgericht Duisburg",
      "registernummer": "HRB 28131",
      "registerart": "HRB",
      "company_name": "MAF Service GmbH",
      "company_seat": "Duisburg",
      "details": "15.01.2025 (Bekanntmachungsdatum)\n\nNordrhein-Westfalen Amtsgericht Duisburg HRB 28131\nLöschungsankündigung\n\nMAF Service GmbH\nGesellschaft mit beschränkter Haftung\nDuisburg\n\nHRB 28131\nMAF Service GmbH\nWalter-Rathenau-Straße 46\n47229 Duisburg\nDas Registergericht beabsichtigt, die im Handelsregister  eingetragene Gesellschaft   gemäß § 394 FamFG wegen Vermögenslosigkeit von Amts wegen zu löschen. Gegen diese Verfügung kann Widerspruch eingelegt werden. Die Frist zur Erhebung eines Widerspruchs gegen die beabsichtigte Löschung von Amts wegen ist auf drei Monate festgesetzt. Rechtsbehelfsbelehrung Der Widerspruch ist bei dem Amtsgericht Duisburg, Kardinal-Galen-Str. 124-132, 47058 Duisburg schriftlich in deutscher Sprache oder zur Niederschrift der Geschäftsstelle einzulegen. Der Widerspruch kann auch zur Niederschrift der Geschäftsstelle eines jeden Amtsgerichtes abgegeben werden. Die Einlegung ist auch durch Übertragung eines elektronischen Dokuments an die elektronische Poststelle des Gerichts möglich. Das elektronische Dokument muss für die Bearbeitung durch das Gericht geeignet und mit einer qualifizierten elektronischen Signatur der verantwortenden Person versehen sein oder von der verantwortenden Person signiert und auf einem sicheren Übermittlungsweg gemäß § 130 a ZPO nach näherer Maßgabe der Verordnung über die technischen Rahmenbedingungen des elektronischen Rechtsverkehrs und über das besondere elektronische Behördenpostfach (BGBl. I, S. 3803) eingereicht werden. Weitere Informationen erhalten Sie auf der Internetseite www.justiz.de <http://www.justiz.de>. Der Widerspruch muss spätestens innerhalb der gesetzten Frist bei dem Amtsgericht Duisburg eingegangen sein. Dies gilt auch dann, wenn der Widerspruch zur Niederschrift der Geschäftsstelle eines anderen Amtsgerichtes abgegeben wurde. Die Frist beginnt mit der Veröffentlichung. Fällt das Ende der Frist auf einen Sonntag, einen allgemeinen Feiertag oder Sonnabend, so endet die Frist mit Ablauf des nächsten Werktages. Der Widerspruch muss die Bezeichnung der angefochtenen Verfügung sowie die Erklärung enthalten, dass Widerspruch gegen diese Verfügung eingelegt wird. Er ist zu unterzeichnen und soll begründet werden."
    },
    {
      "date": "2025-01-15",
      "id": "98690",
      "original_text": "Registerbekanntmachung nach dem Umwandlungsgesetz\nNordrhein-Westfalen Amtsgericht Köln HRB 84122\nDruckluft Walk GmbH – Köln",
      "type": "Registerbekanntmachung nach dem Umwandlungsgesetz",
      "state": "Nordrhein-Westfalen",
      "amtsgericht": "Amtsgericht Köln",
      "registernummer": "HRB 84122",
      "registerart": "HRB",
      "company_name": "Druckluft Walk GmbH",
      "company_seat": "Köln",
      "details": "15.01.2025 (Bekanntmachungsdatum)\n\nNordrhein-Westfalen Amtsgericht Köln HRB 84122\nRegisterbekanntmachung nach dem Umwandlungsgesetz 15.01.2025 (Eintragungsdatum)\n\nDruckluft Walk GmbH\nGesellschaft mit beschränkter Haftung\nKöln\n\nDen Gläubigern der an der Verschmelzung beteiligten Rechtsträger ist, wenn sie binnen sechs Monaten nach dem Tag, an dem die Eintragung der Verschmelzung in das Register des Sitzes desjenigen Rechtsträgers, dessen Gläubiger sie sind, nach § 19 Absatz 3 UmwG als bekanntgemacht gilt, ihren Anspruch nach Grund und Höhe schriftlich anmelden, Sicherheit zu leisten, soweit sie nicht Befriedigung verlangen können. Dieses Recht steht den Gläubigern jedoch nur zu, wenn sie glaubhaft machen, dass durch die Verschmelzung die Erfüllung ihrer Forderung gefährdet wird."
    },
    {
      "date": "2025-01-15",
      "id": "98691",
      "original_text": "Registerbekanntmachung nach dem Umwandlungsgesetz\nNordrhein-Westfalen Amtsgericht Bonn HRB 29234\nMSJ Hammer Holding GmbH – Alfter",
      "type": "Registerbekanntmachung nach dem Umwandlungsgesetz",
      "state": "Nordrhein-Westfalen",
      "amtsgericht": "Amtsgericht Bonn",
      "registernummer": "HRB 29234",
      "registerart": "HRB",
      "company_name": "MSJ Hammer Holding GmbH",
      "company_seat": "Alfter",
      "details": "15.01.2025 (Bekanntmachungsdatum)\n\nNordrhein-Westfalen Amtsgericht Bonn HRB 29234\nRegisterbekanntmachung nach dem Umwandlungsgesetz 15.01.2025 (Eintragungsdatum)\n\nMSJ Hammer Holding GmbH\nGesellschaft mit beschränkter Haftung\nAlfter\n\nDen Gläubigern der an der Ausgliederung beteiligten Rechtsträger ist, wenn sie binnen sechs Monaten nach dem Tag, an dem die Eintragung der Ausgliederung in das Register des Sitzes desjenigen Rechtsträgers, dessen Gläubiger sie sind, nach § 19 Absatz 3 UmwG als bekanntgemacht gilt, ihren Anspruch nach Grund und Höhe schriftlich anmelden, Sicherheit zu leisten, soweit sie nicht Befriedigung verlangen können. Dieses Recht steht den Gläubigern jedoch nur zu, wenn sie glaubhaft machen, dass durch die Ausgliederung die Erfüllung ihrer Forderung gefährdet wird."
    },
    {
      "date": "2025-01-15",
      "id": "98692",
      "original_text": "Löschungsankündigung\nNordrhein-Westfalen Amtsgericht Düsseldorf HRB 87269\nMaric GmbH – Düsseldorf",
      "type": "Löschungsankündigung",
      "state": "Nordrhein-Westfalen",
      "amtsgericht": "Amtsgericht Düsseldorf",
      "registernummer": "HRB 87269",
      "registerart": "HRB",
      "company_name": "Maric GmbH",
      "company_seat": "Düsseldorf",
      "details": "15.01.2025 (Bekanntmachungsdatum)\n\nNordrhein-Westfalen Amtsgericht Düsseldorf HRB 87269\nLöschungsankündigung\n\nMaric GmbH\nGesellschaft mit beschränkter Haftung\nDüsseldorf\n\nDas Registergericht beabsichtigt die Gesellschaft von Amts wegen nach § 394 FamFG zu löschen. Die Frist zur Erhebung eines Widerspruchs ist auf 3 Wochen festgesetzt.\n\nRechtsbehelfsbelehrung:\nDas Widerspruchsrecht steht jedem zu, der an der Unterlassung der Löschung ein berechtigtes Interesse hat. Der Widerspruch ist bei dem Amtsgericht Düsseldorf -Registergericht-, Werdener Straße 1, 40227 Düsseldorf schriftlich in deutscher Sprache oder zur Niederschrift der Geschäftsstelle einzulegen. Der Widerspruch kann auch zur Niederschrift der Geschäftsstelle eines jeden Amtsgerichtes abgegeben werden. Die Einlegung ist auch durch Übertragung eines elektronischen Dokuments an die elektronische Poststelle des Gerichts möglich. Das elektronische Dokument muss für die Bearbeitung durch das Gericht geeignet und mit einer qualifizierten elektronischen Signatur der verantwortenden Person versehen sein oder von der verantwortenden Person signiert und auf einem sicheren Übermittlungsweg gemäß § 130a ZPO nach näherer Maßgabe der Verordnung über die technischen Rahmenbedingungen des elektronischen Rechtsverkehrs und über das besondere elektronische Behördenpostfach (BGBl. I, S.3803) eingereicht werden. Weitere Informationen erhalten Sie auf der Internetseite www.justiz.de.\nDer Widerspruch muss spätestens innerhalb der gesetzten Frist nach dem Datum der Bekanntmachung der Löschungsankündigung bei dem Amtsgericht - Registergericht - Düsseldorf eingegangen sein.  Dies gilt auch dann, wenn der Widerspruch zur Niederschrift der Geschäftsstelle eines anderen Amtsgerichtes abgegeben wurde. Die Frist beginnt mit dem Tage der Bekanntmachung der Löschungsankündigung in dem für die Bekanntmachung der Eintragungen in das Handelsregister bestimmten elektronischen Informations- und Kommunikationssystem nach § 10 des Handelsgesetzbuches. Fällt das Ende der Frist auf einen Sonntag, einen allgemeinen Feiertag oder Sonnabend, so endet die Frist mit Ablauf des nächsten Werktages.\nDer Widerspruch muss die Bezeichnung der angefochtenen Löschungsankündigung sowie die Erklärung enthalten, dass Widerspruch gegen diese Löschungsankündigung eingelegt wird. Er ist zu unterzeichnen und soll begründet werden."
    },
    {
      "date": "2025-01-15",
      "id": "98693",
      "original_text": "Löschungsankündigung\nNordrhein-Westfalen Amtsgericht Aachen VR 2007\nVereinigte Musikarbeitsgemeinschaft – Aachen",
      "type": "Löschungsankündigung",
      "state": "Nordrhein-Westfalen",
      "amtsgericht": "Amtsgericht Aachen",
      "registernummer": "VR 2007",
      "registerart": "VR",
      "company_name": "Vereinigte Musikarbeitsgemeinschaft",
      "company_seat": "Aachen",
      "details": "15.01.2025 (Bekanntmachungsdatum)\n\nNordrhein-Westfalen Amtsgericht Aachen VR 2007\nLöschungsankündigung\n\nVereinigte Musikarbeitsgemeinschaft\neingetragener Verein\nAachen\n\nDas Registergericht beabsichtigt, von Amts wegen den Verein wegen Wegfall aller Mitglieder wegen Unzulässigkeit nach § 395 FamFG zu löschen.\n\nZur Geltendmachung des Widerspruchs gegen die beabsichtigte Löschung wird hiermit eine Frist von einem Monat ab Veröffentlichung dieser Ankündigung bestimmt.\n\nRechtsbehelfsbelehrung:\n\nGegen diese Verfügung kann Widerspruch eingelegt werden. Zum Widerspruch ist jeder berechtigt, der an der Unterlassung der Löschung ein berechtigtes Interesse hat.\n\nDer Widerspruch ist bei dem Amtsgericht Aachen, Adalbertsteinweg 92, 52070 Aachen schriftlich in deutscher Sprache oder zur Niederschrift der Geschäftsstelle einzulegen. Der Widerspruch kann auch zur Niederschrift der Geschäftsstelle eines jeden Amtsgerichtes abgegeben werden.\n\nDer Widerspruch muss spätestens innerhalb der gesetzten Frist nach der Bekanntgabe der Verfügung bei dem Amtsgericht Aachen eingegangen sein. Dies gilt auch dann, wenn der Widerspruch zur Niederschrift der Geschäftsstelle eines anderen Amtsgerichtes abgegeben wurde. Die Frist beginnt mit der Bekanntgabe der Verfügung durch Veröffentlichung. Fällt das Ende der Frist auf einen Sonntag, einen allgemeinen Feiertag oder Sonnabend, so endet die Frist mit Ablauf des nächsten Werktages.\n\nDer Widerspruch muss die Bezeichnung der angefochtenen Verfügung sowie die Erklärung enthalten, dass Widerspruch gegen diese Verfügung eingelegt wird. Er ist zu unterzeichnen und soll begründet werden.\n\nDie Einlegung ist auch durch Übertragung eines elektronischen Dokuments an die elektronische Poststelle des Gerichts möglich. Das elektronische Dokument muss für die Bearbeitung durch das Gericht geeignet und mit einer qualifizierten elektronischen Signatur der verantwortenden Person versehen sein oder von der verantwortenden Person signiert und auf einem sicheren Übermittlungsweg gemäß § 130 a ZPO nach näherer Maßgabe der Verordnung über die technischen Rahmenbedingungen des elektronischen Rechtsverkehrs und über das besondere elektronische Behördenpostfach (BGBl. I, S. 3803) eingereicht werden. Weitere Informationen erhalten Sie auf der Internetseite www.justiz.de."
    },
    {
      "date": "2025-01-15",
      "id": "98694",
      "original_text": "Löschungsankündigung\nNordrhein-Westfalen Amtsgericht Düsseldorf HRB 90851\nShuttle Driver GmbH – Düsseldorf",
      "type": "Löschungsankündigung",
      "state": "Nordrhein-Westfalen",
      "amtsgericht": "Amtsgericht Düsseldorf",
      "registernummer": "HRB 90851",
      "registerart": "HRB",
      "company_name": "Shuttle Driver GmbH",
      "company_seat": "Düsseldorf",
      "details": "15.01.2025 (Bekanntmachungsdatum)\n\nNordrhein-Westfalen Amtsgericht Düsseldorf HRB 90851\nLöschungsankündigung\n\nShuttle Driver GmbH\nGesellschaft mit beschränkter Haftung\nDüsseldorf\n\nDas Registergericht beabsichtigt die Gesellschaft von Amts wegen nach § 394 FamFG zu löschen. Die Frist zur Erhebung eines Widerspruchs ist auf drei Wochen festgesetzt.\n\nRechtsbehelfsbelehrung:\nDas Widerspruchsrecht steht jedem zu, der an der Unterlassung der Löschung ein berechtigtes Interesse hat. Der Widerspruch ist bei dem Amtsgericht Düsseldorf -Registergericht-, Werdener Straße 1, 40227 Düsseldorf schriftlich in deutscher Sprache oder zur Niederschrift der Geschäftsstelle einzulegen. Der Widerspruch kann auch zur Niederschrift der Geschäftsstelle eines jeden Amtsgerichtes abgegeben werden. Die Einlegung ist auch durch Übertragung eines elektronischen Dokuments an die elektronische Poststelle des Gerichts möglich. Das elektronische Dokument muss für die Bearbeitung durch das Gericht geeignet und mit einer qualifizierten elektronischen Signatur der verantwortenden Person versehen sein oder von der verantwortenden Person signiert und auf einem sicheren Übermittlungsweg gemäß § 130a ZPO nach näherer Maßgabe der Verordnung über die technischen Rahmenbedingungen des elektronischen Rechtsverkehrs und über das besondere elektronische Behördenpostfach (BGBl. I, S.3803) eingereicht werden. Weitere Informationen erhalten Sie auf der Internetseite www.justiz.de.\nDer Widerspruch muss spätestens innerhalb der gesetzten Frist nach dem Datum der Bekanntmachung der Löschungsankündigung bei dem Amtsgericht - Registergericht - Düsseldorf eingegangen sein.  Dies gilt auch dann, wenn der Widerspruch zur Niederschrift der Geschäftsstelle eines anderen Amtsgerichtes abgegeben wurde. Die Frist beginnt mit dem Tage der Bekanntmachung der Löschungsankündigung in dem für die Bekanntmachung der Eintragungen in das Handelsregister bestimmten elektronischen Informations- und Kommunikationssystem nach § 10 des Handelsgesetzbuches. Fällt das Ende der Frist auf einen Sonntag, einen allgemeinen Feiertag oder Sonnabend, so endet die Frist mit Ablauf des nächsten Werktages.\nDer Widerspruch muss die Bezeichnung der angefochtenen Löschungsankündigung sowie die Erklärung enthalten, dass Widerspruch gegen diese Löschungsankündigung eingelegt wird. Er ist zu unterzeichnen und soll begründet werden."
    },
    {
      "date": "2025-01-15",
      "id": "98695",
      "original_text": "Registerbekanntmachung nach dem Umwandlungsgesetz\nNordrhein-Westfalen Amtsgericht Düsseldorf HRB 49461\nDas Zahlenwerk Steuerberatungsgesellschaft mbH – Düsseldorf",
      "type": "Registerbekanntmachung nach dem Umwandlungsgesetz",
      "state": "Nordrhein-Westfalen",
      "amtsgericht": "Amtsgericht Düsseldorf",
      "registernummer": "HRB 49461",
      "registerart": "HRB",
      "company_name": "Das Zahlenwerk Steuerberatungsgesellschaft mbH",
      "company_seat": "Düsseldorf",
      "details": "15.01.2025 (Bekanntmachungsdatum)\n\nNordrhein-Westfalen Amtsgericht Düsseldorf HRB 49461\nRegisterbekanntmachung nach dem Umwandlungsgesetz 15.01.2025 (Eintragungsdatum)\n\nDas Zahlenwerk Steuerberatungsgesellschaft mbH\nGesellschaft mit beschränkter Haftung\nDüsseldorf\n\nDen Gläubigern der an der Verschmelzung beteiligten Rechtsträger ist, wenn sie binnen sechs Monaten nach dem Tag, an dem die Eintragung der Verschmelzung in das Register des Sitzes desjenigen Rechtsträgers, dessen Gläubiger sie sind, nach § 19 Absatz 3 UmwG als bekanntgemacht gilt, ihren Anspruch nach Grund und Höhe schriftlich anmelden, Sicherheit zu leisten, soweit sie nicht Befriedigung verlangen können. Dieses Recht steht den Gläubigern jedoch nur zu, wenn sie glaubhaft machen, dass durch die Verschmelzung die Erfüllung ihrer Forderung gefährdet wird."
    },
    {
      "date": "2025-01-15",
      "id": "98696",
      "original_text": "Registerbekanntmachung nach dem Umwandlungsgesetz\nNordrhein-Westfalen Amtsgericht Düsseldorf HRB 60650\nELWISS Rheinland GmbH Steuerberatungsgesellschaft – Düsseldorf",
      "type": "Registerbekanntmachung nach dem Umwandlungsgesetz",
      "state": "Nordrhein-Westfalen",
      "amtsgericht": "Amtsgericht Düsseldorf",
      "registernummer": "HRB 60650",
      "registerart": "HRB",
      "company_name": "ELWISS Rheinland GmbH Steuerberatungsgesellschaft",
      "company_seat": "Düsseldorf",
      "details": "15.01.2025 (Bekanntmachungsdatum)\n\nNordrhein-Westfalen Amtsgericht Düsseldorf HRB 60650\nRegisterbekanntmachung nach dem Umwandlungsgesetz 15.01.2025 (Eintragungsdatum)\n\nELWISS Rheinland GmbH Steuerberatungsgesellschaft\nGesellschaft mit beschränkter Haftung\nDüsseldorf\n\nDen Gläubigern der an der Verschmelzung beteiligten Rechtsträger ist, wenn sie binnen sechs Monaten nach dem Tag, an dem die Eintragung der Verschmelzung in das Register des Sitzes desjenigen Rechtsträgers, dessen Gläubiger sie sind, nach § 19 Absatz 3 UmwG als bekanntgemacht gilt, ihren Anspruch nach Grund und Höhe schriftlich anmelden, Sicherheit zu leisten, soweit sie nicht Befriedigung verlangen können. Dieses Recht steht den Gläubigern jedoch nur zu, wenn sie glaubhaft machen, dass durch die Verschmelzung die Erfüllung ihrer Forderung gefährdet wird."
    },
    {
      "date": "2025-01-15",
      "id": "98697",
      "original_text": "Einreichung neuer Dokumente\nNordrhein-Westfalen Amtsgericht Arnsberg HRB 10542\nDeutsches Rotes Kreuz Soziale Dienste Meschede gemeinnützige GmbH – Meschede",
      "type": "Einreichung neuer Dokumente",
      "state": "Nordrhein-Westfalen",
      "amtsgericht": "Amtsgericht Arnsberg",
      "registernummer": "HRB 10542",
      "registerart": "HRB",
      "company_name": "Deutsches Rotes Kreuz Soziale Dienste Meschede gemeinnützige GmbH",
      "company_seat": "Meschede",
      "details": "15.01.2025 (Bekanntmachungsdatum)\n\nNordrhein-Westfalen Amtsgericht Arnsberg HRB 10542\nEinreichung neuer Dokumente 15.01.2025 (Eintragungsdatum)\n\nDeutsches Rotes Kreuz Soziale Dienste Meschede gemeinnützige GmbH\nGesellschaft mit beschränkter Haftung\nMeschede\n\nDem Registergericht ist eine neue Liste der Mitglieder des Aufsichtsrates eingereicht worden."
    },
    {
      "date": "2025-01-15",
      "id": "98698",
      "original_text": "Registerbekanntmachung nach dem Umwandlungsgesetz\nThüringen Amtsgericht Jena HRA 202988\n\"Alte Ziegelei\" GmbH & Co. KG – Altenburg",
      "type": "Registerbekanntmachung nach dem Umwandlungsgesetz",
      "state": "Thüringen",
      "amtsgericht": "Amtsgericht Jena",
      "registernummer": "HRA 202988",
      "registerart": "HRA",
      "company_name": "\"Alte Ziegelei\" GmbH & Co. KG",
      "company_seat": "Altenburg",
      "details": "15.01.2025 (Bekanntmachungsdatum)\n\nThüringen Amtsgericht Jena HRA 202988\nRegisterbekanntmachung nach dem Umwandlungsgesetz 15.01.2025 (Eintragungsdatum)\n\n\"Alte Ziegelei\" GmbH & Co. KG\nKommanditgesellschaft\nAltenburg\n\nNicht eingetragen: Den Gläubigern des formwechselnden  Rechtsträgers, ist wenn sie binnen sechs Monaten nach dem Tag, an dem die Eintragung des Formwechsels nach § 201 UmwG als bekanntgemacht gilt, ihren Anspruch nach Grund und Höhe schriftlich anmelden, Sicherheit zu leisten, soweit sie nicht Befriedigung verlangen können. Dieses Recht steht ihnen jedoch nur zu, wenn sie glaubhaft machen, daß durch den Formwechsel die Erfüllung ihrer Forderung gefährdet wird."
    },
    {
      "date": "2025-01-15",
      "id": "98699",
      "original_text": "Registerbekanntmachung nach dem Umwandlungsgesetz\nThüringen Amtsgericht Jena HRA 506938\nUlrich Wurzbacher Landwirtschaftsbetrieb e.K. – Remptendorf",
      "type": "Registerbekanntmachung nach dem Umwandlungsgesetz",
      "state": "Thüringen",
      "amtsgericht": "Amtsgericht Jena",
      "registernummer": "HRA 506938",
      "registerart": "HRA",
      "company_name": "Ulrich Wurzbacher Landwirtschaftsbetrieb e.K.",
      "company_seat": "Remptendorf",
      "details": "15.01.2025 (Bekanntmachungsdatum)\n\nThüringen Amtsgericht Jena HRA 506938\nRegisterbekanntmachung nach dem Umwandlungsgesetz 15.01.2025 (Eintragungsdatum)\n\nUlrich Wurzbacher Landwirtschaftsbetrieb e.K.\nEinzelkaufmann / Einzelkauffrau\nRemptendorf\n\nNicht eingetragen: Den Gläubigern der an der Ausgliederung beteiligten Rechtsträger, ist wenn sie binnen sechs Monaten nach dem Tag, an dem die Eintragung der Ausgliederung in das Register des Sitzes desjenigen Rechtsträgers, dessen Gläubiger sie sind, nach §§125, 19 Abs. 3 UmwG als bekanntgemacht gilt, ihren Anspruch nach Grund und Höhe schriftlich anmelden, Sicherheit zu leisten, soweit sie nicht Befriedigung verlangen können. Dieses Recht steht ihnen jedoch nur zu, wenn sie glaubhaft machen, daß durch die Ausgliederung die Erfüllung ihrer Forderung gefährdet wird."
    },
    {
      "date": "2025-01-15",
      "id": "98700",
      "original_text": "Löschungsankündigung\nHessen Amtsgericht Frankfurt am Main HRB 123324\nH One GmbH – Frankfurt am Main",
      "type": "Löschungsankündigung",
      "state": "Hessen",
      "amtsgericht": "Amtsgericht Frankfurt am Main",
      "registernummer": "HRB 123324",
      "registerart": "HRB",
      "company_name": "H One GmbH",
      "company_seat": "Frankfurt am Main",
      "details": "15.01.2025 (Bekanntmachungsdatum)\n\nHessen Amtsgericht Frankfurt am Main HRB 123324\nLöschungsankündigung\n\nH One GmbH\nGesellschaft mit beschränkter Haftung\nFrankfurt am Main\n\nDas Registergericht beabsichtigt die im Handelsregister eingetragene Gesellschaft von Amts wegen nach § 394 FamFG zu löschen. Die Frist zur Erhebung eines Widerspruchs gegen die beabsichtigte Löschung wird auf 1 Monat festgesetzt."
    },
    {
      "date": "2025-01-15",
      "id": "98701",
      "original_text": "Registerbekanntmachung nach dem Umwandlungsgesetz\nHessen Amtsgericht Darmstadt HRB 102067\nbenjamin GmbH – Roßdorf",
      "type": "Registerbekanntmachung nach dem Umwandlungsgesetz",
      "state": "Hessen",
      "amtsgericht": "Amtsgericht Darmstadt",
      "registernummer": "HRB 102067",
      "registerart": "HRB",
      "company_name": "benjamin GmbH",
      "company_seat": "Roßdorf",
      "details": "15.01.2025 (Bekanntmachungsdatum)\n\nHessen Amtsgericht Darmstadt HRB 102067\nRegisterbekanntmachung nach dem Umwandlungsgesetz 15.01.2025 (Eintragungsdatum)\n\nbenjamin GmbH\nGesellschaft mit beschränkter Haftung\nRoßdorf\n\nDen Gläubigern der an der Verschmelzung beteiligten Rechtsträger ist, wenn sie binnen sechs Monaten nach dem Tag, an dem die Eintragung der Verschmelzung in das Register des Sitzes derjenigen Rechtsträger deren Gläubiger sie sind, nach § 19 Absatz 3 UmwG bekannt gemacht worden ist, ihren Anspruch nach Grund und Höhe schriftlich anmelden, Sicherheit zu leisten, soweit sie nicht Befriedigung verlangen können. Dieses Recht steht den Gläubigern jedoch nur zu, wenn sie glaubhaft machen, dass durch die Verschmelzung die Erfüllung ihrer Forderung gefährdet wird."
    },
    {
      "date": "2025-01-15",
      "id": "98702",
      "original_text": "Löschungsankündigung\nHessen Amtsgericht Bad Homburg v.d.H. HRB 15755\nMAA-Security GmbH – Steinbach (Taunus)",
      "type": "Löschungsankündigung",
      "state": "Hessen",
      "amtsgericht": "Amtsgericht Bad Homburg v.d.H.",
      "registernummer": "HRB 15755",
      "registerart": "HRB",
      "company_name": "MAA-Security GmbH",
      "company_seat": "Steinbach (Taunus)",
      "details": "15.01.2025 (Bekanntmachungsdatum)\n\nHessen Amtsgericht Bad Homburg v.d.H. HRB 15755\nLöschungsankündigung 09.11.2023 (Eintragungsdatum)\n\nMAA-Security GmbH\nGesellschaft mit beschränkter Haftung\nSteinbach (Taunus)\n\nDas Registergericht beabsichtigt die im Handelsregister eingetragene Gesellschaft von Amts wegen nach § 394 FamFG zu löschen. Die Frist zur Erhebung eines Widerspruchs gegen die beabsichtigte Löschung wird auf 3 Monate festgesetzt."
    },
    {
      "date": "2025-01-15",
      "id": "98703",
      "original_text": "Löschungsankündigung\nHessen Amtsgericht Frankfurt am Main HRB 99922\nDYKUN ImmoService GmbH – Frankfurt am Main",
      "type": "Löschungsankündigung",
      "state": "Hessen",
      "amtsgericht": "Amtsgericht Frankfurt am Main",
      "registernummer": "HRB 99922",
      "registerart": "HRB",
      "company_name": "DYKUN ImmoService GmbH",
      "company_seat": "Frankfurt am Main",
      "details": "15.01.2025 (Bekanntmachungsdatum)\n\nHessen Amtsgericht Frankfurt am Main HRB 99922\nLöschungsankündigung\n\nDYKUN ImmoService GmbH\nGesellschaft mit beschränkter Haftung\nFrankfurt am Main\n\nDas Registergericht beabsichtigt die im Handelsregister eingetragene Gesellschaft von Amts wegen nach § 394 FamFG zu löschen. Die Frist zur Erhebung eines Widerspruchs gegen die beabsichtigte Löschung wird auf 1 Monat festgesetzt."
    },
    {
      "date": "2025-01-15",
      "id": "98704",
      "original_text": "Löschungsankündigung\nHessen Amtsgericht Darmstadt HRB 100243\nPrima Clean Gebäudereinigung GmbH – Rüsselsheim",
      "type": "Löschungsankündigung",
      "state": "Hessen",
      "amtsgericht": "Amtsgericht Darmstadt",
      "registernummer": "HRB 100243",
      "registerart": "HRB",
      "company_name": "Prima Clean Gebäudereinigung GmbH",
      "company_seat": "Rüsselsheim",
      "details": "15.01.2025 (Bekanntmachungsdatum)\n\nHessen Amtsgericht Darmstadt HRB 100243\nLöschungsankündigung 15.01.2025 (Eintragungsdatum)\n\nPrima Clean Gebäudereinigung GmbH\nGesellschaft mit beschränkter Haftung\nRüsselsheim\n\nDas Registergericht beabsichtigt die im Handelsregister eingetragene Gesellschaft von Amts wegen nach § 394 FamFG zu löschen. Die Frist zur Erhebung eines Widerspruchs gegen die beabsichtigte Löschung wird auf 3 Monate festgesetzt."
    },
    {
      "date": "2025-01-15",
      "id": "98705",
      "original_text": "Löschungsankündigung\nHessen Amtsgericht Bad Hersfeld HRB 2476\nBuspool 2020 GmbH – Bad Hersfeld",
      "type": "Löschungsankündigung",
      "state": "Hessen",
      "amtsgericht": "Amtsgericht Bad Hersfeld",
      "registernummer": "HRB 2476",
      "registerart": "HRB",
      "company_name": "Buspool 2020 GmbH",
      "company_seat": "Bad Hersfeld",
      "details": "15.01.2025 (Bekanntmachungsdatum)\n\nHessen Amtsgericht Bad Hersfeld HRB 2476\nLöschungsankündigung\n\nBuspool 2020 GmbH\nGesellschaft mit beschränkter Haftung\nBad Hersfeld\n\nDas Registergericht beabsichtigt die im Handelsregister eingetragene Gesellschaft von Amts wegen nach § 394 FamFG zu löschen. Die Frist zur Erhebung eines Widerspruchs gegen die beabsichtigte Löschung wird auf 3 Monate festgesetzt."
    },
    {
      "date": "2025-01-15",
      "id": "98706",
      "original_text": "Einreichung neuer Dokumente\nHessen Amtsgericht Kassel HRB 6553\nGWG Service GmbH – Kassel",
      "type": "Einreichung neuer Dokumente",
      "state": "Hessen",
      "amtsgericht": "Amtsgericht Kassel",
      "registernummer": "HRB 6553",
      "registerart": "HRB",
      "company_name": "GWG Service GmbH",
      "company_seat": "Kassel",
      "details": "15.01.2025 (Bekanntmachungsdatum)\n\nHessen Amtsgericht Kassel HRB 6553\nEinreichung neuer Dokumente\n\nGWG Service GmbH\nGesellschaft mit beschränkter Haftung\nKassel\n\nDurch eine Änderung in den Personen der Aufsichtsratsmitglieder ist eine Liste der Mitglieder des Aufsichtsrates zum Handelsregister eingereicht worden."
    },
    {
      "date": "2025-01-15",
      "id": "98707",
      "original_text": "Einreichung neuer Dokumente\nHessen Amtsgericht Kassel HRB 17767\nGWG Projektentwicklung GmbH – Kassel",
      "type": "Einreichung neuer Dokumente",
      "state": "Hessen",
      "amtsgericht": "Amtsgericht Kassel",
      "registernummer": "HRB 17767",
      "registerart": "HRB",
      "company_name": "GWG Projektentwicklung GmbH",
      "company_seat": "Kassel",
      "details": "15.01.2025 (Bekanntmachungsdatum)\n\nHessen Amtsgericht Kassel HRB 17767\nEinreichung neuer Dokumente\n\nGWG Projektentwicklung GmbH\nGesellschaft mit beschränkter Haftung\nKassel\n\nDurch eine Änderung in den Personen der Aufsichtsratsmitglieder ist eine Liste der Mitglieder des Aufsichtsrates zum Handelsregister eingereicht worden."
    },
    {
      "date": "2025-01-15",
      "id": "98708",
      "original_text": "Sonstige Registerbekanntmachung\nHessen Amtsgericht Wiesbaden HRB 31478\nAbbott GmbH – Wiesbaden",
      "type": "Sonstige Registerbekanntmachung",
      "state": "Hessen",
      "amtsgericht": "Amtsgericht Wiesbaden",
      "registernummer": "HRB 31478",
      "registerart": "HRB",
      "company_name": "Abbott GmbH",
      "company_seat": "Wiesbaden",
      "details": "15.01.2025 (Bekanntmachungsdatum)\n\nHessen Amtsgericht Wiesbaden HRB 31478\nSonstige Registerbekanntmachung\n\nAbbott GmbH\nGesellschaft mit beschränkter Haftung\nWiesbaden\n\nDurch eine Änderung in den Personen der Aufsichtsratsmitglieder ist eine Liste der Mitglieder des Aufsichtsrates zum Handelsregister eingereicht worden."
    },
    {
      "date": "2025-01-15",
      "id": "98709",
      "original_text": "Registerbekanntmachung nach dem Umwandlungsgesetz\nHessen Amtsgericht Darmstadt HRB 102073\nFluid Logistics IP UG (haftungsbeschränkt) – Roßdorf",
      "type": "Registerbekanntmachung nach dem Umwandlungsgesetz",
      "state": "Hessen",
      "amtsgericht": "Amtsgericht Darmstadt",
      "registernummer": "HRB 102073",
      "registerart": "HRB",
      "company_name": "Fluid Logistics IP UG (haftungsbeschränkt)",
      "company_seat": "Roßdorf",
      "details": "15.01.2025 (Bekanntmachungsdatum)\n\nHessen Amtsgericht Darmstadt HRB 102073\nRegisterbekanntmachung nach dem Umwandlungsgesetz 15.01.2025 (Eintragungsdatum)\n\nFluid Logistics IP UG (haftungsbeschränkt)\nGesellschaft mit beschränkter Haftung\nRoßdorf\n\nDen Gläubigern der an der Verschmelzung beteiligten Rechtsträger ist, wenn sie binnen sechs Monaten nach dem Tag, an dem die Eintragung der Verschmelzung in das Register des Sitzes derjenigen Rechtsträger deren Gläubiger sie sind, nach § 19 Absatz 3 UmwG bekannt gemacht worden ist, ihren Anspruch nach Grund und Höhe schriftlich anmelden, Sicherheit zu leisten, soweit sie nicht Befriedigung verlangen können. Dieses Recht steht den Gläubigern jedoch nur zu, wenn sie glaubhaft machen, dass durch die Verschmelzung die Erfüllung ihrer Forderung gefährdet wird."
    }
  ]
}