{
  "date": "2025-01-27",
  "date_of_scrape": "2025-02-11T09:06:24.719Z",
  "tool_version": "0.2.0",
  "number_of_announcements": 152,
  "announcements": [
    {
      "date": "2025-01-27",
      "id": "99592",
      "original_text": "Löschungsankündigung\nBaden-Württemberg Amtsgericht Stuttgart HRB 440765\nHeinz Cluster GmbH – Horb am Neckar",
      "type": "Löschungsankündigung",
      "state": "Baden-Württemberg",
      "amtsgericht": "Amtsgericht Stuttgart",
      "registernummer": "HRB 440765",
      "registerart": "HRB",
      "company_name": "Heinz Cluster GmbH",
      "company_seat": "Horb am Neckar",
      "details": "27.01.2025 (Bekanntmachungsdatum)\n\nBaden-Württemberg Amtsgericht Stuttgart HRB 440765\nLöschungsankündigung\n\nHeinz Cluster GmbH\nGesellschaft mit beschränkter Haftung\nHorb am Neckar\n\nDas Gericht beabsichtigt, die Gesellschaft wegen Vermögenslosigkeit im Handelsregister von Amts wegen nach § 394 FamFG zu löschen. Die Frist zur Geltendmachung eines Widerspruchs gegen die beabsichtigte Löschung ist auf zwei Monate ab Veröffentlichung bestimmt."
    },
    {
      "date": "2025-01-27",
      "id": "99593",
      "original_text": "Löschungsankündigung\nBaden-Württemberg Amtsgericht Stuttgart HRB 785385\nKA Facility Service GmbH – Heilbronn",
      "type": "Löschungsankündigung",
      "state": "Baden-Württemberg",
      "amtsgericht": "Amtsgericht Stuttgart",
      "registernummer": "HRB 785385",
      "registerart": "HRB",
      "company_name": "KA Facility Service GmbH",
      "company_seat": "Heilbronn",
      "details": "27.01.2025 (Bekanntmachungsdatum)\n\nBaden-Württemberg Amtsgericht Stuttgart HRB 785385\nLöschungsankündigung\n\nKA Facility Service GmbH\nGesellschaft mit beschränkter Haftung\nHeilbronn\n\nAls nicht eingetragen wird bekanntgemacht:\nDas Gericht beabsichtigt, die Gesellschaft wegen Vermögenslosigkeit im Handelsregister von Amts wegen nach § 394 FamFG zu löschen. Die Frist zur Geltendmachung eines Widerspruchs gegen die beabsichtigte Löschung ist auf zwei Monate ab Veröffentlichung bestimmt."
    },
    {
      "date": "2025-01-27",
      "id": "99594",
      "original_text": "Registerbekanntmachung nach dem Umwandlungsgesetz\nBaden-Württemberg Amtsgericht Stuttgart HRB 781357\nBHK Callcenter Services GmbH – Bietigheim-Bissingen",
      "type": "Registerbekanntmachung nach dem Umwandlungsgesetz",
      "state": "Baden-Württemberg",
      "amtsgericht": "Amtsgericht Stuttgart",
      "registernummer": "HRB 781357",
      "registerart": "HRB",
      "company_name": "BHK Callcenter Services GmbH",
      "company_seat": "Bietigheim-Bissingen",
      "details": "27.01.2025 (Bekanntmachungsdatum)\n\nBaden-Württemberg Amtsgericht Stuttgart HRB 781357\nRegisterbekanntmachung nach dem Umwandlungsgesetz 27.01.2025 (Eintragungsdatum)\n\nBHK Callcenter Services GmbH\nGesellschaft mit beschränkter Haftung\nBietigheim-Bissingen\n\nAls nicht eingetragen wird bekanntgemacht:\nDen Gläubigern der an der Verschmelzung beteiligten Rechtsträger ist, wenn sie binnen sechs Monaten nach dem Tag, an dem die Eintragung der Verschmelzung in das Register des Sitzes desjenigen Rechtsträgers, dessen Gläubiger sie sind, nach § 19 Abs. 3 UmwG als bekanntgemacht gilt, ihren Anspruch nach Grund und Höhe schriftlich anmelden, Sicherheit zu leisten, soweit sie nicht Befriedigung verlangen können. Dieses Recht steht den Gläubigern jedoch nur zu, wenn sie glaubhaft machen, dass durch die Verschmelzung die Erfüllung ihrer Forderung gefährdet wird."
    },
    {
      "date": "2025-01-27",
      "id": "99595",
      "original_text": "Löschungsankündigung\nBerlin Amtsgericht Berlin (Charlottenburg) HRB 154043\nSYNAR Projektgesellschaft mbH – Berlin",
      "type": "Löschungsankündigung",
      "state": "Berlin",
      "amtsgericht": "Amtsgericht Berlin (Charlottenburg)",
      "registernummer": "HRB 154043",
      "registerart": "HRB",
      "company_name": "SYNAR Projektgesellschaft mbH",
      "company_seat": "Berlin",
      "details": "27.01.2025 (Bekanntmachungsdatum)\n\nBerlin Amtsgericht Berlin (Charlottenburg) HRB 154043\nLöschungsankündigung\n\nSYNAR Projektgesellschaft mbH\nGesellschaft mit beschränkter Haftung\nBerlin\n\nBei der nachstehenden Gesellschaft wird das Amtslöschungsverfahren gemäß § 394 FamFG eingeleitet. Widerspruchsfrist 6 Wochen"
    },
    {
      "date": "2025-01-27",
      "id": "99596",
      "original_text": "Einreichung neuer Dokumente\nBaden-Württemberg Amtsgericht Mannheim HRB 500602\nHaus-GmbH der Sparkasse Pforzheim Calw – Pforzheim",
      "type": "Einreichung neuer Dokumente",
      "state": "Baden-Württemberg",
      "amtsgericht": "Amtsgericht Mannheim",
      "registernummer": "HRB 500602",
      "registerart": "HRB",
      "company_name": "Haus-GmbH der Sparkasse Pforzheim Calw",
      "company_seat": "Pforzheim",
      "details": "27.01.2025 (Bekanntmachungsdatum)\n\nBaden-Württemberg Amtsgericht Mannheim HRB 500602\nEinreichung neuer Dokumente\n\nHaus-GmbH der Sparkasse Pforzheim Calw\nGesellschaft mit beschränkter Haftung\nPforzheim\n\nDie Gesellschaft hat am 23.01.2025 die Liste über die Zusammensetzung des Aufsichtsrats zum Handelsregister eingereicht."
    },
    {
      "date": "2025-01-27",
      "id": "99597",
      "original_text": "Löschungsankündigung\nBerlin Amtsgericht Berlin (Charlottenburg) HRB 206748\nStahlnetz Baustahl GmbH – Berlin",
      "type": "Löschungsankündigung",
      "state": "Berlin",
      "amtsgericht": "Amtsgericht Berlin (Charlottenburg)",
      "registernummer": "HRB 206748",
      "registerart": "HRB",
      "company_name": "Stahlnetz Baustahl GmbH",
      "company_seat": "Berlin",
      "details": "27.01.2025 (Bekanntmachungsdatum)\n\nBerlin Amtsgericht Berlin (Charlottenburg) HRB 206748\nLöschungsankündigung\n\nStahlnetz Baustahl GmbH\nGesellschaft mit beschränkter Haftung\nBerlin\n\nBei der nachstehenden Gesellschaft wird das Amtslöschungsverfahren gemäß § 394 FamFG eingeleitet. Widerspruchsfrist 6 Wochen"
    },
    {
      "date": "2025-01-27",
      "id": "99598",
      "original_text": "Löschungsankündigung\nBerlin Amtsgericht Berlin (Charlottenburg) HRB 201397\nSauer Invest Grundstücks GmbH – Berlin",
      "type": "Löschungsankündigung",
      "state": "Berlin",
      "amtsgericht": "Amtsgericht Berlin (Charlottenburg)",
      "registernummer": "HRB 201397",
      "registerart": "HRB",
      "company_name": "Sauer Invest Grundstücks GmbH",
      "company_seat": "Berlin",
      "details": "27.01.2025 (Bekanntmachungsdatum)\n\nBerlin Amtsgericht Berlin (Charlottenburg) HRB 201397\nLöschungsankündigung\n\nSauer Invest Grundstücks GmbH\nGesellschaft mit beschränkter Haftung\nBerlin\n\nBei der nachstehenden Gesellschaft wird das Amtslöschungsverfahren gemäß § 394 FamFG eingeleitet. Widerspruchsfrist 6 Wochen"
    },
    {
      "date": "2025-01-27",
      "id": "99599",
      "original_text": "Löschungsankündigung\nBerlin Amtsgericht Berlin (Charlottenburg) HRB 259391\nHelpBest GmbH – Berlin",
      "type": "Löschungsankündigung",
      "state": "Berlin",
      "amtsgericht": "Amtsgericht Berlin (Charlottenburg)",
      "registernummer": "HRB 259391",
      "registerart": "HRB",
      "company_name": "HelpBest GmbH",
      "company_seat": "Berlin",
      "details": "27.01.2025 (Bekanntmachungsdatum)\n\nBerlin Amtsgericht Berlin (Charlottenburg) HRB 259391\nLöschungsankündigung\n\nHelpBest GmbH\nGesellschaft mit beschränkter Haftung\nBerlin\n\nBei der nachstehenden Gesellschaft wird das Amtslöschungsverfahren gemäß § 394 FamFG eingeleitet. Widerspruchsfrist 6 Wochen"
    },
    {
      "date": "2025-01-27",
      "id": "99600",
      "original_text": "Sonstige Registerbekanntmachung\nBaden-Württemberg Amtsgericht Stuttgart HRB 756985\nSHISHA ORIENTAL GmbH – Leonberg",
      "type": "Sonstige Registerbekanntmachung",
      "state": "Baden-Württemberg",
      "amtsgericht": "Amtsgericht Stuttgart",
      "registernummer": "HRB 756985",
      "registerart": "HRB",
      "company_name": "SHISHA ORIENTAL GmbH",
      "company_seat": "Leonberg",
      "details": "27.01.2025 (Bekanntmachungsdatum)\n\nBaden-Württemberg Amtsgericht Stuttgart HRB 756985\nSonstige Registerbekanntmachung\n\nSHISHA ORIENTAL GmbH\nGesellschaft mit beschränkter Haftung\nLeonberg\n\nDas Gericht beabsichtigt, die Gesellschaft wegen Vermögenslosigkeit im Handelsregister von Amts wegen nach § 394 FamFG zu löschen. Die Frist zur Geltendmachung eines Widerspruchs gegen die beabsichtigte Löschung ist auf zwei Monate ab Veröffentlichung bestimmt."
    },
    {
      "date": "2025-01-27",
      "id": "99601",
      "original_text": "Sonstige Registerbekanntmachung\nBerlin Amtsgericht Berlin (Charlottenburg) HRB 89069\nHerbst Datentechnik GmbH – Berlin",
      "type": "Sonstige Registerbekanntmachung",
      "state": "Berlin",
      "amtsgericht": "Amtsgericht Berlin (Charlottenburg)",
      "registernummer": "HRB 89069",
      "registerart": "HRB",
      "company_name": "Herbst Datentechnik GmbH",
      "company_seat": "Berlin",
      "details": "27.01.2025 (Bekanntmachungsdatum)\n\nBerlin Amtsgericht Berlin (Charlottenburg) HRB 89069\nSonstige Registerbekanntmachung\n\nHerbst Datentechnik GmbH\nGesellschaft mit beschränkter Haftung\nBerlin\n\nAls nicht eingetragen wird veröffentlicht: Den Gläubigern der an der Spaltung beteiligten Rechtsträger ist, wenn sie binnen sechs Monaten nach dem Tag, an dem die Eintragung der Spaltung in das Register des Sitzes desjenigen Rechtsträgers, dessen Gläubiger sie sind, als bekannt gemacht gilt, ihren Anspruch nach Grund und Höhe schriftlich anmelden, Sicherheit zu leisten, soweit sie nicht Befriedigung verlangen können. Dieses Recht steht den Gläubigern jedoch nur zu, wenn sie glaubhaft machen, dass durch die Spaltung die Erfüllung ihrer Forderung gefährdet wird. Das Recht, Sicherheitsleistung zu verlangen, steht Gläubigern nicht zu, die im Falle der Insolvenz ein Recht auf vorzugsweise Befriedigung aus einer Deckungsmasse haben, die nach gesetzlicher Vorschrift zu ihrem Schutz errichtet und staatlich überwacht ist."
    },
    {
      "date": "2025-01-27",
      "id": "99602",
      "original_text": "Löschungsankündigung\nBerlin Amtsgericht Berlin (Charlottenburg) HRB 181962\nYpsilon Trans GmbH – Berlin",
      "type": "Löschungsankündigung",
      "state": "Berlin",
      "amtsgericht": "Amtsgericht Berlin (Charlottenburg)",
      "registernummer": "HRB 181962",
      "registerart": "HRB",
      "company_name": "Ypsilon Trans GmbH",
      "company_seat": "Berlin",
      "details": "27.01.2025 (Bekanntmachungsdatum)\n\nBerlin Amtsgericht Berlin (Charlottenburg) HRB 181962\nLöschungsankündigung\n\nYpsilon Trans GmbH\nGesellschaft mit beschränkter Haftung\nBerlin\n\nBei der nachstehenden Gesellschaft wird das Amtslöschungsverfahren gemäß § 394 FamFG eingeleitet. Widerspruchsfrist 6 Wochen"
    },
    {
      "date": "2025-01-27",
      "id": "99603",
      "original_text": "Löschungsankündigung\nBerlin Amtsgericht Berlin (Charlottenburg) HRB 209892\nSomosDesign GmbH – Berlin",
      "type": "Löschungsankündigung",
      "state": "Berlin",
      "amtsgericht": "Amtsgericht Berlin (Charlottenburg)",
      "registernummer": "HRB 209892",
      "registerart": "HRB",
      "company_name": "SomosDesign GmbH",
      "company_seat": "Berlin",
      "details": "27.01.2025 (Bekanntmachungsdatum)\n\nBerlin Amtsgericht Berlin (Charlottenburg) HRB 209892\nLöschungsankündigung\n\nSomosDesign GmbH\nGesellschaft mit beschränkter Haftung\nBerlin\n\nBei der nachstehenden Gesellschaft wird das Amtslöschungsverfahren gemäß § 394 FamFG eingeleitet. Widerspruchsfrist 6 Wochen"
    },
    {
      "date": "2025-01-27",
      "id": "99604",
      "original_text": "Einreichung neuer Dokumente\nBaden-Württemberg Amtsgericht Stuttgart HRB 301794\nValeo Wischersysteme GmbH – Bietigheim-Bissingen",
      "type": "Einreichung neuer Dokumente",
      "state": "Baden-Württemberg",
      "amtsgericht": "Amtsgericht Stuttgart",
      "registernummer": "HRB 301794",
      "registerart": "HRB",
      "company_name": "Valeo Wischersysteme GmbH",
      "company_seat": "Bietigheim-Bissingen",
      "details": "27.01.2025 (Bekanntmachungsdatum)\n\nBaden-Württemberg Amtsgericht Stuttgart HRB 301794\nEinreichung neuer Dokumente\n\nValeo Wischersysteme GmbH\nGesellschaft mit beschränkter Haftung\nBietigheim-Bissingen\n\nDie Gesellschaft hat am 16.01.2025 die Liste über die Zusammensetzung des Aufsichtsrats zum Handelsregister eingereicht."
    },
    {
      "date": "2025-01-27",
      "id": "99605",
      "original_text": "Registerbekanntmachung nach dem Umwandlungsgesetz\nBaden-Württemberg Amtsgericht Stuttgart HRB 6890\nBreuninger Holding GmbH – Stuttgart",
      "type": "Registerbekanntmachung nach dem Umwandlungsgesetz",
      "state": "Baden-Württemberg",
      "amtsgericht": "Amtsgericht Stuttgart",
      "registernummer": "HRB 6890",
      "registerart": "HRB",
      "company_name": "Breuninger Holding GmbH",
      "company_seat": "Stuttgart",
      "details": "27.01.2025 (Bekanntmachungsdatum)\n\nBaden-Württemberg Amtsgericht Stuttgart HRB 6890\nRegisterbekanntmachung nach dem Umwandlungsgesetz 27.01.2025 (Eintragungsdatum)\n\nBreuninger Holding GmbH\nGesellschaft mit beschränkter Haftung\nStuttgart\n\nAls nicht eingetragen wird bekanntgemacht:\nDen Gläubigern der an der Verschmelzung beteiligten Rechtsträger ist, wenn sie binnen sechs Monaten nach dem Tag, an dem die Eintragung der Verschmelzung in das Register des Sitzes desjenigen Rechtsträgers, dessen Gläubiger sie sind, nach § 19 Abs. 3 UmwG als bekanntgemacht gilt, ihren Anspruch nach Grund und Höhe schriftlich anmelden, Sicherheit zu leisten, soweit sie nicht Befriedigung verlangen können. Dieses Recht steht den Gläubigern jedoch nur zu, wenn sie glaubhaft machen, dass durch die Verschmelzung die Erfüllung ihrer Forderung gefährdet wird."
    },
    {
      "date": "2025-01-27",
      "id": "99606",
      "original_text": "Registerbekanntmachung nach dem Umwandlungsgesetz\nBaden-Württemberg Amtsgericht Stuttgart HRB 11023\n\"Breuninger-Markt\" Vermögensverwaltung Gesellschaft mit beschränkter Haftung – Stuttgart",
      "type": "Registerbekanntmachung nach dem Umwandlungsgesetz",
      "state": "Baden-Württemberg",
      "amtsgericht": "Amtsgericht Stuttgart",
      "registernummer": "HRB 11023",
      "registerart": "HRB",
      "company_name": "\"Breuninger-Markt\" Vermögensverwaltung Gesellschaft mit beschränkter Haftung",
      "company_seat": "Stuttgart",
      "details": "27.01.2025 (Bekanntmachungsdatum)\n\nBaden-Württemberg Amtsgericht Stuttgart HRB 11023\nRegisterbekanntmachung nach dem Umwandlungsgesetz 27.01.2025 (Eintragungsdatum)\n\n\"Breuninger-Markt\"  Vermögensverwaltung  Gesellschaft mit beschränkter Haftung\nGesellschaft mit beschränkter Haftung\nStuttgart\n\nAls nicht eingetragen wird bekanntgemacht:\nDen Gläubigern der an der Verschmelzung beteiligten Rechtsträger ist, wenn sie binnen sechs Monaten nach dem Tag, an dem die Eintragung der Verschmelzung in das Register des Sitzes desjenigen Rechtsträgers, dessen Gläubiger sie sind, nach § 19 Abs. 3 UmwG als bekanntgemacht gilt, ihren Anspruch nach Grund und Höhe schriftlich anmelden, Sicherheit zu leisten, soweit sie nicht Befriedigung verlangen können. Dieses Recht steht den Gläubigern jedoch nur zu, wenn sie glaubhaft machen, dass durch die Verschmelzung die Erfüllung ihrer Forderung gefährdet wird."
    },
    {
      "date": "2025-01-27",
      "id": "99607",
      "original_text": "Sonstige Registerbekanntmachung\nBerlin Amtsgericht Berlin (Charlottenburg) HRB 269576\nHerbst 42 Management GmbH – Berlin",
      "type": "Sonstige Registerbekanntmachung",
      "state": "Berlin",
      "amtsgericht": "Amtsgericht Berlin (Charlottenburg)",
      "registernummer": "HRB 269576",
      "registerart": "HRB",
      "company_name": "Herbst 42 Management GmbH",
      "company_seat": "Berlin",
      "details": "27.01.2025 (Bekanntmachungsdatum)\n\nBerlin Amtsgericht Berlin (Charlottenburg) HRB 269576\nSonstige Registerbekanntmachung\n\nHerbst 42 Management GmbH\nGesellschaft mit beschränkter Haftung\nBerlin\n\nAls nicht eingetragen wird veröffentlicht: Den Gläubigern der an der Spaltung beteiligten Rechtsträger ist, wenn sie binnen sechs Monaten nach dem Tag, an dem die Eintragung der Spaltung in das Register des Sitzes desjenigen Rechtsträgers, dessen Gläubiger sie sind, als bekannt gemacht gilt, ihren Anspruch nach Grund und Höhe schriftlich anmelden, Sicherheit zu leisten, soweit sie nicht Befriedigung verlangen können. Dieses Recht steht den Gläubigern jedoch nur zu, wenn sie glaubhaft machen, dass durch die Spaltung die Erfüllung ihrer Forderung gefährdet wird. Das Recht, Sicherheitsleistung zu verlangen, steht Gläubigern nicht zu, die im Falle der Insolvenz ein Recht auf vorzugsweise Befriedigung aus einer Deckungsmasse haben, die nach gesetzlicher Vorschrift zu ihrem Schutz errichtet und staatlich überwacht ist."
    },
    {
      "date": "2025-01-27",
      "id": "99608",
      "original_text": "Löschungsankündigung\nBaden-Württemberg Amtsgericht Stuttgart HRB 780622\nGaglio Import/ Export GmbH – Sachsenheim",
      "type": "Löschungsankündigung",
      "state": "Baden-Württemberg",
      "amtsgericht": "Amtsgericht Stuttgart",
      "registernummer": "HRB 780622",
      "registerart": "HRB",
      "company_name": "Gaglio Import/ Export GmbH",
      "company_seat": "Sachsenheim",
      "details": "27.01.2025 (Bekanntmachungsdatum)\n\nBaden-Württemberg Amtsgericht Stuttgart HRB 780622\nLöschungsankündigung\n\nGaglio Import/ Export GmbH\nGesellschaft mit beschränkter Haftung\nSachsenheim\n\nDas Gericht beabsichtigt, die Gesellschaft wegen Vermögenslosigkeit im Handelsregister von Amts wegen nach § 394 FamFG zu löschen. Die Frist zur Geltendmachung eines Widerspruchs gegen die beabsichtigte Löschung ist auf zwei Monate ab Veröffentlichung bestimmt."
    },
    {
      "date": "2025-01-27",
      "id": "99609",
      "original_text": "Registerbekanntmachung nach dem Umwandlungsgesetz\nHamburg Amtsgericht Hamburg HRA 131449\nAstropraxis Hélène Fritsch e.K. – Hamburg",
      "type": "Registerbekanntmachung nach dem Umwandlungsgesetz",
      "state": "Hamburg",
      "amtsgericht": "Amtsgericht Hamburg",
      "registernummer": "HRA 131449",
      "registerart": "HRA",
      "company_name": "Astropraxis Hélène Fritsch e.K.",
      "company_seat": "Hamburg",
      "details": "27.01.2025 (Bekanntmachungsdatum)\n\nHamburg Amtsgericht Hamburg HRA 131449\nRegisterbekanntmachung nach dem Umwandlungsgesetz 27.01.2025 (Eintragungsdatum)\n\nAstropraxis Hélène Fritsch e.K.\nEinzelkaufmann\nHamburg\n\nAls nicht eingetragen wird bekannt gemacht:\nDen Gläubigern der an der Ausgliederung beteiligten Gesellschaften ist, wenn sie binnen sechs Monaten nach dem Tag, an dem die Eintragung der Ausgliederung in das Register des Sitzes desjenigen Rechtsträgers, dessen Gläubiger sie sind, nach § 19 Absatz 3 UmwG als bekannt gemacht gilt, ihren Anspruch nach Grund und Höhe schriftlich anmelden, Sicherheit zu leisten, soweit sie nicht Befriedigung verlangen können. Dieses Recht steht den Gläubigern jedoch nur zu, wenn sie glaubhaft machen, dass durch die Ausgliederung die Erfüllung ihrer Forderung gefährdet wird."
    },
    {
      "date": "2025-01-27",
      "id": "99610",
      "original_text": "Registerbekanntmachung nach dem Umwandlungsgesetz\nHamburg Amtsgericht Hamburg HRB 190423\nAstropraxis Hélène Fritsch Aus- und Weiterbildung in Astrologie GmbH – Hamburg",
      "type": "Registerbekanntmachung nach dem Umwandlungsgesetz",
      "state": "Hamburg",
      "amtsgericht": "Amtsgericht Hamburg",
      "registernummer": "HRB 190423",
      "registerart": "HRB",
      "company_name": "Astropraxis Hélène Fritsch Aus- und Weiterbildung in Astrologie GmbH",
      "company_seat": "Hamburg",
      "details": "27.01.2025 (Bekanntmachungsdatum)\n\nHamburg Amtsgericht Hamburg HRB 190423\nRegisterbekanntmachung nach dem Umwandlungsgesetz 27.01.2025 (Eintragungsdatum)\n\nAstropraxis Hélène Fritsch Aus- und Weiterbildung in Astrologie GmbH\nGesellschaft mit beschränkter Haftung\nHamburg\n\nAls nicht eingetragen wird bekannt gemacht:\nDen Gläubigern der an der Ausgliederung beteiligten Gesellschaften ist, wenn sie binnen sechs Monaten nach dem Tag, an dem die Eintragung der Ausgliederung in das Register des Sitzes desjenigen Rechtsträgers, dessen Gläubiger sie sind, nach § 19 Absatz 3 UmwG als bekannt gemacht gilt, ihren Anspruch nach Grund und Höhe schriftlich anmelden, Sicherheit zu leisten, soweit sie nicht Befriedigung verlangen können. Dieses Recht steht den Gläubigern jedoch nur zu, wenn sie glaubhaft machen, dass durch die Ausgliederung die Erfüllung ihrer Forderung gefährdet wird."
    },
    {
      "date": "2025-01-27",
      "id": "99611",
      "original_text": "Registerbekanntmachung nach dem Umwandlungsgesetz\nHamburg Amtsgericht Hamburg HRB 187467\nJupiter Immobilien GmbH – Hamburg",
      "type": "Registerbekanntmachung nach dem Umwandlungsgesetz",
      "state": "Hamburg",
      "amtsgericht": "Amtsgericht Hamburg",
      "registernummer": "HRB 187467",
      "registerart": "HRB",
      "company_name": "Jupiter Immobilien GmbH",
      "company_seat": "Hamburg",
      "details": "27.01.2025 (Bekanntmachungsdatum)\n\nHamburg Amtsgericht Hamburg HRB 187467\nRegisterbekanntmachung nach dem Umwandlungsgesetz 27.01.2025 (Eintragungsdatum)\n\nJupiter Immobilien GmbH\nGesellschaft mit beschränkter Haftung\nHamburg\n\nAls nicht eingetragen wird bekannt gemacht:\nDen Gläubigern der an der formwechselnden Umwandlung beteiligten Gesellschaften ist, wenn sie binnen sechs Monaten nach dem Tag, an dem die Eintragung der formwechselnden Umwandlung in das Register des Sitzes desjenigen Rechtsträgers, dessen Gläubiger sie sind, nach § 19 Absatz 3 UmwG als bekannt gemacht gilt, ihren Anspruch nach Grund und Höhe schriftlich anmelden, Sicherheit zu leisten, soweit sie nicht Befriedigung verlangen können. Dieses Recht steht den Gläubigern jedoch nur zu, wenn sie glaubhaft machen, dass durch die formwechselnde Umwandlung die Erfüllung ihrer Forderung gefährdet wird."
    },
    {
      "date": "2025-01-27",
      "id": "99612",
      "original_text": "Registerbekanntmachung nach dem Umwandlungsgesetz\nBerlin Amtsgericht Berlin (Charlottenburg) HRB 36106\nBärenquell - Brauerei Berlin GmbH – Berlin",
      "type": "Registerbekanntmachung nach dem Umwandlungsgesetz",
      "state": "Berlin",
      "amtsgericht": "Amtsgericht Berlin (Charlottenburg)",
      "registernummer": "HRB 36106",
      "registerart": "HRB",
      "company_name": "Bärenquell - Brauerei Berlin GmbH",
      "company_seat": "Berlin",
      "details": "27.01.2025 (Bekanntmachungsdatum)\n\nBerlin Amtsgericht Berlin (Charlottenburg) HRB 36106\nRegisterbekanntmachung nach dem Umwandlungsgesetz 25.01.2025 (Eintragungsdatum)\n\nBärenquell - Brauerei Berlin GmbH\nGesellschaft mit beschränkter Haftung\nBerlin\n\nZu Eintragungsnummer 6 vom 25.01.2025 wird als nicht eingetragen veröffentlicht: Den Gläubigern der an der Verschmelzung beteiligten Rechtsträger ist, wenn sie binnen sechs Monaten nach dem Tag, an dem die Eintragung der Verschmelzung in das Register des Sitzes desjenigen Rechtsträgers, dessen Gläubiger sie sind, als bekannt gemacht gilt, ihren Anspruch nach Grund und Höhe schriftlich anmelden, Sicherheit zu leisten, soweit sie nicht Befriedigung verlangen können. Dieses Recht steht den Gläubigern jedoch nur zu, wenn sie glaubhaft machen, dass durch die Verschmelzung die Erfüllung ihrer Forderung gefährdet wird. Das Recht, Sicherheitsleistung zu verlangen, steht Gläubigern nicht zu, die im Falle der Insolvenz ein Recht auf vorzugsweise Befriedigung aus einer Deckungsmasse haben, die nach gesetzlicher Vorschrift zu ihrem Schutz errichtet und staatlich überwacht ist."
    },
    {
      "date": "2025-01-27",
      "id": "99613",
      "original_text": "Einreichung neuer Dokumente\nBerlin Amtsgericht Berlin (Charlottenburg) HRB 152369\nHELIOS Klinikum Berlin-Buch GmbH – Berlin",
      "type": "Einreichung neuer Dokumente",
      "state": "Berlin",
      "amtsgericht": "Amtsgericht Berlin (Charlottenburg)",
      "registernummer": "HRB 152369",
      "registerart": "HRB",
      "company_name": "HELIOS Klinikum Berlin-Buch GmbH",
      "company_seat": "Berlin",
      "details": "27.01.2025 (Bekanntmachungsdatum)\n\nBerlin Amtsgericht Berlin (Charlottenburg) HRB 152369\nEinreichung neuer Dokumente\n\nHELIOS Klinikum Berlin-Buch GmbH\nGesellschaft mit beschränkter Haftung\nBerlin\n\nAls nicht eingetragen wird veröffentlicht:Es wurde eine neue Liste der Aufsichtsratsmitglieder eingereicht (§52 GmbHG)."
    },
    {
      "date": "2025-01-27",
      "id": "99614",
      "original_text": "Registerbekanntmachung nach dem Umwandlungsgesetz\nNordrhein-Westfalen Amtsgericht Coesfeld HRA 9928\nTK. Automobile e.K. – Rhede",
      "type": "Registerbekanntmachung nach dem Umwandlungsgesetz",
      "state": "Nordrhein-Westfalen",
      "amtsgericht": "Amtsgericht Coesfeld",
      "registernummer": "HRA 9928",
      "registerart": "HRA",
      "company_name": "TK. Automobile e.K.",
      "company_seat": "Rhede",
      "details": "27.01.2025 (Bekanntmachungsdatum)\n\nNordrhein-Westfalen Amtsgericht Coesfeld HRA 9928\nRegisterbekanntmachung nach dem Umwandlungsgesetz 27.01.2025 (Eintragungsdatum)\n\nTK. Automobile e.K.\nEinzelkaufmann\nRhede\n\nDen Gläubigern der an der Ausgliederung beteiligten Rechtsträger ist, wenn sie binnen sechs Monaten nach dem Tag, an dem die Eintragung der Ausgliederung in das Register des Sitzes desjenigen Rechtsträgers, dessen Gläubiger sie sind, nach § 19 Absatz 3 UmwG als bekanntgemacht gilt, ihren Anspruch nach Grund und Höhe schriftlich anmelden, Sicherheit zu leisten, soweit sie nicht Befriedigung verlangen können. Dieses Recht steht den Gläubigern jedoch nur zu, wenn sie glaubhaft machen, dass durch die Ausgliederung die Erfüllung ihrer Forderung gefährdet wird."
    },
    {
      "date": "2025-01-27",
      "id": "99615",
      "original_text": "Löschungsankündigung\nBrandenburg Amtsgericht Potsdam HRB 35139\nPRAC-Trading UG (haftungsbeschränkt) – Zossen",
      "type": "Löschungsankündigung",
      "state": "Brandenburg",
      "amtsgericht": "Amtsgericht Potsdam",
      "registernummer": "HRB 35139",
      "registerart": "HRB",
      "company_name": "PRAC-Trading UG (haftungsbeschränkt)",
      "company_seat": "Zossen",
      "details": "27.01.2025 (Bekanntmachungsdatum)\n\nBrandenburg Amtsgericht Potsdam HRB 35139\nLöschungsankündigung\n\nPRAC-Trading UG (haftungsbeschränkt)\nGesellschaft mit beschränkter Haftung\nZossen\n\nBei der nachstehenden Gesellschaft wird das Amtslöschungsverfahren gemäß § 394 FamFG eingeleitet."
    },
    {
      "date": "2025-01-27",
      "id": "99616",
      "original_text": "Löschungsankündigung\nBaden-Württemberg Amtsgericht Mannheim HRB 731156\nBGS Security UG (haftungsbeschränkt) – Hockenheim",
      "type": "Löschungsankündigung",
      "state": "Baden-Württemberg",
      "amtsgericht": "Amtsgericht Mannheim",
      "registernummer": "HRB 731156",
      "registerart": "HRB",
      "company_name": "BGS Security UG (haftungsbeschränkt)",
      "company_seat": "Hockenheim",
      "details": "27.01.2025 (Bekanntmachungsdatum)\n\nBaden-Württemberg Amtsgericht Mannheim HRB 731156\nLöschungsankündigung\n\nBGS Security UG (haftungsbeschränkt)\nGesellschaft mit beschränkter Haftung\nHockenheim\n\nDas Gericht beabsichtigt, die Gesellschaft wegen Vermögenslosigkeit im Handelsregister von Amts wegen nach § 394 FamFG zu löschen. Die Frist zur Geltendmachung eines Widerspruchs gegen die beabsichtigte Löschung ist auf einen Monat ab Veröffentlichung bestimmt."
    },
    {
      "date": "2025-01-27",
      "id": "99617",
      "original_text": "Löschungsankündigung\nBaden-Württemberg Amtsgericht Mannheim HRB 725403\nCleanbergs Industrieservice GmbH – Mannheim",
      "type": "Löschungsankündigung",
      "state": "Baden-Württemberg",
      "amtsgericht": "Amtsgericht Mannheim",
      "registernummer": "HRB 725403",
      "registerart": "HRB",
      "company_name": "Cleanbergs Industrieservice GmbH",
      "company_seat": "Mannheim",
      "details": "27.01.2025 (Bekanntmachungsdatum)\n\nBaden-Württemberg Amtsgericht Mannheim HRB 725403\nLöschungsankündigung 27.01.2025 (Eintragungsdatum)\n\nCleanbergs Industrieservice GmbH\nGesellschaft mit beschränkter Haftung\nMannheim\n\nAls nicht eingetragen wird bekanntgemacht:\nDas Gericht beabsichtigt, die Gesellschaft wegen Vermögenslosigkeit im Handelsregister von Amts wegen nach § 394 FamFG zu löschen. Die Frist zur Geltendmachung eines Widerspruchs gegen die beabsichtigte Löschung ist auf einen Monat ab Veröffentlichung bestimmt."
    },
    {
      "date": "2025-01-27",
      "id": "99618",
      "original_text": "Löschungsankündigung\nHamburg Amtsgericht Hamburg HRB 67433\nWeidner & Neese GmbH Personalleasing und -dienstleistungen – Hamburg",
      "type": "Löschungsankündigung",
      "state": "Hamburg",
      "amtsgericht": "Amtsgericht Hamburg",
      "registernummer": "HRB 67433",
      "registerart": "HRB",
      "company_name": "Weidner & Neese GmbH Personalleasing und -dienstleistungen",
      "company_seat": "Hamburg",
      "details": "27.01.2025 (Bekanntmachungsdatum)\n\nHamburg Amtsgericht Hamburg HRB 67433\nLöschungsankündigung\n\nWeidner & Neese GmbH Personalleasing und -dienstleistungen\nGesellschaft mit beschränkter Haftung\nHamburg\n\nDas Registergericht beabsichtigt, die im Handelsregister eingetragene Gesellschaft von Amts wegen nach § 394 FamFG zu löschen. Die Frist zur Erhebung eines Widerspruchs gegen die beabsichtigte Löschung wird auf 3 Monate festgesetzt."
    },
    {
      "date": "2025-01-27",
      "id": "99619",
      "original_text": "Löschungsankündigung\nHamburg Amtsgericht Hamburg HRA 100698\nWIAMO Weinimport e.K. – Hamburg",
      "type": "Löschungsankündigung",
      "state": "Hamburg",
      "amtsgericht": "Amtsgericht Hamburg",
      "registernummer": "HRA 100698",
      "registerart": "HRA",
      "company_name": "WIAMO Weinimport e.K.",
      "company_seat": "Hamburg",
      "details": "27.01.2025 (Bekanntmachungsdatum)\n\nHamburg Amtsgericht Hamburg HRA 100698\nLöschungsankündigung\n\nWIAMO Weinimport e.K.\nEinzelkaufmann\nHamburg\n\nNach Mitteilung des Bezirksamtes Wandsbek, wurde ihnen bezüglich ihres unter der Firma WIAMO Weinimport e.K. ausgeübten Gewerbes, durch Bescheid vom 02.10.2024, bestandskräftig seit dem 06.11.2024, die Ausübung des Gewerbes \"  Importhandel und Vertrieb mit Waren aller Art, insbesondere mit Weinen, ganz und auf Dauer nach § 35\nAbs. 1 Gewerbeordnung, untersagt. Diese Untersagung erstreckt sich auch auf alle anderen Gewerbe sowie auf die Tätigkeit als Vertretungsberechtigte Person eines Gewerbebetriebes oder als mit der Leitung eines Gewerbebetriebes beauftragte Person.\nDie eingetragene Firma WIAMO Weinimport e.K., ist damit wegen des Mangels einer wesentlichen Voraussetzung unzulässig geworden.\nDas Registergericht beabsichtigt daher, die Firma gemäß § 395 des Gesetzes über das Verfahren in Familiensachen und in Angelegenheiten der freiwilligen Gerichtsbarkeit (FamFG) von Amts wegen aus dem Handelsregister zu löschen.\nGegen die beabsichtigte Löschung kann innerhalb eines Monats seit dieser Bekanntmachung Widerspruch beim\nAmtsgericht Hamburg - Registergericht -, Caffamacherreihe 20, 20355 Hamburg,\nschriftlich oder zur Niederschrift der Geschäftsstelle oder des Rechtspflegers eingelegt werden.\nDer Widerspruch kann auch zu Protokoll der Geschäftsstelle eines anderen Amtsgerichtes erfolgen. In diesem Falle ist die Frist nur dann gewahrt, wenn das den Widerspruch enthaltende Protokoll innerhalb der Frist bei dem Registergericht eingeht.\nSofern hier binnen der genannten Frist kein Widerspruch eingeht, wird das Gericht die genannten Eintragungen von Amts wegen löschen."
    },
    {
      "date": "2025-01-27",
      "id": "99620",
      "original_text": "Löschungsankündigung\nHamburg Amtsgericht Hamburg HRB 96807\nCP Service und Dienstleistungen GmbH – Hamburg",
      "type": "Löschungsankündigung",
      "state": "Hamburg",
      "amtsgericht": "Amtsgericht Hamburg",
      "registernummer": "HRB 96807",
      "registerart": "HRB",
      "company_name": "CP Service und Dienstleistungen GmbH",
      "company_seat": "Hamburg",
      "details": "27.01.2025 (Bekanntmachungsdatum)\n\nHamburg Amtsgericht Hamburg HRB 96807\nLöschungsankündigung\n\nCP Service und Dienstleistungen GmbH\nGesellschaft mit beschränkter Haftung\nHamburg\n\nDas Registergericht beabsichtigt, die im Handelsregister eingetragene Gesellschaft von Amts wegen nach § 394 FamFG zu löschen. Die Frist zur Erhebung eines Widerspruchs gegen die beabsichtigte Löschung wird auf 3 Monate festgesetzt."
    },
    {
      "date": "2025-01-27",
      "id": "99621",
      "original_text": "Löschungsankündigung\nHamburg Amtsgericht Hamburg HRB 107817\nTronical Components GmbH – Hamburg",
      "type": "Löschungsankündigung",
      "state": "Hamburg",
      "amtsgericht": "Amtsgericht Hamburg",
      "registernummer": "HRB 107817",
      "registerart": "HRB",
      "company_name": "Tronical Components GmbH",
      "company_seat": "Hamburg",
      "details": "27.01.2025 (Bekanntmachungsdatum)\n\nHamburg Amtsgericht Hamburg HRB 107817\nLöschungsankündigung\n\nTronical Components GmbH\nGesellschaft mit beschränkter Haftung\nHamburg\n\nDas Registergericht beabsichtigt, die im Handelsregister eingetragene Gesellschaft von Amts wegen nach § 394 FamFG zu löschen. Die Frist zur Erhebung eines Widerspruchs gegen die beabsichtigte Löschung wird auf 3 Monate festgesetzt."
    },
    {
      "date": "2025-01-27",
      "id": "99622",
      "original_text": "Löschungsankündigung\nHamburg Amtsgericht Hamburg HRB 127878\nHeinz Buck GmbH Bauschlosserei und Metallbau – Hamburg",
      "type": "Löschungsankündigung",
      "state": "Hamburg",
      "amtsgericht": "Amtsgericht Hamburg",
      "registernummer": "HRB 127878",
      "registerart": "HRB",
      "company_name": "Heinz Buck GmbH Bauschlosserei und Metallbau",
      "company_seat": "Hamburg",
      "details": "27.01.2025 (Bekanntmachungsdatum)\n\nHamburg Amtsgericht Hamburg HRB 127878\nLöschungsankündigung\n\nHeinz Buck GmbH Bauschlosserei und Metallbau\nGesellschaft mit beschränkter Haftung\nHamburg\n\nDas Registergericht beabsichtigt, die im Handelsregister eingetragene Gesellschaft von Amts wegen nach § 394 FamFG zu löschen. Die Frist zur Erhebung eines Widerspruchs gegen die beabsichtigte Löschung wird auf 3 Monate festgesetzt."
    },
    {
      "date": "2025-01-27",
      "id": "99623",
      "original_text": "Löschungsankündigung\nHamburg Amtsgericht Hamburg HRB 149913\nAPS-HYGIENEKONZEPTE CONSULTING LIMITED Zweigniederlassung Deutschland – Hamburg",
      "type": "Löschungsankündigung",
      "state": "Hamburg",
      "amtsgericht": "Amtsgericht Hamburg",
      "registernummer": "HRB 149913",
      "registerart": "HRB",
      "company_name": "APS-HYGIENEKONZEPTE CONSULTING LIMITED Zweigniederlassung Deutschland",
      "company_seat": "Hamburg",
      "details": "27.01.2025 (Bekanntmachungsdatum)\n\nHamburg Amtsgericht Hamburg HRB 149913\nLöschungsankündigung\n\nAPS-HYGIENEKONZEPTE CONSULTING LIMITED Zweigniederlassung Deutschland\nRechtsform ausländischen Rechts HRB\nHamburg\n\nWie dem Gericht bekannt geworden ist, wird die Zweigniederlassung offenbar nicht mehr unterhalten. Briefe kamen als unzustellbar zurück. Der Geschäftsführer ist unbekannt verzogen.\nDie Eintragung der Zweigniederlassung wäre damit wegen des Mangels einer wesentlichen Voraussetzung unzulässig geworden. Das Registergericht beabsichtigt daher, die Zweigniederlassung gemäß § 395 des Gesetzes über das Verfahren in Familiensachen und in Angelegenheiten der freiwilligen Gerichtsbarkeit (FamFG) von Amts wegen zu löschen.\nGegen die beabsichtigte Löschung kann innerhalb eines Monats seit dieser Bekanntmachung Widerspruch beim\nAmtsgericht Hamburg - Registergericht -, Caffamacherreihe 20, 20355 Hamburg,\nschriftlich oder zur Niederschrift der Geschäftsstelle oder des Rechtspflegers eingelegt werden. Der Widerspruch kann auch zu Protokoll der Geschäftsstelle eines anderen Amtsgerichtes erfolgen. In diesem Falle ist die Frist nur dann gewahrt, wenn das den Widerspruch enthaltende Protokoll innerhalb der Frist bei dem Registergericht eingeht.\nSofern hier binnen der genannten Frist kein Widerspruch eingeht, wird das Gericht die Eintragung der Zweigniederlassung von Amts wegen löschen."
    },
    {
      "date": "2025-01-27",
      "id": "99624",
      "original_text": "Löschungsankündigung\nHamburg Amtsgericht Hamburg HRB 178151\nInterfruits UG (haftungsbeschränkt) – Hamburg",
      "type": "Löschungsankündigung",
      "state": "Hamburg",
      "amtsgericht": "Amtsgericht Hamburg",
      "registernummer": "HRB 178151",
      "registerart": "HRB",
      "company_name": "Interfruits UG (haftungsbeschränkt)",
      "company_seat": "Hamburg",
      "details": "27.01.2025 (Bekanntmachungsdatum)\n\nHamburg Amtsgericht Hamburg HRB 178151\nLöschungsankündigung\n\nInterfruits UG (haftungsbeschränkt)\nGesellschaft mit beschränkter Haftung\nHamburg\n\nDas Registergericht beabsichtigt, die im Handelsregister eingetragene Gesellschaft von Amts wegen nach § 394 FamFG zu löschen. Die Frist zur Erhebung eines Widerspruchs gegen die beabsichtigte Löschung wird auf 3 Monate festgesetzt."
    },
    {
      "date": "2025-01-27",
      "id": "99625",
      "original_text": "Löschungsankündigung\nHamburg Amtsgericht Hamburg HRB 178245\nCompany C Hamburg GmbH – Hamburg",
      "type": "Löschungsankündigung",
      "state": "Hamburg",
      "amtsgericht": "Amtsgericht Hamburg",
      "registernummer": "HRB 178245",
      "registerart": "HRB",
      "company_name": "Company C Hamburg GmbH",
      "company_seat": "Hamburg",
      "details": "27.01.2025 (Bekanntmachungsdatum)\n\nHamburg Amtsgericht Hamburg HRB 178245\nLöschungsankündigung\n\nCompany C Hamburg GmbH\nGesellschaft mit beschränkter Haftung\nHamburg\n\nDas Registergericht beabsichtigt, die im Handelsregister eingetragene Gesellschaft von Amts wegen nach § 394 FamFG zu löschen. Die Frist zur Erhebung eines Widerspruchs gegen die beabsichtigte Löschung wird auf 3 Monate festgesetzt."
    },
    {
      "date": "2025-01-27",
      "id": "99626",
      "original_text": "Löschungsankündigung\nHamburg Amtsgericht Hamburg HRA 105675\nTESU-LOGISTIC LTD. & Co. KG – Hamburg",
      "type": "Löschungsankündigung",
      "state": "Hamburg",
      "amtsgericht": "Amtsgericht Hamburg",
      "registernummer": "HRA 105675",
      "registerart": "HRA",
      "company_name": "TESU-LOGISTIC LTD. & Co. KG",
      "company_seat": "Hamburg",
      "details": "27.01.2025 (Bekanntmachungsdatum)\n\nHamburg Amtsgericht Hamburg HRA 105675\nLöschungsankündigung\n\nTESU-LOGISTIC LTD. & Co. KG\nKommanditgesellschaft\nHamburg\n\nDas Registergericht beabsichtigt, die im Handelsregister eingetragene Firma von Amts wegen nach § 31 Abs. 2 HGB zu löschen. Die Frist zur Erhebung eines Widerspruchs gegen die beabsichtigte Löschung wird auf 3 Monate festgesetzt."
    },
    {
      "date": "2025-01-27",
      "id": "99627",
      "original_text": "Löschungsankündigung\nHamburg Amtsgericht Hamburg HRA 112805\nKönig & Cie. Zweite Schiffahrts GmbH & Co. KG – Hamburg",
      "type": "Löschungsankündigung",
      "state": "Hamburg",
      "amtsgericht": "Amtsgericht Hamburg",
      "registernummer": "HRA 112805",
      "registerart": "HRA",
      "company_name": "König & Cie. Zweite Schiffahrts GmbH & Co. KG",
      "company_seat": "Hamburg",
      "details": "27.01.2025 (Bekanntmachungsdatum)\n\nHamburg Amtsgericht Hamburg HRA 112805\nLöschungsankündigung\n\nKönig & Cie. Zweite Schiffahrts GmbH & Co. KG\nKommanditgesellschaft\nHamburg\n\nDas Registergericht beabsichtigt, die im Handelsregister eingetragene Gesellschaft von Amts wegen nach § 394 FamFG zu löschen. Die Frist zur Erhebung eines Widerspruchs gegen die beabsichtigte Löschung wird auf 3 Monate festgesetzt."
    },
    {
      "date": "2025-01-27",
      "id": "99628",
      "original_text": "Löschungsankündigung\nHamburg Amtsgericht Hamburg HRA 118360\nFastfood 24h GmbH & Co. KG – Hamburg",
      "type": "Löschungsankündigung",
      "state": "Hamburg",
      "amtsgericht": "Amtsgericht Hamburg",
      "registernummer": "HRA 118360",
      "registerart": "HRA",
      "company_name": "Fastfood 24h GmbH & Co. KG",
      "company_seat": "Hamburg",
      "details": "27.01.2025 (Bekanntmachungsdatum)\n\nHamburg Amtsgericht Hamburg HRA 118360\nLöschungsankündigung\n\nFastfood 24h GmbH & Co. KG\nKommanditgesellschaft\nHamburg\n\nDas Registergericht beabsichtigt, die im Handelsregister eingetragene Firma von Amts wegen nach § 31 Abs. 2 HGB zu löschen. Die Frist zur Erhebung eines Widerspruchs gegen die beabsichtigte Löschung wird auf 3 Monate festgesetzt."
    },
    {
      "date": "2025-01-27",
      "id": "99629",
      "original_text": "Löschungsankündigung\nHamburg Amtsgericht Hamburg HRA 102528\nBernesto Card GmbH & Co. KG – Hamburg",
      "type": "Löschungsankündigung",
      "state": "Hamburg",
      "amtsgericht": "Amtsgericht Hamburg",
      "registernummer": "HRA 102528",
      "registerart": "HRA",
      "company_name": "Bernesto Card GmbH & Co. KG",
      "company_seat": "Hamburg",
      "details": "27.01.2025 (Bekanntmachungsdatum)\n\nHamburg Amtsgericht Hamburg HRA 102528\nLöschungsankündigung\n\nBernesto Card GmbH & Co. KG\nKommanditgesellschaft\nHamburg\n\nDas Registergericht beabsichtigt, die im Handelsregister eingetragene Gesellschaft von Amts wegen nach § 394 FamFG zu löschen. Die Frist zur Erhebung eines Widerspruchs gegen die beabsichtigte Löschung wird auf 3 Monate festgesetzt."
    },
    {
      "date": "2025-01-27",
      "id": "99630",
      "original_text": "Löschungsankündigung\nHamburg Amtsgericht Hamburg HRA 107735\nDF Shipinvest 3 GmbH & Co. KG – Hamburg",
      "type": "Löschungsankündigung",
      "state": "Hamburg",
      "amtsgericht": "Amtsgericht Hamburg",
      "registernummer": "HRA 107735",
      "registerart": "HRA",
      "company_name": "DF Shipinvest 3 GmbH & Co. KG",
      "company_seat": "Hamburg",
      "details": "27.01.2025 (Bekanntmachungsdatum)\n\nHamburg Amtsgericht Hamburg HRA 107735\nLöschungsankündigung\n\nDF Shipinvest 3 GmbH & Co. KG\nKommanditgesellschaft\nHamburg\n\nDas Registergericht beabsichtigt, die im Handelsregister eingetragene Gesellschaft von Amts wegen nach § 394 FamFG zu löschen. Die Frist zur Erhebung eines Widerspruchs gegen die beabsichtigte Löschung wird auf 3 Monate festgesetzt."
    },
    {
      "date": "2025-01-27",
      "id": "99631",
      "original_text": "Löschungsankündigung\nHamburg Amtsgericht Hamburg HRA 118062\nTOBIAS B. CONRAD Limited & Co. KG – Hamburg",
      "type": "Löschungsankündigung",
      "state": "Hamburg",
      "amtsgericht": "Amtsgericht Hamburg",
      "registernummer": "HRA 118062",
      "registerart": "HRA",
      "company_name": "TOBIAS B. CONRAD Limited & Co. KG",
      "company_seat": "Hamburg",
      "details": "27.01.2025 (Bekanntmachungsdatum)\n\nHamburg Amtsgericht Hamburg HRA 118062\nLöschungsankündigung\n\nTOBIAS B. CONRAD Limited & Co. KG\nKommanditgesellschaft\nHamburg\n\nDas Registergericht beabsichtigt, die im Handelsregister eingetragene Firma von Amts wegen nach § 31 Abs. 2 HGB zu löschen. Die Frist zur Erhebung eines Widerspruchs gegen die beabsichtigte Löschung wird auf 3 Monate festgesetzt."
    },
    {
      "date": "2025-01-27",
      "id": "99632",
      "original_text": "Einreichung neuer Dokumente\nThüringen Amtsgericht Jena HRB 302008\nWohnungsbaugesellschaft mbH Meiningen – Meiningen",
      "type": "Einreichung neuer Dokumente",
      "state": "Thüringen",
      "amtsgericht": "Amtsgericht Jena",
      "registernummer": "HRB 302008",
      "registerart": "HRB",
      "company_name": "Wohnungsbaugesellschaft mbH Meiningen",
      "company_seat": "Meiningen",
      "details": "27.01.2025 (Bekanntmachungsdatum)\n\nThüringen Amtsgericht Jena HRB 302008\nEinreichung neuer Dokumente\n\nWohnungsbaugesellschaft mbH Meiningen\nGesellschaft mit beschränkter Haftung\nMeiningen\n\nBekanntmachung gem. § 52 Abs. 3 Satz 2 GmbHG: Aufgrund einer Veränderung in den Personen der Aufsichtsratsmitglieder ist durch die Geschäftsführer eine neue Liste zum Handelsregister eingereicht worden."
    },
    {
      "date": "2025-01-27",
      "id": "99633",
      "original_text": "Löschungsankündigung\nHamburg Amtsgericht Hamburg VR 10331\nÖSTERREICHER CLUB IN NORDDEUTSCHLAND e.V. – Hamburg",
      "type": "Löschungsankündigung",
      "state": "Hamburg",
      "amtsgericht": "Amtsgericht Hamburg",
      "registernummer": "VR 10331",
      "registerart": "VR",
      "company_name": "ÖSTERREICHER CLUB IN NORDDEUTSCHLAND e.V.",
      "company_seat": "Hamburg",
      "details": "27.01.2025 (Bekanntmachungsdatum)\n\nHamburg Amtsgericht Hamburg VR 10331\nLöschungsankündigung\n\nÖSTERREICHER CLUB IN NORDDEUTSCHLAND e.V.\neingetragener Verein\nHamburg\n\nDas Registergericht beabsichtigt, den im Vereinsregister eingetragenen Verein von Amts wegen nach § 395 FamFG zu löschen, da nach den angestellten Ermittlungen dieser Verein offenbar nicht mehr besteht. Die Frist zur Erhebung eines Widerspruchs gegen die beabsichtigte Löschung wird auf 3 Monate festgesetzt."
    },
    {
      "date": "2025-01-27",
      "id": "99634",
      "original_text": "Löschungsankündigung\nHamburg Amtsgericht Hamburg VR 19391\nCSA - Chill Squad Altona e.V. – Hamburg",
      "type": "Löschungsankündigung",
      "state": "Hamburg",
      "amtsgericht": "Amtsgericht Hamburg",
      "registernummer": "VR 19391",
      "registerart": "VR",
      "company_name": "CSA - Chill Squad Altona e.V.",
      "company_seat": "Hamburg",
      "details": "27.01.2025 (Bekanntmachungsdatum)\n\nHamburg Amtsgericht Hamburg VR 19391\nLöschungsankündigung\n\nCSA - Chill Squad Altona e.V.\neingetragener Verein\nHamburg\n\nDas Registergericht beabsichtigt, den im Vereinsregister eingetragenen Verein von Amts wegen nach § 395 FamFG zu löschen, da nach den angestellten Ermittlungen dieser Verein offenbar nicht mehr besteht. Die Frist zur Erhebung eines Widerspruchs gegen die beabsichtigte Löschung wird auf 3 Monate festgesetzt."
    },
    {
      "date": "2025-01-27",
      "id": "99635",
      "original_text": "Löschungsankündigung\nHamburg Amtsgericht Hamburg VR 22601\nZebracrossing e.V. – Hamburg",
      "type": "Löschungsankündigung",
      "state": "Hamburg",
      "amtsgericht": "Amtsgericht Hamburg",
      "registernummer": "VR 22601",
      "registerart": "VR",
      "company_name": "Zebracrossing e.V.",
      "company_seat": "Hamburg",
      "details": "27.01.2025 (Bekanntmachungsdatum)\n\nHamburg Amtsgericht Hamburg VR 22601\nLöschungsankündigung\n\nZebracrossing e.V.\neingetragener Verein\nHamburg\n\nDas Registergericht beabsichtigt, den im Vereinsregister eingetragenen Verein von Amts wegen nach § 395 FamFG zu löschen, da nach den angestellten Ermittlungen dieser Verein offenbar nicht mehr besteht. Die Frist zur Erhebung eines Widerspruchs gegen die beabsichtigte Löschung wird auf 3 Monate festgesetzt."
    },
    {
      "date": "2025-01-27",
      "id": "99636",
      "original_text": "Löschungsankündigung\nHamburg Amtsgericht Hamburg VR 13154\nKenan's Tae Kwon-Do Sportverein e.V. – Hamburg",
      "type": "Löschungsankündigung",
      "state": "Hamburg",
      "amtsgericht": "Amtsgericht Hamburg",
      "registernummer": "VR 13154",
      "registerart": "VR",
      "company_name": "Kenan's Tae Kwon-Do Sportverein e.V.",
      "company_seat": "Hamburg",
      "details": "27.01.2025 (Bekanntmachungsdatum)\n\nHamburg Amtsgericht Hamburg VR 13154\nLöschungsankündigung\n\nKenan's Tae Kwon-Do Sportverein e.V.\neingetragener Verein\nHamburg\n\nDas Registergericht beabsichtigt, den im Vereinsregister eingetragenen Verein von Amts wegen nach § 395 FamFG zu löschen, da nach den angestellten Ermittlungen dieser Verein offenbar nicht mehr besteht. Die Frist zur Erhebung eines Widerspruchs gegen die beabsichtigte Löschung wird auf 3 Monate festgesetzt."
    },
    {
      "date": "2025-01-27",
      "id": "99637",
      "original_text": "Löschungsankündigung\nHamburg Amtsgericht Hamburg VR 23960\nMit uns Wandern Hamburg e.V. – Hamburg",
      "type": "Löschungsankündigung",
      "state": "Hamburg",
      "amtsgericht": "Amtsgericht Hamburg",
      "registernummer": "VR 23960",
      "registerart": "VR",
      "company_name": "Mit uns Wandern Hamburg e.V.",
      "company_seat": "Hamburg",
      "details": "27.01.2025 (Bekanntmachungsdatum)\n\nHamburg Amtsgericht Hamburg VR 23960\nLöschungsankündigung\n\nMit uns Wandern Hamburg e.V.\neingetragener Verein\nHamburg\n\nDas Registergericht beabsichtigt, den im Vereinsregister eingetragenen Verein von Amts wegen nach § 395 FamFG zu löschen, da nach den angestellten Ermittlungen dieser Verein offenbar nicht mehr besteht. Die Frist zur Erhebung eines Widerspruchs gegen die beabsichtigte Löschung wird auf 3 Monate festgesetzt."
    },
    {
      "date": "2025-01-27",
      "id": "99638",
      "original_text": "Löschungsankündigung\nHamburg Amtsgericht Hamburg HRA 125418\nJFP Fashion GmbH & Co. KG – Hamburg",
      "type": "Löschungsankündigung",
      "state": "Hamburg",
      "amtsgericht": "Amtsgericht Hamburg",
      "registernummer": "HRA 125418",
      "registerart": "HRA",
      "company_name": "JFP Fashion GmbH & Co. KG",
      "company_seat": "Hamburg",
      "details": "27.01.2025 (Bekanntmachungsdatum)\n\nHamburg Amtsgericht Hamburg HRA 125418\nLöschungsankündigung\n\nJFP Fashion GmbH & Co. KG\nKommanditgesellschaft\nHamburg\n\nDas Registergericht beabsichtigt, die im Handelsregister eingetragene Gesellschaft von Amts wegen nach § 394 FamFG zu löschen. Die Frist zur Erhebung eines Widerspruchs gegen die beabsichtigte Löschung wird auf 3 Monate festgesetzt."
    },
    {
      "date": "2025-01-27",
      "id": "99639",
      "original_text": "Löschungsankündigung\nHamburg Amtsgericht Hamburg HRA 125314\nGlobal-Reloc UG (haftungsbeschränkt) & Co. KG – Hamburg",
      "type": "Löschungsankündigung",
      "state": "Hamburg",
      "amtsgericht": "Amtsgericht Hamburg",
      "registernummer": "HRA 125314",
      "registerart": "HRA",
      "company_name": "Global-Reloc UG (haftungsbeschränkt) & Co. KG",
      "company_seat": "Hamburg",
      "details": "27.01.2025 (Bekanntmachungsdatum)\n\nHamburg Amtsgericht Hamburg HRA 125314\nLöschungsankündigung\n\nGlobal-Reloc UG (haftungsbeschränkt) & Co. KG\nKommanditgesellschaft\nHamburg\n\nDas Registergericht beabsichtigt, die im Handelsregister eingetragene Gesellschaft von Amts wegen nach § 394 FamFG zu löschen. Die Frist zur Erhebung eines Widerspruchs gegen die beabsichtigte Löschung wird auf 3 Monate festgesetzt."
    },
    {
      "date": "2025-01-27",
      "id": "99640",
      "original_text": "Sonstige Registerbekanntmachung\nBaden-Württemberg Amtsgericht Mannheim HRB 522398\nTop Hair International GmbH – Gaggenau",
      "type": "Sonstige Registerbekanntmachung",
      "state": "Baden-Württemberg",
      "amtsgericht": "Amtsgericht Mannheim",
      "registernummer": "HRB 522398",
      "registerart": "HRB",
      "company_name": "Top Hair International GmbH",
      "company_seat": "Gaggenau",
      "details": "27.01.2025 (Bekanntmachungsdatum)\n\nBaden-Württemberg Amtsgericht Mannheim HRB 522398\nSonstige Registerbekanntmachung 27.01.2025 (Eintragungsdatum)\n\nTop Hair International GmbH\nGesellschaft mit beschränkter Haftung\nGaggenau\n\nDen Gläubigern der Gesellschaft, deren Forderungen begründet worden sind, bevor die Eintragung der Beendigung des Vertrages in das Handelsregister nach § 10 HGB als bekanntgemacht gilt, ist vom anderen Vertragsteil Sicherheit zu leisten, wenn sie sich binnen sechs Monaten nach der Bekanntmachung zu diesem Zweck bei ihm melden."
    },
    {
      "date": "2025-01-27",
      "id": "99641",
      "original_text": "Registerbekanntmachung nach dem Umwandlungsgesetz\nBrandenburg Amtsgericht Cottbus HRB 11572\nCornwall Verwaltungs GmbH – Schönefeld",
      "type": "Registerbekanntmachung nach dem Umwandlungsgesetz",
      "state": "Brandenburg",
      "amtsgericht": "Amtsgericht Cottbus",
      "registernummer": "HRB 11572",
      "registerart": "HRB",
      "company_name": "Cornwall Verwaltungs GmbH",
      "company_seat": "Schönefeld",
      "details": "27.01.2025 (Bekanntmachungsdatum)\n\nBrandenburg Amtsgericht Cottbus HRB 11572\nRegisterbekanntmachung nach dem Umwandlungsgesetz 23.01.2025 (Eintragungsdatum)\n\nCornwall Verwaltungs GmbH\nGesellschaft mit beschränkter Haftung\nSchönefeld\n\nZu Eintragungsnummer 9 vom 23.01.2025 wird als nicht eingetragen veröffentlicht:\nAls nicht eingetragen wird veröffentlicht:\nDen Gläubigern der an der Verschmelzung beteiligten Rechtsträger ist, wenn sie binnen sechs Monaten nach dem Tag, an dem die Eintragung der Verschmelzung in das Register des Sitzes desjenigen Rechtsträgers, dessen Gläubiger sie sind, als bekannt gemacht gilt, ihren Anspruch nach Grund und Höhe schriftlich anmelden, Sicherheit zu leisten, soweit sie nicht Befriedigung verlangen können. Dieses Recht steht den Gläubigern jedoch nur zu, wenn sie glaubhaft machen, dass durch die Verschmelzung die Erfüllung ihrer Forderung gefährdet wird"
    },
    {
      "date": "2025-01-27",
      "id": "99642",
      "original_text": "Sonstige Registerbekanntmachung\nBrandenburg Amtsgericht Cottbus HRB 8327\nLausitz Energie Kraftwerke AG – Cottbus",
      "type": "Sonstige Registerbekanntmachung",
      "state": "Brandenburg",
      "amtsgericht": "Amtsgericht Cottbus",
      "registernummer": "HRB 8327",
      "registerart": "HRB",
      "company_name": "Lausitz Energie Kraftwerke AG",
      "company_seat": "Cottbus",
      "details": "27.01.2025 (Bekanntmachungsdatum)\n\nBrandenburg Amtsgericht Cottbus HRB 8327\nSonstige Registerbekanntmachung\n\nLausitz Energie Kraftwerke AG\nAktiengesellschaft\nCottbus\n\nAls nicht eingetragen wird veröffentlicht:\n\nZu veröffentlichen gem. § 10 HGB:\n\nEs wurde hier der Entwurf eines Abspaltungs- und Übernahmevertrags der Lausitz Energie Kraftwerke AG mit Sitz in Cottbus (Amtsgerichts Cottbus HRB 8327) als übertragende Gesellschaft auf die LEAG Finance GmbH mit Sitz in Cottbus (Amtsgerichts Cottbus, HRB 17911) als aufnehmende Gesellschaft eingereicht (§§ 61 S. 2, 125 Abs. 1 UmwG)."
    },
    {
      "date": "2025-01-27",
      "id": "99643",
      "original_text": "Einreichung neuer Dokumente\nNordrhein-Westfalen Amtsgericht Coesfeld HRB 18494\nKloster Annenthal - Seniorenzentrum GmbH – Coesfeld",
      "type": "Einreichung neuer Dokumente",
      "state": "Nordrhein-Westfalen",
      "amtsgericht": "Amtsgericht Coesfeld",
      "registernummer": "HRB 18494",
      "registerart": "HRB",
      "company_name": "Kloster Annenthal - Seniorenzentrum GmbH",
      "company_seat": "Coesfeld",
      "details": "27.01.2025 (Bekanntmachungsdatum)\n\nNordrhein-Westfalen Amtsgericht Coesfeld HRB 18494\nEinreichung neuer Dokumente\n\nKloster Annenthal - Seniorenzentrum GmbH\nGesellschaft mit beschränkter Haftung\nCoesfeld\n\nAls nicht eingetragen wird bekanntgemacht: Die Liste der Mitglieder des Aufsichtsrates ist zum Handelsregister eingereicht worden."
    },
    {
      "date": "2025-01-27",
      "id": "99644",
      "original_text": "Sonstige Registerbekanntmachung\nHamburg Amtsgericht Hamburg HRB 21371\nWalter Kluxen GmbH. – Hamburg",
      "type": "Sonstige Registerbekanntmachung",
      "state": "Hamburg",
      "amtsgericht": "Amtsgericht Hamburg",
      "registernummer": "HRB 21371",
      "registerart": "HRB",
      "company_name": "Walter Kluxen GmbH.",
      "company_seat": "Hamburg",
      "details": "27.01.2025 (Bekanntmachungsdatum)\n\nHamburg Amtsgericht Hamburg HRB 21371\nSonstige Registerbekanntmachung 27.01.2025 (Eintragungsdatum)\n\nWalter Kluxen GmbH.\nGesellschaft mit beschränkter Haftung\nHamburg\n\nAls nicht eingetragen wird bekannt gemacht:  Den Gläubigern der Gesellschaft, deren Forderungen begründet worden sind, bevor die Eintragung der Vertragsbeendigung in das Handelsregister nach § 10 HGB als bekannt gemacht gilt, ist vom anderen Vertragsteil Sicherheit zu leisten, wenn sie sich binnen 6 Monaten nach Bekanntmachung der Eintragung zu diesem Zweck bei ihm melden."
    },
    {
      "date": "2025-01-27",
      "id": "99645",
      "original_text": "Einreichung neuer Dokumente\nMecklenburg-Vorpommern Amtsgericht Stralsund HRB 2576 früher Amtsgericht Rostock\nStadtwerke Barth GmbH – Barth",
      "type": "Einreichung neuer Dokumente",
      "state": "Mecklenburg-Vorpommern",
      "amtsgericht": "Amtsgericht Stralsund",
      "registernummer": "HRB 2576",
      "registerart": "HRB",
      "company_name": "Stadtwerke Barth GmbH",
      "company_seat": "Barth",
      "former_amtsgericht": "Rostock",
      "details": "27.01.2025 (Bekanntmachungsdatum)\n\nMecklenburg-Vorpommern Amtsgericht Stralsund HRB 2576 früher Amtsgericht Rostock\nEinreichung neuer Dokumente\n\nStadtwerke Barth GmbH\nGesellschaft mit beschränkter Haftung\nBarth"
    },
    {
      "date": "2025-01-27",
      "id": "99646",
      "original_text": "Löschungsankündigung\nSchleswig-Holstein Amtsgericht Flensburg HRB 6895\nSchaumburg Vermögensverwaltungs GmbH – Hattstedtermarsch",
      "type": "Löschungsankündigung",
      "state": "Schleswig-Holstein",
      "amtsgericht": "Amtsgericht Flensburg",
      "registernummer": "HRB 6895",
      "registerart": "HRB",
      "company_name": "Schaumburg Vermögensverwaltungs GmbH",
      "company_seat": "Hattstedtermarsch",
      "details": "27.01.2025 (Bekanntmachungsdatum)\n\nSchleswig-Holstein Amtsgericht Flensburg HRB 6895\nLöschungsankündigung\n\nSchaumburg Vermögensverwaltungs GmbH\nGesellschaft mit beschränkter Haftung\nHattstedtermarsch\n\nEs ist die Löschung der nachstehenden Gesellschaft wegen Vermögenslosigkeit gemäß § 394 FamFG beabsichtigt.\nWiderspruchsfrist: 2 Monate."
    },
    {
      "date": "2025-01-27",
      "id": "99647",
      "original_text": "Einreichung neuer Dokumente\nBrandenburg Amtsgericht Cottbus HRB 3326\nLausitz Energie Bergbau AG – Cottbus",
      "type": "Einreichung neuer Dokumente",
      "state": "Brandenburg",
      "amtsgericht": "Amtsgericht Cottbus",
      "registernummer": "HRB 3326",
      "registerart": "HRB",
      "company_name": "Lausitz Energie Bergbau AG",
      "company_seat": "Cottbus",
      "details": "27.01.2025 (Bekanntmachungsdatum)\n\nBrandenburg Amtsgericht Cottbus HRB 3326\nEinreichung neuer Dokumente\n\nLausitz Energie Bergbau AG\nAktiengesellschaft\nCottbus\n\nAls nicht eingetragen wird veröffentlicht:\nDer andere Vertragsteil hat den Gläubigern dieses Rechtsträgers, dessen Forderungen begründet worden sind, bevor die Eintragung der Beendigung dieses Vertrages in das Handelsregister nach § 10 des Handelsgesetzbuches als bekannt gemacht gilt, Sicherheit zu leisten, wenn sie sich binnen sechs Monaten nach der Bekanntmachung der Eintragung zu diesem Zweck bei ihm melden"
    },
    {
      "date": "2025-01-27",
      "id": "99648",
      "original_text": "Registerbekanntmachung nach dem Umwandlungsgesetz\nBerlin Amtsgericht Berlin (Charlottenburg) HRB 225686\nSpread VK GmbH – Berlin",
      "type": "Registerbekanntmachung nach dem Umwandlungsgesetz",
      "state": "Berlin",
      "amtsgericht": "Amtsgericht Berlin (Charlottenburg)",
      "registernummer": "HRB 225686",
      "registerart": "HRB",
      "company_name": "Spread VK GmbH",
      "company_seat": "Berlin",
      "details": "27.01.2025 (Bekanntmachungsdatum)\n\nBerlin Amtsgericht Berlin (Charlottenburg) HRB 225686\nRegisterbekanntmachung nach dem Umwandlungsgesetz 24.01.2025 (Eintragungsdatum)\n\nSpread VK GmbH\nGesellschaft mit beschränkter Haftung\nBerlin\n\nZu Eintragungsnummer 5 vom 24.01.2025 wird als nicht eingetragen veröffentlicht: Den Gläubigern der an der Verschmelzung beteiligten Rechtsträger ist, wenn sie binnen sechs Monaten nach dem Tag, an dem die Eintragung der Verschmelzung in das Register des Sitzes desjenigen Rechtsträgers, dessen Gläubiger sie sind, als bekannt gemacht gilt, ihren Anspruch nach Grund und Höhe schriftlich anmelden, Sicherheit zu leisten, soweit sie nicht Befriedigung verlangen können. Dieses Recht steht den Gläubigern jedoch nur zu, wenn sie glaubhaft machen, dass durch die Verschmelzung die Erfüllung ihrer Forderung gefährdet wird. Das Recht, Sicherheitsleistung zu verlangen, steht Gläubigern nicht zu, die im Falle der Insolvenz ein Recht auf vorzugsweise Befriedigung aus einer Deckungsmasse haben, die nach gesetzlicher Vorschrift zu ihrem Schutz errichtet und staatlich überwacht ist."
    },
    {
      "date": "2025-01-27",
      "id": "99649",
      "original_text": "Einreichung neuer Dokumente\nBerlin Amtsgericht Berlin (Charlottenburg) HRB 99634\nBerlinovo Immobilien Gesellschaft mbH – Berlin",
      "type": "Einreichung neuer Dokumente",
      "state": "Berlin",
      "amtsgericht": "Amtsgericht Berlin (Charlottenburg)",
      "registernummer": "HRB 99634",
      "registerart": "HRB",
      "company_name": "Berlinovo Immobilien Gesellschaft mbH",
      "company_seat": "Berlin",
      "details": "27.01.2025 (Bekanntmachungsdatum)\n\nBerlin Amtsgericht Berlin (Charlottenburg) HRB 99634\nEinreichung neuer Dokumente\n\nBerlinovo Immobilien Gesellschaft mbH\nGesellschaft mit beschränkter Haftung\nBerlin\n\nAls nicht eingetragen wird veröffentlicht: Es wurde eine neue Liste der Aufsichtsratsmitglieder eingereicht (§52 GmbHG)."
    },
    {
      "date": "2025-01-27",
      "id": "99650",
      "original_text": "Registerbekanntmachung nach dem Umwandlungsgesetz\nBerlin Amtsgericht Berlin (Charlottenburg) HRB 256260\nKormesch Capital UG (haftungsbeschränkt) – Berlin",
      "type": "Registerbekanntmachung nach dem Umwandlungsgesetz",
      "state": "Berlin",
      "amtsgericht": "Amtsgericht Berlin (Charlottenburg)",
      "registernummer": "HRB 256260",
      "registerart": "HRB",
      "company_name": "Kormesch Capital UG (haftungsbeschränkt)",
      "company_seat": "Berlin",
      "details": "27.01.2025 (Bekanntmachungsdatum)\n\nBerlin Amtsgericht Berlin (Charlottenburg) HRB 256260\nRegisterbekanntmachung nach dem Umwandlungsgesetz 24.01.2025 (Eintragungsdatum)\n\nKormesch Capital UG (haftungsbeschränkt)\nGesellschaft mit beschränkter Haftung\nBerlin\n\nZu Eintragungsnummer 2 vom 24.01.2025 wird als nicht eingetragen veröffentlicht: Den Gläubigern der an der Verschmelzung beteiligten Rechtsträger ist, wenn sie binnen sechs Monaten nach dem Tag, an dem die Eintragung der Verschmelzung in das Register des Sitzes desjenigen Rechtsträgers, dessen Gläubiger sie sind, als bekannt gemacht gilt, ihren Anspruch nach Grund und Höhe schriftlich anmelden, Sicherheit zu leisten, soweit sie nicht Befriedigung verlangen können. Dieses Recht steht den Gläubigern jedoch nur zu, wenn sie glaubhaft machen, dass durch die Verschmelzung die Erfüllung ihrer Forderung gefährdet wird. Das Recht, Sicherheitsleistung zu verlangen, steht Gläubigern nicht zu, die im Falle der Insolvenz ein Recht auf vorzugsweise Befriedigung aus einer Deckungsmasse haben, die nach gesetzlicher Vorschrift zu ihrem Schutz errichtet und staatlich überwacht ist."
    },
    {
      "date": "2025-01-27",
      "id": "99651",
      "original_text": "Einreichung neuer Dokumente\nBerlin Amtsgericht Berlin (Charlottenburg) HRB 80443\nBundesdruckerei Gruppe GmbH – Berlin",
      "type": "Einreichung neuer Dokumente",
      "state": "Berlin",
      "amtsgericht": "Amtsgericht Berlin (Charlottenburg)",
      "registernummer": "HRB 80443",
      "registerart": "HRB",
      "company_name": "Bundesdruckerei Gruppe GmbH",
      "company_seat": "Berlin",
      "details": "27.01.2025 (Bekanntmachungsdatum)\n\nBerlin Amtsgericht Berlin (Charlottenburg) HRB 80443\nEinreichung neuer Dokumente\n\nBundesdruckerei Gruppe GmbH\nGesellschaft mit beschränkter Haftung\nBerlin\n\nAls nicht eingetragen wird veröffentlicht:Es wurde eine neue Liste der Aufsichtsratsmitglieder eingereicht (§52 GmbHG)."
    },
    {
      "date": "2025-01-27",
      "id": "99652",
      "original_text": "Löschungsankündigung\nBerlin Amtsgericht Berlin (Charlottenburg) HRB 86403\nPharao GmbH Unternehmensberatung – Berlin",
      "type": "Löschungsankündigung",
      "state": "Berlin",
      "amtsgericht": "Amtsgericht Berlin (Charlottenburg)",
      "registernummer": "HRB 86403",
      "registerart": "HRB",
      "company_name": "Pharao GmbH Unternehmensberatung",
      "company_seat": "Berlin",
      "details": "27.01.2025 (Bekanntmachungsdatum)\n\nBerlin Amtsgericht Berlin (Charlottenburg) HRB 86403\nLöschungsankündigung\n\nPharao GmbH Unternehmensberatung\nGesellschaft mit beschränkter Haftung\nBerlin\n\nBei der nachstehenden Gesellschaft wird das Amtslöschungsverfahren gemäß § 394 FamFG eingeleitet. Widerspruchsfrist 6 Wochen"
    },
    {
      "date": "2025-01-27",
      "id": "99653",
      "original_text": "Einreichung neuer Dokumente\nMecklenburg-Vorpommern Amtsgericht Stralsund HRB 326 früher Amtsgericht Rostock\nBergener Wohnungsgesellschaft mbH – Bergen auf Rügen",
      "type": "Einreichung neuer Dokumente",
      "state": "Mecklenburg-Vorpommern",
      "amtsgericht": "Amtsgericht Stralsund",
      "registernummer": "HRB 326",
      "registerart": "HRB",
      "company_name": "Bergener Wohnungsgesellschaft mbH",
      "company_seat": "Bergen auf Rügen",
      "former_amtsgericht": "Rostock",
      "details": "27.01.2025 (Bekanntmachungsdatum)\n\nMecklenburg-Vorpommern Amtsgericht Stralsund HRB 326 früher Amtsgericht Rostock\nEinreichung neuer Dokumente\n\nBergener Wohnungsgesellschaft mbH\nGesellschaft mit beschränkter Haftung\nBergen auf Rügen"
    },
    {
      "date": "2025-01-27",
      "id": "99654",
      "original_text": "Löschungsankündigung\nBerlin Amtsgericht Berlin (Charlottenburg) HRB 176893\nMC-Hochbau GmbH – Berlin",
      "type": "Löschungsankündigung",
      "state": "Berlin",
      "amtsgericht": "Amtsgericht Berlin (Charlottenburg)",
      "registernummer": "HRB 176893",
      "registerart": "HRB",
      "company_name": "MC-Hochbau GmbH",
      "company_seat": "Berlin",
      "details": "27.01.2025 (Bekanntmachungsdatum)\n\nBerlin Amtsgericht Berlin (Charlottenburg) HRB 176893\nLöschungsankündigung\n\nMC-Hochbau GmbH\nGesellschaft mit beschränkter Haftung\nBerlin\n\nBei der nachstehenden Gesellschaft wird das Amtslöschungsverfahren gemäß § 394 FamFG eingeleitet. Widerspruchsfrist 6 Wochen"
    },
    {
      "date": "2025-01-27",
      "id": "99655",
      "original_text": "Sonstige Registerbekanntmachung\nBaden-Württemberg Amtsgericht Freiburg HRB 381971\nBodensee-Hafen-Gesellschaft mbH (BHG) – Konstanz",
      "type": "Sonstige Registerbekanntmachung",
      "state": "Baden-Württemberg",
      "amtsgericht": "Amtsgericht Freiburg",
      "registernummer": "HRB 381971",
      "registerart": "HRB",
      "company_name": "Bodensee-Hafen-Gesellschaft mbH (BHG)",
      "company_seat": "Konstanz",
      "details": "27.01.2025 (Bekanntmachungsdatum)\n\nBaden-Württemberg Amtsgericht Freiburg HRB 381971\nSonstige Registerbekanntmachung\n\nBodensee-Hafen-Gesellschaft mbH (BHG)\nGesellschaft mit beschränkter Haftung\nKonstanz\n\nDie Gesellschaft hat am 07.01.2025 die Liste über die Zusammensetzung des Aufsichtsrats zum Handelsregister eingereicht."
    },
    {
      "date": "2025-01-27",
      "id": "99656",
      "original_text": "Registerbekanntmachung nach dem Umwandlungsgesetz\nBaden-Württemberg Amtsgericht Ulm HRB 734585\nKiesel Nord GmbH – Baienfurt",
      "type": "Registerbekanntmachung nach dem Umwandlungsgesetz",
      "state": "Baden-Württemberg",
      "amtsgericht": "Amtsgericht Ulm",
      "registernummer": "HRB 734585",
      "registerart": "HRB",
      "company_name": "Kiesel Nord GmbH",
      "company_seat": "Baienfurt",
      "details": "27.01.2025 (Bekanntmachungsdatum)\n\nBaden-Württemberg Amtsgericht Ulm HRB 734585\nRegisterbekanntmachung nach dem Umwandlungsgesetz 27.01.2025 (Eintragungsdatum)\n\nKiesel Nord GmbH\nGesellschaft mit beschränkter Haftung\nBaienfurt\n\nAls nicht eingetragen wird bekanntgemacht:\nDen Gläubigern der an der Verschmelzung beteiligten Rechtsträger ist, wenn sie binnen sechs Monaten nach dem Tag, an dem die Eintragung der Verschmelzung in das Register des Sitzes desjenigen Rechtsträgers, dessen Gläubiger sie sind, nach § 19 Abs. 3 UmwG als bekanntgemacht gilt, ihren Anspruch nach Grund und Höhe schriftlich anmelden, Sicherheit zu leisten, soweit sie nicht Befriedigung verlangen können. Dieses Recht steht den Gläubigern jedoch nur zu, wenn sie glaubhaft machen, dass durch die Verschmelzung die Erfüllung ihrer Forderung gefährdet wird."
    },
    {
      "date": "2025-01-27",
      "id": "99657",
      "original_text": "Registerbekanntmachung nach dem Umwandlungsgesetz\nBaden-Württemberg Amtsgericht Ulm HRB 722267\nKiesel Verwaltungs GmbH – Baienfurt",
      "type": "Registerbekanntmachung nach dem Umwandlungsgesetz",
      "state": "Baden-Württemberg",
      "amtsgericht": "Amtsgericht Ulm",
      "registernummer": "HRB 722267",
      "registerart": "HRB",
      "company_name": "Kiesel Verwaltungs GmbH",
      "company_seat": "Baienfurt",
      "details": "27.01.2025 (Bekanntmachungsdatum)\n\nBaden-Württemberg Amtsgericht Ulm HRB 722267\nRegisterbekanntmachung nach dem Umwandlungsgesetz 27.01.2025 (Eintragungsdatum)\n\nKiesel Verwaltungs GmbH\nGesellschaft mit beschränkter Haftung\nBaienfurt\n\nAls nicht eingetragen wird bekanntgemacht:\nDen Gläubigern der an der Verschmelzung beteiligten Rechtsträger ist, wenn sie binnen sechs Monaten nach dem Tag, an dem die Eintragung der Verschmelzung in das Register des Sitzes desjenigen Rechtsträgers, dessen Gläubiger sie sind, nach § 19 Abs. 3 UmwG als bekanntgemacht gilt, ihren Anspruch nach Grund und Höhe schriftlich anmelden, Sicherheit zu leisten, soweit sie nicht Befriedigung verlangen können. Dieses Recht steht den Gläubigern jedoch nur zu, wenn sie glaubhaft machen, dass durch die Verschmelzung die Erfüllung ihrer Forderung gefährdet wird."
    },
    {
      "date": "2025-01-27",
      "id": "99658",
      "original_text": "Einreichung neuer Dokumente\nBrandenburg Amtsgericht Cottbus HRB 3326\nLausitz Energie Bergbau AG – Cottbus",
      "type": "Einreichung neuer Dokumente",
      "state": "Brandenburg",
      "amtsgericht": "Amtsgericht Cottbus",
      "registernummer": "HRB 3326",
      "registerart": "HRB",
      "company_name": "Lausitz Energie Bergbau AG",
      "company_seat": "Cottbus",
      "details": "27.01.2025 (Bekanntmachungsdatum)\n\nBrandenburg Amtsgericht Cottbus HRB 3326\nEinreichung neuer Dokumente\n\nLausitz Energie Bergbau AG\nAktiengesellschaft\nCottbus\n\nAls nicht eingetragen wird veröffentlicht:\nEs wurde der Entwurf eines Abspaltungs- und Übernahmevertrags der Lausitz Energie Bergbau AG mit Sitz in Cottbus (Amtsgericht Cottbus, HRB 3326 CB) als übertragende Gesellschaft auf die LEAG Renewables GmbH mit Sitz in Cottbus (Amtsgericht Cottbus, HRB 18056 CB)  sowie  LEAG Clean Power GmbH mit Sitz in Cottbus (Amtsgericht Cottbus, HRB 17639 CB)  und der LEAG Biomass GmbH mit Sitz in Cottbus (Amtsgericht Cottbus, HRB 17378 CB)  als aufnehmende Gesellschaften eingereicht (§§ 61 S. 2, 125 Abs. 1 UmwG)."
    },
    {
      "date": "2025-01-27",
      "id": "99659",
      "original_text": "Sonstige Registerbekanntmachung\nSachsen-Anhalt Amtsgericht Stendal HRB 15572\nSOEX Processing Germany GmbH – Bitterfeld-Wolfen",
      "type": "Sonstige Registerbekanntmachung",
      "state": "Sachsen-Anhalt",
      "amtsgericht": "Amtsgericht Stendal",
      "registernummer": "HRB 15572",
      "registerart": "HRB",
      "company_name": "SOEX Processing Germany GmbH",
      "company_seat": "Bitterfeld-Wolfen",
      "details": "27.01.2025 (Bekanntmachungsdatum)\n\nSachsen-Anhalt Amtsgericht Stendal HRB 15572\nSonstige Registerbekanntmachung 27.01.2025 (Eintragungsdatum)\n\nSOEX Processing Germany GmbH\nGesellschaft mit beschränkter Haftung\nBitterfeld-Wolfen\n\nNicht eingetragen:\nAls nicht eingetragen wird veröffentlicht: Den Gläubigern der Gesellschaft, deren Forderungen begründet worden sind bevor die Eintragung der Beendigung des #DV.Art(Text=\"Art des Vertrages auswählen\",Eingabe=\"Beherrschungs- und Gewinnabführungsvertrages\",\"Beherrschungsvertrages\",\"Gewinnabführungsvertrages\",\"Teilgewinnabführungsvertrages\")  in das Handelsregister nach § 10 des Handelsgesetzbuches als bekanntgemacht gilt, hat der andere Vertragsteil Sicherheit zu leisten, wenn sie sich binnen sechs Monaten nach der Bekanntmachung der Eintragung zu diesem Zweck bei ihm melden."
    },
    {
      "date": "2025-01-27",
      "id": "99660",
      "original_text": "Registerbekanntmachung nach dem Umwandlungsgesetz\nBaden-Württemberg Amtsgericht Mannheim HRB 746653\nSTYX GmbH – Mannheim",
      "type": "Registerbekanntmachung nach dem Umwandlungsgesetz",
      "state": "Baden-Württemberg",
      "amtsgericht": "Amtsgericht Mannheim",
      "registernummer": "HRB 746653",
      "registerart": "HRB",
      "company_name": "STYX GmbH",
      "company_seat": "Mannheim",
      "details": "27.01.2025 (Bekanntmachungsdatum)\n\nBaden-Württemberg Amtsgericht Mannheim HRB 746653\nRegisterbekanntmachung nach dem Umwandlungsgesetz 27.01.2025 (Eintragungsdatum)\n\nSTYX GmbH\nGesellschaft mit beschränkter Haftung\nMannheim\n\nDen Gläubigern des an dem Formwechsel beteiligten Rechtsträgers ist, wenn sie binnen sechs Monaten nach dem Tag, an dem die Eintragung des Formwechsels in das Register des Sitzes desjenigen Rechtsträgers, dessen Gläubiger sie sind, nach § 19 Abs. 3 UmwG als bekanntgemacht gilt, ihren Anspruch nach Grund und Höhe schriftlich anmelden, Sicherheit zu leisten, soweit sie nicht Befriedigung verlangen können. Dieses Recht steht den Gläubigern jedoch nur zu, wenn sie glaubhaft machen, dass durch den Formwechsel die Erfüllung ihrer Forderung gefährdet wird."
    },
    {
      "date": "2025-01-27",
      "id": "99661",
      "original_text": "Registerbekanntmachung nach dem Umwandlungsgesetz\nBaden-Württemberg Amtsgericht Mannheim HRB 753362\nSTYX AG – Mannheim",
      "type": "Registerbekanntmachung nach dem Umwandlungsgesetz",
      "state": "Baden-Württemberg",
      "amtsgericht": "Amtsgericht Mannheim",
      "registernummer": "HRB 753362",
      "registerart": "HRB",
      "company_name": "STYX AG",
      "company_seat": "Mannheim",
      "details": "27.01.2025 (Bekanntmachungsdatum)\n\nBaden-Württemberg Amtsgericht Mannheim HRB 753362\nRegisterbekanntmachung nach dem Umwandlungsgesetz 27.01.2025 (Eintragungsdatum)\n\nSTYX AG\nAktiengesellschaft\nMannheim\n\nDen Gläubigern des an dem Formwechsel beteiligten Rechtsträgers ist, wenn sie binnen sechs Monaten nach dem Tag, an dem die Eintragung des Formwechsels in das Register des Sitzes desjenigen Rechtsträgers, dessen Gläubiger sie sind, nach § 19 Abs. 3 UmwG als bekanntgemacht gilt, ihren Anspruch nach Grund und Höhe schriftlich anmelden, Sicherheit zu leisten, soweit sie nicht Befriedigung verlangen können. Dieses Recht steht den Gläubigern jedoch nur zu, wenn sie glaubhaft machen, dass durch den Formwechsel die Erfüllung ihrer Forderung gefährdet wird."
    },
    {
      "date": "2025-01-27",
      "id": "99662",
      "original_text": "Löschungsankündigung\nMecklenburg-Vorpommern Amtsgericht Schwerin HRA 3273\nTixPert KG – Parchim",
      "type": "Löschungsankündigung",
      "state": "Mecklenburg-Vorpommern",
      "amtsgericht": "Amtsgericht Schwerin",
      "registernummer": "HRA 3273",
      "registerart": "HRA",
      "company_name": "TixPert KG",
      "company_seat": "Parchim",
      "details": "27.01.2025 (Bekanntmachungsdatum)\n\nMecklenburg-Vorpommern Amtsgericht Schwerin HRA 3273\nLöschungsankündigung\n\nTixPert KG\nKommanditgesellschaft\nParchim\n\nDas Registergericht beabsichtigt, die im Handelsregister eingetragene Gesellschaft von Amts wegen nach § 394 FamFG zu löschen. Die Frist zur Erhebung eines Widerspruchs gegen die beabsichtigte Löschung wird auf 1 Monat festgesetzt."
    },
    {
      "date": "2025-01-27",
      "id": "99663",
      "original_text": "Registerbekanntmachung nach dem Umwandlungsgesetz\nSachsen Amtsgericht Leipzig HRB 6993\nLeipziger Verkehrsbetriebe (LVB) Gesellschaft mit beschränkter Haftung – Leipzig",
      "type": "Registerbekanntmachung nach dem Umwandlungsgesetz",
      "state": "Sachsen",
      "amtsgericht": "Amtsgericht Leipzig",
      "registernummer": "HRB 6993",
      "registerart": "HRB",
      "company_name": "Leipziger Verkehrsbetriebe (LVB) Gesellschaft mit beschränkter Haftung",
      "company_seat": "Leipzig",
      "details": "27.01.2025 (Bekanntmachungsdatum)\n\nSachsen Amtsgericht Leipzig HRB 6993\nRegisterbekanntmachung nach dem Umwandlungsgesetz 27.01.2025 (Eintragungsdatum)\n\nLeipziger Verkehrsbetriebe (LVB) Gesellschaft mit beschränkter Haftung\nGesellschaft mit beschränkter Haftung\nLeipzig\n\nDen Gläubigern der an der Verschmelzung beteiligten Rechtsträger ist, wenn sie binnen sechs Monaten nach dem Tag, an dem die Eintragung der Verschmelzung in das Register des Sitzes desjenigen Rechtsträgers, dessen Gläubiger sie sind, nach § 19 Abs. 3 UmwG als bekannt gemacht gilt, ihren Anspruch nach Grund und Höhe in Textform anmelden, Sicherheit zu leisten, soweit sie nicht Befriedigung verlangen können. Dieses Recht steht den Gläubigern jedoch nur zu, wenn sie glaubhaft machen, dass durch die Verschmelzung die Erfüllung der Forderung gefährdet wird."
    },
    {
      "date": "2025-01-27",
      "id": "99664",
      "original_text": "Registerbekanntmachung nach dem Umwandlungsgesetz\nSachsen Amtsgericht Leipzig HRB 24486\nLeipziger Stadtverkehrsbetriebe (LSVB) GmbH – Leipzig",
      "type": "Registerbekanntmachung nach dem Umwandlungsgesetz",
      "state": "Sachsen",
      "amtsgericht": "Amtsgericht Leipzig",
      "registernummer": "HRB 24486",
      "registerart": "HRB",
      "company_name": "Leipziger Stadtverkehrsbetriebe (LSVB) GmbH",
      "company_seat": "Leipzig",
      "details": "27.01.2025 (Bekanntmachungsdatum)\n\nSachsen Amtsgericht Leipzig HRB 24486\nRegisterbekanntmachung nach dem Umwandlungsgesetz 27.01.2025 (Eintragungsdatum)\n\nLeipziger Stadtverkehrsbetriebe (LSVB) GmbH\nGesellschaft mit beschränkter Haftung\nLeipzig\n\nDen Gläubigern der an der Verschmelzung beteiligten Rechtsträger ist, wenn sie binnen sechs Monaten nach dem Tag, an dem die Eintragung der Verschmelzung in das Register des Sitzes desjenigen Rechtsträgers, dessen Gläubiger sie sind, nach § 19 Abs. 3 UmwG als bekannt gemacht gilt, ihren Anspruch nach Grund und Höhe in Textform anmelden, Sicherheit zu leisten, soweit sie nicht Befriedigung verlangen können. Dieses Recht steht den Gläubigern jedoch nur zu, wenn sie glaubhaft machen, dass durch die Verschmelzung die Erfüllung der Forderung gefährdet wird."
    },
    {
      "date": "2025-01-27",
      "id": "99665",
      "original_text": "Löschungsankündigung\nSachsen Amtsgericht Dresden HRB 40678\nKORBWELT UG (haftungsbeschränkt) – Görlitz",
      "type": "Löschungsankündigung",
      "state": "Sachsen",
      "amtsgericht": "Amtsgericht Dresden",
      "registernummer": "HRB 40678",
      "registerart": "HRB",
      "company_name": "KORBWELT UG (haftungsbeschränkt)",
      "company_seat": "Görlitz",
      "details": "27.01.2025 (Bekanntmachungsdatum)\n\nSachsen Amtsgericht Dresden HRB 40678\nLöschungsankündigung\n\nKORBWELT UG (haftungsbeschränkt)\nGesellschaft mit beschränkter Haftung\nGörlitz\n\nDas Registergericht beabsichtigt, die im Handelsregister eingetragene Gesellschaft von Amts wegen nach § 394 FamFG zu löschen. Die Frist zu Erhebung eines Widerspruchs gegen die beabsichtigte Löschung wird auf einen Monat festgesetzt."
    },
    {
      "date": "2025-01-27",
      "id": "99666",
      "original_text": "Einreichung neuer Dokumente\nSachsen Amtsgericht Dresden HRB 24866\nMedizinische Versorgungszentren der Oberlausitz gGmbH – Bautzen",
      "type": "Einreichung neuer Dokumente",
      "state": "Sachsen",
      "amtsgericht": "Amtsgericht Dresden",
      "registernummer": "HRB 24866",
      "registerart": "HRB",
      "company_name": "Medizinische Versorgungszentren der Oberlausitz gGmbH",
      "company_seat": "Bautzen",
      "details": "27.01.2025 (Bekanntmachungsdatum)\n\nSachsen Amtsgericht Dresden HRB 24866\nEinreichung neuer Dokumente\n\nMedizinische Versorgungszentren der Oberlausitz gGmbH\nGesellschaft mit beschränkter Haftung\nBautzen\n\nAm 20.01.2025 wurde beim Handelsregister des Amtsgerichts Dresden die Liste der Mitglieder des Aufsichtsrats gemäß § 52 GmbHG eingereicht."
    },
    {
      "date": "2025-01-27",
      "id": "99667",
      "original_text": "Registerbekanntmachung nach dem Umwandlungsgesetz\nSachsen Amtsgericht Leipzig HRB 7369\nLeoBus GmbH – Leipzig",
      "type": "Registerbekanntmachung nach dem Umwandlungsgesetz",
      "state": "Sachsen",
      "amtsgericht": "Amtsgericht Leipzig",
      "registernummer": "HRB 7369",
      "registerart": "HRB",
      "company_name": "LeoBus GmbH",
      "company_seat": "Leipzig",
      "details": "27.01.2025 (Bekanntmachungsdatum)\n\nSachsen Amtsgericht Leipzig HRB 7369\nRegisterbekanntmachung nach dem Umwandlungsgesetz 27.01.2025 (Eintragungsdatum)\n\nLeoBus GmbH\nGesellschaft mit beschränkter Haftung\nLeipzig\n\nDen Gläubigern der an der Spaltung beteiligten Rechtsträger ist, wenn sie binnen sechs Monaten nach dem Tag, an dem die Eintragung der Spaltung in das Register des Sitzes desjenigen Rechtsträgers, dessen Gläubiger sie sind, nach § 19 Abs. 3 UmwG als bekannt gemacht gilt, ihren Anspruch nach Grund und Höhe in Textform anmelden, Sicherheit zu leisten, soweit sie nicht Befriedigung verlangen können. Dieses Recht steht den Gläubigern jedoch nur zu, wenn sie glaubhaft machen, dass durch die Spaltung die Erfüllung der Forderung gefährdet wird."
    },
    {
      "date": "2025-01-27",
      "id": "99668",
      "original_text": "Löschungsankündigung\nSachsen Amtsgericht Chemnitz HRB 33500\nWEILO-Bauservice UG (haftungsbeschränkt) – Döbeln",
      "type": "Löschungsankündigung",
      "state": "Sachsen",
      "amtsgericht": "Amtsgericht Chemnitz",
      "registernummer": "HRB 33500",
      "registerart": "HRB",
      "company_name": "WEILO-Bauservice UG (haftungsbeschränkt)",
      "company_seat": "Döbeln",
      "details": "27.01.2025 (Bekanntmachungsdatum)\n\nSachsen Amtsgericht Chemnitz HRB 33500\nLöschungsankündigung\n\nWEILO-Bauservice UG (haftungsbeschränkt)\nGesellschaft mit beschränkter Haftung\nDöbeln\n\nDas Registergericht beabsichtigt, die im Handelsregister eingetragene Gesellschaft von Amts wegen nach § 394 FamFG zu löschen. Die Frist zu Erhebung eines Widerspruchs gegen die beabsichtigte Löschung wird auf einen Monat festgesetzt."
    },
    {
      "date": "2025-01-27",
      "id": "99669",
      "original_text": "Registerbekanntmachung nach dem Umwandlungsgesetz\nSachsen Amtsgericht Leipzig HRB 15928\nLTB Leipziger Transport und Logistik Betriebe GmbH – Leipzig",
      "type": "Registerbekanntmachung nach dem Umwandlungsgesetz",
      "state": "Sachsen",
      "amtsgericht": "Amtsgericht Leipzig",
      "registernummer": "HRB 15928",
      "registerart": "HRB",
      "company_name": "LTB Leipziger Transport und Logistik Betriebe GmbH",
      "company_seat": "Leipzig",
      "details": "27.01.2025 (Bekanntmachungsdatum)\n\nSachsen Amtsgericht Leipzig HRB 15928\nRegisterbekanntmachung nach dem Umwandlungsgesetz 27.01.2025 (Eintragungsdatum)\n\nLTB Leipziger Transport und Logistik Betriebe GmbH\nGesellschaft mit beschränkter Haftung\nLeipzig\n\nDen Gläubigern der an der Spaltung beteiligten Rechtsträger ist, wenn sie binnen sechs Monaten nach dem Tag, an dem die Eintragung der Spaltung in das Register des Sitzes desjenigen Rechtsträgers, dessen Gläubiger sie sind, nach § 19 Abs. 3 UmwG als bekannt gemacht gilt, ihren Anspruch nach Grund und Höhe in Textform anmelden, Sicherheit zu leisten, soweit sie nicht Befriedigung verlangen können. Dieses Recht steht den Gläubigern jedoch nur zu, wenn sie glaubhaft machen, dass durch die Spaltung die Erfüllung der Forderung gefährdet wird."
    },
    {
      "date": "2025-01-27",
      "id": "99670",
      "original_text": "Löschungsankündigung\nSachsen Amtsgericht Dresden HRB 44558\nBioTap UG (haftungsbeschränkt) – Dresden",
      "type": "Löschungsankündigung",
      "state": "Sachsen",
      "amtsgericht": "Amtsgericht Dresden",
      "registernummer": "HRB 44558",
      "registerart": "HRB",
      "company_name": "BioTap UG (haftungsbeschränkt)",
      "company_seat": "Dresden",
      "details": "27.01.2025 (Bekanntmachungsdatum)\n\nSachsen Amtsgericht Dresden HRB 44558\nLöschungsankündigung\n\nBioTap UG (haftungsbeschränkt)\nGesellschaft mit beschränkter Haftung\nDresden\n\nDas Registergericht beabsichtigt, die im Handelsregister eingetragene Gesellschaft von Amts wegen nach § 394 FamFG zu löschen. Die Frist zu Erhebung eines Widerspruchs gegen die beabsichtigte Löschung wird auf einen Monat festgesetzt."
    },
    {
      "date": "2025-01-27",
      "id": "99671",
      "original_text": "Einreichung neuer Dokumente\nSachsen Amtsgericht Dresden HRB 18772\nBombastus-Werke - Aktiengesellschaft – Freital",
      "type": "Einreichung neuer Dokumente",
      "state": "Sachsen",
      "amtsgericht": "Amtsgericht Dresden",
      "registernummer": "HRB 18772",
      "registerart": "HRB",
      "company_name": "Bombastus-Werke - Aktiengesellschaft",
      "company_seat": "Freital",
      "details": "27.01.2025 (Bekanntmachungsdatum)\n\nSachsen Amtsgericht Dresden HRB 18772\nEinreichung neuer Dokumente 27.01.2025 (Eintragungsdatum)\n\nBombastus-Werke - Aktiengesellschaft\nAktiengesellschaft\nFreital\n\nAm 21.01.2025 wurde beim Handelsregister des Amtsgerichts Dresden die Liste der Mitglieder des Aufsichtsrats gemäß § 106 AktG eingereicht."
    },
    {
      "date": "2025-01-27",
      "id": "99672",
      "original_text": "Einreichung neuer Dokumente\nSachsen Amtsgericht Dresden HRB 18772\nBombastus-Werke - Aktiengesellschaft – Freital",
      "type": "Einreichung neuer Dokumente",
      "state": "Sachsen",
      "amtsgericht": "Amtsgericht Dresden",
      "registernummer": "HRB 18772",
      "registerart": "HRB",
      "company_name": "Bombastus-Werke - Aktiengesellschaft",
      "company_seat": "Freital",
      "details": "27.01.2025 (Bekanntmachungsdatum)\n\nSachsen Amtsgericht Dresden HRB 18772\nEinreichung neuer Dokumente 27.01.2025 (Eintragungsdatum)\n\nBombastus-Werke - Aktiengesellschaft\nAktiengesellschaft\nFreital\n\nAm 22.01.2025 wurde beim Handelsregister des Amtsgerichts Dresden die Liste der Mitglieder des Aufsichtsrats gemäß § 106 AktG eingereicht."
    },
    {
      "date": "2025-01-27",
      "id": "99673",
      "original_text": "Löschungsankündigung\nNiedersachsen Amtsgericht Walsrode HRA 202184\nMaack, Elektro-Kabelmontagen und -handel e. K., Inhaber Viktor Bäcker – Sulingen",
      "type": "Löschungsankündigung",
      "state": "Niedersachsen",
      "amtsgericht": "Amtsgericht Walsrode",
      "registernummer": "HRA 202184",
      "registerart": "HRA",
      "company_name": "Maack, Elektro-Kabelmontagen und -handel e. K., Inhaber Viktor Bäcker",
      "company_seat": "Sulingen",
      "details": "27.01.2025 (Bekanntmachungsdatum)\n\nNiedersachsen Amtsgericht Walsrode HRA 202184\nLöschungsankündigung 27.01.2025 (Eintragungsdatum)\n\nMaack, Elektro-Kabelmontagen und -handel e. K., Inhaber Viktor Bäcker\nEinzelkaufmann / Einzelkauffrau\nSulingen\n\nDas Registergericht beabsichtigt, die Firma von Amts wegen nach § 395 FamFG zu löschen. Die Frist zur Erhebung eines Widerspruchs ist auf 1 Monat ab dieser Registerbekanntmachung festgesetzt."
    },
    {
      "date": "2025-01-27",
      "id": "99674",
      "original_text": "Registerbekanntmachung nach dem Umwandlungsgesetz\nNiedersachsen Amtsgericht Göttingen HRB 1860\nCarl Hasselbach Beteiligungs- und Geschäftsführungs GmbH – Rosdorf",
      "type": "Registerbekanntmachung nach dem Umwandlungsgesetz",
      "state": "Niedersachsen",
      "amtsgericht": "Amtsgericht Göttingen",
      "registernummer": "HRB 1860",
      "registerart": "HRB",
      "company_name": "Carl Hasselbach Beteiligungs- und Geschäftsführungs GmbH",
      "company_seat": "Rosdorf",
      "details": "27.01.2025 (Bekanntmachungsdatum)\n\nNiedersachsen Amtsgericht Göttingen HRB 1860\nRegisterbekanntmachung nach dem Umwandlungsgesetz 27.01.2025 (Eintragungsdatum)\n\nCarl Hasselbach Beteiligungs- und Geschäftsführungs GmbH\nGesellschaft mit beschränkter Haftung\nRosdorf\n\nDen Gläubigern der an der Verschmelzung beteiligten Rechtsträger ist, wenn sie binnen sechs Monaten nach dem Tag, an dem die Eintragung der Verschmelzung in das Register des Sitzes desjenigen Rechtsträgers, dessen Gläubiger sie sind, nach § 19  Abs.  3 UmwG als bekannt gemacht gilt, ihren Anspruch nach Grund und Höhe schriftlich anmelden, Sicherheit zu leisten, soweit sie nicht Befriedigung verlangen können. Dieses Recht steht den Gläubigern jedoch nur zu, wenn sie glaubhaft machen, dass durch die Verschmelzung die Erfüllung der Forderung gefährdet wird."
    },
    {
      "date": "2025-01-27",
      "id": "99675",
      "original_text": "Sonstige Registerbekanntmachung\nNiedersachsen Amtsgericht Hannover HRB 201186\nenercity Netz GmbH – Hannover",
      "type": "Sonstige Registerbekanntmachung",
      "state": "Niedersachsen",
      "amtsgericht": "Amtsgericht Hannover",
      "registernummer": "HRB 201186",
      "registerart": "HRB",
      "company_name": "enercity Netz GmbH",
      "company_seat": "Hannover",
      "details": "27.01.2025 (Bekanntmachungsdatum)\n\nNiedersachsen Amtsgericht Hannover HRB 201186\nSonstige Registerbekanntmachung\n\nenercity Netz GmbH\nGesellschaft mit beschränkter Haftung\nHannover\n\nDie Liste der Mitglieder des Aufsichtsrats wurde beim Registergericht eingereicht."
    },
    {
      "date": "2025-01-27",
      "id": "99676",
      "original_text": "Registerbekanntmachung nach dem Umwandlungsgesetz\nNiedersachsen Amtsgericht Tostedt HRA 100799 früher Amtsgericht Stade\nPaulus-Apotheke René Große e. K. – Gnarrenburg",
      "type": "Registerbekanntmachung nach dem Umwandlungsgesetz",
      "state": "Niedersachsen",
      "amtsgericht": "Amtsgericht Tostedt",
      "registernummer": "HRA 100799",
      "registerart": "HRA",
      "company_name": "Paulus-Apotheke René Große e. K.",
      "company_seat": "Gnarrenburg",
      "former_amtsgericht": "Stade",
      "details": "27.01.2025 (Bekanntmachungsdatum)\n\nNiedersachsen Amtsgericht Tostedt HRA 100799 früher Amtsgericht Stade\nRegisterbekanntmachung nach dem Umwandlungsgesetz 27.01.2025 (Eintragungsdatum)\n\nPaulus-Apotheke René Große e. K.\nEinzelkaufmann / Einzelkauffrau\nGnarrenburg\n\nDen Gläubigern der an der Ausgliederung beteiligten Rechtsträger ist, wenn sie binnen sechs Monaten nach dem Tag, an dem die Eintragung der Ausgliederung in das Register des Sitzes desjenigen Rechtsträgers, dessen Gläubiger sie sind, nach § 19 Abs. 3 UmwG als bekannt gemacht gilt, ihren Anspruch nach Grund und Höhe schriftlich anmelden, Sicherheit zu leisten, soweit sie nicht Befriedigung verlangen können. Dieses Recht steht den Gläubigern jedoch nur zu, wenn sie glaubhaft machen, dass durch die Ausgliederung die Erfüllung der Forderung gefährdet wird."
    },
    {
      "date": "2025-01-27",
      "id": "99677",
      "original_text": "Registerbekanntmachung nach dem Umwandlungsgesetz\nNiedersachsen Amtsgericht Tostedt VR 201203\nLebenshilfe Landkreis Harburg e.V. – Tostedt",
      "type": "Registerbekanntmachung nach dem Umwandlungsgesetz",
      "state": "Niedersachsen",
      "amtsgericht": "Amtsgericht Tostedt",
      "registernummer": "VR 201203",
      "registerart": "VR",
      "company_name": "Lebenshilfe Landkreis Harburg e.V.",
      "company_seat": "Tostedt",
      "details": "27.01.2025 (Bekanntmachungsdatum)\n\nNiedersachsen Amtsgericht Tostedt VR 201203\nRegisterbekanntmachung nach dem Umwandlungsgesetz 27.01.2025 (Eintragungsdatum)\n\nLebenshilfe Landkreis Harburg e.V.\neingetragener Verein\nTostedt\n\nDen Gläubigern der an der Verschmelzung beteiligten Rechtsträger ist, wenn sie binnen sechs Monaten nach dem Tag, an dem die Eintragung der Verschmelzung in das Register des Sitzes desjenigen Rechtsträgers, dessen Gläubiger sie sind, nach § 19  Abs.  3 UmwG als bekannt gemacht gilt, ihren Anspruch nach Grund und Höhe schriftlich anmelden, Sicherheit zu leisten, soweit sie nicht Befriedigung verlangen können. Dieses Recht steht den Gläubigern jedoch nur zu, wenn sie glaubhaft machen, dass durch die Verschmelzung die Erfüllung der Forderung gefährdet wird."
    },
    {
      "date": "2025-01-27",
      "id": "99678",
      "original_text": "Löschungsankündigung\nNiedersachsen Amtsgericht Oldenburg (Oldenburg) HRB 219246\nCrull Dienstleistungs UG (haftungsbeschränkt) – Hude",
      "type": "Löschungsankündigung",
      "state": "Niedersachsen",
      "amtsgericht": "Amtsgericht Oldenburg (Oldenburg)",
      "registernummer": "HRB 219246",
      "registerart": "HRB",
      "company_name": "Crull Dienstleistungs UG (haftungsbeschränkt)",
      "company_seat": "Hude",
      "details": "27.01.2025 (Bekanntmachungsdatum)\n\nNiedersachsen Amtsgericht Oldenburg (Oldenburg) HRB 219246\nLöschungsankündigung\n\nCrull Dienstleistungs UG (haftungsbeschränkt)\nGesellschaft mit beschränkter Haftung\nHude\n\nDas Registergericht beabsichtigt, die Gesellschaft von Amts wegen nach § 394 FamFG zu löschen. Die Frist zur Erhebung eines Widerspruchs ist auf 1 Monat ab dieser Registerbekanntmachung festgesetzt."
    },
    {
      "date": "2025-01-27",
      "id": "99679",
      "original_text": "Registerbekanntmachung nach dem Umwandlungsgesetz\nNiedersachsen Amtsgericht Hildesheim HRB 202809\nmonofaktur GmbH – Müden",
      "type": "Registerbekanntmachung nach dem Umwandlungsgesetz",
      "state": "Niedersachsen",
      "amtsgericht": "Amtsgericht Hildesheim",
      "registernummer": "HRB 202809",
      "registerart": "HRB",
      "company_name": "monofaktur GmbH",
      "company_seat": "Müden",
      "details": "27.01.2025 (Bekanntmachungsdatum)\n\nNiedersachsen Amtsgericht Hildesheim HRB 202809\nRegisterbekanntmachung nach dem Umwandlungsgesetz 27.01.2025 (Eintragungsdatum)\n\nmonofaktur GmbH\nGesellschaft mit beschränkter Haftung\nMüden\n\nDen Gläubigern der an der formwechselnden Umwandlung beteiligten Rechtsträger ist, wenn sie binnen sechs Monaten nach dem Tag, an dem die Eintragung der Umwandlung in das Register des Sitzes desjenigen Rechtsträgers, dessen Gläubiger sie sind, nach § 19 Abs. 3 UmwG als bekannt gemacht gilt, ihren Anspruch nach Grund und Höhe schriftlich anmelden, Sicherheit zu leisten, soweit sie nicht Befriedigung verlangen können. Dieses Recht steht den Gläubigern jedoch nur zu, wenn sie glaubhaft machen, dass durch die formwechselnde Umwandlung die Erfüllung der Forderung gefährdet wird."
    },
    {
      "date": "2025-01-27",
      "id": "99680",
      "original_text": "Löschungsankündigung\nNiedersachsen Amtsgericht Osnabrück HRB 206506\nPremium Cars EU GmbH – Wilsum",
      "type": "Löschungsankündigung",
      "state": "Niedersachsen",
      "amtsgericht": "Amtsgericht Osnabrück",
      "registernummer": "HRB 206506",
      "registerart": "HRB",
      "company_name": "Premium Cars EU GmbH",
      "company_seat": "Wilsum",
      "details": "27.01.2025 (Bekanntmachungsdatum)\n\nNiedersachsen Amtsgericht Osnabrück HRB 206506\nLöschungsankündigung\n\nPremium Cars EU GmbH\nGesellschaft mit beschränkter Haftung\nWilsum\n\nDas Registergericht beabsichtigt, die Gesellschaft von Amts wegen nach § 394 FamFG wegen Vermögenslosigkeit zu löschen. Die Frist zur Erhebung eines Widerspruchs ist auf 1 Monat ab dieser Registerbekanntmachung festgesetzt."
    },
    {
      "date": "2025-01-27",
      "id": "99681",
      "original_text": "Sonstige Registerbekanntmachung\nNiedersachsen Amtsgericht Tostedt GnR 110008 früher Amtsgericht Langen\nVolksbank Geeste-Nord eG – Geestland",
      "type": "Sonstige Registerbekanntmachung",
      "state": "Niedersachsen",
      "amtsgericht": "Amtsgericht Tostedt",
      "registernummer": "GnR 110008",
      "registerart": "GnR",
      "company_name": "Volksbank Geeste-Nord eG",
      "company_seat": "Geestland",
      "former_amtsgericht": "Langen",
      "details": "27.01.2025 (Bekanntmachungsdatum)\n\nNiedersachsen Amtsgericht Tostedt GnR 110008 früher Amtsgericht Langen\nSonstige Registerbekanntmachung 27.01.2025 (Eintragungsdatum)\n\nVolksbank Geeste-Nord eG\neingetragene Genossenschaft\nGeestland\n\nNeue Regelung: Die Nachschusspflicht der Mitglieder ist ausgeschlossen.. Den Gläubigern der Genossenschaft ist, wenn sie sich binnen sechs Monaten nach dieser Bekanntmachung zu diesem Zweck bei der Genossenschaft melden, Sicherheit zu leisten, soweit sie nicht Befriedigung verlangen können."
    },
    {
      "date": "2025-01-27",
      "id": "99682",
      "original_text": "Löschungsankündigung\nNiedersachsen Amtsgericht Osnabrück HRB 200168\nEsdar Spritzschaumtechnik GmbH – Hasbergen",
      "type": "Löschungsankündigung",
      "state": "Niedersachsen",
      "amtsgericht": "Amtsgericht Osnabrück",
      "registernummer": "HRB 200168",
      "registerart": "HRB",
      "company_name": "Esdar Spritzschaumtechnik GmbH",
      "company_seat": "Hasbergen",
      "details": "27.01.2025 (Bekanntmachungsdatum)\n\nNiedersachsen Amtsgericht Osnabrück HRB 200168\nLöschungsankündigung\n\nEsdar Spritzschaumtechnik GmbH\nGesellschaft mit beschränkter Haftung\nHasbergen\n\nDas Registergericht beabsichtigt, die Gesellschaft von Amts wegen nach § 394 FamFG wegen Vermögenslosigkeit zu löschen. Die Frist zur Erhebung eines Widerspruchs ist auf 1 Monat ab dieser Registerbekanntmachung festgesetzt."
    },
    {
      "date": "2025-01-27",
      "id": "99683",
      "original_text": "Registerbekanntmachung nach dem Umwandlungsgesetz\nNiedersachsen Amtsgericht Hildesheim GnR 200065\nmonofaktur eG – Müden (Aller)",
      "type": "Registerbekanntmachung nach dem Umwandlungsgesetz",
      "state": "Niedersachsen",
      "amtsgericht": "Amtsgericht Hildesheim",
      "registernummer": "GnR 200065",
      "registerart": "GnR",
      "company_name": "monofaktur eG",
      "company_seat": "Müden (Aller)",
      "details": "27.01.2025 (Bekanntmachungsdatum)\n\nNiedersachsen Amtsgericht Hildesheim GnR 200065\nRegisterbekanntmachung nach dem Umwandlungsgesetz 27.01.2025 (Eintragungsdatum)\n\nmonofaktur eG\neingetragene Genossenschaft\nMüden (Aller)\n\nDen Gläubigern der an der formwechselnden Umwandlung beteiligten Rechtsträger ist, wenn sie binnen sechs Monaten nach dem Tag, an dem die Eintragung der Umwandlung in das Register des Sitzes desjenigen Rechtsträgers, dessen Gläubiger sie sind, nach § 19 Abs. 3 UmwG als bekannt gemacht gilt, ihren Anspruch nach Grund und Höhe schriftlich anmelden, Sicherheit zu leisten, soweit sie nicht Befriedigung verlangen können. Dieses Recht steht den Gläubigern jedoch nur zu, wenn sie glaubhaft machen, dass durch die formwechselnde Umwandlung die Erfüllung der Forderung gefährdet wird."
    },
    {
      "date": "2025-01-27",
      "id": "99684",
      "original_text": "Sonstige Registerbekanntmachung\nNiedersachsen Amtsgericht Tostedt GnR 110003 früher Amtsgericht Langen\nVolksbank im Elbe-Weser-Dreieck eG – Beverstedt",
      "type": "Sonstige Registerbekanntmachung",
      "state": "Niedersachsen",
      "amtsgericht": "Amtsgericht Tostedt",
      "registernummer": "GnR 110003",
      "registerart": "GnR",
      "company_name": "Volksbank im Elbe-Weser-Dreieck eG",
      "company_seat": "Beverstedt",
      "former_amtsgericht": "Langen",
      "details": "27.01.2025 (Bekanntmachungsdatum)\n\nNiedersachsen Amtsgericht Tostedt GnR 110003 früher Amtsgericht Langen\nSonstige Registerbekanntmachung 27.01.2025 (Eintragungsdatum)\n\nVolksbank im Elbe-Weser-Dreieck eG\neingetragene Genossenschaft\nBeverstedt\n\nNeue Regelung: Keine Nachschusspflicht.. Den Gläubigern der Genossenschaft ist, wenn sie sich binnen sechs Monaten nach dieser Bekanntmachung zu diesem Zweck bei der Genossenschaft melden, Sicherheit zu leisten, soweit sie nicht Befriedigung verlangen können."
    },
    {
      "date": "2025-01-27",
      "id": "99685",
      "original_text": "Löschungsankündigung\nRheinland-Pfalz Amtsgericht Mainz HRB 49555\nInvest Bau GmbH – Mainz",
      "type": "Löschungsankündigung",
      "state": "Rheinland-Pfalz",
      "amtsgericht": "Amtsgericht Mainz",
      "registernummer": "HRB 49555",
      "registerart": "HRB",
      "company_name": "Invest Bau GmbH",
      "company_seat": "Mainz",
      "details": "27.01.2025 (Bekanntmachungsdatum)\n\nRheinland-Pfalz Amtsgericht Mainz HRB 49555\nLöschungsankündigung\n\nInvest Bau GmbH\nGesellschaft mit beschränkter Haftung\nMainz\n\nDas Registergericht beabsichtigt die Gesellschaft von Amts wegen nach § 394 FamFG zu löschen. Die Frist zur Erhebung eines Widerspruchs ist auf einen Monat festgesetzt."
    },
    {
      "date": "2025-01-27",
      "id": "99686",
      "original_text": "Löschungsankündigung\nBremen Amtsgericht Bremen HRB 26951\nDBO Windpower GmbH – Bremen",
      "type": "Löschungsankündigung",
      "state": "Bremen",
      "amtsgericht": "Amtsgericht Bremen",
      "registernummer": "HRB 26951",
      "registerart": "HRB",
      "company_name": "DBO Windpower GmbH",
      "company_seat": "Bremen",
      "details": "27.01.2025 (Bekanntmachungsdatum)\n\nBremen Amtsgericht Bremen HRB 26951\nLöschungsankündigung\n\nDBO Windpower GmbH\nGesellschaft mit beschränkter Haftung\nBremen\n\nEs ist beabsichtigt die im Handelsregister eingetragene Gesellschaft von Amts wegen gemäß § 394 FamFG zu löschen. Gegen die Löschung kann beim AG Bremen schriftlich oder zu Protokoll der Geschäftsstelle Widerspruch eingelegt werden. Widerspruchsfrist 4 Wochen."
    },
    {
      "date": "2025-01-27",
      "id": "99687",
      "original_text": "Löschungsankündigung\nBremen Amtsgericht Bremen HRB 36462\nHanse eCommerce UG (haftungsbeschränkt) – Bremen",
      "type": "Löschungsankündigung",
      "state": "Bremen",
      "amtsgericht": "Amtsgericht Bremen",
      "registernummer": "HRB 36462",
      "registerart": "HRB",
      "company_name": "Hanse eCommerce UG (haftungsbeschränkt)",
      "company_seat": "Bremen",
      "details": "27.01.2025 (Bekanntmachungsdatum)\n\nBremen Amtsgericht Bremen HRB 36462\nLöschungsankündigung\n\nHanse eCommerce UG (haftungsbeschränkt)\nGesellschaft mit beschränkter Haftung\nBremen\n\nEs ist beabsichtigt die im Handelsregister eingetragene Gesellschaft von Amts wegen gemäß § 394 FamFG zu löschen. Gegen die Löschung kann beim AG Bremen schriftlich oder zu Protokoll der Geschäftsstelle Widerspruch eingelegt werden. Widerspruchsfrist 4 Wochen."
    },
    {
      "date": "2025-01-27",
      "id": "99688",
      "original_text": "Registerbekanntmachung nach dem Umwandlungsgesetz\nNordrhein-Westfalen Amtsgericht Düsseldorf HRB 58328\nHorn Dienstleistungs Beteiligungs GmbH – Düsseldorf",
      "type": "Registerbekanntmachung nach dem Umwandlungsgesetz",
      "state": "Nordrhein-Westfalen",
      "amtsgericht": "Amtsgericht Düsseldorf",
      "registernummer": "HRB 58328",
      "registerart": "HRB",
      "company_name": "Horn Dienstleistungs Beteiligungs GmbH",
      "company_seat": "Düsseldorf",
      "details": "27.01.2025 (Bekanntmachungsdatum)\n\nNordrhein-Westfalen Amtsgericht Düsseldorf HRB 58328\nRegisterbekanntmachung nach dem Umwandlungsgesetz\n\nHorn Dienstleistungs Beteiligungs GmbH\nGesellschaft mit beschränkter Haftung\nDüsseldorf\n\nDem Registergericht ist der Entwurf eines Formwechselplanes über den geplanten Grenzüberschreitenden Formwechsel der Gesellschaft mit beschränkter Haftung nach deutschem Recht unter der Firma Horn Dienstleistungs Beteiligungs GmbH mit Sitz in Düsseldorf (Amtsgericht Düsseldorf HRB 58328) in die Gesellschaft mit beschränkter Haftung nach österreichischem Recht unter der Firma Horn Dienstleistungs Beteiligungs GmbH mit Sitz in Wien / Österreich eingereicht worden.\nDie Gesellschafterversammlung der Gesellschaft wird voraussichtlich am 17. März 2025 über die Zustimmung zu dem Plan für den Grenzüberschreitenden Fomwechsel beschließen. Gesellschafter und Gläubiger der Gesellschaft können bis spätestens fünf Arbeitstage vor dem Tag der Gesellschafterversammlung Bemerkungen zu dem Plan für den Grenzüberschreitenden Formwechsel an die Gesellschaft unter der Geschäftsanschrift Horn Dienstleistungs Beteiligungs GmbH, Berliner Allee 2, 40212 Düsseldorf, Deutschland, übermitteln. Da die Gesellschaft keine Arbeitnehmer hat, unterbleibt darüber hinaus ein Hinweis gemäß §§ 336, 308 Abs. 1 Satz 2 Nr. 4 b) UmwG. Die vollständigen Auskünfte über diese Modalitäten können kostenlos eingeholt werden unter der Geschäftsanschrift Horn Dienstleistungs Beteiligungs GmbH, Berliner Allee 2, 40212 Düsseldorf, Deutschland."
    },
    {
      "date": "2025-01-27",
      "id": "99689",
      "original_text": "Löschungsankündigung\nNordrhein-Westfalen Amtsgericht Bonn HRB 24969\nCooCo GmbH – Wachtberg",
      "type": "Löschungsankündigung",
      "state": "Nordrhein-Westfalen",
      "amtsgericht": "Amtsgericht Bonn",
      "registernummer": "HRB 24969",
      "registerart": "HRB",
      "company_name": "CooCo GmbH",
      "company_seat": "Wachtberg",
      "details": "27.01.2025 (Bekanntmachungsdatum)\n\nNordrhein-Westfalen Amtsgericht Bonn HRB 24969\nLöschungsankündigung\n\nCooCo GmbH\nGesellschaft mit beschränkter Haftung\nWachtberg\n\nDas Registergericht beabsichtigt die Gesellschaft von Amts wegen nach § 394 FamFG zu löschen. Die Frist zur Erhebung eines Widerspruchs ist auf einen Monat festgesetzt."
    },
    {
      "date": "2025-01-27",
      "id": "99690",
      "original_text": "Löschungsankündigung\nNordrhein-Westfalen Amtsgericht Düsseldorf HRB 99339\nOldman Transport GmbH – Düsseldorf",
      "type": "Löschungsankündigung",
      "state": "Nordrhein-Westfalen",
      "amtsgericht": "Amtsgericht Düsseldorf",
      "registernummer": "HRB 99339",
      "registerart": "HRB",
      "company_name": "Oldman Transport GmbH",
      "company_seat": "Düsseldorf",
      "details": "27.01.2025 (Bekanntmachungsdatum)\n\nNordrhein-Westfalen Amtsgericht Düsseldorf HRB 99339\nLöschungsankündigung\n\nOldman Transport GmbH\nGesellschaft mit beschränkter Haftung\nDüsseldorf\n\nDas Registergericht beabsichtigt die Gesellschaft von Amts wegen nach § 394 FamFG zu löschen. Die Frist zur Erhebung eines Widerspruchs ist auf 3 Wochen festgesetzt.\n\nRechtsbehelfsbelehrung:\nDas Widerspruchsrecht steht jedem zu, der an der Unterlassung der Löschung ein berechtigtes Interesse hat. Der Widerspruch ist bei dem Amtsgericht Düsseldorf -Registergericht-, Werdener Straße 1, 40227 Düsseldorf schriftlich in deutscher Sprache oder zur Niederschrift der Geschäftsstelle einzulegen. Der Widerspruch kann auch zur Niederschrift der Geschäftsstelle eines jeden Amtsgerichtes abgegeben werden. Die Einlegung ist auch durch Übertragung eines elektronischen Dokuments an die elektronische Poststelle des Gerichts möglich. Das elektronische Dokument muss für die Bearbeitung durch das Gericht geeignet und mit einer qualifizierten elektronischen Signatur der verantwortenden Person versehen sein oder von der verantwortenden Person signiert und auf einem sicheren Übermittlungsweg gemäß § 130a ZPO nach näherer Maßgabe der Verordnung über die technischen Rahmenbedingungen des elektronischen Rechtsverkehrs und über das besondere elektronische Behördenpostfach (BGBl. I, S.3803) eingereicht werden. Weitere Informationen erhalten Sie auf der Internetseite www.justiz.de.\nDer Widerspruch muss spätestens innerhalb der gesetzten Frist nach dem Datum der Bekanntmachung der Löschungsankündigung bei dem Amtsgericht - Registergericht - Düsseldorf eingegangen sein.  Dies gilt auch dann, wenn der Widerspruch zur Niederschrift der Geschäftsstelle eines anderen Amtsgerichtes abgegeben wurde. Die Frist beginnt mit dem Tage der Bekanntmachung der Löschungsankündigung in dem für die Bekanntmachung der Eintragungen in das Handelsregister bestimmten elektronischen Informations- und Kommunikationssystem nach § 10 des Handelsgesetzbuches. Fällt das Ende der Frist auf einen Sonntag, einen allgemeinen Feiertag oder Sonnabend, so endet die Frist mit Ablauf des nächsten Werktages.\nDer Widerspruch muss die Bezeichnung der angefochtenen Löschungsankündigung sowie die Erklärung enthalten, dass Widerspruch gegen diese Löschungsankündigung eingelegt wird. Er ist zu unterzeichnen und soll begründet werden."
    },
    {
      "date": "2025-01-27",
      "id": "99691",
      "original_text": "Löschungsankündigung\nNordrhein-Westfalen Amtsgericht Düsseldorf HRB 99339\nOldman Transport GmbH – Düsseldorf",
      "type": "Löschungsankündigung",
      "state": "Nordrhein-Westfalen",
      "amtsgericht": "Amtsgericht Düsseldorf",
      "registernummer": "HRB 99339",
      "registerart": "HRB",
      "company_name": "Oldman Transport GmbH",
      "company_seat": "Düsseldorf",
      "details": "27.01.2025 (Bekanntmachungsdatum)\n\nNordrhein-Westfalen Amtsgericht Düsseldorf HRB 99339\nLöschungsankündigung\n\nOldman Transport GmbH\nGesellschaft mit beschränkter Haftung\nDüsseldorf\n\nDem Registergericht ist eine Liste der Mitglieder des Aufsichtsrates eingereicht worden.Das Registergericht beabsichtigt die Gesellschaft von Amts wegen nach § 394 FamFG zu löschen. Die Frist zur Erhebung eines Widerspruchs ist auf 3 Wochen festgesetzt.\n\nRechtsbehelfsbelehrung:\nDas Widerspruchsrecht steht jedem zu, der an der Unterlassung der Löschung ein berechtigtes Interesse hat. Der Widerspruch ist bei dem Amtsgericht Düsseldorf -Registergericht-, Werdener Straße 1, 40227 Düsseldorf schriftlich in deutscher Sprache oder zur Niederschrift der Geschäftsstelle einzulegen. Der Widerspruch kann auch zur Niederschrift der Geschäftsstelle eines jeden Amtsgerichtes abgegeben werden. Die Einlegung ist auch durch Übertragung eines elektronischen Dokuments an die elektronische Poststelle des Gerichts möglich. Das elektronische Dokument muss für die Bearbeitung durch das Gericht geeignet und mit einer qualifizierten elektronischen Signatur der verantwortenden Person versehen sein oder von der verantwortenden Person signiert und auf einem sicheren Übermittlungsweg gemäß § 130a ZPO nach näherer Maßgabe der Verordnung über die technischen Rahmenbedingungen des elektronischen Rechtsverkehrs und über das besondere elektronische Behördenpostfach (BGBl. I, S.3803) eingereicht werden. Weitere Informationen erhalten Sie auf der Internetseite www.justiz.de.\nDer Widerspruch muss spätestens innerhalb der gesetzten Frist nach dem Datum der Bekanntmachung der Löschungsankündigung bei dem Amtsgericht - Registergericht - Düsseldorf eingegangen sein.  Dies gilt auch dann, wenn der Widerspruch zur Niederschrift der Geschäftsstelle eines anderen Amtsgerichtes abgegeben wurde. Die Frist beginnt mit dem Tage der Bekanntmachung der Löschungsankündigung in dem für die Bekanntmachung der Eintragungen in das Handelsregister bestimmten elektronischen Informations- und Kommunikationssystem nach § 10 des Handelsgesetzbuches. Fällt das Ende der Frist auf einen Sonntag, einen allgemeinen Feiertag oder Sonnabend, so endet die Frist mit Ablauf des nächsten Werktages.\nDer Widerspruch muss die Bezeichnung der angefochtenen Löschungsankündigung sowie die Erklärung enthalten, dass Widerspruch gegen diese Löschungsankündigung eingelegt wird. Er ist zu unterzeichnen und soll begründet werden."
    },
    {
      "date": "2025-01-27",
      "id": "99692",
      "original_text": "Sonstige Registerbekanntmachung\nNordrhein-Westfalen Amtsgericht Köln HRB 16238\nWallossek Dentaltechnik GmbH – Köln",
      "type": "Sonstige Registerbekanntmachung",
      "state": "Nordrhein-Westfalen",
      "amtsgericht": "Amtsgericht Köln",
      "registernummer": "HRB 16238",
      "registerart": "HRB",
      "company_name": "Wallossek Dentaltechnik GmbH",
      "company_seat": "Köln",
      "details": "27.01.2025 (Bekanntmachungsdatum)\n\nNordrhein-Westfalen Amtsgericht Köln HRB 16238\nSonstige Registerbekanntmachung 27.01.2025 (Eintragungsdatum)\n\nWallossek Dentaltechnik GmbH\nGesellschaft mit beschränkter Haftung\nKöln\n\nAls nicht eingetragen wird veröffentlicht: Den Gläubigern der Gesellschaft, deren Forderungen begründet worden sind bevor die Eintragung der Beendigung des Gewinnabführungsvertrages  in das Handelsregister nach § 10 des Handelsgesetzbuches als bekanntgemacht gilt, hat der andere Vertragsteil Sicherheit zu leisten, wenn sie sich binnen sechs Monaten nach der Bekanntmachung der Eintragung zu diesem Zweck bei ihm melden."
    },
    {
      "date": "2025-01-27",
      "id": "99693",
      "original_text": "Sonstige Registerbekanntmachung\nNordrhein-Westfalen Amtsgericht Düsseldorf HRB 85739\nAlpha Floristik UG (haftungsbeschränkt) – Düsseldorf",
      "type": "Sonstige Registerbekanntmachung",
      "state": "Nordrhein-Westfalen",
      "amtsgericht": "Amtsgericht Düsseldorf",
      "registernummer": "HRB 85739",
      "registerart": "HRB",
      "company_name": "Alpha Floristik UG (haftungsbeschränkt)",
      "company_seat": "Düsseldorf",
      "details": "27.01.2025 (Bekanntmachungsdatum)\n\nNordrhein-Westfalen Amtsgericht Düsseldorf HRB 85739\nSonstige Registerbekanntmachung 27.01.2025 (Eintragungsdatum)\n\nAlpha Floristik UG (haftungsbeschränkt)\nGesellschaft mit beschränkter Haftung\nDüsseldorf\n\nDie Gesellschaft ist aufgelöst. Von Amts wegen eingetragen."
    },
    {
      "date": "2025-01-27",
      "id": "99694",
      "original_text": "Löschungsankündigung\nNordrhein-Westfalen Amtsgericht Bonn HRB 20212\nDGS DEUTSCHE GRUND & SACHWERT Verwaltungs GmbH – Bonn",
      "type": "Löschungsankündigung",
      "state": "Nordrhein-Westfalen",
      "amtsgericht": "Amtsgericht Bonn",
      "registernummer": "HRB 20212",
      "registerart": "HRB",
      "company_name": "DGS DEUTSCHE GRUND & SACHWERT Verwaltungs GmbH",
      "company_seat": "Bonn",
      "details": "27.01.2025 (Bekanntmachungsdatum)\n\nNordrhein-Westfalen Amtsgericht Bonn HRB 20212\nLöschungsankündigung\n\nDGS DEUTSCHE GRUND & SACHWERT Verwaltungs GmbH\nGesellschaft mit beschränkter Haftung\nBonn\n\nDas Registergericht beabsichtigt die im Handelsregister beim Amtsgericht in Bonn in Abt. B unter Nr. 20212 eingetragene Gesellschaft DGS DEUTSCHE GRUND & SACHWERK Verwaltungs GmbH mit dem Sitz in Bonn von Amts wegen nach § 394 FamFG wegen Vermögenslosigkeit zu löschen. Die Frist zur Erhebung eines Widerspruchs ist auf einen Monat festgesetzt."
    },
    {
      "date": "2025-01-27",
      "id": "99695",
      "original_text": "Einreichung neuer Dokumente\nNordrhein-Westfalen Amtsgericht Duisburg HRB 20198\nMannesmann Precision Tubes GmbH – Mülheim an der Ruhr",
      "type": "Einreichung neuer Dokumente",
      "state": "Nordrhein-Westfalen",
      "amtsgericht": "Amtsgericht Duisburg",
      "registernummer": "HRB 20198",
      "registerart": "HRB",
      "company_name": "Mannesmann Precision Tubes GmbH",
      "company_seat": "Mülheim an der Ruhr",
      "details": "27.01.2025 (Bekanntmachungsdatum)\n\nNordrhein-Westfalen Amtsgericht Duisburg HRB 20198\nEinreichung neuer Dokumente\n\nMannesmann Precision Tubes GmbH\nGesellschaft mit beschränkter Haftung\nMülheim an der Ruhr\n\nDem Registergericht ist eine neue Liste der Mitglieder des Aufsichtsrates eingereicht worden."
    },
    {
      "date": "2025-01-27",
      "id": "99696",
      "original_text": "Löschungsankündigung\nNordrhein-Westfalen Amtsgericht Kleve HRB 17550\nDV Dienstleistungen GmbH – Kamp-Lintfort",
      "type": "Löschungsankündigung",
      "state": "Nordrhein-Westfalen",
      "amtsgericht": "Amtsgericht Kleve",
      "registernummer": "HRB 17550",
      "registerart": "HRB",
      "company_name": "DV Dienstleistungen GmbH",
      "company_seat": "Kamp-Lintfort",
      "details": "27.01.2025 (Bekanntmachungsdatum)\n\nNordrhein-Westfalen Amtsgericht Kleve HRB 17550\nLöschungsankündigung\n\nDV Dienstleistungen GmbH\nGesellschaft mit beschränkter Haftung\nKamp-Lintfort\n\nDas Registergericht beabsichtigt die Gesellschaft von Amts wegen nach § 394 FamFG zu löschen. Die Frist zur Erhebung eines Widerspruchs ist auf einen Monat festgesetzt."
    },
    {
      "date": "2025-01-27",
      "id": "99697",
      "original_text": "Löschungsankündigung\nNordrhein-Westfalen Amtsgericht Dortmund HRA 13264\nDS-Rendite-Fonds Nr. 65 MS Cape Henry GmbH & Co. Containerschiff KG – Dortmund",
      "type": "Löschungsankündigung",
      "state": "Nordrhein-Westfalen",
      "amtsgericht": "Amtsgericht Dortmund",
      "registernummer": "HRA 13264",
      "registerart": "HRA",
      "company_name": "DS-Rendite-Fonds Nr. 65 MS Cape Henry GmbH & Co. Containerschiff KG",
      "company_seat": "Dortmund",
      "details": "27.01.2025 (Bekanntmachungsdatum)\n\nNordrhein-Westfalen Amtsgericht Dortmund HRA 13264\nLöschungsankündigung\n\nDS-Rendite-Fonds Nr. 65 MS Cape Henry GmbH & Co. Containerschiff KG\nKommanditgesellschaft\nDortmund\n\nDas Registergericht beabsichtigt die Firma von Amts wegen nach § 394 FamFG zu löschen. Die Frist zur Erhebung eines Widerspruchs ist auf drei Monate festgesetzt."
    },
    {
      "date": "2025-01-27",
      "id": "99698",
      "original_text": "Einreichung neuer Dokumente\nNordrhein-Westfalen Amtsgericht Gütersloh HRB 12762\nNagel-Group Logistics SE – Versmold",
      "type": "Einreichung neuer Dokumente",
      "state": "Nordrhein-Westfalen",
      "amtsgericht": "Amtsgericht Gütersloh",
      "registernummer": "HRB 12762",
      "registerart": "HRB",
      "company_name": "Nagel-Group Logistics SE",
      "company_seat": "Versmold",
      "details": "27.01.2025 (Bekanntmachungsdatum)\n\nNordrhein-Westfalen Amtsgericht Gütersloh HRB 12762\nEinreichung neuer Dokumente\n\nNagel-Group Logistics SE\nEuropäische Aktiengesellschaft (SE)\nVersmold\n\nDem Registergericht ist eine neue Liste der Mitglieder des Aufsichtsrates eingereicht worden."
    },
    {
      "date": "2025-01-27",
      "id": "99699",
      "original_text": "Löschungsankündigung\nNordrhein-Westfalen Amtsgericht Neuss HRB 19352\nFTS Fair Trade Shop GmbH – Neuss",
      "type": "Löschungsankündigung",
      "state": "Nordrhein-Westfalen",
      "amtsgericht": "Amtsgericht Neuss",
      "registernummer": "HRB 19352",
      "registerart": "HRB",
      "company_name": "FTS Fair Trade Shop GmbH",
      "company_seat": "Neuss",
      "details": "27.01.2025 (Bekanntmachungsdatum)\n\nNordrhein-Westfalen Amtsgericht Neuss HRB 19352\nLöschungsankündigung\n\nFTS Fair Trade Shop GmbH\nGesellschaft mit beschränkter Haftung\nNeuss\n\nEs ist beabsichtigt, die Gesellschaft wegen Vermögenslosigkeit aufgrund des § 394 Abs. 1 FamFG zu löschen. Frist zur Geltendmachung eines Widerspruchs: 1 Monat.\n\nRechtsbehelfsbelehrung:\nGegen diese Verfügung können Sie Widerspruch einlegen.\nDer Widerspruch ist bei dem Amtsgericht Neuss - Registergericht -, Breite Str. 48, 41460 Neuss schriftlich in deutscher Sprache oder zur Niederschrift der Geschäftsstelle einzulegen.\nDer Widerspruch kann auch zur Niederschrift der Geschäftsstelle eines jeden Amtsgerichtes abgegeben werden.\nDie Einlegung ist auch durch Übertragung eines elektronischen Dokuments an die elektronische Poststelle des Gerichts möglich. Das elektronische Dokument muss für die Bearbeitung durch das Gericht geeignet und mit einer qualifizierten elektronischen Signatur der verantwortenden Person versehen sein oder von der verantwortenden Person signiert und auf einem sicheren Übermittlungsweg gemäß § 130a ZPO nach näherer Maßgabe der Verordnung über die technischen Rahmenbedingungen des elektronischen Rechtsverkehrs und über das besondere elektronische Behördenpostfach (BGBl. I, S.3803) eingereicht werden. Weitere Informationen erhalten Sie auf der Internetseite www.justiz.de.\nDer Widerspruch muss spätestens innerhalb der gesetzten Frist nach der schriftlichen Bekanntgabe der Verfügung bei dem Amtsgericht - Registergericht - Neuss eingegangen sein. Dies gilt auch dann, wenn der Widerspruch zur Niederschrift der Geschäftsstelle eines anderen Amtsgerichtes abgegeben wurde. Die Frist beginnt mit der schriftlichen Bekanntgabe der Verfügung. Die Bekanntgabe ist entweder durch Zustellung oder am dritten Tage nach Aufgabe zur Post bewirkt. Fällt das Ende der Frist auf einen Sonntag, einen allgemeinen Feiertag oder Sonnabend, so endet die Frist mit Ablauf des nächsten Werktages.\n\nDer Widerspruch muss die Bezeichnung der angefochtenen Verfügung sowie die Erklärung enthalten, dass Widerspruch gegen diese Verfügung eingelegt wird. Er ist zu unterzeichnen und soll begründet werden."
    },
    {
      "date": "2025-01-27",
      "id": "99700",
      "original_text": "Löschungsankündigung\nBremen Amtsgericht Bremen HRB 37169\nMS Marketing GmbH – Bremen",
      "type": "Löschungsankündigung",
      "state": "Bremen",
      "amtsgericht": "Amtsgericht Bremen",
      "registernummer": "HRB 37169",
      "registerart": "HRB",
      "company_name": "MS Marketing GmbH",
      "company_seat": "Bremen",
      "details": "27.01.2025 (Bekanntmachungsdatum)\n\nBremen Amtsgericht Bremen HRB 37169\nLöschungsankündigung\n\nMS Marketing GmbH\nGesellschaft mit beschränkter Haftung\nBremen\n\nEs ist beabsichtigt die im Handelsregister eingetragene Gesellschaft von Amts wegen gemäß § 394 FamFG zu löschen. Gegen die Löschung kann beim AG Bremen schriftlich oder zu Protokoll der Geschäftsstelle Widerspruch eingelegt werden. Widerspruchsfrist 4 Wochen."
    },
    {
      "date": "2025-01-27",
      "id": "99701",
      "original_text": "Sonstige Registerbekanntmachung\nNordrhein-Westfalen Amtsgericht Köln HRB 100724\nPortfolio KL Betzenberg IV GmbH – Köln",
      "type": "Sonstige Registerbekanntmachung",
      "state": "Nordrhein-Westfalen",
      "amtsgericht": "Amtsgericht Köln",
      "registernummer": "HRB 100724",
      "registerart": "HRB",
      "company_name": "Portfolio KL Betzenberg IV GmbH",
      "company_seat": "Köln",
      "details": "27.01.2025 (Bekanntmachungsdatum)\n\nNordrhein-Westfalen Amtsgericht Köln HRB 100724\nSonstige Registerbekanntmachung 27.01.2025 (Eintragungsdatum)\n\nPortfolio KL Betzenberg IV GmbH\nGesellschaft mit beschränkter Haftung\nKöln\n\nAls nicht eingetragen wird veröffentlicht: Den Gläubigern der Gesellschaft, deren Forderungen begründet worden sind bevor die Eintragung der Beendigung des Gewinnabführungsvertrages  in das Handelsregister nach § 10 des Handelsgesetzbuches als bekanntgemacht gilt, hat der andere Vertragsteil Sicherheit zu leisten, wenn sie sich binnen sechs Monaten nach der Bekanntmachung der Eintragung zu diesem Zweck bei ihm melden."
    },
    {
      "date": "2025-01-27",
      "id": "99702",
      "original_text": "Einreichung neuer Dokumente\nNordrhein-Westfalen Amtsgericht Münster HRB 18330\nLWL-Sozialstiftung gemeinnützige GmbH – Münster",
      "type": "Einreichung neuer Dokumente",
      "state": "Nordrhein-Westfalen",
      "amtsgericht": "Amtsgericht Münster",
      "registernummer": "HRB 18330",
      "registerart": "HRB",
      "company_name": "LWL-Sozialstiftung gemeinnützige GmbH",
      "company_seat": "Münster",
      "details": "27.01.2025 (Bekanntmachungsdatum)\n\nNordrhein-Westfalen Amtsgericht Münster HRB 18330\nEinreichung neuer Dokumente\n\nLWL-Sozialstiftung gemeinnützige GmbH\nGesellschaft mit beschränkter Haftung\nMünster\n\nDem Registergericht ist eine neue Liste der Mitglieder des Aufsichtsrates eingereicht worden."
    },
    {
      "date": "2025-01-27",
      "id": "99703",
      "original_text": "Löschungsankündigung\nNordrhein-Westfalen Amtsgericht Düsseldorf HRB 38326\nSHR Bauträger- und Projektentwicklungsgesellschaft mbH – Ratingen",
      "type": "Löschungsankündigung",
      "state": "Nordrhein-Westfalen",
      "amtsgericht": "Amtsgericht Düsseldorf",
      "registernummer": "HRB 38326",
      "registerart": "HRB",
      "company_name": "SHR Bauträger- und Projektentwicklungsgesellschaft mbH",
      "company_seat": "Ratingen",
      "details": "27.01.2025 (Bekanntmachungsdatum)\n\nNordrhein-Westfalen Amtsgericht Düsseldorf HRB 38326\nLöschungsankündigung\n\nSHR Bauträger- und Projektentwicklungsgesellschaft mbH\nGesellschaft mit beschränkter Haftung\nRatingen\n\nDas Registergericht beabsichtigt die Gesellschaft von Amts wegen nach § 394 Abs. 1 FamFG zu löschen. Die Frist zur Erhebung eines Widerspruchs ist auf einen Monat festgesetzt.\n\nRechtsbehelfsbelehrung:\nDas Widerspruchsrecht steht jedem zu, der an der Unterlassung der Löschung ein berechtigtes Interesse hat. Der Widerspruch ist bei dem Amtsgericht Düsseldorf -Registergericht-, Werdener Straße 1, 40227 Düsseldorf schriftlich in deutscher Sprache oder zur Niederschrift der Geschäftsstelle einzulegen. Der Widerspruch kann auch zur Niederschrift der Geschäftsstelle eines jeden Amtsgerichtes abgegeben werden. Die Einlegung ist auch durch Übertragung eines elektronischen Dokuments an die elektronische Poststelle des Gerichts möglich. Das elektronische Dokument muss für die Bearbeitung durch das Gericht geeignet und mit einer qualifizierten elektronischen Signatur der verantwortenden Person versehen sein oder von der verantwortenden Person signiert und auf einem sicheren Übermittlungsweg gemäß § 130a ZPO nach näherer Maßgabe der Verordnung über die technischen Rahmenbedingungen des elektronischen Rechtsverkehrs und über das besondere elektronische Behördenpostfach (BGBl. I, S.3803) eingereicht werden. Weitere Informationen erhalten Sie auf der Internetseite www.justiz.de.\nDer Widerspruch muss spätestens innerhalb der gesetzten Frist nach dem Datum der Bekanntmachung der Löschungsankündigung bei dem Amtsgericht - Registergericht - Düsseldorf eingegangen sein.  Dies gilt auch dann, wenn der Widerspruch zur Niederschrift der Geschäftsstelle eines anderen Amtsgerichtes abgegeben wurde. Die Frist beginnt mit dem Tage der Bekanntmachung der Löschungsankündigung in dem für die Bekanntmachung der Eintragungen in das Handelsregister bestimmten elektronischen Informations- und Kommunikationssystem nach § 10 des Handelsgesetzbuches. Fällt das Ende der Frist auf einen Sonntag, einen allgemeinen Feiertag oder Sonnabend, so endet die Frist mit Ablauf des nächsten Werktages.\nDer Widerspruch muss die Bezeichnung der angefochtenen Löschungsankündigung sowie die Erklärung enthalten, dass Widerspruch gegen diese Löschungsankündigung eingelegt wird. Er ist zu unterzeichnen und soll begründet werden."
    },
    {
      "date": "2025-01-27",
      "id": "99704",
      "original_text": "Sonstige Registerbekanntmachung\nNordrhein-Westfalen Amtsgericht Neuss HRB 23262\nvoestalpine HPM Deutschland Beteiligungs SE – Meerbusch",
      "type": "Sonstige Registerbekanntmachung",
      "state": "Nordrhein-Westfalen",
      "amtsgericht": "Amtsgericht Neuss",
      "registernummer": "HRB 23262",
      "registerart": "HRB",
      "company_name": "voestalpine HPM Deutschland Beteiligungs SE",
      "company_seat": "Meerbusch",
      "details": "27.01.2025 (Bekanntmachungsdatum)\n\nNordrhein-Westfalen Amtsgericht Neuss HRB 23262\nSonstige Registerbekanntmachung 27.01.2025 (Eintragungsdatum)\n\nvoestalpine HPM Deutschland Beteiligungs SE\nEuropäische Aktiengesellschaft (SE)\nMeerbusch\n\nDie Gesellschaft hat Gläubigern, deren Forderungen vor dieser Bekanntmachung begründet worden sind, Sicherheit zu leisten, soweit sie nicht Befriedigung verlangen können, wenn sie sich binnen sechs Monaten zu diesem Zweck melden."
    },
    {
      "date": "2025-01-27",
      "id": "99705",
      "original_text": "Löschungsankündigung\nNordrhein-Westfalen Amtsgericht Dortmund HRB 11644\nStahl & Brinkmann Marketing GmbH – Dortmund",
      "type": "Löschungsankündigung",
      "state": "Nordrhein-Westfalen",
      "amtsgericht": "Amtsgericht Dortmund",
      "registernummer": "HRB 11644",
      "registerart": "HRB",
      "company_name": "Stahl & Brinkmann Marketing GmbH",
      "company_seat": "Dortmund",
      "details": "27.01.2025 (Bekanntmachungsdatum)\n\nNordrhein-Westfalen Amtsgericht Dortmund HRB 11644\nLöschungsankündigung\n\nStahl & Brinkmann Marketing GmbH\nGesellschaft mit beschränkter Haftung\nDortmund\n\nDas Registergericht beabsichtigt die Gesellschaft von Amts wegen nach § 394 FamFG zu löschen. Die Frist zur Erhebung eines Widerspruchs ist auf zwei Monate festgesetzt."
    },
    {
      "date": "2025-01-27",
      "id": "99706",
      "original_text": "Löschungsankündigung\nRheinland-Pfalz Amtsgericht Ludwigshafen a.Rhein (Ludwigshafen) HRB 66957\nVision IT GmbH – Schifferstadt",
      "type": "Löschungsankündigung",
      "state": "Rheinland-Pfalz",
      "amtsgericht": "Amtsgericht Ludwigshafen a.Rhein (Ludwigshafen)",
      "registernummer": "HRB 66957",
      "registerart": "HRB",
      "company_name": "Vision IT GmbH",
      "company_seat": "Schifferstadt",
      "details": "27.01.2025 (Bekanntmachungsdatum)\n\nRheinland-Pfalz Amtsgericht Ludwigshafen a.Rhein (Ludwigshafen) HRB 66957\nLöschungsankündigung\n\nVision IT GmbH\nGesellschaft mit beschränkter Haftung\nSchifferstadt\n\nDas Registergericht beabsichtigt die Gesellschaft von Amts wegen nach § 394 FamFG zu löschen. Die Frist zur Erhebung eines Widerspruchs ist auf einen Monat festgesetzt."
    },
    {
      "date": "2025-01-27",
      "id": "99707",
      "original_text": "Sonstige Registerbekanntmachung\nNordrhein-Westfalen Amtsgericht Düsseldorf HRB 93774\nSG Spielstation 5 GmbH – Monheim am Rhein",
      "type": "Sonstige Registerbekanntmachung",
      "state": "Nordrhein-Westfalen",
      "amtsgericht": "Amtsgericht Düsseldorf",
      "registernummer": "HRB 93774",
      "registerart": "HRB",
      "company_name": "SG Spielstation 5 GmbH",
      "company_seat": "Monheim am Rhein",
      "details": "27.01.2025 (Bekanntmachungsdatum)\n\nNordrhein-Westfalen Amtsgericht Düsseldorf HRB 93774\nSonstige Registerbekanntmachung 27.01.2025 (Eintragungsdatum)\n\nSG Spielstation 5 GmbH\nGesellschaft mit beschränkter Haftung\nMonheim am Rhein\n\nAls nicht eingetragen wird veröffentlicht: Den Gläubigern der Gesellschaft, deren Forderungen begründet worden sind bevor die Eintragung der Beendigung des Gewinnabführungsvertrages  in das Handelsregister nach § 10 des Handelsgesetzbuches als bekanntgemacht gilt, hat der andere Vertragsteil Sicherheit zu leisten, wenn sie sich binnen sechs Monaten nach der Bekanntmachung der Eintragung zu diesem Zweck bei ihm melden."
    },
    {
      "date": "2025-01-27",
      "id": "99708",
      "original_text": "Löschungsankündigung\nNordrhein-Westfalen Amtsgericht Krefeld HRB 6673\nDAROWSKI Registrierkassen Verkaufs-Gesellschaft mit beschränkter Haftung – Krefeld",
      "type": "Löschungsankündigung",
      "state": "Nordrhein-Westfalen",
      "amtsgericht": "Amtsgericht Krefeld",
      "registernummer": "HRB 6673",
      "registerart": "HRB",
      "company_name": "DAROWSKI Registrierkassen Verkaufs-Gesellschaft mit beschränkter Haftung",
      "company_seat": "Krefeld",
      "details": "27.01.2025 (Bekanntmachungsdatum)\n\nNordrhein-Westfalen Amtsgericht Krefeld HRB 6673\nLöschungsankündigung\n\nDAROWSKI Registrierkassen Verkaufs-Gesellschaft mit beschränkter Haftung\nGesellschaft mit beschränkter Haftung\nKrefeld\n\nDas Registergericht beabsichtigt die Gesellschaft von Amts wegen nach § 394 FamFG zu löschen. Die Frist zur Erhebung eines Widerspruchs ist auf einen Monat festgesetzt."
    },
    {
      "date": "2025-01-27",
      "id": "99709",
      "original_text": "Einreichung neuer Dokumente\nNordrhein-Westfalen Amtsgericht Hamm HRB 3475\nWirtschaftsbetriebe der Stadt Unna GmbH – Unna",
      "type": "Einreichung neuer Dokumente",
      "state": "Nordrhein-Westfalen",
      "amtsgericht": "Amtsgericht Hamm",
      "registernummer": "HRB 3475",
      "registerart": "HRB",
      "company_name": "Wirtschaftsbetriebe der Stadt Unna GmbH",
      "company_seat": "Unna",
      "details": "27.01.2025 (Bekanntmachungsdatum)\n\nNordrhein-Westfalen Amtsgericht Hamm HRB 3475\nEinreichung neuer Dokumente 27.01.2025 (Eintragungsdatum)\n\nWirtschaftsbetriebe der Stadt Unna GmbH\nGesellschaft mit beschränkter Haftung\nUnna\n\nDem Registergericht ist eine neue Liste der Mitglieder des Aufsichtsrates eingereicht worden."
    },
    {
      "date": "2025-01-27",
      "id": "99710",
      "original_text": "Löschungsankündigung\nNordrhein-Westfalen Amtsgericht Düsseldorf HRA 13740\n\"KOKON\" e.K. MARKET SERVICE – Düsseldorf",
      "type": "Löschungsankündigung",
      "state": "Nordrhein-Westfalen",
      "amtsgericht": "Amtsgericht Düsseldorf",
      "registernummer": "HRA 13740",
      "registerart": "HRA",
      "company_name": "\"KOKON\" e.K. MARKET SERVICE",
      "company_seat": "Düsseldorf",
      "details": "27.01.2025 (Bekanntmachungsdatum)\n\nNordrhein-Westfalen Amtsgericht Düsseldorf HRA 13740\nLöschungsankündigung\n\n\"KOKON\" e.K. MARKET SERVICE\nEinzelkaufmann / Einzelkauffrau\nDüsseldorf\n\nDas Registergericht beabsichtigt die Firma von Amts wegen nach § 31 Abs. 2 HGB zu löschen. Die Frist zur Erhebung eines Widerspruchs ist auf 3 Monate festgesetzt.\n\nRechtsbehelfsbelehrung:\nDas Widerspruchsrecht steht jedem zu, der an der Unterlassung der Löschung ein berechtigtes Interesse hat. Der Widerspruch ist bei dem Amtsgericht Düsseldorf -Registergericht-, Werdener Straße 1, 40227 Düsseldorf schriftlich in deutscher Sprache oder zur Niederschrift der Geschäftsstelle einzulegen. Der Widerspruch kann auch zur Niederschrift der Geschäftsstelle eines jeden Amtsgerichtes abgegeben werden. Die Einlegung ist auch durch Übertragung eines elektronischen Dokuments an die elektronische Poststelle des Gerichts möglich. Das elektronische Dokument muss für die Bearbeitung durch das Gericht geeignet und mit einer qualifizierten elektronischen Signatur der verantwortenden Person versehen sein oder von der verantwortenden Person signiert und auf einem sicheren Übermittlungsweg gemäß § 130a ZPO nach näherer Maßgabe der Verordnung über die technischen Rahmenbedingungen des elektronischen Rechtsverkehrs und über das besondere elektronische Behördenpostfach (BGBl. I, S.3803) eingereicht werden. Weitere Informationen erhalten Sie auf der Internetseite www.justiz.de.\nDer Widerspruch muss spätestens innerhalb der gesetzten Frist nach dem Datum der Bekanntmachung der Löschungsankündigung bei dem Amtsgericht - Registergericht - Düsseldorf eingegangen sein.  Dies gilt auch dann, wenn der Widerspruch zur Niederschrift der Geschäftsstelle eines anderen Amtsgerichtes abgegeben wurde. Die Frist beginnt mit dem Tage der Bekanntmachung der Löschungsankündigung in dem für die Bekanntmachung der Eintragungen in das Handelsregister bestimmten elektronischen Informations- und Kommunikationssystem nach § 10 des Handelsgesetzbuches. Fällt das Ende der Frist auf einen Sonntag, einen allgemeinen Feiertag oder Sonnabend, so endet die Frist mit Ablauf des nächsten Werktages.\nDer Widerspruch muss die Bezeichnung der angefochtenen Löschungsankündigung sowie die Erklärung enthalten, dass Widerspruch gegen diese Löschungsankündigung eingelegt wird. Er ist zu unterzeichnen und soll begründet werden."
    },
    {
      "date": "2025-01-27",
      "id": "99711",
      "original_text": "Löschungsankündigung\nNordrhein-Westfalen Amtsgericht Düsseldorf HRB 80686\nEDONE GmbH – Düsseldorf",
      "type": "Löschungsankündigung",
      "state": "Nordrhein-Westfalen",
      "amtsgericht": "Amtsgericht Düsseldorf",
      "registernummer": "HRB 80686",
      "registerart": "HRB",
      "company_name": "EDONE GmbH",
      "company_seat": "Düsseldorf",
      "details": "27.01.2025 (Bekanntmachungsdatum)\n\nNordrhein-Westfalen Amtsgericht Düsseldorf HRB 80686\nLöschungsankündigung\n\nEDONE GmbH\nGesellschaft mit beschränkter Haftung\nDüsseldorf\n\nDas Registergericht beabsichtigt die Gesellschaft von Amts wegen nach § 394 Abs. 1 FamFG zu löschen. Die Frist zur Erhebung eines Widerspruchs ist auf 3 Wochen festgesetzt.\n\nRechtsbehelfsbelehrung:\nDas Widerspruchsrecht steht jedem zu, der an der Unterlassung der Löschung ein berechtigtes Interesse hat. Der Widerspruch ist bei dem Amtsgericht Düsseldorf -Registergericht-, Werdener Straße 1, 40227 Düsseldorf schriftlich in deutscher Sprache oder zur Niederschrift der Geschäftsstelle einzulegen. Der Widerspruch kann auch zur Niederschrift der Geschäftsstelle eines jeden Amtsgerichtes abgegeben werden. Die Einlegung ist auch durch Übertragung eines elektronischen Dokuments an die elektronische Poststelle des Gerichts möglich. Das elektronische Dokument muss für die Bearbeitung durch das Gericht geeignet und mit einer qualifizierten elektronischen Signatur der verantwortenden Person versehen sein oder von der verantwortenden Person signiert und auf einem sicheren Übermittlungsweg gemäß § 130a ZPO nach näherer Maßgabe der Verordnung über die technischen Rahmenbedingungen des elektronischen Rechtsverkehrs und über das besondere elektronische Behördenpostfach (BGBl. I, S.3803) eingereicht werden. Weitere Informationen erhalten Sie auf der Internetseite www.justiz.de.\nDer Widerspruch muss spätestens innerhalb der gesetzten Frist nach dem Datum der Bekanntmachung der Löschungsankündigung bei dem Amtsgericht - Registergericht - Düsseldorf eingegangen sein.  Dies gilt auch dann, wenn der Widerspruch zur Niederschrift der Geschäftsstelle eines anderen Amtsgerichtes abgegeben wurde. Die Frist beginnt mit dem Tage der Bekanntmachung der Löschungsankündigung in dem für die Bekanntmachung der Eintragungen in das Handelsregister bestimmten elektronischen Informations- und Kommunikationssystem nach § 10 des Handelsgesetzbuches. Fällt das Ende der Frist auf einen Sonntag, einen allgemeinen Feiertag oder Sonnabend, so endet die Frist mit Ablauf des nächsten Werktages.\nDer Widerspruch muss die Bezeichnung der angefochtenen Löschungsankündigung sowie die Erklärung enthalten, dass Widerspruch gegen diese Löschungsankündigung eingelegt wird. Er ist zu unterzeichnen und soll begründet werden."
    },
    {
      "date": "2025-01-27",
      "id": "99712",
      "original_text": "Löschungsankündigung\nNordrhein-Westfalen Amtsgericht Düren HRA 3787\nKölsche Eck GmbH & Co. KG – Düren",
      "type": "Löschungsankündigung",
      "state": "Nordrhein-Westfalen",
      "amtsgericht": "Amtsgericht Düren",
      "registernummer": "HRA 3787",
      "registerart": "HRA",
      "company_name": "Kölsche Eck GmbH & Co. KG",
      "company_seat": "Düren",
      "details": "27.01.2025 (Bekanntmachungsdatum)\n\nNordrhein-Westfalen Amtsgericht Düren HRA 3787\nLöschungsankündigung 27.01.2025 (Eintragungsdatum)\n\nKölsche Eck GmbH & Co. KG\nKommanditgesellschaft\nDüren\n\nDas Registergericht beabsichtigt die Firma von Amts wegen nach § 394 FamFG zu löschen. Die Frist zur Erhebung eines Widerspruchs ist auf einen Monat festgesetzt."
    },
    {
      "date": "2025-01-27",
      "id": "99713",
      "original_text": "Löschungsankündigung\nNordrhein-Westfalen Amtsgericht Aachen HRB 14235\nNihat Arslan Heizung- und Sanitär GmbH – Aachen",
      "type": "Löschungsankündigung",
      "state": "Nordrhein-Westfalen",
      "amtsgericht": "Amtsgericht Aachen",
      "registernummer": "HRB 14235",
      "registerart": "HRB",
      "company_name": "Nihat Arslan Heizung- und Sanitär GmbH",
      "company_seat": "Aachen",
      "details": "27.01.2025 (Bekanntmachungsdatum)\n\nNordrhein-Westfalen Amtsgericht Aachen HRB 14235\nLöschungsankündigung\n\nNihat Arslan Heizung- und Sanitär GmbH\nGesellschaft mit beschränkter Haftung\nAachen\n\nDas Registergericht beabsichtigt, von Amts wegen die Gesellschaft wegen Vermögenslosigkeit nach § 394 FamFG zu löschen, weil das Insolvenzverfahren Amtsgericht Aachen (Az.: 93 IN 14/23)  beendet und Vermögen der Gesellschaft nach dem Tod des Geschäftsführers inzwischen nicht mehr vorhanden.\n\nZur Geltendmachung des Widerspruchs gegen die beabsichtigte Löschung wird hiermit eine Frist von einem Monat ab Veröffentlichung dieser Ankündigung bestimmt.\n\nRechtsbehelfsbelehrung:\n\nGegen diese Verfügung kann Widerspruch eingelegt werden. Zum Widerspruch ist jeder berechtigt, der an der Unterlassung der Löschung ein berechtigtes Interesse hat.\n\nDer Widerspruch ist bei dem Amtsgericht Aachen, Adalbertsteinweg 92, 52070 Aachen schriftlich in deutscher Sprache oder zur Niederschrift der Geschäftsstelle einzulegen. Der Widerspruch kann auch zur Niederschrift der Geschäftsstelle eines jeden Amtsgerichtes abgegeben werden.\n\nDer Widerspruch muss spätestens innerhalb der gesetzten Frist nach der Bekanntgabe der Verfügung bei dem Amtsgericht Aachen eingegangen sein. Dies gilt auch dann, wenn der Widerspruch zur Niederschrift der Geschäftsstelle eines anderen Amtsgerichtes abgegeben wurde. Die Frist beginnt mit der Bekanntgabe der Verfügung durch Veröffentlichung. Fällt das Ende der Frist auf einen Sonntag, einen allgemeinen Feiertag oder Sonnabend, so endet die Frist mit Ablauf des nächsten Werktages.\n\nDer Widerspruch muss die Bezeichnung der angefochtenen Verfügung sowie die Erklärung enthalten, dass Widerspruch gegen diese Verfügung eingelegt wird. Er ist zu unterzeichnen und soll begründet werden.\n\nDie Einlegung ist auch durch Übertragung eines elektronischen Dokuments an die elektronische Poststelle des Gerichts möglich. Das elektronische Dokument muss für die Bearbeitung durch das Gericht geeignet und mit einer qualifizierten elektronischen Signatur der verantwortenden Person versehen sein oder von der verantwortenden Person signiert und auf einem sicheren Übermittlungsweg gemäß § 130 a ZPO nach näherer Maßgabe der Verordnung über die technischen Rahmenbedingungen des elektronischen Rechtsverkehrs und über das besondere elektronische Behördenpostfach (BGBl. I, S. 3803) eingereicht werden. Weitere Informationen erhalten Sie auf der Internetseite www.justiz.de."
    },
    {
      "date": "2025-01-27",
      "id": "99714",
      "original_text": "Registerbekanntmachung nach dem Umwandlungsgesetz\nNordrhein-Westfalen Amtsgericht Düsseldorf HRB 107771\nMELT Cookies GmbH – Düsseldorf",
      "type": "Registerbekanntmachung nach dem Umwandlungsgesetz",
      "state": "Nordrhein-Westfalen",
      "amtsgericht": "Amtsgericht Düsseldorf",
      "registernummer": "HRB 107771",
      "registerart": "HRB",
      "company_name": "MELT Cookies GmbH",
      "company_seat": "Düsseldorf",
      "details": "27.01.2025 (Bekanntmachungsdatum)\n\nNordrhein-Westfalen Amtsgericht Düsseldorf HRB 107771\nRegisterbekanntmachung nach dem Umwandlungsgesetz 27.01.2025 (Eintragungsdatum)\n\nMELT Cookies GmbH\nGesellschaft mit beschränkter Haftung\nDüsseldorf\n\nDen Gläubigern der an der formwechselnden Umwandlung beteiligten Rechtsträger ist, wenn sie binnen sechs Monaten nach dem Tag, an dem die Eintragung der formwechselnden Umwandlung in das Register des Sitzes desjenigen Rechtsträgers, dessen Gläubiger sie sind, nach § 19 Absatz 3 UmwG als bekanntgemacht gilt, ihren Anspruch nach Grund und Höhe schriftlich anmelden, Sicherheit zu leisten, soweit sie nicht Befriedigung verlangen können. Dieses Recht steht den Gläubigern jedoch nur zu, wenn sie glaubhaft machen, dass durch die formwechselnden Umwandlung die Erfüllung ihrer Forderung gefährdet wird."
    },
    {
      "date": "2025-01-27",
      "id": "99715",
      "original_text": "Löschungsankündigung\nNordrhein-Westfalen Amtsgericht Wuppertal HRB 31754\nLeanStreamer GmbH – Solingen",
      "type": "Löschungsankündigung",
      "state": "Nordrhein-Westfalen",
      "amtsgericht": "Amtsgericht Wuppertal",
      "registernummer": "HRB 31754",
      "registerart": "HRB",
      "company_name": "LeanStreamer GmbH",
      "company_seat": "Solingen",
      "details": "27.01.2025 (Bekanntmachungsdatum)\n\nNordrhein-Westfalen Amtsgericht Wuppertal HRB 31754\nLöschungsankündigung 24.01.2025 (Eintragungsdatum)\n\nLeanStreamer GmbH\nGesellschaft mit beschränkter Haftung\nSolingen\n\nDas Registergericht beabsichtigt die Gesellschaft von Amts wegen nach § 394 FamFG zu löschen. Die Frist zur Erhebung eines Widerspruchs ist auf einen Monat festgesetzt."
    },
    {
      "date": "2025-01-27",
      "id": "99716",
      "original_text": "Einreichung neuer Dokumente\nNordrhein-Westfalen Amtsgericht Gütersloh HRB 12929\nNagel-Group Invest SE – Versmold",
      "type": "Einreichung neuer Dokumente",
      "state": "Nordrhein-Westfalen",
      "amtsgericht": "Amtsgericht Gütersloh",
      "registernummer": "HRB 12929",
      "registerart": "HRB",
      "company_name": "Nagel-Group Invest SE",
      "company_seat": "Versmold",
      "details": "27.01.2025 (Bekanntmachungsdatum)\n\nNordrhein-Westfalen Amtsgericht Gütersloh HRB 12929\nEinreichung neuer Dokumente 24.01.2025 (Eintragungsdatum)\n\nNagel-Group Invest SE\nEuropäische Aktiengesellschaft (SE)\nVersmold\n\nDem Registergericht ist eine neue Liste der Mitglieder des Verwaltungsrates eingereicht worden."
    },
    {
      "date": "2025-01-27",
      "id": "99717",
      "original_text": "Registerbekanntmachung nach dem Umwandlungsgesetz\nNordrhein-Westfalen Amtsgericht Aachen HRA 9640\ntobspr IT Solutions UG (haftungsbeschränkt) & Co. KG – Aachen",
      "type": "Registerbekanntmachung nach dem Umwandlungsgesetz",
      "state": "Nordrhein-Westfalen",
      "amtsgericht": "Amtsgericht Aachen",
      "registernummer": "HRA 9640",
      "registerart": "HRA",
      "company_name": "tobspr IT Solutions UG (haftungsbeschränkt) & Co. KG",
      "company_seat": "Aachen",
      "details": "27.01.2025 (Bekanntmachungsdatum)\n\nNordrhein-Westfalen Amtsgericht Aachen HRA 9640\nRegisterbekanntmachung nach dem Umwandlungsgesetz 27.01.2025 (Eintragungsdatum)\n\ntobspr IT Solutions UG (haftungsbeschränkt) & Co. KG\nKommanditgesellschaft\nAachen\n\nDen Gläubigern der an der formwechselnden Umwandlung beteiligten Rechtsträger ist, wenn sie binnen sechs Monaten nach dem Tag, an dem die Eintragung der formwechselnden Umwandlung in das Register des Sitzes desjenigen Rechtsträgers, dessen Gläubiger sie sind, nach § 19 Absatz 3 UmwG als bekanntgemacht gilt, ihren Anspruch nach Grund und Höhe schriftlich anmelden, Sicherheit zu leisten, soweit sie nicht Befriedigung verlangen können. Dieses Recht steht den Gläubigern jedoch nur zu, wenn sie glaubhaft machen, dass durch die formwechselnden Umwandlung die Erfüllung ihrer Forderung gefährdet wird."
    },
    {
      "date": "2025-01-27",
      "id": "99718",
      "original_text": "Löschungsankündigung\nNordrhein-Westfalen Amtsgericht Düsseldorf HRB 92045\nAtlant Service GmbH – Düsseldorf",
      "type": "Löschungsankündigung",
      "state": "Nordrhein-Westfalen",
      "amtsgericht": "Amtsgericht Düsseldorf",
      "registernummer": "HRB 92045",
      "registerart": "HRB",
      "company_name": "Atlant Service GmbH",
      "company_seat": "Düsseldorf",
      "details": "27.01.2025 (Bekanntmachungsdatum)\n\nNordrhein-Westfalen Amtsgericht Düsseldorf HRB 92045\nLöschungsankündigung\n\nAtlant Service GmbH\nGesellschaft mit beschränkter Haftung\nDüsseldorf\n\nBetr.: Atlant Service GmbH, Münsterstr. 497, 40472 Düsseldorf\n\nDas Registergericht beabsichtigt die Gesellschaft von Amts wegen nach § 394 FamFG zu löschen. Die Frist zur Erhebung eines Widerspruchs ist auf 3 Wochen festgesetzt.\n\nRechtsbehelfsbelehrung:\n\nDas Widerspruchsrecht steht jedem zu, der an der Unterlassung der Löschung ein berechtigtes Interesse hat. Der Widerspruch ist bei dem Amtsgericht Düsseldorf -Registergericht-, Werdener Straße 1, 40227 Düsseldorf schriftlich in deutscher Sprache oder zur Niederschrift der Geschäftsstelle einzulegen. Der Widerspruch kann auch zur Niederschrift der Geschäftsstelle eines jeden Amtsgerichtes abgegeben werden. Die Einlegung ist auch durch Übertragung eines elektronischen Dokuments an die elektronische Poststelle des Gerichts möglich. Das elektronische Dokument muss für die Bearbeitung durch das Gericht geeignet und mit einer qualifizierten elektronischen Signatur der verantwortenden Person versehen sein oder von der verantwortenden Person signiert und auf einem sicheren Übermittlungsweg gemäß § 130a ZPO nach näherer Maßgabe der Verordnung über die technischen Rahmenbedingungen des elektronischen Rechtsverkehrs und über das besondere elektronische Behördenpostfach (BGBl. I, S.3803) eingereicht werden. Weitere Informationen erhalten Sie auf der Internetseite www.justiz.de.\nDer Widerspruch muss spätestens innerhalb der gesetzten Frist nach dem Datum der Bekanntmachung der Löschungsankündigung bei dem Amtsgericht - Registergericht - Düsseldorf eingegangen sein.  Dies gilt auch dann, wenn der Widerspruch zur Niederschrift der Geschäftsstelle eines anderen Amtsgerichtes abgegeben wurde. Die Frist beginnt mit dem Tage der Bekanntmachung der Löschungsankündigung in dem für die Bekanntmachung der Eintragungen in das Handelsregister bestimmten elektronischen Informations- und Kommunikationssystem nach § 10 des Handelsgesetzbuches. Fällt das Ende der Frist auf einen Sonntag, einen allgemeinen Feiertag oder Sonnabend, so endet die Frist mit Ablauf des nächsten Werktages.\nDer Widerspruch muss die Bezeichnung der angefochtenen Löschungsankündigung sowie die Erklärung enthalten, dass Widerspruch gegen diese Löschungsankündigung eingelegt wird. Er ist zu unterzeichnen und soll begründet werden."
    },
    {
      "date": "2025-01-27",
      "id": "99719",
      "original_text": "Löschungsankündigung\nNordrhein-Westfalen Amtsgericht Dortmund HRB 34644\nGeBau Industrieservice GmbH – Lünen",
      "type": "Löschungsankündigung",
      "state": "Nordrhein-Westfalen",
      "amtsgericht": "Amtsgericht Dortmund",
      "registernummer": "HRB 34644",
      "registerart": "HRB",
      "company_name": "GeBau Industrieservice GmbH",
      "company_seat": "Lünen",
      "details": "27.01.2025 (Bekanntmachungsdatum)\n\nNordrhein-Westfalen Amtsgericht Dortmund HRB 34644\nLöschungsankündigung\n\nGeBau Industrieservice GmbH\nGesellschaft mit beschränkter Haftung\nLünen\n\nDas Registergericht beabsichtigt die Gesellschaft von Amts wegen nach § 394 FamFG zu löschen. Die Frist zur Erhebung eines Widerspruchs ist auf #DV.Fr(Text=\"Bitte wählen Sie die Widerspruchsfrist aus!\",Eingabe=\"einen Monat\",\"zwei Monate\",\"drei Monate\",\"#insert(Text=\"Freitext\")\"|\"freier Text\") festgesetzt."
    },
    {
      "date": "2025-01-27",
      "id": "99720",
      "original_text": "Einreichung neuer Dokumente\nThüringen Amtsgericht Jena HRB 102507\nOhra Energie GmbH – Hörsel",
      "type": "Einreichung neuer Dokumente",
      "state": "Thüringen",
      "amtsgericht": "Amtsgericht Jena",
      "registernummer": "HRB 102507",
      "registerart": "HRB",
      "company_name": "Ohra Energie GmbH",
      "company_seat": "Hörsel",
      "details": "27.01.2025 (Bekanntmachungsdatum)\n\nThüringen Amtsgericht Jena HRB 102507\nEinreichung neuer Dokumente\n\nOhra Energie GmbH\nGesellschaft mit beschränkter Haftung\nHörsel\n\nBekanntmachung gem. § 52 Abs. 3 Satz 2 GmbHG: Aufgrund einer Veränderung in den Personen der Aufsichtsratsmitglieder ist durch die Geschäftsführer eine neue Liste zum Handelsregister eingereicht worden."
    },
    {
      "date": "2025-01-27",
      "id": "99721",
      "original_text": "Löschungsankündigung\nHessen Amtsgericht Wiesbaden HRB 32211\nSisters Fashion GmbH – Wiesbaden",
      "type": "Löschungsankündigung",
      "state": "Hessen",
      "amtsgericht": "Amtsgericht Wiesbaden",
      "registernummer": "HRB 32211",
      "registerart": "HRB",
      "company_name": "Sisters Fashion GmbH",
      "company_seat": "Wiesbaden",
      "details": "27.01.2025 (Bekanntmachungsdatum)\n\nHessen Amtsgericht Wiesbaden HRB 32211\nLöschungsankündigung\n\nSisters Fashion GmbH\nGesellschaft mit beschränkter Haftung\nWiesbaden\n\nDas Registergericht beabsichtigt die im Handelsregister eingetragene Gesellschaft von Amts wegen nach § 394 FamFG zu löschen. Die Frist zur Erhebung eines Widerspruchs gegen die beabsichtigte Löschung wird auf 3 Monate festgesetzt."
    },
    {
      "date": "2025-01-27",
      "id": "99722",
      "original_text": "Löschungsankündigung\nHessen Amtsgericht Darmstadt HRB 103380\nKhokhar Handel & Vermittlung GmbH – Groß-Gerau",
      "type": "Löschungsankündigung",
      "state": "Hessen",
      "amtsgericht": "Amtsgericht Darmstadt",
      "registernummer": "HRB 103380",
      "registerart": "HRB",
      "company_name": "Khokhar Handel & Vermittlung GmbH",
      "company_seat": "Groß-Gerau",
      "details": "27.01.2025 (Bekanntmachungsdatum)\n\nHessen Amtsgericht Darmstadt HRB 103380\nLöschungsankündigung\n\nKhokhar Handel & Vermittlung GmbH\nGesellschaft mit beschränkter Haftung\nGroß-Gerau\n\nDas Registergericht beabsichtigt die im Handelsregister eingetragene Gesellschaft von Amts wegen nach § 394 FamFG zu löschen. Die Frist zur Erhebung eines Widerspruchs gegen die beabsichtigte Löschung wird auf 3 Monate festgesetzt."
    },
    {
      "date": "2025-01-27",
      "id": "99723",
      "original_text": "Löschungsankündigung\nHessen Amtsgericht Frankfurt am Main HRB 85792\nLubron GmbH – Bad Vilbel",
      "type": "Löschungsankündigung",
      "state": "Hessen",
      "amtsgericht": "Amtsgericht Frankfurt am Main",
      "registernummer": "HRB 85792",
      "registerart": "HRB",
      "company_name": "Lubron GmbH",
      "company_seat": "Bad Vilbel",
      "details": "27.01.2025 (Bekanntmachungsdatum)\n\nHessen Amtsgericht Frankfurt am Main HRB 85792\nLöschungsankündigung\n\nLubron GmbH\nGesellschaft mit beschränkter Haftung\nBad Vilbel\n\nDas Registergericht beabsichtigt die im Handelsregister eingetragene Gesellschaft von Amts wegen nach § 394 FamFG zu löschen. Die Frist zur Erhebung eines Widerspruchs gegen die beabsichtigte Löschung wird auf 1 Monate festgesetzt."
    },
    {
      "date": "2025-01-27",
      "id": "99724",
      "original_text": "Löschungsankündigung\nHessen Amtsgericht Darmstadt HRB 5377\nAutohaus Akbaba GmbH, Kfz-Service – Ober-Ramstadt",
      "type": "Löschungsankündigung",
      "state": "Hessen",
      "amtsgericht": "Amtsgericht Darmstadt",
      "registernummer": "HRB 5377",
      "registerart": "HRB",
      "company_name": "Autohaus Akbaba GmbH, Kfz-Service",
      "company_seat": "Ober-Ramstadt",
      "details": "27.01.2025 (Bekanntmachungsdatum)\n\nHessen Amtsgericht Darmstadt HRB 5377\nLöschungsankündigung\n\nAutohaus Akbaba GmbH, Kfz-Service\nGesellschaft mit beschränkter Haftung\nOber-Ramstadt\n\nDas Registergericht beabsichtigt die im Handelsregister eingetragene Gesellschaft von Amts wegen nach § 394 FamFG zu löschen. Die Frist zur Erhebung eines Widerspruchs gegen die beabsichtigte Löschung wird auf 3 Monate festgesetzt."
    },
    {
      "date": "2025-01-27",
      "id": "99725",
      "original_text": "Sonstige Registerbekanntmachung\nHessen Amtsgericht Kassel VR 4775\nBruder-Arkadius-Verein zur Förderung der Kinder-, Jugend- und Sozialarbeit auf dem Rothenberg e.V. – Kassel",
      "type": "Sonstige Registerbekanntmachung",
      "state": "Hessen",
      "amtsgericht": "Amtsgericht Kassel",
      "registernummer": "VR 4775",
      "registerart": "VR",
      "company_name": "Bruder-Arkadius-Verein zur Förderung der Kinder-, Jugend- und Sozialarbeit auf dem Rothenberg e.V.",
      "company_seat": "Kassel",
      "details": "27.01.2025 (Bekanntmachungsdatum)\n\nHessen Amtsgericht Kassel VR 4775\nSonstige Registerbekanntmachung 27.01.2025 (Eintragungsdatum)\n\nBruder-Arkadius-Verein zur Förderung der Kinder-, Jugend- und Sozialarbeit auf dem Rothenberg e.V.\neingetragener Verein\nKassel\n\nDer Verein ist aufgelöst."
    },
    {
      "date": "2025-01-27",
      "id": "99726",
      "original_text": "Sonstige Registerbekanntmachung\nHessen Amtsgericht Darmstadt HRB 70529\nB B K Etikettier- und Sondermaschinenbau Gesellschaft mit beschränkter Haftung – Beerfelden",
      "type": "Sonstige Registerbekanntmachung",
      "state": "Hessen",
      "amtsgericht": "Amtsgericht Darmstadt",
      "registernummer": "HRB 70529",
      "registerart": "HRB",
      "company_name": "B B K Etikettier- und Sondermaschinenbau Gesellschaft mit beschränkter Haftung",
      "company_seat": "Beerfelden",
      "details": "27.01.2025 (Bekanntmachungsdatum)\n\nHessen Amtsgericht Darmstadt HRB 70529\nSonstige Registerbekanntmachung 27.01.2025 (Eintragungsdatum)\n\nB B K   Etikettier- und Sondermaschinenbau Gesellschaft mit beschränkter Haftung\nGesellschaft mit beschränkter Haftung\nBeerfelden\n\nDen Gläubigern der Gesellschaft, deren Forderungen begründet worden sind, bevor die Eintragung der Beendigung des Vertrags in das Handelsregister nach § 10 HGB bekannt gemacht worden ist, ist vom anderen Vertragsteil Sicherheit zu leisten, wenn sie sich binnen sechs Monaten nach dieser Bekanntmachung zu diesem Zweck bei ihm melden."
    },
    {
      "date": "2025-01-27",
      "id": "99727",
      "original_text": "Registerbekanntmachung nach dem Umwandlungsgesetz\nHessen Amtsgericht Bad Homburg v.d.H. HRB 16915\nPhiWo MB GmbH – Friedrichsdorf",
      "type": "Registerbekanntmachung nach dem Umwandlungsgesetz",
      "state": "Hessen",
      "amtsgericht": "Amtsgericht Bad Homburg v.d.H.",
      "registernummer": "HRB 16915",
      "registerart": "HRB",
      "company_name": "PhiWo MB GmbH",
      "company_seat": "Friedrichsdorf",
      "details": "27.01.2025 (Bekanntmachungsdatum)\n\nHessen Amtsgericht Bad Homburg v.d.H. HRB 16915\nRegisterbekanntmachung nach dem Umwandlungsgesetz 27.01.2025 (Eintragungsdatum)\n\nPhiWo MB GmbH\nGesellschaft mit beschränkter Haftung\nFriedrichsdorf\n\nDen Gläubigern der an der formwechselnden Umwandlung beteiligten Rechtsträger ist, wenn sie binnen sechs Monaten nach dem Tag, an dem die Eintragung der formwechselnden Umwandlung in das Register des Sitzes desjenigen Rechtsträgers, dessen Gläubiger sie sind, nach § 201 UmwG bekannt gemacht worden ist, ihren Anspruch nach Grund und Höhe schriftlich anmelden, Sicherheit zu leisten, soweit sie nicht Befriedigung verlangen können. Dieses Recht steht den Gläubigern jedoch nur zu, wenn sie glaubhaft machen, dass durch die formwechselnden Umwandlung die Erfüllung ihrer Forderung gefährdet wird."
    },
    {
      "date": "2025-01-27",
      "id": "99728",
      "original_text": "Registerbekanntmachung nach dem Umwandlungsgesetz\nHessen Amtsgericht Darmstadt HRA 87610\nBernd Kramer e.K. – Riedstadt",
      "type": "Registerbekanntmachung nach dem Umwandlungsgesetz",
      "state": "Hessen",
      "amtsgericht": "Amtsgericht Darmstadt",
      "registernummer": "HRA 87610",
      "registerart": "HRA",
      "company_name": "Bernd Kramer e.K.",
      "company_seat": "Riedstadt",
      "details": "27.01.2025 (Bekanntmachungsdatum)\n\nHessen Amtsgericht Darmstadt HRA 87610\nRegisterbekanntmachung nach dem Umwandlungsgesetz 27.01.2025 (Eintragungsdatum)\n\nBernd Kramer e.K.\nEinzelkaufmann / Einzelkauffrau\nRiedstadt\n\nDen Gläubigern der an der Ausgliederung beteiligten Rechtsträger ist, wenn sie binnen sechs Monaten nach dem Tag, an dem die Eintragung der Ausgliederung in das Register des Sitzes derjenigen Rechtsträger deren Gläubiger sie sind, nach §§ 125, 19 Absatz 3 UmwG bekannt gemacht worden ist, ihren Anspruch nach Grund und Höhe schriftlich anmelden, Sicherheit zu leisten, soweit sie nicht Befriedigung verlangen können. Dieses Recht steht den Gläubigern jedoch nur zu, wenn sie glaubhaft machen, dass durch die Ausgliederung die Erfüllung ihrer Forderung gefährdet wird."
    },
    {
      "date": "2025-01-27",
      "id": "99729",
      "original_text": "Löschungsankündigung\nHessen Amtsgericht Frankfurt am Main HRB 107747\nBuzar GmbH – Bad Vilbel",
      "type": "Löschungsankündigung",
      "state": "Hessen",
      "amtsgericht": "Amtsgericht Frankfurt am Main",
      "registernummer": "HRB 107747",
      "registerart": "HRB",
      "company_name": "Buzar GmbH",
      "company_seat": "Bad Vilbel",
      "details": "27.01.2025 (Bekanntmachungsdatum)\n\nHessen Amtsgericht Frankfurt am Main HRB 107747\nLöschungsankündigung\n\nBuzar GmbH\nGesellschaft mit beschränkter Haftung\nBad Vilbel\n\nDas Registergericht beabsichtigt die im Handelsregister eingetragene Gesellschaft von Amts wegen nach § 394 FamFG zu löschen. Die Frist zur Erhebung eines Widerspruchs gegen die beabsichtigte Löschung wird auf 1 Monat festgesetzt."
    },
    {
      "date": "2025-01-27",
      "id": "99730",
      "original_text": "Sonstige Registerbekanntmachung\nHessen Amtsgericht Frankfurt am Main HRB 9937\nUniversal-Investment-Gesellschaft mit beschränkter Haftung – Frankfurt am Main",
      "type": "Sonstige Registerbekanntmachung",
      "state": "Hessen",
      "amtsgericht": "Amtsgericht Frankfurt am Main",
      "registernummer": "HRB 9937",
      "registerart": "HRB",
      "company_name": "Universal-Investment-Gesellschaft mit beschränkter Haftung",
      "company_seat": "Frankfurt am Main",
      "details": "27.01.2025 (Bekanntmachungsdatum)\n\nHessen Amtsgericht Frankfurt am Main HRB 9937\nSonstige Registerbekanntmachung\n\nUniversal-Investment-Gesellschaft mit beschränkter Haftung\nGesellschaft mit beschränkter Haftung\nFrankfurt am Main\n\nDurch eine Änderung in den Personen der Aufsichtsratsmitglieder ist eine Liste der Mitglieder des Aufsichtsrates zum Handelsregister eingereicht worden."
    },
    {
      "date": "2025-01-27",
      "id": "99731",
      "original_text": "Löschungsankündigung\nHessen Amtsgericht Darmstadt HRA 86722\nCrystal Palace GmbH & Co. KG – Groß-Gerau",
      "type": "Löschungsankündigung",
      "state": "Hessen",
      "amtsgericht": "Amtsgericht Darmstadt",
      "registernummer": "HRA 86722",
      "registerart": "HRA",
      "company_name": "Crystal Palace GmbH & Co. KG",
      "company_seat": "Groß-Gerau",
      "details": "27.01.2025 (Bekanntmachungsdatum)\n\nHessen Amtsgericht Darmstadt HRA 86722\nLöschungsankündigung 27.01.2025 (Eintragungsdatum)\n\nCrystal Palace GmbH & Co. KG\nKommanditgesellschaft\nGroß-Gerau\n\nDas Registergericht beabsichtigt die im Handelsregister eingetragene Firma von Amts wegen nach § 394 FamFG zu löschen. Die Frist zur Erhebung eines Widerspruchs gegen die beabsichtigte Löschung wird auf 3 Monate festgesetzt."
    },
    {
      "date": "2025-01-27",
      "id": "99732",
      "original_text": "Registerbekanntmachung nach dem Umwandlungsgesetz\nHessen Amtsgericht Königstein HRB 5161\nEppstein Technologies GmbH – Eppstein",
      "type": "Registerbekanntmachung nach dem Umwandlungsgesetz",
      "state": "Hessen",
      "amtsgericht": "Amtsgericht Königstein",
      "registernummer": "HRB 5161",
      "registerart": "HRB",
      "company_name": "Eppstein Technologies GmbH",
      "company_seat": "Eppstein",
      "details": "27.01.2025 (Bekanntmachungsdatum)\n\nHessen Amtsgericht Königstein HRB 5161\nRegisterbekanntmachung nach dem Umwandlungsgesetz 27.01.2025 (Eintragungsdatum)\n\nEppstein Technologies GmbH\nGesellschaft mit beschränkter Haftung\nEppstein\n\nDen Gläubigern der an der Verschmelzung beteiligten Rechtsträger ist, wenn sie binnen sechs Monaten nach dem Tag, an dem die Eintragung der Verschmelzung in das Register des Sitzes desjenigen Rechtsträgers, dessen Gläubiger sie sind, nach § 19 Absatz 3 UmwG bekannt gemacht worden ist, ihren Anspruch nach Grund und Höhe schriftlich anmelden, Sicherheit zu leisten, soweit sie nicht Befriedigung verlangen können. Dieses Recht steht den Gläubigern jedoch nur zu, wenn sie glaubhaft machen, dass durch die Verschmelzung die Erfüllung ihrer Forderung gefährdet wird."
    },
    {
      "date": "2025-01-27",
      "id": "99733",
      "original_text": "Löschungsankündigung\nHessen Amtsgericht Darmstadt HRB 98037\nLD-Automobile GmbH – Griesheim",
      "type": "Löschungsankündigung",
      "state": "Hessen",
      "amtsgericht": "Amtsgericht Darmstadt",
      "registernummer": "HRB 98037",
      "registerart": "HRB",
      "company_name": "LD-Automobile GmbH",
      "company_seat": "Griesheim",
      "details": "27.01.2025 (Bekanntmachungsdatum)\n\nHessen Amtsgericht Darmstadt HRB 98037\nLöschungsankündigung\n\nLD-Automobile GmbH\nGesellschaft mit beschränkter Haftung\nGriesheim\n\nDas Registergericht beabsichtigt die im Handelsregister eingetragene Gesellschaft von Amts wegen nach § 394 FamFG zu löschen. Die Frist zur Erhebung eines Widerspruchs gegen die beabsichtigte Löschung wird auf 3 Monate festgesetzt."
    },
    {
      "date": "2025-01-27",
      "id": "99734",
      "original_text": "Registerbekanntmachung nach dem Umwandlungsgesetz\nHessen Amtsgericht Königstein HRB 11036\nEppsteinFOILS GmbH – Eppstein",
      "type": "Registerbekanntmachung nach dem Umwandlungsgesetz",
      "state": "Hessen",
      "amtsgericht": "Amtsgericht Königstein",
      "registernummer": "HRB 11036",
      "registerart": "HRB",
      "company_name": "EppsteinFOILS GmbH",
      "company_seat": "Eppstein",
      "details": "27.01.2025 (Bekanntmachungsdatum)\n\nHessen Amtsgericht Königstein HRB 11036\nRegisterbekanntmachung nach dem Umwandlungsgesetz 27.01.2025 (Eintragungsdatum)\n\nEppsteinFOILS GmbH\nGesellschaft mit beschränkter Haftung\nEppstein\n\nDen Gläubigern der an der Verschmelzung beteiligten Rechtsträger ist, wenn sie binnen sechs Monaten nach dem Tag, an dem die Eintragung der Verschmelzung in das Register des Sitzes desjenigen Rechtsträgers, dessen Gläubiger sie sind, nach § 19 Absatz 3 UmwG bekannt gemacht worden ist, ihren Anspruch nach Grund und Höhe schriftlich anmelden, Sicherheit zu leisten, soweit sie nicht Befriedigung verlangen können. Dieses Recht steht den Gläubigern jedoch nur zu, wenn sie glaubhaft machen, dass durch die Verschmelzung die Erfüllung ihrer Forderung gefährdet wird."
    },
    {
      "date": "2025-01-27",
      "id": "99735",
      "original_text": "Sonstige Registerbekanntmachung\nHessen Amtsgericht Kassel VR 2423\nZEITLOS – Kassel",
      "type": "Sonstige Registerbekanntmachung",
      "state": "Hessen",
      "amtsgericht": "Amtsgericht Kassel",
      "registernummer": "VR 2423",
      "registerart": "VR",
      "company_name": "ZEITLOS",
      "company_seat": "Kassel",
      "details": "27.01.2025 (Bekanntmachungsdatum)\n\nHessen Amtsgericht Kassel VR 2423\nSonstige Registerbekanntmachung 27.01.2025 (Eintragungsdatum)\n\nZEITLOS\neingetragener Verein\nKassel\n\nDurch rechtskräftigen Beschluss des Amtsgerichts Kassel vom 13.12.2024 ist dem Verein gemäß § 73 BGB die Rechtsfähigkeit entzogen worden."
    },
    {
      "date": "2025-01-27",
      "id": "99736",
      "original_text": "Registerbekanntmachung nach dem Umwandlungsgesetz\nHessen Amtsgericht Königstein HRB 8796\nGKRW Rhein-Main GmbH Steuerberatungsgesellschaft – Kelkheim (Taunus)",
      "type": "Registerbekanntmachung nach dem Umwandlungsgesetz",
      "state": "Hessen",
      "amtsgericht": "Amtsgericht Königstein",
      "registernummer": "HRB 8796",
      "registerart": "HRB",
      "company_name": "GKRW Rhein-Main GmbH Steuerberatungsgesellschaft",
      "company_seat": "Kelkheim (Taunus)",
      "details": "27.01.2025 (Bekanntmachungsdatum)\n\nHessen Amtsgericht Königstein HRB 8796\nRegisterbekanntmachung nach dem Umwandlungsgesetz 27.01.2025 (Eintragungsdatum)\n\nGKRW Rhein-Main GmbH Steuerberatungsgesellschaft\nGesellschaft mit beschränkter Haftung\nKelkheim (Taunus)\n\nDen Gläubigern der an der Verschmelzung beteiligten Rechtsträger ist, wenn sie binnen sechs Monaten nach dem Tag, an dem die Eintragung der Verschmelzung in das Register des Sitzes desjenigen Rechtsträgers, dessen Gläubiger sie sind, nach § 19 Absatz 3 UmwG bekannt gemacht worden ist, ihren Anspruch nach Grund und Höhe schriftlich anmelden, Sicherheit zu leisten, soweit sie nicht Befriedigung verlangen können. Dieses Recht steht den Gläubigern jedoch nur zu, wenn sie glaubhaft machen, dass durch die Verschmelzung die Erfüllung ihrer Forderung gefährdet wird."
    },
    {
      "date": "2025-01-27",
      "id": "99737",
      "original_text": "Registerbekanntmachung nach dem Umwandlungsgesetz\nHessen Amtsgericht Wiesbaden HRB 35536\ngo connecting Goßmann GmbH – Wiesbaden",
      "type": "Registerbekanntmachung nach dem Umwandlungsgesetz",
      "state": "Hessen",
      "amtsgericht": "Amtsgericht Wiesbaden",
      "registernummer": "HRB 35536",
      "registerart": "HRB",
      "company_name": "go connecting Goßmann GmbH",
      "company_seat": "Wiesbaden",
      "details": "27.01.2025 (Bekanntmachungsdatum)\n\nHessen Amtsgericht Wiesbaden HRB 35536\nRegisterbekanntmachung nach dem Umwandlungsgesetz 27.01.2025 (Eintragungsdatum)\n\ngo connecting Goßmann GmbH\nGesellschaft mit beschränkter Haftung\nWiesbaden\n\nDen Gläubigern der an der Ausgliederung beteiligten Rechtsträger ist, wenn sie binnen sechs Monaten nach dem Tag, an dem die Eintragung der Ausgliederung in das Register des Sitzes desjenigen Rechtsträgers, dessen Gläubiger sie sind, nach §§ 125, 19 Absatz 3 UmwG bekannt gemacht worden ist, ihren Anspruch nach Grund und Höhe schriftlich anmelden, Sicherheit zu leisten, soweit sie nicht Befriedigung verlangen können. Dieses Recht steht den Gläubigern jedoch nur zu, wenn sie glaubhaft machen, dass durch die Ausgliederung die Erfüllung ihrer Forderung gefährdet wird."
    },
    {
      "date": "2025-01-27",
      "id": "99738",
      "original_text": "Registerbekanntmachung nach dem Umwandlungsgesetz\nHessen Amtsgericht Darmstadt HRA 87632\nKramer GmbH & Co. KG – Riedstadt",
      "type": "Registerbekanntmachung nach dem Umwandlungsgesetz",
      "state": "Hessen",
      "amtsgericht": "Amtsgericht Darmstadt",
      "registernummer": "HRA 87632",
      "registerart": "HRA",
      "company_name": "Kramer GmbH & Co. KG",
      "company_seat": "Riedstadt",
      "details": "27.01.2025 (Bekanntmachungsdatum)\n\nHessen Amtsgericht Darmstadt HRA 87632\nRegisterbekanntmachung nach dem Umwandlungsgesetz 27.01.2025 (Eintragungsdatum)\n\nKramer GmbH & Co. KG\nKommanditgesellschaft\nRiedstadt\n\nDen Gläubigern der an der Ausgliederung beteiligten Rechtsträger ist, wenn sie binnen sechs Monaten nach dem Tag, an dem die Eintragung der Ausgliederung in das Register des Sitzes derjenigen Rechtsträger deren Gläubiger sie sind, nach §§ 125, 19 Absatz 3 UmwG bekannt gemacht worden ist, ihren Anspruch nach Grund und Höhe schriftlich anmelden, Sicherheit zu leisten, soweit sie nicht Befriedigung verlangen können. Dieses Recht steht den Gläubigern jedoch nur zu, wenn sie glaubhaft machen, dass durch die Ausgliederung die Erfüllung ihrer Forderung gefährdet wird."
    },
    {
      "date": "2025-01-27",
      "id": "99739",
      "original_text": "Sonstige Registerbekanntmachung\nHessen Amtsgericht Frankfurt am Main HRB 88301\nCitigroup Global Markets Europe AG – Frankfurt am Main",
      "type": "Sonstige Registerbekanntmachung",
      "state": "Hessen",
      "amtsgericht": "Amtsgericht Frankfurt am Main",
      "registernummer": "HRB 88301",
      "registerart": "HRB",
      "company_name": "Citigroup Global Markets Europe AG",
      "company_seat": "Frankfurt am Main",
      "details": "27.01.2025 (Bekanntmachungsdatum)\n\nHessen Amtsgericht Frankfurt am Main HRB 88301\nSonstige Registerbekanntmachung 26.01.2025 (Eintragungsdatum)\n\nCitigroup Global Markets Europe AG\nAktiengesellschaft\nFrankfurt am Main\n\nDurch eine Änderung in den Personen der Aufsichtsratsmitglieder ist eine Liste der Mitglieder des Aufsichtsrates zum Handelsregister eingereicht worden."
    },
    {
      "date": "2025-01-27",
      "id": "99740",
      "original_text": "Registerbekanntmachung nach dem Umwandlungsgesetz\nHessen Amtsgericht Frankfurt am Main HRB 76658\nEPAM Systems GmbH – Frankfurt am Main",
      "type": "Registerbekanntmachung nach dem Umwandlungsgesetz",
      "state": "Hessen",
      "amtsgericht": "Amtsgericht Frankfurt am Main",
      "registernummer": "HRB 76658",
      "registerart": "HRB",
      "company_name": "EPAM Systems GmbH",
      "company_seat": "Frankfurt am Main",
      "details": "27.01.2025 (Bekanntmachungsdatum)\n\nHessen Amtsgericht Frankfurt am Main HRB 76658\nRegisterbekanntmachung nach dem Umwandlungsgesetz 27.01.2025 (Eintragungsdatum)\n\nEPAM Systems GmbH\nGesellschaft mit beschränkter Haftung\nFrankfurt am Main\n\nDen Gläubigern der an der Verschmelzung beteiligten Rechtsträger ist, wenn sie binnen sechs Monaten nach dem Tag, an dem die Eintragung der Verschmelzung in das Register des Sitzes derjenigen Rechtsträger deren Gläubiger sie sind, nach § 19 Absatz 3 UmwG bekannt gemacht worden ist, ihren Anspruch nach Grund und Höhe schriftlich anmelden, Sicherheit zu leisten, soweit sie nicht Befriedigung verlangen können. Dieses Recht steht den Gläubigern jedoch nur zu, wenn sie glaubhaft machen, dass durch die Verschmelzung die Erfüllung ihrer Forderung gefährdet wird."
    },
    {
      "date": "2025-01-27",
      "id": "99741",
      "original_text": "Sonstige Registerbekanntmachung\nHessen Amtsgericht Frankfurt am Main HRB 120038\nCastolin Eutectic Holding GmbH – Kriftel",
      "type": "Sonstige Registerbekanntmachung",
      "state": "Hessen",
      "amtsgericht": "Amtsgericht Frankfurt am Main",
      "registernummer": "HRB 120038",
      "registerart": "HRB",
      "company_name": "Castolin Eutectic Holding GmbH",
      "company_seat": "Kriftel",
      "details": "27.01.2025 (Bekanntmachungsdatum)\n\nHessen Amtsgericht Frankfurt am Main HRB 120038\nSonstige Registerbekanntmachung\n\nCastolin Eutectic Holding GmbH\nGesellschaft mit beschränkter Haftung\nKriftel\n\nDurch eine Änderung in den Personen der Aufsichtsratsmitglieder ist eine Liste der Mitglieder des Aufsichtsrates zum Handelsregister eingereicht worden."
    },
    {
      "date": "2025-01-27",
      "id": "99742",
      "original_text": "Einreichung neuer Dokumente\nHessen Amtsgericht Königstein HRB 8328\nCapitalion SE – Königstein im Taunus",
      "type": "Einreichung neuer Dokumente",
      "state": "Hessen",
      "amtsgericht": "Amtsgericht Königstein",
      "registernummer": "HRB 8328",
      "registerart": "HRB",
      "company_name": "Capitalion SE",
      "company_seat": "Königstein im Taunus",
      "details": "27.01.2025 (Bekanntmachungsdatum)\n\nHessen Amtsgericht Königstein HRB 8328\nEinreichung neuer Dokumente\n\nCapitalion SE\nEuropäische Aktiengesellschaft (SE)\nKönigstein im Taunus\n\nDurch eine Änderung in den Personen der Verwaltungsratsmitglieder ist eine Liste der Mitglieder des Verwaltungsrats zum Handelsregister eingereicht worden."
    },
    {
      "date": "2025-01-27",
      "id": "99743",
      "original_text": "Einreichung neuer Dokumente\nHessen Amtsgericht Frankfurt am Main HRB 119459\nPlutos Vermögensverwaltung AG – Frankfurt am Main",
      "type": "Einreichung neuer Dokumente",
      "state": "Hessen",
      "amtsgericht": "Amtsgericht Frankfurt am Main",
      "registernummer": "HRB 119459",
      "registerart": "HRB",
      "company_name": "Plutos Vermögensverwaltung AG",
      "company_seat": "Frankfurt am Main",
      "details": "27.01.2025 (Bekanntmachungsdatum)\n\nHessen Amtsgericht Frankfurt am Main HRB 119459\nEinreichung neuer Dokumente\n\nPlutos Vermögensverwaltung AG\nAktiengesellschaft\nFrankfurt am Main\n\nDurch eine Änderung in den Personen der Aufsichtsratsmitglieder ist eine Liste der Mitglieder des Aufsichtsrates zum Handelsregister eingereicht worden."
    }
  ]
}