{
  "date": "2025-01-20",
  "date_of_scrape": "2025-01-21T04:07:03.964Z",
  "tool_version": "0.2.0",
  "number_of_announcements": 115,
  "announcements": [
    {
      "date": "2025-01-20",
      "id": "98968",
      "original_text": "Löschungsankündigung\nBrandenburg Amtsgericht Neuruppin HRB 14739\nLuma-Haus GmbH – Neuruppin",
      "type": "Löschungsankündigung",
      "state": "Brandenburg",
      "amtsgericht": "Amtsgericht Neuruppin",
      "registernummer": "HRB 14739",
      "registerart": "HRB",
      "company_name": "Luma-Haus GmbH",
      "company_seat": "Neuruppin",
      "details": "20.01.2025 (Bekanntmachungsdatum)\n\nBrandenburg Amtsgericht Neuruppin HRB 14739\nLöschungsankündigung\n\nLuma-Haus GmbH\nGesellschaft mit beschränkter Haftung\nNeuruppin\n\nBei der nachstehenden Gesellschaft/dem nachstehenden Einzelkaufmann wird das Amtslöschungsverfahren gemäß § 31 Abs. 2 HGB eingeleitet.\nWiderspruchsfrist: 1 Monat"
    },
    {
      "date": "2025-01-20",
      "id": "98969",
      "original_text": "Löschungsankündigung\nBrandenburg Amtsgericht Neuruppin HRB 14739\nLuma-Haus GmbH – Neuruppin",
      "type": "Löschungsankündigung",
      "state": "Brandenburg",
      "amtsgericht": "Amtsgericht Neuruppin",
      "registernummer": "HRB 14739",
      "registerart": "HRB",
      "company_name": "Luma-Haus GmbH",
      "company_seat": "Neuruppin",
      "details": "20.01.2025 (Bekanntmachungsdatum)\n\nBrandenburg Amtsgericht Neuruppin HRB 14739\nLöschungsankündigung\n\nLuma-Haus GmbH\nGesellschaft mit beschränkter Haftung\nNeuruppin\n\nBei der nachstehenden Gesellschaft wird das Amtslöschungsverfahren gemäß § 394 FamFG eingeleitet.\nWiderspruchsfrist: 1 Monat"
    },
    {
      "date": "2025-01-20",
      "id": "98970",
      "original_text": "Registerbekanntmachung nach dem Umwandlungsgesetz\nBaden-Württemberg Amtsgericht Freiburg HRB 723570\nmyGrapes GmbH – Bahlingen am Kaiserstuhl",
      "type": "Registerbekanntmachung nach dem Umwandlungsgesetz",
      "state": "Baden-Württemberg",
      "amtsgericht": "Amtsgericht Freiburg",
      "registernummer": "HRB 723570",
      "registerart": "HRB",
      "company_name": "myGrapes GmbH",
      "company_seat": "Bahlingen am Kaiserstuhl",
      "details": "20.01.2025 (Bekanntmachungsdatum)\n\nBaden-Württemberg Amtsgericht Freiburg HRB 723570\nRegisterbekanntmachung nach dem Umwandlungsgesetz 20.01.2025 (Eintragungsdatum)\n\nmyGrapes GmbH\nGesellschaft mit beschränkter Haftung\nBahlingen am Kaiserstuhl\n\nAls nicht eingetragen wird bekanntgemacht:\nDen Gläubigern des an dem Formwechsel beteiligten Rechtsträgers ist, wenn sie binnen sechs Monaten nach dem Tag, an dem die Eintragung des Formwechsels in das Register des Sitzes desjenigen Rechtsträgers, dessen Gläubiger sie sind, nach § 19 Abs. 3 UmwG als bekanntgemacht gilt, ihren Anspruch nach Grund und Höhe schriftlich anmelden, Sicherheit zu leisten, soweit sie nicht Befriedigung verlangen können. Dieses Recht steht den Gläubigern jedoch nur zu, wenn sie glaubhaft machen, dass durch den Formwechsel die Erfüllung ihrer Forderung gefährdet wird."
    },
    {
      "date": "2025-01-20",
      "id": "98971",
      "original_text": "Registerbekanntmachung nach dem Umwandlungsgesetz\nBrandenburg Amtsgericht Frankfurt/Oder HRB 20199\nWölkchen Verwaltungs und Beteiligungs GmbH – Rüdersdorf bei Berlin",
      "type": "Registerbekanntmachung nach dem Umwandlungsgesetz",
      "state": "Brandenburg",
      "amtsgericht": "Amtsgericht Frankfurt/Oder",
      "registernummer": "HRB 20199",
      "registerart": "HRB",
      "company_name": "Wölkchen Verwaltungs und Beteiligungs GmbH",
      "company_seat": "Rüdersdorf bei Berlin",
      "details": "20.01.2025 (Bekanntmachungsdatum)\n\nBrandenburg Amtsgericht Frankfurt/Oder HRB 20199\nRegisterbekanntmachung nach dem Umwandlungsgesetz 16.01.2025 (Eintragungsdatum)\n\nWölkchen Verwaltungs und Beteiligungs GmbH\nGesellschaft mit beschränkter Haftung\nRüdersdorf bei Berlin\n\nZu Eintragungsnummer 2 vom 16.01.2025 wird als nicht eingetragen veröffentlicht:Als nicht eingetragen wird veröffentlicht:\nDen Gläubigern der an der Verschmelzung beteiligten Rechtsträger ist, wenn sie binnen sechs Monaten nach dem Tag, an dem die Eintragung der Verschmelzung in das Register des Sitzes desjenigen Rechtsträgers, dessen Gläubiger sie sind, als bekannt gemacht gilt, ihren Anspruch nach Grund und Höhe schriftlich anmelden, Sicherheit zu leisten, soweit sie nicht Befriedigung verlangen können. Dieses Recht steht den Gläubigern jedoch nur zu, wenn sie glaubhaft machen, dass durch die Verschmelzung die Erfüllung ihrer Forderung gefährdet wird"
    },
    {
      "date": "2025-01-20",
      "id": "98972",
      "original_text": "Registerbekanntmachung nach dem Umwandlungsgesetz\nMecklenburg-Vorpommern Amtsgericht Schwerin HRA 4705\nWestphal Vermietungs GmbH & Co. KG – Parchim",
      "type": "Registerbekanntmachung nach dem Umwandlungsgesetz",
      "state": "Mecklenburg-Vorpommern",
      "amtsgericht": "Amtsgericht Schwerin",
      "registernummer": "HRA 4705",
      "registerart": "HRA",
      "company_name": "Westphal Vermietungs GmbH & Co. KG",
      "company_seat": "Parchim",
      "details": "20.01.2025 (Bekanntmachungsdatum)\n\nMecklenburg-Vorpommern Amtsgericht Schwerin HRA 4705\nRegisterbekanntmachung nach dem Umwandlungsgesetz 20.01.2025 (Eintragungsdatum)\n\nWestphal Vermietungs GmbH & Co. KG\nKommanditgesellschaft\nParchim\n\nDie Gesellschaft hat Gläubigern, deren Forderungen vor dieser Bekanntmachung begründet worden sind, Sicherheit zu leisten, soweit sie nicht Befriedigung verlangen können, wenn sie sich binnen sechs Monaten zu diesem Zweck melden."
    },
    {
      "date": "2025-01-20",
      "id": "98973",
      "original_text": "Registerbekanntmachung nach dem Umwandlungsgesetz\nMecklenburg-Vorpommern Amtsgericht Schwerin HRA 4683\nPeter Westphal e. K. – Parchim",
      "type": "Registerbekanntmachung nach dem Umwandlungsgesetz",
      "state": "Mecklenburg-Vorpommern",
      "amtsgericht": "Amtsgericht Schwerin",
      "registernummer": "HRA 4683",
      "registerart": "HRA",
      "company_name": "Peter Westphal e. K.",
      "company_seat": "Parchim",
      "details": "20.01.2025 (Bekanntmachungsdatum)\n\nMecklenburg-Vorpommern Amtsgericht Schwerin HRA 4683\nRegisterbekanntmachung nach dem Umwandlungsgesetz 20.01.2025 (Eintragungsdatum)\n\nPeter Westphal e. K.\nEinzelkaufmann / Einzelkauffrau\nParchim\n\nDie Gesellschaft hat Gläubigern, deren Forderungen vor dieser Bekanntmachung begründet worden sind, Sicherheit zu leisten, soweit sie nicht Befriedigung verlangen können, wenn sie sich binnen sechs Monaten zu diesem Zweck melden."
    },
    {
      "date": "2025-01-20",
      "id": "98974",
      "original_text": "Einreichung neuer Dokumente\nBaden-Württemberg Amtsgericht Stuttgart HRB 770269\nDECATHLON Verwaltung SE – Plochingen",
      "type": "Einreichung neuer Dokumente",
      "state": "Baden-Württemberg",
      "amtsgericht": "Amtsgericht Stuttgart",
      "registernummer": "HRB 770269",
      "registerart": "HRB",
      "company_name": "DECATHLON Verwaltung SE",
      "company_seat": "Plochingen",
      "details": "20.01.2025 (Bekanntmachungsdatum)\n\nBaden-Württemberg Amtsgericht Stuttgart HRB 770269\nEinreichung neuer Dokumente\n\nDECATHLON Verwaltung SE\nEuropäische Aktiengesellschaft (SE)\nPlochingen\n\nDie Gesellschaft hat am 17.01.2025 die Liste über die Zusammensetzung des Aufsichtsrats zum Handelsregister eingereicht."
    },
    {
      "date": "2025-01-20",
      "id": "98975",
      "original_text": "Registerbekanntmachung nach dem Umwandlungsgesetz\nBrandenburg Amtsgericht Cottbus HRB 16497\nMoneta Immobilienmanagement und Verwaltungsgesellschaft mbH – Schönefeld",
      "type": "Registerbekanntmachung nach dem Umwandlungsgesetz",
      "state": "Brandenburg",
      "amtsgericht": "Amtsgericht Cottbus",
      "registernummer": "HRB 16497",
      "registerart": "HRB",
      "company_name": "Moneta Immobilienmanagement und Verwaltungsgesellschaft mbH",
      "company_seat": "Schönefeld",
      "details": "20.01.2025 (Bekanntmachungsdatum)\n\nBrandenburg Amtsgericht Cottbus HRB 16497\nRegisterbekanntmachung nach dem Umwandlungsgesetz 16.01.2025 (Eintragungsdatum)\n\nMoneta Immobilienmanagement und Verwaltungsgesellschaft mbH\nGesellschaft mit beschränkter Haftung\nSchönefeld\n\nZu Eintragungsnummer 2 vom 16.01.2025 wird als nicht eingetragen veröffentlicht:\nDen Gläubigern der an der Verschmelzung beteiligten Rechtsträger ist, wenn sie binnen sechs Monaten nach dem Tag, an dem die Eintragung der Verschmelzung in das Register des Sitzes desjenigen Rechtsträgers, dessen Gläubiger sie sind, als bekannt gemacht gilt, ihren Anspruch nach Grund und Höhe schriftlich anmelden, Sicherheit zu leisten, soweit sie nicht Befriedigung verlangen können. Dieses Recht steht den Gläubigern jedoch nur zu, wenn sie glaubhaft machen, dass durch die Verschmelzung die Erfüllung ihrer Forderung gefährdet wird."
    },
    {
      "date": "2025-01-20",
      "id": "98976",
      "original_text": "Einreichung neuer Dokumente\nBaden-Württemberg Amtsgericht Ulm HRB 661556\nStadtwerke Giengen GmbH – Giengen an der Brenz",
      "type": "Einreichung neuer Dokumente",
      "state": "Baden-Württemberg",
      "amtsgericht": "Amtsgericht Ulm",
      "registernummer": "HRB 661556",
      "registerart": "HRB",
      "company_name": "Stadtwerke Giengen GmbH",
      "company_seat": "Giengen an der Brenz",
      "details": "20.01.2025 (Bekanntmachungsdatum)\n\nBaden-Württemberg Amtsgericht Ulm HRB 661556\nEinreichung neuer Dokumente\n\nStadtwerke Giengen GmbH\nGesellschaft mit beschränkter Haftung\nGiengen an der Brenz\n\nDie Gesellschaft hat am 16.01.2025 die Liste über die Zusammensetzung des Aufsichtsrats zum Handelsregister eingereicht."
    },
    {
      "date": "2025-01-20",
      "id": "98977",
      "original_text": "Sonstige Registerbekanntmachung\nBaden-Württemberg Amtsgericht Stuttgart HRB 725497\nMedienholding Süd GmbH – Stuttgart",
      "type": "Sonstige Registerbekanntmachung",
      "state": "Baden-Württemberg",
      "amtsgericht": "Amtsgericht Stuttgart",
      "registernummer": "HRB 725497",
      "registerart": "HRB",
      "company_name": "Medienholding Süd GmbH",
      "company_seat": "Stuttgart",
      "details": "20.01.2025 (Bekanntmachungsdatum)\n\nBaden-Württemberg Amtsgericht Stuttgart HRB 725497\nSonstige Registerbekanntmachung 20.01.2025 (Eintragungsdatum)\n\nMedienholding Süd GmbH\nGesellschaft mit beschränkter Haftung\nStuttgart\n\nDen Gläubigern der Gesellschaft, deren Forderungen begründet worden sind, bevor die Eintragung der Beendigung des Vertrages in das Handelsregister nach § 10 HGB als bekanntgemacht gilt, ist vom anderen Vertragsteil Sicherheit zu leisten, wenn sie sich binnen sechs Monaten nach der Bekanntmachung zu diesem Zweck bei ihm melden."
    },
    {
      "date": "2025-01-20",
      "id": "98978",
      "original_text": "Registerbekanntmachung nach dem Umwandlungsgesetz\nBaden-Württemberg Amtsgericht Freiburg HRB 602123\nPHOENIX CONTACT Identification GmbH – Villingen-Schwenningen",
      "type": "Registerbekanntmachung nach dem Umwandlungsgesetz",
      "state": "Baden-Württemberg",
      "amtsgericht": "Amtsgericht Freiburg",
      "registernummer": "HRB 602123",
      "registerart": "HRB",
      "company_name": "PHOENIX CONTACT Identification GmbH",
      "company_seat": "Villingen-Schwenningen",
      "details": "20.01.2025 (Bekanntmachungsdatum)\n\nBaden-Württemberg Amtsgericht Freiburg HRB 602123\nRegisterbekanntmachung nach dem Umwandlungsgesetz 20.01.2025 (Eintragungsdatum)\n\nPHOENIX CONTACT Identification GmbH\nGesellschaft mit beschränkter Haftung\nVillingen-Schwenningen\n\nAls nicht eingetragen wird bekanntgemacht:\nDen Gläubigern der an der Verschmelzung beteiligten Rechtsträger ist, wenn sie binnen sechs Monaten nach dem Tag, an dem die Eintragung der Verschmelzung in das Register des Sitzes desjenigen Rechtsträgers, dessen Gläubiger sie sind, nach § 19 Abs. 3 UmwG als bekanntgemacht gilt, ihren Anspruch nach Grund und Höhe schriftlich anmelden, Sicherheit zu leisten, soweit sie nicht Befriedigung verlangen können. Dieses Recht steht den Gläubigern jedoch nur zu, wenn sie glaubhaft machen, dass durch die Verschmelzung die Erfüllung ihrer Forderung gefährdet wird."
    },
    {
      "date": "2025-01-20",
      "id": "98979",
      "original_text": "Einreichung neuer Dokumente\nSchleswig-Holstein Amtsgericht Flensburg HRB 5167\nDiakonisches Werk Husum gGmbH – Husum",
      "type": "Einreichung neuer Dokumente",
      "state": "Schleswig-Holstein",
      "amtsgericht": "Amtsgericht Flensburg",
      "registernummer": "HRB 5167",
      "registerart": "HRB",
      "company_name": "Diakonisches Werk Husum gGmbH",
      "company_seat": "Husum",
      "details": "20.01.2025 (Bekanntmachungsdatum)\n\nSchleswig-Holstein Amtsgericht Flensburg HRB 5167\nEinreichung neuer Dokumente\n\nDiakonisches Werk Husum gGmbH\nGesellschaft mit beschränkter Haftung\nHusum\n\nAls nicht eingetragen wird veröffentlicht: Neue Aufsichtsratsliste nach Änderung eingereicht am 20.01.2025."
    },
    {
      "date": "2025-01-20",
      "id": "98980",
      "original_text": "Löschungsankündigung\nBrandenburg Amtsgericht Frankfurt/Oder HRB 10612\nAluGlasBau Eberswalde GmbH – Eberswalde",
      "type": "Löschungsankündigung",
      "state": "Brandenburg",
      "amtsgericht": "Amtsgericht Frankfurt/Oder",
      "registernummer": "HRB 10612",
      "registerart": "HRB",
      "company_name": "AluGlasBau Eberswalde GmbH",
      "company_seat": "Eberswalde",
      "details": "20.01.2025 (Bekanntmachungsdatum)\n\nBrandenburg Amtsgericht Frankfurt/Oder HRB 10612\nLöschungsankündigung\n\nAluGlasBau Eberswalde GmbH\nGesellschaft mit beschränkter Haftung\nEberswalde\n\nBei der nachstehenden Gesellschaft wird das Amtslöschungsverfahren gemäß § 394 FamFG eingeleitet."
    },
    {
      "date": "2025-01-20",
      "id": "98981",
      "original_text": "Löschungsankündigung\nBrandenburg Amtsgericht Frankfurt/Oder HRB 16301\nRené Krause Oberflächenreinigung GmbH – Wandlitz",
      "type": "Löschungsankündigung",
      "state": "Brandenburg",
      "amtsgericht": "Amtsgericht Frankfurt/Oder",
      "registernummer": "HRB 16301",
      "registerart": "HRB",
      "company_name": "René Krause Oberflächenreinigung GmbH",
      "company_seat": "Wandlitz",
      "details": "20.01.2025 (Bekanntmachungsdatum)\n\nBrandenburg Amtsgericht Frankfurt/Oder HRB 16301\nLöschungsankündigung\n\nRené Krause Oberflächenreinigung GmbH\nGesellschaft mit beschränkter Haftung\nWandlitz\n\nBei der nachstehenden Gesellschaft wird das Amtslöschungsverfahren gemäß § 394 FamFG eingeleitet."
    },
    {
      "date": "2025-01-20",
      "id": "98982",
      "original_text": "Löschungsankündigung\nSchleswig-Holstein Amtsgericht Kiel HRB 14159\nPRI Prevention Rejuvenation Integrity GmbH – Bad Bramstedt",
      "type": "Löschungsankündigung",
      "state": "Schleswig-Holstein",
      "amtsgericht": "Amtsgericht Kiel",
      "registernummer": "HRB 14159",
      "registerart": "HRB",
      "company_name": "PRI Prevention Rejuvenation Integrity GmbH",
      "company_seat": "Bad Bramstedt",
      "details": "20.01.2025 (Bekanntmachungsdatum)\n\nSchleswig-Holstein Amtsgericht Kiel HRB 14159\nLöschungsankündigung\n\nPRI Prevention Rejuvenation Integrity GmbH\nGesellschaft mit beschränkter Haftung\nBad Bramstedt\n\nEs ist die Löschung der nachstehenden Gesellschaft wegen Vermögenslosigkeit gemäß § 394 FamFG beabsichtigt. Widerspruchsfrist: 2 Monate."
    },
    {
      "date": "2025-01-20",
      "id": "98983",
      "original_text": "Registerbekanntmachung nach dem Umwandlungsgesetz\nBrandenburg Amtsgericht Neuruppin HRB 7520\nORPU Pumpenfabrik GmbH – Oranienburg",
      "type": "Registerbekanntmachung nach dem Umwandlungsgesetz",
      "state": "Brandenburg",
      "amtsgericht": "Amtsgericht Neuruppin",
      "registernummer": "HRB 7520",
      "registerart": "HRB",
      "company_name": "ORPU Pumpenfabrik GmbH",
      "company_seat": "Oranienburg",
      "details": "20.01.2025 (Bekanntmachungsdatum)\n\nBrandenburg Amtsgericht Neuruppin HRB 7520\nRegisterbekanntmachung nach dem Umwandlungsgesetz 17.01.2025 (Eintragungsdatum)\n\nORPU Pumpenfabrik GmbH\nGesellschaft mit beschränkter Haftung\nOranienburg\n\nZu Eintragungsnummer 8 vom 17.01.2025 wird als nicht eingetragen veröffentlicht:\nDen Gläubigern der an der Umwandlung beteiligten Rechtsträger ist, wenn sie binnen sechs Monaten nach dem Tag, an dem die Eintragung der Umwandlung in das Register des Sitzes desjenigen Rechtsträgers, dessen Gläubiger sie sind, als bekannt gemacht gilt, ihren Anspruch nach Grund und Höhe schriftlich anmelden, Sicherheit zu leisten, soweit sie nicht Befriedigung verlangen können. Dieses Recht steht den Gläubigern jedoch nur zu, wenn sie glaubhaft machen, dass durch die Umwandlung die Erfüllung ihrer Forderung gefährdet wird"
    },
    {
      "date": "2025-01-20",
      "id": "98984",
      "original_text": "Einreichung neuer Dokumente\nBaden-Württemberg Amtsgericht Stuttgart HRB 780478\nRems-Murr-Kliniken MVZ gGmbH – Winnenden",
      "type": "Einreichung neuer Dokumente",
      "state": "Baden-Württemberg",
      "amtsgericht": "Amtsgericht Stuttgart",
      "registernummer": "HRB 780478",
      "registerart": "HRB",
      "company_name": "Rems-Murr-Kliniken MVZ gGmbH",
      "company_seat": "Winnenden",
      "details": "20.01.2025 (Bekanntmachungsdatum)\n\nBaden-Württemberg Amtsgericht Stuttgart HRB 780478\nEinreichung neuer Dokumente 20.01.2025 (Eintragungsdatum)\n\nRems-Murr-Kliniken MVZ gGmbH\nGesellschaft mit beschränkter Haftung\nWinnenden\n\nDie Gesellschaft hat am 15.01.2025 die Liste über die Zusammensetzung des Aufsichtsrats zum Handelsregister eingereicht."
    },
    {
      "date": "2025-01-20",
      "id": "98985",
      "original_text": "Löschungsankündigung\nBrandenburg Amtsgericht Cottbus HRA 3406\nLTA Anlagenbau GmbH & Co. KG – Schönewalde",
      "type": "Löschungsankündigung",
      "state": "Brandenburg",
      "amtsgericht": "Amtsgericht Cottbus",
      "registernummer": "HRA 3406",
      "registerart": "HRA",
      "company_name": "LTA Anlagenbau GmbH & Co. KG",
      "company_seat": "Schönewalde",
      "details": "20.01.2025 (Bekanntmachungsdatum)\n\nBrandenburg Amtsgericht Cottbus HRA 3406\nLöschungsankündigung\n\nLTA Anlagenbau GmbH & Co. KG\nKommanditgesellschaft\nSchönewalde\n\nBei der nachstehenden Gesellschaft wird das Amtslöschungsverfahren gemäß § 394 FamFG eingeleitet."
    },
    {
      "date": "2025-01-20",
      "id": "98986",
      "original_text": "Registerbekanntmachung nach dem Umwandlungsgesetz\nBaden-Württemberg Amtsgericht Stuttgart HRB 795741\nAUTOflex24 GmbH – Gundelsheim",
      "type": "Registerbekanntmachung nach dem Umwandlungsgesetz",
      "state": "Baden-Württemberg",
      "amtsgericht": "Amtsgericht Stuttgart",
      "registernummer": "HRB 795741",
      "registerart": "HRB",
      "company_name": "AUTOflex24 GmbH",
      "company_seat": "Gundelsheim",
      "details": "20.01.2025 (Bekanntmachungsdatum)\n\nBaden-Württemberg Amtsgericht Stuttgart HRB 795741\nRegisterbekanntmachung nach dem Umwandlungsgesetz 20.01.2025 (Eintragungsdatum)\n\nAUTOflex24 GmbH\nGesellschaft mit beschränkter Haftung\nGundelsheim\n\nAls nicht eingetragen wird bekanntgemacht: Den Gläubigern der an der Verschmelzung beteiligten Rechtsträger ist, wenn sie binnen sechs Monaten nach dem Tag, an dem die Eintragung der Verschmelzung in das Register des Sitzes desjenigen Rechtsträgers, dessen Gläubiger sie sind, nach § 19 Abs. 3 UmwG als bekanntgemacht gilt, ihren Anspruch nach Grund und Höhe schriftlich anmelden, Sicherheit zu leisten, soweit sie nicht Befriedigung verlangen können. Dieses Recht steht den Gläubigern jedoch nur zu, wenn sie glaubhaft machen, dass durch die Verschmelzung die Erfüllung ihrer Forderung gefährdet wird."
    },
    {
      "date": "2025-01-20",
      "id": "98987",
      "original_text": "Registerbekanntmachung nach dem Umwandlungsgesetz\nBrandenburg Amtsgericht Cottbus HRB 2205\nHandelshof Cottbus GmbH Partner für Technik – Cottbus",
      "type": "Registerbekanntmachung nach dem Umwandlungsgesetz",
      "state": "Brandenburg",
      "amtsgericht": "Amtsgericht Cottbus",
      "registernummer": "HRB 2205",
      "registerart": "HRB",
      "company_name": "Handelshof Cottbus GmbH Partner für Technik",
      "company_seat": "Cottbus",
      "details": "20.01.2025 (Bekanntmachungsdatum)\n\nBrandenburg Amtsgericht Cottbus HRB 2205\nRegisterbekanntmachung nach dem Umwandlungsgesetz 17.01.2025 (Eintragungsdatum)\n\nHandelshof Cottbus GmbH Partner für Technik\nGesellschaft mit beschränkter Haftung\nCottbus\n\nZu Eintragungsnummer 23 vom 17.01.2025 wird als nicht eingetragen veröffentlicht:\nAls nicht eingetragen wird veröffentlicht:\nDen Gläubigern der an der Verschmelzung beteiligten Rechtsträger ist, wenn sie binnen sechs Monaten nach dem Tag, an dem die Eintragung der Verschmelzung in das Register des Sitzes desjenigen Rechtsträgers, dessen Gläubiger sie sind, als bekannt gemacht gilt, ihren Anspruch nach Grund und Höhe schriftlich anmelden, Sicherheit zu leisten, soweit sie nicht Befriedigung verlangen können. Dieses Recht steht den Gläubigern jedoch nur zu, wenn sie glaubhaft machen, dass durch die Verschmelzung die Erfüllung ihrer Forderung gefährdet wird"
    },
    {
      "date": "2025-01-20",
      "id": "98988",
      "original_text": "Sonstige Registerbekanntmachung\nSchleswig-Holstein Amtsgericht Lübeck HRB 14980\nI:Collect GmbH – Ahrensburg",
      "type": "Sonstige Registerbekanntmachung",
      "state": "Schleswig-Holstein",
      "amtsgericht": "Amtsgericht Lübeck",
      "registernummer": "HRB 14980",
      "registerart": "HRB",
      "company_name": "I:Collect GmbH",
      "company_seat": "Ahrensburg",
      "details": "20.01.2025 (Bekanntmachungsdatum)\n\nSchleswig-Holstein Amtsgericht Lübeck HRB 14980\nSonstige Registerbekanntmachung 17.01.2025 (Eintragungsdatum)\n\nI:Collect GmbH\nGesellschaft mit beschränkter Haftung\nAhrensburg\n\nAls nicht eingetragen wird veröffentlicht: Der andere Vertragsteil hat den Gläubigern dieses Rechtsträgers, dessen Forderungen begründet worden sind, bevor die Eintragung der Beendigung dieses Vertrages in das Handelsregister nach § 10 des Handelsgesetzbuches als bekannt gemacht gilt, Sicherheit zu leisten, wenn sie sich binnen sechs Monaten nach der Bekanntmachung der Eintragung zu diesem Zweck bei ihm melden. Dieses Recht steht den Gläubigern nicht zu, die im Fall des Insolvenzverfahrens ein Recht auf vorzugsweise Befriedigung aus der Deckungsmasse haben, die nach gesetzlicher Vorschrift zu ihrem Schutz errichtet und staatlich überwacht ist."
    },
    {
      "date": "2025-01-20",
      "id": "98989",
      "original_text": "Registerbekanntmachung nach dem Umwandlungsgesetz\nSchleswig-Holstein Amtsgericht Flensburg HRB 16821\nWestphal Mildstedt GmbH – Mildstedt",
      "type": "Registerbekanntmachung nach dem Umwandlungsgesetz",
      "state": "Schleswig-Holstein",
      "amtsgericht": "Amtsgericht Flensburg",
      "registernummer": "HRB 16821",
      "registerart": "HRB",
      "company_name": "Westphal Mildstedt GmbH",
      "company_seat": "Mildstedt",
      "details": "20.01.2025 (Bekanntmachungsdatum)\n\nSchleswig-Holstein Amtsgericht Flensburg HRB 16821\nRegisterbekanntmachung nach dem Umwandlungsgesetz 14.01.2025 (Eintragungsdatum)\n\nWestphal Mildstedt GmbH\nGesellschaft mit beschränkter Haftung\nMildstedt\n\nAls nicht eingetragen wird veröffentlicht: Den Gläubigern der an der Spaltung beteiligten Rechtsträger ist, wenn sie binnen sechs Monaten nach dem Tag, an dem die Eintragung der Spaltung in das Register des Sitzes desjenigen Rechtsträgers, dessen Gläubiger sie sind, als bekannt gemacht gilt, ihren Anspruch nach Grund und Höhe schriftlich anmelden, Sicherheit zu leisten, soweit sie nicht Befriedigung verlangen können. Dieses Recht steht den Gläubigern jedoch nur zu, wenn sie glaubhaft machen, dass durch die Spaltung die Erfüllung ihrer Forderung gefährdet wird."
    },
    {
      "date": "2025-01-20",
      "id": "98990",
      "original_text": "Löschungsankündigung\nBerlin Amtsgericht Berlin (Charlottenburg) HRB 202229\nTQ Objekt Betzdorf UG (haftungsbeschränkt) – Berlin",
      "type": "Löschungsankündigung",
      "state": "Berlin",
      "amtsgericht": "Amtsgericht Berlin (Charlottenburg)",
      "registernummer": "HRB 202229",
      "registerart": "HRB",
      "company_name": "TQ Objekt Betzdorf UG (haftungsbeschränkt)",
      "company_seat": "Berlin",
      "details": "20.01.2025 (Bekanntmachungsdatum)\n\nBerlin Amtsgericht Berlin (Charlottenburg) HRB 202229\nLöschungsankündigung\n\nTQ Objekt Betzdorf UG (haftungsbeschränkt)\nGesellschaft mit beschränkter Haftung\nBerlin\n\nBei der nachstehenden Gesellschaft wird das Amtslöschungsverfahren gemäß § 394 FamFG eingeleitet. Widerspruchsfrist 6 Wochen"
    },
    {
      "date": "2025-01-20",
      "id": "98991",
      "original_text": "Löschungsankündigung\nBerlin Amtsgericht Berlin (Charlottenburg) HRB 161437\nAgrarhandel Hoffmann GmbH – Berlin",
      "type": "Löschungsankündigung",
      "state": "Berlin",
      "amtsgericht": "Amtsgericht Berlin (Charlottenburg)",
      "registernummer": "HRB 161437",
      "registerart": "HRB",
      "company_name": "Agrarhandel Hoffmann GmbH",
      "company_seat": "Berlin",
      "details": "20.01.2025 (Bekanntmachungsdatum)\n\nBerlin Amtsgericht Berlin (Charlottenburg) HRB 161437\nLöschungsankündigung\n\nAgrarhandel Hoffmann GmbH\nGesellschaft mit beschränkter Haftung\nBerlin\n\nBei der nachstehenden Gesellschaft wird das Amtslöschungsverfahren gemäß § 394 FamFG eingeleitet. Widerspruchsfrist 6 Wochen"
    },
    {
      "date": "2025-01-20",
      "id": "98992",
      "original_text": "Löschungsankündigung\nBrandenburg Amtsgericht Potsdam HRB 19787\nCERTURO Treuhandgesellschaft mbH – Brandenburg an der Havel",
      "type": "Löschungsankündigung",
      "state": "Brandenburg",
      "amtsgericht": "Amtsgericht Potsdam",
      "registernummer": "HRB 19787",
      "registerart": "HRB",
      "company_name": "CERTURO Treuhandgesellschaft mbH",
      "company_seat": "Brandenburg an der Havel",
      "details": "20.01.2025 (Bekanntmachungsdatum)\n\nBrandenburg Amtsgericht Potsdam HRB 19787\nLöschungsankündigung\n\nCERTURO Treuhandgesellschaft mbH\nGesellschaft mit beschränkter Haftung\nBrandenburg an der Havel\n\nBei der nachstehenden Gesellschaft wird das Amtslöschungsverfahren gemäß § 394 FamFG eingeleitet. Widerspruchsfrist: 8 Wochen"
    },
    {
      "date": "2025-01-20",
      "id": "98993",
      "original_text": "Löschungsankündigung\nBaden-Württemberg Amtsgericht Stuttgart HRB 765269\nZG Marketing GmbH – Sindelfingen",
      "type": "Löschungsankündigung",
      "state": "Baden-Württemberg",
      "amtsgericht": "Amtsgericht Stuttgart",
      "registernummer": "HRB 765269",
      "registerart": "HRB",
      "company_name": "ZG Marketing GmbH",
      "company_seat": "Sindelfingen",
      "details": "20.01.2025 (Bekanntmachungsdatum)\n\nBaden-Württemberg Amtsgericht Stuttgart HRB 765269\nLöschungsankündigung\n\nZG Marketing GmbH\nGesellschaft mit beschränkter Haftung\nSindelfingen\n\nDas Gericht beabsichtigt, die Gesellschaft wegen Vermögenslosigkeit im Handelsregister von Amts wegen nach § 394 FamFG zu löschen. Die Frist zur Geltendmachung eines Widerspruchs gegen die beabsichtigte Löschung ist auf zwei Monate ab Veröffentlichung bestimmt."
    },
    {
      "date": "2025-01-20",
      "id": "98994",
      "original_text": "Löschungsankündigung\nSchleswig-Holstein Amtsgericht Flensburg HRB 11725\nSylt House GmbH – Sylt",
      "type": "Löschungsankündigung",
      "state": "Schleswig-Holstein",
      "amtsgericht": "Amtsgericht Flensburg",
      "registernummer": "HRB 11725",
      "registerart": "HRB",
      "company_name": "Sylt House GmbH",
      "company_seat": "Sylt",
      "details": "20.01.2025 (Bekanntmachungsdatum)\n\nSchleswig-Holstein Amtsgericht Flensburg HRB 11725\nLöschungsankündigung\n\nSylt House GmbH\nGesellschaft mit beschränkter Haftung\nSylt\n\nEs ist die Löschung der nachstehenden Gesellschaft wegen Vermögenslosigkeit gemäß § 394 FamFG beabsichtigt.\nWiderspruchsfrist: 2 Monate."
    },
    {
      "date": "2025-01-20",
      "id": "98995",
      "original_text": "Registerbekanntmachung nach dem Umwandlungsgesetz\nBrandenburg Amtsgericht Potsdam HRB 15263\nFARD lighting GmbH – Ludwigsfelde",
      "type": "Registerbekanntmachung nach dem Umwandlungsgesetz",
      "state": "Brandenburg",
      "amtsgericht": "Amtsgericht Potsdam",
      "registernummer": "HRB 15263",
      "registerart": "HRB",
      "company_name": "FARD lighting GmbH",
      "company_seat": "Ludwigsfelde",
      "details": "20.01.2025 (Bekanntmachungsdatum)\n\nBrandenburg Amtsgericht Potsdam HRB 15263\nRegisterbekanntmachung nach dem Umwandlungsgesetz 17.01.2025 (Eintragungsdatum)\n\nFARD lighting GmbH\nGesellschaft mit beschränkter Haftung\nLudwigsfelde\n\nZu Eintragungsnummer 6 vom 17.01.2025 wird als nicht eingetragen veröffentlicht:\nDen Gläubigern der an der Verschmelzung beteiligten Rechtsträger ist, wenn sie binnen sechs Monaten nach dem Tag, an dem die Eintragung der Verschmelzung in das Register des Sitzes desjenigen Rechtsträgers, dessen Gläubiger sie sind, als bekannt gemacht gilt, ihren Anspruch nach Grund und Höhe schriftlich anmelden, Sicherheit zu leisten, soweit sie nicht Befriedigung verlangen können. Dieses Recht steht den Gläubigern jedoch nur zu, wenn sie glaubhaft machen, dass durch die Verschmelzung die Erfüllung ihrer Forderung gefährdet wird"
    },
    {
      "date": "2025-01-20",
      "id": "98996",
      "original_text": "Einreichung neuer Dokumente\nThüringen Amtsgericht Jena HRB 209419\nINTERSHOP Communications Aktiengesellschaft – Jena",
      "type": "Einreichung neuer Dokumente",
      "state": "Thüringen",
      "amtsgericht": "Amtsgericht Jena",
      "registernummer": "HRB 209419",
      "registerart": "HRB",
      "company_name": "INTERSHOP Communications Aktiengesellschaft",
      "company_seat": "Jena",
      "details": "20.01.2025 (Bekanntmachungsdatum)\n\nThüringen Amtsgericht Jena HRB 209419\nEinreichung neuer Dokumente\n\nINTERSHOP Communications Aktiengesellschaft\nAktiengesellschaft\nJena\n\nBekanntmachung gem. § 106 AktG: Aufgrund einer Veränderung in den Personen der Aufsichtsratsmitglieder ist durch den Vorstand eine neue Liste zum Handelsregister eingereicht worden."
    },
    {
      "date": "2025-01-20",
      "id": "98997",
      "original_text": "Löschungsankündigung\nThüringen Amtsgericht Jena HRB 509754\nBramos Planungs- und Servicegesellschaft mbH – Bad Frankenhausen",
      "type": "Löschungsankündigung",
      "state": "Thüringen",
      "amtsgericht": "Amtsgericht Jena",
      "registernummer": "HRB 509754",
      "registerart": "HRB",
      "company_name": "Bramos Planungs- und Servicegesellschaft mbH",
      "company_seat": "Bad Frankenhausen",
      "details": "20.01.2025 (Bekanntmachungsdatum)\n\nThüringen Amtsgericht Jena HRB 509754\nLöschungsankündigung\n\nBramos Planungs- und Servicegesellschaft mbH\nGesellschaft mit beschränkter Haftung\nBad Frankenhausen\n\nDas Registergericht beabsichtigt, die im Handelsregister eingetragene Gesellschaft wegen Vermögenslosigkeit nach § 394 FamFG von Amts wegen zu löschen. Die Frist zur Erhebung eines Widerspruchs gegen die beabsichtigte Löschung wird auf 6 Wochen festgesetzt."
    },
    {
      "date": "2025-01-20",
      "id": "98998",
      "original_text": "Löschungsankündigung\nThüringen Amtsgericht Jena HRB 517395\nBEY BAU und IMMOBILIEN UG (haftungsbeschränkt) – Suhl",
      "type": "Löschungsankündigung",
      "state": "Thüringen",
      "amtsgericht": "Amtsgericht Jena",
      "registernummer": "HRB 517395",
      "registerart": "HRB",
      "company_name": "BEY BAU und IMMOBILIEN UG (haftungsbeschränkt)",
      "company_seat": "Suhl",
      "details": "20.01.2025 (Bekanntmachungsdatum)\n\nThüringen Amtsgericht Jena HRB 517395\nLöschungsankündigung\n\nBEY BAU und IMMOBILIEN UG (haftungsbeschränkt)\nGesellschaft mit beschränkter Haftung\nSuhl\n\nDas Registergericht beabsichtigt, die im Handelsregister eingetragene Gesellschaft wegen Vermögenslosigkeit nach § 394 FamFG von Amts wegen zu löschen. Die Frist zur Erhebung eines Widerspruchs gegen die beabsichtigte Löschung wird auf 6 Wochen festgesetzt."
    },
    {
      "date": "2025-01-20",
      "id": "98999",
      "original_text": "Sonstige Registerbekanntmachung\nBaden-Württemberg Amtsgericht Mannheim HRB 709207\nSenio plus GmbH – Schwarzach",
      "type": "Sonstige Registerbekanntmachung",
      "state": "Baden-Württemberg",
      "amtsgericht": "Amtsgericht Mannheim",
      "registernummer": "HRB 709207",
      "registerart": "HRB",
      "company_name": "Senio plus GmbH",
      "company_seat": "Schwarzach",
      "details": "20.01.2025 (Bekanntmachungsdatum)\n\nBaden-Württemberg Amtsgericht Mannheim HRB 709207\nSonstige Registerbekanntmachung 20.01.2025 (Eintragungsdatum)\n\nSenio plus GmbH\nGesellschaft mit beschränkter Haftung\nSchwarzach\n\nDen Gläubigern der Gesellschaft, deren Forderungen begründet worden sind, bevor die Eintragung der Beendigung des Vertrages in das Handelsregister nach § 10 HGB als bekanntgemacht gilt, ist vom anderen Vertragsteil Sicherheit zu leisten, wenn sie sich binnen sechs Monaten nach der Bekanntmachung zu diesem Zweck bei ihm melden."
    },
    {
      "date": "2025-01-20",
      "id": "99000",
      "original_text": "Löschungsankündigung\nBerlin Amtsgericht Berlin (Charlottenburg) HRB 234008\nN. Sajko GmbH – Berlin",
      "type": "Löschungsankündigung",
      "state": "Berlin",
      "amtsgericht": "Amtsgericht Berlin (Charlottenburg)",
      "registernummer": "HRB 234008",
      "registerart": "HRB",
      "company_name": "N. Sajko GmbH",
      "company_seat": "Berlin",
      "details": "20.01.2025 (Bekanntmachungsdatum)\n\nBerlin Amtsgericht Berlin (Charlottenburg) HRB 234008\nLöschungsankündigung\n\nN. Sajko GmbH\nGesellschaft mit beschränkter Haftung\nBerlin\n\nBei der nachstehenden Gesellschaft wird das Amtslöschungsverfahren gemäß § 394 FamFG eingeleitet. Widerspruchsfrist 6 Wochen"
    },
    {
      "date": "2025-01-20",
      "id": "99001",
      "original_text": "Registerbekanntmachung nach dem Umwandlungsgesetz\nBrandenburg Amtsgericht Potsdam HRB 19789\nVeinland GmbH – Seddiner See",
      "type": "Registerbekanntmachung nach dem Umwandlungsgesetz",
      "state": "Brandenburg",
      "amtsgericht": "Amtsgericht Potsdam",
      "registernummer": "HRB 19789",
      "registerart": "HRB",
      "company_name": "Veinland GmbH",
      "company_seat": "Seddiner See",
      "details": "20.01.2025 (Bekanntmachungsdatum)\n\nBrandenburg Amtsgericht Potsdam HRB 19789\nRegisterbekanntmachung nach dem Umwandlungsgesetz 17.01.2025 (Eintragungsdatum)\n\nVeinland GmbH\nGesellschaft mit beschränkter Haftung\nSeddiner See\n\nZu Eintragungsnummer 8 vom 17.01.2025 wird als nicht eingetragen veröffentlicht:\nDen Gläubigern der an der Verschmelzung beteiligten Rechtsträger ist, wenn sie binnen sechs Monaten nach dem Tag, an dem die Eintragung der Verschmelzung in das Register des Sitzes desjenigen Rechtsträgers, dessen Gläubiger sie sind, als bekannt gemacht gilt, ihren Anspruch nach Grund und Höhe schriftlich anmelden, Sicherheit zu leisten, soweit sie nicht Befriedigung verlangen können. Dieses Recht steht den Gläubigern jedoch nur zu, wenn sie glaubhaft machen, dass durch die Verschmelzung die Erfüllung ihrer Forderung gefährdet wird"
    },
    {
      "date": "2025-01-20",
      "id": "99002",
      "original_text": "Sonstige Registerbekanntmachung\nBerlin Amtsgericht Berlin (Charlottenburg) HRB 96548\nBERINTREG GmbH – Berlin",
      "type": "Sonstige Registerbekanntmachung",
      "state": "Berlin",
      "amtsgericht": "Amtsgericht Berlin (Charlottenburg)",
      "registernummer": "HRB 96548",
      "registerart": "HRB",
      "company_name": "BERINTREG GmbH",
      "company_seat": "Berlin",
      "details": "20.01.2025 (Bekanntmachungsdatum)\n\nBerlin Amtsgericht Berlin (Charlottenburg) HRB 96548\nSonstige Registerbekanntmachung\n\nBERINTREG GmbH\nGesellschaft mit beschränkter Haftung\nBerlin\n\nAls nicht eingetragen wird veröffentlicht:\nIn dem unternehmensrechtlichen Verfahren der BERINTREG GmbH, HRB 96548 B, liegt dem Registergericht ein Antrag vom 07.10.2024, ergänzt am 11.11.2024, 21.11.2024 sowie 05.12.2024, eingegangen am 13.01.2025, mit folgendem Inhalt vor:\n\"[...] beantragt,\nI. für die BERINTREG GmbH, Segelfliegerdamm 67, 12487 Berlin, die Nachtragsliquidation anzuordnen und Rechtsanwalt Sascha Borowski, c/o Buchalik Brömmekamp Rechtsanwaltsgesellschaft mbH, [...] als Nachtragsliquidator zu bestellen, um der Freigabe des beim Amtsgericht München, Hinterlegungsstelle, unter dem Aktenzeichen 38 HL 1133/08 hinterlegten Betrages an den Antragsteller zuzustimmen.\n[...]\nDas Registergericht beabsichtigt zum jetzigen Zeitpunkt diesem Antrag stattzugeben, soweit nicht binnen einer Frist von einem Monat ab Veröffentlichung Widerspruch erhoben wird. Der Widerspruch ist schriftlich oder elektronisch bei dem Amtsgericht Charlottenburg, Dienstgebäude Hardenbergstraße 31, 10623 Berlin, zum Registerzeichen HRB 96548 B begründet einzureichen. Anderenfalls kann keine Berücksichtigung im hiesigen Verfahren erfolgen."
    },
    {
      "date": "2025-01-20",
      "id": "99003",
      "original_text": "Löschungsankündigung\nSchleswig-Holstein Amtsgericht Lübeck HRB 1974 OD\nHDK Hanseatische Debitoren Kontrolle Mahnwesen und Inkasso GmbH – Bad Oldesloe",
      "type": "Löschungsankündigung",
      "state": "Schleswig-Holstein",
      "amtsgericht": "Amtsgericht Lübeck",
      "registernummer": "HRB 1974 OD",
      "registerart": "HRB",
      "company_name": "HDK Hanseatische Debitoren Kontrolle Mahnwesen und Inkasso GmbH",
      "company_seat": "Bad Oldesloe",
      "details": "20.01.2025 (Bekanntmachungsdatum)\n\nSchleswig-Holstein Amtsgericht Lübeck HRB 1974 OD\nLöschungsankündigung\n\nHDK Hanseatische Debitoren Kontrolle Mahnwesen und Inkasso GmbH\nGesellschaft mit beschränkter Haftung\nBad Oldesloe\n\nEs ist die Löschung der nachstehenden Gesellschaft wegen Vermögenslosigkeit gemäß § 394 FamFG beabsichtigt."
    },
    {
      "date": "2025-01-20",
      "id": "99004",
      "original_text": "Löschungsankündigung\nMecklenburg-Vorpommern Amtsgericht Stralsund HRB 8719\nKrieger Solar GmbH – Wolgast",
      "type": "Löschungsankündigung",
      "state": "Mecklenburg-Vorpommern",
      "amtsgericht": "Amtsgericht Stralsund",
      "registernummer": "HRB 8719",
      "registerart": "HRB",
      "company_name": "Krieger Solar GmbH",
      "company_seat": "Wolgast",
      "details": "20.01.2025 (Bekanntmachungsdatum)\n\nMecklenburg-Vorpommern Amtsgericht Stralsund HRB 8719\nLöschungsankündigung 20.01.2025 (Eintragungsdatum)\n\nKrieger Solar GmbH\nGesellschaft mit beschränkter Haftung\nWolgast\n\nDas Registergericht beabsichtigt, die im Handelsregister eingetragene Gesellschaft von Amts wegen nach § 394 FamFG zu löschen. Die Frist zur Erhebung eines Widerspruchs gegen die beabsichtigte Löschung wird auf 1 Monat festgesetzt."
    },
    {
      "date": "2025-01-20",
      "id": "99005",
      "original_text": "Einreichung neuer Dokumente\nBaden-Württemberg Amtsgericht Stuttgart HRB 746451\nVoigt Software und Beratung AG – Ilsfeld",
      "type": "Einreichung neuer Dokumente",
      "state": "Baden-Württemberg",
      "amtsgericht": "Amtsgericht Stuttgart",
      "registernummer": "HRB 746451",
      "registerart": "HRB",
      "company_name": "Voigt Software und Beratung AG",
      "company_seat": "Ilsfeld",
      "details": "20.01.2025 (Bekanntmachungsdatum)\n\nBaden-Württemberg Amtsgericht Stuttgart HRB 746451\nEinreichung neuer Dokumente\n\nVoigt Software und Beratung AG\nAktiengesellschaft\nIlsfeld\n\nDie Gesellschaft hat am 20.01.2025 die Liste über die Zusammensetzung des Aufsichtsrats zum Handelsregister eingereicht."
    },
    {
      "date": "2025-01-20",
      "id": "99006",
      "original_text": "Registerbekanntmachung nach dem Umwandlungsgesetz\nBrandenburg Amtsgericht Cottbus HRB 12550\nHandelshof Cottbus Stahlverarbeitungs GmbH - Partner für Technik – Cottbus",
      "type": "Registerbekanntmachung nach dem Umwandlungsgesetz",
      "state": "Brandenburg",
      "amtsgericht": "Amtsgericht Cottbus",
      "registernummer": "HRB 12550",
      "registerart": "HRB",
      "company_name": "Handelshof Cottbus Stahlverarbeitungs GmbH - Partner für Technik",
      "company_seat": "Cottbus",
      "details": "20.01.2025 (Bekanntmachungsdatum)\n\nBrandenburg Amtsgericht Cottbus HRB 12550\nRegisterbekanntmachung nach dem Umwandlungsgesetz 17.01.2025 (Eintragungsdatum)\n\nHandelshof Cottbus Stahlverarbeitungs GmbH - Partner für Technik\nGesellschaft mit beschränkter Haftung\nCottbus\n\nZu Eintragungsnummer 3 vom 17.01.2025 wird als nicht eingetragen veröffentlicht: Als nicht eingetragen wird veröffentlicht:\nDen Gläubigern der an der Verschmelzung beteiligten Rechtsträger ist, wenn sie binnen sechs Monaten nach dem Tag, an dem die Eintragung der Verschmelzung in das Register des Sitzes desjenigen Rechtsträgers, dessen Gläubiger sie sind, als bekannt gemacht gilt, ihren Anspruch nach Grund und Höhe schriftlich anmelden, Sicherheit zu leisten, soweit sie nicht Befriedigung verlangen können. Dieses Recht steht den Gläubigern jedoch nur zu, wenn sie glaubhaft machen, dass durch die Verschmelzung die Erfüllung ihrer Forderung gefährdet wird"
    },
    {
      "date": "2025-01-20",
      "id": "99007",
      "original_text": "Löschungsankündigung\nMecklenburg-Vorpommern Amtsgericht Stralsund HRB 7937\nEngineering Support and Intellectual Solutions GmbH (ESIS GmbH) – Greifswald",
      "type": "Löschungsankündigung",
      "state": "Mecklenburg-Vorpommern",
      "amtsgericht": "Amtsgericht Stralsund",
      "registernummer": "HRB 7937",
      "registerart": "HRB",
      "company_name": "Engineering Support and Intellectual Solutions GmbH (ESIS GmbH)",
      "company_seat": "Greifswald",
      "details": "20.01.2025 (Bekanntmachungsdatum)\n\nMecklenburg-Vorpommern Amtsgericht Stralsund HRB 7937\nLöschungsankündigung 20.01.2025 (Eintragungsdatum)\n\nEngineering Support and Intellectual Solutions GmbH (ESIS GmbH)\nGesellschaft mit beschränkter Haftung\nGreifswald\n\nDas Registergericht beabsichtigt, die im Handelsregister eingetragene Gesellschaft von Amts wegen nach § 394 FamFG zu löschen. Die Frist zur Erhebung eines Widerspruchs gegen die beabsichtigte Löschung wird auf 1 Monat festgesetzt."
    },
    {
      "date": "2025-01-20",
      "id": "99008",
      "original_text": "Einreichung neuer Dokumente\nBaden-Württemberg Amtsgericht Stuttgart HRB 23388\nLBBW Immobilien Management GmbH – Stuttgart",
      "type": "Einreichung neuer Dokumente",
      "state": "Baden-Württemberg",
      "amtsgericht": "Amtsgericht Stuttgart",
      "registernummer": "HRB 23388",
      "registerart": "HRB",
      "company_name": "LBBW Immobilien Management GmbH",
      "company_seat": "Stuttgart",
      "details": "20.01.2025 (Bekanntmachungsdatum)\n\nBaden-Württemberg Amtsgericht Stuttgart HRB 23388\nEinreichung neuer Dokumente\n\nLBBW Immobilien Management GmbH\nGesellschaft mit beschränkter Haftung\nStuttgart\n\nDie Gesellschaft hat am 17.01.2025 die Liste über die Zusammensetzung des Aufsichtsrats zum Handelsregister eingereicht."
    },
    {
      "date": "2025-01-20",
      "id": "99009",
      "original_text": "Registerbekanntmachung nach dem Umwandlungsgesetz\nBaden-Württemberg Amtsgericht Mannheim HRB 511739\nSander Steuerberatungsgesellschaft mbH – Illingen",
      "type": "Registerbekanntmachung nach dem Umwandlungsgesetz",
      "state": "Baden-Württemberg",
      "amtsgericht": "Amtsgericht Mannheim",
      "registernummer": "HRB 511739",
      "registerart": "HRB",
      "company_name": "Sander Steuerberatungsgesellschaft mbH",
      "company_seat": "Illingen",
      "details": "20.01.2025 (Bekanntmachungsdatum)\n\nBaden-Württemberg Amtsgericht Mannheim HRB 511739\nRegisterbekanntmachung nach dem Umwandlungsgesetz 20.01.2025 (Eintragungsdatum)\n\nSander Steuerberatungsgesellschaft mbH\nGesellschaft mit beschränkter Haftung\nIllingen\n\nDen Gläubigern der an der Verschmelzung beteiligten Rechtsträger ist, wenn sie binnen sechs Monaten nach dem Tag, an dem die Eintragung der Verschmelzung in das Register des Sitzes desjenigen Rechtsträgers, dessen Gläubiger sie sind, nach § 19 Abs. 3 UmwG als bekanntgemacht gilt, ihren Anspruch nach Grund und Höhe schriftlich anmelden, Sicherheit zu leisten, soweit sie nicht Befriedigung verlangen können. Dieses Recht steht den Gläubigern jedoch nur zu, wenn sie glaubhaft machen, dass durch die Verschmelzung die Erfüllung ihrer Forderung gefährdet wird."
    },
    {
      "date": "2025-01-20",
      "id": "99010",
      "original_text": "Löschungsankündigung\nSchleswig-Holstein Amtsgericht Flensburg HRB 12392\nHaferl Projektentwicklung Verwaltungs-GmbH – Poppenbüll",
      "type": "Löschungsankündigung",
      "state": "Schleswig-Holstein",
      "amtsgericht": "Amtsgericht Flensburg",
      "registernummer": "HRB 12392",
      "registerart": "HRB",
      "company_name": "Haferl Projektentwicklung Verwaltungs-GmbH",
      "company_seat": "Poppenbüll",
      "details": "20.01.2025 (Bekanntmachungsdatum)\n\nSchleswig-Holstein Amtsgericht Flensburg HRB 12392\nLöschungsankündigung\n\nHaferl Projektentwicklung Verwaltungs-GmbH\nGesellschaft mit beschränkter Haftung\nPoppenbüll\n\nBei der nachstehenden Gesellschaft wird das Amtslöschungsverfahren gemäß § 395 FamFG eingeleitet.\nWiderspruchsfrist: 1 Monat."
    },
    {
      "date": "2025-01-20",
      "id": "99011",
      "original_text": "Einreichung neuer Dokumente\nBrandenburg Amtsgericht Frankfurt/Oder HRB 3883\nArcelorMittal Eisenhüttenstadt GmbH – Eisenhüttenstadt",
      "type": "Einreichung neuer Dokumente",
      "state": "Brandenburg",
      "amtsgericht": "Amtsgericht Frankfurt/Oder",
      "registernummer": "HRB 3883",
      "registerart": "HRB",
      "company_name": "ArcelorMittal Eisenhüttenstadt GmbH",
      "company_seat": "Eisenhüttenstadt",
      "details": "20.01.2025 (Bekanntmachungsdatum)\n\nBrandenburg Amtsgericht Frankfurt/Oder HRB 3883\nEinreichung neuer Dokumente\n\nArcelorMittal Eisenhüttenstadt GmbH\nGesellschaft mit beschränkter Haftung\nEisenhüttenstadt\n\nAls nicht eingetragen wird veröffentlicht: Als nicht eingetragen wird veröffentlicht: Eine Liste der Mitglieder des Aufsichtsrates wurde zum Handelsregister eingereicht."
    },
    {
      "date": "2025-01-20",
      "id": "99012",
      "original_text": "Einreichung neuer Dokumente\nBrandenburg Amtsgericht Frankfurt/Oder HRB 3444\nStadtwerke Eisenhüttenstadt, Gesellschaft mit beschränkter Haftung – Eisenhüttenstadt",
      "type": "Einreichung neuer Dokumente",
      "state": "Brandenburg",
      "amtsgericht": "Amtsgericht Frankfurt/Oder",
      "registernummer": "HRB 3444",
      "registerart": "HRB",
      "company_name": "Stadtwerke Eisenhüttenstadt, Gesellschaft mit beschränkter Haftung",
      "company_seat": "Eisenhüttenstadt",
      "details": "20.01.2025 (Bekanntmachungsdatum)\n\nBrandenburg Amtsgericht Frankfurt/Oder HRB 3444\nEinreichung neuer Dokumente\n\nStadtwerke Eisenhüttenstadt, Gesellschaft mit beschränkter Haftung\nGesellschaft mit beschränkter Haftung\nEisenhüttenstadt\n\nAls nicht eingetragen wird veröffentlicht: Als nicht eingetragen wird veröffentlicht: Eine Liste der Mitglieder des Aufsichtsrates wurde zum Handelsregister eingereicht."
    },
    {
      "date": "2025-01-20",
      "id": "99013",
      "original_text": "Registerbekanntmachung nach dem Umwandlungsgesetz\nBrandenburg Amtsgericht Cottbus HRB 16434\nRenata gGmbH – Schönefeld",
      "type": "Registerbekanntmachung nach dem Umwandlungsgesetz",
      "state": "Brandenburg",
      "amtsgericht": "Amtsgericht Cottbus",
      "registernummer": "HRB 16434",
      "registerart": "HRB",
      "company_name": "Renata gGmbH",
      "company_seat": "Schönefeld",
      "details": "20.01.2025 (Bekanntmachungsdatum)\n\nBrandenburg Amtsgericht Cottbus HRB 16434\nRegisterbekanntmachung nach dem Umwandlungsgesetz 16.01.2025 (Eintragungsdatum)\n\nRenata gGmbH\nGesellschaft mit beschränkter Haftung\nSchönefeld\n\nAls nicht eingetragen wird veröffentlicht:\nDen Gläubigern der an der Verschmelzung beteiligten Rechtsträger ist, wenn sie binnen sechs Monaten nach dem Tag, an dem die Eintragung der Verschmelzung in das Register des Sitzes desjenigen Rechtsträgers, dessen Gläubiger sie sind, als bekannt gemacht gilt, ihren Anspruch nach Grund und Höhe schriftlich anmelden, Sicherheit zu leisten, soweit sie nicht Befriedigung verlangen können. Dieses Recht steht den Gläubigern jedoch nur zu, wenn sie glaubhaft machen, dass durch die Verschmelzung die Erfüllung ihrer Forderung gefährdet wird"
    },
    {
      "date": "2025-01-20",
      "id": "99014",
      "original_text": "Löschungsankündigung\nBaden-Württemberg Amtsgericht Freiburg HRB 726252\nSempre Gusto GmbH – Weil am Rhein",
      "type": "Löschungsankündigung",
      "state": "Baden-Württemberg",
      "amtsgericht": "Amtsgericht Freiburg",
      "registernummer": "HRB 726252",
      "registerart": "HRB",
      "company_name": "Sempre Gusto GmbH",
      "company_seat": "Weil am Rhein",
      "details": "20.01.2025 (Bekanntmachungsdatum)\n\nBaden-Württemberg Amtsgericht Freiburg HRB 726252\nLöschungsankündigung 20.01.2025 (Eintragungsdatum)\n\nSempre Gusto GmbH\nGesellschaft mit beschränkter Haftung\nWeil am Rhein\n\nAls nicht eingetragen wird bekanntgemacht:\nDas Gericht beabsichtigt, die Gesellschaft wegen Vermögenslosigkeit im Handelsregister von Amts wegen nach § 394 FamFG zu löschen. Die Frist zur Geltendmachung eines Widerspruchs gegen die beabsichtigte Löschung ist auf einen Monat ab Veröffentlichung bestimmt."
    },
    {
      "date": "2025-01-20",
      "id": "99015",
      "original_text": "Registerbekanntmachung nach dem Umwandlungsgesetz\nHamburg Amtsgericht Hamburg HRB 152288\nsolar-konzept International GmbH – Hamburg",
      "type": "Registerbekanntmachung nach dem Umwandlungsgesetz",
      "state": "Hamburg",
      "amtsgericht": "Amtsgericht Hamburg",
      "registernummer": "HRB 152288",
      "registerart": "HRB",
      "company_name": "solar-konzept International GmbH",
      "company_seat": "Hamburg",
      "details": "20.01.2025 (Bekanntmachungsdatum)\n\nHamburg Amtsgericht Hamburg HRB 152288\nRegisterbekanntmachung nach dem Umwandlungsgesetz 20.01.2025 (Eintragungsdatum)\n\nsolar-konzept International GmbH\nGesellschaft mit beschränkter Haftung\nHamburg\n\nAls nicht eingetragen wird bekannt gemacht:\nDen Gläubigern der an der Verschmelzung beteiligten Gesellschaften ist, wenn sie binnen sechs Monaten nach dem Tag, an dem die Eintragung der Verschmelzung in das Register des Sitzes desjenigen Rechtsträgers, dessen Gläubiger sie sind, nach § 19 Absatz 3 UmwG als bekannt gemacht gilt, ihren Anspruch nach Grund und Höhe schriftlich anmelden, Sicherheit zu leisten, soweit sie nicht Befriedigung verlangen können. Dieses Recht steht den Gläubigern jedoch nur zu, wenn sie glaubhaft machen, dass durch die Verschmelzung die Erfüllung ihrer Forderung gefährdet wird."
    },
    {
      "date": "2025-01-20",
      "id": "99016",
      "original_text": "Registerbekanntmachung nach dem Umwandlungsgesetz\nHamburg Amtsgericht Hamburg HRB 172123\nAquila Capital Clean Energy Holding GmbH – Hamburg",
      "type": "Registerbekanntmachung nach dem Umwandlungsgesetz",
      "state": "Hamburg",
      "amtsgericht": "Amtsgericht Hamburg",
      "registernummer": "HRB 172123",
      "registerart": "HRB",
      "company_name": "Aquila Capital Clean Energy Holding GmbH",
      "company_seat": "Hamburg",
      "details": "20.01.2025 (Bekanntmachungsdatum)\n\nHamburg Amtsgericht Hamburg HRB 172123\nRegisterbekanntmachung nach dem Umwandlungsgesetz 20.01.2025 (Eintragungsdatum)\n\nAquila Capital Clean Energy Holding GmbH\nGesellschaft mit beschränkter Haftung\nHamburg\n\nAls nicht eingetragen wird bekannt gemacht:\nDen Gläubigern der an der Verschmelzung beteiligten Gesellschaften ist, wenn sie binnen sechs Monaten nach dem Tag, an dem die Eintragung der Verschmelzung in das Register des Sitzes desjenigen Rechtsträgers, dessen Gläubiger sie sind, nach § 19 Absatz 3 UmwG als bekannt gemacht gilt, ihren Anspruch nach Grund und Höhe schriftlich anmelden, Sicherheit zu leisten, soweit sie nicht Befriedigung verlangen können. Dieses Recht steht den Gläubigern jedoch nur zu, wenn sie glaubhaft machen, dass durch die Verschmelzung die Erfüllung ihrer Forderung gefährdet wird."
    },
    {
      "date": "2025-01-20",
      "id": "99017",
      "original_text": "Registerbekanntmachung nach dem Umwandlungsgesetz\nSaarland Amtsgericht Saarbrücken HRB 106624\nInTax GmbH Steuerberatungsgesellschaft – Saarbrücken",
      "type": "Registerbekanntmachung nach dem Umwandlungsgesetz",
      "state": "Saarland",
      "amtsgericht": "Amtsgericht Saarbrücken",
      "registernummer": "HRB 106624",
      "registerart": "HRB",
      "company_name": "InTax GmbH Steuerberatungsgesellschaft",
      "company_seat": "Saarbrücken",
      "details": "20.01.2025 (Bekanntmachungsdatum)\n\nSaarland Amtsgericht Saarbrücken HRB 106624\nRegisterbekanntmachung nach dem Umwandlungsgesetz 20.01.2025 (Eintragungsdatum)\n\nInTax GmbH Steuerberatungsgesellschaft\nGesellschaft mit beschränkter Haftung\nSaarbrücken\n\nAls nicht eingetragen wird bekannt gemacht: Den Gläubigern der an der Verschmelzung beteiligten Gesellschaften ist, wenn sie binnen sechs Monaten nach dem Tag, an dem die Eintragung der Verschmelzung in das Register des Sitzes desjenigen Rechtsträgers, dessen Gläubiger sie sind, nach § 19 Absatz 3 UmwG bekannt gemacht worden ist, ihren Anspruch nach Grund und Höhe schriftlich anmelden, Sicherheit zu leisten, soweit sie nicht Befriedigung verlangen können. Dieses Recht steht den Gläubigern jedoch nur zu, wenn sie glaubhaft machen, dass durch die Verschmelzung die Erfüllung ihrer Forderung gefährdet wird."
    },
    {
      "date": "2025-01-20",
      "id": "99018",
      "original_text": "Registerbekanntmachung nach dem Umwandlungsgesetz\nSaarland Amtsgericht Saarbrücken HRB 11324\nPublic Audit Revision GmbH Wirtschaftsprüfungsgesellschaft – Saarbrücken",
      "type": "Registerbekanntmachung nach dem Umwandlungsgesetz",
      "state": "Saarland",
      "amtsgericht": "Amtsgericht Saarbrücken",
      "registernummer": "HRB 11324",
      "registerart": "HRB",
      "company_name": "Public Audit Revision GmbH Wirtschaftsprüfungsgesellschaft",
      "company_seat": "Saarbrücken",
      "details": "20.01.2025 (Bekanntmachungsdatum)\n\nSaarland Amtsgericht Saarbrücken HRB 11324\nRegisterbekanntmachung nach dem Umwandlungsgesetz 20.01.2025 (Eintragungsdatum)\n\nPublic  Audit Revision GmbH Wirtschaftsprüfungsgesellschaft\nGesellschaft mit beschränkter Haftung\nSaarbrücken\n\nAls nicht eingetragen wird bekannt gemacht: Den Gläubigern der an der Verschmelzung beteiligten Gesellschaften ist, wenn sie binnen sechs Monaten nach dem Tag, an dem die Eintragung der Verschmelzung in das Register des Sitzes desjenigen Rechtsträgers, dessen Gläubiger sie sind, nach § 19 Absatz 3 UmwG bekannt gemacht worden ist, ihren Anspruch nach Grund und Höhe schriftlich anmelden, Sicherheit zu leisten, soweit sie nicht Befriedigung verlangen können. Dieses Recht steht den Gläubigern jedoch nur zu, wenn sie glaubhaft machen, dass durch die Verschmelzung die Erfüllung ihrer Forderung gefährdet wird."
    },
    {
      "date": "2025-01-20",
      "id": "99019",
      "original_text": "Einreichung neuer Dokumente\nSachsen Amtsgericht Chemnitz HRB 9661\nC³ Chemnitzer Veranstaltungszentren GmbH – Chemnitz",
      "type": "Einreichung neuer Dokumente",
      "state": "Sachsen",
      "amtsgericht": "Amtsgericht Chemnitz",
      "registernummer": "HRB 9661",
      "registerart": "HRB",
      "company_name": "C³ Chemnitzer Veranstaltungszentren GmbH",
      "company_seat": "Chemnitz",
      "details": "20.01.2025 (Bekanntmachungsdatum)\n\nSachsen Amtsgericht Chemnitz HRB 9661\nEinreichung neuer Dokumente 16.01.2025 (Eintragungsdatum)\n\nC³ Chemnitzer Veranstaltungszentren GmbH\nGesellschaft mit beschränkter Haftung\nChemnitz\n\nAm 16.01.2025 wurde beim Handelsregister des Amtsgerichts Chemnitz die Liste der Mitglieder des Aufsichtsrats gemäß § 52 GmbHG eingereicht."
    },
    {
      "date": "2025-01-20",
      "id": "99020",
      "original_text": "Registerbekanntmachung nach dem Umwandlungsgesetz\nSachsen Amtsgericht Chemnitz HRA 10122\nPrüfdienst Neike e.K. – Hartha",
      "type": "Registerbekanntmachung nach dem Umwandlungsgesetz",
      "state": "Sachsen",
      "amtsgericht": "Amtsgericht Chemnitz",
      "registernummer": "HRA 10122",
      "registerart": "HRA",
      "company_name": "Prüfdienst Neike e.K.",
      "company_seat": "Hartha",
      "details": "20.01.2025 (Bekanntmachungsdatum)\n\nSachsen Amtsgericht Chemnitz HRA 10122\nRegisterbekanntmachung nach dem Umwandlungsgesetz 20.01.2025 (Eintragungsdatum)\n\nPrüfdienst Neike e.K.\nEinzelkaufmann / Einzelkauffrau\nHartha\n\nDen Gläubigern der an der Ausgliederung beteiligten Rechtsträger ist, wenn sie binnen sechs Monaten nach dem Tag, an dem die Eintragung der Ausgliederung in das Register des Sitzes desjenigen Rechtsträgers, dessen Gläubiger sie sind, nach § 19 Abs. 3 UmwG als bekannt gemacht gilt, ihren Anspruch nach Grund und Höhe in Textform anmelden, Sicherheit zu leisten, soweit sie nicht Befriedigung verlangen können. Dieses Recht steht den Gläubigern jedoch nur zu, wenn sie glaubhaft machen, dass durch die Ausgliederung die Erfüllung der Forderung gefährdet wird."
    },
    {
      "date": "2025-01-20",
      "id": "99021",
      "original_text": "Registerbekanntmachung nach dem Umwandlungsgesetz\nSachsen Amtsgericht Chemnitz HRB 37102\nReinhard Neike GmbH – Hartha",
      "type": "Registerbekanntmachung nach dem Umwandlungsgesetz",
      "state": "Sachsen",
      "amtsgericht": "Amtsgericht Chemnitz",
      "registernummer": "HRB 37102",
      "registerart": "HRB",
      "company_name": "Reinhard Neike GmbH",
      "company_seat": "Hartha",
      "details": "20.01.2025 (Bekanntmachungsdatum)\n\nSachsen Amtsgericht Chemnitz HRB 37102\nRegisterbekanntmachung nach dem Umwandlungsgesetz 20.01.2025 (Eintragungsdatum)\n\nReinhard Neike GmbH\nGesellschaft mit beschränkter Haftung\nHartha\n\nDen Gläubigern der an der Ausgliederung beteiligten Rechtsträger ist, wenn sie binnen sechs Monaten nach dem Tag, an dem die Eintragung der Ausgliederung in das Register des Sitzes desjenigen Rechtsträgers, dessen Gläubiger sie sind, nach § 19 Abs. 3 UmwG als bekannt gemacht gilt, ihren Anspruch nach Grund und Höhe in Textform anmelden, Sicherheit zu leisten, soweit sie nicht Befriedigung verlangen können. Dieses Recht steht den Gläubigern jedoch nur zu, wenn sie glaubhaft machen, dass durch die Ausgliederung die Erfüllung der Forderung gefährdet wird."
    },
    {
      "date": "2025-01-20",
      "id": "99022",
      "original_text": "Einreichung neuer Dokumente\nSachsen Amtsgericht Chemnitz HRB 13979\nBeschäftigungsförderung Zwickau gemeinnützige GmbH der Stadt Zwickau \"BFZ\" – Zwickau",
      "type": "Einreichung neuer Dokumente",
      "state": "Sachsen",
      "amtsgericht": "Amtsgericht Chemnitz",
      "registernummer": "HRB 13979",
      "registerart": "HRB",
      "company_name": "Beschäftigungsförderung Zwickau gemeinnützige GmbH der Stadt Zwickau \"BFZ\"",
      "company_seat": "Zwickau",
      "details": "20.01.2025 (Bekanntmachungsdatum)\n\nSachsen Amtsgericht Chemnitz HRB 13979\nEinreichung neuer Dokumente\n\nBeschäftigungsförderung Zwickau gemeinnützige GmbH der Stadt Zwickau \"BFZ\"\nGesellschaft mit beschränkter Haftung\nZwickau\n\nAm 14.01.2025 wurde beim Handelsregister des Amtsgerichts Chemnitz die Liste der Mitglieder des Aufsichtsrats gemäß § 52 GmbHG eingereicht."
    },
    {
      "date": "2025-01-20",
      "id": "99023",
      "original_text": "Einreichung neuer Dokumente\nSachsen Amtsgericht Leipzig HRB 3775\nKommunale Wasserwerke Leipzig GmbH – Leipzig",
      "type": "Einreichung neuer Dokumente",
      "state": "Sachsen",
      "amtsgericht": "Amtsgericht Leipzig",
      "registernummer": "HRB 3775",
      "registerart": "HRB",
      "company_name": "Kommunale Wasserwerke Leipzig GmbH",
      "company_seat": "Leipzig",
      "details": "20.01.2025 (Bekanntmachungsdatum)\n\nSachsen Amtsgericht Leipzig HRB 3775\nEinreichung neuer Dokumente\n\nKommunale Wasserwerke Leipzig GmbH\nGesellschaft mit beschränkter Haftung\nLeipzig\n\nAm 15.01.2025 wurde beim Handelsregister des Amtsgerichts Leipzig die Liste der Mitglieder des Aufsichtsrats gemäß § 52 GmbHG eingereicht."
    },
    {
      "date": "2025-01-20",
      "id": "99024",
      "original_text": "Registerbekanntmachung nach dem Umwandlungsgesetz\nSachsen Amtsgericht Leipzig HRB 21990\nBUK Betriebliche Unterstützungskasse GmbH – Leipzig",
      "type": "Registerbekanntmachung nach dem Umwandlungsgesetz",
      "state": "Sachsen",
      "amtsgericht": "Amtsgericht Leipzig",
      "registernummer": "HRB 21990",
      "registerart": "HRB",
      "company_name": "BUK Betriebliche Unterstützungskasse GmbH",
      "company_seat": "Leipzig",
      "details": "20.01.2025 (Bekanntmachungsdatum)\n\nSachsen Amtsgericht Leipzig HRB 21990\nRegisterbekanntmachung nach dem Umwandlungsgesetz 20.01.2025 (Eintragungsdatum)\n\nBUK Betriebliche Unterstützungskasse GmbH\nGesellschaft mit beschränkter Haftung\nLeipzig\n\nDen Gläubigern der an der Ausgliederung beteiligten Rechtsträger ist, wenn sie binnen sechs Monaten nach dem Tag, an dem die Eintragung der Ausgliederung in das Register des Sitzes desjenigen Rechtsträgers, dessen Gläubiger sie sind, nach § 19 Abs. 3 UmwG als bekannt gemacht gilt, ihren Anspruch nach Grund und Höhe in Textform anmelden, Sicherheit zu leisten, soweit sie nicht Befriedigung verlangen können. Dieses Recht steht den Gläubigern jedoch nur zu, wenn sie glaubhaft machen, dass durch die Ausgliederung die Erfüllung der Forderung gefährdet wird."
    },
    {
      "date": "2025-01-20",
      "id": "99025",
      "original_text": "Registerbekanntmachung nach dem Umwandlungsgesetz\nNiedersachsen Amtsgericht Lüneburg HRB 210403\nArt of BBQ UG (haftungsbeschränkt) – Lachendorf",
      "type": "Registerbekanntmachung nach dem Umwandlungsgesetz",
      "state": "Niedersachsen",
      "amtsgericht": "Amtsgericht Lüneburg",
      "registernummer": "HRB 210403",
      "registerart": "HRB",
      "company_name": "Art of BBQ UG (haftungsbeschränkt)",
      "company_seat": "Lachendorf",
      "details": "20.01.2025 (Bekanntmachungsdatum)\n\nNiedersachsen Amtsgericht Lüneburg HRB 210403\nRegisterbekanntmachung nach dem Umwandlungsgesetz 17.01.2025 (Eintragungsdatum)\n\nArt of BBQ UG (haftungsbeschränkt)\nGesellschaft mit beschränkter Haftung\nLachendorf\n\nDen Gläubigern der an der Verschmelzung beteiligten Rechtsträger ist, wenn sie binnen sechs Monaten nach dem Tag, an dem die Eintragung der Verschmelzung in das Register des Sitzes desjenigen Rechtsträgers, dessen Gläubiger sie sind, nach § 19  Abs.  3 UmwG als bekannt gemacht gilt, ihren Anspruch nach Grund und Höhe schriftlich anmelden, Sicherheit zu leisten, soweit sie nicht Befriedigung verlangen können. Dieses Recht steht den Gläubigern jedoch nur zu, wenn sie glaubhaft machen, dass durch die Verschmelzung die Erfüllung der Forderung gefährdet wird."
    },
    {
      "date": "2025-01-20",
      "id": "99026",
      "original_text": "Löschungsankündigung\nNiedersachsen Amtsgericht Lüneburg HRB 207116\nKrasniqi Unternehmergesellschaft (haftungsbeschränkt) – Bleckede",
      "type": "Löschungsankündigung",
      "state": "Niedersachsen",
      "amtsgericht": "Amtsgericht Lüneburg",
      "registernummer": "HRB 207116",
      "registerart": "HRB",
      "company_name": "Krasniqi Unternehmergesellschaft (haftungsbeschränkt)",
      "company_seat": "Bleckede",
      "details": "20.01.2025 (Bekanntmachungsdatum)\n\nNiedersachsen Amtsgericht Lüneburg HRB 207116\nLöschungsankündigung\n\nKrasniqi Unternehmergesellschaft (haftungsbeschränkt)\nGesellschaft mit beschränkter Haftung\nBleckede\n\nDas Registergericht beabsichtigt, die Gesellschaft von Amts wegen nach § 394 FamFG zu löschen. Die Frist zur Erhebung eines Widerspruchs ist auf 2 Monate ab dieser Registerbekanntmachung festgesetzt."
    },
    {
      "date": "2025-01-20",
      "id": "99027",
      "original_text": "Sonstige Registerbekanntmachung\nNiedersachsen Amtsgericht Oldenburg (Oldenburg) GnR 150010 früher Amtsgericht Cloppenburg\nVolksbank Lastrup eG – Lastrup",
      "type": "Sonstige Registerbekanntmachung",
      "state": "Niedersachsen",
      "amtsgericht": "Amtsgericht Oldenburg (Oldenburg)",
      "registernummer": "GnR 150010",
      "registerart": "GnR",
      "company_name": "Volksbank Lastrup eG",
      "company_seat": "Lastrup",
      "former_amtsgericht": "Cloppenburg",
      "details": "20.01.2025 (Bekanntmachungsdatum)\n\nNiedersachsen Amtsgericht Oldenburg (Oldenburg) GnR 150010 früher Amtsgericht Cloppenburg\nSonstige Registerbekanntmachung 20.01.2025 (Eintragungsdatum)\n\nVolksbank Lastrup eG\neingetragene Genossenschaft\nLastrup\n\nNeue Regelung: Eine Nachschusspflicht der Mitglieder ist ausgeschlossen. Den Gläubigern der Genossenschaft ist, wenn sie sich binnen sechs Monaten nach dieser Bekanntmachung zu diesem Zweck bei der Genossenschaft melden, Sicherheit zu leisten, soweit sie nicht Befriedigung verlangen können."
    },
    {
      "date": "2025-01-20",
      "id": "99028",
      "original_text": "Sonstige Registerbekanntmachung\nNiedersachsen Amtsgericht Lüneburg HRB 209718\nSeniorenpark Rethem GmbH – Winsen (Aller)",
      "type": "Sonstige Registerbekanntmachung",
      "state": "Niedersachsen",
      "amtsgericht": "Amtsgericht Lüneburg",
      "registernummer": "HRB 209718",
      "registerart": "HRB",
      "company_name": "Seniorenpark Rethem GmbH",
      "company_seat": "Winsen (Aller)",
      "details": "20.01.2025 (Bekanntmachungsdatum)\n\nNiedersachsen Amtsgericht Lüneburg HRB 209718\nSonstige Registerbekanntmachung 20.01.2025 (Eintragungsdatum)\n\nSeniorenpark Rethem GmbH\nGesellschaft mit beschränkter Haftung\nWinsen (Aller)\n\nDen Gläubigern der Gesellschaft, deren Forderungen begründet worden sind, bevor die Eintragung der Beendigung des Vertrages in das Handelsregister nach § 10 HGB als bekanntgemacht gilt, ist vom anderen Vertragsteil Sicherheit zu leisten, wenn sie sich binnen sechs Monaten nach der Bekanntmachung zu diesem Zweck bei ihm melden."
    },
    {
      "date": "2025-01-20",
      "id": "99029",
      "original_text": "Registerbekanntmachung nach dem Umwandlungsgesetz\nNiedersachsen Amtsgericht Lüneburg HRB 206074\nCEWOX UG (haftungsbeschränkt) – Lachendorf",
      "type": "Registerbekanntmachung nach dem Umwandlungsgesetz",
      "state": "Niedersachsen",
      "amtsgericht": "Amtsgericht Lüneburg",
      "registernummer": "HRB 206074",
      "registerart": "HRB",
      "company_name": "CEWOX UG (haftungsbeschränkt)",
      "company_seat": "Lachendorf",
      "details": "20.01.2025 (Bekanntmachungsdatum)\n\nNiedersachsen Amtsgericht Lüneburg HRB 206074\nRegisterbekanntmachung nach dem Umwandlungsgesetz 17.01.2025 (Eintragungsdatum)\n\nCEWOX UG (haftungsbeschränkt)\nGesellschaft mit beschränkter Haftung\nLachendorf\n\nDen Gläubigern der an der Verschmelzung beteiligten Rechtsträger ist, wenn sie binnen sechs Monaten nach dem Tag, an dem die Eintragung der Verschmelzung in das Register des Sitzes desjenigen Rechtsträgers, dessen Gläubiger sie sind, nach § 19  Abs.  3 UmwG als bekannt gemacht gilt, ihren Anspruch nach Grund und Höhe schriftlich anmelden, Sicherheit zu leisten, soweit sie nicht Befriedigung verlangen können. Dieses Recht steht den Gläubigern jedoch nur zu, wenn sie glaubhaft machen, dass durch die Verschmelzung die Erfüllung der Forderung gefährdet wird."
    },
    {
      "date": "2025-01-20",
      "id": "99030",
      "original_text": "Löschungsankündigung\nNiedersachsen Amtsgericht Osnabrück HRB 21657\nStröer Begrünungen GmbH – Osnabrück",
      "type": "Löschungsankündigung",
      "state": "Niedersachsen",
      "amtsgericht": "Amtsgericht Osnabrück",
      "registernummer": "HRB 21657",
      "registerart": "HRB",
      "company_name": "Ströer Begrünungen GmbH",
      "company_seat": "Osnabrück",
      "details": "20.01.2025 (Bekanntmachungsdatum)\n\nNiedersachsen Amtsgericht Osnabrück HRB 21657\nLöschungsankündigung\n\nStröer Begrünungen GmbH\nGesellschaft mit beschränkter Haftung\nOsnabrück\n\nDas Registergericht beabsichtigt, die Gesellschaft von Amts wegen nach § 394 FamFG wegen Vermögenslosigkeit zu löschen. Die Frist zur Erhebung eines Widerspruchs ist auf 1 Monat ab dieser Registerbekanntmachung festgesetzt."
    },
    {
      "date": "2025-01-20",
      "id": "99031",
      "original_text": "Einreichung neuer Dokumente\nNiedersachsen Amtsgericht Braunschweig HRB 207876\nVolkswagen Group Info Services AG – Wolfsburg",
      "type": "Einreichung neuer Dokumente",
      "state": "Niedersachsen",
      "amtsgericht": "Amtsgericht Braunschweig",
      "registernummer": "HRB 207876",
      "registerart": "HRB",
      "company_name": "Volkswagen Group Info Services AG",
      "company_seat": "Wolfsburg",
      "details": "20.01.2025 (Bekanntmachungsdatum)\n\nNiedersachsen Amtsgericht Braunschweig HRB 207876\nEinreichung neuer Dokumente 20.01.2025 (Eintragungsdatum)\n\nVolkswagen Group Info Services AG\nAktiengesellschaft\nWolfsburg\n\nDie Liste der Mitglieder des Aufsichtsrats wurde beim Registergericht eingereicht."
    },
    {
      "date": "2025-01-20",
      "id": "99032",
      "original_text": "Löschungsankündigung\nNiedersachsen Amtsgericht Hannover HRB 211981\nLeisewitzstübchen Betriebsgesellschaft mbH – Hannover",
      "type": "Löschungsankündigung",
      "state": "Niedersachsen",
      "amtsgericht": "Amtsgericht Hannover",
      "registernummer": "HRB 211981",
      "registerart": "HRB",
      "company_name": "Leisewitzstübchen Betriebsgesellschaft mbH",
      "company_seat": "Hannover",
      "details": "20.01.2025 (Bekanntmachungsdatum)\n\nNiedersachsen Amtsgericht Hannover HRB 211981\nLöschungsankündigung\n\nLeisewitzstübchen Betriebsgesellschaft mbH\nGesellschaft mit beschränkter Haftung\nHannover\n\nDas Registergericht beabsichtigt, die Gesellschaft von Amts wegen nach § 394 FamFG zu löschen. Die Frist zur Erhebung eines Widerspruchs ist auf 1 Monat ab dieser Registerbekanntmachung festgesetzt."
    },
    {
      "date": "2025-01-20",
      "id": "99033",
      "original_text": "Registerbekanntmachung nach dem Umwandlungsgesetz\nRheinland-Pfalz Amtsgericht Zweibrücken HRB 30177\nFiebig GmbH – Bruchmühlbach-Miesau",
      "type": "Registerbekanntmachung nach dem Umwandlungsgesetz",
      "state": "Rheinland-Pfalz",
      "amtsgericht": "Amtsgericht Zweibrücken",
      "registernummer": "HRB 30177",
      "registerart": "HRB",
      "company_name": "Fiebig GmbH",
      "company_seat": "Bruchmühlbach-Miesau",
      "details": "20.01.2025 (Bekanntmachungsdatum)\n\nRheinland-Pfalz Amtsgericht Zweibrücken HRB 30177\nRegisterbekanntmachung nach dem Umwandlungsgesetz 20.01.2025 (Eintragungsdatum)\n\nFiebig GmbH\nGesellschaft mit beschränkter Haftung\nBruchmühlbach-Miesau\n\nAls nicht eingetragen wird veröffentlicht:\nDen Gläubigern des formwechselnden Rechtsträgers ist, wenn sie binnen sechs Monaten nach dem Tag, an dem die Eintragung des Formwechsels nach § 201 UmwG als bekannt gemacht gilt, ihren Anspruch nach Grund und Höhe schriftlich anmelden, Sicherheit zu leisten, soweit sie nicht Befriedigung verlangen können. Dieses Recht steht den Gläubigern jedoch nur zu, wenn sie glaubhaft machen, dass durch den Formwechsel die Erfüllung der Forderung gefährdet wird."
    },
    {
      "date": "2025-01-20",
      "id": "99034",
      "original_text": "Registerbekanntmachung nach dem Umwandlungsgesetz\nRheinland-Pfalz Amtsgericht Zweibrücken HRA 30823\nFiebig GmbH & Co. KG – Bruchmühlbach-Miesau",
      "type": "Registerbekanntmachung nach dem Umwandlungsgesetz",
      "state": "Rheinland-Pfalz",
      "amtsgericht": "Amtsgericht Zweibrücken",
      "registernummer": "HRA 30823",
      "registerart": "HRA",
      "company_name": "Fiebig GmbH & Co. KG",
      "company_seat": "Bruchmühlbach-Miesau",
      "details": "20.01.2025 (Bekanntmachungsdatum)\n\nRheinland-Pfalz Amtsgericht Zweibrücken HRA 30823\nRegisterbekanntmachung nach dem Umwandlungsgesetz 20.01.2025 (Eintragungsdatum)\n\nFiebig GmbH & Co. KG\nKommanditgesellschaft\nBruchmühlbach-Miesau\n\nGläubigern des bisherigen Rechtsträgers ist unter den Voraussetzungen der §§ 204, 22 UmwG Sicherheit zu leisten.Gläubigern des bisherigen Rechtsträgers ist unter den Voraussetzungen der §§ 204, 22 UmwG SichAls nicht eingetragen wird veröffentlicht:\nDen Gläubigern des formwechselnden Rechtsträgers ist, wenn sie binnen sechs Monaten nach dem Tag, an dem die Eintragung des Formwechsels nach § 201 UmwG als bekannt gemacht gilt, ihren Anspruch nach Grund und Höhe schriftlich anmelden, Sicherheit zu leisten, soweit sie nicht Befriedigung verlangen können. Dieses Recht steht den Gläubigern jedoch nur zu, wenn sie glaubhaft machen, dass durch den Formwechsel die Erfüllung der Forderung gefährdet wird. erheit zu leisten."
    },
    {
      "date": "2025-01-20",
      "id": "99035",
      "original_text": "Einreichung neuer Dokumente\nRheinland-Pfalz Amtsgericht Landau HRB 3014\nEnergieSüdwest AG – Landau in der Pfalz",
      "type": "Einreichung neuer Dokumente",
      "state": "Rheinland-Pfalz",
      "amtsgericht": "Amtsgericht Landau",
      "registernummer": "HRB 3014",
      "registerart": "HRB",
      "company_name": "EnergieSüdwest AG",
      "company_seat": "Landau in der Pfalz",
      "details": "20.01.2025 (Bekanntmachungsdatum)\n\nRheinland-Pfalz Amtsgericht Landau HRB 3014\nEinreichung neuer Dokumente\n\nEnergieSüdwest AG\nAktiengesellschaft\nLandau in der Pfalz\n\nDem Registergericht ist eine Liste der Mitglieder des Aufsichtsrates eingereicht worden."
    },
    {
      "date": "2025-01-20",
      "id": "99036",
      "original_text": "Löschungsankündigung\nRheinland-Pfalz Amtsgericht Mainz HRB 43721\nkmu connect GmbH – Worms",
      "type": "Löschungsankündigung",
      "state": "Rheinland-Pfalz",
      "amtsgericht": "Amtsgericht Mainz",
      "registernummer": "HRB 43721",
      "registerart": "HRB",
      "company_name": "kmu connect GmbH",
      "company_seat": "Worms",
      "details": "20.01.2025 (Bekanntmachungsdatum)\n\nRheinland-Pfalz Amtsgericht Mainz HRB 43721\nLöschungsankündigung\n\nkmu connect GmbH\nGesellschaft mit beschränkter Haftung\nWorms\n\nDas Registergericht beabsichtigt die Gesellschaft von Amts wegen nach § 394 FamFG zu löschen. Die Frist zur Erhebung eines Widerspruchs ist auf einen Monat festgesetzt."
    },
    {
      "date": "2025-01-20",
      "id": "99037",
      "original_text": "Registerbekanntmachung nach dem Umwandlungsgesetz\nNordrhein-Westfalen Amtsgericht Köln HRA 32404\nWUM Brand House GmbH & Co.KG – Köln",
      "type": "Registerbekanntmachung nach dem Umwandlungsgesetz",
      "state": "Nordrhein-Westfalen",
      "amtsgericht": "Amtsgericht Köln",
      "registernummer": "HRA 32404",
      "registerart": "HRA",
      "company_name": "WUM Brand House GmbH & Co.KG",
      "company_seat": "Köln",
      "details": "20.01.2025 (Bekanntmachungsdatum)\n\nNordrhein-Westfalen Amtsgericht Köln HRA 32404\nRegisterbekanntmachung nach dem Umwandlungsgesetz 20.01.2025 (Eintragungsdatum)\n\nWUM Brand House GmbH & Co.KG\nKommanditgesellschaft\nKöln\n\nDen Gläubigern der an der Verschmelzung beteiligten Rechtsträger ist, wenn sie binnen sechs Monaten nach dem Tag, an dem die Eintragung der Verschmelzung in das Register des Sitzes desjenigen Rechtsträgers, dessen Gläubiger sie sind, nach § 19 Absatz 3 UmwG als bekanntgemacht gilt, ihren Anspruch nach Grund und Höhe schriftlich anmelden, Sicherheit zu leisten, soweit sie nicht Befriedigung verlangen können. Dieses Recht steht den Gläubigern jedoch nur zu, wenn sie glaubhaft machen, dass durch die Verschmelzung die Erfüllung ihrer Forderung gefährdet wird."
    },
    {
      "date": "2025-01-20",
      "id": "99038",
      "original_text": "Registerbekanntmachung nach dem Umwandlungsgesetz\nNordrhein-Westfalen Amtsgericht Aachen HRB 5985\napi GmbH – Baesweiler",
      "type": "Registerbekanntmachung nach dem Umwandlungsgesetz",
      "state": "Nordrhein-Westfalen",
      "amtsgericht": "Amtsgericht Aachen",
      "registernummer": "HRB 5985",
      "registerart": "HRB",
      "company_name": "api GmbH",
      "company_seat": "Baesweiler",
      "details": "20.01.2025 (Bekanntmachungsdatum)\n\nNordrhein-Westfalen Amtsgericht Aachen HRB 5985\nRegisterbekanntmachung nach dem Umwandlungsgesetz 20.01.2025 (Eintragungsdatum)\n\napi GmbH\nGesellschaft mit beschränkter Haftung\nBaesweiler\n\nDen Gläubigern der an der Verschmelzung beteiligten Rechtsträger ist, wenn sie binnen sechs Monaten nach dem Tag, an dem die Eintragung der Verschmelzung in das Register des Sitzes derjenigen Rechtsträger deren Gläubiger sie sind, nach § 19 Absatz 3 UmwG als bekanntgemacht gilt, ihren Anspruch nach Grund und Höhe schriftlich anmelden, Sicherheit zu leisten, soweit sie nicht Befriedigung verlangen können. Dieses Recht steht den Gläubigern jedoch nur zu, wenn sie glaubhaft machen, dass durch die Verschmelzung die Erfüllung ihrer Forderung gefährdet wird."
    },
    {
      "date": "2025-01-20",
      "id": "99039",
      "original_text": "Sonstige Registerbekanntmachung\nNordrhein-Westfalen Amtsgericht Köln HRB 99764\nZooRoyal Petcare GmbH – Köln",
      "type": "Sonstige Registerbekanntmachung",
      "state": "Nordrhein-Westfalen",
      "amtsgericht": "Amtsgericht Köln",
      "registernummer": "HRB 99764",
      "registerart": "HRB",
      "company_name": "ZooRoyal Petcare GmbH",
      "company_seat": "Köln",
      "details": "20.01.2025 (Bekanntmachungsdatum)\n\nNordrhein-Westfalen Amtsgericht Köln HRB 99764\nSonstige Registerbekanntmachung 20.01.2025 (Eintragungsdatum)\n\nZooRoyal Petcare GmbH\nGesellschaft mit beschränkter Haftung\nKöln\n\nAls nicht eingetragen wird veröffentlicht: Den Gläubigern der Gesellschaft, deren Forderungen begründet worden sind bevor die Eintragung der Beendigung des Beherrschungs- und Gewinnabführungsvertrages  in das Handelsregister nach § 10 des Handelsgesetzbuches als bekanntgemacht gilt, hat der andere Vertragsteil Sicherheit zu leisten, wenn sie sich binnen sechs Monaten nach der Bekanntmachung der Eintragung zu diesem Zweck bei ihm melden."
    },
    {
      "date": "2025-01-20",
      "id": "99040",
      "original_text": "Registerbekanntmachung nach dem Umwandlungsgesetz\nNordrhein-Westfalen Amtsgericht Bielefeld HRB 41920\nWise Care GmbH – Bielefeld",
      "type": "Registerbekanntmachung nach dem Umwandlungsgesetz",
      "state": "Nordrhein-Westfalen",
      "amtsgericht": "Amtsgericht Bielefeld",
      "registernummer": "HRB 41920",
      "registerart": "HRB",
      "company_name": "Wise Care GmbH",
      "company_seat": "Bielefeld",
      "details": "20.01.2025 (Bekanntmachungsdatum)\n\nNordrhein-Westfalen Amtsgericht Bielefeld HRB 41920\nRegisterbekanntmachung nach dem Umwandlungsgesetz 20.01.2025 (Eintragungsdatum)\n\nWise Care GmbH\nGesellschaft mit beschränkter Haftung\nBielefeld\n\nDen Gläubigern der an der Verschmelzung beteiligten Rechtsträger ist, wenn sie binnen sechs Monaten nach dem Tag, an dem die Eintragung der Verschmelzung in das Register des Sitzes desjenigen Rechtsträgers, dessen Gläubiger sie sind, nach § 19 Absatz 3 UmwG als bekanntgemacht gilt, ihren Anspruch nach Grund und Höhe schriftlich anmelden, Sicherheit zu leisten, soweit sie nicht Befriedigung verlangen können. Dieses Recht steht den Gläubigern jedoch nur zu, wenn sie glaubhaft machen, dass durch die Verschmelzung die Erfüllung ihrer Forderung gefährdet wird."
    },
    {
      "date": "2025-01-20",
      "id": "99041",
      "original_text": "Einreichung neuer Dokumente\nNordrhein-Westfalen Amtsgericht Köln HRB 115531\nRaiffeisen Waren-Zentrale Rhein-Main AG – Köln",
      "type": "Einreichung neuer Dokumente",
      "state": "Nordrhein-Westfalen",
      "amtsgericht": "Amtsgericht Köln",
      "registernummer": "HRB 115531",
      "registerart": "HRB",
      "company_name": "Raiffeisen Waren-Zentrale Rhein-Main AG",
      "company_seat": "Köln",
      "details": "20.01.2025 (Bekanntmachungsdatum)\n\nNordrhein-Westfalen Amtsgericht Köln HRB 115531\nEinreichung neuer Dokumente\n\nRaiffeisen Waren-Zentrale Rhein-Main AG\nAktiengesellschaft\nKöln\n\nDem Registergericht ist eine Liste der Mitglieder des Aufsichtsrates eingereicht worden."
    },
    {
      "date": "2025-01-20",
      "id": "99042",
      "original_text": "Registerbekanntmachung nach dem Umwandlungsgesetz\nNordrhein-Westfalen Amtsgericht Bochum HRB 6815\nEickhoff Antriebstechnik GmbH – Bochum",
      "type": "Registerbekanntmachung nach dem Umwandlungsgesetz",
      "state": "Nordrhein-Westfalen",
      "amtsgericht": "Amtsgericht Bochum",
      "registernummer": "HRB 6815",
      "registerart": "HRB",
      "company_name": "Eickhoff Antriebstechnik GmbH",
      "company_seat": "Bochum",
      "details": "20.01.2025 (Bekanntmachungsdatum)\n\nNordrhein-Westfalen Amtsgericht Bochum HRB 6815\nRegisterbekanntmachung nach dem Umwandlungsgesetz 17.01.2025 (Eintragungsdatum)\n\nEickhoff Antriebstechnik GmbH\nGesellschaft mit beschränkter Haftung\nBochum\n\nDen Gläubigern der an der Verschmelzung beteiligten Rechtsträger ist, wenn sie binnen sechs Monaten nach dem Tag, an dem die Eintragung der Verschmelzung in das Register des Sitzes derjenigen Rechtsträger deren Gläubiger sie sind, nach § 19 Absatz 3 UmwG als bekanntgemacht gilt, ihren Anspruch nach Grund und Höhe schriftlich anmelden, Sicherheit zu leisten, soweit sie nicht Befriedigung verlangen können. Dieses Recht steht den Gläubigern jedoch nur zu, wenn sie glaubhaft machen, dass durch die Verschmelzung die Erfüllung ihrer Forderung gefährdet wird."
    },
    {
      "date": "2025-01-20",
      "id": "99043",
      "original_text": "Einreichung neuer Dokumente\nNordrhein-Westfalen Amtsgericht Düsseldorf HRB 97499\nFO Trust GmbH – Düsseldorf",
      "type": "Einreichung neuer Dokumente",
      "state": "Nordrhein-Westfalen",
      "amtsgericht": "Amtsgericht Düsseldorf",
      "registernummer": "HRB 97499",
      "registerart": "HRB",
      "company_name": "FO Trust GmbH",
      "company_seat": "Düsseldorf",
      "details": "20.01.2025 (Bekanntmachungsdatum)\n\nNordrhein-Westfalen Amtsgericht Düsseldorf HRB 97499\nEinreichung neuer Dokumente\n\nFO Trust GmbH\nGesellschaft mit beschränkter Haftung\nDüsseldorf\n\nDem Registergericht ist eine Liste der Mitglieder des Aufsichtsrates eingereicht worden."
    },
    {
      "date": "2025-01-20",
      "id": "99044",
      "original_text": "Registerbekanntmachung nach dem Umwandlungsgesetz\nNordrhein-Westfalen Amtsgericht Dortmund HRB 26790\nSpecta Ruhr GmbH – Dortmund",
      "type": "Registerbekanntmachung nach dem Umwandlungsgesetz",
      "state": "Nordrhein-Westfalen",
      "amtsgericht": "Amtsgericht Dortmund",
      "registernummer": "HRB 26790",
      "registerart": "HRB",
      "company_name": "Specta Ruhr GmbH",
      "company_seat": "Dortmund",
      "details": "20.01.2025 (Bekanntmachungsdatum)\n\nNordrhein-Westfalen Amtsgericht Dortmund HRB 26790\nRegisterbekanntmachung nach dem Umwandlungsgesetz 20.01.2025 (Eintragungsdatum)\n\nSpecta Ruhr GmbH\nGesellschaft mit beschränkter Haftung\nDortmund\n\nDen Gläubigern der an der Verschmelzung beteiligten Rechtsträger ist, wenn sie binnen sechs Monaten nach dem Tag, an dem die Eintragung der Verschmelzung in das Register des Sitzes desjenigen Rechtsträgers, dessen Gläubiger sie sind, nach § 19 Absatz 3 UmwG als bekanntgemacht gilt, ihren Anspruch nach Grund und Höhe schriftlich anmelden, Sicherheit zu leisten, soweit sie nicht Befriedigung verlangen können. Dieses Recht steht den Gläubigern jedoch nur zu, wenn sie glaubhaft machen, dass durch die Verschmelzung die Erfüllung ihrer Forderung gefährdet wird."
    },
    {
      "date": "2025-01-20",
      "id": "99045",
      "original_text": "Löschungsankündigung\nNordrhein-Westfalen Amtsgericht Duisburg HRB 30529\nHRB Institut zur Datenbevorratung UG (haftungsbeschränkt) – Mülheim an der Ruhr",
      "type": "Löschungsankündigung",
      "state": "Nordrhein-Westfalen",
      "amtsgericht": "Amtsgericht Duisburg",
      "registernummer": "HRB 30529",
      "registerart": "HRB",
      "company_name": "HRB Institut zur Datenbevorratung UG (haftungsbeschränkt)",
      "company_seat": "Mülheim an der Ruhr",
      "details": "20.01.2025 (Bekanntmachungsdatum)\n\nNordrhein-Westfalen Amtsgericht Duisburg HRB 30529\nLöschungsankündigung 20.01.2025 (Eintragungsdatum)\n\nHRB Institut zur Datenbevorratung UG (haftungsbeschränkt)\nGesellschaft mit beschränkter Haftung\nMülheim an der Ruhr\n\nHRB 30529:\nHRB Institut zur Datenbevorratung UG (haftungsbeschränkt), Mülheim an der Ruhr\nEichenberg 31, 45473 Mülheim an der Ruhr.\nDas Registergericht beabsichtigt, die im Handelsregister eingetragene Gesellschaft gemäß § 394 FamFG wegen Vermögenslosigkeit von Amts wegen zu löschen. Gegen diese Verfügung kann Widerspruch eingelegt werden. Die Frist zur Erhebung eines Widerspruchs gegen die beabsichtigte Löschung von Amts wegen ist auf drei Monate festgesetzt. Rechtsbehelfsbelehrung Der Widerspruch ist bei dem Amtsgericht Duisburg, Kardinal-Galen-Str. 124-132, 47058 Duisburg schriftlich in deutscher Sprache oder zur Niederschrift der Geschäftsstelle einzulegen. Der Widerspruch kann auch zur Niederschrift der Geschäftsstelle eines jeden Amtsgerichtes abgegeben werden. Die Einlegung ist auch durch Übertragung eines elektronischen Dokuments an die elektronische Poststelle des Gerichts möglich. Das elektronische Dokument muss für die Bearbeitung durch das Gericht geeignet und mit einer qualifizierten elektronischen Signatur der verantwortenden Person versehen sein oder von der verantwortenden Person signiert und auf einem sicheren Übermittlungsweg gemäß § 130 a ZPO nach näherer Maßgabe der Verordnung über die technischen Rahmenbedingungen des elektronischen Rechtsverkehrs und über das besondere elektronische Behördenpostfach (BGBl. I, S. 3803) eingereicht werden. Weitere Informationen erhalten Sie auf der Internetseite www.justiz.de <http://www.justiz.de>. Der Widerspruch muss spätestens innerhalb der gesetzten Frist bei dem Amtsgericht Duisburg eingegangen sein. Dies gilt auch dann, wenn der Widerspruch zur Niederschrift der Geschäftsstelle eines anderen Amtsgerichtes abgegeben wurde. Die Frist beginnt mit der Veröffentlichung. Fällt das Ende der Frist auf einen Sonntag, einen allgemeinen Feiertag oder Sonnabend, so endet die Frist mit Ablauf des nächsten Werktages. Der Widerspruch muss die Bezeichnung der angefochtenen Verfügung sowie die Erklärung enthalten, dass Widerspruch gegen diese Verfügung eingelegt wird. Er ist zu unterzeichnen und soll begründet werden."
    },
    {
      "date": "2025-01-20",
      "id": "99046",
      "original_text": "Registerbekanntmachung nach dem Umwandlungsgesetz\nNordrhein-Westfalen Amtsgericht Lemgo HRA 3746\nPhoenix Contact GmbH & Co. KG – Blomberg",
      "type": "Registerbekanntmachung nach dem Umwandlungsgesetz",
      "state": "Nordrhein-Westfalen",
      "amtsgericht": "Amtsgericht Lemgo",
      "registernummer": "HRA 3746",
      "registerart": "HRA",
      "company_name": "Phoenix Contact GmbH & Co. KG",
      "company_seat": "Blomberg",
      "details": "20.01.2025 (Bekanntmachungsdatum)\n\nNordrhein-Westfalen Amtsgericht Lemgo HRA 3746\nRegisterbekanntmachung nach dem Umwandlungsgesetz 20.01.2025 (Eintragungsdatum)\n\nPhoenix Contact GmbH & Co. KG\nKommanditgesellschaft\nBlomberg\n\nDen Gläubigern der an der Verschmelzung beteiligten Rechtsträger ist, wenn sie binnen sechs Monaten nach dem Tag, an dem die Eintragung der Verschmelzung in das Register des Sitzes desjenigen Rechtsträgers, dessen Gläubiger sie sind, nach § 19 Absatz 3 UmwG als bekanntgemacht gilt, ihren Anspruch nach Grund und Höhe schriftlich anmelden, Sicherheit zu leisten, soweit sie nicht Befriedigung verlangen können. Dieses Recht steht den Gläubigern jedoch nur zu, wenn sie glaubhaft machen, dass durch die Verschmelzung die Erfüllung ihrer Forderung gefährdet wird."
    },
    {
      "date": "2025-01-20",
      "id": "99047",
      "original_text": "Registerbekanntmachung nach dem Umwandlungsgesetz\nNordrhein-Westfalen Amtsgericht Düsseldorf HRB 94104\nStadtmarken HG am Hangeweiher GmbH – Monheim am Rhein",
      "type": "Registerbekanntmachung nach dem Umwandlungsgesetz",
      "state": "Nordrhein-Westfalen",
      "amtsgericht": "Amtsgericht Düsseldorf",
      "registernummer": "HRB 94104",
      "registerart": "HRB",
      "company_name": "Stadtmarken HG am Hangeweiher GmbH",
      "company_seat": "Monheim am Rhein",
      "details": "20.01.2025 (Bekanntmachungsdatum)\n\nNordrhein-Westfalen Amtsgericht Düsseldorf HRB 94104\nRegisterbekanntmachung nach dem Umwandlungsgesetz 20.01.2025 (Eintragungsdatum)\n\nStadtmarken HG am Hangeweiher GmbH\nGesellschaft mit beschränkter Haftung\nMonheim am Rhein\n\nDen Gläubigern der an der Verschmelzung beteiligten Rechtsträger ist, wenn sie binnen sechs Monaten nach dem Tag, an dem die Eintragung der Verschmelzung in das Register des Sitzes desjenigen Rechtsträgers, dessen Gläubiger sie sind, nach § 19 Absatz 3 UmwG als bekanntgemacht gilt, ihren Anspruch nach Grund und Höhe schriftlich anmelden, Sicherheit zu leisten, soweit sie nicht Befriedigung verlangen können. Dieses Recht steht den Gläubigern jedoch nur zu, wenn sie glaubhaft machen, dass durch die Verschmelzung die Erfüllung ihrer Forderung gefährdet wird."
    },
    {
      "date": "2025-01-20",
      "id": "99048",
      "original_text": "Einreichung neuer Dokumente\nNordrhein-Westfalen Amtsgericht Münster HRB 1489\nRegionalverkehr Münsterland GmbH – Münster",
      "type": "Einreichung neuer Dokumente",
      "state": "Nordrhein-Westfalen",
      "amtsgericht": "Amtsgericht Münster",
      "registernummer": "HRB 1489",
      "registerart": "HRB",
      "company_name": "Regionalverkehr Münsterland GmbH",
      "company_seat": "Münster",
      "details": "20.01.2025 (Bekanntmachungsdatum)\n\nNordrhein-Westfalen Amtsgericht Münster HRB 1489\nEinreichung neuer Dokumente\n\nRegionalverkehr Münsterland GmbH\nGesellschaft mit beschränkter Haftung\nMünster\n\nDem Registergericht ist eine neue Liste der Mitglieder des Aufsichtsrates eingereicht worden."
    },
    {
      "date": "2025-01-20",
      "id": "99049",
      "original_text": "Sonstige Registerbekanntmachung\nNordrhein-Westfalen Amtsgericht Duisburg HRB 18154\nDMV GmbH – Mülheim an der Ruhr",
      "type": "Sonstige Registerbekanntmachung",
      "state": "Nordrhein-Westfalen",
      "amtsgericht": "Amtsgericht Duisburg",
      "registernummer": "HRB 18154",
      "registerart": "HRB",
      "company_name": "DMV GmbH",
      "company_seat": "Mülheim an der Ruhr",
      "details": "20.01.2025 (Bekanntmachungsdatum)\n\nNordrhein-Westfalen Amtsgericht Duisburg HRB 18154\nSonstige Registerbekanntmachung 20.01.2025 (Eintragungsdatum)\n\nDMV GmbH\nGesellschaft mit beschränkter Haftung\nMülheim an der Ruhr\n\nDie Gesellschaft hat Gläubigern, deren Forderungen vor dieser Bekanntmachung begründet worden sind, Sicherheit zu leisten, soweit sie nicht Befriedigung verlangen können, wenn sie sich binnen sechs Monaten zu diesem Zweck melden."
    },
    {
      "date": "2025-01-20",
      "id": "99050",
      "original_text": "Löschungsankündigung\nNordrhein-Westfalen Amtsgericht Kleve HRB 16235\nAZZAM GmbH – Kranenburg",
      "type": "Löschungsankündigung",
      "state": "Nordrhein-Westfalen",
      "amtsgericht": "Amtsgericht Kleve",
      "registernummer": "HRB 16235",
      "registerart": "HRB",
      "company_name": "AZZAM GmbH",
      "company_seat": "Kranenburg",
      "details": "20.01.2025 (Bekanntmachungsdatum)\n\nNordrhein-Westfalen Amtsgericht Kleve HRB 16235\nLöschungsankündigung\n\nAZZAM GmbH\nGesellschaft mit beschränkter Haftung\nKranenburg\n\nDas Registergericht beabsichtigt die Gesellschaft von Amts wegen nach § 394 FamFG zu löschen. Die Frist zur Erhebung eines Widerspruchs ist auf einen Monat festgesetzt."
    },
    {
      "date": "2025-01-20",
      "id": "99051",
      "original_text": "Sonstige Registerbekanntmachung\nNordrhein-Westfalen Amtsgericht Düsseldorf HRB 50400\nOranje-Entertainment GmbH – Düsseldorf",
      "type": "Sonstige Registerbekanntmachung",
      "state": "Nordrhein-Westfalen",
      "amtsgericht": "Amtsgericht Düsseldorf",
      "registernummer": "HRB 50400",
      "registerart": "HRB",
      "company_name": "Oranje-Entertainment GmbH",
      "company_seat": "Düsseldorf",
      "details": "20.01.2025 (Bekanntmachungsdatum)\n\nNordrhein-Westfalen Amtsgericht Düsseldorf HRB 50400\nSonstige Registerbekanntmachung 20.01.2025 (Eintragungsdatum)\n\nOranje-Entertainment GmbH\nGesellschaft mit beschränkter Haftung\nDüsseldorf\n\nAls nicht eingetragen wird veröffentlicht: Den Gläubigern der Gesellschaft, deren Forderungen begründet worden sind bevor die Eintragung der Beendigung des Gewinnabführungsvertrages  in das Handelsregister nach § 10 des Handelsgesetzbuches als bekanntgemacht gilt, hat der andere Vertragsteil Sicherheit zu leisten, wenn sie sich binnen sechs Monaten nach der Bekanntmachung der Eintragung zu diesem Zweck bei ihm melden."
    },
    {
      "date": "2025-01-20",
      "id": "99052",
      "original_text": "Löschungsankündigung\nNordrhein-Westfalen Amtsgericht Hagen HRB 12894\nDARC Management UG (haftungsbeschränkt) – Gevelsberg",
      "type": "Löschungsankündigung",
      "state": "Nordrhein-Westfalen",
      "amtsgericht": "Amtsgericht Hagen",
      "registernummer": "HRB 12894",
      "registerart": "HRB",
      "company_name": "DARC Management UG (haftungsbeschränkt)",
      "company_seat": "Gevelsberg",
      "details": "20.01.2025 (Bekanntmachungsdatum)\n\nNordrhein-Westfalen Amtsgericht Hagen HRB 12894\nLöschungsankündigung\n\nDARC Management UG (haftungsbeschränkt)\nGesellschaft mit beschränkter Haftung\nGevelsberg\n\nDas Registergericht beabsichtigt, die im Handelsregister eingetragene Gesellschaft gemäß § 394 Absatz 1 FamFG wegen Vermögenslosigkeit von Amts wegen zu löschen.  Gegen diese Verfügung kann Widerspruch eingelegt werden. Die Frist zur Erhebung eines Widerspruchs gegen die beabsichtigte Löschung von Amts wegen ist auf drei Monate festgesetzt.\n\nRechtsbehelfsbelehrung:\nGegen diese Verfügung können Sie Widerspruch einlegen.\n\nDer Widerspruch ist bei dem Amtsgericht Hagen, Heinitzstraße 42, 58097 Hagen schriftlich in deutscher Sprache oder zur Niederschrift der Geschäftsstelle einzulegen. Der Widerspruch kann auch zur Niederschrift der Geschäftsstelle eines jeden Amtsgerichtes abgegeben werden.\n\nDer Widerspruch muss spätestens innerhalb der gesetzten Frist bei dem Amtsgericht Hagen eingegangen sein. Dies gilt auch dann, wenn der Widerspruch zur Niederschrift der Geschäftsstelle eines anderen Amtsgerichtes abgegeben wurde. Die Frist beginnt mit der Veröffentlichung. Fällt das Ende der Frist auf einen Sonntag, einen allgemeinen Feiertag oder Sonnabend, so endet die Frist mit Ablauf des nächsten Werktages.\n\nDer Widerspruch muss die Bezeichnung der angefochtenen Verfügung sowie die Erklärung enthalten, dass Widerspruch gegen diese Verfügung eingelegt wird. Er ist zu unterzeichnen und soll begründet werden."
    },
    {
      "date": "2025-01-20",
      "id": "99053",
      "original_text": "Einreichung neuer Dokumente\nNordrhein-Westfalen Amtsgericht Düsseldorf HRB 28551\nSV (Deutschland) GmbH – Düsseldorf",
      "type": "Einreichung neuer Dokumente",
      "state": "Nordrhein-Westfalen",
      "amtsgericht": "Amtsgericht Düsseldorf",
      "registernummer": "HRB 28551",
      "registerart": "HRB",
      "company_name": "SV (Deutschland) GmbH",
      "company_seat": "Düsseldorf",
      "details": "20.01.2025 (Bekanntmachungsdatum)\n\nNordrhein-Westfalen Amtsgericht Düsseldorf HRB 28551\nEinreichung neuer Dokumente\n\nSV (Deutschland) GmbH\nGesellschaft mit beschränkter Haftung\nDüsseldorf\n\nDem Registergericht ist eine Liste der Mitglieder des Aufsichtsrates eingereicht worden."
    },
    {
      "date": "2025-01-20",
      "id": "99054",
      "original_text": "Sonstige Registerbekanntmachung\nNordrhein-Westfalen Amtsgericht Köln HRB 99316\nRau Liegenschaften GmbH – Köln",
      "type": "Sonstige Registerbekanntmachung",
      "state": "Nordrhein-Westfalen",
      "amtsgericht": "Amtsgericht Köln",
      "registernummer": "HRB 99316",
      "registerart": "HRB",
      "company_name": "Rau Liegenschaften GmbH",
      "company_seat": "Köln",
      "details": "20.01.2025 (Bekanntmachungsdatum)\n\nNordrhein-Westfalen Amtsgericht Köln HRB 99316\nSonstige Registerbekanntmachung\n\nRau Liegenschaften GmbH\nGesellschaft mit beschränkter Haftung\nKöln\n\nAls nicht eingetragen wird veröffentlicht: Den Gläubigern der Gesellschaft, deren Forderungen begründet worden sind bevor die Eintragung der Beendigung des Beherrschungs- und Gewinnabführungsvertrages  in das Handelsregister nach § 10 des Handelsgesetzbuches als bekanntgemacht gilt, hat der andere Vertragsteil Sicherheit zu leisten, wenn sie sich binnen sechs Monaten nach der Bekanntmachung der Eintragung zu diesem Zweck bei ihm melden."
    },
    {
      "date": "2025-01-20",
      "id": "99055",
      "original_text": "Registerbekanntmachung nach dem Umwandlungsgesetz\nNordrhein-Westfalen Amtsgericht Krefeld HRB 5590\nPMA/TOOLS AG – Willich",
      "type": "Registerbekanntmachung nach dem Umwandlungsgesetz",
      "state": "Nordrhein-Westfalen",
      "amtsgericht": "Amtsgericht Krefeld",
      "registernummer": "HRB 5590",
      "registerart": "HRB",
      "company_name": "PMA/TOOLS AG",
      "company_seat": "Willich",
      "details": "20.01.2025 (Bekanntmachungsdatum)\n\nNordrhein-Westfalen Amtsgericht Krefeld HRB 5590\nRegisterbekanntmachung nach dem Umwandlungsgesetz 20.01.2025 (Eintragungsdatum)\n\nPMA/TOOLS AG\nAktiengesellschaft\nWillich\n\nDen Gläubigern der an der formwechselnden Umwandlung beteiligten Rechtsträger ist, wenn sie binnen sechs Monaten nach dem Tag, an dem die Eintragung der formwechselnden Umwandlung in das Register des Sitzes desjenigen Rechtsträgers, dessen Gläubiger sie sind, nach § 19 Absatz 3 UmwG als bekanntgemacht gilt, ihren Anspruch nach Grund und Höhe schriftlich anmelden, Sicherheit zu leisten, soweit sie nicht Befriedigung verlangen können. Dieses Recht steht den Gläubigern jedoch nur zu, wenn sie glaubhaft machen, dass durch die formwechselnden Umwandlung die Erfüllung ihrer Forderung gefährdet wird."
    },
    {
      "date": "2025-01-20",
      "id": "99056",
      "original_text": "Einreichung neuer Dokumente\nNordrhein-Westfalen Amtsgericht Gütersloh HRB 3027\nClaas Kommanditgesellschaft auf Aktien mbH – Harsewinkel",
      "type": "Einreichung neuer Dokumente",
      "state": "Nordrhein-Westfalen",
      "amtsgericht": "Amtsgericht Gütersloh",
      "registernummer": "HRB 3027",
      "registerart": "HRB",
      "company_name": "Claas Kommanditgesellschaft auf Aktien mbH",
      "company_seat": "Harsewinkel",
      "details": "20.01.2025 (Bekanntmachungsdatum)\n\nNordrhein-Westfalen Amtsgericht Gütersloh HRB 3027\nEinreichung neuer Dokumente 13.01.2025 (Eintragungsdatum)\n\nClaas Kommanditgesellschaft auf Aktien mbH\nKommanditgesellschaft auf Aktien\nHarsewinkel"
    },
    {
      "date": "2025-01-20",
      "id": "99057",
      "original_text": "Einreichung neuer Dokumente\nNordrhein-Westfalen Amtsgericht Düsseldorf HRB 107161\nSYNBIOTIC SE – Düsseldorf",
      "type": "Einreichung neuer Dokumente",
      "state": "Nordrhein-Westfalen",
      "amtsgericht": "Amtsgericht Düsseldorf",
      "registernummer": "HRB 107161",
      "registerart": "HRB",
      "company_name": "SYNBIOTIC SE",
      "company_seat": "Düsseldorf",
      "details": "20.01.2025 (Bekanntmachungsdatum)\n\nNordrhein-Westfalen Amtsgericht Düsseldorf HRB 107161\nEinreichung neuer Dokumente\n\nSYNBIOTIC SE\nEuropäische Aktiengesellschaft (SE)\nDüsseldorf\n\nDem Registergericht ist eine Liste der Mitglieder des Verwaltungsrats eingereicht worden."
    },
    {
      "date": "2025-01-20",
      "id": "99058",
      "original_text": "Löschungsankündigung\nNordrhein-Westfalen Amtsgericht Hagen HRB 11932\nMGforce GmbH – Hagen",
      "type": "Löschungsankündigung",
      "state": "Nordrhein-Westfalen",
      "amtsgericht": "Amtsgericht Hagen",
      "registernummer": "HRB 11932",
      "registerart": "HRB",
      "company_name": "MGforce GmbH",
      "company_seat": "Hagen",
      "details": "20.01.2025 (Bekanntmachungsdatum)\n\nNordrhein-Westfalen Amtsgericht Hagen HRB 11932\nLöschungsankündigung\n\nMGforce GmbH\nGesellschaft mit beschränkter Haftung\nHagen\n\nDas Registergericht beabsichtigt, die im Handelsregister eingetragene Gesellschaft gemäß § 394 Absatz 1 FamFG wegen Vermögenslosigkeit von Amts wegen zu löschen.  Gegen diese Verfügung kann Widerspruch eingelegt werden. Die Frist zur Erhebung eines Widerspruchs gegen die beabsichtigte Löschung von Amts wegen ist auf drei Monate festgesetzt.\n\nRechtsbehelfsbelehrung:\nGegen diese Verfügung können Sie Widerspruch einlegen.\n\nDer Widerspruch ist bei dem Amtsgericht Hagen, Heinitzstraße 42, 58097 Hagen schriftlich in deutscher Sprache oder zur Niederschrift der Geschäftsstelle einzulegen. Der Widerspruch kann auch zur Niederschrift der Geschäftsstelle eines jeden Amtsgerichtes abgegeben werden.\n\nDer Widerspruch muss spätestens innerhalb der gesetzten Frist bei dem Amtsgericht Hagen eingegangen sein. Dies gilt auch dann, wenn der Widerspruch zur Niederschrift der Geschäftsstelle eines anderen Amtsgerichtes abgegeben wurde. Die Frist beginnt mit der Veröffentlichung. Fällt das Ende der Frist auf einen Sonntag, einen allgemeinen Feiertag oder Sonnabend, so endet die Frist mit Ablauf des nächsten Werktages.\n\nDer Widerspruch muss die Bezeichnung der angefochtenen Verfügung sowie die Erklärung enthalten, dass Widerspruch gegen diese Verfügung eingelegt wird. Er ist zu unterzeichnen und soll begründet werden."
    },
    {
      "date": "2025-01-20",
      "id": "99059",
      "original_text": "Registerbekanntmachung nach dem Umwandlungsgesetz\nNordrhein-Westfalen Amtsgericht Krefeld HRB 20824\nPMA/TOOLS GmbH – Willich",
      "type": "Registerbekanntmachung nach dem Umwandlungsgesetz",
      "state": "Nordrhein-Westfalen",
      "amtsgericht": "Amtsgericht Krefeld",
      "registernummer": "HRB 20824",
      "registerart": "HRB",
      "company_name": "PMA/TOOLS GmbH",
      "company_seat": "Willich",
      "details": "20.01.2025 (Bekanntmachungsdatum)\n\nNordrhein-Westfalen Amtsgericht Krefeld HRB 20824\nRegisterbekanntmachung nach dem Umwandlungsgesetz 20.01.2025 (Eintragungsdatum)\n\nPMA/TOOLS GmbH\nGesellschaft mit beschränkter Haftung\nWillich\n\nDen Gläubigern der an der formwechselnden Umwandlung beteiligten Rechtsträger ist, wenn sie binnen sechs Monaten nach dem Tag, an dem die Eintragung der formwechselnden Umwandlung in das Register des Sitzes desjenigen Rechtsträgers, dessen Gläubiger sie sind, nach § 19 Absatz 3 UmwG als bekanntgemacht gilt, ihren Anspruch nach Grund und Höhe schriftlich anmelden, Sicherheit zu leisten, soweit sie nicht Befriedigung verlangen können. Dieses Recht steht den Gläubigern jedoch nur zu, wenn sie glaubhaft machen, dass durch die formwechselnden Umwandlung die Erfüllung ihrer Forderung gefährdet wird."
    },
    {
      "date": "2025-01-20",
      "id": "99060",
      "original_text": "Registerbekanntmachung nach dem Umwandlungsgesetz\nNordrhein-Westfalen Amtsgericht Paderborn HRB 900\nTextilhäuser F. Klingenthal Gesellschaft mit beschränkter Haftung – Paderborn",
      "type": "Registerbekanntmachung nach dem Umwandlungsgesetz",
      "state": "Nordrhein-Westfalen",
      "amtsgericht": "Amtsgericht Paderborn",
      "registernummer": "HRB 900",
      "registerart": "HRB",
      "company_name": "Textilhäuser F. Klingenthal Gesellschaft mit beschränkter Haftung",
      "company_seat": "Paderborn",
      "details": "20.01.2025 (Bekanntmachungsdatum)\n\nNordrhein-Westfalen Amtsgericht Paderborn HRB 900\nRegisterbekanntmachung nach dem Umwandlungsgesetz 20.01.2025 (Eintragungsdatum)\n\nTextilhäuser F. Klingenthal Gesellschaft mit beschränkter Haftung\nGesellschaft mit beschränkter Haftung\nPaderborn\n\nDen Gläubigern der an der Verschmelzung beteiligten Rechtsträger ist, wenn sie binnen sechs Monaten nach dem Tag, an dem die Eintragung der Verschmelzung in das Register des Sitzes desjenigen Rechtsträgers, dessen Gläubiger sie sind, nach § 19 Absatz 3 UmwG als bekanntgemacht gilt, ihren Anspruch nach Grund und Höhe schriftlich anmelden, Sicherheit zu leisten, soweit sie nicht Befriedigung verlangen können. Dieses Recht steht den Gläubigern jedoch nur zu, wenn sie glaubhaft machen, dass durch die Verschmelzung die Erfüllung ihrer Forderung gefährdet wird."
    },
    {
      "date": "2025-01-20",
      "id": "99061",
      "original_text": "Einreichung neuer Dokumente\nNordrhein-Westfalen Amtsgericht Düsseldorf HRB 56040\nGerresheimer AG – Düsseldorf",
      "type": "Einreichung neuer Dokumente",
      "state": "Nordrhein-Westfalen",
      "amtsgericht": "Amtsgericht Düsseldorf",
      "registernummer": "HRB 56040",
      "registerart": "HRB",
      "company_name": "Gerresheimer AG",
      "company_seat": "Düsseldorf",
      "details": "20.01.2025 (Bekanntmachungsdatum)\n\nNordrhein-Westfalen Amtsgericht Düsseldorf HRB 56040\nEinreichung neuer Dokumente\n\nGerresheimer AG\nAktiengesellschaft\nDüsseldorf\n\nDem Registergericht ist eine neue Liste der Mitglieder des Aufsichtsrates eingereicht worden."
    },
    {
      "date": "2025-01-20",
      "id": "99062",
      "original_text": "Löschungsankündigung\nNordrhein-Westfalen Amtsgericht Köln HRB 87946\nMSPD GmbH – Köln",
      "type": "Löschungsankündigung",
      "state": "Nordrhein-Westfalen",
      "amtsgericht": "Amtsgericht Köln",
      "registernummer": "HRB 87946",
      "registerart": "HRB",
      "company_name": "MSPD GmbH",
      "company_seat": "Köln",
      "details": "20.01.2025 (Bekanntmachungsdatum)\n\nNordrhein-Westfalen Amtsgericht Köln HRB 87946\nLöschungsankündigung\n\nMSPD GmbH\nGesellschaft mit beschränkter Haftung\nKöln\n\nDas Registergericht beabsichtigt die Gesellschaft von Amts wegen nach § 394 FamFG zu löschen. Die Frist zur Erhebung eines Widerspruchs ist auf einen Monat festgesetzt."
    },
    {
      "date": "2025-01-20",
      "id": "99063",
      "original_text": "Registerbekanntmachung nach dem Umwandlungsgesetz\nNordrhein-Westfalen Amtsgericht Dortmund HRB 36230\nElmos Semiconductor Sales & Solutions GmbH – Dortmund",
      "type": "Registerbekanntmachung nach dem Umwandlungsgesetz",
      "state": "Nordrhein-Westfalen",
      "amtsgericht": "Amtsgericht Dortmund",
      "registernummer": "HRB 36230",
      "registerart": "HRB",
      "company_name": "Elmos Semiconductor Sales & Solutions GmbH",
      "company_seat": "Dortmund",
      "details": "20.01.2025 (Bekanntmachungsdatum)\n\nNordrhein-Westfalen Amtsgericht Dortmund HRB 36230\nRegisterbekanntmachung nach dem Umwandlungsgesetz 20.01.2025 (Eintragungsdatum)\n\nElmos Semiconductor Sales & Solutions GmbH\nGesellschaft mit beschränkter Haftung\nDortmund\n\nDen Gläubigern der an der Verschmelzung beteiligten Rechtsträger ist, wenn sie binnen sechs Monaten nach dem Tag, an dem die Eintragung der Verschmelzung in das Register des Sitzes desjenigen Rechtsträgers, dessen Gläubiger sie sind, nach § 19 Absatz 3 UmwG als bekanntgemacht gilt, ihren Anspruch nach Grund und Höhe schriftlich anmelden, Sicherheit zu leisten, soweit sie nicht Befriedigung verlangen können. Dieses Recht steht den Gläubigern jedoch nur zu, wenn sie glaubhaft machen, dass durch die Verschmelzung die Erfüllung ihrer Forderung gefährdet wird."
    },
    {
      "date": "2025-01-20",
      "id": "99064",
      "original_text": "Einreichung neuer Dokumente\nBaden-Württemberg Amtsgericht Freiburg HRB 703420\nAmbulante Hilfen im Landkreis Konstanz Gemeinnützige Gesellschaft mbH – Singen Hohentwiel",
      "type": "Einreichung neuer Dokumente",
      "state": "Baden-Württemberg",
      "amtsgericht": "Amtsgericht Freiburg",
      "registernummer": "HRB 703420",
      "registerart": "HRB",
      "company_name": "Ambulante Hilfen im Landkreis Konstanz Gemeinnützige Gesellschaft mbH",
      "company_seat": "Singen Hohentwiel",
      "details": "20.01.2025 (Bekanntmachungsdatum)\n\nBaden-Württemberg Amtsgericht Freiburg HRB 703420\nEinreichung neuer Dokumente\n\nAmbulante Hilfen im Landkreis Konstanz Gemeinnützige Gesellschaft mbH\nGesellschaft mit beschränkter Haftung\nSingen Hohentwiel\n\nDie Gesellschaft hat am 16.01.2025 die Liste über die Zusammensetzung des Aufsichtsrats zum Handelsregister eingereicht."
    },
    {
      "date": "2025-01-20",
      "id": "99065",
      "original_text": "Löschungsankündigung\nHessen Amtsgericht Frankfurt am Main HRB 103681\nBanyan Tree Goods GmbH – Frankfurt am Main",
      "type": "Löschungsankündigung",
      "state": "Hessen",
      "amtsgericht": "Amtsgericht Frankfurt am Main",
      "registernummer": "HRB 103681",
      "registerart": "HRB",
      "company_name": "Banyan Tree Goods GmbH",
      "company_seat": "Frankfurt am Main",
      "details": "20.01.2025 (Bekanntmachungsdatum)\n\nHessen Amtsgericht Frankfurt am Main HRB 103681\nLöschungsankündigung\n\nBanyan Tree Goods GmbH\nGesellschaft mit beschränkter Haftung\nFrankfurt am Main\n\nDas Registergericht beabsichtigt die im Handelsregister eingetragene Gesellschaft von Amts wegen nach § 394 FamFG zu löschen. Sollte kein Widerspruch binnen der genannten Frist hier eingehen wird das Gericht davon ausgehen, dass eine tatsächliche Vermögenslosigkeit vorliegt."
    },
    {
      "date": "2025-01-20",
      "id": "99066",
      "original_text": "Sonstige Registerbekanntmachung\nHessen Amtsgericht Offenbach am Main VR 5102\nKunst in Rödermark – Rödermark",
      "type": "Sonstige Registerbekanntmachung",
      "state": "Hessen",
      "amtsgericht": "Amtsgericht Offenbach am Main",
      "registernummer": "VR 5102",
      "registerart": "VR",
      "company_name": "Kunst in Rödermark",
      "company_seat": "Rödermark",
      "details": "20.01.2025 (Bekanntmachungsdatum)\n\nHessen Amtsgericht Offenbach am Main VR 5102\nSonstige Registerbekanntmachung 20.01.2025 (Eintragungsdatum)\n\nKunst in Rödermark\neingetragener Verein\nRödermark\n\nDer Verein ist aufgelöst."
    },
    {
      "date": "2025-01-20",
      "id": "99067",
      "original_text": "Registerbekanntmachung nach dem Umwandlungsgesetz\nHessen Amtsgericht Frankfurt am Main HRA 53446\nGASTRONOMIE INSTITUT GmbH & Co. KG – Frankfurt am Main",
      "type": "Registerbekanntmachung nach dem Umwandlungsgesetz",
      "state": "Hessen",
      "amtsgericht": "Amtsgericht Frankfurt am Main",
      "registernummer": "HRA 53446",
      "registerart": "HRA",
      "company_name": "GASTRONOMIE INSTITUT GmbH & Co. KG",
      "company_seat": "Frankfurt am Main",
      "details": "20.01.2025 (Bekanntmachungsdatum)\n\nHessen Amtsgericht Frankfurt am Main HRA 53446\nRegisterbekanntmachung nach dem Umwandlungsgesetz 20.01.2025 (Eintragungsdatum)\n\nGASTRONOMIE INSTITUT GmbH & Co. KG\nKommanditgesellschaft\nFrankfurt am Main\n\nDen Gläubigern der an der Ausgliederung beteiligten Rechtsträger ist, wenn sie binnen sechs Monaten nach dem Tag, an dem die Eintragung der Ausgliederung in das Register des Sitzes derjenigen Rechtsträger deren Gläubiger sie sind, nach §§ 125, 19 Absatz 3 UmwG bekannt gemacht worden ist, ihren Anspruch nach Grund und Höhe schriftlich anmelden, Sicherheit zu leisten, soweit sie nicht Befriedigung verlangen können. Dieses Recht steht den Gläubigern jedoch nur zu, wenn sie glaubhaft machen, dass durch die Ausgliederung die Erfüllung ihrer Forderung gefährdet wird."
    },
    {
      "date": "2025-01-20",
      "id": "99068",
      "original_text": "Einreichung neuer Dokumente\nHessen Amtsgericht Limburg HRB 4465\nPur.AG – Weilburg",
      "type": "Einreichung neuer Dokumente",
      "state": "Hessen",
      "amtsgericht": "Amtsgericht Limburg",
      "registernummer": "HRB 4465",
      "registerart": "HRB",
      "company_name": "Pur.AG",
      "company_seat": "Weilburg",
      "details": "20.01.2025 (Bekanntmachungsdatum)\n\nHessen Amtsgericht Limburg HRB 4465\nEinreichung neuer Dokumente\n\nPur.AG\nAktiengesellschaft\nWeilburg\n\nDurch eine Änderung in den Personen der Aufsichtsratsmitglieder ist eine Liste der Mitglieder des Aufsichtsrates zum Handelsregister eingereicht worden."
    },
    {
      "date": "2025-01-20",
      "id": "99069",
      "original_text": "Registerbekanntmachung nach dem Umwandlungsgesetz\nHessen Amtsgericht Kassel VR 5560\nKarnevalsgesellschaft M-Einser Kassel 1956 e.V. – Kassel",
      "type": "Registerbekanntmachung nach dem Umwandlungsgesetz",
      "state": "Hessen",
      "amtsgericht": "Amtsgericht Kassel",
      "registernummer": "VR 5560",
      "registerart": "VR",
      "company_name": "Karnevalsgesellschaft M-Einser Kassel 1956 e.V.",
      "company_seat": "Kassel",
      "details": "20.01.2025 (Bekanntmachungsdatum)\n\nHessen Amtsgericht Kassel VR 5560\nRegisterbekanntmachung nach dem Umwandlungsgesetz 20.01.2025 (Eintragungsdatum)\n\nKarnevalsgesellschaft M-Einser Kassel 1956 e.V.\neingetragener Verein\nKassel\n\nDen Gläubigern der an der Verschmelzung beteiligten Rechtsträger ist, wenn sie binnen sechs Monaten nach dem Tag, an dem die Eintragung der Verschmelzung in das Register des Sitzes desjenigen Rechtsträgers, dessen Gläubiger sie sind, nach § 19 Absatz 3 UmwG bekannt gemacht worden ist, ihren Anspruch nach Grund und Höhe schriftlich anmelden, Sicherheit zu leisten, soweit sie nicht Befriedigung verlangen können. Dieses Recht steht den Gläubigern jedoch nur zu, wenn sie glaubhaft machen, dass durch die Verschmelzung die Erfüllung ihrer Forderung gefährdet wird."
    },
    {
      "date": "2025-01-20",
      "id": "99070",
      "original_text": "Einreichung neuer Dokumente\nHessen Amtsgericht Wiesbaden HRB 16244\nBiogest AG – Taunusstein",
      "type": "Einreichung neuer Dokumente",
      "state": "Hessen",
      "amtsgericht": "Amtsgericht Wiesbaden",
      "registernummer": "HRB 16244",
      "registerart": "HRB",
      "company_name": "Biogest AG",
      "company_seat": "Taunusstein",
      "details": "20.01.2025 (Bekanntmachungsdatum)\n\nHessen Amtsgericht Wiesbaden HRB 16244\nEinreichung neuer Dokumente\n\nBiogest AG\nAktiengesellschaft\nTaunusstein\n\nDurch eine Änderung in den Personen der Aufsichtsratsmitglieder ist eine Liste der Mitglieder des Aufsichtsrates zum Handelsregister eingereicht worden."
    },
    {
      "date": "2025-01-20",
      "id": "99071",
      "original_text": "Einreichung neuer Dokumente\nHessen Amtsgericht Frankfurt am Main HRB 116693\nReesca AG – Frankfurt am Main",
      "type": "Einreichung neuer Dokumente",
      "state": "Hessen",
      "amtsgericht": "Amtsgericht Frankfurt am Main",
      "registernummer": "HRB 116693",
      "registerart": "HRB",
      "company_name": "Reesca AG",
      "company_seat": "Frankfurt am Main",
      "details": "20.01.2025 (Bekanntmachungsdatum)\n\nHessen Amtsgericht Frankfurt am Main HRB 116693\nEinreichung neuer Dokumente 20.01.2025 (Eintragungsdatum)\n\nReesca AG\nAktiengesellschaft\nFrankfurt am Main\n\nDurch eine Änderung in den Personen der Aufsichtsratsmitglieder ist eine Liste der Mitglieder des Aufsichtsrates zum Handelsregister eingereicht worden."
    },
    {
      "date": "2025-01-20",
      "id": "99072",
      "original_text": "Registerbekanntmachung nach dem Umwandlungsgesetz\nHessen Amtsgericht Kassel VR 901\nKarnevalsgesellschaft \" Kassel-Süd \" 1960 e.V. – Kassel",
      "type": "Registerbekanntmachung nach dem Umwandlungsgesetz",
      "state": "Hessen",
      "amtsgericht": "Amtsgericht Kassel",
      "registernummer": "VR 901",
      "registerart": "VR",
      "company_name": "Karnevalsgesellschaft \" Kassel-Süd \" 1960 e.V.",
      "company_seat": "Kassel",
      "details": "20.01.2025 (Bekanntmachungsdatum)\n\nHessen Amtsgericht Kassel VR 901\nRegisterbekanntmachung nach dem Umwandlungsgesetz 20.01.2025 (Eintragungsdatum)\n\nKarnevalsgesellschaft \" Kassel-Süd \" 1960 e.V.\neingetragener Verein\nKassel\n\nDen Gläubigern der an der Verschmelzung beteiligten Rechtsträger ist, wenn sie binnen sechs Monaten nach dem Tag, an dem die Eintragung der Verschmelzung in das Register des Sitzes desjenigen Rechtsträgers, dessen Gläubiger sie sind, nach § 19 Absatz 3 UmwG bekannt gemacht worden ist, ihren Anspruch nach Grund und Höhe schriftlich anmelden, Sicherheit zu leisten, soweit sie nicht Befriedigung verlangen können. Dieses Recht steht den Gläubigern jedoch nur zu, wenn sie glaubhaft machen, dass durch die Verschmelzung die Erfüllung ihrer Forderung gefährdet wird."
    },
    {
      "date": "2025-01-20",
      "id": "99073",
      "original_text": "Löschungsankündigung\nHessen Amtsgericht Friedberg VR 3274\nZentrum für Medienkompetenz e. V. – Ober-Mörlen",
      "type": "Löschungsankündigung",
      "state": "Hessen",
      "amtsgericht": "Amtsgericht Friedberg",
      "registernummer": "VR 3274",
      "registerart": "VR",
      "company_name": "Zentrum für Medienkompetenz e. V.",
      "company_seat": "Ober-Mörlen",
      "details": "20.01.2025 (Bekanntmachungsdatum)\n\nHessen Amtsgericht Friedberg VR 3274\nLöschungsankündigung\n\nZentrum für Medienkompetenz e. V.\neingetragener Verein\nOber-Mörlen\n\nDas Registergericht beabsichtigt den im Vereinsregister eingetragenen Verein von Amts wegen nach § 395 FamFG zu löschen. Die Frist zur Erhebung eines Widerspruchs gegen die beabsichtigte Löschung wird auf zwei Monate festgesetzt."
    },
    {
      "date": "2025-01-20",
      "id": "99074",
      "original_text": "Registerbekanntmachung nach dem Umwandlungsgesetz\nHessen Amtsgericht Frankfurt am Main HRA 53341\nBarbara Anders GASTRONOMIE INSTITUT e.K. – Frankfurt am Main",
      "type": "Registerbekanntmachung nach dem Umwandlungsgesetz",
      "state": "Hessen",
      "amtsgericht": "Amtsgericht Frankfurt am Main",
      "registernummer": "HRA 53341",
      "registerart": "HRA",
      "company_name": "Barbara Anders GASTRONOMIE INSTITUT e.K.",
      "company_seat": "Frankfurt am Main",
      "details": "20.01.2025 (Bekanntmachungsdatum)\n\nHessen Amtsgericht Frankfurt am Main HRA 53341\nRegisterbekanntmachung nach dem Umwandlungsgesetz 20.01.2025 (Eintragungsdatum)\n\nBarbara Anders GASTRONOMIE INSTITUT e.K.\nEinzelkaufmann / Einzelkauffrau\nFrankfurt am Main\n\nDen Gläubigern der an der Ausgliederung beteiligten Rechtsträger ist, wenn sie binnen sechs Monaten nach dem Tag, an dem die Eintragung der Ausgliederung in das Register des Sitzes derjenigen Rechtsträger deren Gläubiger sie sind, nach §§ 125, 19 Absatz 3 UmwG bekannt gemacht worden ist, ihren Anspruch nach Grund und Höhe schriftlich anmelden, Sicherheit zu leisten, soweit sie nicht Befriedigung verlangen können. Dieses Recht steht den Gläubigern jedoch nur zu, wenn sie glaubhaft machen, dass durch die Ausgliederung die Erfüllung ihrer Forderung gefährdet wird."
    },
    {
      "date": "2025-01-20",
      "id": "99075",
      "original_text": "Löschungsankündigung\nHessen Amtsgericht Fulda HRB 8184\nGuerrero de Baez Spirituosen UG (haftungsbeschränkt) – Flieden",
      "type": "Löschungsankündigung",
      "state": "Hessen",
      "amtsgericht": "Amtsgericht Fulda",
      "registernummer": "HRB 8184",
      "registerart": "HRB",
      "company_name": "Guerrero de Baez Spirituosen UG (haftungsbeschränkt)",
      "company_seat": "Flieden",
      "details": "20.01.2025 (Bekanntmachungsdatum)\n\nHessen Amtsgericht Fulda HRB 8184\nLöschungsankündigung\n\nGuerrero de Baez Spirituosen UG (haftungsbeschränkt)\nGesellschaft mit beschränkter Haftung\nFlieden\n\nDas Registergericht beabsichtigt die im Handelsregister eingetragene Gesellschaft von Amts wegen nach § 394 FamFG zu löschen. Die Frist zur Erhebung eines Widerspruchs gegen die beabsichtigte Löschung wird auf 3 Monate festgesetzt."
    },
    {
      "date": "2025-01-20",
      "id": "99076",
      "original_text": "Registerbekanntmachung nach dem Umwandlungsgesetz\nHessen Amtsgericht Frankfurt am Main HRB 129347\nDENTAL-FOX GmbH – Frankfurt am Main",
      "type": "Registerbekanntmachung nach dem Umwandlungsgesetz",
      "state": "Hessen",
      "amtsgericht": "Amtsgericht Frankfurt am Main",
      "registernummer": "HRB 129347",
      "registerart": "HRB",
      "company_name": "DENTAL-FOX GmbH",
      "company_seat": "Frankfurt am Main",
      "details": "20.01.2025 (Bekanntmachungsdatum)\n\nHessen Amtsgericht Frankfurt am Main HRB 129347\nRegisterbekanntmachung nach dem Umwandlungsgesetz 20.01.2025 (Eintragungsdatum)\n\nDENTAL-FOX GmbH\nGesellschaft mit beschränkter Haftung\nFrankfurt am Main\n\nDen Gläubigern der an der Verschmelzung beteiligten Rechtsträger ist, wenn sie binnen sechs Monaten nach dem Tag, an dem die Eintragung der Verschmelzung in das Register des Sitzes derjenigen Rechtsträger deren Gläubiger sie sind, nach § 19 Absatz 3 UmwG bekannt gemacht worden ist, ihren Anspruch nach Grund und Höhe schriftlich anmelden, Sicherheit zu leisten, soweit sie nicht Befriedigung verlangen können. Dieses Recht steht den Gläubigern jedoch nur zu, wenn sie glaubhaft machen, dass durch die Verschmelzung die Erfüllung ihrer Forderung gefährdet wird."
    },
    {
      "date": "2025-01-20",
      "id": "99077",
      "original_text": "Registerbekanntmachung nach dem Umwandlungsgesetz\nHessen Amtsgericht Frankfurt am Main HRB 128796\npluradent dental bauer GmbH – Frankfurt am Main",
      "type": "Registerbekanntmachung nach dem Umwandlungsgesetz",
      "state": "Hessen",
      "amtsgericht": "Amtsgericht Frankfurt am Main",
      "registernummer": "HRB 128796",
      "registerart": "HRB",
      "company_name": "pluradent dental bauer GmbH",
      "company_seat": "Frankfurt am Main",
      "details": "20.01.2025 (Bekanntmachungsdatum)\n\nHessen Amtsgericht Frankfurt am Main HRB 128796\nRegisterbekanntmachung nach dem Umwandlungsgesetz 20.01.2025 (Eintragungsdatum)\n\npluradent dental bauer GmbH\nGesellschaft mit beschränkter Haftung\nFrankfurt am Main\n\nDen Gläubigern der an der Verschmelzung beteiligten Rechtsträger ist, wenn sie binnen sechs Monaten nach dem Tag, an dem die Eintragung der Verschmelzung in das Register des Sitzes derjenigen Rechtsträger deren Gläubiger sie sind, nach § 19 Absatz 3 UmwG bekannt gemacht worden ist, ihren Anspruch nach Grund und Höhe schriftlich anmelden, Sicherheit zu leisten, soweit sie nicht Befriedigung verlangen können. Dieses Recht steht den Gläubigern jedoch nur zu, wenn sie glaubhaft machen, dass durch die Verschmelzung die Erfüllung ihrer Forderung gefährdet wird."
    },
    {
      "date": "2025-01-20",
      "id": "99078",
      "original_text": "Registerbekanntmachung nach dem Umwandlungsgesetz\nHessen Amtsgericht Frankfurt am Main VR 4057\nITGA - Industrieverband Technische Gebäudeausrüstung und Umwelttechnik Hessen, Rheinland-Pfalz und Saarland e.V. – Frankfurt am Main",
      "type": "Registerbekanntmachung nach dem Umwandlungsgesetz",
      "state": "Hessen",
      "amtsgericht": "Amtsgericht Frankfurt am Main",
      "registernummer": "VR 4057",
      "registerart": "VR",
      "company_name": "ITGA - Industrieverband Technische Gebäudeausrüstung und Umwelttechnik Hessen, Rheinland-Pfalz und Saarland e.V.",
      "company_seat": "Frankfurt am Main",
      "details": "20.01.2025 (Bekanntmachungsdatum)\n\nHessen Amtsgericht Frankfurt am Main VR 4057\nRegisterbekanntmachung nach dem Umwandlungsgesetz 20.01.2025 (Eintragungsdatum)\n\nITGA - Industrieverband Technische Gebäudeausrüstung und Umwelttechnik Hessen, Rheinland-Pfalz und Saarland e.V.\neingetragener Verein\nFrankfurt am Main\n\nDen Gläubigern der an der Verschmelzung beteiligten Rechtsträgern ist, wenn sie binnen sechs Monaten nach dem Tag, an dem die Eintragung der Verschmelzung in das Register des Sitzes desjenigen Rechtsträgers, dessen Gläubiger sie sind, nach § 19 Absatz 3 UmwG bekannt gemacht worden ist, ihren Anspruch nach Grund und Höhe schriftlich anmelden, Sicherheit zu leisten, soweit sie nicht Befriedigung verlangen können. Dieses Recht steht den Gläubigern jedoch nur zu, wenn sie glaubhaft machen, dass durch die Verschmelzung die Erfüllung ihrer Forderung gefährdet wird."
    },
    {
      "date": "2025-01-20",
      "id": "99079",
      "original_text": "Einreichung neuer Dokumente\nHessen Amtsgericht Kassel HRB 13338\nVolkswagen Original Teile Logistik Beteiligungs-GmbH – Baunatal",
      "type": "Einreichung neuer Dokumente",
      "state": "Hessen",
      "amtsgericht": "Amtsgericht Kassel",
      "registernummer": "HRB 13338",
      "registerart": "HRB",
      "company_name": "Volkswagen Original Teile Logistik Beteiligungs-GmbH",
      "company_seat": "Baunatal",
      "details": "20.01.2025 (Bekanntmachungsdatum)\n\nHessen Amtsgericht Kassel HRB 13338\nEinreichung neuer Dokumente\n\nVolkswagen Original Teile Logistik Beteiligungs-GmbH\nGesellschaft mit beschränkter Haftung\nBaunatal\n\nDurch eine Änderung in den Personen der Aufsichtsratsmitglieder ist eine Liste der Mitglieder des Aufsichtsrates zum Handelsregister eingereicht worden."
    },
    {
      "date": "2025-01-20",
      "id": "99080",
      "original_text": "Einreichung neuer Dokumente\nHessen Amtsgericht Frankfurt am Main HRB 112899\nDeutsche BauFi Immobilien AG – Frankfurt am Main",
      "type": "Einreichung neuer Dokumente",
      "state": "Hessen",
      "amtsgericht": "Amtsgericht Frankfurt am Main",
      "registernummer": "HRB 112899",
      "registerart": "HRB",
      "company_name": "Deutsche BauFi Immobilien AG",
      "company_seat": "Frankfurt am Main",
      "details": "20.01.2025 (Bekanntmachungsdatum)\n\nHessen Amtsgericht Frankfurt am Main HRB 112899\nEinreichung neuer Dokumente\n\nDeutsche BauFi Immobilien AG\nAktiengesellschaft\nFrankfurt am Main\n\nDurch eine Änderung in den Personen der Aufsichtsratsmitglieder ist eine Liste der Mitglieder des Aufsichtsrates zum Handelsregister eingereicht worden."
    },
    {
      "date": "2025-01-20",
      "id": "99081",
      "original_text": "Löschungsankündigung\nHessen Amtsgericht Darmstadt HRB 103781\nMARTIN BAU GmbH – Nauheim",
      "type": "Löschungsankündigung",
      "state": "Hessen",
      "amtsgericht": "Amtsgericht Darmstadt",
      "registernummer": "HRB 103781",
      "registerart": "HRB",
      "company_name": "MARTIN BAU GmbH",
      "company_seat": "Nauheim",
      "details": "20.01.2025 (Bekanntmachungsdatum)\n\nHessen Amtsgericht Darmstadt HRB 103781\nLöschungsankündigung 20.01.2025 (Eintragungsdatum)\n\nMARTIN BAU GmbH\nGesellschaft mit beschränkter Haftung\nNauheim\n\nDas Registergericht beabsichtigt die im Handelsregister eingetragene Gesellschaft von Amts wegen nach § 394 FamFG zu löschen. Die Frist zur Erhebung eines Widerspruchs gegen die beabsichtigte Löschung wird auf 3 Monate festgesetzt."
    },
    {
      "date": "2025-01-20",
      "id": "99082",
      "original_text": "Registerbekanntmachung nach dem Umwandlungsgesetz\nHessen Amtsgericht Frankfurt am Main HRB 134611\nMainsee 1545. V V GmbH – Frankfurt am Main",
      "type": "Registerbekanntmachung nach dem Umwandlungsgesetz",
      "state": "Hessen",
      "amtsgericht": "Amtsgericht Frankfurt am Main",
      "registernummer": "HRB 134611",
      "registerart": "HRB",
      "company_name": "Mainsee 1545. V V GmbH",
      "company_seat": "Frankfurt am Main",
      "details": "20.01.2025 (Bekanntmachungsdatum)\n\nHessen Amtsgericht Frankfurt am Main HRB 134611\nRegisterbekanntmachung nach dem Umwandlungsgesetz 20.01.2025 (Eintragungsdatum)\n\nMainsee 1545. V V GmbH\nGesellschaft mit beschränkter Haftung\nFrankfurt am Main\n\nDen Gläubigern der an der Verschmelzung beteiligten Rechtsträger ist, wenn sie binnen sechs Monaten nach dem Tag, an dem die Eintragung der Verschmelzung in das Register des Sitzes desjenigen Rechtsträgers, dessen Gläubiger sie sind, nach § 19 Absatz 3 UmwG bekannt gemacht worden ist, ihren Anspruch nach Grund und Höhe schriftlich anmelden, Sicherheit zu leisten, soweit sie nicht Befriedigung verlangen können. Dieses Recht steht den Gläubigern jedoch nur zu, wenn sie glaubhaft machen, dass durch die Verschmelzung die Erfüllung ihrer Forderung gefährdet wird."
    }
  ]
}