{
  "date": "2025-01-07",
  "date_of_scrape": "2025-01-08T04:06:44.605Z",
  "tool_version": "0.2.0",
  "number_of_announcements": 109,
  "announcements": [
    {
      "date": "2025-01-07",
      "id": "97908",
      "original_text": "Registerbekanntmachung nach dem Umwandlungsgesetz\nBayern Amtsgericht Traunstein HRB 30652\nKarsten Ottenberg Beteiligungs UG (haftungsbeschränkt) – Frasdorf",
      "type": "Registerbekanntmachung nach dem Umwandlungsgesetz",
      "state": "Bayern",
      "amtsgericht": "Amtsgericht Traunstein",
      "registernummer": "HRB 30652",
      "registerart": "HRB",
      "company_name": "Karsten Ottenberg Beteiligungs UG (haftungsbeschränkt)",
      "company_seat": "Frasdorf",
      "details": "07.01.2025 (Bekanntmachungsdatum)\n\nBayern Amtsgericht Traunstein HRB 30652\nRegisterbekanntmachung nach dem Umwandlungsgesetz\n\nKarsten Ottenberg Beteiligungs UG (haftungsbeschränkt)\nGesellschaft mit beschränkter Haftung\nFrasdorf\n\nDem Amtsgericht Traunstein -Registergericht- ist am 11.12.2024 ein Verschmelzungsplan über die geplante Verschmelzung der GmbH nach österreichischem Recht unter Firma KOVENT GmbH mit Sitz in Maria Rain/Österreich (Firmenbuchnummer 630426 y) mit der Gesellschaft als übertragendem Rechtsträger eingereicht worden.\nRechte der Anteilsinhaber und Gläubiger der an der grenzüberschreitenden Verschmelzung beteiligten Gesellschaften sowie der zuständigen Betriebsräte der an der grenzüberschreitenden Verschmelzung beteiligten Gesellschaften oder, soweit es keinen Betriebsrat gibt, an die Arbeitnehmer der an der grenzüberschreitenden Verschmelzung beteiligten Gesellschaften: sie können der jeweiligen Gesellschaft spätestens fünf Arbeitstage vor dem Tag der Gesellschafterversammlung Bemerkungen zum Verschmelzungsplan übermitteln § 308 Abs. 1 S. 1 Nr. 4 UmwG)."
    },
    {
      "date": "2025-01-07",
      "id": "97909",
      "original_text": "Registerbekanntmachung nach dem Umwandlungsgesetz\nBayern Amtsgericht München HRB 184524\nSüddeutscher Verlag Veranstaltungen GmbH – München",
      "type": "Registerbekanntmachung nach dem Umwandlungsgesetz",
      "state": "Bayern",
      "amtsgericht": "Amtsgericht München",
      "registernummer": "HRB 184524",
      "registerart": "HRB",
      "company_name": "Süddeutscher Verlag Veranstaltungen GmbH",
      "company_seat": "München",
      "details": "07.01.2025 (Bekanntmachungsdatum)\n\nBayern Amtsgericht München HRB 184524\nRegisterbekanntmachung nach dem Umwandlungsgesetz 04.01.2025 (Eintragungsdatum)\n\nSüddeutscher Verlag Veranstaltungen GmbH\nGesellschaft mit beschränkter Haftung\nMünchen\n\nDen Gläubigern der Gesellschaft, deren Forderungen begründet worden sind, bevor die Eintragung der Beendigung des Beherrschungsvertrages in das Handelsregister nach § 10 des Handelsgesetzbuches als bekanntgemacht gilt, hat der andere Vertragsteil Sicherheit zu leisten, wenn sie sich binnen sechs Monaten nach der Bekanntmachung der Eintragung zu diesem Zweck bei ihm melden.\nDen Gläubigern der Gesellschaft, deren Forderungen begründet worden sind, bevor die Eintragung der Beendigung des Gewinnabführungsvertrages in das Handelsregister nach § 10 des Handelsgesetzbuches als bekanntgemacht gilt, hat der andere Vertragsteil Sicherheit zu leisten, wenn sie sich binnen sechs Monaten nach der Bekanntmachung der Eintragung zu diesem Zweck bei ihm melden."
    },
    {
      "date": "2025-01-07",
      "id": "97910",
      "original_text": "Löschungsankündigung\nBaden-Württemberg Amtsgericht Stuttgart HRB 15869\nBurkhardt Leitner constructiv Beteiligungs-GmbH – Stuttgart",
      "type": "Löschungsankündigung",
      "state": "Baden-Württemberg",
      "amtsgericht": "Amtsgericht Stuttgart",
      "registernummer": "HRB 15869",
      "registerart": "HRB",
      "company_name": "Burkhardt Leitner constructiv Beteiligungs-GmbH",
      "company_seat": "Stuttgart",
      "details": "07.01.2025 (Bekanntmachungsdatum)\n\nBaden-Württemberg Amtsgericht Stuttgart HRB 15869\nLöschungsankündigung\n\nBurkhardt Leitner constructiv Beteiligungs-GmbH\nGesellschaft mit beschränkter Haftung\nStuttgart\n\nDas Gericht beabsichtigt, die Gesellschaft wegen Vermögenslosigkeit im Handelsregister von Amts wegen nach § 394 FamFG zu löschen. Die Frist zur Geltendmachung eines Widerspruchs gegen die beabsichtigte Löschung ist auf einen Monat ab Veröffentlichung bestimmt."
    },
    {
      "date": "2025-01-07",
      "id": "97911",
      "original_text": "Löschungsankündigung\nSchleswig-Holstein Amtsgericht Flensburg HRB 11039\nSönnichsen & Z. von Wildenradt Holding GmbH – Glücksburg",
      "type": "Löschungsankündigung",
      "state": "Schleswig-Holstein",
      "amtsgericht": "Amtsgericht Flensburg",
      "registernummer": "HRB 11039",
      "registerart": "HRB",
      "company_name": "Sönnichsen & Z. von Wildenradt Holding GmbH",
      "company_seat": "Glücksburg",
      "details": "07.01.2025 (Bekanntmachungsdatum)\n\nSchleswig-Holstein Amtsgericht Flensburg HRB 11039\nLöschungsankündigung\n\nSönnichsen & Z. von Wildenradt Holding GmbH\nGesellschaft mit beschränkter Haftung\nGlücksburg\n\nEs ist die Löschung der nachstehenden Gesellschaft wegen Vermögenslosigkeit gemäß § 394 FamFG beabsichtigt.\nWiderspruchsfrist: 2 Monate"
    },
    {
      "date": "2025-01-07",
      "id": "97912",
      "original_text": "Löschungsankündigung\nSchleswig-Holstein Amtsgericht Lübeck HRB 16073\nBierpup Chap UG (haftungsbeschränkt) – Lübeck",
      "type": "Löschungsankündigung",
      "state": "Schleswig-Holstein",
      "amtsgericht": "Amtsgericht Lübeck",
      "registernummer": "HRB 16073",
      "registerart": "HRB",
      "company_name": "Bierpup Chap UG (haftungsbeschränkt)",
      "company_seat": "Lübeck",
      "details": "07.01.2025 (Bekanntmachungsdatum)\n\nSchleswig-Holstein Amtsgericht Lübeck HRB 16073\nLöschungsankündigung\n\nBierpup Chap UG (haftungsbeschränkt)\nGesellschaft mit beschränkter Haftung\nLübeck\n\nEs ist die Löschung der nachstehenden Gesellschaft wegen Vermögenslosigkeit gemäß § 394 FamFG beabsichtigt."
    },
    {
      "date": "2025-01-07",
      "id": "97913",
      "original_text": "Sonstige Registerbekanntmachung\nBaden-Württemberg Amtsgericht Stuttgart HRB 264361\nGF Machining Solutions GmbH – Schorndorf",
      "type": "Sonstige Registerbekanntmachung",
      "state": "Baden-Württemberg",
      "amtsgericht": "Amtsgericht Stuttgart",
      "registernummer": "HRB 264361",
      "registerart": "HRB",
      "company_name": "GF Machining Solutions GmbH",
      "company_seat": "Schorndorf",
      "details": "07.01.2025 (Bekanntmachungsdatum)\n\nBaden-Württemberg Amtsgericht Stuttgart HRB 264361\nSonstige Registerbekanntmachung 07.01.2025 (Eintragungsdatum)\n\nGF Machining Solutions GmbH\nGesellschaft mit beschränkter Haftung\nSchorndorf\n\nAls nicht eingetragen wird bekanntgemacht:\nDen Gläubigern der Gesellschaft, deren Forderungen begründet worden sind, bevor die Eintragung der Beendigung des jeweiligen Vertrages in das Handelsregister nach § 10 HGB als bekanntgemacht gilt, ist vom anderen Vertragsteil Sicherheit zu leisten, wenn sie sich binnen sechs Monaten nach der Bekanntmachung zu diesem Zweck bei ihm melden."
    },
    {
      "date": "2025-01-07",
      "id": "97914",
      "original_text": "Sonstige Registerbekanntmachung\nBerlin Amtsgericht Berlin (Charlottenburg) HRB 270845\nHNF Works GmbH – Berlin",
      "type": "Sonstige Registerbekanntmachung",
      "state": "Berlin",
      "amtsgericht": "Amtsgericht Berlin (Charlottenburg)",
      "registernummer": "HRB 270845",
      "registerart": "HRB",
      "company_name": "HNF Works GmbH",
      "company_seat": "Berlin",
      "details": "07.01.2025 (Bekanntmachungsdatum)\n\nBerlin Amtsgericht Berlin (Charlottenburg) HRB 270845\nSonstige Registerbekanntmachung\n\nHNF Works GmbH\nGesellschaft mit beschränkter Haftung\nBerlin\n\nAls nicht eingetragen wird veröffentlicht:Der andere Vertragsteil hat den Gläubigern dieses Rechtsträgers, deren Forderungen begründet worden sind, bevor die Eintragung der Beendigung dieses Vertrages in das Handelsregister nach § 10 des Handelsgesetzbuches als bekannt gemacht gilt, Sicherheit zu leisten, wenn sie sich binnen sechs Monaten nach der Bekanntmachung der Eintragung zu diesem Zweck bei ihm melden. Dieses Recht steht den Gläubigern nicht zu, die im Fall des Insolvenzverfahrens ein Recht auf vorzugsweise Befriedigung aus der Deckungsmasse haben, die nach gesetzlicher Vorschrift zu ihrem Schutz errichtet und staatlich überwacht ist."
    },
    {
      "date": "2025-01-07",
      "id": "97915",
      "original_text": "Sonstige Registerbekanntmachung\nBerlin Amtsgericht Berlin (Charlottenburg) HRB 115391\nAxel Springer Syndication GmbH – Berlin",
      "type": "Sonstige Registerbekanntmachung",
      "state": "Berlin",
      "amtsgericht": "Amtsgericht Berlin (Charlottenburg)",
      "registernummer": "HRB 115391",
      "registerart": "HRB",
      "company_name": "Axel Springer Syndication GmbH",
      "company_seat": "Berlin",
      "details": "07.01.2025 (Bekanntmachungsdatum)\n\nBerlin Amtsgericht Berlin (Charlottenburg) HRB 115391\nSonstige Registerbekanntmachung\n\nAxel Springer Syndication GmbH\nGesellschaft mit beschränkter Haftung\nBerlin\n\nAls nicht eingetragen wird veröffentlicht: Der andere Vertragsteil hat den Gläubigern dieses Rechtsträgers, deren Forderungen begründet worden sind, bevor die Eintragung der Beendigung dieses Vertrages in das Handelsregister nach § 10 des Handelsgesetzbuches als bekannt gemacht gilt, Sicherheit zu leisten, wenn sie sich binnen sechs Monaten nach der Bekanntmachung der Eintragung zu diesem Zweck bei ihm melden. Dieses Recht steht den Gläubigern nicht zu, die im Fall des Insolvenzverfahrens ein Recht auf vorzugsweise Befriedigung aus der Deckungsmasse haben, die nach gesetzlicher Vorschrift zu ihrem Schutz errichtet und staatlich überwacht ist."
    },
    {
      "date": "2025-01-07",
      "id": "97916",
      "original_text": "Sonstige Registerbekanntmachung\nSachsen-Anhalt Amtsgericht Stendal HRB 27414\nGETEC Kundenservice GmbH – Magdeburg",
      "type": "Sonstige Registerbekanntmachung",
      "state": "Sachsen-Anhalt",
      "amtsgericht": "Amtsgericht Stendal",
      "registernummer": "HRB 27414",
      "registerart": "HRB",
      "company_name": "GETEC Kundenservice GmbH",
      "company_seat": "Magdeburg",
      "details": "07.01.2025 (Bekanntmachungsdatum)\n\nSachsen-Anhalt Amtsgericht Stendal HRB 27414\nSonstige Registerbekanntmachung 07.01.2025 (Eintragungsdatum)\n\nGETEC Kundenservice GmbH\nGesellschaft mit beschränkter Haftung\nMagdeburg\n\nNicht eingetragen:\nAls nicht eingetragen wird veröffentlicht: Den Gläubigern der Gesellschaft, deren Forderungen begründet worden sind bevor die Eintragung der Beendigung des #DV.Art(Text=\"Art des Vertrages auswählen\",Eingabe=\"Beherrschungs- und Gewinnabführungsvertrages\",\"Beherrschungsvertrages\",\"Gewinnabführungsvertrages\",\"Teilgewinnabführungsvertrages\")  in das Handelsregister nach § 10 des Handelsgesetzbuches als bekanntgemacht gilt, hat der andere Vertragsteil Sicherheit zu leisten, wenn sie sich binnen sechs Monaten nach der Bekanntmachung der Eintragung zu diesem Zweck bei ihm melden."
    },
    {
      "date": "2025-01-07",
      "id": "97917",
      "original_text": "Löschungsankündigung\nBerlin Amtsgericht Berlin (Charlottenburg) HRB 169681\nLuxor Taxi GmbH – Berlin",
      "type": "Löschungsankündigung",
      "state": "Berlin",
      "amtsgericht": "Amtsgericht Berlin (Charlottenburg)",
      "registernummer": "HRB 169681",
      "registerart": "HRB",
      "company_name": "Luxor Taxi GmbH",
      "company_seat": "Berlin",
      "details": "07.01.2025 (Bekanntmachungsdatum)\n\nBerlin Amtsgericht Berlin (Charlottenburg) HRB 169681\nLöschungsankündigung\n\nLuxor Taxi GmbH\nGesellschaft mit beschränkter Haftung\nBerlin\n\nBei der nachstehenden Gesellschaft wird das Amtslöschungsverfahren gemäß § 394 FamFG eingeleitet. Widerspruchsfrist 6 Wochen"
    },
    {
      "date": "2025-01-07",
      "id": "97918",
      "original_text": "Löschungsankündigung\nBerlin Amtsgericht Berlin (Charlottenburg) HRB 151689\nCity Aktiv GmbH – Berlin",
      "type": "Löschungsankündigung",
      "state": "Berlin",
      "amtsgericht": "Amtsgericht Berlin (Charlottenburg)",
      "registernummer": "HRB 151689",
      "registerart": "HRB",
      "company_name": "City Aktiv GmbH",
      "company_seat": "Berlin",
      "details": "07.01.2025 (Bekanntmachungsdatum)\n\nBerlin Amtsgericht Berlin (Charlottenburg) HRB 151689\nLöschungsankündigung\n\nCity Aktiv GmbH\nGesellschaft mit beschränkter Haftung\nBerlin\n\nBei der nachstehenden Gesellschaft wird das Amtslöschungsverfahren gemäß § 394 FamFG eingeleitet. Widerspruchsfrist 6 Wochen"
    },
    {
      "date": "2025-01-07",
      "id": "97919",
      "original_text": "Löschungsankündigung\nSaarland Amtsgericht Saarbrücken HRB 52199\nWeiler GmbH – Saarwellingen",
      "type": "Löschungsankündigung",
      "state": "Saarland",
      "amtsgericht": "Amtsgericht Saarbrücken",
      "registernummer": "HRB 52199",
      "registerart": "HRB",
      "company_name": "Weiler GmbH",
      "company_seat": "Saarwellingen",
      "details": "07.01.2025 (Bekanntmachungsdatum)\n\nSaarland Amtsgericht Saarbrücken HRB 52199\nLöschungsankündigung\n\nWeiler GmbH\nGesellschaft mit beschränkter Haftung\nSaarwellingen\n\nEs ist beabsichtigt, die Gesellschaft von Amts wegen gemäß § 394 FamFG wegen Vermögenslosigkeit zu löschen. Gegen die Löschung von Amts wegen ist das Rechtsmittel des Widerspruchs statthaft. Der Widerspruch ist binnen einer Frist von 3 Monaten beginnend mit dem Tag dieser Veröffentlichung durch Einreichen eines Widerspruchsschreibens -schriftlich oder zur Niederschrift der Geschäftsstelle- beim Amtsgericht Saarbrücken, -zentrales Handelsregister-, Mainzerstr.178, 66121 Saarbrücken einzulegen. Der Widerspruch muss die Bezeichnung der angefochtenen Löschungsankündigung enthalten sowie die Erklärung, dass Widerspruch eingelegt wird. Er ist vom Widerspruchsführer oder seinem Bevollmächtigten zu unterzeichnen.\nDas Widerspruchsschreiben kann auch in der Form eines elektronischen Dokumentes eingereicht werden, das mit einer qualifizierten elektronischen Signatur nach dem Signaturgesetz versehen sein muss (§§ 14 Abs. 2 FamFG, 130a, 298 ZPO)."
    },
    {
      "date": "2025-01-07",
      "id": "97920",
      "original_text": "Registerbekanntmachung nach dem Umwandlungsgesetz\nBaden-Württemberg Amtsgericht Mannheim HRB 716014\nPrinted4U GmbH – Kronau",
      "type": "Registerbekanntmachung nach dem Umwandlungsgesetz",
      "state": "Baden-Württemberg",
      "amtsgericht": "Amtsgericht Mannheim",
      "registernummer": "HRB 716014",
      "registerart": "HRB",
      "company_name": "Printed4U GmbH",
      "company_seat": "Kronau",
      "details": "07.01.2025 (Bekanntmachungsdatum)\n\nBaden-Württemberg Amtsgericht Mannheim HRB 716014\nRegisterbekanntmachung nach dem Umwandlungsgesetz 07.01.2025 (Eintragungsdatum)\n\nPrinted4U GmbH\nGesellschaft mit beschränkter Haftung\nKronau\n\nAls nicht eingetragen wird bekanntgemacht:\nDen Gläubigern der an der Verschmelzung beteiligten Rechtsträger ist, wenn sie binnen sechs Monaten nach dem Tag, an dem die Eintragung der Verschmelzung in das Register des Sitzes desjenigen Rechtsträgers, dessen Gläubiger sie sind, nach § 19 Abs. 3 UmwG als bekanntgemacht gilt, ihren Anspruch nach Grund und Höhe schriftlich anmelden, Sicherheit zu leisten, soweit sie nicht Befriedigung verlangen können. Dieses Recht steht den Gläubigern jedoch nur zu, wenn sie glaubhaft machen, dass durch die Verschmelzung die Erfüllung ihrer Forderung gefährdet wird."
    },
    {
      "date": "2025-01-07",
      "id": "97921",
      "original_text": "Sonstige Registerbekanntmachung\nSachsen-Anhalt Amtsgericht Stendal HRB 107834\nReplast Westeregeln GmbH – Börde-Hakel",
      "type": "Sonstige Registerbekanntmachung",
      "state": "Sachsen-Anhalt",
      "amtsgericht": "Amtsgericht Stendal",
      "registernummer": "HRB 107834",
      "registerart": "HRB",
      "company_name": "Replast Westeregeln GmbH",
      "company_seat": "Börde-Hakel",
      "details": "07.01.2025 (Bekanntmachungsdatum)\n\nSachsen-Anhalt Amtsgericht Stendal HRB 107834\nSonstige Registerbekanntmachung 07.01.2025 (Eintragungsdatum)\n\nReplast  Westeregeln GmbH\nGesellschaft mit beschränkter Haftung\nBörde-Hakel\n\nNicht eingetragen:\nAls nicht eingetragen wird veröffentlicht: Den Gläubigern der Gesellschaft, deren Forderungen begründet worden sind bevor die Eintragung der Beendigung des #DV.Art(Text=\"Art des Vertrages auswählen\",Eingabe=\"Beherrschungs- und Gewinnabführungsvertrages\",\"Beherrschungsvertrages\",\"Gewinnabführungsvertrages\",\"Teilgewinnabführungsvertrages\")  in das Handelsregister nach § 10 des Handelsgesetzbuches als bekanntgemacht gilt, hat der andere Vertragsteil Sicherheit zu leisten, wenn sie sich binnen sechs Monaten nach der Bekanntmachung der Eintragung zu diesem Zweck bei ihm melden."
    },
    {
      "date": "2025-01-07",
      "id": "97922",
      "original_text": "Löschungsankündigung\nSaarland Amtsgericht Saarbrücken HRB 12199\nAZF Vermittlungs-GmbH – Saarbrücken",
      "type": "Löschungsankündigung",
      "state": "Saarland",
      "amtsgericht": "Amtsgericht Saarbrücken",
      "registernummer": "HRB 12199",
      "registerart": "HRB",
      "company_name": "AZF Vermittlungs-GmbH",
      "company_seat": "Saarbrücken",
      "details": "07.01.2025 (Bekanntmachungsdatum)\n\nSaarland Amtsgericht Saarbrücken HRB 12199\nLöschungsankündigung\n\nAZF Vermittlungs-GmbH\nGesellschaft mit beschränkter Haftung\nSaarbrücken\n\nEs ist beabsichtigt, die Gesellschaft von Amts wegen gemäß § 394 FamFG wegen Vermögenslosigkeit zu löschen. Gegen die Löschung von Amts wegen ist das Rechtsmittel des Widerspruchs statthaft. Der Widerspruch ist binnen einer Frist von 3 Monaten beginnend mit dem Tag dieser Veröffentlichung durch Einreichen eines Widerspruchsschreibens -schriftlich oder zur Niederschrift der Geschäftsstelle- beim Amtsgericht Saarbrücken, -zentrales Handelsregister-, Mainzerstr.178, 66121 Saarbrücken einzulegen. Der Widerspruch muss die Bezeichnung der angefochtenen Löschungsankündigung enthalten sowie die Erklärung, dass Widerspruch eingelegt wird. Er ist vom Widerspruchsführer oder seinem Bevollmächtigten zu unterzeichnen.\nDas Widerspruchsschreiben kann auch in der Form eines elektronischen Dokumentes eingereicht werden, das mit einer qualifizierten elektronischen Signatur nach dem Signaturgesetz versehen sein muss (§§ 14 Abs. 2 FamFG, 130a, 298 ZPO)."
    },
    {
      "date": "2025-01-07",
      "id": "97923",
      "original_text": "Löschungsankündigung\nBerlin Amtsgericht Berlin (Charlottenburg) HRB 247643\nJaworski Dach Verwaltungs-GmbH – Berlin",
      "type": "Löschungsankündigung",
      "state": "Berlin",
      "amtsgericht": "Amtsgericht Berlin (Charlottenburg)",
      "registernummer": "HRB 247643",
      "registerart": "HRB",
      "company_name": "Jaworski Dach Verwaltungs-GmbH",
      "company_seat": "Berlin",
      "details": "07.01.2025 (Bekanntmachungsdatum)\n\nBerlin Amtsgericht Berlin (Charlottenburg) HRB 247643\nLöschungsankündigung\n\nJaworski Dach Verwaltungs-GmbH\nGesellschaft mit beschränkter Haftung\nBerlin\n\nBei der nachstehenden Gesellschaft wird das Amtslöschungsverfahren gemäß § 394 FamFG eingeleitet. Widerspruchsfrist 6 Wochen"
    },
    {
      "date": "2025-01-07",
      "id": "97924",
      "original_text": "Löschungsankündigung\nSchleswig-Holstein Amtsgericht Lübeck HRA 8559\nVertriebsagentur Alexander Rath e.K. – Lübeck",
      "type": "Löschungsankündigung",
      "state": "Schleswig-Holstein",
      "amtsgericht": "Amtsgericht Lübeck",
      "registernummer": "HRA 8559",
      "registerart": "HRA",
      "company_name": "Vertriebsagentur Alexander Rath e.K.",
      "company_seat": "Lübeck",
      "details": "07.01.2025 (Bekanntmachungsdatum)\n\nSchleswig-Holstein Amtsgericht Lübeck HRA 8559\nLöschungsankündigung\n\nVertriebsagentur Alexander Rath e.K.\nEinzelkaufmann / Einzelkauffrau\nLübeck\n\nBei der nachstehenden Firma wird das Amtslöschungsverfahren gemäß § 31 Abs. 2 HGB eingeleitet.\nWiderspruchsfrist: 1 Monat."
    },
    {
      "date": "2025-01-07",
      "id": "97925",
      "original_text": "Löschungsankündigung\nBerlin Amtsgericht Berlin (Charlottenburg) HRB 224274\nREDI Bau GmbH – Berlin",
      "type": "Löschungsankündigung",
      "state": "Berlin",
      "amtsgericht": "Amtsgericht Berlin (Charlottenburg)",
      "registernummer": "HRB 224274",
      "registerart": "HRB",
      "company_name": "REDI Bau GmbH",
      "company_seat": "Berlin",
      "details": "07.01.2025 (Bekanntmachungsdatum)\n\nBerlin Amtsgericht Berlin (Charlottenburg) HRB 224274\nLöschungsankündigung\n\nREDI Bau GmbH\nGesellschaft mit beschränkter Haftung\nBerlin\n\nBei der nachstehenden Gesellschaft wird das Amtslöschungsverfahren gemäß § 394 FamFG eingeleitet. Widerspruchsfrist\n6 Wochen."
    },
    {
      "date": "2025-01-07",
      "id": "97926",
      "original_text": "Registerbekanntmachung nach dem Umwandlungsgesetz\nBaden-Württemberg Amtsgericht Mannheim HRB 752994\nMain Projektbau GmbH – Grünsfeld",
      "type": "Registerbekanntmachung nach dem Umwandlungsgesetz",
      "state": "Baden-Württemberg",
      "amtsgericht": "Amtsgericht Mannheim",
      "registernummer": "HRB 752994",
      "registerart": "HRB",
      "company_name": "Main Projektbau GmbH",
      "company_seat": "Grünsfeld",
      "details": "07.01.2025 (Bekanntmachungsdatum)\n\nBaden-Württemberg Amtsgericht Mannheim HRB 752994\nRegisterbekanntmachung nach dem Umwandlungsgesetz 07.01.2025 (Eintragungsdatum)\n\nMain Projektbau GmbH\nGesellschaft mit beschränkter Haftung\nGrünsfeld\n\nDen Gläubigern der an der Ausgliederung beteiligten Rechtsträger ist, wenn sie binnen sechs Monaten nach dem Tag, an dem die Eintragung der Ausgliederung in das Register des Sitzes desjenigen Rechtsträgers, dessen Gläubiger sie sind, nach § 19 Abs. 3 UmwG als bekanntgemacht gilt, ihren Anspruch nach Grund und Höhe schriftlich anmelden, Sicherheit zu leisten, soweit sie nicht Befriedigung verlangen können. Dieses Recht steht den Gläubigern jedoch nur zu, wenn sie glaubhaft machen, dass durch die Ausgliederung die Erfüllung ihrer Forderung gefährdet wird."
    },
    {
      "date": "2025-01-07",
      "id": "97927",
      "original_text": "Löschungsankündigung\nBaden-Württemberg Amtsgericht Mannheim HRB 702608\nautokocher.de GmbH – Schwetzingen",
      "type": "Löschungsankündigung",
      "state": "Baden-Württemberg",
      "amtsgericht": "Amtsgericht Mannheim",
      "registernummer": "HRB 702608",
      "registerart": "HRB",
      "company_name": "autokocher.de GmbH",
      "company_seat": "Schwetzingen",
      "details": "07.01.2025 (Bekanntmachungsdatum)\n\nBaden-Württemberg Amtsgericht Mannheim HRB 702608\nLöschungsankündigung\n\nautokocher.de GmbH\nGesellschaft mit beschränkter Haftung\nSchwetzingen\n\nDas Gericht beabsichtigt, die Gesellschaft wegen Vermögenslosigkeit im Handelsregister von Amts wegen nach § 394 FamFG zu löschen. Die Frist zur Geltendmachung eines Widerspruchs gegen die beabsichtigte Löschung ist auf einen Monat ab Veröffentlichung bestimmt."
    },
    {
      "date": "2025-01-07",
      "id": "97928",
      "original_text": "Sonstige Registerbekanntmachung\nBerlin Amtsgericht Berlin (Charlottenburg) HRB 99757\nB.Z. Ullstein GmbH – Berlin",
      "type": "Sonstige Registerbekanntmachung",
      "state": "Berlin",
      "amtsgericht": "Amtsgericht Berlin (Charlottenburg)",
      "registernummer": "HRB 99757",
      "registerart": "HRB",
      "company_name": "B.Z. Ullstein GmbH",
      "company_seat": "Berlin",
      "details": "07.01.2025 (Bekanntmachungsdatum)\n\nBerlin Amtsgericht Berlin (Charlottenburg) HRB 99757\nSonstige Registerbekanntmachung\n\nB.Z. Ullstein GmbH\nGesellschaft mit beschränkter Haftung\nBerlin\n\nAls nicht eingetragen wird veröffentlicht:  Der andere Vertragsteil hat den Gläubigern dieses Rechtsträgers, deren Forderungen begründet worden sind, bevor die Eintragung der Beendigung dieses Vertrages in das Handelsregister nach § 10 des Handelsgesetzbuches als bekannt gemacht gilt, Sicherheit zu leisten, wenn sie sich binnen sechs Monaten nach der Bekanntmachung der Eintragung zu diesem Zweck bei ihm melden. Dieses Recht steht den Gläubigern nicht zu, die im Fall des Insolvenzverfahrens ein Recht auf vorzugsweise Befriedigung aus der Deckungsmasse haben, die nach gesetzlicher Vorschrift zu ihrem Schutz errichtet und staatlich überwacht ist."
    },
    {
      "date": "2025-01-07",
      "id": "97929",
      "original_text": "Sonstige Registerbekanntmachung\nBaden-Württemberg Amtsgericht Stuttgart HRB 770715\nDegler GmbH – Remshalden",
      "type": "Sonstige Registerbekanntmachung",
      "state": "Baden-Württemberg",
      "amtsgericht": "Amtsgericht Stuttgart",
      "registernummer": "HRB 770715",
      "registerart": "HRB",
      "company_name": "Degler GmbH",
      "company_seat": "Remshalden",
      "details": "07.01.2025 (Bekanntmachungsdatum)\n\nBaden-Württemberg Amtsgericht Stuttgart HRB 770715\nSonstige Registerbekanntmachung 07.01.2025 (Eintragungsdatum)\n\nDegler GmbH\nGesellschaft mit beschränkter Haftung\nRemshalden\n\nAls nicht eingetragen wird bekanntgemacht:\nDen Gläubigern der Gesellschaft, deren Forderungen begründet worden sind, bevor die Eintragung der Beendigung des Vertrages in das Handelsregister nach § 10 HGB als bekanntgemacht gilt, ist vom anderen Vertragsteil Sicherheit zu leisten, wenn sie sich binnen sechs Monaten nach der Bekanntmachung zu diesem Zweck bei ihm melden."
    },
    {
      "date": "2025-01-07",
      "id": "97930",
      "original_text": "Registerbekanntmachung nach dem Umwandlungsgesetz\nBerlin Amtsgericht Berlin (Charlottenburg) HRB 245468\nFT Beteiligung GmbH – Berlin",
      "type": "Registerbekanntmachung nach dem Umwandlungsgesetz",
      "state": "Berlin",
      "amtsgericht": "Amtsgericht Berlin (Charlottenburg)",
      "registernummer": "HRB 245468",
      "registerart": "HRB",
      "company_name": "FT Beteiligung GmbH",
      "company_seat": "Berlin",
      "details": "07.01.2025 (Bekanntmachungsdatum)\n\nBerlin Amtsgericht Berlin (Charlottenburg) HRB 245468\nRegisterbekanntmachung nach dem Umwandlungsgesetz 07.01.2025 (Eintragungsdatum)\n\nFT Beteiligung GmbH\nGesellschaft mit beschränkter Haftung\nBerlin\n\nZu Eintragungsnummer 6 vom 07.01.2025 wird als nicht eingetragen veröffentlicht: Den Gläubigern der an der Verschmelzung beteiligten Rechtsträger ist, wenn sie binnen sechs Monaten nach dem Tag, an dem die Eintragung der Verschmelzung in das Register des Sitzes desjenigen Rechtsträgers, dessen Gläubiger sie sind, als bekannt gemacht gilt, ihren Anspruch nach Grund und Höhe schriftlich anmelden, Sicherheit zu leisten, soweit sie nicht Befriedigung verlangen können. Dieses Recht steht den Gläubigern jedoch nur zu, wenn sie glaubhaft machen, dass durch die Verschmelzung die Erfüllung ihrer Forderung gefährdet wird. Das Recht, Sicherheitsleistung zu verlangen, steht Gläubigern nicht zu, die im Falle der Insolvenz ein Recht auf vorzugsweise Befriedigung aus einer Deckungsmasse haben, die nach gesetzlicher Vorschrift zu ihrem Schutz errichtet und staatlich überwacht ist."
    },
    {
      "date": "2025-01-07",
      "id": "97931",
      "original_text": "Registerbekanntmachung nach dem Umwandlungsgesetz\nBerlin Amtsgericht Berlin (Charlottenburg) HRB 238377\nFT Lion Timber GmbH – Berlin",
      "type": "Registerbekanntmachung nach dem Umwandlungsgesetz",
      "state": "Berlin",
      "amtsgericht": "Amtsgericht Berlin (Charlottenburg)",
      "registernummer": "HRB 238377",
      "registerart": "HRB",
      "company_name": "FT Lion Timber GmbH",
      "company_seat": "Berlin",
      "details": "07.01.2025 (Bekanntmachungsdatum)\n\nBerlin Amtsgericht Berlin (Charlottenburg) HRB 238377\nRegisterbekanntmachung nach dem Umwandlungsgesetz 07.01.2025 (Eintragungsdatum)\n\nFT Lion Timber GmbH\nGesellschaft mit beschränkter Haftung\nBerlin\n\nZu Eintragungsnummer 3 vom 07.01.2025 wird als nicht eingetragen veröffentlicht: Den Gläubigern der an der Verschmelzung beteiligten Rechtsträger ist, wenn sie binnen sechs Monaten nach dem Tag, an dem die Eintragung der Verschmelzung in das Register des Sitzes desjenigen Rechtsträgers, dessen Gläubiger sie sind, als bekannt gemacht gilt, ihren Anspruch nach Grund und Höhe schriftlich anmelden, Sicherheit zu leisten, soweit sie nicht Befriedigung verlangen können. Dieses Recht steht den Gläubigern jedoch nur zu, wenn sie glaubhaft machen, dass durch die Verschmelzung die Erfüllung ihrer Forderung gefährdet wird. Das Recht, Sicherheitsleistung zu verlangen, steht Gläubigern nicht zu, die im Falle der Insolvenz ein Recht auf vorzugsweise Befriedigung aus einer Deckungsmasse haben, die nach gesetzlicher Vorschrift zu ihrem Schutz errichtet und staatlich überwacht ist."
    },
    {
      "date": "2025-01-07",
      "id": "97932",
      "original_text": "Löschungsankündigung\nBaden-Württemberg Amtsgericht Mannheim HRB 729984\nNaujok-Pool GmbH – Altlußheim",
      "type": "Löschungsankündigung",
      "state": "Baden-Württemberg",
      "amtsgericht": "Amtsgericht Mannheim",
      "registernummer": "HRB 729984",
      "registerart": "HRB",
      "company_name": "Naujok-Pool GmbH",
      "company_seat": "Altlußheim",
      "details": "07.01.2025 (Bekanntmachungsdatum)\n\nBaden-Württemberg Amtsgericht Mannheim HRB 729984\nLöschungsankündigung\n\nNaujok-Pool GmbH\nGesellschaft mit beschränkter Haftung\nAltlußheim\n\nDas Gericht beabsichtigt, die Eintragung der Gesellschaft im Handelsregister wegen des Mangels einer wesentlichen Voraussetzung von Amts wegen nach § 395 FamFG als unzulässig zu löschen. Die Frist zur Geltendmachung eines Widerspruchs gegen die beabsichtigte Löschung ist auf einen Monat ab Veröffentlichung bestimmt."
    },
    {
      "date": "2025-01-07",
      "id": "97933",
      "original_text": "Registerbekanntmachung nach dem Umwandlungsgesetz\nBerlin Amtsgericht Berlin (Charlottenburg) HRB 245468\nFT Beteiligung GmbH – Berlin",
      "type": "Registerbekanntmachung nach dem Umwandlungsgesetz",
      "state": "Berlin",
      "amtsgericht": "Amtsgericht Berlin (Charlottenburg)",
      "registernummer": "HRB 245468",
      "registerart": "HRB",
      "company_name": "FT Beteiligung GmbH",
      "company_seat": "Berlin",
      "details": "07.01.2025 (Bekanntmachungsdatum)\n\nBerlin Amtsgericht Berlin (Charlottenburg) HRB 245468\nRegisterbekanntmachung nach dem Umwandlungsgesetz 07.01.2025 (Eintragungsdatum)\n\nFT Beteiligung GmbH\nGesellschaft mit beschränkter Haftung\nBerlin\n\nZu Eintragungsnummer 5 vom 07.01.2025 wird als nicht eingetragen veröffentlicht: Den Gläubigern der an der Verschmelzung beteiligten Rechtsträger ist, wenn sie binnen sechs Monaten nach dem Tag, an dem die Eintragung der Verschmelzung in das Register des Sitzes desjenigen Rechtsträgers, dessen Gläubiger sie sind, als bekannt gemacht gilt, ihren Anspruch nach Grund und Höhe schriftlich anmelden, Sicherheit zu leisten, soweit sie nicht Befriedigung verlangen können. Dieses Recht steht den Gläubigern jedoch nur zu, wenn sie glaubhaft machen, dass durch die Verschmelzung die Erfüllung ihrer Forderung gefährdet wird. Das Recht, Sicherheitsleistung zu verlangen, steht Gläubigern nicht zu, die im Falle der Insolvenz ein Recht auf vorzugsweise Befriedigung aus einer Deckungsmasse haben, die nach gesetzlicher Vorschrift zu ihrem Schutz errichtet und staatlich überwacht ist."
    },
    {
      "date": "2025-01-07",
      "id": "97934",
      "original_text": "Sonstige Registerbekanntmachung\nBerlin Amtsgericht Berlin (Charlottenburg) HRB 119058\nBEW Berliner Energie und Wärme AG – Berlin",
      "type": "Sonstige Registerbekanntmachung",
      "state": "Berlin",
      "amtsgericht": "Amtsgericht Berlin (Charlottenburg)",
      "registernummer": "HRB 119058",
      "registerart": "HRB",
      "company_name": "BEW Berliner Energie und Wärme AG",
      "company_seat": "Berlin",
      "details": "07.01.2025 (Bekanntmachungsdatum)\n\nBerlin Amtsgericht Berlin (Charlottenburg) HRB 119058\nSonstige Registerbekanntmachung\n\nBEW Berliner Energie und Wärme AG\nAktiengesellschaft\nBerlin\n\nAls nicht eingetragen wird veröffentlicht: Den Gläubigern ist, wenn sie binnen sechs Monaten nach dem Tag, an dem die Eintragung der Umwandlung als bekannt gemacht gilt, ihren Anspruch nach Grund und Höhe schriftlich anmelden, Sicherheit zu leisten, soweit sie nicht Befriedigung verlangen können. Dieses Recht steht den Gläubigern jedoch nur zu, wenn sie glaubhaft machen, dass durch die Umwandlung die Erfüllung ihrer Forderung gefährdet wird. Das Recht, Sicherheitsleistung zu verlangen, steht Gläubigern nicht zu, die im Falle der Insolvenz ein Recht auf vorzugsweise Befriedigung aus einer Deckungsmasse haben, die nach gesetzlicher Vorschrift zu ihrem Schutz errichtet und staatlich überwacht ist."
    },
    {
      "date": "2025-01-07",
      "id": "97935",
      "original_text": "Einreichung neuer Dokumente\nThüringen Amtsgericht Jena HRB 507668\nSolarpark Breitungen GmbH – Breitungen",
      "type": "Einreichung neuer Dokumente",
      "state": "Thüringen",
      "amtsgericht": "Amtsgericht Jena",
      "registernummer": "HRB 507668",
      "registerart": "HRB",
      "company_name": "Solarpark Breitungen GmbH",
      "company_seat": "Breitungen",
      "details": "07.01.2025 (Bekanntmachungsdatum)\n\nThüringen Amtsgericht Jena HRB 507668\nEinreichung neuer Dokumente\n\nSolarpark Breitungen GmbH\nGesellschaft mit beschränkter Haftung\nBreitungen\n\nBekanntmachung gem. § 52 Abs. 3 Satz 2 GmbHG: Aufgrund einer Veränderung in den Personen der Aufsichtsratsmitglieder ist durch die Geschäftsführer eine neue Liste zum Handelsregister eingereicht worden."
    },
    {
      "date": "2025-01-07",
      "id": "97936",
      "original_text": "Sonstige Registerbekanntmachung\nBerlin Amtsgericht Berlin (Charlottenburg) HRB 270795\nBEW Berliner Energie und Wärme GmbH – Berlin",
      "type": "Sonstige Registerbekanntmachung",
      "state": "Berlin",
      "amtsgericht": "Amtsgericht Berlin (Charlottenburg)",
      "registernummer": "HRB 270795",
      "registerart": "HRB",
      "company_name": "BEW Berliner Energie und Wärme GmbH",
      "company_seat": "Berlin",
      "details": "07.01.2025 (Bekanntmachungsdatum)\n\nBerlin Amtsgericht Berlin (Charlottenburg) HRB 270795\nSonstige Registerbekanntmachung\n\nBEW Berliner Energie und Wärme GmbH\nGesellschaft mit beschränkter Haftung\nBerlin\n\nAls nicht eingetragen wird veröffentlicht: Den Gläubigern ist, wenn sie binnen sechs Monaten nach dem Tag, an dem die Eintragung der Umwandlung als bekannt gemacht gilt, ihren Anspruch nach Grund und Höhe schriftlich anmelden, Sicherheit zu leisten, soweit sie nicht Befriedigung verlangen können. Dieses Recht steht den Gläubigern jedoch nur zu, wenn sie glaubhaft machen, dass durch die Umwandlung die Erfüllung ihrer Forderung gefährdet wird. Das Recht, Sicherheitsleistung zu verlangen, steht Gläubigern nicht zu, die im Falle der Insolvenz ein Recht auf vorzugsweise Befriedigung aus einer Deckungsmasse haben, die nach gesetzlicher Vorschrift zu ihrem Schutz errichtet und staatlich überwacht ist."
    },
    {
      "date": "2025-01-07",
      "id": "97937",
      "original_text": "Registerbekanntmachung nach dem Umwandlungsgesetz\nBrandenburg Amtsgericht Frankfurt/Oder HRA 4332\nRonald Buchholz e. Kfm. – Beiersdorf-Freudenberg",
      "type": "Registerbekanntmachung nach dem Umwandlungsgesetz",
      "state": "Brandenburg",
      "amtsgericht": "Amtsgericht Frankfurt/Oder",
      "registernummer": "HRA 4332",
      "registerart": "HRA",
      "company_name": "Ronald Buchholz e. Kfm.",
      "company_seat": "Beiersdorf-Freudenberg",
      "details": "07.01.2025 (Bekanntmachungsdatum)\n\nBrandenburg Amtsgericht Frankfurt/Oder HRA 4332\nRegisterbekanntmachung nach dem Umwandlungsgesetz 17.07.2024 (Eintragungsdatum)\n\nRonald Buchholz e. Kfm.\nEinzelkaufmann / Einzelkauffrau\nBeiersdorf-Freudenberg\n\nZu Eintragungsnummer 3 vom 17.07.2024 wird als nicht eingetragen veröffentlicht:\nDen Gläubigern der an der Umwandlung beteiligten Rechtsträger ist, wenn sie binnen sechs Monaten nach dem Tag, an dem die Eintragung der Umwandlung in das Register des Sitzes desjenigen Rechtsträgers, dessen Gläubiger sie sind, als bekannt gemacht gilt, ihren Anspruch nach Grund und Höhe schriftlich anmelden, Sicherheit zu leisten, soweit sie nicht Befriedigung verlangen können. Dieses Recht steht den Gläubigern jedoch nur zu, wenn sie glaubhaft machen, dass durch die Umwandlung die Erfüllung ihrer Forderung gefährdet wird"
    },
    {
      "date": "2025-01-07",
      "id": "97938",
      "original_text": "Sonstige Registerbekanntmachung\nSchleswig-Holstein Amtsgericht Kiel GsR 820\nErdmann & Kahle eGbR – Henstedt-Ulzburg",
      "type": "Sonstige Registerbekanntmachung",
      "state": "Schleswig-Holstein",
      "amtsgericht": "Amtsgericht Kiel",
      "registernummer": "GsR 820",
      "registerart": "GsR",
      "company_name": "Erdmann & Kahle eGbR",
      "company_seat": "Henstedt-Ulzburg",
      "details": "07.01.2025 (Bekanntmachungsdatum)\n\nSchleswig-Holstein Amtsgericht Kiel GsR 820\nSonstige Registerbekanntmachung\n\nErdmann & Kahle eGbR\nGesellschaft bürgerlichen Rechts\nHenstedt-Ulzburg\n\nAls nicht eingetragen wird veröffentlicht: Den Gläubigern ist, wenn sie binnen sechs Monaten nach dem Tag, an dem die Eintragung der Umwandlung bekannt gemacht worden ist, ihren Anspruch nach Grund und Höhe schriftlich anmelden, Sicherheit zu leisten, soweit sie nicht Befriedigung verlangen können. Dieses Recht steht den Gläubigern jedoch nur zu, wenn sie glaubhaft machen, dass durch die Umwandlung die Erfüllung ihrer Forderung gefährdet wird."
    },
    {
      "date": "2025-01-07",
      "id": "97939",
      "original_text": "Registerbekanntmachung nach dem Umwandlungsgesetz\nBerlin Amtsgericht Berlin (Charlottenburg) HRB 227893\nFT C2C GmbH – Berlin",
      "type": "Registerbekanntmachung nach dem Umwandlungsgesetz",
      "state": "Berlin",
      "amtsgericht": "Amtsgericht Berlin (Charlottenburg)",
      "registernummer": "HRB 227893",
      "registerart": "HRB",
      "company_name": "FT C2C GmbH",
      "company_seat": "Berlin",
      "details": "07.01.2025 (Bekanntmachungsdatum)\n\nBerlin Amtsgericht Berlin (Charlottenburg) HRB 227893\nRegisterbekanntmachung nach dem Umwandlungsgesetz 07.01.2025 (Eintragungsdatum)\n\nFT C2C GmbH\nGesellschaft mit beschränkter Haftung\nBerlin\n\nZu Eintragungsnummer 4 vom 07.01.2025 wird als nicht eingetragen veröffentlicht: Den Gläubigern der an der Verschmelzung beteiligten Rechtsträger ist, wenn sie binnen sechs Monaten nach dem Tag, an dem die Eintragung der Verschmelzung in das Register des Sitzes desjenigen Rechtsträgers, dessen Gläubiger sie sind, als bekannt gemacht gilt, ihren Anspruch nach Grund und Höhe schriftlich anmelden, Sicherheit zu leisten, soweit sie nicht Befriedigung verlangen können. Dieses Recht steht den Gläubigern jedoch nur zu, wenn sie glaubhaft machen, dass durch die Verschmelzung die Erfüllung ihrer Forderung gefährdet wird. Das Recht, Sicherheitsleistung zu verlangen, steht Gläubigern nicht zu, die im Falle der Insolvenz ein Recht auf vorzugsweise Befriedigung aus einer Deckungsmasse haben, die nach gesetzlicher Vorschrift zu ihrem Schutz errichtet und staatlich überwacht ist."
    },
    {
      "date": "2025-01-07",
      "id": "97940",
      "original_text": "Löschungsankündigung\nBaden-Württemberg Amtsgericht Freiburg HRB 723971\nMarbou GmbH – Gengenbach",
      "type": "Löschungsankündigung",
      "state": "Baden-Württemberg",
      "amtsgericht": "Amtsgericht Freiburg",
      "registernummer": "HRB 723971",
      "registerart": "HRB",
      "company_name": "Marbou GmbH",
      "company_seat": "Gengenbach",
      "details": "07.01.2025 (Bekanntmachungsdatum)\n\nBaden-Württemberg Amtsgericht Freiburg HRB 723971\nLöschungsankündigung\n\nMarbou GmbH\nGesellschaft mit beschränkter Haftung\nGengenbach\n\nDas Gericht beabsichtigt, die Gesellschaft wegen Vermögenslosigkeit im Handelsregister von Amts wegen nach § 394 FamFG zu löschen. Die Frist zur Geltendmachung eines Widerspruchs gegen die beabsichtigte Löschung ist auf einen Monat ab Veröffentlichung bestimmt."
    },
    {
      "date": "2025-01-07",
      "id": "97941",
      "original_text": "Löschungsankündigung\nBerlin Amtsgericht Berlin (Charlottenburg) HRB 192921\nJMA Expert GmbH – Berlin",
      "type": "Löschungsankündigung",
      "state": "Berlin",
      "amtsgericht": "Amtsgericht Berlin (Charlottenburg)",
      "registernummer": "HRB 192921",
      "registerart": "HRB",
      "company_name": "JMA Expert GmbH",
      "company_seat": "Berlin",
      "details": "07.01.2025 (Bekanntmachungsdatum)\n\nBerlin Amtsgericht Berlin (Charlottenburg) HRB 192921\nLöschungsankündigung\n\nJMA Expert GmbH\nGesellschaft mit beschränkter Haftung\nBerlin\n\nEs ist beabsichtigt, die Eintragung des Geschäftsführers Jakub Marcin Adolp gemäß § 395 FamFG zu löschen, zur Geltendmachung eines Widerspruchs gegen die Löschung wird eine Frist von einem Monat gesetzt."
    },
    {
      "date": "2025-01-07",
      "id": "97942",
      "original_text": "Registerbekanntmachung nach dem Umwandlungsgesetz\nHamburg Amtsgericht Hamburg HRB 99491\nVeolia Umweltservice Nord GmbH – Hamburg",
      "type": "Registerbekanntmachung nach dem Umwandlungsgesetz",
      "state": "Hamburg",
      "amtsgericht": "Amtsgericht Hamburg",
      "registernummer": "HRB 99491",
      "registerart": "HRB",
      "company_name": "Veolia Umweltservice Nord GmbH",
      "company_seat": "Hamburg",
      "details": "07.01.2025 (Bekanntmachungsdatum)\n\nHamburg Amtsgericht Hamburg HRB 99491\nRegisterbekanntmachung nach dem Umwandlungsgesetz 23.12.2024 (Eintragungsdatum)\n\nVeolia Umweltservice Nord GmbH\nGesellschaft mit beschränkter Haftung\nHamburg\n\nAls nicht eingetragen wird bekannt gemacht:\nDen Gläubigern der an der Verschmelzung beteiligten Gesellschaften ist, wenn sie binnen sechs Monaten nach dem Tag, an dem die Eintragung der Verschmelzung in das Register des Sitzes desjenigen Rechtsträgers, dessen Gläubiger sie sind, nach § 19 Absatz 3 UmwG als bekannt gemacht gilt, ihren Anspruch nach Grund und Höhe schriftlich anmelden, Sicherheit zu leisten, soweit sie nicht Befriedigung verlangen können. Dieses Recht steht den Gläubigern jedoch nur zu, wenn sie glaubhaft machen, dass durch die Verschmelzung die Erfüllung ihrer Forderung gefährdet wird."
    },
    {
      "date": "2025-01-07",
      "id": "97943",
      "original_text": "Registerbekanntmachung nach dem Umwandlungsgesetz\nHamburg Amtsgericht Hamburg HRA 130788\nAndrea von Harten e. K. – Hamburg",
      "type": "Registerbekanntmachung nach dem Umwandlungsgesetz",
      "state": "Hamburg",
      "amtsgericht": "Amtsgericht Hamburg",
      "registernummer": "HRA 130788",
      "registerart": "HRA",
      "company_name": "Andrea von Harten e. K.",
      "company_seat": "Hamburg",
      "details": "07.01.2025 (Bekanntmachungsdatum)\n\nHamburg Amtsgericht Hamburg HRA 130788\nRegisterbekanntmachung nach dem Umwandlungsgesetz 11.12.2024 (Eintragungsdatum)\n\nAndrea von Harten e. K.\nEinzelkaufmann\nHamburg\n\nAls nicht eingetragen wird bekannt gemacht:\nDen Gläubigern der an der Ausgliederung beteiligten Gesellschaften ist, wenn sie binnen sechs Monaten nach dem Tag, an dem die Eintragung der Ausgliederung in das Register des Sitzes desjenigen Rechtsträgers, dessen Gläubiger sie sind, nach § 19 Absatz 3 UmwG als bekannt gemacht gilt, ihren Anspruch nach Grund und Höhe schriftlich anmelden, Sicherheit zu leisten, soweit sie nicht Befriedigung verlangen können. Dieses Recht steht den Gläubigern jedoch nur zu, wenn sie glaubhaft machen, dass durch die Ausgliederung die Erfüllung ihrer Forderung gefährdet wird."
    },
    {
      "date": "2025-01-07",
      "id": "97944",
      "original_text": "Löschungsankündigung\nBrandenburg Amtsgericht Frankfurt/Oder HRB 13957\nANMI Logistik GmbH – Ahrensfelde",
      "type": "Löschungsankündigung",
      "state": "Brandenburg",
      "amtsgericht": "Amtsgericht Frankfurt/Oder",
      "registernummer": "HRB 13957",
      "registerart": "HRB",
      "company_name": "ANMI Logistik GmbH",
      "company_seat": "Ahrensfelde",
      "details": "07.01.2025 (Bekanntmachungsdatum)\n\nBrandenburg Amtsgericht Frankfurt/Oder HRB 13957\nLöschungsankündigung\n\nANMI Logistik GmbH\nGesellschaft mit beschränkter Haftung\nAhrensfelde\n\nBei der nachstehenden Gesellschaft wird das Amtslöschungsverfahren gemäß § 394 Abs. 1 FamFG eingeleitet."
    },
    {
      "date": "2025-01-07",
      "id": "97945",
      "original_text": "Löschungsankündigung\nBrandenburg Amtsgericht Frankfurt/Oder HRB 15103\nFKB Finowfurt GmbH – Schorfheide",
      "type": "Löschungsankündigung",
      "state": "Brandenburg",
      "amtsgericht": "Amtsgericht Frankfurt/Oder",
      "registernummer": "HRB 15103",
      "registerart": "HRB",
      "company_name": "FKB Finowfurt GmbH",
      "company_seat": "Schorfheide",
      "details": "07.01.2025 (Bekanntmachungsdatum)\n\nBrandenburg Amtsgericht Frankfurt/Oder HRB 15103\nLöschungsankündigung\n\nFKB Finowfurt GmbH\nGesellschaft mit beschränkter Haftung\nSchorfheide\n\nBei der nachstehenden Gesellschaft wird das Amtslöschungsverfahren gemäß § 394 FamFG eingeleitet."
    },
    {
      "date": "2025-01-07",
      "id": "97946",
      "original_text": "Einreichung neuer Dokumente\nSachsen-Anhalt Amtsgericht Stendal HRB 10638\nStadtwerke Lutherstadt Wittenberg GmbH – Wittenberg",
      "type": "Einreichung neuer Dokumente",
      "state": "Sachsen-Anhalt",
      "amtsgericht": "Amtsgericht Stendal",
      "registernummer": "HRB 10638",
      "registerart": "HRB",
      "company_name": "Stadtwerke Lutherstadt Wittenberg GmbH",
      "company_seat": "Wittenberg",
      "details": "07.01.2025 (Bekanntmachungsdatum)\n\nSachsen-Anhalt Amtsgericht Stendal HRB 10638\nEinreichung neuer Dokumente\n\nStadtwerke Lutherstadt Wittenberg GmbH\nGesellschaft mit beschränkter Haftung\nWittenberg\n\nEine Liste der Mitglieder des Aufsichtsrates wurde zum Handelsregister eingereicht."
    },
    {
      "date": "2025-01-07",
      "id": "97947",
      "original_text": "Sonstige Registerbekanntmachung\nSachsen-Anhalt Amtsgericht Stendal HRB 24662\nGETEC heat & power GmbH – Magdeburg",
      "type": "Sonstige Registerbekanntmachung",
      "state": "Sachsen-Anhalt",
      "amtsgericht": "Amtsgericht Stendal",
      "registernummer": "HRB 24662",
      "registerart": "HRB",
      "company_name": "GETEC heat & power GmbH",
      "company_seat": "Magdeburg",
      "details": "07.01.2025 (Bekanntmachungsdatum)\n\nSachsen-Anhalt Amtsgericht Stendal HRB 24662\nSonstige Registerbekanntmachung 07.01.2025 (Eintragungsdatum)\n\nGETEC heat & power GmbH\nGesellschaft mit beschränkter Haftung\nMagdeburg\n\nNicht eingetragen:\nAls nicht eingetragen wird veröffentlicht: Den Gläubigern der Gesellschaft, deren Forderungen begründet worden sind bevor die Eintragung der Beendigung des #DV.Art(Text=\"Art des Vertrages auswählen\",Eingabe=\"Beherrschungs- und Gewinnabführungsvertrages\",\"Beherrschungsvertrages\",\"Gewinnabführungsvertrages\",\"Teilgewinnabführungsvertrages\")  in das Handelsregister nach § 10 des Handelsgesetzbuches als bekanntgemacht gilt, hat der andere Vertragsteil Sicherheit zu leisten, wenn sie sich binnen sechs Monaten nach der Bekanntmachung der Eintragung zu diesem Zweck bei ihm melden."
    },
    {
      "date": "2025-01-07",
      "id": "97948",
      "original_text": "Registerbekanntmachung nach dem Umwandlungsgesetz\nBaden-Württemberg Amtsgericht Stuttgart HRB 401108\nRenz & Yildirim Die Stylisten GmbH – Balingen",
      "type": "Registerbekanntmachung nach dem Umwandlungsgesetz",
      "state": "Baden-Württemberg",
      "amtsgericht": "Amtsgericht Stuttgart",
      "registernummer": "HRB 401108",
      "registerart": "HRB",
      "company_name": "Renz & Yildirim Die Stylisten GmbH",
      "company_seat": "Balingen",
      "details": "07.01.2025 (Bekanntmachungsdatum)\n\nBaden-Württemberg Amtsgericht Stuttgart HRB 401108\nRegisterbekanntmachung nach dem Umwandlungsgesetz 07.01.2025 (Eintragungsdatum)\n\nRenz & Yildirim Die Stylisten GmbH\nGesellschaft mit beschränkter Haftung\nBalingen\n\nDen Gläubigern der an der Verschmelzung beteiligten Rechtsträger ist, wenn sie binnen sechs Monaten nach dem Tag, an dem die Eintragung der Verschmelzung in das Register des Sitzes desjenigen Rechtsträgers, dessen Gläubiger sie sind, nach § 19 Abs. 3 UmwG als bekanntgemacht gilt, ihren Anspruch nach Grund und Höhe schriftlich anmelden, Sicherheit zu leisten, soweit sie nicht Befriedigung verlangen können. Dieses Recht steht den Gläubigern jedoch nur zu, wenn sie glaubhaft machen, dass durch die Verschmelzung die Erfüllung ihrer Forderung gefährdet wird."
    },
    {
      "date": "2025-01-07",
      "id": "97949",
      "original_text": "Löschungsankündigung\nBerlin Amtsgericht Berlin (Charlottenburg) HRB 155144\nGeuting Turnaround GmbH – Berlin",
      "type": "Löschungsankündigung",
      "state": "Berlin",
      "amtsgericht": "Amtsgericht Berlin (Charlottenburg)",
      "registernummer": "HRB 155144",
      "registerart": "HRB",
      "company_name": "Geuting Turnaround GmbH",
      "company_seat": "Berlin",
      "details": "07.01.2025 (Bekanntmachungsdatum)\n\nBerlin Amtsgericht Berlin (Charlottenburg) HRB 155144\nLöschungsankündigung\n\nGeuting Turnaround GmbH\nGesellschaft mit beschränkter Haftung\nBerlin\n\nBei der nachstehenden Gesellschaft wird das Amtslöschungsverfahren gemäß § 394 FamFG eingeleitet. Widerspruchsfrist 6 Wochen"
    },
    {
      "date": "2025-01-07",
      "id": "97950",
      "original_text": "Einreichung neuer Dokumente\nBrandenburg Amtsgericht Frankfurt/Oder HRB 15349\nGeo Group AG – Fürstenwalde/Spree",
      "type": "Einreichung neuer Dokumente",
      "state": "Brandenburg",
      "amtsgericht": "Amtsgericht Frankfurt/Oder",
      "registernummer": "HRB 15349",
      "registerart": "HRB",
      "company_name": "Geo Group AG",
      "company_seat": "Fürstenwalde/Spree",
      "details": "07.01.2025 (Bekanntmachungsdatum)\n\nBrandenburg Amtsgericht Frankfurt/Oder HRB 15349\nEinreichung neuer Dokumente\n\nGeo Group AG\nAktiengesellschaft\nFürstenwalde/Spree\n\nAls nicht eingetragen wird veröffentlicht: Die Liste der Aufsichtsratsmitglieder vom 09.11.2024 ist zum Handelsregister eingereicht worden"
    },
    {
      "date": "2025-01-07",
      "id": "97951",
      "original_text": "Registerbekanntmachung nach dem Umwandlungsgesetz\nBerlin Amtsgericht Berlin (Charlottenburg) HRB 81121\nMercedes-Benz Bank Service Center GmbH – Berlin",
      "type": "Registerbekanntmachung nach dem Umwandlungsgesetz",
      "state": "Berlin",
      "amtsgericht": "Amtsgericht Berlin (Charlottenburg)",
      "registernummer": "HRB 81121",
      "registerart": "HRB",
      "company_name": "Mercedes-Benz Bank Service Center GmbH",
      "company_seat": "Berlin",
      "details": "07.01.2025 (Bekanntmachungsdatum)\n\nBerlin Amtsgericht Berlin (Charlottenburg) HRB 81121\nRegisterbekanntmachung nach dem Umwandlungsgesetz 05.01.2025 (Eintragungsdatum)\n\nMercedes-Benz Bank Service Center GmbH\nGesellschaft mit beschränkter Haftung\nBerlin\n\nZu Eintragungsnummer 21 vom 05.01.2025 wird als nicht eingetragen veröffentlicht: Der andere Vertragsteil hat den Gläubigern dieses Rechtsträgers, deren Forderungen begründet worden sind, bevor die Eintragung der Beendigung dieses Vertrages in das Handelsregister nach § 10 des Handelsgesetzbuches als bekannt gemacht gilt, Sicherheit zu leisten, wenn sie sich binnen sechs Monaten nach der Bekanntmachung der Eintragung zu diesem Zweck bei ihm melden. Dieses Recht steht den Gläubigern nicht zu, die im Fall des Insolvenzverfahrens ein Recht auf vorzugsweise Befriedigung aus der Deckungsmasse haben, die nach gesetzlicher Vorschrift zu ihrem Schutz errichtet und staatlich überwacht ist."
    },
    {
      "date": "2025-01-07",
      "id": "97952",
      "original_text": "Einreichung neuer Dokumente\nBrandenburg Amtsgericht Frankfurt/Oder HRB 2672\nWohnungsbaugesellschaft Bad Freienwalde mbH – Bad Freienwalde (Oder)",
      "type": "Einreichung neuer Dokumente",
      "state": "Brandenburg",
      "amtsgericht": "Amtsgericht Frankfurt/Oder",
      "registernummer": "HRB 2672",
      "registerart": "HRB",
      "company_name": "Wohnungsbaugesellschaft Bad Freienwalde mbH",
      "company_seat": "Bad Freienwalde (Oder)",
      "details": "07.01.2025 (Bekanntmachungsdatum)\n\nBrandenburg Amtsgericht Frankfurt/Oder HRB 2672\nEinreichung neuer Dokumente\n\nWohnungsbaugesellschaft Bad Freienwalde mbH\nGesellschaft mit beschränkter Haftung\nBad Freienwalde (Oder)\n\nAls nicht eingetragen wird veröffentlicht:  Die Gesellschaft hat Änderungen im Aufsichtsrat angezeigt."
    },
    {
      "date": "2025-01-07",
      "id": "97953",
      "original_text": "Löschungsankündigung\nBerlin Amtsgericht Berlin (Charlottenburg) HRB 188952\nBigglesale GmbH – Berlin",
      "type": "Löschungsankündigung",
      "state": "Berlin",
      "amtsgericht": "Amtsgericht Berlin (Charlottenburg)",
      "registernummer": "HRB 188952",
      "registerart": "HRB",
      "company_name": "Bigglesale GmbH",
      "company_seat": "Berlin",
      "details": "07.01.2025 (Bekanntmachungsdatum)\n\nBerlin Amtsgericht Berlin (Charlottenburg) HRB 188952\nLöschungsankündigung\n\nBigglesale GmbH\nGesellschaft mit beschränkter Haftung\nBerlin\n\nBei der nachstehenden Gesellschaft wird das Amtslöschungsverfahren gemäß § 394 FamFG eingeleitet. Widerspruchsfrist 6 Wochen"
    },
    {
      "date": "2025-01-07",
      "id": "97954",
      "original_text": "Sonstige Registerbekanntmachung\nBaden-Württemberg Amtsgericht Stuttgart HRB 10746\nErnst Klett Verlag GmbH – Stuttgart",
      "type": "Sonstige Registerbekanntmachung",
      "state": "Baden-Württemberg",
      "amtsgericht": "Amtsgericht Stuttgart",
      "registernummer": "HRB 10746",
      "registerart": "HRB",
      "company_name": "Ernst Klett Verlag GmbH",
      "company_seat": "Stuttgart",
      "details": "07.01.2025 (Bekanntmachungsdatum)\n\nBaden-Württemberg Amtsgericht Stuttgart HRB 10746\nSonstige Registerbekanntmachung 07.01.2025 (Eintragungsdatum)\n\nErnst Klett Verlag GmbH\nGesellschaft mit beschränkter Haftung\nStuttgart\n\nAls nicht eingetragen wird bekanntgemacht:\nDen Gläubigern der Gesellschaft, deren Forderungen begründet worden sind, bevor die Eintragung der Beendigung des Vertrages in das Handelsregister nach § 10 HGB als bekanntgemacht gilt, ist vom anderen Vertragsteil Sicherheit zu leisten, wenn sie sich binnen sechs Monaten nach der Bekanntmachung zu diesem Zweck bei ihm melden."
    },
    {
      "date": "2025-01-07",
      "id": "97955",
      "original_text": "Registerbekanntmachung nach dem Umwandlungsgesetz\nBerlin Amtsgericht Berlin (Charlottenburg) HRB 172136\nAVIV Group GmbH – Berlin",
      "type": "Registerbekanntmachung nach dem Umwandlungsgesetz",
      "state": "Berlin",
      "amtsgericht": "Amtsgericht Berlin (Charlottenburg)",
      "registernummer": "HRB 172136",
      "registerart": "HRB",
      "company_name": "AVIV Group GmbH",
      "company_seat": "Berlin",
      "details": "07.01.2025 (Bekanntmachungsdatum)\n\nBerlin Amtsgericht Berlin (Charlottenburg) HRB 172136\nRegisterbekanntmachung nach dem Umwandlungsgesetz 06.01.2025 (Eintragungsdatum)\n\nAVIV Group GmbH\nGesellschaft mit beschränkter Haftung\nBerlin\n\nZu Eintragungsnummer 25 vom 06.01.2025 wird als nicht eingetragen veröffentlicht: Der andere Vertragsteil hat den Gläubigern dieses Rechtsträgers, deren Forderungen begründet worden sind, bevor die Eintragung der Beendigung dieses Vertrages in das Handelsregister nach § 10 des Handelsgesetzbuches als bekannt gemacht gilt, Sicherheit zu leisten, wenn sie sich binnen sechs Monaten nach der Bekanntmachung der Eintragung zu diesem Zweck bei ihm melden. Dieses Recht steht den Gläubigern nicht zu, die im Fall des Insolvenzverfahrens ein Recht auf vorzugsweise Befriedigung aus der Deckungsmasse haben, die nach gesetzlicher Vorschrift zu ihrem Schutz errichtet und staatlich überwacht ist."
    },
    {
      "date": "2025-01-07",
      "id": "97956",
      "original_text": "Löschungsankündigung\nBrandenburg Amtsgericht Potsdam HRB 33352\nHKG24 GmbH – Großbeeren",
      "type": "Löschungsankündigung",
      "state": "Brandenburg",
      "amtsgericht": "Amtsgericht Potsdam",
      "registernummer": "HRB 33352",
      "registerart": "HRB",
      "company_name": "HKG24 GmbH",
      "company_seat": "Großbeeren",
      "details": "07.01.2025 (Bekanntmachungsdatum)\n\nBrandenburg Amtsgericht Potsdam HRB 33352\nLöschungsankündigung\n\nHKG24 GmbH\nGesellschaft mit beschränkter Haftung\nGroßbeeren\n\nBei der nachstehenden Gesellschaft wird das Amtslöschungsverfahren gemäß § 394 FamFG eingeleitet. Widerspruchsfrist: 8 Wochen"
    },
    {
      "date": "2025-01-07",
      "id": "97957",
      "original_text": "Löschungsankündigung\nBerlin Amtsgericht Berlin (Charlottenburg) HRB 122556\nJoker's Automaten GmbH – Berlin",
      "type": "Löschungsankündigung",
      "state": "Berlin",
      "amtsgericht": "Amtsgericht Berlin (Charlottenburg)",
      "registernummer": "HRB 122556",
      "registerart": "HRB",
      "company_name": "Joker's Automaten GmbH",
      "company_seat": "Berlin",
      "details": "07.01.2025 (Bekanntmachungsdatum)\n\nBerlin Amtsgericht Berlin (Charlottenburg) HRB 122556\nLöschungsankündigung\n\nJoker's Automaten GmbH\nGesellschaft mit beschränkter Haftung\nBerlin\n\nBei der nachstehenden Gesellschaft wird das Amtslöschungsverfahren gemäß § 394 FamFG eingeleitet. Widerspruchsfrist 6 Wochen"
    },
    {
      "date": "2025-01-07",
      "id": "97958",
      "original_text": "Einreichung neuer Dokumente\nSachsen Amtsgericht Dresden HRB 15248\nWasserversorgung und Stadtentwässerung Radebeul GmbH – Radebeul",
      "type": "Einreichung neuer Dokumente",
      "state": "Sachsen",
      "amtsgericht": "Amtsgericht Dresden",
      "registernummer": "HRB 15248",
      "registerart": "HRB",
      "company_name": "Wasserversorgung und Stadtentwässerung Radebeul GmbH",
      "company_seat": "Radebeul",
      "details": "07.01.2025 (Bekanntmachungsdatum)\n\nSachsen Amtsgericht Dresden HRB 15248\nEinreichung neuer Dokumente\n\nWasserversorgung und Stadtentwässerung Radebeul GmbH\nGesellschaft mit beschränkter Haftung\nRadebeul\n\nAm 03.01.2025 wurde beim Handelsregister des Amtsgerichts Dresden die Liste der Mitglieder des Aufsichtsrats gemäß § 52 GmbHG eingereicht."
    },
    {
      "date": "2025-01-07",
      "id": "97959",
      "original_text": "Löschungsankündigung\nSachsen Amtsgericht Dresden HRB 20748\nKruschel Bau GmbH – Arnsdorf",
      "type": "Löschungsankündigung",
      "state": "Sachsen",
      "amtsgericht": "Amtsgericht Dresden",
      "registernummer": "HRB 20748",
      "registerart": "HRB",
      "company_name": "Kruschel Bau GmbH",
      "company_seat": "Arnsdorf",
      "details": "07.01.2025 (Bekanntmachungsdatum)\n\nSachsen Amtsgericht Dresden HRB 20748\nLöschungsankündigung\n\nKruschel Bau GmbH\nGesellschaft mit beschränkter Haftung\nArnsdorf\n\nDas Registergericht beabsichtigt, die im Handelsregister eingetragene Gesellschaft von Amts wegen nach § 394 FamFG zu löschen. Die Frist zu Erhebung eines Widerspruchs gegen die beabsichtigte Löschung wird auf einen Monat festgesetzt."
    },
    {
      "date": "2025-01-07",
      "id": "97960",
      "original_text": "Einreichung neuer Dokumente\nSachsen Amtsgericht Dresden HRB 13937\nEuropastadt GörlitzZgorzelec GmbH für Wirtschaftsentwicklung, Stadtmarketing und Tourismus – Görlitz",
      "type": "Einreichung neuer Dokumente",
      "state": "Sachsen",
      "amtsgericht": "Amtsgericht Dresden",
      "registernummer": "HRB 13937",
      "registerart": "HRB",
      "company_name": "Europastadt GörlitzZgorzelec GmbH für Wirtschaftsentwicklung, Stadtmarketing und Tourismus",
      "company_seat": "Görlitz",
      "details": "07.01.2025 (Bekanntmachungsdatum)\n\nSachsen Amtsgericht Dresden HRB 13937\nEinreichung neuer Dokumente\n\nEuropastadt GörlitzZgorzelec GmbH für Wirtschaftsentwicklung, Stadtmarketing und Tourismus\nGesellschaft mit beschränkter Haftung\nGörlitz\n\nAm 05.01.2025 wurde beim Handelsregister des Amtsgerichts Dresden die Liste der Mitglieder des Aufsichtsrats gemäß § 52 GmbHG eingereicht."
    },
    {
      "date": "2025-01-07",
      "id": "97961",
      "original_text": "Registerbekanntmachung nach dem Umwandlungsgesetz\nBrandenburg Amtsgericht Cottbus HRB 15226\nEMW Verwaltung GmbH – Schönefeld",
      "type": "Registerbekanntmachung nach dem Umwandlungsgesetz",
      "state": "Brandenburg",
      "amtsgericht": "Amtsgericht Cottbus",
      "registernummer": "HRB 15226",
      "registerart": "HRB",
      "company_name": "EMW Verwaltung GmbH",
      "company_seat": "Schönefeld",
      "details": "07.01.2025 (Bekanntmachungsdatum)\n\nBrandenburg Amtsgericht Cottbus HRB 15226\nRegisterbekanntmachung nach dem Umwandlungsgesetz 03.01.2025 (Eintragungsdatum)\n\nEMW Verwaltung GmbH\nGesellschaft mit beschränkter Haftung\nSchönefeld\n\nAls nicht eingetragen wird veröffentlicht:\nDer andere Vertragsteil hat den Gläubigern dieses Rechtsträgers, dessen Forderungen begründet worden sind, bevor die Eintragung der Beendigung dieses Vertrages in das Handelsregister nach § 10 des Handelsgesetzbuches als bekannt gemacht gilt, Sicherheit zu leisten, wenn sie sich binnen sechs Monaten nach der Bekanntmachung der Eintragung zu diesem Zweck bei ihm melden"
    },
    {
      "date": "2025-01-07",
      "id": "97962",
      "original_text": "Löschungsankündigung\nNiedersachsen Amtsgericht Aurich HRB 201805\nOstfriesische Transportgesellschaft Janssen UG (haftungsbeschränkt) – Emden",
      "type": "Löschungsankündigung",
      "state": "Niedersachsen",
      "amtsgericht": "Amtsgericht Aurich",
      "registernummer": "HRB 201805",
      "registerart": "HRB",
      "company_name": "Ostfriesische Transportgesellschaft Janssen UG (haftungsbeschränkt)",
      "company_seat": "Emden",
      "details": "07.01.2025 (Bekanntmachungsdatum)\n\nNiedersachsen Amtsgericht Aurich HRB 201805\nLöschungsankündigung\n\nOstfriesische Transportgesellschaft Janssen UG (haftungsbeschränkt)\nGesellschaft mit beschränkter Haftung\nEmden\n\nDas Registergericht beabsichtigt, die Gesellschaft von Amts wegen nach § 394 FamFG zu löschen. Die Frist zur Erhebung eines Widerspruchs ist auf 1 Monat ab dieser Registerbekanntmachung festgesetzt."
    },
    {
      "date": "2025-01-07",
      "id": "97963",
      "original_text": "Löschungsankündigung\nNiedersachsen Amtsgericht Osnabrück HRB 217503\nNordvolt GmbH – Haselünne",
      "type": "Löschungsankündigung",
      "state": "Niedersachsen",
      "amtsgericht": "Amtsgericht Osnabrück",
      "registernummer": "HRB 217503",
      "registerart": "HRB",
      "company_name": "Nordvolt GmbH",
      "company_seat": "Haselünne",
      "details": "07.01.2025 (Bekanntmachungsdatum)\n\nNiedersachsen Amtsgericht Osnabrück HRB 217503\nLöschungsankündigung\n\nNordvolt GmbH\nGesellschaft mit beschränkter Haftung\nHaselünne\n\nDas Registergericht beabsichtigt, die Gesellschaft von Amts wegen nach § 394 FamFG wegen Vermögenslosigkeit zu löschen. Die Frist zur Erhebung eines Widerspruchs ist auf 1 Monat ab dieser Registerbekanntmachung festgesetzt."
    },
    {
      "date": "2025-01-07",
      "id": "97964",
      "original_text": "Sonstige Registerbekanntmachung\nNiedersachsen Amtsgericht Osnabrück HRB 204439\nKohne Personalservice GmbH – Osnabrück",
      "type": "Sonstige Registerbekanntmachung",
      "state": "Niedersachsen",
      "amtsgericht": "Amtsgericht Osnabrück",
      "registernummer": "HRB 204439",
      "registerart": "HRB",
      "company_name": "Kohne Personalservice GmbH",
      "company_seat": "Osnabrück",
      "details": "07.01.2025 (Bekanntmachungsdatum)\n\nNiedersachsen Amtsgericht Osnabrück HRB 204439\nSonstige Registerbekanntmachung 07.01.2025 (Eintragungsdatum)\n\nKohne Personalservice GmbH\nGesellschaft mit beschränkter Haftung\nOsnabrück\n\nDen Gläubigern der Gesellschaft, deren Forderungen begründet worden sind, bevor die Eintragung der Beendigung des Vertrages in das Handelsregister nach § 10 HGB als bekanntgemacht gilt, ist vom anderen Vertragsteil Sicherheit zu leisten, wenn sie sich binnen sechs Monaten nach der Bekanntmachung zu diesem Zweck bei ihm melden."
    },
    {
      "date": "2025-01-07",
      "id": "97965",
      "original_text": "Löschungsankündigung\nNiedersachsen Amtsgericht Aurich HRB 202118\nBojen Schiffahrtsbetrieb Geschäftsführungs-GmbH – Moormerland/Neermoor",
      "type": "Löschungsankündigung",
      "state": "Niedersachsen",
      "amtsgericht": "Amtsgericht Aurich",
      "registernummer": "HRB 202118",
      "registerart": "HRB",
      "company_name": "Bojen Schiffahrtsbetrieb Geschäftsführungs-GmbH",
      "company_seat": "Moormerland/Neermoor",
      "details": "07.01.2025 (Bekanntmachungsdatum)\n\nNiedersachsen Amtsgericht Aurich HRB 202118\nLöschungsankündigung\n\nBojen Schiffahrtsbetrieb Geschäftsführungs-GmbH\nGesellschaft mit beschränkter Haftung\nMoormerland/Neermoor\n\nDas Registergericht beabsichtigt, die Gesellschaft von Amts wegen nach § 394 FamFG zu löschen. Die Frist zur Erhebung eines Widerspruchs ist auf 1 Monat ab dieser Registerbekanntmachung festgesetzt."
    },
    {
      "date": "2025-01-07",
      "id": "97966",
      "original_text": "Registerbekanntmachung nach dem Umwandlungsgesetz\nNiedersachsen Amtsgericht Hannover HRB 102353 früher Amtsgericht Hameln\nJ. + E. Hagel GmbH – Barsinghausen",
      "type": "Registerbekanntmachung nach dem Umwandlungsgesetz",
      "state": "Niedersachsen",
      "amtsgericht": "Amtsgericht Hannover",
      "registernummer": "HRB 102353",
      "registerart": "HRB",
      "company_name": "J. + E. Hagel GmbH",
      "company_seat": "Barsinghausen",
      "former_amtsgericht": "Hameln",
      "details": "07.01.2025 (Bekanntmachungsdatum)\n\nNiedersachsen Amtsgericht Hannover HRB 102353 früher Amtsgericht Hameln\nRegisterbekanntmachung nach dem Umwandlungsgesetz 07.01.2025 (Eintragungsdatum)\n\nJ. + E. Hagel GmbH\nGesellschaft mit beschränkter Haftung\nBarsinghausen\n\nDen Gläubigern der an der Verschmelzung beteiligten Rechtsträger ist, wenn sie binnen sechs Monaten nach dem Tag, an dem die Eintragung der Verschmelzung in das Register des Sitzes desjenigen Rechtsträgers, dessen Gläubiger sie sind, nach § 19  Abs.  3 UmwG als bekannt gemacht gilt, ihren Anspruch nach Grund und Höhe schriftlich anmelden, Sicherheit zu leisten, soweit sie nicht Befriedigung verlangen können. Dieses Recht steht den Gläubigern jedoch nur zu, wenn sie glaubhaft machen, dass durch die Verschmelzung die Erfüllung der Forderung gefährdet wird."
    },
    {
      "date": "2025-01-07",
      "id": "97967",
      "original_text": "Löschungsankündigung\nNiedersachsen Amtsgericht Lüneburg HRB 208672\nWeide Licht Elektro UG (haftungsbeschränkt) – Winsen (Luhe)",
      "type": "Löschungsankündigung",
      "state": "Niedersachsen",
      "amtsgericht": "Amtsgericht Lüneburg",
      "registernummer": "HRB 208672",
      "registerart": "HRB",
      "company_name": "Weide Licht Elektro UG (haftungsbeschränkt)",
      "company_seat": "Winsen (Luhe)",
      "details": "07.01.2025 (Bekanntmachungsdatum)\n\nNiedersachsen Amtsgericht Lüneburg HRB 208672\nLöschungsankündigung\n\nWeide Licht Elektro UG (haftungsbeschränkt)\nGesellschaft mit beschränkter Haftung\nWinsen (Luhe)\n\nDas Registergericht beabsichtigt, vorstehende Gesellschaft von Amts wegen nach § 394 FamFG zu löschen. Die Frist zur Erhebung eines Widerspruchs ist auf 1 Monat ab Veröffentlichung festgesetzt."
    },
    {
      "date": "2025-01-07",
      "id": "97968",
      "original_text": "Löschungsankündigung\nBremen Amtsgericht Bremen HRB 27767\nM & G Techno GmbH – Bremen",
      "type": "Löschungsankündigung",
      "state": "Bremen",
      "amtsgericht": "Amtsgericht Bremen",
      "registernummer": "HRB 27767",
      "registerart": "HRB",
      "company_name": "M & G Techno GmbH",
      "company_seat": "Bremen",
      "details": "07.01.2025 (Bekanntmachungsdatum)\n\nBremen Amtsgericht Bremen HRB 27767\nLöschungsankündigung\n\nM & G Techno GmbH\nGesellschaft mit beschränkter Haftung\nBremen\n\nEs ist beabsichtigt die im Handelsregister eingetragene Gesellschaft von Amts wegen gemäß § 394 FamFG zu löschen. Gegen die Löschung kann beim AG Bremen schriftlich oder zu Protokoll der Geschäftsstelle Widerspruch eingelegt werden. Widerspruchsfrist 4 Wochen."
    },
    {
      "date": "2025-01-07",
      "id": "97969",
      "original_text": "Löschungsankündigung\nRheinland-Pfalz Amtsgericht Montabaur HRB 20079\nAB..Z Verwaltungs GmbH – Höhr-Grenzhausen",
      "type": "Löschungsankündigung",
      "state": "Rheinland-Pfalz",
      "amtsgericht": "Amtsgericht Montabaur",
      "registernummer": "HRB 20079",
      "registerart": "HRB",
      "company_name": "AB..Z Verwaltungs GmbH",
      "company_seat": "Höhr-Grenzhausen",
      "details": "07.01.2025 (Bekanntmachungsdatum)\n\nRheinland-Pfalz Amtsgericht Montabaur HRB 20079\nLöschungsankündigung\n\nAB..Z Verwaltungs GmbH\nGesellschaft mit beschränkter Haftung\nHöhr-Grenzhausen\n\nDas Registergericht beabsichtigt die Gesellschaft von Amts wegen nach § 394 FamFG zu löschen. Die Frist zur Erhebung eines Widerspruchs ist auf 1 Monat  festgesetzt."
    },
    {
      "date": "2025-01-07",
      "id": "97970",
      "original_text": "Löschungsankündigung\nRheinland-Pfalz Amtsgericht Ludwigshafen a.Rhein (Ludwigshafen) HRB 65116\nNefisso GmbH – Schifferstadt",
      "type": "Löschungsankündigung",
      "state": "Rheinland-Pfalz",
      "amtsgericht": "Amtsgericht Ludwigshafen a.Rhein (Ludwigshafen)",
      "registernummer": "HRB 65116",
      "registerart": "HRB",
      "company_name": "Nefisso GmbH",
      "company_seat": "Schifferstadt",
      "details": "07.01.2025 (Bekanntmachungsdatum)\n\nRheinland-Pfalz Amtsgericht Ludwigshafen a.Rhein (Ludwigshafen) HRB 65116\nLöschungsankündigung\n\nNefisso GmbH\nGesellschaft mit beschränkter Haftung\nSchifferstadt\n\nDas Registergericht beabsichtigt die Gesellschaft von Amts wegen nach § 394 FamFG zu löschen. Die Frist zur Erhebung eines Widerspruchs ist auf einen Monat festgesetzt."
    },
    {
      "date": "2025-01-07",
      "id": "97971",
      "original_text": "Einreichung neuer Dokumente\nRheinland-Pfalz Amtsgericht Ludwigshafen a.Rhein (Ludwigshafen) HRB 52013\nStadtwerke Speyer GmbH – Speyer",
      "type": "Einreichung neuer Dokumente",
      "state": "Rheinland-Pfalz",
      "amtsgericht": "Amtsgericht Ludwigshafen a.Rhein (Ludwigshafen)",
      "registernummer": "HRB 52013",
      "registerart": "HRB",
      "company_name": "Stadtwerke Speyer GmbH",
      "company_seat": "Speyer",
      "details": "07.01.2025 (Bekanntmachungsdatum)\n\nRheinland-Pfalz Amtsgericht Ludwigshafen a.Rhein (Ludwigshafen) HRB 52013\nEinreichung neuer Dokumente\n\nStadtwerke Speyer GmbH\nGesellschaft mit beschränkter Haftung\nSpeyer\n\nDem Registergericht ist eine neue Liste der Mitglieder des Aufsichtsrates eingereicht worden."
    },
    {
      "date": "2025-01-07",
      "id": "97972",
      "original_text": "Löschungsankündigung\nRheinland-Pfalz Amtsgericht Mainz HRB 51607\nZeljko Barun UG (haftungsbeschränkt) – Alzey",
      "type": "Löschungsankündigung",
      "state": "Rheinland-Pfalz",
      "amtsgericht": "Amtsgericht Mainz",
      "registernummer": "HRB 51607",
      "registerart": "HRB",
      "company_name": "Zeljko Barun UG (haftungsbeschränkt)",
      "company_seat": "Alzey",
      "details": "07.01.2025 (Bekanntmachungsdatum)\n\nRheinland-Pfalz Amtsgericht Mainz HRB 51607\nLöschungsankündigung\n\nZeljko Barun UG (haftungsbeschränkt)\nGesellschaft mit beschränkter Haftung\nAlzey\n\nDas Registergericht beabsichtigt die Gesellschaft von Amts wegen nach § 394 FamFG zu löschen. Die Frist zur Erhebung eines Widerspruchs ist auf einen Monat festgesetzt."
    },
    {
      "date": "2025-01-07",
      "id": "97973",
      "original_text": "Einreichung neuer Dokumente\nRheinland-Pfalz Amtsgericht Ludwigshafen a.Rhein (Ludwigshafen) HRB 21020\nCongressForum Frankenthal GmbH – Frankenthal/Pfalz",
      "type": "Einreichung neuer Dokumente",
      "state": "Rheinland-Pfalz",
      "amtsgericht": "Amtsgericht Ludwigshafen a.Rhein (Ludwigshafen)",
      "registernummer": "HRB 21020",
      "registerart": "HRB",
      "company_name": "CongressForum Frankenthal GmbH",
      "company_seat": "Frankenthal/Pfalz",
      "details": "07.01.2025 (Bekanntmachungsdatum)\n\nRheinland-Pfalz Amtsgericht Ludwigshafen a.Rhein (Ludwigshafen) HRB 21020\nEinreichung neuer Dokumente\n\nCongressForum Frankenthal GmbH\nGesellschaft mit beschränkter Haftung\nFrankenthal/Pfalz\n\nDem Registergericht ist eine neue Liste der Mitglieder des Aufsichtsrates eingereicht worden."
    },
    {
      "date": "2025-01-07",
      "id": "97974",
      "original_text": "Sonstige Registerbekanntmachung\nRheinland-Pfalz Amtsgericht Mainz HRB 47808\nEckes-Granini Beteiligungsverwaltung GmbH – Nieder-Olm",
      "type": "Sonstige Registerbekanntmachung",
      "state": "Rheinland-Pfalz",
      "amtsgericht": "Amtsgericht Mainz",
      "registernummer": "HRB 47808",
      "registerart": "HRB",
      "company_name": "Eckes-Granini Beteiligungsverwaltung GmbH",
      "company_seat": "Nieder-Olm",
      "details": "07.01.2025 (Bekanntmachungsdatum)\n\nRheinland-Pfalz Amtsgericht Mainz HRB 47808\nSonstige Registerbekanntmachung 07.01.2025 (Eintragungsdatum)\n\nEckes-Granini Beteiligungsverwaltung GmbH\nGesellschaft mit beschränkter Haftung\nNieder-Olm\n\nAls nicht eingetragen wird veröffentlicht: Den Gläubigern der Gesellschaft, deren Forderungen begründet worden sind, bevor die Eintragung der Beendigung des Ergebnisabführungsvertrages in das Handelsregister nach § 10 des Handelsgesetzbuches als bekanntgemacht gilt, hat der andere Vertragsteil Sicherheit zu leisten, wenn sie sich binnen sechs Monaten nach der Bekanntmachung der Eintragung zu diesem Zweck bei ihm melden."
    },
    {
      "date": "2025-01-07",
      "id": "97975",
      "original_text": "Einreichung neuer Dokumente\nNordrhein-Westfalen Amtsgericht Köln HRB 112841\nINU - Innovative University AG – Köln",
      "type": "Einreichung neuer Dokumente",
      "state": "Nordrhein-Westfalen",
      "amtsgericht": "Amtsgericht Köln",
      "registernummer": "HRB 112841",
      "registerart": "HRB",
      "company_name": "INU - Innovative University AG",
      "company_seat": "Köln",
      "details": "07.01.2025 (Bekanntmachungsdatum)\n\nNordrhein-Westfalen Amtsgericht Köln HRB 112841\nEinreichung neuer Dokumente 07.01.2025 (Eintragungsdatum)\n\nINU - Innovative University AG\nAktiengesellschaft\nKöln\n\nDem Registergericht ist eine Liste der Mitglieder des Aufsichtsrates eingereicht worden."
    },
    {
      "date": "2025-01-07",
      "id": "97976",
      "original_text": "Registerbekanntmachung nach dem Umwandlungsgesetz\nNordrhein-Westfalen Amtsgericht Köln HRB 121659\nArcelorMittal Downstream Solutions Holding Germany GmbH – Köln",
      "type": "Registerbekanntmachung nach dem Umwandlungsgesetz",
      "state": "Nordrhein-Westfalen",
      "amtsgericht": "Amtsgericht Köln",
      "registernummer": "HRB 121659",
      "registerart": "HRB",
      "company_name": "ArcelorMittal Downstream Solutions Holding Germany GmbH",
      "company_seat": "Köln",
      "details": "07.01.2025 (Bekanntmachungsdatum)\n\nNordrhein-Westfalen Amtsgericht Köln HRB 121659\nRegisterbekanntmachung nach dem Umwandlungsgesetz 07.01.2025 (Eintragungsdatum)\n\nArcelorMittal Downstream Solutions Holding Germany GmbH\nGesellschaft mit beschränkter Haftung\nKöln\n\nDen Gläubigern der an der formwechselnden Umwandlung beteiligten Rechtsträger ist, wenn sie binnen sechs Monaten nach dem Tag, an dem die Eintragung der formwechselnden Umwandlung in das Register des Sitzes desjenigen Rechtsträgers, dessen Gläubiger sie sind, nach § 19 Absatz 3 UmwG als bekanntgemacht gilt, ihren Anspruch nach Grund und Höhe schriftlich anmelden, Sicherheit zu leisten, soweit sie nicht Befriedigung verlangen können. Dieses Recht steht den Gläubigern jedoch nur zu, wenn sie glaubhaft machen, dass durch die formwechselnden Umwandlung die Erfüllung ihrer Forderung gefährdet wird."
    },
    {
      "date": "2025-01-07",
      "id": "97977",
      "original_text": "Sonstige Registerbekanntmachung\nNordrhein-Westfalen Amtsgericht Düsseldorf HRB 68832\nCumulocity GmbH – Düsseldorf",
      "type": "Sonstige Registerbekanntmachung",
      "state": "Nordrhein-Westfalen",
      "amtsgericht": "Amtsgericht Düsseldorf",
      "registernummer": "HRB 68832",
      "registerart": "HRB",
      "company_name": "Cumulocity GmbH",
      "company_seat": "Düsseldorf",
      "details": "07.01.2025 (Bekanntmachungsdatum)\n\nNordrhein-Westfalen Amtsgericht Düsseldorf HRB 68832\nSonstige Registerbekanntmachung 07.01.2025 (Eintragungsdatum)\n\nCumulocity GmbH\nGesellschaft mit beschränkter Haftung\nDüsseldorf\n\nAls nicht eingetragen wird veröffentlicht: Den Gläubigern der Gesellschaft, deren Forderungen begründet worden sind bevor die Eintragung der Beendigung des Beherrschungs- und Gewinnabführungsvertrages  in das Handelsregister nach § 10 des Handelsgesetzbuches als bekanntgemacht gilt, hat der andere Vertragsteil Sicherheit zu leisten, wenn sie sich binnen sechs Monaten nach der Bekanntmachung der Eintragung zu diesem Zweck bei ihm melden."
    },
    {
      "date": "2025-01-07",
      "id": "97978",
      "original_text": "Registerbekanntmachung nach dem Umwandlungsgesetz\nNordrhein-Westfalen Amtsgericht Köln HRB 102099\neepos Beteiligungs GmbH – Wiehl",
      "type": "Registerbekanntmachung nach dem Umwandlungsgesetz",
      "state": "Nordrhein-Westfalen",
      "amtsgericht": "Amtsgericht Köln",
      "registernummer": "HRB 102099",
      "registerart": "HRB",
      "company_name": "eepos Beteiligungs GmbH",
      "company_seat": "Wiehl",
      "details": "07.01.2025 (Bekanntmachungsdatum)\n\nNordrhein-Westfalen Amtsgericht Köln HRB 102099\nRegisterbekanntmachung nach dem Umwandlungsgesetz 07.01.2025 (Eintragungsdatum)\n\neepos Beteiligungs GmbH\nGesellschaft mit beschränkter Haftung\nWiehl\n\nDen Gläubigern der an der Verschmelzung beteiligten Rechtsträger ist, wenn sie binnen sechs Monaten nach dem Tag, an dem die Eintragung der Verschmelzung in das Register des Sitzes desjenigen Rechtsträgers, dessen Gläubiger sie sind, nach § 19 Absatz 3 UmwG als bekanntgemacht gilt, ihren Anspruch nach Grund und Höhe schriftlich anmelden, Sicherheit zu leisten, soweit sie nicht Befriedigung verlangen können. Dieses Recht steht den Gläubigern jedoch nur zu, wenn sie glaubhaft machen, dass durch die Verschmelzung die Erfüllung ihrer Forderung gefährdet wird."
    },
    {
      "date": "2025-01-07",
      "id": "97979",
      "original_text": "Löschungsankündigung\nNordrhein-Westfalen Amtsgericht Wuppertal HRB 32132\nTks Transporte UG (haftungsbeschränkt) – Solingen",
      "type": "Löschungsankündigung",
      "state": "Nordrhein-Westfalen",
      "amtsgericht": "Amtsgericht Wuppertal",
      "registernummer": "HRB 32132",
      "registerart": "HRB",
      "company_name": "Tks Transporte UG (haftungsbeschränkt)",
      "company_seat": "Solingen",
      "details": "07.01.2025 (Bekanntmachungsdatum)\n\nNordrhein-Westfalen Amtsgericht Wuppertal HRB 32132\nLöschungsankündigung\n\nTks Transporte UG (haftungsbeschränkt)\nGesellschaft mit beschränkter Haftung\nSolingen\n\nDas Registergericht beabsichtigt die Gesellschaft von Amts wegen nach § 394 FamFG zu löschen. Die Frist zur Erhebung eines Widerspruchs ist auf einen Monat festgesetzt."
    },
    {
      "date": "2025-01-07",
      "id": "97980",
      "original_text": "Sonstige Registerbekanntmachung\nNordrhein-Westfalen Amtsgericht Düsseldorf HRB 60917\nFluxys TENP GmbH – Düsseldorf",
      "type": "Sonstige Registerbekanntmachung",
      "state": "Nordrhein-Westfalen",
      "amtsgericht": "Amtsgericht Düsseldorf",
      "registernummer": "HRB 60917",
      "registerart": "HRB",
      "company_name": "Fluxys TENP GmbH",
      "company_seat": "Düsseldorf",
      "details": "07.01.2025 (Bekanntmachungsdatum)\n\nNordrhein-Westfalen Amtsgericht Düsseldorf HRB 60917\nSonstige Registerbekanntmachung\n\nFluxys TENP GmbH\nGesellschaft mit beschränkter Haftung\nDüsseldorf\n\nDem Registergericht ist eine Liste der Mitglieder des Aufsichtsrates eingereicht worden."
    },
    {
      "date": "2025-01-07",
      "id": "97981",
      "original_text": "Löschungsankündigung\nNordrhein-Westfalen Amtsgericht Siegen HRB 10961\npaGusto GmbH – Burbach",
      "type": "Löschungsankündigung",
      "state": "Nordrhein-Westfalen",
      "amtsgericht": "Amtsgericht Siegen",
      "registernummer": "HRB 10961",
      "registerart": "HRB",
      "company_name": "paGusto GmbH",
      "company_seat": "Burbach",
      "details": "07.01.2025 (Bekanntmachungsdatum)\n\nNordrhein-Westfalen Amtsgericht Siegen HRB 10961\nLöschungsankündigung\n\npaGusto GmbH\nGesellschaft mit beschränkter Haftung\nBurbach\n\nDas Registergericht beabsichtigt die Gesellschaft von Amts wegen nach § 394 FamFG zu löschen. Die Frist zur Erhebung eines Widerspruchs ist auf drei Monate festgesetzt."
    },
    {
      "date": "2025-01-07",
      "id": "97982",
      "original_text": "Löschungsankündigung\nNordrhein-Westfalen Amtsgericht Mönchengladbach HRB 17371\nDIS GmbH – Niederkrüchten",
      "type": "Löschungsankündigung",
      "state": "Nordrhein-Westfalen",
      "amtsgericht": "Amtsgericht Mönchengladbach",
      "registernummer": "HRB 17371",
      "registerart": "HRB",
      "company_name": "DIS GmbH",
      "company_seat": "Niederkrüchten",
      "details": "07.01.2025 (Bekanntmachungsdatum)\n\nNordrhein-Westfalen Amtsgericht Mönchengladbach HRB 17371\nLöschungsankündigung\n\nDIS GmbH\nGesellschaft mit beschränkter Haftung\nNiederkrüchten\n\nDIS GmbH, Niederkrüchten (Amtsgericht Mönchengladbach, HRB 17371)\nDas Registergericht beabsichtigt, die im Handelsregister eingetragene Gesellschaft gemäß § 394 Absatz 1 FamFG wegen Vermögenslosigkeit von Amts wegen zu löschen. Gegen diese Verfügung kann Widerspruch eingelegt werden. Die Frist zur Erhebung eines Widerspruchs gegen die beabsichtigte Löschung von Amts wegen ist auf drei Monate festgesetzt."
    },
    {
      "date": "2025-01-07",
      "id": "97983",
      "original_text": "Sonstige Registerbekanntmachung\nNordrhein-Westfalen Amtsgericht Düsseldorf HRB 70130\nATC Germany Holdings GmbH – Düsseldorf",
      "type": "Sonstige Registerbekanntmachung",
      "state": "Nordrhein-Westfalen",
      "amtsgericht": "Amtsgericht Düsseldorf",
      "registernummer": "HRB 70130",
      "registerart": "HRB",
      "company_name": "ATC Germany Holdings GmbH",
      "company_seat": "Düsseldorf",
      "details": "07.01.2025 (Bekanntmachungsdatum)\n\nNordrhein-Westfalen Amtsgericht Düsseldorf HRB 70130\nSonstige Registerbekanntmachung 07.01.2025 (Eintragungsdatum)\n\nATC Germany Holdings GmbH\nGesellschaft mit beschränkter Haftung\nDüsseldorf\n\nAls nicht eingetragen wird veröffentlicht: Den Gläubigern der Gesellschaft, deren Forderungen begründet worden sind bevor die Eintragung der Beendigung des Beherrschungs- und Gewinnabführungsvertrages  in das Handelsregister nach § 10 des Handelsgesetzbuches als bekanntgemacht gilt, hat der andere Vertragsteil Sicherheit zu leisten, wenn sie sich binnen sechs Monaten nach der Bekanntmachung der Eintragung zu diesem Zweck bei ihm melden."
    },
    {
      "date": "2025-01-07",
      "id": "97984",
      "original_text": "Löschungsankündigung\nNordrhein-Westfalen Amtsgericht Bonn HRB 26883\nPRO Lager & Logistik GmbH – Bonn",
      "type": "Löschungsankündigung",
      "state": "Nordrhein-Westfalen",
      "amtsgericht": "Amtsgericht Bonn",
      "registernummer": "HRB 26883",
      "registerart": "HRB",
      "company_name": "PRO Lager & Logistik GmbH",
      "company_seat": "Bonn",
      "details": "07.01.2025 (Bekanntmachungsdatum)\n\nNordrhein-Westfalen Amtsgericht Bonn HRB 26883\nLöschungsankündigung\n\nPRO Lager & Logistik GmbH\nGesellschaft mit beschränkter Haftung\nBonn\n\nDas Registergericht beabsichtigt die Gesellschaft von Amts wegen nach § 394 FamFG zu löschen. Die Frist zur Erhebung eines Widerspruchs ist auf einen Monat festgesetzt."
    },
    {
      "date": "2025-01-07",
      "id": "97985",
      "original_text": "Löschungsankündigung\nNordrhein-Westfalen Amtsgericht Wuppertal HRB 29842\nEngin Promotion UG (haftungsbeschränkt) – Wuppertal",
      "type": "Löschungsankündigung",
      "state": "Nordrhein-Westfalen",
      "amtsgericht": "Amtsgericht Wuppertal",
      "registernummer": "HRB 29842",
      "registerart": "HRB",
      "company_name": "Engin Promotion UG (haftungsbeschränkt)",
      "company_seat": "Wuppertal",
      "details": "07.01.2025 (Bekanntmachungsdatum)\n\nNordrhein-Westfalen Amtsgericht Wuppertal HRB 29842\nLöschungsankündigung\n\nEngin Promotion UG (haftungsbeschränkt)\nGesellschaft mit beschränkter Haftung\nWuppertal\n\nDas Registergericht beabsichtigt die Gesellschaft von Amts wegen nach § 394 FamFG zu löschen. Die Frist zur Erhebung eines Widerspruchs ist auf einen Monat festgesetzt."
    },
    {
      "date": "2025-01-07",
      "id": "97986",
      "original_text": "Löschungsankündigung\nNordrhein-Westfalen Amtsgericht Wuppertal HRB 29160\nDogukan UG (haftungsbeschränkt) – Solingen",
      "type": "Löschungsankündigung",
      "state": "Nordrhein-Westfalen",
      "amtsgericht": "Amtsgericht Wuppertal",
      "registernummer": "HRB 29160",
      "registerart": "HRB",
      "company_name": "Dogukan UG (haftungsbeschränkt)",
      "company_seat": "Solingen",
      "details": "07.01.2025 (Bekanntmachungsdatum)\n\nNordrhein-Westfalen Amtsgericht Wuppertal HRB 29160\nLöschungsankündigung\n\nDogukan UG (haftungsbeschränkt)\nGesellschaft mit beschränkter Haftung\nSolingen\n\nDas Registergericht beabsichtigt die Gesellschaft von Amts wegen nach § 394 FamFG zu löschen. Die Frist zur Erhebung eines Widerspruchs ist auf einen Monat festgesetzt."
    },
    {
      "date": "2025-01-07",
      "id": "97987",
      "original_text": "Registerbekanntmachung nach dem Umwandlungsgesetz\nNordrhein-Westfalen Amtsgericht Kleve HRA 5682\nIngenieurbüro für Baustatik Dr.-Ing. Björn Karczewski e.K. – Rees",
      "type": "Registerbekanntmachung nach dem Umwandlungsgesetz",
      "state": "Nordrhein-Westfalen",
      "amtsgericht": "Amtsgericht Kleve",
      "registernummer": "HRA 5682",
      "registerart": "HRA",
      "company_name": "Ingenieurbüro für Baustatik Dr.-Ing. Björn Karczewski e.K.",
      "company_seat": "Rees",
      "details": "07.01.2025 (Bekanntmachungsdatum)\n\nNordrhein-Westfalen Amtsgericht Kleve HRA 5682\nRegisterbekanntmachung nach dem Umwandlungsgesetz 07.01.2025 (Eintragungsdatum)\n\nIngenieurbüro für Baustatik Dr.-Ing. Björn Karczewski e.K.\nEinzelkaufmann / Einzelkauffrau\nRees\n\nDen Gläubigern der an der Ausgliederung beteiligten Rechtsträger ist, wenn sie binnen sechs Monaten nach dem Tag, an dem die Eintragung der Ausgliederung in das Register des Sitzes desjenigen Rechtsträgers, dessen Gläubiger sie sind, nach § 19 Absatz 3 UmwG als bekanntgemacht gilt, ihren Anspruch nach Grund und Höhe schriftlich anmelden, Sicherheit zu leisten, soweit sie nicht Befriedigung verlangen können. Dieses Recht steht den Gläubigern jedoch nur zu, wenn sie glaubhaft machen, dass durch die Ausgliederung die Erfüllung ihrer Forderung gefährdet wird."
    },
    {
      "date": "2025-01-07",
      "id": "97988",
      "original_text": "Sonstige Registerbekanntmachung\nNordrhein-Westfalen Amtsgericht Aachen HRB 12518\nFoconis Payment GBS GmbH – Aachen",
      "type": "Sonstige Registerbekanntmachung",
      "state": "Nordrhein-Westfalen",
      "amtsgericht": "Amtsgericht Aachen",
      "registernummer": "HRB 12518",
      "registerart": "HRB",
      "company_name": "Foconis Payment GBS GmbH",
      "company_seat": "Aachen",
      "details": "07.01.2025 (Bekanntmachungsdatum)\n\nNordrhein-Westfalen Amtsgericht Aachen HRB 12518\nSonstige Registerbekanntmachung 07.01.2025 (Eintragungsdatum)\n\nFoconis Payment GBS GmbH\nGesellschaft mit beschränkter Haftung\nAachen\n\nAls nicht eingetragen wird veröffentlicht: Den Gläubigern der Gesellschaft, deren Forderungen begründet worden sind bevor die Eintragung der Beendigung des Beherrschungs- und Gewinnabführungsvertrages  in das Handelsregister nach § 10 des Handelsgesetzbuches als bekanntgemacht gilt, hat der andere Vertragsteil Sicherheit zu leisten, wenn sie sich binnen sechs Monaten nach der Bekanntmachung der Eintragung zu diesem Zweck bei ihm melden."
    },
    {
      "date": "2025-01-07",
      "id": "97989",
      "original_text": "Registerbekanntmachung nach dem Umwandlungsgesetz\nNordrhein-Westfalen Amtsgericht Köln HRB 57856\neepos GmbH – Wiehl",
      "type": "Registerbekanntmachung nach dem Umwandlungsgesetz",
      "state": "Nordrhein-Westfalen",
      "amtsgericht": "Amtsgericht Köln",
      "registernummer": "HRB 57856",
      "registerart": "HRB",
      "company_name": "eepos GmbH",
      "company_seat": "Wiehl",
      "details": "07.01.2025 (Bekanntmachungsdatum)\n\nNordrhein-Westfalen Amtsgericht Köln HRB 57856\nRegisterbekanntmachung nach dem Umwandlungsgesetz 07.01.2025 (Eintragungsdatum)\n\neepos GmbH\nGesellschaft mit beschränkter Haftung\nWiehl\n\nDen Gläubigern der an der Verschmelzung beteiligten Rechtsträger ist, wenn sie binnen sechs Monaten nach dem Tag, an dem die Eintragung der Verschmelzung in das Register des Sitzes desjenigen Rechtsträgers, dessen Gläubiger sie sind, nach § 19 Absatz 3 UmwG als bekanntgemacht gilt, ihren Anspruch nach Grund und Höhe schriftlich anmelden, Sicherheit zu leisten, soweit sie nicht Befriedigung verlangen können. Dieses Recht steht den Gläubigern jedoch nur zu, wenn sie glaubhaft machen, dass durch die Verschmelzung die Erfüllung ihrer Forderung gefährdet wird."
    },
    {
      "date": "2025-01-07",
      "id": "97990",
      "original_text": "Einreichung neuer Dokumente\nNordrhein-Westfalen Amtsgericht Duisburg HRB 36272\nLCAP Medical AG – Duisburg",
      "type": "Einreichung neuer Dokumente",
      "state": "Nordrhein-Westfalen",
      "amtsgericht": "Amtsgericht Duisburg",
      "registernummer": "HRB 36272",
      "registerart": "HRB",
      "company_name": "LCAP Medical AG",
      "company_seat": "Duisburg",
      "details": "07.01.2025 (Bekanntmachungsdatum)\n\nNordrhein-Westfalen Amtsgericht Duisburg HRB 36272\nEinreichung neuer Dokumente\n\nLCAP Medical AG\nAktiengesellschaft\nDuisburg\n\nDem Registergericht ist eine neue Liste der Mitglieder des Aufsichtsrates eingereicht worden."
    },
    {
      "date": "2025-01-07",
      "id": "97991",
      "original_text": "Löschungsankündigung\nNordrhein-Westfalen Amtsgericht Neuss VR 1809\nDOKU-NICHI PROJEKTS ASSOCIATION – Kaarst",
      "type": "Löschungsankündigung",
      "state": "Nordrhein-Westfalen",
      "amtsgericht": "Amtsgericht Neuss",
      "registernummer": "VR 1809",
      "registerart": "VR",
      "company_name": "DOKU-NICHI PROJEKTS ASSOCIATION",
      "company_seat": "Kaarst",
      "details": "07.01.2025 (Bekanntmachungsdatum)\n\nNordrhein-Westfalen Amtsgericht Neuss VR 1809\nLöschungsankündigung 07.01.2025 (Eintragungsdatum)\n\nDOKU-NICHI PROJEKTS ASSOCIATION\neingetragener Verein\nKaarst\n\nDas Gericht beabsichtigt, den Verein gemäß §395 FamFG im Vereinsregister zu löschen. Gegen die Löschung kann binnen eines Monats jeder Widerspruch erheben, der an der Unterlassung der Löschung ein berechtigtes Interesse hat."
    },
    {
      "date": "2025-01-07",
      "id": "97992",
      "original_text": "Löschungsankündigung\nNordrhein-Westfalen Amtsgericht Wuppertal HRB 28914\nFaßbeck UG (haftungsbeschränkt) Handwerker Service – Wuppertal",
      "type": "Löschungsankündigung",
      "state": "Nordrhein-Westfalen",
      "amtsgericht": "Amtsgericht Wuppertal",
      "registernummer": "HRB 28914",
      "registerart": "HRB",
      "company_name": "Faßbeck UG (haftungsbeschränkt) Handwerker Service",
      "company_seat": "Wuppertal",
      "details": "07.01.2025 (Bekanntmachungsdatum)\n\nNordrhein-Westfalen Amtsgericht Wuppertal HRB 28914\nLöschungsankündigung\n\nFaßbeck UG (haftungsbeschränkt) Handwerker Service\nGesellschaft mit beschränkter Haftung\nWuppertal\n\nDas Registergericht beabsichtigt die Gesellschaft von Amts wegen nach § 394 FamFG zu löschen. Die Frist zur Erhebung eines Widerspruchs ist auf einen Monat festgesetzt."
    },
    {
      "date": "2025-01-07",
      "id": "97993",
      "original_text": "Sonstige Registerbekanntmachung\nNordrhein-Westfalen Amtsgericht Köln HRB 60974\nCaligari Entertainment GmbH – Köln",
      "type": "Sonstige Registerbekanntmachung",
      "state": "Nordrhein-Westfalen",
      "amtsgericht": "Amtsgericht Köln",
      "registernummer": "HRB 60974",
      "registerart": "HRB",
      "company_name": "Caligari Entertainment GmbH",
      "company_seat": "Köln",
      "details": "07.01.2025 (Bekanntmachungsdatum)\n\nNordrhein-Westfalen Amtsgericht Köln HRB 60974\nSonstige Registerbekanntmachung 07.01.2025 (Eintragungsdatum)\n\nCaligari Entertainment GmbH\nGesellschaft mit beschränkter Haftung\nKöln\n\nAls nicht eingetragen wird veröffentlicht: Den Gläubigern der Gesellschaft, deren Forderungen begründet worden sind bevor die Eintragung der Beendigung des Beherrschungs- und Gewinnabführungsvertrages  in das Handelsregister nach § 10 des Handelsgesetzbuches als bekanntgemacht gilt, hat der andere Vertragsteil Sicherheit zu leisten, wenn sie sich binnen sechs Monaten nach der Bekanntmachung der Eintragung zu diesem Zweck bei ihm melden."
    },
    {
      "date": "2025-01-07",
      "id": "97994",
      "original_text": "Registerbekanntmachung nach dem Umwandlungsgesetz\nNordrhein-Westfalen Amtsgericht Köln HRB 115024\nArcelorMittal Downstream Solutions Holding Germany AG – Köln",
      "type": "Registerbekanntmachung nach dem Umwandlungsgesetz",
      "state": "Nordrhein-Westfalen",
      "amtsgericht": "Amtsgericht Köln",
      "registernummer": "HRB 115024",
      "registerart": "HRB",
      "company_name": "ArcelorMittal Downstream Solutions Holding Germany AG",
      "company_seat": "Köln",
      "details": "07.01.2025 (Bekanntmachungsdatum)\n\nNordrhein-Westfalen Amtsgericht Köln HRB 115024\nRegisterbekanntmachung nach dem Umwandlungsgesetz 07.01.2025 (Eintragungsdatum)\n\nArcelorMittal Downstream Solutions Holding Germany AG\nAktiengesellschaft\nKöln\n\nDen Gläubigern der an der formwechselnden Umwandlung beteiligten Rechtsträger ist, wenn sie binnen sechs Monaten nach dem Tag, an dem die Eintragung der formwechselnden Umwandlung in das Register des Sitzes desjenigen Rechtsträgers, dessen Gläubiger sie sind, nach § 19 Absatz 3 UmwG als bekanntgemacht gilt, ihren Anspruch nach Grund und Höhe schriftlich anmelden, Sicherheit zu leisten, soweit sie nicht Befriedigung verlangen können. Dieses Recht steht den Gläubigern jedoch nur zu, wenn sie glaubhaft machen, dass durch die formwechselnden Umwandlung die Erfüllung ihrer Forderung gefährdet wird."
    },
    {
      "date": "2025-01-07",
      "id": "97995",
      "original_text": "Löschungsankündigung\nNordrhein-Westfalen Amtsgericht Düsseldorf HRB 99175\nDyscom Import & Export UG (haftungsbeschränkt) – Düsseldorf",
      "type": "Löschungsankündigung",
      "state": "Nordrhein-Westfalen",
      "amtsgericht": "Amtsgericht Düsseldorf",
      "registernummer": "HRB 99175",
      "registerart": "HRB",
      "company_name": "Dyscom Import & Export UG (haftungsbeschränkt)",
      "company_seat": "Düsseldorf",
      "details": "07.01.2025 (Bekanntmachungsdatum)\n\nNordrhein-Westfalen Amtsgericht Düsseldorf HRB 99175\nLöschungsankündigung\n\nDyscom Import & Export UG (haftungsbeschränkt)\nGesellschaft mit beschränkter Haftung\nDüsseldorf"
    },
    {
      "date": "2025-01-07",
      "id": "97996",
      "original_text": "Löschungsankündigung\nNordrhein-Westfalen Amtsgericht Düsseldorf HRB 99175\nDyscom Import & Export UG (haftungsbeschränkt) – Düsseldorf",
      "type": "Löschungsankündigung",
      "state": "Nordrhein-Westfalen",
      "amtsgericht": "Amtsgericht Düsseldorf",
      "registernummer": "HRB 99175",
      "registerart": "HRB",
      "company_name": "Dyscom Import & Export UG (haftungsbeschränkt)",
      "company_seat": "Düsseldorf",
      "details": "07.01.2025 (Bekanntmachungsdatum)\n\nNordrhein-Westfalen Amtsgericht Düsseldorf HRB 99175\nLöschungsankündigung\n\nDyscom Import & Export UG (haftungsbeschränkt)\nGesellschaft mit beschränkter Haftung\nDüsseldorf\n\nDas Registergericht beabsichtigt die Gesellschaft von Amts wegen nach § 394 FamFG zu löschen. Die Frist zur Erhebung eines Widerspruchs ist auf 3 Wochen festgesetzt.\n\nRechtsbehelfsbelehrung:\nDas Widerspruchsrecht steht jedem zu, der an der Unterlassung der Löschung ein berechtigtes Interesse hat. Der Widerspruch ist bei dem Amtsgericht Düsseldorf -Registergericht-, Werdener Straße 1, 40227 Düsseldorf schriftlich in deutscher Sprache oder zur Niederschrift der Geschäftsstelle einzulegen. Der Widerspruch kann auch zur Niederschrift der Geschäftsstelle eines jeden Amtsgerichtes abgegeben werden. Die Einlegung ist auch durch Übertragung eines elektronischen Dokuments an die elektronische Poststelle des Gerichts möglich. Das elektronische Dokument muss für die Bearbeitung durch das Gericht geeignet und mit einer qualifizierten elektronischen Signatur der verantwortenden Person versehen sein oder von der verantwortenden Person signiert und auf einem sicheren Übermittlungsweg gemäß § 130a ZPO nach näherer Maßgabe der Verordnung über die technischen Rahmenbedingungen des elektronischen Rechtsverkehrs und über das besondere elektronische Behördenpostfach (BGBl. I, S.3803) eingereicht werden. Weitere Informationen erhalten Sie auf der Internetseite www.justiz.de.\nDer Widerspruch muss spätestens innerhalb der gesetzten Frist nach dem Datum der Bekanntmachung der Löschungsankündigung bei dem Amtsgericht - Registergericht - Düsseldorf eingegangen sein.  Dies gilt auch dann, wenn der Widerspruch zur Niederschrift der Geschäftsstelle eines anderen Amtsgerichtes abgegeben wurde. Die Frist beginnt mit dem Tage der Bekanntmachung der Löschungsankündigung in dem für die Bekanntmachung der Eintragungen in das Handelsregister bestimmten elektronischen Informations- und Kommunikationssystem nach § 10 des Handelsgesetzbuches. Fällt das Ende der Frist auf einen Sonntag, einen allgemeinen Feiertag oder Sonnabend, so endet die Frist mit Ablauf des nächsten Werktages.\nDer Widerspruch muss die Bezeichnung der angefochtenen Löschungsankündigung sowie die Erklärung enthalten, dass Widerspruch gegen diese Löschungsankündigung eingelegt wird. Er ist zu unterzeichnen und soll begründet werden."
    },
    {
      "date": "2025-01-07",
      "id": "97997",
      "original_text": "Löschungsankündigung\nNordrhein-Westfalen Amtsgericht Düsseldorf HRB 88848\nWilke Consulting UG (haftungsbeschränkt) – Düsseldorf",
      "type": "Löschungsankündigung",
      "state": "Nordrhein-Westfalen",
      "amtsgericht": "Amtsgericht Düsseldorf",
      "registernummer": "HRB 88848",
      "registerart": "HRB",
      "company_name": "Wilke Consulting UG (haftungsbeschränkt)",
      "company_seat": "Düsseldorf",
      "details": "07.01.2025 (Bekanntmachungsdatum)\n\nNordrhein-Westfalen Amtsgericht Düsseldorf HRB 88848\nLöschungsankündigung\n\nWilke Consulting UG (haftungsbeschränkt)\nGesellschaft mit beschränkter Haftung\nDüsseldorf\n\nDas Registergericht beabsichtigt die Gesellschaft von Amts wegen nach § 394 FamFG zu löschen. Die Frist zur Erhebung eines Widerspruchs ist auf 3 Wochen festgesetzt.\n\nRechtsbehelfsbelehrung:\nDas Widerspruchsrecht steht jedem zu, der an der Unterlassung der Löschung ein berechtigtes Interesse hat. Der Widerspruch ist bei dem Amtsgericht Düsseldorf -Registergericht-, Werdener Straße 1, 40227 Düsseldorf schriftlich in deutscher Sprache oder zur Niederschrift der Geschäftsstelle einzulegen. Der Widerspruch kann auch zur Niederschrift der Geschäftsstelle eines jeden Amtsgerichtes abgegeben werden. Die Einlegung ist auch durch Übertragung eines elektronischen Dokuments an die elektronische Poststelle des Gerichts möglich. Das elektronische Dokument muss für die Bearbeitung durch das Gericht geeignet und mit einer qualifizierten elektronischen Signatur der verantwortenden Person versehen sein oder von der verantwortenden Person signiert und auf einem sicheren Übermittlungsweg gemäß § 130a ZPO nach näherer Maßgabe der Verordnung über die technischen Rahmenbedingungen des elektronischen Rechtsverkehrs und über das besondere elektronische Behördenpostfach (BGBl. I, S.3803) eingereicht werden. Weitere Informationen erhalten Sie auf der Internetseite www.justiz.de.\nDer Widerspruch muss spätestens innerhalb der gesetzten Frist nach dem Datum der Bekanntmachung der Löschungsankündigung bei dem Amtsgericht - Registergericht - Düsseldorf eingegangen sein.  Dies gilt auch dann, wenn der Widerspruch zur Niederschrift der Geschäftsstelle eines anderen Amtsgerichtes abgegeben wurde. Die Frist beginnt mit dem Tage der Bekanntmachung der Löschungsankündigung in dem für die Bekanntmachung der Eintragungen in das Handelsregister bestimmten elektronischen Informations- und Kommunikationssystem nach § 10 des Handelsgesetzbuches. Fällt das Ende der Frist auf einen Sonntag, einen allgemeinen Feiertag oder Sonnabend, so endet die Frist mit Ablauf des nächsten Werktages.\nDer Widerspruch muss die Bezeichnung der angefochtenen Löschungsankündigung sowie die Erklärung enthalten, dass Widerspruch gegen diese Löschungsankündigung eingelegt wird. Er ist zu unterzeichnen und soll begründet werden."
    },
    {
      "date": "2025-01-07",
      "id": "97998",
      "original_text": "Sonstige Registerbekanntmachung\nNordrhein-Westfalen Amtsgericht Köln HRB 104317\nLekkerland SE – Köln",
      "type": "Sonstige Registerbekanntmachung",
      "state": "Nordrhein-Westfalen",
      "amtsgericht": "Amtsgericht Köln",
      "registernummer": "HRB 104317",
      "registerart": "HRB",
      "company_name": "Lekkerland SE",
      "company_seat": "Köln",
      "details": "07.01.2025 (Bekanntmachungsdatum)\n\nNordrhein-Westfalen Amtsgericht Köln HRB 104317\nSonstige Registerbekanntmachung\n\nLekkerland SE\nEuropäische Aktiengesellschaft (SE)\nKöln\n\nAls nicht eingetragen wird veröffentlicht: Den Gläubigern der Gesellschaft, deren Forderungen begründet worden sind bevor die Eintragung der Beendigung des Beherrschungs- und Gewinnabführungsvertrages  in das Handelsregister nach § 10 des Handelsgesetzbuches als bekanntgemacht gilt, hat der andere Vertragsteil Sicherheit zu leisten, wenn sie sich binnen sechs Monaten nach der Bekanntmachung der Eintragung zu diesem Zweck bei ihm melden."
    },
    {
      "date": "2025-01-07",
      "id": "97999",
      "original_text": "Löschungsankündigung\nNordrhein-Westfalen Amtsgericht Hamm HRB 5912\nKobratec GmbH – Bönen",
      "type": "Löschungsankündigung",
      "state": "Nordrhein-Westfalen",
      "amtsgericht": "Amtsgericht Hamm",
      "registernummer": "HRB 5912",
      "registerart": "HRB",
      "company_name": "Kobratec GmbH",
      "company_seat": "Bönen",
      "details": "07.01.2025 (Bekanntmachungsdatum)\n\nNordrhein-Westfalen Amtsgericht Hamm HRB 5912\nLöschungsankündigung\n\nKobratec GmbH\nGesellschaft mit beschränkter Haftung\nBönen\n\nDas Registergericht beabsichtigt die Gesellschaft von Amts wegen nach § 394 FamFG zu löschen. Die Frist zur Erhebung eines Widerspruchs ist auf drei Monate festgesetzt."
    },
    {
      "date": "2025-01-07",
      "id": "98000",
      "original_text": "Löschungsankündigung\nNordrhein-Westfalen Amtsgericht Mönchengladbach HRB 18148\nHGI Verwaltungs UG (haftungsbeschränkt) – Mönchengladbach",
      "type": "Löschungsankündigung",
      "state": "Nordrhein-Westfalen",
      "amtsgericht": "Amtsgericht Mönchengladbach",
      "registernummer": "HRB 18148",
      "registerart": "HRB",
      "company_name": "HGI Verwaltungs UG (haftungsbeschränkt)",
      "company_seat": "Mönchengladbach",
      "details": "07.01.2025 (Bekanntmachungsdatum)\n\nNordrhein-Westfalen Amtsgericht Mönchengladbach HRB 18148\nLöschungsankündigung\n\nHGI Verwaltungs UG (haftungsbeschränkt)\nGesellschaft mit beschränkter Haftung\nMönchengladbach\n\nHGI Verwaltungs UG (haftungsbeschränkt), Mönchengladbach (Amtsgericht Mönchengladbach, HRB 18148)\n\nDas Registergericht beabsichtigt, die im Handelsregister eingetragene Gesellschaft gemäß § 394 Absatz 1 FamFG wegen Vermögenslosigkeit von Amts wegen zu löschen. Gegen diese Verfügung kann Widerspruch eingelegt werden. Die Frist zur Erhebung eines Widerspruchs gegen die beabsichtigte Löschung von Amts wegen ist auf drei Monate festgesetzt."
    },
    {
      "date": "2025-01-07",
      "id": "98001",
      "original_text": "Einreichung neuer Dokumente\nNordrhein-Westfalen Amtsgericht Iserlohn HRB 3898\nMVG Märkische Verkehrsgesellschaft GmbH – Lüdenscheid",
      "type": "Einreichung neuer Dokumente",
      "state": "Nordrhein-Westfalen",
      "amtsgericht": "Amtsgericht Iserlohn",
      "registernummer": "HRB 3898",
      "registerart": "HRB",
      "company_name": "MVG Märkische Verkehrsgesellschaft GmbH",
      "company_seat": "Lüdenscheid",
      "details": "07.01.2025 (Bekanntmachungsdatum)\n\nNordrhein-Westfalen Amtsgericht Iserlohn HRB 3898\nEinreichung neuer Dokumente\n\nMVG Märkische Verkehrsgesellschaft GmbH\nGesellschaft mit beschränkter Haftung\nLüdenscheid\n\nDem Registergericht ist eine neue Liste der Mitglieder des Aufsichtsrates eingereicht worden."
    },
    {
      "date": "2025-01-07",
      "id": "98002",
      "original_text": "Löschungsankündigung\nNordrhein-Westfalen Amtsgericht Düsseldorf HRB 89737\nMetta.Ventures GmbH – Düsseldorf",
      "type": "Löschungsankündigung",
      "state": "Nordrhein-Westfalen",
      "amtsgericht": "Amtsgericht Düsseldorf",
      "registernummer": "HRB 89737",
      "registerart": "HRB",
      "company_name": "Metta.Ventures GmbH",
      "company_seat": "Düsseldorf",
      "details": "07.01.2025 (Bekanntmachungsdatum)\n\nNordrhein-Westfalen Amtsgericht Düsseldorf HRB 89737\nLöschungsankündigung\n\nMetta.Ventures GmbH\nGesellschaft mit beschränkter Haftung\nDüsseldorf\n\nDas Registergericht beabsichtigt die Gesellschaft von Amts wegen nach § 394 FamFG zu löschen. Die Frist zur Erhebung eines Widerspruchs ist auf 3 Wochen festgesetzt.\n\nRechtsbehelfsbelehrung:\nDas Widerspruchsrecht steht jedem zu, der an der Unterlassung der Löschung ein berechtigtes Interesse hat. Der Widerspruch ist bei dem Amtsgericht Düsseldorf -Registergericht-, Werdener Straße 1, 40227 Düsseldorf schriftlich in deutscher Sprache oder zur Niederschrift der Geschäftsstelle einzulegen. Der Widerspruch kann auch zur Niederschrift der Geschäftsstelle eines jeden Amtsgerichtes abgegeben werden. Die Einlegung ist auch durch Übertragung eines elektronischen Dokuments an die elektronische Poststelle des Gerichts möglich. Das elektronische Dokument muss für die Bearbeitung durch das Gericht geeignet und mit einer qualifizierten elektronischen Signatur der verantwortenden Person versehen sein oder von der verantwortenden Person signiert und auf einem sicheren Übermittlungsweg gemäß § 130a ZPO nach näherer Maßgabe der Verordnung über die technischen Rahmenbedingungen des elektronischen Rechtsverkehrs und über das besondere elektronische Behördenpostfach (BGBl. I, S.3803) eingereicht werden. Weitere Informationen erhalten Sie auf der Internetseite www.justiz.de.\nDer Widerspruch muss spätestens innerhalb der gesetzten Frist nach dem Datum der Bekanntmachung der Löschungsankündigung bei dem Amtsgericht - Registergericht - Düsseldorf eingegangen sein.  Dies gilt auch dann, wenn der Widerspruch zur Niederschrift der Geschäftsstelle eines anderen Amtsgerichtes abgegeben wurde. Die Frist beginnt mit dem Tage der Bekanntmachung der Löschungsankündigung in dem für die Bekanntmachung der Eintragungen in das Handelsregister bestimmten elektronischen Informations- und Kommunikationssystem nach § 10 des Handelsgesetzbuches. Fällt das Ende der Frist auf einen Sonntag, einen allgemeinen Feiertag oder Sonnabend, so endet die Frist mit Ablauf des nächsten Werktages.\nDer Widerspruch muss die Bezeichnung der angefochtenen Löschungsankündigung sowie die Erklärung enthalten, dass Widerspruch gegen diese Löschungsankündigung eingelegt wird. Er ist zu unterzeichnen und soll begründet werden."
    },
    {
      "date": "2025-01-07",
      "id": "98003",
      "original_text": "Sonstige Registerbekanntmachung\nNordrhein-Westfalen Amtsgericht Münster GnR 437\nBürger-Energie Sendenhorst & Albersloh eG – Sendenhorst",
      "type": "Sonstige Registerbekanntmachung",
      "state": "Nordrhein-Westfalen",
      "amtsgericht": "Amtsgericht Münster",
      "registernummer": "GnR 437",
      "registerart": "GnR",
      "company_name": "Bürger-Energie Sendenhorst & Albersloh eG",
      "company_seat": "Sendenhorst",
      "details": "07.01.2025 (Bekanntmachungsdatum)\n\nNordrhein-Westfalen Amtsgericht Münster GnR 437\nSonstige Registerbekanntmachung 07.01.2025 (Eintragungsdatum)\n\nBürger-Energie Sendenhorst & Albersloh eG\neingetragene Genossenschaft\nSendenhorst\n\nAls nicht eingetragen wird veröffentlicht: Den Gläubigern der Genossenschaft ist gemäß § 22 GenG, wenn sie sich binnen sechs Monaten nach der Bekanntmachung bei der Genossenschaft  zu diesem Zweck  melden, Sicherheit zu leisten, soweit sie nicht Befriedigung verlangen können."
    },
    {
      "date": "2025-01-07",
      "id": "98004",
      "original_text": "Einreichung neuer Dokumente\nNordrhein-Westfalen Amtsgericht Iserlohn HRB 3849\nMKD Märkisches Kulturgut Dechenhöhle gemeinnützige GmbH – Iserlohn",
      "type": "Einreichung neuer Dokumente",
      "state": "Nordrhein-Westfalen",
      "amtsgericht": "Amtsgericht Iserlohn",
      "registernummer": "HRB 3849",
      "registerart": "HRB",
      "company_name": "MKD Märkisches Kulturgut Dechenhöhle gemeinnützige GmbH",
      "company_seat": "Iserlohn",
      "details": "07.01.2025 (Bekanntmachungsdatum)\n\nNordrhein-Westfalen Amtsgericht Iserlohn HRB 3849\nEinreichung neuer Dokumente 07.01.2025 (Eintragungsdatum)\n\nMKD Märkisches Kulturgut Dechenhöhle gemeinnützige GmbH\nGesellschaft mit beschränkter Haftung\nIserlohn\n\nDem Registergericht ist eine neue Liste der Mitglieder des Aufsichtsrates eingereicht worden."
    },
    {
      "date": "2025-01-07",
      "id": "98005",
      "original_text": "Löschungsankündigung\nNordrhein-Westfalen Amtsgericht Wuppertal HRB 24287\nMST Consulting UG (haftungsbeschränkt) – Erkrath",
      "type": "Löschungsankündigung",
      "state": "Nordrhein-Westfalen",
      "amtsgericht": "Amtsgericht Wuppertal",
      "registernummer": "HRB 24287",
      "registerart": "HRB",
      "company_name": "MST Consulting UG (haftungsbeschränkt)",
      "company_seat": "Erkrath",
      "details": "07.01.2025 (Bekanntmachungsdatum)\n\nNordrhein-Westfalen Amtsgericht Wuppertal HRB 24287\nLöschungsankündigung\n\nMST Consulting UG (haftungsbeschränkt)\nGesellschaft mit beschränkter Haftung\nErkrath\n\nDas Registergericht beabsichtigt die Gesellschaft von Amts wegen nach § 394 FamFG zu löschen. Die Frist zur Erhebung eines Widerspruchs ist auf einen Monat festgesetzt."
    },
    {
      "date": "2025-01-07",
      "id": "98006",
      "original_text": "Sonstige Registerbekanntmachung\nNordrhein-Westfalen Amtsgericht Düsseldorf HRB 67641\nHuf Electronics Düsseldorf GmbH – Düsseldorf",
      "type": "Sonstige Registerbekanntmachung",
      "state": "Nordrhein-Westfalen",
      "amtsgericht": "Amtsgericht Düsseldorf",
      "registernummer": "HRB 67641",
      "registerart": "HRB",
      "company_name": "Huf Electronics Düsseldorf GmbH",
      "company_seat": "Düsseldorf",
      "details": "07.01.2025 (Bekanntmachungsdatum)\n\nNordrhein-Westfalen Amtsgericht Düsseldorf HRB 67641\nSonstige Registerbekanntmachung 07.01.2025 (Eintragungsdatum)\n\nHuf Electronics Düsseldorf GmbH\nGesellschaft mit beschränkter Haftung\nDüsseldorf\n\nAls nicht eingetragen wird veröffentlicht: Den Gläubigern der Gesellschaft, deren Forderungen begründet worden sind bevor die Eintragung der Beendigung des Beherrschungs- und Gewinnabführungsvertrages  in das Handelsregister nach § 10 des Handelsgesetzbuches als bekanntgemacht gilt, hat der andere Vertragsteil Sicherheit zu leisten, wenn sie sich binnen sechs Monaten nach der Bekanntmachung der Eintragung zu diesem Zweck bei ihm melden."
    },
    {
      "date": "2025-01-07",
      "id": "98007",
      "original_text": "Sonstige Registerbekanntmachung\nHessen Amtsgericht Bad Hersfeld VR 1530\nBezirksverein der Kehlkopfoperierten Osthessen e. V. – Bebra",
      "type": "Sonstige Registerbekanntmachung",
      "state": "Hessen",
      "amtsgericht": "Amtsgericht Bad Hersfeld",
      "registernummer": "VR 1530",
      "registerart": "VR",
      "company_name": "Bezirksverein der Kehlkopfoperierten Osthessen e. V.",
      "company_seat": "Bebra",
      "details": "07.01.2025 (Bekanntmachungsdatum)\n\nHessen Amtsgericht Bad Hersfeld VR 1530\nSonstige Registerbekanntmachung 07.01.2025 (Eintragungsdatum)\n\nBezirksverein der Kehlkopfoperierten Osthessen e. V.\neingetragener Verein\nBebra\n\nDer Verein ist aufgelöst."
    },
    {
      "date": "2025-01-07",
      "id": "98008",
      "original_text": "Einreichung neuer Dokumente\nHessen Amtsgericht Bad Homburg v.d.H. HRB 9357\nBaloise Sachversicherung Aktiengesellschaft Deutschland – Bad Homburg v.d.Höhe",
      "type": "Einreichung neuer Dokumente",
      "state": "Hessen",
      "amtsgericht": "Amtsgericht Bad Homburg v.d.H.",
      "registernummer": "HRB 9357",
      "registerart": "HRB",
      "company_name": "Baloise Sachversicherung Aktiengesellschaft Deutschland",
      "company_seat": "Bad Homburg v.d.Höhe",
      "details": "07.01.2025 (Bekanntmachungsdatum)\n\nHessen Amtsgericht Bad Homburg v.d.H. HRB 9357\nEinreichung neuer Dokumente 07.01.2025 (Eintragungsdatum)\n\nBaloise Sachversicherung Aktiengesellschaft Deutschland\nAktiengesellschaft\nBad Homburg v.d.Höhe\n\nDurch eine Änderung in den Personen der Aufsichtsratsmitglieder ist eine Liste der Mitglieder des Aufsichtsrates zum Handelsregister eingereicht worden."
    },
    {
      "date": "2025-01-07",
      "id": "98009",
      "original_text": "Einreichung neuer Dokumente\nHessen Amtsgericht Darmstadt HRB 82007\ngewobau Gesellschaft für Wohnen und Bauen Rüsselsheim mbH – Rüsselsheim",
      "type": "Einreichung neuer Dokumente",
      "state": "Hessen",
      "amtsgericht": "Amtsgericht Darmstadt",
      "registernummer": "HRB 82007",
      "registerart": "HRB",
      "company_name": "gewobau Gesellschaft für Wohnen und Bauen Rüsselsheim mbH",
      "company_seat": "Rüsselsheim",
      "details": "07.01.2025 (Bekanntmachungsdatum)\n\nHessen Amtsgericht Darmstadt HRB 82007\nEinreichung neuer Dokumente 07.01.2025 (Eintragungsdatum)\n\ngewobau Gesellschaft für Wohnen und Bauen Rüsselsheim mbH\nGesellschaft mit beschränkter Haftung\nRüsselsheim\n\nDurch eine Änderung in den Personen der Aufsichtsratsmitglieder ist eine Liste der Mitglieder des Aufsichtsrates zum Handelsregister eingereicht worden."
    },
    {
      "date": "2025-01-07",
      "id": "98010",
      "original_text": "Registerbekanntmachung nach dem Umwandlungsgesetz\nHessen Amtsgericht Darmstadt HRB 107276\nZweiradshop Niederhofer GmbH – Babenhausen",
      "type": "Registerbekanntmachung nach dem Umwandlungsgesetz",
      "state": "Hessen",
      "amtsgericht": "Amtsgericht Darmstadt",
      "registernummer": "HRB 107276",
      "registerart": "HRB",
      "company_name": "Zweiradshop Niederhofer GmbH",
      "company_seat": "Babenhausen",
      "details": "07.01.2025 (Bekanntmachungsdatum)\n\nHessen Amtsgericht Darmstadt HRB 107276\nRegisterbekanntmachung nach dem Umwandlungsgesetz 07.01.2025 (Eintragungsdatum)\n\nZweiradshop Niederhofer GmbH\nGesellschaft mit beschränkter Haftung\nBabenhausen\n\nDen Gläubigern der Gesellschaft, deren Forderungen begründet worden sind, bevor die Eintragung der Beendigung des Vertrags in das Handelsregister nach § 10 HGB bekannt gemacht worden ist, ist vom anderen Vertragsteil Sicherheit zu leisten, wenn sie sich binnen sechs Monaten nach dieser Bekanntmachung zu diesem Zweck bei ihm melden.Den Gläubigern der an der Ausgliederung beteiligten Rechtsträger ist, wenn sie binnen sechs Monaten nach dem Tag, an dem die Eintragung der Ausgliederung in das Register des Sitzes desjenigen Rechtsträgers, dessen Gläubiger sie sind, nach §§ 125, 19 Absatz 3 UmwG bekannt gemacht worden ist, ihren Anspruch nach Grund und Höhe schriftlich anmelden, Sicherheit zu leisten, soweit sie nicht Befriedigung verlangen können. Dieses Recht steht den Gläubigern jedoch nur zu, wenn sie glaubhaft machen, dass durch die Ausgliederung die Erfüllung ihrer Forderung gefährdet wird."
    },
    {
      "date": "2025-01-07",
      "id": "98011",
      "original_text": "Sonstige Registerbekanntmachung\nHessen Amtsgericht Bad Hersfeld VR 1202\nKultur- und Tourismusverein Rotenburg an der Fulda e. V. – Rotenburg a. d. Fulda",
      "type": "Sonstige Registerbekanntmachung",
      "state": "Hessen",
      "amtsgericht": "Amtsgericht Bad Hersfeld",
      "registernummer": "VR 1202",
      "registerart": "VR",
      "company_name": "Kultur- und Tourismusverein Rotenburg an der Fulda e. V.",
      "company_seat": "Rotenburg a. d. Fulda",
      "details": "07.01.2025 (Bekanntmachungsdatum)\n\nHessen Amtsgericht Bad Hersfeld VR 1202\nSonstige Registerbekanntmachung 07.01.2025 (Eintragungsdatum)\n\nKultur- und Tourismusverein Rotenburg an der Fulda e. V.\neingetragener Verein\nRotenburg a. d. Fulda\n\nDer Verein ist aufgelöst."
    },
    {
      "date": "2025-01-07",
      "id": "98012",
      "original_text": "Sonstige Registerbekanntmachung\nHessen Amtsgericht Frankfurt am Main HRB 95390\nNattermann Verwaltungs GmbH – Frankfurt am Main",
      "type": "Sonstige Registerbekanntmachung",
      "state": "Hessen",
      "amtsgericht": "Amtsgericht Frankfurt am Main",
      "registernummer": "HRB 95390",
      "registerart": "HRB",
      "company_name": "Nattermann Verwaltungs GmbH",
      "company_seat": "Frankfurt am Main",
      "details": "07.01.2025 (Bekanntmachungsdatum)\n\nHessen Amtsgericht Frankfurt am Main HRB 95390\nSonstige Registerbekanntmachung 07.01.2025 (Eintragungsdatum)\n\nNattermann Verwaltungs GmbH\nGesellschaft mit beschränkter Haftung\nFrankfurt am Main\n\nDen Gläubigern der Gesellschaft, deren Forderungen begründet worden sind, bevor die Eintragung der Beendigung des Vertrags in das Handelsregister nach § 10 HGB bekannt gemacht worden ist, ist vom anderen Vertragsteil Sicherheit zu leisten, wenn sie sich binnen sechs Monaten nach dieser Bekanntmachung zu diesem Zweck bei ihm melden."
    },
    {
      "date": "2025-01-07",
      "id": "98013",
      "original_text": "Löschungsankündigung\nHessen Amtsgericht Friedberg HRB 9902\nMLC Medien Logistik & Consulting GmbH – Bad Nauheim",
      "type": "Löschungsankündigung",
      "state": "Hessen",
      "amtsgericht": "Amtsgericht Friedberg",
      "registernummer": "HRB 9902",
      "registerart": "HRB",
      "company_name": "MLC Medien Logistik & Consulting GmbH",
      "company_seat": "Bad Nauheim",
      "details": "07.01.2025 (Bekanntmachungsdatum)\n\nHessen Amtsgericht Friedberg HRB 9902\nLöschungsankündigung\n\nMLC Medien Logistik & Consulting GmbH\nGesellschaft mit beschränkter Haftung\nBad Nauheim\n\nDas Registergericht beabsichtigt die im Handelsregister eingetragene Gesellschaft von Amts wegen nach § 394 FamFG zu löschen. Die Frist zur Erhebung eines Widerspruchs gegen die beabsichtigte Löschung wird auf 3 Monate festgesetzt."
    },
    {
      "date": "2025-01-07",
      "id": "98014",
      "original_text": "Registerbekanntmachung nach dem Umwandlungsgesetz\nHessen Amtsgericht Frankfurt am Main HRB 115044\nISS STOXX GmbH – Eschborn",
      "type": "Registerbekanntmachung nach dem Umwandlungsgesetz",
      "state": "Hessen",
      "amtsgericht": "Amtsgericht Frankfurt am Main",
      "registernummer": "HRB 115044",
      "registerart": "HRB",
      "company_name": "ISS STOXX GmbH",
      "company_seat": "Eschborn",
      "details": "07.01.2025 (Bekanntmachungsdatum)\n\nHessen Amtsgericht Frankfurt am Main HRB 115044\nRegisterbekanntmachung nach dem Umwandlungsgesetz\n\nISS STOXX GmbH\nGesellschaft mit beschränkter Haftung\nEschborn\n\nEs wird darauf hingewiesen, dass ein Formwechselplan oder sein Entwurf über einen grenzüberschreitenden Formwechsel in die ISS STOXX B.V. (besloten vennootschap met beperkte aansprake- Iijkheid, B.V., nach niederländischem Recht) mit Sitz in Amsterdam/Niederlande beim Handelsregister eingereicht worden ist.\n\nDie Anteilsinhaber, die Gläubiger sowie die zuständigen Betriebsräte der an dem grenzüberschreitenden Formwechsel beteiligten Gesellschaft oder, soweit es keinen Betriebsrat gibt, die Arbeitnehmer der an dem grenzüberschreitenden Formwechsel beteiligten Gesellschaft, können der Gesellschaft spätestens fünf Arbeitstage vor dem Tag der Gesellschafterversammlung Bemerkungen zum Formwechselplan übermitteln.\n\n1. Rechtsform, Firma und Sitz (§§ 336, 308 Abs. 1 Satz 2 Nr.2 UmwG)\nDie formwechselnde Gesellschaft ist eine Gesellschaft mit beschränkter Haftung nach deutschem Recht unter der Firma ISS STOXX GmbH mit Satzungssitz in Eschborn, Bundesrepublik Deutschland. Die ISS STOXX GmbH wird ab dem Wirksamwerden des grenzüberschreitenden Formwechsels als Gesellschaft mit beschränkter Haftung (besloten vennootschap met beperkte aansprakelijkheid, B.V.) niederländischen Rechts unter der Firma ISS STOXX B.V. und mit Satzungssitz in Amsterdam, Niederlande, fortbestehen.\n2. Register und Registernummer (§§ 336, 308 Abs. I Satz 2 Nr. 3 UmwG) Die ISS STOXX GMbH ist eingetragen im Handelsregister des Amtsgerichts Frankfurt am Main, Bundesrepublik Deutschland, unter HRB 115044.\n3. Hinweis bezüglich der Übermittlung von Bemerkungen zum Formwechselplan (§§ 336, 308 Abs. I Satz 2 Nr. 4 UmwG)\nDie Gesellschafterversammlung der ISS STOXX GmbH, in der über die Zustimmung zum Formwechselplan beschlossen werden soll, soll am 20. Februar 2025 stattfinden. Die Gesellschafter und Gläubiger der ISS STOXX GmbH sowie - da die ISS STOXX GmbH keinen Betriebsrat hat - die Arbeitnehmer der ISS STOXX GmbH können der ISS STOXX GmbH spätestens fünf Arbeitstage vor dem Tag der vorgenannten Gesellschafterversammlung Bemerkungen zum Formwechselplan unter der folgenden Anschrift übermitteln: ISS STOXX GmbH, Geschäftsführung, Mergenthalerallee 73-75, 65760 Eschborn, Bundesrepublik Deutschland."
    },
    {
      "date": "2025-01-07",
      "id": "98015",
      "original_text": "Registerbekanntmachung nach dem Umwandlungsgesetz\nHessen Amtsgericht Darmstadt HRA 83751\nZweiradshop Niederhofer, Inhaber Klaus Schmitt e.K. – Babenhausen (Hessen)",
      "type": "Registerbekanntmachung nach dem Umwandlungsgesetz",
      "state": "Hessen",
      "amtsgericht": "Amtsgericht Darmstadt",
      "registernummer": "HRA 83751",
      "registerart": "HRA",
      "company_name": "Zweiradshop Niederhofer, Inhaber Klaus Schmitt e.K.",
      "company_seat": "Babenhausen (Hessen)",
      "details": "07.01.2025 (Bekanntmachungsdatum)\n\nHessen Amtsgericht Darmstadt HRA 83751\nRegisterbekanntmachung nach dem Umwandlungsgesetz 07.01.2025 (Eintragungsdatum)\n\nZweiradshop Niederhofer, Inhaber Klaus Schmitt e.K.\nEinzelkaufmann / Einzelkauffrau\nBabenhausen (Hessen)\n\nDen Gläubigern der an der Ausgliederung beteiligten Rechtsträger ist, wenn sie binnen sechs Monaten nach dem Tag, an dem die Eintragung der Ausgliederung in das Register des Sitzes desjenigen Rechtsträgers, dessen Gläubiger sie sind, nach §§ 125, 19 Absatz 3 UmwG bekannt gemacht worden ist, ihren Anspruch nach Grund und Höhe schriftlich anmelden, Sicherheit zu leisten, soweit sie nicht Befriedigung verlangen können. Dieses Recht steht den Gläubigern jedoch nur zu, wenn sie glaubhaft machen, dass durch die Ausgliederung die Erfüllung ihrer Forderung gefährdet wird."
    },
    {
      "date": "2025-01-07",
      "id": "98016",
      "original_text": "Registerbekanntmachung nach dem Umwandlungsgesetz\nHessen Amtsgericht Frankfurt am Main HRB 126784\nAßlarer Gärten Immobilienprojektgesellschaft mbH – Frankfurt am Main",
      "type": "Registerbekanntmachung nach dem Umwandlungsgesetz",
      "state": "Hessen",
      "amtsgericht": "Amtsgericht Frankfurt am Main",
      "registernummer": "HRB 126784",
      "registerart": "HRB",
      "company_name": "Aßlarer Gärten Immobilienprojektgesellschaft mbH",
      "company_seat": "Frankfurt am Main",
      "details": "07.01.2025 (Bekanntmachungsdatum)\n\nHessen Amtsgericht Frankfurt am Main HRB 126784\nRegisterbekanntmachung nach dem Umwandlungsgesetz 07.01.2025 (Eintragungsdatum)\n\nAßlarer Gärten Immobilienprojektgesellschaft mbH\nGesellschaft mit beschränkter Haftung\nFrankfurt am Main\n\nDen Gläubigern der an der Verschmelzung beteiligten Rechtsträger ist, wenn sie binnen sechs Monaten nach dem Tag, an dem die Eintragung der Verschmelzung in das Register des Sitzes desjenigen Rechtsträgers, dessen Gläubiger sie sind, nach § 19 Absatz 3 UmwG bekannt gemacht worden ist, ihren Anspruch nach Grund und Höhe schriftlich anmelden, Sicherheit zu leisten, soweit sie nicht Befriedigung verlangen können. Dieses Recht steht den Gläubigern jedoch nur zu, wenn sie glaubhaft machen, dass durch die Verschmelzung die Erfüllung ihrer Forderung gefährdet wird."
    }
  ]
}