{
  "date": "2025-01-09",
  "date_of_scrape": "2025-01-12T08:47:17.838Z",
  "tool_version": "0.2.0",
  "number_of_announcements": 123,
  "announcements": [
    {
      "date": "2025-01-09",
      "id": "98129",
      "original_text": "Sonstige Registerbekanntmachung\nBayern Amtsgericht München HRB 266044\nSchlickenrieder BA II GmbH – Valley-Mitterdarching",
      "type": "Sonstige Registerbekanntmachung",
      "state": "Bayern",
      "amtsgericht": "Amtsgericht München",
      "registernummer": "HRB 266044",
      "registerart": "HRB",
      "company_name": "Schlickenrieder BA II GmbH",
      "company_seat": "Valley-Mitterdarching",
      "details": "09.01.2025 (Bekanntmachungsdatum)\n\nBayern Amtsgericht München HRB 266044\nSonstige Registerbekanntmachung 08.01.2025 (Eintragungsdatum)\n\nSchlickenrieder BA II GmbH\nGesellschaft mit beschränkter Haftung\nValley-Mitterdarching\n\nDen Gläubigern der Gesellschaft, deren Forderungen begründet worden sind, bevor die Eintragung der Beendigung des Beherrschungs- und Gewinnabführungsvertrages in das Handelsregister nach § 10 des Handelsgesetzbuches als bekanntgemacht gilt, hat der andere Vertragsteil Sicherheit zu leisten, wenn sie sich binnen sechs Monaten nach der Bekanntmachung der Eintragung zu diesem Zweck bei ihm melden."
    },
    {
      "date": "2025-01-09",
      "id": "98130",
      "original_text": "Registerbekanntmachung nach dem Umwandlungsgesetz\nBayern Amtsgericht Nürnberg HRB 8779\nB + A Luft- und Seefrachtspedition GmbH – Nürnberg",
      "type": "Registerbekanntmachung nach dem Umwandlungsgesetz",
      "state": "Bayern",
      "amtsgericht": "Amtsgericht Nürnberg",
      "registernummer": "HRB 8779",
      "registerart": "HRB",
      "company_name": "B + A Luft- und Seefrachtspedition GmbH",
      "company_seat": "Nürnberg",
      "details": "09.01.2025 (Bekanntmachungsdatum)\n\nBayern Amtsgericht Nürnberg HRB 8779\nRegisterbekanntmachung nach dem Umwandlungsgesetz 08.01.2025 (Eintragungsdatum)\n\nB + A Luft- und Seefrachtspedition GmbH\nGesellschaft mit beschränkter Haftung\nNürnberg\n\nDen Gläubigern der an der Verschmelzung beteiligten Rechtsträger ist, wenn sie binnen sechs Monaten nach dem Tag, an dem die Eintragung der Verschmelzung in das Register des Sitzes desjenigen Rechtsträgers, dessen Gläubiger sie sind, nach § 19 Abs. 3 UmwG als bekannt gemacht gilt, ihren Anspruch nach Grund und Höhe in Textform anmelden, Sicherheit zu leisten, soweit sie nicht Befriedigung verlangen können. Dieses Recht steht den Gläubigern jedoch nur zu, wenn sie glaubhaft machen, dass durch die Verschmelzung die Erfüllung ihrer Forderung gefährdet wird."
    },
    {
      "date": "2025-01-09",
      "id": "98131",
      "original_text": "Registerbekanntmachung nach dem Umwandlungsgesetz\nBayern Amtsgericht München HRB 234710\nICO - International Certification Organization AG – München",
      "type": "Registerbekanntmachung nach dem Umwandlungsgesetz",
      "state": "Bayern",
      "amtsgericht": "Amtsgericht München",
      "registernummer": "HRB 234710",
      "registerart": "HRB",
      "company_name": "ICO - International Certification Organization AG",
      "company_seat": "München",
      "details": "09.01.2025 (Bekanntmachungsdatum)\n\nBayern Amtsgericht München HRB 234710\nRegisterbekanntmachung nach dem Umwandlungsgesetz 08.01.2025 (Eintragungsdatum)\n\nICO - International Certification Organization AG\nAktiengesellschaft\nMünchen\n\nDen Gläubigern des formwechselnden Rechtsträgers ist, wenn sie binnen sechs Monaten nach dem Tag, an dem die Eintragung des Formwechsels nach § 201 UmwG als bekannt gemacht gilt, ihren Anspruch nach Grund und Höhe in Textform anmelden, Sicherheit zu leisten, soweit sie nicht Befriedigung verlangen können. Dieses Recht steht den Gläubigern jedoch nur zu, wenn sie glaubhaft machen, dass durch den Formwechsel die Erfüllung ihrer Forderung gefährdet wird."
    },
    {
      "date": "2025-01-09",
      "id": "98132",
      "original_text": "Löschungsankündigung\nBayern Amtsgericht Kempten (Allgäu) HRB 11288\nWindenergie Oberland GmbH – Obergünzburg",
      "type": "Löschungsankündigung",
      "state": "Bayern",
      "amtsgericht": "Amtsgericht Kempten (Allgäu)",
      "registernummer": "HRB 11288",
      "registerart": "HRB",
      "company_name": "Windenergie Oberland GmbH",
      "company_seat": "Obergünzburg",
      "details": "09.01.2025 (Bekanntmachungsdatum)\n\nBayern Amtsgericht Kempten (Allgäu) HRB 11288\nLöschungsankündigung\n\nWindenergie Oberland GmbH\nGesellschaft mit beschränkter Haftung\nObergünzburg\n\nDas Registergericht beabsichtigt, die im Handelsregister eingetragene Gesellschaft wegen Vermögenslosigkeit von Amts wegen nach § 394 FamFG zu löschen. Die Frist zur Erhebung eines Widerspruchs ist auf einen Monat festgesetzt."
    },
    {
      "date": "2025-01-09",
      "id": "98133",
      "original_text": "Einreichung neuer Dokumente\nBayern Amtsgericht Ingolstadt HRB 3578\nPädagogisches Zentrum Förderkreis + Haus Miteinander gemeinnützige GmbH – Ingolstadt",
      "type": "Einreichung neuer Dokumente",
      "state": "Bayern",
      "amtsgericht": "Amtsgericht Ingolstadt",
      "registernummer": "HRB 3578",
      "registerart": "HRB",
      "company_name": "Pädagogisches Zentrum Förderkreis + Haus Miteinander gemeinnützige GmbH",
      "company_seat": "Ingolstadt",
      "details": "09.01.2025 (Bekanntmachungsdatum)\n\nBayern Amtsgericht Ingolstadt HRB 3578\nEinreichung neuer Dokumente\n\nPädagogisches Zentrum Förderkreis + Haus Miteinander gemeinnützige GmbH\nGesellschaft mit beschränkter Haftung\nIngolstadt\n\nDem Amtsgericht Ingolstadt -Registergericht- ist eine Liste der Mitglieder des Aufsichtsrats eingereicht worden, § 52 Abs. 3 S. 2 GmbHG."
    },
    {
      "date": "2025-01-09",
      "id": "98134",
      "original_text": "Registerbekanntmachung nach dem Umwandlungsgesetz\nBayern Amtsgericht München HRB 246833\nEncavis Asset Management AG – Neubiberg",
      "type": "Registerbekanntmachung nach dem Umwandlungsgesetz",
      "state": "Bayern",
      "amtsgericht": "Amtsgericht München",
      "registernummer": "HRB 246833",
      "registerart": "HRB",
      "company_name": "Encavis Asset Management AG",
      "company_seat": "Neubiberg",
      "details": "09.01.2025 (Bekanntmachungsdatum)\n\nBayern Amtsgericht München HRB 246833\nRegisterbekanntmachung nach dem Umwandlungsgesetz 08.01.2025 (Eintragungsdatum)\n\nEncavis Asset Management AG\nAktiengesellschaft\nNeubiberg\n\nDen Gläubigern der an der Verschmelzung beteiligten Rechtsträger ist, wenn sie binnen sechs Monaten nach dem Tag, an dem die Eintragung der Verschmelzung in das Register des Sitzes desjenigen Rechtsträgers, dessen Gläubiger sie sind, nach § 19 Abs. 3 UmwG als bekannt gemacht gilt, ihren Anspruch nach Grund und Höhe in Textform anmelden, Sicherheit zu leisten, soweit sie nicht Befriedigung verlangen können. Dieses Recht steht den Gläubigern jedoch nur zu, wenn sie glaubhaft machen, dass durch die Verschmelzung die Erfüllung ihrer Forderung gefährdet wird."
    },
    {
      "date": "2025-01-09",
      "id": "98135",
      "original_text": "Einreichung neuer Dokumente\nBayern Amtsgericht Coburg HRB 5382\nKAESER KOMPRESSOREN SE – Coburg",
      "type": "Einreichung neuer Dokumente",
      "state": "Bayern",
      "amtsgericht": "Amtsgericht Coburg",
      "registernummer": "HRB 5382",
      "registerart": "HRB",
      "company_name": "KAESER KOMPRESSOREN SE",
      "company_seat": "Coburg",
      "details": "09.01.2025 (Bekanntmachungsdatum)\n\nBayern Amtsgericht Coburg HRB 5382\nEinreichung neuer Dokumente 08.01.2025 (Eintragungsdatum)\n\nKAESER KOMPRESSOREN SE\nEuropäische Aktiengesellschaft (SE)\nCoburg\n\nDem Amtsgericht Coburg -Registergericht- ist eine Liste der Mitglieder des Aufsichtsrats eingereicht worden, Art. 9 Abs. 1 Buchst. c (ii) SE-VO i.V.m. § 106 AktG."
    },
    {
      "date": "2025-01-09",
      "id": "98136",
      "original_text": "Registerbekanntmachung nach dem Umwandlungsgesetz\nBayern Amtsgericht Fürth HRB 7805\nErhard Achtelstetter GmbH – Dietersheim",
      "type": "Registerbekanntmachung nach dem Umwandlungsgesetz",
      "state": "Bayern",
      "amtsgericht": "Amtsgericht Fürth",
      "registernummer": "HRB 7805",
      "registerart": "HRB",
      "company_name": "Erhard Achtelstetter GmbH",
      "company_seat": "Dietersheim",
      "details": "09.01.2025 (Bekanntmachungsdatum)\n\nBayern Amtsgericht Fürth HRB 7805\nRegisterbekanntmachung nach dem Umwandlungsgesetz 08.01.2025 (Eintragungsdatum)\n\nErhard Achtelstetter GmbH\nGesellschaft mit beschränkter Haftung\nDietersheim\n\nDen Gläubigern der an der Verschmelzung beteiligten Rechtsträger ist, wenn sie binnen sechs Monaten nach dem Tag, an dem die Eintragung der Verschmelzung in das Register des Sitzes desjenigen Rechtsträgers, dessen Gläubiger sie sind, nach § 19 Abs. 3 UmwG als bekannt gemacht gilt, ihren Anspruch nach Grund und Höhe in Textform anmelden, Sicherheit zu leisten, soweit sie nicht Befriedigung verlangen können. Dieses Recht steht den Gläubigern jedoch nur zu, wenn sie glaubhaft machen, dass durch die Verschmelzung die Erfüllung ihrer Forderung gefährdet wird."
    },
    {
      "date": "2025-01-09",
      "id": "98137",
      "original_text": "Registerbekanntmachung nach dem Umwandlungsgesetz\nBayern Amtsgericht München HRB 246833\nEncavis Asset Management AG – Neubiberg",
      "type": "Registerbekanntmachung nach dem Umwandlungsgesetz",
      "state": "Bayern",
      "amtsgericht": "Amtsgericht München",
      "registernummer": "HRB 246833",
      "registerart": "HRB",
      "company_name": "Encavis Asset Management AG",
      "company_seat": "Neubiberg",
      "details": "09.01.2025 (Bekanntmachungsdatum)\n\nBayern Amtsgericht München HRB 246833\nRegisterbekanntmachung nach dem Umwandlungsgesetz 08.01.2025 (Eintragungsdatum)\n\nEncavis Asset Management AG\nAktiengesellschaft\nNeubiberg\n\nDen Gläubigern der an der Verschmelzung beteiligten Rechtsträger ist, wenn sie binnen sechs Monaten nach dem Tag, an dem die Eintragung der Verschmelzung in das Register des Sitzes desjenigen Rechtsträgers, dessen Gläubiger sie sind, nach § 19 Abs. 3 UmwG als bekannt gemacht gilt, ihren Anspruch nach Grund und Höhe in Textform anmelden, Sicherheit zu leisten, soweit sie nicht Befriedigung verlangen können. Dieses Recht steht den Gläubigern jedoch nur zu, wenn sie glaubhaft machen, dass durch die Verschmelzung die Erfüllung ihrer Forderung gefährdet wird."
    },
    {
      "date": "2025-01-09",
      "id": "98138",
      "original_text": "Registerbekanntmachung nach dem Umwandlungsgesetz\nBayern Amtsgericht Regensburg HRB 18790\nVidaCura GmbH – Regensburg",
      "type": "Registerbekanntmachung nach dem Umwandlungsgesetz",
      "state": "Bayern",
      "amtsgericht": "Amtsgericht Regensburg",
      "registernummer": "HRB 18790",
      "registerart": "HRB",
      "company_name": "VidaCura GmbH",
      "company_seat": "Regensburg",
      "details": "09.01.2025 (Bekanntmachungsdatum)\n\nBayern Amtsgericht Regensburg HRB 18790\nRegisterbekanntmachung nach dem Umwandlungsgesetz 08.01.2025 (Eintragungsdatum)\n\nVidaCura GmbH\nGesellschaft mit beschränkter Haftung\nRegensburg\n\nDen Gläubigern der an der Verschmelzung beteiligten Rechtsträger ist, wenn sie binnen sechs Monaten nach dem Tag, an dem die Eintragung der Verschmelzung in das Register des Sitzes desjenigen Rechtsträgers, dessen Gläubiger sie sind, nach § 19 Abs. 3 UmwG als bekannt gemacht gilt, ihren Anspruch nach Grund und Höhe in Textform anmelden, Sicherheit zu leisten, soweit sie nicht Befriedigung verlangen können. Dieses Recht steht den Gläubigern jedoch nur zu, wenn sie glaubhaft machen, dass durch die Verschmelzung die Erfüllung ihrer Forderung gefährdet wird."
    },
    {
      "date": "2025-01-09",
      "id": "98139",
      "original_text": "Löschungsankündigung\nBayern Amtsgericht Nürnberg HRB 31354\nWomano UG (haftungsbeschränkt) – Nürnberg",
      "type": "Löschungsankündigung",
      "state": "Bayern",
      "amtsgericht": "Amtsgericht Nürnberg",
      "registernummer": "HRB 31354",
      "registerart": "HRB",
      "company_name": "Womano UG (haftungsbeschränkt)",
      "company_seat": "Nürnberg",
      "details": "09.01.2025 (Bekanntmachungsdatum)\n\nBayern Amtsgericht Nürnberg HRB 31354\nLöschungsankündigung\n\nWomano UG (haftungsbeschränkt)\nGesellschaft mit beschränkter Haftung\nNürnberg\n\nDas Registergericht beabsichtigt, die im Handelsregister eingetragene Gesellschaft wegen Vermögenslosigkeit von Amts wegen nach § 394 FamFG zu löschen. Die Frist zur Erhebung eines Widerspruchs ist auf einen Monat festgesetzt."
    },
    {
      "date": "2025-01-09",
      "id": "98140",
      "original_text": "Registerbekanntmachung nach dem Umwandlungsgesetz\nBayern Amtsgericht München HRB 263360\nSUSTAINVEST Partners GmbH – Unterhaching",
      "type": "Registerbekanntmachung nach dem Umwandlungsgesetz",
      "state": "Bayern",
      "amtsgericht": "Amtsgericht München",
      "registernummer": "HRB 263360",
      "registerart": "HRB",
      "company_name": "SUSTAINVEST Partners GmbH",
      "company_seat": "Unterhaching",
      "details": "09.01.2025 (Bekanntmachungsdatum)\n\nBayern Amtsgericht München HRB 263360\nRegisterbekanntmachung nach dem Umwandlungsgesetz 08.01.2025 (Eintragungsdatum)\n\nSUSTAINVEST Partners GmbH\nGesellschaft mit beschränkter Haftung\nUnterhaching\n\nDen Gläubigern der an der Verschmelzung beteiligten Rechtsträger ist, wenn sie binnen sechs Monaten nach dem Tag, an dem die Eintragung der Verschmelzung in das Register des Sitzes desjenigen Rechtsträgers, dessen Gläubiger sie sind, nach § 19 Abs. 3 UmwG als bekannt gemacht gilt, ihren Anspruch nach Grund und Höhe in Textform anmelden, Sicherheit zu leisten, soweit sie nicht Befriedigung verlangen können. Dieses Recht steht den Gläubigern jedoch nur zu, wenn sie glaubhaft machen, dass durch die Verschmelzung die Erfüllung ihrer Forderung gefährdet wird."
    },
    {
      "date": "2025-01-09",
      "id": "98141",
      "original_text": "Sonstige Registerbekanntmachung\nBayern Amtsgericht Kempten (Allgäu) HRB 10739\nSWW - Beteiligungs- und Verwaltungs GmbH – Sonthofen",
      "type": "Sonstige Registerbekanntmachung",
      "state": "Bayern",
      "amtsgericht": "Amtsgericht Kempten (Allgäu)",
      "registernummer": "HRB 10739",
      "registerart": "HRB",
      "company_name": "SWW - Beteiligungs- und Verwaltungs GmbH",
      "company_seat": "Sonthofen",
      "details": "09.01.2025 (Bekanntmachungsdatum)\n\nBayern Amtsgericht Kempten (Allgäu) HRB 10739\nSonstige Registerbekanntmachung 08.01.2025 (Eintragungsdatum)\n\nSWW - Beteiligungs- und Verwaltungs GmbH\nGesellschaft mit beschränkter Haftung\nSonthofen\n\nDem Amtsgericht Kempten (Allgäu) -Registergericht- ist eine Liste der Mitglieder des Aufsichtsrats eingereicht worden, § 52 Abs. 3 S. 2 GmbHG."
    },
    {
      "date": "2025-01-09",
      "id": "98142",
      "original_text": "Einreichung neuer Dokumente\nBayern Amtsgericht Traunstein HRB 19241\nBALIQA INVEST AG – Prien a. Chiemsee",
      "type": "Einreichung neuer Dokumente",
      "state": "Bayern",
      "amtsgericht": "Amtsgericht Traunstein",
      "registernummer": "HRB 19241",
      "registerart": "HRB",
      "company_name": "BALIQA INVEST AG",
      "company_seat": "Prien a. Chiemsee",
      "details": "09.01.2025 (Bekanntmachungsdatum)\n\nBayern Amtsgericht Traunstein HRB 19241\nEinreichung neuer Dokumente\n\nBALIQA INVEST AG\nAktiengesellschaft\nPrien a. Chiemsee\n\nDem Amtsgericht Traunstein -Registergericht- ist eine Liste der Mitglieder des Aufsichtsrats eingereicht worden, § 106 AktG."
    },
    {
      "date": "2025-01-09",
      "id": "98143",
      "original_text": "Einreichung neuer Dokumente\nBayern Amtsgericht München HRB 131083\nBPMI Business Partner Munich International AG – Neubiberg",
      "type": "Einreichung neuer Dokumente",
      "state": "Bayern",
      "amtsgericht": "Amtsgericht München",
      "registernummer": "HRB 131083",
      "registerart": "HRB",
      "company_name": "BPMI Business Partner Munich International AG",
      "company_seat": "Neubiberg",
      "details": "09.01.2025 (Bekanntmachungsdatum)\n\nBayern Amtsgericht München HRB 131083\nEinreichung neuer Dokumente\n\nBPMI Business Partner Munich International AG\nAktiengesellschaft\nNeubiberg\n\nDem Amtsgericht München -Registergericht- ist eine Liste der Mitglieder des Aufsichtsrats eingereicht worden, § 106 AktG."
    },
    {
      "date": "2025-01-09",
      "id": "98144",
      "original_text": "Registerbekanntmachung nach dem Umwandlungsgesetz\nBayern Amtsgericht Fürth HRB 15893\nZimmerei Achtelstetter GmbH – Dietersheim, Ortsteil Altheim",
      "type": "Registerbekanntmachung nach dem Umwandlungsgesetz",
      "state": "Bayern",
      "amtsgericht": "Amtsgericht Fürth",
      "registernummer": "HRB 15893",
      "registerart": "HRB",
      "company_name": "Zimmerei Achtelstetter GmbH",
      "company_seat": "Dietersheim, Ortsteil Altheim",
      "details": "09.01.2025 (Bekanntmachungsdatum)\n\nBayern Amtsgericht Fürth HRB 15893\nRegisterbekanntmachung nach dem Umwandlungsgesetz 08.01.2025 (Eintragungsdatum)\n\nZimmerei Achtelstetter GmbH\nGesellschaft mit beschränkter Haftung\nDietersheim, Ortsteil Altheim\n\nDen Gläubigern der an der Verschmelzung beteiligten Rechtsträger ist, wenn sie binnen sechs Monaten nach dem Tag, an dem die Eintragung der Verschmelzung in das Register des Sitzes desjenigen Rechtsträgers, dessen Gläubiger sie sind, nach § 19 Abs. 3 UmwG als bekannt gemacht gilt, ihren Anspruch nach Grund und Höhe in Textform anmelden, Sicherheit zu leisten, soweit sie nicht Befriedigung verlangen können. Dieses Recht steht den Gläubigern jedoch nur zu, wenn sie glaubhaft machen, dass durch die Verschmelzung die Erfüllung ihrer Forderung gefährdet wird."
    },
    {
      "date": "2025-01-09",
      "id": "98145",
      "original_text": "Registerbekanntmachung nach dem Umwandlungsgesetz\nBayern Amtsgericht Fürth HRB 17393\nAchtelstetter & Löblein Maschinen- und Gerüstverleih GmbH – Dietersheim",
      "type": "Registerbekanntmachung nach dem Umwandlungsgesetz",
      "state": "Bayern",
      "amtsgericht": "Amtsgericht Fürth",
      "registernummer": "HRB 17393",
      "registerart": "HRB",
      "company_name": "Achtelstetter & Löblein Maschinen- und Gerüstverleih GmbH",
      "company_seat": "Dietersheim",
      "details": "09.01.2025 (Bekanntmachungsdatum)\n\nBayern Amtsgericht Fürth HRB 17393\nRegisterbekanntmachung nach dem Umwandlungsgesetz 08.01.2025 (Eintragungsdatum)\n\nAchtelstetter & Löblein Maschinen- und Gerüstverleih GmbH\nGesellschaft mit beschränkter Haftung\nDietersheim\n\nDen Gläubigern der an der Verschmelzung beteiligten Rechtsträger ist, wenn sie binnen sechs Monaten nach dem Tag, an dem die Eintragung der Verschmelzung in das Register des Sitzes desjenigen Rechtsträgers, dessen Gläubiger sie sind, nach § 19 Abs. 3 UmwG als bekannt gemacht gilt, ihren Anspruch nach Grund und Höhe in Textform anmelden, Sicherheit zu leisten, soweit sie nicht Befriedigung verlangen können. Dieses Recht steht den Gläubigern jedoch nur zu, wenn sie glaubhaft machen, dass durch die Verschmelzung die Erfüllung ihrer Forderung gefährdet wird."
    },
    {
      "date": "2025-01-09",
      "id": "98146",
      "original_text": "Registerbekanntmachung nach dem Umwandlungsgesetz\nBayern Amtsgericht Aschaffenburg HRB 17151\nGlobal IDEAS Consultants UG (haftungsbeschränkt) – Obernburg a. Main",
      "type": "Registerbekanntmachung nach dem Umwandlungsgesetz",
      "state": "Bayern",
      "amtsgericht": "Amtsgericht Aschaffenburg",
      "registernummer": "HRB 17151",
      "registerart": "HRB",
      "company_name": "Global IDEAS Consultants UG (haftungsbeschränkt)",
      "company_seat": "Obernburg a. Main",
      "details": "09.01.2025 (Bekanntmachungsdatum)\n\nBayern Amtsgericht Aschaffenburg HRB 17151\nRegisterbekanntmachung nach dem Umwandlungsgesetz 08.01.2025 (Eintragungsdatum)\n\nGlobal IDEAS Consultants UG (haftungsbeschränkt)\nGesellschaft mit beschränkter Haftung\nObernburg a. Main\n\nDen Gläubigern der an der Verschmelzung beteiligten Rechtsträger ist, wenn sie binnen sechs Monaten nach dem Tag, an dem die Eintragung der Verschmelzung in das Register des Sitzes desjenigen Rechtsträgers, dessen Gläubiger sie sind, nach § 19 Abs. 3 UmwG als bekannt gemacht gilt, ihren Anspruch nach Grund und Höhe in Textform anmelden, Sicherheit zu leisten, soweit sie nicht Befriedigung verlangen können. Dieses Recht steht den Gläubigern jedoch nur zu, wenn sie glaubhaft machen, dass durch die Verschmelzung die Erfüllung ihrer Forderung gefährdet wird."
    },
    {
      "date": "2025-01-09",
      "id": "98147",
      "original_text": "Einreichung neuer Dokumente\nSaarland Amtsgericht Saarbrücken HRB 13549\nKnappschaft Kliniken Saar Service GmbH – Püttlingen",
      "type": "Einreichung neuer Dokumente",
      "state": "Saarland",
      "amtsgericht": "Amtsgericht Saarbrücken",
      "registernummer": "HRB 13549",
      "registerart": "HRB",
      "company_name": "Knappschaft Kliniken Saar Service GmbH",
      "company_seat": "Püttlingen",
      "details": "09.01.2025 (Bekanntmachungsdatum)\n\nSaarland Amtsgericht Saarbrücken HRB 13549\nEinreichung neuer Dokumente\n\nKnappschaft Kliniken Saar Service GmbH\nGesellschaft mit beschränkter Haftung\nPüttlingen\n\nDie Geschäftsführung der Gesellschaft hat eine Liste der Mitglieder des Aufsichtsrats zum Handelsregister eingereicht (§ 52 Abs. 3 Satz 2 GmbHG)."
    },
    {
      "date": "2025-01-09",
      "id": "98148",
      "original_text": "Registerbekanntmachung nach dem Umwandlungsgesetz\nBaden-Württemberg Amtsgericht Mannheim HRB 709299\nstadtkinder GmbH – Mannheim",
      "type": "Registerbekanntmachung nach dem Umwandlungsgesetz",
      "state": "Baden-Württemberg",
      "amtsgericht": "Amtsgericht Mannheim",
      "registernummer": "HRB 709299",
      "registerart": "HRB",
      "company_name": "stadtkinder GmbH",
      "company_seat": "Mannheim",
      "details": "09.01.2025 (Bekanntmachungsdatum)\n\nBaden-Württemberg Amtsgericht Mannheim HRB 709299\nRegisterbekanntmachung nach dem Umwandlungsgesetz 09.01.2025 (Eintragungsdatum)\n\nstadtkinder GmbH\nGesellschaft mit beschränkter Haftung\nMannheim\n\nDen Gläubigern der an der Ausgliederung beteiligten Rechtsträger ist, wenn sie binnen sechs Monaten nach dem Tag, an dem die Eintragung der Ausgliederung in das Register des Sitzes desjenigen Rechtsträgers, dessen Gläubiger sie sind, nach § 19 Abs. 3 UmwG als bekanntgemacht gilt, ihren Anspruch nach Grund und Höhe schriftlich anmelden, Sicherheit zu leisten, soweit sie nicht Befriedigung verlangen können. Dieses Recht steht den Gläubigern jedoch nur zu, wenn sie glaubhaft machen, dass durch die Ausgliederung die Erfüllung ihrer Forderung gefährdet wird."
    },
    {
      "date": "2025-01-09",
      "id": "98149",
      "original_text": "Registerbekanntmachung nach dem Umwandlungsgesetz\nBaden-Württemberg Amtsgericht Mannheim HRA 712132\nAdlermedien Mediengestaltung, e.K. – Schwetzingen",
      "type": "Registerbekanntmachung nach dem Umwandlungsgesetz",
      "state": "Baden-Württemberg",
      "amtsgericht": "Amtsgericht Mannheim",
      "registernummer": "HRA 712132",
      "registerart": "HRA",
      "company_name": "Adlermedien Mediengestaltung, e.K.",
      "company_seat": "Schwetzingen",
      "details": "09.01.2025 (Bekanntmachungsdatum)\n\nBaden-Württemberg Amtsgericht Mannheim HRA 712132\nRegisterbekanntmachung nach dem Umwandlungsgesetz 09.01.2025 (Eintragungsdatum)\n\nAdlermedien Mediengestaltung, e.K.\nEinzelkaufmann / Einzelkauffrau\nSchwetzingen\n\nDen Gläubigern der an der Ausgliederung beteiligten Rechtsträger ist, wenn sie binnen sechs Monaten nach dem Tag, an dem die Eintragung der Ausgliederung in das Register des Sitzes desjenigen Rechtsträgers, dessen Gläubiger sie sind, nach § 19 Abs. 3 UmwG als bekanntgemacht gilt, ihren Anspruch nach Grund und Höhe schriftlich anmelden, Sicherheit zu leisten, soweit sie nicht Befriedigung verlangen können. Dieses Recht steht den Gläubigern jedoch nur zu, wenn sie glaubhaft machen, dass durch die Ausgliederung die Erfüllung ihrer Forderung gefährdet wird."
    },
    {
      "date": "2025-01-09",
      "id": "98150",
      "original_text": "Einreichung neuer Dokumente\nBaden-Württemberg Amtsgericht Ulm HRB 737633\nKulturhaus Stolzensee GmbH – Kißlegg",
      "type": "Einreichung neuer Dokumente",
      "state": "Baden-Württemberg",
      "amtsgericht": "Amtsgericht Ulm",
      "registernummer": "HRB 737633",
      "registerart": "HRB",
      "company_name": "Kulturhaus Stolzensee GmbH",
      "company_seat": "Kißlegg",
      "details": "09.01.2025 (Bekanntmachungsdatum)\n\nBaden-Württemberg Amtsgericht Ulm HRB 737633\nEinreichung neuer Dokumente 09.01.2025 (Eintragungsdatum)\n\nKulturhaus Stolzensee GmbH\nGesellschaft mit beschränkter Haftung\nKißlegg\n\nDie Gesellschaft hat am 23.12.2024 die Liste über die Zusammensetzung des Aufsichtsrats zum Handelsregister eingereicht."
    },
    {
      "date": "2025-01-09",
      "id": "98151",
      "original_text": "Löschungsankündigung\nBrandenburg Amtsgericht Potsdam HRB 39038\nMMS Verwaltungs GmbH – Zossen",
      "type": "Löschungsankündigung",
      "state": "Brandenburg",
      "amtsgericht": "Amtsgericht Potsdam",
      "registernummer": "HRB 39038",
      "registerart": "HRB",
      "company_name": "MMS Verwaltungs GmbH",
      "company_seat": "Zossen",
      "details": "09.01.2025 (Bekanntmachungsdatum)\n\nBrandenburg Amtsgericht Potsdam HRB 39038\nLöschungsankündigung\n\nMMS Verwaltungs GmbH\nGesellschaft mit beschränkter Haftung\nZossen\n\nBei der nachstehenden Gesellschaft wird das Amtslöschungsverfahren gemäß § 394 FamFG eingeleitet. Widerspruchsfrist: 8 Wochen"
    },
    {
      "date": "2025-01-09",
      "id": "98152",
      "original_text": "Einreichung neuer Dokumente\nBaden-Württemberg Amtsgericht Freiburg HRB 381410\nBodensee-Schiffsbetriebe GmbH – Konstanz",
      "type": "Einreichung neuer Dokumente",
      "state": "Baden-Württemberg",
      "amtsgericht": "Amtsgericht Freiburg",
      "registernummer": "HRB 381410",
      "registerart": "HRB",
      "company_name": "Bodensee-Schiffsbetriebe GmbH",
      "company_seat": "Konstanz",
      "details": "09.01.2025 (Bekanntmachungsdatum)\n\nBaden-Württemberg Amtsgericht Freiburg HRB 381410\nEinreichung neuer Dokumente 09.01.2025 (Eintragungsdatum)\n\nBodensee-Schiffsbetriebe GmbH\nGesellschaft mit beschränkter Haftung\nKonstanz\n\nDie Gesellschaft hat am 07.01.2025 die Liste über die Zusammensetzung des Aufsichtsrats zum Handelsregister eingereicht."
    },
    {
      "date": "2025-01-09",
      "id": "98153",
      "original_text": "Sonstige Registerbekanntmachung\nHamburg Amtsgericht Hamburg HRB 50535\nVAMED Rehazentrum Harburg GmbH – Hamburg",
      "type": "Sonstige Registerbekanntmachung",
      "state": "Hamburg",
      "amtsgericht": "Amtsgericht Hamburg",
      "registernummer": "HRB 50535",
      "registerart": "HRB",
      "company_name": "VAMED Rehazentrum Harburg GmbH",
      "company_seat": "Hamburg",
      "details": "09.01.2025 (Bekanntmachungsdatum)\n\nHamburg Amtsgericht Hamburg HRB 50535\nSonstige Registerbekanntmachung 09.01.2025 (Eintragungsdatum)\n\nVAMED Rehazentrum Harburg GmbH\nGesellschaft mit beschränkter Haftung\nHamburg\n\nAls nicht eingetragen wird bekannt gemacht:  Den Gläubigern der Gesellschaft, deren Forderungen begründet worden sind, bevor die Eintragung der Vertragsbeendigung in das Handelsregister nach § 10 HGB als bekannt gemacht gilt, ist vom anderen Vertragsteil Sicherheit zu leisten, wenn sie sich binnen 6 Monaten nach Bekanntmachung der Eintragung zu diesem Zweck bei ihm melden."
    },
    {
      "date": "2025-01-09",
      "id": "98154",
      "original_text": "Registerbekanntmachung nach dem Umwandlungsgesetz\nBerlin Amtsgericht Berlin (Charlottenburg) HRB 255774\nFriseurstudio Marion Meschede UG (haftungsbeschränkt) – Berlin",
      "type": "Registerbekanntmachung nach dem Umwandlungsgesetz",
      "state": "Berlin",
      "amtsgericht": "Amtsgericht Berlin (Charlottenburg)",
      "registernummer": "HRB 255774",
      "registerart": "HRB",
      "company_name": "Friseurstudio Marion Meschede UG (haftungsbeschränkt)",
      "company_seat": "Berlin",
      "details": "09.01.2025 (Bekanntmachungsdatum)\n\nBerlin Amtsgericht Berlin (Charlottenburg) HRB 255774\nRegisterbekanntmachung nach dem Umwandlungsgesetz 08.01.2025 (Eintragungsdatum)\n\nFriseurstudio Marion Meschede UG (haftungsbeschränkt)\nGesellschaft mit beschränkter Haftung\nBerlin\n\nZu Eintragungsnummer 2 vom 08.01.2025 wird als nicht eingetragen veröffentlicht:  Den Gläubigern der an der Verschmelzung beteiligten Rechtsträger ist, wenn sie binnen sechs Monaten nach dem Tag, an dem die Eintragung der Verschmelzung in das Register des Sitzes desjenigen Rechtsträgers, dessen Gläubiger sie sind, als bekannt gemacht gilt, ihren Anspruch nach Grund und Höhe schriftlich anmelden, Sicherheit zu leisten, soweit sie nicht Befriedigung verlangen können. Dieses Recht steht den Gläubigern jedoch nur zu, wenn sie glaubhaft machen, dass durch die Verschmelzung die Erfüllung ihrer Forderung gefährdet wird. Das Recht, Sicherheitsleistung zu verlangen, steht Gläubigern nicht zu, die im Falle der Insolvenz ein Recht auf vorzugsweise Befriedigung aus einer Deckungsmasse haben, die nach gesetzlicher Vorschrift zu ihrem Schutz errichtet und staatlich überwacht ist."
    },
    {
      "date": "2025-01-09",
      "id": "98155",
      "original_text": "Löschungsankündigung\nBerlin Amtsgericht Berlin (Charlottenburg) HRB 228448\nKubinka Bau GmbH – Berlin",
      "type": "Löschungsankündigung",
      "state": "Berlin",
      "amtsgericht": "Amtsgericht Berlin (Charlottenburg)",
      "registernummer": "HRB 228448",
      "registerart": "HRB",
      "company_name": "Kubinka Bau GmbH",
      "company_seat": "Berlin",
      "details": "09.01.2025 (Bekanntmachungsdatum)\n\nBerlin Amtsgericht Berlin (Charlottenburg) HRB 228448\nLöschungsankündigung\n\nKubinka Bau GmbH\nGesellschaft mit beschränkter Haftung\nBerlin\n\nBei der nachstehenden Gesellschaft wird das Amtslöschungsverfahren gemäß § 394 FamFG eingeleitet. Widerspruchsfrist 6 Wochen"
    },
    {
      "date": "2025-01-09",
      "id": "98156",
      "original_text": "Sonstige Registerbekanntmachung\nBerlin Amtsgericht Berlin (Charlottenburg) HRB 97096\nUllstein Gesellschaft mit beschränkter Haftung – Berlin",
      "type": "Sonstige Registerbekanntmachung",
      "state": "Berlin",
      "amtsgericht": "Amtsgericht Berlin (Charlottenburg)",
      "registernummer": "HRB 97096",
      "registerart": "HRB",
      "company_name": "Ullstein Gesellschaft mit beschränkter Haftung",
      "company_seat": "Berlin",
      "details": "09.01.2025 (Bekanntmachungsdatum)\n\nBerlin Amtsgericht Berlin (Charlottenburg) HRB 97096\nSonstige Registerbekanntmachung\n\nUllstein Gesellschaft mit beschränkter Haftung\nGesellschaft mit beschränkter Haftung\nBerlin\n\nAls nicht eingetragen wird veröffentlicht: Der andere Vertragsteil hat den Gläubigern dieses Rechtsträgers, deren Forderungen begründet worden sind, bevor die Eintragung der Beendigung dieses Vertrages in das Handelsregister nach § 10 des Handelsgesetzbuches als bekannt gemacht gilt, Sicherheit zu leisten, wenn sie sich binnen sechs Monaten nach der Bekanntmachung der Eintragung zu diesem Zweck bei ihm melden. Dieses Recht steht den Gläubigern nicht zu, die im Fall des Insolvenzverfahrens ein Recht auf vorzugsweise Befriedigung aus der Deckungsmasse haben, die nach gesetzlicher Vorschrift zu ihrem Schutz errichtet und staatlich überwacht ist."
    },
    {
      "date": "2025-01-09",
      "id": "98157",
      "original_text": "Löschungsankündigung\nSaarland Amtsgericht Saarbrücken HRB 106141\nDirks Hausmeisterservice UG (haftungsbeschränkt) – Bexbach",
      "type": "Löschungsankündigung",
      "state": "Saarland",
      "amtsgericht": "Amtsgericht Saarbrücken",
      "registernummer": "HRB 106141",
      "registerart": "HRB",
      "company_name": "Dirks Hausmeisterservice UG (haftungsbeschränkt)",
      "company_seat": "Bexbach",
      "details": "09.01.2025 (Bekanntmachungsdatum)\n\nSaarland Amtsgericht Saarbrücken HRB 106141\nLöschungsankündigung\n\nDirks Hausmeisterservice UG (haftungsbeschränkt)\nGesellschaft mit beschränkter Haftung\nBexbach\n\nEs ist beabsichtigt, die Gesellschaft von Amts wegen gemäß § 394 FamFG wegen Vermögenslosigkeit zu löschen.\nGegen die Löschung von Amts wegen ist das Rechtsmittel des Widerspruchs statthaft. Der Widerspruch ist binnen einer Frist zwei Monaten beginnend mit dem Tag dieser Veröffentlichung durch Einreichen eines Widerspruchsschreibens -schriftlich oder zur Niederschrift der Geschäftsstelle beim Amtsgericht Saarbrücken, -zentrales Handelsregister-, Mainzerstr.178, 66121 Saarbrücken einzulegen.\nDer Widerspruch muss die Bezeichnung der angefochtenen Löschungsankündigung enthalten sowie die Erklärung, dass Widerspruch eingelegt wird. Er ist vom Widerspruchsführer oder seinem Bevollmächtigten zu unterzeichnen.\nDas Widerspruchsschreiben kann auch in der Form eines elektronischen Dokumentes eingereicht werden, das mit einer qualifizierten elektronischen Signatur nach dem Signaturgesetz versehen sein muss (§§ 14 Abs. 2 FamFG, 130a, 298 ZPO)."
    },
    {
      "date": "2025-01-09",
      "id": "98158",
      "original_text": "Löschungsankündigung\nBerlin Amtsgericht Berlin (Charlottenburg) HRB 163051\nAYTAX GmbH – Berlin",
      "type": "Löschungsankündigung",
      "state": "Berlin",
      "amtsgericht": "Amtsgericht Berlin (Charlottenburg)",
      "registernummer": "HRB 163051",
      "registerart": "HRB",
      "company_name": "AYTAX GmbH",
      "company_seat": "Berlin",
      "details": "09.01.2025 (Bekanntmachungsdatum)\n\nBerlin Amtsgericht Berlin (Charlottenburg) HRB 163051\nLöschungsankündigung\n\nAYTAX GmbH\nGesellschaft mit beschränkter Haftung\nBerlin\n\nBei der nachstehenden Gesellschaft wird das Amtslöschungsverfahren gemäß § 394 FamFG eingeleitet. Widerspruchsfrist 6 Wochen"
    },
    {
      "date": "2025-01-09",
      "id": "98159",
      "original_text": "Einreichung neuer Dokumente\nSaarland Amtsgericht Saarbrücken HRB 4489\nSAARLAND - SPORTTOTO GmbH – Saarbrücken",
      "type": "Einreichung neuer Dokumente",
      "state": "Saarland",
      "amtsgericht": "Amtsgericht Saarbrücken",
      "registernummer": "HRB 4489",
      "registerart": "HRB",
      "company_name": "SAARLAND - SPORTTOTO GmbH",
      "company_seat": "Saarbrücken",
      "details": "09.01.2025 (Bekanntmachungsdatum)\n\nSaarland Amtsgericht Saarbrücken HRB 4489\nEinreichung neuer Dokumente\n\nSAARLAND - SPORTTOTO GmbH\nGesellschaft mit beschränkter Haftung\nSaarbrücken\n\nDie Geschäftsführung der Gesellschaft hat eine Liste der Mitglieder des Aufsichtsrats zum Handelsregister eingereicht (§ 52 Abs. 3 Satz 2 GmbHG)."
    },
    {
      "date": "2025-01-09",
      "id": "98160",
      "original_text": "Registerbekanntmachung nach dem Umwandlungsgesetz\nSaarland Amtsgericht Saarbrücken HRB 105778\nOPUS Solarstrom UG (haftungsbeschränkt) – Saarbrücken",
      "type": "Registerbekanntmachung nach dem Umwandlungsgesetz",
      "state": "Saarland",
      "amtsgericht": "Amtsgericht Saarbrücken",
      "registernummer": "HRB 105778",
      "registerart": "HRB",
      "company_name": "OPUS Solarstrom UG (haftungsbeschränkt)",
      "company_seat": "Saarbrücken",
      "details": "09.01.2025 (Bekanntmachungsdatum)\n\nSaarland Amtsgericht Saarbrücken HRB 105778\nRegisterbekanntmachung nach dem Umwandlungsgesetz 09.01.2025 (Eintragungsdatum)\n\nOPUS Solarstrom UG (haftungsbeschränkt)\nGesellschaft mit beschränkter Haftung\nSaarbrücken\n\nAls nicht eingetragen wird bekannt gemacht: Den Gläubigern der an der Verschmelzung beteiligten Gesellschaften ist, wenn sie binnen sechs Monaten nach dem Tag, an dem die Eintragung der Verschmelzung in das Register des Sitzes desjenigen Rechtsträgers, dessen Gläubiger sie sind, nach § 19 Absatz 3 UmwG bekannt gemacht worden ist, ihren Anspruch nach Grund und Höhe schriftlich anmelden, Sicherheit zu leisten, soweit sie nicht Befriedigung verlangen können. Dieses Recht steht den Gläubigern jedoch nur zu, wenn sie glaubhaft machen, dass durch die Verschmelzung die Erfüllung ihrer Forderung gefährdet wird."
    },
    {
      "date": "2025-01-09",
      "id": "98161",
      "original_text": "Löschungsankündigung\nBerlin Amtsgericht Berlin (Charlottenburg) HRA 16342\nLawrenz GmbH & Co. Tischlerei KG. – Berlin",
      "type": "Löschungsankündigung",
      "state": "Berlin",
      "amtsgericht": "Amtsgericht Berlin (Charlottenburg)",
      "registernummer": "HRA 16342",
      "registerart": "HRA",
      "company_name": "Lawrenz GmbH & Co. Tischlerei KG.",
      "company_seat": "Berlin",
      "details": "09.01.2025 (Bekanntmachungsdatum)\n\nBerlin Amtsgericht Berlin (Charlottenburg) HRA 16342\nLöschungsankündigung\n\nLawrenz GmbH & Co. Tischlerei KG.\nKommanditgesellschaft\nBerlin\n\nBei dem nachstehenden Unternehmen / der nachstehenden Gesellschaft wird das Amtslöschungsverfahren gemäß § 31 Abs. 2 HGB eingeleitet. Widerspruchsfrist 1 Monat"
    },
    {
      "date": "2025-01-09",
      "id": "98162",
      "original_text": "Registerbekanntmachung nach dem Umwandlungsgesetz\nSaarland Amtsgericht Saarbrücken HRB 106962\nKOLLMANN PROJEKT GMBH – Saarbrücken",
      "type": "Registerbekanntmachung nach dem Umwandlungsgesetz",
      "state": "Saarland",
      "amtsgericht": "Amtsgericht Saarbrücken",
      "registernummer": "HRB 106962",
      "registerart": "HRB",
      "company_name": "KOLLMANN PROJEKT GMBH",
      "company_seat": "Saarbrücken",
      "details": "09.01.2025 (Bekanntmachungsdatum)\n\nSaarland Amtsgericht Saarbrücken HRB 106962\nRegisterbekanntmachung nach dem Umwandlungsgesetz 09.01.2025 (Eintragungsdatum)\n\nKOLLMANN PROJEKT GMBH\nGesellschaft mit beschränkter Haftung\nSaarbrücken\n\nAls nicht eingetragen wird bekannt gemacht: Den Gläubigern der an der Verschmelzung beteiligten Gesellschaften ist, wenn sie binnen sechs Monaten nach dem Tag, an dem die Eintragung der Verschmelzung in das Register des Sitzes desjenigen Rechtsträgers, dessen Gläubiger sie sind, nach § 19 Absatz 3 UmwG bekannt gemacht worden ist, ihren Anspruch nach Grund und Höhe schriftlich anmelden, Sicherheit zu leisten, soweit sie nicht Befriedigung verlangen können. Dieses Recht steht den Gläubigern jedoch nur zu, wenn sie glaubhaft machen, dass durch die Verschmelzung die Erfüllung ihrer Forderung gefährdet wird."
    },
    {
      "date": "2025-01-09",
      "id": "98163",
      "original_text": "Löschungsankündigung\nBerlin Amtsgericht Berlin (Charlottenburg) HRB 211035\nAdCups Tec GmbH – Berlin",
      "type": "Löschungsankündigung",
      "state": "Berlin",
      "amtsgericht": "Amtsgericht Berlin (Charlottenburg)",
      "registernummer": "HRB 211035",
      "registerart": "HRB",
      "company_name": "AdCups Tec GmbH",
      "company_seat": "Berlin",
      "details": "09.01.2025 (Bekanntmachungsdatum)\n\nBerlin Amtsgericht Berlin (Charlottenburg) HRB 211035\nLöschungsankündigung\n\nAdCups Tec GmbH\nGesellschaft mit beschränkter Haftung\nBerlin\n\nBei der nachstehenden Gesellschaft wird das Amtslöschungsverfahren gemäß § 394 FamFG eingeleitet. Widerspruchsfrist 6 Wochen."
    },
    {
      "date": "2025-01-09",
      "id": "98164",
      "original_text": "Einreichung neuer Dokumente\nBaden-Württemberg Amtsgericht Ulm HRB 530112\nKreisbaugesellschaft mit beschränkter Haftung Filstal – Göppingen",
      "type": "Einreichung neuer Dokumente",
      "state": "Baden-Württemberg",
      "amtsgericht": "Amtsgericht Ulm",
      "registernummer": "HRB 530112",
      "registerart": "HRB",
      "company_name": "Kreisbaugesellschaft mit beschränkter Haftung Filstal",
      "company_seat": "Göppingen",
      "details": "09.01.2025 (Bekanntmachungsdatum)\n\nBaden-Württemberg Amtsgericht Ulm HRB 530112\nEinreichung neuer Dokumente\n\nKreisbaugesellschaft mit beschränkter Haftung Filstal\nGesellschaft mit beschränkter Haftung\nGöppingen\n\nDie Gesellschaft hat am 09.01.2025 die Liste über die Zusammensetzung des Aufsichtsrats zum Handelsregister eingereicht."
    },
    {
      "date": "2025-01-09",
      "id": "98165",
      "original_text": "Löschungsankündigung\nBerlin Amtsgericht Berlin (Charlottenburg) HRB 133195\nFINIT GmbH – Berlin",
      "type": "Löschungsankündigung",
      "state": "Berlin",
      "amtsgericht": "Amtsgericht Berlin (Charlottenburg)",
      "registernummer": "HRB 133195",
      "registerart": "HRB",
      "company_name": "FINIT GmbH",
      "company_seat": "Berlin",
      "details": "09.01.2025 (Bekanntmachungsdatum)\n\nBerlin Amtsgericht Berlin (Charlottenburg) HRB 133195\nLöschungsankündigung\n\nFINIT GmbH\nGesellschaft mit beschränkter Haftung\nBerlin\n\nBei der nachstehenden Gesellschaft wird das Amtslöschungsverfahren gemäß § 394 FamFG eingeleitet. Widerspruchsfrist 6 Wochen"
    },
    {
      "date": "2025-01-09",
      "id": "98166",
      "original_text": "Registerbekanntmachung nach dem Umwandlungsgesetz\nThüringen Amtsgericht Jena HRB 112623\nArnstädter Werkzeug- und Maschinenbau AG – Arnstadt",
      "type": "Registerbekanntmachung nach dem Umwandlungsgesetz",
      "state": "Thüringen",
      "amtsgericht": "Amtsgericht Jena",
      "registernummer": "HRB 112623",
      "registerart": "HRB",
      "company_name": "Arnstädter Werkzeug- und Maschinenbau AG",
      "company_seat": "Arnstadt",
      "details": "09.01.2025 (Bekanntmachungsdatum)\n\nThüringen Amtsgericht Jena HRB 112623\nRegisterbekanntmachung nach dem Umwandlungsgesetz 09.01.2025 (Eintragungsdatum)\n\nArnstädter Werkzeug- und Maschinenbau AG\nAktiengesellschaft\nArnstadt\n\nNicht eingetragen: Den Gläubigern des formwechselnden  Rechtsträgers, ist wenn sie binnen sechs Monaten nach dem Tag, an dem die Eintragung des Formwechsels nach § 201 UmwG als bekanntgemacht gilt, ihren Anspruch nach Grund und Höhe schriftlich anmelden, Sicherheit zu leisten, soweit sie nicht Befriedigung verlangen können. Dieses Recht steht ihnen jedoch nur zu, wenn sie glaubhaft machen, daß durch den Formwechsel die Erfüllung ihrer Forderung gefährdet wird."
    },
    {
      "date": "2025-01-09",
      "id": "98167",
      "original_text": "Registerbekanntmachung nach dem Umwandlungsgesetz\nThüringen Amtsgericht Jena HRB 522730\nArnstädter Werkzeug- und Maschinenbau GmbH – Arnstadt",
      "type": "Registerbekanntmachung nach dem Umwandlungsgesetz",
      "state": "Thüringen",
      "amtsgericht": "Amtsgericht Jena",
      "registernummer": "HRB 522730",
      "registerart": "HRB",
      "company_name": "Arnstädter Werkzeug- und Maschinenbau GmbH",
      "company_seat": "Arnstadt",
      "details": "09.01.2025 (Bekanntmachungsdatum)\n\nThüringen Amtsgericht Jena HRB 522730\nRegisterbekanntmachung nach dem Umwandlungsgesetz 09.01.2025 (Eintragungsdatum)\n\nArnstädter Werkzeug- und Maschinenbau GmbH\nGesellschaft mit beschränkter Haftung\nArnstadt\n\nNicht eingetragen: Den Gläubigern des formwechselnden  Rechtsträgers, ist wenn sie binnen sechs Monaten nach dem Tag, an dem die Eintragung des Formwechsels nach § 201 UmwG als bekanntgemacht gilt, ihren Anspruch nach Grund und Höhe schriftlich anmelden, Sicherheit zu leisten, soweit sie nicht Befriedigung verlangen können. Dieses Recht steht ihnen jedoch nur zu, wenn sie glaubhaft machen, daß durch den Formwechsel die Erfüllung ihrer Forderung gefährdet wird."
    },
    {
      "date": "2025-01-09",
      "id": "98168",
      "original_text": "Einreichung neuer Dokumente\nBaden-Württemberg Amtsgericht Stuttgart HRB 24542\nSV SparkassenVersicherung Lebensversicherung Aktiengesellschaft – Stuttgart",
      "type": "Einreichung neuer Dokumente",
      "state": "Baden-Württemberg",
      "amtsgericht": "Amtsgericht Stuttgart",
      "registernummer": "HRB 24542",
      "registerart": "HRB",
      "company_name": "SV SparkassenVersicherung Lebensversicherung Aktiengesellschaft",
      "company_seat": "Stuttgart",
      "details": "09.01.2025 (Bekanntmachungsdatum)\n\nBaden-Württemberg Amtsgericht Stuttgart HRB 24542\nEinreichung neuer Dokumente\n\nSV SparkassenVersicherung Lebensversicherung Aktiengesellschaft\nAktiengesellschaft\nStuttgart\n\nDie Gesellschaft hat am 27.12.2024 die Liste über die Zusammensetzung des Aufsichtsrats zum Handelsregister eingereicht."
    },
    {
      "date": "2025-01-09",
      "id": "98169",
      "original_text": "Löschungsankündigung\nBrandenburg Amtsgericht Frankfurt/Oder HRB 14882\nFireSafeTec GmbH – Fürstenwalde/Spree",
      "type": "Löschungsankündigung",
      "state": "Brandenburg",
      "amtsgericht": "Amtsgericht Frankfurt/Oder",
      "registernummer": "HRB 14882",
      "registerart": "HRB",
      "company_name": "FireSafeTec GmbH",
      "company_seat": "Fürstenwalde/Spree",
      "details": "09.01.2025 (Bekanntmachungsdatum)\n\nBrandenburg Amtsgericht Frankfurt/Oder HRB 14882\nLöschungsankündigung\n\nFireSafeTec GmbH\nGesellschaft mit beschränkter Haftung\nFürstenwalde/Spree\n\nBei der nachstehenden Gesellschaft wird das Amtslöschungsverfahren gemäß § 394 FamFG eingeleitet."
    },
    {
      "date": "2025-01-09",
      "id": "98170",
      "original_text": "Registerbekanntmachung nach dem Umwandlungsgesetz\nBerlin Amtsgericht Berlin (Charlottenburg) HRB 173684\nInsitu Immobilien Konzepte GmbH – Berlin",
      "type": "Registerbekanntmachung nach dem Umwandlungsgesetz",
      "state": "Berlin",
      "amtsgericht": "Amtsgericht Berlin (Charlottenburg)",
      "registernummer": "HRB 173684",
      "registerart": "HRB",
      "company_name": "Insitu Immobilien Konzepte GmbH",
      "company_seat": "Berlin",
      "details": "09.01.2025 (Bekanntmachungsdatum)\n\nBerlin Amtsgericht Berlin (Charlottenburg) HRB 173684\nRegisterbekanntmachung nach dem Umwandlungsgesetz 09.01.2025 (Eintragungsdatum)\n\nInsitu Immobilien Konzepte GmbH\nGesellschaft mit beschränkter Haftung\nBerlin\n\nZu Eintragungsnummer 4 vom 09.01.2025 wird als nicht eingetragen veröffentlicht: Den Gläubigern der an der Verschmelzung beteiligten Rechtsträger ist, wenn sie binnen sechs Monaten nach dem Tag, an dem die Eintragung der Verschmelzung in das Register des Sitzes desjenigen Rechtsträgers, dessen Gläubiger sie sind, als bekannt gemacht gilt, ihren Anspruch nach Grund und Höhe schriftlich anmelden, Sicherheit zu leisten, soweit sie nicht Befriedigung verlangen können. Dieses Recht steht den Gläubigern jedoch nur zu, wenn sie glaubhaft machen, dass durch die Verschmelzung die Erfüllung ihrer Forderung gefährdet wird. Das Recht, Sicherheitsleistung zu verlangen, steht Gläubigern nicht zu, die im Falle der Insolvenz ein Recht auf vorzugsweise Befriedigung aus einer Deckungsmasse haben, die nach gesetzlicher Vorschrift zu ihrem Schutz errichtet und staatlich überwacht ist."
    },
    {
      "date": "2025-01-09",
      "id": "98171",
      "original_text": "Löschungsankündigung\nSchleswig-Holstein Amtsgericht Lübeck HRB 1271 SB\nAutohaus Schwarzenbek GmbH – Schwarzenbek",
      "type": "Löschungsankündigung",
      "state": "Schleswig-Holstein",
      "amtsgericht": "Amtsgericht Lübeck",
      "registernummer": "HRB 1271 SB",
      "registerart": "HRB",
      "company_name": "Autohaus Schwarzenbek GmbH",
      "company_seat": "Schwarzenbek",
      "details": "09.01.2025 (Bekanntmachungsdatum)\n\nSchleswig-Holstein Amtsgericht Lübeck HRB 1271 SB\nLöschungsankündigung\n\nAutohaus Schwarzenbek GmbH\nGesellschaft mit beschränkter Haftung\nSchwarzenbek\n\nEs ist die Löschung der nachstehenden Gesellschaft wegen Vermögenslosigkeit gemäß § 394 FamFG beabsichtigt."
    },
    {
      "date": "2025-01-09",
      "id": "98172",
      "original_text": "Sonstige Registerbekanntmachung\nBerlin Amtsgericht Berlin (Charlottenburg) HRB 223733\nSpielpalast Tenever GmbH – Berlin",
      "type": "Sonstige Registerbekanntmachung",
      "state": "Berlin",
      "amtsgericht": "Amtsgericht Berlin (Charlottenburg)",
      "registernummer": "HRB 223733",
      "registerart": "HRB",
      "company_name": "Spielpalast Tenever GmbH",
      "company_seat": "Berlin",
      "details": "09.01.2025 (Bekanntmachungsdatum)\n\nBerlin Amtsgericht Berlin (Charlottenburg) HRB 223733\nSonstige Registerbekanntmachung 08.01.2025 (Eintragungsdatum)\n\nSpielpalast Tenever GmbH\nGesellschaft mit beschränkter Haftung\nBerlin\n\nAls nicht eingetragen wird veröffentlicht: Der andere Vertragsteil hat den Gläubigern dieses Rechtsträgers, deren Forderungen begründet worden sind, bevor die Eintragung der Beendigung dieses Vertrages in das Handelsregister nach § 10 des Handelsgesetzbuches als bekannt gemacht gilt, Sicherheit zu leisten, wenn sie sich binnen sechs Monaten nach der Bekanntmachung der Eintragung zu diesem Zweck bei ihm melden. Dieses Recht steht den Gläubigern nicht zu, die im Fall des Insolvenzverfahrens ein Recht auf vorzugsweise Befriedigung aus der Deckungsmasse haben, die nach gesetzlicher Vorschrift zu ihrem Schutz errichtet und staatlich überwacht ist."
    },
    {
      "date": "2025-01-09",
      "id": "98173",
      "original_text": "Einreichung neuer Dokumente\nBerlin Amtsgericht Berlin (Charlottenburg) HRB 34165\nDeutsche Kreditbank Aktiengesellschaft – Berlin",
      "type": "Einreichung neuer Dokumente",
      "state": "Berlin",
      "amtsgericht": "Amtsgericht Berlin (Charlottenburg)",
      "registernummer": "HRB 34165",
      "registerart": "HRB",
      "company_name": "Deutsche Kreditbank Aktiengesellschaft",
      "company_seat": "Berlin",
      "details": "09.01.2025 (Bekanntmachungsdatum)\n\nBerlin Amtsgericht Berlin (Charlottenburg) HRB 34165\nEinreichung neuer Dokumente\n\nDeutsche Kreditbank Aktiengesellschaft\nAktiengesellschaft\nBerlin\n\nAls nicht eingetragen wird veröffentlicht: Es wurde eine neue Liste der Aufsichtsratsmitglieder eingereicht (§ 106 AktG)."
    },
    {
      "date": "2025-01-09",
      "id": "98174",
      "original_text": "Einreichung neuer Dokumente\nBrandenburg Amtsgericht Potsdam HRB 22985\nAbwasserwerke Baruth GmbH – Baruth",
      "type": "Einreichung neuer Dokumente",
      "state": "Brandenburg",
      "amtsgericht": "Amtsgericht Potsdam",
      "registernummer": "HRB 22985",
      "registerart": "HRB",
      "company_name": "Abwasserwerke Baruth GmbH",
      "company_seat": "Baruth",
      "details": "09.01.2025 (Bekanntmachungsdatum)\n\nBrandenburg Amtsgericht Potsdam HRB 22985\nEinreichung neuer Dokumente\n\nAbwasserwerke Baruth GmbH\nGesellschaft mit beschränkter Haftung\nBaruth\n\nAls nicht eingetragen wird veröffentlicht:\nEine Liste der Mitglieder des Aufsichtsrates wurde zum Handelsregister eingereicht."
    },
    {
      "date": "2025-01-09",
      "id": "98175",
      "original_text": "Löschungsankündigung\nSchleswig-Holstein Amtsgericht Lübeck HRB 17534\nNordlicht Security GmbH – Lübeck",
      "type": "Löschungsankündigung",
      "state": "Schleswig-Holstein",
      "amtsgericht": "Amtsgericht Lübeck",
      "registernummer": "HRB 17534",
      "registerart": "HRB",
      "company_name": "Nordlicht Security GmbH",
      "company_seat": "Lübeck",
      "details": "09.01.2025 (Bekanntmachungsdatum)\n\nSchleswig-Holstein Amtsgericht Lübeck HRB 17534\nLöschungsankündigung\n\nNordlicht Security GmbH\nGesellschaft mit beschränkter Haftung\nLübeck\n\nEs ist die Löschung der nachstehenden Gesellschaft wegen Vermögenslosigkeit gemäß § 394 FamFG beabsichtigt."
    },
    {
      "date": "2025-01-09",
      "id": "98176",
      "original_text": "Sonstige Registerbekanntmachung\nHamburg Amtsgericht Hamburg HRB 75285\nReGe Hamburg Projekt-Realisierungsgesellschaft mbH – Hamburg",
      "type": "Sonstige Registerbekanntmachung",
      "state": "Hamburg",
      "amtsgericht": "Amtsgericht Hamburg",
      "registernummer": "HRB 75285",
      "registerart": "HRB",
      "company_name": "ReGe Hamburg Projekt-Realisierungsgesellschaft mbH",
      "company_seat": "Hamburg",
      "details": "09.01.2025 (Bekanntmachungsdatum)\n\nHamburg Amtsgericht Hamburg HRB 75285\nSonstige Registerbekanntmachung 09.01.2025 (Eintragungsdatum)\n\nReGe Hamburg Projekt-Realisierungsgesellschaft mbH\nGesellschaft mit beschränkter Haftung\nHamburg\n\nAls nicht eingetragen wird bekannt gemacht:  Den Gläubigern der Gesellschaft, deren Forderungen begründet worden sind, bevor die Eintragung der Vertragsbeendigung in das Handelsregister nach § 10 HGB als bekannt gemacht gilt, ist vom anderen Vertragsteil Sicherheit zu leisten, wenn sie sich binnen 6 Monaten nach Bekanntmachung der Eintragung zu diesem Zweck bei ihm melden."
    },
    {
      "date": "2025-01-09",
      "id": "98177",
      "original_text": "Löschungsankündigung\nBerlin Amtsgericht Berlin (Charlottenburg) HRB 197020\nBy Mega Bistro UG (haftungsbeschränkt) – Berlin",
      "type": "Löschungsankündigung",
      "state": "Berlin",
      "amtsgericht": "Amtsgericht Berlin (Charlottenburg)",
      "registernummer": "HRB 197020",
      "registerart": "HRB",
      "company_name": "By Mega Bistro UG (haftungsbeschränkt)",
      "company_seat": "Berlin",
      "details": "09.01.2025 (Bekanntmachungsdatum)\n\nBerlin Amtsgericht Berlin (Charlottenburg) HRB 197020\nLöschungsankündigung\n\nBy Mega Bistro UG (haftungsbeschränkt)\nGesellschaft mit beschränkter Haftung\nBerlin\n\nBei der nachstehenden Gesellschaft wird das Amtslöschungsverfahren gemäß § 394 FamFG eingeleitet. Widerspruchsfrist 6 Wochen"
    },
    {
      "date": "2025-01-09",
      "id": "98178",
      "original_text": "Sonstige Registerbekanntmachung\nBaden-Württemberg Amtsgericht Mannheim HRB 724291\nDME Normalien GmbH – Baden-Baden",
      "type": "Sonstige Registerbekanntmachung",
      "state": "Baden-Württemberg",
      "amtsgericht": "Amtsgericht Mannheim",
      "registernummer": "HRB 724291",
      "registerart": "HRB",
      "company_name": "DME Normalien GmbH",
      "company_seat": "Baden-Baden",
      "details": "09.01.2025 (Bekanntmachungsdatum)\n\nBaden-Württemberg Amtsgericht Mannheim HRB 724291\nSonstige Registerbekanntmachung 09.01.2025 (Eintragungsdatum)\n\nDME Normalien GmbH\nGesellschaft mit beschränkter Haftung\nBaden-Baden\n\nAls nicht eingetragen wird bekanntgemacht:\nDen Gläubigern der Gesellschaft, deren Forderungen begründet worden sind, bevor die Eintragung der Beendigung des Vertrages in das Handelsregister nach § 10 HGB als bekanntgemacht gilt, ist vom anderen Vertragsteil Sicherheit zu leisten, wenn sie sich binnen sechs Monaten nach der Bekanntmachung zu diesem Zweck bei ihm melden."
    },
    {
      "date": "2025-01-09",
      "id": "98179",
      "original_text": "Einreichung neuer Dokumente\nSchleswig-Holstein Amtsgericht Kiel HRB 25389\nPLANET Hotelbau AG – Kiel",
      "type": "Einreichung neuer Dokumente",
      "state": "Schleswig-Holstein",
      "amtsgericht": "Amtsgericht Kiel",
      "registernummer": "HRB 25389",
      "registerart": "HRB",
      "company_name": "PLANET Hotelbau AG",
      "company_seat": "Kiel",
      "details": "09.01.2025 (Bekanntmachungsdatum)\n\nSchleswig-Holstein Amtsgericht Kiel HRB 25389\nEinreichung neuer Dokumente\n\nPLANET Hotelbau AG\nAktiengesellschaft\nKiel\n\nEine neue Liste der Aufsichtsratsmitglieder ist eingereicht worden."
    },
    {
      "date": "2025-01-09",
      "id": "98180",
      "original_text": "Registerbekanntmachung nach dem Umwandlungsgesetz\nBaden-Württemberg Amtsgericht Freiburg HRB 413537\nRZW Recycling- Zentrum- Wiesental GmbH – Steinen",
      "type": "Registerbekanntmachung nach dem Umwandlungsgesetz",
      "state": "Baden-Württemberg",
      "amtsgericht": "Amtsgericht Freiburg",
      "registernummer": "HRB 413537",
      "registerart": "HRB",
      "company_name": "RZW Recycling- Zentrum- Wiesental GmbH",
      "company_seat": "Steinen",
      "details": "09.01.2025 (Bekanntmachungsdatum)\n\nBaden-Württemberg Amtsgericht Freiburg HRB 413537\nRegisterbekanntmachung nach dem Umwandlungsgesetz 09.01.2025 (Eintragungsdatum)\n\nRZW Recycling- Zentrum- Wiesental GmbH\nGesellschaft mit beschränkter Haftung\nSteinen\n\nAls nicht eingetragen wird bekanntgemacht:\nDen Gläubigern der an der Verschmelzung beteiligten Rechtsträger (RZW Recycling-Zentrum-Wiesental GmbH mit Sitz in Steinen und REMONDIS Süd GmbH mit Sitz in München) ist, wenn sie binnen sechs Monaten nach dem Tag, an dem die Eintragung der Verschmelzung in das Register des Sitzes desjenigen Rechtsträgers, dessen Gläubiger sie sind, nach § 19 Abs. 3 UmwG als bekanntgemacht gilt, ihren Anspruch nach Grund und Höhe schriftlich anmelden, Sicherheit zu leisten, soweit sie nicht Befriedigung verlangen können. Dieses Recht steht den Gläubigern jedoch nur zu, wenn sie glaubhaft machen, dass durch die Verschmelzung die Erfüllung ihrer Forderung gefährdet wird."
    },
    {
      "date": "2025-01-09",
      "id": "98181",
      "original_text": "Registerbekanntmachung nach dem Umwandlungsgesetz\nSchleswig-Holstein Amtsgericht Pinneberg HRB 5475\nbk medical Medizinische Systeme GmbH – Quickborn/Krs. Pinneberg",
      "type": "Registerbekanntmachung nach dem Umwandlungsgesetz",
      "state": "Schleswig-Holstein",
      "amtsgericht": "Amtsgericht Pinneberg",
      "registernummer": "HRB 5475",
      "registerart": "HRB",
      "company_name": "bk medical Medizinische Systeme GmbH",
      "company_seat": "Quickborn/Krs. Pinneberg",
      "details": "09.01.2025 (Bekanntmachungsdatum)\n\nSchleswig-Holstein Amtsgericht Pinneberg HRB 5475\nRegisterbekanntmachung nach dem Umwandlungsgesetz 09.01.2025 (Eintragungsdatum)\n\nbk medical Medizinische Systeme GmbH\nGesellschaft mit beschränkter Haftung\nQuickborn/Krs. Pinneberg\n\nZu Eintragungsnummer 8 vom 09.01.2025 wird als nicht eingetragen veröffentlicht: Als nicht eingetragen wird veröffentlicht: Den Gläubigern der an der Verschmelzung beteiligten Rechtsträger ist, wenn sie binnen sechs Monaten nach dem Tag, an dem die Eintragung der Verschmelzung in das Register des Sitzes desjenigen Rechtsträgers, dessen Gläubiger sie sind, als bekannt gemacht gilt, ihren Anspruch nach Grund und Höhe schriftlich anmelden, Sicherheit zu leisten, soweit sie nicht Befriedigung verlangen können. Dieses Recht steht den Gläubigern jedoch nur zu, wenn sie glaubhaft machen, dass durch die Verschmelzung die Erfüllung ihrer Forderung gefährdet wird. Das Recht, Sicherheitsleistung zu verlangen, steht Gläubigern nicht zu, die im Falle der Insolvenz ein Recht auf vorzugsweise Befriedigung aus einer Deckungsmasse haben, die nach gesetzlicher Vorschrift zu ihrem Schutz errichtet und staatlich überwacht ist."
    },
    {
      "date": "2025-01-09",
      "id": "98182",
      "original_text": "Einreichung neuer Dokumente\nBaden-Württemberg Amtsgericht Stuttgart HRB 571475\nBäuerliche Erzeugergemeinschaft Schwäbisch Hall AG – Schwäbisch Hall",
      "type": "Einreichung neuer Dokumente",
      "state": "Baden-Württemberg",
      "amtsgericht": "Amtsgericht Stuttgart",
      "registernummer": "HRB 571475",
      "registerart": "HRB",
      "company_name": "Bäuerliche Erzeugergemeinschaft Schwäbisch Hall AG",
      "company_seat": "Schwäbisch Hall",
      "details": "09.01.2025 (Bekanntmachungsdatum)\n\nBaden-Württemberg Amtsgericht Stuttgart HRB 571475\nEinreichung neuer Dokumente\n\nBäuerliche Erzeugergemeinschaft Schwäbisch Hall AG\nAktiengesellschaft\nSchwäbisch Hall\n\nDie Gesellschaft hat am 03.01.2025 die Liste über die Zusammensetzung des Aufsichtsrats zum Handelsregister eingereicht."
    },
    {
      "date": "2025-01-09",
      "id": "98183",
      "original_text": "Sonstige Registerbekanntmachung\nBrandenburg Amtsgericht Cottbus HRB 3595\nIngenieurgesellschaft für Bauwesen und Grundstücksverwaltung Bad Liebenwerda mbH – Bad Liebenwerda",
      "type": "Sonstige Registerbekanntmachung",
      "state": "Brandenburg",
      "amtsgericht": "Amtsgericht Cottbus",
      "registernummer": "HRB 3595",
      "registerart": "HRB",
      "company_name": "Ingenieurgesellschaft für Bauwesen und Grundstücksverwaltung Bad Liebenwerda mbH",
      "company_seat": "Bad Liebenwerda",
      "details": "09.01.2025 (Bekanntmachungsdatum)\n\nBrandenburg Amtsgericht Cottbus HRB 3595\nSonstige Registerbekanntmachung\n\nIngenieurgesellschaft für Bauwesen und Grundstücksverwaltung Bad Liebenwerda mbH\nGesellschaft mit beschränkter Haftung\nBad Liebenwerda\n\nAls nicht eingetragen wird veröffentlicht:\nDie aktuelle Liste der Aufsichtsratsmitglieder wurde zum Handelsregister gem. § 52 Abs. 3 GmbHG eingereicht."
    },
    {
      "date": "2025-01-09",
      "id": "98184",
      "original_text": "Einreichung neuer Dokumente\nBerlin Amtsgericht Berlin (Charlottenburg) HRB 231672\nMellifera Vierzigste Beteiligungsgesellschaft mbH – Berlin",
      "type": "Einreichung neuer Dokumente",
      "state": "Berlin",
      "amtsgericht": "Amtsgericht Berlin (Charlottenburg)",
      "registernummer": "HRB 231672",
      "registerart": "HRB",
      "company_name": "Mellifera Vierzigste Beteiligungsgesellschaft mbH",
      "company_seat": "Berlin",
      "details": "09.01.2025 (Bekanntmachungsdatum)\n\nBerlin Amtsgericht Berlin (Charlottenburg) HRB 231672\nEinreichung neuer Dokumente\n\nMellifera Vierzigste Beteiligungsgesellschaft mbH\nGesellschaft mit beschränkter Haftung\nBerlin\n\nAls nicht eingetragen wird veröffentlicht: Es wurde eine neue Liste der Beiratsmitglieder eingereicht (§52 GmbHG)."
    },
    {
      "date": "2025-01-09",
      "id": "98185",
      "original_text": "Registerbekanntmachung nach dem Umwandlungsgesetz\nBrandenburg Amtsgericht Potsdam HRB 33281\nHaoCare GmbH – Potsdam",
      "type": "Registerbekanntmachung nach dem Umwandlungsgesetz",
      "state": "Brandenburg",
      "amtsgericht": "Amtsgericht Potsdam",
      "registernummer": "HRB 33281",
      "registerart": "HRB",
      "company_name": "HaoCare GmbH",
      "company_seat": "Potsdam",
      "details": "09.01.2025 (Bekanntmachungsdatum)\n\nBrandenburg Amtsgericht Potsdam HRB 33281\nRegisterbekanntmachung nach dem Umwandlungsgesetz 08.01.2025 (Eintragungsdatum)\n\nHaoCare GmbH\nGesellschaft mit beschränkter Haftung\nPotsdam\n\nZu Eintragungsnummer 4 vom 08.01.2025 wird als nicht eingetragen veröffentlicht:Als nicht eingetragen wird veröffentlicht:\nDen Gläubigern der an der Verschmelzung beteiligten Rechtsträger ist, wenn sie binnen sechs Monaten nach dem Tag, an dem die Eintragung der Verschmelzung in das Register des Sitzes desjenigen Rechtsträgers, dessen Gläubiger sie sind, als bekannt gemacht gilt, ihren Anspruch nach Grund und Höhe schriftlich anmelden, Sicherheit zu leisten, soweit sie nicht Befriedigung verlangen können. Dieses Recht steht den Gläubigern jedoch nur zu, wenn sie glaubhaft machen, dass durch die Verschmelzung die Erfüllung ihrer Forderung gefährdet wird"
    },
    {
      "date": "2025-01-09",
      "id": "98186",
      "original_text": "Löschungsankündigung\nSchleswig-Holstein Amtsgericht Flensburg HRB 10964\nUnterhaltungscenter Kiel GmbH – Munkbrarup",
      "type": "Löschungsankündigung",
      "state": "Schleswig-Holstein",
      "amtsgericht": "Amtsgericht Flensburg",
      "registernummer": "HRB 10964",
      "registerart": "HRB",
      "company_name": "Unterhaltungscenter Kiel GmbH",
      "company_seat": "Munkbrarup",
      "details": "09.01.2025 (Bekanntmachungsdatum)\n\nSchleswig-Holstein Amtsgericht Flensburg HRB 10964\nLöschungsankündigung\n\nUnterhaltungscenter Kiel GmbH\nGesellschaft mit beschränkter Haftung\nMunkbrarup\n\nEs ist die Löschung der nachstehenden Gesellschaft wegen Vermögenslosigkeit gemäß § 394 FamFG beabsichtigt.\nWiderspruchsfrist: 2 Monate."
    },
    {
      "date": "2025-01-09",
      "id": "98187",
      "original_text": "Registerbekanntmachung nach dem Umwandlungsgesetz\nSchleswig-Holstein Amtsgericht Kiel HRB 26614\nSmith Music UG (haftungsbeschränkt) – Lehmkuhlen",
      "type": "Registerbekanntmachung nach dem Umwandlungsgesetz",
      "state": "Schleswig-Holstein",
      "amtsgericht": "Amtsgericht Kiel",
      "registernummer": "HRB 26614",
      "registerart": "HRB",
      "company_name": "Smith Music UG (haftungsbeschränkt)",
      "company_seat": "Lehmkuhlen",
      "details": "09.01.2025 (Bekanntmachungsdatum)\n\nSchleswig-Holstein Amtsgericht Kiel HRB 26614\nRegisterbekanntmachung nach dem Umwandlungsgesetz 03.01.2025 (Eintragungsdatum)\n\nSmith Music UG (haftungsbeschränkt)\nGesellschaft mit beschränkter Haftung\nLehmkuhlen\n\nZu Eintragungsnummer 2 vom 03.01.2025 wird als nicht eingetragen veröffentlicht: Als nicht eingetragen wird veröffentlicht: Den Gläubigern der an der Verschmelzung beteiligten Rechtsträger ist, wenn sie binnen sechs Monaten nach dem Tag, an dem die Eintragung der Verschmelzung in das Register des Sitzes desjenigen Rechtsträgers, dessen Gläubiger sie sind, nach § 19 Abs. 3 UmwG bekannt gemacht worden ist, ihren Anspruch nach Grund und Höhe schriftlich anmelden, Sicherheit zu leisten, soweit sie nicht Befriedigung verlangen können. Dieses Recht steht den Gläubigern jedoch nur zu, wenn sie glaubhaft machen, dass durch die Verschmelzung die Erfüllung ihrer Forderung gefährdet wird."
    },
    {
      "date": "2025-01-09",
      "id": "98188",
      "original_text": "Einreichung neuer Dokumente\nSchleswig-Holstein Amtsgericht Kiel HRB 10699\nPLANET-Haus AG – Kiel",
      "type": "Einreichung neuer Dokumente",
      "state": "Schleswig-Holstein",
      "amtsgericht": "Amtsgericht Kiel",
      "registernummer": "HRB 10699",
      "registerart": "HRB",
      "company_name": "PLANET-Haus AG",
      "company_seat": "Kiel",
      "details": "09.01.2025 (Bekanntmachungsdatum)\n\nSchleswig-Holstein Amtsgericht Kiel HRB 10699\nEinreichung neuer Dokumente\n\nPLANET-Haus AG\nAktiengesellschaft\nKiel\n\nEine neue Liste der Aufsichtsratsmitglieder ist eingereicht worden."
    },
    {
      "date": "2025-01-09",
      "id": "98189",
      "original_text": "Registerbekanntmachung nach dem Umwandlungsgesetz\nBerlin Amtsgericht Berlin (Charlottenburg) HRA 59633\n\"kolor\" - Uli Meyer und Tatjana Reimann oHG – Berlin",
      "type": "Registerbekanntmachung nach dem Umwandlungsgesetz",
      "state": "Berlin",
      "amtsgericht": "Amtsgericht Berlin (Charlottenburg)",
      "registernummer": "HRA 59633",
      "registerart": "HRA",
      "company_name": "\"kolor\" - Uli Meyer und Tatjana Reimann oHG",
      "company_seat": "Berlin",
      "details": "09.01.2025 (Bekanntmachungsdatum)\n\nBerlin Amtsgericht Berlin (Charlottenburg) HRA 59633\nRegisterbekanntmachung nach dem Umwandlungsgesetz 08.01.2025 (Eintragungsdatum)\n\n\"kolor\" - Uli Meyer und Tatjana Reimann oHG\nOffene Handelsgesellschaft\nBerlin\n\nZu Eintragungsnummer 2 vom 08.01.2025 wird als nicht eingetragen veröffentlicht: Den Gläubigern ist, wenn sie binnen sechs Monaten nach dem Tag, an dem die Eintragung der Umwandlung als bekannt gemacht gilt, ihren Anspruch nach Grund und Höhe schriftlich anmelden, Sicherheit zu leisten, soweit sie nicht Befriedigung verlangen können. Dieses Recht steht den Gläubigern jedoch nur zu, wenn sie glaubhaft machen, dass durch die Umwandlung die Erfüllung ihrer Forderung gefährdet wird. Das Recht, Sicherheitsleistung zu verlangen, steht Gläubigern nicht zu, die im Falle der Insolvenz ein Recht auf vorzugsweise Befriedigung aus einer Deckungsmasse haben, die nach gesetzlicher Vorschrift zu ihrem Schutz errichtet und staatlich überwacht ist."
    },
    {
      "date": "2025-01-09",
      "id": "98190",
      "original_text": "Registerbekanntmachung nach dem Umwandlungsgesetz\nBerlin Amtsgericht Berlin (Charlottenburg) HRB 270920\nstudio kolor GmbH – Berlin",
      "type": "Registerbekanntmachung nach dem Umwandlungsgesetz",
      "state": "Berlin",
      "amtsgericht": "Amtsgericht Berlin (Charlottenburg)",
      "registernummer": "HRB 270920",
      "registerart": "HRB",
      "company_name": "studio kolor GmbH",
      "company_seat": "Berlin",
      "details": "09.01.2025 (Bekanntmachungsdatum)\n\nBerlin Amtsgericht Berlin (Charlottenburg) HRB 270920\nRegisterbekanntmachung nach dem Umwandlungsgesetz 08.01.2025 (Eintragungsdatum)\n\nstudio kolor GmbH\nGesellschaft mit beschränkter Haftung\nBerlin\n\nZu Eintragungsnummer 1 vom 08.01.2025 wird als nicht eingetragen veröffentlicht: Den Gläubigern ist, wenn sie binnen sechs Monaten nach dem Tag, an dem die Eintragung der Umwandlung als bekannt gemacht gilt, ihren Anspruch nach Grund und Höhe schriftlich anmelden, Sicherheit zu leisten, soweit sie nicht Befriedigung verlangen können. Dieses Recht steht den Gläubigern jedoch nur zu, wenn sie glaubhaft machen, dass durch die Umwandlung die Erfüllung ihrer Forderung gefährdet wird. Das Recht, Sicherheitsleistung zu verlangen, steht Gläubigern nicht zu, die im Falle der Insolvenz ein Recht auf vorzugsweise Befriedigung aus einer Deckungsmasse haben, die nach gesetzlicher Vorschrift zu ihrem Schutz errichtet und staatlich überwacht ist."
    },
    {
      "date": "2025-01-09",
      "id": "98191",
      "original_text": "Einreichung neuer Dokumente\nSchleswig-Holstein Amtsgericht Kiel HRB 10179\nCarlshöhe Bauträger Verwaltung GmbH – Damp",
      "type": "Einreichung neuer Dokumente",
      "state": "Schleswig-Holstein",
      "amtsgericht": "Amtsgericht Kiel",
      "registernummer": "HRB 10179",
      "registerart": "HRB",
      "company_name": "Carlshöhe Bauträger Verwaltung GmbH",
      "company_seat": "Damp",
      "details": "09.01.2025 (Bekanntmachungsdatum)\n\nSchleswig-Holstein Amtsgericht Kiel HRB 10179\nEinreichung neuer Dokumente\n\nCarlshöhe Bauträger Verwaltung GmbH\nGesellschaft mit beschränkter Haftung\nDamp\n\nEine neue Liste der Aufsichtsratsmitglieder ist eingereicht worden."
    },
    {
      "date": "2025-01-09",
      "id": "98192",
      "original_text": "Einreichung neuer Dokumente\nBrandenburg Amtsgericht Cottbus HRB 3220\nHGB Haus-und Grundbesitzgesellschaft Bad Liebenwerda mbH – Bad Liebenwerda",
      "type": "Einreichung neuer Dokumente",
      "state": "Brandenburg",
      "amtsgericht": "Amtsgericht Cottbus",
      "registernummer": "HRB 3220",
      "registerart": "HRB",
      "company_name": "HGB Haus-und Grundbesitzgesellschaft Bad Liebenwerda mbH",
      "company_seat": "Bad Liebenwerda",
      "details": "09.01.2025 (Bekanntmachungsdatum)\n\nBrandenburg Amtsgericht Cottbus HRB 3220\nEinreichung neuer Dokumente\n\nHGB Haus-und Grundbesitzgesellschaft Bad Liebenwerda mbH\nGesellschaft mit beschränkter Haftung\nBad Liebenwerda\n\nAls nicht eingetragen wird veröffentlicht: Der Geschäftsführer hat eine Liste der Aufsichtsratsmitglieder gem. § 52 Abs. 2 Satz 2 GmbHG zum Handelsregister eingereicht"
    },
    {
      "date": "2025-01-09",
      "id": "98193",
      "original_text": "Sonstige Registerbekanntmachung\nBaden-Württemberg Amtsgericht Ulm HRB 501628\nCarl Zeiss EUV Metrology and lnspection GmbH – Oberkochen",
      "type": "Sonstige Registerbekanntmachung",
      "state": "Baden-Württemberg",
      "amtsgericht": "Amtsgericht Ulm",
      "registernummer": "HRB 501628",
      "registerart": "HRB",
      "company_name": "Carl Zeiss EUV Metrology and lnspection GmbH",
      "company_seat": "Oberkochen",
      "details": "09.01.2025 (Bekanntmachungsdatum)\n\nBaden-Württemberg Amtsgericht Ulm HRB 501628\nSonstige Registerbekanntmachung 08.01.2025 (Eintragungsdatum)\n\nCarl Zeiss EUV Metrology and lnspection GmbH\nGesellschaft mit beschränkter Haftung\nOberkochen\n\nAls nicht eingetragen wird bekanntgemacht:\nDen Gläubigern der Gesellschaft, deren Forderungen begründet worden sind, bevor die Eintragung der Beendigung des Vertrages in das Handelsregister nach § 10 HGB als bekanntgemacht gilt, ist vom anderen Vertragsteil Sicherheit zu leisten, wenn sie sich binnen sechs Monaten nach der Bekanntmachung zu diesem Zweck bei ihm melden."
    },
    {
      "date": "2025-01-09",
      "id": "98194",
      "original_text": "Einreichung neuer Dokumente\nBaden-Württemberg Amtsgericht Stuttgart HRB 720915\nKlinikverbund Südwest gGmbH – Böblingen",
      "type": "Einreichung neuer Dokumente",
      "state": "Baden-Württemberg",
      "amtsgericht": "Amtsgericht Stuttgart",
      "registernummer": "HRB 720915",
      "registerart": "HRB",
      "company_name": "Klinikverbund Südwest gGmbH",
      "company_seat": "Böblingen",
      "details": "09.01.2025 (Bekanntmachungsdatum)\n\nBaden-Württemberg Amtsgericht Stuttgart HRB 720915\nEinreichung neuer Dokumente\n\nKlinikverbund Südwest gGmbH\nGesellschaft mit beschränkter Haftung\nBöblingen\n\nDie Gesellschaft hat am 08.01.2025 die Liste über die Zusammensetzung des Aufsichtsrats zum Handelsregister eingereicht."
    },
    {
      "date": "2025-01-09",
      "id": "98195",
      "original_text": "Löschungsankündigung\nBerlin Amtsgericht Berlin (Charlottenburg) HRB 157148\nGima Food GmbH – Berlin",
      "type": "Löschungsankündigung",
      "state": "Berlin",
      "amtsgericht": "Amtsgericht Berlin (Charlottenburg)",
      "registernummer": "HRB 157148",
      "registerart": "HRB",
      "company_name": "Gima Food GmbH",
      "company_seat": "Berlin",
      "details": "09.01.2025 (Bekanntmachungsdatum)\n\nBerlin Amtsgericht Berlin (Charlottenburg) HRB 157148\nLöschungsankündigung\n\nGima Food GmbH\nGesellschaft mit beschränkter Haftung\nBerlin\n\nBei der nachstehenden Gesellschaft wird das Amtslöschungsverfahren gemäß § 394 FamFG eingeleitet. Widerspruchsfrist 6 Wochen"
    },
    {
      "date": "2025-01-09",
      "id": "98196",
      "original_text": "Registerbekanntmachung nach dem Umwandlungsgesetz\nBrandenburg Amtsgericht Frankfurt/Oder HRA 4352\nJens Goldmann e.K. – Fürstenwalde (Spree)",
      "type": "Registerbekanntmachung nach dem Umwandlungsgesetz",
      "state": "Brandenburg",
      "amtsgericht": "Amtsgericht Frankfurt/Oder",
      "registernummer": "HRA 4352",
      "registerart": "HRA",
      "company_name": "Jens Goldmann e.K.",
      "company_seat": "Fürstenwalde (Spree)",
      "details": "09.01.2025 (Bekanntmachungsdatum)\n\nBrandenburg Amtsgericht Frankfurt/Oder HRA 4352\nRegisterbekanntmachung nach dem Umwandlungsgesetz 03.12.2024 (Eintragungsdatum)\n\nJens Goldmann e.K.\nEinzelkaufmann / Einzelkauffrau\nFürstenwalde (Spree)\n\nZu Eintragungsnummer 3 vom 03.12.2024 wird als nicht eingetragen veröffentlicht:\nDen Gläubigern der an der Umwandlung beteiligten Rechtsträger ist, wenn sie binnen sechs Monaten nach dem Tag, an dem die Eintragung der Umwandlung in das Register des Sitzes desjenigen Rechtsträgers, dessen Gläubiger sie sind, als bekannt gemacht gilt, ihren Anspruch nach Grund und Höhe schriftlich anmelden, Sicherheit zu leisten, soweit sie nicht Befriedigung verlangen können. Dieses Recht steht den Gläubigern jedoch nur zu, wenn sie glaubhaft machen, dass durch die Umwandlung die Erfüllung ihrer Forderung gefährdet wird"
    },
    {
      "date": "2025-01-09",
      "id": "98197",
      "original_text": "Einreichung neuer Dokumente\nHamburg Amtsgericht Hamburg HRB 111980\nDeutsche SeeHansa AG – Hamburg",
      "type": "Einreichung neuer Dokumente",
      "state": "Hamburg",
      "amtsgericht": "Amtsgericht Hamburg",
      "registernummer": "HRB 111980",
      "registerart": "HRB",
      "company_name": "Deutsche SeeHansa AG",
      "company_seat": "Hamburg",
      "details": "09.01.2025 (Bekanntmachungsdatum)\n\nHamburg Amtsgericht Hamburg HRB 111980\nEinreichung neuer Dokumente 09.01.2025 (Eintragungsdatum)\n\nDeutsche SeeHansa AG\nAktiengesellschaft\nHamburg\n\nAls nicht eingetragen wird bekannt gemacht: Liste des Aufsichtsrats wurde eingereicht."
    },
    {
      "date": "2025-01-09",
      "id": "98198",
      "original_text": "Sonstige Registerbekanntmachung\nBaden-Württemberg Amtsgericht Ulm HRB 641594\nStadtwerke Biberach GmbH – Biberach an der Riß",
      "type": "Sonstige Registerbekanntmachung",
      "state": "Baden-Württemberg",
      "amtsgericht": "Amtsgericht Ulm",
      "registernummer": "HRB 641594",
      "registerart": "HRB",
      "company_name": "Stadtwerke Biberach GmbH",
      "company_seat": "Biberach an der Riß",
      "details": "09.01.2025 (Bekanntmachungsdatum)\n\nBaden-Württemberg Amtsgericht Ulm HRB 641594\nSonstige Registerbekanntmachung\n\nStadtwerke Biberach GmbH\nGesellschaft mit beschränkter Haftung\nBiberach an der Riß\n\nDie Gesellschaft hat am 08.01.2025 die Liste über die Zusammensetzung des Aufsichtsrats zum Handelsregister eingereicht."
    },
    {
      "date": "2025-01-09",
      "id": "98199",
      "original_text": "Sonstige Registerbekanntmachung\nSchleswig-Holstein Amtsgericht Pinneberg HRB 4277\npluss Personalmanagement Pinneberg GmbH – Pinneberg",
      "type": "Sonstige Registerbekanntmachung",
      "state": "Schleswig-Holstein",
      "amtsgericht": "Amtsgericht Pinneberg",
      "registernummer": "HRB 4277",
      "registerart": "HRB",
      "company_name": "pluss Personalmanagement Pinneberg GmbH",
      "company_seat": "Pinneberg",
      "details": "09.01.2025 (Bekanntmachungsdatum)\n\nSchleswig-Holstein Amtsgericht Pinneberg HRB 4277\nSonstige Registerbekanntmachung 09.01.2025 (Eintragungsdatum)\n\npluss Personalmanagement Pinneberg GmbH\nGesellschaft mit beschränkter Haftung\nPinneberg\n\nAls nicht eingetragen wird veröffentlicht: Der mit der pluss Personalmanagement GmbH mit Sitz in Hamburg (Amtsgericht Hamburg, HRB 32257)bestehende Gewinnabführungsvertrag vom 05.08.2022 ist zum 31.12.2024 beendet. Als nicht eingetragen wird veröffentlicht: Der andere Vertragsteil hat den Gläubigern dieses Rechtsträgers, dessen Forderungen begründet worden sind, bevor die Eintragung der Beendigung dieses Vertrages in das Handelsregister nach § 10 des Handelsgesetzbuches als bekannt gemacht gilt, Sicherheit zu leisten, wenn sie sich binnen sechs Monaten nach der Bekanntmachung der Eintragung zu diesem Zweck bei ihm melden. Dieses Recht steht den Gläubigern nicht zu, die im Fall des Insolvenzverfahrens ein Recht auf vorzugsweise Befriedigung aus der Deckungsmasse haben, die nach gesetzlicher Vorschrift zu ihrem Schutz errichtet und staatlich überwacht ist."
    },
    {
      "date": "2025-01-09",
      "id": "98200",
      "original_text": "Löschungsankündigung\nBrandenburg Amtsgericht Potsdam HRB 13266\nWerner Wils Baugesellschaft mbH – Phöben",
      "type": "Löschungsankündigung",
      "state": "Brandenburg",
      "amtsgericht": "Amtsgericht Potsdam",
      "registernummer": "HRB 13266",
      "registerart": "HRB",
      "company_name": "Werner Wils Baugesellschaft mbH",
      "company_seat": "Phöben",
      "details": "09.01.2025 (Bekanntmachungsdatum)\n\nBrandenburg Amtsgericht Potsdam HRB 13266\nLöschungsankündigung\n\nWerner Wils Baugesellschaft mbH\nGesellschaft mit beschränkter Haftung\nPhöben\n\nBei der nachstehenden Gesellschaft wird das Amtslöschungsverfahren gemäß § 394 FamFG eingeleitet. Widerspruchsfrist: 8 Wochen."
    },
    {
      "date": "2025-01-09",
      "id": "98201",
      "original_text": "Registerbekanntmachung nach dem Umwandlungsgesetz\nSachsen Amtsgericht Leipzig HRB 21455\nHAEMA AG – Leipzig",
      "type": "Registerbekanntmachung nach dem Umwandlungsgesetz",
      "state": "Sachsen",
      "amtsgericht": "Amtsgericht Leipzig",
      "registernummer": "HRB 21455",
      "registerart": "HRB",
      "company_name": "HAEMA AG",
      "company_seat": "Leipzig",
      "details": "09.01.2025 (Bekanntmachungsdatum)\n\nSachsen Amtsgericht Leipzig HRB 21455\nRegisterbekanntmachung nach dem Umwandlungsgesetz 09.01.2025 (Eintragungsdatum)\n\nHAEMA AG\nAktiengesellschaft\nLeipzig\n\nDen Gläubigern der an der Umwandlung beteiligten Rechtsträger ist, wenn sie binnen sechs Monaten nach dem Tag, an dem die Eintragung der Umwandlung in das Register des Sitzes desjenigen Rechtsträgers, dessen Gläubiger sie sind, nach § 19 Abs. 3 UmwG als bekannt gemacht gilt, ihren Anspruch nach Grund und Höhe in Textform anmelden, Sicherheit zu leisten, soweit sie nicht Befriedigung verlangen können. Dieses Recht steht den Gläubigern jedoch nur zu, wenn sie glaubhaft machen, dass durch die Umwandlung die Erfüllung der Forderung gefährdet wird."
    },
    {
      "date": "2025-01-09",
      "id": "98202",
      "original_text": "Registerbekanntmachung nach dem Umwandlungsgesetz\nSachsen Amtsgericht Dresden HRB 46075\nSunfire AG – Dresden",
      "type": "Registerbekanntmachung nach dem Umwandlungsgesetz",
      "state": "Sachsen",
      "amtsgericht": "Amtsgericht Dresden",
      "registernummer": "HRB 46075",
      "registerart": "HRB",
      "company_name": "Sunfire AG",
      "company_seat": "Dresden",
      "details": "09.01.2025 (Bekanntmachungsdatum)\n\nSachsen Amtsgericht Dresden HRB 46075\nRegisterbekanntmachung nach dem Umwandlungsgesetz\n\nSunfire AG\nAktiengesellschaft\nDresden\n\nGemäß Art. 210 SEVO i.V.m. § 61 UmwG wird mitgeteilt,\na) dass der notariell beurkundete Verschmelzungsplan vom 20.12.2024 einschließlich satzungsentwurf für die Sunfire SE (UVz Nr. 5454/2024-H-v. 20.12.2024) beim Handelsregister des Amtsgerichts Dresden am 20.12.2024 HRB 46075 eingereicht worden sind (§ 61 S. 2 UmwG).\nb) wird gem. Art. 21 SEVO i.V.m. § 61 UmwG gem. § 10 HGB veröffentlicht:\n\n1. Angaben gemäß Artikel 21 lit. a) SE-VO:\nAn der Verschmelzung sind beteiligt\n- die Sunfire AG (Rechtsform: Aktiengesellschaft nach dem Recht der Bundesrepublik\nDeutschland) mit Sitz in D-01237 Dresden als aufnehmende Gesellschaft, eingetragen im\nHandelsregister des Amtsgerichts Dresden unter HRB 46075\n- die Sunfire AG (Rechtsform: Aktiengesellschaft nach dem Recht der Republik Österreich)\nmit Sitz in A-1040 Wien, Maderstraße 1/12, eingetragen im Firmenbuch des Handelsgerichts Wien unter FN 612164 t\n\n2. Angaben gemäß Artikel 21 lit. b) SE-VO:\nDie in Artikel 3 Abs. 2 der KL 68/151/EWG (Publizitätsrichtlinie) genannten Urkunden sind hinterlegt:\nfür die Sunfire AG mit Sitz in Wien/Osterreich beim Firmenbuch des Handelsgerichts Wien\nunter FN6l2l64t\nfür die Sunfire AG mit Sitz in Dresden/Deutschland beim Handelsregister des Amtsgerichts\nDresden unter HRB 46075.\n\n3. Angaben gemäß Artikel 21 lit. c) SE-VO:\nGläubigern, die einen Anspruch gegen die Gesellschaft haben, wird Sicherheit geleistet, wenn sie innerhalb von sechs Monaten (Artikel 24 Abs. 1 SE-VO in Verbindung mit § 22 UmwG) nach Offenlegung der Eintragung (Artikel 15 Abs. 2 SE-VO) ihre Forderung dem Grunde und der Höhe nach schriftlich geltend machen. Der Anspruch steht den Gläubigern nur insoweit zu, als dass sie glaubhaft machen können, dass ihre Ansprüche durch die Verschmelzung gefährdet sind und sie nicht bereits Befriedigung verlangen können. Die Anmeldung ist zu richten an\nSunfire SE\nz.H. des Vorstandes\nGasanstaltstraße 2, 01237 Dresden.\nUnter dieser Anschrift können kostenlos erschöpfende Auskünfte über diese Modalitäten eingeholt werden.\n\n4. Angaben gemäß Artikel 21 lit. d) SE-VO:\nAngaben zu den Modalitäten für die Ausübung der Rechte der Minderheitsaktionäre der an der Verschmelzung beteiligten Aktiengesellschaften gemäß Artikel 21 lit. d) SE-VO sind nicht erforderlich, weil bei der übertragenden Aktiengesellschaft keine Minderheitsaktionäre vorhanden sind. Die auf\nnehmende Aktiengesellschaft hält alle Aktien der übertragenden Aktiengesellschaft.\nHinsichtlich der Rechte der Minderheitsaktionäre der aufnehmenden Gesellschaft führt die Verschmelzung zu keinen Änderungen. Sämtliche Aktionäre werden durch die im Verschmelzungsplan aufgenommenen Satzungsentwurf der SE genauso gestellt, wie vor der Verschmelzung in der  Rechtsform der AG. Insbesondere ändert sich durch die Verschmelzung nicht die Höhe Ihrer Beteiligung an der aufnehmenden Gesellschaft. Alle satzungsmäßigen Rechte und Pflichten der Aktionäre\nwerden in der SE entsprechend fortgesetzt.\nDa Umtauschverhältnis und Abfindungsangebot nicht anzugeben waren, sind § 6 SEAG (Verbesserung des Umtauschverhältnisses) und § 7 (Abfindungsangebot im Verschmelzungsplan) nicht einschlägig.\n\n5. Angaben gemäß Artikel 21 lit. e) SE-VO:\nDie durch die Verschmelzung gegründete SE wird unter Sunfire SE firmieren und ihren Sitz unverändert in 01237 Dresden, Gasanstaltstraße 2, Bundesrepublik Deutschland, haben."
    },
    {
      "date": "2025-01-09",
      "id": "98203",
      "original_text": "Löschungsankündigung\nSachsen Amtsgericht Dresden HRB 33803\nÖDR-Dienstleistungen UG (haftungsbeschränkt) – Heidenau",
      "type": "Löschungsankündigung",
      "state": "Sachsen",
      "amtsgericht": "Amtsgericht Dresden",
      "registernummer": "HRB 33803",
      "registerart": "HRB",
      "company_name": "ÖDR-Dienstleistungen UG (haftungsbeschränkt)",
      "company_seat": "Heidenau",
      "details": "09.01.2025 (Bekanntmachungsdatum)\n\nSachsen Amtsgericht Dresden HRB 33803\nLöschungsankündigung\n\nÖDR-Dienstleistungen UG (haftungsbeschränkt)\nGesellschaft mit beschränkter Haftung\nHeidenau\n\nDas Registergericht beabsichtigt, die im Handelsregister eingetragene Gesellschaft von Amts wegen nach § 394 FamFG zu löschen. Die Frist zu Erhebung eines Widerspruchs gegen die beabsichtigte Löschung wird auf einen Monat festgesetzt."
    },
    {
      "date": "2025-01-09",
      "id": "98204",
      "original_text": "Einreichung neuer Dokumente\nSachsen Amtsgericht Dresden HRB 23572\nStadtbäder und Freizeitanlagen GmbH Radebeul – Radebeul",
      "type": "Einreichung neuer Dokumente",
      "state": "Sachsen",
      "amtsgericht": "Amtsgericht Dresden",
      "registernummer": "HRB 23572",
      "registerart": "HRB",
      "company_name": "Stadtbäder und Freizeitanlagen GmbH Radebeul",
      "company_seat": "Radebeul",
      "details": "09.01.2025 (Bekanntmachungsdatum)\n\nSachsen Amtsgericht Dresden HRB 23572\nEinreichung neuer Dokumente 09.01.2025 (Eintragungsdatum)\n\nStadtbäder und Freizeitanlagen GmbH Radebeul\nGesellschaft mit beschränkter Haftung\nRadebeul\n\nAm 03.01.2025 wurde beim Handelsregister des Amtsgerichts Dresden die Liste der Mitglieder des Aufsichtsrats gemäß § 52 GmbHG eingereicht."
    },
    {
      "date": "2025-01-09",
      "id": "98205",
      "original_text": "Registerbekanntmachung nach dem Umwandlungsgesetz\nNiedersachsen Amtsgericht Walsrode HRA 200997\nH.W. Energie u. Technik GmbH & Co. KG – Hassel",
      "type": "Registerbekanntmachung nach dem Umwandlungsgesetz",
      "state": "Niedersachsen",
      "amtsgericht": "Amtsgericht Walsrode",
      "registernummer": "HRA 200997",
      "registerart": "HRA",
      "company_name": "H.W. Energie u. Technik GmbH & Co. KG",
      "company_seat": "Hassel",
      "details": "09.01.2025 (Bekanntmachungsdatum)\n\nNiedersachsen Amtsgericht Walsrode HRA 200997\nRegisterbekanntmachung nach dem Umwandlungsgesetz 09.01.2025 (Eintragungsdatum)\n\nH.W. Energie u. Technik GmbH & Co. KG\nKommanditgesellschaft\nHassel\n\nDen Gläubigern der an der Verschmelzung beteiligten Rechtsträger ist, wenn sie binnen sechs Monaten nach dem Tag, an dem die Eintragung der Verschmelzung in das Register des Sitzes desjenigen Rechtsträgers, dessen Gläubiger sie sind, nach § 19  Abs.  3 UmwG als bekannt gemacht gilt, ihren Anspruch nach Grund und Höhe schriftlich anmelden, Sicherheit zu leisten, soweit sie nicht Befriedigung verlangen können. Dieses Recht steht den Gläubigern jedoch nur zu, wenn sie glaubhaft machen, dass durch die Verschmelzung die Erfüllung der Forderung gefährdet wird."
    },
    {
      "date": "2025-01-09",
      "id": "98206",
      "original_text": "Registerbekanntmachung nach dem Umwandlungsgesetz\nNiedersachsen Amtsgericht Lüneburg HRB 100047 früher Amtsgericht Celle\nHarling Beteiligungsgesellschaft mit beschränkter Haftung – Eversen",
      "type": "Registerbekanntmachung nach dem Umwandlungsgesetz",
      "state": "Niedersachsen",
      "amtsgericht": "Amtsgericht Lüneburg",
      "registernummer": "HRB 100047",
      "registerart": "HRB",
      "company_name": "Harling Beteiligungsgesellschaft mit beschränkter Haftung",
      "company_seat": "Eversen",
      "former_amtsgericht": "Celle",
      "details": "09.01.2025 (Bekanntmachungsdatum)\n\nNiedersachsen Amtsgericht Lüneburg HRB 100047 früher Amtsgericht Celle\nRegisterbekanntmachung nach dem Umwandlungsgesetz 09.01.2025 (Eintragungsdatum)\n\nHarling Beteiligungsgesellschaft mit beschränkter Haftung\nGesellschaft mit beschränkter Haftung\nEversen\n\nDen Gläubigern der an der Verschmelzung beteiligten Rechtsträger ist, wenn sie binnen sechs Monaten nach dem Tag, an dem die Eintragung der Verschmelzung in das Register des Sitzes desjenigen Rechtsträgers, dessen Gläubiger sie sind, nach § 19  Abs.  3 UmwG als bekannt gemacht gilt, ihren Anspruch nach Grund und Höhe schriftlich anmelden, Sicherheit zu leisten, soweit sie nicht Befriedigung verlangen können. Dieses Recht steht den Gläubigern jedoch nur zu, wenn sie glaubhaft machen, dass durch die Verschmelzung die Erfüllung der Forderung gefährdet wird."
    },
    {
      "date": "2025-01-09",
      "id": "98207",
      "original_text": "Registerbekanntmachung nach dem Umwandlungsgesetz\nNiedersachsen Amtsgericht Walsrode HRA 204622\nHof Heimsoth No. 4 Dienstleistungs OHG – Hassel",
      "type": "Registerbekanntmachung nach dem Umwandlungsgesetz",
      "state": "Niedersachsen",
      "amtsgericht": "Amtsgericht Walsrode",
      "registernummer": "HRA 204622",
      "registerart": "HRA",
      "company_name": "Hof Heimsoth No. 4 Dienstleistungs OHG",
      "company_seat": "Hassel",
      "details": "09.01.2025 (Bekanntmachungsdatum)\n\nNiedersachsen Amtsgericht Walsrode HRA 204622\nRegisterbekanntmachung nach dem Umwandlungsgesetz 09.01.2025 (Eintragungsdatum)\n\nHof Heimsoth No. 4 Dienstleistungs OHG\nOffene Handelsgesellschaft\nHassel\n\nDen Gläubigern der an der Verschmelzung beteiligten Rechtsträger ist, wenn sie binnen sechs Monaten nach dem Tag, an dem die Eintragung der Verschmelzung in das Register des Sitzes desjenigen Rechtsträgers, dessen Gläubiger sie sind, nach § 19  Abs.  3 UmwG als bekannt gemacht gilt, ihren Anspruch nach Grund und Höhe schriftlich anmelden, Sicherheit zu leisten, soweit sie nicht Befriedigung verlangen können. Dieses Recht steht den Gläubigern jedoch nur zu, wenn sie glaubhaft machen, dass durch die Verschmelzung die Erfüllung der Forderung gefährdet wird."
    },
    {
      "date": "2025-01-09",
      "id": "98208",
      "original_text": "Löschungsankündigung\nNiedersachsen Amtsgericht Osnabrück HRB 120193 früher Amtsgericht Meppen\nStehmann GmbH – Geeste-Osterbrock",
      "type": "Löschungsankündigung",
      "state": "Niedersachsen",
      "amtsgericht": "Amtsgericht Osnabrück",
      "registernummer": "HRB 120193",
      "registerart": "HRB",
      "company_name": "Stehmann GmbH",
      "company_seat": "Geeste-Osterbrock",
      "former_amtsgericht": "Meppen",
      "details": "09.01.2025 (Bekanntmachungsdatum)\n\nNiedersachsen Amtsgericht Osnabrück HRB 120193 früher Amtsgericht Meppen\nLöschungsankündigung\n\nStehmann GmbH\nGesellschaft mit beschränkter Haftung\nGeeste-Osterbrock\n\nDas Registergericht beabsichtigt, die Gesellschaft von Amts wegen nach § 394 FamFG wegen Vermögenslosigkeit zu löschen. Die Frist zur Erhebung eines Widerspruchs ist auf 1 Monat ab dieser Registerbekanntmachung festgesetzt."
    },
    {
      "date": "2025-01-09",
      "id": "98209",
      "original_text": "Löschungsankündigung\nBremen Amtsgericht Bremen HRB 39008\nMKG GmbH – Bremen",
      "type": "Löschungsankündigung",
      "state": "Bremen",
      "amtsgericht": "Amtsgericht Bremen",
      "registernummer": "HRB 39008",
      "registerart": "HRB",
      "company_name": "MKG GmbH",
      "company_seat": "Bremen",
      "details": "09.01.2025 (Bekanntmachungsdatum)\n\nBremen Amtsgericht Bremen HRB 39008\nLöschungsankündigung\n\nMKG GmbH\nGesellschaft mit beschränkter Haftung\nBremen\n\nEs ist beabsichtigt die im Handelsregister eingetragene Gesellschaft von Amts wegen gemäß § 394 FamFG zu löschen. Gegen die Löschung kann beim AG Bremen schriftlich oder zu Protokoll der Geschäftsstelle Widerspruch eingelegt werden. Widerspruchsfrist 4 Wochen."
    },
    {
      "date": "2025-01-09",
      "id": "98210",
      "original_text": "Löschungsankündigung\nBremen Amtsgericht Bremen HRB 30157\nEcole Suit GmbH – Bremen",
      "type": "Löschungsankündigung",
      "state": "Bremen",
      "amtsgericht": "Amtsgericht Bremen",
      "registernummer": "HRB 30157",
      "registerart": "HRB",
      "company_name": "Ecole Suit GmbH",
      "company_seat": "Bremen",
      "details": "09.01.2025 (Bekanntmachungsdatum)\n\nBremen Amtsgericht Bremen HRB 30157\nLöschungsankündigung\n\nEcole Suit GmbH\nGesellschaft mit beschränkter Haftung\nBremen\n\nEs ist beabsichtigt die im Handelsregister eingetragene Gesellschaft von Amts wegen gemäß § 394 FamFG zu löschen. Gegen die Löschung kann beim AG Bremen schriftlich oder zu Protokoll der Geschäftsstelle Widerspruch eingelegt werden. Widerspruchsfrist 4 Wochen."
    },
    {
      "date": "2025-01-09",
      "id": "98211",
      "original_text": "Sonstige Registerbekanntmachung\nRheinland-Pfalz Amtsgericht Ludwigshafen a.Rhein (Ludwigshafen) HRB 4970\nBASF AGRO TRADEMARKS GmbH – Ludwigshafen",
      "type": "Sonstige Registerbekanntmachung",
      "state": "Rheinland-Pfalz",
      "amtsgericht": "Amtsgericht Ludwigshafen a.Rhein (Ludwigshafen)",
      "registernummer": "HRB 4970",
      "registerart": "HRB",
      "company_name": "BASF AGRO TRADEMARKS GmbH",
      "company_seat": "Ludwigshafen",
      "details": "09.01.2025 (Bekanntmachungsdatum)\n\nRheinland-Pfalz Amtsgericht Ludwigshafen a.Rhein (Ludwigshafen) HRB 4970\nSonstige Registerbekanntmachung 07.01.2025 (Eintragungsdatum)\n\nBASF AGRO TRADEMARKS GmbH\nGesellschaft mit beschränkter Haftung\nLudwigshafen\n\nAls nicht eingetragen wird veröffentlicht: Den Gläubigern der Gesellschaft, deren Forderungen begründet worden sind, bevor die Eintragung der Beendigung des Beherrschungs- und Ergebnisabführungsvertrages in das Handelsregister nach § 10 des Handelsgesetzbuches als bekanntgemacht gilt, hat der andere Vertragsteil Sicherheit zu leisten, wenn sie sich binnen sechs Monaten nach der Bekanntmachung der Eintragung zu diesem Zweck bei ihm melden."
    },
    {
      "date": "2025-01-09",
      "id": "98212",
      "original_text": "Sonstige Registerbekanntmachung\nRheinland-Pfalz Amtsgericht Mainz HRB 7498\nDB Cargo Aktiengesellschaft – Mainz",
      "type": "Sonstige Registerbekanntmachung",
      "state": "Rheinland-Pfalz",
      "amtsgericht": "Amtsgericht Mainz",
      "registernummer": "HRB 7498",
      "registerart": "HRB",
      "company_name": "DB Cargo Aktiengesellschaft",
      "company_seat": "Mainz",
      "details": "09.01.2025 (Bekanntmachungsdatum)\n\nRheinland-Pfalz Amtsgericht Mainz HRB 7498\nSonstige Registerbekanntmachung 08.01.2025 (Eintragungsdatum)\n\nDB Cargo Aktiengesellschaft\nAktiengesellschaft\nMainz\n\nAls nicht eingetragen wird veröffentlicht: Den Gläubigern der Gesellschaft, deren Forderungen begründet worden sind, bevor die Eintragung der Beendigung des Beherrschungs- undGewinnabführungsvertrages in das Handelsregister nach § 10 des Handelsgesetzbuches als bekanntgemacht gilt, hat der andere Vertragsteil Sicherheit zu leisten, wenn sie sich binnen sechs Monaten nach der Bekanntmachung der Eintragung zu diesem Zweck bei ihm melden."
    },
    {
      "date": "2025-01-09",
      "id": "98213",
      "original_text": "Einreichung neuer Dokumente\nRheinland-Pfalz Amtsgericht Wittlich HRB 40577\nJT International Germany GmbH – Trier",
      "type": "Einreichung neuer Dokumente",
      "state": "Rheinland-Pfalz",
      "amtsgericht": "Amtsgericht Wittlich",
      "registernummer": "HRB 40577",
      "registerart": "HRB",
      "company_name": "JT International Germany GmbH",
      "company_seat": "Trier",
      "details": "09.01.2025 (Bekanntmachungsdatum)\n\nRheinland-Pfalz Amtsgericht Wittlich HRB 40577\nEinreichung neuer Dokumente 09.01.2025 (Eintragungsdatum)\n\nJT International Germany GmbH\nGesellschaft mit beschränkter Haftung\nTrier\n\nDem Registergericht ist eine neue Liste der Mitglieder des Aufsichtsrates eingereicht worden."
    },
    {
      "date": "2025-01-09",
      "id": "98214",
      "original_text": "Registerbekanntmachung nach dem Umwandlungsgesetz\nNordrhein-Westfalen Amtsgericht Bochum HRA 8081\nBatterie-Spezialgroßhandlung Günther Lenz GmbH & Co. KG – Bochum",
      "type": "Registerbekanntmachung nach dem Umwandlungsgesetz",
      "state": "Nordrhein-Westfalen",
      "amtsgericht": "Amtsgericht Bochum",
      "registernummer": "HRA 8081",
      "registerart": "HRA",
      "company_name": "Batterie-Spezialgroßhandlung Günther Lenz GmbH & Co. KG",
      "company_seat": "Bochum",
      "details": "09.01.2025 (Bekanntmachungsdatum)\n\nNordrhein-Westfalen Amtsgericht Bochum HRA 8081\nRegisterbekanntmachung nach dem Umwandlungsgesetz 07.01.2025 (Eintragungsdatum)\n\nBatterie-Spezialgroßhandlung Günther Lenz GmbH & Co. KG\nKommanditgesellschaft\nBochum\n\nDen Gläubigern der an der Ausgliederung beteiligten Rechtsträger ist, wenn sie binnen sechs Monaten nach dem Tag, an dem die Eintragung der Ausgliederung in das Register des Sitzes desjenigen Rechtsträgers, dessen Gläubiger sie sind, nach § 19 Absatz 3 UmwG als bekanntgemacht gilt, ihren Anspruch nach Grund und Höhe schriftlich anmelden, Sicherheit zu leisten, soweit sie nicht Befriedigung verlangen können. Dieses Recht steht den Gläubigern jedoch nur zu, wenn sie glaubhaft machen, dass durch die Ausgliederung die Erfüllung ihrer Forderung gefährdet wird."
    },
    {
      "date": "2025-01-09",
      "id": "98215",
      "original_text": "Löschungsankündigung\nNordrhein-Westfalen Amtsgericht Köln HRB 20671\nC.I.P. China Import-Marketing und Promotion GmbH – Köln",
      "type": "Löschungsankündigung",
      "state": "Nordrhein-Westfalen",
      "amtsgericht": "Amtsgericht Köln",
      "registernummer": "HRB 20671",
      "registerart": "HRB",
      "company_name": "C.I.P. China Import-Marketing und Promotion GmbH",
      "company_seat": "Köln",
      "details": "09.01.2025 (Bekanntmachungsdatum)\n\nNordrhein-Westfalen Amtsgericht Köln HRB 20671\nLöschungsankündigung\n\nC.I.P. China Import-Marketing und Promotion GmbH\nGesellschaft mit beschränkter Haftung\nKöln\n\nDas Registergericht beabsichtigt die Gesellschaft von Amts wegen nach § 394 FamFG zu löschen. Die Frist zur Erhebung eines Widerspruchs ist auf einen Monat festgesetzt."
    },
    {
      "date": "2025-01-09",
      "id": "98216",
      "original_text": "Registerbekanntmachung nach dem Umwandlungsgesetz\nNordrhein-Westfalen Amtsgericht Neuss HRB 17839\nSwedex Holding GmbH – Neuss",
      "type": "Registerbekanntmachung nach dem Umwandlungsgesetz",
      "state": "Nordrhein-Westfalen",
      "amtsgericht": "Amtsgericht Neuss",
      "registernummer": "HRB 17839",
      "registerart": "HRB",
      "company_name": "Swedex Holding GmbH",
      "company_seat": "Neuss",
      "details": "09.01.2025 (Bekanntmachungsdatum)\n\nNordrhein-Westfalen Amtsgericht Neuss HRB 17839\nRegisterbekanntmachung nach dem Umwandlungsgesetz 09.01.2025 (Eintragungsdatum)\n\nSwedex Holding GmbH\nGesellschaft mit beschränkter Haftung\nNeuss\n\nDen Gläubigern der an der Verschmelzung beteiligten Rechtsträger ist, wenn sie binnen sechs Monaten nach dem Tag, an dem die Eintragung der Verschmelzung in das Register des Sitzes desjenigen Rechtsträgers, dessen Gläubiger sie sind, nach § 19 Absatz 3 UmwG als bekanntgemacht gilt, ihren Anspruch nach Grund und Höhe schriftlich anmelden, Sicherheit zu leisten, soweit sie nicht Befriedigung verlangen können. Dieses Recht steht den Gläubigern jedoch nur zu, wenn sie glaubhaft machen, dass durch die Verschmelzung die Erfüllung ihrer Forderung gefährdet wird."
    },
    {
      "date": "2025-01-09",
      "id": "98217",
      "original_text": "Löschungsankündigung\nNordrhein-Westfalen Amtsgericht Neuss HRB 20635\nMKService 24 UG (haftungsbeschränkt) – Neuss",
      "type": "Löschungsankündigung",
      "state": "Nordrhein-Westfalen",
      "amtsgericht": "Amtsgericht Neuss",
      "registernummer": "HRB 20635",
      "registerart": "HRB",
      "company_name": "MKService 24 UG (haftungsbeschränkt)",
      "company_seat": "Neuss",
      "details": "09.01.2025 (Bekanntmachungsdatum)\n\nNordrhein-Westfalen Amtsgericht Neuss HRB 20635\nLöschungsankündigung 03.01.2025 (Eintragungsdatum)\n\nMKService 24 UG (haftungsbeschränkt)\nGesellschaft mit beschränkter Haftung\nNeuss\n\nDas Registergericht beabsichtigt die Gesellschaft von Amts wegen nach § 394 FamFG zu löschen. Die Frist zur Erhebung eines Widerspruchs ist auf einen Monat festgesetzt. Rechtsbehelfsbelehrung: Gegen diese Verfügung können Sie Widerspruch einlegen. Der Widerspruch ist bei dem Amtsgericht Neuss - Registergericht -, Breite Str. 48, 41460 Neuss schriftlich in deutscher Sprache oder zur Niederschrift der Geschäftsstelle einzulegen. Der Widerspruch kann auch zur Niederschrift der Geschäftsstelle eines jeden Amtsgerichtes abgegeben werden. Die Einlegung ist auch durch Übertragung eines elektronischen Dokuments an die elektronische Poststelle des Gerichts möglich. Das elektronische Dokument muss für die Bearbeitung durch das Gericht geeignet und mit einer qualifizierten elektronischen Signatur der verantwortenden Person versehen sein oder von der verantwortenden Person signiert und auf einem sicheren Übermittlungsweg gemäß § 130a ZPO nach näherer Maßgabe der Verordnung über die technischen Rahmenbedingungen des elektronischen Rechtsverkehrs und über das besondere elektronische Behördenpostfach (BGBl. I, S.3803) eingereicht werden. Weitere Informationen erhalten Sie auf der Internetseite www.justiz.de. Der Widerspruch muss spätestens innerhalb der gesetzten Frist nach der schriftlichen Bekanntgabe der Verfügung bei dem Amtsgericht - Registergericht - Neuss eingegangen sein. Dies gilt auch dann, wenn der Widerspruch zur Niederschrift der Geschäftsstelle eines anderen Amtsgerichtes abgegeben wurde. Die Frist beginnt mit der schriftlichen Bekanntgabe der Verfügung. Die Bekanntgabe ist entweder durch Zustellung oder am dritten Tage nach Aufgabe zur Post bewirkt. Fällt das Ende der Frist auf einen Sonntag, einen allgemeinen Feiertag oder Sonnabend, so endet die Frist mit Ablauf des nächsten Werktages. Der Widerspruch muss die Bezeichnung der angefochtenen Verfügung sowie die Erklärung enthalten, dass Widerspruch gegen diese Verfügung eingelegt wird. Er ist zu unterzeichnen und soll begründet werden."
    },
    {
      "date": "2025-01-09",
      "id": "98218",
      "original_text": "Einreichung neuer Dokumente\nNordrhein-Westfalen Amtsgericht Iserlohn HRB 4063\nMEG Märkische Eisenbahngesellschaft mit beschränkter Haftung – Lüdenscheid",
      "type": "Einreichung neuer Dokumente",
      "state": "Nordrhein-Westfalen",
      "amtsgericht": "Amtsgericht Iserlohn",
      "registernummer": "HRB 4063",
      "registerart": "HRB",
      "company_name": "MEG Märkische Eisenbahngesellschaft mit beschränkter Haftung",
      "company_seat": "Lüdenscheid",
      "details": "09.01.2025 (Bekanntmachungsdatum)\n\nNordrhein-Westfalen Amtsgericht Iserlohn HRB 4063\nEinreichung neuer Dokumente\n\nMEG Märkische Eisenbahngesellschaft mit beschränkter Haftung\nGesellschaft mit beschränkter Haftung\nLüdenscheid\n\nDem Registergericht ist eine Liste der Mitglieder des Aufsichtsrates eingereicht worden."
    },
    {
      "date": "2025-01-09",
      "id": "98219",
      "original_text": "Löschungsankündigung\nNordrhein-Westfalen Amtsgericht Neuss HRB 22776\nGashbir GmbH – Korschenbroich",
      "type": "Löschungsankündigung",
      "state": "Nordrhein-Westfalen",
      "amtsgericht": "Amtsgericht Neuss",
      "registernummer": "HRB 22776",
      "registerart": "HRB",
      "company_name": "Gashbir GmbH",
      "company_seat": "Korschenbroich",
      "details": "09.01.2025 (Bekanntmachungsdatum)\n\nNordrhein-Westfalen Amtsgericht Neuss HRB 22776\nLöschungsankündigung 09.01.2025 (Eintragungsdatum)\n\nGashbir GmbH\nGesellschaft mit beschränkter Haftung\nKorschenbroich\n\nDas Registergericht beabsichtigt die Gesellschaft von Amts wegen nach § 394 FamFG zu löschen. Die Frist zur Erhebung eines Widerspruchs ist auf einen Monat festgesetzt. Rechtsbehelfsbelehrung: Gegen diese Verfügung können Sie Widerspruch einlegen. Der Widerspruch ist bei dem Amtsgericht Neuss - Registergericht -, Breite Str. 48, 41460 Neuss schriftlich in deutscher Sprache oder zur Niederschrift der Geschäftsstelle einzulegen.Der Widerspruch kann auch zur Niederschrift der Geschäftsstelle eines jeden Amtsgerichtes abgegeben werden. Die Einlegung ist auch durch Übertragung eines elektronischen Dokuments an die elektronische Poststelle des Gerichts möglich. Das elektronische Dokument muss für die Bearbeitung durch das Gericht geeignet und mit einer qualifizierten elektronischen Signatur der verantwortenden Person versehen sein oder von der verantwortenden Person signiert und auf einem sicheren Übermittlungsweg gemäß § 130a ZPO nach näherer Maßgabe der Verordnung über die technischen Rahmenbedingungen des elektronischen Rechtsverkehrs und über das besondere elektronische Behördenpostfach (BGBl. I, S.3803) eingereicht werden. Weitere Informationen erhalten Sie auf der Internetseite www.justiz.de.Der Widerspruch muss spätestens innerhalb der gesetzten Frist nach der schriftlichen Bekanntgabe der Verfügung bei dem Amtsgericht - Registergericht - Neuss eingegangen sein. Dies gilt auch dann, wenn der Widerspruch zur Niederschrift der Geschäftsstelle eines anderen Amtsgerichtes abgegeben wurde. Die Frist beginnt mit der schriftlichen Bekanntgabe der Verfügung. Die Bekanntgabe ist entweder durch Zustellung oder am dritten Tage nach Aufgabe zur Post bewirkt. Fällt das Ende der Frist auf einen Sonntag, einen allgemeinen Feiertag oder Sonnabend, so endet die Frist mit Ablauf des nächsten Werktages. Der Widerspruch muss die Bezeichnung der angefochtenen Verfügung sowie die Erklärung enthalten, dass Widerspruch gegen diese Verfügung eingelegt wird. Er ist zu unterzeichnen und soll begründet werden."
    },
    {
      "date": "2025-01-09",
      "id": "98220",
      "original_text": "Registerbekanntmachung nach dem Umwandlungsgesetz\nNordrhein-Westfalen Amtsgericht Arnsberg VR 50514 früher Amtsgericht Meschede\nTurnverein Calle 1899 e.V. – Meschede",
      "type": "Registerbekanntmachung nach dem Umwandlungsgesetz",
      "state": "Nordrhein-Westfalen",
      "amtsgericht": "Amtsgericht Arnsberg",
      "registernummer": "VR 50514",
      "registerart": "VR",
      "company_name": "Turnverein Calle 1899 e.V.",
      "company_seat": "Meschede",
      "former_amtsgericht": "Meschede",
      "details": "09.01.2025 (Bekanntmachungsdatum)\n\nNordrhein-Westfalen Amtsgericht Arnsberg VR 50514 früher Amtsgericht Meschede\nRegisterbekanntmachung nach dem Umwandlungsgesetz 09.01.2025 (Eintragungsdatum)\n\nTurnverein Calle 1899 e.V.\neingetragener Verein\nMeschede\n\nDen Gläubigern der an der Verschmelzung beteiligten Rechtsträger ist, wenn sie binnen sechs Monaten nach dem Tag, an dem die Eintragung der Verschmelzung in das Register des Sitzes desjenigen Rechtsträgers, dessen Gläubiger sie sind, nach § 19 Absatz 3 UmwG als bekanntgemacht gilt, ihren Anspruch nach Grund und Höhe schriftlich anmelden, Sicherheit zu leisten, soweit sie nicht Befriedigung verlangen können. Dieses Recht steht den Gläubigern jedoch nur zu, wenn sie glaubhaft machen, dass durch die Verschmelzung die Erfüllung ihrer Forderung gefährdet wird."
    },
    {
      "date": "2025-01-09",
      "id": "98221",
      "original_text": "Löschungsankündigung\nNordrhein-Westfalen Amtsgericht Dortmund HRB 32783\nOptimum Brand- und Wasserschadensanierung GmbH – Dortmund",
      "type": "Löschungsankündigung",
      "state": "Nordrhein-Westfalen",
      "amtsgericht": "Amtsgericht Dortmund",
      "registernummer": "HRB 32783",
      "registerart": "HRB",
      "company_name": "Optimum Brand- und Wasserschadensanierung GmbH",
      "company_seat": "Dortmund",
      "details": "09.01.2025 (Bekanntmachungsdatum)\n\nNordrhein-Westfalen Amtsgericht Dortmund HRB 32783\nLöschungsankündigung\n\nOptimum Brand- und Wasserschadensanierung GmbH\nGesellschaft mit beschränkter Haftung\nDortmund\n\nDas Registergericht beabsichtigt die Gesellschaft von Amts wegen nach § 394 FamFG zu löschen. Die Frist zur Erhebung eines Widerspruchs ist auf zwei Monate festgesetzt."
    },
    {
      "date": "2025-01-09",
      "id": "98222",
      "original_text": "Löschungsankündigung\nNordrhein-Westfalen Amtsgericht Kleve HRB 14774\nM&A Immobilien GmbH – Kleve",
      "type": "Löschungsankündigung",
      "state": "Nordrhein-Westfalen",
      "amtsgericht": "Amtsgericht Kleve",
      "registernummer": "HRB 14774",
      "registerart": "HRB",
      "company_name": "M&A Immobilien GmbH",
      "company_seat": "Kleve",
      "details": "09.01.2025 (Bekanntmachungsdatum)\n\nNordrhein-Westfalen Amtsgericht Kleve HRB 14774\nLöschungsankündigung\n\nM&A Immobilien GmbH\nGesellschaft mit beschränkter Haftung\nKleve\n\nDas Registergericht beabsichtigt die Gesellschaft von Amts wegen nach § 394 FamFG zu löschen. Die Frist zur Erhebung eines Widerspruchs ist auf einen Monat festgesetzt."
    },
    {
      "date": "2025-01-09",
      "id": "98223",
      "original_text": "Sonstige Registerbekanntmachung\nNordrhein-Westfalen Amtsgericht Köln HRB 99732\nERVE Deutschland GmbH – Köln",
      "type": "Sonstige Registerbekanntmachung",
      "state": "Nordrhein-Westfalen",
      "amtsgericht": "Amtsgericht Köln",
      "registernummer": "HRB 99732",
      "registerart": "HRB",
      "company_name": "ERVE Deutschland GmbH",
      "company_seat": "Köln",
      "details": "09.01.2025 (Bekanntmachungsdatum)\n\nNordrhein-Westfalen Amtsgericht Köln HRB 99732\nSonstige Registerbekanntmachung 09.01.2025 (Eintragungsdatum)\n\nERVE Deutschland GmbH\nGesellschaft mit beschränkter Haftung\nKöln\n\nAls nicht eingetragen wird veröffentlicht: Den Gläubigern der Gesellschaft, deren Forderungen begründet worden sind bevor die Eintragung der Beendigung des Gewinnabführungsvertrages  in das Handelsregister nach § 10 des Handelsgesetzbuches als bekanntgemacht gilt, hat der andere Vertragsteil Sicherheit zu leisten, wenn sie sich binnen sechs Monaten nach der Bekanntmachung der Eintragung zu diesem Zweck bei ihm melden."
    },
    {
      "date": "2025-01-09",
      "id": "98224",
      "original_text": "Registerbekanntmachung nach dem Umwandlungsgesetz\nNordrhein-Westfalen Amtsgericht Bochum HRA 1951\nBatterie-Spezialgroßhandlung Günther Lenz, Inhaber MIchael Manthe e.K. – Bochum",
      "type": "Registerbekanntmachung nach dem Umwandlungsgesetz",
      "state": "Nordrhein-Westfalen",
      "amtsgericht": "Amtsgericht Bochum",
      "registernummer": "HRA 1951",
      "registerart": "HRA",
      "company_name": "Batterie-Spezialgroßhandlung Günther Lenz, Inhaber MIchael Manthe e.K.",
      "company_seat": "Bochum",
      "details": "09.01.2025 (Bekanntmachungsdatum)\n\nNordrhein-Westfalen Amtsgericht Bochum HRA 1951\nRegisterbekanntmachung nach dem Umwandlungsgesetz 07.01.2025 (Eintragungsdatum)\n\nBatterie-Spezialgroßhandlung Günther Lenz, Inhaber MIchael Manthe e.K.\nEinzelkaufmann / Einzelkauffrau\nBochum\n\nDen Gläubigern der an der Ausgliederung beteiligten Rechtsträger ist, wenn sie binnen sechs Monaten nach dem Tag, an dem die Eintragung der Ausgliederung in das Register des Sitzes desjenigen Rechtsträgers, dessen Gläubiger sie sind, nach § 19 Absatz 3 UmwG als bekanntgemacht gilt, ihren Anspruch nach Grund und Höhe schriftlich anmelden, Sicherheit zu leisten, soweit sie nicht Befriedigung verlangen können. Dieses Recht steht den Gläubigern jedoch nur zu, wenn sie glaubhaft machen, dass durch die Ausgliederung die Erfüllung ihrer Forderung gefährdet wird."
    },
    {
      "date": "2025-01-09",
      "id": "98225",
      "original_text": "Löschungsankündigung\nNordrhein-Westfalen Amtsgericht Neuss HRB 21384\nBloomboxclub UG (haftungsbeschränkt) – Neuss",
      "type": "Löschungsankündigung",
      "state": "Nordrhein-Westfalen",
      "amtsgericht": "Amtsgericht Neuss",
      "registernummer": "HRB 21384",
      "registerart": "HRB",
      "company_name": "Bloomboxclub UG (haftungsbeschränkt)",
      "company_seat": "Neuss",
      "details": "09.01.2025 (Bekanntmachungsdatum)\n\nNordrhein-Westfalen Amtsgericht Neuss HRB 21384\nLöschungsankündigung 07.01.2025 (Eintragungsdatum)\n\nBloomboxclub UG (haftungsbeschränkt)\nGesellschaft mit beschränkter Haftung\nNeuss\n\nDas Registergericht beabsichtigt die Gesellschaft von Amts wegen nach § 394 FamFG zu löschen. Die Frist zur Erhebung eines Widerspruchs ist auf einen Monat festgesetzt. es ist beabsichtigt, die Gesellschaft wegen Vermögenslosigkeit aufgrund des § 394 Abs. 1 FamFG zu löschen. Frist zur Geltendmachung eines Widerspruchs: 1 Monat. Rechtsbehelfsbelehrung:\nGegen diese Verfügung können Sie Widerspruch einlegen. Der Widerspruch ist bei dem Amtsgericht Neuss - Registergericht -, Breite Str. 48, 41460 Neuss schriftlich in deutscher Sprache oder zur Niederschrift der Geschäftsstelle einzulegen. Der Widerspruch kann auch zur Niederschrift der Geschäftsstelle eines jeden Amtsgerichtes abgegeben werden. Die Einlegung ist auch durch Übertragung eines elektronischen Dokuments an die elektronische Poststelle des Gerichts möglich. Das elektronische Dokument muss für die Bearbeitung durch das Gericht geeignet und mit einer qualifizierten elektronischen Signatur der verantwortenden Person versehen sein oder von der verantwortenden Person signiert und auf einem sicheren Übermittlungsweg gemäß § 130a ZPO nach näherer Maßgabe der Verordnung über die technischen Rahmenbedingungen des elektronischen Rechtsverkehrs und über das besondere elektronische Behördenpostfach (BGBl. I, S.3803) eingereicht werden. Weitere Informationen erhalten Sie auf der Internetseite www.justiz.de.\nDer Widerspruch muss spätestens innerhalb der gesetzten Frist nach der schriftlichen Bekanntgabe der Verfügung bei dem Amtsgericht - Registergericht - Neuss eingegangen sein. Dies gilt auch dann, wenn der Widerspruch zur Niederschrift der Geschäftsstelle eines anderen Amtsgerichtes abgegeben wurde. Die Frist beginnt mit der schriftlichen Bekanntgabe der Verfügung. Die Bekanntgabe ist entweder durch Zustellung oder am dritten Tage nach Aufgabe zur Post bewirkt. Fällt das Ende der Frist auf einen Sonntag, einen allgemeinen Feiertag oder Sonnabend, so endet die Frist mit Ablauf des nächsten Werktages. Der Widerspruch muss die Bezeichnung der angefochtenen Verfügung sowie die Erklärung enthalten, dass Widerspruch gegen diese Verfügung eingelegt wird. Er ist zu unterzeichnen und soll begründet werden."
    },
    {
      "date": "2025-01-09",
      "id": "98226",
      "original_text": "Sonstige Registerbekanntmachung\nNordrhein-Westfalen Amtsgericht Hamm HRB 7649\nRhenus AL GVZ GmbH – Holzwickede",
      "type": "Sonstige Registerbekanntmachung",
      "state": "Nordrhein-Westfalen",
      "amtsgericht": "Amtsgericht Hamm",
      "registernummer": "HRB 7649",
      "registerart": "HRB",
      "company_name": "Rhenus AL GVZ GmbH",
      "company_seat": "Holzwickede",
      "details": "09.01.2025 (Bekanntmachungsdatum)\n\nNordrhein-Westfalen Amtsgericht Hamm HRB 7649\nSonstige Registerbekanntmachung 07.01.2025 (Eintragungsdatum)\n\nRhenus AL GVZ GmbH\nGesellschaft mit beschränkter Haftung\nHolzwickede\n\nAls nicht eingetragen wird veröffentlicht: Den Gläubigern der Gesellschaft, deren Forderungen begründet worden sind bevor die Eintragung der Beendigung des Gewinnabführungsvertrages  in das Handelsregister nach § 10 des Handelsgesetzbuches als bekanntgemacht gilt, hat der andere Vertragsteil Sicherheit zu leisten, wenn sie sich binnen sechs Monaten nach der Bekanntmachung der Eintragung zu diesem Zweck bei ihm melden."
    },
    {
      "date": "2025-01-09",
      "id": "98227",
      "original_text": "Registerbekanntmachung nach dem Umwandlungsgesetz\nNordrhein-Westfalen Amtsgericht Arnsberg VR 50520 früher Amtsgericht Meschede\nTurn- und Sportverein Calle-Wallen e.V. – Meschede",
      "type": "Registerbekanntmachung nach dem Umwandlungsgesetz",
      "state": "Nordrhein-Westfalen",
      "amtsgericht": "Amtsgericht Arnsberg",
      "registernummer": "VR 50520",
      "registerart": "VR",
      "company_name": "Turn- und Sportverein Calle-Wallen e.V.",
      "company_seat": "Meschede",
      "former_amtsgericht": "Meschede",
      "details": "09.01.2025 (Bekanntmachungsdatum)\n\nNordrhein-Westfalen Amtsgericht Arnsberg VR 50520 früher Amtsgericht Meschede\nRegisterbekanntmachung nach dem Umwandlungsgesetz 09.01.2025 (Eintragungsdatum)\n\nTurn- und Sportverein Calle-Wallen e.V.\neingetragener Verein\nMeschede\n\nDen Gläubigern der an der Verschmelzung beteiligten Rechtsträger ist, wenn sie binnen sechs Monaten nach dem Tag, an dem die Eintragung der Verschmelzung in das Register des Sitzes desjenigen Rechtsträgers, dessen Gläubiger sie sind, nach § 19 Absatz 3 UmwG als bekanntgemacht gilt, ihren Anspruch nach Grund und Höhe schriftlich anmelden, Sicherheit zu leisten, soweit sie nicht Befriedigung verlangen können. Dieses Recht steht den Gläubigern jedoch nur zu, wenn sie glaubhaft machen, dass durch die Verschmelzung die Erfüllung ihrer Forderung gefährdet wird."
    },
    {
      "date": "2025-01-09",
      "id": "98228",
      "original_text": "Sonstige Registerbekanntmachung\nNordrhein-Westfalen Amtsgericht Düsseldorf HRB 4381\nSteuerberatungsgesellschaft BRS GmbH – Düsseldorf",
      "type": "Sonstige Registerbekanntmachung",
      "state": "Nordrhein-Westfalen",
      "amtsgericht": "Amtsgericht Düsseldorf",
      "registernummer": "HRB 4381",
      "registerart": "HRB",
      "company_name": "Steuerberatungsgesellschaft BRS GmbH",
      "company_seat": "Düsseldorf",
      "details": "09.01.2025 (Bekanntmachungsdatum)\n\nNordrhein-Westfalen Amtsgericht Düsseldorf HRB 4381\nSonstige Registerbekanntmachung 09.01.2025 (Eintragungsdatum)\n\nSteuerberatungsgesellschaft BRS GmbH\nGesellschaft mit beschränkter Haftung\nDüsseldorf\n\nAls nicht eingetragen wird veröffentlicht: Den Gläubigern der Gesellschaft, deren Forderungen begründet worden sind bevor die Eintragung der Beendigung des Gewinnabführungsvertrages  in das Handelsregister nach § 10 des Handelsgesetzbuches als bekanntgemacht gilt, hat der andere Vertragsteil Sicherheit zu leisten, wenn sie sich binnen sechs Monaten nach der Bekanntmachung der Eintragung zu diesem Zweck bei ihm melden."
    },
    {
      "date": "2025-01-09",
      "id": "98229",
      "original_text": "Löschungsankündigung\nNordrhein-Westfalen Amtsgericht Bochum HRB 18017\nMATI Modellbau UG (haftungsbeschränkt) – Herne",
      "type": "Löschungsankündigung",
      "state": "Nordrhein-Westfalen",
      "amtsgericht": "Amtsgericht Bochum",
      "registernummer": "HRB 18017",
      "registerart": "HRB",
      "company_name": "MATI Modellbau UG (haftungsbeschränkt)",
      "company_seat": "Herne",
      "details": "09.01.2025 (Bekanntmachungsdatum)\n\nNordrhein-Westfalen Amtsgericht Bochum HRB 18017\nLöschungsankündigung 10.01.2025 (Eintragungsdatum)\n\nMATI Modellbau UG (haftungsbeschränkt)\nGesellschaft mit beschränkter Haftung\nHerne\n\nDas Registergericht beabsichtigt die Gesellschaft von Amts wegen nach § 394 FamFG zu löschen. Die Frist zur Erhebung eines Widerspruchs ist auf drei Monate festgesetzt.Es ist beabsichtigt, die Eintragung als Geschäftsführer von Amts wegen zu löschen, da die Eintragung eines Amtsunfähigkeitstatbestandes (§ 6 II 2 Nr. 3 a GmbHG) unzulässig geworden ist. Dadurch würde die GmbH führungslos. Wenn letzteres vermieden werden  soll, bestellen Sie gegebenenfalls umgehend einen anderen Geschäftsführer und stellen diesbezüglich einen Eintragungsantrag."
    },
    {
      "date": "2025-01-09",
      "id": "98230",
      "original_text": "Registerbekanntmachung nach dem Umwandlungsgesetz\nNordrhein-Westfalen Amtsgericht Köln HRB 21783\nAstenJohnson (Deutschland) GmbH – Köln",
      "type": "Registerbekanntmachung nach dem Umwandlungsgesetz",
      "state": "Nordrhein-Westfalen",
      "amtsgericht": "Amtsgericht Köln",
      "registernummer": "HRB 21783",
      "registerart": "HRB",
      "company_name": "AstenJohnson (Deutschland) GmbH",
      "company_seat": "Köln",
      "details": "09.01.2025 (Bekanntmachungsdatum)\n\nNordrhein-Westfalen Amtsgericht Köln HRB 21783\nRegisterbekanntmachung nach dem Umwandlungsgesetz\n\nAstenJohnson (Deutschland) GmbH\nGesellschaft mit beschränkter Haftung\nKöln\n\nEs wird darauf hingewiesen, dass ein Verschmelzungsplan oder sein Entwurf über eine grenzüberschreitende Verschmelzung zur Aufnahme mit folgenden Rechtsträgern beim Handelsregister eingereicht worden ist: AstenJohnson (Deutschland) GmbH i.L. mit Sitz in Köln (Amtsgericht Köln, HRB 21783) als übertragender Rechtsträger und der AstenJohnson (Luxembourg) LLC, S.à.r.l. mit Sitz in Luxemburg (RCS Nummer B150163) als übernehmender Rechtsträger.\nDie Anteilsinhaber, die Gläubiger sowie die zuständigen Betriebsräte der an der grenzüberschreitenden Verschmelzung beteiligten Gesellschaften oder, soweit es keinen Betriebsrat gibt, die Arbeitnehmer der an der grenzüberschreitenden Verschmelzung beteiligten Gesellschaften, können der jeweiligen Gesellschaft spätestens fünf Arbeitstage vor dem Tag der Gesellschafterversammlung Bemerkungen zum Verschmelzungsplan übermitteln."
    },
    {
      "date": "2025-01-09",
      "id": "98231",
      "original_text": "Registerbekanntmachung nach dem Umwandlungsgesetz\nNordrhein-Westfalen Amtsgericht Düsseldorf HRB 91572\nStadtmarken HG Düren GmbH – Monheim am Rhein",
      "type": "Registerbekanntmachung nach dem Umwandlungsgesetz",
      "state": "Nordrhein-Westfalen",
      "amtsgericht": "Amtsgericht Düsseldorf",
      "registernummer": "HRB 91572",
      "registerart": "HRB",
      "company_name": "Stadtmarken HG Düren GmbH",
      "company_seat": "Monheim am Rhein",
      "details": "09.01.2025 (Bekanntmachungsdatum)\n\nNordrhein-Westfalen Amtsgericht Düsseldorf HRB 91572\nRegisterbekanntmachung nach dem Umwandlungsgesetz 09.01.2025 (Eintragungsdatum)\n\nStadtmarken HG Düren GmbH\nGesellschaft mit beschränkter Haftung\nMonheim am Rhein\n\nDen Gläubigern der an der Verschmelzung beteiligten Rechtsträger ist, wenn sie binnen sechs Monaten nach dem Tag, an dem die Eintragung der Verschmelzung in das Register des Sitzes desjenigen Rechtsträgers, dessen Gläubiger sie sind, nach § 19 Absatz 3 UmwG als bekanntgemacht gilt, ihren Anspruch nach Grund und Höhe schriftlich anmelden, Sicherheit zu leisten, soweit sie nicht Befriedigung verlangen können. Dieses Recht steht den Gläubigern jedoch nur zu, wenn sie glaubhaft machen, dass durch die Verschmelzung die Erfüllung ihrer Forderung gefährdet wird."
    },
    {
      "date": "2025-01-09",
      "id": "98232",
      "original_text": "Löschungsankündigung\nNordrhein-Westfalen Amtsgericht Dortmund HRB 15283\nTop-Secret GmbH – Dortmund",
      "type": "Löschungsankündigung",
      "state": "Nordrhein-Westfalen",
      "amtsgericht": "Amtsgericht Dortmund",
      "registernummer": "HRB 15283",
      "registerart": "HRB",
      "company_name": "Top-Secret GmbH",
      "company_seat": "Dortmund",
      "details": "09.01.2025 (Bekanntmachungsdatum)\n\nNordrhein-Westfalen Amtsgericht Dortmund HRB 15283\nLöschungsankündigung\n\nTop-Secret GmbH\nGesellschaft mit beschränkter Haftung\nDortmund\n\nDas Registergericht beabsichtigt die Gesellschaft von Amts wegen nach § 394 FamFG zu löschen. Die Frist zur Erhebung eines Widerspruchs ist auf zwei Monate festgesetzt."
    },
    {
      "date": "2025-01-09",
      "id": "98233",
      "original_text": "Einreichung neuer Dokumente\nNordrhein-Westfalen Amtsgericht Düsseldorf HRB 66846\nARAG SE – Düsseldorf",
      "type": "Einreichung neuer Dokumente",
      "state": "Nordrhein-Westfalen",
      "amtsgericht": "Amtsgericht Düsseldorf",
      "registernummer": "HRB 66846",
      "registerart": "HRB",
      "company_name": "ARAG SE",
      "company_seat": "Düsseldorf",
      "details": "09.01.2025 (Bekanntmachungsdatum)\n\nNordrhein-Westfalen Amtsgericht Düsseldorf HRB 66846\nEinreichung neuer Dokumente\n\nARAG SE\nEuropäische Aktiengesellschaft (SE)\nDüsseldorf\n\nDem Registergericht ist eine Liste der Mitglieder des Aufsichtsrates eingereicht worden."
    },
    {
      "date": "2025-01-09",
      "id": "98234",
      "original_text": "Löschungsankündigung\nNordrhein-Westfalen Amtsgericht Dortmund HRB 27876\nBM Innenausbau und Hausservice UG (haftungsbeschränkt) – Dortmund",
      "type": "Löschungsankündigung",
      "state": "Nordrhein-Westfalen",
      "amtsgericht": "Amtsgericht Dortmund",
      "registernummer": "HRB 27876",
      "registerart": "HRB",
      "company_name": "BM Innenausbau und Hausservice UG (haftungsbeschränkt)",
      "company_seat": "Dortmund",
      "details": "09.01.2025 (Bekanntmachungsdatum)\n\nNordrhein-Westfalen Amtsgericht Dortmund HRB 27876\nLöschungsankündigung\n\nBM Innenausbau und Hausservice UG (haftungsbeschränkt)\nGesellschaft mit beschränkter Haftung\nDortmund"
    },
    {
      "date": "2025-01-09",
      "id": "98235",
      "original_text": "Löschungsankündigung\nNordrhein-Westfalen Amtsgericht Dortmund HRB 27876\nBM Innenausbau und Hausservice UG (haftungsbeschränkt) – Dortmund",
      "type": "Löschungsankündigung",
      "state": "Nordrhein-Westfalen",
      "amtsgericht": "Amtsgericht Dortmund",
      "registernummer": "HRB 27876",
      "registerart": "HRB",
      "company_name": "BM Innenausbau und Hausservice UG (haftungsbeschränkt)",
      "company_seat": "Dortmund",
      "details": "09.01.2025 (Bekanntmachungsdatum)\n\nNordrhein-Westfalen Amtsgericht Dortmund HRB 27876\nLöschungsankündigung\n\nBM Innenausbau und Hausservice UG (haftungsbeschränkt)\nGesellschaft mit beschränkter Haftung\nDortmund"
    },
    {
      "date": "2025-01-09",
      "id": "98236",
      "original_text": "Löschungsankündigung\nNordrhein-Westfalen Amtsgericht Wuppertal HRB 28951\nMeso Skin Paris UG (haftungsbeschränkt) – Solingen",
      "type": "Löschungsankündigung",
      "state": "Nordrhein-Westfalen",
      "amtsgericht": "Amtsgericht Wuppertal",
      "registernummer": "HRB 28951",
      "registerart": "HRB",
      "company_name": "Meso Skin Paris UG (haftungsbeschränkt)",
      "company_seat": "Solingen",
      "details": "09.01.2025 (Bekanntmachungsdatum)\n\nNordrhein-Westfalen Amtsgericht Wuppertal HRB 28951\nLöschungsankündigung 08.01.2025 (Eintragungsdatum)\n\nMeso Skin Paris UG (haftungsbeschränkt)\nGesellschaft mit beschränkter Haftung\nSolingen\n\nDas Registergericht beabsichtigt die Gesellschaft von Amts wegen nach § 394 FamFG zu löschen. Die Frist zur Erhebung eines Widerspruchs ist auf einen Monat festgesetzt."
    },
    {
      "date": "2025-01-09",
      "id": "98237",
      "original_text": "Löschungsankündigung\nThüringen Amtsgericht Jena HRB 205754\nSchröder Holzbau GmbH – Jena",
      "type": "Löschungsankündigung",
      "state": "Thüringen",
      "amtsgericht": "Amtsgericht Jena",
      "registernummer": "HRB 205754",
      "registerart": "HRB",
      "company_name": "Schröder Holzbau GmbH",
      "company_seat": "Jena",
      "details": "09.01.2025 (Bekanntmachungsdatum)\n\nThüringen Amtsgericht Jena HRB 205754\nLöschungsankündigung\n\nSchröder Holzbau GmbH\nGesellschaft mit beschränkter Haftung\nJena\n\nDas Registergericht beabsichtigt, die im Handelsregister eingetragene Gesellschaft wegen Vermögenslosigkeit nach § 394 FamFG von Amts wegen zu löschen. Die Frist zur Erhebung eines Widerspruchs gegen die beabsichtigte Löschung wird auf 6 Wochen festgesetzt."
    },
    {
      "date": "2025-01-09",
      "id": "98238",
      "original_text": "Sonstige Registerbekanntmachung\nThüringen Amtsgericht Jena HRB 100221\nTractebel Hydroprojekt GmbH – Weimar",
      "type": "Sonstige Registerbekanntmachung",
      "state": "Thüringen",
      "amtsgericht": "Amtsgericht Jena",
      "registernummer": "HRB 100221",
      "registerart": "HRB",
      "company_name": "Tractebel Hydroprojekt GmbH",
      "company_seat": "Weimar",
      "details": "09.01.2025 (Bekanntmachungsdatum)\n\nThüringen Amtsgericht Jena HRB 100221\nSonstige Registerbekanntmachung 09.01.2025 (Eintragungsdatum)\n\nTractebel Hydroprojekt GmbH\nGesellschaft mit beschränkter Haftung\nWeimar\n\nNicht eingetragen: Den Gläubigern der Gesellschaft, deren Forderungen begründet worden sind, bevor die Eintragung der Beendigung des Vertrages in das Handelsregister nach § 10 des Handelsgesetzbuches als bekanntgemacht gilt, hat der andere Vertragsteil Sicherheit zu leisten, wenn sie sich binnen sechs Monaten nach der Bekanntmachung der Eintragung zu diesem Zweck bei ihm melden."
    },
    {
      "date": "2025-01-09",
      "id": "98239",
      "original_text": "Löschungsankündigung\nThüringen Amtsgericht Jena HRB 208564\nISOTECH Bau GmbH Ost – St. Gangloff",
      "type": "Löschungsankündigung",
      "state": "Thüringen",
      "amtsgericht": "Amtsgericht Jena",
      "registernummer": "HRB 208564",
      "registerart": "HRB",
      "company_name": "ISOTECH Bau GmbH Ost",
      "company_seat": "St. Gangloff",
      "details": "09.01.2025 (Bekanntmachungsdatum)\n\nThüringen Amtsgericht Jena HRB 208564\nLöschungsankündigung\n\nISOTECH Bau GmbH Ost\nGesellschaft mit beschränkter Haftung\nSt. Gangloff\n\nDas Registergericht beabsichtigt, die im Handelsregister eingetragene Gesellschaft wegen Vermögenslosigkeit nach § 394 FamFG von Amts wegen zu löschen. Die Frist zur Erhebung eines Widerspruchs gegen die beabsichtigte Löschung wird auf 6 Wochen festgesetzt."
    },
    {
      "date": "2025-01-09",
      "id": "98240",
      "original_text": "Löschungsankündigung\nHessen Amtsgericht Wiesbaden HRB 31068\nperfyou UG (haftungsbeschränkt) – Wiesbaden",
      "type": "Löschungsankündigung",
      "state": "Hessen",
      "amtsgericht": "Amtsgericht Wiesbaden",
      "registernummer": "HRB 31068",
      "registerart": "HRB",
      "company_name": "perfyou UG (haftungsbeschränkt)",
      "company_seat": "Wiesbaden",
      "details": "09.01.2025 (Bekanntmachungsdatum)\n\nHessen Amtsgericht Wiesbaden HRB 31068\nLöschungsankündigung\n\nperfyou UG (haftungsbeschränkt)\nGesellschaft mit beschränkter Haftung\nWiesbaden\n\nDas Registergericht beabsichtigt die im Handelsregister eingetragene Gesellschaft von Amts wegen nach § 394 FamFG zu löschen. Die Frist zur Erhebung eines Widerspruchs gegen die beabsichtigte Löschung wird auf 3 Monate festgesetzt."
    },
    {
      "date": "2025-01-09",
      "id": "98241",
      "original_text": "Registerbekanntmachung nach dem Umwandlungsgesetz\nHessen Amtsgericht Frankfurt am Main HRB 110517\nTrident Property GmbH – Frankfurt am Main",
      "type": "Registerbekanntmachung nach dem Umwandlungsgesetz",
      "state": "Hessen",
      "amtsgericht": "Amtsgericht Frankfurt am Main",
      "registernummer": "HRB 110517",
      "registerart": "HRB",
      "company_name": "Trident Property GmbH",
      "company_seat": "Frankfurt am Main",
      "details": "09.01.2025 (Bekanntmachungsdatum)\n\nHessen Amtsgericht Frankfurt am Main HRB 110517\nRegisterbekanntmachung nach dem Umwandlungsgesetz 09.01.2025 (Eintragungsdatum)\n\nTrident Property GmbH\nGesellschaft mit beschränkter Haftung\nFrankfurt am Main\n\nDen Gläubigern der an der Verschmelzung beteiligten Rechtsträger ist, wenn sie binnen sechs Monaten nach dem Tag, an dem die Eintragung der Verschmelzung in das Register des Sitzes derjenigen Rechtsträger deren Gläubiger sie sind, nach § 19 Absatz 3 UmwG bekannt gemacht worden ist, ihren Anspruch nach Grund und Höhe schriftlich anmelden, Sicherheit zu leisten, soweit sie nicht Befriedigung verlangen können. Dieses Recht steht den Gläubigern jedoch nur zu, wenn sie glaubhaft machen, dass durch die Verschmelzung die Erfüllung ihrer Forderung gefährdet wird."
    },
    {
      "date": "2025-01-09",
      "id": "98242",
      "original_text": "Registerbekanntmachung nach dem Umwandlungsgesetz\nHessen Amtsgericht Fulda HRB 8544\nWenzel Familienwerte Holding GmbH – Hünfeld",
      "type": "Registerbekanntmachung nach dem Umwandlungsgesetz",
      "state": "Hessen",
      "amtsgericht": "Amtsgericht Fulda",
      "registernummer": "HRB 8544",
      "registerart": "HRB",
      "company_name": "Wenzel Familienwerte Holding GmbH",
      "company_seat": "Hünfeld",
      "details": "09.01.2025 (Bekanntmachungsdatum)\n\nHessen Amtsgericht Fulda HRB 8544\nRegisterbekanntmachung nach dem Umwandlungsgesetz 09.01.2025 (Eintragungsdatum)\n\nWenzel Familienwerte Holding GmbH\nGesellschaft mit beschränkter Haftung\nHünfeld\n\nDen Gläubigern der an der formwechselnden Umwandlung beteiligten Rechtsträger ist, wenn sie binnen sechs Monaten nach dem Tag, an dem die Eintragung der formwechselnden Umwandlung in das Register des Sitzes desjenigen Rechtsträgers, dessen Gläubiger sie sind, nach § 201 UmwG bekannt gemacht worden ist, ihren Anspruch nach Grund und Höhe schriftlich anmelden, Sicherheit zu leisten, soweit sie nicht Befriedigung verlangen können. Dieses Recht steht den Gläubigern jedoch nur zu, wenn sie glaubhaft machen, dass durch die formwechselnden Umwandlung die Erfüllung ihrer Forderung gefährdet wird."
    },
    {
      "date": "2025-01-09",
      "id": "98243",
      "original_text": "Löschungsankündigung\nHessen Amtsgericht Bad Homburg v.d.H. HRA 3302\nMultiform Products textiles und prints Vertriebs GmbH & Co. KG – Bad Homburg v.d.Höhe",
      "type": "Löschungsankündigung",
      "state": "Hessen",
      "amtsgericht": "Amtsgericht Bad Homburg v.d.H.",
      "registernummer": "HRA 3302",
      "registerart": "HRA",
      "company_name": "Multiform Products textiles und prints Vertriebs GmbH & Co. KG",
      "company_seat": "Bad Homburg v.d.Höhe",
      "details": "09.01.2025 (Bekanntmachungsdatum)\n\nHessen Amtsgericht Bad Homburg v.d.H. HRA 3302\nLöschungsankündigung\n\nMultiform Products textiles und prints Vertriebs GmbH & Co. KG\nKommanditgesellschaft\nBad Homburg v.d.Höhe\n\nDas Registergericht beabsichtigt die im Handelsregister eingetragene Firma von Amts wegen nach § 394 FamFG zu löschen. Die Frist zur Erhebung eines Widerspruchs gegen die beabsichtigte Löschung wird auf 3 Monate festgesetzt."
    },
    {
      "date": "2025-01-09",
      "id": "98244",
      "original_text": "Löschungsankündigung\nHessen Amtsgericht Frankfurt am Main HRB 56342\nCUT Media GmbH – Frankfurt am Main",
      "type": "Löschungsankündigung",
      "state": "Hessen",
      "amtsgericht": "Amtsgericht Frankfurt am Main",
      "registernummer": "HRB 56342",
      "registerart": "HRB",
      "company_name": "CUT Media GmbH",
      "company_seat": "Frankfurt am Main",
      "details": "09.01.2025 (Bekanntmachungsdatum)\n\nHessen Amtsgericht Frankfurt am Main HRB 56342\nLöschungsankündigung 09.01.2025 (Eintragungsdatum)\n\nCUT Media GmbH\nGesellschaft mit beschränkter Haftung\nFrankfurt am Main\n\nDas Registergericht beabsichtigt die im Handelsregister eingetragene Gesellschaft von Amts wegen nach § 394 FamFG zu löschen. Die Frist zur Erhebung eines Widerspruchs gegen die beabsichtigte Löschung wird auf 1 Monat festgesetzt."
    },
    {
      "date": "2025-01-09",
      "id": "98245",
      "original_text": "Sonstige Registerbekanntmachung\nHessen Amtsgericht Wiesbaden VR 1524\nRadsport-Verein Kostheim 04 – Mainz-Kostheim",
      "type": "Sonstige Registerbekanntmachung",
      "state": "Hessen",
      "amtsgericht": "Amtsgericht Wiesbaden",
      "registernummer": "VR 1524",
      "registerart": "VR",
      "company_name": "Radsport-Verein Kostheim 04",
      "company_seat": "Mainz-Kostheim",
      "details": "09.01.2025 (Bekanntmachungsdatum)\n\nHessen Amtsgericht Wiesbaden VR 1524\nSonstige Registerbekanntmachung 09.01.2025 (Eintragungsdatum)\n\nRadsport-Verein Kostheim 04\neingetragener Verein\nMainz-Kostheim\n\nDer Verein ist aufgelöst."
    },
    {
      "date": "2025-01-09",
      "id": "98246",
      "original_text": "Registerbekanntmachung nach dem Umwandlungsgesetz\nHessen Amtsgericht Frankfurt am Main HRB 110426\nFreya Asset Invest GmbH – Frankfurt am Main",
      "type": "Registerbekanntmachung nach dem Umwandlungsgesetz",
      "state": "Hessen",
      "amtsgericht": "Amtsgericht Frankfurt am Main",
      "registernummer": "HRB 110426",
      "registerart": "HRB",
      "company_name": "Freya Asset Invest GmbH",
      "company_seat": "Frankfurt am Main",
      "details": "09.01.2025 (Bekanntmachungsdatum)\n\nHessen Amtsgericht Frankfurt am Main HRB 110426\nRegisterbekanntmachung nach dem Umwandlungsgesetz 09.01.2025 (Eintragungsdatum)\n\nFreya Asset Invest GmbH\nGesellschaft mit beschränkter Haftung\nFrankfurt am Main\n\nDen Gläubigern der an der Verschmelzung beteiligten Rechtsträger ist, wenn sie binnen sechs Monaten nach dem Tag, an dem die Eintragung der Verschmelzung in das Register des Sitzes derjenigen Rechtsträger deren Gläubiger sie sind, nach § 19 Absatz 3 UmwG bekannt gemacht worden ist, ihren Anspruch nach Grund und Höhe schriftlich anmelden, Sicherheit zu leisten, soweit sie nicht Befriedigung verlangen können. Dieses Recht steht den Gläubigern jedoch nur zu, wenn sie glaubhaft machen, dass durch die Verschmelzung die Erfüllung ihrer Forderung gefährdet wird."
    },
    {
      "date": "2025-01-09",
      "id": "98247",
      "original_text": "Sonstige Registerbekanntmachung\nHessen Amtsgericht Hanau HRB 93238\nEngelbert Strauss International AG – Biebergemünd",
      "type": "Sonstige Registerbekanntmachung",
      "state": "Hessen",
      "amtsgericht": "Amtsgericht Hanau",
      "registernummer": "HRB 93238",
      "registerart": "HRB",
      "company_name": "Engelbert Strauss International AG",
      "company_seat": "Biebergemünd",
      "details": "09.01.2025 (Bekanntmachungsdatum)\n\nHessen Amtsgericht Hanau HRB 93238\nSonstige Registerbekanntmachung 09.01.2025 (Eintragungsdatum)\n\nEngelbert Strauss International AG\nAktiengesellschaft\nBiebergemünd\n\nDen Gläubigern der Gesellschaft, deren Forderungen begründet worden sind, bevor die Eintragung der Beendigung des Vertrags in das Handelsregister nach § 10 HGB bekannt gemacht worden ist, ist vom anderen Vertragsteil Sicherheit zu leisten, wenn sie sich binnen sechs Monaten nach dieser Bekanntmachung zu diesem Zweck bei ihm melden."
    },
    {
      "date": "2025-01-09",
      "id": "98248",
      "original_text": "Löschungsankündigung\nHessen Amtsgericht Wiesbaden HRB 26929\nElectratec UG (haftungsbeschränkt) – Wiesbaden",
      "type": "Löschungsankündigung",
      "state": "Hessen",
      "amtsgericht": "Amtsgericht Wiesbaden",
      "registernummer": "HRB 26929",
      "registerart": "HRB",
      "company_name": "Electratec UG (haftungsbeschränkt)",
      "company_seat": "Wiesbaden",
      "details": "09.01.2025 (Bekanntmachungsdatum)\n\nHessen Amtsgericht Wiesbaden HRB 26929\nLöschungsankündigung\n\nElectratec UG (haftungsbeschränkt)\nGesellschaft mit beschränkter Haftung\nWiesbaden\n\nDas Registergericht beabsichtigt die im Handelsregister eingetragene Gesellschaft von Amts wegen nach § 394 FamFG zu löschen. Die Frist zur Erhebung eines Widerspruchs gegen die beabsichtigte Löschung wird auf 3 Monate festgesetzt."
    },
    {
      "date": "2025-01-09",
      "id": "98249",
      "original_text": "Löschungsankündigung\nHessen Amtsgericht Wiesbaden HRB 27686\nMalerfachbetrieb M. Waldeck GmbH – Wiesbaden",
      "type": "Löschungsankündigung",
      "state": "Hessen",
      "amtsgericht": "Amtsgericht Wiesbaden",
      "registernummer": "HRB 27686",
      "registerart": "HRB",
      "company_name": "Malerfachbetrieb M. Waldeck GmbH",
      "company_seat": "Wiesbaden",
      "details": "09.01.2025 (Bekanntmachungsdatum)\n\nHessen Amtsgericht Wiesbaden HRB 27686\nLöschungsankündigung\n\nMalerfachbetrieb M. Waldeck GmbH\nGesellschaft mit beschränkter Haftung\nWiesbaden\n\nDas Registergericht beabsichtigt die im Handelsregister eingetragene Gesellschaft von Amts wegen nach § 394 FamFG zu löschen. Die Frist zur Erhebung eines Widerspruchs gegen die beabsichtigte Löschung wird auf 3 Monate festgesetzt."
    },
    {
      "date": "2025-01-09",
      "id": "98250",
      "original_text": "Löschungsankündigung\nHessen Amtsgericht Limburg HRB 4747\nTerra Fuoco Energy GmbH – Bad Camberg",
      "type": "Löschungsankündigung",
      "state": "Hessen",
      "amtsgericht": "Amtsgericht Limburg",
      "registernummer": "HRB 4747",
      "registerart": "HRB",
      "company_name": "Terra Fuoco Energy GmbH",
      "company_seat": "Bad Camberg",
      "details": "09.01.2025 (Bekanntmachungsdatum)\n\nHessen Amtsgericht Limburg HRB 4747\nLöschungsankündigung\n\nTerra Fuoco Energy GmbH\nGesellschaft mit beschränkter Haftung\nBad Camberg\n\nDas Registergericht beabsichtigt die im Handelsregister eingetragene Gesellschaft von Amts wegen nach § 395 FamFG zu löschen. Die Frist zur Erhebung eines Widerspruchs gegen die beabsichtigte Löschung wird auf 3 Monate festgesetzt."
    },
    {
      "date": "2025-01-09",
      "id": "98251",
      "original_text": "Einreichung neuer Dokumente\nHessen Amtsgericht Frankfurt am Main HRB 53576\nLagerbox Düsseldorf 1 GmbH – Frankfurt am Main",
      "type": "Einreichung neuer Dokumente",
      "state": "Hessen",
      "amtsgericht": "Amtsgericht Frankfurt am Main",
      "registernummer": "HRB 53576",
      "registerart": "HRB",
      "company_name": "Lagerbox Düsseldorf 1 GmbH",
      "company_seat": "Frankfurt am Main",
      "details": "09.01.2025 (Bekanntmachungsdatum)\n\nHessen Amtsgericht Frankfurt am Main HRB 53576\nEinreichung neuer Dokumente 09.01.2025 (Eintragungsdatum)\n\nLagerbox Düsseldorf 1 GmbH\nGesellschaft mit beschränkter Haftung\nFrankfurt am Main\n\nDen Gläubigern der Gesellschaft, deren Forderungen begründet worden sind, bevor die Eintragung der Beendigung des Vertrags in das Handelsregister nach § 10 HGB bekannt gemacht worden ist, ist vom anderen Vertragsteil Sicherheit zu leisten, wenn sie sich binnen sechs Monaten nach dieser Bekanntmachung zu diesem Zweck bei ihm melden."
    }
  ]
}