{
  "date": "2025-01-03",
  "date_of_scrape": "2025-01-04T04:07:08.579Z",
  "tool_version": "0.2.0",
  "number_of_announcements": 120,
  "announcements": [
    {
      "date": "2025-01-03",
      "id": "97689",
      "original_text": "Registerbekanntmachung nach dem Umwandlungsgesetz\nBayern Amtsgericht München HRB 266482\nGreenTech Living Spaces GmbH – München",
      "type": "Registerbekanntmachung nach dem Umwandlungsgesetz",
      "state": "Bayern",
      "amtsgericht": "Amtsgericht München",
      "registernummer": "HRB 266482",
      "registerart": "HRB",
      "company_name": "GreenTech Living Spaces GmbH",
      "company_seat": "München",
      "details": "03.01.2025 (Bekanntmachungsdatum)\n\nBayern Amtsgericht München HRB 266482\nRegisterbekanntmachung nach dem Umwandlungsgesetz 20.08.2024 (Eintragungsdatum)\n\nGreenTech Living Spaces GmbH\nGesellschaft mit beschränkter Haftung\nMünchen\n\nDen Gläubigern der an der Verschmelzung beteiligten Rechtsträger ist, wenn sie binnen sechs Monaten nach dem Tag, an dem die Eintragung der Verschmelzung in das Register des Sitzes desjenigen Rechtsträgers, dessen Gläubiger sie sind, nach § 19 Abs. 3 UmwG als bekannt gemacht gilt, ihren Anspruch nach Grund und Höhe in Textform anmelden, Sicherheit zu leisten, soweit sie nicht Befriedigung verlangen können. Dieses Recht steht den Gläubigern jedoch nur zu, wenn sie glaubhaft machen, dass durch die Verschmelzung die Erfüllung ihrer Forderung gefährdet wird."
    },
    {
      "date": "2025-01-03",
      "id": "97690",
      "original_text": "Einreichung neuer Dokumente\nBayern Amtsgericht Aschaffenburg HRB 779\nEnergieversorgung Main-Spessart GmbH – Aschaffenburg",
      "type": "Einreichung neuer Dokumente",
      "state": "Bayern",
      "amtsgericht": "Amtsgericht Aschaffenburg",
      "registernummer": "HRB 779",
      "registerart": "HRB",
      "company_name": "Energieversorgung Main-Spessart GmbH",
      "company_seat": "Aschaffenburg",
      "details": "03.01.2025 (Bekanntmachungsdatum)\n\nBayern Amtsgericht Aschaffenburg HRB 779\nEinreichung neuer Dokumente\n\nEnergieversorgung Main-Spessart GmbH\nGesellschaft mit beschränkter Haftung\nAschaffenburg\n\nDem Amtsgericht Aschaffenburg -Registergericht- ist eine Liste der Mitglieder des Aufsichtsrats eingereicht worden, § 52 Abs. 3 S. 2 GmbHG."
    },
    {
      "date": "2025-01-03",
      "id": "97691",
      "original_text": "Registerbekanntmachung nach dem Umwandlungsgesetz\nBayern Amtsgericht München HRB 229345\nSSP Europe IT GmbH – München",
      "type": "Registerbekanntmachung nach dem Umwandlungsgesetz",
      "state": "Bayern",
      "amtsgericht": "Amtsgericht München",
      "registernummer": "HRB 229345",
      "registerart": "HRB",
      "company_name": "SSP Europe IT GmbH",
      "company_seat": "München",
      "details": "03.01.2025 (Bekanntmachungsdatum)\n\nBayern Amtsgericht München HRB 229345\nRegisterbekanntmachung nach dem Umwandlungsgesetz 02.01.2025 (Eintragungsdatum)\n\nSSP Europe IT GmbH\nGesellschaft mit beschränkter Haftung\nMünchen\n\nDen Gläubigern der an der Verschmelzung beteiligten Rechtsträger ist, wenn sie binnen sechs Monaten nach dem Tag, an dem die Eintragung der Verschmelzung in das Register des Sitzes desjenigen Rechtsträgers, dessen Gläubiger sie sind, nach § 19 Abs. 3 UmwG als bekannt gemacht gilt, ihren Anspruch nach Grund und Höhe in Textform anmelden, Sicherheit zu leisten, soweit sie nicht Befriedigung verlangen können. Dieses Recht steht den Gläubigern jedoch nur zu, wenn sie glaubhaft machen, dass durch die Verschmelzung die Erfüllung ihrer Forderung gefährdet wird."
    },
    {
      "date": "2025-01-03",
      "id": "97692",
      "original_text": "Sonstige Registerbekanntmachung\nBayern Amtsgericht München HRB 226674\nSana Medizintechnisches Servicezentrum GmbH – Ismaning",
      "type": "Sonstige Registerbekanntmachung",
      "state": "Bayern",
      "amtsgericht": "Amtsgericht München",
      "registernummer": "HRB 226674",
      "registerart": "HRB",
      "company_name": "Sana Medizintechnisches Servicezentrum GmbH",
      "company_seat": "Ismaning",
      "details": "03.01.2025 (Bekanntmachungsdatum)\n\nBayern Amtsgericht München HRB 226674\nSonstige Registerbekanntmachung 02.01.2025 (Eintragungsdatum)\n\nSana Medizintechnisches Servicezentrum GmbH\nGesellschaft mit beschränkter Haftung\nIsmaning\n\nDen Gläubigern der Gesellschaft, deren Forderungen begründet worden sind, bevor die Eintragung der Beendigung des Gewinnabführungsvertrages in das Handelsregister nach § 10 des Handelsgesetzbuches als bekanntgemacht gilt, hat der andere Vertragsteil Sicherheit zu leisten, wenn sie sich binnen sechs Monaten nach der Bekanntmachung der Eintragung zu diesem Zweck bei ihm melden."
    },
    {
      "date": "2025-01-03",
      "id": "97693",
      "original_text": "Registerbekanntmachung nach dem Umwandlungsgesetz\nBayern Amtsgericht München HRB 223391\nposterXXL GmbH – Kirchheim b.München",
      "type": "Registerbekanntmachung nach dem Umwandlungsgesetz",
      "state": "Bayern",
      "amtsgericht": "Amtsgericht München",
      "registernummer": "HRB 223391",
      "registerart": "HRB",
      "company_name": "posterXXL GmbH",
      "company_seat": "Kirchheim b.München",
      "details": "03.01.2025 (Bekanntmachungsdatum)\n\nBayern Amtsgericht München HRB 223391\nRegisterbekanntmachung nach dem Umwandlungsgesetz 02.01.2025 (Eintragungsdatum)\n\nposterXXL GmbH\nGesellschaft mit beschränkter Haftung\nKirchheim b.München\n\nDen Gläubigern der an der Verschmelzung beteiligten Rechtsträger ist, wenn sie binnen sechs Monaten nach dem Tag, an dem die Eintragung der Verschmelzung in das Register des Sitzes desjenigen Rechtsträgers, dessen Gläubiger sie sind, nach § 19 Abs. 3 UmwG als bekannt gemacht gilt, ihren Anspruch nach Grund und Höhe in Textform anmelden, Sicherheit zu leisten, soweit sie nicht Befriedigung verlangen können. Dieses Recht steht den Gläubigern jedoch nur zu, wenn sie glaubhaft machen, dass durch die Verschmelzung die Erfüllung ihrer Forderung gefährdet wird."
    },
    {
      "date": "2025-01-03",
      "id": "97694",
      "original_text": "Sonstige Registerbekanntmachung\nBayern Amtsgericht Fürth HRB 15446\nS&P Objektbeteiligungs DREI GmbH – Erlangen",
      "type": "Sonstige Registerbekanntmachung",
      "state": "Bayern",
      "amtsgericht": "Amtsgericht Fürth",
      "registernummer": "HRB 15446",
      "registerart": "HRB",
      "company_name": "S&P Objektbeteiligungs DREI GmbH",
      "company_seat": "Erlangen",
      "details": "03.01.2025 (Bekanntmachungsdatum)\n\nBayern Amtsgericht Fürth HRB 15446\nSonstige Registerbekanntmachung 02.01.2025 (Eintragungsdatum)\n\nS&P Objektbeteiligungs DREI GmbH\nGesellschaft mit beschränkter Haftung\nErlangen\n\nDen Gläubigern der Gesellschaft, deren Forderungen begründet worden sind, bevor die Eintragung der Beendigung des Gewinnabführungsvertrages in das Handelsregister nach § 10 des Handelsgesetzbuches als bekanntgemacht gilt, hat der andere Vertragsteil Sicherheit zu leisten, wenn sie sich binnen sechs Monaten nach der Bekanntmachung der Eintragung zu diesem Zweck bei ihm melden."
    },
    {
      "date": "2025-01-03",
      "id": "97695",
      "original_text": "Registerbekanntmachung nach dem Umwandlungsgesetz\nBayern Amtsgericht München HRB 68535\nAutohaus Feicht GmbH – Haar",
      "type": "Registerbekanntmachung nach dem Umwandlungsgesetz",
      "state": "Bayern",
      "amtsgericht": "Amtsgericht München",
      "registernummer": "HRB 68535",
      "registerart": "HRB",
      "company_name": "Autohaus Feicht GmbH",
      "company_seat": "Haar",
      "details": "03.01.2025 (Bekanntmachungsdatum)\n\nBayern Amtsgericht München HRB 68535\nRegisterbekanntmachung nach dem Umwandlungsgesetz 02.01.2025 (Eintragungsdatum)\n\nAutohaus Feicht GmbH\nGesellschaft mit beschränkter Haftung\nHaar\n\nDen Gläubigern der Gesellschaft, deren Forderungen begründet worden sind, bevor die Eintragung der Beendigung des Gewinnabführungsvertrages in das Handelsregister nach § 10 des Handelsgesetzbuches als bekanntgemacht gilt, hat der andere Vertragsteil Sicherheit zu leisten, wenn sie sich binnen sechs Monaten nach der Bekanntmachung der Eintragung zu diesem Zweck bei ihm melden."
    },
    {
      "date": "2025-01-03",
      "id": "97696",
      "original_text": "Sonstige Registerbekanntmachung\nBayern Amtsgericht München HRB 68535\nAutohaus Feicht GmbH – Haar",
      "type": "Sonstige Registerbekanntmachung",
      "state": "Bayern",
      "amtsgericht": "Amtsgericht München",
      "registernummer": "HRB 68535",
      "registerart": "HRB",
      "company_name": "Autohaus Feicht GmbH",
      "company_seat": "Haar",
      "details": "03.01.2025 (Bekanntmachungsdatum)\n\nBayern Amtsgericht München HRB 68535\nSonstige Registerbekanntmachung 02.01.2025 (Eintragungsdatum)\n\nAutohaus Feicht GmbH\nGesellschaft mit beschränkter Haftung\nHaar\n\nDen Gläubigern der Gesellschaft, deren Forderungen begründet worden sind, bevor die Eintragung der Beendigung des Gewinnabführungsvertrages in das Handelsregister nach § 10 des Handelsgesetzbuches als bekanntgemacht gilt, hat der andere Vertragsteil Sicherheit zu leisten, wenn sie sich binnen sechs Monaten nach der Bekanntmachung der Eintragung zu diesem Zweck bei ihm melden."
    },
    {
      "date": "2025-01-03",
      "id": "97697",
      "original_text": "Sonstige Registerbekanntmachung\nBayern Amtsgericht München HRB 178606\nLIVIA Fin AG – München",
      "type": "Sonstige Registerbekanntmachung",
      "state": "Bayern",
      "amtsgericht": "Amtsgericht München",
      "registernummer": "HRB 178606",
      "registerart": "HRB",
      "company_name": "LIVIA Fin AG",
      "company_seat": "München",
      "details": "03.01.2025 (Bekanntmachungsdatum)\n\nBayern Amtsgericht München HRB 178606\nSonstige Registerbekanntmachung 02.01.2025 (Eintragungsdatum)\n\nLIVIA Fin AG\nAktiengesellschaft\nMünchen\n\nDen Gläubigern der Gesellschaft, deren Forderungen begründet worden sind, bevor die Eintragung der Beendigung des Gewinnabführungsvertrages in das Handelsregister nach § 10 des Handelsgesetzbuches als bekanntgemacht gilt, hat der andere Vertragsteil Sicherheit zu leisten, wenn sie sich binnen sechs Monaten nach der Bekanntmachung der Eintragung zu diesem Zweck bei ihm melden."
    },
    {
      "date": "2025-01-03",
      "id": "97698",
      "original_text": "Einreichung neuer Dokumente\nBayern Amtsgericht Regensburg HRB 16689\nKössinger Verwaltungs AG – Schierling",
      "type": "Einreichung neuer Dokumente",
      "state": "Bayern",
      "amtsgericht": "Amtsgericht Regensburg",
      "registernummer": "HRB 16689",
      "registerart": "HRB",
      "company_name": "Kössinger Verwaltungs AG",
      "company_seat": "Schierling",
      "details": "03.01.2025 (Bekanntmachungsdatum)\n\nBayern Amtsgericht Regensburg HRB 16689\nEinreichung neuer Dokumente 02.01.2025 (Eintragungsdatum)\n\nKössinger Verwaltungs AG\nAktiengesellschaft\nSchierling\n\nDem Amtsgericht Regensburg -Registergericht- ist eine Liste der Mitglieder des Aufsichtsrats eingereicht worden, § 106 AktG."
    },
    {
      "date": "2025-01-03",
      "id": "97699",
      "original_text": "Registerbekanntmachung nach dem Umwandlungsgesetz\nBayern Amtsgericht München HRB 208986\nMCIP Management UG (haftungsbeschränkt) – Kirchheim",
      "type": "Registerbekanntmachung nach dem Umwandlungsgesetz",
      "state": "Bayern",
      "amtsgericht": "Amtsgericht München",
      "registernummer": "HRB 208986",
      "registerart": "HRB",
      "company_name": "MCIP Management UG (haftungsbeschränkt)",
      "company_seat": "Kirchheim",
      "details": "03.01.2025 (Bekanntmachungsdatum)\n\nBayern Amtsgericht München HRB 208986\nRegisterbekanntmachung nach dem Umwandlungsgesetz\n\nMCIP Management UG (haftungsbeschränkt)\nGesellschaft mit beschränkter Haftung\nKirchheim\n\nDen Gläubigern der an der Verschmelzung beteiligten Rechtsträger ist, wenn sie binnen sechs Monaten nach dem Tag, an dem die Eintragung der Verschmelzung in das Register des Sitzes desjenigen Rechtsträgers, dessen Gläubiger sie sind, nach § 19 Abs. 3 UmwG als bekannt gemacht gilt, ihren Anspruch nach Grund und Höhe in Textform anmelden, Sicherheit zu leisten, soweit sie nicht Befriedigung verlangen können. Dieses Recht steht den Gläubigern jedoch nur zu, wenn sie glaubhaft machen, dass durch die Verschmelzung die Erfüllung ihrer Forderung gefährdet wird."
    },
    {
      "date": "2025-01-03",
      "id": "97700",
      "original_text": "Löschungsankündigung\nBayern Amtsgericht München HRB 209373\nAUTOTECH Autokomponenten und Technologien GmbH – München",
      "type": "Löschungsankündigung",
      "state": "Bayern",
      "amtsgericht": "Amtsgericht München",
      "registernummer": "HRB 209373",
      "registerart": "HRB",
      "company_name": "AUTOTECH Autokomponenten und Technologien GmbH",
      "company_seat": "München",
      "details": "03.01.2025 (Bekanntmachungsdatum)\n\nBayern Amtsgericht München HRB 209373\nLöschungsankündigung\n\nAUTOTECH Autokomponenten und Technologien GmbH\nGesellschaft mit beschränkter Haftung\nMünchen\n\nDas Registergericht beabsichtigt, die im Handelsregister eingetragene Gesellschaft wegen Vermögenslosigkeit von Amts wegen nach § 394 FamFG zu löschen. Die Frist zur Erhebung eines Widerspruchs ist auf drei Monate festgesetzt."
    },
    {
      "date": "2025-01-03",
      "id": "97701",
      "original_text": "Sonstige Registerbekanntmachung\nBayern Amtsgericht München HRB 205810\nBHI Beauty & Health Investment Group Management GmbH – Unterföhring",
      "type": "Sonstige Registerbekanntmachung",
      "state": "Bayern",
      "amtsgericht": "Amtsgericht München",
      "registernummer": "HRB 205810",
      "registerart": "HRB",
      "company_name": "BHI Beauty & Health Investment Group Management GmbH",
      "company_seat": "Unterföhring",
      "details": "03.01.2025 (Bekanntmachungsdatum)\n\nBayern Amtsgericht München HRB 205810\nSonstige Registerbekanntmachung 02.01.2025 (Eintragungsdatum)\n\nBHI Beauty & Health Investment Group Management GmbH\nGesellschaft mit beschränkter Haftung\nUnterföhring\n\nDen Gläubigern der Gesellschaft, deren Forderungen begründet worden sind, bevor die Eintragung der Beendigung des Gewinnabführungsvertrages in das Handelsregister nach § 10 des Handelsgesetzbuches als bekanntgemacht gilt, hat der andere Vertragsteil Sicherheit zu leisten, wenn sie sich binnen sechs Monaten nach der Bekanntmachung der Eintragung zu diesem Zweck bei ihm melden."
    },
    {
      "date": "2025-01-03",
      "id": "97702",
      "original_text": "Registerbekanntmachung nach dem Umwandlungsgesetz\nBayern Amtsgericht Augsburg HRB 38281\nk2 solutions gmbh – Neusäß",
      "type": "Registerbekanntmachung nach dem Umwandlungsgesetz",
      "state": "Bayern",
      "amtsgericht": "Amtsgericht Augsburg",
      "registernummer": "HRB 38281",
      "registerart": "HRB",
      "company_name": "k2 solutions gmbh",
      "company_seat": "Neusäß",
      "details": "03.01.2025 (Bekanntmachungsdatum)\n\nBayern Amtsgericht Augsburg HRB 38281\nRegisterbekanntmachung nach dem Umwandlungsgesetz 02.01.2025 (Eintragungsdatum)\n\nk2 solutions gmbh\nGesellschaft mit beschränkter Haftung\nNeusäß\n\nDen Gläubigern der an der Verschmelzung beteiligten Rechtsträger ist, wenn sie binnen sechs Monaten nach dem Tag, an dem die Eintragung der Verschmelzung in das Register des Sitzes desjenigen Rechtsträgers, dessen Gläubiger sie sind, nach § 19 Abs. 3 UmwG als bekannt gemacht gilt, ihren Anspruch nach Grund und Höhe in Textform anmelden, Sicherheit zu leisten, soweit sie nicht Befriedigung verlangen können. Dieses Recht steht den Gläubigern jedoch nur zu, wenn sie glaubhaft machen, dass durch die Verschmelzung die Erfüllung ihrer Forderung gefährdet wird."
    },
    {
      "date": "2025-01-03",
      "id": "97703",
      "original_text": "Registerbekanntmachung nach dem Umwandlungsgesetz\nBayern Amtsgericht München HRB 53490\nRS Maschinenvertrieb GmbH – Germering",
      "type": "Registerbekanntmachung nach dem Umwandlungsgesetz",
      "state": "Bayern",
      "amtsgericht": "Amtsgericht München",
      "registernummer": "HRB 53490",
      "registerart": "HRB",
      "company_name": "RS Maschinenvertrieb GmbH",
      "company_seat": "Germering",
      "details": "03.01.2025 (Bekanntmachungsdatum)\n\nBayern Amtsgericht München HRB 53490\nRegisterbekanntmachung nach dem Umwandlungsgesetz 02.01.2025 (Eintragungsdatum)\n\nRS Maschinenvertrieb GmbH\nGesellschaft mit beschränkter Haftung\nGermering\n\nDen Gläubigern der an der Verschmelzung beteiligten Rechtsträger ist, wenn sie binnen sechs Monaten nach dem Tag, an dem die Eintragung der Verschmelzung in das Register des Sitzes desjenigen Rechtsträgers, dessen Gläubiger sie sind, nach § 19 Abs. 3 UmwG als bekannt gemacht gilt, ihren Anspruch nach Grund und Höhe in Textform anmelden, Sicherheit zu leisten, soweit sie nicht Befriedigung verlangen können. Dieses Recht steht den Gläubigern jedoch nur zu, wenn sie glaubhaft machen, dass durch die Verschmelzung die Erfüllung ihrer Forderung gefährdet wird."
    },
    {
      "date": "2025-01-03",
      "id": "97704",
      "original_text": "Sonstige Registerbekanntmachung\nBayern Amtsgericht München HRB 92253\nBuch Vertrieb Blank GmbH – Vierkirchen",
      "type": "Sonstige Registerbekanntmachung",
      "state": "Bayern",
      "amtsgericht": "Amtsgericht München",
      "registernummer": "HRB 92253",
      "registerart": "HRB",
      "company_name": "Buch Vertrieb Blank GmbH",
      "company_seat": "Vierkirchen",
      "details": "03.01.2025 (Bekanntmachungsdatum)\n\nBayern Amtsgericht München HRB 92253\nSonstige Registerbekanntmachung 02.01.2025 (Eintragungsdatum)\n\nBuch Vertrieb Blank GmbH\nGesellschaft mit beschränkter Haftung\nVierkirchen\n\nDen Gläubigern der Gesellschaft, deren Forderungen begründet worden sind, bevor die Eintragung der Beendigung des Beherrschungs- und Gewinnabführungsvertrages in das Handelsregister nach § 10 des Handelsgesetzbuches als bekanntgemacht gilt, hat der andere Vertragsteil Sicherheit zu leisten, wenn sie sich binnen sechs Monaten nach der Bekanntmachung der Eintragung zu diesem Zweck bei ihm melden."
    },
    {
      "date": "2025-01-03",
      "id": "97705",
      "original_text": "Registerbekanntmachung nach dem Umwandlungsgesetz\nBayern Amtsgericht Augsburg HRA 21844\nSchmittner Melanie Handelsvertretung e.K. – Dasing",
      "type": "Registerbekanntmachung nach dem Umwandlungsgesetz",
      "state": "Bayern",
      "amtsgericht": "Amtsgericht Augsburg",
      "registernummer": "HRA 21844",
      "registerart": "HRA",
      "company_name": "Schmittner Melanie Handelsvertretung e.K.",
      "company_seat": "Dasing",
      "details": "03.01.2025 (Bekanntmachungsdatum)\n\nBayern Amtsgericht Augsburg HRA 21844\nRegisterbekanntmachung nach dem Umwandlungsgesetz 02.01.2025 (Eintragungsdatum)\n\nSchmittner Melanie Handelsvertretung e.K.\nEinzelkaufmann / Einzelkauffrau\nDasing\n\nDen Gläubigern der an der Ausgliederung beteiligten Rechtsträger ist, wenn sie binnen sechs Monaten nach dem Tag, an dem die Eintragung der Ausgliederung in das Register des Sitzes desjenigen Rechtsträgers, dessen Gläubiger sie sind, nach §§ 125, 19 Abs. 3 UmwG als bekannt gemacht gilt, ihren Anspruch nach Grund und Höhe schriftlich anmelden, Sicherheit zu leisten, soweit sie nicht Befriedigung verlangen können. Dieses Recht steht den Gläubigern jedoch nur zu, wenn sie glaubhaft machen, dass durch die Ausgliederung die Erfüllung ihrer Forderung gefährdet wird."
    },
    {
      "date": "2025-01-03",
      "id": "97706",
      "original_text": "Einreichung neuer Dokumente\nBayern Amtsgericht Ingolstadt HRB 1\nAUDI Aktiengesellschaft – Ingolstadt",
      "type": "Einreichung neuer Dokumente",
      "state": "Bayern",
      "amtsgericht": "Amtsgericht Ingolstadt",
      "registernummer": "HRB 1",
      "registerart": "HRB",
      "company_name": "AUDI Aktiengesellschaft",
      "company_seat": "Ingolstadt",
      "details": "03.01.2025 (Bekanntmachungsdatum)\n\nBayern Amtsgericht Ingolstadt HRB 1\nEinreichung neuer Dokumente\n\nAUDI Aktiengesellschaft\nAktiengesellschaft\nIngolstadt\n\nDem Amtsgericht Ingolstadt -Registergericht- ist eine Liste der Mitglieder des Aufsichtsrats eingereicht worden, § 106 AktG."
    },
    {
      "date": "2025-01-03",
      "id": "97707",
      "original_text": "Löschungsankündigung\nBayern Amtsgericht Nürnberg HRB 27336\nLC Gastronomie Betriebs UG (haftungsbeschränkt) – Nürnberg",
      "type": "Löschungsankündigung",
      "state": "Bayern",
      "amtsgericht": "Amtsgericht Nürnberg",
      "registernummer": "HRB 27336",
      "registerart": "HRB",
      "company_name": "LC Gastronomie Betriebs UG (haftungsbeschränkt)",
      "company_seat": "Nürnberg",
      "details": "03.01.2025 (Bekanntmachungsdatum)\n\nBayern Amtsgericht Nürnberg HRB 27336\nLöschungsankündigung\n\nLC Gastronomie Betriebs UG (haftungsbeschränkt)\nGesellschaft mit beschränkter Haftung\nNürnberg\n\nDas Registergericht beabsichtigt, die im Handelsregister eingetragene Gesellschaft wegen Vermögenslosigkeit von Amts wegen nach § 394 FamFG zu löschen. Die Frist zur Erhebung eines Widerspruchs ist auf einen Monat festgesetzt."
    },
    {
      "date": "2025-01-03",
      "id": "97708",
      "original_text": "Löschungsankündigung\nBayern Amtsgericht Nürnberg HRB 27336\nLC Gastronomie Betriebs UG (haftungsbeschränkt) – Nürnberg",
      "type": "Löschungsankündigung",
      "state": "Bayern",
      "amtsgericht": "Amtsgericht Nürnberg",
      "registernummer": "HRB 27336",
      "registerart": "HRB",
      "company_name": "LC Gastronomie Betriebs UG (haftungsbeschränkt)",
      "company_seat": "Nürnberg",
      "details": "03.01.2025 (Bekanntmachungsdatum)\n\nBayern Amtsgericht Nürnberg HRB 27336\nLöschungsankündigung\n\nLC Gastronomie Betriebs UG (haftungsbeschränkt)\nGesellschaft mit beschränkter Haftung\nNürnberg\n\nDas Registergericht beabsichtigt, die im Handelsregister eingetragene Gesellschaft wegen Vermögenslosigkeit von Amts wegen nach § 394 FamFG zu löschen. Die Frist zur Erhebung eines Widerspruchs ist auf einen Monat festgesetzt."
    },
    {
      "date": "2025-01-03",
      "id": "97709",
      "original_text": "Sonstige Registerbekanntmachung\nBayern Amtsgericht München HRB 163554\nACTRON AG – Parsdorf",
      "type": "Sonstige Registerbekanntmachung",
      "state": "Bayern",
      "amtsgericht": "Amtsgericht München",
      "registernummer": "HRB 163554",
      "registerart": "HRB",
      "company_name": "ACTRON AG",
      "company_seat": "Parsdorf",
      "details": "03.01.2025 (Bekanntmachungsdatum)\n\nBayern Amtsgericht München HRB 163554\nSonstige Registerbekanntmachung 02.01.2025 (Eintragungsdatum)\n\nACTRON AG\nAktiengesellschaft\nParsdorf\n\nDen Gläubigern der Gesellschaft, deren Forderungen begründet worden sind, bevor die Eintragung der Beendigung des Gewinnabführungsvertrages in das Handelsregister nach § 10 des Handelsgesetzbuches als bekanntgemacht gilt, hat der andere Vertragsteil Sicherheit zu leisten, wenn sie sich binnen sechs Monaten nach der Bekanntmachung der Eintragung zu diesem Zweck bei ihm melden."
    },
    {
      "date": "2025-01-03",
      "id": "97710",
      "original_text": "Sonstige Registerbekanntmachung\nBayern Amtsgericht München HRB 222667\ncoffee fellows Hotel GmbH – Unterföhring",
      "type": "Sonstige Registerbekanntmachung",
      "state": "Bayern",
      "amtsgericht": "Amtsgericht München",
      "registernummer": "HRB 222667",
      "registerart": "HRB",
      "company_name": "coffee fellows Hotel GmbH",
      "company_seat": "Unterföhring",
      "details": "03.01.2025 (Bekanntmachungsdatum)\n\nBayern Amtsgericht München HRB 222667\nSonstige Registerbekanntmachung 02.01.2025 (Eintragungsdatum)\n\ncoffee fellows Hotel GmbH\nGesellschaft mit beschränkter Haftung\nUnterföhring\n\nDen Gläubigern der Gesellschaft, deren Forderungen begründet worden sind, bevor die Eintragung der Beendigung des Gewinnabführungsvertrages in das Handelsregister nach § 10 des Handelsgesetzbuches als bekanntgemacht gilt, hat der andere Vertragsteil Sicherheit zu leisten, wenn sie sich binnen sechs Monaten nach der Bekanntmachung der Eintragung zu diesem Zweck bei ihm melden."
    },
    {
      "date": "2025-01-03",
      "id": "97711",
      "original_text": "Registerbekanntmachung nach dem Umwandlungsgesetz\nBayern Amtsgericht Augsburg HRB 37839\nSGE Ingenieur GmbH – Mering",
      "type": "Registerbekanntmachung nach dem Umwandlungsgesetz",
      "state": "Bayern",
      "amtsgericht": "Amtsgericht Augsburg",
      "registernummer": "HRB 37839",
      "registerart": "HRB",
      "company_name": "SGE Ingenieur GmbH",
      "company_seat": "Mering",
      "details": "03.01.2025 (Bekanntmachungsdatum)\n\nBayern Amtsgericht Augsburg HRB 37839\nRegisterbekanntmachung nach dem Umwandlungsgesetz 02.01.2025 (Eintragungsdatum)\n\nSGE Ingenieur GmbH\nGesellschaft mit beschränkter Haftung\nMering\n\nDen Gläubigern der an der Spaltung beteiligten Rechtsträger ist, wenn sie binnen sechs Monaten nach dem Tag, an dem die Eintragung der Spaltung in das Register des Sitzes desjenigen Rechtsträgers, dessen Gläubiger sie sind, nach §§ 125, 19 Abs. 3 UmwG als bekannt gemacht gilt, ihren Anspruch nach Grund und Höhe in Textform anmelden, Sicherheit zu leisten, soweit sie nicht Befriedigung verlangen können. Dieses Recht steht den Gläubigern jedoch nur zu, wenn sie glaubhaft machen, dass durch die Spaltung die Erfüllung ihrer Forderung gefährdet wird."
    },
    {
      "date": "2025-01-03",
      "id": "97712",
      "original_text": "Sonstige Registerbekanntmachung\nBayern Amtsgericht München HRB 48768\nArabella Classic Cars GmbH – Wackersberg",
      "type": "Sonstige Registerbekanntmachung",
      "state": "Bayern",
      "amtsgericht": "Amtsgericht München",
      "registernummer": "HRB 48768",
      "registerart": "HRB",
      "company_name": "Arabella Classic Cars GmbH",
      "company_seat": "Wackersberg",
      "details": "03.01.2025 (Bekanntmachungsdatum)\n\nBayern Amtsgericht München HRB 48768\nSonstige Registerbekanntmachung 02.01.2025 (Eintragungsdatum)\n\nArabella Classic Cars GmbH\nGesellschaft mit beschränkter Haftung\nWackersberg\n\nDen Gläubigern der Gesellschaft, deren Forderungen begründet worden sind, bevor die Eintragung der Beendigung des Gewinnabführungsvertrages in das Handelsregister nach § 10 des Handelsgesetzbuches als bekanntgemacht gilt, hat der andere Vertragsteil Sicherheit zu leisten, wenn sie sich binnen sechs Monaten nach der Bekanntmachung der Eintragung zu diesem Zweck bei ihm melden."
    },
    {
      "date": "2025-01-03",
      "id": "97713",
      "original_text": "Registerbekanntmachung nach dem Umwandlungsgesetz\nBayern Amtsgericht München HRB 246132\nEncavis AM Komplementär GmbH – Neubiberg",
      "type": "Registerbekanntmachung nach dem Umwandlungsgesetz",
      "state": "Bayern",
      "amtsgericht": "Amtsgericht München",
      "registernummer": "HRB 246132",
      "registerart": "HRB",
      "company_name": "Encavis AM Komplementär GmbH",
      "company_seat": "Neubiberg",
      "details": "03.01.2025 (Bekanntmachungsdatum)\n\nBayern Amtsgericht München HRB 246132\nRegisterbekanntmachung nach dem Umwandlungsgesetz 02.01.2025 (Eintragungsdatum)\n\nEncavis AM Komplementär GmbH\nGesellschaft mit beschränkter Haftung\nNeubiberg\n\nDen Gläubigern der an der Verschmelzung beteiligten Rechtsträger ist, wenn sie binnen sechs Monaten nach dem Tag, an dem die Eintragung der Verschmelzung in das Register des Sitzes desjenigen Rechtsträgers, dessen Gläubiger sie sind, nach § 19 Abs. 3 UmwG als bekannt gemacht gilt, ihren Anspruch nach Grund und Höhe in Textform anmelden, Sicherheit zu leisten, soweit sie nicht Befriedigung verlangen können. Dieses Recht steht den Gläubigern jedoch nur zu, wenn sie glaubhaft machen, dass durch die Verschmelzung die Erfüllung ihrer Forderung gefährdet wird."
    },
    {
      "date": "2025-01-03",
      "id": "97714",
      "original_text": "Sonstige Registerbekanntmachung\nBayern Amtsgericht Regensburg HRB 8233\nBGW IMMOPROJEKT GmbH – Regensburg",
      "type": "Sonstige Registerbekanntmachung",
      "state": "Bayern",
      "amtsgericht": "Amtsgericht Regensburg",
      "registernummer": "HRB 8233",
      "registerart": "HRB",
      "company_name": "BGW IMMOPROJEKT GmbH",
      "company_seat": "Regensburg",
      "details": "03.01.2025 (Bekanntmachungsdatum)\n\nBayern Amtsgericht Regensburg HRB 8233\nSonstige Registerbekanntmachung 02.01.2025 (Eintragungsdatum)\n\nBGW IMMOPROJEKT GmbH\nGesellschaft mit beschränkter Haftung\nRegensburg\n\nDen Gläubigern der Gesellschaft, deren Forderungen begründet worden sind, bevor die Eintragung der Beendigung des Beherrschungs- und Gewinnabführungsvertrages in das Handelsregister nach § 10 des Handelsgesetzbuches als bekanntgemacht gilt, hat der andere Vertragsteil Sicherheit zu leisten, wenn sie sich binnen sechs Monaten nach der Bekanntmachung der Eintragung zu diesem Zweck bei ihm melden."
    },
    {
      "date": "2025-01-03",
      "id": "97715",
      "original_text": "Löschungsankündigung\nBayern Amtsgericht München HRB 210872\nITP Real Estate Management GmbH – Grünwald",
      "type": "Löschungsankündigung",
      "state": "Bayern",
      "amtsgericht": "Amtsgericht München",
      "registernummer": "HRB 210872",
      "registerart": "HRB",
      "company_name": "ITP Real Estate Management GmbH",
      "company_seat": "Grünwald",
      "details": "03.01.2025 (Bekanntmachungsdatum)\n\nBayern Amtsgericht München HRB 210872\nLöschungsankündigung\n\nITP Real Estate Management GmbH\nGesellschaft mit beschränkter Haftung\nGrünwald\n\nDas Registergericht beabsichtigt, die im Handelsregister eingetragene Gesellschaft wegen Vermögenslosigkeit von Amts wegen nach § 394 FamFG zu löschen. Die Frist zur Erhebung eines Widerspruchs ist auf drei Monate festgesetzt."
    },
    {
      "date": "2025-01-03",
      "id": "97716",
      "original_text": "Registerbekanntmachung nach dem Umwandlungsgesetz\nBayern Amtsgericht München HRB 165385\nPAI partners GmbH – München",
      "type": "Registerbekanntmachung nach dem Umwandlungsgesetz",
      "state": "Bayern",
      "amtsgericht": "Amtsgericht München",
      "registernummer": "HRB 165385",
      "registerart": "HRB",
      "company_name": "PAI partners GmbH",
      "company_seat": "München",
      "details": "03.01.2025 (Bekanntmachungsdatum)\n\nBayern Amtsgericht München HRB 165385\nRegisterbekanntmachung nach dem Umwandlungsgesetz 02.01.2025 (Eintragungsdatum)\n\nPAI partners GmbH\nGesellschaft mit beschränkter Haftung\nMünchen\n\nDen Gläubigern der an der Verschmelzung beteiligten Rechtsträger ist, wenn sie binnen sechs Monaten nach dem Tag, an dem die Eintragung der Verschmelzung in das Register des Sitzes desjenigen Rechtsträgers, dessen Gläubiger sie sind, nach § 19 Abs. 3 UmwG als bekannt gemacht gilt, ihren Anspruch nach Grund und Höhe in Textform anmelden, Sicherheit zu leisten, soweit sie nicht Befriedigung verlangen können. Dieses Recht steht den Gläubigern jedoch nur zu, wenn sie glaubhaft machen, dass durch die Verschmelzung die Erfüllung ihrer Forderung gefährdet wird."
    },
    {
      "date": "2025-01-03",
      "id": "97717",
      "original_text": "Registerbekanntmachung nach dem Umwandlungsgesetz\nBayern Amtsgericht Augsburg HRB 26767\nk2 solutions verwaltungs gmbh – Neusäß",
      "type": "Registerbekanntmachung nach dem Umwandlungsgesetz",
      "state": "Bayern",
      "amtsgericht": "Amtsgericht Augsburg",
      "registernummer": "HRB 26767",
      "registerart": "HRB",
      "company_name": "k2 solutions verwaltungs gmbh",
      "company_seat": "Neusäß",
      "details": "03.01.2025 (Bekanntmachungsdatum)\n\nBayern Amtsgericht Augsburg HRB 26767\nRegisterbekanntmachung nach dem Umwandlungsgesetz 02.01.2025 (Eintragungsdatum)\n\nk2 solutions verwaltungs gmbh\nGesellschaft mit beschränkter Haftung\nNeusäß\n\nDen Gläubigern der an der Verschmelzung beteiligten Rechtsträger ist, wenn sie binnen sechs Monaten nach dem Tag, an dem die Eintragung der Verschmelzung in das Register des Sitzes desjenigen Rechtsträgers, dessen Gläubiger sie sind, nach § 19 Abs. 3 UmwG als bekannt gemacht gilt, ihren Anspruch nach Grund und Höhe in Textform anmelden, Sicherheit zu leisten, soweit sie nicht Befriedigung verlangen können. Dieses Recht steht den Gläubigern jedoch nur zu, wenn sie glaubhaft machen, dass durch die Verschmelzung die Erfüllung ihrer Forderung gefährdet wird."
    },
    {
      "date": "2025-01-03",
      "id": "97718",
      "original_text": "Sonstige Registerbekanntmachung\nBayern Amtsgericht München HRB 283316\nLIVIA Finance IV GmbH – München",
      "type": "Sonstige Registerbekanntmachung",
      "state": "Bayern",
      "amtsgericht": "Amtsgericht München",
      "registernummer": "HRB 283316",
      "registerart": "HRB",
      "company_name": "LIVIA Finance IV GmbH",
      "company_seat": "München",
      "details": "03.01.2025 (Bekanntmachungsdatum)\n\nBayern Amtsgericht München HRB 283316\nSonstige Registerbekanntmachung 02.01.2025 (Eintragungsdatum)\n\nLIVIA Finance IV GmbH\nGesellschaft mit beschränkter Haftung\nMünchen\n\nDen Gläubigern der Gesellschaft, deren Forderungen begründet worden sind, bevor die Eintragung der Beendigung des Gewinnabführungsvertrages in das Handelsregister nach § 10 des Handelsgesetzbuches als bekanntgemacht gilt, hat der andere Vertragsteil Sicherheit zu leisten, wenn sie sich binnen sechs Monaten nach der Bekanntmachung der Eintragung zu diesem Zweck bei ihm melden."
    },
    {
      "date": "2025-01-03",
      "id": "97719",
      "original_text": "Sonstige Registerbekanntmachung\nBayern Amtsgericht Bamberg HRB 6059\nG+K Möbelvertriebs-GmbH – Oberhaid, Ortsteil Unterhaid",
      "type": "Sonstige Registerbekanntmachung",
      "state": "Bayern",
      "amtsgericht": "Amtsgericht Bamberg",
      "registernummer": "HRB 6059",
      "registerart": "HRB",
      "company_name": "G+K Möbelvertriebs-GmbH",
      "company_seat": "Oberhaid, Ortsteil Unterhaid",
      "details": "03.01.2025 (Bekanntmachungsdatum)\n\nBayern Amtsgericht Bamberg HRB 6059\nSonstige Registerbekanntmachung 02.01.2025 (Eintragungsdatum)\n\nG+K Möbelvertriebs-GmbH\nGesellschaft mit beschränkter Haftung\nOberhaid, Ortsteil Unterhaid\n\nDen Gläubigern der Gesellschaft, deren Forderungen begründet worden sind, bevor die Eintragung der Beendigung des Gewinnabführungsvertrages in das Handelsregister nach § 10 des Handelsgesetzbuches als bekanntgemacht gilt, hat der andere Vertragsteil Sicherheit zu leisten, wenn sie sich binnen sechs Monaten nach der Bekanntmachung der Eintragung zu diesem Zweck bei ihm melden."
    },
    {
      "date": "2025-01-03",
      "id": "97720",
      "original_text": "Sonstige Registerbekanntmachung\nBayern Amtsgericht Bamberg HRB 8982\nWoodroom Möbelvertriebs GmbH – Oberhaid, Ortsteil Unterhaid",
      "type": "Sonstige Registerbekanntmachung",
      "state": "Bayern",
      "amtsgericht": "Amtsgericht Bamberg",
      "registernummer": "HRB 8982",
      "registerart": "HRB",
      "company_name": "Woodroom Möbelvertriebs GmbH",
      "company_seat": "Oberhaid, Ortsteil Unterhaid",
      "details": "03.01.2025 (Bekanntmachungsdatum)\n\nBayern Amtsgericht Bamberg HRB 8982\nSonstige Registerbekanntmachung 02.01.2025 (Eintragungsdatum)\n\nWoodroom Möbelvertriebs GmbH\nGesellschaft mit beschränkter Haftung\nOberhaid, Ortsteil Unterhaid\n\nDen Gläubigern der Gesellschaft, deren Forderungen begründet worden sind, bevor die Eintragung der Beendigung des Gewinnabführungsvertrages in das Handelsregister nach § 10 des Handelsgesetzbuches als bekanntgemacht gilt, hat der andere Vertragsteil Sicherheit zu leisten, wenn sie sich binnen sechs Monaten nach der Bekanntmachung der Eintragung zu diesem Zweck bei ihm melden."
    },
    {
      "date": "2025-01-03",
      "id": "97721",
      "original_text": "Sonstige Registerbekanntmachung\nBayern Amtsgericht München HRB 85084\nE.E.P.D. - Electronic-Equipment-Produktion & Distribution GmbH – Weichs,",
      "type": "Sonstige Registerbekanntmachung",
      "state": "Bayern",
      "amtsgericht": "Amtsgericht München",
      "registernummer": "HRB 85084",
      "registerart": "HRB",
      "company_name": "E.E.P.D. - Electronic-Equipment-Produktion & Distribution GmbH",
      "company_seat": "Weichs,",
      "details": "03.01.2025 (Bekanntmachungsdatum)\n\nBayern Amtsgericht München HRB 85084\nSonstige Registerbekanntmachung 02.01.2025 (Eintragungsdatum)\n\nE.E.P.D. - Electronic-Equipment-Produktion & Distribution GmbH\nGesellschaft mit beschränkter Haftung\nWeichs,\n\nDen Gläubigern der Gesellschaft, deren Forderungen begründet worden sind, bevor die Eintragung der Beendigung des Beherrschungs- und Gewinnabführungsvertrages in das Handelsregister nach § 10 des Handelsgesetzbuches als bekanntgemacht gilt, hat der andere Vertragsteil Sicherheit zu leisten, wenn sie sich binnen sechs Monaten nach der Bekanntmachung der Eintragung zu diesem Zweck bei ihm melden."
    },
    {
      "date": "2025-01-03",
      "id": "97722",
      "original_text": "Sonstige Registerbekanntmachung\nBayern Amtsgericht München HRB 158482\nGroßkugel Immobilien- und Projektentwicklungs GmbH – München",
      "type": "Sonstige Registerbekanntmachung",
      "state": "Bayern",
      "amtsgericht": "Amtsgericht München",
      "registernummer": "HRB 158482",
      "registerart": "HRB",
      "company_name": "Großkugel Immobilien- und Projektentwicklungs GmbH",
      "company_seat": "München",
      "details": "03.01.2025 (Bekanntmachungsdatum)\n\nBayern Amtsgericht München HRB 158482\nSonstige Registerbekanntmachung 02.01.2025 (Eintragungsdatum)\n\nGroßkugel Immobilien- und Projektentwicklungs GmbH\nGesellschaft mit beschränkter Haftung\nMünchen\n\nDen Gläubigern der Gesellschaft, deren Forderungen begründet worden sind, bevor die Eintragung der Beendigung des Beherrschungs- und Gewinnabführungsvertrages in das Handelsregister nach § 10 des Handelsgesetzbuches als bekanntgemacht gilt, hat der andere Vertragsteil Sicherheit zu leisten, wenn sie sich binnen sechs Monaten nach der Bekanntmachung der Eintragung zu diesem Zweck bei ihm melden."
    },
    {
      "date": "2025-01-03",
      "id": "97723",
      "original_text": "Sonstige Registerbekanntmachung\nBayern Amtsgericht Würzburg HRB 4233\nHörgeräte Huth & Dickert GmbH – Würzburg",
      "type": "Sonstige Registerbekanntmachung",
      "state": "Bayern",
      "amtsgericht": "Amtsgericht Würzburg",
      "registernummer": "HRB 4233",
      "registerart": "HRB",
      "company_name": "Hörgeräte Huth & Dickert GmbH",
      "company_seat": "Würzburg",
      "details": "03.01.2025 (Bekanntmachungsdatum)\n\nBayern Amtsgericht Würzburg HRB 4233\nSonstige Registerbekanntmachung 02.01.2025 (Eintragungsdatum)\n\nHörgeräte Huth & Dickert GmbH\nGesellschaft mit beschränkter Haftung\nWürzburg\n\nDen Gläubigern der Gesellschaft, deren Forderungen begründet worden sind, bevor die Eintragung der Beendigung des Gewinnabführungsvertrages in das Handelsregister nach § 10 des Handelsgesetzbuches als bekanntgemacht gilt, hat der andere Vertragsteil Sicherheit zu leisten, wenn sie sich binnen sechs Monaten nach der Bekanntmachung der Eintragung zu diesem Zweck bei ihm melden."
    },
    {
      "date": "2025-01-03",
      "id": "97724",
      "original_text": "Registerbekanntmachung nach dem Umwandlungsgesetz\nBayern Amtsgericht Nürnberg HRA 19842\nAlbert Littau Unternehmensberatung eK – Lauf a. d. Pegnitz",
      "type": "Registerbekanntmachung nach dem Umwandlungsgesetz",
      "state": "Bayern",
      "amtsgericht": "Amtsgericht Nürnberg",
      "registernummer": "HRA 19842",
      "registerart": "HRA",
      "company_name": "Albert Littau Unternehmensberatung eK",
      "company_seat": "Lauf a. d. Pegnitz",
      "details": "03.01.2025 (Bekanntmachungsdatum)\n\nBayern Amtsgericht Nürnberg HRA 19842\nRegisterbekanntmachung nach dem Umwandlungsgesetz 02.01.2025 (Eintragungsdatum)\n\nAlbert Littau Unternehmensberatung eK\nEinzelkaufmann / Einzelkauffrau\nLauf a. d. Pegnitz\n\nDen Gläubigern der an der Ausgliederung beteiligten Rechtsträger ist, wenn sie binnen sechs Monaten nach dem Tag, an dem die Eintragung der Ausgliederung in das Register des Sitzes desjenigen Rechtsträgers, dessen Gläubiger sie sind, nach §§ 125, 19 Abs. 3 UmwG als bekannt gemacht gilt, ihren Anspruch nach Grund und Höhe in Textform anmelden, Sicherheit zu leisten, soweit sie nicht Befriedigung verlangen können. Dieses Recht steht den Gläubigern jedoch nur zu, wenn sie glaubhaft machen, dass durch die Ausgliederung die Erfüllung ihrer Forderung gefährdet wird."
    },
    {
      "date": "2025-01-03",
      "id": "97725",
      "original_text": "Registerbekanntmachung nach dem Umwandlungsgesetz\nBayern Amtsgericht Regensburg HRB 8439\nadEvents cross media AG – Regensburg",
      "type": "Registerbekanntmachung nach dem Umwandlungsgesetz",
      "state": "Bayern",
      "amtsgericht": "Amtsgericht Regensburg",
      "registernummer": "HRB 8439",
      "registerart": "HRB",
      "company_name": "adEvents cross media AG",
      "company_seat": "Regensburg",
      "details": "03.01.2025 (Bekanntmachungsdatum)\n\nBayern Amtsgericht Regensburg HRB 8439\nRegisterbekanntmachung nach dem Umwandlungsgesetz 02.01.2025 (Eintragungsdatum)\n\nadEvents cross media AG\nAktiengesellschaft\nRegensburg\n\nDen Gläubigern des formwechselnden Rechtsträgers ist, wenn sie binnen sechs Monaten nach dem Tag, an dem die Eintragung des Formwechsels nach § 201 UmwG als bekannt gemacht gilt, ihren Anspruch nach Grund und Höhe in Textform anmelden, Sicherheit zu leisten, soweit sie nicht Befriedigung verlangen können. Dieses Recht steht den Gläubigern jedoch nur zu, wenn sie glaubhaft machen, dass durch den Formwechsel die Erfüllung ihrer Forderung gefährdet wird."
    },
    {
      "date": "2025-01-03",
      "id": "97726",
      "original_text": "Löschungsankündigung\nBayern Amtsgericht München HRB 210872\nITP Real Estate Management GmbH – Grünwald",
      "type": "Löschungsankündigung",
      "state": "Bayern",
      "amtsgericht": "Amtsgericht München",
      "registernummer": "HRB 210872",
      "registerart": "HRB",
      "company_name": "ITP Real Estate Management GmbH",
      "company_seat": "Grünwald",
      "details": "03.01.2025 (Bekanntmachungsdatum)\n\nBayern Amtsgericht München HRB 210872\nLöschungsankündigung\n\nITP Real Estate Management GmbH\nGesellschaft mit beschränkter Haftung\nGrünwald\n\nDas Registergericht beabsichtigt, die im Handelsregister eingetragene Gesellschaft wegen Vermögenslosigkeit von Amts wegen nach § 394 FamFG zu löschen. Die Frist zur Erhebung eines Widerspruchs ist auf drei Monate festgesetzt."
    },
    {
      "date": "2025-01-03",
      "id": "97727",
      "original_text": "Registerbekanntmachung nach dem Umwandlungsgesetz\nBayern Amtsgericht München HRB 123355\nCloud SG Germany GmbH – München",
      "type": "Registerbekanntmachung nach dem Umwandlungsgesetz",
      "state": "Bayern",
      "amtsgericht": "Amtsgericht München",
      "registernummer": "HRB 123355",
      "registerart": "HRB",
      "company_name": "Cloud SG Germany GmbH",
      "company_seat": "München",
      "details": "03.01.2025 (Bekanntmachungsdatum)\n\nBayern Amtsgericht München HRB 123355\nRegisterbekanntmachung nach dem Umwandlungsgesetz 02.01.2025 (Eintragungsdatum)\n\nCloud SG Germany GmbH\nGesellschaft mit beschränkter Haftung\nMünchen\n\nDen Gläubigern der an der Verschmelzung beteiligten Rechtsträger ist, wenn sie binnen sechs Monaten nach dem Tag, an dem die Eintragung der Verschmelzung in das Register des Sitzes desjenigen Rechtsträgers, dessen Gläubiger sie sind, nach § 19 Abs. 3 UmwG als bekannt gemacht gilt, ihren Anspruch nach Grund und Höhe in Textform anmelden, Sicherheit zu leisten, soweit sie nicht Befriedigung verlangen können. Dieses Recht steht den Gläubigern jedoch nur zu, wenn sie glaubhaft machen, dass durch die Verschmelzung die Erfüllung ihrer Forderung gefährdet wird."
    },
    {
      "date": "2025-01-03",
      "id": "97728",
      "original_text": "Registerbekanntmachung nach dem Umwandlungsgesetz\nBayern Amtsgericht Nürnberg HRB 40890\nAlbert Littau GmbH – Lauf",
      "type": "Registerbekanntmachung nach dem Umwandlungsgesetz",
      "state": "Bayern",
      "amtsgericht": "Amtsgericht Nürnberg",
      "registernummer": "HRB 40890",
      "registerart": "HRB",
      "company_name": "Albert Littau GmbH",
      "company_seat": "Lauf",
      "details": "03.01.2025 (Bekanntmachungsdatum)\n\nBayern Amtsgericht Nürnberg HRB 40890\nRegisterbekanntmachung nach dem Umwandlungsgesetz 02.01.2025 (Eintragungsdatum)\n\nAlbert Littau GmbH\nGesellschaft mit beschränkter Haftung\nLauf\n\nDen Gläubigern der an der Ausgliederung beteiligten Rechtsträger ist, wenn sie binnen sechs Monaten nach dem Tag, an dem die Eintragung der Ausgliederung in das Register des Sitzes desjenigen Rechtsträgers, dessen Gläubiger sie sind, nach §§ 125, 19 Abs. 3 UmwG als bekannt gemacht gilt, ihren Anspruch nach Grund und Höhe in Textform anmelden, Sicherheit zu leisten, soweit sie nicht Befriedigung verlangen können. Dieses Recht steht den Gläubigern jedoch nur zu, wenn sie glaubhaft machen, dass durch die Ausgliederung die Erfüllung ihrer Forderung gefährdet wird."
    },
    {
      "date": "2025-01-03",
      "id": "97729",
      "original_text": "Löschungsankündigung\nBayern Amtsgericht München HRB 223344\nAccliN UG (haftungsbeschränkt) – München",
      "type": "Löschungsankündigung",
      "state": "Bayern",
      "amtsgericht": "Amtsgericht München",
      "registernummer": "HRB 223344",
      "registerart": "HRB",
      "company_name": "AccliN UG (haftungsbeschränkt)",
      "company_seat": "München",
      "details": "03.01.2025 (Bekanntmachungsdatum)\n\nBayern Amtsgericht München HRB 223344\nLöschungsankündigung 02.01.2025 (Eintragungsdatum)\n\nAccliN UG (haftungsbeschränkt)\nGesellschaft mit beschränkter Haftung\nMünchen\n\nDas Registergericht beabsichtigt, die im Handelsregister eingetragene Gesellschaft wegen Vermögenslosigkeit von Amts wegen nach § 394 FamFG zu löschen. Die Frist zur Erhebung eines Widerspruchs ist auf drei Monate festgesetzt."
    },
    {
      "date": "2025-01-03",
      "id": "97730",
      "original_text": "Sonstige Registerbekanntmachung\nBayern Amtsgericht München HRB 164088\nBucher Properties GmbH – München",
      "type": "Sonstige Registerbekanntmachung",
      "state": "Bayern",
      "amtsgericht": "Amtsgericht München",
      "registernummer": "HRB 164088",
      "registerart": "HRB",
      "company_name": "Bucher Properties GmbH",
      "company_seat": "München",
      "details": "03.01.2025 (Bekanntmachungsdatum)\n\nBayern Amtsgericht München HRB 164088\nSonstige Registerbekanntmachung 02.01.2025 (Eintragungsdatum)\n\nBucher Properties GmbH\nGesellschaft mit beschränkter Haftung\nMünchen\n\nDen Gläubigern der Gesellschaft, deren Forderungen begründet worden sind, bevor die Eintragung der Beendigung des Gewinnabführungsvertrages in das Handelsregister nach § 10 des Handelsgesetzbuches als bekanntgemacht gilt, hat der andere Vertragsteil Sicherheit zu leisten, wenn sie sich binnen sechs Monaten nach der Bekanntmachung der Eintragung zu diesem Zweck bei ihm melden."
    },
    {
      "date": "2025-01-03",
      "id": "97731",
      "original_text": "Sonstige Registerbekanntmachung\nHamburg Amtsgericht Hamburg HRB 36936\nOtto M. Schröder Bank Aktiengesellschaft – Hamburg",
      "type": "Sonstige Registerbekanntmachung",
      "state": "Hamburg",
      "amtsgericht": "Amtsgericht Hamburg",
      "registernummer": "HRB 36936",
      "registerart": "HRB",
      "company_name": "Otto M. Schröder Bank Aktiengesellschaft",
      "company_seat": "Hamburg",
      "details": "03.01.2025 (Bekanntmachungsdatum)\n\nHamburg Amtsgericht Hamburg HRB 36936\nSonstige Registerbekanntmachung\n\nOtto M. Schröder Bank Aktiengesellschaft\nAktiengesellschaft\nHamburg\n\nAls nicht eingetragen wird bekannt gemacht: Liste des Aufsichtsrats wurde eingereicht."
    },
    {
      "date": "2025-01-03",
      "id": "97732",
      "original_text": "Einreichung neuer Dokumente\nBaden-Württemberg Amtsgericht Mannheim HRB 107788\nEvangelischer Rundfunkdienst Baden ERB gGmbH – Karlsruhe",
      "type": "Einreichung neuer Dokumente",
      "state": "Baden-Württemberg",
      "amtsgericht": "Amtsgericht Mannheim",
      "registernummer": "HRB 107788",
      "registerart": "HRB",
      "company_name": "Evangelischer Rundfunkdienst Baden ERB gGmbH",
      "company_seat": "Karlsruhe",
      "details": "03.01.2025 (Bekanntmachungsdatum)\n\nBaden-Württemberg Amtsgericht Mannheim HRB 107788\nEinreichung neuer Dokumente\n\nEvangelischer Rundfunkdienst Baden ERB gGmbH\nGesellschaft mit beschränkter Haftung\nKarlsruhe\n\nDie Gesellschaft hat am 02.01.2025 die Liste über die Zusammensetzung des Aufsichtsrats zum Handelsregister eingereicht."
    },
    {
      "date": "2025-01-03",
      "id": "97733",
      "original_text": "Einreichung neuer Dokumente\nBaden-Württemberg Amtsgericht Ulm HRB 726246\nGesundheitszentren des Landkreises Göppingen GmbH – Göppingen",
      "type": "Einreichung neuer Dokumente",
      "state": "Baden-Württemberg",
      "amtsgericht": "Amtsgericht Ulm",
      "registernummer": "HRB 726246",
      "registerart": "HRB",
      "company_name": "Gesundheitszentren des Landkreises Göppingen GmbH",
      "company_seat": "Göppingen",
      "details": "03.01.2025 (Bekanntmachungsdatum)\n\nBaden-Württemberg Amtsgericht Ulm HRB 726246\nEinreichung neuer Dokumente\n\nGesundheitszentren des Landkreises Göppingen GmbH\nGesellschaft mit beschränkter Haftung\nGöppingen\n\nDie Gesellschaft hat am 27.12.2024 die Liste über die Zusammensetzung des Aufsichtsrats zum Handelsregister eingereicht."
    },
    {
      "date": "2025-01-03",
      "id": "97734",
      "original_text": "Registerbekanntmachung nach dem Umwandlungsgesetz\nBerlin Amtsgericht Berlin (Charlottenburg) HRB 214467\nFörderProfi GmbH – Berlin",
      "type": "Registerbekanntmachung nach dem Umwandlungsgesetz",
      "state": "Berlin",
      "amtsgericht": "Amtsgericht Berlin (Charlottenburg)",
      "registernummer": "HRB 214467",
      "registerart": "HRB",
      "company_name": "FörderProfi GmbH",
      "company_seat": "Berlin",
      "details": "03.01.2025 (Bekanntmachungsdatum)\n\nBerlin Amtsgericht Berlin (Charlottenburg) HRB 214467\nRegisterbekanntmachung nach dem Umwandlungsgesetz 02.01.2025 (Eintragungsdatum)\n\nFörderProfi GmbH\nGesellschaft mit beschränkter Haftung\nBerlin\n\nZu Eintragungsnummer 7 vom 02.01.2025 wird als nicht eingetragen veröffentlicht: Der andere Vertragsteil hat den Gläubigern dieses Rechtsträgers, deren Forderungen begründet worden sind, bevor die Eintragung der Beendigung dieses Vertrages in das Handelsregister nach § 10 des Handelsgesetzbuches als bekannt gemacht gilt, Sicherheit zu leisten, wenn sie sich binnen sechs Monaten nach der Bekanntmachung der Eintragung zu diesem Zweck bei ihm melden. Dieses Recht steht den Gläubigern nicht zu, die im Fall des Insolvenzverfahrens ein Recht auf vorzugsweise Befriedigung aus der Deckungsmasse haben, die nach gesetzlicher Vorschrift zu ihrem Schutz errichtet und staatlich überwacht ist."
    },
    {
      "date": "2025-01-03",
      "id": "97735",
      "original_text": "Löschungsankündigung\nBaden-Württemberg Amtsgericht Stuttgart HRB 737235\nHubark Bau GmbH – Besigheim",
      "type": "Löschungsankündigung",
      "state": "Baden-Württemberg",
      "amtsgericht": "Amtsgericht Stuttgart",
      "registernummer": "HRB 737235",
      "registerart": "HRB",
      "company_name": "Hubark Bau GmbH",
      "company_seat": "Besigheim",
      "details": "03.01.2025 (Bekanntmachungsdatum)\n\nBaden-Württemberg Amtsgericht Stuttgart HRB 737235\nLöschungsankündigung\n\nHubark Bau GmbH\nGesellschaft mit beschränkter Haftung\nBesigheim\n\nAls nicht eingetragen wird bekanntgemacht:\nDas Gericht beabsichtigt, die Gesellschaft wegen Vermögenslosigkeit im Handelsregister von Amts wegen nach § 394 FamFG zu löschen. Die Frist zur Geltendmachung eines Widerspruchs gegen die beabsichtigte Löschung ist auf zwei Monate ab Veröffentlichung bestimmt."
    },
    {
      "date": "2025-01-03",
      "id": "97736",
      "original_text": "Registerbekanntmachung nach dem Umwandlungsgesetz\nSaarland Amtsgericht Saarbrücken HRB 108131\nMemory Saarbrücken GmbH – Saarbrücken",
      "type": "Registerbekanntmachung nach dem Umwandlungsgesetz",
      "state": "Saarland",
      "amtsgericht": "Amtsgericht Saarbrücken",
      "registernummer": "HRB 108131",
      "registerart": "HRB",
      "company_name": "Memory Saarbrücken GmbH",
      "company_seat": "Saarbrücken",
      "details": "03.01.2025 (Bekanntmachungsdatum)\n\nSaarland Amtsgericht Saarbrücken HRB 108131\nRegisterbekanntmachung nach dem Umwandlungsgesetz 03.01.2025 (Eintragungsdatum)\n\nMemory Saarbrücken GmbH\nGesellschaft mit beschränkter Haftung\nSaarbrücken\n\nAls nicht eingetragen wird bekannt gemacht: Den Gläubigern der an der Umwandlung beteiligten Gesellschaften ist, wenn sie binnen sechs Monaten nach dem Tag, an dem die Eintragung der Umwandlung in das Register des Sitzes desjenigen Rechtsträgers, dessen Gläubiger sie sind, nach § 19 Absatz 3 UmwG bekannt gemacht worden ist, ihren Anspruch nach Grund und Höhe schriftlich anmelden, Sicherheit zu leisten, soweit sie nicht Befriedigung verlangen können. Dieses Recht steht den Gläubigern jedoch nur zu, wenn sie glaubhaft machen, dass durch die Umwandlung die Erfüllung ihrer Forderung gefährdet wird."
    },
    {
      "date": "2025-01-03",
      "id": "97737",
      "original_text": "Löschungsankündigung\nBerlin Amtsgericht Berlin (Charlottenburg) HRB 164267\nzuckerspecht verwaltungs GmbH – Berlin",
      "type": "Löschungsankündigung",
      "state": "Berlin",
      "amtsgericht": "Amtsgericht Berlin (Charlottenburg)",
      "registernummer": "HRB 164267",
      "registerart": "HRB",
      "company_name": "zuckerspecht verwaltungs GmbH",
      "company_seat": "Berlin",
      "details": "03.01.2025 (Bekanntmachungsdatum)\n\nBerlin Amtsgericht Berlin (Charlottenburg) HRB 164267\nLöschungsankündigung\n\nzuckerspecht verwaltungs GmbH\nGesellschaft mit beschränkter Haftung\nBerlin\n\nBei der nachstehenden Gesellschaft wird das Amtslöschungsverfahren gemäß § 394 FamFG eingeleitet. Widerspruchsfrist 6 Wochen"
    },
    {
      "date": "2025-01-03",
      "id": "97738",
      "original_text": "Löschungsankündigung\nBerlin Amtsgericht Berlin (Charlottenburg) HRB 159704\nFuture Way GmbH – Berlin",
      "type": "Löschungsankündigung",
      "state": "Berlin",
      "amtsgericht": "Amtsgericht Berlin (Charlottenburg)",
      "registernummer": "HRB 159704",
      "registerart": "HRB",
      "company_name": "Future Way GmbH",
      "company_seat": "Berlin",
      "details": "03.01.2025 (Bekanntmachungsdatum)\n\nBerlin Amtsgericht Berlin (Charlottenburg) HRB 159704\nLöschungsankündigung\n\nFuture Way GmbH\nGesellschaft mit beschränkter Haftung\nBerlin\n\nBei der nachstehenden Gesellschaft wird das Amtslöschungsverfahren gemäß § 394 FamFG eingeleitet. Widerspruchsfrist 6 Wochen"
    },
    {
      "date": "2025-01-03",
      "id": "97739",
      "original_text": "Registerbekanntmachung nach dem Umwandlungsgesetz\nBerlin Amtsgericht Berlin (Charlottenburg) HRB 81227\nC l a u d i a S c h u l t z Immobilien GmbH – Berlin",
      "type": "Registerbekanntmachung nach dem Umwandlungsgesetz",
      "state": "Berlin",
      "amtsgericht": "Amtsgericht Berlin (Charlottenburg)",
      "registernummer": "HRB 81227",
      "registerart": "HRB",
      "company_name": "C l a u d i a S c h u l t z Immobilien GmbH",
      "company_seat": "Berlin",
      "details": "03.01.2025 (Bekanntmachungsdatum)\n\nBerlin Amtsgericht Berlin (Charlottenburg) HRB 81227\nRegisterbekanntmachung nach dem Umwandlungsgesetz 30.12.2024 (Eintragungsdatum)\n\nC l a u d i a  S c h u l t z Immobilien GmbH\nGesellschaft mit beschränkter Haftung\nBerlin\n\nZu Eintragungsnummer 7 vom 30.12.2024 wird als nicht eingetragen veröffentlicht: Den Gläubigern der an der Verschmelzung beteiligten Rechtsträger ist, wenn sie binnen sechs Monaten nach dem Tag, an dem die Eintragung der Verschmelzung in das Register des Sitzes desjenigen Rechtsträgers, dessen Gläubiger sie sind, als bekannt gemacht gilt, ihren Anspruch nach Grund und Höhe schriftlich anmelden, Sicherheit zu leisten, soweit sie nicht Befriedigung verlangen können. Dieses Recht steht den Gläubigern jedoch nur zu, wenn sie glaubhaft machen, dass durch die Verschmelzung die Erfüllung ihrer Forderung gefährdet wird. Das Recht, Sicherheitsleistung zu verlangen, steht Gläubigern nicht zu, die im Falle der Insolvenz ein Recht auf vorzugsweise Befriedigung aus einer Deckungsmasse haben, die nach gesetzlicher Vorschrift zu ihrem Schutz errichtet und staatlich überwacht ist."
    },
    {
      "date": "2025-01-03",
      "id": "97740",
      "original_text": "Sonstige Registerbekanntmachung\nBaden-Württemberg Amtsgericht Freiburg HRB 601035\nWaldeck Klinik Verwaltungs GmbH – Bad Dürrheim",
      "type": "Sonstige Registerbekanntmachung",
      "state": "Baden-Württemberg",
      "amtsgericht": "Amtsgericht Freiburg",
      "registernummer": "HRB 601035",
      "registerart": "HRB",
      "company_name": "Waldeck Klinik Verwaltungs GmbH",
      "company_seat": "Bad Dürrheim",
      "details": "03.01.2025 (Bekanntmachungsdatum)\n\nBaden-Württemberg Amtsgericht Freiburg HRB 601035\nSonstige Registerbekanntmachung 03.01.2025 (Eintragungsdatum)\n\nWaldeck Klinik Verwaltungs GmbH\nGesellschaft mit beschränkter Haftung\nBad Dürrheim\n\nAls nicht eingetragen wird bekanntgemacht:\nDen Gläubigern der Gesellschaft, deren Forderungen begründet worden sind, bevor die Eintragung der Beendigung des Vertrages in das Handelsregister nach § 10 HGB als bekanntgemacht gilt, ist vom anderen Vertragsteil Sicherheit zu leisten, wenn sie sich binnen sechs Monaten nach der Bekanntmachung zu diesem Zweck bei ihm melden."
    },
    {
      "date": "2025-01-03",
      "id": "97741",
      "original_text": "Registerbekanntmachung nach dem Umwandlungsgesetz\nBaden-Württemberg Amtsgericht Stuttgart VR 724806\nJRE Origins e.V. – Neuhausen auf den Fildern",
      "type": "Registerbekanntmachung nach dem Umwandlungsgesetz",
      "state": "Baden-Württemberg",
      "amtsgericht": "Amtsgericht Stuttgart",
      "registernummer": "VR 724806",
      "registerart": "VR",
      "company_name": "JRE Origins e.V.",
      "company_seat": "Neuhausen auf den Fildern",
      "details": "03.01.2025 (Bekanntmachungsdatum)\n\nBaden-Württemberg Amtsgericht Stuttgart VR 724806\nRegisterbekanntmachung nach dem Umwandlungsgesetz 03.01.2025 (Eintragungsdatum)\n\nJRE Origins e.V.\neingetragener Verein\nNeuhausen auf den Fildern\n\nDen Gläubigern der an der Verschmelzung beteiligten Rechtsträger ist, wenn sie binnen sechs Monaten nach dem Tag, an dem die Eintragung der Verschmelzung in das Register des Sitzes desjenigen Rechtsträgers, dessen Gläubiger sie sind, nach § 19 Abs. 3 UmwG als bekanntgemacht gilt, ihren Anspruch nach Grund und Höhe schriftlich anmelden, Sicherheit zu leisten, soweit sie nicht Befriedigung verlangen können. Dieses Recht steht den Gläubigern jedoch nur zu, wenn sie glaubhaft machen, dass durch die Verschmelzung die Erfüllung ihrer Forderung gefährdet wird."
    },
    {
      "date": "2025-01-03",
      "id": "97742",
      "original_text": "Einreichung neuer Dokumente\nSachsen-Anhalt Amtsgericht Stendal HRB 107049\nWolmirstedter Wohnungsbaugesellschaft mbH – Wolmirstedt",
      "type": "Einreichung neuer Dokumente",
      "state": "Sachsen-Anhalt",
      "amtsgericht": "Amtsgericht Stendal",
      "registernummer": "HRB 107049",
      "registerart": "HRB",
      "company_name": "Wolmirstedter Wohnungsbaugesellschaft mbH",
      "company_seat": "Wolmirstedt",
      "details": "03.01.2025 (Bekanntmachungsdatum)\n\nSachsen-Anhalt Amtsgericht Stendal HRB 107049\nEinreichung neuer Dokumente\n\nWolmirstedter Wohnungsbaugesellschaft mbH\nGesellschaft mit beschränkter Haftung\nWolmirstedt\n\nEine Liste der Mitglieder des Aufsichtsrates wurde zum Handelsregister eingereicht."
    },
    {
      "date": "2025-01-03",
      "id": "97743",
      "original_text": "Löschungsankündigung\nBerlin Amtsgericht Berlin (Charlottenburg) HRB 198305\nArmalis Planquadrat GmbH – Berlin",
      "type": "Löschungsankündigung",
      "state": "Berlin",
      "amtsgericht": "Amtsgericht Berlin (Charlottenburg)",
      "registernummer": "HRB 198305",
      "registerart": "HRB",
      "company_name": "Armalis Planquadrat GmbH",
      "company_seat": "Berlin",
      "details": "03.01.2025 (Bekanntmachungsdatum)\n\nBerlin Amtsgericht Berlin (Charlottenburg) HRB 198305\nLöschungsankündigung\n\nArmalis Planquadrat GmbH\nGesellschaft mit beschränkter Haftung\nBerlin\n\nBei der nachstehenden Gesellschaft wird das Amtslöschungsverfahren gemäß § 394 FamFG eingeleitet. Widerspruchsfrist 6 Wochen"
    },
    {
      "date": "2025-01-03",
      "id": "97744",
      "original_text": "Löschungsankündigung\nBerlin Amtsgericht Berlin (Charlottenburg) HRB 186043\nRADA DKS Gebäudeservice GmbH – Berlin",
      "type": "Löschungsankündigung",
      "state": "Berlin",
      "amtsgericht": "Amtsgericht Berlin (Charlottenburg)",
      "registernummer": "HRB 186043",
      "registerart": "HRB",
      "company_name": "RADA DKS Gebäudeservice GmbH",
      "company_seat": "Berlin",
      "details": "03.01.2025 (Bekanntmachungsdatum)\n\nBerlin Amtsgericht Berlin (Charlottenburg) HRB 186043\nLöschungsankündigung\n\nRADA DKS Gebäudeservice GmbH\nGesellschaft mit beschränkter Haftung\nBerlin\n\nBei der nachstehenden Gesellschaft wird das Amtslöschungsverfahren gemäß § 394 FamFG eingeleitet. Widerspruchsfrist 6 Wochen"
    },
    {
      "date": "2025-01-03",
      "id": "97745",
      "original_text": "Sonstige Registerbekanntmachung\nSchleswig-Holstein Amtsgericht Lübeck HRB 17186\nDr. Klein Ratenkredit GmbH – Lübeck",
      "type": "Sonstige Registerbekanntmachung",
      "state": "Schleswig-Holstein",
      "amtsgericht": "Amtsgericht Lübeck",
      "registernummer": "HRB 17186",
      "registerart": "HRB",
      "company_name": "Dr. Klein Ratenkredit GmbH",
      "company_seat": "Lübeck",
      "details": "03.01.2025 (Bekanntmachungsdatum)\n\nSchleswig-Holstein Amtsgericht Lübeck HRB 17186\nSonstige Registerbekanntmachung 02.01.2025 (Eintragungsdatum)\n\nDr. Klein Ratenkredit GmbH\nGesellschaft mit beschränkter Haftung\nLübeck\n\nAls nicht eingetragen wird veröffentlicht:\nDen Gläubigern ist, wenn sie binnen sechs Monaten nach dem Tag, an dem die Eintragung der Aufhebung des Ergebnisabführungsvertrages als bekannt gemacht gilt, ihren Anspruch nach Grund und Höhe schriftlich anmelden, Sicherheit zu leisten, soweit sie nicht Befriedigung verlangen können. Dieses Recht steht den Gläubigern jedoch nur zu, wenn sie glaubhaft machen, dass durch die Aufhebung des Ergebnisabführungsvertrages die Erfüllung ihrer Forderung gefährdet wird."
    },
    {
      "date": "2025-01-03",
      "id": "97746",
      "original_text": "Sonstige Registerbekanntmachung\nSchleswig-Holstein Amtsgericht Lübeck HRB 17186\nDr. Klein Ratenkredit GmbH – Lübeck",
      "type": "Sonstige Registerbekanntmachung",
      "state": "Schleswig-Holstein",
      "amtsgericht": "Amtsgericht Lübeck",
      "registernummer": "HRB 17186",
      "registerart": "HRB",
      "company_name": "Dr. Klein Ratenkredit GmbH",
      "company_seat": "Lübeck",
      "details": "03.01.2025 (Bekanntmachungsdatum)\n\nSchleswig-Holstein Amtsgericht Lübeck HRB 17186\nSonstige Registerbekanntmachung 02.01.2025 (Eintragungsdatum)\n\nDr. Klein Ratenkredit GmbH\nGesellschaft mit beschränkter Haftung\nLübeck\n\nAls nicht eingetragen wird veröffentlicht:\nDen Gläubigern ist, wenn sie binnen sechs Monaten nach dem Tag, an dem die Eintragung der Aufhebung des Ergebnisabführungsvertrages als bekannt gemacht gilt, ihren Anspruch nach Grund und Höhe schriftlich anmelden, Sicherheit zu leisten, soweit sie nicht Befriedigung verlangen können. Dieses Recht steht den Gläubigern jedoch nur zu, wenn sie glaubhaft machen, dass durch die Aufhebung des Ergebnisabführungsvertrages die Erfüllung ihrer Forderung gefährdet wird."
    },
    {
      "date": "2025-01-03",
      "id": "97747",
      "original_text": "Sonstige Registerbekanntmachung\nBaden-Württemberg Amtsgericht Ulm HRB 630217\nZeppelin GmbH – Friedrichshafen",
      "type": "Sonstige Registerbekanntmachung",
      "state": "Baden-Württemberg",
      "amtsgericht": "Amtsgericht Ulm",
      "registernummer": "HRB 630217",
      "registerart": "HRB",
      "company_name": "Zeppelin GmbH",
      "company_seat": "Friedrichshafen",
      "details": "03.01.2025 (Bekanntmachungsdatum)\n\nBaden-Württemberg Amtsgericht Ulm HRB 630217\nSonstige Registerbekanntmachung\n\nZeppelin GmbH\nGesellschaft mit beschränkter Haftung\nFriedrichshafen\n\nDie Gesellschaft hat am 30.12.2024 die Liste über die Zusammensetzung des Aufsichtsrats zum Handelsregister eingereicht."
    },
    {
      "date": "2025-01-03",
      "id": "97748",
      "original_text": "Registerbekanntmachung nach dem Umwandlungsgesetz\nBaden-Württemberg Amtsgericht Mannheim HRB 739958\nANEXIA Managed Services Verwaltungs GmbH – Karlsruhe",
      "type": "Registerbekanntmachung nach dem Umwandlungsgesetz",
      "state": "Baden-Württemberg",
      "amtsgericht": "Amtsgericht Mannheim",
      "registernummer": "HRB 739958",
      "registerart": "HRB",
      "company_name": "ANEXIA Managed Services Verwaltungs GmbH",
      "company_seat": "Karlsruhe",
      "details": "03.01.2025 (Bekanntmachungsdatum)\n\nBaden-Württemberg Amtsgericht Mannheim HRB 739958\nRegisterbekanntmachung nach dem Umwandlungsgesetz 03.01.2025 (Eintragungsdatum)\n\nANEXIA Managed Services Verwaltungs GmbH\nGesellschaft mit beschränkter Haftung\nKarlsruhe\n\nAls nicht eingetragen wird bekanntgemacht: Den Gläubigern der an der Verschmelzung beteiligten Rechtsträger ist, wenn sie binnen sechs Monaten nach dem Tag, an dem die Eintragung der Verschmelzung in das Register des Sitzes desjenigen Rechtsträgers, dessen Gläubiger sie sind, nach § 19 Abs. 3 UmwG als bekanntgemacht gilt, ihren Anspruch nach Grund und Höhe schriftlich anmelden, Sicherheit zu leisten, soweit sie nicht Befriedigung verlangen können. Dieses Recht steht den Gläubigern jedoch nur zu, wenn sie glaubhaft machen, dass durch die Verschmelzung die Erfüllung ihrer Forderung gefährdet wird."
    },
    {
      "date": "2025-01-03",
      "id": "97749",
      "original_text": "Registerbekanntmachung nach dem Umwandlungsgesetz\nBaden-Württemberg Amtsgericht Mannheim HRB 745484\nANEXIA Deutschland GmbH – Karlsruhe",
      "type": "Registerbekanntmachung nach dem Umwandlungsgesetz",
      "state": "Baden-Württemberg",
      "amtsgericht": "Amtsgericht Mannheim",
      "registernummer": "HRB 745484",
      "registerart": "HRB",
      "company_name": "ANEXIA Deutschland GmbH",
      "company_seat": "Karlsruhe",
      "details": "03.01.2025 (Bekanntmachungsdatum)\n\nBaden-Württemberg Amtsgericht Mannheim HRB 745484\nRegisterbekanntmachung nach dem Umwandlungsgesetz 03.01.2025 (Eintragungsdatum)\n\nANEXIA Deutschland GmbH\nGesellschaft mit beschränkter Haftung\nKarlsruhe\n\nDen Gläubigern der an der Verschmelzung beteiligten Rechtsträger ist, wenn sie binnen sechs Monaten nach dem Tag, an dem die Eintragung der Verschmelzung in das Register des Sitzes desjenigen Rechtsträgers, dessen Gläubiger sie sind, nach § 19 Abs. 3 UmwG als bekanntgemacht gilt, ihren Anspruch nach Grund und Höhe schriftlich anmelden, Sicherheit zu leisten, soweit sie nicht Befriedigung verlangen können. Dieses Recht steht den Gläubigern jedoch nur zu, wenn sie glaubhaft machen, dass durch die Verschmelzung die Erfüllung ihrer Forderung gefährdet wird."
    },
    {
      "date": "2025-01-03",
      "id": "97750",
      "original_text": "Sonstige Registerbekanntmachung\nBerlin Amtsgericht Berlin (Charlottenburg) HRB 115208\nViessmann Werke Berlin GmbH – Berlin",
      "type": "Sonstige Registerbekanntmachung",
      "state": "Berlin",
      "amtsgericht": "Amtsgericht Berlin (Charlottenburg)",
      "registernummer": "HRB 115208",
      "registerart": "HRB",
      "company_name": "Viessmann Werke Berlin GmbH",
      "company_seat": "Berlin",
      "details": "03.01.2025 (Bekanntmachungsdatum)\n\nBerlin Amtsgericht Berlin (Charlottenburg) HRB 115208\nSonstige Registerbekanntmachung\n\nViessmann Werke Berlin GmbH\nGesellschaft mit beschränkter Haftung\nBerlin\n\nAls nicht eingetragen wird veröffentlicht: Der andere Vertragsteil hat den Gläubigern dieses Rechtsträgers, deren Forderungen begründet worden sind, bevor die Eintragung der Beendigung dieses Vertrages in das Handelsregister nach § 10 des Handelsgesetzbuches als bekannt gemacht gilt, Sicherheit zu leisten, wenn sie sich binnen sechs Monaten nach der Bekanntmachung der Eintragung zu diesem Zweck bei ihm melden. Dieses Recht steht den Gläubigern nicht zu, die im Fall des Insolvenzverfahrens ein Recht auf vorzugsweise Befriedigung aus der Deckungsmasse haben, die nach gesetzlicher Vorschrift zu ihrem Schutz errichtet und staatlich überwacht ist."
    },
    {
      "date": "2025-01-03",
      "id": "97751",
      "original_text": "Registerbekanntmachung nach dem Umwandlungsgesetz\nBaden-Württemberg Amtsgericht Mannheim HRB 738115\nHB security GmbH – Mannheim",
      "type": "Registerbekanntmachung nach dem Umwandlungsgesetz",
      "state": "Baden-Württemberg",
      "amtsgericht": "Amtsgericht Mannheim",
      "registernummer": "HRB 738115",
      "registerart": "HRB",
      "company_name": "HB security GmbH",
      "company_seat": "Mannheim",
      "details": "03.01.2025 (Bekanntmachungsdatum)\n\nBaden-Württemberg Amtsgericht Mannheim HRB 738115\nRegisterbekanntmachung nach dem Umwandlungsgesetz 03.01.2025 (Eintragungsdatum)\n\nHB security GmbH\nGesellschaft mit beschränkter Haftung\nMannheim\n\nAls nicht eingetragen wird bekanntgemacht:\nDen Gläubigern der an der Verschmelzung beteiligten Rechtsträger ist, wenn sie binnen sechs Monaten nach dem Tag, an dem die Eintragung der Verschmelzung in das Register des Sitzes desjenigen Rechtsträgers, dessen Gläubiger sie sind, nach § 19 Abs. 3 UmwG als bekanntgemacht gilt, ihren Anspruch nach Grund und Höhe schriftlich anmelden, Sicherheit zu leisten, soweit sie nicht Befriedigung verlangen können. Dieses Recht steht den Gläubigern jedoch nur zu, wenn sie glaubhaft machen, dass durch die Verschmelzung die Erfüllung ihrer Forderung gefährdet wird."
    },
    {
      "date": "2025-01-03",
      "id": "97752",
      "original_text": "Löschungsankündigung\nBerlin Amtsgericht Berlin (Charlottenburg) HRB 222551\nZindo UG (haftungsbeschränkt) – Berlin",
      "type": "Löschungsankündigung",
      "state": "Berlin",
      "amtsgericht": "Amtsgericht Berlin (Charlottenburg)",
      "registernummer": "HRB 222551",
      "registerart": "HRB",
      "company_name": "Zindo UG (haftungsbeschränkt)",
      "company_seat": "Berlin",
      "details": "03.01.2025 (Bekanntmachungsdatum)\n\nBerlin Amtsgericht Berlin (Charlottenburg) HRB 222551\nLöschungsankündigung\n\nZindo UG (haftungsbeschränkt)\nGesellschaft mit beschränkter Haftung\nBerlin\n\nBei der nachstehenden Gesellschaft wird das Amtslöschungsverfahren gemäß § 394 FamFG eingeleitet. Widerspruchsfrist 6 Wochen"
    },
    {
      "date": "2025-01-03",
      "id": "97753",
      "original_text": "Löschungsankündigung\nBerlin Amtsgericht Berlin (Charlottenburg) HRB 88550\nZEMIS Bau GmbH – Berlin",
      "type": "Löschungsankündigung",
      "state": "Berlin",
      "amtsgericht": "Amtsgericht Berlin (Charlottenburg)",
      "registernummer": "HRB 88550",
      "registerart": "HRB",
      "company_name": "ZEMIS Bau GmbH",
      "company_seat": "Berlin",
      "details": "03.01.2025 (Bekanntmachungsdatum)\n\nBerlin Amtsgericht Berlin (Charlottenburg) HRB 88550\nLöschungsankündigung\n\nZEMIS Bau GmbH\nGesellschaft mit beschränkter Haftung\nBerlin\n\nBei der nachstehenden Gesellschaft wird das Amtslöschungsverfahren gemäß § 394 FamFG eingeleitet. Widerspruchsfrist: 6 Wochen."
    },
    {
      "date": "2025-01-03",
      "id": "97754",
      "original_text": "Löschungsankündigung\nBerlin Amtsgericht Berlin (Charlottenburg) HRB 142492\nDEPAR Bau GmbH – Berlin",
      "type": "Löschungsankündigung",
      "state": "Berlin",
      "amtsgericht": "Amtsgericht Berlin (Charlottenburg)",
      "registernummer": "HRB 142492",
      "registerart": "HRB",
      "company_name": "DEPAR Bau GmbH",
      "company_seat": "Berlin",
      "details": "03.01.2025 (Bekanntmachungsdatum)\n\nBerlin Amtsgericht Berlin (Charlottenburg) HRB 142492\nLöschungsankündigung\n\nDEPAR Bau GmbH\nGesellschaft mit beschränkter Haftung\nBerlin\n\nEs ist beabsichtigt, die Eintragung wegen Mangels einer wesentlichen Voraussetzung gemäß § 395 FamFG von Amts wegen zu löschen. Widerspruchsfrist: 6 Wochen."
    },
    {
      "date": "2025-01-03",
      "id": "97755",
      "original_text": "Registerbekanntmachung nach dem Umwandlungsgesetz\nBaden-Württemberg Amtsgericht Mannheim HRB 744943\nHB & Hardman Security GmbH – Mannheim",
      "type": "Registerbekanntmachung nach dem Umwandlungsgesetz",
      "state": "Baden-Württemberg",
      "amtsgericht": "Amtsgericht Mannheim",
      "registernummer": "HRB 744943",
      "registerart": "HRB",
      "company_name": "HB & Hardman Security GmbH",
      "company_seat": "Mannheim",
      "details": "03.01.2025 (Bekanntmachungsdatum)\n\nBaden-Württemberg Amtsgericht Mannheim HRB 744943\nRegisterbekanntmachung nach dem Umwandlungsgesetz 03.01.2025 (Eintragungsdatum)\n\nHB & Hardman Security GmbH\nGesellschaft mit beschränkter Haftung\nMannheim\n\nAls nicht eingetragen wird bekanntgemacht:\nDen Gläubigern der an der Verschmelzung beteiligten Rechtsträger ist, wenn sie binnen sechs Monaten nach dem Tag, an dem die Eintragung der Verschmelzung in das Register des Sitzes desjenigen Rechtsträgers, dessen Gläubiger sie sind, nach § 19 Abs. 3 UmwG als bekanntgemacht gilt, ihren Anspruch nach Grund und Höhe schriftlich anmelden, Sicherheit zu leisten, soweit sie nicht Befriedigung verlangen können. Dieses Recht steht den Gläubigern jedoch nur zu, wenn sie glaubhaft machen, dass durch die Verschmelzung die Erfüllung ihrer Forderung gefährdet wird."
    },
    {
      "date": "2025-01-03",
      "id": "97756",
      "original_text": "Löschungsankündigung\nBerlin Amtsgericht Berlin (Charlottenburg) HRB 244073\nAsgard Investment GmbH – Berlin",
      "type": "Löschungsankündigung",
      "state": "Berlin",
      "amtsgericht": "Amtsgericht Berlin (Charlottenburg)",
      "registernummer": "HRB 244073",
      "registerart": "HRB",
      "company_name": "Asgard Investment GmbH",
      "company_seat": "Berlin",
      "details": "03.01.2025 (Bekanntmachungsdatum)\n\nBerlin Amtsgericht Berlin (Charlottenburg) HRB 244073\nLöschungsankündigung\n\nAsgard Investment GmbH\nGesellschaft mit beschränkter Haftung\nBerlin\n\nBei der nachstehenden Gesellschaft wird das Amtslöschungsverfahren gemäß § 394 FamFG eingeleitet. Widerspruchsfrist 6 Wochen"
    },
    {
      "date": "2025-01-03",
      "id": "97757",
      "original_text": "Einreichung neuer Dokumente\nBaden-Württemberg Amtsgericht Mannheim HRB 713801\nINTER Beteiligungen AG – Mannheim",
      "type": "Einreichung neuer Dokumente",
      "state": "Baden-Württemberg",
      "amtsgericht": "Amtsgericht Mannheim",
      "registernummer": "HRB 713801",
      "registerart": "HRB",
      "company_name": "INTER Beteiligungen AG",
      "company_seat": "Mannheim",
      "details": "03.01.2025 (Bekanntmachungsdatum)\n\nBaden-Württemberg Amtsgericht Mannheim HRB 713801\nEinreichung neuer Dokumente\n\nINTER Beteiligungen AG\nAktiengesellschaft\nMannheim\n\nDie Gesellschaft hat am 02.01.2025 die Liste über die Zusammensetzung des Aufsichtsrats zum Handelsregister eingereicht."
    },
    {
      "date": "2025-01-03",
      "id": "97758",
      "original_text": "Einreichung neuer Dokumente\nBerlin Amtsgericht Berlin (Charlottenburg) HRB 44314\nAdmiralspalast Aktien-Gesellschaft – Berlin",
      "type": "Einreichung neuer Dokumente",
      "state": "Berlin",
      "amtsgericht": "Amtsgericht Berlin (Charlottenburg)",
      "registernummer": "HRB 44314",
      "registerart": "HRB",
      "company_name": "Admiralspalast Aktien-Gesellschaft",
      "company_seat": "Berlin",
      "details": "03.01.2025 (Bekanntmachungsdatum)\n\nBerlin Amtsgericht Berlin (Charlottenburg) HRB 44314\nEinreichung neuer Dokumente\n\nAdmiralspalast Aktien-Gesellschaft\nAktiengesellschaft\nBerlin\n\nAls nicht eingetragen wird veröffentlicht: Es wurde eine neue Liste der Aufsichtsratsmitglieder eingereicht (§ 106 AktG)."
    },
    {
      "date": "2025-01-03",
      "id": "97759",
      "original_text": "Löschungsankündigung\nBerlin Amtsgericht Berlin (Charlottenburg) HRB 166929\nGlobal Immobilien Investment GmbH – Berlin",
      "type": "Löschungsankündigung",
      "state": "Berlin",
      "amtsgericht": "Amtsgericht Berlin (Charlottenburg)",
      "registernummer": "HRB 166929",
      "registerart": "HRB",
      "company_name": "Global Immobilien Investment GmbH",
      "company_seat": "Berlin",
      "details": "03.01.2025 (Bekanntmachungsdatum)\n\nBerlin Amtsgericht Berlin (Charlottenburg) HRB 166929\nLöschungsankündigung\n\nGlobal Immobilien Investment GmbH\nGesellschaft mit beschränkter Haftung\nBerlin\n\nBei der nachstehenden Gesellschaft wird das Amtslöschungsverfahren gemäß § 394 FamFG eingeleitet. Widerspruchsfrist 6 Wochen"
    },
    {
      "date": "2025-01-03",
      "id": "97760",
      "original_text": "Registerbekanntmachung nach dem Umwandlungsgesetz\nBrandenburg Amtsgericht Potsdam HRB 30746\nLDBS Lichtdienst GmbH – Falkensee",
      "type": "Registerbekanntmachung nach dem Umwandlungsgesetz",
      "state": "Brandenburg",
      "amtsgericht": "Amtsgericht Potsdam",
      "registernummer": "HRB 30746",
      "registerart": "HRB",
      "company_name": "LDBS Lichtdienst GmbH",
      "company_seat": "Falkensee",
      "details": "03.01.2025 (Bekanntmachungsdatum)\n\nBrandenburg Amtsgericht Potsdam HRB 30746\nRegisterbekanntmachung nach dem Umwandlungsgesetz 23.12.2024 (Eintragungsdatum)\n\nLDBS Lichtdienst GmbH\nGesellschaft mit beschränkter Haftung\nFalkensee\n\nZu Eintragungsnummer 17 vom 23.12.2024 wird als nicht eingetragen veröffentlicht:\nDen Gläubigern der an der Verschmelzung beteiligten Rechtsträger ist, wenn sie binnen sechs Monaten nach dem Tag, an dem die Eintragung der Verschmelzung in das Register des Sitzes desjenigen Rechtsträgers, dessen Gläubiger sie sind, als bekannt gemacht gilt, ihren Anspruch nach Grund und Höhe schriftlich anmelden, Sicherheit zu leisten, soweit sie nicht Befriedigung verlangen können. Dieses Recht steht den Gläubigern jedoch nur zu, wenn sie glaubhaft machen, dass durch die Verschmelzung die Erfüllung ihrer Forderung gefährdet wird."
    },
    {
      "date": "2025-01-03",
      "id": "97761",
      "original_text": "Sonstige Registerbekanntmachung\nSchleswig-Holstein Amtsgericht Lübeck HRB 6554\nStüber & Lenz GmbH – Oststeinbek",
      "type": "Sonstige Registerbekanntmachung",
      "state": "Schleswig-Holstein",
      "amtsgericht": "Amtsgericht Lübeck",
      "registernummer": "HRB 6554",
      "registerart": "HRB",
      "company_name": "Stüber & Lenz GmbH",
      "company_seat": "Oststeinbek",
      "details": "03.01.2025 (Bekanntmachungsdatum)\n\nSchleswig-Holstein Amtsgericht Lübeck HRB 6554\nSonstige Registerbekanntmachung 02.01.2025 (Eintragungsdatum)\n\nStüber & Lenz GmbH\nGesellschaft mit beschränkter Haftung\nOststeinbek\n\nAls nicht eingetragen wird veröffentlicht:  Als nicht eingetragen wird veröffentlicht: Der andere Vertragsteil hat den Gläubigern dieses Rechtsträgers, dessen Forderungen begründet worden sind, bevor die Eintragung der Beendigung dieses Vertrages in das Handelsregister nach § 10 des Handelsgesetzbuches als bekannt gemacht gilt, Sicherheit zu leisten, wenn sie sich binnen sechs Monaten nach der Bekanntmachung der Eintragung zu diesem Zweck bei ihm melden. Dieses Recht steht den Gläubigern nicht zu, die im Fall des Insolvenzverfahrens ein Recht auf vorzugsweise Befriedigung aus der Deckungsmasse haben, die nach gesetzlicher Vorschrift zu ihrem Schutz errichtet und staatlich überwacht ist."
    },
    {
      "date": "2025-01-03",
      "id": "97762",
      "original_text": "Sonstige Registerbekanntmachung\nBerlin Amtsgericht Berlin (Charlottenburg) HRB 214131\nLive Veranstaltungsgesellschaft mbH – Berlin",
      "type": "Sonstige Registerbekanntmachung",
      "state": "Berlin",
      "amtsgericht": "Amtsgericht Berlin (Charlottenburg)",
      "registernummer": "HRB 214131",
      "registerart": "HRB",
      "company_name": "Live Veranstaltungsgesellschaft mbH",
      "company_seat": "Berlin",
      "details": "03.01.2025 (Bekanntmachungsdatum)\n\nBerlin Amtsgericht Berlin (Charlottenburg) HRB 214131\nSonstige Registerbekanntmachung\n\nLive Veranstaltungsgesellschaft mbH\nGesellschaft mit beschränkter Haftung\nBerlin\n\nAls nicht eingetragen wird veröffentlicht: Der andere Vertragsteil hat den Gläubigern dieses Rechtsträgers, deren Forderungen begründet worden sind, bevor die Eintragung der Beendigung dieses Vertrages in das Handelsregister nach § 10 des Handelsgesetzbuches als bekannt gemacht gilt, Sicherheit zu leisten, wenn sie sich binnen sechs Monaten nach der Bekanntmachung der Eintragung zu diesem Zweck bei ihm melden. Dieses Recht steht den Gläubigern nicht zu, die im Fall des Insolvenzverfahrens ein Recht auf vorzugsweise Befriedigung aus der Deckungsmasse haben, die nach gesetzlicher Vorschrift zu ihrem Schutz errichtet und staatlich überwacht ist."
    },
    {
      "date": "2025-01-03",
      "id": "97763",
      "original_text": "Registerbekanntmachung nach dem Umwandlungsgesetz\nHamburg Amtsgericht Hamburg HRA 131823\nKinder-u. Jugendnothilfe Tülay Kantekin Ambulante Sozialpsychiatrie, Kinder- u. Jugendhilfe Hamburg e.K. – Hamburg",
      "type": "Registerbekanntmachung nach dem Umwandlungsgesetz",
      "state": "Hamburg",
      "amtsgericht": "Amtsgericht Hamburg",
      "registernummer": "HRA 131823",
      "registerart": "HRA",
      "company_name": "Kinder-u. Jugendnothilfe Tülay Kantekin Ambulante Sozialpsychiatrie, Kinder- u. Jugendhilfe Hamburg e.K.",
      "company_seat": "Hamburg",
      "details": "03.01.2025 (Bekanntmachungsdatum)\n\nHamburg Amtsgericht Hamburg HRA 131823\nRegisterbekanntmachung nach dem Umwandlungsgesetz 03.01.2025 (Eintragungsdatum)\n\nKinder-u. Jugendnothilfe Tülay Kantekin Ambulante Sozialpsychiatrie, Kinder- u. Jugendhilfe Hamburg e.K.\nEinzelkaufmann\nHamburg\n\nAls nicht eingetragen wird bekannt gemacht:\nDen Gläubigern der an der Ausgliederung beteiligten Gesellschaften ist, wenn sie binnen sechs Monaten nach dem Tag, an dem die Eintragung der Ausgliederung in das Register des Sitzes desjenigen Rechtsträgers, dessen Gläubiger sie sind, nach § 19 Absatz 3 UmwG als bekannt gemacht gilt, ihren Anspruch nach Grund und Höhe schriftlich anmelden, Sicherheit zu leisten, soweit sie nicht Befriedigung verlangen können. Dieses Recht steht den Gläubigern jedoch nur zu, wenn sie glaubhaft machen, dass durch die Ausgliederung die Erfüllung ihrer Forderung gefährdet wird."
    },
    {
      "date": "2025-01-03",
      "id": "97764",
      "original_text": "Registerbekanntmachung nach dem Umwandlungsgesetz\nHamburg Amtsgericht Hamburg HRB 187852\nATLAS Psychosoziale Dienste GmbH – Hamburg",
      "type": "Registerbekanntmachung nach dem Umwandlungsgesetz",
      "state": "Hamburg",
      "amtsgericht": "Amtsgericht Hamburg",
      "registernummer": "HRB 187852",
      "registerart": "HRB",
      "company_name": "ATLAS Psychosoziale Dienste GmbH",
      "company_seat": "Hamburg",
      "details": "03.01.2025 (Bekanntmachungsdatum)\n\nHamburg Amtsgericht Hamburg HRB 187852\nRegisterbekanntmachung nach dem Umwandlungsgesetz 03.01.2025 (Eintragungsdatum)\n\nATLAS Psychosoziale Dienste GmbH\nGesellschaft mit beschränkter Haftung\nHamburg\n\nAls nicht eingetragen wird bekannt gemacht:\nDen Gläubigern der an der Ausgliederung beteiligten Gesellschaften ist, wenn sie binnen sechs Monaten nach dem Tag, an dem die Eintragung der Ausgliederung in das Register des Sitzes desjenigen Rechtsträgers, dessen Gläubiger sie sind, nach § 19 Absatz 3 UmwG als bekannt gemacht gilt, ihren Anspruch nach Grund und Höhe schriftlich anmelden, Sicherheit zu leisten, soweit sie nicht Befriedigung verlangen können. Dieses Recht steht den Gläubigern jedoch nur zu, wenn sie glaubhaft machen, dass durch die Ausgliederung die Erfüllung ihrer Forderung gefährdet wird."
    },
    {
      "date": "2025-01-03",
      "id": "97765",
      "original_text": "Sonstige Registerbekanntmachung\nBerlin Amtsgericht Berlin (Charlottenburg) HRB 189716\nMOIA GmbH – Berlin",
      "type": "Sonstige Registerbekanntmachung",
      "state": "Berlin",
      "amtsgericht": "Amtsgericht Berlin (Charlottenburg)",
      "registernummer": "HRB 189716",
      "registerart": "HRB",
      "company_name": "MOIA GmbH",
      "company_seat": "Berlin",
      "details": "03.01.2025 (Bekanntmachungsdatum)\n\nBerlin Amtsgericht Berlin (Charlottenburg) HRB 189716\nSonstige Registerbekanntmachung 02.01.2025 (Eintragungsdatum)\n\nMOIA GmbH\nGesellschaft mit beschränkter Haftung\nBerlin\n\nAls nicht eingetragen wird veröffentlicht: Der andere Vertragsteil hat den Gläubigern dieses Rechtsträgers, deren Forderungen begründet worden sind, bevor die Eintragung der Beendigung dieses Vertrages in das Handelsregister nach § 10 des Handelsgesetzbuches als bekannt gemacht gilt, Sicherheit zu leisten, wenn sie sich binnen sechs Monaten nach der Bekanntmachung der Eintragung zu diesem Zweck bei ihm melden. Dieses Recht steht den Gläubigern nicht zu, die im Fall des Insolvenzverfahrens ein Recht auf vorzugsweise Befriedigung aus der Deckungsmasse haben, die nach gesetzlicher Vorschrift zu ihrem Schutz errichtet und staatlich überwacht ist."
    },
    {
      "date": "2025-01-03",
      "id": "97766",
      "original_text": "Löschungsankündigung\nBerlin Amtsgericht Berlin (Charlottenburg) HRB 250787\nntpk CLICKENHAUS UG (haftungsbeschränkt) – Berlin",
      "type": "Löschungsankündigung",
      "state": "Berlin",
      "amtsgericht": "Amtsgericht Berlin (Charlottenburg)",
      "registernummer": "HRB 250787",
      "registerart": "HRB",
      "company_name": "ntpk CLICKENHAUS UG (haftungsbeschränkt)",
      "company_seat": "Berlin",
      "details": "03.01.2025 (Bekanntmachungsdatum)\n\nBerlin Amtsgericht Berlin (Charlottenburg) HRB 250787\nLöschungsankündigung\n\nntpk CLICKENHAUS UG (haftungsbeschränkt)\nGesellschaft mit beschränkter Haftung\nBerlin\n\nBei der nachstehenden Gesellschaft wird das Amtslöschungsverfahren gemäß § 394 FamFG eingeleitet. Widerspruchsfrist 6 Wochen"
    },
    {
      "date": "2025-01-03",
      "id": "97767",
      "original_text": "Sonstige Registerbekanntmachung\nBerlin Amtsgericht Berlin (Charlottenburg) HRB 153845\nSanoanimal UG (haftungsbeschränkt) – Berlin",
      "type": "Sonstige Registerbekanntmachung",
      "state": "Berlin",
      "amtsgericht": "Amtsgericht Berlin (Charlottenburg)",
      "registernummer": "HRB 153845",
      "registerart": "HRB",
      "company_name": "Sanoanimal UG (haftungsbeschränkt)",
      "company_seat": "Berlin",
      "details": "03.01.2025 (Bekanntmachungsdatum)\n\nBerlin Amtsgericht Berlin (Charlottenburg) HRB 153845\nSonstige Registerbekanntmachung 03.01.2025 (Eintragungsdatum)\n\nSanoanimal UG (haftungsbeschränkt)\nGesellschaft mit beschränkter Haftung\nBerlin\n\nAls nicht eingetragen wird veröffentlicht: Der andere Vertragsteil hat den Gläubigern dieses Rechtsträgers, deren Forderungen begründet worden sind, bevor die Eintragung der Beendigung dieses Vertrages in das Handelsregister nach § 10 des Handelsgesetzbuches als bekannt gemacht gilt, Sicherheit zu leisten, wenn sie sich binnen sechs Monaten nach der Bekanntmachung der Eintragung zu diesem Zweck bei ihm melden. Dieses Recht steht den Gläubigern nicht zu, die im Fall des Insolvenzverfahrens ein Recht auf vorzugsweise Befriedigung aus der Deckungsmasse haben, die nach gesetzlicher Vorschrift zu ihrem Schutz errichtet und staatlich überwacht ist."
    },
    {
      "date": "2025-01-03",
      "id": "97768",
      "original_text": "Löschungsankündigung\nBerlin Amtsgericht Berlin (Charlottenburg) HRB 208156\nATIS GROUP UG (haftungsbeschränkt) – Berlin",
      "type": "Löschungsankündigung",
      "state": "Berlin",
      "amtsgericht": "Amtsgericht Berlin (Charlottenburg)",
      "registernummer": "HRB 208156",
      "registerart": "HRB",
      "company_name": "ATIS GROUP UG (haftungsbeschränkt)",
      "company_seat": "Berlin",
      "details": "03.01.2025 (Bekanntmachungsdatum)\n\nBerlin Amtsgericht Berlin (Charlottenburg) HRB 208156\nLöschungsankündigung\n\nATIS GROUP UG (haftungsbeschränkt)\nGesellschaft mit beschränkter Haftung\nBerlin\n\nEs ist die Löschung des Geschäftsführers Kolotenko gem. § 395 FamFG von Amts wegen beabsichtigt.\nWIderspruchsfrist: 4 Wochen."
    },
    {
      "date": "2025-01-03",
      "id": "97769",
      "original_text": "Registerbekanntmachung nach dem Umwandlungsgesetz\nBaden-Württemberg Amtsgericht Freiburg HRB 581694\nDiehl Defence Verwaltungs-GmbH – Überlingen",
      "type": "Registerbekanntmachung nach dem Umwandlungsgesetz",
      "state": "Baden-Württemberg",
      "amtsgericht": "Amtsgericht Freiburg",
      "registernummer": "HRB 581694",
      "registerart": "HRB",
      "company_name": "Diehl Defence Verwaltungs-GmbH",
      "company_seat": "Überlingen",
      "details": "03.01.2025 (Bekanntmachungsdatum)\n\nBaden-Württemberg Amtsgericht Freiburg HRB 581694\nRegisterbekanntmachung nach dem Umwandlungsgesetz 03.01.2025 (Eintragungsdatum)\n\nDiehl Defence Verwaltungs-GmbH\nGesellschaft mit beschränkter Haftung\nÜberlingen\n\nDen Gläubigern der an der Verschmelzung beteiligten Rechtsträger ist, wenn sie binnen sechs Monaten nach dem Tag, an dem die Eintragung der Verschmelzung in das Register des Sitzes desjenigen Rechtsträgers, dessen Gläubiger sie sind, nach § 19 Abs. 3 UmwG als bekanntgemacht gilt, ihren Anspruch nach Grund und Höhe schriftlich anmelden, Sicherheit zu leisten, soweit sie nicht Befriedigung verlangen können. Dieses Recht steht den Gläubigern jedoch nur zu, wenn sie glaubhaft machen, dass durch die Verschmelzung die Erfüllung ihrer Forderung gefährdet wird."
    },
    {
      "date": "2025-01-03",
      "id": "97770",
      "original_text": "Löschungsankündigung\nBerlin Amtsgericht Berlin (Charlottenburg) HRB 168164\nQuadriga Generalbau GmbH – Berlin",
      "type": "Löschungsankündigung",
      "state": "Berlin",
      "amtsgericht": "Amtsgericht Berlin (Charlottenburg)",
      "registernummer": "HRB 168164",
      "registerart": "HRB",
      "company_name": "Quadriga Generalbau GmbH",
      "company_seat": "Berlin",
      "details": "03.01.2025 (Bekanntmachungsdatum)\n\nBerlin Amtsgericht Berlin (Charlottenburg) HRB 168164\nLöschungsankündigung\n\nQuadriga Generalbau GmbH\nGesellschaft mit beschränkter Haftung\nBerlin\n\nEs ist die Löschung des Geschäftsführers Adolp gem. § 395 FamFG beabsichtigt. Widerspruchsfrist: 6 Wochen"
    },
    {
      "date": "2025-01-03",
      "id": "97771",
      "original_text": "Registerbekanntmachung nach dem Umwandlungsgesetz\nBrandenburg Amtsgericht Potsdam HRB 8355\nDretzener Landprodukte GmbH – Dretzen",
      "type": "Registerbekanntmachung nach dem Umwandlungsgesetz",
      "state": "Brandenburg",
      "amtsgericht": "Amtsgericht Potsdam",
      "registernummer": "HRB 8355",
      "registerart": "HRB",
      "company_name": "Dretzener Landprodukte GmbH",
      "company_seat": "Dretzen",
      "details": "03.01.2025 (Bekanntmachungsdatum)\n\nBrandenburg Amtsgericht Potsdam HRB 8355\nRegisterbekanntmachung nach dem Umwandlungsgesetz 20.12.2024 (Eintragungsdatum)\n\nDretzener Landprodukte GmbH\nGesellschaft mit beschränkter Haftung\nDretzen\n\nZu Eintragungsnummer 7 vom 20.12.2024 wird als nicht eingetragen veröffentlicht:\nDen Gläubigern der an der Verschmelzung beteiligten Rechtsträger ist, wenn sie binnen sechs Monaten nach dem Tag, an dem die Eintragung der Verschmelzung in das Register des Sitzes desjenigen Rechtsträgers, dessen Gläubiger sie sind, als bekannt gemacht gilt, ihren Anspruch nach Grund und Höhe schriftlich anmelden, Sicherheit zu leisten, soweit sie nicht Befriedigung verlangen können. Dieses Recht steht den Gläubigern jedoch nur zu, wenn sie glaubhaft machen, dass durch die Verschmelzung die Erfüllung ihrer Forderung gefährdet wird."
    },
    {
      "date": "2025-01-03",
      "id": "97772",
      "original_text": "Löschungsankündigung\nBerlin Amtsgericht Berlin (Charlottenburg) HRB 224887\nHELLOO Autohandel GmbH – Berlin",
      "type": "Löschungsankündigung",
      "state": "Berlin",
      "amtsgericht": "Amtsgericht Berlin (Charlottenburg)",
      "registernummer": "HRB 224887",
      "registerart": "HRB",
      "company_name": "HELLOO Autohandel GmbH",
      "company_seat": "Berlin",
      "details": "03.01.2025 (Bekanntmachungsdatum)\n\nBerlin Amtsgericht Berlin (Charlottenburg) HRB 224887\nLöschungsankündigung\n\nHELLOO Autohandel GmbH\nGesellschaft mit beschränkter Haftung\nBerlin\n\nBei der nachstehenden Gesellschaft wird das Amtslöschungsverfahren gemäß § 394 FamFG eingeleitet. Widerspruchsfrist 6 Wochen"
    },
    {
      "date": "2025-01-03",
      "id": "97773",
      "original_text": "Sonstige Registerbekanntmachung\nBerlin Amtsgericht Berlin (Charlottenburg) HRB 42166\nWoGeHe Wohnungsbaugesellschaft Hellersdorf mit beschränkter Haftung – Berlin",
      "type": "Sonstige Registerbekanntmachung",
      "state": "Berlin",
      "amtsgericht": "Amtsgericht Berlin (Charlottenburg)",
      "registernummer": "HRB 42166",
      "registerart": "HRB",
      "company_name": "WoGeHe Wohnungsbaugesellschaft Hellersdorf mit beschränkter Haftung",
      "company_seat": "Berlin",
      "details": "03.01.2025 (Bekanntmachungsdatum)\n\nBerlin Amtsgericht Berlin (Charlottenburg) HRB 42166\nSonstige Registerbekanntmachung\n\nWoGeHe Wohnungsbaugesellschaft Hellersdorf mit beschränkter Haftung\nGesellschaft mit beschränkter Haftung\nBerlin\n\nAls nicht eingetragen wird veröffentlicht: Der andere Vertragsteil hat den Gläubigern dieses Rechtsträgers, deren Forderungen begründet worden sind, bevor die Eintragung der Beendigung dieses Vertrages in das Handelsregister nach § 10 des Handelsgesetzbuches als bekannt gemacht gilt, Sicherheit zu leisten, wenn sie sich binnen sechs Monaten nach der Bekanntmachung der Eintragung zu diesem Zweck bei ihm melden. Dieses Recht steht den Gläubigern nicht zu, die im Fall des Insolvenzverfahrens ein Recht auf vorzugsweise Befriedigung aus der Deckungsmasse haben, die nach gesetzlicher Vorschrift zu ihrem Schutz errichtet und staatlich überwacht ist."
    },
    {
      "date": "2025-01-03",
      "id": "97774",
      "original_text": "Einreichung neuer Dokumente\nBrandenburg Amtsgericht Potsdam HRB 4326\nSanierungsträger Potsdam GmbH – Potsdam",
      "type": "Einreichung neuer Dokumente",
      "state": "Brandenburg",
      "amtsgericht": "Amtsgericht Potsdam",
      "registernummer": "HRB 4326",
      "registerart": "HRB",
      "company_name": "Sanierungsträger Potsdam GmbH",
      "company_seat": "Potsdam",
      "details": "03.01.2025 (Bekanntmachungsdatum)\n\nBrandenburg Amtsgericht Potsdam HRB 4326\nEinreichung neuer Dokumente\n\nSanierungsträger Potsdam GmbH\nGesellschaft mit beschränkter Haftung\nPotsdam\n\nAls nicht eingetragen wird veröffentlicht:\nEine Liste der Mitglieder des Aufsichtsrates wurde zum Handelsregister eingereicht."
    },
    {
      "date": "2025-01-03",
      "id": "97775",
      "original_text": "Löschungsankündigung\nSachsen Amtsgericht Chemnitz HRA 6216\nMeichsner Transporte GmbH & Co. KG – Schönheide",
      "type": "Löschungsankündigung",
      "state": "Sachsen",
      "amtsgericht": "Amtsgericht Chemnitz",
      "registernummer": "HRA 6216",
      "registerart": "HRA",
      "company_name": "Meichsner Transporte GmbH & Co. KG",
      "company_seat": "Schönheide",
      "details": "03.01.2025 (Bekanntmachungsdatum)\n\nSachsen Amtsgericht Chemnitz HRA 6216\nLöschungsankündigung\n\nMeichsner Transporte GmbH & Co. KG\nKommanditgesellschaft\nSchönheide\n\nDas Registergericht beabsichtigt, die im Handelsregister eingetragene Gesellschaft von Amts wegen nach § 394 FamFG zu löschen. Die Frist zu Erhebung eines Widerspruchs gegen die beabsichtigte Löschung wird auf einen Monat festgesetzt."
    },
    {
      "date": "2025-01-03",
      "id": "97776",
      "original_text": "Löschungsankündigung\nSachsen Amtsgericht Leipzig HRB 37757\nGuardian Security UG (haftungsbeschränkt) – Leipzig",
      "type": "Löschungsankündigung",
      "state": "Sachsen",
      "amtsgericht": "Amtsgericht Leipzig",
      "registernummer": "HRB 37757",
      "registerart": "HRB",
      "company_name": "Guardian Security UG (haftungsbeschränkt)",
      "company_seat": "Leipzig",
      "details": "03.01.2025 (Bekanntmachungsdatum)\n\nSachsen Amtsgericht Leipzig HRB 37757\nLöschungsankündigung 03.01.2025 (Eintragungsdatum)\n\nGuardian Security UG (haftungsbeschränkt)\nGesellschaft mit beschränkter Haftung\nLeipzig\n\nDas Registergericht beabsichtigt, den im Handelsregister eingetragenen Geschäftsführer Manuel Kiralyhalmi von Amts wegen nach § 395 Absatz 1 FamFG zu löschen. Die Frist zu Erhebung eines Widerspruchs gegen die beabsichtigte Löschung wird auf einen Monat festgesetzt."
    },
    {
      "date": "2025-01-03",
      "id": "97777",
      "original_text": "Löschungsankündigung\nSachsen Amtsgericht Chemnitz HRB 34049\nIFEA Substanz & Erhalt UG (haftungsbeschränkt) – Claußnitz",
      "type": "Löschungsankündigung",
      "state": "Sachsen",
      "amtsgericht": "Amtsgericht Chemnitz",
      "registernummer": "HRB 34049",
      "registerart": "HRB",
      "company_name": "IFEA Substanz & Erhalt UG (haftungsbeschränkt)",
      "company_seat": "Claußnitz",
      "details": "03.01.2025 (Bekanntmachungsdatum)\n\nSachsen Amtsgericht Chemnitz HRB 34049\nLöschungsankündigung\n\nIFEA Substanz & Erhalt UG (haftungsbeschränkt)\nGesellschaft mit beschränkter Haftung\nClaußnitz\n\nDas Registergericht beabsichtigt, die im Handelsregister eingetragene Gesellschaft von Amts wegen nach § 394 FamFG zu löschen. Die Frist zu Erhebung eines Widerspruchs gegen die beabsichtigte Löschung wird auf einen Monat festgesetzt."
    },
    {
      "date": "2025-01-03",
      "id": "97778",
      "original_text": "Registerbekanntmachung nach dem Umwandlungsgesetz\nSachsen Amtsgericht Chemnitz HRB 27371\nM. Simon Beteiligungs GmbH – Grünhainichen",
      "type": "Registerbekanntmachung nach dem Umwandlungsgesetz",
      "state": "Sachsen",
      "amtsgericht": "Amtsgericht Chemnitz",
      "registernummer": "HRB 27371",
      "registerart": "HRB",
      "company_name": "M. Simon Beteiligungs GmbH",
      "company_seat": "Grünhainichen",
      "details": "03.01.2025 (Bekanntmachungsdatum)\n\nSachsen Amtsgericht Chemnitz HRB 27371\nRegisterbekanntmachung nach dem Umwandlungsgesetz 03.01.2025 (Eintragungsdatum)\n\nM. Simon Beteiligungs GmbH\nGesellschaft mit beschränkter Haftung\nGrünhainichen\n\nDen Gläubigern der an der Umwandlung beteiligten Rechtsträger ist, wenn sie binnen sechs Monaten nach dem Tag, an dem die Eintragung der Umwandlung in das Register des Sitzes desjenigen Rechtsträgers, dessen Gläubiger sie sind, nach § 19 Abs. 3 UmwG als bekannt gemacht gilt, ihren Anspruch nach Grund und Höhe in Textform anmelden, Sicherheit zu leisten, soweit sie nicht Befriedigung verlangen können. Dieses Recht steht den Gläubigern jedoch nur zu, wenn sie glaubhaft machen, dass durch die Umwandlung die Erfüllung der Forderung gefährdet wird."
    },
    {
      "date": "2025-01-03",
      "id": "97779",
      "original_text": "Sonstige Registerbekanntmachung\nSachsen Amtsgericht Chemnitz HRB 18541\nFreiberger Bäderbetriebsgesellschaft mit beschränkter Haftung – Freiberg",
      "type": "Sonstige Registerbekanntmachung",
      "state": "Sachsen",
      "amtsgericht": "Amtsgericht Chemnitz",
      "registernummer": "HRB 18541",
      "registerart": "HRB",
      "company_name": "Freiberger Bäderbetriebsgesellschaft mit beschränkter Haftung",
      "company_seat": "Freiberg",
      "details": "03.01.2025 (Bekanntmachungsdatum)\n\nSachsen Amtsgericht Chemnitz HRB 18541\nSonstige Registerbekanntmachung\n\nFreiberger Bäderbetriebsgesellschaft mit beschränkter Haftung\nGesellschaft mit beschränkter Haftung\nFreiberg\n\nAm 30.12.2024 wurde beim Handelsregister des Amtsgerichts Chemnitz die Liste der Mitglieder des Aufsichtsrats gemäß § 52 GmbHG eingereicht."
    },
    {
      "date": "2025-01-03",
      "id": "97780",
      "original_text": "Löschungsankündigung\nSchleswig-Holstein Amtsgericht Flensburg HRB 815 SL\nBIECK EDV - Systemhaus GmbH – Kropp",
      "type": "Löschungsankündigung",
      "state": "Schleswig-Holstein",
      "amtsgericht": "Amtsgericht Flensburg",
      "registernummer": "HRB 815 SL",
      "registerart": "HRB",
      "company_name": "BIECK EDV - Systemhaus GmbH",
      "company_seat": "Kropp",
      "details": "03.01.2025 (Bekanntmachungsdatum)\n\nSchleswig-Holstein Amtsgericht Flensburg HRB 815 SL\nLöschungsankündigung\n\nBIECK EDV - Systemhaus GmbH\nGesellschaft mit beschränkter Haftung\nKropp\n\nEs ist die Löschung der nachstehenden Gesellschaft wegen Vermögenslosigkeit gemäß § 394 FamFG beabsichtigt.\nWiderspruchsfrist: 2 Monate."
    },
    {
      "date": "2025-01-03",
      "id": "97781",
      "original_text": "Registerbekanntmachung nach dem Umwandlungsgesetz\nNiedersachsen Amtsgericht Braunschweig HRB 554\nBraunschweig Beteiligungen GmbH – Braunschweig",
      "type": "Registerbekanntmachung nach dem Umwandlungsgesetz",
      "state": "Niedersachsen",
      "amtsgericht": "Amtsgericht Braunschweig",
      "registernummer": "HRB 554",
      "registerart": "HRB",
      "company_name": "Braunschweig Beteiligungen GmbH",
      "company_seat": "Braunschweig",
      "details": "03.01.2025 (Bekanntmachungsdatum)\n\nNiedersachsen Amtsgericht Braunschweig HRB 554\nRegisterbekanntmachung nach dem Umwandlungsgesetz 03.01.2025 (Eintragungsdatum)\n\nBraunschweig Beteiligungen GmbH\nGesellschaft mit beschränkter Haftung\nBraunschweig\n\nDen Gläubigern der an der Verschmelzung beteiligten Rechtsträger ist, wenn sie binnen sechs Monaten nach dem Tag, an dem die Eintragung der Verschmelzung in das Register des Sitzes desjenigen Rechtsträgers, dessen Gläubiger sie sind, nach § 19  Abs.  3 UmwG als bekannt gemacht gilt, ihren Anspruch nach Grund und Höhe schriftlich anmelden, Sicherheit zu leisten, soweit sie nicht Befriedigung verlangen können. Dieses Recht steht den Gläubigern jedoch nur zu, wenn sie glaubhaft machen, dass durch die Verschmelzung die Erfüllung der Forderung gefährdet wird."
    },
    {
      "date": "2025-01-03",
      "id": "97782",
      "original_text": "Registerbekanntmachung nach dem Umwandlungsgesetz\nNiedersachsen Amtsgericht Braunschweig HRB 3939\nBraunschweiger Bus- und Bahnbetriebsgesellschaft mbH – Braunschweig",
      "type": "Registerbekanntmachung nach dem Umwandlungsgesetz",
      "state": "Niedersachsen",
      "amtsgericht": "Amtsgericht Braunschweig",
      "registernummer": "HRB 3939",
      "registerart": "HRB",
      "company_name": "Braunschweiger Bus- und Bahnbetriebsgesellschaft mbH",
      "company_seat": "Braunschweig",
      "details": "03.01.2025 (Bekanntmachungsdatum)\n\nNiedersachsen Amtsgericht Braunschweig HRB 3939\nRegisterbekanntmachung nach dem Umwandlungsgesetz 03.01.2025 (Eintragungsdatum)\n\nBraunschweiger Bus- und Bahnbetriebsgesellschaft mbH\nGesellschaft mit beschränkter Haftung\nBraunschweig\n\nDen Gläubigern der an der Verschmelzung beteiligten Rechtsträger ist, wenn sie binnen sechs Monaten nach dem Tag, an dem die Eintragung der Verschmelzung in das Register des Sitzes desjenigen Rechtsträgers, dessen Gläubiger sie sind, nach § 19  Abs.  3 UmwG als bekannt gemacht gilt, ihren Anspruch nach Grund und Höhe schriftlich anmelden, Sicherheit zu leisten, soweit sie nicht Befriedigung verlangen können. Dieses Recht steht den Gläubigern jedoch nur zu, wenn sie glaubhaft machen, dass durch die Verschmelzung die Erfüllung der Forderung gefährdet wird."
    },
    {
      "date": "2025-01-03",
      "id": "97783",
      "original_text": "Sonstige Registerbekanntmachung\nNiedersachsen Amtsgericht Göttingen VR 202439\nIron doghead HMFC e.V. – Osterode am Harz",
      "type": "Sonstige Registerbekanntmachung",
      "state": "Niedersachsen",
      "amtsgericht": "Amtsgericht Göttingen",
      "registernummer": "VR 202439",
      "registerart": "VR",
      "company_name": "Iron doghead HMFC e.V.",
      "company_seat": "Osterode am Harz",
      "details": "03.01.2025 (Bekanntmachungsdatum)\n\nNiedersachsen Amtsgericht Göttingen VR 202439\nSonstige Registerbekanntmachung 03.01.2025 (Eintragungsdatum)\n\nIron doghead HMFC e.V.\neingetragener Verein\nOsterode am Harz\n\nVereinsanschrift: Katzensteiner Straße 127, 37520 Osterode am Harz"
    },
    {
      "date": "2025-01-03",
      "id": "97784",
      "original_text": "Löschungsankündigung\nNiedersachsen Amtsgericht Braunschweig HRB 100320 früher Amtsgericht Wolfsburg\nMöbel-Unger Handels GmbH Wolfsburg – Wolfsburg",
      "type": "Löschungsankündigung",
      "state": "Niedersachsen",
      "amtsgericht": "Amtsgericht Braunschweig",
      "registernummer": "HRB 100320",
      "registerart": "HRB",
      "company_name": "Möbel-Unger Handels GmbH Wolfsburg",
      "company_seat": "Wolfsburg",
      "former_amtsgericht": "Wolfsburg",
      "details": "03.01.2025 (Bekanntmachungsdatum)\n\nNiedersachsen Amtsgericht Braunschweig HRB 100320 früher Amtsgericht Wolfsburg\nLöschungsankündigung\n\nMöbel-Unger Handels GmbH Wolfsburg\nGesellschaft mit beschränkter Haftung\nWolfsburg\n\nDas Registergericht beabsichtigt, die Gesellschaft von Amts wegen nach § 394 FamFG zu löschen. Die Frist zur Erhebung eines Widerspruchs ist auf einen Monat ab dieser Registerbekanntmachung festgesetzt."
    },
    {
      "date": "2025-01-03",
      "id": "97785",
      "original_text": "Löschungsankündigung\nSchleswig-Holstein Amtsgericht Kiel HRB 19560\nGutPlan Nord GmbH – Neumünster",
      "type": "Löschungsankündigung",
      "state": "Schleswig-Holstein",
      "amtsgericht": "Amtsgericht Kiel",
      "registernummer": "HRB 19560",
      "registerart": "HRB",
      "company_name": "GutPlan Nord GmbH",
      "company_seat": "Neumünster",
      "details": "03.01.2025 (Bekanntmachungsdatum)\n\nSchleswig-Holstein Amtsgericht Kiel HRB 19560\nLöschungsankündigung\n\nGutPlan Nord GmbH\nGesellschaft mit beschränkter Haftung\nNeumünster\n\nEs ist die Löschung der nachstehenden Gesellschaft wegen Vermögenslosigkeit gemäß § 394 FamFG beabsichtigt. Widerspruchsfrist: 2 Monate."
    },
    {
      "date": "2025-01-03",
      "id": "97786",
      "original_text": "Registerbekanntmachung nach dem Umwandlungsgesetz\nRheinland-Pfalz Amtsgericht Ludwigshafen a.Rhein (Ludwigshafen) HRA 62376\nCapricorn GmbH & Co. KG – Haßloch",
      "type": "Registerbekanntmachung nach dem Umwandlungsgesetz",
      "state": "Rheinland-Pfalz",
      "amtsgericht": "Amtsgericht Ludwigshafen a.Rhein (Ludwigshafen)",
      "registernummer": "HRA 62376",
      "registerart": "HRA",
      "company_name": "Capricorn GmbH & Co. KG",
      "company_seat": "Haßloch",
      "details": "03.01.2025 (Bekanntmachungsdatum)\n\nRheinland-Pfalz Amtsgericht Ludwigshafen a.Rhein (Ludwigshafen) HRA 62376\nRegisterbekanntmachung nach dem Umwandlungsgesetz 11.12.2024 (Eintragungsdatum)\n\nCapricorn GmbH & Co. KG\nKommanditgesellschaft\nHaßloch\n\nGläubigern des bisherigen Rechtsträgers ist unter den Voraussetzungen der §§ 204, 22 UmwG Sicherheit zu leisten."
    },
    {
      "date": "2025-01-03",
      "id": "97787",
      "original_text": "Registerbekanntmachung nach dem Umwandlungsgesetz\nRheinland-Pfalz Amtsgericht Ludwigshafen a.Rhein (Ludwigshafen) HRB 62234\nCapricorn GmbH – Deidesheim",
      "type": "Registerbekanntmachung nach dem Umwandlungsgesetz",
      "state": "Rheinland-Pfalz",
      "amtsgericht": "Amtsgericht Ludwigshafen a.Rhein (Ludwigshafen)",
      "registernummer": "HRB 62234",
      "registerart": "HRB",
      "company_name": "Capricorn GmbH",
      "company_seat": "Deidesheim",
      "details": "03.01.2025 (Bekanntmachungsdatum)\n\nRheinland-Pfalz Amtsgericht Ludwigshafen a.Rhein (Ludwigshafen) HRB 62234\nRegisterbekanntmachung nach dem Umwandlungsgesetz 11.12.2024 (Eintragungsdatum)\n\nCapricorn GmbH\nGesellschaft mit beschränkter Haftung\nDeidesheim\n\nAls nicht eingetragen wird veröffentlicht:\nDen Gläubigern des formwechselnden Rechtsträgers ist, wenn sie binnen sechs Monaten nach dem Tag, an dem die Eintragung des Formwechsels nach § 201 UmwG als bekannt gemacht gilt, ihren Anspruch nach Grund und Höhe schriftlich anmelden, Sicherheit zu leisten, soweit sie nicht Befriedigung verlangen können. Dieses Recht steht den Gläubigern jedoch nur zu, wenn sie glaubhaft machen, dass durch den Formwechsel die Erfüllung der Forderung gefährdet wird. Gläubigern des bisherigen Rechtsträgers ist unter den Voraussetzungen der §§ 204, 22 UmwG Sicherheit zu leisten."
    },
    {
      "date": "2025-01-03",
      "id": "97788",
      "original_text": "Registerbekanntmachung nach dem Umwandlungsgesetz\nNordrhein-Westfalen Amtsgericht Neuss HRB 18174\nhippieness GmbH – Neuss",
      "type": "Registerbekanntmachung nach dem Umwandlungsgesetz",
      "state": "Nordrhein-Westfalen",
      "amtsgericht": "Amtsgericht Neuss",
      "registernummer": "HRB 18174",
      "registerart": "HRB",
      "company_name": "hippieness GmbH",
      "company_seat": "Neuss",
      "details": "03.01.2025 (Bekanntmachungsdatum)\n\nNordrhein-Westfalen Amtsgericht Neuss HRB 18174\nRegisterbekanntmachung nach dem Umwandlungsgesetz 03.01.2025 (Eintragungsdatum)\n\nhippieness GmbH\nGesellschaft mit beschränkter Haftung\nNeuss\n\nDen Gläubigern der an der Verschmelzung beteiligten Rechtsträger ist, wenn sie binnen sechs Monaten nach dem Tag, an dem die Eintragung der Verschmelzung in das Register des Sitzes derjenigen Rechtsträger deren Gläubiger sie sind, nach § 19 Absatz 3 UmwG als bekanntgemacht gilt, ihren Anspruch nach Grund und Höhe schriftlich anmelden, Sicherheit zu leisten, soweit sie nicht Befriedigung verlangen können. Dieses Recht steht den Gläubigern jedoch nur zu, wenn sie glaubhaft machen, dass durch die Verschmelzung die Erfüllung ihrer Forderung gefährdet wird."
    },
    {
      "date": "2025-01-03",
      "id": "97789",
      "original_text": "Registerbekanntmachung nach dem Umwandlungsgesetz\nNordrhein-Westfalen Amtsgericht Münster HRA 12019\nBergmann Polen-Projekt GmbH & Co. KG – Telgte",
      "type": "Registerbekanntmachung nach dem Umwandlungsgesetz",
      "state": "Nordrhein-Westfalen",
      "amtsgericht": "Amtsgericht Münster",
      "registernummer": "HRA 12019",
      "registerart": "HRA",
      "company_name": "Bergmann Polen-Projekt GmbH & Co. KG",
      "company_seat": "Telgte",
      "details": "03.01.2025 (Bekanntmachungsdatum)\n\nNordrhein-Westfalen Amtsgericht Münster HRA 12019\nRegisterbekanntmachung nach dem Umwandlungsgesetz 30.12.2024 (Eintragungsdatum)\n\nBergmann Polen-Projekt GmbH & Co. KG\nKommanditgesellschaft\nTelgte\n\nDen Gläubigern der an der formwechselnden Umwandlung beteiligten Rechtsträger ist, wenn sie binnen sechs Monaten nach dem Tag, an dem die Eintragung der formwechselnden Umwandlung in das Register des Sitzes derjenigen Rechtsträger deren Gläubiger sie sind, nach § 19 Absatz 3 UmwG als bekanntgemacht gilt, ihren Anspruch nach Grund und Höhe schriftlich anmelden, Sicherheit zu leisten, soweit sie nicht Befriedigung verlangen können. Dieses Recht steht den Gläubigern jedoch nur zu, wenn sie glaubhaft machen, dass durch die formwechselnden Umwandlung die Erfüllung ihrer Forderung gefährdet wird."
    },
    {
      "date": "2025-01-03",
      "id": "97790",
      "original_text": "Löschungsankündigung\nNordrhein-Westfalen Amtsgericht Düsseldorf HRB 79130\nDEFEI Technic GmbH – Düsseldorf",
      "type": "Löschungsankündigung",
      "state": "Nordrhein-Westfalen",
      "amtsgericht": "Amtsgericht Düsseldorf",
      "registernummer": "HRB 79130",
      "registerart": "HRB",
      "company_name": "DEFEI Technic GmbH",
      "company_seat": "Düsseldorf",
      "details": "03.01.2025 (Bekanntmachungsdatum)\n\nNordrhein-Westfalen Amtsgericht Düsseldorf HRB 79130\nLöschungsankündigung\n\nDEFEI Technic GmbH\nGesellschaft mit beschränkter Haftung\nDüsseldorf\n\nDas Registergericht beabsichtigt die Gesellschaft von Amts wegen nach § 394 FamFG zu löschen. Die Frist zur Erhebung eines Widerspruchs ist auf 3 Wochen festgesetzt.\n\nRechtsbehelfsbelehrung:\nDas Widerspruchsrecht steht jedem zu, der an der Unterlassung der Löschung ein berechtigtes Interesse hat. Der Widerspruch ist bei dem Amtsgericht Düsseldorf -Registergericht-, Werdener Straße 1, 40227 Düsseldorf schriftlich in deutscher Sprache oder zur Niederschrift der Geschäftsstelle einzulegen. Der Widerspruch kann auch zur Niederschrift der Geschäftsstelle eines jeden Amtsgerichtes abgegeben werden. Die Einlegung ist auch durch Übertragung eines elektronischen Dokuments an die elektronische Poststelle des Gerichts möglich. Das elektronische Dokument muss für die Bearbeitung durch das Gericht geeignet und mit einer qualifizierten elektronischen Signatur der verantwortenden Person versehen sein oder von der verantwortenden Person signiert und auf einem sicheren Übermittlungsweg gemäß § 130a ZPO nach näherer Maßgabe der Verordnung über die technischen Rahmenbedingungen des elektronischen Rechtsverkehrs und über das besondere elektronische Behördenpostfach (BGBl. I, S.3803) eingereicht werden. Weitere Informationen erhalten Sie auf der Internetseite www.justiz.de.\nDer Widerspruch muss spätestens innerhalb der gesetzten Frist nach dem Datum der Bekanntmachung der Löschungsankündigung bei dem Amtsgericht - Registergericht - Düsseldorf eingegangen sein.  Dies gilt auch dann, wenn der Widerspruch zur Niederschrift der Geschäftsstelle eines anderen Amtsgerichtes abgegeben wurde. Die Frist beginnt mit dem Tage der Bekanntmachung der Löschungsankündigung in dem für die Bekanntmachung der Eintragungen in das Handelsregister bestimmten elektronischen Informations- und Kommunikationssystem nach § 10 des Handelsgesetzbuches. Fällt das Ende der Frist auf einen Sonntag, einen allgemeinen Feiertag oder Sonnabend, so endet die Frist mit Ablauf des nächsten Werktages.\nDer Widerspruch muss die Bezeichnung der angefochtenen Löschungsankündigung sowie die Erklärung enthalten, dass Widerspruch gegen diese Löschungsankündigung eingelegt wird. Er ist zu unterzeichnen und soll begründet werden."
    },
    {
      "date": "2025-01-03",
      "id": "97791",
      "original_text": "Löschungsankündigung\nNordrhein-Westfalen Amtsgericht Essen HRB 24085\nM.Y. Unternehmergesellschaft (haftungsbeschränkt) – Essen",
      "type": "Löschungsankündigung",
      "state": "Nordrhein-Westfalen",
      "amtsgericht": "Amtsgericht Essen",
      "registernummer": "HRB 24085",
      "registerart": "HRB",
      "company_name": "M.Y. Unternehmergesellschaft (haftungsbeschränkt)",
      "company_seat": "Essen",
      "details": "03.01.2025 (Bekanntmachungsdatum)\n\nNordrhein-Westfalen Amtsgericht Essen HRB 24085\nLöschungsankündigung\n\nM.Y. Unternehmergesellschaft (haftungsbeschränkt)\nGesellschaft mit beschränkter Haftung\nEssen\n\nDas Registergericht beabsichtigt die Gesellschaft von Amts wegen nach § 394 FamFG zu löschen. Die Frist zur Erhebung eines Widerspruchs ist auf einen Monat festgesetzt."
    },
    {
      "date": "2025-01-03",
      "id": "97792",
      "original_text": "Registerbekanntmachung nach dem Umwandlungsgesetz\nNordrhein-Westfalen Amtsgericht Aachen HRB 8660\nQuip AG – Baesweiler",
      "type": "Registerbekanntmachung nach dem Umwandlungsgesetz",
      "state": "Nordrhein-Westfalen",
      "amtsgericht": "Amtsgericht Aachen",
      "registernummer": "HRB 8660",
      "registerart": "HRB",
      "company_name": "Quip AG",
      "company_seat": "Baesweiler",
      "details": "03.01.2025 (Bekanntmachungsdatum)\n\nNordrhein-Westfalen Amtsgericht Aachen HRB 8660\nRegisterbekanntmachung nach dem Umwandlungsgesetz 03.01.2025 (Eintragungsdatum)\n\nQuip AG\nAktiengesellschaft\nBaesweiler\n\nDen Gläubigern der an der formwechselnden Umwandlung beteiligten Rechtsträger ist, wenn sie binnen sechs Monaten nach dem Tag, an dem die Eintragung der formwechselnden Umwandlung in das Register des Sitzes desjenigen Rechtsträgers, dessen Gläubiger sie sind, nach § 19 Absatz 3 UmwG als bekanntgemacht gilt, ihren Anspruch nach Grund und Höhe schriftlich anmelden, Sicherheit zu leisten, soweit sie nicht Befriedigung verlangen können. Dieses Recht steht den Gläubigern jedoch nur zu, wenn sie glaubhaft machen, dass durch die formwechselnden Umwandlung die Erfüllung ihrer Forderung gefährdet wird."
    },
    {
      "date": "2025-01-03",
      "id": "97793",
      "original_text": "Löschungsankündigung\nNordrhein-Westfalen Amtsgericht Düsseldorf HRA 25962\nTheodorstraße Vermietungskommanditgesellschaft mbH & Co. KG – Düsseldorf",
      "type": "Löschungsankündigung",
      "state": "Nordrhein-Westfalen",
      "amtsgericht": "Amtsgericht Düsseldorf",
      "registernummer": "HRA 25962",
      "registerart": "HRA",
      "company_name": "Theodorstraße Vermietungskommanditgesellschaft mbH & Co. KG",
      "company_seat": "Düsseldorf",
      "details": "03.01.2025 (Bekanntmachungsdatum)\n\nNordrhein-Westfalen Amtsgericht Düsseldorf HRA 25962\nLöschungsankündigung\n\nTheodorstraße Vermietungskommanditgesellschaft mbH & Co. KG\nKommanditgesellschaft\nDüsseldorf\n\nDas Registergericht beabsichtigt die Firma von Amts wegen nach §§ 393 FamFG, 31 Abs. 2 HGB zu löschen. Die Frist zur Erhebung eines Widerspruchs ist auf drei Monate festgesetzt.\n\nRechtsbehelfsbelehrung:\nDas Widerspruchsrecht steht jedem zu, der an der Unterlassung der Löschung ein berechtigtes Interesse hat. Der Widerspruch ist bei dem Amtsgericht Düsseldorf -Registergericht-, Werdener Straße 1, 40227 Düsseldorf schriftlich in deutscher Sprache oder zur Niederschrift der Geschäftsstelle einzulegen. Der Widerspruch kann auch zur Niederschrift der Geschäftsstelle eines jeden Amtsgerichtes abgegeben werden. Die Einlegung ist auch durch Übertragung eines elektronischen Dokuments an die elektronische Poststelle des Gerichts möglich. Das elektronische Dokument muss für die Bearbeitung durch das Gericht geeignet und mit einer qualifizierten elektronischen Signatur der verantwortenden Person versehen sein oder von der verantwortenden Person signiert und auf einem sicheren Übermittlungsweg gemäß § 130a ZPO nach näherer Maßgabe der Verordnung über die technischen Rahmenbedingungen des elektronischen Rechtsverkehrs und über das besondere elektronische Behördenpostfach (BGBl. I, S.3803) eingereicht werden. Weitere Informationen erhalten Sie auf der Internetseite www.justiz.de.\nDer Widerspruch muss spätestens innerhalb der gesetzten Frist nach dem Datum der Bekanntmachung der Löschungsankündigung bei dem Amtsgericht - Registergericht - Düsseldorf eingegangen sein.  Dies gilt auch dann, wenn der Widerspruch zur Niederschrift der Geschäftsstelle eines anderen Amtsgerichtes abgegeben wurde. Die Frist beginnt mit dem Tage der Bekanntmachung der Löschungsankündigung in dem für die Bekanntmachung der Eintragungen in das Handelsregister bestimmten elektronischen Informations- und Kommunikationssystem nach § 10 des Handelsgesetzbuches. Fällt das Ende der Frist auf einen Sonntag, einen allgemeinen Feiertag oder Sonnabend, so endet die Frist mit Ablauf des nächsten Werktages.\nDer Widerspruch muss die Bezeichnung der angefochtenen Löschungsankündigung sowie die Erklärung enthalten, dass Widerspruch gegen diese Löschungsankündigung eingelegt wird. Er ist zu unterzeichnen und soll begründet werden."
    },
    {
      "date": "2025-01-03",
      "id": "97794",
      "original_text": "Löschungsankündigung\nNordrhein-Westfalen Amtsgericht Neuss HRB 20592\nKOBAKO Trading GmbH – Dormagen",
      "type": "Löschungsankündigung",
      "state": "Nordrhein-Westfalen",
      "amtsgericht": "Amtsgericht Neuss",
      "registernummer": "HRB 20592",
      "registerart": "HRB",
      "company_name": "KOBAKO Trading GmbH",
      "company_seat": "Dormagen",
      "details": "03.01.2025 (Bekanntmachungsdatum)\n\nNordrhein-Westfalen Amtsgericht Neuss HRB 20592\nLöschungsankündigung 23.12.2024 (Eintragungsdatum)\n\nKOBAKO Trading GmbH\nGesellschaft mit beschränkter Haftung\nDormagen\n\nDas Registergericht beabsichtigt die Gesellschaft von Amts wegen nach § 394 FamFG zu löschen. Die Frist zur Erhebung eines Widerspruchs ist auf einen Monat festgesetzt. Rechtsbehelfsbelehrung: Gegen diese Verfügung können Sie Widerspruch einlegen. Der Widerspruch ist bei dem Amtsgericht Neuss - Registergericht -, Breite Str. 48, 41460 Neuss schriftlich in deutscher Sprache oder zur Niederschrift der Geschäftsstelle einzulegen. Der Widerspruch kann auch zur Niederschrift der Geschäftsstelle eines jeden Amtsgerichtes abgegeben werden. Die Einlegung ist auch durch Übertragung eines elektronischen Dokuments an die elektronische Poststelle des Gerichts möglich. Das elektronische Dokument muss für die Bearbeitung durch das Gericht geeignet und mit einer qualifizierten elektronischen Signatur der verantwortenden Person versehen sein oder von der verantwortenden Person signiert und auf einem sicheren Übermittlungsweg gemäß § 130a ZPO nach näherer Maßgabe der Verordnung über die technischen Rahmenbedingungen des elektronischen Rechtsverkehrs und über das besondere elektronische Behördenpostfach (BGBl. I, S.3803) eingereicht werden. Weitere Informationen erhalten Sie auf der Internetseite www.justiz.de. Der Widerspruch muss spätestens innerhalb der gesetzten Frist nach der schriftlichen Bekanntgabe der Verfügung bei dem Amtsgericht - Registergericht - Neuss eingegangen sein. Dies gilt auch dann, wenn der Widerspruch zur Niederschrift der Geschäftsstelle eines anderen Amtsgerichtes abgegeben wurde. Die Frist beginnt mit der schriftlichen Bekanntgabe der Verfügung. Die Bekanntgabe ist entweder durch Zustellung oder am dritten Tage nach Aufgabe zur Post bewirkt. Fällt das Ende der Frist auf einen Sonntag, einen allgemeinen Feiertag oder Sonnabend, so endet die Frist mit Ablauf des nächsten Werktages. Der Widerspruch muss die Bezeichnung der angefochtenen Verfügung sowie die Erklärung enthalten, dass Widerspruch gegen diese Verfügung eingelegt wird. Er ist zu unterzeichnen und soll begründet werden."
    },
    {
      "date": "2025-01-03",
      "id": "97795",
      "original_text": "Registerbekanntmachung nach dem Umwandlungsgesetz\nNordrhein-Westfalen Amtsgericht Recklinghausen HRB 7891\nVest Metall UG (haftungsbeschränkt) – Oer-Erkenschwick",
      "type": "Registerbekanntmachung nach dem Umwandlungsgesetz",
      "state": "Nordrhein-Westfalen",
      "amtsgericht": "Amtsgericht Recklinghausen",
      "registernummer": "HRB 7891",
      "registerart": "HRB",
      "company_name": "Vest Metall UG (haftungsbeschränkt)",
      "company_seat": "Oer-Erkenschwick",
      "details": "03.01.2025 (Bekanntmachungsdatum)\n\nNordrhein-Westfalen Amtsgericht Recklinghausen HRB 7891\nRegisterbekanntmachung nach dem Umwandlungsgesetz 03.01.2025 (Eintragungsdatum)\n\nVest Metall UG (haftungsbeschränkt)\nGesellschaft mit beschränkter Haftung\nOer-Erkenschwick\n\nDen Gläubigern der an der Verschmelzung beteiligten Rechtsträger ist, wenn sie binnen sechs Monaten nach dem Tag, an dem die Eintragung der Verschmelzung in das Register des Sitzes desjenigen Rechtsträgers, dessen Gläubiger sie sind, nach § 19 Absatz 3 UmwG als bekanntgemacht gilt, ihren Anspruch nach Grund und Höhe schriftlich anmelden, Sicherheit zu leisten, soweit sie nicht Befriedigung verlangen können. Dieses Recht steht den Gläubigern jedoch nur zu, wenn sie glaubhaft machen, dass durch die Verschmelzung die Erfüllung ihrer Forderung gefährdet wird."
    },
    {
      "date": "2025-01-03",
      "id": "97796",
      "original_text": "Sonstige Registerbekanntmachung\nNordrhein-Westfalen Amtsgericht Bonn HRB 1115\nBonner City Parkraum GmbH – Bonn",
      "type": "Sonstige Registerbekanntmachung",
      "state": "Nordrhein-Westfalen",
      "amtsgericht": "Amtsgericht Bonn",
      "registernummer": "HRB 1115",
      "registerart": "HRB",
      "company_name": "Bonner City Parkraum GmbH",
      "company_seat": "Bonn",
      "details": "03.01.2025 (Bekanntmachungsdatum)\n\nNordrhein-Westfalen Amtsgericht Bonn HRB 1115\nSonstige Registerbekanntmachung 03.01.2025 (Eintragungsdatum)\n\nBonner City Parkraum GmbH\nGesellschaft mit beschränkter Haftung\nBonn\n\nAls nicht eingetragen wird veröffentlicht: Den Gläubigern der Gesellschaft, deren Forderungen begründet worden sind bevor die Eintragung der Beendigung des Ergebnisabführungsvertrages  in das Handelsregister nach § 10 des Handelsgesetzbuches als bekanntgemacht gilt, hat der andere Vertragsteil Sicherheit zu leisten, wenn sie sich binnen sechs Monaten nach der Bekanntmachung der Eintragung zu diesem Zweck bei ihm melden."
    },
    {
      "date": "2025-01-03",
      "id": "97797",
      "original_text": "Löschungsankündigung\nNordrhein-Westfalen Amtsgericht Mönchengladbach HRB 14709\nA.M. Import Grosshandel GmbH – Viersen",
      "type": "Löschungsankündigung",
      "state": "Nordrhein-Westfalen",
      "amtsgericht": "Amtsgericht Mönchengladbach",
      "registernummer": "HRB 14709",
      "registerart": "HRB",
      "company_name": "A.M. Import Grosshandel GmbH",
      "company_seat": "Viersen",
      "details": "03.01.2025 (Bekanntmachungsdatum)\n\nNordrhein-Westfalen Amtsgericht Mönchengladbach HRB 14709\nLöschungsankündigung\n\nA.M. Import Grosshandel GmbH\nGesellschaft mit beschränkter Haftung\nViersen\n\nA.M. Import Grosshandel GmbH, Viersen (Amtsgericht Mönchengladbach HRB 14709).\nDas Registergericht beabsichtigt, die im Handelsregister eingetragene Gesellschaft gemäß § 394 Absatz 1 FamFG wegen Vermögenslosigkeit von Amts wegen zu löschen. Gegen diese Verfügung kann Widerspruch eingelegt werden. Die Frist zur Erhebung eines Widerspruchs gegen die beabsichtigte Löschung von Amts wegen ist auf drei Monate festgesetzt."
    },
    {
      "date": "2025-01-03",
      "id": "97798",
      "original_text": "Registerbekanntmachung nach dem Umwandlungsgesetz\nNordrhein-Westfalen Amtsgericht Dortmund HRB 36759\nOneWay Sicherung und Dienstleistung GmbH – Dortmund",
      "type": "Registerbekanntmachung nach dem Umwandlungsgesetz",
      "state": "Nordrhein-Westfalen",
      "amtsgericht": "Amtsgericht Dortmund",
      "registernummer": "HRB 36759",
      "registerart": "HRB",
      "company_name": "OneWay Sicherung und Dienstleistung GmbH",
      "company_seat": "Dortmund",
      "details": "03.01.2025 (Bekanntmachungsdatum)\n\nNordrhein-Westfalen Amtsgericht Dortmund HRB 36759\nRegisterbekanntmachung nach dem Umwandlungsgesetz 02.01.2025 (Eintragungsdatum)\n\nOneWay Sicherung und Dienstleistung GmbH\nGesellschaft mit beschränkter Haftung\nDortmund\n\nDen Gläubigern der an der Ausgliederung beteiligten Rechtsträger ist, wenn sie binnen sechs Monaten nach dem Tag, an dem die Eintragung der Ausgliederung in das Register des Sitzes desjenigen Rechtsträgers, dessen Gläubiger sie sind, nach § 19 Absatz 3 UmwG als bekanntgemacht gilt, ihren Anspruch nach Grund und Höhe schriftlich anmelden, Sicherheit zu leisten, soweit sie nicht Befriedigung verlangen können. Dieses Recht steht den Gläubigern jedoch nur zu, wenn sie glaubhaft machen, dass durch die Ausgliederung die Erfüllung ihrer Forderung gefährdet wird."
    },
    {
      "date": "2025-01-03",
      "id": "97799",
      "original_text": "Registerbekanntmachung nach dem Umwandlungsgesetz\nNordrhein-Westfalen Amtsgericht Recklinghausen HRB 8144\nPoelka Metall Art UG (haftungsbeschränkt) – Oer-Erkenschwick",
      "type": "Registerbekanntmachung nach dem Umwandlungsgesetz",
      "state": "Nordrhein-Westfalen",
      "amtsgericht": "Amtsgericht Recklinghausen",
      "registernummer": "HRB 8144",
      "registerart": "HRB",
      "company_name": "Poelka Metall Art UG (haftungsbeschränkt)",
      "company_seat": "Oer-Erkenschwick",
      "details": "03.01.2025 (Bekanntmachungsdatum)\n\nNordrhein-Westfalen Amtsgericht Recklinghausen HRB 8144\nRegisterbekanntmachung nach dem Umwandlungsgesetz 03.01.2025 (Eintragungsdatum)\n\nPoelka Metall Art UG (haftungsbeschränkt)\nGesellschaft mit beschränkter Haftung\nOer-Erkenschwick\n\nDen Gläubigern der an der Verschmelzung beteiligten Rechtsträger ist, wenn sie binnen sechs Monaten nach dem Tag, an dem die Eintragung der Verschmelzung in das Register des Sitzes desjenigen Rechtsträgers, dessen Gläubiger sie sind, nach § 19 Absatz 3 UmwG als bekanntgemacht gilt, ihren Anspruch nach Grund und Höhe schriftlich anmelden, Sicherheit zu leisten, soweit sie nicht Befriedigung verlangen können. Dieses Recht steht den Gläubigern jedoch nur zu, wenn sie glaubhaft machen, dass durch die Verschmelzung die Erfüllung ihrer Forderung gefährdet wird."
    },
    {
      "date": "2025-01-03",
      "id": "97800",
      "original_text": "Löschungsankündigung\nNordrhein-Westfalen Amtsgericht Duisburg HRB 31355\nHGB Verwaltung UG (haftungsbeschränkt) – Duisburg",
      "type": "Löschungsankündigung",
      "state": "Nordrhein-Westfalen",
      "amtsgericht": "Amtsgericht Duisburg",
      "registernummer": "HRB 31355",
      "registerart": "HRB",
      "company_name": "HGB Verwaltung UG (haftungsbeschränkt)",
      "company_seat": "Duisburg",
      "details": "03.01.2025 (Bekanntmachungsdatum)\n\nNordrhein-Westfalen Amtsgericht Duisburg HRB 31355\nLöschungsankündigung\n\nHGB Verwaltung UG (haftungsbeschränkt)\nGesellschaft mit beschränkter Haftung\nDuisburg\n\nHRB 31355\nHGB Verwaltung UG (haftungsbeschränkt)\nMainstraße 4, 47226 Duisburg\nDas Registergericht beabsichtigt, die im Handelsregister eingetragene Gesellschaft gemäß § 394 Absatz 1 FamFG wegen Vermögenslosigkeit von Amts wegen zu löschen. Gegen diese Verfügung kann Widerspruch eingelegt werden. Die Frist zur Erhebung eines Widerspruchs gegen die beabsichtigte Löschung von Amts wegen ist auf drei Monate festgesetzt. Rechtsbehelfsbelehrung Der Widerspruch ist bei dem Amtsgericht Duisburg, Kardinal-Galen-Str. 124-132, 47058 Duisburg schriftlich in deutscher Sprache oder zur Niederschrift der Geschäftsstelle einzulegen. Der Widerspruch kann auch zur Niederschrift der Geschäftsstelle eines jeden Amtsgerichtes abgegeben werden. Die Einlegung ist auch durch Übertragung eines elektronischen Dokuments an die elektronische Poststelle des Gerichts möglich. Das elektronische Dokument muss für die Bearbeitung durch das Gericht geeignet und mit einer qualifizierten elektronischen Signatur der verantwortenden Person versehen sein oder von der verantwortenden Person signiert und auf einem sicheren Übermittlungsweg gemäß § 130 a ZPO nach näherer Maßgabe der Verordnung über die technischen Rahmenbedingungen des elektronischen Rechtsverkehrs und über das besondere elektronische Behördenpostfach (BGBl. I, S. 3803) eingereicht werden. Weitere Informationen erhalten Sie auf der Internetseite www.justiz.de <http://www.justiz.de>. Der Widerspruch muss spätestens innerhalb der gesetzten Frist bei dem Amtsgericht Duisburg eingegangen sein. Dies gilt auch dann, wenn der Widerspruch zur Niederschrift der Geschäftsstelle eines anderen Amtsgerichtes abgegeben wurde. Die Frist beginnt mit der Veröffentlichung. Fällt das Ende der Frist auf einen Sonntag, einen allgemeinen Feiertag oder Sonnabend, so endet die Frist mit Ablauf des nächsten Werktages. Der Widerspruch muss die Bezeichnung der angefochtenen Verfügung sowie die Erklärung enthalten, dass Widerspruch gegen diese Verfügung eingelegt wird. Er ist zu unterzeichnen und soll begründet werden."
    },
    {
      "date": "2025-01-03",
      "id": "97801",
      "original_text": "Sonstige Registerbekanntmachung\nHessen Amtsgericht Wiesbaden HRB 20747\nAthora Pensionskasse Aktiengesellschaft – Wiesbaden",
      "type": "Sonstige Registerbekanntmachung",
      "state": "Hessen",
      "amtsgericht": "Amtsgericht Wiesbaden",
      "registernummer": "HRB 20747",
      "registerart": "HRB",
      "company_name": "Athora Pensionskasse Aktiengesellschaft",
      "company_seat": "Wiesbaden",
      "details": "03.01.2025 (Bekanntmachungsdatum)\n\nHessen Amtsgericht Wiesbaden HRB 20747\nSonstige Registerbekanntmachung 03.01.2024 (Eintragungsdatum)\n\nAthora Pensionskasse Aktiengesellschaft\nAktiengesellschaft\nWiesbaden\n\nDurch eine Änderung in den Personen der Aufsichtsratsmitglieder ist eine Liste der Mitglieder des Aufsichtsrates zum Handelsregister eingereicht worden."
    },
    {
      "date": "2025-01-03",
      "id": "97802",
      "original_text": "Sonstige Registerbekanntmachung\nHessen Amtsgericht Frankfurt am Main HRB 34125\nLa Française Systematic Asset Management GmbH – Frankfurt am Main",
      "type": "Sonstige Registerbekanntmachung",
      "state": "Hessen",
      "amtsgericht": "Amtsgericht Frankfurt am Main",
      "registernummer": "HRB 34125",
      "registerart": "HRB",
      "company_name": "La Française Systematic Asset Management GmbH",
      "company_seat": "Frankfurt am Main",
      "details": "03.01.2025 (Bekanntmachungsdatum)\n\nHessen Amtsgericht Frankfurt am Main HRB 34125\nSonstige Registerbekanntmachung\n\nLa Française Systematic Asset Management GmbH\nGesellschaft mit beschränkter Haftung\nFrankfurt am Main\n\nDurch eine Änderung in den Personen der Aufsichtsratsmitglieder ist eine Liste der Mitglieder des Aufsichtsrates zum Handelsregister eingereicht worden."
    },
    {
      "date": "2025-01-03",
      "id": "97803",
      "original_text": "Löschungsankündigung\nHessen Amtsgericht Hanau HRB 97589\nCloud24 Transport & Service GmbH – Ronneburg",
      "type": "Löschungsankündigung",
      "state": "Hessen",
      "amtsgericht": "Amtsgericht Hanau",
      "registernummer": "HRB 97589",
      "registerart": "HRB",
      "company_name": "Cloud24 Transport & Service GmbH",
      "company_seat": "Ronneburg",
      "details": "03.01.2025 (Bekanntmachungsdatum)\n\nHessen Amtsgericht Hanau HRB 97589\nLöschungsankündigung\n\nCloud24 Transport & Service GmbH\nGesellschaft mit beschränkter Haftung\nRonneburg\n\nDas Registergericht beabsichtigt den eingetragenen Geschäftsführer Agbulut, Emre, Nidderau, *02.08.2000, nach § 395 FamFG von Amts wegen zu löschen. Der Geschäftsführer ist ungeeignet im Sinne des GmbHG das Amt weiter auszuführen. Die Frist zur Erhebung eines Widerspruchs gegen die beabsichtigte Löschung wird auf 3 Monate festgesetzt."
    },
    {
      "date": "2025-01-03",
      "id": "97804",
      "original_text": "Sonstige Registerbekanntmachung\nHessen Amtsgericht Offenbach am Main VR 1500\nHomosexuelle Selbsthilfe (HS) – Offenbach am Main",
      "type": "Sonstige Registerbekanntmachung",
      "state": "Hessen",
      "amtsgericht": "Amtsgericht Offenbach am Main",
      "registernummer": "VR 1500",
      "registerart": "VR",
      "company_name": "Homosexuelle Selbsthilfe (HS)",
      "company_seat": "Offenbach am Main",
      "details": "03.01.2025 (Bekanntmachungsdatum)\n\nHessen Amtsgericht Offenbach am Main VR 1500\nSonstige Registerbekanntmachung 03.01.2025 (Eintragungsdatum)\n\nHomosexuelle Selbsthilfe (HS)\neingetragener Verein\nOffenbach am Main\n\nDer Verein ist aufgelöst."
    },
    {
      "date": "2025-01-03",
      "id": "97805",
      "original_text": "Löschungsankündigung\nHessen Amtsgericht Eschwege VR 1957\nReggae-Share-ity e.V. – Witzenhausen",
      "type": "Löschungsankündigung",
      "state": "Hessen",
      "amtsgericht": "Amtsgericht Eschwege",
      "registernummer": "VR 1957",
      "registerart": "VR",
      "company_name": "Reggae-Share-ity e.V.",
      "company_seat": "Witzenhausen",
      "details": "03.01.2025 (Bekanntmachungsdatum)\n\nHessen Amtsgericht Eschwege VR 1957\nLöschungsankündigung 03.01.2025 (Eintragungsdatum)\n\nReggae-Share-ity e.V.\neingetragener Verein\nWitzenhausen\n\nDer Verein ist aufgelöst."
    },
    {
      "date": "2025-01-03",
      "id": "97806",
      "original_text": "Löschungsankündigung\nHessen Amtsgericht Darmstadt HRB 95591\nEVERFLORAL GmbH – Beerfelden",
      "type": "Löschungsankündigung",
      "state": "Hessen",
      "amtsgericht": "Amtsgericht Darmstadt",
      "registernummer": "HRB 95591",
      "registerart": "HRB",
      "company_name": "EVERFLORAL GmbH",
      "company_seat": "Beerfelden",
      "details": "03.01.2025 (Bekanntmachungsdatum)\n\nHessen Amtsgericht Darmstadt HRB 95591\nLöschungsankündigung 03.01.2025 (Eintragungsdatum)\n\nEVERFLORAL GmbH\nGesellschaft mit beschränkter Haftung\nBeerfelden\n\nDas Registergericht beabsichtigt die im Handelsregister eingetragene Gesellschaft von Amts wegen nach § 394 FamFG zu löschen. Die Frist zur Erhebung eines Widerspruchs gegen die beabsichtigte Löschung wird auf 3 Monate festgesetzt."
    },
    {
      "date": "2025-01-03",
      "id": "97807",
      "original_text": "Registerbekanntmachung nach dem Umwandlungsgesetz\nHessen Amtsgericht Wiesbaden HRB 32561\nweck re.con gmbh – Idstein",
      "type": "Registerbekanntmachung nach dem Umwandlungsgesetz",
      "state": "Hessen",
      "amtsgericht": "Amtsgericht Wiesbaden",
      "registernummer": "HRB 32561",
      "registerart": "HRB",
      "company_name": "weck re.con gmbh",
      "company_seat": "Idstein",
      "details": "03.01.2025 (Bekanntmachungsdatum)\n\nHessen Amtsgericht Wiesbaden HRB 32561\nRegisterbekanntmachung nach dem Umwandlungsgesetz 03.01.2025 (Eintragungsdatum)\n\nweck re.con gmbh\nGesellschaft mit beschränkter Haftung\nIdstein\n\nDen Gläubigern der an der Verschmelzung beteiligten Rechtsträger ist, wenn sie binnen sechs Monaten nach dem Tag, an dem die Eintragung der Verschmelzung in das Register des Sitzes desjenigen Rechtsträgers, dessen Gläubiger sie sind, nach § 19 Absatz 3 UmwG bekannt gemacht worden ist, ihren Anspruch nach Grund und Höhe schriftlich anmelden, Sicherheit zu leisten, soweit sie nicht Befriedigung verlangen können. Dieses Recht steht den Gläubigern jedoch nur zu, wenn sie glaubhaft machen, dass durch die Verschmelzung die Erfüllung ihrer Forderung gefährdet wird."
    },
    {
      "date": "2025-01-03",
      "id": "97808",
      "original_text": "Einreichung neuer Dokumente\nHessen Amtsgericht Bad Hersfeld HRB 2213\nmergedmedia AG – Friedewald",
      "type": "Einreichung neuer Dokumente",
      "state": "Hessen",
      "amtsgericht": "Amtsgericht Bad Hersfeld",
      "registernummer": "HRB 2213",
      "registerart": "HRB",
      "company_name": "mergedmedia AG",
      "company_seat": "Friedewald",
      "details": "03.01.2025 (Bekanntmachungsdatum)\n\nHessen Amtsgericht Bad Hersfeld HRB 2213\nEinreichung neuer Dokumente 03.01.0205 (Eintragungsdatum)\n\nmergedmedia AG\nAktiengesellschaft\nFriedewald\n\nDurch eine Änderung in den Personen der Aufsichtsratsmitglieder ist eine Liste der Mitglieder des Aufsichtsrates zum Handelsregister eingereicht worden."
    }
  ]
}