{
  "date": "2025-01-29",
  "date_of_scrape": "2025-01-30T04:06:54.852Z",
  "tool_version": "0.2.0",
  "number_of_announcements": 113,
  "announcements": [
    {
      "date": "2025-01-29",
      "id": "99853",
      "original_text": "Löschungsankündigung\nBayern Amtsgericht München HRB 61067\nHeinz Kagerbauer GmbH – Traubing",
      "type": "Löschungsankündigung",
      "state": "Bayern",
      "amtsgericht": "Amtsgericht München",
      "registernummer": "HRB 61067",
      "registerart": "HRB",
      "company_name": "Heinz Kagerbauer GmbH",
      "company_seat": "Traubing",
      "details": "29.01.2025 (Bekanntmachungsdatum)\n\nBayern Amtsgericht München HRB 61067\nLöschungsankündigung\n\nHeinz Kagerbauer GmbH\nGesellschaft mit beschränkter Haftung\nTraubing\n\nDas Registergericht beabsichtigt, die im Handelsregister eingetragene Gesellschaft wegen Vermögenslosigkeit von Amts wegen nach § 394 FamFG zu löschen. Die Frist zur Erhebung eines Widerspruchs ist auf drei Monate festgesetzt."
    },
    {
      "date": "2025-01-29",
      "id": "99854",
      "original_text": "Sonstige Registerbekanntmachung\nBayern Amtsgericht München HRB 145783\nDeutsche Post Shop München GmbH – München",
      "type": "Sonstige Registerbekanntmachung",
      "state": "Bayern",
      "amtsgericht": "Amtsgericht München",
      "registernummer": "HRB 145783",
      "registerart": "HRB",
      "company_name": "Deutsche Post Shop München GmbH",
      "company_seat": "München",
      "details": "29.01.2025 (Bekanntmachungsdatum)\n\nBayern Amtsgericht München HRB 145783\nSonstige Registerbekanntmachung 28.01.2025 (Eintragungsdatum)\n\nDeutsche Post Shop München GmbH\nGesellschaft mit beschränkter Haftung\nMünchen\n\nDen Gläubigern der Gesellschaft, deren Forderungen begründet worden sind, bevor die Eintragung der Beendigung des Beherrschungs- und Gewinnabführungsvertrages in das Handelsregister nach § 10 des Handelsgesetzbuches als bekanntgemacht gilt, hat der andere Vertragsteil Sicherheit zu leisten, wenn sie sich binnen sechs Monaten nach der Bekanntmachung der Eintragung zu diesem Zweck bei ihm melden."
    },
    {
      "date": "2025-01-29",
      "id": "99855",
      "original_text": "Registerbekanntmachung nach dem Umwandlungsgesetz\nBayern Amtsgericht Nürnberg HRA 20163\nCrämer & Senft OHG – Nürnberg",
      "type": "Registerbekanntmachung nach dem Umwandlungsgesetz",
      "state": "Bayern",
      "amtsgericht": "Amtsgericht Nürnberg",
      "registernummer": "HRA 20163",
      "registerart": "HRA",
      "company_name": "Crämer & Senft OHG",
      "company_seat": "Nürnberg",
      "details": "29.01.2025 (Bekanntmachungsdatum)\n\nBayern Amtsgericht Nürnberg HRA 20163\nRegisterbekanntmachung nach dem Umwandlungsgesetz 28.01.2025 (Eintragungsdatum)\n\nCrämer & Senft OHG\nOffene Handelsgesellschaft\nNürnberg\n\nDen Gläubigern der an der Verschmelzung beteiligten Rechtsträger ist, wenn sie binnen sechs Monaten nach dem Tag, an dem die Eintragung der Verschmelzung in das Register des Sitzes desjenigen Rechtsträgers, dessen Gläubiger sie sind, nach § 19 Abs. 3 UmwG als bekannt gemacht gilt, ihren Anspruch nach Grund und Höhe in Textform anmelden, Sicherheit zu leisten, soweit sie nicht Befriedigung verlangen können. Dieses Recht steht den Gläubigern jedoch nur zu, wenn sie glaubhaft machen, dass durch die Verschmelzung die Erfüllung ihrer Forderung gefährdet wird."
    },
    {
      "date": "2025-01-29",
      "id": "99856",
      "original_text": "Löschungsankündigung\nBayern Amtsgericht Aschaffenburg HRB 13232\nC & E Versandhandel UG (haftungsbeschränkt) – Großwallstadt",
      "type": "Löschungsankündigung",
      "state": "Bayern",
      "amtsgericht": "Amtsgericht Aschaffenburg",
      "registernummer": "HRB 13232",
      "registerart": "HRB",
      "company_name": "C & E Versandhandel UG (haftungsbeschränkt)",
      "company_seat": "Großwallstadt",
      "details": "29.01.2025 (Bekanntmachungsdatum)\n\nBayern Amtsgericht Aschaffenburg HRB 13232\nLöschungsankündigung\n\nC & E Versandhandel UG (haftungsbeschränkt)\nGesellschaft mit beschränkter Haftung\nGroßwallstadt\n\nDas Registergericht beabsichtigt, die im Handelsregister eingetragene Gesellschaft wegen Vermögenslosigkeit von Amts wegen nach § 394 FamFG zu löschen. Die Frist zur Erhebung eines Widerspruchs ist auf drei Monate festgesetzt."
    },
    {
      "date": "2025-01-29",
      "id": "99857",
      "original_text": "Registerbekanntmachung nach dem Umwandlungsgesetz\nBayern Amtsgericht Regensburg HRB 8247\nneo Steuerberatungsgesellschaft Regensburg mbH – Regensburg",
      "type": "Registerbekanntmachung nach dem Umwandlungsgesetz",
      "state": "Bayern",
      "amtsgericht": "Amtsgericht Regensburg",
      "registernummer": "HRB 8247",
      "registerart": "HRB",
      "company_name": "neo Steuerberatungsgesellschaft Regensburg mbH",
      "company_seat": "Regensburg",
      "details": "29.01.2025 (Bekanntmachungsdatum)\n\nBayern Amtsgericht Regensburg HRB 8247\nRegisterbekanntmachung nach dem Umwandlungsgesetz 28.01.2025 (Eintragungsdatum)\n\nneo Steuerberatungsgesellschaft Regensburg mbH\nGesellschaft mit beschränkter Haftung\nRegensburg\n\nDen Gläubigern der an der Spaltung beteiligten Rechtsträger ist, wenn sie binnen sechs Monaten nach dem Tag, an dem die Eintragung der Spaltung in das Register des Sitzes desjenigen Rechtsträgers, dessen Gläubiger sie sind, nach §§ 125, 19 Abs. 3 UmwG als bekannt gemacht gilt, ihren Anspruch nach Grund und Höhe in Textform anmelden, Sicherheit zu leisten, soweit sie nicht Befriedigung verlangen können. Dieses Recht steht den Gläubigern jedoch nur zu, wenn sie glaubhaft machen, dass durch die Spaltung die Erfüllung ihrer Forderung gefährdet wird."
    },
    {
      "date": "2025-01-29",
      "id": "99858",
      "original_text": "Registerbekanntmachung nach dem Umwandlungsgesetz\nBayern Amtsgericht Regensburg HRB 21226\nneo CM Audit GmbH Wirtschaftsprüfungsgesellschaft – Regensburg",
      "type": "Registerbekanntmachung nach dem Umwandlungsgesetz",
      "state": "Bayern",
      "amtsgericht": "Amtsgericht Regensburg",
      "registernummer": "HRB 21226",
      "registerart": "HRB",
      "company_name": "neo CM Audit GmbH Wirtschaftsprüfungsgesellschaft",
      "company_seat": "Regensburg",
      "details": "29.01.2025 (Bekanntmachungsdatum)\n\nBayern Amtsgericht Regensburg HRB 21226\nRegisterbekanntmachung nach dem Umwandlungsgesetz 28.01.2025 (Eintragungsdatum)\n\nneo CM Audit GmbH Wirtschaftsprüfungsgesellschaft\nGesellschaft mit beschränkter Haftung\nRegensburg\n\nDen Gläubigern der an der Spaltung beteiligten Rechtsträger ist, wenn sie binnen sechs Monaten nach dem Tag, an dem die Eintragung der Spaltung in das Register des Sitzes desjenigen Rechtsträgers, dessen Gläubiger sie sind, nach §§ 125, 19 Abs. 3 UmwG als bekannt gemacht gilt, ihren Anspruch nach Grund und Höhe in Textform anmelden, Sicherheit zu leisten, soweit sie nicht Befriedigung verlangen können. Dieses Recht steht den Gläubigern jedoch nur zu, wenn sie glaubhaft machen, dass durch die Spaltung die Erfüllung ihrer Forderung gefährdet wird."
    },
    {
      "date": "2025-01-29",
      "id": "99859",
      "original_text": "Löschungsankündigung\nBayern Amtsgericht München HRB 216897\nGebäudereinigung Professional Luxury Cleaning UG (haftungsbeschränkt) – München",
      "type": "Löschungsankündigung",
      "state": "Bayern",
      "amtsgericht": "Amtsgericht München",
      "registernummer": "HRB 216897",
      "registerart": "HRB",
      "company_name": "Gebäudereinigung Professional Luxury Cleaning UG (haftungsbeschränkt)",
      "company_seat": "München",
      "details": "29.01.2025 (Bekanntmachungsdatum)\n\nBayern Amtsgericht München HRB 216897\nLöschungsankündigung\n\nGebäudereinigung Professional Luxury Cleaning UG (haftungsbeschränkt)\nGesellschaft mit beschränkter Haftung\nMünchen\n\nDas Registergericht beabsichtigt, die im Handelsregister eingetragene Gesellschaft wegen Vermögenslosigkeit von Amts wegen nach § 394 FamFG zu löschen. Die Frist zur Erhebung eines Widerspruchs ist auf drei Monate festgesetzt."
    },
    {
      "date": "2025-01-29",
      "id": "99860",
      "original_text": "Einreichung neuer Dokumente\nBayern Amtsgericht München HRB 288766\nSyndeo AG – München",
      "type": "Einreichung neuer Dokumente",
      "state": "Bayern",
      "amtsgericht": "Amtsgericht München",
      "registernummer": "HRB 288766",
      "registerart": "HRB",
      "company_name": "Syndeo AG",
      "company_seat": "München",
      "details": "29.01.2025 (Bekanntmachungsdatum)\n\nBayern Amtsgericht München HRB 288766\nEinreichung neuer Dokumente 28.01.2025 (Eintragungsdatum)\n\nSyndeo AG\nAktiengesellschaft\nMünchen\n\nDem Amtsgericht München -Registergericht- ist eine Liste der Mitglieder des Aufsichtsrats eingereicht worden, § 106 AktG."
    },
    {
      "date": "2025-01-29",
      "id": "99861",
      "original_text": "Löschungsankündigung\nBayern Amtsgericht München HRB 258697\nAzure Trading GmbH – München",
      "type": "Löschungsankündigung",
      "state": "Bayern",
      "amtsgericht": "Amtsgericht München",
      "registernummer": "HRB 258697",
      "registerart": "HRB",
      "company_name": "Azure Trading GmbH",
      "company_seat": "München",
      "details": "29.01.2025 (Bekanntmachungsdatum)\n\nBayern Amtsgericht München HRB 258697\nLöschungsankündigung\n\nAzure Trading GmbH\nGesellschaft mit beschränkter Haftung\nMünchen\n\nDas Registergericht beabsichtigt, die im Handelsregister eingetragene Gesellschaft wegen Vermögenslosigkeit von Amts wegen nach § 394 FamFG zu löschen. Die Frist zur Erhebung eines Widerspruchs ist auf drei Monate festgesetzt."
    },
    {
      "date": "2025-01-29",
      "id": "99862",
      "original_text": "Registerbekanntmachung nach dem Umwandlungsgesetz\nBayern Amtsgericht München HRB 193849\nTerrafinanz Projekt 2 GmbH – Zolling",
      "type": "Registerbekanntmachung nach dem Umwandlungsgesetz",
      "state": "Bayern",
      "amtsgericht": "Amtsgericht München",
      "registernummer": "HRB 193849",
      "registerart": "HRB",
      "company_name": "Terrafinanz Projekt 2 GmbH",
      "company_seat": "Zolling",
      "details": "29.01.2025 (Bekanntmachungsdatum)\n\nBayern Amtsgericht München HRB 193849\nRegisterbekanntmachung nach dem Umwandlungsgesetz 28.01.2025 (Eintragungsdatum)\n\nTerrafinanz Projekt 2 GmbH\nGesellschaft mit beschränkter Haftung\nZolling\n\nDen Gläubigern des formwechselnden Rechtsträgers ist, wenn sie binnen sechs Monaten nach dem Tag, an dem die Eintragung des Formwechsels nach § 201 UmwG als bekannt gemacht gilt, ihren Anspruch nach Grund und Höhe in Textform anmelden, Sicherheit zu leisten, soweit sie nicht Befriedigung verlangen können. Dieses Recht steht den Gläubigern jedoch nur zu, wenn sie glaubhaft machen, dass durch den Formwechsel die Erfüllung ihrer Forderung gefährdet wird."
    },
    {
      "date": "2025-01-29",
      "id": "99863",
      "original_text": "Einreichung neuer Dokumente\nBayern Amtsgericht Augsburg HRB 21345\nC L Holding AG – Stadtbergen",
      "type": "Einreichung neuer Dokumente",
      "state": "Bayern",
      "amtsgericht": "Amtsgericht Augsburg",
      "registernummer": "HRB 21345",
      "registerart": "HRB",
      "company_name": "C L Holding AG",
      "company_seat": "Stadtbergen",
      "details": "29.01.2025 (Bekanntmachungsdatum)\n\nBayern Amtsgericht Augsburg HRB 21345\nEinreichung neuer Dokumente\n\nC L Holding AG\nAktiengesellschaft\nStadtbergen\n\nDem Amtsgericht Augsburg -Registergericht- ist eine Liste der Mitglieder des Aufsichtsrats eingereicht worden, § 106 AktG."
    },
    {
      "date": "2025-01-29",
      "id": "99864",
      "original_text": "Registerbekanntmachung nach dem Umwandlungsgesetz\nBayern Amtsgericht München HRB 148760\nSport1 Medien AG – Ismaning",
      "type": "Registerbekanntmachung nach dem Umwandlungsgesetz",
      "state": "Bayern",
      "amtsgericht": "Amtsgericht München",
      "registernummer": "HRB 148760",
      "registerart": "HRB",
      "company_name": "Sport1 Medien AG",
      "company_seat": "Ismaning",
      "details": "29.01.2025 (Bekanntmachungsdatum)\n\nBayern Amtsgericht München HRB 148760\nRegisterbekanntmachung nach dem Umwandlungsgesetz 28.01.2025 (Eintragungsdatum)\n\nSport1 Medien AG\nAktiengesellschaft\nIsmaning\n\nDen Gläubigern des formwechselnden Rechtsträgers ist, wenn sie binnen sechs Monaten nach dem Tag, an dem die Eintragung des Formwechsels nach § 201 UmwG als bekannt gemacht gilt, ihren Anspruch nach Grund und Höhe in Textform anmelden, Sicherheit zu leisten, soweit sie nicht Befriedigung verlangen können. Dieses Recht steht den Gläubigern jedoch nur zu, wenn sie glaubhaft machen, dass durch den Formwechsel die Erfüllung ihrer Forderung gefährdet wird."
    },
    {
      "date": "2025-01-29",
      "id": "99865",
      "original_text": "Registerbekanntmachung nach dem Umwandlungsgesetz\nBayern Amtsgericht Nürnberg HRA 14251\nSenft GmbH & Co. KG – Nürnberg",
      "type": "Registerbekanntmachung nach dem Umwandlungsgesetz",
      "state": "Bayern",
      "amtsgericht": "Amtsgericht Nürnberg",
      "registernummer": "HRA 14251",
      "registerart": "HRA",
      "company_name": "Senft GmbH & Co. KG",
      "company_seat": "Nürnberg",
      "details": "29.01.2025 (Bekanntmachungsdatum)\n\nBayern Amtsgericht Nürnberg HRA 14251\nRegisterbekanntmachung nach dem Umwandlungsgesetz 28.01.2025 (Eintragungsdatum)\n\nSenft GmbH & Co. KG\nKommanditgesellschaft\nNürnberg\n\nDen Gläubigern der an der Verschmelzung beteiligten Rechtsträger ist, wenn sie binnen sechs Monaten nach dem Tag, an dem die Eintragung der Verschmelzung in das Register des Sitzes desjenigen Rechtsträgers, dessen Gläubiger sie sind, nach § 19 Abs. 3 UmwG als bekannt gemacht gilt, ihren Anspruch nach Grund und Höhe in Textform anmelden, Sicherheit zu leisten, soweit sie nicht Befriedigung verlangen können. Dieses Recht steht den Gläubigern jedoch nur zu, wenn sie glaubhaft machen, dass durch die Verschmelzung die Erfüllung ihrer Forderung gefährdet wird."
    },
    {
      "date": "2025-01-29",
      "id": "99866",
      "original_text": "Registerbekanntmachung nach dem Umwandlungsgesetz\nBayern Amtsgericht Nürnberg HRB 8417\nTrend Haus GmbH – Nürnberg",
      "type": "Registerbekanntmachung nach dem Umwandlungsgesetz",
      "state": "Bayern",
      "amtsgericht": "Amtsgericht Nürnberg",
      "registernummer": "HRB 8417",
      "registerart": "HRB",
      "company_name": "Trend Haus GmbH",
      "company_seat": "Nürnberg",
      "details": "29.01.2025 (Bekanntmachungsdatum)\n\nBayern Amtsgericht Nürnberg HRB 8417\nRegisterbekanntmachung nach dem Umwandlungsgesetz 28.01.2025 (Eintragungsdatum)\n\nTrend Haus GmbH\nGesellschaft mit beschränkter Haftung\nNürnberg\n\nDen Gläubigern der an der Verschmelzung beteiligten Rechtsträger ist, wenn sie binnen sechs Monaten nach dem Tag, an dem die Eintragung der Verschmelzung in das Register des Sitzes desjenigen Rechtsträgers, dessen Gläubiger sie sind, nach § 19 Abs. 3 UmwG als bekannt gemacht gilt, ihren Anspruch nach Grund und Höhe in Textform anmelden, Sicherheit zu leisten, soweit sie nicht Befriedigung verlangen können. Dieses Recht steht den Gläubigern jedoch nur zu, wenn sie glaubhaft machen, dass durch die Verschmelzung die Erfüllung ihrer Forderung gefährdet wird."
    },
    {
      "date": "2025-01-29",
      "id": "99867",
      "original_text": "Löschungsankündigung\nBayern Amtsgericht Aschaffenburg HRB 8676\nAHB Autohandelsges. mbH – Dorfprozelten",
      "type": "Löschungsankündigung",
      "state": "Bayern",
      "amtsgericht": "Amtsgericht Aschaffenburg",
      "registernummer": "HRB 8676",
      "registerart": "HRB",
      "company_name": "AHB Autohandelsges. mbH",
      "company_seat": "Dorfprozelten",
      "details": "29.01.2025 (Bekanntmachungsdatum)\n\nBayern Amtsgericht Aschaffenburg HRB 8676\nLöschungsankündigung\n\nAHB Autohandelsges. mbH\nGesellschaft mit beschränkter Haftung\nDorfprozelten\n\nDas Registergericht beabsichtigt, die im Handelsregister eingetragene Gesellschaft wegen Vermögenslosigkeit von Amts wegen nach § 394 FamFG zu löschen. Die Frist zur Erhebung eines Widerspruchs ist auf drei Monate festgesetzt."
    },
    {
      "date": "2025-01-29",
      "id": "99868",
      "original_text": "Löschungsankündigung\nBayern Amtsgericht Aschaffenburg HRB 15257\nCEENA Services GmbH – Niedernberg",
      "type": "Löschungsankündigung",
      "state": "Bayern",
      "amtsgericht": "Amtsgericht Aschaffenburg",
      "registernummer": "HRB 15257",
      "registerart": "HRB",
      "company_name": "CEENA Services GmbH",
      "company_seat": "Niedernberg",
      "details": "29.01.2025 (Bekanntmachungsdatum)\n\nBayern Amtsgericht Aschaffenburg HRB 15257\nLöschungsankündigung\n\nCEENA Services GmbH\nGesellschaft mit beschränkter Haftung\nNiedernberg\n\nDas Registergericht beabsichtigt, die im Handelsregister eingetragene Gesellschaft wegen Vermögenslosigkeit von Amts wegen nach § 394 FamFG zu löschen. Die Frist zur Erhebung eines Widerspruchs ist auf drei Monate festgesetzt."
    },
    {
      "date": "2025-01-29",
      "id": "99869",
      "original_text": "Registerbekanntmachung nach dem Umwandlungsgesetz\nBayern Amtsgericht München HRB 180018\nBSM Planungs GmbH – München",
      "type": "Registerbekanntmachung nach dem Umwandlungsgesetz",
      "state": "Bayern",
      "amtsgericht": "Amtsgericht München",
      "registernummer": "HRB 180018",
      "registerart": "HRB",
      "company_name": "BSM Planungs GmbH",
      "company_seat": "München",
      "details": "29.01.2025 (Bekanntmachungsdatum)\n\nBayern Amtsgericht München HRB 180018\nRegisterbekanntmachung nach dem Umwandlungsgesetz 28.01.2025 (Eintragungsdatum)\n\nBSM Planungs GmbH\nGesellschaft mit beschränkter Haftung\nMünchen\n\nDen Gläubigern der an der Verschmelzung beteiligten Rechtsträger ist, wenn sie binnen sechs Monaten nach dem Tag, an dem die Eintragung der Verschmelzung in das Register des Sitzes desjenigen Rechtsträgers, dessen Gläubiger sie sind, nach § 19 Abs. 3 UmwG als bekannt gemacht gilt, ihren Anspruch nach Grund und Höhe in Textform anmelden, Sicherheit zu leisten, soweit sie nicht Befriedigung verlangen können. Dieses Recht steht den Gläubigern jedoch nur zu, wenn sie glaubhaft machen, dass durch die Verschmelzung die Erfüllung ihrer Forderung gefährdet wird."
    },
    {
      "date": "2025-01-29",
      "id": "99870",
      "original_text": "Registerbekanntmachung nach dem Umwandlungsgesetz\nBayern Amtsgericht München HRB 207868\nFriedrich & Wagner Asia Pacific GmbH – Garching b.München",
      "type": "Registerbekanntmachung nach dem Umwandlungsgesetz",
      "state": "Bayern",
      "amtsgericht": "Amtsgericht München",
      "registernummer": "HRB 207868",
      "registerart": "HRB",
      "company_name": "Friedrich & Wagner Asia Pacific GmbH",
      "company_seat": "Garching b.München",
      "details": "29.01.2025 (Bekanntmachungsdatum)\n\nBayern Amtsgericht München HRB 207868\nRegisterbekanntmachung nach dem Umwandlungsgesetz 28.01.2025 (Eintragungsdatum)\n\nFriedrich & Wagner Asia Pacific GmbH\nGesellschaft mit beschränkter Haftung\nGarching b.München\n\nDen Gläubigern der an der Verschmelzung beteiligten Rechtsträger ist, wenn sie binnen sechs Monaten nach dem Tag, an dem die Eintragung der Verschmelzung in das Register des Sitzes desjenigen Rechtsträgers, dessen Gläubiger sie sind, nach § 19 Abs. 3 UmwG als bekannt gemacht gilt, ihren Anspruch nach Grund und Höhe in Textform anmelden, Sicherheit zu leisten, soweit sie nicht Befriedigung verlangen können. Dieses Recht steht den Gläubigern jedoch nur zu, wenn sie glaubhaft machen, dass durch die Verschmelzung die Erfüllung ihrer Forderung gefährdet wird."
    },
    {
      "date": "2025-01-29",
      "id": "99871",
      "original_text": "Löschungsankündigung\nBayern Amtsgericht Coburg HRB 6034\nEH RV-Manufaktur UG (haftungsbeschränkt) – Ebensfeld",
      "type": "Löschungsankündigung",
      "state": "Bayern",
      "amtsgericht": "Amtsgericht Coburg",
      "registernummer": "HRB 6034",
      "registerart": "HRB",
      "company_name": "EH RV-Manufaktur UG (haftungsbeschränkt)",
      "company_seat": "Ebensfeld",
      "details": "29.01.2025 (Bekanntmachungsdatum)\n\nBayern Amtsgericht Coburg HRB 6034\nLöschungsankündigung 28.01.2025 (Eintragungsdatum)\n\nEH RV-Manufaktur UG (haftungsbeschränkt)\nGesellschaft mit beschränkter Haftung\nEbensfeld\n\nDas Registergericht beabsichtigt, die im Handelsregister eingetragene Gesellschaft wegen Vermögenslosigkeit von Amts wegen nach § 394 FamFG zu löschen. Die Frist zur Erhebung eines Widerspruchs ist auf sechs Wochen festgesetzt."
    },
    {
      "date": "2025-01-29",
      "id": "99872",
      "original_text": "Löschungsankündigung\nBayern Amtsgericht München HRB 183907\ngateone GmbH – München",
      "type": "Löschungsankündigung",
      "state": "Bayern",
      "amtsgericht": "Amtsgericht München",
      "registernummer": "HRB 183907",
      "registerart": "HRB",
      "company_name": "gateone GmbH",
      "company_seat": "München",
      "details": "29.01.2025 (Bekanntmachungsdatum)\n\nBayern Amtsgericht München HRB 183907\nLöschungsankündigung 28.01.2025 (Eintragungsdatum)\n\ngateone GmbH\nGesellschaft mit beschränkter Haftung\nMünchen\n\nDas Registergericht beabsichtigt, die im Handelsregister eingetragene Gesellschaft wegen Vermögenslosigkeit von Amts wegen nach § 394 FamFG zu löschen. Die Frist zur Erhebung eines Widerspruchs ist auf drei Monate festgesetzt."
    },
    {
      "date": "2025-01-29",
      "id": "99873",
      "original_text": "Registerbekanntmachung nach dem Umwandlungsgesetz\nBayern Amtsgericht Bamberg HRA 13305\nMax Feldmann Space Four e.K. – Bamberg",
      "type": "Registerbekanntmachung nach dem Umwandlungsgesetz",
      "state": "Bayern",
      "amtsgericht": "Amtsgericht Bamberg",
      "registernummer": "HRA 13305",
      "registerart": "HRA",
      "company_name": "Max Feldmann Space Four e.K.",
      "company_seat": "Bamberg",
      "details": "29.01.2025 (Bekanntmachungsdatum)\n\nBayern Amtsgericht Bamberg HRA 13305\nRegisterbekanntmachung nach dem Umwandlungsgesetz 28.01.2025 (Eintragungsdatum)\n\nMax Feldmann Space Four e.K.\nEinzelkaufmann / Einzelkauffrau\nBamberg\n\nDen Gläubigern der an der Ausgliederung beteiligten Rechtsträger ist, wenn sie binnen sechs Monaten nach dem Tag, an dem die Eintragung der Ausgliederung in das Register des Sitzes desjenigen Rechtsträgers, dessen Gläubiger sie sind, nach §§ 125, 19 Abs. 3 UmwG als bekannt gemacht gilt, ihren Anspruch nach Grund und Höhe in Textform anmelden, Sicherheit zu leisten, soweit sie nicht Befriedigung verlangen können. Dieses Recht steht den Gläubigern jedoch nur zu, wenn sie glaubhaft machen, dass durch die Ausgliederung die Erfüllung ihrer Forderung gefährdet wird."
    },
    {
      "date": "2025-01-29",
      "id": "99874",
      "original_text": "Löschungsankündigung\nBayern Amtsgericht München HRB 63420\nPSM EDV-Service GmbH – Taufkirchen",
      "type": "Löschungsankündigung",
      "state": "Bayern",
      "amtsgericht": "Amtsgericht München",
      "registernummer": "HRB 63420",
      "registerart": "HRB",
      "company_name": "PSM EDV-Service GmbH",
      "company_seat": "Taufkirchen",
      "details": "29.01.2025 (Bekanntmachungsdatum)\n\nBayern Amtsgericht München HRB 63420\nLöschungsankündigung 28.01.2025 (Eintragungsdatum)\n\nPSM EDV-Service GmbH\nGesellschaft mit beschränkter Haftung\nTaufkirchen\n\nDas Registergericht beabsichtigt, die im Handelsregister eingetragene Gesellschaft wegen Vermögenslosigkeit von Amts wegen nach § 394 FamFG zu löschen. Die Frist zur Erhebung eines Widerspruchs ist auf drei Monate festgesetzt."
    },
    {
      "date": "2025-01-29",
      "id": "99875",
      "original_text": "Löschungsankündigung\nBayern Amtsgericht Nürnberg HRB 39862\nAutoAbo4U GmbH – Röthenbach a.d. Pegnitz",
      "type": "Löschungsankündigung",
      "state": "Bayern",
      "amtsgericht": "Amtsgericht Nürnberg",
      "registernummer": "HRB 39862",
      "registerart": "HRB",
      "company_name": "AutoAbo4U GmbH",
      "company_seat": "Röthenbach a.d. Pegnitz",
      "details": "29.01.2025 (Bekanntmachungsdatum)\n\nBayern Amtsgericht Nürnberg HRB 39862\nLöschungsankündigung\n\nAutoAbo4U GmbH\nGesellschaft mit beschränkter Haftung\nRöthenbach a.d. Pegnitz\n\nDas Registergericht beabsichtigt, die im Handelsregister eingetragene Firma von Amts wegen nach § 31 Abs. 2 HGB, § 393 FamFG zu löschen. Die Frist zur Erhebung eines Widerspruchs ist auf einen Monat festgesetzt.Das Registergericht beabsichtigt, die im Handelsregister eingetragene Gesellschaft wegen Vermögenslosigkeit von Amts wegen nach § 394 FamFG zu löschen. Die Frist zur Erhebung eines Widerspruchs ist auf einen Monat festgesetzt."
    },
    {
      "date": "2025-01-29",
      "id": "99876",
      "original_text": "Registerbekanntmachung nach dem Umwandlungsgesetz\nBayern Amtsgericht Nürnberg HRB 6714\nCrämer & Co. GmbH – Nürnberg",
      "type": "Registerbekanntmachung nach dem Umwandlungsgesetz",
      "state": "Bayern",
      "amtsgericht": "Amtsgericht Nürnberg",
      "registernummer": "HRB 6714",
      "registerart": "HRB",
      "company_name": "Crämer & Co. GmbH",
      "company_seat": "Nürnberg",
      "details": "29.01.2025 (Bekanntmachungsdatum)\n\nBayern Amtsgericht Nürnberg HRB 6714\nRegisterbekanntmachung nach dem Umwandlungsgesetz 28.01.2025 (Eintragungsdatum)\n\nCrämer & Co. GmbH\nGesellschaft mit beschränkter Haftung\nNürnberg\n\nDen Gläubigern der an der Verschmelzung beteiligten Rechtsträger ist, wenn sie binnen sechs Monaten nach dem Tag, an dem die Eintragung der Verschmelzung in das Register des Sitzes desjenigen Rechtsträgers, dessen Gläubiger sie sind, nach § 19 Abs. 3 UmwG als bekannt gemacht gilt, ihren Anspruch nach Grund und Höhe in Textform anmelden, Sicherheit zu leisten, soweit sie nicht Befriedigung verlangen können. Dieses Recht steht den Gläubigern jedoch nur zu, wenn sie glaubhaft machen, dass durch die Verschmelzung die Erfüllung ihrer Forderung gefährdet wird."
    },
    {
      "date": "2025-01-29",
      "id": "99877",
      "original_text": "Löschungsankündigung\nBaden-Württemberg Amtsgericht Stuttgart HRA 202711\nFrye Planen und Bauen GmbH & Co. KG Bauträgergesellschaft – Asperg",
      "type": "Löschungsankündigung",
      "state": "Baden-Württemberg",
      "amtsgericht": "Amtsgericht Stuttgart",
      "registernummer": "HRA 202711",
      "registerart": "HRA",
      "company_name": "Frye Planen und Bauen GmbH & Co. KG Bauträgergesellschaft",
      "company_seat": "Asperg",
      "details": "29.01.2025 (Bekanntmachungsdatum)\n\nBaden-Württemberg Amtsgericht Stuttgart HRA 202711\nLöschungsankündigung\n\nFrye Planen und Bauen GmbH & Co. KG Bauträgergesellschaft\nKommanditgesellschaft\nAsperg\n\nAls nicht eingetragen wird bekanntgemacht:\nDas Gericht beabsichtigt, die Gesellschaft wegen Vermögenslosigkeit im Handelsregister von Amts wegen nach § 394 FamFG zu löschen. Die Frist zur Geltendmachung eines Widerspruchs gegen die beabsichtigte Löschung ist auf zwei Monate ab Veröffentlichung bestimmt."
    },
    {
      "date": "2025-01-29",
      "id": "99878",
      "original_text": "Löschungsankündigung\nBaden-Württemberg Amtsgericht Freiburg HRB 725917\nKarGh Lebensmittel und Handels GmbH – Lörrach",
      "type": "Löschungsankündigung",
      "state": "Baden-Württemberg",
      "amtsgericht": "Amtsgericht Freiburg",
      "registernummer": "HRB 725917",
      "registerart": "HRB",
      "company_name": "KarGh Lebensmittel und Handels GmbH",
      "company_seat": "Lörrach",
      "details": "29.01.2025 (Bekanntmachungsdatum)\n\nBaden-Württemberg Amtsgericht Freiburg HRB 725917\nLöschungsankündigung\n\nKarGh Lebensmittel und Handels GmbH\nGesellschaft mit beschränkter Haftung\nLörrach\n\nDas Gericht beabsichtigt, die Gesellschaft wegen Vermögenslosigkeit im Handelsregister von Amts wegen nach § 394 FamFG zu löschen. Die Frist zur Geltendmachung eines Widerspruchs gegen die beabsichtigte Löschung ist auf einen Monat ab Veröffentlichung bestimmt."
    },
    {
      "date": "2025-01-29",
      "id": "99879",
      "original_text": "Einreichung neuer Dokumente\nBaden-Württemberg Amtsgericht Stuttgart HRB 570413\nGWG Grundstücks- und Wohnungsbaugesellschaft Schwäbisch Hall mbH – Schwäbisch Hall",
      "type": "Einreichung neuer Dokumente",
      "state": "Baden-Württemberg",
      "amtsgericht": "Amtsgericht Stuttgart",
      "registernummer": "HRB 570413",
      "registerart": "HRB",
      "company_name": "GWG Grundstücks- und Wohnungsbaugesellschaft Schwäbisch Hall mbH",
      "company_seat": "Schwäbisch Hall",
      "details": "29.01.2025 (Bekanntmachungsdatum)\n\nBaden-Württemberg Amtsgericht Stuttgart HRB 570413\nEinreichung neuer Dokumente\n\nGWG Grundstücks- und Wohnungsbaugesellschaft Schwäbisch Hall mbH\nGesellschaft mit beschränkter Haftung\nSchwäbisch Hall\n\nDie Gesellschaft hat am 11.12.2024 die Liste über die Zusammensetzung des Aufsichtsrats zum Handelsregister eingereicht."
    },
    {
      "date": "2025-01-29",
      "id": "99880",
      "original_text": "Registerbekanntmachung nach dem Umwandlungsgesetz\nBaden-Württemberg Amtsgericht Mannheim HRB 733513\nTierarztpraxis Strassenheim GmbH – Mannheim",
      "type": "Registerbekanntmachung nach dem Umwandlungsgesetz",
      "state": "Baden-Württemberg",
      "amtsgericht": "Amtsgericht Mannheim",
      "registernummer": "HRB 733513",
      "registerart": "HRB",
      "company_name": "Tierarztpraxis Strassenheim GmbH",
      "company_seat": "Mannheim",
      "details": "29.01.2025 (Bekanntmachungsdatum)\n\nBaden-Württemberg Amtsgericht Mannheim HRB 733513\nRegisterbekanntmachung nach dem Umwandlungsgesetz 29.01.2025 (Eintragungsdatum)\n\nTierarztpraxis Strassenheim GmbH\nGesellschaft mit beschränkter Haftung\nMannheim\n\nAls nicht eingetragen wird bekanntgemacht:\nDen Gläubigern der an der Verschmelzung beteiligten Rechtsträger ist, wenn sie binnen sechs Monaten nach dem Tag, an dem die Eintragung der Verschmelzung in das Register des Sitzes desjenigen Rechtsträgers, dessen Gläubiger sie sind, nach § 19 Abs. 3 UmwG als bekanntgemacht gilt, ihren Anspruch nach Grund und Höhe schriftlich anmelden, Sicherheit zu leisten, soweit sie nicht Befriedigung verlangen können. Dieses Recht steht den Gläubigern jedoch nur zu, wenn sie glaubhaft machen, dass durch die Verschmelzung die Erfüllung ihrer Forderung gefährdet wird."
    },
    {
      "date": "2025-01-29",
      "id": "99881",
      "original_text": "Registerbekanntmachung nach dem Umwandlungsgesetz\nSchleswig-Holstein Amtsgericht Flensburg HRA 11149\nRohr & Thiel Heizung und Sanitär OHG – Flensburg",
      "type": "Registerbekanntmachung nach dem Umwandlungsgesetz",
      "state": "Schleswig-Holstein",
      "amtsgericht": "Amtsgericht Flensburg",
      "registernummer": "HRA 11149",
      "registerart": "HRA",
      "company_name": "Rohr & Thiel Heizung und Sanitär OHG",
      "company_seat": "Flensburg",
      "details": "29.01.2025 (Bekanntmachungsdatum)\n\nSchleswig-Holstein Amtsgericht Flensburg HRA 11149\nRegisterbekanntmachung nach dem Umwandlungsgesetz 28.01.2025 (Eintragungsdatum)\n\nRohr & Thiel Heizung und Sanitär OHG\nOffene Handelsgesellschaft\nFlensburg\n\nZu Eintragungsnummer 2 vom 28.01.2025 wird als nicht eingetragen veröffentlicht: Den Gläubigern ist, wenn sie binnen sechs Monaten nach dem Tag, an dem die Eintragung der Umwandlung als bekannt gemacht gilt, ihren Anspruch nach Grund und Höhe schriftlich anmelden, Sicherheit zu leisten, soweit sie nicht Befriedigung verlangen können. Dieses Recht steht den Gläubigern jedoch nur zu, wenn sie glaubhaft machen, dass durch die Umwandlung die Erfüllung ihrer Forderung gefährdet wird."
    },
    {
      "date": "2025-01-29",
      "id": "99882",
      "original_text": "Einreichung neuer Dokumente\nBaden-Württemberg Amtsgericht Stuttgart HRB 752411\nSDK Süddeutsche Leben Vermögensverwaltung AG – Fellbach",
      "type": "Einreichung neuer Dokumente",
      "state": "Baden-Württemberg",
      "amtsgericht": "Amtsgericht Stuttgart",
      "registernummer": "HRB 752411",
      "registerart": "HRB",
      "company_name": "SDK Süddeutsche Leben Vermögensverwaltung AG",
      "company_seat": "Fellbach",
      "details": "29.01.2025 (Bekanntmachungsdatum)\n\nBaden-Württemberg Amtsgericht Stuttgart HRB 752411\nEinreichung neuer Dokumente\n\nSDK Süddeutsche Leben Vermögensverwaltung AG\nAktiengesellschaft\nFellbach\n\nDie Gesellschaft hat am 28.01.2025 die Liste über die Zusammensetzung des Aufsichtsrats zum Handelsregister eingereicht."
    },
    {
      "date": "2025-01-29",
      "id": "99883",
      "original_text": "Einreichung neuer Dokumente\nSaarland Amtsgericht Saarbrücken HRB 7184\nUNION KRANKENVERSICHERUNG AKTIENGESELLSCHAFT – Saarbrücken",
      "type": "Einreichung neuer Dokumente",
      "state": "Saarland",
      "amtsgericht": "Amtsgericht Saarbrücken",
      "registernummer": "HRB 7184",
      "registerart": "HRB",
      "company_name": "UNION KRANKENVERSICHERUNG AKTIENGESELLSCHAFT",
      "company_seat": "Saarbrücken",
      "details": "29.01.2025 (Bekanntmachungsdatum)\n\nSaarland Amtsgericht Saarbrücken HRB 7184\nEinreichung neuer Dokumente 29.01.2025 (Eintragungsdatum)\n\nUNION KRANKENVERSICHERUNG AKTIENGESELLSCHAFT\nAktiengesellschaft\nSaarbrücken\n\nDer Vorstand der Gesellschaft hat eine Liste der Mitglieder des Aufsichtsrats zum Handelsregister eingereicht (§ 106 AktG)."
    },
    {
      "date": "2025-01-29",
      "id": "99884",
      "original_text": "Löschungsankündigung\nBaden-Württemberg Amtsgericht Freiburg HRB 381831\nGebu GmbH, Metallbau – Konstanz",
      "type": "Löschungsankündigung",
      "state": "Baden-Württemberg",
      "amtsgericht": "Amtsgericht Freiburg",
      "registernummer": "HRB 381831",
      "registerart": "HRB",
      "company_name": "Gebu GmbH, Metallbau",
      "company_seat": "Konstanz",
      "details": "29.01.2025 (Bekanntmachungsdatum)\n\nBaden-Württemberg Amtsgericht Freiburg HRB 381831\nLöschungsankündigung\n\nGebu GmbH, Metallbau\nGesellschaft mit beschränkter Haftung\nKonstanz\n\nDas Gericht beabsichtigt, die Gesellschaft wegen Vermögenslosigkeit im Handelsregister von Amts wegen nach § 394 FamFG zu löschen. Die Frist zur Geltendmachung eines Widerspruchs gegen die beabsichtigte Löschung ist auf einen Monat ab Veröffentlichung bestimmt."
    },
    {
      "date": "2025-01-29",
      "id": "99885",
      "original_text": "Einreichung neuer Dokumente\nBaden-Württemberg Amtsgericht Stuttgart HRB 740510\nTransnetBW GmbH – Stuttgart",
      "type": "Einreichung neuer Dokumente",
      "state": "Baden-Württemberg",
      "amtsgericht": "Amtsgericht Stuttgart",
      "registernummer": "HRB 740510",
      "registerart": "HRB",
      "company_name": "TransnetBW GmbH",
      "company_seat": "Stuttgart",
      "details": "29.01.2025 (Bekanntmachungsdatum)\n\nBaden-Württemberg Amtsgericht Stuttgart HRB 740510\nEinreichung neuer Dokumente\n\nTransnetBW GmbH\nGesellschaft mit beschränkter Haftung\nStuttgart\n\nDie Gesellschaft hat am 28.01.2025 die Liste über die Zusammensetzung des Aufsichtsrats zum Handelsregister eingereicht."
    },
    {
      "date": "2025-01-29",
      "id": "99886",
      "original_text": "Einreichung neuer Dokumente\nSachsen-Anhalt Amtsgericht Stendal HRB 10361\nStadtwerke Bitterfeld-Wolfen GmbH – Bitterfeld-Wolfen",
      "type": "Einreichung neuer Dokumente",
      "state": "Sachsen-Anhalt",
      "amtsgericht": "Amtsgericht Stendal",
      "registernummer": "HRB 10361",
      "registerart": "HRB",
      "company_name": "Stadtwerke Bitterfeld-Wolfen GmbH",
      "company_seat": "Bitterfeld-Wolfen",
      "details": "29.01.2025 (Bekanntmachungsdatum)\n\nSachsen-Anhalt Amtsgericht Stendal HRB 10361\nEinreichung neuer Dokumente 29.01.2025 (Eintragungsdatum)\n\nStadtwerke Bitterfeld-Wolfen GmbH\nGesellschaft mit beschränkter Haftung\nBitterfeld-Wolfen\n\nEine Liste der Mitglieder des Aufsichtsrates wurde zum Handelsregister eingereicht."
    },
    {
      "date": "2025-01-29",
      "id": "99887",
      "original_text": "Einreichung neuer Dokumente\nBaden-Württemberg Amtsgericht Freiburg HRB 300725\nland in sicht AG – Freiburg im Breisgau",
      "type": "Einreichung neuer Dokumente",
      "state": "Baden-Württemberg",
      "amtsgericht": "Amtsgericht Freiburg",
      "registernummer": "HRB 300725",
      "registerart": "HRB",
      "company_name": "land in sicht AG",
      "company_seat": "Freiburg im Breisgau",
      "details": "29.01.2025 (Bekanntmachungsdatum)\n\nBaden-Württemberg Amtsgericht Freiburg HRB 300725\nEinreichung neuer Dokumente\n\nland in sicht AG\nAktiengesellschaft\nFreiburg im Breisgau\n\nDie Gesellschaft hat am 28.01.2025 die Liste über die Zusammensetzung des Aufsichtsrats zum Handelsregister eingereicht."
    },
    {
      "date": "2025-01-29",
      "id": "99888",
      "original_text": "Löschungsankündigung\nBaden-Württemberg Amtsgericht Mannheim HRB 728090\nBEK Service UG (haftungsbeschränkt) – Philippsburg",
      "type": "Löschungsankündigung",
      "state": "Baden-Württemberg",
      "amtsgericht": "Amtsgericht Mannheim",
      "registernummer": "HRB 728090",
      "registerart": "HRB",
      "company_name": "BEK Service UG (haftungsbeschränkt)",
      "company_seat": "Philippsburg",
      "details": "29.01.2025 (Bekanntmachungsdatum)\n\nBaden-Württemberg Amtsgericht Mannheim HRB 728090\nLöschungsankündigung\n\nBEK Service UG (haftungsbeschränkt)\nGesellschaft mit beschränkter Haftung\nPhilippsburg\n\nDas Gericht beabsichtigt, die Gesellschaft wegen Vermögenslosigkeit im Handelsregister von Amts wegen nach § 394 FamFG zu löschen. Die Frist zur Geltendmachung eines Widerspruchs gegen die beabsichtigte Löschung ist auf einen Monat ab Veröffentlichung bestimmt."
    },
    {
      "date": "2025-01-29",
      "id": "99889",
      "original_text": "Einreichung neuer Dokumente\nBaden-Württemberg Amtsgericht Stuttgart HRB 11771\nBaden-Württemberg International - Gesellschaft für internationale wirtschaftliche und wissenschaftliche Zusammenarbeit mbH – Stuttgart",
      "type": "Einreichung neuer Dokumente",
      "state": "Baden-Württemberg",
      "amtsgericht": "Amtsgericht Stuttgart",
      "registernummer": "HRB 11771",
      "registerart": "HRB",
      "company_name": "Baden-Württemberg International - Gesellschaft für internationale wirtschaftliche und wissenschaftliche Zusammenarbeit mbH",
      "company_seat": "Stuttgart",
      "details": "29.01.2025 (Bekanntmachungsdatum)\n\nBaden-Württemberg Amtsgericht Stuttgart HRB 11771\nEinreichung neuer Dokumente 29.01.2025 (Eintragungsdatum)\n\nBaden-Württemberg International - Gesellschaft für internationale wirtschaftliche und wissenschaftliche Zusammenarbeit mbH\nGesellschaft mit beschränkter Haftung\nStuttgart\n\nDie Gesellschaft hat am 27.01.2025 die Liste über die Zusammensetzung des Aufsichtsrats zum Handelsregister eingereicht."
    },
    {
      "date": "2025-01-29",
      "id": "99890",
      "original_text": "Einreichung neuer Dokumente\nSchleswig-Holstein Amtsgericht Kiel HRB 18767\nIKT Regio-Netzwerk Service GmbH – Norderstedt",
      "type": "Einreichung neuer Dokumente",
      "state": "Schleswig-Holstein",
      "amtsgericht": "Amtsgericht Kiel",
      "registernummer": "HRB 18767",
      "registerart": "HRB",
      "company_name": "IKT Regio-Netzwerk Service GmbH",
      "company_seat": "Norderstedt",
      "details": "29.01.2025 (Bekanntmachungsdatum)\n\nSchleswig-Holstein Amtsgericht Kiel HRB 18767\nEinreichung neuer Dokumente\n\nIKT Regio-Netzwerk Service GmbH\nGesellschaft mit beschränkter Haftung\nNorderstedt\n\nAls nicht eingetragen wird veröffentlicht: Eine neue Liste der Aufsichtsratsmitglieder ist eingereicht worden."
    },
    {
      "date": "2025-01-29",
      "id": "99891",
      "original_text": "Einreichung neuer Dokumente\nSchleswig-Holstein Amtsgericht Kiel HRB 4216 NO\n\"wilhelm.tel GmbH\" – Norderstedt",
      "type": "Einreichung neuer Dokumente",
      "state": "Schleswig-Holstein",
      "amtsgericht": "Amtsgericht Kiel",
      "registernummer": "HRB 4216 NO",
      "registerart": "HRB",
      "company_name": "\"wilhelm.tel GmbH\"",
      "company_seat": "Norderstedt",
      "details": "29.01.2025 (Bekanntmachungsdatum)\n\nSchleswig-Holstein Amtsgericht Kiel HRB 4216 NO\nEinreichung neuer Dokumente\n\n\"wilhelm.tel GmbH\"\nGesellschaft mit beschränkter Haftung\nNorderstedt\n\nAls nicht eingetragen wird veröffentlicht: Eine neue Liste der Aufsichtsratsmitglieder ist eingereicht worden."
    },
    {
      "date": "2025-01-29",
      "id": "99892",
      "original_text": "Registerbekanntmachung nach dem Umwandlungsgesetz\nSachsen-Anhalt Amtsgericht Stendal HRB 35069\nHRL Grundstücksverwaltungsgesellschaft mbH – Weißenfels",
      "type": "Registerbekanntmachung nach dem Umwandlungsgesetz",
      "state": "Sachsen-Anhalt",
      "amtsgericht": "Amtsgericht Stendal",
      "registernummer": "HRB 35069",
      "registerart": "HRB",
      "company_name": "HRL Grundstücksverwaltungsgesellschaft mbH",
      "company_seat": "Weißenfels",
      "details": "29.01.2025 (Bekanntmachungsdatum)\n\nSachsen-Anhalt Amtsgericht Stendal HRB 35069\nRegisterbekanntmachung nach dem Umwandlungsgesetz 29.01.2025 (Eintragungsdatum)\n\nHRL Grundstücksverwaltungsgesellschaft mbH\nGesellschaft mit beschränkter Haftung\nWeißenfels\n\nNicht eingetragen:\nDen Gläubigern der an der Verschmelzung beteiligten Rechtsträger ist, wenn sie binnen sechs Monaten nach dem Tag, an dem die Eintragung der Verschmelzung nach § 19 Abs. 3 UmwG als bekanntgemacht gilt, ihren Anspruch nach Grund und Höhe schriftlich anmelden, Sicherheit zu leisten, soweit sie nicht Befriedigung verlangen können. Dieses Recht steht ihnen jedoch nur zu, wenn sie glaubhaft machen, dass durch die Verschmelzung die Erfüllung ihrer Forderung gefährdet wird."
    },
    {
      "date": "2025-01-29",
      "id": "99893",
      "original_text": "Registerbekanntmachung nach dem Umwandlungsgesetz\nSachsen-Anhalt Amtsgericht Stendal HRB 23125\nBonback Halle (Saale) GmbH – Halle (Saale)",
      "type": "Registerbekanntmachung nach dem Umwandlungsgesetz",
      "state": "Sachsen-Anhalt",
      "amtsgericht": "Amtsgericht Stendal",
      "registernummer": "HRB 23125",
      "registerart": "HRB",
      "company_name": "Bonback Halle (Saale) GmbH",
      "company_seat": "Halle (Saale)",
      "details": "29.01.2025 (Bekanntmachungsdatum)\n\nSachsen-Anhalt Amtsgericht Stendal HRB 23125\nRegisterbekanntmachung nach dem Umwandlungsgesetz 29.01.2025 (Eintragungsdatum)\n\nBonback Halle (Saale) GmbH\nGesellschaft mit beschränkter Haftung\nHalle (Saale)\n\nNicht eingetragen:\nDen Gläubigern der an der Verschmelzung beteiligten Rechtsträger ist, wenn sie binnen sechs Monaten nach dem Tag, an dem die Eintragung der Verschmelzung nach § 19 Abs. 3 UmwG als bekanntgemacht gilt, ihren Anspruch nach Grund und Höhe schriftlich anmelden, Sicherheit zu leisten, soweit sie nicht Befriedigung verlangen können. Dieses Recht steht ihnen jedoch nur zu, wenn sie glaubhaft machen, dass durch die Verschmelzung die Erfüllung ihrer Forderung gefährdet wird."
    },
    {
      "date": "2025-01-29",
      "id": "99894",
      "original_text": "Registerbekanntmachung nach dem Umwandlungsgesetz\nBaden-Württemberg Amtsgericht Mannheim HRB 362608\nBruker Optik Holding GmbH – Ettlingen",
      "type": "Registerbekanntmachung nach dem Umwandlungsgesetz",
      "state": "Baden-Württemberg",
      "amtsgericht": "Amtsgericht Mannheim",
      "registernummer": "HRB 362608",
      "registerart": "HRB",
      "company_name": "Bruker Optik Holding GmbH",
      "company_seat": "Ettlingen",
      "details": "29.01.2025 (Bekanntmachungsdatum)\n\nBaden-Württemberg Amtsgericht Mannheim HRB 362608\nRegisterbekanntmachung nach dem Umwandlungsgesetz 29.01.2025 (Eintragungsdatum)\n\nBruker Optik Holding GmbH\nGesellschaft mit beschränkter Haftung\nEttlingen\n\nDen Gläubigern des an dem Formwechsel beteiligten Rechtsträgers ist, wenn sie binnen sechs Monaten nach dem Tag, an dem die Eintragung des Formwechsels in das Register des Sitzes desjenigen Rechtsträgers, dessen Gläubiger sie sind, nach § 19 Abs. 3 UmwG als bekanntgemacht gilt, ihren Anspruch nach Grund und Höhe schriftlich anmelden, Sicherheit zu leisten, soweit sie nicht Befriedigung verlangen können. Dieses Recht steht den Gläubigern jedoch nur zu, wenn sie glaubhaft machen, dass durch den Formwechsel die Erfüllung ihrer Forderung gefährdet wird."
    },
    {
      "date": "2025-01-29",
      "id": "99895",
      "original_text": "Sonstige Registerbekanntmachung\nBaden-Württemberg Amtsgericht Mannheim HRB 719527\nManfred-Sauer-Stiftung Betriebsgesellschaft mbH – Lobbach",
      "type": "Sonstige Registerbekanntmachung",
      "state": "Baden-Württemberg",
      "amtsgericht": "Amtsgericht Mannheim",
      "registernummer": "HRB 719527",
      "registerart": "HRB",
      "company_name": "Manfred-Sauer-Stiftung Betriebsgesellschaft mbH",
      "company_seat": "Lobbach",
      "details": "29.01.2025 (Bekanntmachungsdatum)\n\nBaden-Württemberg Amtsgericht Mannheim HRB 719527\nSonstige Registerbekanntmachung 29.01.2025 (Eintragungsdatum)\n\nManfred-Sauer-Stiftung Betriebsgesellschaft mbH\nGesellschaft mit beschränkter Haftung\nLobbach\n\nDen Gläubigern der Gesellschaft, deren Forderungen begründet worden sind, bevor die Eintragung der Beendigung des Vertrages in das Handelsregister nach § 10 HGB als bekanntgemacht gilt, ist vom anderen Vertragsteil Sicherheit zu leisten, wenn sie sich binnen sechs Monaten nach der Bekanntmachung zu diesem Zweck bei ihm melden."
    },
    {
      "date": "2025-01-29",
      "id": "99896",
      "original_text": "Einreichung neuer Dokumente\nThüringen Amtsgericht Jena HRB 402557\nNeue Energien Hörselberg-Hainich GmbH – Hörselberg-Hainich",
      "type": "Einreichung neuer Dokumente",
      "state": "Thüringen",
      "amtsgericht": "Amtsgericht Jena",
      "registernummer": "HRB 402557",
      "registerart": "HRB",
      "company_name": "Neue Energien Hörselberg-Hainich GmbH",
      "company_seat": "Hörselberg-Hainich",
      "details": "29.01.2025 (Bekanntmachungsdatum)\n\nThüringen Amtsgericht Jena HRB 402557\nEinreichung neuer Dokumente\n\nNeue Energien Hörselberg-Hainich GmbH\nGesellschaft mit beschränkter Haftung\nHörselberg-Hainich\n\nBekanntmachung gem. § 52 Abs. 3 Satz 2 GmbHG: Aufgrund einer Veränderung in den Personen der Aufsichtsratsmitglieder ist durch die Geschäftsführer eine neue Liste zum Handelsregister eingereicht worden."
    },
    {
      "date": "2025-01-29",
      "id": "99897",
      "original_text": "Einreichung neuer Dokumente\nBrandenburg Amtsgericht Frankfurt/Oder HRB 2619\nTeGeCe Technologie- und Gewerbecenter Frankfurt (Oder) GmbH – Frankfurt (Oder)",
      "type": "Einreichung neuer Dokumente",
      "state": "Brandenburg",
      "amtsgericht": "Amtsgericht Frankfurt/Oder",
      "registernummer": "HRB 2619",
      "registerart": "HRB",
      "company_name": "TeGeCe Technologie- und Gewerbecenter Frankfurt (Oder) GmbH",
      "company_seat": "Frankfurt (Oder)",
      "details": "29.01.2025 (Bekanntmachungsdatum)\n\nBrandenburg Amtsgericht Frankfurt/Oder HRB 2619\nEinreichung neuer Dokumente\n\nTeGeCe Technologie- und Gewerbecenter Frankfurt (Oder) GmbH\nGesellschaft mit beschränkter Haftung\nFrankfurt (Oder)\n\nAls nicht eingetragen wird veröffentlicht: Die Gesellschaft hat Änderungen im Aufsichtsrat angezeigt."
    },
    {
      "date": "2025-01-29",
      "id": "99898",
      "original_text": "Einreichung neuer Dokumente\nSachsen-Anhalt Amtsgericht Stendal HRB 18417\nStädtische Werke Magdeburg Verwaltungs-GmbH – Magdeburg",
      "type": "Einreichung neuer Dokumente",
      "state": "Sachsen-Anhalt",
      "amtsgericht": "Amtsgericht Stendal",
      "registernummer": "HRB 18417",
      "registerart": "HRB",
      "company_name": "Städtische Werke Magdeburg Verwaltungs-GmbH",
      "company_seat": "Magdeburg",
      "details": "29.01.2025 (Bekanntmachungsdatum)\n\nSachsen-Anhalt Amtsgericht Stendal HRB 18417\nEinreichung neuer Dokumente\n\nStädtische Werke Magdeburg Verwaltungs-GmbH\nGesellschaft mit beschränkter Haftung\nMagdeburg\n\nEine Liste der Mitglieder des Aufsichtsrates wurde zum Handelsregister eingereicht."
    },
    {
      "date": "2025-01-29",
      "id": "99899",
      "original_text": "Einreichung neuer Dokumente\nBaden-Württemberg Amtsgericht Ulm HRB 500372\nGEO Gesellschaft für Energieversorgung Ostalb mbH – Oberkochen",
      "type": "Einreichung neuer Dokumente",
      "state": "Baden-Württemberg",
      "amtsgericht": "Amtsgericht Ulm",
      "registernummer": "HRB 500372",
      "registerart": "HRB",
      "company_name": "GEO Gesellschaft für Energieversorgung Ostalb mbH",
      "company_seat": "Oberkochen",
      "details": "29.01.2025 (Bekanntmachungsdatum)\n\nBaden-Württemberg Amtsgericht Ulm HRB 500372\nEinreichung neuer Dokumente\n\nGEO Gesellschaft für Energieversorgung Ostalb mbH\nGesellschaft mit beschränkter Haftung\nOberkochen\n\nDie Gesellschaft hat am #Fall.Eingang die Liste über die Zusammensetzung des Aufsichtsrats zum Handelsregister eingereicht."
    },
    {
      "date": "2025-01-29",
      "id": "99900",
      "original_text": "Registerbekanntmachung nach dem Umwandlungsgesetz\nNordrhein-Westfalen Amtsgericht Coesfeld HRB 5732\nSE - Blusen Stenau GmbH – Gronau",
      "type": "Registerbekanntmachung nach dem Umwandlungsgesetz",
      "state": "Nordrhein-Westfalen",
      "amtsgericht": "Amtsgericht Coesfeld",
      "registernummer": "HRB 5732",
      "registerart": "HRB",
      "company_name": "SE - Blusen Stenau GmbH",
      "company_seat": "Gronau",
      "details": "29.01.2025 (Bekanntmachungsdatum)\n\nNordrhein-Westfalen Amtsgericht Coesfeld HRB 5732\nRegisterbekanntmachung nach dem Umwandlungsgesetz 29.01.2025 (Eintragungsdatum)\n\nSE - Blusen Stenau GmbH\nGesellschaft mit beschränkter Haftung\nGronau\n\nDen Gläubigern der an der Verschmelzung beteiligten Rechtsträger ist, wenn sie binnen sechs Monaten nach dem Tag, an dem die Eintragung der Verschmelzung in das Register des Sitzes derjenigen Rechtsträger deren Gläubiger sie sind, nach § 19 Absatz 3 UmwG als bekanntgemacht gilt, ihren Anspruch nach Grund und Höhe schriftlich anmelden, Sicherheit zu leisten, soweit sie nicht Befriedigung verlangen können. Dieses Recht steht den Gläubigern jedoch nur zu, wenn sie glaubhaft machen, dass durch die Verschmelzung die Erfüllung ihrer Forderung gefährdet wird."
    },
    {
      "date": "2025-01-29",
      "id": "99901",
      "original_text": "Registerbekanntmachung nach dem Umwandlungsgesetz\nNordrhein-Westfalen Amtsgericht Coesfeld HRB 5595\nLudwig Stenau Blusenfabrik GmbH – Gronau",
      "type": "Registerbekanntmachung nach dem Umwandlungsgesetz",
      "state": "Nordrhein-Westfalen",
      "amtsgericht": "Amtsgericht Coesfeld",
      "registernummer": "HRB 5595",
      "registerart": "HRB",
      "company_name": "Ludwig Stenau Blusenfabrik GmbH",
      "company_seat": "Gronau",
      "details": "29.01.2025 (Bekanntmachungsdatum)\n\nNordrhein-Westfalen Amtsgericht Coesfeld HRB 5595\nRegisterbekanntmachung nach dem Umwandlungsgesetz 29.01.2025 (Eintragungsdatum)\n\nLudwig Stenau Blusenfabrik GmbH\nGesellschaft mit beschränkter Haftung\nGronau\n\nDen Gläubigern der an der Verschmelzung beteiligten Rechtsträger ist, wenn sie binnen sechs Monaten nach dem Tag, an dem die Eintragung der Verschmelzung in das Register des Sitzes derjenigen Rechtsträger deren Gläubiger sie sind, nach § 19 Absatz 3 UmwG als bekanntgemacht gilt, ihren Anspruch nach Grund und Höhe schriftlich anmelden, Sicherheit zu leisten, soweit sie nicht Befriedigung verlangen können. Dieses Recht steht den Gläubigern jedoch nur zu, wenn sie glaubhaft machen, dass durch die Verschmelzung die Erfüllung ihrer Forderung gefährdet wird."
    },
    {
      "date": "2025-01-29",
      "id": "99902",
      "original_text": "Löschungsankündigung\nBaden-Württemberg Amtsgericht Freiburg HRB 710134\nPoolprofi GmbH – Freiburg im Breisgau",
      "type": "Löschungsankündigung",
      "state": "Baden-Württemberg",
      "amtsgericht": "Amtsgericht Freiburg",
      "registernummer": "HRB 710134",
      "registerart": "HRB",
      "company_name": "Poolprofi GmbH",
      "company_seat": "Freiburg im Breisgau",
      "details": "29.01.2025 (Bekanntmachungsdatum)\n\nBaden-Württemberg Amtsgericht Freiburg HRB 710134\nLöschungsankündigung\n\nPoolprofi GmbH\nGesellschaft mit beschränkter Haftung\nFreiburg im Breisgau\n\nDas Gericht beabsichtigt, die Gesellschaft wegen Vermögenslosigkeit im Handelsregister von Amts wegen nach § 394 FamFG zu löschen. Die Frist zur Geltendmachung eines Widerspruchs gegen die beabsichtigte Löschung ist auf einen Monat ab Veröffentlichung bestimmt."
    },
    {
      "date": "2025-01-29",
      "id": "99903",
      "original_text": "Sonstige Registerbekanntmachung\nBaden-Württemberg Amtsgericht Freiburg HRB 602761\nEnergie-Gesellschaft Unterkirnach mbH – Unterkirnach",
      "type": "Sonstige Registerbekanntmachung",
      "state": "Baden-Württemberg",
      "amtsgericht": "Amtsgericht Freiburg",
      "registernummer": "HRB 602761",
      "registerart": "HRB",
      "company_name": "Energie-Gesellschaft Unterkirnach mbH",
      "company_seat": "Unterkirnach",
      "details": "29.01.2025 (Bekanntmachungsdatum)\n\nBaden-Württemberg Amtsgericht Freiburg HRB 602761\nSonstige Registerbekanntmachung 29.01.2025 (Eintragungsdatum)\n\nEnergie-Gesellschaft Unterkirnach mbH\nGesellschaft mit beschränkter Haftung\nUnterkirnach\n\nAls nicht eingetragen wird bekanntgemacht:\nDen Gläubigern der Gesellschaft, deren Forderungen begründet worden sind, bevor die Eintragung der Beendigung des Unternehmensvertrages in das Handelsregister nach § 10 HGB als bekanntgemacht gilt, ist vom anderen Vertragsteil Sicherheit zu leisten, wenn sie sich binnen sechs Monaten nach der Bekanntmachung zu diesem Zweck bei ihm melden."
    },
    {
      "date": "2025-01-29",
      "id": "99904",
      "original_text": "Registerbekanntmachung nach dem Umwandlungsgesetz\nBrandenburg Amtsgericht Cottbus HRA 4414\nCBT e.K. – Kolkwitz",
      "type": "Registerbekanntmachung nach dem Umwandlungsgesetz",
      "state": "Brandenburg",
      "amtsgericht": "Amtsgericht Cottbus",
      "registernummer": "HRA 4414",
      "registerart": "HRA",
      "company_name": "CBT e.K.",
      "company_seat": "Kolkwitz",
      "details": "29.01.2025 (Bekanntmachungsdatum)\n\nBrandenburg Amtsgericht Cottbus HRA 4414\nRegisterbekanntmachung nach dem Umwandlungsgesetz 28.01.2025 (Eintragungsdatum)\n\nCBT e.K.\nEinzelkaufmann / Einzelkauffrau\nKolkwitz\n\nZu Eintragungsnummer 1 vom 28.01.2025 wird als nicht eingetragen veröffentlicht:\nDen Gläubigern der an der Verschmelzung beteiligten Rechtsträger ist, wenn sie binnen sechs Monaten nach dem Tag, an dem die Eintragung der Verschmelzung in das Register des Sitzes desjenigen Rechtsträgers, dessen Gläubiger sie sind, als bekannt gemacht gilt, ihren Anspruch nach Grund und Höhe schriftlich anmelden, Sicherheit zu leisten, soweit sie nicht Befriedigung verlangen können. Dieses Recht steht den Gläubigern jedoch nur zu, wenn sie glaubhaft machen, dass durch die Verschmelzung die Erfüllung ihrer Forderung gefährdet wird"
    },
    {
      "date": "2025-01-29",
      "id": "99905",
      "original_text": "Sonstige Registerbekanntmachung\nHamburg Amtsgericht Hamburg HRB 135611\nVTG Rail Europe GmbH – Hamburg",
      "type": "Sonstige Registerbekanntmachung",
      "state": "Hamburg",
      "amtsgericht": "Amtsgericht Hamburg",
      "registernummer": "HRB 135611",
      "registerart": "HRB",
      "company_name": "VTG Rail Europe GmbH",
      "company_seat": "Hamburg",
      "details": "29.01.2025 (Bekanntmachungsdatum)\n\nHamburg Amtsgericht Hamburg HRB 135611\nSonstige Registerbekanntmachung 29.01.2025 (Eintragungsdatum)\n\nVTG Rail Europe GmbH\nGesellschaft mit beschränkter Haftung\nHamburg\n\nAls nicht eingetragen wird bekannt gemacht:  Den Gläubigern der Gesellschaft, deren Forderungen begründet worden sind, bevor die Eintragung der Vertragsbeendigung in das Handelsregister nach § 10 HGB als bekannt gemacht gilt, ist vom anderen Vertragsteil Sicherheit zu leisten, wenn sie sich binnen 6 Monaten nach Bekanntmachung der Eintragung zu diesem Zweck bei ihm melden."
    },
    {
      "date": "2025-01-29",
      "id": "99906",
      "original_text": "Registerbekanntmachung nach dem Umwandlungsgesetz\nBaden-Württemberg Amtsgericht Mannheim HRB 747822\nVEG Industrieservice GmbH – Malsch",
      "type": "Registerbekanntmachung nach dem Umwandlungsgesetz",
      "state": "Baden-Württemberg",
      "amtsgericht": "Amtsgericht Mannheim",
      "registernummer": "HRB 747822",
      "registerart": "HRB",
      "company_name": "VEG Industrieservice GmbH",
      "company_seat": "Malsch",
      "details": "29.01.2025 (Bekanntmachungsdatum)\n\nBaden-Württemberg Amtsgericht Mannheim HRB 747822\nRegisterbekanntmachung nach dem Umwandlungsgesetz 29.01.2025 (Eintragungsdatum)\n\nVEG Industrieservice GmbH\nGesellschaft mit beschränkter Haftung\nMalsch\n\nAls nicht eingetragen wird bekanntgemacht:\nDen Gläubigern der an der Verschmelzung beteiligten Rechtsträger ist, wenn sie binnen sechs Monaten nach dem Tag, an dem die Eintragung der Verschmelzung in das Register des Sitzes desjenigen Rechtsträgers, dessen Gläubiger sie sind, nach § 19 Abs. 3 UmwG als bekanntgemacht gilt, ihren Anspruch nach Grund und Höhe schriftlich anmelden, Sicherheit zu leisten, soweit sie nicht Befriedigung verlangen können. Dieses Recht steht den Gläubigern jedoch nur zu, wenn sie glaubhaft machen, dass durch die Verschmelzung die Erfüllung ihrer Forderung gefährdet wird."
    },
    {
      "date": "2025-01-29",
      "id": "99907",
      "original_text": "Einreichung neuer Dokumente\nBaden-Württemberg Amtsgericht Ulm HRB 531175\nEberhard AG Automations- und Montagetechnik – Schlierbach",
      "type": "Einreichung neuer Dokumente",
      "state": "Baden-Württemberg",
      "amtsgericht": "Amtsgericht Ulm",
      "registernummer": "HRB 531175",
      "registerart": "HRB",
      "company_name": "Eberhard AG Automations- und Montagetechnik",
      "company_seat": "Schlierbach",
      "details": "29.01.2025 (Bekanntmachungsdatum)\n\nBaden-Württemberg Amtsgericht Ulm HRB 531175\nEinreichung neuer Dokumente\n\nEberhard AG Automations- und Montagetechnik\nAktiengesellschaft\nSchlierbach\n\nDie Gesellschaft hat am 28.01.2025 die Liste über die Zusammensetzung des Aufsichtsrats zum Handelsregister eingereicht."
    },
    {
      "date": "2025-01-29",
      "id": "99908",
      "original_text": "Löschungsankündigung\nBaden-Württemberg Amtsgericht Stuttgart HRB 401221\nSchnee GmbH – Winterlingen",
      "type": "Löschungsankündigung",
      "state": "Baden-Württemberg",
      "amtsgericht": "Amtsgericht Stuttgart",
      "registernummer": "HRB 401221",
      "registerart": "HRB",
      "company_name": "Schnee GmbH",
      "company_seat": "Winterlingen",
      "details": "29.01.2025 (Bekanntmachungsdatum)\n\nBaden-Württemberg Amtsgericht Stuttgart HRB 401221\nLöschungsankündigung\n\nSchnee GmbH\nGesellschaft mit beschränkter Haftung\nWinterlingen\n\nDas Gericht beabsichtigt, die Gesellschaft wegen Vermögenslosigkeit im Handelsregister von Amts wegen nach § 394 FamFG zu löschen. Die Frist zur Geltendmachung eines Widerspruchs gegen die beabsichtigte Löschung ist auf zwei Monate ab Veröffentlichung bestimmt."
    },
    {
      "date": "2025-01-29",
      "id": "99909",
      "original_text": "Registerbekanntmachung nach dem Umwandlungsgesetz\nBaden-Württemberg Amtsgericht Ulm HRA 729288\nValentin Wirtz Karosserie- und Lackexperten e. K. – Leutkirch im Allgäu",
      "type": "Registerbekanntmachung nach dem Umwandlungsgesetz",
      "state": "Baden-Württemberg",
      "amtsgericht": "Amtsgericht Ulm",
      "registernummer": "HRA 729288",
      "registerart": "HRA",
      "company_name": "Valentin Wirtz Karosserie- und Lackexperten e. K.",
      "company_seat": "Leutkirch im Allgäu",
      "details": "29.01.2025 (Bekanntmachungsdatum)\n\nBaden-Württemberg Amtsgericht Ulm HRA 729288\nRegisterbekanntmachung nach dem Umwandlungsgesetz 29.01.2025 (Eintragungsdatum)\n\nValentin Wirtz Karosserie- und Lackexperten e. K.\nEinzelkaufmann / Einzelkauffrau\nLeutkirch im Allgäu\n\nAls nicht eingetragen wird bekanntgemacht:\nDen Gläubigern der an der Ausgliederung beteiligten Rechtsträger ist, wenn sie binnen sechs Monaten nach dem Tag, an dem die Eintragung der Ausgliederung in das Register des Sitzes desjenigen Rechtsträgers, dessen Gläubiger sie sind, nach § 19 Abs. 3 UmwG als bekanntgemacht gilt, ihren Anspruch nach Grund und Höhe schriftlich anmelden, Sicherheit zu leisten, soweit sie nicht Befriedigung verlangen können. Dieses Recht steht den Gläubigern jedoch nur zu, wenn sie glaubhaft machen, dass durch die Ausgliederung die Erfüllung ihrer Forderung gefährdet wird."
    },
    {
      "date": "2025-01-29",
      "id": "99910",
      "original_text": "Registerbekanntmachung nach dem Umwandlungsgesetz\nBaden-Württemberg Amtsgericht Ulm HRB 748604\nWirtz GmbH – Leutkirch im Allgäu",
      "type": "Registerbekanntmachung nach dem Umwandlungsgesetz",
      "state": "Baden-Württemberg",
      "amtsgericht": "Amtsgericht Ulm",
      "registernummer": "HRB 748604",
      "registerart": "HRB",
      "company_name": "Wirtz GmbH",
      "company_seat": "Leutkirch im Allgäu",
      "details": "29.01.2025 (Bekanntmachungsdatum)\n\nBaden-Württemberg Amtsgericht Ulm HRB 748604\nRegisterbekanntmachung nach dem Umwandlungsgesetz 29.01.2025 (Eintragungsdatum)\n\nWirtz GmbH\nGesellschaft mit beschränkter Haftung\nLeutkirch im Allgäu\n\nAls nicht eingetragen wird bekanntgemacht:\nDen Gläubigern der an der Ausgliederung beteiligten Rechtsträger ist, wenn sie binnen sechs Monaten nach dem Tag, an dem die Eintragung der Ausgliederung in das Register des Sitzes desjenigen Rechtsträgers, dessen Gläubiger sie sind, nach § 19 Abs. 3 UmwG als bekanntgemacht gilt, ihren Anspruch nach Grund und Höhe schriftlich anmelden, Sicherheit zu leisten, soweit sie nicht Befriedigung verlangen können. Dieses Recht steht den Gläubigern jedoch nur zu, wenn sie glaubhaft machen, dass durch die Ausgliederung die Erfüllung ihrer Forderung gefährdet wird."
    },
    {
      "date": "2025-01-29",
      "id": "99911",
      "original_text": "Registerbekanntmachung nach dem Umwandlungsgesetz\nBaden-Württemberg Amtsgericht Ulm HRB 733833\nGlaess Software & Automation GmbH – Weingarten",
      "type": "Registerbekanntmachung nach dem Umwandlungsgesetz",
      "state": "Baden-Württemberg",
      "amtsgericht": "Amtsgericht Ulm",
      "registernummer": "HRB 733833",
      "registerart": "HRB",
      "company_name": "Glaess Software & Automation GmbH",
      "company_seat": "Weingarten",
      "details": "29.01.2025 (Bekanntmachungsdatum)\n\nBaden-Württemberg Amtsgericht Ulm HRB 733833\nRegisterbekanntmachung nach dem Umwandlungsgesetz 29.01.2025 (Eintragungsdatum)\n\nGlaess Software & Automation GmbH\nGesellschaft mit beschränkter Haftung\nWeingarten\n\nAls nicht eingetragen wird bekanntgemacht:\nAuf das erhöhte Stammkapital werden Sacheinlagen nach Maßgabe der bei Gericht eingereichten Urkunden geleistet.\n\nDen Gläubigern der an der Verschmelzung beteiligten Rechtsträger ist, wenn sie binnen sechs Monaten nach dem Tag, an dem die Eintragung der Verschmelzung in das Register des Sitzes desjenigen Rechtsträgers, dessen Gläubiger sie sind, nach § 19 Abs. 3 UmwG als bekanntgemacht gilt, ihren Anspruch nach Grund und Höhe schriftlich anmelden, Sicherheit zu leisten, soweit sie nicht Befriedigung verlangen können. Dieses Recht steht den Gläubigern jedoch nur zu, wenn sie glaubhaft machen, dass durch die Verschmelzung die Erfüllung ihrer Forderung gefährdet wird."
    },
    {
      "date": "2025-01-29",
      "id": "99912",
      "original_text": "Registerbekanntmachung nach dem Umwandlungsgesetz\nBaden-Württemberg Amtsgericht Ulm HRB 734337\nPI Products & Innovations GmbH – Weingarten",
      "type": "Registerbekanntmachung nach dem Umwandlungsgesetz",
      "state": "Baden-Württemberg",
      "amtsgericht": "Amtsgericht Ulm",
      "registernummer": "HRB 734337",
      "registerart": "HRB",
      "company_name": "PI Products & Innovations GmbH",
      "company_seat": "Weingarten",
      "details": "29.01.2025 (Bekanntmachungsdatum)\n\nBaden-Württemberg Amtsgericht Ulm HRB 734337\nRegisterbekanntmachung nach dem Umwandlungsgesetz 29.01.2025 (Eintragungsdatum)\n\nPI Products & Innovations GmbH\nGesellschaft mit beschränkter Haftung\nWeingarten\n\nAls nicht eingetragen wird bekanntgemacht:\nDen Gläubigern der an der Verschmelzung beteiligten Rechtsträger ist, wenn sie binnen sechs Monaten nach dem Tag, an dem die Eintragung der Verschmelzung in das Register des Sitzes desjenigen Rechtsträgers, dessen Gläubiger sie sind, nach § 19 Abs. 3 UmwG als bekanntgemacht gilt, ihren Anspruch nach Grund und Höhe schriftlich anmelden, Sicherheit zu leisten, soweit sie nicht Befriedigung verlangen können. Dieses Recht steht den Gläubigern jedoch nur zu, wenn sie glaubhaft machen, dass durch die Verschmelzung die Erfüllung ihrer Forderung gefährdet wird."
    },
    {
      "date": "2025-01-29",
      "id": "99913",
      "original_text": "Einreichung neuer Dokumente\nNordrhein-Westfalen Amtsgericht Coesfeld HRB 2128\nFreeyou Insurance AG – Legden",
      "type": "Einreichung neuer Dokumente",
      "state": "Nordrhein-Westfalen",
      "amtsgericht": "Amtsgericht Coesfeld",
      "registernummer": "HRB 2128",
      "registerart": "HRB",
      "company_name": "Freeyou Insurance AG",
      "company_seat": "Legden",
      "details": "29.01.2025 (Bekanntmachungsdatum)\n\nNordrhein-Westfalen Amtsgericht Coesfeld HRB 2128\nEinreichung neuer Dokumente\n\nFreeyou Insurance AG\nAktiengesellschaft\nLegden\n\nDie Liste der Mitglieder des Aufsichtsrates ist zum Handelsregister eingereicht worden."
    },
    {
      "date": "2025-01-29",
      "id": "99914",
      "original_text": "Einreichung neuer Dokumente\nSachsen Amtsgericht Dresden HRB 42031\nDGI DD Deutsche Grundinvest AG – Dresden",
      "type": "Einreichung neuer Dokumente",
      "state": "Sachsen",
      "amtsgericht": "Amtsgericht Dresden",
      "registernummer": "HRB 42031",
      "registerart": "HRB",
      "company_name": "DGI DD Deutsche Grundinvest AG",
      "company_seat": "Dresden",
      "details": "29.01.2025 (Bekanntmachungsdatum)\n\nSachsen Amtsgericht Dresden HRB 42031\nEinreichung neuer Dokumente 29.01.2025 (Eintragungsdatum)\n\nDGI DD Deutsche Grundinvest AG\nAktiengesellschaft\nDresden\n\nAm 27.01.2025 wurde beim Handelsregister des Amtsgerichts Dresden die Liste der Mitglieder des Aufsichtsrats gemäß § 106 AktG eingereicht."
    },
    {
      "date": "2025-01-29",
      "id": "99915",
      "original_text": "Sonstige Registerbekanntmachung\nSachsen Amtsgericht Leipzig HRB 22362\nEuropean Commodity Clearing AG – Leipzig",
      "type": "Sonstige Registerbekanntmachung",
      "state": "Sachsen",
      "amtsgericht": "Amtsgericht Leipzig",
      "registernummer": "HRB 22362",
      "registerart": "HRB",
      "company_name": "European Commodity Clearing AG",
      "company_seat": "Leipzig",
      "details": "29.01.2025 (Bekanntmachungsdatum)\n\nSachsen Amtsgericht Leipzig HRB 22362\nSonstige Registerbekanntmachung 29.01.2025 (Eintragungsdatum)\n\nEuropean Commodity Clearing AG\nAktiengesellschaft\nLeipzig\n\nDen Gläubigern der Gesellschaft, deren Forderungen begründet worden sind bevor die Eintragung der Beendigung des Beherrschungsvertrages in das Handelsregister nach § 10 des Handelsgesetzbuches als bekanntgemacht gilt, hat der andere Vertragsteil Sicherheit zu leisten, wenn sie sich binnen sechs Monaten nach der Bekanntmachung der Eintragung zu diesem Zweck bei ihm melden."
    },
    {
      "date": "2025-01-29",
      "id": "99916",
      "original_text": "Löschungsankündigung\nSachsen Amtsgericht Leipzig HRB 37692\nDemirtas Bau GmbH – Leipzig",
      "type": "Löschungsankündigung",
      "state": "Sachsen",
      "amtsgericht": "Amtsgericht Leipzig",
      "registernummer": "HRB 37692",
      "registerart": "HRB",
      "company_name": "Demirtas Bau GmbH",
      "company_seat": "Leipzig",
      "details": "29.01.2025 (Bekanntmachungsdatum)\n\nSachsen Amtsgericht Leipzig HRB 37692\nLöschungsankündigung\n\nDemirtas Bau GmbH\nGesellschaft mit beschränkter Haftung\nLeipzig\n\nDas Registergericht beabsichtigt, die im Handelsregister eingetragene Gesellschaft von Amts wegen nach § 394 FamFG zu löschen. Die Frist zu Erhebung eines Widerspruchs gegen die beabsichtigte Löschung wird auf einen Monat festgesetzt."
    },
    {
      "date": "2025-01-29",
      "id": "99917",
      "original_text": "Löschungsankündigung\nSachsen Amtsgericht Leipzig HRB 38873\nDIATOPIA GmbH – Leipzig",
      "type": "Löschungsankündigung",
      "state": "Sachsen",
      "amtsgericht": "Amtsgericht Leipzig",
      "registernummer": "HRB 38873",
      "registerart": "HRB",
      "company_name": "DIATOPIA GmbH",
      "company_seat": "Leipzig",
      "details": "29.01.2025 (Bekanntmachungsdatum)\n\nSachsen Amtsgericht Leipzig HRB 38873\nLöschungsankündigung\n\nDIATOPIA GmbH\nGesellschaft mit beschränkter Haftung\nLeipzig\n\nDas Registergericht beabsichtigt, die im Handelsregister eingetragene Gesellschaft von Amts wegen nach § 394 FamFG zu löschen. Die Frist zu Erhebung eines Widerspruchs gegen die beabsichtigte Löschung wird auf einen Monat festgesetzt."
    },
    {
      "date": "2025-01-29",
      "id": "99918",
      "original_text": "Einreichung neuer Dokumente\nNiedersachsen Amtsgericht Göttingen HRB 205844\nKWS SE – Einbeck",
      "type": "Einreichung neuer Dokumente",
      "state": "Niedersachsen",
      "amtsgericht": "Amtsgericht Göttingen",
      "registernummer": "HRB 205844",
      "registerart": "HRB",
      "company_name": "KWS SE",
      "company_seat": "Einbeck",
      "details": "29.01.2025 (Bekanntmachungsdatum)\n\nNiedersachsen Amtsgericht Göttingen HRB 205844\nEinreichung neuer Dokumente 29.01.2025 (Eintragungsdatum)\n\nKWS SE\nEuropäische Aktiengesellschaft (SE)\nEinbeck\n\nDie Liste der Aufsichtsratsmitglieder wurde zum Handelsregister eingereicht."
    },
    {
      "date": "2025-01-29",
      "id": "99919",
      "original_text": "Einreichung neuer Dokumente\nNiedersachsen Amtsgericht Hannover HRB 6692\nVersorgungs- und Verkehrsgesellschaft Hannover mit beschränkter Haftung – Hannover",
      "type": "Einreichung neuer Dokumente",
      "state": "Niedersachsen",
      "amtsgericht": "Amtsgericht Hannover",
      "registernummer": "HRB 6692",
      "registerart": "HRB",
      "company_name": "Versorgungs- und Verkehrsgesellschaft Hannover mit beschränkter Haftung",
      "company_seat": "Hannover",
      "details": "29.01.2025 (Bekanntmachungsdatum)\n\nNiedersachsen Amtsgericht Hannover HRB 6692\nEinreichung neuer Dokumente 29.01.2025 (Eintragungsdatum)\n\nVersorgungs- und Verkehrsgesellschaft Hannover mit beschränkter Haftung\nGesellschaft mit beschränkter Haftung\nHannover\n\nDie Liste der Mitglieder des Aufsichtsrats wurde beim Registergericht eingereicht."
    },
    {
      "date": "2025-01-29",
      "id": "99920",
      "original_text": "Einreichung neuer Dokumente\nNiedersachsen Amtsgericht Braunschweig HRB 10019\nBraunschweiger Versorgungs-Verwaltungs-Aktiengesellschaft – Braunschweig",
      "type": "Einreichung neuer Dokumente",
      "state": "Niedersachsen",
      "amtsgericht": "Amtsgericht Braunschweig",
      "registernummer": "HRB 10019",
      "registerart": "HRB",
      "company_name": "Braunschweiger Versorgungs-Verwaltungs-Aktiengesellschaft",
      "company_seat": "Braunschweig",
      "details": "29.01.2025 (Bekanntmachungsdatum)\n\nNiedersachsen Amtsgericht Braunschweig HRB 10019\nEinreichung neuer Dokumente 29.01.2025 (Eintragungsdatum)\n\nBraunschweiger Versorgungs-Verwaltungs-Aktiengesellschaft\nAktiengesellschaft\nBraunschweig\n\nDie Liste der Mitglieder des Aufsichtsrats wurde beim Registergericht eingereicht."
    },
    {
      "date": "2025-01-29",
      "id": "99921",
      "original_text": "Registerbekanntmachung nach dem Umwandlungsgesetz\nNiedersachsen Amtsgericht Oldenburg (Oldenburg) HRB 150162 früher Amtsgericht Cloppenburg\nJohann Meemken Mineralöle GmbH – Friesoythe",
      "type": "Registerbekanntmachung nach dem Umwandlungsgesetz",
      "state": "Niedersachsen",
      "amtsgericht": "Amtsgericht Oldenburg (Oldenburg)",
      "registernummer": "HRB 150162",
      "registerart": "HRB",
      "company_name": "Johann Meemken Mineralöle GmbH",
      "company_seat": "Friesoythe",
      "former_amtsgericht": "Cloppenburg",
      "details": "29.01.2025 (Bekanntmachungsdatum)\n\nNiedersachsen Amtsgericht Oldenburg (Oldenburg) HRB 150162 früher Amtsgericht Cloppenburg\nRegisterbekanntmachung nach dem Umwandlungsgesetz 29.01.2025 (Eintragungsdatum)\n\nJohann Meemken Mineralöle GmbH\nGesellschaft mit beschränkter Haftung\nFriesoythe\n\nDen Gläubigern der an der Verschmelzung beteiligten Rechtsträger ist, wenn sie binnen sechs Monaten nach dem Tag, an dem die Eintragung der Verschmelzung in das Register des Sitzes desjenigen Rechtsträgers, dessen Gläubiger sie sind, nach § 19  Abs.  3 UmwG als bekannt gemacht gilt, ihren Anspruch nach Grund und Höhe schriftlich anmelden, Sicherheit zu leisten, soweit sie nicht Befriedigung verlangen können. Dieses Recht steht den Gläubigern jedoch nur zu, wenn sie glaubhaft machen, dass durch die Verschmelzung die Erfüllung der Forderung gefährdet wird."
    },
    {
      "date": "2025-01-29",
      "id": "99922",
      "original_text": "Sonstige Registerbekanntmachung\nNiedersachsen Amtsgericht Braunschweig HRA 202873\nDie Biobäckerei am Elm Brot und Wein e.K. – Evessen",
      "type": "Sonstige Registerbekanntmachung",
      "state": "Niedersachsen",
      "amtsgericht": "Amtsgericht Braunschweig",
      "registernummer": "HRA 202873",
      "registerart": "HRA",
      "company_name": "Die Biobäckerei am Elm Brot und Wein e.K.",
      "company_seat": "Evessen",
      "details": "29.01.2025 (Bekanntmachungsdatum)\n\nNiedersachsen Amtsgericht Braunschweig HRA 202873\nSonstige Registerbekanntmachung 29.01.2025 (Eintragungsdatum)\n\nDie Biobäckerei am Elm Brot und Wein e.K.\nEinzelkaufmann / Einzelkauffrau\nEvessen\n\nNeuer Inhaber: Büttner, Torsten, Ilsenburg (Harz), *29.04.1977. Der Übergang der in dem Betriebe des Geschäfts entstandenen Verbindlichkeiten und Forderungen ist beim Erwerb des Geschäfts durch den neuen Inhaber ausgeschlossen."
    },
    {
      "date": "2025-01-29",
      "id": "99923",
      "original_text": "Einreichung neuer Dokumente\nNiedersachsen Amtsgericht Osnabrück HRB 19396\nChristliches Kinderhospital Osnabrück GmbH – Osnabrück",
      "type": "Einreichung neuer Dokumente",
      "state": "Niedersachsen",
      "amtsgericht": "Amtsgericht Osnabrück",
      "registernummer": "HRB 19396",
      "registerart": "HRB",
      "company_name": "Christliches Kinderhospital Osnabrück GmbH",
      "company_seat": "Osnabrück",
      "details": "29.01.2025 (Bekanntmachungsdatum)\n\nNiedersachsen Amtsgericht Osnabrück HRB 19396\nEinreichung neuer Dokumente 24.01.2025 (Eintragungsdatum)\n\nChristliches Kinderhospital Osnabrück GmbH\nGesellschaft mit beschränkter Haftung\nOsnabrück\n\nDie Liste der Mitglieder des Aufsichtsrats wurde beim Registergericht eingereicht."
    },
    {
      "date": "2025-01-29",
      "id": "99924",
      "original_text": "Löschungsankündigung\nNiedersachsen Amtsgericht Braunschweig HRB 208393\nPH Verwaltungsgesellschaft UG (haftungsbeschränkt) – Salzgitter",
      "type": "Löschungsankündigung",
      "state": "Niedersachsen",
      "amtsgericht": "Amtsgericht Braunschweig",
      "registernummer": "HRB 208393",
      "registerart": "HRB",
      "company_name": "PH Verwaltungsgesellschaft UG (haftungsbeschränkt)",
      "company_seat": "Salzgitter",
      "details": "29.01.2025 (Bekanntmachungsdatum)\n\nNiedersachsen Amtsgericht Braunschweig HRB 208393\nLöschungsankündigung\n\nPH Verwaltungsgesellschaft UG (haftungsbeschränkt)\nGesellschaft mit beschränkter Haftung\nSalzgitter\n\nDas Registergericht beabsichtigt, die Gesellschaft von Amts wegen nach § 394 FamFG zu löschen. Die Frist zur Erhebung eines Widerspruchs ist auf 1 Monat ab dieser Registerbekanntmachung festgesetzt."
    },
    {
      "date": "2025-01-29",
      "id": "99925",
      "original_text": "Registerbekanntmachung nach dem Umwandlungsgesetz\nNiedersachsen Amtsgericht Göttingen HRB 205722\nKWS SAAT SE & Co. KGaA – Einbeck",
      "type": "Registerbekanntmachung nach dem Umwandlungsgesetz",
      "state": "Niedersachsen",
      "amtsgericht": "Amtsgericht Göttingen",
      "registernummer": "HRB 205722",
      "registerart": "HRB",
      "company_name": "KWS SAAT SE & Co. KGaA",
      "company_seat": "Einbeck",
      "details": "29.01.2025 (Bekanntmachungsdatum)\n\nNiedersachsen Amtsgericht Göttingen HRB 205722\nRegisterbekanntmachung nach dem Umwandlungsgesetz\n\nKWS SAAT SE & Co. KGaA\nKommanditgesellschaft auf Aktien\nEinbeck\n\nEs wird darauf hingewiesen, dass ein Entwurf über einen Verschmelzungsvertrag mit der Delitzsch Pflanzenzucht Gesellschaft mit beschränkter Haftung, Einbeck, Amtsgericht Göttingen HRB 200387 beim Handelsregister eingereicht worden ist. Dieser kann über das Registerportal eingesehen werden."
    },
    {
      "date": "2025-01-29",
      "id": "99926",
      "original_text": "Einreichung neuer Dokumente\nNiedersachsen Amtsgericht Osnabrück HRB 20975\nCaritas-Pflegezentrum St. Agnes GmbH – Bohmte",
      "type": "Einreichung neuer Dokumente",
      "state": "Niedersachsen",
      "amtsgericht": "Amtsgericht Osnabrück",
      "registernummer": "HRB 20975",
      "registerart": "HRB",
      "company_name": "Caritas-Pflegezentrum St. Agnes GmbH",
      "company_seat": "Bohmte",
      "details": "29.01.2025 (Bekanntmachungsdatum)\n\nNiedersachsen Amtsgericht Osnabrück HRB 20975\nEinreichung neuer Dokumente 21.01.2025 (Eintragungsdatum)\n\nCaritas-Pflegezentrum St. Agnes GmbH\nGesellschaft mit beschränkter Haftung\nBohmte\n\nDie Liste der Mitglieder des Aufsichtsrats wurde beim Registergericht eingereicht."
    },
    {
      "date": "2025-01-29",
      "id": "99927",
      "original_text": "Sonstige Registerbekanntmachung\nNiedersachsen Amtsgericht Hannover HRB 217147\nHoneywell Riedel-de Haën GmbH – Seelze",
      "type": "Sonstige Registerbekanntmachung",
      "state": "Niedersachsen",
      "amtsgericht": "Amtsgericht Hannover",
      "registernummer": "HRB 217147",
      "registerart": "HRB",
      "company_name": "Honeywell Riedel-de Haën GmbH",
      "company_seat": "Seelze",
      "details": "29.01.2025 (Bekanntmachungsdatum)\n\nNiedersachsen Amtsgericht Hannover HRB 217147\nSonstige Registerbekanntmachung 29.01.2025 (Eintragungsdatum)\n\nHoneywell Riedel-de Haën GmbH\nGesellschaft mit beschränkter Haftung\nSeelze\n\nDen Gläubigern der Gesellschaft, deren Forderungen begründet worden sind, bevor die Eintragung der Beendigung des Vertrages in das Handelsregister nach § 10 HGB als bekanntgemacht gilt, ist vom anderen Vertragsteil Sicherheit zu leisten, wenn sie sich binnen sechs Monaten nach der Bekanntmachung zu diesem Zweck bei ihm melden."
    },
    {
      "date": "2025-01-29",
      "id": "99928",
      "original_text": "Löschungsankündigung\nBremen Amtsgericht Bremen HRB 38728\nConnect The Home UG (haftungsbeschränkt) – Bremen",
      "type": "Löschungsankündigung",
      "state": "Bremen",
      "amtsgericht": "Amtsgericht Bremen",
      "registernummer": "HRB 38728",
      "registerart": "HRB",
      "company_name": "Connect The Home UG (haftungsbeschränkt)",
      "company_seat": "Bremen",
      "details": "29.01.2025 (Bekanntmachungsdatum)\n\nBremen Amtsgericht Bremen HRB 38728\nLöschungsankündigung\n\nConnect The Home UG (haftungsbeschränkt)\nGesellschaft mit beschränkter Haftung\nBremen\n\nEs ist beabsichtigt die im Handelsregister eingetragene Gesellschaft von Amts wegen gemäß § 394 FamFG zu löschen. Gegen die Löschung kann beim AG Bremen schriftlich oder zu Protokoll der Geschäftsstelle Widerspruch eingelegt werden. Widerspruchsfrist 4 Wochen."
    },
    {
      "date": "2025-01-29",
      "id": "99929",
      "original_text": "Löschungsankündigung\nBremen Amtsgericht Bremen HRB 35470\nBre Bedachung GmbH – Bremen",
      "type": "Löschungsankündigung",
      "state": "Bremen",
      "amtsgericht": "Amtsgericht Bremen",
      "registernummer": "HRB 35470",
      "registerart": "HRB",
      "company_name": "Bre Bedachung GmbH",
      "company_seat": "Bremen",
      "details": "29.01.2025 (Bekanntmachungsdatum)\n\nBremen Amtsgericht Bremen HRB 35470\nLöschungsankündigung\n\nBre Bedachung GmbH\nGesellschaft mit beschränkter Haftung\nBremen\n\nEs ist beabsichtigt die im Handelsregister eingetragene Gesellschaft von Amts wegen gemäß § 394 FamFG zu löschen. Gegen die Löschung kann beim AG Bremen schriftlich oder zu Protokoll der Geschäftsstelle Widerspruch eingelegt werden. Widerspruchsfrist 4 Wochen."
    },
    {
      "date": "2025-01-29",
      "id": "99930",
      "original_text": "Löschungsankündigung\nNordrhein-Westfalen Amtsgericht Gütersloh HRB 11477\nSTAR-BAG GmbH – Verl",
      "type": "Löschungsankündigung",
      "state": "Nordrhein-Westfalen",
      "amtsgericht": "Amtsgericht Gütersloh",
      "registernummer": "HRB 11477",
      "registerart": "HRB",
      "company_name": "STAR-BAG GmbH",
      "company_seat": "Verl",
      "details": "29.01.2025 (Bekanntmachungsdatum)\n\nNordrhein-Westfalen Amtsgericht Gütersloh HRB 11477\nLöschungsankündigung\n\nSTAR-BAG GmbH\nGesellschaft mit beschränkter Haftung\nVerl\n\nDas Registergericht beabsichtigt die Gesellschaft von Amts wegen nach § 394 FamFG zu löschen. Die Frist zur Erhebung eines Widerspruchs ist auf einen Monat festgesetzt."
    },
    {
      "date": "2025-01-29",
      "id": "99931",
      "original_text": "Sonstige Registerbekanntmachung\nNordrhein-Westfalen Amtsgericht Bonn HRB 19817\nDeutsche Post Mobility GmbH – Bonn",
      "type": "Sonstige Registerbekanntmachung",
      "state": "Nordrhein-Westfalen",
      "amtsgericht": "Amtsgericht Bonn",
      "registernummer": "HRB 19817",
      "registerart": "HRB",
      "company_name": "Deutsche Post Mobility GmbH",
      "company_seat": "Bonn",
      "details": "29.01.2025 (Bekanntmachungsdatum)\n\nNordrhein-Westfalen Amtsgericht Bonn HRB 19817\nSonstige Registerbekanntmachung 29.01.2025 (Eintragungsdatum)\n\nDeutsche Post Mobility GmbH\nGesellschaft mit beschränkter Haftung\nBonn\n\nAls nicht eingetragen wird veröffentlicht: Den Gläubigern der Gesellschaft, deren Forderungen begründet worden sind bevor die Eintragung der Beendigung des Beherrschungs- und Gewinnabführungsvertrages  in das Handelsregister nach § 10 des Handelsgesetzbuches als bekanntgemacht gilt, hat der andere Vertragsteil Sicherheit zu leisten, wenn sie sich binnen sechs Monaten nach der Bekanntmachung der Eintragung zu diesem Zweck bei ihm melden."
    },
    {
      "date": "2025-01-29",
      "id": "99932",
      "original_text": "Einreichung neuer Dokumente\nNordrhein-Westfalen Amtsgericht Hamm HRB 3348\nStadtwerke Unna GmbH – Unna",
      "type": "Einreichung neuer Dokumente",
      "state": "Nordrhein-Westfalen",
      "amtsgericht": "Amtsgericht Hamm",
      "registernummer": "HRB 3348",
      "registerart": "HRB",
      "company_name": "Stadtwerke Unna GmbH",
      "company_seat": "Unna",
      "details": "29.01.2025 (Bekanntmachungsdatum)\n\nNordrhein-Westfalen Amtsgericht Hamm HRB 3348\nEinreichung neuer Dokumente 27.01.2025 (Eintragungsdatum)\n\nStadtwerke Unna GmbH\nGesellschaft mit beschränkter Haftung\nUnna\n\nDem Registergericht ist eine neue Liste der Mitglieder des Aufsichtsrates eingereicht worden."
    },
    {
      "date": "2025-01-29",
      "id": "99933",
      "original_text": "Einreichung neuer Dokumente\nNordrhein-Westfalen Amtsgericht Köln HRB 35879\nHayuno AG – Köln",
      "type": "Einreichung neuer Dokumente",
      "state": "Nordrhein-Westfalen",
      "amtsgericht": "Amtsgericht Köln",
      "registernummer": "HRB 35879",
      "registerart": "HRB",
      "company_name": "Hayuno AG",
      "company_seat": "Köln",
      "details": "29.01.2025 (Bekanntmachungsdatum)\n\nNordrhein-Westfalen Amtsgericht Köln HRB 35879\nEinreichung neuer Dokumente\n\nHayuno AG\nAktiengesellschaft\nKöln\n\nDem Registergericht ist eine Liste der Mitglieder des Aufsichtsrates eingereicht worden."
    },
    {
      "date": "2025-01-29",
      "id": "99934",
      "original_text": "Registerbekanntmachung nach dem Umwandlungsgesetz\nNordrhein-Westfalen Amtsgericht Köln HRB 66449\nneofone GmbH – Köln",
      "type": "Registerbekanntmachung nach dem Umwandlungsgesetz",
      "state": "Nordrhein-Westfalen",
      "amtsgericht": "Amtsgericht Köln",
      "registernummer": "HRB 66449",
      "registerart": "HRB",
      "company_name": "neofone GmbH",
      "company_seat": "Köln",
      "details": "29.01.2025 (Bekanntmachungsdatum)\n\nNordrhein-Westfalen Amtsgericht Köln HRB 66449\nRegisterbekanntmachung nach dem Umwandlungsgesetz 29.01.2025 (Eintragungsdatum)\n\nneofone GmbH\nGesellschaft mit beschränkter Haftung\nKöln\n\nDen Gläubigern der an der Verschmelzung beteiligten Rechtsträger ist, wenn sie binnen sechs Monaten nach dem Tag, an dem die Eintragung der Verschmelzung in das Register des Sitzes derjenigen Rechtsträger deren Gläubiger sie sind, nach § 19 Absatz 3 UmwG als bekanntgemacht gilt, ihren Anspruch nach Grund und Höhe schriftlich anmelden, Sicherheit zu leisten, soweit sie nicht Befriedigung verlangen können. Dieses Recht steht den Gläubigern jedoch nur zu, wenn sie glaubhaft machen, dass durch die Verschmelzung die Erfüllung ihrer Forderung gefährdet wird."
    },
    {
      "date": "2025-01-29",
      "id": "99935",
      "original_text": "Löschungsankündigung\nNordrhein-Westfalen Amtsgericht Gütersloh HRB 11694\nGrüGa-Bau GmbH – Rietberg",
      "type": "Löschungsankündigung",
      "state": "Nordrhein-Westfalen",
      "amtsgericht": "Amtsgericht Gütersloh",
      "registernummer": "HRB 11694",
      "registerart": "HRB",
      "company_name": "GrüGa-Bau GmbH",
      "company_seat": "Rietberg",
      "details": "29.01.2025 (Bekanntmachungsdatum)\n\nNordrhein-Westfalen Amtsgericht Gütersloh HRB 11694\nLöschungsankündigung\n\nGrüGa-Bau GmbH\nGesellschaft mit beschränkter Haftung\nRietberg\n\nDas Registergericht beabsichtigt die Gesellschaft von Amts wegen nach § 394 FamFG zu löschen. Die Frist zur Erhebung eines Widerspruchs ist auf einen Monat festgesetzt."
    },
    {
      "date": "2025-01-29",
      "id": "99936",
      "original_text": "Registerbekanntmachung nach dem Umwandlungsgesetz\nNordrhein-Westfalen Amtsgericht Düsseldorf HRB 39473\nCECONOMY AG – Düsseldorf",
      "type": "Registerbekanntmachung nach dem Umwandlungsgesetz",
      "state": "Nordrhein-Westfalen",
      "amtsgericht": "Amtsgericht Düsseldorf",
      "registernummer": "HRB 39473",
      "registerart": "HRB",
      "company_name": "CECONOMY AG",
      "company_seat": "Düsseldorf",
      "details": "29.01.2025 (Bekanntmachungsdatum)\n\nNordrhein-Westfalen Amtsgericht Düsseldorf HRB 39473\nRegisterbekanntmachung nach dem Umwandlungsgesetz\n\nCECONOMY AG\nAktiengesellschaft\nDüsseldorf\n\nDem Registergericht ist ein Vertrag über die geplante Verschmelzung der MWFS Zwischenholding GmbH mit Sitz in Düsseldorf (AG Düsseldorf HRB 78537)  mit der CECONOMY AG mit Sitz in Düsseldorf (AG Düsseldorf HRB 39473) eingereicht worden."
    },
    {
      "date": "2025-01-29",
      "id": "99937",
      "original_text": "Einreichung neuer Dokumente\nNordrhein-Westfalen Amtsgericht Gütersloh HRB 10960\nNagel-Group Verwaltungs-SE – Versmold",
      "type": "Einreichung neuer Dokumente",
      "state": "Nordrhein-Westfalen",
      "amtsgericht": "Amtsgericht Gütersloh",
      "registernummer": "HRB 10960",
      "registerart": "HRB",
      "company_name": "Nagel-Group Verwaltungs-SE",
      "company_seat": "Versmold",
      "details": "29.01.2025 (Bekanntmachungsdatum)\n\nNordrhein-Westfalen Amtsgericht Gütersloh HRB 10960\nEinreichung neuer Dokumente\n\nNagel-Group Verwaltungs-SE\nEuropäische Aktiengesellschaft (SE)\nVersmold\n\nDem Registergericht ist eine neue Liste der Mitglieder des Aufsichtsrates eingereicht worden."
    },
    {
      "date": "2025-01-29",
      "id": "99938",
      "original_text": "Löschungsankündigung\nNordrhein-Westfalen Amtsgericht Recklinghausen HRB 6775\nFTOUR GmbH – Recklinghausen",
      "type": "Löschungsankündigung",
      "state": "Nordrhein-Westfalen",
      "amtsgericht": "Amtsgericht Recklinghausen",
      "registernummer": "HRB 6775",
      "registerart": "HRB",
      "company_name": "FTOUR GmbH",
      "company_seat": "Recklinghausen",
      "details": "29.01.2025 (Bekanntmachungsdatum)\n\nNordrhein-Westfalen Amtsgericht Recklinghausen HRB 6775\nLöschungsankündigung\n\nFTOUR GmbH\nGesellschaft mit beschränkter Haftung\nRecklinghausen\n\nDas Registergericht beabsichtigt die Gesellschaft von Amts wegen nach § 394 FamFG zu löschen. Die Frist zur Erhebung eines Widerspruchs ist auf drei Monate festgesetzt."
    },
    {
      "date": "2025-01-29",
      "id": "99939",
      "original_text": "Löschungsankündigung\nNordrhein-Westfalen Amtsgericht Wuppertal HRB 13695\nBoard Technologies GmbH – Haan",
      "type": "Löschungsankündigung",
      "state": "Nordrhein-Westfalen",
      "amtsgericht": "Amtsgericht Wuppertal",
      "registernummer": "HRB 13695",
      "registerart": "HRB",
      "company_name": "Board Technologies GmbH",
      "company_seat": "Haan",
      "details": "29.01.2025 (Bekanntmachungsdatum)\n\nNordrhein-Westfalen Amtsgericht Wuppertal HRB 13695\nLöschungsankündigung\n\nBoard Technologies GmbH\nGesellschaft mit beschränkter Haftung\nHaan\n\nDas Registergericht beabsichtigt die Gesellschaft von Amts wegen nach § 394 FamFG zu löschen. Die Frist zur Erhebung eines Widerspruchs ist auf einen Monat festgesetzt."
    },
    {
      "date": "2025-01-29",
      "id": "99940",
      "original_text": "Löschungsankündigung\nNordrhein-Westfalen Amtsgericht Wuppertal HRB 33706\nOradeas GmbH – Wuppertal",
      "type": "Löschungsankündigung",
      "state": "Nordrhein-Westfalen",
      "amtsgericht": "Amtsgericht Wuppertal",
      "registernummer": "HRB 33706",
      "registerart": "HRB",
      "company_name": "Oradeas GmbH",
      "company_seat": "Wuppertal",
      "details": "29.01.2025 (Bekanntmachungsdatum)\n\nNordrhein-Westfalen Amtsgericht Wuppertal HRB 33706\nLöschungsankündigung\n\nOradeas GmbH\nGesellschaft mit beschränkter Haftung\nWuppertal\n\nDas Registergericht beabsichtigt die Gesellschaft von Amts wegen nach § 394 FamFG zu löschen. Die Frist zur Erhebung eines Widerspruchs ist auf einen Monat festgesetzt."
    },
    {
      "date": "2025-01-29",
      "id": "99941",
      "original_text": "Einreichung neuer Dokumente\nNordrhein-Westfalen Amtsgericht Neuss HRB 21271\nCulligan Wassertechnik GmbH – Neuss",
      "type": "Einreichung neuer Dokumente",
      "state": "Nordrhein-Westfalen",
      "amtsgericht": "Amtsgericht Neuss",
      "registernummer": "HRB 21271",
      "registerart": "HRB",
      "company_name": "Culligan Wassertechnik GmbH",
      "company_seat": "Neuss",
      "details": "29.01.2025 (Bekanntmachungsdatum)\n\nNordrhein-Westfalen Amtsgericht Neuss HRB 21271\nEinreichung neuer Dokumente\n\nCulligan Wassertechnik GmbH\nGesellschaft mit beschränkter Haftung\nNeuss\n\nDem Registergericht ist eine neue Liste der Mitglieder des Aufsichtsrates eingereicht worden."
    },
    {
      "date": "2025-01-29",
      "id": "99942",
      "original_text": "Löschungsankündigung\nNordrhein-Westfalen Amtsgericht Aachen HRB 22634\nCritoxi Unternehmergesellschaft (haftungsbeschränkt) – Baesweiler",
      "type": "Löschungsankündigung",
      "state": "Nordrhein-Westfalen",
      "amtsgericht": "Amtsgericht Aachen",
      "registernummer": "HRB 22634",
      "registerart": "HRB",
      "company_name": "Critoxi Unternehmergesellschaft (haftungsbeschränkt)",
      "company_seat": "Baesweiler",
      "details": "29.01.2025 (Bekanntmachungsdatum)\n\nNordrhein-Westfalen Amtsgericht Aachen HRB 22634\nLöschungsankündigung\n\nCritoxi Unternehmergesellschaft (haftungsbeschränkt)\nGesellschaft mit beschränkter Haftung\nBaesweiler\n\nDas Registergericht beabsichtigt, von Amts wegen die Gesellschaft wegen Vermögenslosigkeit nach § 394 FamFG zu löschen.\nnachdem der Geschäftsführer Ohst mit undatiertem Schreiben, Eingang am 15.01.2025, mitgeteilt hat, dass die Gesellschaft vollständig vermögenslos ist.\n\nZur Geltendmachung des Widerspruchs gegen die beabsichtigte Löschung wird hiermit eine Frist von einem Monat ab Veröffentlichung dieser Ankündigung bestimmt.\n\nRechtsbehelfsbelehrung:\n\nGegen diese Verfügung kann Widerspruch eingelegt werden. Zum Widerspruch ist jeder berechtigt, der an der Unterlassung der Löschung ein berechtigtes Interesse hat.\n\nDer Widerspruch ist bei dem Amtsgericht Aachen, Adalbertsteinweg 92, 52070 Aachen schriftlich in deutscher Sprache oder zur Niederschrift der Geschäftsstelle einzulegen. Der Widerspruch kann auch zur Niederschrift der Geschäftsstelle eines jeden Amtsgerichtes abgegeben werden.\n\nDer Widerspruch muss spätestens innerhalb der gesetzten Frist nach der Bekanntgabe der Verfügung bei dem Amtsgericht Aachen eingegangen sein. Dies gilt auch dann, wenn der Widerspruch zur Niederschrift der Geschäftsstelle eines anderen Amtsgerichtes abgegeben wurde. Die Frist beginnt mit der Bekanntgabe der Verfügung durch Veröffentlichung. Fällt das Ende der Frist auf einen Sonntag, einen allgemeinen Feiertag oder Sonnabend, so endet die Frist mit Ablauf des nächsten Werktages.\n\nDer Widerspruch muss die Bezeichnung der angefochtenen Verfügung sowie die Erklärung enthalten, dass Widerspruch gegen diese Verfügung eingelegt wird. Er ist zu unterzeichnen und soll begründet werden.\n\nDie Einlegung ist auch durch Übertragung eines elektronischen Dokuments an die elektronische Poststelle des Gerichts möglich. Das elektronische Dokument muss für die Bearbeitung durch das Gericht geeignet und mit einer qualifizierten elektronischen Signatur der verantwortenden Person versehen sein oder von der verantwortenden Person signiert und auf einem sicheren Übermittlungsweg gemäß § 130 a ZPO nach näherer Maßgabe der Verordnung über die technischen Rahmenbedingungen des elektronischen Rechtsverkehrs und über das besondere elektronische Behördenpostfach (BGBl. I, S. 3803) eingereicht werden. Weitere Informationen erhalten Sie auf der Internetseite www.justiz.de."
    },
    {
      "date": "2025-01-29",
      "id": "99943",
      "original_text": "Löschungsankündigung\nNordrhein-Westfalen Amtsgericht Dortmund HRB 30362\nDeine Großgarage 10 UG (haftungsbeschränkt) – Castrop-Rauxel",
      "type": "Löschungsankündigung",
      "state": "Nordrhein-Westfalen",
      "amtsgericht": "Amtsgericht Dortmund",
      "registernummer": "HRB 30362",
      "registerart": "HRB",
      "company_name": "Deine Großgarage 10 UG (haftungsbeschränkt)",
      "company_seat": "Castrop-Rauxel",
      "details": "29.01.2025 (Bekanntmachungsdatum)\n\nNordrhein-Westfalen Amtsgericht Dortmund HRB 30362\nLöschungsankündigung 29.01.2025 (Eintragungsdatum)\n\nDeine Großgarage 10 UG (haftungsbeschränkt)\nGesellschaft mit beschränkter Haftung\nCastrop-Rauxel\n\nDas Registergericht beabsichtigt die Gesellschaft von Amts wegen nach § 394 FamFG zu löschen. Die Frist zur Erhebung eines Widerspruchs ist auf zwei Monate festgesetzt."
    },
    {
      "date": "2025-01-29",
      "id": "99944",
      "original_text": "Löschungsankündigung\nNordrhein-Westfalen Amtsgericht Hamm HRB 9936\nFABU Verwaltungs GmbH – Fröndenberg/Ruhr",
      "type": "Löschungsankündigung",
      "state": "Nordrhein-Westfalen",
      "amtsgericht": "Amtsgericht Hamm",
      "registernummer": "HRB 9936",
      "registerart": "HRB",
      "company_name": "FABU Verwaltungs GmbH",
      "company_seat": "Fröndenberg/Ruhr",
      "details": "29.01.2025 (Bekanntmachungsdatum)\n\nNordrhein-Westfalen Amtsgericht Hamm HRB 9936\nLöschungsankündigung\n\nFABU Verwaltungs GmbH\nGesellschaft mit beschränkter Haftung\nFröndenberg/Ruhr\n\nDas Registergericht beabsichtigt die Gesellschaft von Amts wegen nach § 394 FamFG zu löschen. Die Frist zur Erhebung eines Widerspruchs ist auf drei Monate festgesetzt."
    },
    {
      "date": "2025-01-29",
      "id": "99945",
      "original_text": "Löschungsankündigung\nNordrhein-Westfalen Amtsgericht Düsseldorf HRB 62668\nKreativkonfekt - Manufaktur für Grafik, Design & Konzept UG (haftungsbeschränkt) – Düsseldorf",
      "type": "Löschungsankündigung",
      "state": "Nordrhein-Westfalen",
      "amtsgericht": "Amtsgericht Düsseldorf",
      "registernummer": "HRB 62668",
      "registerart": "HRB",
      "company_name": "Kreativkonfekt - Manufaktur für Grafik, Design & Konzept UG (haftungsbeschränkt)",
      "company_seat": "Düsseldorf",
      "details": "29.01.2025 (Bekanntmachungsdatum)\n\nNordrhein-Westfalen Amtsgericht Düsseldorf HRB 62668\nLöschungsankündigung\n\nKreativkonfekt - Manufaktur für Grafik, Design & Konzept UG (haftungsbeschränkt)\nGesellschaft mit beschränkter Haftung\nDüsseldorf\n\nDas Registergericht beabsichtigt die Gesellschaft von Amts wegen nach § 394 FamFG zu löschen. Die Frist zur Erhebung eines Widerspruchs ist auf 3 Wochen festgesetzt.\n\nRechtsbehelfsbelehrung:\nDas Widerspruchsrecht steht jedem zu, der an der Unterlassung der Löschung ein berechtigtes Interesse hat. Der Widerspruch ist bei dem Amtsgericht Düsseldorf -Registergericht-, Werdener Straße 1, 40227 Düsseldorf schriftlich in deutscher Sprache oder zur Niederschrift der Geschäftsstelle einzulegen. Der Widerspruch kann auch zur Niederschrift der Geschäftsstelle eines jeden Amtsgerichtes abgegeben werden. Die Einlegung ist auch durch Übertragung eines elektronischen Dokuments an die elektronische Poststelle des Gerichts möglich. Das elektronische Dokument muss für die Bearbeitung durch das Gericht geeignet und mit einer qualifizierten elektronischen Signatur der verantwortenden Person versehen sein oder von der verantwortenden Person signiert und auf einem sicheren Übermittlungsweg gemäß § 130a ZPO nach näherer Maßgabe der Verordnung über die technischen Rahmenbedingungen des elektronischen Rechtsverkehrs und über das besondere elektronische Behördenpostfach (BGBl. I, S.3803) eingereicht werden. Weitere Informationen erhalten Sie auf der Internetseite www.justiz.de.\nDer Widerspruch muss spätestens innerhalb der gesetzten Frist nach dem Datum der Bekanntmachung der Löschungsankündigung bei dem Amtsgericht - Registergericht - Düsseldorf eingegangen sein.  Dies gilt auch dann, wenn der Widerspruch zur Niederschrift der Geschäftsstelle eines anderen Amtsgerichtes abgegeben wurde. Die Frist beginnt mit dem Tage der Bekanntmachung der Löschungsankündigung in dem für die Bekanntmachung der Eintragungen in das Handelsregister bestimmten elektronischen Informations- und Kommunikationssystem nach § 10 des Handelsgesetzbuches. Fällt das Ende der Frist auf einen Sonntag, einen allgemeinen Feiertag oder Sonnabend, so endet die Frist mit Ablauf des nächsten Werktages.\nDer Widerspruch muss die Bezeichnung der angefochtenen Löschungsankündigung sowie die Erklärung enthalten, dass Widerspruch gegen diese Löschungsankündigung eingelegt wird. Er ist zu unterzeichnen und soll begründet werden."
    },
    {
      "date": "2025-01-29",
      "id": "99946",
      "original_text": "Sonstige Registerbekanntmachung\nNordrhein-Westfalen Amtsgericht Mönchengladbach HRB 9559\nNEW Kreis Viersen GmbH – Viersen",
      "type": "Sonstige Registerbekanntmachung",
      "state": "Nordrhein-Westfalen",
      "amtsgericht": "Amtsgericht Mönchengladbach",
      "registernummer": "HRB 9559",
      "registerart": "HRB",
      "company_name": "NEW Kreis Viersen GmbH",
      "company_seat": "Viersen",
      "details": "29.01.2025 (Bekanntmachungsdatum)\n\nNordrhein-Westfalen Amtsgericht Mönchengladbach HRB 9559\nSonstige Registerbekanntmachung 28.01.2025 (Eintragungsdatum)\n\nNEW Kreis Viersen GmbH\nGesellschaft mit beschränkter Haftung\nViersen\n\nAls nicht eingetragen wird veröffentlicht: Den Gläubigern der Gesellschaft, deren Forderungen begründet worden sind bevor die Eintragung der Beendigung des Gewinnabführungsvertrages  in das Handelsregister nach § 10 des Handelsgesetzbuches als bekanntgemacht gilt, hat der andere Vertragsteil Sicherheit zu leisten, wenn sie sich binnen sechs Monaten nach der Bekanntmachung der Eintragung zu diesem Zweck bei ihm melden."
    },
    {
      "date": "2025-01-29",
      "id": "99947",
      "original_text": "Löschungsankündigung\nNordrhein-Westfalen Amtsgericht Bonn HRA 2336\nUniversitätsbuchhandlung Bouvier GmbH & Co. KG – Bonn",
      "type": "Löschungsankündigung",
      "state": "Nordrhein-Westfalen",
      "amtsgericht": "Amtsgericht Bonn",
      "registernummer": "HRA 2336",
      "registerart": "HRA",
      "company_name": "Universitätsbuchhandlung Bouvier GmbH & Co. KG",
      "company_seat": "Bonn",
      "details": "29.01.2025 (Bekanntmachungsdatum)\n\nNordrhein-Westfalen Amtsgericht Bonn HRA 2336\nLöschungsankündigung\n\nUniversitätsbuchhandlung Bouvier GmbH & Co. KG\nKommanditgesellschaft\nBonn\n\nDas Registergericht beabsichtigt die Firma von Amts wegen nach § 394 FamFG zu löschen. Die Frist zur Erhebung eines Widerspruchs ist auf einen Monat festgesetzt."
    },
    {
      "date": "2025-01-29",
      "id": "99948",
      "original_text": "Löschungsankündigung\nNordrhein-Westfalen Amtsgericht Köln HRA 3741\nemondis GmbH & Co. KG – Köln",
      "type": "Löschungsankündigung",
      "state": "Nordrhein-Westfalen",
      "amtsgericht": "Amtsgericht Köln",
      "registernummer": "HRA 3741",
      "registerart": "HRA",
      "company_name": "emondis GmbH & Co. KG",
      "company_seat": "Köln",
      "details": "29.01.2025 (Bekanntmachungsdatum)\n\nNordrhein-Westfalen Amtsgericht Köln HRA 3741\nLöschungsankündigung 29.01.2025 (Eintragungsdatum)\n\nemondis GmbH & Co. KG\nKommanditgesellschaft\nKöln\n\nDas Registergericht beabsichtigt die Firma von Amts wegen nach § 394 FamFG zu löschen. Die Frist zur Erhebung eines Widerspruchs ist auf #DV.Fr(Text=\"Bitte wählen Sie die Widerspruchsfrist aus!\",Eingabe=\"einen Monat\",\"zwei Monate\",\"drei Monate\",\"#insert(Text=\"Freitext\")\"|\"freier Text\") festgesetzt."
    },
    {
      "date": "2025-01-29",
      "id": "99949",
      "original_text": "Löschungsankündigung\nNordrhein-Westfalen Amtsgericht Köln HRA 3741\nemondis GmbH & Co. KG – Köln",
      "type": "Löschungsankündigung",
      "state": "Nordrhein-Westfalen",
      "amtsgericht": "Amtsgericht Köln",
      "registernummer": "HRA 3741",
      "registerart": "HRA",
      "company_name": "emondis GmbH & Co. KG",
      "company_seat": "Köln",
      "details": "29.01.2025 (Bekanntmachungsdatum)\n\nNordrhein-Westfalen Amtsgericht Köln HRA 3741\nLöschungsankündigung 29.01.2025 (Eintragungsdatum)\n\nemondis GmbH & Co. KG\nKommanditgesellschaft\nKöln\n\nDas Registergericht beabsichtigt die Firma von Amts wegen nach § 394 FamFG zu löschen. Die Frist zur Erhebung eines Widerspruchs ist auf einen Monat festgesetzt."
    },
    {
      "date": "2025-01-29",
      "id": "99950",
      "original_text": "Registerbekanntmachung nach dem Umwandlungsgesetz\nNordrhein-Westfalen Amtsgericht Hamm HRA 4241\nThoWo-Maschinenbesitz GmbH & Co. KG – Hamm",
      "type": "Registerbekanntmachung nach dem Umwandlungsgesetz",
      "state": "Nordrhein-Westfalen",
      "amtsgericht": "Amtsgericht Hamm",
      "registernummer": "HRA 4241",
      "registerart": "HRA",
      "company_name": "ThoWo-Maschinenbesitz GmbH & Co. KG",
      "company_seat": "Hamm",
      "details": "29.01.2025 (Bekanntmachungsdatum)\n\nNordrhein-Westfalen Amtsgericht Hamm HRA 4241\nRegisterbekanntmachung nach dem Umwandlungsgesetz 29.01.2025 (Eintragungsdatum)\n\nThoWo-Maschinenbesitz GmbH & Co. KG\nKommanditgesellschaft\nHamm\n\nDen Gläubigern der an der formwechselnden Umwandlung beteiligten Rechtsträger ist, wenn sie binnen sechs Monaten nach dem Tag, an dem die Eintragung der formwechselnden Umwandlung in das Register des Sitzes derjenigen Rechtsträger deren Gläubiger sie sind, nach § 19 Absatz 3 UmwG als bekanntgemacht gilt, ihren Anspruch nach Grund und Höhe schriftlich anmelden, Sicherheit zu leisten, soweit sie nicht Befriedigung verlangen können. Dieses Recht steht den Gläubigern jedoch nur zu, wenn sie glaubhaft machen, dass durch die formwechselnden Umwandlung die Erfüllung ihrer Forderung gefährdet wird."
    },
    {
      "date": "2025-01-29",
      "id": "99951",
      "original_text": "Registerbekanntmachung nach dem Umwandlungsgesetz\nNordrhein-Westfalen Amtsgericht Gelsenkirchen HRB 2247\nLvU Beteiligungs GmbH – Gelsenkirchen",
      "type": "Registerbekanntmachung nach dem Umwandlungsgesetz",
      "state": "Nordrhein-Westfalen",
      "amtsgericht": "Amtsgericht Gelsenkirchen",
      "registernummer": "HRB 2247",
      "registerart": "HRB",
      "company_name": "LvU Beteiligungs GmbH",
      "company_seat": "Gelsenkirchen",
      "details": "29.01.2025 (Bekanntmachungsdatum)\n\nNordrhein-Westfalen Amtsgericht Gelsenkirchen HRB 2247\nRegisterbekanntmachung nach dem Umwandlungsgesetz 29.01.2025 (Eintragungsdatum)\n\nLvU Beteiligungs GmbH\nGesellschaft mit beschränkter Haftung\nGelsenkirchen\n\nDen Gläubigern der an der Verschmelzung beteiligten Rechtsträger ist, wenn sie binnen sechs Monaten nach dem Tag, an dem die Eintragung der Verschmelzung in das Register des Sitzes desjenigen Rechtsträgers, dessen Gläubiger sie sind, nach § 19 Absatz 3 UmwG als bekanntgemacht gilt, ihren Anspruch nach Grund und Höhe schriftlich anmelden, Sicherheit zu leisten, soweit sie nicht Befriedigung verlangen können. Dieses Recht steht den Gläubigern jedoch nur zu, wenn sie glaubhaft machen, dass durch die Verschmelzung die Erfüllung ihrer Forderung gefährdet wird."
    },
    {
      "date": "2025-01-29",
      "id": "99952",
      "original_text": "Löschungsankündigung\nRheinland-Pfalz Amtsgericht Ludwigshafen a.Rhein (Ludwigshafen) HRB 64382\nr-p-k hausbau GmbH – Ludwigshafen/Rhein",
      "type": "Löschungsankündigung",
      "state": "Rheinland-Pfalz",
      "amtsgericht": "Amtsgericht Ludwigshafen a.Rhein (Ludwigshafen)",
      "registernummer": "HRB 64382",
      "registerart": "HRB",
      "company_name": "r-p-k hausbau GmbH",
      "company_seat": "Ludwigshafen/Rhein",
      "details": "29.01.2025 (Bekanntmachungsdatum)\n\nRheinland-Pfalz Amtsgericht Ludwigshafen a.Rhein (Ludwigshafen) HRB 64382\nLöschungsankündigung\n\nr-p-k hausbau GmbH\nGesellschaft mit beschränkter Haftung\nLudwigshafen/Rhein\n\nDas Registergericht beabsichtigt die Gesellschaft von Amts wegen nach § 394 FamFG zu löschen. Die Frist zur Erhebung eines Widerspruchs ist auf einen Monat festgesetzt."
    },
    {
      "date": "2025-01-29",
      "id": "99953",
      "original_text": "Registerbekanntmachung nach dem Umwandlungsgesetz\nHessen Amtsgericht Frankfurt am Main GsR 337\nDr. Anat, Josef und Filip Blodinger Objekt: Bremen eGbR – Frankfurt am Main",
      "type": "Registerbekanntmachung nach dem Umwandlungsgesetz",
      "state": "Hessen",
      "amtsgericht": "Amtsgericht Frankfurt am Main",
      "registernummer": "GsR 337",
      "registerart": "GsR",
      "company_name": "Dr. Anat, Josef und Filip Blodinger Objekt: Bremen eGbR",
      "company_seat": "Frankfurt am Main",
      "details": "29.01.2025 (Bekanntmachungsdatum)\n\nHessen Amtsgericht Frankfurt am Main GsR 337\nRegisterbekanntmachung nach dem Umwandlungsgesetz 29.01.2025 (Eintragungsdatum)\n\nDr. Anat, Josef und Filip Blodinger Objekt: Bremen eGbR\nGesellschaft bürgerlichen Rechts\nFrankfurt am Main\n\nDen Gläubigern der an der formwechselnden Umwandlung beteiligten Rechtsträger ist, wenn sie binnen sechs Monaten nach dem Tag, an dem die Eintragung der formwechselnden Umwandlung in das Register des Sitzes desjenigen Rechtsträgers, dessen Gläubiger sie sind, nach § 201 UmwG bekannt gemacht worden ist, ihren Anspruch nach Grund und Höhe schriftlich anmelden, Sicherheit zu leisten, soweit sie nicht Befriedigung verlangen können. Dieses Recht steht den Gläubigern jedoch nur zu, wenn sie glaubhaft machen, dass durch die formwechselnden Umwandlung die Erfüllung ihrer Forderung gefährdet wird."
    },
    {
      "date": "2025-01-29",
      "id": "99954",
      "original_text": "Registerbekanntmachung nach dem Umwandlungsgesetz\nHessen Amtsgericht Wetzlar HRB 7369\nKB Toolzz Süd GmbH – Haiger",
      "type": "Registerbekanntmachung nach dem Umwandlungsgesetz",
      "state": "Hessen",
      "amtsgericht": "Amtsgericht Wetzlar",
      "registernummer": "HRB 7369",
      "registerart": "HRB",
      "company_name": "KB Toolzz Süd GmbH",
      "company_seat": "Haiger",
      "details": "29.01.2025 (Bekanntmachungsdatum)\n\nHessen Amtsgericht Wetzlar HRB 7369\nRegisterbekanntmachung nach dem Umwandlungsgesetz 29.01.2025 (Eintragungsdatum)\n\nKB Toolzz Süd GmbH\nGesellschaft mit beschränkter Haftung\nHaiger\n\nDen Gläubigern der an der Verschmelzung beteiligten Rechtsträger ist, wenn sie binnen sechs Monaten nach dem Tag, an dem die Eintragung der Verschmelzung in das Register des Sitzes desjenigen Rechtsträgers, dessen Gläubiger sie sind, nach § 19 Absatz 3 UmwG bekannt gemacht worden ist, ihren Anspruch nach Grund und Höhe schriftlich anmelden, Sicherheit zu leisten, soweit sie nicht Befriedigung verlangen können. Dieses Recht steht den Gläubigern jedoch nur zu, wenn sie glaubhaft machen, dass durch die Verschmelzung die Erfüllung ihrer Forderung gefährdet wird."
    },
    {
      "date": "2025-01-29",
      "id": "99955",
      "original_text": "Registerbekanntmachung nach dem Umwandlungsgesetz\nHessen Amtsgericht Darmstadt HRA 87736\nMd Binco EOOD & Co. KG – Darmstadt",
      "type": "Registerbekanntmachung nach dem Umwandlungsgesetz",
      "state": "Hessen",
      "amtsgericht": "Amtsgericht Darmstadt",
      "registernummer": "HRA 87736",
      "registerart": "HRA",
      "company_name": "Md Binco EOOD & Co. KG",
      "company_seat": "Darmstadt",
      "details": "29.01.2025 (Bekanntmachungsdatum)\n\nHessen Amtsgericht Darmstadt HRA 87736\nRegisterbekanntmachung nach dem Umwandlungsgesetz 29.01.2025 (Eintragungsdatum)\n\nMd Binco EOOD & Co. KG\nKommanditgesellschaft\nDarmstadt\n\nDen Gläubigern der an der formwechselnden Umwandlung beteiligten Rechtsträger ist, wenn sie binnen sechs Monaten nach dem Tag, an dem die Eintragung der formwechselnden Umwandlung in das Register des Sitzes desjenigen Rechtsträgers, dessen Gläubiger sie sind, nach § 201 UmwG bekannt gemacht worden ist, ihren Anspruch nach Grund und Höhe schriftlich anmelden, Sicherheit zu leisten, soweit sie nicht Befriedigung verlangen können. Dieses Recht steht den Gläubigern jedoch nur zu, wenn sie glaubhaft machen, dass durch die formwechselnden Umwandlung die Erfüllung ihrer Forderung gefährdet wird."
    },
    {
      "date": "2025-01-29",
      "id": "99956",
      "original_text": "Löschungsankündigung\nHessen Amtsgericht Wiesbaden HRB 30047\nMAGA Management GmbH – Wiesbaden",
      "type": "Löschungsankündigung",
      "state": "Hessen",
      "amtsgericht": "Amtsgericht Wiesbaden",
      "registernummer": "HRB 30047",
      "registerart": "HRB",
      "company_name": "MAGA Management GmbH",
      "company_seat": "Wiesbaden",
      "details": "29.01.2025 (Bekanntmachungsdatum)\n\nHessen Amtsgericht Wiesbaden HRB 30047\nLöschungsankündigung\n\nMAGA Management GmbH\nGesellschaft mit beschränkter Haftung\nWiesbaden\n\nDas Registergericht beabsichtigt die im Handelsregister eingetragene Gesellschaft von Amts wegen nach § 394 FamFG zu löschen. Die Frist zur Erhebung eines Widerspruchs gegen die beabsichtigte Löschung wird auf 3 Monate festgesetzt."
    },
    {
      "date": "2025-01-29",
      "id": "99957",
      "original_text": "Registerbekanntmachung nach dem Umwandlungsgesetz\nHessen Amtsgericht Wetzlar HRB 7623\nFrizz Group 4 Toolzz GmbH – Haiger",
      "type": "Registerbekanntmachung nach dem Umwandlungsgesetz",
      "state": "Hessen",
      "amtsgericht": "Amtsgericht Wetzlar",
      "registernummer": "HRB 7623",
      "registerart": "HRB",
      "company_name": "Frizz Group 4 Toolzz GmbH",
      "company_seat": "Haiger",
      "details": "29.01.2025 (Bekanntmachungsdatum)\n\nHessen Amtsgericht Wetzlar HRB 7623\nRegisterbekanntmachung nach dem Umwandlungsgesetz 29.01.2025 (Eintragungsdatum)\n\nFrizz Group 4 Toolzz GmbH\nGesellschaft mit beschränkter Haftung\nHaiger\n\nDen Gläubigern der an der Verschmelzung beteiligten Rechtsträger ist, wenn sie binnen sechs Monaten nach dem Tag, an dem die Eintragung der Verschmelzung in das Register des Sitzes desjenigen Rechtsträgers, dessen Gläubiger sie sind, nach § 19 Absatz 3 UmwG bekannt gemacht worden ist, ihren Anspruch nach Grund und Höhe schriftlich anmelden, Sicherheit zu leisten, soweit sie nicht Befriedigung verlangen können. Dieses Recht steht den Gläubigern jedoch nur zu, wenn sie glaubhaft machen, dass durch die Verschmelzung die Erfüllung ihrer Forderung gefährdet wird."
    },
    {
      "date": "2025-01-29",
      "id": "99958",
      "original_text": "Löschungsankündigung\nHessen Amtsgericht Friedberg HRB 9775\nSushi SESAMS GmbH – Büdingen",
      "type": "Löschungsankündigung",
      "state": "Hessen",
      "amtsgericht": "Amtsgericht Friedberg",
      "registernummer": "HRB 9775",
      "registerart": "HRB",
      "company_name": "Sushi SESAMS GmbH",
      "company_seat": "Büdingen",
      "details": "29.01.2025 (Bekanntmachungsdatum)\n\nHessen Amtsgericht Friedberg HRB 9775\nLöschungsankündigung\n\nSushi SESAMS GmbH\nGesellschaft mit beschränkter Haftung\nBüdingen\n\nDas Registergericht beabsichtigt die im Handelsregister eingetragene Gesellschaft von Amts wegen nach § 394 FamFG zu löschen. Die Frist zur Erhebung eines Widerspruchs gegen die beabsichtigte Löschung wird auf 3 Monate festgesetzt."
    },
    {
      "date": "2025-01-29",
      "id": "99959",
      "original_text": "Einreichung neuer Dokumente\nHessen Amtsgericht Offenbach am Main HRB 42024\nHelvar GmbH – Offenbach am Main",
      "type": "Einreichung neuer Dokumente",
      "state": "Hessen",
      "amtsgericht": "Amtsgericht Offenbach am Main",
      "registernummer": "HRB 42024",
      "registerart": "HRB",
      "company_name": "Helvar GmbH",
      "company_seat": "Offenbach am Main",
      "details": "29.01.2025 (Bekanntmachungsdatum)\n\nHessen Amtsgericht Offenbach am Main HRB 42024\nEinreichung neuer Dokumente 29.01.2025 (Eintragungsdatum)\n\nHelvar GmbH\nGesellschaft mit beschränkter Haftung\nOffenbach am Main\n\nDurch eine Änderung in den Personen der Aufsichtsratsmitglieder ist eine Liste der Mitglieder des Aufsichtsrates zum Handelsregister eingereicht worden."
    },
    {
      "date": "2025-01-29",
      "id": "99960",
      "original_text": "Registerbekanntmachung nach dem Umwandlungsgesetz\nHessen Amtsgericht Frankfurt am Main HRB 137449\nDr. Anat, Josef und Filip Blodinger Objekt: Bremen GmbH – Frankfurt am Main",
      "type": "Registerbekanntmachung nach dem Umwandlungsgesetz",
      "state": "Hessen",
      "amtsgericht": "Amtsgericht Frankfurt am Main",
      "registernummer": "HRB 137449",
      "registerart": "HRB",
      "company_name": "Dr. Anat, Josef und Filip Blodinger Objekt: Bremen GmbH",
      "company_seat": "Frankfurt am Main",
      "details": "29.01.2025 (Bekanntmachungsdatum)\n\nHessen Amtsgericht Frankfurt am Main HRB 137449\nRegisterbekanntmachung nach dem Umwandlungsgesetz 29.01.2025 (Eintragungsdatum)\n\nDr. Anat, Josef und Filip Blodinger Objekt: Bremen GmbH\nGesellschaft mit beschränkter Haftung\nFrankfurt am Main\n\nDen Gläubigern der an der formwechselnden Umwandlung beteiligten Rechtsträger ist, wenn sie binnen sechs Monaten nach dem Tag, an dem die Eintragung der formwechselnden Umwandlung in das Register des Sitzes desjenigen Rechtsträgers, dessen Gläubiger sie sind, nach § 201 UmwG bekannt gemacht worden ist, ihren Anspruch nach Grund und Höhe schriftlich anmelden, Sicherheit zu leisten, soweit sie nicht Befriedigung verlangen können. Dieses Recht steht den Gläubigern jedoch nur zu, wenn sie glaubhaft machen, dass durch die formwechselnden Umwandlung die Erfüllung ihrer Forderung gefährdet wird."
    },
    {
      "date": "2025-01-29",
      "id": "99961",
      "original_text": "Sonstige Registerbekanntmachung\nHessen Amtsgericht Eschwege VR 657\nMC Pendragon – Meißner-Vockerode",
      "type": "Sonstige Registerbekanntmachung",
      "state": "Hessen",
      "amtsgericht": "Amtsgericht Eschwege",
      "registernummer": "VR 657",
      "registerart": "VR",
      "company_name": "MC Pendragon",
      "company_seat": "Meißner-Vockerode",
      "details": "29.01.2025 (Bekanntmachungsdatum)\n\nHessen Amtsgericht Eschwege VR 657\nSonstige Registerbekanntmachung 29.01.2025 (Eintragungsdatum)\n\nMC Pendragon\neingetragener Verein\nMeißner-Vockerode\n\nDer Verein ist aufgelöst."
    },
    {
      "date": "2025-01-29",
      "id": "99962",
      "original_text": "Registerbekanntmachung nach dem Umwandlungsgesetz\nHessen Amtsgericht Wetzlar HRB 7364\nKB Toolzz West GmbH – Haiger",
      "type": "Registerbekanntmachung nach dem Umwandlungsgesetz",
      "state": "Hessen",
      "amtsgericht": "Amtsgericht Wetzlar",
      "registernummer": "HRB 7364",
      "registerart": "HRB",
      "company_name": "KB Toolzz West GmbH",
      "company_seat": "Haiger",
      "details": "29.01.2025 (Bekanntmachungsdatum)\n\nHessen Amtsgericht Wetzlar HRB 7364\nRegisterbekanntmachung nach dem Umwandlungsgesetz 29.01.2025 (Eintragungsdatum)\n\nKB Toolzz West GmbH\nGesellschaft mit beschränkter Haftung\nHaiger\n\nDen Gläubigern der an der Verschmelzung beteiligten Rechtsträger ist, wenn sie binnen sechs Monaten nach dem Tag, an dem die Eintragung der Verschmelzung in das Register des Sitzes desjenigen Rechtsträgers, dessen Gläubiger sie sind, nach § 19 Absatz 3 UmwG bekannt gemacht worden ist, ihren Anspruch nach Grund und Höhe schriftlich anmelden, Sicherheit zu leisten, soweit sie nicht Befriedigung verlangen können. Dieses Recht steht den Gläubigern jedoch nur zu, wenn sie glaubhaft machen, dass durch die Verschmelzung die Erfüllung ihrer Forderung gefährdet wird."
    },
    {
      "date": "2025-01-29",
      "id": "99963",
      "original_text": "Registerbekanntmachung nach dem Umwandlungsgesetz\nHessen Amtsgericht Darmstadt HRB 95001\nMd Binco GmbH – Darmstadt",
      "type": "Registerbekanntmachung nach dem Umwandlungsgesetz",
      "state": "Hessen",
      "amtsgericht": "Amtsgericht Darmstadt",
      "registernummer": "HRB 95001",
      "registerart": "HRB",
      "company_name": "Md Binco GmbH",
      "company_seat": "Darmstadt",
      "details": "29.01.2025 (Bekanntmachungsdatum)\n\nHessen Amtsgericht Darmstadt HRB 95001\nRegisterbekanntmachung nach dem Umwandlungsgesetz 29.01.2025 (Eintragungsdatum)\n\nMd Binco GmbH\nGesellschaft mit beschränkter Haftung\nDarmstadt\n\nDen Gläubigern der an der formwechselnden Umwandlung beteiligten Rechtsträger ist, wenn sie binnen sechs Monaten nach dem Tag, an dem die Eintragung der formwechselnden Umwandlung in das Register des Sitzes desjenigen Rechtsträgers, dessen Gläubiger sie sind, nach § 201 UmwG bekannt gemacht worden ist, ihren Anspruch nach Grund und Höhe schriftlich anmelden, Sicherheit zu leisten, soweit sie nicht Befriedigung verlangen können. Dieses Recht steht den Gläubigern jedoch nur zu, wenn sie glaubhaft machen, dass durch die formwechselnden Umwandlung die Erfüllung ihrer Forderung gefährdet wird."
    },
    {
      "date": "2025-01-29",
      "id": "99964",
      "original_text": "Registerbekanntmachung nach dem Umwandlungsgesetz\nHessen Amtsgericht Wetzlar HRB 7360\nKB Toolzz Austria GmbH – Haiger",
      "type": "Registerbekanntmachung nach dem Umwandlungsgesetz",
      "state": "Hessen",
      "amtsgericht": "Amtsgericht Wetzlar",
      "registernummer": "HRB 7360",
      "registerart": "HRB",
      "company_name": "KB Toolzz Austria GmbH",
      "company_seat": "Haiger",
      "details": "29.01.2025 (Bekanntmachungsdatum)\n\nHessen Amtsgericht Wetzlar HRB 7360\nRegisterbekanntmachung nach dem Umwandlungsgesetz 29.01.2025 (Eintragungsdatum)\n\nKB Toolzz Austria GmbH\nGesellschaft mit beschränkter Haftung\nHaiger\n\nDen Gläubigern der an der Verschmelzung beteiligten Rechtsträger ist, wenn sie binnen sechs Monaten nach dem Tag, an dem die Eintragung der Verschmelzung in das Register des Sitzes desjenigen Rechtsträgers, dessen Gläubiger sie sind, nach § 19 Absatz 3 UmwG bekannt gemacht worden ist, ihren Anspruch nach Grund und Höhe schriftlich anmelden, Sicherheit zu leisten, soweit sie nicht Befriedigung verlangen können. Dieses Recht steht den Gläubigern jedoch nur zu, wenn sie glaubhaft machen, dass durch die Verschmelzung die Erfüllung ihrer Forderung gefährdet wird."
    },
    {
      "date": "2025-01-29",
      "id": "99965",
      "original_text": "Registerbekanntmachung nach dem Umwandlungsgesetz\nHessen Amtsgericht Wetzlar HRB 7363\nKB Toolzz Ost GmbH – Haiger",
      "type": "Registerbekanntmachung nach dem Umwandlungsgesetz",
      "state": "Hessen",
      "amtsgericht": "Amtsgericht Wetzlar",
      "registernummer": "HRB 7363",
      "registerart": "HRB",
      "company_name": "KB Toolzz Ost GmbH",
      "company_seat": "Haiger",
      "details": "29.01.2025 (Bekanntmachungsdatum)\n\nHessen Amtsgericht Wetzlar HRB 7363\nRegisterbekanntmachung nach dem Umwandlungsgesetz 29.01.2025 (Eintragungsdatum)\n\nKB Toolzz Ost GmbH\nGesellschaft mit beschränkter Haftung\nHaiger\n\nDen Gläubigern der an der Verschmelzung beteiligten Rechtsträger ist, wenn sie binnen sechs Monaten nach dem Tag, an dem die Eintragung der Verschmelzung in das Register des Sitzes desjenigen Rechtsträgers, dessen Gläubiger sie sind, nach § 19 Absatz 3 UmwG bekannt gemacht worden ist, ihren Anspruch nach Grund und Höhe schriftlich anmelden, Sicherheit zu leisten, soweit sie nicht Befriedigung verlangen können. Dieses Recht steht den Gläubigern jedoch nur zu, wenn sie glaubhaft machen, dass durch die Verschmelzung die Erfüllung ihrer Forderung gefährdet wird."
    }
  ]
}