{
  "date": "2025-01-01",
  "date_of_scrape": "2025-01-02T04:02:11.096Z",
  "tool_version": "0.2.0",
  "number_of_announcements": 2,
  "announcements": [
    {
      "date": "2025-01-01",
      "id": "97584",
      "original_text": "Registerbekanntmachung nach dem Umwandlungsgesetz\nBayern Amtsgericht Bamberg HRA 13274\nChristel Verpachtungs-GmbH & Co. KG – Hirschaid",
      "type": "Registerbekanntmachung nach dem Umwandlungsgesetz",
      "state": "Bayern",
      "amtsgericht": "Amtsgericht Bamberg",
      "registernummer": "HRA 13274",
      "registerart": "HRA",
      "company_name": "Christel Verpachtungs-GmbH & Co. KG",
      "company_seat": "Hirschaid",
      "details": "01.01.2025 (Bekanntmachungsdatum)\n\nBayern Amtsgericht Bamberg HRA 13274\nRegisterbekanntmachung nach dem Umwandlungsgesetz 31.12.2024 (Eintragungsdatum)\n\nChristel Verpachtungs-GmbH & Co. KG\nKommanditgesellschaft\nHirschaid\n\nDen Gläubigern der an der Ausgliederung beteiligten Rechtsträger ist, wenn sie binnen sechs Monaten nach dem Tag, an dem die Eintragung der Ausgliederung in das Register des Sitzes desjenigen Rechtsträgers, dessen Gläubiger sie sind, nach §§ 125, 19 Abs. 3 UmwG als bekannt gemacht gilt, ihren Anspruch nach Grund und Höhe schriftlich anmelden, Sicherheit zu leisten, soweit sie nicht Befriedigung verlangen können. Dieses Recht steht den Gläubigern jedoch nur zu, wenn sie glaubhaft machen, dass durch die Ausgliederung die Erfüllung ihrer Forderung gefährdet wird."
    },
    {
      "date": "2025-01-01",
      "id": "97585",
      "original_text": "Registerbekanntmachung nach dem Umwandlungsgesetz\nBayern Amtsgericht Bamberg HRA 13262\nRoland Christel Besitzunternehmen e.K. – Hirschaid",
      "type": "Registerbekanntmachung nach dem Umwandlungsgesetz",
      "state": "Bayern",
      "amtsgericht": "Amtsgericht Bamberg",
      "registernummer": "HRA 13262",
      "registerart": "HRA",
      "company_name": "Roland Christel Besitzunternehmen e.K.",
      "company_seat": "Hirschaid",
      "details": "01.01.2025 (Bekanntmachungsdatum)\n\nBayern Amtsgericht Bamberg HRA 13262\nRegisterbekanntmachung nach dem Umwandlungsgesetz 31.12.2024 (Eintragungsdatum)\n\nRoland Christel Besitzunternehmen e.K.\nEinzelkaufmann / Einzelkauffrau\nHirschaid\n\nDen Gläubigern der an der Ausgliederung beteiligten Rechtsträger ist, wenn sie binnen sechs Monaten nach dem Tag, an dem die Eintragung der Ausgliederung in das Register des Sitzes desjenigen Rechtsträgers, dessen Gläubiger sie sind, nach §§ 125, 19 Abs. 3 UmwG als bekannt gemacht gilt, ihren Anspruch nach Grund und Höhe schriftlich anmelden, Sicherheit zu leisten, soweit sie nicht Befriedigung verlangen können. Dieses Recht steht den Gläubigern jedoch nur zu, wenn sie glaubhaft machen, dass durch die Ausgliederung die Erfüllung ihrer Forderung gefährdet wird."
    }
  ]
}