{
  "date": "2025-01-23",
  "date_of_scrape": "2025-01-24T04:07:53.726Z",
  "tool_version": "0.2.0",
  "number_of_announcements": 142,
  "announcements": [
    {
      "date": "2025-01-23",
      "id": "99319",
      "original_text": "Löschungsankündigung\nBayern Amtsgericht Coburg HRB 2237\nArsoy - Handels GmbH – Lichtenfels",
      "type": "Löschungsankündigung",
      "state": "Bayern",
      "amtsgericht": "Amtsgericht Coburg",
      "registernummer": "HRB 2237",
      "registerart": "HRB",
      "company_name": "Arsoy - Handels GmbH",
      "company_seat": "Lichtenfels",
      "details": "23.01.2025 (Bekanntmachungsdatum)\n\nBayern Amtsgericht Coburg HRB 2237\nLöschungsankündigung 22.01.2025 (Eintragungsdatum)\n\nArsoy - Handels GmbH\nGesellschaft mit beschränkter Haftung\nLichtenfels\n\nDas Registergericht beabsichtigt, die im Handelsregister eingetragene Gesellschaft wegen Vermögenslosigkeit von Amts wegen nach § 394 FamFG zu löschen. Die Frist zur Erhebung eines Widerspruchs ist auf sechs Wochen festgesetzt."
    },
    {
      "date": "2025-01-23",
      "id": "99320",
      "original_text": "Registerbekanntmachung nach dem Umwandlungsgesetz\nBayern Amtsgericht München HRA 120265\nSaid Ben Bouzid e.K. – München",
      "type": "Registerbekanntmachung nach dem Umwandlungsgesetz",
      "state": "Bayern",
      "amtsgericht": "Amtsgericht München",
      "registernummer": "HRA 120265",
      "registerart": "HRA",
      "company_name": "Said Ben Bouzid e.K.",
      "company_seat": "München",
      "details": "23.01.2025 (Bekanntmachungsdatum)\n\nBayern Amtsgericht München HRA 120265\nRegisterbekanntmachung nach dem Umwandlungsgesetz 22.01.2025 (Eintragungsdatum)\n\nSaid Ben Bouzid e.K.\nEinzelkaufmann / Einzelkauffrau\nMünchen\n\nDen Gläubigern der an der Ausgliederung beteiligten Rechtsträger ist, wenn sie binnen sechs Monaten nach dem Tag, an dem die Eintragung der Ausgliederung in das Register des Sitzes desjenigen Rechtsträgers, dessen Gläubiger sie sind, nach §§ 125, 19 Abs. 3 UmwG als bekannt gemacht gilt, ihren Anspruch nach Grund und Höhe in Textform anmelden, Sicherheit zu leisten, soweit sie nicht Befriedigung verlangen können. Dieses Recht steht den Gläubigern jedoch nur zu, wenn sie glaubhaft machen, dass durch die Ausgliederung die Erfüllung ihrer Forderung gefährdet wird."
    },
    {
      "date": "2025-01-23",
      "id": "99321",
      "original_text": "Einreichung neuer Dokumente\nBayern Amtsgericht Bayreuth HRB 2758\nBTB Bayreuther Thermalbad GmbH – Bayreuth",
      "type": "Einreichung neuer Dokumente",
      "state": "Bayern",
      "amtsgericht": "Amtsgericht Bayreuth",
      "registernummer": "HRB 2758",
      "registerart": "HRB",
      "company_name": "BTB Bayreuther Thermalbad GmbH",
      "company_seat": "Bayreuth",
      "details": "23.01.2025 (Bekanntmachungsdatum)\n\nBayern Amtsgericht Bayreuth HRB 2758\nEinreichung neuer Dokumente\n\nBTB Bayreuther Thermalbad GmbH\nGesellschaft mit beschränkter Haftung\nBayreuth\n\nDem Amtsgericht Bayreuth -Registergericht- ist eine Liste der Mitglieder des Aufsichtsrats eingereicht worden, § 52 Abs. 3 S. 2 GmbHG."
    },
    {
      "date": "2025-01-23",
      "id": "99322",
      "original_text": "Löschungsankündigung\nBayern Amtsgericht Memmingen HRB 18974\nTestra Bau UG (haftungsbeschränkt) – Bad Wörishofen",
      "type": "Löschungsankündigung",
      "state": "Bayern",
      "amtsgericht": "Amtsgericht Memmingen",
      "registernummer": "HRB 18974",
      "registerart": "HRB",
      "company_name": "Testra Bau UG (haftungsbeschränkt)",
      "company_seat": "Bad Wörishofen",
      "details": "23.01.2025 (Bekanntmachungsdatum)\n\nBayern Amtsgericht Memmingen HRB 18974\nLöschungsankündigung\n\nTestra Bau UG (haftungsbeschränkt)\nGesellschaft mit beschränkter Haftung\nBad Wörishofen\n\nDas Registergericht beabsichtigt, die im Handelsregister eingetragene Gesellschaft wegen Vermögenslosigkeit von Amts wegen nach § 394 FamFG zu löschen. Die Frist zur Erhebung eines Widerspruchs ist auf einen Monat festgesetzt."
    },
    {
      "date": "2025-01-23",
      "id": "99323",
      "original_text": "Sonstige Registerbekanntmachung\nBayern Amtsgericht Nürnberg HRB 14188\nBrochier Gebäudetechnik GmbH – Nürnberg",
      "type": "Sonstige Registerbekanntmachung",
      "state": "Bayern",
      "amtsgericht": "Amtsgericht Nürnberg",
      "registernummer": "HRB 14188",
      "registerart": "HRB",
      "company_name": "Brochier Gebäudetechnik GmbH",
      "company_seat": "Nürnberg",
      "details": "23.01.2025 (Bekanntmachungsdatum)\n\nBayern Amtsgericht Nürnberg HRB 14188\nSonstige Registerbekanntmachung 22.01.2025 (Eintragungsdatum)\n\nBrochier Gebäudetechnik GmbH\nGesellschaft mit beschränkter Haftung\nNürnberg\n\nDen Gläubigern der Gesellschaft, deren Forderungen begründet worden sind, bevor die Eintragung der Beendigung des Gewinnabführungsvertrages in das Handelsregister nach § 10 des Handelsgesetzbuches als bekanntgemacht gilt, hat der andere Vertragsteil Sicherheit zu leisten, wenn sie sich binnen sechs Monaten nach der Bekanntmachung der Eintragung zu diesem Zweck bei ihm melden."
    },
    {
      "date": "2025-01-23",
      "id": "99324",
      "original_text": "Sonstige Registerbekanntmachung\nBayern Amtsgericht Aschaffenburg HRB 14820\nDPD Service GmbH – Aschaffenburg",
      "type": "Sonstige Registerbekanntmachung",
      "state": "Bayern",
      "amtsgericht": "Amtsgericht Aschaffenburg",
      "registernummer": "HRB 14820",
      "registerart": "HRB",
      "company_name": "DPD Service GmbH",
      "company_seat": "Aschaffenburg",
      "details": "23.01.2025 (Bekanntmachungsdatum)\n\nBayern Amtsgericht Aschaffenburg HRB 14820\nSonstige Registerbekanntmachung 22.01.2025 (Eintragungsdatum)\n\nDPD Service GmbH\nGesellschaft mit beschränkter Haftung\nAschaffenburg\n\nDen Gläubigern der Gesellschaft, deren Forderungen begründet worden sind, bevor die Eintragung der Beendigung des Gewinnabführungsvertrages in das Handelsregister nach § 10 des Handelsgesetzbuches als bekanntgemacht gilt, hat der andere Vertragsteil Sicherheit zu leisten, wenn sie sich binnen sechs Monaten nach der Bekanntmachung der Eintragung zu diesem Zweck bei ihm melden."
    },
    {
      "date": "2025-01-23",
      "id": "99325",
      "original_text": "Einreichung neuer Dokumente\nBayern Amtsgericht Landshut HRB 6359\nRenovas AG – Landshut",
      "type": "Einreichung neuer Dokumente",
      "state": "Bayern",
      "amtsgericht": "Amtsgericht Landshut",
      "registernummer": "HRB 6359",
      "registerart": "HRB",
      "company_name": "Renovas AG",
      "company_seat": "Landshut",
      "details": "23.01.2025 (Bekanntmachungsdatum)\n\nBayern Amtsgericht Landshut HRB 6359\nEinreichung neuer Dokumente\n\nRenovas AG\nAktiengesellschaft\nLandshut\n\nDem Amtsgericht Landshut -Registergericht- ist eine Liste der Mitglieder des Aufsichtsrats eingereicht worden, § 106 AktG."
    },
    {
      "date": "2025-01-23",
      "id": "99326",
      "original_text": "Löschungsankündigung\nBayern Amtsgericht München HRB 215056\nUhrwerk GmbH – München",
      "type": "Löschungsankündigung",
      "state": "Bayern",
      "amtsgericht": "Amtsgericht München",
      "registernummer": "HRB 215056",
      "registerart": "HRB",
      "company_name": "Uhrwerk GmbH",
      "company_seat": "München",
      "details": "23.01.2025 (Bekanntmachungsdatum)\n\nBayern Amtsgericht München HRB 215056\nLöschungsankündigung 22.01.2025 (Eintragungsdatum)\n\nUhrwerk GmbH\nGesellschaft mit beschränkter Haftung\nMünchen\n\nDas Registergericht beabsichtigt, die im Handelsregister eingetragene Gesellschaft wegen Vermögenslosigkeit von Amts wegen nach § 394 FamFG zu löschen. Die Frist zur Erhebung eines Widerspruchs ist auf drei Monate festgesetzt."
    },
    {
      "date": "2025-01-23",
      "id": "99327",
      "original_text": "Einreichung neuer Dokumente\nBayern Amtsgericht Bayreuth HRB 2611\nStadtwerke Bayreuth Verkehr und Bäder GmbH – Bayreuth",
      "type": "Einreichung neuer Dokumente",
      "state": "Bayern",
      "amtsgericht": "Amtsgericht Bayreuth",
      "registernummer": "HRB 2611",
      "registerart": "HRB",
      "company_name": "Stadtwerke Bayreuth Verkehr und Bäder GmbH",
      "company_seat": "Bayreuth",
      "details": "23.01.2025 (Bekanntmachungsdatum)\n\nBayern Amtsgericht Bayreuth HRB 2611\nEinreichung neuer Dokumente\n\nStadtwerke Bayreuth Verkehr und Bäder GmbH\nGesellschaft mit beschränkter Haftung\nBayreuth\n\nDem Amtsgericht Bayreuth -Registergericht- ist eine Liste der Mitglieder des Aufsichtsrats eingereicht worden, § 52 Abs. 3 S. 2 GmbHG."
    },
    {
      "date": "2025-01-23",
      "id": "99328",
      "original_text": "Einreichung neuer Dokumente\nBayern Amtsgericht Bayreuth HRB 2610\nStadtwerke Bayreuth Energie und Wasser GmbH – Bayreuth",
      "type": "Einreichung neuer Dokumente",
      "state": "Bayern",
      "amtsgericht": "Amtsgericht Bayreuth",
      "registernummer": "HRB 2610",
      "registerart": "HRB",
      "company_name": "Stadtwerke Bayreuth Energie und Wasser GmbH",
      "company_seat": "Bayreuth",
      "details": "23.01.2025 (Bekanntmachungsdatum)\n\nBayern Amtsgericht Bayreuth HRB 2610\nEinreichung neuer Dokumente\n\nStadtwerke Bayreuth Energie und Wasser GmbH\nGesellschaft mit beschränkter Haftung\nBayreuth\n\nDem Amtsgericht Bayreuth -Registergericht- ist eine Liste der Mitglieder des Aufsichtsrats eingereicht worden, § 52 Abs. 3 S. 2 GmbHG."
    },
    {
      "date": "2025-01-23",
      "id": "99329",
      "original_text": "Registerbekanntmachung nach dem Umwandlungsgesetz\nBayern Amtsgericht Traunstein HRB 13256\nISC Innovative Systems Consulting Aktiengesellschaft – Kolbermoor",
      "type": "Registerbekanntmachung nach dem Umwandlungsgesetz",
      "state": "Bayern",
      "amtsgericht": "Amtsgericht Traunstein",
      "registernummer": "HRB 13256",
      "registerart": "HRB",
      "company_name": "ISC Innovative Systems Consulting Aktiengesellschaft",
      "company_seat": "Kolbermoor",
      "details": "23.01.2025 (Bekanntmachungsdatum)\n\nBayern Amtsgericht Traunstein HRB 13256\nRegisterbekanntmachung nach dem Umwandlungsgesetz 22.01.2025 (Eintragungsdatum)\n\nISC Innovative Systems Consulting Aktiengesellschaft\nAktiengesellschaft\nKolbermoor\n\nDen Gläubigern des formwechselnden Rechtsträgers ist, wenn sie binnen sechs Monaten nach dem Tag, an dem die Eintragung des Formwechsels nach § 201 UmwG als bekannt gemacht gilt, ihren Anspruch nach Grund und Höhe in Textform anmelden, Sicherheit zu leisten, soweit sie nicht Befriedigung verlangen können. Dieses Recht steht den Gläubigern jedoch nur zu, wenn sie glaubhaft machen, dass durch den Formwechsel die Erfüllung ihrer Forderung gefährdet wird."
    },
    {
      "date": "2025-01-23",
      "id": "99330",
      "original_text": "Einreichung neuer Dokumente\nBayern Amtsgericht Augsburg HRB 22709\nKUKA Aktiengesellschaft – Augsburg",
      "type": "Einreichung neuer Dokumente",
      "state": "Bayern",
      "amtsgericht": "Amtsgericht Augsburg",
      "registernummer": "HRB 22709",
      "registerart": "HRB",
      "company_name": "KUKA Aktiengesellschaft",
      "company_seat": "Augsburg",
      "details": "23.01.2025 (Bekanntmachungsdatum)\n\nBayern Amtsgericht Augsburg HRB 22709\nEinreichung neuer Dokumente 22.01.2025 (Eintragungsdatum)\n\nKUKA Aktiengesellschaft\nAktiengesellschaft\nAugsburg\n\nDem Registergericht Augsburg ist eine Liste der Mitglieder des Aufsichtsrats eingereicht worden, § 106 AktG."
    },
    {
      "date": "2025-01-23",
      "id": "99331",
      "original_text": "Registerbekanntmachung nach dem Umwandlungsgesetz\nBayern Amtsgericht Memmingen HRB 10189\nLandsperger GmbH – Breitenbrunn",
      "type": "Registerbekanntmachung nach dem Umwandlungsgesetz",
      "state": "Bayern",
      "amtsgericht": "Amtsgericht Memmingen",
      "registernummer": "HRB 10189",
      "registerart": "HRB",
      "company_name": "Landsperger GmbH",
      "company_seat": "Breitenbrunn",
      "details": "23.01.2025 (Bekanntmachungsdatum)\n\nBayern Amtsgericht Memmingen HRB 10189\nRegisterbekanntmachung nach dem Umwandlungsgesetz 22.01.2025 (Eintragungsdatum)\n\nLandsperger GmbH\nGesellschaft mit beschränkter Haftung\nBreitenbrunn\n\nDen Gläubigern des formwechselnden Rechtsträgers ist, wenn sie binnen sechs Monaten nach dem Tag, an dem die Eintragung des Formwechsels nach § 201 UmwG als bekannt gemacht gilt, ihren Anspruch nach Grund und Höhe in Textform anmelden, Sicherheit zu leisten, soweit sie nicht Befriedigung verlangen können. Dieses Recht steht den Gläubigern jedoch nur zu, wenn sie glaubhaft machen, dass durch den Formwechsel die Erfüllung ihrer Forderung gefährdet wird."
    },
    {
      "date": "2025-01-23",
      "id": "99332",
      "original_text": "Sonstige Registerbekanntmachung\nBayern Amtsgericht Bayreuth HRB 2818\nStadtwerke Bayreuth Holding GmbH – Bayreuth",
      "type": "Sonstige Registerbekanntmachung",
      "state": "Bayern",
      "amtsgericht": "Amtsgericht Bayreuth",
      "registernummer": "HRB 2818",
      "registerart": "HRB",
      "company_name": "Stadtwerke Bayreuth Holding GmbH",
      "company_seat": "Bayreuth",
      "details": "23.01.2025 (Bekanntmachungsdatum)\n\nBayern Amtsgericht Bayreuth HRB 2818\nSonstige Registerbekanntmachung\n\nStadtwerke Bayreuth Holding GmbH\nGesellschaft mit beschränkter Haftung\nBayreuth\n\nDem Amtsgericht Bayreuth -Registergericht- ist eine Liste der Mitglieder des Aufsichtsrats eingereicht worden, § 52 Abs. 3 S. 2 GmbHG."
    },
    {
      "date": "2025-01-23",
      "id": "99333",
      "original_text": "Einreichung neuer Dokumente\nBayern Amtsgericht Bayreuth HRB 2818\nStadtwerke Bayreuth Holding GmbH – Bayreuth",
      "type": "Einreichung neuer Dokumente",
      "state": "Bayern",
      "amtsgericht": "Amtsgericht Bayreuth",
      "registernummer": "HRB 2818",
      "registerart": "HRB",
      "company_name": "Stadtwerke Bayreuth Holding GmbH",
      "company_seat": "Bayreuth",
      "details": "23.01.2025 (Bekanntmachungsdatum)\n\nBayern Amtsgericht Bayreuth HRB 2818\nEinreichung neuer Dokumente\n\nStadtwerke Bayreuth Holding GmbH\nGesellschaft mit beschränkter Haftung\nBayreuth\n\nDem Amtsgericht Bayreuth -Registergericht- ist eine Liste der Mitglieder des Aufsichtsrats eingereicht worden, § 52 Abs. 3 S. 2 GmbHG."
    },
    {
      "date": "2025-01-23",
      "id": "99334",
      "original_text": "Registerbekanntmachung nach dem Umwandlungsgesetz\nBayern Amtsgericht Würzburg HRA 7423\nPORTIKUS Verwaltungsgesellschaft mbH & Co. Vermietungs KG – Marktbreit",
      "type": "Registerbekanntmachung nach dem Umwandlungsgesetz",
      "state": "Bayern",
      "amtsgericht": "Amtsgericht Würzburg",
      "registernummer": "HRA 7423",
      "registerart": "HRA",
      "company_name": "PORTIKUS Verwaltungsgesellschaft mbH & Co. Vermietungs KG",
      "company_seat": "Marktbreit",
      "details": "23.01.2025 (Bekanntmachungsdatum)\n\nBayern Amtsgericht Würzburg HRA 7423\nRegisterbekanntmachung nach dem Umwandlungsgesetz 22.01.2025 (Eintragungsdatum)\n\nPORTIKUS Verwaltungsgesellschaft mbH & Co. Vermietungs KG\nKommanditgesellschaft\nMarktbreit\n\nDen Gläubigern des formwechselnden Rechtsträgers ist, wenn sie binnen sechs Monaten nach dem Tag, an dem die Eintragung des Formwechsels nach § 201 UmwG als bekannt gemacht gilt, ihren Anspruch nach Grund und Höhe in Textform anmelden, Sicherheit zu leisten, soweit sie nicht Befriedigung verlangen können. Dieses Recht steht den Gläubigern jedoch nur zu, wenn sie glaubhaft machen, dass durch den Formwechsel die Erfüllung ihrer Forderung gefährdet wird."
    },
    {
      "date": "2025-01-23",
      "id": "99335",
      "original_text": "Löschungsankündigung\nBayern Amtsgericht Traunstein HRB 21204\nHK Haftung & Verwaltung GmbH – Freilassing",
      "type": "Löschungsankündigung",
      "state": "Bayern",
      "amtsgericht": "Amtsgericht Traunstein",
      "registernummer": "HRB 21204",
      "registerart": "HRB",
      "company_name": "HK Haftung & Verwaltung GmbH",
      "company_seat": "Freilassing",
      "details": "23.01.2025 (Bekanntmachungsdatum)\n\nBayern Amtsgericht Traunstein HRB 21204\nLöschungsankündigung\n\nHK Haftung & Verwaltung GmbH\nGesellschaft mit beschränkter Haftung\nFreilassing\n\nDas Registergericht beabsichtigt, die im Handelsregister eingetragene Gesellschaft wegen Vermögenslosigkeit von Amts wegen nach § 394 FamFG zu löschen. Die Frist zur Erhebung eines Widerspruchs ist auf sechs Wochen festgesetzt."
    },
    {
      "date": "2025-01-23",
      "id": "99336",
      "original_text": "Registerbekanntmachung nach dem Umwandlungsgesetz\nBayern Amtsgericht Nürnberg HRB 20344\ncargo support GmbH – Nürnberg",
      "type": "Registerbekanntmachung nach dem Umwandlungsgesetz",
      "state": "Bayern",
      "amtsgericht": "Amtsgericht Nürnberg",
      "registernummer": "HRB 20344",
      "registerart": "HRB",
      "company_name": "cargo support GmbH",
      "company_seat": "Nürnberg",
      "details": "23.01.2025 (Bekanntmachungsdatum)\n\nBayern Amtsgericht Nürnberg HRB 20344\nRegisterbekanntmachung nach dem Umwandlungsgesetz 22.01.2025 (Eintragungsdatum)\n\ncargo support GmbH\nGesellschaft mit beschränkter Haftung\nNürnberg\n\nDen Gläubigern der an der Verschmelzung beteiligten Rechtsträger ist, wenn sie binnen sechs Monaten nach dem Tag, an dem die Eintragung der Verschmelzung in das Register des Sitzes desjenigen Rechtsträgers, dessen Gläubiger sie sind, nach § 19 Abs. 3 UmwG als bekannt gemacht gilt, ihren Anspruch nach Grund und Höhe in Textform anmelden, Sicherheit zu leisten, soweit sie nicht Befriedigung verlangen können. Dieses Recht steht den Gläubigern jedoch nur zu, wenn sie glaubhaft machen, dass durch die Verschmelzung die Erfüllung ihrer Forderung gefährdet wird."
    },
    {
      "date": "2025-01-23",
      "id": "99337",
      "original_text": "Löschungsankündigung\nBayern Amtsgericht München HRB 247679\nFABEOS Service On Demand UG (haftungsbeschränkt) – München",
      "type": "Löschungsankündigung",
      "state": "Bayern",
      "amtsgericht": "Amtsgericht München",
      "registernummer": "HRB 247679",
      "registerart": "HRB",
      "company_name": "FABEOS Service On Demand UG (haftungsbeschränkt)",
      "company_seat": "München",
      "details": "23.01.2025 (Bekanntmachungsdatum)\n\nBayern Amtsgericht München HRB 247679\nLöschungsankündigung 22.01.2025 (Eintragungsdatum)\n\nFABEOS Service On Demand UG (haftungsbeschränkt)\nGesellschaft mit beschränkter Haftung\nMünchen\n\nDas Registergericht beabsichtigt, die im Handelsregister eingetragene Gesellschaft wegen Vermögenslosigkeit von Amts wegen nach § 394 FamFG zu löschen. Die Frist zur Erhebung eines Widerspruchs ist auf drei Monate festgesetzt."
    },
    {
      "date": "2025-01-23",
      "id": "99338",
      "original_text": "Löschungsankündigung\nBayern Amtsgericht Traunstein HRB 8993\nWohnkultur Logistik GmbH – Kiefersfelden",
      "type": "Löschungsankündigung",
      "state": "Bayern",
      "amtsgericht": "Amtsgericht Traunstein",
      "registernummer": "HRB 8993",
      "registerart": "HRB",
      "company_name": "Wohnkultur Logistik GmbH",
      "company_seat": "Kiefersfelden",
      "details": "23.01.2025 (Bekanntmachungsdatum)\n\nBayern Amtsgericht Traunstein HRB 8993\nLöschungsankündigung\n\nWohnkultur Logistik GmbH\nGesellschaft mit beschränkter Haftung\nKiefersfelden\n\nDas Registergericht beabsichtigt, die im Handelsregister eingetragene Gesellschaft wegen Vermögenslosigkeit von Amts wegen nach § 394 FamFG zu löschen. Die Frist zur Erhebung eines Widerspruchs ist auf sechs Wochen festgesetzt."
    },
    {
      "date": "2025-01-23",
      "id": "99339",
      "original_text": "Sonstige Registerbekanntmachung\nBayern Amtsgericht Memmingen HRB 21454\nRegionalwerk Unterallgäu GmbH – Mindelheim",
      "type": "Sonstige Registerbekanntmachung",
      "state": "Bayern",
      "amtsgericht": "Amtsgericht Memmingen",
      "registernummer": "HRB 21454",
      "registerart": "HRB",
      "company_name": "Regionalwerk Unterallgäu GmbH",
      "company_seat": "Mindelheim",
      "details": "23.01.2025 (Bekanntmachungsdatum)\n\nBayern Amtsgericht Memmingen HRB 21454\nSonstige Registerbekanntmachung 22.01.2025 (Eintragungsdatum)\n\nRegionalwerk Unterallgäu GmbH\nGesellschaft mit beschränkter Haftung\nMindelheim\n\nDem Amtsgericht Memmingen -Registergericht- ist eine Liste der Mitglieder des Aufsichtsrats eingereicht worden, § 52 Abs. 3 S. 2 GmbHG."
    },
    {
      "date": "2025-01-23",
      "id": "99340",
      "original_text": "Löschungsankündigung\nBayern Amtsgericht München HRB 249456\nLithium Werks Germany GmbH – München",
      "type": "Löschungsankündigung",
      "state": "Bayern",
      "amtsgericht": "Amtsgericht München",
      "registernummer": "HRB 249456",
      "registerart": "HRB",
      "company_name": "Lithium Werks Germany GmbH",
      "company_seat": "München",
      "details": "23.01.2025 (Bekanntmachungsdatum)\n\nBayern Amtsgericht München HRB 249456\nLöschungsankündigung 22.01.2025 (Eintragungsdatum)\n\nLithium Werks Germany GmbH\nGesellschaft mit beschränkter Haftung\nMünchen\n\nDas Registergericht beabsichtigt, die im Handelsregister eingetragene Gesellschaft wegen Vermögenslosigkeit von Amts wegen nach § 394 FamFG zu löschen. Die Frist zur Erhebung eines Widerspruchs ist auf drei Monate festgesetzt."
    },
    {
      "date": "2025-01-23",
      "id": "99341",
      "original_text": "Registerbekanntmachung nach dem Umwandlungsgesetz\nBerlin Amtsgericht Berlin (Charlottenburg) GsR 2739\nEEI Eco-Environment Innovation - Reinhard Hüttl & Uwe Schneider eGbR – Berlin",
      "type": "Registerbekanntmachung nach dem Umwandlungsgesetz",
      "state": "Berlin",
      "amtsgericht": "Amtsgericht Berlin (Charlottenburg)",
      "registernummer": "GsR 2739",
      "registerart": "GsR",
      "company_name": "EEI Eco-Environment Innovation - Reinhard Hüttl & Uwe Schneider eGbR",
      "company_seat": "Berlin",
      "details": "23.01.2025 (Bekanntmachungsdatum)\n\nBerlin Amtsgericht Berlin (Charlottenburg) GsR 2739\nRegisterbekanntmachung nach dem Umwandlungsgesetz 22.01.2025 (Eintragungsdatum)\n\nEEI Eco-Environment Innovation - Reinhard Hüttl & Uwe Schneider eGbR\nGesellschaft bürgerlichen Rechts\nBerlin\n\nDen Gläubigern ist, wenn sie binnen sechs Monaten nach dem Tag, an dem die Eintragung der Umwandlung als bekannt gemacht gilt, ihren Anspruch nach Grund und Höhe schriftlich anmelden, Sicherheit zu leisten, soweit sie nicht Befriedigung verlangen können. Dieses Recht steht den Gläubigern jedoch nur zu, wenn sie glaubhaft machen, dass durch die Umwandlung die Erfüllung ihrer Forderung gefährdet wird. Das Recht, Sicherheitsleistung zu verlangen, steht Gläubigern nicht zu, die im Falle der Insolvenz ein Recht auf vorzugsweise Befriedigung aus einer Deckungsmasse haben, die nach gesetzlicher Vorschrift zu ihrem Schutz errichtet und staatlich überwacht ist."
    },
    {
      "date": "2025-01-23",
      "id": "99342",
      "original_text": "Löschungsankündigung\nSchleswig-Holstein Amtsgericht Kiel HRB 24539\nQURES Verwaltung GmbH – Kronshagen",
      "type": "Löschungsankündigung",
      "state": "Schleswig-Holstein",
      "amtsgericht": "Amtsgericht Kiel",
      "registernummer": "HRB 24539",
      "registerart": "HRB",
      "company_name": "QURES Verwaltung GmbH",
      "company_seat": "Kronshagen",
      "details": "23.01.2025 (Bekanntmachungsdatum)\n\nSchleswig-Holstein Amtsgericht Kiel HRB 24539\nLöschungsankündigung\n\nQURES Verwaltung GmbH\nGesellschaft mit beschränkter Haftung\nKronshagen\n\nEs ist die Löschung der nachstehenden Gesellschaft wegen Vermögenslosigkeit gemäß § 394 FamFG beabsichtigt. Widerspruchsfrist: 1 Monate."
    },
    {
      "date": "2025-01-23",
      "id": "99343",
      "original_text": "Löschungsankündigung\nBerlin Amtsgericht Berlin (Charlottenburg) HRB 228422\ncyan transport GmbH – Berlin",
      "type": "Löschungsankündigung",
      "state": "Berlin",
      "amtsgericht": "Amtsgericht Berlin (Charlottenburg)",
      "registernummer": "HRB 228422",
      "registerart": "HRB",
      "company_name": "cyan transport GmbH",
      "company_seat": "Berlin",
      "details": "23.01.2025 (Bekanntmachungsdatum)\n\nBerlin Amtsgericht Berlin (Charlottenburg) HRB 228422\nLöschungsankündigung\n\ncyan transport GmbH\nGesellschaft mit beschränkter Haftung\nBerlin\n\nBei der nachstehenden Gesellschaft wird das Amtslöschungsverfahren gemäß § 394 FamFG eingeleitet. Widerspruchsfrist 6 Wochen"
    },
    {
      "date": "2025-01-23",
      "id": "99344",
      "original_text": "Sonstige Registerbekanntmachung\nBaden-Württemberg Amtsgericht Ulm HRB 501474\nStadtwerke Oberkochen GmbH – Oberkochen",
      "type": "Sonstige Registerbekanntmachung",
      "state": "Baden-Württemberg",
      "amtsgericht": "Amtsgericht Ulm",
      "registernummer": "HRB 501474",
      "registerart": "HRB",
      "company_name": "Stadtwerke Oberkochen GmbH",
      "company_seat": "Oberkochen",
      "details": "23.01.2025 (Bekanntmachungsdatum)\n\nBaden-Württemberg Amtsgericht Ulm HRB 501474\nSonstige Registerbekanntmachung\n\nStadtwerke Oberkochen GmbH\nGesellschaft mit beschränkter Haftung\nOberkochen\n\nDie Gesellschaft hat am 20.01.2025 die Liste über die Zusammensetzung des Aufsichtsrats zum Handelsregister eingereicht."
    },
    {
      "date": "2025-01-23",
      "id": "99345",
      "original_text": "Einreichung neuer Dokumente\nMecklenburg-Vorpommern Amtsgericht Stralsund HRB 2746 früher Amtsgericht Rostock\nStadtwerke Ribnitz-Damgarten GmbH – Ribnitz-Damgarten",
      "type": "Einreichung neuer Dokumente",
      "state": "Mecklenburg-Vorpommern",
      "amtsgericht": "Amtsgericht Stralsund",
      "registernummer": "HRB 2746",
      "registerart": "HRB",
      "company_name": "Stadtwerke Ribnitz-Damgarten GmbH",
      "company_seat": "Ribnitz-Damgarten",
      "former_amtsgericht": "Rostock",
      "details": "23.01.2025 (Bekanntmachungsdatum)\n\nMecklenburg-Vorpommern Amtsgericht Stralsund HRB 2746 früher Amtsgericht Rostock\nEinreichung neuer Dokumente\n\nStadtwerke Ribnitz-Damgarten GmbH\nGesellschaft mit beschränkter Haftung\nRibnitz-Damgarten"
    },
    {
      "date": "2025-01-23",
      "id": "99346",
      "original_text": "Löschungsankündigung\nBerlin Amtsgericht Berlin (Charlottenburg) HRB 213294\nSHNOBS GmbH – Berlin",
      "type": "Löschungsankündigung",
      "state": "Berlin",
      "amtsgericht": "Amtsgericht Berlin (Charlottenburg)",
      "registernummer": "HRB 213294",
      "registerart": "HRB",
      "company_name": "SHNOBS GmbH",
      "company_seat": "Berlin",
      "details": "23.01.2025 (Bekanntmachungsdatum)\n\nBerlin Amtsgericht Berlin (Charlottenburg) HRB 213294\nLöschungsankündigung\n\nSHNOBS GmbH\nGesellschaft mit beschränkter Haftung\nBerlin\n\nBei der nachstehenden Gesellschaft wird das Amtslöschungsverfahren gemäß § 394 FamFG eingeleitet. Widerspruchsfrist 6 Wochen"
    },
    {
      "date": "2025-01-23",
      "id": "99347",
      "original_text": "Einreichung neuer Dokumente\nBerlin Amtsgericht Berlin (Charlottenburg) HRB 90762\nFeuersozietät Berlin Brandenburg Versicherung Aktiengesellschaft – Berlin",
      "type": "Einreichung neuer Dokumente",
      "state": "Berlin",
      "amtsgericht": "Amtsgericht Berlin (Charlottenburg)",
      "registernummer": "HRB 90762",
      "registerart": "HRB",
      "company_name": "Feuersozietät Berlin Brandenburg Versicherung Aktiengesellschaft",
      "company_seat": "Berlin",
      "details": "23.01.2025 (Bekanntmachungsdatum)\n\nBerlin Amtsgericht Berlin (Charlottenburg) HRB 90762\nEinreichung neuer Dokumente\n\nFeuersozietät Berlin Brandenburg Versicherung Aktiengesellschaft\nAktiengesellschaft\nBerlin\n\nAls nicht eingetragen wird veröffentlicht:"
    },
    {
      "date": "2025-01-23",
      "id": "99348",
      "original_text": "Registerbekanntmachung nach dem Umwandlungsgesetz\nBaden-Württemberg Amtsgericht Stuttgart HRB 798078\nMüller Bindesysteme GmbH – Grafenberg",
      "type": "Registerbekanntmachung nach dem Umwandlungsgesetz",
      "state": "Baden-Württemberg",
      "amtsgericht": "Amtsgericht Stuttgart",
      "registernummer": "HRB 798078",
      "registerart": "HRB",
      "company_name": "Müller Bindesysteme GmbH",
      "company_seat": "Grafenberg",
      "details": "23.01.2025 (Bekanntmachungsdatum)\n\nBaden-Württemberg Amtsgericht Stuttgart HRB 798078\nRegisterbekanntmachung nach dem Umwandlungsgesetz 23.01.2025 (Eintragungsdatum)\n\nMüller Bindesysteme GmbH\nGesellschaft mit beschränkter Haftung\nGrafenberg\n\nAls nicht eingetragen wird bekanntgemacht:\nDen Gläubigern der an der Ausgliederung beteiligten Rechtsträger ist, wenn sie binnen sechs Monaten nach dem Tag, an dem die Eintragung der Ausgliederung in das Register des Sitzes desjenigen Rechtsträgers, dessen Gläubiger sie sind, nach § 19 Abs. 3 UmwG als bekanntgemacht gilt, ihren Anspruch nach Grund und Höhe schriftlich anmelden, Sicherheit zu leisten, soweit sie nicht Befriedigung verlangen können. Dieses Recht steht den Gläubigern jedoch nur zu, wenn sie glaubhaft machen, dass durch die Ausgliederung die Erfüllung ihrer Forderung gefährdet wird."
    },
    {
      "date": "2025-01-23",
      "id": "99349",
      "original_text": "Einreichung neuer Dokumente\nBaden-Württemberg Amtsgericht Mannheim HRB 750203\nBystronic Holding Deutschland AG – Heimsheim",
      "type": "Einreichung neuer Dokumente",
      "state": "Baden-Württemberg",
      "amtsgericht": "Amtsgericht Mannheim",
      "registernummer": "HRB 750203",
      "registerart": "HRB",
      "company_name": "Bystronic Holding Deutschland AG",
      "company_seat": "Heimsheim",
      "details": "23.01.2025 (Bekanntmachungsdatum)\n\nBaden-Württemberg Amtsgericht Mannheim HRB 750203\nEinreichung neuer Dokumente 23.01.2025 (Eintragungsdatum)\n\nBystronic Holding Deutschland AG\nAktiengesellschaft\nHeimsheim\n\nDie Gesellschaft hat am 19.01.2025 die Liste über die Zusammensetzung des Aufsichtsrats zum Handelsregister eingereicht."
    },
    {
      "date": "2025-01-23",
      "id": "99350",
      "original_text": "Registerbekanntmachung nach dem Umwandlungsgesetz\nBerlin Amtsgericht Berlin (Charlottenburg) HRB 164475\nEEI Eco-Environment Innovation GmbH – Berlin",
      "type": "Registerbekanntmachung nach dem Umwandlungsgesetz",
      "state": "Berlin",
      "amtsgericht": "Amtsgericht Berlin (Charlottenburg)",
      "registernummer": "HRB 164475",
      "registerart": "HRB",
      "company_name": "EEI Eco-Environment Innovation GmbH",
      "company_seat": "Berlin",
      "details": "23.01.2025 (Bekanntmachungsdatum)\n\nBerlin Amtsgericht Berlin (Charlottenburg) HRB 164475\nRegisterbekanntmachung nach dem Umwandlungsgesetz 22.01.2025 (Eintragungsdatum)\n\nEEI Eco-Environment Innovation GmbH\nGesellschaft mit beschränkter Haftung\nBerlin\n\nZu Eintragungsnummer 13 vom 22.01.2025 wird als nicht eingetragen veröffentlicht: Den Gläubigern ist, wenn sie binnen sechs Monaten nach dem Tag, an dem die Eintragung der Umwandlung als bekannt gemacht gilt, ihren Anspruch nach Grund und Höhe schriftlich anmelden, Sicherheit zu leisten, soweit sie nicht Befriedigung verlangen können. Dieses Recht steht den Gläubigern jedoch nur zu, wenn sie glaubhaft machen, dass durch die Umwandlung die Erfüllung ihrer Forderung gefährdet wird. Das Recht, Sicherheitsleistung zu verlangen, steht Gläubigern nicht zu, die im Falle der Insolvenz ein Recht auf vorzugsweise Befriedigung aus einer Deckungsmasse haben, die nach gesetzlicher Vorschrift zu ihrem Schutz errichtet und staatlich überwacht ist."
    },
    {
      "date": "2025-01-23",
      "id": "99351",
      "original_text": "Löschungsankündigung\nBerlin Amtsgericht Berlin (Charlottenburg) HRB 239184\nWeiser Weg GmbH – Berlin",
      "type": "Löschungsankündigung",
      "state": "Berlin",
      "amtsgericht": "Amtsgericht Berlin (Charlottenburg)",
      "registernummer": "HRB 239184",
      "registerart": "HRB",
      "company_name": "Weiser Weg GmbH",
      "company_seat": "Berlin",
      "details": "23.01.2025 (Bekanntmachungsdatum)\n\nBerlin Amtsgericht Berlin (Charlottenburg) HRB 239184\nLöschungsankündigung\n\nWeiser Weg GmbH\nGesellschaft mit beschränkter Haftung\nBerlin\n\nBei der nachstehenden Gesellschaft wird das Amtslöschungsverfahren gemäß § 394 FamFG eingeleitet. Widerspruchsfrist 6 Wochen"
    },
    {
      "date": "2025-01-23",
      "id": "99352",
      "original_text": "Sonstige Registerbekanntmachung\nBaden-Württemberg Amtsgericht Mannheim HRB 701751\nManfred Sauer GmbH – Lobbach",
      "type": "Sonstige Registerbekanntmachung",
      "state": "Baden-Württemberg",
      "amtsgericht": "Amtsgericht Mannheim",
      "registernummer": "HRB 701751",
      "registerart": "HRB",
      "company_name": "Manfred Sauer GmbH",
      "company_seat": "Lobbach",
      "details": "23.01.2025 (Bekanntmachungsdatum)\n\nBaden-Württemberg Amtsgericht Mannheim HRB 701751\nSonstige Registerbekanntmachung 23.01.2025 (Eintragungsdatum)\n\nManfred Sauer GmbH\nGesellschaft mit beschränkter Haftung\nLobbach\n\nAls nicht eingetragen wird bekanntgemacht:\nDen Gläubigern der Gesellschaft, deren Forderungen begründet worden sind, bevor die Eintragung der Beendigung des Vertrages in das Handelsregister nach § 10 HGB als bekanntgemacht gilt, ist vom anderen Vertragsteil Sicherheit zu leisten, wenn sie sich binnen sechs Monaten nach der Bekanntmachung zu diesem Zweck bei ihm melden."
    },
    {
      "date": "2025-01-23",
      "id": "99353",
      "original_text": "Löschungsankündigung\nSaarland Amtsgericht Saarbrücken HRB 104855\nJR Baubetreuung UG (haftungsbeschränkt) – Ottweiler",
      "type": "Löschungsankündigung",
      "state": "Saarland",
      "amtsgericht": "Amtsgericht Saarbrücken",
      "registernummer": "HRB 104855",
      "registerart": "HRB",
      "company_name": "JR Baubetreuung UG (haftungsbeschränkt)",
      "company_seat": "Ottweiler",
      "details": "23.01.2025 (Bekanntmachungsdatum)\n\nSaarland Amtsgericht Saarbrücken HRB 104855\nLöschungsankündigung\n\nJR Baubetreuung UG (haftungsbeschränkt)\nGesellschaft mit beschränkter Haftung\nOttweiler\n\nEs ist beabsichtigt, die Gesellschaft von Amts wegen gemäß § 394 FamFG wegen Vermögenslosigkeit zu löschen. Gegen die Löschung von Amts wegen ist das Rechtsmittel des Widerspruchs statthaft. Der Widerspruch ist binnen einer Frist von 2 Monaten beginnend mit dem Tag dieser Veröffentlichung durch Einreichen eines Widerspruchsschreibens -schriftlich oder zur Niederschrift der Geschäftsstelle- beim Amtsgericht Saarbrücken, -zentrales Handelsregister-, Mainzerstr.178, 66121 Saarbrücken einzulegen. Der Widerspruch muss die Bezeichnung der angefochtenen Löschungsankündigung enthalten sowie die Erklärung, dass Widerspruch eingelegt wird. Er ist vom Widerspruchsführer oder seinem Bevollmächtigten zu unterzeichnen."
    },
    {
      "date": "2025-01-23",
      "id": "99354",
      "original_text": "Einreichung neuer Dokumente\nBerlin Amtsgericht Berlin (Charlottenburg) HRB 147973\nFunanga AG – Berlin",
      "type": "Einreichung neuer Dokumente",
      "state": "Berlin",
      "amtsgericht": "Amtsgericht Berlin (Charlottenburg)",
      "registernummer": "HRB 147973",
      "registerart": "HRB",
      "company_name": "Funanga AG",
      "company_seat": "Berlin",
      "details": "23.01.2025 (Bekanntmachungsdatum)\n\nBerlin Amtsgericht Berlin (Charlottenburg) HRB 147973\nEinreichung neuer Dokumente\n\nFunanga AG\nAktiengesellschaft\nBerlin\n\nAls nicht eingetragen wird veröffentlicht: Es wurde eine neue Liste der Aufsichtsratsmitglieder eingereicht (§ 106 AktG)."
    },
    {
      "date": "2025-01-23",
      "id": "99355",
      "original_text": "Sonstige Registerbekanntmachung\nBaden-Württemberg Amtsgericht Stuttgart HRB 302340\nBESSEY Präzisionsstahl GmbH – Bietigheim-Bissingen",
      "type": "Sonstige Registerbekanntmachung",
      "state": "Baden-Württemberg",
      "amtsgericht": "Amtsgericht Stuttgart",
      "registernummer": "HRB 302340",
      "registerart": "HRB",
      "company_name": "BESSEY Präzisionsstahl GmbH",
      "company_seat": "Bietigheim-Bissingen",
      "details": "23.01.2025 (Bekanntmachungsdatum)\n\nBaden-Württemberg Amtsgericht Stuttgart HRB 302340\nSonstige Registerbekanntmachung 23.01.2025 (Eintragungsdatum)\n\nBESSEY Präzisionsstahl GmbH\nGesellschaft mit beschränkter Haftung\nBietigheim-Bissingen\n\nAls nicht eingetragen wird bekanntgemacht: Den Gläubigern der Gesellschaft, deren Forderungen begründet worden sind, bevor die Eintragung der Beendigung des Vertrages in das Handelsregister nach § 10 HGB als bekanntgemacht gilt, ist vom anderen Vertragsteil Sicherheit zu leisten, wenn sie sich binnen sechs Monaten nach der Bekanntmachung zu diesem Zweck bei ihm melden."
    },
    {
      "date": "2025-01-23",
      "id": "99356",
      "original_text": "Einreichung neuer Dokumente\nThüringen Amtsgericht Jena HRB 302008\nWohnungsbaugesellschaft mbH Meiningen – Meiningen",
      "type": "Einreichung neuer Dokumente",
      "state": "Thüringen",
      "amtsgericht": "Amtsgericht Jena",
      "registernummer": "HRB 302008",
      "registerart": "HRB",
      "company_name": "Wohnungsbaugesellschaft mbH Meiningen",
      "company_seat": "Meiningen",
      "details": "23.01.2025 (Bekanntmachungsdatum)\n\nThüringen Amtsgericht Jena HRB 302008\nEinreichung neuer Dokumente\n\nWohnungsbaugesellschaft mbH Meiningen\nGesellschaft mit beschränkter Haftung\nMeiningen\n\nBekanntmachung gem. § 52 Abs. 3 Satz 2 GmbHG: Aufgrund einer Veränderung in den Personen der Aufsichtsratsmitglieder ist durch die Geschäftsführer eine neue Liste zum Handelsregister eingereicht worden."
    },
    {
      "date": "2025-01-23",
      "id": "99357",
      "original_text": "Einreichung neuer Dokumente\nThüringen Amtsgericht Jena HRB 512858\nWindkraft Tüngeda 07 Verwaltungs- GmbH – Hörselberg-Hainich",
      "type": "Einreichung neuer Dokumente",
      "state": "Thüringen",
      "amtsgericht": "Amtsgericht Jena",
      "registernummer": "HRB 512858",
      "registerart": "HRB",
      "company_name": "Windkraft Tüngeda 07 Verwaltungs- GmbH",
      "company_seat": "Hörselberg-Hainich",
      "details": "23.01.2025 (Bekanntmachungsdatum)\n\nThüringen Amtsgericht Jena HRB 512858\nEinreichung neuer Dokumente\n\nWindkraft Tüngeda 07 Verwaltungs- GmbH\nGesellschaft mit beschränkter Haftung\nHörselberg-Hainich\n\nBekanntmachung gem. § 52 Abs. 3 Satz 2 GmbHG: Aufgrund einer Veränderung in den Personen der Aufsichtsratsmitglieder ist durch die Geschäftsführer eine neue Liste zum Handelsregister eingereicht worden."
    },
    {
      "date": "2025-01-23",
      "id": "99358",
      "original_text": "Löschungsankündigung\nThüringen Amtsgericht Jena HRB 513029\nA. Sander Mineralöl GmbH – Roßleben-Wiehe",
      "type": "Löschungsankündigung",
      "state": "Thüringen",
      "amtsgericht": "Amtsgericht Jena",
      "registernummer": "HRB 513029",
      "registerart": "HRB",
      "company_name": "A. Sander Mineralöl GmbH",
      "company_seat": "Roßleben-Wiehe",
      "details": "23.01.2025 (Bekanntmachungsdatum)\n\nThüringen Amtsgericht Jena HRB 513029\nLöschungsankündigung\n\nA. Sander Mineralöl GmbH\nGesellschaft mit beschränkter Haftung\nRoßleben-Wiehe\n\nDas Registergericht beabsichtigt, die im Handelsregister eingetragene Gesellschaft wegen Vermögenslosigkeit nach § 394 FamFG von Amts wegen zu löschen. Die Frist zur Erhebung eines Widerspruchs gegen die beabsichtigte Löschung wird auf 6 Wochen festgesetzt."
    },
    {
      "date": "2025-01-23",
      "id": "99359",
      "original_text": "Registerbekanntmachung nach dem Umwandlungsgesetz\nBerlin Amtsgericht Berlin (Charlottenburg) HRB 212202\nOdysseus Data Services GmbH – Berlin",
      "type": "Registerbekanntmachung nach dem Umwandlungsgesetz",
      "state": "Berlin",
      "amtsgericht": "Amtsgericht Berlin (Charlottenburg)",
      "registernummer": "HRB 212202",
      "registerart": "HRB",
      "company_name": "Odysseus Data Services GmbH",
      "company_seat": "Berlin",
      "details": "23.01.2025 (Bekanntmachungsdatum)\n\nBerlin Amtsgericht Berlin (Charlottenburg) HRB 212202\nRegisterbekanntmachung nach dem Umwandlungsgesetz 22.01.2025 (Eintragungsdatum)\n\nOdysseus Data Services GmbH\nGesellschaft mit beschränkter Haftung\nBerlin\n\nZu Eintragungsnummer 7 vom 22.01.2025 wird als nicht eingetragen veröffentlicht:Den Gläubigern der an der Verschmelzung beteiligten Rechtsträger ist, wenn sie binnen sechs Monaten nach dem Tag, an dem die Eintragung der Verschmelzung in das Register des Sitzes desjenigen Rechtsträgers, dessen Gläubiger sie sind, als bekannt gemacht gilt, ihren Anspruch nach Grund und Höhe schriftlich anmelden, Sicherheit zu leisten, soweit sie nicht Befriedigung verlangen können. Dieses Recht steht den Gläubigern jedoch nur zu, wenn sie glaubhaft machen, dass durch die Verschmelzung die Erfüllung ihrer Forderung gefährdet wird. Das Recht, Sicherheitsleistung zu verlangen, steht Gläubigern nicht zu, die im Falle der Insolvenz ein Recht auf vorzugsweise Befriedigung aus einer Deckungsmasse haben, die nach gesetzlicher Vorschrift zu ihrem Schutz errichtet und staatlich überwacht ist."
    },
    {
      "date": "2025-01-23",
      "id": "99360",
      "original_text": "Löschungsankündigung\nBerlin Amtsgericht Berlin (Charlottenburg) HRB 243441\nGopharm Logistics GmbH – Berlin",
      "type": "Löschungsankündigung",
      "state": "Berlin",
      "amtsgericht": "Amtsgericht Berlin (Charlottenburg)",
      "registernummer": "HRB 243441",
      "registerart": "HRB",
      "company_name": "Gopharm Logistics GmbH",
      "company_seat": "Berlin",
      "details": "23.01.2025 (Bekanntmachungsdatum)\n\nBerlin Amtsgericht Berlin (Charlottenburg) HRB 243441\nLöschungsankündigung\n\nGopharm Logistics GmbH\nGesellschaft mit beschränkter Haftung\nBerlin\n\nBei der nachstehenden Gesellschaft wird das Amtslöschungsverfahren gemäß § 394 FamFG eingeleitet. Widerspruchsfrist 6 Wochen"
    },
    {
      "date": "2025-01-23",
      "id": "99361",
      "original_text": "Löschungsankündigung\nBerlin Amtsgericht Berlin (Charlottenburg) HRB 209274\nBS Verputz GmbH – Berlin",
      "type": "Löschungsankündigung",
      "state": "Berlin",
      "amtsgericht": "Amtsgericht Berlin (Charlottenburg)",
      "registernummer": "HRB 209274",
      "registerart": "HRB",
      "company_name": "BS Verputz GmbH",
      "company_seat": "Berlin",
      "details": "23.01.2025 (Bekanntmachungsdatum)\n\nBerlin Amtsgericht Berlin (Charlottenburg) HRB 209274\nLöschungsankündigung\n\nBS Verputz GmbH\nGesellschaft mit beschränkter Haftung\nBerlin\n\nBei der nachstehenden Gesellschaft wird das Amtslöschungsverfahren gemäß § 394 FamFG eingeleitet. Widerspruchsfrist\n6 Wochen."
    },
    {
      "date": "2025-01-23",
      "id": "99362",
      "original_text": "Löschungsankündigung\nBerlin Amtsgericht Berlin (Charlottenburg) HRB 236243\nKOTTI Clean Gebäudemanagement UG (haftungsbeschränkt) – Berlin",
      "type": "Löschungsankündigung",
      "state": "Berlin",
      "amtsgericht": "Amtsgericht Berlin (Charlottenburg)",
      "registernummer": "HRB 236243",
      "registerart": "HRB",
      "company_name": "KOTTI Clean Gebäudemanagement UG (haftungsbeschränkt)",
      "company_seat": "Berlin",
      "details": "23.01.2025 (Bekanntmachungsdatum)\n\nBerlin Amtsgericht Berlin (Charlottenburg) HRB 236243\nLöschungsankündigung\n\nKOTTI Clean Gebäudemanagement UG (haftungsbeschränkt)\nGesellschaft mit beschränkter Haftung\nBerlin\n\nBei der nachstehenden Gesellschaft wird das Amtslöschungsverfahren gemäß § 394 FamFG eingeleitet. Widerspruchsfrist 6 Wochen"
    },
    {
      "date": "2025-01-23",
      "id": "99363",
      "original_text": "Registerbekanntmachung nach dem Umwandlungsgesetz\nHamburg Amtsgericht Hamburg HRB 166317\nVerwaltungsgesellschaft Spirit of New Delhi mbH – Hamburg",
      "type": "Registerbekanntmachung nach dem Umwandlungsgesetz",
      "state": "Hamburg",
      "amtsgericht": "Amtsgericht Hamburg",
      "registernummer": "HRB 166317",
      "registerart": "HRB",
      "company_name": "Verwaltungsgesellschaft Spirit of New Delhi mbH",
      "company_seat": "Hamburg",
      "details": "23.01.2025 (Bekanntmachungsdatum)\n\nHamburg Amtsgericht Hamburg HRB 166317\nRegisterbekanntmachung nach dem Umwandlungsgesetz 23.01.2025 (Eintragungsdatum)\n\nVerwaltungsgesellschaft Spirit of New Delhi mbH\nGesellschaft mit beschränkter Haftung\nHamburg\n\nAls nicht eingetragen wird bekannt gemacht:\nDen Gläubigern der an der Verschmelzung beteiligten Gesellschaften ist, wenn sie binnen sechs Monaten nach dem Tag, an dem die Eintragung der Verschmelzung in das Register des Sitzes desjenigen Rechtsträgers, dessen Gläubiger sie sind, nach § 19 Absatz 3 UmwG als bekannt gemacht gilt, ihren Anspruch nach Grund und Höhe schriftlich anmelden, Sicherheit zu leisten, soweit sie nicht Befriedigung verlangen können. Dieses Recht steht den Gläubigern jedoch nur zu, wenn sie glaubhaft machen, dass durch die Verschmelzung die Erfüllung ihrer Forderung gefährdet wird."
    },
    {
      "date": "2025-01-23",
      "id": "99364",
      "original_text": "Registerbekanntmachung nach dem Umwandlungsgesetz\nHamburg Amtsgericht Hamburg HRB 141892\nBeyond Horizon GmbH – Hamburg",
      "type": "Registerbekanntmachung nach dem Umwandlungsgesetz",
      "state": "Hamburg",
      "amtsgericht": "Amtsgericht Hamburg",
      "registernummer": "HRB 141892",
      "registerart": "HRB",
      "company_name": "Beyond Horizon GmbH",
      "company_seat": "Hamburg",
      "details": "23.01.2025 (Bekanntmachungsdatum)\n\nHamburg Amtsgericht Hamburg HRB 141892\nRegisterbekanntmachung nach dem Umwandlungsgesetz 23.01.2025 (Eintragungsdatum)\n\nBeyond Horizon GmbH\nGesellschaft mit beschränkter Haftung\nHamburg\n\nAls nicht eingetragen wird bekannt gemacht:\nDen Gläubigern der an der Verschmelzung beteiligten Gesellschaften ist, wenn sie binnen sechs Monaten nach dem Tag, an dem die Eintragung der Verschmelzung in das Register des Sitzes desjenigen Rechtsträgers, dessen Gläubiger sie sind, nach § 19 Absatz 3 UmwG als bekannt gemacht gilt, ihren Anspruch nach Grund und Höhe schriftlich anmelden, Sicherheit zu leisten, soweit sie nicht Befriedigung verlangen können. Dieses Recht steht den Gläubigern jedoch nur zu, wenn sie glaubhaft machen, dass durch die Verschmelzung die Erfüllung ihrer Forderung gefährdet wird."
    },
    {
      "date": "2025-01-23",
      "id": "99365",
      "original_text": "Registerbekanntmachung nach dem Umwandlungsgesetz\nBaden-Württemberg Amtsgericht Stuttgart HRB 782154\nMACH Smart Solutions GmbH – Stuttgart",
      "type": "Registerbekanntmachung nach dem Umwandlungsgesetz",
      "state": "Baden-Württemberg",
      "amtsgericht": "Amtsgericht Stuttgart",
      "registernummer": "HRB 782154",
      "registerart": "HRB",
      "company_name": "MACH Smart Solutions GmbH",
      "company_seat": "Stuttgart",
      "details": "23.01.2025 (Bekanntmachungsdatum)\n\nBaden-Württemberg Amtsgericht Stuttgart HRB 782154\nRegisterbekanntmachung nach dem Umwandlungsgesetz 23.01.2025 (Eintragungsdatum)\n\nMACH Smart Solutions GmbH\nGesellschaft mit beschränkter Haftung\nStuttgart\n\nAls nicht eingetragen wird bekanntgemacht:\nDen Gläubigern der an der Verschmelzung beteiligten Rechtsträger ist, wenn sie binnen sechs Monaten nach dem Tag, an dem die Eintragung der Verschmelzung in das Register des Sitzes desjenigen Rechtsträgers, dessen Gläubiger sie sind, nach § 19 Abs. 3 UmwG als bekanntgemacht gilt, ihren Anspruch nach Grund und Höhe schriftlich anmelden, Sicherheit zu leisten, soweit sie nicht Befriedigung verlangen können. Dieses Recht steht den Gläubigern jedoch nur zu, wenn sie glaubhaft machen, dass durch die Verschmelzung die Erfüllung ihrer Forderung gefährdet wird."
    },
    {
      "date": "2025-01-23",
      "id": "99366",
      "original_text": "Löschungsankündigung\nBerlin Amtsgericht Berlin (Charlottenburg) HRB 187304\nSanssouci Gebäudeservice & Vertrieb GmbH – Berlin",
      "type": "Löschungsankündigung",
      "state": "Berlin",
      "amtsgericht": "Amtsgericht Berlin (Charlottenburg)",
      "registernummer": "HRB 187304",
      "registerart": "HRB",
      "company_name": "Sanssouci Gebäudeservice & Vertrieb GmbH",
      "company_seat": "Berlin",
      "details": "23.01.2025 (Bekanntmachungsdatum)\n\nBerlin Amtsgericht Berlin (Charlottenburg) HRB 187304\nLöschungsankündigung\n\nSanssouci Gebäudeservice & Vertrieb GmbH\nGesellschaft mit beschränkter Haftung\nBerlin\n\nBei der nachstehenden Gesellschaft wird das Amtslöschungsverfahren gemäß § 394 FamFG eingeleitet. Widerspruchsfrist 6 Wochen"
    },
    {
      "date": "2025-01-23",
      "id": "99367",
      "original_text": "Registerbekanntmachung nach dem Umwandlungsgesetz\nHamburg Amtsgericht Hamburg HRB 155246\nVerwaltungsgesellschaft Spirit of Lisbon mbH – Hamburg",
      "type": "Registerbekanntmachung nach dem Umwandlungsgesetz",
      "state": "Hamburg",
      "amtsgericht": "Amtsgericht Hamburg",
      "registernummer": "HRB 155246",
      "registerart": "HRB",
      "company_name": "Verwaltungsgesellschaft Spirit of Lisbon mbH",
      "company_seat": "Hamburg",
      "details": "23.01.2025 (Bekanntmachungsdatum)\n\nHamburg Amtsgericht Hamburg HRB 155246\nRegisterbekanntmachung nach dem Umwandlungsgesetz 23.01.2025 (Eintragungsdatum)\n\nVerwaltungsgesellschaft Spirit of Lisbon mbH\nGesellschaft mit beschränkter Haftung\nHamburg\n\nAls nicht eingetragen wird bekannt gemacht:\nDen Gläubigern der an der Verschmelzung beteiligten Gesellschaften ist, wenn sie binnen sechs Monaten nach dem Tag, an dem die Eintragung der Verschmelzung in das Register des Sitzes desjenigen Rechtsträgers, dessen Gläubiger sie sind, nach § 19 Absatz 3 UmwG als bekannt gemacht gilt, ihren Anspruch nach Grund und Höhe schriftlich anmelden, Sicherheit zu leisten, soweit sie nicht Befriedigung verlangen können. Dieses Recht steht den Gläubigern jedoch nur zu, wenn sie glaubhaft machen, dass durch die Verschmelzung die Erfüllung ihrer Forderung gefährdet wird."
    },
    {
      "date": "2025-01-23",
      "id": "99368",
      "original_text": "Registerbekanntmachung nach dem Umwandlungsgesetz\nHamburg Amtsgericht Hamburg HRB 141892\nBeyond Horizon GmbH – Hamburg",
      "type": "Registerbekanntmachung nach dem Umwandlungsgesetz",
      "state": "Hamburg",
      "amtsgericht": "Amtsgericht Hamburg",
      "registernummer": "HRB 141892",
      "registerart": "HRB",
      "company_name": "Beyond Horizon GmbH",
      "company_seat": "Hamburg",
      "details": "23.01.2025 (Bekanntmachungsdatum)\n\nHamburg Amtsgericht Hamburg HRB 141892\nRegisterbekanntmachung nach dem Umwandlungsgesetz 23.01.2025 (Eintragungsdatum)\n\nBeyond Horizon GmbH\nGesellschaft mit beschränkter Haftung\nHamburg\n\nAls nicht eingetragen wird bekannt gemacht:\nDen Gläubigern der an der Verschmelzung beteiligten Gesellschaften ist, wenn sie binnen sechs Monaten nach dem Tag, an dem die Eintragung der Verschmelzung in das Register des Sitzes desjenigen Rechtsträgers, dessen Gläubiger sie sind, nach § 19 Absatz 3 UmwG als bekannt gemacht gilt, ihren Anspruch nach Grund und Höhe schriftlich anmelden, Sicherheit zu leisten, soweit sie nicht Befriedigung verlangen können. Dieses Recht steht den Gläubigern jedoch nur zu, wenn sie glaubhaft machen, dass durch die Verschmelzung die Erfüllung ihrer Forderung gefährdet wird."
    },
    {
      "date": "2025-01-23",
      "id": "99369",
      "original_text": "Registerbekanntmachung nach dem Umwandlungsgesetz\nBerlin Amtsgericht Berlin (Charlottenburg) HRB 146726\nRaisin GmbH – Berlin",
      "type": "Registerbekanntmachung nach dem Umwandlungsgesetz",
      "state": "Berlin",
      "amtsgericht": "Amtsgericht Berlin (Charlottenburg)",
      "registernummer": "HRB 146726",
      "registerart": "HRB",
      "company_name": "Raisin GmbH",
      "company_seat": "Berlin",
      "details": "23.01.2025 (Bekanntmachungsdatum)\n\nBerlin Amtsgericht Berlin (Charlottenburg) HRB 146726\nRegisterbekanntmachung nach dem Umwandlungsgesetz 22.01.2025 (Eintragungsdatum)\n\nRaisin GmbH\nGesellschaft mit beschränkter Haftung\nBerlin\n\nZu Eintragungsnummer 42 vom 22.01.2025 wird als nicht eingetragen veröffentlicht: Den Gläubigern ist, wenn sie binnen sechs Monaten nach dem Tag, an dem die Eintragung der Umwandlung als bekannt gemacht gilt, ihren Anspruch nach Grund und Höhe schriftlich anmelden, Sicherheit zu leisten, soweit sie nicht Befriedigung verlangen können. Dieses Recht steht den Gläubigern jedoch nur zu, wenn sie glaubhaft machen, dass durch die Umwandlung die Erfüllung ihrer Forderung gefährdet wird. Das Recht, Sicherheitsleistung zu verlangen, steht Gläubigern nicht zu, die im Falle der Insolvenz ein Recht auf vorzugsweise Befriedigung aus einer Deckungsmasse haben, die nach gesetzlicher Vorschrift zu ihrem Schutz errichtet und staatlich überwacht ist."
    },
    {
      "date": "2025-01-23",
      "id": "99370",
      "original_text": "Registerbekanntmachung nach dem Umwandlungsgesetz\nBerlin Amtsgericht Berlin (Charlottenburg) HRB 271415\nRaisin AG – Berlin",
      "type": "Registerbekanntmachung nach dem Umwandlungsgesetz",
      "state": "Berlin",
      "amtsgericht": "Amtsgericht Berlin (Charlottenburg)",
      "registernummer": "HRB 271415",
      "registerart": "HRB",
      "company_name": "Raisin AG",
      "company_seat": "Berlin",
      "details": "23.01.2025 (Bekanntmachungsdatum)\n\nBerlin Amtsgericht Berlin (Charlottenburg) HRB 271415\nRegisterbekanntmachung nach dem Umwandlungsgesetz 22.01.2025 (Eintragungsdatum)\n\nRaisin AG\nAktiengesellschaft\nBerlin\n\nZu Eintragungsnummer 1 vom 22.01.2025 wird als nicht eingetragen veröffentlicht: Den Gläubigern ist, wenn sie binnen sechs Monaten nach dem Tag, an dem die Eintragung der Umwandlung als bekannt gemacht gilt, ihren Anspruch nach Grund und Höhe schriftlich anmelden, Sicherheit zu leisten, soweit sie nicht Befriedigung verlangen können. Dieses Recht steht den Gläubigern jedoch nur zu, wenn sie glaubhaft machen, dass durch die Umwandlung die Erfüllung ihrer Forderung gefährdet wird. Das Recht, Sicherheitsleistung zu verlangen, steht Gläubigern nicht zu, die im Falle der Insolvenz ein Recht auf vorzugsweise Befriedigung aus einer Deckungsmasse haben, die nach gesetzlicher Vorschrift zu ihrem Schutz errichtet und staatlich überwacht ist."
    },
    {
      "date": "2025-01-23",
      "id": "99371",
      "original_text": "Löschungsankündigung\nBrandenburg Amtsgericht Frankfurt/Oder HRB 18469\nUAN Bau Service GmbH – Werneuchen",
      "type": "Löschungsankündigung",
      "state": "Brandenburg",
      "amtsgericht": "Amtsgericht Frankfurt/Oder",
      "registernummer": "HRB 18469",
      "registerart": "HRB",
      "company_name": "UAN Bau Service GmbH",
      "company_seat": "Werneuchen",
      "details": "23.01.2025 (Bekanntmachungsdatum)\n\nBrandenburg Amtsgericht Frankfurt/Oder HRB 18469\nLöschungsankündigung\n\nUAN Bau Service GmbH\nGesellschaft mit beschränkter Haftung\nWerneuchen\n\nBei der nachstehenden Gesellschaft wird das Amtslöschungsverfahren gemäß § 394 FamFG eingeleitet."
    },
    {
      "date": "2025-01-23",
      "id": "99372",
      "original_text": "Löschungsankündigung\nBrandenburg Amtsgericht Frankfurt/Oder HRB 16335\nISB Frankfurt (Oder) GmbH – Frankfurt (Oder)",
      "type": "Löschungsankündigung",
      "state": "Brandenburg",
      "amtsgericht": "Amtsgericht Frankfurt/Oder",
      "registernummer": "HRB 16335",
      "registerart": "HRB",
      "company_name": "ISB Frankfurt (Oder) GmbH",
      "company_seat": "Frankfurt (Oder)",
      "details": "23.01.2025 (Bekanntmachungsdatum)\n\nBrandenburg Amtsgericht Frankfurt/Oder HRB 16335\nLöschungsankündigung\n\nISB Frankfurt (Oder) GmbH\nGesellschaft mit beschränkter Haftung\nFrankfurt (Oder)\n\nBei der nachstehenden Gesellschaft wird das Amtslöschungsverfahren gemäß § 394 Abs. 1 FamFG eingeleitet."
    },
    {
      "date": "2025-01-23",
      "id": "99373",
      "original_text": "Löschungsankündigung\nSchleswig-Holstein Amtsgericht Kiel HRB 19313\nHengstdepot Vornholt Unternehmergesellschaft (haftungsbeschränkt) – Hanerau-Hademarschen",
      "type": "Löschungsankündigung",
      "state": "Schleswig-Holstein",
      "amtsgericht": "Amtsgericht Kiel",
      "registernummer": "HRB 19313",
      "registerart": "HRB",
      "company_name": "Hengstdepot Vornholt Unternehmergesellschaft (haftungsbeschränkt)",
      "company_seat": "Hanerau-Hademarschen",
      "details": "23.01.2025 (Bekanntmachungsdatum)\n\nSchleswig-Holstein Amtsgericht Kiel HRB 19313\nLöschungsankündigung\n\nHengstdepot Vornholt Unternehmergesellschaft (haftungsbeschränkt)\nGesellschaft mit beschränkter Haftung\nHanerau-Hademarschen\n\nEs ist die Löschung der nachstehenden Gesellschaft wegen Vermögenslosigkeit gemäß § 394 FamFG beabsichtigt. Widerspruchsfrist: 2 Monate."
    },
    {
      "date": "2025-01-23",
      "id": "99374",
      "original_text": "Einreichung neuer Dokumente\nBrandenburg Amtsgericht Frankfurt/Oder HRB 529\nWohnungs- und Baugesellschaft mbH Bernau – Bernau bei Berlin",
      "type": "Einreichung neuer Dokumente",
      "state": "Brandenburg",
      "amtsgericht": "Amtsgericht Frankfurt/Oder",
      "registernummer": "HRB 529",
      "registerart": "HRB",
      "company_name": "Wohnungs- und Baugesellschaft mbH Bernau",
      "company_seat": "Bernau bei Berlin",
      "details": "23.01.2025 (Bekanntmachungsdatum)\n\nBrandenburg Amtsgericht Frankfurt/Oder HRB 529\nEinreichung neuer Dokumente\n\nWohnungs- und Baugesellschaft mbH Bernau\nGesellschaft mit beschränkter Haftung\nBernau bei Berlin\n\nAls nicht eingetragen wird veröffentlicht: Die Liste der Aufsichtsratsmitglieder vom 07.01.2025 ist zum Handelsregister eingereicht worden."
    },
    {
      "date": "2025-01-23",
      "id": "99375",
      "original_text": "Einreichung neuer Dokumente\nBaden-Württemberg Amtsgericht Stuttgart HRB 757705\nDürr Systems AG – Stuttgart",
      "type": "Einreichung neuer Dokumente",
      "state": "Baden-Württemberg",
      "amtsgericht": "Amtsgericht Stuttgart",
      "registernummer": "HRB 757705",
      "registerart": "HRB",
      "company_name": "Dürr Systems AG",
      "company_seat": "Stuttgart",
      "details": "23.01.2025 (Bekanntmachungsdatum)\n\nBaden-Württemberg Amtsgericht Stuttgart HRB 757705\nEinreichung neuer Dokumente\n\nDürr Systems AG\nAktiengesellschaft\nStuttgart\n\nDie Gesellschaft hat am 16.01.2025 die Liste über die Zusammensetzung des Aufsichtsrats zum Handelsregister eingereicht."
    },
    {
      "date": "2025-01-23",
      "id": "99376",
      "original_text": "Registerbekanntmachung nach dem Umwandlungsgesetz\nNordrhein-Westfalen Amtsgericht Coesfeld VR 4143\nSozialdienst katholischer Frauen e.V. Dülmen-Coesfeld – Dülmen",
      "type": "Registerbekanntmachung nach dem Umwandlungsgesetz",
      "state": "Nordrhein-Westfalen",
      "amtsgericht": "Amtsgericht Coesfeld",
      "registernummer": "VR 4143",
      "registerart": "VR",
      "company_name": "Sozialdienst katholischer Frauen e.V. Dülmen-Coesfeld",
      "company_seat": "Dülmen",
      "details": "23.01.2025 (Bekanntmachungsdatum)\n\nNordrhein-Westfalen Amtsgericht Coesfeld VR 4143\nRegisterbekanntmachung nach dem Umwandlungsgesetz 31.10.2023 (Eintragungsdatum)\n\nSozialdienst katholischer Frauen e.V. Dülmen-Coesfeld\n???Global.Rechtsform.???\nDülmen\n\nDen Gläubigern der an der Verschmelzung beteiligten Rechtsträger ist, wenn sie binnen sechs Monaten nach dem Tag, an dem die Eintragung der Verschmelzung in das Register des Sitzes desjenigen Rechtsträgers, dessen Gläubiger sie sind, nach § 19 Absatz 3 UmwG als bekanntgemacht gilt, ihren Anspruch nach Grund und Höhe schriftlich anmelden, Sicherheit zu leisten, soweit sie nicht Befriedigung verlangen können. Dieses Recht steht den Gläubigern jedoch nur zu, wenn sie glaubhaft machen, dass durch die Verschmelzung die Erfüllung ihrer Forderung gefährdet wird."
    },
    {
      "date": "2025-01-23",
      "id": "99377",
      "original_text": "Einreichung neuer Dokumente\nBaden-Württemberg Amtsgericht Stuttgart HRB 570148\nRex Industrie-Produkte Graf von Rex GmbH – Vellberg",
      "type": "Einreichung neuer Dokumente",
      "state": "Baden-Württemberg",
      "amtsgericht": "Amtsgericht Stuttgart",
      "registernummer": "HRB 570148",
      "registerart": "HRB",
      "company_name": "Rex Industrie-Produkte Graf von Rex GmbH",
      "company_seat": "Vellberg",
      "details": "23.01.2025 (Bekanntmachungsdatum)\n\nBaden-Württemberg Amtsgericht Stuttgart HRB 570148\nEinreichung neuer Dokumente\n\nRex Industrie-Produkte Graf von Rex GmbH\nGesellschaft mit beschränkter Haftung\nVellberg\n\nDie Gesellschaft hat am 22.01.2025 die Liste über die Zusammensetzung des Aufsichtsrats zum Handelsregister eingereicht."
    },
    {
      "date": "2025-01-23",
      "id": "99378",
      "original_text": "Registerbekanntmachung nach dem Umwandlungsgesetz\nBaden-Württemberg Amtsgericht Stuttgart HRA 742028\nIMPP Solutions LTD & Co. KG – Eppingen",
      "type": "Registerbekanntmachung nach dem Umwandlungsgesetz",
      "state": "Baden-Württemberg",
      "amtsgericht": "Amtsgericht Stuttgart",
      "registernummer": "HRA 742028",
      "registerart": "HRA",
      "company_name": "IMPP Solutions LTD & Co. KG",
      "company_seat": "Eppingen",
      "details": "23.01.2025 (Bekanntmachungsdatum)\n\nBaden-Württemberg Amtsgericht Stuttgart HRA 742028\nRegisterbekanntmachung nach dem Umwandlungsgesetz 23.01.2025 (Eintragungsdatum)\n\nIMPP Solutions LTD & Co. KG\nKommanditgesellschaft\nEppingen\n\nAls nicht eingetragen wird bekanntgemacht:\nDen Gläubigern der an der Verschmelzung beteiligten Rechtsträger ist, wenn sie binnen sechs Monaten nach dem Tag, an dem die Eintragung der Verschmelzung in das Register des Sitzes desjenigen Rechtsträgers, dessen Gläubiger sie sind, nach § 19 Abs. 3 UmwG als bekanntgemacht gilt, ihren Anspruch nach Grund und Höhe schriftlich anmelden, Sicherheit zu leisten, soweit sie nicht Befriedigung verlangen können. Dieses Recht steht den Gläubigern jedoch nur zu, wenn sie glaubhaft machen, dass durch die Verschmelzung die Erfüllung ihrer Forderung gefährdet wird."
    },
    {
      "date": "2025-01-23",
      "id": "99379",
      "original_text": "Registerbekanntmachung nach dem Umwandlungsgesetz\nBaden-Württemberg Amtsgericht Ulm HRB 552771\nKiesel Mitte GmbH – Baienfurt",
      "type": "Registerbekanntmachung nach dem Umwandlungsgesetz",
      "state": "Baden-Württemberg",
      "amtsgericht": "Amtsgericht Ulm",
      "registernummer": "HRB 552771",
      "registerart": "HRB",
      "company_name": "Kiesel Mitte GmbH",
      "company_seat": "Baienfurt",
      "details": "23.01.2025 (Bekanntmachungsdatum)\n\nBaden-Württemberg Amtsgericht Ulm HRB 552771\nRegisterbekanntmachung nach dem Umwandlungsgesetz 23.01.2025 (Eintragungsdatum)\n\nKiesel Mitte GmbH\nGesellschaft mit beschränkter Haftung\nBaienfurt\n\nAls nicht eingetragen wird bekanntgemacht:\nDen Gläubigern der an der Verschmelzung beteiligten Rechtsträger ist, wenn sie binnen sechs Monaten nach dem Tag, an dem die Eintragung der Verschmelzung in das Register des Sitzes desjenigen Rechtsträgers, dessen Gläubiger sie sind, nach § 19 Abs. 3 UmwG als bekanntgemacht gilt, ihren Anspruch nach Grund und Höhe schriftlich anmelden, Sicherheit zu leisten, soweit sie nicht Befriedigung verlangen können. Dieses Recht steht den Gläubigern jedoch nur zu, wenn sie glaubhaft machen, dass durch die Verschmelzung die Erfüllung ihrer Forderung gefährdet wird."
    },
    {
      "date": "2025-01-23",
      "id": "99380",
      "original_text": "Registerbekanntmachung nach dem Umwandlungsgesetz\nBaden-Württemberg Amtsgericht Stuttgart HRB 791775\nIMPP Solutions GmbH – Eppingen",
      "type": "Registerbekanntmachung nach dem Umwandlungsgesetz",
      "state": "Baden-Württemberg",
      "amtsgericht": "Amtsgericht Stuttgart",
      "registernummer": "HRB 791775",
      "registerart": "HRB",
      "company_name": "IMPP Solutions GmbH",
      "company_seat": "Eppingen",
      "details": "23.01.2025 (Bekanntmachungsdatum)\n\nBaden-Württemberg Amtsgericht Stuttgart HRB 791775\nRegisterbekanntmachung nach dem Umwandlungsgesetz 23.01.2025 (Eintragungsdatum)\n\nIMPP Solutions GmbH\nGesellschaft mit beschränkter Haftung\nEppingen\n\nDen Gläubigern der an der Verschmelzung beteiligten Rechtsträger ist, wenn sie binnen sechs Monaten nach dem Tag, an dem die Eintragung der Verschmelzung in das Register des Sitzes desjenigen Rechtsträgers, dessen Gläubiger sie sind, nach § 19 Abs. 3 UmwG als bekanntgemacht gilt, ihren Anspruch nach Grund und Höhe schriftlich anmelden, Sicherheit zu leisten, soweit sie nicht Befriedigung verlangen können. Dieses Recht steht den Gläubigern jedoch nur zu, wenn sie glaubhaft machen, dass durch die Verschmelzung die Erfüllung ihrer Forderung gefährdet wird."
    },
    {
      "date": "2025-01-23",
      "id": "99381",
      "original_text": "Registerbekanntmachung nach dem Umwandlungsgesetz\nBaden-Württemberg Amtsgericht Stuttgart HRB 791393\nHecker Group Holding GmbH – Eppingen",
      "type": "Registerbekanntmachung nach dem Umwandlungsgesetz",
      "state": "Baden-Württemberg",
      "amtsgericht": "Amtsgericht Stuttgart",
      "registernummer": "HRB 791393",
      "registerart": "HRB",
      "company_name": "Hecker Group Holding GmbH",
      "company_seat": "Eppingen",
      "details": "23.01.2025 (Bekanntmachungsdatum)\n\nBaden-Württemberg Amtsgericht Stuttgart HRB 791393\nRegisterbekanntmachung nach dem Umwandlungsgesetz 23.01.2025 (Eintragungsdatum)\n\nHecker Group Holding GmbH\nGesellschaft mit beschränkter Haftung\nEppingen\n\nAls nicht eingetragen wird bekanntgemacht:\nDen Gläubigern der an der Verschmelzung beteiligten Rechtsträger ist, wenn sie binnen sechs Monaten nach dem Tag, an dem die Eintragung der Verschmelzung in das Register des Sitzes desjenigen Rechtsträgers, dessen Gläubiger sie sind, nach § 19 Abs. 3 UmwG als bekanntgemacht gilt, ihren Anspruch nach Grund und Höhe schriftlich anmelden, Sicherheit zu leisten, soweit sie nicht Befriedigung verlangen können. Dieses Recht steht den Gläubigern jedoch nur zu, wenn sie glaubhaft machen, dass durch die Verschmelzung die Erfüllung ihrer Forderung gefährdet wird."
    },
    {
      "date": "2025-01-23",
      "id": "99382",
      "original_text": "Sonstige Registerbekanntmachung\nBaden-Württemberg Amtsgericht Ulm HRB 630227\nRolls-Royce Solutions GmbH – Friedrichshafen",
      "type": "Sonstige Registerbekanntmachung",
      "state": "Baden-Württemberg",
      "amtsgericht": "Amtsgericht Ulm",
      "registernummer": "HRB 630227",
      "registerart": "HRB",
      "company_name": "Rolls-Royce Solutions GmbH",
      "company_seat": "Friedrichshafen",
      "details": "23.01.2025 (Bekanntmachungsdatum)\n\nBaden-Württemberg Amtsgericht Ulm HRB 630227\nSonstige Registerbekanntmachung\n\nRolls-Royce Solutions GmbH\nGesellschaft mit beschränkter Haftung\nFriedrichshafen\n\nDie Gesellschaft hat am 23.01.2025 die Liste über die Zusammensetzung des Aufsichtsrats zum Handelsregister eingereicht."
    },
    {
      "date": "2025-01-23",
      "id": "99383",
      "original_text": "Registerbekanntmachung nach dem Umwandlungsgesetz\nBaden-Württemberg Amtsgericht Ulm HRB 552814\nKiesel Handels GmbH – Baienfurt",
      "type": "Registerbekanntmachung nach dem Umwandlungsgesetz",
      "state": "Baden-Württemberg",
      "amtsgericht": "Amtsgericht Ulm",
      "registernummer": "HRB 552814",
      "registerart": "HRB",
      "company_name": "Kiesel Handels GmbH",
      "company_seat": "Baienfurt",
      "details": "23.01.2025 (Bekanntmachungsdatum)\n\nBaden-Württemberg Amtsgericht Ulm HRB 552814\nRegisterbekanntmachung nach dem Umwandlungsgesetz 23.01.2025 (Eintragungsdatum)\n\nKiesel Handels GmbH\nGesellschaft mit beschränkter Haftung\nBaienfurt\n\nAls nicht eingetragen wird bekanntgemacht:\nDen Gläubigern der an der Verschmelzung beteiligten Rechtsträger ist, wenn sie binnen sechs Monaten nach dem Tag, an dem die Eintragung der Verschmelzung in das Register des Sitzes desjenigen Rechtsträgers, dessen Gläubiger sie sind, nach § 19 Abs. 3 UmwG als bekanntgemacht gilt, ihren Anspruch nach Grund und Höhe schriftlich anmelden, Sicherheit zu leisten, soweit sie nicht Befriedigung verlangen können. Dieses Recht steht den Gläubigern jedoch nur zu, wenn sie glaubhaft machen, dass durch die Verschmelzung die Erfüllung ihrer Forderung gefährdet wird."
    },
    {
      "date": "2025-01-23",
      "id": "99384",
      "original_text": "Registerbekanntmachung nach dem Umwandlungsgesetz\nBaden-Württemberg Amtsgericht Ulm HRB 721848\nKiesel Ost GmbH – Baienfurt",
      "type": "Registerbekanntmachung nach dem Umwandlungsgesetz",
      "state": "Baden-Württemberg",
      "amtsgericht": "Amtsgericht Ulm",
      "registernummer": "HRB 721848",
      "registerart": "HRB",
      "company_name": "Kiesel Ost GmbH",
      "company_seat": "Baienfurt",
      "details": "23.01.2025 (Bekanntmachungsdatum)\n\nBaden-Württemberg Amtsgericht Ulm HRB 721848\nRegisterbekanntmachung nach dem Umwandlungsgesetz 23.01.2025 (Eintragungsdatum)\n\nKiesel Ost GmbH\nGesellschaft mit beschränkter Haftung\nBaienfurt\n\nAls nicht eingetragen wird bekanntgemacht:\nDen Gläubigern der an der Verschmelzung beteiligten Rechtsträger ist, wenn sie binnen sechs Monaten nach dem Tag, an dem die Eintragung der Verschmelzung in das Register des Sitzes desjenigen Rechtsträgers, dessen Gläubiger sie sind, nach § 19 Abs. 3 UmwG als bekanntgemacht gilt, ihren Anspruch nach Grund und Höhe schriftlich anmelden, Sicherheit zu leisten, soweit sie nicht Befriedigung verlangen können. Dieses Recht steht den Gläubigern jedoch nur zu, wenn sie glaubhaft machen, dass durch die Verschmelzung die Erfüllung ihrer Forderung gefährdet wird."
    },
    {
      "date": "2025-01-23",
      "id": "99385",
      "original_text": "Löschungsankündigung\nSchleswig-Holstein Amtsgericht Lübeck HRA 1071 OD\nABW Abwicklungsgesellschaft mbH & Co. KG – Bad Oldesloe",
      "type": "Löschungsankündigung",
      "state": "Schleswig-Holstein",
      "amtsgericht": "Amtsgericht Lübeck",
      "registernummer": "HRA 1071 OD",
      "registerart": "HRA",
      "company_name": "ABW Abwicklungsgesellschaft mbH & Co. KG",
      "company_seat": "Bad Oldesloe",
      "details": "23.01.2025 (Bekanntmachungsdatum)\n\nSchleswig-Holstein Amtsgericht Lübeck HRA 1071 OD\nLöschungsankündigung\n\nABW Abwicklungsgesellschaft mbH & Co. KG\nKommanditgesellschaft\nBad Oldesloe\n\nEs ist die Löschung der nachstehenden Gesellschaft wegen Vermögenslosigkeit gemäß § 394 FamFG beabsichtigt."
    },
    {
      "date": "2025-01-23",
      "id": "99386",
      "original_text": "Einreichung neuer Dokumente\nBrandenburg Amtsgericht Cottbus HRB 7939\nFinanzhaus Meyer AG – Lübbenau/Spreewald",
      "type": "Einreichung neuer Dokumente",
      "state": "Brandenburg",
      "amtsgericht": "Amtsgericht Cottbus",
      "registernummer": "HRB 7939",
      "registerart": "HRB",
      "company_name": "Finanzhaus Meyer AG",
      "company_seat": "Lübbenau/Spreewald",
      "details": "23.01.2025 (Bekanntmachungsdatum)\n\nBrandenburg Amtsgericht Cottbus HRB 7939\nEinreichung neuer Dokumente\n\nFinanzhaus Meyer AG\nAktiengesellschaft\nLübbenau/Spreewald\n\nDie aktuelle Liste der Aufsichtsratsmitglieder wurde zum Handelsregister gem. § 106 AktG eingereicht."
    },
    {
      "date": "2025-01-23",
      "id": "99387",
      "original_text": "Registerbekanntmachung nach dem Umwandlungsgesetz\nHamburg Amtsgericht Hamburg VR 25799\nSoVD-Landesverband Hamburg e.V. – Hamburg",
      "type": "Registerbekanntmachung nach dem Umwandlungsgesetz",
      "state": "Hamburg",
      "amtsgericht": "Amtsgericht Hamburg",
      "registernummer": "VR 25799",
      "registerart": "VR",
      "company_name": "SoVD-Landesverband Hamburg e.V.",
      "company_seat": "Hamburg",
      "details": "23.01.2025 (Bekanntmachungsdatum)\n\nHamburg Amtsgericht Hamburg VR 25799\nRegisterbekanntmachung nach dem Umwandlungsgesetz 03.01.2025 (Eintragungsdatum)\n\nSoVD-Landesverband Hamburg e.V.\neingetragener Verein\nHamburg\n\nAls nicht eingetragen wird bekannt gemacht:\nDen Gläubigern der an der Abspaltung beteiligten Vereine ist, wenn sie binnen sechs Monaten nach dem Tag, an dem die Eintragung der Abspaltung in das Register des Sitzes desjenigen Rechtsträgers, dessen Gläubiger sie sind, nach § 19 Absatz 3 UmwG als bekannt gemacht gilt, ihren Anspruch nach Grund und Höhe schriftlich anmelden, Sicherheit zu leisten, soweit sie nicht Befriedigung verlangen können. Dieses Recht steht den Gläubigern jedoch nur zu, wenn sie glaubhaft machen, dass durch die Abspaltung die Erfüllung ihrer Forderung gefährdet wird."
    },
    {
      "date": "2025-01-23",
      "id": "99388",
      "original_text": "Löschungsankündigung\nSchleswig-Holstein Amtsgericht Kiel HRB 18017\nEMS GmbH – Rendsburg",
      "type": "Löschungsankündigung",
      "state": "Schleswig-Holstein",
      "amtsgericht": "Amtsgericht Kiel",
      "registernummer": "HRB 18017",
      "registerart": "HRB",
      "company_name": "EMS GmbH",
      "company_seat": "Rendsburg",
      "details": "23.01.2025 (Bekanntmachungsdatum)\n\nSchleswig-Holstein Amtsgericht Kiel HRB 18017\nLöschungsankündigung\n\nEMS GmbH\nGesellschaft mit beschränkter Haftung\nRendsburg\n\nBei der nachstehenden Gesellschaft wird das Amtslöschungsverfahren gemäß § 395 FamFG eingeleitet. Widerspruchsfrist: 2 Monate."
    },
    {
      "date": "2025-01-23",
      "id": "99389",
      "original_text": "Löschungsankündigung\nBrandenburg Amtsgericht Frankfurt/Oder HRB 13249\nIGZ-Hoehenland Limited – Höhenland",
      "type": "Löschungsankündigung",
      "state": "Brandenburg",
      "amtsgericht": "Amtsgericht Frankfurt/Oder",
      "registernummer": "HRB 13249",
      "registerart": "HRB",
      "company_name": "IGZ-Hoehenland Limited",
      "company_seat": "Höhenland",
      "details": "23.01.2025 (Bekanntmachungsdatum)\n\nBrandenburg Amtsgericht Frankfurt/Oder HRB 13249\nLöschungsankündigung\n\nIGZ-Hoehenland Limited\nRechtsform ausländischen Rechts HRB\nHöhenland\n\nBei der nachstehenden Gesellschaft wird das Amtslöschungsverfahren gemäß § 394 FamFG eingeleitet."
    },
    {
      "date": "2025-01-23",
      "id": "99390",
      "original_text": "Löschungsankündigung\nBerlin Amtsgericht Berlin (Charlottenburg) HRB 109154\nDABAK Vermögensgesellschaft mbH – Berlin",
      "type": "Löschungsankündigung",
      "state": "Berlin",
      "amtsgericht": "Amtsgericht Berlin (Charlottenburg)",
      "registernummer": "HRB 109154",
      "registerart": "HRB",
      "company_name": "DABAK Vermögensgesellschaft mbH",
      "company_seat": "Berlin",
      "details": "23.01.2025 (Bekanntmachungsdatum)\n\nBerlin Amtsgericht Berlin (Charlottenburg) HRB 109154\nLöschungsankündigung\n\nDABAK Vermögensgesellschaft mbH\nGesellschaft mit beschränkter Haftung\nBerlin\n\nBei der nachstehenden Gesellschaft wird das Amtslöschungsverfahren gemäß § 394 FamFG eingeleitet. Widerspruchsfrist 6 Wochen"
    },
    {
      "date": "2025-01-23",
      "id": "99391",
      "original_text": "Löschungsankündigung\nSchleswig-Holstein Amtsgericht Kiel HRA 7931\nBonusmedien GmbH & Co.KG – Kiel",
      "type": "Löschungsankündigung",
      "state": "Schleswig-Holstein",
      "amtsgericht": "Amtsgericht Kiel",
      "registernummer": "HRA 7931",
      "registerart": "HRA",
      "company_name": "Bonusmedien GmbH & Co.KG",
      "company_seat": "Kiel",
      "details": "23.01.2025 (Bekanntmachungsdatum)\n\nSchleswig-Holstein Amtsgericht Kiel HRA 7931\nLöschungsankündigung\n\nBonusmedien GmbH & Co.KG\nKommanditgesellschaft\nKiel\n\nBei der nachstehenden Firma wird das Amtslöschungsverfahren gemäß § 31 Abs. 2 HGB und § 393 FamFG eingeleitet. Widerspruchsfrist: 2 Monate."
    },
    {
      "date": "2025-01-23",
      "id": "99392",
      "original_text": "Einreichung neuer Dokumente\nBaden-Württemberg Amtsgericht Mannheim HRB 734272\nBK Giulini GmbH – Ladenburg",
      "type": "Einreichung neuer Dokumente",
      "state": "Baden-Württemberg",
      "amtsgericht": "Amtsgericht Mannheim",
      "registernummer": "HRB 734272",
      "registerart": "HRB",
      "company_name": "BK Giulini GmbH",
      "company_seat": "Ladenburg",
      "details": "23.01.2025 (Bekanntmachungsdatum)\n\nBaden-Württemberg Amtsgericht Mannheim HRB 734272\nEinreichung neuer Dokumente\n\nBK Giulini GmbH\nGesellschaft mit beschränkter Haftung\nLadenburg\n\nDie Gesellschaft hat am 16.01.2025 die Liste über die Zusammensetzung des Aufsichtsrats zum Handelsregister eingereicht."
    },
    {
      "date": "2025-01-23",
      "id": "99393",
      "original_text": "Einreichung neuer Dokumente\nSachsen Amtsgericht Chemnitz HRB 24773\nVOMEC AG – Ellefeld",
      "type": "Einreichung neuer Dokumente",
      "state": "Sachsen",
      "amtsgericht": "Amtsgericht Chemnitz",
      "registernummer": "HRB 24773",
      "registerart": "HRB",
      "company_name": "VOMEC AG",
      "company_seat": "Ellefeld",
      "details": "23.01.2025 (Bekanntmachungsdatum)\n\nSachsen Amtsgericht Chemnitz HRB 24773\nEinreichung neuer Dokumente\n\nVOMEC AG\nAktiengesellschaft\nEllefeld\n\nAm 21.01.2025 wurde beim Handelsregister des Amtsgerichts Chemnitz die Liste der Mitglieder des Aufsichtsrats gemäß § 106 AktG eingereicht."
    },
    {
      "date": "2025-01-23",
      "id": "99394",
      "original_text": "Einreichung neuer Dokumente\nSachsen Amtsgericht Dresden HRB 23100\nASB Kinder-, Jugend- und Familienhilfe gemeinnützige GmbH – Görlitz",
      "type": "Einreichung neuer Dokumente",
      "state": "Sachsen",
      "amtsgericht": "Amtsgericht Dresden",
      "registernummer": "HRB 23100",
      "registerart": "HRB",
      "company_name": "ASB Kinder-, Jugend- und Familienhilfe gemeinnützige GmbH",
      "company_seat": "Görlitz",
      "details": "23.01.2025 (Bekanntmachungsdatum)\n\nSachsen Amtsgericht Dresden HRB 23100\nEinreichung neuer Dokumente\n\nASB Kinder-, Jugend- und Familienhilfe gemeinnützige GmbH\nGesellschaft mit beschränkter Haftung\nGörlitz\n\nAm 21.01.2025 wurde beim Handelsregister des Amtsgerichts Dresden die Liste der Mitglieder des Aufsichtsrats gemäß § 52 GmbHG eingereicht."
    },
    {
      "date": "2025-01-23",
      "id": "99395",
      "original_text": "Einreichung neuer Dokumente\nSachsen Amtsgericht Dresden HRB 8327\nASB Betreuungs- und Sozialdienste gemeinnützige GmbH – Görlitz",
      "type": "Einreichung neuer Dokumente",
      "state": "Sachsen",
      "amtsgericht": "Amtsgericht Dresden",
      "registernummer": "HRB 8327",
      "registerart": "HRB",
      "company_name": "ASB Betreuungs- und Sozialdienste gemeinnützige GmbH",
      "company_seat": "Görlitz",
      "details": "23.01.2025 (Bekanntmachungsdatum)\n\nSachsen Amtsgericht Dresden HRB 8327\nEinreichung neuer Dokumente\n\nASB Betreuungs- und Sozialdienste gemeinnützige GmbH\nGesellschaft mit beschränkter Haftung\nGörlitz\n\nAm 21.01.2025 wurde beim Handelsregister des Amtsgerichts Dresden die Liste der Mitglieder des Aufsichtsrats gemäß § 52 GmbHG eingereicht."
    },
    {
      "date": "2025-01-23",
      "id": "99396",
      "original_text": "Einreichung neuer Dokumente\nSachsen Amtsgericht Chemnitz HRB 21880\nKommunale Holding Oelsnitz/V. GmbH – Oelsnitz/Vogtl.",
      "type": "Einreichung neuer Dokumente",
      "state": "Sachsen",
      "amtsgericht": "Amtsgericht Chemnitz",
      "registernummer": "HRB 21880",
      "registerart": "HRB",
      "company_name": "Kommunale Holding Oelsnitz/V. GmbH",
      "company_seat": "Oelsnitz/Vogtl.",
      "details": "23.01.2025 (Bekanntmachungsdatum)\n\nSachsen Amtsgericht Chemnitz HRB 21880\nEinreichung neuer Dokumente\n\nKommunale Holding Oelsnitz/V. GmbH\nGesellschaft mit beschränkter Haftung\nOelsnitz/Vogtl.\n\nAm 21.01.2025 wurde beim Handelsregister des Amtsgerichts Chemnitz die Liste der Mitglieder des Aufsichtsrats gemäß § 52 GmbHG eingereicht."
    },
    {
      "date": "2025-01-23",
      "id": "99397",
      "original_text": "Einreichung neuer Dokumente\nSachsen Amtsgericht Chemnitz HRB 15272\nOelsnitzer Kultur GmbH – Oelsnitz/Vogtl.",
      "type": "Einreichung neuer Dokumente",
      "state": "Sachsen",
      "amtsgericht": "Amtsgericht Chemnitz",
      "registernummer": "HRB 15272",
      "registerart": "HRB",
      "company_name": "Oelsnitzer Kultur GmbH",
      "company_seat": "Oelsnitz/Vogtl.",
      "details": "23.01.2025 (Bekanntmachungsdatum)\n\nSachsen Amtsgericht Chemnitz HRB 15272\nEinreichung neuer Dokumente\n\nOelsnitzer Kultur GmbH\nGesellschaft mit beschränkter Haftung\nOelsnitz/Vogtl.\n\nAm 21.01.2025 wurde beim Handelsregister des Amtsgerichts Chemnitz die Liste der Mitglieder des Aufsichtsrats gemäß § 52 GmbHG eingereicht."
    },
    {
      "date": "2025-01-23",
      "id": "99398",
      "original_text": "Einreichung neuer Dokumente\nSachsen Amtsgericht Chemnitz HRB 21641\nSozialbetriebe Mittleres Erzgebirge gGmbH – Olbernhau",
      "type": "Einreichung neuer Dokumente",
      "state": "Sachsen",
      "amtsgericht": "Amtsgericht Chemnitz",
      "registernummer": "HRB 21641",
      "registerart": "HRB",
      "company_name": "Sozialbetriebe Mittleres Erzgebirge gGmbH",
      "company_seat": "Olbernhau",
      "details": "23.01.2025 (Bekanntmachungsdatum)\n\nSachsen Amtsgericht Chemnitz HRB 21641\nEinreichung neuer Dokumente\n\nSozialbetriebe Mittleres Erzgebirge gGmbH\nGesellschaft mit beschränkter Haftung\nOlbernhau\n\nAm 21.01.2025 wurde beim Handelsregister des Amtsgerichts Chemnitz die Liste der Mitglieder des Aufsichtsrats gemäß § 52 GmbHG eingereicht."
    },
    {
      "date": "2025-01-23",
      "id": "99399",
      "original_text": "Einreichung neuer Dokumente\nNiedersachsen Amtsgericht Hannover HRB 6580\nTUI AG – Hannover und Berlin",
      "type": "Einreichung neuer Dokumente",
      "state": "Niedersachsen",
      "amtsgericht": "Amtsgericht Hannover",
      "registernummer": "HRB 6580",
      "registerart": "HRB",
      "company_name": "TUI AG",
      "company_seat": "Hannover und Berlin",
      "details": "23.01.2025 (Bekanntmachungsdatum)\n\nNiedersachsen Amtsgericht Hannover HRB 6580\nEinreichung neuer Dokumente\n\nTUI AG\nAktiengesellschaft\nHannover und Berlin\n\nDie Liste der Mitglieder des Aufsichtsrats wurde beim Registergericht eingereicht."
    },
    {
      "date": "2025-01-23",
      "id": "99400",
      "original_text": "Registerbekanntmachung nach dem Umwandlungsgesetz\nNiedersachsen Amtsgericht Göttingen HRB 120537\nMarketing Verwaltungsgesellschaft Bad Sachsa mbH – Bad Sachsa",
      "type": "Registerbekanntmachung nach dem Umwandlungsgesetz",
      "state": "Niedersachsen",
      "amtsgericht": "Amtsgericht Göttingen",
      "registernummer": "HRB 120537",
      "registerart": "HRB",
      "company_name": "Marketing Verwaltungsgesellschaft Bad Sachsa mbH",
      "company_seat": "Bad Sachsa",
      "details": "23.01.2025 (Bekanntmachungsdatum)\n\nNiedersachsen Amtsgericht Göttingen HRB 120537\nRegisterbekanntmachung nach dem Umwandlungsgesetz 23.01.2025 (Eintragungsdatum)\n\nMarketing Verwaltungsgesellschaft Bad Sachsa mbH\nGesellschaft mit beschränkter Haftung\nBad Sachsa\n\nDen Gläubigern der an der Verschmelzung beteiligten Rechtsträger ist, wenn sie binnen sechs Monaten nach dem Tag, an dem die Eintragung der Verschmelzung in das Register des Sitzes desjenigen Rechtsträgers, dessen Gläubiger sie sind, nach § 19  Abs.  3 UmwG als bekannt gemacht gilt, ihren Anspruch nach Grund und Höhe schriftlich anmelden, Sicherheit zu leisten, soweit sie nicht Befriedigung verlangen können. Dieses Recht steht den Gläubigern jedoch nur zu, wenn sie glaubhaft machen, dass durch die Verschmelzung die Erfüllung der Forderung gefährdet wird."
    },
    {
      "date": "2025-01-23",
      "id": "99401",
      "original_text": "Registerbekanntmachung nach dem Umwandlungsgesetz\nNiedersachsen Amtsgericht Tostedt HRA 205018\nRAT Immobilien GmbH & Co. KG – Wurster Nordseeküste",
      "type": "Registerbekanntmachung nach dem Umwandlungsgesetz",
      "state": "Niedersachsen",
      "amtsgericht": "Amtsgericht Tostedt",
      "registernummer": "HRA 205018",
      "registerart": "HRA",
      "company_name": "RAT Immobilien GmbH & Co. KG",
      "company_seat": "Wurster Nordseeküste",
      "details": "23.01.2025 (Bekanntmachungsdatum)\n\nNiedersachsen Amtsgericht Tostedt HRA 205018\nRegisterbekanntmachung nach dem Umwandlungsgesetz 23.01.2025 (Eintragungsdatum)\n\nRAT Immobilien GmbH & Co. KG\nKommanditgesellschaft\nWurster Nordseeküste\n\nDen Gläubigern der an der Ausgliederung beteiligten Rechtsträger ist, wenn sie binnen sechs Monaten nach dem Tag, an dem die Eintragung der Ausgliederung in das Register des Sitzes desjenigen Rechtsträgers, dessen Gläubiger sie sind, nach § 19 Abs. 3 UmwG als bekannt gemacht gilt, ihren Anspruch nach Grund und Höhe schriftlich anmelden, Sicherheit zu leisten, soweit sie nicht Befriedigung verlangen können. Dieses Recht steht den Gläubigern jedoch nur zu, wenn sie glaubhaft machen, dass durch die Ausgliederung die Erfüllung der Forderung gefährdet wird."
    },
    {
      "date": "2025-01-23",
      "id": "99402",
      "original_text": "Registerbekanntmachung nach dem Umwandlungsgesetz\nNiedersachsen Amtsgericht Hannover PR 201287\nMVZ Dres. Awe, Karwetzky Ärzte Partnerschaft Wilhelmshaven – Wilhelmshaven",
      "type": "Registerbekanntmachung nach dem Umwandlungsgesetz",
      "state": "Niedersachsen",
      "amtsgericht": "Amtsgericht Hannover",
      "registernummer": "PR 201287",
      "registerart": "PR",
      "company_name": "MVZ Dres. Awe, Karwetzky Ärzte Partnerschaft Wilhelmshaven",
      "company_seat": "Wilhelmshaven",
      "details": "23.01.2025 (Bekanntmachungsdatum)\n\nNiedersachsen Amtsgericht Hannover PR 201287\nRegisterbekanntmachung nach dem Umwandlungsgesetz 23.01.2025 (Eintragungsdatum)\n\nMVZ Dres. Awe, Karwetzky Ärzte Partnerschaft Wilhelmshaven\nPartnerschaftsgesellschaft\nWilhelmshaven\n\nDen Gläubigern der an der Abspaltung beteiligten Rechtsträger ist, wenn sie binnen sechs Monaten nach dem Tag, an dem die Eintragung der Abspaltung in das Register des Sitzes desjenigen Rechtsträgers, dessen Gläubiger sie sind, nach § 19 Abs. 3 UmwG als bekannt gemacht gilt, ihren Anspruch nach Grund und Höhe schriftlich anmelden, Sicherheit zu leisten, soweit sie nicht Befriedigung verlangen können. Dieses Recht steht den Gläubigern jedoch nur zu, wenn sie glaubhaft machen, dass durch die Abspaltung die Erfüllung der Forderung gefährdet wird."
    },
    {
      "date": "2025-01-23",
      "id": "99403",
      "original_text": "Löschungsankündigung\nNiedersachsen Amtsgericht Hildesheim HRB 208071\nB&B Service GmbH – Gifhorn",
      "type": "Löschungsankündigung",
      "state": "Niedersachsen",
      "amtsgericht": "Amtsgericht Hildesheim",
      "registernummer": "HRB 208071",
      "registerart": "HRB",
      "company_name": "B&B Service GmbH",
      "company_seat": "Gifhorn",
      "details": "23.01.2025 (Bekanntmachungsdatum)\n\nNiedersachsen Amtsgericht Hildesheim HRB 208071\nLöschungsankündigung\n\nB&B Service GmbH\nGesellschaft mit beschränkter Haftung\nGifhorn\n\nDas Registergericht beabsichtigt, die Gesellschaft von Amts wegen nach § 394 FamFG zu löschen. Die Frist zur Erhebung eines Widerspruchs ist auf 1 Monat ab dieser Registerbekanntmachung festgesetzt."
    },
    {
      "date": "2025-01-23",
      "id": "99404",
      "original_text": "Einreichung neuer Dokumente\nNiedersachsen Amtsgericht Osnabrück HRB 110386 früher Amtsgericht Bad Iburg\nGeorgsmarienhütte Holding GmbH – Georgsmarienhütte",
      "type": "Einreichung neuer Dokumente",
      "state": "Niedersachsen",
      "amtsgericht": "Amtsgericht Osnabrück",
      "registernummer": "HRB 110386",
      "registerart": "HRB",
      "company_name": "Georgsmarienhütte Holding GmbH",
      "company_seat": "Georgsmarienhütte",
      "former_amtsgericht": "Bad Iburg",
      "details": "23.01.2025 (Bekanntmachungsdatum)\n\nNiedersachsen Amtsgericht Osnabrück HRB 110386 früher Amtsgericht Bad Iburg\nEinreichung neuer Dokumente 23.01.2025 (Eintragungsdatum)\n\nGeorgsmarienhütte Holding GmbH\nGesellschaft mit beschränkter Haftung\nGeorgsmarienhütte\n\nDie Liste der Mitglieder des Aufsichtsrats wurde beim Registergericht eingereicht."
    },
    {
      "date": "2025-01-23",
      "id": "99405",
      "original_text": "Löschungsankündigung\nNiedersachsen Amtsgericht Tostedt HRB 203139\nPolymertrend GmbH – Stade",
      "type": "Löschungsankündigung",
      "state": "Niedersachsen",
      "amtsgericht": "Amtsgericht Tostedt",
      "registernummer": "HRB 203139",
      "registerart": "HRB",
      "company_name": "Polymertrend GmbH",
      "company_seat": "Stade",
      "details": "23.01.2025 (Bekanntmachungsdatum)\n\nNiedersachsen Amtsgericht Tostedt HRB 203139\nLöschungsankündigung 23.01.2025 (Eintragungsdatum)\n\nPolymertrend GmbH\nGesellschaft mit beschränkter Haftung\nStade\n\nDas Registergericht beabsichtigt, die Gesellschaft von Amts wegen nach § 394 FamFG zu löschen. Die Frist zur Erhebung eines Widerspruchs ist auf 1 Monat ab dieser Registerbekanntmachung festgesetzt."
    },
    {
      "date": "2025-01-23",
      "id": "99406",
      "original_text": "Löschungsankündigung\nNiedersachsen Amtsgericht Hildesheim HRA 202112\nLMP Transporte, Inh. Lusy Martina Purba e. Kfr. – Delligsen",
      "type": "Löschungsankündigung",
      "state": "Niedersachsen",
      "amtsgericht": "Amtsgericht Hildesheim",
      "registernummer": "HRA 202112",
      "registerart": "HRA",
      "company_name": "LMP Transporte, Inh. Lusy Martina Purba e. Kfr.",
      "company_seat": "Delligsen",
      "details": "23.01.2025 (Bekanntmachungsdatum)\n\nNiedersachsen Amtsgericht Hildesheim HRA 202112\nLöschungsankündigung\n\nLMP Transporte, Inh. Lusy Martina Purba e. Kfr.\nEinzelkaufmann / Einzelkauffrau\nDelligsen\n\nDas Registergericht beabsichtigt, die Firma von Amts wegen nach § 31 Abs. 2 Satz 2 HGB, § 393 FamFG zu löschen. Die Frist zur Erhebung eines Widerspruchs ist auf 1 Monat ab dieser Registerbekanntmachung festgesetzt."
    },
    {
      "date": "2025-01-23",
      "id": "99407",
      "original_text": "Einreichung neuer Dokumente\nNiedersachsen Amtsgericht Osnabrück HRB 220721\nMEYER WERFT GmbH – Papenburg",
      "type": "Einreichung neuer Dokumente",
      "state": "Niedersachsen",
      "amtsgericht": "Amtsgericht Osnabrück",
      "registernummer": "HRB 220721",
      "registerart": "HRB",
      "company_name": "MEYER WERFT GmbH",
      "company_seat": "Papenburg",
      "details": "23.01.2025 (Bekanntmachungsdatum)\n\nNiedersachsen Amtsgericht Osnabrück HRB 220721\nEinreichung neuer Dokumente\n\nMEYER WERFT GmbH\nGesellschaft mit beschränkter Haftung\nPapenburg\n\nDie Liste der Mitglieder des Aufsichtsrats wurde beim Registergericht eingereicht."
    },
    {
      "date": "2025-01-23",
      "id": "99408",
      "original_text": "Registerbekanntmachung nach dem Umwandlungsgesetz\nNiedersachsen Amtsgericht Osnabrück HRB 121160 früher Amtsgericht Meppen\nBernhard Rüschen, Gesellschaft mit beschränkter Haftung – Lathen",
      "type": "Registerbekanntmachung nach dem Umwandlungsgesetz",
      "state": "Niedersachsen",
      "amtsgericht": "Amtsgericht Osnabrück",
      "registernummer": "HRB 121160",
      "registerart": "HRB",
      "company_name": "Bernhard Rüschen, Gesellschaft mit beschränkter Haftung",
      "company_seat": "Lathen",
      "former_amtsgericht": "Meppen",
      "details": "23.01.2025 (Bekanntmachungsdatum)\n\nNiedersachsen Amtsgericht Osnabrück HRB 121160 früher Amtsgericht Meppen\nRegisterbekanntmachung nach dem Umwandlungsgesetz 23.01.2025 (Eintragungsdatum)\n\nBernhard Rüschen, Gesellschaft mit beschränkter Haftung\nGesellschaft mit beschränkter Haftung\nLathen\n\nDen Gläubigern der an der Verschmelzung beteiligten Rechtsträger ist, wenn sie binnen sechs Monaten nach dem Tag, an dem die Eintragung der Verschmelzung in das Register des Sitzes desjenigen Rechtsträgers, dessen Gläubiger sie sind, nach § 19  Abs.  3 UmwG als bekannt gemacht gilt, ihren Anspruch nach Grund und Höhe schriftlich anmelden, Sicherheit zu leisten, soweit sie nicht Befriedigung verlangen können. Dieses Recht steht den Gläubigern jedoch nur zu, wenn sie glaubhaft machen, dass durch die Verschmelzung die Erfüllung der Forderung gefährdet wird."
    },
    {
      "date": "2025-01-23",
      "id": "99409",
      "original_text": "Sonstige Registerbekanntmachung\nNiedersachsen Amtsgericht Lüneburg HRB 100683 früher Amtsgericht Celle\nML Immobilien-Handels- und Verwaltungs-GmbH – Winsen/Aller",
      "type": "Sonstige Registerbekanntmachung",
      "state": "Niedersachsen",
      "amtsgericht": "Amtsgericht Lüneburg",
      "registernummer": "HRB 100683",
      "registerart": "HRB",
      "company_name": "ML Immobilien-Handels- und Verwaltungs-GmbH",
      "company_seat": "Winsen/Aller",
      "former_amtsgericht": "Celle",
      "details": "23.01.2025 (Bekanntmachungsdatum)\n\nNiedersachsen Amtsgericht Lüneburg HRB 100683 früher Amtsgericht Celle\nSonstige Registerbekanntmachung 23.01.2025 (Eintragungsdatum)\n\nML Immobilien-Handels- und Verwaltungs-GmbH\nGesellschaft mit beschränkter Haftung\nWinsen/Aller\n\nDen Gläubigern der Gesellschaft, deren Forderungen begründet worden sind, bevor die Eintragung der Beendigung des Vertrages in das Handelsregister nach § 10 HGB als bekanntgemacht gilt, ist vom anderen Vertragsteil Sicherheit zu leisten, wenn sie sich binnen sechs Monaten nach der Bekanntmachung zu diesem Zweck bei ihm melden."
    },
    {
      "date": "2025-01-23",
      "id": "99410",
      "original_text": "Registerbekanntmachung nach dem Umwandlungsgesetz\nNiedersachsen Amtsgericht Tostedt HRA 204883\nWalter M. Brogsitter e.K. – Wurster Nordseeküste",
      "type": "Registerbekanntmachung nach dem Umwandlungsgesetz",
      "state": "Niedersachsen",
      "amtsgericht": "Amtsgericht Tostedt",
      "registernummer": "HRA 204883",
      "registerart": "HRA",
      "company_name": "Walter M. Brogsitter e.K.",
      "company_seat": "Wurster Nordseeküste",
      "details": "23.01.2025 (Bekanntmachungsdatum)\n\nNiedersachsen Amtsgericht Tostedt HRA 204883\nRegisterbekanntmachung nach dem Umwandlungsgesetz 23.01.2025 (Eintragungsdatum)\n\nWalter M. Brogsitter e.K.\nEinzelkaufmann / Einzelkauffrau\nWurster Nordseeküste\n\nDen Gläubigern der an der Ausgliederung beteiligten Rechtsträger ist, wenn sie binnen sechs Monaten nach dem Tag, an dem die Eintragung der Ausgliederung in das Register des Sitzes desjenigen Rechtsträgers, dessen Gläubiger sie sind, nach § 19 Abs. 3 UmwG als bekannt gemacht gilt, ihren Anspruch nach Grund und Höhe schriftlich anmelden, Sicherheit zu leisten, soweit sie nicht Befriedigung verlangen können. Dieses Recht steht den Gläubigern jedoch nur zu, wenn sie glaubhaft machen, dass durch die Ausgliederung die Erfüllung der Forderung gefährdet wird."
    },
    {
      "date": "2025-01-23",
      "id": "99411",
      "original_text": "Einreichung neuer Dokumente\nNiedersachsen Amtsgericht Hildesheim HRB 101405 früher Amtsgericht Gifhorn\nPeiner Träger GmbH – Peine",
      "type": "Einreichung neuer Dokumente",
      "state": "Niedersachsen",
      "amtsgericht": "Amtsgericht Hildesheim",
      "registernummer": "HRB 101405",
      "registerart": "HRB",
      "company_name": "Peiner Träger GmbH",
      "company_seat": "Peine",
      "former_amtsgericht": "Gifhorn",
      "details": "23.01.2025 (Bekanntmachungsdatum)\n\nNiedersachsen Amtsgericht Hildesheim HRB 101405 früher Amtsgericht Gifhorn\nEinreichung neuer Dokumente\n\nPeiner Träger GmbH\nGesellschaft mit beschränkter Haftung\nPeine\n\nDie Liste der Mitglieder des Aufsichtsrats wurde beim Registergericht eingereicht."
    },
    {
      "date": "2025-01-23",
      "id": "99412",
      "original_text": "Registerbekanntmachung nach dem Umwandlungsgesetz\nNiedersachsen Amtsgericht Hannover PR 201523\nMVZ Dr. Awe und Partner Augenärzte Partnerschaft Aurich – Aurich",
      "type": "Registerbekanntmachung nach dem Umwandlungsgesetz",
      "state": "Niedersachsen",
      "amtsgericht": "Amtsgericht Hannover",
      "registernummer": "PR 201523",
      "registerart": "PR",
      "company_name": "MVZ Dr. Awe und Partner Augenärzte Partnerschaft Aurich",
      "company_seat": "Aurich",
      "details": "23.01.2025 (Bekanntmachungsdatum)\n\nNiedersachsen Amtsgericht Hannover PR 201523\nRegisterbekanntmachung nach dem Umwandlungsgesetz 23.01.2025 (Eintragungsdatum)\n\nMVZ Dr. Awe und Partner Augenärzte Partnerschaft Aurich\nPartnerschaftsgesellschaft\nAurich\n\nDen Gläubigern der an der Abspaltung beteiligten Rechtsträger ist, wenn sie binnen sechs Monaten nach dem Tag, an dem die Eintragung der Abspaltung in das Register des Sitzes desjenigen Rechtsträgers, dessen Gläubiger sie sind, nach § 19 Abs. 3 UmwG als bekannt gemacht gilt, ihren Anspruch nach Grund und Höhe schriftlich anmelden, Sicherheit zu leisten, soweit sie nicht Befriedigung verlangen können. Dieses Recht steht den Gläubigern jedoch nur zu, wenn sie glaubhaft machen, dass durch die Abspaltung die Erfüllung der Forderung gefährdet wird."
    },
    {
      "date": "2025-01-23",
      "id": "99413",
      "original_text": "Registerbekanntmachung nach dem Umwandlungsgesetz\nNiedersachsen Amtsgericht Oldenburg (Oldenburg) HRB 215478\nHBG Sechste Projekt GmbH – Oldenburg",
      "type": "Registerbekanntmachung nach dem Umwandlungsgesetz",
      "state": "Niedersachsen",
      "amtsgericht": "Amtsgericht Oldenburg (Oldenburg)",
      "registernummer": "HRB 215478",
      "registerart": "HRB",
      "company_name": "HBG Sechste Projekt GmbH",
      "company_seat": "Oldenburg",
      "details": "23.01.2025 (Bekanntmachungsdatum)\n\nNiedersachsen Amtsgericht Oldenburg (Oldenburg) HRB 215478\nRegisterbekanntmachung nach dem Umwandlungsgesetz 23.01.2025 (Eintragungsdatum)\n\nHBG Sechste Projekt GmbH\nGesellschaft mit beschränkter Haftung\nOldenburg\n\nDen Gläubigern der an der formwechselnden Umwandlung beteiligten Rechtsträger ist, wenn sie binnen sechs Monaten nach dem Tag, an dem die Eintragung der Umwandlung in das Register des Sitzes desjenigen Rechtsträgers, dessen Gläubiger sie sind, nach § 19 Abs. 3 UmwG als bekannt gemacht gilt, ihren Anspruch nach Grund und Höhe schriftlich anmelden, Sicherheit zu leisten, soweit sie nicht Befriedigung verlangen können. Dieses Recht steht den Gläubigern jedoch nur zu, wenn sie glaubhaft machen, dass durch die formwechselnde Umwandlung die Erfüllung der Forderung gefährdet wird."
    },
    {
      "date": "2025-01-23",
      "id": "99414",
      "original_text": "Löschungsankündigung\nNiedersachsen Amtsgericht Braunschweig HRA 10254\nA & K Aparofsky & Kreiling OHG – Vechelde",
      "type": "Löschungsankündigung",
      "state": "Niedersachsen",
      "amtsgericht": "Amtsgericht Braunschweig",
      "registernummer": "HRA 10254",
      "registerart": "HRA",
      "company_name": "A & K Aparofsky & Kreiling OHG",
      "company_seat": "Vechelde",
      "details": "23.01.2025 (Bekanntmachungsdatum)\n\nNiedersachsen Amtsgericht Braunschweig HRA 10254\nLöschungsankündigung\n\nA & K Aparofsky & Kreiling OHG\nOffene Handelsgesellschaft\nVechelde\n\nDas Registergericht beabsichtigt, die Firma von Amts wegen nach § 31 Abs. 2 Satz 2 HGB, § 393 FamFG zu löschen. Die Frist zur Erhebung eines Widerspruchs ist auf 1 Monat ab dieser Registerbekanntmachung festgesetzt."
    },
    {
      "date": "2025-01-23",
      "id": "99415",
      "original_text": "Löschungsankündigung\nNiedersachsen Amtsgericht Oldenburg (Oldenburg) HRB 211019\nWRD Wilhelmshavener Reinigungs-Dienst UG (haftungsbeschränkt) – Wilhelmshaven",
      "type": "Löschungsankündigung",
      "state": "Niedersachsen",
      "amtsgericht": "Amtsgericht Oldenburg (Oldenburg)",
      "registernummer": "HRB 211019",
      "registerart": "HRB",
      "company_name": "WRD Wilhelmshavener Reinigungs-Dienst UG (haftungsbeschränkt)",
      "company_seat": "Wilhelmshaven",
      "details": "23.01.2025 (Bekanntmachungsdatum)\n\nNiedersachsen Amtsgericht Oldenburg (Oldenburg) HRB 211019\nLöschungsankündigung\n\nWRD Wilhelmshavener Reinigungs-Dienst UG (haftungsbeschränkt)\nGesellschaft mit beschränkter Haftung\nWilhelmshaven\n\nDas Registergericht beabsichtigt, die Gesellschaft von Amts wegen nach § 394 FamFG zu löschen. Die Frist zur Erhebung eines Widerspruchs ist auf 1 Monat ab dieser Registerbekanntmachung festgesetzt."
    },
    {
      "date": "2025-01-23",
      "id": "99416",
      "original_text": "Registerbekanntmachung nach dem Umwandlungsgesetz\nRheinland-Pfalz Amtsgericht Montabaur HRB 28503\nRM Immobilien AG – Montabaur",
      "type": "Registerbekanntmachung nach dem Umwandlungsgesetz",
      "state": "Rheinland-Pfalz",
      "amtsgericht": "Amtsgericht Montabaur",
      "registernummer": "HRB 28503",
      "registerart": "HRB",
      "company_name": "RM Immobilien AG",
      "company_seat": "Montabaur",
      "details": "23.01.2025 (Bekanntmachungsdatum)\n\nRheinland-Pfalz Amtsgericht Montabaur HRB 28503\nRegisterbekanntmachung nach dem Umwandlungsgesetz 23.01.2025 (Eintragungsdatum)\n\nRM Immobilien AG\nAktiengesellschaft\nMontabaur\n\nDen Gläubigern der an dem Formwechsel beteiligten Rechtsträgers ist, wenn sie binnen sechs Monaten nach dem Tag, an dem die Eintragung des Formwechsels in das Register des Sitzes desjenigen Rechtsträgers, dessen Gläubiger sie sind, nach § 19 Absatz 3 UmwG als bekanntgemacht gilt, ihren Anspruch nach Grund und Höhe schriftlich anmelden, Sicherheit zu leisten, soweit sie nicht Befriedigung verlangen können.\nDieses Recht steht den Gläubigern jedoch nur zu, wenn sie glaubhaft machen, dass durch den Formwechsel die Erfüllung ihrer Forderung gefährdet wird."
    },
    {
      "date": "2025-01-23",
      "id": "99417",
      "original_text": "Sonstige Registerbekanntmachung\nRheinland-Pfalz Amtsgericht Koblenz HRB 27824\nPlantavis GmbH – Leiningen",
      "type": "Sonstige Registerbekanntmachung",
      "state": "Rheinland-Pfalz",
      "amtsgericht": "Amtsgericht Koblenz",
      "registernummer": "HRB 27824",
      "registerart": "HRB",
      "company_name": "Plantavis GmbH",
      "company_seat": "Leiningen",
      "details": "23.01.2025 (Bekanntmachungsdatum)\n\nRheinland-Pfalz Amtsgericht Koblenz HRB 27824\nSonstige Registerbekanntmachung 23.01.2025 (Eintragungsdatum)\n\nPlantavis GmbH\nGesellschaft mit beschränkter Haftung\nLeiningen\n\nAls nicht eingetragen wird veröffentlicht: Den Gläubigern der Gesellschaft, deren Forderungen begründet worden sind, bevor die Eintragung der Beendigung des Beherrschungs- undGewinnabführungsvertrages in das Handelsregister nach § 10 des Handelsgesetzbuches als bekanntgemacht gilt, hat der andere Vertragsteil Sicherheit zu leisten, wenn sie sich binnen sechs Monaten nach der Bekanntmachung der Eintragung zu diesem Zweck bei ihm melden."
    },
    {
      "date": "2025-01-23",
      "id": "99418",
      "original_text": "Löschungsankündigung\nRheinland-Pfalz Amtsgericht Ludwigshafen a.Rhein (Ludwigshafen) VR 50882\nBridge-Sport-Club Speyer e.V. – Speyer",
      "type": "Löschungsankündigung",
      "state": "Rheinland-Pfalz",
      "amtsgericht": "Amtsgericht Ludwigshafen a.Rhein (Ludwigshafen)",
      "registernummer": "VR 50882",
      "registerart": "VR",
      "company_name": "Bridge-Sport-Club Speyer e.V.",
      "company_seat": "Speyer",
      "details": "23.01.2025 (Bekanntmachungsdatum)\n\nRheinland-Pfalz Amtsgericht Ludwigshafen a.Rhein (Ludwigshafen) VR 50882\nLöschungsankündigung\n\nBridge-Sport-Club Speyer e.V.\neingetragener Verein\nSpeyer\n\nDas Gericht beabsichtigt, den Verein wegen Einstellung des Vereinszwecks und somit Wegfalls aller Mitglieder von Amts wegen zu löschen. Die Frist zur Geltendmachung eines Widerspruchs gegen die beabsichtigte Löschung ist auf einen Monat ab Veröffentlichung bestimmt."
    },
    {
      "date": "2025-01-23",
      "id": "99419",
      "original_text": "Löschungsankündigung\nRheinland-Pfalz Amtsgericht Montabaur HRB 27086\nAlic Projektbau GmbH – Neuwied",
      "type": "Löschungsankündigung",
      "state": "Rheinland-Pfalz",
      "amtsgericht": "Amtsgericht Montabaur",
      "registernummer": "HRB 27086",
      "registerart": "HRB",
      "company_name": "Alic Projektbau GmbH",
      "company_seat": "Neuwied",
      "details": "23.01.2025 (Bekanntmachungsdatum)\n\nRheinland-Pfalz Amtsgericht Montabaur HRB 27086\nLöschungsankündigung\n\nAlic Projektbau GmbH\nGesellschaft mit beschränkter Haftung\nNeuwied\n\nDas Registergericht beabsichtigt nachfolgende Firma von Amts wegen nach § 394 Abs. 1 FamFG zu löschen. Die Frist zur Erhebung eines Widerspruchs ist auf 1 Monat festgesetzt."
    },
    {
      "date": "2025-01-23",
      "id": "99420",
      "original_text": "Löschungsankündigung\nBremen Amtsgericht Bremen HRB 28675\nGlobal Tex Import Export GmbH – Bremen",
      "type": "Löschungsankündigung",
      "state": "Bremen",
      "amtsgericht": "Amtsgericht Bremen",
      "registernummer": "HRB 28675",
      "registerart": "HRB",
      "company_name": "Global Tex Import Export GmbH",
      "company_seat": "Bremen",
      "details": "23.01.2025 (Bekanntmachungsdatum)\n\nBremen Amtsgericht Bremen HRB 28675\nLöschungsankündigung\n\nGlobal Tex Import Export GmbH\nGesellschaft mit beschränkter Haftung\nBremen\n\nEs ist beabsichtigt die im Handelsregister eingetragene Gesellschaft von Amts wegen gemäß § 394 FamFG zu löschen. Gegen die Löschung kann beim AG Bremen schriftlich oder zu Protokoll der Geschäftsstelle Widerspruch eingelegt werden. Widerspruchsfrist 4 Wochen."
    },
    {
      "date": "2025-01-23",
      "id": "99421",
      "original_text": "Löschungsankündigung\nBremen Amtsgericht Bremen HRB 29283\nElke Specketer Haustechnik GmbH – Bremen",
      "type": "Löschungsankündigung",
      "state": "Bremen",
      "amtsgericht": "Amtsgericht Bremen",
      "registernummer": "HRB 29283",
      "registerart": "HRB",
      "company_name": "Elke Specketer Haustechnik GmbH",
      "company_seat": "Bremen",
      "details": "23.01.2025 (Bekanntmachungsdatum)\n\nBremen Amtsgericht Bremen HRB 29283\nLöschungsankündigung\n\nElke Specketer Haustechnik GmbH\nGesellschaft mit beschränkter Haftung\nBremen\n\nEs ist beabsichtigt die im Handelsregister eingetragene Gesellschaft von Amts wegen gemäß § 394 FamFG zu löschen. Gegen die Löschung kann beim AG Bremen schriftlich oder zu Protokoll der Geschäftsstelle Widerspruch eingelegt werden. Widerspruchsfrist 4 Wochen."
    },
    {
      "date": "2025-01-23",
      "id": "99422",
      "original_text": "Löschungsankündigung\nBremen Amtsgericht Bremen HRB 35303\nSEB Bau GmbH – Bremen",
      "type": "Löschungsankündigung",
      "state": "Bremen",
      "amtsgericht": "Amtsgericht Bremen",
      "registernummer": "HRB 35303",
      "registerart": "HRB",
      "company_name": "SEB Bau GmbH",
      "company_seat": "Bremen",
      "details": "23.01.2025 (Bekanntmachungsdatum)\n\nBremen Amtsgericht Bremen HRB 35303\nLöschungsankündigung\n\nSEB Bau GmbH\nGesellschaft mit beschränkter Haftung\nBremen\n\nEs ist beabsichtigt die im Handelsregister eingetragene Gesellschaft von Amts wegen gemäß § 394 FamFG zu löschen. Gegen die Löschung kann beim AG Bremen schriftlich oder zu Protokoll der Geschäftsstelle Widerspruch eingelegt werden. Widerspruchsfrist 4 Wochen."
    },
    {
      "date": "2025-01-23",
      "id": "99423",
      "original_text": "Einreichung neuer Dokumente\nBremen Amtsgericht Bremen HRB 18878\nEUROGATE Geschäftsführungs-GmbH & Co. KGaA – Bremen",
      "type": "Einreichung neuer Dokumente",
      "state": "Bremen",
      "amtsgericht": "Amtsgericht Bremen",
      "registernummer": "HRB 18878",
      "registerart": "HRB",
      "company_name": "EUROGATE Geschäftsführungs-GmbH & Co. KGaA",
      "company_seat": "Bremen",
      "details": "23.01.2025 (Bekanntmachungsdatum)\n\nBremen Amtsgericht Bremen HRB 18878\nEinreichung neuer Dokumente\n\nEUROGATE Geschäftsführungs-GmbH & Co. KGaA\nKommanditgesellschaft auf Aktien\nBremen\n\nAls nicht eingetragen wird veröffentlicht: Liste des Aufsichtsrats wurde eingereicht."
    },
    {
      "date": "2025-01-23",
      "id": "99424",
      "original_text": "Löschungsankündigung\nNordrhein-Westfalen Amtsgericht Mönchengladbach HRB 22128\nGlashaus Investment GmbH – Mönchengladbach",
      "type": "Löschungsankündigung",
      "state": "Nordrhein-Westfalen",
      "amtsgericht": "Amtsgericht Mönchengladbach",
      "registernummer": "HRB 22128",
      "registerart": "HRB",
      "company_name": "Glashaus Investment GmbH",
      "company_seat": "Mönchengladbach",
      "details": "23.01.2025 (Bekanntmachungsdatum)\n\nNordrhein-Westfalen Amtsgericht Mönchengladbach HRB 22128\nLöschungsankündigung\n\nGlashaus Investment GmbH\nGesellschaft mit beschränkter Haftung\nMönchengladbach\n\nGlashaus Investment GmbH, Mönchengladbach (Amtsgericht Mönchengladbach, HRB 22128)\nDas Registergericht beabsichtigt, die im Handelsregister eingetragene Gesellschaft gemäß § 394 Absatz 1 FamFG wegen Vermögenslosigkeit von Amts wegen zu löschen. Gegen diese Verfügung kann Widerspruch eingelegt werden. Die Frist zur Erhebung eines Widerspruchs gegen die beabsichtigte Löschung von Amts wegen ist auf zwei Monate festgesetzt."
    },
    {
      "date": "2025-01-23",
      "id": "99425",
      "original_text": "Löschungsankündigung\nNordrhein-Westfalen Amtsgericht Kleve HRA 5372\nCluster Technology e. K. – Sonsbeck",
      "type": "Löschungsankündigung",
      "state": "Nordrhein-Westfalen",
      "amtsgericht": "Amtsgericht Kleve",
      "registernummer": "HRA 5372",
      "registerart": "HRA",
      "company_name": "Cluster Technology e. K.",
      "company_seat": "Sonsbeck",
      "details": "23.01.2025 (Bekanntmachungsdatum)\n\nNordrhein-Westfalen Amtsgericht Kleve HRA 5372\nLöschungsankündigung\n\nCluster Technology e. K.\nEinzelkaufmann / Einzelkauffrau\nSonsbeck\n\nDas Registergericht beabsichtigt die Firma von Amts wegen nach § 31 Abs. 2 HGB, § 393 FamFG zu löschen. Die Frist zur Erhebung eines Widerspruchs ist auf einen Monat festgesetzt."
    },
    {
      "date": "2025-01-23",
      "id": "99426",
      "original_text": "Löschungsankündigung\nNordrhein-Westfalen Amtsgericht Düsseldorf HRB 77594\nNikumcom GmbH – Hilden",
      "type": "Löschungsankündigung",
      "state": "Nordrhein-Westfalen",
      "amtsgericht": "Amtsgericht Düsseldorf",
      "registernummer": "HRB 77594",
      "registerart": "HRB",
      "company_name": "Nikumcom GmbH",
      "company_seat": "Hilden",
      "details": "23.01.2025 (Bekanntmachungsdatum)\n\nNordrhein-Westfalen Amtsgericht Düsseldorf HRB 77594\nLöschungsankündigung\n\nNikumcom GmbH\nGesellschaft mit beschränkter Haftung\nHilden\n\nDas Registergericht beabsichtigt die Gesellschaft von Amts wegen nach § 394 Abs. 1 FamFG zu löschen. Die Frist zur Erhebung eines Widerspruchs ist auf 3 Wochen festgesetzt.\n\nRechtsbehelfsbelehrung:\nDas Widerspruchsrecht steht jedem zu, der an der Unterlassung der Löschung ein berechtigtes Interesse hat. Der Widerspruch ist bei dem Amtsgericht Düsseldorf -Registergericht-, Werdener Straße 1, 40227 Düsseldorf schriftlich in deutscher Sprache oder zur Niederschrift der Geschäftsstelle einzulegen. Der Widerspruch kann auch zur Niederschrift der Geschäftsstelle eines jeden Amtsgerichtes abgegeben werden. Die Einlegung ist auch durch Übertragung eines elektronischen Dokuments an die elektronische Poststelle des Gerichts möglich. Das elektronische Dokument muss für die Bearbeitung durch das Gericht geeignet und mit einer qualifizierten elektronischen Signatur der verantwortenden Person versehen sein oder von der verantwortenden Person signiert und auf einem sicheren Übermittlungsweg gemäß § 130a ZPO nach näherer Maßgabe der Verordnung über die technischen Rahmenbedingungen des elektronischen Rechtsverkehrs und über das besondere elektronische Behördenpostfach (BGBl. I, S.3803) eingereicht werden. Weitere Informationen erhalten Sie auf der Internetseite www.justiz.de.\nDer Widerspruch muss spätestens innerhalb der gesetzten Frist nach dem Datum der Bekanntmachung der Löschungsankündigung bei dem Amtsgericht - Registergericht - Düsseldorf eingegangen sein.  Dies gilt auch dann, wenn der Widerspruch zur Niederschrift der Geschäftsstelle eines anderen Amtsgerichtes abgegeben wurde. Die Frist beginnt mit dem Tage der Bekanntmachung der Löschungsankündigung in dem für die Bekanntmachung der Eintragungen in das Handelsregister bestimmten elektronischen Informations- und Kommunikationssystem nach § 10 des Handelsgesetzbuches. Fällt das Ende der Frist auf einen Sonntag, einen allgemeinen Feiertag oder Sonnabend, so endet die Frist mit Ablauf des nächsten Werktages.\nDer Widerspruch muss die Bezeichnung der angefochtenen Löschungsankündigung sowie die Erklärung enthalten, dass Widerspruch gegen diese Löschungsankündigung eingelegt wird. Er ist zu unterzeichnen und soll begründet werden."
    },
    {
      "date": "2025-01-23",
      "id": "99427",
      "original_text": "Löschungsankündigung\nNordrhein-Westfalen Amtsgericht Krefeld HRB 16227\nMilicevic Motors UG (haftungsbeschränkt) – Krefeld",
      "type": "Löschungsankündigung",
      "state": "Nordrhein-Westfalen",
      "amtsgericht": "Amtsgericht Krefeld",
      "registernummer": "HRB 16227",
      "registerart": "HRB",
      "company_name": "Milicevic Motors UG (haftungsbeschränkt)",
      "company_seat": "Krefeld",
      "details": "23.01.2025 (Bekanntmachungsdatum)\n\nNordrhein-Westfalen Amtsgericht Krefeld HRB 16227\nLöschungsankündigung\n\nMilicevic Motors UG (haftungsbeschränkt)\nGesellschaft mit beschränkter Haftung\nKrefeld\n\nDas Registergericht beabsichtigt die Gesellschaft von Amts wegen nach § 394 FamFG zu löschen. Die Frist zur Erhebung eines Widerspruchs ist auf einen Monat festgesetzt."
    },
    {
      "date": "2025-01-23",
      "id": "99428",
      "original_text": "Löschungsankündigung\nNordrhein-Westfalen Amtsgericht Mönchengladbach HRB 13005\nagilus personal service gmbh – Jüchen",
      "type": "Löschungsankündigung",
      "state": "Nordrhein-Westfalen",
      "amtsgericht": "Amtsgericht Mönchengladbach",
      "registernummer": "HRB 13005",
      "registerart": "HRB",
      "company_name": "agilus personal service gmbh",
      "company_seat": "Jüchen",
      "details": "23.01.2025 (Bekanntmachungsdatum)\n\nNordrhein-Westfalen Amtsgericht Mönchengladbach HRB 13005\nLöschungsankündigung\n\nagilus personal service gmbh\nGesellschaft mit beschränkter Haftung\nJüchen\n\nDas Registergericht beabsichtigt, die im Handelsregister eingetragene Gesellschaft gemäß § 394 Absatz 1 FamFG wegen Vermögenslosigkeit von Amts wegen zu löschen. Gegen diese Verfügung kann Widerspruch eingelegt werden. Die Frist zur Erhebung eines Widerspruchs gegen die beabsichtigte Löschung von Amts wegen ist auf drei Monate festgesetzt."
    },
    {
      "date": "2025-01-23",
      "id": "99429",
      "original_text": "Einreichung neuer Dokumente\nNordrhein-Westfalen Amtsgericht Köln HRB 623\nDelvag Versicherungs-AG – Köln",
      "type": "Einreichung neuer Dokumente",
      "state": "Nordrhein-Westfalen",
      "amtsgericht": "Amtsgericht Köln",
      "registernummer": "HRB 623",
      "registerart": "HRB",
      "company_name": "Delvag Versicherungs-AG",
      "company_seat": "Köln",
      "details": "23.01.2025 (Bekanntmachungsdatum)\n\nNordrhein-Westfalen Amtsgericht Köln HRB 623\nEinreichung neuer Dokumente\n\nDelvag Versicherungs-AG\nAktiengesellschaft\nKöln\n\nDem Registergericht ist eine Liste der Mitglieder des Aufsichtsrates eingereicht worden."
    },
    {
      "date": "2025-01-23",
      "id": "99430",
      "original_text": "Löschungsankündigung\nNordrhein-Westfalen Amtsgericht Steinfurt HRB 14422\nJG slaapconcepten GmbH – Rheine",
      "type": "Löschungsankündigung",
      "state": "Nordrhein-Westfalen",
      "amtsgericht": "Amtsgericht Steinfurt",
      "registernummer": "HRB 14422",
      "registerart": "HRB",
      "company_name": "JG slaapconcepten GmbH",
      "company_seat": "Rheine",
      "details": "23.01.2025 (Bekanntmachungsdatum)\n\nNordrhein-Westfalen Amtsgericht Steinfurt HRB 14422\nLöschungsankündigung\n\nJG slaapconcepten GmbH\nGesellschaft mit beschränkter Haftung\nRheine\n\nDas Registergericht beabsichtigt, die im Handelsregister eingetragene Gesellschaft gemäß § 394 Absatz 1 FamFG wegen Vermögenslosigkeit von Amts wegen zu löschen.\n\nGegen diese Verfügung kann Widerspruch eingelegt werden. Die Frist zur Erhebung eines Widerspruchs gegen die beabsichtigte Löschung von Amts wegen ist auf 6 Wochen festgesetzt.\n\nRechtsbehelfsbelehrung:\n\nGegen diese Verfügung können Sie Widerspruch einlegen.\n\nDer Widerspruch ist bei dem Amtsgericht Steinfurt, Gerichtstraße 2, 48565 Steinfurt schriftlich in deutscher Sprache oder zur Niederschrift der Geschäftsstelle einzulegen. Der Widerspruch kann auch zur Niederschrift der Geschäftsstelle eines jeden Amtsgerichtes abgegeben werden.\nDie Einlegung ist auch durch Übertragung eines elektronischen Dokuments an die elektronische Poststelle des Gerichts möglich. Das elektronische Dokument muss für die Bearbeitung durch das Gericht geeignet und mit einer qualifizierten elektronischen Signatur der verantwortenden Person versehen sein oder von der verantwortenden Person signiert und auf einem sicheren Übermittlungsweg gemäß § 130a ZPO nach näherer Maßgabe der Verordnung über die technischen Rahmenbedingungen des elektronischen Rechtsverkehrs und über das besondere elektronische Behördenpostfach (BGBl. I, S.3803) eingereicht werden. Weitere Informationen erhalten Sie auf der Internetseite www.justiz.de.\n\nDer Widerspruch muss spätestens innerhalb der gesetzten Frist bei dem Amtsgericht Steinfurt eingegangen sein. Dies gilt auch dann, wenn der Widerspruch zur Niederschrift der Geschäftsstelle eines anderen Amtsgerichtes abgegeben wurde. Die Frist beginnt mit der Veröffentlichung. Fällt das Ende der Frist auf einen Sonntag, einen allgemeinen Feiertag oder Sonnabend, so endet die Frist mit Ablauf des nächsten Werktages.\n\nDer Widerspruch muss die Bezeichnung der angefochtenen Verfügung sowie die Erklärung enthalten, dass Widerspruch gegen diese Verfügung eingelegt wird. Er ist zu unterzeichnen und soll begründet werden."
    },
    {
      "date": "2025-01-23",
      "id": "99431",
      "original_text": "Registerbekanntmachung nach dem Umwandlungsgesetz\nNordrhein-Westfalen Amtsgericht Lemgo HRB 702\nKerkhoff-Unternehmensberatungs-GmbH – Lemgo",
      "type": "Registerbekanntmachung nach dem Umwandlungsgesetz",
      "state": "Nordrhein-Westfalen",
      "amtsgericht": "Amtsgericht Lemgo",
      "registernummer": "HRB 702",
      "registerart": "HRB",
      "company_name": "Kerkhoff-Unternehmensberatungs-GmbH",
      "company_seat": "Lemgo",
      "details": "23.01.2025 (Bekanntmachungsdatum)\n\nNordrhein-Westfalen Amtsgericht Lemgo HRB 702\nRegisterbekanntmachung nach dem Umwandlungsgesetz 23.01.2025 (Eintragungsdatum)\n\nKerkhoff-Unternehmensberatungs-GmbH\nGesellschaft mit beschränkter Haftung\nLemgo\n\nDen Gläubigern der an der Verschmelzung beteiligten Rechtsträger ist, wenn sie binnen sechs Monaten nach dem Tag, an dem die Eintragung der Verschmelzung in das Register des Sitzes desjenigen Rechtsträgers, dessen Gläubiger sie sind, nach § 19 Absatz 3 UmwG als bekanntgemacht gilt, ihren Anspruch nach Grund und Höhe schriftlich anmelden, Sicherheit zu leisten, soweit sie nicht Befriedigung verlangen können. Dieses Recht steht den Gläubigern jedoch nur zu, wenn sie glaubhaft machen, dass durch die Verschmelzung die Erfüllung ihrer Forderung gefährdet wird."
    },
    {
      "date": "2025-01-23",
      "id": "99432",
      "original_text": "Registerbekanntmachung nach dem Umwandlungsgesetz\nNordrhein-Westfalen Amtsgericht Lemgo HRA 6432\nHeidemarie Kerkhoff e.K. – Lemgo",
      "type": "Registerbekanntmachung nach dem Umwandlungsgesetz",
      "state": "Nordrhein-Westfalen",
      "amtsgericht": "Amtsgericht Lemgo",
      "registernummer": "HRA 6432",
      "registerart": "HRA",
      "company_name": "Heidemarie Kerkhoff e.K.",
      "company_seat": "Lemgo",
      "details": "23.01.2025 (Bekanntmachungsdatum)\n\nNordrhein-Westfalen Amtsgericht Lemgo HRA 6432\nRegisterbekanntmachung nach dem Umwandlungsgesetz 23.01.2025 (Eintragungsdatum)\n\nHeidemarie Kerkhoff e.K.\nEinzelkaufmann / Einzelkauffrau\nLemgo\n\nDen Gläubigern der an der Verschmelzung beteiligten Rechtsträger ist, wenn sie binnen sechs Monaten nach dem Tag, an dem die Eintragung der Verschmelzung in das Register des Sitzes desjenigen Rechtsträgers, dessen Gläubiger sie sind, nach § 19 Absatz 3 UmwG als bekanntgemacht gilt, ihren Anspruch nach Grund und Höhe schriftlich anmelden, Sicherheit zu leisten, soweit sie nicht Befriedigung verlangen können. Dieses Recht steht den Gläubigern jedoch nur zu, wenn sie glaubhaft machen, dass durch die Verschmelzung die Erfüllung ihrer Forderung gefährdet wird."
    },
    {
      "date": "2025-01-23",
      "id": "99433",
      "original_text": "Einreichung neuer Dokumente\nNordrhein-Westfalen Amtsgericht Bad Oeynhausen HRB 5161\nMKB-MühlenkreisBus GmbH – Minden",
      "type": "Einreichung neuer Dokumente",
      "state": "Nordrhein-Westfalen",
      "amtsgericht": "Amtsgericht Bad Oeynhausen",
      "registernummer": "HRB 5161",
      "registerart": "HRB",
      "company_name": "MKB-MühlenkreisBus GmbH",
      "company_seat": "Minden",
      "details": "23.01.2025 (Bekanntmachungsdatum)\n\nNordrhein-Westfalen Amtsgericht Bad Oeynhausen HRB 5161\nEinreichung neuer Dokumente\n\nMKB-MühlenkreisBus GmbH\nGesellschaft mit beschränkter Haftung\nMinden\n\nDem Registergericht ist eine neue Liste der Mitglieder des Aufsichtsrates eingereicht worden."
    },
    {
      "date": "2025-01-23",
      "id": "99434",
      "original_text": "Einreichung neuer Dokumente\nNordrhein-Westfalen Amtsgericht Düsseldorf HRB 41241\nProvinzial Versicherung Aktiengesellschaft – Düsseldorf",
      "type": "Einreichung neuer Dokumente",
      "state": "Nordrhein-Westfalen",
      "amtsgericht": "Amtsgericht Düsseldorf",
      "registernummer": "HRB 41241",
      "registerart": "HRB",
      "company_name": "Provinzial Versicherung Aktiengesellschaft",
      "company_seat": "Düsseldorf",
      "details": "23.01.2025 (Bekanntmachungsdatum)\n\nNordrhein-Westfalen Amtsgericht Düsseldorf HRB 41241\nEinreichung neuer Dokumente\n\nProvinzial Versicherung Aktiengesellschaft\nAktiengesellschaft\nDüsseldorf\n\nDem Registergericht ist eine neue Liste der Mitglieder des Aufsichtsrates eingereicht worden."
    },
    {
      "date": "2025-01-23",
      "id": "99435",
      "original_text": "Registerbekanntmachung nach dem Umwandlungsgesetz\nNordrhein-Westfalen Amtsgericht Köln HRA 35411\nP + S Immobilien OHG – Hückeswagen",
      "type": "Registerbekanntmachung nach dem Umwandlungsgesetz",
      "state": "Nordrhein-Westfalen",
      "amtsgericht": "Amtsgericht Köln",
      "registernummer": "HRA 35411",
      "registerart": "HRA",
      "company_name": "P + S Immobilien OHG",
      "company_seat": "Hückeswagen",
      "details": "23.01.2025 (Bekanntmachungsdatum)\n\nNordrhein-Westfalen Amtsgericht Köln HRA 35411\nRegisterbekanntmachung nach dem Umwandlungsgesetz 23.01.2025 (Eintragungsdatum)\n\nP + S Immobilien OHG\nOffene Handelsgesellschaft\nHückeswagen\n\nDen Gläubigern der an der #DV.UmF(Text=\"Bitte wählen Sie die zutreffende Art nach UmwG aus!\",Eingabe=\"Verschmelzung\",\"Aufspaltung\",\"Abspaltung\",\"Ausgliederung\",\"Vermögensübertragung\",\"formwechselnden Umwandlung\") beteiligten Rechtsträger ist, wenn sie binnen sechs Monaten nach dem Tag, an dem die Eintragung der #DV.UmF in das Register des Sitzes #DV.RTr(Text=\"Bitte wählen Sie aus, ob ein oder mehrere andere Rechtsträger betroffen sind!\",Eingabe=\"desjenigen Rechtsträgers, dessen Gläubiger\",\"derjenigen Rechtsträger deren Gläubiger\") sie sind, nach § 19 Absatz 3 UmwG als bekanntgemacht gilt, ihren Anspruch nach Grund und Höhe schriftlich anmelden, Sicherheit zu leisten, soweit sie nicht Befriedigung verlangen können. Dieses Recht steht den Gläubigern jedoch nur zu, wenn sie glaubhaft machen, dass durch die #DV.UmF die Erfüllung ihrer Forderung gefährdet wird."
    },
    {
      "date": "2025-01-23",
      "id": "99436",
      "original_text": "Löschungsankündigung\nNordrhein-Westfalen Amtsgericht Wuppertal HRA 24459\nElektro Bogutzki GmbH & Co. KG – Remscheid",
      "type": "Löschungsankündigung",
      "state": "Nordrhein-Westfalen",
      "amtsgericht": "Amtsgericht Wuppertal",
      "registernummer": "HRA 24459",
      "registerart": "HRA",
      "company_name": "Elektro Bogutzki GmbH & Co. KG",
      "company_seat": "Remscheid",
      "details": "23.01.2025 (Bekanntmachungsdatum)\n\nNordrhein-Westfalen Amtsgericht Wuppertal HRA 24459\nLöschungsankündigung\n\nElektro Bogutzki GmbH & Co. KG\nKommanditgesellschaft\nRemscheid\n\nDas Registergericht beabsichtigt die Firma von Amts wegen nach § § 393,394 FamFG zu löschen. Die Frist zur Erhebung eines Widerspruchs ist auf drei Monate festgesetzt."
    },
    {
      "date": "2025-01-23",
      "id": "99437",
      "original_text": "Löschungsankündigung\nNordrhein-Westfalen Amtsgericht Wuppertal HRB 17878\nARISTON Apparatebau GmbH – Velbert",
      "type": "Löschungsankündigung",
      "state": "Nordrhein-Westfalen",
      "amtsgericht": "Amtsgericht Wuppertal",
      "registernummer": "HRB 17878",
      "registerart": "HRB",
      "company_name": "ARISTON Apparatebau GmbH",
      "company_seat": "Velbert",
      "details": "23.01.2025 (Bekanntmachungsdatum)\n\nNordrhein-Westfalen Amtsgericht Wuppertal HRB 17878\nLöschungsankündigung 22.01.2025 (Eintragungsdatum)\n\nARISTON Apparatebau GmbH\nGesellschaft mit beschränkter Haftung\nVelbert\n\nDas Registergericht beabsichtigt die Gesellschaft von Amts wegen nach § 394 FamFG zu löschen. Die Frist zur Erhebung eines Widerspruchs ist auf einen Monat festgesetzt."
    },
    {
      "date": "2025-01-23",
      "id": "99438",
      "original_text": "Einreichung neuer Dokumente\nNordrhein-Westfalen Amtsgericht Bochum HRB 18610\nDRK-Pflegedienste in Witten gemeinnützige GmbH – Witten",
      "type": "Einreichung neuer Dokumente",
      "state": "Nordrhein-Westfalen",
      "amtsgericht": "Amtsgericht Bochum",
      "registernummer": "HRB 18610",
      "registerart": "HRB",
      "company_name": "DRK-Pflegedienste in Witten gemeinnützige GmbH",
      "company_seat": "Witten",
      "details": "23.01.2025 (Bekanntmachungsdatum)\n\nNordrhein-Westfalen Amtsgericht Bochum HRB 18610\nEinreichung neuer Dokumente\n\nDRK-Pflegedienste in Witten gemeinnützige GmbH\nGesellschaft mit beschränkter Haftung\nWitten\n\nDem Registergericht ist eine neue Liste der Mitglieder des Aufsichtsrates eingereicht worden."
    },
    {
      "date": "2025-01-23",
      "id": "99439",
      "original_text": "Einreichung neuer Dokumente\nNordrhein-Westfalen Amtsgericht Düsseldorf HRB 107495\nKloeckner Metals Germany GmbH – Düsseldorf",
      "type": "Einreichung neuer Dokumente",
      "state": "Nordrhein-Westfalen",
      "amtsgericht": "Amtsgericht Düsseldorf",
      "registernummer": "HRB 107495",
      "registerart": "HRB",
      "company_name": "Kloeckner Metals Germany GmbH",
      "company_seat": "Düsseldorf",
      "details": "23.01.2025 (Bekanntmachungsdatum)\n\nNordrhein-Westfalen Amtsgericht Düsseldorf HRB 107495\nEinreichung neuer Dokumente\n\nKloeckner Metals Germany GmbH\nGesellschaft mit beschränkter Haftung\nDüsseldorf\n\nDem Registergericht ist eine Liste der Mitglieder des Aufsichtsrates eingereicht worden."
    },
    {
      "date": "2025-01-23",
      "id": "99440",
      "original_text": "Löschungsankündigung\nNordrhein-Westfalen Amtsgericht Duisburg HRB 36324\nToniban UG (haftungsbeschränkt) – Oberhausen",
      "type": "Löschungsankündigung",
      "state": "Nordrhein-Westfalen",
      "amtsgericht": "Amtsgericht Duisburg",
      "registernummer": "HRB 36324",
      "registerart": "HRB",
      "company_name": "Toniban UG (haftungsbeschränkt)",
      "company_seat": "Oberhausen",
      "details": "23.01.2025 (Bekanntmachungsdatum)\n\nNordrhein-Westfalen Amtsgericht Duisburg HRB 36324\nLöschungsankündigung\n\nToniban UG (haftungsbeschränkt)\nGesellschaft mit beschränkter Haftung\nOberhausen\n\nDas Registergericht beabsichtigt, die im Handelsregister eingetragene Gesellschaft Toniban UG (haftungsbeschränkt) gemäß § 394 Absatz 1 FamFG wegen Vermögenslosigkeit von Amts wegen zu löschen. Gegen diese Verfügung kann Widerspruch eingelegt werden. Die Frist zur Erhebung eines Widerspruchs gegen die beabsichtigte Löschung von Amts wegen ist auf drei Monate festgesetzt. Rechtsbehelfsbelehrung Der Widerspruch ist bei dem Amtsgericht Duisburg, Kardinal-Galen-Str. 124-132, 47058 Duisburg schriftlich in deutscher Sprache oder zur Niederschrift der Geschäftsstelle einzulegen. Der Widerspruch kann auch zur Niederschrift der Geschäftsstelle eines jeden Amtsgerichtes abgegeben werden. Die Einlegung ist auch durch Übertragung eines elektronischen Dokuments an die elektronische Poststelle des Gerichts möglich. Das elektronische Dokument muss für die Bearbeitung durch das Gericht geeignet und mit einer qualifizierten elektronischen Signatur der verantwortenden Person versehen sein oder von der verantwortenden Person signiert und auf einem sicheren Übermittlungsweg gemäß § 130 a ZPO nach näherer Maßgabe der Verordnung über die technischen Rahmenbedingungen des elektronischen Rechtsverkehrs und über das besondere elektronische Behördenpostfach (BGBl. I, S. 3803) eingereicht werden. Weitere Informationen erhalten Sie auf der Internetseite www.justiz.de <http://www.justiz.de>. Der Widerspruch muss spätestens innerhalb der gesetzten Frist bei dem Amtsgericht Duisburg eingegangen sein. Dies gilt auch dann, wenn der Widerspruch zur Niederschrift der Geschäftsstelle eines anderen Amtsgerichtes abgegeben wurde. Die Frist beginnt mit der Veröffentlichung. Fällt das Ende der Frist auf einen Sonntag, einen allgemeinen Feiertag oder Sonnabend, so endet die Frist mit Ablauf des nächsten Werktages. Der Widerspruch muss die Bezeichnung der angefochtenen Verfügung sowie die Erklärung enthalten, dass Widerspruch gegen diese Verfügung eingelegt wird. Er ist zu unterzeichnen und soll begründet werden."
    },
    {
      "date": "2025-01-23",
      "id": "99441",
      "original_text": "Löschungsankündigung\nNordrhein-Westfalen Amtsgericht Köln HRB 118532\nGerhard Menzel GmbH – Leverkusen",
      "type": "Löschungsankündigung",
      "state": "Nordrhein-Westfalen",
      "amtsgericht": "Amtsgericht Köln",
      "registernummer": "HRB 118532",
      "registerart": "HRB",
      "company_name": "Gerhard Menzel GmbH",
      "company_seat": "Leverkusen",
      "details": "23.01.2025 (Bekanntmachungsdatum)\n\nNordrhein-Westfalen Amtsgericht Köln HRB 118532\nLöschungsankündigung\n\nGerhard Menzel GmbH\nGesellschaft mit beschränkter Haftung\nLeverkusen\n\nDas Registergericht beabsichtigt die Gesellschaft von Amts wegen nach § 394 FamFG zu löschen. Die Frist zur Erhebung eines Widerspruchs ist auf einen Monat festgesetzt."
    },
    {
      "date": "2025-01-23",
      "id": "99442",
      "original_text": "Löschungsankündigung\nNordrhein-Westfalen Amtsgericht Wuppertal HRB 28219\nsmallchek GmbH – Wuppertal",
      "type": "Löschungsankündigung",
      "state": "Nordrhein-Westfalen",
      "amtsgericht": "Amtsgericht Wuppertal",
      "registernummer": "HRB 28219",
      "registerart": "HRB",
      "company_name": "smallchek GmbH",
      "company_seat": "Wuppertal",
      "details": "23.01.2025 (Bekanntmachungsdatum)\n\nNordrhein-Westfalen Amtsgericht Wuppertal HRB 28219\nLöschungsankündigung 22.01.2025 (Eintragungsdatum)\n\nsmallchek GmbH\nGesellschaft mit beschränkter Haftung\nWuppertal\n\nDas Registergericht beabsichtigt die Gesellschaft von Amts wegen nach § 394 FamFG zu löschen. Die Frist zur Erhebung eines Widerspruchs ist auf einen Monat festgesetzt."
    },
    {
      "date": "2025-01-23",
      "id": "99443",
      "original_text": "Löschungsankündigung\nThüringen Amtsgericht Jena HRB 514251\nPutz- & Ausbau Manfred Hahn UG (haftungsbeschränkt) – Buttlar",
      "type": "Löschungsankündigung",
      "state": "Thüringen",
      "amtsgericht": "Amtsgericht Jena",
      "registernummer": "HRB 514251",
      "registerart": "HRB",
      "company_name": "Putz- & Ausbau Manfred Hahn UG (haftungsbeschränkt)",
      "company_seat": "Buttlar",
      "details": "23.01.2025 (Bekanntmachungsdatum)\n\nThüringen Amtsgericht Jena HRB 514251\nLöschungsankündigung\n\nPutz- & Ausbau Manfred Hahn UG (haftungsbeschränkt)\nGesellschaft mit beschränkter Haftung\nButtlar\n\nDas Registergericht beabsichtigt, die im Handelsregister eingetragene Gesellschaft wegen Vermögenslosigkeit nach § 394 FamFG von Amts wegen zu löschen. Die Frist zur Erhebung eines Widerspruchs gegen die beabsichtigte Löschung wird auf 6 Wochen festgesetzt."
    },
    {
      "date": "2025-01-23",
      "id": "99444",
      "original_text": "Einreichung neuer Dokumente\nHessen Amtsgericht Wiesbaden HRB 31192\nCHEMIE Pensionsfonds AG – Wiesbaden",
      "type": "Einreichung neuer Dokumente",
      "state": "Hessen",
      "amtsgericht": "Amtsgericht Wiesbaden",
      "registernummer": "HRB 31192",
      "registerart": "HRB",
      "company_name": "CHEMIE Pensionsfonds AG",
      "company_seat": "Wiesbaden",
      "details": "23.01.2025 (Bekanntmachungsdatum)\n\nHessen Amtsgericht Wiesbaden HRB 31192\nEinreichung neuer Dokumente 23.01.2025 (Eintragungsdatum)\n\nCHEMIE Pensionsfonds AG\nAktiengesellschaft\nWiesbaden\n\nDurch eine Änderung in den Personen der Aufsichtsratsmitglieder ist eine Liste der Mitglieder des Aufsichtsrates zum Handelsregister eingereicht worden."
    },
    {
      "date": "2025-01-23",
      "id": "99445",
      "original_text": "Registerbekanntmachung nach dem Umwandlungsgesetz\nHessen Amtsgericht Frankfurt am Main HRB 122690\nPluto HoldCo GmbH – Frankfurt am Main",
      "type": "Registerbekanntmachung nach dem Umwandlungsgesetz",
      "state": "Hessen",
      "amtsgericht": "Amtsgericht Frankfurt am Main",
      "registernummer": "HRB 122690",
      "registerart": "HRB",
      "company_name": "Pluto HoldCo GmbH",
      "company_seat": "Frankfurt am Main",
      "details": "23.01.2025 (Bekanntmachungsdatum)\n\nHessen Amtsgericht Frankfurt am Main HRB 122690\nRegisterbekanntmachung nach dem Umwandlungsgesetz 23.01.2025 (Eintragungsdatum)\n\nPluto HoldCo GmbH\nGesellschaft mit beschränkter Haftung\nFrankfurt am Main\n\nDen Gläubigern der an der Verschmelzung beteiligten Rechtsträger ist, wenn sie binnen sechs Monaten nach dem Tag, an dem die Eintragung der Verschmelzung in das Register des Sitzes desjenigen Rechtsträgers, dessen Gläubiger sie sind, nach § 19 Absatz 3 UmwG bekannt gemacht worden ist, ihren Anspruch nach Grund und Höhe schriftlich anmelden, Sicherheit zu leisten, soweit sie nicht Befriedigung verlangen können. Dieses Recht steht den Gläubigern jedoch nur zu, wenn sie glaubhaft machen, dass durch die Verschmelzung die Erfüllung ihrer Forderung gefährdet wird."
    },
    {
      "date": "2025-01-23",
      "id": "99446",
      "original_text": "Sonstige Registerbekanntmachung\nHessen Amtsgericht Offenbach am Main VR 2055\nIntegrativer Reit- und Fahrverein Dietzenbach-Hexenberg – Dietzenbach",
      "type": "Sonstige Registerbekanntmachung",
      "state": "Hessen",
      "amtsgericht": "Amtsgericht Offenbach am Main",
      "registernummer": "VR 2055",
      "registerart": "VR",
      "company_name": "Integrativer Reit- und Fahrverein Dietzenbach-Hexenberg",
      "company_seat": "Dietzenbach",
      "details": "23.01.2025 (Bekanntmachungsdatum)\n\nHessen Amtsgericht Offenbach am Main VR 2055\nSonstige Registerbekanntmachung 23.01.2025 (Eintragungsdatum)\n\nIntegrativer Reit- und Fahrverein Dietzenbach-Hexenberg\neingetragener Verein\nDietzenbach\n\nDer Verein ist aufgelöst."
    },
    {
      "date": "2025-01-23",
      "id": "99447",
      "original_text": "Sonstige Registerbekanntmachung\nHessen Amtsgericht Marburg HRB 5326\nViessmann Werke Allendorf GmbH – Allendorf (Eder)",
      "type": "Sonstige Registerbekanntmachung",
      "state": "Hessen",
      "amtsgericht": "Amtsgericht Marburg",
      "registernummer": "HRB 5326",
      "registerart": "HRB",
      "company_name": "Viessmann Werke Allendorf GmbH",
      "company_seat": "Allendorf (Eder)",
      "details": "23.01.2025 (Bekanntmachungsdatum)\n\nHessen Amtsgericht Marburg HRB 5326\nSonstige Registerbekanntmachung 23.01.2025 (Eintragungsdatum)\n\nViessmann Werke Allendorf GmbH\nGesellschaft mit beschränkter Haftung\nAllendorf (Eder)\n\nDen Gläubigern der Gesellschaft, deren Forderungen begründet worden sind, bevor die Eintragung der Beendigung des Vertrags in das Handelsregister nach § 10 HGB bekannt gemacht worden ist, ist vom anderen Vertragsteil Sicherheit zu leisten, wenn sie sich binnen sechs Monaten nach dieser Bekanntmachung zu diesem Zweck bei ihm melden."
    },
    {
      "date": "2025-01-23",
      "id": "99448",
      "original_text": "Sonstige Registerbekanntmachung\nHessen Amtsgericht Wetzlar HRB 159\nKüster Automotive GmbH – Ehringshausen",
      "type": "Sonstige Registerbekanntmachung",
      "state": "Hessen",
      "amtsgericht": "Amtsgericht Wetzlar",
      "registernummer": "HRB 159",
      "registerart": "HRB",
      "company_name": "Küster Automotive GmbH",
      "company_seat": "Ehringshausen",
      "details": "23.01.2025 (Bekanntmachungsdatum)\n\nHessen Amtsgericht Wetzlar HRB 159\nSonstige Registerbekanntmachung\n\nKüster Automotive GmbH\nGesellschaft mit beschränkter Haftung\nEhringshausen\n\nDurch eine Änderung in den Personen der Aufsichtsratsmitglieder ist eine Liste der Mitglieder des Aufsichtsrates zum Handelsregister eingereicht worden."
    },
    {
      "date": "2025-01-23",
      "id": "99449",
      "original_text": "Löschungsankündigung\nHessen Amtsgericht Frankfurt am Main HRB 118252\nAlfa Reinigung UG (haftungsbeschränkt) – Bad Vilbel",
      "type": "Löschungsankündigung",
      "state": "Hessen",
      "amtsgericht": "Amtsgericht Frankfurt am Main",
      "registernummer": "HRB 118252",
      "registerart": "HRB",
      "company_name": "Alfa Reinigung UG (haftungsbeschränkt)",
      "company_seat": "Bad Vilbel",
      "details": "23.01.2025 (Bekanntmachungsdatum)\n\nHessen Amtsgericht Frankfurt am Main HRB 118252\nLöschungsankündigung\n\nAlfa Reinigung UG (haftungsbeschränkt)\nGesellschaft mit beschränkter Haftung\nBad Vilbel\n\nDas Registergericht beabsichtigt die im Handelsregister eingetragene Gesellschaft von Amts wegen nach § 394 FamFG zu löschen. Die Frist zur Erhebung eines Widerspruchs gegen die beabsichtigte Löschung wird auf 1 Monat festgesetzt."
    },
    {
      "date": "2025-01-23",
      "id": "99450",
      "original_text": "Registerbekanntmachung nach dem Umwandlungsgesetz\nHessen Amtsgericht Darmstadt HRB 100536\nSupport Africa gGmbH – Weiterstadt",
      "type": "Registerbekanntmachung nach dem Umwandlungsgesetz",
      "state": "Hessen",
      "amtsgericht": "Amtsgericht Darmstadt",
      "registernummer": "HRB 100536",
      "registerart": "HRB",
      "company_name": "Support Africa gGmbH",
      "company_seat": "Weiterstadt",
      "details": "23.01.2025 (Bekanntmachungsdatum)\n\nHessen Amtsgericht Darmstadt HRB 100536\nRegisterbekanntmachung nach dem Umwandlungsgesetz 23.01.2025 (Eintragungsdatum)\n\nSupport Africa gGmbH\nGesellschaft mit beschränkter Haftung\nWeiterstadt"
    },
    {
      "date": "2025-01-23",
      "id": "99451",
      "original_text": "Löschungsankündigung\nHessen Amtsgericht Hanau HRA 4819\nCity-Reisebüro Inh. Gerhard Buzilowski – Hanau",
      "type": "Löschungsankündigung",
      "state": "Hessen",
      "amtsgericht": "Amtsgericht Hanau",
      "registernummer": "HRA 4819",
      "registerart": "HRA",
      "company_name": "City-Reisebüro Inh. Gerhard Buzilowski",
      "company_seat": "Hanau",
      "details": "23.01.2025 (Bekanntmachungsdatum)\n\nHessen Amtsgericht Hanau HRA 4819\nLöschungsankündigung\n\nCity-Reisebüro Inh. Gerhard Buzilowski\nEinzelkaufmann / Einzelkauffrau\nHanau\n\nDas Registergericht beabsichtigt die im Handelsregister eingetragene Firma von Amts wegen nach § 31 Abs. 2 HGB zu löschen. Die Frist zur Erhebung eines Widerspruchs gegen die beabsichtigte Löschung wird auf 3 Monate festgesetzt."
    },
    {
      "date": "2025-01-23",
      "id": "99452",
      "original_text": "Sonstige Registerbekanntmachung\nHessen Amtsgericht Bad Hersfeld VR 1963\nNiederellenbacher See e. V. – Alheim",
      "type": "Sonstige Registerbekanntmachung",
      "state": "Hessen",
      "amtsgericht": "Amtsgericht Bad Hersfeld",
      "registernummer": "VR 1963",
      "registerart": "VR",
      "company_name": "Niederellenbacher See e. V.",
      "company_seat": "Alheim",
      "details": "23.01.2025 (Bekanntmachungsdatum)\n\nHessen Amtsgericht Bad Hersfeld VR 1963\nSonstige Registerbekanntmachung 23.01.2025 (Eintragungsdatum)\n\nNiederellenbacher See e. V.\neingetragener Verein\nAlheim\n\nDer Verein ist aufgelöst."
    },
    {
      "date": "2025-01-23",
      "id": "99453",
      "original_text": "Löschungsankündigung\nHessen Amtsgericht Darmstadt HRB 100266\nPCG GmbH – Rüsselsheim",
      "type": "Löschungsankündigung",
      "state": "Hessen",
      "amtsgericht": "Amtsgericht Darmstadt",
      "registernummer": "HRB 100266",
      "registerart": "HRB",
      "company_name": "PCG GmbH",
      "company_seat": "Rüsselsheim",
      "details": "23.01.2025 (Bekanntmachungsdatum)\n\nHessen Amtsgericht Darmstadt HRB 100266\nLöschungsankündigung 23.01.2025 (Eintragungsdatum)\n\nPCG GmbH\nGesellschaft mit beschränkter Haftung\nRüsselsheim\n\nDas Registergericht beabsichtigt die im Handelsregister eingetragene Gesellschaft von Amts wegen nach § 394 FamFG zu löschen. Die Frist zur Erhebung eines Widerspruchs gegen die beabsichtigte Löschung wird auf 3 Monate festgesetzt."
    },
    {
      "date": "2025-01-23",
      "id": "99454",
      "original_text": "Löschungsankündigung\nHessen Amtsgericht Frankfurt am Main HRB 104942\nSPOME GmbH – Frankfurt am Main",
      "type": "Löschungsankündigung",
      "state": "Hessen",
      "amtsgericht": "Amtsgericht Frankfurt am Main",
      "registernummer": "HRB 104942",
      "registerart": "HRB",
      "company_name": "SPOME GmbH",
      "company_seat": "Frankfurt am Main",
      "details": "23.01.2025 (Bekanntmachungsdatum)\n\nHessen Amtsgericht Frankfurt am Main HRB 104942\nLöschungsankündigung 23.01.2025 (Eintragungsdatum)\n\nSPOME GmbH\nGesellschaft mit beschränkter Haftung\nFrankfurt am Main\n\nDas Registergericht beabsichtigt die im Handelsregister eingetragene Gesellschaft von Amts wegen nach § 394 FamFG zu löschen. Die Frist zur Erhebung eines Widerspruchs gegen die beabsichtigte Löschung wird auf 1 Monat festgesetzt."
    },
    {
      "date": "2025-01-23",
      "id": "99455",
      "original_text": "Registerbekanntmachung nach dem Umwandlungsgesetz\nHessen Amtsgericht Darmstadt HRB 96108\nADRA gGmbH – Weiterstadt",
      "type": "Registerbekanntmachung nach dem Umwandlungsgesetz",
      "state": "Hessen",
      "amtsgericht": "Amtsgericht Darmstadt",
      "registernummer": "HRB 96108",
      "registerart": "HRB",
      "company_name": "ADRA gGmbH",
      "company_seat": "Weiterstadt",
      "details": "23.01.2025 (Bekanntmachungsdatum)\n\nHessen Amtsgericht Darmstadt HRB 96108\nRegisterbekanntmachung nach dem Umwandlungsgesetz 23.01.2025 (Eintragungsdatum)\n\nADRA gGmbH\nGesellschaft mit beschränkter Haftung\nWeiterstadt\n\nDen Gläubigern der an der Verschmelzung beteiligten Rechtsträger ist, wenn sie binnen sechs Monaten nach dem Tag, an dem die Eintragung der Verschmelzung in das Register des Sitzes desjenigen Rechtsträgers, dessen Gläubiger sie sind, nach § 19 Absatz 3 UmwG bekannt gemacht worden ist, ihren Anspruch nach Grund und Höhe schriftlich anmelden, Sicherheit zu leisten, soweit sie nicht Befriedigung verlangen können. Dieses Recht steht den Gläubigern jedoch nur zu, wenn sie glaubhaft machen, dass durch die Verschmelzung die Erfüllung ihrer Forderung gefährdet wird."
    },
    {
      "date": "2025-01-23",
      "id": "99456",
      "original_text": "Registerbekanntmachung nach dem Umwandlungsgesetz\nHessen Amtsgericht Frankfurt am Main HRB 122578\nPluto BidCo GmbH – Frankfurt am Main",
      "type": "Registerbekanntmachung nach dem Umwandlungsgesetz",
      "state": "Hessen",
      "amtsgericht": "Amtsgericht Frankfurt am Main",
      "registernummer": "HRB 122578",
      "registerart": "HRB",
      "company_name": "Pluto BidCo GmbH",
      "company_seat": "Frankfurt am Main",
      "details": "23.01.2025 (Bekanntmachungsdatum)\n\nHessen Amtsgericht Frankfurt am Main HRB 122578\nRegisterbekanntmachung nach dem Umwandlungsgesetz 23.01.2025 (Eintragungsdatum)\n\nPluto BidCo GmbH\nGesellschaft mit beschränkter Haftung\nFrankfurt am Main\n\nDen Gläubigern der an der Verschmelzung beteiligten Rechtsträger ist, wenn sie binnen sechs Monaten nach dem Tag, an dem die Eintragung der Verschmelzung in das Register des Sitzes desjenigen Rechtsträgers, dessen Gläubiger sie sind, nach § 19 Absatz 3 UmwG bekannt gemacht worden ist, ihren Anspruch nach Grund und Höhe schriftlich anmelden, Sicherheit zu leisten, soweit sie nicht Befriedigung verlangen können. Dieses Recht steht den Gläubigern jedoch nur zu, wenn sie glaubhaft machen, dass durch die Verschmelzung die Erfüllung ihrer Forderung gefährdet wird."
    },
    {
      "date": "2025-01-23",
      "id": "99457",
      "original_text": "Registerbekanntmachung nach dem Umwandlungsgesetz\nHessen Amtsgericht Gießen HRA 5479\nMK Versuchsanlagen GmbH & Co. KG – Mücke",
      "type": "Registerbekanntmachung nach dem Umwandlungsgesetz",
      "state": "Hessen",
      "amtsgericht": "Amtsgericht Gießen",
      "registernummer": "HRA 5479",
      "registerart": "HRA",
      "company_name": "MK Versuchsanlagen GmbH & Co. KG",
      "company_seat": "Mücke",
      "details": "23.01.2025 (Bekanntmachungsdatum)\n\nHessen Amtsgericht Gießen HRA 5479\nRegisterbekanntmachung nach dem Umwandlungsgesetz 23.01.2025 (Eintragungsdatum)\n\nMK Versuchsanlagen GmbH & Co. KG\nKommanditgesellschaft\nMücke\n\nDen Gläubigern der an der Ausgliederung beteiligten Rechtsträger ist, wenn sie binnen sechs Monaten nach dem Tag, an dem die Eintragung der Ausgliederung in das Register des Sitzes desjenigen Rechtsträgers, dessen Gläubiger sie sind, nach §§ 125, 19 Absatz 3 UmwG bekannt gemacht worden ist, ihren Anspruch nach Grund und Höhe schriftlich anmelden, Sicherheit zu leisten, soweit sie nicht Befriedigung verlangen können. Dieses Recht steht den Gläubigern jedoch nur zu, wenn sie glaubhaft machen, dass durch die Ausgliederung die Erfüllung ihrer Forderung gefährdet wird."
    },
    {
      "date": "2025-01-23",
      "id": "99458",
      "original_text": "Registerbekanntmachung nach dem Umwandlungsgesetz\nHessen Amtsgericht Gießen HRA 4842\nMK-Versuchsanlagen und Laborbedarf e.K. Inh.: Michael Keil – Mücke",
      "type": "Registerbekanntmachung nach dem Umwandlungsgesetz",
      "state": "Hessen",
      "amtsgericht": "Amtsgericht Gießen",
      "registernummer": "HRA 4842",
      "registerart": "HRA",
      "company_name": "MK-Versuchsanlagen und Laborbedarf e.K. Inh.: Michael Keil",
      "company_seat": "Mücke",
      "details": "23.01.2025 (Bekanntmachungsdatum)\n\nHessen Amtsgericht Gießen HRA 4842\nRegisterbekanntmachung nach dem Umwandlungsgesetz 23.01.2025 (Eintragungsdatum)\n\nMK-Versuchsanlagen und Laborbedarf e.K. Inh.: Michael Keil\nEinzelkaufmann / Einzelkauffrau\nMücke\n\nDen Gläubigern der an der Ausgliederung beteiligten Rechtsträger ist, wenn sie binnen sechs Monaten nach dem Tag, an dem die Eintragung der Ausgliederung in das Register des Sitzes desjenigen Rechtsträgers, dessen Gläubiger sie sind, nach §§ 125, 19 Absatz 3 UmwG bekannt gemacht worden ist, ihren Anspruch nach Grund und Höhe schriftlich anmelden, Sicherheit zu leisten, soweit sie nicht Befriedigung verlangen können. Dieses Recht steht den Gläubigern jedoch nur zu, wenn sie glaubhaft machen, dass durch die Ausgliederung die Erfüllung ihrer Forderung gefährdet wird."
    },
    {
      "date": "2025-01-23",
      "id": "99459",
      "original_text": "Einreichung neuer Dokumente\nHessen Amtsgericht Offenbach am Main HRB 55740\nKARL MAYER Holding Management SE – Obertshausen",
      "type": "Einreichung neuer Dokumente",
      "state": "Hessen",
      "amtsgericht": "Amtsgericht Offenbach am Main",
      "registernummer": "HRB 55740",
      "registerart": "HRB",
      "company_name": "KARL MAYER Holding Management SE",
      "company_seat": "Obertshausen",
      "details": "23.01.2025 (Bekanntmachungsdatum)\n\nHessen Amtsgericht Offenbach am Main HRB 55740\nEinreichung neuer Dokumente 23.01.2025 (Eintragungsdatum)\n\nKARL MAYER Holding Management SE\nEuropäische Aktiengesellschaft (SE)\nObertshausen\n\nDurch eine Änderung in den Personen der Aufsichtsratsmitglieder ist eine Liste der Mitglieder des Aufsichtsrates zum Handelsregister eingereicht worden."
    },
    {
      "date": "2025-01-23",
      "id": "99460",
      "original_text": "Löschungsankündigung\nHessen Amtsgericht Darmstadt HRB 95024\nDepreal Informationstechnik GmbH – Darmstadt",
      "type": "Löschungsankündigung",
      "state": "Hessen",
      "amtsgericht": "Amtsgericht Darmstadt",
      "registernummer": "HRB 95024",
      "registerart": "HRB",
      "company_name": "Depreal Informationstechnik GmbH",
      "company_seat": "Darmstadt",
      "details": "23.01.2025 (Bekanntmachungsdatum)\n\nHessen Amtsgericht Darmstadt HRB 95024\nLöschungsankündigung 23.01.2025 (Eintragungsdatum)\n\nDepreal Informationstechnik GmbH\nGesellschaft mit beschränkter Haftung\nDarmstadt\n\nDas Registergericht beabsichtigt die im Handelsregister eingetragene Gesellschaft von Amts wegen nach § 394 FamFG zu löschen. Die Frist zur Erhebung eines Widerspruchs gegen die beabsichtigte Löschung wird auf 3 Monate festgesetzt."
    }
  ]
}