{
  "date": "2025-01-18",
  "date_of_scrape": "2025-01-19T04:02:58.688Z",
  "tool_version": "0.2.0",
  "number_of_announcements": 21,
  "announcements": [
    {
      "date": "2025-01-18",
      "id": "98947",
      "original_text": "Löschungsankündigung\nBayern Amtsgericht München HRB 257094\nHerlitschke Consulting UG (haftungsbeschränkt) – München",
      "type": "Löschungsankündigung",
      "state": "Bayern",
      "amtsgericht": "Amtsgericht München",
      "registernummer": "HRB 257094",
      "registerart": "HRB",
      "company_name": "Herlitschke Consulting UG (haftungsbeschränkt)",
      "company_seat": "München",
      "details": "18.01.2025 (Bekanntmachungsdatum)\n\nBayern Amtsgericht München HRB 257094\nLöschungsankündigung\n\nHerlitschke Consulting UG (haftungsbeschränkt)\nGesellschaft mit beschränkter Haftung\nMünchen\n\nDas Registergericht beabsichtigt, die im Handelsregister eingetragene Gesellschaft wegen Vermögenslosigkeit von Amts wegen nach § 394 FamFG zu löschen. Die Frist zur Erhebung eines Widerspruchs ist auf drei Monate festgesetzt."
    },
    {
      "date": "2025-01-18",
      "id": "98948",
      "original_text": "Registerbekanntmachung nach dem Umwandlungsgesetz\nBayern Amtsgericht München HRB 170730\nREMONDIS Süd GmbH – München",
      "type": "Registerbekanntmachung nach dem Umwandlungsgesetz",
      "state": "Bayern",
      "amtsgericht": "Amtsgericht München",
      "registernummer": "HRB 170730",
      "registerart": "HRB",
      "company_name": "REMONDIS Süd GmbH",
      "company_seat": "München",
      "details": "18.01.2025 (Bekanntmachungsdatum)\n\nBayern Amtsgericht München HRB 170730\nRegisterbekanntmachung nach dem Umwandlungsgesetz 17.01.2025 (Eintragungsdatum)\n\nREMONDIS Süd GmbH\nGesellschaft mit beschränkter Haftung\nMünchen\n\nDen Gläubigern der an der Verschmelzung beteiligten Rechtsträger ist, wenn sie binnen sechs Monaten nach dem Tag, an dem die Eintragung der Verschmelzung in das Register des Sitzes desjenigen Rechtsträgers, dessen Gläubiger sie sind, nach § 19 Abs. 3 UmwG als bekannt gemacht gilt, ihren Anspruch nach Grund und Höhe in Textform anmelden, Sicherheit zu leisten, soweit sie nicht Befriedigung verlangen können. Dieses Recht steht den Gläubigern jedoch nur zu, wenn sie glaubhaft machen, dass durch die Verschmelzung die Erfüllung ihrer Forderung gefährdet wird."
    },
    {
      "date": "2025-01-18",
      "id": "98949",
      "original_text": "Löschungsankündigung\nBayern Amtsgericht München HRB 193638\nCEO advise GmbH – Forstern",
      "type": "Löschungsankündigung",
      "state": "Bayern",
      "amtsgericht": "Amtsgericht München",
      "registernummer": "HRB 193638",
      "registerart": "HRB",
      "company_name": "CEO advise GmbH",
      "company_seat": "Forstern",
      "details": "18.01.2025 (Bekanntmachungsdatum)\n\nBayern Amtsgericht München HRB 193638\nLöschungsankündigung 17.01.2025 (Eintragungsdatum)\n\nCEO advise GmbH\nGesellschaft mit beschränkter Haftung\nForstern\n\nDas Registergericht beabsichtigt, die im Handelsregister eingetragene Gesellschaft wegen Vermögenslosigkeit von Amts wegen nach § 394 FamFG zu löschen. Die Frist zur Erhebung eines Widerspruchs ist auf drei Monate festgesetzt."
    },
    {
      "date": "2025-01-18",
      "id": "98950",
      "original_text": "Registerbekanntmachung nach dem Umwandlungsgesetz\nBayern Amtsgericht München HRB 257413\nStartup Communication GmbH – München",
      "type": "Registerbekanntmachung nach dem Umwandlungsgesetz",
      "state": "Bayern",
      "amtsgericht": "Amtsgericht München",
      "registernummer": "HRB 257413",
      "registerart": "HRB",
      "company_name": "Startup Communication GmbH",
      "company_seat": "München",
      "details": "18.01.2025 (Bekanntmachungsdatum)\n\nBayern Amtsgericht München HRB 257413\nRegisterbekanntmachung nach dem Umwandlungsgesetz 17.01.2025 (Eintragungsdatum)\n\nStartup Communication GmbH\nGesellschaft mit beschränkter Haftung\nMünchen\n\nDen Gläubigern der an der Verschmelzung beteiligten Rechtsträger ist, wenn sie binnen sechs Monaten nach dem Tag, an dem die Eintragung der Verschmelzung in das Register des Sitzes desjenigen Rechtsträgers, dessen Gläubiger sie sind, nach § 19 Abs. 3 UmwG als bekannt gemacht gilt, ihren Anspruch nach Grund und Höhe in Textform anmelden, Sicherheit zu leisten, soweit sie nicht Befriedigung verlangen können. Dieses Recht steht den Gläubigern jedoch nur zu, wenn sie glaubhaft machen, dass durch die Verschmelzung die Erfüllung ihrer Forderung gefährdet wird."
    },
    {
      "date": "2025-01-18",
      "id": "98951",
      "original_text": "Löschungsankündigung\nBayern Amtsgericht München HRB 227517\nAvalanche Float Solutions GmbH – München",
      "type": "Löschungsankündigung",
      "state": "Bayern",
      "amtsgericht": "Amtsgericht München",
      "registernummer": "HRB 227517",
      "registerart": "HRB",
      "company_name": "Avalanche Float Solutions GmbH",
      "company_seat": "München",
      "details": "18.01.2025 (Bekanntmachungsdatum)\n\nBayern Amtsgericht München HRB 227517\nLöschungsankündigung 17.01.2025 (Eintragungsdatum)\n\nAvalanche Float Solutions GmbH\nGesellschaft mit beschränkter Haftung\nMünchen\n\nDas Registergericht beabsichtigt, die im Handelsregister eingetragene Gesellschaft wegen Vermögenslosigkeit von Amts wegen nach § 394 FamFG zu löschen. Die Frist zur Erhebung eines Widerspruchs ist auf drei Monate festgesetzt."
    },
    {
      "date": "2025-01-18",
      "id": "98952",
      "original_text": "Registerbekanntmachung nach dem Umwandlungsgesetz\nBayern Amtsgericht München HRB 299105\n4ibiz GmbH – München",
      "type": "Registerbekanntmachung nach dem Umwandlungsgesetz",
      "state": "Bayern",
      "amtsgericht": "Amtsgericht München",
      "registernummer": "HRB 299105",
      "registerart": "HRB",
      "company_name": "4ibiz GmbH",
      "company_seat": "München",
      "details": "18.01.2025 (Bekanntmachungsdatum)\n\nBayern Amtsgericht München HRB 299105\nRegisterbekanntmachung nach dem Umwandlungsgesetz 17.01.2025 (Eintragungsdatum)\n\n4ibiz GmbH\nGesellschaft mit beschränkter Haftung\nMünchen\n\nDen Gläubigern des formwechselnden Rechtsträgers ist, wenn sie binnen sechs Monaten nach dem Tag, an dem die Eintragung des Formwechsels nach § 201 UmwG als bekannt gemacht gilt, ihren Anspruch nach Grund und Höhe in Textform anmelden, Sicherheit zu leisten, soweit sie nicht Befriedigung verlangen können. Dieses Recht steht den Gläubigern jedoch nur zu, wenn sie glaubhaft machen, dass durch den Formwechsel die Erfüllung ihrer Forderung gefährdet wird."
    },
    {
      "date": "2025-01-18",
      "id": "98953",
      "original_text": "Löschungsankündigung\nBayern Amtsgericht München HRB 219897\nrubaldi GmbH – Sauerlach",
      "type": "Löschungsankündigung",
      "state": "Bayern",
      "amtsgericht": "Amtsgericht München",
      "registernummer": "HRB 219897",
      "registerart": "HRB",
      "company_name": "rubaldi GmbH",
      "company_seat": "Sauerlach",
      "details": "18.01.2025 (Bekanntmachungsdatum)\n\nBayern Amtsgericht München HRB 219897\nLöschungsankündigung\n\nrubaldi GmbH\nGesellschaft mit beschränkter Haftung\nSauerlach\n\nDas Registergericht beabsichtigt, den im Handelsregister eingetragenen Geschäftsführer André Baldini wegen fehlender Eignung nach § 395 FamFG zu löschen. Die Frist zur Erhebung eines Widerspruchs ist auf drei Monate festgesetzt."
    },
    {
      "date": "2025-01-18",
      "id": "98954",
      "original_text": "Registerbekanntmachung nach dem Umwandlungsgesetz\nBayern Amtsgericht München HRB 290952\nT&I Elements Holding UG (haftungsbeschränkt) – Vaterstetten",
      "type": "Registerbekanntmachung nach dem Umwandlungsgesetz",
      "state": "Bayern",
      "amtsgericht": "Amtsgericht München",
      "registernummer": "HRB 290952",
      "registerart": "HRB",
      "company_name": "T&I Elements Holding UG (haftungsbeschränkt)",
      "company_seat": "Vaterstetten",
      "details": "18.01.2025 (Bekanntmachungsdatum)\n\nBayern Amtsgericht München HRB 290952\nRegisterbekanntmachung nach dem Umwandlungsgesetz 17.01.2025 (Eintragungsdatum)\n\nT&I Elements Holding UG (haftungsbeschränkt)\nGesellschaft mit beschränkter Haftung\nVaterstetten\n\nDen Gläubigern der an der Verschmelzung beteiligten Rechtsträger ist, wenn sie binnen sechs Monaten nach dem Tag, an dem die Eintragung der Verschmelzung in das Register des Sitzes desjenigen Rechtsträgers, dessen Gläubiger sie sind, nach § 19 Abs. 3 UmwG als bekannt gemacht gilt, ihren Anspruch nach Grund und Höhe in Textform anmelden, Sicherheit zu leisten, soweit sie nicht Befriedigung verlangen können. Dieses Recht steht den Gläubigern jedoch nur zu, wenn sie glaubhaft machen, dass durch die Verschmelzung die Erfüllung ihrer Forderung gefährdet wird."
    },
    {
      "date": "2025-01-18",
      "id": "98955",
      "original_text": "Einreichung neuer Dokumente\nBayern Amtsgericht Kempten (Allgäu) HRB 15062\nALPS Family Office AG – Dietmannsried",
      "type": "Einreichung neuer Dokumente",
      "state": "Bayern",
      "amtsgericht": "Amtsgericht Kempten (Allgäu)",
      "registernummer": "HRB 15062",
      "registerart": "HRB",
      "company_name": "ALPS Family Office AG",
      "company_seat": "Dietmannsried",
      "details": "18.01.2025 (Bekanntmachungsdatum)\n\nBayern Amtsgericht Kempten (Allgäu) HRB 15062\nEinreichung neuer Dokumente 17.01.2025 (Eintragungsdatum)\n\nALPS Family Office AG\nAktiengesellschaft\nDietmannsried\n\nDem Amtsgericht Kempten (Allgäu) -Registergericht- ist eine Liste der Mitglieder des Aufsichtsrats eingereicht worden, § 106 AktG."
    },
    {
      "date": "2025-01-18",
      "id": "98956",
      "original_text": "Löschungsankündigung\nBayern Amtsgericht München HRB 191218\nFEGRACON UG (haftungsbeschränkt) – München",
      "type": "Löschungsankündigung",
      "state": "Bayern",
      "amtsgericht": "Amtsgericht München",
      "registernummer": "HRB 191218",
      "registerart": "HRB",
      "company_name": "FEGRACON UG (haftungsbeschränkt)",
      "company_seat": "München",
      "details": "18.01.2025 (Bekanntmachungsdatum)\n\nBayern Amtsgericht München HRB 191218\nLöschungsankündigung 17.01.2025 (Eintragungsdatum)\n\nFEGRACON UG (haftungsbeschränkt)\nGesellschaft mit beschränkter Haftung\nMünchen\n\nDas Registergericht beabsichtigt, die im Handelsregister eingetragene Gesellschaft wegen Vermögenslosigkeit von Amts wegen nach § 394 FamFG zu löschen. Die Frist zur Erhebung eines Widerspruchs ist auf drei Monate festgesetzt."
    },
    {
      "date": "2025-01-18",
      "id": "98957",
      "original_text": "Registerbekanntmachung nach dem Umwandlungsgesetz\nBayern Amtsgericht München HRB 273557\nT&I Elements UG (haftungsbeschränkt) – Parsdorf",
      "type": "Registerbekanntmachung nach dem Umwandlungsgesetz",
      "state": "Bayern",
      "amtsgericht": "Amtsgericht München",
      "registernummer": "HRB 273557",
      "registerart": "HRB",
      "company_name": "T&I Elements UG (haftungsbeschränkt)",
      "company_seat": "Parsdorf",
      "details": "18.01.2025 (Bekanntmachungsdatum)\n\nBayern Amtsgericht München HRB 273557\nRegisterbekanntmachung nach dem Umwandlungsgesetz 17.01.2025 (Eintragungsdatum)\n\nT&I Elements UG (haftungsbeschränkt)\nGesellschaft mit beschränkter Haftung\nParsdorf\n\nDen Gläubigern der an der Verschmelzung beteiligten Rechtsträger ist, wenn sie binnen sechs Monaten nach dem Tag, an dem die Eintragung der Verschmelzung in das Register des Sitzes desjenigen Rechtsträgers, dessen Gläubiger sie sind, nach § 19 Abs. 3 UmwG als bekannt gemacht gilt, ihren Anspruch nach Grund und Höhe in Textform anmelden, Sicherheit zu leisten, soweit sie nicht Befriedigung verlangen können. Dieses Recht steht den Gläubigern jedoch nur zu, wenn sie glaubhaft machen, dass durch die Verschmelzung die Erfüllung ihrer Forderung gefährdet wird."
    },
    {
      "date": "2025-01-18",
      "id": "98958",
      "original_text": "Löschungsankündigung\nBayern Amtsgericht München HRB 203179\nEhrewig Handel GmbH – München",
      "type": "Löschungsankündigung",
      "state": "Bayern",
      "amtsgericht": "Amtsgericht München",
      "registernummer": "HRB 203179",
      "registerart": "HRB",
      "company_name": "Ehrewig Handel GmbH",
      "company_seat": "München",
      "details": "18.01.2025 (Bekanntmachungsdatum)\n\nBayern Amtsgericht München HRB 203179\nLöschungsankündigung\n\nEhrewig Handel GmbH\nGesellschaft mit beschränkter Haftung\nMünchen\n\nDas Registergericht beabsichtigt, die im Handelsregister eingetragene Gesellschaft wegen Vermögenslosigkeit von Amts wegen nach § 394 FamFG zu löschen. Die Frist zur Erhebung eines Widerspruchs ist auf drei Monate festgesetzt."
    },
    {
      "date": "2025-01-18",
      "id": "98959",
      "original_text": "Registerbekanntmachung nach dem Umwandlungsgesetz\nBayern Amtsgericht München HRB 127385\n4ibiz - Aktiengesellschaft – München",
      "type": "Registerbekanntmachung nach dem Umwandlungsgesetz",
      "state": "Bayern",
      "amtsgericht": "Amtsgericht München",
      "registernummer": "HRB 127385",
      "registerart": "HRB",
      "company_name": "4ibiz - Aktiengesellschaft",
      "company_seat": "München",
      "details": "18.01.2025 (Bekanntmachungsdatum)\n\nBayern Amtsgericht München HRB 127385\nRegisterbekanntmachung nach dem Umwandlungsgesetz 17.01.2025 (Eintragungsdatum)\n\n4ibiz - Aktiengesellschaft\nAktiengesellschaft\nMünchen\n\nDen Gläubigern des formwechselnden Rechtsträgers ist, wenn sie binnen sechs Monaten nach dem Tag, an dem die Eintragung des Formwechsels nach § 201 UmwG als bekannt gemacht gilt, ihren Anspruch nach Grund und Höhe in Textform anmelden, Sicherheit zu leisten, soweit sie nicht Befriedigung verlangen können. Dieses Recht steht den Gläubigern jedoch nur zu, wenn sie glaubhaft machen, dass durch den Formwechsel die Erfüllung ihrer Forderung gefährdet wird."
    },
    {
      "date": "2025-01-18",
      "id": "98960",
      "original_text": "Löschungsankündigung\nBayern Amtsgericht Nürnberg HRB 15763\nAUTO HÖSSL, Kfz-Handel, Abschleppdienst und Reparaturservice GmbH – Nürnberg",
      "type": "Löschungsankündigung",
      "state": "Bayern",
      "amtsgericht": "Amtsgericht Nürnberg",
      "registernummer": "HRB 15763",
      "registerart": "HRB",
      "company_name": "AUTO HÖSSL, Kfz-Handel, Abschleppdienst und Reparaturservice GmbH",
      "company_seat": "Nürnberg",
      "details": "18.01.2025 (Bekanntmachungsdatum)\n\nBayern Amtsgericht Nürnberg HRB 15763\nLöschungsankündigung\n\nAUTO HÖSSL, Kfz-Handel, Abschleppdienst und Reparaturservice GmbH\nGesellschaft mit beschränkter Haftung\nNürnberg\n\nDas Registergericht beabsichtigt, die im Handelsregister eingetragene Gesellschaft wegen Vermögenslosigkeit von Amts wegen nach § 394 FamFG zu löschen. Die Frist zur Erhebung eines Widerspruchs ist auf einen Monat festgesetzt."
    },
    {
      "date": "2025-01-18",
      "id": "98961",
      "original_text": "Registerbekanntmachung nach dem Umwandlungsgesetz\nBayern Amtsgericht München HRB 294807\nSilk Road AcquiCo GmbH – München",
      "type": "Registerbekanntmachung nach dem Umwandlungsgesetz",
      "state": "Bayern",
      "amtsgericht": "Amtsgericht München",
      "registernummer": "HRB 294807",
      "registerart": "HRB",
      "company_name": "Silk Road AcquiCo GmbH",
      "company_seat": "München",
      "details": "18.01.2025 (Bekanntmachungsdatum)\n\nBayern Amtsgericht München HRB 294807\nRegisterbekanntmachung nach dem Umwandlungsgesetz 17.01.2025 (Eintragungsdatum)\n\nSilk Road AcquiCo GmbH\nGesellschaft mit beschränkter Haftung\nMünchen\n\nDen Gläubigern der an der Verschmelzung beteiligten Rechtsträger ist, wenn sie binnen sechs Monaten nach dem Tag, an dem die Eintragung der Verschmelzung in das Register des Sitzes desjenigen Rechtsträgers, dessen Gläubiger sie sind, nach § 19 Abs. 3 UmwG als bekannt gemacht gilt, ihren Anspruch nach Grund und Höhe in Textform anmelden, Sicherheit zu leisten, soweit sie nicht Befriedigung verlangen können. Dieses Recht steht den Gläubigern jedoch nur zu, wenn sie glaubhaft machen, dass durch die Verschmelzung die Erfüllung ihrer Forderung gefährdet wird."
    },
    {
      "date": "2025-01-18",
      "id": "98962",
      "original_text": "Löschungsankündigung\nBayern Amtsgericht Augsburg HRB 33018\nEasyGoing GLC UG (haftungsbeschränkt) – Kaufering",
      "type": "Löschungsankündigung",
      "state": "Bayern",
      "amtsgericht": "Amtsgericht Augsburg",
      "registernummer": "HRB 33018",
      "registerart": "HRB",
      "company_name": "EasyGoing GLC UG (haftungsbeschränkt)",
      "company_seat": "Kaufering",
      "details": "18.01.2025 (Bekanntmachungsdatum)\n\nBayern Amtsgericht Augsburg HRB 33018\nLöschungsankündigung\n\nEasyGoing GLC UG (haftungsbeschränkt)\nGesellschaft mit beschränkter Haftung\nKaufering\n\nDas Registergericht beabsichtigt, die im Handelsregister eingetragene Gesellschaft wegen Vermögenslosigkeit von Amts wegen nach § 394 FamFG zu löschen. Die Frist zur Erhebung eines Widerspruchs ist auf einen Monat festgesetzt."
    },
    {
      "date": "2025-01-18",
      "id": "98963",
      "original_text": "Löschungsankündigung\nBayern Amtsgericht Nürnberg HRB 28461\nAlternative Energie Europe AE GmbH – Nürnberg",
      "type": "Löschungsankündigung",
      "state": "Bayern",
      "amtsgericht": "Amtsgericht Nürnberg",
      "registernummer": "HRB 28461",
      "registerart": "HRB",
      "company_name": "Alternative Energie Europe AE GmbH",
      "company_seat": "Nürnberg",
      "details": "18.01.2025 (Bekanntmachungsdatum)\n\nBayern Amtsgericht Nürnberg HRB 28461\nLöschungsankündigung\n\nAlternative Energie Europe AE GmbH\nGesellschaft mit beschränkter Haftung\nNürnberg\n\nDas Registergericht beabsichtigt, die im Handelsregister eingetragene Gesellschaft wegen Vermögenslosigkeit von Amts wegen nach § 394 FamFG zu löschen. Die Frist zur Erhebung eines Widerspruchs ist auf einen Monat festgesetzt."
    },
    {
      "date": "2025-01-18",
      "id": "98964",
      "original_text": "Einreichung neuer Dokumente\nBayern Amtsgericht Bayreuth HRB 6106\n7C Solarparken AG – Bayreuth",
      "type": "Einreichung neuer Dokumente",
      "state": "Bayern",
      "amtsgericht": "Amtsgericht Bayreuth",
      "registernummer": "HRB 6106",
      "registerart": "HRB",
      "company_name": "7C Solarparken AG",
      "company_seat": "Bayreuth",
      "details": "18.01.2025 (Bekanntmachungsdatum)\n\nBayern Amtsgericht Bayreuth HRB 6106\nEinreichung neuer Dokumente\n\n7C Solarparken AG\nAktiengesellschaft\nBayreuth\n\nDem Amtsgericht Bayreuth -Registergericht- ist eine Liste der Mitglieder des Aufsichtsrats eingereicht worden, § 106 AktG."
    },
    {
      "date": "2025-01-18",
      "id": "98965",
      "original_text": "Einreichung neuer Dokumente\nBayern Amtsgericht Traunstein HRB 31779\nadvastore SE – Unterwössen",
      "type": "Einreichung neuer Dokumente",
      "state": "Bayern",
      "amtsgericht": "Amtsgericht Traunstein",
      "registernummer": "HRB 31779",
      "registerart": "HRB",
      "company_name": "advastore SE",
      "company_seat": "Unterwössen",
      "details": "18.01.2025 (Bekanntmachungsdatum)\n\nBayern Amtsgericht Traunstein HRB 31779\nEinreichung neuer Dokumente 17.01.2025 (Eintragungsdatum)\n\nadvastore SE\nEuropäische Aktiengesellschaft (SE)\nUnterwössen\n\nDem Amtsgericht Traunstein -Registergericht- ist eine Liste der Mitglieder des Aufsichtsrats eingereicht worden, Art. 9 Abs. 1 Buchst. c (ii) SE-VO i.V.m. § 106 AktG."
    },
    {
      "date": "2025-01-18",
      "id": "98966",
      "original_text": "Löschungsankündigung\nBayern Amtsgericht Bayreuth HRA 2118\nHeinz Lorat Textilveredlung e. K. – Kulmbach",
      "type": "Löschungsankündigung",
      "state": "Bayern",
      "amtsgericht": "Amtsgericht Bayreuth",
      "registernummer": "HRA 2118",
      "registerart": "HRA",
      "company_name": "Heinz Lorat Textilveredlung e. K.",
      "company_seat": "Kulmbach",
      "details": "18.01.2025 (Bekanntmachungsdatum)\n\nBayern Amtsgericht Bayreuth HRA 2118\nLöschungsankündigung\n\nHeinz Lorat Textilveredlung e. K.\nEinzelkaufmann / Einzelkauffrau\nKulmbach\n\nDas Registergericht beabsichtigt, die im Handelsregister eingetragene Firma von Amts wegen nach § 31 Abs. 2 HGB zu löschen. Die Frist zur Erhebung eines Widerspruchs ist auf sechs Wochen festgesetzt."
    },
    {
      "date": "2025-01-18",
      "id": "98967",
      "original_text": "Einreichung neuer Dokumente\nNordrhein-Westfalen Amtsgericht Bochum HRB 12025\nKnappschaft Kliniken Solution GmbH – Bochum",
      "type": "Einreichung neuer Dokumente",
      "state": "Nordrhein-Westfalen",
      "amtsgericht": "Amtsgericht Bochum",
      "registernummer": "HRB 12025",
      "registerart": "HRB",
      "company_name": "Knappschaft Kliniken Solution GmbH",
      "company_seat": "Bochum",
      "details": "18.01.2025 (Bekanntmachungsdatum)\n\nNordrhein-Westfalen Amtsgericht Bochum HRB 12025\nEinreichung neuer Dokumente\n\nKnappschaft Kliniken Solution GmbH\nGesellschaft mit beschränkter Haftung\nBochum\n\nDem Registergericht ist eine neue Liste der Mitglieder des Aufsichtsrates eingereicht worden."
    }
  ]
}