{
  "date": "2025-01-14",
  "date_of_scrape": "2025-01-15T04:06:38.932Z",
  "tool_version": "0.2.0",
  "number_of_announcements": 130,
  "announcements": [
    {
      "date": "2025-01-14",
      "id": "98469",
      "original_text": "Löschungsankündigung\nBayern Amtsgericht Regensburg HRB 20421\nV.E.R.K. Gruppe UG (haftungsbeschränkt) – Arrach",
      "type": "Löschungsankündigung",
      "state": "Bayern",
      "amtsgericht": "Amtsgericht Regensburg",
      "registernummer": "HRB 20421",
      "registerart": "HRB",
      "company_name": "V.E.R.K. Gruppe UG (haftungsbeschränkt)",
      "company_seat": "Arrach",
      "details": "14.01.2025 (Bekanntmachungsdatum)\n\nBayern Amtsgericht Regensburg HRB 20421\nLöschungsankündigung\n\nV.E.R.K. Gruppe UG (haftungsbeschränkt)\nGesellschaft mit beschränkter Haftung\nArrach\n\nDas Registergericht beabsichtigt, die im Handelsregister eingetragene Gesellschaft wegen Vermögenslosigkeit von Amts wegen nach § 394 FamFG zu löschen. Die Frist zur Erhebung eines Widerspruchs ist auf zwei Monate festgesetzt."
    },
    {
      "date": "2025-01-14",
      "id": "98470",
      "original_text": "Registerbekanntmachung nach dem Umwandlungsgesetz\nBayern Amtsgericht Weiden i. d. OPf. HRA 3272\ngewerbliche Vermietung Gunther Lukas e.K. – Parkstein",
      "type": "Registerbekanntmachung nach dem Umwandlungsgesetz",
      "state": "Bayern",
      "amtsgericht": "Amtsgericht Weiden i. d. OPf.",
      "registernummer": "HRA 3272",
      "registerart": "HRA",
      "company_name": "gewerbliche Vermietung Gunther Lukas e.K.",
      "company_seat": "Parkstein",
      "details": "14.01.2025 (Bekanntmachungsdatum)\n\nBayern Amtsgericht Weiden i. d. OPf. HRA 3272\nRegisterbekanntmachung nach dem Umwandlungsgesetz 17.12.2024 (Eintragungsdatum)\n\ngewerbliche Vermietung Gunther Lukas e.K.\nEinzelkaufmann / Einzelkauffrau\nParkstein\n\nDen Gläubigern der an der Ausgliederung beteiligten Rechtsträger ist, wenn sie binnen sechs Monaten nach dem Tag, an dem die Eintragung der Ausgliederung in das Register des Sitzes desjenigen Rechtsträgers, dessen Gläubiger sie sind, nach §§ 125, 19 Abs. 3 UmwG als bekannt gemacht gilt, ihren Anspruch nach Grund und Höhe schriftlich anmelden, Sicherheit zu leisten, soweit sie nicht Befriedigung verlangen können. Dieses Recht steht den Gläubigern jedoch nur zu, wenn sie glaubhaft machen, dass durch die Ausgliederung die Erfüllung ihrer Forderung gefährdet wird."
    },
    {
      "date": "2025-01-14",
      "id": "98471",
      "original_text": "Registerbekanntmachung nach dem Umwandlungsgesetz\nBayern Amtsgericht Coburg HRB 5481\nFISHBULL Franz Fischer Qualitätswerkzeuge GmbH – Neustadt b. Coburg",
      "type": "Registerbekanntmachung nach dem Umwandlungsgesetz",
      "state": "Bayern",
      "amtsgericht": "Amtsgericht Coburg",
      "registernummer": "HRB 5481",
      "registerart": "HRB",
      "company_name": "FISHBULL Franz Fischer Qualitätswerkzeuge GmbH",
      "company_seat": "Neustadt b. Coburg",
      "details": "14.01.2025 (Bekanntmachungsdatum)\n\nBayern Amtsgericht Coburg HRB 5481\nRegisterbekanntmachung nach dem Umwandlungsgesetz 13.01.2025 (Eintragungsdatum)\n\nFISHBULL Franz Fischer Qualitätswerkzeuge GmbH\nGesellschaft mit beschränkter Haftung\nNeustadt b. Coburg\n\nDen Gläubigern des formwechselnden Rechtsträgers ist, wenn sie binnen sechs Monaten nach dem Tag, an dem die Eintragung des Formwechsels nach § 201 UmwG als bekannt gemacht gilt, ihren Anspruch nach Grund und Höhe in Textform anmelden, Sicherheit zu leisten, soweit sie nicht Befriedigung verlangen können. Dieses Recht steht den Gläubigern jedoch nur zu, wenn sie glaubhaft machen, dass durch den Formwechsel die Erfüllung ihrer Forderung gefährdet wird."
    },
    {
      "date": "2025-01-14",
      "id": "98472",
      "original_text": "Sonstige Registerbekanntmachung\nBayern Amtsgericht München HRB 259595\nSozialkonzept Christinenhof GmbH Betriebsgesellschaft sozialer Einrichtungen – München",
      "type": "Sonstige Registerbekanntmachung",
      "state": "Bayern",
      "amtsgericht": "Amtsgericht München",
      "registernummer": "HRB 259595",
      "registerart": "HRB",
      "company_name": "Sozialkonzept Christinenhof GmbH Betriebsgesellschaft sozialer Einrichtungen",
      "company_seat": "München",
      "details": "14.01.2025 (Bekanntmachungsdatum)\n\nBayern Amtsgericht München HRB 259595\nSonstige Registerbekanntmachung 13.01.2025 (Eintragungsdatum)\n\nSozialkonzept Christinenhof GmbH Betriebsgesellschaft sozialer Einrichtungen\nGesellschaft mit beschränkter Haftung\nMünchen\n\nDen Gläubigern der Gesellschaft, deren Forderungen begründet worden sind, bevor die Eintragung der Beendigung des Beherrschungs- und Gewinnabführungsvertrages in das Handelsregister nach § 10 des Handelsgesetzbuches als bekanntgemacht gilt, hat der andere Vertragsteil Sicherheit zu leisten, wenn sie sich binnen sechs Monaten nach der Bekanntmachung der Eintragung zu diesem Zweck bei ihm melden."
    },
    {
      "date": "2025-01-14",
      "id": "98473",
      "original_text": "Löschungsankündigung\nBayern Amtsgericht München HRB 220003\nGuardia Turnavision GmbH – München",
      "type": "Löschungsankündigung",
      "state": "Bayern",
      "amtsgericht": "Amtsgericht München",
      "registernummer": "HRB 220003",
      "registerart": "HRB",
      "company_name": "Guardia Turnavision GmbH",
      "company_seat": "München",
      "details": "14.01.2025 (Bekanntmachungsdatum)\n\nBayern Amtsgericht München HRB 220003\nLöschungsankündigung 13.01.2025 (Eintragungsdatum)\n\nGuardia Turnavision GmbH\nGesellschaft mit beschränkter Haftung\nMünchen\n\nDas Registergericht beabsichtigt, die im Handelsregister eingetragene Gesellschaft wegen Vermögenslosigkeit von Amts wegen nach § 394 FamFG zu löschen. Die Frist zur Erhebung eines Widerspruchs ist auf drei Monate festgesetzt."
    },
    {
      "date": "2025-01-14",
      "id": "98474",
      "original_text": "Registerbekanntmachung nach dem Umwandlungsgesetz\nBayern Amtsgericht Nürnberg HRA 20144\nElektro Jakob e.K. – Nürnberg",
      "type": "Registerbekanntmachung nach dem Umwandlungsgesetz",
      "state": "Bayern",
      "amtsgericht": "Amtsgericht Nürnberg",
      "registernummer": "HRA 20144",
      "registerart": "HRA",
      "company_name": "Elektro Jakob e.K.",
      "company_seat": "Nürnberg",
      "details": "14.01.2025 (Bekanntmachungsdatum)\n\nBayern Amtsgericht Nürnberg HRA 20144\nRegisterbekanntmachung nach dem Umwandlungsgesetz 13.01.2025 (Eintragungsdatum)\n\nElektro Jakob e.K.\nEinzelkaufmann / Einzelkauffrau\nNürnberg\n\nDen Gläubigern der an der Ausgliederung beteiligten Rechtsträger ist, wenn sie binnen sechs Monaten nach dem Tag, an dem die Eintragung der Ausgliederung in das Register des Sitzes desjenigen Rechtsträgers, dessen Gläubiger sie sind, nach §§ 125, 19 Abs. 3 UmwG als bekannt gemacht gilt, ihren Anspruch nach Grund und Höhe in Textform anmelden, Sicherheit zu leisten, soweit sie nicht Befriedigung verlangen können. Dieses Recht steht den Gläubigern jedoch nur zu, wenn sie glaubhaft machen, dass durch die Ausgliederung die Erfüllung ihrer Forderung gefährdet wird."
    },
    {
      "date": "2025-01-14",
      "id": "98475",
      "original_text": "Einreichung neuer Dokumente\nBayern Amtsgericht München HRB 4921\nBayWa Aktiengesellschaft – München",
      "type": "Einreichung neuer Dokumente",
      "state": "Bayern",
      "amtsgericht": "Amtsgericht München",
      "registernummer": "HRB 4921",
      "registerart": "HRB",
      "company_name": "BayWa Aktiengesellschaft",
      "company_seat": "München",
      "details": "14.01.2025 (Bekanntmachungsdatum)\n\nBayern Amtsgericht München HRB 4921\nEinreichung neuer Dokumente 13.01.2025 (Eintragungsdatum)\n\nBayWa Aktiengesellschaft\nAktiengesellschaft\nMünchen\n\nDem Amtsgericht München -Registergericht- ist eine Liste der Mitglieder des Aufsichtsrats eingereicht worden, § 106 AktG."
    },
    {
      "date": "2025-01-14",
      "id": "98476",
      "original_text": "Löschungsankündigung\nBayern Amtsgericht Nürnberg HRB 31992\nnewtech GmbH – Nürnberg",
      "type": "Löschungsankündigung",
      "state": "Bayern",
      "amtsgericht": "Amtsgericht Nürnberg",
      "registernummer": "HRB 31992",
      "registerart": "HRB",
      "company_name": "newtech GmbH",
      "company_seat": "Nürnberg",
      "details": "14.01.2025 (Bekanntmachungsdatum)\n\nBayern Amtsgericht Nürnberg HRB 31992\nLöschungsankündigung\n\nnewtech GmbH\nGesellschaft mit beschränkter Haftung\nNürnberg\n\nDas Registergericht beabsichtigt, die im Handelsregister eingetragene Firma von Amts wegen nach § 31 Abs. 2 HGB, § 393 FamFG zu löschen. Die Frist zur Erhebung eines Widerspruchs ist auf einen Monat festgesetzt."
    },
    {
      "date": "2025-01-14",
      "id": "98477",
      "original_text": "Einreichung neuer Dokumente\nBayern Amtsgericht München HRB 158525\nsalesforce.com Germany GmbH – München",
      "type": "Einreichung neuer Dokumente",
      "state": "Bayern",
      "amtsgericht": "Amtsgericht München",
      "registernummer": "HRB 158525",
      "registerart": "HRB",
      "company_name": "salesforce.com Germany GmbH",
      "company_seat": "München",
      "details": "14.01.2025 (Bekanntmachungsdatum)\n\nBayern Amtsgericht München HRB 158525\nEinreichung neuer Dokumente 13.01.2025 (Eintragungsdatum)\n\nsalesforce.com Germany GmbH\nGesellschaft mit beschränkter Haftung\nMünchen\n\nDem Amtsgericht München -Registergericht- ist eine Liste der Mitglieder des Aufsichtsrats eingereicht worden, § 52 Abs. 3 S. 2 GmbHG."
    },
    {
      "date": "2025-01-14",
      "id": "98478",
      "original_text": "Löschungsankündigung\nBayern Amtsgericht Würzburg HRB 15214\nwarelogic UG (haftungsbeschränkt) – Marktheidenfeld",
      "type": "Löschungsankündigung",
      "state": "Bayern",
      "amtsgericht": "Amtsgericht Würzburg",
      "registernummer": "HRB 15214",
      "registerart": "HRB",
      "company_name": "warelogic UG (haftungsbeschränkt)",
      "company_seat": "Marktheidenfeld",
      "details": "14.01.2025 (Bekanntmachungsdatum)\n\nBayern Amtsgericht Würzburg HRB 15214\nLöschungsankündigung 13.01.2025 (Eintragungsdatum)\n\nwarelogic UG (haftungsbeschränkt)\nGesellschaft mit beschränkter Haftung\nMarktheidenfeld\n\nDas Registergericht beabsichtigt, die im Handelsregister eingetragene Gesellschaft wegen Vermögenslosigkeit von Amts wegen nach § 394 FamFG zu löschen. Die Widerspruchsfrist beträgt 3 Monate."
    },
    {
      "date": "2025-01-14",
      "id": "98479",
      "original_text": "Registerbekanntmachung nach dem Umwandlungsgesetz\nBayern Amtsgericht Nürnberg HRB 43966\nElektro Jakob GmbH – Nürnberg",
      "type": "Registerbekanntmachung nach dem Umwandlungsgesetz",
      "state": "Bayern",
      "amtsgericht": "Amtsgericht Nürnberg",
      "registernummer": "HRB 43966",
      "registerart": "HRB",
      "company_name": "Elektro Jakob GmbH",
      "company_seat": "Nürnberg",
      "details": ""
    },
    {
      "date": "2025-01-14",
      "id": "98480",
      "original_text": "Einreichung neuer Dokumente\nBayern Amtsgericht Kempten (Allgäu) HRB 7247\nSozialstation der Caritas und der Diakonie Oberallgäu gemeinnützige GmbH – Sonthofen",
      "type": "Einreichung neuer Dokumente",
      "state": "Bayern",
      "amtsgericht": "Amtsgericht Kempten (Allgäu)",
      "registernummer": "HRB 7247",
      "registerart": "HRB",
      "company_name": "Sozialstation der Caritas und der Diakonie Oberallgäu gemeinnützige GmbH",
      "company_seat": "Sonthofen",
      "details": "14.01.2025 (Bekanntmachungsdatum)\n\nBayern Amtsgericht Kempten (Allgäu) HRB 7247\nEinreichung neuer Dokumente 13.01.2025 (Eintragungsdatum)\n\nSozialstation der Caritas und der Diakonie Oberallgäu gemeinnützige GmbH\nGesellschaft mit beschränkter Haftung\nSonthofen\n\nDem Amtsgericht Kempten (Allgäu) -Registergericht- ist eine Liste der Mitglieder des Aufsichtsrats eingereicht worden, § 52 Abs. 3 S. 2 GmbHG."
    },
    {
      "date": "2025-01-14",
      "id": "98481",
      "original_text": "Löschungsankündigung\nBayern Amtsgericht Nürnberg HRB 24693\nNUEVA STADTPROJEKTE GmbH – Nürnberg",
      "type": "Löschungsankündigung",
      "state": "Bayern",
      "amtsgericht": "Amtsgericht Nürnberg",
      "registernummer": "HRB 24693",
      "registerart": "HRB",
      "company_name": "NUEVA STADTPROJEKTE GmbH",
      "company_seat": "Nürnberg",
      "details": "14.01.2025 (Bekanntmachungsdatum)\n\nBayern Amtsgericht Nürnberg HRB 24693\nLöschungsankündigung\n\nNUEVA STADTPROJEKTE GmbH\nGesellschaft mit beschränkter Haftung\nNürnberg\n\nDas Registergericht beabsichtigt, die im Handelsregister eingetragene Firma von Amts wegen nach § 31 Abs. 2 HGB, § 393 FamFG zu löschen. Die Frist zur Erhebung eines Widerspruchs ist auf einen Monat festgesetzt."
    },
    {
      "date": "2025-01-14",
      "id": "98482",
      "original_text": "Einreichung neuer Dokumente\nBayern Amtsgericht Augsburg HRB 35559\nAUGUSTA INVEST AG – Augsburg",
      "type": "Einreichung neuer Dokumente",
      "state": "Bayern",
      "amtsgericht": "Amtsgericht Augsburg",
      "registernummer": "HRB 35559",
      "registerart": "HRB",
      "company_name": "AUGUSTA INVEST AG",
      "company_seat": "Augsburg",
      "details": "14.01.2025 (Bekanntmachungsdatum)\n\nBayern Amtsgericht Augsburg HRB 35559\nEinreichung neuer Dokumente\n\nAUGUSTA INVEST AG\nAktiengesellschaft\nAugsburg\n\nDem Amtsgericht Augsburg -Registergericht- ist eine Liste der Mitglieder des Aufsichtsrats eingereicht worden, § 106 AktG."
    },
    {
      "date": "2025-01-14",
      "id": "98483",
      "original_text": "Einreichung neuer Dokumente\nBayern Amtsgericht München HRB 276649\nSWTecs AG – Germering",
      "type": "Einreichung neuer Dokumente",
      "state": "Bayern",
      "amtsgericht": "Amtsgericht München",
      "registernummer": "HRB 276649",
      "registerart": "HRB",
      "company_name": "SWTecs AG",
      "company_seat": "Germering",
      "details": "14.01.2025 (Bekanntmachungsdatum)\n\nBayern Amtsgericht München HRB 276649\nEinreichung neuer Dokumente\n\nSWTecs AG\nAktiengesellschaft\nGermering\n\nDem Amtsgericht München -Registergericht- ist eine Liste der Mitglieder des Aufsichtsrats eingereicht worden, § 106 AktG."
    },
    {
      "date": "2025-01-14",
      "id": "98484",
      "original_text": "Registerbekanntmachung nach dem Umwandlungsgesetz\nBayern Amtsgericht München HRB 203563\nHolzland Kern Beteiligungs- und Geschäftsführungs GmbH – Kirchseeon",
      "type": "Registerbekanntmachung nach dem Umwandlungsgesetz",
      "state": "Bayern",
      "amtsgericht": "Amtsgericht München",
      "registernummer": "HRB 203563",
      "registerart": "HRB",
      "company_name": "Holzland Kern Beteiligungs- und Geschäftsführungs GmbH",
      "company_seat": "Kirchseeon",
      "details": "14.01.2025 (Bekanntmachungsdatum)\n\nBayern Amtsgericht München HRB 203563\nRegisterbekanntmachung nach dem Umwandlungsgesetz 13.01.2025 (Eintragungsdatum)\n\nHolzland Kern Beteiligungs- und Geschäftsführungs GmbH\nGesellschaft mit beschränkter Haftung\nKirchseeon\n\nDen Gläubigern der an der Verschmelzung beteiligten Rechtsträger ist, wenn sie binnen sechs Monaten nach dem Tag, an dem die Eintragung der Verschmelzung in das Register des Sitzes desjenigen Rechtsträgers, dessen Gläubiger sie sind, nach § 19 Abs. 3 UmwG als bekannt gemacht gilt, ihren Anspruch nach Grund und Höhe in Textform anmelden, Sicherheit zu leisten, soweit sie nicht Befriedigung verlangen können. Dieses Recht steht den Gläubigern jedoch nur zu, wenn sie glaubhaft machen, dass durch die Verschmelzung die Erfüllung ihrer Forderung gefährdet wird."
    },
    {
      "date": "2025-01-14",
      "id": "98485",
      "original_text": "Löschungsankündigung\nSaarland Amtsgericht Saarbrücken HRB 9543\nObsthandel Dekker GmbH – Saarbrücken",
      "type": "Löschungsankündigung",
      "state": "Saarland",
      "amtsgericht": "Amtsgericht Saarbrücken",
      "registernummer": "HRB 9543",
      "registerart": "HRB",
      "company_name": "Obsthandel Dekker GmbH",
      "company_seat": "Saarbrücken",
      "details": "14.01.2025 (Bekanntmachungsdatum)\n\nSaarland Amtsgericht Saarbrücken HRB 9543\nLöschungsankündigung\n\nObsthandel Dekker GmbH\nGesellschaft mit beschränkter Haftung\nSaarbrücken\n\nEs ist beabsichtigt, die Gesellschaft von Amts wegen gemäß § 394 FamFG wegen Vermögenslosigkeit zu löschen.\nGegen die Löschung von Amts wegen ist das Rechtsmittel des Widerspruchs statthaft. Der Widerspruch ist binnen einer Frist zwei Monaten beginnend mit dem Tag dieser Veröffentlichung durch Einreichen eines Widerspruchsschreibens -schriftlich oder zur Niederschrift der Geschäftsstelle beim Amtsgericht Saarbrücken, -zentrales Handelsregister-, Mainzerstr.178, 66121 Saarbrücken einzulegen.\nDer Widerspruch muss die Bezeichnung der angefochtenen Löschungsankündigung enthalten sowie die Erklärung, dass Widerspruch eingelegt wird. Er ist vom Widerspruchsführer oder seinem Bevollmächtigten zu unterzeichnen.\nDas Widerspruchsschreiben kann auch in der Form eines elektronischen Dokumentes eingereicht werden, das mit einer qualifizierten elektronischen Signatur nach dem Signaturgesetz versehen sein muss (§§ 14 Abs. 2 FamFG, 130a, 298 ZPO)."
    },
    {
      "date": "2025-01-14",
      "id": "98486",
      "original_text": "Löschungsankündigung\nSaarland Amtsgericht Saarbrücken HRB 101224\nNOVA Service GmbH – Saarbrücken",
      "type": "Löschungsankündigung",
      "state": "Saarland",
      "amtsgericht": "Amtsgericht Saarbrücken",
      "registernummer": "HRB 101224",
      "registerart": "HRB",
      "company_name": "NOVA Service GmbH",
      "company_seat": "Saarbrücken",
      "details": "14.01.2025 (Bekanntmachungsdatum)\n\nSaarland Amtsgericht Saarbrücken HRB 101224\nLöschungsankündigung\n\nNOVA Service GmbH\nGesellschaft mit beschränkter Haftung\nSaarbrücken\n\nEs ist beabsichtigt, die Gesellschaft von Amts wegen gemäß § 394 FamFG wegen Vermögenslosigkeit zu löschen. Gegen die Löschung von Amts wegen ist das Rechtsmittel des Widerspruchs statthaft. Der Widerspruch ist binnen einer Frist von 1 Monat beginnend mit dem Tag dieser Veröffentlichung durch Einreichen eines Widerspruchsschreibens -schriftlich oder zur Niederschrift der Geschäftsstelle- beim Amtsgericht Saarbrücken, -zentrales Handelsregister-, Mainzerstr.178, 66121 Saarbrücken einzulegen. Der Widerspruch muss die Bezeichnung der angefochtenen Löschungsankündigung enthalten sowie die Erklärung, dass Widerspruch eingelegt wird. Er ist vom Widerspruchsführer oder seinem Bevollmächtigten zu unterzeichnen.\nDas Widerspruchsschreiben kann auch in der Form eines elektronischen Dokumentes eingereicht werden, das mit einer qualifizierten elektronischen Signatur nach dem Signaturgesetz versehen sein muss (§§ 14 Abs. 2 FamFG, 130a, 298 ZPO)."
    },
    {
      "date": "2025-01-14",
      "id": "98487",
      "original_text": "Registerbekanntmachung nach dem Umwandlungsgesetz\nBaden-Württemberg Amtsgericht Freiburg VR 380771\nAkademie für Wissenschaftliche Weiterbildung an der Universität Konstanz e.V. – Konstanz",
      "type": "Registerbekanntmachung nach dem Umwandlungsgesetz",
      "state": "Baden-Württemberg",
      "amtsgericht": "Amtsgericht Freiburg",
      "registernummer": "VR 380771",
      "registerart": "VR",
      "company_name": "Akademie für Wissenschaftliche Weiterbildung an der Universität Konstanz e.V.",
      "company_seat": "Konstanz",
      "details": "14.01.2025 (Bekanntmachungsdatum)\n\nBaden-Württemberg Amtsgericht Freiburg VR 380771\nRegisterbekanntmachung nach dem Umwandlungsgesetz 14.01.2025 (Eintragungsdatum)\n\nAkademie für Wissenschaftliche Weiterbildung an der Universität Konstanz e.V.\neingetragener Verein\nKonstanz\n\nAls nicht eingetragen wird bekanntgemacht:\nDen Gläubigern des an dem Formwechsel beteiligten Rechtsträgers ist, wenn sie binnen sechs Monaten nach dem Tag, an dem die Eintragung des Formwechsels in das Register des Sitzes desjenigen Rechtsträgers, dessen Gläubiger sie sind, nach § 19 Abs. 3 UmwG als bekanntgemacht gilt, ihren Anspruch nach Grund und Höhe schriftlich anmelden, Sicherheit zu leisten, soweit sie nicht Befriedigung verlangen können. Dieses Recht steht den Gläubigern jedoch nur zu, wenn sie glaubhaft machen, dass durch den Formwechsel die Erfüllung ihrer Forderung gefährdet wird."
    },
    {
      "date": "2025-01-14",
      "id": "98488",
      "original_text": "Sonstige Registerbekanntmachung\nBaden-Württemberg Amtsgericht Ulm HRB 631526\nifm prover gmbh Sensorik für die Prozeß- und Verfahrenstechnik – Tettnang",
      "type": "Sonstige Registerbekanntmachung",
      "state": "Baden-Württemberg",
      "amtsgericht": "Amtsgericht Ulm",
      "registernummer": "HRB 631526",
      "registerart": "HRB",
      "company_name": "ifm prover gmbh Sensorik für die Prozeß- und Verfahrenstechnik",
      "company_seat": "Tettnang",
      "details": "14.01.2025 (Bekanntmachungsdatum)\n\nBaden-Württemberg Amtsgericht Ulm HRB 631526\nSonstige Registerbekanntmachung 14.01.2025 (Eintragungsdatum)\n\nifm prover gmbh Sensorik für die Prozeß- und Verfahrenstechnik\nGesellschaft mit beschränkter Haftung\nTettnang\n\nAls nicht eingetragen wird bekanntgemacht:\nDen Gläubigern der Gesellschaft, deren Forderungen begründet worden sind, bevor die Eintragung der Beendigung des Vertrages in das Handelsregister nach § 10 HGB als bekanntgemacht gilt, ist vom anderen Vertragsteil Sicherheit zu leisten, wenn sie sich binnen sechs Monaten nach der Bekanntmachung zu diesem Zweck bei ihm melden."
    },
    {
      "date": "2025-01-14",
      "id": "98489",
      "original_text": "Löschungsankündigung\nBrandenburg Amtsgericht Potsdam HRB 12449\nLamcha Bau Verwaltungs GmbH – Märkisch Luch",
      "type": "Löschungsankündigung",
      "state": "Brandenburg",
      "amtsgericht": "Amtsgericht Potsdam",
      "registernummer": "HRB 12449",
      "registerart": "HRB",
      "company_name": "Lamcha Bau Verwaltungs GmbH",
      "company_seat": "Märkisch Luch",
      "details": "14.01.2025 (Bekanntmachungsdatum)\n\nBrandenburg Amtsgericht Potsdam HRB 12449\nLöschungsankündigung\n\nLamcha Bau Verwaltungs GmbH\nGesellschaft mit beschränkter Haftung\nMärkisch Luch\n\nBei der nachstehenden Gesellschaft wird das Amtslöschungsverfahren gemäß § 394 FamFG eingeleitet."
    },
    {
      "date": "2025-01-14",
      "id": "98490",
      "original_text": "Sonstige Registerbekanntmachung\nBaden-Württemberg Amtsgericht Mannheim HRB 702796\nCornerstoneCapital Verwaltungs AG – Heidelberg",
      "type": "Sonstige Registerbekanntmachung",
      "state": "Baden-Württemberg",
      "amtsgericht": "Amtsgericht Mannheim",
      "registernummer": "HRB 702796",
      "registerart": "HRB",
      "company_name": "CornerstoneCapital Verwaltungs AG",
      "company_seat": "Heidelberg",
      "details": "14.01.2025 (Bekanntmachungsdatum)\n\nBaden-Württemberg Amtsgericht Mannheim HRB 702796\nSonstige Registerbekanntmachung 14.01.2025 (Eintragungsdatum)\n\nCornerstoneCapital Verwaltungs AG\nAktiengesellschaft\nHeidelberg\n\nAls nicht eingetragen wird bekanntgemacht:\nDen Gläubigern der Gesellschaft, deren Forderungen begründet worden sind, bevor die Eintragung der Beendigung des Vertrages in das Handelsregister nach § 10 HGB als bekanntgemacht gilt, ist vom anderen Vertragsteil Sicherheit zu leisten, wenn sie sich binnen sechs Monaten nach der Bekanntmachung zu diesem Zweck bei ihm melden."
    },
    {
      "date": "2025-01-14",
      "id": "98491",
      "original_text": "Löschungsankündigung\nBrandenburg Amtsgericht Potsdam HRB 33921\nDDS - Dresdner Dämmtechnik und Serviceleistungen GmbH – Kleinmachnow",
      "type": "Löschungsankündigung",
      "state": "Brandenburg",
      "amtsgericht": "Amtsgericht Potsdam",
      "registernummer": "HRB 33921",
      "registerart": "HRB",
      "company_name": "DDS - Dresdner Dämmtechnik und Serviceleistungen GmbH",
      "company_seat": "Kleinmachnow",
      "details": "14.01.2025 (Bekanntmachungsdatum)\n\nBrandenburg Amtsgericht Potsdam HRB 33921\nLöschungsankündigung\n\nDDS - Dresdner Dämmtechnik und Serviceleistungen GmbH\nGesellschaft mit beschränkter Haftung\nKleinmachnow\n\nBei der nachstehenden Gesellschaft wird das Amtslöschungsverfahren gemäß § 394 FamFG eingeleitet. Widerspruchsfrist: 8 Wochen"
    },
    {
      "date": "2025-01-14",
      "id": "98492",
      "original_text": "Sonstige Registerbekanntmachung\nBaden-Württemberg Amtsgericht Ulm HRB 730516\nifm efector gmbh – Tettnang",
      "type": "Sonstige Registerbekanntmachung",
      "state": "Baden-Württemberg",
      "amtsgericht": "Amtsgericht Ulm",
      "registernummer": "HRB 730516",
      "registerart": "HRB",
      "company_name": "ifm efector gmbh",
      "company_seat": "Tettnang",
      "details": "14.01.2025 (Bekanntmachungsdatum)\n\nBaden-Württemberg Amtsgericht Ulm HRB 730516\nSonstige Registerbekanntmachung 14.01.2025 (Eintragungsdatum)\n\nifm efector gmbh\nGesellschaft mit beschränkter Haftung\nTettnang\n\nAls nicht eingetragen wird bekanntgemacht:\nDen Gläubigern der Gesellschaft, deren Forderungen begründet worden sind, bevor die Eintragung der Beendigung des Vertrages in das Handelsregister nach § 10 HGB als bekanntgemacht gilt, ist vom anderen Vertragsteil Sicherheit zu leisten, wenn sie sich binnen sechs Monaten nach der Bekanntmachung zu diesem Zweck bei ihm melden."
    },
    {
      "date": "2025-01-14",
      "id": "98493",
      "original_text": "Löschungsankündigung\nBrandenburg Amtsgericht Potsdam HRB 25407\nAPEN GmbH – Brandenburg an der Havel",
      "type": "Löschungsankündigung",
      "state": "Brandenburg",
      "amtsgericht": "Amtsgericht Potsdam",
      "registernummer": "HRB 25407",
      "registerart": "HRB",
      "company_name": "APEN GmbH",
      "company_seat": "Brandenburg an der Havel",
      "details": "14.01.2025 (Bekanntmachungsdatum)\n\nBrandenburg Amtsgericht Potsdam HRB 25407\nLöschungsankündigung\n\nAPEN GmbH\nGesellschaft mit beschränkter Haftung\nBrandenburg an der Havel\n\nBei der nachstehenden Gesellschaft wird das Amtslöschungsverfahren gemäß § 394 FamFG eingeleitet. Widerspruchsfrist: 8 Wochen"
    },
    {
      "date": "2025-01-14",
      "id": "98494",
      "original_text": "Registerbekanntmachung nach dem Umwandlungsgesetz\nBerlin Amtsgericht Berlin (Charlottenburg) HRB 194654\nGoCareJobs GmbH – Berlin",
      "type": "Registerbekanntmachung nach dem Umwandlungsgesetz",
      "state": "Berlin",
      "amtsgericht": "Amtsgericht Berlin (Charlottenburg)",
      "registernummer": "HRB 194654",
      "registerart": "HRB",
      "company_name": "GoCareJobs GmbH",
      "company_seat": "Berlin",
      "details": "14.01.2025 (Bekanntmachungsdatum)\n\nBerlin Amtsgericht Berlin (Charlottenburg) HRB 194654\nRegisterbekanntmachung nach dem Umwandlungsgesetz 06.02.2019 (Eintragungsdatum)\n\nGoCareJobs GmbH\nGesellschaft mit beschränkter Haftung\nBerlin\n\nZu Eintragungsnummer 2 vom 06.02.2019 wird als nicht eingetragen veröffentlicht: Den Gläubigern der an der Verschmelzung beteiligten Rechtsträger ist, wenn sie binnen sechs Monaten nach dem Tag, an dem die Eintragung der Verschmelzung in das Register des Sitzes desjenigen Rechtsträgers, dessen Gläubiger sie sind, als bekannt gemacht gilt, ihren Anspruch nach Grund und Höhe schriftlich anmelden, Sicherheit zu leisten, soweit sie nicht Befriedigung verlangen können. Dieses Recht steht den Gläubigern jedoch nur zu, wenn sie glaubhaft machen, dass durch die Verschmelzung die Erfüllung ihrer Forderung gefährdet wird. Das Recht, Sicherheitsleistung zu verlangen, steht Gläubigern nicht zu, die im Falle der Insolvenz ein Recht auf vorzugsweise Befriedigung aus einer Deckungsmasse haben, die nach gesetzlicher Vorschrift zu ihrem Schutz errichtet und staatlich überwacht ist."
    },
    {
      "date": "2025-01-14",
      "id": "98495",
      "original_text": "Löschungsankündigung\nBerlin Amtsgericht Berlin (Charlottenburg) HRB 243641\nLechner Verwaltungs GmbH – Berlin",
      "type": "Löschungsankündigung",
      "state": "Berlin",
      "amtsgericht": "Amtsgericht Berlin (Charlottenburg)",
      "registernummer": "HRB 243641",
      "registerart": "HRB",
      "company_name": "Lechner Verwaltungs GmbH",
      "company_seat": "Berlin",
      "details": "14.01.2025 (Bekanntmachungsdatum)\n\nBerlin Amtsgericht Berlin (Charlottenburg) HRB 243641\nLöschungsankündigung\n\nLechner Verwaltungs GmbH\nGesellschaft mit beschränkter Haftung\nBerlin\n\nBei der nachstehenden Gesellschaft wird das Amtslöschungsverfahren gemäß § 394 FamFG eingeleitet. Widerspruchsfrist 6 Wochen"
    },
    {
      "date": "2025-01-14",
      "id": "98496",
      "original_text": "Löschungsankündigung\nBrandenburg Amtsgericht Potsdam HRB 24081\nLehniner Kabeltief und Rohrleitungsbau GmbH – Kloster Lehnin",
      "type": "Löschungsankündigung",
      "state": "Brandenburg",
      "amtsgericht": "Amtsgericht Potsdam",
      "registernummer": "HRB 24081",
      "registerart": "HRB",
      "company_name": "Lehniner Kabeltief und Rohrleitungsbau GmbH",
      "company_seat": "Kloster Lehnin",
      "details": "14.01.2025 (Bekanntmachungsdatum)\n\nBrandenburg Amtsgericht Potsdam HRB 24081\nLöschungsankündigung\n\nLehniner Kabeltief und Rohrleitungsbau GmbH\nGesellschaft mit beschränkter Haftung\nKloster Lehnin\n\nBei der nachstehenden Gesellschaft wird das Amtslöschungsverfahren gemäß § 394 FamFG eingeleitet. Widerspruchsfrist: 8 Wochen"
    },
    {
      "date": "2025-01-14",
      "id": "98497",
      "original_text": "Registerbekanntmachung nach dem Umwandlungsgesetz\nBerlin Amtsgericht Berlin (Charlottenburg) HRB 194654\nGoCareJobs GmbH – Berlin",
      "type": "Registerbekanntmachung nach dem Umwandlungsgesetz",
      "state": "Berlin",
      "amtsgericht": "Amtsgericht Berlin (Charlottenburg)",
      "registernummer": "HRB 194654",
      "registerart": "HRB",
      "company_name": "GoCareJobs GmbH",
      "company_seat": "Berlin",
      "details": "14.01.2025 (Bekanntmachungsdatum)\n\nBerlin Amtsgericht Berlin (Charlottenburg) HRB 194654\nRegisterbekanntmachung nach dem Umwandlungsgesetz 14.01.2025 (Eintragungsdatum)\n\nGoCareJobs GmbH\nGesellschaft mit beschränkter Haftung\nBerlin\n\nZu Eintragungsnummer 3 vom 14.01.2025 wird als nicht eingetragen veröffentlicht: Den Gläubigern der an der Verschmelzung beteiligten Rechtsträger ist, wenn sie binnen sechs Monaten nach dem Tag, an dem die Eintragung der Verschmelzung in das Register des Sitzes desjenigen Rechtsträgers, dessen Gläubiger sie sind, als bekannt gemacht gilt, ihren Anspruch nach Grund und Höhe schriftlich anmelden, Sicherheit zu leisten, soweit sie nicht Befriedigung verlangen können. Dieses Recht steht den Gläubigern jedoch nur zu, wenn sie glaubhaft machen, dass durch die Verschmelzung die Erfüllung ihrer Forderung gefährdet wird. Das Recht, Sicherheitsleistung zu verlangen, steht Gläubigern nicht zu, die im Falle der Insolvenz ein Recht auf vorzugsweise Befriedigung aus einer Deckungsmasse haben, die nach gesetzlicher Vorschrift zu ihrem Schutz errichtet und staatlich überwacht ist."
    },
    {
      "date": "2025-01-14",
      "id": "98498",
      "original_text": "Sonstige Registerbekanntmachung\nBaden-Württemberg Amtsgericht Stuttgart HRB 21447\nDYMATRIX GmbH – Stuttgart",
      "type": "Sonstige Registerbekanntmachung",
      "state": "Baden-Württemberg",
      "amtsgericht": "Amtsgericht Stuttgart",
      "registernummer": "HRB 21447",
      "registerart": "HRB",
      "company_name": "DYMATRIX GmbH",
      "company_seat": "Stuttgart",
      "details": "14.01.2025 (Bekanntmachungsdatum)\n\nBaden-Württemberg Amtsgericht Stuttgart HRB 21447\nSonstige Registerbekanntmachung 14.01.2025 (Eintragungsdatum)\n\nDYMATRIX GmbH\nGesellschaft mit beschränkter Haftung\nStuttgart\n\nAls nicht eingetragen wird bekanntgemacht:\nDen Gläubigern der Gesellschaft, deren Forderungen begründet worden sind, bevor die Eintragung der Beendigung des Vertrages in das Handelsregister nach § 10 HGB als bekanntgemacht gilt, ist vom anderen Vertragsteil Sicherheit zu leisten, wenn sie sich binnen sechs Monaten nach der Bekanntmachung zu diesem Zweck bei ihm melden."
    },
    {
      "date": "2025-01-14",
      "id": "98499",
      "original_text": "Registerbekanntmachung nach dem Umwandlungsgesetz\nHamburg Amtsgericht Hamburg HRA 131859\nST Obst & Gemüse Großhandel e.K. – Hamburg",
      "type": "Registerbekanntmachung nach dem Umwandlungsgesetz",
      "state": "Hamburg",
      "amtsgericht": "Amtsgericht Hamburg",
      "registernummer": "HRA 131859",
      "registerart": "HRA",
      "company_name": "ST Obst & Gemüse Großhandel e.K.",
      "company_seat": "Hamburg",
      "details": "14.01.2025 (Bekanntmachungsdatum)\n\nHamburg Amtsgericht Hamburg HRA 131859\nRegisterbekanntmachung nach dem Umwandlungsgesetz 14.01.2025 (Eintragungsdatum)\n\nST Obst & Gemüse Großhandel e.K.\nEinzelkaufmann\nHamburg\n\nAls nicht eingetragen wird bekannt gemacht:\nDen Gläubigern der an der Ausgliederung beteiligten Gesellschaften ist, wenn sie binnen sechs Monaten nach dem Tag, an dem die Eintragung der Ausgliederung in das Register des Sitzes desjenigen Rechtsträgers, dessen Gläubiger sie sind, nach § 19 Absatz 3 UmwG als bekannt gemacht gilt, ihren Anspruch nach Grund und Höhe schriftlich anmelden, Sicherheit zu leisten, soweit sie nicht Befriedigung verlangen können. Dieses Recht steht den Gläubigern jedoch nur zu, wenn sie glaubhaft machen, dass durch die Ausgliederung die Erfüllung ihrer Forderung gefährdet wird."
    },
    {
      "date": "2025-01-14",
      "id": "98500",
      "original_text": "Einreichung neuer Dokumente\nBerlin Amtsgericht Berlin (Charlottenburg) HRB 135502\nGRTgaz Deutschland GmbH – Berlin",
      "type": "Einreichung neuer Dokumente",
      "state": "Berlin",
      "amtsgericht": "Amtsgericht Berlin (Charlottenburg)",
      "registernummer": "HRB 135502",
      "registerart": "HRB",
      "company_name": "GRTgaz Deutschland GmbH",
      "company_seat": "Berlin",
      "details": "14.01.2025 (Bekanntmachungsdatum)\n\nBerlin Amtsgericht Berlin (Charlottenburg) HRB 135502\nEinreichung neuer Dokumente\n\nGRTgaz Deutschland GmbH\nGesellschaft mit beschränkter Haftung\nBerlin\n\nAls nicht eingetragen wird veröffentlicht: Es wurde eine neue Liste der Aufsichtsratsmitglieder eingereicht (§52 GmbHG)."
    },
    {
      "date": "2025-01-14",
      "id": "98501",
      "original_text": "Löschungsankündigung\nBerlin Amtsgericht Berlin (Charlottenburg) HRB 215531\nYelTec UG (haftungsbeschränkt) – Berlin",
      "type": "Löschungsankündigung",
      "state": "Berlin",
      "amtsgericht": "Amtsgericht Berlin (Charlottenburg)",
      "registernummer": "HRB 215531",
      "registerart": "HRB",
      "company_name": "YelTec UG (haftungsbeschränkt)",
      "company_seat": "Berlin",
      "details": "14.01.2025 (Bekanntmachungsdatum)\n\nBerlin Amtsgericht Berlin (Charlottenburg) HRB 215531\nLöschungsankündigung\n\nYelTec UG (haftungsbeschränkt)\nGesellschaft mit beschränkter Haftung\nBerlin\n\nBei der nachstehenden Gesellschaft wird das Amtslöschungsverfahren gemäß § 394 FamFG eingeleitet. Widerspruchsfrist: 6 Wochen."
    },
    {
      "date": "2025-01-14",
      "id": "98502",
      "original_text": "Registerbekanntmachung nach dem Umwandlungsgesetz\nBaden-Württemberg Amtsgericht Stuttgart HRB 766317\nOzean Group GmbH – Herrenberg",
      "type": "Registerbekanntmachung nach dem Umwandlungsgesetz",
      "state": "Baden-Württemberg",
      "amtsgericht": "Amtsgericht Stuttgart",
      "registernummer": "HRB 766317",
      "registerart": "HRB",
      "company_name": "Ozean Group GmbH",
      "company_seat": "Herrenberg",
      "details": "14.01.2025 (Bekanntmachungsdatum)\n\nBaden-Württemberg Amtsgericht Stuttgart HRB 766317\nRegisterbekanntmachung nach dem Umwandlungsgesetz 14.01.2025 (Eintragungsdatum)\n\nOzean Group GmbH\nGesellschaft mit beschränkter Haftung\nHerrenberg\n\nAls nicht eingetragen wird bekanntgemacht:\nDen Gläubigern der an der Verschmelzung beteiligten Rechtsträger ist, wenn sie binnen sechs Monaten nach dem Tag, an dem die Eintragung der Verschmelzung in das Register des Sitzes desjenigen Rechtsträgers, dessen Gläubiger sie sind, nach § 19 Abs. 3 UmwG als bekanntgemacht gilt, ihren Anspruch nach Grund und Höhe schriftlich anmelden, Sicherheit zu leisten, soweit sie nicht Befriedigung verlangen können. Dieses Recht steht den Gläubigern jedoch nur zu, wenn sie glaubhaft machen, dass durch die Verschmelzung die Erfüllung ihrer Forderung gefährdet wird."
    },
    {
      "date": "2025-01-14",
      "id": "98503",
      "original_text": "Löschungsankündigung\nSchleswig-Holstein Amtsgericht Lübeck HRB 10761\nTEKA Geschäftsführungs-GmbH – Ahrensburg",
      "type": "Löschungsankündigung",
      "state": "Schleswig-Holstein",
      "amtsgericht": "Amtsgericht Lübeck",
      "registernummer": "HRB 10761",
      "registerart": "HRB",
      "company_name": "TEKA Geschäftsführungs-GmbH",
      "company_seat": "Ahrensburg",
      "details": "14.01.2025 (Bekanntmachungsdatum)\n\nSchleswig-Holstein Amtsgericht Lübeck HRB 10761\nLöschungsankündigung\n\nTEKA Geschäftsführungs-GmbH\nGesellschaft mit beschränkter Haftung\nAhrensburg\n\nEs ist die Löschung der nachstehenden Gesellschaft wegen Vermögenslosigkeit gemäß § 394 FamFG beabsichtigt.\nWiderspruchsfrist: 1 Monat."
    },
    {
      "date": "2025-01-14",
      "id": "98504",
      "original_text": "Registerbekanntmachung nach dem Umwandlungsgesetz\nBaden-Württemberg Amtsgericht Stuttgart HRB 788478\nNAI Management GmbH – Herrenberg",
      "type": "Registerbekanntmachung nach dem Umwandlungsgesetz",
      "state": "Baden-Württemberg",
      "amtsgericht": "Amtsgericht Stuttgart",
      "registernummer": "HRB 788478",
      "registerart": "HRB",
      "company_name": "NAI Management GmbH",
      "company_seat": "Herrenberg",
      "details": "14.01.2025 (Bekanntmachungsdatum)\n\nBaden-Württemberg Amtsgericht Stuttgart HRB 788478\nRegisterbekanntmachung nach dem Umwandlungsgesetz 14.01.2025 (Eintragungsdatum)\n\nNAI Management GmbH\nGesellschaft mit beschränkter Haftung\nHerrenberg\n\nAls nicht eingetragen wird bekanntgemacht:\nDen Gläubigern der an der Verschmelzung beteiligten Rechtsträger ist, wenn sie binnen sechs Monaten nach dem Tag, an dem die Eintragung der Verschmelzung in das Register des Sitzes desjenigen Rechtsträgers, dessen Gläubiger sie sind, nach § 19 Abs. 3 UmwG als bekanntgemacht gilt, ihren Anspruch nach Grund und Höhe schriftlich anmelden, Sicherheit zu leisten, soweit sie nicht Befriedigung verlangen können. Dieses Recht steht den Gläubigern jedoch nur zu, wenn sie glaubhaft machen, dass durch die Verschmelzung die Erfüllung ihrer Forderung gefährdet wird."
    },
    {
      "date": "2025-01-14",
      "id": "98505",
      "original_text": "Einreichung neuer Dokumente\nBerlin Amtsgericht Berlin (Charlottenburg) HRB 54751\nKinder- und Jugendfreizeitzentrum Wuhlheide - Landesmusikakademie - gemeinnützige Betriebsgesellschaft mbH – Berlin",
      "type": "Einreichung neuer Dokumente",
      "state": "Berlin",
      "amtsgericht": "Amtsgericht Berlin (Charlottenburg)",
      "registernummer": "HRB 54751",
      "registerart": "HRB",
      "company_name": "Kinder- und Jugendfreizeitzentrum Wuhlheide - Landesmusikakademie - gemeinnützige Betriebsgesellschaft mbH",
      "company_seat": "Berlin",
      "details": "14.01.2025 (Bekanntmachungsdatum)\n\nBerlin Amtsgericht Berlin (Charlottenburg) HRB 54751\nEinreichung neuer Dokumente\n\nKinder- und Jugendfreizeitzentrum Wuhlheide - Landesmusikakademie - gemeinnützige Betriebsgesellschaft mbH\nGesellschaft mit beschränkter Haftung\nBerlin\n\nAls nicht eingetragen wird veröffentlicht:"
    },
    {
      "date": "2025-01-14",
      "id": "98506",
      "original_text": "Sonstige Registerbekanntmachung\nBaden-Württemberg Amtsgericht Freiburg HRB 709513\nTauron Ventures GmbH – Konstanz",
      "type": "Sonstige Registerbekanntmachung",
      "state": "Baden-Württemberg",
      "amtsgericht": "Amtsgericht Freiburg",
      "registernummer": "HRB 709513",
      "registerart": "HRB",
      "company_name": "Tauron Ventures GmbH",
      "company_seat": "Konstanz",
      "details": "14.01.2025 (Bekanntmachungsdatum)\n\nBaden-Württemberg Amtsgericht Freiburg HRB 709513\nSonstige Registerbekanntmachung 14.01.2025 (Eintragungsdatum)\n\nTauron Ventures GmbH\nGesellschaft mit beschränkter Haftung\nKonstanz\n\nAls nicht eingetragen wird bekanntgemacht:\nDen Gläubigern der Gesellschaft, deren Forderungen begründet worden sind, bevor die Eintragung der Beendigung des Vertrages in das Handelsregister nach § 10 HGB als bekanntgemacht gilt, ist vom anderen Vertragsteil Sicherheit zu leisten, wenn sie sich binnen sechs Monaten nach der Bekanntmachung zu diesem Zweck bei ihm melden."
    },
    {
      "date": "2025-01-14",
      "id": "98507",
      "original_text": "Registerbekanntmachung nach dem Umwandlungsgesetz\nBaden-Württemberg Amtsgericht Freiburg VR 701717\nDeutsche Verkehrswissenschaftliche Gesellschaft Bezirksvereinigung Freiburg e. V. – Freiburg im Breisgau",
      "type": "Registerbekanntmachung nach dem Umwandlungsgesetz",
      "state": "Baden-Württemberg",
      "amtsgericht": "Amtsgericht Freiburg",
      "registernummer": "VR 701717",
      "registerart": "VR",
      "company_name": "Deutsche Verkehrswissenschaftliche Gesellschaft Bezirksvereinigung Freiburg e. V.",
      "company_seat": "Freiburg im Breisgau",
      "details": ""
    },
    {
      "date": "2025-01-14",
      "id": "98508",
      "original_text": "Löschungsankündigung\nBerlin Amtsgericht Berlin (Charlottenburg) HRB 104197\nK. A. Automaten GmbH – Berlin",
      "type": "Löschungsankündigung",
      "state": "Berlin",
      "amtsgericht": "Amtsgericht Berlin (Charlottenburg)",
      "registernummer": "HRB 104197",
      "registerart": "HRB",
      "company_name": "K. A. Automaten GmbH",
      "company_seat": "Berlin",
      "details": "14.01.2025 (Bekanntmachungsdatum)\n\nBerlin Amtsgericht Berlin (Charlottenburg) HRB 104197\nLöschungsankündigung\n\nK. A. Automaten GmbH\nGesellschaft mit beschränkter Haftung\nBerlin\n\nBei der nachstehenden Gesellschaft wird das Amtslöschungsverfahren gemäß § 394 FamFG eingeleitet. Widerspruchsfrist 6 Wochen"
    },
    {
      "date": "2025-01-14",
      "id": "98509",
      "original_text": "Löschungsankündigung\nBrandenburg Amtsgericht Neuruppin HRB 6053\nElbeOel Prignitz (EOP) AG – Falkenhagen",
      "type": "Löschungsankündigung",
      "state": "Brandenburg",
      "amtsgericht": "Amtsgericht Neuruppin",
      "registernummer": "HRB 6053",
      "registerart": "HRB",
      "company_name": "ElbeOel Prignitz (EOP) AG",
      "company_seat": "Falkenhagen",
      "details": "14.01.2025 (Bekanntmachungsdatum)\n\nBrandenburg Amtsgericht Neuruppin HRB 6053\nLöschungsankündigung\n\nElbeOel Prignitz (EOP) AG\nAktiengesellschaft\nFalkenhagen\n\nBei der nachstehenden Gesellschaft wird das Amtslöschungsverfahren gemäß § 394 FamFG eingeleitet.\nWiderspruchsfrist: 1 Monat"
    },
    {
      "date": "2025-01-14",
      "id": "98510",
      "original_text": "Einreichung neuer Dokumente\nBaden-Württemberg Amtsgericht Freiburg HRB 381756\nStadtwerke Konstanz GmbH – Konstanz",
      "type": "Einreichung neuer Dokumente",
      "state": "Baden-Württemberg",
      "amtsgericht": "Amtsgericht Freiburg",
      "registernummer": "HRB 381756",
      "registerart": "HRB",
      "company_name": "Stadtwerke Konstanz GmbH",
      "company_seat": "Konstanz",
      "details": "14.01.2025 (Bekanntmachungsdatum)\n\nBaden-Württemberg Amtsgericht Freiburg HRB 381756\nEinreichung neuer Dokumente 14.01.2025 (Eintragungsdatum)\n\nStadtwerke Konstanz GmbH\nGesellschaft mit beschränkter Haftung\nKonstanz\n\nDie Gesellschaft hat am 07.01.2025 die Liste über die Zusammensetzung des Aufsichtsrats zum Handelsregister eingereicht."
    },
    {
      "date": "2025-01-14",
      "id": "98511",
      "original_text": "Registerbekanntmachung nach dem Umwandlungsgesetz\nHamburg Amtsgericht Hamburg VR 11357\nFreundeskreise für Suchtkrankenhilfe Landesverband Hamburg e.V. – Hamburg",
      "type": "Registerbekanntmachung nach dem Umwandlungsgesetz",
      "state": "Hamburg",
      "amtsgericht": "Amtsgericht Hamburg",
      "registernummer": "VR 11357",
      "registerart": "VR",
      "company_name": "Freundeskreise für Suchtkrankenhilfe Landesverband Hamburg e.V.",
      "company_seat": "Hamburg",
      "details": "14.01.2025 (Bekanntmachungsdatum)\n\nHamburg Amtsgericht Hamburg VR 11357\nRegisterbekanntmachung nach dem Umwandlungsgesetz 14.01.2025 (Eintragungsdatum)\n\nFreundeskreise für Suchtkrankenhilfe Landesverband Hamburg e.V.\neingetragener Verein\nHamburg\n\nAls nicht eingetragen wird bekannt gemacht:\nDen Gläubigern der an der Verschmelzung beteiligten Gesellschaften ist, wenn sie binnen sechs Monaten nach dem Tag, an dem die Eintragung der Verschmelzung in das Register des Sitzes desjenigen Rechtsträgers, dessen Gläubiger sie sind, nach § 19 Absatz 3 UmwG als bekannt gemacht gilt, ihren Anspruch nach Grund und Höhe schriftlich anmelden, Sicherheit zu leisten, soweit sie nicht Befriedigung verlangen können. Dieses Recht steht den Gläubigern jedoch nur zu, wenn sie glaubhaft machen, dass durch die Verschmelzung die Erfüllung ihrer Forderung gefährdet wird."
    },
    {
      "date": "2025-01-14",
      "id": "98512",
      "original_text": "Löschungsankündigung\nBaden-Württemberg Amtsgericht Stuttgart HRB 741903\nGinvest GmbH – Geislingen",
      "type": "Löschungsankündigung",
      "state": "Baden-Württemberg",
      "amtsgericht": "Amtsgericht Stuttgart",
      "registernummer": "HRB 741903",
      "registerart": "HRB",
      "company_name": "Ginvest GmbH",
      "company_seat": "Geislingen",
      "details": "14.01.2025 (Bekanntmachungsdatum)\n\nBaden-Württemberg Amtsgericht Stuttgart HRB 741903\nLöschungsankündigung\n\nGinvest GmbH\nGesellschaft mit beschränkter Haftung\nGeislingen\n\nDas Gericht beabsichtigt, die Gesellschaft wegen Vermögenslosigkeit im Handelsregister von Amts wegen nach § 394 FamFG zu löschen. Die Frist zur Geltendmachung eines Widerspruchs gegen die beabsichtigte Löschung ist auf zwei Monate ab Veröffentlichung bestimmt."
    },
    {
      "date": "2025-01-14",
      "id": "98513",
      "original_text": "Registerbekanntmachung nach dem Umwandlungsgesetz\nBaden-Württemberg Amtsgericht Stuttgart HRB 730565\nBS Capital AG – Heilbronn",
      "type": "Registerbekanntmachung nach dem Umwandlungsgesetz",
      "state": "Baden-Württemberg",
      "amtsgericht": "Amtsgericht Stuttgart",
      "registernummer": "HRB 730565",
      "registerart": "HRB",
      "company_name": "BS Capital AG",
      "company_seat": "Heilbronn",
      "details": "14.01.2025 (Bekanntmachungsdatum)\n\nBaden-Württemberg Amtsgericht Stuttgart HRB 730565\nRegisterbekanntmachung nach dem Umwandlungsgesetz 14.01.2025 (Eintragungsdatum)\n\nBS Capital AG\nAktiengesellschaft\nHeilbronn\n\nDen Gläubigern des an dem Formwechsel beteiligten Rechtsträgers ist, wenn sie binnen sechs Monaten nach dem Tag, an dem die Eintragung des Formwechsels in das Register des Sitzes desjenigen Rechtsträgers, dessen Gläubiger sie sind, nach § 19 Abs. 3 UmwG als bekanntgemacht gilt, ihren Anspruch nach Grund und Höhe schriftlich anmelden, Sicherheit zu leisten, soweit sie nicht Befriedigung verlangen können. Dieses Recht steht den Gläubigern jedoch nur zu, wenn sie glaubhaft machen, dass durch den Formwechsel die Erfüllung ihrer Forderung gefährdet wird."
    },
    {
      "date": "2025-01-14",
      "id": "98514",
      "original_text": "Registerbekanntmachung nach dem Umwandlungsgesetz\nBaden-Württemberg Amtsgericht Stuttgart HRB 797907\nBS Capital GmbH – Heilbronn",
      "type": "Registerbekanntmachung nach dem Umwandlungsgesetz",
      "state": "Baden-Württemberg",
      "amtsgericht": "Amtsgericht Stuttgart",
      "registernummer": "HRB 797907",
      "registerart": "HRB",
      "company_name": "BS Capital GmbH",
      "company_seat": "Heilbronn",
      "details": "14.01.2025 (Bekanntmachungsdatum)\n\nBaden-Württemberg Amtsgericht Stuttgart HRB 797907\nRegisterbekanntmachung nach dem Umwandlungsgesetz 14.01.2025 (Eintragungsdatum)\n\nBS Capital GmbH\nGesellschaft mit beschränkter Haftung\nHeilbronn\n\nDen Gläubigern des an dem Formwechsel beteiligten Rechtsträgers ist, wenn sie binnen sechs Monaten nach dem Tag, an dem die Eintragung des Formwechsels in das Register des Sitzes desjenigen Rechtsträgers, dessen Gläubiger sie sind, nach § 19 Abs. 3 UmwG als bekanntgemacht gilt, ihren Anspruch nach Grund und Höhe schriftlich anmelden, Sicherheit zu leisten, soweit sie nicht Befriedigung verlangen können. Dieses Recht steht den Gläubigern jedoch nur zu, wenn sie glaubhaft machen, dass durch den Formwechsel die Erfüllung ihrer Forderung gefährdet wird."
    },
    {
      "date": "2025-01-14",
      "id": "98515",
      "original_text": "Sonstige Registerbekanntmachung\nBrandenburg Amtsgericht Cottbus HRB 988\nGebäudewirtschaft Cottbus GmbH – Cottbus",
      "type": "Sonstige Registerbekanntmachung",
      "state": "Brandenburg",
      "amtsgericht": "Amtsgericht Cottbus",
      "registernummer": "HRB 988",
      "registerart": "HRB",
      "company_name": "Gebäudewirtschaft Cottbus GmbH",
      "company_seat": "Cottbus",
      "details": "14.01.2025 (Bekanntmachungsdatum)\n\nBrandenburg Amtsgericht Cottbus HRB 988\nSonstige Registerbekanntmachung\n\nGebäudewirtschaft Cottbus GmbH\nGesellschaft mit beschränkter Haftung\nCottbus\n\nDer Geschäftsführer hat eine Liste der Aufsichtsratsmitglieder gem. § 52 Abs. 2 Satz 2 GmbHG zum Handelsregister eingereicht."
    },
    {
      "date": "2025-01-14",
      "id": "98516",
      "original_text": "Einreichung neuer Dokumente\nBerlin Amtsgericht Berlin (Charlottenburg) HRB 5484\nMesse Berlin GmbH – Berlin",
      "type": "Einreichung neuer Dokumente",
      "state": "Berlin",
      "amtsgericht": "Amtsgericht Berlin (Charlottenburg)",
      "registernummer": "HRB 5484",
      "registerart": "HRB",
      "company_name": "Messe Berlin GmbH",
      "company_seat": "Berlin",
      "details": "14.01.2025 (Bekanntmachungsdatum)\n\nBerlin Amtsgericht Berlin (Charlottenburg) HRB 5484\nEinreichung neuer Dokumente\n\nMesse Berlin GmbH\nGesellschaft mit beschränkter Haftung\nBerlin\n\nAls nicht eingetragen wird veröffentlicht:Es wurde eine neue Liste der Aufsichtsratsmitglieder eingereicht (§ 106 AktG)."
    },
    {
      "date": "2025-01-14",
      "id": "98517",
      "original_text": "Registerbekanntmachung nach dem Umwandlungsgesetz\nBaden-Württemberg Amtsgericht Stuttgart HRB 758721\nDATAGROUP SE – Pliezhausen",
      "type": "Registerbekanntmachung nach dem Umwandlungsgesetz",
      "state": "Baden-Württemberg",
      "amtsgericht": "Amtsgericht Stuttgart",
      "registernummer": "HRB 758721",
      "registerart": "HRB",
      "company_name": "DATAGROUP SE",
      "company_seat": "Pliezhausen",
      "details": "14.01.2025 (Bekanntmachungsdatum)\n\nBaden-Württemberg Amtsgericht Stuttgart HRB 758721\nRegisterbekanntmachung nach dem Umwandlungsgesetz 14.01.2025 (Eintragungsdatum)\n\nDATAGROUP SE\nEuropäische Aktiengesellschaft (SE)\nPliezhausen\n\nDen Gläubigern der an der Abspaltung beteiligten Rechtsträger ist, wenn sie binnen sechs Monaten nach dem Tag, an dem die Eintragung der Abspaltung in das Register des Sitzes desjenigen Rechtsträgers, dessen Gläubiger sie sind, nach § 19 Abs. 3 UmwG als bekanntgemacht gilt, ihren Anspruch nach Grund und Höhe schriftlich anmelden, Sicherheit zu leisten, soweit sie nicht Befriedigung verlangen können. Dieses Recht steht den Gläubigern jedoch nur zu, wenn sie glaubhaft machen, dass durch die Abspaltung die Erfüllung ihrer Forderung gefährdet wird."
    },
    {
      "date": "2025-01-14",
      "id": "98518",
      "original_text": "Sonstige Registerbekanntmachung\nBaden-Württemberg Amtsgericht Freiburg GnR 700002\nthe seed eG – Schopfheim",
      "type": "Sonstige Registerbekanntmachung",
      "state": "Baden-Württemberg",
      "amtsgericht": "Amtsgericht Freiburg",
      "registernummer": "GnR 700002",
      "registerart": "GnR",
      "company_name": "the seed eG",
      "company_seat": "Schopfheim",
      "details": "14.01.2025 (Bekanntmachungsdatum)\n\nBaden-Württemberg Amtsgericht Freiburg GnR 700002\nSonstige Registerbekanntmachung 14.01.2025 (Eintragungsdatum)\n\nthe seed eG\neingetragene Genossenschaft\nSchopfheim\n\nDie Verpflichtung der Genossen, Nachschüsse zur Insolvenzmasse zu leisten, wurde aufgehoben.\nDen Gläubigern der Genossenschaft ist, wenn sie sich binnen sechs Monaten nach der Bekanntmachung bei der Genossenschaft zu diesem Zweck melden, Sicherheit zu leisten, soweit sie nicht Befriedigung verlangen können."
    },
    {
      "date": "2025-01-14",
      "id": "98519",
      "original_text": "Einreichung neuer Dokumente\nSachsen-Anhalt Amtsgericht Stendal HRB 102033\nIlsenburger Wohnungsbaugesellschaft mbH – Ilsenburg",
      "type": "Einreichung neuer Dokumente",
      "state": "Sachsen-Anhalt",
      "amtsgericht": "Amtsgericht Stendal",
      "registernummer": "HRB 102033",
      "registerart": "HRB",
      "company_name": "Ilsenburger Wohnungsbaugesellschaft mbH",
      "company_seat": "Ilsenburg",
      "details": "14.01.2025 (Bekanntmachungsdatum)\n\nSachsen-Anhalt Amtsgericht Stendal HRB 102033\nEinreichung neuer Dokumente 14.01.2025 (Eintragungsdatum)\n\nIlsenburger Wohnungsbaugesellschaft mbH\nGesellschaft mit beschränkter Haftung\nIlsenburg\n\nEine Liste der Mitglieder des Aufsichtsrates wurde zum Handelsregister eingereicht."
    },
    {
      "date": "2025-01-14",
      "id": "98520",
      "original_text": "Einreichung neuer Dokumente\nBrandenburg Amtsgericht Cottbus HRB 1315\nWohnungsbau- und -verwaltungsgesellschaft ,,Vorspreewald\" mbH – Peitz",
      "type": "Einreichung neuer Dokumente",
      "state": "Brandenburg",
      "amtsgericht": "Amtsgericht Cottbus",
      "registernummer": "HRB 1315",
      "registerart": "HRB",
      "company_name": "Wohnungsbau- und -verwaltungsgesellschaft ,,Vorspreewald\" mbH",
      "company_seat": "Peitz",
      "details": "14.01.2025 (Bekanntmachungsdatum)\n\nBrandenburg Amtsgericht Cottbus HRB 1315\nEinreichung neuer Dokumente\n\nWohnungsbau- und -verwaltungsgesellschaft ,,Vorspreewald\" mbH\nGesellschaft mit beschränkter Haftung\nPeitz\n\nAls nicht eingetragen wird veröffentlicht:\nDie aktuelle Liste der Aufsichtsratsmitglieder wurde zum Handelsregister gem. § 52 Abs. 3 GmbHG eingereicht."
    },
    {
      "date": "2025-01-14",
      "id": "98521",
      "original_text": "Sonstige Registerbekanntmachung\nThüringen Amtsgericht Jena HRB 104491\nAmber-Bäuerliche Aktiengesellschaft – Georgenthal",
      "type": "Sonstige Registerbekanntmachung",
      "state": "Thüringen",
      "amtsgericht": "Amtsgericht Jena",
      "registernummer": "HRB 104491",
      "registerart": "HRB",
      "company_name": "Amber-Bäuerliche Aktiengesellschaft",
      "company_seat": "Georgenthal",
      "details": "14.01.2025 (Bekanntmachungsdatum)\n\nThüringen Amtsgericht Jena HRB 104491\nSonstige Registerbekanntmachung\n\nAmber-Bäuerliche Aktiengesellschaft\nAktiengesellschaft\nGeorgenthal\n\nBekanntmachung gem. § 106 AktG: Aufgrund einer Veränderung in den Personen der Aufsichtsratsmitglieder ist durch den Vorstand eine neue Liste zum Handelsregister eingereicht worden."
    },
    {
      "date": "2025-01-14",
      "id": "98522",
      "original_text": "Einreichung neuer Dokumente\nThüringen Amtsgericht Jena HRB 102528\nEnergieversorgung Inselsberg GmbH – Waltershausen",
      "type": "Einreichung neuer Dokumente",
      "state": "Thüringen",
      "amtsgericht": "Amtsgericht Jena",
      "registernummer": "HRB 102528",
      "registerart": "HRB",
      "company_name": "Energieversorgung Inselsberg GmbH",
      "company_seat": "Waltershausen",
      "details": "14.01.2025 (Bekanntmachungsdatum)\n\nThüringen Amtsgericht Jena HRB 102528\nEinreichung neuer Dokumente\n\nEnergieversorgung Inselsberg GmbH\nGesellschaft mit beschränkter Haftung\nWaltershausen\n\nBekanntmachung gem. § 52 Abs. 3 Satz 2 GmbHG: Aufgrund einer Veränderung in den Personen der Aufsichtsratsmitglieder ist durch die Geschäftsführer eine neue Liste zum Handelsregister eingereicht worden."
    },
    {
      "date": "2025-01-14",
      "id": "98523",
      "original_text": "Einreichung neuer Dokumente\nBaden-Württemberg Amtsgericht Freiburg HRB 727653\nStadtwerke Konstanz Mobil GmbH – Konstanz",
      "type": "Einreichung neuer Dokumente",
      "state": "Baden-Württemberg",
      "amtsgericht": "Amtsgericht Freiburg",
      "registernummer": "HRB 727653",
      "registerart": "HRB",
      "company_name": "Stadtwerke Konstanz Mobil GmbH",
      "company_seat": "Konstanz",
      "details": "14.01.2025 (Bekanntmachungsdatum)\n\nBaden-Württemberg Amtsgericht Freiburg HRB 727653\nEinreichung neuer Dokumente 14.01.2025 (Eintragungsdatum)\n\nStadtwerke Konstanz Mobil GmbH\nGesellschaft mit beschränkter Haftung\nKonstanz\n\nDie Gesellschaft hat am 07.01.2025 die Liste über die Zusammensetzung des Aufsichtsrats zum Handelsregister eingereicht."
    },
    {
      "date": "2025-01-14",
      "id": "98524",
      "original_text": "Einreichung neuer Dokumente\nHamburg Amtsgericht Hamburg HRB 132441\nSprinkenhof GmbH – Hamburg",
      "type": "Einreichung neuer Dokumente",
      "state": "Hamburg",
      "amtsgericht": "Amtsgericht Hamburg",
      "registernummer": "HRB 132441",
      "registerart": "HRB",
      "company_name": "Sprinkenhof GmbH",
      "company_seat": "Hamburg",
      "details": "14.01.2025 (Bekanntmachungsdatum)\n\nHamburg Amtsgericht Hamburg HRB 132441\nEinreichung neuer Dokumente\n\nSprinkenhof GmbH\nGesellschaft mit beschränkter Haftung\nHamburg\n\nAls nicht eingetragen wird bekannt gemacht: Liste des Aufsichtsrats wurde eingereicht."
    },
    {
      "date": "2025-01-14",
      "id": "98525",
      "original_text": "Löschungsankündigung\nBaden-Württemberg Amtsgericht Freiburg HRB 719465\nShaca UG (haftungsbeschränkt) – Konstanz",
      "type": "Löschungsankündigung",
      "state": "Baden-Württemberg",
      "amtsgericht": "Amtsgericht Freiburg",
      "registernummer": "HRB 719465",
      "registerart": "HRB",
      "company_name": "Shaca UG (haftungsbeschränkt)",
      "company_seat": "Konstanz",
      "details": "14.01.2025 (Bekanntmachungsdatum)\n\nBaden-Württemberg Amtsgericht Freiburg HRB 719465\nLöschungsankündigung\n\nShaca UG (haftungsbeschränkt)\nGesellschaft mit beschränkter Haftung\nKonstanz\n\nDas Gericht beabsichtigt, die Gesellschaft wegen Vermögenslosigkeit im Handelsregister von Amts wegen nach § 394 FamFG zu löschen. Die Frist zur Geltendmachung eines Widerspruchs gegen die beabsichtigte Löschung ist auf einen Monat ab Veröffentlichung bestimmt."
    },
    {
      "date": "2025-01-14",
      "id": "98526",
      "original_text": "Löschungsankündigung\nBaden-Württemberg Amtsgericht Mannheim HRB 504101\nMVS Mittelstand Verbund-Servicecenter GmbH – Pforzheim",
      "type": "Löschungsankündigung",
      "state": "Baden-Württemberg",
      "amtsgericht": "Amtsgericht Mannheim",
      "registernummer": "HRB 504101",
      "registerart": "HRB",
      "company_name": "MVS Mittelstand Verbund-Servicecenter GmbH",
      "company_seat": "Pforzheim",
      "details": "14.01.2025 (Bekanntmachungsdatum)\n\nBaden-Württemberg Amtsgericht Mannheim HRB 504101\nLöschungsankündigung\n\nMVS Mittelstand Verbund-Servicecenter GmbH\nGesellschaft mit beschränkter Haftung\nPforzheim\n\nDas Gericht beabsichtigt, die Gesellschaft wegen Vermögenslosigkeit im Handelsregister von Amts wegen nach § 394 FamFG zu löschen. Die Frist zur Geltendmachung eines Widerspruchs gegen die beabsichtigte Löschung ist auf einen Monat ab Veröffentlichung bestimmt."
    },
    {
      "date": "2025-01-14",
      "id": "98527",
      "original_text": "Löschungsankündigung\nNordrhein-Westfalen Amtsgericht Coesfeld HRB 20799\nInternationale Baumaschinenhandelsgesellschaft mbH – Reken",
      "type": "Löschungsankündigung",
      "state": "Nordrhein-Westfalen",
      "amtsgericht": "Amtsgericht Coesfeld",
      "registernummer": "HRB 20799",
      "registerart": "HRB",
      "company_name": "Internationale Baumaschinenhandelsgesellschaft mbH",
      "company_seat": "Reken",
      "details": "14.01.2025 (Bekanntmachungsdatum)\n\nNordrhein-Westfalen Amtsgericht Coesfeld HRB 20799\nLöschungsankündigung\n\nInternationale Baumaschinenhandelsgesellschaft mbH\nGesellschaft mit beschränkter Haftung\nReken\n\nDas Registergericht beabsichtigt, den Rechtsträger wegen Vermögenslosigkeit gemäß § 394 FamFG von Amts wegen zu löschen.\n\nGegen diese Verfügung kann Widerspruch eingelegt werden. Die Frist zur Erhebung eines Widerspruchs gegen die beabsichtigte Löschung ist auf einen Monat ab Veröffentlichung festgesetzt."
    },
    {
      "date": "2025-01-14",
      "id": "98528",
      "original_text": "Sonstige Registerbekanntmachung\nHamburg Amtsgericht Hamburg HRB 74060\nSalo Holding AG – Hamburg",
      "type": "Sonstige Registerbekanntmachung",
      "state": "Hamburg",
      "amtsgericht": "Amtsgericht Hamburg",
      "registernummer": "HRB 74060",
      "registerart": "HRB",
      "company_name": "Salo Holding AG",
      "company_seat": "Hamburg",
      "details": "14.01.2025 (Bekanntmachungsdatum)\n\nHamburg Amtsgericht Hamburg HRB 74060\nSonstige Registerbekanntmachung 14.01.2025 (Eintragungsdatum)\n\nSalo Holding AG\nAktiengesellschaft\nHamburg\n\nAls nicht eingetragen wird bekannt gemacht: Liste des Aufsichtsrats wurde eingereicht."
    },
    {
      "date": "2025-01-14",
      "id": "98529",
      "original_text": "Sonstige Registerbekanntmachung\nHamburg Amtsgericht Hamburg HRB 124499\nColonia Portfolio Ost GmbH – Hamburg",
      "type": "Sonstige Registerbekanntmachung",
      "state": "Hamburg",
      "amtsgericht": "Amtsgericht Hamburg",
      "registernummer": "HRB 124499",
      "registerart": "HRB",
      "company_name": "Colonia Portfolio Ost GmbH",
      "company_seat": "Hamburg",
      "details": "14.01.2025 (Bekanntmachungsdatum)\n\nHamburg Amtsgericht Hamburg HRB 124499\nSonstige Registerbekanntmachung 14.01.2025 (Eintragungsdatum)\n\nColonia Portfolio Ost GmbH\nGesellschaft mit beschränkter Haftung\nHamburg\n\nAls nicht eingetragen wird bekannt gemacht: Den Gläubigern der Gesellschaft, deren Forderungen begründet worden sind, bevor die Eintragung der Vertragsbeendigung in das Handelsregister nach § 10 HGB als bekannt gemacht gilt, ist vom anderen Vertragsteil Sicherheit zu leisten, wenn sie sich binnen 6 Monaten nach Bekanntmachung der Eintragung zu diesem Zweck bei ihm melden."
    },
    {
      "date": "2025-01-14",
      "id": "98530",
      "original_text": "Einreichung neuer Dokumente\nSaarland Amtsgericht Saarbrücken HRB 3677\nESKAPE Identifikationstechnik AG – Kirkel",
      "type": "Einreichung neuer Dokumente",
      "state": "Saarland",
      "amtsgericht": "Amtsgericht Saarbrücken",
      "registernummer": "HRB 3677",
      "registerart": "HRB",
      "company_name": "ESKAPE Identifikationstechnik AG",
      "company_seat": "Kirkel",
      "details": "14.01.2025 (Bekanntmachungsdatum)\n\nSaarland Amtsgericht Saarbrücken HRB 3677\nEinreichung neuer Dokumente 14.01.2025 (Eintragungsdatum)\n\nESKAPE Identifikationstechnik AG\nAktiengesellschaft\nKirkel\n\nDer Vorstand der Gesellschaft hat eine Liste der Mitglieder des Aufsichtsrats zum Handelsregister eingereicht (§ 106 AktG)."
    },
    {
      "date": "2025-01-14",
      "id": "98531",
      "original_text": "Einreichung neuer Dokumente\nHamburg Amtsgericht Hamburg HRB 158471\nTK Pensionsfonds AG – Hamburg",
      "type": "Einreichung neuer Dokumente",
      "state": "Hamburg",
      "amtsgericht": "Amtsgericht Hamburg",
      "registernummer": "HRB 158471",
      "registerart": "HRB",
      "company_name": "TK Pensionsfonds AG",
      "company_seat": "Hamburg",
      "details": "14.01.2025 (Bekanntmachungsdatum)\n\nHamburg Amtsgericht Hamburg HRB 158471\nEinreichung neuer Dokumente\n\nTK Pensionsfonds AG\nAktiengesellschaft\nHamburg\n\nAls nicht eingetragen wird bekannt gemacht: Liste des Aufsichtsrats wurde eingereicht."
    },
    {
      "date": "2025-01-14",
      "id": "98532",
      "original_text": "Einreichung neuer Dokumente\nBaden-Württemberg Amtsgericht Ulm HRB 632124\nKlinikum Friedrichshafen GmbH – Friedrichshafen",
      "type": "Einreichung neuer Dokumente",
      "state": "Baden-Württemberg",
      "amtsgericht": "Amtsgericht Ulm",
      "registernummer": "HRB 632124",
      "registerart": "HRB",
      "company_name": "Klinikum Friedrichshafen GmbH",
      "company_seat": "Friedrichshafen",
      "details": "14.01.2025 (Bekanntmachungsdatum)\n\nBaden-Württemberg Amtsgericht Ulm HRB 632124\nEinreichung neuer Dokumente\n\nKlinikum Friedrichshafen GmbH\nGesellschaft mit beschränkter Haftung\nFriedrichshafen\n\nDie Gesellschaft hat am 23.12.2024 die Liste über die Zusammensetzung des Aufsichtsrats zum Handelsregister eingereicht."
    },
    {
      "date": "2025-01-14",
      "id": "98533",
      "original_text": "Einreichung neuer Dokumente\nBaden-Württemberg Amtsgericht Stuttgart HRB 763512\nBaden-Württemberg-Tarif GmbH – Stuttgart",
      "type": "Einreichung neuer Dokumente",
      "state": "Baden-Württemberg",
      "amtsgericht": "Amtsgericht Stuttgart",
      "registernummer": "HRB 763512",
      "registerart": "HRB",
      "company_name": "Baden-Württemberg-Tarif GmbH",
      "company_seat": "Stuttgart",
      "details": "14.01.2025 (Bekanntmachungsdatum)\n\nBaden-Württemberg Amtsgericht Stuttgart HRB 763512\nEinreichung neuer Dokumente\n\nBaden-Württemberg-Tarif GmbH\nGesellschaft mit beschränkter Haftung\nStuttgart\n\nDie Gesellschaft hat am 13.01.2025 die Liste über die Zusammensetzung des Aufsichtsrats zum Handelsregister eingereicht."
    },
    {
      "date": "2025-01-14",
      "id": "98534",
      "original_text": "Löschungsankündigung\nBerlin Amtsgericht Berlin (Charlottenburg) HRB 200319\nTLX GastroTec UG (haftungsbeschränkt) – Berlin",
      "type": "Löschungsankündigung",
      "state": "Berlin",
      "amtsgericht": "Amtsgericht Berlin (Charlottenburg)",
      "registernummer": "HRB 200319",
      "registerart": "HRB",
      "company_name": "TLX GastroTec UG (haftungsbeschränkt)",
      "company_seat": "Berlin",
      "details": "14.01.2025 (Bekanntmachungsdatum)\n\nBerlin Amtsgericht Berlin (Charlottenburg) HRB 200319\nLöschungsankündigung\n\nTLX GastroTec UG (haftungsbeschränkt)\nGesellschaft mit beschränkter Haftung\nBerlin\n\nBei der nachstehenden Gesellschaft wird das Amtslöschungsverfahren gemäß § 394 FamFG eingeleitet. Widerspruchsfrist 6 Wochen"
    },
    {
      "date": "2025-01-14",
      "id": "98535",
      "original_text": "Registerbekanntmachung nach dem Umwandlungsgesetz\nSchleswig-Holstein Amtsgericht Kiel HRB 19286\nS. Greve GmbH – Barkelsby",
      "type": "Registerbekanntmachung nach dem Umwandlungsgesetz",
      "state": "Schleswig-Holstein",
      "amtsgericht": "Amtsgericht Kiel",
      "registernummer": "HRB 19286",
      "registerart": "HRB",
      "company_name": "S. Greve GmbH",
      "company_seat": "Barkelsby",
      "details": "14.01.2025 (Bekanntmachungsdatum)\n\nSchleswig-Holstein Amtsgericht Kiel HRB 19286\nRegisterbekanntmachung nach dem Umwandlungsgesetz 27.12.2024 (Eintragungsdatum)\n\nS. Greve GmbH\nGesellschaft mit beschränkter Haftung\nBarkelsby\n\nZu Eintragungsnummer 3 vom 27.12.2024 wird als nicht eingetragen veröffentlicht: Den Gläubigern der an der Verschmelzung beteiligten Rechtsträger ist, wenn sie binnen sechs Monaten nach dem Tag, an dem die Eintragung der Verschmelzung in das Register des Sitzes desjenigen Rechtsträgers, dessen Gläubiger sie sind, nach § 19 Abs. 3 UmwG bekannt gemacht worden ist, ihren Anspruch nach Grund und Höhe schriftlich anmelden, Sicherheit zu leisten, soweit sie nicht Befriedigung verlangen können. Dieses Recht steht den Gläubigern jedoch nur zu, wenn sie glaubhaft machen, dass durch die Verschmelzung die Erfüllung ihrer Forderung gefährdet wird."
    },
    {
      "date": "2025-01-14",
      "id": "98536",
      "original_text": "Löschungsankündigung\nBaden-Württemberg Amtsgericht Stuttgart HRB 22708\nMetzger Haustechnik GmbH – Stuttgart",
      "type": "Löschungsankündigung",
      "state": "Baden-Württemberg",
      "amtsgericht": "Amtsgericht Stuttgart",
      "registernummer": "HRB 22708",
      "registerart": "HRB",
      "company_name": "Metzger Haustechnik GmbH",
      "company_seat": "Stuttgart",
      "details": "14.01.2025 (Bekanntmachungsdatum)\n\nBaden-Württemberg Amtsgericht Stuttgart HRB 22708\nLöschungsankündigung\n\nMetzger Haustechnik GmbH\nGesellschaft mit beschränkter Haftung\nStuttgart\n\nDas Gericht beabsichtigt, die Gesellschaft wegen Vermögenslosigkeit im Handelsregister von Amts wegen nach § 394 FamFG zu löschen. Die Frist zur Geltendmachung eines Widerspruchs gegen die beabsichtigte Löschung ist auf zwei Monate ab Veröffentlichung bestimmt."
    },
    {
      "date": "2025-01-14",
      "id": "98537",
      "original_text": "Löschungsankündigung\nBrandenburg Amtsgericht Potsdam HRB 28547\nGBD Berlin GmbH – Brieselang",
      "type": "Löschungsankündigung",
      "state": "Brandenburg",
      "amtsgericht": "Amtsgericht Potsdam",
      "registernummer": "HRB 28547",
      "registerart": "HRB",
      "company_name": "GBD Berlin GmbH",
      "company_seat": "Brieselang",
      "details": "14.01.2025 (Bekanntmachungsdatum)\n\nBrandenburg Amtsgericht Potsdam HRB 28547\nLöschungsankündigung\n\nGBD Berlin GmbH\nGesellschaft mit beschränkter Haftung\nBrieselang\n\nBei der nachstehenden Gesellschaft wird das Amtslöschungsverfahren gemäß § 394 FamFG eingeleitet. Widerspruchsfrist: 8 Wochen"
    },
    {
      "date": "2025-01-14",
      "id": "98538",
      "original_text": "Einreichung neuer Dokumente\nBaden-Württemberg Amtsgericht Stuttgart HRB 107207\nHeilbronn Marketing GmbH – Heilbronn",
      "type": "Einreichung neuer Dokumente",
      "state": "Baden-Württemberg",
      "amtsgericht": "Amtsgericht Stuttgart",
      "registernummer": "HRB 107207",
      "registerart": "HRB",
      "company_name": "Heilbronn Marketing GmbH",
      "company_seat": "Heilbronn",
      "details": "14.01.2025 (Bekanntmachungsdatum)\n\nBaden-Württemberg Amtsgericht Stuttgart HRB 107207\nEinreichung neuer Dokumente\n\nHeilbronn Marketing GmbH\nGesellschaft mit beschränkter Haftung\nHeilbronn\n\nDie Gesellschaft hat am 03.12.2024 die Liste über die Zusammensetzung des Aufsichtsrats zum Handelsregister eingereicht."
    },
    {
      "date": "2025-01-14",
      "id": "98539",
      "original_text": "Einreichung neuer Dokumente\nBaden-Württemberg Amtsgericht Ulm HRB 735904\nHK-Softcons AG – Schwäbisch Gmünd",
      "type": "Einreichung neuer Dokumente",
      "state": "Baden-Württemberg",
      "amtsgericht": "Amtsgericht Ulm",
      "registernummer": "HRB 735904",
      "registerart": "HRB",
      "company_name": "HK-Softcons AG",
      "company_seat": "Schwäbisch Gmünd",
      "details": "14.01.2025 (Bekanntmachungsdatum)\n\nBaden-Württemberg Amtsgericht Ulm HRB 735904\nEinreichung neuer Dokumente 14.01.2025 (Eintragungsdatum)\n\nHK-Softcons AG\nAktiengesellschaft\nSchwäbisch Gmünd\n\nDie Gesellschaft hat am 13.01.2025 die Liste über die Zusammensetzung des Aufsichtsrats zum Handelsregister eingereicht."
    },
    {
      "date": "2025-01-14",
      "id": "98540",
      "original_text": "Registerbekanntmachung nach dem Umwandlungsgesetz\nBaden-Württemberg Amtsgericht Mannheim HRA 706252\nstü.watt GmbH & Co. KG – Bühl",
      "type": "Registerbekanntmachung nach dem Umwandlungsgesetz",
      "state": "Baden-Württemberg",
      "amtsgericht": "Amtsgericht Mannheim",
      "registernummer": "HRA 706252",
      "registerart": "HRA",
      "company_name": "stü.watt GmbH & Co. KG",
      "company_seat": "Bühl",
      "details": "14.01.2025 (Bekanntmachungsdatum)\n\nBaden-Württemberg Amtsgericht Mannheim HRA 706252\nRegisterbekanntmachung nach dem Umwandlungsgesetz 14.01.2025 (Eintragungsdatum)\n\nstü.watt GmbH & Co. KG\nKommanditgesellschaft\nBühl\n\nDen Gläubigern des an dem Formwechsel beteiligten Rechtsträgers ist, wenn sie binnen sechs Monaten nach dem Tag, an dem die Eintragung des Formwechsels in das Register des Sitzes desjenigen Rechtsträgers, dessen Gläubiger sie sind, nach § 19 Abs. 3 UmwG als bekanntgemacht gilt, ihren Anspruch nach Grund und Höhe schriftlich anmelden, Sicherheit zu leisten, soweit sie nicht Befriedigung verlangen können. Dieses Recht steht den Gläubigern jedoch nur zu, wenn sie glaubhaft machen, dass durch den Formwechsel die Erfüllung ihrer Forderung gefährdet wird."
    },
    {
      "date": "2025-01-14",
      "id": "98541",
      "original_text": "Einreichung neuer Dokumente\nBaden-Württemberg Amtsgericht Stuttgart HRB 451000\nTuttlinger Bäder GmbH – Tuttlingen",
      "type": "Einreichung neuer Dokumente",
      "state": "Baden-Württemberg",
      "amtsgericht": "Amtsgericht Stuttgart",
      "registernummer": "HRB 451000",
      "registerart": "HRB",
      "company_name": "Tuttlinger Bäder GmbH",
      "company_seat": "Tuttlingen",
      "details": "14.01.2025 (Bekanntmachungsdatum)\n\nBaden-Württemberg Amtsgericht Stuttgart HRB 451000\nEinreichung neuer Dokumente\n\nTuttlinger Bäder GmbH\nGesellschaft mit beschränkter Haftung\nTuttlingen\n\nDie Gesellschaft hat am 16.09.2024 die Liste über die Zusammensetzung des Aufsichtsrats zum Handelsregister eingereicht."
    },
    {
      "date": "2025-01-14",
      "id": "98542",
      "original_text": "Löschungsankündigung\nSaarland Amtsgericht Saarbrücken HRB 16287\nFlück & Horn Stuckateurbetrieb GmbH – Neunkirchen",
      "type": "Löschungsankündigung",
      "state": "Saarland",
      "amtsgericht": "Amtsgericht Saarbrücken",
      "registernummer": "HRB 16287",
      "registerart": "HRB",
      "company_name": "Flück & Horn Stuckateurbetrieb GmbH",
      "company_seat": "Neunkirchen",
      "details": "14.01.2025 (Bekanntmachungsdatum)\n\nSaarland Amtsgericht Saarbrücken HRB 16287\nLöschungsankündigung\n\nFlück & Horn Stuckateurbetrieb GmbH\nGesellschaft mit beschränkter Haftung\nNeunkirchen\n\nEs ist beabsichtigt, die Gesellschaft von Amts wegen gemäß § 394 FamFG wegen Vermögenslosigkeit zu löschen.\nGegen die Löschung von Amts wegen ist das Rechtsmittel des Widerspruchs statthaft. Der Widerspruch ist binnen einer Frist zwei Monaten beginnend mit dem Tag dieser Veröffentlichung durch Einreichen eines Widerspruchsschreibens -schriftlich oder zur Niederschrift der Geschäftsstelle beim Amtsgericht Saarbrücken, -zentrales Handelsregister-, Mainzerstr.178, 66121 Saarbrücken einzulegen.\nDer Widerspruch muss die Bezeichnung der angefochtenen Löschungsankündigung enthalten sowie die Erklärung, dass Widerspruch eingelegt wird. Er ist vom Widerspruchsführer oder seinem Bevollmächtigten zu unterzeichnen.\nDas Widerspruchsschreiben kann auch in der Form eines elektronischen Dokumentes eingereicht werden, das mit einer qualifizierten elektronischen Signatur nach dem Signaturgesetz versehen sein muss (§§ 14 Abs. 2 FamFG, 130a, 298 ZPO)."
    },
    {
      "date": "2025-01-14",
      "id": "98543",
      "original_text": "Einreichung neuer Dokumente\nSachsen Amtsgericht Leipzig HRB 36977\nSPRIND GmbH – Leipzig",
      "type": "Einreichung neuer Dokumente",
      "state": "Sachsen",
      "amtsgericht": "Amtsgericht Leipzig",
      "registernummer": "HRB 36977",
      "registerart": "HRB",
      "company_name": "SPRIND GmbH",
      "company_seat": "Leipzig",
      "details": "14.01.2025 (Bekanntmachungsdatum)\n\nSachsen Amtsgericht Leipzig HRB 36977\nEinreichung neuer Dokumente\n\nSPRIND GmbH\nGesellschaft mit beschränkter Haftung\nLeipzig\n\nAm 13.01.2025 wurde beim Handelsregister des Amtsgerichts Leipzig die Liste der Mitglieder des Aufsichtsrats gemäß § 52 GmbHG eingereicht."
    },
    {
      "date": "2025-01-14",
      "id": "98544",
      "original_text": "Sonstige Registerbekanntmachung\nSachsen Amtsgericht Chemnitz HRB 17862\nSozialpädiatrisches Zentrum am HELIOS Klinikum Aue gemeinnützige Gesellschaft mit beschränkter Haftung – Aue-Bad Schlema",
      "type": "Sonstige Registerbekanntmachung",
      "state": "Sachsen",
      "amtsgericht": "Amtsgericht Chemnitz",
      "registernummer": "HRB 17862",
      "registerart": "HRB",
      "company_name": "Sozialpädiatrisches Zentrum am HELIOS Klinikum Aue gemeinnützige Gesellschaft mit beschränkter Haftung",
      "company_seat": "Aue-Bad Schlema",
      "details": "14.01.2025 (Bekanntmachungsdatum)\n\nSachsen Amtsgericht Chemnitz HRB 17862\nSonstige Registerbekanntmachung\n\nSozialpädiatrisches Zentrum am HELIOS Klinikum Aue gemeinnützige Gesellschaft mit beschränkter Haftung\nGesellschaft mit beschränkter Haftung\nAue-Bad Schlema\n\nAm 18.08.2024 wurde beim Handelsregister des Amtsgerichts Chemnitz die Liste der Mitglieder des Aufsichtsrats gemäß § 52 GmbHG eingereicht."
    },
    {
      "date": "2025-01-14",
      "id": "98545",
      "original_text": "Einreichung neuer Dokumente\nSachsen Amtsgericht Chemnitz HRB 3783\nWohnungsbaugesellschaft mbH \"Zwönitztal\" – Thalheim/Erzgeb.",
      "type": "Einreichung neuer Dokumente",
      "state": "Sachsen",
      "amtsgericht": "Amtsgericht Chemnitz",
      "registernummer": "HRB 3783",
      "registerart": "HRB",
      "company_name": "Wohnungsbaugesellschaft mbH \"Zwönitztal\"",
      "company_seat": "Thalheim/Erzgeb.",
      "details": "14.01.2025 (Bekanntmachungsdatum)\n\nSachsen Amtsgericht Chemnitz HRB 3783\nEinreichung neuer Dokumente\n\nWohnungsbaugesellschaft mbH \"Zwönitztal\"\nGesellschaft mit beschränkter Haftung\nThalheim/Erzgeb.\n\nAm 09.01.2025 wurde beim Handelsregister des Amtsgerichts Chemnitz die Liste der Mitglieder des Aufsichtsrats gemäß § 52 GmbHG eingereicht."
    },
    {
      "date": "2025-01-14",
      "id": "98546",
      "original_text": "Löschungsankündigung\nSachsen Amtsgericht Chemnitz HRB 35973\nEesell Planungs & Installations GmbH – Chemnitz",
      "type": "Löschungsankündigung",
      "state": "Sachsen",
      "amtsgericht": "Amtsgericht Chemnitz",
      "registernummer": "HRB 35973",
      "registerart": "HRB",
      "company_name": "Eesell Planungs & Installations GmbH",
      "company_seat": "Chemnitz",
      "details": "14.01.2025 (Bekanntmachungsdatum)\n\nSachsen Amtsgericht Chemnitz HRB 35973\nLöschungsankündigung\n\nEesell Planungs & Installations GmbH\nGesellschaft mit beschränkter Haftung\nChemnitz\n\nDas Registergericht beabsichtigt, die im Handelsregister eingetragene Gesellschaft von Amts wegen nach § 394 FamFG zu löschen. Die Frist zu Erhebung eines Widerspruchs gegen die beabsichtigte Löschung wird auf einen Monat festgesetzt."
    },
    {
      "date": "2025-01-14",
      "id": "98547",
      "original_text": "Einreichung neuer Dokumente\nSachsen Amtsgericht Chemnitz HRB 6393\nStadtbau Freiberg GmbH – Freiberg",
      "type": "Einreichung neuer Dokumente",
      "state": "Sachsen",
      "amtsgericht": "Amtsgericht Chemnitz",
      "registernummer": "HRB 6393",
      "registerart": "HRB",
      "company_name": "Stadtbau Freiberg GmbH",
      "company_seat": "Freiberg",
      "details": "14.01.2025 (Bekanntmachungsdatum)\n\nSachsen Amtsgericht Chemnitz HRB 6393\nEinreichung neuer Dokumente\n\nStadtbau Freiberg GmbH\nGesellschaft mit beschränkter Haftung\nFreiberg\n\nAm 14.01.2025 wurde beim Handelsregister des Amtsgerichts Chemnitz die Liste der Mitglieder des Aufsichtsrats gemäß § 52 GmbHG eingereicht."
    },
    {
      "date": "2025-01-14",
      "id": "98548",
      "original_text": "Löschungsankündigung\nSachsen Amtsgericht Dresden HRB 36858\nCleanHouse UG (haftungsbeschränkt) – Ottendorf-Okrilla",
      "type": "Löschungsankündigung",
      "state": "Sachsen",
      "amtsgericht": "Amtsgericht Dresden",
      "registernummer": "HRB 36858",
      "registerart": "HRB",
      "company_name": "CleanHouse UG (haftungsbeschränkt)",
      "company_seat": "Ottendorf-Okrilla",
      "details": "14.01.2025 (Bekanntmachungsdatum)\n\nSachsen Amtsgericht Dresden HRB 36858\nLöschungsankündigung\n\nCleanHouse UG (haftungsbeschränkt)\nGesellschaft mit beschränkter Haftung\nOttendorf-Okrilla\n\nDas Registergericht beabsichtigt, die im Handelsregister eingetragene Gesellschaft von Amts wegen nach § 394 FamFG zu löschen. Die Frist zu Erhebung eines Widerspruchs gegen die beabsichtigte Löschung wird auf einen Monat festgesetzt."
    },
    {
      "date": "2025-01-14",
      "id": "98549",
      "original_text": "Löschungsankündigung\nSachsen Amtsgericht Dresden HRB 30955\nKTR Recycling Trading GmbH – Zeithain",
      "type": "Löschungsankündigung",
      "state": "Sachsen",
      "amtsgericht": "Amtsgericht Dresden",
      "registernummer": "HRB 30955",
      "registerart": "HRB",
      "company_name": "KTR Recycling Trading GmbH",
      "company_seat": "Zeithain",
      "details": "14.01.2025 (Bekanntmachungsdatum)\n\nSachsen Amtsgericht Dresden HRB 30955\nLöschungsankündigung\n\nKTR Recycling Trading GmbH\nGesellschaft mit beschränkter Haftung\nZeithain\n\nDas Registergericht beabsichtigt, die im Handelsregister eingetragene Gesellschaft von Amts wegen nach § 394 FamFG zu löschen. Die Frist zu Erhebung eines Widerspruchs gegen die beabsichtigte Löschung wird auf einen Monat festgesetzt."
    },
    {
      "date": "2025-01-14",
      "id": "98550",
      "original_text": "Löschungsankündigung\nSachsen Amtsgericht Dresden HRB 36941\nGFH Handel-Kanzlei UG (haftungsbeschränkt) – Görlitz",
      "type": "Löschungsankündigung",
      "state": "Sachsen",
      "amtsgericht": "Amtsgericht Dresden",
      "registernummer": "HRB 36941",
      "registerart": "HRB",
      "company_name": "GFH Handel-Kanzlei UG (haftungsbeschränkt)",
      "company_seat": "Görlitz",
      "details": "14.01.2025 (Bekanntmachungsdatum)\n\nSachsen Amtsgericht Dresden HRB 36941\nLöschungsankündigung\n\nGFH Handel-Kanzlei UG (haftungsbeschränkt)\nGesellschaft mit beschränkter Haftung\nGörlitz\n\nDas Registergericht beabsichtigt, die im Handelsregister eingetragene Gesellschaft von Amts wegen nach § 394 FamFG zu löschen. Die Frist zu Erhebung eines Widerspruchs gegen die beabsichtigte Löschung wird auf einen Monat festgesetzt."
    },
    {
      "date": "2025-01-14",
      "id": "98551",
      "original_text": "Löschungsankündigung\nSachsen Amtsgericht Dresden HRB 32615\nLaserTag Dresden UG (haftungsbeschränkt) – Dresden",
      "type": "Löschungsankündigung",
      "state": "Sachsen",
      "amtsgericht": "Amtsgericht Dresden",
      "registernummer": "HRB 32615",
      "registerart": "HRB",
      "company_name": "LaserTag Dresden UG (haftungsbeschränkt)",
      "company_seat": "Dresden",
      "details": "14.01.2025 (Bekanntmachungsdatum)\n\nSachsen Amtsgericht Dresden HRB 32615\nLöschungsankündigung\n\nLaserTag Dresden UG (haftungsbeschränkt)\nGesellschaft mit beschränkter Haftung\nDresden\n\nDas Registergericht beabsichtigt, die im Handelsregister eingetragene Gesellschaft von Amts wegen nach § 394 FamFG zu löschen. Die Frist zu Erhebung eines Widerspruchs gegen die beabsichtigte Löschung wird auf einen Monat festgesetzt."
    },
    {
      "date": "2025-01-14",
      "id": "98552",
      "original_text": "Löschungsankündigung\nBaden-Württemberg Amtsgericht Freiburg HRB 704223\nMediasales GmbH – Teningen",
      "type": "Löschungsankündigung",
      "state": "Baden-Württemberg",
      "amtsgericht": "Amtsgericht Freiburg",
      "registernummer": "HRB 704223",
      "registerart": "HRB",
      "company_name": "Mediasales GmbH",
      "company_seat": "Teningen",
      "details": "14.01.2025 (Bekanntmachungsdatum)\n\nBaden-Württemberg Amtsgericht Freiburg HRB 704223\nLöschungsankündigung\n\nMediasales GmbH\nGesellschaft mit beschränkter Haftung\nTeningen\n\nAls nicht eingetragen wird bekanntgemacht:\nDas Gericht beabsichtigt, die Gesellschaft wegen Vermögenslosigkeit im Handelsregister von Amts wegen nach § 394 FamFG zu löschen. Die Frist zur Geltendmachung eines Widerspruchs gegen die beabsichtigte Löschung ist auf einen Monat ab Veröffentlichung bestimmt."
    },
    {
      "date": "2025-01-14",
      "id": "98553",
      "original_text": "Löschungsankündigung\nNiedersachsen Amtsgericht Oldenburg (Oldenburg) HRA 200978\nRudolf Schepers Schiffahrtsgesellschaft mbH & Co. KG MS \"Anna-S.\" – Bad Zwischenahn",
      "type": "Löschungsankündigung",
      "state": "Niedersachsen",
      "amtsgericht": "Amtsgericht Oldenburg (Oldenburg)",
      "registernummer": "HRA 200978",
      "registerart": "HRA",
      "company_name": "Rudolf Schepers Schiffahrtsgesellschaft mbH & Co. KG MS \"Anna-S.\"",
      "company_seat": "Bad Zwischenahn",
      "details": "14.01.2025 (Bekanntmachungsdatum)\n\nNiedersachsen Amtsgericht Oldenburg (Oldenburg) HRA 200978\nLöschungsankündigung\n\nRudolf Schepers Schiffahrtsgesellschaft mbH & Co. KG MS \"Anna-S.\"\nKommanditgesellschaft\nBad Zwischenahn\n\nDas Registergericht beabsichtigt, die Firma von Amts wegen nach § 394 FamFG zu löschen. Die Frist zur Erhebung eines Widerspruchs ist auf 1 Monat ab dieser Registerbekanntmachung festgesetzt."
    },
    {
      "date": "2025-01-14",
      "id": "98554",
      "original_text": "Sonstige Registerbekanntmachung\nNiedersachsen Amtsgericht Oldenburg (Oldenburg) HRB 111825 früher Amtsgericht Vechta\nMeat Cracks Technologie GmbH – Steinfeld",
      "type": "Sonstige Registerbekanntmachung",
      "state": "Niedersachsen",
      "amtsgericht": "Amtsgericht Oldenburg (Oldenburg)",
      "registernummer": "HRB 111825",
      "registerart": "HRB",
      "company_name": "Meat Cracks Technologie GmbH",
      "company_seat": "Steinfeld",
      "former_amtsgericht": "Vechta",
      "details": "14.01.2025 (Bekanntmachungsdatum)\n\nNiedersachsen Amtsgericht Oldenburg (Oldenburg) HRB 111825 früher Amtsgericht Vechta\nSonstige Registerbekanntmachung 14.01.2025 (Eintragungsdatum)\n\nMeat Cracks Technologie GmbH\nGesellschaft mit beschränkter Haftung\nSteinfeld\n\nDen Gläubigern der Gesellschaft, deren Forderungen begründet worden sind, bevor die Eintragung der Beendigung des Vertrages in das Handelsregister nach § 10 HGB als bekanntgemacht gilt, ist vom anderen Vertragsteil Sicherheit zu leisten, wenn sie sich binnen sechs Monaten nach der Bekanntmachung zu diesem Zweck bei ihm melden."
    },
    {
      "date": "2025-01-14",
      "id": "98555",
      "original_text": "Löschungsankündigung\nNiedersachsen Amtsgericht Hildesheim HRB 206813\nBertram BauConcept GmbH – Uetze",
      "type": "Löschungsankündigung",
      "state": "Niedersachsen",
      "amtsgericht": "Amtsgericht Hildesheim",
      "registernummer": "HRB 206813",
      "registerart": "HRB",
      "company_name": "Bertram BauConcept GmbH",
      "company_seat": "Uetze",
      "details": "14.01.2025 (Bekanntmachungsdatum)\n\nNiedersachsen Amtsgericht Hildesheim HRB 206813\nLöschungsankündigung\n\nBertram BauConcept GmbH\nGesellschaft mit beschränkter Haftung\nUetze\n\nDas Registergericht beabsichtigt, die Gesellschaft von Amts wegen nach § 394 FamFG zu löschen. Die Frist zur Erhebung eines Widerspruchs ist auf 1 Monat ab dieser Registerbekanntmachung festgesetzt."
    },
    {
      "date": "2025-01-14",
      "id": "98556",
      "original_text": "Registerbekanntmachung nach dem Umwandlungsgesetz\nNiedersachsen Amtsgericht Lüneburg HRA 203769\nBootsschule1 GmbH & Co. KG – Uelzen",
      "type": "Registerbekanntmachung nach dem Umwandlungsgesetz",
      "state": "Niedersachsen",
      "amtsgericht": "Amtsgericht Lüneburg",
      "registernummer": "HRA 203769",
      "registerart": "HRA",
      "company_name": "Bootsschule1 GmbH & Co. KG",
      "company_seat": "Uelzen",
      "details": "14.01.2025 (Bekanntmachungsdatum)\n\nNiedersachsen Amtsgericht Lüneburg HRA 203769\nRegisterbekanntmachung nach dem Umwandlungsgesetz 14.01.2025 (Eintragungsdatum)\n\nBootsschule1 GmbH & Co. KG\nKommanditgesellschaft\nUelzen\n\nDen Gläubigern der an der formwechselnden Umwandlung beteiligten Rechtsträger ist, wenn sie binnen sechs Monaten nach dem Tag, an dem die Eintragung der Umwandlung in das Register des Sitzes desjenigen Rechtsträgers, dessen Gläubiger sie sind, nach § 19 Abs. 3 UmwG als bekannt gemacht gilt, ihren Anspruch nach Grund und Höhe schriftlich anmelden, Sicherheit zu leisten, soweit sie nicht Befriedigung verlangen können. Dieses Recht steht den Gläubigern jedoch nur zu, wenn sie glaubhaft machen, dass durch die formwechselnde Umwandlung die Erfüllung der Forderung gefährdet wird."
    },
    {
      "date": "2025-01-14",
      "id": "98557",
      "original_text": "Sonstige Registerbekanntmachung\nNiedersachsen Amtsgericht Oldenburg (Oldenburg) HRB 213195\nM Food Group GmbH – Steinfeld-Mühlen",
      "type": "Sonstige Registerbekanntmachung",
      "state": "Niedersachsen",
      "amtsgericht": "Amtsgericht Oldenburg (Oldenburg)",
      "registernummer": "HRB 213195",
      "registerart": "HRB",
      "company_name": "M Food Group GmbH",
      "company_seat": "Steinfeld-Mühlen",
      "details": "14.01.2025 (Bekanntmachungsdatum)\n\nNiedersachsen Amtsgericht Oldenburg (Oldenburg) HRB 213195\nSonstige Registerbekanntmachung 14.01.2025 (Eintragungsdatum)\n\nM Food Group GmbH\nGesellschaft mit beschränkter Haftung\nSteinfeld-Mühlen\n\nDen Gläubigern der Gesellschaft, deren Forderungen begründet worden sind, bevor die Eintragung der Beendigung des Vertrages in das Handelsregister nach § 10 HGB als bekanntgemacht gilt, ist vom anderen Vertragsteil Sicherheit zu leisten, wenn sie sich binnen sechs Monaten nach der Bekanntmachung zu diesem Zweck bei ihm melden."
    },
    {
      "date": "2025-01-14",
      "id": "98558",
      "original_text": "Löschungsankündigung\nNiedersachsen Amtsgericht Braunschweig HRA 201447\nGushop e.K. – Goslar",
      "type": "Löschungsankündigung",
      "state": "Niedersachsen",
      "amtsgericht": "Amtsgericht Braunschweig",
      "registernummer": "HRA 201447",
      "registerart": "HRA",
      "company_name": "Gushop e.K.",
      "company_seat": "Goslar",
      "details": "14.01.2025 (Bekanntmachungsdatum)\n\nNiedersachsen Amtsgericht Braunschweig HRA 201447\nLöschungsankündigung\n\nGushop e.K.\nEinzelkaufmann / Einzelkauffrau\nGoslar\n\nDas Registergericht beabsichtigt, die Firma von Amts wegen nach § 31 Abs. 2 Satz 2 HGB, § 393 FamFG zu löschen. Die Frist zur Erhebung eines Widerspruchs ist auf 1 Monat ab dieser Registerbekanntmachung festgesetzt."
    },
    {
      "date": "2025-01-14",
      "id": "98559",
      "original_text": "Registerbekanntmachung nach dem Umwandlungsgesetz\nNiedersachsen Amtsgericht Lüneburg HRB 212565\nBoot1 GmbH – Uelzen",
      "type": "Registerbekanntmachung nach dem Umwandlungsgesetz",
      "state": "Niedersachsen",
      "amtsgericht": "Amtsgericht Lüneburg",
      "registernummer": "HRB 212565",
      "registerart": "HRB",
      "company_name": "Boot1 GmbH",
      "company_seat": "Uelzen",
      "details": "14.01.2025 (Bekanntmachungsdatum)\n\nNiedersachsen Amtsgericht Lüneburg HRB 212565\nRegisterbekanntmachung nach dem Umwandlungsgesetz 14.01.2025 (Eintragungsdatum)\n\nBoot1 GmbH\nGesellschaft mit beschränkter Haftung\nUelzen\n\nDen Gläubigern der an der formwechselnden Umwandlung beteiligten Rechtsträger ist, wenn sie binnen sechs Monaten nach dem Tag, an dem die Eintragung der Umwandlung in das Register des Sitzes desjenigen Rechtsträgers, dessen Gläubiger sie sind, nach § 19 Abs. 3 UmwG als bekannt gemacht gilt, ihren Anspruch nach Grund und Höhe schriftlich anmelden, Sicherheit zu leisten, soweit sie nicht Befriedigung verlangen können. Dieses Recht steht den Gläubigern jedoch nur zu, wenn sie glaubhaft machen, dass durch die formwechselnde Umwandlung die Erfüllung der Forderung gefährdet wird."
    },
    {
      "date": "2025-01-14",
      "id": "98560",
      "original_text": "Registerbekanntmachung nach dem Umwandlungsgesetz\nNiedersachsen Amtsgericht Göttingen HRB 201338\nBus Bar Niedersachsen GmbH – Nörten-Hardenberg",
      "type": "Registerbekanntmachung nach dem Umwandlungsgesetz",
      "state": "Niedersachsen",
      "amtsgericht": "Amtsgericht Göttingen",
      "registernummer": "HRB 201338",
      "registerart": "HRB",
      "company_name": "Bus Bar Niedersachsen GmbH",
      "company_seat": "Nörten-Hardenberg",
      "details": "14.01.2025 (Bekanntmachungsdatum)\n\nNiedersachsen Amtsgericht Göttingen HRB 201338\nRegisterbekanntmachung nach dem Umwandlungsgesetz 14.01.2025 (Eintragungsdatum)\n\nBus Bar Niedersachsen GmbH\nGesellschaft mit beschränkter Haftung\nNörten-Hardenberg\n\nDen Gläubigern der an der Verschmelzung beteiligten Rechtsträger ist, wenn sie binnen sechs Monaten nach dem Tag, an dem die Eintragung der Verschmelzung in das Register des Sitzes desjenigen Rechtsträgers, dessen Gläubiger sie sind, nach § 19  Abs.  3 UmwG als bekannt gemacht gilt, ihren Anspruch nach Grund und Höhe schriftlich anmelden, Sicherheit zu leisten, soweit sie nicht Befriedigung verlangen können. Dieses Recht steht den Gläubigern jedoch nur zu, wenn sie glaubhaft machen, dass durch die Verschmelzung die Erfüllung der Forderung gefährdet wird."
    },
    {
      "date": "2025-01-14",
      "id": "98561",
      "original_text": "Registerbekanntmachung nach dem Umwandlungsgesetz\nNiedersachsen Amtsgericht Lüneburg HRB 208074\nSchluckwerder Holding GmbH – Adendorf",
      "type": "Registerbekanntmachung nach dem Umwandlungsgesetz",
      "state": "Niedersachsen",
      "amtsgericht": "Amtsgericht Lüneburg",
      "registernummer": "HRB 208074",
      "registerart": "HRB",
      "company_name": "Schluckwerder Holding GmbH",
      "company_seat": "Adendorf",
      "details": "14.01.2025 (Bekanntmachungsdatum)\n\nNiedersachsen Amtsgericht Lüneburg HRB 208074\nRegisterbekanntmachung nach dem Umwandlungsgesetz 14.01.2025 (Eintragungsdatum)\n\nSchluckwerder Holding GmbH\nGesellschaft mit beschränkter Haftung\nAdendorf\n\nDen Gläubigern der an der Verschmelzung beteiligten Rechtsträger ist, wenn sie binnen sechs Monaten nach dem Tag, an dem die Eintragung der Verschmelzung in das Register des Sitzes desjenigen Rechtsträgers, dessen Gläubiger sie sind, nach § 19  Abs.  3 UmwG als bekannt gemacht gilt, ihren Anspruch nach Grund und Höhe schriftlich anmelden, Sicherheit zu leisten, soweit sie nicht Befriedigung verlangen können. Dieses Recht steht den Gläubigern jedoch nur zu, wenn sie glaubhaft machen, dass durch die Verschmelzung die Erfüllung der Forderung gefährdet wird."
    },
    {
      "date": "2025-01-14",
      "id": "98562",
      "original_text": "Registerbekanntmachung nach dem Umwandlungsgesetz\nNiedersachsen Amtsgericht Lüneburg HRB 208073\nSchluckwerder Grundstücksgesellschaft mbH – Adendorf",
      "type": "Registerbekanntmachung nach dem Umwandlungsgesetz",
      "state": "Niedersachsen",
      "amtsgericht": "Amtsgericht Lüneburg",
      "registernummer": "HRB 208073",
      "registerart": "HRB",
      "company_name": "Schluckwerder Grundstücksgesellschaft mbH",
      "company_seat": "Adendorf",
      "details": "14.01.2025 (Bekanntmachungsdatum)\n\nNiedersachsen Amtsgericht Lüneburg HRB 208073\nRegisterbekanntmachung nach dem Umwandlungsgesetz 14.01.2025 (Eintragungsdatum)\n\nSchluckwerder Grundstücksgesellschaft mbH\nGesellschaft mit beschränkter Haftung\nAdendorf\n\nDen Gläubigern der an der Verschmelzung beteiligten Rechtsträger ist, wenn sie binnen sechs Monaten nach dem Tag, an dem die Eintragung der Verschmelzung in das Register des Sitzes desjenigen Rechtsträgers, dessen Gläubiger sie sind, nach § 19  Abs.  3 UmwG als bekannt gemacht gilt, ihren Anspruch nach Grund und Höhe schriftlich anmelden, Sicherheit zu leisten, soweit sie nicht Befriedigung verlangen können. Dieses Recht steht den Gläubigern jedoch nur zu, wenn sie glaubhaft machen, dass durch die Verschmelzung die Erfüllung der Forderung gefährdet wird."
    },
    {
      "date": "2025-01-14",
      "id": "98563",
      "original_text": "Registerbekanntmachung nach dem Umwandlungsgesetz\nNiedersachsen Amtsgericht Oldenburg (Oldenburg) HRB 110500 früher Amtsgericht Vechta\nWübbeler Transport GmbH – Visbek-Varnhorn",
      "type": "Registerbekanntmachung nach dem Umwandlungsgesetz",
      "state": "Niedersachsen",
      "amtsgericht": "Amtsgericht Oldenburg (Oldenburg)",
      "registernummer": "HRB 110500",
      "registerart": "HRB",
      "company_name": "Wübbeler Transport GmbH",
      "company_seat": "Visbek-Varnhorn",
      "former_amtsgericht": "Vechta",
      "details": "14.01.2025 (Bekanntmachungsdatum)\n\nNiedersachsen Amtsgericht Oldenburg (Oldenburg) HRB 110500 früher Amtsgericht Vechta\nRegisterbekanntmachung nach dem Umwandlungsgesetz 14.01.2025 (Eintragungsdatum)\n\nWübbeler Transport GmbH\nGesellschaft mit beschränkter Haftung\nVisbek-Varnhorn\n\nDen Gläubigern der an der Verschmelzung beteiligten Rechtsträger ist, wenn sie binnen sechs Monaten nach dem Tag, an dem die Eintragung der Verschmelzung in das Register des Sitzes desjenigen Rechtsträgers, dessen Gläubiger sie sind, nach § 19  Abs.  3 UmwG als bekannt gemacht gilt, ihren Anspruch nach Grund und Höhe schriftlich anmelden, Sicherheit zu leisten, soweit sie nicht Befriedigung verlangen können. Dieses Recht steht den Gläubigern jedoch nur zu, wenn sie glaubhaft machen, dass durch die Verschmelzung die Erfüllung der Forderung gefährdet wird."
    },
    {
      "date": "2025-01-14",
      "id": "98564",
      "original_text": "Einreichung neuer Dokumente\nNiedersachsen Amtsgericht Braunschweig HRB 100007 früher Amtsgericht Wolfsburg\nLandE GmbH – Wolfsburg-Fallersleben",
      "type": "Einreichung neuer Dokumente",
      "state": "Niedersachsen",
      "amtsgericht": "Amtsgericht Braunschweig",
      "registernummer": "HRB 100007",
      "registerart": "HRB",
      "company_name": "LandE GmbH",
      "company_seat": "Wolfsburg-Fallersleben",
      "former_amtsgericht": "Wolfsburg",
      "details": "14.01.2025 (Bekanntmachungsdatum)\n\nNiedersachsen Amtsgericht Braunschweig HRB 100007 früher Amtsgericht Wolfsburg\nEinreichung neuer Dokumente\n\nLandE GmbH\nGesellschaft mit beschränkter Haftung\nWolfsburg-Fallersleben\n\nDie aktuelle Liste der Mitglieder des Aufsichtsrats wurde beim Registergericht eingereicht."
    },
    {
      "date": "2025-01-14",
      "id": "98565",
      "original_text": "Einreichung neuer Dokumente\nRheinland-Pfalz Amtsgericht Montabaur HRB 14178\nBasalt-Union Gesellschaft mit beschränkter Haftung – Linz/Rhein",
      "type": "Einreichung neuer Dokumente",
      "state": "Rheinland-Pfalz",
      "amtsgericht": "Amtsgericht Montabaur",
      "registernummer": "HRB 14178",
      "registerart": "HRB",
      "company_name": "Basalt-Union Gesellschaft mit beschränkter Haftung",
      "company_seat": "Linz/Rhein",
      "details": "14.01.2025 (Bekanntmachungsdatum)\n\nRheinland-Pfalz Amtsgericht Montabaur HRB 14178\nEinreichung neuer Dokumente\n\nBasalt-Union Gesellschaft mit beschränkter Haftung\nGesellschaft mit beschränkter Haftung\nLinz/Rhein\n\nDem Registergericht ist eine neue Liste der Mitglieder des Aufsichtsrates eingereicht worden."
    },
    {
      "date": "2025-01-14",
      "id": "98566",
      "original_text": "Löschungsankündigung\nBremen Amtsgericht Bremen HRB 36030\nLorin Erziehung und Beratung UG (haftungsbeschränkt) – Bremen",
      "type": "Löschungsankündigung",
      "state": "Bremen",
      "amtsgericht": "Amtsgericht Bremen",
      "registernummer": "HRB 36030",
      "registerart": "HRB",
      "company_name": "Lorin Erziehung und Beratung UG (haftungsbeschränkt)",
      "company_seat": "Bremen",
      "details": "14.01.2025 (Bekanntmachungsdatum)\n\nBremen Amtsgericht Bremen HRB 36030\nLöschungsankündigung\n\nLorin Erziehung und Beratung UG (haftungsbeschränkt)\nGesellschaft mit beschränkter Haftung\nBremen\n\nEs ist beabsichtigt die im Handelsregister eingetragene Gesellschaft von Amts wegen gemäß § 394 FamFG zu löschen. Gegen die Löschung kann beim AG Bremen schriftlich oder zu Protokoll der Geschäftsstelle Widerspruch eingelegt werden. Widerspruchsfrist 4 Wochen."
    },
    {
      "date": "2025-01-14",
      "id": "98567",
      "original_text": "Löschungsankündigung\nNordrhein-Westfalen Amtsgericht Köln HRA 35274\nM.Z. Immobilienmakler Köln e.K. – Köln",
      "type": "Löschungsankündigung",
      "state": "Nordrhein-Westfalen",
      "amtsgericht": "Amtsgericht Köln",
      "registernummer": "HRA 35274",
      "registerart": "HRA",
      "company_name": "M.Z. Immobilienmakler Köln e.K.",
      "company_seat": "Köln",
      "details": "14.01.2025 (Bekanntmachungsdatum)\n\nNordrhein-Westfalen Amtsgericht Köln HRA 35274\nLöschungsankündigung\n\nM.Z. Immobilienmakler Köln e.K.\nEinzelkaufmann / Einzelkauffrau\nKöln\n\nDas Registergericht beabsichtigt die Firma von Amts wegen nach § 394 FamFG zu löschen aufgrund der Aufgabe des Geschäftsbetriebs. Die Frist zur Erhebung eines Widerspruchs ist auf einen Monat festgesetzt."
    },
    {
      "date": "2025-01-14",
      "id": "98568",
      "original_text": "Registerbekanntmachung nach dem Umwandlungsgesetz\nNordrhein-Westfalen Amtsgericht Münster HRB 11376\nTH-Bosenberg Verwaltungs-GmbH – Ahlen",
      "type": "Registerbekanntmachung nach dem Umwandlungsgesetz",
      "state": "Nordrhein-Westfalen",
      "amtsgericht": "Amtsgericht Münster",
      "registernummer": "HRB 11376",
      "registerart": "HRB",
      "company_name": "TH-Bosenberg Verwaltungs-GmbH",
      "company_seat": "Ahlen",
      "details": "14.01.2025 (Bekanntmachungsdatum)\n\nNordrhein-Westfalen Amtsgericht Münster HRB 11376\nRegisterbekanntmachung nach dem Umwandlungsgesetz 14.01.2025 (Eintragungsdatum)\n\nTH-Bosenberg Verwaltungs-GmbH\nGesellschaft mit beschränkter Haftung\nAhlen\n\nDen Gläubigern der an der Verschmelzung beteiligten Rechtsträger ist, wenn sie binnen sechs Monaten nach dem Tag, an dem die Eintragung der Verschmelzung in das Register des Sitzes desjenigen Rechtsträgers, dessen Gläubiger sie sind, nach § 19 Absatz 3 UmwG als bekanntgemacht gilt, ihren Anspruch nach Grund und Höhe schriftlich anmelden, Sicherheit zu leisten, soweit sie nicht Befriedigung verlangen können. Dieses Recht steht den Gläubigern jedoch nur zu, wenn sie glaubhaft machen, dass durch die Verschmelzung die Erfüllung ihrer Forderung gefährdet wird."
    },
    {
      "date": "2025-01-14",
      "id": "98569",
      "original_text": "Einreichung neuer Dokumente\nNordrhein-Westfalen Amtsgericht Düsseldorf HRB 99715\nL'Oréal Deutschland GmbH – Düsseldorf",
      "type": "Einreichung neuer Dokumente",
      "state": "Nordrhein-Westfalen",
      "amtsgericht": "Amtsgericht Düsseldorf",
      "registernummer": "HRB 99715",
      "registerart": "HRB",
      "company_name": "L'Oréal Deutschland GmbH",
      "company_seat": "Düsseldorf",
      "details": "14.01.2025 (Bekanntmachungsdatum)\n\nNordrhein-Westfalen Amtsgericht Düsseldorf HRB 99715\nEinreichung neuer Dokumente\n\nL'Oréal Deutschland GmbH\nGesellschaft mit beschränkter Haftung\nDüsseldorf\n\nDem Registergericht ist eine Liste der Mitglieder des Aufsichtsrates eingereicht worden."
    },
    {
      "date": "2025-01-14",
      "id": "98570",
      "original_text": "Löschungsankündigung\nNordrhein-Westfalen Amtsgericht Recklinghausen VR 2566\nDeutsch-Türkischer Kulturverein Datteln e.V. – Datteln",
      "type": "Löschungsankündigung",
      "state": "Nordrhein-Westfalen",
      "amtsgericht": "Amtsgericht Recklinghausen",
      "registernummer": "VR 2566",
      "registerart": "VR",
      "company_name": "Deutsch-Türkischer Kulturverein Datteln e.V.",
      "company_seat": "Datteln",
      "details": "14.01.2025 (Bekanntmachungsdatum)\n\nNordrhein-Westfalen Amtsgericht Recklinghausen VR 2566\nLöschungsankündigung\n\nDeutsch-Türkischer Kulturverein Datteln e.V.\neingetragener Verein\nDatteln\n\nDas Registergericht beabsichtigt, den im Vereinsregister eingetragenen Verein gemäß §§ 395 FamFG in Verbindung mit 4 Abs. 2 Ziff. 1 Vereinsregisterverordnung wegen Wegfalls aller Mitglieder von Amts wegen zu löschen.\n\nGegen diese Verfügung kann Widerspruch eingelegt werden. Die Frist zur Erhebung eines Widerspruchs gegen die beabsichtigte Löschung von Amts wegen ist auf drei Monate festgesetzt.\n\nRechtsbehelfsbelehrung:\n\nGegen diese Verfügung können Sie Widerspruch einlegen.\n\nDer Widerspruch ist bei dem Amtsgericht Recklinghausen, Reitzensteinstraße 17 - 21, 45657 Recklinghausen schriftlich in deutscher Sprache oder zur Niederschrift der Geschäftsstelle einzulegen.\nDer Widerspruch muss die Bezeichnung der angefochtenen Verfügung sowie die Erklärung enthalten, dass Widerspruch gegen diese Verfügung eingelegt wird. Er ist zu unterzeichnen und soll begründet werden."
    },
    {
      "date": "2025-01-14",
      "id": "98571",
      "original_text": "Löschungsankündigung\nNordrhein-Westfalen Amtsgericht Düsseldorf HRB 67716\nMuennerstadt Management UG (haftungsbeschränkt) – Düsseldorf",
      "type": "Löschungsankündigung",
      "state": "Nordrhein-Westfalen",
      "amtsgericht": "Amtsgericht Düsseldorf",
      "registernummer": "HRB 67716",
      "registerart": "HRB",
      "company_name": "Muennerstadt Management UG (haftungsbeschränkt)",
      "company_seat": "Düsseldorf",
      "details": "14.01.2025 (Bekanntmachungsdatum)\n\nNordrhein-Westfalen Amtsgericht Düsseldorf HRB 67716\nLöschungsankündigung\n\nMuennerstadt Management UG (haftungsbeschränkt)\nGesellschaft mit beschränkter Haftung\nDüsseldorf\n\nDas Registergericht beabsichtigt die Gesellschaft von Amts wegen nach § 394 Abs. 1 FamFG zu löschen. Die Frist zur Erhebung eines Widerspruchs ist auf einen Monat festgesetzt.\n\nRechtsbehelfsbelehrung:\nDas Widerspruchsrecht steht jedem zu, der an der Unterlassung der Löschung ein berechtigtes Interesse hat. Der Widerspruch ist bei dem Amtsgericht Düsseldorf -Registergericht-, Werdener Straße 1, 40227 Düsseldorf schriftlich in deutscher Sprache oder zur Niederschrift der Geschäftsstelle einzulegen. Der Widerspruch kann auch zur Niederschrift der Geschäftsstelle eines jeden Amtsgerichtes abgegeben werden. Die Einlegung ist auch durch Übertragung eines elektronischen Dokuments an die elektronische Poststelle des Gerichts möglich. Das elektronische Dokument muss für die Bearbeitung durch das Gericht geeignet und mit einer qualifizierten elektronischen Signatur der verantwortenden Person versehen sein oder von der verantwortenden Person signiert und auf einem sicheren Übermittlungsweg gemäß § 130a ZPO nach näherer Maßgabe der Verordnung über die technischen Rahmenbedingungen des elektronischen Rechtsverkehrs und über das besondere elektronische Behördenpostfach (BGBl. I, S.3803) eingereicht werden. Weitere Informationen erhalten Sie auf der Internetseite www.justiz.de.\nDer Widerspruch muss spätestens innerhalb der gesetzten Frist nach dem Datum der Bekanntmachung der Löschungsankündigung bei dem Amtsgericht - Registergericht - Düsseldorf eingegangen sein.  Dies gilt auch dann, wenn der Widerspruch zur Niederschrift der Geschäftsstelle eines anderen Amtsgerichtes abgegeben wurde. Die Frist beginnt mit dem Tage der Bekanntmachung der Löschungsankündigung in dem für die Bekanntmachung der Eintragungen in das Handelsregister bestimmten elektronischen Informations- und Kommunikationssystem nach § 10 des Handelsgesetzbuches. Fällt das Ende der Frist auf einen Sonntag, einen allgemeinen Feiertag oder Sonnabend, so endet die Frist mit Ablauf des nächsten Werktages.\nDer Widerspruch muss die Bezeichnung der angefochtenen Löschungsankündigung sowie die Erklärung enthalten, dass Widerspruch gegen diese Löschungsankündigung eingelegt wird. Er ist zu unterzeichnen und soll begründet werden."
    },
    {
      "date": "2025-01-14",
      "id": "98572",
      "original_text": "Einreichung neuer Dokumente\nNordrhein-Westfalen Amtsgericht Köln HRB 82614\nHDI Pensionskasse AG – Köln",
      "type": "Einreichung neuer Dokumente",
      "state": "Nordrhein-Westfalen",
      "amtsgericht": "Amtsgericht Köln",
      "registernummer": "HRB 82614",
      "registerart": "HRB",
      "company_name": "HDI Pensionskasse AG",
      "company_seat": "Köln",
      "details": "14.01.2025 (Bekanntmachungsdatum)\n\nNordrhein-Westfalen Amtsgericht Köln HRB 82614\nEinreichung neuer Dokumente\n\nHDI Pensionskasse AG\nAktiengesellschaft\nKöln\n\nDem Registergericht ist eine neue Liste der Mitglieder des Aufsichtsrates eingereicht worden."
    },
    {
      "date": "2025-01-14",
      "id": "98573",
      "original_text": "Sonstige Registerbekanntmachung\nNordrhein-Westfalen Amtsgericht Köln HRB 12146\nTektronix GmbH – Köln",
      "type": "Sonstige Registerbekanntmachung",
      "state": "Nordrhein-Westfalen",
      "amtsgericht": "Amtsgericht Köln",
      "registernummer": "HRB 12146",
      "registerart": "HRB",
      "company_name": "Tektronix GmbH",
      "company_seat": "Köln",
      "details": "14.01.2025 (Bekanntmachungsdatum)\n\nNordrhein-Westfalen Amtsgericht Köln HRB 12146\nSonstige Registerbekanntmachung 14.01.2025 (Eintragungsdatum)\n\nTektronix GmbH\nGesellschaft mit beschränkter Haftung\nKöln\n\nAls nicht eingetragen wird veröffentlicht: Den Gläubigern der Gesellschaft, deren Forderungen begründet worden sind bevor die Eintragung der Beendigung des Gewinnabführungsvertrages  in das Handelsregister nach § 10 des Handelsgesetzbuches als bekanntgemacht gilt, hat der andere Vertragsteil Sicherheit zu leisten, wenn sie sich binnen sechs Monaten nach der Bekanntmachung der Eintragung zu diesem Zweck bei ihm melden."
    },
    {
      "date": "2025-01-14",
      "id": "98574",
      "original_text": "Einreichung neuer Dokumente\nNordrhein-Westfalen Amtsgericht Essen HRB 22565\nWestconnect GmbH – Essen",
      "type": "Einreichung neuer Dokumente",
      "state": "Nordrhein-Westfalen",
      "amtsgericht": "Amtsgericht Essen",
      "registernummer": "HRB 22565",
      "registerart": "HRB",
      "company_name": "Westconnect GmbH",
      "company_seat": "Essen",
      "details": "14.01.2025 (Bekanntmachungsdatum)\n\nNordrhein-Westfalen Amtsgericht Essen HRB 22565\nEinreichung neuer Dokumente\n\nWestconnect GmbH\nGesellschaft mit beschränkter Haftung\nEssen\n\nDem Registergericht ist eine neue Liste der Mitglieder des Aufsichtsrates eingereicht worden."
    },
    {
      "date": "2025-01-14",
      "id": "98575",
      "original_text": "Löschungsankündigung\nNordrhein-Westfalen Amtsgericht Mönchengladbach HRB 19797\nArena Fleischcontor GmbH – Mönchengladbach",
      "type": "Löschungsankündigung",
      "state": "Nordrhein-Westfalen",
      "amtsgericht": "Amtsgericht Mönchengladbach",
      "registernummer": "HRB 19797",
      "registerart": "HRB",
      "company_name": "Arena Fleischcontor GmbH",
      "company_seat": "Mönchengladbach",
      "details": "14.01.2025 (Bekanntmachungsdatum)\n\nNordrhein-Westfalen Amtsgericht Mönchengladbach HRB 19797\nLöschungsankündigung\n\nArena Fleischcontor GmbH\nGesellschaft mit beschränkter Haftung\nMönchengladbach\n\nArena Fleischcontor GmbH, Mönchengladbach (Amtsgericht Mönchengladbach, HRB 19797).\nDas Registergericht beabsichtigt, die im Handelsregister eingetragene Gesellschaft gemäß § 394 Absatz 1 FamFG wegen Vermögenslosigkeit von Amts wegen zu löschen. Gegen diese Verfügung kann Widerspruch eingelegt werden. Die Frist zur Erhebung eines Widerspruchs gegen die beabsichtigte Löschung von Amts wegen ist auf drei Monate festgesetzt."
    },
    {
      "date": "2025-01-14",
      "id": "98576",
      "original_text": "Sonstige Registerbekanntmachung\nNordrhein-Westfalen Amtsgericht Bochum HRB 10568\nSICO Gesellschaft für Siliconverarbeitung mbH – Witten",
      "type": "Sonstige Registerbekanntmachung",
      "state": "Nordrhein-Westfalen",
      "amtsgericht": "Amtsgericht Bochum",
      "registernummer": "HRB 10568",
      "registerart": "HRB",
      "company_name": "SICO Gesellschaft für Siliconverarbeitung mbH",
      "company_seat": "Witten",
      "details": "14.01.2025 (Bekanntmachungsdatum)\n\nNordrhein-Westfalen Amtsgericht Bochum HRB 10568\nSonstige Registerbekanntmachung 10.01.2025 (Eintragungsdatum)\n\nSICO Gesellschaft für Siliconverarbeitung mbH\nGesellschaft mit beschränkter Haftung\nWitten\n\nAls nicht eingetragen wird veröffentlicht: Den Gläubigern der Gesellschaft, deren Forderungen begründet worden sind bevor die Eintragung der Beendigung des Gewinnabführungsvertrages  in das Handelsregister nach § 10 des Handelsgesetzbuches als bekanntgemacht gilt, hat der andere Vertragsteil Sicherheit zu leisten, wenn sie sich binnen sechs Monaten nach der Bekanntmachung der Eintragung zu diesem Zweck bei ihm melden."
    },
    {
      "date": "2025-01-14",
      "id": "98577",
      "original_text": "Löschungsankündigung\nNordrhein-Westfalen Amtsgericht Köln HRB 79068\nBGW International Trade GmbH – Pulheim",
      "type": "Löschungsankündigung",
      "state": "Nordrhein-Westfalen",
      "amtsgericht": "Amtsgericht Köln",
      "registernummer": "HRB 79068",
      "registerart": "HRB",
      "company_name": "BGW International Trade GmbH",
      "company_seat": "Pulheim",
      "details": "14.01.2025 (Bekanntmachungsdatum)\n\nNordrhein-Westfalen Amtsgericht Köln HRB 79068\nLöschungsankündigung\n\nBGW International Trade GmbH\nGesellschaft mit beschränkter Haftung\nPulheim\n\nDas Registergericht beabsichtigt, die im Handelsregister eingetragene Gesellschaft gemäß § 394 Absatz 1 FamFG wegen Vermögenslosigkeit von Amts wegen zu löschen. Gegen diese Verfügung kann Widerspruch eingelegt werden. Die Frist zur Erhebung eines Widerspruchs gegen die beabsichtigte Löschung von Amts wegen ist auf einen Monat festgesetzt. Rechtsbehelfsbelehrung: Gegen diese Verfügung können Sie Widerspruch einlegen. Der Widerspruch ist bei dem Amtsgericht Köln, Reichenspergerplatz 1, 50670 Köln schriftlich in deutscher Sprache oder zur Niederschrift der Geschäftsstelle einzulegen. Der Widerspruch kann auch zur Niederschrift der Geschäftsstelle eines jeden Amtsgerichtes abgegeben werden. Die Einlegung ist auch durch Übertragung eines elektronischen Dokuments an die elektronische Poststelle des Gerichts möglich. Das elektronische Dokument muss für die Bearbeitung durch das Gericht geeignet und mit einer qualifizierten elektronischen Signatur der verantwortenden Person versehen sein oder von der verantwortenden Person signiert und auf einem sicheren Übermittlungsweg gemäß § 130a ZPO nach näherer Maßgabe der Verordnung über die technischen Rahmenbedingungen des elektronischen Rechtsverkehrs und über das besondere elektronische Behördenpostfach (BGBl. I, S.3803) eingereicht werden. Weitere Informationen erhalten Sie auf der Internetseite www.justiz.de.Der Widerspruch muss spätestens innerhalb der gesetzten Frist bei dem Amtsgericht Köln eingegangen sein. Dies gilt auch dann, wenn der Widerspruch zur Niederschrift der Geschäftsstelle eines anderen Amtsgerichtes abgegeben wurde. Die Frist beginnt mit der Veröffentlichung. Fällt das Ende der Frist auf einen Sonntag, einen allgemeinen Feiertag oder Sonnabend, so endet die Frist mit Ablauf des nächsten Werktages.Der Widerspruch muss die Bezeichnung der angefochtenen Verfügung sowie die Erklärung enthalten, dass Widerspruch gegen diese Verfügung eingelegt wird. Er ist zu unterzeichnen und soll begründet"
    },
    {
      "date": "2025-01-14",
      "id": "98578",
      "original_text": "Einreichung neuer Dokumente\nNordrhein-Westfalen Amtsgericht Wuppertal HRB 23425\nETRIS Bank GmbH – Wuppertal",
      "type": "Einreichung neuer Dokumente",
      "state": "Nordrhein-Westfalen",
      "amtsgericht": "Amtsgericht Wuppertal",
      "registernummer": "HRB 23425",
      "registerart": "HRB",
      "company_name": "ETRIS Bank GmbH",
      "company_seat": "Wuppertal",
      "details": "14.01.2025 (Bekanntmachungsdatum)\n\nNordrhein-Westfalen Amtsgericht Wuppertal HRB 23425\nEinreichung neuer Dokumente 14.01.2025 (Eintragungsdatum)\n\nETRIS Bank GmbH\nGesellschaft mit beschränkter Haftung\nWuppertal\n\nDem Registergericht ist eine neue Liste der Mitglieder des Aufsichtsrates eingereicht worden."
    },
    {
      "date": "2025-01-14",
      "id": "98579",
      "original_text": "Sonstige Registerbekanntmachung\nNordrhein-Westfalen Amtsgericht Köln HRB 90609\nREWE LOG 9 GmbH – Köln",
      "type": "Sonstige Registerbekanntmachung",
      "state": "Nordrhein-Westfalen",
      "amtsgericht": "Amtsgericht Köln",
      "registernummer": "HRB 90609",
      "registerart": "HRB",
      "company_name": "REWE LOG 9 GmbH",
      "company_seat": "Köln",
      "details": "14.01.2025 (Bekanntmachungsdatum)\n\nNordrhein-Westfalen Amtsgericht Köln HRB 90609\nSonstige Registerbekanntmachung\n\nREWE LOG 9 GmbH\nGesellschaft mit beschränkter Haftung\nKöln\n\nAls nicht eingetragen wird veröffentlicht: Den Gläubigern der Gesellschaft, deren Forderungen begründet worden sind bevor die Eintragung der Beendigung des Beherrschungs- und Gewinnabführungsvertrages  in das Handelsregister nach § 10 des Handelsgesetzbuches als bekanntgemacht gilt, hat der andere Vertragsteil Sicherheit zu leisten, wenn sie sich binnen sechs Monaten nach der Bekanntmachung der Eintragung zu diesem Zweck bei ihm melden."
    },
    {
      "date": "2025-01-14",
      "id": "98580",
      "original_text": "Löschungsankündigung\nNordrhein-Westfalen Amtsgericht Recklinghausen HRB 9317\nPARIZZ GmbH – Recklinghausen",
      "type": "Löschungsankündigung",
      "state": "Nordrhein-Westfalen",
      "amtsgericht": "Amtsgericht Recklinghausen",
      "registernummer": "HRB 9317",
      "registerart": "HRB",
      "company_name": "PARIZZ GmbH",
      "company_seat": "Recklinghausen",
      "details": "14.01.2025 (Bekanntmachungsdatum)\n\nNordrhein-Westfalen Amtsgericht Recklinghausen HRB 9317\nLöschungsankündigung\n\nPARIZZ GmbH\nGesellschaft mit beschränkter Haftung\nRecklinghausen\n\nDas Registergericht beabsichtigt die Gesellschaft von Amts wegen nach § 394 FamFG zu löschen. Die Frist zur Erhebung eines Widerspruchs ist auf zwei Monate festgesetzt."
    },
    {
      "date": "2025-01-14",
      "id": "98581",
      "original_text": "Löschungsankündigung\nNordrhein-Westfalen Amtsgericht Krefeld HRB 990\nintermedia Werbe- und Verlagsgesellschaft mit beschränkter Haftung – Krefeld",
      "type": "Löschungsankündigung",
      "state": "Nordrhein-Westfalen",
      "amtsgericht": "Amtsgericht Krefeld",
      "registernummer": "HRB 990",
      "registerart": "HRB",
      "company_name": "intermedia Werbe- und Verlagsgesellschaft mit beschränkter Haftung",
      "company_seat": "Krefeld",
      "details": "14.01.2025 (Bekanntmachungsdatum)\n\nNordrhein-Westfalen Amtsgericht Krefeld HRB 990\nLöschungsankündigung\n\nintermedia Werbe- und Verlagsgesellschaft mit beschränkter Haftung\nGesellschaft mit beschränkter Haftung\nKrefeld\n\nDas Registergericht beabsichtigt die Gesellschaft von Amts wegen nach § 394 FamFG zu löschen. Die Frist zur Erhebung eines Widerspruchs ist auf einen Monat festgesetzt."
    },
    {
      "date": "2025-01-14",
      "id": "98582",
      "original_text": "Sonstige Registerbekanntmachung\nNordrhein-Westfalen Amtsgericht Aachen HRB 14973\nWegener International GmbH – Eschweiler",
      "type": "Sonstige Registerbekanntmachung",
      "state": "Nordrhein-Westfalen",
      "amtsgericht": "Amtsgericht Aachen",
      "registernummer": "HRB 14973",
      "registerart": "HRB",
      "company_name": "Wegener International GmbH",
      "company_seat": "Eschweiler",
      "details": "14.01.2025 (Bekanntmachungsdatum)\n\nNordrhein-Westfalen Amtsgericht Aachen HRB 14973\nSonstige Registerbekanntmachung\n\nWegener International GmbH\nGesellschaft mit beschränkter Haftung\nEschweiler\n\nAls nicht eingetragen wird veröffentlicht: Den Gläubigern der Gesellschaft, deren Forderungen begründet worden sind bevor die Eintragung der Beendigung des Beherrschungs- und Gewinnabführungsvertrages  in das Handelsregister nach § 10 des Handelsgesetzbuches als bekanntgemacht gilt, hat der andere Vertragsteil Sicherheit zu leisten, wenn sie sich binnen sechs Monaten nach der Bekanntmachung der Eintragung zu diesem Zweck bei ihm melden."
    },
    {
      "date": "2025-01-14",
      "id": "98583",
      "original_text": "Sonstige Registerbekanntmachung\nNordrhein-Westfalen Amtsgericht Köln HRB 603\nHDI Lebensversicherung AG – Köln",
      "type": "Sonstige Registerbekanntmachung",
      "state": "Nordrhein-Westfalen",
      "amtsgericht": "Amtsgericht Köln",
      "registernummer": "HRB 603",
      "registerart": "HRB",
      "company_name": "HDI Lebensversicherung AG",
      "company_seat": "Köln",
      "details": "14.01.2025 (Bekanntmachungsdatum)\n\nNordrhein-Westfalen Amtsgericht Köln HRB 603\nSonstige Registerbekanntmachung\n\nHDI Lebensversicherung AG\nAktiengesellschaft\nKöln\n\nDem Registergericht ist eine Liste der Mitglieder des Aufsichtsrates eingereicht worden."
    },
    {
      "date": "2025-01-14",
      "id": "98584",
      "original_text": "Einreichung neuer Dokumente\nNordrhein-Westfalen Amtsgericht Bochum HRB 14427\nKnappschaft Kliniken Universitätsklinikum Bochum GmbH – Bochum",
      "type": "Einreichung neuer Dokumente",
      "state": "Nordrhein-Westfalen",
      "amtsgericht": "Amtsgericht Bochum",
      "registernummer": "HRB 14427",
      "registerart": "HRB",
      "company_name": "Knappschaft Kliniken Universitätsklinikum Bochum GmbH",
      "company_seat": "Bochum",
      "details": "14.01.2025 (Bekanntmachungsdatum)\n\nNordrhein-Westfalen Amtsgericht Bochum HRB 14427\nEinreichung neuer Dokumente\n\nKnappschaft Kliniken Universitätsklinikum Bochum GmbH\nGesellschaft mit beschränkter Haftung\nBochum\n\nDem Registergericht ist eine Liste der Mitglieder des Aufsichtsrates eingereicht worden."
    },
    {
      "date": "2025-01-14",
      "id": "98585",
      "original_text": "Löschungsankündigung\nNordrhein-Westfalen Amtsgericht Düsseldorf HRB 87846\nFunnelTec GmbH – Langenfeld",
      "type": "Löschungsankündigung",
      "state": "Nordrhein-Westfalen",
      "amtsgericht": "Amtsgericht Düsseldorf",
      "registernummer": "HRB 87846",
      "registerart": "HRB",
      "company_name": "FunnelTec GmbH",
      "company_seat": "Langenfeld",
      "details": "14.01.2025 (Bekanntmachungsdatum)\n\nNordrhein-Westfalen Amtsgericht Düsseldorf HRB 87846\nLöschungsankündigung\n\nFunnelTec GmbH\nGesellschaft mit beschränkter Haftung\nLangenfeld\n\nDas Registergericht beabsichtigt die Gesellschaft von Amts wegen nach § 394 Abs. 1 FamFG zu löschen. Die Frist zur Erhebung eines Widerspruchs ist auf einen Monat festgesetzt.\n\nRechtsbehelfsbelehrung:\nDas Widerspruchsrecht steht jedem zu, der an der Unterlassung der Löschung ein berechtigtes Interesse hat. Der Widerspruch ist bei dem Amtsgericht Düsseldorf -Registergericht-, Werdener Straße 1, 40227 Düsseldorf schriftlich in deutscher Sprache oder zur Niederschrift der Geschäftsstelle einzulegen. Der Widerspruch kann auch zur Niederschrift der Geschäftsstelle eines jeden Amtsgerichtes abgegeben werden. Die Einlegung ist auch durch Übertragung eines elektronischen Dokuments an die elektronische Poststelle des Gerichts möglich. Das elektronische Dokument muss für die Bearbeitung durch das Gericht geeignet und mit einer qualifizierten elektronischen Signatur der verantwortenden Person versehen sein oder von der verantwortenden Person signiert und auf einem sicheren Übermittlungsweg gemäß § 130a ZPO nach näherer Maßgabe der Verordnung über die technischen Rahmenbedingungen des elektronischen Rechtsverkehrs und über das besondere elektronische Behördenpostfach (BGBl. I, S.3803) eingereicht werden. Weitere Informationen erhalten Sie auf der Internetseite www.justiz.de.\nDer Widerspruch muss spätestens innerhalb der gesetzten Frist nach dem Datum der Bekanntmachung der Löschungsankündigung bei dem Amtsgericht - Registergericht - Düsseldorf eingegangen sein.  Dies gilt auch dann, wenn der Widerspruch zur Niederschrift der Geschäftsstelle eines anderen Amtsgerichtes abgegeben wurde. Die Frist beginnt mit dem Tage der Bekanntmachung der Löschungsankündigung in dem für die Bekanntmachung der Eintragungen in das Handelsregister bestimmten elektronischen Informations- und Kommunikationssystem nach § 10 des Handelsgesetzbuches. Fällt das Ende der Frist auf einen Sonntag, einen allgemeinen Feiertag oder Sonnabend, so endet die Frist mit Ablauf des nächsten Werktages.\nDer Widerspruch muss die Bezeichnung der angefochtenen Löschungsankündigung sowie die Erklärung enthalten, dass Widerspruch gegen diese Löschungsankündigung eingelegt wird. Er ist zu unterzeichnen und soll begründet werden."
    },
    {
      "date": "2025-01-14",
      "id": "98586",
      "original_text": "Sonstige Registerbekanntmachung\nNordrhein-Westfalen Amtsgericht Köln HRB 49559\nBITech AG Beratungsgesellschaft für betriebswirtschaftliche Anwendungssoftware – Leverkusen",
      "type": "Sonstige Registerbekanntmachung",
      "state": "Nordrhein-Westfalen",
      "amtsgericht": "Amtsgericht Köln",
      "registernummer": "HRB 49559",
      "registerart": "HRB",
      "company_name": "BITech AG Beratungsgesellschaft für betriebswirtschaftliche Anwendungssoftware",
      "company_seat": "Leverkusen",
      "details": "14.01.2025 (Bekanntmachungsdatum)\n\nNordrhein-Westfalen Amtsgericht Köln HRB 49559\nSonstige Registerbekanntmachung\n\nBITech AG Beratungsgesellschaft für betriebswirtschaftliche Anwendungssoftware\nAktiengesellschaft\nLeverkusen\n\nDem Registergericht ist eine Liste der Mitglieder des Aufsichtsrates eingereicht worden."
    },
    {
      "date": "2025-01-14",
      "id": "98587",
      "original_text": "Löschungsankündigung\nNordrhein-Westfalen Amtsgericht Kleve HRB 11189\nIDEAL DRINKS GmbH – Kleve",
      "type": "Löschungsankündigung",
      "state": "Nordrhein-Westfalen",
      "amtsgericht": "Amtsgericht Kleve",
      "registernummer": "HRB 11189",
      "registerart": "HRB",
      "company_name": "IDEAL DRINKS GmbH",
      "company_seat": "Kleve",
      "details": "14.01.2025 (Bekanntmachungsdatum)\n\nNordrhein-Westfalen Amtsgericht Kleve HRB 11189\nLöschungsankündigung\n\nIDEAL DRINKS GmbH\nGesellschaft mit beschränkter Haftung\nKleve\n\nDas Registergericht beabsichtigt die Gesellschaft von Amts wegen nach § 394 FamFG zu löschen. Die Frist zur Erhebung eines Widerspruchs ist auf einen Monat festgesetzt."
    },
    {
      "date": "2025-01-14",
      "id": "98588",
      "original_text": "Löschungsankündigung\nNordrhein-Westfalen Amtsgericht Mönchengladbach HRB 20361\nUnist Handel GmbH – Mönchengladbach",
      "type": "Löschungsankündigung",
      "state": "Nordrhein-Westfalen",
      "amtsgericht": "Amtsgericht Mönchengladbach",
      "registernummer": "HRB 20361",
      "registerart": "HRB",
      "company_name": "Unist Handel GmbH",
      "company_seat": "Mönchengladbach",
      "details": "14.01.2025 (Bekanntmachungsdatum)\n\nNordrhein-Westfalen Amtsgericht Mönchengladbach HRB 20361\nLöschungsankündigung\n\nUnist Handel GmbH\nGesellschaft mit beschränkter Haftung\nMönchengladbach\n\nDas Registergericht beabsichtigt die Gesellschaft von Amts wegen nach § 394 FamFG zu löschen. Die Frist zur Erhebung eines Widerspruchs ist auf drei Monate festgesetzt."
    },
    {
      "date": "2025-01-14",
      "id": "98589",
      "original_text": "Einreichung neuer Dokumente\nNordrhein-Westfalen Amtsgericht Düsseldorf HRB 39401\nRheinmetall Aktiengesellschaft – Düsseldorf",
      "type": "Einreichung neuer Dokumente",
      "state": "Nordrhein-Westfalen",
      "amtsgericht": "Amtsgericht Düsseldorf",
      "registernummer": "HRB 39401",
      "registerart": "HRB",
      "company_name": "Rheinmetall Aktiengesellschaft",
      "company_seat": "Düsseldorf",
      "details": "14.01.2025 (Bekanntmachungsdatum)\n\nNordrhein-Westfalen Amtsgericht Düsseldorf HRB 39401\nEinreichung neuer Dokumente\n\nRheinmetall Aktiengesellschaft\nAktiengesellschaft\nDüsseldorf\n\nDem Registergericht ist eine Liste der Mitglieder des Aufsichtsrates eingereicht worden."
    },
    {
      "date": "2025-01-14",
      "id": "98590",
      "original_text": "Löschungsankündigung\nNordrhein-Westfalen Amtsgericht Düsseldorf HRB 83561\nDDFC GmbH – Düsseldorf",
      "type": "Löschungsankündigung",
      "state": "Nordrhein-Westfalen",
      "amtsgericht": "Amtsgericht Düsseldorf",
      "registernummer": "HRB 83561",
      "registerart": "HRB",
      "company_name": "DDFC GmbH",
      "company_seat": "Düsseldorf",
      "details": "14.01.2025 (Bekanntmachungsdatum)\n\nNordrhein-Westfalen Amtsgericht Düsseldorf HRB 83561\nLöschungsankündigung\n\nDDFC GmbH\nGesellschaft mit beschränkter Haftung\nDüsseldorf\n\nDas Registergericht beabsichtigt die Gesellschaft von Amts wegen nach § 394 FamFG zu löschen. Die Frist zur Erhebung eines Widerspruchs ist auf 3 Wochen festgesetzt.\n\nRechtsbehelfsbelehrung:\nDas Widerspruchsrecht steht jedem zu, der an der Unterlassung der Löschung ein berechtigtes Interesse hat. Der Widerspruch ist bei dem Amtsgericht Düsseldorf -Registergericht-, Werdener Straße 1, 40227 Düsseldorf schriftlich in deutscher Sprache oder zur Niederschrift der Geschäftsstelle einzulegen. Der Widerspruch kann auch zur Niederschrift der Geschäftsstelle eines jeden Amtsgerichtes abgegeben werden. Die Einlegung ist auch durch Übertragung eines elektronischen Dokuments an die elektronische Poststelle des Gerichts möglich. Das elektronische Dokument muss für die Bearbeitung durch das Gericht geeignet und mit einer qualifizierten elektronischen Signatur der verantwortenden Person versehen sein oder von der verantwortenden Person signiert und auf einem sicheren Übermittlungsweg gemäß § 130a ZPO nach näherer Maßgabe der Verordnung über die technischen Rahmenbedingungen des elektronischen Rechtsverkehrs und über das besondere elektronische Behördenpostfach (BGBl. I, S.3803) eingereicht werden. Weitere Informationen erhalten Sie auf der Internetseite www.justiz.de.\nDer Widerspruch muss spätestens innerhalb der gesetzten Frist nach dem Datum der Bekanntmachung der Löschungsankündigung bei dem Amtsgericht - Registergericht - Düsseldorf eingegangen sein.  Dies gilt auch dann, wenn der Widerspruch zur Niederschrift der Geschäftsstelle eines anderen Amtsgerichtes abgegeben wurde. Die Frist beginnt mit dem Tage der Bekanntmachung der Löschungsankündigung in dem für die Bekanntmachung der Eintragungen in das Handelsregister bestimmten elektronischen Informations- und Kommunikationssystem nach § 10 des Handelsgesetzbuches. Fällt das Ende der Frist auf einen Sonntag, einen allgemeinen Feiertag oder Sonnabend, so endet die Frist mit Ablauf des nächsten Werktages.\nDer Widerspruch muss die Bezeichnung der angefochtenen Löschungsankündigung sowie die Erklärung enthalten, dass Widerspruch gegen diese Löschungsankündigung eingelegt wird. Er ist zu unterzeichnen und soll begründet werden."
    },
    {
      "date": "2025-01-14",
      "id": "98591",
      "original_text": "Löschungsankündigung\nThüringen Amtsgericht Jena HRA 103127\nFenster- und Türenbau Tabarz Ltd. & Co KG – Bad Tabarz",
      "type": "Löschungsankündigung",
      "state": "Thüringen",
      "amtsgericht": "Amtsgericht Jena",
      "registernummer": "HRA 103127",
      "registerart": "HRA",
      "company_name": "Fenster- und Türenbau Tabarz Ltd. & Co KG",
      "company_seat": "Bad Tabarz",
      "details": ""
    },
    {
      "date": "2025-01-14",
      "id": "98592",
      "original_text": "Sonstige Registerbekanntmachung\nHessen Amtsgericht Frankfurt am Main HRB 119985\nAlliance Healthcare Deutschland GmbH – Frankfurt am Main",
      "type": "Sonstige Registerbekanntmachung",
      "state": "Hessen",
      "amtsgericht": "Amtsgericht Frankfurt am Main",
      "registernummer": "HRB 119985",
      "registerart": "HRB",
      "company_name": "Alliance Healthcare Deutschland GmbH",
      "company_seat": "Frankfurt am Main",
      "details": "14.01.2025 (Bekanntmachungsdatum)\n\nHessen Amtsgericht Frankfurt am Main HRB 119985\nSonstige Registerbekanntmachung 14.01.2025 (Eintragungsdatum)\n\nAlliance Healthcare Deutschland GmbH\nGesellschaft mit beschränkter Haftung\nFrankfurt am Main\n\nDurch eine Änderung in den Personen der Aufsichtsratsmitglieder ist eine Liste der Mitglieder des Aufsichtsrates zum Handelsregister eingereicht worden."
    },
    {
      "date": "2025-01-14",
      "id": "98593",
      "original_text": "Löschungsankündigung\nHessen Amtsgericht Friedberg HRB 8825\nFliesen Chalet Friedberg GmbH – Friedberg (Hessen)",
      "type": "Löschungsankündigung",
      "state": "Hessen",
      "amtsgericht": "Amtsgericht Friedberg",
      "registernummer": "HRB 8825",
      "registerart": "HRB",
      "company_name": "Fliesen Chalet Friedberg GmbH",
      "company_seat": "Friedberg (Hessen)",
      "details": "14.01.2025 (Bekanntmachungsdatum)\n\nHessen Amtsgericht Friedberg HRB 8825\nLöschungsankündigung\n\nFliesen Chalet Friedberg GmbH\nGesellschaft mit beschränkter Haftung\nFriedberg (Hessen)\n\nDas Registergericht beabsichtigt die im Handelsregister eingetragene Gesellschaft von Amts wegen nach § 394 FamFG zu löschen. Die Frist zur Erhebung eines Widerspruchs gegen die beabsichtigte Löschung wird auf 3 Monate festgesetzt."
    },
    {
      "date": "2025-01-14",
      "id": "98594",
      "original_text": "Sonstige Registerbekanntmachung\nHessen Amtsgericht Wiesbaden HRB 9110\nP&I Personal & Informatik Aktiengesellschaft – Wiesbaden",
      "type": "Sonstige Registerbekanntmachung",
      "state": "Hessen",
      "amtsgericht": "Amtsgericht Wiesbaden",
      "registernummer": "HRB 9110",
      "registerart": "HRB",
      "company_name": "P&I Personal & Informatik Aktiengesellschaft",
      "company_seat": "Wiesbaden",
      "details": "14.01.2025 (Bekanntmachungsdatum)\n\nHessen Amtsgericht Wiesbaden HRB 9110\nSonstige Registerbekanntmachung\n\nP&I Personal & Informatik Aktiengesellschaft\nAktiengesellschaft\nWiesbaden\n\nDurch eine Änderung in den Personen der Aufsichtsratsmitglieder ist eine Liste der Mitglieder des Aufsichtsrates zum Handelsregister eingereicht worden."
    },
    {
      "date": "2025-01-14",
      "id": "98595",
      "original_text": "Registerbekanntmachung nach dem Umwandlungsgesetz\nHessen Amtsgericht Darmstadt HRB 105593\nWTG direct GmbH – Darmstadt",
      "type": "Registerbekanntmachung nach dem Umwandlungsgesetz",
      "state": "Hessen",
      "amtsgericht": "Amtsgericht Darmstadt",
      "registernummer": "HRB 105593",
      "registerart": "HRB",
      "company_name": "WTG direct GmbH",
      "company_seat": "Darmstadt",
      "details": "14.01.2025 (Bekanntmachungsdatum)\n\nHessen Amtsgericht Darmstadt HRB 105593\nRegisterbekanntmachung nach dem Umwandlungsgesetz 14.01.2025 (Eintragungsdatum)\n\nWTG direct GmbH\nGesellschaft mit beschränkter Haftung\nDarmstadt\n\nDen Gläubigern der an der Verschmelzung beteiligten Rechtsträger ist, wenn sie binnen sechs Monaten nach dem Tag, an dem die Eintragung der Verschmelzung in das Register des Sitzes derjenigen Rechtsträger deren Gläubiger sie sind, nach § 19 Absatz 3 UmwG bekannt gemacht worden ist, ihren Anspruch nach Grund und Höhe schriftlich anmelden, Sicherheit zu leisten, soweit sie nicht Befriedigung verlangen können. Dieses Recht steht den Gläubigern jedoch nur zu, wenn sie glaubhaft machen, dass durch die Verschmelzung die Erfüllung ihrer Forderung gefährdet wird."
    },
    {
      "date": "2025-01-14",
      "id": "98596",
      "original_text": "Löschungsankündigung\nHessen Amtsgericht Hanau HRB 95078\nBullites UG (haftungsbeschränkt) – Langenselbold",
      "type": "Löschungsankündigung",
      "state": "Hessen",
      "amtsgericht": "Amtsgericht Hanau",
      "registernummer": "HRB 95078",
      "registerart": "HRB",
      "company_name": "Bullites UG (haftungsbeschränkt)",
      "company_seat": "Langenselbold",
      "details": "14.01.2025 (Bekanntmachungsdatum)\n\nHessen Amtsgericht Hanau HRB 95078\nLöschungsankündigung\n\nBullites UG (haftungsbeschränkt)\nGesellschaft mit beschränkter Haftung\nLangenselbold\n\nDas Registergericht beabsichtigt die im Handelsregister eingetragene Gesellschaft von Amts wegen nach § 394 FamFG zu löschen. Die Frist zur Erhebung eines Widerspruchs gegen die beabsichtigte Löschung wird auf 3 Monate festgesetzt."
    },
    {
      "date": "2025-01-14",
      "id": "98597",
      "original_text": "Löschungsankündigung\nHessen Amtsgericht Darmstadt HRB 102256\nMeci GmbH – Bischofsheim",
      "type": "Löschungsankündigung",
      "state": "Hessen",
      "amtsgericht": "Amtsgericht Darmstadt",
      "registernummer": "HRB 102256",
      "registerart": "HRB",
      "company_name": "Meci GmbH",
      "company_seat": "Bischofsheim",
      "details": "14.01.2025 (Bekanntmachungsdatum)\n\nHessen Amtsgericht Darmstadt HRB 102256\nLöschungsankündigung\n\nMeci GmbH\nGesellschaft mit beschränkter Haftung\nBischofsheim\n\nDas Registergericht beabsichtigt die im Handelsregister eingetragene Gesellschaft von Amts wegen nach § 394 FamFG zu löschen. Die Frist zur Erhebung eines Widerspruchs gegen die beabsichtigte Löschung wird auf 3 Monate festgesetzt."
    },
    {
      "date": "2025-01-14",
      "id": "98598",
      "original_text": "Sonstige Registerbekanntmachung\nHessen Amtsgericht Gießen VR 102097 früher Amtsgericht Friedberg\nGesangverein \"Liedertafel\" 1947 Trais Horloff e.V. – Hungen-Trais-Horloff",
      "type": "Sonstige Registerbekanntmachung",
      "state": "Hessen",
      "amtsgericht": "Amtsgericht Gießen",
      "registernummer": "VR 102097",
      "registerart": "VR",
      "company_name": "Gesangverein \"Liedertafel\" 1947 Trais Horloff e.V.",
      "company_seat": "Hungen-Trais-Horloff",
      "former_amtsgericht": "Friedberg",
      "details": "14.01.2025 (Bekanntmachungsdatum)\n\nHessen Amtsgericht Gießen VR 102097 früher Amtsgericht Friedberg\nSonstige Registerbekanntmachung\n\nGesangverein \"Liedertafel\" 1947 Trais Horloff e.V.\neingetragener Verein\nHungen-Trais-Horloff\n\nDer Verein ist aufgelöst."
    }
  ]
}