{
  "date": "2025-01-17",
  "date_of_scrape": "2025-01-18T04:06:51.852Z",
  "tool_version": "0.2.0",
  "number_of_announcements": 109,
  "announcements": [
    {
      "date": "2025-01-17",
      "id": "70",
      "original_text": "Sonderregisterbekanntmachung OHNE Bezug zum elektr. Register\nSachsen-Anhalt Amtsgericht Stendal\n65 AR 2617/24\nWoodleaze Ventures Limited",
      "type": "Sonderregisterbekanntmachung OHNE Bezug zum elektr. Register",
      "state": "Sachsen-Anhalt",
      "amtsgericht": "Amtsgericht Stendal",
      "company_name": "Woodleaze Ventures Limited",
      "sonderegister_referenz": "65 AR 2617/24",
      "details": "17.01.2025 (Bekanntmachungsdatum)\n\nSachsen-Anhalt Amtsgericht Stendal\n65 AR 2617/24\nSonderregisterbekanntmachung OHNE Bezug zum elektr. Register\n\nWoodleaze Ventures Limited\n\nHinsichtlich o.g. Gesellschaft ist beabsichtigt, Ingolf Schoder, Falkenstein/Harz, zum Nachtragsliquidator zu bestellen. Die Frist zu Einreichung etwaiger Stellungnahmen bzw. Erhebung eines Widerspruchs beim Amtsgericht Stendal wird auf 1 Monat festgesetzt."
    },
    {
      "date": "2025-01-17",
      "id": "98839",
      "original_text": "Einreichung neuer Dokumente\nBayern Amtsgericht München HRB 131060\nCA Akademie privates Institut für Controlling und Unternehmensführung Aktiengesellschaft – Wörthsee",
      "type": "Einreichung neuer Dokumente",
      "state": "Bayern",
      "amtsgericht": "Amtsgericht München",
      "registernummer": "HRB 131060",
      "registerart": "HRB",
      "company_name": "CA Akademie privates Institut für Controlling und Unternehmensführung Aktiengesellschaft",
      "company_seat": "Wörthsee",
      "details": "17.01.2025 (Bekanntmachungsdatum)\n\nBayern Amtsgericht München HRB 131060\nEinreichung neuer Dokumente\n\nCA Akademie privates Institut für Controlling und Unternehmensführung Aktiengesellschaft\nAktiengesellschaft\nWörthsee\n\nDem #Re.Name ist eine Liste der Mitglieder des Aufsichtsrats eingereicht worden, § 106 AktG."
    },
    {
      "date": "2025-01-17",
      "id": "98840",
      "original_text": "Löschungsankündigung\nBayern Amtsgericht München HRB 191391\nRWI RealWertInvest Verwaltungsgesellschaft mbH – Unterhaching",
      "type": "Löschungsankündigung",
      "state": "Bayern",
      "amtsgericht": "Amtsgericht München",
      "registernummer": "HRB 191391",
      "registerart": "HRB",
      "company_name": "RWI RealWertInvest Verwaltungsgesellschaft mbH",
      "company_seat": "Unterhaching",
      "details": "17.01.2025 (Bekanntmachungsdatum)\n\nBayern Amtsgericht München HRB 191391\nLöschungsankündigung\n\nRWI RealWertInvest Verwaltungsgesellschaft mbH\nGesellschaft mit beschränkter Haftung\nUnterhaching\n\nDas Registergericht beabsichtigt, die im Handelsregister eingetragene Gesellschaft wegen Vermögenslosigkeit von Amts wegen nach § 394 FamFG zu löschen. Die Frist zur Erhebung eines Widerspruchs ist auf drei Monate festgesetzt."
    },
    {
      "date": "2025-01-17",
      "id": "98841",
      "original_text": "Sonstige Registerbekanntmachung\nBayern Amtsgericht Augsburg HRB 32695\nAndreas Schmid Transport GmbH – Gersthofen",
      "type": "Sonstige Registerbekanntmachung",
      "state": "Bayern",
      "amtsgericht": "Amtsgericht Augsburg",
      "registernummer": "HRB 32695",
      "registerart": "HRB",
      "company_name": "Andreas Schmid Transport GmbH",
      "company_seat": "Gersthofen",
      "details": "17.01.2025 (Bekanntmachungsdatum)\n\nBayern Amtsgericht Augsburg HRB 32695\nSonstige Registerbekanntmachung 16.01.2025 (Eintragungsdatum)\n\nAndreas Schmid Transport GmbH\nGesellschaft mit beschränkter Haftung\nGersthofen\n\nDen Gläubigern der Gesellschaft, deren Forderungen begründet worden sind, bevor die Eintragung der Beendigung des Gewinnabführungsvertrages in das Handelsregister nach § 10 des Handelsgesetzbuches als bekanntgemacht gilt, hat der andere Vertragsteil Sicherheit zu leisten, wenn sie sich binnen sechs Monaten nach der Bekanntmachung der Eintragung zu diesem Zweck bei ihm melden."
    },
    {
      "date": "2025-01-17",
      "id": "98842",
      "original_text": "Registerbekanntmachung nach dem Umwandlungsgesetz\nBayern Amtsgericht München HRB 299086\nKirschner Holding & Unternehmerberatung AG Wirtschaftsprüfungsgesellschaft Steuerberatungsgesellschaft – München",
      "type": "Registerbekanntmachung nach dem Umwandlungsgesetz",
      "state": "Bayern",
      "amtsgericht": "Amtsgericht München",
      "registernummer": "HRB 299086",
      "registerart": "HRB",
      "company_name": "Kirschner Holding & Unternehmerberatung AG Wirtschaftsprüfungsgesellschaft Steuerberatungsgesellschaft",
      "company_seat": "München",
      "details": "17.01.2025 (Bekanntmachungsdatum)\n\nBayern Amtsgericht München HRB 299086\nRegisterbekanntmachung nach dem Umwandlungsgesetz 16.01.2025 (Eintragungsdatum)\n\nKirschner Holding & Unternehmerberatung AG Wirtschaftsprüfungsgesellschaft Steuerberatungsgesellschaft\nAktiengesellschaft\nMünchen\n\nDen Gläubigern des formwechselnden Rechtsträgers ist, wenn sie binnen sechs Monaten nach dem Tag, an dem die Eintragung des Formwechsels nach § 201 UmwG als bekannt gemacht gilt, ihren Anspruch nach Grund und Höhe in Textform anmelden, Sicherheit zu leisten, soweit sie nicht Befriedigung verlangen können. Dieses Recht steht den Gläubigern jedoch nur zu, wenn sie glaubhaft machen, dass durch den Formwechsel die Erfüllung ihrer Forderung gefährdet wird."
    },
    {
      "date": "2025-01-17",
      "id": "98843",
      "original_text": "Registerbekanntmachung nach dem Umwandlungsgesetz\nBayern Amtsgericht München HRB 290209\nYSC YOGA SOCIAL CLUB München GmbH – München",
      "type": "Registerbekanntmachung nach dem Umwandlungsgesetz",
      "state": "Bayern",
      "amtsgericht": "Amtsgericht München",
      "registernummer": "HRB 290209",
      "registerart": "HRB",
      "company_name": "YSC YOGA SOCIAL CLUB München GmbH",
      "company_seat": "München",
      "details": "17.01.2025 (Bekanntmachungsdatum)\n\nBayern Amtsgericht München HRB 290209\nRegisterbekanntmachung nach dem Umwandlungsgesetz 16.01.2025 (Eintragungsdatum)\n\nYSC YOGA SOCIAL CLUB München GmbH\nGesellschaft mit beschränkter Haftung\nMünchen\n\nDen Gläubigern der an der Verschmelzung beteiligten Rechtsträger ist, wenn sie binnen sechs Monaten nach dem Tag, an dem die Eintragung der Verschmelzung in das Register des Sitzes desjenigen Rechtsträgers, dessen Gläubiger sie sind, nach § 19 Abs. 3 UmwG als bekannt gemacht gilt, ihren Anspruch nach Grund und Höhe in Textform anmelden, Sicherheit zu leisten, soweit sie nicht Befriedigung verlangen können. Dieses Recht steht den Gläubigern jedoch nur zu, wenn sie glaubhaft machen, dass durch die Verschmelzung die Erfüllung ihrer Forderung gefährdet wird."
    },
    {
      "date": "2025-01-17",
      "id": "98844",
      "original_text": "Sonstige Registerbekanntmachung\nBayern Amtsgericht München HRB 261218\nLIVIA Finance III AG – München",
      "type": "Sonstige Registerbekanntmachung",
      "state": "Bayern",
      "amtsgericht": "Amtsgericht München",
      "registernummer": "HRB 261218",
      "registerart": "HRB",
      "company_name": "LIVIA Finance III AG",
      "company_seat": "München",
      "details": "17.01.2025 (Bekanntmachungsdatum)\n\nBayern Amtsgericht München HRB 261218\nSonstige Registerbekanntmachung 16.01.2025 (Eintragungsdatum)\n\nLIVIA Finance III AG\nAktiengesellschaft\nMünchen\n\nDen Gläubigern der Gesellschaft, deren Forderungen begründet worden sind, bevor die Eintragung der Beendigung des Gewinnabführungsvertrages in das Handelsregister nach § 10 des Handelsgesetzbuches als bekanntgemacht gilt, hat der andere Vertragsteil Sicherheit zu leisten, wenn sie sich binnen sechs Monaten nach der Bekanntmachung der Eintragung zu diesem Zweck bei ihm melden."
    },
    {
      "date": "2025-01-17",
      "id": "98845",
      "original_text": "Löschungsankündigung\nBayern Amtsgericht München HRB 198789\nBusiness Media Marketing GmbH – München",
      "type": "Löschungsankündigung",
      "state": "Bayern",
      "amtsgericht": "Amtsgericht München",
      "registernummer": "HRB 198789",
      "registerart": "HRB",
      "company_name": "Business Media Marketing GmbH",
      "company_seat": "München",
      "details": "17.01.2025 (Bekanntmachungsdatum)\n\nBayern Amtsgericht München HRB 198789\nLöschungsankündigung\n\nBusiness Media Marketing GmbH\nGesellschaft mit beschränkter Haftung\nMünchen\n\nDas Registergericht beabsichtigt, die im Handelsregister eingetragene Gesellschaft wegen Vermögenslosigkeit von Amts wegen nach § 394 FamFG zu löschen. Die Frist zur Erhebung eines Widerspruchs ist auf drei Monate festgesetzt."
    },
    {
      "date": "2025-01-17",
      "id": "98846",
      "original_text": "Einreichung neuer Dokumente\nBayern Amtsgericht Traunstein HRB 27259\nISG Jugendhilfe gGmbH – Traunreut",
      "type": "Einreichung neuer Dokumente",
      "state": "Bayern",
      "amtsgericht": "Amtsgericht Traunstein",
      "registernummer": "HRB 27259",
      "registerart": "HRB",
      "company_name": "ISG Jugendhilfe gGmbH",
      "company_seat": "Traunreut",
      "details": "17.01.2025 (Bekanntmachungsdatum)\n\nBayern Amtsgericht Traunstein HRB 27259\nEinreichung neuer Dokumente 16.01.2025 (Eintragungsdatum)\n\nISG Jugendhilfe gGmbH\nGesellschaft mit beschränkter Haftung\nTraunreut\n\nDem Amtsgericht Traunstein -Registergericht- ist eine Liste der Mitglieder des Aufsichtsrats eingereicht worden, § 52 Abs. 3 S. 2 GmbHG."
    },
    {
      "date": "2025-01-17",
      "id": "98847",
      "original_text": "Registerbekanntmachung nach dem Umwandlungsgesetz\nBayern Amtsgericht München HRB 211067\nKirschner Holding & Unternehmerberatung GmbH Wirtschaftsprüfungsgesellschaft Steuerberatungsgesellschaft – München",
      "type": "Registerbekanntmachung nach dem Umwandlungsgesetz",
      "state": "Bayern",
      "amtsgericht": "Amtsgericht München",
      "registernummer": "HRB 211067",
      "registerart": "HRB",
      "company_name": "Kirschner Holding & Unternehmerberatung GmbH Wirtschaftsprüfungsgesellschaft Steuerberatungsgesellschaft",
      "company_seat": "München",
      "details": "17.01.2025 (Bekanntmachungsdatum)\n\nBayern Amtsgericht München HRB 211067\nRegisterbekanntmachung nach dem Umwandlungsgesetz 16.01.2025 (Eintragungsdatum)\n\nKirschner Holding & Unternehmerberatung GmbH Wirtschaftsprüfungsgesellschaft Steuerberatungsgesellschaft\nGesellschaft mit beschränkter Haftung\nMünchen\n\nDen Gläubigern des formwechselnden Rechtsträgers ist, wenn sie binnen sechs Monaten nach dem Tag, an dem die Eintragung des Formwechsels nach § 201 UmwG als bekannt gemacht gilt, ihren Anspruch nach Grund und Höhe in Textform anmelden, Sicherheit zu leisten, soweit sie nicht Befriedigung verlangen können. Dieses Recht steht den Gläubigern jedoch nur zu, wenn sie glaubhaft machen, dass durch den Formwechsel die Erfüllung ihrer Forderung gefährdet wird."
    },
    {
      "date": "2025-01-17",
      "id": "98848",
      "original_text": "Registerbekanntmachung nach dem Umwandlungsgesetz\nBayern Amtsgericht München HRB 299026\nHealing Humans GmbH – München",
      "type": "Registerbekanntmachung nach dem Umwandlungsgesetz",
      "state": "Bayern",
      "amtsgericht": "Amtsgericht München",
      "registernummer": "HRB 299026",
      "registerart": "HRB",
      "company_name": "Healing Humans GmbH",
      "company_seat": "München",
      "details": "17.01.2025 (Bekanntmachungsdatum)\n\nBayern Amtsgericht München HRB 299026\nRegisterbekanntmachung nach dem Umwandlungsgesetz 16.01.2025 (Eintragungsdatum)\n\nHealing Humans GmbH\nGesellschaft mit beschränkter Haftung\nMünchen\n\nDen Gläubigern der an der Ausgliederung beteiligten Rechtsträger ist, wenn sie binnen sechs Monaten nach dem Tag, an dem die Eintragung der Ausgliederung in das Register des Sitzes desjenigen Rechtsträgers, dessen Gläubiger sie sind, nach §§ 125, 19 Abs. 3 UmwG als bekannt gemacht gilt, ihren Anspruch nach Grund und Höhe in Textform anmelden, Sicherheit zu leisten, soweit sie nicht Befriedigung verlangen können. Dieses Recht steht den Gläubigern jedoch nur zu, wenn sie glaubhaft machen, dass durch die Ausgliederung die Erfüllung ihrer Forderung gefährdet wird."
    },
    {
      "date": "2025-01-17",
      "id": "98849",
      "original_text": "Registerbekanntmachung nach dem Umwandlungsgesetz\nBayern Amtsgericht Memmingen HRB 21390\nGoldhofer Airport Technology AG – Memmingen",
      "type": "Registerbekanntmachung nach dem Umwandlungsgesetz",
      "state": "Bayern",
      "amtsgericht": "Amtsgericht Memmingen",
      "registernummer": "HRB 21390",
      "registerart": "HRB",
      "company_name": "Goldhofer Airport Technology AG",
      "company_seat": "Memmingen",
      "details": "17.01.2025 (Bekanntmachungsdatum)\n\nBayern Amtsgericht Memmingen HRB 21390\nRegisterbekanntmachung nach dem Umwandlungsgesetz\n\nGoldhofer Airport Technology AG\nAktiengesellschaft\nMemmingen\n\nDem Amtsgericht Memmingen -Registergericht- ist der Entwurf eines Verschmelzungsvertrages zwischen der Gesellschaft als übernehmendem Rechtsträger und der Goldhofer AG, Memmingen (Amtsgericht Memmingen HRB 10871) zur Einsichtnahme eingereicht worden."
    },
    {
      "date": "2025-01-17",
      "id": "98850",
      "original_text": "Registerbekanntmachung nach dem Umwandlungsgesetz\nBayern Amtsgericht München HRB 299023\nPREBAG Holding GmbH – Aschheim",
      "type": "Registerbekanntmachung nach dem Umwandlungsgesetz",
      "state": "Bayern",
      "amtsgericht": "Amtsgericht München",
      "registernummer": "HRB 299023",
      "registerart": "HRB",
      "company_name": "PREBAG Holding GmbH",
      "company_seat": "Aschheim",
      "details": "17.01.2025 (Bekanntmachungsdatum)\n\nBayern Amtsgericht München HRB 299023\nRegisterbekanntmachung nach dem Umwandlungsgesetz 16.01.2025 (Eintragungsdatum)\n\nPREBAG Holding GmbH\nGesellschaft mit beschränkter Haftung\nAschheim\n\nDen Gläubigern des formwechselnden Rechtsträgers ist, wenn sie binnen sechs Monaten nach dem Tag, an dem die Eintragung des Formwechsels nach § 201 UmwG als bekannt gemacht gilt, ihren Anspruch nach Grund und Höhe in Textform anmelden, Sicherheit zu leisten, soweit sie nicht Befriedigung verlangen können. Dieses Recht steht den Gläubigern jedoch nur zu, wenn sie glaubhaft machen, dass durch den Formwechsel die Erfüllung ihrer Forderung gefährdet wird."
    },
    {
      "date": "2025-01-17",
      "id": "98851",
      "original_text": "Löschungsankündigung\nBayern Amtsgericht Memmingen HRB 17290\nHoliday Apartments Kötz UG (haftungsbeschränkt) – Kötz",
      "type": "Löschungsankündigung",
      "state": "Bayern",
      "amtsgericht": "Amtsgericht Memmingen",
      "registernummer": "HRB 17290",
      "registerart": "HRB",
      "company_name": "Holiday Apartments Kötz UG (haftungsbeschränkt)",
      "company_seat": "Kötz",
      "details": "17.01.2025 (Bekanntmachungsdatum)\n\nBayern Amtsgericht Memmingen HRB 17290\nLöschungsankündigung\n\nHoliday Apartments Kötz UG (haftungsbeschränkt)\nGesellschaft mit beschränkter Haftung\nKötz\n\nDas Registergericht beabsichtigt, die im Handelsregister eingetragene Gesellschaft wegen Vermögenslosigkeit von Amts wegen nach § 394 FamFG zu löschen. Die Frist zur Erhebung eines Widerspruchs ist auf einen Monat festgesetzt."
    },
    {
      "date": "2025-01-17",
      "id": "98852",
      "original_text": "Löschungsankündigung\nBayern Amtsgericht München HRA 90465\nSol 1 GmbH & Co. KG – München",
      "type": "Löschungsankündigung",
      "state": "Bayern",
      "amtsgericht": "Amtsgericht München",
      "registernummer": "HRA 90465",
      "registerart": "HRA",
      "company_name": "Sol 1 GmbH & Co. KG",
      "company_seat": "München",
      "details": "17.01.2025 (Bekanntmachungsdatum)\n\nBayern Amtsgericht München HRA 90465\nLöschungsankündigung\n\nSol 1 GmbH & Co. KG\nKommanditgesellschaft\nMünchen\n\nDas Registergericht beabsichtigt, die im Handelsregister eingetragene Firma von Amts wegen nach § 31 Abs. 2 HGB zu löschen. Die Frist zur Erhebung eines Widerspruchs ist auf drei Monate festgesetzt."
    },
    {
      "date": "2025-01-17",
      "id": "98853",
      "original_text": "Registerbekanntmachung nach dem Umwandlungsgesetz\nBayern Amtsgericht München HRB 202280\nPREBAG Holding AG – Aschheim",
      "type": "Registerbekanntmachung nach dem Umwandlungsgesetz",
      "state": "Bayern",
      "amtsgericht": "Amtsgericht München",
      "registernummer": "HRB 202280",
      "registerart": "HRB",
      "company_name": "PREBAG Holding AG",
      "company_seat": "Aschheim",
      "details": "17.01.2025 (Bekanntmachungsdatum)\n\nBayern Amtsgericht München HRB 202280\nRegisterbekanntmachung nach dem Umwandlungsgesetz 16.01.2025 (Eintragungsdatum)\n\nPREBAG Holding AG\nAktiengesellschaft\nAschheim\n\nDen Gläubigern des formwechselnden Rechtsträgers ist, wenn sie binnen sechs Monaten nach dem Tag, an dem die Eintragung des Formwechsels nach § 201 UmwG als bekannt gemacht gilt, ihren Anspruch nach Grund und Höhe in Textform anmelden, Sicherheit zu leisten, soweit sie nicht Befriedigung verlangen können. Dieses Recht steht den Gläubigern jedoch nur zu, wenn sie glaubhaft machen, dass durch den Formwechsel die Erfüllung ihrer Forderung gefährdet wird."
    },
    {
      "date": "2025-01-17",
      "id": "98854",
      "original_text": "Löschungsankündigung\nBayern Amtsgericht München HRA 116276\nPRIMUS Concept Future 37 GmbH & Co. KG – Markt Indersdorf",
      "type": "Löschungsankündigung",
      "state": "Bayern",
      "amtsgericht": "Amtsgericht München",
      "registernummer": "HRA 116276",
      "registerart": "HRA",
      "company_name": "PRIMUS Concept Future 37 GmbH & Co. KG",
      "company_seat": "Markt Indersdorf",
      "details": "17.01.2025 (Bekanntmachungsdatum)\n\nBayern Amtsgericht München HRA 116276\nLöschungsankündigung\n\nPRIMUS Concept Future 37 GmbH & Co. KG\nKommanditgesellschaft\nMarkt Indersdorf\n\nDas Registergericht beabsichtigt, die im Handelsregister eingetragene Gesellschaft wegen Vermögenslosigkeit von Amts wegen nach § 394 FamFG zu löschen. Die Frist zur Erhebung eines Widerspruchs ist auf drei Monate festgesetzt."
    },
    {
      "date": "2025-01-17",
      "id": "98855",
      "original_text": "Registerbekanntmachung nach dem Umwandlungsgesetz\nBayern Amtsgericht Aschaffenburg HRB 15862\nBach Rechtsanwaltsgesellschaft mbH – Aschaffenburg",
      "type": "Registerbekanntmachung nach dem Umwandlungsgesetz",
      "state": "Bayern",
      "amtsgericht": "Amtsgericht Aschaffenburg",
      "registernummer": "HRB 15862",
      "registerart": "HRB",
      "company_name": "Bach Rechtsanwaltsgesellschaft mbH",
      "company_seat": "Aschaffenburg",
      "details": "17.01.2025 (Bekanntmachungsdatum)\n\nBayern Amtsgericht Aschaffenburg HRB 15862\nRegisterbekanntmachung nach dem Umwandlungsgesetz 16.01.2025 (Eintragungsdatum)\n\nBach Rechtsanwaltsgesellschaft mbH\nGesellschaft mit beschränkter Haftung\nAschaffenburg\n\nDen Gläubigern der an der Verschmelzung beteiligten Rechtsträger ist, wenn sie binnen sechs Monaten nach dem Tag, an dem die Eintragung der Verschmelzung in das Register des Sitzes desjenigen Rechtsträgers, dessen Gläubiger sie sind, nach § 19 Abs. 3 UmwG als bekannt gemacht gilt, ihren Anspruch nach Grund und Höhe in Textform anmelden, Sicherheit zu leisten, soweit sie nicht Befriedigung verlangen können. Dieses Recht steht den Gläubigern jedoch nur zu, wenn sie glaubhaft machen, dass durch die Verschmelzung die Erfüllung ihrer Forderung gefährdet wird."
    },
    {
      "date": "2025-01-17",
      "id": "98856",
      "original_text": "Registerbekanntmachung nach dem Umwandlungsgesetz\nBayern Amtsgericht Aschaffenburg PR 79\nBach Rechtsanwälte Partnerschaft – Aschaffenburg",
      "type": "Registerbekanntmachung nach dem Umwandlungsgesetz",
      "state": "Bayern",
      "amtsgericht": "Amtsgericht Aschaffenburg",
      "registernummer": "PR 79",
      "registerart": "PR",
      "company_name": "Bach Rechtsanwälte Partnerschaft",
      "company_seat": "Aschaffenburg",
      "details": "17.01.2025 (Bekanntmachungsdatum)\n\nBayern Amtsgericht Aschaffenburg PR 79\nRegisterbekanntmachung nach dem Umwandlungsgesetz 16.01.2025 (Eintragungsdatum)\n\nBach Rechtsanwälte Partnerschaft\nPartnerschaftsgesellschaft\nAschaffenburg\n\nDen Gläubigern der an der Verschmelzung beteiligten Rechtsträger ist, wenn sie binnen sechs Monaten nach dem Tag, an dem die Eintragung der Verschmelzung in das Register des Sitzes desjenigen Rechtsträgers, dessen Gläubiger sie sind, nach § 19 Abs. 3 UmwG als bekannt gemacht gilt, ihren Anspruch nach Grund und Höhe in Textform anmelden, Sicherheit zu leisten, soweit sie nicht Befriedigung verlangen können. Dieses Recht steht den Gläubigern jedoch nur zu, wenn sie glaubhaft machen, dass durch die Verschmelzung die Erfüllung ihrer Forderung gefährdet wird."
    },
    {
      "date": "2025-01-17",
      "id": "98857",
      "original_text": "Sonstige Registerbekanntmachung\nBayern Amtsgericht Hof HRB 3643\nRAUMEDIC AG – Münchberg",
      "type": "Sonstige Registerbekanntmachung",
      "state": "Bayern",
      "amtsgericht": "Amtsgericht Hof",
      "registernummer": "HRB 3643",
      "registerart": "HRB",
      "company_name": "RAUMEDIC AG",
      "company_seat": "Münchberg",
      "details": "17.01.2025 (Bekanntmachungsdatum)\n\nBayern Amtsgericht Hof HRB 3643\nSonstige Registerbekanntmachung\n\nRAUMEDIC AG\nAktiengesellschaft\nMünchberg\n\nDem Amtsgericht Hof -Registergericht- ist eine Liste der Mitglieder des Aufsichtsrats eingereicht worden, § 106 AktG."
    },
    {
      "date": "2025-01-17",
      "id": "98858",
      "original_text": "Registerbekanntmachung nach dem Umwandlungsgesetz\nBaden-Württemberg Amtsgericht Freiburg HRB 709481\nFinanzkanzlei am See GmbH – Überlingen",
      "type": "Registerbekanntmachung nach dem Umwandlungsgesetz",
      "state": "Baden-Württemberg",
      "amtsgericht": "Amtsgericht Freiburg",
      "registernummer": "HRB 709481",
      "registerart": "HRB",
      "company_name": "Finanzkanzlei am See GmbH",
      "company_seat": "Überlingen",
      "details": "17.01.2025 (Bekanntmachungsdatum)\n\nBaden-Württemberg Amtsgericht Freiburg HRB 709481\nRegisterbekanntmachung nach dem Umwandlungsgesetz 17.01.2025 (Eintragungsdatum)\n\nFinanzkanzlei am See GmbH\nGesellschaft mit beschränkter Haftung\nÜberlingen\n\nAls nicht eingetragen wird bekanntgemacht:\nDen Gläubigern der an der Ausgliederung beteiligten Rechtsträger ist, wenn sie binnen sechs Monaten nach dem Tag, an dem die Eintragung der Ausgliederung in das Register des Sitzes desjenigen Rechtsträgers, dessen Gläubiger sie sind, nach § 19 Abs. 3 UmwG als bekanntgemacht gilt, ihren Anspruch nach Grund und Höhe schriftlich anmelden, Sicherheit zu leisten, soweit sie nicht Befriedigung verlangen können. Dieses Recht steht den Gläubigern jedoch nur zu, wenn sie glaubhaft machen, dass durch die Ausgliederung die Erfüllung ihrer Forderung gefährdet wird."
    },
    {
      "date": "2025-01-17",
      "id": "98859",
      "original_text": "Registerbekanntmachung nach dem Umwandlungsgesetz\nBaden-Württemberg Amtsgericht Freiburg HRB 731385\nFinanzkanzlei am See Vermögen AG – Überlingen",
      "type": "Registerbekanntmachung nach dem Umwandlungsgesetz",
      "state": "Baden-Württemberg",
      "amtsgericht": "Amtsgericht Freiburg",
      "registernummer": "HRB 731385",
      "registerart": "HRB",
      "company_name": "Finanzkanzlei am See Vermögen AG",
      "company_seat": "Überlingen",
      "details": "17.01.2025 (Bekanntmachungsdatum)\n\nBaden-Württemberg Amtsgericht Freiburg HRB 731385\nRegisterbekanntmachung nach dem Umwandlungsgesetz 17.01.2025 (Eintragungsdatum)\n\nFinanzkanzlei am See Vermögen AG\nAktiengesellschaft\nÜberlingen\n\nAls nicht eingetragen wird bekanntgemacht:\nDen Gläubigern der an der Ausgliederung beteiligten Rechtsträger ist, wenn sie binnen sechs Monaten nach dem Tag, an dem die Eintragung der Ausgliederung in das Register des Sitzes desjenigen Rechtsträgers, dessen Gläubiger sie sind, nach § 19 Abs. 3 UmwG als bekanntgemacht gilt, ihren Anspruch nach Grund und Höhe schriftlich anmelden, Sicherheit zu leisten, soweit sie nicht Befriedigung verlangen können. Dieses Recht steht den Gläubigern jedoch nur zu, wenn sie glaubhaft machen, dass durch die Ausgliederung die Erfüllung ihrer Forderung gefährdet wird."
    },
    {
      "date": "2025-01-17",
      "id": "98860",
      "original_text": "Einreichung neuer Dokumente\nBrandenburg Amtsgericht Potsdam HRB 3064\nLBS Landesbausparkasse NordOst AG – Potsdam und Hamburg",
      "type": "Einreichung neuer Dokumente",
      "state": "Brandenburg",
      "amtsgericht": "Amtsgericht Potsdam",
      "registernummer": "HRB 3064",
      "registerart": "HRB",
      "company_name": "LBS Landesbausparkasse NordOst AG",
      "company_seat": "Potsdam und Hamburg",
      "details": "17.01.2025 (Bekanntmachungsdatum)\n\nBrandenburg Amtsgericht Potsdam HRB 3064\nEinreichung neuer Dokumente\n\nLBS Landesbausparkasse NordOst AG\nAktiengesellschaft\nPotsdam und Hamburg\n\nAls nicht eingetragen wird veröffentlicht: Eine Liste der Mitglieder des Aufsichtsrates wurde zum Handelsregister eingereicht."
    },
    {
      "date": "2025-01-17",
      "id": "98861",
      "original_text": "Löschungsankündigung\nBerlin Amtsgericht Berlin (Charlottenburg) HRB 160370\nsoundsUP Shop VOP UG (haftungsbeschränkt) – Berlin",
      "type": "Löschungsankündigung",
      "state": "Berlin",
      "amtsgericht": "Amtsgericht Berlin (Charlottenburg)",
      "registernummer": "HRB 160370",
      "registerart": "HRB",
      "company_name": "soundsUP Shop VOP UG (haftungsbeschränkt)",
      "company_seat": "Berlin",
      "details": "17.01.2025 (Bekanntmachungsdatum)\n\nBerlin Amtsgericht Berlin (Charlottenburg) HRB 160370\nLöschungsankündigung\n\nsoundsUP Shop VOP UG (haftungsbeschränkt)\nGesellschaft mit beschränkter Haftung\nBerlin\n\nBei der nachstehenden Gesellschaft wird das Amtslöschungsverfahren gemäß § 394 FamFG eingeleitet. Widerspruchsfrist 6 Wochen"
    },
    {
      "date": "2025-01-17",
      "id": "98862",
      "original_text": "Registerbekanntmachung nach dem Umwandlungsgesetz\nBaden-Württemberg Amtsgericht Mannheim HRB 726317\nHR Path GmbH – Mannheim",
      "type": "Registerbekanntmachung nach dem Umwandlungsgesetz",
      "state": "Baden-Württemberg",
      "amtsgericht": "Amtsgericht Mannheim",
      "registernummer": "HRB 726317",
      "registerart": "HRB",
      "company_name": "HR Path GmbH",
      "company_seat": "Mannheim",
      "details": "17.01.2025 (Bekanntmachungsdatum)\n\nBaden-Württemberg Amtsgericht Mannheim HRB 726317\nRegisterbekanntmachung nach dem Umwandlungsgesetz 17.01.2025 (Eintragungsdatum)\n\nHR Path GmbH\nGesellschaft mit beschränkter Haftung\nMannheim\n\nDen Gläubigern der an der Verschmelzung beteiligten Rechtsträger ist, wenn sie binnen sechs Monaten nach dem Tag, an dem die Eintragung der Verschmelzung in das Register des Sitzes desjenigen Rechtsträgers, dessen Gläubiger sie sind, nach § 19 Abs. 3 UmwG als bekanntgemacht gilt, ihren Anspruch nach Grund und Höhe schriftlich anmelden, Sicherheit zu leisten, soweit sie nicht Befriedigung verlangen können. Dieses Recht steht den Gläubigern jedoch nur zu, wenn sie glaubhaft machen, dass durch die Verschmelzung die Erfüllung ihrer Forderung gefährdet wird."
    },
    {
      "date": "2025-01-17",
      "id": "98863",
      "original_text": "Einreichung neuer Dokumente\nBerlin Amtsgericht Berlin (Charlottenburg) HRB 166467\nGrover Group GmbH – Berlin",
      "type": "Einreichung neuer Dokumente",
      "state": "Berlin",
      "amtsgericht": "Amtsgericht Berlin (Charlottenburg)",
      "registernummer": "HRB 166467",
      "registerart": "HRB",
      "company_name": "Grover Group GmbH",
      "company_seat": "Berlin",
      "details": "17.01.2025 (Bekanntmachungsdatum)\n\nBerlin Amtsgericht Berlin (Charlottenburg) HRB 166467\nEinreichung neuer Dokumente\n\nGrover Group GmbH\nGesellschaft mit beschränkter Haftung\nBerlin\n\nAls nicht eingetragen wird veröffentlicht: Es wurde eine neue Liste der Beiratsmitglieder eingereicht (§ 52 III GmbHG)."
    },
    {
      "date": "2025-01-17",
      "id": "98864",
      "original_text": "Löschungsankündigung\nBerlin Amtsgericht Berlin (Charlottenburg) HRB 250294\nGreen Wood Service GmbH – Berlin",
      "type": "Löschungsankündigung",
      "state": "Berlin",
      "amtsgericht": "Amtsgericht Berlin (Charlottenburg)",
      "registernummer": "HRB 250294",
      "registerart": "HRB",
      "company_name": "Green Wood Service GmbH",
      "company_seat": "Berlin",
      "details": "17.01.2025 (Bekanntmachungsdatum)\n\nBerlin Amtsgericht Berlin (Charlottenburg) HRB 250294\nLöschungsankündigung\n\nGreen Wood Service GmbH\nGesellschaft mit beschränkter Haftung\nBerlin\n\nBei der nachstehenden Gesellschaft wird das Amtslöschungsverfahren gemäß § 394 FamFG eingeleitet. Widerspruchsfrist 6 Wochen"
    },
    {
      "date": "2025-01-17",
      "id": "98865",
      "original_text": "Einreichung neuer Dokumente\nBrandenburg Amtsgericht Cottbus HRB 2774\nSana Kliniken Niederlausitz gGmbH – Senftenberg",
      "type": "Einreichung neuer Dokumente",
      "state": "Brandenburg",
      "amtsgericht": "Amtsgericht Cottbus",
      "registernummer": "HRB 2774",
      "registerart": "HRB",
      "company_name": "Sana Kliniken Niederlausitz gGmbH",
      "company_seat": "Senftenberg",
      "details": "17.01.2025 (Bekanntmachungsdatum)\n\nBrandenburg Amtsgericht Cottbus HRB 2774\nEinreichung neuer Dokumente\n\nSana Kliniken Niederlausitz gGmbH\nGesellschaft mit beschränkter Haftung\nSenftenberg\n\nAls nicht eingetragen wird veröffentlicht:\nDer Geschäftsführer hat eine Liste der Aufsichtsratsmitglieder gem. § 52 Abs. 3 Satz 2 GmbHG zum Handelsregister eingereicht."
    },
    {
      "date": "2025-01-17",
      "id": "98866",
      "original_text": "Einreichung neuer Dokumente\nSachsen-Anhalt Amtsgericht Stendal HRB 100252\nNOSA GmbH Holding der Stadt Halberstadt – Halberstadt",
      "type": "Einreichung neuer Dokumente",
      "state": "Sachsen-Anhalt",
      "amtsgericht": "Amtsgericht Stendal",
      "registernummer": "HRB 100252",
      "registerart": "HRB",
      "company_name": "NOSA GmbH Holding der Stadt Halberstadt",
      "company_seat": "Halberstadt",
      "details": "17.01.2025 (Bekanntmachungsdatum)\n\nSachsen-Anhalt Amtsgericht Stendal HRB 100252\nEinreichung neuer Dokumente 17.01.2025 (Eintragungsdatum)\n\nNOSA GmbH Holding der Stadt Halberstadt\nGesellschaft mit beschränkter Haftung\nHalberstadt\n\nEine Liste der Mitglieder des Aufsichtsrates wurde zum Handelsregister eingereicht."
    },
    {
      "date": "2025-01-17",
      "id": "98867",
      "original_text": "Registerbekanntmachung nach dem Umwandlungsgesetz\nBaden-Württemberg Amtsgericht Freiburg VR 280371\nMinikindergarten Waldkirch e.V. – Waldkirch",
      "type": "Registerbekanntmachung nach dem Umwandlungsgesetz",
      "state": "Baden-Württemberg",
      "amtsgericht": "Amtsgericht Freiburg",
      "registernummer": "VR 280371",
      "registerart": "VR",
      "company_name": "Minikindergarten Waldkirch e.V.",
      "company_seat": "Waldkirch",
      "details": "17.01.2025 (Bekanntmachungsdatum)\n\nBaden-Württemberg Amtsgericht Freiburg VR 280371\nRegisterbekanntmachung nach dem Umwandlungsgesetz 17.01.2025 (Eintragungsdatum)\n\nMinikindergarten Waldkirch e.V.\neingetragener Verein\nWaldkirch\n\nAls nicht eingetragen wird bekanntgemacht:\nDen Gläubigern der an der Verschmelzung beteiligten Rechtsträger ist, wenn sie binnen sechs Monaten nach dem Tag, an dem die Eintragung der Verschmelzung in das Register des Sitzes desjenigen Rechtsträgers, dessen Gläubiger sie sind, nach § 19 Abs. 3 UmwG als bekanntgemacht gilt, ihren Anspruch nach Grund und Höhe schriftlich anmelden, Sicherheit zu leisten, soweit sie nicht Befriedigung verlangen können. Dieses Recht steht den Gläubigern jedoch nur zu, wenn sie glaubhaft machen, dass durch die Verschmelzung die Erfüllung ihrer Forderung gefährdet wird."
    },
    {
      "date": "2025-01-17",
      "id": "98868",
      "original_text": "Registerbekanntmachung nach dem Umwandlungsgesetz\nBaden-Württemberg Amtsgericht Freiburg HRB 707616\nMehr Raum für Kinder, gemeinnützige GmbH – Waldkirch",
      "type": "Registerbekanntmachung nach dem Umwandlungsgesetz",
      "state": "Baden-Württemberg",
      "amtsgericht": "Amtsgericht Freiburg",
      "registernummer": "HRB 707616",
      "registerart": "HRB",
      "company_name": "Mehr Raum für Kinder, gemeinnützige GmbH",
      "company_seat": "Waldkirch",
      "details": "17.01.2025 (Bekanntmachungsdatum)\n\nBaden-Württemberg Amtsgericht Freiburg HRB 707616\nRegisterbekanntmachung nach dem Umwandlungsgesetz 17.01.2025 (Eintragungsdatum)\n\nMehr Raum für Kinder, gemeinnützige GmbH\nGesellschaft mit beschränkter Haftung\nWaldkirch\n\nAls nicht eingetragen wird bekanntgemacht:\nDen Gläubigern der an der Verschmelzung beteiligten Rechtsträger ist, wenn sie binnen sechs Monaten nach dem Tag, an dem die Eintragung der Verschmelzung in das Register des Sitzes desjenigen Rechtsträgers, dessen Gläubiger sie sind, nach § 19 Abs. 3 UmwG als bekanntgemacht gilt, ihren Anspruch nach Grund und Höhe schriftlich anmelden, Sicherheit zu leisten, soweit sie nicht Befriedigung verlangen können. Dieses Recht steht den Gläubigern jedoch nur zu, wenn sie glaubhaft machen, dass durch die Verschmelzung die Erfüllung ihrer Forderung gefährdet wird."
    },
    {
      "date": "2025-01-17",
      "id": "98869",
      "original_text": "Löschungsankündigung\nBerlin Amtsgericht Berlin (Charlottenburg) HRB 174228\nIntrend Immo GmbH – Berlin",
      "type": "Löschungsankündigung",
      "state": "Berlin",
      "amtsgericht": "Amtsgericht Berlin (Charlottenburg)",
      "registernummer": "HRB 174228",
      "registerart": "HRB",
      "company_name": "Intrend Immo GmbH",
      "company_seat": "Berlin",
      "details": "17.01.2025 (Bekanntmachungsdatum)\n\nBerlin Amtsgericht Berlin (Charlottenburg) HRB 174228\nLöschungsankündigung\n\nIntrend Immo GmbH\nGesellschaft mit beschränkter Haftung\nBerlin\n\nBei der nachstehenden Gesellschaft wird das Amtslöschungsverfahren gemäß § 394 FamFG eingeleitet. Widerspruchsfrist 6 Wochen"
    },
    {
      "date": "2025-01-17",
      "id": "98870",
      "original_text": "Sonstige Registerbekanntmachung\nHamburg Amtsgericht Hamburg HRB 98935\ncadooz rewards GmbH – Hamburg",
      "type": "Sonstige Registerbekanntmachung",
      "state": "Hamburg",
      "amtsgericht": "Amtsgericht Hamburg",
      "registernummer": "HRB 98935",
      "registerart": "HRB",
      "company_name": "cadooz rewards GmbH",
      "company_seat": "Hamburg",
      "details": "17.01.2025 (Bekanntmachungsdatum)\n\nHamburg Amtsgericht Hamburg HRB 98935\nSonstige Registerbekanntmachung 15.01.2025 (Eintragungsdatum)\n\ncadooz rewards GmbH\nGesellschaft mit beschränkter Haftung\nHamburg\n\nAls nicht eingetragen wird bekannt gemacht:  Den Gläubigern der Gesellschaft, deren Forderungen begründet worden sind, bevor die Eintragung der Vertragsbeendigung in das Handelsregister nach § 10 HGB als bekannt gemacht gilt, ist vom anderen Vertragsteil Sicherheit zu leisten, wenn sie sich binnen 6 Monaten nach Bekanntmachung der Eintragung zu diesem Zweck bei ihm melden."
    },
    {
      "date": "2025-01-17",
      "id": "98871",
      "original_text": "Einreichung neuer Dokumente\nSachsen-Anhalt Amtsgericht Stendal HRB 103749\nHalberstädter Wohnungsgesellschaft mit beschränkter Haftung – Halberstadt",
      "type": "Einreichung neuer Dokumente",
      "state": "Sachsen-Anhalt",
      "amtsgericht": "Amtsgericht Stendal",
      "registernummer": "HRB 103749",
      "registerart": "HRB",
      "company_name": "Halberstädter Wohnungsgesellschaft mit beschränkter Haftung",
      "company_seat": "Halberstadt",
      "details": "17.01.2025 (Bekanntmachungsdatum)\n\nSachsen-Anhalt Amtsgericht Stendal HRB 103749\nEinreichung neuer Dokumente 17.01.2025 (Eintragungsdatum)\n\nHalberstädter Wohnungsgesellschaft mit beschränkter Haftung\nGesellschaft mit beschränkter Haftung\nHalberstadt\n\nEine Liste der Mitglieder des Aufsichtsrates wurde zum Handelsregister eingereicht."
    },
    {
      "date": "2025-01-17",
      "id": "98872",
      "original_text": "Einreichung neuer Dokumente\nBaden-Württemberg Amtsgericht Freiburg HRB 381984\nBGK - Bädergesellschaft Konstanz mbH – Konstanz",
      "type": "Einreichung neuer Dokumente",
      "state": "Baden-Württemberg",
      "amtsgericht": "Amtsgericht Freiburg",
      "registernummer": "HRB 381984",
      "registerart": "HRB",
      "company_name": "BGK - Bädergesellschaft Konstanz mbH",
      "company_seat": "Konstanz",
      "details": "17.01.2025 (Bekanntmachungsdatum)\n\nBaden-Württemberg Amtsgericht Freiburg HRB 381984\nEinreichung neuer Dokumente\n\nBGK - Bädergesellschaft Konstanz mbH\nGesellschaft mit beschränkter Haftung\nKonstanz\n\nDie Gesellschaft hat am 16.01.2025 die Liste über die Zusammensetzung des Aufsichtsrats zum Handelsregister eingereicht."
    },
    {
      "date": "2025-01-17",
      "id": "98873",
      "original_text": "Registerbekanntmachung nach dem Umwandlungsgesetz\nSaarland Amtsgericht Saarbrücken HRB 18319\nOVENO Gesellschaft für Informations- und Kommunikationsdienstleistungen mbH – St. Wendel",
      "type": "Registerbekanntmachung nach dem Umwandlungsgesetz",
      "state": "Saarland",
      "amtsgericht": "Amtsgericht Saarbrücken",
      "registernummer": "HRB 18319",
      "registerart": "HRB",
      "company_name": "OVENO Gesellschaft für Informations- und Kommunikationsdienstleistungen mbH",
      "company_seat": "St. Wendel",
      "details": "17.01.2025 (Bekanntmachungsdatum)\n\nSaarland Amtsgericht Saarbrücken HRB 18319\nRegisterbekanntmachung nach dem Umwandlungsgesetz\n\nOVENO Gesellschaft für Informations- und Kommunikationsdienstleistungen mbH\nGesellschaft mit beschränkter Haftung\nSt. Wendel\n\nEs ist beabsichtigt, die Gesellschaft von Amts wegen gemäß § 394 FamFG wegen Vermögenslosigkeit zu löschen.\nGegen die Löschung von Amts wegen ist das Rechtsmittel des Widerspruchs statthaft. Der Widerspruch ist binnen einer Frist zwei Monaten beginnend mit dem Tag dieser Veröffentlichung durch Einreichen eines Widerspruchsschreibens -schriftlich oder zur Niederschrift der Geschäftsstelle beim Amtsgericht Saarbrücken, -zentrales Handelsregister-, Mainzer Str.178, 66121 Saarbrücken einzulegen.\nDer Widerspruch muss die Bezeichnung der angefochtenen Löschungsankündigung enthalten sowie die Erklärung, dass Widerspruch eingelegt wird. Er ist vom Widerspruchsführer oder seinem Bevollmächtigten zu unterzeichnen.\nDas Widerspruchsschreiben kann auch in der Form eines elektronischen Dokumentes eingereicht werden, das mit einer qualifizierten elektronischen Signatur nach dem Signaturgesetz versehen sein muss (§§ 14 Abs. 2 FamFG, 130a, 298 ZPO)."
    },
    {
      "date": "2025-01-17",
      "id": "98874",
      "original_text": "Einreichung neuer Dokumente\nMecklenburg-Vorpommern Amtsgericht Stralsund HRB 90 früher Amtsgericht Rostock\nEWN Entsorgungswerk für Nuklearanlagen GmbH – Rubenow",
      "type": "Einreichung neuer Dokumente",
      "state": "Mecklenburg-Vorpommern",
      "amtsgericht": "Amtsgericht Stralsund",
      "registernummer": "HRB 90",
      "registerart": "HRB",
      "company_name": "EWN Entsorgungswerk für Nuklearanlagen GmbH",
      "company_seat": "Rubenow",
      "former_amtsgericht": "Rostock",
      "details": "17.01.2025 (Bekanntmachungsdatum)\n\nMecklenburg-Vorpommern Amtsgericht Stralsund HRB 90 früher Amtsgericht Rostock\nEinreichung neuer Dokumente\n\nEWN Entsorgungswerk für Nuklearanlagen GmbH\nGesellschaft mit beschränkter Haftung\nRubenow\n\nEine Liste der Mitglieder des Aufsichtsrats ist zum Handelsregister eingereicht worden."
    },
    {
      "date": "2025-01-17",
      "id": "98875",
      "original_text": "Registerbekanntmachung nach dem Umwandlungsgesetz\nHamburg Amtsgericht Hamburg HRB 43935\nplusswerk GmbH – Hamburg",
      "type": "Registerbekanntmachung nach dem Umwandlungsgesetz",
      "state": "Hamburg",
      "amtsgericht": "Amtsgericht Hamburg",
      "registernummer": "HRB 43935",
      "registerart": "HRB",
      "company_name": "plusswerk GmbH",
      "company_seat": "Hamburg",
      "details": "17.01.2025 (Bekanntmachungsdatum)\n\nHamburg Amtsgericht Hamburg HRB 43935\nRegisterbekanntmachung nach dem Umwandlungsgesetz 17.01.2025 (Eintragungsdatum)\n\nplusswerk GmbH\nGesellschaft mit beschränkter Haftung\nHamburg\n\nAls nicht eingetragen wird bekannt gemacht:\nDen Gläubigern der an der Aufspaltung beteiligten Gesellschaften ist, wenn sie binnen sechs Monaten nach dem Tag, an dem die Eintragung der Aufspaltung in das Register des Sitzes desjenigen Rechtsträgers, dessen Gläubiger sie sind, nach § 19 Absatz 3 UmwG als bekannt gemacht gilt, ihren Anspruch nach Grund und Höhe schriftlich anmelden, Sicherheit zu leisten, soweit sie nicht Befriedigung verlangen können. Dieses Recht steht den Gläubigern jedoch nur zu, wenn sie glaubhaft machen, dass durch die Aufspaltung die Erfüllung ihrer Forderung gefährdet wird."
    },
    {
      "date": "2025-01-17",
      "id": "98876",
      "original_text": "Registerbekanntmachung nach dem Umwandlungsgesetz\nHamburg Amtsgericht Hamburg HRB 32257\npluss Personalmanagement GmbH – Hamburg",
      "type": "Registerbekanntmachung nach dem Umwandlungsgesetz",
      "state": "Hamburg",
      "amtsgericht": "Amtsgericht Hamburg",
      "registernummer": "HRB 32257",
      "registerart": "HRB",
      "company_name": "pluss Personalmanagement GmbH",
      "company_seat": "Hamburg",
      "details": "17.01.2025 (Bekanntmachungsdatum)\n\nHamburg Amtsgericht Hamburg HRB 32257\nRegisterbekanntmachung nach dem Umwandlungsgesetz 17.01.2025 (Eintragungsdatum)\n\npluss Personalmanagement GmbH\nGesellschaft mit beschränkter Haftung\nHamburg\n\nAls nicht eingetragen wird bekannt gemacht:\nDen Gläubigern der an der Aufspaltung beteiligten Gesellschaften ist, wenn sie binnen sechs Monaten nach dem Tag, an dem die Eintragung der Aufspaltung in das Register des Sitzes desjenigen Rechtsträgers, dessen Gläubiger sie sind, nach § 19 Absatz 3 UmwG als bekannt gemacht gilt, ihren Anspruch nach Grund und Höhe schriftlich anmelden, Sicherheit zu leisten, soweit sie nicht Befriedigung verlangen können. Dieses Recht steht den Gläubigern jedoch nur zu, wenn sie glaubhaft machen, dass durch die Aufspaltung die Erfüllung ihrer Forderung gefährdet wird."
    },
    {
      "date": "2025-01-17",
      "id": "98877",
      "original_text": "Sonstige Registerbekanntmachung\nHamburg Amtsgericht Hamburg HRB 41037\nChristian Olearius Beteiligungsgesellschaft mbH – Hamburg",
      "type": "Sonstige Registerbekanntmachung",
      "state": "Hamburg",
      "amtsgericht": "Amtsgericht Hamburg",
      "registernummer": "HRB 41037",
      "registerart": "HRB",
      "company_name": "Christian Olearius Beteiligungsgesellschaft mbH",
      "company_seat": "Hamburg",
      "details": "17.01.2025 (Bekanntmachungsdatum)\n\nHamburg Amtsgericht Hamburg HRB 41037\nSonstige Registerbekanntmachung 17.01.2025 (Eintragungsdatum)\n\nChristian Olearius Beteiligungsgesellschaft mbH\nGesellschaft mit beschränkter Haftung\nHamburg\n\nAls nicht eingetragen wird bekannt gemacht:  Den Gläubigern der Gesellschaft, deren Forderungen begründet worden sind, bevor die Eintragung der Vertragsbeendigung in das Handelsregister nach § 10 HGB als bekannt gemacht gilt, ist vom anderen Vertragsteil Sicherheit zu leisten, wenn sie sich binnen 6 Monaten nach Bekanntmachung der Eintragung zu diesem Zweck bei ihm melden."
    },
    {
      "date": "2025-01-17",
      "id": "98878",
      "original_text": "Einreichung neuer Dokumente\nHamburg Amtsgericht Hamburg HRB 19251\nF. LAEISZ Versicherung Aktiengesellschaft – Hamburg",
      "type": "Einreichung neuer Dokumente",
      "state": "Hamburg",
      "amtsgericht": "Amtsgericht Hamburg",
      "registernummer": "HRB 19251",
      "registerart": "HRB",
      "company_name": "F. LAEISZ Versicherung Aktiengesellschaft",
      "company_seat": "Hamburg",
      "details": "17.01.2025 (Bekanntmachungsdatum)\n\nHamburg Amtsgericht Hamburg HRB 19251\nEinreichung neuer Dokumente 17.01.2025 (Eintragungsdatum)\n\nF. LAEISZ Versicherung Aktiengesellschaft\nAktiengesellschaft\nHamburg\n\nAls nicht eingetragen wird bekannt gemacht: Liste des Aufsichtsrats wurde eingereicht."
    },
    {
      "date": "2025-01-17",
      "id": "98879",
      "original_text": "Registerbekanntmachung nach dem Umwandlungsgesetz\nHamburg Amtsgericht Hamburg HRB 43935\nplusswerk GmbH – Hamburg",
      "type": "Registerbekanntmachung nach dem Umwandlungsgesetz",
      "state": "Hamburg",
      "amtsgericht": "Amtsgericht Hamburg",
      "registernummer": "HRB 43935",
      "registerart": "HRB",
      "company_name": "plusswerk GmbH",
      "company_seat": "Hamburg",
      "details": "17.01.2025 (Bekanntmachungsdatum)\n\nHamburg Amtsgericht Hamburg HRB 43935\nRegisterbekanntmachung nach dem Umwandlungsgesetz 17.01.2025 (Eintragungsdatum)\n\nplusswerk GmbH\nGesellschaft mit beschränkter Haftung\nHamburg\n\nAls nicht eingetragen wird bekannt gemacht:\nDen Gläubigern der an der Aufspaltung beteiligten Gesellschaften ist, wenn sie binnen sechs Monaten nach dem Tag, an dem die Eintragung der Aufspaltung in das Register des Sitzes desjenigen Rechtsträgers, dessen Gläubiger sie sind, nach § 19 Absatz 3 UmwG als bekannt gemacht gilt, ihren Anspruch nach Grund und Höhe schriftlich anmelden, Sicherheit zu leisten, soweit sie nicht Befriedigung verlangen können. Dieses Recht steht den Gläubigern jedoch nur zu, wenn sie glaubhaft machen, dass durch die Aufspaltung die Erfüllung ihrer Forderung gefährdet wird."
    },
    {
      "date": "2025-01-17",
      "id": "98880",
      "original_text": "Registerbekanntmachung nach dem Umwandlungsgesetz\nHamburg Amtsgericht Hamburg HRB 32257\npluss Personalmanagement GmbH – Hamburg",
      "type": "Registerbekanntmachung nach dem Umwandlungsgesetz",
      "state": "Hamburg",
      "amtsgericht": "Amtsgericht Hamburg",
      "registernummer": "HRB 32257",
      "registerart": "HRB",
      "company_name": "pluss Personalmanagement GmbH",
      "company_seat": "Hamburg",
      "details": "17.01.2025 (Bekanntmachungsdatum)\n\nHamburg Amtsgericht Hamburg HRB 32257\nRegisterbekanntmachung nach dem Umwandlungsgesetz 17.01.2025 (Eintragungsdatum)\n\npluss Personalmanagement GmbH\nGesellschaft mit beschränkter Haftung\nHamburg\n\nAls nicht eingetragen wird bekannt gemacht:\nDen Gläubigern der an der Aufspaltung beteiligten Gesellschaften ist, wenn sie binnen sechs Monaten nach dem Tag, an dem die Eintragung der Aufspaltung in das Register des Sitzes desjenigen Rechtsträgers, dessen Gläubiger sie sind, nach § 19 Absatz 3 UmwG als bekannt gemacht gilt, ihren Anspruch nach Grund und Höhe schriftlich anmelden, Sicherheit zu leisten, soweit sie nicht Befriedigung verlangen können. Dieses Recht steht den Gläubigern jedoch nur zu, wenn sie glaubhaft machen, dass durch die Aufspaltung die Erfüllung ihrer Forderung gefährdet wird."
    },
    {
      "date": "2025-01-17",
      "id": "98881",
      "original_text": "Registerbekanntmachung nach dem Umwandlungsgesetz\nSachsen-Anhalt Amtsgericht Stendal HRB 35264\nP.I.M. GmbH – Magdeburg",
      "type": "Registerbekanntmachung nach dem Umwandlungsgesetz",
      "state": "Sachsen-Anhalt",
      "amtsgericht": "Amtsgericht Stendal",
      "registernummer": "HRB 35264",
      "registerart": "HRB",
      "company_name": "P.I.M. GmbH",
      "company_seat": "Magdeburg",
      "details": "17.01.2025 (Bekanntmachungsdatum)\n\nSachsen-Anhalt Amtsgericht Stendal HRB 35264\nRegisterbekanntmachung nach dem Umwandlungsgesetz 17.01.2025 (Eintragungsdatum)\n\nP.I.M. GmbH\nGesellschaft mit beschränkter Haftung\nMagdeburg\n\nDie Gesellschaft hat im Wege der Abspaltung gemäß Spaltungsplan vom 28.11.2024 sowie Beschluss ihrer Gesellschafterversammlung vom 28.11.2024 und Beschluss der  Gesellschafterversammlung der übertragenden Gesellschaft vom 28.11.2024 Teile des Vermögens (Betriebsteil Maybachstraße Magdeburg) von der Demontage, Bauausführung und Immoblilienservice GmbH mit dem Sitz in Magdeburg (Amtsgericht Stendal HRB 106888) übernommen. Die Abspaltung wurde am 17.01.2025 im Register des übertragenden Rechtsträgers eingetragen. Nicht eingetragen: Den Gläubigern der an der Spaltung beteiligten Rechtsträger, ist wenn sie binnen sechs Monaten nach dem Tag, an dem die Eintragung der Spaltung nach §§ 125, 19 Abs. 3 UmwG als bekanntgemacht gilt, ihren Anspruch nach Grund und Höhe schriftlich anmelden, Sicherheit zu leisten, soweit sie nicht Befriedigung verlangen können. Dieses Recht steht ihnen jedoch nur zu, wenn sie glaubhaft machen, daß durch die Spaltung die Erfüllung ihrer Forderung gefährdet wird."
    },
    {
      "date": "2025-01-17",
      "id": "98882",
      "original_text": "Registerbekanntmachung nach dem Umwandlungsgesetz\nSachsen-Anhalt Amtsgericht Stendal HRB 106888\nDemontage, Bauausführung und Immobilienservice GmbH – Magdeburg",
      "type": "Registerbekanntmachung nach dem Umwandlungsgesetz",
      "state": "Sachsen-Anhalt",
      "amtsgericht": "Amtsgericht Stendal",
      "registernummer": "HRB 106888",
      "registerart": "HRB",
      "company_name": "Demontage, Bauausführung und Immobilienservice GmbH",
      "company_seat": "Magdeburg",
      "details": "17.01.2025 (Bekanntmachungsdatum)\n\nSachsen-Anhalt Amtsgericht Stendal HRB 106888\nRegisterbekanntmachung nach dem Umwandlungsgesetz 17.01.2025 (Eintragungsdatum)\n\nDemontage, Bauausführung und Immobilienservice GmbH\nGesellschaft mit beschränkter Haftung\nMagdeburg\n\nDie Gesellschaft hat im Wege der Abspaltung gemäß Spaltungsplan vom 28.11.2024 sowie Beschluss ihrer Gesellschafterversammlung vom 28.11.2024 und Beschluss der Gesellschafterversammlung der übernehmenden Gesellschaft vom 28.12.2024 Teile des Vermögens (Betriebsteil Maybachstraße Magdeburg) auf die P.I.M. GmbH mit dem Sitz in Magdeburg (Amtsgericht Stendal HRB 35264) übertragen. Nicht eingetragen:\nDen Gläubigern der an der Spaltung beteiligten Rechtsträger, ist wenn sie binnen sechs Monaten nach dem Tag, an dem die Eintragung der Spaltung nach §§ 125, 19 Abs. 3 UmwG als bekanntgemacht gilt, ihren Anspruch nach Grund und Höhe schriftlich anmelden, Sicherheit zu leisten, soweit sie nicht Befriedigung verlangen können. Dieses Recht steht ihnen jedoch nur zu, wenn sie glaubhaft machen, daß durch die Spaltung die Erfüllung ihrer Forderung gefährdet wird."
    },
    {
      "date": "2025-01-17",
      "id": "98883",
      "original_text": "Registerbekanntmachung nach dem Umwandlungsgesetz\nHamburg Amtsgericht Hamburg HRB 32257\npluss Personalmanagement GmbH – Hamburg",
      "type": "Registerbekanntmachung nach dem Umwandlungsgesetz",
      "state": "Hamburg",
      "amtsgericht": "Amtsgericht Hamburg",
      "registernummer": "HRB 32257",
      "registerart": "HRB",
      "company_name": "pluss Personalmanagement GmbH",
      "company_seat": "Hamburg",
      "details": "17.01.2025 (Bekanntmachungsdatum)\n\nHamburg Amtsgericht Hamburg HRB 32257\nRegisterbekanntmachung nach dem Umwandlungsgesetz 17.01.2025 (Eintragungsdatum)\n\npluss Personalmanagement GmbH\nGesellschaft mit beschränkter Haftung\nHamburg\n\nAls nicht eingetragen wird bekannt gemacht:\nDen Gläubigern der an der Aufspaltung beteiligten Gesellschaften ist, wenn sie binnen sechs Monaten nach dem Tag, an dem die Eintragung der Aufspaltung in das Register des Sitzes desjenigen Rechtsträgers, dessen Gläubiger sie sind, nach § 19 Absatz 3 UmwG als bekannt gemacht gilt, ihren Anspruch nach Grund und Höhe schriftlich anmelden, Sicherheit zu leisten, soweit sie nicht Befriedigung verlangen können. Dieses Recht steht den Gläubigern jedoch nur zu, wenn sie glaubhaft machen, dass durch die Aufspaltung die Erfüllung ihrer Forderung gefährdet wird."
    },
    {
      "date": "2025-01-17",
      "id": "98884",
      "original_text": "Registerbekanntmachung nach dem Umwandlungsgesetz\nHamburg Amtsgericht Hamburg HRB 43935\nplusswerk GmbH – Hamburg",
      "type": "Registerbekanntmachung nach dem Umwandlungsgesetz",
      "state": "Hamburg",
      "amtsgericht": "Amtsgericht Hamburg",
      "registernummer": "HRB 43935",
      "registerart": "HRB",
      "company_name": "plusswerk GmbH",
      "company_seat": "Hamburg",
      "details": "17.01.2025 (Bekanntmachungsdatum)\n\nHamburg Amtsgericht Hamburg HRB 43935\nRegisterbekanntmachung nach dem Umwandlungsgesetz 17.01.2025 (Eintragungsdatum)\n\nplusswerk GmbH\nGesellschaft mit beschränkter Haftung\nHamburg\n\nAls nicht eingetragen wird bekannt gemacht:\nDen Gläubigern der an der Aufspaltung beteiligten Gesellschaften ist, wenn sie binnen sechs Monaten nach dem Tag, an dem die Eintragung der Aufspaltung in das Register des Sitzes desjenigen Rechtsträgers, dessen Gläubiger sie sind, nach § 19 Absatz 3 UmwG als bekannt gemacht gilt, ihren Anspruch nach Grund und Höhe schriftlich anmelden, Sicherheit zu leisten, soweit sie nicht Befriedigung verlangen können. Dieses Recht steht den Gläubigern jedoch nur zu, wenn sie glaubhaft machen, dass durch die Aufspaltung die Erfüllung ihrer Forderung gefährdet wird."
    },
    {
      "date": "2025-01-17",
      "id": "98885",
      "original_text": "Sonstige Registerbekanntmachung\nBerlin Amtsgericht Berlin (Charlottenburg) HRB 146735\nFresenius Health Services Deutschland GmbH – Berlin",
      "type": "Sonstige Registerbekanntmachung",
      "state": "Berlin",
      "amtsgericht": "Amtsgericht Berlin (Charlottenburg)",
      "registernummer": "HRB 146735",
      "registerart": "HRB",
      "company_name": "Fresenius Health Services Deutschland GmbH",
      "company_seat": "Berlin",
      "details": "17.01.2025 (Bekanntmachungsdatum)\n\nBerlin Amtsgericht Berlin (Charlottenburg) HRB 146735\nSonstige Registerbekanntmachung\n\nFresenius Health Services Deutschland GmbH\nGesellschaft mit beschränkter Haftung\nBerlin\n\nAls nicht eingetragen wird veröffentlicht: Der andere Vertragsteil hat den Gläubigern dieses Rechtsträgers, deren Forderungen begründet worden sind, bevor die Eintragung der Beendigung dieses Vertrages in das Handelsregister nach § 10 des Handelsgesetzbuches als bekannt gemacht gilt, Sicherheit zu leisten, wenn sie sich binnen sechs Monaten nach der Bekanntmachung der Eintragung zu diesem Zweck bei ihm melden. Dieses Recht steht den Gläubigern nicht zu, die im Fall des Insolvenzverfahrens ein Recht auf vorzugsweise Befriedigung aus der Deckungsmasse haben, die nach gesetzlicher Vorschrift zu ihrem Schutz errichtet und staatlich überwacht ist."
    },
    {
      "date": "2025-01-17",
      "id": "98886",
      "original_text": "Löschungsankündigung\nBerlin Amtsgericht Berlin (Charlottenburg) HRB 136770\nSolarpark am Bergheider See GmbH – Berlin",
      "type": "Löschungsankündigung",
      "state": "Berlin",
      "amtsgericht": "Amtsgericht Berlin (Charlottenburg)",
      "registernummer": "HRB 136770",
      "registerart": "HRB",
      "company_name": "Solarpark am Bergheider See GmbH",
      "company_seat": "Berlin",
      "details": "17.01.2025 (Bekanntmachungsdatum)\n\nBerlin Amtsgericht Berlin (Charlottenburg) HRB 136770\nLöschungsankündigung\n\nSolarpark am Bergheider See GmbH\nGesellschaft mit beschränkter Haftung\nBerlin\n\nBei der nachstehenden Gesellschaft wird das Amtslöschungsverfahren gemäß § 394 FamFG eingeleitet. Widerspruchsfrist 6 Wochen"
    },
    {
      "date": "2025-01-17",
      "id": "98887",
      "original_text": "Löschungsankündigung\nThüringen Amtsgericht Jena HRB 206787\nHaemoSys GmbH – Jena",
      "type": "Löschungsankündigung",
      "state": "Thüringen",
      "amtsgericht": "Amtsgericht Jena",
      "registernummer": "HRB 206787",
      "registerart": "HRB",
      "company_name": "HaemoSys GmbH",
      "company_seat": "Jena",
      "details": "17.01.2025 (Bekanntmachungsdatum)\n\nThüringen Amtsgericht Jena HRB 206787\nLöschungsankündigung\n\nHaemoSys GmbH\nGesellschaft mit beschränkter Haftung\nJena\n\nDas Registergericht beabsichtigt, die im Handelsregister eingetragene Gesellschaft wegen Vermögenslosigkeit nach § 394 FamFG von Amts wegen zu löschen. Die Frist zur Erhebung eines Widerspruchs gegen die beabsichtigte Löschung wird auf 6 Wochen festgesetzt."
    },
    {
      "date": "2025-01-17",
      "id": "98888",
      "original_text": "Löschungsankündigung\nThüringen Amtsgericht Jena HRB 512057\nROBOTEC Signal Server Systems UG (haftungsbeschränkt) – Suhl",
      "type": "Löschungsankündigung",
      "state": "Thüringen",
      "amtsgericht": "Amtsgericht Jena",
      "registernummer": "HRB 512057",
      "registerart": "HRB",
      "company_name": "ROBOTEC Signal Server Systems UG (haftungsbeschränkt)",
      "company_seat": "Suhl",
      "details": "17.01.2025 (Bekanntmachungsdatum)\n\nThüringen Amtsgericht Jena HRB 512057\nLöschungsankündigung\n\nROBOTEC Signal Server Systems UG (haftungsbeschränkt)\nGesellschaft mit beschränkter Haftung\nSuhl\n\nDas Registergericht beabsichtigt, die im Handelsregister eingetragene Gesellschaft wegen Vermögenslosigkeit nach § 394 FamFG von Amts wegen zu löschen. Die Frist zur Erhebung eines Widerspruchs gegen die beabsichtigte Löschung wird auf 6 Wochen festgesetzt."
    },
    {
      "date": "2025-01-17",
      "id": "98889",
      "original_text": "Löschungsankündigung\nBaden-Württemberg Amtsgericht Mannheim HRB 351053\nBroermann Treuhandgesellschaft mbH Unternehmens- und Steuerberatungsgesellschaft – St. Leon-Rot",
      "type": "Löschungsankündigung",
      "state": "Baden-Württemberg",
      "amtsgericht": "Amtsgericht Mannheim",
      "registernummer": "HRB 351053",
      "registerart": "HRB",
      "company_name": "Broermann Treuhandgesellschaft mbH Unternehmens- und Steuerberatungsgesellschaft",
      "company_seat": "St. Leon-Rot",
      "details": "17.01.2025 (Bekanntmachungsdatum)\n\nBaden-Württemberg Amtsgericht Mannheim HRB 351053\nLöschungsankündigung 17.01.2025 (Eintragungsdatum)\n\nBroermann Treuhandgesellschaft mbH Unternehmens- und Steuerberatungsgesellschaft\nGesellschaft mit beschränkter Haftung\nSt. Leon-Rot\n\n#DV.Auswahl(Text=\"Bitte wählen Sie aus:\",\tEingabe=\n\"#insert(Text=\"VOE_Allgemein\")\"|\"Als nicht eingetragen wird bekanntgemacht:\",\n\"#insert(Text=\"VOE_BKM_Blätter\")\"|\"Bekanntmachungen der Gesellschaft erfolgen...\",\n\"#insert(Text=\"VOE_Aufsichtsrat\")\"|\"Mitglieder des ersten Aufsichtsrats\",\n\"#insert(Text=\"VOE_Sachgründung\")\"|\"Sachgründung\",\n\"#insert(Text=\"VOE_Sacherhöhung\")\"|\"Sacherhöhung\",\n\"#insert(Text=\"VOE_Aufhebung_UV\")\"|\"Aufhebung Unternehmensvertrag\",\n\"#insert(Text=\"VOE_Formwechsel\")\"|\"Formwechsel\",\n\"#insert(Text=\"VOE_Verschmelzung\")\"|\"Verschmelzung\",\n\"#insert(Text=\"VOE_Abspaltung\")\"|\"Abspaltung\",\n\"#insert(Text=\"VOE_Aufspaltung\")\"|\"Aufspaltung\",\n\"#insert(Text=\"VOE_Ausgliederung\")\"|\"Ausgliederung\",\n\"#insert(Text=\"VOE_Vermögensübertragung\")\"|\"Vermögensübertragung\",\n\"#insert(Text=\"Loeschungsankündigung_HR_394\")\"|\"Löschungsankündigung 394 FamFG\",\n\"#insert(Text=\"Loeschungsankündigung_HR_395\")\"|\"Löschungsankündigung 395 FamFG\",\n\"#insert(Text=\"Loeschungsankündigung_HR_397\")\"|\"Löschungsankündigung 397 FamFG\")"
    },
    {
      "date": "2025-01-17",
      "id": "98890",
      "original_text": "Löschungsankündigung\nBaden-Württemberg Amtsgericht Mannheim HRB 351053\nBroermann Treuhandgesellschaft mbH Unternehmens- und Steuerberatungsgesellschaft – St. Leon-Rot",
      "type": "Löschungsankündigung",
      "state": "Baden-Württemberg",
      "amtsgericht": "Amtsgericht Mannheim",
      "registernummer": "HRB 351053",
      "registerart": "HRB",
      "company_name": "Broermann Treuhandgesellschaft mbH Unternehmens- und Steuerberatungsgesellschaft",
      "company_seat": "St. Leon-Rot",
      "details": "17.01.2025 (Bekanntmachungsdatum)\n\nBaden-Württemberg Amtsgericht Mannheim HRB 351053\nLöschungsankündigung 17.01.2025 (Eintragungsdatum)\n\nBroermann Treuhandgesellschaft mbH Unternehmens- und Steuerberatungsgesellschaft\nGesellschaft mit beschränkter Haftung\nSt. Leon-Rot\n\nDas Gericht beabsichtigt, die Gesellschaft wegen Vermögenslosigkeit im Handelsregister von Amts wegen nach § 394 FamFG zu löschen. Die Frist zur Geltendmachung eines Widerspruchs gegen die beabsichtigte Löschung ist auf einen Monat ab Veröffentlichung bestimmt."
    },
    {
      "date": "2025-01-17",
      "id": "98891",
      "original_text": "Einreichung neuer Dokumente\nBrandenburg Amtsgericht Frankfurt/Oder HRB 2706\nBeeskower Wohnungsbau- und Verwaltungsgesellschaft mbH – Beeskow",
      "type": "Einreichung neuer Dokumente",
      "state": "Brandenburg",
      "amtsgericht": "Amtsgericht Frankfurt/Oder",
      "registernummer": "HRB 2706",
      "registerart": "HRB",
      "company_name": "Beeskower Wohnungsbau- und Verwaltungsgesellschaft mbH",
      "company_seat": "Beeskow",
      "details": "17.01.2025 (Bekanntmachungsdatum)\n\nBrandenburg Amtsgericht Frankfurt/Oder HRB 2706\nEinreichung neuer Dokumente\n\nBeeskower Wohnungsbau- und Verwaltungsgesellschaft mbH\nGesellschaft mit beschränkter Haftung\nBeeskow\n\nAls nicht eingetragen wird veröffentlicht:\n\nDie Gesellschaft hat Änderungen im Aufsichtsrat angezeigt gemäß § 106 AktG."
    },
    {
      "date": "2025-01-17",
      "id": "98892",
      "original_text": "Sonstige Registerbekanntmachung\nBaden-Württemberg Amtsgericht Freiburg HRA 704798\nPETMAR EWIV – Endingen am Kaiserstuhl",
      "type": "Sonstige Registerbekanntmachung",
      "state": "Baden-Württemberg",
      "amtsgericht": "Amtsgericht Freiburg",
      "registernummer": "HRA 704798",
      "registerart": "HRA",
      "company_name": "PETMAR EWIV",
      "company_seat": "Endingen am Kaiserstuhl",
      "details": "17.01.2025 (Bekanntmachungsdatum)\n\nBaden-Württemberg Amtsgericht Freiburg HRA 704798\nSonstige Registerbekanntmachung 17.01.2025 (Eintragungsdatum)\n\nPETMAR EWIV\nEuropäische wirtschaftliche Interessenvereinigung\nEndingen am Kaiserstuhl\n\nDie Gesellschaft hat am 03.01.2025 einen Mitgliederbeschluss über eine Sitzverlegung nach Endingen am Kaiserstuhl und eine neue Satzung eingereicht."
    },
    {
      "date": "2025-01-17",
      "id": "98893",
      "original_text": "Löschungsankündigung\nSchleswig-Holstein Amtsgericht Flensburg HRB 13925\nM-Team! Biogasservice GmbH – Horstedt",
      "type": "Löschungsankündigung",
      "state": "Schleswig-Holstein",
      "amtsgericht": "Amtsgericht Flensburg",
      "registernummer": "HRB 13925",
      "registerart": "HRB",
      "company_name": "M-Team! Biogasservice GmbH",
      "company_seat": "Horstedt",
      "details": "17.01.2025 (Bekanntmachungsdatum)\n\nSchleswig-Holstein Amtsgericht Flensburg HRB 13925\nLöschungsankündigung\n\nM-Team! Biogasservice GmbH\nGesellschaft mit beschränkter Haftung\nHorstedt\n\nEs ist die Löschung der nachstehenden Gesellschaft wegen Vermögenslosigkeit gemäß § 394 FamFG beabsichtigt.\nWiderspruchsfrist: 2 Monate"
    },
    {
      "date": "2025-01-17",
      "id": "98894",
      "original_text": "Löschungsankündigung\nBerlin Amtsgericht Berlin (Charlottenburg) HRB 188510\nSoundsUP Vinyl UG (haftungsbeschränkt) – Berlin",
      "type": "Löschungsankündigung",
      "state": "Berlin",
      "amtsgericht": "Amtsgericht Berlin (Charlottenburg)",
      "registernummer": "HRB 188510",
      "registerart": "HRB",
      "company_name": "SoundsUP Vinyl UG (haftungsbeschränkt)",
      "company_seat": "Berlin",
      "details": "17.01.2025 (Bekanntmachungsdatum)\n\nBerlin Amtsgericht Berlin (Charlottenburg) HRB 188510\nLöschungsankündigung\n\nSoundsUP Vinyl UG (haftungsbeschränkt)\nGesellschaft mit beschränkter Haftung\nBerlin\n\nBei der nachstehenden Gesellschaft wird das Amtslöschungsverfahren gemäß § 394 FamFG eingeleitet. Widerspruchsfrist: 6 Wochen."
    },
    {
      "date": "2025-01-17",
      "id": "98895",
      "original_text": "Registerbekanntmachung nach dem Umwandlungsgesetz\nBrandenburg Amtsgericht Frankfurt/Oder GsR 154\nWölkchen - die frische Toilette Frank Krische & Matthias Heise eGbR – Rüdersdorf bei Berlin",
      "type": "Registerbekanntmachung nach dem Umwandlungsgesetz",
      "state": "Brandenburg",
      "amtsgericht": "Amtsgericht Frankfurt/Oder",
      "registernummer": "GsR 154",
      "registerart": "GsR",
      "company_name": "Wölkchen - die frische Toilette Frank Krische & Matthias Heise eGbR",
      "company_seat": "Rüdersdorf bei Berlin",
      "details": "17.01.2025 (Bekanntmachungsdatum)\n\nBrandenburg Amtsgericht Frankfurt/Oder GsR 154\nRegisterbekanntmachung nach dem Umwandlungsgesetz 16.01.2025 (Eintragungsdatum)\n\nWölkchen - die frische Toilette Frank Krische & Matthias Heise eGbR\nGesellschaft bürgerlichen Rechts\nRüdersdorf bei Berlin\n\nZu Eintragungsnummer 3 vom 16.01.2025 wird als nicht eingetragen veröffentlicht: Als nicht eingetragen wird veröffentlicht:\nGläubigern, deren Forderungen begründet worden sind, bevor die Eintragung des Beschlusses als nach § 10 des Handelsgesetzbuches bekannt gemacht gilt, ist, wenn sie sich binnen sechs Monaten nach der Bekanntmachung zu diesem Zweck melden, Sicherheit zu leisten, soweit sie nicht Befriedigung verlangen können"
    },
    {
      "date": "2025-01-17",
      "id": "98896",
      "original_text": "Löschungsankündigung\nBerlin Amtsgericht Berlin (Charlottenburg) HRB 238511\nRebel Operations Germany GmbH – Berlin",
      "type": "Löschungsankündigung",
      "state": "Berlin",
      "amtsgericht": "Amtsgericht Berlin (Charlottenburg)",
      "registernummer": "HRB 238511",
      "registerart": "HRB",
      "company_name": "Rebel Operations Germany GmbH",
      "company_seat": "Berlin",
      "details": "17.01.2025 (Bekanntmachungsdatum)\n\nBerlin Amtsgericht Berlin (Charlottenburg) HRB 238511\nLöschungsankündigung\n\nRebel Operations Germany GmbH\nGesellschaft mit beschränkter Haftung\nBerlin\n\nBei der nachstehenden Gesellschaft wird das Amtslöschungsverfahren gemäß § 394 FamFG eingeleitet. Widerspruchsfrist: 6 Wochen."
    },
    {
      "date": "2025-01-17",
      "id": "98897",
      "original_text": "Sonstige Registerbekanntmachung\nHamburg Amtsgericht Hamburg HRB 43935\nplusswerk GmbH – Hamburg",
      "type": "Sonstige Registerbekanntmachung",
      "state": "Hamburg",
      "amtsgericht": "Amtsgericht Hamburg",
      "registernummer": "HRB 43935",
      "registerart": "HRB",
      "company_name": "plusswerk GmbH",
      "company_seat": "Hamburg",
      "details": "17.01.2025 (Bekanntmachungsdatum)\n\nHamburg Amtsgericht Hamburg HRB 43935\nSonstige Registerbekanntmachung 17.01.2025 (Eintragungsdatum)\n\nplusswerk GmbH\nGesellschaft mit beschränkter Haftung\nHamburg\n\nAls nicht eingetragen wird bekannt gemacht:  Den Gläubigern der Gesellschaft, deren Forderungen begründet worden sind, bevor die Eintragung der Vertragsbeendigung in das Handelsregister nach § 10 HGB als bekannt gemacht gilt, ist vom anderen Vertragsteil Sicherheit zu leisten, wenn sie sich binnen 6 Monaten nach Bekanntmachung der Eintragung zu diesem Zweck bei ihm melden."
    },
    {
      "date": "2025-01-17",
      "id": "98898",
      "original_text": "Registerbekanntmachung nach dem Umwandlungsgesetz\nBaden-Württemberg Amtsgericht Mannheim HRA 711870\nAnne Merz e.K. – Leimen",
      "type": "Registerbekanntmachung nach dem Umwandlungsgesetz",
      "state": "Baden-Württemberg",
      "amtsgericht": "Amtsgericht Mannheim",
      "registernummer": "HRA 711870",
      "registerart": "HRA",
      "company_name": "Anne Merz e.K.",
      "company_seat": "Leimen",
      "details": "17.01.2025 (Bekanntmachungsdatum)\n\nBaden-Württemberg Amtsgericht Mannheim HRA 711870\nRegisterbekanntmachung nach dem Umwandlungsgesetz 17.01.2025 (Eintragungsdatum)\n\nAnne Merz e.K.\nEinzelkaufmann / Einzelkauffrau\nLeimen\n\nDen Gläubigern der an der Ausgliederung beteiligten Rechtsträger ist, wenn sie binnen sechs Monaten nach dem Tag, an dem die Eintragung der Ausgliederung in das Register des Sitzes desjenigen Rechtsträgers, dessen Gläubiger sie sind, nach § 19 Abs. 3 UmwG als bekanntgemacht gilt, ihren Anspruch nach Grund und Höhe schriftlich anmelden, Sicherheit zu leisten, soweit sie nicht Befriedigung verlangen können. Dieses Recht steht den Gläubigern jedoch nur zu, wenn sie glaubhaft machen, dass durch die Ausgliederung die Erfüllung ihrer Forderung gefährdet wird."
    },
    {
      "date": "2025-01-17",
      "id": "98899",
      "original_text": "Registerbekanntmachung nach dem Umwandlungsgesetz\nBaden-Württemberg Amtsgericht Mannheim HRA 711920\nAlovis GmbH & Co. KG – Leimen",
      "type": "Registerbekanntmachung nach dem Umwandlungsgesetz",
      "state": "Baden-Württemberg",
      "amtsgericht": "Amtsgericht Mannheim",
      "registernummer": "HRA 711920",
      "registerart": "HRA",
      "company_name": "Alovis GmbH & Co. KG",
      "company_seat": "Leimen",
      "details": "17.01.2025 (Bekanntmachungsdatum)\n\nBaden-Württemberg Amtsgericht Mannheim HRA 711920\nRegisterbekanntmachung nach dem Umwandlungsgesetz 17.01.2025 (Eintragungsdatum)\n\nAlovis GmbH & Co. KG\nKommanditgesellschaft\nLeimen\n\nDen Gläubigern der an der Ausgliederung beteiligten Rechtsträger ist, wenn sie binnen sechs Monaten nach dem Tag, an dem die Eintragung der Ausgliederung in das Register des Sitzes desjenigen Rechtsträgers, dessen Gläubiger sie sind, nach § 19 Abs. 3 UmwG als bekanntgemacht gilt, ihren Anspruch nach Grund und Höhe schriftlich anmelden, Sicherheit zu leisten, soweit sie nicht Befriedigung verlangen können. Dieses Recht steht den Gläubigern jedoch nur zu, wenn sie glaubhaft machen, dass durch die Ausgliederung die Erfüllung ihrer Forderung gefährdet wird."
    },
    {
      "date": "2025-01-17",
      "id": "98900",
      "original_text": "Registerbekanntmachung nach dem Umwandlungsgesetz\nBerlin Amtsgericht Berlin (Charlottenburg) HRB 130027\nRENAFAN GmbH – Berlin",
      "type": "Registerbekanntmachung nach dem Umwandlungsgesetz",
      "state": "Berlin",
      "amtsgericht": "Amtsgericht Berlin (Charlottenburg)",
      "registernummer": "HRB 130027",
      "registerart": "HRB",
      "company_name": "RENAFAN GmbH",
      "company_seat": "Berlin",
      "details": "17.01.2025 (Bekanntmachungsdatum)\n\nBerlin Amtsgericht Berlin (Charlottenburg) HRB 130027\nRegisterbekanntmachung nach dem Umwandlungsgesetz 16.01.2025 (Eintragungsdatum)\n\nRENAFAN GmbH\nGesellschaft mit beschränkter Haftung\nBerlin\n\nZu Eintragungsnummer 20 vom 16.01.2025 wird als nicht eingetragen veröffentlicht: Den Gläubigern der an der Verschmelzung beteiligten Rechtsträger ist, wenn sie binnen sechs Monaten nach dem Tag, an dem die Eintragung der Verschmelzung in das Register des Sitzes desjenigen Rechtsträgers, dessen Gläubiger sie sind, als bekannt gemacht gilt, ihren Anspruch nach Grund und Höhe schriftlich anmelden, Sicherheit zu leisten, soweit sie nicht Befriedigung verlangen können. Dieses Recht steht den Gläubigern jedoch nur zu, wenn sie glaubhaft machen, dass durch die Verschmelzung die Erfüllung ihrer Forderung gefährdet wird. Das Recht, Sicherheitsleistung zu verlangen, steht Gläubigern nicht zu, die im Falle der Insolvenz ein Recht auf vorzugsweise Befriedigung aus einer Deckungsmasse haben, die nach gesetzlicher Vorschrift zu ihrem Schutz errichtet und staatlich überwacht ist."
    },
    {
      "date": "2025-01-17",
      "id": "98901",
      "original_text": "Registerbekanntmachung nach dem Umwandlungsgesetz\nBerlin Amtsgericht Berlin (Charlottenburg) HRB 269270\nKomfort Vermietungsgesellschaft mbH – Berlin",
      "type": "Registerbekanntmachung nach dem Umwandlungsgesetz",
      "state": "Berlin",
      "amtsgericht": "Amtsgericht Berlin (Charlottenburg)",
      "registernummer": "HRB 269270",
      "registerart": "HRB",
      "company_name": "Komfort Vermietungsgesellschaft mbH",
      "company_seat": "Berlin",
      "details": "17.01.2025 (Bekanntmachungsdatum)\n\nBerlin Amtsgericht Berlin (Charlottenburg) HRB 269270\nRegisterbekanntmachung nach dem Umwandlungsgesetz 16.01.2025 (Eintragungsdatum)\n\nKomfort Vermietungsgesellschaft mbH\nGesellschaft mit beschränkter Haftung\nBerlin\n\nZu Eintragungsnummer 2 vom 16.01.2025 wird als nicht eingetragen veröffentlicht: Den Gläubigern der an der Verschmelzung beteiligten Rechtsträger ist, wenn sie binnen sechs Monaten nach dem Tag, an dem die Eintragung der Verschmelzung in das Register des Sitzes desjenigen Rechtsträgers, dessen Gläubiger sie sind, als bekannt gemacht gilt, ihren Anspruch nach Grund und Höhe schriftlich anmelden, Sicherheit zu leisten, soweit sie nicht Befriedigung verlangen können. Dieses Recht steht den Gläubigern jedoch nur zu, wenn sie glaubhaft machen, dass durch die Verschmelzung die Erfüllung ihrer Forderung gefährdet wird. Das Recht, Sicherheitsleistung zu verlangen, steht Gläubigern nicht zu, die im Falle der Insolvenz ein Recht auf vorzugsweise Befriedigung aus einer Deckungsmasse haben, die nach gesetzlicher Vorschrift zu ihrem Schutz errichtet und staatlich überwacht ist."
    },
    {
      "date": "2025-01-17",
      "id": "98902",
      "original_text": "Löschungsankündigung\nBaden-Württemberg Amtsgericht Stuttgart HRB 245527\nPROPLAN Projektentwicklungs- und Planungsgesellschaft mbH – Grafenau",
      "type": "Löschungsankündigung",
      "state": "Baden-Württemberg",
      "amtsgericht": "Amtsgericht Stuttgart",
      "registernummer": "HRB 245527",
      "registerart": "HRB",
      "company_name": "PROPLAN Projektentwicklungs- und Planungsgesellschaft mbH",
      "company_seat": "Grafenau",
      "details": "17.01.2025 (Bekanntmachungsdatum)\n\nBaden-Württemberg Amtsgericht Stuttgart HRB 245527\nLöschungsankündigung\n\nPROPLAN Projektentwicklungs- und Planungsgesellschaft mbH\nGesellschaft mit beschränkter Haftung\nGrafenau\n\nDas Gericht beabsichtigt, die Gesellschaft wegen Vermögenslosigkeit im Handelsregister von Amts wegen nach § 394 FamFG zu löschen. Die Frist zur Geltendmachung eines Widerspruchs gegen die beabsichtigte Löschung ist auf zwei Monate ab Veröffentlichung bestimmt."
    },
    {
      "date": "2025-01-17",
      "id": "98903",
      "original_text": "Sonstige Registerbekanntmachung\nHamburg Amtsgericht Hamburg HRB 131412\nT.J.H. Hamburger Hunde GmbH – Hamburg",
      "type": "Sonstige Registerbekanntmachung",
      "state": "Hamburg",
      "amtsgericht": "Amtsgericht Hamburg",
      "registernummer": "HRB 131412",
      "registerart": "HRB",
      "company_name": "T.J.H. Hamburger Hunde GmbH",
      "company_seat": "Hamburg",
      "details": "17.01.2025 (Bekanntmachungsdatum)\n\nHamburg Amtsgericht Hamburg HRB 131412\nSonstige Registerbekanntmachung 17.01.2025 (Eintragungsdatum)\n\nT.J.H. Hamburger Hunde GmbH\nGesellschaft mit beschränkter Haftung\nHamburg\n\nAls nicht eingetragen wird bekannt gemacht: Den Gläubigern der Gesellschaft, deren Forderungen begründet worden sind, bevor die Eintragung der Vertragsbeendigung in das Handelsregister nach § 10 HGB als bekannt gemacht gilt, ist vom anderen Vertragsteil Sicherheit zu leisten, wenn sie sich binnen 6 Monaten nach Bekanntmachung der Eintragung zu diesem Zweck bei ihm melden."
    },
    {
      "date": "2025-01-17",
      "id": "98904",
      "original_text": "Registerbekanntmachung nach dem Umwandlungsgesetz\nBaden-Württemberg Amtsgericht Mannheim HRB 738608\nRKW SE – Mannheim",
      "type": "Registerbekanntmachung nach dem Umwandlungsgesetz",
      "state": "Baden-Württemberg",
      "amtsgericht": "Amtsgericht Mannheim",
      "registernummer": "HRB 738608",
      "registerart": "HRB",
      "company_name": "RKW SE",
      "company_seat": "Mannheim",
      "details": "17.01.2025 (Bekanntmachungsdatum)\n\nBaden-Württemberg Amtsgericht Mannheim HRB 738608\nRegisterbekanntmachung nach dem Umwandlungsgesetz\n\nRKW SE\nEuropäische Aktiengesellschaft (SE)\nMannheim\n\nDie Gesellschaft hat am 15.01.2025 den Entwurf des Verschmelzungsvertrages zwischen RKW Agri Verwaltungs GmbH (Amtsgericht Mannheim HRB 738655)\nund der hiesigen Gesellschaft (übernehmender Rechtsträger) zum Handelsregister eingereicht."
    },
    {
      "date": "2025-01-17",
      "id": "98905",
      "original_text": "Sonstige Registerbekanntmachung\nSachsen-Anhalt Amtsgericht Stendal VR 48277\nArbeiterwohlfahrt Kreisverband Burgenlandkreis e.V.-Hohenmölsen/Zeitz/Weißenfels – Hohenmölsen",
      "type": "Sonstige Registerbekanntmachung",
      "state": "Sachsen-Anhalt",
      "amtsgericht": "Amtsgericht Stendal",
      "registernummer": "VR 48277",
      "registerart": "VR",
      "company_name": "Arbeiterwohlfahrt Kreisverband Burgenlandkreis e.V.-Hohenmölsen/Zeitz/Weißenfels",
      "company_seat": "Hohenmölsen",
      "details": "17.01.2025 (Bekanntmachungsdatum)\n\nSachsen-Anhalt Amtsgericht Stendal VR 48277\nSonstige Registerbekanntmachung\n\nArbeiterwohlfahrt Kreisverband Burgenlandkreis e.V.-Hohenmölsen/Zeitz/Weißenfels\neingetragener Verein\nHohenmölsen\n\nDas Registergericht beabsichtigt, Frau Rechtsanwältin Angela Anders aus Zeitz zum alleinvertretungsberechtigten Notvorstand des Vereins mit einer Befristung von 6 Monaten zu bestellen.\n\nEtwaige Einwendungen gegen die beabsichtigte Bestellung sind bis zum 31.01.2024 hier einzureichen."
    },
    {
      "date": "2025-01-17",
      "id": "98906",
      "original_text": "Registerbekanntmachung nach dem Umwandlungsgesetz\nSaarland Amtsgericht Saarbrücken HRA 13578\nTMB Holding GmbH & Co. KG – St. Wendel",
      "type": "Registerbekanntmachung nach dem Umwandlungsgesetz",
      "state": "Saarland",
      "amtsgericht": "Amtsgericht Saarbrücken",
      "registernummer": "HRA 13578",
      "registerart": "HRA",
      "company_name": "TMB Holding GmbH & Co. KG",
      "company_seat": "St. Wendel",
      "details": "17.01.2025 (Bekanntmachungsdatum)\n\nSaarland Amtsgericht Saarbrücken HRA 13578\nRegisterbekanntmachung nach dem Umwandlungsgesetz 17.01.2025 (Eintragungsdatum)\n\nTMB Holding GmbH & Co. KG\nKommanditgesellschaft\nSt. Wendel\n\nAls nicht eingetragen wird bekannt gemacht: Den Gläubigern der an der Verschmelzung beteiligten Gesellschaften ist, wenn sie binnen sechs Monaten nach dem Tag, an dem die Eintragung der Verschmelzung in das Register des Sitzes desjenigen Rechtsträgers, dessen Gläubiger sie sind, nach § 19 Absatz 3 UmwG bekannt gemacht worden ist, ihren Anspruch nach Grund und Höhe schriftlich anmelden, Sicherheit zu leisten, soweit sie nicht Befriedigung verlangen können. Dieses Recht steht den Gläubigern jedoch nur zu, wenn sie glaubhaft machen, dass durch die Verschmelzung die Erfüllung ihrer Forderung gefährdet wird."
    },
    {
      "date": "2025-01-17",
      "id": "98907",
      "original_text": "Registerbekanntmachung nach dem Umwandlungsgesetz\nSaarland Amtsgericht Saarbrücken HRA 80702\nGLOBUS Holding GmbH & Co. KG – St. Wendel",
      "type": "Registerbekanntmachung nach dem Umwandlungsgesetz",
      "state": "Saarland",
      "amtsgericht": "Amtsgericht Saarbrücken",
      "registernummer": "HRA 80702",
      "registerart": "HRA",
      "company_name": "GLOBUS Holding GmbH & Co. KG",
      "company_seat": "St. Wendel",
      "details": "17.01.2025 (Bekanntmachungsdatum)\n\nSaarland Amtsgericht Saarbrücken HRA 80702\nRegisterbekanntmachung nach dem Umwandlungsgesetz 17.01.2025 (Eintragungsdatum)\n\nGLOBUS Holding GmbH & Co. KG\nKommanditgesellschaft\nSt. Wendel\n\nAls nicht eingetragen wird bekannt gemacht: Den Gläubigern der an der Verschmelzung beteiligten Gesellschaften ist, wenn sie binnen sechs Monaten nach dem Tag, an dem die Eintragung der Verschmelzung in das Register des Sitzes desjenigen Rechtsträgers, dessen Gläubiger sie sind, nach § 19 Absatz 3 UmwG bekannt gemacht worden ist, ihren Anspruch nach Grund und Höhe schriftlich anmelden, Sicherheit zu leisten, soweit sie nicht Befriedigung verlangen können. Dieses Recht steht den Gläubigern jedoch nur zu, wenn sie glaubhaft machen, dass durch die Verschmelzung die Erfüllung ihrer Forderung gefährdet wird."
    },
    {
      "date": "2025-01-17",
      "id": "98908",
      "original_text": "Registerbekanntmachung nach dem Umwandlungsgesetz\nHamburg Amtsgericht Hamburg HRB 158560\nsmidig GmbH – Hamburg",
      "type": "Registerbekanntmachung nach dem Umwandlungsgesetz",
      "state": "Hamburg",
      "amtsgericht": "Amtsgericht Hamburg",
      "registernummer": "HRB 158560",
      "registerart": "HRB",
      "company_name": "smidig GmbH",
      "company_seat": "Hamburg",
      "details": "17.01.2025 (Bekanntmachungsdatum)\n\nHamburg Amtsgericht Hamburg HRB 158560\nRegisterbekanntmachung nach dem Umwandlungsgesetz 17.01.2025 (Eintragungsdatum)\n\nsmidig GmbH\nGesellschaft mit beschränkter Haftung\nHamburg\n\nAls nicht eingetragen wird bekannt gemacht:\nDen Gläubigern der an der formwechselnden Umwandlung beteiligten Gesellschaften ist, wenn sie binnen sechs Monaten nach dem Tag, an dem die Eintragung der formwechselnden Umwandlung in das Register des Sitzes desjenigen Rechtsträgers, dessen Gläubiger sie sind, nach § 19 Absatz 3 UmwG als bekannt gemacht gilt, ihren Anspruch nach Grund und Höhe schriftlich anmelden, Sicherheit zu leisten, soweit sie nicht Befriedigung verlangen können. Dieses Recht steht den Gläubigern jedoch nur zu, wenn sie glaubhaft machen, dass durch die formwechselnde Umwandlung die Erfüllung ihrer Forderung gefährdet wird."
    },
    {
      "date": "2025-01-17",
      "id": "98909",
      "original_text": "Löschungsankündigung\nBrandenburg Amtsgericht Frankfurt/Oder HRB 11823\ninnova-paper-form GmbH – Neulewin",
      "type": "Löschungsankündigung",
      "state": "Brandenburg",
      "amtsgericht": "Amtsgericht Frankfurt/Oder",
      "registernummer": "HRB 11823",
      "registerart": "HRB",
      "company_name": "innova-paper-form GmbH",
      "company_seat": "Neulewin",
      "details": "17.01.2025 (Bekanntmachungsdatum)\n\nBrandenburg Amtsgericht Frankfurt/Oder HRB 11823\nLöschungsankündigung\n\ninnova-paper-form GmbH\nGesellschaft mit beschränkter Haftung\nNeulewin\n\nBei der nachstehenden Gesellschaft wird das Amtslöschungsverfahren gemäß § 394 FamFG eingeleitet."
    },
    {
      "date": "2025-01-17",
      "id": "98910",
      "original_text": "Einreichung neuer Dokumente\nBaden-Württemberg Amtsgericht Stuttgart HRB 226105\nLandesmesse Stuttgart Verwaltungs-GmbH – Stuttgart",
      "type": "Einreichung neuer Dokumente",
      "state": "Baden-Württemberg",
      "amtsgericht": "Amtsgericht Stuttgart",
      "registernummer": "HRB 226105",
      "registerart": "HRB",
      "company_name": "Landesmesse Stuttgart Verwaltungs-GmbH",
      "company_seat": "Stuttgart",
      "details": "17.01.2025 (Bekanntmachungsdatum)\n\nBaden-Württemberg Amtsgericht Stuttgart HRB 226105\nEinreichung neuer Dokumente\n\nLandesmesse Stuttgart Verwaltungs-GmbH\nGesellschaft mit beschränkter Haftung\nStuttgart\n\nDie Gesellschaft hat am 16.01.2025 die Liste über die Zusammensetzung des Aufsichtsrats zum Handelsregister eingereicht."
    },
    {
      "date": "2025-01-17",
      "id": "98911",
      "original_text": "Einreichung neuer Dokumente\nSachsen Amtsgericht Dresden HRB 1378\nElbe Flugzeugwerke GmbH – Dresden",
      "type": "Einreichung neuer Dokumente",
      "state": "Sachsen",
      "amtsgericht": "Amtsgericht Dresden",
      "registernummer": "HRB 1378",
      "registerart": "HRB",
      "company_name": "Elbe Flugzeugwerke GmbH",
      "company_seat": "Dresden",
      "details": "17.01.2025 (Bekanntmachungsdatum)\n\nSachsen Amtsgericht Dresden HRB 1378\nEinreichung neuer Dokumente 17.01.2025 (Eintragungsdatum)\n\nElbe Flugzeugwerke GmbH\nGesellschaft mit beschränkter Haftung\nDresden\n\nAm 07.01.2025 wurde beim Handelsregister des Amtsgerichts Dresden die Liste der Mitglieder des Aufsichtsrats gemäß § 52 GmbHG eingereicht."
    },
    {
      "date": "2025-01-17",
      "id": "98912",
      "original_text": "Registerbekanntmachung nach dem Umwandlungsgesetz\nNiedersachsen Amtsgericht Osnabrück GsR 776\nDüthmann Immobilien eGbR – Haren (Ems)",
      "type": "Registerbekanntmachung nach dem Umwandlungsgesetz",
      "state": "Niedersachsen",
      "amtsgericht": "Amtsgericht Osnabrück",
      "registernummer": "GsR 776",
      "registerart": "GsR",
      "company_name": "Düthmann Immobilien eGbR",
      "company_seat": "Haren (Ems)",
      "details": "17.01.2025 (Bekanntmachungsdatum)\n\nNiedersachsen Amtsgericht Osnabrück GsR 776\nRegisterbekanntmachung nach dem Umwandlungsgesetz 17.01.2025 (Eintragungsdatum)\n\nDüthmann Immobilien eGbR\nGesellschaft bürgerlichen Rechts\nHaren (Ems)\n\nDen Gläubigern der an der formwechselnden Umwandlung beteiligten Rechtsträger ist, wenn sie binnen sechs Monaten nach dem Tag, an dem die Eintragung der Umwandlung in das Register des Sitzes desjenigen Rechtsträgers, dessen Gläubiger sie sind, nach § 19 Abs. 3 UmwG als bekannt gemacht gilt, ihren Anspruch nach Grund und Höhe schriftlich anmelden, Sicherheit zu leisten, soweit sie nicht Befriedigung verlangen können. Dieses Recht steht den Gläubigern jedoch nur zu, wenn sie glaubhaft machen, dass durch die formwechselnde Umwandlung die Erfüllung der Forderung gefährdet wird."
    },
    {
      "date": "2025-01-17",
      "id": "98913",
      "original_text": "Sonstige Registerbekanntmachung\nNiedersachsen Amtsgericht Hannover HRB 59100\nMecklenburgische Krankenversicherungs- Aktiengesellschaft – Hannover",
      "type": "Sonstige Registerbekanntmachung",
      "state": "Niedersachsen",
      "amtsgericht": "Amtsgericht Hannover",
      "registernummer": "HRB 59100",
      "registerart": "HRB",
      "company_name": "Mecklenburgische Krankenversicherungs- Aktiengesellschaft",
      "company_seat": "Hannover",
      "details": "17.01.2025 (Bekanntmachungsdatum)\n\nNiedersachsen Amtsgericht Hannover HRB 59100\nSonstige Registerbekanntmachung 17.01.2025 (Eintragungsdatum)\n\nMecklenburgische Krankenversicherungs- Aktiengesellschaft\nAktiengesellschaft\nHannover\n\nDen Gläubigern der Gesellschaft, deren Forderungen begründet worden sind, bevor die Eintragung der Beendigung des Vertrages in das Handelsregister nach § 10 HGB als bekanntgemacht gilt, ist vom anderen Vertragsteil Sicherheit zu leisten, wenn sie sich binnen sechs Monaten nach der Bekanntmachung zu diesem Zweck bei ihm melden."
    },
    {
      "date": "2025-01-17",
      "id": "98914",
      "original_text": "Löschungsankündigung\nNiedersachsen Amtsgericht Stadthagen HRB 202031\nInvesta UG (haftungsbeschränkt) – Rinteln",
      "type": "Löschungsankündigung",
      "state": "Niedersachsen",
      "amtsgericht": "Amtsgericht Stadthagen",
      "registernummer": "HRB 202031",
      "registerart": "HRB",
      "company_name": "Investa UG (haftungsbeschränkt)",
      "company_seat": "Rinteln",
      "details": "17.01.2025 (Bekanntmachungsdatum)\n\nNiedersachsen Amtsgericht Stadthagen HRB 202031\nLöschungsankündigung\n\nInvesta UG (haftungsbeschränkt)\nGesellschaft mit beschränkter Haftung\nRinteln\n\nDas Registergericht beabsichtigt, die Gesellschaft von Amts wegen nach § 394 FamFG zu löschen. Die Frist zur Erhebung eines Widerspruchs ist auf 1 Monat ab dieser Registerbekanntmachung festgesetzt."
    },
    {
      "date": "2025-01-17",
      "id": "98915",
      "original_text": "Einreichung neuer Dokumente\nNiedersachsen Amtsgericht Braunschweig HRB 208203\nCARIAD SE – Wolfsburg",
      "type": "Einreichung neuer Dokumente",
      "state": "Niedersachsen",
      "amtsgericht": "Amtsgericht Braunschweig",
      "registernummer": "HRB 208203",
      "registerart": "HRB",
      "company_name": "CARIAD SE",
      "company_seat": "Wolfsburg",
      "details": "17.01.2025 (Bekanntmachungsdatum)\n\nNiedersachsen Amtsgericht Braunschweig HRB 208203\nEinreichung neuer Dokumente\n\nCARIAD SE\nEuropäische Aktiengesellschaft (SE)\nWolfsburg\n\nEine aktuelle Liste der Mitglieder des Aufsichtsrats wurde beim Registergericht eingereicht."
    },
    {
      "date": "2025-01-17",
      "id": "98916",
      "original_text": "Registerbekanntmachung nach dem Umwandlungsgesetz\nNiedersachsen Amtsgericht Osnabrück HRB 221284\nDüthmann Immobilien GmbH – Haren (Ems)",
      "type": "Registerbekanntmachung nach dem Umwandlungsgesetz",
      "state": "Niedersachsen",
      "amtsgericht": "Amtsgericht Osnabrück",
      "registernummer": "HRB 221284",
      "registerart": "HRB",
      "company_name": "Düthmann Immobilien GmbH",
      "company_seat": "Haren (Ems)",
      "details": "17.01.2025 (Bekanntmachungsdatum)\n\nNiedersachsen Amtsgericht Osnabrück HRB 221284\nRegisterbekanntmachung nach dem Umwandlungsgesetz 17.01.2025 (Eintragungsdatum)\n\nDüthmann Immobilien GmbH\nGesellschaft mit beschränkter Haftung\nHaren (Ems)\n\nDen Gläubigern der an der formwechselnden Umwandlung beteiligten Rechtsträger ist, wenn sie binnen sechs Monaten nach dem Tag, an dem die Eintragung der Umwandlung in das Register des Sitzes desjenigen Rechtsträgers, dessen Gläubiger sie sind, nach § 19 Abs. 3 UmwG als bekannt gemacht gilt, ihren Anspruch nach Grund und Höhe schriftlich anmelden, Sicherheit zu leisten, soweit sie nicht Befriedigung verlangen können. Dieses Recht steht den Gläubigern jedoch nur zu, wenn sie glaubhaft machen, dass durch die formwechselnde Umwandlung die Erfüllung der Forderung gefährdet wird."
    },
    {
      "date": "2025-01-17",
      "id": "98917",
      "original_text": "Registerbekanntmachung nach dem Umwandlungsgesetz\nNiedersachsen Amtsgericht Osnabrück HRB 101084 früher Amtsgericht Lingen (Ems)\nPIN 1 - Projekt GmbH – Emsbüren",
      "type": "Registerbekanntmachung nach dem Umwandlungsgesetz",
      "state": "Niedersachsen",
      "amtsgericht": "Amtsgericht Osnabrück",
      "registernummer": "HRB 101084",
      "registerart": "HRB",
      "company_name": "PIN 1 - Projekt GmbH",
      "company_seat": "Emsbüren",
      "former_amtsgericht": "Lingen (Ems)",
      "details": "17.01.2025 (Bekanntmachungsdatum)\n\nNiedersachsen Amtsgericht Osnabrück HRB 101084 früher Amtsgericht Lingen (Ems)\nRegisterbekanntmachung nach dem Umwandlungsgesetz 17.01.2025 (Eintragungsdatum)\n\nPIN 1 - Projekt GmbH\nGesellschaft mit beschränkter Haftung\nEmsbüren\n\nEs wird gemäß § 308 Absatz 1 Nr. 1 bis Nr. 3 UmwG in Verbindung mit § 10 HGB darauf hingewiesen, dass beim Amtsgericht Osnabrück - Handelsregister - der Entwurf eines  Verschmelzungsplans über eine grenzüberschreitende Verschmelzung  eingereicht worden ist. Übertragender Rechtsträger ist die PIN 1 - Projekt GmbH mit Sitz in Emsbüren, eine deutsche Kapitalgesellschaft mit beschränkter Haftung, eingetragen im Handelsregister des Amtsgericht Osnabrück unter HRB 101084. Übernehmender Rechtsträger ist die Bennie Kuipers Holding B.V. mit Sitz in De Lutte/Königreich der Niederlande, eine niederländische Kapitalgesellschaft mit beschränkter Haftung (besloten vennotschap), eingetragen im Handelsregister der niederländischen Handelskammer unter der Nummer 68860390.\nDie in § 308 Absatz 1 Nr. 4 UmwG bezeichneten Personen, nämlich\na) die Anteilsinhaber und Gläubiger der an der grenzüberschreitenden Verschmelzung beteiligten Gesellschaften sowie\nb) die Arbeitnehmer der an der grenzüberschreitenden Verschmelzung beteiligten Gesellschaften (ein Betriebsrat besteht bei keiner der genannten Gesellschaften)\nkönnen der jeweiligen Gesellschaft bis zum 10. März 2025 und damit spätestens fünf Arbeitstage vor dem Tag der Gesellschafterversammlung im Sinne von § 308 Absatz 1 Nr. 4 UmwG Bemerkungen zum Verschmelzungsplan mitteilen. Solche Bemerkungen sind zu richten an die PIN 1 - Projekt GmbH, Carl-Linne-Straße 1, 48488 Emsbüren, Deutschland, oder an die Bennie Kuipers Holding B.V., Kaviksweg 5, 7587 LL de Lutte, Niederlande.\nJeweils zu Händen des Geschäftsführers Benni Kuipers.\nDer Gläubiger der übertragenden Gesellschaft kann nach § 314 UmwG verlangen, dass ihm Sicherheit geleistet wird für eine Forderung, die vor der Bekanntmachung des\nVerschmelzungsplans oder seines Entwurfs entstanden, aber im Zeitpunkt der Bekanntmachung noch nicht fällig geworden ist, und deren Erfüllung durch die Verschmelzung gefährdet wird. Die Voraussetzungen des Anspruchs sind gegenüber dem zuständigen Gericht glaubhaft zu machen. Der Anspruch auf Sicherheitsleistung erlischt, wenn er nicht innerhalb von drei Monaten ab Bekanntmachung des Verschmelzungsplans gerichtlich geltend gemacht wird.\nDie an der grenzüberschreitenden Verschmelzung beteiligten Gesellschaften haben keinen Betriebsrat, die übertragende Gesellschaft hat keine Arbeitnehmer, die übernehmende Gesellschaft hat einen Arbeitnehmer, der Mitglied der Vorstandsebene ist."
    },
    {
      "date": "2025-01-17",
      "id": "98918",
      "original_text": "Löschungsankündigung\nNiedersachsen Amtsgericht Walsrode HRB 210663\nB & H Trading GmbH – Rehburg-Loccum",
      "type": "Löschungsankündigung",
      "state": "Niedersachsen",
      "amtsgericht": "Amtsgericht Walsrode",
      "registernummer": "HRB 210663",
      "registerart": "HRB",
      "company_name": "B & H Trading GmbH",
      "company_seat": "Rehburg-Loccum",
      "details": "17.01.2025 (Bekanntmachungsdatum)\n\nNiedersachsen Amtsgericht Walsrode HRB 210663\nLöschungsankündigung\n\nB & H Trading GmbH\nGesellschaft mit beschränkter Haftung\nRehburg-Loccum\n\nDas Registergericht beabsichtigt, die Gesellschaft von Amts wegen nach § 394 FamFG zu löschen. Die Frist zur Erhebung eines Widerspruchs ist auf 1 Monat ab dieser Registerbekanntmachung festgesetzt."
    },
    {
      "date": "2025-01-17",
      "id": "98919",
      "original_text": "Löschungsankündigung\nNiedersachsen Amtsgericht Hannover HRA 203136\nATS Bau Abdulmüttalip Akyol e.K. – Garbsen",
      "type": "Löschungsankündigung",
      "state": "Niedersachsen",
      "amtsgericht": "Amtsgericht Hannover",
      "registernummer": "HRA 203136",
      "registerart": "HRA",
      "company_name": "ATS Bau Abdulmüttalip Akyol e.K.",
      "company_seat": "Garbsen",
      "details": "17.01.2025 (Bekanntmachungsdatum)\n\nNiedersachsen Amtsgericht Hannover HRA 203136\nLöschungsankündigung\n\nATS Bau Abdulmüttalip Akyol e.K.\nEinzelkaufmann / Einzelkauffrau\nGarbsen\n\nDas Registergericht beabsichtigt, die Firma von Amts wegen nach § 31 Abs. 2 Satz 2 HGB, § 393 FamFG zu löschen. Die Frist zur Erhebung eines Widerspruchs ist auf 1 Monat ab dieser Registerbekanntmachung festgesetzt."
    },
    {
      "date": "2025-01-17",
      "id": "98920",
      "original_text": "Einreichung neuer Dokumente\nNiedersachsen Amtsgericht Walsrode HRB 30828\nMittelweser-Touristik GmbH – Nienburg/Weser",
      "type": "Einreichung neuer Dokumente",
      "state": "Niedersachsen",
      "amtsgericht": "Amtsgericht Walsrode",
      "registernummer": "HRB 30828",
      "registerart": "HRB",
      "company_name": "Mittelweser-Touristik GmbH",
      "company_seat": "Nienburg/Weser",
      "details": "17.01.2025 (Bekanntmachungsdatum)\n\nNiedersachsen Amtsgericht Walsrode HRB 30828\nEinreichung neuer Dokumente 17.01.2025 (Eintragungsdatum)\n\nMittelweser-Touristik GmbH\nGesellschaft mit beschränkter Haftung\nNienburg/Weser\n\nDie Liste der Mitglieder des Aufsichtsrats wurde beim Registergericht eingereicht."
    },
    {
      "date": "2025-01-17",
      "id": "98921",
      "original_text": "Einreichung neuer Dokumente\nNiedersachsen Amtsgericht Lüneburg HRB 120610 früher Amtsgericht Dannenberg (Elbe)\nHeide-Zwiebel AG – Uelzen",
      "type": "Einreichung neuer Dokumente",
      "state": "Niedersachsen",
      "amtsgericht": "Amtsgericht Lüneburg",
      "registernummer": "HRB 120610",
      "registerart": "HRB",
      "company_name": "Heide-Zwiebel AG",
      "company_seat": "Uelzen",
      "former_amtsgericht": "Dannenberg (Elbe)",
      "details": "17.01.2025 (Bekanntmachungsdatum)\n\nNiedersachsen Amtsgericht Lüneburg HRB 120610 früher Amtsgericht Dannenberg (Elbe)\nEinreichung neuer Dokumente 17.01.2025 (Eintragungsdatum)\n\nHeide-Zwiebel AG\nAktiengesellschaft\nUelzen\n\nEine aktuelle Liste der Mitglieder des Aufsichtsrats wurde beim Registergericht eingereicht."
    },
    {
      "date": "2025-01-17",
      "id": "98922",
      "original_text": "Sonstige Registerbekanntmachung\nNiedersachsen Amtsgericht Aurich HRB 111013 früher Amtsgericht Leer (Ostfriesland) (Leer)\nVolksbank Immobilien GmbH – Rhauderfehn",
      "type": "Sonstige Registerbekanntmachung",
      "state": "Niedersachsen",
      "amtsgericht": "Amtsgericht Aurich",
      "registernummer": "HRB 111013",
      "registerart": "HRB",
      "company_name": "Volksbank Immobilien GmbH",
      "company_seat": "Rhauderfehn",
      "former_amtsgericht": "Leer (Ostfriesland) (Leer)",
      "details": "17.01.2025 (Bekanntmachungsdatum)\n\nNiedersachsen Amtsgericht Aurich HRB 111013 früher Amtsgericht Leer (Ostfriesland) (Leer)\nSonstige Registerbekanntmachung 17.01.2025 (Eintragungsdatum)\n\nVolksbank Immobilien GmbH\nGesellschaft mit beschränkter Haftung\nRhauderfehn\n\nDen Gläubigern der Gesellschaft, deren Forderungen begründet worden sind, bevor die Eintragung der Beendigung des Vertrages in das Handelsregister nach § 10 HGB als bekanntgemacht gilt, ist vom anderen Vertragsteil Sicherheit zu leisten, wenn sie sich binnen sechs Monaten nach der Bekanntmachung zu diesem Zweck bei ihm melden."
    },
    {
      "date": "2025-01-17",
      "id": "98923",
      "original_text": "Löschungsankündigung\nRheinland-Pfalz Amtsgericht Mainz HRB 48216\nKS Consulting UG (haftungsbeschränkt) – Flörsheim-Dalsheim",
      "type": "Löschungsankündigung",
      "state": "Rheinland-Pfalz",
      "amtsgericht": "Amtsgericht Mainz",
      "registernummer": "HRB 48216",
      "registerart": "HRB",
      "company_name": "KS Consulting UG (haftungsbeschränkt)",
      "company_seat": "Flörsheim-Dalsheim",
      "details": "17.01.2025 (Bekanntmachungsdatum)\n\nRheinland-Pfalz Amtsgericht Mainz HRB 48216\nLöschungsankündigung\n\nKS Consulting UG (haftungsbeschränkt)\nGesellschaft mit beschränkter Haftung\nFlörsheim-Dalsheim\n\nDas Registergericht beabsichtigt die Gesellschaft von Amts wegen nach § 394 FamFG zu löschen. Die Frist zur Erhebung eines Widerspruchs ist auf einen Monat festgesetzt."
    },
    {
      "date": "2025-01-17",
      "id": "98924",
      "original_text": "Einreichung neuer Dokumente\nRheinland-Pfalz Amtsgericht Landau HRB 2971\nEnergieSüdwest Netz GmbH – Landau in der Pfalz",
      "type": "Einreichung neuer Dokumente",
      "state": "Rheinland-Pfalz",
      "amtsgericht": "Amtsgericht Landau",
      "registernummer": "HRB 2971",
      "registerart": "HRB",
      "company_name": "EnergieSüdwest Netz GmbH",
      "company_seat": "Landau in der Pfalz",
      "details": "17.01.2025 (Bekanntmachungsdatum)\n\nRheinland-Pfalz Amtsgericht Landau HRB 2971\nEinreichung neuer Dokumente 17.01.2025 (Eintragungsdatum)\n\nEnergieSüdwest Netz GmbH\nGesellschaft mit beschränkter Haftung\nLandau in der Pfalz\n\nDem Registergericht ist eine neue Liste der Mitglieder des Aufsichtsrates eingereicht worden."
    },
    {
      "date": "2025-01-17",
      "id": "98925",
      "original_text": "Löschungsankündigung\nNordrhein-Westfalen Amtsgericht Neuss HRB 22403\nGM Gesund & Munter UG (haftungsbeschränkt) – Kaarst",
      "type": "Löschungsankündigung",
      "state": "Nordrhein-Westfalen",
      "amtsgericht": "Amtsgericht Neuss",
      "registernummer": "HRB 22403",
      "registerart": "HRB",
      "company_name": "GM Gesund & Munter UG (haftungsbeschränkt)",
      "company_seat": "Kaarst",
      "details": "17.01.2025 (Bekanntmachungsdatum)\n\nNordrhein-Westfalen Amtsgericht Neuss HRB 22403\nLöschungsankündigung 17.01.2025 (Eintragungsdatum)\n\nGM Gesund & Munter UG (haftungsbeschränkt)\nGesellschaft mit beschränkter Haftung\nKaarst\n\nDas Registergericht beabsichtigt die Gesellschaft wegen Vermögenslosigkeit aufgrund des § 394 Abs. 1 FamFG zu löschen. Frist zur Geltendmachung eines Widerspruchs: 1 Monat.\nRechtsbehelfsbelehrung:\nGegen diese Verfügung können Sie Widerspruch einlegen.\nDer Widerspruch ist bei dem Amtsgericht Neuss - Registergericht -, Breite Str. 48, 41460 Neuss schriftlich in deutscher Sprache oder zur Niederschrift der Geschäftsstelle einzulegen.\nDer Widerspruch kann auch zur Niederschrift der Geschäftsstelle eines jeden Amtsgerichtes abgegeben werden.\nDie Einlegung ist auch durch Übertragung eines elektronischen Dokuments an die elektronische Poststelle des Gerichts möglich. Das elektronische Dokument muss für die Bearbeitung durch das Gericht geeignet und mit einer qualifizierten elektronischen Signatur der verantwortenden Person versehen sein oder von der verantwortenden Person signiert und auf einem sicheren Übermittlungsweg gemäß § 130a ZPO nach näherer Maßgabe der Verordnung über die technischen Rahmenbedingungen des elektronischen Rechtsverkehrs und über das besondere elektronische Behördenpostfach (BGBl. I, S.3803) eingereicht werden. Weitere Informationen erhalten Sie auf der Internetseite www.justiz.de.\nDer Widerspruch muss spätestens innerhalb der gesetzten Frist nach der schriftlichen Bekanntgabe der Verfügung bei dem Amtsgericht - Registergericht - Neuss eingegangen sein. Dies gilt auch dann, wenn der Widerspruch zur Niederschrift der Geschäftsstelle eines anderen Amtsgerichtes abgegeben wurde. Die Frist beginnt mit der schriftlichen Bekanntgabe der Verfügung. Die Bekanntgabe ist entweder durch Zustellung oder am dritten Tage nach Aufgabe zur Post bewirkt. Fällt das Ende der Frist auf einen Sonntag, einen allgemeinen Feiertag oder Sonnabend, so endet die Frist mit Ablauf des nächsten Werktages.\nDer Widerspruch muss die Bezeichnung der angefochtenen Verfügung sowie die Erklärung enthalten, dass Widerspruch gegen diese Verfügung eingelegt wird. Er ist zu unterzeichnen und soll begründet werden."
    },
    {
      "date": "2025-01-17",
      "id": "98926",
      "original_text": "Löschungsankündigung\nNordrhein-Westfalen Amtsgericht Hamm HRB 7888\nHeiermann Verkehrsbildung und Berufskraftfahrer UG (haftungsbeschränkt) – Hamm",
      "type": "Löschungsankündigung",
      "state": "Nordrhein-Westfalen",
      "amtsgericht": "Amtsgericht Hamm",
      "registernummer": "HRB 7888",
      "registerart": "HRB",
      "company_name": "Heiermann Verkehrsbildung und Berufskraftfahrer UG (haftungsbeschränkt)",
      "company_seat": "Hamm",
      "details": "17.01.2025 (Bekanntmachungsdatum)\n\nNordrhein-Westfalen Amtsgericht Hamm HRB 7888\nLöschungsankündigung\n\nHeiermann Verkehrsbildung und Berufskraftfahrer UG (haftungsbeschränkt)\nGesellschaft mit beschränkter Haftung\nHamm\n\nDas Registergericht beabsichtigt die Gesellschaft von Amts wegen nach § 394 FamFG zu löschen. Die Frist zur Erhebung eines Widerspruchs ist auf drei Monate festgesetzt."
    },
    {
      "date": "2025-01-17",
      "id": "98927",
      "original_text": "Registerbekanntmachung nach dem Umwandlungsgesetz\nNordrhein-Westfalen Amtsgericht Paderborn HRA 5819\nWiesmann Gerüstbau e.K. – Borgentreich",
      "type": "Registerbekanntmachung nach dem Umwandlungsgesetz",
      "state": "Nordrhein-Westfalen",
      "amtsgericht": "Amtsgericht Paderborn",
      "registernummer": "HRA 5819",
      "registerart": "HRA",
      "company_name": "Wiesmann Gerüstbau e.K.",
      "company_seat": "Borgentreich",
      "details": "17.01.2025 (Bekanntmachungsdatum)\n\nNordrhein-Westfalen Amtsgericht Paderborn HRA 5819\nRegisterbekanntmachung nach dem Umwandlungsgesetz 17.01.2025 (Eintragungsdatum)\n\nWiesmann Gerüstbau e.K.\nEinzelkaufmann / Einzelkauffrau\nBorgentreich\n\nDen Gläubigern der an der Ausgliederung beteiligten Rechtsträger ist, wenn sie binnen sechs Monaten nach dem Tag, an dem die Eintragung der Ausgliederung in das Register des Sitzes desjenigen Rechtsträgers, dessen Gläubiger sie sind, nach § 19 Absatz 3 UmwG als bekanntgemacht gilt, ihren Anspruch nach Grund und Höhe schriftlich anmelden, Sicherheit zu leisten, soweit sie nicht Befriedigung verlangen können. Dieses Recht steht den Gläubigern jedoch nur zu, wenn sie glaubhaft machen, dass durch die Ausgliederung die Erfüllung ihrer Forderung gefährdet wird."
    },
    {
      "date": "2025-01-17",
      "id": "98928",
      "original_text": "Einreichung neuer Dokumente\nNordrhein-Westfalen Amtsgericht Aachen HRB 24165\numlaut SE – Aachen",
      "type": "Einreichung neuer Dokumente",
      "state": "Nordrhein-Westfalen",
      "amtsgericht": "Amtsgericht Aachen",
      "registernummer": "HRB 24165",
      "registerart": "HRB",
      "company_name": "umlaut SE",
      "company_seat": "Aachen",
      "details": "17.01.2025 (Bekanntmachungsdatum)\n\nNordrhein-Westfalen Amtsgericht Aachen HRB 24165\nEinreichung neuer Dokumente\n\numlaut SE\nEuropäische Aktiengesellschaft (SE)\nAachen\n\nDem Registergericht ist eine neue Liste der Mitglieder des Aufsichtsrates eingereicht worden."
    },
    {
      "date": "2025-01-17",
      "id": "98929",
      "original_text": "Einreichung neuer Dokumente\nNordrhein-Westfalen Amtsgericht Arnsberg HRB 15224\nJosefs-Gesellschaft gAG – Olsberg",
      "type": "Einreichung neuer Dokumente",
      "state": "Nordrhein-Westfalen",
      "amtsgericht": "Amtsgericht Arnsberg",
      "registernummer": "HRB 15224",
      "registerart": "HRB",
      "company_name": "Josefs-Gesellschaft gAG",
      "company_seat": "Olsberg",
      "details": "17.01.2025 (Bekanntmachungsdatum)\n\nNordrhein-Westfalen Amtsgericht Arnsberg HRB 15224\nEinreichung neuer Dokumente\n\nJosefs-Gesellschaft gAG\nAktiengesellschaft\nOlsberg\n\nDem Registergericht ist eine neue Liste der Mitglieder des Aufsichtsrates eingereicht worden."
    },
    {
      "date": "2025-01-17",
      "id": "98930",
      "original_text": "Registerbekanntmachung nach dem Umwandlungsgesetz\nNordrhein-Westfalen Amtsgericht Bad Oeynhausen HRB 17989\ngreeneps GmbH – Hiddenhausen",
      "type": "Registerbekanntmachung nach dem Umwandlungsgesetz",
      "state": "Nordrhein-Westfalen",
      "amtsgericht": "Amtsgericht Bad Oeynhausen",
      "registernummer": "HRB 17989",
      "registerart": "HRB",
      "company_name": "greeneps GmbH",
      "company_seat": "Hiddenhausen",
      "details": "17.01.2025 (Bekanntmachungsdatum)\n\nNordrhein-Westfalen Amtsgericht Bad Oeynhausen HRB 17989\nRegisterbekanntmachung nach dem Umwandlungsgesetz 17.01.2025 (Eintragungsdatum)\n\ngreeneps GmbH\nGesellschaft mit beschränkter Haftung\nHiddenhausen\n\nDen Gläubigern der an der Verschmelzung beteiligten Rechtsträger ist, wenn sie binnen sechs Monaten nach dem Tag, an dem die Eintragung der Verschmelzung in das Register des Sitzes desjenigen Rechtsträgers, dessen Gläubiger sie sind, nach § 19 Absatz 3 UmwG als bekanntgemacht gilt, ihren Anspruch nach Grund und Höhe schriftlich anmelden, Sicherheit zu leisten, soweit sie nicht Befriedigung verlangen können. Dieses Recht steht den Gläubigern jedoch nur zu, wenn sie glaubhaft machen, dass durch die Verschmelzung die Erfüllung ihrer Forderung gefährdet wird."
    },
    {
      "date": "2025-01-17",
      "id": "98931",
      "original_text": "Löschungsankündigung\nNordrhein-Westfalen Amtsgericht Mönchengladbach HRB 10764\nNeue Energie- und Umwelttechnik ETU GmbH – Viersen",
      "type": "Löschungsankündigung",
      "state": "Nordrhein-Westfalen",
      "amtsgericht": "Amtsgericht Mönchengladbach",
      "registernummer": "HRB 10764",
      "registerart": "HRB",
      "company_name": "Neue Energie- und Umwelttechnik ETU GmbH",
      "company_seat": "Viersen",
      "details": "17.01.2025 (Bekanntmachungsdatum)\n\nNordrhein-Westfalen Amtsgericht Mönchengladbach HRB 10764\nLöschungsankündigung\n\nNeue Energie- und Umwelttechnik ETU GmbH\nGesellschaft mit beschränkter Haftung\nViersen\n\nDas Registergericht beabsichtigt die Gesellschaft von Amts wegen nach § 394 FamFG zu löschen. Die Frist zur Erhebung eines Widerspruchs ist auf drei Monate festgesetzt."
    },
    {
      "date": "2025-01-17",
      "id": "98932",
      "original_text": "Löschungsankündigung\nBremen Amtsgericht Bremen HRB 26776\nCarisbrooke Shipping (Germany) GmbH – Bremen",
      "type": "Löschungsankündigung",
      "state": "Bremen",
      "amtsgericht": "Amtsgericht Bremen",
      "registernummer": "HRB 26776",
      "registerart": "HRB",
      "company_name": "Carisbrooke Shipping (Germany) GmbH",
      "company_seat": "Bremen",
      "details": "17.01.2025 (Bekanntmachungsdatum)\n\nBremen Amtsgericht Bremen HRB 26776\nLöschungsankündigung\n\nCarisbrooke Shipping (Germany) GmbH\nGesellschaft mit beschränkter Haftung\nBremen\n\nEs ist beabsichtigt die im Handelsregister eingetragene Gesellschaft von Amts wegen gemäß § 394 FamFG zu löschen. Gegen die Löschung kann beim AG Bremen schriftlich oder zu Protokoll der Geschäftsstelle Widerspruch eingelegt werden. Widerspruchsfrist 4 Wochen."
    },
    {
      "date": "2025-01-17",
      "id": "98933",
      "original_text": "Löschungsankündigung\nBremen Amtsgericht Bremen HRB 28403\nAIR AKTIV HANSAKLIMA UG (haftungsbeschränkt) – Bremen",
      "type": "Löschungsankündigung",
      "state": "Bremen",
      "amtsgericht": "Amtsgericht Bremen",
      "registernummer": "HRB 28403",
      "registerart": "HRB",
      "company_name": "AIR AKTIV HANSAKLIMA UG (haftungsbeschränkt)",
      "company_seat": "Bremen",
      "details": "17.01.2025 (Bekanntmachungsdatum)\n\nBremen Amtsgericht Bremen HRB 28403\nLöschungsankündigung\n\nAIR AKTIV HANSAKLIMA UG (haftungsbeschränkt)\nGesellschaft mit beschränkter Haftung\nBremen\n\nEs ist beabsichtigt die im Handelsregister eingetragene Gesellschaft von Amts wegen gemäß § 394 FamFG zu löschen. Gegen die Löschung kann beim AG Bremen schriftlich oder zu Protokoll der Geschäftsstelle Widerspruch eingelegt werden. Widerspruchsfrist 4 Wochen."
    },
    {
      "date": "2025-01-17",
      "id": "98934",
      "original_text": "Löschungsankündigung\nNordrhein-Westfalen Amtsgericht Köln HRB 71519\nH & S Haustechnik Verwaltungs-GmbH – Köln",
      "type": "Löschungsankündigung",
      "state": "Nordrhein-Westfalen",
      "amtsgericht": "Amtsgericht Köln",
      "registernummer": "HRB 71519",
      "registerart": "HRB",
      "company_name": "H & S Haustechnik Verwaltungs-GmbH",
      "company_seat": "Köln",
      "details": "17.01.2025 (Bekanntmachungsdatum)\n\nNordrhein-Westfalen Amtsgericht Köln HRB 71519\nLöschungsankündigung\n\nH & S Haustechnik Verwaltungs-GmbH\nGesellschaft mit beschränkter Haftung\nKöln\n\nDas Registergericht beabsichtigt die Gesellschaft von Amts wegen nach § 394 FamFG zu löschen. Die Frist zur Erhebung eines Widerspruchs ist auf einen Monat festgesetzt."
    },
    {
      "date": "2025-01-17",
      "id": "98935",
      "original_text": "Löschungsankündigung\nNordrhein-Westfalen Amtsgericht Düsseldorf HRB 89576\nto5 GmbH – Düsseldorf",
      "type": "Löschungsankündigung",
      "state": "Nordrhein-Westfalen",
      "amtsgericht": "Amtsgericht Düsseldorf",
      "registernummer": "HRB 89576",
      "registerart": "HRB",
      "company_name": "to5 GmbH",
      "company_seat": "Düsseldorf",
      "details": "17.01.2025 (Bekanntmachungsdatum)\n\nNordrhein-Westfalen Amtsgericht Düsseldorf HRB 89576\nLöschungsankündigung\n\nto5 GmbH\nGesellschaft mit beschränkter Haftung\nDüsseldorf\n\nDas Registergericht beabsichtigt die Gesellschaft von Amts wegen nach § 394 FamFG zu löschen. Die Frist zur Erhebung eines Widerspruchs ist auf #DV.Fr(Text=\"Bitte wählen Sie die Widerspruchsfrist aus!\",Eingabe=\"einen Monat\",\"zwei Monate\",\"drei Monate\",\"#insert(Text=\"Freitext\")\"|\"freier Text\") festgesetzt.\n\nRechtsbehelfsbelehrung:\nDas Widerspruchsrecht steht jedem zu, der an der Unterlassung der Löschung ein berechtigtes Interesse hat. Der Widerspruch ist bei dem Amtsgericht Düsseldorf -Registergericht-, Werdener Straße 1, 40227 Düsseldorf schriftlich in deutscher Sprache oder zur Niederschrift der Geschäftsstelle einzulegen. Der Widerspruch kann auch zur Niederschrift der Geschäftsstelle eines jeden Amtsgerichtes abgegeben werden. Die Einlegung ist auch durch Übertragung eines elektronischen Dokuments an die elektronische Poststelle des Gerichts möglich. Das elektronische Dokument muss für die Bearbeitung durch das Gericht geeignet und mit einer qualifizierten elektronischen Signatur der verantwortenden Person versehen sein oder von der verantwortenden Person signiert und auf einem sicheren Übermittlungsweg gemäß § 130a ZPO nach näherer Maßgabe der Verordnung über die technischen Rahmenbedingungen des elektronischen Rechtsverkehrs und über das besondere elektronische Behördenpostfach (BGBl. I, S.3803) eingereicht werden. Weitere Informationen erhalten Sie auf der Internetseite www.justiz.de.\nDer Widerspruch muss spätestens innerhalb der gesetzten Frist nach dem Datum der Bekanntmachung der Löschungsankündigung bei dem Amtsgericht - Registergericht - Düsseldorf eingegangen sein.  Dies gilt auch dann, wenn der Widerspruch zur Niederschrift der Geschäftsstelle eines anderen Amtsgerichtes abgegeben wurde. Die Frist beginnt mit dem Tage der Bekanntmachung der Löschungsankündigung in dem für die Bekanntmachung der Eintragungen in das Handelsregister bestimmten elektronischen Informations- und Kommunikationssystem nach § 10 des Handelsgesetzbuches. Fällt das Ende der Frist auf einen Sonntag, einen allgemeinen Feiertag oder Sonnabend, so endet die Frist mit Ablauf des nächsten Werktages.\nDer Widerspruch muss die Bezeichnung der angefochtenen Löschungsankündigung sowie die Erklärung enthalten, dass Widerspruch gegen diese Löschungsankündigung eingelegt wird. Er ist zu unterzeichnen und soll begründet werden."
    },
    {
      "date": "2025-01-17",
      "id": "98936",
      "original_text": "Registerbekanntmachung nach dem Umwandlungsgesetz\nNordrhein-Westfalen Amtsgericht Paderborn VR 1324\nDer Paritätische Förderverein für soziale Arbeit im Kreis Paderborn – Paderborn",
      "type": "Registerbekanntmachung nach dem Umwandlungsgesetz",
      "state": "Nordrhein-Westfalen",
      "amtsgericht": "Amtsgericht Paderborn",
      "registernummer": "VR 1324",
      "registerart": "VR",
      "company_name": "Der Paritätische Förderverein für soziale Arbeit im Kreis Paderborn",
      "company_seat": "Paderborn",
      "details": "17.01.2025 (Bekanntmachungsdatum)\n\nNordrhein-Westfalen Amtsgericht Paderborn VR 1324\nRegisterbekanntmachung nach dem Umwandlungsgesetz 17.01.2025 (Eintragungsdatum)\n\nDer Paritätische Förderverein für soziale Arbeit im Kreis Paderborn\neingetragener Verein\nPaderborn\n\nDen Gläubigern der an der Verschmelzung beteiligten Rechtsträger ist, wenn sie binnen sechs Monaten nach dem Tag, an dem die Eintragung der Verschmelzung in das Register des Sitzes derjenigen Rechtsträger deren Gläubiger sie sind, nach § 19 Absatz 3 UmwG als bekanntgemacht gilt, ihren Anspruch nach Grund und Höhe schriftlich anmelden, Sicherheit zu leisten, soweit sie nicht Befriedigung verlangen können. Dieses Recht steht den Gläubigern jedoch nur zu, wenn sie glaubhaft machen, dass durch die Verschmelzung die Erfüllung ihrer Forderung gefährdet wird."
    },
    {
      "date": "2025-01-17",
      "id": "98937",
      "original_text": "Einreichung neuer Dokumente\nNordrhein-Westfalen Amtsgericht Bielefeld HRB 38144\nDRK Bielefeld Martha-Stapenhorst-Heim gGmbH – Bielefeld",
      "type": "Einreichung neuer Dokumente",
      "state": "Nordrhein-Westfalen",
      "amtsgericht": "Amtsgericht Bielefeld",
      "registernummer": "HRB 38144",
      "registerart": "HRB",
      "company_name": "DRK Bielefeld Martha-Stapenhorst-Heim gGmbH",
      "company_seat": "Bielefeld",
      "details": "17.01.2025 (Bekanntmachungsdatum)\n\nNordrhein-Westfalen Amtsgericht Bielefeld HRB 38144\nEinreichung neuer Dokumente 17.01.2025 (Eintragungsdatum)\n\nDRK Bielefeld Martha-Stapenhorst-Heim gGmbH\nGesellschaft mit beschränkter Haftung\nBielefeld\n\nDem Registergericht ist eine Liste der Mitglieder des Aufsichtsrates eingereicht worden."
    },
    {
      "date": "2025-01-17",
      "id": "98938",
      "original_text": "Sonstige Registerbekanntmachung\nNordrhein-Westfalen Amtsgericht Köln HRB 86880\nspeakeasy Sprachen+ UG (haftungsbeschränkt) – Köln",
      "type": "Sonstige Registerbekanntmachung",
      "state": "Nordrhein-Westfalen",
      "amtsgericht": "Amtsgericht Köln",
      "registernummer": "HRB 86880",
      "registerart": "HRB",
      "company_name": "speakeasy Sprachen+ UG (haftungsbeschränkt)",
      "company_seat": "Köln",
      "details": "17.01.2025 (Bekanntmachungsdatum)\n\nNordrhein-Westfalen Amtsgericht Köln HRB 86880\nSonstige Registerbekanntmachung 17.01.2025 (Eintragungsdatum)\n\nspeakeasy Sprachen+ UG (haftungsbeschränkt)\nGesellschaft mit beschränkter Haftung\nKöln\n\nAls nicht eingetragen wird veröffentlicht: Den Gläubigern der Gesellschaft, deren Forderungen begründet worden sind bevor die Eintragung der Beendigung des Gewinnabführungsvertrages  in das Handelsregister nach § 10 des Handelsgesetzbuches als bekanntgemacht gilt, hat der andere Vertragsteil Sicherheit zu leisten, wenn sie sich binnen sechs Monaten nach der Bekanntmachung der Eintragung zu diesem Zweck bei ihm melden."
    },
    {
      "date": "2025-01-17",
      "id": "98939",
      "original_text": "Registerbekanntmachung nach dem Umwandlungsgesetz\nNordrhein-Westfalen Amtsgericht Bad Oeynhausen HRB 19013\nxolarc GmbH – Hiddenhausen",
      "type": "Registerbekanntmachung nach dem Umwandlungsgesetz",
      "state": "Nordrhein-Westfalen",
      "amtsgericht": "Amtsgericht Bad Oeynhausen",
      "registernummer": "HRB 19013",
      "registerart": "HRB",
      "company_name": "xolarc GmbH",
      "company_seat": "Hiddenhausen",
      "details": "17.01.2025 (Bekanntmachungsdatum)\n\nNordrhein-Westfalen Amtsgericht Bad Oeynhausen HRB 19013\nRegisterbekanntmachung nach dem Umwandlungsgesetz 17.01.2025 (Eintragungsdatum)\n\nxolarc GmbH\nGesellschaft mit beschränkter Haftung\nHiddenhausen\n\nDen Gläubigern der an der Verschmelzung beteiligten Rechtsträger ist, wenn sie binnen sechs Monaten nach dem Tag, an dem die Eintragung der Verschmelzung in das Register des Sitzes desjenigen Rechtsträgers, dessen Gläubiger sie sind, nach § 19 Absatz 3 UmwG als bekanntgemacht gilt, ihren Anspruch nach Grund und Höhe schriftlich anmelden, Sicherheit zu leisten, soweit sie nicht Befriedigung verlangen können. Dieses Recht steht den Gläubigern jedoch nur zu, wenn sie glaubhaft machen, dass durch die Verschmelzung die Erfüllung ihrer Forderung gefährdet wird."
    },
    {
      "date": "2025-01-17",
      "id": "98940",
      "original_text": "Löschungsankündigung\nNordrhein-Westfalen Amtsgericht Dortmund HRB 29621\nMOVMAX UG (haftungsbeschränkt) – Dortmund",
      "type": "Löschungsankündigung",
      "state": "Nordrhein-Westfalen",
      "amtsgericht": "Amtsgericht Dortmund",
      "registernummer": "HRB 29621",
      "registerart": "HRB",
      "company_name": "MOVMAX UG (haftungsbeschränkt)",
      "company_seat": "Dortmund",
      "details": "17.01.2025 (Bekanntmachungsdatum)\n\nNordrhein-Westfalen Amtsgericht Dortmund HRB 29621\nLöschungsankündigung\n\nMOVMAX UG (haftungsbeschränkt)\nGesellschaft mit beschränkter Haftung\nDortmund\n\nDas Registergericht beabsichtigt die Gesellschaft von Amts wegen nach § 394 FamFG zu löschen. Die Frist zur Erhebung eines Widerspruchs ist auf zwei Monate festgesetzt."
    },
    {
      "date": "2025-01-17",
      "id": "98941",
      "original_text": "Registerbekanntmachung nach dem Umwandlungsgesetz\nHessen Amtsgericht Kassel HRB 5671\nTop Ten GmbH – Kassel",
      "type": "Registerbekanntmachung nach dem Umwandlungsgesetz",
      "state": "Hessen",
      "amtsgericht": "Amtsgericht Kassel",
      "registernummer": "HRB 5671",
      "registerart": "HRB",
      "company_name": "Top Ten GmbH",
      "company_seat": "Kassel",
      "details": "17.01.2025 (Bekanntmachungsdatum)\n\nHessen Amtsgericht Kassel HRB 5671\nRegisterbekanntmachung nach dem Umwandlungsgesetz 17.01.2025 (Eintragungsdatum)\n\nTop Ten GmbH\nGesellschaft mit beschränkter Haftung\nKassel\n\nDen Gläubigern der an der Verschmelzung beteiligten Rechtsträger ist, wenn sie binnen sechs Monaten nach dem Tag, an dem die Eintragung der Verschmelzung in das Register des Sitzes desjenigen Rechtsträgers, dessen Gläubiger sie sind, nach § 19 Absatz 3 UmwG bekannt gemacht worden ist, ihren Anspruch nach Grund und Höhe schriftlich anmelden, Sicherheit zu leisten, soweit sie nicht Befriedigung verlangen können. Dieses Recht steht den Gläubigern jedoch nur zu, wenn sie glaubhaft machen, dass durch die Verschmelzung die Erfüllung ihrer Forderung gefährdet wird."
    },
    {
      "date": "2025-01-17",
      "id": "98942",
      "original_text": "Sonstige Registerbekanntmachung\nHessen Amtsgericht Offenbach am Main VR 5026\nRegenbogen – Offenbach am Main",
      "type": "Sonstige Registerbekanntmachung",
      "state": "Hessen",
      "amtsgericht": "Amtsgericht Offenbach am Main",
      "registernummer": "VR 5026",
      "registerart": "VR",
      "company_name": "Regenbogen",
      "company_seat": "Offenbach am Main",
      "details": "17.01.2025 (Bekanntmachungsdatum)\n\nHessen Amtsgericht Offenbach am Main VR 5026\nSonstige Registerbekanntmachung 17.01.2025 (Eintragungsdatum)\n\nRegenbogen\neingetragener Verein\nOffenbach am Main\n\nDer Verein ist aufgelöst."
    },
    {
      "date": "2025-01-17",
      "id": "98943",
      "original_text": "Sonstige Registerbekanntmachung\nHessen Amtsgericht Fritzlar HRB 11270\nDagopower-Aktiengesellschaft – Malsfeld",
      "type": "Sonstige Registerbekanntmachung",
      "state": "Hessen",
      "amtsgericht": "Amtsgericht Fritzlar",
      "registernummer": "HRB 11270",
      "registerart": "HRB",
      "company_name": "Dagopower-Aktiengesellschaft",
      "company_seat": "Malsfeld",
      "details": "17.01.2025 (Bekanntmachungsdatum)\n\nHessen Amtsgericht Fritzlar HRB 11270\nSonstige Registerbekanntmachung 17.01.2025 (Eintragungsdatum)\n\nDagopower-Aktiengesellschaft\nAktiengesellschaft\nMalsfeld\n\nDurch eine Änderung in den Personen der Aufsichtsratsmitglieder ist eine Liste der Mitglieder des Aufsichtsrates zum Handelsregister eingereicht worden."
    },
    {
      "date": "2025-01-17",
      "id": "98944",
      "original_text": "Einreichung neuer Dokumente\nHessen Amtsgericht Frankfurt am Main HRB 131080\nBank Pictet & Cie (Europe) AG – Frankfurt am Main",
      "type": "Einreichung neuer Dokumente",
      "state": "Hessen",
      "amtsgericht": "Amtsgericht Frankfurt am Main",
      "registernummer": "HRB 131080",
      "registerart": "HRB",
      "company_name": "Bank Pictet & Cie (Europe) AG",
      "company_seat": "Frankfurt am Main",
      "details": "17.01.2025 (Bekanntmachungsdatum)\n\nHessen Amtsgericht Frankfurt am Main HRB 131080\nEinreichung neuer Dokumente 17.01.2025 (Eintragungsdatum)\n\nBank Pictet & Cie (Europe) AG\nAktiengesellschaft\nFrankfurt am Main\n\nDurch eine Änderung in den Personen der Aufsichtsratsmitglieder ist eine Liste der Mitglieder des Aufsichtsrates zum Handelsregister eingereicht worden."
    },
    {
      "date": "2025-01-17",
      "id": "98945",
      "original_text": "Registerbekanntmachung nach dem Umwandlungsgesetz\nHessen Amtsgericht Kassel HRA 17282\nHübner GmbH & Co. KG – Kassel",
      "type": "Registerbekanntmachung nach dem Umwandlungsgesetz",
      "state": "Hessen",
      "amtsgericht": "Amtsgericht Kassel",
      "registernummer": "HRA 17282",
      "registerart": "HRA",
      "company_name": "Hübner GmbH & Co. KG",
      "company_seat": "Kassel",
      "details": "17.01.2025 (Bekanntmachungsdatum)\n\nHessen Amtsgericht Kassel HRA 17282\nRegisterbekanntmachung nach dem Umwandlungsgesetz 17.01.2025 (Eintragungsdatum)\n\nHübner GmbH & Co. KG\nKommanditgesellschaft\nKassel\n\nDen Gläubigern der an der Verschmelzung beteiligten Rechtsträger ist, wenn sie binnen sechs Monaten nach dem Tag, an dem die Eintragung der Verschmelzung in das Register des Sitzes desjenigen Rechtsträgers, dessen Gläubiger sie sind, nach § 19 Absatz 3 UmwG bekannt gemacht worden ist, ihren Anspruch nach Grund und Höhe schriftlich anmelden, Sicherheit zu leisten, soweit sie nicht Befriedigung verlangen können. Dieses Recht steht den Gläubigern jedoch nur zu, wenn sie glaubhaft machen, dass durch die Verschmelzung die Erfüllung ihrer Forderung gefährdet wird."
    },
    {
      "date": "2025-01-17",
      "id": "98946",
      "original_text": "Registerbekanntmachung nach dem Umwandlungsgesetz\nHessen Amtsgericht Offenbach am Main HRB 57515\nDimar Holding GmbH – Neu-Isenburg",
      "type": "Registerbekanntmachung nach dem Umwandlungsgesetz",
      "state": "Hessen",
      "amtsgericht": "Amtsgericht Offenbach am Main",
      "registernummer": "HRB 57515",
      "registerart": "HRB",
      "company_name": "Dimar Holding GmbH",
      "company_seat": "Neu-Isenburg",
      "details": "17.01.2025 (Bekanntmachungsdatum)\n\nHessen Amtsgericht Offenbach am Main HRB 57515\nRegisterbekanntmachung nach dem Umwandlungsgesetz 17.01.2025 (Eintragungsdatum)\n\nDimar Holding GmbH\nGesellschaft mit beschränkter Haftung\nNeu-Isenburg\n\nDen Gläubigern der an der Verschmelzung beteiligten Rechtsträger ist, wenn sie binnen sechs Monaten nach dem Tag, an dem die Eintragung der Verschmelzung in das Register des Sitzes desjenigen Rechtsträgers, dessen Gläubiger sie sind, nach § 19 Absatz 3 UmwG bekannt gemacht worden ist, ihren Anspruch nach Grund und Höhe schriftlich anmelden, Sicherheit zu leisten, soweit sie nicht Befriedigung verlangen können. Dieses Recht steht den Gläubigern jedoch nur zu, wenn sie glaubhaft machen, dass durch die Verschmelzung die Erfüllung ihrer Forderung gefährdet wird."
    }
  ]
}