{
  "date": "2025-01-22",
  "date_of_scrape": "2025-01-23T04:07:26.083Z",
  "tool_version": "0.2.0",
  "number_of_announcements": 137,
  "announcements": [
    {
      "date": "2025-01-22",
      "id": "99182",
      "original_text": "Registerbekanntmachung nach dem Umwandlungsgesetz\nBayern Amtsgericht Bamberg HRA 13299\nRobert Leopold e.K. – Forchheim",
      "type": "Registerbekanntmachung nach dem Umwandlungsgesetz",
      "state": "Bayern",
      "amtsgericht": "Amtsgericht Bamberg",
      "registernummer": "HRA 13299",
      "registerart": "HRA",
      "company_name": "Robert Leopold e.K.",
      "company_seat": "Forchheim",
      "details": "22.01.2025 (Bekanntmachungsdatum)\n\nBayern Amtsgericht Bamberg HRA 13299\nRegisterbekanntmachung nach dem Umwandlungsgesetz 21.01.2025 (Eintragungsdatum)\n\nRobert Leopold e.K.\nEinzelkaufmann / Einzelkauffrau\nForchheim\n\nDen Gläubigern der an der Ausgliederung beteiligten Rechtsträger ist, wenn sie binnen sechs Monaten nach dem Tag, an dem die Eintragung der Ausgliederung in das Register des Sitzes desjenigen Rechtsträgers, dessen Gläubiger sie sind, nach §§ 125, 19 Abs. 3 UmwG als bekannt gemacht gilt, ihren Anspruch nach Grund und Höhe in Textform anmelden, Sicherheit zu leisten, soweit sie nicht Befriedigung verlangen können. Dieses Recht steht den Gläubigern jedoch nur zu, wenn sie glaubhaft machen, dass durch die Ausgliederung die Erfüllung ihrer Forderung gefährdet wird."
    },
    {
      "date": "2025-01-22",
      "id": "99183",
      "original_text": "Registerbekanntmachung nach dem Umwandlungsgesetz\nBayern Amtsgericht München HRB 194919\nREFINA Vermögensverwaltungs GmbH & Co. KGaA – Pullach i. Isartal",
      "type": "Registerbekanntmachung nach dem Umwandlungsgesetz",
      "state": "Bayern",
      "amtsgericht": "Amtsgericht München",
      "registernummer": "HRB 194919",
      "registerart": "HRB",
      "company_name": "REFINA Vermögensverwaltungs GmbH & Co. KGaA",
      "company_seat": "Pullach i. Isartal",
      "details": "22.01.2025 (Bekanntmachungsdatum)\n\nBayern Amtsgericht München HRB 194919\nRegisterbekanntmachung nach dem Umwandlungsgesetz 21.01.2025 (Eintragungsdatum)\n\nREFINA Vermögensverwaltungs GmbH & Co. KGaA\nKommanditgesellschaft auf Aktien\nPullach i. Isartal\n\nDen Gläubigern des formwechselnden Rechtsträgers ist, wenn sie binnen sechs Monaten nach dem Tag, an dem die Eintragung des Formwechsels nach § 201 UmwG als bekannt gemacht gilt, ihren Anspruch nach Grund und Höhe in Textform anmelden, Sicherheit zu leisten, soweit sie nicht Befriedigung verlangen können. Dieses Recht steht den Gläubigern jedoch nur zu, wenn sie glaubhaft machen, dass durch den Formwechsel die Erfüllung ihrer Forderung gefährdet wird."
    },
    {
      "date": "2025-01-22",
      "id": "99184",
      "original_text": "Einreichung neuer Dokumente\nBayern Amtsgericht München HRB 135571\nitl Institut für technische Literatur AG – München",
      "type": "Einreichung neuer Dokumente",
      "state": "Bayern",
      "amtsgericht": "Amtsgericht München",
      "registernummer": "HRB 135571",
      "registerart": "HRB",
      "company_name": "itl Institut für technische Literatur AG",
      "company_seat": "München",
      "details": "22.01.2025 (Bekanntmachungsdatum)\n\nBayern Amtsgericht München HRB 135571\nEinreichung neuer Dokumente 21.01.2025 (Eintragungsdatum)\n\nitl Institut für technische Literatur AG\nAktiengesellschaft\nMünchen\n\nDem Amtsgericht München -Registergericht- ist eine Liste der Mitglieder des Aufsichtsrats eingereicht worden, § 106 AktG."
    },
    {
      "date": "2025-01-22",
      "id": "99185",
      "original_text": "Registerbekanntmachung nach dem Umwandlungsgesetz\nBayern Amtsgericht Weiden i. d. OPf. HRA 2613\nJoKa Kaffee-Service e.K. – Wiesau",
      "type": "Registerbekanntmachung nach dem Umwandlungsgesetz",
      "state": "Bayern",
      "amtsgericht": "Amtsgericht Weiden i. d. OPf.",
      "registernummer": "HRA 2613",
      "registerart": "HRA",
      "company_name": "JoKa Kaffee-Service e.K.",
      "company_seat": "Wiesau",
      "details": "22.01.2025 (Bekanntmachungsdatum)\n\nBayern Amtsgericht Weiden i. d. OPf. HRA 2613\nRegisterbekanntmachung nach dem Umwandlungsgesetz 21.01.2025 (Eintragungsdatum)\n\nJoKa Kaffee-Service e.K.\nEinzelkaufmann / Einzelkauffrau\nWiesau\n\nDen Gläubigern der an der Ausgliederung beteiligten Rechtsträger ist, wenn sie binnen sechs Monaten nach dem Tag, an dem die Eintragung der Ausgliederung in das Register des Sitzes desjenigen Rechtsträgers, dessen Gläubiger sie sind, nach §§ 125, 19 Abs. 3 UmwG als bekannt gemacht gilt, ihren Anspruch nach Grund und Höhe in Textform anmelden, Sicherheit zu leisten, soweit sie nicht Befriedigung verlangen können. Dieses Recht steht den Gläubigern jedoch nur zu, wenn sie glaubhaft machen, dass durch die Ausgliederung die Erfüllung ihrer Forderung gefährdet wird."
    },
    {
      "date": "2025-01-22",
      "id": "99186",
      "original_text": "Löschungsankündigung\nBayern Amtsgericht München HRB 88210\nCEJAD Gesellschaft mit beschränkter Haftung – München",
      "type": "Löschungsankündigung",
      "state": "Bayern",
      "amtsgericht": "Amtsgericht München",
      "registernummer": "HRB 88210",
      "registerart": "HRB",
      "company_name": "CEJAD Gesellschaft mit beschränkter Haftung",
      "company_seat": "München",
      "details": "22.01.2025 (Bekanntmachungsdatum)\n\nBayern Amtsgericht München HRB 88210\nLöschungsankündigung 21.01.2025 (Eintragungsdatum)\n\nCEJAD Gesellschaft mit beschränkter Haftung\nGesellschaft mit beschränkter Haftung\nMünchen\n\nDas Registergericht beabsichtigt, die im Handelsregister eingetragene Gesellschaft wegen Vermögenslosigkeit von Amts wegen nach § 394 FamFG zu löschen. Die Frist zur Erhebung eines Widerspruchs ist auf drei Monate festgesetzt."
    },
    {
      "date": "2025-01-22",
      "id": "99187",
      "original_text": "Löschungsankündigung\nBayern Amtsgericht Aschaffenburg HRA 3760\nJet-Transporte e.K. – Kahl am Main",
      "type": "Löschungsankündigung",
      "state": "Bayern",
      "amtsgericht": "Amtsgericht Aschaffenburg",
      "registernummer": "HRA 3760",
      "registerart": "HRA",
      "company_name": "Jet-Transporte e.K.",
      "company_seat": "Kahl am Main",
      "details": "22.01.2025 (Bekanntmachungsdatum)\n\nBayern Amtsgericht Aschaffenburg HRA 3760\nLöschungsankündigung\n\nJet-Transporte e.K.\nEinzelkaufmann / Einzelkauffrau\nKahl am Main\n\nDas Registergericht beabsichtigt, die im Handelsregister eingetragene Firma von Amts wegen nach § 31 Abs. 2 HGB iVm 393 FamFG zu löschen. Die Frist zur Erhebung eines Widerspruchs ist auf drei Monate festgesetzt."
    },
    {
      "date": "2025-01-22",
      "id": "99188",
      "original_text": "Einreichung neuer Dokumente\nBayern Amtsgericht München HRB 168973\nLeaseForce AG – München",
      "type": "Einreichung neuer Dokumente",
      "state": "Bayern",
      "amtsgericht": "Amtsgericht München",
      "registernummer": "HRB 168973",
      "registerart": "HRB",
      "company_name": "LeaseForce AG",
      "company_seat": "München",
      "details": "22.01.2025 (Bekanntmachungsdatum)\n\nBayern Amtsgericht München HRB 168973\nEinreichung neuer Dokumente\n\nLeaseForce AG\nAktiengesellschaft\nMünchen\n\nDem Amtsgericht München -Registergericht- ist eine Liste der Mitglieder des Aufsichtsrats eingereicht worden, § 106 AktG."
    },
    {
      "date": "2025-01-22",
      "id": "99189",
      "original_text": "Sonstige Registerbekanntmachung\nBayern Amtsgericht Hof HRB 771\nGetränke Lippert GmbH – Hof (Saale)",
      "type": "Sonstige Registerbekanntmachung",
      "state": "Bayern",
      "amtsgericht": "Amtsgericht Hof",
      "registernummer": "HRB 771",
      "registerart": "HRB",
      "company_name": "Getränke Lippert GmbH",
      "company_seat": "Hof (Saale)",
      "details": "22.01.2025 (Bekanntmachungsdatum)\n\nBayern Amtsgericht Hof HRB 771\nSonstige Registerbekanntmachung 21.01.2025 (Eintragungsdatum)\n\nGetränke Lippert GmbH\nGesellschaft mit beschränkter Haftung\nHof (Saale)\n\nDen Gläubigern der Gesellschaft, deren Forderungen begründet worden sind, bevor die Eintragung der Beendigung des Beherrschungs- und Gewinnabführungsvertrages in das Handelsregister nach § 10 des Handelsgesetzbuches als bekanntgemacht gilt, hat der andere Vertragsteil Sicherheit zu leisten, wenn sie sich binnen sechs Monaten nach der Bekanntmachung der Eintragung zu diesem Zweck bei ihm melden."
    },
    {
      "date": "2025-01-22",
      "id": "99190",
      "original_text": "Registerbekanntmachung nach dem Umwandlungsgesetz\nBayern Amtsgericht Bamberg HRA 13308\nLeopold Liegenschaften GmbH & Co. KG – Forchheim",
      "type": "Registerbekanntmachung nach dem Umwandlungsgesetz",
      "state": "Bayern",
      "amtsgericht": "Amtsgericht Bamberg",
      "registernummer": "HRA 13308",
      "registerart": "HRA",
      "company_name": "Leopold Liegenschaften GmbH & Co. KG",
      "company_seat": "Forchheim",
      "details": "22.01.2025 (Bekanntmachungsdatum)\n\nBayern Amtsgericht Bamberg HRA 13308\nRegisterbekanntmachung nach dem Umwandlungsgesetz 21.01.2025 (Eintragungsdatum)\n\nLeopold Liegenschaften GmbH & Co. KG\nKommanditgesellschaft\nForchheim\n\nDen Gläubigern der an der Ausgliederung beteiligten Rechtsträger ist, wenn sie binnen sechs Monaten nach dem Tag, an dem die Eintragung der Ausgliederung in das Register des Sitzes desjenigen Rechtsträgers, dessen Gläubiger sie sind, nach §§ 125, 19 Abs. 3 UmwG als bekannt gemacht gilt, ihren Anspruch nach Grund und Höhe in Textform anmelden, Sicherheit zu leisten, soweit sie nicht Befriedigung verlangen können. Dieses Recht steht den Gläubigern jedoch nur zu, wenn sie glaubhaft machen, dass durch die Ausgliederung die Erfüllung ihrer Forderung gefährdet wird."
    },
    {
      "date": "2025-01-22",
      "id": "99191",
      "original_text": "Einreichung neuer Dokumente\nBayern Amtsgericht München HRB 274438\nLeaseForce Vertriebs AG – München",
      "type": "Einreichung neuer Dokumente",
      "state": "Bayern",
      "amtsgericht": "Amtsgericht München",
      "registernummer": "HRB 274438",
      "registerart": "HRB",
      "company_name": "LeaseForce Vertriebs AG",
      "company_seat": "München",
      "details": "22.01.2025 (Bekanntmachungsdatum)\n\nBayern Amtsgericht München HRB 274438\nEinreichung neuer Dokumente 03.01.2025 (Eintragungsdatum)\n\nLeaseForce Vertriebs AG\nAktiengesellschaft\nMünchen\n\nDem Amtsgericht München -Registergericht- ist eine Liste der Mitglieder des Aufsichtsrats eingereicht worden, § 106 AktG."
    },
    {
      "date": "2025-01-22",
      "id": "99192",
      "original_text": "Löschungsankündigung\nBayern Amtsgericht Passau HRB 11040\nY & T Leaders GmbH – Hauzenberg",
      "type": "Löschungsankündigung",
      "state": "Bayern",
      "amtsgericht": "Amtsgericht Passau",
      "registernummer": "HRB 11040",
      "registerart": "HRB",
      "company_name": "Y & T Leaders GmbH",
      "company_seat": "Hauzenberg",
      "details": "22.01.2025 (Bekanntmachungsdatum)\n\nBayern Amtsgericht Passau HRB 11040\nLöschungsankündigung\n\nY & T Leaders GmbH\nGesellschaft mit beschränkter Haftung\nHauzenberg\n\nDas Registergericht beabsichtigt, den  im Handelsregister eingetragenen Geschäftsführer Yaliniz Tuncay von Amts wegen nach § 395 FamFG zu löschen. Die Frist zur Erhebung eines Widerspruchs ist auf einen Monat festgesetzt."
    },
    {
      "date": "2025-01-22",
      "id": "99193",
      "original_text": "Löschungsankündigung\nBayern Amtsgericht München HRB 260813\nAO24 Number UG (haftungsbeschränkt) – München",
      "type": "Löschungsankündigung",
      "state": "Bayern",
      "amtsgericht": "Amtsgericht München",
      "registernummer": "HRB 260813",
      "registerart": "HRB",
      "company_name": "AO24 Number UG (haftungsbeschränkt)",
      "company_seat": "München",
      "details": "22.01.2025 (Bekanntmachungsdatum)\n\nBayern Amtsgericht München HRB 260813\nLöschungsankündigung 21.01.2025 (Eintragungsdatum)\n\nAO24 Number UG (haftungsbeschränkt)\nGesellschaft mit beschränkter Haftung\nMünchen\n\nDas Registergericht beabsichtigt, die im Handelsregister eingetragene Gesellschaft wegen Vermögenslosigkeit von Amts wegen nach § 394 FamFG zu löschen. Die Frist zur Erhebung eines Widerspruchs ist auf drei Monate festgesetzt."
    },
    {
      "date": "2025-01-22",
      "id": "99194",
      "original_text": "Registerbekanntmachung nach dem Umwandlungsgesetz\nBayern Amtsgericht München HRA 118349\nToni von Weinhold eK – München",
      "type": "Registerbekanntmachung nach dem Umwandlungsgesetz",
      "state": "Bayern",
      "amtsgericht": "Amtsgericht München",
      "registernummer": "HRA 118349",
      "registerart": "HRA",
      "company_name": "Toni von Weinhold eK",
      "company_seat": "München",
      "details": "22.01.2025 (Bekanntmachungsdatum)\n\nBayern Amtsgericht München HRA 118349\nRegisterbekanntmachung nach dem Umwandlungsgesetz 21.01.2025 (Eintragungsdatum)\n\nToni von Weinhold eK\nEinzelkaufmann / Einzelkauffrau\nMünchen\n\nDen Gläubigern der an der Verschmelzung beteiligten Rechtsträger ist, wenn sie binnen sechs Monaten nach dem Tag, an dem die Eintragung der Verschmelzung in das Register des Sitzes desjenigen Rechtsträgers, dessen Gläubiger sie sind, nach § 19 Abs. 3 UmwG als bekannt gemacht gilt, ihren Anspruch nach Grund und Höhe in Textform anmelden, Sicherheit zu leisten, soweit sie nicht Befriedigung verlangen können. Dieses Recht steht den Gläubigern jedoch nur zu, wenn sie glaubhaft machen, dass durch die Verschmelzung die Erfüllung ihrer Forderung gefährdet wird."
    },
    {
      "date": "2025-01-22",
      "id": "99195",
      "original_text": "Registerbekanntmachung nach dem Umwandlungsgesetz\nBayern Amtsgericht München HRB 270389\nAllgeier Experts Holding GmbH – München",
      "type": "Registerbekanntmachung nach dem Umwandlungsgesetz",
      "state": "Bayern",
      "amtsgericht": "Amtsgericht München",
      "registernummer": "HRB 270389",
      "registerart": "HRB",
      "company_name": "Allgeier Experts Holding GmbH",
      "company_seat": "München",
      "details": "22.01.2025 (Bekanntmachungsdatum)\n\nBayern Amtsgericht München HRB 270389\nRegisterbekanntmachung nach dem Umwandlungsgesetz 21.01.2025 (Eintragungsdatum)\n\nAllgeier Experts Holding GmbH\nGesellschaft mit beschränkter Haftung\nMünchen\n\nDen Gläubigern der an der Verschmelzung beteiligten Rechtsträger ist, wenn sie binnen sechs Monaten nach dem Tag, an dem die Eintragung der Verschmelzung in das Register des Sitzes desjenigen Rechtsträgers, dessen Gläubiger sie sind, nach § 19 Abs. 3 UmwG als bekannt gemacht gilt, ihren Anspruch nach Grund und Höhe in Textform anmelden, Sicherheit zu leisten, soweit sie nicht Befriedigung verlangen können. Dieses Recht steht den Gläubigern jedoch nur zu, wenn sie glaubhaft machen, dass durch die Verschmelzung die Erfüllung ihrer Forderung gefährdet wird."
    },
    {
      "date": "2025-01-22",
      "id": "99196",
      "original_text": "Löschungsankündigung\nBayern Amtsgericht Traunstein HRB 23261\nWendelstein Anzeiger GmbH – Bad Feilnbach",
      "type": "Löschungsankündigung",
      "state": "Bayern",
      "amtsgericht": "Amtsgericht Traunstein",
      "registernummer": "HRB 23261",
      "registerart": "HRB",
      "company_name": "Wendelstein Anzeiger GmbH",
      "company_seat": "Bad Feilnbach",
      "details": "22.01.2025 (Bekanntmachungsdatum)\n\nBayern Amtsgericht Traunstein HRB 23261\nLöschungsankündigung 21.01.2025 (Eintragungsdatum)\n\nWendelstein Anzeiger GmbH\nGesellschaft mit beschränkter Haftung\nBad Feilnbach\n\nDas Registergericht beabsichtigt, die im Handelsregister eingetragene Gesellschaft wegen Vermögenslosigkeit von Amts wegen nach § 394 FamFG zu löschen. Die Frist zur Erhebung eines Widerspruchs ist auf einen Monat festgesetzt."
    },
    {
      "date": "2025-01-22",
      "id": "99197",
      "original_text": "Sonstige Registerbekanntmachung\nBayern Amtsgericht München HRB 193621\nGSK Vaccines Vertriebs GmbH – Holzkirchen",
      "type": "Sonstige Registerbekanntmachung",
      "state": "Bayern",
      "amtsgericht": "Amtsgericht München",
      "registernummer": "HRB 193621",
      "registerart": "HRB",
      "company_name": "GSK Vaccines Vertriebs GmbH",
      "company_seat": "Holzkirchen",
      "details": "22.01.2025 (Bekanntmachungsdatum)\n\nBayern Amtsgericht München HRB 193621\nSonstige Registerbekanntmachung 21.01.2025 (Eintragungsdatum)\n\nGSK Vaccines Vertriebs GmbH\nGesellschaft mit beschränkter Haftung\nHolzkirchen\n\nDen Gläubigern der Gesellschaft, deren Forderungen begründet worden sind, bevor die Eintragung der Beendigung des Beherrschungs- und Gewinnabführungsvertrages in das Handelsregister nach § 10 des Handelsgesetzbuches als bekanntgemacht gilt, hat der andere Vertragsteil Sicherheit zu leisten, wenn sie sich binnen sechs Monaten nach der Bekanntmachung der Eintragung zu diesem Zweck bei ihm melden."
    },
    {
      "date": "2025-01-22",
      "id": "99198",
      "original_text": "Einreichung neuer Dokumente\nBayern Amtsgericht München HRB 133419\nBank Vontobel Europe AG – München",
      "type": "Einreichung neuer Dokumente",
      "state": "Bayern",
      "amtsgericht": "Amtsgericht München",
      "registernummer": "HRB 133419",
      "registerart": "HRB",
      "company_name": "Bank Vontobel Europe AG",
      "company_seat": "München",
      "details": "22.01.2025 (Bekanntmachungsdatum)\n\nBayern Amtsgericht München HRB 133419\nEinreichung neuer Dokumente 21.01.2025 (Eintragungsdatum)\n\nBank Vontobel Europe AG\nAktiengesellschaft\nMünchen\n\nDem Amtsgericht München -Registergericht- ist eine Liste der Mitglieder des Aufsichtsrats eingereicht worden, § 106 AktG."
    },
    {
      "date": "2025-01-22",
      "id": "99199",
      "original_text": "Registerbekanntmachung nach dem Umwandlungsgesetz\nBayern Amtsgericht München HRB 45221\nDorst Technologies Verwaltungs GmbH – Kochel am See",
      "type": "Registerbekanntmachung nach dem Umwandlungsgesetz",
      "state": "Bayern",
      "amtsgericht": "Amtsgericht München",
      "registernummer": "HRB 45221",
      "registerart": "HRB",
      "company_name": "Dorst Technologies Verwaltungs GmbH",
      "company_seat": "Kochel am See",
      "details": "22.01.2025 (Bekanntmachungsdatum)\n\nBayern Amtsgericht München HRB 45221\nRegisterbekanntmachung nach dem Umwandlungsgesetz 21.01.2025 (Eintragungsdatum)\n\nDorst Technologies Verwaltungs GmbH\nGesellschaft mit beschränkter Haftung\nKochel am See\n\nDen Gläubigern der an der Verschmelzung beteiligten Rechtsträger ist, wenn sie binnen sechs Monaten nach dem Tag, an dem die Eintragung der Verschmelzung in das Register des Sitzes desjenigen Rechtsträgers, dessen Gläubiger sie sind, nach § 19 Abs. 3 UmwG als bekannt gemacht gilt, ihren Anspruch nach Grund und Höhe schriftlich anmelden, Sicherheit zu leisten, soweit sie nicht Befriedigung verlangen können. Dieses Recht steht den Gläubigern jedoch nur zu, wenn sie glaubhaft machen, dass durch die Verschmelzung die Erfüllung ihrer Forderung gefährdet wird."
    },
    {
      "date": "2025-01-22",
      "id": "99200",
      "original_text": "Registerbekanntmachung nach dem Umwandlungsgesetz\nBayern Amtsgericht München HRB 281602\nAURELIUS Advisory AG – München",
      "type": "Registerbekanntmachung nach dem Umwandlungsgesetz",
      "state": "Bayern",
      "amtsgericht": "Amtsgericht München",
      "registernummer": "HRB 281602",
      "registerart": "HRB",
      "company_name": "AURELIUS Advisory AG",
      "company_seat": "München",
      "details": "22.01.2025 (Bekanntmachungsdatum)\n\nBayern Amtsgericht München HRB 281602\nRegisterbekanntmachung nach dem Umwandlungsgesetz\n\nAURELIUS Advisory AG\nAktiengesellschaft\nMünchen\n\nDem Amtsgericht München -Registergericht- ist der Entwurf eines Verschmelzungsvertrages zwischen der Gesellschaft als übernehmendem Rechtsträger und der AURELIUS Services Holding GmbH, München (Amtsgericht München HRB 204655) zur Einsichtnahme eingereicht worden."
    },
    {
      "date": "2025-01-22",
      "id": "99201",
      "original_text": "Löschungsankündigung\nBayern Amtsgericht Bayreuth HRB 4803\nCreativ-Konzept-Bau GmbH – Kulmbach",
      "type": "Löschungsankündigung",
      "state": "Bayern",
      "amtsgericht": "Amtsgericht Bayreuth",
      "registernummer": "HRB 4803",
      "registerart": "HRB",
      "company_name": "Creativ-Konzept-Bau GmbH",
      "company_seat": "Kulmbach",
      "details": "22.01.2025 (Bekanntmachungsdatum)\n\nBayern Amtsgericht Bayreuth HRB 4803\nLöschungsankündigung\n\nCreativ-Konzept-Bau GmbH\nGesellschaft mit beschränkter Haftung\nKulmbach\n\nDas Registergericht beabsichtigt, die im Handelsregister eingetragene Gesellschaft wegen Vermögenslosigkeit von Amts wegen nach § 394 FamFG zu löschen. Die Frist zur Erhebung eines Widerspruchs ist auf einen Monat festgesetzt."
    },
    {
      "date": "2025-01-22",
      "id": "99202",
      "original_text": "Löschungsankündigung\nBayern Amtsgericht München HRB 206896\nBusiness Alliance UG (haftungsbeschränkt) – München",
      "type": "Löschungsankündigung",
      "state": "Bayern",
      "amtsgericht": "Amtsgericht München",
      "registernummer": "HRB 206896",
      "registerart": "HRB",
      "company_name": "Business Alliance UG (haftungsbeschränkt)",
      "company_seat": "München",
      "details": "22.01.2025 (Bekanntmachungsdatum)\n\nBayern Amtsgericht München HRB 206896\nLöschungsankündigung 21.01.2025 (Eintragungsdatum)\n\nBusiness Alliance UG (haftungsbeschränkt)\nGesellschaft mit beschränkter Haftung\nMünchen\n\nDas Registergericht beabsichtigt, die im Handelsregister eingetragene Gesellschaft wegen Vermögenslosigkeit von Amts wegen nach § 394 FamFG zu löschen. Die Frist zur Erhebung eines Widerspruchs ist auf drei Monate festgesetzt."
    },
    {
      "date": "2025-01-22",
      "id": "99203",
      "original_text": "Sonstige Registerbekanntmachung\nBayern Amtsgericht Landshut HRB 8413\nUngarische Autobahn Inkasso GmbH – Eggenfelden",
      "type": "Sonstige Registerbekanntmachung",
      "state": "Bayern",
      "amtsgericht": "Amtsgericht Landshut",
      "registernummer": "HRB 8413",
      "registerart": "HRB",
      "company_name": "Ungarische Autobahn Inkasso GmbH",
      "company_seat": "Eggenfelden",
      "details": "22.01.2025 (Bekanntmachungsdatum)\n\nBayern Amtsgericht Landshut HRB 8413\nSonstige Registerbekanntmachung 21.01.2025 (Eintragungsdatum)\n\nUngarische Autobahn Inkasso GmbH\nGesellschaft mit beschränkter Haftung\nEggenfelden\n\nDen Gläubigern der Gesellschaft, deren Forderungen begründet worden sind, bevor die Eintragung der Beendigung des Gewinnabführungsvertrages in das Handelsregister nach § 10 des Handelsgesetzbuches als bekanntgemacht gilt, hat der andere Vertragsteil Sicherheit zu leisten, wenn sie sich binnen sechs Monaten nach der Bekanntmachung der Eintragung zu diesem Zweck bei ihm melden."
    },
    {
      "date": "2025-01-22",
      "id": "99204",
      "original_text": "Registerbekanntmachung nach dem Umwandlungsgesetz\nBayern Amtsgericht München HRA 120355\nAndreas Eichmeier e.K. – München",
      "type": "Registerbekanntmachung nach dem Umwandlungsgesetz",
      "state": "Bayern",
      "amtsgericht": "Amtsgericht München",
      "registernummer": "HRA 120355",
      "registerart": "HRA",
      "company_name": "Andreas Eichmeier e.K.",
      "company_seat": "München",
      "details": "22.01.2025 (Bekanntmachungsdatum)\n\nBayern Amtsgericht München HRA 120355\nRegisterbekanntmachung nach dem Umwandlungsgesetz 21.01.2025 (Eintragungsdatum)\n\nAndreas Eichmeier e.K.\nEinzelkaufmann / Einzelkauffrau\nMünchen\n\nDen Gläubigern der an der Ausgliederung beteiligten Rechtsträger ist, wenn sie binnen sechs Monaten nach dem Tag, an dem die Eintragung der Ausgliederung in das Register des Sitzes desjenigen Rechtsträgers, dessen Gläubiger sie sind, nach §§ 125, 19 Abs. 3 UmwG als bekannt gemacht gilt, ihren Anspruch nach Grund und Höhe in Textform anmelden, Sicherheit zu leisten, soweit sie nicht Befriedigung verlangen können. Dieses Recht steht den Gläubigern jedoch nur zu, wenn sie glaubhaft machen, dass durch die Ausgliederung die Erfüllung ihrer Forderung gefährdet wird."
    },
    {
      "date": "2025-01-22",
      "id": "99205",
      "original_text": "Einreichung neuer Dokumente\nBayern Amtsgericht Kempten (Allgäu) HRB 12623\nHausverwaltung Oberallgäu GmbH – Sonthofen",
      "type": "Einreichung neuer Dokumente",
      "state": "Bayern",
      "amtsgericht": "Amtsgericht Kempten (Allgäu)",
      "registernummer": "HRB 12623",
      "registerart": "HRB",
      "company_name": "Hausverwaltung Oberallgäu GmbH",
      "company_seat": "Sonthofen",
      "details": "22.01.2025 (Bekanntmachungsdatum)\n\nBayern Amtsgericht Kempten (Allgäu) HRB 12623\nEinreichung neuer Dokumente 21.01.2025 (Eintragungsdatum)\n\nHausverwaltung Oberallgäu GmbH\nGesellschaft mit beschränkter Haftung\nSonthofen\n\nDem Amtsgericht Kempten (Allgäu) -Registergericht- ist eine Liste der Mitglieder des Aufsichtsrats eingereicht worden, § 52 Abs. 3 S. 2 GmbHG."
    },
    {
      "date": "2025-01-22",
      "id": "99206",
      "original_text": "Löschungsankündigung\nBayern Amtsgericht München HRB 136237\nExclusive Ambiente GmbH – München",
      "type": "Löschungsankündigung",
      "state": "Bayern",
      "amtsgericht": "Amtsgericht München",
      "registernummer": "HRB 136237",
      "registerart": "HRB",
      "company_name": "Exclusive Ambiente GmbH",
      "company_seat": "München",
      "details": "22.01.2025 (Bekanntmachungsdatum)\n\nBayern Amtsgericht München HRB 136237\nLöschungsankündigung 17.01.2025 (Eintragungsdatum)\n\nExclusive Ambiente GmbH\nGesellschaft mit beschränkter Haftung\nMünchen\n\nDas Registergericht beabsichtigt, die im Handelsregister eingetragene Gesellschaft wegen Vermögenslosigkeit von Amts wegen nach § 394 FamFG zu löschen. Die Frist zur Erhebung eines Widerspruchs ist auf drei Monate festgesetzt."
    },
    {
      "date": "2025-01-22",
      "id": "99207",
      "original_text": "Einreichung neuer Dokumente\nBayern Amtsgericht Fürth HRB 19239\nZBI Fondsmanagement GmbH – Erlangen",
      "type": "Einreichung neuer Dokumente",
      "state": "Bayern",
      "amtsgericht": "Amtsgericht Fürth",
      "registernummer": "HRB 19239",
      "registerart": "HRB",
      "company_name": "ZBI Fondsmanagement GmbH",
      "company_seat": "Erlangen",
      "details": "22.01.2025 (Bekanntmachungsdatum)\n\nBayern Amtsgericht Fürth HRB 19239\nEinreichung neuer Dokumente\n\nZBI Fondsmanagement GmbH\nGesellschaft mit beschränkter Haftung\nErlangen\n\nDem Amtsgericht Fürth -Registergericht- ist eine Liste der Mitglieder des Aufsichtsrats eingereicht worden, § 52 Abs. 3 S. 2 GmbHG."
    },
    {
      "date": "2025-01-22",
      "id": "99208",
      "original_text": "Löschungsankündigung\nBayern Amtsgericht München HRB 238488\nZD Impex GmbH – München",
      "type": "Löschungsankündigung",
      "state": "Bayern",
      "amtsgericht": "Amtsgericht München",
      "registernummer": "HRB 238488",
      "registerart": "HRB",
      "company_name": "ZD Impex GmbH",
      "company_seat": "München",
      "details": "22.01.2025 (Bekanntmachungsdatum)\n\nBayern Amtsgericht München HRB 238488\nLöschungsankündigung\n\nZD Impex GmbH\nGesellschaft mit beschränkter Haftung\nMünchen\n\nDas Registergericht beabsichtigt, die im Handelsregister eingetragene Gesellschaft wegen Vermögenslosigkeit von Amts wegen nach § 394 FamFG zu löschen. Die Frist zur Erhebung eines Widerspruchs ist auf drei Monate festgesetzt."
    },
    {
      "date": "2025-01-22",
      "id": "99209",
      "original_text": "Sonstige Registerbekanntmachung\nBayern Amtsgericht Augsburg HRB 949\nAndrew Wireless Systems GmbH – Buchdorf",
      "type": "Sonstige Registerbekanntmachung",
      "state": "Bayern",
      "amtsgericht": "Amtsgericht Augsburg",
      "registernummer": "HRB 949",
      "registerart": "HRB",
      "company_name": "Andrew Wireless Systems GmbH",
      "company_seat": "Buchdorf",
      "details": "22.01.2025 (Bekanntmachungsdatum)\n\nBayern Amtsgericht Augsburg HRB 949\nSonstige Registerbekanntmachung 21.01.2025 (Eintragungsdatum)\n\nAndrew Wireless Systems GmbH\nGesellschaft mit beschränkter Haftung\nBuchdorf\n\nDen Gläubigern der Gesellschaft, deren Forderungen begründet worden sind, bevor die Eintragung der Beendigung des Gewinnabführungsvertrages in das Handelsregister nach § 10 des Handelsgesetzbuches als bekanntgemacht gilt, hat der andere Vertragsteil Sicherheit zu leisten, wenn sie sich binnen sechs Monaten nach der Bekanntmachung der Eintragung zu diesem Zweck bei ihm melden."
    },
    {
      "date": "2025-01-22",
      "id": "99210",
      "original_text": "Registerbekanntmachung nach dem Umwandlungsgesetz\nBayern Amtsgericht München VR 10853\n\"Dietrich-Bonhoeffer-Verein zur Förderung christlicher Verantwortung in Kirche und Gesellschaft\" e.V. – Neubiberg",
      "type": "Registerbekanntmachung nach dem Umwandlungsgesetz",
      "state": "Bayern",
      "amtsgericht": "Amtsgericht München",
      "registernummer": "VR 10853",
      "registerart": "VR",
      "company_name": "\"Dietrich-Bonhoeffer-Verein zur Förderung christlicher Verantwortung in Kirche und Gesellschaft\" e.V.",
      "company_seat": "Neubiberg",
      "details": "22.01.2025 (Bekanntmachungsdatum)\n\nBayern Amtsgericht München VR 10853\nRegisterbekanntmachung nach dem Umwandlungsgesetz 21.01.2025 (Eintragungsdatum)\n\n\"Dietrich-Bonhoeffer-Verein zur Förderung christlicher Verantwortung in Kirche und Gesellschaft\" e.V.\neingetragener Verein\nNeubiberg\n\nDen Gläubigern der an der Verschmelzung beteiligten Rechtsträger ist, wenn sie binnen sechs Monaten nach dem Tag, an dem die Eintragung der Verschmelzung in das Register des Sitzes desjenigen Rechtsträgers, dessen Gläubiger sie sind, nach § 19 Abs. 3 UmwG als bekannt gemacht gilt, ihren Anspruch nach Grund und Höhe in Textform anmelden, Sicherheit zu leisten, soweit sie nicht Befriedigung verlangen können. Dieses Recht steht den Gläubigern jedoch nur zu, wenn sie glaubhaft machen, dass durch die Verschmelzung die Erfüllung ihrer Forderung gefährdet wird."
    },
    {
      "date": "2025-01-22",
      "id": "99211",
      "original_text": "Registerbekanntmachung nach dem Umwandlungsgesetz\nBayern Amtsgericht Memmingen HRB 10871\nGoldhofer Aktiengesellschaft – Memmingen",
      "type": "Registerbekanntmachung nach dem Umwandlungsgesetz",
      "state": "Bayern",
      "amtsgericht": "Amtsgericht Memmingen",
      "registernummer": "HRB 10871",
      "registerart": "HRB",
      "company_name": "Goldhofer Aktiengesellschaft",
      "company_seat": "Memmingen",
      "details": "22.01.2025 (Bekanntmachungsdatum)\n\nBayern Amtsgericht Memmingen HRB 10871\nRegisterbekanntmachung nach dem Umwandlungsgesetz\n\nGoldhofer Aktiengesellschaft\nAktiengesellschaft\nMemmingen\n\nDem Amtsgericht Memmingen -Registergericht- ist ein Verschmelzungsvertrag zwischen der Goldhofer Airport Technology AG, Memmingen (Amtsgericht Amtsgericht Memmingen HRB 21390) und der Gesellschaft als übertragendem Rechtsträger zur Einsichtnahme eingereicht worden."
    },
    {
      "date": "2025-01-22",
      "id": "99212",
      "original_text": "Einreichung neuer Dokumente\nBayern Amtsgericht Weiden i. d. OPf. HRB 2863\nChristophorus Holding GmbH – Weiden in der Oberpfalz",
      "type": "Einreichung neuer Dokumente",
      "state": "Bayern",
      "amtsgericht": "Amtsgericht Weiden i. d. OPf.",
      "registernummer": "HRB 2863",
      "registerart": "HRB",
      "company_name": "Christophorus Holding GmbH",
      "company_seat": "Weiden in der Oberpfalz",
      "details": "22.01.2025 (Bekanntmachungsdatum)\n\nBayern Amtsgericht Weiden i. d. OPf. HRB 2863\nEinreichung neuer Dokumente 21.01.2024 (Eintragungsdatum)\n\nChristophorus Holding GmbH\nGesellschaft mit beschränkter Haftung\nWeiden in der Oberpfalz\n\nDem Amtsgericht Weiden i.d.OPf. -Registergericht- ist eine Liste der Mitglieder des Aufsichtsrats eingereicht worden, § 52 Abs. 3 S. 2 GmbHG."
    },
    {
      "date": "2025-01-22",
      "id": "99213",
      "original_text": "Registerbekanntmachung nach dem Umwandlungsgesetz\nBaden-Württemberg Amtsgericht Stuttgart HRB 15139\nHerzzentrum Klinikum Stuttgart GmbH – Stuttgart",
      "type": "Registerbekanntmachung nach dem Umwandlungsgesetz",
      "state": "Baden-Württemberg",
      "amtsgericht": "Amtsgericht Stuttgart",
      "registernummer": "HRB 15139",
      "registerart": "HRB",
      "company_name": "Herzzentrum Klinikum Stuttgart GmbH",
      "company_seat": "Stuttgart",
      "details": "22.01.2025 (Bekanntmachungsdatum)\n\nBaden-Württemberg Amtsgericht Stuttgart HRB 15139\nRegisterbekanntmachung nach dem Umwandlungsgesetz 22.01.2025 (Eintragungsdatum)\n\nHerzzentrum Klinikum Stuttgart GmbH\nGesellschaft mit beschränkter Haftung\nStuttgart\n\nAls nicht eingetragen wird bekanntgemacht:\nDen Gläubigern des an dem Formwechsel beteiligten Rechtsträgers ist, wenn sie binnen sechs Monaten nach dem Tag, an dem die Eintragung des Formwechsels in das Register des Sitzes desjenigen Rechtsträgers, dessen Gläubiger sie sind, nach § 19 Abs. 3 UmwG als bekanntgemacht gilt, ihren Anspruch nach Grund und Höhe schriftlich anmelden, Sicherheit zu leisten, soweit sie nicht Befriedigung verlangen können. Dieses Recht steht den Gläubigern jedoch nur zu, wenn sie glaubhaft machen, dass durch den Formwechsel die Erfüllung ihrer Forderung gefährdet wird."
    },
    {
      "date": "2025-01-22",
      "id": "99214",
      "original_text": "Einreichung neuer Dokumente\nBaden-Württemberg Amtsgericht Stuttgart HRB 722731\nEvangelische Heimstiftung GmbH – Stuttgart",
      "type": "Einreichung neuer Dokumente",
      "state": "Baden-Württemberg",
      "amtsgericht": "Amtsgericht Stuttgart",
      "registernummer": "HRB 722731",
      "registerart": "HRB",
      "company_name": "Evangelische Heimstiftung GmbH",
      "company_seat": "Stuttgart",
      "details": "22.01.2025 (Bekanntmachungsdatum)\n\nBaden-Württemberg Amtsgericht Stuttgart HRB 722731\nEinreichung neuer Dokumente\n\nEvangelische Heimstiftung GmbH\nGesellschaft mit beschränkter Haftung\nStuttgart\n\nDie Gesellschaft hat am 21.01.2025 die Liste über die Zusammensetzung des Aufsichtsrats zum Handelsregister eingereicht."
    },
    {
      "date": "2025-01-22",
      "id": "99215",
      "original_text": "Einreichung neuer Dokumente\nBaden-Württemberg Amtsgericht Ulm HRB 680461\nStadtwerk Tauberfranken GmbH – Bad Mergentheim",
      "type": "Einreichung neuer Dokumente",
      "state": "Baden-Württemberg",
      "amtsgericht": "Amtsgericht Ulm",
      "registernummer": "HRB 680461",
      "registerart": "HRB",
      "company_name": "Stadtwerk Tauberfranken GmbH",
      "company_seat": "Bad Mergentheim",
      "details": "22.01.2025 (Bekanntmachungsdatum)\n\nBaden-Württemberg Amtsgericht Ulm HRB 680461\nEinreichung neuer Dokumente 22.01.2025 (Eintragungsdatum)\n\nStadtwerk Tauberfranken GmbH\nGesellschaft mit beschränkter Haftung\nBad Mergentheim\n\nDie Gesellschaft hat am 21.01.2025 die Liste über die Zusammensetzung des Aufsichtsrats zum Handelsregister eingereicht."
    },
    {
      "date": "2025-01-22",
      "id": "99216",
      "original_text": "Löschungsankündigung\nSaarland Amtsgericht Saarbrücken HRB 102371\nMayEvening UG (haftungsbeschränkt) – Neunkirchen",
      "type": "Löschungsankündigung",
      "state": "Saarland",
      "amtsgericht": "Amtsgericht Saarbrücken",
      "registernummer": "HRB 102371",
      "registerart": "HRB",
      "company_name": "MayEvening UG (haftungsbeschränkt)",
      "company_seat": "Neunkirchen",
      "details": "22.01.2025 (Bekanntmachungsdatum)\n\nSaarland Amtsgericht Saarbrücken HRB 102371\nLöschungsankündigung\n\nMayEvening UG (haftungsbeschränkt)\nGesellschaft mit beschränkter Haftung\nNeunkirchen\n\nEs ist beabsichtigt, die Gesellschaft von Amts wegen gemäß § 394 FamFG wegen Vermögenslosigkeit zu löschen.\nGegen die Löschung von Amts wegen ist das Rechtsmittel des Widerspruchs statthaft. Der Widerspruch ist binnen einer Frist drei Monaten beginnend mit dem Tag dieser Veröffentlichung durch Einreichen eines Widerspruchsschreibens -schriftlich oder zur Niederschrift der Geschäftsstelle beim Amtsgericht Saarbrücken, -zentrales Handelsregister-, Mainzerstr.178, 66121 Saarbrücken einzulegen.\nDer Widerspruch muss die Bezeichnung der angefochtenen Löschungsankündigung enthalten sowie die Erklärung, dass Widerspruch eingelegt wird. Er ist vom Widerspruchsführer oder seinem Bevollmächtigten zu unterzeichnen.\nDas Widerspruchsschreiben kann auch in der Form eines elektronischen Dokumentes eingereicht werden, das mit einer qualifizierten elektronischen Signatur nach dem Signaturgesetz versehen sein muss (§§ 14 Abs. 2 FamFG, 130a, 298 ZPO)."
    },
    {
      "date": "2025-01-22",
      "id": "99217",
      "original_text": "Löschungsankündigung\nBerlin Amtsgericht Berlin (Charlottenburg) HRB 140545\nBondi Beteiligungs GmbH – Berlin",
      "type": "Löschungsankündigung",
      "state": "Berlin",
      "amtsgericht": "Amtsgericht Berlin (Charlottenburg)",
      "registernummer": "HRB 140545",
      "registerart": "HRB",
      "company_name": "Bondi Beteiligungs GmbH",
      "company_seat": "Berlin",
      "details": "22.01.2025 (Bekanntmachungsdatum)\n\nBerlin Amtsgericht Berlin (Charlottenburg) HRB 140545\nLöschungsankündigung\n\nBondi Beteiligungs GmbH\nGesellschaft mit beschränkter Haftung\nBerlin\n\nBei der nachstehenden Gesellschaft wird das Amtslöschungsverfahren gemäß § 394 FamFG eingeleitet. Widerspruchsfrist 6 Wochen"
    },
    {
      "date": "2025-01-22",
      "id": "99218",
      "original_text": "Löschungsankündigung\nBaden-Württemberg Amtsgericht Freiburg HRB 729018\nFibracon GmbH – Weil am Rhein",
      "type": "Löschungsankündigung",
      "state": "Baden-Württemberg",
      "amtsgericht": "Amtsgericht Freiburg",
      "registernummer": "HRB 729018",
      "registerart": "HRB",
      "company_name": "Fibracon GmbH",
      "company_seat": "Weil am Rhein",
      "details": "22.01.2025 (Bekanntmachungsdatum)\n\nBaden-Württemberg Amtsgericht Freiburg HRB 729018\nLöschungsankündigung\n\nFibracon GmbH\nGesellschaft mit beschränkter Haftung\nWeil am Rhein\n\nAls nicht eingetragen wird bekanntgemacht:\nDas Gericht beabsichtigt, die Gesellschaft wegen Vermögenslosigkeit im Handelsregister von Amts wegen nach § 394 FamFG zu löschen. Die Frist zur Geltendmachung eines Widerspruchs gegen die beabsichtigte Löschung ist auf einen Monat ab Veröffentlichung bestimmt."
    },
    {
      "date": "2025-01-22",
      "id": "99219",
      "original_text": "Einreichung neuer Dokumente\nMecklenburg-Vorpommern Amtsgericht Stralsund HRB 3668\nStralsunder Innovation Consult GmbH – Stralsund",
      "type": "Einreichung neuer Dokumente",
      "state": "Mecklenburg-Vorpommern",
      "amtsgericht": "Amtsgericht Stralsund",
      "registernummer": "HRB 3668",
      "registerart": "HRB",
      "company_name": "Stralsunder Innovation Consult GmbH",
      "company_seat": "Stralsund",
      "details": "22.01.2025 (Bekanntmachungsdatum)\n\nMecklenburg-Vorpommern Amtsgericht Stralsund HRB 3668\nEinreichung neuer Dokumente\n\nStralsunder Innovation Consult GmbH\nGesellschaft mit beschränkter Haftung\nStralsund"
    },
    {
      "date": "2025-01-22",
      "id": "99220",
      "original_text": "Sonstige Registerbekanntmachung\nBaden-Württemberg Amtsgericht Freiburg HRB 413567\neucatech AG – Weil am Rhein",
      "type": "Sonstige Registerbekanntmachung",
      "state": "Baden-Württemberg",
      "amtsgericht": "Amtsgericht Freiburg",
      "registernummer": "HRB 413567",
      "registerart": "HRB",
      "company_name": "eucatech AG",
      "company_seat": "Weil am Rhein",
      "details": "22.01.2025 (Bekanntmachungsdatum)\n\nBaden-Württemberg Amtsgericht Freiburg HRB 413567\nSonstige Registerbekanntmachung\n\neucatech AG\nAktiengesellschaft\nWeil am Rhein\n\nDie Gesellschaft hat am 21.01.2025 die Liste über die Zusammensetzung des Aufsichtsrats zum Handelsregister eingereicht."
    },
    {
      "date": "2025-01-22",
      "id": "99221",
      "original_text": "Löschungsankündigung\nSchleswig-Holstein Amtsgericht Lübeck HRB 6430\nGrimm Wintergärten GmbH – Süsel",
      "type": "Löschungsankündigung",
      "state": "Schleswig-Holstein",
      "amtsgericht": "Amtsgericht Lübeck",
      "registernummer": "HRB 6430",
      "registerart": "HRB",
      "company_name": "Grimm Wintergärten GmbH",
      "company_seat": "Süsel",
      "details": "22.01.2025 (Bekanntmachungsdatum)\n\nSchleswig-Holstein Amtsgericht Lübeck HRB 6430\nLöschungsankündigung\n\nGrimm Wintergärten GmbH\nGesellschaft mit beschränkter Haftung\nSüsel\n\nEs ist die Löschung der nachstehenden Gesellschaft wegen Vermögenslosigkeit gemäß § 394 FamFG beabsichtigt. Widerspruchsfrist: 1 Monat"
    },
    {
      "date": "2025-01-22",
      "id": "99222",
      "original_text": "Löschungsankündigung\nBaden-Württemberg Amtsgericht Stuttgart HRB 764336\nSG Baubetreuung GmbH – Böblingen",
      "type": "Löschungsankündigung",
      "state": "Baden-Württemberg",
      "amtsgericht": "Amtsgericht Stuttgart",
      "registernummer": "HRB 764336",
      "registerart": "HRB",
      "company_name": "SG Baubetreuung GmbH",
      "company_seat": "Böblingen",
      "details": "22.01.2025 (Bekanntmachungsdatum)\n\nBaden-Württemberg Amtsgericht Stuttgart HRB 764336\nLöschungsankündigung\n\nSG Baubetreuung GmbH\nGesellschaft mit beschränkter Haftung\nBöblingen\n\nAls nicht eingetragen wird bekanntgemacht:\nDas Gericht beabsichtigt, die Gesellschaft wegen Vermögenslosigkeit im Handelsregister von Amts wegen nach § 394 FamFG zu löschen. Die Frist zur Geltendmachung eines Widerspruchs gegen die beabsichtigte Löschung ist auf zwei Monate ab Veröffentlichung bestimmt."
    },
    {
      "date": "2025-01-22",
      "id": "99223",
      "original_text": "Registerbekanntmachung nach dem Umwandlungsgesetz\nHamburg Amtsgericht Hamburg HRB 32564\nNAVIS Consulting & Computer Services Gesellschaft mit beschränkter Haftung – Hamburg",
      "type": "Registerbekanntmachung nach dem Umwandlungsgesetz",
      "state": "Hamburg",
      "amtsgericht": "Amtsgericht Hamburg",
      "registernummer": "HRB 32564",
      "registerart": "HRB",
      "company_name": "NAVIS Consulting & Computer Services Gesellschaft mit beschränkter Haftung",
      "company_seat": "Hamburg",
      "details": "22.01.2025 (Bekanntmachungsdatum)\n\nHamburg Amtsgericht Hamburg HRB 32564\nRegisterbekanntmachung nach dem Umwandlungsgesetz 22.01.2025 (Eintragungsdatum)\n\nNAVIS Consulting & Computer Services Gesellschaft mit beschränkter Haftung\nGesellschaft mit beschränkter Haftung\nHamburg\n\nAls nicht eingetragen wird bekannt gemacht:\nDen Gläubigern der an der Verschmelzung beteiligten Gesellschaften ist, wenn sie binnen sechs Monaten nach dem Tag, an dem die Eintragung der Verschmelzung in das Register des Sitzes desjenigen Rechtsträgers, dessen Gläubiger sie sind, nach § 19 Absatz 3 UmwG als bekannt gemacht gilt, ihren Anspruch nach Grund und Höhe schriftlich anmelden, Sicherheit zu leisten, soweit sie nicht Befriedigung verlangen können. Dieses Recht steht den Gläubigern jedoch nur zu, wenn sie glaubhaft machen, dass durch die Verschmelzung die Erfüllung ihrer Forderung gefährdet wird."
    },
    {
      "date": "2025-01-22",
      "id": "99224",
      "original_text": "Registerbekanntmachung nach dem Umwandlungsgesetz\nHamburg Amtsgericht Hamburg HRB 59688\nNAVIS Schiffahrts- und Speditions-Aktiengesellschaft – Hamburg",
      "type": "Registerbekanntmachung nach dem Umwandlungsgesetz",
      "state": "Hamburg",
      "amtsgericht": "Amtsgericht Hamburg",
      "registernummer": "HRB 59688",
      "registerart": "HRB",
      "company_name": "NAVIS Schiffahrts- und Speditions-Aktiengesellschaft",
      "company_seat": "Hamburg",
      "details": "22.01.2025 (Bekanntmachungsdatum)\n\nHamburg Amtsgericht Hamburg HRB 59688\nRegisterbekanntmachung nach dem Umwandlungsgesetz 22.01.2025 (Eintragungsdatum)\n\nNAVIS Schiffahrts- und Speditions-Aktiengesellschaft\nAktiengesellschaft\nHamburg\n\nAls nicht eingetragen wird bekannt gemacht:\nDen Gläubigern der an der Verschmelzung beteiligten Gesellschaften ist, wenn sie binnen sechs Monaten nach dem Tag, an dem die Eintragung der Verschmelzung in das Register des Sitzes desjenigen Rechtsträgers, dessen Gläubiger sie sind, nach § 19 Absatz 3 UmwG als bekannt gemacht gilt, ihren Anspruch nach Grund und Höhe schriftlich anmelden, Sicherheit zu leisten, soweit sie nicht Befriedigung verlangen können. Dieses Recht steht den Gläubigern jedoch nur zu, wenn sie glaubhaft machen, dass durch die Verschmelzung die Erfüllung ihrer Forderung gefährdet wird."
    },
    {
      "date": "2025-01-22",
      "id": "99225",
      "original_text": "Sonstige Registerbekanntmachung\nBaden-Württemberg Amtsgericht Freiburg HRB 490059\nEdgar Feger GmbH – Oberkirch",
      "type": "Sonstige Registerbekanntmachung",
      "state": "Baden-Württemberg",
      "amtsgericht": "Amtsgericht Freiburg",
      "registernummer": "HRB 490059",
      "registerart": "HRB",
      "company_name": "Edgar Feger GmbH",
      "company_seat": "Oberkirch",
      "details": "22.01.2025 (Bekanntmachungsdatum)\n\nBaden-Württemberg Amtsgericht Freiburg HRB 490059\nSonstige Registerbekanntmachung 22.01.2025 (Eintragungsdatum)\n\nEdgar Feger GmbH\nGesellschaft mit beschränkter Haftung\nOberkirch\n\nDer Unternehmensvertrag mit der \"Edgar Feger Vermietungen e.K.\" (Amtsgericht Freiburg, HRA 490354) ist mit Wirkung zum 31.12.2024 beendet.  Den Gläubigern der Gesellschaft, deren Forderungen begründet worden sind, bevor die Eintragung der Beendigung des Vertrages in das Handelsregister nach § 10 HGB als bekanntgemacht gilt, ist vom anderen Vertragsteil Sicherheit zu leisten, wenn sie sich binnen sechs Monaten nach der Bekanntmachung zu diesem Zweck bei ihm melden."
    },
    {
      "date": "2025-01-22",
      "id": "99226",
      "original_text": "Einreichung neuer Dokumente\nSaarland Amtsgericht Saarbrücken HRB 9163\nSaarland Feuerversicherung Aktiengesellschaft – Saarbrücken",
      "type": "Einreichung neuer Dokumente",
      "state": "Saarland",
      "amtsgericht": "Amtsgericht Saarbrücken",
      "registernummer": "HRB 9163",
      "registerart": "HRB",
      "company_name": "Saarland Feuerversicherung Aktiengesellschaft",
      "company_seat": "Saarbrücken",
      "details": "22.01.2025 (Bekanntmachungsdatum)\n\nSaarland Amtsgericht Saarbrücken HRB 9163\nEinreichung neuer Dokumente\n\nSaarland Feuerversicherung Aktiengesellschaft\nAktiengesellschaft\nSaarbrücken\n\nDer Vorstand der Gesellschaft hat eine Liste der Mitglieder des Aufsichtsrats zum Handelsregister eingereicht (§ 106 AktG)."
    },
    {
      "date": "2025-01-22",
      "id": "99227",
      "original_text": "Registerbekanntmachung nach dem Umwandlungsgesetz\nSchleswig-Holstein Amtsgericht Lübeck HRA 11199\nFachbetrieb für Schankanlagen Marcus Freyberg e.K. – Lübeck",
      "type": "Registerbekanntmachung nach dem Umwandlungsgesetz",
      "state": "Schleswig-Holstein",
      "amtsgericht": "Amtsgericht Lübeck",
      "registernummer": "HRA 11199",
      "registerart": "HRA",
      "company_name": "Fachbetrieb für Schankanlagen Marcus Freyberg e.K.",
      "company_seat": "Lübeck",
      "details": "22.01.2025 (Bekanntmachungsdatum)\n\nSchleswig-Holstein Amtsgericht Lübeck HRA 11199\nRegisterbekanntmachung nach dem Umwandlungsgesetz 20.01.2025 (Eintragungsdatum)\n\nFachbetrieb für Schankanlagen Marcus Freyberg e.K.\nEinzelkaufmann / Einzelkauffrau\nLübeck\n\nZu Eintragungsnummer 2 vom 20.01.2025 wird als nicht eingetragen veröffentlicht:  Den Gläubigern ist, wenn sie binnen sechs Monaten nach dem Tag, an dem die Eintragung der Umwandlung als bekannt gemacht gilt, ihren Anspruch nach Grund und Höhe schriftlich anmelden, Sicherheit zu leisten, soweit sie nicht Befriedigung verlangen können. Dieses Recht steht den Gläubigern jedoch nur zu, wenn sie glaubhaft machen, dass durch die Umwandlung die Erfüllung ihrer Forderung gefährdet wird."
    },
    {
      "date": "2025-01-22",
      "id": "99228",
      "original_text": "Löschungsankündigung\nBerlin Amtsgericht Berlin (Charlottenburg) HRB 234317\nTaxi Ringbahn GmbH – Berlin",
      "type": "Löschungsankündigung",
      "state": "Berlin",
      "amtsgericht": "Amtsgericht Berlin (Charlottenburg)",
      "registernummer": "HRB 234317",
      "registerart": "HRB",
      "company_name": "Taxi Ringbahn GmbH",
      "company_seat": "Berlin",
      "details": "22.01.2025 (Bekanntmachungsdatum)\n\nBerlin Amtsgericht Berlin (Charlottenburg) HRB 234317\nLöschungsankündigung\n\nTaxi Ringbahn GmbH\nGesellschaft mit beschränkter Haftung\nBerlin\n\nBei der nachstehenden Gesellschaft wird das Amtslöschungsverfahren gemäß § 394 FamFG eingeleitet. Widerspruchsfrist 6 Wochen"
    },
    {
      "date": "2025-01-22",
      "id": "99229",
      "original_text": "Einreichung neuer Dokumente\nBaden-Württemberg Amtsgericht Freiburg HRB 621413\n+siggset+ print & media Aktiengesellschaft – Albbruck",
      "type": "Einreichung neuer Dokumente",
      "state": "Baden-Württemberg",
      "amtsgericht": "Amtsgericht Freiburg",
      "registernummer": "HRB 621413",
      "registerart": "HRB",
      "company_name": "+siggset+ print & media Aktiengesellschaft",
      "company_seat": "Albbruck",
      "details": "22.01.2025 (Bekanntmachungsdatum)\n\nBaden-Württemberg Amtsgericht Freiburg HRB 621413\nEinreichung neuer Dokumente\n\n+siggset+ print & media Aktiengesellschaft\nAktiengesellschaft\nAlbbruck\n\nAls nicht eingetragen wird bekanntgemacht:\nDie Gesellschaft hat am 20.01.2025 die Liste über die Zusammensetzung des Aufsichtsrats zum Handelsregister eingereicht."
    },
    {
      "date": "2025-01-22",
      "id": "99230",
      "original_text": "Löschungsankündigung\nThüringen Amtsgericht Jena HRB 506203\nTief Textilien und Geräte GmbH – Hildburghausen",
      "type": "Löschungsankündigung",
      "state": "Thüringen",
      "amtsgericht": "Amtsgericht Jena",
      "registernummer": "HRB 506203",
      "registerart": "HRB",
      "company_name": "Tief Textilien und Geräte GmbH",
      "company_seat": "Hildburghausen",
      "details": "22.01.2025 (Bekanntmachungsdatum)\n\nThüringen Amtsgericht Jena HRB 506203\nLöschungsankündigung\n\nTief Textilien und Geräte GmbH\nGesellschaft mit beschränkter Haftung\nHildburghausen\n\nDas Registergericht beabsichtigt, die im Handelsregister eingetragene Gesellschaft wegen Vermögenslosigkeit nach § 394 FamFG von Amts wegen zu löschen. Die Frist zur Erhebung eines Widerspruchs gegen die beabsichtigte Löschung wird auf 6 Wochen festgesetzt."
    },
    {
      "date": "2025-01-22",
      "id": "99231",
      "original_text": "Löschungsankündigung\nThüringen Amtsgericht Jena HRB 510988\nA.B.T.-Trockenbau GmbH – Ronneburg",
      "type": "Löschungsankündigung",
      "state": "Thüringen",
      "amtsgericht": "Amtsgericht Jena",
      "registernummer": "HRB 510988",
      "registerart": "HRB",
      "company_name": "A.B.T.-Trockenbau GmbH",
      "company_seat": "Ronneburg",
      "details": "22.01.2025 (Bekanntmachungsdatum)\n\nThüringen Amtsgericht Jena HRB 510988\nLöschungsankündigung\n\nA.B.T.-Trockenbau GmbH\nGesellschaft mit beschränkter Haftung\nRonneburg\n\nDas Registergericht beabsichtigt, die im Handelsregister eingetragene Gesellschaft wegen Vermögenslosigkeit nach § 394 FamFG von Amts wegen zu löschen. Die Frist zur Erhebung eines Widerspruchs gegen die beabsichtigte Löschung wird auf 6 Wochen festgesetzt."
    },
    {
      "date": "2025-01-22",
      "id": "99232",
      "original_text": "Löschungsankündigung\nThüringen Amtsgericht Jena HRB 516853\nGEKO - Bauservice GmbH – Gera",
      "type": "Löschungsankündigung",
      "state": "Thüringen",
      "amtsgericht": "Amtsgericht Jena",
      "registernummer": "HRB 516853",
      "registerart": "HRB",
      "company_name": "GEKO - Bauservice GmbH",
      "company_seat": "Gera",
      "details": "22.01.2025 (Bekanntmachungsdatum)\n\nThüringen Amtsgericht Jena HRB 516853\nLöschungsankündigung\n\nGEKO - Bauservice GmbH\nGesellschaft mit beschränkter Haftung\nGera\n\nDas Registergericht beabsichtigt, die im Handelsregister eingetragene Gesellschaft wegen Vermögenslosigkeit nach § 394 FamFG von Amts wegen zu löschen. Die Frist zur Erhebung eines Widerspruchs gegen die beabsichtigte Löschung wird auf 6 Wochen festgesetzt."
    },
    {
      "date": "2025-01-22",
      "id": "99233",
      "original_text": "Löschungsankündigung\nBerlin Amtsgericht Berlin (Charlottenburg) HRB 94021\nWDM - Wirtschaftsdienst Mittelstand GmbH – Berlin",
      "type": "Löschungsankündigung",
      "state": "Berlin",
      "amtsgericht": "Amtsgericht Berlin (Charlottenburg)",
      "registernummer": "HRB 94021",
      "registerart": "HRB",
      "company_name": "WDM - Wirtschaftsdienst Mittelstand GmbH",
      "company_seat": "Berlin",
      "details": "22.01.2025 (Bekanntmachungsdatum)\n\nBerlin Amtsgericht Berlin (Charlottenburg) HRB 94021\nLöschungsankündigung\n\nWDM - Wirtschaftsdienst Mittelstand GmbH\nGesellschaft mit beschränkter Haftung\nBerlin\n\nBei der nachstehenden Gesellschaft wird das Amtslöschungsverfahren gemäß § 394 FamFG eingeleitet. Widerspruchsfrist 6 Wochen"
    },
    {
      "date": "2025-01-22",
      "id": "99234",
      "original_text": "Sonstige Registerbekanntmachung\nHamburg Amtsgericht Hamburg HRB 7408\nBürgschaftsbank Hamburg GmbH – Hamburg",
      "type": "Sonstige Registerbekanntmachung",
      "state": "Hamburg",
      "amtsgericht": "Amtsgericht Hamburg",
      "registernummer": "HRB 7408",
      "registerart": "HRB",
      "company_name": "Bürgschaftsbank Hamburg GmbH",
      "company_seat": "Hamburg",
      "details": "22.01.2025 (Bekanntmachungsdatum)\n\nHamburg Amtsgericht Hamburg HRB 7408\nSonstige Registerbekanntmachung\n\nBürgschaftsbank Hamburg GmbH\nGesellschaft mit beschränkter Haftung\nHamburg\n\nAls nicht eingetragen wird bekannt gemacht: Liste des Aufsichtsrats wurde eingereicht."
    },
    {
      "date": "2025-01-22",
      "id": "99235",
      "original_text": "Registerbekanntmachung nach dem Umwandlungsgesetz\nBaden-Württemberg Amtsgericht Freiburg HRB 715366\nSOWO Verwaltungs GmbH – Konstanz",
      "type": "Registerbekanntmachung nach dem Umwandlungsgesetz",
      "state": "Baden-Württemberg",
      "amtsgericht": "Amtsgericht Freiburg",
      "registernummer": "HRB 715366",
      "registerart": "HRB",
      "company_name": "SOWO Verwaltungs GmbH",
      "company_seat": "Konstanz",
      "details": "22.01.2025 (Bekanntmachungsdatum)\n\nBaden-Württemberg Amtsgericht Freiburg HRB 715366\nRegisterbekanntmachung nach dem Umwandlungsgesetz 22.01.2025 (Eintragungsdatum)\n\nSOWO Verwaltungs GmbH\nGesellschaft mit beschränkter Haftung\nKonstanz\n\nAls nicht eingetragen wird bekanntgemacht:\nDen Gläubigern der an der Verschmelzung beteiligten Rechtsträger ist, wenn sie binnen sechs Monaten nach dem Tag, an dem die Eintragung der Verschmelzung in das Register des Sitzes desjenigen Rechtsträgers, dessen Gläubiger sie sind, nach § 19 Abs. 3 UmwG als bekanntgemacht gilt, ihren Anspruch nach Grund und Höhe schriftlich anmelden, Sicherheit zu leisten, soweit sie nicht Befriedigung verlangen können. Dieses Recht steht den Gläubigern jedoch nur zu, wenn sie glaubhaft machen, dass durch die Verschmelzung die Erfüllung ihrer Forderung gefährdet wird."
    },
    {
      "date": "2025-01-22",
      "id": "99236",
      "original_text": "Löschungsankündigung\nBerlin Amtsgericht Berlin (Charlottenburg) HRB 94283\nVierzehnte Rote Vermögensverwaltungs GmbH – Berlin",
      "type": "Löschungsankündigung",
      "state": "Berlin",
      "amtsgericht": "Amtsgericht Berlin (Charlottenburg)",
      "registernummer": "HRB 94283",
      "registerart": "HRB",
      "company_name": "Vierzehnte Rote Vermögensverwaltungs GmbH",
      "company_seat": "Berlin",
      "details": "22.01.2025 (Bekanntmachungsdatum)\n\nBerlin Amtsgericht Berlin (Charlottenburg) HRB 94283\nLöschungsankündigung\n\nVierzehnte Rote Vermögensverwaltungs GmbH\nGesellschaft mit beschränkter Haftung\nBerlin\n\nBei der nachstehenden Gesellschaft wird das Amtslöschungsverfahren gemäß § 394 FamFG eingeleitet. Widerspruchsfrist\n6 Wochen."
    },
    {
      "date": "2025-01-22",
      "id": "99237",
      "original_text": "Sonstige Registerbekanntmachung\nHamburg Amtsgericht Hamburg HRB 155984\nBILTON Holding AG – Hamburg",
      "type": "Sonstige Registerbekanntmachung",
      "state": "Hamburg",
      "amtsgericht": "Amtsgericht Hamburg",
      "registernummer": "HRB 155984",
      "registerart": "HRB",
      "company_name": "BILTON Holding AG",
      "company_seat": "Hamburg",
      "details": "22.01.2025 (Bekanntmachungsdatum)\n\nHamburg Amtsgericht Hamburg HRB 155984\nSonstige Registerbekanntmachung 22.01.2025 (Eintragungsdatum)\n\nBILTON Holding AG\nAktiengesellschaft\nHamburg\n\nAls nicht eingetragen wird bekannt gemacht: Liste des Aufsichtsrats wurde eingereicht."
    },
    {
      "date": "2025-01-22",
      "id": "99238",
      "original_text": "Sonstige Registerbekanntmachung\nBerlin Amtsgericht Berlin (Charlottenburg) HRB 148053\nclubspo11 AG – Berlin",
      "type": "Sonstige Registerbekanntmachung",
      "state": "Berlin",
      "amtsgericht": "Amtsgericht Berlin (Charlottenburg)",
      "registernummer": "HRB 148053",
      "registerart": "HRB",
      "company_name": "clubspo11 AG",
      "company_seat": "Berlin",
      "details": "22.01.2025 (Bekanntmachungsdatum)\n\nBerlin Amtsgericht Berlin (Charlottenburg) HRB 148053\nSonstige Registerbekanntmachung\n\nclubspo11 AG\nAktiengesellschaft\nBerlin\n\nAls nicht eingetragen wird veröffentlicht: Es wurde eine neue Liste der Aufsichtsratsmitglieder eingereicht (§ 106 AktG)."
    },
    {
      "date": "2025-01-22",
      "id": "99239",
      "original_text": "Sonstige Registerbekanntmachung\nBaden-Württemberg Amtsgericht Stuttgart HRB 230261\neVitis GmbH – Owen",
      "type": "Sonstige Registerbekanntmachung",
      "state": "Baden-Württemberg",
      "amtsgericht": "Amtsgericht Stuttgart",
      "registernummer": "HRB 230261",
      "registerart": "HRB",
      "company_name": "eVitis GmbH",
      "company_seat": "Owen",
      "details": "22.01.2025 (Bekanntmachungsdatum)\n\nBaden-Württemberg Amtsgericht Stuttgart HRB 230261\nSonstige Registerbekanntmachung 22.01.2025 (Eintragungsdatum)\n\neVitis GmbH\nGesellschaft mit beschränkter Haftung\nOwen\n\nAls nicht eingetragen wird bekanntgemacht:\nDen Gläubigern der Gesellschaft, deren Forderungen begründet worden sind, bevor die Eintragung der Beendigung des Vertrages in das Handelsregister nach § 10 HGB als bekanntgemacht gilt, ist vom anderen Vertragsteil Sicherheit zu leisten, wenn sie sich binnen sechs Monaten nach der Bekanntmachung zu diesem Zweck bei ihm melden."
    },
    {
      "date": "2025-01-22",
      "id": "99240",
      "original_text": "Registerbekanntmachung nach dem Umwandlungsgesetz\nSchleswig-Holstein Amtsgericht Kiel HRA 12406\nRögner KG – Kaltenkirchen",
      "type": "Registerbekanntmachung nach dem Umwandlungsgesetz",
      "state": "Schleswig-Holstein",
      "amtsgericht": "Amtsgericht Kiel",
      "registernummer": "HRA 12406",
      "registerart": "HRA",
      "company_name": "Rögner KG",
      "company_seat": "Kaltenkirchen",
      "details": "22.01.2025 (Bekanntmachungsdatum)\n\nSchleswig-Holstein Amtsgericht Kiel HRA 12406\nRegisterbekanntmachung nach dem Umwandlungsgesetz 21.01.2025 (Eintragungsdatum)\n\nRögner KG\nKommanditgesellschaft\nKaltenkirchen\n\nZu Eintragungsnummer 2 vom 21.01.2025 wird als nicht eingetragen veröffentlicht: Den Gläubigern der an der Spaltung beteiligten Rechtsträger ist, wenn sie binnen sechs Monaten nach dem Tag, an dem die Eintragung der Spaltung in das Register des Sitzes desjenigen Rechtsträgers, dessen Gläubiger sie sind,  bekannt gemacht worden ist, ihren Anspruch nach Grund und Höhe schriftlich anmelden, Sicherheit zu leisten, soweit sie nicht Befriedigung verlangen können. Dieses Recht steht den Gläubigern jedoch nur zu, wenn sie glaubhaft machen, dass durch die Spaltung die Erfüllung ihrer Forderung gefährdet wird."
    },
    {
      "date": "2025-01-22",
      "id": "99241",
      "original_text": "Registerbekanntmachung nach dem Umwandlungsgesetz\nSchleswig-Holstein Amtsgericht Kiel HRA 12316\nRögner - Individuelles Möbelstudio und Systemeinbau e. K. – Kaltenkirchen",
      "type": "Registerbekanntmachung nach dem Umwandlungsgesetz",
      "state": "Schleswig-Holstein",
      "amtsgericht": "Amtsgericht Kiel",
      "registernummer": "HRA 12316",
      "registerart": "HRA",
      "company_name": "Rögner - Individuelles Möbelstudio und Systemeinbau e. K.",
      "company_seat": "Kaltenkirchen",
      "details": "22.01.2025 (Bekanntmachungsdatum)\n\nSchleswig-Holstein Amtsgericht Kiel HRA 12316\nRegisterbekanntmachung nach dem Umwandlungsgesetz 21.01.2025 (Eintragungsdatum)\n\nRögner - Individuelles Möbelstudio und Systemeinbau e. K.\nEinzelkaufmann / Einzelkauffrau\nKaltenkirchen\n\nZu Eintragungsnummer 2 vom 21.01.2025 wird als nicht eingetragen veröffentlicht: Den Gläubigern der an der Spaltung beteiligten Rechtsträger ist, wenn sie binnen sechs Monaten nach dem Tag, an dem die Eintragung der Spaltung in das Register des Sitzes desjenigen Rechtsträgers, dessen Gläubiger sie sind,  bekannt gemacht worden ist, ihren Anspruch nach Grund und Höhe schriftlich anmelden, Sicherheit zu leisten, soweit sie nicht Befriedigung verlangen können. Dieses Recht steht den Gläubigern jedoch nur zu, wenn sie glaubhaft machen, dass durch die Spaltung die Erfüllung ihrer Forderung gefährdet wird."
    },
    {
      "date": "2025-01-22",
      "id": "99242",
      "original_text": "Registerbekanntmachung nach dem Umwandlungsgesetz\nBaden-Württemberg Amtsgericht Mannheim HRB 711037\nThomas Bender Hausverwaltungen GmbH – Bruchsal",
      "type": "Registerbekanntmachung nach dem Umwandlungsgesetz",
      "state": "Baden-Württemberg",
      "amtsgericht": "Amtsgericht Mannheim",
      "registernummer": "HRB 711037",
      "registerart": "HRB",
      "company_name": "Thomas Bender Hausverwaltungen GmbH",
      "company_seat": "Bruchsal",
      "details": "22.01.2025 (Bekanntmachungsdatum)\n\nBaden-Württemberg Amtsgericht Mannheim HRB 711037\nRegisterbekanntmachung nach dem Umwandlungsgesetz 22.01.2025 (Eintragungsdatum)\n\nThomas Bender Hausverwaltungen GmbH\nGesellschaft mit beschränkter Haftung\nBruchsal\n\nDen Gläubigern der an der Verschmelzung beteiligten Rechtsträger ist, wenn sie binnen sechs Monaten nach dem Tag, an dem die Eintragung der Verschmelzung in das Register des Sitzes desjenigen Rechtsträgers, dessen Gläubiger sie sind, nach § 19 Abs. 3 UmwG als bekanntgemacht gilt, ihren Anspruch nach Grund und Höhe schriftlich anmelden, Sicherheit zu leisten, soweit sie nicht Befriedigung verlangen können. Dieses Recht steht den Gläubigern jedoch nur zu, wenn sie glaubhaft machen, dass durch die Verschmelzung die Erfüllung ihrer Forderung gefährdet wird."
    },
    {
      "date": "2025-01-22",
      "id": "99243",
      "original_text": "Löschungsankündigung\nBaden-Württemberg Amtsgericht Stuttgart HRB 727407\nDEUS Rescue GmbH – Bietigheim-Bissingen",
      "type": "Löschungsankündigung",
      "state": "Baden-Württemberg",
      "amtsgericht": "Amtsgericht Stuttgart",
      "registernummer": "HRB 727407",
      "registerart": "HRB",
      "company_name": "DEUS Rescue GmbH",
      "company_seat": "Bietigheim-Bissingen",
      "details": "22.01.2025 (Bekanntmachungsdatum)\n\nBaden-Württemberg Amtsgericht Stuttgart HRB 727407\nLöschungsankündigung\n\nDEUS Rescue GmbH\nGesellschaft mit beschränkter Haftung\nBietigheim-Bissingen\n\nDas Gericht beabsichtigt, die Gesellschaft wegen Vermögenslosigkeit im Handelsregister von Amts wegen nach § 394 FamFG zu löschen. Die Frist zur Geltendmachung eines Widerspruchs gegen die beabsichtigte Löschung ist auf zwei Monate ab Veröffentlichung bestimmt."
    },
    {
      "date": "2025-01-22",
      "id": "99244",
      "original_text": "Sonstige Registerbekanntmachung\nSchleswig-Holstein Amtsgericht Lübeck HRB 7048\ndatexa GmbH – Reinbek",
      "type": "Sonstige Registerbekanntmachung",
      "state": "Schleswig-Holstein",
      "amtsgericht": "Amtsgericht Lübeck",
      "registernummer": "HRB 7048",
      "registerart": "HRB",
      "company_name": "datexa GmbH",
      "company_seat": "Reinbek",
      "details": "22.01.2025 (Bekanntmachungsdatum)\n\nSchleswig-Holstein Amtsgericht Lübeck HRB 7048\nSonstige Registerbekanntmachung\n\ndatexa GmbH\nGesellschaft mit beschränkter Haftung\nReinbek\n\nAls nicht eingetragen wird veröffentlicht:\n\nAmtsgericht Lübeck, Am Burgfeld 7, 23568 Lübeck\n\nHerrn\nJan Köster\naufhältlich im Vereinigten Königreich\n\nUnser Zeichen: HRB 7048 HL\nDatum: 22.01.2025\n\nSehr geehrte Damen und Herren,\n\nin der Registersache\n\ndatexa GmbH\n\nergeben sich aus den mir vorliegenden Unterlagen Anhaltspunkte dafür, dass die Gesellschaft, als deren Geschäftsführer Sie noch eingetragen sind, vermögenslos ist:\n\nSchreiben des Finanzamtes Stormarn vom 13.11.2024\n\nIch beabsichtige daher, die Gesellschaft wegen Vermögenslosigkeit gemäß § 394 FamFG zu löschen.\n\nIch bestimme eine Frist von einem Monat zur Geltendmachung eines Widerspruchs gegen die Löschung, § 394 Abs. 2 S. 1 FamFG.\n\nWeiter bitte ich Sie, mir binnen derselben Frist mitzuteilen, ob die genannte Gesellschaft noch Vermögen hat, ggf. welche Vermögensgegenstände sie besitzt, ob die Gesellschaft noch Partei eines noch nicht rechtskräftig abgeschlossenen Rechtsstreits ist oder ob sonst noch eine Abwicklung stattfindet.\n\nNach Fristablauf ohne Widerspruch von Ihnen oder anderer Seite wird die Gesellschaft gelöscht.\n\nMit freundlichen Grüßen\nWolski,\nDipl.-Rechtspflegerin (FH)"
    },
    {
      "date": "2025-01-22",
      "id": "99245",
      "original_text": "Löschungsankündigung\nBaden-Württemberg Amtsgericht Mannheim HRB 732122\nlupuS 2 GmbH – Mannheim",
      "type": "Löschungsankündigung",
      "state": "Baden-Württemberg",
      "amtsgericht": "Amtsgericht Mannheim",
      "registernummer": "HRB 732122",
      "registerart": "HRB",
      "company_name": "lupuS 2 GmbH",
      "company_seat": "Mannheim",
      "details": "22.01.2025 (Bekanntmachungsdatum)\n\nBaden-Württemberg Amtsgericht Mannheim HRB 732122\nLöschungsankündigung 22.01.2025 (Eintragungsdatum)\n\nlupuS 2 GmbH\nGesellschaft mit beschränkter Haftung\nMannheim\n\nDas Gericht beabsichtigt, die Gesellschaft wegen Vermögenslosigkeit im Handelsregister von Amts wegen nach § 394 FamFG zu löschen. Die Frist zur Geltendmachung eines Widerspruchs gegen die beabsichtigte Löschung ist auf einen Monat ab Veröffentlichung bestimmt."
    },
    {
      "date": "2025-01-22",
      "id": "99246",
      "original_text": "Einreichung neuer Dokumente\nBerlin Amtsgericht Berlin (Charlottenburg) HRB 79833\nECOVIS Audit AG Wirtschaftsprüfungsgesellschaft – Berlin",
      "type": "Einreichung neuer Dokumente",
      "state": "Berlin",
      "amtsgericht": "Amtsgericht Berlin (Charlottenburg)",
      "registernummer": "HRB 79833",
      "registerart": "HRB",
      "company_name": "ECOVIS Audit AG Wirtschaftsprüfungsgesellschaft",
      "company_seat": "Berlin",
      "details": "22.01.2025 (Bekanntmachungsdatum)\n\nBerlin Amtsgericht Berlin (Charlottenburg) HRB 79833\nEinreichung neuer Dokumente\n\nECOVIS Audit AG Wirtschaftsprüfungsgesellschaft\nAktiengesellschaft\nBerlin\n\nAls nicht eingetragen wird veröffentlicht: Es wurde eine neue Liste der Aufsichtsratsmitglieder eingereicht (§ 106 AktG)."
    },
    {
      "date": "2025-01-22",
      "id": "99247",
      "original_text": "Sonstige Registerbekanntmachung\nHamburg Amtsgericht Hamburg HRB 98201\nJET Energy Trading GmbH – Hamburg",
      "type": "Sonstige Registerbekanntmachung",
      "state": "Hamburg",
      "amtsgericht": "Amtsgericht Hamburg",
      "registernummer": "HRB 98201",
      "registerart": "HRB",
      "company_name": "JET Energy Trading GmbH",
      "company_seat": "Hamburg",
      "details": "22.01.2025 (Bekanntmachungsdatum)\n\nHamburg Amtsgericht Hamburg HRB 98201\nSonstige Registerbekanntmachung 22.01.2025 (Eintragungsdatum)\n\nJET Energy Trading GmbH\nGesellschaft mit beschränkter Haftung\nHamburg\n\nAls nicht eingetragen wird bekannt gemacht:  Den Gläubigern der Gesellschaft, deren Forderungen begründet worden sind, bevor die Eintragung der Vertragsbeendigung in das Handelsregister nach § 10 HGB als bekannt gemacht gilt, ist vom anderen Vertragsteil Sicherheit zu leisten, wenn sie sich binnen 6 Monaten nach Bekanntmachung der Eintragung zu diesem Zweck bei ihm melden."
    },
    {
      "date": "2025-01-22",
      "id": "99248",
      "original_text": "Einreichung neuer Dokumente\nSachsen Amtsgericht Dresden HRB 13496\nStädtische Dienstleistungs-GmbH Zittau – Zittau",
      "type": "Einreichung neuer Dokumente",
      "state": "Sachsen",
      "amtsgericht": "Amtsgericht Dresden",
      "registernummer": "HRB 13496",
      "registerart": "HRB",
      "company_name": "Städtische Dienstleistungs-GmbH Zittau",
      "company_seat": "Zittau",
      "details": "22.01.2025 (Bekanntmachungsdatum)\n\nSachsen Amtsgericht Dresden HRB 13496\nEinreichung neuer Dokumente\n\nStädtische Dienstleistungs-GmbH Zittau\nGesellschaft mit beschränkter Haftung\nZittau\n\nAm 20.01.2025 wurde beim Handelsregister des Amtsgerichts Dresden die Liste der Mitglieder des Aufsichtsrats gemäß § 52 GmbHG eingereicht."
    },
    {
      "date": "2025-01-22",
      "id": "99249",
      "original_text": "Einreichung neuer Dokumente\nSachsen Amtsgericht Dresden HRB 3862\nWBG - Wohnungsbaugesellschaft mbH Weißwasser – Weißwasser",
      "type": "Einreichung neuer Dokumente",
      "state": "Sachsen",
      "amtsgericht": "Amtsgericht Dresden",
      "registernummer": "HRB 3862",
      "registerart": "HRB",
      "company_name": "WBG - Wohnungsbaugesellschaft mbH Weißwasser",
      "company_seat": "Weißwasser",
      "details": "22.01.2025 (Bekanntmachungsdatum)\n\nSachsen Amtsgericht Dresden HRB 3862\nEinreichung neuer Dokumente 22.01.2025 (Eintragungsdatum)\n\nWBG - Wohnungsbaugesellschaft mbH Weißwasser\nGesellschaft mit beschränkter Haftung\nWeißwasser\n\nAm 20.01.2025 wurde beim Handelsregister des Amtsgerichts Dresden die Liste der Mitglieder des Aufsichtsrats gemäß § 52 GmbHG eingereicht."
    },
    {
      "date": "2025-01-22",
      "id": "99250",
      "original_text": "Registerbekanntmachung nach dem Umwandlungsgesetz\nSachsen Amtsgericht Leipzig HRB 42070\nSAMU TRANSFORMS GmbH – Leipzig",
      "type": "Registerbekanntmachung nach dem Umwandlungsgesetz",
      "state": "Sachsen",
      "amtsgericht": "Amtsgericht Leipzig",
      "registernummer": "HRB 42070",
      "registerart": "HRB",
      "company_name": "SAMU TRANSFORMS GmbH",
      "company_seat": "Leipzig",
      "details": "22.01.2025 (Bekanntmachungsdatum)\n\nSachsen Amtsgericht Leipzig HRB 42070\nRegisterbekanntmachung nach dem Umwandlungsgesetz 22.01.2025 (Eintragungsdatum)\n\nSAMU TRANSFORMS GmbH\nGesellschaft mit beschränkter Haftung\nLeipzig\n\nDen Gläubigern der an der Verschmelzung beteiligten Rechtsträger ist, wenn sie binnen sechs Monaten nach dem Tag, an dem die Eintragung der Verschmelzung in das Register des Sitzes desjenigen Rechtsträgers, dessen Gläubiger sie sind, nach § 19 Abs. 3 UmwG als bekannt gemacht gilt, ihren Anspruch nach Grund und Höhe in Textform anmelden, Sicherheit zu leisten, soweit sie nicht Befriedigung verlangen können. Dieses Recht steht den Gläubigern jedoch nur zu, wenn sie glaubhaft machen, dass durch die Verschmelzung die Erfüllung der Forderung gefährdet wird."
    },
    {
      "date": "2025-01-22",
      "id": "99251",
      "original_text": "Einreichung neuer Dokumente\nSachsen Amtsgericht Dresden HRB 8065\nS.V. Holding Aktiengesellschaft – Dresden",
      "type": "Einreichung neuer Dokumente",
      "state": "Sachsen",
      "amtsgericht": "Amtsgericht Dresden",
      "registernummer": "HRB 8065",
      "registerart": "HRB",
      "company_name": "S.V. Holding Aktiengesellschaft",
      "company_seat": "Dresden",
      "details": "22.01.2025 (Bekanntmachungsdatum)\n\nSachsen Amtsgericht Dresden HRB 8065\nEinreichung neuer Dokumente 22.01.2025 (Eintragungsdatum)\n\nS.V. Holding Aktiengesellschaft\nAktiengesellschaft\nDresden\n\nAm 21.01.2025 wurde beim Handelsregister des Amtsgerichts Dresden die Liste der Mitglieder des Aufsichtsrats gemäß § 106 AktG eingereicht."
    },
    {
      "date": "2025-01-22",
      "id": "99252",
      "original_text": "Löschungsankündigung\nSachsen Amtsgericht Chemnitz HRB 31713\nvdb Briefmarken UG (haftungsbeschränkt) – Limbach-Oberfrohna",
      "type": "Löschungsankündigung",
      "state": "Sachsen",
      "amtsgericht": "Amtsgericht Chemnitz",
      "registernummer": "HRB 31713",
      "registerart": "HRB",
      "company_name": "vdb Briefmarken UG (haftungsbeschränkt)",
      "company_seat": "Limbach-Oberfrohna",
      "details": "22.01.2025 (Bekanntmachungsdatum)\n\nSachsen Amtsgericht Chemnitz HRB 31713\nLöschungsankündigung\n\nvdb Briefmarken UG (haftungsbeschränkt)\nGesellschaft mit beschränkter Haftung\nLimbach-Oberfrohna\n\nDas Registergericht beabsichtigt, die im Handelsregister eingetragene Gesellschaft von Amts wegen nach § 394 FamFG zu löschen. Die Frist zu Erhebung eines Widerspruchs gegen die beabsichtigte Löschung wird auf einen Monat festgesetzt."
    },
    {
      "date": "2025-01-22",
      "id": "99253",
      "original_text": "Einreichung neuer Dokumente\nSachsen Amtsgericht Chemnitz HRB 8499\nStadtwerke Oelsnitz/V. GmbH – Oelsnitz/Vogtl.",
      "type": "Einreichung neuer Dokumente",
      "state": "Sachsen",
      "amtsgericht": "Amtsgericht Chemnitz",
      "registernummer": "HRB 8499",
      "registerart": "HRB",
      "company_name": "Stadtwerke Oelsnitz/V. GmbH",
      "company_seat": "Oelsnitz/Vogtl.",
      "details": "22.01.2025 (Bekanntmachungsdatum)\n\nSachsen Amtsgericht Chemnitz HRB 8499\nEinreichung neuer Dokumente\n\nStadtwerke Oelsnitz/V. GmbH\nGesellschaft mit beschränkter Haftung\nOelsnitz/Vogtl.\n\nAm 21.01.2025 wurde beim Handelsregister des Amtsgerichts Chemnitz die Liste der Mitglieder des Aufsichtsrats gemäß § 52 GmbHG eingereicht."
    },
    {
      "date": "2025-01-22",
      "id": "99254",
      "original_text": "Einreichung neuer Dokumente\nSachsen Amtsgericht Dresden HRB 22280\nMorgenschweis Vermögensverwaltungs AG – Dresden",
      "type": "Einreichung neuer Dokumente",
      "state": "Sachsen",
      "amtsgericht": "Amtsgericht Dresden",
      "registernummer": "HRB 22280",
      "registerart": "HRB",
      "company_name": "Morgenschweis Vermögensverwaltungs AG",
      "company_seat": "Dresden",
      "details": "22.01.2025 (Bekanntmachungsdatum)\n\nSachsen Amtsgericht Dresden HRB 22280\nEinreichung neuer Dokumente 22.01.2025 (Eintragungsdatum)\n\nMorgenschweis Vermögensverwaltungs AG\nAktiengesellschaft\nDresden\n\nAm 14.01.2025 wurde beim Handelsregister des Amtsgerichts Dresden die Liste der Mitglieder des Aufsichtsrats gemäß § 106 AktG eingereicht."
    },
    {
      "date": "2025-01-22",
      "id": "99255",
      "original_text": "Einreichung neuer Dokumente\nSachsen Amtsgericht Dresden HRB 6983\nRegionalverkehr Sächsische Schweiz-Osterzgebirge GmbH – Pirna",
      "type": "Einreichung neuer Dokumente",
      "state": "Sachsen",
      "amtsgericht": "Amtsgericht Dresden",
      "registernummer": "HRB 6983",
      "registerart": "HRB",
      "company_name": "Regionalverkehr Sächsische Schweiz-Osterzgebirge GmbH",
      "company_seat": "Pirna",
      "details": "22.01.2025 (Bekanntmachungsdatum)\n\nSachsen Amtsgericht Dresden HRB 6983\nEinreichung neuer Dokumente\n\nRegionalverkehr Sächsische Schweiz-Osterzgebirge GmbH\nGesellschaft mit beschränkter Haftung\nPirna\n\nAm 20.01.2025 wurde beim Handelsregister des Amtsgerichts Dresden die Liste der Mitglieder des Aufsichtsrats gemäß § 52 GmbHG eingereicht."
    },
    {
      "date": "2025-01-22",
      "id": "99256",
      "original_text": "Registerbekanntmachung nach dem Umwandlungsgesetz\nSchleswig-Holstein Amtsgericht Kiel HRA 12398\nRistorante La Fontana e.Kfr. Inh. Ludovica Indomenico – Norderstedt",
      "type": "Registerbekanntmachung nach dem Umwandlungsgesetz",
      "state": "Schleswig-Holstein",
      "amtsgericht": "Amtsgericht Kiel",
      "registernummer": "HRA 12398",
      "registerart": "HRA",
      "company_name": "Ristorante La Fontana e.Kfr. Inh. Ludovica Indomenico",
      "company_seat": "Norderstedt",
      "details": "22.01.2025 (Bekanntmachungsdatum)\n\nSchleswig-Holstein Amtsgericht Kiel HRA 12398\nRegisterbekanntmachung nach dem Umwandlungsgesetz 21.01.2025 (Eintragungsdatum)\n\nRistorante La Fontana e.Kfr. Inh. Ludovica Indomenico\nEinzelkaufmann / Einzelkauffrau\nNorderstedt\n\nZu Eintragungsnummer 2 vom 21.01.2025 wird als nicht eingetragen veröffentlicht: Den Gläubigern der an der Spaltung beteiligten Rechtsträger ist, wenn sie binnen sechs Monaten nach dem Tag, an dem die Eintragung der Spaltung in das Register des Sitzes desjenigen Rechtsträgers, dessen Gläubiger sie sind,  bekannt gemacht worden ist, ihren Anspruch nach Grund und Höhe schriftlich anmelden, Sicherheit zu leisten, soweit sie nicht Befriedigung verlangen können. Dieses Recht steht den Gläubigern jedoch nur zu, wenn sie glaubhaft machen, dass durch die Spaltung die Erfüllung ihrer Forderung gefährdet wird."
    },
    {
      "date": "2025-01-22",
      "id": "99257",
      "original_text": "Einreichung neuer Dokumente\nNiedersachsen Amtsgericht Osnabrück HRB 110824 früher Amtsgericht Bad Iburg\nNiels-Stensen-Kliniken GmbH – Osnabrück",
      "type": "Einreichung neuer Dokumente",
      "state": "Niedersachsen",
      "amtsgericht": "Amtsgericht Osnabrück",
      "registernummer": "HRB 110824",
      "registerart": "HRB",
      "company_name": "Niels-Stensen-Kliniken GmbH",
      "company_seat": "Osnabrück",
      "former_amtsgericht": "Bad Iburg",
      "details": "22.01.2025 (Bekanntmachungsdatum)\n\nNiedersachsen Amtsgericht Osnabrück HRB 110824 früher Amtsgericht Bad Iburg\nEinreichung neuer Dokumente 22.01.2025 (Eintragungsdatum)\n\nNiels-Stensen-Kliniken GmbH\nGesellschaft mit beschränkter Haftung\nOsnabrück\n\nDie Liste der Mitglieder des Aufsichtsrats wurde beim Registergericht eingereicht."
    },
    {
      "date": "2025-01-22",
      "id": "99258",
      "original_text": "Registerbekanntmachung nach dem Umwandlungsgesetz\nNiedersachsen Amtsgericht Göttingen HRB 201519\nBK BeteiligungsKonzept GmbH – Göttingen",
      "type": "Registerbekanntmachung nach dem Umwandlungsgesetz",
      "state": "Niedersachsen",
      "amtsgericht": "Amtsgericht Göttingen",
      "registernummer": "HRB 201519",
      "registerart": "HRB",
      "company_name": "BK BeteiligungsKonzept GmbH",
      "company_seat": "Göttingen",
      "details": "22.01.2025 (Bekanntmachungsdatum)\n\nNiedersachsen Amtsgericht Göttingen HRB 201519\nRegisterbekanntmachung nach dem Umwandlungsgesetz 22.01.2025 (Eintragungsdatum)\n\nBK BeteiligungsKonzept GmbH\nGesellschaft mit beschränkter Haftung\nGöttingen\n\nDen Gläubigern der an der Verschmelzung beteiligten Rechtsträger ist, wenn sie binnen sechs Monaten nach dem Tag, an dem die Eintragung der Verschmelzung in das Register des Sitzes desjenigen Rechtsträgers, dessen Gläubiger sie sind, nach § 19  Abs.  3 UmwG als bekannt gemacht gilt, ihren Anspruch nach Grund und Höhe schriftlich anmelden, Sicherheit zu leisten, soweit sie nicht Befriedigung verlangen können. Dieses Recht steht den Gläubigern jedoch nur zu, wenn sie glaubhaft machen, dass durch die Verschmelzung die Erfüllung der Forderung gefährdet wird."
    },
    {
      "date": "2025-01-22",
      "id": "99259",
      "original_text": "Löschungsankündigung\nNiedersachsen Amtsgericht Lüneburg HRB 206329\nPola Eliz GmbH – Bleckede",
      "type": "Löschungsankündigung",
      "state": "Niedersachsen",
      "amtsgericht": "Amtsgericht Lüneburg",
      "registernummer": "HRB 206329",
      "registerart": "HRB",
      "company_name": "Pola Eliz GmbH",
      "company_seat": "Bleckede",
      "details": "22.01.2025 (Bekanntmachungsdatum)\n\nNiedersachsen Amtsgericht Lüneburg HRB 206329\nLöschungsankündigung 22.01.2025 (Eintragungsdatum)\n\nPola Eliz GmbH\nGesellschaft mit beschränkter Haftung\nBleckede\n\nDas Registergericht beabsichtigt, die Gesellschaft von Amts wegen nach § 394 FamFG zu löschen. Die Frist zur Erhebung eines Widerspruchs ist auf 1 Monat ab dieser Registerbekanntmachung festgesetzt."
    },
    {
      "date": "2025-01-22",
      "id": "99260",
      "original_text": "Registerbekanntmachung nach dem Umwandlungsgesetz\nNiedersachsen Amtsgericht Tostedt HRB 209792\nKabisch & Kabisch GmbH – Tostedt",
      "type": "Registerbekanntmachung nach dem Umwandlungsgesetz",
      "state": "Niedersachsen",
      "amtsgericht": "Amtsgericht Tostedt",
      "registernummer": "HRB 209792",
      "registerart": "HRB",
      "company_name": "Kabisch & Kabisch GmbH",
      "company_seat": "Tostedt",
      "details": "22.01.2025 (Bekanntmachungsdatum)\n\nNiedersachsen Amtsgericht Tostedt HRB 209792\nRegisterbekanntmachung nach dem Umwandlungsgesetz 22.01.2025 (Eintragungsdatum)\n\nKabisch & Kabisch GmbH\nGesellschaft mit beschränkter Haftung\nTostedt\n\nDen Gläubigern der an der Verschmelzung beteiligten Rechtsträger ist, wenn sie binnen sechs Monaten nach dem Tag, an dem die Eintragung der Verschmelzung in das Register des Sitzes desjenigen Rechtsträgers, dessen Gläubiger sie sind, nach § 19  Abs.  3 UmwG als bekannt gemacht gilt, ihren Anspruch nach Grund und Höhe schriftlich anmelden, Sicherheit zu leisten, soweit sie nicht Befriedigung verlangen können. Dieses Recht steht den Gläubigern jedoch nur zu, wenn sie glaubhaft machen, dass durch die Verschmelzung die Erfüllung der Forderung gefährdet wird."
    },
    {
      "date": "2025-01-22",
      "id": "99261",
      "original_text": "Löschungsankündigung\nNiedersachsen Amtsgericht Hildesheim HRB 200529\nMeyer Dachtechnik GmbH – Lehrte",
      "type": "Löschungsankündigung",
      "state": "Niedersachsen",
      "amtsgericht": "Amtsgericht Hildesheim",
      "registernummer": "HRB 200529",
      "registerart": "HRB",
      "company_name": "Meyer Dachtechnik GmbH",
      "company_seat": "Lehrte",
      "details": "22.01.2025 (Bekanntmachungsdatum)\n\nNiedersachsen Amtsgericht Hildesheim HRB 200529\nLöschungsankündigung\n\nMeyer Dachtechnik GmbH\nGesellschaft mit beschränkter Haftung\nLehrte\n\nDas Registergericht beabsichtigt, die Gesellschaft von Amts wegen nach § 394 FamFG zu löschen. Die Frist zur Erhebung eines Widerspruchs ist auf 1 Monat ab dieser Registerbekanntmachung festgesetzt."
    },
    {
      "date": "2025-01-22",
      "id": "99262",
      "original_text": "Löschungsankündigung\nNiedersachsen Amtsgericht Hannover HRA 204846\nCuervo GmbH & Co. KG – Ronnenberg",
      "type": "Löschungsankündigung",
      "state": "Niedersachsen",
      "amtsgericht": "Amtsgericht Hannover",
      "registernummer": "HRA 204846",
      "registerart": "HRA",
      "company_name": "Cuervo GmbH & Co. KG",
      "company_seat": "Ronnenberg",
      "details": "22.01.2025 (Bekanntmachungsdatum)\n\nNiedersachsen Amtsgericht Hannover HRA 204846\nLöschungsankündigung\n\nCuervo GmbH & Co. KG\nKommanditgesellschaft\nRonnenberg\n\nDas Registergericht beabsichtigt, die Firma von Amts wegen nach § 31 Abs. 2 Satz 2 HGB, § 393 FamFG zu löschen. Die Frist zur Erhebung eines Widerspruchs ist auf 1 Monat ab dieser Registerbekanntmachung festgesetzt."
    },
    {
      "date": "2025-01-22",
      "id": "99263",
      "original_text": "Registerbekanntmachung nach dem Umwandlungsgesetz\nNiedersachsen Amtsgericht Tostedt HRA 205457\nKabisch&Kabisch Inhaber Andreas Kabisch e. K. – Tostedt",
      "type": "Registerbekanntmachung nach dem Umwandlungsgesetz",
      "state": "Niedersachsen",
      "amtsgericht": "Amtsgericht Tostedt",
      "registernummer": "HRA 205457",
      "registerart": "HRA",
      "company_name": "Kabisch&Kabisch Inhaber Andreas Kabisch e. K.",
      "company_seat": "Tostedt",
      "details": "22.01.2025 (Bekanntmachungsdatum)\n\nNiedersachsen Amtsgericht Tostedt HRA 205457\nRegisterbekanntmachung nach dem Umwandlungsgesetz 22.01.2025 (Eintragungsdatum)\n\nKabisch&Kabisch Inhaber Andreas Kabisch e. K.\nEinzelkaufmann / Einzelkauffrau\nTostedt\n\nDen Gläubigern der an der Verschmelzung beteiligten Rechtsträger ist, wenn sie binnen sechs Monaten nach dem Tag, an dem die Eintragung der Verschmelzung in das Register des Sitzes desjenigen Rechtsträgers, dessen Gläubiger sie sind, nach § 19  Abs.  3 UmwG als bekannt gemacht gilt, ihren Anspruch nach Grund und Höhe schriftlich anmelden, Sicherheit zu leisten, soweit sie nicht Befriedigung verlangen können. Dieses Recht steht den Gläubigern jedoch nur zu, wenn sie glaubhaft machen, dass durch die Verschmelzung die Erfüllung der Forderung gefährdet wird."
    },
    {
      "date": "2025-01-22",
      "id": "99264",
      "original_text": "Sonstige Registerbekanntmachung\nNiedersachsen Amtsgericht Hannover HRB 55697\nHoneywell Specialty Chemicals Seelze GmbH – Seelze",
      "type": "Sonstige Registerbekanntmachung",
      "state": "Niedersachsen",
      "amtsgericht": "Amtsgericht Hannover",
      "registernummer": "HRB 55697",
      "registerart": "HRB",
      "company_name": "Honeywell Specialty Chemicals Seelze GmbH",
      "company_seat": "Seelze",
      "details": "22.01.2025 (Bekanntmachungsdatum)\n\nNiedersachsen Amtsgericht Hannover HRB 55697\nSonstige Registerbekanntmachung 22.01.2025 (Eintragungsdatum)\n\nHoneywell Specialty Chemicals Seelze GmbH\nGesellschaft mit beschränkter Haftung\nSeelze\n\nDen Gläubigern der Gesellschaft, deren Forderungen begründet worden sind, bevor die Eintragung der Beendigung des Vertrages in das Handelsregister nach § 10 HGB als bekanntgemacht gilt, ist vom anderen Vertragsteil Sicherheit zu leisten, wenn sie sich binnen sechs Monaten nach der Bekanntmachung zu diesem Zweck bei ihm melden."
    },
    {
      "date": "2025-01-22",
      "id": "99265",
      "original_text": "Löschungsankündigung\nNiedersachsen Amtsgericht Braunschweig HRA 10209\nStendel Immobilien, Inhaber Klaus Stendel e.K. – Braunschweig",
      "type": "Löschungsankündigung",
      "state": "Niedersachsen",
      "amtsgericht": "Amtsgericht Braunschweig",
      "registernummer": "HRA 10209",
      "registerart": "HRA",
      "company_name": "Stendel Immobilien, Inhaber Klaus Stendel e.K.",
      "company_seat": "Braunschweig",
      "details": "22.01.2025 (Bekanntmachungsdatum)\n\nNiedersachsen Amtsgericht Braunschweig HRA 10209\nLöschungsankündigung 22.01.2024 (Eintragungsdatum)\n\nStendel Immobilien, Inhaber Klaus Stendel e.K.\nEinzelkaufmann / Einzelkauffrau\nBraunschweig\n\nDas Registergericht beabsichtigt, die Firma von Amts wegen nach § 31 Abs. 2 Satz 2 HGB, § 393 FamFG zu löschen. Die Frist zur Erhebung eines Widerspruchs ist auf 1 Monat ab dieser Registerbekanntmachung festgesetzt."
    },
    {
      "date": "2025-01-22",
      "id": "99266",
      "original_text": "Löschungsankündigung\nNiedersachsen Amtsgericht Stadthagen HRA 200331\nBiPa Biogas 10 GmbH & Co.KG – Bückeburg",
      "type": "Löschungsankündigung",
      "state": "Niedersachsen",
      "amtsgericht": "Amtsgericht Stadthagen",
      "registernummer": "HRA 200331",
      "registerart": "HRA",
      "company_name": "BiPa Biogas 10 GmbH & Co.KG",
      "company_seat": "Bückeburg",
      "details": "22.01.2025 (Bekanntmachungsdatum)\n\nNiedersachsen Amtsgericht Stadthagen HRA 200331\nLöschungsankündigung\n\nBiPa Biogas 10 GmbH & Co.KG\nKommanditgesellschaft\nBückeburg\n\nDas Registergericht beabsichtigt, die Firma von Amts wegen nach § 394 FamFG zu löschen. Die Frist zur Erhebung eines Widerspruchs ist auf 1 Monat ab dieser Registerbekanntmachung festgesetzt."
    },
    {
      "date": "2025-01-22",
      "id": "99267",
      "original_text": "Einreichung neuer Dokumente\nNiedersachsen Amtsgericht Göttingen HRB 206919\nGöttingen Marketing GmbH – Göttingen",
      "type": "Einreichung neuer Dokumente",
      "state": "Niedersachsen",
      "amtsgericht": "Amtsgericht Göttingen",
      "registernummer": "HRB 206919",
      "registerart": "HRB",
      "company_name": "Göttingen Marketing GmbH",
      "company_seat": "Göttingen",
      "details": "22.01.2025 (Bekanntmachungsdatum)\n\nNiedersachsen Amtsgericht Göttingen HRB 206919\nEinreichung neuer Dokumente\n\nGöttingen Marketing GmbH\nGesellschaft mit beschränkter Haftung\nGöttingen\n\nDie Liste der Mitglieder des Aufsichtsrats wurde beim Registergericht eingereicht."
    },
    {
      "date": "2025-01-22",
      "id": "99268",
      "original_text": "Löschungsankündigung\nNiedersachsen Amtsgericht Tostedt HRB 208192\nSana-Anima UG (haftungsbeschränkt) – Buxtehude",
      "type": "Löschungsankündigung",
      "state": "Niedersachsen",
      "amtsgericht": "Amtsgericht Tostedt",
      "registernummer": "HRB 208192",
      "registerart": "HRB",
      "company_name": "Sana-Anima UG (haftungsbeschränkt)",
      "company_seat": "Buxtehude",
      "details": "22.01.2025 (Bekanntmachungsdatum)\n\nNiedersachsen Amtsgericht Tostedt HRB 208192\nLöschungsankündigung\n\nSana-Anima UG (haftungsbeschränkt)\nGesellschaft mit beschränkter Haftung\nBuxtehude\n\nDas Registergericht beabsichtigt, die Gesellschaft von Amts wegen nach § 394 FamFG zu löschen. Die Frist zur Erhebung eines Widerspruchs ist auf 1 Monat ab dieser Registerbekanntmachung festgesetzt."
    },
    {
      "date": "2025-01-22",
      "id": "99269",
      "original_text": "Einreichung neuer Dokumente\nNiedersachsen Amtsgericht Hannover HRB 209010\nStadtwerke Neustadt a. Rbge. GmbH – Neustadt",
      "type": "Einreichung neuer Dokumente",
      "state": "Niedersachsen",
      "amtsgericht": "Amtsgericht Hannover",
      "registernummer": "HRB 209010",
      "registerart": "HRB",
      "company_name": "Stadtwerke Neustadt a. Rbge. GmbH",
      "company_seat": "Neustadt",
      "details": "22.01.2025 (Bekanntmachungsdatum)\n\nNiedersachsen Amtsgericht Hannover HRB 209010\nEinreichung neuer Dokumente\n\nStadtwerke Neustadt a. Rbge. GmbH\nGesellschaft mit beschränkter Haftung\nNeustadt\n\nDie Liste der Mitglieder des Aufsichtsrats wurde beim Registergericht eingereicht."
    },
    {
      "date": "2025-01-22",
      "id": "99270",
      "original_text": "Sonstige Registerbekanntmachung\nNiedersachsen Amtsgericht Tostedt GnR 100017 früher Amtsgericht Stade\nVolksbank eG – Fredenbeck",
      "type": "Sonstige Registerbekanntmachung",
      "state": "Niedersachsen",
      "amtsgericht": "Amtsgericht Tostedt",
      "registernummer": "GnR 100017",
      "registerart": "GnR",
      "company_name": "Volksbank eG",
      "company_seat": "Fredenbeck",
      "former_amtsgericht": "Stade",
      "details": "22.01.2025 (Bekanntmachungsdatum)\n\nNiedersachsen Amtsgericht Tostedt GnR 100017 früher Amtsgericht Stade\nSonstige Registerbekanntmachung 05.09.2023 (Eintragungsdatum)\n\nVolksbank eG\neingetragene Genossenschaft\nFredenbeck\n\nNeue Regelung: Eine Nachschusspflicht der Mitglieder ist ausgeschlossen. Den Gläubigern der Genossenschaft ist, wenn sie sich binnen sechs Monaten nach dieser Bekanntmachung zu diesem Zweck bei der Genossenschaft melden, Sicherheit zu leisten, soweit sie nicht Befriedigung verlangen können."
    },
    {
      "date": "2025-01-22",
      "id": "99271",
      "original_text": "Registerbekanntmachung nach dem Umwandlungsgesetz\nNiedersachsen Amtsgericht Aurich HRB 202656\nOGE Verwaltungs GmbH – Leer",
      "type": "Registerbekanntmachung nach dem Umwandlungsgesetz",
      "state": "Niedersachsen",
      "amtsgericht": "Amtsgericht Aurich",
      "registernummer": "HRB 202656",
      "registerart": "HRB",
      "company_name": "OGE Verwaltungs GmbH",
      "company_seat": "Leer",
      "details": "22.01.2025 (Bekanntmachungsdatum)\n\nNiedersachsen Amtsgericht Aurich HRB 202656\nRegisterbekanntmachung nach dem Umwandlungsgesetz 22.01.2025 (Eintragungsdatum)\n\nOGE Verwaltungs GmbH\nGesellschaft mit beschränkter Haftung\nLeer\n\nDen Gläubigern der an der Verschmelzung beteiligten Rechtsträger ist, wenn sie binnen sechs Monaten nach dem Tag, an dem die Eintragung der Verschmelzung in das Register des Sitzes desjenigen Rechtsträgers, dessen Gläubiger sie sind, nach § 19  Abs.  3 UmwG als bekannt gemacht gilt, ihren Anspruch nach Grund und Höhe schriftlich anmelden, Sicherheit zu leisten, soweit sie nicht Befriedigung verlangen können. Dieses Recht steht den Gläubigern jedoch nur zu, wenn sie glaubhaft machen, dass durch die Verschmelzung die Erfüllung der Forderung gefährdet wird."
    },
    {
      "date": "2025-01-22",
      "id": "99272",
      "original_text": "Einreichung neuer Dokumente\nNiedersachsen Amtsgericht Hannover HRB 206946\nVermögensverwaltungsgesellschaft mbH des Niedersächsischen Beamtenbundes und Tarifunion – Hannover",
      "type": "Einreichung neuer Dokumente",
      "state": "Niedersachsen",
      "amtsgericht": "Amtsgericht Hannover",
      "registernummer": "HRB 206946",
      "registerart": "HRB",
      "company_name": "Vermögensverwaltungsgesellschaft mbH des Niedersächsischen Beamtenbundes und Tarifunion",
      "company_seat": "Hannover",
      "details": "22.01.2025 (Bekanntmachungsdatum)\n\nNiedersachsen Amtsgericht Hannover HRB 206946\nEinreichung neuer Dokumente\n\nVermögensverwaltungsgesellschaft mbH des Niedersächsischen Beamtenbundes und Tarifunion\nGesellschaft mit beschränkter Haftung\nHannover\n\nDie Liste der Mitglieder des Aufsichtsrats wurde beim Registergericht eingereicht."
    },
    {
      "date": "2025-01-22",
      "id": "99273",
      "original_text": "Registerbekanntmachung nach dem Umwandlungsgesetz\nNiedersachsen Amtsgericht Aurich HRB 202683\nJLO Jümme GmbH – Leer",
      "type": "Registerbekanntmachung nach dem Umwandlungsgesetz",
      "state": "Niedersachsen",
      "amtsgericht": "Amtsgericht Aurich",
      "registernummer": "HRB 202683",
      "registerart": "HRB",
      "company_name": "JLO Jümme GmbH",
      "company_seat": "Leer",
      "details": "22.01.2025 (Bekanntmachungsdatum)\n\nNiedersachsen Amtsgericht Aurich HRB 202683\nRegisterbekanntmachung nach dem Umwandlungsgesetz 22.01.2025 (Eintragungsdatum)\n\nJLO Jümme GmbH\nGesellschaft mit beschränkter Haftung\nLeer\n\nDen Gläubigern der an der Verschmelzung beteiligten Rechtsträger ist, wenn sie binnen sechs Monaten nach dem Tag, an dem die Eintragung der Verschmelzung in das Register des Sitzes desjenigen Rechtsträgers, dessen Gläubiger sie sind, nach § 19  Abs.  3 UmwG als bekannt gemacht gilt, ihren Anspruch nach Grund und Höhe schriftlich anmelden, Sicherheit zu leisten, soweit sie nicht Befriedigung verlangen können. Dieses Recht steht den Gläubigern jedoch nur zu, wenn sie glaubhaft machen, dass durch die Verschmelzung die Erfüllung der Forderung gefährdet wird."
    },
    {
      "date": "2025-01-22",
      "id": "99274",
      "original_text": "Registerbekanntmachung nach dem Umwandlungsgesetz\nNiedersachsen Amtsgericht Aurich HRB 202268\nEuphonia Beteiligungs UG (haftungsbeschränkt) – Leer",
      "type": "Registerbekanntmachung nach dem Umwandlungsgesetz",
      "state": "Niedersachsen",
      "amtsgericht": "Amtsgericht Aurich",
      "registernummer": "HRB 202268",
      "registerart": "HRB",
      "company_name": "Euphonia Beteiligungs UG (haftungsbeschränkt)",
      "company_seat": "Leer",
      "details": "22.01.2025 (Bekanntmachungsdatum)\n\nNiedersachsen Amtsgericht Aurich HRB 202268\nRegisterbekanntmachung nach dem Umwandlungsgesetz 22.01.2025 (Eintragungsdatum)\n\nEuphonia Beteiligungs UG (haftungsbeschränkt)\nGesellschaft mit beschränkter Haftung\nLeer\n\nDen Gläubigern der an der Verschmelzung beteiligten Rechtsträger ist, wenn sie binnen sechs Monaten nach dem Tag, an dem die Eintragung der Verschmelzung in das Register des Sitzes desjenigen Rechtsträgers, dessen Gläubiger sie sind, nach § 19  Abs.  3 UmwG als bekannt gemacht gilt, ihren Anspruch nach Grund und Höhe schriftlich anmelden, Sicherheit zu leisten, soweit sie nicht Befriedigung verlangen können. Dieses Recht steht den Gläubigern jedoch nur zu, wenn sie glaubhaft machen, dass durch die Verschmelzung die Erfüllung der Forderung gefährdet wird."
    },
    {
      "date": "2025-01-22",
      "id": "99275",
      "original_text": "Löschungsankündigung\nNiedersachsen Amtsgericht Braunschweig HRB 208377\nVest Design UG (haftungsbeschränkt) – Braunschweig",
      "type": "Löschungsankündigung",
      "state": "Niedersachsen",
      "amtsgericht": "Amtsgericht Braunschweig",
      "registernummer": "HRB 208377",
      "registerart": "HRB",
      "company_name": "Vest Design UG (haftungsbeschränkt)",
      "company_seat": "Braunschweig",
      "details": "22.01.2025 (Bekanntmachungsdatum)\n\nNiedersachsen Amtsgericht Braunschweig HRB 208377\nLöschungsankündigung\n\nVest Design UG (haftungsbeschränkt)\nGesellschaft mit beschränkter Haftung\nBraunschweig\n\nDas Registergericht beabsichtigt, die Gesellschaft von Amts wegen nach § 394 FamFG zu löschen. Die Frist zur Erhebung eines Widerspruchs ist auf 1 Monat ab dieser Registerbekanntmachung festgesetzt."
    },
    {
      "date": "2025-01-22",
      "id": "99276",
      "original_text": "Löschungsankündigung\nRheinland-Pfalz Amtsgericht Landau HRB 11377\nBolz & Eisold Bauunternehmung GmbH – Germersheim",
      "type": "Löschungsankündigung",
      "state": "Rheinland-Pfalz",
      "amtsgericht": "Amtsgericht Landau",
      "registernummer": "HRB 11377",
      "registerart": "HRB",
      "company_name": "Bolz & Eisold Bauunternehmung GmbH",
      "company_seat": "Germersheim",
      "details": "22.01.2025 (Bekanntmachungsdatum)\n\nRheinland-Pfalz Amtsgericht Landau HRB 11377\nLöschungsankündigung\n\nBolz & Eisold Bauunternehmung GmbH\nGesellschaft mit beschränkter Haftung\nGermersheim\n\nDas Registergericht beabsichtigt die Gesellschaft von Amts wegen nach § 394 FamFG zu löschen. Die Frist zur Erhebung eines Widerspruchs ist auf einen Monat festgesetzt."
    },
    {
      "date": "2025-01-22",
      "id": "99277",
      "original_text": "Sonstige Registerbekanntmachung\nRheinland-Pfalz Amtsgericht Kaiserslautern HRB 30450\nTEMAMED Medizintechnische Dienstleistungs GmbH – Kirchheimbolanden",
      "type": "Sonstige Registerbekanntmachung",
      "state": "Rheinland-Pfalz",
      "amtsgericht": "Amtsgericht Kaiserslautern",
      "registernummer": "HRB 30450",
      "registerart": "HRB",
      "company_name": "TEMAMED Medizintechnische Dienstleistungs GmbH",
      "company_seat": "Kirchheimbolanden",
      "details": "22.01.2025 (Bekanntmachungsdatum)\n\nRheinland-Pfalz Amtsgericht Kaiserslautern HRB 30450\nSonstige Registerbekanntmachung 22.01.2025 (Eintragungsdatum)\n\nTEMAMED Medizintechnische Dienstleistungs GmbH\nGesellschaft mit beschränkter Haftung\nKirchheimbolanden\n\nAls nicht eingetragen wird veröffentlicht: Den Gläubigern der Gesellschaft, deren Forderungen begründet worden sind, bevor die Eintragung der Beendigung des Gewinnabführungsvertrages in das Handelsregister nach § 10 des Handelsgesetzbuches als bekanntgemacht gilt, hat der andere Vertragsteil Sicherheit zu leisten, wenn sie sich binnen sechs Monaten nach der Bekanntmachung der Eintragung zu diesem Zweck bei ihm melden."
    },
    {
      "date": "2025-01-22",
      "id": "99278",
      "original_text": "Sonstige Registerbekanntmachung\nRheinland-Pfalz Amtsgericht Zweibrücken HRB 23382\nStadtwerke Pirmasens Verkehrs GmbH – Pirmasens",
      "type": "Sonstige Registerbekanntmachung",
      "state": "Rheinland-Pfalz",
      "amtsgericht": "Amtsgericht Zweibrücken",
      "registernummer": "HRB 23382",
      "registerart": "HRB",
      "company_name": "Stadtwerke Pirmasens Verkehrs GmbH",
      "company_seat": "Pirmasens",
      "details": "22.01.2025 (Bekanntmachungsdatum)\n\nRheinland-Pfalz Amtsgericht Zweibrücken HRB 23382\nSonstige Registerbekanntmachung\n\nStadtwerke Pirmasens Verkehrs GmbH\nGesellschaft mit beschränkter Haftung\nPirmasens\n\nDem Registergericht ist eine neue Liste der Mitglieder des Aufsichtsrates eingereicht worden."
    },
    {
      "date": "2025-01-22",
      "id": "99279",
      "original_text": "Sonstige Registerbekanntmachung\nRheinland-Pfalz Amtsgericht Kaiserslautern HRB 34042\nHERMED Technische Beratungs GmbH – Kirchheimbolanden",
      "type": "Sonstige Registerbekanntmachung",
      "state": "Rheinland-Pfalz",
      "amtsgericht": "Amtsgericht Kaiserslautern",
      "registernummer": "HRB 34042",
      "registerart": "HRB",
      "company_name": "HERMED Technische Beratungs GmbH",
      "company_seat": "Kirchheimbolanden",
      "details": "22.01.2025 (Bekanntmachungsdatum)\n\nRheinland-Pfalz Amtsgericht Kaiserslautern HRB 34042\nSonstige Registerbekanntmachung 22.01.2025 (Eintragungsdatum)\n\nHERMED Technische Beratungs GmbH\nGesellschaft mit beschränkter Haftung\nKirchheimbolanden\n\nAls nicht eingetragen wird veröffentlicht: Den Gläubigern der Gesellschaft, deren Forderungen begründet worden sind, bevor die Eintragung der Beendigung des Gewinnabführungsvertrages in das Handelsregister nach § 10 des Handelsgesetzbuches als bekanntgemacht gilt, hat der andere Vertragsteil Sicherheit zu leisten, wenn sie sich binnen sechs Monaten nach der Bekanntmachung der Eintragung zu diesem Zweck bei ihm melden."
    },
    {
      "date": "2025-01-22",
      "id": "99280",
      "original_text": "Löschungsankündigung\nBremen Amtsgericht Bremen HRB 35493\nBremer Kreativ Bau GmbH – Bremen",
      "type": "Löschungsankündigung",
      "state": "Bremen",
      "amtsgericht": "Amtsgericht Bremen",
      "registernummer": "HRB 35493",
      "registerart": "HRB",
      "company_name": "Bremer Kreativ Bau GmbH",
      "company_seat": "Bremen",
      "details": "22.01.2025 (Bekanntmachungsdatum)\n\nBremen Amtsgericht Bremen HRB 35493\nLöschungsankündigung\n\nBremer Kreativ Bau GmbH\nGesellschaft mit beschränkter Haftung\nBremen\n\nEs ist beabsichtigt die im Handelsregister eingetragene Gesellschaft von Amts wegen gemäß § 394 FamFG zu löschen. Gegen die Löschung kann beim AG Bremen schriftlich oder zu Protokoll der Geschäftsstelle Widerspruch eingelegt werden. Widerspruchsfrist 4 Wochen."
    },
    {
      "date": "2025-01-22",
      "id": "99281",
      "original_text": "Einreichung neuer Dokumente\nNordrhein-Westfalen Amtsgericht Münster HRB 20851\nDeutsches Rotes Kreuz Dienstleistungen Westfalen-Lippe GmbH – Münster",
      "type": "Einreichung neuer Dokumente",
      "state": "Nordrhein-Westfalen",
      "amtsgericht": "Amtsgericht Münster",
      "registernummer": "HRB 20851",
      "registerart": "HRB",
      "company_name": "Deutsches Rotes Kreuz Dienstleistungen Westfalen-Lippe GmbH",
      "company_seat": "Münster",
      "details": "22.01.2025 (Bekanntmachungsdatum)\n\nNordrhein-Westfalen Amtsgericht Münster HRB 20851\nEinreichung neuer Dokumente\n\nDeutsches Rotes Kreuz Dienstleistungen Westfalen-Lippe GmbH\nGesellschaft mit beschränkter Haftung\nMünster\n\nDem Registergericht ist eine neue Liste der Mitglieder des Aufsichtsrates eingereicht worden."
    },
    {
      "date": "2025-01-22",
      "id": "99282",
      "original_text": "Registerbekanntmachung nach dem Umwandlungsgesetz\nNordrhein-Westfalen Amtsgericht Münster HRB 15575\nCyberHealth GmbH – Münster",
      "type": "Registerbekanntmachung nach dem Umwandlungsgesetz",
      "state": "Nordrhein-Westfalen",
      "amtsgericht": "Amtsgericht Münster",
      "registernummer": "HRB 15575",
      "registerart": "HRB",
      "company_name": "CyberHealth GmbH",
      "company_seat": "Münster",
      "details": "22.01.2025 (Bekanntmachungsdatum)\n\nNordrhein-Westfalen Amtsgericht Münster HRB 15575\nRegisterbekanntmachung nach dem Umwandlungsgesetz 22.01.2025 (Eintragungsdatum)\n\nCyberHealth GmbH\nGesellschaft mit beschränkter Haftung\nMünster\n\nDen Gläubigern der an der Ausgliederung beteiligten Rechtsträger ist, wenn sie binnen sechs Monaten nach dem Tag, an dem die Eintragung der Ausgliederung in das Register des Sitzes desjenigen Rechtsträgers, dessen Gläubiger sie sind, nach § 19 Absatz 3 UmwG als bekanntgemacht gilt, ihren Anspruch nach Grund und Höhe schriftlich anmelden, Sicherheit zu leisten, soweit sie nicht Befriedigung verlangen können. Dieses Recht steht den Gläubigern jedoch nur zu, wenn sie glaubhaft machen, dass durch die Ausgliederung die Erfüllung ihrer Forderung gefährdet wird."
    },
    {
      "date": "2025-01-22",
      "id": "99283",
      "original_text": "Einreichung neuer Dokumente\nNordrhein-Westfalen Amtsgericht Bad Oeynhausen HRB 9171\nMerkur.com AG – Espelkamp",
      "type": "Einreichung neuer Dokumente",
      "state": "Nordrhein-Westfalen",
      "amtsgericht": "Amtsgericht Bad Oeynhausen",
      "registernummer": "HRB 9171",
      "registerart": "HRB",
      "company_name": "Merkur.com AG",
      "company_seat": "Espelkamp",
      "details": "22.01.2025 (Bekanntmachungsdatum)\n\nNordrhein-Westfalen Amtsgericht Bad Oeynhausen HRB 9171\nEinreichung neuer Dokumente\n\nMerkur.com AG\nAktiengesellschaft\nEspelkamp\n\nDem Registergericht ist eine neue Liste der Mitglieder des Aufsichtsrates eingereicht worden."
    },
    {
      "date": "2025-01-22",
      "id": "99284",
      "original_text": "Einreichung neuer Dokumente\nNordrhein-Westfalen Amtsgericht Essen HRB 31402\nTK Elevator GmbH – Essen",
      "type": "Einreichung neuer Dokumente",
      "state": "Nordrhein-Westfalen",
      "amtsgericht": "Amtsgericht Essen",
      "registernummer": "HRB 31402",
      "registerart": "HRB",
      "company_name": "TK Elevator GmbH",
      "company_seat": "Essen",
      "details": "22.01.2025 (Bekanntmachungsdatum)\n\nNordrhein-Westfalen Amtsgericht Essen HRB 31402\nEinreichung neuer Dokumente\n\nTK Elevator GmbH\nGesellschaft mit beschränkter Haftung\nEssen\n\nDem Registergericht ist eine neue Liste der Mitglieder des Aufsichtsrates eingereicht worden."
    },
    {
      "date": "2025-01-22",
      "id": "99285",
      "original_text": "Einreichung neuer Dokumente\nNordrhein-Westfalen Amtsgericht Münster HRB 461\nWestfälische Verkehrsgesellschaft mbH – Münster",
      "type": "Einreichung neuer Dokumente",
      "state": "Nordrhein-Westfalen",
      "amtsgericht": "Amtsgericht Münster",
      "registernummer": "HRB 461",
      "registerart": "HRB",
      "company_name": "Westfälische Verkehrsgesellschaft mbH",
      "company_seat": "Münster",
      "details": "22.01.2025 (Bekanntmachungsdatum)\n\nNordrhein-Westfalen Amtsgericht Münster HRB 461\nEinreichung neuer Dokumente\n\nWestfälische Verkehrsgesellschaft mbH\nGesellschaft mit beschränkter Haftung\nMünster\n\nDem Registergericht ist eine neue Liste der Mitglieder des Aufsichtsrates eingereicht worden."
    },
    {
      "date": "2025-01-22",
      "id": "99286",
      "original_text": "Löschungsankündigung\nNordrhein-Westfalen Amtsgericht Düsseldorf HRB 99563\nPAK Bau- und Immobilienservice GmbH – Düsseldorf",
      "type": "Löschungsankündigung",
      "state": "Nordrhein-Westfalen",
      "amtsgericht": "Amtsgericht Düsseldorf",
      "registernummer": "HRB 99563",
      "registerart": "HRB",
      "company_name": "PAK Bau- und Immobilienservice GmbH",
      "company_seat": "Düsseldorf",
      "details": "22.01.2025 (Bekanntmachungsdatum)\n\nNordrhein-Westfalen Amtsgericht Düsseldorf HRB 99563\nLöschungsankündigung\n\nPAK Bau- und Immobilienservice GmbH\nGesellschaft mit beschränkter Haftung\nDüsseldorf\n\nDas Registergericht beabsichtigt die Gesellschaft von Amts wegen nach § 394 FamFG zu löschen. Die Frist zur Erhebung eines Widerspruchs ist auf 3 Wochen festgesetzt.\n\nRechtsbehelfsbelehrung:\nDas Widerspruchsrecht steht jedem zu, der an der Unterlassung der Löschung ein berechtigtes Interesse hat. Der Widerspruch ist bei dem Amtsgericht Düsseldorf -Registergericht-, Werdener Straße 1, 40227 Düsseldorf schriftlich in deutscher Sprache oder zur Niederschrift der Geschäftsstelle einzulegen. Der Widerspruch kann auch zur Niederschrift der Geschäftsstelle eines jeden Amtsgerichtes abgegeben werden. Die Einlegung ist auch durch Übertragung eines elektronischen Dokuments an die elektronische Poststelle des Gerichts möglich. Das elektronische Dokument muss für die Bearbeitung durch das Gericht geeignet und mit einer qualifizierten elektronischen Signatur der verantwortenden Person versehen sein oder von der verantwortenden Person signiert und auf einem sicheren Übermittlungsweg gemäß § 130a ZPO nach näherer Maßgabe der Verordnung über die technischen Rahmenbedingungen des elektronischen Rechtsverkehrs und über das besondere elektronische Behördenpostfach (BGBl. I, S.3803) eingereicht werden. Weitere Informationen erhalten Sie auf der Internetseite www.justiz.de.\nDer Widerspruch muss spätestens innerhalb der gesetzten Frist nach dem Datum der Bekanntmachung der Löschungsankündigung bei dem Amtsgericht - Registergericht - Düsseldorf eingegangen sein.  Dies gilt auch dann, wenn der Widerspruch zur Niederschrift der Geschäftsstelle eines anderen Amtsgerichtes abgegeben wurde. Die Frist beginnt mit dem Tage der Bekanntmachung der Löschungsankündigung in dem für die Bekanntmachung der Eintragungen in das Handelsregister bestimmten elektronischen Informations- und Kommunikationssystem nach § 10 des Handelsgesetzbuches. Fällt das Ende der Frist auf einen Sonntag, einen allgemeinen Feiertag oder Sonnabend, so endet die Frist mit Ablauf des nächsten Werktages.\nDer Widerspruch muss die Bezeichnung der angefochtenen Löschungsankündigung sowie die Erklärung enthalten, dass Widerspruch gegen diese Löschungsankündigung eingelegt wird. Er ist zu unterzeichnen und soll begründet werden."
    },
    {
      "date": "2025-01-22",
      "id": "99287",
      "original_text": "Löschungsankündigung\nNordrhein-Westfalen Amtsgericht Kleve HRB 18754\nMoni Bau GmbH – Kamp-Lintfort",
      "type": "Löschungsankündigung",
      "state": "Nordrhein-Westfalen",
      "amtsgericht": "Amtsgericht Kleve",
      "registernummer": "HRB 18754",
      "registerart": "HRB",
      "company_name": "Moni Bau GmbH",
      "company_seat": "Kamp-Lintfort",
      "details": "22.01.2025 (Bekanntmachungsdatum)\n\nNordrhein-Westfalen Amtsgericht Kleve HRB 18754\nLöschungsankündigung\n\nMoni Bau GmbH\nGesellschaft mit beschränkter Haftung\nKamp-Lintfort\n\nDas Registergericht beabsichtigt die Gesellschaft von Amts wegen nach § 394 FamFG zu löschen. Die Frist zur Erhebung eines Widerspruchs ist auf einen Monat festgesetzt."
    },
    {
      "date": "2025-01-22",
      "id": "99288",
      "original_text": "Löschungsankündigung\nNordrhein-Westfalen Amtsgericht Hamm HRB 9122\nRehneses GmbH – Hamm",
      "type": "Löschungsankündigung",
      "state": "Nordrhein-Westfalen",
      "amtsgericht": "Amtsgericht Hamm",
      "registernummer": "HRB 9122",
      "registerart": "HRB",
      "company_name": "Rehneses GmbH",
      "company_seat": "Hamm",
      "details": "22.01.2025 (Bekanntmachungsdatum)\n\nNordrhein-Westfalen Amtsgericht Hamm HRB 9122\nLöschungsankündigung\n\nRehneses GmbH\nGesellschaft mit beschränkter Haftung\nHamm\n\nDas Registergericht beabsichtigt die Gesellschaft von Amts wegen nach § 394 FamFG zu löschen. Die Frist zur Erhebung eines Widerspruchs ist auf drei Monate festgesetzt."
    },
    {
      "date": "2025-01-22",
      "id": "99289",
      "original_text": "Löschungsankündigung\nNordrhein-Westfalen Amtsgericht Krefeld HRB 19727\nEdora Trading GmbH – Krefeld",
      "type": "Löschungsankündigung",
      "state": "Nordrhein-Westfalen",
      "amtsgericht": "Amtsgericht Krefeld",
      "registernummer": "HRB 19727",
      "registerart": "HRB",
      "company_name": "Edora Trading GmbH",
      "company_seat": "Krefeld",
      "details": "22.01.2025 (Bekanntmachungsdatum)\n\nNordrhein-Westfalen Amtsgericht Krefeld HRB 19727\nLöschungsankündigung\n\nEdora Trading GmbH\nGesellschaft mit beschränkter Haftung\nKrefeld\n\nDas Registergericht beabsichtigt die Gesellschaft von Amts wegen nach § 394 FamFG zu löschen. Die Frist zur Erhebung eines Widerspruchs ist auf einen Monat festgesetzt."
    },
    {
      "date": "2025-01-22",
      "id": "99290",
      "original_text": "Einreichung neuer Dokumente\nNordrhein-Westfalen Amtsgericht Köln HRB 95366\nOpen-Xchange AG – Köln",
      "type": "Einreichung neuer Dokumente",
      "state": "Nordrhein-Westfalen",
      "amtsgericht": "Amtsgericht Köln",
      "registernummer": "HRB 95366",
      "registerart": "HRB",
      "company_name": "Open-Xchange AG",
      "company_seat": "Köln",
      "details": "22.01.2025 (Bekanntmachungsdatum)\n\nNordrhein-Westfalen Amtsgericht Köln HRB 95366\nEinreichung neuer Dokumente\n\nOpen-Xchange AG\nAktiengesellschaft\nKöln\n\nDem Registergericht ist eine Liste der Mitglieder des Aufsichtsrates eingereicht worden."
    },
    {
      "date": "2025-01-22",
      "id": "99291",
      "original_text": "Löschungsankündigung\nNordrhein-Westfalen Amtsgericht Krefeld HRB 12683\nAutogaspoint UG (haftungsbeschränkt) – Krefeld",
      "type": "Löschungsankündigung",
      "state": "Nordrhein-Westfalen",
      "amtsgericht": "Amtsgericht Krefeld",
      "registernummer": "HRB 12683",
      "registerart": "HRB",
      "company_name": "Autogaspoint UG (haftungsbeschränkt)",
      "company_seat": "Krefeld",
      "details": "22.01.2025 (Bekanntmachungsdatum)\n\nNordrhein-Westfalen Amtsgericht Krefeld HRB 12683\nLöschungsankündigung\n\nAutogaspoint UG (haftungsbeschränkt)\nGesellschaft mit beschränkter Haftung\nKrefeld\n\nDas Registergericht beabsichtigt die Gesellschaft von Amts wegen nach § 394 FamFG zu löschen. Die Frist zur Erhebung eines Widerspruchs ist auf einen Monat festgesetzt."
    },
    {
      "date": "2025-01-22",
      "id": "99292",
      "original_text": "Registerbekanntmachung nach dem Umwandlungsgesetz\nNordrhein-Westfalen Amtsgericht Münster HRB 16270\nCyberFitness GmbH – Münster",
      "type": "Registerbekanntmachung nach dem Umwandlungsgesetz",
      "state": "Nordrhein-Westfalen",
      "amtsgericht": "Amtsgericht Münster",
      "registernummer": "HRB 16270",
      "registerart": "HRB",
      "company_name": "CyberFitness GmbH",
      "company_seat": "Münster",
      "details": "22.01.2025 (Bekanntmachungsdatum)\n\nNordrhein-Westfalen Amtsgericht Münster HRB 16270\nRegisterbekanntmachung nach dem Umwandlungsgesetz 22.01.2025 (Eintragungsdatum)\n\nCyberFitness GmbH\nGesellschaft mit beschränkter Haftung\nMünster\n\nDen Gläubigern der an der Ausgliederung beteiligten Rechtsträger ist, wenn sie binnen sechs Monaten nach dem Tag, an dem die Eintragung der Ausgliederung in das Register des Sitzes desjenigen Rechtsträgers, dessen Gläubiger sie sind, nach § 19 Absatz 3 UmwG als bekanntgemacht gilt, ihren Anspruch nach Grund und Höhe schriftlich anmelden, Sicherheit zu leisten, soweit sie nicht Befriedigung verlangen können. Dieses Recht steht den Gläubigern jedoch nur zu, wenn sie glaubhaft machen, dass durch die Ausgliederung die Erfüllung ihrer Forderung gefährdet wird."
    },
    {
      "date": "2025-01-22",
      "id": "99293",
      "original_text": "Einreichung neuer Dokumente\nNordrhein-Westfalen Amtsgericht Essen HRB 26385\nCovivio Immobilien SE – Essen",
      "type": "Einreichung neuer Dokumente",
      "state": "Nordrhein-Westfalen",
      "amtsgericht": "Amtsgericht Essen",
      "registernummer": "HRB 26385",
      "registerart": "HRB",
      "company_name": "Covivio Immobilien SE",
      "company_seat": "Essen",
      "details": "22.01.2025 (Bekanntmachungsdatum)\n\nNordrhein-Westfalen Amtsgericht Essen HRB 26385\nEinreichung neuer Dokumente\n\nCovivio Immobilien SE\nEuropäische Aktiengesellschaft (SE)\nEssen"
    },
    {
      "date": "2025-01-22",
      "id": "99294",
      "original_text": "Einreichung neuer Dokumente\nNordrhein-Westfalen Amtsgericht Köln HRB 85281\nCovestro AG – Leverkusen",
      "type": "Einreichung neuer Dokumente",
      "state": "Nordrhein-Westfalen",
      "amtsgericht": "Amtsgericht Köln",
      "registernummer": "HRB 85281",
      "registerart": "HRB",
      "company_name": "Covestro AG",
      "company_seat": "Leverkusen",
      "details": "22.01.2025 (Bekanntmachungsdatum)\n\nNordrhein-Westfalen Amtsgericht Köln HRB 85281\nEinreichung neuer Dokumente\n\nCovestro AG\nAktiengesellschaft\nLeverkusen\n\nDem Registergericht ist eine Liste der Mitglieder des Aufsichtsrates eingereicht worden."
    },
    {
      "date": "2025-01-22",
      "id": "99295",
      "original_text": "Löschungsankündigung\nNordrhein-Westfalen Amtsgericht Duisburg HRB 33005\nN.B. Bedachung UG (haftungsbeschränkt) – Oberhausen",
      "type": "Löschungsankündigung",
      "state": "Nordrhein-Westfalen",
      "amtsgericht": "Amtsgericht Duisburg",
      "registernummer": "HRB 33005",
      "registerart": "HRB",
      "company_name": "N.B. Bedachung UG (haftungsbeschränkt)",
      "company_seat": "Oberhausen",
      "details": "22.01.2025 (Bekanntmachungsdatum)\n\nNordrhein-Westfalen Amtsgericht Duisburg HRB 33005\nLöschungsankündigung\n\nN.B. Bedachung UG (haftungsbeschränkt)\nGesellschaft mit beschränkter Haftung\nOberhausen\n\nDas Registergericht beabsichtigt, die im Handelsregister unter HRB 33005  eingetragene Gesellschaft N.B. Bedachung UG (haftungsbeschränkt)  gemäß § 394 FamFG wegen Vermögenslosigkeit von Amts wegen zu löschen. Gegen diese Verfügung kann Widerspruch eingelegt werden. Die Frist zur Erhebung eines Widerspruchs gegen die beabsichtigte Löschung von Amts wegen ist auf drei Monate festgesetzt. Rechtsbehelfsbelehrung Der Widerspruch ist bei dem Amtsgericht Duisburg, Kardinal-Galen-Str. 124-132, 47058 Duisburg schriftlich in deutscher Sprache oder zur Niederschrift der Geschäftsstelle einzulegen. Der Widerspruch kann auch zur Niederschrift der Geschäftsstelle eines jeden Amtsgerichtes abgegeben werden. Die Einlegung ist auch durch Übertragung eines elektronischen Dokuments an die elektronische Poststelle des Gerichts möglich. Das elektronische Dokument muss für die Bearbeitung durch das Gericht geeignet und mit einer qualifizierten elektronischen Signatur der verantwortenden Person versehen sein oder von der verantwortenden Person signiert und auf einem sicheren Übermittlungsweg gemäß § 130 a ZPO nach näherer Maßgabe der Verordnung über die technischen Rahmenbedingungen des elektronischen Rechtsverkehrs und über das besondere elektronische Behördenpostfach (BGBl. I, S. 3803) eingereicht werden. Weitere Informationen erhalten Sie auf der Internetseite www.justiz.de <http://www.justiz.de>. Der Widerspruch muss spätestens innerhalb der gesetzten Frist bei dem Amtsgericht Duisburg eingegangen sein. Dies gilt auch dann, wenn der Widerspruch zur Niederschrift der Geschäftsstelle eines anderen Amtsgerichtes abgegeben wurde. Die Frist beginnt mit der Veröffentlichung. Fällt das Ende der Frist auf einen Sonntag, einen allgemeinen Feiertag oder Sonnabend, so endet die Frist mit Ablauf des nächsten Werktages. Der Widerspruch muss die Bezeichnung der angefochtenen Verfügung sowie die Erklärung enthalten, dass Widerspruch gegen diese Verfügung eingelegt wird. Er ist zu unterzeichnen und soll begründet werden."
    },
    {
      "date": "2025-01-22",
      "id": "99296",
      "original_text": "Registerbekanntmachung nach dem Umwandlungsgesetz\nNordrhein-Westfalen Amtsgericht Lemgo HRA 3746\nPhoenix Contact GmbH & Co. KG – Blomberg",
      "type": "Registerbekanntmachung nach dem Umwandlungsgesetz",
      "state": "Nordrhein-Westfalen",
      "amtsgericht": "Amtsgericht Lemgo",
      "registernummer": "HRA 3746",
      "registerart": "HRA",
      "company_name": "Phoenix Contact GmbH & Co. KG",
      "company_seat": "Blomberg",
      "details": "22.01.2025 (Bekanntmachungsdatum)\n\nNordrhein-Westfalen Amtsgericht Lemgo HRA 3746\nRegisterbekanntmachung nach dem Umwandlungsgesetz 22.01.2025 (Eintragungsdatum)\n\nPhoenix Contact GmbH & Co. KG\nKommanditgesellschaft\nBlomberg\n\nDen Gläubigern der an der Verschmelzung beteiligten Rechtsträger ist, wenn sie binnen sechs Monaten nach dem Tag, an dem die Eintragung der Verschmelzung in das Register des Sitzes desjenigen Rechtsträgers, dessen Gläubiger sie sind, nach § 19 Absatz 3 UmwG als bekanntgemacht gilt, ihren Anspruch nach Grund und Höhe schriftlich anmelden, Sicherheit zu leisten, soweit sie nicht Befriedigung verlangen können. Dieses Recht steht den Gläubigern jedoch nur zu, wenn sie glaubhaft machen, dass durch die Verschmelzung die Erfüllung ihrer Forderung gefährdet wird."
    },
    {
      "date": "2025-01-22",
      "id": "99297",
      "original_text": "Registerbekanntmachung nach dem Umwandlungsgesetz\nNordrhein-Westfalen Amtsgericht Köln HRB 102694\nWonderland GmbH – Köln",
      "type": "Registerbekanntmachung nach dem Umwandlungsgesetz",
      "state": "Nordrhein-Westfalen",
      "amtsgericht": "Amtsgericht Köln",
      "registernummer": "HRB 102694",
      "registerart": "HRB",
      "company_name": "Wonderland GmbH",
      "company_seat": "Köln",
      "details": "22.01.2025 (Bekanntmachungsdatum)\n\nNordrhein-Westfalen Amtsgericht Köln HRB 102694\nRegisterbekanntmachung nach dem Umwandlungsgesetz 22.01.2025 (Eintragungsdatum)\n\nWonderland GmbH\nGesellschaft mit beschränkter Haftung\nKöln\n\nDen Gläubigern der an der formwechselnden Umwandlung beteiligten Rechtsträger ist, wenn sie binnen sechs Monaten nach dem Tag, an dem die Eintragung der formwechselnden Umwandlung in das Register des Sitzes desjenigen Rechtsträgers, dessen Gläubiger sie sind, nach § 19 Absatz 3 UmwG als bekanntgemacht gilt, ihren Anspruch nach Grund und Höhe schriftlich anmelden, Sicherheit zu leisten, soweit sie nicht Befriedigung verlangen können. Dieses Recht steht den Gläubigern jedoch nur zu, wenn sie glaubhaft machen, dass durch die formwechselnden Umwandlung die Erfüllung ihrer Forderung gefährdet wird."
    },
    {
      "date": "2025-01-22",
      "id": "99298",
      "original_text": "Löschungsankündigung\nNordrhein-Westfalen Amtsgericht Köln HRA 29236\nLEYCON CC GmbH & Co. KG – Köln",
      "type": "Löschungsankündigung",
      "state": "Nordrhein-Westfalen",
      "amtsgericht": "Amtsgericht Köln",
      "registernummer": "HRA 29236",
      "registerart": "HRA",
      "company_name": "LEYCON CC GmbH & Co. KG",
      "company_seat": "Köln",
      "details": "22.01.2025 (Bekanntmachungsdatum)\n\nNordrhein-Westfalen Amtsgericht Köln HRA 29236\nLöschungsankündigung 22.01.2025 (Eintragungsdatum)\n\nLEYCON CC GmbH & Co. KG\nKommanditgesellschaft\nKöln\n\nDas Registergericht beabsichtigt die Firma von Amts wegen nach § 394 FamFG zu löschen. Die Frist zur Erhebung eines Widerspruchs ist auf einen Monat festgesetzt."
    },
    {
      "date": "2025-01-22",
      "id": "99299",
      "original_text": "Löschungsankündigung\nNordrhein-Westfalen Amtsgericht Bonn GnR 406\nMADIBA ACADEMY eG – Bonn",
      "type": "Löschungsankündigung",
      "state": "Nordrhein-Westfalen",
      "amtsgericht": "Amtsgericht Bonn",
      "registernummer": "GnR 406",
      "registerart": "GnR",
      "company_name": "MADIBA ACADEMY eG",
      "company_seat": "Bonn",
      "details": "22.01.2025 (Bekanntmachungsdatum)\n\nNordrhein-Westfalen Amtsgericht Bonn GnR 406\nLöschungsankündigung 03.01.2025 (Eintragungsdatum)\n\nMADIBA ACADEMY eG\neingetragene Genossenschaft\nBonn\n\nDas Registergericht beabsichtigt die Genossenschaft von Amts wegen nach § 394 FamFG zu löschen. Die Frist zur Erhebung eines Widerspruchs ist auf einen Monat festgesetzt."
    },
    {
      "date": "2025-01-22",
      "id": "99300",
      "original_text": "Einreichung neuer Dokumente\nNordrhein-Westfalen Amtsgericht Münster HRB 6491\nSelbstständiges Wohnen gemeinnützige GmbH – Münster",
      "type": "Einreichung neuer Dokumente",
      "state": "Nordrhein-Westfalen",
      "amtsgericht": "Amtsgericht Münster",
      "registernummer": "HRB 6491",
      "registerart": "HRB",
      "company_name": "Selbstständiges Wohnen gemeinnützige GmbH",
      "company_seat": "Münster",
      "details": "22.01.2025 (Bekanntmachungsdatum)\n\nNordrhein-Westfalen Amtsgericht Münster HRB 6491\nEinreichung neuer Dokumente\n\nSelbstständiges Wohnen gemeinnützige GmbH\nGesellschaft mit beschränkter Haftung\nMünster\n\nDem Registergericht ist eine neue Liste der Mitglieder des Aufsichtsrates eingereicht worden."
    },
    {
      "date": "2025-01-22",
      "id": "99301",
      "original_text": "Löschungsankündigung\nNordrhein-Westfalen Amtsgericht Bonn HRB 23673\nPLOMO GmbH – Rheinbach",
      "type": "Löschungsankündigung",
      "state": "Nordrhein-Westfalen",
      "amtsgericht": "Amtsgericht Bonn",
      "registernummer": "HRB 23673",
      "registerart": "HRB",
      "company_name": "PLOMO GmbH",
      "company_seat": "Rheinbach",
      "details": "22.01.2025 (Bekanntmachungsdatum)\n\nNordrhein-Westfalen Amtsgericht Bonn HRB 23673\nLöschungsankündigung\n\nPLOMO GmbH\nGesellschaft mit beschränkter Haftung\nRheinbach\n\nDas Registergericht beabsichtigt die Gesellschaft von Amts wegen nach § 394 FamFG zu löschen. Die Frist zur Erhebung eines Widerspruchs ist auf einen Monat festgesetzt."
    },
    {
      "date": "2025-01-22",
      "id": "99302",
      "original_text": "Einreichung neuer Dokumente\nNordrhein-Westfalen Amtsgericht Köln HRB 49892\nCovestro Deutschland AG – Leverkusen",
      "type": "Einreichung neuer Dokumente",
      "state": "Nordrhein-Westfalen",
      "amtsgericht": "Amtsgericht Köln",
      "registernummer": "HRB 49892",
      "registerart": "HRB",
      "company_name": "Covestro Deutschland AG",
      "company_seat": "Leverkusen",
      "details": "22.01.2025 (Bekanntmachungsdatum)\n\nNordrhein-Westfalen Amtsgericht Köln HRB 49892\nEinreichung neuer Dokumente\n\nCovestro Deutschland AG\nAktiengesellschaft\nLeverkusen\n\nDem Registergericht ist eine Liste der Mitglieder des Aufsichtsrates eingereicht worden."
    },
    {
      "date": "2025-01-22",
      "id": "99303",
      "original_text": "Löschungsankündigung\nThüringen Amtsgericht Jena HRB 500348\nKüchenmontagen Jörg Richter GmbH – Ronneburg",
      "type": "Löschungsankündigung",
      "state": "Thüringen",
      "amtsgericht": "Amtsgericht Jena",
      "registernummer": "HRB 500348",
      "registerart": "HRB",
      "company_name": "Küchenmontagen Jörg Richter GmbH",
      "company_seat": "Ronneburg",
      "details": "22.01.2025 (Bekanntmachungsdatum)\n\nThüringen Amtsgericht Jena HRB 500348\nLöschungsankündigung\n\nKüchenmontagen Jörg Richter GmbH\nGesellschaft mit beschränkter Haftung\nRonneburg\n\nDas Registergericht beabsichtigt, die im Handelsregister eingetragene Gesellschaft wegen Vermögenslosigkeit nach § 394 FamFG von Amts wegen zu löschen. Die Frist zur Erhebung eines Widerspruchs gegen die beabsichtigte Löschung wird auf 6 Wochen festgesetzt."
    },
    {
      "date": "2025-01-22",
      "id": "99304",
      "original_text": "Einreichung neuer Dokumente\nThüringen Amtsgericht Jena HRB 303862\nKommunale Bau- und Entwicklungsgesellschaft Meiningen mbH , die Firmenkurzbezeichnung lautet: \"KOBEG\" – Meiningen",
      "type": "Einreichung neuer Dokumente",
      "state": "Thüringen",
      "amtsgericht": "Amtsgericht Jena",
      "registernummer": "HRB 303862",
      "registerart": "HRB",
      "company_name": "Kommunale Bau- und Entwicklungsgesellschaft Meiningen mbH , die Firmenkurzbezeichnung lautet: \"KOBEG\"",
      "company_seat": "Meiningen",
      "details": "22.01.2025 (Bekanntmachungsdatum)\n\nThüringen Amtsgericht Jena HRB 303862\nEinreichung neuer Dokumente\n\nKommunale Bau- und Entwicklungsgesellschaft Meiningen mbH , die Firmenkurzbezeichnung lautet: \"KOBEG\"\nGesellschaft mit beschränkter Haftung\nMeiningen\n\nBekanntmachung gem. § 52 Abs. 3 Satz 2 GmbHG: Aufgrund einer Veränderung in den Personen der Aufsichtsratsmitglieder ist durch die Geschäftsführer eine neue Liste zum Handelsregister eingereicht worden."
    },
    {
      "date": "2025-01-22",
      "id": "99305",
      "original_text": "Löschungsankündigung\nThüringen Amtsgericht Jena HRB 113668\nMCS - Marketing Consulting Systems GmbH – Erfurt",
      "type": "Löschungsankündigung",
      "state": "Thüringen",
      "amtsgericht": "Amtsgericht Jena",
      "registernummer": "HRB 113668",
      "registerart": "HRB",
      "company_name": "MCS - Marketing Consulting Systems GmbH",
      "company_seat": "Erfurt",
      "details": "22.01.2025 (Bekanntmachungsdatum)\n\nThüringen Amtsgericht Jena HRB 113668\nLöschungsankündigung\n\nMCS - Marketing Consulting Systems GmbH\nGesellschaft mit beschränkter Haftung\nErfurt\n\nDas Registergericht beabsichtigt, die im Handelsregister eingetragene Gesellschaft wegen Vermögenslosigkeit nach § 394 FamFG von Amts wegen zu löschen. Die Frist zur Erhebung eines Widerspruchs gegen die beabsichtigte Löschung wird auf 6 Wochen festgesetzt."
    },
    {
      "date": "2025-01-22",
      "id": "99306",
      "original_text": "Sonstige Registerbekanntmachung\nHessen Amtsgericht Wiesbaden VR 5027\nBadminton Club Niedernhausen e.V. – Niedernhausen",
      "type": "Sonstige Registerbekanntmachung",
      "state": "Hessen",
      "amtsgericht": "Amtsgericht Wiesbaden",
      "registernummer": "VR 5027",
      "registerart": "VR",
      "company_name": "Badminton Club Niedernhausen e.V.",
      "company_seat": "Niedernhausen",
      "details": "22.01.2025 (Bekanntmachungsdatum)\n\nHessen Amtsgericht Wiesbaden VR 5027\nSonstige Registerbekanntmachung 22.01.2025 (Eintragungsdatum)\n\nBadminton Club Niedernhausen e.V.\neingetragener Verein\nNiedernhausen\n\nDer Verein ist aufgelöst."
    },
    {
      "date": "2025-01-22",
      "id": "99307",
      "original_text": "Sonstige Registerbekanntmachung\nHessen Amtsgericht Kassel VR 2669\nCentral-Net – Baunatal",
      "type": "Sonstige Registerbekanntmachung",
      "state": "Hessen",
      "amtsgericht": "Amtsgericht Kassel",
      "registernummer": "VR 2669",
      "registerart": "VR",
      "company_name": "Central-Net",
      "company_seat": "Baunatal",
      "details": "22.01.2025 (Bekanntmachungsdatum)\n\nHessen Amtsgericht Kassel VR 2669\nSonstige Registerbekanntmachung 22.01.2025 (Eintragungsdatum)\n\nCentral-Net\neingetragener Verein\nBaunatal\n\nDer Verein ist aufgelöst."
    },
    {
      "date": "2025-01-22",
      "id": "99308",
      "original_text": "Sonstige Registerbekanntmachung\nHessen Amtsgericht Frankfurt am Main HRB 132939\nICI Holding SE – Frankfurt am Main",
      "type": "Sonstige Registerbekanntmachung",
      "state": "Hessen",
      "amtsgericht": "Amtsgericht Frankfurt am Main",
      "registernummer": "HRB 132939",
      "registerart": "HRB",
      "company_name": "ICI Holding SE",
      "company_seat": "Frankfurt am Main",
      "details": "22.01.2025 (Bekanntmachungsdatum)\n\nHessen Amtsgericht Frankfurt am Main HRB 132939\nSonstige Registerbekanntmachung\n\nICI Holding SE\nEuropäische Aktiengesellschaft (SE)\nFrankfurt am Main\n\nDurch eine Änderung in den Personen der Aufsichtsratsmitglieder ist eine Liste der Mitglieder des Aufsichtsrates zum Handelsregister eingereicht worden."
    },
    {
      "date": "2025-01-22",
      "id": "99309",
      "original_text": "Einreichung neuer Dokumente\nHessen Amtsgericht Frankfurt am Main HRB 82321\nAllianz Global Investors Investmentaktiengesellschaft mit veränderlichem Kapital mit Teilgesellschaftsvermögen – Frankfurt am Main",
      "type": "Einreichung neuer Dokumente",
      "state": "Hessen",
      "amtsgericht": "Amtsgericht Frankfurt am Main",
      "registernummer": "HRB 82321",
      "registerart": "HRB",
      "company_name": "Allianz Global Investors Investmentaktiengesellschaft mit veränderlichem Kapital mit Teilgesellschaftsvermögen",
      "company_seat": "Frankfurt am Main",
      "details": "22.01.2025 (Bekanntmachungsdatum)\n\nHessen Amtsgericht Frankfurt am Main HRB 82321\nEinreichung neuer Dokumente\n\nAllianz Global Investors Investmentaktiengesellschaft mit veränderlichem Kapital mit Teilgesellschaftsvermögen\nAktiengesellschaft\nFrankfurt am Main\n\nDurch eine Änderung in den Personen der Aufsichtsratsmitglieder ist eine Liste der Mitglieder des Aufsichtsrates zum Handelsregister eingereicht worden."
    },
    {
      "date": "2025-01-22",
      "id": "99310",
      "original_text": "Einreichung neuer Dokumente\nHessen Amtsgericht Kassel HRB 17228\nnew.space AG – Kassel",
      "type": "Einreichung neuer Dokumente",
      "state": "Hessen",
      "amtsgericht": "Amtsgericht Kassel",
      "registernummer": "HRB 17228",
      "registerart": "HRB",
      "company_name": "new.space AG",
      "company_seat": "Kassel",
      "details": "22.01.2025 (Bekanntmachungsdatum)\n\nHessen Amtsgericht Kassel HRB 17228\nEinreichung neuer Dokumente\n\nnew.space AG\nAktiengesellschaft\nKassel\n\nDurch eine Änderung in den Personen der Aufsichtsratsmitglieder ist eine Liste der Mitglieder des Aufsichtsrates zum Handelsregister eingereicht worden."
    },
    {
      "date": "2025-01-22",
      "id": "99311",
      "original_text": "Sonstige Registerbekanntmachung\nHessen Amtsgericht Frankfurt am Main HRB 89384\nHouse of Logistics & Mobility (HOLM) GmbH – Frankfurt am Main",
      "type": "Sonstige Registerbekanntmachung",
      "state": "Hessen",
      "amtsgericht": "Amtsgericht Frankfurt am Main",
      "registernummer": "HRB 89384",
      "registerart": "HRB",
      "company_name": "House of Logistics & Mobility (HOLM) GmbH",
      "company_seat": "Frankfurt am Main",
      "details": "22.01.2025 (Bekanntmachungsdatum)\n\nHessen Amtsgericht Frankfurt am Main HRB 89384\nSonstige Registerbekanntmachung\n\nHouse of Logistics & Mobility (HOLM) GmbH\nGesellschaft mit beschränkter Haftung\nFrankfurt am Main\n\nDurch eine Änderung in den Personen der Aufsichtsratsmitglieder ist eine Liste der Mitglieder des Aufsichtsrates zum Handelsregister eingereicht worden."
    },
    {
      "date": "2025-01-22",
      "id": "99312",
      "original_text": "Löschungsankündigung\nHessen Amtsgericht Königstein HRB 7724\nA-Z Computer UG (haftungsbeschränkt) – Schwalbach am Taunus",
      "type": "Löschungsankündigung",
      "state": "Hessen",
      "amtsgericht": "Amtsgericht Königstein",
      "registernummer": "HRB 7724",
      "registerart": "HRB",
      "company_name": "A-Z Computer UG (haftungsbeschränkt)",
      "company_seat": "Schwalbach am Taunus",
      "details": "22.01.2025 (Bekanntmachungsdatum)\n\nHessen Amtsgericht Königstein HRB 7724\nLöschungsankündigung\n\nA-Z Computer UG (haftungsbeschränkt)\nGesellschaft mit beschränkter Haftung\nSchwalbach am Taunus\n\nDas Registergericht beabsichtigt die im Handelsregister eingetragene Gesellschaft von Amts wegen nach § 394 FamFG zu löschen. Die Frist zur Erhebung eines Widerspruchs gegen die beabsichtigte Löschung wird auf 2 Monate festgesetzt."
    },
    {
      "date": "2025-01-22",
      "id": "99313",
      "original_text": "Löschungsankündigung\nHessen Amtsgericht Frankfurt am Main HRB 121523\nRock Invest Asset Management GmbH – Frankfurt am Main",
      "type": "Löschungsankündigung",
      "state": "Hessen",
      "amtsgericht": "Amtsgericht Frankfurt am Main",
      "registernummer": "HRB 121523",
      "registerart": "HRB",
      "company_name": "Rock Invest Asset Management GmbH",
      "company_seat": "Frankfurt am Main",
      "details": "22.01.2025 (Bekanntmachungsdatum)\n\nHessen Amtsgericht Frankfurt am Main HRB 121523\nLöschungsankündigung\n\nRock Invest Asset Management GmbH\nGesellschaft mit beschränkter Haftung\nFrankfurt am Main\n\nDas Registergericht beabsichtigt die im Handelsregister eingetragene Gesellschaft von Amts wegen nach § 394 FamFG zu löschen. Die Frist zur Erhebung eines Widerspruchs gegen die beabsichtigte Löschung wird auf 1 Monat festgesetzt."
    },
    {
      "date": "2025-01-22",
      "id": "99314",
      "original_text": "Einreichung neuer Dokumente\nHessen Amtsgericht Wiesbaden HRB 7934\nR+V VERSICHERUNG AG – Wiesbaden",
      "type": "Einreichung neuer Dokumente",
      "state": "Hessen",
      "amtsgericht": "Amtsgericht Wiesbaden",
      "registernummer": "HRB 7934",
      "registerart": "HRB",
      "company_name": "R+V VERSICHERUNG AG",
      "company_seat": "Wiesbaden",
      "details": "22.01.2025 (Bekanntmachungsdatum)\n\nHessen Amtsgericht Wiesbaden HRB 7934\nEinreichung neuer Dokumente\n\nR+V VERSICHERUNG AG\nAktiengesellschaft\nWiesbaden\n\nDurch eine Änderung in den Personen der Aufsichtsratsmitglieder ist eine Liste der Mitglieder des Aufsichtsrates zum Handelsregister eingereicht worden."
    },
    {
      "date": "2025-01-22",
      "id": "99315",
      "original_text": "Löschungsankündigung\nHessen Amtsgericht Frankfurt am Main HRB 110435\nHAAL Hoch- und Tiefbau GmbH – Frankfurt am Main",
      "type": "Löschungsankündigung",
      "state": "Hessen",
      "amtsgericht": "Amtsgericht Frankfurt am Main",
      "registernummer": "HRB 110435",
      "registerart": "HRB",
      "company_name": "HAAL Hoch- und Tiefbau GmbH",
      "company_seat": "Frankfurt am Main",
      "details": "22.01.2025 (Bekanntmachungsdatum)\n\nHessen Amtsgericht Frankfurt am Main HRB 110435\nLöschungsankündigung\n\nHAAL Hoch- und Tiefbau GmbH\nGesellschaft mit beschränkter Haftung\nFrankfurt am Main\n\nDas Registergericht beabsichtigt die im Handelsregister eingetragene Gesellschaft von Amts wegen nach § 394 FamFG zu löschen. Die Frist zur Erhebung eines Widerspruchs gegen die beabsichtigte Löschung wird auf 1 Monat festgesetzt."
    },
    {
      "date": "2025-01-22",
      "id": "99316",
      "original_text": "Einreichung neuer Dokumente\nHessen Amtsgericht Wiesbaden HRB 7629\nR + V LEBENSVERSICHERUNG AKTIENGESELLSCHAFT – Wiesbaden",
      "type": "Einreichung neuer Dokumente",
      "state": "Hessen",
      "amtsgericht": "Amtsgericht Wiesbaden",
      "registernummer": "HRB 7629",
      "registerart": "HRB",
      "company_name": "R + V LEBENSVERSICHERUNG AKTIENGESELLSCHAFT",
      "company_seat": "Wiesbaden",
      "details": "22.01.2025 (Bekanntmachungsdatum)\n\nHessen Amtsgericht Wiesbaden HRB 7629\nEinreichung neuer Dokumente\n\nR + V LEBENSVERSICHERUNG AKTIENGESELLSCHAFT\nAktiengesellschaft\nWiesbaden\n\nDurch eine Änderung in den Personen der Aufsichtsratsmitglieder ist eine Liste der Mitglieder des Aufsichtsrates zum Handelsregister eingereicht worden."
    },
    {
      "date": "2025-01-22",
      "id": "99317",
      "original_text": "Sonstige Registerbekanntmachung\nHessen Amtsgericht Wetzlar VR 4298\nFörderverein für den Westerwälder & Siegerländer-Kuhhund kurz F-W-S-K – Driedorf",
      "type": "Sonstige Registerbekanntmachung",
      "state": "Hessen",
      "amtsgericht": "Amtsgericht Wetzlar",
      "registernummer": "VR 4298",
      "registerart": "VR",
      "company_name": "Förderverein für den Westerwälder & Siegerländer-Kuhhund kurz F-W-S-K",
      "company_seat": "Driedorf",
      "details": "22.01.2025 (Bekanntmachungsdatum)\n\nHessen Amtsgericht Wetzlar VR 4298\nSonstige Registerbekanntmachung 22.01.2025 (Eintragungsdatum)\n\nFörderverein für den Westerwälder & Siegerländer-Kuhhund kurz F-W-S-K\neingetragener Verein\nDriedorf\n\nDer Verein ist aufgelöst."
    },
    {
      "date": "2025-01-22",
      "id": "99318",
      "original_text": "Löschungsankündigung\nHessen Amtsgericht Frankfurt am Main HRB 94914\nKRS Gebäudeservice GmbH – Frankfurt am Main",
      "type": "Löschungsankündigung",
      "state": "Hessen",
      "amtsgericht": "Amtsgericht Frankfurt am Main",
      "registernummer": "HRB 94914",
      "registerart": "HRB",
      "company_name": "KRS Gebäudeservice GmbH",
      "company_seat": "Frankfurt am Main",
      "details": "22.01.2025 (Bekanntmachungsdatum)\n\nHessen Amtsgericht Frankfurt am Main HRB 94914\nLöschungsankündigung\n\nKRS Gebäudeservice GmbH\nGesellschaft mit beschränkter Haftung\nFrankfurt am Main\n\nDas Registergericht beabsichtigt die im Handelsregister eingetragene Gesellschaft von Amts wegen nach § 394 FamFG zu löschen. Die Frist zur Erhebung eines Widerspruchs gegen die beabsichtigte Löschung wird auf 3 Monate festgesetzt."
    }
  ]
}