{
  "date": "2025-01-31",
  "date_of_scrape": "2025-02-01T04:07:09.827Z",
  "tool_version": "0.2.0",
  "number_of_announcements": 107,
  "announcements": [
    {
      "date": "2025-01-31",
      "id": "100133",
      "original_text": "Löschungsankündigung\nBayern Amtsgericht Nürnberg HRB 22636\nHampton Verwaltungs GmbH – Nürnberg",
      "type": "Löschungsankündigung",
      "state": "Bayern",
      "amtsgericht": "Amtsgericht Nürnberg",
      "registernummer": "HRB 22636",
      "registerart": "HRB",
      "company_name": "Hampton Verwaltungs GmbH",
      "company_seat": "Nürnberg",
      "details": "31.01.2025 (Bekanntmachungsdatum)\n\nBayern Amtsgericht Nürnberg HRB 22636\nLöschungsankündigung\n\nHampton Verwaltungs GmbH\nGesellschaft mit beschränkter Haftung\nNürnberg\n\nDas Registergericht beabsichtigt, die im Handelsregister eingetragene Gesellschaft wegen Vermögenslosigkeit von Amts wegen nach § 394 FamFG zu löschen. Die Frist zur Erhebung eines Widerspruchs ist auf einen Monat festgesetzt."
    },
    {
      "date": "2025-01-31",
      "id": "100134",
      "original_text": "Löschungsankündigung\nBayern Amtsgericht Nürnberg HRB 22636\nHampton Verwaltungs GmbH – Nürnberg",
      "type": "Löschungsankündigung",
      "state": "Bayern",
      "amtsgericht": "Amtsgericht Nürnberg",
      "registernummer": "HRB 22636",
      "registerart": "HRB",
      "company_name": "Hampton Verwaltungs GmbH",
      "company_seat": "Nürnberg",
      "details": "31.01.2025 (Bekanntmachungsdatum)\n\nBayern Amtsgericht Nürnberg HRB 22636\nLöschungsankündigung\n\nHampton Verwaltungs GmbH\nGesellschaft mit beschränkter Haftung\nNürnberg\n\nDas Registergericht beabsichtigt, die im Handelsregister eingetragene Gesellschaft wegen Vermögenslosigkeit von Amts wegen nach § 394 FamFG zu löschen. Die Frist zur Erhebung eines Widerspruchs ist auf einen Monat festgesetzt."
    },
    {
      "date": "2025-01-31",
      "id": "100135",
      "original_text": "Registerbekanntmachung nach dem Umwandlungsgesetz\nBayern Amtsgericht Nürnberg HRB 13839\nKT Immobilien GmbH – Nürnberg",
      "type": "Registerbekanntmachung nach dem Umwandlungsgesetz",
      "state": "Bayern",
      "amtsgericht": "Amtsgericht Nürnberg",
      "registernummer": "HRB 13839",
      "registerart": "HRB",
      "company_name": "KT Immobilien GmbH",
      "company_seat": "Nürnberg",
      "details": "31.01.2025 (Bekanntmachungsdatum)\n\nBayern Amtsgericht Nürnberg HRB 13839\nRegisterbekanntmachung nach dem Umwandlungsgesetz 30.01.2025 (Eintragungsdatum)\n\nKT Immobilien GmbH\nGesellschaft mit beschränkter Haftung\nNürnberg\n\nDen Gläubigern der an der Ausgliederung beteiligten Rechtsträger ist, wenn sie binnen sechs Monaten nach dem Tag, an dem die Eintragung der Ausgliederung in das Register des Sitzes desjenigen Rechtsträgers, dessen Gläubiger sie sind, nach §§ 125, 19 Abs. 3 UmwG als bekannt gemacht gilt, ihren Anspruch nach Grund und Höhe in Textform anmelden, Sicherheit zu leisten, soweit sie nicht Befriedigung verlangen können. Dieses Recht steht den Gläubigern jedoch nur zu, wenn sie glaubhaft machen, dass durch die Ausgliederung die Erfüllung ihrer Forderung gefährdet wird."
    },
    {
      "date": "2025-01-31",
      "id": "100136",
      "original_text": "Registerbekanntmachung nach dem Umwandlungsgesetz\nBayern Amtsgericht Würzburg HRB 17747\nHotel Elbestr. Ffm. GmbH – Marktbreit",
      "type": "Registerbekanntmachung nach dem Umwandlungsgesetz",
      "state": "Bayern",
      "amtsgericht": "Amtsgericht Würzburg",
      "registernummer": "HRB 17747",
      "registerart": "HRB",
      "company_name": "Hotel Elbestr. Ffm. GmbH",
      "company_seat": "Marktbreit",
      "details": "31.01.2025 (Bekanntmachungsdatum)\n\nBayern Amtsgericht Würzburg HRB 17747\nRegisterbekanntmachung nach dem Umwandlungsgesetz 30.01.2025 (Eintragungsdatum)\n\nHotel Elbestr. Ffm. GmbH\nGesellschaft mit beschränkter Haftung\nMarktbreit\n\nDen Gläubigern des formwechselnden Rechtsträgers ist, wenn sie binnen sechs Monaten nach dem Tag, an dem die Eintragung des Formwechsels nach § 201 UmwG als bekannt gemacht gilt, ihren Anspruch nach Grund und Höhe in Textform anmelden, Sicherheit zu leisten, soweit sie nicht Befriedigung verlangen können. Dieses Recht steht den Gläubigern jedoch nur zu, wenn sie glaubhaft machen, dass durch den Formwechsel die Erfüllung ihrer Forderung gefährdet wird."
    },
    {
      "date": "2025-01-31",
      "id": "100137",
      "original_text": "Löschungsankündigung\nBayern Amtsgericht Nürnberg HRB 6056\nBayerisches Hammerwerk Freiformschmiede und Ringwalzwerk Hermann Zechel GmbH – Nürnberg",
      "type": "Löschungsankündigung",
      "state": "Bayern",
      "amtsgericht": "Amtsgericht Nürnberg",
      "registernummer": "HRB 6056",
      "registerart": "HRB",
      "company_name": "Bayerisches Hammerwerk Freiformschmiede und Ringwalzwerk Hermann Zechel GmbH",
      "company_seat": "Nürnberg",
      "details": "31.01.2025 (Bekanntmachungsdatum)\n\nBayern Amtsgericht Nürnberg HRB 6056\nLöschungsankündigung\n\nBayerisches Hammerwerk Freiformschmiede und Ringwalzwerk Hermann Zechel GmbH\nGesellschaft mit beschränkter Haftung\nNürnberg\n\nDas Registergericht beabsichtigt, die im Handelsregister eingetragene Gesellschaft wegen Vermögenslosigkeit von Amts wegen nach § 394 FamFG zu löschen. Die Frist zur Erhebung eines Widerspruchs ist auf einen Monat festgesetzt."
    },
    {
      "date": "2025-01-31",
      "id": "100138",
      "original_text": "Registerbekanntmachung nach dem Umwandlungsgesetz\nBayern Amtsgericht Nürnberg HRB 32287\nGSB Gesellschaft für sicherheits- und brandschutztechnische Komponenten und Anlagen mbH – Nürnberg",
      "type": "Registerbekanntmachung nach dem Umwandlungsgesetz",
      "state": "Bayern",
      "amtsgericht": "Amtsgericht Nürnberg",
      "registernummer": "HRB 32287",
      "registerart": "HRB",
      "company_name": "GSB Gesellschaft für sicherheits- und brandschutztechnische Komponenten und Anlagen mbH",
      "company_seat": "Nürnberg",
      "details": "31.01.2025 (Bekanntmachungsdatum)\n\nBayern Amtsgericht Nürnberg HRB 32287\nRegisterbekanntmachung nach dem Umwandlungsgesetz 30.01.2025 (Eintragungsdatum)\n\nGSB Gesellschaft für sicherheits- und brandschutztechnische Komponenten und Anlagen mbH\nGesellschaft mit beschränkter Haftung\nNürnberg\n\nDen Gläubigern der an der Ausgliederung beteiligten Rechtsträger ist, wenn sie binnen sechs Monaten nach dem Tag, an dem die Eintragung der Ausgliederung in das Register des Sitzes desjenigen Rechtsträgers, dessen Gläubiger sie sind, nach §§ 125, 19 Abs. 3 UmwG als bekannt gemacht gilt, ihren Anspruch nach Grund und Höhe in Textform anmelden, Sicherheit zu leisten, soweit sie nicht Befriedigung verlangen können. Dieses Recht steht den Gläubigern jedoch nur zu, wenn sie glaubhaft machen, dass durch die Ausgliederung die Erfüllung ihrer Forderung gefährdet wird."
    },
    {
      "date": "2025-01-31",
      "id": "100139",
      "original_text": "Löschungsankündigung\nBayern Amtsgericht Schweinfurt HRB 9463\nAR ImmoFinanz UG (haftungsbeschränkt) – Bad Kissingen",
      "type": "Löschungsankündigung",
      "state": "Bayern",
      "amtsgericht": "Amtsgericht Schweinfurt",
      "registernummer": "HRB 9463",
      "registerart": "HRB",
      "company_name": "AR ImmoFinanz UG (haftungsbeschränkt)",
      "company_seat": "Bad Kissingen",
      "details": "31.01.2025 (Bekanntmachungsdatum)\n\nBayern Amtsgericht Schweinfurt HRB 9463\nLöschungsankündigung\n\nAR ImmoFinanz UG (haftungsbeschränkt)\nGesellschaft mit beschränkter Haftung\nBad Kissingen\n\nDas Registergericht beabsichtigt, die im Handelsregister eingetragene Gesellschaft wegen Vermögenslosigkeit von Amts wegen nach § 394 FamFG zu löschen. Die Frist zur Erhebung eines Widerspruchs ist auf einen Monat festgesetzt."
    },
    {
      "date": "2025-01-31",
      "id": "100140",
      "original_text": "Löschungsankündigung\nBayern Amtsgericht Traunstein HRA 10777\nEnergie Beteiligungen Hintersteiner GmbH & Co. KG – Freilassing",
      "type": "Löschungsankündigung",
      "state": "Bayern",
      "amtsgericht": "Amtsgericht Traunstein",
      "registernummer": "HRA 10777",
      "registerart": "HRA",
      "company_name": "Energie Beteiligungen Hintersteiner GmbH & Co. KG",
      "company_seat": "Freilassing",
      "details": "31.01.2025 (Bekanntmachungsdatum)\n\nBayern Amtsgericht Traunstein HRA 10777\nLöschungsankündigung\n\nEnergie Beteiligungen Hintersteiner GmbH & Co. KG\nKommanditgesellschaft\nFreilassing\n\nDas Registergericht beabsichtigt, die im Handelsregister eingetragene Gesellschaft wegen Vermögenslosigkeit von Amts wegen nach § 394 FamFG zu löschen. Die Frist zur Erhebung eines Widerspruchs ist auf drei Monate festgesetzt."
    },
    {
      "date": "2025-01-31",
      "id": "100141",
      "original_text": "Einreichung neuer Dokumente\nBayern Amtsgericht München HRB 90720\nmetafinanz Informationssysteme GmbH – München",
      "type": "Einreichung neuer Dokumente",
      "state": "Bayern",
      "amtsgericht": "Amtsgericht München",
      "registernummer": "HRB 90720",
      "registerart": "HRB",
      "company_name": "metafinanz Informationssysteme GmbH",
      "company_seat": "München",
      "details": "31.01.2025 (Bekanntmachungsdatum)\n\nBayern Amtsgericht München HRB 90720\nEinreichung neuer Dokumente 30.01.2025 (Eintragungsdatum)\n\nmetafinanz Informationssysteme GmbH\nGesellschaft mit beschränkter Haftung\nMünchen\n\nDem Amtsgericht München -Registergericht- ist eine Liste der Mitglieder des Aufsichtsrats eingereicht worden, § 52 Abs. 3 S. 2 GmbHG."
    },
    {
      "date": "2025-01-31",
      "id": "100142",
      "original_text": "Registerbekanntmachung nach dem Umwandlungsgesetz\nBayern Amtsgericht Fürth VR 20667\nHeimatverein Herzogenaurach Verein für Heimatschutz und Heimatpflege e.V. – Herzogenaurach",
      "type": "Registerbekanntmachung nach dem Umwandlungsgesetz",
      "state": "Bayern",
      "amtsgericht": "Amtsgericht Fürth",
      "registernummer": "VR 20667",
      "registerart": "VR",
      "company_name": "Heimatverein Herzogenaurach Verein für Heimatschutz und Heimatpflege e.V.",
      "company_seat": "Herzogenaurach",
      "details": "31.01.2025 (Bekanntmachungsdatum)\n\nBayern Amtsgericht Fürth VR 20667\nRegisterbekanntmachung nach dem Umwandlungsgesetz 30.01.2025 (Eintragungsdatum)\n\nHeimatverein Herzogenaurach Verein für Heimatschutz und Heimatpflege e.V.\neingetragener Verein\nHerzogenaurach\n\nDen Gläubigern der an der Verschmelzung beteiligten Rechtsträger ist, wenn sie binnen sechs Monaten nach dem Tag, an dem die Eintragung der Verschmelzung in das Register des Sitzes desjenigen Rechtsträgers, dessen Gläubiger sie sind, nach § 19 Abs. 3 UmwG als bekannt gemacht gilt, ihren Anspruch nach Grund und Höhe in Textform anmelden, Sicherheit zu leisten, soweit sie nicht Befriedigung verlangen können. Dieses Recht steht den Gläubigern jedoch nur zu, wenn sie glaubhaft machen, dass durch die Verschmelzung die Erfüllung ihrer Forderung gefährdet wird."
    },
    {
      "date": "2025-01-31",
      "id": "100143",
      "original_text": "Löschungsankündigung\nBayern Amtsgericht München HRB 243594\nAD Bauunternehmen UG (haftungsbeschränkt) – Kirchheim b.München",
      "type": "Löschungsankündigung",
      "state": "Bayern",
      "amtsgericht": "Amtsgericht München",
      "registernummer": "HRB 243594",
      "registerart": "HRB",
      "company_name": "AD Bauunternehmen UG (haftungsbeschränkt)",
      "company_seat": "Kirchheim b.München",
      "details": "31.01.2025 (Bekanntmachungsdatum)\n\nBayern Amtsgericht München HRB 243594\nLöschungsankündigung\n\nAD Bauunternehmen UG (haftungsbeschränkt)\nGesellschaft mit beschränkter Haftung\nKirchheim b.München\n\nDas Registergericht beabsichtigt, die im Handelsregister eingetragene Gesellschaft wegen Vermögenslosigkeit von Amts wegen nach § 394 FamFG zu löschen. Die Frist zur Erhebung eines Widerspruchs ist auf drei Monate festgesetzt."
    },
    {
      "date": "2025-01-31",
      "id": "100144",
      "original_text": "Registerbekanntmachung nach dem Umwandlungsgesetz\nBayern Amtsgericht Würzburg HRA 6794\nHotel Elbestr. Ffm. GmbH & Co. KG – Marktbreit",
      "type": "Registerbekanntmachung nach dem Umwandlungsgesetz",
      "state": "Bayern",
      "amtsgericht": "Amtsgericht Würzburg",
      "registernummer": "HRA 6794",
      "registerart": "HRA",
      "company_name": "Hotel Elbestr. Ffm. GmbH & Co. KG",
      "company_seat": "Marktbreit",
      "details": "31.01.2025 (Bekanntmachungsdatum)\n\nBayern Amtsgericht Würzburg HRA 6794\nRegisterbekanntmachung nach dem Umwandlungsgesetz 30.01.2025 (Eintragungsdatum)\n\nHotel Elbestr. Ffm. GmbH & Co. KG\nKommanditgesellschaft\nMarktbreit\n\nDen Gläubigern des formwechselnden Rechtsträgers ist, wenn sie binnen sechs Monaten nach dem Tag, an dem die Eintragung des Formwechsels nach § 201 UmwG als bekannt gemacht gilt, ihren Anspruch nach Grund und Höhe in Textform anmelden, Sicherheit zu leisten, soweit sie nicht Befriedigung verlangen können. Dieses Recht steht den Gläubigern jedoch nur zu, wenn sie glaubhaft machen, dass durch den Formwechsel die Erfüllung ihrer Forderung gefährdet wird."
    },
    {
      "date": "2025-01-31",
      "id": "100145",
      "original_text": "Registerbekanntmachung nach dem Umwandlungsgesetz\nBayern Amtsgericht München HRB 143034\nin-tech GmbH – Garching",
      "type": "Registerbekanntmachung nach dem Umwandlungsgesetz",
      "state": "Bayern",
      "amtsgericht": "Amtsgericht München",
      "registernummer": "HRB 143034",
      "registerart": "HRB",
      "company_name": "in-tech GmbH",
      "company_seat": "Garching",
      "details": "31.01.2025 (Bekanntmachungsdatum)\n\nBayern Amtsgericht München HRB 143034\nRegisterbekanntmachung nach dem Umwandlungsgesetz 30.01.2025 (Eintragungsdatum)\n\nin-tech GmbH\nGesellschaft mit beschränkter Haftung\nGarching\n\nDen Gläubigern der an der Verschmelzung beteiligten Rechtsträger ist, wenn sie binnen sechs Monaten nach dem Tag, an dem die Eintragung der Verschmelzung in das Register des Sitzes desjenigen Rechtsträgers, dessen Gläubiger sie sind, nach § 19 Abs. 3 UmwG als bekannt gemacht gilt, ihren Anspruch nach Grund und Höhe in Textform anmelden, Sicherheit zu leisten, soweit sie nicht Befriedigung verlangen können. Dieses Recht steht den Gläubigern jedoch nur zu, wenn sie glaubhaft machen, dass durch die Verschmelzung die Erfüllung ihrer Forderung gefährdet wird."
    },
    {
      "date": "2025-01-31",
      "id": "100146",
      "original_text": "Sonstige Registerbekanntmachung\nBayern Amtsgericht München HRB 138057\nqueo München AG – München",
      "type": "Sonstige Registerbekanntmachung",
      "state": "Bayern",
      "amtsgericht": "Amtsgericht München",
      "registernummer": "HRB 138057",
      "registerart": "HRB",
      "company_name": "queo München AG",
      "company_seat": "München",
      "details": "31.01.2025 (Bekanntmachungsdatum)\n\nBayern Amtsgericht München HRB 138057\nSonstige Registerbekanntmachung\n\nqueo München AG\nAktiengesellschaft\nMünchen\n\nDem Amtsgericht München -Registergericht- ist eine Liste der Mitglieder des Aufsichtsrats eingereicht worden, § 106 AktG."
    },
    {
      "date": "2025-01-31",
      "id": "100147",
      "original_text": "Registerbekanntmachung nach dem Umwandlungsgesetz\nBayern Amtsgericht Nürnberg HRB 39931\nAlchimedus Management GmbH – Nürnberg",
      "type": "Registerbekanntmachung nach dem Umwandlungsgesetz",
      "state": "Bayern",
      "amtsgericht": "Amtsgericht Nürnberg",
      "registernummer": "HRB 39931",
      "registerart": "HRB",
      "company_name": "Alchimedus Management GmbH",
      "company_seat": "Nürnberg",
      "details": "31.01.2025 (Bekanntmachungsdatum)\n\nBayern Amtsgericht Nürnberg HRB 39931\nRegisterbekanntmachung nach dem Umwandlungsgesetz 30.01.2025 (Eintragungsdatum)\n\nAlchimedus Management GmbH\nGesellschaft mit beschränkter Haftung\nNürnberg\n\nDen Gläubigern der an der Verschmelzung beteiligten Rechtsträger ist, wenn sie binnen sechs Monaten nach dem Tag, an dem die Eintragung der Verschmelzung in das Register des Sitzes desjenigen Rechtsträgers, dessen Gläubiger sie sind, nach § 19 Abs. 3 UmwG als bekannt gemacht gilt, ihren Anspruch nach Grund und Höhe in Textform anmelden, Sicherheit zu leisten, soweit sie nicht Befriedigung verlangen können. Dieses Recht steht den Gläubigern jedoch nur zu, wenn sie glaubhaft machen, dass durch die Verschmelzung die Erfüllung ihrer Forderung gefährdet wird."
    },
    {
      "date": "2025-01-31",
      "id": "100148",
      "original_text": "Löschungsankündigung\nBayern Amtsgericht München HRB 236174\nSottoPelle Central Europe UG (haftungsbeschränkt) – München",
      "type": "Löschungsankündigung",
      "state": "Bayern",
      "amtsgericht": "Amtsgericht München",
      "registernummer": "HRB 236174",
      "registerart": "HRB",
      "company_name": "SottoPelle Central Europe UG (haftungsbeschränkt)",
      "company_seat": "München",
      "details": "31.01.2025 (Bekanntmachungsdatum)\n\nBayern Amtsgericht München HRB 236174\nLöschungsankündigung\n\nSottoPelle Central Europe UG (haftungsbeschränkt)\nGesellschaft mit beschränkter Haftung\nMünchen\n\nDas Registergericht beabsichtigt, die im Handelsregister eingetragene Gesellschaft wegen Vermögenslosigkeit von Amts wegen nach § 394 FamFG zu löschen. Die Frist zur Erhebung eines Widerspruchs ist auf drei Monate festgesetzt."
    },
    {
      "date": "2025-01-31",
      "id": "100149",
      "original_text": "Registerbekanntmachung nach dem Umwandlungsgesetz\nBayern Amtsgericht Nürnberg HRB 39997\nBusiness Fitness Konzepte UG (haftungsbeschränkt) – Nürnberg",
      "type": "Registerbekanntmachung nach dem Umwandlungsgesetz",
      "state": "Bayern",
      "amtsgericht": "Amtsgericht Nürnberg",
      "registernummer": "HRB 39997",
      "registerart": "HRB",
      "company_name": "Business Fitness Konzepte UG (haftungsbeschränkt)",
      "company_seat": "Nürnberg",
      "details": "31.01.2025 (Bekanntmachungsdatum)\n\nBayern Amtsgericht Nürnberg HRB 39997\nRegisterbekanntmachung nach dem Umwandlungsgesetz 30.01.2025 (Eintragungsdatum)\n\nBusiness Fitness Konzepte UG (haftungsbeschränkt)\nGesellschaft mit beschränkter Haftung\nNürnberg\n\nDen Gläubigern der an der Verschmelzung beteiligten Rechtsträger ist, wenn sie binnen sechs Monaten nach dem Tag, an dem die Eintragung der Verschmelzung in das Register des Sitzes desjenigen Rechtsträgers, dessen Gläubiger sie sind, nach § 19 Abs. 3 UmwG als bekannt gemacht gilt, ihren Anspruch nach Grund und Höhe in Textform anmelden, Sicherheit zu leisten, soweit sie nicht Befriedigung verlangen können. Dieses Recht steht den Gläubigern jedoch nur zu, wenn sie glaubhaft machen, dass durch die Verschmelzung die Erfüllung ihrer Forderung gefährdet wird."
    },
    {
      "date": "2025-01-31",
      "id": "100150",
      "original_text": "Einreichung neuer Dokumente\nBayern Amtsgericht München HRB 81283\nBL die Bayerische Lebensversicherung AG – München",
      "type": "Einreichung neuer Dokumente",
      "state": "Bayern",
      "amtsgericht": "Amtsgericht München",
      "registernummer": "HRB 81283",
      "registerart": "HRB",
      "company_name": "BL die Bayerische Lebensversicherung AG",
      "company_seat": "München",
      "details": "31.01.2025 (Bekanntmachungsdatum)\n\nBayern Amtsgericht München HRB 81283\nEinreichung neuer Dokumente\n\nBL die Bayerische Lebensversicherung AG\nAktiengesellschaft\nMünchen\n\nDem Amtsgericht München -Registergericht- ist eine Liste der Mitglieder des Aufsichtsrats eingereicht worden, § 106 AktG."
    },
    {
      "date": "2025-01-31",
      "id": "100151",
      "original_text": "Löschungsankündigung\nBayern Amtsgericht Augsburg HRB 30183\nStahlbau Aindling GmbH – Aindling",
      "type": "Löschungsankündigung",
      "state": "Bayern",
      "amtsgericht": "Amtsgericht Augsburg",
      "registernummer": "HRB 30183",
      "registerart": "HRB",
      "company_name": "Stahlbau Aindling GmbH",
      "company_seat": "Aindling",
      "details": "31.01.2025 (Bekanntmachungsdatum)\n\nBayern Amtsgericht Augsburg HRB 30183\nLöschungsankündigung 30.01.2025 (Eintragungsdatum)\n\nStahlbau Aindling GmbH\nGesellschaft mit beschränkter Haftung\nAindling"
    },
    {
      "date": "2025-01-31",
      "id": "100152",
      "original_text": "Registerbekanntmachung nach dem Umwandlungsgesetz\nBayern Amtsgericht München HRB 296947\nNeugebauer Maler- & Trockenbau GmbH – Zolling",
      "type": "Registerbekanntmachung nach dem Umwandlungsgesetz",
      "state": "Bayern",
      "amtsgericht": "Amtsgericht München",
      "registernummer": "HRB 296947",
      "registerart": "HRB",
      "company_name": "Neugebauer Maler- & Trockenbau GmbH",
      "company_seat": "Zolling",
      "details": "31.01.2025 (Bekanntmachungsdatum)\n\nBayern Amtsgericht München HRB 296947\nRegisterbekanntmachung nach dem Umwandlungsgesetz 30.01.2025 (Eintragungsdatum)\n\nNeugebauer Maler- & Trockenbau GmbH\nGesellschaft mit beschränkter Haftung\nZolling\n\nDen Gläubigern der an der Ausgliederung beteiligten Rechtsträger ist, wenn sie binnen sechs Monaten nach dem Tag, an dem die Eintragung der Ausgliederung in das Register des Sitzes desjenigen Rechtsträgers, dessen Gläubiger sie sind, nach §§ 125, 19 Abs. 3 UmwG als bekannt gemacht gilt, ihren Anspruch nach Grund und Höhe in Textform anmelden, Sicherheit zu leisten, soweit sie nicht Befriedigung verlangen können. Dieses Recht steht den Gläubigern jedoch nur zu, wenn sie glaubhaft machen, dass durch die Ausgliederung die Erfüllung ihrer Forderung gefährdet wird."
    },
    {
      "date": "2025-01-31",
      "id": "100153",
      "original_text": "Löschungsankündigung\nBayern Amtsgericht Landshut HRB 3985\nHold Consulting GmbH – Altdorf",
      "type": "Löschungsankündigung",
      "state": "Bayern",
      "amtsgericht": "Amtsgericht Landshut",
      "registernummer": "HRB 3985",
      "registerart": "HRB",
      "company_name": "Hold Consulting GmbH",
      "company_seat": "Altdorf",
      "details": "31.01.2025 (Bekanntmachungsdatum)\n\nBayern Amtsgericht Landshut HRB 3985\nLöschungsankündigung\n\nHold Consulting GmbH\nGesellschaft mit beschränkter Haftung\nAltdorf\n\nDas Registergericht beabsichtigt, die im Handelsregister eingetragene Gesellschaft wegen Vermögenslosigkeit von Amts wegen nach § 394 FamFG zu löschen. Die Frist zur Erhebung eines Widerspruchs ist auf einen Monat festgesetzt."
    },
    {
      "date": "2025-01-31",
      "id": "100154",
      "original_text": "Sonstige Registerbekanntmachung\nBayern Amtsgericht München HRB 279188\nHaustechnik Deutschland DEK GmbH – Unterschleißheim",
      "type": "Sonstige Registerbekanntmachung",
      "state": "Bayern",
      "amtsgericht": "Amtsgericht München",
      "registernummer": "HRB 279188",
      "registerart": "HRB",
      "company_name": "Haustechnik Deutschland DEK GmbH",
      "company_seat": "Unterschleißheim",
      "details": "31.01.2025 (Bekanntmachungsdatum)\n\nBayern Amtsgericht München HRB 279188\nSonstige Registerbekanntmachung 30.01.2025 (Eintragungsdatum)\n\nHaustechnik Deutschland DEK GmbH\nGesellschaft mit beschränkter Haftung\nUnterschleißheim\n\nDen Gläubigern der Gesellschaft, deren Forderungen begründet worden sind, bevor die Eintragung der Beendigung des Beherrschungs- und Gewinnabführungsvertrages in das Handelsregister nach § 10 des Handelsgesetzbuches als bekanntgemacht gilt, hat der andere Vertragsteil Sicherheit zu leisten, wenn sie sich binnen sechs Monaten nach der Bekanntmachung der Eintragung zu diesem Zweck bei ihm melden."
    },
    {
      "date": "2025-01-31",
      "id": "100155",
      "original_text": "Löschungsankündigung\nBayern Amtsgericht Hof HRB 6137\nCF-Tor-ay-tex GmbH – Hof",
      "type": "Löschungsankündigung",
      "state": "Bayern",
      "amtsgericht": "Amtsgericht Hof",
      "registernummer": "HRB 6137",
      "registerart": "HRB",
      "company_name": "CF-Tor-ay-tex GmbH",
      "company_seat": "Hof",
      "details": "31.01.2025 (Bekanntmachungsdatum)\n\nBayern Amtsgericht Hof HRB 6137\nLöschungsankündigung\n\nCF-Tor-ay-tex GmbH\nGesellschaft mit beschränkter Haftung\nHof\n\nDas Registergericht beabsichtigt, die im Handelsregister eingetragene Gesellschaft wegen Vermögenslosigkeit von Amts wegen nach § 394 FamFG zu löschen. Die Frist zur Erhebung eines Widerspruchs ist auf sechs Wochen festgesetzt."
    },
    {
      "date": "2025-01-31",
      "id": "100156",
      "original_text": "Löschungsankündigung\nBayern Amtsgericht Augsburg HRB 18905\nBytemaster Computer Gesellschaft mit beschränkter Haftung – Augsburg",
      "type": "Löschungsankündigung",
      "state": "Bayern",
      "amtsgericht": "Amtsgericht Augsburg",
      "registernummer": "HRB 18905",
      "registerart": "HRB",
      "company_name": "Bytemaster Computer Gesellschaft mit beschränkter Haftung",
      "company_seat": "Augsburg",
      "details": "31.01.2025 (Bekanntmachungsdatum)\n\nBayern Amtsgericht Augsburg HRB 18905\nLöschungsankündigung\n\nBytemaster Computer Gesellschaft mit beschränkter Haftung\nGesellschaft mit beschränkter Haftung\nAugsburg\n\nDas Registergericht beabsichtigt, die im Handelsregister eingetragene Gesellschaft wegen Vermögenslosigkeit von Amts wegen nach § 394 FamFG zu löschen. Die Frist zur Erhebung eines Widerspruchs ist auf einen Monat festgesetzt."
    },
    {
      "date": "2025-01-31",
      "id": "100157",
      "original_text": "Einreichung neuer Dokumente\nBayern Amtsgericht Traunstein HRB 19673\nHaumann und Fuchs Ingenieure AG – Traunstein",
      "type": "Einreichung neuer Dokumente",
      "state": "Bayern",
      "amtsgericht": "Amtsgericht Traunstein",
      "registernummer": "HRB 19673",
      "registerart": "HRB",
      "company_name": "Haumann und Fuchs Ingenieure AG",
      "company_seat": "Traunstein",
      "details": "31.01.2025 (Bekanntmachungsdatum)\n\nBayern Amtsgericht Traunstein HRB 19673\nEinreichung neuer Dokumente 30.01.2025 (Eintragungsdatum)\n\nHaumann und Fuchs Ingenieure AG\nAktiengesellschaft\nTraunstein\n\nDem Amtsgericht Traunstein -Registergericht- ist eine Liste der Mitglieder des Aufsichtsrats eingereicht worden, § 106 AktG."
    },
    {
      "date": "2025-01-31",
      "id": "100158",
      "original_text": "Einreichung neuer Dokumente\nBayern Amtsgericht München HRB 138097\nS-Partner Kapital AG – München",
      "type": "Einreichung neuer Dokumente",
      "state": "Bayern",
      "amtsgericht": "Amtsgericht München",
      "registernummer": "HRB 138097",
      "registerart": "HRB",
      "company_name": "S-Partner Kapital AG",
      "company_seat": "München",
      "details": "31.01.2025 (Bekanntmachungsdatum)\n\nBayern Amtsgericht München HRB 138097\nEinreichung neuer Dokumente\n\nS-Partner Kapital AG\nAktiengesellschaft\nMünchen\n\nDem Amtsgericht München -Registergericht- ist eine Liste der Mitglieder des Aufsichtsrats eingereicht worden, § 106 AktG."
    },
    {
      "date": "2025-01-31",
      "id": "100159",
      "original_text": "Löschungsankündigung\nBayern Amtsgericht München HRB 90436\nLang - Sondermaschinenbau GmbH – Eschenlohe",
      "type": "Löschungsankündigung",
      "state": "Bayern",
      "amtsgericht": "Amtsgericht München",
      "registernummer": "HRB 90436",
      "registerart": "HRB",
      "company_name": "Lang - Sondermaschinenbau GmbH",
      "company_seat": "Eschenlohe",
      "details": "31.01.2025 (Bekanntmachungsdatum)\n\nBayern Amtsgericht München HRB 90436\nLöschungsankündigung 28.01.2025 (Eintragungsdatum)\n\nLang - Sondermaschinenbau GmbH\nGesellschaft mit beschränkter Haftung\nEschenlohe\n\nDas Registergericht beabsichtigt, die im Handelsregister eingetragene Gesellschaft wegen Vermögenslosigkeit von Amts wegen nach § 394 FamFG zu löschen. Die Frist zur Erhebung eines Widerspruchs ist auf drei Monate festgesetzt."
    },
    {
      "date": "2025-01-31",
      "id": "100160",
      "original_text": "Einreichung neuer Dokumente\nSaarland Amtsgericht Saarbrücken HRB 24845\nVerkehrs- und Energiebeteiligungsgesellschaft der Stadt Dillingen mbH – Dillingen",
      "type": "Einreichung neuer Dokumente",
      "state": "Saarland",
      "amtsgericht": "Amtsgericht Saarbrücken",
      "registernummer": "HRB 24845",
      "registerart": "HRB",
      "company_name": "Verkehrs- und Energiebeteiligungsgesellschaft der Stadt Dillingen mbH",
      "company_seat": "Dillingen",
      "details": "31.01.2025 (Bekanntmachungsdatum)\n\nSaarland Amtsgericht Saarbrücken HRB 24845\nEinreichung neuer Dokumente\n\nVerkehrs- und Energiebeteiligungsgesellschaft der Stadt Dillingen mbH\nGesellschaft mit beschränkter Haftung\nDillingen\n\nDie Geschäftsführung der Gesellschaft hat eine Liste der Mitglieder des Aufsichtsrats zum Handelsregister eingereicht (§ 52 Abs. 3 Satz 2 GmbHG)."
    },
    {
      "date": "2025-01-31",
      "id": "100161",
      "original_text": "Einreichung neuer Dokumente\nSaarland Amtsgericht Saarbrücken HRB 104671\nErneuerbare Energien Gesellschaft Dillingen/Saar mbH – Dillingen",
      "type": "Einreichung neuer Dokumente",
      "state": "Saarland",
      "amtsgericht": "Amtsgericht Saarbrücken",
      "registernummer": "HRB 104671",
      "registerart": "HRB",
      "company_name": "Erneuerbare Energien Gesellschaft Dillingen/Saar mbH",
      "company_seat": "Dillingen",
      "details": "31.01.2025 (Bekanntmachungsdatum)\n\nSaarland Amtsgericht Saarbrücken HRB 104671\nEinreichung neuer Dokumente\n\nErneuerbare Energien Gesellschaft Dillingen/Saar mbH\nGesellschaft mit beschränkter Haftung\nDillingen\n\nDie Geschäftsführung der Gesellschaft hat eine Liste der Mitglieder des Aufsichtsrats zum Handelsregister eingereicht (§ 52 Abs. 3 Satz 2 GmbHG)."
    },
    {
      "date": "2025-01-31",
      "id": "100162",
      "original_text": "Löschungsankündigung\nHamburg Amtsgericht Hamburg HRA 124332\nProjektges. BNS 59 mbH & Co KG – Hamburg",
      "type": "Löschungsankündigung",
      "state": "Hamburg",
      "amtsgericht": "Amtsgericht Hamburg",
      "registernummer": "HRA 124332",
      "registerart": "HRA",
      "company_name": "Projektges. BNS 59 mbH & Co KG",
      "company_seat": "Hamburg",
      "details": "31.01.2025 (Bekanntmachungsdatum)\n\nHamburg Amtsgericht Hamburg HRA 124332\nLöschungsankündigung\n\nProjektges. BNS 59 mbH & Co KG\nKommanditgesellschaft\nHamburg\n\nDas Registergericht beabsichtigt, die im Handelsregister eingetragene Firma von Amts wegen nach § 31 Abs. 2 HGB zu löschen. Die Frist zur Erhebung eines Widerspruchs gegen die beabsichtigte Löschung wird auf 3 Monate festgesetzt."
    },
    {
      "date": "2025-01-31",
      "id": "100163",
      "original_text": "Einreichung neuer Dokumente\nNordrhein-Westfalen Amtsgericht Coesfeld HRB 19015\nGigaset AG – Bocholt",
      "type": "Einreichung neuer Dokumente",
      "state": "Nordrhein-Westfalen",
      "amtsgericht": "Amtsgericht Coesfeld",
      "registernummer": "HRB 19015",
      "registerart": "HRB",
      "company_name": "Gigaset AG",
      "company_seat": "Bocholt",
      "details": "31.01.2025 (Bekanntmachungsdatum)\n\nNordrhein-Westfalen Amtsgericht Coesfeld HRB 19015\nEinreichung neuer Dokumente\n\nGigaset AG\nAktiengesellschaft\nBocholt\n\nDie Liste der Mitglieder des Aufsichtsrates ist zum Handelsregister eingereicht worden."
    },
    {
      "date": "2025-01-31",
      "id": "100164",
      "original_text": "Einreichung neuer Dokumente\nBaden-Württemberg Amtsgericht Ulm HRB 552545\nBodensee-Oberschwaben Verkehrsverbund GmbH – Ravensburg",
      "type": "Einreichung neuer Dokumente",
      "state": "Baden-Württemberg",
      "amtsgericht": "Amtsgericht Ulm",
      "registernummer": "HRB 552545",
      "registerart": "HRB",
      "company_name": "Bodensee-Oberschwaben Verkehrsverbund GmbH",
      "company_seat": "Ravensburg",
      "details": "31.01.2025 (Bekanntmachungsdatum)\n\nBaden-Württemberg Amtsgericht Ulm HRB 552545\nEinreichung neuer Dokumente\n\nBodensee-Oberschwaben Verkehrsverbund GmbH\nGesellschaft mit beschränkter Haftung\nRavensburg\n\nDie Gesellschaft hat am 29.01.2025 die Liste über die Zusammensetzung des Aufsichtsrats zum Handelsregister eingereicht."
    },
    {
      "date": "2025-01-31",
      "id": "100165",
      "original_text": "Einreichung neuer Dokumente\nBerlin Amtsgericht Berlin (Charlottenburg) HRB 261360\nRubinum 1. SE – Berlin",
      "type": "Einreichung neuer Dokumente",
      "state": "Berlin",
      "amtsgericht": "Amtsgericht Berlin (Charlottenburg)",
      "registernummer": "HRB 261360",
      "registerart": "HRB",
      "company_name": "Rubinum 1. SE",
      "company_seat": "Berlin",
      "details": "31.01.2025 (Bekanntmachungsdatum)\n\nBerlin Amtsgericht Berlin (Charlottenburg) HRB 261360\nEinreichung neuer Dokumente\n\nRubinum 1. SE\nEuropäische Aktiengesellschaft (SE)\nBerlin\n\nAls nicht eingetragen wird veröffentlicht:Es wurde eine neue Liste der Aufsichtsratsmitglieder eingereicht (§ 106 AktG)."
    },
    {
      "date": "2025-01-31",
      "id": "100166",
      "original_text": "Löschungsankündigung\nBaden-Württemberg Amtsgericht Ulm HRB 701781\nBauArte GmbH – Lorch",
      "type": "Löschungsankündigung",
      "state": "Baden-Württemberg",
      "amtsgericht": "Amtsgericht Ulm",
      "registernummer": "HRB 701781",
      "registerart": "HRB",
      "company_name": "BauArte GmbH",
      "company_seat": "Lorch",
      "details": "31.01.2025 (Bekanntmachungsdatum)\n\nBaden-Württemberg Amtsgericht Ulm HRB 701781\nLöschungsankündigung 31.01.2025 (Eintragungsdatum)\n\nBauArte GmbH\nGesellschaft mit beschränkter Haftung\nLorch\n\nDas Gericht beabsichtigt, die Gesellschaft wegen Vermögenslosigkeit im Handelsregister von Amts wegen nach § 394 FamFG zu löschen. Die Frist zur Geltendmachung eines Widerspruchs gegen die beabsichtigte Löschung ist auf  einen Monat ab Veröffentlichung bestimmt."
    },
    {
      "date": "2025-01-31",
      "id": "100167",
      "original_text": "Registerbekanntmachung nach dem Umwandlungsgesetz\nBaden-Württemberg Amtsgericht Mannheim HRB 718174\nVerPackung.com GmbH Gesellschaft für Verpackungen – Eppelheim",
      "type": "Registerbekanntmachung nach dem Umwandlungsgesetz",
      "state": "Baden-Württemberg",
      "amtsgericht": "Amtsgericht Mannheim",
      "registernummer": "HRB 718174",
      "registerart": "HRB",
      "company_name": "VerPackung.com GmbH Gesellschaft für Verpackungen",
      "company_seat": "Eppelheim",
      "details": "31.01.2025 (Bekanntmachungsdatum)\n\nBaden-Württemberg Amtsgericht Mannheim HRB 718174\nRegisterbekanntmachung nach dem Umwandlungsgesetz 31.01.2025 (Eintragungsdatum)\n\nVerPackung.com GmbH Gesellschaft für Verpackungen\nGesellschaft mit beschränkter Haftung\nEppelheim\n\nDen Gläubigern der an der Verschmelzung beteiligten Rechtsträger ist, wenn sie binnen sechs Monaten nach dem Tag, an dem die Eintragung der Verschmelzung in das Register des Sitzes desjenigen Rechtsträgers, dessen Gläubiger sie sind, nach § 19 Abs. 3 UmwG als bekanntgemacht gilt, ihren Anspruch nach Grund und Höhe schriftlich anmelden, Sicherheit zu leisten, soweit sie nicht Befriedigung verlangen können. Dieses Recht steht den Gläubigern jedoch nur zu, wenn sie glaubhaft machen, dass durch die Verschmelzung die Erfüllung ihrer Forderung gefährdet wird."
    },
    {
      "date": "2025-01-31",
      "id": "100168",
      "original_text": "Löschungsankündigung\nHamburg Amtsgericht Hamburg VR 22052\nJugenderlebniswelten Hamburg e.V. – Hamburg",
      "type": "Löschungsankündigung",
      "state": "Hamburg",
      "amtsgericht": "Amtsgericht Hamburg",
      "registernummer": "VR 22052",
      "registerart": "VR",
      "company_name": "Jugenderlebniswelten Hamburg e.V.",
      "company_seat": "Hamburg",
      "details": "31.01.2025 (Bekanntmachungsdatum)\n\nHamburg Amtsgericht Hamburg VR 22052\nLöschungsankündigung\n\nJugenderlebniswelten Hamburg e.V.\neingetragener Verein\nHamburg\n\nDas Registergericht beabsichtigt, den im Vereinsregister eingetragenen Verein von Amts wegen nach § 395 FamFG zu löschen, da nach den angestellten Ermittlungen dieser Verein offenbar nicht mehr besteht. Die Frist zur Erhebung eines Widerspruchs gegen die beabsichtigte Löschung wird auf 3 Monate festgesetzt."
    },
    {
      "date": "2025-01-31",
      "id": "100169",
      "original_text": "Registerbekanntmachung nach dem Umwandlungsgesetz\nBaden-Württemberg Amtsgericht Mannheim HRB 336058\nPackmann Gesellschaft für Verpackungen und Dienstleistungen mbH – Eppelheim",
      "type": "Registerbekanntmachung nach dem Umwandlungsgesetz",
      "state": "Baden-Württemberg",
      "amtsgericht": "Amtsgericht Mannheim",
      "registernummer": "HRB 336058",
      "registerart": "HRB",
      "company_name": "Packmann Gesellschaft für Verpackungen und Dienstleistungen mbH",
      "company_seat": "Eppelheim",
      "details": "31.01.2025 (Bekanntmachungsdatum)\n\nBaden-Württemberg Amtsgericht Mannheim HRB 336058\nRegisterbekanntmachung nach dem Umwandlungsgesetz 31.01.2025 (Eintragungsdatum)\n\nPackmann Gesellschaft für Verpackungen und Dienstleistungen mbH\nGesellschaft mit beschränkter Haftung\nEppelheim\n\nAls nicht eingetragen wird bekanntgemacht:Den Gläubigern der an der Verschmelzung beteiligten Rechtsträger ist, wenn sie binnen sechs Monaten nach dem Tag, an dem die Eintragung der Verschmelzung in das Register des Sitzes desjenigen Rechtsträgers, dessen Gläubiger sie sind, nach § 19 Abs. 3 UmwG als bekanntgemacht gilt, ihren Anspruch nach Grund und Höhe schriftlich anmelden, Sicherheit zu leisten, soweit sie nicht Befriedigung verlangen können. Dieses Recht steht den Gläubigern jedoch nur zu, wenn sie glaubhaft machen, dass durch die Verschmelzung die Erfüllung ihrer Forderung gefährdet wird."
    },
    {
      "date": "2025-01-31",
      "id": "100170",
      "original_text": "Einreichung neuer Dokumente\nBerlin Amtsgericht Berlin (Charlottenburg) HRB 94436\nmovingimage EVP GmbH – Berlin",
      "type": "Einreichung neuer Dokumente",
      "state": "Berlin",
      "amtsgericht": "Amtsgericht Berlin (Charlottenburg)",
      "registernummer": "HRB 94436",
      "registerart": "HRB",
      "company_name": "movingimage EVP GmbH",
      "company_seat": "Berlin",
      "details": "31.01.2025 (Bekanntmachungsdatum)\n\nBerlin Amtsgericht Berlin (Charlottenburg) HRB 94436\nEinreichung neuer Dokumente\n\nmovingimage EVP GmbH\nGesellschaft mit beschränkter Haftung\nBerlin\n\nAls nicht eingetragen wird veröffentlicht:Es wurde eine neue Liste der Aufsichtsratsmitglieder eingereicht (§52 GmbHG)."
    },
    {
      "date": "2025-01-31",
      "id": "100171",
      "original_text": "Einreichung neuer Dokumente\nBaden-Württemberg Amtsgericht Freiburg HRB 590393\nDCT DELTA AG Digital Communication Technology – Bodman-Ludwigshafen",
      "type": "Einreichung neuer Dokumente",
      "state": "Baden-Württemberg",
      "amtsgericht": "Amtsgericht Freiburg",
      "registernummer": "HRB 590393",
      "registerart": "HRB",
      "company_name": "DCT DELTA AG Digital Communication Technology",
      "company_seat": "Bodman-Ludwigshafen",
      "details": "31.01.2025 (Bekanntmachungsdatum)\n\nBaden-Württemberg Amtsgericht Freiburg HRB 590393\nEinreichung neuer Dokumente 31.01.2025 (Eintragungsdatum)\n\nDCT DELTA AG Digital Communication Technology\nAktiengesellschaft\nBodman-Ludwigshafen\n\nAls nicht eingetragen wird bekanntgemacht:\nDie Gesellschaft hat am 30.01.2025 die Liste über die Zusammensetzung des Aufsichtsrats zum Handelsregister eingereicht."
    },
    {
      "date": "2025-01-31",
      "id": "100172",
      "original_text": "Einreichung neuer Dokumente\nBerlin Amtsgericht Berlin (Charlottenburg) HRB 163774\nSuhrkamp Verlag AG – Berlin",
      "type": "Einreichung neuer Dokumente",
      "state": "Berlin",
      "amtsgericht": "Amtsgericht Berlin (Charlottenburg)",
      "registernummer": "HRB 163774",
      "registerart": "HRB",
      "company_name": "Suhrkamp Verlag AG",
      "company_seat": "Berlin",
      "details": "31.01.2025 (Bekanntmachungsdatum)\n\nBerlin Amtsgericht Berlin (Charlottenburg) HRB 163774\nEinreichung neuer Dokumente\n\nSuhrkamp Verlag AG\nAktiengesellschaft\nBerlin\n\nAls nicht eingetragen wird veröffentlicht:  Es wurde eine neue Liste der Aufsichtsratsmitglieder eingereicht (§ 106 AktG)."
    },
    {
      "date": "2025-01-31",
      "id": "100173",
      "original_text": "Registerbekanntmachung nach dem Umwandlungsgesetz\nBaden-Württemberg Amtsgericht Ulm HRB 671306\nHerrmann Grundbesitz Verwaltungs-GmbH – Crailsheim",
      "type": "Registerbekanntmachung nach dem Umwandlungsgesetz",
      "state": "Baden-Württemberg",
      "amtsgericht": "Amtsgericht Ulm",
      "registernummer": "HRB 671306",
      "registerart": "HRB",
      "company_name": "Herrmann Grundbesitz Verwaltungs-GmbH",
      "company_seat": "Crailsheim",
      "details": "31.01.2025 (Bekanntmachungsdatum)\n\nBaden-Württemberg Amtsgericht Ulm HRB 671306\nRegisterbekanntmachung nach dem Umwandlungsgesetz 31.01.2025 (Eintragungsdatum)\n\nHerrmann Grundbesitz Verwaltungs-GmbH\nGesellschaft mit beschränkter Haftung\nCrailsheim\n\nAls nicht eingetragen wird bekanntgemacht:\nDen Gläubigern der an der Verschmelzung beteiligten Rechtsträger ist, wenn sie binnen sechs Monaten nach dem Tag, an dem die Eintragung der Verschmelzung in das Register des Sitzes desjenigen Rechtsträgers, dessen Gläubiger sie sind, nach § 19 Abs. 3 UmwG als bekanntgemacht gilt, ihren Anspruch nach Grund und Höhe schriftlich anmelden, Sicherheit zu leisten, soweit sie nicht Befriedigung verlangen können. Dieses Recht steht den Gläubigern jedoch nur zu, wenn sie glaubhaft machen, dass durch die Verschmelzung die Erfüllung ihrer Forderung gefährdet wird."
    },
    {
      "date": "2025-01-31",
      "id": "100174",
      "original_text": "Löschungsankündigung\nBaden-Württemberg Amtsgericht Mannheim HRB 733721\nHI+RA UG (haftungsbeschränkt) – Mannheim",
      "type": "Löschungsankündigung",
      "state": "Baden-Württemberg",
      "amtsgericht": "Amtsgericht Mannheim",
      "registernummer": "HRB 733721",
      "registerart": "HRB",
      "company_name": "HI+RA UG (haftungsbeschränkt)",
      "company_seat": "Mannheim",
      "details": "31.01.2025 (Bekanntmachungsdatum)\n\nBaden-Württemberg Amtsgericht Mannheim HRB 733721\nLöschungsankündigung\n\nHI+RA UG (haftungsbeschränkt)\nGesellschaft mit beschränkter Haftung\nMannheim\n\nDas Gericht beabsichtigt, die Gesellschaft wegen Vermögenslosigkeit im Handelsregister von Amts wegen nach § 394 FamFG zu löschen. Die Frist zur Geltendmachung eines Widerspruchs gegen die beabsichtigte Löschung ist auf einen Monat ab Veröffentlichung bestimmt."
    },
    {
      "date": "2025-01-31",
      "id": "100175",
      "original_text": "Sonstige Registerbekanntmachung\nHamburg Amtsgericht Hamburg HRB 168009\nEMobG Services Germany GmbH – Hamburg",
      "type": "Sonstige Registerbekanntmachung",
      "state": "Hamburg",
      "amtsgericht": "Amtsgericht Hamburg",
      "registernummer": "HRB 168009",
      "registerart": "HRB",
      "company_name": "EMobG Services Germany GmbH",
      "company_seat": "Hamburg",
      "details": "31.01.2025 (Bekanntmachungsdatum)\n\nHamburg Amtsgericht Hamburg HRB 168009\nSonstige Registerbekanntmachung\n\nEMobG Services Germany GmbH\nGesellschaft mit beschränkter Haftung\nHamburg\n\nAls nicht eingetragen wird bekannt gemacht: Liste des Aufsichtsrats wurde eingereicht."
    },
    {
      "date": "2025-01-31",
      "id": "100176",
      "original_text": "Löschungsankündigung\nBaden-Württemberg Amtsgericht Mannheim HRB 717410\nCongero-Baudienstleistungen UG (haftungsbeschränkt) – Mannheim",
      "type": "Löschungsankündigung",
      "state": "Baden-Württemberg",
      "amtsgericht": "Amtsgericht Mannheim",
      "registernummer": "HRB 717410",
      "registerart": "HRB",
      "company_name": "Congero-Baudienstleistungen UG (haftungsbeschränkt)",
      "company_seat": "Mannheim",
      "details": "31.01.2025 (Bekanntmachungsdatum)\n\nBaden-Württemberg Amtsgericht Mannheim HRB 717410\nLöschungsankündigung\n\nCongero-Baudienstleistungen UG (haftungsbeschränkt)\nGesellschaft mit beschränkter Haftung\nMannheim\n\nAls nicht eingetragen wird bekanntgemacht:\nDas Gericht beabsichtigt, die Gesellschaft wegen Vermögenslosigkeit im Handelsregister von Amts wegen nach § 394 FamFG zu löschen. Die Frist zur Geltendmachung eines Widerspruchs gegen die beabsichtigte Löschung ist auf einen Monat ab Veröffentlichung bestimmt."
    },
    {
      "date": "2025-01-31",
      "id": "100177",
      "original_text": "Sonstige Registerbekanntmachung\nHamburg Amtsgericht Hamburg HRB 87975\nTÜV Hanse GmbH TÜV SÜD Gruppe – Hamburg",
      "type": "Sonstige Registerbekanntmachung",
      "state": "Hamburg",
      "amtsgericht": "Amtsgericht Hamburg",
      "registernummer": "HRB 87975",
      "registerart": "HRB",
      "company_name": "TÜV Hanse GmbH TÜV SÜD Gruppe",
      "company_seat": "Hamburg",
      "details": "31.01.2025 (Bekanntmachungsdatum)\n\nHamburg Amtsgericht Hamburg HRB 87975\nSonstige Registerbekanntmachung\n\nTÜV Hanse GmbH TÜV SÜD Gruppe\nGesellschaft mit beschränkter Haftung\nHamburg\n\nAls nicht eingetragen wird bekannt gemacht: Liste des Aufsichtsrats wurde eingereicht."
    },
    {
      "date": "2025-01-31",
      "id": "100178",
      "original_text": "Löschungsankündigung\nBerlin Amtsgericht Berlin (Charlottenburg) HRB 218215\nEOTEC OBJEKT BAU GmbH – Berlin",
      "type": "Löschungsankündigung",
      "state": "Berlin",
      "amtsgericht": "Amtsgericht Berlin (Charlottenburg)",
      "registernummer": "HRB 218215",
      "registerart": "HRB",
      "company_name": "EOTEC OBJEKT BAU GmbH",
      "company_seat": "Berlin",
      "details": "31.01.2025 (Bekanntmachungsdatum)\n\nBerlin Amtsgericht Berlin (Charlottenburg) HRB 218215\nLöschungsankündigung\n\nEOTEC OBJEKT BAU GmbH\nGesellschaft mit beschränkter Haftung\nBerlin\n\nBei der nachstehenden Gesellschaft wird das Amtslöschungsverfahren gemäß § 394 FamFG eingeleitet. Widerspruchsfrist 6 Wochen"
    },
    {
      "date": "2025-01-31",
      "id": "100179",
      "original_text": "Löschungsankündigung\nSchleswig-Holstein Amtsgericht Flensburg HRA 8058\nVORTEX Systemtechnik ApS & Co. Kommanditgesellschaft – Handewitt",
      "type": "Löschungsankündigung",
      "state": "Schleswig-Holstein",
      "amtsgericht": "Amtsgericht Flensburg",
      "registernummer": "HRA 8058",
      "registerart": "HRA",
      "company_name": "VORTEX Systemtechnik ApS & Co. Kommanditgesellschaft",
      "company_seat": "Handewitt",
      "details": "31.01.2025 (Bekanntmachungsdatum)\n\nSchleswig-Holstein Amtsgericht Flensburg HRA 8058\nLöschungsankündigung\n\nVORTEX Systemtechnik ApS & Co. Kommanditgesellschaft\nKommanditgesellschaft\nHandewitt\n\nEs ist beabsichtigt, die Firma gemäß § 31 Abs. 2 HGB von Amts wegen zu löschen. Widerspruchsfrist: 3 Monate."
    },
    {
      "date": "2025-01-31",
      "id": "100180",
      "original_text": "Registerbekanntmachung nach dem Umwandlungsgesetz\nBerlin Amtsgericht Berlin (Charlottenburg) GnR 1046\nCora Sukha eG – Berlin",
      "type": "Registerbekanntmachung nach dem Umwandlungsgesetz",
      "state": "Berlin",
      "amtsgericht": "Amtsgericht Berlin (Charlottenburg)",
      "registernummer": "GnR 1046",
      "registerart": "GnR",
      "company_name": "Cora Sukha eG",
      "company_seat": "Berlin",
      "details": "31.01.2025 (Bekanntmachungsdatum)\n\nBerlin Amtsgericht Berlin (Charlottenburg) GnR 1046\nRegisterbekanntmachung nach dem Umwandlungsgesetz 30.01.2025 (Eintragungsdatum)\n\nCora Sukha eG\neingetragene Genossenschaft\nBerlin\n\nZu Eintragungsnummer 1 vom 30.01.2025 wird als nicht eingetragen veröffentlicht: Den Gläubigern ist, wenn sie binnen sechs Monaten nach dem Tag, an dem die Eintragung der Umwandlung als bekannt gemacht gilt, ihren Anspruch nach Grund und Höhe schriftlich anmelden, Sicherheit zu leisten, soweit sie nicht Befriedigung verlangen können. Dieses Recht steht den Gläubigern jedoch nur zu, wenn sie glaubhaft machen, dass durch die Umwandlung die Erfüllung ihrer Forderung gefährdet wird. Das Recht, Sicherheitsleistung zu verlangen, steht Gläubigern nicht zu, die im Falle der Insolvenz ein Recht auf vorzugsweise Befriedigung aus einer Deckungsmasse haben, die nach gesetzlicher Vorschrift zu ihrem Schutz errichtet und staatlich überwacht ist."
    },
    {
      "date": "2025-01-31",
      "id": "100181",
      "original_text": "Sonstige Registerbekanntmachung\nBaden-Württemberg Amtsgericht Mannheim HRB 9967\nAutoCenter Dietrich GmbH – Mannheim",
      "type": "Sonstige Registerbekanntmachung",
      "state": "Baden-Württemberg",
      "amtsgericht": "Amtsgericht Mannheim",
      "registernummer": "HRB 9967",
      "registerart": "HRB",
      "company_name": "AutoCenter Dietrich GmbH",
      "company_seat": "Mannheim",
      "details": "31.01.2025 (Bekanntmachungsdatum)\n\nBaden-Württemberg Amtsgericht Mannheim HRB 9967\nSonstige Registerbekanntmachung 31.01.2025 (Eintragungsdatum)\n\nAutoCenter Dietrich GmbH\nGesellschaft mit beschränkter Haftung\nMannheim\n\nDen Gläubigern der Gesellschaft, deren Forderungen begründet worden sind, bevor die Eintragung der Beendigung des Vertrages in das Handelsregister nach § 10 HGB als bekanntgemacht gilt, ist vom anderen Vertragsteil Sicherheit zu leisten, wenn sie sich binnen sechs Monaten nach der Bekanntmachung zu diesem Zweck bei ihm melden."
    },
    {
      "date": "2025-01-31",
      "id": "100182",
      "original_text": "Registerbekanntmachung nach dem Umwandlungsgesetz\nBerlin Amtsgericht Berlin (Charlottenburg) HRA 57428\nCora KG – Berlin",
      "type": "Registerbekanntmachung nach dem Umwandlungsgesetz",
      "state": "Berlin",
      "amtsgericht": "Amtsgericht Berlin (Charlottenburg)",
      "registernummer": "HRA 57428",
      "registerart": "HRA",
      "company_name": "Cora KG",
      "company_seat": "Berlin",
      "details": "31.01.2025 (Bekanntmachungsdatum)\n\nBerlin Amtsgericht Berlin (Charlottenburg) HRA 57428\nRegisterbekanntmachung nach dem Umwandlungsgesetz 30.01.2025 (Eintragungsdatum)\n\nCora KG\nKommanditgesellschaft\nBerlin\n\nZu Eintragungsnummer 2 vom 30.01.2025 wird als nicht eingetragen veröffentlicht: Den Gläubigern ist, wenn sie binnen sechs Monaten nach dem Tag, an dem die Eintragung der Umwandlung als bekannt gemacht gilt, ihren Anspruch nach Grund und Höhe schriftlich anmelden, Sicherheit zu leisten, soweit sie nicht Befriedigung verlangen können. Dieses Recht steht den Gläubigern jedoch nur zu, wenn sie glaubhaft machen, dass durch die Umwandlung die Erfüllung ihrer Forderung gefährdet wird. Das Recht, Sicherheitsleistung zu verlangen, steht Gläubigern nicht zu, die im Falle der Insolvenz ein Recht auf vorzugsweise Befriedigung aus einer Deckungsmasse haben, die nach gesetzlicher Vorschrift zu ihrem Schutz errichtet und staatlich überwacht ist."
    },
    {
      "date": "2025-01-31",
      "id": "100183",
      "original_text": "Löschungsankündigung\nBrandenburg Amtsgericht Potsdam HRB 22866\nImka Film UG (haftungsbeschränkt) – Ludwigsfelde",
      "type": "Löschungsankündigung",
      "state": "Brandenburg",
      "amtsgericht": "Amtsgericht Potsdam",
      "registernummer": "HRB 22866",
      "registerart": "HRB",
      "company_name": "Imka Film UG (haftungsbeschränkt)",
      "company_seat": "Ludwigsfelde",
      "details": "31.01.2025 (Bekanntmachungsdatum)\n\nBrandenburg Amtsgericht Potsdam HRB 22866\nLöschungsankündigung\n\nImka Film UG (haftungsbeschränkt)\nGesellschaft mit beschränkter Haftung\nLudwigsfelde\n\nBei der nachstehenden Gesellschaft wird das Amtslöschungsverfahren gemäß § 394 FamFG eingeleitet. Widerspruchsfrist: 8 Wochen."
    },
    {
      "date": "2025-01-31",
      "id": "100184",
      "original_text": "Registerbekanntmachung nach dem Umwandlungsgesetz\nBerlin Amtsgericht Berlin (Charlottenburg) HRB 24613\nIMPATIA GmbH Immobilien-Vermittlung und Betreuung – Berlin",
      "type": "Registerbekanntmachung nach dem Umwandlungsgesetz",
      "state": "Berlin",
      "amtsgericht": "Amtsgericht Berlin (Charlottenburg)",
      "registernummer": "HRB 24613",
      "registerart": "HRB",
      "company_name": "IMPATIA GmbH Immobilien-Vermittlung und Betreuung",
      "company_seat": "Berlin",
      "details": "31.01.2025 (Bekanntmachungsdatum)\n\nBerlin Amtsgericht Berlin (Charlottenburg) HRB 24613\nRegisterbekanntmachung nach dem Umwandlungsgesetz 31.01.2025 (Eintragungsdatum)\n\nIMPATIA GmbH Immobilien-Vermittlung und Betreuung\nGesellschaft mit beschränkter Haftung\nBerlin\n\nZu Eintragungsnummer 4 vom 31.01.2025 wird als nicht eingetragen veröffentlicht: Den Gläubigern der an der Verschmelzung beteiligten Rechtsträger ist, wenn sie binnen sechs Monaten nach dem Tag, an dem die Eintragung der Verschmelzung in das Register des Sitzes desjenigen Rechtsträgers, dessen Gläubiger sie sind, als bekannt gemacht gilt, ihren Anspruch nach Grund und Höhe schriftlich anmelden, Sicherheit zu leisten, soweit sie nicht Befriedigung verlangen können. Dieses Recht steht den Gläubigern jedoch nur zu, wenn sie glaubhaft machen, dass durch die Verschmelzung die Erfüllung ihrer Forderung gefährdet wird. Das Recht, Sicherheitsleistung zu verlangen, steht Gläubigern nicht zu, die im Falle der Insolvenz ein Recht auf vorzugsweise Befriedigung aus einer Deckungsmasse haben, die nach gesetzlicher Vorschrift zu ihrem Schutz errichtet und staatlich überwacht ist."
    },
    {
      "date": "2025-01-31",
      "id": "100185",
      "original_text": "Registerbekanntmachung nach dem Umwandlungsgesetz\nBerlin Amtsgericht Berlin (Charlottenburg) HRB 196472\nTopim GmbH – Berlin",
      "type": "Registerbekanntmachung nach dem Umwandlungsgesetz",
      "state": "Berlin",
      "amtsgericht": "Amtsgericht Berlin (Charlottenburg)",
      "registernummer": "HRB 196472",
      "registerart": "HRB",
      "company_name": "Topim GmbH",
      "company_seat": "Berlin",
      "details": "31.01.2025 (Bekanntmachungsdatum)\n\nBerlin Amtsgericht Berlin (Charlottenburg) HRB 196472\nRegisterbekanntmachung nach dem Umwandlungsgesetz 31.01.2025 (Eintragungsdatum)\n\nTopim GmbH\nGesellschaft mit beschränkter Haftung\nBerlin\n\nZu Eintragungsnummer 2 vom 31.01.2025 wird als nicht eingetragen veröffentlicht: Den Gläubigern der an der Verschmelzung beteiligten Rechtsträger ist, wenn sie binnen sechs Monaten nach dem Tag, an dem die Eintragung der Verschmelzung in das Register des Sitzes desjenigen Rechtsträgers, dessen Gläubiger sie sind, als bekannt gemacht gilt, ihren Anspruch nach Grund und Höhe schriftlich anmelden, Sicherheit zu leisten, soweit sie nicht Befriedigung verlangen können. Dieses Recht steht den Gläubigern jedoch nur zu, wenn sie glaubhaft machen, dass durch die Verschmelzung die Erfüllung ihrer Forderung gefährdet wird. Das Recht, Sicherheitsleistung zu verlangen, steht Gläubigern nicht zu, die im Falle der Insolvenz ein Recht auf vorzugsweise Befriedigung aus einer Deckungsmasse haben, die nach gesetzlicher Vorschrift zu ihrem Schutz errichtet und staatlich überwacht ist."
    },
    {
      "date": "2025-01-31",
      "id": "100186",
      "original_text": "Registerbekanntmachung nach dem Umwandlungsgesetz\nBaden-Württemberg Amtsgericht Mannheim HRB 110002\nCentinet AG – Karlsruhe",
      "type": "Registerbekanntmachung nach dem Umwandlungsgesetz",
      "state": "Baden-Württemberg",
      "amtsgericht": "Amtsgericht Mannheim",
      "registernummer": "HRB 110002",
      "registerart": "HRB",
      "company_name": "Centinet AG",
      "company_seat": "Karlsruhe",
      "details": "31.01.2025 (Bekanntmachungsdatum)\n\nBaden-Württemberg Amtsgericht Mannheim HRB 110002\nRegisterbekanntmachung nach dem Umwandlungsgesetz 31.01.2025 (Eintragungsdatum)\n\nCentinet AG\nAktiengesellschaft\nKarlsruhe\n\nAls nicht eingetragen wird bekanntgemacht: Den Gläubigern des an dem Formwechsel beteiligten Rechtsträgers ist, wenn sie binnen sechs Monaten nach dem Tag, an dem die Eintragung des Formwechsels in das Register des Sitzes desjenigen Rechtsträgers, dessen Gläubiger sie sind, nach § 19 Abs. 3 UmwG als bekanntgemacht gilt, ihren Anspruch nach Grund und Höhe schriftlich anmelden, Sicherheit zu leisten, soweit sie nicht Befriedigung verlangen können. Dieses Recht steht den Gläubigern jedoch nur zu, wenn sie glaubhaft machen, dass durch den Formwechsel die Erfüllung ihrer Forderung gefährdet wird."
    },
    {
      "date": "2025-01-31",
      "id": "100187",
      "original_text": "Registerbekanntmachung nach dem Umwandlungsgesetz\nBaden-Württemberg Amtsgericht Mannheim HRB 753431\nCentinet Consulting GmbH – Karlsruhe",
      "type": "Registerbekanntmachung nach dem Umwandlungsgesetz",
      "state": "Baden-Württemberg",
      "amtsgericht": "Amtsgericht Mannheim",
      "registernummer": "HRB 753431",
      "registerart": "HRB",
      "company_name": "Centinet Consulting GmbH",
      "company_seat": "Karlsruhe",
      "details": "31.01.2025 (Bekanntmachungsdatum)\n\nBaden-Württemberg Amtsgericht Mannheim HRB 753431\nRegisterbekanntmachung nach dem Umwandlungsgesetz 31.01.2025 (Eintragungsdatum)\n\nCentinet Consulting GmbH\nGesellschaft mit beschränkter Haftung\nKarlsruhe\n\nAls nicht eingetragen wird bekanntgemacht: Den Gläubigern des an dem Formwechsel beteiligten Rechtsträgers ist, wenn sie binnen sechs Monaten nach dem Tag, an dem die Eintragung des Formwechsels in das Register des Sitzes desjenigen Rechtsträgers, dessen Gläubiger sie sind, nach § 19 Abs. 3 UmwG als bekanntgemacht gilt, ihren Anspruch nach Grund und Höhe schriftlich anmelden, Sicherheit zu leisten, soweit sie nicht Befriedigung verlangen können. Dieses Recht steht den Gläubigern jedoch nur zu, wenn sie glaubhaft machen, dass durch den Formwechsel die Erfüllung ihrer Forderung gefährdet wird."
    },
    {
      "date": "2025-01-31",
      "id": "100188",
      "original_text": "Einreichung neuer Dokumente\nHamburg Amtsgericht Hamburg HRB 16851\nHansaport Hafenbetriebsgesellschaft mit beschränkter Haftung – Hamburg",
      "type": "Einreichung neuer Dokumente",
      "state": "Hamburg",
      "amtsgericht": "Amtsgericht Hamburg",
      "registernummer": "HRB 16851",
      "registerart": "HRB",
      "company_name": "Hansaport Hafenbetriebsgesellschaft mit beschränkter Haftung",
      "company_seat": "Hamburg",
      "details": "31.01.2025 (Bekanntmachungsdatum)\n\nHamburg Amtsgericht Hamburg HRB 16851\nEinreichung neuer Dokumente\n\nHansaport Hafenbetriebsgesellschaft mit beschränkter Haftung\nGesellschaft mit beschränkter Haftung\nHamburg\n\nAls nicht eingetragen wird bekannt gemacht: Liste des Aufsichtsrats wurde eingereicht."
    },
    {
      "date": "2025-01-31",
      "id": "100189",
      "original_text": "Registerbekanntmachung nach dem Umwandlungsgesetz\nBaden-Württemberg Amtsgericht Stuttgart HRB 762379\nPrototools Verwaltungs GmbH – Neuenstadt am Kocher",
      "type": "Registerbekanntmachung nach dem Umwandlungsgesetz",
      "state": "Baden-Württemberg",
      "amtsgericht": "Amtsgericht Stuttgart",
      "registernummer": "HRB 762379",
      "registerart": "HRB",
      "company_name": "Prototools Verwaltungs GmbH",
      "company_seat": "Neuenstadt am Kocher",
      "details": "31.01.2025 (Bekanntmachungsdatum)\n\nBaden-Württemberg Amtsgericht Stuttgart HRB 762379\nRegisterbekanntmachung nach dem Umwandlungsgesetz 31.01.2025 (Eintragungsdatum)\n\nPrototools Verwaltungs GmbH\nGesellschaft mit beschränkter Haftung\nNeuenstadt am Kocher\n\nAls nicht eingetragen wird bekanntgemacht:\nDen Gläubigern der an der Verschmelzung beteiligten Rechtsträger ist, wenn sie binnen sechs Monaten nach dem Tag, an dem die Eintragung der Verschmelzung in das Register des Sitzes desjenigen Rechtsträgers, dessen Gläubiger sie sind, nach § 19 Abs. 3 UmwG als bekanntgemacht gilt, ihren Anspruch nach Grund und Höhe schriftlich anmelden, Sicherheit zu leisten, soweit sie nicht Befriedigung verlangen können. Dieses Recht steht den Gläubigern jedoch nur zu, wenn sie glaubhaft machen, dass durch die Verschmelzung die Erfüllung ihrer Forderung gefährdet wird."
    },
    {
      "date": "2025-01-31",
      "id": "100190",
      "original_text": "Registerbekanntmachung nach dem Umwandlungsgesetz\nSachsen Amtsgericht Chemnitz HRA 10159\nArchitektur- u. Ing.-büro Dr. h.c. Heiko W. Sünderhauf e. K. – Pöhl",
      "type": "Registerbekanntmachung nach dem Umwandlungsgesetz",
      "state": "Sachsen",
      "amtsgericht": "Amtsgericht Chemnitz",
      "registernummer": "HRA 10159",
      "registerart": "HRA",
      "company_name": "Architektur- u. Ing.-büro Dr. h.c. Heiko W. Sünderhauf e. K.",
      "company_seat": "Pöhl",
      "details": "31.01.2025 (Bekanntmachungsdatum)\n\nSachsen Amtsgericht Chemnitz HRA 10159\nRegisterbekanntmachung nach dem Umwandlungsgesetz 31.01.2025 (Eintragungsdatum)\n\nArchitektur- u. Ing.-büro Dr. h.c. Heiko W. Sünderhauf e. K.\nEinzelkaufmann / Einzelkauffrau\nPöhl\n\nDen Gläubigern der an der Ausgliederung beteiligten Rechtsträger ist, wenn sie binnen sechs Monaten nach dem Tag, an dem die Eintragung der Ausgliederung in das Register des Sitzes desjenigen Rechtsträgers, dessen Gläubiger sie sind, nach § 19 Abs. 3 UmwG als bekannt gemacht gilt, ihren Anspruch nach Grund und Höhe in Textform anmelden, Sicherheit zu leisten, soweit sie nicht Befriedigung verlangen können. Dieses Recht steht den Gläubigern jedoch nur zu, wenn sie glaubhaft machen, dass durch die Ausgliederung die Erfüllung der Forderung gefährdet wird."
    },
    {
      "date": "2025-01-31",
      "id": "100191",
      "original_text": "Registerbekanntmachung nach dem Umwandlungsgesetz\nSachsen Amtsgericht Leipzig HRA 19623\nBirgit Krätzer Holding UG (haftungsbeschränkt) & Co. KG – Leipzig",
      "type": "Registerbekanntmachung nach dem Umwandlungsgesetz",
      "state": "Sachsen",
      "amtsgericht": "Amtsgericht Leipzig",
      "registernummer": "HRA 19623",
      "registerart": "HRA",
      "company_name": "Birgit Krätzer Holding UG (haftungsbeschränkt) & Co. KG",
      "company_seat": "Leipzig",
      "details": "31.01.2025 (Bekanntmachungsdatum)\n\nSachsen Amtsgericht Leipzig HRA 19623\nRegisterbekanntmachung nach dem Umwandlungsgesetz 31.01.2025 (Eintragungsdatum)\n\nBirgit Krätzer Holding UG (haftungsbeschränkt) & Co. KG\nKommanditgesellschaft\nLeipzig\n\nDen Gläubigern der an der Ausgliederung beteiligten Rechtsträger ist, wenn sie binnen sechs Monaten nach dem Tag, an dem die Eintragung der Ausgliederung in das Register des Sitzes desjenigen Rechtsträgers, dessen Gläubiger sie sind, nach § 19 Abs. 3 UmwG als bekannt gemacht gilt, ihren Anspruch nach Grund und Höhe in Textform anmelden, Sicherheit zu leisten, soweit sie nicht Befriedigung verlangen können. Dieses Recht steht den Gläubigern jedoch nur zu, wenn sie glaubhaft machen, dass durch die Ausgliederung die Erfüllung der Forderung gefährdet wird."
    },
    {
      "date": "2025-01-31",
      "id": "100192",
      "original_text": "Registerbekanntmachung nach dem Umwandlungsgesetz\nSachsen Amtsgericht Chemnitz HRB 37140\narcontec consulting GmbH – Plauen",
      "type": "Registerbekanntmachung nach dem Umwandlungsgesetz",
      "state": "Sachsen",
      "amtsgericht": "Amtsgericht Chemnitz",
      "registernummer": "HRB 37140",
      "registerart": "HRB",
      "company_name": "arcontec consulting GmbH",
      "company_seat": "Plauen",
      "details": "31.01.2025 (Bekanntmachungsdatum)\n\nSachsen Amtsgericht Chemnitz HRB 37140\nRegisterbekanntmachung nach dem Umwandlungsgesetz 31.01.2025 (Eintragungsdatum)\n\narcontec consulting GmbH\nGesellschaft mit beschränkter Haftung\nPlauen\n\nDen Gläubigern der an der Ausgliederung beteiligten Rechtsträger ist, wenn sie binnen sechs Monaten nach dem Tag, an dem die Eintragung der Ausgliederung in das Register des Sitzes desjenigen Rechtsträgers, dessen Gläubiger sie sind, nach § 19 Abs. 3 UmwG als bekannt gemacht gilt, ihren Anspruch nach Grund und Höhe in Textform anmelden, Sicherheit zu leisten, soweit sie nicht Befriedigung verlangen können. Dieses Recht steht den Gläubigern jedoch nur zu, wenn sie glaubhaft machen, dass durch die Ausgliederung die Erfüllung der Forderung gefährdet wird."
    },
    {
      "date": "2025-01-31",
      "id": "100193",
      "original_text": "Registerbekanntmachung nach dem Umwandlungsgesetz\nSachsen Amtsgericht Leipzig HRA 19599\nBirgit Krätzer e.K. – Leipzig",
      "type": "Registerbekanntmachung nach dem Umwandlungsgesetz",
      "state": "Sachsen",
      "amtsgericht": "Amtsgericht Leipzig",
      "registernummer": "HRA 19599",
      "registerart": "HRA",
      "company_name": "Birgit Krätzer e.K.",
      "company_seat": "Leipzig",
      "details": "31.01.2025 (Bekanntmachungsdatum)\n\nSachsen Amtsgericht Leipzig HRA 19599\nRegisterbekanntmachung nach dem Umwandlungsgesetz 31.01.2025 (Eintragungsdatum)\n\nBirgit Krätzer e.K.\nEinzelkaufmann / Einzelkauffrau\nLeipzig\n\nDen Gläubigern der an der Ausgliederung beteiligten Rechtsträger ist, wenn sie binnen sechs Monaten nach dem Tag, an dem die Eintragung der Ausgliederung in das Register des Sitzes desjenigen Rechtsträgers, dessen Gläubiger sie sind, nach § 19 Abs. 3 UmwG als bekannt gemacht gilt, ihren Anspruch nach Grund und Höhe in Textform anmelden, Sicherheit zu leisten, soweit sie nicht Befriedigung verlangen können. Dieses Recht steht den Gläubigern jedoch nur zu, wenn sie glaubhaft machen, dass durch die Ausgliederung die Erfüllung der Forderung gefährdet wird."
    },
    {
      "date": "2025-01-31",
      "id": "100194",
      "original_text": "Einreichung neuer Dokumente\nSachsen Amtsgericht Chemnitz HRB 15765\n(EFC) Eissport und Freizeit GmbH Chemnitz – Chemnitz",
      "type": "Einreichung neuer Dokumente",
      "state": "Sachsen",
      "amtsgericht": "Amtsgericht Chemnitz",
      "registernummer": "HRB 15765",
      "registerart": "HRB",
      "company_name": "(EFC) Eissport und Freizeit GmbH Chemnitz",
      "company_seat": "Chemnitz",
      "details": "31.01.2025 (Bekanntmachungsdatum)\n\nSachsen Amtsgericht Chemnitz HRB 15765\nEinreichung neuer Dokumente\n\n(EFC) Eissport und Freizeit GmbH Chemnitz\nGesellschaft mit beschränkter Haftung\nChemnitz\n\nAm 29.01.2025 wurde beim Handelsregister des Amtsgerichts Chemnitz die Liste der Mitglieder des Aufsichtsrats gemäß § 52 GmbHG eingereicht."
    },
    {
      "date": "2025-01-31",
      "id": "100195",
      "original_text": "Sonstige Registerbekanntmachung\nSachsen Amtsgericht Dresden HRB 37342\nKF Strahltechnik Dresden GmbH – Dresden",
      "type": "Sonstige Registerbekanntmachung",
      "state": "Sachsen",
      "amtsgericht": "Amtsgericht Dresden",
      "registernummer": "HRB 37342",
      "registerart": "HRB",
      "company_name": "KF Strahltechnik Dresden GmbH",
      "company_seat": "Dresden",
      "details": "31.01.2025 (Bekanntmachungsdatum)\n\nSachsen Amtsgericht Dresden HRB 37342\nSonstige Registerbekanntmachung 31.01.2025 (Eintragungsdatum)\n\nKF Strahltechnik Dresden GmbH\nGesellschaft mit beschränkter Haftung\nDresden\n\nDen Gläubigern der Gesellschaft, deren Forderungen begründet worden sind bevor die Eintragung der Beendigung des Beherrschungs- und Gewinnabführungsvertrages in das Handelsregister nach § 10 des Handelsgesetzbuches als bekanntgemacht gilt, hat der andere Vertragsteil Sicherheit zu leisten, wenn sie sich binnen sechs Monaten nach der Bekanntmachung der Eintragung zu diesem Zweck bei ihm melden."
    },
    {
      "date": "2025-01-31",
      "id": "100196",
      "original_text": "Einreichung neuer Dokumente\nMecklenburg-Vorpommern Amtsgericht Stralsund HRB 1964\nStadterneuerungsgesellschaft Stralsund mbH – Stralsund",
      "type": "Einreichung neuer Dokumente",
      "state": "Mecklenburg-Vorpommern",
      "amtsgericht": "Amtsgericht Stralsund",
      "registernummer": "HRB 1964",
      "registerart": "HRB",
      "company_name": "Stadterneuerungsgesellschaft Stralsund mbH",
      "company_seat": "Stralsund",
      "details": "31.01.2025 (Bekanntmachungsdatum)\n\nMecklenburg-Vorpommern Amtsgericht Stralsund HRB 1964\nEinreichung neuer Dokumente\n\nStadterneuerungsgesellschaft Stralsund mbH\nGesellschaft mit beschränkter Haftung\nStralsund\n\nEine Liste der Mitglieder des Aufsichtsrats ist zum Handelsregister eingereicht worden."
    },
    {
      "date": "2025-01-31",
      "id": "100197",
      "original_text": "Löschungsankündigung\nSchleswig-Holstein Amtsgericht Kiel HRA 10442\nLG Handwerksfachbetrieb GmbH & Co. KG – Schacht-Audorf",
      "type": "Löschungsankündigung",
      "state": "Schleswig-Holstein",
      "amtsgericht": "Amtsgericht Kiel",
      "registernummer": "HRA 10442",
      "registerart": "HRA",
      "company_name": "LG Handwerksfachbetrieb GmbH & Co. KG",
      "company_seat": "Schacht-Audorf",
      "details": "31.01.2025 (Bekanntmachungsdatum)\n\nSchleswig-Holstein Amtsgericht Kiel HRA 10442\nLöschungsankündigung\n\nLG Handwerksfachbetrieb GmbH & Co. KG\nKommanditgesellschaft\nSchacht-Audorf\n\nBei der nachstehenden Firma wird das Amtslöschungsverfahren gemäß § 31 Abs. 2 HGB eingeleitet. Widerspruchsfrist: 2 Monate."
    },
    {
      "date": "2025-01-31",
      "id": "100198",
      "original_text": "Einreichung neuer Dokumente\nBaden-Württemberg Amtsgericht Mannheim HRB 711465\nBalaton Agro Invest AG – Heidelberg",
      "type": "Einreichung neuer Dokumente",
      "state": "Baden-Württemberg",
      "amtsgericht": "Amtsgericht Mannheim",
      "registernummer": "HRB 711465",
      "registerart": "HRB",
      "company_name": "Balaton Agro Invest AG",
      "company_seat": "Heidelberg",
      "details": "31.01.2025 (Bekanntmachungsdatum)\n\nBaden-Württemberg Amtsgericht Mannheim HRB 711465\nEinreichung neuer Dokumente\n\nBalaton Agro Invest AG\nAktiengesellschaft\nHeidelberg\n\nDie Gesellschaft hat am 31.01.2025 den Entwurf des Verschmelzungsvertrages zwischen \"Deutsche Balaton Aktiengesellschaft\", Heidelberg (Amtsgericht Amtsgericht Mannheim HRB 338172)\nund der hiesigen Gesellschaft (übertragender Rechtsträger) zum Handelsregister eingereicht."
    },
    {
      "date": "2025-01-31",
      "id": "100199",
      "original_text": "Registerbekanntmachung nach dem Umwandlungsgesetz\nBaden-Württemberg Amtsgericht Stuttgart PR 721220\nüBAG der Zahnärzte Herr Thomas Binder, Zahnarzt, Herr Dr. Peter Maier, Zahnarzt, Partnerschaft mbB – Stuttgart",
      "type": "Registerbekanntmachung nach dem Umwandlungsgesetz",
      "state": "Baden-Württemberg",
      "amtsgericht": "Amtsgericht Stuttgart",
      "registernummer": "PR 721220",
      "registerart": "PR",
      "company_name": "üBAG der Zahnärzte Herr Thomas Binder, Zahnarzt, Herr Dr. Peter Maier, Zahnarzt, Partnerschaft mbB",
      "company_seat": "Stuttgart",
      "details": "31.01.2025 (Bekanntmachungsdatum)\n\nBaden-Württemberg Amtsgericht Stuttgart PR 721220\nRegisterbekanntmachung nach dem Umwandlungsgesetz 31.01.2025 (Eintragungsdatum)\n\nüBAG der Zahnärzte Herr Thomas Binder, Zahnarzt, Herr Dr. Peter Maier, Zahnarzt, Partnerschaft mbB\nPartnerschaftsgesellschaft\nStuttgart\n\nDen Gläubigern der an der Verschmelzung beteiligten Rechtsträger ist, wenn sie binnen sechs Monaten nach dem Tag, an dem die Eintragung der Verschmelzung in das Register des Sitzes desjenigen Rechtsträgers, dessen Gläubiger sie sind, nach § 19 Abs. 3 UmwG als bekanntgemacht gilt, ihren Anspruch nach Grund und Höhe schriftlich anmelden, Sicherheit zu leisten, soweit sie nicht Befriedigung verlangen können. Dieses Recht steht den Gläubigern jedoch nur zu, wenn sie glaubhaft machen, dass durch die Verschmelzung die Erfüllung ihrer Forderung gefährdet wird."
    },
    {
      "date": "2025-01-31",
      "id": "100200",
      "original_text": "Registerbekanntmachung nach dem Umwandlungsgesetz\nBaden-Württemberg Amtsgericht Stuttgart HRB 794239\nS-Dent MVZ GmbH – Stuttgart",
      "type": "Registerbekanntmachung nach dem Umwandlungsgesetz",
      "state": "Baden-Württemberg",
      "amtsgericht": "Amtsgericht Stuttgart",
      "registernummer": "HRB 794239",
      "registerart": "HRB",
      "company_name": "S-Dent MVZ GmbH",
      "company_seat": "Stuttgart",
      "details": "31.01.2025 (Bekanntmachungsdatum)\n\nBaden-Württemberg Amtsgericht Stuttgart HRB 794239\nRegisterbekanntmachung nach dem Umwandlungsgesetz 31.01.2025 (Eintragungsdatum)\n\nS-Dent MVZ GmbH\nGesellschaft mit beschränkter Haftung\nStuttgart\n\nAls nicht eingetragen wird bekanntgemacht:\nDen Gläubigern der an der Verschmelzung beteiligten Rechtsträger ist, wenn sie binnen sechs Monaten nach dem Tag, an dem die Eintragung der Verschmelzung in das Register des Sitzes desjenigen Rechtsträgers, dessen Gläubiger sie sind, nach § 19 Abs. 3 UmwG als bekanntgemacht gilt, ihren Anspruch nach Grund und Höhe schriftlich anmelden, Sicherheit zu leisten, soweit sie nicht Befriedigung verlangen können. Dieses Recht steht den Gläubigern jedoch nur zu, wenn sie glaubhaft machen, dass durch die Verschmelzung die Erfüllung ihrer Forderung gefährdet wird."
    },
    {
      "date": "2025-01-31",
      "id": "100201",
      "original_text": "Sonstige Registerbekanntmachung\nBerlin Amtsgericht Berlin (Charlottenburg) HRB 20795\nFUNKE Media Sales & Services Berlin GmbH – Berlin",
      "type": "Sonstige Registerbekanntmachung",
      "state": "Berlin",
      "amtsgericht": "Amtsgericht Berlin (Charlottenburg)",
      "registernummer": "HRB 20795",
      "registerart": "HRB",
      "company_name": "FUNKE Media Sales & Services Berlin GmbH",
      "company_seat": "Berlin",
      "details": "31.01.2025 (Bekanntmachungsdatum)\n\nBerlin Amtsgericht Berlin (Charlottenburg) HRB 20795\nSonstige Registerbekanntmachung\n\nFUNKE Media Sales & Services Berlin GmbH\nGesellschaft mit beschränkter Haftung\nBerlin\n\nAls nicht eingetragen wird veröffentlicht:\n\nDer andere Vertragsteil hat den Gläubigern dieses Rechtsträgers, deren Forderungen begründet worden sind, bevor die Eintragung der Beendigung dieses Vertrages in das Handelsregister nach § 10 des Handelsgesetzbuches als bekannt gemacht gilt, Sicherheit zu leisten, wenn sie sich binnen sechs Monaten nach der Bekanntmachung der Eintragung zu diesem Zweck bei ihm melden. Dieses Recht steht den Gläubigern nicht zu, die im Fall des Insolvenzverfahrens ein Recht auf vorzugsweise Befriedigung aus der Deckungsmasse haben, die nach gesetzlicher Vorschrift zu ihrem Schutz errichtet und staatlich überwacht ist."
    },
    {
      "date": "2025-01-31",
      "id": "100202",
      "original_text": "Sonstige Registerbekanntmachung\nBrandenburg Amtsgericht Frankfurt/Oder HRB 12548\nHGS Handelsgesellschaft und Versorgung mbH – Grünheide (Mark)",
      "type": "Sonstige Registerbekanntmachung",
      "state": "Brandenburg",
      "amtsgericht": "Amtsgericht Frankfurt/Oder",
      "registernummer": "HRB 12548",
      "registerart": "HRB",
      "company_name": "HGS Handelsgesellschaft und Versorgung mbH",
      "company_seat": "Grünheide (Mark)",
      "details": "31.01.2025 (Bekanntmachungsdatum)\n\nBrandenburg Amtsgericht Frankfurt/Oder HRB 12548\nSonstige Registerbekanntmachung\n\nHGS Handelsgesellschaft und Versorgung mbH\nGesellschaft mit beschränkter Haftung\nGrünheide (Mark)\n\nDie vermögenslose Gesellschaft ist auf Grund des § 394 FamFG von Amts wegen gelöscht"
    },
    {
      "date": "2025-01-31",
      "id": "100203",
      "original_text": "Registerbekanntmachung nach dem Umwandlungsgesetz\nNiedersachsen Amtsgericht Hildesheim HRB 209496\nLöpertz Software GmbH – Hildesheim",
      "type": "Registerbekanntmachung nach dem Umwandlungsgesetz",
      "state": "Niedersachsen",
      "amtsgericht": "Amtsgericht Hildesheim",
      "registernummer": "HRB 209496",
      "registerart": "HRB",
      "company_name": "Löpertz Software GmbH",
      "company_seat": "Hildesheim",
      "details": "31.01.2025 (Bekanntmachungsdatum)\n\nNiedersachsen Amtsgericht Hildesheim HRB 209496\nRegisterbekanntmachung nach dem Umwandlungsgesetz 31.01.2025 (Eintragungsdatum)\n\nLöpertz Software GmbH\nGesellschaft mit beschränkter Haftung\nHildesheim\n\nDen Gläubigern der an der Verschmelzung beteiligten Rechtsträger ist, wenn sie binnen sechs Monaten nach dem Tag, an dem die Eintragung der Verschmelzung in das Register des Sitzes desjenigen Rechtsträgers, dessen Gläubiger sie sind, nach § 19  Abs.  3 UmwG als bekannt gemacht gilt, ihren Anspruch nach Grund und Höhe schriftlich anmelden, Sicherheit zu leisten, soweit sie nicht Befriedigung verlangen können. Dieses Recht steht den Gläubigern jedoch nur zu, wenn sie glaubhaft machen, dass durch die Verschmelzung die Erfüllung der Forderung gefährdet wird."
    },
    {
      "date": "2025-01-31",
      "id": "100204",
      "original_text": "Registerbekanntmachung nach dem Umwandlungsgesetz\nNiedersachsen Amtsgericht Walsrode VR 200890\nFörderverein Kindergarten und Krippe Wolkentraum e.V. – Steyerberg",
      "type": "Registerbekanntmachung nach dem Umwandlungsgesetz",
      "state": "Niedersachsen",
      "amtsgericht": "Amtsgericht Walsrode",
      "registernummer": "VR 200890",
      "registerart": "VR",
      "company_name": "Förderverein Kindergarten und Krippe Wolkentraum e.V.",
      "company_seat": "Steyerberg",
      "details": "31.01.2025 (Bekanntmachungsdatum)\n\nNiedersachsen Amtsgericht Walsrode VR 200890\nRegisterbekanntmachung nach dem Umwandlungsgesetz 31.01.2025 (Eintragungsdatum)\n\nFörderverein Kindergarten und Krippe Wolkentraum e.V.\neingetragener Verein\nSteyerberg\n\nDen Gläubigern der an der Verschmelzung beteiligten Rechtsträger ist, wenn sie binnen sechs Monaten nach dem Tag, an dem die Eintragung der Verschmelzung in das Register des Sitzes desjenigen Rechtsträgers, dessen Gläubiger sie sind, nach § 19  Abs.  3 UmwG als bekannt gemacht gilt, ihren Anspruch nach Grund und Höhe schriftlich anmelden, Sicherheit zu leisten, soweit sie nicht Befriedigung verlangen können. Dieses Recht steht den Gläubigern jedoch nur zu, wenn sie glaubhaft machen, dass durch die Verschmelzung die Erfüllung der Forderung gefährdet wird."
    },
    {
      "date": "2025-01-31",
      "id": "100205",
      "original_text": "Registerbekanntmachung nach dem Umwandlungsgesetz\nNiedersachsen Amtsgericht Hildesheim HRB 202124\nMEDIFOX DAN GmbH – Hildesheim",
      "type": "Registerbekanntmachung nach dem Umwandlungsgesetz",
      "state": "Niedersachsen",
      "amtsgericht": "Amtsgericht Hildesheim",
      "registernummer": "HRB 202124",
      "registerart": "HRB",
      "company_name": "MEDIFOX DAN GmbH",
      "company_seat": "Hildesheim",
      "details": "31.01.2025 (Bekanntmachungsdatum)\n\nNiedersachsen Amtsgericht Hildesheim HRB 202124\nRegisterbekanntmachung nach dem Umwandlungsgesetz 31.01.2025 (Eintragungsdatum)\n\nMEDIFOX DAN GmbH\nGesellschaft mit beschränkter Haftung\nHildesheim\n\nDen Gläubigern der an der Verschmelzung beteiligten Rechtsträger ist, wenn sie binnen sechs Monaten nach dem Tag, an dem die Eintragung der Verschmelzung in das Register des Sitzes desjenigen Rechtsträgers, dessen Gläubiger sie sind, nach § 19  Abs.  3 UmwG als bekannt gemacht gilt, ihren Anspruch nach Grund und Höhe schriftlich anmelden, Sicherheit zu leisten, soweit sie nicht Befriedigung verlangen können. Dieses Recht steht den Gläubigern jedoch nur zu, wenn sie glaubhaft machen, dass durch die Verschmelzung die Erfüllung der Forderung gefährdet wird."
    },
    {
      "date": "2025-01-31",
      "id": "100206",
      "original_text": "Registerbekanntmachung nach dem Umwandlungsgesetz\nNiedersachsen Amtsgericht Hildesheim HRB 202124\nMEDIFOX DAN GmbH – Hildesheim",
      "type": "Registerbekanntmachung nach dem Umwandlungsgesetz",
      "state": "Niedersachsen",
      "amtsgericht": "Amtsgericht Hildesheim",
      "registernummer": "HRB 202124",
      "registerart": "HRB",
      "company_name": "MEDIFOX DAN GmbH",
      "company_seat": "Hildesheim",
      "details": "31.01.2025 (Bekanntmachungsdatum)\n\nNiedersachsen Amtsgericht Hildesheim HRB 202124\nRegisterbekanntmachung nach dem Umwandlungsgesetz 31.01.2025 (Eintragungsdatum)\n\nMEDIFOX DAN GmbH\nGesellschaft mit beschränkter Haftung\nHildesheim\n\nDen Gläubigern der an der Verschmelzung beteiligten Rechtsträger ist, wenn sie binnen sechs Monaten nach dem Tag, an dem die Eintragung der Verschmelzung in das Register des Sitzes desjenigen Rechtsträgers, dessen Gläubiger sie sind, nach § 19  Abs.  3 UmwG als bekannt gemacht gilt, ihren Anspruch nach Grund und Höhe schriftlich anmelden, Sicherheit zu leisten, soweit sie nicht Befriedigung verlangen können. Dieses Recht steht den Gläubigern jedoch nur zu, wenn sie glaubhaft machen, dass durch die Verschmelzung die Erfüllung der Forderung gefährdet wird."
    },
    {
      "date": "2025-01-31",
      "id": "100207",
      "original_text": "Löschungsankündigung\nNiedersachsen Amtsgericht Osnabrück HRB 217105\nB2B Support GmbH – Bad Bentheim",
      "type": "Löschungsankündigung",
      "state": "Niedersachsen",
      "amtsgericht": "Amtsgericht Osnabrück",
      "registernummer": "HRB 217105",
      "registerart": "HRB",
      "company_name": "B2B Support GmbH",
      "company_seat": "Bad Bentheim",
      "details": "31.01.2025 (Bekanntmachungsdatum)\n\nNiedersachsen Amtsgericht Osnabrück HRB 217105\nLöschungsankündigung\n\nB2B Support GmbH\nGesellschaft mit beschränkter Haftung\nBad Bentheim\n\nDas Registergericht beabsichtigt, die Gesellschaft von Amts wegen nach § 394 FamFG wegen Vermögenslosigkeit zu löschen. Die Frist zur Erhebung eines Widerspruchs ist auf 1 Monat ab dieser Registerbekanntmachung festgesetzt."
    },
    {
      "date": "2025-01-31",
      "id": "100208",
      "original_text": "Registerbekanntmachung nach dem Umwandlungsgesetz\nNiedersachsen Amtsgericht Walsrode VR 200442\nFörderverein Kindergarten Wurzelhöhle e.V. – Steyerberg",
      "type": "Registerbekanntmachung nach dem Umwandlungsgesetz",
      "state": "Niedersachsen",
      "amtsgericht": "Amtsgericht Walsrode",
      "registernummer": "VR 200442",
      "registerart": "VR",
      "company_name": "Förderverein Kindergarten Wurzelhöhle e.V.",
      "company_seat": "Steyerberg",
      "details": "31.01.2025 (Bekanntmachungsdatum)\n\nNiedersachsen Amtsgericht Walsrode VR 200442\nRegisterbekanntmachung nach dem Umwandlungsgesetz 31.01.2025 (Eintragungsdatum)\n\nFörderverein Kindergarten Wurzelhöhle e.V.\neingetragener Verein\nSteyerberg\n\nDen Gläubigern der an der Verschmelzung beteiligten Rechtsträger ist, wenn sie binnen sechs Monaten nach dem Tag, an dem die Eintragung der Verschmelzung in das Register des Sitzes desjenigen Rechtsträgers, dessen Gläubiger sie sind, nach § 19  Abs.  3 UmwG als bekannt gemacht gilt, ihren Anspruch nach Grund und Höhe schriftlich anmelden, Sicherheit zu leisten, soweit sie nicht Befriedigung verlangen können. Dieses Recht steht den Gläubigern jedoch nur zu, wenn sie glaubhaft machen, dass durch die Verschmelzung die Erfüllung der Forderung gefährdet wird."
    },
    {
      "date": "2025-01-31",
      "id": "100209",
      "original_text": "Löschungsankündigung\nNiedersachsen Amtsgericht Lüneburg HRB 206663\nBB-Immobiliengesellschaft UG (haftungsbeschränkt) – Bispingen",
      "type": "Löschungsankündigung",
      "state": "Niedersachsen",
      "amtsgericht": "Amtsgericht Lüneburg",
      "registernummer": "HRB 206663",
      "registerart": "HRB",
      "company_name": "BB-Immobiliengesellschaft UG (haftungsbeschränkt)",
      "company_seat": "Bispingen",
      "details": "31.01.2025 (Bekanntmachungsdatum)\n\nNiedersachsen Amtsgericht Lüneburg HRB 206663\nLöschungsankündigung\n\nBB-Immobiliengesellschaft UG (haftungsbeschränkt)\nGesellschaft mit beschränkter Haftung\nBispingen\n\nDas Registergericht beabsichtigt, die Gesellschaft von Amts wegen nach § 394 FamFG zu löschen. Die Frist zur Erhebung eines Widerspruchs ist auf 1 Monat ab dieser Registerbekanntmachung festgesetzt."
    },
    {
      "date": "2025-01-31",
      "id": "100210",
      "original_text": "Registerbekanntmachung nach dem Umwandlungsgesetz\nRheinland-Pfalz Amtsgericht Wittlich HRB 44500\nNOVA Beteiligungs-AG – Kröv",
      "type": "Registerbekanntmachung nach dem Umwandlungsgesetz",
      "state": "Rheinland-Pfalz",
      "amtsgericht": "Amtsgericht Wittlich",
      "registernummer": "HRB 44500",
      "registerart": "HRB",
      "company_name": "NOVA Beteiligungs-AG",
      "company_seat": "Kröv",
      "details": "31.01.2025 (Bekanntmachungsdatum)\n\nRheinland-Pfalz Amtsgericht Wittlich HRB 44500\nRegisterbekanntmachung nach dem Umwandlungsgesetz 31.01.2025 (Eintragungsdatum)\n\nNOVA Beteiligungs-AG\nAktiengesellschaft\nKröv\n\nAls nicht eingetragen wird veröffentlicht:\nDen Gläubigern des formwechselnden Rechtsträgers ist, wenn sie binnen sechs Monaten nach dem Tag, an dem die Eintragung des Formwechsels nach § 201 UmwG als bekannt gemacht gilt, ihren Anspruch nach Grund und Höhe schriftlich anmelden, Sicherheit zu leisten, soweit sie nicht Befriedigung verlangen können. Dieses Recht steht den Gläubigern jedoch nur zu, wenn sie glaubhaft machen, dass durch den Formwechsel die Erfüllung der Forderung gefährdet wird."
    },
    {
      "date": "2025-01-31",
      "id": "100211",
      "original_text": "Löschungsankündigung\nRheinland-Pfalz Amtsgericht Ludwigshafen a.Rhein (Ludwigshafen) HRB 67893\nI.D Abbruch GmbH – Ludwigshafen am Rhein",
      "type": "Löschungsankündigung",
      "state": "Rheinland-Pfalz",
      "amtsgericht": "Amtsgericht Ludwigshafen a.Rhein (Ludwigshafen)",
      "registernummer": "HRB 67893",
      "registerart": "HRB",
      "company_name": "I.D Abbruch GmbH",
      "company_seat": "Ludwigshafen am Rhein",
      "details": "31.01.2025 (Bekanntmachungsdatum)\n\nRheinland-Pfalz Amtsgericht Ludwigshafen a.Rhein (Ludwigshafen) HRB 67893\nLöschungsankündigung\n\nI.D Abbruch GmbH\nGesellschaft mit beschränkter Haftung\nLudwigshafen am Rhein\n\nDas Registergericht beabsichtigt die Gesellschaft von Amts wegen nach § 394 FamFG zu löschen. Die Frist zur Erhebung eines Widerspruchs ist auf einen Monat festgesetzt."
    },
    {
      "date": "2025-01-31",
      "id": "100212",
      "original_text": "Registerbekanntmachung nach dem Umwandlungsgesetz\nNordrhein-Westfalen Amtsgericht Bielefeld HRB 33415\nTRIGENT Bekleidung Beteiligungs GmbH – Bielefeld",
      "type": "Registerbekanntmachung nach dem Umwandlungsgesetz",
      "state": "Nordrhein-Westfalen",
      "amtsgericht": "Amtsgericht Bielefeld",
      "registernummer": "HRB 33415",
      "registerart": "HRB",
      "company_name": "TRIGENT Bekleidung Beteiligungs GmbH",
      "company_seat": "Bielefeld",
      "details": "31.01.2025 (Bekanntmachungsdatum)\n\nNordrhein-Westfalen Amtsgericht Bielefeld HRB 33415\nRegisterbekanntmachung nach dem Umwandlungsgesetz 31.01.2025 (Eintragungsdatum)\n\nTRIGENT Bekleidung Beteiligungs GmbH\nGesellschaft mit beschränkter Haftung\nBielefeld\n\nDen Gläubigern der an der Verschmelzung beteiligten Rechtsträger ist, wenn sie binnen sechs Monaten nach dem Tag, an dem die Eintragung der Verschmelzung in das Register des Sitzes desjenigen Rechtsträgers, dessen Gläubiger sie sind, nach § 19 Absatz 3 UmwG als bekanntgemacht gilt, ihren Anspruch nach Grund und Höhe schriftlich anmelden, Sicherheit zu leisten, soweit sie nicht Befriedigung verlangen können. Dieses Recht steht den Gläubigern jedoch nur zu, wenn sie glaubhaft machen, dass durch die Verschmelzung die Erfüllung ihrer Forderung gefährdet wird."
    },
    {
      "date": "2025-01-31",
      "id": "100213",
      "original_text": "Registerbekanntmachung nach dem Umwandlungsgesetz\nNordrhein-Westfalen Amtsgericht Neuss HRB 17776\nKB Toolzz Group GmbH – Meerbusch",
      "type": "Registerbekanntmachung nach dem Umwandlungsgesetz",
      "state": "Nordrhein-Westfalen",
      "amtsgericht": "Amtsgericht Neuss",
      "registernummer": "HRB 17776",
      "registerart": "HRB",
      "company_name": "KB Toolzz Group GmbH",
      "company_seat": "Meerbusch",
      "details": "31.01.2025 (Bekanntmachungsdatum)\n\nNordrhein-Westfalen Amtsgericht Neuss HRB 17776\nRegisterbekanntmachung nach dem Umwandlungsgesetz 31.01.2025 (Eintragungsdatum)\n\nKB Toolzz Group GmbH\nGesellschaft mit beschränkter Haftung\nMeerbusch\n\nDen Gläubigern der an der Verschmelzung beteiligten Rechtsträger ist, wenn sie binnen sechs Monaten nach dem Tag, an dem die Eintragung der Verschmelzung in das Register des Sitzes derjenigen Rechtsträger deren Gläubiger sie sind, nach § 19 Absatz 3 UmwG als bekanntgemacht gilt, ihren Anspruch nach Grund und Höhe schriftlich anmelden, Sicherheit zu leisten, soweit sie nicht Befriedigung verlangen können. Dieses Recht steht den Gläubigern jedoch nur zu, wenn sie glaubhaft machen, dass durch die Verschmelzung die Erfüllung ihrer Forderung gefährdet wird."
    },
    {
      "date": "2025-01-31",
      "id": "100214",
      "original_text": "Registerbekanntmachung nach dem Umwandlungsgesetz\nNordrhein-Westfalen Amtsgericht Neuss HRB 17776\nKB Toolzz Group GmbH – Meerbusch",
      "type": "Registerbekanntmachung nach dem Umwandlungsgesetz",
      "state": "Nordrhein-Westfalen",
      "amtsgericht": "Amtsgericht Neuss",
      "registernummer": "HRB 17776",
      "registerart": "HRB",
      "company_name": "KB Toolzz Group GmbH",
      "company_seat": "Meerbusch",
      "details": "31.01.2025 (Bekanntmachungsdatum)\n\nNordrhein-Westfalen Amtsgericht Neuss HRB 17776\nRegisterbekanntmachung nach dem Umwandlungsgesetz 31.01.2025 (Eintragungsdatum)\n\nKB Toolzz Group GmbH\nGesellschaft mit beschränkter Haftung\nMeerbusch\n\nDen Gläubigern der an der Verschmelzung beteiligten Rechtsträger ist, wenn sie binnen sechs Monaten nach dem Tag, an dem die Eintragung der Verschmelzung in das Register des Sitzes derjenigen Rechtsträger deren Gläubiger sie sind, nach § 19 Absatz 3 UmwG als bekanntgemacht gilt, ihren Anspruch nach Grund und Höhe schriftlich anmelden, Sicherheit zu leisten, soweit sie nicht Befriedigung verlangen können. Dieses Recht steht den Gläubigern jedoch nur zu, wenn sie glaubhaft machen, dass durch die Verschmelzung die Erfüllung ihrer Forderung gefährdet wird."
    },
    {
      "date": "2025-01-31",
      "id": "100215",
      "original_text": "Registerbekanntmachung nach dem Umwandlungsgesetz\nNordrhein-Westfalen Amtsgericht Neuss HRB 17776\nKB Toolzz Group GmbH – Meerbusch",
      "type": "Registerbekanntmachung nach dem Umwandlungsgesetz",
      "state": "Nordrhein-Westfalen",
      "amtsgericht": "Amtsgericht Neuss",
      "registernummer": "HRB 17776",
      "registerart": "HRB",
      "company_name": "KB Toolzz Group GmbH",
      "company_seat": "Meerbusch",
      "details": "31.01.2025 (Bekanntmachungsdatum)\n\nNordrhein-Westfalen Amtsgericht Neuss HRB 17776\nRegisterbekanntmachung nach dem Umwandlungsgesetz 31.01.2025 (Eintragungsdatum)\n\nKB Toolzz Group GmbH\nGesellschaft mit beschränkter Haftung\nMeerbusch\n\nDen Gläubigern der an der Verschmelzung beteiligten Rechtsträger ist, wenn sie binnen sechs Monaten nach dem Tag, an dem die Eintragung der Verschmelzung in das Register des Sitzes derjenigen Rechtsträger deren Gläubiger sie sind, nach § 19 Absatz 3 UmwG als bekanntgemacht gilt, ihren Anspruch nach Grund und Höhe schriftlich anmelden, Sicherheit zu leisten, soweit sie nicht Befriedigung verlangen können. Dieses Recht steht den Gläubigern jedoch nur zu, wenn sie glaubhaft machen, dass durch die Verschmelzung die Erfüllung ihrer Forderung gefährdet wird."
    },
    {
      "date": "2025-01-31",
      "id": "100216",
      "original_text": "Registerbekanntmachung nach dem Umwandlungsgesetz\nNordrhein-Westfalen Amtsgericht Siegen HRB 12077\nEMZ Holding GmbH – Wenden",
      "type": "Registerbekanntmachung nach dem Umwandlungsgesetz",
      "state": "Nordrhein-Westfalen",
      "amtsgericht": "Amtsgericht Siegen",
      "registernummer": "HRB 12077",
      "registerart": "HRB",
      "company_name": "EMZ Holding GmbH",
      "company_seat": "Wenden",
      "details": "31.01.2025 (Bekanntmachungsdatum)\n\nNordrhein-Westfalen Amtsgericht Siegen HRB 12077\nRegisterbekanntmachung nach dem Umwandlungsgesetz 31.01.2025 (Eintragungsdatum)\n\nEMZ Holding GmbH\nGesellschaft mit beschränkter Haftung\nWenden\n\nDen Gläubigern der an der Verschmelzung beteiligten Rechtsträger ist, wenn sie binnen sechs Monaten nach dem Tag, an dem die Eintragung der Verschmelzung in das Register des Sitzes desjenigen Rechtsträgers, dessen Gläubiger sie sind, nach § 19 Absatz 3 UmwG als bekanntgemacht gilt, ihren Anspruch nach Grund und Höhe schriftlich anmelden, Sicherheit zu leisten, soweit sie nicht Befriedigung verlangen können. Dieses Recht steht den Gläubigern jedoch nur zu, wenn sie glaubhaft machen, dass durch die Verschmelzung die Erfüllung ihrer Forderung gefährdet wird."
    },
    {
      "date": "2025-01-31",
      "id": "100217",
      "original_text": "Einreichung neuer Dokumente\nBremen Amtsgericht Bremen HRB 17359\nGEWOBA Aktiengesellschaft Wohnen und Bauen – Bremen",
      "type": "Einreichung neuer Dokumente",
      "state": "Bremen",
      "amtsgericht": "Amtsgericht Bremen",
      "registernummer": "HRB 17359",
      "registerart": "HRB",
      "company_name": "GEWOBA Aktiengesellschaft Wohnen und Bauen",
      "company_seat": "Bremen",
      "details": "31.01.2025 (Bekanntmachungsdatum)\n\nBremen Amtsgericht Bremen HRB 17359\nEinreichung neuer Dokumente\n\nGEWOBA Aktiengesellschaft Wohnen und Bauen\nAktiengesellschaft\nBremen\n\nAls nicht eingetragen wird bekannt gemacht: Liste des Aufsichtsrats wurde eingereicht."
    },
    {
      "date": "2025-01-31",
      "id": "100218",
      "original_text": "Löschungsankündigung\nNordrhein-Westfalen Amtsgericht Düsseldorf HRB 92647\nCredere International GmbH – Düsseldorf",
      "type": "Löschungsankündigung",
      "state": "Nordrhein-Westfalen",
      "amtsgericht": "Amtsgericht Düsseldorf",
      "registernummer": "HRB 92647",
      "registerart": "HRB",
      "company_name": "Credere International GmbH",
      "company_seat": "Düsseldorf",
      "details": "31.01.2025 (Bekanntmachungsdatum)\n\nNordrhein-Westfalen Amtsgericht Düsseldorf HRB 92647\nLöschungsankündigung\n\nCredere International GmbH\nGesellschaft mit beschränkter Haftung\nDüsseldorf\n\nDas Registergericht beabsichtigt die Gesellschaft von Amts wegen nach § 394 FamFG zu löschen. Die Frist zur Erhebung eines Widerspruchs ist auf 3 Wochen festgesetzt.\n\nRechtsbehelfsbelehrung:\nDas Widerspruchsrecht steht jedem zu, der an der Unterlassung der Löschung ein berechtigtes Interesse hat. Der Widerspruch ist bei dem Amtsgericht Düsseldorf -Registergericht-, Werdener Straße 1, 40227 Düsseldorf schriftlich in deutscher Sprache oder zur Niederschrift der Geschäftsstelle einzulegen. Der Widerspruch kann auch zur Niederschrift der Geschäftsstelle eines jeden Amtsgerichtes abgegeben werden. Die Einlegung ist auch durch Übertragung eines elektronischen Dokuments an die elektronische Poststelle des Gerichts möglich. Das elektronische Dokument muss für die Bearbeitung durch das Gericht geeignet und mit einer qualifizierten elektronischen Signatur der verantwortenden Person versehen sein oder von der verantwortenden Person signiert und auf einem sicheren Übermittlungsweg gemäß § 130a ZPO nach näherer Maßgabe der Verordnung über die technischen Rahmenbedingungen des elektronischen Rechtsverkehrs und über das besondere elektronische Behördenpostfach (BGBl. I, S.3803) eingereicht werden. Weitere Informationen erhalten Sie auf der Internetseite www.justiz.de.\nDer Widerspruch muss spätestens innerhalb der gesetzten Frist nach dem Datum der Bekanntmachung der Löschungsankündigung bei dem Amtsgericht - Registergericht - Düsseldorf eingegangen sein.  Dies gilt auch dann, wenn der Widerspruch zur Niederschrift der Geschäftsstelle eines anderen Amtsgerichtes abgegeben wurde. Die Frist beginnt mit dem Tage der Bekanntmachung der Löschungsankündigung in dem für die Bekanntmachung der Eintragungen in das Handelsregister bestimmten elektronischen Informations- und Kommunikationssystem nach § 10 des Handelsgesetzbuches. Fällt das Ende der Frist auf einen Sonntag, einen allgemeinen Feiertag oder Sonnabend, so endet die Frist mit Ablauf des nächsten Werktages.\nDer Widerspruch muss die Bezeichnung der angefochtenen Löschungsankündigung sowie die Erklärung enthalten, dass Widerspruch gegen diese Löschungsankündigung eingelegt wird. Er ist zu unterzeichnen und soll begründet werden."
    },
    {
      "date": "2025-01-31",
      "id": "100219",
      "original_text": "Sonstige Registerbekanntmachung\nNordrhein-Westfalen Amtsgericht Bonn HRB 24985\nDHL 2-Mann-Handling GmbH – Bonn",
      "type": "Sonstige Registerbekanntmachung",
      "state": "Nordrhein-Westfalen",
      "amtsgericht": "Amtsgericht Bonn",
      "registernummer": "HRB 24985",
      "registerart": "HRB",
      "company_name": "DHL 2-Mann-Handling GmbH",
      "company_seat": "Bonn",
      "details": "31.01.2025 (Bekanntmachungsdatum)\n\nNordrhein-Westfalen Amtsgericht Bonn HRB 24985\nSonstige Registerbekanntmachung 31.01.2025 (Eintragungsdatum)\n\nDHL 2-Mann-Handling GmbH\nGesellschaft mit beschränkter Haftung\nBonn\n\nAls nicht eingetragen wird veröffentlicht: Den Gläubigern der Gesellschaft, deren Forderungen begründet worden sind bevor die Eintragung der Beendigung des Beherrschungs- und Gewinnabführungsvertrages  in das Handelsregister nach § 10 des Handelsgesetzbuches als bekanntgemacht gilt, hat der andere Vertragsteil Sicherheit zu leisten, wenn sie sich binnen sechs Monaten nach der Bekanntmachung der Eintragung zu diesem Zweck bei ihm melden."
    },
    {
      "date": "2025-01-31",
      "id": "100220",
      "original_text": "Löschungsankündigung\nNordrhein-Westfalen Amtsgericht Kleve HRB 16783\nVan der dool management GmbH – Kleve",
      "type": "Löschungsankündigung",
      "state": "Nordrhein-Westfalen",
      "amtsgericht": "Amtsgericht Kleve",
      "registernummer": "HRB 16783",
      "registerart": "HRB",
      "company_name": "Van der dool management GmbH",
      "company_seat": "Kleve",
      "details": "31.01.2025 (Bekanntmachungsdatum)\n\nNordrhein-Westfalen Amtsgericht Kleve HRB 16783\nLöschungsankündigung\n\nVan der dool management GmbH\nGesellschaft mit beschränkter Haftung\nKleve\n\nDas Registergericht beabsichtigt die Gesellschaft von Amts wegen nach § 394 FamFG zu löschen. Die Frist zur Erhebung eines Widerspruchs ist auf einen Monat festgesetzt."
    },
    {
      "date": "2025-01-31",
      "id": "100221",
      "original_text": "Registerbekanntmachung nach dem Umwandlungsgesetz\nNordrhein-Westfalen Amtsgericht Düsseldorf HRB 47050\nHelikum GmbH – Hilden",
      "type": "Registerbekanntmachung nach dem Umwandlungsgesetz",
      "state": "Nordrhein-Westfalen",
      "amtsgericht": "Amtsgericht Düsseldorf",
      "registernummer": "HRB 47050",
      "registerart": "HRB",
      "company_name": "Helikum GmbH",
      "company_seat": "Hilden",
      "details": "31.01.2025 (Bekanntmachungsdatum)\n\nNordrhein-Westfalen Amtsgericht Düsseldorf HRB 47050\nRegisterbekanntmachung nach dem Umwandlungsgesetz 31.01.2025 (Eintragungsdatum)\n\nHelikum GmbH\nGesellschaft mit beschränkter Haftung\nHilden\n\nDen Gläubigern der an der Verschmelzung beteiligten Rechtsträger ist, wenn sie binnen sechs Monaten nach dem Tag, an dem die Eintragung der Verschmelzung in das Register des Sitzes desjenigen Rechtsträgers, dessen Gläubiger sie sind, nach § 19 Absatz 3 UmwG als bekanntgemacht gilt, ihren Anspruch nach Grund und Höhe schriftlich anmelden, Sicherheit zu leisten, soweit sie nicht Befriedigung verlangen können. Dieses Recht steht den Gläubigern jedoch nur zu, wenn sie glaubhaft machen, dass durch die Verschmelzung die Erfüllung ihrer Forderung gefährdet wird."
    },
    {
      "date": "2025-01-31",
      "id": "100222",
      "original_text": "Einreichung neuer Dokumente\nNordrhein-Westfalen Amtsgericht Münster HRB 5908\nnicos Aktiengesellschaft – Münster",
      "type": "Einreichung neuer Dokumente",
      "state": "Nordrhein-Westfalen",
      "amtsgericht": "Amtsgericht Münster",
      "registernummer": "HRB 5908",
      "registerart": "HRB",
      "company_name": "nicos Aktiengesellschaft",
      "company_seat": "Münster",
      "details": "31.01.2025 (Bekanntmachungsdatum)\n\nNordrhein-Westfalen Amtsgericht Münster HRB 5908\nEinreichung neuer Dokumente 20.01.2025 (Eintragungsdatum)\n\nnicos Aktiengesellschaft\nAktiengesellschaft\nMünster\n\nDem Registergericht ist eine neue Liste der Mitglieder des Aufsichtsrates eingereicht worden."
    },
    {
      "date": "2025-01-31",
      "id": "100223",
      "original_text": "Registerbekanntmachung nach dem Umwandlungsgesetz\nNordrhein-Westfalen Amtsgericht Siegen HRB 12097\nEMZ Beteiligungen GmbH – Wenden",
      "type": "Registerbekanntmachung nach dem Umwandlungsgesetz",
      "state": "Nordrhein-Westfalen",
      "amtsgericht": "Amtsgericht Siegen",
      "registernummer": "HRB 12097",
      "registerart": "HRB",
      "company_name": "EMZ Beteiligungen GmbH",
      "company_seat": "Wenden",
      "details": "31.01.2025 (Bekanntmachungsdatum)\n\nNordrhein-Westfalen Amtsgericht Siegen HRB 12097\nRegisterbekanntmachung nach dem Umwandlungsgesetz 31.01.2025 (Eintragungsdatum)\n\nEMZ Beteiligungen GmbH\nGesellschaft mit beschränkter Haftung\nWenden\n\nDen Gläubigern der an der Verschmelzung beteiligten Rechtsträger ist, wenn sie binnen sechs Monaten nach dem Tag, an dem die Eintragung der Verschmelzung in das Register des Sitzes desjenigen Rechtsträgers, dessen Gläubiger sie sind, nach § 19 Absatz 3 UmwG als bekanntgemacht gilt, ihren Anspruch nach Grund und Höhe schriftlich anmelden, Sicherheit zu leisten, soweit sie nicht Befriedigung verlangen können. Dieses Recht steht den Gläubigern jedoch nur zu, wenn sie glaubhaft machen, dass durch die Verschmelzung die Erfüllung ihrer Forderung gefährdet wird."
    },
    {
      "date": "2025-01-31",
      "id": "100224",
      "original_text": "Registerbekanntmachung nach dem Umwandlungsgesetz\nNordrhein-Westfalen Amtsgericht Bielefeld HRB 37905\nDeutsche Herrenwäsche-Fabriken Dornbusch & Co. GmbH – Bielefeld",
      "type": "Registerbekanntmachung nach dem Umwandlungsgesetz",
      "state": "Nordrhein-Westfalen",
      "amtsgericht": "Amtsgericht Bielefeld",
      "registernummer": "HRB 37905",
      "registerart": "HRB",
      "company_name": "Deutsche Herrenwäsche-Fabriken Dornbusch & Co. GmbH",
      "company_seat": "Bielefeld",
      "details": "31.01.2025 (Bekanntmachungsdatum)\n\nNordrhein-Westfalen Amtsgericht Bielefeld HRB 37905\nRegisterbekanntmachung nach dem Umwandlungsgesetz 31.01.2025 (Eintragungsdatum)\n\nDeutsche Herrenwäsche-Fabriken Dornbusch & Co. GmbH\nGesellschaft mit beschränkter Haftung\nBielefeld\n\nDen Gläubigern der an der Verschmelzung beteiligten Rechtsträger ist, wenn sie binnen sechs Monaten nach dem Tag, an dem die Eintragung der Verschmelzung in das Register des Sitzes desjenigen Rechtsträgers, dessen Gläubiger sie sind, nach § 19 Absatz 3 UmwG als bekanntgemacht gilt, ihren Anspruch nach Grund und Höhe schriftlich anmelden, Sicherheit zu leisten, soweit sie nicht Befriedigung verlangen können. Dieses Recht steht den Gläubigern jedoch nur zu, wenn sie glaubhaft machen, dass durch die Verschmelzung die Erfüllung ihrer Forderung gefährdet wird."
    },
    {
      "date": "2025-01-31",
      "id": "100225",
      "original_text": "Registerbekanntmachung nach dem Umwandlungsgesetz\nNordrhein-Westfalen Amtsgericht Bielefeld HRB 7757\nSeidensticker Europe Agency GmbH – Bielefeld",
      "type": "Registerbekanntmachung nach dem Umwandlungsgesetz",
      "state": "Nordrhein-Westfalen",
      "amtsgericht": "Amtsgericht Bielefeld",
      "registernummer": "HRB 7757",
      "registerart": "HRB",
      "company_name": "Seidensticker Europe Agency GmbH",
      "company_seat": "Bielefeld",
      "details": "31.01.2025 (Bekanntmachungsdatum)\n\nNordrhein-Westfalen Amtsgericht Bielefeld HRB 7757\nRegisterbekanntmachung nach dem Umwandlungsgesetz 31.01.2025 (Eintragungsdatum)\n\nSeidensticker Europe Agency GmbH\nGesellschaft mit beschränkter Haftung\nBielefeld\n\nDen Gläubigern der an der Verschmelzung beteiligten Rechtsträger ist, wenn sie binnen sechs Monaten nach dem Tag, an dem die Eintragung der Verschmelzung in das Register des Sitzes desjenigen Rechtsträgers, dessen Gläubiger sie sind, nach § 19 Absatz 3 UmwG als bekanntgemacht gilt, ihren Anspruch nach Grund und Höhe schriftlich anmelden, Sicherheit zu leisten, soweit sie nicht Befriedigung verlangen können. Dieses Recht steht den Gläubigern jedoch nur zu, wenn sie glaubhaft machen, dass durch die Verschmelzung die Erfüllung ihrer Forderung gefährdet wird."
    },
    {
      "date": "2025-01-31",
      "id": "100226",
      "original_text": "Registerbekanntmachung nach dem Umwandlungsgesetz\nNordrhein-Westfalen Amtsgericht Bielefeld HRB 33415\nTRIGENT Bekleidung Beteiligungs GmbH – Bielefeld",
      "type": "Registerbekanntmachung nach dem Umwandlungsgesetz",
      "state": "Nordrhein-Westfalen",
      "amtsgericht": "Amtsgericht Bielefeld",
      "registernummer": "HRB 33415",
      "registerart": "HRB",
      "company_name": "TRIGENT Bekleidung Beteiligungs GmbH",
      "company_seat": "Bielefeld",
      "details": "31.01.2025 (Bekanntmachungsdatum)\n\nNordrhein-Westfalen Amtsgericht Bielefeld HRB 33415\nRegisterbekanntmachung nach dem Umwandlungsgesetz 31.01.2025 (Eintragungsdatum)\n\nTRIGENT Bekleidung Beteiligungs GmbH\nGesellschaft mit beschränkter Haftung\nBielefeld\n\nDen Gläubigern der an der Verschmelzung beteiligten Rechtsträger ist, wenn sie binnen sechs Monaten nach dem Tag, an dem die Eintragung der Verschmelzung in das Register des Sitzes desjenigen Rechtsträgers, dessen Gläubiger sie sind, nach § 19 Absatz 3 UmwG als bekanntgemacht gilt, ihren Anspruch nach Grund und Höhe schriftlich anmelden, Sicherheit zu leisten, soweit sie nicht Befriedigung verlangen können. Dieses Recht steht den Gläubigern jedoch nur zu, wenn sie glaubhaft machen, dass durch die Verschmelzung die Erfüllung ihrer Forderung gefährdet wird."
    },
    {
      "date": "2025-01-31",
      "id": "100227",
      "original_text": "Registerbekanntmachung nach dem Umwandlungsgesetz\nNordrhein-Westfalen Amtsgericht Krefeld HRB 7116\nCERTUSS Dampfautomaten Verwaltungsgesellschaft mbH – Krefeld",
      "type": "Registerbekanntmachung nach dem Umwandlungsgesetz",
      "state": "Nordrhein-Westfalen",
      "amtsgericht": "Amtsgericht Krefeld",
      "registernummer": "HRB 7116",
      "registerart": "HRB",
      "company_name": "CERTUSS Dampfautomaten Verwaltungsgesellschaft mbH",
      "company_seat": "Krefeld",
      "details": "31.01.2025 (Bekanntmachungsdatum)\n\nNordrhein-Westfalen Amtsgericht Krefeld HRB 7116\nRegisterbekanntmachung nach dem Umwandlungsgesetz 31.01.2025 (Eintragungsdatum)\n\nCERTUSS Dampfautomaten Verwaltungsgesellschaft mbH\nGesellschaft mit beschränkter Haftung\nKrefeld\n\nDen Gläubigern der an der Verschmelzung beteiligten Rechtsträger ist, wenn sie binnen sechs Monaten nach dem Tag, an dem die Eintragung der Verschmelzung in das Register des Sitzes desjenigen Rechtsträgers, dessen Gläubiger sie sind, nach § 19 Absatz 3 UmwG als bekanntgemacht gilt, ihren Anspruch nach Grund und Höhe schriftlich anmelden, Sicherheit zu leisten, soweit sie nicht Befriedigung verlangen können. Dieses Recht steht den Gläubigern jedoch nur zu, wenn sie glaubhaft machen, dass durch die Verschmelzung die Erfüllung ihrer Forderung gefährdet wird."
    },
    {
      "date": "2025-01-31",
      "id": "100228",
      "original_text": "Registerbekanntmachung nach dem Umwandlungsgesetz\nNordrhein-Westfalen Amtsgericht Recklinghausen HRB 5082\nEuro-HochWeit AG – Waltrop",
      "type": "Registerbekanntmachung nach dem Umwandlungsgesetz",
      "state": "Nordrhein-Westfalen",
      "amtsgericht": "Amtsgericht Recklinghausen",
      "registernummer": "HRB 5082",
      "registerart": "HRB",
      "company_name": "Euro-HochWeit AG",
      "company_seat": "Waltrop",
      "details": "31.01.2025 (Bekanntmachungsdatum)\n\nNordrhein-Westfalen Amtsgericht Recklinghausen HRB 5082\nRegisterbekanntmachung nach dem Umwandlungsgesetz 31.01.2025 (Eintragungsdatum)\n\nEuro-HochWeit AG\nAktiengesellschaft\nWaltrop\n\nDen Gläubigern der an der Verschmelzung beteiligten Rechtsträger ist, wenn sie binnen sechs Monaten nach dem Tag, an dem die Eintragung der Verschmelzung in das Register des Sitzes desjenigen Rechtsträgers, dessen Gläubiger sie sind, nach § 19 Absatz 3 UmwG als bekanntgemacht gilt, ihren Anspruch nach Grund und Höhe schriftlich anmelden, Sicherheit zu leisten, soweit sie nicht Befriedigung verlangen können. Dieses Recht steht den Gläubigern jedoch nur zu, wenn sie glaubhaft machen, dass durch die Verschmelzung die Erfüllung ihrer Forderung gefährdet wird."
    },
    {
      "date": "2025-01-31",
      "id": "100229",
      "original_text": "Löschungsankündigung\nNordrhein-Westfalen Amtsgericht Dortmund HRB 34298\nSUWALA GmbH – Dortmund",
      "type": "Löschungsankündigung",
      "state": "Nordrhein-Westfalen",
      "amtsgericht": "Amtsgericht Dortmund",
      "registernummer": "HRB 34298",
      "registerart": "HRB",
      "company_name": "SUWALA GmbH",
      "company_seat": "Dortmund",
      "details": "31.01.2025 (Bekanntmachungsdatum)\n\nNordrhein-Westfalen Amtsgericht Dortmund HRB 34298\nLöschungsankündigung 31.01.2025 (Eintragungsdatum)\n\nSUWALA GmbH\nGesellschaft mit beschränkter Haftung\nDortmund\n\nDas Registergericht beabsichtigt die Gesellschaft von Amts wegen nach § 394 FamFG zu löschen. Die Frist zur Erhebung eines Widerspruchs ist auf drei Monate festgesetzt."
    },
    {
      "date": "2025-01-31",
      "id": "100230",
      "original_text": "Registerbekanntmachung nach dem Umwandlungsgesetz\nNordrhein-Westfalen Amtsgericht Krefeld HRB 20499\nCERTUSS GmbH – Krefeld",
      "type": "Registerbekanntmachung nach dem Umwandlungsgesetz",
      "state": "Nordrhein-Westfalen",
      "amtsgericht": "Amtsgericht Krefeld",
      "registernummer": "HRB 20499",
      "registerart": "HRB",
      "company_name": "CERTUSS GmbH",
      "company_seat": "Krefeld",
      "details": "31.01.2025 (Bekanntmachungsdatum)\n\nNordrhein-Westfalen Amtsgericht Krefeld HRB 20499\nRegisterbekanntmachung nach dem Umwandlungsgesetz 31.01.2025 (Eintragungsdatum)\n\nCERTUSS GmbH\nGesellschaft mit beschränkter Haftung\nKrefeld\n\nDen Gläubigern der an der Verschmelzung beteiligten Rechtsträger ist, wenn sie binnen sechs Monaten nach dem Tag, an dem die Eintragung der Verschmelzung in das Register des Sitzes desjenigen Rechtsträgers, dessen Gläubiger sie sind, nach § 19 Absatz 3 UmwG als bekanntgemacht gilt, ihren Anspruch nach Grund und Höhe schriftlich anmelden, Sicherheit zu leisten, soweit sie nicht Befriedigung verlangen können. Dieses Recht steht den Gläubigern jedoch nur zu, wenn sie glaubhaft machen, dass durch die Verschmelzung die Erfüllung ihrer Forderung gefährdet wird."
    },
    {
      "date": "2025-01-31",
      "id": "100231",
      "original_text": "Registerbekanntmachung nach dem Umwandlungsgesetz\nNordrhein-Westfalen Amtsgericht Neuss HRB 17776\nKB Toolzz Group GmbH – Meerbusch",
      "type": "Registerbekanntmachung nach dem Umwandlungsgesetz",
      "state": "Nordrhein-Westfalen",
      "amtsgericht": "Amtsgericht Neuss",
      "registernummer": "HRB 17776",
      "registerart": "HRB",
      "company_name": "KB Toolzz Group GmbH",
      "company_seat": "Meerbusch",
      "details": "31.01.2025 (Bekanntmachungsdatum)\n\nNordrhein-Westfalen Amtsgericht Neuss HRB 17776\nRegisterbekanntmachung nach dem Umwandlungsgesetz 31.01.2025 (Eintragungsdatum)\n\nKB Toolzz Group GmbH\nGesellschaft mit beschränkter Haftung\nMeerbusch\n\nDen Gläubigern der an der Verschmelzung beteiligten Rechtsträger ist, wenn sie binnen sechs Monaten nach dem Tag, an dem die Eintragung der Verschmelzung in das Register des Sitzes derjenigen Rechtsträger deren Gläubiger sie sind, nach § 19 Absatz 3 UmwG als bekanntgemacht gilt, ihren Anspruch nach Grund und Höhe schriftlich anmelden, Sicherheit zu leisten, soweit sie nicht Befriedigung verlangen können. Dieses Recht steht den Gläubigern jedoch nur zu, wenn sie glaubhaft machen, dass durch die Verschmelzung die Erfüllung ihrer Forderung gefährdet wird."
    },
    {
      "date": "2025-01-31",
      "id": "100232",
      "original_text": "Registerbekanntmachung nach dem Umwandlungsgesetz\nNordrhein-Westfalen Amtsgericht Neuss HRB 17776\nKB Toolzz Group GmbH – Meerbusch",
      "type": "Registerbekanntmachung nach dem Umwandlungsgesetz",
      "state": "Nordrhein-Westfalen",
      "amtsgericht": "Amtsgericht Neuss",
      "registernummer": "HRB 17776",
      "registerart": "HRB",
      "company_name": "KB Toolzz Group GmbH",
      "company_seat": "Meerbusch",
      "details": "31.01.2025 (Bekanntmachungsdatum)\n\nNordrhein-Westfalen Amtsgericht Neuss HRB 17776\nRegisterbekanntmachung nach dem Umwandlungsgesetz 31.01.2025 (Eintragungsdatum)\n\nKB Toolzz Group GmbH\nGesellschaft mit beschränkter Haftung\nMeerbusch\n\nDen Gläubigern der an der Verschmelzung beteiligten Rechtsträger ist, wenn sie binnen sechs Monaten nach dem Tag, an dem die Eintragung der Verschmelzung in das Register des Sitzes derjenigen Rechtsträger deren Gläubiger sie sind, nach § 19 Absatz 3 UmwG als bekanntgemacht gilt, ihren Anspruch nach Grund und Höhe schriftlich anmelden, Sicherheit zu leisten, soweit sie nicht Befriedigung verlangen können. Dieses Recht steht den Gläubigern jedoch nur zu, wenn sie glaubhaft machen, dass durch die Verschmelzung die Erfüllung ihrer Forderung gefährdet wird."
    },
    {
      "date": "2025-01-31",
      "id": "100233",
      "original_text": "Löschungsankündigung\nNordrhein-Westfalen Amtsgericht Essen HRB 32464\nIKB-Management UG (haftungsbeschränkt) – Essen",
      "type": "Löschungsankündigung",
      "state": "Nordrhein-Westfalen",
      "amtsgericht": "Amtsgericht Essen",
      "registernummer": "HRB 32464",
      "registerart": "HRB",
      "company_name": "IKB-Management UG (haftungsbeschränkt)",
      "company_seat": "Essen",
      "details": "31.01.2025 (Bekanntmachungsdatum)\n\nNordrhein-Westfalen Amtsgericht Essen HRB 32464\nLöschungsankündigung\n\nIKB-Management UG (haftungsbeschränkt)\nGesellschaft mit beschränkter Haftung\nEssen\n\nDas Registergericht beabsichtigt die Gesellschaft von Amts wegen nach § 394 FamFG zu löschen. Die Frist zur Erhebung eines Widerspruchs ist auf einen Monat festgesetzt."
    },
    {
      "date": "2025-01-31",
      "id": "100234",
      "original_text": "Registerbekanntmachung nach dem Umwandlungsgesetz\nNordrhein-Westfalen Amtsgericht Düsseldorf HRB 102591\nGottfried Schultz Beteiligung GmbH – Düsseldorf",
      "type": "Registerbekanntmachung nach dem Umwandlungsgesetz",
      "state": "Nordrhein-Westfalen",
      "amtsgericht": "Amtsgericht Düsseldorf",
      "registernummer": "HRB 102591",
      "registerart": "HRB",
      "company_name": "Gottfried Schultz Beteiligung GmbH",
      "company_seat": "Düsseldorf",
      "details": "31.01.2025 (Bekanntmachungsdatum)\n\nNordrhein-Westfalen Amtsgericht Düsseldorf HRB 102591\nRegisterbekanntmachung nach dem Umwandlungsgesetz 31.01.2025 (Eintragungsdatum)\n\nGottfried Schultz Beteiligung GmbH\nGesellschaft mit beschränkter Haftung\nDüsseldorf\n\nDen Gläubigern der an der Verschmelzung beteiligten Rechtsträger ist, wenn sie binnen sechs Monaten nach dem Tag, an dem die Eintragung der Verschmelzung in das Register des Sitzes desjenigen Rechtsträgers, dessen Gläubiger sie sind, nach § 19 Absatz 3 UmwG als bekanntgemacht gilt, ihren Anspruch nach Grund und Höhe schriftlich anmelden, Sicherheit zu leisten, soweit sie nicht Befriedigung verlangen können. Dieses Recht steht den Gläubigern jedoch nur zu, wenn sie glaubhaft machen, dass durch die Verschmelzung die Erfüllung ihrer Forderung gefährdet wird."
    },
    {
      "date": "2025-01-31",
      "id": "100235",
      "original_text": "Löschungsankündigung\nNordrhein-Westfalen Amtsgericht Lemgo HRB 11286\nWA Breilmann GmbH – Lage",
      "type": "Löschungsankündigung",
      "state": "Nordrhein-Westfalen",
      "amtsgericht": "Amtsgericht Lemgo",
      "registernummer": "HRB 11286",
      "registerart": "HRB",
      "company_name": "WA Breilmann GmbH",
      "company_seat": "Lage",
      "details": "31.01.2025 (Bekanntmachungsdatum)\n\nNordrhein-Westfalen Amtsgericht Lemgo HRB 11286\nLöschungsankündigung\n\nWA Breilmann GmbH\nGesellschaft mit beschränkter Haftung\nLage\n\nEs ist beabsichtigt, die Gesellschaft von Amts wegen im Hinblick auf die abgegebene Vermögensauskunft wegen Vermögenslosigkeit gemäß § 394 Abs. 1 FamFG zu löschen. Hiergegen kann binnen 3 Monaten nach Veröffentlichung dieser Bekanntmachung Widerspruch beim Amtsgericht Lemgo eingelegt werden."
    },
    {
      "date": "2025-01-31",
      "id": "100236",
      "original_text": "Sonstige Registerbekanntmachung\nHessen Amtsgericht Fritzlar VR 3440\nFSC Guxhagen 2000 – Guxhagen",
      "type": "Sonstige Registerbekanntmachung",
      "state": "Hessen",
      "amtsgericht": "Amtsgericht Fritzlar",
      "registernummer": "VR 3440",
      "registerart": "VR",
      "company_name": "FSC Guxhagen 2000",
      "company_seat": "Guxhagen",
      "details": "31.01.2025 (Bekanntmachungsdatum)\n\nHessen Amtsgericht Fritzlar VR 3440\nSonstige Registerbekanntmachung 31.01.2025 (Eintragungsdatum)\n\nFSC Guxhagen 2000\neingetragener Verein\nGuxhagen\n\nDer Verein ist aufgelöst."
    },
    {
      "date": "2025-01-31",
      "id": "100237",
      "original_text": "Löschungsankündigung\nHessen Amtsgericht Frankfurt am Main HRB 131073\nSHABAH UG (haftungsbeschränkt) – Frankfurt am Main",
      "type": "Löschungsankündigung",
      "state": "Hessen",
      "amtsgericht": "Amtsgericht Frankfurt am Main",
      "registernummer": "HRB 131073",
      "registerart": "HRB",
      "company_name": "SHABAH UG (haftungsbeschränkt)",
      "company_seat": "Frankfurt am Main",
      "details": "31.01.2025 (Bekanntmachungsdatum)\n\nHessen Amtsgericht Frankfurt am Main HRB 131073\nLöschungsankündigung 31.01.2025 (Eintragungsdatum)\n\nSHABAH UG (haftungsbeschränkt)\nGesellschaft mit beschränkter Haftung\nFrankfurt am Main\n\nEs ist beabsichtigt, die Gesellschaft wegen Vermögenslosigkeit gemäß § 394 FamFG von Amts wegen im Handelsregister zu löschen.\n\nHiergegen kann innerhalb eines Monats nach Veröffentlichung Widerspruch bei dem Amtsgericht Frankfurt am Main eingelegt werden."
    },
    {
      "date": "2025-01-31",
      "id": "100238",
      "original_text": "Löschungsankündigung\nHessen Amtsgericht Wiesbaden VR 3416\nU.I.M. Wiesbaden e.V. – Wiesbaden",
      "type": "Löschungsankündigung",
      "state": "Hessen",
      "amtsgericht": "Amtsgericht Wiesbaden",
      "registernummer": "VR 3416",
      "registerart": "VR",
      "company_name": "U.I.M. Wiesbaden e.V.",
      "company_seat": "Wiesbaden",
      "details": "31.01.2025 (Bekanntmachungsdatum)\n\nHessen Amtsgericht Wiesbaden VR 3416\nLöschungsankündigung 31.01.2025 (Eintragungsdatum)\n\nU.I.M. Wiesbaden e.V.\neingetragener Verein\nWiesbaden\n\nDer Verein ist aufgelöst."
    },
    {
      "date": "2025-01-31",
      "id": "100239",
      "original_text": "Löschungsankündigung\nHessen Amtsgericht Frankfurt am Main HRA 48845\nGoldener Elch GmbH & Co. KG – Frankfurt am Main",
      "type": "Löschungsankündigung",
      "state": "Hessen",
      "amtsgericht": "Amtsgericht Frankfurt am Main",
      "registernummer": "HRA 48845",
      "registerart": "HRA",
      "company_name": "Goldener Elch GmbH & Co. KG",
      "company_seat": "Frankfurt am Main",
      "details": "31.01.2025 (Bekanntmachungsdatum)\n\nHessen Amtsgericht Frankfurt am Main HRA 48845\nLöschungsankündigung\n\nGoldener Elch GmbH & Co. KG\nKommanditgesellschaft\nFrankfurt am Main\n\nDas Registergericht beabsichtigt die im Handelsregister eingetragene Firma von Amts wegen nach § 31 Abs. 2 HGB  i.V.m. § 393 FamFG zu löschen. Die Frist zur Erhebung eines Widerspruchs gegen die beabsichtigte Löschung wird auf 4 Wochen festgesetzt."
    }
  ]
}