{
  "date": "2025-01-11",
  "date_of_scrape": "2025-01-12T09:09:13.878Z",
  "tool_version": "0.2.0",
  "number_of_announcements": 25,
  "announcements": [
    {
      "date": "2025-01-11",
      "id": "98340",
      "original_text": "Registerbekanntmachung nach dem Umwandlungsgesetz\nBayern Amtsgericht München HRB 263403\nSportScheck Stationär Verwaltungs-GmbH – München",
      "type": "Registerbekanntmachung nach dem Umwandlungsgesetz",
      "state": "Bayern",
      "amtsgericht": "Amtsgericht München",
      "registernummer": "HRB 263403",
      "registerart": "HRB",
      "company_name": "SportScheck Stationär Verwaltungs-GmbH",
      "company_seat": "München",
      "details": "11.01.2025 (Bekanntmachungsdatum)\n\nBayern Amtsgericht München HRB 263403\nRegisterbekanntmachung nach dem Umwandlungsgesetz 10.01.2025 (Eintragungsdatum)\n\nSportScheck Stationär Verwaltungs-GmbH\nGesellschaft mit beschränkter Haftung\nMünchen\n\nDen Gläubigern #dv.auswahl(Text=\"Bitte zutreffendes auswählen:\",Eingabe=\n\n\"der an der Verschmelzung beteiligten Rechtsträger ist, wenn sie binnen sechs Monaten nach dem Tag, an dem die Eintragung der Verschmelzung in das Register des Sitzes desjenigen Rechtsträgers, dessen Gläubiger sie sind, nach § 19 Abs. 3 UmwG als bekannt gemacht gilt, ihren Anspruch nach Grund und Höhe in Textform anmelden, Sicherheit zu leisten, soweit sie nicht Befriedigung verlangen können. Dieses Recht steht den Gläubigern jedoch nur zu, wenn sie glaubhaft machen, dass durch die Verschmelzung die Erfüllung ihrer Forderung gefährdet wird.\"|\"Verschmelzung\",\n\n\"der an der Spaltung beteiligten Rechtsträger ist, wenn sie binnen sechs Monaten nach dem Tag, an dem die Eintragung der Spaltung in das Register des Sitzes desjenigen Rechtsträgers, dessen Gläubiger sie sind, nach §§ 125, 19 Abs. 3 UmwG als bekannt gemacht gilt, ihren Anspruch nach Grund und Höhe in Textform anmelden, Sicherheit zu leisten, soweit sie nicht Befriedigung verlangen können. Dieses Recht steht den Gläubigern jedoch nur zu, wenn sie glaubhaft machen, dass durch die Spaltung die Erfüllung ihrer Forderung gefährdet wird.\"|\"Spaltung\",\n\n\"des formwechselnden Rechtsträgers ist, wenn sie binnen sechs Monaten nach dem Tag, an dem die Eintragung des Formwechsels nach § 201 UmwG als bekannt gemacht gilt, ihren Anspruch nach Grund und Höhe in Textform anmelden, Sicherheit zu leisten, soweit sie nicht Befriedigung verlangen können. Dieses Recht steht den Gläubigern jedoch nur zu, wenn sie glaubhaft machen, dass durch den Formwechsel die Erfüllung ihrer Forderung gefährdet wird.\"|\"formwechselnde Umwandlung\",\n\n\"der an der Ausgliederung beteiligten Rechtsträger ist, wenn sie binnen sechs Monaten nach dem Tag, an dem die Eintragung der Ausgliederung in das Register des Sitzes desjenigen Rechtsträgers, dessen Gläubiger sie sind, nach §§ 125, 19 Abs. 3 UmwG als bekannt gemacht gilt, ihren Anspruch nach Grund und Höhe in Textform anmelden, Sicherheit zu leisten, soweit sie nicht Befriedigung verlangen können. Dieses Recht steht den Gläubigern jedoch nur zu, wenn sie glaubhaft machen, dass durch die Ausgliederung die Erfüllung ihrer Forderung gefährdet wird.\"|\"Ausgliederung\")"
    },
    {
      "date": "2025-01-11",
      "id": "98341",
      "original_text": "Löschungsankündigung\nBayern Amtsgericht Aschaffenburg HRB 14052\nGBT Gefahrgut Beratung und Transport GmbH – Alzenau",
      "type": "Löschungsankündigung",
      "state": "Bayern",
      "amtsgericht": "Amtsgericht Aschaffenburg",
      "registernummer": "HRB 14052",
      "registerart": "HRB",
      "company_name": "GBT Gefahrgut Beratung und Transport GmbH",
      "company_seat": "Alzenau",
      "details": "11.01.2025 (Bekanntmachungsdatum)\n\nBayern Amtsgericht Aschaffenburg HRB 14052\nLöschungsankündigung\n\nGBT Gefahrgut Beratung und Transport GmbH\nGesellschaft mit beschränkter Haftung\nAlzenau\n\nDas Registergericht beabsichtigt, die im Handelsregister eingetragene Gesellschaft wegen Vermögenslosigkeit von Amts wegen nach § 394 FamFG zu löschen. Die Frist zur Erhebung eines Widerspruchs ist auf drei Monate festgesetzt."
    },
    {
      "date": "2025-01-11",
      "id": "98342",
      "original_text": "Registerbekanntmachung nach dem Umwandlungsgesetz\nBayern Amtsgericht München HRA 42101\nDorst Technologies GmbH & Co. KG – Kochel",
      "type": "Registerbekanntmachung nach dem Umwandlungsgesetz",
      "state": "Bayern",
      "amtsgericht": "Amtsgericht München",
      "registernummer": "HRA 42101",
      "registerart": "HRA",
      "company_name": "Dorst Technologies GmbH & Co. KG",
      "company_seat": "Kochel",
      "details": "11.01.2025 (Bekanntmachungsdatum)\n\nBayern Amtsgericht München HRA 42101\nRegisterbekanntmachung nach dem Umwandlungsgesetz 10.01.2025 (Eintragungsdatum)\n\nDorst Technologies GmbH & Co. KG\nKommanditgesellschaft\nKochel\n\nDen Gläubigern des formwechselnden Rechtsträgers ist, wenn sie binnen sechs Monaten nach dem Tag, an dem die Eintragung des Formwechsels nach § 201 UmwG als bekannt gemacht gilt, ihren Anspruch nach Grund und Höhe in Textform anmelden, Sicherheit zu leisten, soweit sie nicht Befriedigung verlangen können. Dieses Recht steht den Gläubigern jedoch nur zu, wenn sie glaubhaft machen, dass durch den Formwechsel die Erfüllung ihrer Forderung gefährdet wird."
    },
    {
      "date": "2025-01-11",
      "id": "98343",
      "original_text": "Sonstige Registerbekanntmachung\nBayern Amtsgericht Fürth HRB 20192\nGBI GmbH Gesellschaft für Beteiligungen und Immobilienentwicklungen – Erlangen",
      "type": "Sonstige Registerbekanntmachung",
      "state": "Bayern",
      "amtsgericht": "Amtsgericht Fürth",
      "registernummer": "HRB 20192",
      "registerart": "HRB",
      "company_name": "GBI GmbH Gesellschaft für Beteiligungen und Immobilienentwicklungen",
      "company_seat": "Erlangen",
      "details": "11.01.2025 (Bekanntmachungsdatum)\n\nBayern Amtsgericht Fürth HRB 20192\nSonstige Registerbekanntmachung 10.01.2025 (Eintragungsdatum)\n\nGBI GmbH Gesellschaft für Beteiligungen und Immobilienentwicklungen\nGesellschaft mit beschränkter Haftung\nErlangen\n\nDen Gläubigern der Gesellschaft, deren Forderungen begründet worden sind, bevor die Eintragung der Beendigung des Gewinnabführungsvertrages in das Handelsregister nach § 10 des Handelsgesetzbuches als bekanntgemacht gilt, hat der andere Vertragsteil Sicherheit zu leisten, wenn sie sich binnen sechs Monaten nach der Bekanntmachung der Eintragung zu diesem Zweck bei ihm melden."
    },
    {
      "date": "2025-01-11",
      "id": "98344",
      "original_text": "Einreichung neuer Dokumente\nBayern Amtsgericht München HRB 1355\nBayerische Futtersaatbau Gesellschaft mit beschränkter Haftung – Ismaning",
      "type": "Einreichung neuer Dokumente",
      "state": "Bayern",
      "amtsgericht": "Amtsgericht München",
      "registernummer": "HRB 1355",
      "registerart": "HRB",
      "company_name": "Bayerische Futtersaatbau Gesellschaft mit beschränkter Haftung",
      "company_seat": "Ismaning",
      "details": "11.01.2025 (Bekanntmachungsdatum)\n\nBayern Amtsgericht München HRB 1355\nEinreichung neuer Dokumente 10.01.2025 (Eintragungsdatum)\n\nBayerische Futtersaatbau Gesellschaft mit beschränkter Haftung\nGesellschaft mit beschränkter Haftung\nIsmaning\n\nDem Amtsgericht München -Registergericht- ist eine Liste der Mitglieder des Aufsichtsrats eingereicht worden, § 52 Abs. 3 S. 2 GmbHG."
    },
    {
      "date": "2025-01-11",
      "id": "98345",
      "original_text": "Einreichung neuer Dokumente\nBayern Amtsgericht München HRB 6466\nHelmholtz Zentrum München Deutsches Forschungszentrum für Gesundheit und Umwelt (GmbH) – München",
      "type": "Einreichung neuer Dokumente",
      "state": "Bayern",
      "amtsgericht": "Amtsgericht München",
      "registernummer": "HRB 6466",
      "registerart": "HRB",
      "company_name": "Helmholtz Zentrum München Deutsches Forschungszentrum für Gesundheit und Umwelt (GmbH)",
      "company_seat": "München",
      "details": "11.01.2025 (Bekanntmachungsdatum)\n\nBayern Amtsgericht München HRB 6466\nEinreichung neuer Dokumente\n\nHelmholtz Zentrum München Deutsches Forschungszentrum für Gesundheit und Umwelt (GmbH)\nGesellschaft mit beschränkter Haftung\nMünchen\n\nDem Amtsgericht München -Registergericht- ist eine Liste der Mitglieder des Aufsichtsrats eingereicht worden, § 52 Abs. 3 S. 2 GmbHG."
    },
    {
      "date": "2025-01-11",
      "id": "98346",
      "original_text": "Registerbekanntmachung nach dem Umwandlungsgesetz\nBayern Amtsgericht Nürnberg HRB 31654\nBraun & Müller Druck- und Medienproduktions-GmbH – Nürnberg",
      "type": "Registerbekanntmachung nach dem Umwandlungsgesetz",
      "state": "Bayern",
      "amtsgericht": "Amtsgericht Nürnberg",
      "registernummer": "HRB 31654",
      "registerart": "HRB",
      "company_name": "Braun & Müller Druck- und Medienproduktions-GmbH",
      "company_seat": "Nürnberg",
      "details": "11.01.2025 (Bekanntmachungsdatum)\n\nBayern Amtsgericht Nürnberg HRB 31654\nRegisterbekanntmachung nach dem Umwandlungsgesetz 10.01.2025 (Eintragungsdatum)\n\nBraun & Müller Druck- und Medienproduktions-GmbH\nGesellschaft mit beschränkter Haftung\nNürnberg\n\nDen Gläubigern der an der Verschmelzung beteiligten Rechtsträger ist, wenn sie binnen sechs Monaten nach dem Tag, an dem die Eintragung der Verschmelzung in das Register des Sitzes desjenigen Rechtsträgers, dessen Gläubiger sie sind, nach § 19 Abs. 3 UmwG als bekannt gemacht gilt, ihren Anspruch nach Grund und Höhe in Textform anmelden, Sicherheit zu leisten, soweit sie nicht Befriedigung verlangen können. Dieses Recht steht den Gläubigern jedoch nur zu, wenn sie glaubhaft machen, dass durch die Verschmelzung die Erfüllung ihrer Forderung gefährdet wird."
    },
    {
      "date": "2025-01-11",
      "id": "98347",
      "original_text": "Registerbekanntmachung nach dem Umwandlungsgesetz\nBayern Amtsgericht München HRB 276978\nBecker Capital Management UG (haftungsbeschränkt) – München",
      "type": "Registerbekanntmachung nach dem Umwandlungsgesetz",
      "state": "Bayern",
      "amtsgericht": "Amtsgericht München",
      "registernummer": "HRB 276978",
      "registerart": "HRB",
      "company_name": "Becker Capital Management UG (haftungsbeschränkt)",
      "company_seat": "München",
      "details": "11.01.2025 (Bekanntmachungsdatum)\n\nBayern Amtsgericht München HRB 276978\nRegisterbekanntmachung nach dem Umwandlungsgesetz 10.01.2025 (Eintragungsdatum)\n\nBecker Capital Management UG (haftungsbeschränkt)\nGesellschaft mit beschränkter Haftung\nMünchen\n\nDen Gläubigern der an der Verschmelzung beteiligten Rechtsträger ist, wenn sie binnen sechs Monaten nach dem Tag, an dem die Eintragung der Verschmelzung in das Register des Sitzes desjenigen Rechtsträgers, dessen Gläubiger sie sind, nach § 19 Abs. 3 UmwG als bekannt gemacht gilt, ihren Anspruch nach Grund und Höhe in Textform anmelden, Sicherheit zu leisten, soweit sie nicht Befriedigung verlangen können. Dieses Recht steht den Gläubigern jedoch nur zu, wenn sie glaubhaft machen, dass durch die Verschmelzung die Erfüllung ihrer Forderung gefährdet wird."
    },
    {
      "date": "2025-01-11",
      "id": "98348",
      "original_text": "Registerbekanntmachung nach dem Umwandlungsgesetz\nBayern Amtsgericht Nürnberg HRB 43463\nNÜRNBERGER TREUHAND Verwaltungs-GmbH Wirtschaftsprüfungsgesellschaft Steuerberater Rechtsanwalt – Nürnberg",
      "type": "Registerbekanntmachung nach dem Umwandlungsgesetz",
      "state": "Bayern",
      "amtsgericht": "Amtsgericht Nürnberg",
      "registernummer": "HRB 43463",
      "registerart": "HRB",
      "company_name": "NÜRNBERGER TREUHAND Verwaltungs-GmbH Wirtschaftsprüfungsgesellschaft Steuerberater Rechtsanwalt",
      "company_seat": "Nürnberg",
      "details": "11.01.2025 (Bekanntmachungsdatum)\n\nBayern Amtsgericht Nürnberg HRB 43463\nRegisterbekanntmachung nach dem Umwandlungsgesetz 10.01.2025 (Eintragungsdatum)\n\nNÜRNBERGER TREUHAND Verwaltungs-GmbH Wirtschaftsprüfungsgesellschaft Steuerberater Rechtsanwalt\nGesellschaft mit beschränkter Haftung\nNürnberg\n\nDen Gläubigern der an der Verschmelzung beteiligten Rechtsträger ist, wenn sie binnen sechs Monaten nach dem Tag, an dem die Eintragung der Verschmelzung in das Register des Sitzes desjenigen Rechtsträgers, dessen Gläubiger sie sind, nach § 19 Abs. 3 UmwG als bekannt gemacht gilt, ihren Anspruch nach Grund und Höhe in Textform anmelden, Sicherheit zu leisten, soweit sie nicht Befriedigung verlangen können. Dieses Recht steht den Gläubigern jedoch nur zu, wenn sie glaubhaft machen, dass durch die Verschmelzung die Erfüllung ihrer Forderung gefährdet wird."
    },
    {
      "date": "2025-01-11",
      "id": "98349",
      "original_text": "Sonstige Registerbekanntmachung\nBayern Amtsgericht Nürnberg HRB 16688\nCOSMINO AG – Nürnberg",
      "type": "Sonstige Registerbekanntmachung",
      "state": "Bayern",
      "amtsgericht": "Amtsgericht Nürnberg",
      "registernummer": "HRB 16688",
      "registerart": "HRB",
      "company_name": "COSMINO AG",
      "company_seat": "Nürnberg",
      "details": "11.01.2025 (Bekanntmachungsdatum)\n\nBayern Amtsgericht Nürnberg HRB 16688\nSonstige Registerbekanntmachung\n\nCOSMINO AG\nAktiengesellschaft\nNürnberg\n\nDem Amtsgericht Nürnberg -Registergericht- ist eine Liste der Mitglieder des Aufsichtsrats eingereicht worden, § 106 AktG."
    },
    {
      "date": "2025-01-11",
      "id": "98350",
      "original_text": "Löschungsankündigung\nBayern Amtsgericht München HRB 211711\nHappy Factory Vertriebs GmbH – Oberhaching",
      "type": "Löschungsankündigung",
      "state": "Bayern",
      "amtsgericht": "Amtsgericht München",
      "registernummer": "HRB 211711",
      "registerart": "HRB",
      "company_name": "Happy Factory Vertriebs GmbH",
      "company_seat": "Oberhaching",
      "details": "11.01.2025 (Bekanntmachungsdatum)\n\nBayern Amtsgericht München HRB 211711\nLöschungsankündigung 10.01.2025 (Eintragungsdatum)\n\nHappy Factory Vertriebs GmbH\nGesellschaft mit beschränkter Haftung\nOberhaching\n\nDas Registergericht beabsichtigt, die im Handelsregister eingetragene Gesellschaft wegen Vermögenslosigkeit von Amts wegen nach § 394 FamFG zu löschen. Die Frist zur Erhebung eines Widerspruchs ist auf drei Monate festgesetzt."
    },
    {
      "date": "2025-01-11",
      "id": "98351",
      "original_text": "Sonstige Registerbekanntmachung\nBayern Amtsgericht Augsburg HRB 24942\nElektrotechnik Magherusan GmbH – Kissing",
      "type": "Sonstige Registerbekanntmachung",
      "state": "Bayern",
      "amtsgericht": "Amtsgericht Augsburg",
      "registernummer": "HRB 24942",
      "registerart": "HRB",
      "company_name": "Elektrotechnik Magherusan GmbH",
      "company_seat": "Kissing",
      "details": "11.01.2025 (Bekanntmachungsdatum)\n\nBayern Amtsgericht Augsburg HRB 24942\nSonstige Registerbekanntmachung 10.01.2025 (Eintragungsdatum)\n\nElektrotechnik Magherusan GmbH\nGesellschaft mit beschränkter Haftung\nKissing\n\nDen Gläubigern der Gesellschaft, deren Forderungen begründet worden sind, bevor die Eintragung der Beendigung des Gewinnabführungsvertrages in das Handelsregister nach § 10 des Handelsgesetzbuches als bekanntgemacht gilt, hat der andere Vertragsteil Sicherheit zu leisten, wenn sie sich binnen sechs Monaten nach der Bekanntmachung der Eintragung zu diesem Zweck bei ihm melden."
    },
    {
      "date": "2025-01-11",
      "id": "98352",
      "original_text": "Sonstige Registerbekanntmachung\nBayern Amtsgericht München HRB 119806\nWEKA Fachmedien GmbH – Haar",
      "type": "Sonstige Registerbekanntmachung",
      "state": "Bayern",
      "amtsgericht": "Amtsgericht München",
      "registernummer": "HRB 119806",
      "registerart": "HRB",
      "company_name": "WEKA Fachmedien GmbH",
      "company_seat": "Haar",
      "details": "11.01.2025 (Bekanntmachungsdatum)\n\nBayern Amtsgericht München HRB 119806\nSonstige Registerbekanntmachung 10.01.2025 (Eintragungsdatum)\n\nWEKA Fachmedien GmbH\nGesellschaft mit beschränkter Haftung\nHaar\n\nDen Gläubigern der Gesellschaft, deren Forderungen begründet worden sind, bevor die Eintragung der Beendigung des Beherrschungsvertrages und/oder Gewinnabführungsvertrages in das Handelsregister nach § 10 des Handelsgesetzbuches als bekanntgemacht gilt, hat der andere Vertragsteil Sicherheit zu leisten, wenn sie sich binnen sechs Monaten nach der Bekanntmachung der Eintragung zu diesem Zweck bei ihm melden."
    },
    {
      "date": "2025-01-11",
      "id": "98353",
      "original_text": "Einreichung neuer Dokumente\nBayern Amtsgericht Ingolstadt HRB 9128\nArtificial Intelligence Network Ingolstadt GmbH – Ingolstadt",
      "type": "Einreichung neuer Dokumente",
      "state": "Bayern",
      "amtsgericht": "Amtsgericht Ingolstadt",
      "registernummer": "HRB 9128",
      "registerart": "HRB",
      "company_name": "Artificial Intelligence Network Ingolstadt GmbH",
      "company_seat": "Ingolstadt",
      "details": "11.01.2025 (Bekanntmachungsdatum)\n\nBayern Amtsgericht Ingolstadt HRB 9128\nEinreichung neuer Dokumente\n\nArtificial Intelligence Network Ingolstadt GmbH\nGesellschaft mit beschränkter Haftung\nIngolstadt\n\nDem Amtsgericht Ingolstadt -Registergericht- ist eine Liste der Mitglieder des Aufsichtsrats eingereicht worden, § 52 Abs. 3 S. 2 GmbHG."
    },
    {
      "date": "2025-01-11",
      "id": "98354",
      "original_text": "Sonstige Registerbekanntmachung\nBayern Amtsgericht Fürth HRB 14314\nGBI Wohnungsbau GmbH – Erlangen",
      "type": "Sonstige Registerbekanntmachung",
      "state": "Bayern",
      "amtsgericht": "Amtsgericht Fürth",
      "registernummer": "HRB 14314",
      "registerart": "HRB",
      "company_name": "GBI Wohnungsbau GmbH",
      "company_seat": "Erlangen",
      "details": "11.01.2025 (Bekanntmachungsdatum)\n\nBayern Amtsgericht Fürth HRB 14314\nSonstige Registerbekanntmachung 10.01.2025 (Eintragungsdatum)\n\nGBI Wohnungsbau GmbH\nGesellschaft mit beschränkter Haftung\nErlangen\n\nDen Gläubigern der Gesellschaft, deren Forderungen begründet worden sind, bevor die Eintragung der Beendigung des Gewinnabführungsvertrages in das Handelsregister nach § 10 des Handelsgesetzbuches als bekanntgemacht gilt, hat der andere Vertragsteil Sicherheit zu leisten, wenn sie sich binnen sechs Monaten nach der Bekanntmachung der Eintragung zu diesem Zweck bei ihm melden."
    },
    {
      "date": "2025-01-11",
      "id": "98355",
      "original_text": "Löschungsankündigung\nBayern Amtsgericht München HRB 203869\nLendstar GmbH – Starnberg",
      "type": "Löschungsankündigung",
      "state": "Bayern",
      "amtsgericht": "Amtsgericht München",
      "registernummer": "HRB 203869",
      "registerart": "HRB",
      "company_name": "Lendstar GmbH",
      "company_seat": "Starnberg",
      "details": "11.01.2025 (Bekanntmachungsdatum)\n\nBayern Amtsgericht München HRB 203869\nLöschungsankündigung\n\nLendstar GmbH\nGesellschaft mit beschränkter Haftung\nStarnberg\n\nDas Registergericht beabsichtigt, die im Handelsregister eingetragene Gesellschaft wegen Vermögenslosigkeit von Amts wegen nach § 394 FamFG zu löschen. Die Frist zur Erhebung eines Widerspruchs ist auf drei Monate festgesetzt."
    },
    {
      "date": "2025-01-11",
      "id": "98356",
      "original_text": "Löschungsankündigung\nBayern Amtsgericht München HRB 173711\nSelfmade Capital Management GmbH – Unterföhring",
      "type": "Löschungsankündigung",
      "state": "Bayern",
      "amtsgericht": "Amtsgericht München",
      "registernummer": "HRB 173711",
      "registerart": "HRB",
      "company_name": "Selfmade Capital Management GmbH",
      "company_seat": "Unterföhring",
      "details": "11.01.2025 (Bekanntmachungsdatum)\n\nBayern Amtsgericht München HRB 173711\nLöschungsankündigung 10.01.2025 (Eintragungsdatum)\n\nSelfmade Capital Management GmbH\nGesellschaft mit beschränkter Haftung\nUnterföhring\n\nDas Registergericht beabsichtigt, die im Handelsregister eingetragene Gesellschaft wegen Vermögenslosigkeit von Amts wegen nach § 394 FamFG zu löschen. Die Frist zur Erhebung eines Widerspruchs ist auf drei Monate festgesetzt."
    },
    {
      "date": "2025-01-11",
      "id": "98357",
      "original_text": "Sonstige Registerbekanntmachung\nBayern Amtsgericht Traunstein HRB 25698\nKFO Fleet Service GmbH – Rosenheim",
      "type": "Sonstige Registerbekanntmachung",
      "state": "Bayern",
      "amtsgericht": "Amtsgericht Traunstein",
      "registernummer": "HRB 25698",
      "registerart": "HRB",
      "company_name": "KFO Fleet Service GmbH",
      "company_seat": "Rosenheim",
      "details": "11.01.2025 (Bekanntmachungsdatum)\n\nBayern Amtsgericht Traunstein HRB 25698\nSonstige Registerbekanntmachung 10.01.2025 (Eintragungsdatum)\n\nKFO Fleet Service GmbH\nGesellschaft mit beschränkter Haftung\nRosenheim\n\nDen Gläubigern der Gesellschaft, deren Forderungen begründet worden sind, bevor die Eintragung der Beendigung des Gewinnabführungsvertrages in das Handelsregister nach § 10 des Handelsgesetzbuches als bekanntgemacht gilt, hat der andere Vertragsteil Sicherheit zu leisten, wenn sie sich binnen sechs Monaten nach der Bekanntmachung der Eintragung zu diesem Zweck bei ihm melden."
    },
    {
      "date": "2025-01-11",
      "id": "98358",
      "original_text": "Einreichung neuer Dokumente\nBayern Amtsgericht München HRB 274912\nFlix SE – München",
      "type": "Einreichung neuer Dokumente",
      "state": "Bayern",
      "amtsgericht": "Amtsgericht München",
      "registernummer": "HRB 274912",
      "registerart": "HRB",
      "company_name": "Flix SE",
      "company_seat": "München",
      "details": "11.01.2025 (Bekanntmachungsdatum)\n\nBayern Amtsgericht München HRB 274912\nEinreichung neuer Dokumente\n\nFlix SE\nEuropäische Aktiengesellschaft (SE)\nMünchen\n\nDem Amtsgericht München -Registergericht- ist eine Liste der Mitglieder des Aufsichtsrats eingereicht worden, Art. 9 Abs. 1 Buchst. c (ii) SE-VO i.V.m. § 106 AktG."
    },
    {
      "date": "2025-01-11",
      "id": "98359",
      "original_text": "Registerbekanntmachung nach dem Umwandlungsgesetz\nBayern Amtsgericht Nürnberg GsR 273\nBraun & Müller Werbe- und Druckagentur eGbR – Nürnberg",
      "type": "Registerbekanntmachung nach dem Umwandlungsgesetz",
      "state": "Bayern",
      "amtsgericht": "Amtsgericht Nürnberg",
      "registernummer": "GsR 273",
      "registerart": "GsR",
      "company_name": "Braun & Müller Werbe- und Druckagentur eGbR",
      "company_seat": "Nürnberg",
      "details": "11.01.2025 (Bekanntmachungsdatum)\n\nBayern Amtsgericht Nürnberg GsR 273\nRegisterbekanntmachung nach dem Umwandlungsgesetz 10.01.2025 (Eintragungsdatum)\n\nBraun & Müller Werbe- und Druckagentur eGbR\nGesellschaft bürgerlichen Rechts\nNürnberg\n\nDen Gläubigern der an der Verschmelzung beteiligten Rechtsträger ist, wenn sie binnen sechs Monaten nach dem Tag, an dem die Eintragung der Verschmelzung in das Register des Sitzes desjenigen Rechtsträgers, dessen Gläubiger sie sind, nach § 19 Abs. 3 UmwG als bekannt gemacht gilt, ihren Anspruch nach Grund und Höhe in Textform anmelden, Sicherheit zu leisten, soweit sie nicht Befriedigung verlangen können. Dieses Recht steht den Gläubigern jedoch nur zu, wenn sie glaubhaft machen, dass durch die Verschmelzung die Erfüllung ihrer Forderung gefährdet wird."
    },
    {
      "date": "2025-01-11",
      "id": "98360",
      "original_text": "Registerbekanntmachung nach dem Umwandlungsgesetz\nBayern Amtsgericht Nürnberg HRB 37646\nNürnberger Treuhand SVZ Rechtsanwaltsgesellschaft mbH – Nürnberg",
      "type": "Registerbekanntmachung nach dem Umwandlungsgesetz",
      "state": "Bayern",
      "amtsgericht": "Amtsgericht Nürnberg",
      "registernummer": "HRB 37646",
      "registerart": "HRB",
      "company_name": "Nürnberger Treuhand SVZ Rechtsanwaltsgesellschaft mbH",
      "company_seat": "Nürnberg",
      "details": "11.01.2025 (Bekanntmachungsdatum)\n\nBayern Amtsgericht Nürnberg HRB 37646\nRegisterbekanntmachung nach dem Umwandlungsgesetz 10.01.2025 (Eintragungsdatum)\n\nNürnberger Treuhand SVZ Rechtsanwaltsgesellschaft mbH\nGesellschaft mit beschränkter Haftung\nNürnberg\n\nDen Gläubigern der an der Verschmelzung beteiligten Rechtsträger ist, wenn sie binnen sechs Monaten nach dem Tag, an dem die Eintragung der Verschmelzung in das Register des Sitzes desjenigen Rechtsträgers, dessen Gläubiger sie sind, nach § 19 Abs. 3 UmwG als bekannt gemacht gilt, ihren Anspruch nach Grund und Höhe in Textform anmelden, Sicherheit zu leisten, soweit sie nicht Befriedigung verlangen können. Dieses Recht steht den Gläubigern jedoch nur zu, wenn sie glaubhaft machen, dass durch die Verschmelzung die Erfüllung ihrer Forderung gefährdet wird."
    },
    {
      "date": "2025-01-11",
      "id": "98361",
      "original_text": "Einreichung neuer Dokumente\nBayern Amtsgericht München HRB 160333\nRohde & Schwarz Cybersecurity GmbH – München",
      "type": "Einreichung neuer Dokumente",
      "state": "Bayern",
      "amtsgericht": "Amtsgericht München",
      "registernummer": "HRB 160333",
      "registerart": "HRB",
      "company_name": "Rohde & Schwarz Cybersecurity GmbH",
      "company_seat": "München",
      "details": "11.01.2025 (Bekanntmachungsdatum)\n\nBayern Amtsgericht München HRB 160333\nEinreichung neuer Dokumente\n\nRohde & Schwarz Cybersecurity GmbH\nGesellschaft mit beschränkter Haftung\nMünchen\n\nDem Amtsgericht München -Registergericht- ist eine Liste der Mitglieder des Aufsichtsrats eingereicht worden, § 52 Abs. 3 S. 2 GmbHG."
    },
    {
      "date": "2025-01-11",
      "id": "98362",
      "original_text": "Registerbekanntmachung nach dem Umwandlungsgesetz\nBayern Amtsgericht Nürnberg HRB 24181\nLEONI Kabel GmbH – Roth",
      "type": "Registerbekanntmachung nach dem Umwandlungsgesetz",
      "state": "Bayern",
      "amtsgericht": "Amtsgericht Nürnberg",
      "registernummer": "HRB 24181",
      "registerart": "HRB",
      "company_name": "LEONI Kabel GmbH",
      "company_seat": "Roth",
      "details": "11.01.2025 (Bekanntmachungsdatum)\n\nBayern Amtsgericht Nürnberg HRB 24181\nRegisterbekanntmachung nach dem Umwandlungsgesetz 10.01.2025 (Eintragungsdatum)\n\nLEONI Kabel GmbH\nGesellschaft mit beschränkter Haftung\nRoth\n\nDen Gläubigern der Gesellschaft, deren Forderungen begründet worden sind, bevor die Eintragung der Beendigung des Gewinnabführungsvertrages in das Handelsregister nach § 10 des Handelsgesetzbuches als bekanntgemacht gilt, hat der andere Vertragsteil Sicherheit zu leisten, wenn sie sich binnen sechs Monaten nach der Bekanntmachung der Eintragung zu diesem Zweck bei ihm melden."
    },
    {
      "date": "2025-01-11",
      "id": "98363",
      "original_text": "Löschungsankündigung\nBayern Amtsgericht München HRB 104269\nWinkelbauer GmbH – München",
      "type": "Löschungsankündigung",
      "state": "Bayern",
      "amtsgericht": "Amtsgericht München",
      "registernummer": "HRB 104269",
      "registerart": "HRB",
      "company_name": "Winkelbauer GmbH",
      "company_seat": "München",
      "details": "11.01.2025 (Bekanntmachungsdatum)\n\nBayern Amtsgericht München HRB 104269\nLöschungsankündigung\n\nWinkelbauer GmbH\nGesellschaft mit beschränkter Haftung\nMünchen\n\nDas Registergericht beabsichtigt, die im Handelsregister eingetragene Gesellschaft wegen Vermögenslosigkeit von Amts wegen nach § 394 FamFG zu löschen. Die Frist zur Erhebung eines Widerspruchs ist auf drei Monate festgesetzt."
    },
    {
      "date": "2025-01-11",
      "id": "98364",
      "original_text": "Sonstige Registerbekanntmachung\nNordrhein-Westfalen Amtsgericht Düsseldorf HRB 46987\nHDI Pensionsfonds AG – Hilden",
      "type": "Sonstige Registerbekanntmachung",
      "state": "Nordrhein-Westfalen",
      "amtsgericht": "Amtsgericht Düsseldorf",
      "registernummer": "HRB 46987",
      "registerart": "HRB",
      "company_name": "HDI Pensionsfonds AG",
      "company_seat": "Hilden",
      "details": "11.01.2025 (Bekanntmachungsdatum)\n\nNordrhein-Westfalen Amtsgericht Düsseldorf HRB 46987\nSonstige Registerbekanntmachung\n\nHDI Pensionsfonds AG\nAktiengesellschaft\nHilden\n\nDem Registergericht ist eine Liste der Mitglieder des Aufsichtsrates eingereicht worden."
    }
  ]
}