{
  "date": "2025-01-13",
  "date_of_scrape": "2025-01-14T04:05:28.433Z",
  "tool_version": "0.2.0",
  "number_of_announcements": 105,
  "announcements": [
    {
      "date": "2025-01-13",
      "id": "69",
      "original_text": "Sonderregisterbekanntmachung OHNE Bezug zum elektr. Register\nSachsen-Anhalt Amtsgericht Stendal\n65 AR 954/15\nLPG Tierproduktion Einheit Oberröblingen",
      "type": "Sonderregisterbekanntmachung OHNE Bezug zum elektr. Register",
      "state": "Sachsen-Anhalt",
      "amtsgericht": "Amtsgericht Stendal",
      "company_name": "LPG Tierproduktion Einheit Oberröblingen",
      "sonderegister_referenz": "65 AR 954/15",
      "details": "13.01.2025 (Bekanntmachungsdatum)\n\nSachsen-Anhalt Amtsgericht Stendal\n65 AR 954/15\nSonderregisterbekanntmachung OHNE Bezug zum elektr. Register\n\nLPG Tierproduktion Einheit Oberröblingen\n\nDas Registergericht beabsichtigt, nachfolgende im Handelregister eingetragenen Firmen von Amts wegen nach § 394 FamFG zu löschen. Die Frist zu Erhebung eines Widerspruchs wird auf drei Monate festgesetzt."
    },
    {
      "date": "2025-01-13",
      "id": "98365",
      "original_text": "Sonstige Registerbekanntmachung\nBaden-Württemberg Amtsgericht Mannheim HRB 718468\nSteele Immobilien GmbH – Mühlacker",
      "type": "Sonstige Registerbekanntmachung",
      "state": "Baden-Württemberg",
      "amtsgericht": "Amtsgericht Mannheim",
      "registernummer": "HRB 718468",
      "registerart": "HRB",
      "company_name": "Steele Immobilien GmbH",
      "company_seat": "Mühlacker",
      "details": "13.01.2025 (Bekanntmachungsdatum)\n\nBaden-Württemberg Amtsgericht Mannheim HRB 718468\nSonstige Registerbekanntmachung 13.01.2025 (Eintragungsdatum)\n\nSteele Immobilien GmbH\nGesellschaft mit beschränkter Haftung\nMühlacker\n\nAls nicht eingetragen wird bekanntgemacht: Den Gläubigern der Gesellschaft, deren Forderungen begründet worden sind, bevor die Eintragung der Beendigung des Vertrages in das Handelsregister nach § 10 HGB als bekanntgemacht gilt, ist vom anderen Vertragsteil Sicherheit zu leisten, wenn sie sich binnen sechs Monaten nach der Bekanntmachung zu diesem Zweck bei ihm melden."
    },
    {
      "date": "2025-01-13",
      "id": "98366",
      "original_text": "Löschungsankündigung\nBerlin Amtsgericht Berlin (Charlottenburg) HRB 184523\nIMEXA Import - Export - Agentur & Handelsgesellschaft für das Baltikum Gesellschaft mit beschränkter Haftung – Berlin",
      "type": "Löschungsankündigung",
      "state": "Berlin",
      "amtsgericht": "Amtsgericht Berlin (Charlottenburg)",
      "registernummer": "HRB 184523",
      "registerart": "HRB",
      "company_name": "IMEXA Import - Export - Agentur & Handelsgesellschaft für das Baltikum Gesellschaft mit beschränkter Haftung",
      "company_seat": "Berlin",
      "details": "13.01.2025 (Bekanntmachungsdatum)\n\nBerlin Amtsgericht Berlin (Charlottenburg) HRB 184523\nLöschungsankündigung\n\nIMEXA Import - Export - Agentur & Handelsgesellschaft für das Baltikum Gesellschaft mit beschränkter Haftung\nGesellschaft mit beschränkter Haftung\nBerlin\n\nBei der nachstehenden Gesellschaft wird das Amtslöschungsverfahren gemäß § 394 FamFG eingeleitet. Widerspruchsfrist 6 Wochen"
    },
    {
      "date": "2025-01-13",
      "id": "98367",
      "original_text": "Löschungsankündigung\nBerlin Amtsgericht Berlin (Charlottenburg) HRB 188548\nILMA Trading GmbH – Berlin",
      "type": "Löschungsankündigung",
      "state": "Berlin",
      "amtsgericht": "Amtsgericht Berlin (Charlottenburg)",
      "registernummer": "HRB 188548",
      "registerart": "HRB",
      "company_name": "ILMA Trading GmbH",
      "company_seat": "Berlin",
      "details": "13.01.2025 (Bekanntmachungsdatum)\n\nBerlin Amtsgericht Berlin (Charlottenburg) HRB 188548\nLöschungsankündigung\n\nILMA Trading GmbH\nGesellschaft mit beschränkter Haftung\nBerlin\n\nBei der nachstehenden Gesellschaft wird das Amtslöschungsverfahren gemäß § 394 FamFG eingeleitet. Widerspruchsfrist 6 Wochen"
    },
    {
      "date": "2025-01-13",
      "id": "98368",
      "original_text": "Sonstige Registerbekanntmachung\nBaden-Württemberg Amtsgericht Ulm HRB 4219\nIngenics Services GmbH – Ulm",
      "type": "Sonstige Registerbekanntmachung",
      "state": "Baden-Württemberg",
      "amtsgericht": "Amtsgericht Ulm",
      "registernummer": "HRB 4219",
      "registerart": "HRB",
      "company_name": "Ingenics Services GmbH",
      "company_seat": "Ulm",
      "details": ""
    },
    {
      "date": "2025-01-13",
      "id": "98369",
      "original_text": "Einreichung neuer Dokumente\nBaden-Württemberg Amtsgericht Mannheim HRB 108956\nArtifiction AG – Karlsruhe",
      "type": "Einreichung neuer Dokumente",
      "state": "Baden-Württemberg",
      "amtsgericht": "Amtsgericht Mannheim",
      "registernummer": "HRB 108956",
      "registerart": "HRB",
      "company_name": "Artifiction AG",
      "company_seat": "Karlsruhe",
      "details": "13.01.2025 (Bekanntmachungsdatum)\n\nBaden-Württemberg Amtsgericht Mannheim HRB 108956\nEinreichung neuer Dokumente 13.01.2025 (Eintragungsdatum)\n\nArtifiction AG\nAktiengesellschaft\nKarlsruhe\n\nDie Gesellschaft hat am 10.01.2025 die Liste über die Zusammensetzung des Aufsichtsrats zum Handelsregister eingereicht."
    },
    {
      "date": "2025-01-13",
      "id": "98370",
      "original_text": "Einreichung neuer Dokumente\nSchleswig-Holstein Amtsgericht Kiel HRB 23429\nBLUME2000 SE – Norderstedt",
      "type": "Einreichung neuer Dokumente",
      "state": "Schleswig-Holstein",
      "amtsgericht": "Amtsgericht Kiel",
      "registernummer": "HRB 23429",
      "registerart": "HRB",
      "company_name": "BLUME2000 SE",
      "company_seat": "Norderstedt",
      "details": "13.01.2025 (Bekanntmachungsdatum)\n\nSchleswig-Holstein Amtsgericht Kiel HRB 23429\nEinreichung neuer Dokumente\n\nBLUME2000 SE\nEuropäische Aktiengesellschaft (SE)\nNorderstedt\n\nEine neue Liste der Aufsichtsratsmitglieder ist eingereicht worden."
    },
    {
      "date": "2025-01-13",
      "id": "98371",
      "original_text": "Löschungsankündigung\nBerlin Amtsgericht Berlin (Charlottenburg) HRB 185517\nBeteiligungsgesellschaft XYZ GmbH – Berlin",
      "type": "Löschungsankündigung",
      "state": "Berlin",
      "amtsgericht": "Amtsgericht Berlin (Charlottenburg)",
      "registernummer": "HRB 185517",
      "registerart": "HRB",
      "company_name": "Beteiligungsgesellschaft XYZ GmbH",
      "company_seat": "Berlin",
      "details": "13.01.2025 (Bekanntmachungsdatum)\n\nBerlin Amtsgericht Berlin (Charlottenburg) HRB 185517\nLöschungsankündigung\n\nBeteiligungsgesellschaft XYZ GmbH\nGesellschaft mit beschränkter Haftung\nBerlin\n\nBei der nachstehenden Gesellschaft wird das Amtslöschungsverfahren gemäß § 394 FamFG eingeleitet. Widerspruchsfrist: 6 Wochen."
    },
    {
      "date": "2025-01-13",
      "id": "98372",
      "original_text": "Sonstige Registerbekanntmachung\nBaden-Württemberg Amtsgericht Mannheim HRB 740247\nARTUS Risk Management Consulting GmbH – Baden-Baden",
      "type": "Sonstige Registerbekanntmachung",
      "state": "Baden-Württemberg",
      "amtsgericht": "Amtsgericht Mannheim",
      "registernummer": "HRB 740247",
      "registerart": "HRB",
      "company_name": "ARTUS Risk Management Consulting GmbH",
      "company_seat": "Baden-Baden",
      "details": "13.01.2025 (Bekanntmachungsdatum)\n\nBaden-Württemberg Amtsgericht Mannheim HRB 740247\nSonstige Registerbekanntmachung 13.01.2025 (Eintragungsdatum)\n\nARTUS Risk Management Consulting GmbH\nGesellschaft mit beschränkter Haftung\nBaden-Baden\n\nDen Gläubigern der Gesellschaft, deren Forderungen begründet worden sind, bevor die Eintragung der Beendigung des Vertrages in das Handelsregister nach § 10 HGB als bekanntgemacht gilt, ist vom anderen Vertragsteil Sicherheit zu leisten, wenn sie sich binnen sechs Monaten nach der Bekanntmachung zu diesem Zweck bei ihm melden."
    },
    {
      "date": "2025-01-13",
      "id": "98373",
      "original_text": "Löschungsankündigung\nBerlin Amtsgericht Berlin (Charlottenburg) HRB 236080\nLang Personalmanagement UG (haftungsbeschränkt) – Berlin",
      "type": "Löschungsankündigung",
      "state": "Berlin",
      "amtsgericht": "Amtsgericht Berlin (Charlottenburg)",
      "registernummer": "HRB 236080",
      "registerart": "HRB",
      "company_name": "Lang Personalmanagement UG (haftungsbeschränkt)",
      "company_seat": "Berlin",
      "details": "13.01.2025 (Bekanntmachungsdatum)\n\nBerlin Amtsgericht Berlin (Charlottenburg) HRB 236080\nLöschungsankündigung\n\nLang Personalmanagement UG (haftungsbeschränkt)\nGesellschaft mit beschränkter Haftung\nBerlin\n\nBei der nachstehenden Gesellschaft wird das Amtslöschungsverfahren gemäß § 394 FamFG eingeleitet. Widerspruchsfrist 6 Wochen"
    },
    {
      "date": "2025-01-13",
      "id": "98374",
      "original_text": "Löschungsankündigung\nBrandenburg Amtsgericht Potsdam HRB 33453\nArcadia Estates Halskestr. 42 GmbH – Zossen",
      "type": "Löschungsankündigung",
      "state": "Brandenburg",
      "amtsgericht": "Amtsgericht Potsdam",
      "registernummer": "HRB 33453",
      "registerart": "HRB",
      "company_name": "Arcadia Estates Halskestr. 42 GmbH",
      "company_seat": "Zossen",
      "details": "13.01.2025 (Bekanntmachungsdatum)\n\nBrandenburg Amtsgericht Potsdam HRB 33453\nLöschungsankündigung\n\nArcadia Estates Halskestr. 42 GmbH\nGesellschaft mit beschränkter Haftung\nZossen\n\nBei der nachstehenden Gesellschaft wird das Amtslöschungsverfahren gemäß § 394 FamFG eingeleitet. Widerspruchsfrist: 8 Wochen"
    },
    {
      "date": "2025-01-13",
      "id": "98375",
      "original_text": "Löschungsankündigung\nBrandenburg Amtsgericht Potsdam HRB 30106\nSKP Fine Food GmbH – Potsdam",
      "type": "Löschungsankündigung",
      "state": "Brandenburg",
      "amtsgericht": "Amtsgericht Potsdam",
      "registernummer": "HRB 30106",
      "registerart": "HRB",
      "company_name": "SKP Fine Food GmbH",
      "company_seat": "Potsdam",
      "details": "13.01.2025 (Bekanntmachungsdatum)\n\nBrandenburg Amtsgericht Potsdam HRB 30106\nLöschungsankündigung\n\nSKP Fine Food GmbH\nGesellschaft mit beschränkter Haftung\nPotsdam\n\nBei der nachstehenden Gesellschaft wird das Amtslöschungsverfahren gemäß § 394 FamFG eingeleitet. Die Widerspruchsfrist beträgt: 8 Wochen."
    },
    {
      "date": "2025-01-13",
      "id": "98376",
      "original_text": "Einreichung neuer Dokumente\nBaden-Württemberg Amtsgericht Ulm HRB 501527\nFeuerbestattung Ostwürttemberg AG – Aalen",
      "type": "Einreichung neuer Dokumente",
      "state": "Baden-Württemberg",
      "amtsgericht": "Amtsgericht Ulm",
      "registernummer": "HRB 501527",
      "registerart": "HRB",
      "company_name": "Feuerbestattung Ostwürttemberg AG",
      "company_seat": "Aalen",
      "details": "13.01.2025 (Bekanntmachungsdatum)\n\nBaden-Württemberg Amtsgericht Ulm HRB 501527\nEinreichung neuer Dokumente 13.01.2025 (Eintragungsdatum)\n\nFeuerbestattung Ostwürttemberg AG\nAktiengesellschaft\nAalen\n\nDie Gesellschaft hat am 09.01.2025 die Liste über die Zusammensetzung des Aufsichtsrats zum Handelsregister eingereicht."
    },
    {
      "date": "2025-01-13",
      "id": "98377",
      "original_text": "Löschungsankündigung\nBerlin Amtsgericht Berlin (Charlottenburg) HRB 175292\nIhr Gutachter Team UG (haftungsbeschränkt) – Berlin",
      "type": "Löschungsankündigung",
      "state": "Berlin",
      "amtsgericht": "Amtsgericht Berlin (Charlottenburg)",
      "registernummer": "HRB 175292",
      "registerart": "HRB",
      "company_name": "Ihr Gutachter Team UG (haftungsbeschränkt)",
      "company_seat": "Berlin",
      "details": "13.01.2025 (Bekanntmachungsdatum)\n\nBerlin Amtsgericht Berlin (Charlottenburg) HRB 175292\nLöschungsankündigung\n\nIhr Gutachter Team UG (haftungsbeschränkt)\nGesellschaft mit beschränkter Haftung\nBerlin\n\nBei der nachstehenden Gesellschaft wird das Amtslöschungsverfahren gemäß § 394 FamFG eingeleitet. Widerspruchsfrist 6 Wochen"
    },
    {
      "date": "2025-01-13",
      "id": "98378",
      "original_text": "Einreichung neuer Dokumente\nBaden-Württemberg Amtsgericht Stuttgart HRB 779472\nStadtwerke Öhringen GmbH – Öhringen",
      "type": "Einreichung neuer Dokumente",
      "state": "Baden-Württemberg",
      "amtsgericht": "Amtsgericht Stuttgart",
      "registernummer": "HRB 779472",
      "registerart": "HRB",
      "company_name": "Stadtwerke Öhringen GmbH",
      "company_seat": "Öhringen",
      "details": "13.01.2025 (Bekanntmachungsdatum)\n\nBaden-Württemberg Amtsgericht Stuttgart HRB 779472\nEinreichung neuer Dokumente\n\nStadtwerke Öhringen GmbH\nGesellschaft mit beschränkter Haftung\nÖhringen\n\nDie Gesellschaft hat am 09.01.2025 die Liste über die Zusammensetzung des Aufsichtsrats zum Handelsregister eingereicht."
    },
    {
      "date": "2025-01-13",
      "id": "98379",
      "original_text": "Registerbekanntmachung nach dem Umwandlungsgesetz\nBaden-Württemberg Amtsgericht Mannheim HRB 505613\ninsatech GmbH – Königsbach-Stein",
      "type": "Registerbekanntmachung nach dem Umwandlungsgesetz",
      "state": "Baden-Württemberg",
      "amtsgericht": "Amtsgericht Mannheim",
      "registernummer": "HRB 505613",
      "registerart": "HRB",
      "company_name": "insatech GmbH",
      "company_seat": "Königsbach-Stein",
      "details": "13.01.2025 (Bekanntmachungsdatum)\n\nBaden-Württemberg Amtsgericht Mannheim HRB 505613\nRegisterbekanntmachung nach dem Umwandlungsgesetz 13.01.2025 (Eintragungsdatum)\n\ninsatech GmbH\nGesellschaft mit beschränkter Haftung\nKönigsbach-Stein\n\nAls nicht eingetragen wird bekanntgemacht:\nDen Gläubigern der an der Verschmelzung beteiligten Rechtsträger ist, wenn sie binnen sechs Monaten nach dem Tag, an dem die Eintragung der Verschmelzung in das Register des Sitzes desjenigen Rechtsträgers, dessen Gläubiger sie sind, nach § 19 Abs. 3 UmwG als bekanntgemacht gilt, ihren Anspruch nach Grund und Höhe schriftlich anmelden, Sicherheit zu leisten, soweit sie nicht Befriedigung verlangen können. Dieses Recht steht den Gläubigern jedoch nur zu, wenn sie glaubhaft machen, dass durch die Verschmelzung die Erfüllung ihrer Forderung gefährdet wird."
    },
    {
      "date": "2025-01-13",
      "id": "98380",
      "original_text": "Löschungsankündigung\nBaden-Württemberg Amtsgericht Mannheim HRB 202376\nWHAT'S UP FACTORY GmbH – Baden-Baden",
      "type": "Löschungsankündigung",
      "state": "Baden-Württemberg",
      "amtsgericht": "Amtsgericht Mannheim",
      "registernummer": "HRB 202376",
      "registerart": "HRB",
      "company_name": "WHAT'S UP FACTORY GmbH",
      "company_seat": "Baden-Baden",
      "details": "13.01.2025 (Bekanntmachungsdatum)\n\nBaden-Württemberg Amtsgericht Mannheim HRB 202376\nLöschungsankündigung\n\nWHAT'S UP FACTORY GmbH\nGesellschaft mit beschränkter Haftung\nBaden-Baden\n\nDas Gericht beabsichtigt, die Gesellschaft wegen Vermögenslosigkeit im Handelsregister von Amts wegen nach § 394 FamFG zu löschen. Die Frist zur Geltendmachung eines Widerspruchs gegen die beabsichtigte Löschung ist auf einen Monat ab Veröffentlichung bestimmt."
    },
    {
      "date": "2025-01-13",
      "id": "98381",
      "original_text": "Löschungsankündigung\nBerlin Amtsgericht Berlin (Charlottenburg) HRB 217064\nMETATEC Bau- und Handelsgesellschaft mbH – Berlin",
      "type": "Löschungsankündigung",
      "state": "Berlin",
      "amtsgericht": "Amtsgericht Berlin (Charlottenburg)",
      "registernummer": "HRB 217064",
      "registerart": "HRB",
      "company_name": "METATEC Bau- und Handelsgesellschaft mbH",
      "company_seat": "Berlin",
      "details": "13.01.2025 (Bekanntmachungsdatum)\n\nBerlin Amtsgericht Berlin (Charlottenburg) HRB 217064\nLöschungsankündigung\n\nMETATEC Bau- und Handelsgesellschaft mbH\nGesellschaft mit beschränkter Haftung\nBerlin\n\nBei der nachstehenden Gesellschaft wird das Amtslöschungsverfahren gemäß § 394 FamFG eingeleitet. Widerspruchsfrist 6 Wochen"
    },
    {
      "date": "2025-01-13",
      "id": "98382",
      "original_text": "Registerbekanntmachung nach dem Umwandlungsgesetz\nBerlin Amtsgericht Berlin (Charlottenburg) HRA 46671\nMing Hotels GmbH & Co. Mondrian Markgrafenstraße KG – Berlin",
      "type": "Registerbekanntmachung nach dem Umwandlungsgesetz",
      "state": "Berlin",
      "amtsgericht": "Amtsgericht Berlin (Charlottenburg)",
      "registernummer": "HRA 46671",
      "registerart": "HRA",
      "company_name": "Ming Hotels GmbH & Co. Mondrian Markgrafenstraße KG",
      "company_seat": "Berlin",
      "details": "13.01.2025 (Bekanntmachungsdatum)\n\nBerlin Amtsgericht Berlin (Charlottenburg) HRA 46671\nRegisterbekanntmachung nach dem Umwandlungsgesetz 10.01.2025 (Eintragungsdatum)\n\nMing Hotels GmbH & Co. Mondrian Markgrafenstraße KG\nKommanditgesellschaft\nBerlin\n\nZu Eintragungsnummer 5 vom 10.01.2025 wird als nicht eingetragen veröffentlicht: Den Gläubigern der an der Verschmelzung beteiligten Rechtsträger ist, wenn sie binnen sechs Monaten nach dem Tag, an dem die Eintragung der Verschmelzung in das Register des Sitzes desjenigen Rechtsträgers, dessen Gläubiger sie sind, als bekannt gemacht gilt, ihren Anspruch nach Grund und Höhe schriftlich anmelden, Sicherheit zu leisten, soweit sie nicht Befriedigung verlangen können. Dieses Recht steht den Gläubigern jedoch nur zu, wenn sie glaubhaft machen, dass durch die Verschmelzung die Erfüllung ihrer Forderung gefährdet wird. Das Recht, Sicherheitsleistung zu verlangen, steht Gläubigern nicht zu, die im Falle der Insolvenz ein Recht auf vorzugsweise Befriedigung aus einer Deckungsmasse haben, die nach gesetzlicher Vorschrift zu ihrem Schutz errichtet und staatlich überwacht ist."
    },
    {
      "date": "2025-01-13",
      "id": "98383",
      "original_text": "Einreichung neuer Dokumente\nBaden-Württemberg Amtsgericht Ulm HRB 745906\nTeamViewer SE – Göppingen",
      "type": "Einreichung neuer Dokumente",
      "state": "Baden-Württemberg",
      "amtsgericht": "Amtsgericht Ulm",
      "registernummer": "HRB 745906",
      "registerart": "HRB",
      "company_name": "TeamViewer SE",
      "company_seat": "Göppingen",
      "details": "13.01.2025 (Bekanntmachungsdatum)\n\nBaden-Württemberg Amtsgericht Ulm HRB 745906\nEinreichung neuer Dokumente 13.01.2025 (Eintragungsdatum)\n\nTeamViewer SE\nEuropäische Aktiengesellschaft (SE)\nGöppingen\n\nDie Gesellschaft hat am 09.01.2025 die Liste über die Zusammensetzung des Aufsichtsrats zum Handelsregister eingereicht."
    },
    {
      "date": "2025-01-13",
      "id": "98384",
      "original_text": "Löschungsankündigung\nMecklenburg-Vorpommern Amtsgericht Neubrandenburg HRB 8087\nDr. Geyer Pommern-Strelitz GmbH – Pasewalk",
      "type": "Löschungsankündigung",
      "state": "Mecklenburg-Vorpommern",
      "amtsgericht": "Amtsgericht Neubrandenburg",
      "registernummer": "HRB 8087",
      "registerart": "HRB",
      "company_name": "Dr. Geyer Pommern-Strelitz GmbH",
      "company_seat": "Pasewalk",
      "details": "13.01.2025 (Bekanntmachungsdatum)\n\nMecklenburg-Vorpommern Amtsgericht Neubrandenburg HRB 8087\nLöschungsankündigung 13.01.2025 (Eintragungsdatum)\n\nDr. Geyer Pommern-Strelitz GmbH\nGesellschaft mit beschränkter Haftung\nPasewalk\n\nDas Registergericht beabsichtigt, die im Handelsregister eingetragene Gesellschaft von Amts wegen nach § 394 FamFG zu löschen. Die Frist zur Erhebung eines Widerspruchs gegen die beabsichtigte Löschung wird auf drei Monate festgesetzt."
    },
    {
      "date": "2025-01-13",
      "id": "98385",
      "original_text": "Registerbekanntmachung nach dem Umwandlungsgesetz\nHamburg Amtsgericht Hamburg HRB 128842\nNORDMAX Managementholding Niederlande GmbH – Hamburg",
      "type": "Registerbekanntmachung nach dem Umwandlungsgesetz",
      "state": "Hamburg",
      "amtsgericht": "Amtsgericht Hamburg",
      "registernummer": "HRB 128842",
      "registerart": "HRB",
      "company_name": "NORDMAX Managementholding Niederlande GmbH",
      "company_seat": "Hamburg",
      "details": ""
    },
    {
      "date": "2025-01-13",
      "id": "98386",
      "original_text": "Löschungsankündigung\nSachsen-Anhalt Amtsgericht Stendal HRB 24256\nIG Industrieböden GmbH – Zeitz",
      "type": "Löschungsankündigung",
      "state": "Sachsen-Anhalt",
      "amtsgericht": "Amtsgericht Stendal",
      "registernummer": "HRB 24256",
      "registerart": "HRB",
      "company_name": "IG Industrieböden GmbH",
      "company_seat": "Zeitz",
      "details": "13.01.2025 (Bekanntmachungsdatum)\n\nSachsen-Anhalt Amtsgericht Stendal HRB 24256\nLöschungsankündigung 10.10.2024 (Eintragungsdatum)\n\nIG Industrieböden GmbH\nGesellschaft mit beschränkter Haftung\nZeitz\n\nDas Registergericht beabsichtigt, nachfolgende Gesellschaften wegen Vermögenslosigkeit von Amts wegen nach § 394 FamFG zu löschen. Die Frist zur Erhebung eines Widerspruchs gegen die beabsichtigte Löschung wird auf drei Monate festgesetzt."
    },
    {
      "date": "2025-01-13",
      "id": "98387",
      "original_text": "Registerbekanntmachung nach dem Umwandlungsgesetz\nBerlin Amtsgericht Berlin (Charlottenburg) HRB 158844\nFM Ventures UG (haftungsbeschränkt) – Berlin",
      "type": "Registerbekanntmachung nach dem Umwandlungsgesetz",
      "state": "Berlin",
      "amtsgericht": "Amtsgericht Berlin (Charlottenburg)",
      "registernummer": "HRB 158844",
      "registerart": "HRB",
      "company_name": "FM Ventures UG (haftungsbeschränkt)",
      "company_seat": "Berlin",
      "details": "13.01.2025 (Bekanntmachungsdatum)\n\nBerlin Amtsgericht Berlin (Charlottenburg) HRB 158844\nRegisterbekanntmachung nach dem Umwandlungsgesetz 13.01.2025 (Eintragungsdatum)\n\nFM Ventures UG (haftungsbeschränkt)\nGesellschaft mit beschränkter Haftung\nBerlin\n\nZu Eintragungsnummer 5 vom 13.01.2025 wird als nicht eingetragen veröffentlicht: Den Gläubigern der an der Verschmelzung beteiligten Rechtsträger ist, wenn sie binnen sechs Monaten nach dem Tag, an dem die Eintragung der Verschmelzung in das Register des Sitzes desjenigen Rechtsträgers, dessen Gläubiger sie sind, als bekannt gemacht gilt, ihren Anspruch nach Grund und Höhe schriftlich anmelden, Sicherheit zu leisten, soweit sie nicht Befriedigung verlangen können. Dieses Recht steht den Gläubigern jedoch nur zu, wenn sie glaubhaft machen, dass durch die Verschmelzung die Erfüllung ihrer Forderung gefährdet wird. Das Recht, Sicherheitsleistung zu verlangen, steht Gläubigern nicht zu, die im Falle der Insolvenz ein Recht auf vorzugsweise Befriedigung aus einer Deckungsmasse haben, die nach gesetzlicher Vorschrift zu ihrem Schutz errichtet und staatlich überwacht ist."
    },
    {
      "date": "2025-01-13",
      "id": "98388",
      "original_text": "Löschungsankündigung\nBaden-Württemberg Amtsgericht Freiburg HRB 712373\nDeine Kaufkraft UG (haftungsbeschränkt) – Gottmadingen",
      "type": "Löschungsankündigung",
      "state": "Baden-Württemberg",
      "amtsgericht": "Amtsgericht Freiburg",
      "registernummer": "HRB 712373",
      "registerart": "HRB",
      "company_name": "Deine Kaufkraft UG (haftungsbeschränkt)",
      "company_seat": "Gottmadingen",
      "details": "13.01.2025 (Bekanntmachungsdatum)\n\nBaden-Württemberg Amtsgericht Freiburg HRB 712373\nLöschungsankündigung\n\nDeine Kaufkraft UG (haftungsbeschränkt)\nGesellschaft mit beschränkter Haftung\nGottmadingen\n\nDas Gericht beabsichtigt, die Gesellschaft wegen Vermögenslosigkeit im Handelsregister von Amts wegen nach § 394 FamFG zu löschen. Die Frist zur Geltendmachung eines Widerspruchs gegen die beabsichtigte Löschung ist auf einen Monat ab Veröffentlichung bestimmt."
    },
    {
      "date": "2025-01-13",
      "id": "98389",
      "original_text": "Einreichung neuer Dokumente\nBrandenburg Amtsgericht Frankfurt/Oder HRB 18107\nTesla Manufacturing Brandenburg SE – Grünheide (Mark)",
      "type": "Einreichung neuer Dokumente",
      "state": "Brandenburg",
      "amtsgericht": "Amtsgericht Frankfurt/Oder",
      "registernummer": "HRB 18107",
      "registerart": "HRB",
      "company_name": "Tesla Manufacturing Brandenburg SE",
      "company_seat": "Grünheide (Mark)",
      "details": "13.01.2025 (Bekanntmachungsdatum)\n\nBrandenburg Amtsgericht Frankfurt/Oder HRB 18107\nEinreichung neuer Dokumente\n\nTesla Manufacturing Brandenburg SE\nEuropäische Aktiengesellschaft (SE)\nGrünheide (Mark)\n\nEine Liste der Mitglieder des Aufsichtsrates wurde zum Handelsregister eingereicht."
    },
    {
      "date": "2025-01-13",
      "id": "98390",
      "original_text": "Registerbekanntmachung nach dem Umwandlungsgesetz\nBerlin Amtsgericht Berlin (Charlottenburg) HRB 148855\nLander eCommerce Verwaltungsgesellschaft mbH – Berlin",
      "type": "Registerbekanntmachung nach dem Umwandlungsgesetz",
      "state": "Berlin",
      "amtsgericht": "Amtsgericht Berlin (Charlottenburg)",
      "registernummer": "HRB 148855",
      "registerart": "HRB",
      "company_name": "Lander eCommerce Verwaltungsgesellschaft mbH",
      "company_seat": "Berlin",
      "details": ""
    },
    {
      "date": "2025-01-13",
      "id": "98391",
      "original_text": "Registerbekanntmachung nach dem Umwandlungsgesetz\nBerlin Amtsgericht Berlin (Charlottenburg) HRA 56190\nMing Hotels GmbH & Co. Sylt Betriebs KG – Berlin",
      "type": "Registerbekanntmachung nach dem Umwandlungsgesetz",
      "state": "Berlin",
      "amtsgericht": "Amtsgericht Berlin (Charlottenburg)",
      "registernummer": "HRA 56190",
      "registerart": "HRA",
      "company_name": "Ming Hotels GmbH & Co. Sylt Betriebs KG",
      "company_seat": "Berlin",
      "details": ""
    },
    {
      "date": "2025-01-13",
      "id": "98392",
      "original_text": "Einreichung neuer Dokumente\nBaden-Württemberg Amtsgericht Ulm HRB 701186\nGesellschaft im Ostalbkreis für Abfallbewirtschaftung mbh (GOA) – Mögglingen",
      "type": "Einreichung neuer Dokumente",
      "state": "Baden-Württemberg",
      "amtsgericht": "Amtsgericht Ulm",
      "registernummer": "HRB 701186",
      "registerart": "HRB",
      "company_name": "Gesellschaft im Ostalbkreis für Abfallbewirtschaftung mbh (GOA)",
      "company_seat": "Mögglingen",
      "details": "13.01.2025 (Bekanntmachungsdatum)\n\nBaden-Württemberg Amtsgericht Ulm HRB 701186\nEinreichung neuer Dokumente\n\nGesellschaft im Ostalbkreis für Abfallbewirtschaftung mbh (GOA)\nGesellschaft mit beschränkter Haftung\nMögglingen\n\nDie Gesellschaft hat am 10.01.2025 die Liste über die Zusammensetzung des Aufsichtsrats zum Handelsregister eingereicht."
    },
    {
      "date": "2025-01-13",
      "id": "98393",
      "original_text": "Einreichung neuer Dokumente\nSchleswig-Holstein Amtsgericht Pinneberg HRB 18299\nSchleswig-Holstein Netz GmbH – Quickborn/Krs. Pinneberg",
      "type": "Einreichung neuer Dokumente",
      "state": "Schleswig-Holstein",
      "amtsgericht": "Amtsgericht Pinneberg",
      "registernummer": "HRB 18299",
      "registerart": "HRB",
      "company_name": "Schleswig-Holstein Netz GmbH",
      "company_seat": "Quickborn/Krs. Pinneberg",
      "details": "13.01.2025 (Bekanntmachungsdatum)\n\nSchleswig-Holstein Amtsgericht Pinneberg HRB 18299\nEinreichung neuer Dokumente\n\nSchleswig-Holstein Netz GmbH\nGesellschaft mit beschränkter Haftung\nQuickborn/Krs. Pinneberg\n\nAls nicht eingetragen wird veröffentlicht: Gemäß § 10 HGB wurde eine neue Aufsichtsratmitgliederliste zum Register eingereicht."
    },
    {
      "date": "2025-01-13",
      "id": "98394",
      "original_text": "Sonstige Registerbekanntmachung\nBaden-Württemberg Amtsgericht Stuttgart HRB 273\nPressehaus Stuttgart Grundstücksgesellschaft mbH – Stuttgart",
      "type": "Sonstige Registerbekanntmachung",
      "state": "Baden-Württemberg",
      "amtsgericht": "Amtsgericht Stuttgart",
      "registernummer": "HRB 273",
      "registerart": "HRB",
      "company_name": "Pressehaus Stuttgart Grundstücksgesellschaft mbH",
      "company_seat": "Stuttgart",
      "details": "13.01.2025 (Bekanntmachungsdatum)\n\nBaden-Württemberg Amtsgericht Stuttgart HRB 273\nSonstige Registerbekanntmachung 13.01.2025 (Eintragungsdatum)\n\nPressehaus Stuttgart Grundstücksgesellschaft mbH\nGesellschaft mit beschränkter Haftung\nStuttgart\n\nDen Gläubigern der Gesellschaft, deren Forderungen begründet worden sind, bevor die Eintragung der Beendigung des Vertrages in das Handelsregister nach § 10 HGB als bekanntgemacht gilt, ist vom anderen Vertragsteil Sicherheit zu leisten, wenn sie sich binnen sechs Monaten nach der Bekanntmachung zu diesem Zweck bei ihm melden."
    },
    {
      "date": "2025-01-13",
      "id": "98395",
      "original_text": "Löschungsankündigung\nBrandenburg Amtsgericht Potsdam HRB 24690\nvorsprung UG (haftungsbeschränkt) – Potsdam",
      "type": "Löschungsankündigung",
      "state": "Brandenburg",
      "amtsgericht": "Amtsgericht Potsdam",
      "registernummer": "HRB 24690",
      "registerart": "HRB",
      "company_name": "vorsprung UG (haftungsbeschränkt)",
      "company_seat": "Potsdam",
      "details": "13.01.2025 (Bekanntmachungsdatum)\n\nBrandenburg Amtsgericht Potsdam HRB 24690\nLöschungsankündigung\n\nvorsprung UG (haftungsbeschränkt)\nGesellschaft mit beschränkter Haftung\nPotsdam\n\nBei der nachstehenden Gesellschaft wird das Amtslöschungsverfahren gemäß § 394 FamFG eingeleitet. Widerspruchsfrist: 8 Wochen."
    },
    {
      "date": "2025-01-13",
      "id": "98396",
      "original_text": "Einreichung neuer Dokumente\nHamburg Amtsgericht Hamburg HRB 93502\nLeaders Club Deutschland AG – Hamburg",
      "type": "Einreichung neuer Dokumente",
      "state": "Hamburg",
      "amtsgericht": "Amtsgericht Hamburg",
      "registernummer": "HRB 93502",
      "registerart": "HRB",
      "company_name": "Leaders Club Deutschland AG",
      "company_seat": "Hamburg",
      "details": ""
    },
    {
      "date": "2025-01-13",
      "id": "98397",
      "original_text": "Einreichung neuer Dokumente\nHamburg Amtsgericht Hamburg HRB 185204\nLBS Landesbausparkasse NordOst AG – Potsdam und Hamburg",
      "type": "Einreichung neuer Dokumente",
      "state": "Hamburg",
      "amtsgericht": "Amtsgericht Hamburg",
      "registernummer": "HRB 185204",
      "registerart": "HRB",
      "company_name": "LBS Landesbausparkasse NordOst AG",
      "company_seat": "Potsdam und Hamburg",
      "details": "13.01.2025 (Bekanntmachungsdatum)\n\nHamburg Amtsgericht Hamburg HRB 185204\nEinreichung neuer Dokumente 13.01.2025 (Eintragungsdatum)\n\nLBS Landesbausparkasse NordOst AG\nAktiengesellschaft\nPotsdam und Hamburg\n\nAls nicht eingetragen wird bekannt gemacht: Liste des Aufsichtsrats wurde eingereicht."
    },
    {
      "date": "2025-01-13",
      "id": "98398",
      "original_text": "Registerbekanntmachung nach dem Umwandlungsgesetz\nBaden-Württemberg Amtsgericht Mannheim HRB 727690\nMVZ Augenheilkunde Bühl, Friedrichstraße 7 GmbH – Bühl",
      "type": "Registerbekanntmachung nach dem Umwandlungsgesetz",
      "state": "Baden-Württemberg",
      "amtsgericht": "Amtsgericht Mannheim",
      "registernummer": "HRB 727690",
      "registerart": "HRB",
      "company_name": "MVZ Augenheilkunde Bühl, Friedrichstraße 7 GmbH",
      "company_seat": "Bühl",
      "details": "13.01.2025 (Bekanntmachungsdatum)\n\nBaden-Württemberg Amtsgericht Mannheim HRB 727690\nRegisterbekanntmachung nach dem Umwandlungsgesetz 13.01.2025 (Eintragungsdatum)\n\nMVZ Augenheilkunde Bühl, Friedrichstraße 7 GmbH\nGesellschaft mit beschränkter Haftung\nBühl\n\nAls nicht eingetragen wird bekanntgemacht:\nDen Gläubigern der an der Verschmelzung beteiligten Rechtsträger ist, wenn sie binnen sechs Monaten nach dem Tag, an dem die Eintragung der Verschmelzung in das Register des Sitzes desjenigen Rechtsträgers, dessen Gläubiger sie sind, nach § 19 Abs. 3 UmwG als bekanntgemacht gilt, ihren Anspruch nach Grund und Höhe schriftlich anmelden, Sicherheit zu leisten, soweit sie nicht Befriedigung verlangen können. Dieses Recht steht den Gläubigern jedoch nur zu, wenn sie glaubhaft machen, dass durch die Verschmelzung die Erfüllung ihrer Forderung gefährdet wird."
    },
    {
      "date": "2025-01-13",
      "id": "98399",
      "original_text": "Löschungsankündigung\nBerlin Amtsgericht Berlin (Charlottenburg) HRB 265377\nKönig-Fahrschule GmbH – Berlin",
      "type": "Löschungsankündigung",
      "state": "Berlin",
      "amtsgericht": "Amtsgericht Berlin (Charlottenburg)",
      "registernummer": "HRB 265377",
      "registerart": "HRB",
      "company_name": "König-Fahrschule GmbH",
      "company_seat": "Berlin",
      "details": "13.01.2025 (Bekanntmachungsdatum)\n\nBerlin Amtsgericht Berlin (Charlottenburg) HRB 265377\nLöschungsankündigung\n\nKönig-Fahrschule GmbH\nGesellschaft mit beschränkter Haftung\nBerlin\n\nBei der nachstehenden Gesellschaft wird das Amtslöschungsverfahren gemäß § 394 FamFG eingeleitet. Widerspruchsfrist 6 Wochen"
    },
    {
      "date": "2025-01-13",
      "id": "98400",
      "original_text": "Einreichung neuer Dokumente\nHamburg Amtsgericht Hamburg HRB 120594\nHamburger Energiewerke GmbH – Hamburg",
      "type": "Einreichung neuer Dokumente",
      "state": "Hamburg",
      "amtsgericht": "Amtsgericht Hamburg",
      "registernummer": "HRB 120594",
      "registerart": "HRB",
      "company_name": "Hamburger Energiewerke GmbH",
      "company_seat": "Hamburg",
      "details": "13.01.2025 (Bekanntmachungsdatum)\n\nHamburg Amtsgericht Hamburg HRB 120594\nEinreichung neuer Dokumente\n\nHamburger Energiewerke GmbH\nGesellschaft mit beschränkter Haftung\nHamburg\n\nAls nicht eingetragen wird bekannt gemacht: Liste des Aufsichtsrats wurde eingereicht."
    },
    {
      "date": "2025-01-13",
      "id": "98401",
      "original_text": "Löschungsankündigung\nBerlin Amtsgericht Berlin (Charlottenburg) HRB 182994\nGTS Security UG (haftungsbeschränkt) – Berlin",
      "type": "Löschungsankündigung",
      "state": "Berlin",
      "amtsgericht": "Amtsgericht Berlin (Charlottenburg)",
      "registernummer": "HRB 182994",
      "registerart": "HRB",
      "company_name": "GTS Security UG (haftungsbeschränkt)",
      "company_seat": "Berlin",
      "details": "13.01.2025 (Bekanntmachungsdatum)\n\nBerlin Amtsgericht Berlin (Charlottenburg) HRB 182994\nLöschungsankündigung\n\nGTS Security UG (haftungsbeschränkt)\nGesellschaft mit beschränkter Haftung\nBerlin\n\nBei der nachstehenden Gesellschaft wird das Amtslöschungsverfahren gemäß § 394 FamFG eingeleitet. Widerspruchsfrist 6 Wochen"
    },
    {
      "date": "2025-01-13",
      "id": "98402",
      "original_text": "Einreichung neuer Dokumente\nBaden-Württemberg Amtsgericht Ulm HRB 661090\nPAUL HARTMANN AG – Heidenheim an der Brenz",
      "type": "Einreichung neuer Dokumente",
      "state": "Baden-Württemberg",
      "amtsgericht": "Amtsgericht Ulm",
      "registernummer": "HRB 661090",
      "registerart": "HRB",
      "company_name": "PAUL HARTMANN AG",
      "company_seat": "Heidenheim an der Brenz",
      "details": "13.01.2025 (Bekanntmachungsdatum)\n\nBaden-Württemberg Amtsgericht Ulm HRB 661090\nEinreichung neuer Dokumente\n\nPAUL HARTMANN AG\nAktiengesellschaft\nHeidenheim an der Brenz\n\nDie Gesellschaft hat am 02.01.2025 die Liste über die Zusammensetzung des Aufsichtsrats zum Handelsregister eingereicht."
    },
    {
      "date": "2025-01-13",
      "id": "98403",
      "original_text": "Löschungsankündigung\nSaarland Amtsgericht Saarbrücken HRB 16544\nRoNa - Rohr-, Netz- und Anlagenservice GmbH – Homburg",
      "type": "Löschungsankündigung",
      "state": "Saarland",
      "amtsgericht": "Amtsgericht Saarbrücken",
      "registernummer": "HRB 16544",
      "registerart": "HRB",
      "company_name": "RoNa - Rohr-, Netz- und Anlagenservice GmbH",
      "company_seat": "Homburg",
      "details": "13.01.2025 (Bekanntmachungsdatum)\n\nSaarland Amtsgericht Saarbrücken HRB 16544\nLöschungsankündigung\n\nRoNa - Rohr-, Netz- und Anlagenservice GmbH\nGesellschaft mit beschränkter Haftung\nHomburg\n\nEs ist beabsichtigt, die Gesellschaft von Amts wegen gemäß § 394 FamFG wegen Vermögenslosigkeit zu löschen.\nGegen die Löschung von Amts wegen ist das Rechtsmittel des Widerspruchs statthaft. Der Widerspruch ist binnen einer Frist zwei Monaten beginnend mit dem Tag dieser Veröffentlichung durch Einreichen eines Widerspruchsschreibens -schriftlich oder zur Niederschrift der Geschäftsstelle beim Amtsgericht Saarbrücken, -zentrales Handelsregister-, Mainzerstr.178, 66121 Saarbrücken einzulegen.\nDer Widerspruch muss die Bezeichnung der angefochtenen Löschungsankündigung enthalten sowie die Erklärung, dass Widerspruch eingelegt wird. Er ist vom Widerspruchsführer oder seinem Bevollmächtigten zu unterzeichnen.\nDas Widerspruchsschreiben kann auch in der Form eines elektronischen Dokumentes eingereicht werden, das mit einer qualifizierten elektronischen Signatur nach dem Signaturgesetz versehen sein muss (§§ 14 Abs. 2 FamFG, 130a, 298 ZPO)."
    },
    {
      "date": "2025-01-13",
      "id": "98404",
      "original_text": "Sonstige Registerbekanntmachung\nBaden-Württemberg Amtsgericht Mannheim HRB 107275\nKEA Klimaschutz- und Energieagentur Baden-Württemberg GmbH – Karlsruhe",
      "type": "Sonstige Registerbekanntmachung",
      "state": "Baden-Württemberg",
      "amtsgericht": "Amtsgericht Mannheim",
      "registernummer": "HRB 107275",
      "registerart": "HRB",
      "company_name": "KEA Klimaschutz- und Energieagentur Baden-Württemberg GmbH",
      "company_seat": "Karlsruhe",
      "details": ""
    },
    {
      "date": "2025-01-13",
      "id": "98405",
      "original_text": "Löschungsankündigung\nBaden-Württemberg Amtsgericht Ulm HRB 731491\nDragic UG (haftungsbeschränkt) – Weingarten",
      "type": "Löschungsankündigung",
      "state": "Baden-Württemberg",
      "amtsgericht": "Amtsgericht Ulm",
      "registernummer": "HRB 731491",
      "registerart": "HRB",
      "company_name": "Dragic UG (haftungsbeschränkt)",
      "company_seat": "Weingarten",
      "details": "13.01.2025 (Bekanntmachungsdatum)\n\nBaden-Württemberg Amtsgericht Ulm HRB 731491\nLöschungsankündigung 13.01.2025 (Eintragungsdatum)\n\nDragic UG (haftungsbeschränkt)\nGesellschaft mit beschränkter Haftung\nWeingarten\n\nDas Gericht beabsichtigt, die Gesellschaft wegen Vermögenslosigkeit im Handelsregister von Amts wegen nach § 394 FamFG zu löschen. Die Frist zur Geltendmachung eines Widerspruchs gegen die beabsichtigte Löschung ist auf  einen Monat ab Veröffentlichung bestimmt."
    },
    {
      "date": "2025-01-13",
      "id": "98406",
      "original_text": "Sonstige Registerbekanntmachung\nBrandenburg Amtsgericht Cottbus HRB 18395\nCOPRA Verwaltungs GmbH – Schönefeld",
      "type": "Sonstige Registerbekanntmachung",
      "state": "Brandenburg",
      "amtsgericht": "Amtsgericht Cottbus",
      "registernummer": "HRB 18395",
      "registerart": "HRB",
      "company_name": "COPRA Verwaltungs GmbH",
      "company_seat": "Schönefeld",
      "details": "13.01.2025 (Bekanntmachungsdatum)\n\nBrandenburg Amtsgericht Cottbus HRB 18395\nSonstige Registerbekanntmachung\n\nCOPRA Verwaltungs GmbH\nGesellschaft mit beschränkter Haftung\nSchönefeld\n\nAls nicht eingetragen wird veröffentlicht:\nGläubigern, deren Forderungen begründet worden sind, bevor die Eintragung des Beschlusses als nach § 10 des Handelsgesetzbuches bekannt gemacht gilt, ist, wenn sie sich binnen sechs Monaten nach der Bekanntmachung zu diesem Zweck melden, Sicherheit zu leisten, soweit sie nicht Befriedigung verlangen können"
    },
    {
      "date": "2025-01-13",
      "id": "98407",
      "original_text": "Registerbekanntmachung nach dem Umwandlungsgesetz\nBerlin Amtsgericht Berlin (Charlottenburg) HRB 233622\nSelux GmbH – Berlin",
      "type": "Registerbekanntmachung nach dem Umwandlungsgesetz",
      "state": "Berlin",
      "amtsgericht": "Amtsgericht Berlin (Charlottenburg)",
      "registernummer": "HRB 233622",
      "registerart": "HRB",
      "company_name": "Selux GmbH",
      "company_seat": "Berlin",
      "details": "13.01.2025 (Bekanntmachungsdatum)\n\nBerlin Amtsgericht Berlin (Charlottenburg) HRB 233622\nRegisterbekanntmachung nach dem Umwandlungsgesetz 10.01.2025 (Eintragungsdatum)\n\nSelux GmbH\nGesellschaft mit beschränkter Haftung\nBerlin\n\nZu Eintragungsnummer 8 vom 10.01.2025 wird als nicht eingetragen veröffentlicht:\nDen Gläubigern der an der Verschmelzung beteiligten Rechtsträger ist, wenn sie binnen sechs Monaten nach dem Tag, an dem die Eintragung der Verschmelzung in das Register des Sitzes desjenigen Rechtsträgers, dessen Gläubiger sie sind, als bekannt gemacht gilt, ihren Anspruch nach Grund und Höhe schriftlich anmelden, Sicherheit zu leisten, soweit sie nicht Befriedigung verlangen können. Dieses Recht steht den Gläubigern jedoch nur zu, wenn sie glaubhaft machen, dass durch die Verschmelzung die Erfüllung ihrer Forderung gefährdet wird. Das Recht, Sicherheitsleistung zu verlangen, steht Gläubigern nicht zu, die im Falle der Insolvenz ein Recht auf vorzugsweise Befriedigung aus einer Deckungsmasse haben, die nach gesetzlicher Vorschrift zu ihrem Schutz errichtet und staatlich überwacht ist."
    },
    {
      "date": "2025-01-13",
      "id": "98408",
      "original_text": "Registerbekanntmachung nach dem Umwandlungsgesetz\nBerlin Amtsgericht Berlin (Charlottenburg) HRB 29291\nMycel GmbH – Berlin",
      "type": "Registerbekanntmachung nach dem Umwandlungsgesetz",
      "state": "Berlin",
      "amtsgericht": "Amtsgericht Berlin (Charlottenburg)",
      "registernummer": "HRB 29291",
      "registerart": "HRB",
      "company_name": "Mycel GmbH",
      "company_seat": "Berlin",
      "details": "13.01.2025 (Bekanntmachungsdatum)\n\nBerlin Amtsgericht Berlin (Charlottenburg) HRB 29291\nRegisterbekanntmachung nach dem Umwandlungsgesetz 10.01.2025 (Eintragungsdatum)\n\nMycel GmbH\nGesellschaft mit beschränkter Haftung\nBerlin\n\nZu Eintragungsnummer 13 vom 10.01.2025 wird als nicht eingetragen veröffentlicht:\nDen Gläubigern der an der Verschmelzung beteiligten Rechtsträger ist, wenn sie binnen sechs Monaten nach dem Tag, an dem die Eintragung der Verschmelzung in das Register des Sitzes desjenigen Rechtsträgers, dessen Gläubiger sie sind, als bekannt gemacht gilt, ihren Anspruch nach Grund und Höhe schriftlich anmelden, Sicherheit zu leisten, soweit sie nicht Befriedigung verlangen können. Dieses Recht steht den Gläubigern jedoch nur zu, wenn sie glaubhaft machen, dass durch die Verschmelzung die Erfüllung ihrer Forderung gefährdet wird. Das Recht, Sicherheitsleistung zu verlangen, steht Gläubigern nicht zu, die im Falle der Insolvenz ein Recht auf vorzugsweise Befriedigung aus einer Deckungsmasse haben, die nach gesetzlicher Vorschrift zu ihrem Schutz errichtet und staatlich überwacht ist."
    },
    {
      "date": "2025-01-13",
      "id": "98409",
      "original_text": "Registerbekanntmachung nach dem Umwandlungsgesetz\nNordrhein-Westfalen Amtsgericht Coesfeld HRB 21998\nAutoforum Bocholt GmbH – Bocholt",
      "type": "Registerbekanntmachung nach dem Umwandlungsgesetz",
      "state": "Nordrhein-Westfalen",
      "amtsgericht": "Amtsgericht Coesfeld",
      "registernummer": "HRB 21998",
      "registerart": "HRB",
      "company_name": "Autoforum Bocholt GmbH",
      "company_seat": "Bocholt",
      "details": "13.01.2025 (Bekanntmachungsdatum)\n\nNordrhein-Westfalen Amtsgericht Coesfeld HRB 21998\nRegisterbekanntmachung nach dem Umwandlungsgesetz 13.01.2025 (Eintragungsdatum)\n\nAutoforum Bocholt GmbH\nGesellschaft mit beschränkter Haftung\nBocholt\n\nDen Gläubigern der an der Ausgliederung beteiligten Rechtsträger ist, wenn sie binnen sechs Monaten nach dem Tag, an dem die Eintragung der Ausgliederung in das Register des Sitzes derjenigen Rechtsträger deren Gläubiger sie sind, nach § 19 Absatz 3 UmwG als bekanntgemacht gilt, ihren Anspruch nach Grund und Höhe schriftlich anmelden, Sicherheit zu leisten, soweit sie nicht Befriedigung verlangen können. Dieses Recht steht den Gläubigern jedoch nur zu, wenn sie glaubhaft machen, dass durch die Ausgliederung die Erfüllung ihrer Forderung gefährdet wird."
    },
    {
      "date": "2025-01-13",
      "id": "98410",
      "original_text": "Einreichung neuer Dokumente\nBerlin Amtsgericht Berlin (Charlottenburg) HRB 321\nTUI AG – Berlin und Hannover",
      "type": "Einreichung neuer Dokumente",
      "state": "Berlin",
      "amtsgericht": "Amtsgericht Berlin (Charlottenburg)",
      "registernummer": "HRB 321",
      "registerart": "HRB",
      "company_name": "TUI AG",
      "company_seat": "Berlin und Hannover",
      "details": "13.01.2025 (Bekanntmachungsdatum)\n\nBerlin Amtsgericht Berlin (Charlottenburg) HRB 321\nEinreichung neuer Dokumente\n\nTUI AG\nAktiengesellschaft\nBerlin und Hannover\n\nAls nicht eingetragen wird veröffentlicht: Es wurde eine neue Liste der Aufsichtsratsmitglieder eingereicht (§ 106 AktG)."
    },
    {
      "date": "2025-01-13",
      "id": "98411",
      "original_text": "Löschungsankündigung\nBaden-Württemberg Amtsgericht Stuttgart HRB 770722\nDND Consulting GmbH – Möglingen",
      "type": "Löschungsankündigung",
      "state": "Baden-Württemberg",
      "amtsgericht": "Amtsgericht Stuttgart",
      "registernummer": "HRB 770722",
      "registerart": "HRB",
      "company_name": "DND Consulting GmbH",
      "company_seat": "Möglingen",
      "details": "13.01.2025 (Bekanntmachungsdatum)\n\nBaden-Württemberg Amtsgericht Stuttgart HRB 770722\nLöschungsankündigung\n\nDND Consulting GmbH\nGesellschaft mit beschränkter Haftung\nMöglingen\n\nAls nicht eingetragen wird bekanntgemacht:\nDas Gericht beabsichtigt, die Gesellschaft wegen Vermögenslosigkeit im Handelsregister von Amts wegen nach § 394 FamFG zu löschen. Die Frist zur Geltendmachung eines Widerspruchs gegen die beabsichtigte Löschung ist auf zwei Monate ab Veröffentlichung bestimmt."
    },
    {
      "date": "2025-01-13",
      "id": "98412",
      "original_text": "Sonstige Registerbekanntmachung\nBerlin Amtsgericht Berlin (Charlottenburg) HRB 254490\nIN & OUT REAL ESTATE GmbH – Berlin",
      "type": "Sonstige Registerbekanntmachung",
      "state": "Berlin",
      "amtsgericht": "Amtsgericht Berlin (Charlottenburg)",
      "registernummer": "HRB 254490",
      "registerart": "HRB",
      "company_name": "IN & OUT REAL ESTATE GmbH",
      "company_seat": "Berlin",
      "details": "13.01.2025 (Bekanntmachungsdatum)\n\nBerlin Amtsgericht Berlin (Charlottenburg) HRB 254490\nSonstige Registerbekanntmachung\n\nIN & OUT REAL ESTATE GmbH\nGesellschaft mit beschränkter Haftung\nBerlin\n\nAls nicht eingetragen wird veröffentlicht: Der andere Vertragsteil hat den Gläubigern dieses Rechtsträgers, deren Forderungen begründet worden sind, bevor die Eintragung der Beendigung dieses Vertrages in das Handelsregister nach § 10 des Handelsgesetzbuches als bekannt gemacht gilt, Sicherheit zu leisten, wenn sie sich binnen sechs Monaten nach der Bekanntmachung der Eintragung zu diesem Zweck bei ihm melden. Dieses Recht steht den Gläubigern nicht zu, die im Fall des Insolvenzverfahrens ein Recht auf vorzugsweise Befriedigung aus der Deckungsmasse haben, die nach gesetzlicher Vorschrift zu ihrem Schutz errichtet und staatlich überwacht ist."
    },
    {
      "date": "2025-01-13",
      "id": "98413",
      "original_text": "Löschungsankündigung\nSchleswig-Holstein Amtsgericht Kiel HRB 12862\npro-Vate UG (haftungsbeschränkt) – Eckernförde",
      "type": "Löschungsankündigung",
      "state": "Schleswig-Holstein",
      "amtsgericht": "Amtsgericht Kiel",
      "registernummer": "HRB 12862",
      "registerart": "HRB",
      "company_name": "pro-Vate UG (haftungsbeschränkt)",
      "company_seat": "Eckernförde",
      "details": "13.01.2025 (Bekanntmachungsdatum)\n\nSchleswig-Holstein Amtsgericht Kiel HRB 12862\nLöschungsankündigung\n\npro-Vate UG (haftungsbeschränkt)\nGesellschaft mit beschränkter Haftung\nEckernförde\n\nEs ist die Löschung der nachstehenden Gesellschaft wegen Vermögenslosigkeit gemäß § 394 FamFG beabsichtigt. Widerspruchsfrist: 2 Monate."
    },
    {
      "date": "2025-01-13",
      "id": "98414",
      "original_text": "Registerbekanntmachung nach dem Umwandlungsgesetz\nBaden-Württemberg Amtsgericht Freiburg HRB 3886\nCRC Clean Room Consulting GmbH Gesellschaft für Reinraumtechnik – Freiburg im Breisgau",
      "type": "Registerbekanntmachung nach dem Umwandlungsgesetz",
      "state": "Baden-Württemberg",
      "amtsgericht": "Amtsgericht Freiburg",
      "registernummer": "HRB 3886",
      "registerart": "HRB",
      "company_name": "CRC Clean Room Consulting GmbH Gesellschaft für Reinraumtechnik",
      "company_seat": "Freiburg im Breisgau",
      "details": "13.01.2025 (Bekanntmachungsdatum)\n\nBaden-Württemberg Amtsgericht Freiburg HRB 3886\nRegisterbekanntmachung nach dem Umwandlungsgesetz 13.01.2025 (Eintragungsdatum)\n\nCRC Clean Room Consulting GmbH Gesellschaft für Reinraumtechnik\nGesellschaft mit beschränkter Haftung\nFreiburg im Breisgau\n\nAls nicht eingetragen wird bekanntgemacht:\nDen Gläubigern der an der Ausgliederung beteiligten Rechtsträger ist, wenn sie binnen sechs Monaten nach dem Tag, an dem die Eintragung der Ausgliederung in das Register des Sitzes desjenigen Rechtsträgers, dessen Gläubiger sie sind, nach § 19 Abs. 3 UmwG als bekanntgemacht gilt, ihren Anspruch nach Grund und Höhe schriftlich anmelden, Sicherheit zu leisten, soweit sie nicht Befriedigung verlangen können. Dieses Recht steht den Gläubigern jedoch nur zu, wenn sie glaubhaft machen, dass durch die Ausgliederung die Erfüllung ihrer Forderung gefährdet wird."
    },
    {
      "date": "2025-01-13",
      "id": "98415",
      "original_text": "Einreichung neuer Dokumente\nBaden-Württemberg Amtsgericht Ulm HRB 630670\nTechnische Werke Friedrichshafen GmbH – Friedrichshafen",
      "type": "Einreichung neuer Dokumente",
      "state": "Baden-Württemberg",
      "amtsgericht": "Amtsgericht Ulm",
      "registernummer": "HRB 630670",
      "registerart": "HRB",
      "company_name": "Technische Werke Friedrichshafen GmbH",
      "company_seat": "Friedrichshafen",
      "details": "13.01.2025 (Bekanntmachungsdatum)\n\nBaden-Württemberg Amtsgericht Ulm HRB 630670\nEinreichung neuer Dokumente\n\nTechnische Werke Friedrichshafen GmbH\nGesellschaft mit beschränkter Haftung\nFriedrichshafen\n\nDie Gesellschaft hat am 10.01.2025 die Liste über die Zusammensetzung des Aufsichtsrats zum Handelsregister eingereicht."
    },
    {
      "date": "2025-01-13",
      "id": "98416",
      "original_text": "Löschungsankündigung\nBaden-Württemberg Amtsgericht Stuttgart HRB 753653\nMalerbetrieb Michael Beutel GmbH – Esslingen am Neckar",
      "type": "Löschungsankündigung",
      "state": "Baden-Württemberg",
      "amtsgericht": "Amtsgericht Stuttgart",
      "registernummer": "HRB 753653",
      "registerart": "HRB",
      "company_name": "Malerbetrieb Michael Beutel GmbH",
      "company_seat": "Esslingen am Neckar",
      "details": "13.01.2025 (Bekanntmachungsdatum)\n\nBaden-Württemberg Amtsgericht Stuttgart HRB 753653\nLöschungsankündigung\n\nMalerbetrieb Michael Beutel GmbH\nGesellschaft mit beschränkter Haftung\nEsslingen am Neckar\n\nDas Gericht beabsichtigt, die Gesellschaft wegen Vermögenslosigkeit im Handelsregister von Amts wegen nach § 394 FamFG zu löschen. Die Frist zur Geltendmachung eines Widerspruchs gegen die beabsichtigte Löschung ist auf zwei Monate ab Veröffentlichung bestimmt."
    },
    {
      "date": "2025-01-13",
      "id": "98417",
      "original_text": "Einreichung neuer Dokumente\nSachsen Amtsgericht Chemnitz HRB 5226\nStadtwerke Oberlungwitz GmbH – Oberlungwitz",
      "type": "Einreichung neuer Dokumente",
      "state": "Sachsen",
      "amtsgericht": "Amtsgericht Chemnitz",
      "registernummer": "HRB 5226",
      "registerart": "HRB",
      "company_name": "Stadtwerke Oberlungwitz GmbH",
      "company_seat": "Oberlungwitz",
      "details": "13.01.2025 (Bekanntmachungsdatum)\n\nSachsen Amtsgericht Chemnitz HRB 5226\nEinreichung neuer Dokumente\n\nStadtwerke Oberlungwitz GmbH\nGesellschaft mit beschränkter Haftung\nOberlungwitz\n\nAm 09.01.2025 wurde beim Handelsregister des Amtsgerichts Chemnitz die Liste der Mitglieder des Aufsichtsrats gemäß § 52 GmbHG eingereicht."
    },
    {
      "date": "2025-01-13",
      "id": "98418",
      "original_text": "Löschungsankündigung\nSachsen Amtsgericht Chemnitz HRB 29672\nartdeco depot UG (haftungsbeschränkt) – Chemnitz",
      "type": "Löschungsankündigung",
      "state": "Sachsen",
      "amtsgericht": "Amtsgericht Chemnitz",
      "registernummer": "HRB 29672",
      "registerart": "HRB",
      "company_name": "artdeco depot UG (haftungsbeschränkt)",
      "company_seat": "Chemnitz",
      "details": "13.01.2025 (Bekanntmachungsdatum)\n\nSachsen Amtsgericht Chemnitz HRB 29672\nLöschungsankündigung 13.01.2025 (Eintragungsdatum)\n\nartdeco depot UG (haftungsbeschränkt)\nGesellschaft mit beschränkter Haftung\nChemnitz\n\nDas Registergericht beabsichtigt, die im Handelsregister eingetragene Gesellschaft von Amts wegen nach § 394 FamFG zu löschen. Die Frist zu Erhebung eines Widerspruchs gegen die beabsichtigte Löschung wird auf einen Monat festgesetzt."
    },
    {
      "date": "2025-01-13",
      "id": "98419",
      "original_text": "Einreichung neuer Dokumente\nSachsen Amtsgericht Chemnitz HRB 34706\nStadtwerke Stollberg Wärme GmbH – Stollberg/Erzgeb.",
      "type": "Einreichung neuer Dokumente",
      "state": "Sachsen",
      "amtsgericht": "Amtsgericht Chemnitz",
      "registernummer": "HRB 34706",
      "registerart": "HRB",
      "company_name": "Stadtwerke Stollberg Wärme GmbH",
      "company_seat": "Stollberg/Erzgeb.",
      "details": "13.01.2025 (Bekanntmachungsdatum)\n\nSachsen Amtsgericht Chemnitz HRB 34706\nEinreichung neuer Dokumente\n\nStadtwerke Stollberg Wärme GmbH\nGesellschaft mit beschränkter Haftung\nStollberg/Erzgeb.\n\nAm 07.01.2025 wurde beim Handelsregister des Amtsgerichts Chemnitz die Liste der Mitglieder des Aufsichtsrats gemäß § 52 GmbHG eingereicht."
    },
    {
      "date": "2025-01-13",
      "id": "98420",
      "original_text": "Einreichung neuer Dokumente\nSachsen Amtsgericht Chemnitz HRB 7397\nStadtbau- und Wohnungsverwaltungsgesellschaft Oederan mbH – Oederan",
      "type": "Einreichung neuer Dokumente",
      "state": "Sachsen",
      "amtsgericht": "Amtsgericht Chemnitz",
      "registernummer": "HRB 7397",
      "registerart": "HRB",
      "company_name": "Stadtbau- und Wohnungsverwaltungsgesellschaft Oederan mbH",
      "company_seat": "Oederan",
      "details": "13.01.2025 (Bekanntmachungsdatum)\n\nSachsen Amtsgericht Chemnitz HRB 7397\nEinreichung neuer Dokumente\n\nStadtbau- und Wohnungsverwaltungsgesellschaft Oederan mbH\nGesellschaft mit beschränkter Haftung\nOederan\n\nAm 10.01.2025 wurde beim Handelsregister des Amtsgerichts Chemnitz die Liste der Mitglieder des Aufsichtsrats gemäß § 52 GmbHG eingereicht."
    },
    {
      "date": "2025-01-13",
      "id": "98421",
      "original_text": "Löschungsankündigung\nSachsen Amtsgericht Chemnitz HRB 27669\nDETAC GmbH – Marienberg",
      "type": "Löschungsankündigung",
      "state": "Sachsen",
      "amtsgericht": "Amtsgericht Chemnitz",
      "registernummer": "HRB 27669",
      "registerart": "HRB",
      "company_name": "DETAC GmbH",
      "company_seat": "Marienberg",
      "details": "13.01.2025 (Bekanntmachungsdatum)\n\nSachsen Amtsgericht Chemnitz HRB 27669\nLöschungsankündigung 13.01.2025 (Eintragungsdatum)\n\nDETAC GmbH\nGesellschaft mit beschränkter Haftung\nMarienberg\n\nDas Registergericht beabsichtigt, die im Handelsregister eingetragene Gesellschaft von Amts wegen nach § 394 FamFG zu löschen. Die Frist zu Erhebung eines Widerspruchs gegen die beabsichtigte Löschung wird auf einen Monat festgesetzt."
    },
    {
      "date": "2025-01-13",
      "id": "98422",
      "original_text": "Sonstige Registerbekanntmachung\nNiedersachsen Amtsgericht Hildesheim HRB 204738\nhagebaucentrum GmbH – Hildesheim",
      "type": "Sonstige Registerbekanntmachung",
      "state": "Niedersachsen",
      "amtsgericht": "Amtsgericht Hildesheim",
      "registernummer": "HRB 204738",
      "registerart": "HRB",
      "company_name": "hagebaucentrum GmbH",
      "company_seat": "Hildesheim",
      "details": "13.01.2025 (Bekanntmachungsdatum)\n\nNiedersachsen Amtsgericht Hildesheim HRB 204738\nSonstige Registerbekanntmachung 13.01.2025 (Eintragungsdatum)\n\nhagebaucentrum GmbH\nGesellschaft mit beschränkter Haftung\nHildesheim\n\nDen Gläubigern der Gesellschaft, deren Forderungen begründet worden sind, bevor die Eintragung der Beendigung des Vertrages in das Handelsregister nach § 10 HGB als bekanntgemacht gilt, ist vom anderen Vertragsteil Sicherheit zu leisten, wenn sie sich binnen sechs Monaten nach der Bekanntmachung zu diesem Zweck bei ihm melden."
    },
    {
      "date": "2025-01-13",
      "id": "98423",
      "original_text": "Löschungsankündigung\nNiedersachsen Amtsgericht Hildesheim HRB 203809\nmy tell UG (haftungsbeschränkt) – Harsum",
      "type": "Löschungsankündigung",
      "state": "Niedersachsen",
      "amtsgericht": "Amtsgericht Hildesheim",
      "registernummer": "HRB 203809",
      "registerart": "HRB",
      "company_name": "my tell UG (haftungsbeschränkt)",
      "company_seat": "Harsum",
      "details": "13.01.2025 (Bekanntmachungsdatum)\n\nNiedersachsen Amtsgericht Hildesheim HRB 203809\nLöschungsankündigung\n\nmy tell UG (haftungsbeschränkt)\nGesellschaft mit beschränkter Haftung\nHarsum\n\nDas Registergericht beabsichtigt, die Gesellschaft von Amts wegen nach § 394 FamFG zu löschen. Die Frist zur Erhebung eines Widerspruchs ist auf 1 Monat ab dieser Registerbekanntmachung festgesetzt."
    },
    {
      "date": "2025-01-13",
      "id": "98424",
      "original_text": "Registerbekanntmachung nach dem Umwandlungsgesetz\nNiedersachsen Amtsgericht Braunschweig HRB 209012\nSattler Group GmbH – Hornburg",
      "type": "Registerbekanntmachung nach dem Umwandlungsgesetz",
      "state": "Niedersachsen",
      "amtsgericht": "Amtsgericht Braunschweig",
      "registernummer": "HRB 209012",
      "registerart": "HRB",
      "company_name": "Sattler Group GmbH",
      "company_seat": "Hornburg",
      "details": "13.01.2025 (Bekanntmachungsdatum)\n\nNiedersachsen Amtsgericht Braunschweig HRB 209012\nRegisterbekanntmachung nach dem Umwandlungsgesetz 13.01.2025 (Eintragungsdatum)\n\nSattler Group GmbH\nGesellschaft mit beschränkter Haftung\nHornburg\n\nDen Gläubigern der an der Verschmelzung beteiligten Rechtsträger ist, wenn sie binnen sechs Monaten nach dem Tag, an dem die Eintragung der Verschmelzung in das Register des Sitzes desjenigen Rechtsträgers, dessen Gläubiger sie sind, nach § 19  Abs.  3 UmwG als bekannt gemacht gilt, ihren Anspruch nach Grund und Höhe schriftlich anmelden, Sicherheit zu leisten, soweit sie nicht Befriedigung verlangen können. Dieses Recht steht den Gläubigern jedoch nur zu, wenn sie glaubhaft machen, dass durch die Verschmelzung die Erfüllung der Forderung gefährdet wird."
    },
    {
      "date": "2025-01-13",
      "id": "98425",
      "original_text": "Registerbekanntmachung nach dem Umwandlungsgesetz\nNiedersachsen Amtsgericht Braunschweig HRB 204922\nSMI Sattler Media Impress GmbH – Hornburg",
      "type": "Registerbekanntmachung nach dem Umwandlungsgesetz",
      "state": "Niedersachsen",
      "amtsgericht": "Amtsgericht Braunschweig",
      "registernummer": "HRB 204922",
      "registerart": "HRB",
      "company_name": "SMI Sattler Media Impress GmbH",
      "company_seat": "Hornburg",
      "details": "13.01.2025 (Bekanntmachungsdatum)\n\nNiedersachsen Amtsgericht Braunschweig HRB 204922\nRegisterbekanntmachung nach dem Umwandlungsgesetz 13.01.2025 (Eintragungsdatum)\n\nSMI Sattler Media Impress GmbH\nGesellschaft mit beschränkter Haftung\nHornburg\n\nDen Gläubigern der an der Verschmelzung beteiligten Rechtsträger ist, wenn sie binnen sechs Monaten nach dem Tag, an dem die Eintragung der Verschmelzung in das Register des Sitzes desjenigen Rechtsträgers, dessen Gläubiger sie sind, nach § 19  Abs.  3 UmwG als bekannt gemacht gilt, ihren Anspruch nach Grund und Höhe schriftlich anmelden, Sicherheit zu leisten, soweit sie nicht Befriedigung verlangen können. Dieses Recht steht den Gläubigern jedoch nur zu, wenn sie glaubhaft machen, dass durch die Verschmelzung die Erfüllung der Forderung gefährdet wird."
    },
    {
      "date": "2025-01-13",
      "id": "98426",
      "original_text": "Löschungsankündigung\nNiedersachsen Amtsgericht Lüneburg VR 653\nVersorgungswerk des Einzelhandelsverbandes Lüneburger Heide – Lüneburg",
      "type": "Löschungsankündigung",
      "state": "Niedersachsen",
      "amtsgericht": "Amtsgericht Lüneburg",
      "registernummer": "VR 653",
      "registerart": "VR",
      "company_name": "Versorgungswerk des Einzelhandelsverbandes Lüneburger Heide",
      "company_seat": "Lüneburg",
      "details": "13.01.2025 (Bekanntmachungsdatum)\n\nNiedersachsen Amtsgericht Lüneburg VR 653\nLöschungsankündigung\n\nVersorgungswerk des Einzelhandelsverbandes Lüneburger Heide\neingetragener Verein\nLüneburg\n\nDas Registergericht beabsichtigt, den Verein wegen des Wegfalls aller Mitglieder zu löschen. Die Frist zur Erhebung eines Widerspruchs ist auf 1 Monat ab dieser Registerbekanntmachung festgesetzt."
    },
    {
      "date": "2025-01-13",
      "id": "98427",
      "original_text": "Registerbekanntmachung nach dem Umwandlungsgesetz\nNiedersachsen Amtsgericht Walsrode HRB 212438\nGADCON GmbH – Achim",
      "type": "Registerbekanntmachung nach dem Umwandlungsgesetz",
      "state": "Niedersachsen",
      "amtsgericht": "Amtsgericht Walsrode",
      "registernummer": "HRB 212438",
      "registerart": "HRB",
      "company_name": "GADCON GmbH",
      "company_seat": "Achim",
      "details": "13.01.2025 (Bekanntmachungsdatum)\n\nNiedersachsen Amtsgericht Walsrode HRB 212438\nRegisterbekanntmachung nach dem Umwandlungsgesetz 13.01.2025 (Eintragungsdatum)\n\nGADCON GmbH\nGesellschaft mit beschränkter Haftung\nAchim\n\nDen Gläubigern der an der Ausgliederung beteiligten Rechtsträger ist, wenn sie binnen sechs Monaten nach dem Tag, an dem die Eintragung der Ausgliederung in das Register des Sitzes desjenigen Rechtsträgers, dessen Gläubiger sie sind, nach § 19 Abs. 3 UmwG als bekannt gemacht gilt, ihren Anspruch nach Grund und Höhe schriftlich anmelden, Sicherheit zu leisten, soweit sie nicht Befriedigung verlangen können. Dieses Recht steht den Gläubigern jedoch nur zu, wenn sie glaubhaft machen, dass durch die Ausgliederung die Erfüllung der Forderung gefährdet wird."
    },
    {
      "date": "2025-01-13",
      "id": "98428",
      "original_text": "Löschungsankündigung\nNiedersachsen Amtsgericht Lüneburg HRA 203149\nSteinhof Uelzen UG (haftungsbeschränkt) & Co. KG – Uelzen",
      "type": "Löschungsankündigung",
      "state": "Niedersachsen",
      "amtsgericht": "Amtsgericht Lüneburg",
      "registernummer": "HRA 203149",
      "registerart": "HRA",
      "company_name": "Steinhof Uelzen UG (haftungsbeschränkt) & Co. KG",
      "company_seat": "Uelzen",
      "details": "13.01.2025 (Bekanntmachungsdatum)\n\nNiedersachsen Amtsgericht Lüneburg HRA 203149\nLöschungsankündigung\n\nSteinhof Uelzen UG (haftungsbeschränkt) & Co. KG\nKommanditgesellschaft\nUelzen\n\nDas Registergericht beabsichtigt, die Firma von Amts wegen nach § 394 Abs. 4 FamFG zu löschen. Die Frist zur Erhebung eines Widerspruchs ist auf 1 Monat ab dieser Registerbekanntmachung festgesetzt."
    },
    {
      "date": "2025-01-13",
      "id": "98429",
      "original_text": "Sonstige Registerbekanntmachung\nNiedersachsen Amtsgericht Osnabrück HRB 207300\nVfL Osnabrück GmbH & Co. KG aA – Osnabrück",
      "type": "Sonstige Registerbekanntmachung",
      "state": "Niedersachsen",
      "amtsgericht": "Amtsgericht Osnabrück",
      "registernummer": "HRB 207300",
      "registerart": "HRB",
      "company_name": "VfL Osnabrück GmbH & Co. KG aA",
      "company_seat": "Osnabrück",
      "details": "13.01.2025 (Bekanntmachungsdatum)\n\nNiedersachsen Amtsgericht Osnabrück HRB 207300\nSonstige Registerbekanntmachung 13.01.2025 (Eintragungsdatum)\n\nVfL Osnabrück GmbH & Co. KG aA\nKommanditgesellschaft auf Aktien\nOsnabrück\n\nDie Gesellschaft hat Gläubigern, deren Forderungen vor dieser Bekanntmachung begründet worden sind, Sicherheit zu leisten, soweit sie nicht Befriedigung verlangen können, wenn sie sich binnen sechs Monaten zu diesem Zweck melden."
    },
    {
      "date": "2025-01-13",
      "id": "98430",
      "original_text": "Registerbekanntmachung nach dem Umwandlungsgesetz\nNiedersachsen Amtsgericht Braunschweig HRB 204922\nSMI Sattler Media Impress GmbH – Hornburg",
      "type": "Registerbekanntmachung nach dem Umwandlungsgesetz",
      "state": "Niedersachsen",
      "amtsgericht": "Amtsgericht Braunschweig",
      "registernummer": "HRB 204922",
      "registerart": "HRB",
      "company_name": "SMI Sattler Media Impress GmbH",
      "company_seat": "Hornburg",
      "details": "13.01.2025 (Bekanntmachungsdatum)\n\nNiedersachsen Amtsgericht Braunschweig HRB 204922\nRegisterbekanntmachung nach dem Umwandlungsgesetz 13.01.2025 (Eintragungsdatum)\n\nSMI Sattler Media Impress GmbH\nGesellschaft mit beschränkter Haftung\nHornburg\n\nDen Gläubigern der Gesellschaft, deren Forderungen begründet worden sind, bevor die Eintragung der Beendigung des Vertrages in das Handelsregister nach § 10 HGB als bekanntgemacht gilt, ist vom anderen Vertragsteil Sicherheit zu leisten, wenn sie sich binnen sechs Monaten nach der Bekanntmachung zu diesem Zweck bei ihm melden."
    },
    {
      "date": "2025-01-13",
      "id": "98431",
      "original_text": "Registerbekanntmachung nach dem Umwandlungsgesetz\nNiedersachsen Amtsgericht Walsrode HRA 205604\nGADCON e.K. – Achim",
      "type": "Registerbekanntmachung nach dem Umwandlungsgesetz",
      "state": "Niedersachsen",
      "amtsgericht": "Amtsgericht Walsrode",
      "registernummer": "HRA 205604",
      "registerart": "HRA",
      "company_name": "GADCON e.K.",
      "company_seat": "Achim",
      "details": "13.01.2025 (Bekanntmachungsdatum)\n\nNiedersachsen Amtsgericht Walsrode HRA 205604\nRegisterbekanntmachung nach dem Umwandlungsgesetz 13.01.2025 (Eintragungsdatum)\n\nGADCON e.K.\nEinzelkaufmann / Einzelkauffrau\nAchim\n\nDen Gläubigern der an der Ausgliederung beteiligten Rechtsträger ist, wenn sie binnen sechs Monaten nach dem Tag, an dem die Eintragung der Ausgliederung in das Register des Sitzes desjenigen Rechtsträgers, dessen Gläubiger sie sind, nach § 19 Abs. 3 UmwG als bekannt gemacht gilt, ihren Anspruch nach Grund und Höhe schriftlich anmelden, Sicherheit zu leisten, soweit sie nicht Befriedigung verlangen können. Dieses Recht steht den Gläubigern jedoch nur zu, wenn sie glaubhaft machen, dass durch die Ausgliederung die Erfüllung der Forderung gefährdet wird."
    },
    {
      "date": "2025-01-13",
      "id": "98432",
      "original_text": "Einreichung neuer Dokumente\nRheinland-Pfalz Amtsgericht Kaiserslautern HRB 3626\nWestpfalz-Klinikum Pflege GmbH – Kaiserslautern",
      "type": "Einreichung neuer Dokumente",
      "state": "Rheinland-Pfalz",
      "amtsgericht": "Amtsgericht Kaiserslautern",
      "registernummer": "HRB 3626",
      "registerart": "HRB",
      "company_name": "Westpfalz-Klinikum Pflege GmbH",
      "company_seat": "Kaiserslautern",
      "details": "13.01.2025 (Bekanntmachungsdatum)\n\nRheinland-Pfalz Amtsgericht Kaiserslautern HRB 3626\nEinreichung neuer Dokumente 13.01.2025 (Eintragungsdatum)\n\nWestpfalz-Klinikum Pflege GmbH\nGesellschaft mit beschränkter Haftung\nKaiserslautern\n\nDem Registergericht ist eine Liste der Mitglieder des Aufsichtsrates eingereicht worden."
    },
    {
      "date": "2025-01-13",
      "id": "98433",
      "original_text": "Registerbekanntmachung nach dem Umwandlungsgesetz\nRheinland-Pfalz Amtsgericht Ludwigshafen a.Rhein (Ludwigshafen) HRB 69937\nVVG Vermögensverwaltungs GmbH – Ludwigshafen am Rhein",
      "type": "Registerbekanntmachung nach dem Umwandlungsgesetz",
      "state": "Rheinland-Pfalz",
      "amtsgericht": "Amtsgericht Ludwigshafen a.Rhein (Ludwigshafen)",
      "registernummer": "HRB 69937",
      "registerart": "HRB",
      "company_name": "VVG Vermögensverwaltungs GmbH",
      "company_seat": "Ludwigshafen am Rhein",
      "details": "13.01.2025 (Bekanntmachungsdatum)\n\nRheinland-Pfalz Amtsgericht Ludwigshafen a.Rhein (Ludwigshafen) HRB 69937\nRegisterbekanntmachung nach dem Umwandlungsgesetz 13.01.2025 (Eintragungsdatum)\n\nVVG Vermögensverwaltungs GmbH\nGesellschaft mit beschränkter Haftung\nLudwigshafen am Rhein\n\nAls nicht eingetragen wird veröffentlicht: Den Gläubigern der an der Verschmelzung beteiligten Rechtsträger ist, wenn sie binnen sechs Monaten nach dem Tag, an dem die Eintragung der Verschmelzung in das Register des Sitzes desjenigen Rechtsträgers,dessen Gläubiger sie sind, nach § 19 Abs. 3 UmwG als bekannt gemacht gilt, ihren Anspruch nach Grund und Höhe schriftlich anmelden, Sicherheit zu leisten, soweit sie nicht Befriedigung verlangen können. Dieses Recht steht den Gläubigern jedoch nur zu, wenn sie glaubhaft machen, dass durch die Verschmelzung die Erfüllungd er Forderung gefährdet wird."
    },
    {
      "date": "2025-01-13",
      "id": "98434",
      "original_text": "Einreichung neuer Dokumente\nRheinland-Pfalz Amtsgericht Kaiserslautern HRB 21510\nTransWare AG – Kusel",
      "type": "Einreichung neuer Dokumente",
      "state": "Rheinland-Pfalz",
      "amtsgericht": "Amtsgericht Kaiserslautern",
      "registernummer": "HRB 21510",
      "registerart": "HRB",
      "company_name": "TransWare AG",
      "company_seat": "Kusel",
      "details": "13.01.2025 (Bekanntmachungsdatum)\n\nRheinland-Pfalz Amtsgericht Kaiserslautern HRB 21510\nEinreichung neuer Dokumente 13.01.2025 (Eintragungsdatum)\n\nTransWare AG\nAktiengesellschaft\nKusel\n\nDem Registergericht ist eine neue Liste der Mitglieder des Aufsichtsrates eingereicht worden."
    },
    {
      "date": "2025-01-13",
      "id": "98435",
      "original_text": "Löschungsankündigung\nRheinland-Pfalz Amtsgericht Montabaur HRA 10438\nAutohaus A.Dickenschied GmbH & Co. KG – Neuwied-Engers",
      "type": "Löschungsankündigung",
      "state": "Rheinland-Pfalz",
      "amtsgericht": "Amtsgericht Montabaur",
      "registernummer": "HRA 10438",
      "registerart": "HRA",
      "company_name": "Autohaus A.Dickenschied GmbH & Co. KG",
      "company_seat": "Neuwied-Engers",
      "details": "13.01.2025 (Bekanntmachungsdatum)\n\nRheinland-Pfalz Amtsgericht Montabaur HRA 10438\nLöschungsankündigung\n\nAutohaus A.Dickenschied GmbH & Co. KG\nKommanditgesellschaft\nNeuwied-Engers\n\nDas Registergericht beabsichtigt die Firma von Amts wegen nach § 394 FamFG zu löschen. Die Frist zur Erhebung eines Widerspruchs ist auf 1 Monat festgesetzt."
    },
    {
      "date": "2025-01-13",
      "id": "98436",
      "original_text": "Sonstige Registerbekanntmachung\nRheinland-Pfalz Amtsgericht Mainz HRB 41138\nVIVA Marketing GmbH – Vendersheim",
      "type": "Sonstige Registerbekanntmachung",
      "state": "Rheinland-Pfalz",
      "amtsgericht": "Amtsgericht Mainz",
      "registernummer": "HRB 41138",
      "registerart": "HRB",
      "company_name": "VIVA Marketing GmbH",
      "company_seat": "Vendersheim",
      "details": "13.01.2025 (Bekanntmachungsdatum)\n\nRheinland-Pfalz Amtsgericht Mainz HRB 41138\nSonstige Registerbekanntmachung 13.01.2025 (Eintragungsdatum)\n\nVIVA Marketing GmbH\nGesellschaft mit beschränkter Haftung\nVendersheim\n\nAls nicht eingetragen wird veröffentlicht: Den Gläubigern der Gesellschaft, deren Forderungen begründet worden sind, bevor die Eintragung der Beendigung des Organschaftssvertrages in das Handelsregister nach § 10 des Handelsgesetzbuches als bekanntgemacht gilt, hat der andere Vertragsteil Sicherheit zu leisten, wenn sie sich binnen sechs Monaten nach der Bekanntmachung der Eintragung zu diesem Zweck bei ihm melden."
    },
    {
      "date": "2025-01-13",
      "id": "98437",
      "original_text": "Löschungsankündigung\nRheinland-Pfalz Amtsgericht Koblenz HRB 24892\nLavinya UG (haftungsbeschränkt) – Remagen",
      "type": "Löschungsankündigung",
      "state": "Rheinland-Pfalz",
      "amtsgericht": "Amtsgericht Koblenz",
      "registernummer": "HRB 24892",
      "registerart": "HRB",
      "company_name": "Lavinya UG (haftungsbeschränkt)",
      "company_seat": "Remagen",
      "details": ""
    },
    {
      "date": "2025-01-13",
      "id": "98438",
      "original_text": "Löschungsankündigung\nRheinland-Pfalz Amtsgericht Montabaur HRB 5649\nPro Design Geschenkartikel GmbH – Birken/Honigsessen",
      "type": "Löschungsankündigung",
      "state": "Rheinland-Pfalz",
      "amtsgericht": "Amtsgericht Montabaur",
      "registernummer": "HRB 5649",
      "registerart": "HRB",
      "company_name": "Pro Design Geschenkartikel GmbH",
      "company_seat": "Birken/Honigsessen",
      "details": "13.01.2025 (Bekanntmachungsdatum)\n\nRheinland-Pfalz Amtsgericht Montabaur HRB 5649\nLöschungsankündigung\n\nPro Design Geschenkartikel GmbH\nGesellschaft mit beschränkter Haftung\nBirken/Honigsessen\n\nDas Registergericht beabsichtigt die Gesellschaft von Amts wegen nach § 394 FamFG zu löschen. Die Frist zur Erhebung eines Widerspruchs ist auf 1 Monat festgesetzt."
    },
    {
      "date": "2025-01-13",
      "id": "98439",
      "original_text": "Sonstige Registerbekanntmachung\nNordrhein-Westfalen Amtsgericht Köln HRB 84369\nREWE LOG 6 GmbH – Köln",
      "type": "Sonstige Registerbekanntmachung",
      "state": "Nordrhein-Westfalen",
      "amtsgericht": "Amtsgericht Köln",
      "registernummer": "HRB 84369",
      "registerart": "HRB",
      "company_name": "REWE LOG 6 GmbH",
      "company_seat": "Köln",
      "details": "13.01.2025 (Bekanntmachungsdatum)\n\nNordrhein-Westfalen Amtsgericht Köln HRB 84369\nSonstige Registerbekanntmachung\n\nREWE LOG 6 GmbH\nGesellschaft mit beschränkter Haftung\nKöln\n\nAls nicht eingetragen wird veröffentlicht: Den Gläubigern der Gesellschaft, deren Forderungen begründet worden sind bevor die Eintragung der Beendigung des Beherrschungs- und Gewinnabführungsvertrages  in das Handelsregister nach § 10 des Handelsgesetzbuches als bekanntgemacht gilt, hat der andere Vertragsteil Sicherheit zu leisten, wenn sie sich binnen sechs Monaten nach der Bekanntmachung der Eintragung zu diesem Zweck bei ihm melden."
    },
    {
      "date": "2025-01-13",
      "id": "98440",
      "original_text": "Sonstige Registerbekanntmachung\nNordrhein-Westfalen Amtsgericht Köln HRB 48232\nGoetze Wohnungsbau GmbH – Burscheid",
      "type": "Sonstige Registerbekanntmachung",
      "state": "Nordrhein-Westfalen",
      "amtsgericht": "Amtsgericht Köln",
      "registernummer": "HRB 48232",
      "registerart": "HRB",
      "company_name": "Goetze Wohnungsbau GmbH",
      "company_seat": "Burscheid",
      "details": "13.01.2025 (Bekanntmachungsdatum)\n\nNordrhein-Westfalen Amtsgericht Köln HRB 48232\nSonstige Registerbekanntmachung 13.01.2025 (Eintragungsdatum)\n\nGoetze Wohnungsbau GmbH\nGesellschaft mit beschränkter Haftung\nBurscheid\n\nAls nicht eingetragen wird veröffentlicht: Den Gläubigern der Gesellschaft, deren Forderungen begründet worden sind bevor die Eintragung der Beendigung des Beherrschungs- und Gewinnabführungsvertrages  in das Handelsregister nach § 10 des Handelsgesetzbuches als bekanntgemacht gilt, hat der andere Vertragsteil Sicherheit zu leisten, wenn sie sich binnen sechs Monaten nach der Bekanntmachung der Eintragung zu diesem Zweck bei ihm melden."
    },
    {
      "date": "2025-01-13",
      "id": "98441",
      "original_text": "Sonstige Registerbekanntmachung\nNordrhein-Westfalen Amtsgericht Dortmund HRB 33801\nTOP NOTCH TEAM GmbH – Dortmund",
      "type": "Sonstige Registerbekanntmachung",
      "state": "Nordrhein-Westfalen",
      "amtsgericht": "Amtsgericht Dortmund",
      "registernummer": "HRB 33801",
      "registerart": "HRB",
      "company_name": "TOP NOTCH TEAM GmbH",
      "company_seat": "Dortmund",
      "details": "13.01.2025 (Bekanntmachungsdatum)\n\nNordrhein-Westfalen Amtsgericht Dortmund HRB 33801\nSonstige Registerbekanntmachung 13.01.2025 (Eintragungsdatum)\n\nTOP NOTCH TEAM GmbH\nGesellschaft mit beschränkter Haftung\nDortmund\n\nAls nicht eingetragen wird veröffentlicht: Den Gläubigern der Gesellschaft, deren Forderungen begründet worden sind bevor die Eintragung der Beendigung des Gewinnabführungsvertrages  in das Handelsregister nach § 10 des Handelsgesetzbuches als bekanntgemacht gilt, hat der andere Vertragsteil Sicherheit zu leisten, wenn sie sich binnen sechs Monaten nach der Bekanntmachung der Eintragung zu diesem Zweck bei ihm melden."
    },
    {
      "date": "2025-01-13",
      "id": "98442",
      "original_text": "Einreichung neuer Dokumente\nNordrhein-Westfalen Amtsgericht Bochum HRB 6901\nDSL-Dienst- und Serviceleistungen - GmbH Knappschaftskrankenhäuser Bochum-Langendreer und Bottrop – Bochum",
      "type": "Einreichung neuer Dokumente",
      "state": "Nordrhein-Westfalen",
      "amtsgericht": "Amtsgericht Bochum",
      "registernummer": "HRB 6901",
      "registerart": "HRB",
      "company_name": "DSL-Dienst- und Serviceleistungen - GmbH Knappschaftskrankenhäuser Bochum-Langendreer und Bottrop",
      "company_seat": "Bochum",
      "details": "13.01.2025 (Bekanntmachungsdatum)\n\nNordrhein-Westfalen Amtsgericht Bochum HRB 6901\nEinreichung neuer Dokumente\n\nDSL-Dienst- und Serviceleistungen - GmbH Knappschaftskrankenhäuser Bochum-Langendreer und Bottrop\nGesellschaft mit beschränkter Haftung\nBochum\n\nDem Registergericht ist eine Liste der Mitglieder des Aufsichtsrates eingereicht worden."
    },
    {
      "date": "2025-01-13",
      "id": "98443",
      "original_text": "Einreichung neuer Dokumente\nNordrhein-Westfalen Amtsgericht Münster HRB 9982\nProvinzial Holding Aktiengesellschaft – Münster",
      "type": "Einreichung neuer Dokumente",
      "state": "Nordrhein-Westfalen",
      "amtsgericht": "Amtsgericht Münster",
      "registernummer": "HRB 9982",
      "registerart": "HRB",
      "company_name": "Provinzial Holding Aktiengesellschaft",
      "company_seat": "Münster",
      "details": "13.01.2025 (Bekanntmachungsdatum)\n\nNordrhein-Westfalen Amtsgericht Münster HRB 9982\nEinreichung neuer Dokumente\n\nProvinzial Holding Aktiengesellschaft\nAktiengesellschaft\nMünster\n\nDem Registergericht ist eine neue Liste der Mitglieder des Aufsichtsrates eingereicht worden."
    },
    {
      "date": "2025-01-13",
      "id": "98444",
      "original_text": "Löschungsankündigung\nNordrhein-Westfalen Amtsgericht Duisburg HRB 34379\nStar Magic Games S.A. – Duisburg",
      "type": "Löschungsankündigung",
      "state": "Nordrhein-Westfalen",
      "amtsgericht": "Amtsgericht Duisburg",
      "registernummer": "HRB 34379",
      "registerart": "HRB",
      "company_name": "Star Magic Games S.A.",
      "company_seat": "Duisburg",
      "details": "13.01.2025 (Bekanntmachungsdatum)\n\nNordrhein-Westfalen Amtsgericht Duisburg HRB 34379\nLöschungsankündigung 13.01.2025 (Eintragungsdatum)\n\nStar Magic Games S.A.\nRechtsform ausländischen Rechts HRB\nDuisburg\n\nHRB 34379:\nStar Magic Games S.A., Duisburg,\nSchulstraße 30, 47166 Duisburg.\nDie Eintragung von Frau Monika Rosen, Oberhausen, *06.04.1958 als ständige Vertreterin der Zweigniederlassung nach deren Versterben von Amts wegen gem. § 395 FamFG gelöscht werden.\nGegen diese Verfügung kann Widerspruch eingelegt werden. Die Frist zur Erhebung eines Widerspruchs gegen die beabsichtigte Löschung von Amts wegen ist auf drei Monate festgesetzt. Rechtsbehelfsbelehrung Der Widerspruch ist bei dem Amtsgericht Duisburg, Kardinal-Galen-Str. 124-132, 47058 Duisburg schriftlich in deutscher Sprache oder zur Niederschrift der Geschäftsstelle einzulegen. Der Widerspruch kann auch zur Niederschrift der Geschäftsstelle eines jeden Amtsgerichtes abgegeben werden. Die Einlegung ist auch durch Übertragung eines elektronischen Dokuments an die elektronische Poststelle des Gerichts möglich. Das elektronische Dokument muss für die Bearbeitung durch das Gericht geeignet und mit einer qualifizierten elektronischen Signatur der verantwortenden Person versehen sein oder von der verantwortenden Person signiert und auf einem sicheren Übermittlungsweg gemäß § 130 a ZPO nach näherer Maßgabe der Verordnung über die technischen Rahmenbedingungen des elektronischen Rechtsverkehrs und über das besondere elektronische Behördenpostfach (BGBl. I, S. 3803) eingereicht werden. Weitere Informationen erhalten Sie auf der Internetseite www.justiz.de <http://www.justiz.de>. Der Widerspruch muss spätestens innerhalb der gesetzten Frist bei dem Amtsgericht Duisburg eingegangen sein. Dies gilt auch dann, wenn der Widerspruch zur Niederschrift der Geschäftsstelle eines anderen Amtsgerichtes abgegeben wurde. Die Frist beginnt mit der Veröffentlichung. Fällt das Ende der Frist auf einen Sonntag, einen allgemeinen Feiertag oder Sonnabend, so endet die Frist mit Ablauf des nächsten Werktages. Der Widerspruch muss die Bezeichnung der angefochtenen Verfügung sowie die Erklärung enthalten, dass Widerspruch gegen diese Verfügung eingelegt wird. Er ist zu unterzeichnen und soll begründet werden."
    },
    {
      "date": "2025-01-13",
      "id": "98445",
      "original_text": "Registerbekanntmachung nach dem Umwandlungsgesetz\nNordrhein-Westfalen Amtsgericht Bad Oeynhausen HRB 7487\nAutohof A 30 Bünde Verwaltungs GmbH – Bünde",
      "type": "Registerbekanntmachung nach dem Umwandlungsgesetz",
      "state": "Nordrhein-Westfalen",
      "amtsgericht": "Amtsgericht Bad Oeynhausen",
      "registernummer": "HRB 7487",
      "registerart": "HRB",
      "company_name": "Autohof A 30 Bünde Verwaltungs GmbH",
      "company_seat": "Bünde",
      "details": "13.01.2025 (Bekanntmachungsdatum)\n\nNordrhein-Westfalen Amtsgericht Bad Oeynhausen HRB 7487\nRegisterbekanntmachung nach dem Umwandlungsgesetz 13.01.2025 (Eintragungsdatum)\n\nAutohof A 30 Bünde Verwaltungs GmbH\nGesellschaft mit beschränkter Haftung\nBünde\n\nDen Gläubigern der an der Verschmelzung beteiligten Rechtsträger ist, wenn sie binnen sechs Monaten nach dem Tag, an dem die Eintragung der Verschmelzung in das Register des Sitzes desjenigen Rechtsträgers, dessen Gläubiger sie sind, nach § 19 Absatz 3 UmwG als bekanntgemacht gilt, ihren Anspruch nach Grund und Höhe schriftlich anmelden, Sicherheit zu leisten, soweit sie nicht Befriedigung verlangen können. Dieses Recht steht den Gläubigern jedoch nur zu, wenn sie glaubhaft machen, dass durch die Verschmelzung die Erfüllung ihrer Forderung gefährdet wird."
    },
    {
      "date": "2025-01-13",
      "id": "98446",
      "original_text": "Registerbekanntmachung nach dem Umwandlungsgesetz\nNordrhein-Westfalen Amtsgericht Köln HRA 8526\nElektrohaus Bernhard Günther GmbH & Co. KG – Köln",
      "type": "Registerbekanntmachung nach dem Umwandlungsgesetz",
      "state": "Nordrhein-Westfalen",
      "amtsgericht": "Amtsgericht Köln",
      "registernummer": "HRA 8526",
      "registerart": "HRA",
      "company_name": "Elektrohaus Bernhard Günther GmbH & Co. KG",
      "company_seat": "Köln",
      "details": "13.01.2025 (Bekanntmachungsdatum)\n\nNordrhein-Westfalen Amtsgericht Köln HRA 8526\nRegisterbekanntmachung nach dem Umwandlungsgesetz 13.01.2025 (Eintragungsdatum)\n\nElektrohaus Bernhard Günther GmbH & Co. KG\nKommanditgesellschaft\nKöln\n\nDen Gläubigern der an der formwechselnden Umwandlung beteiligten Rechtsträger ist, wenn sie binnen sechs Monaten nach dem Tag, an dem die Eintragung der formwechselnden Umwandlung in das Register des Sitzes desjenigen Rechtsträgers, dessen Gläubiger sie sind, nach § 19 Absatz 3 UmwG als bekanntgemacht gilt, ihren Anspruch nach Grund und Höhe schriftlich anmelden, Sicherheit zu leisten, soweit sie nicht Befriedigung verlangen können. Dieses Recht steht den Gläubigern jedoch nur zu, wenn sie glaubhaft machen, dass durch die formwechselnden Umwandlung die Erfüllung ihrer Forderung gefährdet wird."
    },
    {
      "date": "2025-01-13",
      "id": "98447",
      "original_text": "Registerbekanntmachung nach dem Umwandlungsgesetz\nNordrhein-Westfalen Amtsgericht Dortmund HRB 28832\nKKTW Holding GmbH – Dortmund",
      "type": "Registerbekanntmachung nach dem Umwandlungsgesetz",
      "state": "Nordrhein-Westfalen",
      "amtsgericht": "Amtsgericht Dortmund",
      "registernummer": "HRB 28832",
      "registerart": "HRB",
      "company_name": "KKTW Holding GmbH",
      "company_seat": "Dortmund",
      "details": "13.01.2025 (Bekanntmachungsdatum)\n\nNordrhein-Westfalen Amtsgericht Dortmund HRB 28832\nRegisterbekanntmachung nach dem Umwandlungsgesetz 13.01.2025 (Eintragungsdatum)\n\nKKTW Holding GmbH\nGesellschaft mit beschränkter Haftung\nDortmund\n\nDen Gläubigern der an der Verschmelzung beteiligten Rechtsträger ist, wenn sie binnen sechs Monaten nach dem Tag, an dem die Eintragung der Verschmelzung in das Register des Sitzes desjenigen Rechtsträgers, dessen Gläubiger sie sind, nach § 19 Absatz 3 UmwG als bekanntgemacht gilt, ihren Anspruch nach Grund und Höhe schriftlich anmelden, Sicherheit zu leisten, soweit sie nicht Befriedigung verlangen können. Dieses Recht steht den Gläubigern jedoch nur zu, wenn sie glaubhaft machen, dass durch die Verschmelzung die Erfüllung ihrer Forderung gefährdet wird."
    },
    {
      "date": "2025-01-13",
      "id": "98448",
      "original_text": "Sonstige Registerbekanntmachung\nNordrhein-Westfalen Amtsgericht Neuss HRB 20303\nGarten- und Landschaftsbau Browa GmbH – Neuss",
      "type": "Sonstige Registerbekanntmachung",
      "state": "Nordrhein-Westfalen",
      "amtsgericht": "Amtsgericht Neuss",
      "registernummer": "HRB 20303",
      "registerart": "HRB",
      "company_name": "Garten- und Landschaftsbau Browa GmbH",
      "company_seat": "Neuss",
      "details": "13.01.2025 (Bekanntmachungsdatum)\n\nNordrhein-Westfalen Amtsgericht Neuss HRB 20303\nSonstige Registerbekanntmachung 13.01.2025 (Eintragungsdatum)\n\nGarten- und Landschaftsbau Browa GmbH\nGesellschaft mit beschränkter Haftung\nNeuss\n\nAls nicht eingetragen wird veröffentlicht: Den Gläubigern der Gesellschaft, deren Forderungen begründet worden sind bevor die Eintragung der Beendigung des Beherrschungs- und Gewinnabführungsvertrages  in das Handelsregister nach § 10 des Handelsgesetzbuches als bekanntgemacht gilt, hat der andere Vertragsteil Sicherheit zu leisten, wenn sie sich binnen sechs Monaten nach der Bekanntmachung der Eintragung zu diesem Zweck bei ihm melden."
    },
    {
      "date": "2025-01-13",
      "id": "98449",
      "original_text": "Löschungsankündigung\nNordrhein-Westfalen Amtsgericht Köln HRB 114560\nIB-Personal- & InvoiceService GmbH – Köln",
      "type": "Löschungsankündigung",
      "state": "Nordrhein-Westfalen",
      "amtsgericht": "Amtsgericht Köln",
      "registernummer": "HRB 114560",
      "registerart": "HRB",
      "company_name": "IB-Personal- & InvoiceService GmbH",
      "company_seat": "Köln",
      "details": ""
    },
    {
      "date": "2025-01-13",
      "id": "98450",
      "original_text": "Registerbekanntmachung nach dem Umwandlungsgesetz\nNordrhein-Westfalen Amtsgericht Köln HRB 121708\nElektrohaus Bernhard Günther GmbH – Köln",
      "type": "Registerbekanntmachung nach dem Umwandlungsgesetz",
      "state": "Nordrhein-Westfalen",
      "amtsgericht": "Amtsgericht Köln",
      "registernummer": "HRB 121708",
      "registerart": "HRB",
      "company_name": "Elektrohaus Bernhard Günther GmbH",
      "company_seat": "Köln",
      "details": "13.01.2025 (Bekanntmachungsdatum)\n\nNordrhein-Westfalen Amtsgericht Köln HRB 121708\nRegisterbekanntmachung nach dem Umwandlungsgesetz 13.01.2025 (Eintragungsdatum)\n\nElektrohaus Bernhard Günther GmbH\nGesellschaft mit beschränkter Haftung\nKöln\n\nDen Gläubigern der an der formwechselnden Umwandlung beteiligten Rechtsträger ist, wenn sie binnen sechs Monaten nach dem Tag, an dem die Eintragung der formwechselnden Umwandlung in das Register des Sitzes desjenigen Rechtsträgers, dessen Gläubiger sie sind, nach § 19 Absatz 3 UmwG als bekanntgemacht gilt, ihren Anspruch nach Grund und Höhe schriftlich anmelden, Sicherheit zu leisten, soweit sie nicht Befriedigung verlangen können. Dieses Recht steht den Gläubigern jedoch nur zu, wenn sie glaubhaft machen, dass durch die formwechselnden Umwandlung die Erfüllung ihrer Forderung gefährdet wird."
    },
    {
      "date": "2025-01-13",
      "id": "98451",
      "original_text": "Löschungsankündigung\nNordrhein-Westfalen Amtsgericht Aachen HRB 20522\nSoftlock International GmbH – Aachen",
      "type": "Löschungsankündigung",
      "state": "Nordrhein-Westfalen",
      "amtsgericht": "Amtsgericht Aachen",
      "registernummer": "HRB 20522",
      "registerart": "HRB",
      "company_name": "Softlock International GmbH",
      "company_seat": "Aachen",
      "details": "13.01.2025 (Bekanntmachungsdatum)\n\nNordrhein-Westfalen Amtsgericht Aachen HRB 20522\nLöschungsankündigung\n\nSoftlock International GmbH\nGesellschaft mit beschränkter Haftung\nAachen\n\nDas Registergericht beabsichtigt, von Amts wegen die Gesellschaft wegen Vermögenslosigkeit nach § 394 FamFG zu löschen, weil das Finanzamt Aachen-Stadt mit Schreiben vom 06.11.2024 Umstände mitgeteilt hat, aufgrund derer das Gericht davon überzeugt ist, dass die Gesellschaft vollständig vermögenslos ist.\n\nZur Geltendmachung des Widerspruchs gegen die beabsichtigte Löschung wird hiermit eine Frist von einem Monat ab Veröffentlichung dieser Ankündigung bestimmt.\n\nRechtsbehelfsbelehrung:\n\nGegen diese Verfügung kann Widerspruch eingelegt werden. Zum Widerspruch ist jeder berechtigt, der an der Unterlassung der Löschung ein berechtigtes Interesse hat.\n\nDer Widerspruch ist bei dem Amtsgericht Aachen, Adalbertsteinweg 92, 52070 Aachen schriftlich in deutscher Sprache oder zur Niederschrift der Geschäftsstelle einzulegen. Der Widerspruch kann auch zur Niederschrift der Geschäftsstelle eines jeden Amtsgerichtes abgegeben werden.\n\nDer Widerspruch muss spätestens innerhalb der gesetzten Frist nach der Bekanntgabe der Verfügung bei dem Amtsgericht Aachen eingegangen sein. Dies gilt auch dann, wenn der Widerspruch zur Niederschrift der Geschäftsstelle eines anderen Amtsgerichtes abgegeben wurde. Die Frist beginnt mit der Bekanntgabe der Verfügung durch Veröffentlichung. Fällt das Ende der Frist auf einen Sonntag, einen allgemeinen Feiertag oder Sonnabend, so endet die Frist mit Ablauf des nächsten Werktages.\n\nDer Widerspruch muss die Bezeichnung der angefochtenen Verfügung sowie die Erklärung enthalten, dass Widerspruch gegen diese Verfügung eingelegt wird. Er ist zu unterzeichnen und soll begründet werden.\n\nDie Einlegung ist auch durch Übertragung eines elektronischen Dokuments an die elektronische Poststelle des Gerichts möglich. Das elektronische Dokument muss für die Bearbeitung durch das Gericht geeignet und mit einer qualifizierten elektronischen Signatur der verantwortenden Person versehen sein oder von der verantwortenden Person signiert und auf einem sicheren Übermittlungsweg gemäß § 130 a ZPO nach näherer Maßgabe der Verordnung über die technischen Rahmenbedingungen des elektronischen Rechtsverkehrs und über das besondere elektronische Behördenpostfach (BGBl. I, S. 3803) eingereicht werden. Weitere Informationen erhalten Sie auf der Internetseite www.justiz.de."
    },
    {
      "date": "2025-01-13",
      "id": "98452",
      "original_text": "Löschungsankündigung\nNordrhein-Westfalen Amtsgericht Siegburg HRB 8730\nF L Z (Fahrzeug - Logistik - Zentrum) GmbH – Troisdorf",
      "type": "Löschungsankündigung",
      "state": "Nordrhein-Westfalen",
      "amtsgericht": "Amtsgericht Siegburg",
      "registernummer": "HRB 8730",
      "registerart": "HRB",
      "company_name": "F L Z (Fahrzeug - Logistik - Zentrum) GmbH",
      "company_seat": "Troisdorf",
      "details": "13.01.2025 (Bekanntmachungsdatum)\n\nNordrhein-Westfalen Amtsgericht Siegburg HRB 8730\nLöschungsankündigung\n\nF L Z (Fahrzeug - Logistik - Zentrum) GmbH\nGesellschaft mit beschränkter Haftung\nTroisdorf\n\nDas Registergericht hat glaubhafte Kenntnis erlangt, dass die Gesellschaft vermögenslos geworden ist.\n\nEs ist daher beabsichtigt, die Gesellschaft nach § 394 FamFG im Handelsregister wegen Vermögenslosigkeit zu löschen.\nEinwände gegen die Löschung sind durch Widerspruch binnen einer Frist von 3 Monaten geltend zu machen, andernfalls die Löschung erfolgen wird.\n\nEinzulegen ist der Widerspruch bei dem Amtsgericht Siegburg, Neue Poststraße 16, 53721 Siegburg, und zwar entweder schriftlich in deutscher Sprache oder mündlich zur Niederschrift der Geschäftsstelle. Der Widerspruch kann auch zur Niederschrift der Geschäftsstelle eines jeden Amtsgerichts abgegeben werden. Der Widerspruch ist binnen der in der Verfügung bestimmten Frist einzulegen. Die Frist ist nur gewahrt, wenn der Widerspruch rechtzeitig bei dem Amtsgericht Siegburg eingeht, auch wenn der Widerspruch zur Niederschrift der Geschäftsstelle eines anderen Amtsgerichts abgegeben wurde. Die Frist beginnt jeweils mit der schriftlichen Bekanntgabe der Verfügung an die Beteiligten. Kann die schriftliche Bekanntgabe an einen Beteiligten nicht bewirkt werden, beginnt die Frist spätestens mit Ablauf von fünf Monaten nach Erlass der Verfügung. Die Bekanntgabe ist entweder durch Zustellung oder am dritten Tage nach Aufgabe zur Post bewirkt. Sofern die Löschung noch nicht erfolgt ist, kann der Widerspruch auch noch nach Ablauf der Frist eingelegt werden. Fällt das Ende der Frist auf einen Sonnabend, einen Sonntag oder einen allgemeinen Feiertag, endet die Frist mit Ablauf des nächsten Werktages. Der Widerspruch ist zu unterzeichnen. Eine Begründung des Widerspruchs ist nicht vorgeschrieben."
    },
    {
      "date": "2025-01-13",
      "id": "98453",
      "original_text": "Sonstige Registerbekanntmachung\nNordrhein-Westfalen Amtsgericht Köln HRB 109369\nAwright GmbH – Köln",
      "type": "Sonstige Registerbekanntmachung",
      "state": "Nordrhein-Westfalen",
      "amtsgericht": "Amtsgericht Köln",
      "registernummer": "HRB 109369",
      "registerart": "HRB",
      "company_name": "Awright GmbH",
      "company_seat": "Köln",
      "details": "13.01.2025 (Bekanntmachungsdatum)\n\nNordrhein-Westfalen Amtsgericht Köln HRB 109369\nSonstige Registerbekanntmachung 13.01.2025 (Eintragungsdatum)\n\nAwright GmbH\nGesellschaft mit beschränkter Haftung\nKöln\n\nAls nicht eingetragen wird veröffentlicht: Den Gläubigern der Gesellschaft, deren Forderungen begründet worden sind bevor die Eintragung der Beendigung des Gewinnabführungsvertrages  in das Handelsregister nach § 10 des Handelsgesetzbuches als bekanntgemacht gilt, hat der andere Vertragsteil Sicherheit zu leisten, wenn sie sich binnen sechs Monaten nach der Bekanntmachung der Eintragung zu diesem Zweck bei ihm melden."
    },
    {
      "date": "2025-01-13",
      "id": "98454",
      "original_text": "Löschungsankündigung\nNordrhein-Westfalen Amtsgericht Neuss HRB 20721\nAZM Motors UG (haftungsbeschränkt) – Neuss",
      "type": "Löschungsankündigung",
      "state": "Nordrhein-Westfalen",
      "amtsgericht": "Amtsgericht Neuss",
      "registernummer": "HRB 20721",
      "registerart": "HRB",
      "company_name": "AZM Motors UG (haftungsbeschränkt)",
      "company_seat": "Neuss",
      "details": "13.01.2025 (Bekanntmachungsdatum)\n\nNordrhein-Westfalen Amtsgericht Neuss HRB 20721\nLöschungsankündigung 23.12.2024 (Eintragungsdatum)\n\nAZM Motors UG (haftungsbeschränkt)\nGesellschaft mit beschränkter Haftung\nNeuss\n\nEs ist beabsichtigt, die Gesellschaft wegen Vermögenslosigkeit aufgrund des § 394 Abs. 1 FamFG zu löschen. Frist zur Geltendmachung eines Widerspruchs: 1 Monat.\n\nRechtsbehelfsbelehrung:\nGegen diese Verfügung können Sie Widerspruch einlegen.\nDer Widerspruch ist bei dem Amtsgericht Neuss - Registergericht -, Breite Str. 48, 41460 Neuss schriftlich in deutscher Sprache oder zur Niederschrift der Geschäftsstelle einzulegen.\nDer Widerspruch kann auch zur Niederschrift der Geschäftsstelle eines jeden Amtsgerichtes abgegeben werden.\nDie Einlegung ist auch durch Übertragung eines elektronischen Dokuments an die elektronische Poststelle des Gerichts möglich. Das elektronische Dokument muss für die Bearbeitung durch das Gericht geeignet und mit einer qualifizierten elektronischen Signatur der verantwortenden Person versehen sein oder von der verantwortenden Person signiert und auf einem sicheren Übermittlungsweg gemäß § 130a ZPO nach näherer Maßgabe der Verordnung über die technischen Rahmenbedingungen des elektronischen Rechtsverkehrs und über das besondere elektronische Behördenpostfach (BGBl. I, S.3803) eingereicht werden. Weitere Informationen erhalten Sie auf der Internetseite www.justiz.de.\nDer Widerspruch muss spätestens innerhalb der gesetzten Frist nach der schriftlichen Bekanntgabe der Verfügung bei dem Amtsgericht - Registergericht - Neuss eingegangen sein. Dies gilt auch dann, wenn der Widerspruch zur Niederschrift der Geschäftsstelle eines anderen Amtsgerichtes abgegeben wurde. Die Frist beginnt mit der schriftlichen Bekanntgabe der Verfügung. Die Bekanntgabe ist entweder durchDas Registergericht beabsichtigt die Gesellschaft von Amts wegen nach § 394 FamFG zu löschen. Die Frist zur Erhebung eines Widerspruchs ist auf #DV.Fr(Text=\"Bitte wählen Sie die Widerspruchsfrist aus!\",Eingabe=\"einen Monat\",\"zwei Monate\",\"drei Monate\",\"#insert(Text=\"Freitext\")\"|\"freier Text\") festgesetzt. Zustellung oder am dritten Tage nach Aufgabe zur Post bewirkt. Fällt das Ende der Frist auf einen Sonntag, einen allgemeinen Feiertag oder Sonnabend, so endet die Frist mit Ablauf des nächsten Werktages.\n\nDer Widerspruch muss die Bezeichnung der angefochtenen Verfügung sowie die Erklärung enthalten, dass Widerspruch gegen diese Verfügung eingelegt wird. Er ist zu unterzeichnen und soll begründet werden."
    },
    {
      "date": "2025-01-13",
      "id": "98455",
      "original_text": "Löschungsankündigung\nNordrhein-Westfalen Amtsgericht Dortmund HRB 25239\nEuro Transport GmbH – Dortmund",
      "type": "Löschungsankündigung",
      "state": "Nordrhein-Westfalen",
      "amtsgericht": "Amtsgericht Dortmund",
      "registernummer": "HRB 25239",
      "registerart": "HRB",
      "company_name": "Euro Transport GmbH",
      "company_seat": "Dortmund",
      "details": "13.01.2025 (Bekanntmachungsdatum)\n\nNordrhein-Westfalen Amtsgericht Dortmund HRB 25239\nLöschungsankündigung\n\nEuro Transport GmbH\nGesellschaft mit beschränkter Haftung\nDortmund\n\nDas Registergericht beabsichtigt die Gesellschaft von Amts wegen nach § 394 FamFG zu löschen. Die Frist zur Erhebung eines Widerspruchs ist auf zwei Monate festgesetzt."
    },
    {
      "date": "2025-01-13",
      "id": "98456",
      "original_text": "Löschungsankündigung\nNordrhein-Westfalen Amtsgericht Köln HRB 46509\nKremer Wohndesign GmbH – Bergisch Gladbach",
      "type": "Löschungsankündigung",
      "state": "Nordrhein-Westfalen",
      "amtsgericht": "Amtsgericht Köln",
      "registernummer": "HRB 46509",
      "registerart": "HRB",
      "company_name": "Kremer Wohndesign GmbH",
      "company_seat": "Bergisch Gladbach",
      "details": "13.01.2025 (Bekanntmachungsdatum)\n\nNordrhein-Westfalen Amtsgericht Köln HRB 46509\nLöschungsankündigung\n\nKremer Wohndesign GmbH\nGesellschaft mit beschränkter Haftung\nBergisch Gladbach\n\nDas Registergericht beabsichtigt die Gesellschaft von Amts wegen nach § 394 FamFG zu löschen. Die Frist zur Erhebung eines Widerspruchs ist auf einen Monat festgesetzt."
    },
    {
      "date": "2025-01-13",
      "id": "98457",
      "original_text": "Löschungsankündigung\nSaarland Amtsgericht Saarbrücken HRB 105991\nRORO international Trading GmbH – St. Ingbert",
      "type": "Löschungsankündigung",
      "state": "Saarland",
      "amtsgericht": "Amtsgericht Saarbrücken",
      "registernummer": "HRB 105991",
      "registerart": "HRB",
      "company_name": "RORO international Trading GmbH",
      "company_seat": "St. Ingbert",
      "details": "13.01.2025 (Bekanntmachungsdatum)\n\nSaarland Amtsgericht Saarbrücken HRB 105991\nLöschungsankündigung\n\nRORO international Trading GmbH\nGesellschaft mit beschränkter Haftung\nSt. Ingbert\n\nEs ist beabsichtigt, die Gesellschaft von Amts wegen gemäß § 394 FamFG wegen Vermögenslosigkeit zu löschen. Gegen die Löschung von Amts wegen ist das Rechtsmittel des Widerspruchs statthaft. Der Widerspruch ist binnen einer Frist von 1 Monat beginnend mit dem Tag dieser Veröffentlichung durch Einreichen eines Widerspruchsschreibens -schriftlich oder zur Niederschrift der Geschäftsstelle- beim Amtsgericht Saarbrücken, -zentrales Handelsregister-, Mainzerstr.178, 66121 Saarbrücken einzulegen. Der Widerspruch muss die Bezeichnung der angefochtenen Löschungsankündigung enthalten sowie die Erklärung, dass Widerspruch eingelegt wird. Er ist vom Widerspruchsführer oder seinem Bevollmächtigten zu unterzeichnen.\nDas Widerspruchsschreiben kann auch in der Form eines elektronischen Dokumentes eingereicht werden, das mit einer qualifizierten elektronischen Signatur nach dem Signaturgesetz versehen sein muss (§§ 14 Abs. 2 FamFG, 130a, 298 ZPO)."
    },
    {
      "date": "2025-01-13",
      "id": "98458",
      "original_text": "Löschungsankündigung\nSaarland Amtsgericht Saarbrücken HRB 103798\nG.F.I. GmbH – Homburg/Saar",
      "type": "Löschungsankündigung",
      "state": "Saarland",
      "amtsgericht": "Amtsgericht Saarbrücken",
      "registernummer": "HRB 103798",
      "registerart": "HRB",
      "company_name": "G.F.I. GmbH",
      "company_seat": "Homburg/Saar",
      "details": "13.01.2025 (Bekanntmachungsdatum)\n\nSaarland Amtsgericht Saarbrücken HRB 103798\nLöschungsankündigung\n\nG.F.I. GmbH\nGesellschaft mit beschränkter Haftung\nHomburg/Saar\n\nEs ist beabsichtigt, die Gesellschaft von Amts wegen gemäß § 394 FamFG wegen Vermögenslosigkeit zu löschen. Gegen die Löschung von Amts wegen ist das Rechtsmittel des Widerspruchs statthaft. Der Widerspruch ist binnen einer Frist von 1 Monat beginnend mit dem Tag dieser Veröffentlichung durch Einreichen eines Widerspruchsschreibens -schriftlich oder zur Niederschrift der Geschäftsstelle- beim Amtsgericht Saarbrücken, -zentrales Handelsregister-, Mainzerstr.178, 66121 Saarbrücken einzulegen. Der Widerspruch muss die Bezeichnung der angefochtenen Löschungsankündigung enthalten sowie die Erklärung, dass Widerspruch eingelegt wird. Er ist vom Widerspruchsführer oder seinem Bevollmächtigten zu unterzeichnen.\nDas Widerspruchsschreiben kann auch in der Form eines elektronischen Dokumentes eingereicht werden, das mit einer qualifizierten elektronischen Signatur nach dem Signaturgesetz versehen sein muss (§§ 14 Abs. 2 FamFG, 130a, 298 ZPO)."
    },
    {
      "date": "2025-01-13",
      "id": "98459",
      "original_text": "Löschungsankündigung\nSaarland Amtsgericht Saarbrücken HRB 26327\nJakobs Heizung + Sanitär GmbH – Saarlouis",
      "type": "Löschungsankündigung",
      "state": "Saarland",
      "amtsgericht": "Amtsgericht Saarbrücken",
      "registernummer": "HRB 26327",
      "registerart": "HRB",
      "company_name": "Jakobs Heizung + Sanitär GmbH",
      "company_seat": "Saarlouis",
      "details": "13.01.2025 (Bekanntmachungsdatum)\n\nSaarland Amtsgericht Saarbrücken HRB 26327\nLöschungsankündigung\n\nJakobs Heizung + Sanitär GmbH\nGesellschaft mit beschränkter Haftung\nSaarlouis\n\nEs ist beabsichtigt, die Gesellschaft von Amts wegen gemäß § 394 FamFG wegen Vermögenslosigkeit zu löschen. Gegen die Löschung von Amts wegen ist das Rechtsmittel des Widerspruchs statthaft. Der Widerspruch ist binnen einer Frist von 1 Monat beginnend mit dem Tag dieser Veröffentlichung durch Einreichen eines Widerspruchsschreibens -schriftlich oder zur Niederschrift der Geschäftsstelle- beim Amtsgericht Saarbrücken, -zentrales Handelsregister-, Mainzerstr.178, 66121 Saarbrücken einzulegen. Der Widerspruch muss die Bezeichnung der angefochtenen Löschungsankündigung enthalten sowie die Erklärung, dass Widerspruch eingelegt wird. Er ist vom Widerspruchsführer oder seinem Bevollmächtigten zu unterzeichnen.\nDas Widerspruchsschreiben kann auch in der Form eines elektronischen Dokumentes eingereicht werden, das mit einer qualifizierten elektronischen Signatur nach dem Signaturgesetz versehen sein muss (§§ 14 Abs. 2 FamFG, 130a, 298 ZPO)."
    },
    {
      "date": "2025-01-13",
      "id": "98460",
      "original_text": "Löschungsankündigung\nSaarland Amtsgericht Saarbrücken HRB 103291\nS & L Elektro UG (haftungsbeschränkt) – Freisen",
      "type": "Löschungsankündigung",
      "state": "Saarland",
      "amtsgericht": "Amtsgericht Saarbrücken",
      "registernummer": "HRB 103291",
      "registerart": "HRB",
      "company_name": "S & L Elektro UG (haftungsbeschränkt)",
      "company_seat": "Freisen",
      "details": "13.01.2025 (Bekanntmachungsdatum)\n\nSaarland Amtsgericht Saarbrücken HRB 103291\nLöschungsankündigung\n\nS & L Elektro UG (haftungsbeschränkt)\nGesellschaft mit beschränkter Haftung\nFreisen\n\nEs ist beabsichtigt, die Gesellschaft von Amts wegen gemäß § 394 FamFG wegen Vermögenslosigkeit zu löschen. Gegen die Löschung von Amts wegen ist das Rechtsmittel des Widerspruchs statthaft. Der Widerspruch ist binnen einer Frist von 1 Monat beginnend mit dem Tag dieser Veröffentlichung durch Einreichen eines Widerspruchsschreibens -schriftlich oder zur Niederschrift der Geschäftsstelle- beim Amtsgericht Saarbrücken, -zentrales Handelsregister-, Mainzerstr.178, 66121 Saarbrücken einzulegen. Der Widerspruch muss die Bezeichnung der angefochtenen Löschungsankündigung enthalten sowie die Erklärung, dass Widerspruch eingelegt wird. Er ist vom Widerspruchsführer oder seinem Bevollmächtigten zu unterzeichnen.\nDas Widerspruchsschreiben kann auch in der Form eines elektronischen Dokumentes eingereicht werden, das mit einer qualifizierten elektronischen Signatur nach dem Signaturgesetz versehen sein muss (§§ 14 Abs. 2 FamFG, 130a, 298 ZPO)."
    },
    {
      "date": "2025-01-13",
      "id": "98461",
      "original_text": "Registerbekanntmachung nach dem Umwandlungsgesetz\nHessen Amtsgericht Bad Homburg v.d.H. HRB 16419\nOne Healthy Future UG (haftungsbeschränkt) – Friedrichsdorf",
      "type": "Registerbekanntmachung nach dem Umwandlungsgesetz",
      "state": "Hessen",
      "amtsgericht": "Amtsgericht Bad Homburg v.d.H.",
      "registernummer": "HRB 16419",
      "registerart": "HRB",
      "company_name": "One Healthy Future UG (haftungsbeschränkt)",
      "company_seat": "Friedrichsdorf",
      "details": "13.01.2025 (Bekanntmachungsdatum)\n\nHessen Amtsgericht Bad Homburg v.d.H. HRB 16419\nRegisterbekanntmachung nach dem Umwandlungsgesetz 13.01.2025 (Eintragungsdatum)\n\nOne Healthy Future UG (haftungsbeschränkt)\nGesellschaft mit beschränkter Haftung\nFriedrichsdorf\n\nDen Gläubigern der an der Verschmelzung beteiligten Rechtsträger ist, wenn sie binnen sechs Monaten nach dem Tag, an dem die Eintragung der Verschmelzung in das Register des Sitzes desjenigen Rechtsträgers, dessen Gläubiger sie sind, nach § 19 Absatz 3 UmwG bekannt gemacht worden ist, ihren Anspruch nach Grund und Höhe schriftlich anmelden, Sicherheit zu leisten, soweit sie nicht Befriedigung verlangen können. Dieses Recht steht den Gläubigern jedoch nur zu, wenn sie glaubhaft machen, dass durch die Verschmelzung die Erfüllung ihrer Forderung gefährdet wird."
    },
    {
      "date": "2025-01-13",
      "id": "98462",
      "original_text": "Einreichung neuer Dokumente\nHessen Amtsgericht Frankfurt am Main HRB 123926\nGigabitregion FrankfurtRheinMain GmbH – Frankfurt am Main",
      "type": "Einreichung neuer Dokumente",
      "state": "Hessen",
      "amtsgericht": "Amtsgericht Frankfurt am Main",
      "registernummer": "HRB 123926",
      "registerart": "HRB",
      "company_name": "Gigabitregion FrankfurtRheinMain GmbH",
      "company_seat": "Frankfurt am Main",
      "details": "13.01.2025 (Bekanntmachungsdatum)\n\nHessen Amtsgericht Frankfurt am Main HRB 123926\nEinreichung neuer Dokumente 13.01.2025 (Eintragungsdatum)\n\nGigabitregion FrankfurtRheinMain GmbH\nGesellschaft mit beschränkter Haftung\nFrankfurt am Main\n\nDurch eine Änderung in den Personen der Aufsichtsratsmitglieder ist eine Liste der Mitglieder des Aufsichtsrates zum Handelsregister eingereicht worden."
    },
    {
      "date": "2025-01-13",
      "id": "98463",
      "original_text": "Einreichung neuer Dokumente\nHessen Amtsgericht Frankfurt am Main HRB 80499\nBetriebs-Center für Banken AG – Frankfurt am Main",
      "type": "Einreichung neuer Dokumente",
      "state": "Hessen",
      "amtsgericht": "Amtsgericht Frankfurt am Main",
      "registernummer": "HRB 80499",
      "registerart": "HRB",
      "company_name": "Betriebs-Center für Banken AG",
      "company_seat": "Frankfurt am Main",
      "details": "13.01.2025 (Bekanntmachungsdatum)\n\nHessen Amtsgericht Frankfurt am Main HRB 80499\nEinreichung neuer Dokumente\n\nBetriebs-Center für Banken AG\nAktiengesellschaft\nFrankfurt am Main\n\nDurch eine Änderung in den Personen der Aufsichtsratsmitglieder ist eine Liste der Mitglieder des Aufsichtsrates zum Handelsregister eingereicht worden."
    },
    {
      "date": "2025-01-13",
      "id": "98464",
      "original_text": "Löschungsankündigung\nHessen Amtsgericht Wetzlar VR 4626\nMuththamizh Sangam e.V. – Herborn",
      "type": "Löschungsankündigung",
      "state": "Hessen",
      "amtsgericht": "Amtsgericht Wetzlar",
      "registernummer": "VR 4626",
      "registerart": "VR",
      "company_name": "Muththamizh Sangam e.V.",
      "company_seat": "Herborn",
      "details": ""
    },
    {
      "date": "2025-01-13",
      "id": "98465",
      "original_text": "Einreichung neuer Dokumente\nHessen Amtsgericht Frankfurt am Main HRB 45651\nDZ BANK AG Deutsche Zentral-Genossenschaftsbank, Frankfurt am Main – Frankfurt am Main",
      "type": "Einreichung neuer Dokumente",
      "state": "Hessen",
      "amtsgericht": "Amtsgericht Frankfurt am Main",
      "registernummer": "HRB 45651",
      "registerart": "HRB",
      "company_name": "DZ BANK AG Deutsche Zentral-Genossenschaftsbank, Frankfurt am Main",
      "company_seat": "Frankfurt am Main",
      "details": "13.01.2025 (Bekanntmachungsdatum)\n\nHessen Amtsgericht Frankfurt am Main HRB 45651\nEinreichung neuer Dokumente\n\nDZ BANK AG Deutsche Zentral-Genossenschaftsbank, Frankfurt am Main\nAktiengesellschaft\nFrankfurt am Main\n\nDurch eine Änderung in den Personen der Aufsichtsratsmitglieder ist eine Liste der Mitglieder des Aufsichtsrates zum Handelsregister eingereicht worden."
    },
    {
      "date": "2025-01-13",
      "id": "98466",
      "original_text": "Registerbekanntmachung nach dem Umwandlungsgesetz\nHessen Amtsgericht Bad Homburg v.d.H. HRB 14769\nLeading Consult GmbH – Friedrichsdorf",
      "type": "Registerbekanntmachung nach dem Umwandlungsgesetz",
      "state": "Hessen",
      "amtsgericht": "Amtsgericht Bad Homburg v.d.H.",
      "registernummer": "HRB 14769",
      "registerart": "HRB",
      "company_name": "Leading Consult GmbH",
      "company_seat": "Friedrichsdorf",
      "details": "13.01.2025 (Bekanntmachungsdatum)\n\nHessen Amtsgericht Bad Homburg v.d.H. HRB 14769\nRegisterbekanntmachung nach dem Umwandlungsgesetz 13.01.2025 (Eintragungsdatum)\n\nLeading Consult GmbH\nGesellschaft mit beschränkter Haftung\nFriedrichsdorf\n\nDen Gläubigern der an der Verschmelzung beteiligten Rechtsträger ist, wenn sie binnen sechs Monaten nach dem Tag, an dem die Eintragung der Verschmelzung in das Register des Sitzes desjenigen Rechtsträgers, dessen Gläubiger sie sind, nach § 19 Absatz 3 UmwG bekannt gemacht worden ist, ihren Anspruch nach Grund und Höhe schriftlich anmelden, Sicherheit zu leisten, soweit sie nicht Befriedigung verlangen können. Dieses Recht steht den Gläubigern jedoch nur zu, wenn sie glaubhaft machen, dass durch die Verschmelzung die Erfüllung ihrer Forderung gefährdet wird."
    },
    {
      "date": "2025-01-13",
      "id": "98467",
      "original_text": "Einreichung neuer Dokumente\nHessen Amtsgericht Offenbach am Main HRB 55740\nKARL MAYER Holding Management SE – Obertshausen",
      "type": "Einreichung neuer Dokumente",
      "state": "Hessen",
      "amtsgericht": "Amtsgericht Offenbach am Main",
      "registernummer": "HRB 55740",
      "registerart": "HRB",
      "company_name": "KARL MAYER Holding Management SE",
      "company_seat": "Obertshausen",
      "details": "13.01.2025 (Bekanntmachungsdatum)\n\nHessen Amtsgericht Offenbach am Main HRB 55740\nEinreichung neuer Dokumente 13.01.2025 (Eintragungsdatum)\n\nKARL MAYER Holding Management SE\nEuropäische Aktiengesellschaft (SE)\nObertshausen\n\nDurch eine Änderung in den Personen der Aufsichtsratsmitglieder ist eine Liste der Mitglieder des Aufsichtsrates zum Handelsregister eingereicht worden."
    },
    {
      "date": "2025-01-13",
      "id": "98468",
      "original_text": "Registerbekanntmachung nach dem Umwandlungsgesetz\nHessen Amtsgericht Frankfurt am Main HRB 136272\nAudika GmbH – Frankfurt am Main",
      "type": "Registerbekanntmachung nach dem Umwandlungsgesetz",
      "state": "Hessen",
      "amtsgericht": "Amtsgericht Frankfurt am Main",
      "registernummer": "HRB 136272",
      "registerart": "HRB",
      "company_name": "Audika GmbH",
      "company_seat": "Frankfurt am Main",
      "details": "13.01.2025 (Bekanntmachungsdatum)\n\nHessen Amtsgericht Frankfurt am Main HRB 136272\nRegisterbekanntmachung nach dem Umwandlungsgesetz 13.01.2025 (Eintragungsdatum)\n\nAudika GmbH\nGesellschaft mit beschränkter Haftung\nFrankfurt am Main\n\nDen Gläubigern der an der Verschmelzung beteiligten Rechtsträger ist, wenn sie binnen sechs Monaten nach dem Tag, an dem die Eintragung der Verschmelzung in das Register des Sitzes desjenigen Rechtsträgers, dessen Gläubiger sie sind, nach § 19 Absatz 3 UmwG bekannt gemacht worden ist, ihren Anspruch nach Grund und Höhe schriftlich anmelden, Sicherheit zu leisten, soweit sie nicht Befriedigung verlangen können. Dieses Recht steht den Gläubigern jedoch nur zu, wenn sie glaubhaft machen, dass durch die Verschmelzung die Erfüllung ihrer Forderung gefährdet wird."
    }
  ]
}