{
  "date": "2025-01-25",
  "date_of_scrape": "2025-02-11T08:57:51.177Z",
  "tool_version": "0.2.0",
  "number_of_announcements": 18,
  "announcements": [
    {
      "date": "2025-01-25",
      "id": "99572",
      "original_text": "Sonstige Registerbekanntmachung\nBayern Amtsgericht Kempten (Allgäu) HRB 5192\nDEKRA Visatec GmbH – Sulzberg",
      "type": "Sonstige Registerbekanntmachung",
      "state": "Bayern",
      "amtsgericht": "Amtsgericht Kempten (Allgäu)",
      "registernummer": "HRB 5192",
      "registerart": "HRB",
      "company_name": "DEKRA Visatec GmbH",
      "company_seat": "Sulzberg",
      "details": "25.01.2025 (Bekanntmachungsdatum)\n\nBayern Amtsgericht Kempten (Allgäu) HRB 5192\nSonstige Registerbekanntmachung 16.01.2025 (Eintragungsdatum)\n\nDEKRA Visatec GmbH\nGesellschaft mit beschränkter Haftung\nSulzberg\n\nDen Gläubigern der Gesellschaft, deren Forderungen begründet worden sind, bevor die Eintragung der Beendigung des Beherrschungs- und Gewinnabführungsvertrages in das Handelsregister nach § 10 des Handelsgesetzbuches als bekanntgemacht gilt, hat der andere Vertragsteil Sicherheit zu leisten, wenn sie sich binnen sechs Monaten nach der Bekanntmachung der Eintragung zu diesem Zweck bei ihm melden."
    },
    {
      "date": "2025-01-25",
      "id": "99573",
      "original_text": "Registerbekanntmachung nach dem Umwandlungsgesetz\nBayern Amtsgericht Ingolstadt HRB 4095\nBionergy GmbH – Pfaffenhofen a.d. Ilm",
      "type": "Registerbekanntmachung nach dem Umwandlungsgesetz",
      "state": "Bayern",
      "amtsgericht": "Amtsgericht Ingolstadt",
      "registernummer": "HRB 4095",
      "registerart": "HRB",
      "company_name": "Bionergy GmbH",
      "company_seat": "Pfaffenhofen a.d. Ilm",
      "details": "25.01.2025 (Bekanntmachungsdatum)\n\nBayern Amtsgericht Ingolstadt HRB 4095\nRegisterbekanntmachung nach dem Umwandlungsgesetz 24.01.2025 (Eintragungsdatum)\n\nBionergy GmbH\nGesellschaft mit beschränkter Haftung\nPfaffenhofen a.d. Ilm\n\nDen Gläubigern der an der Verschmelzung beteiligten Rechtsträger ist, wenn sie binnen sechs Monaten nach dem Tag, an dem die Eintragung der Verschmelzung in das Register des Sitzes desjenigen Rechtsträgers, dessen Gläubiger sie sind, nach § 19 Abs. 3 UmwG als bekannt gemacht gilt, ihren Anspruch nach Grund und Höhe in Textform anmelden, Sicherheit zu leisten, soweit sie nicht Befriedigung verlangen können. Dieses Recht steht den Gläubigern jedoch nur zu, wenn sie glaubhaft machen, dass durch die Verschmelzung die Erfüllung ihrer Forderung gefährdet wird."
    },
    {
      "date": "2025-01-25",
      "id": "99574",
      "original_text": "Sonstige Registerbekanntmachung\nBayern Amtsgericht München HRB 187678\nBV Bayerische Vermögen GmbH – München",
      "type": "Sonstige Registerbekanntmachung",
      "state": "Bayern",
      "amtsgericht": "Amtsgericht München",
      "registernummer": "HRB 187678",
      "registerart": "HRB",
      "company_name": "BV Bayerische Vermögen GmbH",
      "company_seat": "München",
      "details": "25.01.2025 (Bekanntmachungsdatum)\n\nBayern Amtsgericht München HRB 187678\nSonstige Registerbekanntmachung 24.01.2025 (Eintragungsdatum)\n\nBV Bayerische Vermögen GmbH\nGesellschaft mit beschränkter Haftung\nMünchen\n\nDen Gläubigern der Gesellschaft, deren Forderungen begründet worden sind, bevor die Eintragung der Beendigung des Gewinnabführungsvertrages in das Handelsregister nach § 10 des Handelsgesetzbuches als bekanntgemacht gilt, hat der andere Vertragsteil Sicherheit zu leisten, wenn sie sich binnen sechs Monaten nach der Bekanntmachung der Eintragung zu diesem Zweck bei ihm melden."
    },
    {
      "date": "2025-01-25",
      "id": "99575",
      "original_text": "Einreichung neuer Dokumente\nBayern Amtsgericht Nürnberg HRB 9342\nNürnberger Lebensversicherung AG – Nürnberg",
      "type": "Einreichung neuer Dokumente",
      "state": "Bayern",
      "amtsgericht": "Amtsgericht Nürnberg",
      "registernummer": "HRB 9342",
      "registerart": "HRB",
      "company_name": "Nürnberger Lebensversicherung AG",
      "company_seat": "Nürnberg",
      "details": "25.01.2025 (Bekanntmachungsdatum)\n\nBayern Amtsgericht Nürnberg HRB 9342\nEinreichung neuer Dokumente 24.01.2025 (Eintragungsdatum)\n\nNürnberger Lebensversicherung AG\nAktiengesellschaft\nNürnberg\n\nDem Amtsgericht Nürnberg -Registergericht- ist eine Liste der Mitglieder des Aufsichtsrats eingereicht worden, § 106 AktG."
    },
    {
      "date": "2025-01-25",
      "id": "99576",
      "original_text": "Registerbekanntmachung nach dem Umwandlungsgesetz\nBayern Amtsgericht Augsburg GsR 386\nTanja Hasselberg-Priebe und Christian Priebe eGbR – Eresing",
      "type": "Registerbekanntmachung nach dem Umwandlungsgesetz",
      "state": "Bayern",
      "amtsgericht": "Amtsgericht Augsburg",
      "registernummer": "GsR 386",
      "registerart": "GsR",
      "company_name": "Tanja Hasselberg-Priebe und Christian Priebe eGbR",
      "company_seat": "Eresing",
      "details": "25.01.2025 (Bekanntmachungsdatum)\n\nBayern Amtsgericht Augsburg GsR 386\nRegisterbekanntmachung nach dem Umwandlungsgesetz 24.01.2025 (Eintragungsdatum)\n\nTanja Hasselberg-Priebe und Christian Priebe eGbR\nGesellschaft bürgerlichen Rechts\nEresing\n\nDen Gläubigern des formwechselnden Rechtsträgers ist, wenn sie binnen sechs Monaten nach dem Tag, an dem die Eintragung des Formwechsels nach § 201 UmwG als bekannt gemacht gilt, ihren Anspruch nach Grund und Höhe in Textform anmelden, Sicherheit zu leisten, soweit sie nicht Befriedigung verlangen können. Dieses Recht steht den Gläubigern jedoch nur zu, wenn sie glaubhaft machen, dass durch den Formwechsel die Erfüllung ihrer Forderung gefährdet wird."
    },
    {
      "date": "2025-01-25",
      "id": "99577",
      "original_text": "Sonstige Registerbekanntmachung\nBayern Amtsgericht Nürnberg HRB 66\nNÜRNBERGER Beteiligungs-AG – Nürnberg",
      "type": "Sonstige Registerbekanntmachung",
      "state": "Bayern",
      "amtsgericht": "Amtsgericht Nürnberg",
      "registernummer": "HRB 66",
      "registerart": "HRB",
      "company_name": "NÜRNBERGER Beteiligungs-AG",
      "company_seat": "Nürnberg",
      "details": "25.01.2025 (Bekanntmachungsdatum)\n\nBayern Amtsgericht Nürnberg HRB 66\nSonstige Registerbekanntmachung\n\nNÜRNBERGER Beteiligungs-AG\nAktiengesellschaft\nNürnberg\n\nDem Amtsgericht Nürnberg -Registergericht- ist eine Liste der Mitglieder des Aufsichtsrats eingereicht worden, § 106 AktG."
    },
    {
      "date": "2025-01-25",
      "id": "99578",
      "original_text": "Registerbekanntmachung nach dem Umwandlungsgesetz\nBayern Amtsgericht Ansbach HRA 4871\nZimmerei Gegg GmbH & Co. KG – Pappenheim-Bieswang",
      "type": "Registerbekanntmachung nach dem Umwandlungsgesetz",
      "state": "Bayern",
      "amtsgericht": "Amtsgericht Ansbach",
      "registernummer": "HRA 4871",
      "registerart": "HRA",
      "company_name": "Zimmerei Gegg GmbH & Co. KG",
      "company_seat": "Pappenheim-Bieswang",
      "details": "25.01.2025 (Bekanntmachungsdatum)\n\nBayern Amtsgericht Ansbach HRA 4871\nRegisterbekanntmachung nach dem Umwandlungsgesetz 24.01.2025 (Eintragungsdatum)\n\nZimmerei Gegg GmbH & Co. KG\nKommanditgesellschaft\nPappenheim-Bieswang\n\nDen Gläubigern des formwechselnden Rechtsträgers ist, wenn sie binnen sechs Monaten nach dem Tag, an dem die Eintragung des Formwechsels nach § 201 UmwG als bekannt gemacht gilt, ihren Anspruch nach Grund und Höhe in Textform anmelden, Sicherheit zu leisten, soweit sie nicht Befriedigung verlangen können. Dieses Recht steht den Gläubigern jedoch nur zu, wenn sie glaubhaft machen, dass durch den Formwechsel die Erfüllung ihrer Forderung gefährdet wird."
    },
    {
      "date": "2025-01-25",
      "id": "99579",
      "original_text": "Löschungsankündigung\nBayern Amtsgericht München HRA 110134\nWL Immobilien UG (haftungsbeschränkt) & Co. KG – München",
      "type": "Löschungsankündigung",
      "state": "Bayern",
      "amtsgericht": "Amtsgericht München",
      "registernummer": "HRA 110134",
      "registerart": "HRA",
      "company_name": "WL Immobilien UG (haftungsbeschränkt) & Co. KG",
      "company_seat": "München",
      "details": "25.01.2025 (Bekanntmachungsdatum)\n\nBayern Amtsgericht München HRA 110134\nLöschungsankündigung 23.01.2025 (Eintragungsdatum)\n\nWL Immobilien UG (haftungsbeschränkt) & Co. KG\nKommanditgesellschaft\nMünchen\n\nDas Registergericht beabsichtigt, die im Handelsregister eingetragene Firma wegen Vermögenslosigkeit von Amts wegen nach § 394 FamFG zu löschen. Die Frist zur Erhebung eines Widerspruchs ist auf drei Monate festgesetzt."
    },
    {
      "date": "2025-01-25",
      "id": "99580",
      "original_text": "Registerbekanntmachung nach dem Umwandlungsgesetz\nBayern Amtsgericht Ansbach HRB 3412\nZimmerei Gegg GmbH – Pappenheim-Bieswang",
      "type": "Registerbekanntmachung nach dem Umwandlungsgesetz",
      "state": "Bayern",
      "amtsgericht": "Amtsgericht Ansbach",
      "registernummer": "HRB 3412",
      "registerart": "HRB",
      "company_name": "Zimmerei Gegg GmbH",
      "company_seat": "Pappenheim-Bieswang",
      "details": "25.01.2025 (Bekanntmachungsdatum)\n\nBayern Amtsgericht Ansbach HRB 3412\nRegisterbekanntmachung nach dem Umwandlungsgesetz 24.01.2025 (Eintragungsdatum)\n\nZimmerei Gegg GmbH\nGesellschaft mit beschränkter Haftung\nPappenheim-Bieswang\n\nDen Gläubigern des formwechselnden Rechtsträgers ist, wenn sie binnen sechs Monaten nach dem Tag, an dem die Eintragung des Formwechsels nach § 201 UmwG als bekannt gemacht gilt, ihren Anspruch nach Grund und Höhe in Textform anmelden, Sicherheit zu leisten, soweit sie nicht Befriedigung verlangen können. Dieses Recht steht den Gläubigern jedoch nur zu, wenn sie glaubhaft machen, dass durch den Formwechsel die Erfüllung ihrer Forderung gefährdet wird."
    },
    {
      "date": "2025-01-25",
      "id": "99581",
      "original_text": "Registerbekanntmachung nach dem Umwandlungsgesetz\nBayern Amtsgericht München HRA 120577\nSEAC Germany Inc. & Co. KG – München",
      "type": "Registerbekanntmachung nach dem Umwandlungsgesetz",
      "state": "Bayern",
      "amtsgericht": "Amtsgericht München",
      "registernummer": "HRA 120577",
      "registerart": "HRA",
      "company_name": "SEAC Germany Inc. & Co. KG",
      "company_seat": "München",
      "details": "25.01.2025 (Bekanntmachungsdatum)\n\nBayern Amtsgericht München HRA 120577\nRegisterbekanntmachung nach dem Umwandlungsgesetz 24.01.2025 (Eintragungsdatum)\n\nSEAC Germany Inc. & Co. KG\nKommanditgesellschaft\nMünchen\n\nDen Gläubigern des formwechselnden Rechtsträgers ist, wenn sie binnen sechs Monaten nach dem Tag, an dem die Eintragung des Formwechsels nach § 201 UmwG als bekannt gemacht gilt, ihren Anspruch nach Grund und Höhe in Textform anmelden, Sicherheit zu leisten, soweit sie nicht Befriedigung verlangen können. Dieses Recht steht den Gläubigern jedoch nur zu, wenn sie glaubhaft machen, dass durch den Formwechsel die Erfüllung ihrer Forderung gefährdet wird."
    },
    {
      "date": "2025-01-25",
      "id": "99582",
      "original_text": "Einreichung neuer Dokumente\nBayern Amtsgericht München HRB 289271\nFNZ Bank SE – Aschheim",
      "type": "Einreichung neuer Dokumente",
      "state": "Bayern",
      "amtsgericht": "Amtsgericht München",
      "registernummer": "HRB 289271",
      "registerart": "HRB",
      "company_name": "FNZ Bank SE",
      "company_seat": "Aschheim",
      "details": "25.01.2025 (Bekanntmachungsdatum)\n\nBayern Amtsgericht München HRB 289271\nEinreichung neuer Dokumente\n\nFNZ Bank SE\nEuropäische Aktiengesellschaft (SE)\nAschheim\n\nDem Amtsgericht München -Registergericht- ist eine Liste der Mitglieder des Aufsichtsrats eingereicht worden, Art. 9 Abs. 1 Buchst. c (ii) SE-VO i.V.m. § 106 AktG."
    },
    {
      "date": "2025-01-25",
      "id": "99583",
      "original_text": "Sonstige Registerbekanntmachung\nBayern Amtsgericht München HRB 246211\nQUARTERBACK München GmbH – München",
      "type": "Sonstige Registerbekanntmachung",
      "state": "Bayern",
      "amtsgericht": "Amtsgericht München",
      "registernummer": "HRB 246211",
      "registerart": "HRB",
      "company_name": "QUARTERBACK München GmbH",
      "company_seat": "München",
      "details": "25.01.2025 (Bekanntmachungsdatum)\n\nBayern Amtsgericht München HRB 246211\nSonstige Registerbekanntmachung 24.01.2025 (Eintragungsdatum)\n\nQUARTERBACK München GmbH\nGesellschaft mit beschränkter Haftung\nMünchen\n\nDen Gläubigern der Gesellschaft, deren Forderungen begründet worden sind, bevor die Eintragung der Beendigung des Gewinnabführungsvertrages in das Handelsregister nach § 10 des Handelsgesetzbuches als bekanntgemacht gilt, hat der andere Vertragsteil Sicherheit zu leisten, wenn sie sich binnen sechs Monaten nach der Bekanntmachung der Eintragung zu diesem Zweck bei ihm melden."
    },
    {
      "date": "2025-01-25",
      "id": "99584",
      "original_text": "Sonstige Registerbekanntmachung\nBayern Amtsgericht München HRB 246211\nQUARTERBACK München GmbH – München",
      "type": "Sonstige Registerbekanntmachung",
      "state": "Bayern",
      "amtsgericht": "Amtsgericht München",
      "registernummer": "HRB 246211",
      "registerart": "HRB",
      "company_name": "QUARTERBACK München GmbH",
      "company_seat": "München",
      "details": "25.01.2025 (Bekanntmachungsdatum)\n\nBayern Amtsgericht München HRB 246211\nSonstige Registerbekanntmachung 24.01.2025 (Eintragungsdatum)\n\nQUARTERBACK München GmbH\nGesellschaft mit beschränkter Haftung\nMünchen\n\nDen Gläubigern der Gesellschaft, deren Forderungen begründet worden sind, bevor die Eintragung der Beendigung des Beherrschungsvertrages in das Handelsregister nach § 10 des Handelsgesetzbuches als bekanntgemacht gilt, hat der andere Vertragsteil Sicherheit zu leisten, wenn sie sich binnen sechs Monaten nach der Bekanntmachung der Eintragung zu diesem Zweck bei ihm melden."
    },
    {
      "date": "2025-01-25",
      "id": "99585",
      "original_text": "Registerbekanntmachung nach dem Umwandlungsgesetz\nBayern Amtsgericht Ingolstadt HRB 3501\nASCAM GmbH – Pfaffenhofen",
      "type": "Registerbekanntmachung nach dem Umwandlungsgesetz",
      "state": "Bayern",
      "amtsgericht": "Amtsgericht Ingolstadt",
      "registernummer": "HRB 3501",
      "registerart": "HRB",
      "company_name": "ASCAM GmbH",
      "company_seat": "Pfaffenhofen",
      "details": "25.01.2025 (Bekanntmachungsdatum)\n\nBayern Amtsgericht Ingolstadt HRB 3501\nRegisterbekanntmachung nach dem Umwandlungsgesetz 24.01.2025 (Eintragungsdatum)\n\nASCAM GmbH\nGesellschaft mit beschränkter Haftung\nPfaffenhofen\n\nDen Gläubigern der an der Verschmelzung beteiligten Rechtsträger ist, wenn sie binnen sechs Monaten nach dem Tag, an dem die Eintragung der Verschmelzung in das Register des Sitzes desjenigen Rechtsträgers, dessen Gläubiger sie sind, nach § 19 Abs. 3 UmwG als bekannt gemacht gilt, ihren Anspruch nach Grund und Höhe in Textform anmelden, Sicherheit zu leisten, soweit sie nicht Befriedigung verlangen können. Dieses Recht steht den Gläubigern jedoch nur zu, wenn sie glaubhaft machen, dass durch die Verschmelzung die Erfüllung ihrer Forderung gefährdet wird."
    },
    {
      "date": "2025-01-25",
      "id": "99586",
      "original_text": "Sonstige Registerbekanntmachung\nBayern Amtsgericht München HRB 171307\npure11 GmbH – Grünwald",
      "type": "Sonstige Registerbekanntmachung",
      "state": "Bayern",
      "amtsgericht": "Amtsgericht München",
      "registernummer": "HRB 171307",
      "registerart": "HRB",
      "company_name": "pure11 GmbH",
      "company_seat": "Grünwald",
      "details": "25.01.2025 (Bekanntmachungsdatum)\n\nBayern Amtsgericht München HRB 171307\nSonstige Registerbekanntmachung 24.01.2025 (Eintragungsdatum)\n\npure11 GmbH\nGesellschaft mit beschränkter Haftung\nGrünwald\n\nDen Gläubigern der Gesellschaft, deren Forderungen begründet worden sind, bevor die Eintragung der Beendigung des Gewinnabführungsvertrages in das Handelsregister nach § 10 des Handelsgesetzbuches als bekanntgemacht gilt, hat der andere Vertragsteil Sicherheit zu leisten, wenn sie sich binnen sechs Monaten nach der Bekanntmachung der Eintragung zu diesem Zweck bei ihm melden."
    },
    {
      "date": "2025-01-25",
      "id": "99587",
      "original_text": "Einreichung neuer Dokumente\nBayern Amtsgericht München HRB 42031\nKnorr-Bremse Aktiengesellschaft – München",
      "type": "Einreichung neuer Dokumente",
      "state": "Bayern",
      "amtsgericht": "Amtsgericht München",
      "registernummer": "HRB 42031",
      "registerart": "HRB",
      "company_name": "Knorr-Bremse Aktiengesellschaft",
      "company_seat": "München",
      "details": "25.01.2025 (Bekanntmachungsdatum)\n\nBayern Amtsgericht München HRB 42031\nEinreichung neuer Dokumente\n\nKnorr-Bremse Aktiengesellschaft\nAktiengesellschaft\nMünchen\n\nDem Amtsgericht München -Registergericht- ist eine Liste der Mitglieder des Aufsichtsrats eingereicht worden, § 106 AktG."
    },
    {
      "date": "2025-01-25",
      "id": "99588",
      "original_text": "Registerbekanntmachung nach dem Umwandlungsgesetz\nBayern Amtsgericht München HRB 235698\nHWN XIX GmbH – Grünwald",
      "type": "Registerbekanntmachung nach dem Umwandlungsgesetz",
      "state": "Bayern",
      "amtsgericht": "Amtsgericht München",
      "registernummer": "HRB 235698",
      "registerart": "HRB",
      "company_name": "HWN XIX GmbH",
      "company_seat": "Grünwald",
      "details": "25.01.2025 (Bekanntmachungsdatum)\n\nBayern Amtsgericht München HRB 235698\nRegisterbekanntmachung nach dem Umwandlungsgesetz 24.01.2025 (Eintragungsdatum)\n\nHWN XIX GmbH\nGesellschaft mit beschränkter Haftung\nGrünwald\n\nDen Gläubigern der an der Verschmelzung beteiligten Rechtsträger ist, wenn sie binnen sechs Monaten nach dem Tag, an dem die Eintragung der Verschmelzung in das Register des Sitzes desjenigen Rechtsträgers, dessen Gläubiger sie sind, nach § 19 Abs. 3 UmwG als bekannt gemacht gilt, ihren Anspruch nach Grund und Höhe in Textform anmelden, Sicherheit zu leisten, soweit sie nicht Befriedigung verlangen können. Dieses Recht steht den Gläubigern jedoch nur zu, wenn sie glaubhaft machen, dass durch die Verschmelzung die Erfüllung ihrer Forderung gefährdet wird."
    },
    {
      "date": "2025-01-25",
      "id": "99589",
      "original_text": "Löschungsankündigung\nSachsen Amtsgericht Leipzig HRB 40174\nD. M. Group GmbH – Rötha",
      "type": "Löschungsankündigung",
      "state": "Sachsen",
      "amtsgericht": "Amtsgericht Leipzig",
      "registernummer": "HRB 40174",
      "registerart": "HRB",
      "company_name": "D. M. Group GmbH",
      "company_seat": "Rötha",
      "details": "25.01.2025 (Bekanntmachungsdatum)\n\nSachsen Amtsgericht Leipzig HRB 40174\nLöschungsankündigung 25.01.2025 (Eintragungsdatum)\n\nD. M. Group GmbH\nGesellschaft mit beschränkter Haftung\nRötha\n\nDas Registergericht beabsichtigt, den im Handelsregister eingetragenen Liquidator Marian Vasiliev von Amts wegen nach § 395 Absatz 1 FamFG zu löschen. Die Frist zu Erhebung eines Widerspruchs gegen die beabsichtigte Löschung wird auf einen Monat festgesetzt."
    }
  ]
}