{
  "date": "2025-01-10",
  "date_of_scrape": "2025-01-12T09:03:37.590Z",
  "tool_version": "0.2.0",
  "number_of_announcements": 88,
  "announcements": [
    {
      "date": "2025-01-10",
      "id": "98252",
      "original_text": "Einreichung neuer Dokumente\nBayern Amtsgericht Landshut HRB 5487\nENDOR Aktiengesellschaft – Landshut",
      "type": "Einreichung neuer Dokumente",
      "state": "Bayern",
      "amtsgericht": "Amtsgericht Landshut",
      "registernummer": "HRB 5487",
      "registerart": "HRB",
      "company_name": "ENDOR Aktiengesellschaft",
      "company_seat": "Landshut",
      "details": "10.01.2025 (Bekanntmachungsdatum)\n\nBayern Amtsgericht Landshut HRB 5487\nEinreichung neuer Dokumente 09.01.2025 (Eintragungsdatum)\n\nENDOR Aktiengesellschaft\nAktiengesellschaft\nLandshut\n\nDem Amtsgericht Landshut -Registergericht- ist eine Liste der Mitglieder des Aufsichtsrats eingereicht worden, § 106 AktG."
    },
    {
      "date": "2025-01-10",
      "id": "98253",
      "original_text": "Registerbekanntmachung nach dem Umwandlungsgesetz\nBayern Amtsgericht Nürnberg HRA 20174\nBucar Diamantwerkzeuge GmbH & Co. KG – Nürnberg",
      "type": "Registerbekanntmachung nach dem Umwandlungsgesetz",
      "state": "Bayern",
      "amtsgericht": "Amtsgericht Nürnberg",
      "registernummer": "HRA 20174",
      "registerart": "HRA",
      "company_name": "Bucar Diamantwerkzeuge GmbH & Co. KG",
      "company_seat": "Nürnberg",
      "details": "10.01.2025 (Bekanntmachungsdatum)\n\nBayern Amtsgericht Nürnberg HRA 20174\nRegisterbekanntmachung nach dem Umwandlungsgesetz 09.01.2025 (Eintragungsdatum)\n\nBucar Diamantwerkzeuge GmbH & Co. KG\nKommanditgesellschaft\nNürnberg\n\nDen Gläubigern der an der Ausgliederung beteiligten Rechtsträger ist, wenn sie binnen sechs Monaten nach dem Tag, an dem die Eintragung der Ausgliederung in das Register des Sitzes desjenigen Rechtsträgers, dessen Gläubiger sie sind, nach §§ 125, 19 Abs. 3 UmwG als bekannt gemacht gilt, ihren Anspruch nach Grund und Höhe in Textform anmelden, Sicherheit zu leisten, soweit sie nicht Befriedigung verlangen können. Dieses Recht steht den Gläubigern jedoch nur zu, wenn sie glaubhaft machen, dass durch die Ausgliederung die Erfüllung ihrer Forderung gefährdet wird."
    },
    {
      "date": "2025-01-10",
      "id": "98254",
      "original_text": "Einreichung neuer Dokumente\nBayern Amtsgericht Fürth HRB 7803\nDIB Vermögensverwaltungs AG – Möhrendorf",
      "type": "Einreichung neuer Dokumente",
      "state": "Bayern",
      "amtsgericht": "Amtsgericht Fürth",
      "registernummer": "HRB 7803",
      "registerart": "HRB",
      "company_name": "DIB Vermögensverwaltungs AG",
      "company_seat": "Möhrendorf",
      "details": "10.01.2025 (Bekanntmachungsdatum)\n\nBayern Amtsgericht Fürth HRB 7803\nEinreichung neuer Dokumente\n\nDIB Vermögensverwaltungs AG\nAktiengesellschaft\nMöhrendorf\n\nDem Amtsgericht Fürth -Registergericht- ist eine Liste der Mitglieder des Aufsichtsrats eingereicht worden, § 106 AktG."
    },
    {
      "date": "2025-01-10",
      "id": "98255",
      "original_text": "Löschungsankündigung\nBayern Amtsgericht Passau HRB 11551\nLightning Pictures GmbH – Passau",
      "type": "Löschungsankündigung",
      "state": "Bayern",
      "amtsgericht": "Amtsgericht Passau",
      "registernummer": "HRB 11551",
      "registerart": "HRB",
      "company_name": "Lightning Pictures GmbH",
      "company_seat": "Passau",
      "details": "10.01.2025 (Bekanntmachungsdatum)\n\nBayern Amtsgericht Passau HRB 11551\nLöschungsankündigung\n\nLightning Pictures GmbH\nGesellschaft mit beschränkter Haftung\nPassau\n\nDas Registergericht beabsichtigt, die im Handelsregister eingetragene Gesellschaft wegen Vermögenslosigkeit von Amts wegen nach § 394 FamFG zu löschen. Die Frist zur Erhebung eines Widerspruchs ist auf einen Monat festgesetzt."
    },
    {
      "date": "2025-01-10",
      "id": "98256",
      "original_text": "Einreichung neuer Dokumente\nBayern Amtsgericht München HRB 234370\nZeppelin Rental GmbH – Garching b.München",
      "type": "Einreichung neuer Dokumente",
      "state": "Bayern",
      "amtsgericht": "Amtsgericht München",
      "registernummer": "HRB 234370",
      "registerart": "HRB",
      "company_name": "Zeppelin Rental GmbH",
      "company_seat": "Garching b.München",
      "details": "10.01.2025 (Bekanntmachungsdatum)\n\nBayern Amtsgericht München HRB 234370\nEinreichung neuer Dokumente\n\nZeppelin Rental GmbH\nGesellschaft mit beschränkter Haftung\nGarching b.München\n\nDem Amtsgericht München -Registergericht- ist eine Liste der Mitglieder des Aufsichtsrats eingereicht worden, § 52 Abs. 3 S. 2 GmbHG."
    },
    {
      "date": "2025-01-10",
      "id": "98257",
      "original_text": "Sonstige Registerbekanntmachung\nBayern Amtsgericht München HRB 118814\nHoerbiger Kompressortechnik GmbH – Schongau",
      "type": "Sonstige Registerbekanntmachung",
      "state": "Bayern",
      "amtsgericht": "Amtsgericht München",
      "registernummer": "HRB 118814",
      "registerart": "HRB",
      "company_name": "Hoerbiger Kompressortechnik GmbH",
      "company_seat": "Schongau",
      "details": "10.01.2025 (Bekanntmachungsdatum)\n\nBayern Amtsgericht München HRB 118814\nSonstige Registerbekanntmachung 09.01.2025 (Eintragungsdatum)\n\nHoerbiger Kompressortechnik GmbH\nGesellschaft mit beschränkter Haftung\nSchongau\n\nDen Gläubigern der Gesellschaft, deren Forderungen begründet worden sind, bevor die Eintragung der Beendigung des Beherrschungs- und Gewinnabführungsvertrages in das Handelsregister nach § 10 des Handelsgesetzbuches als bekanntgemacht gilt, hat der andere Vertragsteil Sicherheit zu leisten, wenn sie sich binnen sechs Monaten nach der Bekanntmachung der Eintragung zu diesem Zweck bei ihm melden."
    },
    {
      "date": "2025-01-10",
      "id": "98258",
      "original_text": "Registerbekanntmachung nach dem Umwandlungsgesetz\nBayern Amtsgericht Aschaffenburg HRB 15351\nWhisky Bunker GmbH – Rüdenau",
      "type": "Registerbekanntmachung nach dem Umwandlungsgesetz",
      "state": "Bayern",
      "amtsgericht": "Amtsgericht Aschaffenburg",
      "registernummer": "HRB 15351",
      "registerart": "HRB",
      "company_name": "Whisky Bunker GmbH",
      "company_seat": "Rüdenau",
      "details": "10.01.2025 (Bekanntmachungsdatum)\n\nBayern Amtsgericht Aschaffenburg HRB 15351\nRegisterbekanntmachung nach dem Umwandlungsgesetz 09.01.2025 (Eintragungsdatum)\n\nWhisky Bunker GmbH\nGesellschaft mit beschränkter Haftung\nRüdenau\n\nDen Gläubigern des formwechselnden Rechtsträgers ist, wenn sie binnen sechs Monaten nach dem Tag, an dem die Eintragung des Formwechsels nach § 201 UmwG als bekannt gemacht gilt, ihren Anspruch nach Grund und Höhe in Textform anmelden, Sicherheit zu leisten, soweit sie nicht Befriedigung verlangen können. Dieses Recht steht den Gläubigern jedoch nur zu, wenn sie glaubhaft machen, dass durch den Formwechsel die Erfüllung ihrer Forderung gefährdet wird."
    },
    {
      "date": "2025-01-10",
      "id": "98259",
      "original_text": "Registerbekanntmachung nach dem Umwandlungsgesetz\nBayern Amtsgericht München HRA 104489\nServiceplan Neo GmbH & Co. KG – München",
      "type": "Registerbekanntmachung nach dem Umwandlungsgesetz",
      "state": "Bayern",
      "amtsgericht": "Amtsgericht München",
      "registernummer": "HRA 104489",
      "registerart": "HRA",
      "company_name": "Serviceplan Neo GmbH & Co. KG",
      "company_seat": "München",
      "details": "10.01.2025 (Bekanntmachungsdatum)\n\nBayern Amtsgericht München HRA 104489\nRegisterbekanntmachung nach dem Umwandlungsgesetz 09.01.2025 (Eintragungsdatum)\n\nServiceplan Neo GmbH & Co. KG\nKommanditgesellschaft\nMünchen\n\nDen Gläubigern der an der Verschmelzung beteiligten Rechtsträger ist, wenn sie binnen sechs Monaten nach dem Tag, an dem die Eintragung der Verschmelzung in das Register des Sitzes desjenigen Rechtsträgers, dessen Gläubiger sie sind, nach § 19 Abs. 3 UmwG als bekannt gemacht gilt, ihren Anspruch nach Grund und Höhe in Textform anmelden, Sicherheit zu leisten, soweit sie nicht Befriedigung verlangen können. Dieses Recht steht den Gläubigern jedoch nur zu, wenn sie glaubhaft machen, dass durch die Verschmelzung die Erfüllung ihrer Forderung gefährdet wird."
    },
    {
      "date": "2025-01-10",
      "id": "98260",
      "original_text": "Registerbekanntmachung nach dem Umwandlungsgesetz\nBayern Amtsgericht München HRB 218995\nSUSTAINVEST Beteiligungs GmbH – Unterhaching",
      "type": "Registerbekanntmachung nach dem Umwandlungsgesetz",
      "state": "Bayern",
      "amtsgericht": "Amtsgericht München",
      "registernummer": "HRB 218995",
      "registerart": "HRB",
      "company_name": "SUSTAINVEST Beteiligungs GmbH",
      "company_seat": "Unterhaching",
      "details": "10.01.2025 (Bekanntmachungsdatum)\n\nBayern Amtsgericht München HRB 218995\nRegisterbekanntmachung nach dem Umwandlungsgesetz 09.01.2025 (Eintragungsdatum)\n\nSUSTAINVEST Beteiligungs GmbH\nGesellschaft mit beschränkter Haftung\nUnterhaching\n\nDen Gläubigern der an der Verschmelzung beteiligten Rechtsträger ist, wenn sie binnen sechs Monaten nach dem Tag, an dem die Eintragung der Verschmelzung in das Register des Sitzes desjenigen Rechtsträgers, dessen Gläubiger sie sind, nach § 19 Abs. 3 UmwG als bekannt gemacht gilt, ihren Anspruch nach Grund und Höhe in Textform anmelden, Sicherheit zu leisten, soweit sie nicht Befriedigung verlangen können. Dieses Recht steht den Gläubigern jedoch nur zu, wenn sie glaubhaft machen, dass durch die Verschmelzung die Erfüllung ihrer Forderung gefährdet wird."
    },
    {
      "date": "2025-01-10",
      "id": "98261",
      "original_text": "Einreichung neuer Dokumente\nBayern Amtsgericht Bamberg HRB 9043\neco eco AG – Bamberg",
      "type": "Einreichung neuer Dokumente",
      "state": "Bayern",
      "amtsgericht": "Amtsgericht Bamberg",
      "registernummer": "HRB 9043",
      "registerart": "HRB",
      "company_name": "eco eco AG",
      "company_seat": "Bamberg",
      "details": "10.01.2025 (Bekanntmachungsdatum)\n\nBayern Amtsgericht Bamberg HRB 9043\nEinreichung neuer Dokumente\n\neco eco AG\nAktiengesellschaft\nBamberg\n\nDem Amtsgericht Bamberg -Registergericht- ist eine Liste der Mitglieder des Aufsichtsrats eingereicht worden, § 106 AktG."
    },
    {
      "date": "2025-01-10",
      "id": "98262",
      "original_text": "Sonstige Registerbekanntmachung\nBayern Amtsgericht Augsburg HRB 6455\nFLSmidth Pfister GmbH – Augsburg",
      "type": "Sonstige Registerbekanntmachung",
      "state": "Bayern",
      "amtsgericht": "Amtsgericht Augsburg",
      "registernummer": "HRB 6455",
      "registerart": "HRB",
      "company_name": "FLSmidth Pfister GmbH",
      "company_seat": "Augsburg",
      "details": "10.01.2025 (Bekanntmachungsdatum)\n\nBayern Amtsgericht Augsburg HRB 6455\nSonstige Registerbekanntmachung 09.01.2025 (Eintragungsdatum)\n\nFLSmidth Pfister GmbH\nGesellschaft mit beschränkter Haftung\nAugsburg\n\nDen Gläubigern der Gesellschaft, deren Forderungen begründet worden sind, bevor die Eintragung der Beendigung des Beherrschungs- und Gewinnabführungsvertrages in das Handelsregister nach § 10 des Handelsgesetzbuches als bekanntgemacht gilt, hat der andere Vertragsteil Sicherheit zu leisten, wenn sie sich binnen sechs Monaten nach der Bekanntmachung der Eintragung zu diesem Zweck bei ihm melden."
    },
    {
      "date": "2025-01-10",
      "id": "98263",
      "original_text": "Sonstige Registerbekanntmachung\nBayern Amtsgericht Hof HRB 5575\nTUZZI Collection GmbH – Münchberg",
      "type": "Sonstige Registerbekanntmachung",
      "state": "Bayern",
      "amtsgericht": "Amtsgericht Hof",
      "registernummer": "HRB 5575",
      "registerart": "HRB",
      "company_name": "TUZZI Collection GmbH",
      "company_seat": "Münchberg",
      "details": "10.01.2025 (Bekanntmachungsdatum)\n\nBayern Amtsgericht Hof HRB 5575\nSonstige Registerbekanntmachung 09.01.2025 (Eintragungsdatum)\n\nTUZZI Collection GmbH\nGesellschaft mit beschränkter Haftung\nMünchberg\n\nDen Gläubigern der Gesellschaft, deren Forderungen begründet worden sind, bevor die Eintragung der Beendigung des Beherrschungs- und Ergebnisabführungsvertrages in das Handelsregister nach § 10 des Handelsgesetzbuches als bekanntgemacht gilt, hat der andere Vertragsteil Sicherheit zu leisten, wenn sie sich binnen sechs Monaten nach der Bekanntmachung der Eintragung zu diesem Zweck bei ihm melden."
    },
    {
      "date": "2025-01-10",
      "id": "98264",
      "original_text": "Registerbekanntmachung nach dem Umwandlungsgesetz\nBayern Amtsgericht Nürnberg HRA 20161\nBucar Industriebedarf e.K. – Nürnberg",
      "type": "Registerbekanntmachung nach dem Umwandlungsgesetz",
      "state": "Bayern",
      "amtsgericht": "Amtsgericht Nürnberg",
      "registernummer": "HRA 20161",
      "registerart": "HRA",
      "company_name": "Bucar Industriebedarf e.K.",
      "company_seat": "Nürnberg",
      "details": "10.01.2025 (Bekanntmachungsdatum)\n\nBayern Amtsgericht Nürnberg HRA 20161\nRegisterbekanntmachung nach dem Umwandlungsgesetz 09.01.2025 (Eintragungsdatum)\n\nBucar Industriebedarf e.K.\nEinzelkaufmann / Einzelkauffrau\nNürnberg\n\nDen Gläubigern der an der Ausgliederung beteiligten Rechtsträger ist, wenn sie binnen sechs Monaten nach dem Tag, an dem die Eintragung der Ausgliederung in das Register des Sitzes desjenigen Rechtsträgers, dessen Gläubiger sie sind, nach §§ 125, 19 Abs. 3 UmwG als bekannt gemacht gilt, ihren Anspruch nach Grund und Höhe in Textform anmelden, Sicherheit zu leisten, soweit sie nicht Befriedigung verlangen können. Dieses Recht steht den Gläubigern jedoch nur zu, wenn sie glaubhaft machen, dass durch die Ausgliederung die Erfüllung ihrer Forderung gefährdet wird."
    },
    {
      "date": "2025-01-10",
      "id": "98265",
      "original_text": "Löschungsankündigung\nBayern Amtsgericht Fürth HRB 791\nWilli Bierlein & Rudolf Schwarz GmbH – Kalchreuth",
      "type": "Löschungsankündigung",
      "state": "Bayern",
      "amtsgericht": "Amtsgericht Fürth",
      "registernummer": "HRB 791",
      "registerart": "HRB",
      "company_name": "Willi Bierlein & Rudolf Schwarz GmbH",
      "company_seat": "Kalchreuth",
      "details": "10.01.2025 (Bekanntmachungsdatum)\n\nBayern Amtsgericht Fürth HRB 791\nLöschungsankündigung\n\nWilli Bierlein & Rudolf Schwarz GmbH\nGesellschaft mit beschränkter Haftung\nKalchreuth\n\nDas Registergericht beabsichtigt, die im Handelsregister eingetragene Gesellschaft wegen Vermögenslosigkeit von Amts wegen nach § 394 FamFG zu löschen. Die Frist zur Erhebung eines Widerspruchs ist auf drei Monate festgesetzt."
    },
    {
      "date": "2025-01-10",
      "id": "98266",
      "original_text": "Einreichung neuer Dokumente\nBayern Amtsgericht Aschaffenburg HRB 17907\nWhisky Bunker AG – Rüdenau",
      "type": "Einreichung neuer Dokumente",
      "state": "Bayern",
      "amtsgericht": "Amtsgericht Aschaffenburg",
      "registernummer": "HRB 17907",
      "registerart": "HRB",
      "company_name": "Whisky Bunker AG",
      "company_seat": "Rüdenau",
      "details": "10.01.2025 (Bekanntmachungsdatum)\n\nBayern Amtsgericht Aschaffenburg HRB 17907\nEinreichung neuer Dokumente 09.01.2025 (Eintragungsdatum)\n\nWhisky Bunker AG\nAktiengesellschaft\nRüdenau\n\nDem Registergericht Aschaffenburg ist eine Liste der Mitglieder des Aufsichtsrats eingereicht worden, § 106 AktG."
    },
    {
      "date": "2025-01-10",
      "id": "98267",
      "original_text": "Einreichung neuer Dokumente\nBayern Amtsgericht München HRB 111650\nBayerische Beamtenkrankenkasse Aktiengesellschaft – München",
      "type": "Einreichung neuer Dokumente",
      "state": "Bayern",
      "amtsgericht": "Amtsgericht München",
      "registernummer": "HRB 111650",
      "registerart": "HRB",
      "company_name": "Bayerische Beamtenkrankenkasse Aktiengesellschaft",
      "company_seat": "München",
      "details": "10.01.2025 (Bekanntmachungsdatum)\n\nBayern Amtsgericht München HRB 111650\nEinreichung neuer Dokumente\n\nBayerische Beamtenkrankenkasse Aktiengesellschaft\nAktiengesellschaft\nMünchen\n\nDem Amtsgericht München -Registergericht- ist eine Liste der Mitglieder des Aufsichtsrats eingereicht worden, § 106 AktG."
    },
    {
      "date": "2025-01-10",
      "id": "98268",
      "original_text": "Registerbekanntmachung nach dem Umwandlungsgesetz\nBayern Amtsgericht München HRB 237213\nBüchelhofer Asset Management GmbH – München",
      "type": "Registerbekanntmachung nach dem Umwandlungsgesetz",
      "state": "Bayern",
      "amtsgericht": "Amtsgericht München",
      "registernummer": "HRB 237213",
      "registerart": "HRB",
      "company_name": "Büchelhofer Asset Management GmbH",
      "company_seat": "München",
      "details": "10.01.2025 (Bekanntmachungsdatum)\n\nBayern Amtsgericht München HRB 237213\nRegisterbekanntmachung nach dem Umwandlungsgesetz 09.01.2025 (Eintragungsdatum)\n\nBüchelhofer Asset Management GmbH\nGesellschaft mit beschränkter Haftung\nMünchen\n\nDen Gläubigern der an der Verschmelzung beteiligten Rechtsträger ist, wenn sie binnen sechs Monaten nach dem Tag, an dem die Eintragung der Verschmelzung in das Register des Sitzes desjenigen Rechtsträgers, dessen Gläubiger sie sind, nach § 19 Abs. 3 UmwG als bekannt gemacht gilt, ihren Anspruch nach Grund und Höhe in Textform anmelden, Sicherheit zu leisten, soweit sie nicht Befriedigung verlangen können. Dieses Recht steht den Gläubigern jedoch nur zu, wenn sie glaubhaft machen, dass durch die Verschmelzung die Erfüllung ihrer Forderung gefährdet wird."
    },
    {
      "date": "2025-01-10",
      "id": "98269",
      "original_text": "Registerbekanntmachung nach dem Umwandlungsgesetz\nBayern Amtsgericht München HRB 112800\nWiSeA GmbH Wirtschaftsservice für Arzt- und Zahnarztpraxen – München",
      "type": "Registerbekanntmachung nach dem Umwandlungsgesetz",
      "state": "Bayern",
      "amtsgericht": "Amtsgericht München",
      "registernummer": "HRB 112800",
      "registerart": "HRB",
      "company_name": "WiSeA GmbH Wirtschaftsservice für Arzt- und Zahnarztpraxen",
      "company_seat": "München",
      "details": "10.01.2025 (Bekanntmachungsdatum)\n\nBayern Amtsgericht München HRB 112800\nRegisterbekanntmachung nach dem Umwandlungsgesetz 09.01.2025 (Eintragungsdatum)\n\nWiSeA GmbH Wirtschaftsservice für Arzt- und Zahnarztpraxen\nGesellschaft mit beschränkter Haftung\nMünchen\n\nDen Gläubigern der an der Verschmelzung beteiligten Rechtsträger ist, wenn sie binnen sechs Monaten nach dem Tag, an dem die Eintragung der Verschmelzung in das Register des Sitzes desjenigen Rechtsträgers, dessen Gläubiger sie sind, nach § 19 Abs. 3 UmwG als bekannt gemacht gilt, ihren Anspruch nach Grund und Höhe in Textform anmelden, Sicherheit zu leisten, soweit sie nicht Befriedigung verlangen können. Dieses Recht steht den Gläubigern jedoch nur zu, wenn sie glaubhaft machen, dass durch die Verschmelzung die Erfüllung ihrer Forderung gefährdet wird."
    },
    {
      "date": "2025-01-10",
      "id": "98270",
      "original_text": "Einreichung neuer Dokumente\nBayern Amtsgericht Aschaffenburg HRB 6649\nSingulus Technologies Aktiengesellschaft – Kahl am Main",
      "type": "Einreichung neuer Dokumente",
      "state": "Bayern",
      "amtsgericht": "Amtsgericht Aschaffenburg",
      "registernummer": "HRB 6649",
      "registerart": "HRB",
      "company_name": "Singulus Technologies Aktiengesellschaft",
      "company_seat": "Kahl am Main",
      "details": "10.01.2025 (Bekanntmachungsdatum)\n\nBayern Amtsgericht Aschaffenburg HRB 6649\nEinreichung neuer Dokumente\n\nSingulus Technologies Aktiengesellschaft\nAktiengesellschaft\nKahl am Main\n\nDem Amtsgericht Aschaffenburg -Registergericht- ist eine Liste der Mitglieder des Aufsichtsrats eingereicht worden, § 106 AktG."
    },
    {
      "date": "2025-01-10",
      "id": "98271",
      "original_text": "Sonstige Registerbekanntmachung\nBayern Amtsgericht München HRB 226303\nKlinge Biopharma GmbH – Holzkirchen",
      "type": "Sonstige Registerbekanntmachung",
      "state": "Bayern",
      "amtsgericht": "Amtsgericht München",
      "registernummer": "HRB 226303",
      "registerart": "HRB",
      "company_name": "Klinge Biopharma GmbH",
      "company_seat": "Holzkirchen",
      "details": "10.01.2025 (Bekanntmachungsdatum)\n\nBayern Amtsgericht München HRB 226303\nSonstige Registerbekanntmachung 09.01.2025 (Eintragungsdatum)\n\nKlinge Biopharma GmbH\nGesellschaft mit beschränkter Haftung\nHolzkirchen\n\nDen Gläubigern der Gesellschaft, deren Forderungen begründet worden sind, bevor die Eintragung der Beendigung des Beherrschungs- und Gewinnabführungsvertrages in das Handelsregister nach § 10 des Handelsgesetzbuches als bekanntgemacht gilt, hat der andere Vertragsteil Sicherheit zu leisten, wenn sie sich binnen sechs Monaten nach der Bekanntmachung der Eintragung zu diesem Zweck bei ihm melden."
    },
    {
      "date": "2025-01-10",
      "id": "98272",
      "original_text": "Sonstige Registerbekanntmachung\nBayern Amtsgericht Bayreuth HRB 3640\nMarkgrafen Heimdienst GmbH – Kulmbach",
      "type": "Sonstige Registerbekanntmachung",
      "state": "Bayern",
      "amtsgericht": "Amtsgericht Bayreuth",
      "registernummer": "HRB 3640",
      "registerart": "HRB",
      "company_name": "Markgrafen Heimdienst GmbH",
      "company_seat": "Kulmbach",
      "details": "10.01.2025 (Bekanntmachungsdatum)\n\nBayern Amtsgericht Bayreuth HRB 3640\nSonstige Registerbekanntmachung 09.01.2025 (Eintragungsdatum)\n\nMarkgrafen Heimdienst GmbH\nGesellschaft mit beschränkter Haftung\nKulmbach\n\nDen Gläubigern der Gesellschaft, deren Forderungen begründet worden sind, bevor die Eintragung der Beendigung des Gewinnabführungsvertrages in das Handelsregister nach § 10 des Handelsgesetzbuches als bekanntgemacht gilt, hat der andere Vertragsteil Sicherheit zu leisten, wenn sie sich binnen sechs Monaten nach der Bekanntmachung der Eintragung zu diesem Zweck bei ihm melden."
    },
    {
      "date": "2025-01-10",
      "id": "98273",
      "original_text": "Löschungsankündigung\nSaarland Amtsgericht Saarbrücken HRB 107599\nScholl Renovierung UG (haftungsbeschränkt) – Illingen",
      "type": "Löschungsankündigung",
      "state": "Saarland",
      "amtsgericht": "Amtsgericht Saarbrücken",
      "registernummer": "HRB 107599",
      "registerart": "HRB",
      "company_name": "Scholl Renovierung UG (haftungsbeschränkt)",
      "company_seat": "Illingen",
      "details": "10.01.2025 (Bekanntmachungsdatum)\n\nSaarland Amtsgericht Saarbrücken HRB 107599\nLöschungsankündigung\n\nScholl Renovierung UG (haftungsbeschränkt)\nGesellschaft mit beschränkter Haftung\nIllingen\n\nEs ist beabsichtigt, die Gesellschaft von Amts wegen gemäß § 394 FamFG wegen Vermögenslosigkeit zu löschen. Gegen die Löschung von Amts wegen ist das Rechtsmittel des Widerspruchs statthaft. Der Widerspruch ist binnen einer Frist von 1 Monat beginnend mit dem Tag dieser Veröffentlichung durch Einreichen eines Widerspruchsschreibens -schriftlich oder zur Niederschrift der Geschäftsstelle- beim Amtsgericht Saarbrücken, -zentrales Handelsregister-, Mainzerstr.178, 66121 Saarbrücken einzulegen. Der Widerspruch muss die Bezeichnung der angefochtenen Löschungsankündigung enthalten sowie die Erklärung, dass Widerspruch eingelegt wird. Er ist vom Widerspruchsführer oder seinem Bevollmächtigten zu unterzeichnen.\nDas Widerspruchsschreiben kann auch in der Form eines elektronischen Dokumentes eingereicht werden, das mit einer qualifizierten elektronischen Signatur nach dem Signaturgesetz versehen sein muss (§§ 14 Abs. 2 FamFG, 130a, 298 ZPO)."
    },
    {
      "date": "2025-01-10",
      "id": "98274",
      "original_text": "Löschungsankündigung\nBaden-Württemberg Amtsgericht Ulm HRB 739861\nrundum FINANZEN UG (haftungsbeschränkt) – Bingen",
      "type": "Löschungsankündigung",
      "state": "Baden-Württemberg",
      "amtsgericht": "Amtsgericht Ulm",
      "registernummer": "HRB 739861",
      "registerart": "HRB",
      "company_name": "rundum FINANZEN UG (haftungsbeschränkt)",
      "company_seat": "Bingen",
      "details": "10.01.2025 (Bekanntmachungsdatum)\n\nBaden-Württemberg Amtsgericht Ulm HRB 739861\nLöschungsankündigung\n\nrundum FINANZEN UG (haftungsbeschränkt)\nGesellschaft mit beschränkter Haftung\nBingen\n\nDas Gericht beabsichtigt, die Gesellschaft wegen Vermögenslosigkeit im Handelsregister von Amts wegen nach § 394 FamFG zu löschen. Die Frist zur Geltendmachung eines Widerspruchs gegen die beabsichtigte Löschung ist auf  einen Monat ab Veröffentlichung bestimmt."
    },
    {
      "date": "2025-01-10",
      "id": "98275",
      "original_text": "Registerbekanntmachung nach dem Umwandlungsgesetz\nBaden-Württemberg Amtsgericht Stuttgart HRB 108789\nJens Baumgärtner GmbH – Massenbachhausen",
      "type": "Registerbekanntmachung nach dem Umwandlungsgesetz",
      "state": "Baden-Württemberg",
      "amtsgericht": "Amtsgericht Stuttgart",
      "registernummer": "HRB 108789",
      "registerart": "HRB",
      "company_name": "Jens Baumgärtner GmbH",
      "company_seat": "Massenbachhausen",
      "details": "10.01.2025 (Bekanntmachungsdatum)\n\nBaden-Württemberg Amtsgericht Stuttgart HRB 108789\nRegisterbekanntmachung nach dem Umwandlungsgesetz 10.01.2025 (Eintragungsdatum)\n\nJens Baumgärtner GmbH\nGesellschaft mit beschränkter Haftung\nMassenbachhausen\n\nAls nicht eingetragen wird bekanntgemacht:\nDen Gläubigern der an der Verschmelzung beteiligten Rechtsträger ist, wenn sie binnen sechs Monaten nach dem Tag, an dem die Eintragung der Verschmelzung in das Register des Sitzes desjenigen Rechtsträgers, dessen Gläubiger sie sind, nach § 19 Abs. 3 UmwG als bekanntgemacht gilt, ihren Anspruch nach Grund und Höhe schriftlich anmelden, Sicherheit zu leisten, soweit sie nicht Befriedigung verlangen können. Dieses Recht steht den Gläubigern jedoch nur zu, wenn sie glaubhaft machen, dass durch die Verschmelzung die Erfüllung ihrer Forderung gefährdet wird."
    },
    {
      "date": "2025-01-10",
      "id": "98276",
      "original_text": "Einreichung neuer Dokumente\nSaarland Amtsgericht Saarbrücken HRB 4145\nVSE Aktiengesellschaft – Saarbrücken",
      "type": "Einreichung neuer Dokumente",
      "state": "Saarland",
      "amtsgericht": "Amtsgericht Saarbrücken",
      "registernummer": "HRB 4145",
      "registerart": "HRB",
      "company_name": "VSE Aktiengesellschaft",
      "company_seat": "Saarbrücken",
      "details": "10.01.2025 (Bekanntmachungsdatum)\n\nSaarland Amtsgericht Saarbrücken HRB 4145\nEinreichung neuer Dokumente\n\nVSE Aktiengesellschaft\nAktiengesellschaft\nSaarbrücken\n\nDer Vorstand der Gesellschaft hat eine Liste der Mitglieder des Aufsichtsrats zum Handelsregister eingereicht (§ 106 AktG)."
    },
    {
      "date": "2025-01-10",
      "id": "98277",
      "original_text": "Einreichung neuer Dokumente\nBaden-Württemberg Amtsgericht Mannheim HRB 710296\nBilfinger SE – Mannheim",
      "type": "Einreichung neuer Dokumente",
      "state": "Baden-Württemberg",
      "amtsgericht": "Amtsgericht Mannheim",
      "registernummer": "HRB 710296",
      "registerart": "HRB",
      "company_name": "Bilfinger SE",
      "company_seat": "Mannheim",
      "details": "10.01.2025 (Bekanntmachungsdatum)\n\nBaden-Württemberg Amtsgericht Mannheim HRB 710296\nEinreichung neuer Dokumente 10.01.2025 (Eintragungsdatum)\n\nBilfinger SE\nEuropäische Aktiengesellschaft (SE)\nMannheim\n\nDie Gesellschaft hat am 09.01.2025 die Liste über die Zusammensetzung des Aufsichtsrats zum Handelsregister eingereicht."
    },
    {
      "date": "2025-01-10",
      "id": "98278",
      "original_text": "Einreichung neuer Dokumente\nBaden-Württemberg Amtsgericht Mannheim HRB 240219\nKommunalbau GmbH Gesellschaft für Stadterneuerung und Stadtentwicklung Bretten – Bretten",
      "type": "Einreichung neuer Dokumente",
      "state": "Baden-Württemberg",
      "amtsgericht": "Amtsgericht Mannheim",
      "registernummer": "HRB 240219",
      "registerart": "HRB",
      "company_name": "Kommunalbau GmbH Gesellschaft für Stadterneuerung und Stadtentwicklung Bretten",
      "company_seat": "Bretten",
      "details": "10.01.2025 (Bekanntmachungsdatum)\n\nBaden-Württemberg Amtsgericht Mannheim HRB 240219\nEinreichung neuer Dokumente\n\nKommunalbau GmbH Gesellschaft für Stadterneuerung und Stadtentwicklung Bretten\nGesellschaft mit beschränkter Haftung\nBretten\n\nDie Gesellschaft hat am 08.01.2025 die Liste über die Zusammensetzung des Aufsichtsrats zum Handelsregister eingereicht."
    },
    {
      "date": "2025-01-10",
      "id": "98279",
      "original_text": "Löschungsankündigung\nBerlin Amtsgericht Berlin (Charlottenburg) HRB 113869\nEasy ABI GmbH – Berlin",
      "type": "Löschungsankündigung",
      "state": "Berlin",
      "amtsgericht": "Amtsgericht Berlin (Charlottenburg)",
      "registernummer": "HRB 113869",
      "registerart": "HRB",
      "company_name": "Easy ABI GmbH",
      "company_seat": "Berlin",
      "details": "10.01.2025 (Bekanntmachungsdatum)\n\nBerlin Amtsgericht Berlin (Charlottenburg) HRB 113869\nLöschungsankündigung\n\nEasy ABI GmbH\nGesellschaft mit beschränkter Haftung\nBerlin\n\nBei der nachstehenden Gesellschaft wird das Amtslöschungsverfahren gemäß § 394 FamFG eingeleitet. Widerspruchsfrist 6 Wochen"
    },
    {
      "date": "2025-01-10",
      "id": "98280",
      "original_text": "Löschungsankündigung\nMecklenburg-Vorpommern Amtsgericht Stralsund HRB 20360\nLandBoss UG (haftungsbeschränkt) – Tribsees",
      "type": "Löschungsankündigung",
      "state": "Mecklenburg-Vorpommern",
      "amtsgericht": "Amtsgericht Stralsund",
      "registernummer": "HRB 20360",
      "registerart": "HRB",
      "company_name": "LandBoss UG (haftungsbeschränkt)",
      "company_seat": "Tribsees",
      "details": "10.01.2025 (Bekanntmachungsdatum)\n\nMecklenburg-Vorpommern Amtsgericht Stralsund HRB 20360\nLöschungsankündigung\n\nLandBoss UG (haftungsbeschränkt)\nGesellschaft mit beschränkter Haftung\nTribsees\n\nDas Registergericht beabsichtigt, die im Handelsregister eingetragene Gesellschaft von Amts wegen nach § 394 FamFG zu löschen. Die Frist zur Erhebung eines Widerspruchs gegen die beabsichtigte Löschung wird auf 1 Monat festgesetzt."
    },
    {
      "date": "2025-01-10",
      "id": "98281",
      "original_text": "Einreichung neuer Dokumente\nHamburg Amtsgericht Hamburg HRB 182946\nAequitas Integration Aktiengesellschaft – Hamburg",
      "type": "Einreichung neuer Dokumente",
      "state": "Hamburg",
      "amtsgericht": "Amtsgericht Hamburg",
      "registernummer": "HRB 182946",
      "registerart": "HRB",
      "company_name": "Aequitas Integration Aktiengesellschaft",
      "company_seat": "Hamburg",
      "details": "10.01.2025 (Bekanntmachungsdatum)\n\nHamburg Amtsgericht Hamburg HRB 182946\nEinreichung neuer Dokumente\n\nAequitas Integration Aktiengesellschaft\nAktiengesellschaft\nHamburg\n\nAls nicht eingetragen wird bekannt gemacht: Liste des Aufsichtsrats wurde eingereicht."
    },
    {
      "date": "2025-01-10",
      "id": "98282",
      "original_text": "Sonstige Registerbekanntmachung\nBaden-Württemberg Amtsgericht Freiburg HRB 711722\ne.optimum AG – Offenburg",
      "type": "Sonstige Registerbekanntmachung",
      "state": "Baden-Württemberg",
      "amtsgericht": "Amtsgericht Freiburg",
      "registernummer": "HRB 711722",
      "registerart": "HRB",
      "company_name": "e.optimum AG",
      "company_seat": "Offenburg",
      "details": "10.01.2025 (Bekanntmachungsdatum)\n\nBaden-Württemberg Amtsgericht Freiburg HRB 711722\nSonstige Registerbekanntmachung 10.01.2025 (Eintragungsdatum)\n\ne.optimum AG\nAktiengesellschaft\nOffenburg\n\nAls nicht eingetragen wird bekanntgemacht:\nDen Gläubigern der Gesellschaft, deren Forderungen begründet worden sind, bevor die Eintragung der Beendigung des Vertrages in das Handelsregister nach § 10 HGB als bekanntgemacht gilt, ist vom anderen Vertragsteil Sicherheit zu leisten, wenn sie sich binnen sechs Monaten nach der Bekanntmachung zu diesem Zweck bei ihm melden."
    },
    {
      "date": "2025-01-10",
      "id": "98283",
      "original_text": "Sonstige Registerbekanntmachung\nBaden-Württemberg Amtsgericht Freiburg HRB 410922\nSF IntraLogistik GmbH – Rheinfelden Baden",
      "type": "Sonstige Registerbekanntmachung",
      "state": "Baden-Württemberg",
      "amtsgericht": "Amtsgericht Freiburg",
      "registernummer": "HRB 410922",
      "registerart": "HRB",
      "company_name": "SF IntraLogistik GmbH",
      "company_seat": "Rheinfelden Baden",
      "details": "10.01.2025 (Bekanntmachungsdatum)\n\nBaden-Württemberg Amtsgericht Freiburg HRB 410922\nSonstige Registerbekanntmachung 10.01.2025 (Eintragungsdatum)\n\nSF IntraLogistik GmbH\nGesellschaft mit beschränkter Haftung\nRheinfelden Baden\n\nAls nicht eingetragen wird bekanntgemacht:\nDen Gläubigern der Gesellschaft, deren Forderungen begründet worden sind, bevor die Eintragung der Beendigung des Vertrages in das Handelsregister nach § 10 HGB als bekanntgemacht gilt, ist vom anderen Vertragsteil Sicherheit zu leisten, wenn sie sich binnen sechs Monaten nach der Bekanntmachung zu diesem Zweck bei ihm melden."
    },
    {
      "date": "2025-01-10",
      "id": "98284",
      "original_text": "Registerbekanntmachung nach dem Umwandlungsgesetz\nBerlin Amtsgericht Berlin (Charlottenburg) HRA 63802\nNicolas Demuth e.K – Berlin",
      "type": "Registerbekanntmachung nach dem Umwandlungsgesetz",
      "state": "Berlin",
      "amtsgericht": "Amtsgericht Berlin (Charlottenburg)",
      "registernummer": "HRA 63802",
      "registerart": "HRA",
      "company_name": "Nicolas Demuth e.K",
      "company_seat": "Berlin",
      "details": "10.01.2025 (Bekanntmachungsdatum)\n\nBerlin Amtsgericht Berlin (Charlottenburg) HRA 63802\nRegisterbekanntmachung nach dem Umwandlungsgesetz 09.01.2025 (Eintragungsdatum)\n\nNicolas Demuth e.K\nEinzelkaufmann / Einzelkauffrau\nBerlin\n\nZu Eintragungsnummer 2 vom 09.01.2025 wird als nicht eingetragen veröffentlicht:Den Gläubigern der an der Spaltung beteiligten Rechtsträger ist, wenn sie binnen sechs Monaten nach dem Tag, an dem die Eintragung der Spaltung in das Register des Sitzes desjenigen Rechtsträgers, dessen Gläubiger sie sind, als bekannt gemacht gilt, ihren Anspruch nach Grund und Höhe schriftlich anmelden, Sicherheit zu leisten, soweit sie nicht Befriedigung verlangen können. Dieses Recht steht den Gläubigern jedoch nur zu, wenn sie glaubhaft machen, dass durch die Spaltung die Erfüllung ihrer Forderung gefährdet wird. Das Recht, Sicherheitsleistung zu verlangen, steht Gläubigern nicht zu, die im Falle der Insolvenz ein Recht auf vorzugsweise Befriedigung aus einer Deckungsmasse haben, die nach gesetzlicher Vorschrift zu ihrem Schutz errichtet und staatlich überwacht ist."
    },
    {
      "date": "2025-01-10",
      "id": "98285",
      "original_text": "Registerbekanntmachung nach dem Umwandlungsgesetz\nBerlin Amtsgericht Berlin (Charlottenburg) HRB 270953\nParra for Cuva GmbH – Berlin",
      "type": "Registerbekanntmachung nach dem Umwandlungsgesetz",
      "state": "Berlin",
      "amtsgericht": "Amtsgericht Berlin (Charlottenburg)",
      "registernummer": "HRB 270953",
      "registerart": "HRB",
      "company_name": "Parra for Cuva GmbH",
      "company_seat": "Berlin",
      "details": "10.01.2025 (Bekanntmachungsdatum)\n\nBerlin Amtsgericht Berlin (Charlottenburg) HRB 270953\nRegisterbekanntmachung nach dem Umwandlungsgesetz 09.01.2025 (Eintragungsdatum)\n\nParra for Cuva GmbH\nGesellschaft mit beschränkter Haftung\nBerlin\n\nZu Eintragungsnummer 1 vom 09.01.2025 wird als nicht eingetragen veröffentlicht:Den Gläubigern der an der Spaltung beteiligten Rechtsträger ist, wenn sie binnen sechs Monaten nach dem Tag, an dem die Eintragung der Spaltung in das Register des Sitzes desjenigen Rechtsträgers, dessen Gläubiger sie sind, als bekannt gemacht gilt, ihren Anspruch nach Grund und Höhe schriftlich anmelden, Sicherheit zu leisten, soweit sie nicht Befriedigung verlangen können. Dieses Recht steht den Gläubigern jedoch nur zu, wenn sie glaubhaft machen, dass durch die Spaltung die Erfüllung ihrer Forderung gefährdet wird. Das Recht, Sicherheitsleistung zu verlangen, steht Gläubigern nicht zu, die im Falle der Insolvenz ein Recht auf vorzugsweise Befriedigung aus einer Deckungsmasse haben, die nach gesetzlicher Vorschrift zu ihrem Schutz errichtet und staatlich überwacht ist."
    },
    {
      "date": "2025-01-10",
      "id": "98286",
      "original_text": "Löschungsankündigung\nSchleswig-Holstein Amtsgericht Lübeck HRB 21747\nB.A.U. Bauleistungen GmbH – Lübeck",
      "type": "Löschungsankündigung",
      "state": "Schleswig-Holstein",
      "amtsgericht": "Amtsgericht Lübeck",
      "registernummer": "HRB 21747",
      "registerart": "HRB",
      "company_name": "B.A.U. Bauleistungen GmbH",
      "company_seat": "Lübeck",
      "details": "10.01.2025 (Bekanntmachungsdatum)\n\nSchleswig-Holstein Amtsgericht Lübeck HRB 21747\nLöschungsankündigung\n\nB.A.U. Bauleistungen GmbH\nGesellschaft mit beschränkter Haftung\nLübeck\n\nEs ist die Löschung der nachstehenden Gesellschaft wegen Vermögenslosigkeit gemäß § 394 FamFG beabsichtigt. Widerspruchsfrist: 1 Monat."
    },
    {
      "date": "2025-01-10",
      "id": "98287",
      "original_text": "Sonstige Registerbekanntmachung\nBaden-Württemberg Amtsgericht Mannheim HRB 240414\nStadtwerke Bretten Gesellschaft mit beschränkter Haftung – Bretten",
      "type": "Sonstige Registerbekanntmachung",
      "state": "Baden-Württemberg",
      "amtsgericht": "Amtsgericht Mannheim",
      "registernummer": "HRB 240414",
      "registerart": "HRB",
      "company_name": "Stadtwerke Bretten Gesellschaft mit beschränkter Haftung",
      "company_seat": "Bretten",
      "details": "10.01.2025 (Bekanntmachungsdatum)\n\nBaden-Württemberg Amtsgericht Mannheim HRB 240414\nSonstige Registerbekanntmachung\n\nStadtwerke Bretten Gesellschaft mit beschränkter Haftung\nGesellschaft mit beschränkter Haftung\nBretten\n\nDie Gesellschaft hat am 08.01.2025 die Liste über die Zusammensetzung des Aufsichtsrats zum Handelsregister eingereicht."
    },
    {
      "date": "2025-01-10",
      "id": "98288",
      "original_text": "Einreichung neuer Dokumente\nBaden-Württemberg Amtsgericht Mannheim HRB 702991\nGewerbeentwicklung Baden-Baden GmbH – Baden-Baden",
      "type": "Einreichung neuer Dokumente",
      "state": "Baden-Württemberg",
      "amtsgericht": "Amtsgericht Mannheim",
      "registernummer": "HRB 702991",
      "registerart": "HRB",
      "company_name": "Gewerbeentwicklung Baden-Baden GmbH",
      "company_seat": "Baden-Baden",
      "details": "10.01.2025 (Bekanntmachungsdatum)\n\nBaden-Württemberg Amtsgericht Mannheim HRB 702991\nEinreichung neuer Dokumente\n\nGewerbeentwicklung Baden-Baden GmbH\nGesellschaft mit beschränkter Haftung\nBaden-Baden\n\nDie Gesellschaft hat am 17.12.2024  und am 09.01.2025 die Liste über die Zusammensetzung des Aufsichtsrats zum Handelsregister eingereicht."
    },
    {
      "date": "2025-01-10",
      "id": "98289",
      "original_text": "Löschungsankündigung\nSachsen-Anhalt Amtsgericht Stendal HRB 34481\nAsset Logistics GmbH – Köthen (Anhalt)",
      "type": "Löschungsankündigung",
      "state": "Sachsen-Anhalt",
      "amtsgericht": "Amtsgericht Stendal",
      "registernummer": "HRB 34481",
      "registerart": "HRB",
      "company_name": "Asset Logistics GmbH",
      "company_seat": "Köthen (Anhalt)",
      "details": "10.01.2025 (Bekanntmachungsdatum)\n\nSachsen-Anhalt Amtsgericht Stendal HRB 34481\nLöschungsankündigung\n\nAsset Logistics GmbH\nGesellschaft mit beschränkter Haftung\nKöthen (Anhalt)\n\nDas Registergericht beabsichtigt, den Geschäftsführer von Amts wegen nach § 395 FamFG zu löschen. Die Frist zur Erhebung eines Widerspruchs gegen die beabsichtigte Löschung wird auf einen Monat festgesetzt."
    },
    {
      "date": "2025-01-10",
      "id": "98290",
      "original_text": "Sonstige Registerbekanntmachung\nBerlin Amtsgericht Berlin (Charlottenburg) HRB 259317\nsunnexus PV Verwaltungs GmbH – Berlin",
      "type": "Sonstige Registerbekanntmachung",
      "state": "Berlin",
      "amtsgericht": "Amtsgericht Berlin (Charlottenburg)",
      "registernummer": "HRB 259317",
      "registerart": "HRB",
      "company_name": "sunnexus PV Verwaltungs GmbH",
      "company_seat": "Berlin",
      "details": "10.01.2025 (Bekanntmachungsdatum)\n\nBerlin Amtsgericht Berlin (Charlottenburg) HRB 259317\nSonstige Registerbekanntmachung\n\nsunnexus PV Verwaltungs GmbH\nGesellschaft mit beschränkter Haftung\nBerlin\n\nAls nicht eingetragen wird veröffentlicht: Der andere Vertragsteil hat den Gläubigern dieses Rechtsträgers, deren Forderungen begründet worden sind, bevor die Eintragung der Beendigung dieses Vertrages in das Handelsregister nach § 10 des Handelsgesetzbuches als bekannt gemacht gilt, Sicherheit zu leisten, wenn sie sich binnen sechs Monaten nach der Bekanntmachung der Eintragung zu diesem Zweck bei ihm melden. Dieses Recht steht den Gläubigern nicht zu, die im Fall des Insolvenzverfahrens ein Recht auf vorzugsweise Befriedigung aus der Deckungsmasse haben, die nach gesetzlicher Vorschrift zu ihrem Schutz errichtet und staatlich überwacht ist."
    },
    {
      "date": "2025-01-10",
      "id": "98291",
      "original_text": "Registerbekanntmachung nach dem Umwandlungsgesetz\nBaden-Württemberg Amtsgericht Mannheim HRB 748125\nAESTHETIKON GmbH – Mannheim",
      "type": "Registerbekanntmachung nach dem Umwandlungsgesetz",
      "state": "Baden-Württemberg",
      "amtsgericht": "Amtsgericht Mannheim",
      "registernummer": "HRB 748125",
      "registerart": "HRB",
      "company_name": "AESTHETIKON GmbH",
      "company_seat": "Mannheim",
      "details": "10.01.2025 (Bekanntmachungsdatum)\n\nBaden-Württemberg Amtsgericht Mannheim HRB 748125\nRegisterbekanntmachung nach dem Umwandlungsgesetz 10.01.2025 (Eintragungsdatum)\n\nAESTHETIKON GmbH\nGesellschaft mit beschränkter Haftung\nMannheim\n\nAls nicht eingetragen wird bekanntgemacht:\nDen Gläubigern der an der Verschmelzung beteiligten Rechtsträger ist, wenn sie binnen sechs Monaten nach dem Tag, an dem die Eintragung der Verschmelzung in das Register des Sitzes desjenigen Rechtsträgers, dessen Gläubiger sie sind, nach § 19 Abs. 3 UmwG als bekanntgemacht gilt, ihren Anspruch nach Grund und Höhe schriftlich anmelden, Sicherheit zu leisten, soweit sie nicht Befriedigung verlangen können. Dieses Recht steht den Gläubigern jedoch nur zu, wenn sie glaubhaft machen, dass durch die Verschmelzung die Erfüllung ihrer Forderung gefährdet wird."
    },
    {
      "date": "2025-01-10",
      "id": "98292",
      "original_text": "Registerbekanntmachung nach dem Umwandlungsgesetz\nBaden-Württemberg Amtsgericht Mannheim GsR 1126\nProf. Dr. Fischer eGbR – Mannheim",
      "type": "Registerbekanntmachung nach dem Umwandlungsgesetz",
      "state": "Baden-Württemberg",
      "amtsgericht": "Amtsgericht Mannheim",
      "registernummer": "GsR 1126",
      "registerart": "GsR",
      "company_name": "Prof. Dr. Fischer eGbR",
      "company_seat": "Mannheim",
      "details": "10.01.2025 (Bekanntmachungsdatum)\n\nBaden-Württemberg Amtsgericht Mannheim GsR 1126\nRegisterbekanntmachung nach dem Umwandlungsgesetz 10.01.2025 (Eintragungsdatum)\n\nProf. Dr. Fischer eGbR\nGesellschaft bürgerlichen Rechts\nMannheim\n\nAls nicht eingetragen wird bekanntgemacht:\nDen Gläubigern der an der Verschmelzung beteiligten Rechtsträger ist, wenn sie binnen sechs Monaten nach dem Tag, an dem die Eintragung der Verschmelzung in das Register des Sitzes desjenigen Rechtsträgers, dessen Gläubiger sie sind, nach § 19 Abs. 3 UmwG als bekanntgemacht gilt, ihren Anspruch nach Grund und Höhe schriftlich anmelden, Sicherheit zu leisten, soweit sie nicht Befriedigung verlangen können. Dieses Recht steht den Gläubigern jedoch nur zu, wenn sie glaubhaft machen, dass durch die Verschmelzung die Erfüllung ihrer Forderung gefährdet wird."
    },
    {
      "date": "2025-01-10",
      "id": "98293",
      "original_text": "Registerbekanntmachung nach dem Umwandlungsgesetz\nBaden-Württemberg Amtsgericht Freiburg HRA 708939\nAntonio Argenziano e.K. – Heitersheim",
      "type": "Registerbekanntmachung nach dem Umwandlungsgesetz",
      "state": "Baden-Württemberg",
      "amtsgericht": "Amtsgericht Freiburg",
      "registernummer": "HRA 708939",
      "registerart": "HRA",
      "company_name": "Antonio Argenziano e.K.",
      "company_seat": "Heitersheim",
      "details": "10.01.2025 (Bekanntmachungsdatum)\n\nBaden-Württemberg Amtsgericht Freiburg HRA 708939\nRegisterbekanntmachung nach dem Umwandlungsgesetz 10.01.2025 (Eintragungsdatum)\n\nAntonio Argenziano e.K.\nEinzelkaufmann / Einzelkauffrau\nHeitersheim\n\nAls nicht eingetragen wird bekanntgemacht:\nDen Gläubigern der an der Verschmelzung beteiligten Rechtsträger ist, wenn sie binnen sechs Monaten nach dem Tag, an dem die Eintragung der Verschmelzung in das Register des Sitzes desjenigen Rechtsträgers, dessen Gläubiger sie sind, nach § 19 Abs. 3 UmwG als bekanntgemacht gilt, ihren Anspruch nach Grund und Höhe schriftlich anmelden, Sicherheit zu leisten, soweit sie nicht Befriedigung verlangen können. Dieses Recht steht den Gläubigern jedoch nur zu, wenn sie glaubhaft machen, dass durch die Verschmelzung die Erfüllung ihrer Forderung gefährdet wird."
    },
    {
      "date": "2025-01-10",
      "id": "98294",
      "original_text": "Registerbekanntmachung nach dem Umwandlungsgesetz\nBaden-Württemberg Amtsgericht Freiburg HRB 720510\nAntonio Argenziano GmbH – Heitersheim",
      "type": "Registerbekanntmachung nach dem Umwandlungsgesetz",
      "state": "Baden-Württemberg",
      "amtsgericht": "Amtsgericht Freiburg",
      "registernummer": "HRB 720510",
      "registerart": "HRB",
      "company_name": "Antonio Argenziano GmbH",
      "company_seat": "Heitersheim",
      "details": "10.01.2025 (Bekanntmachungsdatum)\n\nBaden-Württemberg Amtsgericht Freiburg HRB 720510\nRegisterbekanntmachung nach dem Umwandlungsgesetz 10.01.2025 (Eintragungsdatum)\n\nAntonio Argenziano GmbH\nGesellschaft mit beschränkter Haftung\nHeitersheim\n\nAls nicht eingetragen wird bekanntgemacht:\nDen Gläubigern der an der Verschmelzung beteiligten Rechtsträger ist, wenn sie binnen sechs Monaten nach dem Tag, an dem die Eintragung der Verschmelzung in das Register des Sitzes desjenigen Rechtsträgers, dessen Gläubiger sie sind, nach § 19 Abs. 3 UmwG als bekanntgemacht gilt, ihren Anspruch nach Grund und Höhe schriftlich anmelden, Sicherheit zu leisten, soweit sie nicht Befriedigung verlangen können. Dieses Recht steht den Gläubigern jedoch nur zu, wenn sie glaubhaft machen, dass durch die Verschmelzung die Erfüllung ihrer Forderung gefährdet wird."
    },
    {
      "date": "2025-01-10",
      "id": "98295",
      "original_text": "Löschungsankündigung\nBrandenburg Amtsgericht Frankfurt/Oder HRB 15790\nACHILLIONN GmbH – Woltersdorf",
      "type": "Löschungsankündigung",
      "state": "Brandenburg",
      "amtsgericht": "Amtsgericht Frankfurt/Oder",
      "registernummer": "HRB 15790",
      "registerart": "HRB",
      "company_name": "ACHILLIONN GmbH",
      "company_seat": "Woltersdorf",
      "details": "10.01.2025 (Bekanntmachungsdatum)\n\nBrandenburg Amtsgericht Frankfurt/Oder HRB 15790\nLöschungsankündigung\n\nACHILLIONN GmbH\nGesellschaft mit beschränkter Haftung\nWoltersdorf\n\nBei der nachstehenden Gesellschaft wird das Amtslöschungsverfahren gemäß § 394 FamFG eingeleitet."
    },
    {
      "date": "2025-01-10",
      "id": "98296",
      "original_text": "Löschungsankündigung\nBrandenburg Amtsgericht Potsdam HRB 30035\nCamelot Immobilien GmbH – Potsdam",
      "type": "Löschungsankündigung",
      "state": "Brandenburg",
      "amtsgericht": "Amtsgericht Potsdam",
      "registernummer": "HRB 30035",
      "registerart": "HRB",
      "company_name": "Camelot Immobilien GmbH",
      "company_seat": "Potsdam",
      "details": "10.01.2025 (Bekanntmachungsdatum)\n\nBrandenburg Amtsgericht Potsdam HRB 30035\nLöschungsankündigung\n\nCamelot Immobilien GmbH\nGesellschaft mit beschränkter Haftung\nPotsdam\n\nBei der nachstehenden Gesellschaft wird das Amtslöschungsverfahren gemäß § 394 FamFG eingeleitet."
    },
    {
      "date": "2025-01-10",
      "id": "98297",
      "original_text": "Löschungsankündigung\nNordrhein-Westfalen Amtsgericht Coesfeld HRB 16510\nPrimero Europe GmbH – Legden",
      "type": "Löschungsankündigung",
      "state": "Nordrhein-Westfalen",
      "amtsgericht": "Amtsgericht Coesfeld",
      "registernummer": "HRB 16510",
      "registerart": "HRB",
      "company_name": "Primero Europe GmbH",
      "company_seat": "Legden",
      "details": "10.01.2025 (Bekanntmachungsdatum)\n\nNordrhein-Westfalen Amtsgericht Coesfeld HRB 16510\nLöschungsankündigung\n\nPrimero Europe GmbH\nGesellschaft mit beschränkter Haftung\nLegden\n\nDas Registergericht beabsichtigt, den Rechtsträger wegen Vermögenslosigkeit gemäß § 394 FamFG von Amts wegen zu löschen.\n\nGegen diese Verfügung kann Widerspruch eingelegt werden. Die Frist zur Erhebung eines Widerspruchs gegen die beabsichtigte Löschung ist auf zwei Monate ab Veröffentlichung festgesetzt."
    },
    {
      "date": "2025-01-10",
      "id": "98298",
      "original_text": "Einreichung neuer Dokumente\nBrandenburg Amtsgericht Cottbus HRB 5895\nGEMAG Gebäudemanagement Aktiengesellschaft – Cottbus",
      "type": "Einreichung neuer Dokumente",
      "state": "Brandenburg",
      "amtsgericht": "Amtsgericht Cottbus",
      "registernummer": "HRB 5895",
      "registerart": "HRB",
      "company_name": "GEMAG Gebäudemanagement Aktiengesellschaft",
      "company_seat": "Cottbus",
      "details": "10.01.2025 (Bekanntmachungsdatum)\n\nBrandenburg Amtsgericht Cottbus HRB 5895\nEinreichung neuer Dokumente\n\nGEMAG Gebäudemanagement Aktiengesellschaft\nAktiengesellschaft\nCottbus\n\nAls nicht eingetragen wird veröffentlicht:\nDie aktuelle Liste der Aufsichtsratsmitglieder wurde zum Handelsregister gem. § 52 Abs. 3 GmbHG eingereicht."
    },
    {
      "date": "2025-01-10",
      "id": "98299",
      "original_text": "Registerbekanntmachung nach dem Umwandlungsgesetz\nBaden-Württemberg Amtsgericht Stuttgart HRB 797880\nMoll Stauden GmbH – Leinfelden-Echterdingen",
      "type": "Registerbekanntmachung nach dem Umwandlungsgesetz",
      "state": "Baden-Württemberg",
      "amtsgericht": "Amtsgericht Stuttgart",
      "registernummer": "HRB 797880",
      "registerart": "HRB",
      "company_name": "Moll Stauden GmbH",
      "company_seat": "Leinfelden-Echterdingen",
      "details": "10.01.2025 (Bekanntmachungsdatum)\n\nBaden-Württemberg Amtsgericht Stuttgart HRB 797880\nRegisterbekanntmachung nach dem Umwandlungsgesetz 10.01.2025 (Eintragungsdatum)\n\nMoll Stauden GmbH\nGesellschaft mit beschränkter Haftung\nLeinfelden-Echterdingen\n\nAls nicht eingetragen wird bekanntgemacht:\nDen Gläubigern der an der Ausgliederung beteiligten Rechtsträger ist, wenn sie binnen sechs Monaten nach dem Tag, an dem die Eintragung der Ausgliederung in das Register des Sitzes desjenigen Rechtsträgers, dessen Gläubiger sie sind, nach § 19 Abs. 3 UmwG als bekanntgemacht gilt, ihren Anspruch nach Grund und Höhe schriftlich anmelden, Sicherheit zu leisten, soweit sie nicht Befriedigung verlangen können. Dieses Recht steht den Gläubigern jedoch nur zu, wenn sie glaubhaft machen, dass durch die Ausgliederung die Erfüllung ihrer Forderung gefährdet wird."
    },
    {
      "date": "2025-01-10",
      "id": "98300",
      "original_text": "Einreichung neuer Dokumente\nSachsen Amtsgericht Dresden HRB 39619\nServicegesellschaft Spreequellen mbH – Ebersbach-Neugersdorf",
      "type": "Einreichung neuer Dokumente",
      "state": "Sachsen",
      "amtsgericht": "Amtsgericht Dresden",
      "registernummer": "HRB 39619",
      "registerart": "HRB",
      "company_name": "Servicegesellschaft Spreequellen mbH",
      "company_seat": "Ebersbach-Neugersdorf",
      "details": "10.01.2025 (Bekanntmachungsdatum)\n\nSachsen Amtsgericht Dresden HRB 39619\nEinreichung neuer Dokumente 10.01.2025 (Eintragungsdatum)\n\nServicegesellschaft Spreequellen mbH\nGesellschaft mit beschränkter Haftung\nEbersbach-Neugersdorf\n\nAm 09.01.2025 wurde beim Handelsregister des Amtsgerichts Dresden die Liste der Mitglieder des Aufsichtsrats gemäß § 52 GmbHG eingereicht."
    },
    {
      "date": "2025-01-10",
      "id": "98301",
      "original_text": "Einreichung neuer Dokumente\nSachsen Amtsgericht Leipzig HRB 8077\nColditzer Wohnungsbaugesellschaft mbH – Colditz",
      "type": "Einreichung neuer Dokumente",
      "state": "Sachsen",
      "amtsgericht": "Amtsgericht Leipzig",
      "registernummer": "HRB 8077",
      "registerart": "HRB",
      "company_name": "Colditzer Wohnungsbaugesellschaft mbH",
      "company_seat": "Colditz",
      "details": "10.01.2025 (Bekanntmachungsdatum)\n\nSachsen Amtsgericht Leipzig HRB 8077\nEinreichung neuer Dokumente\n\nColditzer Wohnungsbaugesellschaft mbH\nGesellschaft mit beschränkter Haftung\nColditz\n\nAm 09.01.2025 wurde beim Handelsregister des Amtsgerichts Leipzig die Liste der Mitglieder des Aufsichtsrats gemäß § 52 GmbHG eingereicht."
    },
    {
      "date": "2025-01-10",
      "id": "98302",
      "original_text": "Sonstige Registerbekanntmachung\nSachsen Amtsgericht Chemnitz HRB 9442\nKommunale Wohnungsgesellschaft mbH Kirchberg – Kirchberg",
      "type": "Sonstige Registerbekanntmachung",
      "state": "Sachsen",
      "amtsgericht": "Amtsgericht Chemnitz",
      "registernummer": "HRB 9442",
      "registerart": "HRB",
      "company_name": "Kommunale Wohnungsgesellschaft mbH Kirchberg",
      "company_seat": "Kirchberg",
      "details": "10.01.2025 (Bekanntmachungsdatum)\n\nSachsen Amtsgericht Chemnitz HRB 9442\nSonstige Registerbekanntmachung\n\nKommunale Wohnungsgesellschaft mbH Kirchberg\nGesellschaft mit beschränkter Haftung\nKirchberg\n\nAm 03.01.2025 wurde beim Handelsregister des Amtsgerichts Chemnitz die Liste der Mitglieder des Aufsichtsrats gemäß § 52 GmbHG eingereicht."
    },
    {
      "date": "2025-01-10",
      "id": "98303",
      "original_text": "Registerbekanntmachung nach dem Umwandlungsgesetz\nSachsen Amtsgericht Leipzig HRB 42982\nPapà GmbH – Leipzig",
      "type": "Registerbekanntmachung nach dem Umwandlungsgesetz",
      "state": "Sachsen",
      "amtsgericht": "Amtsgericht Leipzig",
      "registernummer": "HRB 42982",
      "registerart": "HRB",
      "company_name": "Papà GmbH",
      "company_seat": "Leipzig",
      "details": "10.01.2025 (Bekanntmachungsdatum)\n\nSachsen Amtsgericht Leipzig HRB 42982\nRegisterbekanntmachung nach dem Umwandlungsgesetz 10.01.2025 (Eintragungsdatum)\n\nPapà GmbH\nGesellschaft mit beschränkter Haftung\nLeipzig\n\nDen Gläubigern der an der Verschmelzung beteiligten Rechtsträger ist, wenn sie binnen sechs Monaten nach dem Tag, an dem die Eintragung der Verschmelzung in das Register des Sitzes desjenigen Rechtsträgers, dessen Gläubiger sie sind, nach § 19 Abs. 3 UmwG als bekannt gemacht gilt, ihren Anspruch nach Grund und Höhe in Textform anmelden, Sicherheit zu leisten, soweit sie nicht Befriedigung verlangen können. Dieses Recht steht den Gläubigern jedoch nur zu, wenn sie glaubhaft machen, dass durch die Verschmelzung die Erfüllung der Forderung gefährdet wird."
    },
    {
      "date": "2025-01-10",
      "id": "98304",
      "original_text": "Registerbekanntmachung nach dem Umwandlungsgesetz\nSachsen Amtsgericht Leipzig HRB 42976\nSchnitzel Culture Leipzig GmbH – Leipzig",
      "type": "Registerbekanntmachung nach dem Umwandlungsgesetz",
      "state": "Sachsen",
      "amtsgericht": "Amtsgericht Leipzig",
      "registernummer": "HRB 42976",
      "registerart": "HRB",
      "company_name": "Schnitzel Culture Leipzig GmbH",
      "company_seat": "Leipzig",
      "details": "10.01.2025 (Bekanntmachungsdatum)\n\nSachsen Amtsgericht Leipzig HRB 42976\nRegisterbekanntmachung nach dem Umwandlungsgesetz 10.01.2025 (Eintragungsdatum)\n\nSchnitzel Culture Leipzig GmbH\nGesellschaft mit beschränkter Haftung\nLeipzig\n\nDen Gläubigern der an der Verschmelzung beteiligten Rechtsträger ist, wenn sie binnen sechs Monaten nach dem Tag, an dem die Eintragung der Verschmelzung in das Register des Sitzes desjenigen Rechtsträgers, dessen Gläubiger sie sind, nach § 19 Abs. 3 UmwG als bekannt gemacht gilt, ihren Anspruch nach Grund und Höhe in Textform anmelden, Sicherheit zu leisten, soweit sie nicht Befriedigung verlangen können. Dieses Recht steht den Gläubigern jedoch nur zu, wenn sie glaubhaft machen, dass durch die Verschmelzung die Erfüllung der Forderung gefährdet wird."
    },
    {
      "date": "2025-01-10",
      "id": "98305",
      "original_text": "Einreichung neuer Dokumente\nNiedersachsen Amtsgericht Hannover HRB 6580\nTUI AG – Hannover und Berlin",
      "type": "Einreichung neuer Dokumente",
      "state": "Niedersachsen",
      "amtsgericht": "Amtsgericht Hannover",
      "registernummer": "HRB 6580",
      "registerart": "HRB",
      "company_name": "TUI AG",
      "company_seat": "Hannover und Berlin",
      "details": "10.01.2025 (Bekanntmachungsdatum)\n\nNiedersachsen Amtsgericht Hannover HRB 6580\nEinreichung neuer Dokumente 10.01.2025 (Eintragungsdatum)\n\nTUI AG\nAktiengesellschaft\nHannover und Berlin\n\nDie Liste der Mitglieder des Aufsichtsrats wurde beim Registergericht eingereicht."
    },
    {
      "date": "2025-01-10",
      "id": "98306",
      "original_text": "Löschungsankündigung\nNiedersachsen Amtsgericht Lüneburg HRA 203460\nWEE GmbH & Co. KG – Bergen",
      "type": "Löschungsankündigung",
      "state": "Niedersachsen",
      "amtsgericht": "Amtsgericht Lüneburg",
      "registernummer": "HRA 203460",
      "registerart": "HRA",
      "company_name": "WEE GmbH & Co. KG",
      "company_seat": "Bergen",
      "details": "10.01.2025 (Bekanntmachungsdatum)\n\nNiedersachsen Amtsgericht Lüneburg HRA 203460\nLöschungsankündigung\n\nWEE GmbH & Co. KG\nKommanditgesellschaft\nBergen\n\nDas Registergericht beabsichtigt, die Firma von Amts wegen nach § 31 Abs. 2 Satz 2 HGB, § 393 FamFG zu löschen. Die Frist zur Erhebung eines Widerspruchs ist auf 1 Monat ab dieser Registerbekanntmachung festgesetzt."
    },
    {
      "date": "2025-01-10",
      "id": "98307",
      "original_text": "Einreichung neuer Dokumente\nNiedersachsen Amtsgericht Braunschweig HRB 210842\nVolkswagen Financial Services AG – Braunschweig",
      "type": "Einreichung neuer Dokumente",
      "state": "Niedersachsen",
      "amtsgericht": "Amtsgericht Braunschweig",
      "registernummer": "HRB 210842",
      "registerart": "HRB",
      "company_name": "Volkswagen Financial Services AG",
      "company_seat": "Braunschweig",
      "details": "10.01.2025 (Bekanntmachungsdatum)\n\nNiedersachsen Amtsgericht Braunschweig HRB 210842\nEinreichung neuer Dokumente\n\nVolkswagen Financial Services AG\nAktiengesellschaft\nBraunschweig\n\nDie Liste der Mitglieder des Aufsichtsrats wurde beim Registergericht eingereicht."
    },
    {
      "date": "2025-01-10",
      "id": "98308",
      "original_text": "Einreichung neuer Dokumente\nNiedersachsen Amtsgericht Braunschweig HRB 5217\nAerodata Aktiengesellschaft – Braunschweig",
      "type": "Einreichung neuer Dokumente",
      "state": "Niedersachsen",
      "amtsgericht": "Amtsgericht Braunschweig",
      "registernummer": "HRB 5217",
      "registerart": "HRB",
      "company_name": "Aerodata Aktiengesellschaft",
      "company_seat": "Braunschweig",
      "details": "10.01.2025 (Bekanntmachungsdatum)\n\nNiedersachsen Amtsgericht Braunschweig HRB 5217\nEinreichung neuer Dokumente\n\nAerodata Aktiengesellschaft\nAktiengesellschaft\nBraunschweig\n\nDie aktuelle Liste der Mitglieder des Aufsichtsrats wurde beim Registergericht eingereicht."
    },
    {
      "date": "2025-01-10",
      "id": "98309",
      "original_text": "Registerbekanntmachung nach dem Umwandlungsgesetz\nNiedersachsen Amtsgericht Aurich HRA 203868\nFleischerei Tuitjer e.K. – Detern",
      "type": "Registerbekanntmachung nach dem Umwandlungsgesetz",
      "state": "Niedersachsen",
      "amtsgericht": "Amtsgericht Aurich",
      "registernummer": "HRA 203868",
      "registerart": "HRA",
      "company_name": "Fleischerei Tuitjer e.K.",
      "company_seat": "Detern",
      "details": "10.01.2025 (Bekanntmachungsdatum)\n\nNiedersachsen Amtsgericht Aurich HRA 203868\nRegisterbekanntmachung nach dem Umwandlungsgesetz 10.01.2025 (Eintragungsdatum)\n\nFleischerei Tuitjer e.K.\nEinzelkaufmann / Einzelkauffrau\nDetern\n\nDen Gläubigern der an der Ausgliederung beteiligten Rechtsträger ist, wenn sie binnen sechs Monaten nach dem Tag, an dem die Eintragung der Ausgliederung in das Register des Sitzes desjenigen Rechtsträgers, dessen Gläubiger sie sind, nach § 19 Abs. 3 UmwG als bekannt gemacht gilt, ihren Anspruch nach Grund und Höhe schriftlich anmelden, Sicherheit zu leisten, soweit sie nicht Befriedigung verlangen können. Dieses Recht steht den Gläubigern jedoch nur zu, wenn sie glaubhaft machen, dass durch die Ausgliederung die Erfüllung der Forderung gefährdet wird."
    },
    {
      "date": "2025-01-10",
      "id": "98310",
      "original_text": "Löschungsankündigung\nNiedersachsen Amtsgericht Aurich HRA 203877\nFleischerei Christian Tuitjer GmbH & Co. KG – Detern",
      "type": "Löschungsankündigung",
      "state": "Niedersachsen",
      "amtsgericht": "Amtsgericht Aurich",
      "registernummer": "HRA 203877",
      "registerart": "HRA",
      "company_name": "Fleischerei Christian Tuitjer GmbH & Co. KG",
      "company_seat": "Detern",
      "details": "10.01.2025 (Bekanntmachungsdatum)\n\nNiedersachsen Amtsgericht Aurich HRA 203877\nLöschungsankündigung 10.01.2025 (Eintragungsdatum)\n\nFleischerei Christian Tuitjer GmbH & Co. KG\nKommanditgesellschaft\nDetern\n\nDen Gläubigern der an der Ausgliederung beteiligten Rechtsträger ist, wenn sie binnen sechs Monaten nach dem Tag, an dem die Eintragung der Ausgliederung in das Register des Sitzes desjenigen Rechtsträgers, dessen Gläubiger sie sind, nach § 19 Abs. 3 UmwG als bekannt gemacht gilt, ihren Anspruch nach Grund und Höhe schriftlich anmelden, Sicherheit zu leisten, soweit sie nicht Befriedigung verlangen können. Dieses Recht steht den Gläubigern jedoch nur zu, wenn sie glaubhaft machen, dass durch die Ausgliederung die Erfüllung der Forderung gefährdet wird."
    },
    {
      "date": "2025-01-10",
      "id": "98311",
      "original_text": "Registerbekanntmachung nach dem Umwandlungsgesetz\nNiedersachsen Amtsgericht Lüneburg HRB 110946 früher Amtsgericht Winsen\nPilot Computerhandels GmbH – Seevetal",
      "type": "Registerbekanntmachung nach dem Umwandlungsgesetz",
      "state": "Niedersachsen",
      "amtsgericht": "Amtsgericht Lüneburg",
      "registernummer": "HRB 110946",
      "registerart": "HRB",
      "company_name": "Pilot Computerhandels GmbH",
      "company_seat": "Seevetal",
      "former_amtsgericht": "Winsen",
      "details": "10.01.2025 (Bekanntmachungsdatum)\n\nNiedersachsen Amtsgericht Lüneburg HRB 110946 früher Amtsgericht Winsen\nRegisterbekanntmachung nach dem Umwandlungsgesetz 10.01.2025 (Eintragungsdatum)\n\nPilot Computerhandels GmbH\nGesellschaft mit beschränkter Haftung\nSeevetal\n\nDen Gläubigern der an der Verschmelzung beteiligten Rechtsträger ist, wenn sie binnen sechs Monaten nach dem Tag, an dem die Eintragung der Verschmelzung in das Register des Sitzes desjenigen Rechtsträgers, dessen Gläubiger sie sind, nach § 19  Abs.  3 UmwG als bekannt gemacht gilt, ihren Anspruch nach Grund und Höhe schriftlich anmelden, Sicherheit zu leisten, soweit sie nicht Befriedigung verlangen können. Dieses Recht steht den Gläubigern jedoch nur zu, wenn sie glaubhaft machen, dass durch die Verschmelzung die Erfüllung der Forderung gefährdet wird."
    },
    {
      "date": "2025-01-10",
      "id": "98312",
      "original_text": "Einreichung neuer Dokumente\nNiedersachsen Amtsgericht Braunschweig HRB 204131\nLSW Holding Verwaltungs-GmbH – Wolfsburg",
      "type": "Einreichung neuer Dokumente",
      "state": "Niedersachsen",
      "amtsgericht": "Amtsgericht Braunschweig",
      "registernummer": "HRB 204131",
      "registerart": "HRB",
      "company_name": "LSW Holding Verwaltungs-GmbH",
      "company_seat": "Wolfsburg",
      "details": "10.01.2025 (Bekanntmachungsdatum)\n\nNiedersachsen Amtsgericht Braunschweig HRB 204131\nEinreichung neuer Dokumente\n\nLSW Holding Verwaltungs-GmbH\nGesellschaft mit beschränkter Haftung\nWolfsburg\n\nEine aktuelle Liste der Mitglieder des Aufsichtsrats wurde beim Registergericht eingereicht."
    },
    {
      "date": "2025-01-10",
      "id": "98313",
      "original_text": "Löschungsankündigung\nNiedersachsen Amtsgericht Osnabrück HRB 211697\nDas kleine Stadthotel GmbH – Melle",
      "type": "Löschungsankündigung",
      "state": "Niedersachsen",
      "amtsgericht": "Amtsgericht Osnabrück",
      "registernummer": "HRB 211697",
      "registerart": "HRB",
      "company_name": "Das kleine Stadthotel GmbH",
      "company_seat": "Melle",
      "details": "10.01.2025 (Bekanntmachungsdatum)\n\nNiedersachsen Amtsgericht Osnabrück HRB 211697\nLöschungsankündigung\n\nDas kleine Stadthotel GmbH\nGesellschaft mit beschränkter Haftung\nMelle\n\nDas Registergericht beabsichtigt, die Gesellschaft von Amts wegen nach § 394 FamFG wegen Vermögenslosigkeit zu löschen. Die Frist zur Erhebung eines Widerspruchs ist auf 1 Monat ab dieser Registerbekanntmachung festgesetzt."
    },
    {
      "date": "2025-01-10",
      "id": "98314",
      "original_text": "Einreichung neuer Dokumente\nNiedersachsen Amtsgericht Tostedt HRB 110421 früher Amtsgericht Langen\nLa mer Cosmetics AG – Cuxhaven",
      "type": "Einreichung neuer Dokumente",
      "state": "Niedersachsen",
      "amtsgericht": "Amtsgericht Tostedt",
      "registernummer": "HRB 110421",
      "registerart": "HRB",
      "company_name": "La mer Cosmetics AG",
      "company_seat": "Cuxhaven",
      "former_amtsgericht": "Langen",
      "details": "10.01.2025 (Bekanntmachungsdatum)\n\nNiedersachsen Amtsgericht Tostedt HRB 110421 früher Amtsgericht Langen\nEinreichung neuer Dokumente\n\nLa mer Cosmetics AG\nAktiengesellschaft\nCuxhaven\n\nDie Liste der Mitglieder des Aufsichtsrats wurde beim Registergericht eingereicht."
    },
    {
      "date": "2025-01-10",
      "id": "98315",
      "original_text": "Einreichung neuer Dokumente\nNordrhein-Westfalen Amtsgericht Düsseldorf HRB 63310\nLifestyle Protection AG – Hilden",
      "type": "Einreichung neuer Dokumente",
      "state": "Nordrhein-Westfalen",
      "amtsgericht": "Amtsgericht Düsseldorf",
      "registernummer": "HRB 63310",
      "registerart": "HRB",
      "company_name": "Lifestyle Protection AG",
      "company_seat": "Hilden",
      "details": "10.01.2025 (Bekanntmachungsdatum)\n\nNordrhein-Westfalen Amtsgericht Düsseldorf HRB 63310\nEinreichung neuer Dokumente\n\nLifestyle Protection AG\nAktiengesellschaft\nHilden\n\nDem Registergericht ist eine neue Liste der Mitglieder des Aufsichtsrates eingereicht worden."
    },
    {
      "date": "2025-01-10",
      "id": "98316",
      "original_text": "Einreichung neuer Dokumente\nNordrhein-Westfalen Amtsgericht Essen HRB 17451\nelpix AG – Essen",
      "type": "Einreichung neuer Dokumente",
      "state": "Nordrhein-Westfalen",
      "amtsgericht": "Amtsgericht Essen",
      "registernummer": "HRB 17451",
      "registerart": "HRB",
      "company_name": "elpix AG",
      "company_seat": "Essen",
      "details": "10.01.2025 (Bekanntmachungsdatum)\n\nNordrhein-Westfalen Amtsgericht Essen HRB 17451\nEinreichung neuer Dokumente\n\nelpix AG\nAktiengesellschaft\nEssen\n\nDem Registergericht ist eine neue Liste der Mitglieder des Aufsichtsrates eingereicht worden."
    },
    {
      "date": "2025-01-10",
      "id": "98317",
      "original_text": "Einreichung neuer Dokumente\nNordrhein-Westfalen Amtsgericht Siegen HRB 5765\nManeris AG – Siegen",
      "type": "Einreichung neuer Dokumente",
      "state": "Nordrhein-Westfalen",
      "amtsgericht": "Amtsgericht Siegen",
      "registernummer": "HRB 5765",
      "registerart": "HRB",
      "company_name": "Maneris AG",
      "company_seat": "Siegen",
      "details": "10.01.2025 (Bekanntmachungsdatum)\n\nNordrhein-Westfalen Amtsgericht Siegen HRB 5765\nEinreichung neuer Dokumente\n\nManeris AG\nAktiengesellschaft\nSiegen\n\nDem Registergericht ist eine neue Liste der Mitglieder des Aufsichtsrates eingereicht worden."
    },
    {
      "date": "2025-01-10",
      "id": "98318",
      "original_text": "Einreichung neuer Dokumente\nNordrhein-Westfalen Amtsgericht Essen HRB 14155\nConPAIR AG – Essen",
      "type": "Einreichung neuer Dokumente",
      "state": "Nordrhein-Westfalen",
      "amtsgericht": "Amtsgericht Essen",
      "registernummer": "HRB 14155",
      "registerart": "HRB",
      "company_name": "ConPAIR AG",
      "company_seat": "Essen",
      "details": "10.01.2025 (Bekanntmachungsdatum)\n\nNordrhein-Westfalen Amtsgericht Essen HRB 14155\nEinreichung neuer Dokumente\n\nConPAIR AG\nAktiengesellschaft\nEssen\n\nDem Registergericht ist eine neue Liste der Mitglieder des Aufsichtsrates eingereicht worden."
    },
    {
      "date": "2025-01-10",
      "id": "98319",
      "original_text": "Sonstige Registerbekanntmachung\nNordrhein-Westfalen Amtsgericht Gelsenkirchen HRB 10729\nStölting Courier & Service GmbH – Gelsenkirchen",
      "type": "Sonstige Registerbekanntmachung",
      "state": "Nordrhein-Westfalen",
      "amtsgericht": "Amtsgericht Gelsenkirchen",
      "registernummer": "HRB 10729",
      "registerart": "HRB",
      "company_name": "Stölting Courier & Service GmbH",
      "company_seat": "Gelsenkirchen",
      "details": "10.01.2025 (Bekanntmachungsdatum)\n\nNordrhein-Westfalen Amtsgericht Gelsenkirchen HRB 10729\nSonstige Registerbekanntmachung 10.01.2025 (Eintragungsdatum)\n\nStölting Courier & Service GmbH\nGesellschaft mit beschränkter Haftung\nGelsenkirchen\n\nAls nicht eingetragen wird veröffentlicht: Den Gläubigern der Gesellschaft, deren Forderungen begründet worden sind bevor die Eintragung der Beendigung des Beherrschungs- und Gewinnabführungsvertrages  in das Handelsregister nach § 10 des Handelsgesetzbuches als bekanntgemacht gilt, hat der andere Vertragsteil Sicherheit zu leisten, wenn sie sich binnen sechs Monaten nach der Bekanntmachung der Eintragung zu diesem Zweck bei ihm melden."
    },
    {
      "date": "2025-01-10",
      "id": "98320",
      "original_text": "Sonstige Registerbekanntmachung\nNordrhein-Westfalen Amtsgericht Bielefeld HRB 34644\nDr. Oetker China Holding GmbH – Bielefeld",
      "type": "Sonstige Registerbekanntmachung",
      "state": "Nordrhein-Westfalen",
      "amtsgericht": "Amtsgericht Bielefeld",
      "registernummer": "HRB 34644",
      "registerart": "HRB",
      "company_name": "Dr. Oetker China Holding GmbH",
      "company_seat": "Bielefeld",
      "details": "10.01.2025 (Bekanntmachungsdatum)\n\nNordrhein-Westfalen Amtsgericht Bielefeld HRB 34644\nSonstige Registerbekanntmachung 10.01.2025 (Eintragungsdatum)\n\nDr. Oetker China Holding GmbH\nGesellschaft mit beschränkter Haftung\nBielefeld\n\nAls nicht eingetragen wird veröffentlicht: Den Gläubigern der Gesellschaft, deren Forderungen begründet worden sind bevor die Eintragung der Beendigung des Beherrschungs- und Gewinnabführungsvertrages  in das Handelsregister nach § 10 des Handelsgesetzbuches als bekanntgemacht gilt, hat der andere Vertragsteil Sicherheit zu leisten, wenn sie sich binnen sechs Monaten nach der Bekanntmachung der Eintragung zu diesem Zweck bei ihm melden."
    },
    {
      "date": "2025-01-10",
      "id": "98321",
      "original_text": "Löschungsankündigung\nNordrhein-Westfalen Amtsgericht Krefeld HRB 10620\nUding Bedachungen u. Bauklempnerei GmbH – Brüggen",
      "type": "Löschungsankündigung",
      "state": "Nordrhein-Westfalen",
      "amtsgericht": "Amtsgericht Krefeld",
      "registernummer": "HRB 10620",
      "registerart": "HRB",
      "company_name": "Uding Bedachungen u. Bauklempnerei GmbH",
      "company_seat": "Brüggen",
      "details": "10.01.2025 (Bekanntmachungsdatum)\n\nNordrhein-Westfalen Amtsgericht Krefeld HRB 10620\nLöschungsankündigung\n\nUding Bedachungen u. Bauklempnerei GmbH\nGesellschaft mit beschränkter Haftung\nBrüggen\n\nDas Registergericht beabsichtigt die Gesellschaft von Amts wegen nach § 394 FamFG zu löschen. Die Frist zur Erhebung eines Widerspruchs ist auf einen Monat festgesetzt."
    },
    {
      "date": "2025-01-10",
      "id": "98322",
      "original_text": "Löschungsankündigung\nNordrhein-Westfalen Amtsgericht Krefeld HRB 17745\nThree Entertainment GmbH – Willich",
      "type": "Löschungsankündigung",
      "state": "Nordrhein-Westfalen",
      "amtsgericht": "Amtsgericht Krefeld",
      "registernummer": "HRB 17745",
      "registerart": "HRB",
      "company_name": "Three Entertainment GmbH",
      "company_seat": "Willich",
      "details": "10.01.2025 (Bekanntmachungsdatum)\n\nNordrhein-Westfalen Amtsgericht Krefeld HRB 17745\nLöschungsankündigung\n\nThree Entertainment GmbH\nGesellschaft mit beschränkter Haftung\nWillich\n\nDas Registergericht beabsichtigt die Gesellschaft von Amts wegen nach § 394 FamFG zu löschen. Die Frist zur Erhebung eines Widerspruchs ist auf einen Monat festgesetzt."
    },
    {
      "date": "2025-01-10",
      "id": "98323",
      "original_text": "Einreichung neuer Dokumente\nNordrhein-Westfalen Amtsgericht Köln HRB 82614\nHDI Pensionskasse AG – Köln",
      "type": "Einreichung neuer Dokumente",
      "state": "Nordrhein-Westfalen",
      "amtsgericht": "Amtsgericht Köln",
      "registernummer": "HRB 82614",
      "registerart": "HRB",
      "company_name": "HDI Pensionskasse AG",
      "company_seat": "Köln",
      "details": "10.01.2025 (Bekanntmachungsdatum)\n\nNordrhein-Westfalen Amtsgericht Köln HRB 82614\nEinreichung neuer Dokumente\n\nHDI Pensionskasse AG\nAktiengesellschaft\nKöln\n\nDem Registergericht ist eine neue Liste der Mitglieder des Aufsichtsrates eingereicht worden."
    },
    {
      "date": "2025-01-10",
      "id": "98324",
      "original_text": "Löschungsankündigung\nNordrhein-Westfalen Amtsgericht Mönchengladbach HRB 13216\nDFM GmbH – Hückelhoven",
      "type": "Löschungsankündigung",
      "state": "Nordrhein-Westfalen",
      "amtsgericht": "Amtsgericht Mönchengladbach",
      "registernummer": "HRB 13216",
      "registerart": "HRB",
      "company_name": "DFM GmbH",
      "company_seat": "Hückelhoven",
      "details": "10.01.2025 (Bekanntmachungsdatum)\n\nNordrhein-Westfalen Amtsgericht Mönchengladbach HRB 13216\nLöschungsankündigung\n\nDFM GmbH\nGesellschaft mit beschränkter Haftung\nHückelhoven\n\nDFM GmbH, Hückelhoven (Amtsgericht Mönchengladbach, HRB 13216)\nDas Registergericht beabsichtigt, die im Handelsregister eingetragene Gesellschaft gemäß § 394 Absatz 1 FamFG wegen Vermögenslosigkeit von Amts wegen zu löschen. Gegen diese Verfügung kann Widerspruch eingelegt werden. Die Frist zur Erhebung eines Widerspruchs gegen die beabsichtigte Löschung von Amts wegen ist auf zwei Monate festgesetzt."
    },
    {
      "date": "2025-01-10",
      "id": "98325",
      "original_text": "Einreichung neuer Dokumente\nNordrhein-Westfalen Amtsgericht Düsseldorf HRB 90791\nAgfa Alterssicherungs-AG – Düsseldorf",
      "type": "Einreichung neuer Dokumente",
      "state": "Nordrhein-Westfalen",
      "amtsgericht": "Amtsgericht Düsseldorf",
      "registernummer": "HRB 90791",
      "registerart": "HRB",
      "company_name": "Agfa Alterssicherungs-AG",
      "company_seat": "Düsseldorf",
      "details": "10.01.2025 (Bekanntmachungsdatum)\n\nNordrhein-Westfalen Amtsgericht Düsseldorf HRB 90791\nEinreichung neuer Dokumente\n\nAgfa Alterssicherungs-AG\nAktiengesellschaft\nDüsseldorf\n\nDem Registergericht ist eine neue Liste der Mitglieder des Aufsichtsrates eingereicht worden."
    },
    {
      "date": "2025-01-10",
      "id": "98326",
      "original_text": "Löschungsankündigung\nNordrhein-Westfalen Amtsgericht Düren HRB 7210\nSonnenschein Galatec UG (haftungsbeschränkt) – Dahlem",
      "type": "Löschungsankündigung",
      "state": "Nordrhein-Westfalen",
      "amtsgericht": "Amtsgericht Düren",
      "registernummer": "HRB 7210",
      "registerart": "HRB",
      "company_name": "Sonnenschein Galatec UG (haftungsbeschränkt)",
      "company_seat": "Dahlem",
      "details": "10.01.2025 (Bekanntmachungsdatum)\n\nNordrhein-Westfalen Amtsgericht Düren HRB 7210\nLöschungsankündigung\n\nSonnenschein Galatec UG (haftungsbeschränkt)\nGesellschaft mit beschränkter Haftung\nDahlem\n\nDas Registergericht beabsichtigt die Gesellschaft von Amts wegen nach § 394 FamFG zu löschen. Die Frist zur Erhebung eines Widerspruchs ist auf drei Monate festgesetzt."
    },
    {
      "date": "2025-01-10",
      "id": "98327",
      "original_text": "Sonstige Registerbekanntmachung\nNordrhein-Westfalen Amtsgericht Bielefeld HRB 7005\nRavensberger Heimstättengesellschaft mit beschränkter Haftung – Bielefeld",
      "type": "Sonstige Registerbekanntmachung",
      "state": "Nordrhein-Westfalen",
      "amtsgericht": "Amtsgericht Bielefeld",
      "registernummer": "HRB 7005",
      "registerart": "HRB",
      "company_name": "Ravensberger Heimstättengesellschaft mit beschränkter Haftung",
      "company_seat": "Bielefeld",
      "details": "10.01.2025 (Bekanntmachungsdatum)\n\nNordrhein-Westfalen Amtsgericht Bielefeld HRB 7005\nSonstige Registerbekanntmachung 10.01.2025 (Eintragungsdatum)\n\nRavensberger Heimstättengesellschaft mit beschränkter Haftung\nGesellschaft mit beschränkter Haftung\nBielefeld\n\nAls nicht eingetragen wird veröffentlicht: Den Gläubigern der Gesellschaft, deren Forderungen begründet worden sind bevor die Eintragung der Beendigung des Gewinnabführungsvertrages  in das Handelsregister nach § 10 des Handelsgesetzbuches als bekanntgemacht gilt, hat der andere Vertragsteil Sicherheit zu leisten, wenn sie sich binnen sechs Monaten nach der Bekanntmachung der Eintragung zu diesem Zweck bei ihm melden."
    },
    {
      "date": "2025-01-10",
      "id": "98328",
      "original_text": "Registerbekanntmachung nach dem Umwandlungsgesetz\nNordrhein-Westfalen Amtsgericht Paderborn HRA 8799\nWiesmann Asset GmbH & Co. KG – Borgentreich",
      "type": "Registerbekanntmachung nach dem Umwandlungsgesetz",
      "state": "Nordrhein-Westfalen",
      "amtsgericht": "Amtsgericht Paderborn",
      "registernummer": "HRA 8799",
      "registerart": "HRA",
      "company_name": "Wiesmann Asset GmbH & Co. KG",
      "company_seat": "Borgentreich",
      "details": "10.01.2025 (Bekanntmachungsdatum)\n\nNordrhein-Westfalen Amtsgericht Paderborn HRA 8799\nRegisterbekanntmachung nach dem Umwandlungsgesetz 10.01.2025 (Eintragungsdatum)\n\nWiesmann Asset GmbH & Co. KG\nKommanditgesellschaft\nBorgentreich\n\nDen Gläubigern der an der Ausgliederung beteiligten Rechtsträger ist, wenn sie binnen sechs Monaten nach dem Tag, an dem die Eintragung der Ausgliederung in das Register des Sitzes desjenigen Rechtsträgers, dessen Gläubiger sie sind, nach § 19 Absatz 3 UmwG als bekanntgemacht gilt, ihren Anspruch nach Grund und Höhe schriftlich anmelden, Sicherheit zu leisten, soweit sie nicht Befriedigung verlangen können. Dieses Recht steht den Gläubigern jedoch nur zu, wenn sie glaubhaft machen, dass durch die Ausgliederung die Erfüllung ihrer Forderung gefährdet wird."
    },
    {
      "date": "2025-01-10",
      "id": "98329",
      "original_text": "Löschungsankündigung\nNordrhein-Westfalen Amtsgericht Dortmund HRB 24734\nBauunternehmung Wacher UG (haftungsbeschränkt) – Selm",
      "type": "Löschungsankündigung",
      "state": "Nordrhein-Westfalen",
      "amtsgericht": "Amtsgericht Dortmund",
      "registernummer": "HRB 24734",
      "registerart": "HRB",
      "company_name": "Bauunternehmung Wacher UG (haftungsbeschränkt)",
      "company_seat": "Selm",
      "details": "10.01.2025 (Bekanntmachungsdatum)\n\nNordrhein-Westfalen Amtsgericht Dortmund HRB 24734\nLöschungsankündigung\n\nBauunternehmung Wacher UG (haftungsbeschränkt)\nGesellschaft mit beschränkter Haftung\nSelm\n\nDas Registergericht beabsichtigt die Gesellschaft von Amts wegen nach § 394 FamFG zu löschen. Die Frist zur Erhebung eines Widerspruchs ist auf einen Monat festgesetzt."
    },
    {
      "date": "2025-01-10",
      "id": "98330",
      "original_text": "Löschungsankündigung\nNordrhein-Westfalen Amtsgericht Gütersloh HRB 10680\nTEAMORA GmbH – Rheda-Wiedenbrück",
      "type": "Löschungsankündigung",
      "state": "Nordrhein-Westfalen",
      "amtsgericht": "Amtsgericht Gütersloh",
      "registernummer": "HRB 10680",
      "registerart": "HRB",
      "company_name": "TEAMORA GmbH",
      "company_seat": "Rheda-Wiedenbrück",
      "details": "10.01.2025 (Bekanntmachungsdatum)\n\nNordrhein-Westfalen Amtsgericht Gütersloh HRB 10680\nLöschungsankündigung 10.01.2025 (Eintragungsdatum)\n\nTEAMORA GmbH\nGesellschaft mit beschränkter Haftung\nRheda-Wiedenbrück\n\nDas Registergericht beabsichtigt die Gesellschaft von Amts wegen nach § 394 FamFG zu löschen. Die Frist zur Erhebung eines Widerspruchs ist auf einen Monat festgesetzt."
    },
    {
      "date": "2025-01-10",
      "id": "98331",
      "original_text": "Löschungsankündigung\nNordrhein-Westfalen Amtsgericht Duisburg HRB 12198\nIndustrie-Montagen-Rohrleitungsbau Ruhnke G.m.b.H. – Oberhausen",
      "type": "Löschungsankündigung",
      "state": "Nordrhein-Westfalen",
      "amtsgericht": "Amtsgericht Duisburg",
      "registernummer": "HRB 12198",
      "registerart": "HRB",
      "company_name": "Industrie-Montagen-Rohrleitungsbau Ruhnke G.m.b.H.",
      "company_seat": "Oberhausen",
      "details": "10.01.2025 (Bekanntmachungsdatum)\n\nNordrhein-Westfalen Amtsgericht Duisburg HRB 12198\nLöschungsankündigung\n\nIndustrie-Montagen-Rohrleitungsbau Ruhnke G.m.b.H.\nGesellschaft mit beschränkter Haftung\nOberhausen\n\nHRB 12198:\nIndustrie-Montagen-Rohrleitungsbau Ruhnke G.m.b.H.,\nOberhausen\nGeschäftsanschrift: Erlenstr. 12,\n46149 Oberhausen. Das Registergericht beabsichtigt, die im Handelsregister eingetragene Gesellschaft gemäß § 394 Absatz 1 FamFG wegen Vermögenslosigkeit von Amts wegen zu löschen. Gegen diese Verfügung kann Widerspruch eingelegt werden. Die Frist zur Erhebung eines Widerspruchs gegen die beabsichtigte Löschung von Amts wegen ist auf drei Monate festgesetzt. Rechtsbehelfsbelehrung Der Widerspruch ist bei dem Amtsgericht Duisburg, Kardinal-Galen-Str. 124-132, 47058 Duisburg schriftlich in deutscher Sprache oder zur Niederschrift der Geschäftsstelle einzulegen. Der Widerspruch kann auch zur Niederschrift der Geschäftsstelle eines jeden Amtsgerichtes abgegeben werden. Die Einlegung ist auch durch Übertragung eines elektronischen Dokuments an die elektronische Poststelle des Gerichts möglich. Das elektronische Dokument muss für die Bearbeitung durch das Gericht geeignet und mit einer qualifizierten elektronischen Signatur der verantwortenden Person versehen sein oder von der verantwortenden Person signiert und auf einem sicheren Übermittlungsweg gemäß § 130 a ZPO nach näherer Maßgabe der Verordnung über die technischen Rahmenbedingungen des elektronischen Rechtsverkehrs und über das besondere elektronische Behördenpostfach (BGBl. I, S. 3803) eingereicht werden. Weitere Informationen erhalten Sie auf der Internetseite www.justiz.de <http://www.justiz.de>. Der Widerspruch muss spätestens innerhalb der gesetzten Frist bei dem Amtsgericht Duisburg eingegangen sein. Dies gilt auch dann, wenn der Widerspruch zur Niederschrift der Geschäftsstelle eines anderen Amtsgerichtes abgegeben wurde. Die Frist beginnt mit der Veröffentlichung. Fällt das Ende der Frist auf einen Sonntag, einen allgemeinen Feiertag oder Sonnabend, so endet die Frist mit Ablauf des nächsten Werktages. Der Widerspruch muss die Bezeichnung der angefochtenen Verfügung sowie die Erklärung enthalten, dass Widerspruch gegen diese Verfügung eingelegt wird. Er ist zu unterzeichnen und soll begründet werden."
    },
    {
      "date": "2025-01-10",
      "id": "98332",
      "original_text": "Löschungsankündigung\nNordrhein-Westfalen Amtsgericht Krefeld HRB 12352\nPro Vita Fahrdienst GmbH – Krefeld",
      "type": "Löschungsankündigung",
      "state": "Nordrhein-Westfalen",
      "amtsgericht": "Amtsgericht Krefeld",
      "registernummer": "HRB 12352",
      "registerart": "HRB",
      "company_name": "Pro Vita Fahrdienst GmbH",
      "company_seat": "Krefeld",
      "details": "10.01.2025 (Bekanntmachungsdatum)\n\nNordrhein-Westfalen Amtsgericht Krefeld HRB 12352\nLöschungsankündigung\n\nPro Vita Fahrdienst GmbH\nGesellschaft mit beschränkter Haftung\nKrefeld\n\nDas Registergericht beabsichtigt die Gesellschaft von Amts wegen nach § 394 FamFG zu löschen. Die Frist zur Erhebung eines Widerspruchs ist auf einen Monat festgesetzt."
    },
    {
      "date": "2025-01-10",
      "id": "98333",
      "original_text": "Sonstige Registerbekanntmachung\nNordrhein-Westfalen Amtsgericht Düsseldorf HRB 53760\nHSBC Trinkaus Family Office GmbH – Düsseldorf",
      "type": "Sonstige Registerbekanntmachung",
      "state": "Nordrhein-Westfalen",
      "amtsgericht": "Amtsgericht Düsseldorf",
      "registernummer": "HRB 53760",
      "registerart": "HRB",
      "company_name": "HSBC Trinkaus Family Office GmbH",
      "company_seat": "Düsseldorf",
      "details": "10.01.2025 (Bekanntmachungsdatum)\n\nNordrhein-Westfalen Amtsgericht Düsseldorf HRB 53760\nSonstige Registerbekanntmachung 10.01.2025 (Eintragungsdatum)\n\nHSBC Trinkaus Family Office GmbH\nGesellschaft mit beschränkter Haftung\nDüsseldorf\n\nAls nicht eingetragen wird veröffentlicht: Den Gläubigern der Gesellschaft, deren Forderungen begründet worden sind bevor die Eintragung der Beendigung des Beherrschungs- und Gewinnabführungsvertrages  in das Handelsregister nach § 10 des Handelsgesetzbuches als bekanntgemacht gilt, hat der andere Vertragsteil Sicherheit zu leisten, wenn sie sich binnen sechs Monaten nach der Bekanntmachung der Eintragung zu diesem Zweck bei ihm melden."
    },
    {
      "date": "2025-01-10",
      "id": "98334",
      "original_text": "Löschungsankündigung\nHessen Amtsgericht Offenbach am Main HRB 42179\nGolden Tulip Hospitality Management Germany GmbH – Offenbach am Main",
      "type": "Löschungsankündigung",
      "state": "Hessen",
      "amtsgericht": "Amtsgericht Offenbach am Main",
      "registernummer": "HRB 42179",
      "registerart": "HRB",
      "company_name": "Golden Tulip Hospitality Management Germany GmbH",
      "company_seat": "Offenbach am Main",
      "details": "10.01.2025 (Bekanntmachungsdatum)\n\nHessen Amtsgericht Offenbach am Main HRB 42179\nLöschungsankündigung\n\nGolden Tulip Hospitality Management Germany GmbH\nGesellschaft mit beschränkter Haftung\nOffenbach am Main\n\nDas Registergericht beabsichtigt die im Handelsregister eingetragene Gesellschaft von Amts wegen nach § 394 FamFG zu löschen. Die Frist zur Erhebung eines Widerspruchs gegen die beabsichtigte Löschung wird auf 3 Monate festgesetzt."
    },
    {
      "date": "2025-01-10",
      "id": "98335",
      "original_text": "Registerbekanntmachung nach dem Umwandlungsgesetz\nHessen Amtsgericht Offenbach am Main HRB 47441\ngd inside GmbH – Mainhausen",
      "type": "Registerbekanntmachung nach dem Umwandlungsgesetz",
      "state": "Hessen",
      "amtsgericht": "Amtsgericht Offenbach am Main",
      "registernummer": "HRB 47441",
      "registerart": "HRB",
      "company_name": "gd inside GmbH",
      "company_seat": "Mainhausen",
      "details": "10.01.2025 (Bekanntmachungsdatum)\n\nHessen Amtsgericht Offenbach am Main HRB 47441\nRegisterbekanntmachung nach dem Umwandlungsgesetz 10.01.2025 (Eintragungsdatum)\n\ngd inside GmbH\nGesellschaft mit beschränkter Haftung\nMainhausen\n\nDen Gläubigern der an der Verschmelzung beteiligten Rechtsträger ist, wenn sie binnen sechs Monaten nach dem Tag, an dem die Eintragung der Verschmelzung in das Register des Sitzes desjenigen Rechtsträgers, dessen Gläubiger sie sind, nach § 19 Absatz 3 UmwG bekannt gemacht worden ist, ihren Anspruch nach Grund und Höhe schriftlich anmelden, Sicherheit zu leisten, soweit sie nicht Befriedigung verlangen können. Dieses Recht steht den Gläubigern jedoch nur zu, wenn sie glaubhaft machen, dass durch die Verschmelzung die Erfüllung ihrer Forderung gefährdet wird."
    },
    {
      "date": "2025-01-10",
      "id": "98336",
      "original_text": "Sonstige Registerbekanntmachung\nHessen Amtsgericht Frankfurt am Main HRB 53421\nLagerbox Frankfurt GmbH – Frankfurt am Main",
      "type": "Sonstige Registerbekanntmachung",
      "state": "Hessen",
      "amtsgericht": "Amtsgericht Frankfurt am Main",
      "registernummer": "HRB 53421",
      "registerart": "HRB",
      "company_name": "Lagerbox Frankfurt GmbH",
      "company_seat": "Frankfurt am Main",
      "details": "10.01.2025 (Bekanntmachungsdatum)\n\nHessen Amtsgericht Frankfurt am Main HRB 53421\nSonstige Registerbekanntmachung 10.01.2025 (Eintragungsdatum)\n\nLagerbox Frankfurt GmbH\nGesellschaft mit beschränkter Haftung\nFrankfurt am Main\n\nDen Gläubigern der Gesellschaft, deren Forderungen begründet worden sind, bevor die Eintragung der Beendigung des Vertrags in das Handelsregister nach § 10 HGB bekannt gemacht worden ist, ist vom anderen Vertragsteil Sicherheit zu leisten, wenn sie sich binnen sechs Monaten nach dieser Bekanntmachung zu diesem Zweck bei ihm melden."
    },
    {
      "date": "2025-01-10",
      "id": "98337",
      "original_text": "Löschungsankündigung\nHessen Amtsgericht Frankfurt am Main HRB 104820\nDachs GmbH – Frankfurt am Main",
      "type": "Löschungsankündigung",
      "state": "Hessen",
      "amtsgericht": "Amtsgericht Frankfurt am Main",
      "registernummer": "HRB 104820",
      "registerart": "HRB",
      "company_name": "Dachs GmbH",
      "company_seat": "Frankfurt am Main",
      "details": "10.01.2025 (Bekanntmachungsdatum)\n\nHessen Amtsgericht Frankfurt am Main HRB 104820\nLöschungsankündigung\n\nDachs GmbH\nGesellschaft mit beschränkter Haftung\nFrankfurt am Main\n\nDas Registergericht beabsichtigt die im Handelsregister eingetragene Gesellschaft von Amts wegen nach § 394 FamFG zu löschen. Die Frist zur Erhebung eines Widerspruchs gegen die beabsichtigte Löschung wird auf 1 Monat festgesetzt."
    },
    {
      "date": "2025-01-10",
      "id": "98338",
      "original_text": "Sonstige Registerbekanntmachung\nHessen Amtsgericht Marburg VR 1932\nSchulkultur - Verein zur Förderung kultureller und pädagogischer Praxis an Schulen – Marburg",
      "type": "Sonstige Registerbekanntmachung",
      "state": "Hessen",
      "amtsgericht": "Amtsgericht Marburg",
      "registernummer": "VR 1932",
      "registerart": "VR",
      "company_name": "Schulkultur - Verein zur Förderung kultureller und pädagogischer Praxis an Schulen",
      "company_seat": "Marburg",
      "details": "10.01.2025 (Bekanntmachungsdatum)\n\nHessen Amtsgericht Marburg VR 1932\nSonstige Registerbekanntmachung 09.01.2025 (Eintragungsdatum)\n\nSchulkultur - Verein zur Förderung kultureller und pädagogischer Praxis an Schulen\neingetragener Verein\nMarburg\n\nDer Verein ist aufgelöst."
    },
    {
      "date": "2025-01-10",
      "id": "98339",
      "original_text": "Sonstige Registerbekanntmachung\nHessen Amtsgericht Marburg VR 1932\nSchulkultur - Verein zur Förderung kultureller und pädagogischer Praxis an Schulen – Marburg",
      "type": "Sonstige Registerbekanntmachung",
      "state": "Hessen",
      "amtsgericht": "Amtsgericht Marburg",
      "registernummer": "VR 1932",
      "registerart": "VR",
      "company_name": "Schulkultur - Verein zur Förderung kultureller und pädagogischer Praxis an Schulen",
      "company_seat": "Marburg",
      "details": "10.01.2025 (Bekanntmachungsdatum)\n\nHessen Amtsgericht Marburg VR 1932\nSonstige Registerbekanntmachung 09.01.2025 (Eintragungsdatum)\n\nSchulkultur - Verein zur Förderung kultureller und pädagogischer Praxis an Schulen\neingetragener Verein\nMarburg\n\nDer Verein ist aufgelöst."
    }
  ]
}