{
  "date": "2025-01-06",
  "date_of_scrape": "2025-01-07T04:05:11.606Z",
  "tool_version": "0.2.0",
  "number_of_announcements": 77,
  "announcements": [
    {
      "date": "2025-01-06",
      "id": "97831",
      "original_text": "Sonstige Registerbekanntmachung\nBerlin Amtsgericht Berlin (Charlottenburg) HRB 259603\ninflu:ants UG (haftungsbeschränkt) – Berlin",
      "type": "Sonstige Registerbekanntmachung",
      "state": "Berlin",
      "amtsgericht": "Amtsgericht Berlin (Charlottenburg)",
      "registernummer": "HRB 259603",
      "registerart": "HRB",
      "company_name": "influ:ants UG (haftungsbeschränkt)",
      "company_seat": "Berlin",
      "details": "06.01.2025 (Bekanntmachungsdatum)\n\nBerlin Amtsgericht Berlin (Charlottenburg) HRB 259603\nSonstige Registerbekanntmachung\n\ninflu:ants UG (haftungsbeschränkt)\nGesellschaft mit beschränkter Haftung\nBerlin\n\nAls nicht eingetragen wird veröffentlicht: Der andere Vertragsteil hat den Gläubigern dieses Rechtsträgers, deren Forderungen begründet worden sind, bevor die Eintragung der Beendigung dieses Vertrages in das Handelsregister nach § 10 des Handelsgesetzbuches als bekannt gemacht gilt, Sicherheit zu leisten, wenn sie sich binnen sechs Monaten nach der Bekanntmachung der Eintragung zu diesem Zweck bei ihm melden. Dieses Recht steht den Gläubigern nicht zu, die im Fall des Insolvenzverfahrens ein Recht auf vorzugsweise Befriedigung aus der Deckungsmasse haben, die nach gesetzlicher Vorschrift zu ihrem Schutz errichtet und staatlich überwacht ist."
    },
    {
      "date": "2025-01-06",
      "id": "97832",
      "original_text": "Registerbekanntmachung nach dem Umwandlungsgesetz\nBerlin Amtsgericht Berlin (Charlottenburg) HRB 264268\nAufzugsverbund Deutschland Verwaltungs GmbH – Berlin",
      "type": "Registerbekanntmachung nach dem Umwandlungsgesetz",
      "state": "Berlin",
      "amtsgericht": "Amtsgericht Berlin (Charlottenburg)",
      "registernummer": "HRB 264268",
      "registerart": "HRB",
      "company_name": "Aufzugsverbund Deutschland Verwaltungs GmbH",
      "company_seat": "Berlin",
      "details": "06.01.2025 (Bekanntmachungsdatum)\n\nBerlin Amtsgericht Berlin (Charlottenburg) HRB 264268\nRegisterbekanntmachung nach dem Umwandlungsgesetz 03.01.2025 (Eintragungsdatum)\n\nAufzugsverbund Deutschland Verwaltungs GmbH\nGesellschaft mit beschränkter Haftung\nBerlin\n\nDen Gläubigern der an der Verschmelzung beteiligten Rechtsträger ist, wenn sie binnen sechs Monaten nach dem Tag, an dem die Eintragung der Verschmelzung in das Register des Sitzes desjenigen Rechtsträgers, dessen Gläubiger sie sind, als bekannt gemacht gilt, ihren Anspruch nach Grund und Höhe schriftlich anmelden, Sicherheit zu leisten, soweit sie nicht Befriedigung verlangen können. Dieses Recht steht den Gläubigern jedoch nur zu, wenn sie glaubhaft machen, dass durch die Verschmelzung die Erfüllung ihrer Forderung gefährdet wird. Das Recht, Sicherheitsleistung zu verlangen, steht Gläubigern nicht zu, die im Falle der Insolvenz ein Recht auf vorzugsweise Befriedigung aus einer Deckungsmasse haben, die nach gesetzlicher Vorschrift zu ihrem Schutz errichtet und staatlich überwacht ist.Zu Eintragungsnummer 2 vom 03.01.2025 wird als nicht eingetragen veröffentlicht:"
    },
    {
      "date": "2025-01-06",
      "id": "97833",
      "original_text": "Löschungsankündigung\nSchleswig-Holstein Amtsgericht Flensburg HRB 12370\nSylter Watt Original Verwaltungs-GmbH – Tinningstedt",
      "type": "Löschungsankündigung",
      "state": "Schleswig-Holstein",
      "amtsgericht": "Amtsgericht Flensburg",
      "registernummer": "HRB 12370",
      "registerart": "HRB",
      "company_name": "Sylter Watt Original Verwaltungs-GmbH",
      "company_seat": "Tinningstedt",
      "details": "06.01.2025 (Bekanntmachungsdatum)\n\nSchleswig-Holstein Amtsgericht Flensburg HRB 12370\nLöschungsankündigung\n\nSylter Watt Original Verwaltungs-GmbH\nGesellschaft mit beschränkter Haftung\nTinningstedt\n\nEs ist die Löschung der nachstehenden Gesellschaft wegen Vermögenslosigkeit gemäß § 394 FamFG beabsichtigt.\nWiderspruchsfrist: 2 Monate."
    },
    {
      "date": "2025-01-06",
      "id": "97834",
      "original_text": "Sonstige Registerbekanntmachung\nBerlin Amtsgericht Berlin (Charlottenburg) HRB 128699\nOkapi GmbH – Berlin",
      "type": "Sonstige Registerbekanntmachung",
      "state": "Berlin",
      "amtsgericht": "Amtsgericht Berlin (Charlottenburg)",
      "registernummer": "HRB 128699",
      "registerart": "HRB",
      "company_name": "Okapi GmbH",
      "company_seat": "Berlin",
      "details": "06.01.2025 (Bekanntmachungsdatum)\n\nBerlin Amtsgericht Berlin (Charlottenburg) HRB 128699\nSonstige Registerbekanntmachung 06.01.2025 (Eintragungsdatum)\n\nOkapi GmbH\nGesellschaft mit beschränkter Haftung\nBerlin\n\nAls nicht eingetragen wird veröffentlicht: Der andere Vertragsteil hat den Gläubigern dieses Rechtsträgers, deren Forderungen begründet worden sind, bevor die Eintragung der Beendigung dieses Vertrages in das Handelsregister nach § 10 des Handelsgesetzbuches als bekannt gemacht gilt, Sicherheit zu leisten, wenn sie sich binnen sechs Monaten nach der Bekanntmachung der Eintragung zu diesem Zweck bei ihm melden. Dieses Recht steht den Gläubigern nicht zu, die im Fall des Insolvenzverfahrens ein Recht auf vorzugsweise Befriedigung aus der Deckungsmasse haben, die nach gesetzlicher Vorschrift zu ihrem Schutz errichtet und staatlich überwacht ist."
    },
    {
      "date": "2025-01-06",
      "id": "97835",
      "original_text": "Einreichung neuer Dokumente\nBrandenburg Amtsgericht Potsdam HRB 4428\nHavelbus Verkehrsgesellschaft mbH – Nauen",
      "type": "Einreichung neuer Dokumente",
      "state": "Brandenburg",
      "amtsgericht": "Amtsgericht Potsdam",
      "registernummer": "HRB 4428",
      "registerart": "HRB",
      "company_name": "Havelbus Verkehrsgesellschaft mbH",
      "company_seat": "Nauen",
      "details": "06.01.2025 (Bekanntmachungsdatum)\n\nBrandenburg Amtsgericht Potsdam HRB 4428\nEinreichung neuer Dokumente\n\nHavelbus Verkehrsgesellschaft mbH\nGesellschaft mit beschränkter Haftung\nNauen\n\nAls nicht eingetragen wird veröffentlicht: Eine Liste der Mitglieder des Aufsichtsrates wurde zum Handelsregister eingereicht."
    },
    {
      "date": "2025-01-06",
      "id": "97836",
      "original_text": "Sonstige Registerbekanntmachung\nBrandenburg Amtsgericht Cottbus HRB 15503\nVEM Filia GmbH – Schönefeld",
      "type": "Sonstige Registerbekanntmachung",
      "state": "Brandenburg",
      "amtsgericht": "Amtsgericht Cottbus",
      "registernummer": "HRB 15503",
      "registerart": "HRB",
      "company_name": "VEM Filia GmbH",
      "company_seat": "Schönefeld",
      "details": "06.01.2025 (Bekanntmachungsdatum)\n\nBrandenburg Amtsgericht Cottbus HRB 15503\nSonstige Registerbekanntmachung\n\nVEM Filia GmbH\nGesellschaft mit beschränkter Haftung\nSchönefeld\n\nDen Gläubigern der Gesellschaft, deren Forderungen begründet worden sind, bevor die Eintragung der Beendigung des Vertrages in das Handelsregister nach § 10 des Handelsgesetzbuches als bekanntgemacht gilt, hat der andere Vertragsteil Sicherheit zu leisten, wenn sie sich binnen sechs Monaten nach der Bekanntmachung der Eintragung zu diesem Zweck bei ihm melden"
    },
    {
      "date": "2025-01-06",
      "id": "97837",
      "original_text": "Löschungsankündigung\nSaarland Amtsgericht Saarbrücken HRB 18240\nHFT Hirtz Fertigungstechnik GmbH – Püttlingen",
      "type": "Löschungsankündigung",
      "state": "Saarland",
      "amtsgericht": "Amtsgericht Saarbrücken",
      "registernummer": "HRB 18240",
      "registerart": "HRB",
      "company_name": "HFT Hirtz Fertigungstechnik GmbH",
      "company_seat": "Püttlingen",
      "details": "06.01.2025 (Bekanntmachungsdatum)\n\nSaarland Amtsgericht Saarbrücken HRB 18240\nLöschungsankündigung\n\nHFT Hirtz Fertigungstechnik GmbH\nGesellschaft mit beschränkter Haftung\nPüttlingen\n\nEs ist beabsichtigt, die Gesellschaft von Amts wegen gemäß § 394 FamFG wegen Vermögenslosigkeit zu löschen.\nGegen die Löschung von Amts wegen ist das Rechtsmittel des Widerspruchs statthaft. Der Widerspruch ist binnen einer Frist zwei Monaten beginnend mit dem Tag dieser Veröffentlichung durch Einreichen eines Widerspruchsschreibens -schriftlich oder zur Niederschrift der Geschäftsstelle beim Amtsgericht Saarbrücken, -zentrales Handelsregister-, Mainzerstr.178, 66121 Saarbrücken einzulegen.\nDer Widerspruch muss die Bezeichnung der angefochtenen Löschungsankündigung enthalten sowie die Erklärung, dass Widerspruch eingelegt wird. Er ist vom Widerspruchsführer oder seinem Bevollmächtigten zu unterzeichnen.\nDas Widerspruchsschreiben kann auch in der Form eines elektronischen Dokumentes eingereicht werden, das mit einer qualifizierten elektronischen Signatur nach dem Signaturgesetz versehen sein muss (§§ 14 Abs. 2 FamFG, 130a, 298 ZPO)."
    },
    {
      "date": "2025-01-06",
      "id": "97838",
      "original_text": "Einreichung neuer Dokumente\nSaarland Amtsgericht Saarbrücken HRB 5977\nSAARLAND - SPIELBANK GmbH – Saarbrücken",
      "type": "Einreichung neuer Dokumente",
      "state": "Saarland",
      "amtsgericht": "Amtsgericht Saarbrücken",
      "registernummer": "HRB 5977",
      "registerart": "HRB",
      "company_name": "SAARLAND - SPIELBANK GmbH",
      "company_seat": "Saarbrücken",
      "details": "06.01.2025 (Bekanntmachungsdatum)\n\nSaarland Amtsgericht Saarbrücken HRB 5977\nEinreichung neuer Dokumente\n\nSAARLAND - SPIELBANK GmbH\nGesellschaft mit beschränkter Haftung\nSaarbrücken\n\nDie Geschäftsführung der Gesellschaft hat eine Liste der Mitglieder des Aufsichtsrats zum Handelsregister eingereicht (§ 52 Abs. 3 Satz 2 GmbHG)."
    },
    {
      "date": "2025-01-06",
      "id": "97839",
      "original_text": "Löschungsankündigung\nBerlin Amtsgericht Berlin (Charlottenburg) HRB 259340\nRV Bau GmbH – Berlin",
      "type": "Löschungsankündigung",
      "state": "Berlin",
      "amtsgericht": "Amtsgericht Berlin (Charlottenburg)",
      "registernummer": "HRB 259340",
      "registerart": "HRB",
      "company_name": "RV Bau GmbH",
      "company_seat": "Berlin",
      "details": "06.01.2025 (Bekanntmachungsdatum)\n\nBerlin Amtsgericht Berlin (Charlottenburg) HRB 259340\nLöschungsankündigung\n\nRV Bau GmbH\nGesellschaft mit beschränkter Haftung\nBerlin\n\nBei der nachstehenden Gesellschaft wird das Amtslöschungsverfahren gemäß § 394 FamFG eingeleitet. Widerspruchsfrist 6 Wochen"
    },
    {
      "date": "2025-01-06",
      "id": "97840",
      "original_text": "Löschungsankündigung\nBerlin Amtsgericht Berlin (Charlottenburg) HRB 227949\nKMW City Bau GmbH – Berlin",
      "type": "Löschungsankündigung",
      "state": "Berlin",
      "amtsgericht": "Amtsgericht Berlin (Charlottenburg)",
      "registernummer": "HRB 227949",
      "registerart": "HRB",
      "company_name": "KMW City Bau GmbH",
      "company_seat": "Berlin",
      "details": "06.01.2025 (Bekanntmachungsdatum)\n\nBerlin Amtsgericht Berlin (Charlottenburg) HRB 227949\nLöschungsankündigung\n\nKMW City Bau GmbH\nGesellschaft mit beschränkter Haftung\nBerlin\n\nBei der nachstehenden Gesellschaft wird das Amtslöschungsverfahren gemäß § 394 FamFG eingeleitet. Widerspruchsfrist 6 Wochen"
    },
    {
      "date": "2025-01-06",
      "id": "97841",
      "original_text": "Registerbekanntmachung nach dem Umwandlungsgesetz\nMecklenburg-Vorpommern Amtsgericht Stralsund HRB 6238\nYachtzentrum Greifswald Beteiligungs-GmbH – Greifswald",
      "type": "Registerbekanntmachung nach dem Umwandlungsgesetz",
      "state": "Mecklenburg-Vorpommern",
      "amtsgericht": "Amtsgericht Stralsund",
      "registernummer": "HRB 6238",
      "registerart": "HRB",
      "company_name": "Yachtzentrum Greifswald Beteiligungs-GmbH",
      "company_seat": "Greifswald",
      "details": "06.01.2025 (Bekanntmachungsdatum)\n\nMecklenburg-Vorpommern Amtsgericht Stralsund HRB 6238\nRegisterbekanntmachung nach dem Umwandlungsgesetz 06.01.2025 (Eintragungsdatum)\n\nYachtzentrum Greifswald Beteiligungs-GmbH\nGesellschaft mit beschränkter Haftung\nGreifswald\n\nAls nicht eingetragen wird veröffentlicht: Den Gläubigern der an der Verschmelzung beteiligten Rechtsträger ist, wenn sie binnen sechs Monaten nach dem Tag, an dem die Eintragung der Verschmelzung in das Register des Sitzes desjenigen Rechtsträgers, dessen Gläubiger sie sind, nach § 19 Abs. 3 UmwG als bekannt gemacht gilt,\nihren Anspruch nach Grund und Höhe schriftlich anmelden, Sicherheit zu leisten, soweit sie nicht Befriedigung verlangen können. Dieses Recht steht den Gläubigern jedoch nur zu, wenn sie glaubhaft machen, dass durch die Verschmelzung die Erfüllung der Forderung gefährdet wird."
    },
    {
      "date": "2025-01-06",
      "id": "97842",
      "original_text": "Registerbekanntmachung nach dem Umwandlungsgesetz\nHamburg Amtsgericht Hamburg HRB 71179\n53.10. Real Assets Treuhand GmbH – Hamburg",
      "type": "Registerbekanntmachung nach dem Umwandlungsgesetz",
      "state": "Hamburg",
      "amtsgericht": "Amtsgericht Hamburg",
      "registernummer": "HRB 71179",
      "registerart": "HRB",
      "company_name": "53.10. Real Assets Treuhand GmbH",
      "company_seat": "Hamburg",
      "details": "06.01.2025 (Bekanntmachungsdatum)\n\nHamburg Amtsgericht Hamburg HRB 71179\nRegisterbekanntmachung nach dem Umwandlungsgesetz 06.01.2025 (Eintragungsdatum)\n\n53.10. Real Assets Treuhand GmbH\nGesellschaft mit beschränkter Haftung\nHamburg\n\nAls nicht eingetragen wird bekannt gemacht:  Den Gläubigern der Gesellschaft, deren Forderungen begründet worden sind, bevor die Eintragung der Vertragsbeendigung in das Handelsregister nach § 10 HGB als bekannt gemacht gilt, ist vom anderen Vertragsteil Sicherheit zu leisten, wenn sie sich binnen 6 Monaten nach Bekanntmachung der Eintragung zu diesem Zweck bei ihm melden."
    },
    {
      "date": "2025-01-06",
      "id": "97843",
      "original_text": "Registerbekanntmachung nach dem Umwandlungsgesetz\nHamburg Amtsgericht Hamburg HRB 109328\nFLOW media company GmbH – Hamburg",
      "type": "Registerbekanntmachung nach dem Umwandlungsgesetz",
      "state": "Hamburg",
      "amtsgericht": "Amtsgericht Hamburg",
      "registernummer": "HRB 109328",
      "registerart": "HRB",
      "company_name": "FLOW media company GmbH",
      "company_seat": "Hamburg",
      "details": "06.01.2025 (Bekanntmachungsdatum)\n\nHamburg Amtsgericht Hamburg HRB 109328\nRegisterbekanntmachung nach dem Umwandlungsgesetz 23.12.2024 (Eintragungsdatum)\n\nFLOW media company GmbH\nGesellschaft mit beschränkter Haftung\nHamburg\n\nAls nicht eingetragen wird bekannt gemacht:\nDen Gläubigern der an der Verschmelzung beteiligten Gesellschaften ist, wenn sie binnen sechs Monaten nach dem Tag, an dem die Eintragung der Verschmelzung in das Register des Sitzes desjenigen Rechtsträgers, dessen Gläubiger sie sind, nach § 19 Absatz 3 UmwG als bekannt gemacht gilt, ihren Anspruch nach Grund und Höhe schriftlich anmelden, Sicherheit zu leisten, soweit sie nicht Befriedigung verlangen können. Dieses Recht steht den Gläubigern jedoch nur zu, wenn sie glaubhaft machen, dass durch die Verschmelzung die Erfüllung ihrer Forderung gefährdet wird."
    },
    {
      "date": "2025-01-06",
      "id": "97844",
      "original_text": "Löschungsankündigung\nBerlin Amtsgericht Berlin (Charlottenburg) HRB 221109\nqBrands Trade GmbH – Berlin",
      "type": "Löschungsankündigung",
      "state": "Berlin",
      "amtsgericht": "Amtsgericht Berlin (Charlottenburg)",
      "registernummer": "HRB 221109",
      "registerart": "HRB",
      "company_name": "qBrands Trade GmbH",
      "company_seat": "Berlin",
      "details": "06.01.2025 (Bekanntmachungsdatum)\n\nBerlin Amtsgericht Berlin (Charlottenburg) HRB 221109\nLöschungsankündigung\n\nqBrands Trade GmbH\nGesellschaft mit beschränkter Haftung\nBerlin\n\nBei der nachstehenden Gesellschaft wird das Amtslöschungsverfahren gemäß § 394 FamFG eingeleitet. Widerspruchsfrist 6 Wochen"
    },
    {
      "date": "2025-01-06",
      "id": "97845",
      "original_text": "Registerbekanntmachung nach dem Umwandlungsgesetz\nMecklenburg-Vorpommern Amtsgericht Schwerin HRA 4682\nHML Grambow Holding GmbH & Co. KG – Grambow",
      "type": "Registerbekanntmachung nach dem Umwandlungsgesetz",
      "state": "Mecklenburg-Vorpommern",
      "amtsgericht": "Amtsgericht Schwerin",
      "registernummer": "HRA 4682",
      "registerart": "HRA",
      "company_name": "HML Grambow Holding GmbH & Co. KG",
      "company_seat": "Grambow",
      "details": "06.01.2025 (Bekanntmachungsdatum)\n\nMecklenburg-Vorpommern Amtsgericht Schwerin HRA 4682\nRegisterbekanntmachung nach dem Umwandlungsgesetz 06.01.2025 (Eintragungsdatum)\n\nHML Grambow Holding GmbH & Co. KG\nKommanditgesellschaft\nGrambow\n\nAls nicht eingetragen wird veröffentlicht: Den Gläubigern der an der Ausgliederung beteiligten Rechtsträger ist, wenn sie binnen sechs Monaten nach dem Tag, an dem die Eintragung der Ausgliederung in das Register des Sitzes desjenigen Rechtsträgers, dessen Gläubiger sie sind, nach § 19 Abs. 3 UmwG als bekannt gemacht gilt, ihren Anspruch nach Grund und Höhe schriftlich anmelden,\nSicherheit zu leisten, soweit sie nicht Befriedigung verlangen können. Dieses Recht steht den Gläubigern jedoch nur zu, wenn sie glaubhaft machen, dass durch die Ausgliederung die Erfüllung der Forderung gefährdet wird."
    },
    {
      "date": "2025-01-06",
      "id": "97846",
      "original_text": "Sonstige Registerbekanntmachung\nHamburg Amtsgericht Hamburg HRB 4659\nBaloise Lebensversicherung Aktiengesellschaft Deutschland – Hamburg",
      "type": "Sonstige Registerbekanntmachung",
      "state": "Hamburg",
      "amtsgericht": "Amtsgericht Hamburg",
      "registernummer": "HRB 4659",
      "registerart": "HRB",
      "company_name": "Baloise Lebensversicherung Aktiengesellschaft Deutschland",
      "company_seat": "Hamburg",
      "details": "06.01.2025 (Bekanntmachungsdatum)\n\nHamburg Amtsgericht Hamburg HRB 4659\nSonstige Registerbekanntmachung 06.01.2025 (Eintragungsdatum)\n\nBaloise Lebensversicherung Aktiengesellschaft Deutschland\nAktiengesellschaft\nHamburg\n\nAls nicht eingetragen wird bekannt gemacht: Liste des Aufsichtsrats wurde eingereicht."
    },
    {
      "date": "2025-01-06",
      "id": "97847",
      "original_text": "Einreichung neuer Dokumente\nBerlin Amtsgericht Berlin (Charlottenburg) HRB 72916\nBT Berlin Transport GmbH – Berlin",
      "type": "Einreichung neuer Dokumente",
      "state": "Berlin",
      "amtsgericht": "Amtsgericht Berlin (Charlottenburg)",
      "registernummer": "HRB 72916",
      "registerart": "HRB",
      "company_name": "BT Berlin Transport GmbH",
      "company_seat": "Berlin",
      "details": "06.01.2025 (Bekanntmachungsdatum)\n\nBerlin Amtsgericht Berlin (Charlottenburg) HRB 72916\nEinreichung neuer Dokumente\n\nBT Berlin Transport GmbH\nGesellschaft mit beschränkter Haftung\nBerlin\n\nAls nicht eingetragen wird veröffentlicht:\n\nEs wurde eine neue Liste der Aufsichtsratsmitglieder eingereicht (§52 GmbHG)."
    },
    {
      "date": "2025-01-06",
      "id": "97848",
      "original_text": "Löschungsankündigung\nBerlin Amtsgericht Berlin (Charlottenburg) HRB 144563\nCREATIV Projektentwicklungs- und Baumanagement GmbH – Berlin",
      "type": "Löschungsankündigung",
      "state": "Berlin",
      "amtsgericht": "Amtsgericht Berlin (Charlottenburg)",
      "registernummer": "HRB 144563",
      "registerart": "HRB",
      "company_name": "CREATIV Projektentwicklungs- und Baumanagement GmbH",
      "company_seat": "Berlin",
      "details": "06.01.2025 (Bekanntmachungsdatum)\n\nBerlin Amtsgericht Berlin (Charlottenburg) HRB 144563\nLöschungsankündigung\n\nCREATIV Projektentwicklungs- und Baumanagement GmbH\nGesellschaft mit beschränkter Haftung\nBerlin\n\nBei der nachstehenden Gesellschaft wird das Amtslöschungsverfahren gemäß § 394 FamFG eingeleitet. Widerspruchsfrist 6 Wochen"
    },
    {
      "date": "2025-01-06",
      "id": "97849",
      "original_text": "Sonstige Registerbekanntmachung\nSchleswig-Holstein Amtsgericht Lübeck HRB 15752\nDr. Klein Wowi Finanz AG – Lübeck",
      "type": "Sonstige Registerbekanntmachung",
      "state": "Schleswig-Holstein",
      "amtsgericht": "Amtsgericht Lübeck",
      "registernummer": "HRB 15752",
      "registerart": "HRB",
      "company_name": "Dr. Klein Wowi Finanz AG",
      "company_seat": "Lübeck",
      "details": "06.01.2025 (Bekanntmachungsdatum)\n\nSchleswig-Holstein Amtsgericht Lübeck HRB 15752\nSonstige Registerbekanntmachung 03.01.2025 (Eintragungsdatum)\n\nDr. Klein Wowi Finanz AG\nAktiengesellschaft\nLübeck\n\nAls nicht eingetragen wird veröffentlicht: Der andere Vertragsteil hat den Gläubigern dieses Rechtsträgers, dessen Forderungen begründet worden sind, bevor die Eintragung der Beendigung dieses Vertrages in das Handelsregister nach § 10 des Handelsgesetzbuches als bekannt gemacht gilt, Sicherheit zu leisten, wenn sie sich binnen sechs Monaten nach der Bekanntmachung der Eintragung zu diesem Zweck bei ihm melden. Dieses Recht steht den Gläubigern nicht zu, die im Fall des Insolvenzverfahrens ein Recht auf vorzugsweise Befriedigung aus der Deckungsmasse haben, die nach gesetzlicher Vorschrift zu ihrem Schutz errichtet und staatlich überwacht ist."
    },
    {
      "date": "2025-01-06",
      "id": "97850",
      "original_text": "Sonstige Registerbekanntmachung\nMecklenburg-Vorpommern Amtsgericht Schwerin HRB 8902\nNetzgesellschaft Schwerin mbH (NGS) – Schwerin",
      "type": "Sonstige Registerbekanntmachung",
      "state": "Mecklenburg-Vorpommern",
      "amtsgericht": "Amtsgericht Schwerin",
      "registernummer": "HRB 8902",
      "registerart": "HRB",
      "company_name": "Netzgesellschaft Schwerin mbH (NGS)",
      "company_seat": "Schwerin",
      "details": "06.01.2025 (Bekanntmachungsdatum)\n\nMecklenburg-Vorpommern Amtsgericht Schwerin HRB 8902\nSonstige Registerbekanntmachung 06.01.2025 (Eintragungsdatum)\n\nNetzgesellschaft Schwerin mbH (NGS)\nGesellschaft mit beschränkter Haftung\nSchwerin\n\nEine Liste der Mitglieder des Aufsichtsrats ist zum Handelsregister eingereicht worden."
    },
    {
      "date": "2025-01-06",
      "id": "97851",
      "original_text": "Sonstige Registerbekanntmachung\nBerlin Amtsgericht Berlin (Charlottenburg) HRB 125457\nBESSER DISTRIBUTION GmbH – Berlin",
      "type": "Sonstige Registerbekanntmachung",
      "state": "Berlin",
      "amtsgericht": "Amtsgericht Berlin (Charlottenburg)",
      "registernummer": "HRB 125457",
      "registerart": "HRB",
      "company_name": "BESSER DISTRIBUTION GmbH",
      "company_seat": "Berlin",
      "details": "06.01.2025 (Bekanntmachungsdatum)\n\nBerlin Amtsgericht Berlin (Charlottenburg) HRB 125457\nSonstige Registerbekanntmachung\n\nBESSER DISTRIBUTION GmbH\nGesellschaft mit beschränkter Haftung\nBerlin\n\nAls nicht eingetragen wird veröffentlicht:Der andere Vertragsteil hat den Gläubigern dieses Rechtsträgers, deren Forderungen begründet worden sind, bevor die Eintragung der Beendigung dieses Vertrages in das Handelsregister nach § 10 des Handelsgesetzbuches als bekannt gemacht gilt, Sicherheit zu leisten, wenn sie sich binnen sechs Monaten nach der Bekanntmachung der Eintragung zu diesem Zweck bei ihm melden. Dieses Recht steht den Gläubigern nicht zu, die im Fall des Insolvenzverfahrens ein Recht auf vorzugsweise Befriedigung aus der Deckungsmasse haben, die nach gesetzlicher Vorschrift zu ihrem Schutz errichtet und staatlich überwacht ist."
    },
    {
      "date": "2025-01-06",
      "id": "97852",
      "original_text": "Einreichung neuer Dokumente\nBerlin Amtsgericht Berlin (Charlottenburg) HRB 83319\nCondat Aktiengesellschaft – Berlin",
      "type": "Einreichung neuer Dokumente",
      "state": "Berlin",
      "amtsgericht": "Amtsgericht Berlin (Charlottenburg)",
      "registernummer": "HRB 83319",
      "registerart": "HRB",
      "company_name": "Condat Aktiengesellschaft",
      "company_seat": "Berlin",
      "details": "06.01.2025 (Bekanntmachungsdatum)\n\nBerlin Amtsgericht Berlin (Charlottenburg) HRB 83319\nEinreichung neuer Dokumente\n\nCondat Aktiengesellschaft\nAktiengesellschaft\nBerlin\n\nAls nicht eingetragen wird veröffentlicht: Es wurde eine neue Liste der Aufsichtsratsmitglieder eingereicht (§ 106 AktG)."
    },
    {
      "date": "2025-01-06",
      "id": "97853",
      "original_text": "Löschungsankündigung\nBerlin Amtsgericht Berlin (Charlottenburg) HRB 206264\nSPG Logistic GmbH – Berlin",
      "type": "Löschungsankündigung",
      "state": "Berlin",
      "amtsgericht": "Amtsgericht Berlin (Charlottenburg)",
      "registernummer": "HRB 206264",
      "registerart": "HRB",
      "company_name": "SPG Logistic GmbH",
      "company_seat": "Berlin",
      "details": "06.01.2025 (Bekanntmachungsdatum)\n\nBerlin Amtsgericht Berlin (Charlottenburg) HRB 206264\nLöschungsankündigung\n\nSPG Logistic GmbH\nGesellschaft mit beschränkter Haftung\nBerlin\n\nBei der nachstehenden Gesellschaft wird das Amtslöschungsverfahren gemäß § 394 FamFG eingeleitet. Widerspruchsfrist 6 Wochen"
    },
    {
      "date": "2025-01-06",
      "id": "97854",
      "original_text": "Löschungsankündigung\nBerlin Amtsgericht Berlin (Charlottenburg) HRB 206253\nLumenora GmbH – Berlin",
      "type": "Löschungsankündigung",
      "state": "Berlin",
      "amtsgericht": "Amtsgericht Berlin (Charlottenburg)",
      "registernummer": "HRB 206253",
      "registerart": "HRB",
      "company_name": "Lumenora GmbH",
      "company_seat": "Berlin",
      "details": "06.01.2025 (Bekanntmachungsdatum)\n\nBerlin Amtsgericht Berlin (Charlottenburg) HRB 206253\nLöschungsankündigung\n\nLumenora GmbH\nGesellschaft mit beschränkter Haftung\nBerlin\n\nBei der nachstehenden Gesellschaft wird das Amtslöschungsverfahren gemäß § 394 FamFG eingeleitet. Widerspruchsfrist 6 Wochen"
    },
    {
      "date": "2025-01-06",
      "id": "97855",
      "original_text": "Sonstige Registerbekanntmachung\nBerlin Amtsgericht Berlin (Charlottenburg) HRB 177978\nCarnaby Living House Berlin GmbH – Berlin",
      "type": "Sonstige Registerbekanntmachung",
      "state": "Berlin",
      "amtsgericht": "Amtsgericht Berlin (Charlottenburg)",
      "registernummer": "HRB 177978",
      "registerart": "HRB",
      "company_name": "Carnaby Living House Berlin GmbH",
      "company_seat": "Berlin",
      "details": "06.01.2025 (Bekanntmachungsdatum)\n\nBerlin Amtsgericht Berlin (Charlottenburg) HRB 177978\nSonstige Registerbekanntmachung\n\nCarnaby Living House Berlin GmbH\nGesellschaft mit beschränkter Haftung\nBerlin\n\nAls nicht eingetragen wird veröffentlicht: Der andere Vertragsteil hat den Gläubigern dieses Rechtsträgers, deren Forderungen begründet worden sind, bevor die Eintragung der Beendigung dieses Vertrages in das Handelsregister nach § 10 des Handelsgesetzbuches als bekannt gemacht gilt, Sicherheit zu leisten, wenn sie sich binnen sechs Monaten nach der Bekanntmachung der Eintragung zu diesem Zweck bei ihm melden. Dieses Recht steht den Gläubigern nicht zu, die im Fall des Insolvenzverfahrens ein Recht auf vorzugsweise Befriedigung aus der Deckungsmasse haben, die nach gesetzlicher Vorschrift zu ihrem Schutz errichtet und staatlich überwacht ist."
    },
    {
      "date": "2025-01-06",
      "id": "97856",
      "original_text": "Löschungsankündigung\nBerlin Amtsgericht Berlin (Charlottenburg) HRB 208293\nY.T. Stein-Bau GmbH – Berlin",
      "type": "Löschungsankündigung",
      "state": "Berlin",
      "amtsgericht": "Amtsgericht Berlin (Charlottenburg)",
      "registernummer": "HRB 208293",
      "registerart": "HRB",
      "company_name": "Y.T. Stein-Bau GmbH",
      "company_seat": "Berlin",
      "details": "06.01.2025 (Bekanntmachungsdatum)\n\nBerlin Amtsgericht Berlin (Charlottenburg) HRB 208293\nLöschungsankündigung\n\nY.T. Stein-Bau GmbH\nGesellschaft mit beschränkter Haftung\nBerlin\n\nBei der nachstehenden Gesellschaft wird das Amtslöschungsverfahren gemäß § 394 FamFG eingeleitet. Widerspruchsfrist 6 Wochen"
    },
    {
      "date": "2025-01-06",
      "id": "97857",
      "original_text": "Einreichung neuer Dokumente\nBrandenburg Amtsgericht Potsdam HRB 7889\nEntwicklungsträger Bornstedter Feld GmbH – Potsdam",
      "type": "Einreichung neuer Dokumente",
      "state": "Brandenburg",
      "amtsgericht": "Amtsgericht Potsdam",
      "registernummer": "HRB 7889",
      "registerart": "HRB",
      "company_name": "Entwicklungsträger Bornstedter Feld GmbH",
      "company_seat": "Potsdam",
      "details": "06.01.2025 (Bekanntmachungsdatum)\n\nBrandenburg Amtsgericht Potsdam HRB 7889\nEinreichung neuer Dokumente\n\nEntwicklungsträger Bornstedter Feld GmbH\nGesellschaft mit beschränkter Haftung\nPotsdam\n\nAls nicht eingetragen wird veröffentlicht: Eine Liste der Mitglieder des Aufsichtsrates wurde zum Handelsregister eingereicht."
    },
    {
      "date": "2025-01-06",
      "id": "97858",
      "original_text": "Registerbekanntmachung nach dem Umwandlungsgesetz\nHamburg Amtsgericht Hamburg HRB 167551\nGGW Group GmbH – Hamburg",
      "type": "Registerbekanntmachung nach dem Umwandlungsgesetz",
      "state": "Hamburg",
      "amtsgericht": "Amtsgericht Hamburg",
      "registernummer": "HRB 167551",
      "registerart": "HRB",
      "company_name": "GGW Group GmbH",
      "company_seat": "Hamburg",
      "details": "06.01.2025 (Bekanntmachungsdatum)\n\nHamburg Amtsgericht Hamburg HRB 167551\nRegisterbekanntmachung nach dem Umwandlungsgesetz 06.01.2025 (Eintragungsdatum)\n\nGGW Group GmbH\nGesellschaft mit beschränkter Haftung\nHamburg\n\nAls nicht eingetragen wird bekannt gemacht:\nDen Gläubigern der an der Verschmelzung beteiligten Gesellschaften ist, wenn sie binnen sechs Monaten nach dem Tag, an dem die Eintragung der Verschmelzung in das Register des Sitzes desjenigen Rechtsträgers, dessen Gläubiger sie sind, nach § 19 Absatz 3 UmwG als bekannt gemacht gilt, ihren Anspruch nach Grund und Höhe schriftlich anmelden, Sicherheit zu leisten, soweit sie nicht Befriedigung verlangen können. Dieses Recht steht den Gläubigern jedoch nur zu, wenn sie glaubhaft machen, dass durch die Verschmelzung die Erfüllung ihrer Forderung gefährdet wird."
    },
    {
      "date": "2025-01-06",
      "id": "97859",
      "original_text": "Löschungsankündigung\nBrandenburg Amtsgericht Frankfurt/Oder HRB 17603\nSonnabend UG (haftungsbeschränkt) – Müncheberg",
      "type": "Löschungsankündigung",
      "state": "Brandenburg",
      "amtsgericht": "Amtsgericht Frankfurt/Oder",
      "registernummer": "HRB 17603",
      "registerart": "HRB",
      "company_name": "Sonnabend UG (haftungsbeschränkt)",
      "company_seat": "Müncheberg",
      "details": "06.01.2025 (Bekanntmachungsdatum)\n\nBrandenburg Amtsgericht Frankfurt/Oder HRB 17603\nLöschungsankündigung\n\nSonnabend UG (haftungsbeschränkt)\nGesellschaft mit beschränkter Haftung\nMüncheberg\n\nBei der nachstehenden Gesellschaft wird das Amtslöschungsverfahren gemäß § 394 FamFG eingeleitet."
    },
    {
      "date": "2025-01-06",
      "id": "97860",
      "original_text": "Einreichung neuer Dokumente\nSachsen Amtsgericht Dresden HRB 15017\nWeingut Hoflößnitz GmbH – Radebeul",
      "type": "Einreichung neuer Dokumente",
      "state": "Sachsen",
      "amtsgericht": "Amtsgericht Dresden",
      "registernummer": "HRB 15017",
      "registerart": "HRB",
      "company_name": "Weingut Hoflößnitz GmbH",
      "company_seat": "Radebeul",
      "details": "06.01.2025 (Bekanntmachungsdatum)\n\nSachsen Amtsgericht Dresden HRB 15017\nEinreichung neuer Dokumente\n\nWeingut Hoflößnitz GmbH\nGesellschaft mit beschränkter Haftung\nRadebeul\n\nAm 03.01.2025 wurde beim Handelsregister des Amtsgerichts Dresden die Liste der Mitglieder des Aufsichtsrats gemäß § 52 GmbHG eingereicht."
    },
    {
      "date": "2025-01-06",
      "id": "97861",
      "original_text": "Einreichung neuer Dokumente\nSachsen Amtsgericht Dresden HRB 6606\nBeteiligungsgesellschaft der Stadt Radebeul mbH – Radebeul",
      "type": "Einreichung neuer Dokumente",
      "state": "Sachsen",
      "amtsgericht": "Amtsgericht Dresden",
      "registernummer": "HRB 6606",
      "registerart": "HRB",
      "company_name": "Beteiligungsgesellschaft der Stadt Radebeul mbH",
      "company_seat": "Radebeul",
      "details": "06.01.2025 (Bekanntmachungsdatum)\n\nSachsen Amtsgericht Dresden HRB 6606\nEinreichung neuer Dokumente\n\nBeteiligungsgesellschaft der Stadt Radebeul mbH\nGesellschaft mit beschränkter Haftung\nRadebeul\n\nAm 03.01.2025 wurde beim Handelsregister des Amtsgerichts Dresden die Liste der Mitglieder des Aufsichtsrats gemäß § 52 GmbHG eingereicht."
    },
    {
      "date": "2025-01-06",
      "id": "97862",
      "original_text": "Einreichung neuer Dokumente\nSachsen Amtsgericht Dresden HRB 7313\nWIR Wohnen in Radebeul GmbH – Radebeul",
      "type": "Einreichung neuer Dokumente",
      "state": "Sachsen",
      "amtsgericht": "Amtsgericht Dresden",
      "registernummer": "HRB 7313",
      "registerart": "HRB",
      "company_name": "WIR Wohnen in Radebeul GmbH",
      "company_seat": "Radebeul",
      "details": "06.01.2025 (Bekanntmachungsdatum)\n\nSachsen Amtsgericht Dresden HRB 7313\nEinreichung neuer Dokumente\n\nWIR Wohnen in Radebeul GmbH\nGesellschaft mit beschränkter Haftung\nRadebeul\n\nAm 03.01.2025 wurde beim Handelsregister des Amtsgerichts Dresden die Liste der Mitglieder des Aufsichtsrats gemäß § 52 GmbHG eingereicht."
    },
    {
      "date": "2025-01-06",
      "id": "97863",
      "original_text": "Einreichung neuer Dokumente\nSachsen Amtsgericht Chemnitz HRB 5760\nRöhrsdorfer Wohnungsbauförderungsgesellschaft mbH – Chemnitz",
      "type": "Einreichung neuer Dokumente",
      "state": "Sachsen",
      "amtsgericht": "Amtsgericht Chemnitz",
      "registernummer": "HRB 5760",
      "registerart": "HRB",
      "company_name": "Röhrsdorfer Wohnungsbauförderungsgesellschaft mbH",
      "company_seat": "Chemnitz",
      "details": "06.01.2025 (Bekanntmachungsdatum)\n\nSachsen Amtsgericht Chemnitz HRB 5760\nEinreichung neuer Dokumente\n\nRöhrsdorfer Wohnungsbauförderungsgesellschaft mbH\nGesellschaft mit beschränkter Haftung\nChemnitz\n\nAm 27.12.2024 wurde beim Handelsregister des Amtsgerichts Chemnitz die Liste der Mitglieder des Aufsichtsrats gemäß § 52 GmbHG eingereicht."
    },
    {
      "date": "2025-01-06",
      "id": "97864",
      "original_text": "Einreichung neuer Dokumente\nSachsen Amtsgericht Chemnitz HRB 3756\nStadtwerke Freiberg Aktiengesellschaft – Freiberg",
      "type": "Einreichung neuer Dokumente",
      "state": "Sachsen",
      "amtsgericht": "Amtsgericht Chemnitz",
      "registernummer": "HRB 3756",
      "registerart": "HRB",
      "company_name": "Stadtwerke Freiberg Aktiengesellschaft",
      "company_seat": "Freiberg",
      "details": "06.01.2025 (Bekanntmachungsdatum)\n\nSachsen Amtsgericht Chemnitz HRB 3756\nEinreichung neuer Dokumente\n\nStadtwerke Freiberg Aktiengesellschaft\nAktiengesellschaft\nFreiberg\n\nAm 30.12.2024 wurde beim Handelsregister des Amtsgerichts Chemnitz die Liste der Mitglieder des Aufsichtsrats gemäß § 106 AktG eingereicht."
    },
    {
      "date": "2025-01-06",
      "id": "97865",
      "original_text": "Sonstige Registerbekanntmachung\nSachsen Amtsgericht Leipzig HRB 22030\nGünter Bauer Agrar- und Landschaftsbau GmbH – Leipzig OT Knautnaundorf",
      "type": "Sonstige Registerbekanntmachung",
      "state": "Sachsen",
      "amtsgericht": "Amtsgericht Leipzig",
      "registernummer": "HRB 22030",
      "registerart": "HRB",
      "company_name": "Günter Bauer Agrar- und Landschaftsbau GmbH",
      "company_seat": "Leipzig OT Knautnaundorf",
      "details": "06.01.2025 (Bekanntmachungsdatum)\n\nSachsen Amtsgericht Leipzig HRB 22030\nSonstige Registerbekanntmachung 06.01.2025 (Eintragungsdatum)\n\nGünter Bauer Agrar- und Landschaftsbau GmbH\nGesellschaft mit beschränkter Haftung\nLeipzig OT Knautnaundorf\n\nDen Gläubigern der Gesellschaft, deren Forderungen begründet worden sind bevor die Eintragung der Beendigung des Beherrschungs- und Gewinnabführungsvertrages in das Handelsregister nach § 10 des Handelsgesetzbuches als bekanntgemacht gilt, hat der andere Vertragsteil Sicherheit zu leisten, wenn sie sich binnen sechs Monaten nach der Bekanntmachung der Eintragung zu diesem Zweck bei ihm melden."
    },
    {
      "date": "2025-01-06",
      "id": "97866",
      "original_text": "Registerbekanntmachung nach dem Umwandlungsgesetz\nSachsen Amtsgericht Leipzig HRB 40314\nRUBIN 89. GmbH – Leipzig",
      "type": "Registerbekanntmachung nach dem Umwandlungsgesetz",
      "state": "Sachsen",
      "amtsgericht": "Amtsgericht Leipzig",
      "registernummer": "HRB 40314",
      "registerart": "HRB",
      "company_name": "RUBIN 89. GmbH",
      "company_seat": "Leipzig",
      "details": "06.01.2025 (Bekanntmachungsdatum)\n\nSachsen Amtsgericht Leipzig HRB 40314\nRegisterbekanntmachung nach dem Umwandlungsgesetz 06.01.2025 (Eintragungsdatum)\n\nRUBIN 89. GmbH\nGesellschaft mit beschränkter Haftung\nLeipzig\n\nDen Gläubigern der an der Verschmelzung beteiligten Rechtsträger ist, wenn sie binnen sechs Monaten nach dem Tag, an dem die Eintragung der Verschmelzung in das Register des Sitzes desjenigen Rechtsträgers, dessen Gläubiger sie sind, nach § 19 Abs. 3 UmwG als bekannt gemacht gilt, ihren Anspruch nach Grund und Höhe in Textform anmelden, Sicherheit zu leisten, soweit sie nicht Befriedigung verlangen können. Dieses Recht steht den Gläubigern jedoch nur zu, wenn sie glaubhaft machen, dass durch die Verschmelzung die Erfüllung der Forderung gefährdet wird."
    },
    {
      "date": "2025-01-06",
      "id": "97867",
      "original_text": "Registerbekanntmachung nach dem Umwandlungsgesetz\nSachsen Amtsgericht Leipzig HRB 15193\nLeipziger Stadtbau Aktiengesellschaft – Leipzig",
      "type": "Registerbekanntmachung nach dem Umwandlungsgesetz",
      "state": "Sachsen",
      "amtsgericht": "Amtsgericht Leipzig",
      "registernummer": "HRB 15193",
      "registerart": "HRB",
      "company_name": "Leipziger Stadtbau Aktiengesellschaft",
      "company_seat": "Leipzig",
      "details": "06.01.2025 (Bekanntmachungsdatum)\n\nSachsen Amtsgericht Leipzig HRB 15193\nRegisterbekanntmachung nach dem Umwandlungsgesetz 06.01.2025 (Eintragungsdatum)\n\nLeipziger Stadtbau Aktiengesellschaft\nAktiengesellschaft\nLeipzig\n\nDen Gläubigern der an der Verschmelzung beteiligten Rechtsträger ist, wenn sie binnen sechs Monaten nach dem Tag, an dem die Eintragung der Verschmelzung in das Register des Sitzes desjenigen Rechtsträgers, dessen Gläubiger sie sind, nach § 19 Abs. 3 UmwG als bekannt gemacht gilt, ihren Anspruch nach Grund und Höhe in Textform anmelden, Sicherheit zu leisten, soweit sie nicht Befriedigung verlangen können. Dieses Recht steht den Gläubigern jedoch nur zu, wenn sie glaubhaft machen, dass durch die Verschmelzung die Erfüllung der Forderung gefährdet wird."
    },
    {
      "date": "2025-01-06",
      "id": "97868",
      "original_text": "Registerbekanntmachung nach dem Umwandlungsgesetz\nSachsen Amtsgericht Leipzig HRB 36977\nSPRIND GmbH – Leipzig",
      "type": "Registerbekanntmachung nach dem Umwandlungsgesetz",
      "state": "Sachsen",
      "amtsgericht": "Amtsgericht Leipzig",
      "registernummer": "HRB 36977",
      "registerart": "HRB",
      "company_name": "SPRIND GmbH",
      "company_seat": "Leipzig",
      "details": "06.01.2025 (Bekanntmachungsdatum)\n\nSachsen Amtsgericht Leipzig HRB 36977\nRegisterbekanntmachung nach dem Umwandlungsgesetz 06.01.2025 (Eintragungsdatum)\n\nSPRIND GmbH\nGesellschaft mit beschränkter Haftung\nLeipzig\n\nDen Gläubigern der an der Spaltung beteiligten Rechtsträger ist, wenn sie binnen sechs Monaten nach dem Tag, an dem die Eintragung der Spaltung in das Register des Sitzes desjenigen Rechtsträgers, dessen Gläubiger sie sind, nach § 19 Abs. 3 UmwG als bekannt gemacht gilt, ihren Anspruch nach Grund und Höhe in Textform anmelden, Sicherheit zu leisten, soweit sie nicht Befriedigung verlangen können. Dieses Recht steht den Gläubigern jedoch nur zu, wenn sie glaubhaft machen, dass durch die Spaltung die Erfüllung der Forderung gefährdet wird."
    },
    {
      "date": "2025-01-06",
      "id": "97869",
      "original_text": "Einreichung neuer Dokumente\nBrandenburg Amtsgericht Frankfurt/Oder HRB 7054\nMayer Kanalmanagement GmbH – Rüdersdorf b. Berlin",
      "type": "Einreichung neuer Dokumente",
      "state": "Brandenburg",
      "amtsgericht": "Amtsgericht Frankfurt/Oder",
      "registernummer": "HRB 7054",
      "registerart": "HRB",
      "company_name": "Mayer Kanalmanagement GmbH",
      "company_seat": "Rüdersdorf b. Berlin",
      "details": "06.01.2025 (Bekanntmachungsdatum)\n\nBrandenburg Amtsgericht Frankfurt/Oder HRB 7054\nEinreichung neuer Dokumente\n\nMayer Kanalmanagement GmbH\nGesellschaft mit beschränkter Haftung\nRüdersdorf b. Berlin\n\nAls nicht eingetragen wird veröffentlicht: Als nicht eingetragen wird veröffentlicht:\nDen Gläubigern der an der Verschmelzung beteiligten Rechtsträger ist, wenn sie binnen sechs Monaten nach dem Tag, an dem die Eintragung der Verschmelzung in das Register des Sitzes desjenigen Rechtsträgers, dessen Gläubiger sie sind, als bekannt gemacht gilt, ihren Anspruch nach Grund und Höhe schriftlich anmelden, Sicherheit zu leisten, soweit sie nicht Befriedigung verlangen können. Dieses Recht steht den Gläubigern jedoch nur zu, wenn sie glaubhaft machen, dass durch die Verschmelzung die Erfüllung ihrer Forderung gefährdet wird"
    },
    {
      "date": "2025-01-06",
      "id": "97870",
      "original_text": "Löschungsankündigung\nNiedersachsen Amtsgericht Hildesheim HRB 205397\nFHu UG (haftungsbeschränkt) – Harsum",
      "type": "Löschungsankündigung",
      "state": "Niedersachsen",
      "amtsgericht": "Amtsgericht Hildesheim",
      "registernummer": "HRB 205397",
      "registerart": "HRB",
      "company_name": "FHu UG (haftungsbeschränkt)",
      "company_seat": "Harsum",
      "details": "06.01.2025 (Bekanntmachungsdatum)\n\nNiedersachsen Amtsgericht Hildesheim HRB 205397\nLöschungsankündigung 06.01.2025 (Eintragungsdatum)\n\nFHu UG (haftungsbeschränkt)\nGesellschaft mit beschränkter Haftung\nHarsum\n\nDas Registergericht beabsichtigt, die Gesellschaft von Amts wegen nach § 394 FamFG zu löschen. Die Frist zur Erhebung eines Widerspruchs ist auf 1 Monat ab dieser Registerbekanntmachung festgesetzt."
    },
    {
      "date": "2025-01-06",
      "id": "97871",
      "original_text": "Sonstige Registerbekanntmachung\nNiedersachsen Amtsgericht Osnabrück HRB 18811\nFVB Gesellschaft für Finanz- und Versorgungsberatung mbH – Osnabrück",
      "type": "Sonstige Registerbekanntmachung",
      "state": "Niedersachsen",
      "amtsgericht": "Amtsgericht Osnabrück",
      "registernummer": "HRB 18811",
      "registerart": "HRB",
      "company_name": "FVB Gesellschaft für Finanz- und Versorgungsberatung mbH",
      "company_seat": "Osnabrück",
      "details": "06.01.2025 (Bekanntmachungsdatum)\n\nNiedersachsen Amtsgericht Osnabrück HRB 18811\nSonstige Registerbekanntmachung 06.01.2025 (Eintragungsdatum)\n\nFVB Gesellschaft für Finanz- und Versorgungsberatung mbH\nGesellschaft mit beschränkter Haftung\nOsnabrück\n\nDen Gläubigern der Gesellschaft, deren Forderungen begründet worden sind, bevor die Eintragung der Beendigung des Vertrages in das Handelsregister nach § 10 HGB als bekanntgemacht gilt, ist vom anderen Vertragsteil Sicherheit zu leisten, wenn sie sich binnen sechs Monaten nach der Bekanntmachung zu diesem Zweck bei ihm melden."
    },
    {
      "date": "2025-01-06",
      "id": "97872",
      "original_text": "Registerbekanntmachung nach dem Umwandlungsgesetz\nNiedersachsen Amtsgericht Hannover HRA 110303 früher Amtsgericht Neustadt a. Rbge. (Neustadt)\nStadtsparkasse Wunstorf – Wunstorf",
      "type": "Registerbekanntmachung nach dem Umwandlungsgesetz",
      "state": "Niedersachsen",
      "amtsgericht": "Amtsgericht Hannover",
      "registernummer": "HRA 110303",
      "registerart": "HRA",
      "company_name": "Stadtsparkasse Wunstorf",
      "company_seat": "Wunstorf",
      "former_amtsgericht": "Neustadt a. Rbge. (Neustadt)",
      "details": "06.01.2025 (Bekanntmachungsdatum)\n\nNiedersachsen Amtsgericht Hannover HRA 110303 früher Amtsgericht Neustadt a. Rbge. (Neustadt)\nRegisterbekanntmachung nach dem Umwandlungsgesetz 06.01.2025 (Eintragungsdatum)\n\nStadtsparkasse Wunstorf\nSonstige juristische Person\nWunstorf\n\nDen Gläubigern der an der Vermögensübertragung beteiligten Rechtsträger ist, wenn sie binnen sechs Monaten nach dem Tag, an dem die Eintragung der Vermögensübertagung in das Register des Sitzes desjenigen Rechtsträgers, dessen Gläubiger sie sind, nach § 19 Abs. 3 UmwG als bekannt gemacht gilt, ihren Anspruch nach Grund und Höhe schriftlich anmelden, Sicherheit zu leisten, soweit sie nicht Befriedigung verlangen können. Dieses Recht steht den Gläubigern jedoch nur zu, wenn sie glaubhaft machen, dass durch die Vermögensübertragung die Erfüllung der Forderung gefährdet wird."
    },
    {
      "date": "2025-01-06",
      "id": "97873",
      "original_text": "Löschungsankündigung\nNiedersachsen Amtsgericht Hildesheim HRB 205443\nMontana Property GmbH – Sarstedt",
      "type": "Löschungsankündigung",
      "state": "Niedersachsen",
      "amtsgericht": "Amtsgericht Hildesheim",
      "registernummer": "HRB 205443",
      "registerart": "HRB",
      "company_name": "Montana Property GmbH",
      "company_seat": "Sarstedt",
      "details": "06.01.2025 (Bekanntmachungsdatum)\n\nNiedersachsen Amtsgericht Hildesheim HRB 205443\nLöschungsankündigung\n\nMontana Property GmbH\nGesellschaft mit beschränkter Haftung\nSarstedt\n\nDas Registergericht beabsichtigt, die Gesellschaft von Amts wegen nach § 394 FamFG zu löschen. Die Frist zur Erhebung eines Widerspruchs ist auf 1 Monat ab dieser Registerbekanntmachung festgesetzt."
    },
    {
      "date": "2025-01-06",
      "id": "97874",
      "original_text": "Einreichung neuer Dokumente\nNiedersachsen Amtsgericht Göttingen HRB 131114 früher Amtsgericht Northeim\nIlmebahn Gesellschaft mit beschränkter Haftung – Einbeck",
      "type": "Einreichung neuer Dokumente",
      "state": "Niedersachsen",
      "amtsgericht": "Amtsgericht Göttingen",
      "registernummer": "HRB 131114",
      "registerart": "HRB",
      "company_name": "Ilmebahn Gesellschaft mit beschränkter Haftung",
      "company_seat": "Einbeck",
      "former_amtsgericht": "Northeim",
      "details": "06.01.2025 (Bekanntmachungsdatum)\n\nNiedersachsen Amtsgericht Göttingen HRB 131114 früher Amtsgericht Northeim\nEinreichung neuer Dokumente 06.01.2025 (Eintragungsdatum)\n\nIlmebahn Gesellschaft mit beschränkter Haftung\nGesellschaft mit beschränkter Haftung\nEinbeck\n\nDie Liste der Mitglieder des Aufsichtsrats wurde beim Registergericht eingereicht."
    },
    {
      "date": "2025-01-06",
      "id": "97875",
      "original_text": "Löschungsankündigung\nNiedersachsen Amtsgericht Lüneburg HRA 110087 früher Amtsgericht Winsen\nTeekessel, Inh. Margot Dempwolf-Freier – Undeloh",
      "type": "Löschungsankündigung",
      "state": "Niedersachsen",
      "amtsgericht": "Amtsgericht Lüneburg",
      "registernummer": "HRA 110087",
      "registerart": "HRA",
      "company_name": "Teekessel, Inh. Margot Dempwolf-Freier",
      "company_seat": "Undeloh",
      "former_amtsgericht": "Winsen",
      "details": "06.01.2025 (Bekanntmachungsdatum)\n\nNiedersachsen Amtsgericht Lüneburg HRA 110087 früher Amtsgericht Winsen\nLöschungsankündigung\n\nTeekessel, Inh. Margot Dempwolf-Freier\nEinzelkaufmann / Einzelkauffrau\nUndeloh\n\nDas Registergericht beabsichtigt, die Firma von Amts wegen nach § 395 FamFG zu löschen. Die Frist zur Erhebung eines Widerspruchs ist auf 1 Monat ab dieser Registerbekanntmachung festgesetzt."
    },
    {
      "date": "2025-01-06",
      "id": "97876",
      "original_text": "Löschungsankündigung\nNiedersachsen Amtsgericht Aurich HRB 202791\nDie Coder GmbH – Leer",
      "type": "Löschungsankündigung",
      "state": "Niedersachsen",
      "amtsgericht": "Amtsgericht Aurich",
      "registernummer": "HRB 202791",
      "registerart": "HRB",
      "company_name": "Die Coder GmbH",
      "company_seat": "Leer",
      "details": "06.01.2025 (Bekanntmachungsdatum)\n\nNiedersachsen Amtsgericht Aurich HRB 202791\nLöschungsankündigung 06.01.2025 (Eintragungsdatum)\n\nDie Coder GmbH\nGesellschaft mit beschränkter Haftung\nLeer\n\nDas Registergericht beabsichtigt, die Gesellschaft von Amts wegen nach § 394 FamFG zu löschen. Die Frist zur Erhebung eines Widerspruchs ist auf 1 Monat ab dieser Registerbekanntmachung festgesetzt."
    },
    {
      "date": "2025-01-06",
      "id": "97877",
      "original_text": "Löschungsankündigung\nNiedersachsen Amtsgericht Hannover HRB 208174\nY.Q.O. GmbH – Hannover",
      "type": "Löschungsankündigung",
      "state": "Niedersachsen",
      "amtsgericht": "Amtsgericht Hannover",
      "registernummer": "HRB 208174",
      "registerart": "HRB",
      "company_name": "Y.Q.O. GmbH",
      "company_seat": "Hannover",
      "details": "06.01.2025 (Bekanntmachungsdatum)\n\nNiedersachsen Amtsgericht Hannover HRB 208174\nLöschungsankündigung\n\nY.Q.O. GmbH\nGesellschaft mit beschränkter Haftung\nHannover\n\nDas Registergericht beabsichtigt, die Gesellschaft von Amts wegen nach § 394 FamFG zu löschen. Die Frist zur Erhebung eines Widerspruchs ist auf 1 Monat ab dieser Registerbekanntmachung festgesetzt."
    },
    {
      "date": "2025-01-06",
      "id": "97878",
      "original_text": "Löschungsankündigung\nNiedersachsen Amtsgericht Tostedt HRA 200014\nWFS Wirtschafts- und Finanzberatung Schröder G.m.b.H. & Co. KG – Rosengarten",
      "type": "Löschungsankündigung",
      "state": "Niedersachsen",
      "amtsgericht": "Amtsgericht Tostedt",
      "registernummer": "HRA 200014",
      "registerart": "HRA",
      "company_name": "WFS Wirtschafts- und Finanzberatung Schröder G.m.b.H. & Co. KG",
      "company_seat": "Rosengarten",
      "details": "06.01.2025 (Bekanntmachungsdatum)\n\nNiedersachsen Amtsgericht Tostedt HRA 200014\nLöschungsankündigung 06.01.2025 (Eintragungsdatum)\n\nWFS Wirtschafts- und Finanzberatung Schröder G.m.b.H. & Co. KG\nKommanditgesellschaft\nRosengarten\n\nDas Registergericht beabsichtigt, die Firma von Amts wegen nach § 394 FamFG zu löschen. Die Frist zur Erhebung eines Widerspruchs ist auf 1 Monat ab dieser Registerbekanntmachung festgesetzt."
    },
    {
      "date": "2025-01-06",
      "id": "97879",
      "original_text": "Registerbekanntmachung nach dem Umwandlungsgesetz\nNiedersachsen Amtsgericht Hannover HRA 26009\nSparkasse Hannover – Hannover",
      "type": "Registerbekanntmachung nach dem Umwandlungsgesetz",
      "state": "Niedersachsen",
      "amtsgericht": "Amtsgericht Hannover",
      "registernummer": "HRA 26009",
      "registerart": "HRA",
      "company_name": "Sparkasse Hannover",
      "company_seat": "Hannover",
      "details": "06.01.2025 (Bekanntmachungsdatum)\n\nNiedersachsen Amtsgericht Hannover HRA 26009\nRegisterbekanntmachung nach dem Umwandlungsgesetz 06.01.2025 (Eintragungsdatum)\n\nSparkasse Hannover\nSonstige juristische Person\nHannover\n\nDen Gläubigern der an der Vermögensübertragung beteiligten Rechtsträger ist, wenn sie binnen sechs Monaten nach dem Tag, an dem die Eintragung der Vermögensübertagung in das Register des Sitzes desjenigen Rechtsträgers, dessen Gläubiger sie sind, nach § 19 Abs. 3 UmwG als bekannt gemacht gilt, ihren Anspruch nach Grund und Höhe schriftlich anmelden, Sicherheit zu leisten, soweit sie nicht Befriedigung verlangen können. Dieses Recht steht den Gläubigern jedoch nur zu, wenn sie glaubhaft machen, dass durch die Vermögensübertragung die Erfüllung der Forderung gefährdet wird."
    },
    {
      "date": "2025-01-06",
      "id": "97880",
      "original_text": "Löschungsankündigung\nNiedersachsen Amtsgericht Hildesheim HRB 22638\nCASE Institut GmbH – Uetze",
      "type": "Löschungsankündigung",
      "state": "Niedersachsen",
      "amtsgericht": "Amtsgericht Hildesheim",
      "registernummer": "HRB 22638",
      "registerart": "HRB",
      "company_name": "CASE Institut GmbH",
      "company_seat": "Uetze",
      "details": "06.01.2025 (Bekanntmachungsdatum)\n\nNiedersachsen Amtsgericht Hildesheim HRB 22638\nLöschungsankündigung\n\nCASE Institut GmbH\nGesellschaft mit beschränkter Haftung\nUetze\n\nDas Registergericht beabsichtigt, die Gesellschaft von Amts wegen nach § 394 FamFG zu löschen. Die Frist zur Erhebung eines Widerspruchs ist auf 1 Monat ab dieser Registerbekanntmachung festgesetzt."
    },
    {
      "date": "2025-01-06",
      "id": "97881",
      "original_text": "Sonstige Registerbekanntmachung\nRheinland-Pfalz Amtsgericht Landau HRB 30653\nCaratec GmbH – Landau in der Pfalz",
      "type": "Sonstige Registerbekanntmachung",
      "state": "Rheinland-Pfalz",
      "amtsgericht": "Amtsgericht Landau",
      "registernummer": "HRB 30653",
      "registerart": "HRB",
      "company_name": "Caratec GmbH",
      "company_seat": "Landau in der Pfalz",
      "details": "06.01.2025 (Bekanntmachungsdatum)\n\nRheinland-Pfalz Amtsgericht Landau HRB 30653\nSonstige Registerbekanntmachung 06.01.2025 (Eintragungsdatum)\n\nCaratec GmbH\nGesellschaft mit beschränkter Haftung\nLandau in der Pfalz\n\nAls nicht eingetragen wird veröffentlicht: Den Gläubigern der Gesellschaft, deren Forderungen begründet worden sind, bevor die Eintragung der Beendigung des Gewinnabführungsvertrages in das Handelsregister nach § 10 des Handelsgesetzbuches als bekanntgemacht gilt, hat der andere Vertragsteil Sicherheit zu leisten, wenn sie sich binnen sechs Monaten nach der Bekanntmachung der Eintragung zu diesem Zweck bei ihm melden."
    },
    {
      "date": "2025-01-06",
      "id": "97882",
      "original_text": "Einreichung neuer Dokumente\nRheinland-Pfalz Amtsgericht Kaiserslautern HRB 3089\nWestpfalz-Klinikum GmbH – Kaiserslautern",
      "type": "Einreichung neuer Dokumente",
      "state": "Rheinland-Pfalz",
      "amtsgericht": "Amtsgericht Kaiserslautern",
      "registernummer": "HRB 3089",
      "registerart": "HRB",
      "company_name": "Westpfalz-Klinikum GmbH",
      "company_seat": "Kaiserslautern",
      "details": "06.01.2025 (Bekanntmachungsdatum)\n\nRheinland-Pfalz Amtsgericht Kaiserslautern HRB 3089\nEinreichung neuer Dokumente\n\nWestpfalz-Klinikum GmbH\nGesellschaft mit beschränkter Haftung\nKaiserslautern\n\nDem Registergericht ist eine neue Liste der Mitglieder des Aufsichtsrates eingereicht worden."
    },
    {
      "date": "2025-01-06",
      "id": "97883",
      "original_text": "Löschungsankündigung\nRheinland-Pfalz Amtsgericht Wittlich HRB 42583\nDer Haushaltsoptimierer GmbH – Schweich",
      "type": "Löschungsankündigung",
      "state": "Rheinland-Pfalz",
      "amtsgericht": "Amtsgericht Wittlich",
      "registernummer": "HRB 42583",
      "registerart": "HRB",
      "company_name": "Der Haushaltsoptimierer GmbH",
      "company_seat": "Schweich",
      "details": "06.01.2025 (Bekanntmachungsdatum)\n\nRheinland-Pfalz Amtsgericht Wittlich HRB 42583\nLöschungsankündigung 06.01.2025 (Eintragungsdatum)\n\nDer Haushaltsoptimierer GmbH\nGesellschaft mit beschränkter Haftung\nSchweich\n\nDas Registergericht beabsichtigt die Gesellschaft von Amts wegen nach § 394 FamFG zu löschen. Die Frist zur Erhebung eines Widerspruchs ist auf einen Monat festgesetzt."
    },
    {
      "date": "2025-01-06",
      "id": "97884",
      "original_text": "Löschungsankündigung\nBremen Amtsgericht Bremen HRB 27411\nLarisa Spielhallen GmbH – Bremen",
      "type": "Löschungsankündigung",
      "state": "Bremen",
      "amtsgericht": "Amtsgericht Bremen",
      "registernummer": "HRB 27411",
      "registerart": "HRB",
      "company_name": "Larisa Spielhallen GmbH",
      "company_seat": "Bremen",
      "details": "06.01.2025 (Bekanntmachungsdatum)\n\nBremen Amtsgericht Bremen HRB 27411\nLöschungsankündigung\n\nLarisa Spielhallen GmbH\nGesellschaft mit beschränkter Haftung\nBremen\n\nEs ist beabsichtigt die im Handelsregister eingetragene Gesellschaft von Amts wegen gemäß § 394 FamFG zu löschen. Gegen die Löschung kann beim AG Bremen schriftlich oder zu Protokoll der Geschäftsstelle Widerspruch eingelegt werden. Widerspruchsfrist 4 Wochen."
    },
    {
      "date": "2025-01-06",
      "id": "97885",
      "original_text": "Löschungsankündigung\nNordrhein-Westfalen Amtsgericht Mönchengladbach HRB 20537\nIRI Plus Verwaltungs GmbH – Mönchengladbach",
      "type": "Löschungsankündigung",
      "state": "Nordrhein-Westfalen",
      "amtsgericht": "Amtsgericht Mönchengladbach",
      "registernummer": "HRB 20537",
      "registerart": "HRB",
      "company_name": "IRI Plus Verwaltungs GmbH",
      "company_seat": "Mönchengladbach",
      "details": "06.01.2025 (Bekanntmachungsdatum)\n\nNordrhein-Westfalen Amtsgericht Mönchengladbach HRB 20537\nLöschungsankündigung\n\nIRI Plus Verwaltungs GmbH\nGesellschaft mit beschränkter Haftung\nMönchengladbach\n\nIRI Plus Verwaltungs GmbH, Mönchengladbach (Amtsgericht Mönchengladbach, HRB 20537).\nDas Registergericht beabsichtigt, die im Handelsregister eingetragene Gesellschaft gemäß § 394 Absatz 1 FamFG wegen Vermögenslosigkeit von Amts wegen zu löschen. Gegen diese Verfügung kann Widerspruch eingelegt werden. Die Frist zur Erhebung eines Widerspruchs gegen die beabsichtigte Löschung von Amts wegen ist auf drei Monate festgesetzt."
    },
    {
      "date": "2025-01-06",
      "id": "97886",
      "original_text": "Registerbekanntmachung nach dem Umwandlungsgesetz\nNordrhein-Westfalen Amtsgericht Düsseldorf HRB 104105\nGE Healthcare GmbH – Düsseldorf",
      "type": "Registerbekanntmachung nach dem Umwandlungsgesetz",
      "state": "Nordrhein-Westfalen",
      "amtsgericht": "Amtsgericht Düsseldorf",
      "registernummer": "HRB 104105",
      "registerart": "HRB",
      "company_name": "GE Healthcare GmbH",
      "company_seat": "Düsseldorf",
      "details": "06.01.2025 (Bekanntmachungsdatum)\n\nNordrhein-Westfalen Amtsgericht Düsseldorf HRB 104105\nRegisterbekanntmachung nach dem Umwandlungsgesetz 06.01.2025 (Eintragungsdatum)\n\nGE Healthcare GmbH\nGesellschaft mit beschränkter Haftung\nDüsseldorf\n\nDen Gläubigern der an der Verschmelzung beteiligten Rechtsträger ist, wenn sie binnen sechs Monaten nach dem Tag, an dem die Eintragung der Verschmelzung in das Register des Sitzes desjenigen Rechtsträgers, dessen Gläubiger sie sind, nach § 19 Absatz 3 UmwG als bekanntgemacht gilt, ihren Anspruch nach Grund und Höhe schriftlich anmelden, Sicherheit zu leisten, soweit sie nicht Befriedigung verlangen können. Dieses Recht steht den Gläubigern jedoch nur zu, wenn sie glaubhaft machen, dass durch die Verschmelzung die Erfüllung ihrer Forderung gefährdet wird."
    },
    {
      "date": "2025-01-06",
      "id": "97887",
      "original_text": "Sonstige Registerbekanntmachung\nNordrhein-Westfalen Amtsgericht Aachen HRB 1861\nBosch Access Systems GmbH – Aachen",
      "type": "Sonstige Registerbekanntmachung",
      "state": "Nordrhein-Westfalen",
      "amtsgericht": "Amtsgericht Aachen",
      "registernummer": "HRB 1861",
      "registerart": "HRB",
      "company_name": "Bosch Access Systems GmbH",
      "company_seat": "Aachen",
      "details": "06.01.2025 (Bekanntmachungsdatum)\n\nNordrhein-Westfalen Amtsgericht Aachen HRB 1861\nSonstige Registerbekanntmachung 06.01.2025 (Eintragungsdatum)\n\nBosch Access Systems GmbH\nGesellschaft mit beschränkter Haftung\nAachen\n\nAls nicht eingetragen wird veröffentlicht: Den Gläubigern der Gesellschaft, deren Forderungen begründet worden sind bevor die Eintragung der Beendigung des Gewinnabführungsvertrages  in das Handelsregister nach § 10 des Handelsgesetzbuches als bekanntgemacht gilt, hat der andere Vertragsteil Sicherheit zu leisten, wenn sie sich binnen sechs Monaten nach der Bekanntmachung der Eintragung zu diesem Zweck bei ihm melden."
    },
    {
      "date": "2025-01-06",
      "id": "97888",
      "original_text": "Registerbekanntmachung nach dem Umwandlungsgesetz\nNordrhein-Westfalen Amtsgericht Düsseldorf HRB 90082\nTrei Real Estate Immobilienholding GmbH – Düsseldorf",
      "type": "Registerbekanntmachung nach dem Umwandlungsgesetz",
      "state": "Nordrhein-Westfalen",
      "amtsgericht": "Amtsgericht Düsseldorf",
      "registernummer": "HRB 90082",
      "registerart": "HRB",
      "company_name": "Trei Real Estate Immobilienholding GmbH",
      "company_seat": "Düsseldorf",
      "details": "06.01.2025 (Bekanntmachungsdatum)\n\nNordrhein-Westfalen Amtsgericht Düsseldorf HRB 90082\nRegisterbekanntmachung nach dem Umwandlungsgesetz 06.01.2025 (Eintragungsdatum)\n\nTrei Real Estate Immobilienholding GmbH\nGesellschaft mit beschränkter Haftung\nDüsseldorf\n\nDen Gläubigern der an der Verschmelzung beteiligten Rechtsträger ist, wenn sie binnen sechs Monaten nach dem Tag, an dem die Eintragung der Verschmelzung in das Register des Sitzes desjenigen Rechtsträgers, dessen Gläubiger sie sind, nach § 19 Absatz 3 UmwG als bekanntgemacht gilt, ihren Anspruch nach Grund und Höhe schriftlich anmelden, Sicherheit zu leisten, soweit sie nicht Befriedigung verlangen können. Dieses Recht steht den Gläubigern jedoch nur zu, wenn sie glaubhaft machen, dass durch die Verschmelzung die Erfüllung ihrer Forderung gefährdet wird."
    },
    {
      "date": "2025-01-06",
      "id": "97889",
      "original_text": "Löschungsankündigung\nNordrhein-Westfalen Amtsgericht Wuppertal HRB 12424\nHG Remscheid Betriebs- und Marketing GmbH – Remscheid",
      "type": "Löschungsankündigung",
      "state": "Nordrhein-Westfalen",
      "amtsgericht": "Amtsgericht Wuppertal",
      "registernummer": "HRB 12424",
      "registerart": "HRB",
      "company_name": "HG Remscheid Betriebs- und Marketing GmbH",
      "company_seat": "Remscheid",
      "details": "06.01.2025 (Bekanntmachungsdatum)\n\nNordrhein-Westfalen Amtsgericht Wuppertal HRB 12424\nLöschungsankündigung\n\nHG Remscheid Betriebs- und Marketing GmbH\nGesellschaft mit beschränkter Haftung\nRemscheid\n\nDas Registergericht beabsichtigt die Gesellschaft von Amts wegen nach § 394 FamFG zu löschen. Die Frist zur Erhebung eines Widerspruchs ist auf einen Monat festgesetzt."
    },
    {
      "date": "2025-01-06",
      "id": "97890",
      "original_text": "Registerbekanntmachung nach dem Umwandlungsgesetz\nNordrhein-Westfalen Amtsgericht Düsseldorf HRB 90303\nTrei Real Estate GmbH – Düsseldorf",
      "type": "Registerbekanntmachung nach dem Umwandlungsgesetz",
      "state": "Nordrhein-Westfalen",
      "amtsgericht": "Amtsgericht Düsseldorf",
      "registernummer": "HRB 90303",
      "registerart": "HRB",
      "company_name": "Trei Real Estate GmbH",
      "company_seat": "Düsseldorf",
      "details": "06.01.2025 (Bekanntmachungsdatum)\n\nNordrhein-Westfalen Amtsgericht Düsseldorf HRB 90303\nRegisterbekanntmachung nach dem Umwandlungsgesetz 06.01.2025 (Eintragungsdatum)\n\nTrei Real Estate GmbH\nGesellschaft mit beschränkter Haftung\nDüsseldorf\n\nDen Gläubigern der an der Verschmelzung beteiligten Rechtsträger ist, wenn sie binnen sechs Monaten nach dem Tag, an dem die Eintragung der Verschmelzung in das Register des Sitzes desjenigen Rechtsträgers, dessen Gläubiger sie sind, nach § 19 Absatz 3 UmwG als bekanntgemacht gilt, ihren Anspruch nach Grund und Höhe schriftlich anmelden, Sicherheit zu leisten, soweit sie nicht Befriedigung verlangen können. Dieses Recht steht den Gläubigern jedoch nur zu, wenn sie glaubhaft machen, dass durch die Verschmelzung die Erfüllung ihrer Forderung gefährdet wird."
    },
    {
      "date": "2025-01-06",
      "id": "97891",
      "original_text": "Löschungsankündigung\nNordrhein-Westfalen Amtsgericht Wuppertal HRB 31091\nEva's Walk GmbH – Solingen",
      "type": "Löschungsankündigung",
      "state": "Nordrhein-Westfalen",
      "amtsgericht": "Amtsgericht Wuppertal",
      "registernummer": "HRB 31091",
      "registerart": "HRB",
      "company_name": "Eva's Walk GmbH",
      "company_seat": "Solingen",
      "details": "06.01.2025 (Bekanntmachungsdatum)\n\nNordrhein-Westfalen Amtsgericht Wuppertal HRB 31091\nLöschungsankündigung 30.12.2024 (Eintragungsdatum)\n\nEva's Walk GmbH\nGesellschaft mit beschränkter Haftung\nSolingen\n\nDas Registergericht beabsichtigt die Gesellschaft von Amts wegen nach § 394 FamFG zu löschen. Die Frist zur Erhebung eines Widerspruchs ist auf einen Monat festgesetzt."
    },
    {
      "date": "2025-01-06",
      "id": "97892",
      "original_text": "Sonstige Registerbekanntmachung\nNordrhein-Westfalen Amtsgericht Steinfurt HRB 11001\nFleetboost GmbH – Greven",
      "type": "Sonstige Registerbekanntmachung",
      "state": "Nordrhein-Westfalen",
      "amtsgericht": "Amtsgericht Steinfurt",
      "registernummer": "HRB 11001",
      "registerart": "HRB",
      "company_name": "Fleetboost GmbH",
      "company_seat": "Greven",
      "details": "06.01.2025 (Bekanntmachungsdatum)\n\nNordrhein-Westfalen Amtsgericht Steinfurt HRB 11001\nSonstige Registerbekanntmachung 06.01.2025 (Eintragungsdatum)\n\nFleetboost GmbH\nGesellschaft mit beschränkter Haftung\nGreven\n\nAls nicht eingetragen wird veröffentlicht: Den Gläubigern der Gesellschaft, deren Forderungen begründet worden sind bevor die Eintragung der Beendigung des Gewinnabführungsvertrages  in das Handelsregister nach § 10 des Handelsgesetzbuches als bekanntgemacht gilt, hat der andere Vertragsteil Sicherheit zu leisten, wenn sie sich binnen sechs Monaten nach der Bekanntmachung der Eintragung zu diesem Zweck bei ihm melden."
    },
    {
      "date": "2025-01-06",
      "id": "97893",
      "original_text": "Löschungsankündigung\nNordrhein-Westfalen Amtsgericht Dortmund HRB 5182\nGöge Gesellschaft mit beschränkter Haftung – Dortmund",
      "type": "Löschungsankündigung",
      "state": "Nordrhein-Westfalen",
      "amtsgericht": "Amtsgericht Dortmund",
      "registernummer": "HRB 5182",
      "registerart": "HRB",
      "company_name": "Göge Gesellschaft mit beschränkter Haftung",
      "company_seat": "Dortmund",
      "details": "06.01.2025 (Bekanntmachungsdatum)\n\nNordrhein-Westfalen Amtsgericht Dortmund HRB 5182\nLöschungsankündigung 06.01.2025 (Eintragungsdatum)\n\nGöge Gesellschaft mit beschränkter Haftung\nGesellschaft mit beschränkter Haftung\nDortmund\n\nDas Registergericht beabsichtigt die Gesellschaft von Amts wegen nach § 394 FamFG zu löschen. Die Frist zur Erhebung eines Widerspruchs ist auf zwei Monate festgesetzt."
    },
    {
      "date": "2025-01-06",
      "id": "97894",
      "original_text": "Löschungsankündigung\nNordrhein-Westfalen Amtsgericht Köln HRB 90082\nC.U.T. Logistik GmbH – Brühl",
      "type": "Löschungsankündigung",
      "state": "Nordrhein-Westfalen",
      "amtsgericht": "Amtsgericht Köln",
      "registernummer": "HRB 90082",
      "registerart": "HRB",
      "company_name": "C.U.T. Logistik GmbH",
      "company_seat": "Brühl",
      "details": "06.01.2025 (Bekanntmachungsdatum)\n\nNordrhein-Westfalen Amtsgericht Köln HRB 90082\nLöschungsankündigung\n\nC.U.T. Logistik GmbH\nGesellschaft mit beschränkter Haftung\nBrühl\n\nDas Registergericht beabsichtigt die Gesellschaft von Amts wegen nach § 394 FamFG zu löschen. Die Frist zur Erhebung eines Widerspruchs ist auf einen Monat festgesetzt."
    },
    {
      "date": "2025-01-06",
      "id": "97895",
      "original_text": "Löschungsankündigung\nNordrhein-Westfalen Amtsgericht Köln HRB 83282\nDivine Cosmetics GmbH – Köln",
      "type": "Löschungsankündigung",
      "state": "Nordrhein-Westfalen",
      "amtsgericht": "Amtsgericht Köln",
      "registernummer": "HRB 83282",
      "registerart": "HRB",
      "company_name": "Divine Cosmetics GmbH",
      "company_seat": "Köln",
      "details": "06.01.2025 (Bekanntmachungsdatum)\n\nNordrhein-Westfalen Amtsgericht Köln HRB 83282\nLöschungsankündigung\n\nDivine Cosmetics GmbH\nGesellschaft mit beschränkter Haftung\nKöln\n\nDas Registergericht beabsichtigt die Gesellschaft von Amts wegen nach § 394 FamFG zu löschen. Die Frist zur Erhebung eines Widerspruchs ist auf einen Monat festgesetzt."
    },
    {
      "date": "2025-01-06",
      "id": "97896",
      "original_text": "Sonstige Registerbekanntmachung\nNordrhein-Westfalen Amtsgericht Bad Oeynhausen HRB 19557\nBonitas Bielefeld GmbH – Herford",
      "type": "Sonstige Registerbekanntmachung",
      "state": "Nordrhein-Westfalen",
      "amtsgericht": "Amtsgericht Bad Oeynhausen",
      "registernummer": "HRB 19557",
      "registerart": "HRB",
      "company_name": "Bonitas Bielefeld GmbH",
      "company_seat": "Herford",
      "details": "06.01.2025 (Bekanntmachungsdatum)\n\nNordrhein-Westfalen Amtsgericht Bad Oeynhausen HRB 19557\nSonstige Registerbekanntmachung 06.01.2025 (Eintragungsdatum)\n\nBonitas Bielefeld GmbH\nGesellschaft mit beschränkter Haftung\nHerford\n\nAls nicht eingetragen wird veröffentlicht: Den Gläubigern der Gesellschaft, deren Forderungen begründet worden sind bevor die Eintragung der Beendigung des Gewinnabführungsvertrages  in das Handelsregister nach § 10 des Handelsgesetzbuches als bekanntgemacht gilt, hat der andere Vertragsteil Sicherheit zu leisten, wenn sie sich binnen sechs Monaten nach der Bekanntmachung der Eintragung zu diesem Zweck bei ihm melden."
    },
    {
      "date": "2025-01-06",
      "id": "97897",
      "original_text": "Sonstige Registerbekanntmachung\nNordrhein-Westfalen Amtsgericht Düsseldorf HRB 60360\nProTect Versicherung Aktiengesellschaft – Düsseldorf",
      "type": "Sonstige Registerbekanntmachung",
      "state": "Nordrhein-Westfalen",
      "amtsgericht": "Amtsgericht Düsseldorf",
      "registernummer": "HRB 60360",
      "registerart": "HRB",
      "company_name": "ProTect Versicherung Aktiengesellschaft",
      "company_seat": "Düsseldorf",
      "details": "06.01.2025 (Bekanntmachungsdatum)\n\nNordrhein-Westfalen Amtsgericht Düsseldorf HRB 60360\nSonstige Registerbekanntmachung 06.01.2025 (Eintragungsdatum)\n\nProTect Versicherung Aktiengesellschaft\nAktiengesellschaft\nDüsseldorf\n\nAls nicht eingetragen wird veröffentlicht: Den Gläubigern der Gesellschaft, deren Forderungen begründet worden sind bevor die Eintragung der Beendigung des Beherrschungs- und Gewinnabführungsvertrages  in das Handelsregister nach § 10 des Handelsgesetzbuches als bekanntgemacht gilt, hat der andere Vertragsteil Sicherheit zu leisten, wenn sie sich binnen sechs Monaten nach der Bekanntmachung der Eintragung zu diesem Zweck bei ihm melden."
    },
    {
      "date": "2025-01-06",
      "id": "97898",
      "original_text": "Löschungsankündigung\nNordrhein-Westfalen Amtsgericht Kleve HRB 18186\nSL Selected Labels GmbH – Moers",
      "type": "Löschungsankündigung",
      "state": "Nordrhein-Westfalen",
      "amtsgericht": "Amtsgericht Kleve",
      "registernummer": "HRB 18186",
      "registerart": "HRB",
      "company_name": "SL Selected Labels GmbH",
      "company_seat": "Moers",
      "details": "06.01.2025 (Bekanntmachungsdatum)\n\nNordrhein-Westfalen Amtsgericht Kleve HRB 18186\nLöschungsankündigung\n\nSL Selected Labels GmbH\nGesellschaft mit beschränkter Haftung\nMoers\n\nDas Registergericht beabsichtigt die Gesellschaft von Amts wegen nach § 394 FamFG zu löschen. Die Frist zur Erhebung eines Widerspruchs ist auf einen Monat festgesetzt."
    },
    {
      "date": "2025-01-06",
      "id": "97899",
      "original_text": "Sonstige Registerbekanntmachung\nNordrhein-Westfalen Amtsgericht Dortmund HRB 33594\nArcelorMittal Dortmund GmbH – Dortmund",
      "type": "Sonstige Registerbekanntmachung",
      "state": "Nordrhein-Westfalen",
      "amtsgericht": "Amtsgericht Dortmund",
      "registernummer": "HRB 33594",
      "registerart": "HRB",
      "company_name": "ArcelorMittal Dortmund GmbH",
      "company_seat": "Dortmund",
      "details": "06.01.2025 (Bekanntmachungsdatum)\n\nNordrhein-Westfalen Amtsgericht Dortmund HRB 33594\nSonstige Registerbekanntmachung 06.01.2025 (Eintragungsdatum)\n\nArcelorMittal Dortmund GmbH\nGesellschaft mit beschränkter Haftung\nDortmund\n\nAls nicht eingetragen wird veröffentlicht: Den Gläubigern der Gesellschaft, deren Forderungen begründet worden sind bevor die Eintragung der Beendigung des Gewinnabführungsvertrages  in das Handelsregister nach § 10 des Handelsgesetzbuches als bekanntgemacht gilt, hat der andere Vertragsteil Sicherheit zu leisten, wenn sie sich binnen sechs Monaten nach der Bekanntmachung der Eintragung zu diesem Zweck bei ihm melden."
    },
    {
      "date": "2025-01-06",
      "id": "97900",
      "original_text": "Löschungsankündigung\nNordrhein-Westfalen Amtsgericht Neuss HRB 22963\nBVDK Sachverständiger UG (haftungsbeschränkt) – Meerbusch",
      "type": "Löschungsankündigung",
      "state": "Nordrhein-Westfalen",
      "amtsgericht": "Amtsgericht Neuss",
      "registernummer": "HRB 22963",
      "registerart": "HRB",
      "company_name": "BVDK Sachverständiger UG (haftungsbeschränkt)",
      "company_seat": "Meerbusch",
      "details": "06.01.2025 (Bekanntmachungsdatum)\n\nNordrhein-Westfalen Amtsgericht Neuss HRB 22963\nLöschungsankündigung 06.01.2025 (Eintragungsdatum)\n\nBVDK Sachverständiger UG (haftungsbeschränkt)\nGesellschaft mit beschränkter Haftung\nMeerbusch\n\nDas Registergericht beabsichtigt von Amts wegen die Gesellschaft wegen Vermögenslosigkeit aufgrund des § 394 Abs. 1 FamFG zu löschen. Frist zur Geltendmachung eines Widerspruchs: 1 Monat.\nRechtsbehelfsbelehrung:\nGegen diese Verfügung können Sie Widerspruch einlegen.\nDer Widerspruch ist bei dem Amtsgericht Neuss - Registergericht -, Breite Str. 48, 41460 Neuss schriftlich in deutscher Sprache oder zur Niederschrift der Geschäftsstelle einzulegen.\nDer Widerspruch kann auch zur Niederschrift der Geschäftsstelle eines jeden Amtsgerichtes abgegeben werden.\nDie Einlegung ist auch durch Übertragung eines elektronischen Dokuments an die elektronische Poststelle des Gerichts möglich. Das elektronische Dokument muss für die Bearbeitung durch das Gericht geeignet und mit einer qualifizierten elektronischen Signatur der verantwortenden Person versehen sein oder von der verantwortenden Person signiert und auf einem sicheren Übermittlungsweg gemäß § 130a ZPO nach näherer Maßgabe der Verordnung über die technischen Rahmenbedingungen des elektronischen Rechtsverkehrs und über das besondere elektronische Behördenpostfach (BGBl. I, S.3803) eingereicht werden. Weitere Informationen erhalten Sie auf der Internetseite www.justiz.de.\nDer Widerspruch muss spätestens innerhalb der gesetzten Frist nach der schriftlichen Bekanntgabe der Verfügung bei dem Amtsgericht - Registergericht - Neuss eingegangen sein. Dies gilt auch dann, wenn der Widerspruch zur Niederschrift der Geschäftsstelle eines anderen Amtsgerichtes abgegeben wurde. Die Frist beginnt mit der schriftlichen Bekanntgabe der Verfügung. Die Bekanntgabe ist entweder durch Zustellung oder am dritten Tage nach Aufgabe zur Post bewirkt. Fällt das Ende der Frist auf einen Sonntag, einen allgemeinen Feiertag oder Sonnabend, so endet die Frist mit Ablauf des nächsten Werktages.\nDer Widerspruch muss die Bezeichnung der angefochtenen Verfügung sowie die Erklärung enthalten, dass Widerspruch gegen diese Verfügung eingelegt wird. Er ist zu unterzeichnen und soll begründet werden."
    },
    {
      "date": "2025-01-06",
      "id": "97901",
      "original_text": "Löschungsankündigung\nNordrhein-Westfalen Amtsgericht Münster HRB 20120\nMercato Roma UG (haftungsbeschränkt) – Sendenhorst",
      "type": "Löschungsankündigung",
      "state": "Nordrhein-Westfalen",
      "amtsgericht": "Amtsgericht Münster",
      "registernummer": "HRB 20120",
      "registerart": "HRB",
      "company_name": "Mercato Roma UG (haftungsbeschränkt)",
      "company_seat": "Sendenhorst",
      "details": "06.01.2025 (Bekanntmachungsdatum)\n\nNordrhein-Westfalen Amtsgericht Münster HRB 20120\nLöschungsankündigung\n\nMercato Roma UG (haftungsbeschränkt)\nGesellschaft mit beschränkter Haftung\nSendenhorst\n\nDas Registergericht beabsichtigt die Gesellschaft von Amts wegen nach § 394 FamFG zu löschen. Die Frist zur Erhebung eines Widerspruchs ist auf drei Wochen festgesetzt."
    },
    {
      "date": "2025-01-06",
      "id": "97902",
      "original_text": "Sonstige Registerbekanntmachung\nNordrhein-Westfalen Amtsgericht Köln HRB 108263\ninnotec Facilitymanagement GmbH – Köln",
      "type": "Sonstige Registerbekanntmachung",
      "state": "Nordrhein-Westfalen",
      "amtsgericht": "Amtsgericht Köln",
      "registernummer": "HRB 108263",
      "registerart": "HRB",
      "company_name": "innotec Facilitymanagement GmbH",
      "company_seat": "Köln",
      "details": "06.01.2025 (Bekanntmachungsdatum)\n\nNordrhein-Westfalen Amtsgericht Köln HRB 108263\nSonstige Registerbekanntmachung 06.01.2025 (Eintragungsdatum)\n\ninnotec Facilitymanagement GmbH\nGesellschaft mit beschränkter Haftung\nKöln\n\nAls nicht eingetragen wird veröffentlicht: Den Gläubigern der Gesellschaft, deren Forderungen begründet worden sind bevor die Eintragung der Beendigung des Gewinnabführungsvertrages  in das Handelsregister nach § 10 des Handelsgesetzbuches als bekanntgemacht gilt, hat der andere Vertragsteil Sicherheit zu leisten, wenn sie sich binnen sechs Monaten nach der Bekanntmachung der Eintragung zu diesem Zweck bei ihm melden."
    },
    {
      "date": "2025-01-06",
      "id": "97903",
      "original_text": "Registerbekanntmachung nach dem Umwandlungsgesetz\nHessen Amtsgericht Wiesbaden HRB 32539\nweck holding gmbh – Idstein",
      "type": "Registerbekanntmachung nach dem Umwandlungsgesetz",
      "state": "Hessen",
      "amtsgericht": "Amtsgericht Wiesbaden",
      "registernummer": "HRB 32539",
      "registerart": "HRB",
      "company_name": "weck holding gmbh",
      "company_seat": "Idstein",
      "details": "06.01.2025 (Bekanntmachungsdatum)\n\nHessen Amtsgericht Wiesbaden HRB 32539\nRegisterbekanntmachung nach dem Umwandlungsgesetz 06.01.2025 (Eintragungsdatum)\n\nweck holding gmbh\nGesellschaft mit beschränkter Haftung\nIdstein\n\nDen Gläubigern der an der Verschmelzung beteiligten Rechtsträger ist, wenn sie binnen sechs Monaten nach dem Tag, an dem die Eintragung der Verschmelzung in das Register des Sitzes desjenigen Rechtsträgers, dessen Gläubiger sie sind, nach § 19 Absatz 3 UmwG bekannt gemacht worden ist, ihren Anspruch nach Grund und Höhe schriftlich anmelden, Sicherheit zu leisten, soweit sie nicht Befriedigung verlangen können. Dieses Recht steht den Gläubigern jedoch nur zu, wenn sie glaubhaft machen, dass durch die Verschmelzung die Erfüllung ihrer Forderung gefährdet wird."
    },
    {
      "date": "2025-01-06",
      "id": "97904",
      "original_text": "Sonstige Registerbekanntmachung\nHessen Amtsgericht Hanau HRB 91399\nNeue WindSolar Griechenland GmbH – Brachttal",
      "type": "Sonstige Registerbekanntmachung",
      "state": "Hessen",
      "amtsgericht": "Amtsgericht Hanau",
      "registernummer": "HRB 91399",
      "registerart": "HRB",
      "company_name": "Neue WindSolar Griechenland GmbH",
      "company_seat": "Brachttal",
      "details": "06.01.2025 (Bekanntmachungsdatum)\n\nHessen Amtsgericht Hanau HRB 91399\nSonstige Registerbekanntmachung 06.01.2025 (Eintragungsdatum)\n\nNeue WindSolar Griechenland GmbH\nGesellschaft mit beschränkter Haftung\nBrachttal\n\nDen Gläubigern der Gesellschaft, deren Forderungen begründet worden sind, bevor die Eintragung der Beendigung des Vertrags in das Handelsregister nach § 10 HGB bekannt gemacht worden ist, ist vom anderen Vertragsteil Sicherheit zu leisten, wenn sie sich binnen sechs Monaten nach dieser Bekanntmachung zu diesem Zweck bei ihm melden."
    },
    {
      "date": "2025-01-06",
      "id": "97905",
      "original_text": "Löschungsankündigung\nHessen Amtsgericht Kassel HRA 17272\nEintracht Baunatal Handball-Bundesliga Spielbetriebs GmbH & Co. KG – Baunatal",
      "type": "Löschungsankündigung",
      "state": "Hessen",
      "amtsgericht": "Amtsgericht Kassel",
      "registernummer": "HRA 17272",
      "registerart": "HRA",
      "company_name": "Eintracht Baunatal Handball-Bundesliga Spielbetriebs GmbH & Co. KG",
      "company_seat": "Baunatal",
      "details": "06.01.2025 (Bekanntmachungsdatum)\n\nHessen Amtsgericht Kassel HRA 17272\nLöschungsankündigung\n\nEintracht Baunatal Handball-Bundesliga Spielbetriebs GmbH & Co. KG\nKommanditgesellschaft\nBaunatal\n\nDas Registergericht beabsichtigt die im Handelsregister eingetragene Firma von Amts wegen nach § 394 FamFG zu löschen. Die Frist zur Erhebung eines Widerspruchs gegen die beabsichtigte Löschung wird auf 8 Wochen festgesetzt."
    },
    {
      "date": "2025-01-06",
      "id": "97906",
      "original_text": "Sonstige Registerbekanntmachung\nHessen Amtsgericht Wiesbaden VR 5760\nGesangverein Sängerlust 1883 e.V. – Eltville am Rhein-Martinsthal",
      "type": "Sonstige Registerbekanntmachung",
      "state": "Hessen",
      "amtsgericht": "Amtsgericht Wiesbaden",
      "registernummer": "VR 5760",
      "registerart": "VR",
      "company_name": "Gesangverein Sängerlust 1883 e.V.",
      "company_seat": "Eltville am Rhein-Martinsthal",
      "details": "06.01.2025 (Bekanntmachungsdatum)\n\nHessen Amtsgericht Wiesbaden VR 5760\nSonstige Registerbekanntmachung 06.01.2025 (Eintragungsdatum)\n\nGesangverein Sängerlust 1883 e.V.\neingetragener Verein\nEltville am Rhein-Martinsthal\n\nDer Verein ist aufgelöst."
    },
    {
      "date": "2025-01-06",
      "id": "97907",
      "original_text": "Sonstige Registerbekanntmachung\nHessen Amtsgericht Frankfurt am Main VR 14641\nUnified Worship – Frankfurt am Main",
      "type": "Sonstige Registerbekanntmachung",
      "state": "Hessen",
      "amtsgericht": "Amtsgericht Frankfurt am Main",
      "registernummer": "VR 14641",
      "registerart": "VR",
      "company_name": "Unified Worship",
      "company_seat": "Frankfurt am Main",
      "details": "06.01.2025 (Bekanntmachungsdatum)\n\nHessen Amtsgericht Frankfurt am Main VR 14641\nSonstige Registerbekanntmachung 06.01.2025 (Eintragungsdatum)\n\nUnified Worship\neingetragener Verein\nFrankfurt am Main\n\nDer Verein ist aufgelöst."
    }
  ]
}