{
  "date": "2025-01-28",
  "date_of_scrape": "2025-02-11T09:28:14.624Z",
  "tool_version": "0.2.0",
  "number_of_announcements": 109,
  "announcements": [
    {
      "date": "2025-01-28",
      "id": "99744",
      "original_text": "Registerbekanntmachung nach dem Umwandlungsgesetz\nBayern Amtsgericht München HRB 299416\nCollaboration Factory GmbH – München",
      "type": "Registerbekanntmachung nach dem Umwandlungsgesetz",
      "state": "Bayern",
      "amtsgericht": "Amtsgericht München",
      "registernummer": "HRB 299416",
      "registerart": "HRB",
      "company_name": "Collaboration Factory GmbH",
      "company_seat": "München",
      "details": "28.01.2025 (Bekanntmachungsdatum)\n\nBayern Amtsgericht München HRB 299416\nRegisterbekanntmachung nach dem Umwandlungsgesetz 27.01.2025 (Eintragungsdatum)\n\nCollaboration Factory GmbH\nGesellschaft mit beschränkter Haftung\nMünchen\n\nDen Gläubigern des formwechselnden Rechtsträgers ist, wenn sie binnen sechs Monaten nach dem Tag, an dem die Eintragung des Formwechsels nach § 201 UmwG als bekannt gemacht gilt, ihren Anspruch nach Grund und Höhe in Textform anmelden, Sicherheit zu leisten, soweit sie nicht Befriedigung verlangen können. Dieses Recht steht den Gläubigern jedoch nur zu, wenn sie glaubhaft machen, dass durch den Formwechsel die Erfüllung ihrer Forderung gefährdet wird."
    },
    {
      "date": "2025-01-28",
      "id": "99745",
      "original_text": "Registerbekanntmachung nach dem Umwandlungsgesetz\nBayern Amtsgericht München HRB 91038\nSchütz Baugesellschaft mbH – München",
      "type": "Registerbekanntmachung nach dem Umwandlungsgesetz",
      "state": "Bayern",
      "amtsgericht": "Amtsgericht München",
      "registernummer": "HRB 91038",
      "registerart": "HRB",
      "company_name": "Schütz Baugesellschaft mbH",
      "company_seat": "München",
      "details": "28.01.2025 (Bekanntmachungsdatum)\n\nBayern Amtsgericht München HRB 91038\nRegisterbekanntmachung nach dem Umwandlungsgesetz 27.01.2025 (Eintragungsdatum)\n\nSchütz Baugesellschaft mbH\nGesellschaft mit beschränkter Haftung\nMünchen\n\nDen Gläubigern der an der Verschmelzung beteiligten Rechtsträger ist, wenn sie binnen sechs Monaten nach dem Tag, an dem die Eintragung der Verschmelzung in das Register des Sitzes desjenigen Rechtsträgers, dessen Gläubiger sie sind, nach § 19 Abs. 3 UmwG als bekannt gemacht gilt, ihren Anspruch nach Grund und Höhe in Textform anmelden, Sicherheit zu leisten, soweit sie nicht Befriedigung verlangen können. Dieses Recht steht den Gläubigern jedoch nur zu, wenn sie glaubhaft machen, dass durch die Verschmelzung die Erfüllung ihrer Forderung gefährdet wird."
    },
    {
      "date": "2025-01-28",
      "id": "99746",
      "original_text": "Löschungsankündigung\nBayern Amtsgericht Bayreuth HRA 973\nMälzerei Ochsenfurt GmbH & Co. KG – Kulmbach",
      "type": "Löschungsankündigung",
      "state": "Bayern",
      "amtsgericht": "Amtsgericht Bayreuth",
      "registernummer": "HRA 973",
      "registerart": "HRA",
      "company_name": "Mälzerei Ochsenfurt GmbH & Co. KG",
      "company_seat": "Kulmbach",
      "details": "28.01.2025 (Bekanntmachungsdatum)\n\nBayern Amtsgericht Bayreuth HRA 973\nLöschungsankündigung\n\nMälzerei Ochsenfurt GmbH & Co. KG\nKommanditgesellschaft\nKulmbach\n\nDas Registergericht beabsichtigt, die im Handelsregister eingetragene Firma wegen Vermögenslosigkeit von Amts wegen nach § 394 FamFG zu löschen. Die Frist zur Erhebung eines Widerspruchs ist auf sechs Wochen festgesetzt."
    },
    {
      "date": "2025-01-28",
      "id": "99747",
      "original_text": "Löschungsankündigung\nBayern Amtsgericht Nürnberg HRB 34796\nAutomobile Mahler UG (haftungsbeschränkt) – Allersberg",
      "type": "Löschungsankündigung",
      "state": "Bayern",
      "amtsgericht": "Amtsgericht Nürnberg",
      "registernummer": "HRB 34796",
      "registerart": "HRB",
      "company_name": "Automobile Mahler UG (haftungsbeschränkt)",
      "company_seat": "Allersberg",
      "details": "28.01.2025 (Bekanntmachungsdatum)\n\nBayern Amtsgericht Nürnberg HRB 34796\nLöschungsankündigung\n\nAutomobile Mahler UG (haftungsbeschränkt)\nGesellschaft mit beschränkter Haftung\nAllersberg\n\nDas Registergericht beabsichtigt, die im Handelsregister eingetragene Firma von Amts wegen nach § 31 Abs. 2 HGB, § 393 FamFG zu löschen. Die Frist zur Erhebung eines Widerspruchs ist auf einen Monat festgesetzt."
    },
    {
      "date": "2025-01-28",
      "id": "99748",
      "original_text": "Registerbekanntmachung nach dem Umwandlungsgesetz\nBayern Amtsgericht Memmingen HRB 17987\nNeu-Ulmer Granit- und Küchenvertriebs GmbH – Neu-Ulm",
      "type": "Registerbekanntmachung nach dem Umwandlungsgesetz",
      "state": "Bayern",
      "amtsgericht": "Amtsgericht Memmingen",
      "registernummer": "HRB 17987",
      "registerart": "HRB",
      "company_name": "Neu-Ulmer Granit- und Küchenvertriebs GmbH",
      "company_seat": "Neu-Ulm",
      "details": "28.01.2025 (Bekanntmachungsdatum)\n\nBayern Amtsgericht Memmingen HRB 17987\nRegisterbekanntmachung nach dem Umwandlungsgesetz 27.01.2025 (Eintragungsdatum)\n\nNeu-Ulmer Granit- und Küchenvertriebs GmbH\nGesellschaft mit beschränkter Haftung\nNeu-Ulm\n\nDen Gläubigern des formwechselnden Rechtsträgers ist, wenn sie binnen sechs Monaten nach dem Tag, an dem die Eintragung des Formwechsels nach § 201 UmwG als bekannt gemacht gilt, ihren Anspruch nach Grund und Höhe in Textform anmelden, Sicherheit zu leisten, soweit sie nicht Befriedigung verlangen können. Dieses Recht steht den Gläubigern jedoch nur zu, wenn sie glaubhaft machen, dass durch den Formwechsel die Erfüllung ihrer Forderung gefährdet wird."
    },
    {
      "date": "2025-01-28",
      "id": "99749",
      "original_text": "Löschungsankündigung\nBayern Amtsgericht Aschaffenburg HRB 13370\nG & O Transporte GmbH – Aschaffenburg",
      "type": "Löschungsankündigung",
      "state": "Bayern",
      "amtsgericht": "Amtsgericht Aschaffenburg",
      "registernummer": "HRB 13370",
      "registerart": "HRB",
      "company_name": "G & O Transporte GmbH",
      "company_seat": "Aschaffenburg",
      "details": "28.01.2025 (Bekanntmachungsdatum)\n\nBayern Amtsgericht Aschaffenburg HRB 13370\nLöschungsankündigung\n\nG & O Transporte GmbH\nGesellschaft mit beschränkter Haftung\nAschaffenburg\n\nDas Registergericht beabsichtigt, die im Handelsregister eingetragene Gesellschaft wegen Vermögenslosigkeit von Amts wegen nach § 394 FamFG zu löschen. Die Frist zur Erhebung eines Widerspruchs ist auf drei Monate festgesetzt."
    },
    {
      "date": "2025-01-28",
      "id": "99750",
      "original_text": "Einreichung neuer Dokumente\nBayern Amtsgericht Ingolstadt HRB 2585\nINIT Consulting AG – Ingolstadt",
      "type": "Einreichung neuer Dokumente",
      "state": "Bayern",
      "amtsgericht": "Amtsgericht Ingolstadt",
      "registernummer": "HRB 2585",
      "registerart": "HRB",
      "company_name": "INIT Consulting AG",
      "company_seat": "Ingolstadt",
      "details": "28.01.2025 (Bekanntmachungsdatum)\n\nBayern Amtsgericht Ingolstadt HRB 2585\nEinreichung neuer Dokumente 27.01.2025 (Eintragungsdatum)\n\nINIT Consulting AG\nAktiengesellschaft\nIngolstadt\n\nDem Registergericht Ingolstadt ist eine Liste der Mitglieder des Aufsichtsrats eingereicht worden, § 106 AktG."
    },
    {
      "date": "2025-01-28",
      "id": "99751",
      "original_text": "Löschungsankündigung\nBayern Amtsgericht Nürnberg HRB 36272\nHimmelsKron GmbH – Nürnberg",
      "type": "Löschungsankündigung",
      "state": "Bayern",
      "amtsgericht": "Amtsgericht Nürnberg",
      "registernummer": "HRB 36272",
      "registerart": "HRB",
      "company_name": "HimmelsKron GmbH",
      "company_seat": "Nürnberg",
      "details": "28.01.2025 (Bekanntmachungsdatum)\n\nBayern Amtsgericht Nürnberg HRB 36272\nLöschungsankündigung\n\nHimmelsKron GmbH\nGesellschaft mit beschränkter Haftung\nNürnberg\n\nDas Registergericht beabsichtigt, die im Handelsregister eingetragene Gesellschaft wegen Vermögenslosigkeit von Amts wegen nach § 394 FamFG zu löschen. Die Frist zur Erhebung eines Widerspruchs ist auf einen Monat festgesetzt."
    },
    {
      "date": "2025-01-28",
      "id": "99752",
      "original_text": "Einreichung neuer Dokumente\nBayern Amtsgericht München HRB 228251\nKraussMaffei Group GmbH – Vaterstetten, OT Parsdorf",
      "type": "Einreichung neuer Dokumente",
      "state": "Bayern",
      "amtsgericht": "Amtsgericht München",
      "registernummer": "HRB 228251",
      "registerart": "HRB",
      "company_name": "KraussMaffei Group GmbH",
      "company_seat": "Vaterstetten, OT Parsdorf",
      "details": "28.01.2025 (Bekanntmachungsdatum)\n\nBayern Amtsgericht München HRB 228251\nEinreichung neuer Dokumente 27.01.2025 (Eintragungsdatum)\n\nKraussMaffei Group GmbH\nGesellschaft mit beschränkter Haftung\nVaterstetten, OT Parsdorf\n\nDem Amtsgericht München -Registergericht- ist eine Liste der Mitglieder des Aufsichtsrats eingereicht worden, § 52 Abs. 3 S. 2 GmbHG."
    },
    {
      "date": "2025-01-28",
      "id": "99753",
      "original_text": "Registerbekanntmachung nach dem Umwandlungsgesetz\nBayern Amtsgericht München HRB 262367\nCollaboration Factory AG – München",
      "type": "Registerbekanntmachung nach dem Umwandlungsgesetz",
      "state": "Bayern",
      "amtsgericht": "Amtsgericht München",
      "registernummer": "HRB 262367",
      "registerart": "HRB",
      "company_name": "Collaboration Factory AG",
      "company_seat": "München",
      "details": "28.01.2025 (Bekanntmachungsdatum)\n\nBayern Amtsgericht München HRB 262367\nRegisterbekanntmachung nach dem Umwandlungsgesetz 27.01.2025 (Eintragungsdatum)\n\nCollaboration Factory AG\nAktiengesellschaft\nMünchen\n\nDen Gläubigern des formwechselnden Rechtsträgers ist, wenn sie binnen sechs Monaten nach dem Tag, an dem die Eintragung des Formwechsels nach § 201 UmwG als bekannt gemacht gilt, ihren Anspruch nach Grund und Höhe in Textform anmelden, Sicherheit zu leisten, soweit sie nicht Befriedigung verlangen können. Dieses Recht steht den Gläubigern jedoch nur zu, wenn sie glaubhaft machen, dass durch den Formwechsel die Erfüllung ihrer Forderung gefährdet wird."
    },
    {
      "date": "2025-01-28",
      "id": "99754",
      "original_text": "Löschungsankündigung\nBayern Amtsgericht Nürnberg HRB 30200\nAmmOS GmbH – Nürnberg",
      "type": "Löschungsankündigung",
      "state": "Bayern",
      "amtsgericht": "Amtsgericht Nürnberg",
      "registernummer": "HRB 30200",
      "registerart": "HRB",
      "company_name": "AmmOS GmbH",
      "company_seat": "Nürnberg",
      "details": "28.01.2025 (Bekanntmachungsdatum)\n\nBayern Amtsgericht Nürnberg HRB 30200\nLöschungsankündigung\n\nAmmOS GmbH\nGesellschaft mit beschränkter Haftung\nNürnberg\n\nDas Registergericht beabsichtigt, die im Handelsregister eingetragene Gesellschaft wegen Vermögenslosigkeit von Amts wegen nach § 394 FamFG zu löschen. Die Frist zur Erhebung eines Widerspruchs ist auf einen Monat festgesetzt."
    },
    {
      "date": "2025-01-28",
      "id": "99755",
      "original_text": "Löschungsankündigung\nBayern Amtsgericht München HRB 222398\nfan & more Fanartikel Holding UG (haftungsbeschränkt) – München",
      "type": "Löschungsankündigung",
      "state": "Bayern",
      "amtsgericht": "Amtsgericht München",
      "registernummer": "HRB 222398",
      "registerart": "HRB",
      "company_name": "fan & more Fanartikel Holding UG (haftungsbeschränkt)",
      "company_seat": "München",
      "details": "28.01.2025 (Bekanntmachungsdatum)\n\nBayern Amtsgericht München HRB 222398\nLöschungsankündigung\n\nfan & more Fanartikel Holding UG (haftungsbeschränkt)\nGesellschaft mit beschränkter Haftung\nMünchen\n\nDas Registergericht beabsichtigt, die im Handelsregister eingetragene Gesellschaft wegen Vermögenslosigkeit von Amts wegen nach § 394 FamFG zu löschen. Die Frist zur Erhebung eines Widerspruchs ist auf drei Monate festgesetzt."
    },
    {
      "date": "2025-01-28",
      "id": "99756",
      "original_text": "Registerbekanntmachung nach dem Umwandlungsgesetz\nBayern Amtsgericht München HRA 120585\nImmobilien Sobe e.K. – München",
      "type": "Registerbekanntmachung nach dem Umwandlungsgesetz",
      "state": "Bayern",
      "amtsgericht": "Amtsgericht München",
      "registernummer": "HRA 120585",
      "registerart": "HRA",
      "company_name": "Immobilien Sobe e.K.",
      "company_seat": "München",
      "details": "28.01.2025 (Bekanntmachungsdatum)\n\nBayern Amtsgericht München HRA 120585\nRegisterbekanntmachung nach dem Umwandlungsgesetz 27.01.2025 (Eintragungsdatum)\n\nImmobilien Sobe e.K.\nEinzelkaufmann / Einzelkauffrau\nMünchen\n\nDen Gläubigern der an der Verschmelzung beteiligten Rechtsträger ist, wenn sie binnen sechs Monaten nach dem Tag, an dem die Eintragung der Verschmelzung in das Register des Sitzes desjenigen Rechtsträgers, dessen Gläubiger sie sind, nach § 19 Abs. 3 UmwG als bekannt gemacht gilt, ihren Anspruch nach Grund und Höhe in Textform anmelden, Sicherheit zu leisten, soweit sie nicht Befriedigung verlangen können. Dieses Recht steht den Gläubigern jedoch nur zu, wenn sie glaubhaft machen, dass durch die Verschmelzung die Erfüllung ihrer Forderung gefährdet wird."
    },
    {
      "date": "2025-01-28",
      "id": "99757",
      "original_text": "Sonstige Registerbekanntmachung\nBayern Amtsgericht Nürnberg HRB 774\nNÜRNBERGER Allgemeine Versicherungs-Aktiengesellschaft – Nürnberg",
      "type": "Sonstige Registerbekanntmachung",
      "state": "Bayern",
      "amtsgericht": "Amtsgericht Nürnberg",
      "registernummer": "HRB 774",
      "registerart": "HRB",
      "company_name": "NÜRNBERGER Allgemeine Versicherungs-Aktiengesellschaft",
      "company_seat": "Nürnberg",
      "details": "28.01.2025 (Bekanntmachungsdatum)\n\nBayern Amtsgericht Nürnberg HRB 774\nSonstige Registerbekanntmachung\n\nNÜRNBERGER Allgemeine Versicherungs-Aktiengesellschaft\nAktiengesellschaft\nNürnberg\n\nDem Amtsgericht Nürnberg -Registergericht- ist eine Liste der Mitglieder des Aufsichtsrats eingereicht worden, § 106 AktG."
    },
    {
      "date": "2025-01-28",
      "id": "99758",
      "original_text": "Löschungsankündigung\nBayern Amtsgericht Ingolstadt HRB 6610\nDavid Auto GmbH – Pfaffenhofen a.d. Ilm",
      "type": "Löschungsankündigung",
      "state": "Bayern",
      "amtsgericht": "Amtsgericht Ingolstadt",
      "registernummer": "HRB 6610",
      "registerart": "HRB",
      "company_name": "David Auto GmbH",
      "company_seat": "Pfaffenhofen a.d. Ilm",
      "details": "28.01.2025 (Bekanntmachungsdatum)\n\nBayern Amtsgericht Ingolstadt HRB 6610\nLöschungsankündigung\n\nDavid Auto GmbH\nGesellschaft mit beschränkter Haftung\nPfaffenhofen a.d. Ilm\n\nDas Registergericht beabsichtigt, die im Handelsregister eingetragene Gesellschaft wegen Vermögenslosigkeit von Amts wegen nach § 394 FamFG zu löschen. #insert(Text=\"zztb_V_Widerspruchsfrist\")"
    },
    {
      "date": "2025-01-28",
      "id": "99759",
      "original_text": "Löschungsankündigung\nBayern Amtsgericht Coburg HRB 2593\nFloßanger Beteiligungsgesellschaft mbH – Coburg",
      "type": "Löschungsankündigung",
      "state": "Bayern",
      "amtsgericht": "Amtsgericht Coburg",
      "registernummer": "HRB 2593",
      "registerart": "HRB",
      "company_name": "Floßanger Beteiligungsgesellschaft mbH",
      "company_seat": "Coburg",
      "details": "28.01.2025 (Bekanntmachungsdatum)\n\nBayern Amtsgericht Coburg HRB 2593\nLöschungsankündigung 24.01.2025 (Eintragungsdatum)\n\nFloßanger Beteiligungsgesellschaft mbH\nGesellschaft mit beschränkter Haftung\nCoburg\n\nDas Registergericht beabsichtigt, die im Handelsregister eingetragene Gesellschaft wegen Vermögenslosigkeit von Amts wegen nach § 394 FamFG zu löschen. Die Frist zur Erhebung eines Widerspruchs ist auf sechs Wochen festgesetzt."
    },
    {
      "date": "2025-01-28",
      "id": "99760",
      "original_text": "Registerbekanntmachung nach dem Umwandlungsgesetz\nBerlin Amtsgericht Berlin (Charlottenburg) HRB 241859\nPR-Coffee-Company GmbH – Berlin",
      "type": "Registerbekanntmachung nach dem Umwandlungsgesetz",
      "state": "Berlin",
      "amtsgericht": "Amtsgericht Berlin (Charlottenburg)",
      "registernummer": "HRB 241859",
      "registerart": "HRB",
      "company_name": "PR-Coffee-Company GmbH",
      "company_seat": "Berlin",
      "details": "28.01.2025 (Bekanntmachungsdatum)\n\nBerlin Amtsgericht Berlin (Charlottenburg) HRB 241859\nRegisterbekanntmachung nach dem Umwandlungsgesetz 27.01.2025 (Eintragungsdatum)\n\nPR-Coffee-Company GmbH\nGesellschaft mit beschränkter Haftung\nBerlin\n\nZu Eintragungsnummer 3 vom 27.01.2025 wird als nicht eingetragen veröffentlicht: Den Gläubigern ist, wenn sie binnen sechs Monaten nach dem Tag, an dem die Eintragung der Umwandlung als bekannt gemacht gilt, ihren Anspruch nach Grund und Höhe schriftlich anmelden, Sicherheit zu leisten, soweit sie nicht Befriedigung verlangen können. Dieses Recht steht den Gläubigern jedoch nur zu, wenn sie glaubhaft machen, dass durch die Umwandlung die Erfüllung ihrer Forderung gefährdet wird. Das Recht, Sicherheitsleistung zu verlangen, steht Gläubigern nicht zu, die im Falle der Insolvenz ein Recht auf vorzugsweise Befriedigung aus einer Deckungsmasse haben, die nach gesetzlicher Vorschrift zu ihrem Schutz errichtet und staatlich überwacht ist."
    },
    {
      "date": "2025-01-28",
      "id": "99761",
      "original_text": "Registerbekanntmachung nach dem Umwandlungsgesetz\nBaden-Württemberg Amtsgericht Stuttgart HRB 798078\nMüller Bindesysteme GmbH – Grafenberg",
      "type": "Registerbekanntmachung nach dem Umwandlungsgesetz",
      "state": "Baden-Württemberg",
      "amtsgericht": "Amtsgericht Stuttgart",
      "registernummer": "HRB 798078",
      "registerart": "HRB",
      "company_name": "Müller Bindesysteme GmbH",
      "company_seat": "Grafenberg",
      "details": "28.01.2025 (Bekanntmachungsdatum)\n\nBaden-Württemberg Amtsgericht Stuttgart HRB 798078\nRegisterbekanntmachung nach dem Umwandlungsgesetz 28.01.2025 (Eintragungsdatum)\n\nMüller Bindesysteme GmbH\nGesellschaft mit beschränkter Haftung\nGrafenberg\n\nAls nicht eingetragen wird bekanntgemacht:\nDen Gläubigern der an der Ausgliederung beteiligten Rechtsträger ist, wenn sie binnen sechs Monaten nach dem Tag, an dem die Eintragung der Ausgliederung in das Register des Sitzes desjenigen Rechtsträgers, dessen Gläubiger sie sind, nach § 19 Abs. 3 UmwG als bekanntgemacht gilt, ihren Anspruch nach Grund und Höhe schriftlich anmelden, Sicherheit zu leisten, soweit sie nicht Befriedigung verlangen können. Dieses Recht steht den Gläubigern jedoch nur zu, wenn sie glaubhaft machen, dass durch die Ausgliederung die Erfüllung ihrer Forderung gefährdet wird."
    },
    {
      "date": "2025-01-28",
      "id": "99762",
      "original_text": "Registerbekanntmachung nach dem Umwandlungsgesetz\nSaarland Amtsgericht Saarbrücken HRB 104758\nGV Lebach GmbH – Eppelborn",
      "type": "Registerbekanntmachung nach dem Umwandlungsgesetz",
      "state": "Saarland",
      "amtsgericht": "Amtsgericht Saarbrücken",
      "registernummer": "HRB 104758",
      "registerart": "HRB",
      "company_name": "GV Lebach GmbH",
      "company_seat": "Eppelborn",
      "details": "28.01.2025 (Bekanntmachungsdatum)\n\nSaarland Amtsgericht Saarbrücken HRB 104758\nRegisterbekanntmachung nach dem Umwandlungsgesetz 28.01.2025 (Eintragungsdatum)\n\nGV Lebach GmbH\nGesellschaft mit beschränkter Haftung\nEppelborn\n\nDie Gesellschaft hat nach Maßgabe des Verschmelzungsvertrages vom 30.12.2024 sowie des Zustimmungsbeschlusses ihrer Gesellschafterversammlung vom 30.12.2024 im Wege der Umwandlung durch Verschmelzung ihr Vermögen als Ganzes auf ihren Alleingesellschafter Armin Lauck, 25.11.1965, Lebach übertragen. Der Rechtsträger ist erloschen.\nAls nicht eingetragen wird bekannt gemacht: Den Gläubigern der an der Verschmelzung beteiligten Gesellschaften ist, wenn sie binnen sechs Monaten nach dem Tag, an dem die Eintragung der Verschmelzung in das Register des Sitzes desjenigen Rechtsträgers, dessen Gläubiger sie sind, nach § 19 Absatz 3 UmwG bekannt gemacht worden ist, ihren Anspruch nach Grund und Höhe schriftlich anmelden, Sicherheit zu leisten, soweit sie nicht Befriedigung verlangen können. Dieses Recht steht den Gläubigern jedoch nur zu, wenn sie glaubhaft machen, dass durch die Verschmelzung die Erfüllung ihrer Forderung gefährdet wird."
    },
    {
      "date": "2025-01-28",
      "id": "99763",
      "original_text": "Registerbekanntmachung nach dem Umwandlungsgesetz\nBaden-Württemberg Amtsgericht Mannheim HRB 727297\nMVZ OSG Augenzentrum Baden-Baden GmbH – Baden-Baden",
      "type": "Registerbekanntmachung nach dem Umwandlungsgesetz",
      "state": "Baden-Württemberg",
      "amtsgericht": "Amtsgericht Mannheim",
      "registernummer": "HRB 727297",
      "registerart": "HRB",
      "company_name": "MVZ OSG Augenzentrum Baden-Baden GmbH",
      "company_seat": "Baden-Baden",
      "details": "28.01.2025 (Bekanntmachungsdatum)\n\nBaden-Württemberg Amtsgericht Mannheim HRB 727297\nRegisterbekanntmachung nach dem Umwandlungsgesetz 28.01.2025 (Eintragungsdatum)\n\nMVZ OSG Augenzentrum Baden-Baden GmbH\nGesellschaft mit beschränkter Haftung\nBaden-Baden\n\nDen Gläubigern der an der Verschmelzung beteiligten Rechtsträger ist, wenn sie binnen sechs Monaten nach dem Tag, an dem die Eintragung der Verschmelzung in das Register des Sitzes desjenigen Rechtsträgers, dessen Gläubiger sie sind, nach § 19 Abs. 3 UmwG als bekanntgemacht gilt, ihren Anspruch nach Grund und Höhe schriftlich anmelden, Sicherheit zu leisten, soweit sie nicht Befriedigung verlangen können. Dieses Recht steht den Gläubigern jedoch nur zu, wenn sie glaubhaft machen, dass durch die Verschmelzung die Erfüllung ihrer Forderung gefährdet wird."
    },
    {
      "date": "2025-01-28",
      "id": "99764",
      "original_text": "Sonstige Registerbekanntmachung\nHamburg Amtsgericht Hamburg HRB 14468\nAssekuranz Nordwest Vermittlungs- G.m.b.H. – Hamburg",
      "type": "Sonstige Registerbekanntmachung",
      "state": "Hamburg",
      "amtsgericht": "Amtsgericht Hamburg",
      "registernummer": "HRB 14468",
      "registerart": "HRB",
      "company_name": "Assekuranz Nordwest Vermittlungs- G.m.b.H.",
      "company_seat": "Hamburg",
      "details": "28.01.2025 (Bekanntmachungsdatum)\n\nHamburg Amtsgericht Hamburg HRB 14468\nSonstige Registerbekanntmachung 28.01.2025 (Eintragungsdatum)\n\nAssekuranz Nordwest Vermittlungs- G.m.b.H.\nGesellschaft mit beschränkter Haftung\nHamburg\n\nAls nicht eingetragen wird bekannt gemacht: Den Gläubigern der Gesellschaft, deren Forderungen begründet worden sind, bevor die Eintragung der Vertragsbeendigung in das Handelsregister nach § 10 HGB als bekannt gemacht gilt, ist vom anderen Vertragsteil Sicherheit zu leisten, wenn sie sich binnen 6 Monaten nach Bekanntmachung der Eintragung zu diesem Zweck bei ihm melden."
    },
    {
      "date": "2025-01-28",
      "id": "99765",
      "original_text": "Sonstige Registerbekanntmachung\nHamburg Amtsgericht Hamburg HRB 112120\nHPM Geschäftsbereich Gebäudedienste GmbH – Hamburg",
      "type": "Sonstige Registerbekanntmachung",
      "state": "Hamburg",
      "amtsgericht": "Amtsgericht Hamburg",
      "registernummer": "HRB 112120",
      "registerart": "HRB",
      "company_name": "HPM Geschäftsbereich Gebäudedienste GmbH",
      "company_seat": "Hamburg",
      "details": "28.01.2025 (Bekanntmachungsdatum)\n\nHamburg Amtsgericht Hamburg HRB 112120\nSonstige Registerbekanntmachung 28.01.2025 (Eintragungsdatum)\n\nHPM Geschäftsbereich Gebäudedienste GmbH\nGesellschaft mit beschränkter Haftung\nHamburg\n\nAls nicht eingetragen wird bekannt gemacht:  Den Gläubigern der Gesellschaft, deren Forderungen begründet worden sind, bevor die Eintragung der Vertragsbeendigung in das Handelsregister nach § 10 HGB als bekannt gemacht gilt, ist vom anderen Vertragsteil Sicherheit zu leisten, wenn sie sich binnen 6 Monaten nach Bekanntmachung der Eintragung zu diesem Zweck bei ihm melden."
    },
    {
      "date": "2025-01-28",
      "id": "99766",
      "original_text": "Löschungsankündigung\nMecklenburg-Vorpommern Amtsgericht Neubrandenburg HRB 21144\nHometown Holiday GmbH – Grabowhöfe",
      "type": "Löschungsankündigung",
      "state": "Mecklenburg-Vorpommern",
      "amtsgericht": "Amtsgericht Neubrandenburg",
      "registernummer": "HRB 21144",
      "registerart": "HRB",
      "company_name": "Hometown Holiday GmbH",
      "company_seat": "Grabowhöfe",
      "details": "28.01.2025 (Bekanntmachungsdatum)\n\nMecklenburg-Vorpommern Amtsgericht Neubrandenburg HRB 21144\nLöschungsankündigung 28.01.2025 (Eintragungsdatum)\n\nHometown Holiday GmbH\nGesellschaft mit beschränkter Haftung\nGrabowhöfe\n\nDas Registergericht beabsichtigt, die im Handelsregister eingetragene Gesellschaft von Amts wegen nach § 394 FamFG zu löschen. Die Frist zur Erhebung eines Widerspruchs gegen die beabsichtigte Löschung wird auf drei Monate festgesetzt."
    },
    {
      "date": "2025-01-28",
      "id": "99767",
      "original_text": "Sonstige Registerbekanntmachung\nHamburg Amtsgericht Hamburg HRB 93106\nHPM Geschäftsbereich Technische Gebäudeausrüstung GmbH – Hamburg",
      "type": "Sonstige Registerbekanntmachung",
      "state": "Hamburg",
      "amtsgericht": "Amtsgericht Hamburg",
      "registernummer": "HRB 93106",
      "registerart": "HRB",
      "company_name": "HPM Geschäftsbereich Technische Gebäudeausrüstung GmbH",
      "company_seat": "Hamburg",
      "details": "28.01.2025 (Bekanntmachungsdatum)\n\nHamburg Amtsgericht Hamburg HRB 93106\nSonstige Registerbekanntmachung 28.01.2025 (Eintragungsdatum)\n\nHPM Geschäftsbereich Technische Gebäudeausrüstung GmbH\nGesellschaft mit beschränkter Haftung\nHamburg\n\nAls nicht eingetragen wird bekannt gemacht:  Den Gläubigern der Gesellschaft, deren Forderungen begründet worden sind, bevor die Eintragung der Vertragsbeendigung in das Handelsregister nach § 10 HGB als bekannt gemacht gilt, ist vom anderen Vertragsteil Sicherheit zu leisten, wenn sie sich binnen 6 Monaten nach Bekanntmachung der Eintragung zu diesem Zweck bei ihm melden."
    },
    {
      "date": "2025-01-28",
      "id": "99768",
      "original_text": "Sonstige Registerbekanntmachung\nHamburg Amtsgericht Hamburg HRB 86162\nHPM Geschäftsbereich Maler Fassade Ausbau GmbH – Hamburg",
      "type": "Sonstige Registerbekanntmachung",
      "state": "Hamburg",
      "amtsgericht": "Amtsgericht Hamburg",
      "registernummer": "HRB 86162",
      "registerart": "HRB",
      "company_name": "HPM Geschäftsbereich Maler Fassade Ausbau GmbH",
      "company_seat": "Hamburg",
      "details": "28.01.2025 (Bekanntmachungsdatum)\n\nHamburg Amtsgericht Hamburg HRB 86162\nSonstige Registerbekanntmachung 28.01.2025 (Eintragungsdatum)\n\nHPM Geschäftsbereich Maler Fassade Ausbau GmbH\nGesellschaft mit beschränkter Haftung\nHamburg\n\nAls nicht eingetragen wird bekannt gemacht:  Den Gläubigern der Gesellschaft, deren Forderungen begründet worden sind, bevor die Eintragung der Vertragsbeendigung in das Handelsregister nach § 10 HGB als bekannt gemacht gilt, ist vom anderen Vertragsteil Sicherheit zu leisten, wenn sie sich binnen 6 Monaten nach Bekanntmachung der Eintragung zu diesem Zweck bei ihm melden."
    },
    {
      "date": "2025-01-28",
      "id": "99769",
      "original_text": "Sonstige Registerbekanntmachung\nHamburg Amtsgericht Hamburg HRB 89410\nHPM Beteiligungen GmbH – Hamburg",
      "type": "Sonstige Registerbekanntmachung",
      "state": "Hamburg",
      "amtsgericht": "Amtsgericht Hamburg",
      "registernummer": "HRB 89410",
      "registerart": "HRB",
      "company_name": "HPM Beteiligungen GmbH",
      "company_seat": "Hamburg",
      "details": "28.01.2025 (Bekanntmachungsdatum)\n\nHamburg Amtsgericht Hamburg HRB 89410\nSonstige Registerbekanntmachung 28.01.2025 (Eintragungsdatum)\n\nHPM Beteiligungen GmbH\nGesellschaft mit beschränkter Haftung\nHamburg\n\nAls nicht eingetragen wird bekannt gemacht:  Den Gläubigern der Gesellschaft, deren Forderungen begründet worden sind, bevor die Eintragung der Vertragsbeendigung in das Handelsregister nach § 10 HGB als bekannt gemacht gilt, ist vom anderen Vertragsteil Sicherheit zu leisten, wenn sie sich binnen 6 Monaten nach Bekanntmachung der Eintragung zu diesem Zweck bei ihm melden."
    },
    {
      "date": "2025-01-28",
      "id": "99770",
      "original_text": "Einreichung neuer Dokumente\nHamburg Amtsgericht Hamburg HRB 104241\nPFLEGEN & WOHNEN HAMBURG GmbH – Hamburg",
      "type": "Einreichung neuer Dokumente",
      "state": "Hamburg",
      "amtsgericht": "Amtsgericht Hamburg",
      "registernummer": "HRB 104241",
      "registerart": "HRB",
      "company_name": "PFLEGEN & WOHNEN HAMBURG GmbH",
      "company_seat": "Hamburg",
      "details": "28.01.2025 (Bekanntmachungsdatum)\n\nHamburg Amtsgericht Hamburg HRB 104241\nEinreichung neuer Dokumente 28.01.2025 (Eintragungsdatum)\n\nPFLEGEN & WOHNEN HAMBURG GmbH\nGesellschaft mit beschränkter Haftung\nHamburg\n\nAls nicht eingetragen wird bekannt gemacht: Liste des Aufsichtsrats wurde eingereicht."
    },
    {
      "date": "2025-01-28",
      "id": "99771",
      "original_text": "Sonstige Registerbekanntmachung\nHamburg Amtsgericht Hamburg HRB 38845\nL.E.G. Lagerhaus ELBBRÜCKEN GmbH – Hamburg",
      "type": "Sonstige Registerbekanntmachung",
      "state": "Hamburg",
      "amtsgericht": "Amtsgericht Hamburg",
      "registernummer": "HRB 38845",
      "registerart": "HRB",
      "company_name": "L.E.G. Lagerhaus ELBBRÜCKEN GmbH",
      "company_seat": "Hamburg",
      "details": "28.01.2025 (Bekanntmachungsdatum)\n\nHamburg Amtsgericht Hamburg HRB 38845\nSonstige Registerbekanntmachung 28.01.2025 (Eintragungsdatum)\n\nL.E.G. Lagerhaus ELBBRÜCKEN GmbH\nGesellschaft mit beschränkter Haftung\nHamburg\n\nAls nicht eingetragen wird bekannt gemacht:  Den Gläubigern der Gesellschaft, deren Forderungen begründet worden sind, bevor die Eintragung der Vertragsbeendigung in das Handelsregister nach § 10 HGB als bekannt gemacht gilt, ist vom anderen Vertragsteil Sicherheit zu leisten, wenn sie sich binnen 6 Monaten nach Bekanntmachung der Eintragung zu diesem Zweck bei ihm melden."
    },
    {
      "date": "2025-01-28",
      "id": "99772",
      "original_text": "Registerbekanntmachung nach dem Umwandlungsgesetz\nBaden-Württemberg Amtsgericht Mannheim HRB 747822\nVEG Industrieservice GmbH – Malsch",
      "type": "Registerbekanntmachung nach dem Umwandlungsgesetz",
      "state": "Baden-Württemberg",
      "amtsgericht": "Amtsgericht Mannheim",
      "registernummer": "HRB 747822",
      "registerart": "HRB",
      "company_name": "VEG Industrieservice GmbH",
      "company_seat": "Malsch",
      "details": "28.01.2025 (Bekanntmachungsdatum)\n\nBaden-Württemberg Amtsgericht Mannheim HRB 747822\nRegisterbekanntmachung nach dem Umwandlungsgesetz 28.01.2025 (Eintragungsdatum)\n\nVEG Industrieservice GmbH\nGesellschaft mit beschränkter Haftung\nMalsch\n\nAls nicht eingetragen wird bekanntgemacht:\nDen Gläubigern der an der Verschmelzung beteiligten Rechtsträger ist, wenn sie binnen sechs Monaten nach dem Tag, an dem die Eintragung der Verschmelzung in das Register des Sitzes desjenigen Rechtsträgers, dessen Gläubiger sie sind, nach § 19 Abs. 3 UmwG als bekanntgemacht gilt, ihren Anspruch nach Grund und Höhe schriftlich anmelden, Sicherheit zu leisten, soweit sie nicht Befriedigung verlangen können. Dieses Recht steht den Gläubigern jedoch nur zu, wenn sie glaubhaft machen, dass durch die Verschmelzung die Erfüllung ihrer Forderung gefährdet wird."
    },
    {
      "date": "2025-01-28",
      "id": "99773",
      "original_text": "Registerbekanntmachung nach dem Umwandlungsgesetz\nBaden-Württemberg Amtsgericht Mannheim HRB 735188\nVEG EnergyHub GmbH – Malsch",
      "type": "Registerbekanntmachung nach dem Umwandlungsgesetz",
      "state": "Baden-Württemberg",
      "amtsgericht": "Amtsgericht Mannheim",
      "registernummer": "HRB 735188",
      "registerart": "HRB",
      "company_name": "VEG EnergyHub GmbH",
      "company_seat": "Malsch",
      "details": "28.01.2025 (Bekanntmachungsdatum)\n\nBaden-Württemberg Amtsgericht Mannheim HRB 735188\nRegisterbekanntmachung nach dem Umwandlungsgesetz 28.01.2025 (Eintragungsdatum)\n\nVEG EnergyHub GmbH\nGesellschaft mit beschränkter Haftung\nMalsch\n\nAls nicht eingetragen wird bekanntgemacht:\nDen Gläubigern der an der Verschmelzung beteiligten Rechtsträger ist, wenn sie binnen sechs Monaten nach dem Tag, an dem die Eintragung der Verschmelzung in das Register des Sitzes desjenigen Rechtsträgers, dessen Gläubiger sie sind, nach § 19 Abs. 3 UmwG als bekanntgemacht gilt, ihren Anspruch nach Grund und Höhe schriftlich anmelden, Sicherheit zu leisten, soweit sie nicht Befriedigung verlangen können. Dieses Recht steht den Gläubigern jedoch nur zu, wenn sie glaubhaft machen, dass durch die Verschmelzung die Erfüllung ihrer Forderung gefährdet wird."
    },
    {
      "date": "2025-01-28",
      "id": "99774",
      "original_text": "Löschungsankündigung\nSaarland Amtsgericht Saarbrücken HRB 108162\nACE OF CUTS GmbH – Saarbrücken",
      "type": "Löschungsankündigung",
      "state": "Saarland",
      "amtsgericht": "Amtsgericht Saarbrücken",
      "registernummer": "HRB 108162",
      "registerart": "HRB",
      "company_name": "ACE OF CUTS GmbH",
      "company_seat": "Saarbrücken",
      "details": "28.01.2025 (Bekanntmachungsdatum)\n\nSaarland Amtsgericht Saarbrücken HRB 108162\nLöschungsankündigung 28.01.2025 (Eintragungsdatum)\n\nACE OF CUTS GmbH\nGesellschaft mit beschränkter Haftung\nSaarbrücken\n\nEs ist beabsichtigt, die Gesellschaft von Amts wegen gemäß § 394 FamFG wegen Vermögenslosigkeit zu löschen.\nGegen die Löschung von Amts wegen ist das Rechtsmittel des Widerspruchs statthaft. Der Widerspruch ist binnen einer Frist von 2 Monaten beginnend mit dem Tag dieser Veröffentlichung durch Einreichen eines Widerspruchsschreibens -schriftlich oder zur Niederschrift der Geschäftsstelle beim Amtsgericht Saarbrücken, -zentrales Handelsregister-, Mainzerstr.178, 66121 Saarbrücken einzulegen.\nDer Widerspruch muss die Bezeichnung der angefochtenen Löschungsankündigung enthalten sowie die Erklärung, dass Widerspruch eingelegt wird. Er ist vom Widerspruchsführer oder seinem Bevollmächtigten zu unterzeichnen.\nDas Widerspruchsschreiben kann auch in der Form eines elektronischen Dokumentes eingereicht werden, das mit einer qualifizierten elektronischen Signatur nach dem Signaturgesetz versehen sein muss (§§ 14 Abs. 2 FamFG, 130a, 298 ZPO)."
    },
    {
      "date": "2025-01-28",
      "id": "99775",
      "original_text": "Einreichung neuer Dokumente\nBaden-Württemberg Amtsgericht Mannheim HRB 338172\nDeutsche Balaton Aktiengesellschaft – Heidelberg",
      "type": "Einreichung neuer Dokumente",
      "state": "Baden-Württemberg",
      "amtsgericht": "Amtsgericht Mannheim",
      "registernummer": "HRB 338172",
      "registerart": "HRB",
      "company_name": "Deutsche Balaton Aktiengesellschaft",
      "company_seat": "Heidelberg",
      "details": "28.01.2025 (Bekanntmachungsdatum)\n\nBaden-Württemberg Amtsgericht Mannheim HRB 338172\nEinreichung neuer Dokumente\n\nDeutsche Balaton Aktiengesellschaft\nAktiengesellschaft\nHeidelberg\n\nDie Gesellschaft hat am 21.01.2025 den Entwurf des Verschmelzungsvertrages zwischen \"Balaton Agro Invest AG\", Heidelberg (Amtsgericht Amtsgericht Mannheim HRB 711465)\nund der hiesigen Gesellschaft (übernehmender Rechtsträger) zum Handelsregister eingereicht."
    },
    {
      "date": "2025-01-28",
      "id": "99776",
      "original_text": "Registerbekanntmachung nach dem Umwandlungsgesetz\nHamburg Amtsgericht Hamburg HRB 107779\nKD Investment & Consulting GmbH – Hamburg",
      "type": "Registerbekanntmachung nach dem Umwandlungsgesetz",
      "state": "Hamburg",
      "amtsgericht": "Amtsgericht Hamburg",
      "registernummer": "HRB 107779",
      "registerart": "HRB",
      "company_name": "KD Investment & Consulting GmbH",
      "company_seat": "Hamburg",
      "details": "28.01.2025 (Bekanntmachungsdatum)\n\nHamburg Amtsgericht Hamburg HRB 107779\nRegisterbekanntmachung nach dem Umwandlungsgesetz 28.01.2025 (Eintragungsdatum)\n\nKD Investment & Consulting GmbH\nGesellschaft mit beschränkter Haftung\nHamburg\n\nAls nicht eingetragen wird bekannt gemacht:\nDen Gläubigern der an der Verschmelzung beteiligten Gesellschaften ist, wenn sie binnen sechs Monaten nach dem Tag, an dem die Eintragung der Verschmelzung in das Register des Sitzes desjenigen Rechtsträgers, dessen Gläubiger sie sind, nach § 19 Absatz 3 UmwG als bekannt gemacht gilt, ihren Anspruch nach Grund und Höhe schriftlich anmelden, Sicherheit zu leisten, soweit sie nicht Befriedigung verlangen können. Dieses Recht steht den Gläubigern jedoch nur zu, wenn sie glaubhaft machen, dass durch die Verschmelzung die Erfüllung ihrer Forderung gefährdet wird."
    },
    {
      "date": "2025-01-28",
      "id": "99777",
      "original_text": "Registerbekanntmachung nach dem Umwandlungsgesetz\nHamburg Amtsgericht Hamburg HRB 104784\nNGI Grund Invest GmbH – Hamburg",
      "type": "Registerbekanntmachung nach dem Umwandlungsgesetz",
      "state": "Hamburg",
      "amtsgericht": "Amtsgericht Hamburg",
      "registernummer": "HRB 104784",
      "registerart": "HRB",
      "company_name": "NGI Grund Invest GmbH",
      "company_seat": "Hamburg",
      "details": "28.01.2025 (Bekanntmachungsdatum)\n\nHamburg Amtsgericht Hamburg HRB 104784\nRegisterbekanntmachung nach dem Umwandlungsgesetz 28.01.2025 (Eintragungsdatum)\n\nNGI Grund Invest GmbH\nGesellschaft mit beschränkter Haftung\nHamburg\n\nAls nicht eingetragen wird bekannt gemacht:\nDen Gläubigern der an der Verschmelzung beteiligten Gesellschaften ist, wenn sie binnen sechs Monaten nach dem Tag, an dem die Eintragung der Verschmelzung in das Register des Sitzes desjenigen Rechtsträgers, dessen Gläubiger sie sind, nach § 19 Absatz 3 UmwG als bekannt gemacht gilt, ihren Anspruch nach Grund und Höhe schriftlich anmelden, Sicherheit zu leisten, soweit sie nicht Befriedigung verlangen können. Dieses Recht steht den Gläubigern jedoch nur zu, wenn sie glaubhaft machen, dass durch die Verschmelzung die Erfüllung ihrer Forderung gefährdet wird."
    },
    {
      "date": "2025-01-28",
      "id": "99778",
      "original_text": "Registerbekanntmachung nach dem Umwandlungsgesetz\nSaarland Amtsgericht Saarbrücken HRA 13221\nBrandschutz Kavelius e.K. – Bous",
      "type": "Registerbekanntmachung nach dem Umwandlungsgesetz",
      "state": "Saarland",
      "amtsgericht": "Amtsgericht Saarbrücken",
      "registernummer": "HRA 13221",
      "registerart": "HRA",
      "company_name": "Brandschutz Kavelius e.K.",
      "company_seat": "Bous",
      "details": "28.01.2025 (Bekanntmachungsdatum)\n\nSaarland Amtsgericht Saarbrücken HRA 13221\nRegisterbekanntmachung nach dem Umwandlungsgesetz 28.01.2025 (Eintragungsdatum)\n\nBrandschutz Kavelius e.K.\nEinzelkaufmann / Einzelkauffrau\nBous\n\nAls nicht eingetragen wird bekannt gemacht: Den Gläubigern der an der Ausgliederung beteiligten Gesellschaften ist, wenn sie binnen sechs Monaten nach dem Tag, an dem die Eintragung der Ausgliederung in das Register des Sitzes desjenigen Rechtsträgers, dessen Gläubiger sie sind, nach § 19 Absatz 3 UmwG bekannt gemacht worden ist, ihren Anspruch nach Grund und Höhe schriftlich anmelden, Sicherheit zu leisten, soweit sie nicht Befriedigung verlangen können. Dieses Recht steht den Gläubigern jedoch nur zu, wenn sie glaubhaft machen, dass durch die Ausgliederung die Erfüllung ihrer Forderung gefährdet wird."
    },
    {
      "date": "2025-01-28",
      "id": "99779",
      "original_text": "Registerbekanntmachung nach dem Umwandlungsgesetz\nSaarland Amtsgericht Saarbrücken HRB 110949\nBrandschutz Kavelius GmbH – Bous",
      "type": "Registerbekanntmachung nach dem Umwandlungsgesetz",
      "state": "Saarland",
      "amtsgericht": "Amtsgericht Saarbrücken",
      "registernummer": "HRB 110949",
      "registerart": "HRB",
      "company_name": "Brandschutz Kavelius GmbH",
      "company_seat": "Bous",
      "details": "28.01.2025 (Bekanntmachungsdatum)\n\nSaarland Amtsgericht Saarbrücken HRB 110949\nRegisterbekanntmachung nach dem Umwandlungsgesetz 28.01.2025 (Eintragungsdatum)\n\nBrandschutz Kavelius GmbH\nGesellschaft mit beschränkter Haftung\nBous\n\nAls nicht eingetragen wird bekannt gemacht: Den Gläubigern der an der Ausgliederung beteiligten Gesellschaften ist, wenn sie binnen sechs Monaten nach dem Tag, an dem die Eintragung der Ausgliederung in das Register des Sitzes desjenigen Rechtsträgers, dessen Gläubiger sie sind, nach § 19 Absatz 3 UmwG bekannt gemacht worden ist, ihren Anspruch nach Grund und Höhe schriftlich anmelden, Sicherheit zu leisten, soweit sie nicht Befriedigung verlangen können. Dieses Recht steht den Gläubigern jedoch nur zu, wenn sie glaubhaft machen, dass durch die Ausgliederung die Erfüllung ihrer Forderung gefährdet wird."
    },
    {
      "date": "2025-01-28",
      "id": "99780",
      "original_text": "Registerbekanntmachung nach dem Umwandlungsgesetz\nBaden-Württemberg Amtsgericht Ulm HRB 738328\nElectrostar GmbH – Ebersbach an der Fils",
      "type": "Registerbekanntmachung nach dem Umwandlungsgesetz",
      "state": "Baden-Württemberg",
      "amtsgericht": "Amtsgericht Ulm",
      "registernummer": "HRB 738328",
      "registerart": "HRB",
      "company_name": "Electrostar GmbH",
      "company_seat": "Ebersbach an der Fils",
      "details": "28.01.2025 (Bekanntmachungsdatum)\n\nBaden-Württemberg Amtsgericht Ulm HRB 738328\nRegisterbekanntmachung nach dem Umwandlungsgesetz 28.01.2025 (Eintragungsdatum)\n\nElectrostar GmbH\nGesellschaft mit beschränkter Haftung\nEbersbach an der Fils\n\nDen Gläubigern der an der Abspaltung beteiligten Rechtsträger ist, wenn sie binnen sechs Monaten nach dem Tag, an dem die Eintragung der Abspaltung in das Register des Sitzes desjenigen Rechtsträgers, dessen Gläubiger sie sind, nach § 19 Abs. 3 UmwG als bekanntgemacht gilt, ihren Anspruch nach Grund und Höhe schriftlich anmelden, Sicherheit zu leisten, soweit sie nicht Befriedigung verlangen können. Dieses Recht steht den Gläubigern jedoch nur zu, wenn sie glaubhaft machen, dass durch die Abspaltung die Erfüllung ihrer Forderung gefährdet wird."
    },
    {
      "date": "2025-01-28",
      "id": "99781",
      "original_text": "Löschungsankündigung\nSchleswig-Holstein Amtsgericht Kiel HRB 24878\nCAKEKING GmbH – Henstedt-Ulzburg",
      "type": "Löschungsankündigung",
      "state": "Schleswig-Holstein",
      "amtsgericht": "Amtsgericht Kiel",
      "registernummer": "HRB 24878",
      "registerart": "HRB",
      "company_name": "CAKEKING GmbH",
      "company_seat": "Henstedt-Ulzburg",
      "details": "28.01.2025 (Bekanntmachungsdatum)\n\nSchleswig-Holstein Amtsgericht Kiel HRB 24878\nLöschungsankündigung\n\nCAKEKING GmbH\nGesellschaft mit beschränkter Haftung\nHenstedt-Ulzburg\n\nEs ist die Löschung der nachstehenden Gesellschaft wegen Vermögenslosigkeit gemäß § 394 FamFG beabsichtigt. Widerspruchsfrist: 2 Monate."
    },
    {
      "date": "2025-01-28",
      "id": "99782",
      "original_text": "Einreichung neuer Dokumente\nBaden-Württemberg Amtsgericht Ulm HRB 729780\nZeppelin Systems GmbH – Friedrichshafen",
      "type": "Einreichung neuer Dokumente",
      "state": "Baden-Württemberg",
      "amtsgericht": "Amtsgericht Ulm",
      "registernummer": "HRB 729780",
      "registerart": "HRB",
      "company_name": "Zeppelin Systems GmbH",
      "company_seat": "Friedrichshafen",
      "details": "28.01.2025 (Bekanntmachungsdatum)\n\nBaden-Württemberg Amtsgericht Ulm HRB 729780\nEinreichung neuer Dokumente\n\nZeppelin Systems GmbH\nGesellschaft mit beschränkter Haftung\nFriedrichshafen\n\nDie Gesellschaft hat am 27.01.2025 die Liste über die Zusammensetzung des Aufsichtsrats zum Handelsregister eingereicht."
    },
    {
      "date": "2025-01-28",
      "id": "99783",
      "original_text": "Löschungsankündigung\nThüringen Amtsgericht Rudolstadt VR 270249\nThüringerwald - Zweigverein Probstzella e.V. – Probstzella",
      "type": "Löschungsankündigung",
      "state": "Thüringen",
      "amtsgericht": "Amtsgericht Rudolstadt",
      "registernummer": "VR 270249",
      "registerart": "VR",
      "company_name": "Thüringerwald - Zweigverein Probstzella e.V.",
      "company_seat": "Probstzella",
      "details": "28.01.2025 (Bekanntmachungsdatum)\n\nThüringen Amtsgericht Rudolstadt VR 270249\nLöschungsankündigung\n\nThüringerwald - Zweigverein Probstzella e.V.\neingetragener Verein\nProbstzella\n\nDas Gericht beabsichtigt, den im Vereinsregister eingetragenen Verein Thüringerwald - Zweigverein Probstzella e.V. gemäß § 395 FamFG wegen unzulässiger Eintragung von Amts wegen zu löschen. Der Verein ist infolge Wegfalls sämtlicher Mitglieder erloschen. Die Frist zur Geltendmachung eines Widerspruch gegen die beabsichtigte Löschung wird auf einen Monat ab dieser Veröffentlichung festgesetzt."
    },
    {
      "date": "2025-01-28",
      "id": "99784",
      "original_text": "Einreichung neuer Dokumente\nThüringen Amtsgericht Jena HRB 105037\n\"Stadtwerke Weimar Stadtversorgungs-GmbH\" – Weimar",
      "type": "Einreichung neuer Dokumente",
      "state": "Thüringen",
      "amtsgericht": "Amtsgericht Jena",
      "registernummer": "HRB 105037",
      "registerart": "HRB",
      "company_name": "\"Stadtwerke Weimar Stadtversorgungs-GmbH\"",
      "company_seat": "Weimar",
      "details": "28.01.2025 (Bekanntmachungsdatum)\n\nThüringen Amtsgericht Jena HRB 105037\nEinreichung neuer Dokumente\n\n\"Stadtwerke Weimar Stadtversorgungs-GmbH\"\nGesellschaft mit beschränkter Haftung\nWeimar\n\nBekanntmachung gem. § 52 Abs. 3 Satz 2 GmbHG: Aufgrund einer Veränderung in den Personen der Aufsichtsratsmitglieder ist durch die Geschäftsführer eine neue Liste zum Handelsregister eingereicht worden."
    },
    {
      "date": "2025-01-28",
      "id": "99785",
      "original_text": "Registerbekanntmachung nach dem Umwandlungsgesetz\nSachsen-Anhalt Amtsgericht Stendal HRB 103059\nCurt Schröter Nachfolger GmbH – Barleben",
      "type": "Registerbekanntmachung nach dem Umwandlungsgesetz",
      "state": "Sachsen-Anhalt",
      "amtsgericht": "Amtsgericht Stendal",
      "registernummer": "HRB 103059",
      "registerart": "HRB",
      "company_name": "Curt Schröter Nachfolger GmbH",
      "company_seat": "Barleben",
      "details": "28.01.2025 (Bekanntmachungsdatum)\n\nSachsen-Anhalt Amtsgericht Stendal HRB 103059\nRegisterbekanntmachung nach dem Umwandlungsgesetz 28.01.2025 (Eintragungsdatum)\n\nCurt Schröter Nachfolger GmbH\nGesellschaft mit beschränkter Haftung\nBarleben\n\nNicht eingetragen:\nDen Gläubigern der an der Spaltung beteiligten Rechtsträger, ist wenn sie binnen sechs Monaten nach dem Tag, an dem die Eintragung der Spaltung nach §§ 125, 19 Abs. 3 UmwG als bekanntgemacht gilt, ihren Anspruch nach Grund und Höhe schriftlich anmelden, Sicherheit zu leisten, soweit sie nicht Befriedigung verlangen können. Dieses Recht steht ihnen jedoch nur zu, wenn sie glaubhaft machen, daß durch die Spaltung die Erfüllung ihrer Forderung gefährdet wird."
    },
    {
      "date": "2025-01-28",
      "id": "99786",
      "original_text": "Einreichung neuer Dokumente\nHamburg Amtsgericht Hamburg HRB 58961\nKörber AG – Hamburg",
      "type": "Einreichung neuer Dokumente",
      "state": "Hamburg",
      "amtsgericht": "Amtsgericht Hamburg",
      "registernummer": "HRB 58961",
      "registerart": "HRB",
      "company_name": "Körber AG",
      "company_seat": "Hamburg",
      "details": "28.01.2025 (Bekanntmachungsdatum)\n\nHamburg Amtsgericht Hamburg HRB 58961\nEinreichung neuer Dokumente\n\nKörber AG\nAktiengesellschaft\nHamburg\n\nAls nicht eingetragen wird bekannt gemacht: Liste des Aufsichtsrats wurde eingereicht."
    },
    {
      "date": "2025-01-28",
      "id": "99787",
      "original_text": "Löschungsankündigung\nBrandenburg Amtsgericht Potsdam HRB 19783\nErste Green Grundstücks GmbH – Kloster Lehnin",
      "type": "Löschungsankündigung",
      "state": "Brandenburg",
      "amtsgericht": "Amtsgericht Potsdam",
      "registernummer": "HRB 19783",
      "registerart": "HRB",
      "company_name": "Erste Green Grundstücks GmbH",
      "company_seat": "Kloster Lehnin",
      "details": "28.01.2025 (Bekanntmachungsdatum)\n\nBrandenburg Amtsgericht Potsdam HRB 19783\nLöschungsankündigung\n\nErste Green Grundstücks GmbH\nGesellschaft mit beschränkter Haftung\nKloster Lehnin\n\nBei der nachstehenden Gesellschaft wird das Amtslöschungsverfahren gemäß § 394 FamFG eingeleitet."
    },
    {
      "date": "2025-01-28",
      "id": "99788",
      "original_text": "Sonstige Registerbekanntmachung\nBaden-Württemberg Amtsgericht Mannheim HRB 341421\nINNOTEC Zerspanungstechnik GmbH – Sinsheim",
      "type": "Sonstige Registerbekanntmachung",
      "state": "Baden-Württemberg",
      "amtsgericht": "Amtsgericht Mannheim",
      "registernummer": "HRB 341421",
      "registerart": "HRB",
      "company_name": "INNOTEC Zerspanungstechnik GmbH",
      "company_seat": "Sinsheim",
      "details": "28.01.2025 (Bekanntmachungsdatum)\n\nBaden-Württemberg Amtsgericht Mannheim HRB 341421\nSonstige Registerbekanntmachung 28.01.2025 (Eintragungsdatum)\n\nINNOTEC Zerspanungstechnik GmbH\nGesellschaft mit beschränkter Haftung\nSinsheim\n\nAls nicht eingetragen wird bekanntgemacht: Den Gläubigern der Gesellschaft, deren Forderungen begründet worden sind, bevor die Eintragung der Beendigung des Vertrages in das Handelsregister nach § 10 HGB als bekanntgemacht gilt, ist vom anderen Vertragsteil Sicherheit zu leisten, wenn sie sich binnen sechs Monaten nach der Bekanntmachung zu diesem Zweck bei ihm melden."
    },
    {
      "date": "2025-01-28",
      "id": "99789",
      "original_text": "Sonstige Registerbekanntmachung\nHamburg Amtsgericht Hamburg HRB 96810\nSYBO Aktiengesellschaft Steuerberatungsgesellschaft – Hamburg",
      "type": "Sonstige Registerbekanntmachung",
      "state": "Hamburg",
      "amtsgericht": "Amtsgericht Hamburg",
      "registernummer": "HRB 96810",
      "registerart": "HRB",
      "company_name": "SYBO Aktiengesellschaft Steuerberatungsgesellschaft",
      "company_seat": "Hamburg",
      "details": "28.01.2025 (Bekanntmachungsdatum)\n\nHamburg Amtsgericht Hamburg HRB 96810\nSonstige Registerbekanntmachung 28.01.2025 (Eintragungsdatum)\n\nSYBO Aktiengesellschaft Steuerberatungsgesellschaft\nAktiengesellschaft\nHamburg\n\nAls nicht eingetragen wird bekannt gemacht: Liste des Aufsichtsrats wurde eingereicht."
    },
    {
      "date": "2025-01-28",
      "id": "99790",
      "original_text": "Sonstige Registerbekanntmachung\nHamburg Amtsgericht Hamburg HRB 189215\nProjektentwicklung Hofgartengarage in Düsseldorf GmbH – Hamburg",
      "type": "Sonstige Registerbekanntmachung",
      "state": "Hamburg",
      "amtsgericht": "Amtsgericht Hamburg",
      "registernummer": "HRB 189215",
      "registerart": "HRB",
      "company_name": "Projektentwicklung Hofgartengarage in Düsseldorf GmbH",
      "company_seat": "Hamburg",
      "details": "28.01.2025 (Bekanntmachungsdatum)\n\nHamburg Amtsgericht Hamburg HRB 189215\nSonstige Registerbekanntmachung 28.01.2025 (Eintragungsdatum)\n\nProjektentwicklung Hofgartengarage in Düsseldorf GmbH\nGesellschaft mit beschränkter Haftung\nHamburg\n\nAls nicht eingetragen wird bekannt gemacht:  Den Gläubigern der Gesellschaft, deren Forderungen begründet worden sind, bevor die Eintragung der Vertragsbeendigung in das Handelsregister nach § 10 HGB als bekannt gemacht gilt, ist vom anderen Vertragsteil Sicherheit zu leisten, wenn sie sich binnen 6 Monaten nach Bekanntmachung der Eintragung zu diesem Zweck bei ihm melden."
    },
    {
      "date": "2025-01-28",
      "id": "99791",
      "original_text": "Löschungsankündigung\nBaden-Württemberg Amtsgericht Stuttgart HRB 776173\nSwid & Haas Consulting GmbH – Stuttgart",
      "type": "Löschungsankündigung",
      "state": "Baden-Württemberg",
      "amtsgericht": "Amtsgericht Stuttgart",
      "registernummer": "HRB 776173",
      "registerart": "HRB",
      "company_name": "Swid & Haas Consulting GmbH",
      "company_seat": "Stuttgart",
      "details": "28.01.2025 (Bekanntmachungsdatum)\n\nBaden-Württemberg Amtsgericht Stuttgart HRB 776173\nLöschungsankündigung\n\nSwid & Haas Consulting GmbH\nGesellschaft mit beschränkter Haftung\nStuttgart\n\nDas Gericht beabsichtigt, die Gesellschaft wegen Vermögenslosigkeit im Handelsregister von Amts wegen nach § 394 FamFG zu löschen. Die Frist zur Geltendmachung eines Widerspruchs gegen die beabsichtigte Löschung ist auf zwei Monate ab Veröffentlichung bestimmt."
    },
    {
      "date": "2025-01-28",
      "id": "99792",
      "original_text": "Registerbekanntmachung nach dem Umwandlungsgesetz\nSaarland Amtsgericht Saarbrücken HRB 100517\nAltes Stadtbad Projekt GmbH – Merzig",
      "type": "Registerbekanntmachung nach dem Umwandlungsgesetz",
      "state": "Saarland",
      "amtsgericht": "Amtsgericht Saarbrücken",
      "registernummer": "HRB 100517",
      "registerart": "HRB",
      "company_name": "Altes Stadtbad Projekt GmbH",
      "company_seat": "Merzig",
      "details": "28.01.2025 (Bekanntmachungsdatum)\n\nSaarland Amtsgericht Saarbrücken HRB 100517\nRegisterbekanntmachung nach dem Umwandlungsgesetz 28.01.2025 (Eintragungsdatum)\n\nAltes Stadtbad Projekt GmbH\nGesellschaft mit beschränkter Haftung\nMerzig\n\nAls nicht eingetragen wird bekannt gemacht: Den Gläubigern der an der Verschmelzung beteiligten Gesellschaften ist, wenn sie binnen sechs Monaten nach dem Tag, an dem die Eintragung der Verschmelzung in das Register des Sitzes derjenigen Rechtsträger deren Gläubiger sie sind, nach § 19 Absatz 3 UmwG bekannt gemacht worden ist, ihren Anspruch nach Grund und Höhe schriftlich anmelden, Sicherheit zu leisten, soweit sie nicht Befriedigung verlangen können. Dieses Recht steht den Gläubigern jedoch nur zu, wenn sie glaubhaft machen, dass durch die Verschmelzung die Erfüllung ihrer Forderung gefährdet wird."
    },
    {
      "date": "2025-01-28",
      "id": "99793",
      "original_text": "Einreichung neuer Dokumente\nHamburg Amtsgericht Hamburg HRB 72691\nMPC Münchmeyer Petersen Capital AG – Hamburg",
      "type": "Einreichung neuer Dokumente",
      "state": "Hamburg",
      "amtsgericht": "Amtsgericht Hamburg",
      "registernummer": "HRB 72691",
      "registerart": "HRB",
      "company_name": "MPC Münchmeyer Petersen Capital AG",
      "company_seat": "Hamburg",
      "details": "28.01.2025 (Bekanntmachungsdatum)\n\nHamburg Amtsgericht Hamburg HRB 72691\nEinreichung neuer Dokumente 28.01.2025 (Eintragungsdatum)\n\nMPC Münchmeyer Petersen Capital AG\nAktiengesellschaft\nHamburg\n\nAls nicht eingetragen wird bekannt gemacht: Liste des Aufsichtsrats wurde eingereicht."
    },
    {
      "date": "2025-01-28",
      "id": "99794",
      "original_text": "Registerbekanntmachung nach dem Umwandlungsgesetz\nSchleswig-Holstein Amtsgericht Lübeck HRB 25779\nAuf den Punkt GmbH – Grömitz",
      "type": "Registerbekanntmachung nach dem Umwandlungsgesetz",
      "state": "Schleswig-Holstein",
      "amtsgericht": "Amtsgericht Lübeck",
      "registernummer": "HRB 25779",
      "registerart": "HRB",
      "company_name": "Auf den Punkt GmbH",
      "company_seat": "Grömitz",
      "details": "28.01.2025 (Bekanntmachungsdatum)\n\nSchleswig-Holstein Amtsgericht Lübeck HRB 25779\nRegisterbekanntmachung nach dem Umwandlungsgesetz 27.01.2025 (Eintragungsdatum)\n\nAuf den Punkt GmbH\nGesellschaft mit beschränkter Haftung\nGrömitz\n\nZu Eintragungsnummer 1 vom 27.01.2025 wird als nicht eingetragen veröffentlicht: Den Gläubigern ist, wenn sie binnen sechs Monaten nach dem Tag, an dem die Eintragung der Umwandlung als bekannt gemacht gilt, ihren Anspruch nach Grund und Höhe schriftlich anmelden, Sicherheit zu leisten, soweit sie nicht Befriedigung verlangen können. Dieses Recht steht den Gläubigern jedoch nur zu, wenn sie glaubhaft machen, dass durch die Umwandlung die Erfüllung ihrer Forderung gefährdet wird."
    },
    {
      "date": "2025-01-28",
      "id": "99795",
      "original_text": "Löschungsankündigung\nBrandenburg Amtsgericht Frankfurt/Oder HRB 16570\nTyler Heyn Consulting UG (haftungsbeschränkt) – Wandlitz",
      "type": "Löschungsankündigung",
      "state": "Brandenburg",
      "amtsgericht": "Amtsgericht Frankfurt/Oder",
      "registernummer": "HRB 16570",
      "registerart": "HRB",
      "company_name": "Tyler Heyn Consulting UG (haftungsbeschränkt)",
      "company_seat": "Wandlitz",
      "details": "28.01.2025 (Bekanntmachungsdatum)\n\nBrandenburg Amtsgericht Frankfurt/Oder HRB 16570\nLöschungsankündigung\n\nTyler Heyn Consulting UG (haftungsbeschränkt)\nGesellschaft mit beschränkter Haftung\nWandlitz\n\nBei der nachstehenden Gesellschaft wird das Amtslöschungsverfahren gemäß § 394 FamFG eingeleitet."
    },
    {
      "date": "2025-01-28",
      "id": "99796",
      "original_text": "Sonstige Registerbekanntmachung\nHamburg Amtsgericht Hamburg HRB 177058\nSunnic Lighthouse Solar Invest 10 GmbH – Hamburg",
      "type": "Sonstige Registerbekanntmachung",
      "state": "Hamburg",
      "amtsgericht": "Amtsgericht Hamburg",
      "registernummer": "HRB 177058",
      "registerart": "HRB",
      "company_name": "Sunnic Lighthouse Solar Invest 10 GmbH",
      "company_seat": "Hamburg",
      "details": "28.01.2025 (Bekanntmachungsdatum)\n\nHamburg Amtsgericht Hamburg HRB 177058\nSonstige Registerbekanntmachung 28.01.2025 (Eintragungsdatum)\n\nSunnic Lighthouse Solar Invest 10 GmbH\nGesellschaft mit beschränkter Haftung\nHamburg\n\nAls nicht eingetragen wird bekannt gemacht:  Den Gläubigern der Gesellschaft, deren Forderungen begründet worden sind, bevor die Eintragung der Vertragsbeendigung in das Handelsregister nach § 10 HGB als bekannt gemacht gilt, ist vom anderen Vertragsteil Sicherheit zu leisten, wenn sie sich binnen 6 Monaten nach Bekanntmachung der Eintragung zu diesem Zweck bei ihm melden."
    },
    {
      "date": "2025-01-28",
      "id": "99797",
      "original_text": "Registerbekanntmachung nach dem Umwandlungsgesetz\nBaden-Württemberg Amtsgericht Stuttgart HRB 798186\nHST Steinhilber Beteiligungs GmbH – Rottweil",
      "type": "Registerbekanntmachung nach dem Umwandlungsgesetz",
      "state": "Baden-Württemberg",
      "amtsgericht": "Amtsgericht Stuttgart",
      "registernummer": "HRB 798186",
      "registerart": "HRB",
      "company_name": "HST Steinhilber Beteiligungs GmbH",
      "company_seat": "Rottweil",
      "details": "28.01.2025 (Bekanntmachungsdatum)\n\nBaden-Württemberg Amtsgericht Stuttgart HRB 798186\nRegisterbekanntmachung nach dem Umwandlungsgesetz 28.01.2025 (Eintragungsdatum)\n\nHST Steinhilber Beteiligungs GmbH\nGesellschaft mit beschränkter Haftung\nRottweil\n\nAls nicht eingetragen wird bekanntgemacht:\nDen Gläubigern des an dem Formwechsel beteiligten Rechtsträgers ist, wenn sie binnen sechs Monaten nach dem Tag, an dem die Eintragung des Formwechsels in das Register des Sitzes desjenigen Rechtsträgers, dessen Gläubiger sie sind, nach § 19 Abs. 3 UmwG als bekanntgemacht gilt, ihren Anspruch nach Grund und Höhe schriftlich anmelden, Sicherheit zu leisten, soweit sie nicht Befriedigung verlangen können. Dieses Recht steht den Gläubigern jedoch nur zu, wenn sie glaubhaft machen, dass durch den Formwechsel die Erfüllung ihrer Forderung gefährdet wird."
    },
    {
      "date": "2025-01-28",
      "id": "99798",
      "original_text": "Registerbekanntmachung nach dem Umwandlungsgesetz\nBaden-Württemberg Amtsgericht Stuttgart HRB 470765\nHST Steinhilber Beteiligungs AG – Rottweil",
      "type": "Registerbekanntmachung nach dem Umwandlungsgesetz",
      "state": "Baden-Württemberg",
      "amtsgericht": "Amtsgericht Stuttgart",
      "registernummer": "HRB 470765",
      "registerart": "HRB",
      "company_name": "HST Steinhilber Beteiligungs AG",
      "company_seat": "Rottweil",
      "details": "28.01.2025 (Bekanntmachungsdatum)\n\nBaden-Württemberg Amtsgericht Stuttgart HRB 470765\nRegisterbekanntmachung nach dem Umwandlungsgesetz 28.01.2025 (Eintragungsdatum)\n\nHST Steinhilber Beteiligungs AG\nAktiengesellschaft\nRottweil\n\nAls nicht eingetragen wird bekanntgemacht:\nDen Gläubigern des an dem Formwechsel beteiligten Rechtsträgers ist, wenn sie binnen sechs Monaten nach dem Tag, an dem die Eintragung des Formwechsels in das Register des Sitzes desjenigen Rechtsträgers, dessen Gläubiger sie sind, nach § 19 Abs. 3 UmwG als bekanntgemacht gilt, ihren Anspruch nach Grund und Höhe schriftlich anmelden, Sicherheit zu leisten, soweit sie nicht Befriedigung verlangen können. Dieses Recht steht den Gläubigern jedoch nur zu, wenn sie glaubhaft machen, dass durch den Formwechsel die Erfüllung ihrer Forderung gefährdet wird."
    },
    {
      "date": "2025-01-28",
      "id": "99799",
      "original_text": "Registerbekanntmachung nach dem Umwandlungsgesetz\nBaden-Württemberg Amtsgericht Freiburg HRB 732503\nBau mit Holz Gonzalez GmbH – Uhldingen-Mühlhofen",
      "type": "Registerbekanntmachung nach dem Umwandlungsgesetz",
      "state": "Baden-Württemberg",
      "amtsgericht": "Amtsgericht Freiburg",
      "registernummer": "HRB 732503",
      "registerart": "HRB",
      "company_name": "Bau mit Holz Gonzalez GmbH",
      "company_seat": "Uhldingen-Mühlhofen",
      "details": "28.01.2025 (Bekanntmachungsdatum)\n\nBaden-Württemberg Amtsgericht Freiburg HRB 732503\nRegisterbekanntmachung nach dem Umwandlungsgesetz 28.01.2025 (Eintragungsdatum)\n\nBau mit Holz Gonzalez GmbH\nGesellschaft mit beschränkter Haftung\nUhldingen-Mühlhofen\n\nAls nicht eingetragen wird bekanntgemacht:\nDen Gläubigern der an der Ausgliederung beteiligten Rechtsträger ist, wenn sie binnen sechs Monaten nach dem Tag, an dem die Eintragung der Ausgliederung in das Register des Sitzes desjenigen Rechtsträgers, dessen Gläubiger sie sind, nach § 19 Abs. 3 UmwG als bekanntgemacht gilt, ihren Anspruch nach Grund und Höhe schriftlich anmelden, Sicherheit zu leisten, soweit sie nicht Befriedigung verlangen können. Dieses Recht steht den Gläubigern jedoch nur zu, wenn sie glaubhaft machen, dass durch die Ausgliederung die Erfüllung ihrer Forderung gefährdet wird."
    },
    {
      "date": "2025-01-28",
      "id": "99800",
      "original_text": "Registerbekanntmachung nach dem Umwandlungsgesetz\nBaden-Württemberg Amtsgericht Freiburg HRA 708898\nBau mit Holz Gonzalez e.K. – Uhldingen-Mühlhofen",
      "type": "Registerbekanntmachung nach dem Umwandlungsgesetz",
      "state": "Baden-Württemberg",
      "amtsgericht": "Amtsgericht Freiburg",
      "registernummer": "HRA 708898",
      "registerart": "HRA",
      "company_name": "Bau mit Holz Gonzalez e.K.",
      "company_seat": "Uhldingen-Mühlhofen",
      "details": "28.01.2025 (Bekanntmachungsdatum)\n\nBaden-Württemberg Amtsgericht Freiburg HRA 708898\nRegisterbekanntmachung nach dem Umwandlungsgesetz 28.01.2025 (Eintragungsdatum)\n\nBau mit Holz Gonzalez e.K.\nEinzelkaufmann / Einzelkauffrau\nUhldingen-Mühlhofen\n\nAls nicht eingetragen wird bekanntgemacht:\nDen Gläubigern der an der Ausgliederung beteiligten Rechtsträger ist, wenn sie binnen sechs Monaten nach dem Tag, an dem die Eintragung der Ausgliederung in das Register des Sitzes desjenigen Rechtsträgers, dessen Gläubiger sie sind, nach § 19 Abs. 3 UmwG als bekanntgemacht gilt, ihren Anspruch nach Grund und Höhe schriftlich anmelden, Sicherheit zu leisten, soweit sie nicht Befriedigung verlangen können. Dieses Recht steht den Gläubigern jedoch nur zu, wenn sie glaubhaft machen, dass durch die Ausgliederung die Erfüllung ihrer Forderung gefährdet wird."
    },
    {
      "date": "2025-01-28",
      "id": "99801",
      "original_text": "Registerbekanntmachung nach dem Umwandlungsgesetz\nBrandenburg Amtsgericht Cottbus HRB 2883\nCBT Beton-, Baustofftransporte und Betonpumpendienst GmbH – Krieschow",
      "type": "Registerbekanntmachung nach dem Umwandlungsgesetz",
      "state": "Brandenburg",
      "amtsgericht": "Amtsgericht Cottbus",
      "registernummer": "HRB 2883",
      "registerart": "HRB",
      "company_name": "CBT Beton-, Baustofftransporte und Betonpumpendienst GmbH",
      "company_seat": "Krieschow",
      "details": "28.01.2025 (Bekanntmachungsdatum)\n\nBrandenburg Amtsgericht Cottbus HRB 2883\nRegisterbekanntmachung nach dem Umwandlungsgesetz 28.01.2025 (Eintragungsdatum)\n\nCBT Beton-, Baustofftransporte und Betonpumpendienst GmbH\nGesellschaft mit beschränkter Haftung\nKrieschow\n\nDen Gläubigern der an der Verschmelzung beteiligten Rechtsträger ist, wenn sie binnen sechs Monaten nach dem Tag, an dem die Eintragung der Verschmelzung in das Register des Sitzes desjenigen Rechtsträgers, dessen Gläubiger sie sind, als bekannt gemacht gilt, ihren Anspruch nach Grund und Höhe schriftlich anmelden, Sicherheit zu leisten, soweit sie nicht Befriedigung verlangen können. Dieses Recht steht den Gläubigern jedoch nur zu, wenn sie glaubhaft machen, dass durch die Verschmelzung die Erfüllung ihrer Forderung gefährdet wird."
    },
    {
      "date": "2025-01-28",
      "id": "99802",
      "original_text": "Löschungsankündigung\nSachsen Amtsgericht Dresden HRB 22490\nWallenborn Beteiligungsgesellschaft mbH – Klipphausen",
      "type": "Löschungsankündigung",
      "state": "Sachsen",
      "amtsgericht": "Amtsgericht Dresden",
      "registernummer": "HRB 22490",
      "registerart": "HRB",
      "company_name": "Wallenborn Beteiligungsgesellschaft mbH",
      "company_seat": "Klipphausen",
      "details": "28.01.2025 (Bekanntmachungsdatum)\n\nSachsen Amtsgericht Dresden HRB 22490\nLöschungsankündigung\n\nWallenborn Beteiligungsgesellschaft mbH\nGesellschaft mit beschränkter Haftung\nKlipphausen\n\nDas Registergericht beabsichtigt, die im Handelsregister eingetragene Gesellschaft von Amts wegen nach § 394 FamFG zu löschen. Die Frist zu Erhebung eines Widerspruchs gegen die beabsichtigte Löschung wird auf einen Monat festgesetzt."
    },
    {
      "date": "2025-01-28",
      "id": "99803",
      "original_text": "Registerbekanntmachung nach dem Umwandlungsgesetz\nSachsen Amtsgericht Leipzig HRA 19609\nSEAN LLC & Co. KG – Leipzig",
      "type": "Registerbekanntmachung nach dem Umwandlungsgesetz",
      "state": "Sachsen",
      "amtsgericht": "Amtsgericht Leipzig",
      "registernummer": "HRA 19609",
      "registerart": "HRA",
      "company_name": "SEAN LLC & Co. KG",
      "company_seat": "Leipzig",
      "details": "28.01.2025 (Bekanntmachungsdatum)\n\nSachsen Amtsgericht Leipzig HRA 19609\nRegisterbekanntmachung nach dem Umwandlungsgesetz 28.01.2025 (Eintragungsdatum)\n\nSEAN LLC & Co. KG\nKommanditgesellschaft\nLeipzig\n\nDen Gläubigern der an der Verschmelzung beteiligten Rechtsträger ist, wenn sie binnen sechs Monaten nach dem Tag, an dem die Eintragung der Verschmelzung in das Register des Sitzes desjenigen Rechtsträgers, dessen Gläubiger sie sind, nach § 19 Abs. 3 UmwG als bekannt gemacht gilt, ihren Anspruch nach Grund und Höhe in Textform anmelden, Sicherheit zu leisten, soweit sie nicht Befriedigung verlangen können. Dieses Recht steht den Gläubigern jedoch nur zu, wenn sie glaubhaft machen, dass durch die Verschmelzung die Erfüllung der Forderung gefährdet wird."
    },
    {
      "date": "2025-01-28",
      "id": "99804",
      "original_text": "Löschungsankündigung\nSachsen Amtsgericht Dresden HRB 39707\nIHC - International Handel & Consulting UG (haftungsbeschränkt) – Dresden",
      "type": "Löschungsankündigung",
      "state": "Sachsen",
      "amtsgericht": "Amtsgericht Dresden",
      "registernummer": "HRB 39707",
      "registerart": "HRB",
      "company_name": "IHC - International Handel & Consulting UG (haftungsbeschränkt)",
      "company_seat": "Dresden",
      "details": "28.01.2025 (Bekanntmachungsdatum)\n\nSachsen Amtsgericht Dresden HRB 39707\nLöschungsankündigung\n\nIHC - International Handel & Consulting UG (haftungsbeschränkt)\nGesellschaft mit beschränkter Haftung\nDresden\n\nDas Registergericht beabsichtigt, die im Handelsregister eingetragene Gesellschaft von Amts wegen nach § 394 FamFG zu löschen. Die Frist zu Erhebung eines Widerspruchs gegen die beabsichtigte Löschung wird auf einen Monat festgesetzt."
    },
    {
      "date": "2025-01-28",
      "id": "99805",
      "original_text": "Löschungsankündigung\nSachsen Amtsgericht Dresden HRB 26132\nAVERS TECHNOLOGY GmbH – Königsbrück",
      "type": "Löschungsankündigung",
      "state": "Sachsen",
      "amtsgericht": "Amtsgericht Dresden",
      "registernummer": "HRB 26132",
      "registerart": "HRB",
      "company_name": "AVERS TECHNOLOGY GmbH",
      "company_seat": "Königsbrück",
      "details": "28.01.2025 (Bekanntmachungsdatum)\n\nSachsen Amtsgericht Dresden HRB 26132\nLöschungsankündigung\n\nAVERS TECHNOLOGY GmbH\nGesellschaft mit beschränkter Haftung\nKönigsbrück\n\nDas Registergericht beabsichtigt, die im Handelsregister eingetragene Gesellschaft von Amts wegen nach § 394 FamFG zu löschen. Die Frist zu Erhebung eines Widerspruchs gegen die beabsichtigte Löschung wird auf einen Monat festgesetzt."
    },
    {
      "date": "2025-01-28",
      "id": "99806",
      "original_text": "Registerbekanntmachung nach dem Umwandlungsgesetz\nSachsen Amtsgericht Leipzig HRB 15928\nLTB Leipziger Transport und Logistik Betriebe GmbH – Leipzig",
      "type": "Registerbekanntmachung nach dem Umwandlungsgesetz",
      "state": "Sachsen",
      "amtsgericht": "Amtsgericht Leipzig",
      "registernummer": "HRB 15928",
      "registerart": "HRB",
      "company_name": "LTB Leipziger Transport und Logistik Betriebe GmbH",
      "company_seat": "Leipzig",
      "details": "28.01.2025 (Bekanntmachungsdatum)\n\nSachsen Amtsgericht Leipzig HRB 15928\nRegisterbekanntmachung nach dem Umwandlungsgesetz 28.01.2025 (Eintragungsdatum)\n\nLTB Leipziger Transport und Logistik Betriebe GmbH\nGesellschaft mit beschränkter Haftung\nLeipzig\n\nDen Gläubigern der an der Verschmelzung beteiligten Rechtsträger ist, wenn sie binnen sechs Monaten nach dem Tag, an dem die Eintragung der Verschmelzung in das Register des Sitzes desjenigen Rechtsträgers, dessen Gläubiger sie sind, nach § 19 Abs. 3 UmwG als bekannt gemacht gilt, ihren Anspruch nach Grund und Höhe in Textform anmelden, Sicherheit zu leisten, soweit sie nicht Befriedigung verlangen können. Dieses Recht steht den Gläubigern jedoch nur zu, wenn sie glaubhaft machen, dass durch die Verschmelzung die Erfüllung der Forderung gefährdet wird."
    },
    {
      "date": "2025-01-28",
      "id": "99807",
      "original_text": "Registerbekanntmachung nach dem Umwandlungsgesetz\nSachsen Amtsgericht Leipzig HRB 13567\nLeipziger Servicebetriebe (LSB) GmbH – Leipzig",
      "type": "Registerbekanntmachung nach dem Umwandlungsgesetz",
      "state": "Sachsen",
      "amtsgericht": "Amtsgericht Leipzig",
      "registernummer": "HRB 13567",
      "registerart": "HRB",
      "company_name": "Leipziger Servicebetriebe (LSB) GmbH",
      "company_seat": "Leipzig",
      "details": "28.01.2025 (Bekanntmachungsdatum)\n\nSachsen Amtsgericht Leipzig HRB 13567\nRegisterbekanntmachung nach dem Umwandlungsgesetz 28.01.2025 (Eintragungsdatum)\n\nLeipziger Servicebetriebe (LSB) GmbH\nGesellschaft mit beschränkter Haftung\nLeipzig\n\nDen Gläubigern der an der Verschmelzung beteiligten Rechtsträger ist, wenn sie binnen sechs Monaten nach dem Tag, an dem die Eintragung der Verschmelzung in das Register des Sitzes desjenigen Rechtsträgers, dessen Gläubiger sie sind, nach § 19 Abs. 3 UmwG als bekannt gemacht gilt, ihren Anspruch nach Grund und Höhe in Textform anmelden, Sicherheit zu leisten, soweit sie nicht Befriedigung verlangen können. Dieses Recht steht den Gläubigern jedoch nur zu, wenn sie glaubhaft machen, dass durch die Verschmelzung die Erfüllung der Forderung gefährdet wird."
    },
    {
      "date": "2025-01-28",
      "id": "99808",
      "original_text": "Einreichung neuer Dokumente\nSachsen Amtsgericht Leipzig HRB 4545\nWestsächsische Entsorgungs- und Verwertungsgesellschaft mit beschränkter Haftung – Großpösna OT Störmthal",
      "type": "Einreichung neuer Dokumente",
      "state": "Sachsen",
      "amtsgericht": "Amtsgericht Leipzig",
      "registernummer": "HRB 4545",
      "registerart": "HRB",
      "company_name": "Westsächsische Entsorgungs- und Verwertungsgesellschaft mit beschränkter Haftung",
      "company_seat": "Großpösna OT Störmthal",
      "details": "28.01.2025 (Bekanntmachungsdatum)\n\nSachsen Amtsgericht Leipzig HRB 4545\nEinreichung neuer Dokumente\n\nWestsächsische Entsorgungs- und Verwertungsgesellschaft mit beschränkter Haftung\nGesellschaft mit beschränkter Haftung\nGroßpösna OT Störmthal\n\nAm 15.01.2025 wurde beim Handelsregister des Amtsgerichts Leipzig die Liste der Mitglieder des Aufsichtsrats gemäß § 52 GmbHG eingereicht."
    },
    {
      "date": "2025-01-28",
      "id": "99809",
      "original_text": "Sonstige Registerbekanntmachung\nSachsen Amtsgericht Leipzig HRB 4703\nHelmholtz-Zentrum für Umweltforschung GmbH - UFZ – Leipzig",
      "type": "Sonstige Registerbekanntmachung",
      "state": "Sachsen",
      "amtsgericht": "Amtsgericht Leipzig",
      "registernummer": "HRB 4703",
      "registerart": "HRB",
      "company_name": "Helmholtz-Zentrum für Umweltforschung GmbH - UFZ",
      "company_seat": "Leipzig",
      "details": "28.01.2025 (Bekanntmachungsdatum)\n\nSachsen Amtsgericht Leipzig HRB 4703\nSonstige Registerbekanntmachung\n\nHelmholtz-Zentrum für Umweltforschung GmbH - UFZ\nGesellschaft mit beschränkter Haftung\nLeipzig\n\nAm 27.01.2025 wurde beim Handelsregister des Amtsgerichts Leipzig die Liste der Mitglieder des Aufsichtsrats gemäß § 52 GmbHG eingereicht."
    },
    {
      "date": "2025-01-28",
      "id": "99810",
      "original_text": "Löschungsankündigung\nSachsen Amtsgericht Dresden HRB 40230\nCareLove GmbH – Dresden",
      "type": "Löschungsankündigung",
      "state": "Sachsen",
      "amtsgericht": "Amtsgericht Dresden",
      "registernummer": "HRB 40230",
      "registerart": "HRB",
      "company_name": "CareLove GmbH",
      "company_seat": "Dresden",
      "details": "28.01.2025 (Bekanntmachungsdatum)\n\nSachsen Amtsgericht Dresden HRB 40230\nLöschungsankündigung\n\nCareLove GmbH\nGesellschaft mit beschränkter Haftung\nDresden\n\nDas Registergericht beabsichtigt, die im Handelsregister eingetragene Gesellschaft von Amts wegen nach § 394 FamFG zu löschen. Die Frist zu Erhebung eines Widerspruchs gegen die beabsichtigte Löschung wird auf einen Monat festgesetzt."
    },
    {
      "date": "2025-01-28",
      "id": "99811",
      "original_text": "Löschungsankündigung\nSachsen Amtsgericht Leipzig VR 5825\nVerband Bornaer Kleingärtner und Kleingartenvereine e.V. – Borna",
      "type": "Löschungsankündigung",
      "state": "Sachsen",
      "amtsgericht": "Amtsgericht Leipzig",
      "registernummer": "VR 5825",
      "registerart": "VR",
      "company_name": "Verband Bornaer Kleingärtner und Kleingartenvereine e.V.",
      "company_seat": "Borna",
      "details": "28.01.2025 (Bekanntmachungsdatum)\n\nSachsen Amtsgericht Leipzig VR 5825\nLöschungsankündigung\n\nVerband Bornaer Kleingärtner und Kleingartenvereine e.V.\neingetragener Verein\nBorna\n\nDas Gericht beabsichtigt, gemäß § 4 Absatz 2 Ziffer 1 der Verordnung über das Vereinsregister das Registerblatt  des Vereins zu schließen, da nach Mitteilung des bisherigen Vorstandes sämtliche Mitglieder aus dem Verein ausgeschieden sind. Zur Geltendmachung eines Widerspruchs gegen die beabsichtigte Schließung wird eine Frist von einem Monat nach der Veröffentlichung bestimmt."
    },
    {
      "date": "2025-01-28",
      "id": "99812",
      "original_text": "Löschungsankündigung\nSachsen Amtsgericht Chemnitz HRB 34033\nBrento GmbH – Plauen",
      "type": "Löschungsankündigung",
      "state": "Sachsen",
      "amtsgericht": "Amtsgericht Chemnitz",
      "registernummer": "HRB 34033",
      "registerart": "HRB",
      "company_name": "Brento GmbH",
      "company_seat": "Plauen",
      "details": "28.01.2025 (Bekanntmachungsdatum)\n\nSachsen Amtsgericht Chemnitz HRB 34033\nLöschungsankündigung\n\nBrento GmbH\nGesellschaft mit beschränkter Haftung\nPlauen\n\nDas Registergericht beabsichtigt, die im Handelsregister eingetragene Gesellschaft von Amts wegen nach § 394 FamFG zu löschen. Die Frist zu Erhebung eines Widerspruchs gegen die beabsichtigte Löschung wird auf einen Monat festgesetzt."
    },
    {
      "date": "2025-01-28",
      "id": "99813",
      "original_text": "Registerbekanntmachung nach dem Umwandlungsgesetz\nNiedersachsen Amtsgericht Hannover GnR 200088\nPortfolios Finanzmanagement eG – Hannover",
      "type": "Registerbekanntmachung nach dem Umwandlungsgesetz",
      "state": "Niedersachsen",
      "amtsgericht": "Amtsgericht Hannover",
      "registernummer": "GnR 200088",
      "registerart": "GnR",
      "company_name": "Portfolios Finanzmanagement eG",
      "company_seat": "Hannover",
      "details": "28.01.2025 (Bekanntmachungsdatum)\n\nNiedersachsen Amtsgericht Hannover GnR 200088\nRegisterbekanntmachung nach dem Umwandlungsgesetz 28.01.2025 (Eintragungsdatum)\n\nPortfolios Finanzmanagement eG\neingetragene Genossenschaft\nHannover\n\nDen Gläubigern der an der formwechselnden Umwandlung beteiligten Rechtsträger ist, wenn sie binnen sechs Monaten nach dem Tag, an dem die Eintragung der Umwandlung in das Register des Sitzes desjenigen Rechtsträgers, dessen Gläubiger sie sind, nach § 19 Abs. 3 UmwG als bekannt gemacht gilt, ihren Anspruch nach Grund und Höhe schriftlich anmelden, Sicherheit zu leisten, soweit sie nicht Befriedigung verlangen können. Dieses Recht steht den Gläubigern jedoch nur zu, wenn sie glaubhaft machen, dass durch die formwechselnde Umwandlung die Erfüllung der Forderung gefährdet wird."
    },
    {
      "date": "2025-01-28",
      "id": "99814",
      "original_text": "Sonstige Registerbekanntmachung\nNiedersachsen Amtsgericht Hannover HRB 58488\naquaLaatzium Freizeit-GmbH – Laatzen",
      "type": "Sonstige Registerbekanntmachung",
      "state": "Niedersachsen",
      "amtsgericht": "Amtsgericht Hannover",
      "registernummer": "HRB 58488",
      "registerart": "HRB",
      "company_name": "aquaLaatzium Freizeit-GmbH",
      "company_seat": "Laatzen",
      "details": "28.01.2025 (Bekanntmachungsdatum)\n\nNiedersachsen Amtsgericht Hannover HRB 58488\nSonstige Registerbekanntmachung\n\naquaLaatzium Freizeit-GmbH\nGesellschaft mit beschränkter Haftung\nLaatzen\n\nDie Liste der Mitglieder des Aufsichtsrats wurde beim Registergericht eingereicht."
    },
    {
      "date": "2025-01-28",
      "id": "99815",
      "original_text": "Sonstige Registerbekanntmachung\nNiedersachsen Amtsgericht Tostedt GnR 110006 früher Amtsgericht Langen\nMolkerei Lamstedt eG – Lamstedt",
      "type": "Sonstige Registerbekanntmachung",
      "state": "Niedersachsen",
      "amtsgericht": "Amtsgericht Tostedt",
      "registernummer": "GnR 110006",
      "registerart": "GnR",
      "company_name": "Molkerei Lamstedt eG",
      "company_seat": "Lamstedt",
      "former_amtsgericht": "Langen",
      "details": "28.01.2025 (Bekanntmachungsdatum)\n\nNiedersachsen Amtsgericht Tostedt GnR 110006 früher Amtsgericht Langen\nSonstige Registerbekanntmachung 28.06.2024 (Eintragungsdatum)\n\nMolkerei Lamstedt eG\neingetragene Genossenschaft\nLamstedt\n\nNeue Regelung: Die Nachschusspflicht ist ausgeschlossen.. Den Gläubigern der Genossenschaft ist, wenn sie sich binnen sechs Monaten nach dieser Bekanntmachung zu diesem Zweck bei der Genossenschaft melden, Sicherheit zu leisten, soweit sie nicht Befriedigung verlangen können."
    },
    {
      "date": "2025-01-28",
      "id": "99816",
      "original_text": "Einreichung neuer Dokumente\nNiedersachsen Amtsgericht Lüneburg HRB 100001 früher Amtsgericht Celle\nOsthannoversche Eisenbahnen Aktiengesellschaft – Celle",
      "type": "Einreichung neuer Dokumente",
      "state": "Niedersachsen",
      "amtsgericht": "Amtsgericht Lüneburg",
      "registernummer": "HRB 100001",
      "registerart": "HRB",
      "company_name": "Osthannoversche Eisenbahnen Aktiengesellschaft",
      "company_seat": "Celle",
      "former_amtsgericht": "Celle",
      "details": "28.01.2025 (Bekanntmachungsdatum)\n\nNiedersachsen Amtsgericht Lüneburg HRB 100001 früher Amtsgericht Celle\nEinreichung neuer Dokumente\n\nOsthannoversche Eisenbahnen Aktiengesellschaft\nAktiengesellschaft\nCelle\n\nDie Liste der Mitglieder des Aufsichtsrats wurde beim Registergericht eingereicht."
    },
    {
      "date": "2025-01-28",
      "id": "99817",
      "original_text": "Einreichung neuer Dokumente\nNiedersachsen Amtsgericht Braunschweig HRB 206170\nWSN Technologies AG – Braunschweig",
      "type": "Einreichung neuer Dokumente",
      "state": "Niedersachsen",
      "amtsgericht": "Amtsgericht Braunschweig",
      "registernummer": "HRB 206170",
      "registerart": "HRB",
      "company_name": "WSN Technologies AG",
      "company_seat": "Braunschweig",
      "details": "28.01.2025 (Bekanntmachungsdatum)\n\nNiedersachsen Amtsgericht Braunschweig HRB 206170\nEinreichung neuer Dokumente 28.01.2025 (Eintragungsdatum)\n\nWSN Technologies AG\nAktiengesellschaft\nBraunschweig\n\nDie Liste der Mitglieder des Aufsichtsrats wurde beim Registergericht eingereicht."
    },
    {
      "date": "2025-01-28",
      "id": "99818",
      "original_text": "Einreichung neuer Dokumente\nNiedersachsen Amtsgericht Oldenburg (Oldenburg) HRB 3723\nEWE TEL GmbH – Oldenburg",
      "type": "Einreichung neuer Dokumente",
      "state": "Niedersachsen",
      "amtsgericht": "Amtsgericht Oldenburg (Oldenburg)",
      "registernummer": "HRB 3723",
      "registerart": "HRB",
      "company_name": "EWE TEL GmbH",
      "company_seat": "Oldenburg",
      "details": "28.01.2025 (Bekanntmachungsdatum)\n\nNiedersachsen Amtsgericht Oldenburg (Oldenburg) HRB 3723\nEinreichung neuer Dokumente\n\nEWE TEL GmbH\nGesellschaft mit beschränkter Haftung\nOldenburg\n\nDie Liste der Mitglieder des Aufsichtsrats wurde beim Registergericht eingereicht."
    },
    {
      "date": "2025-01-28",
      "id": "99819",
      "original_text": "Registerbekanntmachung nach dem Umwandlungsgesetz\nNiedersachsen Amtsgericht Osnabrück HRB 206895\nKDW Verwaltungs GmbH – Bad Essen",
      "type": "Registerbekanntmachung nach dem Umwandlungsgesetz",
      "state": "Niedersachsen",
      "amtsgericht": "Amtsgericht Osnabrück",
      "registernummer": "HRB 206895",
      "registerart": "HRB",
      "company_name": "KDW Verwaltungs GmbH",
      "company_seat": "Bad Essen",
      "details": "28.01.2025 (Bekanntmachungsdatum)\n\nNiedersachsen Amtsgericht Osnabrück HRB 206895\nRegisterbekanntmachung nach dem Umwandlungsgesetz 28.01.2025 (Eintragungsdatum)\n\nKDW Verwaltungs GmbH\nGesellschaft mit beschränkter Haftung\nBad Essen\n\nDen Gläubigern der an der Verschmelzung beteiligten Rechtsträger ist, wenn sie binnen sechs Monaten nach dem Tag, an dem die Eintragung der Verschmelzung in das Register des Sitzes desjenigen Rechtsträgers, dessen Gläubiger sie sind, nach § 19  Abs.  3 UmwG als bekannt gemacht gilt, ihren Anspruch nach Grund und Höhe schriftlich anmelden, Sicherheit zu leisten, soweit sie nicht Befriedigung verlangen können. Dieses Recht steht den Gläubigern jedoch nur zu, wenn sie glaubhaft machen, dass durch die Verschmelzung die Erfüllung der Forderung gefährdet wird."
    },
    {
      "date": "2025-01-28",
      "id": "99820",
      "original_text": "Löschungsankündigung\nNiedersachsen Amtsgericht Osnabrück HRB 210941\nViktor Müller Bauservice UG (haftungsbeschränkt) – Herzlake",
      "type": "Löschungsankündigung",
      "state": "Niedersachsen",
      "amtsgericht": "Amtsgericht Osnabrück",
      "registernummer": "HRB 210941",
      "registerart": "HRB",
      "company_name": "Viktor Müller Bauservice UG (haftungsbeschränkt)",
      "company_seat": "Herzlake",
      "details": "28.01.2025 (Bekanntmachungsdatum)\n\nNiedersachsen Amtsgericht Osnabrück HRB 210941\nLöschungsankündigung\n\nViktor Müller Bauservice UG (haftungsbeschränkt)\nGesellschaft mit beschränkter Haftung\nHerzlake\n\nDas Registergericht beabsichtigt, die Gesellschaft von Amts wegen nach § 394 FamFG wegen Vermögenslosigkeit zu löschen. Die Frist zur Erhebung eines Widerspruchs ist auf 1 Monat ab dieser Registerbekanntmachung festgesetzt."
    },
    {
      "date": "2025-01-28",
      "id": "99821",
      "original_text": "Registerbekanntmachung nach dem Umwandlungsgesetz\nNiedersachsen Amtsgericht Göttingen HRB 205722\nKWS SAAT SE & Co. KGaA – Einbeck",
      "type": "Registerbekanntmachung nach dem Umwandlungsgesetz",
      "state": "Niedersachsen",
      "amtsgericht": "Amtsgericht Göttingen",
      "registernummer": "HRB 205722",
      "registerart": "HRB",
      "company_name": "KWS SAAT SE & Co. KGaA",
      "company_seat": "Einbeck",
      "details": "28.01.2025 (Bekanntmachungsdatum)\n\nNiedersachsen Amtsgericht Göttingen HRB 205722\nDie Registerbekanntmachung ist nachträglich am 29.01.2025 um 19:02 Uhr gelöscht worden.\nWegen der Einzelheiten und näherer Auskünfte wenden Sie sich bitte an das Amtsgericht Göttingen ."
    },
    {
      "date": "2025-01-28",
      "id": "99822",
      "original_text": "Registerbekanntmachung nach dem Umwandlungsgesetz\nRheinland-Pfalz Amtsgericht Wittlich HRA 41844\nKraus Beteiligungsgesellschaft UG (haftungsbeschränkt) & Co.KG – Saarburg",
      "type": "Registerbekanntmachung nach dem Umwandlungsgesetz",
      "state": "Rheinland-Pfalz",
      "amtsgericht": "Amtsgericht Wittlich",
      "registernummer": "HRA 41844",
      "registerart": "HRA",
      "company_name": "Kraus Beteiligungsgesellschaft UG (haftungsbeschränkt) & Co.KG",
      "company_seat": "Saarburg",
      "details": "28.01.2025 (Bekanntmachungsdatum)\n\nRheinland-Pfalz Amtsgericht Wittlich HRA 41844\nRegisterbekanntmachung nach dem Umwandlungsgesetz 28.01.2025 (Eintragungsdatum)\n\nKraus Beteiligungsgesellschaft UG (haftungsbeschränkt) & Co.KG\nKommanditgesellschaft\nSaarburg\n\nAls nicht eingetragen wird veröffentlicht:\nDen Gläubigern des formwechselnden Rechtsträgers ist, wenn sie binnen sechs Monaten nach dem Tag, an dem die Eintragung des Formwechsels nach § 201 UmwG als bekannt gemacht gilt, ihren Anspruch nach Grund und Höhe schriftlich anmelden, Sicherheit zu leisten, soweit sie nicht Befriedigung verlangen können. Dieses Recht steht den Gläubigern jedoch nur zu, wenn sie glaubhaft machen, dass durch den Formwechsel die Erfüllung der Forderung gefährdet wird."
    },
    {
      "date": "2025-01-28",
      "id": "99823",
      "original_text": "Sonstige Registerbekanntmachung\nRheinland-Pfalz Amtsgericht Mainz HRB 10117\nFlugplatz GmbH Worms – Worms",
      "type": "Sonstige Registerbekanntmachung",
      "state": "Rheinland-Pfalz",
      "amtsgericht": "Amtsgericht Mainz",
      "registernummer": "HRB 10117",
      "registerart": "HRB",
      "company_name": "Flugplatz GmbH Worms",
      "company_seat": "Worms",
      "details": "28.01.2025 (Bekanntmachungsdatum)\n\nRheinland-Pfalz Amtsgericht Mainz HRB 10117\nSonstige Registerbekanntmachung 28.01.2025 (Eintragungsdatum)\n\nFlugplatz GmbH Worms\nGesellschaft mit beschränkter Haftung\nWorms\n\nAls nicht eingetragen wird veröffentlicht: Den Gläubigern der Gesellschaft, deren Forderungen begründet worden sind, bevor die Eintragung der Beendigung des Beherrschungs- und Gewinnabführungsvertrages in das Handelsregister nach § 10 des Handelsgesetzbuches als bekanntgemacht gilt, hat der andere Vertragsteil Sicherheit zu leisten, wenn sie sich binnen sechs Monaten nach der Bekanntmachung der Eintragung zu diesem Zweck bei ihm melden."
    },
    {
      "date": "2025-01-28",
      "id": "99824",
      "original_text": "Löschungsankündigung\nBremen Amtsgericht Bremen HRB 32831\nBR Retail Abwicklungs GmbH – Bremen",
      "type": "Löschungsankündigung",
      "state": "Bremen",
      "amtsgericht": "Amtsgericht Bremen",
      "registernummer": "HRB 32831",
      "registerart": "HRB",
      "company_name": "BR Retail Abwicklungs GmbH",
      "company_seat": "Bremen",
      "details": "28.01.2025 (Bekanntmachungsdatum)\n\nBremen Amtsgericht Bremen HRB 32831\nLöschungsankündigung\n\nBR Retail Abwicklungs GmbH\nGesellschaft mit beschränkter Haftung\nBremen\n\nEs ist beabsichtigt die im Handelsregister eingetragene Gesellschaft von Amts wegen gemäß § 394 FamFG zu löschen. Gegen die Löschung kann beim AG Bremen schriftlich oder zu Protokoll der Geschäftsstelle Widerspruch eingelegt werden. Widerspruchsfrist 4 Wochen."
    },
    {
      "date": "2025-01-28",
      "id": "99825",
      "original_text": "Löschungsankündigung\nBremen Amtsgericht Bremen HRB 29728\nAykut Kaffeekonzepte GmbH – Bremen",
      "type": "Löschungsankündigung",
      "state": "Bremen",
      "amtsgericht": "Amtsgericht Bremen",
      "registernummer": "HRB 29728",
      "registerart": "HRB",
      "company_name": "Aykut Kaffeekonzepte GmbH",
      "company_seat": "Bremen",
      "details": "28.01.2025 (Bekanntmachungsdatum)\n\nBremen Amtsgericht Bremen HRB 29728\nLöschungsankündigung\n\nAykut Kaffeekonzepte GmbH\nGesellschaft mit beschränkter Haftung\nBremen\n\nEs ist beabsichtigt die im Handelsregister eingetragene Gesellschaft von Amts wegen gemäß § 394 FamFG zu löschen. Gegen die Löschung kann beim AG Bremen schriftlich oder zu Protokoll der Geschäftsstelle Widerspruch eingelegt werden. Widerspruchsfrist 4 Wochen."
    },
    {
      "date": "2025-01-28",
      "id": "99826",
      "original_text": "Sonstige Registerbekanntmachung\nBremen Amtsgericht Bremen HRB 3354\nWFB Wirtschaftsförderung Bremen GmbH – Bremen",
      "type": "Sonstige Registerbekanntmachung",
      "state": "Bremen",
      "amtsgericht": "Amtsgericht Bremen",
      "registernummer": "HRB 3354",
      "registerart": "HRB",
      "company_name": "WFB Wirtschaftsförderung Bremen GmbH",
      "company_seat": "Bremen",
      "details": "28.01.2025 (Bekanntmachungsdatum)\n\nBremen Amtsgericht Bremen HRB 3354\nSonstige Registerbekanntmachung\n\nWFB Wirtschaftsförderung Bremen GmbH\nGesellschaft mit beschränkter Haftung\nBremen\n\nAls nicht eingetragen wird bekannt gemacht: Liste des Aufsichtsrats wurde eingereicht."
    },
    {
      "date": "2025-01-28",
      "id": "99827",
      "original_text": "Löschungsankündigung\nBremen Amtsgericht Bremen HRB 38118\nWeser Bauprojekt GmbH – Bremen",
      "type": "Löschungsankündigung",
      "state": "Bremen",
      "amtsgericht": "Amtsgericht Bremen",
      "registernummer": "HRB 38118",
      "registerart": "HRB",
      "company_name": "Weser Bauprojekt GmbH",
      "company_seat": "Bremen",
      "details": "28.01.2025 (Bekanntmachungsdatum)\n\nBremen Amtsgericht Bremen HRB 38118\nLöschungsankündigung\n\nWeser Bauprojekt GmbH\nGesellschaft mit beschränkter Haftung\nBremen\n\nEs ist beabsichtigt die im Handelsregister eingetragene Gesellschaft von Amts wegen gemäß § 394 FamFG zu löschen. Gegen die Löschung kann beim AG Bremen schriftlich oder zu Protokoll der Geschäftsstelle Widerspruch eingelegt werden. Widerspruchsfrist 4 Wochen."
    },
    {
      "date": "2025-01-28",
      "id": "99828",
      "original_text": "Löschungsankündigung\nNordrhein-Westfalen Amtsgericht Mönchengladbach HRB 9060\nAutohaus Marion Müller-Platz GmbH – Wegberg",
      "type": "Löschungsankündigung",
      "state": "Nordrhein-Westfalen",
      "amtsgericht": "Amtsgericht Mönchengladbach",
      "registernummer": "HRB 9060",
      "registerart": "HRB",
      "company_name": "Autohaus Marion Müller-Platz GmbH",
      "company_seat": "Wegberg",
      "details": "28.01.2025 (Bekanntmachungsdatum)\n\nNordrhein-Westfalen Amtsgericht Mönchengladbach HRB 9060\nLöschungsankündigung 28.01.2025 (Eintragungsdatum)\n\nAutohaus Marion Müller-Platz GmbH\nGesellschaft mit beschränkter Haftung\nWegberg\n\nDas Registergericht beabsichtigt die Gesellschaft von Amts wegen nach § 394 FamFG zu löschen. Die Frist zur Erhebung eines Widerspruchs ist auf #DV.Fr(Text=\"Bitte wählen Sie die Widerspruchsfrist aus!\",Eingabe=\"einen Monat\",\"zwei Monate\",\"drei Monate\",\"#insert(Text=\"Freitext\")\"|\"freier Text\") festgesetzt."
    },
    {
      "date": "2025-01-28",
      "id": "99829",
      "original_text": "Löschungsankündigung\nNordrhein-Westfalen Amtsgericht Neuss HRB 23184\nATRIMMO Projektentwicklung GmbH – Neuss",
      "type": "Löschungsankündigung",
      "state": "Nordrhein-Westfalen",
      "amtsgericht": "Amtsgericht Neuss",
      "registernummer": "HRB 23184",
      "registerart": "HRB",
      "company_name": "ATRIMMO Projektentwicklung GmbH",
      "company_seat": "Neuss",
      "details": "28.01.2025 (Bekanntmachungsdatum)\n\nNordrhein-Westfalen Amtsgericht Neuss HRB 23184\nLöschungsankündigung 27.01.2025 (Eintragungsdatum)\n\nATRIMMO Projektentwicklung GmbH\nGesellschaft mit beschränkter Haftung\nNeuss\n\nDas Registergericht beabsichtigt die Gesellschaft von Amts wegen nach § 394 FamFG zu löschen. Die Frist zur Erhebung eines Widerspruchs ist auf einen Monat festgesetzt. Rechtsbehelfsbelehrung: Gegen diese Verfügung können Sie Widerspruch einlegen. Der Widerspruch ist bei dem Amtsgericht Neuss - Registergericht -, Breite Str. 48, 41460 Neuss schriftlich in deutscher Sprache oder zur Niederschrift der Geschäftsstelle einzulegen. Der Widerspruch kann auch zur Niederschrift der Geschäftsstelle eines jeden Amtsgerichtes abgegeben werden. Die Einlegung ist auch durch Übertragung eines elektronischen Dokuments an die elektronische Poststelle des Gerichts möglich. Das elektronische Dokument muss für die Bearbeitung durch das Gericht geeignet und mit einer qualifizierten elektronischen Signatur der verantwortenden Person versehen sein oder von der verantwortenden Person signiert und auf einem sicheren Übermittlungsweg gemäß § 130a ZPO nach näherer Maßgabe der Verordnung über die technischen Rahmenbedingungen des elektronischen Rechtsverkehrs und über das besondere elektronische Behördenpostfach (BGBl. I, S.3803) eingereicht werden. Weitere Informationen erhalten Sie auf der Internetseite www.justiz.de. Der Widerspruch muss spätestens innerhalb der gesetzten Frist nach der schriftlichen Bekanntgabe der Verfügung bei dem Amtsgericht - Registergericht - Neuss eingegangen sein. Dies gilt auch dann, wenn der Widerspruch zur Niederschrift der Geschäftsstelle eines anderen Amtsgerichtes abgegeben wurde. Die Frist beginnt mit der schriftlichen Bekanntgabe der Verfügung. Die Bekanntgabe ist entweder durch Zustellung oder am dritten Tage nach Aufgabe zur Post bewirkt. Fällt das Ende der Frist auf einen Sonntag, einen allgemeinen Feiertag oder Sonnabend, so endet die Frist mit Ablauf des nächsten Werktages. Der Widerspruch muss die Bezeichnung der angefochtenen Verfügung sowie die Erklärung enthalten, dass Widerspruch gegen diese Verfügung eingelegt wird. Er ist zu unterzeichnen und soll begründet werden."
    },
    {
      "date": "2025-01-28",
      "id": "99830",
      "original_text": "Einreichung neuer Dokumente\nNordrhein-Westfalen Amtsgericht Duisburg HRB 105\nGrillo-Werke Aktiengesellschaft – Duisburg",
      "type": "Einreichung neuer Dokumente",
      "state": "Nordrhein-Westfalen",
      "amtsgericht": "Amtsgericht Duisburg",
      "registernummer": "HRB 105",
      "registerart": "HRB",
      "company_name": "Grillo-Werke Aktiengesellschaft",
      "company_seat": "Duisburg",
      "details": "28.01.2025 (Bekanntmachungsdatum)\n\nNordrhein-Westfalen Amtsgericht Duisburg HRB 105\nEinreichung neuer Dokumente\n\nGrillo-Werke Aktiengesellschaft\nAktiengesellschaft\nDuisburg\n\nDem Registergericht ist eine Liste der Mitglieder des Aufsichtsrates eingereicht worden."
    },
    {
      "date": "2025-01-28",
      "id": "99831",
      "original_text": "Löschungsankündigung\nNordrhein-Westfalen Amtsgericht Steinfurt HRB 13443\nIFRI-SOL GmbH – Neuenkirchen",
      "type": "Löschungsankündigung",
      "state": "Nordrhein-Westfalen",
      "amtsgericht": "Amtsgericht Steinfurt",
      "registernummer": "HRB 13443",
      "registerart": "HRB",
      "company_name": "IFRI-SOL GmbH",
      "company_seat": "Neuenkirchen",
      "details": "28.01.2025 (Bekanntmachungsdatum)\n\nNordrhein-Westfalen Amtsgericht Steinfurt HRB 13443\nLöschungsankündigung\n\nIFRI-SOL GmbH\nGesellschaft mit beschränkter Haftung\nNeuenkirchen\n\nDas Registergericht beabsichtigt, die im Handelsregister eingetragene Gesellschaft gemäß § 394 Absatz 1 FamFG wegen Vermögenslosigkeit von Amts wegen zu löschen.\n\nGegen diese Verfügung kann Widerspruch eingelegt werden. Die Frist zur Erhebung eines Widerspruchs gegen die beabsichtigte Löschung von Amts wegen ist auf einen Monat festgesetzt.\n\nRechtsbehelfsbelehrung:\n\nGegen diese Verfügung können Sie Widerspruch einlegen.\n\nDer Widerspruch ist bei dem Amtsgericht Steinfurt, Gerichtstraße 2, 48565 Steinfurt schriftlich in deutscher Sprache oder zur Niederschrift der Geschäftsstelle einzulegen. Der Widerspruch kann auch zur Niederschrift der Geschäftsstelle eines jeden Amtsgerichtes abgegeben werden.\nDie Einlegung ist auch durch Übertragung eines elektronischen Dokuments an die elektronische Poststelle des Gerichts möglich. Das elektronische Dokument muss für die Bearbeitung durch das Gericht geeignet und mit einer qualifizierten elektronischen Signatur der verantwortenden Person versehen sein oder von der verantwortenden Person signiert und auf einem sicheren Übermittlungsweg gemäß § 130a ZPO nach näherer Maßgabe der Verordnung über die technischen Rahmenbedingungen des elektronischen Rechtsverkehrs und über das besondere elektronische Behördenpostfach (BGBl. I, S.3803) eingereicht werden. Weitere Informationen erhalten Sie auf der Internetseite www.justiz.de.\n\nDer Widerspruch muss spätestens innerhalb der gesetzten Frist bei dem Amtsgericht Steinfurt eingegangen sein. Dies gilt auch dann, wenn der Widerspruch zur Niederschrift der Geschäftsstelle eines anderen Amtsgerichtes abgegeben wurde. Die Frist beginnt mit der Veröffentlichung. Fällt das Ende der Frist auf einen Sonntag, einen allgemeinen Feiertag oder Sonnabend, so endet die Frist mit Ablauf des nächsten Werktages.\n\nDer Widerspruch muss die Bezeichnung der angefochtenen Verfügung sowie die Erklärung enthalten, dass Widerspruch gegen diese Verfügung eingelegt wird. Er ist zu unterzeichnen und soll begründet werden."
    },
    {
      "date": "2025-01-28",
      "id": "99832",
      "original_text": "Löschungsankündigung\nNordrhein-Westfalen Amtsgericht Mönchengladbach HRB 21713\nEF Vermietung- und Dienstleistung UG (haftungsbeschränkt) – Mönchengladbach",
      "type": "Löschungsankündigung",
      "state": "Nordrhein-Westfalen",
      "amtsgericht": "Amtsgericht Mönchengladbach",
      "registernummer": "HRB 21713",
      "registerart": "HRB",
      "company_name": "EF Vermietung- und Dienstleistung UG (haftungsbeschränkt)",
      "company_seat": "Mönchengladbach",
      "details": "28.01.2025 (Bekanntmachungsdatum)\n\nNordrhein-Westfalen Amtsgericht Mönchengladbach HRB 21713\nLöschungsankündigung\n\nEF Vermietung- und Dienstleistung UG (haftungsbeschränkt)\nGesellschaft mit beschränkter Haftung\nMönchengladbach\n\nEF Vermietung- und Dienstleistung UG (haftungsbeschränkt), Mönchengladbach (Amtsgericht Mönchengladbach, HRB 21713).\nDas Registergericht beabsichtigt, die im Handelsregister eingetragene Gesellschaft gemäß § 394 Absatz 1 FamFG wegen Vermögenslosigkeit von Amts wegen zu löschen. Gegen diese Verfügung kann Widerspruch eingelegt werden. Die Frist zur Erhebung eines Widerspruchs gegen die beabsichtigte Löschung von Amts wegen ist auf drei Monate festgesetzt."
    },
    {
      "date": "2025-01-28",
      "id": "99833",
      "original_text": "Löschungsankündigung\nNordrhein-Westfalen Amtsgericht Kleve HRB 15776\nm.f.m. Bauprojekte GmbH – Moers",
      "type": "Löschungsankündigung",
      "state": "Nordrhein-Westfalen",
      "amtsgericht": "Amtsgericht Kleve",
      "registernummer": "HRB 15776",
      "registerart": "HRB",
      "company_name": "m.f.m. Bauprojekte GmbH",
      "company_seat": "Moers",
      "details": "28.01.2025 (Bekanntmachungsdatum)\n\nNordrhein-Westfalen Amtsgericht Kleve HRB 15776\nLöschungsankündigung\n\nm.f.m. Bauprojekte GmbH\nGesellschaft mit beschränkter Haftung\nMoers\n\nDas Registergericht beabsichtigt die Gesellschaft von Amts wegen nach § 394 FamFG zu löschen. Die Frist zur Erhebung eines Widerspruchs ist auf einen Monat festgesetzt."
    },
    {
      "date": "2025-01-28",
      "id": "99834",
      "original_text": "Löschungsankündigung\nNordrhein-Westfalen Amtsgericht Mönchengladbach HRB 7605\nANNA Fashion GmbH – Grevenbroich",
      "type": "Löschungsankündigung",
      "state": "Nordrhein-Westfalen",
      "amtsgericht": "Amtsgericht Mönchengladbach",
      "registernummer": "HRB 7605",
      "registerart": "HRB",
      "company_name": "ANNA Fashion GmbH",
      "company_seat": "Grevenbroich",
      "details": "28.01.2025 (Bekanntmachungsdatum)\n\nNordrhein-Westfalen Amtsgericht Mönchengladbach HRB 7605\nLöschungsankündigung\n\nANNA Fashion GmbH\nGesellschaft mit beschränkter Haftung\nGrevenbroich\n\nDas Registergericht beabsichtigt, die im Handelsregister eingetragene Gesellschaft gemäß § 394 Absatz 1 FamFG wegen Vermögenslosigkeit von Amts wegen zu löschen. Gegen diese Verfügung kann Widerspruch eingelegt werden. Die Frist zur Erhebung eines Widerspruchs gegen die beabsichtigte Löschung von Amts wegen ist auf zwei Monate festgesetzt."
    },
    {
      "date": "2025-01-28",
      "id": "99835",
      "original_text": "Einreichung neuer Dokumente\nNordrhein-Westfalen Amtsgericht Essen HRB 19649\nSTEAG GmbH – Essen",
      "type": "Einreichung neuer Dokumente",
      "state": "Nordrhein-Westfalen",
      "amtsgericht": "Amtsgericht Essen",
      "registernummer": "HRB 19649",
      "registerart": "HRB",
      "company_name": "STEAG GmbH",
      "company_seat": "Essen",
      "details": "28.01.2025 (Bekanntmachungsdatum)\n\nNordrhein-Westfalen Amtsgericht Essen HRB 19649\nEinreichung neuer Dokumente\n\nSTEAG GmbH\nGesellschaft mit beschränkter Haftung\nEssen\n\nDem Registergericht ist eine neue Liste der Mitglieder des Aufsichtsrates eingereicht worden."
    },
    {
      "date": "2025-01-28",
      "id": "99836",
      "original_text": "Löschungsankündigung\nNordrhein-Westfalen Amtsgericht Neuss HRA 5270\nGraham Whitelaw Transporte e. K. – Dormagen",
      "type": "Löschungsankündigung",
      "state": "Nordrhein-Westfalen",
      "amtsgericht": "Amtsgericht Neuss",
      "registernummer": "HRA 5270",
      "registerart": "HRA",
      "company_name": "Graham Whitelaw Transporte e. K.",
      "company_seat": "Dormagen",
      "details": "28.01.2025 (Bekanntmachungsdatum)\n\nNordrhein-Westfalen Amtsgericht Neuss HRA 5270\nLöschungsankündigung 28.01.2025 (Eintragungsdatum)\n\nGraham Whitelaw Transporte e. K.\nEinzelkaufmann / Einzelkauffrau\nDormagen\n\nDas Registergericht beabsichtigt die Einzelfirma ist im Handelsregister von Amts wegen gemäß § 31 Absatz II HGB i.V. m. § 393 FamFG zu löschen. Gegen die Löschung kann binnen zwei Monaten jeder Widerspruch erheben, der an der Unterlassung der Löschung ein berechtigtes Interesse hat."
    },
    {
      "date": "2025-01-28",
      "id": "99837",
      "original_text": "Einreichung neuer Dokumente\nNordrhein-Westfalen Amtsgericht Düren HRB 9005\nCTH Conrads Technologie und Holding AG – Jülich",
      "type": "Einreichung neuer Dokumente",
      "state": "Nordrhein-Westfalen",
      "amtsgericht": "Amtsgericht Düren",
      "registernummer": "HRB 9005",
      "registerart": "HRB",
      "company_name": "CTH Conrads Technologie und Holding AG",
      "company_seat": "Jülich",
      "details": "28.01.2025 (Bekanntmachungsdatum)\n\nNordrhein-Westfalen Amtsgericht Düren HRB 9005\nEinreichung neuer Dokumente 27.01.2025 (Eintragungsdatum)\n\nCTH Conrads Technologie und Holding AG\nAktiengesellschaft\nJülich\n\nDem Registergericht ist eine neue Liste der Mitglieder des Aufsichtsrates eingereicht worden."
    },
    {
      "date": "2025-01-28",
      "id": "99838",
      "original_text": "Einreichung neuer Dokumente\nNordrhein-Westfalen Amtsgericht Essen HRB 31635\nSTEAG Power GmbH – Essen",
      "type": "Einreichung neuer Dokumente",
      "state": "Nordrhein-Westfalen",
      "amtsgericht": "Amtsgericht Essen",
      "registernummer": "HRB 31635",
      "registerart": "HRB",
      "company_name": "STEAG Power GmbH",
      "company_seat": "Essen",
      "details": "28.01.2025 (Bekanntmachungsdatum)\n\nNordrhein-Westfalen Amtsgericht Essen HRB 31635\nEinreichung neuer Dokumente\n\nSTEAG Power GmbH\nGesellschaft mit beschränkter Haftung\nEssen\n\nDem Registergericht ist eine neue Liste der Mitglieder des Aufsichtsrates eingereicht worden."
    },
    {
      "date": "2025-01-28",
      "id": "99839",
      "original_text": "Einreichung neuer Dokumente\nNordrhein-Westfalen Amtsgericht Köln HRB 54183\nFord-Werke GmbH – Köln",
      "type": "Einreichung neuer Dokumente",
      "state": "Nordrhein-Westfalen",
      "amtsgericht": "Amtsgericht Köln",
      "registernummer": "HRB 54183",
      "registerart": "HRB",
      "company_name": "Ford-Werke GmbH",
      "company_seat": "Köln",
      "details": "28.01.2025 (Bekanntmachungsdatum)\n\nNordrhein-Westfalen Amtsgericht Köln HRB 54183\nEinreichung neuer Dokumente 28.01.2025 (Eintragungsdatum)\n\nFord-Werke GmbH\nGesellschaft mit beschränkter Haftung\nKöln\n\nDem Registergericht ist eine neue Liste der Mitglieder des Aufsichtsrates eingereicht worden."
    },
    {
      "date": "2025-01-28",
      "id": "99840",
      "original_text": "Löschungsankündigung\nNordrhein-Westfalen Amtsgericht Wuppertal HRB 22929\nL 4 GmbH – Wuppertal",
      "type": "Löschungsankündigung",
      "state": "Nordrhein-Westfalen",
      "amtsgericht": "Amtsgericht Wuppertal",
      "registernummer": "HRB 22929",
      "registerart": "HRB",
      "company_name": "L 4 GmbH",
      "company_seat": "Wuppertal",
      "details": "28.01.2025 (Bekanntmachungsdatum)\n\nNordrhein-Westfalen Amtsgericht Wuppertal HRB 22929\nLöschungsankündigung 27.01.2025 (Eintragungsdatum)\n\nL 4 GmbH\nGesellschaft mit beschränkter Haftung\nWuppertal\n\nDas Registergericht beabsichtigt die Gesellschaft von Amts wegen nach § 394 FamFG zu löschen. Die Frist zur Erhebung eines Widerspruchs ist auf einen Monat festgesetzt."
    },
    {
      "date": "2025-01-28",
      "id": "99841",
      "original_text": "Registerbekanntmachung nach dem Umwandlungsgesetz\nNordrhein-Westfalen Amtsgericht Münster HRA 11992\nWaschmaxX e. K., Inhaber Helmuth Heitmann – Warendorf",
      "type": "Registerbekanntmachung nach dem Umwandlungsgesetz",
      "state": "Nordrhein-Westfalen",
      "amtsgericht": "Amtsgericht Münster",
      "registernummer": "HRA 11992",
      "registerart": "HRA",
      "company_name": "WaschmaxX e. K., Inhaber Helmuth Heitmann",
      "company_seat": "Warendorf",
      "details": "28.01.2025 (Bekanntmachungsdatum)\n\nNordrhein-Westfalen Amtsgericht Münster HRA 11992\nRegisterbekanntmachung nach dem Umwandlungsgesetz 09.01.2025 (Eintragungsdatum)\n\nWaschmaxX e. K., Inhaber Helmuth Heitmann\nEinzelkaufmann / Einzelkauffrau\nWarendorf\n\nDen Gläubigern der an der Ausgliederung beteiligten Rechtsträger ist, wenn sie binnen sechs Monaten nach dem Tag, an dem die Eintragung der Ausgliederung in das Register des Sitzes desjenigen Rechtsträgers, dessen Gläubiger sie sind, nach § 19 Absatz 3 UmwG als bekanntgemacht gilt, ihren Anspruch nach Grund und Höhe schriftlich anmelden, Sicherheit zu leisten, soweit sie nicht Befriedigung verlangen können. Dieses Recht steht den Gläubigern jedoch nur zu, wenn sie glaubhaft machen, dass durch die Ausgliederung die Erfüllung ihrer Forderung gefährdet wird."
    },
    {
      "date": "2025-01-28",
      "id": "99842",
      "original_text": "Löschungsankündigung\nNordrhein-Westfalen Amtsgericht Mönchengladbach HRB 20949\nda Piero UG (haftungsbeschränkt) – Viersen",
      "type": "Löschungsankündigung",
      "state": "Nordrhein-Westfalen",
      "amtsgericht": "Amtsgericht Mönchengladbach",
      "registernummer": "HRB 20949",
      "registerart": "HRB",
      "company_name": "da Piero UG (haftungsbeschränkt)",
      "company_seat": "Viersen",
      "details": "28.01.2025 (Bekanntmachungsdatum)\n\nNordrhein-Westfalen Amtsgericht Mönchengladbach HRB 20949\nLöschungsankündigung\n\nda Piero UG (haftungsbeschränkt)\nGesellschaft mit beschränkter Haftung\nViersen\n\nda Piero UG (haftungsbeschränkt), Viersen, (Amtsgericht Mönchengladbach, HRB 20949).\nDas Registergericht beabsichtigt, die im Handelsregister eingetragene Gesellschaft gemäß § 394 Absatz 1 FamFG wegen Vermögenslosigkeit von Amts wegen zu löschen. Gegen diese Verfügung kann Widerspruch eingelegt werden. Die Frist zur Erhebung eines Widerspruchs gegen die beabsichtigte Löschung von Amts wegen ist auf drei Monate festgesetzt."
    },
    {
      "date": "2025-01-28",
      "id": "99843",
      "original_text": "Löschungsankündigung\nNordrhein-Westfalen Amtsgericht Aachen HRA 9144\nLava Lounge Aachen UG (haftungsbeschränkt) & Co. KG – Aachen",
      "type": "Löschungsankündigung",
      "state": "Nordrhein-Westfalen",
      "amtsgericht": "Amtsgericht Aachen",
      "registernummer": "HRA 9144",
      "registerart": "HRA",
      "company_name": "Lava Lounge Aachen UG (haftungsbeschränkt) & Co. KG",
      "company_seat": "Aachen",
      "details": "28.01.2025 (Bekanntmachungsdatum)\n\nNordrhein-Westfalen Amtsgericht Aachen HRA 9144\nLöschungsankündigung\n\nLava Lounge Aachen UG (haftungsbeschränkt) & Co. KG\nKommanditgesellschaft\nAachen\n\nDas Registergericht beabsichtigt, von Amts wegen die Gesellschaft wegen Vermögenslosigkeit nach § 394 FamFG zu löschen.\n\nZur Geltendmachung des Widerspruchs gegen die beabsichtigte Löschung wird hiermit eine Frist von einem Monat ab Veröffentlichung dieser Ankündigung bestimmt.\n\nRechtsbehelfsbelehrung:\n\nGegen diese Verfügung kann Widerspruch eingelegt werden. Zum Widerspruch ist jeder berechtigt, der an der Unterlassung der Löschung ein berechtigtes Interesse hat.\n\nDer Widerspruch ist bei dem Amtsgericht Aachen, Adalbertsteinweg 92, 52070 Aachen schriftlich in deutscher Sprache oder zur Niederschrift der Geschäftsstelle einzulegen. Der Widerspruch kann auch zur Niederschrift der Geschäftsstelle eines jeden Amtsgerichtes abgegeben werden.\n\nDer Widerspruch muss spätestens innerhalb der gesetzten Frist nach der Bekanntgabe der Verfügung bei dem Amtsgericht Aachen eingegangen sein. Dies gilt auch dann, wenn der Widerspruch zur Niederschrift der Geschäftsstelle eines anderen Amtsgerichtes abgegeben wurde. Die Frist beginnt mit der Bekanntgabe der Verfügung durch Veröffentlichung. Fällt das Ende der Frist auf einen Sonntag, einen allgemeinen Feiertag oder Sonnabend, so endet die Frist mit Ablauf des nächsten Werktages.\n\nDer Widerspruch muss die Bezeichnung der angefochtenen Verfügung sowie die Erklärung enthalten, dass Widerspruch gegen diese Verfügung eingelegt wird. Er ist zu unterzeichnen und soll begründet werden.\n\nDie Einlegung ist auch durch Übertragung eines elektronischen Dokuments an die elektronische Poststelle des Gerichts möglich. Das elektronische Dokument muss für die Bearbeitung durch das Gericht geeignet und mit einer qualifizierten elektronischen Signatur der verantwortenden Person versehen sein oder von der verantwortenden Person signiert und auf einem sicheren Übermittlungsweg gemäß § 130 a ZPO nach näherer Maßgabe der Verordnung über die technischen Rahmenbedingungen des elektronischen Rechtsverkehrs und über das besondere elektronische Behördenpostfach (BGBl. I, S. 3803) eingereicht werden. Weitere Informationen erhalten Sie auf der Internetseite www.justiz.de."
    },
    {
      "date": "2025-01-28",
      "id": "99844",
      "original_text": "Löschungsankündigung\nNordrhein-Westfalen Amtsgericht Siegen HRB 12280\nNew YZM Technology GmbH – Wilnsdorf",
      "type": "Löschungsankündigung",
      "state": "Nordrhein-Westfalen",
      "amtsgericht": "Amtsgericht Siegen",
      "registernummer": "HRB 12280",
      "registerart": "HRB",
      "company_name": "New YZM Technology GmbH",
      "company_seat": "Wilnsdorf",
      "details": "28.01.2025 (Bekanntmachungsdatum)\n\nNordrhein-Westfalen Amtsgericht Siegen HRB 12280\nLöschungsankündigung\n\nNew YZM Technology GmbH\nGesellschaft mit beschränkter Haftung\nWilnsdorf\n\nDas Registergericht beabsichtigt die Gesellschaft von Amts wegen nach § 394 FamFG zu löschen. Die Frist zur Erhebung eines Widerspruchs ist auf drei Monate festgesetzt."
    },
    {
      "date": "2025-01-28",
      "id": "99845",
      "original_text": "Löschungsankündigung\nHessen Amtsgericht Frankfurt am Main HRB 102736\nBoomer GmbH – Frankfurt am Main",
      "type": "Löschungsankündigung",
      "state": "Hessen",
      "amtsgericht": "Amtsgericht Frankfurt am Main",
      "registernummer": "HRB 102736",
      "registerart": "HRB",
      "company_name": "Boomer GmbH",
      "company_seat": "Frankfurt am Main",
      "details": "28.01.2025 (Bekanntmachungsdatum)\n\nHessen Amtsgericht Frankfurt am Main HRB 102736\nLöschungsankündigung\n\nBoomer GmbH\nGesellschaft mit beschränkter Haftung\nFrankfurt am Main\n\nEs ist beabsichtigt die Gesellschaft wegen Vermögenslosigkeit gemäß § 394 FamFG von Amts wegen zu löschen. Hiergegen kann innerhalb eines Monats nach dieser Veröffentlichung Widerspruch bei dem Amtsgericht Frankfurt am Main eingelegt werden."
    },
    {
      "date": "2025-01-28",
      "id": "99846",
      "original_text": "Registerbekanntmachung nach dem Umwandlungsgesetz\nHessen Amtsgericht Frankfurt am Main HRB 135466\nKSL Joining Technology GmbH – Frankfurt am Main",
      "type": "Registerbekanntmachung nach dem Umwandlungsgesetz",
      "state": "Hessen",
      "amtsgericht": "Amtsgericht Frankfurt am Main",
      "registernummer": "HRB 135466",
      "registerart": "HRB",
      "company_name": "KSL Joining Technology GmbH",
      "company_seat": "Frankfurt am Main",
      "details": "28.01.2025 (Bekanntmachungsdatum)\n\nHessen Amtsgericht Frankfurt am Main HRB 135466\nRegisterbekanntmachung nach dem Umwandlungsgesetz 28.01.2025 (Eintragungsdatum)\n\nKSL Joining Technology GmbH\nGesellschaft mit beschränkter Haftung\nFrankfurt am Main\n\nDen Gläubigern der an der Abspaltung beteiligten Rechtsträger ist, wenn sie binnen sechs Monaten nach dem Tag, an dem die Eintragung der Ausgliederung in das Register des Sitzes desjenigen Rechtsträgers, dessen Gläubiger sie sind, nach §§ 125, 19 Absatz 3 UmwG bekannt gemacht worden ist, ihren Anspruch nach Grund und Höhe schriftlich anmelden, Sicherheit zu leisten, soweit sie nicht Befriedigung verlangen können. Dieses Recht steht den Gläubigern jedoch nur zu, wenn sie glaubhaft machen, dass durch die Ausgliederung die Erfüllung ihrer Forderung gefährdet wird."
    },
    {
      "date": "2025-01-28",
      "id": "99847",
      "original_text": "Löschungsankündigung\nHessen Amtsgericht Darmstadt VR 20687\nSozialwerk der Beschäftigten beim Kreisausschuß des Kreises Bergstraße – Heppenheim (Bergstraße)",
      "type": "Löschungsankündigung",
      "state": "Hessen",
      "amtsgericht": "Amtsgericht Darmstadt",
      "registernummer": "VR 20687",
      "registerart": "VR",
      "company_name": "Sozialwerk der Beschäftigten beim Kreisausschuß des Kreises Bergstraße",
      "company_seat": "Heppenheim (Bergstraße)",
      "details": "28.01.2025 (Bekanntmachungsdatum)\n\nHessen Amtsgericht Darmstadt VR 20687\nLöschungsankündigung 28.01.2025 (Eintragungsdatum)\n\nSozialwerk der Beschäftigten beim Kreisausschuß des Kreises Bergstraße\neingetragener Verein\nHeppenheim (Bergstraße)\n\nDer Verein ist aufgelöst."
    },
    {
      "date": "2025-01-28",
      "id": "99848",
      "original_text": "Löschungsankündigung\nHessen Amtsgericht Frankfurt am Main HRB 101116\nGalaxy Way GmbH – Liederbach",
      "type": "Löschungsankündigung",
      "state": "Hessen",
      "amtsgericht": "Amtsgericht Frankfurt am Main",
      "registernummer": "HRB 101116",
      "registerart": "HRB",
      "company_name": "Galaxy Way GmbH",
      "company_seat": "Liederbach",
      "details": "28.01.2025 (Bekanntmachungsdatum)\n\nHessen Amtsgericht Frankfurt am Main HRB 101116\nLöschungsankündigung\n\nGalaxy Way GmbH\nGesellschaft mit beschränkter Haftung\nLiederbach\n\nDas Registergericht beabsichtigt die im Handelsregister eingetragene Gesellschaft von Amts wegen nach § 394 FamFG zu löschen. Hiergegen kann innerhalb eines Zeitraums von 1 Moat nach dieser Veröffentlichung Wiederspruch bei dem Amtsgericht Frankfurt am Main eingelegt werden."
    },
    {
      "date": "2025-01-28",
      "id": "99849",
      "original_text": "Löschungsankündigung\nHessen Amtsgericht Frankfurt am Main VR 7652\nSozial-Werk des Verbandes Frankfurter Frauen für Kultur und Bildung – Frankfurt am Main",
      "type": "Löschungsankündigung",
      "state": "Hessen",
      "amtsgericht": "Amtsgericht Frankfurt am Main",
      "registernummer": "VR 7652",
      "registerart": "VR",
      "company_name": "Sozial-Werk des Verbandes Frankfurter Frauen für Kultur und Bildung",
      "company_seat": "Frankfurt am Main",
      "details": "28.01.2025 (Bekanntmachungsdatum)\n\nHessen Amtsgericht Frankfurt am Main VR 7652\nLöschungsankündigung 28.01.2025 (Eintragungsdatum)\n\nSozial-Werk des Verbandes Frankfurter Frauen für Kultur und Bildung\neingetragener Verein\nFrankfurt am Main"
    },
    {
      "date": "2025-01-28",
      "id": "99850",
      "original_text": "Registerbekanntmachung nach dem Umwandlungsgesetz\nHessen Amtsgericht Frankfurt am Main HRB 94894\nPrema Gebäudedienste GmbH – Sulzbach",
      "type": "Registerbekanntmachung nach dem Umwandlungsgesetz",
      "state": "Hessen",
      "amtsgericht": "Amtsgericht Frankfurt am Main",
      "registernummer": "HRB 94894",
      "registerart": "HRB",
      "company_name": "Prema Gebäudedienste GmbH",
      "company_seat": "Sulzbach",
      "details": "28.01.2025 (Bekanntmachungsdatum)\n\nHessen Amtsgericht Frankfurt am Main HRB 94894\nRegisterbekanntmachung nach dem Umwandlungsgesetz 28.01.2025 (Eintragungsdatum)\n\nPrema Gebäudedienste GmbH\nGesellschaft mit beschränkter Haftung\nSulzbach\n\nDen Gläubigern der an der Verschmelzung beteiligten Rechtsträger ist, wenn sie binnen sechs Monaten nach dem Tag, an dem die Eintragung der Verschmelzung in das Register des Sitzes derjenigen Rechtsträger deren Gläubiger sie sind, nach § 19 Absatz 3 UmwG bekannt gemacht worden ist, ihren Anspruch nach Grund und Höhe schriftlich anmelden, Sicherheit zu leisten, soweit sie nicht Befriedigung verlangen können. Dieses Recht steht den Gläubigern jedoch nur zu, wenn sie glaubhaft machen, dass durch die Verschmelzung die Erfüllung ihrer Forderung gefährdet wird."
    },
    {
      "date": "2025-01-28",
      "id": "99851",
      "original_text": "Löschungsankündigung\nHessen Amtsgericht Frankfurt am Main VR 4447\nPhotoindustrie-Verband – Frankfurt am Main",
      "type": "Löschungsankündigung",
      "state": "Hessen",
      "amtsgericht": "Amtsgericht Frankfurt am Main",
      "registernummer": "VR 4447",
      "registerart": "VR",
      "company_name": "Photoindustrie-Verband",
      "company_seat": "Frankfurt am Main",
      "details": "28.01.2025 (Bekanntmachungsdatum)\n\nHessen Amtsgericht Frankfurt am Main VR 4447\nLöschungsankündigung 28.01.2025 (Eintragungsdatum)\n\nPhotoindustrie-Verband\neingetragener Verein\nFrankfurt am Main"
    },
    {
      "date": "2025-01-28",
      "id": "99852",
      "original_text": "Registerbekanntmachung nach dem Umwandlungsgesetz\nHessen Amtsgericht Frankfurt am Main HRB 51790\nOCS Office Clean Service GmbH – Frankfurt am Main",
      "type": "Registerbekanntmachung nach dem Umwandlungsgesetz",
      "state": "Hessen",
      "amtsgericht": "Amtsgericht Frankfurt am Main",
      "registernummer": "HRB 51790",
      "registerart": "HRB",
      "company_name": "OCS Office Clean Service GmbH",
      "company_seat": "Frankfurt am Main",
      "details": "28.01.2025 (Bekanntmachungsdatum)\n\nHessen Amtsgericht Frankfurt am Main HRB 51790\nRegisterbekanntmachung nach dem Umwandlungsgesetz 28.01.2025 (Eintragungsdatum)\n\nOCS Office Clean Service GmbH\nGesellschaft mit beschränkter Haftung\nFrankfurt am Main\n\nDen Gläubigern der an der Verschmelzung beteiligten Rechtsträger ist, wenn sie binnen sechs Monaten nach dem Tag, an dem die Eintragung der Verschmelzung in das Register des Sitzes derjenigen Rechtsträger deren Gläubiger sie sind, nach § 19 Absatz 3 UmwG bekannt gemacht worden ist, ihren Anspruch nach Grund und Höhe schriftlich anmelden, Sicherheit zu leisten, soweit sie nicht Befriedigung verlangen können. Dieses Recht steht den Gläubigern jedoch nur zu, wenn sie glaubhaft machen, dass durch die Verschmelzung die Erfüllung ihrer Forderung gefährdet wird."
    }
  ]
}