{
  "date": "2025-01-08",
  "date_of_scrape": "2025-01-09T04:06:24.860Z",
  "tool_version": "0.2.0",
  "number_of_announcements": 112,
  "announcements": [
    {
      "date": "2025-01-08",
      "id": "98017",
      "original_text": "Sonstige Registerbekanntmachung\nBayern Amtsgericht Würzburg HRB 10467\ndion Solution GmbH – Veitshöchheim",
      "type": "Sonstige Registerbekanntmachung",
      "state": "Bayern",
      "amtsgericht": "Amtsgericht Würzburg",
      "registernummer": "HRB 10467",
      "registerart": "HRB",
      "company_name": "dion Solution GmbH",
      "company_seat": "Veitshöchheim",
      "details": "08.01.2025 (Bekanntmachungsdatum)\n\nBayern Amtsgericht Würzburg HRB 10467\nSonstige Registerbekanntmachung 07.01.2025 (Eintragungsdatum)\n\ndion Solution GmbH\nGesellschaft mit beschränkter Haftung\nVeitshöchheim\n\nDen Gläubigern der Gesellschaft, deren Forderungen begründet worden sind, bevor die Eintragung der Beendigung des Beherrschungs- und Gewinnabführungsvertrages in das Handelsregister nach § 10 des Handelsgesetzbuches als bekanntgemacht gilt, hat der andere Vertragsteil Sicherheit zu leisten, wenn sie sich binnen sechs Monaten nach der Bekanntmachung der Eintragung zu diesem Zweck bei ihm melden."
    },
    {
      "date": "2025-01-08",
      "id": "98018",
      "original_text": "Registerbekanntmachung nach dem Umwandlungsgesetz\nBayern Amtsgericht Nürnberg HRB 16795\nPHYSIOMED ELEKTROMEDIZIN AG – Schnaittach",
      "type": "Registerbekanntmachung nach dem Umwandlungsgesetz",
      "state": "Bayern",
      "amtsgericht": "Amtsgericht Nürnberg",
      "registernummer": "HRB 16795",
      "registerart": "HRB",
      "company_name": "PHYSIOMED ELEKTROMEDIZIN AG",
      "company_seat": "Schnaittach",
      "details": "08.01.2025 (Bekanntmachungsdatum)\n\nBayern Amtsgericht Nürnberg HRB 16795\nRegisterbekanntmachung nach dem Umwandlungsgesetz\n\nPHYSIOMED ELEKTROMEDIZIN AG\nAktiengesellschaft\nSchnaittach\n\nDem Amtsgericht Nürnberg -Registergericht- ist der Entwurf eines Verschmelzungsvertrages zwischen der Gesellschaft als übernehmendem Rechtsträger und der MEDEVICE GmbH, Pirmasens (Amtsgericht Zweibrücken HRB 33001) zur Einsichtnahme eingereicht worden."
    },
    {
      "date": "2025-01-08",
      "id": "98019",
      "original_text": "Registerbekanntmachung nach dem Umwandlungsgesetz\nBayern Amtsgericht München HRB 140713\nENCAVIS AM Capital GmbH – Neubiberg",
      "type": "Registerbekanntmachung nach dem Umwandlungsgesetz",
      "state": "Bayern",
      "amtsgericht": "Amtsgericht München",
      "registernummer": "HRB 140713",
      "registerart": "HRB",
      "company_name": "ENCAVIS AM Capital GmbH",
      "company_seat": "Neubiberg",
      "details": "08.01.2025 (Bekanntmachungsdatum)\n\nBayern Amtsgericht München HRB 140713\nRegisterbekanntmachung nach dem Umwandlungsgesetz 07.01.2025 (Eintragungsdatum)\n\nENCAVIS AM Capital GmbH\nGesellschaft mit beschränkter Haftung\nNeubiberg\n\nDen Gläubigern der an der Verschmelzung beteiligten Rechtsträger ist, wenn sie binnen sechs Monaten nach dem Tag, an dem die Eintragung der Verschmelzung in das Register des Sitzes desjenigen Rechtsträgers, dessen Gläubiger sie sind, nach § 19 Abs. 3 UmwG als bekannt gemacht gilt, ihren Anspruch nach Grund und Höhe in Textform anmelden, Sicherheit zu leisten, soweit sie nicht Befriedigung verlangen können. Dieses Recht steht den Gläubigern jedoch nur zu, wenn sie glaubhaft machen, dass durch die Verschmelzung die Erfüllung ihrer Forderung gefährdet wird."
    },
    {
      "date": "2025-01-08",
      "id": "98020",
      "original_text": "Löschungsankündigung\nBayern Amtsgericht Landshut HRB 8368\nHigh Five Solutions UG (haftungsbeschränkt) – Dingolfing",
      "type": "Löschungsankündigung",
      "state": "Bayern",
      "amtsgericht": "Amtsgericht Landshut",
      "registernummer": "HRB 8368",
      "registerart": "HRB",
      "company_name": "High Five Solutions UG (haftungsbeschränkt)",
      "company_seat": "Dingolfing",
      "details": "08.01.2025 (Bekanntmachungsdatum)\n\nBayern Amtsgericht Landshut HRB 8368\nLöschungsankündigung\n\nHigh Five Solutions UG (haftungsbeschränkt)\nGesellschaft mit beschränkter Haftung\nDingolfing\n\nDas Registergericht beabsichtigt, die im Handelsregister eingetragene Gesellschaft wegen Vermögenslosigkeit von Amts wegen nach § 394 FamFG zu löschen. Die Frist zur Erhebung eines Widerspruchs ist auf einen Monat festgesetzt."
    },
    {
      "date": "2025-01-08",
      "id": "98021",
      "original_text": "Einreichung neuer Dokumente\nBayern Amtsgericht München HRB 215846\nTEN31 Bank AG – Ottobrunn",
      "type": "Einreichung neuer Dokumente",
      "state": "Bayern",
      "amtsgericht": "Amtsgericht München",
      "registernummer": "HRB 215846",
      "registerart": "HRB",
      "company_name": "TEN31 Bank AG",
      "company_seat": "Ottobrunn",
      "details": "08.01.2025 (Bekanntmachungsdatum)\n\nBayern Amtsgericht München HRB 215846\nEinreichung neuer Dokumente\n\nTEN31 Bank AG\nAktiengesellschaft\nOttobrunn\n\nDem Amtsgericht München -Registergericht- ist eine Liste der Mitglieder des Aufsichtsrats eingereicht worden, § 106 AktG."
    },
    {
      "date": "2025-01-08",
      "id": "98022",
      "original_text": "Löschungsankündigung\nBayern Amtsgericht Nürnberg HRB 36993\nERG-Global UG (haftungsbeschränkt) – Nürnberg",
      "type": "Löschungsankündigung",
      "state": "Bayern",
      "amtsgericht": "Amtsgericht Nürnberg",
      "registernummer": "HRB 36993",
      "registerart": "HRB",
      "company_name": "ERG-Global UG (haftungsbeschränkt)",
      "company_seat": "Nürnberg",
      "details": "08.01.2025 (Bekanntmachungsdatum)\n\nBayern Amtsgericht Nürnberg HRB 36993\nLöschungsankündigung\n\nERG-Global UG (haftungsbeschränkt)\nGesellschaft mit beschränkter Haftung\nNürnberg\n\nDas Registergericht beabsichtigt, die im Handelsregister eingetragene Gesellschaft wegen Vermögenslosigkeit von Amts wegen nach § 394 FamFG zu löschen. Die Frist zur Erhebung eines Widerspruchs ist auf einen Monat festgesetzt."
    },
    {
      "date": "2025-01-08",
      "id": "98023",
      "original_text": "Einreichung neuer Dokumente\nBayern Amtsgericht München HRB 135389\nINTARIA AG Wirtschaftsprüfungsgesellschaft Steuerberatungsgesellschaft Rechtsanwälte – München",
      "type": "Einreichung neuer Dokumente",
      "state": "Bayern",
      "amtsgericht": "Amtsgericht München",
      "registernummer": "HRB 135389",
      "registerart": "HRB",
      "company_name": "INTARIA AG Wirtschaftsprüfungsgesellschaft Steuerberatungsgesellschaft Rechtsanwälte",
      "company_seat": "München",
      "details": "08.01.2025 (Bekanntmachungsdatum)\n\nBayern Amtsgericht München HRB 135389\nEinreichung neuer Dokumente\n\nINTARIA AG Wirtschaftsprüfungsgesellschaft Steuerberatungsgesellschaft Rechtsanwälte\nAktiengesellschaft\nMünchen\n\nDem #Re.Name ist eine Liste der Mitglieder des Aufsichtsrats eingereicht worden, § 106 AktG."
    },
    {
      "date": "2025-01-08",
      "id": "98024",
      "original_text": "Sonstige Registerbekanntmachung\nBayern Amtsgericht München HRB 230406\nFireRisk Brandschutzmanagement und Consulting GmbH – München",
      "type": "Sonstige Registerbekanntmachung",
      "state": "Bayern",
      "amtsgericht": "Amtsgericht München",
      "registernummer": "HRB 230406",
      "registerart": "HRB",
      "company_name": "FireRisk Brandschutzmanagement und Consulting GmbH",
      "company_seat": "München",
      "details": "08.01.2025 (Bekanntmachungsdatum)\n\nBayern Amtsgericht München HRB 230406\nSonstige Registerbekanntmachung 07.01.2025 (Eintragungsdatum)\n\nFireRisk Brandschutzmanagement und Consulting GmbH\nGesellschaft mit beschränkter Haftung\nMünchen\n\nDen Gläubigern der Gesellschaft, deren Forderungen begründet worden sind, bevor die Eintragung der Beendigung des Beherrschungs- und Gewinnabführungsvertrages in das Handelsregister nach § 10 des Handelsgesetzbuches als bekanntgemacht gilt, hat der andere Vertragsteil Sicherheit zu leisten, wenn sie sich binnen sechs Monaten nach der Bekanntmachung der Eintragung zu diesem Zweck bei ihm melden."
    },
    {
      "date": "2025-01-08",
      "id": "98025",
      "original_text": "Registerbekanntmachung nach dem Umwandlungsgesetz\nBayern Amtsgericht München HRB 200131\nAdess AG – München",
      "type": "Registerbekanntmachung nach dem Umwandlungsgesetz",
      "state": "Bayern",
      "amtsgericht": "Amtsgericht München",
      "registernummer": "HRB 200131",
      "registerart": "HRB",
      "company_name": "Adess AG",
      "company_seat": "München",
      "details": "08.01.2025 (Bekanntmachungsdatum)\n\nBayern Amtsgericht München HRB 200131\nRegisterbekanntmachung nach dem Umwandlungsgesetz\n\nAdess AG\nAktiengesellschaft\nMünchen\n\nEs wird darauf hingewiesen, dass ein Formwechselplan oder sein Entwurf über einen grenzüberschreitenden Formwechsel in die ADESS Lda mit Sitz in Parque Empresarial da Granja, Portugal, einer Gesellschaft mit beschränkter Haftung nach dem Recht Portugals beim Handelsregister eingereicht worden ist.\nDie Anteilsinhaber, die Gläubiger sowie die zuständigen Betriebsräte der an dem grenzüberschreitenden Formwechsel beteiligten Gesellschaft oder, soweit es keinen Betriebsrat gibt, die Arbeitnehmer der an dem grenzüberschreitenden Formwechsel beteiligten Gesellschaft, können der Gesellschaft spätestens fünf Arbeitstage vor dem Tag der Hauptversammlung Bemerkungen zum Formwechselplan übermitteln."
    },
    {
      "date": "2025-01-08",
      "id": "98026",
      "original_text": "Löschungsankündigung\nBayern Amtsgericht München HRB 275900\nFAF Trade GmbH – Unterhaching",
      "type": "Löschungsankündigung",
      "state": "Bayern",
      "amtsgericht": "Amtsgericht München",
      "registernummer": "HRB 275900",
      "registerart": "HRB",
      "company_name": "FAF Trade GmbH",
      "company_seat": "Unterhaching",
      "details": "08.01.2025 (Bekanntmachungsdatum)\n\nBayern Amtsgericht München HRB 275900\nLöschungsankündigung 07.01.2025 (Eintragungsdatum)\n\nFAF Trade GmbH\nGesellschaft mit beschränkter Haftung\nUnterhaching\n\nDas Registergericht beabsichtigt, die im Handelsregister eingetragene Gesellschaft wegen Vermögenslosigkeit von Amts wegen nach § 394 FamFG zu löschen. Die Frist zur Erhebung eines Widerspruchs ist auf drei Monate festgesetzt."
    },
    {
      "date": "2025-01-08",
      "id": "98027",
      "original_text": "Sonstige Registerbekanntmachung\nBayern Amtsgericht München HRB 47272\nCargogate Munich Airport GmbH – Hallbergmoos",
      "type": "Sonstige Registerbekanntmachung",
      "state": "Bayern",
      "amtsgericht": "Amtsgericht München",
      "registernummer": "HRB 47272",
      "registerart": "HRB",
      "company_name": "Cargogate Munich Airport GmbH",
      "company_seat": "Hallbergmoos",
      "details": "08.01.2025 (Bekanntmachungsdatum)\n\nBayern Amtsgericht München HRB 47272\nSonstige Registerbekanntmachung 07.01.2025 (Eintragungsdatum)\n\nCargogate Munich Airport GmbH\nGesellschaft mit beschränkter Haftung\nHallbergmoos\n\nDen Gläubigern der Gesellschaft, deren Forderungen begründet worden sind, bevor die Eintragung der Beendigung des Gewinnabführungsvertrages in das Handelsregister nach § 10 des Handelsgesetzbuches als bekanntgemacht gilt, hat der andere Vertragsteil Sicherheit zu leisten, wenn sie sich binnen sechs Monaten nach der Bekanntmachung der Eintragung zu diesem Zweck bei ihm melden."
    },
    {
      "date": "2025-01-08",
      "id": "98028",
      "original_text": "Einreichung neuer Dokumente\nBayern Amtsgericht Regensburg HRB 7575\nKössinger Holding AG – Schierling",
      "type": "Einreichung neuer Dokumente",
      "state": "Bayern",
      "amtsgericht": "Amtsgericht Regensburg",
      "registernummer": "HRB 7575",
      "registerart": "HRB",
      "company_name": "Kössinger Holding AG",
      "company_seat": "Schierling",
      "details": "08.01.2025 (Bekanntmachungsdatum)\n\nBayern Amtsgericht Regensburg HRB 7575\nEinreichung neuer Dokumente 07.01.2025 (Eintragungsdatum)\n\nKössinger Holding AG\nAktiengesellschaft\nSchierling\n\nDem Amtsgericht Regensburg -Registergericht- ist eine Liste der Mitglieder des Aufsichtsrats eingereicht worden, § 106 AktG."
    },
    {
      "date": "2025-01-08",
      "id": "98029",
      "original_text": "Löschungsankündigung\nBayern Amtsgericht Kempten (Allgäu) HRB 10231\nBonné Academy GmbH – Kempten (Allgäu)",
      "type": "Löschungsankündigung",
      "state": "Bayern",
      "amtsgericht": "Amtsgericht Kempten (Allgäu)",
      "registernummer": "HRB 10231",
      "registerart": "HRB",
      "company_name": "Bonné Academy GmbH",
      "company_seat": "Kempten (Allgäu)",
      "details": "08.01.2025 (Bekanntmachungsdatum)\n\nBayern Amtsgericht Kempten (Allgäu) HRB 10231\nLöschungsankündigung\n\nBonné Academy GmbH\nGesellschaft mit beschränkter Haftung\nKempten (Allgäu)\n\nDas Registergericht beabsichtigt, die im Handelsregister eingetragene Gesellschaft wegen Vermögenslosigkeit von Amts wegen nach § 394 FamFG zu löschen. Die Frist zur Erhebung eines Widerspruchs ist auf einen Monat festgesetzt."
    },
    {
      "date": "2025-01-08",
      "id": "98030",
      "original_text": "Sonstige Registerbekanntmachung\nBayern Amtsgericht München HRB 85872\nGräfe und Unzer Verlag GmbH – München",
      "type": "Sonstige Registerbekanntmachung",
      "state": "Bayern",
      "amtsgericht": "Amtsgericht München",
      "registernummer": "HRB 85872",
      "registerart": "HRB",
      "company_name": "Gräfe und Unzer Verlag GmbH",
      "company_seat": "München",
      "details": "08.01.2025 (Bekanntmachungsdatum)\n\nBayern Amtsgericht München HRB 85872\nSonstige Registerbekanntmachung 07.01.2025 (Eintragungsdatum)\n\nGräfe und Unzer Verlag GmbH\nGesellschaft mit beschränkter Haftung\nMünchen\n\nDen Gläubigern der Gesellschaft, deren Forderungen begründet worden sind, bevor die Eintragung der Beendigung des Gewinnabführungsvertrages in das Handelsregister nach § 10 des Handelsgesetzbuches als bekanntgemacht gilt, hat der andere Vertragsteil Sicherheit zu leisten, wenn sie sich binnen sechs Monaten nach der Bekanntmachung der Eintragung zu diesem Zweck bei ihm melden."
    },
    {
      "date": "2025-01-08",
      "id": "98031",
      "original_text": "Einreichung neuer Dokumente\nBayern Amtsgericht München HRB 269316\nFAISSNER PETERMEIER Mobility AG – Garching b.München",
      "type": "Einreichung neuer Dokumente",
      "state": "Bayern",
      "amtsgericht": "Amtsgericht München",
      "registernummer": "HRB 269316",
      "registerart": "HRB",
      "company_name": "FAISSNER PETERMEIER Mobility AG",
      "company_seat": "Garching b.München",
      "details": "08.01.2025 (Bekanntmachungsdatum)\n\nBayern Amtsgericht München HRB 269316\nEinreichung neuer Dokumente\n\nFAISSNER PETERMEIER Mobility AG\nAktiengesellschaft\nGarching b.München\n\nDem Amtsgericht München -Registergericht- ist eine Liste der Mitglieder des Aufsichtsrats eingereicht worden, § 106 AktG."
    },
    {
      "date": "2025-01-08",
      "id": "98032",
      "original_text": "Registerbekanntmachung nach dem Umwandlungsgesetz\nBayern Amtsgericht München HRB 277296\nArtho Secure Verwaltung GmbH – München",
      "type": "Registerbekanntmachung nach dem Umwandlungsgesetz",
      "state": "Bayern",
      "amtsgericht": "Amtsgericht München",
      "registernummer": "HRB 277296",
      "registerart": "HRB",
      "company_name": "Artho Secure Verwaltung GmbH",
      "company_seat": "München",
      "details": "08.01.2025 (Bekanntmachungsdatum)\n\nBayern Amtsgericht München HRB 277296\nRegisterbekanntmachung nach dem Umwandlungsgesetz 07.01.2025 (Eintragungsdatum)\n\nArtho Secure Verwaltung GmbH\nGesellschaft mit beschränkter Haftung\nMünchen\n\nDen Gläubigern des formwechselnden Rechtsträgers ist, wenn sie binnen sechs Monaten nach dem Tag, an dem die Eintragung des Formwechsels nach § 201 UmwG als bekannt gemacht gilt, ihren Anspruch nach Grund und Höhe in Textform anmelden, Sicherheit zu leisten, soweit sie nicht Befriedigung verlangen können. Dieses Recht steht den Gläubigern jedoch nur zu, wenn sie glaubhaft machen, dass durch den Formwechsel die Erfüllung ihrer Forderung gefährdet wird."
    },
    {
      "date": "2025-01-08",
      "id": "98033",
      "original_text": "Löschungsankündigung\nBrandenburg Amtsgericht Potsdam HRB 32290\nBrands for Kids Marken GmbH – Teltow",
      "type": "Löschungsankündigung",
      "state": "Brandenburg",
      "amtsgericht": "Amtsgericht Potsdam",
      "registernummer": "HRB 32290",
      "registerart": "HRB",
      "company_name": "Brands for Kids Marken GmbH",
      "company_seat": "Teltow",
      "details": "08.01.2025 (Bekanntmachungsdatum)\n\nBrandenburg Amtsgericht Potsdam HRB 32290\nLöschungsankündigung\n\nBrands for Kids Marken GmbH\nGesellschaft mit beschränkter Haftung\nTeltow\n\nBei der nachstehenden Gesellschaft wird das Amtslöschungsverfahren gemäß § 394 FamFG eingeleitet. Widerspruchsfrist: 8 Wochen."
    },
    {
      "date": "2025-01-08",
      "id": "98034",
      "original_text": "Einreichung neuer Dokumente\nHamburg Amtsgericht Hamburg HRB 184092\nDEGAG Deutsche Grundbesitz Holding AG – Hamburg",
      "type": "Einreichung neuer Dokumente",
      "state": "Hamburg",
      "amtsgericht": "Amtsgericht Hamburg",
      "registernummer": "HRB 184092",
      "registerart": "HRB",
      "company_name": "DEGAG Deutsche Grundbesitz Holding AG",
      "company_seat": "Hamburg",
      "details": "08.01.2025 (Bekanntmachungsdatum)\n\nHamburg Amtsgericht Hamburg HRB 184092\nEinreichung neuer Dokumente\n\nDEGAG Deutsche Grundbesitz Holding AG\nAktiengesellschaft\nHamburg\n\nAls nicht eingetragen wird bekannt gemacht: Liste des Aufsichtsrats wurde eingereicht."
    },
    {
      "date": "2025-01-08",
      "id": "98035",
      "original_text": "Löschungsankündigung\nSaarland Amtsgericht Saarbrücken HRB 108892\nAlvan Trading & Consulting GmbH – Saarbrücken",
      "type": "Löschungsankündigung",
      "state": "Saarland",
      "amtsgericht": "Amtsgericht Saarbrücken",
      "registernummer": "HRB 108892",
      "registerart": "HRB",
      "company_name": "Alvan Trading & Consulting GmbH",
      "company_seat": "Saarbrücken",
      "details": "08.01.2025 (Bekanntmachungsdatum)\n\nSaarland Amtsgericht Saarbrücken HRB 108892\nLöschungsankündigung\n\nAlvan Trading & Consulting GmbH\nGesellschaft mit beschränkter Haftung\nSaarbrücken\n\nEs ist beabsichtigt, die Gesellschaft von Amts wegen gemäß § 394 FamFG wegen Vermögenslosigkeit zu löschen. Gegen die Löschung von Amts wegen ist das Rechtsmittel des Widerspruchs statthaft. Der Widerspruch ist binnen einer Frist von 1 Monat beginnend mit dem Tag dieser Veröffentlichung durch Einreichen eines Widerspruchsschreibens -schriftlich oder zur Niederschrift der Geschäftsstelle- beim Amtsgericht Saarbrücken, -zentrales Handelsregister-, Mainzerstr.178, 66121 Saarbrücken einzulegen. Der Widerspruch muss die Bezeichnung der angefochtenen Löschungsankündigung enthalten sowie die Erklärung, dass Widerspruch eingelegt wird. Er ist vom Widerspruchsführer oder seinem Bevollmächtigten zu unterzeichnen.\nDas Widerspruchsschreiben kann auch in der Form eines elektronischen Dokumentes eingereicht werden, das mit einer qualifizierten elektronischen Signatur nach dem Signaturgesetz versehen sein muss (§§ 14 Abs. 2 FamFG, 130a, 298 ZPO)."
    },
    {
      "date": "2025-01-08",
      "id": "98036",
      "original_text": "Sonstige Registerbekanntmachung\nBrandenburg Amtsgericht Potsdam HRB 1431\nGEFOMA GmbH Großbeeren Ingenieur- und Planungsgesellschaft – Großbeeren",
      "type": "Sonstige Registerbekanntmachung",
      "state": "Brandenburg",
      "amtsgericht": "Amtsgericht Potsdam",
      "registernummer": "HRB 1431",
      "registerart": "HRB",
      "company_name": "GEFOMA GmbH Großbeeren Ingenieur- und Planungsgesellschaft",
      "company_seat": "Großbeeren",
      "details": "08.01.2025 (Bekanntmachungsdatum)\n\nBrandenburg Amtsgericht Potsdam HRB 1431\nSonstige Registerbekanntmachung\n\nGEFOMA GmbH Großbeeren Ingenieur- und Planungsgesellschaft\nGesellschaft mit beschränkter Haftung\nGroßbeeren\n\nAls nicht eingetragen wird veröffentlicht: Der andere Vertragsteil hat entsprechend § 303 AktG den Gläubigern der Gesellschaft, deren Forderungen begründet worden sind, bevor die Eintragung der Beendigung des Vertrages in das Handelsregister nach § 10 HGB als bekannt gemacht worden ist, Sicherheit zu leisten, wenn sie sich binnen 6 Monaten nach der Bekanntmachung dieser Eintragung zu diesem Zweck bei dem anderen Vertragsteil melden"
    },
    {
      "date": "2025-01-08",
      "id": "98037",
      "original_text": "Einreichung neuer Dokumente\nHamburg Amtsgericht Hamburg HRB 87366\nHamburg Commercial Bank AG – Hamburg",
      "type": "Einreichung neuer Dokumente",
      "state": "Hamburg",
      "amtsgericht": "Amtsgericht Hamburg",
      "registernummer": "HRB 87366",
      "registerart": "HRB",
      "company_name": "Hamburg Commercial Bank AG",
      "company_seat": "Hamburg",
      "details": "08.01.2025 (Bekanntmachungsdatum)\n\nHamburg Amtsgericht Hamburg HRB 87366\nEinreichung neuer Dokumente\n\nHamburg Commercial Bank AG\nAktiengesellschaft\nHamburg\n\nAls nicht eingetragen wird bekannt gemacht: Liste des Aufsichtsrats wurde eingereicht."
    },
    {
      "date": "2025-01-08",
      "id": "98038",
      "original_text": "Sonstige Registerbekanntmachung\nBaden-Württemberg Amtsgericht Stuttgart HRB 736674\nVINOTECK GmbH – Owen",
      "type": "Sonstige Registerbekanntmachung",
      "state": "Baden-Württemberg",
      "amtsgericht": "Amtsgericht Stuttgart",
      "registernummer": "HRB 736674",
      "registerart": "HRB",
      "company_name": "VINOTECK GmbH",
      "company_seat": "Owen",
      "details": "08.01.2025 (Bekanntmachungsdatum)\n\nBaden-Württemberg Amtsgericht Stuttgart HRB 736674\nSonstige Registerbekanntmachung 08.01.2025 (Eintragungsdatum)\n\nVINOTECK GmbH\nGesellschaft mit beschränkter Haftung\nOwen\n\nDen Gläubigern der Gesellschaft, deren Forderungen begründet worden sind, bevor die Eintragung der Beendigung des Vertrages in das Handelsregister nach § 10 HGB als bekanntgemacht gilt, ist vom anderen Vertragsteil Sicherheit zu leisten, wenn sie sich binnen sechs Monaten nach der Bekanntmachung zu diesem Zweck bei ihm melden."
    },
    {
      "date": "2025-01-08",
      "id": "98039",
      "original_text": "Sonstige Registerbekanntmachung\nSachsen-Anhalt Amtsgericht Stendal HRB 24651\nGETEC Wärme & Effizienz GmbH – Magdeburg",
      "type": "Sonstige Registerbekanntmachung",
      "state": "Sachsen-Anhalt",
      "amtsgericht": "Amtsgericht Stendal",
      "registernummer": "HRB 24651",
      "registerart": "HRB",
      "company_name": "GETEC Wärme & Effizienz GmbH",
      "company_seat": "Magdeburg",
      "details": "08.01.2025 (Bekanntmachungsdatum)\n\nSachsen-Anhalt Amtsgericht Stendal HRB 24651\nSonstige Registerbekanntmachung 08.01.2025 (Eintragungsdatum)\n\nGETEC Wärme & Effizienz GmbH\nGesellschaft mit beschränkter Haftung\nMagdeburg\n\nNicht eingetragen:\nAls nicht eingetragen wird veröffentlicht: Den Gläubigern der Gesellschaft, deren Forderungen begründet worden sind bevor die Eintragung der Beendigung des #DV.Art(Text=\"Art des Vertrages auswählen\",Eingabe=\"Beherrschungs- und Gewinnabführungsvertrages\",\"Beherrschungsvertrages\",\"Gewinnabführungsvertrages\",\"Teilgewinnabführungsvertrages\")  in das Handelsregister nach § 10 des Handelsgesetzbuches als bekanntgemacht gilt, hat der andere Vertragsteil Sicherheit zu leisten, wenn sie sich binnen sechs Monaten nach der Bekanntmachung der Eintragung zu diesem Zweck bei ihm melden."
    },
    {
      "date": "2025-01-08",
      "id": "98040",
      "original_text": "Registerbekanntmachung nach dem Umwandlungsgesetz\nBaden-Württemberg Amtsgericht Stuttgart HRB 108789\nJens Baumgärtner GmbH – Massenbachhausen",
      "type": "Registerbekanntmachung nach dem Umwandlungsgesetz",
      "state": "Baden-Württemberg",
      "amtsgericht": "Amtsgericht Stuttgart",
      "registernummer": "HRB 108789",
      "registerart": "HRB",
      "company_name": "Jens Baumgärtner GmbH",
      "company_seat": "Massenbachhausen",
      "details": "08.01.2025 (Bekanntmachungsdatum)\n\nBaden-Württemberg Amtsgericht Stuttgart HRB 108789\nRegisterbekanntmachung nach dem Umwandlungsgesetz 08.01.2025 (Eintragungsdatum)\n\nJens Baumgärtner GmbH\nGesellschaft mit beschränkter Haftung\nMassenbachhausen\n\nAls nicht eingetragen wird bekanntgemacht:\nDen Gläubigern der an der Verschmelzung beteiligten Rechtsträger ist, wenn sie binnen sechs Monaten nach dem Tag, an dem die Eintragung der Verschmelzung in das Register des Sitzes desjenigen Rechtsträgers, dessen Gläubiger sie sind, nach § 19 Abs. 3 UmwG als bekanntgemacht gilt, ihren Anspruch nach Grund und Höhe schriftlich anmelden, Sicherheit zu leisten, soweit sie nicht Befriedigung verlangen können. Dieses Recht steht den Gläubigern jedoch nur zu, wenn sie glaubhaft machen, dass durch die Verschmelzung die Erfüllung ihrer Forderung gefährdet wird."
    },
    {
      "date": "2025-01-08",
      "id": "98041",
      "original_text": "Einreichung neuer Dokumente\nBaden-Württemberg Amtsgericht Mannheim HRB 731215\nEkosem-Agrar AG – Walldorf",
      "type": "Einreichung neuer Dokumente",
      "state": "Baden-Württemberg",
      "amtsgericht": "Amtsgericht Mannheim",
      "registernummer": "HRB 731215",
      "registerart": "HRB",
      "company_name": "Ekosem-Agrar AG",
      "company_seat": "Walldorf",
      "details": "08.01.2025 (Bekanntmachungsdatum)\n\nBaden-Württemberg Amtsgericht Mannheim HRB 731215\nEinreichung neuer Dokumente\n\nEkosem-Agrar AG\nAktiengesellschaft\nWalldorf\n\nDie Gesellschaft hat am 07.01.2025 die Liste über die Zusammensetzung des Aufsichtsrats zum Handelsregister eingereicht."
    },
    {
      "date": "2025-01-08",
      "id": "98042",
      "original_text": "Löschungsankündigung\nBerlin Amtsgericht Berlin (Charlottenburg) HRB 238216\nSensika Technologies GmbH – Berlin",
      "type": "Löschungsankündigung",
      "state": "Berlin",
      "amtsgericht": "Amtsgericht Berlin (Charlottenburg)",
      "registernummer": "HRB 238216",
      "registerart": "HRB",
      "company_name": "Sensika Technologies GmbH",
      "company_seat": "Berlin",
      "details": "08.01.2025 (Bekanntmachungsdatum)\n\nBerlin Amtsgericht Berlin (Charlottenburg) HRB 238216\nLöschungsankündigung\n\nSensika Technologies GmbH\nGesellschaft mit beschränkter Haftung\nBerlin\n\nBei der nachstehenden Gesellschaft wird das Amtslöschungsverfahren gemäß § 394 FamFG eingeleitet. Widerspruchsfrist 6 Wochen"
    },
    {
      "date": "2025-01-08",
      "id": "98043",
      "original_text": "Löschungsankündigung\nBerlin Amtsgericht Berlin (Charlottenburg) HRB 202756\nID League GmbH – Berlin",
      "type": "Löschungsankündigung",
      "state": "Berlin",
      "amtsgericht": "Amtsgericht Berlin (Charlottenburg)",
      "registernummer": "HRB 202756",
      "registerart": "HRB",
      "company_name": "ID League GmbH",
      "company_seat": "Berlin",
      "details": "08.01.2025 (Bekanntmachungsdatum)\n\nBerlin Amtsgericht Berlin (Charlottenburg) HRB 202756\nLöschungsankündigung\n\nID League GmbH\nGesellschaft mit beschränkter Haftung\nBerlin\n\nEs ist beabsichtigt, die Eintragung wegen Mangels einer wesentlichen Voraussetzung gemäß § 395 FamFG von Amts wegen zu löschen. Widerspruchsfrist 6 Wochen"
    },
    {
      "date": "2025-01-08",
      "id": "98044",
      "original_text": "Sonstige Registerbekanntmachung\nBaden-Württemberg Amtsgericht Freiburg HRB 709113\ne.optimum home GmbH – Offenburg",
      "type": "Sonstige Registerbekanntmachung",
      "state": "Baden-Württemberg",
      "amtsgericht": "Amtsgericht Freiburg",
      "registernummer": "HRB 709113",
      "registerart": "HRB",
      "company_name": "e.optimum home GmbH",
      "company_seat": "Offenburg",
      "details": "08.01.2025 (Bekanntmachungsdatum)\n\nBaden-Württemberg Amtsgericht Freiburg HRB 709113\nSonstige Registerbekanntmachung 08.01.2025 (Eintragungsdatum)\n\ne.optimum home GmbH\nGesellschaft mit beschränkter Haftung\nOffenburg\n\nAls nicht eingetragen wird bekanntgemacht:\nDen Gläubigern der Gesellschaft, deren Forderungen begründet worden sind, bevor die Eintragung der Beendigung des Vertrages in das Handelsregister nach § 10 HGB als bekanntgemacht gilt, ist vom anderen Vertragsteil Sicherheit zu leisten, wenn sie sich binnen sechs Monaten nach der Bekanntmachung zu diesem Zweck bei ihm melden."
    },
    {
      "date": "2025-01-08",
      "id": "98045",
      "original_text": "Sonstige Registerbekanntmachung\nBerlin Amtsgericht Berlin (Charlottenburg) HRB 83256\nUnigarant Berlin GmbH Steuerberatungsgesellschaft Treuhandgesellschaft – Berlin",
      "type": "Sonstige Registerbekanntmachung",
      "state": "Berlin",
      "amtsgericht": "Amtsgericht Berlin (Charlottenburg)",
      "registernummer": "HRB 83256",
      "registerart": "HRB",
      "company_name": "Unigarant Berlin GmbH Steuerberatungsgesellschaft Treuhandgesellschaft",
      "company_seat": "Berlin",
      "details": "08.01.2025 (Bekanntmachungsdatum)\n\nBerlin Amtsgericht Berlin (Charlottenburg) HRB 83256\nSonstige Registerbekanntmachung\n\nUnigarant Berlin GmbH Steuerberatungsgesellschaft Treuhandgesellschaft\nGesellschaft mit beschränkter Haftung\nBerlin\n\nAls nicht eingetragen wird veröffentlicht:Der andere Vertragsteil hat den Gläubigern dieses Rechtsträgers, deren Forderungen begründet worden sind, bevor die Eintragung der Beendigung dieses Vertrages in das Handelsregister nach § 10 des Handelsgesetzbuches als bekannt gemacht gilt, Sicherheit zu leisten, wenn sie sich binnen sechs Monaten nach der Bekanntmachung der Eintragung zu diesem Zweck bei ihm melden. Dieses Recht steht den Gläubigern nicht zu, die im Fall des Insolvenzverfahrens ein Recht auf vorzugsweise Befriedigung aus der Deckungsmasse haben, die nach gesetzlicher Vorschrift zu ihrem Schutz errichtet und staatlich überwacht ist."
    },
    {
      "date": "2025-01-08",
      "id": "98046",
      "original_text": "Löschungsankündigung\nBerlin Amtsgericht Berlin (Charlottenburg) HRB 238292\nNeumann Baumanagement GmbH – Berlin",
      "type": "Löschungsankündigung",
      "state": "Berlin",
      "amtsgericht": "Amtsgericht Berlin (Charlottenburg)",
      "registernummer": "HRB 238292",
      "registerart": "HRB",
      "company_name": "Neumann Baumanagement GmbH",
      "company_seat": "Berlin",
      "details": "08.01.2025 (Bekanntmachungsdatum)\n\nBerlin Amtsgericht Berlin (Charlottenburg) HRB 238292\nLöschungsankündigung\n\nNeumann Baumanagement GmbH\nGesellschaft mit beschränkter Haftung\nBerlin\n\nBei der nachstehenden Gesellschaft wird das Amtslöschungsverfahren gemäß § 394 FamFG eingeleitet. Widerspruchsfrist 6 Wochen"
    },
    {
      "date": "2025-01-08",
      "id": "98047",
      "original_text": "Registerbekanntmachung nach dem Umwandlungsgesetz\nMecklenburg-Vorpommern Amtsgericht Schwerin HRB 12439\niPhotex GmbH – Schönberg",
      "type": "Registerbekanntmachung nach dem Umwandlungsgesetz",
      "state": "Mecklenburg-Vorpommern",
      "amtsgericht": "Amtsgericht Schwerin",
      "registernummer": "HRB 12439",
      "registerart": "HRB",
      "company_name": "iPhotex GmbH",
      "company_seat": "Schönberg",
      "details": "08.01.2025 (Bekanntmachungsdatum)\n\nMecklenburg-Vorpommern Amtsgericht Schwerin HRB 12439\nRegisterbekanntmachung nach dem Umwandlungsgesetz 08.01.2025 (Eintragungsdatum)\n\niPhotex GmbH\nGesellschaft mit beschränkter Haftung\nSchönberg\n\nDen Gläubigern der an der Verschmelzung beteiligten Gesellschaften ist, wenn sie binnen sechs Monaten nach dem Tag, an dem die Eintragung der Verschmelzungen in das Register des Sitzes desjenigen Rechtsträgers, dessen Gläubiger sie sind, nach § 19 Absatz 3 UmwG als bekanntgemacht gilt, ihren Anspruch nach Grund und Höhe schriftlich anmelden, Sicherheit zu leisten, soweit sie nicht Befriedigung verlangen können. Dieses Recht steht den Gläubigern jedoch nur zu, wenn sie glaubhaft machen, dass durch die Verschmelzung die Erfüllung ihrer Forderung gefährdet wird."
    },
    {
      "date": "2025-01-08",
      "id": "98048",
      "original_text": "Einreichung neuer Dokumente\nBerlin Amtsgericht Berlin (Charlottenburg) HRB 97214\nLucaNet Aktiengesellschaft – Berlin",
      "type": "Einreichung neuer Dokumente",
      "state": "Berlin",
      "amtsgericht": "Amtsgericht Berlin (Charlottenburg)",
      "registernummer": "HRB 97214",
      "registerart": "HRB",
      "company_name": "LucaNet Aktiengesellschaft",
      "company_seat": "Berlin",
      "details": "08.01.2025 (Bekanntmachungsdatum)\n\nBerlin Amtsgericht Berlin (Charlottenburg) HRB 97214\nEinreichung neuer Dokumente\n\nLucaNet Aktiengesellschaft\nAktiengesellschaft\nBerlin\n\nAls nicht eingetragen wird veröffentlicht: Die Gesellschaft hat den Entwurf eines Verschmelzungsplans eingereicht.\nAn der Verschmelzung sind beteiligt:\na) die LucaNet (Austria) GmbH, eine nach den Gesetzen von Österreich errichtete und bestehende Gesellschaft mit beschränkter Haftung (GmbH) mit dem Sitz in Wien, Österreich als übertragende Gesellschaft;\nb) die LucaNet AG, eine nach den Gesetzen der Bundesrepublik Deutschland errichtete und bestehende Aktiengesellschaft (AG) mit dem Sitz in Berlin als übernehmende Gesellschaft.\nDie LucaNet (Austria) GmbH ist eingetragen im Firmenbuch von Österreich unter der Firmenbuchnummer 430386x. Die LucaNet AG ist eingetragen im Handelsregister des Amtsgerichts Charlottenburg unter HRB 97214.\nDie Gläubiger, Anteilsinhaber und Arbeitnehmer der an der grenzüberschreitenden Verschmelzung beteiligten Gesellschaften können bis spätestens fünf Tage vor dem Tag der Gesellschafterversammlung der LucaNet AG als übernehmender Gesellschaft Bemerkungen zum Verschmelzungsplan an folgende Geschäftsanschrift der LucaNetAG übermitteln:\nAlexanderplatz l, 10178 Berlin"
    },
    {
      "date": "2025-01-08",
      "id": "98049",
      "original_text": "Sonstige Registerbekanntmachung\nThüringen Amtsgericht Jena HRB 302008\nWohnungsbaugesellschaft mbH Meiningen – Meiningen",
      "type": "Sonstige Registerbekanntmachung",
      "state": "Thüringen",
      "amtsgericht": "Amtsgericht Jena",
      "registernummer": "HRB 302008",
      "registerart": "HRB",
      "company_name": "Wohnungsbaugesellschaft mbH Meiningen",
      "company_seat": "Meiningen",
      "details": "08.01.2025 (Bekanntmachungsdatum)\n\nThüringen Amtsgericht Jena HRB 302008\nSonstige Registerbekanntmachung 08.01.2025 (Eintragungsdatum)\n\nWohnungsbaugesellschaft mbH Meiningen\nGesellschaft mit beschränkter Haftung\nMeiningen\n\nNicht eingetragen: Den Gläubigern der Gesellschaft, deren Forderungen begründet worden sind, bevor die Eintragung der Beendigung des Vertrages in das Handelsregister nach § 10 des Handelsgesetzbuches als bekanntgemacht gilt, hat der andere Vertragsteil Sicherheit zu leisten, wenn sie sich binnen sechs Monaten nach der Bekanntmachung der Eintragung zu diesem Zweck bei ihm melden."
    },
    {
      "date": "2025-01-08",
      "id": "98050",
      "original_text": "Löschungsankündigung\nThüringen Amtsgericht Jena HRB 509085\nKita-Service Brinkmann UG (haftungsbeschränkt) – Gera",
      "type": "Löschungsankündigung",
      "state": "Thüringen",
      "amtsgericht": "Amtsgericht Jena",
      "registernummer": "HRB 509085",
      "registerart": "HRB",
      "company_name": "Kita-Service Brinkmann UG (haftungsbeschränkt)",
      "company_seat": "Gera",
      "details": "08.01.2025 (Bekanntmachungsdatum)\n\nThüringen Amtsgericht Jena HRB 509085\nLöschungsankündigung\n\nKita-Service Brinkmann UG (haftungsbeschränkt)\nGesellschaft mit beschränkter Haftung\nGera\n\nDas Registergericht beabsichtigt, die im Handelsregister eingetragene Gesellschaft wegen Vermögenslosigkeit nach § 394 FamFG von Amts wegen zu löschen. Die Frist zur Erhebung eines Widerspruchs gegen die beabsichtigte Löschung wird auf 6 Wochen festgesetzt."
    },
    {
      "date": "2025-01-08",
      "id": "98051",
      "original_text": "Registerbekanntmachung nach dem Umwandlungsgesetz\nThüringen Amtsgericht Jena HRA 506867\nMontageservice Kraus e.K. – Oettersdorf",
      "type": "Registerbekanntmachung nach dem Umwandlungsgesetz",
      "state": "Thüringen",
      "amtsgericht": "Amtsgericht Jena",
      "registernummer": "HRA 506867",
      "registerart": "HRA",
      "company_name": "Montageservice Kraus e.K.",
      "company_seat": "Oettersdorf",
      "details": "08.01.2025 (Bekanntmachungsdatum)\n\nThüringen Amtsgericht Jena HRA 506867\nRegisterbekanntmachung nach dem Umwandlungsgesetz 08.01.2025 (Eintragungsdatum)\n\nMontageservice Kraus e.K.\nEinzelkaufmann / Einzelkauffrau\nOettersdorf\n\nNicht eingetragen: Den Gläubigern der an der Ausgliederung beteiligten Rechtsträger, ist wenn sie binnen sechs Monaten nach dem Tag, an dem die Eintragung der Ausgliederung in das Register des Sitzes desjenigen Rechtsträgers, dessen Gläubiger sie sind, nach §§125, 19 Abs. 3 UmwG als bekanntgemacht gilt, ihren Anspruch nach Grund und Höhe schriftlich anmelden, Sicherheit zu leisten, soweit sie nicht Befriedigung verlangen können. Dieses Recht steht ihnen jedoch nur zu, wenn sie glaubhaft machen, daß durch die Ausgliederung die Erfüllung ihrer Forderung gefährdet wird."
    },
    {
      "date": "2025-01-08",
      "id": "98052",
      "original_text": "Löschungsankündigung\nThüringen Amtsgericht Jena HRB 519485\nGastro-Projekte Rader GmbH – Erfurt",
      "type": "Löschungsankündigung",
      "state": "Thüringen",
      "amtsgericht": "Amtsgericht Jena",
      "registernummer": "HRB 519485",
      "registerart": "HRB",
      "company_name": "Gastro-Projekte Rader GmbH",
      "company_seat": "Erfurt",
      "details": "08.01.2025 (Bekanntmachungsdatum)\n\nThüringen Amtsgericht Jena HRB 519485\nLöschungsankündigung\n\nGastro-Projekte Rader GmbH\nGesellschaft mit beschränkter Haftung\nErfurt\n\nDas Registergericht beabsichtigt, die im Handelsregister eingetragene Gesellschaft wegen Vermögenslosigkeit nach § 394 FamFG von Amts wegen zu löschen. Die Frist zur Erhebung eines Widerspruchs gegen die beabsichtigte Löschung wird auf 6 Wochen festgesetzt."
    },
    {
      "date": "2025-01-08",
      "id": "98053",
      "original_text": "Löschungsankündigung\nThüringen Amtsgericht Jena HRB 512425\nFFM Montage GmbH – Leinefelde-Worbis",
      "type": "Löschungsankündigung",
      "state": "Thüringen",
      "amtsgericht": "Amtsgericht Jena",
      "registernummer": "HRB 512425",
      "registerart": "HRB",
      "company_name": "FFM Montage GmbH",
      "company_seat": "Leinefelde-Worbis",
      "details": "08.01.2025 (Bekanntmachungsdatum)\n\nThüringen Amtsgericht Jena HRB 512425\nLöschungsankündigung\n\nFFM Montage GmbH\nGesellschaft mit beschränkter Haftung\nLeinefelde-Worbis\n\nDas Registergericht beabsichtigt, die im Handelsregister eingetragene Gesellschaft wegen Vermögenslosigkeit nach § 394 FamFG von Amts wegen zu löschen. Die Frist zur Erhebung eines Widerspruchs gegen die beabsichtigte Löschung wird auf 6 Wochen festgesetzt."
    },
    {
      "date": "2025-01-08",
      "id": "98054",
      "original_text": "Sonstige Registerbekanntmachung\nThüringen Amtsgericht Jena HRB 501897\nTEXAID Collection GmbH – Apolda",
      "type": "Sonstige Registerbekanntmachung",
      "state": "Thüringen",
      "amtsgericht": "Amtsgericht Jena",
      "registernummer": "HRB 501897",
      "registerart": "HRB",
      "company_name": "TEXAID Collection GmbH",
      "company_seat": "Apolda",
      "details": "08.01.2025 (Bekanntmachungsdatum)\n\nThüringen Amtsgericht Jena HRB 501897\nSonstige Registerbekanntmachung 08.01.2025 (Eintragungsdatum)\n\nTEXAID Collection GmbH\nGesellschaft mit beschränkter Haftung\nApolda\n\nNicht eingetragen: Den Gläubigern der Gesellschaft, deren Forderungen begründet worden sind, bevor die Eintragung der Beendigung des Vertrages in das Handelsregister nach § 10 des Handelsgesetzbuches als bekanntgemacht gilt, hat der andere Vertragsteil Sicherheit zu leisten, wenn sie sich binnen sechs Monaten nach der Bekanntmachung der Eintragung zu diesem Zweck bei ihm melden."
    },
    {
      "date": "2025-01-08",
      "id": "98055",
      "original_text": "Löschungsankündigung\nThüringen Amtsgericht Jena HRB 501987\nPanoramamaker Immobilien Marketing- und Beratungsgesellschaft mbH – Geisa",
      "type": "Löschungsankündigung",
      "state": "Thüringen",
      "amtsgericht": "Amtsgericht Jena",
      "registernummer": "HRB 501987",
      "registerart": "HRB",
      "company_name": "Panoramamaker Immobilien Marketing- und Beratungsgesellschaft mbH",
      "company_seat": "Geisa",
      "details": "08.01.2025 (Bekanntmachungsdatum)\n\nThüringen Amtsgericht Jena HRB 501987\nLöschungsankündigung\n\nPanoramamaker Immobilien Marketing- und Beratungsgesellschaft mbH\nGesellschaft mit beschränkter Haftung\nGeisa\n\nDas Registergericht beabsichtigt, die im Handelsregister eingetragene Gesellschaft wegen Vermögenslosigkeit nach § 394 FamFG von Amts wegen zu löschen. Die Frist zur Erhebung eines Widerspruchs gegen die beabsichtigte Löschung wird auf 6 Wochen festgesetzt."
    },
    {
      "date": "2025-01-08",
      "id": "98056",
      "original_text": "Sonstige Registerbekanntmachung\nBaden-Württemberg Amtsgericht Mannheim HRB 732524\nADWEKO Solutions GmbH – Walldorf",
      "type": "Sonstige Registerbekanntmachung",
      "state": "Baden-Württemberg",
      "amtsgericht": "Amtsgericht Mannheim",
      "registernummer": "HRB 732524",
      "registerart": "HRB",
      "company_name": "ADWEKO Solutions GmbH",
      "company_seat": "Walldorf",
      "details": "08.01.2025 (Bekanntmachungsdatum)\n\nBaden-Württemberg Amtsgericht Mannheim HRB 732524\nSonstige Registerbekanntmachung 08.01.2025 (Eintragungsdatum)\n\nADWEKO Solutions GmbH\nGesellschaft mit beschränkter Haftung\nWalldorf\n\nAls nicht eingetragen wird bekanntgemacht:\nDen Gläubigern der Gesellschaft, deren Forderungen begründet worden sind, bevor die Eintragung der Beendigung des Vertrages in das Handelsregister nach § 10 HGB als bekanntgemacht gilt, ist vom anderen Vertragsteil Sicherheit zu leisten, wenn sie sich binnen sechs Monaten nach der Bekanntmachung zu diesem Zweck bei ihm melden."
    },
    {
      "date": "2025-01-08",
      "id": "98057",
      "original_text": "Löschungsankündigung\nBerlin Amtsgericht Berlin (Charlottenburg) HRB 204513\nKARO Labs GmbH – Berlin",
      "type": "Löschungsankündigung",
      "state": "Berlin",
      "amtsgericht": "Amtsgericht Berlin (Charlottenburg)",
      "registernummer": "HRB 204513",
      "registerart": "HRB",
      "company_name": "KARO Labs GmbH",
      "company_seat": "Berlin",
      "details": "08.01.2025 (Bekanntmachungsdatum)\n\nBerlin Amtsgericht Berlin (Charlottenburg) HRB 204513\nLöschungsankündigung\n\nKARO Labs GmbH\nGesellschaft mit beschränkter Haftung\nBerlin\n\nBei der nachstehenden Gesellschaft wird das Amtslöschungsverfahren gemäß § 394 FamFG eingeleitet. Widerspruchsfrist: 6 Wochen."
    },
    {
      "date": "2025-01-08",
      "id": "98058",
      "original_text": "Registerbekanntmachung nach dem Umwandlungsgesetz\nBaden-Württemberg Amtsgericht Stuttgart HRB 769749\nBaumgärtner Verwaltungsgesellschaft mbH – Massenbachhausen",
      "type": "Registerbekanntmachung nach dem Umwandlungsgesetz",
      "state": "Baden-Württemberg",
      "amtsgericht": "Amtsgericht Stuttgart",
      "registernummer": "HRB 769749",
      "registerart": "HRB",
      "company_name": "Baumgärtner Verwaltungsgesellschaft mbH",
      "company_seat": "Massenbachhausen",
      "details": "08.01.2025 (Bekanntmachungsdatum)\n\nBaden-Württemberg Amtsgericht Stuttgart HRB 769749\nRegisterbekanntmachung nach dem Umwandlungsgesetz 08.01.2025 (Eintragungsdatum)\n\nBaumgärtner Verwaltungsgesellschaft mbH\nGesellschaft mit beschränkter Haftung\nMassenbachhausen\n\nAls nicht eingetragen wird bekanntgemacht:\nDen Gläubigern der an der Verschmelzung beteiligten Rechtsträger ist, wenn sie binnen sechs Monaten nach dem Tag, an dem die Eintragung der Verschmelzung in das Register des Sitzes desjenigen Rechtsträgers, dessen Gläubiger sie sind, nach § 19 Abs. 3 UmwG als bekanntgemacht gilt, ihren Anspruch nach Grund und Höhe schriftlich anmelden, Sicherheit zu leisten, soweit sie nicht Befriedigung verlangen können. Dieses Recht steht den Gläubigern jedoch nur zu, wenn sie glaubhaft machen, dass durch die Verschmelzung die Erfüllung ihrer Forderung gefährdet wird."
    },
    {
      "date": "2025-01-08",
      "id": "98059",
      "original_text": "Sonstige Registerbekanntmachung\nBerlin Amtsgericht Berlin (Charlottenburg) HRB 166292\nCentaurusNet UG (haftungsbeschränkt) – Berlin",
      "type": "Sonstige Registerbekanntmachung",
      "state": "Berlin",
      "amtsgericht": "Amtsgericht Berlin (Charlottenburg)",
      "registernummer": "HRB 166292",
      "registerart": "HRB",
      "company_name": "CentaurusNet UG (haftungsbeschränkt)",
      "company_seat": "Berlin",
      "details": "08.01.2025 (Bekanntmachungsdatum)\n\nBerlin Amtsgericht Berlin (Charlottenburg) HRB 166292\nSonstige Registerbekanntmachung\n\nCentaurusNet UG (haftungsbeschränkt)\nGesellschaft mit beschränkter Haftung\nBerlin\n\nAls nicht eingetragen wird veröffentlicht: Der andere Vertragsteil hat den Gläubigern dieses Rechtsträgers, deren Forderungen begründet worden sind, bevor die Eintragung der Beendigung dieses Vertrages in das Handelsregister nach § 10 des Handelsgesetzbuches als bekannt gemacht gilt, Sicherheit zu leisten, wenn sie sich binnen sechs Monaten nach der Bekanntmachung der Eintragung zu diesem Zweck bei ihm melden. Dieses Recht steht den Gläubigern nicht zu, die im Fall des Insolvenzverfahrens ein Recht auf vorzugsweise Befriedigung aus der Deckungsmasse haben, die nach gesetzlicher Vorschrift zu ihrem Schutz errichtet und staatlich überwacht ist."
    },
    {
      "date": "2025-01-08",
      "id": "98060",
      "original_text": "Sonstige Registerbekanntmachung\nMecklenburg-Vorpommern Amtsgericht Stralsund HRB 4971\nATG Sicherheitstechnik Nordost GmbH – Greifswald",
      "type": "Sonstige Registerbekanntmachung",
      "state": "Mecklenburg-Vorpommern",
      "amtsgericht": "Amtsgericht Stralsund",
      "registernummer": "HRB 4971",
      "registerart": "HRB",
      "company_name": "ATG Sicherheitstechnik Nordost GmbH",
      "company_seat": "Greifswald",
      "details": "08.01.2025 (Bekanntmachungsdatum)\n\nMecklenburg-Vorpommern Amtsgericht Stralsund HRB 4971\nSonstige Registerbekanntmachung 08.01.2025 (Eintragungsdatum)\n\nATG Sicherheitstechnik Nordost GmbH\nGesellschaft mit beschränkter Haftung\nGreifswald\n\nAls nicht eingetragen wird veröffentlicht: Den Gläubigern der Gesellschaft, deren Forderungen begründet worden sind bevor die Eintragung der Beendigung des Beherrschungs- und Gewinnabführungsvertrages in das Handelsregister nach § 10 des Handelsgesetzbuches als bekanntgemacht gilt, hat der andere Vertragsteil Sicherheit zu leisten, wenn sie sich binnen sechs Monaten nach der Bekanntmachung der Eintragung zu diesem Zweck bei ihm melden."
    },
    {
      "date": "2025-01-08",
      "id": "98061",
      "original_text": "Registerbekanntmachung nach dem Umwandlungsgesetz\nBaden-Württemberg Amtsgericht Stuttgart HRB 320564\nCheminox GmbH – Zaberfeld",
      "type": "Registerbekanntmachung nach dem Umwandlungsgesetz",
      "state": "Baden-Württemberg",
      "amtsgericht": "Amtsgericht Stuttgart",
      "registernummer": "HRB 320564",
      "registerart": "HRB",
      "company_name": "Cheminox GmbH",
      "company_seat": "Zaberfeld",
      "details": "08.01.2025 (Bekanntmachungsdatum)\n\nBaden-Württemberg Amtsgericht Stuttgart HRB 320564\nRegisterbekanntmachung nach dem Umwandlungsgesetz 08.01.2025 (Eintragungsdatum)\n\nCheminox GmbH\nGesellschaft mit beschränkter Haftung\nZaberfeld\n\nDen Gläubigern der an der Verschmelzung beteiligten Rechtsträger ist, wenn sie binnen sechs Monaten nach dem Tag, an dem die Eintragung der Verschmelzung in das Register des Sitzes desjenigen Rechtsträgers, dessen Gläubiger sie sind, nach § 19 Abs. 3 UmwG als bekanntgemacht gilt, ihren Anspruch nach Grund und Höhe schriftlich anmelden, Sicherheit zu leisten, soweit sie nicht Befriedigung verlangen können. Dieses Recht steht den Gläubigern jedoch nur zu, wenn sie glaubhaft machen, dass durch die Verschmelzung die Erfüllung ihrer Forderung gefährdet wird."
    },
    {
      "date": "2025-01-08",
      "id": "98062",
      "original_text": "Registerbekanntmachung nach dem Umwandlungsgesetz\nBaden-Württemberg Amtsgericht Stuttgart HRB 797831\nSATA Management GmbH – Kornwestheim",
      "type": "Registerbekanntmachung nach dem Umwandlungsgesetz",
      "state": "Baden-Württemberg",
      "amtsgericht": "Amtsgericht Stuttgart",
      "registernummer": "HRB 797831",
      "registerart": "HRB",
      "company_name": "SATA Management GmbH",
      "company_seat": "Kornwestheim",
      "details": "08.01.2025 (Bekanntmachungsdatum)\n\nBaden-Württemberg Amtsgericht Stuttgart HRB 797831\nRegisterbekanntmachung nach dem Umwandlungsgesetz 08.01.2025 (Eintragungsdatum)\n\nSATA Management GmbH\nGesellschaft mit beschränkter Haftung\nKornwestheim\n\nAls nicht eingetragen wird bekanntgemacht:\nDen Gläubigern der an der Ausgliederung beteiligten Rechtsträger ist, wenn sie binnen sechs Monaten nach dem Tag, an dem die Eintragung der Ausgliederung in das Register des Sitzes desjenigen Rechtsträgers, dessen Gläubiger sie sind, nach § 19 Abs. 3 UmwG als bekanntgemacht gilt, ihren Anspruch nach Grund und Höhe schriftlich anmelden, Sicherheit zu leisten, soweit sie nicht Befriedigung verlangen können. Dieses Recht steht den Gläubigern jedoch nur zu, wenn sie glaubhaft machen, dass durch die Ausgliederung die Erfüllung ihrer Forderung gefährdet wird."
    },
    {
      "date": "2025-01-08",
      "id": "98063",
      "original_text": "Registerbekanntmachung nach dem Umwandlungsgesetz\nBaden-Württemberg Amtsgericht Stuttgart HRB 720917\nSATA Holding GmbH – Kornwestheim",
      "type": "Registerbekanntmachung nach dem Umwandlungsgesetz",
      "state": "Baden-Württemberg",
      "amtsgericht": "Amtsgericht Stuttgart",
      "registernummer": "HRB 720917",
      "registerart": "HRB",
      "company_name": "SATA Holding GmbH",
      "company_seat": "Kornwestheim",
      "details": "08.01.2025 (Bekanntmachungsdatum)\n\nBaden-Württemberg Amtsgericht Stuttgart HRB 720917\nRegisterbekanntmachung nach dem Umwandlungsgesetz 08.01.2025 (Eintragungsdatum)\n\nSATA Holding GmbH\nGesellschaft mit beschränkter Haftung\nKornwestheim\n\nAls nicht eingetragen wird bekanntgemacht:\nDen Gläubigern der an der Ausgliederung beteiligten Rechtsträger ist, wenn sie binnen sechs Monaten nach dem Tag, an dem die Eintragung der Ausgliederung in das Register des Sitzes desjenigen Rechtsträgers, dessen Gläubiger sie sind, nach § 19 Abs. 3 UmwG als bekanntgemacht gilt, ihren Anspruch nach Grund und Höhe schriftlich anmelden, Sicherheit zu leisten, soweit sie nicht Befriedigung verlangen können. Dieses Recht steht den Gläubigern jedoch nur zu, wenn sie glaubhaft machen, dass durch die Ausgliederung die Erfüllung ihrer Forderung gefährdet wird."
    },
    {
      "date": "2025-01-08",
      "id": "98064",
      "original_text": "Einreichung neuer Dokumente\nBaden-Württemberg Amtsgericht Stuttgart HRB 350105\nGWG - Wohnungsgesellschaft Reutlingen mbH – Reutlingen",
      "type": "Einreichung neuer Dokumente",
      "state": "Baden-Württemberg",
      "amtsgericht": "Amtsgericht Stuttgart",
      "registernummer": "HRB 350105",
      "registerart": "HRB",
      "company_name": "GWG - Wohnungsgesellschaft Reutlingen mbH",
      "company_seat": "Reutlingen",
      "details": "08.01.2025 (Bekanntmachungsdatum)\n\nBaden-Württemberg Amtsgericht Stuttgart HRB 350105\nEinreichung neuer Dokumente\n\nGWG - Wohnungsgesellschaft Reutlingen mbH\nGesellschaft mit beschränkter Haftung\nReutlingen\n\nDie Gesellschaft hat am 04.01.2025 die Liste über die Zusammensetzung des Aufsichtsrats zum Handelsregister eingereicht."
    },
    {
      "date": "2025-01-08",
      "id": "98065",
      "original_text": "Registerbekanntmachung nach dem Umwandlungsgesetz\nBerlin Amtsgericht Berlin (Charlottenburg) HRA 63010\nZamani Tehrani, Mohammad & Zamani Tehrani, Mehdi OHG – Berlin",
      "type": "Registerbekanntmachung nach dem Umwandlungsgesetz",
      "state": "Berlin",
      "amtsgericht": "Amtsgericht Berlin (Charlottenburg)",
      "registernummer": "HRA 63010",
      "registerart": "HRA",
      "company_name": "Zamani Tehrani, Mohammad & Zamani Tehrani, Mehdi OHG",
      "company_seat": "Berlin",
      "details": "08.01.2025 (Bekanntmachungsdatum)\n\nBerlin Amtsgericht Berlin (Charlottenburg) HRA 63010\nRegisterbekanntmachung nach dem Umwandlungsgesetz 07.01.2025 (Eintragungsdatum)\n\nZamani Tehrani, Mohammad & Zamani Tehrani, Mehdi OHG\nOffene Handelsgesellschaft\nBerlin\n\nZu Eintragungsnummer 2 vom 07.01.2025 wird als nicht eingetragen veröffentlicht:Den Gläubigern ist, wenn sie binnen sechs Monaten nach dem Tag, an dem die Eintragung der Umwandlung als bekannt gemacht gilt, ihren Anspruch nach Grund und Höhe schriftlich anmelden, Sicherheit zu leisten, soweit sie nicht Befriedigung verlangen können. Dieses Recht steht den Gläubigern jedoch nur zu, wenn sie glaubhaft machen, dass durch die Umwandlung die Erfüllung ihrer Forderung gefährdet wird. Das Recht, Sicherheitsleistung zu verlangen, steht Gläubigern nicht zu, die im Falle der Insolvenz ein Recht auf vorzugsweise Befriedigung aus einer Deckungsmasse haben, die nach gesetzlicher Vorschrift zu ihrem Schutz errichtet und staatlich überwacht ist."
    },
    {
      "date": "2025-01-08",
      "id": "98066",
      "original_text": "Registerbekanntmachung nach dem Umwandlungsgesetz\nBerlin Amtsgericht Berlin (Charlottenburg) HRB 270857\nMeet Me Halfway GmbH – Berlin",
      "type": "Registerbekanntmachung nach dem Umwandlungsgesetz",
      "state": "Berlin",
      "amtsgericht": "Amtsgericht Berlin (Charlottenburg)",
      "registernummer": "HRB 270857",
      "registerart": "HRB",
      "company_name": "Meet Me Halfway GmbH",
      "company_seat": "Berlin",
      "details": "08.01.2025 (Bekanntmachungsdatum)\n\nBerlin Amtsgericht Berlin (Charlottenburg) HRB 270857\nRegisterbekanntmachung nach dem Umwandlungsgesetz 07.01.2025 (Eintragungsdatum)\n\nMeet Me Halfway GmbH\nGesellschaft mit beschränkter Haftung\nBerlin\n\nZu Eintragungsnummer 1 vom 07.01.2025 wird als nicht eingetragen veröffentlicht:Den Gläubigern ist, wenn sie binnen sechs Monaten nach dem Tag, an dem die Eintragung der Umwandlung als bekannt gemacht gilt, ihren Anspruch nach Grund und Höhe schriftlich anmelden, Sicherheit zu leisten, soweit sie nicht Befriedigung verlangen können. Dieses Recht steht den Gläubigern jedoch nur zu, wenn sie glaubhaft machen, dass durch die Umwandlung die Erfüllung ihrer Forderung gefährdet wird. Das Recht, Sicherheitsleistung zu verlangen, steht Gläubigern nicht zu, die im Falle der Insolvenz ein Recht auf vorzugsweise Befriedigung aus einer Deckungsmasse haben, die nach gesetzlicher Vorschrift zu ihrem Schutz errichtet und staatlich überwacht ist."
    },
    {
      "date": "2025-01-08",
      "id": "98067",
      "original_text": "Einreichung neuer Dokumente\nSachsen-Anhalt Amtsgericht Stendal HRB 35303\nQuartier Immo Invest I AG – Naumburg (Saale)",
      "type": "Einreichung neuer Dokumente",
      "state": "Sachsen-Anhalt",
      "amtsgericht": "Amtsgericht Stendal",
      "registernummer": "HRB 35303",
      "registerart": "HRB",
      "company_name": "Quartier Immo Invest I AG",
      "company_seat": "Naumburg (Saale)",
      "details": "08.01.2025 (Bekanntmachungsdatum)\n\nSachsen-Anhalt Amtsgericht Stendal HRB 35303\nEinreichung neuer Dokumente 08.01.2025 (Eintragungsdatum)\n\nQuartier Immo Invest I AG\nAktiengesellschaft\nNaumburg (Saale)\n\nEine Liste der Mitglieder des Aufsichtsrates wurde zum Handelsregister eingereicht."
    },
    {
      "date": "2025-01-08",
      "id": "98068",
      "original_text": "Registerbekanntmachung nach dem Umwandlungsgesetz\nSchleswig-Holstein Amtsgericht Kiel HRA 12420\nGacfar Elmoussa e. K. – Heikendorf",
      "type": "Registerbekanntmachung nach dem Umwandlungsgesetz",
      "state": "Schleswig-Holstein",
      "amtsgericht": "Amtsgericht Kiel",
      "registernummer": "HRA 12420",
      "registerart": "HRA",
      "company_name": "Gacfar Elmoussa e. K.",
      "company_seat": "Heikendorf",
      "details": "08.01.2025 (Bekanntmachungsdatum)\n\nSchleswig-Holstein Amtsgericht Kiel HRA 12420\nRegisterbekanntmachung nach dem Umwandlungsgesetz 17.12.2024 (Eintragungsdatum)\n\nGacfar Elmoussa e. K.\nEinzelkaufmann / Einzelkauffrau\nHeikendorf\n\nZu Eintragungsnummer 2 vom 17.12.2024 wird als nicht eingetragen veröffentlicht:  Den Gläubigern der an der Spaltung beteiligten Rechtsträger ist, wenn sie binnen sechs Monaten nach dem Tag, an dem die Eintragung der Spaltung in das Register des Sitzes desjenigen Rechtsträgers, dessen Gläubiger sie sind,  bekannt gemacht worden ist, ihren Anspruch nach Grund und Höhe schriftlich anmelden, Sicherheit zu leisten, soweit sie nicht Befriedigung verlangen können. Dieses Recht steht den Gläubigern jedoch nur zu, wenn sie glaubhaft machen, dass durch die Spaltung die Erfüllung ihrer Forderung gefährdet wird."
    },
    {
      "date": "2025-01-08",
      "id": "98069",
      "original_text": "Löschungsankündigung\nBerlin Amtsgericht Berlin (Charlottenburg) HRB 144823\nO.A. Projects UG (haftungsbeschränkt) – Berlin",
      "type": "Löschungsankündigung",
      "state": "Berlin",
      "amtsgericht": "Amtsgericht Berlin (Charlottenburg)",
      "registernummer": "HRB 144823",
      "registerart": "HRB",
      "company_name": "O.A. Projects UG (haftungsbeschränkt)",
      "company_seat": "Berlin",
      "details": "08.01.2025 (Bekanntmachungsdatum)\n\nBerlin Amtsgericht Berlin (Charlottenburg) HRB 144823\nLöschungsankündigung\n\nO.A. Projects UG (haftungsbeschränkt)\nGesellschaft mit beschränkter Haftung\nBerlin\n\nBei der nachstehenden Gesellschaft wird das Amtslöschungsverfahren gemäß § 394 FamFG eingeleitet. Widerspruchsfrist 6 Wochen"
    },
    {
      "date": "2025-01-08",
      "id": "98070",
      "original_text": "Löschungsankündigung\nSaarland Amtsgericht Saarbrücken HRB 106993\nGreen Health Concept UG (haftungsbeschränkt) – Homburg",
      "type": "Löschungsankündigung",
      "state": "Saarland",
      "amtsgericht": "Amtsgericht Saarbrücken",
      "registernummer": "HRB 106993",
      "registerart": "HRB",
      "company_name": "Green Health Concept UG (haftungsbeschränkt)",
      "company_seat": "Homburg",
      "details": "08.01.2025 (Bekanntmachungsdatum)\n\nSaarland Amtsgericht Saarbrücken HRB 106993\nLöschungsankündigung\n\nGreen Health Concept UG (haftungsbeschränkt)\nGesellschaft mit beschränkter Haftung\nHomburg\n\nEs ist beabsichtigt, die Gesellschaft von Amts wegen gemäß § 394 FamFG wegen Vermögenslosigkeit zu löschen. Gegen die Löschung von Amts wegen ist das Rechtsmittel des Widerspruchs statthaft. Der Widerspruch ist binnen einer Frist von 1 Monat beginnend mit dem Tag dieser Veröffentlichung durch Einreichen eines Widerspruchsschreibens -schriftlich oder zur Niederschrift der Geschäftsstelle- beim Amtsgericht Saarbrücken, -zentrales Handelsregister-, Mainzerstr.178, 66121 Saarbrücken einzulegen. Der Widerspruch muss die Bezeichnung der angefochtenen Löschungsankündigung enthalten sowie die Erklärung, dass Widerspruch eingelegt wird. Er ist vom Widerspruchsführer oder seinem Bevollmächtigten zu unterzeichnen."
    },
    {
      "date": "2025-01-08",
      "id": "98071",
      "original_text": "Registerbekanntmachung nach dem Umwandlungsgesetz\nBerlin Amtsgericht Berlin (Charlottenburg) HRB 169178\nHRG Hotel Holdings GmbH – Berlin",
      "type": "Registerbekanntmachung nach dem Umwandlungsgesetz",
      "state": "Berlin",
      "amtsgericht": "Amtsgericht Berlin (Charlottenburg)",
      "registernummer": "HRB 169178",
      "registerart": "HRB",
      "company_name": "HRG Hotel Holdings GmbH",
      "company_seat": "Berlin",
      "details": "08.01.2025 (Bekanntmachungsdatum)\n\nBerlin Amtsgericht Berlin (Charlottenburg) HRB 169178\nRegisterbekanntmachung nach dem Umwandlungsgesetz 12.09.2024 (Eintragungsdatum)\n\nHRG Hotel Holdings GmbH\nGesellschaft mit beschränkter Haftung\nBerlin\n\nZu Eintragungsnummer 9 vom 12.09.2024 wird als nicht eingetragen veröffentlicht:\n\nDie Gesellschaft hat den Entwurf eines Abspaltungsplans beim Handelsregister eingereicht.\nDie abspaltende Gesellschaft, HRG Hotel Holdings GmbH, ist eine Gesellschaft mit beschränkter Haftung nach dem Recht der Bundesrepublik Deutschland (GmbH) mit Sitz in Berlin, Deutschland. Die Gesellschaft soll im Wege der Abspaltung zur Neugründung gemäß §§ 320 Abs. 1 Nr. 1, 123 Abs. 2 Nr. 2 UmwG einen Teil ihres Vermögens mit allen Rechten und Pflichten als Gesamtheit auf die von ihr neu zu gründende HRG Hotels Dritte Management B.V. (Besloten Vennootschap met beperkte aansprakelijkheid) (\"Übernehmende Gesellschaft\") als übernehmende Gesellschaft übertragen.\nDie Gesellschaft ist eingetragen im Handelsregister des Amtsgerichts Charlottenburg unter HRB 169178 B. Nach Vollzug der Abspaltung wird die Übernehmende Gesellschaft in das niederländische Handelsregister {Kamer van Koophandel) eingetragen.\nDer Gesellschafter und die Gläubiger der Gesellschaft (Betriebsräte und Arbeitnehmer gibt es nicht) werden darauf hingewiesen, dass sie der Gesellschaft spätestens fünf Arbeitstage vor dem Tag der Gesellschafterversammlung, die über die Zustimmung zu dem Abspaltungsplan beschließen soll, Bemerkungen zu dem Abspaltungsplan übermitteln können. Die Gesellschafterversammlung findet am 21. Februar 2025 statt.\n\nSchmidt\nRichterin am Amtsgericht"
    },
    {
      "date": "2025-01-08",
      "id": "98072",
      "original_text": "Löschungsankündigung\nSchleswig-Holstein Amtsgericht Pinneberg HRB 13227\nWBK Wedeler Baukontor GmbH – Rellingen",
      "type": "Löschungsankündigung",
      "state": "Schleswig-Holstein",
      "amtsgericht": "Amtsgericht Pinneberg",
      "registernummer": "HRB 13227",
      "registerart": "HRB",
      "company_name": "WBK Wedeler Baukontor GmbH",
      "company_seat": "Rellingen",
      "details": "08.01.2025 (Bekanntmachungsdatum)\n\nSchleswig-Holstein Amtsgericht Pinneberg HRB 13227\nLöschungsankündigung\n\nWBK Wedeler Baukontor GmbH\nGesellschaft mit beschränkter Haftung\nRellingen\n\nEs ist die Löschung der nachstehenden Gesellschaft wegen Vermögenslosigkeit gemäß § 394 FamFG beabsichtigt. Widerspruchsfrist: 2 Monate."
    },
    {
      "date": "2025-01-08",
      "id": "98073",
      "original_text": "Einreichung neuer Dokumente\nBaden-Württemberg Amtsgericht Mannheim HRB 100097\nAlliance One Rotag AG – Karlsruhe",
      "type": "Einreichung neuer Dokumente",
      "state": "Baden-Württemberg",
      "amtsgericht": "Amtsgericht Mannheim",
      "registernummer": "HRB 100097",
      "registerart": "HRB",
      "company_name": "Alliance One Rotag AG",
      "company_seat": "Karlsruhe",
      "details": "08.01.2025 (Bekanntmachungsdatum)\n\nBaden-Württemberg Amtsgericht Mannheim HRB 100097\nEinreichung neuer Dokumente\n\nAlliance One Rotag AG\nAktiengesellschaft\nKarlsruhe\n\nDie Gesellschaft hat am 08.01.2025 die Liste über die Zusammensetzung des Aufsichtsrats zum Handelsregister eingereicht."
    },
    {
      "date": "2025-01-08",
      "id": "98074",
      "original_text": "Einreichung neuer Dokumente\nBrandenburg Amtsgericht Potsdam HRB 21178\nLuftschiffhafen Potsdam GmbH – Potsdam",
      "type": "Einreichung neuer Dokumente",
      "state": "Brandenburg",
      "amtsgericht": "Amtsgericht Potsdam",
      "registernummer": "HRB 21178",
      "registerart": "HRB",
      "company_name": "Luftschiffhafen Potsdam GmbH",
      "company_seat": "Potsdam",
      "details": "08.01.2025 (Bekanntmachungsdatum)\n\nBrandenburg Amtsgericht Potsdam HRB 21178\nEinreichung neuer Dokumente\n\nLuftschiffhafen Potsdam GmbH\nGesellschaft mit beschränkter Haftung\nPotsdam\n\nAls nicht eingetragen wird veröffentlicht: Eine Liste der Mitglieder des Aufsichtsrates wurde zum Handelsregister eingereicht."
    },
    {
      "date": "2025-01-08",
      "id": "98075",
      "original_text": "Registerbekanntmachung nach dem Umwandlungsgesetz\nBaden-Württemberg Amtsgericht Mannheim HRB 745484\nANEXIA Deutschland GmbH – Karlsruhe",
      "type": "Registerbekanntmachung nach dem Umwandlungsgesetz",
      "state": "Baden-Württemberg",
      "amtsgericht": "Amtsgericht Mannheim",
      "registernummer": "HRB 745484",
      "registerart": "HRB",
      "company_name": "ANEXIA Deutschland GmbH",
      "company_seat": "Karlsruhe",
      "details": "08.01.2025 (Bekanntmachungsdatum)\n\nBaden-Württemberg Amtsgericht Mannheim HRB 745484\nRegisterbekanntmachung nach dem Umwandlungsgesetz 08.01.2025 (Eintragungsdatum)\n\nANEXIA Deutschland GmbH\nGesellschaft mit beschränkter Haftung\nKarlsruhe\n\nDen Gläubigern der an der Verschmelzung beteiligten Rechtsträger ist, wenn sie binnen sechs Monaten nach dem Tag, an dem die Eintragung der Verschmelzung in das Register des Sitzes desjenigen Rechtsträgers, dessen Gläubiger sie sind, nach § 19 Abs. 3 UmwG als bekanntgemacht gilt, ihren Anspruch nach Grund und Höhe schriftlich anmelden, Sicherheit zu leisten, soweit sie nicht Befriedigung verlangen können. Dieses Recht steht den Gläubigern jedoch nur zu, wenn sie glaubhaft machen, dass durch die Verschmelzung die Erfüllung ihrer Forderung gefährdet wird."
    },
    {
      "date": "2025-01-08",
      "id": "98076",
      "original_text": "Registerbekanntmachung nach dem Umwandlungsgesetz\nSchleswig-Holstein Amtsgericht Kiel HRB 13665\nBUD Verwaltungs GmbH – Noer OT Lindhöft",
      "type": "Registerbekanntmachung nach dem Umwandlungsgesetz",
      "state": "Schleswig-Holstein",
      "amtsgericht": "Amtsgericht Kiel",
      "registernummer": "HRB 13665",
      "registerart": "HRB",
      "company_name": "BUD Verwaltungs GmbH",
      "company_seat": "Noer OT Lindhöft",
      "details": "08.01.2025 (Bekanntmachungsdatum)\n\nSchleswig-Holstein Amtsgericht Kiel HRB 13665\nRegisterbekanntmachung nach dem Umwandlungsgesetz 29.10.2024 (Eintragungsdatum)\n\nBUD Verwaltungs GmbH\nGesellschaft mit beschränkter Haftung\nNoer OT Lindhöft\n\nZu Eintragungsnummer 4 vom 29.10.2024 wird als nicht eingetragen veröffentlicht: Den Gläubigern der an der Verschmelzung beteiligten Rechtsträger ist, wenn sie binnen sechs Monaten nach dem Tag, an dem die Eintragung der Verschmelzung in das Register des Sitzes desjenigen Rechtsträgers, dessen Gläubiger sie sind, nach § 19 Abs. 3 UmwG bekannt gemacht worden ist, ihren Anspruch nach Grund und Höhe schriftlich anmelden, Sicherheit zu leisten, soweit sie nicht Befriedigung verlangen können. Dieses Recht steht den Gläubigern jedoch nur zu, wenn sie glaubhaft machen, dass durch die Verschmelzung die Erfüllung ihrer Forderung gefährdet wird."
    },
    {
      "date": "2025-01-08",
      "id": "98077",
      "original_text": "Einreichung neuer Dokumente\nBaden-Württemberg Amtsgericht Mannheim HRB 502640\nGesellschaft für Beschäftigung und berufliche Eingliederung mbH Pforzheim (GBE) – Pforzheim",
      "type": "Einreichung neuer Dokumente",
      "state": "Baden-Württemberg",
      "amtsgericht": "Amtsgericht Mannheim",
      "registernummer": "HRB 502640",
      "registerart": "HRB",
      "company_name": "Gesellschaft für Beschäftigung und berufliche Eingliederung mbH Pforzheim (GBE)",
      "company_seat": "Pforzheim",
      "details": "08.01.2025 (Bekanntmachungsdatum)\n\nBaden-Württemberg Amtsgericht Mannheim HRB 502640\nEinreichung neuer Dokumente 07.01.2025 (Eintragungsdatum)\n\nGesellschaft für Beschäftigung und berufliche Eingliederung mbH Pforzheim (GBE)\nGesellschaft mit beschränkter Haftung\nPforzheim\n\nDie Gesellschaft hat am 07.01.2025 die Liste über die Zusammensetzung des Aufsichtsrats zum Handelsregister eingereicht."
    },
    {
      "date": "2025-01-08",
      "id": "98078",
      "original_text": "Löschungsankündigung\nSachsen Amtsgericht Dresden HRB 33102\nKHS Immobilien GmbH – Pirna",
      "type": "Löschungsankündigung",
      "state": "Sachsen",
      "amtsgericht": "Amtsgericht Dresden",
      "registernummer": "HRB 33102",
      "registerart": "HRB",
      "company_name": "KHS Immobilien GmbH",
      "company_seat": "Pirna",
      "details": "08.01.2025 (Bekanntmachungsdatum)\n\nSachsen Amtsgericht Dresden HRB 33102\nLöschungsankündigung\n\nKHS Immobilien GmbH\nGesellschaft mit beschränkter Haftung\nPirna\n\nDas Registergericht beabsichtigt, die im Handelsregister eingetragene Gesellschaft von Amts wegen nach § 394 FamFG zu löschen. Die Frist zu Erhebung eines Widerspruchs gegen die beabsichtigte Löschung wird auf einen Monat festgesetzt."
    },
    {
      "date": "2025-01-08",
      "id": "98079",
      "original_text": "Löschungsankündigung\nSachsen Amtsgericht Chemnitz HRB 16270\nGFU Hähner und Co. Unternehmensberatung GmbH – Mülsen",
      "type": "Löschungsankündigung",
      "state": "Sachsen",
      "amtsgericht": "Amtsgericht Chemnitz",
      "registernummer": "HRB 16270",
      "registerart": "HRB",
      "company_name": "GFU Hähner und Co. Unternehmensberatung GmbH",
      "company_seat": "Mülsen",
      "details": "08.01.2025 (Bekanntmachungsdatum)\n\nSachsen Amtsgericht Chemnitz HRB 16270\nLöschungsankündigung 08.01.2025 (Eintragungsdatum)\n\nGFU Hähner und Co. Unternehmensberatung GmbH\nGesellschaft mit beschränkter Haftung\nMülsen\n\nDas Registergericht beabsichtigt, die im Handelsregister eingetragene Gesellschaft von Amts wegen nach § 394 FamFG zu löschen. Die Frist zu Erhebung eines Widerspruchs gegen die beabsichtigte Löschung wird auf einen Monat festgesetzt."
    },
    {
      "date": "2025-01-08",
      "id": "98080",
      "original_text": "Sonstige Registerbekanntmachung\nSachsen Amtsgericht Dresden HRB 12870\nBeyond Gravity Germany GmbH – Coswig",
      "type": "Sonstige Registerbekanntmachung",
      "state": "Sachsen",
      "amtsgericht": "Amtsgericht Dresden",
      "registernummer": "HRB 12870",
      "registerart": "HRB",
      "company_name": "Beyond Gravity Germany GmbH",
      "company_seat": "Coswig",
      "details": "08.01.2025 (Bekanntmachungsdatum)\n\nSachsen Amtsgericht Dresden HRB 12870\nSonstige Registerbekanntmachung 08.01.2025 (Eintragungsdatum)\n\nBeyond Gravity Germany GmbH\nGesellschaft mit beschränkter Haftung\nCoswig\n\nDen Gläubigern der Gesellschaft, deren Forderungen begründet worden sind bevor die Eintragung der Beendigung des Vertrages in das Handelsregister nach § 10 des Handelsgesetzbuches als bekanntgemacht gilt, hat der andere Vertragsteil Sicherheit zu leisten, wenn sie sich binnen sechs Monaten nach der Bekanntmachung der Eintragung zu diesem Zweck bei ihm melden."
    },
    {
      "date": "2025-01-08",
      "id": "98081",
      "original_text": "Löschungsankündigung\nSachsen Amtsgericht Dresden HRB 15768\nOptiNet EDV-Systeme & Netzwerke Verwaltungs-GmbH – Dresden",
      "type": "Löschungsankündigung",
      "state": "Sachsen",
      "amtsgericht": "Amtsgericht Dresden",
      "registernummer": "HRB 15768",
      "registerart": "HRB",
      "company_name": "OptiNet EDV-Systeme & Netzwerke Verwaltungs-GmbH",
      "company_seat": "Dresden",
      "details": "08.01.2025 (Bekanntmachungsdatum)\n\nSachsen Amtsgericht Dresden HRB 15768\nLöschungsankündigung\n\nOptiNet EDV-Systeme & Netzwerke Verwaltungs-GmbH\nGesellschaft mit beschränkter Haftung\nDresden\n\nDas Registergericht beabsichtigt, die im Handelsregister eingetragene Gesellschaft von Amts wegen nach § 394 FamFG zu löschen. Die Frist zu Erhebung eines Widerspruchs gegen die beabsichtigte Löschung wird auf einen Monat festgesetzt."
    },
    {
      "date": "2025-01-08",
      "id": "98082",
      "original_text": "Registerbekanntmachung nach dem Umwandlungsgesetz\nSachsen Amtsgericht Chemnitz HRB 17544\nWUDAG Umweltdienste AG – Hartmannsdorf",
      "type": "Registerbekanntmachung nach dem Umwandlungsgesetz",
      "state": "Sachsen",
      "amtsgericht": "Amtsgericht Chemnitz",
      "registernummer": "HRB 17544",
      "registerart": "HRB",
      "company_name": "WUDAG Umweltdienste AG",
      "company_seat": "Hartmannsdorf",
      "details": "08.01.2025 (Bekanntmachungsdatum)\n\nSachsen Amtsgericht Chemnitz HRB 17544\nRegisterbekanntmachung nach dem Umwandlungsgesetz 08.01.2025 (Eintragungsdatum)\n\nWUDAG Umweltdienste AG\nAktiengesellschaft\nHartmannsdorf\n\nDen Gläubigern der an der Umwandlung beteiligten Rechtsträger ist, wenn sie binnen sechs Monaten nach dem Tag, an dem die Eintragung der Umwandlung in das Register des Sitzes desjenigen Rechtsträgers, dessen Gläubiger sie sind, nach § 19 Abs. 3 UmwG als bekannt gemacht gilt, ihren Anspruch nach Grund und Höhe in Textform anmelden, Sicherheit zu leisten, soweit sie nicht Befriedigung verlangen können. Dieses Recht steht den Gläubigern jedoch nur zu, wenn sie glaubhaft machen, dass durch die Umwandlung die Erfüllung der Forderung gefährdet wird."
    },
    {
      "date": "2025-01-08",
      "id": "98083",
      "original_text": "Sonstige Registerbekanntmachung\nSachsen Amtsgericht Leipzig HRB 33638\nBALANCE Erneuerbare Energien GmbH – Leipzig",
      "type": "Sonstige Registerbekanntmachung",
      "state": "Sachsen",
      "amtsgericht": "Amtsgericht Leipzig",
      "registernummer": "HRB 33638",
      "registerart": "HRB",
      "company_name": "BALANCE Erneuerbare Energien GmbH",
      "company_seat": "Leipzig",
      "details": "08.01.2025 (Bekanntmachungsdatum)\n\nSachsen Amtsgericht Leipzig HRB 33638\nSonstige Registerbekanntmachung 08.01.2025 (Eintragungsdatum)\n\nBALANCE Erneuerbare Energien GmbH\nGesellschaft mit beschränkter Haftung\nLeipzig\n\nDen Gläubigern der Gesellschaft, deren Forderungen begründet worden sind bevor die Eintragung der Beendigung des Beherrschungs- und Gewinnabführungsvertrages in das Handelsregister nach § 10 des Handelsgesetzbuches als bekanntgemacht gilt, hat der andere Vertragsteil Sicherheit zu leisten, wenn sie sich binnen sechs Monaten nach der Bekanntmachung der Eintragung zu diesem Zweck bei ihm melden."
    },
    {
      "date": "2025-01-08",
      "id": "98084",
      "original_text": "Löschungsankündigung\nSachsen Amtsgericht Dresden HRB 34079\nAL Objektausbau GmbH – Coswig",
      "type": "Löschungsankündigung",
      "state": "Sachsen",
      "amtsgericht": "Amtsgericht Dresden",
      "registernummer": "HRB 34079",
      "registerart": "HRB",
      "company_name": "AL Objektausbau GmbH",
      "company_seat": "Coswig",
      "details": "08.01.2025 (Bekanntmachungsdatum)\n\nSachsen Amtsgericht Dresden HRB 34079\nLöschungsankündigung\n\nAL Objektausbau GmbH\nGesellschaft mit beschränkter Haftung\nCoswig\n\nDas Registergericht beabsichtigt, die im Handelsregister eingetragene Gesellschaft von Amts wegen nach § 394 FamFG zu löschen. Die Frist zu Erhebung eines Widerspruchs gegen die beabsichtigte Löschung wird auf einen Monat festgesetzt."
    },
    {
      "date": "2025-01-08",
      "id": "98085",
      "original_text": "Löschungsankündigung\nSachsen Amtsgericht Dresden HRB 25007\nMARBELLANY-BAU, SL Zweigniederlassung Reinhardtsgrimma – Reinhardtsgrimma",
      "type": "Löschungsankündigung",
      "state": "Sachsen",
      "amtsgericht": "Amtsgericht Dresden",
      "registernummer": "HRB 25007",
      "registerart": "HRB",
      "company_name": "MARBELLANY-BAU, SL Zweigniederlassung Reinhardtsgrimma",
      "company_seat": "Reinhardtsgrimma",
      "details": "08.01.2025 (Bekanntmachungsdatum)\n\nSachsen Amtsgericht Dresden HRB 25007\nLöschungsankündigung\n\nMARBELLANY-BAU, SL Zweigniederlassung Reinhardtsgrimma\nRechtsform ausländischen Rechts HRB\nReinhardtsgrimma\n\nDas Registergericht beabsichtigt, den im Handelsregister eingetragenen Geschäftsführer Fritz-Dieter Scholz von Amts wegen nach § 395 Absatz 1 FamFG zu löschen. Die Frist zu Erhebung eines Widerspruchs gegen die beabsichtigte Löschung wird auf einen Monat festgesetzt."
    },
    {
      "date": "2025-01-08",
      "id": "98086",
      "original_text": "Löschungsankündigung\nNiedersachsen Amtsgericht Osnabrück HRB 212009\n3L Beteiligungsgesellschaft UG (haftungsbeschränkt) – Bad Rothenfelde",
      "type": "Löschungsankündigung",
      "state": "Niedersachsen",
      "amtsgericht": "Amtsgericht Osnabrück",
      "registernummer": "HRB 212009",
      "registerart": "HRB",
      "company_name": "3L Beteiligungsgesellschaft UG (haftungsbeschränkt)",
      "company_seat": "Bad Rothenfelde",
      "details": "08.01.2025 (Bekanntmachungsdatum)\n\nNiedersachsen Amtsgericht Osnabrück HRB 212009\nLöschungsankündigung 08.01.2025 (Eintragungsdatum)\n\n3L Beteiligungsgesellschaft UG (haftungsbeschränkt)\nGesellschaft mit beschränkter Haftung\nBad Rothenfelde\n\nDas Registergericht beabsichtigt, die Gesellschaft von Amts wegen nach § 394 FamFG wegen Vermögenslosigkeit zu löschen. Die Frist zur Erhebung eines Widerspruchs ist auf 1 Monat ab dieser Registerbekanntmachung festgesetzt."
    },
    {
      "date": "2025-01-08",
      "id": "98087",
      "original_text": "Registerbekanntmachung nach dem Umwandlungsgesetz\nNiedersachsen Amtsgericht Göttingen HRA 202189\nKönig Profilsysteme GmbH & Co. KG – Moringen",
      "type": "Registerbekanntmachung nach dem Umwandlungsgesetz",
      "state": "Niedersachsen",
      "amtsgericht": "Amtsgericht Göttingen",
      "registernummer": "HRA 202189",
      "registerart": "HRA",
      "company_name": "König Profilsysteme GmbH & Co. KG",
      "company_seat": "Moringen",
      "details": "08.01.2025 (Bekanntmachungsdatum)\n\nNiedersachsen Amtsgericht Göttingen HRA 202189\nRegisterbekanntmachung nach dem Umwandlungsgesetz 08.01.2025 (Eintragungsdatum)\n\nKönig Profilsysteme GmbH & Co. KG\nKommanditgesellschaft\nMoringen\n\nDen Gläubigern der an der Ausgliederung beteiligten Rechtsträger ist, wenn sie binnen sechs Monaten nach dem Tag, an dem die Eintragung der Ausgliederung in das Register des Sitzes desjenigen Rechtsträgers, dessen Gläubiger sie sind, nach § 19 Abs. 3 UmwG als bekannt gemacht gilt, ihren Anspruch nach Grund und Höhe schriftlich anmelden, Sicherheit zu leisten, soweit sie nicht Befriedigung verlangen können. Dieses Recht steht den Gläubigern jedoch nur zu, wenn sie glaubhaft machen, dass durch die Ausgliederung die Erfüllung der Forderung gefährdet wird."
    },
    {
      "date": "2025-01-08",
      "id": "98088",
      "original_text": "Registerbekanntmachung nach dem Umwandlungsgesetz\nNiedersachsen Amtsgericht Osnabrück HRB 20672\nZweite Bürgerwind GmbH – Osnabrück",
      "type": "Registerbekanntmachung nach dem Umwandlungsgesetz",
      "state": "Niedersachsen",
      "amtsgericht": "Amtsgericht Osnabrück",
      "registernummer": "HRB 20672",
      "registerart": "HRB",
      "company_name": "Zweite Bürgerwind GmbH",
      "company_seat": "Osnabrück",
      "details": "08.01.2025 (Bekanntmachungsdatum)\n\nNiedersachsen Amtsgericht Osnabrück HRB 20672\nRegisterbekanntmachung nach dem Umwandlungsgesetz 08.01.2025 (Eintragungsdatum)\n\nZweite Bürgerwind GmbH\nGesellschaft mit beschränkter Haftung\nOsnabrück\n\nDen Gläubigern der an der Verschmelzung beteiligten Rechtsträger ist, wenn sie binnen sechs Monaten nach dem Tag, an dem die Eintragung der Verschmelzung in das Register des Sitzes desjenigen Rechtsträgers, dessen Gläubiger sie sind, nach § 19  Abs.  3 UmwG als bekannt gemacht gilt, ihren Anspruch nach Grund und Höhe schriftlich anmelden, Sicherheit zu leisten, soweit sie nicht Befriedigung verlangen können. Dieses Recht steht den Gläubigern jedoch nur zu, wenn sie glaubhaft machen, dass durch die Verschmelzung die Erfüllung der Forderung gefährdet wird."
    },
    {
      "date": "2025-01-08",
      "id": "98089",
      "original_text": "Sonstige Registerbekanntmachung\nNiedersachsen Amtsgericht Oldenburg (Oldenburg) HRB 207350\nOffshore-Windpark RIFFGAT GmbH – Oldenburg",
      "type": "Sonstige Registerbekanntmachung",
      "state": "Niedersachsen",
      "amtsgericht": "Amtsgericht Oldenburg (Oldenburg)",
      "registernummer": "HRB 207350",
      "registerart": "HRB",
      "company_name": "Offshore-Windpark RIFFGAT GmbH",
      "company_seat": "Oldenburg",
      "details": "08.01.2025 (Bekanntmachungsdatum)\n\nNiedersachsen Amtsgericht Oldenburg (Oldenburg) HRB 207350\nSonstige Registerbekanntmachung 08.01.2025 (Eintragungsdatum)\n\nOffshore-Windpark RIFFGAT GmbH\nGesellschaft mit beschränkter Haftung\nOldenburg\n\nDen Gläubigern der Gesellschaft, deren Forderungen begründet worden sind, bevor die Eintragung der Beendigung des Vertrages in das Handelsregister nach § 10 HGB als bekanntgemacht gilt, ist vom anderen Vertragsteil Sicherheit zu leisten, wenn sie sich binnen sechs Monaten nach der Bekanntmachung zu diesem Zweck bei ihm melden."
    },
    {
      "date": "2025-01-08",
      "id": "98090",
      "original_text": "Sonstige Registerbekanntmachung\nNiedersachsen Amtsgericht Oldenburg (Oldenburg) HRB 207350\nOffshore-Windpark RIFFGAT GmbH – Oldenburg",
      "type": "Sonstige Registerbekanntmachung",
      "state": "Niedersachsen",
      "amtsgericht": "Amtsgericht Oldenburg (Oldenburg)",
      "registernummer": "HRB 207350",
      "registerart": "HRB",
      "company_name": "Offshore-Windpark RIFFGAT GmbH",
      "company_seat": "Oldenburg",
      "details": "08.01.2025 (Bekanntmachungsdatum)\n\nNiedersachsen Amtsgericht Oldenburg (Oldenburg) HRB 207350\nSonstige Registerbekanntmachung 08.01.2025 (Eintragungsdatum)\n\nOffshore-Windpark RIFFGAT GmbH\nGesellschaft mit beschränkter Haftung\nOldenburg\n\nDen Gläubigern der Gesellschaft, deren Forderungen begründet worden sind, bevor die Eintragung der Beendigung des Vertrages in das Handelsregister nach § 10 HGB als bekanntgemacht gilt, ist vom anderen Vertragsteil Sicherheit zu leisten, wenn sie sich binnen sechs Monaten nach der Bekanntmachung zu diesem Zweck bei ihm melden."
    },
    {
      "date": "2025-01-08",
      "id": "98091",
      "original_text": "Registerbekanntmachung nach dem Umwandlungsgesetz\nNiedersachsen Amtsgericht Osnabrück GsR 690\nWindpark Lippetal Netz GmbH & Co. eGbR – Osnabrück",
      "type": "Registerbekanntmachung nach dem Umwandlungsgesetz",
      "state": "Niedersachsen",
      "amtsgericht": "Amtsgericht Osnabrück",
      "registernummer": "GsR 690",
      "registerart": "GsR",
      "company_name": "Windpark Lippetal Netz GmbH & Co. eGbR",
      "company_seat": "Osnabrück",
      "details": "08.01.2025 (Bekanntmachungsdatum)\n\nNiedersachsen Amtsgericht Osnabrück GsR 690\nRegisterbekanntmachung nach dem Umwandlungsgesetz 08.01.2025 (Eintragungsdatum)\n\nWindpark Lippetal Netz GmbH & Co. eGbR\nGesellschaft bürgerlichen Rechts\nOsnabrück\n\nDen Gläubigern der an der Verschmelzung beteiligten Rechtsträger ist, wenn sie binnen sechs Monaten nach dem Tag, an dem die Eintragung der Verschmelzung in das Register des Sitzes desjenigen Rechtsträgers, dessen Gläubiger sie sind, nach § 19  Abs.  3 UmwG als bekannt gemacht gilt, ihren Anspruch nach Grund und Höhe schriftlich anmelden, Sicherheit zu leisten, soweit sie nicht Befriedigung verlangen können. Dieses Recht steht den Gläubigern jedoch nur zu, wenn sie glaubhaft machen, dass durch die Verschmelzung die Erfüllung der Forderung gefährdet wird."
    },
    {
      "date": "2025-01-08",
      "id": "98092",
      "original_text": "Löschungsankündigung\nNiedersachsen Amtsgericht Lüneburg HRB 120944 früher Amtsgericht Dannenberg (Elbe)\nJO Augenoptik GmbH – Lüchow",
      "type": "Löschungsankündigung",
      "state": "Niedersachsen",
      "amtsgericht": "Amtsgericht Lüneburg",
      "registernummer": "HRB 120944",
      "registerart": "HRB",
      "company_name": "JO Augenoptik GmbH",
      "company_seat": "Lüchow",
      "former_amtsgericht": "Dannenberg (Elbe)",
      "details": "08.01.2025 (Bekanntmachungsdatum)\n\nNiedersachsen Amtsgericht Lüneburg HRB 120944 früher Amtsgericht Dannenberg (Elbe)\nLöschungsankündigung\n\nJO Augenoptik GmbH\nGesellschaft mit beschränkter Haftung\nLüchow\n\nDas Registergericht beabsichtigt, die Gesellschaft von Amts wegen nach § 394 FamFG zu löschen. Die Frist zur Erhebung eines Widerspruchs ist auf 1 Monat ab dieser Registerbekanntmachung festgesetzt."
    },
    {
      "date": "2025-01-08",
      "id": "98093",
      "original_text": "Einreichung neuer Dokumente\nNiedersachsen Amtsgericht Walsrode HRB 120002\nStadtwerke Achim AG – Achim",
      "type": "Einreichung neuer Dokumente",
      "state": "Niedersachsen",
      "amtsgericht": "Amtsgericht Walsrode",
      "registernummer": "HRB 120002",
      "registerart": "HRB",
      "company_name": "Stadtwerke Achim AG",
      "company_seat": "Achim",
      "details": "08.01.2025 (Bekanntmachungsdatum)\n\nNiedersachsen Amtsgericht Walsrode HRB 120002\nEinreichung neuer Dokumente\n\nStadtwerke Achim AG\nAktiengesellschaft\nAchim\n\nDie Liste der Mitglieder des Aufsichtsrats wurde beim Registergericht eingereicht."
    },
    {
      "date": "2025-01-08",
      "id": "98094",
      "original_text": "Registerbekanntmachung nach dem Umwandlungsgesetz\nNiedersachsen Amtsgericht Osnabrück HRB 219259\nDevNatives GmbH – Quakenbrück",
      "type": "Registerbekanntmachung nach dem Umwandlungsgesetz",
      "state": "Niedersachsen",
      "amtsgericht": "Amtsgericht Osnabrück",
      "registernummer": "HRB 219259",
      "registerart": "HRB",
      "company_name": "DevNatives GmbH",
      "company_seat": "Quakenbrück",
      "details": "08.01.2025 (Bekanntmachungsdatum)\n\nNiedersachsen Amtsgericht Osnabrück HRB 219259\nRegisterbekanntmachung nach dem Umwandlungsgesetz 08.01.2025 (Eintragungsdatum)\n\nDevNatives GmbH\nGesellschaft mit beschränkter Haftung\nQuakenbrück\n\nDen Gläubigern der an der Verschmelzung beteiligten Rechtsträger ist, wenn sie binnen sechs Monaten nach dem Tag, an dem die Eintragung der Verschmelzung in das Register des Sitzes desjenigen Rechtsträgers, dessen Gläubiger sie sind, nach § 19  Abs.  3 UmwG als bekannt gemacht gilt, ihren Anspruch nach Grund und Höhe schriftlich anmelden, Sicherheit zu leisten, soweit sie nicht Befriedigung verlangen können. Dieses Recht steht den Gläubigern jedoch nur zu, wenn sie glaubhaft machen, dass durch die Verschmelzung die Erfüllung der Forderung gefährdet wird."
    },
    {
      "date": "2025-01-08",
      "id": "98095",
      "original_text": "Registerbekanntmachung nach dem Umwandlungsgesetz\nNiedersachsen Amtsgericht Osnabrück HRB 19921\nRosengarten GmbH – Badbergen",
      "type": "Registerbekanntmachung nach dem Umwandlungsgesetz",
      "state": "Niedersachsen",
      "amtsgericht": "Amtsgericht Osnabrück",
      "registernummer": "HRB 19921",
      "registerart": "HRB",
      "company_name": "Rosengarten GmbH",
      "company_seat": "Badbergen",
      "details": "08.01.2025 (Bekanntmachungsdatum)\n\nNiedersachsen Amtsgericht Osnabrück HRB 19921\nRegisterbekanntmachung nach dem Umwandlungsgesetz 08.01.2025 (Eintragungsdatum)\n\nRosengarten GmbH\nGesellschaft mit beschränkter Haftung\nBadbergen\n\nDen Gläubigern der an der Verschmelzung beteiligten Rechtsträger ist, wenn sie binnen sechs Monaten nach dem Tag, an dem die Eintragung der Verschmelzung in das Register des Sitzes desjenigen Rechtsträgers, dessen Gläubiger sie sind, nach § 19  Abs.  3 UmwG als bekannt gemacht gilt, ihren Anspruch nach Grund und Höhe schriftlich anmelden, Sicherheit zu leisten, soweit sie nicht Befriedigung verlangen können. Dieses Recht steht den Gläubigern jedoch nur zu, wenn sie glaubhaft machen, dass durch die Verschmelzung die Erfüllung der Forderung gefährdet wird."
    },
    {
      "date": "2025-01-08",
      "id": "98096",
      "original_text": "Sonstige Registerbekanntmachung\nNiedersachsen Amtsgericht Oldenburg (Oldenburg) HRB 150663 früher Amtsgericht Cloppenburg\nDM EDV- und Bürosysteme GmbH – Garrel",
      "type": "Sonstige Registerbekanntmachung",
      "state": "Niedersachsen",
      "amtsgericht": "Amtsgericht Oldenburg (Oldenburg)",
      "registernummer": "HRB 150663",
      "registerart": "HRB",
      "company_name": "DM EDV- und Bürosysteme GmbH",
      "company_seat": "Garrel",
      "former_amtsgericht": "Cloppenburg",
      "details": "08.01.2025 (Bekanntmachungsdatum)\n\nNiedersachsen Amtsgericht Oldenburg (Oldenburg) HRB 150663 früher Amtsgericht Cloppenburg\nSonstige Registerbekanntmachung 08.01.2025 (Eintragungsdatum)\n\nDM EDV- und Bürosysteme GmbH\nGesellschaft mit beschränkter Haftung\nGarrel\n\nDen Gläubigern der Gesellschaft, deren Forderungen begründet worden sind, bevor die Eintragung der Beendigung des Vertrages in das Handelsregister nach § 10 HGB als bekanntgemacht gilt, ist vom anderen Vertragsteil Sicherheit zu leisten, wenn sie sich binnen sechs Monaten nach der Bekanntmachung zu diesem Zweck bei ihm melden."
    },
    {
      "date": "2025-01-08",
      "id": "98097",
      "original_text": "Löschungsankündigung\nRheinland-Pfalz Amtsgericht Koblenz HRB 25126\nCRYPTA Sicherheitsservice und mehr GmbH – Ochtendung",
      "type": "Löschungsankündigung",
      "state": "Rheinland-Pfalz",
      "amtsgericht": "Amtsgericht Koblenz",
      "registernummer": "HRB 25126",
      "registerart": "HRB",
      "company_name": "CRYPTA Sicherheitsservice und mehr GmbH",
      "company_seat": "Ochtendung",
      "details": "08.01.2025 (Bekanntmachungsdatum)\n\nRheinland-Pfalz Amtsgericht Koblenz HRB 25126\nLöschungsankündigung\n\nCRYPTA Sicherheitsservice und mehr GmbH\nGesellschaft mit beschränkter Haftung\nOchtendung\n\nDas Registergericht beabsichtigt die Gesellschaft von Amts wegen nach § 394 FamFG zu löschen. Die Frist zur Erhebung eines Widerspruchs ist auf zwei Monate festgesetzt."
    },
    {
      "date": "2025-01-08",
      "id": "98098",
      "original_text": "Löschungsankündigung\nNordrhein-Westfalen Amtsgericht Siegen HRB 6173\nMBG Braun GmbH – Lennestadt",
      "type": "Löschungsankündigung",
      "state": "Nordrhein-Westfalen",
      "amtsgericht": "Amtsgericht Siegen",
      "registernummer": "HRB 6173",
      "registerart": "HRB",
      "company_name": "MBG Braun GmbH",
      "company_seat": "Lennestadt",
      "details": "08.01.2025 (Bekanntmachungsdatum)\n\nNordrhein-Westfalen Amtsgericht Siegen HRB 6173\nLöschungsankündigung\n\nMBG Braun GmbH\nGesellschaft mit beschränkter Haftung\nLennestadt\n\nDas Registergericht beabsichtigt die Gesellschaft von Amts wegen nach § 394 FamFG zu löschen. Die Frist zur Erhebung eines Widerspruchs ist auf drei Monate festgesetzt."
    },
    {
      "date": "2025-01-08",
      "id": "98099",
      "original_text": "Löschungsankündigung\nNordrhein-Westfalen Amtsgericht Mönchengladbach HRA 7382\nBauunternehmung Fallentin & Schmitz GmbH & Co. KG – Mönchengladbach",
      "type": "Löschungsankündigung",
      "state": "Nordrhein-Westfalen",
      "amtsgericht": "Amtsgericht Mönchengladbach",
      "registernummer": "HRA 7382",
      "registerart": "HRA",
      "company_name": "Bauunternehmung Fallentin & Schmitz GmbH & Co. KG",
      "company_seat": "Mönchengladbach",
      "details": "08.01.2025 (Bekanntmachungsdatum)\n\nNordrhein-Westfalen Amtsgericht Mönchengladbach HRA 7382\nLöschungsankündigung\n\nBauunternehmung Fallentin & Schmitz GmbH & Co. KG\nKommanditgesellschaft\nMönchengladbach\n\nDas Registergericht beabsichtigt, die im Handelsregister eingetragene Gesellschaft gemäß § 394 Absatz 1 FamFG wegen Vermögenslosigkeit von Amts wegen zu löschen. Gegen diese Verfügung kann Widerspruch eingelegt werden. Die Frist zur Erhebung eines Widerspruchs gegen die beabsichtigte Löschung von Amts wegen ist auf drei Monate festgesetzt."
    },
    {
      "date": "2025-01-08",
      "id": "98100",
      "original_text": "Löschungsankündigung\nNordrhein-Westfalen Amtsgericht Bochum HRB 20797\nAvant UG (haftungsbeschränkt) – Herne",
      "type": "Löschungsankündigung",
      "state": "Nordrhein-Westfalen",
      "amtsgericht": "Amtsgericht Bochum",
      "registernummer": "HRB 20797",
      "registerart": "HRB",
      "company_name": "Avant UG (haftungsbeschränkt)",
      "company_seat": "Herne",
      "details": "08.01.2025 (Bekanntmachungsdatum)\n\nNordrhein-Westfalen Amtsgericht Bochum HRB 20797\nLöschungsankündigung 09.01.2025 (Eintragungsdatum)\n\nAvant UG (haftungsbeschränkt)\nGesellschaft mit beschränkter Haftung\nHerne\n\nDas Registergericht beabsichtigt die Gesellschaft von Amts wegen nach § 394 FamFG zu löschen. Die Frist zur Erhebung eines Widerspruchs ist auf drei Monate festgesetzt."
    },
    {
      "date": "2025-01-08",
      "id": "98101",
      "original_text": "Löschungsankündigung\nNordrhein-Westfalen Amtsgericht Gütersloh HRB 10715\nMM Gloria Personalservice GmbH – Werther",
      "type": "Löschungsankündigung",
      "state": "Nordrhein-Westfalen",
      "amtsgericht": "Amtsgericht Gütersloh",
      "registernummer": "HRB 10715",
      "registerart": "HRB",
      "company_name": "MM Gloria Personalservice GmbH",
      "company_seat": "Werther",
      "details": "08.01.2025 (Bekanntmachungsdatum)\n\nNordrhein-Westfalen Amtsgericht Gütersloh HRB 10715\nLöschungsankündigung\n\nMM Gloria Personalservice GmbH\nGesellschaft mit beschränkter Haftung\nWerther\n\nDas Registergericht beabsichtigt die Gesellschaft von Amts wegen nach § 394 FamFG zu löschen. Die Frist zur Erhebung eines Widerspruchs ist auf zwei Monate festgesetzt."
    },
    {
      "date": "2025-01-08",
      "id": "98102",
      "original_text": "Sonstige Registerbekanntmachung\nNordrhein-Westfalen Amtsgericht Köln HRB 55249\nREWE - Zentral GmbH – Köln",
      "type": "Sonstige Registerbekanntmachung",
      "state": "Nordrhein-Westfalen",
      "amtsgericht": "Amtsgericht Köln",
      "registernummer": "HRB 55249",
      "registerart": "HRB",
      "company_name": "REWE - Zentral GmbH",
      "company_seat": "Köln",
      "details": "08.01.2025 (Bekanntmachungsdatum)\n\nNordrhein-Westfalen Amtsgericht Köln HRB 55249\nSonstige Registerbekanntmachung 17.12.2024 (Eintragungsdatum)\n\nREWE - Zentral GmbH\nGesellschaft mit beschränkter Haftung\nKöln\n\nAls nicht eingetragen wird veröffentlicht: Den Gläubigern der Gesellschaft, deren Forderungen begründet worden sind bevor die Eintragung der Beendigung des Beherrschungs- und Gewinnabführungsvertrages  in das Handelsregister nach § 10 des Handelsgesetzbuches als bekanntgemacht gilt, hat der andere Vertragsteil Sicherheit zu leisten, wenn sie sich binnen sechs Monaten nach der Bekanntmachung der Eintragung zu diesem Zweck bei ihm melden."
    },
    {
      "date": "2025-01-08",
      "id": "98103",
      "original_text": "Sonstige Registerbekanntmachung\nNordrhein-Westfalen Amtsgericht Köln HRB 47998\nCookpal GmbH – Köln",
      "type": "Sonstige Registerbekanntmachung",
      "state": "Nordrhein-Westfalen",
      "amtsgericht": "Amtsgericht Köln",
      "registernummer": "HRB 47998",
      "registerart": "HRB",
      "company_name": "Cookpal GmbH",
      "company_seat": "Köln",
      "details": "08.01.2025 (Bekanntmachungsdatum)\n\nNordrhein-Westfalen Amtsgericht Köln HRB 47998\nSonstige Registerbekanntmachung\n\nCookpal GmbH\nGesellschaft mit beschränkter Haftung\nKöln\n\nAls nicht eingetragen wird veröffentlicht: Den Gläubigern der Gesellschaft, deren Forderungen begründet worden sind bevor die Eintragung der Beendigung des Beherrschungs- und Gewinnabführungsvertrages  in das Handelsregister nach § 10 des Handelsgesetzbuches als bekanntgemacht gilt, hat der andere Vertragsteil Sicherheit zu leisten, wenn sie sich binnen sechs Monaten nach der Bekanntmachung der Eintragung zu diesem Zweck bei ihm melden."
    },
    {
      "date": "2025-01-08",
      "id": "98104",
      "original_text": "Einreichung neuer Dokumente\nNordrhein-Westfalen Amtsgericht Dortmund HRB 20065\nDiakonisches Werk Dortmund und Lünen gGmbH – Dortmund",
      "type": "Einreichung neuer Dokumente",
      "state": "Nordrhein-Westfalen",
      "amtsgericht": "Amtsgericht Dortmund",
      "registernummer": "HRB 20065",
      "registerart": "HRB",
      "company_name": "Diakonisches Werk Dortmund und Lünen gGmbH",
      "company_seat": "Dortmund",
      "details": "08.01.2025 (Bekanntmachungsdatum)\n\nNordrhein-Westfalen Amtsgericht Dortmund HRB 20065\nEinreichung neuer Dokumente\n\nDiakonisches Werk Dortmund und Lünen gGmbH\nGesellschaft mit beschränkter Haftung\nDortmund\n\nDem Registergericht ist eine neue Liste der Mitglieder des Aufsichtsrates eingereicht worden."
    },
    {
      "date": "2025-01-08",
      "id": "98105",
      "original_text": "Registerbekanntmachung nach dem Umwandlungsgesetz\nNordrhein-Westfalen Amtsgericht Köln HRB 95245\nOSMAB LPG 1 GmbH – Rösrath",
      "type": "Registerbekanntmachung nach dem Umwandlungsgesetz",
      "state": "Nordrhein-Westfalen",
      "amtsgericht": "Amtsgericht Köln",
      "registernummer": "HRB 95245",
      "registerart": "HRB",
      "company_name": "OSMAB LPG 1 GmbH",
      "company_seat": "Rösrath",
      "details": "08.01.2025 (Bekanntmachungsdatum)\n\nNordrhein-Westfalen Amtsgericht Köln HRB 95245\nRegisterbekanntmachung nach dem Umwandlungsgesetz 08.01.2025 (Eintragungsdatum)\n\nOSMAB LPG 1 GmbH\nGesellschaft mit beschränkter Haftung\nRösrath\n\nDen Gläubigern der an der Verschmelzung beteiligten Rechtsträger ist, wenn sie binnen sechs Monaten nach dem Tag, an dem die Eintragung der Verschmelzung in das Register des Sitzes desjenigen Rechtsträgers, dessen Gläubiger sie sind, nach § 19 Absatz 3 UmwG als bekanntgemacht gilt, ihren Anspruch nach Grund und Höhe schriftlich anmelden, Sicherheit zu leisten, soweit sie nicht Befriedigung verlangen können. Dieses Recht steht den Gläubigern jedoch nur zu, wenn sie glaubhaft machen, dass durch die Verschmelzung die Erfüllung ihrer Forderung gefährdet wird."
    },
    {
      "date": "2025-01-08",
      "id": "98106",
      "original_text": "Registerbekanntmachung nach dem Umwandlungsgesetz\nNordrhein-Westfalen Amtsgericht Bad Oeynhausen HRB 14477\nPWK Beteiligungs- und Verwaltungs AG – Herford",
      "type": "Registerbekanntmachung nach dem Umwandlungsgesetz",
      "state": "Nordrhein-Westfalen",
      "amtsgericht": "Amtsgericht Bad Oeynhausen",
      "registernummer": "HRB 14477",
      "registerart": "HRB",
      "company_name": "PWK Beteiligungs- und Verwaltungs AG",
      "company_seat": "Herford",
      "details": "08.01.2025 (Bekanntmachungsdatum)\n\nNordrhein-Westfalen Amtsgericht Bad Oeynhausen HRB 14477\nRegisterbekanntmachung nach dem Umwandlungsgesetz 08.01.2025 (Eintragungsdatum)\n\nPWK Beteiligungs- und Verwaltungs AG\nAktiengesellschaft\nHerford\n\nDen Gläubigern der an der formwechselnden Umwandlung beteiligten Rechtsträger ist, wenn sie binnen sechs Monaten nach dem Tag, an dem die Eintragung der formwechselnden Umwandlung in das Register des Sitzes desjenigen Rechtsträgers, dessen Gläubiger sie sind, nach § 19 Absatz 3 UmwG als bekanntgemacht gilt, ihren Anspruch nach Grund und Höhe schriftlich anmelden, Sicherheit zu leisten, soweit sie nicht Befriedigung verlangen können. Dieses Recht steht den Gläubigern jedoch nur zu, wenn sie glaubhaft machen, dass durch die formwechselnden Umwandlung die Erfüllung ihrer Forderung gefährdet wird."
    },
    {
      "date": "2025-01-08",
      "id": "98107",
      "original_text": "Einreichung neuer Dokumente\nNordrhein-Westfalen Amtsgericht Düsseldorf HRB 50391\nLAUREUS AG PRIVAT FINANZ – Düsseldorf",
      "type": "Einreichung neuer Dokumente",
      "state": "Nordrhein-Westfalen",
      "amtsgericht": "Amtsgericht Düsseldorf",
      "registernummer": "HRB 50391",
      "registerart": "HRB",
      "company_name": "LAUREUS AG PRIVAT FINANZ",
      "company_seat": "Düsseldorf",
      "details": "08.01.2025 (Bekanntmachungsdatum)\n\nNordrhein-Westfalen Amtsgericht Düsseldorf HRB 50391\nEinreichung neuer Dokumente\n\nLAUREUS AG PRIVAT FINANZ\nAktiengesellschaft\nDüsseldorf\n\nDem Registergericht ist eine neue Liste der Mitglieder des Aufsichtsrates eingereicht worden."
    },
    {
      "date": "2025-01-08",
      "id": "98108",
      "original_text": "Einreichung neuer Dokumente\nNordrhein-Westfalen Amtsgericht Düsseldorf HRB 68736\nFluxys Deutschland GmbH – Düsseldorf",
      "type": "Einreichung neuer Dokumente",
      "state": "Nordrhein-Westfalen",
      "amtsgericht": "Amtsgericht Düsseldorf",
      "registernummer": "HRB 68736",
      "registerart": "HRB",
      "company_name": "Fluxys Deutschland GmbH",
      "company_seat": "Düsseldorf",
      "details": "08.01.2025 (Bekanntmachungsdatum)\n\nNordrhein-Westfalen Amtsgericht Düsseldorf HRB 68736\nEinreichung neuer Dokumente\n\nFluxys Deutschland GmbH\nGesellschaft mit beschränkter Haftung\nDüsseldorf\n\nDem Registergericht ist eine Liste der Mitglieder des Aufsichtsrates eingereicht worden."
    },
    {
      "date": "2025-01-08",
      "id": "98109",
      "original_text": "Registerbekanntmachung nach dem Umwandlungsgesetz\nNordrhein-Westfalen Amtsgericht Köln HRB 66773\nREWE Markt GmbH – Köln",
      "type": "Registerbekanntmachung nach dem Umwandlungsgesetz",
      "state": "Nordrhein-Westfalen",
      "amtsgericht": "Amtsgericht Köln",
      "registernummer": "HRB 66773",
      "registerart": "HRB",
      "company_name": "REWE Markt GmbH",
      "company_seat": "Köln",
      "details": "08.01.2025 (Bekanntmachungsdatum)\n\nNordrhein-Westfalen Amtsgericht Köln HRB 66773\nRegisterbekanntmachung nach dem Umwandlungsgesetz 08.01.2025 (Eintragungsdatum)\n\nREWE Markt GmbH\nGesellschaft mit beschränkter Haftung\nKöln\n\nDen Gläubigern der an der Abspaltung beteiligten Rechtsträger ist, wenn sie binnen sechs Monaten nach dem Tag, an dem die Eintragung der Abspaltung in das Register des Sitzes desjenigen Rechtsträgers, dessen Gläubiger sie sind, nach § 19 Absatz 3 UmwG als bekanntgemacht gilt, ihren Anspruch nach Grund und Höhe schriftlich anmelden, Sicherheit zu leisten, soweit sie nicht Befriedigung verlangen können. Dieses Recht steht den Gläubigern jedoch nur zu, wenn sie glaubhaft machen, dass durch die Abspaltung die Erfüllung ihrer Forderung gefährdet wird."
    },
    {
      "date": "2025-01-08",
      "id": "98110",
      "original_text": "Löschungsankündigung\nNordrhein-Westfalen Amtsgericht Duisburg HRB 31253\nHSF Food & Nonfood GmbH – Duisburg",
      "type": "Löschungsankündigung",
      "state": "Nordrhein-Westfalen",
      "amtsgericht": "Amtsgericht Duisburg",
      "registernummer": "HRB 31253",
      "registerart": "HRB",
      "company_name": "HSF Food & Nonfood GmbH",
      "company_seat": "Duisburg",
      "details": "08.01.2025 (Bekanntmachungsdatum)\n\nNordrhein-Westfalen Amtsgericht Duisburg HRB 31253\nLöschungsankündigung\n\nHSF Food & Nonfood GmbH\nGesellschaft mit beschränkter Haftung\nDuisburg\n\nHRB 31253:\nHSF Food & Nonfood GmbH,\nDuisburg,\nAuf der Höhe 63, 47059 Duisburg. Das Registergericht beabsichtigt, die im Handelsregister eingetragene Gesellschaft gemäß § 394 Absatz 1 FamFG wegen Vermögenslosigkeit von Amts wegen zu löschen. Gegen diese Verfügung kann Widerspruch eingelegt werden. Die Frist zur Erhebung eines Widerspruchs gegen die beabsichtigte Löschung von Amts wegen ist auf drei Monate festgesetzt. Rechtsbehelfsbelehrung Der Widerspruch ist bei dem Amtsgericht Duisburg, Kardinal-Galen-Str. 124-132, 47058 Duisburg schriftlich in deutscher Sprache oder zur Niederschrift der Geschäftsstelle einzulegen. Der Widerspruch kann auch zur Niederschrift der Geschäftsstelle eines jeden Amtsgerichtes abgegeben werden. Die Einlegung ist auch durch Übertragung eines elektronischen Dokuments an die elektronische Poststelle des Gerichts möglich. Das elektronische Dokument muss für die Bearbeitung durch das Gericht geeignet und mit einer qualifizierten elektronischen Signatur der verantwortenden Person versehen sein oder von der verantwortenden Person signiert und auf einem sicheren Übermittlungsweg gemäß § 130 a ZPO nach näherer Maßgabe der Verordnung über die technischen Rahmenbedingungen des elektronischen Rechtsverkehrs und über das besondere elektronische Behördenpostfach (BGBl. I, S. 3803) eingereicht werden. Weitere Informationen erhalten Sie auf der Internetseite www.justiz.de <http://www.justiz.de>. Der Widerspruch muss spätestens innerhalb der gesetzten Frist bei dem Amtsgericht Duisburg eingegangen sein. Dies gilt auch dann, wenn der Widerspruch zur Niederschrift der Geschäftsstelle eines anderen Amtsgerichtes abgegeben wurde. Die Frist beginnt mit der Veröffentlichung. Fällt das Ende der Frist auf einen Sonntag, einen allgemeinen Feiertag oder Sonnabend, so endet die Frist mit Ablauf des nächsten Werktages. Der Widerspruch muss die Bezeichnung der angefochtenen Verfügung sowie die Erklärung enthalten, dass Widerspruch gegen diese Verfügung eingelegt wird. Er ist zu unterzeichnen und soll begründet werden."
    },
    {
      "date": "2025-01-08",
      "id": "98111",
      "original_text": "Registerbekanntmachung nach dem Umwandlungsgesetz\nNordrhein-Westfalen Amtsgericht Mönchengladbach HRB 16932\nMultiflex-Solutions GmbH – Grevenbroich",
      "type": "Registerbekanntmachung nach dem Umwandlungsgesetz",
      "state": "Nordrhein-Westfalen",
      "amtsgericht": "Amtsgericht Mönchengladbach",
      "registernummer": "HRB 16932",
      "registerart": "HRB",
      "company_name": "Multiflex-Solutions GmbH",
      "company_seat": "Grevenbroich",
      "details": "08.01.2025 (Bekanntmachungsdatum)\n\nNordrhein-Westfalen Amtsgericht Mönchengladbach HRB 16932\nRegisterbekanntmachung nach dem Umwandlungsgesetz 08.01.2025 (Eintragungsdatum)\n\nMultiflex-Solutions GmbH\nGesellschaft mit beschränkter Haftung\nGrevenbroich\n\nDen Gläubigern der an der Verschmelzung beteiligten Rechtsträger ist, wenn sie binnen sechs Monaten nach dem Tag, an dem die Eintragung der Verschmelzung in das Register des Sitzes desjenigen Rechtsträgers, dessen Gläubiger sie sind, nach § 19 Absatz 3 UmwG als bekanntgemacht gilt, ihren Anspruch nach Grund und Höhe schriftlich anmelden, Sicherheit zu leisten, soweit sie nicht Befriedigung verlangen können. Dieses Recht steht den Gläubigern jedoch nur zu, wenn sie glaubhaft machen, dass durch die Verschmelzung die Erfüllung ihrer Forderung gefährdet wird."
    },
    {
      "date": "2025-01-08",
      "id": "98112",
      "original_text": "Registerbekanntmachung nach dem Umwandlungsgesetz\nNordrhein-Westfalen Amtsgericht Köln HRB 68024\nOSMAB Verwaltungs GmbH – Rösrath",
      "type": "Registerbekanntmachung nach dem Umwandlungsgesetz",
      "state": "Nordrhein-Westfalen",
      "amtsgericht": "Amtsgericht Köln",
      "registernummer": "HRB 68024",
      "registerart": "HRB",
      "company_name": "OSMAB Verwaltungs GmbH",
      "company_seat": "Rösrath",
      "details": "08.01.2025 (Bekanntmachungsdatum)\n\nNordrhein-Westfalen Amtsgericht Köln HRB 68024\nRegisterbekanntmachung nach dem Umwandlungsgesetz 08.01.2025 (Eintragungsdatum)\n\nOSMAB Verwaltungs GmbH\nGesellschaft mit beschränkter Haftung\nRösrath\n\nDen Gläubigern der an der Verschmelzung beteiligten Rechtsträger ist, wenn sie binnen sechs Monaten nach dem Tag, an dem die Eintragung der Verschmelzung in das Register des Sitzes desjenigen Rechtsträgers, dessen Gläubiger sie sind, nach § 19 Absatz 3 UmwG als bekanntgemacht gilt, ihren Anspruch nach Grund und Höhe schriftlich anmelden, Sicherheit zu leisten, soweit sie nicht Befriedigung verlangen können. Dieses Recht steht den Gläubigern jedoch nur zu, wenn sie glaubhaft machen, dass durch die Verschmelzung die Erfüllung ihrer Forderung gefährdet wird."
    },
    {
      "date": "2025-01-08",
      "id": "98113",
      "original_text": "Löschungsankündigung\nNordrhein-Westfalen Amtsgericht Siegburg HRB 13293\nLas Vegas 2 Spielhallenbetriebe UG (haftungsbeschränkt) – Waldbröl",
      "type": "Löschungsankündigung",
      "state": "Nordrhein-Westfalen",
      "amtsgericht": "Amtsgericht Siegburg",
      "registernummer": "HRB 13293",
      "registerart": "HRB",
      "company_name": "Las Vegas 2 Spielhallenbetriebe UG (haftungsbeschränkt)",
      "company_seat": "Waldbröl",
      "details": "08.01.2025 (Bekanntmachungsdatum)\n\nNordrhein-Westfalen Amtsgericht Siegburg HRB 13293\nLöschungsankündigung\n\nLas Vegas 2 Spielhallenbetriebe UG (haftungsbeschränkt)\nGesellschaft mit beschränkter Haftung\nWaldbröl\n\nDas Registergericht hat glaubhafte Kenntnis erlangt, dass die Gesellschaft vermögenslos geworden ist, da ein Insolvenzverfahren wegen Masseunzulänglichkeit nach § 208 ff InsO eingestellt wurde.\n\nEs ist daher beabsichtigt, die Gesellschaft nach § 394 FamFG im Handelsregister wegen Vermögenslosigkeit zu löschen.\n\nEinwände gegen die Löschung sind durch Widerspruch binnen einer Frist von 3 Monaten geltend zu machen, andernfalls die Löschung erfolgen wird.\n\nEinzulegen ist der Widerspruch bei dem Amtsgericht Siegburg, Neue Poststraße 16, 53721 Siegburg, und zwar entweder schriftlich in deutscher Sprache oder mündlich zur Niederschrift der Geschäftsstelle. Der Widerspruch kann auch zur Niederschrift der Geschäftsstelle eines jeden Amtsgerichts abgegeben werden. Der Widerspruch ist binnen der in der Verfügung bestimmten Frist einzulegen. Die Frist ist nur gewahrt, wenn der Widerspruch rechtzeitig bei dem Amtsgericht Siegburg eingeht, auch wenn der Widerspruch zur Niederschrift der Geschäftsstelle eines anderen Amtsgerichts abgegeben wurde. Die Frist beginnt jeweils mit der schriftlichen Bekanntgabe der Verfügung an die Beteiligten. Kann die schriftliche Bekanntgabe an einen Beteiligten nicht bewirkt werden, beginnt die Frist spätestens mit Ablauf von fünf Monaten nach Erlass der Verfügung. Die Bekanntgabe ist entweder durch Zustellung oder am dritten Tage nach Aufgabe zur Post bewirkt. Sofern die Löschung noch nicht erfolgt ist, kann der Widerspruch auch noch nach Ablauf der Frist eingelegt werden. Fällt das Ende der Frist auf einen Sonnabend, einen Sonntag oder einen allgemeinen Feiertag, endet die Frist mit Ablauf des nächsten Werktages. Der Widerspruch ist zu unterzeichnen. Eine Begründung des Widerspruchs ist nicht vorgeschrieben."
    },
    {
      "date": "2025-01-08",
      "id": "98114",
      "original_text": "Einreichung neuer Dokumente\nNordrhein-Westfalen Amtsgericht Aachen HRB 6145\nForschungsflugplatz Würselen-Aachen GmbH – Würselen",
      "type": "Einreichung neuer Dokumente",
      "state": "Nordrhein-Westfalen",
      "amtsgericht": "Amtsgericht Aachen",
      "registernummer": "HRB 6145",
      "registerart": "HRB",
      "company_name": "Forschungsflugplatz Würselen-Aachen GmbH",
      "company_seat": "Würselen",
      "details": "08.01.2025 (Bekanntmachungsdatum)\n\nNordrhein-Westfalen Amtsgericht Aachen HRB 6145\nEinreichung neuer Dokumente\n\nForschungsflugplatz Würselen-Aachen GmbH\nGesellschaft mit beschränkter Haftung\nWürselen\n\nDem Registergericht ist eine neue Liste der Mitglieder des Aufsichtsrates eingereicht worden."
    },
    {
      "date": "2025-01-08",
      "id": "98115",
      "original_text": "Registerbekanntmachung nach dem Umwandlungsgesetz\nNordrhein-Westfalen Amtsgericht Köln HRB 29619\nREWE Group Fruchtlogistik GmbH – Köln",
      "type": "Registerbekanntmachung nach dem Umwandlungsgesetz",
      "state": "Nordrhein-Westfalen",
      "amtsgericht": "Amtsgericht Köln",
      "registernummer": "HRB 29619",
      "registerart": "HRB",
      "company_name": "REWE Group Fruchtlogistik GmbH",
      "company_seat": "Köln",
      "details": "08.01.2025 (Bekanntmachungsdatum)\n\nNordrhein-Westfalen Amtsgericht Köln HRB 29619\nRegisterbekanntmachung nach dem Umwandlungsgesetz 08.01.2025 (Eintragungsdatum)\n\nREWE Group Fruchtlogistik GmbH\nGesellschaft mit beschränkter Haftung\nKöln\n\nDen Gläubigern der an der Verschmelzung beteiligten Rechtsträger ist, wenn sie binnen sechs Monaten nach dem Tag, an dem die Eintragung der Verschmelzung in das Register des Sitzes desjenigen Rechtsträgers, dessen Gläubiger sie sind, nach § 19 Absatz 3 UmwG als bekanntgemacht gilt, ihren Anspruch nach Grund und Höhe schriftlich anmelden, Sicherheit zu leisten, soweit sie nicht Befriedigung verlangen können. Dieses Recht steht den Gläubigern jedoch nur zu, wenn sie glaubhaft machen, dass durch die Verschmelzung die Erfüllung ihrer Forderung gefährdet wird."
    },
    {
      "date": "2025-01-08",
      "id": "98116",
      "original_text": "Registerbekanntmachung nach dem Umwandlungsgesetz\nNordrhein-Westfalen Amtsgericht Bad Oeynhausen HRB 20054\nPWK Beteiligungs- und Verwaltungs GmbH – Herford",
      "type": "Registerbekanntmachung nach dem Umwandlungsgesetz",
      "state": "Nordrhein-Westfalen",
      "amtsgericht": "Amtsgericht Bad Oeynhausen",
      "registernummer": "HRB 20054",
      "registerart": "HRB",
      "company_name": "PWK Beteiligungs- und Verwaltungs GmbH",
      "company_seat": "Herford",
      "details": "08.01.2025 (Bekanntmachungsdatum)\n\nNordrhein-Westfalen Amtsgericht Bad Oeynhausen HRB 20054\nRegisterbekanntmachung nach dem Umwandlungsgesetz 08.01.2025 (Eintragungsdatum)\n\nPWK Beteiligungs- und Verwaltungs GmbH\nGesellschaft mit beschränkter Haftung\nHerford\n\nDen Gläubigern der an der formwechselnden Umwandlung beteiligten Rechtsträger ist, wenn sie binnen sechs Monaten nach dem Tag, an dem die Eintragung der formwechselnden Umwandlung in das Register des Sitzes desjenigen Rechtsträgers, dessen Gläubiger sie sind, nach § 19 Absatz 3 UmwG als bekanntgemacht gilt, ihren Anspruch nach Grund und Höhe schriftlich anmelden, Sicherheit zu leisten, soweit sie nicht Befriedigung verlangen können. Dieses Recht steht den Gläubigern jedoch nur zu, wenn sie glaubhaft machen, dass durch die formwechselnden Umwandlung die Erfüllung ihrer Forderung gefährdet wird."
    },
    {
      "date": "2025-01-08",
      "id": "98117",
      "original_text": "Registerbekanntmachung nach dem Umwandlungsgesetz\nThüringen Amtsgericht Jena HRB 515970\nIHI Charging Systems International GmbH – Amt Wachsenburg",
      "type": "Registerbekanntmachung nach dem Umwandlungsgesetz",
      "state": "Thüringen",
      "amtsgericht": "Amtsgericht Jena",
      "registernummer": "HRB 515970",
      "registerart": "HRB",
      "company_name": "IHI Charging Systems International GmbH",
      "company_seat": "Amt Wachsenburg",
      "details": "08.01.2025 (Bekanntmachungsdatum)\n\nThüringen Amtsgericht Jena HRB 515970\nRegisterbekanntmachung nach dem Umwandlungsgesetz 08.01.2025 (Eintragungsdatum)\n\nIHI Charging Systems International GmbH\nGesellschaft mit beschränkter Haftung\nAmt Wachsenburg\n\nNicht eingetragen: Den Gläubigern der an der Verschmelzung beteiligten Rechtsträger, ist wenn sie binnen sechs Monaten nach dem Tag, an dem die Eintragung der Verschmelzung in das Register des Sitzes desjenigen Rechtsträgers, dessen Gläubiger sie sind,  nach § 19 Abs. 3 UmwG als bekanntgemacht gilt, ihren Anspruch nach Grund und Höhe schriftlich anmelden, Sicherheit zu leisten, soweit sie nicht Befriedigung verlangen können. Dieses Recht steht ihnen jedoch nur zu, wenn sie glaubhaft machen, daß durch die Verschmelzung die Erfüllung ihrer Forderung gefährdet wird."
    },
    {
      "date": "2025-01-08",
      "id": "98118",
      "original_text": "Registerbekanntmachung nach dem Umwandlungsgesetz\nThüringen Amtsgericht Jena HRB 502765\nIHI Charging Systems International Germany GmbH – Amt Wachsenburg",
      "type": "Registerbekanntmachung nach dem Umwandlungsgesetz",
      "state": "Thüringen",
      "amtsgericht": "Amtsgericht Jena",
      "registernummer": "HRB 502765",
      "registerart": "HRB",
      "company_name": "IHI Charging Systems International Germany GmbH",
      "company_seat": "Amt Wachsenburg",
      "details": "08.01.2025 (Bekanntmachungsdatum)\n\nThüringen Amtsgericht Jena HRB 502765\nRegisterbekanntmachung nach dem Umwandlungsgesetz 08.01.2025 (Eintragungsdatum)\n\nIHI Charging Systems International Germany GmbH\nGesellschaft mit beschränkter Haftung\nAmt Wachsenburg\n\nNicht eingetragen: Den Gläubigern der an der Verschmelzung beteiligten Rechtsträger, ist wenn sie binnen sechs Monaten nach dem Tag, an dem die Eintragung der Verschmelzung in das Register des Sitzes desjenigen Rechtsträgers, dessen Gläubiger sie sind,  nach § 19 Abs. 3 UmwG als bekanntgemacht gilt, ihren Anspruch nach Grund und Höhe schriftlich anmelden, Sicherheit zu leisten, soweit sie nicht Befriedigung verlangen können. Dieses Recht steht ihnen jedoch nur zu, wenn sie glaubhaft machen, daß durch die Verschmelzung die Erfüllung ihrer Forderung gefährdet wird."
    },
    {
      "date": "2025-01-08",
      "id": "98119",
      "original_text": "Löschungsankündigung\nThüringen Amtsgericht Jena HRB 501715\nPlanungsgruppe machWERK GmbH – Gera",
      "type": "Löschungsankündigung",
      "state": "Thüringen",
      "amtsgericht": "Amtsgericht Jena",
      "registernummer": "HRB 501715",
      "registerart": "HRB",
      "company_name": "Planungsgruppe machWERK GmbH",
      "company_seat": "Gera",
      "details": "08.01.2025 (Bekanntmachungsdatum)\n\nThüringen Amtsgericht Jena HRB 501715\nLöschungsankündigung\n\nPlanungsgruppe machWERK GmbH\nGesellschaft mit beschränkter Haftung\nGera\n\nDas Registergericht beabsichtigt, die im Handelsregister eingetragene Gesellschaft wegen Vermögenslosigkeit nach § 394 FamFG von Amts wegen zu löschen. Die Frist zur Erhebung eines Widerspruchs gegen die beabsichtigte Löschung wird auf 6 Wochen festgesetzt."
    },
    {
      "date": "2025-01-08",
      "id": "98120",
      "original_text": "Registerbekanntmachung nach dem Umwandlungsgesetz\nHessen Amtsgericht Frankfurt am Main HRB 73924\nCFI Leben GmbH – Frankfurt am Main",
      "type": "Registerbekanntmachung nach dem Umwandlungsgesetz",
      "state": "Hessen",
      "amtsgericht": "Amtsgericht Frankfurt am Main",
      "registernummer": "HRB 73924",
      "registerart": "HRB",
      "company_name": "CFI Leben GmbH",
      "company_seat": "Frankfurt am Main",
      "details": "08.01.2025 (Bekanntmachungsdatum)\n\nHessen Amtsgericht Frankfurt am Main HRB 73924\nRegisterbekanntmachung nach dem Umwandlungsgesetz 08.01.2025 (Eintragungsdatum)\n\nCFI Leben GmbH\nGesellschaft mit beschränkter Haftung\nFrankfurt am Main\n\nDen Gläubigern der an der Verschmelzung beteiligten Rechtsträger ist, wenn sie binnen sechs Monaten nach dem Tag, an dem die Eintragung der Verschmelzung in das Register des Sitzes desjenigen Rechtsträgers, dessen Gläubiger sie sind, nach § 19 Absatz 3 UmwG bekannt gemacht worden ist, ihren Anspruch nach Grund und Höhe schriftlich anmelden, Sicherheit zu leisten, soweit sie nicht Befriedigung verlangen können. Dieses Recht steht den Gläubigern jedoch nur zu, wenn sie glaubhaft machen, dass durch die Verschmelzung die Erfüllung ihrer Forderung gefährdet wird."
    },
    {
      "date": "2025-01-08",
      "id": "98121",
      "original_text": "Löschungsankündigung\nHessen Amtsgericht Offenbach am Main HRB 46373\nRaab Hausbau GmbH – Mühlheim am Main",
      "type": "Löschungsankündigung",
      "state": "Hessen",
      "amtsgericht": "Amtsgericht Offenbach am Main",
      "registernummer": "HRB 46373",
      "registerart": "HRB",
      "company_name": "Raab Hausbau GmbH",
      "company_seat": "Mühlheim am Main",
      "details": "08.01.2025 (Bekanntmachungsdatum)\n\nHessen Amtsgericht Offenbach am Main HRB 46373\nLöschungsankündigung\n\nRaab Hausbau GmbH\nGesellschaft mit beschränkter Haftung\nMühlheim am Main\n\nDas Registergericht beabsichtigt die im Handelsregister eingetragene Gesellschaft von Amts wegen nach § 395 FamFG zu löschen. Die Frist zur Erhebung eines Widerspruchs gegen die beabsichtigte Löschung wird auf 3 Monate festgesetzt."
    },
    {
      "date": "2025-01-08",
      "id": "98122",
      "original_text": "Einreichung neuer Dokumente\nHessen Amtsgericht Frankfurt am Main HRB 55490\nBearingPoint GmbH – Frankfurt am Main",
      "type": "Einreichung neuer Dokumente",
      "state": "Hessen",
      "amtsgericht": "Amtsgericht Frankfurt am Main",
      "registernummer": "HRB 55490",
      "registerart": "HRB",
      "company_name": "BearingPoint GmbH",
      "company_seat": "Frankfurt am Main",
      "details": "08.01.2025 (Bekanntmachungsdatum)\n\nHessen Amtsgericht Frankfurt am Main HRB 55490\nEinreichung neuer Dokumente 08.01.2025 (Eintragungsdatum)\n\nBearingPoint GmbH\nGesellschaft mit beschränkter Haftung\nFrankfurt am Main\n\nDurch eine Änderung in den Personen der Aufsichtsratsmitglieder ist eine Liste der Mitglieder des Aufsichtsrates zum Handelsregister eingereicht worden."
    },
    {
      "date": "2025-01-08",
      "id": "98123",
      "original_text": "Löschungsankündigung\nHessen Amtsgericht Offenbach am Main HRB 41666\nHessische Red Square Verwaltungs GmbH – Neu-Isenburg",
      "type": "Löschungsankündigung",
      "state": "Hessen",
      "amtsgericht": "Amtsgericht Offenbach am Main",
      "registernummer": "HRB 41666",
      "registerart": "HRB",
      "company_name": "Hessische Red Square Verwaltungs GmbH",
      "company_seat": "Neu-Isenburg",
      "details": "08.01.2025 (Bekanntmachungsdatum)\n\nHessen Amtsgericht Offenbach am Main HRB 41666\nLöschungsankündigung\n\nHessische Red Square Verwaltungs GmbH\nGesellschaft mit beschränkter Haftung\nNeu-Isenburg\n\nDas Registergericht beabsichtigt die im Handelsregister eingetragene Gesellschaft von Amts wegen nach § 395 FamFG zu löschen. Die Frist zur Erhebung eines Widerspruchs gegen die beabsichtigte Löschung wird auf 3 Monate festgesetzt."
    },
    {
      "date": "2025-01-08",
      "id": "98124",
      "original_text": "Registerbekanntmachung nach dem Umwandlungsgesetz\nHessen Amtsgericht Frankfurt am Main HRB 85427\nCumerius Management GmbH – Frankfurt am Main",
      "type": "Registerbekanntmachung nach dem Umwandlungsgesetz",
      "state": "Hessen",
      "amtsgericht": "Amtsgericht Frankfurt am Main",
      "registernummer": "HRB 85427",
      "registerart": "HRB",
      "company_name": "Cumerius Management GmbH",
      "company_seat": "Frankfurt am Main",
      "details": "08.01.2025 (Bekanntmachungsdatum)\n\nHessen Amtsgericht Frankfurt am Main HRB 85427\nRegisterbekanntmachung nach dem Umwandlungsgesetz 08.01.2025 (Eintragungsdatum)\n\nCumerius Management GmbH\nGesellschaft mit beschränkter Haftung\nFrankfurt am Main\n\nDen Gläubigern der an der Verschmelzung beteiligten Rechtsträger ist, wenn sie binnen sechs Monaten nach dem Tag, an dem die Eintragung der Verschmelzung in das Register des Sitzes desjenigen Rechtsträgers, dessen Gläubiger sie sind, nach § 19 Absatz 3 UmwG bekannt gemacht worden ist, ihren Anspruch nach Grund und Höhe schriftlich anmelden, Sicherheit zu leisten, soweit sie nicht Befriedigung verlangen können. Dieses Recht steht den Gläubigern jedoch nur zu, wenn sie glaubhaft machen, dass durch die Verschmelzung die Erfüllung ihrer Forderung gefährdet wird."
    },
    {
      "date": "2025-01-08",
      "id": "98125",
      "original_text": "Einreichung neuer Dokumente\nHessen Amtsgericht Frankfurt am Main HRB 126056\nJ.P. Morgan SE – Frankfurt am Main",
      "type": "Einreichung neuer Dokumente",
      "state": "Hessen",
      "amtsgericht": "Amtsgericht Frankfurt am Main",
      "registernummer": "HRB 126056",
      "registerart": "HRB",
      "company_name": "J.P. Morgan SE",
      "company_seat": "Frankfurt am Main",
      "details": "08.01.2025 (Bekanntmachungsdatum)\n\nHessen Amtsgericht Frankfurt am Main HRB 126056\nEinreichung neuer Dokumente 08.01.2025 (Eintragungsdatum)\n\nJ.P. Morgan SE\nEuropäische Aktiengesellschaft (SE)\nFrankfurt am Main\n\nDurch eine Änderung in den Personen der Aufsichtsratsmitglieder ist eine Liste der Mitglieder des Aufsichtsrates zum Handelsregister eingereicht worden."
    },
    {
      "date": "2025-01-08",
      "id": "98126",
      "original_text": "Sonstige Registerbekanntmachung\nHessen Amtsgericht Frankfurt am Main HRB 108109\nStandard Chartered Bank AG – Frankfurt am Main",
      "type": "Sonstige Registerbekanntmachung",
      "state": "Hessen",
      "amtsgericht": "Amtsgericht Frankfurt am Main",
      "registernummer": "HRB 108109",
      "registerart": "HRB",
      "company_name": "Standard Chartered Bank AG",
      "company_seat": "Frankfurt am Main",
      "details": "08.01.2025 (Bekanntmachungsdatum)\n\nHessen Amtsgericht Frankfurt am Main HRB 108109\nSonstige Registerbekanntmachung\n\nStandard Chartered Bank AG\nAktiengesellschaft\nFrankfurt am Main\n\nDurch eine Änderung in den Personen der Aufsichtsratsmitglieder ist eine Liste der Mitglieder des Aufsichtsrates zum Handelsregister eingereicht worden."
    },
    {
      "date": "2025-01-08",
      "id": "98127",
      "original_text": "Sonstige Registerbekanntmachung\nHessen Amtsgericht Darmstadt VR 70398\nMännergesangverein 1845 Neustadt – Breuberg-Neustadt",
      "type": "Sonstige Registerbekanntmachung",
      "state": "Hessen",
      "amtsgericht": "Amtsgericht Darmstadt",
      "registernummer": "VR 70398",
      "registerart": "VR",
      "company_name": "Männergesangverein 1845 Neustadt",
      "company_seat": "Breuberg-Neustadt",
      "details": "08.01.2025 (Bekanntmachungsdatum)\n\nHessen Amtsgericht Darmstadt VR 70398\nSonstige Registerbekanntmachung 08.01.2025 (Eintragungsdatum)\n\nMännergesangverein 1845 Neustadt\neingetragener Verein\nBreuberg-Neustadt\n\nDer Verein ist aufgelöst."
    },
    {
      "date": "2025-01-08",
      "id": "98128",
      "original_text": "Einreichung neuer Dokumente\nHessen Amtsgericht Frankfurt am Main HRB 79274\nAugur-Steinbeis CapTec AG – Frankfurt am Main",
      "type": "Einreichung neuer Dokumente",
      "state": "Hessen",
      "amtsgericht": "Amtsgericht Frankfurt am Main",
      "registernummer": "HRB 79274",
      "registerart": "HRB",
      "company_name": "Augur-Steinbeis CapTec AG",
      "company_seat": "Frankfurt am Main",
      "details": "08.01.2025 (Bekanntmachungsdatum)\n\nHessen Amtsgericht Frankfurt am Main HRB 79274\nEinreichung neuer Dokumente\n\nAugur-Steinbeis CapTec AG\nAktiengesellschaft\nFrankfurt am Main\n\nDurch eine Änderung in den Personen der Aufsichtsratsmitglieder ist eine Liste der Mitglieder des Aufsichtsrates zum Handelsregister eingereicht worden."
    }
  ]
}