{
  "date": "2025-01-16",
  "date_of_scrape": "2025-01-17T04:07:16.254Z",
  "tool_version": "0.2.0",
  "number_of_announcements": 129,
  "announcements": [
    {
      "date": "2025-01-16",
      "id": "98710",
      "original_text": "Löschungsankündigung\nBayern Amtsgericht München HRB 247274\nG & T Transporte GmbH – München",
      "type": "Löschungsankündigung",
      "state": "Bayern",
      "amtsgericht": "Amtsgericht München",
      "registernummer": "HRB 247274",
      "registerart": "HRB",
      "company_name": "G & T Transporte GmbH",
      "company_seat": "München",
      "details": "16.01.2025 (Bekanntmachungsdatum)\n\nBayern Amtsgericht München HRB 247274\nLöschungsankündigung\n\nG & T Transporte GmbH\nGesellschaft mit beschränkter Haftung\nMünchen\n\nDas Registergericht beabsichtigt, die im Handelsregister eingetragene Gesellschaft wegen Vermögenslosigkeit von Amts wegen nach § 394 FamFG zu löschen. Die Frist zur Erhebung eines Widerspruchs ist auf drei Monate festgesetzt."
    },
    {
      "date": "2025-01-16",
      "id": "98711",
      "original_text": "Registerbekanntmachung nach dem Umwandlungsgesetz\nBayern Amtsgericht München HRB 166188\nGesellschaft für kommunale Verkehrs- und Versorgungsanlagen mit beschränkter Haftung – Pullach i. Isartal",
      "type": "Registerbekanntmachung nach dem Umwandlungsgesetz",
      "state": "Bayern",
      "amtsgericht": "Amtsgericht München",
      "registernummer": "HRB 166188",
      "registerart": "HRB",
      "company_name": "Gesellschaft für kommunale Verkehrs- und Versorgungsanlagen mit beschränkter Haftung",
      "company_seat": "Pullach i. Isartal",
      "details": "16.01.2025 (Bekanntmachungsdatum)\n\nBayern Amtsgericht München HRB 166188\nRegisterbekanntmachung nach dem Umwandlungsgesetz 15.01.2025 (Eintragungsdatum)\n\nGesellschaft für kommunale Verkehrs- und Versorgungsanlagen mit beschränkter Haftung\nGesellschaft mit beschränkter Haftung\nPullach i. Isartal\n\nDen Gläubigern der an der Verschmelzung beteiligten Rechtsträger ist, wenn sie binnen sechs Monaten nach dem Tag, an dem die Eintragung der Verschmelzung in das Register des Sitzes desjenigen Rechtsträgers, dessen Gläubiger sie sind, nach § 19 Abs. 3 UmwG als bekannt gemacht gilt, ihren Anspruch nach Grund und Höhe in Textform anmelden, Sicherheit zu leisten, soweit sie nicht Befriedigung verlangen können. Dieses Recht steht den Gläubigern jedoch nur zu, wenn sie glaubhaft machen, dass durch die Verschmelzung die Erfüllung ihrer Forderung gefährdet wird."
    },
    {
      "date": "2025-01-16",
      "id": "98712",
      "original_text": "Registerbekanntmachung nach dem Umwandlungsgesetz\nBayern Amtsgericht München HRB 213636\nTexas Instruments Education Technology GmbH – Freising",
      "type": "Registerbekanntmachung nach dem Umwandlungsgesetz",
      "state": "Bayern",
      "amtsgericht": "Amtsgericht München",
      "registernummer": "HRB 213636",
      "registerart": "HRB",
      "company_name": "Texas Instruments Education Technology GmbH",
      "company_seat": "Freising",
      "details": "16.01.2025 (Bekanntmachungsdatum)\n\nBayern Amtsgericht München HRB 213636\nRegisterbekanntmachung nach dem Umwandlungsgesetz 15.01.2025 (Eintragungsdatum)\n\nTexas Instruments Education Technology GmbH\nGesellschaft mit beschränkter Haftung\nFreising\n\nDen Gläubigern der an der Verschmelzung beteiligten Rechtsträger ist, wenn sie binnen sechs Monaten nach dem Tag, an dem die Eintragung der Verschmelzung in das Register des Sitzes desjenigen Rechtsträgers, dessen Gläubiger sie sind, nach § 19 Abs. 3 UmwG als bekannt gemacht gilt, ihren Anspruch nach Grund und Höhe in Textform anmelden, Sicherheit zu leisten, soweit sie nicht Befriedigung verlangen können. Dieses Recht steht den Gläubigern jedoch nur zu, wenn sie glaubhaft machen, dass durch die Verschmelzung die Erfüllung ihrer Forderung gefährdet wird."
    },
    {
      "date": "2025-01-16",
      "id": "98713",
      "original_text": "Einreichung neuer Dokumente\nBayern Amtsgericht München HRB 190873\nWebasto Roof & Components SE – Gauting",
      "type": "Einreichung neuer Dokumente",
      "state": "Bayern",
      "amtsgericht": "Amtsgericht München",
      "registernummer": "HRB 190873",
      "registerart": "HRB",
      "company_name": "Webasto Roof & Components SE",
      "company_seat": "Gauting",
      "details": "16.01.2025 (Bekanntmachungsdatum)\n\nBayern Amtsgericht München HRB 190873\nEinreichung neuer Dokumente\n\nWebasto Roof & Components SE\nEuropäische Aktiengesellschaft (SE)\nGauting\n\nDem Amtsgericht München -Registergericht- ist eine Liste der Mitglieder des Aufsichtsrats eingereicht worden, Art. 9 Abs. 1 Buchst. c (ii) SE-VO i.V.m. § 106 AktG."
    },
    {
      "date": "2025-01-16",
      "id": "98714",
      "original_text": "Registerbekanntmachung nach dem Umwandlungsgesetz\nBayern Amtsgericht Nürnberg HRB 25017\nDiehl Röthenbach Verwaltungs GmbH – Nürnberg",
      "type": "Registerbekanntmachung nach dem Umwandlungsgesetz",
      "state": "Bayern",
      "amtsgericht": "Amtsgericht Nürnberg",
      "registernummer": "HRB 25017",
      "registerart": "HRB",
      "company_name": "Diehl Röthenbach Verwaltungs GmbH",
      "company_seat": "Nürnberg",
      "details": "16.01.2025 (Bekanntmachungsdatum)\n\nBayern Amtsgericht Nürnberg HRB 25017\nRegisterbekanntmachung nach dem Umwandlungsgesetz 15.01.2025 (Eintragungsdatum)\n\nDiehl Röthenbach Verwaltungs GmbH\nGesellschaft mit beschränkter Haftung\nNürnberg\n\nDen Gläubigern der an der Verschmelzung beteiligten Rechtsträger ist, wenn sie binnen sechs Monaten nach dem Tag, an dem die Eintragung der Verschmelzung in das Register des Sitzes desjenigen Rechtsträgers, dessen Gläubiger sie sind, nach § 19 Abs. 3 UmwG als bekannt gemacht gilt, ihren Anspruch nach Grund und Höhe in Textform anmelden, Sicherheit zu leisten, soweit sie nicht Befriedigung verlangen können. Dieses Recht steht den Gläubigern jedoch nur zu, wenn sie glaubhaft machen, dass durch die Verschmelzung die Erfüllung ihrer Forderung gefährdet wird."
    },
    {
      "date": "2025-01-16",
      "id": "98715",
      "original_text": "Löschungsankündigung\nBayern Amtsgericht München HRB 173666\nBalanso GmbH – Pullach i. Isartal",
      "type": "Löschungsankündigung",
      "state": "Bayern",
      "amtsgericht": "Amtsgericht München",
      "registernummer": "HRB 173666",
      "registerart": "HRB",
      "company_name": "Balanso GmbH",
      "company_seat": "Pullach i. Isartal",
      "details": "16.01.2025 (Bekanntmachungsdatum)\n\nBayern Amtsgericht München HRB 173666\nLöschungsankündigung\n\nBalanso GmbH\nGesellschaft mit beschränkter Haftung\nPullach i. Isartal\n\nDas Registergericht beabsichtigt, die im Handelsregister eingetragene Gesellschaft wegen Vermögenslosigkeit von Amts wegen nach § 394 FamFG zu löschen. Die Frist zur Erhebung eines Widerspruchs ist auf drei Monate festgesetzt."
    },
    {
      "date": "2025-01-16",
      "id": "98716",
      "original_text": "Einreichung neuer Dokumente\nBayern Amtsgericht Würzburg HRB 14818\nBrose Verwaltung SE, Würzburg – Würzburg",
      "type": "Einreichung neuer Dokumente",
      "state": "Bayern",
      "amtsgericht": "Amtsgericht Würzburg",
      "registernummer": "HRB 14818",
      "registerart": "HRB",
      "company_name": "Brose Verwaltung SE, Würzburg",
      "company_seat": "Würzburg",
      "details": "16.01.2025 (Bekanntmachungsdatum)\n\nBayern Amtsgericht Würzburg HRB 14818\nEinreichung neuer Dokumente\n\nBrose Verwaltung SE, Würzburg\nEuropäische Aktiengesellschaft (SE)\nWürzburg\n\nDem Amtsgericht Würzburg -Registergericht- ist eine Liste der Mitglieder des Aufsichtsrats eingereicht worden, Art. 9 Abs. 1 Buchst. c (ii) SE-VO i.V.m. § 106 AktG."
    },
    {
      "date": "2025-01-16",
      "id": "98717",
      "original_text": "Einreichung neuer Dokumente\nBayern Amtsgericht München HRB 215991\nKONSORTIUM AKTIENGESELLSCHAFT – Mittenwald",
      "type": "Einreichung neuer Dokumente",
      "state": "Bayern",
      "amtsgericht": "Amtsgericht München",
      "registernummer": "HRB 215991",
      "registerart": "HRB",
      "company_name": "KONSORTIUM AKTIENGESELLSCHAFT",
      "company_seat": "Mittenwald",
      "details": "16.01.2025 (Bekanntmachungsdatum)\n\nBayern Amtsgericht München HRB 215991\nEinreichung neuer Dokumente\n\nKONSORTIUM AKTIENGESELLSCHAFT\nAktiengesellschaft\nMittenwald\n\nDem #Re.Name ist eine Liste der Mitglieder des Aufsichtsrats eingereicht worden, § 106 AktG."
    },
    {
      "date": "2025-01-16",
      "id": "98718",
      "original_text": "Einreichung neuer Dokumente\nBayern Amtsgericht Nürnberg HRB 20609\nElectrolux Rothenburg GmbH Factory and Development – Nürnberg",
      "type": "Einreichung neuer Dokumente",
      "state": "Bayern",
      "amtsgericht": "Amtsgericht Nürnberg",
      "registernummer": "HRB 20609",
      "registerart": "HRB",
      "company_name": "Electrolux Rothenburg GmbH Factory and Development",
      "company_seat": "Nürnberg",
      "details": "16.01.2025 (Bekanntmachungsdatum)\n\nBayern Amtsgericht Nürnberg HRB 20609\nEinreichung neuer Dokumente 30.12.2024 (Eintragungsdatum)\n\nElectrolux Rothenburg GmbH Factory and Development\nGesellschaft mit beschränkter Haftung\nNürnberg\n\nDem #Re.Name ist eine Liste der Mitglieder des Aufsichtsrats eingereicht worden, § 52 Abs. 3 S. 2 GmbHG."
    },
    {
      "date": "2025-01-16",
      "id": "98719",
      "original_text": "Einreichung neuer Dokumente\nBayern Amtsgericht Regensburg HRB 15138\nBauwert Aktiengesellschaft – Bad Kötzting",
      "type": "Einreichung neuer Dokumente",
      "state": "Bayern",
      "amtsgericht": "Amtsgericht Regensburg",
      "registernummer": "HRB 15138",
      "registerart": "HRB",
      "company_name": "Bauwert Aktiengesellschaft",
      "company_seat": "Bad Kötzting",
      "details": "16.01.2025 (Bekanntmachungsdatum)\n\nBayern Amtsgericht Regensburg HRB 15138\nEinreichung neuer Dokumente\n\nBauwert Aktiengesellschaft\nAktiengesellschaft\nBad Kötzting\n\nDem Amtsgericht Regensburg -Registergericht- ist eine Liste der Mitglieder des Aufsichtsrats eingereicht worden, § 106 AktG."
    },
    {
      "date": "2025-01-16",
      "id": "98720",
      "original_text": "Einreichung neuer Dokumente\nBayern Amtsgericht München HRB 180914\nAlnylam Europe AG – München",
      "type": "Einreichung neuer Dokumente",
      "state": "Bayern",
      "amtsgericht": "Amtsgericht München",
      "registernummer": "HRB 180914",
      "registerart": "HRB",
      "company_name": "Alnylam Europe AG",
      "company_seat": "München",
      "details": "16.01.2025 (Bekanntmachungsdatum)\n\nBayern Amtsgericht München HRB 180914\nEinreichung neuer Dokumente\n\nAlnylam Europe AG\nAktiengesellschaft\nMünchen\n\nDem Amtsgericht München -Registergericht- ist eine Liste der Mitglieder des Aufsichtsrats eingereicht worden, § 106 AktG."
    },
    {
      "date": "2025-01-16",
      "id": "98721",
      "original_text": "Löschungsankündigung\nBayern Amtsgericht München HRB 178226\nMK Abbruch & Sanierung GmbH – München",
      "type": "Löschungsankündigung",
      "state": "Bayern",
      "amtsgericht": "Amtsgericht München",
      "registernummer": "HRB 178226",
      "registerart": "HRB",
      "company_name": "MK Abbruch & Sanierung GmbH",
      "company_seat": "München",
      "details": "16.01.2025 (Bekanntmachungsdatum)\n\nBayern Amtsgericht München HRB 178226\nLöschungsankündigung 15.01.2025 (Eintragungsdatum)\n\nMK Abbruch & Sanierung GmbH\nGesellschaft mit beschränkter Haftung\nMünchen\n\nDas Registergericht beabsichtigt, die im Handelsregister eingetragene Gesellschaft wegen Vermögenslosigkeit von Amts wegen nach § 394 FamFG zu löschen. Die Frist zur Erhebung eines Widerspruchs ist auf drei Monate festgesetzt."
    },
    {
      "date": "2025-01-16",
      "id": "98722",
      "original_text": "Löschungsankündigung\nBayern Amtsgericht München HRB 237654\nCopperhead Industrial GmbH – München",
      "type": "Löschungsankündigung",
      "state": "Bayern",
      "amtsgericht": "Amtsgericht München",
      "registernummer": "HRB 237654",
      "registerart": "HRB",
      "company_name": "Copperhead Industrial GmbH",
      "company_seat": "München",
      "details": "16.01.2025 (Bekanntmachungsdatum)\n\nBayern Amtsgericht München HRB 237654\nLöschungsankündigung 15.01.2025 (Eintragungsdatum)\n\nCopperhead Industrial GmbH\nGesellschaft mit beschränkter Haftung\nMünchen\n\nDas Registergericht beabsichtigt, die im Handelsregister eingetragene Gesellschaft wegen Vermögenslosigkeit von Amts wegen nach § 394 FamFG zu löschen. Die Frist zur Erhebung eines Widerspruchs ist auf drei Monate festgesetzt."
    },
    {
      "date": "2025-01-16",
      "id": "98723",
      "original_text": "Einreichung neuer Dokumente\nBayern Amtsgericht Bayreuth HRB 6781\nStäubli Immobiliengesellschaft mbH – Bayreuth",
      "type": "Einreichung neuer Dokumente",
      "state": "Bayern",
      "amtsgericht": "Amtsgericht Bayreuth",
      "registernummer": "HRB 6781",
      "registerart": "HRB",
      "company_name": "Stäubli Immobiliengesellschaft mbH",
      "company_seat": "Bayreuth",
      "details": "16.01.2025 (Bekanntmachungsdatum)\n\nBayern Amtsgericht Bayreuth HRB 6781\nEinreichung neuer Dokumente\n\nStäubli Immobiliengesellschaft mbH\nGesellschaft mit beschränkter Haftung\nBayreuth\n\nDem Amtsgericht Bayreuth -Registergericht- ist eine Liste der Mitglieder des Beirats eingereicht worden, § 52 Abs. 3 S. 2 GmbHG."
    },
    {
      "date": "2025-01-16",
      "id": "98724",
      "original_text": "Löschungsankündigung\nBayern Amtsgericht Nürnberg HRA 8744\nJaguar - Accessoires Inh. Werner Leikamm – Röttenbach",
      "type": "Löschungsankündigung",
      "state": "Bayern",
      "amtsgericht": "Amtsgericht Nürnberg",
      "registernummer": "HRA 8744",
      "registerart": "HRA",
      "company_name": "Jaguar - Accessoires Inh. Werner Leikamm",
      "company_seat": "Röttenbach",
      "details": "16.01.2025 (Bekanntmachungsdatum)\n\nBayern Amtsgericht Nürnberg HRA 8744\nLöschungsankündigung\n\nJaguar - Accessoires Inh. Werner Leikamm\nEinzelkaufmann / Einzelkauffrau\nRöttenbach\n\nDas Registergericht beabsichtigt, die im Handelsregister eingetragene Firma von Amts wegen nach § 31 Abs. 2 HGB zu löschen. Die Frist zur Erhebung eines Widerspruchs ist auf einen Monat festgesetzt."
    },
    {
      "date": "2025-01-16",
      "id": "98725",
      "original_text": "Registerbekanntmachung nach dem Umwandlungsgesetz\nBayern Amtsgericht München HRB 299000\nARRI GmbH – München",
      "type": "Registerbekanntmachung nach dem Umwandlungsgesetz",
      "state": "Bayern",
      "amtsgericht": "Amtsgericht München",
      "registernummer": "HRB 299000",
      "registerart": "HRB",
      "company_name": "ARRI GmbH",
      "company_seat": "München",
      "details": "16.01.2025 (Bekanntmachungsdatum)\n\nBayern Amtsgericht München HRB 299000\nRegisterbekanntmachung nach dem Umwandlungsgesetz 15.01.2025 (Eintragungsdatum)\n\nARRI GmbH\nGesellschaft mit beschränkter Haftung\nMünchen\n\nDen Gläubigern des formwechselnden Rechtsträgers ist, wenn sie binnen sechs Monaten nach dem Tag, an dem die Eintragung des Formwechsels nach § 201 UmwG als bekannt gemacht gilt, ihren Anspruch nach Grund und Höhe in Textform anmelden, Sicherheit zu leisten, soweit sie nicht Befriedigung verlangen können. Dieses Recht steht den Gläubigern jedoch nur zu, wenn sie glaubhaft machen, dass durch den Formwechsel die Erfüllung ihrer Forderung gefährdet wird."
    },
    {
      "date": "2025-01-16",
      "id": "98726",
      "original_text": "Registerbekanntmachung nach dem Umwandlungsgesetz\nBayern Amtsgericht München HRB 196733\nT-Development GmbH – Garmisch-Partenkirchen",
      "type": "Registerbekanntmachung nach dem Umwandlungsgesetz",
      "state": "Bayern",
      "amtsgericht": "Amtsgericht München",
      "registernummer": "HRB 196733",
      "registerart": "HRB",
      "company_name": "T-Development GmbH",
      "company_seat": "Garmisch-Partenkirchen",
      "details": "16.01.2025 (Bekanntmachungsdatum)\n\nBayern Amtsgericht München HRB 196733\nRegisterbekanntmachung nach dem Umwandlungsgesetz\n\nT-Development GmbH\nGesellschaft mit beschränkter Haftung\nGarmisch-Partenkirchen\n\nDem Amtsgericht München -Registergericht- ist am 13.01.2025 der Entwurf eines Verschmelzungsplanes über die geplante Verschmelzung der Gesellschaft mit beschränkter Haftung nach lettischem Recht unter der Firma SIA \"T-Development\" mit Sitz in Riga / Lettland im Gesellschaftsregister der Republik Lettland unter der Registernummer 50103535191 mit der Gesellschaft als übertragendem Rechtsträger eingereicht worden.\n\nEs ergehen folgende Hinweise:\n\nDass die Gesellschafter und die Gläubiger der an der grenzüberschreitenden Verschmelzung beteiligten Gesellschaften spätestens fünf Arbeitstage vor dem 21. Februar 2025 (dies ist der Tag, an dem der Verschmelzungsplan beurkundet werden soll und VerschmeIzungsbeschlüsse - sofern sie erforderlich oder dienlich sind - gefasst werden sollen) Bemerkungen zum Verschmelzungsplan übermitteln können.\n\nDass ein Hinweis an die Betriebsräte oder an die Arbeitnehmer der an der Verschmelzung beteiligten Gesellschaften (§ 308 Abs. 1 Nr. 4b) UmwG) entbehrlich ist, da keine der beteiligten Gesellschaften über einen Betriebsrat verfügt oder Arbeitnehmer beschäftigt."
    },
    {
      "date": "2025-01-16",
      "id": "98727",
      "original_text": "Sonstige Registerbekanntmachung\nBayern Amtsgericht Nürnberg HRB 8104\nALLCOLOR Malerbedarf GmbH – Abenberg",
      "type": "Sonstige Registerbekanntmachung",
      "state": "Bayern",
      "amtsgericht": "Amtsgericht Nürnberg",
      "registernummer": "HRB 8104",
      "registerart": "HRB",
      "company_name": "ALLCOLOR Malerbedarf GmbH",
      "company_seat": "Abenberg",
      "details": "16.01.2025 (Bekanntmachungsdatum)\n\nBayern Amtsgericht Nürnberg HRB 8104\nSonstige Registerbekanntmachung 15.01.2025 (Eintragungsdatum)\n\nALLCOLOR Malerbedarf GmbH\nGesellschaft mit beschränkter Haftung\nAbenberg\n\nDen Gläubigern der Gesellschaft, deren Forderungen begründet worden sind, bevor die Eintragung der Beendigung des Gewinnabführungsvertrages in das Handelsregister nach § 10 des Handelsgesetzbuches als bekanntgemacht gilt, hat der andere Vertragsteil Sicherheit zu leisten, wenn sie sich binnen sechs Monaten nach der Bekanntmachung der Eintragung zu diesem Zweck bei ihm melden."
    },
    {
      "date": "2025-01-16",
      "id": "98728",
      "original_text": "Löschungsankündigung\nBayern Amtsgericht Bamberg HRB 8875\nTraxx GmbH – Theres OT Obertheres",
      "type": "Löschungsankündigung",
      "state": "Bayern",
      "amtsgericht": "Amtsgericht Bamberg",
      "registernummer": "HRB 8875",
      "registerart": "HRB",
      "company_name": "Traxx GmbH",
      "company_seat": "Theres OT Obertheres",
      "details": "16.01.2025 (Bekanntmachungsdatum)\n\nBayern Amtsgericht Bamberg HRB 8875\nLöschungsankündigung\n\nTraxx GmbH\nGesellschaft mit beschränkter Haftung\nTheres OT Obertheres\n\nDas Registergericht beabsichtigt, die im Handelsregister eingetragene Gesellschaft wegen Vermögenslosigkeit von Amts wegen nach § 394 FamFG zu löschen. Die Frist zur Erhebung eines Widerspruchs ist auf einen Monat festgesetzt."
    },
    {
      "date": "2025-01-16",
      "id": "98729",
      "original_text": "Sonstige Registerbekanntmachung\nBayern Amtsgericht München HRB 139758\nLodenfrey-Park GmbH – München",
      "type": "Sonstige Registerbekanntmachung",
      "state": "Bayern",
      "amtsgericht": "Amtsgericht München",
      "registernummer": "HRB 139758",
      "registerart": "HRB",
      "company_name": "Lodenfrey-Park GmbH",
      "company_seat": "München",
      "details": "16.01.2025 (Bekanntmachungsdatum)\n\nBayern Amtsgericht München HRB 139758\nSonstige Registerbekanntmachung\n\nLodenfrey-Park GmbH\nGesellschaft mit beschränkter Haftung\nMünchen\n\nDem #Re.Name ist eine Liste der Mitglieder des Aufsichtsrats eingereicht worden, § 52 Abs. 3 S. 2 GmbHG."
    },
    {
      "date": "2025-01-16",
      "id": "98730",
      "original_text": "Registerbekanntmachung nach dem Umwandlungsgesetz\nBayern Amtsgericht München HRB 213921\nTvW Holding GmbH – München",
      "type": "Registerbekanntmachung nach dem Umwandlungsgesetz",
      "state": "Bayern",
      "amtsgericht": "Amtsgericht München",
      "registernummer": "HRB 213921",
      "registerart": "HRB",
      "company_name": "TvW Holding GmbH",
      "company_seat": "München",
      "details": "16.01.2025 (Bekanntmachungsdatum)\n\nBayern Amtsgericht München HRB 213921\nRegisterbekanntmachung nach dem Umwandlungsgesetz 15.01.2025 (Eintragungsdatum)\n\nTvW Holding GmbH\nGesellschaft mit beschränkter Haftung\nMünchen\n\nDen Gläubigern der an der Verschmelzung beteiligten Rechtsträger ist, wenn sie binnen sechs Monaten nach dem Tag, an dem die Eintragung der Verschmelzung in das Register des Sitzes desjenigen Rechtsträgers, dessen Gläubiger sie sind, nach § 19 Abs. 3 UmwG als bekannt gemacht gilt, ihren Anspruch nach Grund und Höhe in Textform anmelden, Sicherheit zu leisten, soweit sie nicht Befriedigung verlangen können. Dieses Recht steht den Gläubigern jedoch nur zu, wenn sie glaubhaft machen, dass durch die Verschmelzung die Erfüllung ihrer Forderung gefährdet wird."
    },
    {
      "date": "2025-01-16",
      "id": "98731",
      "original_text": "Einreichung neuer Dokumente\nBayern Amtsgericht München HRB 127559\nConsal Beteiligungsgesellschaft Aktiengesellschaft – München",
      "type": "Einreichung neuer Dokumente",
      "state": "Bayern",
      "amtsgericht": "Amtsgericht München",
      "registernummer": "HRB 127559",
      "registerart": "HRB",
      "company_name": "Consal Beteiligungsgesellschaft Aktiengesellschaft",
      "company_seat": "München",
      "details": "16.01.2025 (Bekanntmachungsdatum)\n\nBayern Amtsgericht München HRB 127559\nEinreichung neuer Dokumente\n\nConsal Beteiligungsgesellschaft Aktiengesellschaft\nAktiengesellschaft\nMünchen\n\nDem #Re.Name ist eine Liste der Mitglieder des Aufsichtsrats eingereicht worden, § 106 AktG."
    },
    {
      "date": "2025-01-16",
      "id": "98732",
      "original_text": "Einreichung neuer Dokumente\nBayern Amtsgericht Bayreuth HRB 6065\nStäubli Bayreuth GmbH – Bayreuth",
      "type": "Einreichung neuer Dokumente",
      "state": "Bayern",
      "amtsgericht": "Amtsgericht Bayreuth",
      "registernummer": "HRB 6065",
      "registerart": "HRB",
      "company_name": "Stäubli Bayreuth GmbH",
      "company_seat": "Bayreuth",
      "details": "16.01.2025 (Bekanntmachungsdatum)\n\nBayern Amtsgericht Bayreuth HRB 6065\nEinreichung neuer Dokumente\n\nStäubli Bayreuth GmbH\nGesellschaft mit beschränkter Haftung\nBayreuth\n\nDem Amtsgericht Bayreuth -Registergericht- ist eine Liste der Mitglieder des Beirats eingereicht worden, § 52 Abs. 3 S. 2 GmbHG."
    },
    {
      "date": "2025-01-16",
      "id": "98733",
      "original_text": "Sonstige Registerbekanntmachung\nBayern Amtsgericht Coburg HRB 30\nHUK-COBURG-Lebensversicherung AG – Coburg",
      "type": "Sonstige Registerbekanntmachung",
      "state": "Bayern",
      "amtsgericht": "Amtsgericht Coburg",
      "registernummer": "HRB 30",
      "registerart": "HRB",
      "company_name": "HUK-COBURG-Lebensversicherung AG",
      "company_seat": "Coburg",
      "details": "16.01.2025 (Bekanntmachungsdatum)\n\nBayern Amtsgericht Coburg HRB 30\nSonstige Registerbekanntmachung 13.01.2025 (Eintragungsdatum)\n\nHUK-COBURG-Lebensversicherung AG\nAktiengesellschaft\nCoburg\n\nDen Gläubigern der Gesellschaft, deren Forderungen begründet worden sind, bevor die Eintragung des Beschlusses bekanntgemacht worden ist, ist, wenn sie sich binnen sechs Monaten nach der Bekanntmachung zu diesem Zweck melden, Sicherheit zu leisten, soweit sie nicht Befriedigung verlangen können. Das Recht, Sicherheitsleistung zu verlangen, steht Gläubigern nicht zu, die im Fall des Insolvenzverfahrens ein Recht auf vorzugsweise Befriedigung aus einer Deckungsmasse haben, die nach gesetzlicher Vorschrift zu ihrem Schutz errichtet und staatlich überwacht ist."
    },
    {
      "date": "2025-01-16",
      "id": "98734",
      "original_text": "Registerbekanntmachung nach dem Umwandlungsgesetz\nBayern Amtsgericht München HRB 139673\nARRI AG – München",
      "type": "Registerbekanntmachung nach dem Umwandlungsgesetz",
      "state": "Bayern",
      "amtsgericht": "Amtsgericht München",
      "registernummer": "HRB 139673",
      "registerart": "HRB",
      "company_name": "ARRI AG",
      "company_seat": "München",
      "details": "16.01.2025 (Bekanntmachungsdatum)\n\nBayern Amtsgericht München HRB 139673\nRegisterbekanntmachung nach dem Umwandlungsgesetz 15.01.2025 (Eintragungsdatum)\n\nARRI AG\nAktiengesellschaft\nMünchen\n\nDen Gläubigern des formwechselnden Rechtsträgers ist, wenn sie binnen sechs Monaten nach dem Tag, an dem die Eintragung des Formwechsels nach § 201 UmwG als bekannt gemacht gilt, ihren Anspruch nach Grund und Höhe in Textform anmelden, Sicherheit zu leisten, soweit sie nicht Befriedigung verlangen können. Dieses Recht steht den Gläubigern jedoch nur zu, wenn sie glaubhaft machen, dass durch den Formwechsel die Erfüllung ihrer Forderung gefährdet wird."
    },
    {
      "date": "2025-01-16",
      "id": "98735",
      "original_text": "Registerbekanntmachung nach dem Umwandlungsgesetz\nBayern Amtsgericht München HRB 261508\nLOGIC GREEN VALLEY 1 GmbH – Gräfelfing",
      "type": "Registerbekanntmachung nach dem Umwandlungsgesetz",
      "state": "Bayern",
      "amtsgericht": "Amtsgericht München",
      "registernummer": "HRB 261508",
      "registerart": "HRB",
      "company_name": "LOGIC GREEN VALLEY 1 GmbH",
      "company_seat": "Gräfelfing",
      "details": "16.01.2025 (Bekanntmachungsdatum)\n\nBayern Amtsgericht München HRB 261508\nRegisterbekanntmachung nach dem Umwandlungsgesetz 15.01.2025 (Eintragungsdatum)\n\nLOGIC GREEN VALLEY 1 GmbH\nGesellschaft mit beschränkter Haftung\nGräfelfing\n\nEs wird darauf hingewiesen, dass ein Formwechselplan oder sein Entwurf über einen grenzüberschreitenden Formwechsel in die LOGIC GREEN VALLEY 1 société à responsabilitité limitée mit Sitz in Bereldange/Luxemburg (société à responsabilité limitée - Gesellschaft mit beschränkter Haftung  nach luxemburgischem Recht) beim Handelsregister eingereicht worden ist.\nDie Anteilsinhaber, die Gläubiger sowie die zuständigen Betriebsräte der an dem grenzüberschreitenden Formwechsel beteiligten Gesellschaft oder, soweit es keinen Betriebsrat gibt, die Arbeitnehmer der an dem grenzüberschreitenden Formwechsel beteiligten Gesellschaft, können der Gesellschaft spätestens fünf Arbeitstage vor dem Tag der Gesellschafterversammlung Bemerkungen zum Formwechselplan übermitteln."
    },
    {
      "date": "2025-01-16",
      "id": "98736",
      "original_text": "Einreichung neuer Dokumente\nBayern Amtsgericht München HRB 298093\nTradevest Markets AG – München",
      "type": "Einreichung neuer Dokumente",
      "state": "Bayern",
      "amtsgericht": "Amtsgericht München",
      "registernummer": "HRB 298093",
      "registerart": "HRB",
      "company_name": "Tradevest Markets AG",
      "company_seat": "München",
      "details": "16.01.2025 (Bekanntmachungsdatum)\n\nBayern Amtsgericht München HRB 298093\nEinreichung neuer Dokumente 15.01.2025 (Eintragungsdatum)\n\nTradevest Markets AG\nAktiengesellschaft\nMünchen\n\nDem #Re.Name ist eine Liste der Mitglieder des Aufsichtsrats eingereicht worden, § 106 AktG."
    },
    {
      "date": "2025-01-16",
      "id": "98737",
      "original_text": "Registerbekanntmachung nach dem Umwandlungsgesetz\nBayern Amtsgericht Augsburg HRA 16994\nPegasus Immobilienverwaltung GmbH & Co. KG – Gersthofen",
      "type": "Registerbekanntmachung nach dem Umwandlungsgesetz",
      "state": "Bayern",
      "amtsgericht": "Amtsgericht Augsburg",
      "registernummer": "HRA 16994",
      "registerart": "HRA",
      "company_name": "Pegasus Immobilienverwaltung GmbH & Co. KG",
      "company_seat": "Gersthofen",
      "details": "16.01.2025 (Bekanntmachungsdatum)\n\nBayern Amtsgericht Augsburg HRA 16994\nRegisterbekanntmachung nach dem Umwandlungsgesetz 15.01.2025 (Eintragungsdatum)\n\nPegasus Immobilienverwaltung GmbH & Co. KG\nKommanditgesellschaft\nGersthofen\n\nDen Gläubigern des formwechselnden Rechtsträgers ist, wenn sie binnen sechs Monaten nach dem Tag, an dem die Eintragung des Formwechsels nach § 201 UmwG als bekannt gemacht gilt, ihren Anspruch nach Grund und Höhe in Textform anmelden, Sicherheit zu leisten, soweit sie nicht Befriedigung verlangen können. Dieses Recht steht den Gläubigern jedoch nur zu, wenn sie glaubhaft machen, dass durch den Formwechsel die Erfüllung ihrer Forderung gefährdet wird."
    },
    {
      "date": "2025-01-16",
      "id": "98738",
      "original_text": "Registerbekanntmachung nach dem Umwandlungsgesetz\nBerlin Amtsgericht Berlin (Charlottenburg) HRB 60942\nZahl GmbH – Berlin",
      "type": "Registerbekanntmachung nach dem Umwandlungsgesetz",
      "state": "Berlin",
      "amtsgericht": "Amtsgericht Berlin (Charlottenburg)",
      "registernummer": "HRB 60942",
      "registerart": "HRB",
      "company_name": "Zahl GmbH",
      "company_seat": "Berlin",
      "details": "16.01.2025 (Bekanntmachungsdatum)\n\nBerlin Amtsgericht Berlin (Charlottenburg) HRB 60942\nRegisterbekanntmachung nach dem Umwandlungsgesetz 15.01.2025 (Eintragungsdatum)\n\nZahl GmbH\nGesellschaft mit beschränkter Haftung\nBerlin\n\nZu Eintragungsnummer 6 vom 15.01.2025 wird als nicht eingetragen veröffentlicht:\n\nDen Gläubigern ist, wenn sie binnen sechs Monaten nach dem Tag, an dem die Eintragung der Umwandlung als bekannt gemacht gilt, ihren Anspruch nach Grund und Höhe schriftlich anmelden, Sicherheit zu leisten, soweit sie nicht Befriedigung verlangen können. Dieses Recht steht den Gläubigern jedoch nur zu, wenn sie glaubhaft machen, dass durch die Umwandlung die Erfüllung ihrer Forderung gefährdet wird. Das Recht, Sicherheitsleistung zu verlangen, steht Gläubigern nicht zu, die im Falle der Insolvenz ein Recht auf vorzugsweise Befriedigung aus einer Deckungsmasse haben, die nach gesetzlicher Vorschrift zu ihrem Schutz errichtet und staatlich überwacht ist."
    },
    {
      "date": "2025-01-16",
      "id": "98739",
      "original_text": "Registerbekanntmachung nach dem Umwandlungsgesetz\nBerlin Amtsgericht Berlin (Charlottenburg) HRA 63822\nZahl KG – Berlin",
      "type": "Registerbekanntmachung nach dem Umwandlungsgesetz",
      "state": "Berlin",
      "amtsgericht": "Amtsgericht Berlin (Charlottenburg)",
      "registernummer": "HRA 63822",
      "registerart": "HRA",
      "company_name": "Zahl KG",
      "company_seat": "Berlin",
      "details": "16.01.2025 (Bekanntmachungsdatum)\n\nBerlin Amtsgericht Berlin (Charlottenburg) HRA 63822\nRegisterbekanntmachung nach dem Umwandlungsgesetz 15.01.2025 (Eintragungsdatum)\n\nZahl KG\nKommanditgesellschaft\nBerlin\n\nZu Eintragungsnummer 1 vom 15.01.2025 wird als nicht eingetragen veröffentlicht:\n\nDen Gläubigern ist, wenn sie binnen sechs Monaten nach dem Tag, an dem die Eintragung der Umwandlung als bekannt gemacht gilt, ihren Anspruch nach Grund und Höhe schriftlich anmelden, Sicherheit zu leisten, soweit sie nicht Befriedigung verlangen können. Dieses Recht steht den Gläubigern jedoch nur zu, wenn sie glaubhaft machen, dass durch die Umwandlung die Erfüllung ihrer Forderung gefährdet wird. Das Recht, Sicherheitsleistung zu verlangen, steht Gläubigern nicht zu, die im Falle der Insolvenz ein Recht auf vorzugsweise Befriedigung aus einer Deckungsmasse haben, die nach gesetzlicher Vorschrift zu ihrem Schutz errichtet und staatlich überwacht ist."
    },
    {
      "date": "2025-01-16",
      "id": "98740",
      "original_text": "Löschungsankündigung\nSachsen-Anhalt Amtsgericht Stendal HRA 3164\nPLABIS INTERNATIONAL GmbH & Co. KG – Haldensleben",
      "type": "Löschungsankündigung",
      "state": "Sachsen-Anhalt",
      "amtsgericht": "Amtsgericht Stendal",
      "registernummer": "HRA 3164",
      "registerart": "HRA",
      "company_name": "PLABIS INTERNATIONAL GmbH & Co. KG",
      "company_seat": "Haldensleben",
      "details": "16.01.2025 (Bekanntmachungsdatum)\n\nSachsen-Anhalt Amtsgericht Stendal HRA 3164\nLöschungsankündigung\n\nPLABIS INTERNATIONAL GmbH & Co. KG\nKommanditgesellschaft\nHaldensleben\n\nDas Registergericht beabsichtigt, nachfolgende im Handelregister eingetragenen Firmen von Amts wegen nach § 394 FamFG zu löschen. Die Frist zu Erhebung eines Widerspruchs wird auf drei Monate festgesetzt."
    },
    {
      "date": "2025-01-16",
      "id": "98741",
      "original_text": "Einreichung neuer Dokumente\nBerlin Amtsgericht Berlin (Charlottenburg) HRB 110981\nABK Allgemeine Beamten Bank AG – Berlin",
      "type": "Einreichung neuer Dokumente",
      "state": "Berlin",
      "amtsgericht": "Amtsgericht Berlin (Charlottenburg)",
      "registernummer": "HRB 110981",
      "registerart": "HRB",
      "company_name": "ABK Allgemeine Beamten Bank AG",
      "company_seat": "Berlin",
      "details": "16.01.2025 (Bekanntmachungsdatum)\n\nBerlin Amtsgericht Berlin (Charlottenburg) HRB 110981\nEinreichung neuer Dokumente\n\nABK Allgemeine Beamten Bank AG\nAktiengesellschaft\nBerlin\n\nAls nicht eingetragen wird veröffentlicht: Es wurde eine neue Liste der Aufsichtsratsmitglieder eingereicht (§ 106 AktG)."
    },
    {
      "date": "2025-01-16",
      "id": "98742",
      "original_text": "Löschungsankündigung\nBerlin Amtsgericht Berlin (Charlottenburg) HRB 139413\nDE-RI Dachdeckertechnik GmbH – Berlin",
      "type": "Löschungsankündigung",
      "state": "Berlin",
      "amtsgericht": "Amtsgericht Berlin (Charlottenburg)",
      "registernummer": "HRB 139413",
      "registerart": "HRB",
      "company_name": "DE-RI Dachdeckertechnik GmbH",
      "company_seat": "Berlin",
      "details": "16.01.2025 (Bekanntmachungsdatum)\n\nBerlin Amtsgericht Berlin (Charlottenburg) HRB 139413\nLöschungsankündigung\n\nDE-RI Dachdeckertechnik GmbH\nGesellschaft mit beschränkter Haftung\nBerlin\n\nBei der nachstehenden Gesellschaft wird das Amtslöschungsverfahren gemäß § 394 FamFG eingeleitet. Widerspruchsfrist 6 Wochen"
    },
    {
      "date": "2025-01-16",
      "id": "98743",
      "original_text": "Löschungsankündigung\nBerlin Amtsgericht Berlin (Charlottenburg) HRB 195292\nAventura Investment GmbH – Berlin",
      "type": "Löschungsankündigung",
      "state": "Berlin",
      "amtsgericht": "Amtsgericht Berlin (Charlottenburg)",
      "registernummer": "HRB 195292",
      "registerart": "HRB",
      "company_name": "Aventura Investment GmbH",
      "company_seat": "Berlin",
      "details": "16.01.2025 (Bekanntmachungsdatum)\n\nBerlin Amtsgericht Berlin (Charlottenburg) HRB 195292\nLöschungsankündigung\n\nAventura Investment GmbH\nGesellschaft mit beschränkter Haftung\nBerlin\n\nBei der nachstehenden Gesellschaft wird das Amtslöschungsverfahren gemäß § 394 FamFG eingeleitet. Widerspruchsfrist 6 Wochen"
    },
    {
      "date": "2025-01-16",
      "id": "98744",
      "original_text": "Registerbekanntmachung nach dem Umwandlungsgesetz\nBaden-Württemberg Amtsgericht Stuttgart HRA 741968\nJulia Käser Leadership Coaching & Training e.K. – Neckartailfingen",
      "type": "Registerbekanntmachung nach dem Umwandlungsgesetz",
      "state": "Baden-Württemberg",
      "amtsgericht": "Amtsgericht Stuttgart",
      "registernummer": "HRA 741968",
      "registerart": "HRA",
      "company_name": "Julia Käser Leadership Coaching & Training e.K.",
      "company_seat": "Neckartailfingen",
      "details": "16.01.2025 (Bekanntmachungsdatum)\n\nBaden-Württemberg Amtsgericht Stuttgart HRA 741968\nRegisterbekanntmachung nach dem Umwandlungsgesetz 16.01.2025 (Eintragungsdatum)\n\nJulia Käser Leadership Coaching & Training e.K.\nEinzelkaufmann / Einzelkauffrau\nNeckartailfingen\n\nDen Gläubigern der an der Ausgliederung beteiligten Rechtsträger ist, wenn sie binnen sechs Monaten nach dem Tag, an dem die Eintragung der Ausgliederung in das Register des Sitzes desjenigen Rechtsträgers, dessen Gläubiger sie sind, nach § 19 Abs. 3 UmwG als bekanntgemacht gilt, ihren Anspruch nach Grund und Höhe schriftlich anmelden, Sicherheit zu leisten, soweit sie nicht Befriedigung verlangen können. Dieses Recht steht den Gläubigern jedoch nur zu, wenn sie glaubhaft machen, dass durch die Ausgliederung die Erfüllung ihrer Forderung gefährdet wird."
    },
    {
      "date": "2025-01-16",
      "id": "98745",
      "original_text": "Sonstige Registerbekanntmachung\nBaden-Württemberg Amtsgericht Mannheim HRB 8193\nLibertas Holding AG – Mannheim",
      "type": "Sonstige Registerbekanntmachung",
      "state": "Baden-Württemberg",
      "amtsgericht": "Amtsgericht Mannheim",
      "registernummer": "HRB 8193",
      "registerart": "HRB",
      "company_name": "Libertas Holding AG",
      "company_seat": "Mannheim",
      "details": "16.01.2025 (Bekanntmachungsdatum)\n\nBaden-Württemberg Amtsgericht Mannheim HRB 8193\nSonstige Registerbekanntmachung 16.01.2025 (Eintragungsdatum)\n\nLibertas Holding AG\nAktiengesellschaft\nMannheim\n\nDie Gesellschaft hat am 03.01.2025 eine Liste der Aufsichtsratsmitglieder bei Gericht eingereicht."
    },
    {
      "date": "2025-01-16",
      "id": "98746",
      "original_text": "Löschungsankündigung\nBaden-Württemberg Amtsgericht Stuttgart HRB 743008\nViropad Products GmbH – Stuttgart",
      "type": "Löschungsankündigung",
      "state": "Baden-Württemberg",
      "amtsgericht": "Amtsgericht Stuttgart",
      "registernummer": "HRB 743008",
      "registerart": "HRB",
      "company_name": "Viropad Products GmbH",
      "company_seat": "Stuttgart",
      "details": "16.01.2025 (Bekanntmachungsdatum)\n\nBaden-Württemberg Amtsgericht Stuttgart HRB 743008\nLöschungsankündigung\n\nViropad Products GmbH\nGesellschaft mit beschränkter Haftung\nStuttgart\n\nDas Gericht beabsichtigt, die Gesellschaft wegen Vermögenslosigkeit im Handelsregister von Amts wegen nach § 394 FamFG zu löschen. Die Frist zur Geltendmachung eines Widerspruchs gegen die beabsichtigte Löschung ist auf zwei Monate ab Veröffentlichung bestimmt."
    },
    {
      "date": "2025-01-16",
      "id": "98747",
      "original_text": "Löschungsankündigung\nBaden-Württemberg Amtsgericht Stuttgart HRB 781574\nEst GmbH – Sindelfingen",
      "type": "Löschungsankündigung",
      "state": "Baden-Württemberg",
      "amtsgericht": "Amtsgericht Stuttgart",
      "registernummer": "HRB 781574",
      "registerart": "HRB",
      "company_name": "Est GmbH",
      "company_seat": "Sindelfingen",
      "details": "16.01.2025 (Bekanntmachungsdatum)\n\nBaden-Württemberg Amtsgericht Stuttgart HRB 781574\nLöschungsankündigung\n\nEst GmbH\nGesellschaft mit beschränkter Haftung\nSindelfingen\n\nDas Gericht beabsichtigt, die Gesellschaft wegen Vermögenslosigkeit im Handelsregister von Amts wegen nach § 394 FamFG zu löschen. Die Frist zur Geltendmachung eines Widerspruchs gegen die beabsichtigte Löschung ist auf zwei Monate ab Veröffentlichung bestimmt."
    },
    {
      "date": "2025-01-16",
      "id": "98748",
      "original_text": "Löschungsankündigung\nBerlin Amtsgericht Berlin (Charlottenburg) HRB 226311\nEE Raum Concept GmbH – Berlin",
      "type": "Löschungsankündigung",
      "state": "Berlin",
      "amtsgericht": "Amtsgericht Berlin (Charlottenburg)",
      "registernummer": "HRB 226311",
      "registerart": "HRB",
      "company_name": "EE Raum Concept GmbH",
      "company_seat": "Berlin",
      "details": "16.01.2025 (Bekanntmachungsdatum)\n\nBerlin Amtsgericht Berlin (Charlottenburg) HRB 226311\nLöschungsankündigung\n\nEE Raum Concept GmbH\nGesellschaft mit beschränkter Haftung\nBerlin\n\nEs ist beabsichtigt, die Eintragung wegen Mangels einer wesentlichen Voraussetzung gemäß § 395 FamFG von Amts wegen zu löschen. Widerspruchsfrist 6 Wochen"
    },
    {
      "date": "2025-01-16",
      "id": "98749",
      "original_text": "Löschungsankündigung\nSaarland Amtsgericht Saarbrücken HRB 106342\nGM Modernbau GmbH – Saarbrücken",
      "type": "Löschungsankündigung",
      "state": "Saarland",
      "amtsgericht": "Amtsgericht Saarbrücken",
      "registernummer": "HRB 106342",
      "registerart": "HRB",
      "company_name": "GM Modernbau GmbH",
      "company_seat": "Saarbrücken",
      "details": "16.01.2025 (Bekanntmachungsdatum)\n\nSaarland Amtsgericht Saarbrücken HRB 106342\nLöschungsankündigung\n\nGM Modernbau GmbH\nGesellschaft mit beschränkter Haftung\nSaarbrücken\n\nEs ist beabsichtigt, die Gesellschaft von Amts wegen gemäß § 394 FamFG wegen Vermögenslosigkeit zu löschen.\nGegen die Löschung von Amts wegen ist das Rechtsmittel des Widerspruchs statthaft. Der Widerspruch ist binnen einer Frist zwei Monaten beginnend mit dem Tag dieser Veröffentlichung durch Einreichen eines Widerspruchsschreibens -schriftlich oder zur Niederschrift der Geschäftsstelle beim Amtsgericht Saarbrücken, -zentrales Handelsregister-, Mainzerstr.178, 66121 Saarbrücken einzulegen.\nDer Widerspruch muss die Bezeichnung der angefochtenen Löschungsankündigung enthalten sowie die Erklärung, dass Widerspruch eingelegt wird. Er ist vom Widerspruchsführer oder seinem Bevollmächtigten zu unterzeichnen.\nDas Widerspruchsschreiben kann auch in der Form eines elektronischen Dokumentes eingereicht werden, das mit einer qualifizierten elektronischen Signatur nach dem Signaturgesetz versehen sein muss (§§ 14 Abs. 2 FamFG, 130a, 298 ZPO)."
    },
    {
      "date": "2025-01-16",
      "id": "98750",
      "original_text": "Registerbekanntmachung nach dem Umwandlungsgesetz\nBaden-Württemberg Amtsgericht Mannheim HRB 422533\nSpiegel Institut Mannheim Verwaltungs GmbH – Mannheim",
      "type": "Registerbekanntmachung nach dem Umwandlungsgesetz",
      "state": "Baden-Württemberg",
      "amtsgericht": "Amtsgericht Mannheim",
      "registernummer": "HRB 422533",
      "registerart": "HRB",
      "company_name": "Spiegel Institut Mannheim Verwaltungs GmbH",
      "company_seat": "Mannheim",
      "details": "16.01.2025 (Bekanntmachungsdatum)\n\nBaden-Württemberg Amtsgericht Mannheim HRB 422533\nRegisterbekanntmachung nach dem Umwandlungsgesetz 16.01.2025 (Eintragungsdatum)\n\nSpiegel Institut Mannheim Verwaltungs GmbH\nGesellschaft mit beschränkter Haftung\nMannheim\n\nAls nicht eingetragen wird bekanntgemacht:\nDen Gläubigern der an der Verschmelzung beteiligten Rechtsträger ist, wenn sie binnen sechs Monaten nach dem Tag, an dem die Eintragung der Verschmelzung in das Register des Sitzes desjenigen Rechtsträgers, dessen Gläubiger sie sind, nach § 19 Abs. 3 UmwG als bekanntgemacht gilt, ihren Anspruch nach Grund und Höhe schriftlich anmelden, Sicherheit zu leisten, soweit sie nicht Befriedigung verlangen können. Dieses Recht steht den Gläubigern jedoch nur zu, wenn sie glaubhaft machen, dass durch die Verschmelzung die Erfüllung ihrer Forderung gefährdet wird."
    },
    {
      "date": "2025-01-16",
      "id": "98751",
      "original_text": "Registerbekanntmachung nach dem Umwandlungsgesetz\nBaden-Württemberg Amtsgericht Mannheim HRB 707004\nProf. Dr. Spiegel & Associés GmbH – Brühl",
      "type": "Registerbekanntmachung nach dem Umwandlungsgesetz",
      "state": "Baden-Württemberg",
      "amtsgericht": "Amtsgericht Mannheim",
      "registernummer": "HRB 707004",
      "registerart": "HRB",
      "company_name": "Prof. Dr. Spiegel & Associés GmbH",
      "company_seat": "Brühl",
      "details": "16.01.2025 (Bekanntmachungsdatum)\n\nBaden-Württemberg Amtsgericht Mannheim HRB 707004\nRegisterbekanntmachung nach dem Umwandlungsgesetz 16.01.2025 (Eintragungsdatum)\n\nProf. Dr. Spiegel & Associés GmbH\nGesellschaft mit beschränkter Haftung\nBrühl\n\nAls nicht eingetragen wird bekanntgemacht:\nDen Gläubigern der an der Verschmelzung beteiligten Rechtsträger ist, wenn sie binnen sechs Monaten nach dem Tag, an dem die Eintragung der Verschmelzung in das Register des Sitzes desjenigen Rechtsträgers, dessen Gläubiger sie sind, nach § 19 Abs. 3 UmwG als bekanntgemacht gilt, ihren Anspruch nach Grund und Höhe schriftlich anmelden, Sicherheit zu leisten, soweit sie nicht Befriedigung verlangen können. Dieses Recht steht den Gläubigern jedoch nur zu, wenn sie glaubhaft machen, dass durch die Verschmelzung die Erfüllung ihrer Forderung gefährdet wird."
    },
    {
      "date": "2025-01-16",
      "id": "98752",
      "original_text": "Einreichung neuer Dokumente\nBerlin Amtsgericht Berlin (Charlottenburg) HRB 150299\nElisabeth Vinzenz Verbund GmbH – Berlin",
      "type": "Einreichung neuer Dokumente",
      "state": "Berlin",
      "amtsgericht": "Amtsgericht Berlin (Charlottenburg)",
      "registernummer": "HRB 150299",
      "registerart": "HRB",
      "company_name": "Elisabeth Vinzenz Verbund GmbH",
      "company_seat": "Berlin",
      "details": "16.01.2025 (Bekanntmachungsdatum)\n\nBerlin Amtsgericht Berlin (Charlottenburg) HRB 150299\nEinreichung neuer Dokumente\n\nElisabeth Vinzenz Verbund GmbH\nGesellschaft mit beschränkter Haftung\nBerlin\n\nAls nicht eingetragen wird veröffentlicht:Es wurde eine neue Liste der Aufsichtsratsmitglieder eingereicht (§52 GmbHG)."
    },
    {
      "date": "2025-01-16",
      "id": "98753",
      "original_text": "Einreichung neuer Dokumente\nBaden-Württemberg Amtsgericht Freiburg HRB 730094\nharu AG – Reichenau",
      "type": "Einreichung neuer Dokumente",
      "state": "Baden-Württemberg",
      "amtsgericht": "Amtsgericht Freiburg",
      "registernummer": "HRB 730094",
      "registerart": "HRB",
      "company_name": "haru AG",
      "company_seat": "Reichenau",
      "details": "16.01.2025 (Bekanntmachungsdatum)\n\nBaden-Württemberg Amtsgericht Freiburg HRB 730094\nEinreichung neuer Dokumente 16.01.2025 (Eintragungsdatum)\n\nharu AG\nAktiengesellschaft\nReichenau\n\nAls nicht eingetragen wird bekanntgemacht:\nDie Gesellschaft hat am 15.01.2025 die Liste über die Zusammensetzung des Aufsichtsrats zum Handelsregister eingereicht."
    },
    {
      "date": "2025-01-16",
      "id": "98754",
      "original_text": "Registerbekanntmachung nach dem Umwandlungsgesetz\nBerlin Amtsgericht Berlin (Charlottenburg) HRA 53072\nBoettger Logistik GmbH & Co. KG – Berlin",
      "type": "Registerbekanntmachung nach dem Umwandlungsgesetz",
      "state": "Berlin",
      "amtsgericht": "Amtsgericht Berlin (Charlottenburg)",
      "registernummer": "HRA 53072",
      "registerart": "HRA",
      "company_name": "Boettger Logistik GmbH & Co. KG",
      "company_seat": "Berlin",
      "details": "16.01.2025 (Bekanntmachungsdatum)\n\nBerlin Amtsgericht Berlin (Charlottenburg) HRA 53072\nRegisterbekanntmachung nach dem Umwandlungsgesetz 15.01.2025 (Eintragungsdatum)\n\nBoettger Logistik GmbH & Co. KG\nKommanditgesellschaft\nBerlin\n\nZu Eintragungsnummer 3 vom 15.01.2025 wird als nicht eingetragen veröffentlicht: Den Gläubigern der an der Verschmelzung beteiligten Rechtsträger ist, wenn sie binnen sechs Monaten nach dem Tag, an dem die Eintragung der Verschmelzung in das Register des Sitzes desjenigen Rechtsträgers, dessen Gläubiger sie sind, als bekannt gemacht gilt, ihren Anspruch nach Grund und Höhe schriftlich anmelden, Sicherheit zu leisten, soweit sie nicht Befriedigung verlangen können. Dieses Recht steht den Gläubigern jedoch nur zu, wenn sie glaubhaft machen, dass durch die Verschmelzung die Erfüllung ihrer Forderung gefährdet wird. Das Recht, Sicherheitsleistung zu verlangen, steht Gläubigern nicht zu, die im Falle der Insolvenz ein Recht auf vorzugsweise Befriedigung aus einer Deckungsmasse haben, die nach gesetzlicher Vorschrift zu ihrem Schutz errichtet und staatlich überwacht ist."
    },
    {
      "date": "2025-01-16",
      "id": "98755",
      "original_text": "Löschungsankündigung\nBerlin Amtsgericht Berlin (Charlottenburg) HRB 263192\nAllstar Bahngleissicherung GmbH – Berlin",
      "type": "Löschungsankündigung",
      "state": "Berlin",
      "amtsgericht": "Amtsgericht Berlin (Charlottenburg)",
      "registernummer": "HRB 263192",
      "registerart": "HRB",
      "company_name": "Allstar Bahngleissicherung GmbH",
      "company_seat": "Berlin",
      "details": "16.01.2025 (Bekanntmachungsdatum)\n\nBerlin Amtsgericht Berlin (Charlottenburg) HRB 263192\nLöschungsankündigung\n\nAllstar Bahngleissicherung GmbH\nGesellschaft mit beschränkter Haftung\nBerlin\n\nBei der nachstehenden Gesellschaft wird das Amtslöschungsverfahren gemäß § 394 FamFG eingeleitet. Widerspruchsfrist 6 Wochen"
    },
    {
      "date": "2025-01-16",
      "id": "98756",
      "original_text": "Einreichung neuer Dokumente\nMecklenburg-Vorpommern Amtsgericht Neubrandenburg HRB 1249\nGeothermie Neubrandenburg Gesellschaft mit beschränkter Haftung – Neubrandenburg",
      "type": "Einreichung neuer Dokumente",
      "state": "Mecklenburg-Vorpommern",
      "amtsgericht": "Amtsgericht Neubrandenburg",
      "registernummer": "HRB 1249",
      "registerart": "HRB",
      "company_name": "Geothermie Neubrandenburg Gesellschaft mit beschränkter Haftung",
      "company_seat": "Neubrandenburg",
      "details": "16.01.2025 (Bekanntmachungsdatum)\n\nMecklenburg-Vorpommern Amtsgericht Neubrandenburg HRB 1249\nEinreichung neuer Dokumente\n\nGeothermie Neubrandenburg Gesellschaft mit beschränkter Haftung\nGesellschaft mit beschränkter Haftung\nNeubrandenburg\n\nEine Liste der Mitglieder des Aufsichtsrats ist zum Handelsregister eingereicht worden."
    },
    {
      "date": "2025-01-16",
      "id": "98757",
      "original_text": "Einreichung neuer Dokumente\nBerlin Amtsgericht Berlin (Charlottenburg) HRB 200197\nNATCON AG – Berlin",
      "type": "Einreichung neuer Dokumente",
      "state": "Berlin",
      "amtsgericht": "Amtsgericht Berlin (Charlottenburg)",
      "registernummer": "HRB 200197",
      "registerart": "HRB",
      "company_name": "NATCON AG",
      "company_seat": "Berlin",
      "details": "16.01.2025 (Bekanntmachungsdatum)\n\nBerlin Amtsgericht Berlin (Charlottenburg) HRB 200197\nEinreichung neuer Dokumente\n\nNATCON AG\nAktiengesellschaft\nBerlin\n\nAls nicht eingetragen wird veröffentlicht:Es wurde eine neue Liste der Aufsichtsratsmitglieder eingereicht (§ 106 AktG)."
    },
    {
      "date": "2025-01-16",
      "id": "98758",
      "original_text": "Einreichung neuer Dokumente\nBaden-Württemberg Amtsgericht Ulm HRB 722408\nLebenshilfe für Menschen mit Behinderung Ostalb gemeinnützige GmbH – Aalen",
      "type": "Einreichung neuer Dokumente",
      "state": "Baden-Württemberg",
      "amtsgericht": "Amtsgericht Ulm",
      "registernummer": "HRB 722408",
      "registerart": "HRB",
      "company_name": "Lebenshilfe für Menschen mit Behinderung Ostalb gemeinnützige GmbH",
      "company_seat": "Aalen",
      "details": "16.01.2025 (Bekanntmachungsdatum)\n\nBaden-Württemberg Amtsgericht Ulm HRB 722408\nEinreichung neuer Dokumente\n\nLebenshilfe für Menschen mit Behinderung Ostalb gemeinnützige GmbH\nGesellschaft mit beschränkter Haftung\nAalen\n\nDie Gesellschaft hat am 16.01.2025 die Liste über die Zusammensetzung des Aufsichtsrats zum Handelsregister eingereicht."
    },
    {
      "date": "2025-01-16",
      "id": "98759",
      "original_text": "Einreichung neuer Dokumente\nSchleswig-Holstein Amtsgericht Pinneberg HRB 8122\nSchleswig-Holstein Netz Beteiligungs-AG – Quickborn/Krs. Pinneberg",
      "type": "Einreichung neuer Dokumente",
      "state": "Schleswig-Holstein",
      "amtsgericht": "Amtsgericht Pinneberg",
      "registernummer": "HRB 8122",
      "registerart": "HRB",
      "company_name": "Schleswig-Holstein Netz Beteiligungs-AG",
      "company_seat": "Quickborn/Krs. Pinneberg",
      "details": "16.01.2025 (Bekanntmachungsdatum)\n\nSchleswig-Holstein Amtsgericht Pinneberg HRB 8122\nEinreichung neuer Dokumente\n\nSchleswig-Holstein Netz Beteiligungs-AG\nAktiengesellschaft\nQuickborn/Krs. Pinneberg\n\nAls nicht eingetragen wird veröffentlicht: Es ist eine neue Liste der Aufsichtsratsmitglieder zum Handelsregister eingereicht."
    },
    {
      "date": "2025-01-16",
      "id": "98760",
      "original_text": "Einreichung neuer Dokumente\nSchleswig-Holstein Amtsgericht Kiel HRB 7636\nNSH Nahverkehr Schleswig-Holstein GmbH – Kiel",
      "type": "Einreichung neuer Dokumente",
      "state": "Schleswig-Holstein",
      "amtsgericht": "Amtsgericht Kiel",
      "registernummer": "HRB 7636",
      "registerart": "HRB",
      "company_name": "NSH Nahverkehr Schleswig-Holstein GmbH",
      "company_seat": "Kiel",
      "details": "16.01.2025 (Bekanntmachungsdatum)\n\nSchleswig-Holstein Amtsgericht Kiel HRB 7636\nEinreichung neuer Dokumente\n\nNSH Nahverkehr Schleswig-Holstein GmbH\nGesellschaft mit beschränkter Haftung\nKiel\n\nAls nicht eingetragen wird veröffentlicht: Eine neue Liste der Aufsichtsratsmitglieder ist eingereicht worden."
    },
    {
      "date": "2025-01-16",
      "id": "98761",
      "original_text": "Löschungsankündigung\nSchleswig-Holstein Amtsgericht Flensburg HRA 8359\nGermania-Park GmbH & Co. KG – Sylt/OT Keitum",
      "type": "Löschungsankündigung",
      "state": "Schleswig-Holstein",
      "amtsgericht": "Amtsgericht Flensburg",
      "registernummer": "HRA 8359",
      "registerart": "HRA",
      "company_name": "Germania-Park GmbH & Co. KG",
      "company_seat": "Sylt/OT Keitum",
      "details": "16.01.2025 (Bekanntmachungsdatum)\n\nSchleswig-Holstein Amtsgericht Flensburg HRA 8359\nLöschungsankündigung\n\nGermania-Park GmbH & Co. KG\nKommanditgesellschaft\nSylt/OT Keitum\n\nEs ist beabsichtigt, die Firma gemäß § 31 Abs. 2 HGB von Amts wegen zu löschen. Widerspruchsfrist: 3 Monate."
    },
    {
      "date": "2025-01-16",
      "id": "98762",
      "original_text": "Löschungsankündigung\nThüringen Amtsgericht Jena HRB 206488\nKlinik Waldeshöhe GmbH – Uhlstädt-Kirchhasel",
      "type": "Löschungsankündigung",
      "state": "Thüringen",
      "amtsgericht": "Amtsgericht Jena",
      "registernummer": "HRB 206488",
      "registerart": "HRB",
      "company_name": "Klinik Waldeshöhe GmbH",
      "company_seat": "Uhlstädt-Kirchhasel",
      "details": "16.01.2025 (Bekanntmachungsdatum)\n\nThüringen Amtsgericht Jena HRB 206488\nLöschungsankündigung\n\nKlinik Waldeshöhe GmbH\nGesellschaft mit beschränkter Haftung\nUhlstädt-Kirchhasel\n\nDas Registergericht beabsichtigt, die im Handelsregister eingetragene Gesellschaft wegen Vermögenslosigkeit nach § 394 FamFG von Amts wegen zu löschen. Die Frist zur Erhebung eines Widerspruchs gegen die beabsichtigte Löschung wird auf 6 Wochen festgesetzt."
    },
    {
      "date": "2025-01-16",
      "id": "98763",
      "original_text": "Sonstige Registerbekanntmachung\nThüringen Amtsgericht Jena HRB 506966\nQSIL GmbH Quarzschmelze Ilmenau – Ilmenau",
      "type": "Sonstige Registerbekanntmachung",
      "state": "Thüringen",
      "amtsgericht": "Amtsgericht Jena",
      "registernummer": "HRB 506966",
      "registerart": "HRB",
      "company_name": "QSIL GmbH Quarzschmelze Ilmenau",
      "company_seat": "Ilmenau",
      "details": "16.01.2025 (Bekanntmachungsdatum)\n\nThüringen Amtsgericht Jena HRB 506966\nSonstige Registerbekanntmachung 16.01.2025 (Eintragungsdatum)\n\nQSIL GmbH Quarzschmelze Ilmenau\nGesellschaft mit beschränkter Haftung\nIlmenau\n\nNicht eingetragen: Den Gläubigern der Gesellschaft, deren Forderungen begründet worden sind, bevor die Eintragung der Beendigung des Vertrages in das Handelsregister nach § 10 des Handelsgesetzbuches als bekanntgemacht gilt, hat der andere Vertragsteil Sicherheit zu leisten, wenn sie sich binnen sechs Monaten nach der Bekanntmachung der Eintragung zu diesem Zweck bei ihm melden."
    },
    {
      "date": "2025-01-16",
      "id": "98764",
      "original_text": "Löschungsankündigung\nSaarland Amtsgericht Saarbrücken HRB 17512\nStuiber Schokoladen GmbH – St. Ingbert",
      "type": "Löschungsankündigung",
      "state": "Saarland",
      "amtsgericht": "Amtsgericht Saarbrücken",
      "registernummer": "HRB 17512",
      "registerart": "HRB",
      "company_name": "Stuiber Schokoladen GmbH",
      "company_seat": "St. Ingbert",
      "details": "16.01.2025 (Bekanntmachungsdatum)\n\nSaarland Amtsgericht Saarbrücken HRB 17512\nLöschungsankündigung\n\nStuiber Schokoladen GmbH\nGesellschaft mit beschränkter Haftung\nSt. Ingbert\n\nEs ist beabsichtigt, die Gesellschaft von Amts wegen gemäß § 394 FamFG wegen Vermögenslosigkeit zu löschen.\nGegen die Löschung von Amts wegen ist das Rechtsmittel des Widerspruchs statthaft. Der Widerspruch ist binnen einer Frist drei Monaten beginnend mit dem Tag dieser Veröffentlichung durch Einreichen eines Widerspruchsschreibens -schriftlich oder zur Niederschrift der Geschäftsstelle beim Amtsgericht Saarbrücken, -zentrales Handelsregister-, Mainzer Str.178, 66121 Saarbrücken einzulegen.\nDer Widerspruch muss die Bezeichnung der angefochtenen Löschungsankündigung enthalten sowie die Erklärung, dass Widerspruch eingelegt wird. Er ist vom Widerspruchsführer oder seinem Bevollmächtigten zu unterzeichnen.\nDas Widerspruchsschreiben kann auch in der Form eines elektronischen Dokumentes eingereicht werden, das mit einer qualifizierten elektronischen Signatur nach dem Signaturgesetz versehen sein muss (§§ 14 Abs. 2 FamFG, 130a, 298 ZPO)."
    },
    {
      "date": "2025-01-16",
      "id": "98765",
      "original_text": "Registerbekanntmachung nach dem Umwandlungsgesetz\nSchleswig-Holstein Amtsgericht Flensburg HRA 1546 HU\nWilhelm Henkens GmbH & Co. KG – Husum",
      "type": "Registerbekanntmachung nach dem Umwandlungsgesetz",
      "state": "Schleswig-Holstein",
      "amtsgericht": "Amtsgericht Flensburg",
      "registernummer": "HRA 1546 HU",
      "registerart": "HRA",
      "company_name": "Wilhelm Henkens GmbH & Co. KG",
      "company_seat": "Husum",
      "details": "16.01.2025 (Bekanntmachungsdatum)\n\nSchleswig-Holstein Amtsgericht Flensburg HRA 1546 HU\nRegisterbekanntmachung nach dem Umwandlungsgesetz 14.01.2025 (Eintragungsdatum)\n\nWilhelm Henkens GmbH & Co. KG\nKommanditgesellschaft\nHusum\n\nZu Eintragungsnummer 3 vom 14.01.2025 wird als nicht eingetragen veröffentlicht: Den Gläubigern ist, wenn sie binnen sechs Monaten nach dem Tag, an dem die Eintragung der Umwandlung als bekannt gemacht gilt, ihren Anspruch nach Grund und Höhe schriftlich anmelden, Sicherheit zu leisten, soweit sie nicht Befriedigung verlangen können. Dieses Recht steht den Gläubigern jedoch nur zu, wenn sie glaubhaft machen, dass durch die Umwandlung die Erfüllung ihrer Forderung gefährdet wird."
    },
    {
      "date": "2025-01-16",
      "id": "98766",
      "original_text": "Einreichung neuer Dokumente\nBerlin Amtsgericht Berlin (Charlottenburg) HRB 106191\nKPMG AG Wirtschaftsprüfungsgesellschaft – Berlin",
      "type": "Einreichung neuer Dokumente",
      "state": "Berlin",
      "amtsgericht": "Amtsgericht Berlin (Charlottenburg)",
      "registernummer": "HRB 106191",
      "registerart": "HRB",
      "company_name": "KPMG AG Wirtschaftsprüfungsgesellschaft",
      "company_seat": "Berlin",
      "details": "16.01.2025 (Bekanntmachungsdatum)\n\nBerlin Amtsgericht Berlin (Charlottenburg) HRB 106191\nEinreichung neuer Dokumente\n\nKPMG AG Wirtschaftsprüfungsgesellschaft\nAktiengesellschaft\nBerlin\n\nAls nicht eingetragen wird veröffentlicht:Es wurde eine neue Liste der Aufsichtsratsmitglieder eingereicht (§ 106 AktG)."
    },
    {
      "date": "2025-01-16",
      "id": "98767",
      "original_text": "Löschungsankündigung\nBerlin Amtsgericht Berlin (Charlottenburg) HRB 134261\nM.E.G.A. Stars - Music & Show Betriebsgesellschaft Nr. 1 GmbH – Berlin",
      "type": "Löschungsankündigung",
      "state": "Berlin",
      "amtsgericht": "Amtsgericht Berlin (Charlottenburg)",
      "registernummer": "HRB 134261",
      "registerart": "HRB",
      "company_name": "M.E.G.A. Stars - Music & Show Betriebsgesellschaft Nr. 1 GmbH",
      "company_seat": "Berlin",
      "details": "16.01.2025 (Bekanntmachungsdatum)\n\nBerlin Amtsgericht Berlin (Charlottenburg) HRB 134261\nLöschungsankündigung\n\nM.E.G.A. Stars - Music & Show Betriebsgesellschaft Nr. 1 GmbH\nGesellschaft mit beschränkter Haftung\nBerlin\n\nBei der nachstehenden Gesellschaft wird das Amtslöschungsverfahren gemäß § 394 FamFG eingeleitet. Widerspruchsfrist 6 Wochen"
    },
    {
      "date": "2025-01-16",
      "id": "98768",
      "original_text": "Einreichung neuer Dokumente\nBaden-Württemberg Amtsgericht Stuttgart HRB 778600\nDaimler Truck Holding AG – Stuttgart",
      "type": "Einreichung neuer Dokumente",
      "state": "Baden-Württemberg",
      "amtsgericht": "Amtsgericht Stuttgart",
      "registernummer": "HRB 778600",
      "registerart": "HRB",
      "company_name": "Daimler Truck Holding AG",
      "company_seat": "Stuttgart",
      "details": "16.01.2025 (Bekanntmachungsdatum)\n\nBaden-Württemberg Amtsgericht Stuttgart HRB 778600\nEinreichung neuer Dokumente 16.01.2025 (Eintragungsdatum)\n\nDaimler Truck Holding AG\nAktiengesellschaft\nStuttgart\n\nDie Gesellschaft hat am 15.01.2025 die Liste über die Zusammensetzung des Aufsichtsrats zum Handelsregister eingereicht."
    },
    {
      "date": "2025-01-16",
      "id": "98769",
      "original_text": "Löschungsankündigung\nBaden-Württemberg Amtsgericht Mannheim HRB 724112\nCasa Nostra Immobilienservice UG (haftungsbeschränkt) – Karlsruhe",
      "type": "Löschungsankündigung",
      "state": "Baden-Württemberg",
      "amtsgericht": "Amtsgericht Mannheim",
      "registernummer": "HRB 724112",
      "registerart": "HRB",
      "company_name": "Casa Nostra Immobilienservice UG (haftungsbeschränkt)",
      "company_seat": "Karlsruhe",
      "details": "16.01.2025 (Bekanntmachungsdatum)\n\nBaden-Württemberg Amtsgericht Mannheim HRB 724112\nLöschungsankündigung\n\nCasa Nostra Immobilienservice UG (haftungsbeschränkt)\nGesellschaft mit beschränkter Haftung\nKarlsruhe\n\nDas Gericht beabsichtigt, die Gesellschaft wegen Vermögenslosigkeit im Handelsregister von Amts wegen nach § 394 FamFG zu löschen. Die Frist zur Geltendmachung eines Widerspruchs gegen die beabsichtigte Löschung ist auf einen Monat ab Veröffentlichung bestimmt."
    },
    {
      "date": "2025-01-16",
      "id": "98770",
      "original_text": "Einreichung neuer Dokumente\nBaden-Württemberg Amtsgericht Stuttgart HRB 411197\nTheben AG – Haigerloch",
      "type": "Einreichung neuer Dokumente",
      "state": "Baden-Württemberg",
      "amtsgericht": "Amtsgericht Stuttgart",
      "registernummer": "HRB 411197",
      "registerart": "HRB",
      "company_name": "Theben AG",
      "company_seat": "Haigerloch",
      "details": "16.01.2025 (Bekanntmachungsdatum)\n\nBaden-Württemberg Amtsgericht Stuttgart HRB 411197\nEinreichung neuer Dokumente\n\nTheben AG\nAktiengesellschaft\nHaigerloch\n\nDie Gesellschaft hat am 20.12.2024 die Liste über die Zusammensetzung des Aufsichtsrats zum Handelsregister eingereicht."
    },
    {
      "date": "2025-01-16",
      "id": "98771",
      "original_text": "Einreichung neuer Dokumente\nBaden-Württemberg Amtsgericht Stuttgart HRB 723309\nFichtner Management Consulting Aktiengesellschaft – Stuttgart",
      "type": "Einreichung neuer Dokumente",
      "state": "Baden-Württemberg",
      "amtsgericht": "Amtsgericht Stuttgart",
      "registernummer": "HRB 723309",
      "registerart": "HRB",
      "company_name": "Fichtner Management Consulting Aktiengesellschaft",
      "company_seat": "Stuttgart",
      "details": "16.01.2025 (Bekanntmachungsdatum)\n\nBaden-Württemberg Amtsgericht Stuttgart HRB 723309\nEinreichung neuer Dokumente\n\nFichtner Management Consulting Aktiengesellschaft\nAktiengesellschaft\nStuttgart\n\nDie Gesellschaft hat am 16.01.2025 die Liste über die Zusammensetzung des Aufsichtsrats zum Handelsregister eingereicht."
    },
    {
      "date": "2025-01-16",
      "id": "98772",
      "original_text": "Löschungsankündigung\nSchleswig-Holstein Amtsgericht Kiel HRA 11758\nPflegedienst Ozean GmbH & Co. KG – Norderstedt",
      "type": "Löschungsankündigung",
      "state": "Schleswig-Holstein",
      "amtsgericht": "Amtsgericht Kiel",
      "registernummer": "HRA 11758",
      "registerart": "HRA",
      "company_name": "Pflegedienst Ozean GmbH & Co. KG",
      "company_seat": "Norderstedt",
      "details": "16.01.2025 (Bekanntmachungsdatum)\n\nSchleswig-Holstein Amtsgericht Kiel HRA 11758\nLöschungsankündigung\n\nPflegedienst Ozean GmbH & Co. KG\nKommanditgesellschaft\nNorderstedt\n\nBei der nachstehenden Firma wird das Amtslöschungsverfahren gemäß § 31 Abs. 2 HGB eingeleitet. Widerspruchsfrist: 2 Monate."
    },
    {
      "date": "2025-01-16",
      "id": "98773",
      "original_text": "Einreichung neuer Dokumente\nBaden-Württemberg Amtsgericht Stuttgart HRB 762884\nDaimler Truck AG – Stuttgart",
      "type": "Einreichung neuer Dokumente",
      "state": "Baden-Württemberg",
      "amtsgericht": "Amtsgericht Stuttgart",
      "registernummer": "HRB 762884",
      "registerart": "HRB",
      "company_name": "Daimler Truck AG",
      "company_seat": "Stuttgart",
      "details": "16.01.2025 (Bekanntmachungsdatum)\n\nBaden-Württemberg Amtsgericht Stuttgart HRB 762884\nEinreichung neuer Dokumente 16.01.2025 (Eintragungsdatum)\n\nDaimler Truck AG\nAktiengesellschaft\nStuttgart\n\nDie Gesellschaft hat am 15.01.2025 die Liste über die Zusammensetzung des Aufsichtsrats zum Handelsregister eingereicht."
    },
    {
      "date": "2025-01-16",
      "id": "98774",
      "original_text": "Einreichung neuer Dokumente\nBaden-Württemberg Amtsgericht Stuttgart HRB 750996\nArthro Kinetics AG – Tübingen",
      "type": "Einreichung neuer Dokumente",
      "state": "Baden-Württemberg",
      "amtsgericht": "Amtsgericht Stuttgart",
      "registernummer": "HRB 750996",
      "registerart": "HRB",
      "company_name": "Arthro Kinetics AG",
      "company_seat": "Tübingen",
      "details": "16.01.2025 (Bekanntmachungsdatum)\n\nBaden-Württemberg Amtsgericht Stuttgart HRB 750996\nEinreichung neuer Dokumente\n\nArthro Kinetics AG\nAktiengesellschaft\nTübingen\n\nDie Gesellschaft hat am 13.01.2025 die Liste über die Zusammensetzung des Aufsichtsrats zum Handelsregister eingereicht."
    },
    {
      "date": "2025-01-16",
      "id": "98775",
      "original_text": "Löschungsankündigung\nBaden-Württemberg Amtsgericht Freiburg HRB 711046\nBest Sales Akademie UG (haftungsbeschränkt) – Endingen am Kaiserstuhl",
      "type": "Löschungsankündigung",
      "state": "Baden-Württemberg",
      "amtsgericht": "Amtsgericht Freiburg",
      "registernummer": "HRB 711046",
      "registerart": "HRB",
      "company_name": "Best Sales Akademie UG (haftungsbeschränkt)",
      "company_seat": "Endingen am Kaiserstuhl",
      "details": "16.01.2025 (Bekanntmachungsdatum)\n\nBaden-Württemberg Amtsgericht Freiburg HRB 711046\nLöschungsankündigung 16.01.2025 (Eintragungsdatum)\n\nBest Sales Akademie UG (haftungsbeschränkt)\nGesellschaft mit beschränkter Haftung\nEndingen am Kaiserstuhl\n\nAls nicht eingetragen wird bekanntgemacht:\nDas Gericht beabsichtigt, die Gesellschaft wegen Vermögenslosigkeit im Handelsregister von Amts wegen nach § 394 FamFG zu löschen. Die Frist zur Geltendmachung eines Widerspruchs gegen die beabsichtigte Löschung ist auf einen Monat ab Veröffentlichung bestimmt."
    },
    {
      "date": "2025-01-16",
      "id": "98776",
      "original_text": "Einreichung neuer Dokumente\nBaden-Württemberg Amtsgericht Stuttgart HRB 17102\nNVBW - Nahverkehrsgesellschaft Baden-Württemberg mbH – Stuttgart",
      "type": "Einreichung neuer Dokumente",
      "state": "Baden-Württemberg",
      "amtsgericht": "Amtsgericht Stuttgart",
      "registernummer": "HRB 17102",
      "registerart": "HRB",
      "company_name": "NVBW - Nahverkehrsgesellschaft Baden-Württemberg mbH",
      "company_seat": "Stuttgart",
      "details": "16.01.2025 (Bekanntmachungsdatum)\n\nBaden-Württemberg Amtsgericht Stuttgart HRB 17102\nEinreichung neuer Dokumente\n\nNVBW - Nahverkehrsgesellschaft Baden-Württemberg mbH\nGesellschaft mit beschränkter Haftung\nStuttgart\n\nDie Gesellschaft hat am 16.01.2025 die Liste über die Zusammensetzung des Aufsichtsrats zum Handelsregister eingereicht."
    },
    {
      "date": "2025-01-16",
      "id": "98777",
      "original_text": "Einreichung neuer Dokumente\nMecklenburg-Vorpommern Amtsgericht Stralsund HRB 8355\nSWS Natur GmbH – Stralsund",
      "type": "Einreichung neuer Dokumente",
      "state": "Mecklenburg-Vorpommern",
      "amtsgericht": "Amtsgericht Stralsund",
      "registernummer": "HRB 8355",
      "registerart": "HRB",
      "company_name": "SWS Natur GmbH",
      "company_seat": "Stralsund",
      "details": "16.01.2025 (Bekanntmachungsdatum)\n\nMecklenburg-Vorpommern Amtsgericht Stralsund HRB 8355\nEinreichung neuer Dokumente\n\nSWS Natur GmbH\nGesellschaft mit beschränkter Haftung\nStralsund\n\nEine Liste der Mitglieder des Aufsichtsrats ist zum Handelsregister eingereicht worden."
    },
    {
      "date": "2025-01-16",
      "id": "98778",
      "original_text": "Löschungsankündigung\nSchleswig-Holstein Amtsgericht Kiel HRA 9348\nAdolf C.C. Rüegg (GmbH & Co. KG) – Norderstedt",
      "type": "Löschungsankündigung",
      "state": "Schleswig-Holstein",
      "amtsgericht": "Amtsgericht Kiel",
      "registernummer": "HRA 9348",
      "registerart": "HRA",
      "company_name": "Adolf C.C. Rüegg (GmbH & Co. KG)",
      "company_seat": "Norderstedt",
      "details": "16.01.2025 (Bekanntmachungsdatum)\n\nSchleswig-Holstein Amtsgericht Kiel HRA 9348\nLöschungsankündigung\n\nAdolf C.C. Rüegg (GmbH & Co. KG)\nKommanditgesellschaft\nNorderstedt\n\nBei der nachstehenden Firma wird das Amtslöschungsverfahren gemäß § 31 Abs. 2 HGB eingeleitet. Widerspruchsfrist: 2 Monate."
    },
    {
      "date": "2025-01-16",
      "id": "98779",
      "original_text": "Registerbekanntmachung nach dem Umwandlungsgesetz\nBaden-Württemberg Amtsgericht Stuttgart HRA 740746\nMichael Moll e.K. – Leinfelden-Echterdingen",
      "type": "Registerbekanntmachung nach dem Umwandlungsgesetz",
      "state": "Baden-Württemberg",
      "amtsgericht": "Amtsgericht Stuttgart",
      "registernummer": "HRA 740746",
      "registerart": "HRA",
      "company_name": "Michael Moll e.K.",
      "company_seat": "Leinfelden-Echterdingen",
      "details": "16.01.2025 (Bekanntmachungsdatum)\n\nBaden-Württemberg Amtsgericht Stuttgart HRA 740746\nRegisterbekanntmachung nach dem Umwandlungsgesetz 16.01.2025 (Eintragungsdatum)\n\nMichael Moll e.K.\nEinzelkaufmann / Einzelkauffrau\nLeinfelden-Echterdingen\n\nAls nicht eingetragen wird bekanntgemacht:\nDen Gläubigern der an der Ausgliederung beteiligten Rechtsträger ist, wenn sie binnen sechs Monaten nach dem Tag, an dem die Eintragung der Ausgliederung in das Register des Sitzes desjenigen Rechtsträgers, dessen Gläubiger sie sind, nach § 19 Abs. 3 UmwG als bekanntgemacht gilt, ihren Anspruch nach Grund und Höhe schriftlich anmelden, Sicherheit zu leisten, soweit sie nicht Befriedigung verlangen können. Dieses Recht steht den Gläubigern jedoch nur zu, wenn sie glaubhaft machen, dass durch die Ausgliederung die Erfüllung ihrer Forderung gefährdet wird."
    },
    {
      "date": "2025-01-16",
      "id": "98780",
      "original_text": "Löschungsankündigung\nSachsen Amtsgericht Chemnitz HRB 28266\nSaxwatt UG (haftungsbeschränkt) – Hartmannsdorf",
      "type": "Löschungsankündigung",
      "state": "Sachsen",
      "amtsgericht": "Amtsgericht Chemnitz",
      "registernummer": "HRB 28266",
      "registerart": "HRB",
      "company_name": "Saxwatt UG (haftungsbeschränkt)",
      "company_seat": "Hartmannsdorf",
      "details": "16.01.2025 (Bekanntmachungsdatum)\n\nSachsen Amtsgericht Chemnitz HRB 28266\nLöschungsankündigung 16.01.2025 (Eintragungsdatum)\n\nSaxwatt UG (haftungsbeschränkt)\nGesellschaft mit beschränkter Haftung\nHartmannsdorf\n\nDas Registergericht beabsichtigt, die im Handelsregister eingetragene Gesellschaft von Amts wegen nach § 394 FamFG zu löschen. Die Frist zu Erhebung eines Widerspruchs gegen die beabsichtigte Löschung wird auf einen Monat festgesetzt."
    },
    {
      "date": "2025-01-16",
      "id": "98781",
      "original_text": "Einreichung neuer Dokumente\nSachsen Amtsgericht Dresden HRB 8144\nWohnungsbau- und Wärmeversorgungsgesellschaft Neustadt i. Sa. mbH - WWGN - – Neustadt",
      "type": "Einreichung neuer Dokumente",
      "state": "Sachsen",
      "amtsgericht": "Amtsgericht Dresden",
      "registernummer": "HRB 8144",
      "registerart": "HRB",
      "company_name": "Wohnungsbau- und Wärmeversorgungsgesellschaft Neustadt i. Sa. mbH - WWGN -",
      "company_seat": "Neustadt",
      "details": "16.01.2025 (Bekanntmachungsdatum)\n\nSachsen Amtsgericht Dresden HRB 8144\nEinreichung neuer Dokumente\n\nWohnungsbau- und Wärmeversorgungsgesellschaft Neustadt i. Sa. mbH   - WWGN -\nGesellschaft mit beschränkter Haftung\nNeustadt\n\nAm 10.01.2025 wurde beim Handelsregister des Amtsgerichts Dresden die Liste der Mitglieder des Aufsichtsrats gemäß § 52 GmbHG eingereicht."
    },
    {
      "date": "2025-01-16",
      "id": "98782",
      "original_text": "Einreichung neuer Dokumente\nSachsen Amtsgericht Chemnitz HRB 16389\nTechnologie Centrum Chemnitz GmbH – Chemnitz",
      "type": "Einreichung neuer Dokumente",
      "state": "Sachsen",
      "amtsgericht": "Amtsgericht Chemnitz",
      "registernummer": "HRB 16389",
      "registerart": "HRB",
      "company_name": "Technologie Centrum Chemnitz GmbH",
      "company_seat": "Chemnitz",
      "details": "16.01.2025 (Bekanntmachungsdatum)\n\nSachsen Amtsgericht Chemnitz HRB 16389\nEinreichung neuer Dokumente\n\nTechnologie Centrum Chemnitz GmbH\nGesellschaft mit beschränkter Haftung\nChemnitz\n\nAm 15.01.2025 wurde beim Handelsregister des Amtsgerichts Chemnitz die Liste der Mitglieder des Aufsichtsrats gemäß § 52 GmbHG eingereicht."
    },
    {
      "date": "2025-01-16",
      "id": "98783",
      "original_text": "Einreichung neuer Dokumente\nSachsen Amtsgericht Dresden HRB 11743\nMesse Dresden GmbH – Dresden",
      "type": "Einreichung neuer Dokumente",
      "state": "Sachsen",
      "amtsgericht": "Amtsgericht Dresden",
      "registernummer": "HRB 11743",
      "registerart": "HRB",
      "company_name": "Messe Dresden GmbH",
      "company_seat": "Dresden",
      "details": "16.01.2025 (Bekanntmachungsdatum)\n\nSachsen Amtsgericht Dresden HRB 11743\nEinreichung neuer Dokumente\n\nMesse Dresden GmbH\nGesellschaft mit beschränkter Haftung\nDresden\n\nAm 10.01.2025 wurde beim Handelsregister des Amtsgerichts Dresden die Liste der Mitglieder des Aufsichtsrats gemäß § 52 GmbHG eingereicht."
    },
    {
      "date": "2025-01-16",
      "id": "98784",
      "original_text": "Einreichung neuer Dokumente\nSachsen Amtsgericht Dresden HRB 8432\nStadtwerke Pirna Energie GmbH – Pirna",
      "type": "Einreichung neuer Dokumente",
      "state": "Sachsen",
      "amtsgericht": "Amtsgericht Dresden",
      "registernummer": "HRB 8432",
      "registerart": "HRB",
      "company_name": "Stadtwerke Pirna Energie GmbH",
      "company_seat": "Pirna",
      "details": "16.01.2025 (Bekanntmachungsdatum)\n\nSachsen Amtsgericht Dresden HRB 8432\nEinreichung neuer Dokumente\n\nStadtwerke Pirna Energie GmbH\nGesellschaft mit beschränkter Haftung\nPirna\n\nAm 14.01.2025 wurde beim Handelsregister des Amtsgerichts Dresden die Liste der Mitglieder des Aufsichtsrats gemäß § 52 GmbHG eingereicht."
    },
    {
      "date": "2025-01-16",
      "id": "98785",
      "original_text": "Löschungsankündigung\nNiedersachsen Amtsgericht Aurich HRA 110999 früher Amtsgericht Leer (Ostfriesland) (Leer)\nReederei MS \"Global Hemera\" GmbH & Co. KG – Leer",
      "type": "Löschungsankündigung",
      "state": "Niedersachsen",
      "amtsgericht": "Amtsgericht Aurich",
      "registernummer": "HRA 110999",
      "registerart": "HRA",
      "company_name": "Reederei MS \"Global Hemera\" GmbH & Co. KG",
      "company_seat": "Leer",
      "former_amtsgericht": "Leer (Ostfriesland) (Leer)",
      "details": "16.01.2025 (Bekanntmachungsdatum)\n\nNiedersachsen Amtsgericht Aurich HRA 110999 früher Amtsgericht Leer (Ostfriesland) (Leer)\nLöschungsankündigung 16.01.2025 (Eintragungsdatum)\n\nReederei MS \"Global Hemera\" GmbH & Co. KG\nKommanditgesellschaft\nLeer\n\nDas Registergericht beabsichtigt, die Firma von Amts wegen nach § 394 FamFG zu löschen. Die Frist zur Erhebung eines Widerspruchs ist auf 1 Monat ab dieser Registerbekanntmachung festgesetzt."
    },
    {
      "date": "2025-01-16",
      "id": "98786",
      "original_text": "Sonstige Registerbekanntmachung\nNiedersachsen Amtsgericht Osnabrück HRB 1201\nStadtwerke Osnabrück Aktiengesellschaft – Osnabrück",
      "type": "Sonstige Registerbekanntmachung",
      "state": "Niedersachsen",
      "amtsgericht": "Amtsgericht Osnabrück",
      "registernummer": "HRB 1201",
      "registerart": "HRB",
      "company_name": "Stadtwerke Osnabrück Aktiengesellschaft",
      "company_seat": "Osnabrück",
      "details": "16.01.2025 (Bekanntmachungsdatum)\n\nNiedersachsen Amtsgericht Osnabrück HRB 1201\nSonstige Registerbekanntmachung 16.01.2025 (Eintragungsdatum)\n\nStadtwerke Osnabrück Aktiengesellschaft\nAktiengesellschaft\nOsnabrück\n\nDen Gläubigern der Gesellschaft, deren Forderungen begründet worden sind, bevor die Eintragung der Beendigung des Vertrages in das Handelsregister nach § 10 HGB als bekanntgemacht gilt, ist vom anderen Vertragsteil Sicherheit zu leisten, wenn sie sich binnen sechs Monaten nach der Bekanntmachung zu diesem Zweck bei ihm melden."
    },
    {
      "date": "2025-01-16",
      "id": "98787",
      "original_text": "Löschungsankündigung\nNiedersachsen Amtsgericht Hannover HRB 203982\nFLEXTRA-Logistic GmbH – Gehrden",
      "type": "Löschungsankündigung",
      "state": "Niedersachsen",
      "amtsgericht": "Amtsgericht Hannover",
      "registernummer": "HRB 203982",
      "registerart": "HRB",
      "company_name": "FLEXTRA-Logistic GmbH",
      "company_seat": "Gehrden",
      "details": "16.01.2025 (Bekanntmachungsdatum)\n\nNiedersachsen Amtsgericht Hannover HRB 203982\nLöschungsankündigung\n\nFLEXTRA-Logistic GmbH\nGesellschaft mit beschränkter Haftung\nGehrden\n\nDas Registergericht beabsichtigt, die Gesellschaft von Amts wegen nach § 394 FamFG zu löschen. Die Frist zur Erhebung eines Widerspruchs ist auf 1 Monat ab dieser Registerbekanntmachung festgesetzt."
    },
    {
      "date": "2025-01-16",
      "id": "98788",
      "original_text": "Registerbekanntmachung nach dem Umwandlungsgesetz\nNiedersachsen Amtsgericht Braunschweig HRB 211239\nHarz Hotel Waldhaus UG (haftungsbeschränkt) – Goslar",
      "type": "Registerbekanntmachung nach dem Umwandlungsgesetz",
      "state": "Niedersachsen",
      "amtsgericht": "Amtsgericht Braunschweig",
      "registernummer": "HRB 211239",
      "registerart": "HRB",
      "company_name": "Harz Hotel Waldhaus UG (haftungsbeschränkt)",
      "company_seat": "Goslar",
      "details": "16.01.2025 (Bekanntmachungsdatum)\n\nNiedersachsen Amtsgericht Braunschweig HRB 211239\nRegisterbekanntmachung nach dem Umwandlungsgesetz 16.01.2025 (Eintragungsdatum)\n\nHarz Hotel Waldhaus UG (haftungsbeschränkt)\nGesellschaft mit beschränkter Haftung\nGoslar\n\nDen Gläubigern der an der Verschmelzung beteiligten Rechtsträger ist, wenn sie binnen sechs Monaten nach dem Tag, an dem die Eintragung der Verschmelzung in das Register des Sitzes desjenigen Rechtsträgers, dessen Gläubiger sie sind, nach § 19  Abs.  3 UmwG als bekannt gemacht gilt, ihren Anspruch nach Grund und Höhe schriftlich anmelden, Sicherheit zu leisten, soweit sie nicht Befriedigung verlangen können. Dieses Recht steht den Gläubigern jedoch nur zu, wenn sie glaubhaft machen, dass durch die Verschmelzung die Erfüllung der Forderung gefährdet wird."
    },
    {
      "date": "2025-01-16",
      "id": "98789",
      "original_text": "Einreichung neuer Dokumente\nNiedersachsen Amtsgericht Hildesheim HRB 110401 früher Amtsgericht Alfeld\nStiebel Eltron Geschäftsführungsgesellschaft mit beschränkter Haftung – Holzminden",
      "type": "Einreichung neuer Dokumente",
      "state": "Niedersachsen",
      "amtsgericht": "Amtsgericht Hildesheim",
      "registernummer": "HRB 110401",
      "registerart": "HRB",
      "company_name": "Stiebel Eltron Geschäftsführungsgesellschaft mit beschränkter Haftung",
      "company_seat": "Holzminden",
      "former_amtsgericht": "Alfeld",
      "details": "16.01.2025 (Bekanntmachungsdatum)\n\nNiedersachsen Amtsgericht Hildesheim HRB 110401 früher Amtsgericht Alfeld\nEinreichung neuer Dokumente\n\nStiebel Eltron Geschäftsführungsgesellschaft mit beschränkter Haftung\nGesellschaft mit beschränkter Haftung\nHolzminden\n\nDie Liste der Mitglieder des Aufsichtsrats wurde beim Registergericht eingereicht."
    },
    {
      "date": "2025-01-16",
      "id": "98790",
      "original_text": "Registerbekanntmachung nach dem Umwandlungsgesetz\nNiedersachsen Amtsgericht Göttingen HRA 202341\nKrüger Immobilien Beteiligungs GmbH & Co. KG – Göttingen",
      "type": "Registerbekanntmachung nach dem Umwandlungsgesetz",
      "state": "Niedersachsen",
      "amtsgericht": "Amtsgericht Göttingen",
      "registernummer": "HRA 202341",
      "registerart": "HRA",
      "company_name": "Krüger Immobilien Beteiligungs GmbH & Co. KG",
      "company_seat": "Göttingen",
      "details": "16.01.2025 (Bekanntmachungsdatum)\n\nNiedersachsen Amtsgericht Göttingen HRA 202341\nRegisterbekanntmachung nach dem Umwandlungsgesetz 16.01.2025 (Eintragungsdatum)\n\nKrüger Immobilien Beteiligungs GmbH & Co. KG\nKommanditgesellschaft\nGöttingen\n\nDen Gläubigern der an der Ausgliederung beteiligten Rechtsträger ist, wenn sie binnen sechs Monaten nach dem Tag, an dem die Eintragung der Ausgliederung in das Register des Sitzes desjenigen Rechtsträgers, dessen Gläubiger sie sind, nach § 19 Abs. 3 UmwG als bekannt gemacht gilt, ihren Anspruch nach Grund und Höhe schriftlich anmelden, Sicherheit zu leisten, soweit sie nicht Befriedigung verlangen können. Dieses Recht steht den Gläubigern jedoch nur zu, wenn sie glaubhaft machen, dass durch die Ausgliederung die Erfüllung der Forderung gefährdet wird."
    },
    {
      "date": "2025-01-16",
      "id": "98791",
      "original_text": "Registerbekanntmachung nach dem Umwandlungsgesetz\nNiedersachsen Amtsgericht Göttingen HRA 202191\nAndreas Krüger e. K. – Göttingen",
      "type": "Registerbekanntmachung nach dem Umwandlungsgesetz",
      "state": "Niedersachsen",
      "amtsgericht": "Amtsgericht Göttingen",
      "registernummer": "HRA 202191",
      "registerart": "HRA",
      "company_name": "Andreas Krüger e. K.",
      "company_seat": "Göttingen",
      "details": "16.01.2025 (Bekanntmachungsdatum)\n\nNiedersachsen Amtsgericht Göttingen HRA 202191\nRegisterbekanntmachung nach dem Umwandlungsgesetz 16.01.2025 (Eintragungsdatum)\n\nAndreas Krüger e. K.\nEinzelkaufmann / Einzelkauffrau\nGöttingen\n\nDen Gläubigern der an der Ausgliederung beteiligten Rechtsträger ist, wenn sie binnen sechs Monaten nach dem Tag, an dem die Eintragung der Ausgliederung in das Register des Sitzes desjenigen Rechtsträgers, dessen Gläubiger sie sind, nach § 19 Abs. 3 UmwG als bekannt gemacht gilt, ihren Anspruch nach Grund und Höhe schriftlich anmelden, Sicherheit zu leisten, soweit sie nicht Befriedigung verlangen können. Dieses Recht steht den Gläubigern jedoch nur zu, wenn sie glaubhaft machen, dass durch die Ausgliederung die Erfüllung der Forderung gefährdet wird."
    },
    {
      "date": "2025-01-16",
      "id": "98792",
      "original_text": "Registerbekanntmachung nach dem Umwandlungsgesetz\nNiedersachsen Amtsgericht Braunschweig HRB 211237\nHarz Restaurant Waldhaus UG (haftungsbeschränkt) – Goslar",
      "type": "Registerbekanntmachung nach dem Umwandlungsgesetz",
      "state": "Niedersachsen",
      "amtsgericht": "Amtsgericht Braunschweig",
      "registernummer": "HRB 211237",
      "registerart": "HRB",
      "company_name": "Harz Restaurant Waldhaus UG (haftungsbeschränkt)",
      "company_seat": "Goslar",
      "details": "16.01.2025 (Bekanntmachungsdatum)\n\nNiedersachsen Amtsgericht Braunschweig HRB 211237\nRegisterbekanntmachung nach dem Umwandlungsgesetz 16.01.2025 (Eintragungsdatum)\n\nHarz Restaurant Waldhaus UG (haftungsbeschränkt)\nGesellschaft mit beschränkter Haftung\nGoslar\n\nDen Gläubigern der an der Verschmelzung beteiligten Rechtsträger ist, wenn sie binnen sechs Monaten nach dem Tag, an dem die Eintragung der Verschmelzung in das Register des Sitzes desjenigen Rechtsträgers, dessen Gläubiger sie sind, nach § 19  Abs.  3 UmwG als bekannt gemacht gilt, ihren Anspruch nach Grund und Höhe schriftlich anmelden, Sicherheit zu leisten, soweit sie nicht Befriedigung verlangen können. Dieses Recht steht den Gläubigern jedoch nur zu, wenn sie glaubhaft machen, dass durch die Verschmelzung die Erfüllung der Forderung gefährdet wird."
    },
    {
      "date": "2025-01-16",
      "id": "98793",
      "original_text": "Registerbekanntmachung nach dem Umwandlungsgesetz\nNiedersachsen Amtsgericht Braunschweig HRB 211203\nHarz Hotel Waldhaus GmbH – Goslar",
      "type": "Registerbekanntmachung nach dem Umwandlungsgesetz",
      "state": "Niedersachsen",
      "amtsgericht": "Amtsgericht Braunschweig",
      "registernummer": "HRB 211203",
      "registerart": "HRB",
      "company_name": "Harz Hotel Waldhaus GmbH",
      "company_seat": "Goslar",
      "details": "16.01.2025 (Bekanntmachungsdatum)\n\nNiedersachsen Amtsgericht Braunschweig HRB 211203\nRegisterbekanntmachung nach dem Umwandlungsgesetz 16.01.2025 (Eintragungsdatum)\n\nHarz Hotel Waldhaus GmbH\nGesellschaft mit beschränkter Haftung\nGoslar\n\nDen Gläubigern der an der Verschmelzung beteiligten Rechtsträger ist, wenn sie binnen sechs Monaten nach dem Tag, an dem die Eintragung der Verschmelzung in das Register des Sitzes desjenigen Rechtsträgers, dessen Gläubiger sie sind, nach § 19  Abs.  3 UmwG als bekannt gemacht gilt, ihren Anspruch nach Grund und Höhe schriftlich anmelden, Sicherheit zu leisten, soweit sie nicht Befriedigung verlangen können. Dieses Recht steht den Gläubigern jedoch nur zu, wenn sie glaubhaft machen, dass durch die Verschmelzung die Erfüllung der Forderung gefährdet wird."
    },
    {
      "date": "2025-01-16",
      "id": "98794",
      "original_text": "Registerbekanntmachung nach dem Umwandlungsgesetz\nNiedersachsen Amtsgericht Hannover HRB 100528 früher Amtsgericht Hameln\nPHOENIX CONTACT ELECTRONICS GmbH – Bad Pyrmont",
      "type": "Registerbekanntmachung nach dem Umwandlungsgesetz",
      "state": "Niedersachsen",
      "amtsgericht": "Amtsgericht Hannover",
      "registernummer": "HRB 100528",
      "registerart": "HRB",
      "company_name": "PHOENIX CONTACT ELECTRONICS GmbH",
      "company_seat": "Bad Pyrmont",
      "former_amtsgericht": "Hameln",
      "details": "16.01.2025 (Bekanntmachungsdatum)\n\nNiedersachsen Amtsgericht Hannover HRB 100528 früher Amtsgericht Hameln\nRegisterbekanntmachung nach dem Umwandlungsgesetz 16.01.2025 (Eintragungsdatum)\n\nPHOENIX CONTACT ELECTRONICS GmbH\nGesellschaft mit beschränkter Haftung\nBad Pyrmont\n\nDen Gläubigern der an der Verschmelzung beteiligten Rechtsträger ist, wenn sie binnen sechs Monaten nach dem Tag, an dem die Eintragung der Verschmelzung in das Register des Sitzes desjenigen Rechtsträgers, dessen Gläubiger sie sind, nach § 19  Abs.  3 UmwG als bekannt gemacht gilt, ihren Anspruch nach Grund und Höhe schriftlich anmelden, Sicherheit zu leisten, soweit sie nicht Befriedigung verlangen können. Dieses Recht steht den Gläubigern jedoch nur zu, wenn sie glaubhaft machen, dass durch die Verschmelzung die Erfüllung der Forderung gefährdet wird."
    },
    {
      "date": "2025-01-16",
      "id": "98795",
      "original_text": "Registerbekanntmachung nach dem Umwandlungsgesetz\nNiedersachsen Amtsgericht Braunschweig HRB 211203\nWaldhaus Technik & Verwaltung GmbH – Goslar",
      "type": "Registerbekanntmachung nach dem Umwandlungsgesetz",
      "state": "Niedersachsen",
      "amtsgericht": "Amtsgericht Braunschweig",
      "registernummer": "HRB 211203",
      "registerart": "HRB",
      "company_name": "Waldhaus Technik & Verwaltung GmbH",
      "company_seat": "Goslar",
      "details": "16.01.2025 (Bekanntmachungsdatum)\n\nNiedersachsen Amtsgericht Braunschweig HRB 211203\nRegisterbekanntmachung nach dem Umwandlungsgesetz 16.01.2025 (Eintragungsdatum)\n\nWaldhaus Technik & Verwaltung GmbH\nGesellschaft mit beschränkter Haftung\nGoslar\n\nDen Gläubigern der an der Verschmelzung beteiligten Rechtsträger ist, wenn sie binnen sechs Monaten nach dem Tag, an dem die Eintragung der Verschmelzung in das Register des Sitzes desjenigen Rechtsträgers, dessen Gläubiger sie sind, nach § 19  Abs.  3 UmwG als bekannt gemacht gilt, ihren Anspruch nach Grund und Höhe schriftlich anmelden, Sicherheit zu leisten, soweit sie nicht Befriedigung verlangen können. Dieses Recht steht den Gläubigern jedoch nur zu, wenn sie glaubhaft machen, dass durch die Verschmelzung die Erfüllung der Forderung gefährdet wird."
    },
    {
      "date": "2025-01-16",
      "id": "98796",
      "original_text": "Einreichung neuer Dokumente\nBaden-Württemberg Amtsgericht Freiburg HRB 725198\nSCHIESSER GmbH – Radolfzell am Bodensee",
      "type": "Einreichung neuer Dokumente",
      "state": "Baden-Württemberg",
      "amtsgericht": "Amtsgericht Freiburg",
      "registernummer": "HRB 725198",
      "registerart": "HRB",
      "company_name": "SCHIESSER GmbH",
      "company_seat": "Radolfzell am Bodensee",
      "details": "16.01.2025 (Bekanntmachungsdatum)\n\nBaden-Württemberg Amtsgericht Freiburg HRB 725198\nEinreichung neuer Dokumente\n\nSCHIESSER GmbH\nGesellschaft mit beschränkter Haftung\nRadolfzell am Bodensee\n\nDie Gesellschaft hat am 16.01.2025 die Liste über die Zusammensetzung des Aufsichtsrats zum Handelsregister eingereicht."
    },
    {
      "date": "2025-01-16",
      "id": "98797",
      "original_text": "Einreichung neuer Dokumente\nRheinland-Pfalz Amtsgericht Koblenz HRB 22187\nAhrtal-Werke GmbH – Bad Neuenahr-Ahrweiler",
      "type": "Einreichung neuer Dokumente",
      "state": "Rheinland-Pfalz",
      "amtsgericht": "Amtsgericht Koblenz",
      "registernummer": "HRB 22187",
      "registerart": "HRB",
      "company_name": "Ahrtal-Werke GmbH",
      "company_seat": "Bad Neuenahr-Ahrweiler",
      "details": "16.01.2025 (Bekanntmachungsdatum)\n\nRheinland-Pfalz Amtsgericht Koblenz HRB 22187\nEinreichung neuer Dokumente\n\nAhrtal-Werke GmbH\nGesellschaft mit beschränkter Haftung\nBad Neuenahr-Ahrweiler\n\nDem Registergericht ist eine neue Liste der Mitglieder des Aufsichtsrates eingereicht worden."
    },
    {
      "date": "2025-01-16",
      "id": "98798",
      "original_text": "Sonstige Registerbekanntmachung\nRheinland-Pfalz Amtsgericht Mainz HRB 10036\nEWR Aktiengesellschaft – Worms",
      "type": "Sonstige Registerbekanntmachung",
      "state": "Rheinland-Pfalz",
      "amtsgericht": "Amtsgericht Mainz",
      "registernummer": "HRB 10036",
      "registerart": "HRB",
      "company_name": "EWR Aktiengesellschaft",
      "company_seat": "Worms",
      "details": "16.01.2025 (Bekanntmachungsdatum)\n\nRheinland-Pfalz Amtsgericht Mainz HRB 10036\nSonstige Registerbekanntmachung\n\nEWR Aktiengesellschaft\nAktiengesellschaft\nWorms\n\nDem Registergericht ist eine geänderte Liste der Mitglieder des Aufsichtsrates eingereicht worden."
    },
    {
      "date": "2025-01-16",
      "id": "98799",
      "original_text": "Löschungsankündigung\nRheinland-Pfalz Amtsgericht Landau HRB 31313\nbuco spedition gmbh – Kandel",
      "type": "Löschungsankündigung",
      "state": "Rheinland-Pfalz",
      "amtsgericht": "Amtsgericht Landau",
      "registernummer": "HRB 31313",
      "registerart": "HRB",
      "company_name": "buco spedition gmbh",
      "company_seat": "Kandel",
      "details": "16.01.2025 (Bekanntmachungsdatum)\n\nRheinland-Pfalz Amtsgericht Landau HRB 31313\nLöschungsankündigung\n\nbuco spedition gmbh\nGesellschaft mit beschränkter Haftung\nKandel\n\nDas Registergericht beabsichtigt die Gesellschaft von Amts wegen nach § 394 FamFG zu löschen. Die Frist zur Erhebung eines Widerspruchs ist auf einen Monat festgesetzt."
    },
    {
      "date": "2025-01-16",
      "id": "98800",
      "original_text": "Einreichung neuer Dokumente\nNordrhein-Westfalen Amtsgericht Bonn HRB 29408\nDeutsche Bau- und Grundstücks-Aktiengesellschaft i.L. – Bonn",
      "type": "Einreichung neuer Dokumente",
      "state": "Nordrhein-Westfalen",
      "amtsgericht": "Amtsgericht Bonn",
      "registernummer": "HRB 29408",
      "registerart": "HRB",
      "company_name": "Deutsche Bau- und Grundstücks-Aktiengesellschaft i.L.",
      "company_seat": "Bonn",
      "details": "16.01.2025 (Bekanntmachungsdatum)\n\nNordrhein-Westfalen Amtsgericht Bonn HRB 29408\nEinreichung neuer Dokumente\n\nDeutsche Bau- und Grundstücks-Aktiengesellschaft i.L.\nAktiengesellschaft\nBonn\n\nDem Registergericht ist eine neue Liste der Mitglieder des Aufsichtsrates eingereicht worden."
    },
    {
      "date": "2025-01-16",
      "id": "98801",
      "original_text": "Löschungsankündigung\nNordrhein-Westfalen Amtsgericht Paderborn HRB 13945\nBDC Express Logistik GmbH – Paderborn",
      "type": "Löschungsankündigung",
      "state": "Nordrhein-Westfalen",
      "amtsgericht": "Amtsgericht Paderborn",
      "registernummer": "HRB 13945",
      "registerart": "HRB",
      "company_name": "BDC Express Logistik GmbH",
      "company_seat": "Paderborn",
      "details": "16.01.2025 (Bekanntmachungsdatum)\n\nNordrhein-Westfalen Amtsgericht Paderborn HRB 13945\nLöschungsankündigung 16.01.2025 (Eintragungsdatum)\n\nBDC Express Logistik GmbH\nGesellschaft mit beschränkter Haftung\nPaderborn\n\nDas Registergericht beabsichtigt die Gesellschaft von Amts wegen nach § 394 FamFG zu löschen. Die Frist zur Erhebung eines Widerspruchs ist auf einen Monat festgesetzt."
    },
    {
      "date": "2025-01-16",
      "id": "98802",
      "original_text": "Löschungsankündigung\nBremen Amtsgericht Bremen HRB 33671\nDiamond Reinigungs- und Transportservice GmbH – Bremen",
      "type": "Löschungsankündigung",
      "state": "Bremen",
      "amtsgericht": "Amtsgericht Bremen",
      "registernummer": "HRB 33671",
      "registerart": "HRB",
      "company_name": "Diamond Reinigungs- und Transportservice GmbH",
      "company_seat": "Bremen",
      "details": "16.01.2025 (Bekanntmachungsdatum)\n\nBremen Amtsgericht Bremen HRB 33671\nLöschungsankündigung\n\nDiamond Reinigungs- und Transportservice GmbH\nGesellschaft mit beschränkter Haftung\nBremen\n\nEs ist beabsichtigt die im Handelsregister eingetragene Gesellschaft von Amts wegen gemäß § 394 FamFG zu löschen. Gegen die Löschung kann beim AG Bremen schriftlich oder zu Protokoll der Geschäftsstelle Widerspruch eingelegt werden. Widerspruchsfrist 4 Wochen."
    },
    {
      "date": "2025-01-16",
      "id": "98803",
      "original_text": "Einreichung neuer Dokumente\nNordrhein-Westfalen Amtsgericht Paderborn HRB 5302\nWestfälische Landes-Eisenbahn GmbH – Lippstadt",
      "type": "Einreichung neuer Dokumente",
      "state": "Nordrhein-Westfalen",
      "amtsgericht": "Amtsgericht Paderborn",
      "registernummer": "HRB 5302",
      "registerart": "HRB",
      "company_name": "Westfälische Landes-Eisenbahn GmbH",
      "company_seat": "Lippstadt",
      "details": "16.01.2025 (Bekanntmachungsdatum)\n\nNordrhein-Westfalen Amtsgericht Paderborn HRB 5302\nEinreichung neuer Dokumente\n\nWestfälische Landes-Eisenbahn GmbH\nGesellschaft mit beschränkter Haftung\nLippstadt\n\nDem Registergericht ist eine Liste der Mitglieder des Aufsichtsrates eingereicht worden."
    },
    {
      "date": "2025-01-16",
      "id": "98804",
      "original_text": "Löschungsankündigung\nNordrhein-Westfalen Amtsgericht Köln HRB 75500\nH.H. Edelmetalle GmbH – Köln",
      "type": "Löschungsankündigung",
      "state": "Nordrhein-Westfalen",
      "amtsgericht": "Amtsgericht Köln",
      "registernummer": "HRB 75500",
      "registerart": "HRB",
      "company_name": "H.H. Edelmetalle GmbH",
      "company_seat": "Köln",
      "details": "16.01.2025 (Bekanntmachungsdatum)\n\nNordrhein-Westfalen Amtsgericht Köln HRB 75500\nLöschungsankündigung\n\nH.H. Edelmetalle GmbH\nGesellschaft mit beschränkter Haftung\nKöln\n\nDas Registergericht beabsichtigt die Gesellschaft von Amts wegen nach § 394 FamFG zu löschen. Die Frist zur Erhebung eines Widerspruchs ist auf einen Monat festgesetzt."
    },
    {
      "date": "2025-01-16",
      "id": "98805",
      "original_text": "Registerbekanntmachung nach dem Umwandlungsgesetz\nNordrhein-Westfalen Amtsgericht Paderborn HRB 4260\nF. Klingenthal Verwaltungs GmbH – Paderborn",
      "type": "Registerbekanntmachung nach dem Umwandlungsgesetz",
      "state": "Nordrhein-Westfalen",
      "amtsgericht": "Amtsgericht Paderborn",
      "registernummer": "HRB 4260",
      "registerart": "HRB",
      "company_name": "F. Klingenthal Verwaltungs GmbH",
      "company_seat": "Paderborn",
      "details": "16.01.2025 (Bekanntmachungsdatum)\n\nNordrhein-Westfalen Amtsgericht Paderborn HRB 4260\nRegisterbekanntmachung nach dem Umwandlungsgesetz 16.01.2025 (Eintragungsdatum)\n\nF. Klingenthal Verwaltungs GmbH\nGesellschaft mit beschränkter Haftung\nPaderborn\n\nDen Gläubigern der an der Verschmelzung beteiligten Rechtsträger ist, wenn sie binnen sechs Monaten nach dem Tag, an dem die Eintragung der Verschmelzung in das Register des Sitzes desjenigen Rechtsträgers, dessen Gläubiger sie sind, nach § 19 Absatz 3 UmwG als bekanntgemacht gilt, ihren Anspruch nach Grund und Höhe schriftlich anmelden, Sicherheit zu leisten, soweit sie nicht Befriedigung verlangen können. Dieses Recht steht den Gläubigern jedoch nur zu, wenn sie glaubhaft machen, dass durch die Verschmelzung die Erfüllung ihrer Forderung gefährdet wird."
    },
    {
      "date": "2025-01-16",
      "id": "98806",
      "original_text": "Einreichung neuer Dokumente\nNordrhein-Westfalen Amtsgericht Arnsberg HRB 7153\nDRK Haus Piening Warstein gGmbH – Warstein",
      "type": "Einreichung neuer Dokumente",
      "state": "Nordrhein-Westfalen",
      "amtsgericht": "Amtsgericht Arnsberg",
      "registernummer": "HRB 7153",
      "registerart": "HRB",
      "company_name": "DRK Haus Piening Warstein gGmbH",
      "company_seat": "Warstein",
      "details": "16.01.2025 (Bekanntmachungsdatum)\n\nNordrhein-Westfalen Amtsgericht Arnsberg HRB 7153\nEinreichung neuer Dokumente 16.01.2025 (Eintragungsdatum)\n\nDRK Haus Piening Warstein gGmbH\nGesellschaft mit beschränkter Haftung\nWarstein\n\nDem Registergericht ist eine neue Liste der Mitglieder des Aufsichtsrates eingereicht worden."
    },
    {
      "date": "2025-01-16",
      "id": "98807",
      "original_text": "Registerbekanntmachung nach dem Umwandlungsgesetz\nNordrhein-Westfalen Amtsgericht Dortmund HRB 35649\nproLogistik Transportation GmbH – Dortmund",
      "type": "Registerbekanntmachung nach dem Umwandlungsgesetz",
      "state": "Nordrhein-Westfalen",
      "amtsgericht": "Amtsgericht Dortmund",
      "registernummer": "HRB 35649",
      "registerart": "HRB",
      "company_name": "proLogistik Transportation GmbH",
      "company_seat": "Dortmund",
      "details": "16.01.2025 (Bekanntmachungsdatum)\n\nNordrhein-Westfalen Amtsgericht Dortmund HRB 35649\nRegisterbekanntmachung nach dem Umwandlungsgesetz 14.01.2025 (Eintragungsdatum)\n\nproLogistik Transportation GmbH\nGesellschaft mit beschränkter Haftung\nDortmund\n\nDen Gläubigern der an der Verschmelzung beteiligten Rechtsträger ist, wenn sie binnen sechs Monaten nach dem Tag, an dem die Eintragung der Verschmelzung in das Register des Sitzes desjenigen Rechtsträgers, dessen Gläubiger sie sind, nach § 19 Absatz 3 UmwG als bekanntgemacht gilt, ihren Anspruch nach Grund und Höhe schriftlich anmelden, Sicherheit zu leisten, soweit sie nicht Befriedigung verlangen können. Dieses Recht steht den Gläubigern jedoch nur zu, wenn sie glaubhaft machen, dass durch die Verschmelzung die Erfüllung ihrer Forderung gefährdet wird."
    },
    {
      "date": "2025-01-16",
      "id": "98808",
      "original_text": "Sonstige Registerbekanntmachung\nNordrhein-Westfalen Amtsgericht Düsseldorf HRB 47096\nBaust Rollen GmbH – Langenfeld",
      "type": "Sonstige Registerbekanntmachung",
      "state": "Nordrhein-Westfalen",
      "amtsgericht": "Amtsgericht Düsseldorf",
      "registernummer": "HRB 47096",
      "registerart": "HRB",
      "company_name": "Baust Rollen GmbH",
      "company_seat": "Langenfeld",
      "details": "16.01.2025 (Bekanntmachungsdatum)\n\nNordrhein-Westfalen Amtsgericht Düsseldorf HRB 47096\nSonstige Registerbekanntmachung 16.01.2025 (Eintragungsdatum)\n\nBaust Rollen GmbH\nGesellschaft mit beschränkter Haftung\nLangenfeld\n\nAls nicht eingetragen wird veröffentlicht: Den Gläubigern der Gesellschaft, deren Forderungen begründet worden sind bevor die Eintragung der Beendigung des Beherrschungs- und Gewinnabführungsvertrages  in das Handelsregister nach § 10 des Handelsgesetzbuches als bekanntgemacht gilt, hat der andere Vertragsteil Sicherheit zu leisten, wenn sie sich binnen sechs Monaten nach der Bekanntmachung der Eintragung zu diesem Zweck bei ihm melden."
    },
    {
      "date": "2025-01-16",
      "id": "98809",
      "original_text": "Registerbekanntmachung nach dem Umwandlungsgesetz\nNordrhein-Westfalen Amtsgericht Kleve HRB 12591\nLöhr Steuerberatungsgesellschaft mbH – Goch",
      "type": "Registerbekanntmachung nach dem Umwandlungsgesetz",
      "state": "Nordrhein-Westfalen",
      "amtsgericht": "Amtsgericht Kleve",
      "registernummer": "HRB 12591",
      "registerart": "HRB",
      "company_name": "Löhr Steuerberatungsgesellschaft mbH",
      "company_seat": "Goch",
      "details": "16.01.2025 (Bekanntmachungsdatum)\n\nNordrhein-Westfalen Amtsgericht Kleve HRB 12591\nRegisterbekanntmachung nach dem Umwandlungsgesetz 14.01.2025 (Eintragungsdatum)\n\nLöhr Steuerberatungsgesellschaft mbH\nGesellschaft mit beschränkter Haftung\nGoch\n\nDen Gläubigern der an der Verschmelzung beteiligten Rechtsträger ist, wenn sie binnen sechs Monaten nach dem Tag, an dem die Eintragung der Verschmelzung in das Register des Sitzes desjenigen Rechtsträgers, dessen Gläubiger sie sind, nach § 19 Absatz 3 UmwG als bekanntgemacht gilt, ihren Anspruch nach Grund und Höhe schriftlich anmelden, Sicherheit zu leisten, soweit sie nicht Befriedigung verlangen können. Dieses Recht steht den Gläubigern jedoch nur zu, wenn sie glaubhaft machen, dass durch die Verschmelzung die Erfüllung ihrer Forderung gefährdet wird."
    },
    {
      "date": "2025-01-16",
      "id": "98810",
      "original_text": "Löschungsankündigung\nNordrhein-Westfalen Amtsgericht Düsseldorf HRB 67691\nEurokarttel GmbH – Düsseldorf",
      "type": "Löschungsankündigung",
      "state": "Nordrhein-Westfalen",
      "amtsgericht": "Amtsgericht Düsseldorf",
      "registernummer": "HRB 67691",
      "registerart": "HRB",
      "company_name": "Eurokarttel GmbH",
      "company_seat": "Düsseldorf",
      "details": "16.01.2025 (Bekanntmachungsdatum)\n\nNordrhein-Westfalen Amtsgericht Düsseldorf HRB 67691\nLöschungsankündigung\n\nEurokarttel GmbH\nGesellschaft mit beschränkter Haftung\nDüsseldorf\n\nDas Registergericht beabsichtigt die Gesellschaft von Amts wegen nach § 394 FamFG zu löschen. Die Frist zur Erhebung eines Widerspruchs ist auf drei Wochen festgesetzt.\n\nRechtsbehelfsbelehrung:\nDas Widerspruchsrecht steht jedem zu, der an der Unterlassung der Löschung ein berechtigtes Interesse hat. Der Widerspruch ist bei dem Amtsgericht Düsseldorf -Registergericht-, Werdener Straße 1, 40227 Düsseldorf schriftlich in deutscher Sprache oder zur Niederschrift der Geschäftsstelle einzulegen. Der Widerspruch kann auch zur Niederschrift der Geschäftsstelle eines jeden Amtsgerichtes abgegeben werden. Die Einlegung ist auch durch Übertragung eines elektronischen Dokuments an die elektronische Poststelle des Gerichts möglich. Das elektronische Dokument muss für die Bearbeitung durch das Gericht geeignet und mit einer qualifizierten elektronischen Signatur der verantwortenden Person versehen sein oder von der verantwortenden Person signiert und auf einem sicheren Übermittlungsweg gemäß § 130a ZPO nach näherer Maßgabe der Verordnung über die technischen Rahmenbedingungen des elektronischen Rechtsverkehrs und über das besondere elektronische Behördenpostfach (BGBl. I, S.3803) eingereicht werden. Weitere Informationen erhalten Sie auf der Internetseite www.justiz.de.\nDer Widerspruch muss spätestens innerhalb der gesetzten Frist nach dem Datum der Bekanntmachung der Löschungsankündigung bei dem Amtsgericht - Registergericht - Düsseldorf eingegangen sein.  Dies gilt auch dann, wenn der Widerspruch zur Niederschrift der Geschäftsstelle eines anderen Amtsgerichtes abgegeben wurde. Die Frist beginnt mit dem Tage der Bekanntmachung der Löschungsankündigung in dem für die Bekanntmachung der Eintragungen in das Handelsregister bestimmten elektronischen Informations- und Kommunikationssystem nach § 10 des Handelsgesetzbuches. Fällt das Ende der Frist auf einen Sonntag, einen allgemeinen Feiertag oder Sonnabend, so endet die Frist mit Ablauf des nächsten Werktages.\nDer Widerspruch muss die Bezeichnung der angefochtenen Löschungsankündigung sowie die Erklärung enthalten, dass Widerspruch gegen diese Löschungsankündigung eingelegt wird. Er ist zu unterzeichnen und soll begründet werden."
    },
    {
      "date": "2025-01-16",
      "id": "98811",
      "original_text": "Sonstige Registerbekanntmachung\nNordrhein-Westfalen Amtsgericht Düsseldorf HRB 93794\nSG Spielstation Brohl GmbH – Monheim am Rhein",
      "type": "Sonstige Registerbekanntmachung",
      "state": "Nordrhein-Westfalen",
      "amtsgericht": "Amtsgericht Düsseldorf",
      "registernummer": "HRB 93794",
      "registerart": "HRB",
      "company_name": "SG Spielstation Brohl GmbH",
      "company_seat": "Monheim am Rhein",
      "details": "16.01.2025 (Bekanntmachungsdatum)\n\nNordrhein-Westfalen Amtsgericht Düsseldorf HRB 93794\nSonstige Registerbekanntmachung 16.01.2025 (Eintragungsdatum)\n\nSG Spielstation Brohl GmbH\nGesellschaft mit beschränkter Haftung\nMonheim am Rhein\n\nAls nicht eingetragen wird veröffentlicht: Den Gläubigern der Gesellschaft, deren Forderungen begründet worden sind bevor die Eintragung der Beendigung des Gewinnabführungsvertrages  in das Handelsregister nach § 10 des Handelsgesetzbuches als bekanntgemacht gilt, hat der andere Vertragsteil Sicherheit zu leisten, wenn sie sich binnen sechs Monaten nach der Bekanntmachung der Eintragung zu diesem Zweck bei ihm melden."
    },
    {
      "date": "2025-01-16",
      "id": "98812",
      "original_text": "Löschungsankündigung\nNordrhein-Westfalen Amtsgericht Mönchengladbach HRB 19715\nALGIRDAI GmbH – Schwalmtal",
      "type": "Löschungsankündigung",
      "state": "Nordrhein-Westfalen",
      "amtsgericht": "Amtsgericht Mönchengladbach",
      "registernummer": "HRB 19715",
      "registerart": "HRB",
      "company_name": "ALGIRDAI GmbH",
      "company_seat": "Schwalmtal",
      "details": "16.01.2025 (Bekanntmachungsdatum)\n\nNordrhein-Westfalen Amtsgericht Mönchengladbach HRB 19715\nLöschungsankündigung\n\nALGIRDAI GmbH\nGesellschaft mit beschränkter Haftung\nSchwalmtal\n\nDas Registergericht beabsichtigt, die im Handelsregister eingetragene Gesellschaft gemäß § 394 Absatz 1 FamFG wegen Vermögenslosigkeit von Amts wegen zu löschen. Gegen diese Verfügung kann Widerspruch eingelegt werden. Die Frist zur Erhebung eines Widerspruchs gegen die beabsichtigte Löschung von Amts wegen ist auf zwei Monate festgesetzt."
    },
    {
      "date": "2025-01-16",
      "id": "98813",
      "original_text": "Löschungsankündigung\nNordrhein-Westfalen Amtsgericht Düsseldorf HRB 38298\nNCP Group AG – Düsseldorf",
      "type": "Löschungsankündigung",
      "state": "Nordrhein-Westfalen",
      "amtsgericht": "Amtsgericht Düsseldorf",
      "registernummer": "HRB 38298",
      "registerart": "HRB",
      "company_name": "NCP Group AG",
      "company_seat": "Düsseldorf",
      "details": "16.01.2025 (Bekanntmachungsdatum)\n\nNordrhein-Westfalen Amtsgericht Düsseldorf HRB 38298\nLöschungsankündigung\n\nNCP Group AG\nAktiengesellschaft\nDüsseldorf\n\nDas Registergericht beabsichtigt die Gesellschaft von Amts wegen nach § 394 FamFG zu löschen. Die Frist zur Erhebung eines Widerspruchs ist auf 3 Wochen festgesetzt.\n\nRechtsbehelfsbelehrung:\nDas Widerspruchsrecht steht jedem zu, der an der Unterlassung der Löschung ein berechtigtes Interesse hat. Der Widerspruch ist bei dem Amtsgericht Düsseldorf -Registergericht-, Werdener Straße 1, 40227 Düsseldorf schriftlich in deutscher Sprache oder zur Niederschrift der Geschäftsstelle einzulegen. Der Widerspruch kann auch zur Niederschrift der Geschäftsstelle eines jeden Amtsgerichtes abgegeben werden. Die Einlegung ist auch durch Übertragung eines elektronischen Dokuments an die elektronische Poststelle des Gerichts möglich. Das elektronische Dokument muss für die Bearbeitung durch das Gericht geeignet und mit einer qualifizierten elektronischen Signatur der verantwortenden Person versehen sein oder von der verantwortenden Person signiert und auf einem sicheren Übermittlungsweg gemäß § 130a ZPO nach näherer Maßgabe der Verordnung über die technischen Rahmenbedingungen des elektronischen Rechtsverkehrs und über das besondere elektronische Behördenpostfach (BGBl. I, S.3803) eingereicht werden. Weitere Informationen erhalten Sie auf der Internetseite www.justiz.de.\nDer Widerspruch muss spätestens innerhalb der gesetzten Frist nach dem Datum der Bekanntmachung der Löschungsankündigung bei dem Amtsgericht - Registergericht - Düsseldorf eingegangen sein.  Dies gilt auch dann, wenn der Widerspruch zur Niederschrift der Geschäftsstelle eines anderen Amtsgerichtes abgegeben wurde. Die Frist beginnt mit dem Tage der Bekanntmachung der Löschungsankündigung in dem für die Bekanntmachung der Eintragungen in das Handelsregister bestimmten elektronischen Informations- und Kommunikationssystem nach § 10 des Handelsgesetzbuches. Fällt das Ende der Frist auf einen Sonntag, einen allgemeinen Feiertag oder Sonnabend, so endet die Frist mit Ablauf des nächsten Werktages.\nDer Widerspruch muss die Bezeichnung der angefochtenen Löschungsankündigung sowie die Erklärung enthalten, dass Widerspruch gegen diese Löschungsankündigung eingelegt wird. Er ist zu unterzeichnen und soll begründet werden."
    },
    {
      "date": "2025-01-16",
      "id": "98814",
      "original_text": "Löschungsankündigung\nNordrhein-Westfalen Amtsgericht Düsseldorf HRB 100774\nHala Marketing UG (haftungsbeschränkt) – Monheim am Rhein",
      "type": "Löschungsankündigung",
      "state": "Nordrhein-Westfalen",
      "amtsgericht": "Amtsgericht Düsseldorf",
      "registernummer": "HRB 100774",
      "registerart": "HRB",
      "company_name": "Hala Marketing UG (haftungsbeschränkt)",
      "company_seat": "Monheim am Rhein",
      "details": "16.01.2025 (Bekanntmachungsdatum)\n\nNordrhein-Westfalen Amtsgericht Düsseldorf HRB 100774\nLöschungsankündigung\n\nHala Marketing UG (haftungsbeschränkt)\nGesellschaft mit beschränkter Haftung\nMonheim am Rhein\n\nDas Registergericht beabsichtigt die Gesellschaft von Amts wegen nach § 394 FamFG zu löschen. Die Frist zur Erhebung eines Widerspruchs ist auf #DV.Fr(Text=\"Bitte wählen Sie die Widerspruchsfrist aus!\",Eingabe=\"einen Monat\",\"zwei Monate\",\"drei Monate\",\"#insert(Text=\"Freitext\")\"|\"freier Text\") festgesetzt.\n\nRechtsbehelfsbelehrung:\nDas Widerspruchsrecht steht jedem zu, der an der Unterlassung der Löschung ein berechtigtes Interesse hat. Der Widerspruch ist bei dem Amtsgericht Düsseldorf -Registergericht-, Werdener Straße 1, 40227 Düsseldorf schriftlich in deutscher Sprache oder zur Niederschrift der Geschäftsstelle einzulegen. Der Widerspruch kann auch zur Niederschrift der Geschäftsstelle eines jeden Amtsgerichtes abgegeben werden. Die Einlegung ist auch durch Übertragung eines elektronischen Dokuments an die elektronische Poststelle des Gerichts möglich. Das elektronische Dokument muss für die Bearbeitung durch das Gericht geeignet und mit einer qualifizierten elektronischen Signatur der verantwortenden Person versehen sein oder von der verantwortenden Person signiert und auf einem sicheren Übermittlungsweg gemäß § 130a ZPO nach näherer Maßgabe der Verordnung über die technischen Rahmenbedingungen des elektronischen Rechtsverkehrs und über das besondere elektronische Behördenpostfach (BGBl. I, S.3803) eingereicht werden. Weitere Informationen erhalten Sie auf der Internetseite www.justiz.de.\nDer Widerspruch muss spätestens innerhalb der gesetzten Frist nach dem Datum der Bekanntmachung der Löschungsankündigung bei dem Amtsgericht - Registergericht - Düsseldorf eingegangen sein.  Dies gilt auch dann, wenn der Widerspruch zur Niederschrift der Geschäftsstelle eines anderen Amtsgerichtes abgegeben wurde. Die Frist beginnt mit dem Tage der Bekanntmachung der Löschungsankündigung in dem für die Bekanntmachung der Eintragungen in das Handelsregister bestimmten elektronischen Informations- und Kommunikationssystem nach § 10 des Handelsgesetzbuches. Fällt das Ende der Frist auf einen Sonntag, einen allgemeinen Feiertag oder Sonnabend, so endet die Frist mit Ablauf des nächsten Werktages.\nDer Widerspruch muss die Bezeichnung der angefochtenen Löschungsankündigung sowie die Erklärung enthalten, dass Widerspruch gegen diese Löschungsankündigung eingelegt wird. Er ist zu unterzeichnen und soll begründet werden."
    },
    {
      "date": "2025-01-16",
      "id": "98815",
      "original_text": "Löschungsankündigung\nNordrhein-Westfalen Amtsgericht Siegburg HRB 15157\nMatei Bau GmbH – Waldbröl",
      "type": "Löschungsankündigung",
      "state": "Nordrhein-Westfalen",
      "amtsgericht": "Amtsgericht Siegburg",
      "registernummer": "HRB 15157",
      "registerart": "HRB",
      "company_name": "Matei Bau GmbH",
      "company_seat": "Waldbröl",
      "details": "16.01.2025 (Bekanntmachungsdatum)\n\nNordrhein-Westfalen Amtsgericht Siegburg HRB 15157\nLöschungsankündigung\n\nMatei Bau GmbH\nGesellschaft mit beschränkter Haftung\nWaldbröl\n\nDas Registergericht hat glaubhafte Kenntnis erlangt, dass die Gesellschaft vermögenslos geworden ist, da ein Insolvenzeröffnungsantrag mangels Masse nach § 26 InsO zurückgewiesen wurde.\n\nEs ist daher beabsichtigt, die Gesellschaft nach § 394 FamFG im Handelsregister wegen Vermögenslosigkeit zu löschen.\nEinwände gegen die Löschung sind durch Widerspruch binnen einer Frist von 3 Monaten geltend zu machen, andernfalls die Löschung erfolgen wird.\n\nEinzulegen ist der Widerspruch bei dem Amtsgericht Siegburg, Neue Poststraße 16, 53721 Siegburg, und zwar entweder schriftlich in deutscher Sprache oder mündlich zur Niederschrift der Geschäftsstelle. Der Widerspruch kann auch zur Niederschrift der Geschäftsstelle eines jeden Amtsgerichts abgegeben werden. Der Widerspruch ist binnen der in der Verfügung bestimmten Frist einzulegen. Die Frist ist nur gewahrt, wenn der Widerspruch rechtzeitig bei dem Amtsgericht Siegburg eingeht, auch wenn der Widerspruch zur Niederschrift der Geschäftsstelle eines anderen Amtsgerichts abgegeben wurde. Die Frist beginnt jeweils mit der schriftlichen Bekanntgabe der Verfügung an die Beteiligten. Kann die schriftliche Bekanntgabe an einen Beteiligten nicht bewirkt werden, beginnt die Frist spätestens mit Ablauf von fünf Monaten nach Erlass der Verfügung. Die Bekanntgabe ist entweder durch Zustellung oder am dritten Tage nach Aufgabe zur Post bewirkt. Sofern die Löschung noch nicht erfolgt ist, kann der Widerspruch auch noch nach Ablauf der Frist eingelegt werden. Fällt das Ende der Frist auf einen Sonnabend, einen Sonntag oder einen allgemeinen Feiertag, endet die Frist mit Ablauf des nächsten Werktages. Der Widerspruch ist zu unterzeichnen. Eine Begründung des Widerspruchs ist nicht vorgeschrieben."
    },
    {
      "date": "2025-01-16",
      "id": "98816",
      "original_text": "Registerbekanntmachung nach dem Umwandlungsgesetz\nNordrhein-Westfalen Amtsgericht Dortmund HRB 20559\nOnline Engineering GmbH – Dortmund",
      "type": "Registerbekanntmachung nach dem Umwandlungsgesetz",
      "state": "Nordrhein-Westfalen",
      "amtsgericht": "Amtsgericht Dortmund",
      "registernummer": "HRB 20559",
      "registerart": "HRB",
      "company_name": "Online Engineering GmbH",
      "company_seat": "Dortmund",
      "details": "16.01.2025 (Bekanntmachungsdatum)\n\nNordrhein-Westfalen Amtsgericht Dortmund HRB 20559\nRegisterbekanntmachung nach dem Umwandlungsgesetz 15.01.2025 (Eintragungsdatum)\n\nOnline Engineering GmbH\nGesellschaft mit beschränkter Haftung\nDortmund\n\nDen Gläubigern der an der Verschmelzung beteiligten Rechtsträger ist, wenn sie binnen sechs Monaten nach dem Tag, an dem die Eintragung der Verschmelzung in das Register des Sitzes desjenigen Rechtsträgers, dessen Gläubiger sie sind, nach § 19 Absatz 3 UmwG als bekanntgemacht gilt, ihren Anspruch nach Grund und Höhe schriftlich anmelden, Sicherheit zu leisten, soweit sie nicht Befriedigung verlangen können. Dieses Recht steht den Gläubigern jedoch nur zu, wenn sie glaubhaft machen, dass durch die Verschmelzung die Erfüllung ihrer Forderung gefährdet wird."
    },
    {
      "date": "2025-01-16",
      "id": "98817",
      "original_text": "Einreichung neuer Dokumente\nNordrhein-Westfalen Amtsgericht Köln HRB 118943\nTMD Friction Group GmbH – Leverkusen",
      "type": "Einreichung neuer Dokumente",
      "state": "Nordrhein-Westfalen",
      "amtsgericht": "Amtsgericht Köln",
      "registernummer": "HRB 118943",
      "registerart": "HRB",
      "company_name": "TMD Friction Group GmbH",
      "company_seat": "Leverkusen",
      "details": "16.01.2025 (Bekanntmachungsdatum)\n\nNordrhein-Westfalen Amtsgericht Köln HRB 118943\nEinreichung neuer Dokumente\n\nTMD Friction Group GmbH\nGesellschaft mit beschränkter Haftung\nLeverkusen\n\nDem Registergericht ist eine Liste der Mitglieder des Aufsichtsrates eingereicht worden."
    },
    {
      "date": "2025-01-16",
      "id": "98818",
      "original_text": "Einreichung neuer Dokumente\nNordrhein-Westfalen Amtsgericht Arnsberg HRB 5439\nRegionalverkehr Ruhr-Lippe GmbH – Soest",
      "type": "Einreichung neuer Dokumente",
      "state": "Nordrhein-Westfalen",
      "amtsgericht": "Amtsgericht Arnsberg",
      "registernummer": "HRB 5439",
      "registerart": "HRB",
      "company_name": "Regionalverkehr Ruhr-Lippe GmbH",
      "company_seat": "Soest",
      "details": "16.01.2025 (Bekanntmachungsdatum)\n\nNordrhein-Westfalen Amtsgericht Arnsberg HRB 5439\nEinreichung neuer Dokumente 16.01.2025 (Eintragungsdatum)\n\nRegionalverkehr Ruhr-Lippe GmbH\nGesellschaft mit beschränkter Haftung\nSoest\n\nDem Registergericht ist eine neue Liste der Mitglieder des Aufsichtsrates eingereicht worden."
    },
    {
      "date": "2025-01-16",
      "id": "98819",
      "original_text": "Löschungsankündigung\nNordrhein-Westfalen Amtsgericht Bonn HRB 20819\nEDI GmbH – Bonn",
      "type": "Löschungsankündigung",
      "state": "Nordrhein-Westfalen",
      "amtsgericht": "Amtsgericht Bonn",
      "registernummer": "HRB 20819",
      "registerart": "HRB",
      "company_name": "EDI GmbH",
      "company_seat": "Bonn",
      "details": "16.01.2025 (Bekanntmachungsdatum)\n\nNordrhein-Westfalen Amtsgericht Bonn HRB 20819\nLöschungsankündigung\n\nEDI GmbH\nGesellschaft mit beschränkter Haftung\nBonn\n\nDas Registergericht beabsichtigt die Gesellschaft von Amts wegen nach § 394 FamFG zu löschen. Die Frist zur Erhebung eines Widerspruchs ist auf einen Monat festgesetzt."
    },
    {
      "date": "2025-01-16",
      "id": "98820",
      "original_text": "Löschungsankündigung\nNordrhein-Westfalen Amtsgericht Bochum HRB 17234\nAKPAL GmbH – Bochum",
      "type": "Löschungsankündigung",
      "state": "Nordrhein-Westfalen",
      "amtsgericht": "Amtsgericht Bochum",
      "registernummer": "HRB 17234",
      "registerart": "HRB",
      "company_name": "AKPAL GmbH",
      "company_seat": "Bochum",
      "details": "16.01.2025 (Bekanntmachungsdatum)\n\nNordrhein-Westfalen Amtsgericht Bochum HRB 17234\nLöschungsankündigung 17.01.2025 (Eintragungsdatum)\n\nAKPAL GmbH\nGesellschaft mit beschränkter Haftung\nBochum\n\nDas Registergericht beabsichtigt die Gesellschaft von Amts wegen nach § 395 FamFG zu löschen. Die Frist zur Erhebung eines Widerspruchs ist auf drei Monate festgesetzt."
    },
    {
      "date": "2025-01-16",
      "id": "98821",
      "original_text": "Sonstige Registerbekanntmachung\nNordrhein-Westfalen Amtsgericht Dortmund HRB 36151\nbuildingclouds GmbH – Dortmund",
      "type": "Sonstige Registerbekanntmachung",
      "state": "Nordrhein-Westfalen",
      "amtsgericht": "Amtsgericht Dortmund",
      "registernummer": "HRB 36151",
      "registerart": "HRB",
      "company_name": "buildingclouds GmbH",
      "company_seat": "Dortmund",
      "details": "16.01.2025 (Bekanntmachungsdatum)\n\nNordrhein-Westfalen Amtsgericht Dortmund HRB 36151\nSonstige Registerbekanntmachung 16.01.2025 (Eintragungsdatum)\n\nbuildingclouds GmbH\nGesellschaft mit beschränkter Haftung\nDortmund\n\nAls nicht eingetragen wird veröffentlicht: Den Gläubigern der Gesellschaft, deren Forderungen begründet worden sind bevor die Eintragung der Aussetzung des Ergebnis-/Gewinnabführungsvertrages  in das Handelsregister nach § 10 des Handelsgesetzbuches als bekanntgemacht gilt, hat der andere Vertragsteil Sicherheit zu leisten, wenn sie sich binnen sechs Monaten nach der Bekanntmachung der Eintragung zu diesem Zweck bei ihm melden."
    },
    {
      "date": "2025-01-16",
      "id": "98822",
      "original_text": "Löschungsankündigung\nNordrhein-Westfalen Amtsgericht Krefeld HRB 9341\n\"Wohnbau Terporten GmbH\" – Kempen",
      "type": "Löschungsankündigung",
      "state": "Nordrhein-Westfalen",
      "amtsgericht": "Amtsgericht Krefeld",
      "registernummer": "HRB 9341",
      "registerart": "HRB",
      "company_name": "\"Wohnbau Terporten GmbH\"",
      "company_seat": "Kempen",
      "details": "16.01.2025 (Bekanntmachungsdatum)\n\nNordrhein-Westfalen Amtsgericht Krefeld HRB 9341\nLöschungsankündigung\n\n\"Wohnbau Terporten GmbH\"\nGesellschaft mit beschränkter Haftung\nKempen\n\nDas Registergericht beabsichtigt die Gesellschaft von Amts wegen nach § 394 FamFG zu löschen. Die Frist zur Erhebung eines Widerspruchs ist auf einen Monat festgesetzt."
    },
    {
      "date": "2025-01-16",
      "id": "98823",
      "original_text": "Einreichung neuer Dokumente\nNordrhein-Westfalen Amtsgericht Bad Oeynhausen HRB 5202\nMindener Kreisbahnen GmbH – Minden",
      "type": "Einreichung neuer Dokumente",
      "state": "Nordrhein-Westfalen",
      "amtsgericht": "Amtsgericht Bad Oeynhausen",
      "registernummer": "HRB 5202",
      "registerart": "HRB",
      "company_name": "Mindener Kreisbahnen GmbH",
      "company_seat": "Minden",
      "details": "16.01.2025 (Bekanntmachungsdatum)\n\nNordrhein-Westfalen Amtsgericht Bad Oeynhausen HRB 5202\nEinreichung neuer Dokumente 16.01.2025 (Eintragungsdatum)\n\nMindener Kreisbahnen GmbH\nGesellschaft mit beschränkter Haftung\nMinden\n\nDem Registergericht ist eine neue Liste der Mitglieder des Aufsichtsrates eingereicht worden."
    },
    {
      "date": "2025-01-16",
      "id": "98824",
      "original_text": "Einreichung neuer Dokumente\nHessen Amtsgericht Frankfurt am Main HRB 116860\nPAYONE GmbH – Frankfurt am Main",
      "type": "Einreichung neuer Dokumente",
      "state": "Hessen",
      "amtsgericht": "Amtsgericht Frankfurt am Main",
      "registernummer": "HRB 116860",
      "registerart": "HRB",
      "company_name": "PAYONE GmbH",
      "company_seat": "Frankfurt am Main",
      "details": "16.01.2025 (Bekanntmachungsdatum)\n\nHessen Amtsgericht Frankfurt am Main HRB 116860\nEinreichung neuer Dokumente 16.01.2025 (Eintragungsdatum)\n\nPAYONE GmbH\nGesellschaft mit beschränkter Haftung\nFrankfurt am Main\n\nDurch eine Änderung in den Personen der Aufsichtsratsmitglieder ist eine Liste der Mitglieder des Aufsichtsrates zum Handelsregister eingereicht worden."
    },
    {
      "date": "2025-01-16",
      "id": "98825",
      "original_text": "Sonstige Registerbekanntmachung\nHessen Amtsgericht Kassel VR 5605\nFriends help e.V. – Wolfhagen",
      "type": "Sonstige Registerbekanntmachung",
      "state": "Hessen",
      "amtsgericht": "Amtsgericht Kassel",
      "registernummer": "VR 5605",
      "registerart": "VR",
      "company_name": "Friends help e.V.",
      "company_seat": "Wolfhagen",
      "details": "16.01.2025 (Bekanntmachungsdatum)\n\nHessen Amtsgericht Kassel VR 5605\nSonstige Registerbekanntmachung 16.01.2025 (Eintragungsdatum)\n\nFriends help e.V.\neingetragener Verein\nWolfhagen\n\nDer Verein ist aufgelöst."
    },
    {
      "date": "2025-01-16",
      "id": "98826",
      "original_text": "Löschungsankündigung\nHessen Amtsgericht Friedberg HRB 10346\nStar Gebäudereinigung GmbH – Hirzenhain (Wetteraukreis)",
      "type": "Löschungsankündigung",
      "state": "Hessen",
      "amtsgericht": "Amtsgericht Friedberg",
      "registernummer": "HRB 10346",
      "registerart": "HRB",
      "company_name": "Star Gebäudereinigung GmbH",
      "company_seat": "Hirzenhain (Wetteraukreis)",
      "details": "16.01.2025 (Bekanntmachungsdatum)\n\nHessen Amtsgericht Friedberg HRB 10346\nLöschungsankündigung\n\nStar Gebäudereinigung GmbH\nGesellschaft mit beschränkter Haftung\nHirzenhain (Wetteraukreis)\n\nDas Registergericht beabsichtigt die im Handelsregister eingetragene Gesellschaft von Amts wegen nach § 394 FamFG zu löschen. Die Frist zur Erhebung eines Widerspruchs gegen die beabsichtigte Löschung wird auf 3 Monate festgesetzt."
    },
    {
      "date": "2025-01-16",
      "id": "98827",
      "original_text": "Sonstige Registerbekanntmachung\nHessen Amtsgericht Kassel VR 3299\nInstitut für Integrierte Systemanalysen (IISA) – Kassel",
      "type": "Sonstige Registerbekanntmachung",
      "state": "Hessen",
      "amtsgericht": "Amtsgericht Kassel",
      "registernummer": "VR 3299",
      "registerart": "VR",
      "company_name": "Institut für Integrierte Systemanalysen (IISA)",
      "company_seat": "Kassel",
      "details": "16.01.2025 (Bekanntmachungsdatum)\n\nHessen Amtsgericht Kassel VR 3299\nSonstige Registerbekanntmachung 16.01.2025 (Eintragungsdatum)\n\nInstitut für Integrierte Systemanalysen (IISA)\neingetragener Verein\nKassel\n\nDer Verein ist aufgelöst."
    },
    {
      "date": "2025-01-16",
      "id": "98828",
      "original_text": "Einreichung neuer Dokumente\nHessen Amtsgericht Darmstadt HRB 51168\nÜberlandwerk Groß-Gerau GmbH – Groß-Gerau",
      "type": "Einreichung neuer Dokumente",
      "state": "Hessen",
      "amtsgericht": "Amtsgericht Darmstadt",
      "registernummer": "HRB 51168",
      "registerart": "HRB",
      "company_name": "Überlandwerk Groß-Gerau GmbH",
      "company_seat": "Groß-Gerau",
      "details": "16.01.2025 (Bekanntmachungsdatum)\n\nHessen Amtsgericht Darmstadt HRB 51168\nEinreichung neuer Dokumente 16.01.2025 (Eintragungsdatum)\n\nÜberlandwerk Groß-Gerau GmbH\nGesellschaft mit beschränkter Haftung\nGroß-Gerau\n\nWegen Änderungen in den Personen der Aufsichtsratsmitglieder ist eine Liste der Mitglieder des Aufsichtsrates zum Handelsregister eingereicht worden."
    },
    {
      "date": "2025-01-16",
      "id": "98829",
      "original_text": "Sonstige Registerbekanntmachung\nHessen Amtsgericht Wiesbaden VR 5085\nSportverein 1921 Esch/Ts. – Waldems-Esch",
      "type": "Sonstige Registerbekanntmachung",
      "state": "Hessen",
      "amtsgericht": "Amtsgericht Wiesbaden",
      "registernummer": "VR 5085",
      "registerart": "VR",
      "company_name": "Sportverein 1921 Esch/Ts.",
      "company_seat": "Waldems-Esch",
      "details": "16.01.2025 (Bekanntmachungsdatum)\n\nHessen Amtsgericht Wiesbaden VR 5085\nSonstige Registerbekanntmachung 16.01.2025 (Eintragungsdatum)\n\nSportverein 1921 Esch/Ts.\neingetragener Verein\nWaldems-Esch\n\nDer Verein ist aufgelöst."
    },
    {
      "date": "2025-01-16",
      "id": "98830",
      "original_text": "Registerbekanntmachung nach dem Umwandlungsgesetz\nHessen Amtsgericht Frankfurt am Main HRB 132541\nGerman Sino Capital Management GmbH – Frankfurt am Main",
      "type": "Registerbekanntmachung nach dem Umwandlungsgesetz",
      "state": "Hessen",
      "amtsgericht": "Amtsgericht Frankfurt am Main",
      "registernummer": "HRB 132541",
      "registerart": "HRB",
      "company_name": "German Sino Capital Management GmbH",
      "company_seat": "Frankfurt am Main",
      "details": "16.01.2025 (Bekanntmachungsdatum)\n\nHessen Amtsgericht Frankfurt am Main HRB 132541\nRegisterbekanntmachung nach dem Umwandlungsgesetz 16.01.2025 (Eintragungsdatum)\n\nGerman Sino Capital Management GmbH\nGesellschaft mit beschränkter Haftung\nFrankfurt am Main\n\nDen Gläubigern der an der formwechselnden Umwandlung beteiligten Rechtsträger ist, wenn sie binnen sechs Monaten nach dem Tag, an dem die Eintragung der formwechselnden Umwandlung in das Register des Sitzes desjenigen Rechtsträgers, dessen Gläubiger sie sind, nach § 201 UmwG bekannt gemacht worden ist, ihren Anspruch nach Grund und Höhe schriftlich anmelden, Sicherheit zu leisten, soweit sie nicht Befriedigung verlangen können. Dieses Recht steht den Gläubigern jedoch nur zu, wenn sie glaubhaft machen, dass durch die formwechselnden Umwandlung die Erfüllung ihrer Forderung gefährdet wird."
    },
    {
      "date": "2025-01-16",
      "id": "98831",
      "original_text": "Sonstige Registerbekanntmachung\nHessen Amtsgericht Bad Hersfeld HRB 2297\nBKK Akademie GmbH – Rotenburg a. d. Fulda",
      "type": "Sonstige Registerbekanntmachung",
      "state": "Hessen",
      "amtsgericht": "Amtsgericht Bad Hersfeld",
      "registernummer": "HRB 2297",
      "registerart": "HRB",
      "company_name": "BKK Akademie GmbH",
      "company_seat": "Rotenburg a. d. Fulda",
      "details": "16.01.2025 (Bekanntmachungsdatum)\n\nHessen Amtsgericht Bad Hersfeld HRB 2297\nSonstige Registerbekanntmachung\n\nBKK Akademie GmbH\nGesellschaft mit beschränkter Haftung\nRotenburg a. d. Fulda\n\nDurch eine Änderung in den Personen der Aufsichtsratsmitglieder ist eine Liste der Mitglieder des Aufsichtsrates zum Handelsregister eingereicht worden."
    },
    {
      "date": "2025-01-16",
      "id": "98832",
      "original_text": "Sonstige Registerbekanntmachung\nHessen Amtsgericht Kassel HRB 6713\nNetcom Kassel Gesellschaft für Telekommunikation mbH – Kassel",
      "type": "Sonstige Registerbekanntmachung",
      "state": "Hessen",
      "amtsgericht": "Amtsgericht Kassel",
      "registernummer": "HRB 6713",
      "registerart": "HRB",
      "company_name": "Netcom Kassel Gesellschaft für Telekommunikation mbH",
      "company_seat": "Kassel",
      "details": "16.01.2025 (Bekanntmachungsdatum)\n\nHessen Amtsgericht Kassel HRB 6713\nSonstige Registerbekanntmachung 16.01.2025 (Eintragungsdatum)\n\nNetcom Kassel Gesellschaft für Telekommunikation mbH\nGesellschaft mit beschränkter Haftung\nKassel\n\nDurch die Neufassung des Gesellschaftsvertrags mit Gesellschafterbeschluss vom 19.12.2024, eingetragen am 16.01.2025, ist der Aufsichtsrat der Gesellschaft weggefallen."
    },
    {
      "date": "2025-01-16",
      "id": "98833",
      "original_text": "Einreichung neuer Dokumente\nHessen Amtsgericht Kassel HRB 2022\nGemeinnützige Wohnungsbaugesellschaft der Stadt Kassel mit beschränkter Haftung – Kassel",
      "type": "Einreichung neuer Dokumente",
      "state": "Hessen",
      "amtsgericht": "Amtsgericht Kassel",
      "registernummer": "HRB 2022",
      "registerart": "HRB",
      "company_name": "Gemeinnützige Wohnungsbaugesellschaft der Stadt Kassel mit beschränkter Haftung",
      "company_seat": "Kassel",
      "details": "16.01.2025 (Bekanntmachungsdatum)\n\nHessen Amtsgericht Kassel HRB 2022\nEinreichung neuer Dokumente\n\nGemeinnützige Wohnungsbaugesellschaft der Stadt Kassel mit beschränkter Haftung\nGesellschaft mit beschränkter Haftung\nKassel\n\nDurch eine Änderung in den Personen der Aufsichtsratsmitglieder ist eine Liste der Mitglieder des Aufsichtsrates zum Handelsregister eingereicht worden."
    },
    {
      "date": "2025-01-16",
      "id": "98834",
      "original_text": "Löschungsankündigung\nHessen Amtsgericht Hanau HRB 97887\nMaintrailer Logistik GmbH – Maintal",
      "type": "Löschungsankündigung",
      "state": "Hessen",
      "amtsgericht": "Amtsgericht Hanau",
      "registernummer": "HRB 97887",
      "registerart": "HRB",
      "company_name": "Maintrailer Logistik GmbH",
      "company_seat": "Maintal",
      "details": "16.01.2025 (Bekanntmachungsdatum)\n\nHessen Amtsgericht Hanau HRB 97887\nLöschungsankündigung\n\nMaintrailer Logistik GmbH\nGesellschaft mit beschränkter Haftung\nMaintal\n\nDas Registergericht beabsichtigt die im Handelsregister eingetragene Gesellschaft von Amts wegen nach § 394 FamFG zu löschen. Die Frist zur Erhebung eines Widerspruchs gegen die beabsichtigte Löschung wird auf 3 Monate festgesetzt."
    },
    {
      "date": "2025-01-16",
      "id": "98835",
      "original_text": "Registerbekanntmachung nach dem Umwandlungsgesetz\nHessen Amtsgericht Frankfurt am Main HRA 54035\nGerman Sino Capital Management S.R.L. & Co. KG – Frankfurt am Main",
      "type": "Registerbekanntmachung nach dem Umwandlungsgesetz",
      "state": "Hessen",
      "amtsgericht": "Amtsgericht Frankfurt am Main",
      "registernummer": "HRA 54035",
      "registerart": "HRA",
      "company_name": "German Sino Capital Management S.R.L. & Co. KG",
      "company_seat": "Frankfurt am Main",
      "details": "16.01.2025 (Bekanntmachungsdatum)\n\nHessen Amtsgericht Frankfurt am Main HRA 54035\nRegisterbekanntmachung nach dem Umwandlungsgesetz 16.01.2025 (Eintragungsdatum)\n\nGerman Sino Capital Management S.R.L. & Co. KG\nKommanditgesellschaft\nFrankfurt am Main\n\nDen Gläubigern der an der formwechselnden Umwandlung beteiligten Rechtsträger ist, wenn sie binnen sechs Monaten nach dem Tag, an dem die Eintragung der formwechselnden Umwandlung in das Register des Sitzes desjenigen Rechtsträgers, dessen Gläubiger sie sind, nach § 201 UmwG bekannt gemacht worden ist, ihren Anspruch nach Grund und Höhe schriftlich anmelden, Sicherheit zu leisten, soweit sie nicht Befriedigung verlangen können. Dieses Recht steht den Gläubigern jedoch nur zu, wenn sie glaubhaft machen, dass durch die formwechselnden Umwandlung die Erfüllung ihrer Forderung gefährdet wird."
    },
    {
      "date": "2025-01-16",
      "id": "98836",
      "original_text": "Löschungsankündigung\nHessen Amtsgericht Darmstadt HRA 85750\nCrossladen.de GmbH & Co. KG – Ober-Ramstadt",
      "type": "Löschungsankündigung",
      "state": "Hessen",
      "amtsgericht": "Amtsgericht Darmstadt",
      "registernummer": "HRA 85750",
      "registerart": "HRA",
      "company_name": "Crossladen.de GmbH & Co. KG",
      "company_seat": "Ober-Ramstadt",
      "details": "16.01.2025 (Bekanntmachungsdatum)\n\nHessen Amtsgericht Darmstadt HRA 85750\nLöschungsankündigung\n\nCrossladen.de GmbH & Co. KG\nKommanditgesellschaft\nOber-Ramstadt\n\nDas Registergericht beabsichtigt die im Handelsregister eingetragene Firma von Amts wegen nach § 394 FamFG zu löschen. Die Frist zur Erhebung eines Widerspruchs gegen die beabsichtigte Löschung wird auf 3 Monate festgesetzt."
    },
    {
      "date": "2025-01-16",
      "id": "98837",
      "original_text": "Einreichung neuer Dokumente\nHessen Amtsgericht Frankfurt am Main HRB 111136\nAdvanced Blockchain AG – Frankfurt am Main",
      "type": "Einreichung neuer Dokumente",
      "state": "Hessen",
      "amtsgericht": "Amtsgericht Frankfurt am Main",
      "registernummer": "HRB 111136",
      "registerart": "HRB",
      "company_name": "Advanced Blockchain AG",
      "company_seat": "Frankfurt am Main",
      "details": "16.01.2025 (Bekanntmachungsdatum)\n\nHessen Amtsgericht Frankfurt am Main HRB 111136\nEinreichung neuer Dokumente 16.01.2025 (Eintragungsdatum)\n\nAdvanced Blockchain AG\nAktiengesellschaft\nFrankfurt am Main\n\nDurch eine Änderung in den Personen der Aufsichtsratsmitglieder ist eine Liste der Mitglieder des Aufsichtsrates zum Handelsregister eingereicht worden."
    },
    {
      "date": "2025-01-16",
      "id": "98838",
      "original_text": "Löschungsankündigung\nHessen Amtsgericht Frankfurt am Main HRB 107966\nML 181 Property GmbH – Frankfurt am Main",
      "type": "Löschungsankündigung",
      "state": "Hessen",
      "amtsgericht": "Amtsgericht Frankfurt am Main",
      "registernummer": "HRB 107966",
      "registerart": "HRB",
      "company_name": "ML 181 Property GmbH",
      "company_seat": "Frankfurt am Main",
      "details": "16.01.2025 (Bekanntmachungsdatum)\n\nHessen Amtsgericht Frankfurt am Main HRB 107966\nLöschungsankündigung 16.01.2025 (Eintragungsdatum)\n\nML 181 Property GmbH\nGesellschaft mit beschränkter Haftung\nFrankfurt am Main\n\nEs ist beabsichtigt, die Gesellschaft wegen Vermögenslosigkeit gemäß § 394 FamFG von Amts wegen im Handelsregister zu löschen.\n\nHiergegen kann innerhalb eines Monats nach dieser Veröffentlichung Widerspruch bei dem Amtsgericht Frankfurt am Main eingelegt werden."
    }
  ]
}