{
  "date": "2025-01-04",
  "date_of_scrape": "2025-01-05T04:02:51.975Z",
  "tool_version": "0.2.0",
  "number_of_announcements": 22,
  "announcements": [
    {
      "date": "2025-01-04",
      "id": "97809",
      "original_text": "Löschungsankündigung\nBayern Amtsgericht München HRB 112126\nNetTeam EDV-Lösungen GmbH – München",
      "type": "Löschungsankündigung",
      "state": "Bayern",
      "amtsgericht": "Amtsgericht München",
      "registernummer": "HRB 112126",
      "registerart": "HRB",
      "company_name": "NetTeam EDV-Lösungen GmbH",
      "company_seat": "München",
      "details": "04.01.2025 (Bekanntmachungsdatum)\n\nBayern Amtsgericht München HRB 112126\nLöschungsankündigung 03.01.2025 (Eintragungsdatum)\n\nNetTeam EDV-Lösungen GmbH\nGesellschaft mit beschränkter Haftung\nMünchen\n\nDas Registergericht beabsichtigt, die im Handelsregister eingetragene Gesellschaft wegen Vermögenslosigkeit von Amts wegen nach § 394 FamFG zu löschen. Die Frist zur Erhebung eines Widerspruchs ist auf drei Monate festgesetzt."
    },
    {
      "date": "2025-01-04",
      "id": "97810",
      "original_text": "Sonstige Registerbekanntmachung\nBayern Amtsgericht München HRB 196460\nCamping Resort Zugspitze GmbH – Grainau",
      "type": "Sonstige Registerbekanntmachung",
      "state": "Bayern",
      "amtsgericht": "Amtsgericht München",
      "registernummer": "HRB 196460",
      "registerart": "HRB",
      "company_name": "Camping Resort Zugspitze GmbH",
      "company_seat": "Grainau",
      "details": "04.01.2025 (Bekanntmachungsdatum)\n\nBayern Amtsgericht München HRB 196460\nSonstige Registerbekanntmachung 03.01.2025 (Eintragungsdatum)\n\nCamping Resort Zugspitze GmbH\nGesellschaft mit beschränkter Haftung\nGrainau\n\nDen Gläubigern der Gesellschaft, deren Forderungen begründet worden sind, bevor die Eintragung der Beendigung des Gewinnabführungsvertrages in das Handelsregister nach § 10 des Handelsgesetzbuches als bekanntgemacht gilt, hat der andere Vertragsteil Sicherheit zu leisten, wenn sie sich binnen sechs Monaten nach der Bekanntmachung der Eintragung zu diesem Zweck bei ihm melden."
    },
    {
      "date": "2025-01-04",
      "id": "97811",
      "original_text": "Sonstige Registerbekanntmachung\nBayern Amtsgericht München HRB 226208\nPHÖNIX Sozialzentrum Windsbach GmbH – München",
      "type": "Sonstige Registerbekanntmachung",
      "state": "Bayern",
      "amtsgericht": "Amtsgericht München",
      "registernummer": "HRB 226208",
      "registerart": "HRB",
      "company_name": "PHÖNIX Sozialzentrum Windsbach GmbH",
      "company_seat": "München",
      "details": "04.01.2025 (Bekanntmachungsdatum)\n\nBayern Amtsgericht München HRB 226208\nSonstige Registerbekanntmachung 03.01.2025 (Eintragungsdatum)\n\nPHÖNIX Sozialzentrum Windsbach GmbH\nGesellschaft mit beschränkter Haftung\nMünchen\n\nDen Gläubigern der Gesellschaft, deren Forderungen begründet worden sind, bevor die Eintragung der Beendigung des Beherrschungs- und Gewinnabführungsvertrages in das Handelsregister nach § 10 des Handelsgesetzbuches als bekanntgemacht gilt, hat der andere Vertragsteil Sicherheit zu leisten, wenn sie sich binnen sechs Monaten nach der Bekanntmachung der Eintragung zu diesem Zweck bei ihm melden."
    },
    {
      "date": "2025-01-04",
      "id": "97812",
      "original_text": "Sonstige Registerbekanntmachung\nBayern Amtsgericht Fürth HRB 10564\nEVG Energieversorgungsgesellschaft Stein mbH – Stein",
      "type": "Sonstige Registerbekanntmachung",
      "state": "Bayern",
      "amtsgericht": "Amtsgericht Fürth",
      "registernummer": "HRB 10564",
      "registerart": "HRB",
      "company_name": "EVG Energieversorgungsgesellschaft Stein mbH",
      "company_seat": "Stein",
      "details": "04.01.2025 (Bekanntmachungsdatum)\n\nBayern Amtsgericht Fürth HRB 10564\nSonstige Registerbekanntmachung 03.01.2025 (Eintragungsdatum)\n\nEVG Energieversorgungsgesellschaft Stein mbH\nGesellschaft mit beschränkter Haftung\nStein\n\nDen Gläubigern der Gesellschaft, deren Forderungen begründet worden sind, bevor die Eintragung der Beendigung des Gewinnabführungsvertrages in das Handelsregister nach § 10 des Handelsgesetzbuches als bekanntgemacht gilt, hat der andere Vertragsteil Sicherheit zu leisten, wenn sie sich binnen sechs Monaten nach der Bekanntmachung der Eintragung zu diesem Zweck bei ihm melden."
    },
    {
      "date": "2025-01-04",
      "id": "97813",
      "original_text": "Einreichung neuer Dokumente\nBayern Amtsgericht Regensburg HRB 12279\nImmobilien Zentrum Holding AG – Regensburg",
      "type": "Einreichung neuer Dokumente",
      "state": "Bayern",
      "amtsgericht": "Amtsgericht Regensburg",
      "registernummer": "HRB 12279",
      "registerart": "HRB",
      "company_name": "Immobilien Zentrum Holding AG",
      "company_seat": "Regensburg",
      "details": "04.01.2025 (Bekanntmachungsdatum)\n\nBayern Amtsgericht Regensburg HRB 12279\nEinreichung neuer Dokumente\n\nImmobilien Zentrum Holding AG\nAktiengesellschaft\nRegensburg\n\nDem #Re.Name ist eine Liste der Mitglieder des Aufsichtsrats eingereicht worden, § 106 AktG."
    },
    {
      "date": "2025-01-04",
      "id": "97814",
      "original_text": "Einreichung neuer Dokumente\nBayern Amtsgericht München HRB 203845\nCANCOM SE – München",
      "type": "Einreichung neuer Dokumente",
      "state": "Bayern",
      "amtsgericht": "Amtsgericht München",
      "registernummer": "HRB 203845",
      "registerart": "HRB",
      "company_name": "CANCOM SE",
      "company_seat": "München",
      "details": "04.01.2025 (Bekanntmachungsdatum)\n\nBayern Amtsgericht München HRB 203845\nEinreichung neuer Dokumente\n\nCANCOM SE\nEuropäische Aktiengesellschaft (SE)\nMünchen\n\nDem Amtsgericht München -Registergericht- ist eine Liste der Mitglieder des Aufsichtsrats eingereicht worden, Art. 9 Abs. 1 Buchst. c (ii) SE-VO i.V.m. § 106 AktG."
    },
    {
      "date": "2025-01-04",
      "id": "97815",
      "original_text": "Registerbekanntmachung nach dem Umwandlungsgesetz\nBayern Amtsgericht München HRB 65177\nGIEAG Projekt 180 GmbH – Oberhaching",
      "type": "Registerbekanntmachung nach dem Umwandlungsgesetz",
      "state": "Bayern",
      "amtsgericht": "Amtsgericht München",
      "registernummer": "HRB 65177",
      "registerart": "HRB",
      "company_name": "GIEAG Projekt 180 GmbH",
      "company_seat": "Oberhaching",
      "details": "04.01.2025 (Bekanntmachungsdatum)\n\nBayern Amtsgericht München HRB 65177\nRegisterbekanntmachung nach dem Umwandlungsgesetz 03.01.2025 (Eintragungsdatum)\n\nGIEAG Projekt 180 GmbH\nGesellschaft mit beschränkter Haftung\nOberhaching\n\nDen Gläubigern der an der Verschmelzung beteiligten Rechtsträger ist, wenn sie binnen sechs Monaten nach dem Tag, an dem die Eintragung der Verschmelzung in das Register des Sitzes desjenigen Rechtsträgers, dessen Gläubiger sie sind, nach § 19 Abs. 3 UmwG als bekannt gemacht gilt, ihren Anspruch nach Grund und Höhe in Textform anmelden, Sicherheit zu leisten, soweit sie nicht Befriedigung verlangen können. Dieses Recht steht den Gläubigern jedoch nur zu, wenn sie glaubhaft machen, dass durch die Verschmelzung die Erfüllung ihrer Forderung gefährdet wird."
    },
    {
      "date": "2025-01-04",
      "id": "97816",
      "original_text": "Sonstige Registerbekanntmachung\nBayern Amtsgericht München HRB 199862\nCamping Erlebnis Zugspitze GmbH – Grainau",
      "type": "Sonstige Registerbekanntmachung",
      "state": "Bayern",
      "amtsgericht": "Amtsgericht München",
      "registernummer": "HRB 199862",
      "registerart": "HRB",
      "company_name": "Camping Erlebnis Zugspitze GmbH",
      "company_seat": "Grainau",
      "details": "04.01.2025 (Bekanntmachungsdatum)\n\nBayern Amtsgericht München HRB 199862\nSonstige Registerbekanntmachung 03.01.2025 (Eintragungsdatum)\n\nCamping Erlebnis Zugspitze GmbH\nGesellschaft mit beschränkter Haftung\nGrainau\n\nDen Gläubigern der Gesellschaft, deren Forderungen begründet worden sind, bevor die Eintragung der Beendigung des Gewinnabführungsvertrages in das Handelsregister nach § 10 des Handelsgesetzbuches als bekanntgemacht gilt, hat der andere Vertragsteil Sicherheit zu leisten, wenn sie sich binnen sechs Monaten nach der Bekanntmachung der Eintragung zu diesem Zweck bei ihm melden."
    },
    {
      "date": "2025-01-04",
      "id": "97817",
      "original_text": "Löschungsankündigung\nBayern Amtsgericht Bayreuth VR 10328\nFörderverein des Spiel- und Sportvereins Kasendorf e.V. – Kasendorf",
      "type": "Löschungsankündigung",
      "state": "Bayern",
      "amtsgericht": "Amtsgericht Bayreuth",
      "registernummer": "VR 10328",
      "registerart": "VR",
      "company_name": "Förderverein des Spiel- und Sportvereins Kasendorf e.V.",
      "company_seat": "Kasendorf",
      "details": "04.01.2025 (Bekanntmachungsdatum)\n\nBayern Amtsgericht Bayreuth VR 10328\nLöschungsankündigung\n\nFörderverein des Spiel- und Sportvereins Kasendorf e.V.\neingetragener Verein\nKasendorf\n\nDas Registergericht beabsichtigt, den im Vereinsregister eingetragenen Verein von Amts wegen nach  § 395 FamFG zu löschen. Die Frist zur Erhebung eines Widerspruchs ist auf einen Monat festgesetzt."
    },
    {
      "date": "2025-01-04",
      "id": "97818",
      "original_text": "Löschungsankündigung\nBayern Amtsgericht Bayreuth VR 10328\nFörderverein des Spiel- und Sportvereins Kasendorf e.V. – Kasendorf",
      "type": "Löschungsankündigung",
      "state": "Bayern",
      "amtsgericht": "Amtsgericht Bayreuth",
      "registernummer": "VR 10328",
      "registerart": "VR",
      "company_name": "Förderverein des Spiel- und Sportvereins Kasendorf e.V.",
      "company_seat": "Kasendorf",
      "details": "04.01.2025 (Bekanntmachungsdatum)\n\nBayern Amtsgericht Bayreuth VR 10328\nLöschungsankündigung\n\nFörderverein des Spiel- und Sportvereins Kasendorf e.V.\neingetragener Verein\nKasendorf\n\nDas Registergericht beabsichtigt, den im Vereinsregister eingetragenen Verein von Amts wegen nach § 395 FamFG zu löschen. Die Frist zur Erhebung eines Widerspruchs ist auf einen Monat festgesetzt."
    },
    {
      "date": "2025-01-04",
      "id": "97819",
      "original_text": "Registerbekanntmachung nach dem Umwandlungsgesetz\nBayern Amtsgericht Regensburg HRB 12360\nLensing-Wolff Verwaltungsgesellschaft mbH – Neutraubling",
      "type": "Registerbekanntmachung nach dem Umwandlungsgesetz",
      "state": "Bayern",
      "amtsgericht": "Amtsgericht Regensburg",
      "registernummer": "HRB 12360",
      "registerart": "HRB",
      "company_name": "Lensing-Wolff Verwaltungsgesellschaft mbH",
      "company_seat": "Neutraubling",
      "details": "04.01.2025 (Bekanntmachungsdatum)\n\nBayern Amtsgericht Regensburg HRB 12360\nRegisterbekanntmachung nach dem Umwandlungsgesetz 03.01.2025 (Eintragungsdatum)\n\nLensing-Wolff Verwaltungsgesellschaft mbH\nGesellschaft mit beschränkter Haftung\nNeutraubling\n\nDen Gläubigern der an der Verschmelzung beteiligten Rechtsträger ist, wenn sie binnen sechs Monaten nach dem Tag, an dem die Eintragung der Verschmelzung in das Register des Sitzes desjenigen Rechtsträgers, dessen Gläubiger sie sind, nach § 19 Abs. 3 UmwG als bekannt gemacht gilt, ihren Anspruch nach Grund und Höhe in Textform anmelden, Sicherheit zu leisten, soweit sie nicht Befriedigung verlangen können. Dieses Recht steht den Gläubigern jedoch nur zu, wenn sie glaubhaft machen, dass durch die Verschmelzung die Erfüllung ihrer Forderung gefährdet wird."
    },
    {
      "date": "2025-01-04",
      "id": "97820",
      "original_text": "Sonstige Registerbekanntmachung\nBayern Amtsgericht München HRB 253005\nZONEGREEN GmbH – München",
      "type": "Sonstige Registerbekanntmachung",
      "state": "Bayern",
      "amtsgericht": "Amtsgericht München",
      "registernummer": "HRB 253005",
      "registerart": "HRB",
      "company_name": "ZONEGREEN GmbH",
      "company_seat": "München",
      "details": "04.01.2025 (Bekanntmachungsdatum)\n\nBayern Amtsgericht München HRB 253005\nSonstige Registerbekanntmachung 03.01.2025 (Eintragungsdatum)\n\nZONEGREEN GmbH\nGesellschaft mit beschränkter Haftung\nMünchen\n\nDen Gläubigern der Gesellschaft, deren Forderungen begründet worden sind, bevor die Eintragung der Beendigung des Beherrschungs- und Gewinnabführungsvertrages in das Handelsregister nach § 10 des Handelsgesetzbuches als bekanntgemacht gilt, hat der andere Vertragsteil Sicherheit zu leisten, wenn sie sich binnen sechs Monaten nach der Bekanntmachung der Eintragung zu diesem Zweck bei ihm melden."
    },
    {
      "date": "2025-01-04",
      "id": "97821",
      "original_text": "Sonstige Registerbekanntmachung\nBayern Amtsgericht München HRB 119479\nDokumentations- und Informationszentrum München GmbH – München",
      "type": "Sonstige Registerbekanntmachung",
      "state": "Bayern",
      "amtsgericht": "Amtsgericht München",
      "registernummer": "HRB 119479",
      "registerart": "HRB",
      "company_name": "Dokumentations- und Informationszentrum München GmbH",
      "company_seat": "München",
      "details": "04.01.2025 (Bekanntmachungsdatum)\n\nBayern Amtsgericht München HRB 119479\nSonstige Registerbekanntmachung 03.01.2025 (Eintragungsdatum)\n\nDokumentations- und Informationszentrum München GmbH\nGesellschaft mit beschränkter Haftung\nMünchen\n\nDen Gläubigern der Gesellschaft, deren Forderungen begründet worden sind, bevor die Eintragung der Beendigung des Beherrschungs- und Gewinnabführungsvertrages in das Handelsregister nach § 10 des Handelsgesetzbuches als bekanntgemacht gilt, hat der andere Vertragsteil Sicherheit zu leisten, wenn sie sich binnen sechs Monaten nach der Bekanntmachung der Eintragung zu diesem Zweck bei ihm melden."
    },
    {
      "date": "2025-01-04",
      "id": "97822",
      "original_text": "Löschungsankündigung\nBayern Amtsgericht München HRB 157080\nM.K.S. Gastro GmbH – München",
      "type": "Löschungsankündigung",
      "state": "Bayern",
      "amtsgericht": "Amtsgericht München",
      "registernummer": "HRB 157080",
      "registerart": "HRB",
      "company_name": "M.K.S. Gastro GmbH",
      "company_seat": "München",
      "details": "04.01.2025 (Bekanntmachungsdatum)\n\nBayern Amtsgericht München HRB 157080\nLöschungsankündigung 03.01.2025 (Eintragungsdatum)\n\nM.K.S. Gastro GmbH\nGesellschaft mit beschränkter Haftung\nMünchen\n\nDas Registergericht beabsichtigt, die im Handelsregister eingetragene Gesellschaft wegen Vermögenslosigkeit von Amts wegen nach § 394 FamFG zu löschen. Die Frist zur Erhebung eines Widerspruchs ist auf drei Monate festgesetzt."
    },
    {
      "date": "2025-01-04",
      "id": "97823",
      "original_text": "Sonstige Registerbekanntmachung\nBayern Amtsgericht Schweinfurt HRB 8067\nHydroelektra Turbinen UG (haftungsbeschränkt) – Kolitzheim",
      "type": "Sonstige Registerbekanntmachung",
      "state": "Bayern",
      "amtsgericht": "Amtsgericht Schweinfurt",
      "registernummer": "HRB 8067",
      "registerart": "HRB",
      "company_name": "Hydroelektra Turbinen UG (haftungsbeschränkt)",
      "company_seat": "Kolitzheim",
      "details": "04.01.2025 (Bekanntmachungsdatum)\n\nBayern Amtsgericht Schweinfurt HRB 8067\nSonstige Registerbekanntmachung 03.01.2025 (Eintragungsdatum)\n\nHydroelektra Turbinen UG (haftungsbeschränkt)\nGesellschaft mit beschränkter Haftung\nKolitzheim\n\nDen Gläubigern der Gesellschaft, deren Forderungen begründet worden sind, bevor die Eintragung der Beendigung des Beherrschungs- und Gewinnabführungsvertrages in das Handelsregister nach § 10 des Handelsgesetzbuches als bekanntgemacht gilt, hat der andere Vertragsteil Sicherheit zu leisten, wenn sie sich binnen sechs Monaten nach der Bekanntmachung der Eintragung zu diesem Zweck bei ihm melden."
    },
    {
      "date": "2025-01-04",
      "id": "97824",
      "original_text": "Registerbekanntmachung nach dem Umwandlungsgesetz\nBayern Amtsgericht Nürnberg HRB 42685\nBlended Clinic AI GmbH – Nürnberg",
      "type": "Registerbekanntmachung nach dem Umwandlungsgesetz",
      "state": "Bayern",
      "amtsgericht": "Amtsgericht Nürnberg",
      "registernummer": "HRB 42685",
      "registerart": "HRB",
      "company_name": "Blended Clinic AI GmbH",
      "company_seat": "Nürnberg",
      "details": "04.01.2025 (Bekanntmachungsdatum)\n\nBayern Amtsgericht Nürnberg HRB 42685\nRegisterbekanntmachung nach dem Umwandlungsgesetz 03.01.2025 (Eintragungsdatum)\n\nBlended Clinic AI GmbH\nGesellschaft mit beschränkter Haftung\nNürnberg\n\nDen Gläubigern der an der Verschmelzung beteiligten Rechtsträger ist, wenn sie binnen sechs Monaten nach dem Tag, an dem die Eintragung der Verschmelzung in das Register des Sitzes desjenigen Rechtsträgers, dessen Gläubiger sie sind, nach § 19 Abs. 3 UmwG als bekannt gemacht gilt, ihren Anspruch nach Grund und Höhe in Textform anmelden, Sicherheit zu leisten, soweit sie nicht Befriedigung verlangen können. Dieses Recht steht den Gläubigern jedoch nur zu, wenn sie glaubhaft machen, dass durch die Verschmelzung die Erfüllung ihrer Forderung gefährdet wird."
    },
    {
      "date": "2025-01-04",
      "id": "97825",
      "original_text": "Registerbekanntmachung nach dem Umwandlungsgesetz\nBayern Amtsgericht München HRB 224975\nGIEAG Development GmbH – Oberhaching",
      "type": "Registerbekanntmachung nach dem Umwandlungsgesetz",
      "state": "Bayern",
      "amtsgericht": "Amtsgericht München",
      "registernummer": "HRB 224975",
      "registerart": "HRB",
      "company_name": "GIEAG Development GmbH",
      "company_seat": "Oberhaching",
      "details": "04.01.2025 (Bekanntmachungsdatum)\n\nBayern Amtsgericht München HRB 224975\nRegisterbekanntmachung nach dem Umwandlungsgesetz 03.01.2025 (Eintragungsdatum)\n\nGIEAG Development GmbH\nGesellschaft mit beschränkter Haftung\nOberhaching\n\nDen Gläubigern der an der Verschmelzung beteiligten Rechtsträger ist, wenn sie binnen sechs Monaten nach dem Tag, an dem die Eintragung der Verschmelzung in das Register des Sitzes desjenigen Rechtsträgers, dessen Gläubiger sie sind, nach § 19 Abs. 3 UmwG als bekannt gemacht gilt, ihren Anspruch nach Grund und Höhe in Textform anmelden, Sicherheit zu leisten, soweit sie nicht Befriedigung verlangen können. Dieses Recht steht den Gläubigern jedoch nur zu, wenn sie glaubhaft machen, dass durch die Verschmelzung die Erfüllung ihrer Forderung gefährdet wird."
    },
    {
      "date": "2025-01-04",
      "id": "97826",
      "original_text": "Sonstige Registerbekanntmachung\nBayern Amtsgericht München HRB 226411\nSenioren- und Fachpflegezentrum GmbH (Gretel-Egner-Haus) – München",
      "type": "Sonstige Registerbekanntmachung",
      "state": "Bayern",
      "amtsgericht": "Amtsgericht München",
      "registernummer": "HRB 226411",
      "registerart": "HRB",
      "company_name": "Senioren- und Fachpflegezentrum GmbH (Gretel-Egner-Haus)",
      "company_seat": "München",
      "details": "04.01.2025 (Bekanntmachungsdatum)\n\nBayern Amtsgericht München HRB 226411\nSonstige Registerbekanntmachung 03.01.2025 (Eintragungsdatum)\n\nSenioren- und Fachpflegezentrum GmbH (Gretel-Egner-Haus)\nGesellschaft mit beschränkter Haftung\nMünchen\n\nDen Gläubigern der Gesellschaft, deren Forderungen begründet worden sind, bevor die Eintragung der Beendigung des Beherrschungs- und Gewinnabführungsvertrages in das Handelsregister nach § 10 des Handelsgesetzbuches als bekanntgemacht gilt, hat der andere Vertragsteil Sicherheit zu leisten, wenn sie sich binnen sechs Monaten nach der Bekanntmachung der Eintragung zu diesem Zweck bei ihm melden."
    },
    {
      "date": "2025-01-04",
      "id": "97827",
      "original_text": "Sonstige Registerbekanntmachung\nBayern Amtsgericht München HRB 281712\nBest Secret Group SE – Aschheim",
      "type": "Sonstige Registerbekanntmachung",
      "state": "Bayern",
      "amtsgericht": "Amtsgericht München",
      "registernummer": "HRB 281712",
      "registerart": "HRB",
      "company_name": "Best Secret Group SE",
      "company_seat": "Aschheim",
      "details": "04.01.2025 (Bekanntmachungsdatum)\n\nBayern Amtsgericht München HRB 281712\nSonstige Registerbekanntmachung 03.01.2025 (Eintragungsdatum)\n\nBest Secret Group SE\nEuropäische Aktiengesellschaft (SE)\nAschheim\n\nDen Gläubigern der Gesellschaft, deren Forderungen begründet worden sind, bevor die Eintragung der Beendigung des Beherrschungsvertrages in das Handelsregister nach § 10 des Handelsgesetzbuches als bekanntgemacht gilt, hat der andere Vertragsteil Sicherheit zu leisten, wenn sie sich binnen sechs Monaten nach der Bekanntmachung der Eintragung zu diesem Zweck bei ihm melden."
    },
    {
      "date": "2025-01-04",
      "id": "97828",
      "original_text": "Registerbekanntmachung nach dem Umwandlungsgesetz\nBayern Amtsgericht Nürnberg HRB 43925\nDAIG 18. Objektgesellschaft mbH – Nürnberg",
      "type": "Registerbekanntmachung nach dem Umwandlungsgesetz",
      "state": "Bayern",
      "amtsgericht": "Amtsgericht Nürnberg",
      "registernummer": "HRB 43925",
      "registerart": "HRB",
      "company_name": "DAIG 18. Objektgesellschaft mbH",
      "company_seat": "Nürnberg",
      "details": "04.01.2025 (Bekanntmachungsdatum)\n\nBayern Amtsgericht Nürnberg HRB 43925\nRegisterbekanntmachung nach dem Umwandlungsgesetz 03.01.2025 (Eintragungsdatum)\n\nDAIG 18. Objektgesellschaft mbH\nGesellschaft mit beschränkter Haftung\nNürnberg\n\nDen Gläubigern des formwechselnden Rechtsträgers ist, wenn sie binnen sechs Monaten nach dem Tag, an dem die Eintragung des Formwechsels nach § 201 UmwG als bekannt gemacht gilt, ihren Anspruch nach Grund und Höhe in Textform anmelden, Sicherheit zu leisten, soweit sie nicht Befriedigung verlangen können. Dieses Recht steht den Gläubigern jedoch nur zu, wenn sie glaubhaft machen, dass durch den Formwechsel die Erfüllung ihrer Forderung gefährdet wird."
    },
    {
      "date": "2025-01-04",
      "id": "97829",
      "original_text": "Sonstige Registerbekanntmachung\nBayern Amtsgericht München HRB 179635\nSana Immobilien Service GmbH – Ismaning",
      "type": "Sonstige Registerbekanntmachung",
      "state": "Bayern",
      "amtsgericht": "Amtsgericht München",
      "registernummer": "HRB 179635",
      "registerart": "HRB",
      "company_name": "Sana Immobilien Service GmbH",
      "company_seat": "Ismaning",
      "details": "04.01.2025 (Bekanntmachungsdatum)\n\nBayern Amtsgericht München HRB 179635\nSonstige Registerbekanntmachung 03.01.2025 (Eintragungsdatum)\n\nSana Immobilien Service GmbH\nGesellschaft mit beschränkter Haftung\nIsmaning\n\nDen Gläubigern der Gesellschaft, deren Forderungen begründet worden sind, bevor die Eintragung der Beendigung des Gewinnabführungsvertrages in das Handelsregister nach § 10 des Handelsgesetzbuches als bekanntgemacht gilt, hat der andere Vertragsteil Sicherheit zu leisten, wenn sie sich binnen sechs Monaten nach der Bekanntmachung der Eintragung zu diesem Zweck bei ihm melden."
    },
    {
      "date": "2025-01-04",
      "id": "97830",
      "original_text": "Registerbekanntmachung nach dem Umwandlungsgesetz\nSchleswig-Holstein Amtsgericht Lübeck HRB 10503\nSinus Nachrichtentechnik GmbH – Barsbüttel",
      "type": "Registerbekanntmachung nach dem Umwandlungsgesetz",
      "state": "Schleswig-Holstein",
      "amtsgericht": "Amtsgericht Lübeck",
      "registernummer": "HRB 10503",
      "registerart": "HRB",
      "company_name": "Sinus Nachrichtentechnik GmbH",
      "company_seat": "Barsbüttel",
      "details": "04.01.2025 (Bekanntmachungsdatum)\n\nSchleswig-Holstein Amtsgericht Lübeck HRB 10503\nRegisterbekanntmachung nach dem Umwandlungsgesetz 02.01.2025 (Eintragungsdatum)\n\nSinus Nachrichtentechnik GmbH\nGesellschaft mit beschränkter Haftung\nBarsbüttel\n\nAls nicht eingetragen wird veröffentlicht: Den Gläubigern der an der Verschmelzung beteiligten Rechtsträger ist, wenn sie binnen sechs Monaten nach dem Tag, an dem die Eintragung der Verschmelzung in das Register des Sitzes desjenigen Rechtsträgers, dessen Gläubiger sie sind, als bekannt gemacht gilt, ihren Anspruch nach Grund und Höhe schriftlich anmelden, Sicherheit zu leisten, soweit sie nicht Befriedigung verlangen können. Dieses Recht steht den Gläubigern jedoch nur zu, wenn sie glaubhaft machen, dass durch die Verschmelzung die Erfüllung ihrer Forderung gefährdet wird."
    }
  ]
}