{
  "date": "2025-01-24",
  "date_of_scrape": "2025-01-25T04:06:22.309Z",
  "tool_version": "0.2.0",
  "number_of_announcements": 112,
  "announcements": [
    {
      "date": "2025-01-24",
      "id": "71",
      "original_text": "Sonderregisterbekanntmachung OHNE Bezug zum elektr. Register\nBrandenburg Amtsgericht Neuruppin\nHRB 9975 NP\nWohnbauten GmbH Schwedt/Oder",
      "type": "Sonderregisterbekanntmachung OHNE Bezug zum elektr. Register",
      "state": "Brandenburg",
      "amtsgericht": "Amtsgericht Neuruppin",
      "company_name": "Wohnbauten GmbH Schwedt/Oder",
      "sonderegister_referenz": "HRB 9975 NP",
      "details": "24.01.2025 (Bekanntmachungsdatum)\n\nBrandenburg Amtsgericht Neuruppin\nHRB 9975 NP\nSonderregisterbekanntmachung OHNE Bezug zum elektr. Register\n\nWohnbauten GmbH Schwedt/Oder\n\nAls nicht eingetragen wird bekannt gemacht:\nEine Liste der Mitglieder des Aufsichtsrates wurde zum Handelsregister eingereicht."
    },
    {
      "date": "2025-01-24",
      "id": "99461",
      "original_text": "Registerbekanntmachung nach dem Umwandlungsgesetz\nBayern Amtsgericht München HRB 167317\nH. Becks Immobilien GmbH – München",
      "type": "Registerbekanntmachung nach dem Umwandlungsgesetz",
      "state": "Bayern",
      "amtsgericht": "Amtsgericht München",
      "registernummer": "HRB 167317",
      "registerart": "HRB",
      "company_name": "H. Becks Immobilien GmbH",
      "company_seat": "München",
      "details": "24.01.2025 (Bekanntmachungsdatum)\n\nBayern Amtsgericht München HRB 167317\nRegisterbekanntmachung nach dem Umwandlungsgesetz 23.01.2025 (Eintragungsdatum)\n\nH. Becks Immobilien GmbH\nGesellschaft mit beschränkter Haftung\nMünchen\n\nDen Gläubigern der an der Verschmelzung beteiligten Rechtsträger ist, wenn sie binnen sechs Monaten nach dem Tag, an dem die Eintragung der Verschmelzung in das Register des Sitzes desjenigen Rechtsträgers, dessen Gläubiger sie sind, nach § 19 Abs. 3 UmwG als bekannt gemacht gilt, ihren Anspruch nach Grund und Höhe in Textform anmelden, Sicherheit zu leisten, soweit sie nicht Befriedigung verlangen können. Dieses Recht steht den Gläubigern jedoch nur zu, wenn sie glaubhaft machen, dass durch die Verschmelzung die Erfüllung ihrer Forderung gefährdet wird."
    },
    {
      "date": "2025-01-24",
      "id": "99462",
      "original_text": "Einreichung neuer Dokumente\nBayern Amtsgericht Augsburg HRB 31776\nGreiffenberger Aktiengesellschaft – Augsburg",
      "type": "Einreichung neuer Dokumente",
      "state": "Bayern",
      "amtsgericht": "Amtsgericht Augsburg",
      "registernummer": "HRB 31776",
      "registerart": "HRB",
      "company_name": "Greiffenberger Aktiengesellschaft",
      "company_seat": "Augsburg",
      "details": "24.01.2025 (Bekanntmachungsdatum)\n\nBayern Amtsgericht Augsburg HRB 31776\nEinreichung neuer Dokumente\n\nGreiffenberger Aktiengesellschaft\nAktiengesellschaft\nAugsburg\n\nDem Amtsgericht Augsburg -Registergericht- ist eine Liste der Mitglieder des Aufsichtsrats eingereicht worden, § 106 AktG."
    },
    {
      "date": "2025-01-24",
      "id": "99463",
      "original_text": "Löschungsankündigung\nBayern Amtsgericht Nürnberg HRB 30014\nHeinz D. Ritter UG (haftungsbeschränkt) – Nürnberg",
      "type": "Löschungsankündigung",
      "state": "Bayern",
      "amtsgericht": "Amtsgericht Nürnberg",
      "registernummer": "HRB 30014",
      "registerart": "HRB",
      "company_name": "Heinz D. Ritter UG (haftungsbeschränkt)",
      "company_seat": "Nürnberg",
      "details": "24.01.2025 (Bekanntmachungsdatum)\n\nBayern Amtsgericht Nürnberg HRB 30014\nLöschungsankündigung\n\nHeinz D. Ritter UG (haftungsbeschränkt)\nGesellschaft mit beschränkter Haftung\nNürnberg\n\nDas Registergericht beabsichtigt, die im Handelsregister eingetragene Gesellschaft wegen Vermögenslosigkeit von Amts wegen nach § 394 FamFG zu löschen. Die Frist zur Erhebung eines Widerspruchs ist auf drei Monate festgesetzt."
    },
    {
      "date": "2025-01-24",
      "id": "99464",
      "original_text": "Registerbekanntmachung nach dem Umwandlungsgesetz\nBayern Amtsgericht Coburg HRB 7452\nEndress+Hauser Flow Deutschland GmbH – Coburg",
      "type": "Registerbekanntmachung nach dem Umwandlungsgesetz",
      "state": "Bayern",
      "amtsgericht": "Amtsgericht Coburg",
      "registernummer": "HRB 7452",
      "registerart": "HRB",
      "company_name": "Endress+Hauser Flow Deutschland GmbH",
      "company_seat": "Coburg",
      "details": "24.01.2025 (Bekanntmachungsdatum)\n\nBayern Amtsgericht Coburg HRB 7452\nRegisterbekanntmachung nach dem Umwandlungsgesetz 21.01.2025 (Eintragungsdatum)\n\nEndress+Hauser Flow Deutschland GmbH\nGesellschaft mit beschränkter Haftung\nCoburg\n\nDen Gläubigern des formwechselnden Rechtsträgers ist, wenn sie binnen sechs Monaten nach dem Tag, an dem die Eintragung des Formwechsels nach § 201 UmwG als bekannt gemacht gilt, ihren Anspruch nach Grund und Höhe in Textform anmelden, Sicherheit zu leisten, soweit sie nicht Befriedigung verlangen können. Dieses Recht steht den Gläubigern jedoch nur zu, wenn sie glaubhaft machen, dass durch den Formwechsel die Erfüllung ihrer Forderung gefährdet wird."
    },
    {
      "date": "2025-01-24",
      "id": "99465",
      "original_text": "Löschungsankündigung\nBayern Amtsgericht Nürnberg HRB 30839\nLUCA TRANS DEUTSCHLAND LTD. Niederlassung in Deutschland – Nürnberg",
      "type": "Löschungsankündigung",
      "state": "Bayern",
      "amtsgericht": "Amtsgericht Nürnberg",
      "registernummer": "HRB 30839",
      "registerart": "HRB",
      "company_name": "LUCA TRANS DEUTSCHLAND LTD. Niederlassung in Deutschland",
      "company_seat": "Nürnberg",
      "details": "24.01.2025 (Bekanntmachungsdatum)\n\nBayern Amtsgericht Nürnberg HRB 30839\nLöschungsankündigung\n\nLUCA TRANS DEUTSCHLAND LTD. Niederlassung in Deutschland\nRechtsform ausländischen Rechts HRB\nNürnberg\n\nDas Registergericht beabsichtigt, die im Handelsregister eingetragene Gesellschaft wegen Vermögenslosigkeit von Amts wegen nach § 394 FamFG zu löschen. Die Frist zur Erhebung eines Widerspruchs ist auf einen Monat festgesetzt."
    },
    {
      "date": "2025-01-24",
      "id": "99466",
      "original_text": "Löschungsankündigung\nBayern Amtsgericht Nürnberg HRB 30839\nLUCA TRANS DEUTSCHLAND LTD. Niederlassung in Deutschland – Nürnberg",
      "type": "Löschungsankündigung",
      "state": "Bayern",
      "amtsgericht": "Amtsgericht Nürnberg",
      "registernummer": "HRB 30839",
      "registerart": "HRB",
      "company_name": "LUCA TRANS DEUTSCHLAND LTD. Niederlassung in Deutschland",
      "company_seat": "Nürnberg",
      "details": "24.01.2025 (Bekanntmachungsdatum)\n\nBayern Amtsgericht Nürnberg HRB 30839\nLöschungsankündigung\n\nLUCA TRANS DEUTSCHLAND LTD. Niederlassung in Deutschland\nRechtsform ausländischen Rechts HRB\nNürnberg\n\nDas Registergericht beabsichtigt, die im Handelsregister eingetragene Gesellschaft wegen Vermögenslosigkeit von Amts wegen nach § 394 FamFG zu löschen. Die Frist zur Erhebung eines Widerspruchs ist auf einen Monat festgesetzt."
    },
    {
      "date": "2025-01-24",
      "id": "99467",
      "original_text": "Einreichung neuer Dokumente\nBayern Amtsgericht Ingolstadt HRB 7176\nIDEENION Automobil AG – Gaimersheim",
      "type": "Einreichung neuer Dokumente",
      "state": "Bayern",
      "amtsgericht": "Amtsgericht Ingolstadt",
      "registernummer": "HRB 7176",
      "registerart": "HRB",
      "company_name": "IDEENION Automobil AG",
      "company_seat": "Gaimersheim",
      "details": "24.01.2025 (Bekanntmachungsdatum)\n\nBayern Amtsgericht Ingolstadt HRB 7176\nEinreichung neuer Dokumente 23.01.2025 (Eintragungsdatum)\n\nIDEENION Automobil AG\nAktiengesellschaft\nGaimersheim\n\nDem Registergericht Ingolstadt ist eine Liste der Mitglieder des Aufsichtsrats eingereicht worden, § 106 AktG."
    },
    {
      "date": "2025-01-24",
      "id": "99468",
      "original_text": "Löschungsankündigung\nBayern Amtsgericht Nürnberg HRB 28508\nAnnette Weber GmbH Personaldienstleistungen – Neumarkt",
      "type": "Löschungsankündigung",
      "state": "Bayern",
      "amtsgericht": "Amtsgericht Nürnberg",
      "registernummer": "HRB 28508",
      "registerart": "HRB",
      "company_name": "Annette Weber GmbH Personaldienstleistungen",
      "company_seat": "Neumarkt",
      "details": "24.01.2025 (Bekanntmachungsdatum)\n\nBayern Amtsgericht Nürnberg HRB 28508\nLöschungsankündigung\n\nAnnette Weber GmbH Personaldienstleistungen\nGesellschaft mit beschränkter Haftung\nNeumarkt\n\nDas Registergericht beabsichtigt, die im Handelsregister eingetragene Gesellschaft wegen Vermögenslosigkeit von Amts wegen nach § 394 FamFG zu löschen. Die Frist zur Erhebung eines Widerspruchs ist auf einen Monat festgesetzt."
    },
    {
      "date": "2025-01-24",
      "id": "99469",
      "original_text": "Sonstige Registerbekanntmachung\nBayern Amtsgericht München HRB 184650\nPaulaner Vertriebsgesellschaft mbH – München",
      "type": "Sonstige Registerbekanntmachung",
      "state": "Bayern",
      "amtsgericht": "Amtsgericht München",
      "registernummer": "HRB 184650",
      "registerart": "HRB",
      "company_name": "Paulaner Vertriebsgesellschaft mbH",
      "company_seat": "München",
      "details": "24.01.2025 (Bekanntmachungsdatum)\n\nBayern Amtsgericht München HRB 184650\nSonstige Registerbekanntmachung 23.01.2025 (Eintragungsdatum)\n\nPaulaner Vertriebsgesellschaft mbH\nGesellschaft mit beschränkter Haftung\nMünchen\n\nDen Gläubigern der Gesellschaft, deren Forderungen begründet worden sind, bevor die Eintragung der Beendigung des Gewinnabführungsvertrages in das Handelsregister nach § 10 des Handelsgesetzbuches als bekanntgemacht gilt, hat der andere Vertragsteil Sicherheit zu leisten, wenn sie sich binnen sechs Monaten nach der Bekanntmachung der Eintragung zu diesem Zweck bei ihm melden."
    },
    {
      "date": "2025-01-24",
      "id": "99470",
      "original_text": "Einreichung neuer Dokumente\nBayern Amtsgericht Bayreuth HRB 4324\nStadtwerke Bayreuth Energiehandel GmbH – Bayreuth",
      "type": "Einreichung neuer Dokumente",
      "state": "Bayern",
      "amtsgericht": "Amtsgericht Bayreuth",
      "registernummer": "HRB 4324",
      "registerart": "HRB",
      "company_name": "Stadtwerke Bayreuth Energiehandel GmbH",
      "company_seat": "Bayreuth",
      "details": "24.01.2025 (Bekanntmachungsdatum)\n\nBayern Amtsgericht Bayreuth HRB 4324\nEinreichung neuer Dokumente\n\nStadtwerke Bayreuth Energiehandel GmbH\nGesellschaft mit beschränkter Haftung\nBayreuth\n\nDem Amtsgericht Bayreuth -Registergericht- ist eine Liste der Mitglieder des Aufsichtsrats eingereicht worden, § 52 Abs. 3 S. 2 GmbHG."
    },
    {
      "date": "2025-01-24",
      "id": "99471",
      "original_text": "Löschungsankündigung\nBayern Amtsgericht Nürnberg HRB 40420\nBF3 Bayern STB UG (haftungsbeschränkt) – Hilpoltstein",
      "type": "Löschungsankündigung",
      "state": "Bayern",
      "amtsgericht": "Amtsgericht Nürnberg",
      "registernummer": "HRB 40420",
      "registerart": "HRB",
      "company_name": "BF3 Bayern STB UG (haftungsbeschränkt)",
      "company_seat": "Hilpoltstein",
      "details": "24.01.2025 (Bekanntmachungsdatum)\n\nBayern Amtsgericht Nürnberg HRB 40420\nLöschungsankündigung\n\nBF3 Bayern STB UG (haftungsbeschränkt)\nGesellschaft mit beschränkter Haftung\nHilpoltstein\n\nDas Registergericht beabsichtigt, die im Handelsregister eingetragene Gesellschaft wegen Vermögenslosigkeit von Amts wegen nach § 394 FamFG zu löschen. Die Frist zur Erhebung eines Widerspruchs ist auf drei Monate festgesetzt."
    },
    {
      "date": "2025-01-24",
      "id": "99472",
      "original_text": "Registerbekanntmachung nach dem Umwandlungsgesetz\nBayern Amtsgericht München HRA 110775\nAmRest DE Sp. z o.o. & Co. KG – München",
      "type": "Registerbekanntmachung nach dem Umwandlungsgesetz",
      "state": "Bayern",
      "amtsgericht": "Amtsgericht München",
      "registernummer": "HRA 110775",
      "registerart": "HRA",
      "company_name": "AmRest DE Sp. z o.o. & Co. KG",
      "company_seat": "München",
      "details": "24.01.2025 (Bekanntmachungsdatum)\n\nBayern Amtsgericht München HRA 110775\nRegisterbekanntmachung nach dem Umwandlungsgesetz 23.01.2025 (Eintragungsdatum)\n\nAmRest DE Sp. z o.o. & Co. KG\nKommanditgesellschaft\nMünchen\n\nDen Gläubigern der an der Verschmelzung beteiligten Rechtsträger ist, wenn sie binnen sechs Monaten nach dem Tag, an dem die Eintragung der Verschmelzung in das Register des Sitzes desjenigen Rechtsträgers, dessen Gläubiger sie sind, nach § 19 Abs. 3 UmwG als bekannt gemacht gilt, ihren Anspruch nach Grund und Höhe in Textform anmelden, Sicherheit zu leisten, soweit sie nicht Befriedigung verlangen können. Dieses Recht steht den Gläubigern jedoch nur zu, wenn sie glaubhaft machen, dass durch die Verschmelzung die Erfüllung ihrer Forderung gefährdet wird."
    },
    {
      "date": "2025-01-24",
      "id": "99473",
      "original_text": "Löschungsankündigung\nBayern Amtsgericht Nürnberg HRB 36907\nAvill-Bau GmbH – Nürnberg",
      "type": "Löschungsankündigung",
      "state": "Bayern",
      "amtsgericht": "Amtsgericht Nürnberg",
      "registernummer": "HRB 36907",
      "registerart": "HRB",
      "company_name": "Avill-Bau GmbH",
      "company_seat": "Nürnberg",
      "details": "24.01.2025 (Bekanntmachungsdatum)\n\nBayern Amtsgericht Nürnberg HRB 36907\nLöschungsankündigung\n\nAvill-Bau GmbH\nGesellschaft mit beschränkter Haftung\nNürnberg\n\nDas Registergericht beabsichtigt, den im Handelsregister eingetragenen Geschäftsführer wegen fehlender Eignung nach § 395 FamFG zu löschen. Die Frist zur Erhebung eines Widerspruchs ist auf sechs Wochen festgesetzt."
    },
    {
      "date": "2025-01-24",
      "id": "99474",
      "original_text": "Löschungsankündigung\nBayern Amtsgericht München HRB 240769\nNarrenfreiheit GmbH – München",
      "type": "Löschungsankündigung",
      "state": "Bayern",
      "amtsgericht": "Amtsgericht München",
      "registernummer": "HRB 240769",
      "registerart": "HRB",
      "company_name": "Narrenfreiheit GmbH",
      "company_seat": "München",
      "details": "24.01.2025 (Bekanntmachungsdatum)\n\nBayern Amtsgericht München HRB 240769\nLöschungsankündigung\n\nNarrenfreiheit GmbH\nGesellschaft mit beschränkter Haftung\nMünchen\n\nDas Registergericht beabsichtigt, die im Handelsregister eingetragene Gesellschaft wegen Vermögenslosigkeit von Amts wegen nach § 394 FamFG zu löschen. Die Frist zur Erhebung eines Widerspruchs ist auf drei Monate festgesetzt."
    },
    {
      "date": "2025-01-24",
      "id": "99475",
      "original_text": "Löschungsankündigung\nBayern Amtsgericht Nürnberg HRB 35644\nPVO GmbH – Nürnberg",
      "type": "Löschungsankündigung",
      "state": "Bayern",
      "amtsgericht": "Amtsgericht Nürnberg",
      "registernummer": "HRB 35644",
      "registerart": "HRB",
      "company_name": "PVO GmbH",
      "company_seat": "Nürnberg",
      "details": "24.01.2025 (Bekanntmachungsdatum)\n\nBayern Amtsgericht Nürnberg HRB 35644\nLöschungsankündigung\n\nPVO GmbH\nGesellschaft mit beschränkter Haftung\nNürnberg\n\nDas Registergericht beabsichtigt, die im Handelsregister eingetragene Gesellschaft wegen Vermögenslosigkeit von Amts wegen nach § 394 FamFG zu löschen. Die Frist zur Erhebung eines Widerspruchs ist auf einen Monat festgesetzt."
    },
    {
      "date": "2025-01-24",
      "id": "99476",
      "original_text": "Löschungsankündigung\nBayern Amtsgericht Nürnberg HRB 35644\nPVO GmbH – Nürnberg",
      "type": "Löschungsankündigung",
      "state": "Bayern",
      "amtsgericht": "Amtsgericht Nürnberg",
      "registernummer": "HRB 35644",
      "registerart": "HRB",
      "company_name": "PVO GmbH",
      "company_seat": "Nürnberg",
      "details": "24.01.2025 (Bekanntmachungsdatum)\n\nBayern Amtsgericht Nürnberg HRB 35644\nLöschungsankündigung\n\nPVO GmbH\nGesellschaft mit beschränkter Haftung\nNürnberg\n\nDas Registergericht beabsichtigt, die im Handelsregister eingetragene Gesellschaft wegen Vermögenslosigkeit von Amts wegen nach § 394 FamFG zu löschen. Die Frist zur Erhebung eines Widerspruchs ist auf einen Monat festgesetzt."
    },
    {
      "date": "2025-01-24",
      "id": "99477",
      "original_text": "Löschungsankündigung\nBayern Amtsgericht Augsburg HRB 35153\nHelios El-Bau UG (haftungsbeschränkt) – Augsburg",
      "type": "Löschungsankündigung",
      "state": "Bayern",
      "amtsgericht": "Amtsgericht Augsburg",
      "registernummer": "HRB 35153",
      "registerart": "HRB",
      "company_name": "Helios El-Bau UG (haftungsbeschränkt)",
      "company_seat": "Augsburg",
      "details": "24.01.2025 (Bekanntmachungsdatum)\n\nBayern Amtsgericht Augsburg HRB 35153\nLöschungsankündigung\n\nHelios El-Bau UG (haftungsbeschränkt)\nGesellschaft mit beschränkter Haftung\nAugsburg\n\nDas Registergericht beabsichtigt, die im Handelsregister eingetragene Gesellschaft wegen Vermögenslosigkeit von Amts wegen nach § 394 FamFG zu löschen. Die Frist zur Erhebung eines Widerspruchs ist auf einen Monat festgesetzt."
    },
    {
      "date": "2025-01-24",
      "id": "99478",
      "original_text": "Löschungsankündigung\nBayern Amtsgericht Nürnberg HRB 38225\nQUERWILD GmbH – Burgthann",
      "type": "Löschungsankündigung",
      "state": "Bayern",
      "amtsgericht": "Amtsgericht Nürnberg",
      "registernummer": "HRB 38225",
      "registerart": "HRB",
      "company_name": "QUERWILD GmbH",
      "company_seat": "Burgthann",
      "details": "24.01.2025 (Bekanntmachungsdatum)\n\nBayern Amtsgericht Nürnberg HRB 38225\nLöschungsankündigung\n\nQUERWILD GmbH\nGesellschaft mit beschränkter Haftung\nBurgthann\n\nDas Registergericht beabsichtigt, die im Handelsregister eingetragene Gesellschaft wegen Vermögenslosigkeit von Amts wegen nach § 394 FamFG zu löschen. Die Frist zur Erhebung eines Widerspruchs ist auf drei Monate festgesetzt."
    },
    {
      "date": "2025-01-24",
      "id": "99479",
      "original_text": "Einreichung neuer Dokumente\nBayern Amtsgericht München HRB 173005\nMetechon AG – München",
      "type": "Einreichung neuer Dokumente",
      "state": "Bayern",
      "amtsgericht": "Amtsgericht München",
      "registernummer": "HRB 173005",
      "registerart": "HRB",
      "company_name": "Metechon AG",
      "company_seat": "München",
      "details": "24.01.2025 (Bekanntmachungsdatum)\n\nBayern Amtsgericht München HRB 173005\nEinreichung neuer Dokumente\n\nMetechon AG\nAktiengesellschaft\nMünchen\n\nDem Amtsgericht München -Registergericht- ist eine Liste der Mitglieder des Aufsichtsrats eingereicht worden, § 106 AktG."
    },
    {
      "date": "2025-01-24",
      "id": "99480",
      "original_text": "Einreichung neuer Dokumente\nBayern Amtsgericht München HRB 177273\nMüller-BBM AG – Planegg",
      "type": "Einreichung neuer Dokumente",
      "state": "Bayern",
      "amtsgericht": "Amtsgericht München",
      "registernummer": "HRB 177273",
      "registerart": "HRB",
      "company_name": "Müller-BBM AG",
      "company_seat": "Planegg",
      "details": "24.01.2025 (Bekanntmachungsdatum)\n\nBayern Amtsgericht München HRB 177273\nEinreichung neuer Dokumente\n\nMüller-BBM AG\nAktiengesellschaft\nPlanegg\n\nDem Amtsgericht München -Registergericht- ist eine Liste der Mitglieder des Aufsichtsrats eingereicht worden, § 106 AktG."
    },
    {
      "date": "2025-01-24",
      "id": "99481",
      "original_text": "Einreichung neuer Dokumente\nBayern Amtsgericht Fürth HRB 8213\nFaber-Castell Aktiengesellschaft – Stein",
      "type": "Einreichung neuer Dokumente",
      "state": "Bayern",
      "amtsgericht": "Amtsgericht Fürth",
      "registernummer": "HRB 8213",
      "registerart": "HRB",
      "company_name": "Faber-Castell Aktiengesellschaft",
      "company_seat": "Stein",
      "details": "24.01.2025 (Bekanntmachungsdatum)\n\nBayern Amtsgericht Fürth HRB 8213\nEinreichung neuer Dokumente\n\nFaber-Castell Aktiengesellschaft\nAktiengesellschaft\nStein\n\nDem Amtsgericht Fürth -Registergericht- ist eine Liste der Mitglieder des Aufsichtsrats eingereicht worden, § 106 AktG."
    },
    {
      "date": "2025-01-24",
      "id": "99482",
      "original_text": "Registerbekanntmachung nach dem Umwandlungsgesetz\nBayern Amtsgericht Coburg HRB 4481\nEndress+Hauser Flow Deutschland AG – Coburg",
      "type": "Registerbekanntmachung nach dem Umwandlungsgesetz",
      "state": "Bayern",
      "amtsgericht": "Amtsgericht Coburg",
      "registernummer": "HRB 4481",
      "registerart": "HRB",
      "company_name": "Endress+Hauser Flow Deutschland AG",
      "company_seat": "Coburg",
      "details": "24.01.2025 (Bekanntmachungsdatum)\n\nBayern Amtsgericht Coburg HRB 4481\nRegisterbekanntmachung nach dem Umwandlungsgesetz 21.01.2025 (Eintragungsdatum)\n\nEndress+Hauser Flow Deutschland AG\nAktiengesellschaft\nCoburg\n\nDen Gläubigern des formwechselnden Rechtsträgers ist, wenn sie binnen sechs Monaten nach dem Tag, an dem die Eintragung des Formwechsels nach § 201 UmwG als bekannt gemacht gilt, ihren Anspruch nach Grund und Höhe in Textform anmelden, Sicherheit zu leisten, soweit sie nicht Befriedigung verlangen können. Dieses Recht steht den Gläubigern jedoch nur zu, wenn sie glaubhaft machen, dass durch den Formwechsel die Erfüllung ihrer Forderung gefährdet wird."
    },
    {
      "date": "2025-01-24",
      "id": "99483",
      "original_text": "Löschungsankündigung\nBayern Amtsgericht Nürnberg HRB 7512\nFrankonia Assekuranz Vermittlungs GmbH – Nürnberg",
      "type": "Löschungsankündigung",
      "state": "Bayern",
      "amtsgericht": "Amtsgericht Nürnberg",
      "registernummer": "HRB 7512",
      "registerart": "HRB",
      "company_name": "Frankonia Assekuranz Vermittlungs GmbH",
      "company_seat": "Nürnberg",
      "details": "24.01.2025 (Bekanntmachungsdatum)\n\nBayern Amtsgericht Nürnberg HRB 7512\nLöschungsankündigung\n\nFrankonia Assekuranz Vermittlungs GmbH\nGesellschaft mit beschränkter Haftung\nNürnberg\n\nDas Registergericht beabsichtigt, die im Handelsregister eingetragene Gesellschaft wegen Vermögenslosigkeit von Amts wegen nach § 394 FamFG zu löschen. Die Frist zur Erhebung eines Widerspruchs ist auf drei Monate festgesetzt."
    },
    {
      "date": "2025-01-24",
      "id": "99484",
      "original_text": "Sonstige Registerbekanntmachung\nBayern Amtsgericht Aschaffenburg HRB 9623\nHamberger Hardwood GmbH – Kleinostheim",
      "type": "Sonstige Registerbekanntmachung",
      "state": "Bayern",
      "amtsgericht": "Amtsgericht Aschaffenburg",
      "registernummer": "HRB 9623",
      "registerart": "HRB",
      "company_name": "Hamberger Hardwood GmbH",
      "company_seat": "Kleinostheim",
      "details": "24.01.2025 (Bekanntmachungsdatum)\n\nBayern Amtsgericht Aschaffenburg HRB 9623\nSonstige Registerbekanntmachung 23.01.2025 (Eintragungsdatum)\n\nHamberger Hardwood GmbH\nGesellschaft mit beschränkter Haftung\nKleinostheim\n\nDen Gläubigern der Gesellschaft, deren Forderungen begründet worden sind, bevor die Eintragung der Beendigung des Gewinnabführungsvertrages in das Handelsregister nach § 10 des Handelsgesetzbuches als bekanntgemacht gilt, hat der andere Vertragsteil Sicherheit zu leisten, wenn sie sich binnen sechs Monaten nach der Bekanntmachung der Eintragung zu diesem Zweck bei ihm melden."
    },
    {
      "date": "2025-01-24",
      "id": "99485",
      "original_text": "Löschungsankündigung\nBayern Amtsgericht Kempten (Allgäu) HRB 15446\nBIGZ GmbH – Unterthingau",
      "type": "Löschungsankündigung",
      "state": "Bayern",
      "amtsgericht": "Amtsgericht Kempten (Allgäu)",
      "registernummer": "HRB 15446",
      "registerart": "HRB",
      "company_name": "BIGZ GmbH",
      "company_seat": "Unterthingau",
      "details": "24.01.2025 (Bekanntmachungsdatum)\n\nBayern Amtsgericht Kempten (Allgäu) HRB 15446\nLöschungsankündigung\n\nBIGZ GmbH\nGesellschaft mit beschränkter Haftung\nUnterthingau\n\nDas Registergericht beabsichtigt, die im Handelsregister eingetragene Gesellschaft wegen Vermögenslosigkeit von Amts wegen nach § 394 FamFG zu löschen. Die Frist zur Erhebung eines Widerspruchs ist auf einen Monat festgesetzt."
    },
    {
      "date": "2025-01-24",
      "id": "99486",
      "original_text": "Einreichung neuer Dokumente\nBayern Amtsgericht München HRB 167896\nRandstad Digital Germany AG – München",
      "type": "Einreichung neuer Dokumente",
      "state": "Bayern",
      "amtsgericht": "Amtsgericht München",
      "registernummer": "HRB 167896",
      "registerart": "HRB",
      "company_name": "Randstad Digital Germany AG",
      "company_seat": "München",
      "details": "24.01.2025 (Bekanntmachungsdatum)\n\nBayern Amtsgericht München HRB 167896\nEinreichung neuer Dokumente\n\nRandstad Digital Germany AG\nAktiengesellschaft\nMünchen\n\nDem Amtsgericht München -Registergericht- ist eine Liste der Mitglieder des Aufsichtsrats eingereicht worden, § 106 AktG."
    },
    {
      "date": "2025-01-24",
      "id": "99487",
      "original_text": "Registerbekanntmachung nach dem Umwandlungsgesetz\nBayern Amtsgericht Hof HRB 7050\nS89 Immobilien GmbH – Hof",
      "type": "Registerbekanntmachung nach dem Umwandlungsgesetz",
      "state": "Bayern",
      "amtsgericht": "Amtsgericht Hof",
      "registernummer": "HRB 7050",
      "registerart": "HRB",
      "company_name": "S89 Immobilien GmbH",
      "company_seat": "Hof",
      "details": "24.01.2025 (Bekanntmachungsdatum)\n\nBayern Amtsgericht Hof HRB 7050\nRegisterbekanntmachung nach dem Umwandlungsgesetz 23.01.2025 (Eintragungsdatum)\n\nS89 Immobilien GmbH\nGesellschaft mit beschränkter Haftung\nHof\n\nDen Gläubigern der an der Ausgliederung beteiligten Rechtsträger ist, wenn sie binnen sechs Monaten nach dem Tag, an dem die Eintragung der Ausgliederung in das Register des Sitzes desjenigen Rechtsträgers, dessen Gläubiger sie sind, nach §§ 125, 19 Abs. 3 UmwG als bekannt gemacht gilt, ihren Anspruch nach Grund und Höhe in Textform anmelden, Sicherheit zu leisten, soweit sie nicht Befriedigung verlangen können. Dieses Recht steht den Gläubigern jedoch nur zu, wenn sie glaubhaft machen, dass durch die Ausgliederung die Erfüllung ihrer Forderung gefährdet wird."
    },
    {
      "date": "2025-01-24",
      "id": "99488",
      "original_text": "Registerbekanntmachung nach dem Umwandlungsgesetz\nBayern Amtsgericht Hof HRB 6448\nErwin Schiller Holding GmbH – Hof",
      "type": "Registerbekanntmachung nach dem Umwandlungsgesetz",
      "state": "Bayern",
      "amtsgericht": "Amtsgericht Hof",
      "registernummer": "HRB 6448",
      "registerart": "HRB",
      "company_name": "Erwin Schiller Holding GmbH",
      "company_seat": "Hof",
      "details": "24.01.2025 (Bekanntmachungsdatum)\n\nBayern Amtsgericht Hof HRB 6448\nRegisterbekanntmachung nach dem Umwandlungsgesetz 23.01.2025 (Eintragungsdatum)\n\nErwin Schiller Holding GmbH\nGesellschaft mit beschränkter Haftung\nHof\n\nDen Gläubigern der an der Ausgliederung beteiligten Rechtsträger ist, wenn sie binnen sechs Monaten nach dem Tag, an dem die Eintragung der Ausgliederung in das Register des Sitzes desjenigen Rechtsträgers, dessen Gläubiger sie sind, nach §§ 125, 19 Abs. 3 UmwG als bekannt gemacht gilt, ihren Anspruch nach Grund und Höhe in Textform anmelden, Sicherheit zu leisten, soweit sie nicht Befriedigung verlangen können. Dieses Recht steht den Gläubigern jedoch nur zu, wenn sie glaubhaft machen, dass durch die Ausgliederung die Erfüllung ihrer Forderung gefährdet wird."
    },
    {
      "date": "2025-01-24",
      "id": "99489",
      "original_text": "Löschungsankündigung\nBaden-Württemberg Amtsgericht Ulm HRB 741821\nMaier - BMV GmbH – Göppingen",
      "type": "Löschungsankündigung",
      "state": "Baden-Württemberg",
      "amtsgericht": "Amtsgericht Ulm",
      "registernummer": "HRB 741821",
      "registerart": "HRB",
      "company_name": "Maier - BMV GmbH",
      "company_seat": "Göppingen",
      "details": "24.01.2025 (Bekanntmachungsdatum)\n\nBaden-Württemberg Amtsgericht Ulm HRB 741821\nLöschungsankündigung\n\nMaier - BMV GmbH\nGesellschaft mit beschränkter Haftung\nGöppingen\n\nDas Gericht beabsichtigt, die Gesellschaft wegen Vermögenslosigkeit im Handelsregister von Amts wegen nach § 394 FamFG zu löschen. Die Frist zur Geltendmachung eines Widerspruchs gegen die beabsichtigte Löschung ist auf  einen Monat ab Veröffentlichung bestimmt."
    },
    {
      "date": "2025-01-24",
      "id": "99490",
      "original_text": "Sonstige Registerbekanntmachung\nBrandenburg Amtsgericht Cottbus HRB 15520\nUBH Immobilien GmbH – Schönefeld",
      "type": "Sonstige Registerbekanntmachung",
      "state": "Brandenburg",
      "amtsgericht": "Amtsgericht Cottbus",
      "registernummer": "HRB 15520",
      "registerart": "HRB",
      "company_name": "UBH Immobilien GmbH",
      "company_seat": "Schönefeld",
      "details": "24.01.2025 (Bekanntmachungsdatum)\n\nBrandenburg Amtsgericht Cottbus HRB 15520\nSonstige Registerbekanntmachung\n\nUBH Immobilien GmbH\nGesellschaft mit beschränkter Haftung\nSchönefeld\n\nAls nicht eingetragen wird veröffentlicht:\nGläubigern, deren Forderungen begründet worden sind, bevor die Eintragung des Beschlusses als nach § 10 des Handelsgesetzbuches bekannt gemacht gilt, ist, wenn sie sich binnen sechs Monaten nach der Bekanntmachung zu diesem Zweck melden, Sicherheit zu leisten, soweit sie nicht Befriedigung verlangen können"
    },
    {
      "date": "2025-01-24",
      "id": "99491",
      "original_text": "Löschungsankündigung\nSchleswig-Holstein Amtsgericht Lübeck HRB 18706\nElit Events 34 UG (haftungsbeschränkt) – Stockelsdorf",
      "type": "Löschungsankündigung",
      "state": "Schleswig-Holstein",
      "amtsgericht": "Amtsgericht Lübeck",
      "registernummer": "HRB 18706",
      "registerart": "HRB",
      "company_name": "Elit Events 34 UG (haftungsbeschränkt)",
      "company_seat": "Stockelsdorf",
      "details": "24.01.2025 (Bekanntmachungsdatum)\n\nSchleswig-Holstein Amtsgericht Lübeck HRB 18706\nLöschungsankündigung\n\nElit Events 34 UG (haftungsbeschränkt)\nGesellschaft mit beschränkter Haftung\nStockelsdorf\n\nEs ist die Löschung der nachstehenden Gesellschaft wegen Vermögenslosigkeit gemäß § 394 FamFG beabsichtigt."
    },
    {
      "date": "2025-01-24",
      "id": "99492",
      "original_text": "Registerbekanntmachung nach dem Umwandlungsgesetz\nBaden-Württemberg Amtsgericht Ulm HRB 723429\nBARTEC GmbH – Bad Mergentheim",
      "type": "Registerbekanntmachung nach dem Umwandlungsgesetz",
      "state": "Baden-Württemberg",
      "amtsgericht": "Amtsgericht Ulm",
      "registernummer": "HRB 723429",
      "registerart": "HRB",
      "company_name": "BARTEC GmbH",
      "company_seat": "Bad Mergentheim",
      "details": "24.01.2025 (Bekanntmachungsdatum)\n\nBaden-Württemberg Amtsgericht Ulm HRB 723429\nRegisterbekanntmachung nach dem Umwandlungsgesetz 24.01.2025 (Eintragungsdatum)\n\nBARTEC GmbH\nGesellschaft mit beschränkter Haftung\nBad Mergentheim\n\nAls nicht eingetragen wird bekanntgemacht:\nDen Gläubigern der an der Verschmelzung beteiligten Rechtsträger ist, wenn sie binnen sechs Monaten nach dem Tag, an dem die Eintragung der Verschmelzung in das Register des Sitzes desjenigen Rechtsträgers, dessen Gläubiger sie sind, nach § 19 Abs. 3 UmwG als bekanntgemacht gilt, ihren Anspruch nach Grund und Höhe schriftlich anmelden, Sicherheit zu leisten, soweit sie nicht Befriedigung verlangen können. Dieses Recht steht den Gläubigern jedoch nur zu, wenn sie glaubhaft machen, dass durch die Verschmelzung die Erfüllung ihrer Forderung gefährdet wird."
    },
    {
      "date": "2025-01-24",
      "id": "99493",
      "original_text": "Löschungsankündigung\nBerlin Amtsgericht Berlin (Charlottenburg) HRB 176329\nLa Divina UG (haftungsbeschränkt) – Berlin",
      "type": "Löschungsankündigung",
      "state": "Berlin",
      "amtsgericht": "Amtsgericht Berlin (Charlottenburg)",
      "registernummer": "HRB 176329",
      "registerart": "HRB",
      "company_name": "La Divina UG (haftungsbeschränkt)",
      "company_seat": "Berlin",
      "details": "24.01.2025 (Bekanntmachungsdatum)\n\nBerlin Amtsgericht Berlin (Charlottenburg) HRB 176329\nLöschungsankündigung\n\nLa Divina UG (haftungsbeschränkt)\nGesellschaft mit beschränkter Haftung\nBerlin\n\nBei der nachstehenden Gesellschaft wird das Amtslöschungsverfahren gemäß § 394 FamFG eingeleitet. Widerspruchsfrist 6 Wochen"
    },
    {
      "date": "2025-01-24",
      "id": "99494",
      "original_text": "Einreichung neuer Dokumente\nBaden-Württemberg Amtsgericht Ulm HRB 721056\nRolls-Royce Power Systems AG – Friedrichshafen",
      "type": "Einreichung neuer Dokumente",
      "state": "Baden-Württemberg",
      "amtsgericht": "Amtsgericht Ulm",
      "registernummer": "HRB 721056",
      "registerart": "HRB",
      "company_name": "Rolls-Royce Power Systems AG",
      "company_seat": "Friedrichshafen",
      "details": "24.01.2025 (Bekanntmachungsdatum)\n\nBaden-Württemberg Amtsgericht Ulm HRB 721056\nEinreichung neuer Dokumente\n\nRolls-Royce Power Systems AG\nAktiengesellschaft\nFriedrichshafen\n\nDie Gesellschaft hat am 23.01.2025 die Liste über die Zusammensetzung des Aufsichtsrats zum Handelsregister eingereicht."
    },
    {
      "date": "2025-01-24",
      "id": "99495",
      "original_text": "Einreichung neuer Dokumente\nBaden-Württemberg Amtsgericht Mannheim HRB 108015\nS&G Automobil AG – Karlsruhe",
      "type": "Einreichung neuer Dokumente",
      "state": "Baden-Württemberg",
      "amtsgericht": "Amtsgericht Mannheim",
      "registernummer": "HRB 108015",
      "registerart": "HRB",
      "company_name": "S&G Automobil AG",
      "company_seat": "Karlsruhe",
      "details": "24.01.2025 (Bekanntmachungsdatum)\n\nBaden-Württemberg Amtsgericht Mannheim HRB 108015\nEinreichung neuer Dokumente 24.01.2025 (Eintragungsdatum)\n\nS&G Automobil AG\nAktiengesellschaft\nKarlsruhe\n\nDie Gesellschaft hat am 23.01.2025 die Liste über die Zusammensetzung des Aufsichtsrats zum Handelsregister eingereicht."
    },
    {
      "date": "2025-01-24",
      "id": "99496",
      "original_text": "Löschungsankündigung\nBrandenburg Amtsgericht Potsdam HRB 27099\nBlauton Media GmbH – Zossen",
      "type": "Löschungsankündigung",
      "state": "Brandenburg",
      "amtsgericht": "Amtsgericht Potsdam",
      "registernummer": "HRB 27099",
      "registerart": "HRB",
      "company_name": "Blauton Media GmbH",
      "company_seat": "Zossen",
      "details": "24.01.2025 (Bekanntmachungsdatum)\n\nBrandenburg Amtsgericht Potsdam HRB 27099\nLöschungsankündigung\n\nBlauton Media GmbH\nGesellschaft mit beschränkter Haftung\nZossen\n\nBei der nachstehenden Gesellschaft wird das Amtslöschungsverfahren gemäß § 394 FamFG eingeleitet."
    },
    {
      "date": "2025-01-24",
      "id": "99497",
      "original_text": "Einreichung neuer Dokumente\nBaden-Württemberg Amtsgericht Mannheim HRB 741455\ntrans-o-flex Express GmbH & Co. KGaA – Weinheim",
      "type": "Einreichung neuer Dokumente",
      "state": "Baden-Württemberg",
      "amtsgericht": "Amtsgericht Mannheim",
      "registernummer": "HRB 741455",
      "registerart": "HRB",
      "company_name": "trans-o-flex Express GmbH & Co. KGaA",
      "company_seat": "Weinheim",
      "details": "24.01.2025 (Bekanntmachungsdatum)\n\nBaden-Württemberg Amtsgericht Mannheim HRB 741455\nEinreichung neuer Dokumente\n\ntrans-o-flex Express GmbH & Co. KGaA\nKommanditgesellschaft auf Aktien\nWeinheim\n\nDie Gesellschaft hat am 14.01.2025 die Liste über die Zusammensetzung des Aufsichtsrats zum Handelsregister eingereicht."
    },
    {
      "date": "2025-01-24",
      "id": "99498",
      "original_text": "Löschungsankündigung\nBerlin Amtsgericht Berlin (Charlottenburg) HRB 161935\nTürkis Taxi GmbH – Berlin",
      "type": "Löschungsankündigung",
      "state": "Berlin",
      "amtsgericht": "Amtsgericht Berlin (Charlottenburg)",
      "registernummer": "HRB 161935",
      "registerart": "HRB",
      "company_name": "Türkis Taxi GmbH",
      "company_seat": "Berlin",
      "details": "24.01.2025 (Bekanntmachungsdatum)\n\nBerlin Amtsgericht Berlin (Charlottenburg) HRB 161935\nLöschungsankündigung\n\nTürkis Taxi GmbH\nGesellschaft mit beschränkter Haftung\nBerlin\n\nBei der nachstehenden Gesellschaft wird das Amtslöschungsverfahren gemäß § 394 FamFG eingeleitet. Widerspruchsfrist 6 Wochen"
    },
    {
      "date": "2025-01-24",
      "id": "99499",
      "original_text": "Löschungsankündigung\nBerlin Amtsgericht Berlin (Charlottenburg) HRB 242950\nRoyal Garten und Landschaftsbau GmbH – Berlin",
      "type": "Löschungsankündigung",
      "state": "Berlin",
      "amtsgericht": "Amtsgericht Berlin (Charlottenburg)",
      "registernummer": "HRB 242950",
      "registerart": "HRB",
      "company_name": "Royal Garten und Landschaftsbau GmbH",
      "company_seat": "Berlin",
      "details": "24.01.2025 (Bekanntmachungsdatum)\n\nBerlin Amtsgericht Berlin (Charlottenburg) HRB 242950\nLöschungsankündigung\n\nRoyal Garten und Landschaftsbau GmbH\nGesellschaft mit beschränkter Haftung\nBerlin\n\nBei der nachstehenden Gesellschaft wird das Amtslöschungsverfahren gemäß § 394 FamFG eingeleitet. Widerspruchsfrist 6 Wochen"
    },
    {
      "date": "2025-01-24",
      "id": "99500",
      "original_text": "Löschungsankündigung\nBerlin Amtsgericht Berlin (Charlottenburg) HRB 177869\nITAP Klassiker UG (haftungsbeschränkt) – Berlin",
      "type": "Löschungsankündigung",
      "state": "Berlin",
      "amtsgericht": "Amtsgericht Berlin (Charlottenburg)",
      "registernummer": "HRB 177869",
      "registerart": "HRB",
      "company_name": "ITAP Klassiker UG (haftungsbeschränkt)",
      "company_seat": "Berlin",
      "details": "24.01.2025 (Bekanntmachungsdatum)\n\nBerlin Amtsgericht Berlin (Charlottenburg) HRB 177869\nLöschungsankündigung\n\nITAP Klassiker UG (haftungsbeschränkt)\nGesellschaft mit beschränkter Haftung\nBerlin\n\nBei der nachstehenden Gesellschaft wird das Amtslöschungsverfahren gemäß § 394 FamFG eingeleitet. Widerspruchsfrist 6 Wochen"
    },
    {
      "date": "2025-01-24",
      "id": "99501",
      "original_text": "Registerbekanntmachung nach dem Umwandlungsgesetz\nBaden-Württemberg Amtsgericht Stuttgart HRA 222305\nMüller Bindesysteme Inhaber Markus Apostel e.K. – Grafenberg",
      "type": "Registerbekanntmachung nach dem Umwandlungsgesetz",
      "state": "Baden-Württemberg",
      "amtsgericht": "Amtsgericht Stuttgart",
      "registernummer": "HRA 222305",
      "registerart": "HRA",
      "company_name": "Müller Bindesysteme Inhaber Markus Apostel e.K.",
      "company_seat": "Grafenberg",
      "details": "24.01.2025 (Bekanntmachungsdatum)\n\nBaden-Württemberg Amtsgericht Stuttgart HRA 222305\nRegisterbekanntmachung nach dem Umwandlungsgesetz 24.01.2025 (Eintragungsdatum)\n\nMüller Bindesysteme Inhaber Markus Apostel e.K.\nEinzelkaufmann / Einzelkauffrau\nGrafenberg\n\nDen Gläubigern der an der Ausgliederung beteiligten Rechtsträger ist, wenn sie binnen sechs Monaten nach dem Tag, an dem die Eintragung der Ausgliederung in das Register des Sitzes desjenigen Rechtsträgers, dessen Gläubiger sie sind, nach § 19 Abs. 3 UmwG als bekanntgemacht gilt, ihren Anspruch nach Grund und Höhe schriftlich anmelden, Sicherheit zu leisten, soweit sie nicht Befriedigung verlangen können. Dieses Recht steht den Gläubigern jedoch nur zu, wenn sie glaubhaft machen, dass durch die Ausgliederung die Erfüllung ihrer Forderung gefährdet wird."
    },
    {
      "date": "2025-01-24",
      "id": "99502",
      "original_text": "Löschungsankündigung\nBaden-Württemberg Amtsgericht Stuttgart HRB 767515\nFeinkosta Foodlogistics UG (haftungsbeschränkt) – Stuttgart",
      "type": "Löschungsankündigung",
      "state": "Baden-Württemberg",
      "amtsgericht": "Amtsgericht Stuttgart",
      "registernummer": "HRB 767515",
      "registerart": "HRB",
      "company_name": "Feinkosta Foodlogistics UG (haftungsbeschränkt)",
      "company_seat": "Stuttgart",
      "details": "24.01.2025 (Bekanntmachungsdatum)\n\nBaden-Württemberg Amtsgericht Stuttgart HRB 767515\nLöschungsankündigung\n\nFeinkosta Foodlogistics UG (haftungsbeschränkt)\nGesellschaft mit beschränkter Haftung\nStuttgart\n\nAls nicht eingetragen wird bekanntgemacht:\nDas Gericht beabsichtigt, die Gesellschaft wegen Vermögenslosigkeit im Handelsregister von Amts wegen nach § 394 FamFG zu löschen. Die Frist zur Geltendmachung eines Widerspruchs gegen die beabsichtigte Löschung ist auf zwei Monate ab Veröffentlichung bestimmt."
    },
    {
      "date": "2025-01-24",
      "id": "99503",
      "original_text": "Registerbekanntmachung nach dem Umwandlungsgesetz\nBaden-Württemberg Amtsgericht Freiburg HRB 490159\nRichard Meyer GmbH – Renchen",
      "type": "Registerbekanntmachung nach dem Umwandlungsgesetz",
      "state": "Baden-Württemberg",
      "amtsgericht": "Amtsgericht Freiburg",
      "registernummer": "HRB 490159",
      "registerart": "HRB",
      "company_name": "Richard Meyer GmbH",
      "company_seat": "Renchen",
      "details": "24.01.2025 (Bekanntmachungsdatum)\n\nBaden-Württemberg Amtsgericht Freiburg HRB 490159\nRegisterbekanntmachung nach dem Umwandlungsgesetz 24.01.2025 (Eintragungsdatum)\n\nRichard Meyer GmbH\nGesellschaft mit beschränkter Haftung\nRenchen\n\nDie Gesellschaft ist durch Vertrag vom 23.01.2025 mit dem Vermögen des Alleingesellschafters Claus Richard Meyer, Renchen, verschmolzen.\nDen Gläubigern der an der Verschmelzung beteiligten Rechtsträger ist, wenn sie binnen sechs Monaten nach dem Tag, an dem die Eintragung der Verschmelzung in das Register des Sitzes desjenigen Rechtsträgers, dessen Gläubiger sie sind, nach § 19 Abs. 3 UmwG als bekanntgemacht gilt, ihren Anspruch nach Grund und Höhe schriftlich anmelden, Sicherheit zu leisten, soweit sie nicht Befriedigung verlangen können. Dieses Recht steht den Gläubigern jedoch nur zu, wenn sie glaubhaft machen, dass durch die Verschmelzung die Erfüllung ihrer Forderung gefährdet wird."
    },
    {
      "date": "2025-01-24",
      "id": "99504",
      "original_text": "Registerbekanntmachung nach dem Umwandlungsgesetz\nSachsen-Anhalt Amtsgericht Stendal HRA 7982\nHäusliche Kranken- & Seniorenpflege Daus e.K. – Zörbig",
      "type": "Registerbekanntmachung nach dem Umwandlungsgesetz",
      "state": "Sachsen-Anhalt",
      "amtsgericht": "Amtsgericht Stendal",
      "registernummer": "HRA 7982",
      "registerart": "HRA",
      "company_name": "Häusliche Kranken- & Seniorenpflege Daus e.K.",
      "company_seat": "Zörbig",
      "details": "24.01.2025 (Bekanntmachungsdatum)\n\nSachsen-Anhalt Amtsgericht Stendal HRA 7982\nRegisterbekanntmachung nach dem Umwandlungsgesetz 24.01.2025 (Eintragungsdatum)\n\nHäusliche Kranken- & Seniorenpflege Daus e.K.\nEinzelkaufmann / Einzelkauffrau\nZörbig\n\nNicht eingetragen:\nDen Gläubigern der an der Ausgliederung beteiligten Rechtsträger, ist wenn sie binnen sechs Monaten nach dem Tag, an dem die Eintragung der Ausgliederung nach §§125, 19 Abs. 3 UmwG als bekanntgemacht gilt, ihren Anspruch nach Grund und Höhe schriftlich anmelden, Sicherheit zu leisten, soweit sie nicht Befriedigung verlangen können. Diese Recht steht ihnen jedoch nur zu, wenn sie glaubhaft machen, dass durch die Ausgliederung die Erfüllung ihrer Forderung gefährdet wird."
    },
    {
      "date": "2025-01-24",
      "id": "99505",
      "original_text": "Löschungsankündigung\nSaarland Amtsgericht Saarbrücken HRB 8970\nEHS Eckes & Huberty Saarbrücken GmbH – Saarbrücken",
      "type": "Löschungsankündigung",
      "state": "Saarland",
      "amtsgericht": "Amtsgericht Saarbrücken",
      "registernummer": "HRB 8970",
      "registerart": "HRB",
      "company_name": "EHS Eckes & Huberty Saarbrücken GmbH",
      "company_seat": "Saarbrücken",
      "details": "24.01.2025 (Bekanntmachungsdatum)\n\nSaarland Amtsgericht Saarbrücken HRB 8970\nLöschungsankündigung\n\nEHS Eckes & Huberty Saarbrücken GmbH\nGesellschaft mit beschränkter Haftung\nSaarbrücken\n\nEs ist beabsichtigt, die Gesellschaft von Amts wegen gemäß § 394 FamFG wegen Vermögenslosigkeit zu löschen.\nGegen die Löschung von Amts wegen ist das Rechtsmittel des Widerspruchs statthaft. Der Widerspruch ist binnen einer Frist drei Monaten beginnend mit dem Tag dieser Veröffentlichung durch Einreichen eines Widerspruchsschreibens -schriftlich oder zur Niederschrift der Geschäftsstelle beim Amtsgericht Saarbrücken, -zentrales Handelsregister-, Mainzerstr.178, 66121 Saarbrücken einzulegen.\nDer Widerspruch muss die Bezeichnung der angefochtenen Löschungsankündigung enthalten sowie die Erklärung, dass Widerspruch eingelegt wird. Er ist vom Widerspruchsführer oder seinem Bevollmächtigten zu unterzeichnen.\nDas Widerspruchsschreiben kann auch in der Form eines elektronischen Dokumentes eingereicht werden, das mit einer qualifizierten elektronischen Signatur nach dem Signaturgesetz versehen sein muss (§§ 14 Abs. 2 FamFG, 130a, 298 ZPO)."
    },
    {
      "date": "2025-01-24",
      "id": "99506",
      "original_text": "Sonstige Registerbekanntmachung\nBaden-Württemberg Amtsgericht Mannheim HRB 220317\nMösbacher Spirituosen Vertriebs GmbH Mösbach/Schwarzwald – Achern",
      "type": "Sonstige Registerbekanntmachung",
      "state": "Baden-Württemberg",
      "amtsgericht": "Amtsgericht Mannheim",
      "registernummer": "HRB 220317",
      "registerart": "HRB",
      "company_name": "Mösbacher Spirituosen Vertriebs GmbH Mösbach/Schwarzwald",
      "company_seat": "Achern",
      "details": "24.01.2025 (Bekanntmachungsdatum)\n\nBaden-Württemberg Amtsgericht Mannheim HRB 220317\nSonstige Registerbekanntmachung 24.01.2025 (Eintragungsdatum)\n\nMösbacher Spirituosen Vertriebs GmbH Mösbach/Schwarzwald\nGesellschaft mit beschränkter Haftung\nAchern\n\nDen Gläubigern der Gesellschaft, deren Forderungen begründet worden sind, bevor die Eintragung der Beendigung des Vertrages in das Handelsregister nach § 10 HGB als bekanntgemacht gilt, ist vom anderen Vertragsteil Sicherheit zu leisten, wenn sie sich binnen sechs Monaten nach der Bekanntmachung zu diesem Zweck bei ihm melden."
    },
    {
      "date": "2025-01-24",
      "id": "99507",
      "original_text": "Löschungsankündigung\nSaarland Amtsgericht Saarbrücken HRB 107906\nBAZAJ UG (haftungsbeschränkt) – Saarlouis",
      "type": "Löschungsankündigung",
      "state": "Saarland",
      "amtsgericht": "Amtsgericht Saarbrücken",
      "registernummer": "HRB 107906",
      "registerart": "HRB",
      "company_name": "BAZAJ UG (haftungsbeschränkt)",
      "company_seat": "Saarlouis",
      "details": "24.01.2025 (Bekanntmachungsdatum)\n\nSaarland Amtsgericht Saarbrücken HRB 107906\nLöschungsankündigung\n\nBAZAJ UG (haftungsbeschränkt)\nGesellschaft mit beschränkter Haftung\nSaarlouis\n\nEs ist beabsichtigt, die Gesellschaft von Amts wegen gemäß § 394 FamFG wegen Vermögenslosigkeit zu löschen.\nGegen die Löschung von Amts wegen ist das Rechtsmittel des Widerspruchs statthaft. Der Widerspruch ist binnen einer Frist zwei Monaten beginnend mit dem Tag dieser Veröffentlichung durch Einreichen eines Widerspruchsschreibens -schriftlich oder zur Niederschrift der Geschäftsstelle beim Amtsgericht Saarbrücken, -zentrales Handelsregister-, Mainzer Str.178, 66121 Saarbrücken einzulegen.\nDer Widerspruch muss die Bezeichnung der angefochtenen Löschungsankündigung enthalten sowie die Erklärung, dass Widerspruch eingelegt wird. Er ist vom Widerspruchsführer oder seinem Bevollmächtigten zu unterzeichnen.\nDas Widerspruchsschreiben kann auch in der Form eines elektronischen Dokumentes eingereicht werden, das mit einer qualifizierten elektronischen Signatur nach dem Signaturgesetz versehen sein muss (§§ 14 Abs. 2 FamFG, 130a, 298 ZPO)."
    },
    {
      "date": "2025-01-24",
      "id": "99508",
      "original_text": "Löschungsankündigung\nSchleswig-Holstein Amtsgericht Kiel HRB 20026\nRIFA Handwerksservice UG (haftungsbeschränkt) – Eckernförde",
      "type": "Löschungsankündigung",
      "state": "Schleswig-Holstein",
      "amtsgericht": "Amtsgericht Kiel",
      "registernummer": "HRB 20026",
      "registerart": "HRB",
      "company_name": "RIFA Handwerksservice UG (haftungsbeschränkt)",
      "company_seat": "Eckernförde",
      "details": "24.01.2025 (Bekanntmachungsdatum)\n\nSchleswig-Holstein Amtsgericht Kiel HRB 20026\nLöschungsankündigung\n\nRIFA Handwerksservice UG (haftungsbeschränkt)\nGesellschaft mit beschränkter Haftung\nEckernförde\n\nEs ist die Löschung der nachstehenden Gesellschaft wegen Vermögenslosigkeit gemäß § 394 FamFG beabsichtigt. Widerspruchsfrist: 2 Monate."
    },
    {
      "date": "2025-01-24",
      "id": "99509",
      "original_text": "Löschungsankündigung\nSaarland Amtsgericht Saarbrücken HRB 100531\nRomeo & Juliet UG (haftungsbeschränkt) – Spiesen-Elversberg",
      "type": "Löschungsankündigung",
      "state": "Saarland",
      "amtsgericht": "Amtsgericht Saarbrücken",
      "registernummer": "HRB 100531",
      "registerart": "HRB",
      "company_name": "Romeo & Juliet UG (haftungsbeschränkt)",
      "company_seat": "Spiesen-Elversberg",
      "details": "24.01.2025 (Bekanntmachungsdatum)\n\nSaarland Amtsgericht Saarbrücken HRB 100531\nLöschungsankündigung\n\nRomeo & Juliet UG (haftungsbeschränkt)\nGesellschaft mit beschränkter Haftung\nSpiesen-Elversberg\n\nEs ist beabsichtigt, die Gesellschaft von Amts wegen gemäß § 394 FamFG wegen Vermögenslosigkeit zu löschen.\nGegen die Löschung von Amts wegen ist das Rechtsmittel des Widerspruchs statthaft. Der Widerspruch ist binnen einer Frist zwei Monaten beginnend mit dem Tag dieser Veröffentlichung durch Einreichen eines Widerspruchsschreibens -schriftlich oder zur Niederschrift der Geschäftsstelle beim Amtsgericht Saarbrücken, -zentrales Handelsregister-, Mainzerstr.178, 66121 Saarbrücken einzulegen.\nDer Widerspruch muss die Bezeichnung der angefochtenen Löschungsankündigung enthalten sowie die Erklärung, dass Widerspruch eingelegt wird. Er ist vom Widerspruchsführer oder seinem Bevollmächtigten zu unterzeichnen.\nDas Widerspruchsschreiben kann auch in der Form eines elektronischen Dokumentes eingereicht werden, das mit einer qualifizierten elektronischen Signatur nach dem Signaturgesetz versehen sein muss (§§ 14 Abs. 2 FamFG, 130a, 298 ZPO)."
    },
    {
      "date": "2025-01-24",
      "id": "99510",
      "original_text": "Löschungsankündigung\nSaarland Amtsgericht Saarbrücken HRB 104734\nDominic Pelzer's UG (haftungsbeschränkt) – Dillingen/Saar",
      "type": "Löschungsankündigung",
      "state": "Saarland",
      "amtsgericht": "Amtsgericht Saarbrücken",
      "registernummer": "HRB 104734",
      "registerart": "HRB",
      "company_name": "Dominic Pelzer's UG (haftungsbeschränkt)",
      "company_seat": "Dillingen/Saar",
      "details": "24.01.2025 (Bekanntmachungsdatum)\n\nSaarland Amtsgericht Saarbrücken HRB 104734\nLöschungsankündigung\n\nDominic Pelzer's UG (haftungsbeschränkt)\nGesellschaft mit beschränkter Haftung\nDillingen/Saar\n\nEs ist beabsichtigt, die Gesellschaft von Amts wegen gemäß § 394 FamFG wegen Vermögenslosigkeit zu löschen.\nGegen die Löschung von Amts wegen ist das Rechtsmittel des Widerspruchs statthaft. Der Widerspruch ist binnen einer Frist einem Monat beginnend mit dem Tag dieser Veröffentlichung durch Einreichen eines Widerspruchsschreibens -schriftlich oder zur Niederschrift der Geschäftsstelle beim Amtsgericht Saarbrücken, -zentrales Handelsregister-, Mainzerstr.178, 66121 Saarbrücken einzulegen.\nDer Widerspruch muss die Bezeichnung der angefochtenen Löschungsankündigung enthalten sowie die Erklärung, dass Widerspruch eingelegt wird. Er ist vom Widerspruchsführer oder seinem Bevollmächtigten zu unterzeichnen.\nDas Widerspruchsschreiben kann auch in der Form eines elektronischen Dokumentes eingereicht werden, das mit einer qualifizierten elektronischen Signatur nach dem Signaturgesetz versehen sein muss (§§ 14 Abs. 2 FamFG, 130a, 298 ZPO)."
    },
    {
      "date": "2025-01-24",
      "id": "99511",
      "original_text": "Registerbekanntmachung nach dem Umwandlungsgesetz\nBaden-Württemberg Amtsgericht Stuttgart HRA 742035\nPS Panzersplitt OHG – Eschbronn",
      "type": "Registerbekanntmachung nach dem Umwandlungsgesetz",
      "state": "Baden-Württemberg",
      "amtsgericht": "Amtsgericht Stuttgart",
      "registernummer": "HRA 742035",
      "registerart": "HRA",
      "company_name": "PS Panzersplitt OHG",
      "company_seat": "Eschbronn",
      "details": "24.01.2025 (Bekanntmachungsdatum)\n\nBaden-Württemberg Amtsgericht Stuttgart HRA 742035\nRegisterbekanntmachung nach dem Umwandlungsgesetz 24.01.2025 (Eintragungsdatum)\n\nPS Panzersplitt OHG\nOffene Handelsgesellschaft\nEschbronn\n\nAls nicht eingetragen wird bekanntgemacht:\nDen Gläubigern des an dem Formwechsel beteiligten Rechtsträgers ist, wenn sie binnen sechs Monaten nach dem Tag, an dem die Eintragung des Formwechsels in das Register des Sitzes desjenigen Rechtsträgers, dessen Gläubiger sie sind, nach § 19 Abs. 3 UmwG als bekanntgemacht gilt, ihren Anspruch nach Grund und Höhe schriftlich anmelden, Sicherheit zu leisten, soweit sie nicht Befriedigung verlangen können. Dieses Recht steht den Gläubigern jedoch nur zu, wenn sie glaubhaft machen, dass durch den Formwechsel die Erfüllung ihrer Forderung gefährdet wird."
    },
    {
      "date": "2025-01-24",
      "id": "99512",
      "original_text": "Registerbekanntmachung nach dem Umwandlungsgesetz\nSachsen-Anhalt Amtsgericht Stendal HRA 7951\nUHLE Meisterbetrieb für GAS-WASSER-SANITÄR-HEIZUNG e.K. – Weißenfels OT Reichardtswerben",
      "type": "Registerbekanntmachung nach dem Umwandlungsgesetz",
      "state": "Sachsen-Anhalt",
      "amtsgericht": "Amtsgericht Stendal",
      "registernummer": "HRA 7951",
      "registerart": "HRA",
      "company_name": "UHLE Meisterbetrieb für GAS-WASSER-SANITÄR-HEIZUNG e.K.",
      "company_seat": "Weißenfels OT Reichardtswerben",
      "details": "24.01.2025 (Bekanntmachungsdatum)\n\nSachsen-Anhalt Amtsgericht Stendal HRA 7951\nRegisterbekanntmachung nach dem Umwandlungsgesetz 24.01.2025 (Eintragungsdatum)\n\nUHLE Meisterbetrieb für GAS-WASSER-SANITÄR-HEIZUNG e.K.\nEinzelkaufmann / Einzelkauffrau\nWeißenfels OT Reichardtswerben\n\nNicht eingetragen:\nDen Gläubigern der an der Verschmelzung beteiligten Rechtsträger ist, wenn sie binnen sechs Monaten nach dem Tag, an dem die Eintragung der Verschmelzung nach § 19 Abs. 3 UmwG als bekanntgemacht gilt, ihren Anspruch nach Grund und Höhe schriftlich anmelden, Sicherheit zu leisten, soweit sie nicht Befriedigung verlangen können. Dieses Recht steht ihnen jedoch nur zu, wenn sie glaubhaft machen, dass durch die Verschmelzung die Erfüllung ihrer Forderung gefährdet wird."
    },
    {
      "date": "2025-01-24",
      "id": "99513",
      "original_text": "Registerbekanntmachung nach dem Umwandlungsgesetz\nSachsen-Anhalt Amtsgericht Stendal HRB 31307\nP & K Merger GmbH – Weißenfels",
      "type": "Registerbekanntmachung nach dem Umwandlungsgesetz",
      "state": "Sachsen-Anhalt",
      "amtsgericht": "Amtsgericht Stendal",
      "registernummer": "HRB 31307",
      "registerart": "HRB",
      "company_name": "P & K Merger GmbH",
      "company_seat": "Weißenfels",
      "details": "24.01.2025 (Bekanntmachungsdatum)\n\nSachsen-Anhalt Amtsgericht Stendal HRB 31307\nRegisterbekanntmachung nach dem Umwandlungsgesetz 24.01.2025 (Eintragungsdatum)\n\nP & K Merger GmbH\nGesellschaft mit beschränkter Haftung\nWeißenfels\n\nDie Gesellschafterversammlung vom 16.01.2025 hat die formwechselnde Umwandlung der Gesellschaft in die  \"P & K Merger eGbR\" mit dem Sitz in Weißenfels (Amtsgericht Stendal GsR 752) beschlossen, welche mit Eintragung des neu gegründeten Rechtsträgers am 24.01.2025 wirksam geworden ist. Den Gläubigern des formwechselnden  Rechtsträgers, ist wenn sie binnen sechs Monaten nach dem Tag, an dem die Eintragung der Formwechsels nach § 201 UmwG als bekanntgemacht gilt, ihren Anspruch nach Grund und Höhe schriftlich anmelden, Sicherheit zu leisten, soweit sie nicht Befriedigung verlangen können. Dieses Recht steht ihnen jedoch nur zu, wenn sie glaubhaft machen, dass durch den Formwechsel die Erfüllung ihrer Forderung gefährdet wird"
    },
    {
      "date": "2025-01-24",
      "id": "99514",
      "original_text": "Registerbekanntmachung nach dem Umwandlungsgesetz\nSachsen-Anhalt Amtsgericht Stendal HRB 209273\nUHLE GMBH – Reichardtswerben",
      "type": "Registerbekanntmachung nach dem Umwandlungsgesetz",
      "state": "Sachsen-Anhalt",
      "amtsgericht": "Amtsgericht Stendal",
      "registernummer": "HRB 209273",
      "registerart": "HRB",
      "company_name": "UHLE GMBH",
      "company_seat": "Reichardtswerben",
      "details": "24.01.2025 (Bekanntmachungsdatum)\n\nSachsen-Anhalt Amtsgericht Stendal HRB 209273\nRegisterbekanntmachung nach dem Umwandlungsgesetz 24.01.2025 (Eintragungsdatum)\n\nUHLE GMBH\nGesellschaft mit beschränkter Haftung\nReichardtswerben\n\nDie Gesellschaft ist auf Grund des Verschmelzungsvertrages vom 02.01.2025 sowie des Beschlusses der Gesellschafterversammlung vom selben Tag mit dem Vermögen des Alleingesellschafters Karsten Uhle, Weißenfels, *05.10.1962 verschmolzen. Das Unternehmen wird als Einzelfirma unter der Firma UHLE Meisterbetrieb für GAS-WASSER-SANITÄR-HEIZUNG e.K. mit dem Sitz in Weißenfels (Amtsgericht Stendal HRA 7951) geführt. Nicht eingetragen:\nDen Gläubigern der an der Verschmelzung beteiligten Rechtsträger ist, wenn sie binnen sechs Monaten nach dem Tag, an dem die Eintragung der Verschmelzung nach § 19 Abs. 3 UmwG als bekanntgemacht gilt, ihren Anspruch nach Grund und Höhe schriftlich anmelden, Sicherheit zu leisten, soweit sie nicht Befriedigung verlangen können. Dieses Recht steht ihnen jedoch nur zu, wenn sie glaubhaft machen, dass durch die Verschmelzung die Erfüllung ihrer Forderung gefährdet wird."
    },
    {
      "date": "2025-01-24",
      "id": "99515",
      "original_text": "Registerbekanntmachung nach dem Umwandlungsgesetz\nBaden-Württemberg Amtsgericht Stuttgart HRB 723343\nPS Panzersplitt GmbH – Eschbronn",
      "type": "Registerbekanntmachung nach dem Umwandlungsgesetz",
      "state": "Baden-Württemberg",
      "amtsgericht": "Amtsgericht Stuttgart",
      "registernummer": "HRB 723343",
      "registerart": "HRB",
      "company_name": "PS Panzersplitt GmbH",
      "company_seat": "Eschbronn",
      "details": "24.01.2025 (Bekanntmachungsdatum)\n\nBaden-Württemberg Amtsgericht Stuttgart HRB 723343\nRegisterbekanntmachung nach dem Umwandlungsgesetz 24.01.2025 (Eintragungsdatum)\n\nPS Panzersplitt GmbH\nGesellschaft mit beschränkter Haftung\nEschbronn\n\nAls nicht eingetragen wird bekanntgemacht:\nDen Gläubigern des an dem Formwechsel beteiligten Rechtsträgers ist, wenn sie binnen sechs Monaten nach dem Tag, an dem die Eintragung des Formwechsels in das Register des Sitzes desjenigen Rechtsträgers, dessen Gläubiger sie sind, nach § 19 Abs. 3 UmwG als bekanntgemacht gilt, ihren Anspruch nach Grund und Höhe schriftlich anmelden, Sicherheit zu leisten, soweit sie nicht Befriedigung verlangen können. Dieses Recht steht den Gläubigern jedoch nur zu, wenn sie glaubhaft machen, dass durch den Formwechsel die Erfüllung ihrer Forderung gefährdet wird."
    },
    {
      "date": "2025-01-24",
      "id": "99516",
      "original_text": "Einreichung neuer Dokumente\nBerlin Amtsgericht Berlin (Charlottenburg) HRB 229247\nWhitefield Investment AG – Berlin",
      "type": "Einreichung neuer Dokumente",
      "state": "Berlin",
      "amtsgericht": "Amtsgericht Berlin (Charlottenburg)",
      "registernummer": "HRB 229247",
      "registerart": "HRB",
      "company_name": "Whitefield Investment AG",
      "company_seat": "Berlin",
      "details": "24.01.2025 (Bekanntmachungsdatum)\n\nBerlin Amtsgericht Berlin (Charlottenburg) HRB 229247\nEinreichung neuer Dokumente\n\nWhitefield Investment AG\nAktiengesellschaft\nBerlin\n\nAls nicht eingetragen wird veröffentlicht: Es wurde eine neue Liste der Aufsichtsratsmitglieder eingereicht (§ 106 AktG)."
    },
    {
      "date": "2025-01-24",
      "id": "99517",
      "original_text": "Einreichung neuer Dokumente\nBerlin Amtsgericht Berlin (Charlottenburg) HRB 70764\nBundesdruckerei GmbH – Berlin",
      "type": "Einreichung neuer Dokumente",
      "state": "Berlin",
      "amtsgericht": "Amtsgericht Berlin (Charlottenburg)",
      "registernummer": "HRB 70764",
      "registerart": "HRB",
      "company_name": "Bundesdruckerei GmbH",
      "company_seat": "Berlin",
      "details": "24.01.2025 (Bekanntmachungsdatum)\n\nBerlin Amtsgericht Berlin (Charlottenburg) HRB 70764\nEinreichung neuer Dokumente\n\nBundesdruckerei GmbH\nGesellschaft mit beschränkter Haftung\nBerlin\n\nAls nicht eingetragen wird veröffentlicht:"
    },
    {
      "date": "2025-01-24",
      "id": "99518",
      "original_text": "Einreichung neuer Dokumente\nThüringen Amtsgericht Jena HRB 402436\nBadehaus Nordhausen GmbH – Nordhausen",
      "type": "Einreichung neuer Dokumente",
      "state": "Thüringen",
      "amtsgericht": "Amtsgericht Jena",
      "registernummer": "HRB 402436",
      "registerart": "HRB",
      "company_name": "Badehaus Nordhausen GmbH",
      "company_seat": "Nordhausen",
      "details": "24.01.2025 (Bekanntmachungsdatum)\n\nThüringen Amtsgericht Jena HRB 402436\nEinreichung neuer Dokumente\n\nBadehaus Nordhausen GmbH\nGesellschaft mit beschränkter Haftung\nNordhausen\n\nBekanntmachung gem. § 52 Abs. 3 Satz 2 GmbHG: Aufgrund einer Veränderung in den Personen der Aufsichtsratsmitglieder ist durch die Geschäftsführer eine neue Liste zum Handelsregister eingereicht worden."
    },
    {
      "date": "2025-01-24",
      "id": "99519",
      "original_text": "Löschungsankündigung\nBerlin Amtsgericht Berlin (Charlottenburg) HRB 243874\nAbachum UG (haftungsbeschränkt) – Berlin",
      "type": "Löschungsankündigung",
      "state": "Berlin",
      "amtsgericht": "Amtsgericht Berlin (Charlottenburg)",
      "registernummer": "HRB 243874",
      "registerart": "HRB",
      "company_name": "Abachum UG (haftungsbeschränkt)",
      "company_seat": "Berlin",
      "details": "24.01.2025 (Bekanntmachungsdatum)\n\nBerlin Amtsgericht Berlin (Charlottenburg) HRB 243874\nLöschungsankündigung\n\nAbachum UG (haftungsbeschränkt)\nGesellschaft mit beschränkter Haftung\nBerlin\n\nBei der nachstehenden Gesellschaft wird das Amtslöschungsverfahren gemäß § 394 FamFG eingeleitet. Widerspruchsfrist 6 Wochen"
    },
    {
      "date": "2025-01-24",
      "id": "99520",
      "original_text": "Löschungsankündigung\nBerlin Amtsgericht Berlin (Charlottenburg) HRB 237054\nALICE Handels UG (haftungsbeschränkt) – Berlin",
      "type": "Löschungsankündigung",
      "state": "Berlin",
      "amtsgericht": "Amtsgericht Berlin (Charlottenburg)",
      "registernummer": "HRB 237054",
      "registerart": "HRB",
      "company_name": "ALICE Handels UG (haftungsbeschränkt)",
      "company_seat": "Berlin",
      "details": "24.01.2025 (Bekanntmachungsdatum)\n\nBerlin Amtsgericht Berlin (Charlottenburg) HRB 237054\nLöschungsankündigung\n\nALICE Handels UG (haftungsbeschränkt)\nGesellschaft mit beschränkter Haftung\nBerlin\n\nBei der nachstehenden Gesellschaft wird das Amtslöschungsverfahren gemäß § 394 FamFG eingeleitet. Widerspruchsfrist 6 Wochen"
    },
    {
      "date": "2025-01-24",
      "id": "99521",
      "original_text": "Löschungsankündigung\nBerlin Amtsgericht Berlin (Charlottenburg) HRB 125541\nKastro Bauservice GmbH – Berlin",
      "type": "Löschungsankündigung",
      "state": "Berlin",
      "amtsgericht": "Amtsgericht Berlin (Charlottenburg)",
      "registernummer": "HRB 125541",
      "registerart": "HRB",
      "company_name": "Kastro Bauservice GmbH",
      "company_seat": "Berlin",
      "details": "24.01.2025 (Bekanntmachungsdatum)\n\nBerlin Amtsgericht Berlin (Charlottenburg) HRB 125541\nLöschungsankündigung\n\nKastro Bauservice GmbH\nGesellschaft mit beschränkter Haftung\nBerlin\n\nBei der nachstehenden Gesellschaft wird das Amtslöschungsverfahren gemäß § 394 FamFG eingeleitet. Widerspruchsfrist 6 Wochen"
    },
    {
      "date": "2025-01-24",
      "id": "99522",
      "original_text": "Einreichung neuer Dokumente\nSchleswig-Holstein Amtsgericht Kiel HRB 5704\nProvinzial Nord Brandkasse Aktiengesellschaft – Kiel",
      "type": "Einreichung neuer Dokumente",
      "state": "Schleswig-Holstein",
      "amtsgericht": "Amtsgericht Kiel",
      "registernummer": "HRB 5704",
      "registerart": "HRB",
      "company_name": "Provinzial Nord Brandkasse Aktiengesellschaft",
      "company_seat": "Kiel",
      "details": "24.01.2025 (Bekanntmachungsdatum)\n\nSchleswig-Holstein Amtsgericht Kiel HRB 5704\nEinreichung neuer Dokumente\n\nProvinzial Nord Brandkasse Aktiengesellschaft\nAktiengesellschaft\nKiel\n\nAls nicht eingetragen wird veröffentlicht:Eine neue Liste der Aufsichtsratsmitglieder ist eingereicht worden."
    },
    {
      "date": "2025-01-24",
      "id": "99523",
      "original_text": "Löschungsankündigung\nBerlin Amtsgericht Berlin (Charlottenburg) HRB 139211\nUni-Tex Trade UG (haftungsbeschränkt) – Berlin",
      "type": "Löschungsankündigung",
      "state": "Berlin",
      "amtsgericht": "Amtsgericht Berlin (Charlottenburg)",
      "registernummer": "HRB 139211",
      "registerart": "HRB",
      "company_name": "Uni-Tex Trade UG (haftungsbeschränkt)",
      "company_seat": "Berlin",
      "details": "24.01.2025 (Bekanntmachungsdatum)\n\nBerlin Amtsgericht Berlin (Charlottenburg) HRB 139211\nLöschungsankündigung\n\nUni-Tex Trade UG (haftungsbeschränkt)\nGesellschaft mit beschränkter Haftung\nBerlin\n\nBei der nachstehenden Gesellschaft wird das Amtslöschungsverfahren gemäß § 394 FamFG eingeleitet. Widerspruchsfrist 6 Wochen"
    },
    {
      "date": "2025-01-24",
      "id": "99524",
      "original_text": "Löschungsankündigung\nBerlin Amtsgericht Berlin (Charlottenburg) HRB 254996\nCity Service Management GmbH – Berlin",
      "type": "Löschungsankündigung",
      "state": "Berlin",
      "amtsgericht": "Amtsgericht Berlin (Charlottenburg)",
      "registernummer": "HRB 254996",
      "registerart": "HRB",
      "company_name": "City Service Management GmbH",
      "company_seat": "Berlin",
      "details": "24.01.2025 (Bekanntmachungsdatum)\n\nBerlin Amtsgericht Berlin (Charlottenburg) HRB 254996\nLöschungsankündigung\n\nCity Service Management GmbH\nGesellschaft mit beschränkter Haftung\nBerlin\n\nEs ist beabsichtigt, die Eintragung wegen Mangels einer wesentlichen Voraussetzung gemäß § 395 FamFG von Amts wegen zu löschen. Widerspruchsfrist 6 Wochen"
    },
    {
      "date": "2025-01-24",
      "id": "99525",
      "original_text": "Einreichung neuer Dokumente\nBaden-Württemberg Amtsgericht Mannheim HRB 710920\nSIXBID AG – Baden-Baden",
      "type": "Einreichung neuer Dokumente",
      "state": "Baden-Württemberg",
      "amtsgericht": "Amtsgericht Mannheim",
      "registernummer": "HRB 710920",
      "registerart": "HRB",
      "company_name": "SIXBID AG",
      "company_seat": "Baden-Baden",
      "details": "24.01.2025 (Bekanntmachungsdatum)\n\nBaden-Württemberg Amtsgericht Mannheim HRB 710920\nEinreichung neuer Dokumente 24.01.2025 (Eintragungsdatum)\n\nSIXBID AG\nAktiengesellschaft\nBaden-Baden\n\nDie Gesellschaft hat am 21.01.2025 die Liste über die Zusammensetzung des Aufsichtsrats zum Handelsregister eingereicht."
    },
    {
      "date": "2025-01-24",
      "id": "99526",
      "original_text": "Einreichung neuer Dokumente\nBerlin Amtsgericht Berlin (Charlottenburg) HRB 57494\nTotalEnergies Marketing Deutschland GmbH – Berlin",
      "type": "Einreichung neuer Dokumente",
      "state": "Berlin",
      "amtsgericht": "Amtsgericht Berlin (Charlottenburg)",
      "registernummer": "HRB 57494",
      "registerart": "HRB",
      "company_name": "TotalEnergies Marketing Deutschland GmbH",
      "company_seat": "Berlin",
      "details": "24.01.2025 (Bekanntmachungsdatum)\n\nBerlin Amtsgericht Berlin (Charlottenburg) HRB 57494\nEinreichung neuer Dokumente\n\nTotalEnergies Marketing Deutschland GmbH\nGesellschaft mit beschränkter Haftung\nBerlin\n\nAls nicht eingetragen wird veröffentlicht: Es wurde eine neue Liste der Aufsichtsratsmitglieder eingereicht (§52 GmbHG)."
    },
    {
      "date": "2025-01-24",
      "id": "99527",
      "original_text": "Einreichung neuer Dokumente\nBaden-Württemberg Amtsgericht Mannheim HRB 749949\nGrafenberg AG – Karlsruhe",
      "type": "Einreichung neuer Dokumente",
      "state": "Baden-Württemberg",
      "amtsgericht": "Amtsgericht Mannheim",
      "registernummer": "HRB 749949",
      "registerart": "HRB",
      "company_name": "Grafenberg AG",
      "company_seat": "Karlsruhe",
      "details": "24.01.2025 (Bekanntmachungsdatum)\n\nBaden-Württemberg Amtsgericht Mannheim HRB 749949\nEinreichung neuer Dokumente\n\nGrafenberg AG\nAktiengesellschaft\nKarlsruhe\n\nDie Gesellschaft hat am 23.01.2025 die Liste über die Zusammensetzung des Aufsichtsrats zum Handelsregister eingereicht."
    },
    {
      "date": "2025-01-24",
      "id": "99528",
      "original_text": "Registerbekanntmachung nach dem Umwandlungsgesetz\nBaden-Württemberg Amtsgericht Stuttgart HRB 762379\nPrototools Verwaltungs GmbH – Neuenstadt am Kocher",
      "type": "Registerbekanntmachung nach dem Umwandlungsgesetz",
      "state": "Baden-Württemberg",
      "amtsgericht": "Amtsgericht Stuttgart",
      "registernummer": "HRB 762379",
      "registerart": "HRB",
      "company_name": "Prototools Verwaltungs GmbH",
      "company_seat": "Neuenstadt am Kocher",
      "details": "24.01.2025 (Bekanntmachungsdatum)\n\nBaden-Württemberg Amtsgericht Stuttgart HRB 762379\nRegisterbekanntmachung nach dem Umwandlungsgesetz 24.01.2025 (Eintragungsdatum)\n\nPrototools Verwaltungs GmbH\nGesellschaft mit beschränkter Haftung\nNeuenstadt am Kocher\n\nAls nicht eingetragen wird bekanntgemacht:\nDen Gläubigern der an der Verschmelzung beteiligten Rechtsträger ist, wenn sie binnen sechs Monaten nach dem Tag, an dem die Eintragung der Verschmelzung in das Register des Sitzes desjenigen Rechtsträgers, dessen Gläubiger sie sind, nach § 19 Abs. 3 UmwG als bekanntgemacht gilt, ihren Anspruch nach Grund und Höhe schriftlich anmelden, Sicherheit zu leisten, soweit sie nicht Befriedigung verlangen können. Dieses Recht steht den Gläubigern jedoch nur zu, wenn sie glaubhaft machen, dass durch die Verschmelzung die Erfüllung ihrer Forderung gefährdet wird."
    },
    {
      "date": "2025-01-24",
      "id": "99529",
      "original_text": "Einreichung neuer Dokumente\nSachsen Amtsgericht Leipzig HRB 6824\nLESG Gesellschaft der Stadt Leipzig zur Erschließung, Entwicklung und Sanierung von Baugebieten mit beschränkter Haftung – Leipzig",
      "type": "Einreichung neuer Dokumente",
      "state": "Sachsen",
      "amtsgericht": "Amtsgericht Leipzig",
      "registernummer": "HRB 6824",
      "registerart": "HRB",
      "company_name": "LESG Gesellschaft der Stadt Leipzig zur Erschließung, Entwicklung und Sanierung von Baugebieten mit beschränkter Haftung",
      "company_seat": "Leipzig",
      "details": "24.01.2025 (Bekanntmachungsdatum)\n\nSachsen Amtsgericht Leipzig HRB 6824\nEinreichung neuer Dokumente\n\nLESG Gesellschaft der Stadt Leipzig zur Erschließung, Entwicklung und Sanierung von Baugebieten mit beschränkter Haftung\nGesellschaft mit beschränkter Haftung\nLeipzig\n\nAm 08.01.2025 wurde beim Handelsregister des Amtsgerichts Leipzig die Liste der Mitglieder des Aufsichtsrats gemäß § 52 GmbHG eingereicht."
    },
    {
      "date": "2025-01-24",
      "id": "99530",
      "original_text": "Registerbekanntmachung nach dem Umwandlungsgesetz\nSachsen Amtsgericht Leipzig HRB 33837\nGreenfield GmbH – Leipzig",
      "type": "Registerbekanntmachung nach dem Umwandlungsgesetz",
      "state": "Sachsen",
      "amtsgericht": "Amtsgericht Leipzig",
      "registernummer": "HRB 33837",
      "registerart": "HRB",
      "company_name": "Greenfield GmbH",
      "company_seat": "Leipzig",
      "details": "24.01.2025 (Bekanntmachungsdatum)\n\nSachsen Amtsgericht Leipzig HRB 33837\nRegisterbekanntmachung nach dem Umwandlungsgesetz 24.01.2025 (Eintragungsdatum)\n\nGreenfield GmbH\nGesellschaft mit beschränkter Haftung\nLeipzig\n\nDen Gläubigern der an der Verschmelzung beteiligten Rechtsträger ist, wenn sie binnen sechs Monaten nach dem Tag, an dem die Eintragung der Verschmelzung in das Register des Sitzes desjenigen Rechtsträgers, dessen Gläubiger sie sind, nach § 19 Abs. 3 UmwG als bekannt gemacht gilt, ihren Anspruch nach Grund und Höhe in Textform anmelden, Sicherheit zu leisten, soweit sie nicht Befriedigung verlangen können. Dieses Recht steht den Gläubigern jedoch nur zu, wenn sie glaubhaft machen, dass durch die Verschmelzung die Erfüllung der Forderung gefährdet wird."
    },
    {
      "date": "2025-01-24",
      "id": "99531",
      "original_text": "Löschungsankündigung\nSachsen Amtsgericht Dresden HRB 19557\nThiel Spedition GmbH – Eibau",
      "type": "Löschungsankündigung",
      "state": "Sachsen",
      "amtsgericht": "Amtsgericht Dresden",
      "registernummer": "HRB 19557",
      "registerart": "HRB",
      "company_name": "Thiel Spedition GmbH",
      "company_seat": "Eibau",
      "details": "24.01.2025 (Bekanntmachungsdatum)\n\nSachsen Amtsgericht Dresden HRB 19557\nLöschungsankündigung\n\nThiel Spedition GmbH\nGesellschaft mit beschränkter Haftung\nEibau\n\nDas Registergericht beabsichtigt, die im Handelsregister eingetragene Gesellschaft von Amts wegen nach § 394 FamFG zu löschen. Die Frist zu Erhebung eines Widerspruchs gegen die beabsichtigte Löschung wird auf einen Monat festgesetzt."
    },
    {
      "date": "2025-01-24",
      "id": "99532",
      "original_text": "Einreichung neuer Dokumente\nNiedersachsen Amtsgericht Braunschweig HRB 100013 früher Amtsgericht Wolfsburg\nNeuland Wohnungsgesellschaft mit beschränkter Haftung – Wolfsburg",
      "type": "Einreichung neuer Dokumente",
      "state": "Niedersachsen",
      "amtsgericht": "Amtsgericht Braunschweig",
      "registernummer": "HRB 100013",
      "registerart": "HRB",
      "company_name": "Neuland Wohnungsgesellschaft mit beschränkter Haftung",
      "company_seat": "Wolfsburg",
      "former_amtsgericht": "Wolfsburg",
      "details": "24.01.2025 (Bekanntmachungsdatum)\n\nNiedersachsen Amtsgericht Braunschweig HRB 100013 früher Amtsgericht Wolfsburg\nEinreichung neuer Dokumente\n\nNeuland Wohnungsgesellschaft mit beschränkter Haftung\nGesellschaft mit beschränkter Haftung\nWolfsburg\n\nEine aktuelle Liste der Mitglieder des Aufsichtsrats wurde beim Registergericht eingereicht."
    },
    {
      "date": "2025-01-24",
      "id": "99533",
      "original_text": "Einreichung neuer Dokumente\nNiedersachsen Amtsgericht Braunschweig HRB 6609\nSalzgitter Flachstahl GmbH – Salzgitter",
      "type": "Einreichung neuer Dokumente",
      "state": "Niedersachsen",
      "amtsgericht": "Amtsgericht Braunschweig",
      "registernummer": "HRB 6609",
      "registerart": "HRB",
      "company_name": "Salzgitter Flachstahl GmbH",
      "company_seat": "Salzgitter",
      "details": "24.01.2025 (Bekanntmachungsdatum)\n\nNiedersachsen Amtsgericht Braunschweig HRB 6609\nEinreichung neuer Dokumente 24.01.2025 (Eintragungsdatum)\n\nSalzgitter Flachstahl GmbH\nGesellschaft mit beschränkter Haftung\nSalzgitter\n\nDie Liste der Mitglieder des Aufsichtsrats wurde beim Registergericht eingereicht."
    },
    {
      "date": "2025-01-24",
      "id": "99534",
      "original_text": "Registerbekanntmachung nach dem Umwandlungsgesetz\nNiedersachsen Amtsgericht Hannover HRB 58629\nBantleon Invest Kapitalverwaltungsgesellschaft mbH – Hannover",
      "type": "Registerbekanntmachung nach dem Umwandlungsgesetz",
      "state": "Niedersachsen",
      "amtsgericht": "Amtsgericht Hannover",
      "registernummer": "HRB 58629",
      "registerart": "HRB",
      "company_name": "Bantleon Invest Kapitalverwaltungsgesellschaft mbH",
      "company_seat": "Hannover",
      "details": "24.01.2025 (Bekanntmachungsdatum)\n\nNiedersachsen Amtsgericht Hannover HRB 58629\nRegisterbekanntmachung nach dem Umwandlungsgesetz 24.01.2025 (Eintragungsdatum)\n\nBantleon Invest Kapitalverwaltungsgesellschaft mbH\nGesellschaft mit beschränkter Haftung\nHannover\n\nDen Gläubigern der an der formwechselnden Umwandlung beteiligten Rechtsträger ist, wenn sie binnen sechs Monaten nach dem Tag, an dem die Eintragung der Umwandlung in das Register des Sitzes desjenigen Rechtsträgers, dessen Gläubiger sie sind, nach § 19 Abs. 3 UmwG als bekannt gemacht gilt, ihren Anspruch nach Grund und Höhe schriftlich anmelden, Sicherheit zu leisten, soweit sie nicht Befriedigung verlangen können. Dieses Recht steht den Gläubigern jedoch nur zu, wenn sie glaubhaft machen, dass durch die formwechselnde Umwandlung die Erfüllung der Forderung gefährdet wird."
    },
    {
      "date": "2025-01-24",
      "id": "99535",
      "original_text": "Sonstige Registerbekanntmachung\nNiedersachsen Amtsgericht Tostedt GnR 120012 früher Amtsgericht Buxtehude\nVolksbank Geest eG – Apensen",
      "type": "Sonstige Registerbekanntmachung",
      "state": "Niedersachsen",
      "amtsgericht": "Amtsgericht Tostedt",
      "registernummer": "GnR 120012",
      "registerart": "GnR",
      "company_name": "Volksbank Geest eG",
      "company_seat": "Apensen",
      "former_amtsgericht": "Buxtehude",
      "details": "24.01.2025 (Bekanntmachungsdatum)\n\nNiedersachsen Amtsgericht Tostedt GnR 120012 früher Amtsgericht Buxtehude\nSonstige Registerbekanntmachung 17.10.2023 (Eintragungsdatum)\n\nVolksbank Geest eG\neingetragene Genossenschaft\nApensen\n\nNeue Regelung: Keine Nachschusspflicht. Den Gläubigern der Genossenschaft ist, wenn sie sich binnen sechs Monaten nach dieser Bekanntmachung zu diesem Zweck bei der Genossenschaft melden, Sicherheit zu leisten, soweit sie nicht Befriedigung verlangen können."
    },
    {
      "date": "2025-01-24",
      "id": "99536",
      "original_text": "Sonstige Registerbekanntmachung\nNiedersachsen Amtsgericht Tostedt GnR 100001 früher Amtsgericht Stade\nVolksbank Stade-Cuxhaven eG – Stade",
      "type": "Sonstige Registerbekanntmachung",
      "state": "Niedersachsen",
      "amtsgericht": "Amtsgericht Tostedt",
      "registernummer": "GnR 100001",
      "registerart": "GnR",
      "company_name": "Volksbank Stade-Cuxhaven eG",
      "company_seat": "Stade",
      "former_amtsgericht": "Stade",
      "details": "24.01.2025 (Bekanntmachungsdatum)\n\nNiedersachsen Amtsgericht Tostedt GnR 100001 früher Amtsgericht Stade\nSonstige Registerbekanntmachung 13.11.2023 (Eintragungsdatum)\n\nVolksbank Stade-Cuxhaven eG\neingetragene Genossenschaft\nStade\n\nNeue Regelung: Nachschusspflicht aufgehoben. Den Gläubigern der Genossenschaft ist, wenn sie sich binnen sechs Monaten nach dieser Bekanntmachung zu diesem Zweck bei der Genossenschaft melden, Sicherheit zu leisten, soweit sie nicht Befriedigung verlangen können."
    },
    {
      "date": "2025-01-24",
      "id": "99537",
      "original_text": "Löschungsankündigung\nNiedersachsen Amtsgericht Stadthagen HRB 201468\nBookfactory Buchproduktion GmbH – Stadthagen",
      "type": "Löschungsankündigung",
      "state": "Niedersachsen",
      "amtsgericht": "Amtsgericht Stadthagen",
      "registernummer": "HRB 201468",
      "registerart": "HRB",
      "company_name": "Bookfactory Buchproduktion GmbH",
      "company_seat": "Stadthagen",
      "details": "24.01.2025 (Bekanntmachungsdatum)\n\nNiedersachsen Amtsgericht Stadthagen HRB 201468\nLöschungsankündigung\n\nBookfactory Buchproduktion GmbH\nGesellschaft mit beschränkter Haftung\nStadthagen\n\nDas Registergericht beabsichtigt, die Gesellschaft von Amts wegen nach § 394 FamFG zu löschen. Die Frist zur Erhebung eines Widerspruchs ist auf 1 Monat ab dieser Registerbekanntmachung festgesetzt."
    },
    {
      "date": "2025-01-24",
      "id": "99538",
      "original_text": "Löschungsankündigung\nNiedersachsen Amtsgericht Hildesheim HRA 200367\nGTN Kommunikations- und Sicherungssysteme GmbH & Co. KG – Holle",
      "type": "Löschungsankündigung",
      "state": "Niedersachsen",
      "amtsgericht": "Amtsgericht Hildesheim",
      "registernummer": "HRA 200367",
      "registerart": "HRA",
      "company_name": "GTN Kommunikations- und Sicherungssysteme GmbH & Co. KG",
      "company_seat": "Holle",
      "details": "24.01.2025 (Bekanntmachungsdatum)\n\nNiedersachsen Amtsgericht Hildesheim HRA 200367\nLöschungsankündigung 24.01.2025 (Eintragungsdatum)\n\nGTN Kommunikations- und Sicherungssysteme GmbH & Co. KG\nKommanditgesellschaft\nHolle\n\nDas Registergericht beabsichtigt, die Firma von Amts wegen nach § 394 FamFG zu löschen. Die Frist zur Erhebung eines Widerspruchs ist auf 1 Monat ab dieser Registerbekanntmachung festgesetzt."
    },
    {
      "date": "2025-01-24",
      "id": "99539",
      "original_text": "Löschungsankündigung\nNiedersachsen Amtsgericht Stadthagen HRB 201757\nBlackbird Handel UG (haftungsbeschränkt) – Lüdersfeld",
      "type": "Löschungsankündigung",
      "state": "Niedersachsen",
      "amtsgericht": "Amtsgericht Stadthagen",
      "registernummer": "HRB 201757",
      "registerart": "HRB",
      "company_name": "Blackbird Handel UG (haftungsbeschränkt)",
      "company_seat": "Lüdersfeld",
      "details": "24.01.2025 (Bekanntmachungsdatum)\n\nNiedersachsen Amtsgericht Stadthagen HRB 201757\nLöschungsankündigung\n\nBlackbird Handel UG (haftungsbeschränkt)\nGesellschaft mit beschränkter Haftung\nLüdersfeld\n\nDas Registergericht beabsichtigt, die Gesellschaft von Amts wegen nach § 394 FamFG zu löschen. Die Frist zur Erhebung eines Widerspruchs ist auf 1 Monat ab dieser Registerbekanntmachung festgesetzt."
    },
    {
      "date": "2025-01-24",
      "id": "99540",
      "original_text": "Löschungsankündigung\nRheinland-Pfalz Amtsgericht Ludwigshafen a.Rhein (Ludwigshafen) HRB 64837\nSahin Bauservice GmbH – Ludwigshafen/Rhein",
      "type": "Löschungsankündigung",
      "state": "Rheinland-Pfalz",
      "amtsgericht": "Amtsgericht Ludwigshafen a.Rhein (Ludwigshafen)",
      "registernummer": "HRB 64837",
      "registerart": "HRB",
      "company_name": "Sahin Bauservice GmbH",
      "company_seat": "Ludwigshafen/Rhein",
      "details": "24.01.2025 (Bekanntmachungsdatum)\n\nRheinland-Pfalz Amtsgericht Ludwigshafen a.Rhein (Ludwigshafen) HRB 64837\nLöschungsankündigung\n\nSahin Bauservice GmbH\nGesellschaft mit beschränkter Haftung\nLudwigshafen/Rhein\n\nDas Registergericht beabsichtigt die Gesellschaft von Amts wegen nach § 394 FamFG zu löschen. Die Frist zur Erhebung eines Widerspruchs ist auf einen Monat festgesetzt."
    },
    {
      "date": "2025-01-24",
      "id": "99541",
      "original_text": "Sonstige Registerbekanntmachung\nRheinland-Pfalz Amtsgericht Zweibrücken HRB 22935\nPirmasenser Luft- und Badepark (PLUB) GmbH – Pirmasens",
      "type": "Sonstige Registerbekanntmachung",
      "state": "Rheinland-Pfalz",
      "amtsgericht": "Amtsgericht Zweibrücken",
      "registernummer": "HRB 22935",
      "registerart": "HRB",
      "company_name": "Pirmasenser Luft- und Badepark (PLUB) GmbH",
      "company_seat": "Pirmasens",
      "details": "24.01.2025 (Bekanntmachungsdatum)\n\nRheinland-Pfalz Amtsgericht Zweibrücken HRB 22935\nSonstige Registerbekanntmachung 23.01.2025 (Eintragungsdatum)\n\nPirmasenser Luft- und Badepark (PLUB) GmbH\nGesellschaft mit beschränkter Haftung\nPirmasens\n\nDem Registergericht ist eine neue Liste der Mitglieder des Aufsichtsrates eingereicht worden."
    },
    {
      "date": "2025-01-24",
      "id": "99542",
      "original_text": "Registerbekanntmachung nach dem Umwandlungsgesetz\nRheinland-Pfalz Amtsgericht Kaiserslautern HRA 30729\nHollinger New Home Entwicklungs GmbH & Co. KG – Konken",
      "type": "Registerbekanntmachung nach dem Umwandlungsgesetz",
      "state": "Rheinland-Pfalz",
      "amtsgericht": "Amtsgericht Kaiserslautern",
      "registernummer": "HRA 30729",
      "registerart": "HRA",
      "company_name": "Hollinger New Home Entwicklungs GmbH & Co. KG",
      "company_seat": "Konken",
      "details": "24.01.2025 (Bekanntmachungsdatum)\n\nRheinland-Pfalz Amtsgericht Kaiserslautern HRA 30729\nRegisterbekanntmachung nach dem Umwandlungsgesetz 24.01.2025 (Eintragungsdatum)\n\nHollinger New Home Entwicklungs GmbH & Co. KG\nKommanditgesellschaft\nKonken\n\nAls nicht eingetragen wird veröffentlicht: Den Gläubigern der an der Ausgliederung beteiligten Rechtsträger ist, wenn sie binnen sechs Monaten nac hdem Tag, an dem die Eintragung der Ausgliederung in das Register des Sitzes desjenigen Rechtsträgers,dessen Gläubiger sie sind, nach § 19 Abs. 3 UmwG als bekannt gemacht gilt, ihren Anspruch nach Grund und Höhe schriftlich anmelden, Sicherheit zu leisten, soweit sie nicht Befriedigung verlangen können. Dieses Recht steht den Gläubigern jedoch nur zu, wenn sie glaubhaft machen, dass durch die Ausgliederung die Erfüllung der Forderung gefährdet wird."
    },
    {
      "date": "2025-01-24",
      "id": "99543",
      "original_text": "Sonstige Registerbekanntmachung\nRheinland-Pfalz Amtsgericht Mainz HRB 6443\nPolycasa GmbH – Mainz",
      "type": "Sonstige Registerbekanntmachung",
      "state": "Rheinland-Pfalz",
      "amtsgericht": "Amtsgericht Mainz",
      "registernummer": "HRB 6443",
      "registerart": "HRB",
      "company_name": "Polycasa GmbH",
      "company_seat": "Mainz",
      "details": "24.01.2025 (Bekanntmachungsdatum)\n\nRheinland-Pfalz Amtsgericht Mainz HRB 6443\nSonstige Registerbekanntmachung 24.01.2025 (Eintragungsdatum)\n\nPolycasa GmbH\nGesellschaft mit beschränkter Haftung\nMainz\n\nAls nicht eingetragen wird veröffentlicht: Den Gläubigern der Gesellschaft, deren Forderungen begründet worden sind, bevor die Eintragung der Beendigung des Gewinnabführungsvertrages in das Handelsregister nach § 10 des Handelsgesetzbuches als bekanntgemacht gilt, hat der andere Vertragsteil Sicherheit zu leisten, wenn sie sich binnen sechs Monaten nach der Bekanntmachung der Eintragung zu diesem Zweck bei ihm melden."
    },
    {
      "date": "2025-01-24",
      "id": "99544",
      "original_text": "Registerbekanntmachung nach dem Umwandlungsgesetz\nRheinland-Pfalz Amtsgericht Kaiserslautern HRA 30667\nEW Bau Hollinger e. K. – Konken",
      "type": "Registerbekanntmachung nach dem Umwandlungsgesetz",
      "state": "Rheinland-Pfalz",
      "amtsgericht": "Amtsgericht Kaiserslautern",
      "registernummer": "HRA 30667",
      "registerart": "HRA",
      "company_name": "EW Bau Hollinger e. K.",
      "company_seat": "Konken",
      "details": "24.01.2025 (Bekanntmachungsdatum)\n\nRheinland-Pfalz Amtsgericht Kaiserslautern HRA 30667\nRegisterbekanntmachung nach dem Umwandlungsgesetz 24.01.2025 (Eintragungsdatum)\n\nEW Bau Hollinger e. K.\nEinzelkaufmann / Einzelkauffrau\nKonken\n\nAls nicht eingetragen wird veröffentlicht: Den Gläubigern der an der Ausgliederung beteiligten Rechtsträger ist, wenn sie binnen sechs Monaten nac hdem Tag, an dem die Eintragung der Ausgliederung in das Register des Sitzes desjenigen Rechtsträgers,dessen Gläubiger sie sind, nach § 19 Abs. 3 UmwG als bekannt gemacht gilt, ihren Anspruch nach Grund und Höhe schriftlich anmelden, Sicherheit zu leisten, soweit sie nicht Befriedigung verlangen können. Dieses Recht steht den Gläubigern jedoch nur zu, wenn sie glaubhaft machen, dass durch die Ausgliederung die Erfüllung der Forderung gefährdet wird."
    },
    {
      "date": "2025-01-24",
      "id": "99545",
      "original_text": "Sonstige Registerbekanntmachung\nRheinland-Pfalz Amtsgericht Zweibrücken HRB 23383\nStadtwerke Pirmasens Versorgungs GmbH – Pirmasens",
      "type": "Sonstige Registerbekanntmachung",
      "state": "Rheinland-Pfalz",
      "amtsgericht": "Amtsgericht Zweibrücken",
      "registernummer": "HRB 23383",
      "registerart": "HRB",
      "company_name": "Stadtwerke Pirmasens Versorgungs GmbH",
      "company_seat": "Pirmasens",
      "details": "24.01.2025 (Bekanntmachungsdatum)\n\nRheinland-Pfalz Amtsgericht Zweibrücken HRB 23383\nSonstige Registerbekanntmachung 23.01.2025 (Eintragungsdatum)\n\nStadtwerke Pirmasens Versorgungs GmbH\nGesellschaft mit beschränkter Haftung\nPirmasens\n\nDem Registergericht ist eine neue Liste der Mitglieder des Aufsichtsrates eingereicht worden."
    },
    {
      "date": "2025-01-24",
      "id": "99546",
      "original_text": "Sonstige Registerbekanntmachung\nRheinland-Pfalz Amtsgericht Zweibrücken HRB 22905\nStadtwerke Pirmasens Holding GmbH – Pirmasens",
      "type": "Sonstige Registerbekanntmachung",
      "state": "Rheinland-Pfalz",
      "amtsgericht": "Amtsgericht Zweibrücken",
      "registernummer": "HRB 22905",
      "registerart": "HRB",
      "company_name": "Stadtwerke Pirmasens Holding GmbH",
      "company_seat": "Pirmasens",
      "details": "24.01.2025 (Bekanntmachungsdatum)\n\nRheinland-Pfalz Amtsgericht Zweibrücken HRB 22905\nSonstige Registerbekanntmachung 23.01.2025 (Eintragungsdatum)\n\nStadtwerke Pirmasens Holding GmbH\nGesellschaft mit beschränkter Haftung\nPirmasens\n\nDem Registergericht ist eine neue Liste der Mitglieder des Aufsichtsrates eingereicht worden."
    },
    {
      "date": "2025-01-24",
      "id": "99547",
      "original_text": "Sonstige Registerbekanntmachung\nRheinland-Pfalz Amtsgericht Mainz HRB 32755\nAlzeyer Beteiligungs- und Verwaltungs-GmbH – Alzey",
      "type": "Sonstige Registerbekanntmachung",
      "state": "Rheinland-Pfalz",
      "amtsgericht": "Amtsgericht Mainz",
      "registernummer": "HRB 32755",
      "registerart": "HRB",
      "company_name": "Alzeyer Beteiligungs- und Verwaltungs-GmbH",
      "company_seat": "Alzey",
      "details": "24.01.2025 (Bekanntmachungsdatum)\n\nRheinland-Pfalz Amtsgericht Mainz HRB 32755\nSonstige Registerbekanntmachung\n\nAlzeyer Beteiligungs- und Verwaltungs-GmbH\nGesellschaft mit beschränkter Haftung\nAlzey\n\nDem Registergericht ist eine neue Liste der Mitglieder des Aufsichtsrates eingereicht worden."
    },
    {
      "date": "2025-01-24",
      "id": "99548",
      "original_text": "Sonstige Registerbekanntmachung\nRheinland-Pfalz Amtsgericht Zweibrücken HRB 23424\nneox Aktiengesellschaft für Informationstechnologie – Pirmasens",
      "type": "Sonstige Registerbekanntmachung",
      "state": "Rheinland-Pfalz",
      "amtsgericht": "Amtsgericht Zweibrücken",
      "registernummer": "HRB 23424",
      "registerart": "HRB",
      "company_name": "neox Aktiengesellschaft für Informationstechnologie",
      "company_seat": "Pirmasens",
      "details": "24.01.2025 (Bekanntmachungsdatum)\n\nRheinland-Pfalz Amtsgericht Zweibrücken HRB 23424\nSonstige Registerbekanntmachung 23.01.2025 (Eintragungsdatum)\n\nneox Aktiengesellschaft für Informationstechnologie\nAktiengesellschaft\nPirmasens\n\nDem Registergericht ist eine neue Liste der Mitglieder des Aufsichtsrates eingereicht worden."
    },
    {
      "date": "2025-01-24",
      "id": "99549",
      "original_text": "Sonstige Registerbekanntmachung\nNordrhein-Westfalen Amtsgericht Aachen HRB 4306\nWochenblatt-Zustellung Grenzland GmbH – Aachen",
      "type": "Sonstige Registerbekanntmachung",
      "state": "Nordrhein-Westfalen",
      "amtsgericht": "Amtsgericht Aachen",
      "registernummer": "HRB 4306",
      "registerart": "HRB",
      "company_name": "Wochenblatt-Zustellung Grenzland GmbH",
      "company_seat": "Aachen",
      "details": "24.01.2025 (Bekanntmachungsdatum)\n\nNordrhein-Westfalen Amtsgericht Aachen HRB 4306\nSonstige Registerbekanntmachung 24.01.2025 (Eintragungsdatum)\n\nWochenblatt-Zustellung Grenzland GmbH\nGesellschaft mit beschränkter Haftung\nAachen\n\nAls nicht eingetragen wird veröffentlicht: Den Gläubigern der Gesellschaft, deren Forderungen begründet worden sind bevor die Eintragung der Beendigung des Gewinnabführungsvertrages  in das Handelsregister nach § 10 des Handelsgesetzbuches als bekanntgemacht gilt, hat der andere Vertragsteil Sicherheit zu leisten, wenn sie sich binnen sechs Monaten nach der Bekanntmachung der Eintragung zu diesem Zweck bei ihm melden."
    },
    {
      "date": "2025-01-24",
      "id": "99550",
      "original_text": "Sonstige Registerbekanntmachung\nNordrhein-Westfalen Amtsgericht Köln HRB 92189\nPlusHolding GmbH – Köln",
      "type": "Sonstige Registerbekanntmachung",
      "state": "Nordrhein-Westfalen",
      "amtsgericht": "Amtsgericht Köln",
      "registernummer": "HRB 92189",
      "registerart": "HRB",
      "company_name": "PlusHolding GmbH",
      "company_seat": "Köln",
      "details": "24.01.2025 (Bekanntmachungsdatum)\n\nNordrhein-Westfalen Amtsgericht Köln HRB 92189\nSonstige Registerbekanntmachung 24.01.2025 (Eintragungsdatum)\n\nPlusHolding GmbH\nGesellschaft mit beschränkter Haftung\nKöln\n\nAls nicht eingetragen wird veröffentlicht: Den Gläubigern der Gesellschaft, deren Forderungen begründet worden sind bevor die Eintragung der Beendigung des Beherrschungs- und Gewinnabführungsvertrages  in das Handelsregister nach § 10 des Handelsgesetzbuches als bekanntgemacht gilt, hat der andere Vertragsteil Sicherheit zu leisten, wenn sie sich binnen sechs Monaten nach der Bekanntmachung der Eintragung zu diesem Zweck bei ihm melden."
    },
    {
      "date": "2025-01-24",
      "id": "99551",
      "original_text": "Sonstige Registerbekanntmachung\nNordrhein-Westfalen Amtsgericht Bielefeld HRB 35830\nSymmedia GmbH – Bielefeld",
      "type": "Sonstige Registerbekanntmachung",
      "state": "Nordrhein-Westfalen",
      "amtsgericht": "Amtsgericht Bielefeld",
      "registernummer": "HRB 35830",
      "registerart": "HRB",
      "company_name": "Symmedia GmbH",
      "company_seat": "Bielefeld",
      "details": "24.01.2025 (Bekanntmachungsdatum)\n\nNordrhein-Westfalen Amtsgericht Bielefeld HRB 35830\nSonstige Registerbekanntmachung 23.01.2025 (Eintragungsdatum)\n\nSymmedia GmbH\nGesellschaft mit beschränkter Haftung\nBielefeld\n\nAls nicht eingetragen wird veröffentlicht: Den Gläubigern der Gesellschaft, deren Forderungen begründet worden sind bevor die Eintragung der Beendigung des Beherrschungs- und Gewinnabführungsvertrages  in das Handelsregister nach § 10 des Handelsgesetzbuches als bekanntgemacht gilt, hat der andere Vertragsteil Sicherheit zu leisten, wenn sie sich binnen sechs Monaten nach der Bekanntmachung der Eintragung zu diesem Zweck bei ihm melden."
    },
    {
      "date": "2025-01-24",
      "id": "99552",
      "original_text": "Registerbekanntmachung nach dem Umwandlungsgesetz\nNordrhein-Westfalen Amtsgericht Essen GsR 195\nMartina Kunka und Monika Reisen Praxis für Krankengymnastik eGbR – Essen",
      "type": "Registerbekanntmachung nach dem Umwandlungsgesetz",
      "state": "Nordrhein-Westfalen",
      "amtsgericht": "Amtsgericht Essen",
      "registernummer": "GsR 195",
      "registerart": "GsR",
      "company_name": "Martina Kunka und Monika Reisen Praxis für Krankengymnastik eGbR",
      "company_seat": "Essen",
      "details": "24.01.2025 (Bekanntmachungsdatum)\n\nNordrhein-Westfalen Amtsgericht Essen GsR 195\nRegisterbekanntmachung nach dem Umwandlungsgesetz 24.01.2025 (Eintragungsdatum)\n\nMartina Kunka und Monika Reisen Praxis für Krankengymnastik eGbR\nGesellschaft bürgerlichen Rechts\nEssen\n\nDen Gläubigern der an der formwechselnden Umwandlung beteiligten Rechtsträger ist, wenn sie binnen sechs Monaten nach dem Tag, an dem die Eintragung der formwechselnden Umwandlung in das Register des Sitzes desjenigen Rechtsträgers, dessen Gläubiger sie sind, nach § 19 Absatz 3 UmwG als bekanntgemacht gilt, ihren Anspruch nach Grund und Höhe schriftlich anmelden, Sicherheit zu leisten, soweit sie nicht Befriedigung verlangen können. Dieses Recht steht den Gläubigern jedoch nur zu, wenn sie glaubhaft machen, dass durch die formwechselnden Umwandlung die Erfüllung ihrer Forderung gefährdet wird."
    },
    {
      "date": "2025-01-24",
      "id": "99553",
      "original_text": "Löschungsankündigung\nNordrhein-Westfalen Amtsgericht Krefeld HRB 10944\nPanacific Verwaltungs-GmbH – Krefeld",
      "type": "Löschungsankündigung",
      "state": "Nordrhein-Westfalen",
      "amtsgericht": "Amtsgericht Krefeld",
      "registernummer": "HRB 10944",
      "registerart": "HRB",
      "company_name": "Panacific Verwaltungs-GmbH",
      "company_seat": "Krefeld",
      "details": "24.01.2025 (Bekanntmachungsdatum)\n\nNordrhein-Westfalen Amtsgericht Krefeld HRB 10944\nLöschungsankündigung\n\nPanacific Verwaltungs-GmbH\nGesellschaft mit beschränkter Haftung\nKrefeld\n\nDas Registergericht beabsichtigt die Gesellschaft von Amts wegen nach § 394 FamFG zu löschen. Die Frist zur Erhebung eines Widerspruchs ist auf einen Monat festgesetzt."
    },
    {
      "date": "2025-01-24",
      "id": "99554",
      "original_text": "Löschungsankündigung\nNordrhein-Westfalen Amtsgericht Düsseldorf HRB 96434\nGermtech Trading GmbH – Düsseldorf",
      "type": "Löschungsankündigung",
      "state": "Nordrhein-Westfalen",
      "amtsgericht": "Amtsgericht Düsseldorf",
      "registernummer": "HRB 96434",
      "registerart": "HRB",
      "company_name": "Germtech Trading GmbH",
      "company_seat": "Düsseldorf",
      "details": "24.01.2025 (Bekanntmachungsdatum)\n\nNordrhein-Westfalen Amtsgericht Düsseldorf HRB 96434\nLöschungsankündigung\n\nGermtech Trading GmbH\nGesellschaft mit beschränkter Haftung\nDüsseldorf\n\nDas Registergericht beabsichtigt die Gesellschaft von Amts wegen nach § 394 Abs. 1  FamFG zu löschen. Die Frist zur Erhebung eines Widerspruchs ist auf 3 Wochen festgesetzt.\n\nRechtsbehelfsbelehrung:\nDas Widerspruchsrecht steht jedem zu, der an der Unterlassung der Löschung ein berechtigtes Interesse hat. Der Widerspruch ist bei dem Amtsgericht Düsseldorf -Registergericht-, Werdener Straße 1, 40227 Düsseldorf schriftlich in deutscher Sprache oder zur Niederschrift der Geschäftsstelle einzulegen. Der Widerspruch kann auch zur Niederschrift der Geschäftsstelle eines jeden Amtsgerichtes abgegeben werden. Die Einlegung ist auch durch Übertragung eines elektronischen Dokuments an die elektronische Poststelle des Gerichts möglich. Das elektronische Dokument muss für die Bearbeitung durch das Gericht geeignet und mit einer qualifizierten elektronischen Signatur der verantwortenden Person versehen sein oder von der verantwortenden Person signiert und auf einem sicheren Übermittlungsweg gemäß § 130a ZPO nach näherer Maßgabe der Verordnung über die technischen Rahmenbedingungen des elektronischen Rechtsverkehrs und über das besondere elektronische Behördenpostfach (BGBl. I, S.3803) eingereicht werden. Weitere Informationen erhalten Sie auf der Internetseite www.justiz.de.\nDer Widerspruch muss spätestens innerhalb der gesetzten Frist nach dem Datum der Bekanntmachung der Löschungsankündigung bei dem Amtsgericht - Registergericht - Düsseldorf eingegangen sein.  Dies gilt auch dann, wenn der Widerspruch zur Niederschrift der Geschäftsstelle eines anderen Amtsgerichtes abgegeben wurde. Die Frist beginnt mit dem Tage der Bekanntmachung der Löschungsankündigung in dem für die Bekanntmachung der Eintragungen in das Handelsregister bestimmten elektronischen Informations- und Kommunikationssystem nach § 10 des Handelsgesetzbuches. Fällt das Ende der Frist auf einen Sonntag, einen allgemeinen Feiertag oder Sonnabend, so endet die Frist mit Ablauf des nächsten Werktages.\nDer Widerspruch muss die Bezeichnung der angefochtenen Löschungsankündigung sowie die Erklärung enthalten, dass Widerspruch gegen diese Löschungsankündigung eingelegt wird. Er ist zu unterzeichnen und soll begründet werden."
    },
    {
      "date": "2025-01-24",
      "id": "99555",
      "original_text": "Löschungsankündigung\nNordrhein-Westfalen Amtsgericht Siegen HRB 9336\nHaus Hadem Wohn- und Lebensräume gemeinnützige GmbH – Kreuztal",
      "type": "Löschungsankündigung",
      "state": "Nordrhein-Westfalen",
      "amtsgericht": "Amtsgericht Siegen",
      "registernummer": "HRB 9336",
      "registerart": "HRB",
      "company_name": "Haus Hadem Wohn- und Lebensräume gemeinnützige GmbH",
      "company_seat": "Kreuztal",
      "details": "24.01.2025 (Bekanntmachungsdatum)\n\nNordrhein-Westfalen Amtsgericht Siegen HRB 9336\nLöschungsankündigung\n\nHaus Hadem Wohn- und Lebensräume gemeinnützige GmbH\nGesellschaft mit beschränkter Haftung\nKreuztal\n\nDas Registergericht beabsichtigt die Gesellschaft von Amts wegen nach § 394 FamFG zu löschen. Die Frist zur Erhebung eines Widerspruchs ist auf drei Monate festgesetzt."
    },
    {
      "date": "2025-01-24",
      "id": "99556",
      "original_text": "Löschungsankündigung\nNordrhein-Westfalen Amtsgericht Düsseldorf HRB 93695\nCP COMPANY UG (haftungsbeschränkt) – Duesseldorf",
      "type": "Löschungsankündigung",
      "state": "Nordrhein-Westfalen",
      "amtsgericht": "Amtsgericht Düsseldorf",
      "registernummer": "HRB 93695",
      "registerart": "HRB",
      "company_name": "CP COMPANY UG (haftungsbeschränkt)",
      "company_seat": "Duesseldorf",
      "details": "24.01.2025 (Bekanntmachungsdatum)\n\nNordrhein-Westfalen Amtsgericht Düsseldorf HRB 93695\nLöschungsankündigung\n\nCP COMPANY UG (haftungsbeschränkt)\nGesellschaft mit beschränkter Haftung\nDuesseldorf\n\nDas Registergericht beabsichtigt die Gesellschaft von Amts wegen nach § 394 Abs. 1 FamFG zu löschen. Die Frist zur Erhebung eines Widerspruchs ist auf 3 Wochen festgesetzt.\n\nRechtsbehelfsbelehrung:\nDas Widerspruchsrecht steht jedem zu, der an der Unterlassung der Löschung ein berechtigtes Interesse hat. Der Widerspruch ist bei dem Amtsgericht Düsseldorf -Registergericht-, Werdener Straße 1, 40227 Düsseldorf schriftlich in deutscher Sprache oder zur Niederschrift der Geschäftsstelle einzulegen. Der Widerspruch kann auch zur Niederschrift der Geschäftsstelle eines jeden Amtsgerichtes abgegeben werden. Die Einlegung ist auch durch Übertragung eines elektronischen Dokuments an die elektronische Poststelle des Gerichts möglich. Das elektronische Dokument muss für die Bearbeitung durch das Gericht geeignet und mit einer qualifizierten elektronischen Signatur der verantwortenden Person versehen sein oder von der verantwortenden Person signiert und auf einem sicheren Übermittlungsweg gemäß § 130a ZPO nach näherer Maßgabe der Verordnung über die technischen Rahmenbedingungen des elektronischen Rechtsverkehrs und über das besondere elektronische Behördenpostfach (BGBl. I, S.3803) eingereicht werden. Weitere Informationen erhalten Sie auf der Internetseite www.justiz.de.\nDer Widerspruch muss spätestens innerhalb der gesetzten Frist nach dem Datum der Bekanntmachung der Löschungsankündigung bei dem Amtsgericht - Registergericht - Düsseldorf eingegangen sein.  Dies gilt auch dann, wenn der Widerspruch zur Niederschrift der Geschäftsstelle eines anderen Amtsgerichtes abgegeben wurde. Die Frist beginnt mit dem Tage der Bekanntmachung der Löschungsankündigung in dem für die Bekanntmachung der Eintragungen in das Handelsregister bestimmten elektronischen Informations- und Kommunikationssystem nach § 10 des Handelsgesetzbuches. Fällt das Ende der Frist auf einen Sonntag, einen allgemeinen Feiertag oder Sonnabend, so endet die Frist mit Ablauf des nächsten Werktages.\nDer Widerspruch muss die Bezeichnung der angefochtenen Löschungsankündigung sowie die Erklärung enthalten, dass Widerspruch gegen diese Löschungsankündigung eingelegt wird. Er ist zu unterzeichnen und soll begründet werden."
    },
    {
      "date": "2025-01-24",
      "id": "99557",
      "original_text": "Löschungsankündigung\nNordrhein-Westfalen Amtsgericht Wuppertal HRB 20307\nCity Malerei & Immobilien GmbH – Mettmann",
      "type": "Löschungsankündigung",
      "state": "Nordrhein-Westfalen",
      "amtsgericht": "Amtsgericht Wuppertal",
      "registernummer": "HRB 20307",
      "registerart": "HRB",
      "company_name": "City Malerei & Immobilien GmbH",
      "company_seat": "Mettmann",
      "details": "24.01.2025 (Bekanntmachungsdatum)\n\nNordrhein-Westfalen Amtsgericht Wuppertal HRB 20307\nLöschungsankündigung\n\nCity Malerei & Immobilien GmbH\nGesellschaft mit beschränkter Haftung\nMettmann\n\nDas Registergericht beabsichtigt die Gesellschaft von Amts wegen nach § 394 FamFG zu löschen. Die Frist zur Erhebung eines Widerspruchs ist auf einen Monat festgesetzt."
    },
    {
      "date": "2025-01-24",
      "id": "99558",
      "original_text": "Sonstige Registerbekanntmachung\nNordrhein-Westfalen Amtsgericht Gelsenkirchen HRB 12559\nKnappschaft Kliniken Bottrop GmbH – Bottrop",
      "type": "Sonstige Registerbekanntmachung",
      "state": "Nordrhein-Westfalen",
      "amtsgericht": "Amtsgericht Gelsenkirchen",
      "registernummer": "HRB 12559",
      "registerart": "HRB",
      "company_name": "Knappschaft Kliniken Bottrop GmbH",
      "company_seat": "Bottrop",
      "details": "24.01.2025 (Bekanntmachungsdatum)\n\nNordrhein-Westfalen Amtsgericht Gelsenkirchen HRB 12559\nSonstige Registerbekanntmachung 24.01.2025 (Eintragungsdatum)\n\nKnappschaft Kliniken Bottrop GmbH\nGesellschaft mit beschränkter Haftung\nBottrop\n\nDem Registergericht ist eine neue Liste der Mitglieder des Aufsichtsrates eingereicht worden."
    },
    {
      "date": "2025-01-24",
      "id": "99559",
      "original_text": "Einreichung neuer Dokumente\nNordrhein-Westfalen Amtsgericht Wuppertal HRB 28475\nBarmenia Krankenversicherung AG – Wuppertal",
      "type": "Einreichung neuer Dokumente",
      "state": "Nordrhein-Westfalen",
      "amtsgericht": "Amtsgericht Wuppertal",
      "registernummer": "HRB 28475",
      "registerart": "HRB",
      "company_name": "Barmenia Krankenversicherung AG",
      "company_seat": "Wuppertal",
      "details": "24.01.2025 (Bekanntmachungsdatum)\n\nNordrhein-Westfalen Amtsgericht Wuppertal HRB 28475\nEinreichung neuer Dokumente 24.01.2025 (Eintragungsdatum)\n\nBarmenia Krankenversicherung AG\nAktiengesellschaft\nWuppertal\n\nDem Registergericht ist eine neue Liste der Mitglieder des Aufsichtsrates eingereicht worden."
    },
    {
      "date": "2025-01-24",
      "id": "99560",
      "original_text": "Registerbekanntmachung nach dem Umwandlungsgesetz\nHessen Amtsgericht Offenbach am Main HRA 43228\nZC-Trockenbau e.K. – Offenbach am Main",
      "type": "Registerbekanntmachung nach dem Umwandlungsgesetz",
      "state": "Hessen",
      "amtsgericht": "Amtsgericht Offenbach am Main",
      "registernummer": "HRA 43228",
      "registerart": "HRA",
      "company_name": "ZC-Trockenbau e.K.",
      "company_seat": "Offenbach am Main",
      "details": "24.01.2025 (Bekanntmachungsdatum)\n\nHessen Amtsgericht Offenbach am Main HRA 43228\nRegisterbekanntmachung nach dem Umwandlungsgesetz 24.01.2025 (Eintragungsdatum)\n\nZC-Trockenbau e.K.\nEinzelkaufmann / Einzelkauffrau\nOffenbach am Main\n\nDen Gläubigern der an der Ausgliederung beteiligten Rechtsträger ist, wenn sie binnen sechs Monaten nach dem Tag, an dem die Eintragung der Ausgliederung in das Register des Sitzes desjenigen Rechtsträgers, dessen Gläubiger sie sind, nach §§ 125, 19 Absatz 3 UmwG bekannt gemacht worden ist, ihren Anspruch nach Grund und Höhe schriftlich anmelden, Sicherheit zu leisten, soweit sie nicht Befriedigung verlangen können. Dieses Recht steht den Gläubigern jedoch nur zu, wenn sie glaubhaft machen, dass durch die Ausgliederung die Erfüllung ihrer Forderung gefährdet wird."
    },
    {
      "date": "2025-01-24",
      "id": "99561",
      "original_text": "Löschungsankündigung\nHessen Amtsgericht Offenbach am Main HRB 42059\nFioroni Verwaltungsgesellschaft mbH – Mühlheim am Main",
      "type": "Löschungsankündigung",
      "state": "Hessen",
      "amtsgericht": "Amtsgericht Offenbach am Main",
      "registernummer": "HRB 42059",
      "registerart": "HRB",
      "company_name": "Fioroni Verwaltungsgesellschaft mbH",
      "company_seat": "Mühlheim am Main",
      "details": "24.01.2025 (Bekanntmachungsdatum)\n\nHessen Amtsgericht Offenbach am Main HRB 42059\nLöschungsankündigung\n\nFioroni Verwaltungsgesellschaft mbH\nGesellschaft mit beschränkter Haftung\nMühlheim am Main\n\nDas Registergericht beabsichtigt die im Handelsregister eingetragene Gesellschaft von Amts wegen nach § 394 FamFG zu löschen. Die Frist zur Erhebung eines Widerspruchs gegen die beabsichtigte Löschung wird auf 3 Monate festgesetzt."
    },
    {
      "date": "2025-01-24",
      "id": "99562",
      "original_text": "Einreichung neuer Dokumente\nHessen Amtsgericht Frankfurt am Main HRB 53312\nCOI Partners Capital Management AG – Frankfurt am Main",
      "type": "Einreichung neuer Dokumente",
      "state": "Hessen",
      "amtsgericht": "Amtsgericht Frankfurt am Main",
      "registernummer": "HRB 53312",
      "registerart": "HRB",
      "company_name": "COI Partners Capital Management AG",
      "company_seat": "Frankfurt am Main",
      "details": "24.01.2025 (Bekanntmachungsdatum)\n\nHessen Amtsgericht Frankfurt am Main HRB 53312\nEinreichung neuer Dokumente\n\nCOI Partners Capital Management AG\nAktiengesellschaft\nFrankfurt am Main\n\nDurch eine Änderung in den Personen der Aufsichtsratsmitglieder ist eine Liste der Mitglieder des Aufsichtsrates zum Handelsregister eingereicht worden."
    },
    {
      "date": "2025-01-24",
      "id": "99563",
      "original_text": "Löschungsankündigung\nHessen Amtsgericht Darmstadt HRA 61886\nCWK Integrated IT Solutions GmbH & Co KG – Viernheim",
      "type": "Löschungsankündigung",
      "state": "Hessen",
      "amtsgericht": "Amtsgericht Darmstadt",
      "registernummer": "HRA 61886",
      "registerart": "HRA",
      "company_name": "CWK Integrated IT Solutions GmbH & Co KG",
      "company_seat": "Viernheim",
      "details": "24.01.2025 (Bekanntmachungsdatum)\n\nHessen Amtsgericht Darmstadt HRA 61886\nLöschungsankündigung\n\nCWK Integrated IT Solutions GmbH & Co KG\nKommanditgesellschaft\nViernheim\n\nDas Registergericht beabsichtigt die im Handelsregister eingetragene Firma von Amts wegen nach § 394 IV FamFG zu löschen. Die Frist zur Erhebung eines Widerspruchs gegen die beabsichtigte Löschung wird auf 3 Monate festgesetzt."
    },
    {
      "date": "2025-01-24",
      "id": "99564",
      "original_text": "Löschungsankündigung\nHessen Amtsgericht Darmstadt HRB 102340\nMG Stahl GmbH – Rüsselsheim",
      "type": "Löschungsankündigung",
      "state": "Hessen",
      "amtsgericht": "Amtsgericht Darmstadt",
      "registernummer": "HRB 102340",
      "registerart": "HRB",
      "company_name": "MG Stahl GmbH",
      "company_seat": "Rüsselsheim",
      "details": "24.01.2025 (Bekanntmachungsdatum)\n\nHessen Amtsgericht Darmstadt HRB 102340\nLöschungsankündigung\n\nMG Stahl GmbH\nGesellschaft mit beschränkter Haftung\nRüsselsheim\n\nDas Registergericht beabsichtigt die im Handelsregister eingetragene Gesellschaft von Amts wegen nach § 394 FamFG zu löschen. Die Frist zur Erhebung eines Widerspruchs gegen die beabsichtigte Löschung wird auf 3 Monate festgesetzt."
    },
    {
      "date": "2025-01-24",
      "id": "99565",
      "original_text": "Sonstige Registerbekanntmachung\nHessen Amtsgericht Marburg VR 2840\nRELAX AND TALK – Bad Endbach",
      "type": "Sonstige Registerbekanntmachung",
      "state": "Hessen",
      "amtsgericht": "Amtsgericht Marburg",
      "registernummer": "VR 2840",
      "registerart": "VR",
      "company_name": "RELAX AND TALK",
      "company_seat": "Bad Endbach",
      "details": "24.01.2025 (Bekanntmachungsdatum)\n\nHessen Amtsgericht Marburg VR 2840\nSonstige Registerbekanntmachung 20.01.2025 (Eintragungsdatum)\n\nRELAX AND TALK\neingetragener Verein\nBad Endbach\n\nDer Verein ist aufgelöst."
    },
    {
      "date": "2025-01-24",
      "id": "99566",
      "original_text": "Einreichung neuer Dokumente\nHessen Amtsgericht Darmstadt HRB 24758\nBRAIN Biotech AG – Zwingenberg",
      "type": "Einreichung neuer Dokumente",
      "state": "Hessen",
      "amtsgericht": "Amtsgericht Darmstadt",
      "registernummer": "HRB 24758",
      "registerart": "HRB",
      "company_name": "BRAIN Biotech AG",
      "company_seat": "Zwingenberg",
      "details": "24.01.2025 (Bekanntmachungsdatum)\n\nHessen Amtsgericht Darmstadt HRB 24758\nEinreichung neuer Dokumente\n\nBRAIN Biotech AG\nAktiengesellschaft\nZwingenberg\n\nWegen Änderungen in den Personen der Aufsichtsratsmitglieder ist eine Liste der Mitglieder des Aufsichtsrates zum Handelsregister eingereicht worden."
    },
    {
      "date": "2025-01-24",
      "id": "99567",
      "original_text": "Einreichung neuer Dokumente\nHessen Amtsgericht Darmstadt HRB 89241\nEPG (Engineered nanoProducts Germany) AG – Griesheim",
      "type": "Einreichung neuer Dokumente",
      "state": "Hessen",
      "amtsgericht": "Amtsgericht Darmstadt",
      "registernummer": "HRB 89241",
      "registerart": "HRB",
      "company_name": "EPG (Engineered nanoProducts Germany) AG",
      "company_seat": "Griesheim",
      "details": "24.01.2025 (Bekanntmachungsdatum)\n\nHessen Amtsgericht Darmstadt HRB 89241\nEinreichung neuer Dokumente 24.01.2025 (Eintragungsdatum)\n\nEPG (Engineered nanoProducts Germany) AG\nAktiengesellschaft\nGriesheim\n\nWegen Änderungen in den Personen der Aufsichtsratsmitglieder ist eine Liste der Mitglieder des Aufsichtsrates zum Handelsregister eingereicht worden."
    },
    {
      "date": "2025-01-24",
      "id": "99568",
      "original_text": "Löschungsankündigung\nHessen Amtsgericht Offenbach am Main HRB 47579\nS & R Projektgesellschaft mbH – Offenbach am Main",
      "type": "Löschungsankündigung",
      "state": "Hessen",
      "amtsgericht": "Amtsgericht Offenbach am Main",
      "registernummer": "HRB 47579",
      "registerart": "HRB",
      "company_name": "S & R Projektgesellschaft mbH",
      "company_seat": "Offenbach am Main",
      "details": "24.01.2025 (Bekanntmachungsdatum)\n\nHessen Amtsgericht Offenbach am Main HRB 47579\nLöschungsankündigung\n\nS & R Projektgesellschaft mbH\nGesellschaft mit beschränkter Haftung\nOffenbach am Main\n\nDas Registergericht beabsichtigt die im Handelsregister eingetragene Gesellschaft von Amts wegen nach § 394 FamFG zu löschen. Die Frist zur Erhebung eines Widerspruchs gegen die beabsichtigte Löschung wird auf 3 Monate festgesetzt."
    },
    {
      "date": "2025-01-24",
      "id": "99569",
      "original_text": "Registerbekanntmachung nach dem Umwandlungsgesetz\nHessen Amtsgericht Wiesbaden VR 2085\nMartin Niemöller-Stiftung e. V. – Wiesbaden",
      "type": "Registerbekanntmachung nach dem Umwandlungsgesetz",
      "state": "Hessen",
      "amtsgericht": "Amtsgericht Wiesbaden",
      "registernummer": "VR 2085",
      "registerart": "VR",
      "company_name": "Martin Niemöller-Stiftung e. V.",
      "company_seat": "Wiesbaden",
      "details": "24.01.2025 (Bekanntmachungsdatum)\n\nHessen Amtsgericht Wiesbaden VR 2085\nRegisterbekanntmachung nach dem Umwandlungsgesetz 24.01.2025 (Eintragungsdatum)\n\nMartin Niemöller-Stiftung e. V.\neingetragener Verein\nWiesbaden\n\nDen Gläubigern der an der #DV.UmF(Text=\"Bitte wählen Sie die zutreffende Art nach UmwG aus!\",Eingabe=\"Verschmelzung\",\"Aufspaltung\",\"Abspaltung\",\"Ausgliederung\",\"Vermögensübertragung\",\"formwechselnden Umwandlung\") beteiligten Rechtsträger ist, wenn sie binnen sechs Monaten nach dem Tag, an dem die Eintragung der #DV.UmF in das Register des Sitzes #DV.RTr(Text=\"Bitte wählen Sie aus, ob ein oder mehrere andere Rechtsträger betroffen sind!\",Eingabe=\"desjenigen Rechtsträgers, dessen Gläubiger\",\"derjenigen Rechtsträger deren Gläubiger\") sie sind, nach #DV.Auswahl(Text=\"Bitte wählen Sie die zutreffende Vorschrift aus!\",Eingabe=\"§ 19 Absatz 3 UmwG\"|\"§ 19 Absatz 3 UmwG (=Verschmelzung)\",\"§§ 122a Absatz 2, 19 Absatz 3 UmwG\"|\"§§ 122a Absatz 2, 19 Absatz 3 UmwG (=grenzüberschreitende Verschmelzung)\",\"§§ 125, 19 Absatz 3 UmwG\"|\"§§ 125, 19 Absatz 3 UmwG (=Spaltung)\",\"§ 201 UmwG\"|\"§ 201 UmwG (=Formwechsel)\",\"#insert(Text=\"Freitext\") UmwG\"|\"freie Eingabe\") bekannt gemacht worden ist, ihren Anspruch nach Grund und Höhe schriftlich anmelden, Sicherheit zu leisten, soweit sie nicht Befriedigung verlangen können. Dieses Recht steht den Gläubigern jedoch nur zu, wenn sie glaubhaft machen, dass durch die #DV.UmF die Erfüllung ihrer Forderung gefährdet wird."
    },
    {
      "date": "2025-01-24",
      "id": "99570",
      "original_text": "Einreichung neuer Dokumente\nHessen Amtsgericht Frankfurt am Main HRB 82129\nAir Liquide Global E&C Solutions Germany GmbH – Frankfurt am Main",
      "type": "Einreichung neuer Dokumente",
      "state": "Hessen",
      "amtsgericht": "Amtsgericht Frankfurt am Main",
      "registernummer": "HRB 82129",
      "registerart": "HRB",
      "company_name": "Air Liquide Global E&C Solutions Germany GmbH",
      "company_seat": "Frankfurt am Main",
      "details": "24.01.2025 (Bekanntmachungsdatum)\n\nHessen Amtsgericht Frankfurt am Main HRB 82129\nEinreichung neuer Dokumente 24.01.2025 (Eintragungsdatum)\n\nAir Liquide Global E&C Solutions Germany GmbH\nGesellschaft mit beschränkter Haftung\nFrankfurt am Main\n\nDurch eine Änderung in den Personen der Aufsichtsratsmitglieder ist eine Liste der Mitglieder des Aufsichtsrates zum Handelsregister eingereicht worden."
    },
    {
      "date": "2025-01-24",
      "id": "99571",
      "original_text": "Registerbekanntmachung nach dem Umwandlungsgesetz\nHessen Amtsgericht Offenbach am Main HRB 57541\nPaja GmbH – Offenbach am Main",
      "type": "Registerbekanntmachung nach dem Umwandlungsgesetz",
      "state": "Hessen",
      "amtsgericht": "Amtsgericht Offenbach am Main",
      "registernummer": "HRB 57541",
      "registerart": "HRB",
      "company_name": "Paja GmbH",
      "company_seat": "Offenbach am Main",
      "details": "24.01.2025 (Bekanntmachungsdatum)\n\nHessen Amtsgericht Offenbach am Main HRB 57541\nRegisterbekanntmachung nach dem Umwandlungsgesetz 24.01.2025 (Eintragungsdatum)\n\nPaja GmbH\nGesellschaft mit beschränkter Haftung\nOffenbach am Main\n\nDen Gläubigern der an der Ausgliederung beteiligten Rechtsträger ist, wenn sie binnen sechs Monaten nach dem Tag, an dem die Eintragung der Ausgliederung in das Register des Sitzes desjenigen Rechtsträgers, dessen Gläubiger sie sind, nach §§ 125, 19 Absatz 3 UmwG bekannt gemacht worden ist, ihren Anspruch nach Grund und Höhe schriftlich anmelden, Sicherheit zu leisten, soweit sie nicht Befriedigung verlangen können. Dieses Recht steht den Gläubigern jedoch nur zu, wenn sie glaubhaft machen, dass durch die Ausgliederung die Erfüllung ihrer Forderung gefährdet wird."
    }
  ]
}