{
  "date": "2025-01-21",
  "date_of_scrape": "2025-01-22T04:05:44.428Z",
  "tool_version": "0.2.0",
  "number_of_announcements": 99,
  "announcements": [
    {
      "date": "2025-01-21",
      "id": "99083",
      "original_text": "Registerbekanntmachung nach dem Umwandlungsgesetz\nBayern Amtsgericht Traunstein HRB 31474\nOptiSano Vertriebs GmbH – Reit im Winkl",
      "type": "Registerbekanntmachung nach dem Umwandlungsgesetz",
      "state": "Bayern",
      "amtsgericht": "Amtsgericht Traunstein",
      "registernummer": "HRB 31474",
      "registerart": "HRB",
      "company_name": "OptiSano Vertriebs GmbH",
      "company_seat": "Reit im Winkl",
      "details": "21.01.2025 (Bekanntmachungsdatum)\n\nBayern Amtsgericht Traunstein HRB 31474\nRegisterbekanntmachung nach dem Umwandlungsgesetz 20.01.2025 (Eintragungsdatum)\n\nOptiSano Vertriebs GmbH\nGesellschaft mit beschränkter Haftung\nReit im Winkl\n\nDen Gläubigern der an der Verschmelzung beteiligten Rechtsträger ist, wenn sie binnen sechs Monaten nach dem Tag, an dem die Eintragung der Verschmelzung in das Register des Sitzes desjenigen Rechtsträgers, dessen Gläubiger sie sind, nach § 19 Abs. 3 UmwG als bekannt gemacht gilt, ihren Anspruch nach Grund und Höhe in Textform anmelden, Sicherheit zu leisten, soweit sie nicht Befriedigung verlangen können. Dieses Recht steht den Gläubigern jedoch nur zu, wenn sie glaubhaft machen, dass durch die Verschmelzung die Erfüllung ihrer Forderung gefährdet wird."
    },
    {
      "date": "2025-01-21",
      "id": "99084",
      "original_text": "Einreichung neuer Dokumente\nBayern Amtsgericht Traunstein HRB 23892\nMarc O´Polo License AG – Stephanskirchen",
      "type": "Einreichung neuer Dokumente",
      "state": "Bayern",
      "amtsgericht": "Amtsgericht Traunstein",
      "registernummer": "HRB 23892",
      "registerart": "HRB",
      "company_name": "Marc O´Polo License AG",
      "company_seat": "Stephanskirchen",
      "details": "21.01.2025 (Bekanntmachungsdatum)\n\nBayern Amtsgericht Traunstein HRB 23892\nEinreichung neuer Dokumente 20.01.2025 (Eintragungsdatum)\n\nMarc O´Polo License AG\nAktiengesellschaft\nStephanskirchen\n\nDem Amtsgericht Traunstein -Registergericht- ist eine Liste der Mitglieder des Aufsichtsrats eingereicht worden, § 106 AktG."
    },
    {
      "date": "2025-01-21",
      "id": "99085",
      "original_text": "Registerbekanntmachung nach dem Umwandlungsgesetz\nBayern Amtsgericht München HRB 223251\nTexas Instruments EMEA Sales GmbH – Freising",
      "type": "Registerbekanntmachung nach dem Umwandlungsgesetz",
      "state": "Bayern",
      "amtsgericht": "Amtsgericht München",
      "registernummer": "HRB 223251",
      "registerart": "HRB",
      "company_name": "Texas Instruments EMEA Sales GmbH",
      "company_seat": "Freising",
      "details": "21.01.2025 (Bekanntmachungsdatum)\n\nBayern Amtsgericht München HRB 223251\nRegisterbekanntmachung nach dem Umwandlungsgesetz 20.01.2025 (Eintragungsdatum)\n\nTexas Instruments EMEA Sales GmbH\nGesellschaft mit beschränkter Haftung\nFreising\n\nDen Gläubigern der an der Verschmelzung beteiligten Rechtsträger ist, wenn sie binnen sechs Monaten nach dem Tag, an dem die Eintragung der Verschmelzung in das Register des Sitzes desjenigen Rechtsträgers, dessen Gläubiger sie sind, nach § 19 Abs. 3 UmwG als bekannt gemacht gilt, ihren Anspruch nach Grund und Höhe in Textform anmelden, Sicherheit zu leisten, soweit sie nicht Befriedigung verlangen können. Dieses Recht steht den Gläubigern jedoch nur zu, wenn sie glaubhaft machen, dass durch die Verschmelzung die Erfüllung ihrer Forderung gefährdet wird."
    },
    {
      "date": "2025-01-21",
      "id": "99086",
      "original_text": "Löschungsankündigung\nBayern Amtsgericht München HRB 108221\nOmnigrund Immobilien GmbH – München",
      "type": "Löschungsankündigung",
      "state": "Bayern",
      "amtsgericht": "Amtsgericht München",
      "registernummer": "HRB 108221",
      "registerart": "HRB",
      "company_name": "Omnigrund Immobilien GmbH",
      "company_seat": "München",
      "details": "21.01.2025 (Bekanntmachungsdatum)\n\nBayern Amtsgericht München HRB 108221\nLöschungsankündigung 20.01.2025 (Eintragungsdatum)\n\nOmnigrund Immobilien GmbH\nGesellschaft mit beschränkter Haftung\nMünchen\n\nDas Registergericht beabsichtigt, die im Handelsregister eingetragene Gesellschaft wegen Vermögenslosigkeit von Amts wegen nach § 394 FamFG zu löschen. Die Frist zur Erhebung eines Widerspruchs ist auf drei Monate festgesetzt."
    },
    {
      "date": "2025-01-21",
      "id": "99087",
      "original_text": "Löschungsankündigung\nBayern Amtsgericht Coburg HRB 5436\nLucky Trading GmbH – Ahorn",
      "type": "Löschungsankündigung",
      "state": "Bayern",
      "amtsgericht": "Amtsgericht Coburg",
      "registernummer": "HRB 5436",
      "registerart": "HRB",
      "company_name": "Lucky Trading GmbH",
      "company_seat": "Ahorn",
      "details": "21.01.2025 (Bekanntmachungsdatum)\n\nBayern Amtsgericht Coburg HRB 5436\nLöschungsankündigung 20.01.2025 (Eintragungsdatum)\n\nLucky Trading GmbH\nGesellschaft mit beschränkter Haftung\nAhorn\n\nDas Registergericht beabsichtigt, die im Handelsregister eingetragene Gesellschaft wegen Vermögenslosigkeit von Amts wegen nach § 394 FamFG zu löschen. Die Frist zur Erhebung eines Widerspruchs ist auf sechs Wochen festgesetzt."
    },
    {
      "date": "2025-01-21",
      "id": "99088",
      "original_text": "Löschungsankündigung\nBayern Amtsgericht Traunstein HRA 6796\nSIROTEX OHG – Freilassing",
      "type": "Löschungsankündigung",
      "state": "Bayern",
      "amtsgericht": "Amtsgericht Traunstein",
      "registernummer": "HRA 6796",
      "registerart": "HRA",
      "company_name": "SIROTEX OHG",
      "company_seat": "Freilassing",
      "details": "21.01.2025 (Bekanntmachungsdatum)\n\nBayern Amtsgericht Traunstein HRA 6796\nLöschungsankündigung\n\nSIROTEX OHG\nOffene Handelsgesellschaft\nFreilassing\n\nDas Registergericht beabsichtigt, die im Handelsregister eingetragene Firma von Amts wegen nach § 31 Abs. 2 HGB zu löschen. Die Frist zur Erhebung eines Widerspruchs ist auf drei Monate festgesetzt."
    },
    {
      "date": "2025-01-21",
      "id": "99089",
      "original_text": "Löschungsankündigung\nBayern Amtsgericht München HRB 94159\nMEDIATEAM Medienberatung und -produktion GmbH – München",
      "type": "Löschungsankündigung",
      "state": "Bayern",
      "amtsgericht": "Amtsgericht München",
      "registernummer": "HRB 94159",
      "registerart": "HRB",
      "company_name": "MEDIATEAM Medienberatung und -produktion GmbH",
      "company_seat": "München",
      "details": "21.01.2025 (Bekanntmachungsdatum)\n\nBayern Amtsgericht München HRB 94159\nLöschungsankündigung 20.01.2025 (Eintragungsdatum)\n\nMEDIATEAM Medienberatung und -produktion GmbH\nGesellschaft mit beschränkter Haftung\nMünchen\n\nDas Registergericht beabsichtigt, die im Handelsregister eingetragene Gesellschaft wegen Vermögenslosigkeit von Amts wegen nach § 394 FamFG zu löschen. Die Frist zur Erhebung eines Widerspruchs ist auf drei Monate festgesetzt."
    },
    {
      "date": "2025-01-21",
      "id": "99090",
      "original_text": "Einreichung neuer Dokumente\nBayern Amtsgericht Regensburg HRB 1638\nREGENSBURGER ENERGIE- UND WASSERVERSORGUNG AG – Regensburg",
      "type": "Einreichung neuer Dokumente",
      "state": "Bayern",
      "amtsgericht": "Amtsgericht Regensburg",
      "registernummer": "HRB 1638",
      "registerart": "HRB",
      "company_name": "REGENSBURGER ENERGIE- UND WASSERVERSORGUNG AG",
      "company_seat": "Regensburg",
      "details": "21.01.2025 (Bekanntmachungsdatum)\n\nBayern Amtsgericht Regensburg HRB 1638\nEinreichung neuer Dokumente\n\nREGENSBURGER ENERGIE- UND WASSERVERSORGUNG AG\nAktiengesellschaft\nRegensburg\n\nDem Amtsgericht Regensburg -Registergericht- ist eine Liste der Mitglieder des Aufsichtsrats eingereicht worden, § 106 AktG."
    },
    {
      "date": "2025-01-21",
      "id": "99091",
      "original_text": "Löschungsankündigung\nBayern Amtsgericht München HRB 146799\nEureka Aktiengesellschaft – München",
      "type": "Löschungsankündigung",
      "state": "Bayern",
      "amtsgericht": "Amtsgericht München",
      "registernummer": "HRB 146799",
      "registerart": "HRB",
      "company_name": "Eureka Aktiengesellschaft",
      "company_seat": "München",
      "details": "21.01.2025 (Bekanntmachungsdatum)\n\nBayern Amtsgericht München HRB 146799\nLöschungsankündigung\n\nEureka Aktiengesellschaft\nAktiengesellschaft\nMünchen\n\nDas Registergericht beabsichtigt, die im Handelsregister eingetragene Gesellschaft wegen Vermögenslosigkeit von Amts wegen nach § 394 FamFG zu löschen. Die Frist zur Erhebung eines Widerspruchs ist auf drei Monate festgesetzt."
    },
    {
      "date": "2025-01-21",
      "id": "99092",
      "original_text": "Löschungsankündigung\nBayern Amtsgericht München HRA 43806\nSundheimer GmbH & Co KG – Miesbach",
      "type": "Löschungsankündigung",
      "state": "Bayern",
      "amtsgericht": "Amtsgericht München",
      "registernummer": "HRA 43806",
      "registerart": "HRA",
      "company_name": "Sundheimer GmbH & Co KG",
      "company_seat": "Miesbach",
      "details": "21.01.2025 (Bekanntmachungsdatum)\n\nBayern Amtsgericht München HRA 43806\nLöschungsankündigung 19.01.2025 (Eintragungsdatum)\n\nSundheimer GmbH & Co KG\nKommanditgesellschaft\nMiesbach\n\nDas Registergericht beabsichtigt, die im Handelsregister eingetragene Firma von Amts wegen nach § 31 Abs. 2 HGB zu löschen. Die Frist zur Erhebung eines Widerspruchs ist auf drei Monate festgesetzt."
    },
    {
      "date": "2025-01-21",
      "id": "99093",
      "original_text": "Löschungsankündigung\nBayern Amtsgericht Augsburg HRB 32388\nschichtplaner-online.de UG (haftungsbeschränkt) – Augsburg",
      "type": "Löschungsankündigung",
      "state": "Bayern",
      "amtsgericht": "Amtsgericht Augsburg",
      "registernummer": "HRB 32388",
      "registerart": "HRB",
      "company_name": "schichtplaner-online.de UG (haftungsbeschränkt)",
      "company_seat": "Augsburg",
      "details": "21.01.2025 (Bekanntmachungsdatum)\n\nBayern Amtsgericht Augsburg HRB 32388\nLöschungsankündigung 17.01.2025 (Eintragungsdatum)\n\nschichtplaner-online.de UG (haftungsbeschränkt)\nGesellschaft mit beschränkter Haftung\nAugsburg"
    },
    {
      "date": "2025-01-21",
      "id": "99094",
      "original_text": "Löschungsankündigung\nBayern Amtsgericht München HRB 220959\nExclusive Cars Anzing GmbH – Finsing",
      "type": "Löschungsankündigung",
      "state": "Bayern",
      "amtsgericht": "Amtsgericht München",
      "registernummer": "HRB 220959",
      "registerart": "HRB",
      "company_name": "Exclusive Cars Anzing GmbH",
      "company_seat": "Finsing",
      "details": "21.01.2025 (Bekanntmachungsdatum)\n\nBayern Amtsgericht München HRB 220959\nLöschungsankündigung 20.01.2025 (Eintragungsdatum)\n\nExclusive Cars Anzing GmbH\nGesellschaft mit beschränkter Haftung\nFinsing\n\nDas Registergericht beabsichtigt, die im Handelsregister eingetragene Gesellschaft wegen Vermögenslosigkeit von Amts wegen nach § 394 FamFG zu löschen. Die Frist zur Erhebung eines Widerspruchs ist auf drei Monate festgesetzt."
    },
    {
      "date": "2025-01-21",
      "id": "99095",
      "original_text": "Löschungsankündigung\nBayern Amtsgericht München HRB 131872\nOst-Leder GmbH – München",
      "type": "Löschungsankündigung",
      "state": "Bayern",
      "amtsgericht": "Amtsgericht München",
      "registernummer": "HRB 131872",
      "registerart": "HRB",
      "company_name": "Ost-Leder GmbH",
      "company_seat": "München",
      "details": "21.01.2025 (Bekanntmachungsdatum)\n\nBayern Amtsgericht München HRB 131872\nLöschungsankündigung 20.01.2025 (Eintragungsdatum)\n\nOst-Leder GmbH\nGesellschaft mit beschränkter Haftung\nMünchen\n\nDas Registergericht beabsichtigt, die im Handelsregister eingetragene Gesellschaft wegen Vermögenslosigkeit von Amts wegen nach § 394 FamFG zu löschen. Die Frist zur Erhebung eines Widerspruchs ist auf drei Monate festgesetzt."
    },
    {
      "date": "2025-01-21",
      "id": "99096",
      "original_text": "Registerbekanntmachung nach dem Umwandlungsgesetz\nBayern Amtsgericht Traunstein HRB 31548\nOptiSano Vertriebs GmbH – Reit im Winkl",
      "type": "Registerbekanntmachung nach dem Umwandlungsgesetz",
      "state": "Bayern",
      "amtsgericht": "Amtsgericht Traunstein",
      "registernummer": "HRB 31548",
      "registerart": "HRB",
      "company_name": "OptiSano Vertriebs GmbH",
      "company_seat": "Reit im Winkl",
      "details": "21.01.2025 (Bekanntmachungsdatum)\n\nBayern Amtsgericht Traunstein HRB 31548\nRegisterbekanntmachung nach dem Umwandlungsgesetz 20.01.2025 (Eintragungsdatum)\n\nOptiSano Vertriebs GmbH\nGesellschaft mit beschränkter Haftung\nReit im Winkl\n\nDen Gläubigern der an der Verschmelzung beteiligten Rechtsträger ist, wenn sie binnen sechs Monaten nach dem Tag, an dem die Eintragung der Verschmelzung in das Register des Sitzes desjenigen Rechtsträgers, dessen Gläubiger sie sind, nach § 19 Abs. 3 UmwG als bekannt gemacht gilt, ihren Anspruch nach Grund und Höhe in Textform anmelden, Sicherheit zu leisten, soweit sie nicht Befriedigung verlangen können. Dieses Recht steht den Gläubigern jedoch nur zu, wenn sie glaubhaft machen, dass durch die Verschmelzung die Erfüllung ihrer Forderung gefährdet wird."
    },
    {
      "date": "2025-01-21",
      "id": "99097",
      "original_text": "Löschungsankündigung\nBayern Amtsgericht Traunstein HRB 19736\nINDID GROUP UG (haftungsbeschränkt) – Freilassing",
      "type": "Löschungsankündigung",
      "state": "Bayern",
      "amtsgericht": "Amtsgericht Traunstein",
      "registernummer": "HRB 19736",
      "registerart": "HRB",
      "company_name": "INDID GROUP UG (haftungsbeschränkt)",
      "company_seat": "Freilassing",
      "details": "21.01.2025 (Bekanntmachungsdatum)\n\nBayern Amtsgericht Traunstein HRB 19736\nLöschungsankündigung\n\nINDID GROUP UG (haftungsbeschränkt)\nGesellschaft mit beschränkter Haftung\nFreilassing\n\nDas Registergericht beabsichtigt, die im Handelsregister eingetragene Gesellschaft wegen Vermögenslosigkeit von Amts wegen nach § 394 FamFG zu löschen. Die Frist zur Erhebung eines Widerspruchs ist auf einen Monat festgesetzt."
    },
    {
      "date": "2025-01-21",
      "id": "99098",
      "original_text": "Registerbekanntmachung nach dem Umwandlungsgesetz\nBayern Amtsgericht München HRB 261508\nLOGIC GREEN VALLEY 1 GmbH – Gräfelfing",
      "type": "Registerbekanntmachung nach dem Umwandlungsgesetz",
      "state": "Bayern",
      "amtsgericht": "Amtsgericht München",
      "registernummer": "HRB 261508",
      "registerart": "HRB",
      "company_name": "LOGIC GREEN VALLEY 1 GmbH",
      "company_seat": "Gräfelfing",
      "details": "21.01.2025 (Bekanntmachungsdatum)\n\nBayern Amtsgericht München HRB 261508\nRegisterbekanntmachung nach dem Umwandlungsgesetz\n\nLOGIC GREEN VALLEY 1 GmbH\nGesellschaft mit beschränkter Haftung\nGräfelfing\n\nEs wird darauf hingewiesen, dass ein Formwechselplan oder sein Entwurf über einen grenzüberschreitenden Formwechsel hinsichtlich der LOGIC GREEN VALLEY 1 GmbH, einer Gesellschaft mit beschränkter Haftung nach deutschem Recht mit Sitz in Gräfelfing (Deutschland), eingetragen im Handelsregister des Amtsgerichts München unter der Nummer HRB 261508 in die LOGIC GREEN VALLEY 1 société à responsabilitité limitée mit Sitz in Bereldange/Luxemburg (société à responsabilité limitée - Gesellschaft mit beschränkter Haftung nach luxemburgischem Recht) beim Handelsregister eingereicht worden ist.\nDie Anteilsinhaber, die Gläubiger sowie die zuständigen Betriebsräte der an dem grenzüberschreitenden Formwechsel beteiligten Gesellschaft oder, soweit es keinen Betriebsrat gibt, die Arbeitnehmer der an dem grenzüberschreitenden Formwechsel beteiligten Gesellschaft, können der Gesellschaft spätestens fünf Arbeitstage vor dem Tag der Gesellschafterversammlung Bemerkungen zum Formwechselplan übermitteln."
    },
    {
      "date": "2025-01-21",
      "id": "99099",
      "original_text": "Registerbekanntmachung nach dem Umwandlungsgesetz\nBayern Amtsgericht München HRA 120543\nZimmerei Josef Kaiser e.K. – Rottach-Egern",
      "type": "Registerbekanntmachung nach dem Umwandlungsgesetz",
      "state": "Bayern",
      "amtsgericht": "Amtsgericht München",
      "registernummer": "HRA 120543",
      "registerart": "HRA",
      "company_name": "Zimmerei Josef Kaiser e.K.",
      "company_seat": "Rottach-Egern",
      "details": "21.01.2025 (Bekanntmachungsdatum)\n\nBayern Amtsgericht München HRA 120543\nRegisterbekanntmachung nach dem Umwandlungsgesetz 20.01.2025 (Eintragungsdatum)\n\nZimmerei Josef Kaiser e.K.\nEinzelkaufmann / Einzelkauffrau\nRottach-Egern\n\nDen Gläubigern der an der Verschmelzung beteiligten Rechtsträger ist, wenn sie binnen sechs Monaten nach dem Tag, an dem die Eintragung der Verschmelzung in das Register des Sitzes desjenigen Rechtsträgers, dessen Gläubiger sie sind, nach § 19 Abs. 3 UmwG als bekannt gemacht gilt, ihren Anspruch nach Grund und Höhe in Textform anmelden, Sicherheit zu leisten, soweit sie nicht Befriedigung verlangen können. Dieses Recht steht den Gläubigern jedoch nur zu, wenn sie glaubhaft machen, dass durch die Verschmelzung die Erfüllung ihrer Forderung gefährdet wird."
    },
    {
      "date": "2025-01-21",
      "id": "99100",
      "original_text": "Registerbekanntmachung nach dem Umwandlungsgesetz\nBayern Amtsgericht München HRB 40758\nRies, Gesellschaft mit beschränkter Haftung, Bekleidungsverschlußfabrik Verwaltungsgesellschaft – Unterpfaffenhofen",
      "type": "Registerbekanntmachung nach dem Umwandlungsgesetz",
      "state": "Bayern",
      "amtsgericht": "Amtsgericht München",
      "registernummer": "HRB 40758",
      "registerart": "HRB",
      "company_name": "Ries, Gesellschaft mit beschränkter Haftung, Bekleidungsverschlußfabrik Verwaltungsgesellschaft",
      "company_seat": "Unterpfaffenhofen",
      "details": "21.01.2025 (Bekanntmachungsdatum)\n\nBayern Amtsgericht München HRB 40758\nRegisterbekanntmachung nach dem Umwandlungsgesetz 20.01.2025 (Eintragungsdatum)\n\nRies, Gesellschaft mit beschränkter Haftung, Bekleidungsverschlußfabrik Verwaltungsgesellschaft\nGesellschaft mit beschränkter Haftung\nUnterpfaffenhofen\n\nDen Gläubigern der an der Verschmelzung beteiligten Rechtsträger ist, wenn sie binnen sechs Monaten nach dem Tag, an dem die Eintragung der Verschmelzung in das Register des Sitzes desjenigen Rechtsträgers, dessen Gläubiger sie sind, nach § 19 Abs. 3 UmwG als bekannt gemacht gilt, ihren Anspruch nach Grund und Höhe in Textform anmelden, Sicherheit zu leisten, soweit sie nicht Befriedigung verlangen können. Dieses Recht steht den Gläubigern jedoch nur zu, wenn sie glaubhaft machen, dass durch die Verschmelzung die Erfüllung ihrer Forderung gefährdet wird."
    },
    {
      "date": "2025-01-21",
      "id": "99101",
      "original_text": "Einreichung neuer Dokumente\nBaden-Württemberg Amtsgericht Freiburg HRB 712144\nwvib Schwarzwald AG – Freiburg im Breisgau",
      "type": "Einreichung neuer Dokumente",
      "state": "Baden-Württemberg",
      "amtsgericht": "Amtsgericht Freiburg",
      "registernummer": "HRB 712144",
      "registerart": "HRB",
      "company_name": "wvib Schwarzwald AG",
      "company_seat": "Freiburg im Breisgau",
      "details": "21.01.2025 (Bekanntmachungsdatum)\n\nBaden-Württemberg Amtsgericht Freiburg HRB 712144\nEinreichung neuer Dokumente 21.01.2025 (Eintragungsdatum)\n\nwvib Schwarzwald AG\nAktiengesellschaft\nFreiburg im Breisgau\n\nAls nicht eingetragen wird bekanntgemacht:\nDie Gesellschaft hat am 20.01.2025 die Liste über die Zusammensetzung des Aufsichtsrats zum Handelsregister eingereicht."
    },
    {
      "date": "2025-01-21",
      "id": "99102",
      "original_text": "Sonstige Registerbekanntmachung\nBaden-Württemberg Amtsgericht Mannheim HRB 738292\nCRS Clinical Research Services Mannheim GmbH – Mannheim",
      "type": "Sonstige Registerbekanntmachung",
      "state": "Baden-Württemberg",
      "amtsgericht": "Amtsgericht Mannheim",
      "registernummer": "HRB 738292",
      "registerart": "HRB",
      "company_name": "CRS Clinical Research Services Mannheim GmbH",
      "company_seat": "Mannheim",
      "details": "21.01.2025 (Bekanntmachungsdatum)\n\nBaden-Württemberg Amtsgericht Mannheim HRB 738292\nSonstige Registerbekanntmachung 21.01.2025 (Eintragungsdatum)\n\nCRS Clinical Research Services Mannheim GmbH\nGesellschaft mit beschränkter Haftung\nMannheim\n\nAls nicht eingetragen wird bekanntgemacht:\nDen Gläubigern der Gesellschaft, deren Forderungen begründet worden sind, bevor die Eintragung der Beendigung des Vertrages in das Handelsregister nach § 10 HGB als bekanntgemacht gilt, ist vom anderen Vertragsteil Sicherheit zu leisten, wenn sie sich binnen sechs Monaten nach der Bekanntmachung zu diesem Zweck bei ihm melden."
    },
    {
      "date": "2025-01-21",
      "id": "99103",
      "original_text": "Einreichung neuer Dokumente\nBaden-Württemberg Amtsgericht Mannheim HRB 362406\nCTDI GmbH – Malsch",
      "type": "Einreichung neuer Dokumente",
      "state": "Baden-Württemberg",
      "amtsgericht": "Amtsgericht Mannheim",
      "registernummer": "HRB 362406",
      "registerart": "HRB",
      "company_name": "CTDI GmbH",
      "company_seat": "Malsch",
      "details": "21.01.2025 (Bekanntmachungsdatum)\n\nBaden-Württemberg Amtsgericht Mannheim HRB 362406\nEinreichung neuer Dokumente\n\nCTDI GmbH\nGesellschaft mit beschränkter Haftung\nMalsch\n\nDie Gesellschaft hat am 20.01.2025 die Liste über die Zusammensetzung des Aufsichtsrats zum Handelsregister eingereicht."
    },
    {
      "date": "2025-01-21",
      "id": "99104",
      "original_text": "Einreichung neuer Dokumente\nSaarland Amtsgericht Saarbrücken HRB 12245\ne.consult AG – Saarbrücken",
      "type": "Einreichung neuer Dokumente",
      "state": "Saarland",
      "amtsgericht": "Amtsgericht Saarbrücken",
      "registernummer": "HRB 12245",
      "registerart": "HRB",
      "company_name": "e.consult AG",
      "company_seat": "Saarbrücken",
      "details": "21.01.2025 (Bekanntmachungsdatum)\n\nSaarland Amtsgericht Saarbrücken HRB 12245\nEinreichung neuer Dokumente\n\ne.consult AG\nAktiengesellschaft\nSaarbrücken\n\nDer Vorstand der Gesellschaft hat eine Liste der Mitglieder des Aufsichtsrats zum Handelsregister eingereicht (§ 106 AktG)."
    },
    {
      "date": "2025-01-21",
      "id": "99105",
      "original_text": "Löschungsankündigung\nBerlin Amtsgericht Berlin (Charlottenburg) HRB 210554\nWildeküche.Berlin UG (haftungsbeschränkt) – Berlin",
      "type": "Löschungsankündigung",
      "state": "Berlin",
      "amtsgericht": "Amtsgericht Berlin (Charlottenburg)",
      "registernummer": "HRB 210554",
      "registerart": "HRB",
      "company_name": "Wildeküche.Berlin UG (haftungsbeschränkt)",
      "company_seat": "Berlin",
      "details": "21.01.2025 (Bekanntmachungsdatum)\n\nBerlin Amtsgericht Berlin (Charlottenburg) HRB 210554\nLöschungsankündigung\n\nWildeküche.Berlin UG (haftungsbeschränkt)\nGesellschaft mit beschränkter Haftung\nBerlin\n\nBei der nachstehenden Gesellschaft wird das Amtslöschungsverfahren gemäß § 394 FamFG eingeleitet. Widerspruchsfrist 6 Wochen"
    },
    {
      "date": "2025-01-21",
      "id": "99106",
      "original_text": "Einreichung neuer Dokumente\nBrandenburg Amtsgericht Potsdam HRB 1294\nProPotsdam GmbH – Potsdam",
      "type": "Einreichung neuer Dokumente",
      "state": "Brandenburg",
      "amtsgericht": "Amtsgericht Potsdam",
      "registernummer": "HRB 1294",
      "registerart": "HRB",
      "company_name": "ProPotsdam GmbH",
      "company_seat": "Potsdam",
      "details": "21.01.2025 (Bekanntmachungsdatum)\n\nBrandenburg Amtsgericht Potsdam HRB 1294\nEinreichung neuer Dokumente\n\nProPotsdam GmbH\nGesellschaft mit beschränkter Haftung\nPotsdam\n\nAls nicht eingetragen wird veröffentlicht: Eine Liste der Mitglieder des Aufsichtsrates wurde zum Handelsregister eingereicht."
    },
    {
      "date": "2025-01-21",
      "id": "99107",
      "original_text": "Löschungsankündigung\nSchleswig-Holstein Amtsgericht Lübeck HRB 1331 SB\nZinzow Tischlerei GmbH – Roseburg",
      "type": "Löschungsankündigung",
      "state": "Schleswig-Holstein",
      "amtsgericht": "Amtsgericht Lübeck",
      "registernummer": "HRB 1331 SB",
      "registerart": "HRB",
      "company_name": "Zinzow Tischlerei GmbH",
      "company_seat": "Roseburg",
      "details": "21.01.2025 (Bekanntmachungsdatum)\n\nSchleswig-Holstein Amtsgericht Lübeck HRB 1331 SB\nLöschungsankündigung\n\nZinzow Tischlerei GmbH\nGesellschaft mit beschränkter Haftung\nRoseburg\n\nEs ist die Löschung der nachstehenden Gesellschaft wegen Vermögenslosigkeit gemäß § 394 FamFG beabsichtigt.\nWiderspruchstfrist: 1 Monat."
    },
    {
      "date": "2025-01-21",
      "id": "99108",
      "original_text": "Sonstige Registerbekanntmachung\nSchleswig-Holstein Amtsgericht Lübeck HRB 7903\nDrägerwerk AG & Co. KGaA – Lübeck",
      "type": "Sonstige Registerbekanntmachung",
      "state": "Schleswig-Holstein",
      "amtsgericht": "Amtsgericht Lübeck",
      "registernummer": "HRB 7903",
      "registerart": "HRB",
      "company_name": "Drägerwerk AG & Co. KGaA",
      "company_seat": "Lübeck",
      "details": "21.01.2025 (Bekanntmachungsdatum)\n\nSchleswig-Holstein Amtsgericht Lübeck HRB 7903\nSonstige Registerbekanntmachung\n\nDrägerwerk AG & Co. KGaA\nKommanditgesellschaft auf Aktien\nLübeck\n\nAls nicht eingetragen wird veröffentlicht: Es wurde eine neue Liste der Aufsichtsratmitglieder zum Handelsregister eingereicht"
    },
    {
      "date": "2025-01-21",
      "id": "99109",
      "original_text": "Sonstige Registerbekanntmachung\nSchleswig-Holstein Amtsgericht Lübeck HRB 6570\nHolzideen Tischlerei GmbH – Bargteheide",
      "type": "Sonstige Registerbekanntmachung",
      "state": "Schleswig-Holstein",
      "amtsgericht": "Amtsgericht Lübeck",
      "registernummer": "HRB 6570",
      "registerart": "HRB",
      "company_name": "Holzideen Tischlerei GmbH",
      "company_seat": "Bargteheide",
      "details": "21.01.2025 (Bekanntmachungsdatum)\n\nSchleswig-Holstein Amtsgericht Lübeck HRB 6570\nSonstige Registerbekanntmachung\n\nHolzideen Tischlerei GmbH\nGesellschaft mit beschränkter Haftung\nBargteheide\n\nAls nicht eingetragen wird veröffentlicht:\nIn der Handelsregistersache\nHolzideen Tischlerei GmbH\nergeben sich aus den mir vorliegenden Unterlagen Anhaltspunkte dafür, dass die\nGesellschaft, als deren Geschäftsführer Sie noch eingetragen sind, vermögenslos ist:\nDas Insolvenzverfahren wurde durch Beschluss des Amtsgerichts Reinbek vom 06.11.2024\nnach Abhaltung des Schlusstermins und Vollzug der Schlussverteilung aufgehoben.\nDer Geschäftsführer ist verstorben, die Gesellschafter nicht erreichbar.\nIch beabsichtige daher, die Gesellschaft wegen Vermögenslosigkeit gemäß\n§ 394 FamFG zu löschen.\nIch bestimme eine Frist von einem Monat zur Geltendmachung eines Widerspruchs\ngegen die Löschung, § 394 Abs. 2 S. 1 FamFG.\nWeiter bitte ich, mir binnen derselben Frist mitzuteilen, ob die genannte Gesellschaft\nnoch Vermögen hat, ggf. welche Vermögensgegenstände sie besitzt, ob die Gesellschaft\nnoch Partei eines noch nicht rechtskräftig abgeschlossenen Rechtsstreits ist oder ob sonst\nnoch eine Abwicklung stattfindet.\nNach Fristablauf ohne Widerspruch wird die Gesellschaft gelöscht.\nAmtsgericht Lübeck, Abt. 6\nGärtner, Rechtspflegerin"
    },
    {
      "date": "2025-01-21",
      "id": "99110",
      "original_text": "Registerbekanntmachung nach dem Umwandlungsgesetz\nBaden-Württemberg Amtsgericht Stuttgart VR 6413\nNaturheilgesellschaft Stuttgart e.V. – Stuttgart",
      "type": "Registerbekanntmachung nach dem Umwandlungsgesetz",
      "state": "Baden-Württemberg",
      "amtsgericht": "Amtsgericht Stuttgart",
      "registernummer": "VR 6413",
      "registerart": "VR",
      "company_name": "Naturheilgesellschaft Stuttgart e.V.",
      "company_seat": "Stuttgart",
      "details": "21.01.2025 (Bekanntmachungsdatum)\n\nBaden-Württemberg Amtsgericht Stuttgart VR 6413\nRegisterbekanntmachung nach dem Umwandlungsgesetz 21.01.2025 (Eintragungsdatum)\n\nNaturheilgesellschaft Stuttgart e.V.\neingetragener Verein\nStuttgart\n\nAls nicht eingetragen wird bekanntgemacht:\nDen Gläubigern der an der Verschmelzung beteiligten Rechtsträger ist, wenn sie binnen sechs Monaten nach dem Tag, an dem die Eintragung der Verschmelzung in das Register des Sitzes desjenigen Rechtsträgers, dessen Gläubiger sie sind, nach § 19 Abs. 3 UmwG als bekanntgemacht gilt, ihren Anspruch nach Grund und Höhe schriftlich anmelden, Sicherheit zu leisten, soweit sie nicht Befriedigung verlangen können. Dieses Recht steht den Gläubigern jedoch nur zu, wenn sie glaubhaft machen, dass durch die Verschmelzung die Erfüllung ihrer Forderung gefährdet wird."
    },
    {
      "date": "2025-01-21",
      "id": "99111",
      "original_text": "Einreichung neuer Dokumente\nSchleswig-Holstein Amtsgericht Lübeck HRB 9\nL. Possehl & Co. mit beschränkter Haftung – Lübeck",
      "type": "Einreichung neuer Dokumente",
      "state": "Schleswig-Holstein",
      "amtsgericht": "Amtsgericht Lübeck",
      "registernummer": "HRB 9",
      "registerart": "HRB",
      "company_name": "L. Possehl & Co. mit beschränkter Haftung",
      "company_seat": "Lübeck",
      "details": "21.01.2025 (Bekanntmachungsdatum)\n\nSchleswig-Holstein Amtsgericht Lübeck HRB 9\nEinreichung neuer Dokumente\n\nL. Possehl & Co. mit beschränkter Haftung\nGesellschaft mit beschränkter Haftung\nLübeck\n\nAls nicht eingetragen wird veröffentlicht: Es wurde eine aktuelle Liste der Aufsichtsratsmitglieder zum Handelsregister eingereicht."
    },
    {
      "date": "2025-01-21",
      "id": "99112",
      "original_text": "Sonstige Registerbekanntmachung\nMecklenburg-Vorpommern Amtsgericht Rostock HRB 1229\nWIRO Wohnen in Rostock Wohnungsgesellschaft mbH – Rostock",
      "type": "Sonstige Registerbekanntmachung",
      "state": "Mecklenburg-Vorpommern",
      "amtsgericht": "Amtsgericht Rostock",
      "registernummer": "HRB 1229",
      "registerart": "HRB",
      "company_name": "WIRO Wohnen in Rostock Wohnungsgesellschaft mbH",
      "company_seat": "Rostock",
      "details": "21.01.2025 (Bekanntmachungsdatum)\n\nMecklenburg-Vorpommern Amtsgericht Rostock HRB 1229\nSonstige Registerbekanntmachung\n\nWIRO Wohnen in Rostock Wohnungsgesellschaft mbH\nGesellschaft mit beschränkter Haftung\nRostock\n\nEine Liste der Mitglieder des Aufsichtsrats ist zum Handelsregister eingereicht worden."
    },
    {
      "date": "2025-01-21",
      "id": "99113",
      "original_text": "Registerbekanntmachung nach dem Umwandlungsgesetz\nBerlin Amtsgericht Berlin (Charlottenburg) HRA 52814\nSeehotel Zeuthen GmbH & Co. Betriebs KG – Berlin",
      "type": "Registerbekanntmachung nach dem Umwandlungsgesetz",
      "state": "Berlin",
      "amtsgericht": "Amtsgericht Berlin (Charlottenburg)",
      "registernummer": "HRA 52814",
      "registerart": "HRA",
      "company_name": "Seehotel Zeuthen GmbH & Co. Betriebs KG",
      "company_seat": "Berlin",
      "details": "21.01.2025 (Bekanntmachungsdatum)\n\nBerlin Amtsgericht Berlin (Charlottenburg) HRA 52814\nRegisterbekanntmachung nach dem Umwandlungsgesetz 20.01.2025 (Eintragungsdatum)\n\nSeehotel Zeuthen GmbH & Co. Betriebs KG\nKommanditgesellschaft\nBerlin\n\nZu Eintragungsnummer 9 vom 20.01.2025 wird als nicht eingetragen veröffentlicht:Den Gläubigern der an der Verschmelzung beteiligten Rechtsträger ist, wenn sie binnen sechs Monaten nach dem Tag, an dem die Eintragung der Verschmelzung in das Register des Sitzes desjenigen Rechtsträgers, dessen Gläubiger sie sind, als bekannt gemacht gilt, ihren Anspruch nach Grund und Höhe schriftlich anmelden, Sicherheit zu leisten, soweit sie nicht Befriedigung verlangen können. Dieses Recht steht den Gläubigern jedoch nur zu, wenn sie glaubhaft machen, dass durch die Verschmelzung die Erfüllung ihrer Forderung gefährdet wird. Das Recht, Sicherheitsleistung zu verlangen, steht Gläubigern nicht zu, die im Falle der Insolvenz ein Recht auf vorzugsweise Befriedigung aus einer Deckungsmasse haben, die nach gesetzlicher Vorschrift zu ihrem Schutz errichtet und staatlich überwacht ist."
    },
    {
      "date": "2025-01-21",
      "id": "99114",
      "original_text": "Registerbekanntmachung nach dem Umwandlungsgesetz\nBerlin Amtsgericht Berlin (Charlottenburg) HRA 46631\nMing Hotels GmbH & Co. Monbijou KG – Berlin",
      "type": "Registerbekanntmachung nach dem Umwandlungsgesetz",
      "state": "Berlin",
      "amtsgericht": "Amtsgericht Berlin (Charlottenburg)",
      "registernummer": "HRA 46631",
      "registerart": "HRA",
      "company_name": "Ming Hotels GmbH & Co. Monbijou KG",
      "company_seat": "Berlin",
      "details": "21.01.2025 (Bekanntmachungsdatum)\n\nBerlin Amtsgericht Berlin (Charlottenburg) HRA 46631\nRegisterbekanntmachung nach dem Umwandlungsgesetz 20.01.2025 (Eintragungsdatum)\n\nMing Hotels GmbH & Co. Monbijou KG\nKommanditgesellschaft\nBerlin\n\nZu Eintragungsnummer 6 vom 20.01.2025 wird als nicht eingetragen veröffentlicht:Den Gläubigern der an der Verschmelzung beteiligten Rechtsträger ist, wenn sie binnen sechs Monaten nach dem Tag, an dem die Eintragung der Verschmelzung in das Register des Sitzes desjenigen Rechtsträgers, dessen Gläubiger sie sind, als bekannt gemacht gilt, ihren Anspruch nach Grund und Höhe schriftlich anmelden, Sicherheit zu leisten, soweit sie nicht Befriedigung verlangen können. Dieses Recht steht den Gläubigern jedoch nur zu, wenn sie glaubhaft machen, dass durch die Verschmelzung die Erfüllung ihrer Forderung gefährdet wird. Das Recht, Sicherheitsleistung zu verlangen, steht Gläubigern nicht zu, die im Falle der Insolvenz ein Recht auf vorzugsweise Befriedigung aus einer Deckungsmasse haben, die nach gesetzlicher Vorschrift zu ihrem Schutz errichtet und staatlich überwacht ist."
    },
    {
      "date": "2025-01-21",
      "id": "99115",
      "original_text": "Einreichung neuer Dokumente\nThüringen Amtsgericht Jena HRB 303807\nIMMS Institut für Mikroelektronik- und Mechatronik-Systeme gemeinnützige GmbH (IMMS GmbH) – Ilmenau",
      "type": "Einreichung neuer Dokumente",
      "state": "Thüringen",
      "amtsgericht": "Amtsgericht Jena",
      "registernummer": "HRB 303807",
      "registerart": "HRB",
      "company_name": "IMMS Institut für Mikroelektronik- und Mechatronik-Systeme gemeinnützige GmbH (IMMS GmbH)",
      "company_seat": "Ilmenau",
      "details": "21.01.2025 (Bekanntmachungsdatum)\n\nThüringen Amtsgericht Jena HRB 303807\nEinreichung neuer Dokumente\n\nIMMS Institut für Mikroelektronik- und Mechatronik-Systeme gemeinnützige GmbH (IMMS GmbH)\nGesellschaft mit beschränkter Haftung\nIlmenau\n\nBekanntmachung gem. § 52 Abs. 3 Satz 2 GmbHG: Aufgrund einer Veränderung in den Personen der Aufsichtsratsmitglieder ist durch die Geschäftsführer eine neue Liste zum Handelsregister eingereicht worden."
    },
    {
      "date": "2025-01-21",
      "id": "99116",
      "original_text": "Einreichung neuer Dokumente\nBrandenburg Amtsgericht Potsdam HRB 26391\nEntwicklungsträger Potsdam GmbH – Potsdam",
      "type": "Einreichung neuer Dokumente",
      "state": "Brandenburg",
      "amtsgericht": "Amtsgericht Potsdam",
      "registernummer": "HRB 26391",
      "registerart": "HRB",
      "company_name": "Entwicklungsträger Potsdam GmbH",
      "company_seat": "Potsdam",
      "details": "21.01.2025 (Bekanntmachungsdatum)\n\nBrandenburg Amtsgericht Potsdam HRB 26391\nEinreichung neuer Dokumente\n\nEntwicklungsträger Potsdam GmbH\nGesellschaft mit beschränkter Haftung\nPotsdam\n\nals nicht eingetragen wird bekanntgemacht : Eine Liste der Mitglieder des Aufsichtsrates wurde zum Handelsregister eingereicht."
    },
    {
      "date": "2025-01-21",
      "id": "99117",
      "original_text": "Registerbekanntmachung nach dem Umwandlungsgesetz\nSchleswig-Holstein Amtsgericht Kiel VR 947 RD\nFreundeskreise für Suchtkrankenhilfe Landesverband Schleswig-Holstein e.V. – Rendsburg",
      "type": "Registerbekanntmachung nach dem Umwandlungsgesetz",
      "state": "Schleswig-Holstein",
      "amtsgericht": "Amtsgericht Kiel",
      "registernummer": "VR 947 RD",
      "registerart": "VR",
      "company_name": "Freundeskreise für Suchtkrankenhilfe Landesverband Schleswig-Holstein e.V.",
      "company_seat": "Rendsburg",
      "details": "21.01.2025 (Bekanntmachungsdatum)\n\nSchleswig-Holstein Amtsgericht Kiel VR 947 RD\nRegisterbekanntmachung nach dem Umwandlungsgesetz 20.01.2025 (Eintragungsdatum)\n\nFreundeskreise für Suchtkrankenhilfe Landesverband Schleswig-Holstein e.V.\neingetragener Verein\nRendsburg\n\nZu Eintragungsnummer 12 vom 20.01.2025 wird als nicht eingetragen veröffentlicht: Den Gläubigern der an der Verschmelzung beteiligten Rechtsträger ist, wenn sie binnen sechs Monaten nach dem Tag, an dem die Eintragung der Verschmelzung in das Register des Sitzes desjenigen Rechtsträgers, dessen Gläubiger sie sind, nach § 19 Abs. 3 UmwG bekannt gemacht worden ist, ihren Anspruch nach Grund und Höhe schriftlich anmelden, Sicherheit zu leisten, soweit sie nicht Befriedigung verlangen können. Dieses Recht steht den Gläubigern jedoch nur zu, wenn sie glaubhaft machen, dass durch die Verschmelzung die Erfüllung ihrer Forderung gefährdet wird."
    },
    {
      "date": "2025-01-21",
      "id": "99118",
      "original_text": "Einreichung neuer Dokumente\nBaden-Württemberg Amtsgericht Stuttgart HRB 726530\nRems-Murr-Kliniken gGmbH – Winnenden",
      "type": "Einreichung neuer Dokumente",
      "state": "Baden-Württemberg",
      "amtsgericht": "Amtsgericht Stuttgart",
      "registernummer": "HRB 726530",
      "registerart": "HRB",
      "company_name": "Rems-Murr-Kliniken gGmbH",
      "company_seat": "Winnenden",
      "details": "21.01.2025 (Bekanntmachungsdatum)\n\nBaden-Württemberg Amtsgericht Stuttgart HRB 726530\nEinreichung neuer Dokumente\n\nRems-Murr-Kliniken gGmbH\nGesellschaft mit beschränkter Haftung\nWinnenden\n\nDie Gesellschaft hat am 16.01.2025 die Liste über die Zusammensetzung des Aufsichtsrats zum Handelsregister eingereicht."
    },
    {
      "date": "2025-01-21",
      "id": "99119",
      "original_text": "Löschungsankündigung\nSchleswig-Holstein Amtsgericht Kiel HRB 16387\nHugoGelato GmbH – Kiel",
      "type": "Löschungsankündigung",
      "state": "Schleswig-Holstein",
      "amtsgericht": "Amtsgericht Kiel",
      "registernummer": "HRB 16387",
      "registerart": "HRB",
      "company_name": "HugoGelato GmbH",
      "company_seat": "Kiel",
      "details": "21.01.2025 (Bekanntmachungsdatum)\n\nSchleswig-Holstein Amtsgericht Kiel HRB 16387\nLöschungsankündigung\n\nHugoGelato GmbH\nGesellschaft mit beschränkter Haftung\nKiel\n\nEs ist die Löschung der nachstehenden Gesellschaft wegen Vermögenslosigkeit gemäß § 394 FamFG beabsichtigt. Widerspruchsfrist: 2 Monate."
    },
    {
      "date": "2025-01-21",
      "id": "99120",
      "original_text": "Registerbekanntmachung nach dem Umwandlungsgesetz\nMecklenburg-Vorpommern Amtsgericht Stralsund HRB 22602\nPapenhäger Wind GmbH – Papenhagen",
      "type": "Registerbekanntmachung nach dem Umwandlungsgesetz",
      "state": "Mecklenburg-Vorpommern",
      "amtsgericht": "Amtsgericht Stralsund",
      "registernummer": "HRB 22602",
      "registerart": "HRB",
      "company_name": "Papenhäger Wind GmbH",
      "company_seat": "Papenhagen",
      "details": "21.01.2025 (Bekanntmachungsdatum)\n\nMecklenburg-Vorpommern Amtsgericht Stralsund HRB 22602\nRegisterbekanntmachung nach dem Umwandlungsgesetz 21.01.2025 (Eintragungsdatum)\n\nPapenhäger Wind GmbH\nGesellschaft mit beschränkter Haftung\nPapenhagen\n\nAls nicht eingetragen wird veröffentlicht: Den Gläubigern der an der Umwandlung beteiligten Rechtsträger ist, wenn sie binnen sechs\nMonaten nach dem Tag, an dem die Eintragung der Umwandlung in das Register des Sitzes desjenigen Rechtsträgers, dessen Gläubiger sie sind, nach § 19 Abs. 3 UmwG als bekannt gemacht gilt, ihren Anspruch nach Grund und Höhe in Textform anmelden, Sicherheit zu leisten, soweit sie nicht Befriedigung verlangen können. Dieses Recht steht den Gläubigern jedoch nur zu, wenn sie glaubhaft machen, dass durch die Umwandlung die Erfüllung der Forderung gefährdet wird."
    },
    {
      "date": "2025-01-21",
      "id": "99121",
      "original_text": "Sonstige Registerbekanntmachung\nSchleswig-Holstein Amtsgericht Lübeck HRA 10748\nColumbia1899 Betriebs- und Handels GmbH & Co. KG – Grömitz",
      "type": "Sonstige Registerbekanntmachung",
      "state": "Schleswig-Holstein",
      "amtsgericht": "Amtsgericht Lübeck",
      "registernummer": "HRA 10748",
      "registerart": "HRA",
      "company_name": "Columbia1899 Betriebs- und Handels GmbH & Co. KG",
      "company_seat": "Grömitz",
      "details": "21.01.2025 (Bekanntmachungsdatum)\n\nSchleswig-Holstein Amtsgericht Lübeck HRA 10748\nSonstige Registerbekanntmachung\n\nColumbia1899 Betriebs- und Handels GmbH & Co. KG\nKommanditgesellschaft\nGrömitz\n\nAls nicht eingetragen wird veröffentlicht:\nHerrn\nMatthias Ottosander\nals Kommanditist und Geschäftsführer\nzurzeit unbekannten Aufenthaltes\n\nDatum: 03.01.2025\n\nSehr geehrte Damen und Herren,\n\nin der Handelsregistersache der\nColumbia1899 Betriebs- und Handels GmbH & Co. KG\n\nwurde festgestellt, dass der vorletzte Gesellschafter durch Löschung aus der Gesellschaft\nausgeschieden ist.\nDas Ausscheiden eines von zwei Gesellschaftern führt bei einer\nPersonenhandelsgesellschaft zum liquidationslosen Erlöschen der Firma.\n\nEs ist beabsichtigt, die Firma von Amts wegen gemäß § 31 Abs. 2 HGB bzw. ggfls. § 394\nAbs. 4 FamFG zu löschen.\nSie erhalten hiermit Gelegenheit zur Erhebung eines Widerspruchs gegen die\nLöschungsankündigung. Der Widerspruch muss innerhalb von einem Monat ab Zugang\ndieses Schreibens schriftlich oder zu Protokoll der Geschäftsstelle erhoben werden.\n\nMit freundlichen Grüßen\nWolski, Rechtspflegerin\nBankverbindung:"
    },
    {
      "date": "2025-01-21",
      "id": "99122",
      "original_text": "Löschungsankündigung\nBaden-Württemberg Amtsgericht Stuttgart HRB 350521\nAdolf Münzinger Gipsergeschäft Gesellschaft mit beschränkter Haftung – Reutlingen",
      "type": "Löschungsankündigung",
      "state": "Baden-Württemberg",
      "amtsgericht": "Amtsgericht Stuttgart",
      "registernummer": "HRB 350521",
      "registerart": "HRB",
      "company_name": "Adolf Münzinger Gipsergeschäft Gesellschaft mit beschränkter Haftung",
      "company_seat": "Reutlingen",
      "details": "21.01.2025 (Bekanntmachungsdatum)\n\nBaden-Württemberg Amtsgericht Stuttgart HRB 350521\nLöschungsankündigung\n\nAdolf Münzinger Gipsergeschäft Gesellschaft mit beschränkter Haftung\nGesellschaft mit beschränkter Haftung\nReutlingen\n\nAls nicht eingetragen wird bekanntgemacht:\nDas Gericht beabsichtigt, die Gesellschaft wegen Vermögenslosigkeit im Handelsregister von Amts wegen nach § 394 FamFG zu löschen. Die Frist zur Geltendmachung eines Widerspruchs gegen die beabsichtigte Löschung ist auf zwei Monate ab Veröffentlichung bestimmt."
    },
    {
      "date": "2025-01-21",
      "id": "99123",
      "original_text": "Sonstige Registerbekanntmachung\nSchleswig-Holstein Amtsgericht Kiel HRB 4845\nCRS Clinical Research Services Kiel GmbH – Kiel",
      "type": "Sonstige Registerbekanntmachung",
      "state": "Schleswig-Holstein",
      "amtsgericht": "Amtsgericht Kiel",
      "registernummer": "HRB 4845",
      "registerart": "HRB",
      "company_name": "CRS Clinical Research Services Kiel GmbH",
      "company_seat": "Kiel",
      "details": "21.01.2025 (Bekanntmachungsdatum)\n\nSchleswig-Holstein Amtsgericht Kiel HRB 4845\nSonstige Registerbekanntmachung\n\nCRS Clinical Research Services Kiel GmbH\nGesellschaft mit beschränkter Haftung\nKiel\n\nAls nicht eingetragen wird veröffentlicht: Den Gläubigern der Gesellschaft, deren Forderungen begründet worden sind, bevor die Eintragung der Beendigung des Vertrages in das Handelsregister nach § 10 HGB bekannt gemacht worden ist, ist vom anderen Vertragspartner Sicherheit zu leisten, wenn sie sich binnen sechs Monaten nach Bekanntmachung der Eintragung zu diesem Zweck bei ihm melden."
    },
    {
      "date": "2025-01-21",
      "id": "99124",
      "original_text": "Registerbekanntmachung nach dem Umwandlungsgesetz\nSchleswig-Holstein Amtsgericht Kiel HRB 15163\nGLI Golden Leaf Invest Nord GmbH – Norderstedt",
      "type": "Registerbekanntmachung nach dem Umwandlungsgesetz",
      "state": "Schleswig-Holstein",
      "amtsgericht": "Amtsgericht Kiel",
      "registernummer": "HRB 15163",
      "registerart": "HRB",
      "company_name": "GLI Golden Leaf Invest Nord GmbH",
      "company_seat": "Norderstedt",
      "details": "21.01.2025 (Bekanntmachungsdatum)\n\nSchleswig-Holstein Amtsgericht Kiel HRB 15163\nRegisterbekanntmachung nach dem Umwandlungsgesetz 15.01.2025 (Eintragungsdatum)\n\nGLI Golden Leaf Invest Nord GmbH\nGesellschaft mit beschränkter Haftung\nNorderstedt\n\nZu Eintragungsnummer 9 vom 15.01.2025 wird als nicht eingetragen veröffentlicht: Den Gläubigern der an der Verschmelzung beteiligten Rechtsträger ist, wenn sie binnen sechs Monaten nach dem Tag, an dem die Eintragung der Verschmelzung in das Register des Sitzes desjenigen Rechtsträgers, dessen Gläubiger sie sind, nach § 19 Abs. 3 UmwG bekannt gemacht worden ist, ihren Anspruch nach Grund und Höhe schriftlich anmelden, Sicherheit zu leisten, soweit sie nicht Befriedigung verlangen können. Dieses Recht steht den Gläubigern jedoch nur zu, wenn sie glaubhaft machen, dass durch die Verschmelzung die Erfüllung ihrer Forderung gefährdet wird."
    },
    {
      "date": "2025-01-21",
      "id": "99125",
      "original_text": "Einreichung neuer Dokumente\nBaden-Württemberg Amtsgericht Stuttgart HRB 732806\nREM CAPITAL AG – Stuttgart",
      "type": "Einreichung neuer Dokumente",
      "state": "Baden-Württemberg",
      "amtsgericht": "Amtsgericht Stuttgart",
      "registernummer": "HRB 732806",
      "registerart": "HRB",
      "company_name": "REM CAPITAL AG",
      "company_seat": "Stuttgart",
      "details": "21.01.2025 (Bekanntmachungsdatum)\n\nBaden-Württemberg Amtsgericht Stuttgart HRB 732806\nEinreichung neuer Dokumente\n\nREM CAPITAL AG\nAktiengesellschaft\nStuttgart\n\nDie Gesellschaft hat am 20.01.2025 die Liste über die Zusammensetzung des Aufsichtsrats zum Handelsregister eingereicht."
    },
    {
      "date": "2025-01-21",
      "id": "99126",
      "original_text": "Einreichung neuer Dokumente\nSachsen-Anhalt Amtsgericht Stendal HRB 107281\nWohnungsbau-GmbH Oebisfelde – Oebisfelde-Weferlingen",
      "type": "Einreichung neuer Dokumente",
      "state": "Sachsen-Anhalt",
      "amtsgericht": "Amtsgericht Stendal",
      "registernummer": "HRB 107281",
      "registerart": "HRB",
      "company_name": "Wohnungsbau-GmbH Oebisfelde",
      "company_seat": "Oebisfelde-Weferlingen",
      "details": "21.01.2025 (Bekanntmachungsdatum)\n\nSachsen-Anhalt Amtsgericht Stendal HRB 107281\nEinreichung neuer Dokumente\n\nWohnungsbau-GmbH Oebisfelde\nGesellschaft mit beschränkter Haftung\nOebisfelde-Weferlingen\n\nEine Liste der Mitglieder des Aufsichtsrates wurde zum Handelsregister eingereicht."
    },
    {
      "date": "2025-01-21",
      "id": "99127",
      "original_text": "Registerbekanntmachung nach dem Umwandlungsgesetz\nBaden-Württemberg Amtsgericht Stuttgart HRB 753413\nAUTOflex GmbH – Gundelsheim",
      "type": "Registerbekanntmachung nach dem Umwandlungsgesetz",
      "state": "Baden-Württemberg",
      "amtsgericht": "Amtsgericht Stuttgart",
      "registernummer": "HRB 753413",
      "registerart": "HRB",
      "company_name": "AUTOflex GmbH",
      "company_seat": "Gundelsheim",
      "details": "21.01.2025 (Bekanntmachungsdatum)\n\nBaden-Württemberg Amtsgericht Stuttgart HRB 753413\nRegisterbekanntmachung nach dem Umwandlungsgesetz 21.01.2025 (Eintragungsdatum)\n\nAUTOflex GmbH\nGesellschaft mit beschränkter Haftung\nGundelsheim\n\nAls nicht eingetragen wird bekanntgemacht:\nDen Gläubigern der an der Verschmelzung beteiligten Rechtsträger ist, wenn sie binnen sechs Monaten nach dem Tag, an dem die Eintragung der Verschmelzung in das Register des Sitzes desjenigen Rechtsträgers, dessen Gläubiger sie sind, nach § 19 Abs. 3 UmwG als bekanntgemacht gilt, ihren Anspruch nach Grund und Höhe schriftlich anmelden, Sicherheit zu leisten, soweit sie nicht Befriedigung verlangen können. Dieses Recht steht den Gläubigern jedoch nur zu, wenn sie glaubhaft machen, dass durch die Verschmelzung die Erfüllung ihrer Forderung gefährdet wird."
    },
    {
      "date": "2025-01-21",
      "id": "99128",
      "original_text": "Registerbekanntmachung nach dem Umwandlungsgesetz\nBerlin Amtsgericht Berlin (Charlottenburg) HRB 247758\nLEURDO Properties GmbH – Berlin",
      "type": "Registerbekanntmachung nach dem Umwandlungsgesetz",
      "state": "Berlin",
      "amtsgericht": "Amtsgericht Berlin (Charlottenburg)",
      "registernummer": "HRB 247758",
      "registerart": "HRB",
      "company_name": "LEURDO Properties GmbH",
      "company_seat": "Berlin",
      "details": "21.01.2025 (Bekanntmachungsdatum)\n\nBerlin Amtsgericht Berlin (Charlottenburg) HRB 247758\nRegisterbekanntmachung nach dem Umwandlungsgesetz 20.01.2025 (Eintragungsdatum)\n\nLEURDO Properties GmbH\nGesellschaft mit beschränkter Haftung\nBerlin\n\nZu Eintragungsnummer 3 vom 20.01.2025 wird als nicht eingetragen veröffentlicht: Den Gläubigern der an der Verschmelzung beteiligten Rechtsträger ist, wenn sie binnen sechs Monaten nach dem Tag, an dem die Eintragung der Verschmelzung in das Register des Sitzes desjenigen Rechtsträgers, dessen Gläubiger sie sind, als bekannt gemacht gilt, ihren Anspruch nach Grund und Höhe schriftlich anmelden, Sicherheit zu leisten, soweit sie nicht Befriedigung verlangen können. Dieses Recht steht den Gläubigern jedoch nur zu, wenn sie glaubhaft machen, dass durch die Verschmelzung die Erfüllung ihrer Forderung gefährdet wird. Das Recht, Sicherheitsleistung zu verlangen, steht Gläubigern nicht zu, die im Falle der Insolvenz ein Recht auf vorzugsweise Befriedigung aus einer Deckungsmasse haben, die nach gesetzlicher Vorschrift zu ihrem Schutz errichtet und staatlich überwacht ist."
    },
    {
      "date": "2025-01-21",
      "id": "99129",
      "original_text": "Registerbekanntmachung nach dem Umwandlungsgesetz\nBerlin Amtsgericht Berlin (Charlottenburg) HRB 264070\nDebehaus GmbH – Berlin",
      "type": "Registerbekanntmachung nach dem Umwandlungsgesetz",
      "state": "Berlin",
      "amtsgericht": "Amtsgericht Berlin (Charlottenburg)",
      "registernummer": "HRB 264070",
      "registerart": "HRB",
      "company_name": "Debehaus GmbH",
      "company_seat": "Berlin",
      "details": "21.01.2025 (Bekanntmachungsdatum)\n\nBerlin Amtsgericht Berlin (Charlottenburg) HRB 264070\nRegisterbekanntmachung nach dem Umwandlungsgesetz 20.01.2025 (Eintragungsdatum)\n\nDebehaus GmbH\nGesellschaft mit beschränkter Haftung\nBerlin\n\nZu Eintragungsnummer 2 vom 20.01.2025 wird als nicht eingetragen veröffentlicht: Den Gläubigern der an der Verschmelzung beteiligten Rechtsträger ist, wenn sie binnen sechs Monaten nach dem Tag, an dem die Eintragung der Verschmelzung in das Register des Sitzes desjenigen Rechtsträgers, dessen Gläubiger sie sind, als bekannt gemacht gilt, ihren Anspruch nach Grund und Höhe schriftlich anmelden, Sicherheit zu leisten, soweit sie nicht Befriedigung verlangen können. Dieses Recht steht den Gläubigern jedoch nur zu, wenn sie glaubhaft machen, dass durch die Verschmelzung die Erfüllung ihrer Forderung gefährdet wird. Das Recht, Sicherheitsleistung zu verlangen, steht Gläubigern nicht zu, die im Falle der Insolvenz ein Recht auf vorzugsweise Befriedigung aus einer Deckungsmasse haben, die nach gesetzlicher Vorschrift zu ihrem Schutz errichtet und staatlich überwacht ist."
    },
    {
      "date": "2025-01-21",
      "id": "99130",
      "original_text": "Registerbekanntmachung nach dem Umwandlungsgesetz\nSachsen Amtsgericht Chemnitz HRB 31501\nGK Software SE – Schöneck/Vogtl.",
      "type": "Registerbekanntmachung nach dem Umwandlungsgesetz",
      "state": "Sachsen",
      "amtsgericht": "Amtsgericht Chemnitz",
      "registernummer": "HRB 31501",
      "registerart": "HRB",
      "company_name": "GK Software SE",
      "company_seat": "Schöneck/Vogtl.",
      "details": "21.01.2025 (Bekanntmachungsdatum)\n\nSachsen Amtsgericht Chemnitz HRB 31501\nRegisterbekanntmachung nach dem Umwandlungsgesetz\n\nGK Software SE\nEuropäische Aktiengesellschaft (SE)\nSchöneck/Vogtl.\n\nHRB 31501:\nGK Software SE, Schöneck/Vogtl.,\nWaldstraße 7, 08261 Schöneck/Vogtl.\n\nGemäß §§ 62 Abs. 3, Satz 2, 61 UmwG wird bekanntgemacht, dass die Gesellschaft den Verschmelzungsvertrag zwischen der Gesellschaft und der Retail7 GmbH mit Sitz in Berlin (Amtsgericht Charlottenburg HRB 219116 B) beim Handelsregister eingereicht hat."
    },
    {
      "date": "2025-01-21",
      "id": "99131",
      "original_text": "Sonstige Registerbekanntmachung\nSachsen Amtsgericht Dresden HRB 32931\nNovaled GmbH – Dresden",
      "type": "Sonstige Registerbekanntmachung",
      "state": "Sachsen",
      "amtsgericht": "Amtsgericht Dresden",
      "registernummer": "HRB 32931",
      "registerart": "HRB",
      "company_name": "Novaled GmbH",
      "company_seat": "Dresden",
      "details": "21.01.2025 (Bekanntmachungsdatum)\n\nSachsen Amtsgericht Dresden HRB 32931\nSonstige Registerbekanntmachung\n\nNovaled GmbH\nGesellschaft mit beschränkter Haftung\nDresden\n\nAm 20.01.2025 wurde beim Handelsregister des Amtsgerichts Dresden die Liste der Mitglieder des Aufsichtsrats gemäß § 52 GmbHG eingereicht."
    },
    {
      "date": "2025-01-21",
      "id": "99132",
      "original_text": "Sonstige Registerbekanntmachung\nSachsen Amtsgericht Dresden HRB 27229\nDresden Marketing GmbH – Dresden",
      "type": "Sonstige Registerbekanntmachung",
      "state": "Sachsen",
      "amtsgericht": "Amtsgericht Dresden",
      "registernummer": "HRB 27229",
      "registerart": "HRB",
      "company_name": "Dresden Marketing GmbH",
      "company_seat": "Dresden",
      "details": "21.01.2025 (Bekanntmachungsdatum)\n\nSachsen Amtsgericht Dresden HRB 27229\nSonstige Registerbekanntmachung\n\nDresden Marketing GmbH\nGesellschaft mit beschränkter Haftung\nDresden\n\nAm 17.01.2025 wurde beim Handelsregister des Amtsgerichts Dresden die Liste der Mitglieder des Aufsichtsrats gemäß § 52 GmbHG eingereicht."
    },
    {
      "date": "2025-01-21",
      "id": "99133",
      "original_text": "Löschungsankündigung\nSachsen Amtsgericht Dresden HRA 7288\nBE Building Service Limited & Co. KG – Dresden",
      "type": "Löschungsankündigung",
      "state": "Sachsen",
      "amtsgericht": "Amtsgericht Dresden",
      "registernummer": "HRA 7288",
      "registerart": "HRA",
      "company_name": "BE Building Service Limited & Co. KG",
      "company_seat": "Dresden",
      "details": "21.01.2025 (Bekanntmachungsdatum)\n\nSachsen Amtsgericht Dresden HRA 7288\nLöschungsankündigung\n\nBE Building Service Limited & Co. KG\nKommanditgesellschaft\nDresden\n\nDas Registergericht beabsichtigt, die im Handelsregister eingetragene Gesellschaft von Amts wegen nach §§ 31 Abs.2 HGB, 393 FamFG zu löschen. Die Frist zu Erhebung eines Widerspruchs gegen die beabsichtigte Löschung wird auf einen Monat festgesetzt."
    },
    {
      "date": "2025-01-21",
      "id": "99134",
      "original_text": "Registerbekanntmachung nach dem Umwandlungsgesetz\nSachsen Amtsgericht Chemnitz HRB 31501\nGK Software SE – Schöneck/Vogtl.",
      "type": "Registerbekanntmachung nach dem Umwandlungsgesetz",
      "state": "Sachsen",
      "amtsgericht": "Amtsgericht Chemnitz",
      "registernummer": "HRB 31501",
      "registerart": "HRB",
      "company_name": "GK Software SE",
      "company_seat": "Schöneck/Vogtl.",
      "details": "21.01.2025 (Bekanntmachungsdatum)\n\nSachsen Amtsgericht Chemnitz HRB 31501\nRegisterbekanntmachung nach dem Umwandlungsgesetz\n\nGK Software SE\nEuropäische Aktiengesellschaft (SE)\nSchöneck/Vogtl.\n\nHRB 31501:\nGK Software SE, Schöneck/Vogtl.,\nWaldstraße 7, 08261 Schöneck/Vogtl.\n\nGemäß §§ 62 Abs. 3, Satz 2, 61 UmwG wird bekanntgemacht, dass die Gesellschaft den Verschmelzungsvertrag zwischen der Gesellschaft und der GK Group IT Solutions GmbH mit Sitz in Schöneck/Vogtl. (Amtsgericht Chemnitz HRB 35463) beim Handelsregister eingereicht hat."
    },
    {
      "date": "2025-01-21",
      "id": "99135",
      "original_text": "Registerbekanntmachung nach dem Umwandlungsgesetz\nSachsen Amtsgericht Leipzig HRB 38826\nOLOID Solution GmbH – Leipzig",
      "type": "Registerbekanntmachung nach dem Umwandlungsgesetz",
      "state": "Sachsen",
      "amtsgericht": "Amtsgericht Leipzig",
      "registernummer": "HRB 38826",
      "registerart": "HRB",
      "company_name": "OLOID Solution GmbH",
      "company_seat": "Leipzig",
      "details": "21.01.2025 (Bekanntmachungsdatum)\n\nSachsen Amtsgericht Leipzig HRB 38826\nRegisterbekanntmachung nach dem Umwandlungsgesetz 21.01.2025 (Eintragungsdatum)\n\nOLOID Solution GmbH\nGesellschaft mit beschränkter Haftung\nLeipzig\n\nDen Gläubigern der an der Verschmelzung beteiligten Rechtsträger ist, wenn sie binnen sechs Monaten nach dem Tag, an dem die Eintragung der Verschmelzung in das Register des Sitzes desjenigen Rechtsträgers, dessen Gläubiger sie sind, nach § 19 Abs. 3 UmwG als bekannt gemacht gilt, ihren Anspruch nach Grund und Höhe in Textform anmelden, Sicherheit zu leisten, soweit sie nicht Befriedigung verlangen können. Dieses Recht steht den Gläubigern jedoch nur zu, wenn sie glaubhaft machen, dass durch die Verschmelzung die Erfüllung der Forderung gefährdet wird."
    },
    {
      "date": "2025-01-21",
      "id": "99136",
      "original_text": "Löschungsankündigung\nNiedersachsen Amtsgericht Aurich HRA 200471\nReederei MS \"Global Hera\" GmbH & Co. KG – Leer",
      "type": "Löschungsankündigung",
      "state": "Niedersachsen",
      "amtsgericht": "Amtsgericht Aurich",
      "registernummer": "HRA 200471",
      "registerart": "HRA",
      "company_name": "Reederei MS \"Global Hera\" GmbH & Co. KG",
      "company_seat": "Leer",
      "details": "21.01.2025 (Bekanntmachungsdatum)\n\nNiedersachsen Amtsgericht Aurich HRA 200471\nLöschungsankündigung 21.01.2025 (Eintragungsdatum)\n\nReederei MS \"Global Hera\" GmbH & Co. KG\nKommanditgesellschaft\nLeer\n\nDas Registergericht beabsichtigt, die Firma von Amts wegen nach § 394 FamFG zu löschen. Die Frist zur Erhebung eines Widerspruchs ist auf 1 Monat ab dieser Registerbekanntmachung festgesetzt."
    },
    {
      "date": "2025-01-21",
      "id": "99137",
      "original_text": "Löschungsankündigung\nNiedersachsen Amtsgericht Hildesheim HRB 202646\nDavid Jade Garden UG (haftungsbeschränkt) – Meine",
      "type": "Löschungsankündigung",
      "state": "Niedersachsen",
      "amtsgericht": "Amtsgericht Hildesheim",
      "registernummer": "HRB 202646",
      "registerart": "HRB",
      "company_name": "David Jade Garden UG (haftungsbeschränkt)",
      "company_seat": "Meine",
      "details": "21.01.2025 (Bekanntmachungsdatum)\n\nNiedersachsen Amtsgericht Hildesheim HRB 202646\nLöschungsankündigung 21.01.2025 (Eintragungsdatum)\n\nDavid Jade Garden UG (haftungsbeschränkt)\nGesellschaft mit beschränkter Haftung\nMeine\n\nDas Registergericht beabsichtigt, die Gesellschaft von Amts wegen nach § 394 FamFG zu löschen. Die Frist zur Erhebung eines Widerspruchs ist auf 1 Monat ab dieser Registerbekanntmachung festgesetzt."
    },
    {
      "date": "2025-01-21",
      "id": "99138",
      "original_text": "Einreichung neuer Dokumente\nNiedersachsen Amtsgericht Braunschweig HRB 202475\nGandersheimer Domfestspiele gemeinnützige GmbH – Bad Gandersheim",
      "type": "Einreichung neuer Dokumente",
      "state": "Niedersachsen",
      "amtsgericht": "Amtsgericht Braunschweig",
      "registernummer": "HRB 202475",
      "registerart": "HRB",
      "company_name": "Gandersheimer Domfestspiele gemeinnützige GmbH",
      "company_seat": "Bad Gandersheim",
      "details": "21.01.2025 (Bekanntmachungsdatum)\n\nNiedersachsen Amtsgericht Braunschweig HRB 202475\nEinreichung neuer Dokumente 21.01.2025 (Eintragungsdatum)\n\nGandersheimer Domfestspiele gemeinnützige GmbH\nGesellschaft mit beschränkter Haftung\nBad Gandersheim\n\nDie Liste der Mitglieder des Aufsichtsrats wurde beim Registergericht eingereicht."
    },
    {
      "date": "2025-01-21",
      "id": "99139",
      "original_text": "Löschungsankündigung\nNiedersachsen Amtsgericht Oldenburg (Oldenburg) HRB 210804\nMS \"Viktoria Wulff\" Schiffahrtsverwaltungs-GmbH – Delmenhorst",
      "type": "Löschungsankündigung",
      "state": "Niedersachsen",
      "amtsgericht": "Amtsgericht Oldenburg (Oldenburg)",
      "registernummer": "HRB 210804",
      "registerart": "HRB",
      "company_name": "MS \"Viktoria Wulff\" Schiffahrtsverwaltungs-GmbH",
      "company_seat": "Delmenhorst",
      "details": "21.01.2025 (Bekanntmachungsdatum)\n\nNiedersachsen Amtsgericht Oldenburg (Oldenburg) HRB 210804\nLöschungsankündigung\n\nMS \"Viktoria Wulff\" Schiffahrtsverwaltungs-GmbH\nGesellschaft mit beschränkter Haftung\nDelmenhorst\n\nDas Registergericht beabsichtigt, die Gesellschaft von Amts wegen nach § 394 FamFG zu löschen. Die Frist zur Erhebung eines Widerspruchs ist auf 1 Monat ab dieser Registerbekanntmachung festgesetzt."
    },
    {
      "date": "2025-01-21",
      "id": "99140",
      "original_text": "Einreichung neuer Dokumente\nNiedersachsen Amtsgericht Osnabrück HRB 218123\nSolarNord AG – Osnabrück",
      "type": "Einreichung neuer Dokumente",
      "state": "Niedersachsen",
      "amtsgericht": "Amtsgericht Osnabrück",
      "registernummer": "HRB 218123",
      "registerart": "HRB",
      "company_name": "SolarNord AG",
      "company_seat": "Osnabrück",
      "details": "21.01.2025 (Bekanntmachungsdatum)\n\nNiedersachsen Amtsgericht Osnabrück HRB 218123\nEinreichung neuer Dokumente\n\nSolarNord AG\nAktiengesellschaft\nOsnabrück\n\nDie Liste der Mitglieder des Aufsichtsrats wurde beim Registergericht eingereicht."
    },
    {
      "date": "2025-01-21",
      "id": "99141",
      "original_text": "Registerbekanntmachung nach dem Umwandlungsgesetz\nNiedersachsen Amtsgericht Aurich HRB 200134\nWWS Consulting GmbH – Leer",
      "type": "Registerbekanntmachung nach dem Umwandlungsgesetz",
      "state": "Niedersachsen",
      "amtsgericht": "Amtsgericht Aurich",
      "registernummer": "HRB 200134",
      "registerart": "HRB",
      "company_name": "WWS Consulting GmbH",
      "company_seat": "Leer",
      "details": "21.01.2025 (Bekanntmachungsdatum)\n\nNiedersachsen Amtsgericht Aurich HRB 200134\nRegisterbekanntmachung nach dem Umwandlungsgesetz 21.01.2025 (Eintragungsdatum)\n\nWWS Consulting GmbH\nGesellschaft mit beschränkter Haftung\nLeer\n\nDen Gläubigern der an der Verschmelzung beteiligten Rechtsträger ist, wenn sie binnen sechs Monaten nach dem Tag, an dem die Eintragung der Verschmelzung in das Register des Sitzes desjenigen Rechtsträgers, dessen Gläubiger sie sind, nach § 19  Abs.  3 UmwG als bekannt gemacht gilt, ihren Anspruch nach Grund und Höhe schriftlich anmelden, Sicherheit zu leisten, soweit sie nicht Befriedigung verlangen können. Dieses Recht steht den Gläubigern jedoch nur zu, wenn sie glaubhaft machen, dass durch die Verschmelzung die Erfüllung der Forderung gefährdet wird."
    },
    {
      "date": "2025-01-21",
      "id": "99142",
      "original_text": "Registerbekanntmachung nach dem Umwandlungsgesetz\nNiedersachsen Amtsgericht Hannover HRB 228322\nBonk-Maire-Hoppmann GmbH – Garbsen",
      "type": "Registerbekanntmachung nach dem Umwandlungsgesetz",
      "state": "Niedersachsen",
      "amtsgericht": "Amtsgericht Hannover",
      "registernummer": "HRB 228322",
      "registerart": "HRB",
      "company_name": "Bonk-Maire-Hoppmann GmbH",
      "company_seat": "Garbsen",
      "details": "21.01.2025 (Bekanntmachungsdatum)\n\nNiedersachsen Amtsgericht Hannover HRB 228322\nRegisterbekanntmachung nach dem Umwandlungsgesetz 21.01.2025 (Eintragungsdatum)\n\nBonk-Maire-Hoppmann GmbH\nGesellschaft mit beschränkter Haftung\nGarbsen\n\nDen Gläubigern der an der formwechselnden Umwandlung beteiligten Rechtsträger ist, wenn sie binnen sechs Monaten nach dem Tag, an dem die Eintragung der Umwandlung in das Register des Sitzes desjenigen Rechtsträgers, dessen Gläubiger sie sind, nach § 19 Abs. 3 UmwG als bekannt gemacht gilt, ihren Anspruch nach Grund und Höhe schriftlich anmelden, Sicherheit zu leisten, soweit sie nicht Befriedigung verlangen können. Dieses Recht steht den Gläubigern jedoch nur zu, wenn sie glaubhaft machen, dass durch die formwechselnde Umwandlung die Erfüllung der Forderung gefährdet wird."
    },
    {
      "date": "2025-01-21",
      "id": "99143",
      "original_text": "Registerbekanntmachung nach dem Umwandlungsgesetz\nNiedersachsen Amtsgericht Aurich HRB 200088\nHiltes Software Systeme GmbH – Leer",
      "type": "Registerbekanntmachung nach dem Umwandlungsgesetz",
      "state": "Niedersachsen",
      "amtsgericht": "Amtsgericht Aurich",
      "registernummer": "HRB 200088",
      "registerart": "HRB",
      "company_name": "Hiltes Software Systeme GmbH",
      "company_seat": "Leer",
      "details": "21.01.2025 (Bekanntmachungsdatum)\n\nNiedersachsen Amtsgericht Aurich HRB 200088\nRegisterbekanntmachung nach dem Umwandlungsgesetz 21.01.2025 (Eintragungsdatum)\n\nHiltes Software Systeme GmbH\nGesellschaft mit beschränkter Haftung\nLeer\n\nDen Gläubigern der an der Verschmelzung beteiligten Rechtsträger ist, wenn sie binnen sechs Monaten nach dem Tag, an dem die Eintragung der Verschmelzung in das Register des Sitzes desjenigen Rechtsträgers, dessen Gläubiger sie sind, nach § 19  Abs.  3 UmwG als bekannt gemacht gilt, ihren Anspruch nach Grund und Höhe schriftlich anmelden, Sicherheit zu leisten, soweit sie nicht Befriedigung verlangen können. Dieses Recht steht den Gläubigern jedoch nur zu, wenn sie glaubhaft machen, dass durch die Verschmelzung die Erfüllung der Forderung gefährdet wird."
    },
    {
      "date": "2025-01-21",
      "id": "99144",
      "original_text": "Registerbekanntmachung nach dem Umwandlungsgesetz\nNiedersachsen Amtsgericht Hannover PR 201017\nBonk - Maire - Hoppmann PartG mbB Beratende Ingenieure und Sachverständige – Garbsen",
      "type": "Registerbekanntmachung nach dem Umwandlungsgesetz",
      "state": "Niedersachsen",
      "amtsgericht": "Amtsgericht Hannover",
      "registernummer": "PR 201017",
      "registerart": "PR",
      "company_name": "Bonk - Maire - Hoppmann PartG mbB Beratende Ingenieure und Sachverständige",
      "company_seat": "Garbsen",
      "details": "21.01.2025 (Bekanntmachungsdatum)\n\nNiedersachsen Amtsgericht Hannover PR 201017\nRegisterbekanntmachung nach dem Umwandlungsgesetz 21.01.2025 (Eintragungsdatum)\n\nBonk - Maire - Hoppmann PartG mbB Beratende Ingenieure und Sachverständige\nPartnerschaftsgesellschaft\nGarbsen\n\nDen Gläubigern der an der formwechselnden Umwandlung beteiligten Rechtsträger ist, wenn sie binnen sechs Monaten nach dem Tag, an dem die Eintragung der Umwandlung in das Register des Sitzes desjenigen Rechtsträgers, dessen Gläubiger sie sind, nach § 19 Abs. 3 UmwG als bekannt gemacht gilt, ihren Anspruch nach Grund und Höhe schriftlich anmelden, Sicherheit zu leisten, soweit sie nicht Befriedigung verlangen können. Dieses Recht steht den Gläubigern jedoch nur zu, wenn sie glaubhaft machen, dass durch die formwechselnde Umwandlung die Erfüllung der Forderung gefährdet wird."
    },
    {
      "date": "2025-01-21",
      "id": "99145",
      "original_text": "Einreichung neuer Dokumente\nNiedersachsen Amtsgericht Hannover HRB 120541 früher Amtsgericht Burgwedel\nVAPS GmbH – Isernhagen",
      "type": "Einreichung neuer Dokumente",
      "state": "Niedersachsen",
      "amtsgericht": "Amtsgericht Hannover",
      "registernummer": "HRB 120541",
      "registerart": "HRB",
      "company_name": "VAPS GmbH",
      "company_seat": "Isernhagen",
      "former_amtsgericht": "Burgwedel",
      "details": "21.01.2025 (Bekanntmachungsdatum)\n\nNiedersachsen Amtsgericht Hannover HRB 120541 früher Amtsgericht Burgwedel\nEinreichung neuer Dokumente 21.01.2025 (Eintragungsdatum)\n\nVAPS GmbH\nGesellschaft mit beschränkter Haftung\nIsernhagen\n\nDie Liste der Mitglieder des Aufsichtsrats wurde beim Registergericht eingereicht."
    },
    {
      "date": "2025-01-21",
      "id": "99146",
      "original_text": "Löschungsankündigung\nNiedersachsen Amtsgericht Aurich HRB 202991\nplanen & bauen Balfanz GmbH – Hage",
      "type": "Löschungsankündigung",
      "state": "Niedersachsen",
      "amtsgericht": "Amtsgericht Aurich",
      "registernummer": "HRB 202991",
      "registerart": "HRB",
      "company_name": "planen & bauen Balfanz GmbH",
      "company_seat": "Hage",
      "details": "21.01.2025 (Bekanntmachungsdatum)\n\nNiedersachsen Amtsgericht Aurich HRB 202991\nLöschungsankündigung 21.01.2025 (Eintragungsdatum)\n\nplanen & bauen Balfanz GmbH\nGesellschaft mit beschränkter Haftung\nHage\n\nDas Registergericht beabsichtigt, die Gesellschaft von Amts wegen nach § 394 FamFG zu löschen. Die Frist zur Erhebung eines Widerspruchs ist auf 1 Monat ab dieser Registerbekanntmachung festgesetzt."
    },
    {
      "date": "2025-01-21",
      "id": "99147",
      "original_text": "Sonstige Registerbekanntmachung\nRheinland-Pfalz Amtsgericht Mainz HRB 50396\nDeutsches Rotes Kreuz Medizinische Dienste Mainz-Bingen gGmbH – Mainz",
      "type": "Sonstige Registerbekanntmachung",
      "state": "Rheinland-Pfalz",
      "amtsgericht": "Amtsgericht Mainz",
      "registernummer": "HRB 50396",
      "registerart": "HRB",
      "company_name": "Deutsches Rotes Kreuz Medizinische Dienste Mainz-Bingen gGmbH",
      "company_seat": "Mainz",
      "details": "21.01.2025 (Bekanntmachungsdatum)\n\nRheinland-Pfalz Amtsgericht Mainz HRB 50396\nSonstige Registerbekanntmachung\n\nDeutsches Rotes Kreuz Medizinische Dienste Mainz-Bingen gGmbH\nGesellschaft mit beschränkter Haftung\nMainz\n\nDem Registergericht ist eine neue Liste der Mitglieder des Aufsichtsrates eingereicht worden."
    },
    {
      "date": "2025-01-21",
      "id": "99148",
      "original_text": "Sonstige Registerbekanntmachung\nRheinland-Pfalz Amtsgericht Mainz HRB 4066\nEckes-Granini Deutschland GmbH – Nieder-Olm",
      "type": "Sonstige Registerbekanntmachung",
      "state": "Rheinland-Pfalz",
      "amtsgericht": "Amtsgericht Mainz",
      "registernummer": "HRB 4066",
      "registerart": "HRB",
      "company_name": "Eckes-Granini Deutschland GmbH",
      "company_seat": "Nieder-Olm",
      "details": "21.01.2025 (Bekanntmachungsdatum)\n\nRheinland-Pfalz Amtsgericht Mainz HRB 4066\nSonstige Registerbekanntmachung\n\nEckes-Granini  Deutschland GmbH\nGesellschaft mit beschränkter Haftung\nNieder-Olm\n\nDem Registergericht ist eine neue Liste der Mitglieder des Aufsichtsrates eingereicht worden."
    },
    {
      "date": "2025-01-21",
      "id": "99149",
      "original_text": "Sonstige Registerbekanntmachung\nRheinland-Pfalz Amtsgericht Mainz HRB 7366\nHUBER+SUHNER Cube Optics AG – Mainz",
      "type": "Sonstige Registerbekanntmachung",
      "state": "Rheinland-Pfalz",
      "amtsgericht": "Amtsgericht Mainz",
      "registernummer": "HRB 7366",
      "registerart": "HRB",
      "company_name": "HUBER+SUHNER Cube Optics AG",
      "company_seat": "Mainz",
      "details": "21.01.2025 (Bekanntmachungsdatum)\n\nRheinland-Pfalz Amtsgericht Mainz HRB 7366\nSonstige Registerbekanntmachung\n\nHUBER+SUHNER Cube Optics AG\nAktiengesellschaft\nMainz\n\nDem Registergericht ist eine neue Liste der Mitglieder des Aufsichtsrates eingereicht worden."
    },
    {
      "date": "2025-01-21",
      "id": "99150",
      "original_text": "Löschungsankündigung\nBremen Amtsgericht Bremen HRB 32519\nSchlüterPartner Verwaltungs-GmbH – Bremen",
      "type": "Löschungsankündigung",
      "state": "Bremen",
      "amtsgericht": "Amtsgericht Bremen",
      "registernummer": "HRB 32519",
      "registerart": "HRB",
      "company_name": "SchlüterPartner Verwaltungs-GmbH",
      "company_seat": "Bremen",
      "details": "21.01.2025 (Bekanntmachungsdatum)\n\nBremen Amtsgericht Bremen HRB 32519\nLöschungsankündigung\n\nSchlüterPartner Verwaltungs-GmbH\nGesellschaft mit beschränkter Haftung\nBremen\n\nEs ist beabsichtigt die im Handelsregister eingetragene Gesellschaft von Amts wegen gemäß § 394 FamFG zu löschen. Gegen die Löschung kann beim AG Bremen schriftlich oder zu Protokoll der Geschäftsstelle Widerspruch eingelegt werden. Widerspruchsfrist 4 Wochen."
    },
    {
      "date": "2025-01-21",
      "id": "99151",
      "original_text": "Löschungsankündigung\nBremen Amtsgericht Bremen HRA 23027\nSun & Window Sonnenschutzanlagen GmbH & Co.KG – Bremen",
      "type": "Löschungsankündigung",
      "state": "Bremen",
      "amtsgericht": "Amtsgericht Bremen",
      "registernummer": "HRA 23027",
      "registerart": "HRA",
      "company_name": "Sun & Window Sonnenschutzanlagen GmbH & Co.KG",
      "company_seat": "Bremen",
      "details": "21.01.2025 (Bekanntmachungsdatum)\n\nBremen Amtsgericht Bremen HRA 23027\nLöschungsankündigung\n\nSun & Window Sonnenschutzanlagen GmbH & Co.KG\nKommanditgesellschaft\nBremen\n\nEs ist beabsichtigt die im Handelsregister eingetragene Firma von Amts wegen gemäß § 31 Abs.2 HGB zu löschen. Gegen die Löschung kann beim AG Bremen schriftlich oder zu Protokoll der Geschäftsstelle Widerspruch eingelegt werden. Widerspruchsfrist 4 Wochen."
    },
    {
      "date": "2025-01-21",
      "id": "99152",
      "original_text": "Löschungsankündigung\nNordrhein-Westfalen Amtsgericht Wuppertal HRB 19740\nTELE-SOREL GmbH – Wuppertal",
      "type": "Löschungsankündigung",
      "state": "Nordrhein-Westfalen",
      "amtsgericht": "Amtsgericht Wuppertal",
      "registernummer": "HRB 19740",
      "registerart": "HRB",
      "company_name": "TELE-SOREL GmbH",
      "company_seat": "Wuppertal",
      "details": "21.01.2025 (Bekanntmachungsdatum)\n\nNordrhein-Westfalen Amtsgericht Wuppertal HRB 19740\nLöschungsankündigung\n\nTELE-SOREL GmbH\nGesellschaft mit beschränkter Haftung\nWuppertal\n\nDas Registergericht beabsichtigt die Gesellschaft von Amts wegen nach § 394 FamFG zu löschen. Die Frist zur Erhebung eines Widerspruchs ist auf einen Monat festgesetzt."
    },
    {
      "date": "2025-01-21",
      "id": "99153",
      "original_text": "Löschungsankündigung\nNordrhein-Westfalen Amtsgericht Dortmund HRB 31934\nMSB Paletten GmbH – Dortmund",
      "type": "Löschungsankündigung",
      "state": "Nordrhein-Westfalen",
      "amtsgericht": "Amtsgericht Dortmund",
      "registernummer": "HRB 31934",
      "registerart": "HRB",
      "company_name": "MSB Paletten GmbH",
      "company_seat": "Dortmund",
      "details": "21.01.2025 (Bekanntmachungsdatum)\n\nNordrhein-Westfalen Amtsgericht Dortmund HRB 31934\nLöschungsankündigung\n\nMSB Paletten GmbH\nGesellschaft mit beschränkter Haftung\nDortmund\n\nDas Registergericht beabsichtigt die Gesellschaft von Amts wegen nach § 394 FamFG zu löschen. Die Frist zur Erhebung eines Widerspruchs ist auf zwei Monate festgesetzt."
    },
    {
      "date": "2025-01-21",
      "id": "99154",
      "original_text": "Einreichung neuer Dokumente\nNordrhein-Westfalen Amtsgericht Dortmund HRB 21273\nThyssengas GmbH – Dortmund",
      "type": "Einreichung neuer Dokumente",
      "state": "Nordrhein-Westfalen",
      "amtsgericht": "Amtsgericht Dortmund",
      "registernummer": "HRB 21273",
      "registerart": "HRB",
      "company_name": "Thyssengas GmbH",
      "company_seat": "Dortmund",
      "details": "21.01.2025 (Bekanntmachungsdatum)\n\nNordrhein-Westfalen Amtsgericht Dortmund HRB 21273\nEinreichung neuer Dokumente\n\nThyssengas GmbH\nGesellschaft mit beschränkter Haftung\nDortmund\n\nDem Registergericht ist eine neue Liste der Mitglieder des Aufsichtsrates eingereicht worden."
    },
    {
      "date": "2025-01-21",
      "id": "99155",
      "original_text": "Registerbekanntmachung nach dem Umwandlungsgesetz\nNordrhein-Westfalen Amtsgericht Wuppertal HRB 21303\nElektrotechnik Stefan Sill GmbH – Remscheid",
      "type": "Registerbekanntmachung nach dem Umwandlungsgesetz",
      "state": "Nordrhein-Westfalen",
      "amtsgericht": "Amtsgericht Wuppertal",
      "registernummer": "HRB 21303",
      "registerart": "HRB",
      "company_name": "Elektrotechnik Stefan Sill GmbH",
      "company_seat": "Remscheid",
      "details": "21.01.2025 (Bekanntmachungsdatum)\n\nNordrhein-Westfalen Amtsgericht Wuppertal HRB 21303\nRegisterbekanntmachung nach dem Umwandlungsgesetz 15.01.2025 (Eintragungsdatum)\n\nElektrotechnik Stefan Sill GmbH\nGesellschaft mit beschränkter Haftung\nRemscheid\n\nDen Gläubigern der an der Verschmelzung beteiligten Rechtsträger ist, wenn sie binnen sechs Monaten nach dem Tag, an dem die Eintragung der Verschmelzung in das Register des Sitzes desjenigen Rechtsträgers, dessen Gläubiger sie sind, nach § 19 Absatz 3 UmwG als bekanntgemacht gilt, ihren Anspruch nach Grund und Höhe schriftlich anmelden, Sicherheit zu leisten, soweit sie nicht Befriedigung verlangen können. Dieses Recht steht den Gläubigern jedoch nur zu, wenn sie glaubhaft machen, dass durch die Verschmelzung die Erfüllung ihrer Forderung gefährdet wird."
    },
    {
      "date": "2025-01-21",
      "id": "99156",
      "original_text": "Registerbekanntmachung nach dem Umwandlungsgesetz\nNordrhein-Westfalen Amtsgericht Bielefeld HRA 8217\nTextilkontor Walter Seidensticker GmbH & Co. KG – Bielefeld",
      "type": "Registerbekanntmachung nach dem Umwandlungsgesetz",
      "state": "Nordrhein-Westfalen",
      "amtsgericht": "Amtsgericht Bielefeld",
      "registernummer": "HRA 8217",
      "registerart": "HRA",
      "company_name": "Textilkontor Walter Seidensticker GmbH & Co. KG",
      "company_seat": "Bielefeld",
      "details": "21.01.2025 (Bekanntmachungsdatum)\n\nNordrhein-Westfalen Amtsgericht Bielefeld HRA 8217\nRegisterbekanntmachung nach dem Umwandlungsgesetz 09.01.2025 (Eintragungsdatum)\n\nTextilkontor Walter Seidensticker GmbH & Co. KG\nKommanditgesellschaft\nBielefeld\n\nDen Gläubigern der an der Verschmelzung beteiligten Rechtsträger ist, wenn sie binnen sechs Monaten nach dem Tag, an dem die Eintragung der Verschmelzung in das Register des Sitzes desjenigen Rechtsträgers, dessen Gläubiger sie sind, nach § 19 Absatz 3 UmwG als bekanntgemacht gilt, ihren Anspruch nach Grund und Höhe schriftlich anmelden, Sicherheit zu leisten, soweit sie nicht Befriedigung verlangen können. Dieses Recht steht den Gläubigern jedoch nur zu, wenn sie glaubhaft machen, dass durch die Verschmelzung die Erfüllung ihrer Forderung gefährdet wird."
    },
    {
      "date": "2025-01-21",
      "id": "99157",
      "original_text": "Einreichung neuer Dokumente\nNordrhein-Westfalen Amtsgericht Düsseldorf HRB 345\nDüsseldorfer Künstleratelier GmbH – Düsseldorf",
      "type": "Einreichung neuer Dokumente",
      "state": "Nordrhein-Westfalen",
      "amtsgericht": "Amtsgericht Düsseldorf",
      "registernummer": "HRB 345",
      "registerart": "HRB",
      "company_name": "Düsseldorfer Künstleratelier GmbH",
      "company_seat": "Düsseldorf",
      "details": "21.01.2025 (Bekanntmachungsdatum)\n\nNordrhein-Westfalen Amtsgericht Düsseldorf HRB 345\nEinreichung neuer Dokumente\n\nDüsseldorfer Künstleratelier GmbH\nGesellschaft mit beschränkter Haftung\nDüsseldorf\n\nDem Registergericht ist eine Liste der Mitglieder des Aufsichtsrates eingereicht worden."
    },
    {
      "date": "2025-01-21",
      "id": "99158",
      "original_text": "Einreichung neuer Dokumente\nNordrhein-Westfalen Amtsgericht Düsseldorf HRB 11971\nODDO BHF Asset Management GmbH – Düsseldorf",
      "type": "Einreichung neuer Dokumente",
      "state": "Nordrhein-Westfalen",
      "amtsgericht": "Amtsgericht Düsseldorf",
      "registernummer": "HRB 11971",
      "registerart": "HRB",
      "company_name": "ODDO BHF Asset Management GmbH",
      "company_seat": "Düsseldorf",
      "details": "21.01.2025 (Bekanntmachungsdatum)\n\nNordrhein-Westfalen Amtsgericht Düsseldorf HRB 11971\nEinreichung neuer Dokumente\n\nODDO BHF Asset Management GmbH\nGesellschaft mit beschränkter Haftung\nDüsseldorf\n\nDem Registergericht ist eine neue Liste der Mitglieder des Aufsichtsrates eingereicht worden."
    },
    {
      "date": "2025-01-21",
      "id": "99159",
      "original_text": "Löschungsankündigung\nNordrhein-Westfalen Amtsgericht Köln HRB 102227\nNB ELGRO UG (haftungsbeschränkt) – Köln",
      "type": "Löschungsankündigung",
      "state": "Nordrhein-Westfalen",
      "amtsgericht": "Amtsgericht Köln",
      "registernummer": "HRB 102227",
      "registerart": "HRB",
      "company_name": "NB ELGRO UG (haftungsbeschränkt)",
      "company_seat": "Köln",
      "details": "21.01.2025 (Bekanntmachungsdatum)\n\nNordrhein-Westfalen Amtsgericht Köln HRB 102227\nLöschungsankündigung\n\nNB ELGRO UG (haftungsbeschränkt)\nGesellschaft mit beschränkter Haftung\nKöln\n\nDas Registergericht beabsichtigt die Gesellschaft von Amts wegen nach § 394 FamFG zu löschen. Die Frist zur Erhebung eines Widerspruchs ist auf einen Monat festgesetzt."
    },
    {
      "date": "2025-01-21",
      "id": "99160",
      "original_text": "Sonstige Registerbekanntmachung\nNordrhein-Westfalen Amtsgericht Köln HRB 36935\nSMV Schätz mal Verlag GmbH – Köln",
      "type": "Sonstige Registerbekanntmachung",
      "state": "Nordrhein-Westfalen",
      "amtsgericht": "Amtsgericht Köln",
      "registernummer": "HRB 36935",
      "registerart": "HRB",
      "company_name": "SMV Schätz mal Verlag GmbH",
      "company_seat": "Köln",
      "details": "21.01.2025 (Bekanntmachungsdatum)\n\nNordrhein-Westfalen Amtsgericht Köln HRB 36935\nSonstige Registerbekanntmachung 13.05.2024 (Eintragungsdatum)\n\nSMV Schätz mal Verlag GmbH\nGesellschaft mit beschränkter Haftung\nKöln\n\nAls nicht eingetragen wird veröffentlicht: Den Gläubigern der Gesellschaft, deren Forderungen begründet worden sind bevor die Eintragung der Beendigung des Beherrschungs- und Gewinnabführungsvertrages  in das Handelsregister nach § 10 des Handelsgesetzbuches als bekanntgemacht gilt, hat der andere Vertragsteil Sicherheit zu leisten, wenn sie sich binnen sechs Monaten nach der Bekanntmachung der Eintragung zu diesem Zweck bei ihm melden."
    },
    {
      "date": "2025-01-21",
      "id": "99161",
      "original_text": "Löschungsankündigung\nNordrhein-Westfalen Amtsgericht Wuppertal HRB 8992\nProjektgesellschaft Planen + Bauen Verwaltungs GmbH – Wuppertal",
      "type": "Löschungsankündigung",
      "state": "Nordrhein-Westfalen",
      "amtsgericht": "Amtsgericht Wuppertal",
      "registernummer": "HRB 8992",
      "registerart": "HRB",
      "company_name": "Projektgesellschaft Planen + Bauen Verwaltungs GmbH",
      "company_seat": "Wuppertal",
      "details": "21.01.2025 (Bekanntmachungsdatum)\n\nNordrhein-Westfalen Amtsgericht Wuppertal HRB 8992\nLöschungsankündigung\n\nProjektgesellschaft Planen + Bauen Verwaltungs GmbH\nGesellschaft mit beschränkter Haftung\nWuppertal\n\nDas Registergericht beabsichtigt die Gesellschaft von Amts wegen nach § 394 FamFG zu löschen. Die Frist zur Erhebung eines Widerspruchs ist auf einen Monat festgesetzt."
    },
    {
      "date": "2025-01-21",
      "id": "99162",
      "original_text": "Sonstige Registerbekanntmachung\nNordrhein-Westfalen Amtsgericht Bad Oeynhausen HRB 8753\ngoneo Internet GmbH – Minden",
      "type": "Sonstige Registerbekanntmachung",
      "state": "Nordrhein-Westfalen",
      "amtsgericht": "Amtsgericht Bad Oeynhausen",
      "registernummer": "HRB 8753",
      "registerart": "HRB",
      "company_name": "goneo Internet GmbH",
      "company_seat": "Minden",
      "details": "21.01.2025 (Bekanntmachungsdatum)\n\nNordrhein-Westfalen Amtsgericht Bad Oeynhausen HRB 8753\nSonstige Registerbekanntmachung 21.01.2025 (Eintragungsdatum)\n\ngoneo Internet GmbH\nGesellschaft mit beschränkter Haftung\nMinden\n\nAls nicht eingetragen wird veröffentlicht: Den Gläubigern der Gesellschaft, deren Forderungen begründet worden sind bevor die Eintragung der Beendigung des Gewinnabführungsvertrages  in das Handelsregister nach § 10 des Handelsgesetzbuches als bekanntgemacht gilt, hat der andere Vertragsteil Sicherheit zu leisten, wenn sie sich binnen sechs Monaten nach der Bekanntmachung der Eintragung zu diesem Zweck bei ihm melden."
    },
    {
      "date": "2025-01-21",
      "id": "99163",
      "original_text": "Löschungsankündigung\nNordrhein-Westfalen Amtsgericht Siegburg HRB 12974\nToLo Ianua Nova Unternehmergesellschaft (haftungsbeschränkt) – Sankt Augustin",
      "type": "Löschungsankündigung",
      "state": "Nordrhein-Westfalen",
      "amtsgericht": "Amtsgericht Siegburg",
      "registernummer": "HRB 12974",
      "registerart": "HRB",
      "company_name": "ToLo Ianua Nova Unternehmergesellschaft (haftungsbeschränkt)",
      "company_seat": "Sankt Augustin",
      "details": "21.01.2025 (Bekanntmachungsdatum)\n\nNordrhein-Westfalen Amtsgericht Siegburg HRB 12974\nLöschungsankündigung\n\nToLo Ianua Nova Unternehmergesellschaft (haftungsbeschränkt)\nGesellschaft mit beschränkter Haftung\nSankt Augustin\n\nDas Registergericht hat glaubhafte Kenntnis erlangt, dass die Gesellschaft vermögenslos geworden ist, da Zwangsvollstreckungsmaßnahmen des Bundesamtes für Justiz erfolglos geblieben sind.\nEs ist daher beabsichtigt, die Gesellschaft nach § 394 FamFG im Handelsregister wegen Vermögenslosigkeit zu löschen.\nEinwände gegen die Löschung sind durch Widerspruch binnen einer Frist von 3 Monaten geltend zu machen, andernfalls die Löschung erfolgen wird.\nEinzulegen ist der Widerspruch bei dem Amtsgericht Siegburg, Neue Poststraße 16, 53721 Siegburg, und zwar entweder schriftlich in deutscher Sprache oder mündlich zur Niederschrift der Geschäftsstelle. Der Widerspruch kann auch zur Niederschrift der Geschäftsstelle eines jeden Amtsgerichts abgegeben werden. Der Widerspruch ist binnen der in der Verfügung bestimmten Frist einzulegen. Die Frist ist nur gewahrt, wenn der Widerspruch rechtzeitig bei dem Amtsgericht Siegburg eingeht, auch wenn der Widerspruch zur Niederschrift der Geschäftsstelle eines anderen Amtsgerichts abgegeben wurde. Die Frist beginnt jeweils mit der schriftlichen Bekanntgabe der Verfügung an die Beteiligten. Kann die schriftliche Bekanntgabe an einen Beteiligten nicht bewirkt werden, beginnt die Frist spätestens mit Ablauf von fünf Monaten nach Erlass der Verfügung. Die Bekanntgabe ist entweder durch Zustellung oder am dritten Tage nach Aufgabe zur Post bewirkt.\nSofern die Löschung noch nicht erfolgt ist, kann der Widerspruch auch noch nach Ablauf der Frist eingelegt werden. Fällt das Ende der Frist auf einen Sonnabend, einen Sonntag oder einen allgemeinen Feiertag, endet die Frist mit Ablauf des nächsten Werktages. Der Widerspruch ist zu unterzeichnen. Eine Begründung des Widerspruchs ist nicht vorgeschrieben."
    },
    {
      "date": "2025-01-21",
      "id": "99164",
      "original_text": "Löschungsankündigung\nNordrhein-Westfalen Amtsgericht Siegburg HRA 6452\nH&S Wirtschaftsberatungs- und Beteiligungsges. mbH & Co. KG – Bad Honnef",
      "type": "Löschungsankündigung",
      "state": "Nordrhein-Westfalen",
      "amtsgericht": "Amtsgericht Siegburg",
      "registernummer": "HRA 6452",
      "registerart": "HRA",
      "company_name": "H&S Wirtschaftsberatungs- und Beteiligungsges. mbH & Co. KG",
      "company_seat": "Bad Honnef",
      "details": "21.01.2025 (Bekanntmachungsdatum)\n\nNordrhein-Westfalen Amtsgericht Siegburg HRA 6452\nLöschungsankündigung\n\nH&S Wirtschaftsberatungs- und Beteiligungsges. mbH & Co. KG\nKommanditgesellschaft\nBad Honnef\n\nDie im hiesigen Handelsregister eingetragene Firma H & S Wirtschaftsberatungs- und Beteiligungsges. mbH & Co.KG soll gemäß § 31 Absatz 2 HGB i.V.m. § 393 FamFG von Amts wegen gelöscht werden.\nEin etwaiger Widerspruch gegen die beabsichtigte Löschung ist binnen einer Frist von drei Monaten bei dem Registergericht geltend zu machen, andernfalls wird die Löschung der Firma erfolgen."
    },
    {
      "date": "2025-01-21",
      "id": "99165",
      "original_text": "Registerbekanntmachung nach dem Umwandlungsgesetz\nNordrhein-Westfalen Amtsgericht Köln HRB 94802\nTRILUX Lighting Solutions GmbH – Köln",
      "type": "Registerbekanntmachung nach dem Umwandlungsgesetz",
      "state": "Nordrhein-Westfalen",
      "amtsgericht": "Amtsgericht Köln",
      "registernummer": "HRB 94802",
      "registerart": "HRB",
      "company_name": "TRILUX Lighting Solutions GmbH",
      "company_seat": "Köln",
      "details": "21.01.2025 (Bekanntmachungsdatum)\n\nNordrhein-Westfalen Amtsgericht Köln HRB 94802\nRegisterbekanntmachung nach dem Umwandlungsgesetz 21.01.2025 (Eintragungsdatum)\n\nTRILUX Lighting Solutions GmbH\nGesellschaft mit beschränkter Haftung\nKöln\n\nDen Gläubigern der an der Verschmelzung beteiligten Rechtsträger ist, wenn sie binnen sechs Monaten nach dem Tag, an dem die Eintragung der Verschmelzung in das Register des Sitzes derjenigen Rechtsträger deren Gläubiger sie sind, nach § 19 Absatz 3 UmwG als bekanntgemacht gilt, ihren Anspruch nach Grund und Höhe schriftlich anmelden, Sicherheit zu leisten, soweit sie nicht Befriedigung verlangen können. Dieses Recht steht den Gläubigern jedoch nur zu, wenn sie glaubhaft machen, dass durch die Verschmelzung die Erfüllung ihrer Forderung gefährdet wird."
    },
    {
      "date": "2025-01-21",
      "id": "99166",
      "original_text": "Löschungsankündigung\nNordrhein-Westfalen Amtsgericht Köln HRA 28073\nPURE e. Kffr. – Frechen",
      "type": "Löschungsankündigung",
      "state": "Nordrhein-Westfalen",
      "amtsgericht": "Amtsgericht Köln",
      "registernummer": "HRA 28073",
      "registerart": "HRA",
      "company_name": "PURE e. Kffr.",
      "company_seat": "Frechen",
      "details": "21.01.2025 (Bekanntmachungsdatum)\n\nNordrhein-Westfalen Amtsgericht Köln HRA 28073\nLöschungsankündigung\n\nPURE e. Kffr.\nEinzelkaufmann / Einzelkauffrau\nFrechen\n\nDas Registergericht beabsichtigt die Firma von Amts wegen nach § 31 Abs. 2 HGB, § 393 FamFG zu löschen. Die Frist zur Erhebung eines Widerspruchs ist auf einen Monat festgesetzt."
    },
    {
      "date": "2025-01-21",
      "id": "99167",
      "original_text": "Löschungsankündigung\nNordrhein-Westfalen Amtsgericht Dortmund HRB 34595\nFlix Sanierung GmbH – Castrop-Rauxel",
      "type": "Löschungsankündigung",
      "state": "Nordrhein-Westfalen",
      "amtsgericht": "Amtsgericht Dortmund",
      "registernummer": "HRB 34595",
      "registerart": "HRB",
      "company_name": "Flix Sanierung GmbH",
      "company_seat": "Castrop-Rauxel",
      "details": "21.01.2025 (Bekanntmachungsdatum)\n\nNordrhein-Westfalen Amtsgericht Dortmund HRB 34595\nLöschungsankündigung\n\nFlix Sanierung GmbH\nGesellschaft mit beschränkter Haftung\nCastrop-Rauxel\n\nDas Registergericht beabsichtigt die Gesellschaft von Amts wegen nach § 394 FamFG zu löschen. Die Frist zur Erhebung eines Widerspruchs ist auf zwei Monate festgesetzt."
    },
    {
      "date": "2025-01-21",
      "id": "99168",
      "original_text": "Löschungsankündigung\nNordrhein-Westfalen Amtsgericht Bonn GnR 406\nMADIBA ACADEMY eG – Bonn",
      "type": "Löschungsankündigung",
      "state": "Nordrhein-Westfalen",
      "amtsgericht": "Amtsgericht Bonn",
      "registernummer": "GnR 406",
      "registerart": "GnR",
      "company_name": "MADIBA ACADEMY eG",
      "company_seat": "Bonn",
      "details": "21.01.2025 (Bekanntmachungsdatum)\n\nNordrhein-Westfalen Amtsgericht Bonn GnR 406\nLöschungsankündigung 03.01.2025 (Eintragungsdatum)\n\nMADIBA ACADEMY eG\neingetragene Genossenschaft\nBonn\n\nDas Registergericht beabsichtigt die Genossenschaft von Amts wegen nach § 394 FamFG zu löschen. Die Frist zur Erhebung eines Widerspruchs ist auf einen Monat festgesetzt."
    },
    {
      "date": "2025-01-21",
      "id": "99169",
      "original_text": "Löschungsankündigung\nNordrhein-Westfalen Amtsgericht Kleve HRB 16130\nThomas Eislöffel Reinigungsmaschinen UG (haftungsbeschränkt) – Kevelaer",
      "type": "Löschungsankündigung",
      "state": "Nordrhein-Westfalen",
      "amtsgericht": "Amtsgericht Kleve",
      "registernummer": "HRB 16130",
      "registerart": "HRB",
      "company_name": "Thomas Eislöffel Reinigungsmaschinen UG (haftungsbeschränkt)",
      "company_seat": "Kevelaer",
      "details": "21.01.2025 (Bekanntmachungsdatum)\n\nNordrhein-Westfalen Amtsgericht Kleve HRB 16130\nLöschungsankündigung\n\nThomas Eislöffel Reinigungsmaschinen UG (haftungsbeschränkt)\nGesellschaft mit beschränkter Haftung\nKevelaer\n\nDas Registergericht beabsichtigt die Gesellschaft von Amts wegen nach § 394 FamFG zu löschen. Die Frist zur Erhebung eines Widerspruchs ist auf einen Monat festgesetzt."
    },
    {
      "date": "2025-01-21",
      "id": "99170",
      "original_text": "Löschungsankündigung\nNordrhein-Westfalen Amtsgericht Dortmund HRB 32413\nDienstleistungen Türk GmbH – Castrop-Rauxel",
      "type": "Löschungsankündigung",
      "state": "Nordrhein-Westfalen",
      "amtsgericht": "Amtsgericht Dortmund",
      "registernummer": "HRB 32413",
      "registerart": "HRB",
      "company_name": "Dienstleistungen Türk GmbH",
      "company_seat": "Castrop-Rauxel",
      "details": "21.01.2025 (Bekanntmachungsdatum)\n\nNordrhein-Westfalen Amtsgericht Dortmund HRB 32413\nLöschungsankündigung\n\nDienstleistungen Türk GmbH\nGesellschaft mit beschränkter Haftung\nCastrop-Rauxel\n\nDas Registergericht beabsichtigt die Gesellschaft von Amts wegen nach § 394 FamFG zu löschen. Die Frist zur Erhebung eines Widerspruchs ist auf zwei Monate festgesetzt."
    },
    {
      "date": "2025-01-21",
      "id": "99171",
      "original_text": "Löschungsankündigung\nThüringen Amtsgericht Jena HRB 511323\nHALWE Service-, Planungs- und Beteiligungsgesellschaft mbH – Bad Frankenhausen",
      "type": "Löschungsankündigung",
      "state": "Thüringen",
      "amtsgericht": "Amtsgericht Jena",
      "registernummer": "HRB 511323",
      "registerart": "HRB",
      "company_name": "HALWE Service-, Planungs- und Beteiligungsgesellschaft mbH",
      "company_seat": "Bad Frankenhausen",
      "details": "21.01.2025 (Bekanntmachungsdatum)\n\nThüringen Amtsgericht Jena HRB 511323\nLöschungsankündigung\n\nHALWE Service-, Planungs- und Beteiligungsgesellschaft mbH\nGesellschaft mit beschränkter Haftung\nBad Frankenhausen\n\nDas Registergericht beabsichtigt, die im Handelsregister eingetragene Gesellschaft wegen Vermögenslosigkeit nach § 394 FamFG von Amts wegen zu löschen. Die Frist zur Erhebung eines Widerspruchs gegen die beabsichtigte Löschung wird auf 6 Wochen festgesetzt."
    },
    {
      "date": "2025-01-21",
      "id": "99172",
      "original_text": "Löschungsankündigung\nHessen Amtsgericht Wiesbaden HRB 33225\nGSA UG (haftungsbeschränkt) – Flörsheim am Main",
      "type": "Löschungsankündigung",
      "state": "Hessen",
      "amtsgericht": "Amtsgericht Wiesbaden",
      "registernummer": "HRB 33225",
      "registerart": "HRB",
      "company_name": "GSA UG (haftungsbeschränkt)",
      "company_seat": "Flörsheim am Main",
      "details": "21.01.2025 (Bekanntmachungsdatum)\n\nHessen Amtsgericht Wiesbaden HRB 33225\nLöschungsankündigung\n\nGSA UG (haftungsbeschränkt)\nGesellschaft mit beschränkter Haftung\nFlörsheim am Main\n\nDas Registergericht beabsichtigt die im Handelsregister eingetragene Gesellschaft von Amts wegen nach § 394 FamFG zu löschen. Die Frist zur Erhebung eines Widerspruchs gegen die beabsichtigte Löschung wird auf 3 Monate festgesetzt."
    },
    {
      "date": "2025-01-21",
      "id": "99173",
      "original_text": "Löschungsankündigung\nHessen Amtsgericht Friedberg HRB 8510\nSec Sicherheits-Management GmbH – Bad Nauheim",
      "type": "Löschungsankündigung",
      "state": "Hessen",
      "amtsgericht": "Amtsgericht Friedberg",
      "registernummer": "HRB 8510",
      "registerart": "HRB",
      "company_name": "Sec Sicherheits-Management GmbH",
      "company_seat": "Bad Nauheim",
      "details": "21.01.2025 (Bekanntmachungsdatum)\n\nHessen Amtsgericht Friedberg HRB 8510\nLöschungsankündigung\n\nSec Sicherheits-Management GmbH\nGesellschaft mit beschränkter Haftung\nBad Nauheim\n\nDas Registergericht beabsichtigt die im Handelsregister eingetragene Gesellschaft von Amts wegen nach § 394 FamFG zu löschen. Die Frist zur Erhebung eines Widerspruchs gegen die beabsichtigte Löschung wird auf 3 Monate festgesetzt."
    },
    {
      "date": "2025-01-21",
      "id": "99174",
      "original_text": "Löschungsankündigung\nHessen Amtsgericht Frankfurt am Main HRB 129279\nFermo Marketing GmbH – Frankfurt am Main",
      "type": "Löschungsankündigung",
      "state": "Hessen",
      "amtsgericht": "Amtsgericht Frankfurt am Main",
      "registernummer": "HRB 129279",
      "registerart": "HRB",
      "company_name": "Fermo Marketing GmbH",
      "company_seat": "Frankfurt am Main",
      "details": "21.01.2025 (Bekanntmachungsdatum)\n\nHessen Amtsgericht Frankfurt am Main HRB 129279\nLöschungsankündigung\n\nFermo Marketing GmbH\nGesellschaft mit beschränkter Haftung\nFrankfurt am Main\n\nEs ist beabsichtigt, die Gesellschaft wegen Vermögenslosigkeit gemäß § 394 FamFG von Amts wegen im Handelsregister zu löschen. Hiergegen kann innerhalb eines Monats nach dieser Veröffentlichung Widerspruch bei dem Amtsgericht Frankfurt am Main eingelegt werden."
    },
    {
      "date": "2025-01-21",
      "id": "99175",
      "original_text": "Einreichung neuer Dokumente\nHessen Amtsgericht Wiesbaden HRB 30486\ncomforte AG – Wiesbaden",
      "type": "Einreichung neuer Dokumente",
      "state": "Hessen",
      "amtsgericht": "Amtsgericht Wiesbaden",
      "registernummer": "HRB 30486",
      "registerart": "HRB",
      "company_name": "comforte AG",
      "company_seat": "Wiesbaden",
      "details": "21.01.2025 (Bekanntmachungsdatum)\n\nHessen Amtsgericht Wiesbaden HRB 30486\nEinreichung neuer Dokumente 21.01.2025 (Eintragungsdatum)\n\ncomforte AG\nAktiengesellschaft\nWiesbaden\n\nDurch eine Änderung in den Personen der Aufsichtsratsmitglieder ist eine Liste der Mitglieder des Aufsichtsrates zum Handelsregister eingereicht worden."
    },
    {
      "date": "2025-01-21",
      "id": "99176",
      "original_text": "Einreichung neuer Dokumente\nHessen Amtsgericht Marburg HRB 2110\nDeutsches Rotes Kreuz Rettungsdienst Mittelhessen - gemeinnützige Gesellschaft mit beschränkter Haftung – Marburg",
      "type": "Einreichung neuer Dokumente",
      "state": "Hessen",
      "amtsgericht": "Amtsgericht Marburg",
      "registernummer": "HRB 2110",
      "registerart": "HRB",
      "company_name": "Deutsches Rotes Kreuz Rettungsdienst Mittelhessen - gemeinnützige Gesellschaft mit beschränkter Haftung",
      "company_seat": "Marburg",
      "details": "21.01.2025 (Bekanntmachungsdatum)\n\nHessen Amtsgericht Marburg HRB 2110\nEinreichung neuer Dokumente\n\nDeutsches Rotes Kreuz Rettungsdienst Mittelhessen - gemeinnützige Gesellschaft mit beschränkter Haftung\nGesellschaft mit beschränkter Haftung\nMarburg\n\nDurch eine Änderung in den Personen der Aufsichtsratsmitglieder ist eine Liste der Mitglieder des Aufsichtsrates zum Handelsregister eingereicht worden."
    },
    {
      "date": "2025-01-21",
      "id": "99177",
      "original_text": "Einreichung neuer Dokumente\nHessen Amtsgericht Wiesbaden HRB 33491\nMEWA Textil-Service SE – Wiesbaden",
      "type": "Einreichung neuer Dokumente",
      "state": "Hessen",
      "amtsgericht": "Amtsgericht Wiesbaden",
      "registernummer": "HRB 33491",
      "registerart": "HRB",
      "company_name": "MEWA Textil-Service SE",
      "company_seat": "Wiesbaden",
      "details": "21.01.2025 (Bekanntmachungsdatum)\n\nHessen Amtsgericht Wiesbaden HRB 33491\nEinreichung neuer Dokumente\n\nMEWA Textil-Service SE\nEuropäische Aktiengesellschaft (SE)\nWiesbaden\n\nDurch eine Änderung in den Personen der Aufsichtsratsmitglieder ist eine Liste der Mitglieder des Aufsichtsrates zum Handelsregister eingereicht worden."
    },
    {
      "date": "2025-01-21",
      "id": "99178",
      "original_text": "Löschungsankündigung\nHessen Amtsgericht Frankfurt am Main HRB 129974\nCLEANTERRA UG (haftungsbeschränkt) – Frankfurt am Main",
      "type": "Löschungsankündigung",
      "state": "Hessen",
      "amtsgericht": "Amtsgericht Frankfurt am Main",
      "registernummer": "HRB 129974",
      "registerart": "HRB",
      "company_name": "CLEANTERRA UG (haftungsbeschränkt)",
      "company_seat": "Frankfurt am Main",
      "details": "21.01.2025 (Bekanntmachungsdatum)\n\nHessen Amtsgericht Frankfurt am Main HRB 129974\nLöschungsankündigung\n\nCLEANTERRA UG (haftungsbeschränkt)\nGesellschaft mit beschränkter Haftung\nFrankfurt am Main\n\nDas Registergericht beabsichtigt die im Handelsregister eingetragene Gesellschaft von Amts wegen nach § 394 FamFG zu löschen. Die Frist zur Erhebung eines Widerspruchs gegen die beabsichtigte Löschung wird auf 1 Monat festgesetzt."
    },
    {
      "date": "2025-01-21",
      "id": "99179",
      "original_text": "Löschungsankündigung\nHessen Amtsgericht Wiesbaden HRB 31146\nLIVE BAUSERVICE GmbH – Wiesbaden",
      "type": "Löschungsankündigung",
      "state": "Hessen",
      "amtsgericht": "Amtsgericht Wiesbaden",
      "registernummer": "HRB 31146",
      "registerart": "HRB",
      "company_name": "LIVE BAUSERVICE GmbH",
      "company_seat": "Wiesbaden",
      "details": "21.01.2025 (Bekanntmachungsdatum)\n\nHessen Amtsgericht Wiesbaden HRB 31146\nLöschungsankündigung\n\nLIVE BAUSERVICE GmbH\nGesellschaft mit beschränkter Haftung\nWiesbaden\n\nDas Registergericht beabsichtigt die im Handelsregister eingetragene Gesellschaft von Amts wegen nach § 394 FamFG zu löschen. Die Frist zur Erhebung eines Widerspruchs gegen die beabsichtigte Löschung wird auf 3 Monate festgesetzt."
    },
    {
      "date": "2025-01-21",
      "id": "99180",
      "original_text": "Löschungsankündigung\nHessen Amtsgericht Frankfurt am Main HRB 97795\nEUN GmbH – Frankfurt am Main",
      "type": "Löschungsankündigung",
      "state": "Hessen",
      "amtsgericht": "Amtsgericht Frankfurt am Main",
      "registernummer": "HRB 97795",
      "registerart": "HRB",
      "company_name": "EUN GmbH",
      "company_seat": "Frankfurt am Main",
      "details": "21.01.2025 (Bekanntmachungsdatum)\n\nHessen Amtsgericht Frankfurt am Main HRB 97795\nLöschungsankündigung\n\nEUN GmbH\nGesellschaft mit beschränkter Haftung\nFrankfurt am Main\n\nDas Registergericht beabsichtigt die im Handelsregister eingetragene Gesellschaft von Amts wegen nach § 394 FamFG zu löschen. Die Frist zur Erhebung eines Widerspruchs gegen die beabsichtigte Löschung wird auf 1 Monate festgesetzt."
    },
    {
      "date": "2025-01-21",
      "id": "99181",
      "original_text": "Löschungsankündigung\nHessen Amtsgericht Hanau HRB 99619\nIMEX INTERNATIONAL GROUP GmbH – Bad Soden-Salmünster",
      "type": "Löschungsankündigung",
      "state": "Hessen",
      "amtsgericht": "Amtsgericht Hanau",
      "registernummer": "HRB 99619",
      "registerart": "HRB",
      "company_name": "IMEX INTERNATIONAL GROUP GmbH",
      "company_seat": "Bad Soden-Salmünster",
      "details": "21.01.2025 (Bekanntmachungsdatum)\n\nHessen Amtsgericht Hanau HRB 99619\nLöschungsankündigung\n\nIMEX INTERNATIONAL GROUP GmbH\nGesellschaft mit beschränkter Haftung\nBad Soden-Salmünster\n\nDas Registergericht beabsichtigt die im Handelsregister eingetragene Gesellschaft von Amts wegen nach § 394 FamFG zu löschen. Die Frist zur Erhebung eines Widerspruchs gegen die beabsichtigte Löschung wird auf 3 Monate festgesetzt."
    }
  ]
}