{
  "date": "2025-09-06",
  "date_of_scrape": "2025-10-26T14:14:10.077Z",
  "tool_version": "0.2.0",
  "number_of_announcements": 60,
  "announcements": [
    {
      "date": "2025-09-06",
      "id": "127429",
      "original_text": "Registerbekanntmachung nach dem Umwandlungsgesetz\nBayern Amtsgericht Kempten (Allgäu) HRB 10168\nTT RETAIL GmbH – Lindau (Bodensee)",
      "type": "Registerbekanntmachung nach dem Umwandlungsgesetz",
      "state": "Bayern",
      "amtsgericht": "Amtsgericht Kempten (Allgäu)",
      "registernummer": "HRB 10168",
      "registerart": "HRB",
      "company_name": "TT RETAIL GmbH",
      "company_seat": "Lindau (Bodensee)",
      "details": "06.09.2025 (Bekanntmachungsdatum)\n\nBayern Amtsgericht Kempten (Allgäu) HRB 10168\nRegisterbekanntmachung nach dem Umwandlungsgesetz 05.09.2025 (Eintragungsdatum)\n\nTT RETAIL GmbH\nGesellschaft mit beschränkter Haftung\nLindau (Bodensee)\n\nDen Gläubigern der an der Verschmelzung beteiligten Rechtsträger ist, wenn sie binnen sechs Monaten nach dem Tag, an dem die Eintragung der Verschmelzung in das Register des Sitzes desjenigen Rechtsträgers, dessen Gläubiger sie sind, nach § 19 Abs. 3 UmwG als bekannt gemacht gilt, ihren Anspruch nach Grund und Höhe in Textform anmelden, Sicherheit zu leisten, soweit sie nicht Befriedigung verlangen können. Dieses Recht steht den Gläubigern jedoch nur zu, wenn sie glaubhaft machen, dass durch die Verschmelzung die Erfüllung ihrer Forderung gefährdet wird."
    },
    {
      "date": "2025-09-06",
      "id": "127430",
      "original_text": "Registerbekanntmachung nach dem Umwandlungsgesetz\nBayern Amtsgericht München HRB 303773\nAuto Heiß & Sohn GmbH – Jesenwang",
      "type": "Registerbekanntmachung nach dem Umwandlungsgesetz",
      "state": "Bayern",
      "amtsgericht": "Amtsgericht München",
      "registernummer": "HRB 303773",
      "registerart": "HRB",
      "company_name": "Auto Heiß & Sohn GmbH",
      "company_seat": "Jesenwang",
      "details": "06.09.2025 (Bekanntmachungsdatum)\n\nBayern Amtsgericht München HRB 303773\nRegisterbekanntmachung nach dem Umwandlungsgesetz 05.09.2025 (Eintragungsdatum)\n\nAuto Heiß & Sohn GmbH\nGesellschaft mit beschränkter Haftung\nJesenwang\n\nDen Gläubigern der an der Ausgliederung beteiligten Rechtsträger ist, wenn sie binnen sechs Monaten nach dem Tag, an dem die Eintragung der Ausgliederung in das Register des Sitzes desjenigen Rechtsträgers, dessen Gläubiger sie sind, nach §§ 125, 19 Abs. 3 UmwG als bekannt gemacht gilt, ihren Anspruch nach Grund und Höhe in Textform anmelden, Sicherheit zu leisten, soweit sie nicht Befriedigung verlangen können. Dieses Recht steht den Gläubigern jedoch nur zu, wenn sie glaubhaft machen, dass durch die Ausgliederung die Erfüllung ihrer Forderung gefährdet wird."
    },
    {
      "date": "2025-09-06",
      "id": "127431",
      "original_text": "Registerbekanntmachung nach dem Umwandlungsgesetz\nBayern Amtsgericht München HRB 172957\nM-Autowaschanlagen GmbH – Aßling",
      "type": "Registerbekanntmachung nach dem Umwandlungsgesetz",
      "state": "Bayern",
      "amtsgericht": "Amtsgericht München",
      "registernummer": "HRB 172957",
      "registerart": "HRB",
      "company_name": "M-Autowaschanlagen GmbH",
      "company_seat": "Aßling",
      "details": "06.09.2025 (Bekanntmachungsdatum)\n\nBayern Amtsgericht München HRB 172957\nRegisterbekanntmachung nach dem Umwandlungsgesetz 05.09.2025 (Eintragungsdatum)\n\nM-Autowaschanlagen GmbH\nGesellschaft mit beschränkter Haftung\nAßling\n\nDen Gläubigern der an der Spaltung beteiligten Rechtsträger ist, wenn sie binnen sechs Monaten nach dem Tag, an dem die Eintragung der Spaltung in das Register des Sitzes desjenigen Rechtsträgers, dessen Gläubiger sie sind, nach §§ 125, 19 Abs. 3 UmwG als bekannt gemacht gilt, ihren Anspruch nach Grund und Höhe in Textform anmelden, Sicherheit zu leisten, soweit sie nicht Befriedigung verlangen können. Dieses Recht steht den Gläubigern jedoch nur zu, wenn sie glaubhaft machen, dass durch die Spaltung die Erfüllung ihrer Forderung gefährdet wird."
    },
    {
      "date": "2025-09-06",
      "id": "127432",
      "original_text": "Registerbekanntmachung nach dem Umwandlungsgesetz\nBayern Amtsgericht Aschaffenburg HRA 6141\nTerraTess-Event Service e.K. – Kleinostheim",
      "type": "Registerbekanntmachung nach dem Umwandlungsgesetz",
      "state": "Bayern",
      "amtsgericht": "Amtsgericht Aschaffenburg",
      "registernummer": "HRA 6141",
      "registerart": "HRA",
      "company_name": "TerraTess-Event Service e.K.",
      "company_seat": "Kleinostheim",
      "details": "06.09.2025 (Bekanntmachungsdatum)\n\nBayern Amtsgericht Aschaffenburg HRA 6141\nRegisterbekanntmachung nach dem Umwandlungsgesetz 05.09.2025 (Eintragungsdatum)\n\nTerraTess-Event Service e.K.\nEinzelkaufmann / Einzelkauffrau\nKleinostheim\n\nDen Gläubigern der an der Ausgliederung beteiligten Rechtsträger ist, wenn sie binnen sechs Monaten nach dem Tag, an dem die Eintragung der Ausgliederung in das Register des Sitzes desjenigen Rechtsträgers, dessen Gläubiger sie sind, nach §§ 125, 19 Abs. 3 UmwG als bekannt gemacht gilt, ihren Anspruch nach Grund und Höhe in Textform anmelden, Sicherheit zu leisten, soweit sie nicht Befriedigung verlangen können. Dieses Recht steht den Gläubigern jedoch nur zu, wenn sie glaubhaft machen, dass durch die Ausgliederung die Erfüllung ihrer Forderung gefährdet wird."
    },
    {
      "date": "2025-09-06",
      "id": "127433",
      "original_text": "Registerbekanntmachung nach dem Umwandlungsgesetz\nBayern Amtsgericht München HRB 172957\nM-Autowaschanlagen GmbH – Aßling",
      "type": "Registerbekanntmachung nach dem Umwandlungsgesetz",
      "state": "Bayern",
      "amtsgericht": "Amtsgericht München",
      "registernummer": "HRB 172957",
      "registerart": "HRB",
      "company_name": "M-Autowaschanlagen GmbH",
      "company_seat": "Aßling",
      "details": "06.09.2025 (Bekanntmachungsdatum)\n\nBayern Amtsgericht München HRB 172957\nRegisterbekanntmachung nach dem Umwandlungsgesetz 05.09.2025 (Eintragungsdatum)\n\nM-Autowaschanlagen GmbH\nGesellschaft mit beschränkter Haftung\nAßling\n\nDen Gläubigern der an der Spaltung beteiligten Rechtsträger ist, wenn sie binnen sechs Monaten nach dem Tag, an dem die Eintragung der Spaltung in das Register des Sitzes desjenigen Rechtsträgers, dessen Gläubiger sie sind, nach §§ 125, 19 Abs. 3 UmwG als bekannt gemacht gilt, ihren Anspruch nach Grund und Höhe in Textform anmelden, Sicherheit zu leisten, soweit sie nicht Befriedigung verlangen können. Dieses Recht steht den Gläubigern jedoch nur zu, wenn sie glaubhaft machen, dass durch die Spaltung die Erfüllung ihrer Forderung gefährdet wird."
    },
    {
      "date": "2025-09-06",
      "id": "127434",
      "original_text": "Löschungsankündigung\nBayern Amtsgericht München HRB 246210\nMavic Germany GmbH – Garching b.München",
      "type": "Löschungsankündigung",
      "state": "Bayern",
      "amtsgericht": "Amtsgericht München",
      "registernummer": "HRB 246210",
      "registerart": "HRB",
      "company_name": "Mavic Germany GmbH",
      "company_seat": "Garching b.München",
      "details": "06.09.2025 (Bekanntmachungsdatum)\n\nBayern Amtsgericht München HRB 246210\nLöschungsankündigung 05.09.2025 (Eintragungsdatum)\n\nMavic Germany GmbH\nGesellschaft mit beschränkter Haftung\nGarching b.München\n\nDas Registergericht beabsichtigt, die im Handelsregister eingetragene Gesellschaft wegen Vermögenslosigkeit von Amts wegen nach § 394 FamFG zu löschen. Die Frist zur Erhebung eines Widerspruchs ist auf drei Monate festgesetzt."
    },
    {
      "date": "2025-09-06",
      "id": "127435",
      "original_text": "Löschungsankündigung\nBayern Amtsgericht München HRB 250024\nIvortec GmbH – München",
      "type": "Löschungsankündigung",
      "state": "Bayern",
      "amtsgericht": "Amtsgericht München",
      "registernummer": "HRB 250024",
      "registerart": "HRB",
      "company_name": "Ivortec GmbH",
      "company_seat": "München",
      "details": "06.09.2025 (Bekanntmachungsdatum)\n\nBayern Amtsgericht München HRB 250024\nLöschungsankündigung 05.09.2025 (Eintragungsdatum)\n\nIvortec GmbH\nGesellschaft mit beschränkter Haftung\nMünchen\n\nDas Registergericht beabsichtigt, die im Handelsregister eingetragene Gesellschaft wegen Vermögenslosigkeit von Amts wegen nach § 394 FamFG zu löschen. Die Frist zur Erhebung eines Widerspruchs ist auf drei Monate festgesetzt."
    },
    {
      "date": "2025-09-06",
      "id": "127436",
      "original_text": "Registerbekanntmachung nach dem Umwandlungsgesetz\nBayern Amtsgericht Augsburg HRB 35269\nMWW Holding GmbH – Kaufering",
      "type": "Registerbekanntmachung nach dem Umwandlungsgesetz",
      "state": "Bayern",
      "amtsgericht": "Amtsgericht Augsburg",
      "registernummer": "HRB 35269",
      "registerart": "HRB",
      "company_name": "MWW Holding GmbH",
      "company_seat": "Kaufering",
      "details": "06.09.2025 (Bekanntmachungsdatum)\n\nBayern Amtsgericht Augsburg HRB 35269\nRegisterbekanntmachung nach dem Umwandlungsgesetz 05.09.2025 (Eintragungsdatum)\n\nMWW Holding GmbH\nGesellschaft mit beschränkter Haftung\nKaufering\n\nDen Gläubigern der an der Verschmelzung beteiligten Rechtsträger ist, wenn sie binnen sechs Monaten nach dem Tag, an dem die Eintragung der Verschmelzung in das Register des Sitzes desjenigen Rechtsträgers, dessen Gläubiger sie sind, nach § 19 Abs. 3 UmwG als bekannt gemacht gilt, ihren Anspruch nach Grund und Höhe in Textform anmelden, Sicherheit zu leisten, soweit sie nicht Befriedigung verlangen können. Dieses Recht steht den Gläubigern jedoch nur zu, wenn sie glaubhaft machen, dass durch die Verschmelzung die Erfüllung ihrer Forderung gefährdet wird."
    },
    {
      "date": "2025-09-06",
      "id": "127437",
      "original_text": "Registerbekanntmachung nach dem Umwandlungsgesetz\nBayern Amtsgericht Hof HRB 2512\nBrendel GmbH – Helmbrechts",
      "type": "Registerbekanntmachung nach dem Umwandlungsgesetz",
      "state": "Bayern",
      "amtsgericht": "Amtsgericht Hof",
      "registernummer": "HRB 2512",
      "registerart": "HRB",
      "company_name": "Brendel GmbH",
      "company_seat": "Helmbrechts",
      "details": "06.09.2025 (Bekanntmachungsdatum)\n\nBayern Amtsgericht Hof HRB 2512\nRegisterbekanntmachung nach dem Umwandlungsgesetz 05.09.2025 (Eintragungsdatum)\n\nBrendel GmbH\nGesellschaft mit beschränkter Haftung\nHelmbrechts\n\nDen Gläubigern der an der Verschmelzung beteiligten Rechtsträger ist, wenn sie binnen sechs Monaten nach dem Tag, an dem die Eintragung der Verschmelzung in das Register des Sitzes desjenigen Rechtsträgers, dessen Gläubiger sie sind, nach § 19 Abs. 3 UmwG als bekannt gemacht gilt, ihren Anspruch nach Grund und Höhe in Textform anmelden, Sicherheit zu leisten, soweit sie nicht Befriedigung verlangen können. Dieses Recht steht den Gläubigern jedoch nur zu, wenn sie glaubhaft machen, dass durch die Verschmelzung die Erfüllung ihrer Forderung gefährdet wird."
    },
    {
      "date": "2025-09-06",
      "id": "127438",
      "original_text": "Registerbekanntmachung nach dem Umwandlungsgesetz\nBayern Amtsgericht Bamberg HRB 11953\nBarbossa AcquiCo GmbH – Bamberg",
      "type": "Registerbekanntmachung nach dem Umwandlungsgesetz",
      "state": "Bayern",
      "amtsgericht": "Amtsgericht Bamberg",
      "registernummer": "HRB 11953",
      "registerart": "HRB",
      "company_name": "Barbossa AcquiCo GmbH",
      "company_seat": "Bamberg",
      "details": "06.09.2025 (Bekanntmachungsdatum)\n\nBayern Amtsgericht Bamberg HRB 11953\nRegisterbekanntmachung nach dem Umwandlungsgesetz 05.09.2025 (Eintragungsdatum)\n\nBarbossa AcquiCo GmbH\nGesellschaft mit beschränkter Haftung\nBamberg\n\nDen Gläubigern der an der Verschmelzung beteiligten Rechtsträger ist, wenn sie binnen sechs Monaten nach dem Tag, an dem die Eintragung der Verschmelzung in das Register des Sitzes desjenigen Rechtsträgers, dessen Gläubiger sie sind, nach § 19 Abs. 3 UmwG als bekannt gemacht gilt, ihren Anspruch nach Grund und Höhe in Textform anmelden, Sicherheit zu leisten, soweit sie nicht Befriedigung verlangen können. Dieses Recht steht den Gläubigern jedoch nur zu, wenn sie glaubhaft machen, dass durch die Verschmelzung die Erfüllung ihrer Forderung gefährdet wird."
    },
    {
      "date": "2025-09-06",
      "id": "127439",
      "original_text": "Registerbekanntmachung nach dem Umwandlungsgesetz\nBayern Amtsgericht Bayreuth HRA 4462\nZahlenwerk Steuerberatungsgesellschaft mbH & Co. KG – Bayreuth",
      "type": "Registerbekanntmachung nach dem Umwandlungsgesetz",
      "state": "Bayern",
      "amtsgericht": "Amtsgericht Bayreuth",
      "registernummer": "HRA 4462",
      "registerart": "HRA",
      "company_name": "Zahlenwerk Steuerberatungsgesellschaft mbH & Co. KG",
      "company_seat": "Bayreuth",
      "details": "06.09.2025 (Bekanntmachungsdatum)\n\nBayern Amtsgericht Bayreuth HRA 4462\nRegisterbekanntmachung nach dem Umwandlungsgesetz 05.09.2025 (Eintragungsdatum)\n\nZahlenwerk Steuerberatungsgesellschaft mbH & Co. KG\nKommanditgesellschaft\nBayreuth\n\nDen Gläubigern des formwechselnden Rechtsträgers ist, wenn sie binnen sechs Monaten nach dem Tag, an dem die Eintragung des Formwechsels nach § 201 UmwG als bekannt gemacht gilt, ihren Anspruch nach Grund und Höhe in Textform anmelden, Sicherheit zu leisten, soweit sie nicht Befriedigung verlangen können. Dieses Recht steht den Gläubigern jedoch nur zu, wenn sie glaubhaft machen, dass durch den Formwechsel die Erfüllung ihrer Forderung gefährdet wird."
    },
    {
      "date": "2025-09-06",
      "id": "127440",
      "original_text": "Registerbekanntmachung nach dem Umwandlungsgesetz\nBayern Amtsgericht München HRB 283899\nSCUR-Alpha 1597 GmbH – München",
      "type": "Registerbekanntmachung nach dem Umwandlungsgesetz",
      "state": "Bayern",
      "amtsgericht": "Amtsgericht München",
      "registernummer": "HRB 283899",
      "registerart": "HRB",
      "company_name": "SCUR-Alpha 1597 GmbH",
      "company_seat": "München",
      "details": "06.09.2025 (Bekanntmachungsdatum)\n\nBayern Amtsgericht München HRB 283899\nRegisterbekanntmachung nach dem Umwandlungsgesetz 05.09.2025 (Eintragungsdatum)\n\nSCUR-Alpha 1597 GmbH\nGesellschaft mit beschränkter Haftung\nMünchen\n\nDen Gläubigern der an der Verschmelzung beteiligten Rechtsträger ist, wenn sie binnen sechs Monaten nach dem Tag, an dem die Eintragung der Verschmelzung in das Register des Sitzes desjenigen Rechtsträgers, dessen Gläubiger sie sind, nach § 19 Abs. 3 UmwG als bekannt gemacht gilt, ihren Anspruch nach Grund und Höhe in Textform anmelden, Sicherheit zu leisten, soweit sie nicht Befriedigung verlangen können. Dieses Recht steht den Gläubigern jedoch nur zu, wenn sie glaubhaft machen, dass durch die Verschmelzung die Erfüllung ihrer Forderung gefährdet wird."
    },
    {
      "date": "2025-09-06",
      "id": "127441",
      "original_text": "Registerbekanntmachung nach dem Umwandlungsgesetz\nBayern Amtsgericht Augsburg HRB 20430\nDecumed-Bari Vertriebs-GmbH – Neusäß",
      "type": "Registerbekanntmachung nach dem Umwandlungsgesetz",
      "state": "Bayern",
      "amtsgericht": "Amtsgericht Augsburg",
      "registernummer": "HRB 20430",
      "registerart": "HRB",
      "company_name": "Decumed-Bari Vertriebs-GmbH",
      "company_seat": "Neusäß",
      "details": "06.09.2025 (Bekanntmachungsdatum)\n\nBayern Amtsgericht Augsburg HRB 20430\nRegisterbekanntmachung nach dem Umwandlungsgesetz 05.09.2025 (Eintragungsdatum)\n\nDecumed-Bari Vertriebs-GmbH\nGesellschaft mit beschränkter Haftung\nNeusäß\n\nDen Gläubigern der an der Verschmelzung beteiligten Rechtsträger ist, wenn sie binnen sechs Monaten nach dem Tag, an dem die Eintragung der Verschmelzung in das Register des Sitzes desjenigen Rechtsträgers, dessen Gläubiger sie sind, nach § 19 Abs. 3 UmwG als bekannt gemacht gilt, ihren Anspruch nach Grund und Höhe in Textform anmelden, Sicherheit zu leisten, soweit sie nicht Befriedigung verlangen können. Dieses Recht steht den Gläubigern jedoch nur zu, wenn sie glaubhaft machen, dass durch die Verschmelzung die Erfüllung ihrer Forderung gefährdet wird."
    },
    {
      "date": "2025-09-06",
      "id": "127442",
      "original_text": "Registerbekanntmachung nach dem Umwandlungsgesetz\nBayern Amtsgericht Bamberg HRB 9610\nGSN Immobilienverwaltung UG (haftungsbeschränkt) – Bamberg",
      "type": "Registerbekanntmachung nach dem Umwandlungsgesetz",
      "state": "Bayern",
      "amtsgericht": "Amtsgericht Bamberg",
      "registernummer": "HRB 9610",
      "registerart": "HRB",
      "company_name": "GSN Immobilienverwaltung UG (haftungsbeschränkt)",
      "company_seat": "Bamberg",
      "details": "06.09.2025 (Bekanntmachungsdatum)\n\nBayern Amtsgericht Bamberg HRB 9610\nRegisterbekanntmachung nach dem Umwandlungsgesetz 05.09.2025 (Eintragungsdatum)\n\nGSN Immobilienverwaltung UG (haftungsbeschränkt)\nGesellschaft mit beschränkter Haftung\nBamberg\n\nDen Gläubigern der an der Verschmelzung beteiligten Rechtsträger ist, wenn sie binnen sechs Monaten nach dem Tag, an dem die Eintragung der Verschmelzung in das Register des Sitzes desjenigen Rechtsträgers, dessen Gläubiger sie sind, nach § 19 Abs. 3 UmwG als bekannt gemacht gilt, ihren Anspruch nach Grund und Höhe in Textform anmelden, Sicherheit zu leisten, soweit sie nicht Befriedigung verlangen können. Dieses Recht steht den Gläubigern jedoch nur zu, wenn sie glaubhaft machen, dass durch die Verschmelzung die Erfüllung ihrer Forderung gefährdet wird."
    },
    {
      "date": "2025-09-06",
      "id": "127443",
      "original_text": "Löschungsankündigung\nBayern Amtsgericht München HRB 275924\nBaunata GmbH – München",
      "type": "Löschungsankündigung",
      "state": "Bayern",
      "amtsgericht": "Amtsgericht München",
      "registernummer": "HRB 275924",
      "registerart": "HRB",
      "company_name": "Baunata GmbH",
      "company_seat": "München",
      "details": "06.09.2025 (Bekanntmachungsdatum)\n\nBayern Amtsgericht München HRB 275924\nLöschungsankündigung 05.09.2025 (Eintragungsdatum)\n\nBaunata GmbH\nGesellschaft mit beschränkter Haftung\nMünchen\n\nDas Registergericht beabsichtigt, die im Handelsregister eingetragene Gesellschaft wegen Vermögenslosigkeit von Amts wegen nach § 394 FamFG zu löschen. Die Frist zur Erhebung eines Widerspruchs ist auf drei Monate festgesetzt."
    },
    {
      "date": "2025-09-06",
      "id": "127444",
      "original_text": "Registerbekanntmachung nach dem Umwandlungsgesetz\nBayern Amtsgericht Hof HRB 740\nBad Stebener Weinhaus Gesellschaft mit beschränkter Haftung – Bad Steben",
      "type": "Registerbekanntmachung nach dem Umwandlungsgesetz",
      "state": "Bayern",
      "amtsgericht": "Amtsgericht Hof",
      "registernummer": "HRB 740",
      "registerart": "HRB",
      "company_name": "Bad Stebener Weinhaus Gesellschaft mit beschränkter Haftung",
      "company_seat": "Bad Steben",
      "details": "06.09.2025 (Bekanntmachungsdatum)\n\nBayern Amtsgericht Hof HRB 740\nRegisterbekanntmachung nach dem Umwandlungsgesetz 05.09.2025 (Eintragungsdatum)\n\nBad Stebener Weinhaus Gesellschaft mit beschränkter Haftung\nGesellschaft mit beschränkter Haftung\nBad Steben\n\nDen Gläubigern des formwechselnden Rechtsträgers ist, wenn sie binnen sechs Monaten nach dem Tag, an dem die Eintragung des Formwechsels nach § 201 UmwG als bekannt gemacht gilt, ihren Anspruch nach Grund und Höhe in Textform anmelden, Sicherheit zu leisten, soweit sie nicht Befriedigung verlangen können. Dieses Recht steht den Gläubigern jedoch nur zu, wenn sie glaubhaft machen, dass durch den Formwechsel die Erfüllung ihrer Forderung gefährdet wird."
    },
    {
      "date": "2025-09-06",
      "id": "127445",
      "original_text": "Registerbekanntmachung nach dem Umwandlungsgesetz\nBayern Amtsgericht Augsburg HRB 33181\nDecumed-Bari medical GmbH – Neusäß",
      "type": "Registerbekanntmachung nach dem Umwandlungsgesetz",
      "state": "Bayern",
      "amtsgericht": "Amtsgericht Augsburg",
      "registernummer": "HRB 33181",
      "registerart": "HRB",
      "company_name": "Decumed-Bari medical GmbH",
      "company_seat": "Neusäß",
      "details": "06.09.2025 (Bekanntmachungsdatum)\n\nBayern Amtsgericht Augsburg HRB 33181\nRegisterbekanntmachung nach dem Umwandlungsgesetz 05.09.2025 (Eintragungsdatum)\n\nDecumed-Bari medical GmbH\nGesellschaft mit beschränkter Haftung\nNeusäß\n\nDen Gläubigern der an der Verschmelzung beteiligten Rechtsträger ist, wenn sie binnen sechs Monaten nach dem Tag, an dem die Eintragung der Verschmelzung in das Register des Sitzes desjenigen Rechtsträgers, dessen Gläubiger sie sind, nach § 19 Abs. 3 UmwG als bekannt gemacht gilt, ihren Anspruch nach Grund und Höhe in Textform anmelden, Sicherheit zu leisten, soweit sie nicht Befriedigung verlangen können. Dieses Recht steht den Gläubigern jedoch nur zu, wenn sie glaubhaft machen, dass durch die Verschmelzung die Erfüllung ihrer Forderung gefährdet wird."
    },
    {
      "date": "2025-09-06",
      "id": "127446",
      "original_text": "Registerbekanntmachung nach dem Umwandlungsgesetz\nBayern Amtsgericht Kempten (Allgäu) HRA 11726\nEpple Beratungs- und Beteiligungs e.K. – Wald",
      "type": "Registerbekanntmachung nach dem Umwandlungsgesetz",
      "state": "Bayern",
      "amtsgericht": "Amtsgericht Kempten (Allgäu)",
      "registernummer": "HRA 11726",
      "registerart": "HRA",
      "company_name": "Epple Beratungs- und Beteiligungs e.K.",
      "company_seat": "Wald",
      "details": "06.09.2025 (Bekanntmachungsdatum)\n\nBayern Amtsgericht Kempten (Allgäu) HRA 11726\nRegisterbekanntmachung nach dem Umwandlungsgesetz 05.09.2025 (Eintragungsdatum)\n\nEpple Beratungs- und Beteiligungs e.K.\nEinzelkaufmann / Einzelkauffrau\nWald\n\nDen Gläubigern der an der Ausgliederung beteiligten Rechtsträger ist, wenn sie binnen sechs Monaten nach dem Tag, an dem die Eintragung der Ausgliederung in das Register des Sitzes desjenigen Rechtsträgers, dessen Gläubiger sie sind, nach §§ 125, 19 Abs. 3 UmwG als bekannt gemacht gilt, ihren Anspruch nach Grund und Höhe in Textform anmelden, Sicherheit zu leisten, soweit sie nicht Befriedigung verlangen können. Dieses Recht steht den Gläubigern jedoch nur zu, wenn sie glaubhaft machen, dass durch die Ausgliederung die Erfüllung ihrer Forderung gefährdet wird."
    },
    {
      "date": "2025-09-06",
      "id": "127447",
      "original_text": "Registerbekanntmachung nach dem Umwandlungsgesetz\nBayern Amtsgericht Traunstein HRB 28909\nClassic No I Barber&Tattoo UG (haftungsbeschränkt) – Wasserburg a.Inn",
      "type": "Registerbekanntmachung nach dem Umwandlungsgesetz",
      "state": "Bayern",
      "amtsgericht": "Amtsgericht Traunstein",
      "registernummer": "HRB 28909",
      "registerart": "HRB",
      "company_name": "Classic No I Barber&Tattoo UG (haftungsbeschränkt)",
      "company_seat": "Wasserburg a.Inn",
      "details": "06.09.2025 (Bekanntmachungsdatum)\n\nBayern Amtsgericht Traunstein HRB 28909\nRegisterbekanntmachung nach dem Umwandlungsgesetz 05.09.2025 (Eintragungsdatum)\n\nClassic No I Barber&Tattoo UG (haftungsbeschränkt)\nGesellschaft mit beschränkter Haftung\nWasserburg a.Inn\n\nDen Gläubigern der an der Verschmelzung beteiligten Rechtsträger ist, wenn sie binnen sechs Monaten nach dem Tag, an dem die Eintragung der Verschmelzung in das Register des Sitzes desjenigen Rechtsträgers, dessen Gläubiger sie sind, nach § 19 Abs. 3 UmwG als bekannt gemacht gilt, ihren Anspruch nach Grund und Höhe in Textform anmelden, Sicherheit zu leisten, soweit sie nicht Befriedigung verlangen können. Dieses Recht steht den Gläubigern jedoch nur zu, wenn sie glaubhaft machen, dass durch die Verschmelzung die Erfüllung ihrer Forderung gefährdet wird."
    },
    {
      "date": "2025-09-06",
      "id": "127448",
      "original_text": "Registerbekanntmachung nach dem Umwandlungsgesetz\nBayern Amtsgericht Traunstein HRA 10680\nOberhaizinger Grundbesitz GmbH & Co. KG – Marktl",
      "type": "Registerbekanntmachung nach dem Umwandlungsgesetz",
      "state": "Bayern",
      "amtsgericht": "Amtsgericht Traunstein",
      "registernummer": "HRA 10680",
      "registerart": "HRA",
      "company_name": "Oberhaizinger Grundbesitz GmbH & Co. KG",
      "company_seat": "Marktl",
      "details": "06.09.2025 (Bekanntmachungsdatum)\n\nBayern Amtsgericht Traunstein HRA 10680\nRegisterbekanntmachung nach dem Umwandlungsgesetz 05.09.2025 (Eintragungsdatum)\n\nOberhaizinger Grundbesitz GmbH & Co. KG\nKommanditgesellschaft\nMarktl\n\nDen Gläubigern des formwechselnden Rechtsträgers ist, wenn sie binnen sechs Monaten nach dem Tag, an dem die Eintragung des Formwechsels nach § 201 UmwG als bekannt gemacht gilt, ihren Anspruch nach Grund und Höhe in Textform anmelden, Sicherheit zu leisten, soweit sie nicht Befriedigung verlangen können. Dieses Recht steht den Gläubigern jedoch nur zu, wenn sie glaubhaft machen, dass durch den Formwechsel die Erfüllung ihrer Forderung gefährdet wird."
    },
    {
      "date": "2025-09-06",
      "id": "127449",
      "original_text": "Registerbekanntmachung nach dem Umwandlungsgesetz\nBayern Amtsgericht München VR 205331\nWirtschaftsverband für Handelsvertretungen Bayern (CDH) e.V. – München",
      "type": "Registerbekanntmachung nach dem Umwandlungsgesetz",
      "state": "Bayern",
      "amtsgericht": "Amtsgericht München",
      "registernummer": "VR 205331",
      "registerart": "VR",
      "company_name": "Wirtschaftsverband für Handelsvertretungen Bayern (CDH) e.V.",
      "company_seat": "München",
      "details": "06.09.2025 (Bekanntmachungsdatum)\n\nBayern Amtsgericht München VR 205331\nRegisterbekanntmachung nach dem Umwandlungsgesetz 05.09.2025 (Eintragungsdatum)\n\nWirtschaftsverband für Handelsvertretungen Bayern (CDH) e.V.\neingetragener Verein\nMünchen\n\nDen Gläubigern der an der Verschmelzung beteiligten Rechtsträger ist, wenn sie binnen sechs Monaten nach dem Tag, an dem die Eintragung der Verschmelzung in das Register des Sitzes desjenigen Rechtsträgers, dessen Gläubiger sie sind, nach § 19 Abs. 3 UmwG als bekannt gemacht gilt, ihren Anspruch nach Grund und Höhe in Textform anmelden, Sicherheit zu leisten, soweit sie nicht Befriedigung verlangen können. Dieses Recht steht den Gläubigern jedoch nur zu, wenn sie glaubhaft machen, dass durch die Verschmelzung die Erfüllung ihrer Forderung gefährdet wird."
    },
    {
      "date": "2025-09-06",
      "id": "127450",
      "original_text": "Löschungsankündigung\nBayern Amtsgericht München HRB 280797\nKODA LOGISTIK d.o.o. Zweigniederlassung München – München",
      "type": "Löschungsankündigung",
      "state": "Bayern",
      "amtsgericht": "Amtsgericht München",
      "registernummer": "HRB 280797",
      "registerart": "HRB",
      "company_name": "KODA LOGISTIK d.o.o. Zweigniederlassung München",
      "company_seat": "München",
      "details": "06.09.2025 (Bekanntmachungsdatum)\n\nBayern Amtsgericht München HRB 280797\nLöschungsankündigung 05.09.2025 (Eintragungsdatum)\n\nKODA LOGISTIK d.o.o. Zweigniederlassung München\nRechtsform ausländischen Rechts HRB\nMünchen\n\nDas Registergericht beabsichtigt, die im Handelsregister eingetragene Gesellschaft von Amts wegen nach § 395 FamFG zu löschen. Die Frist zur Erhebung eines Widerspruchs ist auf drei Monate festgesetzt."
    },
    {
      "date": "2025-09-06",
      "id": "127451",
      "original_text": "Löschungsankündigung\nBayern Amtsgericht München HRB 122125\nMIKAH GmbH – München",
      "type": "Löschungsankündigung",
      "state": "Bayern",
      "amtsgericht": "Amtsgericht München",
      "registernummer": "HRB 122125",
      "registerart": "HRB",
      "company_name": "MIKAH GmbH",
      "company_seat": "München",
      "details": "06.09.2025 (Bekanntmachungsdatum)\n\nBayern Amtsgericht München HRB 122125\nLöschungsankündigung 05.09.2025 (Eintragungsdatum)\n\nMIKAH GmbH\nGesellschaft mit beschränkter Haftung\nMünchen\n\nDas Registergericht beabsichtigt, die im Handelsregister eingetragene Gesellschaft wegen Vermögenslosigkeit von Amts wegen nach § 394 FamFG zu löschen. Die Frist zur Erhebung eines Widerspruchs ist auf drei Monate festgesetzt."
    },
    {
      "date": "2025-09-06",
      "id": "127452",
      "original_text": "Löschungsankündigung\nBayern Amtsgericht Bamberg HRB 7474\nDereser Logistik GmbH – Rauhenebrach",
      "type": "Löschungsankündigung",
      "state": "Bayern",
      "amtsgericht": "Amtsgericht Bamberg",
      "registernummer": "HRB 7474",
      "registerart": "HRB",
      "company_name": "Dereser Logistik GmbH",
      "company_seat": "Rauhenebrach",
      "details": "06.09.2025 (Bekanntmachungsdatum)\n\nBayern Amtsgericht Bamberg HRB 7474\nLöschungsankündigung\n\nDereser Logistik GmbH\nGesellschaft mit beschränkter Haftung\nRauhenebrach\n\nDas Registergericht beabsichtigt, die im Handelsregister eingetragene Gesellschaft wegen Vermögenslosigkeit von Amts wegen nach § 394 FamFG zu löschen. Die Frist zur Erhebung eines Widerspruchs ist auf einen Monat festgesetzt."
    },
    {
      "date": "2025-09-06",
      "id": "127453",
      "original_text": "Registerbekanntmachung nach dem Umwandlungsgesetz\nBayern Amtsgericht Traunstein HRB 34428\nOberhaizinger Holding GmbH – Marktl",
      "type": "Registerbekanntmachung nach dem Umwandlungsgesetz",
      "state": "Bayern",
      "amtsgericht": "Amtsgericht Traunstein",
      "registernummer": "HRB 34428",
      "registerart": "HRB",
      "company_name": "Oberhaizinger Holding GmbH",
      "company_seat": "Marktl",
      "details": "06.09.2025 (Bekanntmachungsdatum)\n\nBayern Amtsgericht Traunstein HRB 34428\nRegisterbekanntmachung nach dem Umwandlungsgesetz 05.09.2025 (Eintragungsdatum)\n\nOberhaizinger Holding GmbH\nGesellschaft mit beschränkter Haftung\nMarktl\n\nDen Gläubigern des formwechselnden Rechtsträgers ist, wenn sie binnen sechs Monaten nach dem Tag, an dem die Eintragung des Formwechsels nach § 201 UmwG als bekannt gemacht gilt, ihren Anspruch nach Grund und Höhe in Textform anmelden, Sicherheit zu leisten, soweit sie nicht Befriedigung verlangen können. Dieses Recht steht den Gläubigern jedoch nur zu, wenn sie glaubhaft machen, dass durch den Formwechsel die Erfüllung ihrer Forderung gefährdet wird."
    },
    {
      "date": "2025-09-06",
      "id": "127454",
      "original_text": "Registerbekanntmachung nach dem Umwandlungsgesetz\nBayern Amtsgericht Bamberg HRB 10296\nPERBILITY Holding GmbH – Bamberg",
      "type": "Registerbekanntmachung nach dem Umwandlungsgesetz",
      "state": "Bayern",
      "amtsgericht": "Amtsgericht Bamberg",
      "registernummer": "HRB 10296",
      "registerart": "HRB",
      "company_name": "PERBILITY Holding GmbH",
      "company_seat": "Bamberg",
      "details": "06.09.2025 (Bekanntmachungsdatum)\n\nBayern Amtsgericht Bamberg HRB 10296\nRegisterbekanntmachung nach dem Umwandlungsgesetz 05.09.2025 (Eintragungsdatum)\n\nPERBILITY Holding GmbH\nGesellschaft mit beschränkter Haftung\nBamberg\n\nDen Gläubigern der an der Verschmelzung beteiligten Rechtsträger ist, wenn sie binnen sechs Monaten nach dem Tag, an dem die Eintragung der Verschmelzung in das Register des Sitzes desjenigen Rechtsträgers, dessen Gläubiger sie sind, nach § 19 Abs. 3 UmwG als bekannt gemacht gilt, ihren Anspruch nach Grund und Höhe in Textform anmelden, Sicherheit zu leisten, soweit sie nicht Befriedigung verlangen können. Dieses Recht steht den Gläubigern jedoch nur zu, wenn sie glaubhaft machen, dass durch die Verschmelzung die Erfüllung ihrer Forderung gefährdet wird."
    },
    {
      "date": "2025-09-06",
      "id": "127455",
      "original_text": "Registerbekanntmachung nach dem Umwandlungsgesetz\nBayern Amtsgericht Bamberg HRB 9492\nGridsystems Netzstudien GmbH – Bamberg",
      "type": "Registerbekanntmachung nach dem Umwandlungsgesetz",
      "state": "Bayern",
      "amtsgericht": "Amtsgericht Bamberg",
      "registernummer": "HRB 9492",
      "registerart": "HRB",
      "company_name": "Gridsystems Netzstudien GmbH",
      "company_seat": "Bamberg",
      "details": "06.09.2025 (Bekanntmachungsdatum)\n\nBayern Amtsgericht Bamberg HRB 9492\nRegisterbekanntmachung nach dem Umwandlungsgesetz 05.09.2025 (Eintragungsdatum)\n\nGridsystems Netzstudien GmbH\nGesellschaft mit beschränkter Haftung\nBamberg\n\nDen Gläubigern der an der Verschmelzung beteiligten Rechtsträger ist, wenn sie binnen sechs Monaten nach dem Tag, an dem die Eintragung der Verschmelzung in das Register des Sitzes desjenigen Rechtsträgers, dessen Gläubiger sie sind, nach § 19 Abs. 3 UmwG als bekannt gemacht gilt, ihren Anspruch nach Grund und Höhe in Textform anmelden, Sicherheit zu leisten, soweit sie nicht Befriedigung verlangen können. Dieses Recht steht den Gläubigern jedoch nur zu, wenn sie glaubhaft machen, dass durch die Verschmelzung die Erfüllung ihrer Forderung gefährdet wird."
    },
    {
      "date": "2025-09-06",
      "id": "127456",
      "original_text": "Registerbekanntmachung nach dem Umwandlungsgesetz\nBayern Amtsgericht München HRB 198212\nGoYellow GmbH – München",
      "type": "Registerbekanntmachung nach dem Umwandlungsgesetz",
      "state": "Bayern",
      "amtsgericht": "Amtsgericht München",
      "registernummer": "HRB 198212",
      "registerart": "HRB",
      "company_name": "GoYellow GmbH",
      "company_seat": "München",
      "details": "06.09.2025 (Bekanntmachungsdatum)\n\nBayern Amtsgericht München HRB 198212\nRegisterbekanntmachung nach dem Umwandlungsgesetz 05.09.2025 (Eintragungsdatum)\n\nGoYellow GmbH\nGesellschaft mit beschränkter Haftung\nMünchen\n\nDen Gläubigern der an der Verschmelzung beteiligten Rechtsträger ist, wenn sie binnen sechs Monaten nach dem Tag, an dem die Eintragung der Verschmelzung in das Register des Sitzes desjenigen Rechtsträgers, dessen Gläubiger sie sind, nach § 19 Abs. 3 UmwG als bekannt gemacht gilt, ihren Anspruch nach Grund und Höhe in Textform anmelden, Sicherheit zu leisten, soweit sie nicht Befriedigung verlangen können. Dieses Recht steht den Gläubigern jedoch nur zu, wenn sie glaubhaft machen, dass durch die Verschmelzung die Erfüllung ihrer Forderung gefährdet wird."
    },
    {
      "date": "2025-09-06",
      "id": "127457",
      "original_text": "Registerbekanntmachung nach dem Umwandlungsgesetz\nBayern Amtsgericht Weiden i. d. OPf. HRA 2839\nDIMASE GmbH & Co. Store KG – Weiden i.d.OPf.",
      "type": "Registerbekanntmachung nach dem Umwandlungsgesetz",
      "state": "Bayern",
      "amtsgericht": "Amtsgericht Weiden i. d. OPf.",
      "registernummer": "HRA 2839",
      "registerart": "HRA",
      "company_name": "DIMASE GmbH & Co. Store KG",
      "company_seat": "Weiden i.d.OPf.",
      "details": "06.09.2025 (Bekanntmachungsdatum)\n\nBayern Amtsgericht Weiden i. d. OPf. HRA 2839\nRegisterbekanntmachung nach dem Umwandlungsgesetz 05.09.2025 (Eintragungsdatum)\n\nDIMASE GmbH & Co. Store KG\nKommanditgesellschaft\nWeiden i.d.OPf.\n\nDen Gläubigern der an der Verschmelzung beteiligten Rechtsträger ist, wenn sie binnen sechs Monaten nach dem Tag, an dem die Eintragung der Verschmelzung in das Register des Sitzes desjenigen Rechtsträgers, dessen Gläubiger sie sind, nach § 19 Abs. 3 UmwG als bekannt gemacht gilt, ihren Anspruch nach Grund und Höhe in Textform anmelden, Sicherheit zu leisten, soweit sie nicht Befriedigung verlangen können. Dieses Recht steht den Gläubigern jedoch nur zu, wenn sie glaubhaft machen, dass durch die Verschmelzung die Erfüllung ihrer Forderung gefährdet wird."
    },
    {
      "date": "2025-09-06",
      "id": "127458",
      "original_text": "Registerbekanntmachung nach dem Umwandlungsgesetz\nBayern Amtsgericht München HRB 136788\nAnnex Capital Solutions GmbH – München",
      "type": "Registerbekanntmachung nach dem Umwandlungsgesetz",
      "state": "Bayern",
      "amtsgericht": "Amtsgericht München",
      "registernummer": "HRB 136788",
      "registerart": "HRB",
      "company_name": "Annex Capital Solutions GmbH",
      "company_seat": "München",
      "details": "06.09.2025 (Bekanntmachungsdatum)\n\nBayern Amtsgericht München HRB 136788\nRegisterbekanntmachung nach dem Umwandlungsgesetz 05.09.2025 (Eintragungsdatum)\n\nAnnex Capital Solutions GmbH\nGesellschaft mit beschränkter Haftung\nMünchen\n\nDen Gläubigern der an der Verschmelzung beteiligten Rechtsträger ist, wenn sie binnen sechs Monaten nach dem Tag, an dem die Eintragung der Verschmelzung in das Register des Sitzes desjenigen Rechtsträgers, dessen Gläubiger sie sind, nach § 19 Abs. 3 UmwG als bekannt gemacht gilt, ihren Anspruch nach Grund und Höhe in Textform anmelden, Sicherheit zu leisten, soweit sie nicht Befriedigung verlangen können. Dieses Recht steht den Gläubigern jedoch nur zu, wenn sie glaubhaft machen, dass durch die Verschmelzung die Erfüllung ihrer Forderung gefährdet wird."
    },
    {
      "date": "2025-09-06",
      "id": "127459",
      "original_text": "Registerbekanntmachung nach dem Umwandlungsgesetz\nBayern Amtsgericht Würzburg HRA 9008\nNonstop gutes Marketing - Jorin Obreschkow e.K. – Marktheidenfeld",
      "type": "Registerbekanntmachung nach dem Umwandlungsgesetz",
      "state": "Bayern",
      "amtsgericht": "Amtsgericht Würzburg",
      "registernummer": "HRA 9008",
      "registerart": "HRA",
      "company_name": "Nonstop gutes Marketing - Jorin Obreschkow e.K.",
      "company_seat": "Marktheidenfeld",
      "details": "06.09.2025 (Bekanntmachungsdatum)\n\nBayern Amtsgericht Würzburg HRA 9008\nRegisterbekanntmachung nach dem Umwandlungsgesetz 05.09.2025 (Eintragungsdatum)\n\nNonstop gutes Marketing - Jorin Obreschkow e.K.\nEinzelkaufmann / Einzelkauffrau\nMarktheidenfeld\n\nDen Gläubigern der an der Verschmelzung beteiligten Rechtsträger ist, wenn sie binnen sechs Monaten nach dem Tag, an dem die Eintragung der Verschmelzung in das Register des Sitzes desjenigen Rechtsträgers, dessen Gläubiger sie sind, nach § 19 Abs. 3 UmwG als bekannt gemacht gilt, ihren Anspruch nach Grund und Höhe in Textform anmelden, Sicherheit zu leisten, soweit sie nicht Befriedigung verlangen können. Dieses Recht steht den Gläubigern jedoch nur zu, wenn sie glaubhaft machen, dass durch die Verschmelzung die Erfüllung ihrer Forderung gefährdet wird."
    },
    {
      "date": "2025-09-06",
      "id": "127460",
      "original_text": "Registerbekanntmachung nach dem Umwandlungsgesetz\nBayern Amtsgericht München HRA 121086\nPolt GmbH & Co. Betriebs KG – Vierkirchen",
      "type": "Registerbekanntmachung nach dem Umwandlungsgesetz",
      "state": "Bayern",
      "amtsgericht": "Amtsgericht München",
      "registernummer": "HRA 121086",
      "registerart": "HRA",
      "company_name": "Polt GmbH & Co. Betriebs KG",
      "company_seat": "Vierkirchen",
      "details": "06.09.2025 (Bekanntmachungsdatum)\n\nBayern Amtsgericht München HRA 121086\nRegisterbekanntmachung nach dem Umwandlungsgesetz 05.09.2025 (Eintragungsdatum)\n\nPolt GmbH & Co. Betriebs KG\nKommanditgesellschaft\nVierkirchen\n\nDen Gläubigern der an der Ausgliederung beteiligten Rechtsträger ist, wenn sie binnen sechs Monaten nach dem Tag, an dem die Eintragung der Ausgliederung in das Register des Sitzes desjenigen Rechtsträgers, dessen Gläubiger sie sind, nach §§ 125, 19 Abs. 3 UmwG als bekannt gemacht gilt, ihren Anspruch nach Grund und Höhe in Textform anmelden, Sicherheit zu leisten, soweit sie nicht Befriedigung verlangen können. Dieses Recht steht den Gläubigern jedoch nur zu, wenn sie glaubhaft machen, dass durch die Ausgliederung die Erfüllung ihrer Forderung gefährdet wird."
    },
    {
      "date": "2025-09-06",
      "id": "127461",
      "original_text": "Einreichung neuer Dokumente\nBayern Amtsgericht München HRB 281602\nAURELIUS Advisory AG – München",
      "type": "Einreichung neuer Dokumente",
      "state": "Bayern",
      "amtsgericht": "Amtsgericht München",
      "registernummer": "HRB 281602",
      "registerart": "HRB",
      "company_name": "AURELIUS Advisory AG",
      "company_seat": "München",
      "details": "06.09.2025 (Bekanntmachungsdatum)\n\nBayern Amtsgericht München HRB 281602\nEinreichung neuer Dokumente\n\nAURELIUS Advisory AG\nAktiengesellschaft\nMünchen\n\nDem Amtsgericht München -Registergericht- ist eine Liste der Mitglieder des Aufsichtsrats eingereicht worden, § 106 AktG."
    },
    {
      "date": "2025-09-06",
      "id": "127462",
      "original_text": "Registerbekanntmachung nach dem Umwandlungsgesetz\nBayern Amtsgericht München HRB 267709\nCoros Borsigturm GmbH – Grünwald",
      "type": "Registerbekanntmachung nach dem Umwandlungsgesetz",
      "state": "Bayern",
      "amtsgericht": "Amtsgericht München",
      "registernummer": "HRB 267709",
      "registerart": "HRB",
      "company_name": "Coros Borsigturm GmbH",
      "company_seat": "Grünwald",
      "details": "06.09.2025 (Bekanntmachungsdatum)\n\nBayern Amtsgericht München HRB 267709\nRegisterbekanntmachung nach dem Umwandlungsgesetz 05.09.2025 (Eintragungsdatum)\n\nCoros Borsigturm GmbH\nGesellschaft mit beschränkter Haftung\nGrünwald\n\nDen Gläubigern der an der Verschmelzung beteiligten Rechtsträger ist, wenn sie binnen sechs Monaten nach dem Tag, an dem die Eintragung der Verschmelzung in das Register des Sitzes desjenigen Rechtsträgers, dessen Gläubiger sie sind, nach § 19 Abs. 3 UmwG als bekannt gemacht gilt, ihren Anspruch nach Grund und Höhe in Textform anmelden, Sicherheit zu leisten, soweit sie nicht Befriedigung verlangen können. Dieses Recht steht den Gläubigern jedoch nur zu, wenn sie glaubhaft machen, dass durch die Verschmelzung die Erfüllung ihrer Forderung gefährdet wird."
    },
    {
      "date": "2025-09-06",
      "id": "127463",
      "original_text": "Registerbekanntmachung nach dem Umwandlungsgesetz\nBayern Amtsgericht Kempten (Allgäu) HRB 18415\nEpple Beteiligungs-GmbH – Wald",
      "type": "Registerbekanntmachung nach dem Umwandlungsgesetz",
      "state": "Bayern",
      "amtsgericht": "Amtsgericht Kempten (Allgäu)",
      "registernummer": "HRB 18415",
      "registerart": "HRB",
      "company_name": "Epple Beteiligungs-GmbH",
      "company_seat": "Wald",
      "details": "06.09.2025 (Bekanntmachungsdatum)\n\nBayern Amtsgericht Kempten (Allgäu) HRB 18415\nRegisterbekanntmachung nach dem Umwandlungsgesetz 05.09.2025 (Eintragungsdatum)\n\nEpple Beteiligungs-GmbH\nGesellschaft mit beschränkter Haftung\nWald\n\nDen Gläubigern der an der Ausgliederung beteiligten Rechtsträger ist, wenn sie binnen sechs Monaten nach dem Tag, an dem die Eintragung der Ausgliederung in das Register des Sitzes desjenigen Rechtsträgers, dessen Gläubiger sie sind, nach §§ 125, 19 Abs. 3 UmwG als bekannt gemacht gilt, ihren Anspruch nach Grund und Höhe in Textform anmelden, Sicherheit zu leisten, soweit sie nicht Befriedigung verlangen können. Dieses Recht steht den Gläubigern jedoch nur zu, wenn sie glaubhaft machen, dass durch die Ausgliederung die Erfüllung ihrer Forderung gefährdet wird."
    },
    {
      "date": "2025-09-06",
      "id": "127464",
      "original_text": "Registerbekanntmachung nach dem Umwandlungsgesetz\nBayern Amtsgericht München HRB 244807\nGuFaYo GmbH – München",
      "type": "Registerbekanntmachung nach dem Umwandlungsgesetz",
      "state": "Bayern",
      "amtsgericht": "Amtsgericht München",
      "registernummer": "HRB 244807",
      "registerart": "HRB",
      "company_name": "GuFaYo GmbH",
      "company_seat": "München",
      "details": "06.09.2025 (Bekanntmachungsdatum)\n\nBayern Amtsgericht München HRB 244807\nRegisterbekanntmachung nach dem Umwandlungsgesetz 05.09.2025 (Eintragungsdatum)\n\nGuFaYo GmbH\nGesellschaft mit beschränkter Haftung\nMünchen\n\nDen Gläubigern der an der Verschmelzung beteiligten Rechtsträger ist, wenn sie binnen sechs Monaten nach dem Tag, an dem die Eintragung der Verschmelzung in das Register des Sitzes desjenigen Rechtsträgers, dessen Gläubiger sie sind, nach § 19 Abs. 3 UmwG als bekannt gemacht gilt, ihren Anspruch nach Grund und Höhe in Textform anmelden, Sicherheit zu leisten, soweit sie nicht Befriedigung verlangen können. Dieses Recht steht den Gläubigern jedoch nur zu, wenn sie glaubhaft machen, dass durch die Verschmelzung die Erfüllung ihrer Forderung gefährdet wird."
    },
    {
      "date": "2025-09-06",
      "id": "127465",
      "original_text": "Registerbekanntmachung nach dem Umwandlungsgesetz\nBayern Amtsgericht München HRB 209997\nAtolls Germany GmbH – München",
      "type": "Registerbekanntmachung nach dem Umwandlungsgesetz",
      "state": "Bayern",
      "amtsgericht": "Amtsgericht München",
      "registernummer": "HRB 209997",
      "registerart": "HRB",
      "company_name": "Atolls Germany GmbH",
      "company_seat": "München",
      "details": "06.09.2025 (Bekanntmachungsdatum)\n\nBayern Amtsgericht München HRB 209997\nRegisterbekanntmachung nach dem Umwandlungsgesetz 05.09.2025 (Eintragungsdatum)\n\nAtolls Germany GmbH\nGesellschaft mit beschränkter Haftung\nMünchen\n\nDen Gläubigern der an der Verschmelzung beteiligten Rechtsträger ist, wenn sie binnen sechs Monaten nach dem Tag, an dem die Eintragung der Verschmelzung in das Register des Sitzes desjenigen Rechtsträgers, dessen Gläubiger sie sind, nach § 19 Abs. 3 UmwG als bekannt gemacht gilt, ihren Anspruch nach Grund und Höhe in Textform anmelden, Sicherheit zu leisten, soweit sie nicht Befriedigung verlangen können. Dieses Recht steht den Gläubigern jedoch nur zu, wenn sie glaubhaft machen, dass durch die Verschmelzung die Erfüllung ihrer Forderung gefährdet wird."
    },
    {
      "date": "2025-09-06",
      "id": "127466",
      "original_text": "Löschungsankündigung\nBayern Amtsgericht München HRB 222025\nALSEKO Beteiligungsgesellschaft mbH – München",
      "type": "Löschungsankündigung",
      "state": "Bayern",
      "amtsgericht": "Amtsgericht München",
      "registernummer": "HRB 222025",
      "registerart": "HRB",
      "company_name": "ALSEKO Beteiligungsgesellschaft mbH",
      "company_seat": "München",
      "details": "06.09.2025 (Bekanntmachungsdatum)\n\nBayern Amtsgericht München HRB 222025\nLöschungsankündigung 05.09.2025 (Eintragungsdatum)\n\nALSEKO Beteiligungsgesellschaft mbH\nGesellschaft mit beschränkter Haftung\nMünchen\n\nDas Registergericht beabsichtigt, die im Handelsregister eingetragene Gesellschaft wegen Vermögenslosigkeit von Amts wegen nach § 394 FamFG zu löschen. Die Frist zur Erhebung eines Widerspruchs ist auf drei Monate festgesetzt."
    },
    {
      "date": "2025-09-06",
      "id": "127467",
      "original_text": "Registerbekanntmachung nach dem Umwandlungsgesetz\nBayern Amtsgericht Würzburg HRA 8920\nSchreinerei Daniel Breunig e.K. – Gaubüttelbrunn",
      "type": "Registerbekanntmachung nach dem Umwandlungsgesetz",
      "state": "Bayern",
      "amtsgericht": "Amtsgericht Würzburg",
      "registernummer": "HRA 8920",
      "registerart": "HRA",
      "company_name": "Schreinerei Daniel Breunig e.K.",
      "company_seat": "Gaubüttelbrunn",
      "details": "06.09.2025 (Bekanntmachungsdatum)\n\nBayern Amtsgericht Würzburg HRA 8920\nRegisterbekanntmachung nach dem Umwandlungsgesetz 05.09.2025 (Eintragungsdatum)\n\nSchreinerei Daniel Breunig e.K.\nEinzelkaufmann / Einzelkauffrau\nGaubüttelbrunn\n\nDen Gläubigern der an der Ausgliederung beteiligten Rechtsträger ist, wenn sie binnen sechs Monaten nach dem Tag, an dem die Eintragung der Ausgliederung in das Register des Sitzes desjenigen Rechtsträgers, dessen Gläubiger sie sind, nach §§ 125, 19 Abs. 3 UmwG als bekannt gemacht gilt, ihren Anspruch nach Grund und Höhe in Textform anmelden, Sicherheit zu leisten, soweit sie nicht Befriedigung verlangen können. Dieses Recht steht den Gläubigern jedoch nur zu, wenn sie glaubhaft machen, dass durch die Ausgliederung die Erfüllung ihrer Forderung gefährdet wird."
    },
    {
      "date": "2025-09-06",
      "id": "127468",
      "original_text": "Registerbekanntmachung nach dem Umwandlungsgesetz\nBayern Amtsgericht Würzburg HRB 18040\nSchreinerei Daniel Breunig GmbH – Kirchheim",
      "type": "Registerbekanntmachung nach dem Umwandlungsgesetz",
      "state": "Bayern",
      "amtsgericht": "Amtsgericht Würzburg",
      "registernummer": "HRB 18040",
      "registerart": "HRB",
      "company_name": "Schreinerei Daniel Breunig GmbH",
      "company_seat": "Kirchheim",
      "details": "06.09.2025 (Bekanntmachungsdatum)\n\nBayern Amtsgericht Würzburg HRB 18040\nRegisterbekanntmachung nach dem Umwandlungsgesetz 05.09.2025 (Eintragungsdatum)\n\nSchreinerei Daniel Breunig GmbH\nGesellschaft mit beschränkter Haftung\nKirchheim\n\nDen Gläubigern der an der Ausgliederung beteiligten Rechtsträger ist, wenn sie binnen sechs Monaten nach dem Tag, an dem die Eintragung der Ausgliederung in das Register des Sitzes desjenigen Rechtsträgers, dessen Gläubiger sie sind, nach §§ 125, 19 Abs. 3 UmwG als bekannt gemacht gilt, ihren Anspruch nach Grund und Höhe in Textform anmelden, Sicherheit zu leisten, soweit sie nicht Befriedigung verlangen können. Dieses Recht steht den Gläubigern jedoch nur zu, wenn sie glaubhaft machen, dass durch die Ausgliederung die Erfüllung ihrer Forderung gefährdet wird."
    },
    {
      "date": "2025-09-06",
      "id": "127469",
      "original_text": "Registerbekanntmachung nach dem Umwandlungsgesetz\nBayern Amtsgericht Weiden i. d. OPf. HRA 2293\nDIMASE GmbH & Co. Weiden KG – Weiden i.d.OPf.",
      "type": "Registerbekanntmachung nach dem Umwandlungsgesetz",
      "state": "Bayern",
      "amtsgericht": "Amtsgericht Weiden i. d. OPf.",
      "registernummer": "HRA 2293",
      "registerart": "HRA",
      "company_name": "DIMASE GmbH & Co. Weiden KG",
      "company_seat": "Weiden i.d.OPf.",
      "details": "06.09.2025 (Bekanntmachungsdatum)\n\nBayern Amtsgericht Weiden i. d. OPf. HRA 2293\nRegisterbekanntmachung nach dem Umwandlungsgesetz 05.09.2025 (Eintragungsdatum)\n\nDIMASE GmbH & Co. Weiden KG\nKommanditgesellschaft\nWeiden i.d.OPf.\n\nDen Gläubigern der an der Verschmelzung beteiligten Rechtsträger ist, wenn sie binnen sechs Monaten nach dem Tag, an dem die Eintragung der Verschmelzung in das Register des Sitzes desjenigen Rechtsträgers, dessen Gläubiger sie sind, nach § 19 Abs. 3 UmwG als bekannt gemacht gilt, ihren Anspruch nach Grund und Höhe in Textform anmelden, Sicherheit zu leisten, soweit sie nicht Befriedigung verlangen können. Dieses Recht steht den Gläubigern jedoch nur zu, wenn sie glaubhaft machen, dass durch die Verschmelzung die Erfüllung ihrer Forderung gefährdet wird."
    },
    {
      "date": "2025-09-06",
      "id": "127470",
      "original_text": "Registerbekanntmachung nach dem Umwandlungsgesetz\nBayern Amtsgericht München HRB 305380\nBenedikt Böhm shaping Leaders GmbH – Grünwald",
      "type": "Registerbekanntmachung nach dem Umwandlungsgesetz",
      "state": "Bayern",
      "amtsgericht": "Amtsgericht München",
      "registernummer": "HRB 305380",
      "registerart": "HRB",
      "company_name": "Benedikt Böhm shaping Leaders GmbH",
      "company_seat": "Grünwald",
      "details": "06.09.2025 (Bekanntmachungsdatum)\n\nBayern Amtsgericht München HRB 305380\nRegisterbekanntmachung nach dem Umwandlungsgesetz 05.09.2025 (Eintragungsdatum)\n\nBenedikt Böhm shaping Leaders GmbH\nGesellschaft mit beschränkter Haftung\nGrünwald\n\nDen Gläubigern der an der Ausgliederung beteiligten Rechtsträger ist, wenn sie binnen sechs Monaten nach dem Tag, an dem die Eintragung der Ausgliederung in das Register des Sitzes desjenigen Rechtsträgers, dessen Gläubiger sie sind, nach §§ 125, 19 Abs. 3 UmwG als bekannt gemacht gilt, ihren Anspruch nach Grund und Höhe in Textform anmelden, Sicherheit zu leisten, soweit sie nicht Befriedigung verlangen können. Dieses Recht steht den Gläubigern jedoch nur zu, wenn sie glaubhaft machen, dass durch die Ausgliederung die Erfüllung ihrer Forderung gefährdet wird."
    },
    {
      "date": "2025-09-06",
      "id": "127471",
      "original_text": "Registerbekanntmachung nach dem Umwandlungsgesetz\nBayern Amtsgericht Aschaffenburg HRB 18209\nTerraTess-Event Service GmbH – Kleinostheim",
      "type": "Registerbekanntmachung nach dem Umwandlungsgesetz",
      "state": "Bayern",
      "amtsgericht": "Amtsgericht Aschaffenburg",
      "registernummer": "HRB 18209",
      "registerart": "HRB",
      "company_name": "TerraTess-Event Service GmbH",
      "company_seat": "Kleinostheim",
      "details": "06.09.2025 (Bekanntmachungsdatum)\n\nBayern Amtsgericht Aschaffenburg HRB 18209\nRegisterbekanntmachung nach dem Umwandlungsgesetz 05.09.2025 (Eintragungsdatum)\n\nTerraTess-Event Service GmbH\nGesellschaft mit beschränkter Haftung\nKleinostheim\n\nDen Gläubigern der an der Ausgliederung beteiligten Rechtsträger ist, wenn sie binnen sechs Monaten nach dem Tag, an dem die Eintragung der Ausgliederung in das Register des Sitzes desjenigen Rechtsträgers, dessen Gläubiger sie sind, nach §§ 125, 19 Abs. 3 UmwG als bekannt gemacht gilt, ihren Anspruch nach Grund und Höhe in Textform anmelden, Sicherheit zu leisten, soweit sie nicht Befriedigung verlangen können. Dieses Recht steht den Gläubigern jedoch nur zu, wenn sie glaubhaft machen, dass durch die Ausgliederung die Erfüllung ihrer Forderung gefährdet wird."
    },
    {
      "date": "2025-09-06",
      "id": "127472",
      "original_text": "Registerbekanntmachung nach dem Umwandlungsgesetz\nBayern Amtsgericht Würzburg HRB 12559\nMedia Airport GmbH – Marktheidenfeld",
      "type": "Registerbekanntmachung nach dem Umwandlungsgesetz",
      "state": "Bayern",
      "amtsgericht": "Amtsgericht Würzburg",
      "registernummer": "HRB 12559",
      "registerart": "HRB",
      "company_name": "Media Airport GmbH",
      "company_seat": "Marktheidenfeld",
      "details": "06.09.2025 (Bekanntmachungsdatum)\n\nBayern Amtsgericht Würzburg HRB 12559\nRegisterbekanntmachung nach dem Umwandlungsgesetz 05.09.2025 (Eintragungsdatum)\n\nMedia Airport GmbH\nGesellschaft mit beschränkter Haftung\nMarktheidenfeld\n\nDen Gläubigern der an der Verschmelzung beteiligten Rechtsträger ist, wenn sie binnen sechs Monaten nach dem Tag, an dem die Eintragung der Verschmelzung in das Register des Sitzes desjenigen Rechtsträgers, dessen Gläubiger sie sind, nach § 19 Abs. 3 UmwG als bekannt gemacht gilt, ihren Anspruch nach Grund und Höhe in Textform anmelden, Sicherheit zu leisten, soweit sie nicht Befriedigung verlangen können. Dieses Recht steht den Gläubigern jedoch nur zu, wenn sie glaubhaft machen, dass durch die Verschmelzung die Erfüllung ihrer Forderung gefährdet wird."
    },
    {
      "date": "2025-09-06",
      "id": "127473",
      "original_text": "Registerbekanntmachung nach dem Umwandlungsgesetz\nBayern Amtsgericht München HRB 231709\nVlyby Digital GmbH – München",
      "type": "Registerbekanntmachung nach dem Umwandlungsgesetz",
      "state": "Bayern",
      "amtsgericht": "Amtsgericht München",
      "registernummer": "HRB 231709",
      "registerart": "HRB",
      "company_name": "Vlyby Digital GmbH",
      "company_seat": "München",
      "details": "06.09.2025 (Bekanntmachungsdatum)\n\nBayern Amtsgericht München HRB 231709\nRegisterbekanntmachung nach dem Umwandlungsgesetz 05.09.2025 (Eintragungsdatum)\n\nVlyby Digital GmbH\nGesellschaft mit beschränkter Haftung\nMünchen\n\nDen Gläubigern der an der Verschmelzung beteiligten Rechtsträger ist, wenn sie binnen sechs Monaten nach dem Tag, an dem die Eintragung der Verschmelzung in das Register des Sitzes desjenigen Rechtsträgers, dessen Gläubiger sie sind, nach § 19 Abs. 3 UmwG als bekannt gemacht gilt, ihren Anspruch nach Grund und Höhe in Textform anmelden, Sicherheit zu leisten, soweit sie nicht Befriedigung verlangen können. Dieses Recht steht den Gläubigern jedoch nur zu, wenn sie glaubhaft machen, dass durch die Verschmelzung die Erfüllung ihrer Forderung gefährdet wird."
    },
    {
      "date": "2025-09-06",
      "id": "127474",
      "original_text": "Registerbekanntmachung nach dem Umwandlungsgesetz\nBayern Amtsgericht Augsburg HRB 35688\nWasserle Arbeitsbühnenvermietung GmbH – Kaufering",
      "type": "Registerbekanntmachung nach dem Umwandlungsgesetz",
      "state": "Bayern",
      "amtsgericht": "Amtsgericht Augsburg",
      "registernummer": "HRB 35688",
      "registerart": "HRB",
      "company_name": "Wasserle Arbeitsbühnenvermietung GmbH",
      "company_seat": "Kaufering",
      "details": "06.09.2025 (Bekanntmachungsdatum)\n\nBayern Amtsgericht Augsburg HRB 35688\nRegisterbekanntmachung nach dem Umwandlungsgesetz 05.09.2025 (Eintragungsdatum)\n\nWasserle Arbeitsbühnenvermietung GmbH\nGesellschaft mit beschränkter Haftung\nKaufering\n\nDen Gläubigern der an der Verschmelzung beteiligten Rechtsträger ist, wenn sie binnen sechs Monaten nach dem Tag, an dem die Eintragung der Verschmelzung in das Register des Sitzes desjenigen Rechtsträgers, dessen Gläubiger sie sind, nach § 19 Abs. 3 UmwG als bekannt gemacht gilt, ihren Anspruch nach Grund und Höhe in Textform anmelden, Sicherheit zu leisten, soweit sie nicht Befriedigung verlangen können. Dieses Recht steht den Gläubigern jedoch nur zu, wenn sie glaubhaft machen, dass durch die Verschmelzung die Erfüllung ihrer Forderung gefährdet wird."
    },
    {
      "date": "2025-09-06",
      "id": "127475",
      "original_text": "Registerbekanntmachung nach dem Umwandlungsgesetz\nBayern Amtsgericht München HRB 267019\nCoros Stolberger GmbH – Grünwald",
      "type": "Registerbekanntmachung nach dem Umwandlungsgesetz",
      "state": "Bayern",
      "amtsgericht": "Amtsgericht München",
      "registernummer": "HRB 267019",
      "registerart": "HRB",
      "company_name": "Coros Stolberger GmbH",
      "company_seat": "Grünwald",
      "details": "06.09.2025 (Bekanntmachungsdatum)\n\nBayern Amtsgericht München HRB 267019\nRegisterbekanntmachung nach dem Umwandlungsgesetz 05.09.2025 (Eintragungsdatum)\n\nCoros Stolberger GmbH\nGesellschaft mit beschränkter Haftung\nGrünwald\n\nDen Gläubigern der an der Verschmelzung beteiligten Rechtsträger ist, wenn sie binnen sechs Monaten nach dem Tag, an dem die Eintragung der Verschmelzung in das Register des Sitzes desjenigen Rechtsträgers, dessen Gläubiger sie sind, nach § 19 Abs. 3 UmwG als bekannt gemacht gilt, ihren Anspruch nach Grund und Höhe in Textform anmelden, Sicherheit zu leisten, soweit sie nicht Befriedigung verlangen können. Dieses Recht steht den Gläubigern jedoch nur zu, wenn sie glaubhaft machen, dass durch die Verschmelzung die Erfüllung ihrer Forderung gefährdet wird."
    },
    {
      "date": "2025-09-06",
      "id": "127476",
      "original_text": "Registerbekanntmachung nach dem Umwandlungsgesetz\nBayern Amtsgericht Augsburg HRB 23129\nswissplast Vakuform GmbH – Diedorf",
      "type": "Registerbekanntmachung nach dem Umwandlungsgesetz",
      "state": "Bayern",
      "amtsgericht": "Amtsgericht Augsburg",
      "registernummer": "HRB 23129",
      "registerart": "HRB",
      "company_name": "swissplast Vakuform GmbH",
      "company_seat": "Diedorf",
      "details": "06.09.2025 (Bekanntmachungsdatum)\n\nBayern Amtsgericht Augsburg HRB 23129\nRegisterbekanntmachung nach dem Umwandlungsgesetz 05.09.2025 (Eintragungsdatum)\n\nswissplast Vakuform GmbH\nGesellschaft mit beschränkter Haftung\nDiedorf\n\nDen Gläubigern der an der Verschmelzung beteiligten Rechtsträger ist, wenn sie binnen sechs Monaten nach dem Tag, an dem die Eintragung der Verschmelzung in das Register des Sitzes desjenigen Rechtsträgers, dessen Gläubiger sie sind, nach § 19 Abs. 3 UmwG als bekannt gemacht gilt, ihren Anspruch nach Grund und Höhe in Textform anmelden, Sicherheit zu leisten, soweit sie nicht Befriedigung verlangen können. Dieses Recht steht den Gläubigern jedoch nur zu, wenn sie glaubhaft machen, dass durch die Verschmelzung die Erfüllung ihrer Forderung gefährdet wird."
    },
    {
      "date": "2025-09-06",
      "id": "127477",
      "original_text": "Registerbekanntmachung nach dem Umwandlungsgesetz\nBayern Amtsgericht Kempten (Allgäu) HRA 8635\nDieter Conle Immobilienverwaltung GmbH & Co. KG – Sonthofen",
      "type": "Registerbekanntmachung nach dem Umwandlungsgesetz",
      "state": "Bayern",
      "amtsgericht": "Amtsgericht Kempten (Allgäu)",
      "registernummer": "HRA 8635",
      "registerart": "HRA",
      "company_name": "Dieter Conle Immobilienverwaltung GmbH & Co. KG",
      "company_seat": "Sonthofen",
      "details": "06.09.2025 (Bekanntmachungsdatum)\n\nBayern Amtsgericht Kempten (Allgäu) HRA 8635\nRegisterbekanntmachung nach dem Umwandlungsgesetz 04.09.2025 (Eintragungsdatum)\n\nDieter Conle Immobilienverwaltung GmbH & Co. KG\nKommanditgesellschaft\nSonthofen\n\nDen Gläubigern des formwechselnden Rechtsträgers ist, wenn sie binnen sechs Monaten nach dem Tag, an dem die Eintragung des Formwechsels nach § 201 UmwG als bekannt gemacht gilt, ihren Anspruch nach Grund und Höhe in Textform anmelden, Sicherheit zu leisten, soweit sie nicht Befriedigung verlangen können. Dieses Recht steht den Gläubigern jedoch nur zu, wenn sie glaubhaft machen, dass durch den Formwechsel die Erfüllung ihrer Forderung gefährdet wird."
    },
    {
      "date": "2025-09-06",
      "id": "127478",
      "original_text": "Registerbekanntmachung nach dem Umwandlungsgesetz\nBayern Amtsgericht Bamberg GsR 275\nM+L GalaBau eGbR – Haßfurt",
      "type": "Registerbekanntmachung nach dem Umwandlungsgesetz",
      "state": "Bayern",
      "amtsgericht": "Amtsgericht Bamberg",
      "registernummer": "GsR 275",
      "registerart": "GsR",
      "company_name": "M+L GalaBau eGbR",
      "company_seat": "Haßfurt",
      "details": "06.09.2025 (Bekanntmachungsdatum)\n\nBayern Amtsgericht Bamberg GsR 275\nRegisterbekanntmachung nach dem Umwandlungsgesetz 05.09.2025 (Eintragungsdatum)\n\nM+L GalaBau eGbR\nGesellschaft bürgerlichen Rechts\nHaßfurt\n\nDen Gläubigern des formwechselnden Rechtsträgers ist, wenn sie binnen sechs Monaten nach dem Tag, an dem die Eintragung des Formwechsels nach § 201 UmwG als bekannt gemacht gilt, ihren Anspruch nach Grund und Höhe in Textform anmelden, Sicherheit zu leisten, soweit sie nicht Befriedigung verlangen können. Dieses Recht steht den Gläubigern jedoch nur zu, wenn sie glaubhaft machen, dass durch den Formwechsel die Erfüllung ihrer Forderung gefährdet wird."
    },
    {
      "date": "2025-09-06",
      "id": "127479",
      "original_text": "Registerbekanntmachung nach dem Umwandlungsgesetz\nBayern Amtsgericht Kempten (Allgäu) HRB 18407\nDieter Conle Immobilienverwaltung GmbH – Sonthofen",
      "type": "Registerbekanntmachung nach dem Umwandlungsgesetz",
      "state": "Bayern",
      "amtsgericht": "Amtsgericht Kempten (Allgäu)",
      "registernummer": "HRB 18407",
      "registerart": "HRB",
      "company_name": "Dieter Conle Immobilienverwaltung GmbH",
      "company_seat": "Sonthofen",
      "details": "06.09.2025 (Bekanntmachungsdatum)\n\nBayern Amtsgericht Kempten (Allgäu) HRB 18407\nRegisterbekanntmachung nach dem Umwandlungsgesetz 04.09.2025 (Eintragungsdatum)\n\nDieter Conle Immobilienverwaltung GmbH\nGesellschaft mit beschränkter Haftung\nSonthofen\n\nDen Gläubigern des formwechselnden Rechtsträgers ist, wenn sie binnen sechs Monaten nach dem Tag, an dem die Eintragung des Formwechsels nach § 201 UmwG als bekannt gemacht gilt, ihren Anspruch nach Grund und Höhe in Textform anmelden, Sicherheit zu leisten, soweit sie nicht Befriedigung verlangen können. Dieses Recht steht den Gläubigern jedoch nur zu, wenn sie glaubhaft machen, dass durch den Formwechsel die Erfüllung ihrer Forderung gefährdet wird."
    },
    {
      "date": "2025-09-06",
      "id": "127480",
      "original_text": "Registerbekanntmachung nach dem Umwandlungsgesetz\nNiedersachsen Amtsgericht Hildesheim HRA 203109\nTim Hasse Malerfachbetrieb e.Kfm. – Lamspringe",
      "type": "Registerbekanntmachung nach dem Umwandlungsgesetz",
      "state": "Niedersachsen",
      "amtsgericht": "Amtsgericht Hildesheim",
      "registernummer": "HRA 203109",
      "registerart": "HRA",
      "company_name": "Tim Hasse Malerfachbetrieb e.Kfm.",
      "company_seat": "Lamspringe",
      "details": "06.09.2025 (Bekanntmachungsdatum)\n\nNiedersachsen Amtsgericht Hildesheim HRA 203109\nRegisterbekanntmachung nach dem Umwandlungsgesetz 06.09.2025 (Eintragungsdatum)\n\nTim Hasse Malerfachbetrieb e.Kfm.\nEinzelkaufmann / Einzelkauffrau\nLamspringe\n\nDen Gläubigern der an der Ausgliederung beteiligten Rechtsträger ist, wenn sie binnen sechs Monaten nach dem Tag, an dem die Eintragung der Ausgliederung in das Register des Sitzes desjenigen Rechtsträgers, dessen Gläubiger sie sind, nach § 19 Abs. 3 UmwG als bekannt gemacht gilt, ihren Anspruch nach Grund und Höhe schriftlich anmelden, Sicherheit zu leisten, soweit sie nicht Befriedigung verlangen können. Dieses Recht steht den Gläubigern jedoch nur zu, wenn sie glaubhaft machen, dass durch die Ausgliederung die Erfüllung der Forderung gefährdet wird."
    },
    {
      "date": "2025-09-06",
      "id": "127481",
      "original_text": "Registerbekanntmachung nach dem Umwandlungsgesetz\nNiedersachsen Amtsgericht Hildesheim HRB 210050\nTH Maler GmbH – Lamspringe OT Sehlem",
      "type": "Registerbekanntmachung nach dem Umwandlungsgesetz",
      "state": "Niedersachsen",
      "amtsgericht": "Amtsgericht Hildesheim",
      "registernummer": "HRB 210050",
      "registerart": "HRB",
      "company_name": "TH Maler GmbH",
      "company_seat": "Lamspringe OT Sehlem",
      "details": "06.09.2025 (Bekanntmachungsdatum)\n\nNiedersachsen Amtsgericht Hildesheim HRB 210050\nRegisterbekanntmachung nach dem Umwandlungsgesetz 06.09.2025 (Eintragungsdatum)\n\nTH Maler GmbH\nGesellschaft mit beschränkter Haftung\nLamspringe OT Sehlem\n\nDen Gläubigern der an der Ausgliederung beteiligten Rechtsträger ist, wenn sie binnen sechs Monaten nach dem Tag, an dem die Eintragung der Ausgliederung in das Register des Sitzes desjenigen Rechtsträgers, dessen Gläubiger sie sind, nach § 19 Abs. 3 UmwG als bekannt gemacht gilt, ihren Anspruch nach Grund und Höhe schriftlich anmelden, Sicherheit zu leisten, soweit sie nicht Befriedigung verlangen können. Dieses Recht steht den Gläubigern jedoch nur zu, wenn sie glaubhaft machen, dass durch die Ausgliederung die Erfüllung der Forderung gefährdet wird."
    },
    {
      "date": "2025-09-06",
      "id": "127482",
      "original_text": "Registerbekanntmachung nach dem Umwandlungsgesetz\nNordrhein-Westfalen Amtsgericht Bad Oeynhausen HRB 13496\nExklusives Küchendesign GmbH – Löhne",
      "type": "Registerbekanntmachung nach dem Umwandlungsgesetz",
      "state": "Nordrhein-Westfalen",
      "amtsgericht": "Amtsgericht Bad Oeynhausen",
      "registernummer": "HRB 13496",
      "registerart": "HRB",
      "company_name": "Exklusives Küchendesign GmbH",
      "company_seat": "Löhne",
      "details": "06.09.2025 (Bekanntmachungsdatum)\n\nNordrhein-Westfalen Amtsgericht Bad Oeynhausen HRB 13496\nRegisterbekanntmachung nach dem Umwandlungsgesetz 02.09.2025 (Eintragungsdatum)\n\nExklusives Küchendesign GmbH\nGesellschaft mit beschränkter Haftung\nLöhne\n\nDen Gläubigern der an der Verschmelzung beteiligten Rechtsträger ist, wenn sie binnen sechs Monaten nach dem Tag, an dem die Eintragung der Verschmelzung in das Register des Sitzes desjenigen Rechtsträgers, dessen Gläubiger sie sind, nach § 19 Absatz 3 UmwG als bekanntgemacht gilt, ihren Anspruch nach Grund und Höhe schriftlich anmelden, Sicherheit zu leisten, soweit sie nicht Befriedigung verlangen können. Dieses Recht steht den Gläubigern jedoch nur zu, wenn sie glaubhaft machen, dass durch die Verschmelzung die Erfüllung ihrer Forderung gefährdet wird."
    },
    {
      "date": "2025-09-06",
      "id": "127483",
      "original_text": "Registerbekanntmachung nach dem Umwandlungsgesetz\nNordrhein-Westfalen Amtsgericht Bad Oeynhausen HRB 20480\nporta.immo GmbH – Porta Westfalica",
      "type": "Registerbekanntmachung nach dem Umwandlungsgesetz",
      "state": "Nordrhein-Westfalen",
      "amtsgericht": "Amtsgericht Bad Oeynhausen",
      "registernummer": "HRB 20480",
      "registerart": "HRB",
      "company_name": "porta.immo GmbH",
      "company_seat": "Porta Westfalica",
      "details": "06.09.2025 (Bekanntmachungsdatum)\n\nNordrhein-Westfalen Amtsgericht Bad Oeynhausen HRB 20480\nRegisterbekanntmachung nach dem Umwandlungsgesetz 06.09.2025 (Eintragungsdatum)\n\nporta.immo GmbH\nGesellschaft mit beschränkter Haftung\nPorta Westfalica\n\nDen Gläubigern der an der formwechselnden Umwandlung beteiligten Rechtsträger ist, wenn sie binnen sechs Monaten nach dem Tag, an dem die Eintragung der formwechselnden Umwandlung in das Register des Sitzes desjenigen Rechtsträgers, dessen Gläubiger sie sind, nach § 19 Absatz 3 UmwG als bekanntgemacht gilt, ihren Anspruch nach Grund und Höhe schriftlich anmelden, Sicherheit zu leisten, soweit sie nicht Befriedigung verlangen können. Dieses Recht steht den Gläubigern jedoch nur zu, wenn sie glaubhaft machen, dass durch die formwechselnden Umwandlung die Erfüllung ihrer Forderung gefährdet wird."
    },
    {
      "date": "2025-09-06",
      "id": "127484",
      "original_text": "Registerbekanntmachung nach dem Umwandlungsgesetz\nNordrhein-Westfalen Amtsgericht Bad Oeynhausen HRB 13059\nDAYCO Immobilien GmbH – Porta Westfalica",
      "type": "Registerbekanntmachung nach dem Umwandlungsgesetz",
      "state": "Nordrhein-Westfalen",
      "amtsgericht": "Amtsgericht Bad Oeynhausen",
      "registernummer": "HRB 13059",
      "registerart": "HRB",
      "company_name": "DAYCO Immobilien GmbH",
      "company_seat": "Porta Westfalica",
      "details": "06.09.2025 (Bekanntmachungsdatum)\n\nNordrhein-Westfalen Amtsgericht Bad Oeynhausen HRB 13059\nRegisterbekanntmachung nach dem Umwandlungsgesetz 06.09.2025 (Eintragungsdatum)\n\nDAYCO Immobilien GmbH\nGesellschaft mit beschränkter Haftung\nPorta Westfalica\n\nDen Gläubigern der an der Verschmelzung beteiligten Rechtsträger ist, wenn sie binnen sechs Monaten nach dem Tag, an dem die Eintragung der Verschmelzung in das Register des Sitzes desjenigen Rechtsträgers, dessen Gläubiger sie sind, nach § 19 Absatz 3 UmwG als bekanntgemacht gilt, ihren Anspruch nach Grund und Höhe schriftlich anmelden, Sicherheit zu leisten, soweit sie nicht Befriedigung verlangen können. Dieses Recht steht den Gläubigern jedoch nur zu, wenn sie glaubhaft machen, dass durch die Verschmelzung die Erfüllung ihrer Forderung gefährdet wird."
    },
    {
      "date": "2025-09-06",
      "id": "127485",
      "original_text": "Registerbekanntmachung nach dem Umwandlungsgesetz\nNordrhein-Westfalen Amtsgericht Köln HRB 101126\nnexum Beteiligungs GmbH – Köln",
      "type": "Registerbekanntmachung nach dem Umwandlungsgesetz",
      "state": "Nordrhein-Westfalen",
      "amtsgericht": "Amtsgericht Köln",
      "registernummer": "HRB 101126",
      "registerart": "HRB",
      "company_name": "nexum Beteiligungs GmbH",
      "company_seat": "Köln",
      "details": "06.09.2025 (Bekanntmachungsdatum)\n\nNordrhein-Westfalen Amtsgericht Köln HRB 101126\nRegisterbekanntmachung nach dem Umwandlungsgesetz 06.09.2025 (Eintragungsdatum)\n\nnexum Beteiligungs GmbH\nGesellschaft mit beschränkter Haftung\nKöln\n\nDen Gläubigern der an der Verschmelzung beteiligten Rechtsträger ist, wenn sie binnen sechs Monaten nach dem Tag, an dem die Eintragung der Verschmelzung in das Register des Sitzes desjenigen Rechtsträgers, dessen Gläubiger sie sind, nach § 19 Absatz 3 UmwG als bekanntgemacht gilt, ihren Anspruch nach Grund und Höhe schriftlich anmelden, Sicherheit zu leisten, soweit sie nicht Befriedigung verlangen können. Dieses Recht steht den Gläubigern jedoch nur zu, wenn sie glaubhaft machen, dass durch die Verschmelzung die Erfüllung ihrer Forderung gefährdet wird."
    },
    {
      "date": "2025-09-06",
      "id": "127486",
      "original_text": "Registerbekanntmachung nach dem Umwandlungsgesetz\nNordrhein-Westfalen Amtsgericht Münster HRB 15163\nJosef Vernhold Nachfolger Verwaltungs-GmbH – Münster",
      "type": "Registerbekanntmachung nach dem Umwandlungsgesetz",
      "state": "Nordrhein-Westfalen",
      "amtsgericht": "Amtsgericht Münster",
      "registernummer": "HRB 15163",
      "registerart": "HRB",
      "company_name": "Josef Vernhold Nachfolger Verwaltungs-GmbH",
      "company_seat": "Münster",
      "details": "06.09.2025 (Bekanntmachungsdatum)\n\nNordrhein-Westfalen Amtsgericht Münster HRB 15163\nRegisterbekanntmachung nach dem Umwandlungsgesetz 06.09.2025 (Eintragungsdatum)\n\nJosef Vernhold Nachfolger Verwaltungs-GmbH\nGesellschaft mit beschränkter Haftung\nMünster\n\nDen Gläubigern der an der Verschmelzung beteiligten Rechtsträger ist, wenn sie binnen sechs Monaten nach dem Tag, an dem die Eintragung der Verschmelzung in das Register des Sitzes desjenigen Rechtsträgers, dessen Gläubiger sie sind, nach § 19 Absatz 3 UmwG als bekanntgemacht gilt, ihren Anspruch nach Grund und Höhe schriftlich anmelden, Sicherheit zu leisten, soweit sie nicht Befriedigung verlangen können. Dieses Recht steht den Gläubigern jedoch nur zu, wenn sie glaubhaft machen, dass durch die Verschmelzung die Erfüllung ihrer Forderung gefährdet wird."
    },
    {
      "date": "2025-09-06",
      "id": "127487",
      "original_text": "Registerbekanntmachung nach dem Umwandlungsgesetz\nNordrhein-Westfalen Amtsgericht Bad Oeynhausen HRB 19373\nOWL-Wohnbau GmbH – Porta Westfalica",
      "type": "Registerbekanntmachung nach dem Umwandlungsgesetz",
      "state": "Nordrhein-Westfalen",
      "amtsgericht": "Amtsgericht Bad Oeynhausen",
      "registernummer": "HRB 19373",
      "registerart": "HRB",
      "company_name": "OWL-Wohnbau GmbH",
      "company_seat": "Porta Westfalica",
      "details": "06.09.2025 (Bekanntmachungsdatum)\n\nNordrhein-Westfalen Amtsgericht Bad Oeynhausen HRB 19373\nRegisterbekanntmachung nach dem Umwandlungsgesetz 06.09.2025 (Eintragungsdatum)\n\nOWL-Wohnbau GmbH\nGesellschaft mit beschränkter Haftung\nPorta Westfalica\n\nDen Gläubigern der an der Verschmelzung beteiligten Rechtsträger ist, wenn sie binnen sechs Monaten nach dem Tag, an dem die Eintragung der Verschmelzung in das Register des Sitzes desjenigen Rechtsträgers, dessen Gläubiger sie sind, nach § 19 Absatz 3 UmwG als bekanntgemacht gilt, ihren Anspruch nach Grund und Höhe schriftlich anmelden, Sicherheit zu leisten, soweit sie nicht Befriedigung verlangen können. Dieses Recht steht den Gläubigern jedoch nur zu, wenn sie glaubhaft machen, dass durch die Verschmelzung die Erfüllung ihrer Forderung gefährdet wird."
    },
    {
      "date": "2025-09-06",
      "id": "127488",
      "original_text": "Registerbekanntmachung nach dem Umwandlungsgesetz\nNordrhein-Westfalen Amtsgericht Münster HRB 2543\nGrundhoff-Orthopädietechnik GmbH – Münster",
      "type": "Registerbekanntmachung nach dem Umwandlungsgesetz",
      "state": "Nordrhein-Westfalen",
      "amtsgericht": "Amtsgericht Münster",
      "registernummer": "HRB 2543",
      "registerart": "HRB",
      "company_name": "Grundhoff-Orthopädietechnik GmbH",
      "company_seat": "Münster",
      "details": "06.09.2025 (Bekanntmachungsdatum)\n\nNordrhein-Westfalen Amtsgericht Münster HRB 2543\nRegisterbekanntmachung nach dem Umwandlungsgesetz 06.09.2025 (Eintragungsdatum)\n\nGrundhoff-Orthopädietechnik GmbH\nGesellschaft mit beschränkter Haftung\nMünster\n\nDen Gläubigern der an der Verschmelzung beteiligten Rechtsträger ist, wenn sie binnen sechs Monaten nach dem Tag, an dem die Eintragung der Verschmelzung in das Register des Sitzes desjenigen Rechtsträgers, dessen Gläubiger sie sind, nach § 19 Absatz 3 UmwG als bekanntgemacht gilt, ihren Anspruch nach Grund und Höhe schriftlich anmelden, Sicherheit zu leisten, soweit sie nicht Befriedigung verlangen können. Dieses Recht steht den Gläubigern jedoch nur zu, wenn sie glaubhaft machen, dass durch die Verschmelzung die Erfüllung ihrer Forderung gefährdet wird."
    }
  ]
}