{
  "date": "2025-09-12",
  "date_of_scrape": "2025-10-27T07:32:12.662Z",
  "tool_version": "0.2.0",
  "number_of_announcements": 293,
  "announcements": [
    {
      "date": "2025-09-12",
      "id": "128912",
      "original_text": "Registerbekanntmachung nach dem Umwandlungsgesetz\nBayern Amtsgericht Landshut HRA 12917\nStegmüller Grundstücke GmbH & Co. KG – Arnstorf",
      "type": "Registerbekanntmachung nach dem Umwandlungsgesetz",
      "state": "Bayern",
      "amtsgericht": "Amtsgericht Landshut",
      "registernummer": "HRA 12917",
      "registerart": "HRA",
      "company_name": "Stegmüller Grundstücke GmbH & Co. KG",
      "company_seat": "Arnstorf",
      "details": "12.09.2025 (Bekanntmachungsdatum)\n\nBayern Amtsgericht Landshut HRA 12917\nRegisterbekanntmachung nach dem Umwandlungsgesetz 11.09.2025 (Eintragungsdatum)\n\nStegmüller Grundstücke GmbH & Co. KG\nKommanditgesellschaft\nArnstorf\n\nDen Gläubigern der an der Ausgliederung beteiligten Rechtsträger ist, wenn sie binnen sechs Monaten nach dem Tag, an dem die Eintragung der Ausgliederung in das Register des Sitzes desjenigen Rechtsträgers, dessen Gläubiger sie sind, nach §§ 125, 19 Abs. 3 UmwG als bekannt gemacht gilt, ihren Anspruch nach Grund und Höhe in Textform anmelden, Sicherheit zu leisten, soweit sie nicht Befriedigung verlangen können. Dieses Recht steht den Gläubigern jedoch nur zu, wenn sie glaubhaft machen, dass durch die Ausgliederung die Erfüllung ihrer Forderung gefährdet wird."
    },
    {
      "date": "2025-09-12",
      "id": "128913",
      "original_text": "Registerbekanntmachung nach dem Umwandlungsgesetz\nBayern Amtsgericht München HRB 137216\nKMS Beratungs- und Verwaltungs GmbH – Tegernsee",
      "type": "Registerbekanntmachung nach dem Umwandlungsgesetz",
      "state": "Bayern",
      "amtsgericht": "Amtsgericht München",
      "registernummer": "HRB 137216",
      "registerart": "HRB",
      "company_name": "KMS Beratungs- und Verwaltungs GmbH",
      "company_seat": "Tegernsee",
      "details": "12.09.2025 (Bekanntmachungsdatum)\n\nBayern Amtsgericht München HRB 137216\nRegisterbekanntmachung nach dem Umwandlungsgesetz 11.09.2025 (Eintragungsdatum)\n\nKMS Beratungs- und Verwaltungs GmbH\nGesellschaft mit beschränkter Haftung\nTegernsee\n\nDen Gläubigern der an der Verschmelzung beteiligten Rechtsträger ist, wenn sie binnen sechs Monaten nach dem Tag, an dem die Eintragung der Verschmelzung in das Register des Sitzes desjenigen Rechtsträgers, dessen Gläubiger sie sind, nach § 19 Abs. 3 UmwG als bekannt gemacht gilt, ihren Anspruch nach Grund und Höhe in Textform anmelden, Sicherheit zu leisten, soweit sie nicht Befriedigung verlangen können. Dieses Recht steht den Gläubigern jedoch nur zu, wenn sie glaubhaft machen, dass durch die Verschmelzung die Erfüllung ihrer Forderung gefährdet wird."
    },
    {
      "date": "2025-09-12",
      "id": "128914",
      "original_text": "Registerbekanntmachung nach dem Umwandlungsgesetz\nBayern Amtsgericht München HRB 239170\nWöhrl Beta Beteiligungs GmbH – München",
      "type": "Registerbekanntmachung nach dem Umwandlungsgesetz",
      "state": "Bayern",
      "amtsgericht": "Amtsgericht München",
      "registernummer": "HRB 239170",
      "registerart": "HRB",
      "company_name": "Wöhrl Beta Beteiligungs GmbH",
      "company_seat": "München",
      "details": "12.09.2025 (Bekanntmachungsdatum)\n\nBayern Amtsgericht München HRB 239170\nRegisterbekanntmachung nach dem Umwandlungsgesetz 11.09.2025 (Eintragungsdatum)\n\nWöhrl Beta Beteiligungs GmbH\nGesellschaft mit beschränkter Haftung\nMünchen\n\nDen Gläubigern der an der Verschmelzung beteiligten Rechtsträger ist, wenn sie binnen sechs Monaten nach dem Tag, an dem die Eintragung der Verschmelzung in das Register des Sitzes desjenigen Rechtsträgers, dessen Gläubiger sie sind, nach § 19 Abs. 3 UmwG als bekannt gemacht gilt, ihren Anspruch nach Grund und Höhe in Textform anmelden, Sicherheit zu leisten, soweit sie nicht Befriedigung verlangen können. Dieses Recht steht den Gläubigern jedoch nur zu, wenn sie glaubhaft machen, dass durch die Verschmelzung die Erfüllung ihrer Forderung gefährdet wird. Den Gläubigern der an der Verschmelzung beteiligten Rechtsträger ist, wenn sie binnen sechs Monaten nach dem Tag, an dem die Eintragung der Verschmelzung in das Register des Sitzes desjenigen Rechtsträgers, dessen Gläubiger sie sind, nach § 19 Abs. 3 UmwG als bekannt gemacht gilt, ihren Anspruch nach Grund und Höhe in Textform anmelden, Sicherheit zu leisten, soweit sie nicht Befriedigung verlangen können. Dieses Recht steht den Gläubigern jedoch nur zu, wenn sie glaubhaft machen, dass durch die Verschmelzung die Erfüllung ihrer Forderung gefährdet wird."
    },
    {
      "date": "2025-09-12",
      "id": "128915",
      "original_text": "Registerbekanntmachung nach dem Umwandlungsgesetz\nBayern Amtsgericht München HRA 71082\nDostthaler e.K. – Valley",
      "type": "Registerbekanntmachung nach dem Umwandlungsgesetz",
      "state": "Bayern",
      "amtsgericht": "Amtsgericht München",
      "registernummer": "HRA 71082",
      "registerart": "HRA",
      "company_name": "Dostthaler e.K.",
      "company_seat": "Valley",
      "details": "12.09.2025 (Bekanntmachungsdatum)\n\nBayern Amtsgericht München HRA 71082\nRegisterbekanntmachung nach dem Umwandlungsgesetz 11.09.2025 (Eintragungsdatum)\n\nDostthaler e.K.\nEinzelkaufmann / Einzelkauffrau\nValley\n\nDen Gläubigern der an der Ausgliederung beteiligten Rechtsträger ist, wenn sie binnen sechs Monaten nach dem Tag, an dem die Eintragung der Ausgliederung in das Register des Sitzes desjenigen Rechtsträgers, dessen Gläubiger sie sind, nach §§ 125, 19 Abs. 3 UmwG als bekannt gemacht gilt, ihren Anspruch nach Grund und Höhe in Textform anmelden, Sicherheit zu leisten, soweit sie nicht Befriedigung verlangen können. Dieses Recht steht den Gläubigern jedoch nur zu, wenn sie glaubhaft machen, dass durch die Ausgliederung die Erfüllung ihrer Forderung gefährdet wird."
    },
    {
      "date": "2025-09-12",
      "id": "128916",
      "original_text": "Registerbekanntmachung nach dem Umwandlungsgesetz\nBayern Amtsgericht München HRB 287169\nMöhler + Partner Ingenieure GmbH – München",
      "type": "Registerbekanntmachung nach dem Umwandlungsgesetz",
      "state": "Bayern",
      "amtsgericht": "Amtsgericht München",
      "registernummer": "HRB 287169",
      "registerart": "HRB",
      "company_name": "Möhler + Partner Ingenieure GmbH",
      "company_seat": "München",
      "details": "12.09.2025 (Bekanntmachungsdatum)\n\nBayern Amtsgericht München HRB 287169\nRegisterbekanntmachung nach dem Umwandlungsgesetz 11.09.2025 (Eintragungsdatum)\n\nMöhler + Partner Ingenieure GmbH\nGesellschaft mit beschränkter Haftung\nMünchen\n\nDen Gläubigern der an der Verschmelzung beteiligten Rechtsträger ist, wenn sie binnen sechs Monaten nach dem Tag, an dem die Eintragung der Verschmelzung in das Register des Sitzes desjenigen Rechtsträgers, dessen Gläubiger sie sind, nach § 19 Abs. 3 UmwG als bekannt gemacht gilt, ihren Anspruch nach Grund und Höhe in Textform anmelden, Sicherheit zu leisten, soweit sie nicht Befriedigung verlangen können. Dieses Recht steht den Gläubigern jedoch nur zu, wenn sie glaubhaft machen, dass durch die Verschmelzung die Erfüllung ihrer Forderung gefährdet wird."
    },
    {
      "date": "2025-09-12",
      "id": "128917",
      "original_text": "Registerbekanntmachung nach dem Umwandlungsgesetz\nBayern Amtsgericht Augsburg HRB 16791\nPflasterbau Oettingen GmbH – Deiningen",
      "type": "Registerbekanntmachung nach dem Umwandlungsgesetz",
      "state": "Bayern",
      "amtsgericht": "Amtsgericht Augsburg",
      "registernummer": "HRB 16791",
      "registerart": "HRB",
      "company_name": "Pflasterbau Oettingen GmbH",
      "company_seat": "Deiningen",
      "details": "12.09.2025 (Bekanntmachungsdatum)\n\nBayern Amtsgericht Augsburg HRB 16791\nRegisterbekanntmachung nach dem Umwandlungsgesetz 11.09.2025 (Eintragungsdatum)\n\nPflasterbau Oettingen GmbH\nGesellschaft mit beschränkter Haftung\nDeiningen\n\nDen Gläubigern der an der Verschmelzung beteiligten Rechtsträger ist, wenn sie binnen sechs Monaten nach dem Tag, an dem die Eintragung der Verschmelzung in das Register des Sitzes desjenigen Rechtsträgers, dessen Gläubiger sie sind, nach § 19 Abs. 3 UmwG als bekannt gemacht gilt, ihren Anspruch nach Grund und Höhe in Textform anmelden, Sicherheit zu leisten, soweit sie nicht Befriedigung verlangen können. Dieses Recht steht den Gläubigern jedoch nur zu, wenn sie glaubhaft machen, dass durch die Verschmelzung die Erfüllung ihrer Forderung gefährdet wird."
    },
    {
      "date": "2025-09-12",
      "id": "128918",
      "original_text": "Registerbekanntmachung nach dem Umwandlungsgesetz\nBayern Amtsgericht München HRB 66889\nVISO-CAR GmbH – München",
      "type": "Registerbekanntmachung nach dem Umwandlungsgesetz",
      "state": "Bayern",
      "amtsgericht": "Amtsgericht München",
      "registernummer": "HRB 66889",
      "registerart": "HRB",
      "company_name": "VISO-CAR GmbH",
      "company_seat": "München",
      "details": "12.09.2025 (Bekanntmachungsdatum)\n\nBayern Amtsgericht München HRB 66889\nRegisterbekanntmachung nach dem Umwandlungsgesetz 11.09.2025 (Eintragungsdatum)\n\nVISO-CAR GmbH\nGesellschaft mit beschränkter Haftung\nMünchen\n\nDen Gläubigern der an der Verschmelzung beteiligten Rechtsträger ist, wenn sie binnen sechs Monaten nach dem Tag, an dem die Eintragung der Verschmelzung in das Register des Sitzes desjenigen Rechtsträgers, dessen Gläubiger sie sind, nach § 19 Abs. 3 UmwG als bekannt gemacht gilt, ihren Anspruch nach Grund und Höhe in Textform anmelden, Sicherheit zu leisten, soweit sie nicht Befriedigung verlangen können. Dieses Recht steht den Gläubigern jedoch nur zu, wenn sie glaubhaft machen, dass durch die Verschmelzung die Erfüllung ihrer Forderung gefährdet wird."
    },
    {
      "date": "2025-09-12",
      "id": "128919",
      "original_text": "Registerbekanntmachung nach dem Umwandlungsgesetz\nBayern Amtsgericht Augsburg HRA 22021\nVersicherungsmakler Stölzl GmbH & Co. KG – Sielenbach",
      "type": "Registerbekanntmachung nach dem Umwandlungsgesetz",
      "state": "Bayern",
      "amtsgericht": "Amtsgericht Augsburg",
      "registernummer": "HRA 22021",
      "registerart": "HRA",
      "company_name": "Versicherungsmakler Stölzl GmbH & Co. KG",
      "company_seat": "Sielenbach",
      "details": "12.09.2025 (Bekanntmachungsdatum)\n\nBayern Amtsgericht Augsburg HRA 22021\nRegisterbekanntmachung nach dem Umwandlungsgesetz 11.09.2025 (Eintragungsdatum)\n\nVersicherungsmakler Stölzl GmbH & Co. KG\nKommanditgesellschaft\nSielenbach\n\nDen Gläubigern der an der Ausgliederung beteiligten Rechtsträger ist, wenn sie binnen sechs Monaten nach dem Tag, an dem die Eintragung der Ausgliederung in das Register des Sitzes desjenigen Rechtsträgers, dessen Gläubiger sie sind, nach §§ 125, 19 Abs. 3 UmwG als bekannt gemacht gilt, ihren Anspruch nach Grund und Höhe in Textform anmelden, Sicherheit zu leisten, soweit sie nicht Befriedigung verlangen können. Dieses Recht steht den Gläubigern jedoch nur zu, wenn sie glaubhaft machen, dass durch die Ausgliederung die Erfüllung ihrer Forderung gefährdet wird."
    },
    {
      "date": "2025-09-12",
      "id": "128920",
      "original_text": "Registerbekanntmachung nach dem Umwandlungsgesetz\nBayern Amtsgericht Coburg HRA 5624\nAlexandra Zaß e.K. – Michelau",
      "type": "Registerbekanntmachung nach dem Umwandlungsgesetz",
      "state": "Bayern",
      "amtsgericht": "Amtsgericht Coburg",
      "registernummer": "HRA 5624",
      "registerart": "HRA",
      "company_name": "Alexandra Zaß e.K.",
      "company_seat": "Michelau",
      "details": "12.09.2025 (Bekanntmachungsdatum)\n\nBayern Amtsgericht Coburg HRA 5624\nRegisterbekanntmachung nach dem Umwandlungsgesetz 11.09.2025 (Eintragungsdatum)\n\nAlexandra Zaß e.K.\nEinzelkaufmann / Einzelkauffrau\nMichelau\n\nDen Gläubigern der an der Ausgliederung beteiligten Rechtsträger ist, wenn sie binnen sechs Monaten nach dem Tag, an dem die Eintragung der Ausgliederung in das Register des Sitzes desjenigen Rechtsträgers, dessen Gläubiger sie sind, nach §§ 125, 19 Abs. 3 UmwG als bekannt gemacht gilt, ihren Anspruch nach Grund und Höhe in Textform anmelden, Sicherheit zu leisten, soweit sie nicht Befriedigung verlangen können. Dieses Recht steht den Gläubigern jedoch nur zu, wenn sie glaubhaft machen, dass durch die Ausgliederung die Erfüllung ihrer Forderung gefährdet wird."
    },
    {
      "date": "2025-09-12",
      "id": "128921",
      "original_text": "Löschungsankündigung\nBayern Amtsgericht München HRB 175814\nImmoLounge Verwaltungs GmbH – München",
      "type": "Löschungsankündigung",
      "state": "Bayern",
      "amtsgericht": "Amtsgericht München",
      "registernummer": "HRB 175814",
      "registerart": "HRB",
      "company_name": "ImmoLounge Verwaltungs GmbH",
      "company_seat": "München",
      "details": "12.09.2025 (Bekanntmachungsdatum)\n\nBayern Amtsgericht München HRB 175814\nLöschungsankündigung 11.09.2025 (Eintragungsdatum)\n\nImmoLounge Verwaltungs GmbH\nGesellschaft mit beschränkter Haftung\nMünchen\n\nDas Registergericht beabsichtigt, die im Handelsregister eingetragene Löschung der Gesellschaft von Amts wegen nach § 395 FamFG zu löschen. Die Frist zur Erhebung eines Widerspruchs ist auf drei Monate festgesetzt."
    },
    {
      "date": "2025-09-12",
      "id": "128922",
      "original_text": "Registerbekanntmachung nach dem Umwandlungsgesetz\nBayern Amtsgericht Augsburg GnR 1628\nGEDENKWERK e.G. – Augsburg",
      "type": "Registerbekanntmachung nach dem Umwandlungsgesetz",
      "state": "Bayern",
      "amtsgericht": "Amtsgericht Augsburg",
      "registernummer": "GnR 1628",
      "registerart": "GnR",
      "company_name": "GEDENKWERK e.G.",
      "company_seat": "Augsburg",
      "details": "12.09.2025 (Bekanntmachungsdatum)\n\nBayern Amtsgericht Augsburg GnR 1628\nRegisterbekanntmachung nach dem Umwandlungsgesetz 11.09.2025 (Eintragungsdatum)\n\nGEDENKWERK e.G.\neingetragene Genossenschaft\nAugsburg\n\nDen Gläubigern der an der Verschmelzung beteiligten Rechtsträger ist, wenn sie binnen sechs Monaten nach dem Tag, an dem die Eintragung der Verschmelzung in das Register des Sitzes desjenigen Rechtsträgers, dessen Gläubiger sie sind, nach § 19 Abs. 3 UmwG als bekannt gemacht gilt, ihren Anspruch nach Grund und Höhe in Textform anmelden, Sicherheit zu leisten, soweit sie nicht Befriedigung verlangen können. Dieses Recht steht den Gläubigern jedoch nur zu, wenn sie glaubhaft machen, dass durch die Verschmelzung die Erfüllung ihrer Forderung gefährdet wird."
    },
    {
      "date": "2025-09-12",
      "id": "128923",
      "original_text": "Löschungsankündigung\nBayern Amtsgericht Ansbach HRB 766\nLöffler Maschinenbau GmbH – Langenaltheim",
      "type": "Löschungsankündigung",
      "state": "Bayern",
      "amtsgericht": "Amtsgericht Ansbach",
      "registernummer": "HRB 766",
      "registerart": "HRB",
      "company_name": "Löffler Maschinenbau GmbH",
      "company_seat": "Langenaltheim",
      "details": "12.09.2025 (Bekanntmachungsdatum)\n\nBayern Amtsgericht Ansbach HRB 766\nLöschungsankündigung\n\nLöffler Maschinenbau GmbH\nGesellschaft mit beschränkter Haftung\nLangenaltheim\n\nDas Registergericht beabsichtigt, die im Handelsregister eingetragene Gesellschaft wegen Vermögenslosigkeit von Amts wegen nach § 394 FamFG zu löschen. Die Frist zur Erhebung eines Widerspruchs ist auf sechs Wochen festgesetzt."
    },
    {
      "date": "2025-09-12",
      "id": "128924",
      "original_text": "Löschungsankündigung\nBayern Amtsgericht Bayreuth VR 1546\nCowboy's and Angel's, Country & Line-Dance Bayreuth e. V. – Bayreuth",
      "type": "Löschungsankündigung",
      "state": "Bayern",
      "amtsgericht": "Amtsgericht Bayreuth",
      "registernummer": "VR 1546",
      "registerart": "VR",
      "company_name": "Cowboy's and Angel's, Country & Line-Dance Bayreuth e. V.",
      "company_seat": "Bayreuth",
      "details": "12.09.2025 (Bekanntmachungsdatum)\n\nBayern Amtsgericht Bayreuth VR 1546\nLöschungsankündigung\n\nCowboy's and Angel's, Country & Line-Dance Bayreuth e. V.\neingetragener Verein\nBayreuth\n\nDas Registergericht beabsichtigt, den im Vereinsregister eingetragenen Verein von Amts wegen nach § 395 FamFG wegen Wegfalls aller Mitglieder zu löschen. Die Frist zur Erhebung eines Widerspruchs ist auf einen Monat festgesetzt."
    },
    {
      "date": "2025-09-12",
      "id": "128925",
      "original_text": "Löschungsankündigung\nBayern Amtsgericht Bayreuth VR 1546\nCowboy's and Angel's, Country & Line-Dance Bayreuth e. V. – Bayreuth",
      "type": "Löschungsankündigung",
      "state": "Bayern",
      "amtsgericht": "Amtsgericht Bayreuth",
      "registernummer": "VR 1546",
      "registerart": "VR",
      "company_name": "Cowboy's and Angel's, Country & Line-Dance Bayreuth e. V.",
      "company_seat": "Bayreuth",
      "details": "12.09.2025 (Bekanntmachungsdatum)\n\nBayern Amtsgericht Bayreuth VR 1546\nLöschungsankündigung\n\nCowboy's and Angel's, Country & Line-Dance Bayreuth e. V.\neingetragener Verein\nBayreuth\n\nDas Registergericht beabsichtigt, den im Vereinsregister eingetragenen Verein von Amts wegen nach 395 FamFG wegen Wegfalls aller Mitglieder zu löschen. Die Frist zur Erhebung eines Widerspruchs ist auf einen Monat festgesetzt."
    },
    {
      "date": "2025-09-12",
      "id": "128926",
      "original_text": "Registerbekanntmachung nach dem Umwandlungsgesetz\nBayern Amtsgericht München HRA 121431\nA. Reßle Besitzunternehmen e.K. – Peiting",
      "type": "Registerbekanntmachung nach dem Umwandlungsgesetz",
      "state": "Bayern",
      "amtsgericht": "Amtsgericht München",
      "registernummer": "HRA 121431",
      "registerart": "HRA",
      "company_name": "A. Reßle Besitzunternehmen e.K.",
      "company_seat": "Peiting",
      "details": "12.09.2025 (Bekanntmachungsdatum)\n\nBayern Amtsgericht München HRA 121431\nRegisterbekanntmachung nach dem Umwandlungsgesetz 11.09.2025 (Eintragungsdatum)\n\nA. Reßle Besitzunternehmen e.K.\nEinzelkaufmann / Einzelkauffrau\nPeiting\n\nDen Gläubigern der an der Ausgliederung beteiligten Rechtsträger ist, wenn sie binnen sechs Monaten nach dem Tag, an dem die Eintragung der Ausgliederung in das Register des Sitzes desjenigen Rechtsträgers, dessen Gläubiger sie sind, nach §§ 125, 19 Abs. 3 UmwG als bekannt gemacht gilt, ihren Anspruch nach Grund und Höhe in Textform anmelden, Sicherheit zu leisten, soweit sie nicht Befriedigung verlangen können. Dieses Recht steht den Gläubigern jedoch nur zu, wenn sie glaubhaft machen, dass durch die Ausgliederung die Erfüllung ihrer Forderung gefährdet wird."
    },
    {
      "date": "2025-09-12",
      "id": "128927",
      "original_text": "Registerbekanntmachung nach dem Umwandlungsgesetz\nBayern Amtsgericht Würzburg HRA 8991\nV.S. Grundbesitz e. K. – Marktsteft",
      "type": "Registerbekanntmachung nach dem Umwandlungsgesetz",
      "state": "Bayern",
      "amtsgericht": "Amtsgericht Würzburg",
      "registernummer": "HRA 8991",
      "registerart": "HRA",
      "company_name": "V.S. Grundbesitz e. K.",
      "company_seat": "Marktsteft",
      "details": "12.09.2025 (Bekanntmachungsdatum)\n\nBayern Amtsgericht Würzburg HRA 8991\nRegisterbekanntmachung nach dem Umwandlungsgesetz 11.09.2025 (Eintragungsdatum)\n\nV.S. Grundbesitz e. K.\nEinzelkaufmann / Einzelkauffrau\nMarktsteft\n\nDen Gläubigern der an der Ausgliederung beteiligten Rechtsträger ist, wenn sie binnen sechs Monaten nach dem Tag, an dem die Eintragung der Ausgliederung in das Register des Sitzes desjenigen Rechtsträgers, dessen Gläubiger sie sind, nach §§ 125, 19 Abs. 3 UmwG als bekannt gemacht gilt, ihren Anspruch nach Grund und Höhe in Textform anmelden, Sicherheit zu leisten, soweit sie nicht Befriedigung verlangen können. Dieses Recht steht den Gläubigern jedoch nur zu, wenn sie glaubhaft machen, dass durch die Ausgliederung die Erfüllung ihrer Forderung gefährdet wird."
    },
    {
      "date": "2025-09-12",
      "id": "128928",
      "original_text": "Registerbekanntmachung nach dem Umwandlungsgesetz\nBayern Amtsgericht Augsburg HRA 17422\nBamberger Präzisionsteile aus Elastomeren e.K. – Gundelfingen a. d. Donau",
      "type": "Registerbekanntmachung nach dem Umwandlungsgesetz",
      "state": "Bayern",
      "amtsgericht": "Amtsgericht Augsburg",
      "registernummer": "HRA 17422",
      "registerart": "HRA",
      "company_name": "Bamberger Präzisionsteile aus Elastomeren e.K.",
      "company_seat": "Gundelfingen a. d. Donau",
      "details": "12.09.2025 (Bekanntmachungsdatum)\n\nBayern Amtsgericht Augsburg HRA 17422\nRegisterbekanntmachung nach dem Umwandlungsgesetz 11.09.2025 (Eintragungsdatum)\n\nBamberger Präzisionsteile aus Elastomeren e.K.\nEinzelkaufmann / Einzelkauffrau\nGundelfingen a. d. Donau\n\nDen Gläubigern der an der Ausgliederung beteiligten Rechtsträger ist, wenn sie binnen sechs Monaten nach dem Tag, an dem die Eintragung der Ausgliederung in das Register des Sitzes desjenigen Rechtsträgers, dessen Gläubiger sie sind, nach §§ 125, 19 Abs. 3 UmwG als bekannt gemacht gilt, ihren Anspruch nach Grund und Höhe in Textform anmelden, Sicherheit zu leisten, soweit sie nicht Befriedigung verlangen können. Dieses Recht steht den Gläubigern jedoch nur zu, wenn sie glaubhaft machen, dass durch die Ausgliederung die Erfüllung ihrer Forderung gefährdet wird."
    },
    {
      "date": "2025-09-12",
      "id": "128929",
      "original_text": "Registerbekanntmachung nach dem Umwandlungsgesetz\nBayern Amtsgericht Bamberg HRB 12158\nDellerate GmbH – Bamberg",
      "type": "Registerbekanntmachung nach dem Umwandlungsgesetz",
      "state": "Bayern",
      "amtsgericht": "Amtsgericht Bamberg",
      "registernummer": "HRB 12158",
      "registerart": "HRB",
      "company_name": "Dellerate GmbH",
      "company_seat": "Bamberg",
      "details": "12.09.2025 (Bekanntmachungsdatum)\n\nBayern Amtsgericht Bamberg HRB 12158\nRegisterbekanntmachung nach dem Umwandlungsgesetz 11.09.2025 (Eintragungsdatum)\n\nDellerate GmbH\nGesellschaft mit beschränkter Haftung\nBamberg\n\nDen Gläubigern der an der Ausgliederung beteiligten Rechtsträger ist, wenn sie binnen sechs Monaten nach dem Tag, an dem die Eintragung der Ausgliederung in das Register des Sitzes desjenigen Rechtsträgers, dessen Gläubiger sie sind, nach §§ 125, 19 Abs. 3 UmwG als bekannt gemacht gilt, ihren Anspruch nach Grund und Höhe in Textform anmelden, Sicherheit zu leisten, soweit sie nicht Befriedigung verlangen können. Dieses Recht steht den Gläubigern jedoch nur zu, wenn sie glaubhaft machen, dass durch die Ausgliederung die Erfüllung ihrer Forderung gefährdet wird."
    },
    {
      "date": "2025-09-12",
      "id": "128930",
      "original_text": "Löschungsankündigung\nBayern Amtsgericht München HRB 199920\nCRG UG (haftungsbeschränkt) – Pähl",
      "type": "Löschungsankündigung",
      "state": "Bayern",
      "amtsgericht": "Amtsgericht München",
      "registernummer": "HRB 199920",
      "registerart": "HRB",
      "company_name": "CRG UG (haftungsbeschränkt)",
      "company_seat": "Pähl",
      "details": "12.09.2025 (Bekanntmachungsdatum)\n\nBayern Amtsgericht München HRB 199920\nLöschungsankündigung 11.09.2025 (Eintragungsdatum)\n\nCRG UG (haftungsbeschränkt)\nGesellschaft mit beschränkter Haftung\nPähl\n\nDas Registergericht beabsichtigt, die im Handelsregister eingetragene Gesellschaft wegen Vermögenslosigkeit von Amts wegen nach § 394 FamFG zu löschen. Die Frist zur Erhebung eines Widerspruchs ist auf drei Monate festgesetzt."
    },
    {
      "date": "2025-09-12",
      "id": "128931",
      "original_text": "Registerbekanntmachung nach dem Umwandlungsgesetz\nBayern Amtsgericht Landshut HRA 11296\nA.M. Erdbau und Kabelverlegungs GmbH & Co. KG – Rottenburg a. d. Laaber",
      "type": "Registerbekanntmachung nach dem Umwandlungsgesetz",
      "state": "Bayern",
      "amtsgericht": "Amtsgericht Landshut",
      "registernummer": "HRA 11296",
      "registerart": "HRA",
      "company_name": "A.M. Erdbau und Kabelverlegungs GmbH & Co. KG",
      "company_seat": "Rottenburg a. d. Laaber",
      "details": "12.09.2025 (Bekanntmachungsdatum)\n\nBayern Amtsgericht Landshut HRA 11296\nRegisterbekanntmachung nach dem Umwandlungsgesetz 11.09.2025 (Eintragungsdatum)\n\nA.M. Erdbau und Kabelverlegungs GmbH & Co. KG\nKommanditgesellschaft\nRottenburg a. d. Laaber\n\nDen Gläubigern des formwechselnden Rechtsträgers ist, wenn sie binnen sechs Monaten nach dem Tag, an dem die Eintragung des Formwechsels nach § 201 UmwG als bekannt gemacht gilt, ihren Anspruch nach Grund und Höhe in Textform anmelden, Sicherheit zu leisten, soweit sie nicht Befriedigung verlangen können. Dieses Recht steht den Gläubigern jedoch nur zu, wenn sie glaubhaft machen, dass durch den Formwechsel die Erfüllung ihrer Forderung gefährdet wird."
    },
    {
      "date": "2025-09-12",
      "id": "128932",
      "original_text": "Registerbekanntmachung nach dem Umwandlungsgesetz\nBayern Amtsgericht Landshut HRB 3890\nSBL Landshut GmbH – Landshut",
      "type": "Registerbekanntmachung nach dem Umwandlungsgesetz",
      "state": "Bayern",
      "amtsgericht": "Amtsgericht Landshut",
      "registernummer": "HRB 3890",
      "registerart": "HRB",
      "company_name": "SBL Landshut GmbH",
      "company_seat": "Landshut",
      "details": "12.09.2025 (Bekanntmachungsdatum)\n\nBayern Amtsgericht Landshut HRB 3890\nRegisterbekanntmachung nach dem Umwandlungsgesetz 11.09.2025 (Eintragungsdatum)\n\nSBL Landshut GmbH\nGesellschaft mit beschränkter Haftung\nLandshut\n\nDen Gläubigern der an der Verschmelzung beteiligten Rechtsträger ist, wenn sie binnen sechs Monaten nach dem Tag, an dem die Eintragung der Verschmelzung in das Register des Sitzes desjenigen Rechtsträgers, dessen Gläubiger sie sind, nach § 19 Abs. 3 UmwG als bekannt gemacht gilt, ihren Anspruch nach Grund und Höhe in Textform anmelden, Sicherheit zu leisten, soweit sie nicht Befriedigung verlangen können. Dieses Recht steht den Gläubigern jedoch nur zu, wenn sie glaubhaft machen, dass durch die Verschmelzung die Erfüllung ihrer Forderung gefährdet wird."
    },
    {
      "date": "2025-09-12",
      "id": "128933",
      "original_text": "Registerbekanntmachung nach dem Umwandlungsgesetz\nBayern Amtsgericht München HRB 276783\nregConnect GmbH – Planegg",
      "type": "Registerbekanntmachung nach dem Umwandlungsgesetz",
      "state": "Bayern",
      "amtsgericht": "Amtsgericht München",
      "registernummer": "HRB 276783",
      "registerart": "HRB",
      "company_name": "regConnect GmbH",
      "company_seat": "Planegg",
      "details": "12.09.2025 (Bekanntmachungsdatum)\n\nBayern Amtsgericht München HRB 276783\nRegisterbekanntmachung nach dem Umwandlungsgesetz 11.09.2025 (Eintragungsdatum)\n\nregConnect GmbH\nGesellschaft mit beschränkter Haftung\nPlanegg\n\nDen Gläubigern der an der Verschmelzung beteiligten Rechtsträger ist, wenn sie binnen sechs Monaten nach dem Tag, an dem die Eintragung der Verschmelzung in das Register des Sitzes desjenigen Rechtsträgers, dessen Gläubiger sie sind, nach § 19 Abs. 3 UmwG als bekannt gemacht gilt, ihren Anspruch nach Grund und Höhe in Textform anmelden, Sicherheit zu leisten, soweit sie nicht Befriedigung verlangen können. Dieses Recht steht den Gläubigern jedoch nur zu, wenn sie glaubhaft machen, dass durch die Verschmelzung die Erfüllung ihrer Forderung gefährdet wird."
    },
    {
      "date": "2025-09-12",
      "id": "128934",
      "original_text": "Registerbekanntmachung nach dem Umwandlungsgesetz\nBayern Amtsgericht Augsburg HRA 16127\nBMK Group GmbH & Co. KG – Augsburg",
      "type": "Registerbekanntmachung nach dem Umwandlungsgesetz",
      "state": "Bayern",
      "amtsgericht": "Amtsgericht Augsburg",
      "registernummer": "HRA 16127",
      "registerart": "HRA",
      "company_name": "BMK Group GmbH & Co. KG",
      "company_seat": "Augsburg",
      "details": "12.09.2025 (Bekanntmachungsdatum)\n\nBayern Amtsgericht Augsburg HRA 16127\nRegisterbekanntmachung nach dem Umwandlungsgesetz 11.09.2025 (Eintragungsdatum)\n\nBMK Group GmbH & Co. KG\nKommanditgesellschaft\nAugsburg\n\nDen Gläubigern des formwechselnden Rechtsträgers ist, wenn sie binnen sechs Monaten nach dem Tag, an dem die Eintragung des Formwechsels nach § 201 UmwG als bekannt gemacht gilt, ihren Anspruch nach Grund und Höhe in Textform anmelden, Sicherheit zu leisten, soweit sie nicht Befriedigung verlangen können. Dieses Recht steht den Gläubigern jedoch nur zu, wenn sie glaubhaft machen, dass durch den Formwechsel die Erfüllung ihrer Forderung gefährdet wird."
    },
    {
      "date": "2025-09-12",
      "id": "128935",
      "original_text": "Registerbekanntmachung nach dem Umwandlungsgesetz\nBayern Amtsgericht Augsburg HRA 22034\nSchulten & Zillich OHG – Augsburg",
      "type": "Registerbekanntmachung nach dem Umwandlungsgesetz",
      "state": "Bayern",
      "amtsgericht": "Amtsgericht Augsburg",
      "registernummer": "HRA 22034",
      "registerart": "HRA",
      "company_name": "Schulten & Zillich OHG",
      "company_seat": "Augsburg",
      "details": "12.09.2025 (Bekanntmachungsdatum)\n\nBayern Amtsgericht Augsburg HRA 22034\nRegisterbekanntmachung nach dem Umwandlungsgesetz 11.09.2025 (Eintragungsdatum)\n\nSchulten & Zillich OHG\nOffene Handelsgesellschaft\nAugsburg\n\nDem Amtsgericht Augsburg -Registergericht- ist am 26.08.2025 ein Verschmelzungsplan über die geplante Verschmelzung der offenen HandelsgDen Gläubigern der an der Verschmelzung beteiligten Rechtsträger ist, wenn sie binnen sechs Monaten nach dem Tag, an dem die Eintragung der Verschmelzung in das Register des Sitzes desjenigen Rechtsträgers, dessen Gläubiger sie sind, nach § 19 Abs. 3 UmwG als bekannt gemacht gilt, ihren Anspruch nach Grund und Höhe in Textform anmelden, Sicherheit zu leisten, soweit sie nicht Befriedigung verlangen können. Dieses Recht steht den Gläubigern jedoch nur zu, wenn sie glaubhaft machen, dass durch die Verschmelzung die Erfüllung ihrer Forderung gefährdet wird.esellschaft unter Firma up First GmbH mit Sitz in München/Deutschland (Amtsgericht München HRB 304676) mit der Gesellschaft als übertragendem Rechtsträger eingereicht worden. Die vollständigen Auskünfte über diese Modalitäten können kostenlos eingeholt werden bei ."
    },
    {
      "date": "2025-09-12",
      "id": "128936",
      "original_text": "Registerbekanntmachung nach dem Umwandlungsgesetz\nBayern Amtsgericht München HRB 298002\nTion Renewables GmbH – München",
      "type": "Registerbekanntmachung nach dem Umwandlungsgesetz",
      "state": "Bayern",
      "amtsgericht": "Amtsgericht München",
      "registernummer": "HRB 298002",
      "registerart": "HRB",
      "company_name": "Tion Renewables GmbH",
      "company_seat": "München",
      "details": "12.09.2025 (Bekanntmachungsdatum)\n\nBayern Amtsgericht München HRB 298002\nRegisterbekanntmachung nach dem Umwandlungsgesetz 11.09.2025 (Eintragungsdatum)\n\nTion Renewables GmbH\nGesellschaft mit beschränkter Haftung\nMünchen\n\nDen Gläubigern der an der Verschmelzung beteiligten Rechtsträger ist, wenn sie binnen sechs Monaten nach dem Tag, an dem die Eintragung der Verschmelzung in das Register des Sitzes desjenigen Rechtsträgers, dessen Gläubiger sie sind, nach § 19 Abs. 3 UmwG als bekannt gemacht gilt, ihren Anspruch nach Grund und Höhe in Textform anmelden, Sicherheit zu leisten, soweit sie nicht Befriedigung verlangen können. Dieses Recht steht den Gläubigern jedoch nur zu, wenn sie glaubhaft machen, dass durch die Verschmelzung die Erfüllung ihrer Forderung gefährdet wird."
    },
    {
      "date": "2025-09-12",
      "id": "128937",
      "original_text": "Sonstige Registerbekanntmachung\nBayern Amtsgericht Augsburg HRB 23360\nModewelt GmbH – Donauwörth",
      "type": "Sonstige Registerbekanntmachung",
      "state": "Bayern",
      "amtsgericht": "Amtsgericht Augsburg",
      "registernummer": "HRB 23360",
      "registerart": "HRB",
      "company_name": "Modewelt GmbH",
      "company_seat": "Donauwörth",
      "details": "12.09.2025 (Bekanntmachungsdatum)\n\nBayern Amtsgericht Augsburg HRB 23360\nSonstige Registerbekanntmachung 11.09.2025 (Eintragungsdatum)\n\nModewelt GmbH\nGesellschaft mit beschränkter Haftung\nDonauwörth\n\nDen Gläubigern der Gesellschaft, deren Forderungen begründet worden sind, bevor die Eintragung der Beendigung des Beherrschungs- und Gewinnabführungsvertrages in das Handelsregister nach § 10 des Handelsgesetzbuches als bekanntgemacht gilt, hat der andere Vertragsteil Sicherheit zu leisten, wenn sie sich binnen sechs Monaten nach der Bekanntmachung der Eintragung zu diesem Zweck bei ihm melden."
    },
    {
      "date": "2025-09-12",
      "id": "128938",
      "original_text": "Registerbekanntmachung nach dem Umwandlungsgesetz\nBayern Amtsgericht Hof HRB 4505\nFriedrich GmbH – Helmbrechts",
      "type": "Registerbekanntmachung nach dem Umwandlungsgesetz",
      "state": "Bayern",
      "amtsgericht": "Amtsgericht Hof",
      "registernummer": "HRB 4505",
      "registerart": "HRB",
      "company_name": "Friedrich GmbH",
      "company_seat": "Helmbrechts",
      "details": "12.09.2025 (Bekanntmachungsdatum)\n\nBayern Amtsgericht Hof HRB 4505\nRegisterbekanntmachung nach dem Umwandlungsgesetz 11.09.2025 (Eintragungsdatum)\n\nFriedrich GmbH\nGesellschaft mit beschränkter Haftung\nHelmbrechts\n\nDen Gläubigern der an der Verschmelzung beteiligten Rechtsträger ist, wenn sie binnen sechs Monaten nach dem Tag, an dem die Eintragung der Verschmelzung in das Register des Sitzes desjenigen Rechtsträgers, dessen Gläubiger sie sind, nach § 19 Abs. 3 UmwG als bekannt gemacht gilt, ihren Anspruch nach Grund und Höhe in Textform anmelden, Sicherheit zu leisten, soweit sie nicht Befriedigung verlangen können. Dieses Recht steht den Gläubigern jedoch nur zu, wenn sie glaubhaft machen, dass durch die Verschmelzung die Erfüllung ihrer Forderung gefährdet wird."
    },
    {
      "date": "2025-09-12",
      "id": "128939",
      "original_text": "Registerbekanntmachung nach dem Umwandlungsgesetz\nBayern Amtsgericht Coburg HRA 5631\nZaß & Berthold GmbH & Co. KG – Michelau",
      "type": "Registerbekanntmachung nach dem Umwandlungsgesetz",
      "state": "Bayern",
      "amtsgericht": "Amtsgericht Coburg",
      "registernummer": "HRA 5631",
      "registerart": "HRA",
      "company_name": "Zaß & Berthold GmbH & Co. KG",
      "company_seat": "Michelau",
      "details": "12.09.2025 (Bekanntmachungsdatum)\n\nBayern Amtsgericht Coburg HRA 5631\nRegisterbekanntmachung nach dem Umwandlungsgesetz 11.09.2025 (Eintragungsdatum)\n\nZaß & Berthold GmbH & Co. KG\nKommanditgesellschaft\nMichelau\n\nDen Gläubigern der an der Ausgliederung beteiligten Rechtsträger ist, wenn sie binnen sechs Monaten nach dem Tag, an dem die Eintragung der Ausgliederung in das Register des Sitzes desjenigen Rechtsträgers, dessen Gläubiger sie sind, nach §§ 125, 19 Abs. 3 UmwG als bekannt gemacht gilt, ihren Anspruch nach Grund und Höhe in Textform anmelden, Sicherheit zu leisten, soweit sie nicht Befriedigung verlangen können. Dieses Recht steht den Gläubigern jedoch nur zu, wenn sie glaubhaft machen, dass durch die Ausgliederung die Erfüllung ihrer Forderung gefährdet wird."
    },
    {
      "date": "2025-09-12",
      "id": "128940",
      "original_text": "Registerbekanntmachung nach dem Umwandlungsgesetz\nBayern Amtsgericht München HRA 102418\nAlvarez & Marsal Deutschland GmbH & Co. KG – München",
      "type": "Registerbekanntmachung nach dem Umwandlungsgesetz",
      "state": "Bayern",
      "amtsgericht": "Amtsgericht München",
      "registernummer": "HRA 102418",
      "registerart": "HRA",
      "company_name": "Alvarez & Marsal Deutschland GmbH & Co. KG",
      "company_seat": "München",
      "details": "12.09.2025 (Bekanntmachungsdatum)\n\nBayern Amtsgericht München HRA 102418\nRegisterbekanntmachung nach dem Umwandlungsgesetz 11.09.2025 (Eintragungsdatum)\n\nAlvarez & Marsal Deutschland GmbH & Co. KG\nKommanditgesellschaft\nMünchen\n\nDen Gläubigern der an der Verschmelzung beteiligten Rechtsträger ist, wenn sie binnen sechs Monaten nach dem Tag, an dem die Eintragung der Verschmelzung in das Register des Sitzes desjenigen Rechtsträgers, dessen Gläubiger sie sind, nach § 19 Abs. 3 UmwG als bekannt gemacht gilt, ihren Anspruch nach Grund und Höhe in Textform anmelden, Sicherheit zu leisten, soweit sie nicht Befriedigung verlangen können. Dieses Recht steht den Gläubigern jedoch nur zu, wenn sie glaubhaft machen, dass durch die Verschmelzung die Erfüllung ihrer Forderung gefährdet wird."
    },
    {
      "date": "2025-09-12",
      "id": "128941",
      "original_text": "Registerbekanntmachung nach dem Umwandlungsgesetz\nBayern Amtsgericht Memmingen HRB 19745\nDUO Warenvertriebs GmbH – Leipheim",
      "type": "Registerbekanntmachung nach dem Umwandlungsgesetz",
      "state": "Bayern",
      "amtsgericht": "Amtsgericht Memmingen",
      "registernummer": "HRB 19745",
      "registerart": "HRB",
      "company_name": "DUO Warenvertriebs GmbH",
      "company_seat": "Leipheim",
      "details": "12.09.2025 (Bekanntmachungsdatum)\n\nBayern Amtsgericht Memmingen HRB 19745\nRegisterbekanntmachung nach dem Umwandlungsgesetz 09.09.2025 (Eintragungsdatum)\n\nDUO Warenvertriebs GmbH\nGesellschaft mit beschränkter Haftung\nLeipheim\n\nDem Amtsgericht Memmingen -Registergericht- ist ein Verschmelzungsvertrag zwischen der Duo Warenvertriebs GmbH, Leipheim (Amtsgericht Memmingen HRB 19745) und der Gesellschaft als übertragendem Rechtsträger zur Einsichtnahme eingereicht worden."
    },
    {
      "date": "2025-09-12",
      "id": "128942",
      "original_text": "Registerbekanntmachung nach dem Umwandlungsgesetz\nBayern Amtsgericht Hof HRB 726\nFriedrich GmbH – Helmbrechts",
      "type": "Registerbekanntmachung nach dem Umwandlungsgesetz",
      "state": "Bayern",
      "amtsgericht": "Amtsgericht Hof",
      "registernummer": "HRB 726",
      "registerart": "HRB",
      "company_name": "Friedrich GmbH",
      "company_seat": "Helmbrechts",
      "details": "12.09.2025 (Bekanntmachungsdatum)\n\nBayern Amtsgericht Hof HRB 726\nRegisterbekanntmachung nach dem Umwandlungsgesetz 11.09.2025 (Eintragungsdatum)\n\nFriedrich GmbH\nGesellschaft mit beschränkter Haftung\nHelmbrechts\n\nDen Gläubigern der an der Verschmelzung beteiligten Rechtsträger ist, wenn sie binnen sechs Monaten nach dem Tag, an dem die Eintragung der Verschmelzung in das Register des Sitzes desjenigen Rechtsträgers, dessen Gläubiger sie sind, nach § 19 Abs. 3 UmwG als bekannt gemacht gilt, ihren Anspruch nach Grund und Höhe in Textform anmelden, Sicherheit zu leisten, soweit sie nicht Befriedigung verlangen können. Dieses Recht steht den Gläubigern jedoch nur zu, wenn sie glaubhaft machen, dass durch die Verschmelzung die Erfüllung ihrer Forderung gefährdet wird."
    },
    {
      "date": "2025-09-12",
      "id": "128943",
      "original_text": "Registerbekanntmachung nach dem Umwandlungsgesetz\nBayern Amtsgericht München HRA 121406\nJohann Dostthaler GmbH & Co. KG – Valley",
      "type": "Registerbekanntmachung nach dem Umwandlungsgesetz",
      "state": "Bayern",
      "amtsgericht": "Amtsgericht München",
      "registernummer": "HRA 121406",
      "registerart": "HRA",
      "company_name": "Johann Dostthaler GmbH & Co. KG",
      "company_seat": "Valley",
      "details": "12.09.2025 (Bekanntmachungsdatum)\n\nBayern Amtsgericht München HRA 121406\nRegisterbekanntmachung nach dem Umwandlungsgesetz 11.09.2025 (Eintragungsdatum)\n\nJohann Dostthaler GmbH & Co. KG\nKommanditgesellschaft\nValley\n\nDen Gläubigern der an der Ausgliederung beteiligten Rechtsträger ist, wenn sie binnen sechs Monaten nach dem Tag, an dem die Eintragung der Ausgliederung in das Register des Sitzes desjenigen Rechtsträgers, dessen Gläubiger sie sind, nach §§ 125, 19 Abs. 3 UmwG als bekannt gemacht gilt, ihren Anspruch nach Grund und Höhe in Textform anmelden, Sicherheit zu leisten, soweit sie nicht Befriedigung verlangen können. Dieses Recht steht den Gläubigern jedoch nur zu, wenn sie glaubhaft machen, dass durch die Ausgliederung die Erfüllung ihrer Forderung gefährdet wird."
    },
    {
      "date": "2025-09-12",
      "id": "128944",
      "original_text": "Registerbekanntmachung nach dem Umwandlungsgesetz\nBayern Amtsgericht München HRB 305518\nMB Value GmbH – München",
      "type": "Registerbekanntmachung nach dem Umwandlungsgesetz",
      "state": "Bayern",
      "amtsgericht": "Amtsgericht München",
      "registernummer": "HRB 305518",
      "registerart": "HRB",
      "company_name": "MB Value GmbH",
      "company_seat": "München",
      "details": "12.09.2025 (Bekanntmachungsdatum)\n\nBayern Amtsgericht München HRB 305518\nRegisterbekanntmachung nach dem Umwandlungsgesetz 11.09.2025 (Eintragungsdatum)\n\nMB Value GmbH\nGesellschaft mit beschränkter Haftung\nMünchen\n\nDen Gläubigern des formwechselnden Rechtsträgers ist, wenn sie binnen sechs Monaten nach dem Tag, an dem die Eintragung des Formwechsels nach § 201 UmwG als bekannt gemacht gilt, ihren Anspruch nach Grund und Höhe in Textform anmelden, Sicherheit zu leisten, soweit sie nicht Befriedigung verlangen können. Dieses Recht steht den Gläubigern jedoch nur zu, wenn sie glaubhaft machen, dass durch den Formwechsel die Erfüllung ihrer Forderung gefährdet wird."
    },
    {
      "date": "2025-09-12",
      "id": "128945",
      "original_text": "Registerbekanntmachung nach dem Umwandlungsgesetz\nBayern Amtsgericht München HRB 205565\nSCUR24 Holding GmbH – München",
      "type": "Registerbekanntmachung nach dem Umwandlungsgesetz",
      "state": "Bayern",
      "amtsgericht": "Amtsgericht München",
      "registernummer": "HRB 205565",
      "registerart": "HRB",
      "company_name": "SCUR24 Holding GmbH",
      "company_seat": "München",
      "details": "12.09.2025 (Bekanntmachungsdatum)\n\nBayern Amtsgericht München HRB 205565\nRegisterbekanntmachung nach dem Umwandlungsgesetz 11.09.2025 (Eintragungsdatum)\n\nSCUR24 Holding GmbH\nGesellschaft mit beschränkter Haftung\nMünchen\n\nDen Gläubigern der an der Verschmelzung beteiligten Rechtsträger ist, wenn sie binnen sechs Monaten nach dem Tag, an dem die Eintragung der Verschmelzung in das Register des Sitzes desjenigen Rechtsträgers, dessen Gläubiger sie sind, nach § 19 Abs. 3 UmwG als bekannt gemacht gilt, ihren Anspruch nach Grund und Höhe in Textform anmelden, Sicherheit zu leisten, soweit sie nicht Befriedigung verlangen können. Dieses Recht steht den Gläubigern jedoch nur zu, wenn sie glaubhaft machen, dass durch die Verschmelzung die Erfüllung ihrer Forderung gefährdet wird."
    },
    {
      "date": "2025-09-12",
      "id": "128946",
      "original_text": "Registerbekanntmachung nach dem Umwandlungsgesetz\nBayern Amtsgericht München HRB 194371\nexsellent UG (haftungsbeschränkt) – München",
      "type": "Registerbekanntmachung nach dem Umwandlungsgesetz",
      "state": "Bayern",
      "amtsgericht": "Amtsgericht München",
      "registernummer": "HRB 194371",
      "registerart": "HRB",
      "company_name": "exsellent UG (haftungsbeschränkt)",
      "company_seat": "München",
      "details": "12.09.2025 (Bekanntmachungsdatum)\n\nBayern Amtsgericht München HRB 194371\nRegisterbekanntmachung nach dem Umwandlungsgesetz 11.09.2025 (Eintragungsdatum)\n\nexsellent UG (haftungsbeschränkt)\nGesellschaft mit beschränkter Haftung\nMünchen\n\nDen Gläubigern des formwechselnden Rechtsträgers ist, wenn sie binnen sechs Monaten nach dem Tag, an dem die Eintragung des Formwechsels nach § 201 UmwG als bekannt gemacht gilt, ihren Anspruch nach Grund und Höhe in Textform anmelden, Sicherheit zu leisten, soweit sie nicht Befriedigung verlangen können. Dieses Recht steht den Gläubigern jedoch nur zu, wenn sie glaubhaft machen, dass durch den Formwechsel die Erfüllung ihrer Forderung gefährdet wird."
    },
    {
      "date": "2025-09-12",
      "id": "128947",
      "original_text": "Registerbekanntmachung nach dem Umwandlungsgesetz\nBayern Amtsgericht Würzburg HRA 8997\nV.S. Vermietungs GmbH & Co. KG – Marktsteft",
      "type": "Registerbekanntmachung nach dem Umwandlungsgesetz",
      "state": "Bayern",
      "amtsgericht": "Amtsgericht Würzburg",
      "registernummer": "HRA 8997",
      "registerart": "HRA",
      "company_name": "V.S. Vermietungs GmbH & Co. KG",
      "company_seat": "Marktsteft",
      "details": "12.09.2025 (Bekanntmachungsdatum)\n\nBayern Amtsgericht Würzburg HRA 8997\nRegisterbekanntmachung nach dem Umwandlungsgesetz 11.09.2025 (Eintragungsdatum)\n\nV.S. Vermietungs GmbH & Co. KG\nKommanditgesellschaft\nMarktsteft\n\nDen Gläubigern der an der Ausgliederung beteiligten Rechtsträger ist, wenn sie binnen sechs Monaten nach dem Tag, an dem die Eintragung der Ausgliederung in das Register des Sitzes desjenigen Rechtsträgers, dessen Gläubiger sie sind, nach §§ 125, 19 Abs. 3 UmwG als bekannt gemacht gilt, ihren Anspruch nach Grund und Höhe in Textform anmelden, Sicherheit zu leisten, soweit sie nicht Befriedigung verlangen können. Dieses Recht steht den Gläubigern jedoch nur zu, wenn sie glaubhaft machen, dass durch die Ausgliederung die Erfüllung ihrer Forderung gefährdet wird."
    },
    {
      "date": "2025-09-12",
      "id": "128948",
      "original_text": "Einreichung neuer Dokumente\nBayern Amtsgericht München HRB 209454\nREMA TIP TOP AG – Poing",
      "type": "Einreichung neuer Dokumente",
      "state": "Bayern",
      "amtsgericht": "Amtsgericht München",
      "registernummer": "HRB 209454",
      "registerart": "HRB",
      "company_name": "REMA TIP TOP AG",
      "company_seat": "Poing",
      "details": "12.09.2025 (Bekanntmachungsdatum)\n\nBayern Amtsgericht München HRB 209454\nEinreichung neuer Dokumente\n\nREMA TIP TOP AG\nAktiengesellschaft\nPoing\n\nDem Amtsgericht München -Registergericht- ist eine Liste der Mitglieder des Aufsichtsrats eingereicht worden, § 106 AktG."
    },
    {
      "date": "2025-09-12",
      "id": "128949",
      "original_text": "Registerbekanntmachung nach dem Umwandlungsgesetz\nBayern Amtsgericht Landshut HRB 14985\nA.M. Erdbau und Kabelverlegungs GmbH – Rottenburg a.d.Laaber",
      "type": "Registerbekanntmachung nach dem Umwandlungsgesetz",
      "state": "Bayern",
      "amtsgericht": "Amtsgericht Landshut",
      "registernummer": "HRB 14985",
      "registerart": "HRB",
      "company_name": "A.M. Erdbau und Kabelverlegungs GmbH",
      "company_seat": "Rottenburg a.d.Laaber",
      "details": "12.09.2025 (Bekanntmachungsdatum)\n\nBayern Amtsgericht Landshut HRB 14985\nRegisterbekanntmachung nach dem Umwandlungsgesetz 11.09.2025 (Eintragungsdatum)\n\nA.M. Erdbau und Kabelverlegungs GmbH\nGesellschaft mit beschränkter Haftung\nRottenburg a.d.Laaber"
    },
    {
      "date": "2025-09-12",
      "id": "128950",
      "original_text": "Registerbekanntmachung nach dem Umwandlungsgesetz\nBayern Amtsgericht Bamberg HRA 13384\nNiklas Deller e. K. – Bamberg",
      "type": "Registerbekanntmachung nach dem Umwandlungsgesetz",
      "state": "Bayern",
      "amtsgericht": "Amtsgericht Bamberg",
      "registernummer": "HRA 13384",
      "registerart": "HRA",
      "company_name": "Niklas Deller e. K.",
      "company_seat": "Bamberg",
      "details": "12.09.2025 (Bekanntmachungsdatum)\n\nBayern Amtsgericht Bamberg HRA 13384\nRegisterbekanntmachung nach dem Umwandlungsgesetz 11.09.2025 (Eintragungsdatum)\n\nNiklas Deller e. K.\nEinzelkaufmann / Einzelkauffrau\nBamberg\n\nDen Gläubigern der an der Ausgliederung beteiligten Rechtsträger ist, wenn sie binnen sechs Monaten nach dem Tag, an dem die Eintragung der Ausgliederung in das Register des Sitzes desjenigen Rechtsträgers, dessen Gläubiger sie sind, nach §§ 125, 19 Abs. 3 UmwG als bekannt gemacht gilt, ihren Anspruch nach Grund und Höhe in Textform anmelden, Sicherheit zu leisten, soweit sie nicht Befriedigung verlangen können. Dieses Recht steht den Gläubigern jedoch nur zu, wenn sie glaubhaft machen, dass durch die Ausgliederung die Erfüllung ihrer Forderung gefährdet wird."
    },
    {
      "date": "2025-09-12",
      "id": "128951",
      "original_text": "Registerbekanntmachung nach dem Umwandlungsgesetz\nBayern Amtsgericht Augsburg GsR 551\nWLW - Wolfgang Arendt eGbR – Landsberg am Lech",
      "type": "Registerbekanntmachung nach dem Umwandlungsgesetz",
      "state": "Bayern",
      "amtsgericht": "Amtsgericht Augsburg",
      "registernummer": "GsR 551",
      "registerart": "GsR",
      "company_name": "WLW - Wolfgang Arendt eGbR",
      "company_seat": "Landsberg am Lech",
      "details": "12.09.2025 (Bekanntmachungsdatum)\n\nBayern Amtsgericht Augsburg GsR 551\nRegisterbekanntmachung nach dem Umwandlungsgesetz 11.09.2025 (Eintragungsdatum)\n\nWLW - Wolfgang Arendt eGbR\nGesellschaft bürgerlichen Rechts\nLandsberg am Lech\n\nDen Gläubigern des formwechselnden Rechtsträgers ist, wenn sie binnen sechs Monaten nach dem Tag, an dem die Eintragung des Formwechsels nach § 201 UmwG als bekannt gemacht gilt, ihren Anspruch nach Grund und Höhe in Textform anmelden, Sicherheit zu leisten, soweit sie nicht Befriedigung verlangen können. Dieses Recht steht den Gläubigern jedoch nur zu, wenn sie glaubhaft machen, dass durch den Formwechsel die Erfüllung ihrer Forderung gefährdet wird."
    },
    {
      "date": "2025-09-12",
      "id": "128952",
      "original_text": "Registerbekanntmachung nach dem Umwandlungsgesetz\nBayern Amtsgericht Würzburg HRA 9009\nStahlform GmbH & Co. KG – Kitzingen",
      "type": "Registerbekanntmachung nach dem Umwandlungsgesetz",
      "state": "Bayern",
      "amtsgericht": "Amtsgericht Würzburg",
      "registernummer": "HRA 9009",
      "registerart": "HRA",
      "company_name": "Stahlform GmbH & Co. KG",
      "company_seat": "Kitzingen",
      "details": "12.09.2025 (Bekanntmachungsdatum)\n\nBayern Amtsgericht Würzburg HRA 9009\nRegisterbekanntmachung nach dem Umwandlungsgesetz 11.09.2025 (Eintragungsdatum)\n\nStahlform GmbH & Co. KG\nKommanditgesellschaft\nKitzingen\n\nDen Gläubigern der an der Verschmelzung beteiligten Rechtsträger ist, wenn sie binnen sechs Monaten nach dem Tag, an dem die Eintragung der Verschmelzung in das Register des Sitzes desjenigen Rechtsträgers, dessen Gläubiger sie sind, nach § 19 Abs. 3 UmwG als bekannt gemacht gilt, ihren Anspruch nach Grund und Höhe in Textform anmelden, Sicherheit zu leisten, soweit sie nicht Befriedigung verlangen können. Dieses Recht steht den Gläubigern jedoch nur zu, wenn sie glaubhaft machen, dass durch die Verschmelzung die Erfüllung ihrer Forderung gefährdet wird."
    },
    {
      "date": "2025-09-12",
      "id": "128953",
      "original_text": "Registerbekanntmachung nach dem Umwandlungsgesetz\nBayern Amtsgericht München HRB 271901\nSolarpark Kobe GmbH – München",
      "type": "Registerbekanntmachung nach dem Umwandlungsgesetz",
      "state": "Bayern",
      "amtsgericht": "Amtsgericht München",
      "registernummer": "HRB 271901",
      "registerart": "HRB",
      "company_name": "Solarpark Kobe GmbH",
      "company_seat": "München",
      "details": "12.09.2025 (Bekanntmachungsdatum)\n\nBayern Amtsgericht München HRB 271901\nRegisterbekanntmachung nach dem Umwandlungsgesetz 11.09.2025 (Eintragungsdatum)\n\nSolarpark Kobe GmbH\nGesellschaft mit beschränkter Haftung\nMünchen\n\nDen Gläubigern der an der Verschmelzung beteiligten Rechtsträger ist, wenn sie binnen sechs Monaten nach dem Tag, an dem die Eintragung der Verschmelzung in das Register des Sitzes desjenigen Rechtsträgers, dessen Gläubiger sie sind, nach § 19 Abs. 3 UmwG als bekannt gemacht gilt, ihren Anspruch nach Grund und Höhe in Textform anmelden, Sicherheit zu leisten, soweit sie nicht Befriedigung verlangen können. Dieses Recht steht den Gläubigern jedoch nur zu, wenn sie glaubhaft machen, dass durch die Verschmelzung die Erfüllung ihrer Forderung gefährdet wird."
    },
    {
      "date": "2025-09-12",
      "id": "128954",
      "original_text": "Registerbekanntmachung nach dem Umwandlungsgesetz\nBayern Amtsgericht München HRB 103619\nOliver Wyman GmbH – München",
      "type": "Registerbekanntmachung nach dem Umwandlungsgesetz",
      "state": "Bayern",
      "amtsgericht": "Amtsgericht München",
      "registernummer": "HRB 103619",
      "registerart": "HRB",
      "company_name": "Oliver Wyman GmbH",
      "company_seat": "München",
      "details": "12.09.2025 (Bekanntmachungsdatum)\n\nBayern Amtsgericht München HRB 103619\nRegisterbekanntmachung nach dem Umwandlungsgesetz 11.09.2025 (Eintragungsdatum)\n\nOliver Wyman GmbH\nGesellschaft mit beschränkter Haftung\nMünchen\n\nDen Gläubigern der an der Verschmelzung beteiligten Rechtsträger ist, wenn sie binnen sechs Monaten nach dem Tag, an dem die Eintragung der Verschmelzung in das Register des Sitzes desjenigen Rechtsträgers, dessen Gläubiger sie sind, nach § 19 Abs. 3 UmwG als bekannt gemacht gilt, ihren Anspruch nach Grund und Höhe in Textform anmelden, Sicherheit zu leisten, soweit sie nicht Befriedigung verlangen können. Dieses Recht steht den Gläubigern jedoch nur zu, wenn sie glaubhaft machen, dass durch die Verschmelzung die Erfüllung ihrer Forderung gefährdet wird."
    },
    {
      "date": "2025-09-12",
      "id": "128955",
      "original_text": "Löschungsankündigung\nBayern Amtsgericht Landshut HRB 6783\nPIN Mail Landshut GmbH – Ergolding",
      "type": "Löschungsankündigung",
      "state": "Bayern",
      "amtsgericht": "Amtsgericht Landshut",
      "registernummer": "HRB 6783",
      "registerart": "HRB",
      "company_name": "PIN Mail Landshut GmbH",
      "company_seat": "Ergolding",
      "details": "12.09.2025 (Bekanntmachungsdatum)\n\nBayern Amtsgericht Landshut HRB 6783\nLöschungsankündigung\n\nPIN Mail Landshut GmbH\nGesellschaft mit beschränkter Haftung\nErgolding\n\nDas Registergericht beabsichtigt, die im Handelsregister eingetragene Gesellschaft wegen Vermögenslosigkeit von Amts wegen nach § 394 FamFG zu löschen. Die Frist zur Erhebung eines Widerspruchs ist auf einen Monat festgesetzt."
    },
    {
      "date": "2025-09-12",
      "id": "128956",
      "original_text": "Registerbekanntmachung nach dem Umwandlungsgesetz\nBayern Amtsgericht Augsburg HRA 13250\nBernhard Stölzl e. K. – Sielenbach-Tödtenried",
      "type": "Registerbekanntmachung nach dem Umwandlungsgesetz",
      "state": "Bayern",
      "amtsgericht": "Amtsgericht Augsburg",
      "registernummer": "HRA 13250",
      "registerart": "HRA",
      "company_name": "Bernhard Stölzl e. K.",
      "company_seat": "Sielenbach-Tödtenried",
      "details": "12.09.2025 (Bekanntmachungsdatum)\n\nBayern Amtsgericht Augsburg HRA 13250\nRegisterbekanntmachung nach dem Umwandlungsgesetz 11.09.2025 (Eintragungsdatum)\n\nBernhard Stölzl e. K.\nEinzelkaufmann / Einzelkauffrau\nSielenbach-Tödtenried\n\nDen Gläubigern der an der Ausgliederung beteiligten Rechtsträger ist, wenn sie binnen sechs Monaten nach dem Tag, an dem die Eintragung der Ausgliederung in das Register des Sitzes desjenigen Rechtsträgers, dessen Gläubiger sie sind, nach §§ 125, 19 Abs. 3 UmwG als bekannt gemacht gilt, ihren Anspruch nach Grund und Höhe in Textform anmelden, Sicherheit zu leisten, soweit sie nicht Befriedigung verlangen können. Dieses Recht steht den Gläubigern jedoch nur zu, wenn sie glaubhaft machen, dass durch die Ausgliederung die Erfüllung ihrer Forderung gefährdet wird."
    },
    {
      "date": "2025-09-12",
      "id": "128957",
      "original_text": "Registerbekanntmachung nach dem Umwandlungsgesetz\nBayern Amtsgericht Landshut HRA 12910\nStegmüller Otto e.K. – Arnstorf",
      "type": "Registerbekanntmachung nach dem Umwandlungsgesetz",
      "state": "Bayern",
      "amtsgericht": "Amtsgericht Landshut",
      "registernummer": "HRA 12910",
      "registerart": "HRA",
      "company_name": "Stegmüller Otto e.K.",
      "company_seat": "Arnstorf",
      "details": "12.09.2025 (Bekanntmachungsdatum)\n\nBayern Amtsgericht Landshut HRA 12910\nRegisterbekanntmachung nach dem Umwandlungsgesetz 11.09.2025 (Eintragungsdatum)\n\nStegmüller Otto e.K.\nEinzelkaufmann / Einzelkauffrau\nArnstorf\n\nDen Gläubigern der an der Ausgliederung beteiligten Rechtsträger ist, wenn sie binnen sechs Monaten nach dem Tag, an dem die Eintragung der Ausgliederung in das Register des Sitzes desjenigen Rechtsträgers, dessen Gläubiger sie sind, nach §§ 125, 19 Abs. 3 UmwG als bekannt gemacht gilt, ihren Anspruch nach Grund und Höhe in Textform anmelden, Sicherheit zu leisten, soweit sie nicht Befriedigung verlangen können. Dieses Recht steht den Gläubigern jedoch nur zu, wenn sie glaubhaft machen, dass durch die Ausgliederung die Erfüllung ihrer Forderung gefährdet wird."
    },
    {
      "date": "2025-09-12",
      "id": "128958",
      "original_text": "Registerbekanntmachung nach dem Umwandlungsgesetz\nBayern Amtsgericht Augsburg HRA 18667\nHermann Leister e. K. – Deiningen",
      "type": "Registerbekanntmachung nach dem Umwandlungsgesetz",
      "state": "Bayern",
      "amtsgericht": "Amtsgericht Augsburg",
      "registernummer": "HRA 18667",
      "registerart": "HRA",
      "company_name": "Hermann Leister e. K.",
      "company_seat": "Deiningen",
      "details": "12.09.2025 (Bekanntmachungsdatum)\n\nBayern Amtsgericht Augsburg HRA 18667\nRegisterbekanntmachung nach dem Umwandlungsgesetz 11.09.2025 (Eintragungsdatum)\n\nHermann Leister e. K.\nEinzelkaufmann / Einzelkauffrau\nDeiningen\n\nDen Gläubigern der an der Verschmelzung beteiligten Rechtsträger ist, wenn sie binnen sechs Monaten nach dem Tag, an dem die Eintragung der Verschmelzung in das Register des Sitzes desjenigen Rechtsträgers, dessen Gläubiger sie sind, nach § 19 Abs. 3 UmwG als bekannt gemacht gilt, ihren Anspruch nach Grund und Höhe in Textform anmelden, Sicherheit zu leisten, soweit sie nicht Befriedigung verlangen können. Dieses Recht steht den Gläubigern jedoch nur zu, wenn sie glaubhaft machen, dass durch die Verschmelzung die Erfüllung ihrer Forderung gefährdet wird."
    },
    {
      "date": "2025-09-12",
      "id": "128959",
      "original_text": "Registerbekanntmachung nach dem Umwandlungsgesetz\nBayern Amtsgericht München HRB 140669\nWavestone Germany AG – München",
      "type": "Registerbekanntmachung nach dem Umwandlungsgesetz",
      "state": "Bayern",
      "amtsgericht": "Amtsgericht München",
      "registernummer": "HRB 140669",
      "registerart": "HRB",
      "company_name": "Wavestone Germany AG",
      "company_seat": "München",
      "details": "12.09.2025 (Bekanntmachungsdatum)\n\nBayern Amtsgericht München HRB 140669\nRegisterbekanntmachung nach dem Umwandlungsgesetz\n\nWavestone Germany AG\nAktiengesellschaft\nMünchen\n\nDem Amtsgericht München -Registergericht- ist ein Verschmelzungsvertrag zwischen der Gesellschaft als übernehmendem Rechtsträger und der New Outcome GmbH, München (Amtsgericht München HRB 261209) zur Einsichtnahme eingereicht worden."
    },
    {
      "date": "2025-09-12",
      "id": "128960",
      "original_text": "Registerbekanntmachung nach dem Umwandlungsgesetz\nBaden-Württemberg Amtsgericht Mannheim HRB 744202\nThe Dudes of Pforzheim GmbH – Bretten",
      "type": "Registerbekanntmachung nach dem Umwandlungsgesetz",
      "state": "Baden-Württemberg",
      "amtsgericht": "Amtsgericht Mannheim",
      "registernummer": "HRB 744202",
      "registerart": "HRB",
      "company_name": "The Dudes of Pforzheim GmbH",
      "company_seat": "Bretten",
      "details": "12.09.2025 (Bekanntmachungsdatum)\n\nBaden-Württemberg Amtsgericht Mannheim HRB 744202\nRegisterbekanntmachung nach dem Umwandlungsgesetz 12.09.2025 (Eintragungsdatum)\n\nThe Dudes of Pforzheim GmbH\nGesellschaft mit beschränkter Haftung\nBretten\n\nDen Gläubigern der an der Verschmelzung beteiligten Rechtsträger ist, wenn sie binnen sechs Monaten nach dem Tag, an dem die Eintragung der Verschmelzung in das Register des Sitzes desjenigen Rechtsträgers, dessen Gläubiger sie sind, nach § 19 Abs. 3 UmwG als bekanntgemacht gilt, ihren Anspruch nach Grund und Höhe schriftlich anmelden, Sicherheit zu leisten, soweit sie nicht Befriedigung verlangen können. Dieses Recht steht den Gläubigern jedoch nur zu, wenn sie glaubhaft machen, dass durch die Verschmelzung die Erfüllung ihrer Forderung gefährdet wird."
    },
    {
      "date": "2025-09-12",
      "id": "128961",
      "original_text": "Löschungsankündigung\nBaden-Württemberg Amtsgericht Mannheim HRB 732892\nDZ ARTEMIS GmbH – Wiesloch",
      "type": "Löschungsankündigung",
      "state": "Baden-Württemberg",
      "amtsgericht": "Amtsgericht Mannheim",
      "registernummer": "HRB 732892",
      "registerart": "HRB",
      "company_name": "DZ ARTEMIS GmbH",
      "company_seat": "Wiesloch",
      "details": "12.09.2025 (Bekanntmachungsdatum)\n\nBaden-Württemberg Amtsgericht Mannheim HRB 732892\nLöschungsankündigung\n\nDZ ARTEMIS GmbH\nGesellschaft mit beschränkter Haftung\nWiesloch\n\nDas Gericht beabsichtigt, die Gesellschaft wegen Vermögenslosigkeit im Handelsregister von Amts wegen nach § 394 FamFG zu löschen. Die Frist zur Geltendmachung eines Widerspruchs gegen die beabsichtigte Löschung ist auf einen Monat ab Veröffentlichung bestimmt."
    },
    {
      "date": "2025-09-12",
      "id": "128962",
      "original_text": "Registerbekanntmachung nach dem Umwandlungsgesetz\nBerlin Amtsgericht Berlin (Charlottenburg) HRB 237430\nWIV Immobilien Holding GmbH – Berlin",
      "type": "Registerbekanntmachung nach dem Umwandlungsgesetz",
      "state": "Berlin",
      "amtsgericht": "Amtsgericht Berlin (Charlottenburg)",
      "registernummer": "HRB 237430",
      "registerart": "HRB",
      "company_name": "WIV Immobilien Holding GmbH",
      "company_seat": "Berlin",
      "details": "12.09.2025 (Bekanntmachungsdatum)\n\nBerlin Amtsgericht Berlin (Charlottenburg) HRB 237430\nRegisterbekanntmachung nach dem Umwandlungsgesetz 11.09.2025 (Eintragungsdatum)\n\nWIV Immobilien Holding GmbH\nGesellschaft mit beschränkter Haftung\nBerlin\n\nZu Eintragungsnummer 3 vom 11.09.2025 wird als nicht eingetragen veröffentlicht: Den Gläubigern der an der Verschmelzung beteiligten Rechtsträger ist, wenn sie binnen sechs Monaten nach dem Tag, an dem die Eintragung der Verschmelzung in das Register des Sitzes desjenigen Rechtsträgers, dessen Gläubiger sie sind, als bekannt gemacht gilt, ihren Anspruch nach Grund und Höhe schriftlich anmelden, Sicherheit zu leisten, soweit sie nicht Befriedigung verlangen können. Dieses Recht steht den Gläubigern jedoch nur zu, wenn sie glaubhaft machen, dass durch die Verschmelzung die Erfüllung ihrer Forderung gefährdet wird. Das Recht, Sicherheitsleistung zu verlangen, steht Gläubigern nicht zu, die im Falle der Insolvenz ein Recht auf vorzugsweise Befriedigung aus einer Deckungsmasse haben, die nach gesetzlicher Vorschrift zu ihrem Schutz errichtet und staatlich überwacht ist."
    },
    {
      "date": "2025-09-12",
      "id": "128963",
      "original_text": "Löschungsankündigung\nBerlin Amtsgericht Berlin (Charlottenburg) HRB 179370\nShopall24 Germany GmbH – Berlin",
      "type": "Löschungsankündigung",
      "state": "Berlin",
      "amtsgericht": "Amtsgericht Berlin (Charlottenburg)",
      "registernummer": "HRB 179370",
      "registerart": "HRB",
      "company_name": "Shopall24 Germany GmbH",
      "company_seat": "Berlin",
      "details": "12.09.2025 (Bekanntmachungsdatum)\n\nBerlin Amtsgericht Berlin (Charlottenburg) HRB 179370\nLöschungsankündigung\n\nShopall24 Germany GmbH\nGesellschaft mit beschränkter Haftung\nBerlin\n\nBei der nachstehenden Gesellschaft wird das Amtslöschungsverfahren gemäß § 394 FamFG eingeleitet. Widerspruchsfrist 6 Wochen"
    },
    {
      "date": "2025-09-12",
      "id": "128964",
      "original_text": "Löschungsankündigung\nSchleswig-Holstein Amtsgericht Flensburg HRB 14377\nTALO II UG (haftungsbeschränkt) – Leck",
      "type": "Löschungsankündigung",
      "state": "Schleswig-Holstein",
      "amtsgericht": "Amtsgericht Flensburg",
      "registernummer": "HRB 14377",
      "registerart": "HRB",
      "company_name": "TALO II UG (haftungsbeschränkt)",
      "company_seat": "Leck",
      "details": "12.09.2025 (Bekanntmachungsdatum)\n\nSchleswig-Holstein Amtsgericht Flensburg HRB 14377\nLöschungsankündigung\n\nTALO II UG (haftungsbeschränkt)\nGesellschaft mit beschränkter Haftung\nLeck\n\nEs ist die Löschung der nachstehenden Gesellschaft wegen Vermögenslosigkeit gemäß § 394 FamFG beabsichtigt.\nWiderspruchsfrist: 2 Monate."
    },
    {
      "date": "2025-09-12",
      "id": "128965",
      "original_text": "Registerbekanntmachung nach dem Umwandlungsgesetz\nBaden-Württemberg Amtsgericht Mannheim HRB 730338\nSunshine Fahrschule UG (haftungsbeschränkt) – Dielheim",
      "type": "Registerbekanntmachung nach dem Umwandlungsgesetz",
      "state": "Baden-Württemberg",
      "amtsgericht": "Amtsgericht Mannheim",
      "registernummer": "HRB 730338",
      "registerart": "HRB",
      "company_name": "Sunshine Fahrschule UG (haftungsbeschränkt)",
      "company_seat": "Dielheim",
      "details": "12.09.2025 (Bekanntmachungsdatum)\n\nBaden-Württemberg Amtsgericht Mannheim HRB 730338\nRegisterbekanntmachung nach dem Umwandlungsgesetz\n\nSunshine Fahrschule UG (haftungsbeschränkt)\nGesellschaft mit beschränkter Haftung\nDielheim\n\nDas Gericht beabsichtigt, die Gesellschaft wegen Vermögenslosigkeit im Handelsregister von Amts wegen nach § 394 FamFG zu löschen. Die Frist zur Geltendmachung eines Widerspruchs gegen die beabsichtigte Löschung ist auf einen Monat ab Veröffentlichung bestimmt."
    },
    {
      "date": "2025-09-12",
      "id": "128966",
      "original_text": "Registerbekanntmachung nach dem Umwandlungsgesetz\nBrandenburg Amtsgericht Cottbus HRB 14518\nRandalswood Germany GmbH – Schönefeld",
      "type": "Registerbekanntmachung nach dem Umwandlungsgesetz",
      "state": "Brandenburg",
      "amtsgericht": "Amtsgericht Cottbus",
      "registernummer": "HRB 14518",
      "registerart": "HRB",
      "company_name": "Randalswood Germany GmbH",
      "company_seat": "Schönefeld",
      "details": "12.09.2025 (Bekanntmachungsdatum)\n\nBrandenburg Amtsgericht Cottbus HRB 14518\nRegisterbekanntmachung nach dem Umwandlungsgesetz 11.09.2025 (Eintragungsdatum)\n\nRandalswood Germany GmbH\nGesellschaft mit beschränkter Haftung\nSchönefeld\n\nZu Eintragungsnummer 6 vom 11.09.2025 wird als nicht eingetragen veröffentlicht:\nDen Gläubigern der an der Ausgliederung beteiligten Rechtsträger ist, wenn sie binnen sechs Monaten nach dem Tag, an dem die Eintragung der Ausgliederung in das Register des Sitzes desjenigen Rechtsträgers, dessen Gläubiger sie sind, als bekannt gemacht gilt, ihren Anspruch nach Grund und Höhe schriftlich anmelden, Sicherheit zu leisten, soweit sie nicht Befriedigung verlangen können. Dieses Recht steht den Gläubigern jedoch nur zu, wenn sie glaubhaft machen, dass durch die Ausgliederung die Erfüllung ihrer Forderung gefährdet wird."
    },
    {
      "date": "2025-09-12",
      "id": "128967",
      "original_text": "Registerbekanntmachung nach dem Umwandlungsgesetz\nBerlin Amtsgericht Berlin (Charlottenburg) HRB 126046\nLibra 6 GmbH – Berlin",
      "type": "Registerbekanntmachung nach dem Umwandlungsgesetz",
      "state": "Berlin",
      "amtsgericht": "Amtsgericht Berlin (Charlottenburg)",
      "registernummer": "HRB 126046",
      "registerart": "HRB",
      "company_name": "Libra 6 GmbH",
      "company_seat": "Berlin",
      "details": "12.09.2025 (Bekanntmachungsdatum)\n\nBerlin Amtsgericht Berlin (Charlottenburg) HRB 126046\nRegisterbekanntmachung nach dem Umwandlungsgesetz 09.09.2025 (Eintragungsdatum)\n\nLibra 6 GmbH\nGesellschaft mit beschränkter Haftung\nBerlin\n\nZu Eintragungsnummer 5 vom 09.09.2025 wird als nicht eingetragen veröffentlicht: Den Gläubigern der an der Verschmelzung beteiligten Rechtsträger ist, wenn sie binnen sechs Monaten nach dem Tag, an dem die Eintragung der Verschmelzung in das Register des Sitzes desjenigen Rechtsträgers, dessen Gläubiger sie sind, als bekannt gemacht gilt, ihren Anspruch nach Grund und Höhe schriftlich anmelden, Sicherheit zu leisten, soweit sie nicht Befriedigung verlangen können. Dieses Recht steht den Gläubigern jedoch nur zu, wenn sie glaubhaft machen, dass durch die Verschmelzung die Erfüllung ihrer Forderung gefährdet wird. Das Recht, Sicherheitsleistung zu verlangen, steht Gläubigern nicht zu, die im Falle der Insolvenz ein Recht auf vorzugsweise Befriedigung aus einer Deckungsmasse haben, die nach gesetzlicher Vorschrift zu ihrem Schutz errichtet und staatlich überwacht ist."
    },
    {
      "date": "2025-09-12",
      "id": "128968",
      "original_text": "Registerbekanntmachung nach dem Umwandlungsgesetz\nBrandenburg Amtsgericht Potsdam HRA 1803\nBaustoffwerke Ruhlsdorf GmbH & Co. KG – Ruhlsdorf",
      "type": "Registerbekanntmachung nach dem Umwandlungsgesetz",
      "state": "Brandenburg",
      "amtsgericht": "Amtsgericht Potsdam",
      "registernummer": "HRA 1803",
      "registerart": "HRA",
      "company_name": "Baustoffwerke Ruhlsdorf GmbH & Co. KG",
      "company_seat": "Ruhlsdorf",
      "details": "12.09.2025 (Bekanntmachungsdatum)\n\nBrandenburg Amtsgericht Potsdam HRA 1803\nRegisterbekanntmachung nach dem Umwandlungsgesetz 11.09.2025 (Eintragungsdatum)\n\nBaustoffwerke Ruhlsdorf GmbH & Co. KG\nKommanditgesellschaft\nRuhlsdorf\n\nZu Eintragungsnummer 3 vom 11.09.2025 wird als nicht eingetragen veröffentlicht: Den Gläubigern der an der Verschmelzung beteiligten Rechtsträger ist, wenn sie binnen sechs Monaten nach dem Tag, an dem die Eintragung der Verschmelzung in das Register des Sitzes desjenigen Rechtsträgers, dessen Gläubiger sie sind, als bekannt gemacht gilt, ihren Anspruch nach Grund und Höhe schriftlich anmelden, Sicherheit zu leisten, soweit sie nicht Befriedigung verlangen können. Dieses Recht steht den Gläubigern jedoch nur zu, wenn sie glaubhaft machen, dass durch die Verschmelzung die Erfüllung ihrer Forderung gefährdet wird."
    },
    {
      "date": "2025-09-12",
      "id": "128969",
      "original_text": "Registerbekanntmachung nach dem Umwandlungsgesetz\nBaden-Württemberg Amtsgericht Stuttgart GnR 400003\nVolksbank Zollernalb eG – Balingen",
      "type": "Registerbekanntmachung nach dem Umwandlungsgesetz",
      "state": "Baden-Württemberg",
      "amtsgericht": "Amtsgericht Stuttgart",
      "registernummer": "GnR 400003",
      "registerart": "GnR",
      "company_name": "Volksbank Zollernalb eG",
      "company_seat": "Balingen",
      "details": "12.09.2025 (Bekanntmachungsdatum)\n\nBaden-Württemberg Amtsgericht Stuttgart GnR 400003\nRegisterbekanntmachung nach dem Umwandlungsgesetz 12.09.2025 (Eintragungsdatum)\n\nVolksbank Zollernalb eG\neingetragene Genossenschaft\nBalingen\n\nDen Gläubigern der an der Verschmelzung beteiligten Rechtsträger ist, wenn sie binnen sechs Monaten nach dem Tag, an dem die Eintragung der Verschmelzung in das Register des Sitzes desjenigen Rechtsträgers, dessen Gläubiger sie sind, nach § 19 Abs. 3 UmwG als bekanntgemacht gilt, ihren Anspruch nach Grund und Höhe schriftlich anmelden, Sicherheit zu leisten, soweit sie nicht Befriedigung verlangen können. Dieses Recht steht den Gläubigern jedoch nur zu, wenn sie glaubhaft machen, dass durch die Verschmelzung die Erfüllung ihrer Forderung gefährdet wird."
    },
    {
      "date": "2025-09-12",
      "id": "128970",
      "original_text": "Registerbekanntmachung nach dem Umwandlungsgesetz\nBaden-Württemberg Amtsgericht Mannheim HRA 332585\nBahnhof Apotheke Frank Knecht – Eberbach",
      "type": "Registerbekanntmachung nach dem Umwandlungsgesetz",
      "state": "Baden-Württemberg",
      "amtsgericht": "Amtsgericht Mannheim",
      "registernummer": "HRA 332585",
      "registerart": "HRA",
      "company_name": "Bahnhof Apotheke Frank Knecht",
      "company_seat": "Eberbach",
      "details": "12.09.2025 (Bekanntmachungsdatum)\n\nBaden-Württemberg Amtsgericht Mannheim HRA 332585\nRegisterbekanntmachung nach dem Umwandlungsgesetz 12.09.2025 (Eintragungsdatum)\n\nBahnhof Apotheke Frank Knecht\nEinzelkaufmann / Einzelkauffrau\nEberbach\n\nDen Gläubigern der an der Ausgliederung beteiligten Rechtsträger ist, wenn sie binnen sechs Monaten nach dem Tag, an dem die Eintragung der Ausgliederung in das Register des Sitzes desjenigen Rechtsträgers, dessen Gläubiger sie sind, nach § 19 Abs. 3 UmwG als bekanntgemacht gilt, ihren Anspruch nach Grund und Höhe schriftlich anmelden, Sicherheit zu leisten, soweit sie nicht Befriedigung verlangen können. Dieses Recht steht den Gläubigern jedoch nur zu, wenn sie glaubhaft machen, dass durch die Ausgliederung die Erfüllung ihrer Forderung gefährdet wird."
    },
    {
      "date": "2025-09-12",
      "id": "128971",
      "original_text": "Einreichung neuer Dokumente\nBerlin Amtsgericht Berlin (Charlottenburg) HRB 103698\nVolleyball Bundesliga GmbH – Berlin",
      "type": "Einreichung neuer Dokumente",
      "state": "Berlin",
      "amtsgericht": "Amtsgericht Berlin (Charlottenburg)",
      "registernummer": "HRB 103698",
      "registerart": "HRB",
      "company_name": "Volleyball Bundesliga GmbH",
      "company_seat": "Berlin",
      "details": "12.09.2025 (Bekanntmachungsdatum)\n\nBerlin Amtsgericht Berlin (Charlottenburg) HRB 103698\nEinreichung neuer Dokumente\n\nVolleyball Bundesliga GmbH\nGesellschaft mit beschränkter Haftung\nBerlin\n\nAls nicht eingetragen wird veröffentlicht: Es wurde eine neue Liste der Aufsichtsratsmitglieder eingereicht (§52 GmbHG)."
    },
    {
      "date": "2025-09-12",
      "id": "128972",
      "original_text": "Registerbekanntmachung nach dem Umwandlungsgesetz\nSaarland Amtsgericht Saarbrücken HRB 104551\nIDA GmbH – Nalbach",
      "type": "Registerbekanntmachung nach dem Umwandlungsgesetz",
      "state": "Saarland",
      "amtsgericht": "Amtsgericht Saarbrücken",
      "registernummer": "HRB 104551",
      "registerart": "HRB",
      "company_name": "IDA GmbH",
      "company_seat": "Nalbach",
      "details": "12.09.2025 (Bekanntmachungsdatum)\n\nSaarland Amtsgericht Saarbrücken HRB 104551\nRegisterbekanntmachung nach dem Umwandlungsgesetz 12.09.2025 (Eintragungsdatum)\n\nIDA GmbH\nGesellschaft mit beschränkter Haftung\nNalbach\n\nAls nicht eingetragen wird bekannt gemacht: Den Gläubigern der an der Verschmelzung beteiligten Gesellschaften ist, wenn sie binnen sechs Monaten nach dem Tag, an dem die Eintragung der Verschmelzung in das Register des Sitzes desjenigen Rechtsträgers, dessen Gläubiger sie sind, nach § 19 Absatz 3 UmwG bekannt gemacht worden ist, ihren Anspruch nach Grund und Höhe schriftlich anmelden, Sicherheit zu leisten, soweit sie nicht Befriedigung verlangen können. Dieses Recht steht den Gläubigern jedoch nur zu, wenn sie glaubhaft machen, dass durch die Verschmelzung die Erfüllung ihrer Forderung gefährdet wird."
    },
    {
      "date": "2025-09-12",
      "id": "128973",
      "original_text": "Registerbekanntmachung nach dem Umwandlungsgesetz\nBaden-Württemberg Amtsgericht Mannheim HRA 712724\nA. Knecht & F. Knecht oHG – Eberbach",
      "type": "Registerbekanntmachung nach dem Umwandlungsgesetz",
      "state": "Baden-Württemberg",
      "amtsgericht": "Amtsgericht Mannheim",
      "registernummer": "HRA 712724",
      "registerart": "HRA",
      "company_name": "A. Knecht & F. Knecht oHG",
      "company_seat": "Eberbach",
      "details": "12.09.2025 (Bekanntmachungsdatum)\n\nBaden-Württemberg Amtsgericht Mannheim HRA 712724\nRegisterbekanntmachung nach dem Umwandlungsgesetz 12.09.2025 (Eintragungsdatum)\n\nA. Knecht & F. Knecht oHG\nOffene Handelsgesellschaft\nEberbach\n\nAls nicht eingetragen wird bekanntgemacht:\nDen Gläubigern der an der Ausgliederung beteiligten Rechtsträger ist, wenn sie binnen sechs Monaten nach dem Tag, an dem die Eintragung der Ausgliederung in das Register des Sitzes desjenigen Rechtsträgers, dessen Gläubiger sie sind, nach § 19 Abs. 3 UmwG als bekanntgemacht gilt, ihren Anspruch nach Grund und Höhe schriftlich anmelden, Sicherheit zu leisten, soweit sie nicht Befriedigung verlangen können. Dieses Recht steht den Gläubigern jedoch nur zu, wenn sie glaubhaft machen, dass durch die Ausgliederung die Erfüllung ihrer Forderung gefährdet wird."
    },
    {
      "date": "2025-09-12",
      "id": "128974",
      "original_text": "Registerbekanntmachung nach dem Umwandlungsgesetz\nBrandenburg Amtsgericht Cottbus HRB 10147\nExecuJet Europe GmbH – Schönefeld",
      "type": "Registerbekanntmachung nach dem Umwandlungsgesetz",
      "state": "Brandenburg",
      "amtsgericht": "Amtsgericht Cottbus",
      "registernummer": "HRB 10147",
      "registerart": "HRB",
      "company_name": "ExecuJet Europe GmbH",
      "company_seat": "Schönefeld",
      "details": "12.09.2025 (Bekanntmachungsdatum)\n\nBrandenburg Amtsgericht Cottbus HRB 10147\nRegisterbekanntmachung nach dem Umwandlungsgesetz 11.09.2025 (Eintragungsdatum)\n\nExecuJet Europe GmbH\nGesellschaft mit beschränkter Haftung\nSchönefeld\n\nAls nicht eingetragen wird veröffentlicht:\nDen Gläubigern der an der Verschmelzung beteiligten Rechtsträger ist, wenn sie binnen sechs Monaten nach dem Tag, an dem die Eintragung der Verschmelzung in das Register des Sitzes desjenigen Rechtsträgers, dessen Gläubiger sie sind, als bekannt gemacht gilt, ihren Anspruch nach Grund und Höhe schriftlich anmelden, Sicherheit zu leisten, soweit sie nicht Befriedigung verlangen können. Dieses Recht steht den Gläubigern jedoch nur zu, wenn sie glaubhaft machen, dass durch die Verschmelzung die Erfüllung ihrer Forderung gefährdet wird"
    },
    {
      "date": "2025-09-12",
      "id": "128975",
      "original_text": "Registerbekanntmachung nach dem Umwandlungsgesetz\nBaden-Württemberg Amtsgericht Mannheim HRA 712802\nSezer Hausverwaltung e.K. – Oftersheim",
      "type": "Registerbekanntmachung nach dem Umwandlungsgesetz",
      "state": "Baden-Württemberg",
      "amtsgericht": "Amtsgericht Mannheim",
      "registernummer": "HRA 712802",
      "registerart": "HRA",
      "company_name": "Sezer Hausverwaltung e.K.",
      "company_seat": "Oftersheim",
      "details": "12.09.2025 (Bekanntmachungsdatum)\n\nBaden-Württemberg Amtsgericht Mannheim HRA 712802\nRegisterbekanntmachung nach dem Umwandlungsgesetz 12.09.2025 (Eintragungsdatum)\n\nSezer Hausverwaltung e.K.\nEinzelkaufmann / Einzelkauffrau\nOftersheim\n\nDen Gläubigern der an der Verschmelzung beteiligten Rechtsträger ist, wenn sie binnen sechs Monaten nach dem Tag, an dem die Eintragung der Verschmelzung in das Register des Sitzes desjenigen Rechtsträgers, dessen Gläubiger sie sind, nach § 19 Abs. 3 UmwG als bekanntgemacht gilt, ihren Anspruch nach Grund und Höhe schriftlich anmelden, Sicherheit zu leisten, soweit sie nicht Befriedigung verlangen können. Dieses Recht steht den Gläubigern jedoch nur zu, wenn sie glaubhaft machen, dass durch die Verschmelzung die Erfüllung ihrer Forderung gefährdet wird."
    },
    {
      "date": "2025-09-12",
      "id": "128976",
      "original_text": "Registerbekanntmachung nach dem Umwandlungsgesetz\nHamburg Amtsgericht Hamburg HRB 131236\nJur Solutions GmbH – Hamburg",
      "type": "Registerbekanntmachung nach dem Umwandlungsgesetz",
      "state": "Hamburg",
      "amtsgericht": "Amtsgericht Hamburg",
      "registernummer": "HRB 131236",
      "registerart": "HRB",
      "company_name": "Jur Solutions GmbH",
      "company_seat": "Hamburg",
      "details": "12.09.2025 (Bekanntmachungsdatum)\n\nHamburg Amtsgericht Hamburg HRB 131236\nRegisterbekanntmachung nach dem Umwandlungsgesetz 12.09.2025 (Eintragungsdatum)\n\nJur Solutions GmbH\nGesellschaft mit beschränkter Haftung\nHamburg\n\nAls nicht eingetragen wird bekannt gemacht:\nDen Gläubigern der an der Verschmelzung beteiligten Gesellschaften ist, wenn sie binnen sechs Monaten nach dem Tag, an dem die Eintragung der Verschmelzung in das Register des Sitzes desjenigen Rechtsträgers, dessen Gläubiger sie sind, nach § 19 Absatz 3 UmwG als bekannt gemacht gilt, ihren Anspruch nach Grund und Höhe schriftlich anmelden, Sicherheit zu leisten, soweit sie nicht Befriedigung verlangen können. Dieses Recht steht den Gläubigern jedoch nur zu, wenn sie glaubhaft machen, dass durch die Verschmelzung die Erfüllung ihrer Forderung gefährdet wird."
    },
    {
      "date": "2025-09-12",
      "id": "128977",
      "original_text": "Registerbekanntmachung nach dem Umwandlungsgesetz\nHamburg Amtsgericht Hamburg HRB 20082\nWolfram Kreisl GmbH. – Hamburg",
      "type": "Registerbekanntmachung nach dem Umwandlungsgesetz",
      "state": "Hamburg",
      "amtsgericht": "Amtsgericht Hamburg",
      "registernummer": "HRB 20082",
      "registerart": "HRB",
      "company_name": "Wolfram Kreisl GmbH.",
      "company_seat": "Hamburg",
      "details": "12.09.2025 (Bekanntmachungsdatum)\n\nHamburg Amtsgericht Hamburg HRB 20082\nRegisterbekanntmachung nach dem Umwandlungsgesetz 12.09.2025 (Eintragungsdatum)\n\nWolfram Kreisl GmbH.\nGesellschaft mit beschränkter Haftung\nHamburg\n\nAls nicht eingetragen wird bekannt gemacht:\nDen Gläubigern der an der Verschmelzung beteiligten Gesellschaften ist, wenn sie binnen sechs Monaten nach dem Tag, an dem die Eintragung der Verschmelzung in das Register des Sitzes desjenigen Rechtsträgers, dessen Gläubiger sie sind, nach § 19 Absatz 3 UmwG als bekannt gemacht gilt, ihren Anspruch nach Grund und Höhe schriftlich anmelden, Sicherheit zu leisten, soweit sie nicht Befriedigung verlangen können. Dieses Recht steht den Gläubigern jedoch nur zu, wenn sie glaubhaft machen, dass durch die Verschmelzung die Erfüllung ihrer Forderung gefährdet wird."
    },
    {
      "date": "2025-09-12",
      "id": "128978",
      "original_text": "Registerbekanntmachung nach dem Umwandlungsgesetz\nBaden-Württemberg Amtsgericht Freiburg HRA 709175\nNiederberger Putz & Stuck GmbH & Co. KG – Singen Hohentwiel",
      "type": "Registerbekanntmachung nach dem Umwandlungsgesetz",
      "state": "Baden-Württemberg",
      "amtsgericht": "Amtsgericht Freiburg",
      "registernummer": "HRA 709175",
      "registerart": "HRA",
      "company_name": "Niederberger Putz & Stuck GmbH & Co. KG",
      "company_seat": "Singen Hohentwiel",
      "details": "12.09.2025 (Bekanntmachungsdatum)\n\nBaden-Württemberg Amtsgericht Freiburg HRA 709175\nRegisterbekanntmachung nach dem Umwandlungsgesetz 12.09.2025 (Eintragungsdatum)\n\nNiederberger Putz & Stuck GmbH & Co. KG\nKommanditgesellschaft\nSingen Hohentwiel\n\nDen Gläubigern der an der Ausgliederung beteiligten Rechtsträger ist, wenn sie binnen sechs Monaten nach dem Tag, an dem die Eintragung der Ausgliederung in das Register des Sitzes desjenigen Rechtsträgers, dessen Gläubiger sie sind, nach § 19 Abs. 3 UmwG als bekanntgemacht gilt, ihren Anspruch nach Grund und Höhe schriftlich anmelden, Sicherheit zu leisten, soweit sie nicht Befriedigung verlangen können. Dieses Recht steht den Gläubigern jedoch nur zu, wenn sie glaubhaft machen, dass durch die Ausgliederung die Erfüllung ihrer Forderung gefährdet wird."
    },
    {
      "date": "2025-09-12",
      "id": "128979",
      "original_text": "Registerbekanntmachung nach dem Umwandlungsgesetz\nBaden-Württemberg Amtsgericht Freiburg HRA 708918\nElmar Niederberger Gipser-, Stuckateur- und Verpachtungsbetrieb e. K. – Singen Hohentwiel",
      "type": "Registerbekanntmachung nach dem Umwandlungsgesetz",
      "state": "Baden-Württemberg",
      "amtsgericht": "Amtsgericht Freiburg",
      "registernummer": "HRA 708918",
      "registerart": "HRA",
      "company_name": "Elmar Niederberger Gipser-, Stuckateur- und Verpachtungsbetrieb e. K.",
      "company_seat": "Singen Hohentwiel",
      "details": "12.09.2025 (Bekanntmachungsdatum)\n\nBaden-Württemberg Amtsgericht Freiburg HRA 708918\nRegisterbekanntmachung nach dem Umwandlungsgesetz 12.09.2025 (Eintragungsdatum)\n\nElmar Niederberger Gipser-, Stuckateur- und Verpachtungsbetrieb e. K.\nEinzelkaufmann / Einzelkauffrau\nSingen Hohentwiel\n\nAls nicht eingetragen wird bekanntgemacht:\nDen Gläubigern der an der Ausgliederung beteiligten Rechtsträger ist, wenn sie binnen sechs Monaten nach dem Tag, an dem die Eintragung der Ausgliederung in das Register des Sitzes desjenigen Rechtsträgers, dessen Gläubiger sie sind, nach § 19 Abs. 3 UmwG als bekanntgemacht gilt, ihren Anspruch nach Grund und Höhe schriftlich anmelden, Sicherheit zu leisten, soweit sie nicht Befriedigung verlangen können. Dieses Recht steht den Gläubigern jedoch nur zu, wenn sie glaubhaft machen, dass durch die Ausgliederung die Erfüllung ihrer Forderung gefährdet wird."
    },
    {
      "date": "2025-09-12",
      "id": "128980",
      "original_text": "Registerbekanntmachung nach dem Umwandlungsgesetz\nBerlin Amtsgericht Berlin (Charlottenburg) HRB 211669\nBetter Financial Services GmbH – Berlin",
      "type": "Registerbekanntmachung nach dem Umwandlungsgesetz",
      "state": "Berlin",
      "amtsgericht": "Amtsgericht Berlin (Charlottenburg)",
      "registernummer": "HRB 211669",
      "registerart": "HRB",
      "company_name": "Better Financial Services GmbH",
      "company_seat": "Berlin",
      "details": "12.09.2025 (Bekanntmachungsdatum)\n\nBerlin Amtsgericht Berlin (Charlottenburg) HRB 211669\nRegisterbekanntmachung nach dem Umwandlungsgesetz 12.09.2025 (Eintragungsdatum)\n\nBetter Financial Services GmbH\nGesellschaft mit beschränkter Haftung\nBerlin\n\nZu Eintragungsnummer 2 vom 12.09.2025 wird als nicht eingetragen veröffentlicht: Den Gläubigern der an der Verschmelzung beteiligten Rechtsträger ist, wenn sie binnen sechs Monaten nach dem Tag, an dem die Eintragung der Verschmelzung in das Register des Sitzes desjenigen Rechtsträgers, dessen Gläubiger sie sind, als bekannt gemacht gilt, ihren Anspruch nach Grund und Höhe schriftlich anmelden, Sicherheit zu leisten, soweit sie nicht Befriedigung verlangen können. Dieses Recht steht den Gläubigern jedoch nur zu, wenn sie glaubhaft machen, dass durch die Verschmelzung die Erfüllung ihrer Forderung gefährdet wird. Das Recht, Sicherheitsleistung zu verlangen, steht Gläubigern nicht zu, die im Falle der Insolvenz ein Recht auf vorzugsweise Befriedigung aus einer Deckungsmasse haben, die nach gesetzlicher Vorschrift zu ihrem Schutz errichtet und staatlich überwacht ist."
    },
    {
      "date": "2025-09-12",
      "id": "128981",
      "original_text": "Registerbekanntmachung nach dem Umwandlungsgesetz\nBaden-Württemberg Amtsgericht Stuttgart HRB 801646\nMagna PT B.V. & Co. KGaA – Untergruppenbach",
      "type": "Registerbekanntmachung nach dem Umwandlungsgesetz",
      "state": "Baden-Württemberg",
      "amtsgericht": "Amtsgericht Stuttgart",
      "registernummer": "HRB 801646",
      "registerart": "HRB",
      "company_name": "Magna PT B.V. & Co. KGaA",
      "company_seat": "Untergruppenbach",
      "details": "12.09.2025 (Bekanntmachungsdatum)\n\nBaden-Württemberg Amtsgericht Stuttgart HRB 801646\nRegisterbekanntmachung nach dem Umwandlungsgesetz 12.09.2025 (Eintragungsdatum)\n\nMagna PT B.V. & Co. KGaA\nKommanditgesellschaft auf Aktien\nUntergruppenbach\n\nAls nicht eingetragen wird bekanntgemacht:\nDen Gläubigern des an dem Formwechsel beteiligten Rechtsträgers ist, wenn sie binnen sechs Monaten nach dem Tag, an dem die Eintragung des Formwechsels in das Register des Sitzes desjenigen Rechtsträgers, dessen Gläubiger sie sind, nach § 19 Abs. 3 UmwG als bekanntgemacht gilt, ihren Anspruch nach Grund und Höhe schriftlich anmelden, Sicherheit zu leisten, soweit sie nicht Befriedigung verlangen können. Dieses Recht steht den Gläubigern jedoch nur zu, wenn sie glaubhaft machen, dass durch den Formwechsel die Erfüllung ihrer Forderung gefährdet wird."
    },
    {
      "date": "2025-09-12",
      "id": "128982",
      "original_text": "Registerbekanntmachung nach dem Umwandlungsgesetz\nBerlin Amtsgericht Berlin (Charlottenburg) HRB 156865\nBetter Payment Germany GmbH – Berlin",
      "type": "Registerbekanntmachung nach dem Umwandlungsgesetz",
      "state": "Berlin",
      "amtsgericht": "Amtsgericht Berlin (Charlottenburg)",
      "registernummer": "HRB 156865",
      "registerart": "HRB",
      "company_name": "Better Payment Germany GmbH",
      "company_seat": "Berlin",
      "details": "12.09.2025 (Bekanntmachungsdatum)\n\nBerlin Amtsgericht Berlin (Charlottenburg) HRB 156865\nRegisterbekanntmachung nach dem Umwandlungsgesetz 12.09.2025 (Eintragungsdatum)\n\nBetter Payment Germany GmbH\nGesellschaft mit beschränkter Haftung\nBerlin\n\nZu Eintragungsnummer 9 vom 12.09.2025 wird als nicht eingetragen veröffentlicht: Den Gläubigern der an der Verschmelzung beteiligten Rechtsträger ist, wenn sie binnen sechs Monaten nach dem Tag, an dem die Eintragung der Verschmelzung in das Register des Sitzes desjenigen Rechtsträgers, dessen Gläubiger sie sind, als bekannt gemacht gilt, ihren Anspruch nach Grund und Höhe schriftlich anmelden, Sicherheit zu leisten, soweit sie nicht Befriedigung verlangen können. Dieses Recht steht den Gläubigern jedoch nur zu, wenn sie glaubhaft machen, dass durch die Verschmelzung die Erfüllung ihrer Forderung gefährdet wird. Das Recht, Sicherheitsleistung zu verlangen, steht Gläubigern nicht zu, die im Falle der Insolvenz ein Recht auf vorzugsweise Befriedigung aus einer Deckungsmasse haben, die nach gesetzlicher Vorschrift zu ihrem Schutz errichtet und staatlich überwacht ist."
    },
    {
      "date": "2025-09-12",
      "id": "128983",
      "original_text": "Registerbekanntmachung nach dem Umwandlungsgesetz\nBaden-Württemberg Amtsgericht Stuttgart HRA 104271\nMagna PT B.V. & Co. KG – Untergruppenbach",
      "type": "Registerbekanntmachung nach dem Umwandlungsgesetz",
      "state": "Baden-Württemberg",
      "amtsgericht": "Amtsgericht Stuttgart",
      "registernummer": "HRA 104271",
      "registerart": "HRA",
      "company_name": "Magna PT B.V. & Co. KG",
      "company_seat": "Untergruppenbach",
      "details": "12.09.2025 (Bekanntmachungsdatum)\n\nBaden-Württemberg Amtsgericht Stuttgart HRA 104271\nRegisterbekanntmachung nach dem Umwandlungsgesetz 12.09.2025 (Eintragungsdatum)\n\nMagna PT B.V. & Co. KG\nKommanditgesellschaft\nUntergruppenbach\n\nAls nicht eingetragen wird bekanntgemacht:\nDen Gläubigern des an dem Formwechsel beteiligten Rechtsträgers ist, wenn sie binnen sechs Monaten nach dem Tag, an dem die Eintragung des Formwechsels in das Register des Sitzes desjenigen Rechtsträgers, dessen Gläubiger sie sind, nach § 19 Abs. 3 UmwG als bekanntgemacht gilt, ihren Anspruch nach Grund und Höhe schriftlich anmelden, Sicherheit zu leisten, soweit sie nicht Befriedigung verlangen können. Dieses Recht steht den Gläubigern jedoch nur zu, wenn sie glaubhaft machen, dass durch den Formwechsel die Erfüllung ihrer Forderung gefährdet wird."
    },
    {
      "date": "2025-09-12",
      "id": "128984",
      "original_text": "Registerbekanntmachung nach dem Umwandlungsgesetz\nBaden-Württemberg Amtsgericht Mannheim HRB 748760\nTrouble Hausverwaltung GmbH – Oftersheim",
      "type": "Registerbekanntmachung nach dem Umwandlungsgesetz",
      "state": "Baden-Württemberg",
      "amtsgericht": "Amtsgericht Mannheim",
      "registernummer": "HRB 748760",
      "registerart": "HRB",
      "company_name": "Trouble Hausverwaltung GmbH",
      "company_seat": "Oftersheim",
      "details": "12.09.2025 (Bekanntmachungsdatum)\n\nBaden-Württemberg Amtsgericht Mannheim HRB 748760\nRegisterbekanntmachung nach dem Umwandlungsgesetz 12.09.2025 (Eintragungsdatum)\n\nTrouble Hausverwaltung GmbH\nGesellschaft mit beschränkter Haftung\nOftersheim\n\nDen Gläubigern der an der Verschmelzung beteiligten Rechtsträger ist, wenn sie binnen sechs Monaten nach dem Tag, an dem die Eintragung der Verschmelzung in das Register des Sitzes desjenigen Rechtsträgers, dessen Gläubiger sie sind, nach § 19 Abs. 3 UmwG als bekanntgemacht gilt, ihren Anspruch nach Grund und Höhe schriftlich anmelden, Sicherheit zu leisten, soweit sie nicht Befriedigung verlangen können. Dieses Recht steht den Gläubigern jedoch nur zu, wenn sie glaubhaft machen, dass durch die Verschmelzung die Erfüllung ihrer Forderung gefährdet wird."
    },
    {
      "date": "2025-09-12",
      "id": "128985",
      "original_text": "Registerbekanntmachung nach dem Umwandlungsgesetz\nBerlin Amtsgericht Berlin (Charlottenburg) HRB 265545\nTele Columbus Luxembourg GmbH – Berlin",
      "type": "Registerbekanntmachung nach dem Umwandlungsgesetz",
      "state": "Berlin",
      "amtsgericht": "Amtsgericht Berlin (Charlottenburg)",
      "registernummer": "HRB 265545",
      "registerart": "HRB",
      "company_name": "Tele Columbus Luxembourg GmbH",
      "company_seat": "Berlin",
      "details": "12.09.2025 (Bekanntmachungsdatum)\n\nBerlin Amtsgericht Berlin (Charlottenburg) HRB 265545\nRegisterbekanntmachung nach dem Umwandlungsgesetz 11.09.2025 (Eintragungsdatum)\n\nTele Columbus Luxembourg GmbH\nGesellschaft mit beschränkter Haftung\nBerlin\n\nZu Eintragungsnummer 5 vom 11.09.2025 wird als nicht eingetragen veröffentlicht: Den Gläubigern der an der Verschmelzung beteiligten Rechtsträger ist, wenn sie binnen sechs Monaten nach dem Tag, an dem die Eintragung der Verschmelzung in das Register des Sitzes desjenigen Rechtsträgers, dessen Gläubiger sie sind, als bekannt gemacht gilt, ihren Anspruch nach Grund und Höhe schriftlich anmelden, Sicherheit zu leisten, soweit sie nicht Befriedigung verlangen können. Dieses Recht steht den Gläubigern jedoch nur zu, wenn sie glaubhaft machen, dass durch die Verschmelzung die Erfüllung ihrer Forderung gefährdet wird. Das Recht, Sicherheitsleistung zu verlangen, steht Gläubigern nicht zu, die im Falle der Insolvenz ein Recht auf vorzugsweise Befriedigung aus einer Deckungsmasse haben, die nach gesetzlicher Vorschrift zu ihrem Schutz errichtet und staatlich überwacht ist."
    },
    {
      "date": "2025-09-12",
      "id": "128986",
      "original_text": "Registerbekanntmachung nach dem Umwandlungsgesetz\nHamburg Amtsgericht Hamburg HRB 11262\nGoetz Dekorationsgesellschaft mit beschränkter Haftung – Hamburg",
      "type": "Registerbekanntmachung nach dem Umwandlungsgesetz",
      "state": "Hamburg",
      "amtsgericht": "Amtsgericht Hamburg",
      "registernummer": "HRB 11262",
      "registerart": "HRB",
      "company_name": "Goetz Dekorationsgesellschaft mit beschränkter Haftung",
      "company_seat": "Hamburg",
      "details": "12.09.2025 (Bekanntmachungsdatum)\n\nHamburg Amtsgericht Hamburg HRB 11262\nRegisterbekanntmachung nach dem Umwandlungsgesetz 12.09.2025 (Eintragungsdatum)\n\nGoetz Dekorationsgesellschaft mit beschränkter Haftung\nGesellschaft mit beschränkter Haftung\nHamburg\n\nAls nicht eingetragen wird bekannt gemacht:\nDen Gläubigern der an der Verschmelzung beteiligten Gesellschaften ist, wenn sie binnen sechs Monaten nach dem Tag, an dem die Eintragung der Verschmelzung in das Register des Sitzes desjenigen Rechtsträgers, dessen Gläubiger sie sind, nach § 19 Absatz 3 UmwG als bekannt gemacht gilt, ihren Anspruch nach Grund und Höhe schriftlich anmelden, Sicherheit zu leisten, soweit sie nicht Befriedigung verlangen können. Dieses Recht steht den Gläubigern jedoch nur zu, wenn sie glaubhaft machen, dass durch die Verschmelzung die Erfüllung ihrer Forderung gefährdet wird."
    },
    {
      "date": "2025-09-12",
      "id": "128987",
      "original_text": "Registerbekanntmachung nach dem Umwandlungsgesetz\nHamburg Amtsgericht Hamburg HRB 93796\nOtto Musfeldt Bestattungen GmbH – Hamburg",
      "type": "Registerbekanntmachung nach dem Umwandlungsgesetz",
      "state": "Hamburg",
      "amtsgericht": "Amtsgericht Hamburg",
      "registernummer": "HRB 93796",
      "registerart": "HRB",
      "company_name": "Otto Musfeldt Bestattungen GmbH",
      "company_seat": "Hamburg",
      "details": "12.09.2025 (Bekanntmachungsdatum)\n\nHamburg Amtsgericht Hamburg HRB 93796\nRegisterbekanntmachung nach dem Umwandlungsgesetz 12.09.2025 (Eintragungsdatum)\n\nOtto Musfeldt Bestattungen GmbH\nGesellschaft mit beschränkter Haftung\nHamburg\n\nAls nicht eingetragen wird bekannt gemacht:\nDen Gläubigern der an der Verschmelzung beteiligten Gesellschaften ist, wenn sie binnen sechs Monaten nach dem Tag, an dem die Eintragung der Verschmelzung in das Register des Sitzes desjenigen Rechtsträgers, dessen Gläubiger sie sind, nach § 19 Absatz 3 UmwG als bekannt gemacht gilt, ihren Anspruch nach Grund und Höhe schriftlich anmelden, Sicherheit zu leisten, soweit sie nicht Befriedigung verlangen können. Dieses Recht steht den Gläubigern jedoch nur zu, wenn sie glaubhaft machen, dass durch die Verschmelzung die Erfüllung ihrer Forderung gefährdet wird."
    },
    {
      "date": "2025-09-12",
      "id": "128988",
      "original_text": "Registerbekanntmachung nach dem Umwandlungsgesetz\nHamburg Amtsgericht Hamburg HRB 77198\nBeerdigungsinstitut Otto Musfeldt GmbH – Hamburg",
      "type": "Registerbekanntmachung nach dem Umwandlungsgesetz",
      "state": "Hamburg",
      "amtsgericht": "Amtsgericht Hamburg",
      "registernummer": "HRB 77198",
      "registerart": "HRB",
      "company_name": "Beerdigungsinstitut Otto Musfeldt GmbH",
      "company_seat": "Hamburg",
      "details": "12.09.2025 (Bekanntmachungsdatum)\n\nHamburg Amtsgericht Hamburg HRB 77198\nRegisterbekanntmachung nach dem Umwandlungsgesetz 12.09.2025 (Eintragungsdatum)\n\nBeerdigungsinstitut Otto Musfeldt GmbH\nGesellschaft mit beschränkter Haftung\nHamburg\n\nAls nicht eingetragen wird bekannt gemacht:\nDen Gläubigern der an der Verschmelzung beteiligten Gesellschaften ist, wenn sie binnen sechs Monaten nach dem Tag, an dem die Eintragung der Verschmelzung in das Register des Sitzes desjenigen Rechtsträgers, dessen Gläubiger sie sind, nach § 19 Absatz 3 UmwG als bekannt gemacht gilt, ihren Anspruch nach Grund und Höhe schriftlich anmelden, Sicherheit zu leisten, soweit sie nicht Befriedigung verlangen können. Dieses Recht steht den Gläubigern jedoch nur zu, wenn sie glaubhaft machen, dass durch die Verschmelzung die Erfüllung ihrer Forderung gefährdet wird."
    },
    {
      "date": "2025-09-12",
      "id": "128989",
      "original_text": "Registerbekanntmachung nach dem Umwandlungsgesetz\nBerlin Amtsgericht Berlin (Charlottenburg) HRB 187520\nErnst Christiansen GmbH – Berlin",
      "type": "Registerbekanntmachung nach dem Umwandlungsgesetz",
      "state": "Berlin",
      "amtsgericht": "Amtsgericht Berlin (Charlottenburg)",
      "registernummer": "HRB 187520",
      "registerart": "HRB",
      "company_name": "Ernst Christiansen GmbH",
      "company_seat": "Berlin",
      "details": "12.09.2025 (Bekanntmachungsdatum)\n\nBerlin Amtsgericht Berlin (Charlottenburg) HRB 187520\nRegisterbekanntmachung nach dem Umwandlungsgesetz 11.09.2025 (Eintragungsdatum)\n\nErnst Christiansen GmbH\nGesellschaft mit beschränkter Haftung\nBerlin\n\nZu Eintragungsnummer 4 vom 11.09.2025 wird als nicht eingetragen veröffentlicht: Den Gläubigern der an der Verschmelzung beteiligten Rechtsträger ist, wenn sie binnen sechs Monaten nach dem Tag, an dem die Eintragung der Verschmelzung in das Register des Sitzes desjenigen Rechtsträgers, dessen Gläubiger sie sind, als bekannt gemacht gilt, ihren Anspruch nach Grund und Höhe schriftlich anmelden, Sicherheit zu leisten, soweit sie nicht Befriedigung verlangen können. Dieses Recht steht den Gläubigern jedoch nur zu, wenn sie glaubhaft machen, dass durch die Verschmelzung die Erfüllung ihrer Forderung gefährdet wird. Das Recht, Sicherheitsleistung zu verlangen, steht Gläubigern nicht zu, die im Falle der Insolvenz ein Recht auf vorzugsweise Befriedigung aus einer Deckungsmasse haben, die nach gesetzlicher Vorschrift zu ihrem Schutz errichtet und staatlich überwacht ist."
    },
    {
      "date": "2025-09-12",
      "id": "128990",
      "original_text": "Registerbekanntmachung nach dem Umwandlungsgesetz\nBerlin Amtsgericht Berlin (Charlottenburg) HRB 186778\nCH Investment GmbH – Berlin",
      "type": "Registerbekanntmachung nach dem Umwandlungsgesetz",
      "state": "Berlin",
      "amtsgericht": "Amtsgericht Berlin (Charlottenburg)",
      "registernummer": "HRB 186778",
      "registerart": "HRB",
      "company_name": "CH Investment GmbH",
      "company_seat": "Berlin",
      "details": "12.09.2025 (Bekanntmachungsdatum)\n\nBerlin Amtsgericht Berlin (Charlottenburg) HRB 186778\nRegisterbekanntmachung nach dem Umwandlungsgesetz 11.09.2025 (Eintragungsdatum)\n\nCH Investment GmbH\nGesellschaft mit beschränkter Haftung\nBerlin\n\nZu Eintragungsnummer 3 vom 11.09.2025 wird als nicht eingetragen veröffentlicht: Den Gläubigern der an der Verschmelzung beteiligten Rechtsträger ist, wenn sie binnen sechs Monaten nach dem Tag, an dem die Eintragung der Verschmelzung in das Register des Sitzes desjenigen Rechtsträgers, dessen Gläubiger sie sind, als bekannt gemacht gilt, ihren Anspruch nach Grund und Höhe schriftlich anmelden, Sicherheit zu leisten, soweit sie nicht Befriedigung verlangen können. Dieses Recht steht den Gläubigern jedoch nur zu, wenn sie glaubhaft machen, dass durch die Verschmelzung die Erfüllung ihrer Forderung gefährdet wird. Das Recht, Sicherheitsleistung zu verlangen, steht Gläubigern nicht zu, die im Falle der Insolvenz ein Recht auf vorzugsweise Befriedigung aus einer Deckungsmasse haben, die nach gesetzlicher Vorschrift zu ihrem Schutz errichtet und staatlich überwacht ist."
    },
    {
      "date": "2025-09-12",
      "id": "128991",
      "original_text": "Registerbekanntmachung nach dem Umwandlungsgesetz\nBaden-Württemberg Amtsgericht Mannheim HRB 755713\nJohmann Verwaltungs GmbH – Mosbach",
      "type": "Registerbekanntmachung nach dem Umwandlungsgesetz",
      "state": "Baden-Württemberg",
      "amtsgericht": "Amtsgericht Mannheim",
      "registernummer": "HRB 755713",
      "registerart": "HRB",
      "company_name": "Johmann Verwaltungs GmbH",
      "company_seat": "Mosbach",
      "details": "12.09.2025 (Bekanntmachungsdatum)\n\nBaden-Württemberg Amtsgericht Mannheim HRB 755713\nRegisterbekanntmachung nach dem Umwandlungsgesetz 12.09.2025 (Eintragungsdatum)\n\nJohmann Verwaltungs GmbH\nGesellschaft mit beschränkter Haftung\nMosbach\n\nDen Gläubigern des an dem Formwechsel beteiligten Rechtsträgers ist, wenn sie binnen sechs Monaten nach dem Tag, an dem die Eintragung des Formwechsels in das Register des Sitzes desjenigen Rechtsträgers, dessen Gläubiger sie sind, nach § 19 Abs. 3 UmwG als bekanntgemacht gilt, ihren Anspruch nach Grund und Höhe schriftlich anmelden, Sicherheit zu leisten, soweit sie nicht Befriedigung verlangen können. Dieses Recht steht den Gläubigern jedoch nur zu, wenn sie glaubhaft machen, dass durch den Formwechsel die Erfüllung ihrer Forderung gefährdet wird."
    },
    {
      "date": "2025-09-12",
      "id": "128992",
      "original_text": "Registerbekanntmachung nach dem Umwandlungsgesetz\nBerlin Amtsgericht Berlin (Charlottenburg) HRB 268183\nInstant Offices GmbH – Berlin",
      "type": "Registerbekanntmachung nach dem Umwandlungsgesetz",
      "state": "Berlin",
      "amtsgericht": "Amtsgericht Berlin (Charlottenburg)",
      "registernummer": "HRB 268183",
      "registerart": "HRB",
      "company_name": "Instant Offices GmbH",
      "company_seat": "Berlin",
      "details": "12.09.2025 (Bekanntmachungsdatum)\n\nBerlin Amtsgericht Berlin (Charlottenburg) HRB 268183\nRegisterbekanntmachung nach dem Umwandlungsgesetz 11.09.2025 (Eintragungsdatum)\n\nInstant Offices GmbH\nGesellschaft mit beschränkter Haftung\nBerlin\n\nZu Eintragungsnummer 3 vom 11.09.2025 wird als nicht eingetragen veröffentlicht:Den Gläubigern der an der Verschmelzung beteiligten Rechtsträger ist, wenn sie binnen sechs Monaten nach dem Tag, an dem die Eintragung der Verschmelzung in das Register des Sitzes desjenigen Rechtsträgers, dessen Gläubiger sie sind, als bekannt gemacht gilt, ihren Anspruch nach Grund und Höhe schriftlich anmelden, Sicherheit zu leisten, soweit sie nicht Befriedigung verlangen können. Dieses Recht steht den Gläubigern jedoch nur zu, wenn sie glaubhaft machen, dass durch die Verschmelzung die Erfüllung ihrer Forderung gefährdet wird. Das Recht, Sicherheitsleistung zu verlangen, steht Gläubigern nicht zu, die im Falle der Insolvenz ein Recht auf vorzugsweise Befriedigung aus einer Deckungsmasse haben, die nach gesetzlicher Vorschrift zu ihrem Schutz errichtet und staatlich überwacht ist."
    },
    {
      "date": "2025-09-12",
      "id": "128993",
      "original_text": "Registerbekanntmachung nach dem Umwandlungsgesetz\nBaden-Württemberg Amtsgericht Mannheim GsR 1334\nAndreas und Joachim Johmann eGbR – Mosbach",
      "type": "Registerbekanntmachung nach dem Umwandlungsgesetz",
      "state": "Baden-Württemberg",
      "amtsgericht": "Amtsgericht Mannheim",
      "registernummer": "GsR 1334",
      "registerart": "GsR",
      "company_name": "Andreas und Joachim Johmann eGbR",
      "company_seat": "Mosbach",
      "details": "12.09.2025 (Bekanntmachungsdatum)\n\nBaden-Württemberg Amtsgericht Mannheim GsR 1334\nRegisterbekanntmachung nach dem Umwandlungsgesetz 12.09.2025 (Eintragungsdatum)\n\nAndreas und Joachim Johmann eGbR\nGesellschaft bürgerlichen Rechts\nMosbach\n\nDen Gläubigern des an dem Formwechsel beteiligten Rechtsträgers ist, wenn sie binnen sechs Monaten nach dem Tag, an dem die Eintragung des Formwechsels in das Register des Sitzes desjenigen Rechtsträgers, dessen Gläubiger sie sind, nach § 19 Abs. 3 UmwG als bekanntgemacht gilt, ihren Anspruch nach Grund und Höhe schriftlich anmelden, Sicherheit zu leisten, soweit sie nicht Befriedigung verlangen können. Dieses Recht steht den Gläubigern jedoch nur zu, wenn sie glaubhaft machen, dass durch den Formwechsel die Erfüllung ihrer Forderung gefährdet wird."
    },
    {
      "date": "2025-09-12",
      "id": "128994",
      "original_text": "Registerbekanntmachung nach dem Umwandlungsgesetz\nBaden-Württemberg Amtsgericht Stuttgart HRB 801271\ndie netzwerker IT Services GmbH – Kirchheim unter Teck",
      "type": "Registerbekanntmachung nach dem Umwandlungsgesetz",
      "state": "Baden-Württemberg",
      "amtsgericht": "Amtsgericht Stuttgart",
      "registernummer": "HRB 801271",
      "registerart": "HRB",
      "company_name": "die netzwerker IT Services GmbH",
      "company_seat": "Kirchheim unter Teck",
      "details": "12.09.2025 (Bekanntmachungsdatum)\n\nBaden-Württemberg Amtsgericht Stuttgart HRB 801271\nRegisterbekanntmachung nach dem Umwandlungsgesetz 12.09.2025 (Eintragungsdatum)\n\ndie netzwerker IT Services GmbH\nGesellschaft mit beschränkter Haftung\nKirchheim unter Teck\n\nAls nicht eingetragen wird bekanntgemacht:\nDen Gläubigern der an der Ausgliederung beteiligten Rechtsträger ist, wenn sie binnen sechs Monaten nach dem Tag, an dem die Eintragung der Ausgliederung in das Register des Sitzes desjenigen Rechtsträgers, dessen Gläubiger sie sind, nach § 19 Abs. 3 UmwG als bekanntgemacht gilt, ihren Anspruch nach Grund und Höhe schriftlich anmelden, Sicherheit zu leisten, soweit sie nicht Befriedigung verlangen können. Dieses Recht steht den Gläubigern jedoch nur zu, wenn sie glaubhaft machen, dass durch die Ausgliederung die Erfüllung ihrer Forderung gefährdet wird."
    },
    {
      "date": "2025-09-12",
      "id": "128995",
      "original_text": "Registerbekanntmachung nach dem Umwandlungsgesetz\nHamburg Amtsgericht Hamburg HRB 167880\nMSD Handels- und Verwaltungs GmbH – Hamburg",
      "type": "Registerbekanntmachung nach dem Umwandlungsgesetz",
      "state": "Hamburg",
      "amtsgericht": "Amtsgericht Hamburg",
      "registernummer": "HRB 167880",
      "registerart": "HRB",
      "company_name": "MSD Handels- und Verwaltungs GmbH",
      "company_seat": "Hamburg",
      "details": "12.09.2025 (Bekanntmachungsdatum)\n\nHamburg Amtsgericht Hamburg HRB 167880\nRegisterbekanntmachung nach dem Umwandlungsgesetz 12.09.2025 (Eintragungsdatum)\n\nMSD Handels- und Verwaltungs GmbH\nGesellschaft mit beschränkter Haftung\nHamburg\n\nAls nicht eingetragen wird bekannt gemacht:\nDen Gläubigern der an der Verschmelzung beteiligten Gesellschaften ist, wenn sie binnen sechs Monaten nach dem Tag, an dem die Eintragung der Verschmelzung in das Register des Sitzes desjenigen Rechtsträgers, dessen Gläubiger sie sind, nach § 19 Absatz 3 UmwG als bekannt gemacht gilt, ihren Anspruch nach Grund und Höhe schriftlich anmelden, Sicherheit zu leisten, soweit sie nicht Befriedigung verlangen können. Dieses Recht steht den Gläubigern jedoch nur zu, wenn sie glaubhaft machen, dass durch die Verschmelzung die Erfüllung ihrer Forderung gefährdet wird."
    },
    {
      "date": "2025-09-12",
      "id": "128996",
      "original_text": "Registerbekanntmachung nach dem Umwandlungsgesetz\nHamburg Amtsgericht Hamburg HRB 167538\nspring capitalinvest GmbH – Hamburg",
      "type": "Registerbekanntmachung nach dem Umwandlungsgesetz",
      "state": "Hamburg",
      "amtsgericht": "Amtsgericht Hamburg",
      "registernummer": "HRB 167538",
      "registerart": "HRB",
      "company_name": "spring capitalinvest GmbH",
      "company_seat": "Hamburg",
      "details": "12.09.2025 (Bekanntmachungsdatum)\n\nHamburg Amtsgericht Hamburg HRB 167538\nRegisterbekanntmachung nach dem Umwandlungsgesetz 12.09.2025 (Eintragungsdatum)\n\nspring capitalinvest GmbH\nGesellschaft mit beschränkter Haftung\nHamburg\n\nAls nicht eingetragen wird bekannt gemacht:\nDen Gläubigern der an der Verschmelzung beteiligten Gesellschaften ist, wenn sie binnen sechs Monaten nach dem Tag, an dem die Eintragung der Verschmelzung in das Register des Sitzes desjenigen Rechtsträgers, dessen Gläubiger sie sind, nach § 19 Absatz 3 UmwG als bekannt gemacht gilt, ihren Anspruch nach Grund und Höhe schriftlich anmelden, Sicherheit zu leisten, soweit sie nicht Befriedigung verlangen können. Dieses Recht steht den Gläubigern jedoch nur zu, wenn sie glaubhaft machen, dass durch die Verschmelzung die Erfüllung ihrer Forderung gefährdet wird."
    },
    {
      "date": "2025-09-12",
      "id": "128997",
      "original_text": "Registerbekanntmachung nach dem Umwandlungsgesetz\nSchleswig-Holstein Amtsgericht Pinneberg VR 1668\nStadtmarketing Pinneberg e. V. – Pinneberg",
      "type": "Registerbekanntmachung nach dem Umwandlungsgesetz",
      "state": "Schleswig-Holstein",
      "amtsgericht": "Amtsgericht Pinneberg",
      "registernummer": "VR 1668",
      "registerart": "VR",
      "company_name": "Stadtmarketing Pinneberg e. V.",
      "company_seat": "Pinneberg",
      "details": "12.09.2025 (Bekanntmachungsdatum)\n\nSchleswig-Holstein Amtsgericht Pinneberg VR 1668\nRegisterbekanntmachung nach dem Umwandlungsgesetz 12.09.2025 (Eintragungsdatum)\n\nStadtmarketing Pinneberg e. V.\neingetragener Verein\nPinneberg\n\nZu Eintragungsnummer 9 vom 12.09.2025 wird als nicht eingetragen veröffentlicht:  Als nicht eingetragen wird veröffentlicht: Den Gläubigern der an der Verschmelzung beteiligten Rechtsträger ist, wenn sie binnen sechs Monaten nach dem Tag, an dem die Eintragung der Verschmelzung in das Register des Sitzes desjenigen Rechtsträgers, dessen Gläubiger sie sind, als bekannt gemacht gilt, ihren Anspruch nach Grund und Höhe schriftlich anmelden, Sicherheit zu leisten, soweit sie nicht Befriedigung verlangen können. Dieses Recht steht den Gläubigern jedoch nur zu, wenn sie glaubhaft machen, dass durch die Verschmelzung die Erfüllung ihrer Forderung gefährdet wird. Das Recht, Sicherheitsleistung zu verlangen, steht Gläubigern nicht zu, die im Falle der Insolvenz ein Recht auf vorzugsweise Befriedigung aus einer Deckungsmasse haben, die nach gesetzlicher Vorschrift zu ihrem Schutz errichtet und staatlich überwacht ist."
    },
    {
      "date": "2025-09-12",
      "id": "128998",
      "original_text": "Registerbekanntmachung nach dem Umwandlungsgesetz\nMecklenburg-Vorpommern Amtsgericht Neubrandenburg HRA 3270\nElektrotechnik Rönneburg e.K. – Malchow",
      "type": "Registerbekanntmachung nach dem Umwandlungsgesetz",
      "state": "Mecklenburg-Vorpommern",
      "amtsgericht": "Amtsgericht Neubrandenburg",
      "registernummer": "HRA 3270",
      "registerart": "HRA",
      "company_name": "Elektrotechnik Rönneburg e.K.",
      "company_seat": "Malchow",
      "details": "12.09.2025 (Bekanntmachungsdatum)\n\nMecklenburg-Vorpommern Amtsgericht Neubrandenburg HRA 3270\nRegisterbekanntmachung nach dem Umwandlungsgesetz 12.09.2025 (Eintragungsdatum)\n\nElektrotechnik Rönneburg e.K.\nEinzelkaufmann / Einzelkauffrau\nMalchow\n\nAls nicht eingetragen wird veröffentlicht: Den Gläubigern der an der Ausgliederung beteiligten Rechtsträger ist, wenn sie binnen sechs Monaten nach dem Tag, an dem die Eintragung der Ausgliederung in das Register des Sitzes desjenigen Rechtsträgers, dessen Gläubiger sie sind, nach § 19 Abs. 3 UmwG als bekannt gemacht gilt, ihren Anspruch nach Grund und Höhe in Textform anmelden,\nSicherheit zu leisten, soweit sie nicht Befriedigung verlangen können. Dieses Recht steht den Gläubigern jedoch nur zu, wenn sie glaubhaft machen, dass durch die Ausgliederung die Erfüllung der Forderung gefährdet wird."
    },
    {
      "date": "2025-09-12",
      "id": "128999",
      "original_text": "Registerbekanntmachung nach dem Umwandlungsgesetz\nBerlin Amtsgericht Berlin (Charlottenburg) HRA 43576\nGoodlive Artists GmbH & Co. KG – Berlin",
      "type": "Registerbekanntmachung nach dem Umwandlungsgesetz",
      "state": "Berlin",
      "amtsgericht": "Amtsgericht Berlin (Charlottenburg)",
      "registernummer": "HRA 43576",
      "registerart": "HRA",
      "company_name": "Goodlive Artists GmbH & Co. KG",
      "company_seat": "Berlin",
      "details": "12.09.2025 (Bekanntmachungsdatum)\n\nBerlin Amtsgericht Berlin (Charlottenburg) HRA 43576\nRegisterbekanntmachung nach dem Umwandlungsgesetz 11.09.2025 (Eintragungsdatum)\n\nGoodlive Artists GmbH & Co. KG\nKommanditgesellschaft\nBerlin\n\nZu Eintragungsnummer 10 vom 11.09.2025 wird als nicht eingetragen veröffentlicht: Den Gläubigern der an der Verschmelzung beteiligten Rechtsträger ist, wenn sie binnen sechs Monaten nach dem Tag, an dem die Eintragung der Verschmelzung in das Register des Sitzes desjenigen Rechtsträgers, dessen Gläubiger sie sind, als bekannt gemacht gilt, ihren Anspruch nach Grund und Höhe schriftlich anmelden, Sicherheit zu leisten, soweit sie nicht Befriedigung verlangen können. Dieses Recht steht den Gläubigern jedoch nur zu, wenn sie glaubhaft machen, dass durch die Verschmelzung die Erfüllung ihrer Forderung gefährdet wird. Das Recht, Sicherheitsleistung zu verlangen, steht Gläubigern nicht zu, die im Falle der Insolvenz ein Recht auf vorzugsweise Befriedigung aus einer Deckungsmasse haben, die nach gesetzlicher Vorschrift zu ihrem Schutz errichtet und staatlich überwacht ist."
    },
    {
      "date": "2025-09-12",
      "id": "129000",
      "original_text": "Registerbekanntmachung nach dem Umwandlungsgesetz\nHamburg Amtsgericht Hamburg HRB 167760\nDSM Handels- und Verwaltungs GmbH – Hamburg",
      "type": "Registerbekanntmachung nach dem Umwandlungsgesetz",
      "state": "Hamburg",
      "amtsgericht": "Amtsgericht Hamburg",
      "registernummer": "HRB 167760",
      "registerart": "HRB",
      "company_name": "DSM Handels- und Verwaltungs GmbH",
      "company_seat": "Hamburg",
      "details": "12.09.2025 (Bekanntmachungsdatum)\n\nHamburg Amtsgericht Hamburg HRB 167760\nRegisterbekanntmachung nach dem Umwandlungsgesetz 12.09.2025 (Eintragungsdatum)\n\nDSM Handels- und Verwaltungs GmbH\nGesellschaft mit beschränkter Haftung\nHamburg\n\nAls nicht eingetragen wird bekannt gemacht:\nDen Gläubigern der an der Verschmelzung beteiligten Gesellschaften ist, wenn sie binnen sechs Monaten nach dem Tag, an dem die Eintragung der Verschmelzung in das Register des Sitzes desjenigen Rechtsträgers, dessen Gläubiger sie sind, nach § 19 Absatz 3 UmwG als bekannt gemacht gilt, ihren Anspruch nach Grund und Höhe schriftlich anmelden, Sicherheit zu leisten, soweit sie nicht Befriedigung verlangen können. Dieses Recht steht den Gläubigern jedoch nur zu, wenn sie glaubhaft machen, dass durch die Verschmelzung die Erfüllung ihrer Forderung gefährdet wird."
    },
    {
      "date": "2025-09-12",
      "id": "129001",
      "original_text": "Registerbekanntmachung nach dem Umwandlungsgesetz\nBerlin Amtsgericht Berlin (Charlottenburg) HRB 220267\nNitelive Artists Verwaltungs GmbH – Berlin",
      "type": "Registerbekanntmachung nach dem Umwandlungsgesetz",
      "state": "Berlin",
      "amtsgericht": "Amtsgericht Berlin (Charlottenburg)",
      "registernummer": "HRB 220267",
      "registerart": "HRB",
      "company_name": "Nitelive Artists Verwaltungs GmbH",
      "company_seat": "Berlin",
      "details": "12.09.2025 (Bekanntmachungsdatum)\n\nBerlin Amtsgericht Berlin (Charlottenburg) HRB 220267\nRegisterbekanntmachung nach dem Umwandlungsgesetz 11.09.2025 (Eintragungsdatum)\n\nNitelive Artists Verwaltungs GmbH\nGesellschaft mit beschränkter Haftung\nBerlin\n\nZu Eintragungsnummer 3 vom 11.09.2025 wird als nicht eingetragen veröffentlicht: Den Gläubigern der an der Verschmelzung beteiligten Rechtsträger ist, wenn sie binnen sechs Monaten nach dem Tag, an dem die Eintragung der Verschmelzung in das Register des Sitzes desjenigen Rechtsträgers, dessen Gläubiger sie sind, als bekannt gemacht gilt, ihren Anspruch nach Grund und Höhe schriftlich anmelden, Sicherheit zu leisten, soweit sie nicht Befriedigung verlangen können. Dieses Recht steht den Gläubigern jedoch nur zu, wenn sie glaubhaft machen, dass durch die Verschmelzung die Erfüllung ihrer Forderung gefährdet wird. Das Recht, Sicherheitsleistung zu verlangen, steht Gläubigern nicht zu, die im Falle der Insolvenz ein Recht auf vorzugsweise Befriedigung aus einer Deckungsmasse haben, die nach gesetzlicher Vorschrift zu ihrem Schutz errichtet und staatlich überwacht ist."
    },
    {
      "date": "2025-09-12",
      "id": "129002",
      "original_text": "Registerbekanntmachung nach dem Umwandlungsgesetz\nBaden-Württemberg Amtsgericht Stuttgart HRB 764923\nWeinmann Geschäftsführungs GmbH – Esslingen am Neckar",
      "type": "Registerbekanntmachung nach dem Umwandlungsgesetz",
      "state": "Baden-Württemberg",
      "amtsgericht": "Amtsgericht Stuttgart",
      "registernummer": "HRB 764923",
      "registerart": "HRB",
      "company_name": "Weinmann Geschäftsführungs GmbH",
      "company_seat": "Esslingen am Neckar",
      "details": "12.09.2025 (Bekanntmachungsdatum)\n\nBaden-Württemberg Amtsgericht Stuttgart HRB 764923\nRegisterbekanntmachung nach dem Umwandlungsgesetz 12.09.2025 (Eintragungsdatum)\n\nWeinmann Geschäftsführungs GmbH\nGesellschaft mit beschränkter Haftung\nEsslingen am Neckar\n\nAls nicht eingetragen wird bekanntgemacht:\nDen Gläubigern der an der Verschmelzung beteiligten Rechtsträger ist, wenn sie binnen sechs Monaten nach dem Tag, an dem die Eintragung der Verschmelzung in das Register des Sitzes desjenigen Rechtsträgers, dessen Gläubiger sie sind, nach § 19 Abs. 3 UmwG als bekanntgemacht gilt, ihren Anspruch nach Grund und Höhe schriftlich anmelden, Sicherheit zu leisten, soweit sie nicht Befriedigung verlangen können. Dieses Recht steht den Gläubigern jedoch nur zu, wenn sie glaubhaft machen, dass durch die Verschmelzung die Erfüllung ihrer Forderung gefährdet wird."
    },
    {
      "date": "2025-09-12",
      "id": "129003",
      "original_text": "Registerbekanntmachung nach dem Umwandlungsgesetz\nHamburg Amtsgericht Hamburg HRB 104993\nBunte Hunde GmbH – Hamburg",
      "type": "Registerbekanntmachung nach dem Umwandlungsgesetz",
      "state": "Hamburg",
      "amtsgericht": "Amtsgericht Hamburg",
      "registernummer": "HRB 104993",
      "registerart": "HRB",
      "company_name": "Bunte Hunde GmbH",
      "company_seat": "Hamburg",
      "details": "12.09.2025 (Bekanntmachungsdatum)\n\nHamburg Amtsgericht Hamburg HRB 104993\nRegisterbekanntmachung nach dem Umwandlungsgesetz 12.09.2025 (Eintragungsdatum)\n\nBunte Hunde GmbH\nGesellschaft mit beschränkter Haftung\nHamburg\n\nAls nicht eingetragen wird bekannt gemacht:\nDen Gläubigern der an der Verschmelzung beteiligten Gesellschaften ist, wenn sie binnen sechs Monaten nach dem Tag, an dem die Eintragung der Verschmelzung in das Register des Sitzes desjenigen Rechtsträgers, dessen Gläubiger sie sind, nach § 19 Absatz 3 UmwG als bekannt gemacht gilt, ihren Anspruch nach Grund und Höhe schriftlich anmelden, Sicherheit zu leisten, soweit sie nicht Befriedigung verlangen können. Dieses Recht steht den Gläubigern jedoch nur zu, wenn sie glaubhaft machen, dass durch die Verschmelzung die Erfüllung ihrer Forderung gefährdet wird."
    },
    {
      "date": "2025-09-12",
      "id": "129004",
      "original_text": "Registerbekanntmachung nach dem Umwandlungsgesetz\nHamburg Amtsgericht Hamburg HRB 96416\nEDEKA C+C großmarkt GmbH – Hamburg",
      "type": "Registerbekanntmachung nach dem Umwandlungsgesetz",
      "state": "Hamburg",
      "amtsgericht": "Amtsgericht Hamburg",
      "registernummer": "HRB 96416",
      "registerart": "HRB",
      "company_name": "EDEKA C+C großmarkt GmbH",
      "company_seat": "Hamburg",
      "details": "12.09.2025 (Bekanntmachungsdatum)\n\nHamburg Amtsgericht Hamburg HRB 96416\nRegisterbekanntmachung nach dem Umwandlungsgesetz 12.09.2025 (Eintragungsdatum)\n\nEDEKA C+C großmarkt GmbH\nGesellschaft mit beschränkter Haftung\nHamburg\n\nAls nicht eingetragen wird bekannt gemacht:\nDen Gläubigern der an der Verschmelzung beteiligten Gesellschaften ist, wenn sie binnen sechs Monaten nach dem Tag, an dem die Eintragung der Verschmelzung in das Register des Sitzes desjenigen Rechtsträgers, dessen Gläubiger sie sind, nach § 19 Absatz 3 UmwG als bekannt gemacht gilt, ihren Anspruch nach Grund und Höhe schriftlich anmelden, Sicherheit zu leisten, soweit sie nicht Befriedigung verlangen können. Dieses Recht steht den Gläubigern jedoch nur zu, wenn sie glaubhaft machen, dass durch die Verschmelzung die Erfüllung ihrer Forderung gefährdet wird."
    },
    {
      "date": "2025-09-12",
      "id": "129005",
      "original_text": "Registerbekanntmachung nach dem Umwandlungsgesetz\nHamburg Amtsgericht Hamburg HRB 155204\nFJUL GmbH – Hamburg",
      "type": "Registerbekanntmachung nach dem Umwandlungsgesetz",
      "state": "Hamburg",
      "amtsgericht": "Amtsgericht Hamburg",
      "registernummer": "HRB 155204",
      "registerart": "HRB",
      "company_name": "FJUL GmbH",
      "company_seat": "Hamburg",
      "details": "12.09.2025 (Bekanntmachungsdatum)\n\nHamburg Amtsgericht Hamburg HRB 155204\nRegisterbekanntmachung nach dem Umwandlungsgesetz 12.09.2025 (Eintragungsdatum)\n\nFJUL GmbH\nGesellschaft mit beschränkter Haftung\nHamburg\n\nAls nicht eingetragen wird bekannt gemacht:\nDen Gläubigern der an der Verschmelzung beteiligten Gesellschaften ist, wenn sie binnen sechs Monaten nach dem Tag, an dem die Eintragung der Verschmelzung in das Register des Sitzes desjenigen Rechtsträgers, dessen Gläubiger sie sind, nach § 19 Absatz 3 UmwG als bekannt gemacht gilt, ihren Anspruch nach Grund und Höhe schriftlich anmelden, Sicherheit zu leisten, soweit sie nicht Befriedigung verlangen können. Dieses Recht steht den Gläubigern jedoch nur zu, wenn sie glaubhaft machen, dass durch die Verschmelzung die Erfüllung ihrer Forderung gefährdet wird."
    },
    {
      "date": "2025-09-12",
      "id": "129006",
      "original_text": "Löschungsankündigung\nMecklenburg-Vorpommern Amtsgericht Neubrandenburg HRA 2932\ndust Beratungsgesellschaft GmbH & Co. KG – Wustrow",
      "type": "Löschungsankündigung",
      "state": "Mecklenburg-Vorpommern",
      "amtsgericht": "Amtsgericht Neubrandenburg",
      "registernummer": "HRA 2932",
      "registerart": "HRA",
      "company_name": "dust Beratungsgesellschaft GmbH & Co. KG",
      "company_seat": "Wustrow",
      "details": "12.09.2025 (Bekanntmachungsdatum)\n\nMecklenburg-Vorpommern Amtsgericht Neubrandenburg HRA 2932\nLöschungsankündigung 12.09.2025 (Eintragungsdatum)\n\ndust Beratungsgesellschaft GmbH & Co. KG\nKommanditgesellschaft\nWustrow\n\nDas Registergericht beabsichtigt, die im Handelsregister eingetragene Gesellschaft von Amts wegen nach § 394 FamFG zu löschen. Die Frist zur Erhebung eines Widerspruchs gegen die beabsichtigte Löschung wird auf drei Monate festgesetzt."
    },
    {
      "date": "2025-09-12",
      "id": "129007",
      "original_text": "Löschungsankündigung\nMecklenburg-Vorpommern Amtsgericht Neubrandenburg HRA 2932\ndust Beratungsgesellschaft GmbH & Co. KG – Wustrow",
      "type": "Löschungsankündigung",
      "state": "Mecklenburg-Vorpommern",
      "amtsgericht": "Amtsgericht Neubrandenburg",
      "registernummer": "HRA 2932",
      "registerart": "HRA",
      "company_name": "dust Beratungsgesellschaft GmbH & Co. KG",
      "company_seat": "Wustrow",
      "details": "12.09.2025 (Bekanntmachungsdatum)\n\nMecklenburg-Vorpommern Amtsgericht Neubrandenburg HRA 2932\nLöschungsankündigung 12.09.2025 (Eintragungsdatum)\n\ndust Beratungsgesellschaft GmbH & Co. KG\nKommanditgesellschaft\nWustrow\n\nDas Registergericht beabsichtigt, die im Handelsregister eingetragene Gesellschaft von Amts wegen nach § 394 FamFG zu löschen. Die Frist zur Erhebung eines Widerspruchs gegen die beabsichtigte Löschung wird auf drei Monate festgesetzt."
    },
    {
      "date": "2025-09-12",
      "id": "129008",
      "original_text": "Registerbekanntmachung nach dem Umwandlungsgesetz\nBerlin Amtsgericht Berlin (Charlottenburg) HRA 64559\nNSL Advisory e.K. Inh. Uğur Ünsal – Berlin",
      "type": "Registerbekanntmachung nach dem Umwandlungsgesetz",
      "state": "Berlin",
      "amtsgericht": "Amtsgericht Berlin (Charlottenburg)",
      "registernummer": "HRA 64559",
      "registerart": "HRA",
      "company_name": "NSL Advisory e.K. Inh. Uğur Ünsal",
      "company_seat": "Berlin",
      "details": "12.09.2025 (Bekanntmachungsdatum)\n\nBerlin Amtsgericht Berlin (Charlottenburg) HRA 64559\nRegisterbekanntmachung nach dem Umwandlungsgesetz 11.09.2025 (Eintragungsdatum)\n\nNSL Advisory e.K. Inh. Uğur Ünsal\nEinzelkaufmann / Einzelkauffrau\nBerlin\n\nZu Eintragungsnummer 2 vom 11.09.2025 wird als nicht eingetragen veröffentlicht: Den Gläubigern der an der Spaltung beteiligten Rechtsträger ist, wenn sie binnen sechs Monaten nach dem Tag, an dem die Eintragung der Spaltung in das Register des Sitzes desjenigen Rechtsträgers, dessen Gläubiger sie sind, als bekannt gemacht gilt, ihren Anspruch nach Grund und Höhe schriftlich anmelden, Sicherheit zu leisten, soweit sie nicht Befriedigung verlangen können. Dieses Recht steht den Gläubigern jedoch nur zu, wenn sie glaubhaft machen, dass durch die Spaltung die Erfüllung ihrer Forderung gefährdet wird. Das Recht, Sicherheitsleistung zu verlangen, steht Gläubigern nicht zu, die im Falle der Insolvenz ein Recht auf vorzugsweise Befriedigung aus einer Deckungsmasse haben, die nach gesetzlicher Vorschrift zu ihrem Schutz errichtet und staatlich überwacht ist."
    },
    {
      "date": "2025-09-12",
      "id": "129009",
      "original_text": "Registerbekanntmachung nach dem Umwandlungsgesetz\nBaden-Württemberg Amtsgericht Ulm HRB 750248\nReformhaus Marion Escher GmbH – Göppingen",
      "type": "Registerbekanntmachung nach dem Umwandlungsgesetz",
      "state": "Baden-Württemberg",
      "amtsgericht": "Amtsgericht Ulm",
      "registernummer": "HRB 750248",
      "registerart": "HRB",
      "company_name": "Reformhaus Marion Escher GmbH",
      "company_seat": "Göppingen",
      "details": "12.09.2025 (Bekanntmachungsdatum)\n\nBaden-Württemberg Amtsgericht Ulm HRB 750248\nRegisterbekanntmachung nach dem Umwandlungsgesetz 12.09.2025 (Eintragungsdatum)\n\nReformhaus Marion Escher GmbH\nGesellschaft mit beschränkter Haftung\nGöppingen\n\nAls nicht eingetragen wird bekanntgemacht:\nDen Gläubigern der an der Ausgliederung beteiligten Rechtsträger ist, wenn sie binnen sechs Monaten nach dem Tag, an dem die Eintragung der Ausgliederung in das Register des Sitzes desjenigen Rechtsträgers, dessen Gläubiger sie sind, nach § 19 Abs. 3 UmwG als bekanntgemacht gilt, ihren Anspruch nach Grund und Höhe schriftlich anmelden, Sicherheit zu leisten, soweit sie nicht Befriedigung verlangen können. Dieses Recht steht den Gläubigern jedoch nur zu, wenn sie glaubhaft machen, dass durch die Ausgliederung die Erfüllung ihrer Forderung gefährdet wird."
    },
    {
      "date": "2025-09-12",
      "id": "129010",
      "original_text": "Registerbekanntmachung nach dem Umwandlungsgesetz\nBaden-Württemberg Amtsgericht Mannheim HRB 362577\nvi2vi GmbH – Malsch",
      "type": "Registerbekanntmachung nach dem Umwandlungsgesetz",
      "state": "Baden-Württemberg",
      "amtsgericht": "Amtsgericht Mannheim",
      "registernummer": "HRB 362577",
      "registerart": "HRB",
      "company_name": "vi2vi GmbH",
      "company_seat": "Malsch",
      "details": "12.09.2025 (Bekanntmachungsdatum)\n\nBaden-Württemberg Amtsgericht Mannheim HRB 362577\nRegisterbekanntmachung nach dem Umwandlungsgesetz 12.09.2025 (Eintragungsdatum)\n\nvi2vi GmbH\nGesellschaft mit beschränkter Haftung\nMalsch\n\nDen Gläubigern der an der Verschmelzung beteiligten Rechtsträger ist, wenn sie binnen sechs Monaten nach dem Tag, an dem die Eintragung der Verschmelzung in das Register des Sitzes desjenigen Rechtsträgers, dessen Gläubiger sie sind, nach § 19 Abs. 3 UmwG als bekanntgemacht gilt, ihren Anspruch nach Grund und Höhe schriftlich anmelden, Sicherheit zu leisten, soweit sie nicht Befriedigung verlangen können. Dieses Recht steht den Gläubigern jedoch nur zu, wenn sie glaubhaft machen, dass durch die Verschmelzung die Erfüllung ihrer Forderung gefährdet wird."
    },
    {
      "date": "2025-09-12",
      "id": "129011",
      "original_text": "Registerbekanntmachung nach dem Umwandlungsgesetz\nSaarland Amtsgericht Saarbrücken HRA 13592\nTBS Dewald e.K. – Saarwellingen",
      "type": "Registerbekanntmachung nach dem Umwandlungsgesetz",
      "state": "Saarland",
      "amtsgericht": "Amtsgericht Saarbrücken",
      "registernummer": "HRA 13592",
      "registerart": "HRA",
      "company_name": "TBS Dewald e.K.",
      "company_seat": "Saarwellingen",
      "details": "12.09.2025 (Bekanntmachungsdatum)\n\nSaarland Amtsgericht Saarbrücken HRA 13592\nRegisterbekanntmachung nach dem Umwandlungsgesetz 12.09.2025 (Eintragungsdatum)\n\nTBS Dewald e.K.\nEinzelkaufmann / Einzelkauffrau\nSaarwellingen\n\nAls nicht eingetragen wird bekannt gemacht: Den Gläubigern der an der Verschmelzung beteiligten Gesellschaften ist, wenn sie binnen sechs Monaten nach dem Tag, an dem die Eintragung der Verschmelzung in das Register des Sitzes desjenigen Rechtsträgers, dessen Gläubiger sie sind, nach § 19 Absatz 3 UmwG bekannt gemacht worden ist, ihren Anspruch nach Grund und Höhe schriftlich anmelden, Sicherheit zu leisten, soweit sie nicht Befriedigung verlangen können. Dieses Recht steht den Gläubigern jedoch nur zu, wenn sie glaubhaft machen, dass durch die Verschmelzung die Erfüllung ihrer Forderung gefährdet wird."
    },
    {
      "date": "2025-09-12",
      "id": "129012",
      "original_text": "Sonstige Registerbekanntmachung\nBerlin Amtsgericht Berlin (Charlottenburg) HRB 224342\nRazor Group Acquisition I GmbH – Berlin",
      "type": "Sonstige Registerbekanntmachung",
      "state": "Berlin",
      "amtsgericht": "Amtsgericht Berlin (Charlottenburg)",
      "registernummer": "HRB 224342",
      "registerart": "HRB",
      "company_name": "Razor Group Acquisition I GmbH",
      "company_seat": "Berlin",
      "details": "12.09.2025 (Bekanntmachungsdatum)\n\nBerlin Amtsgericht Berlin (Charlottenburg) HRB 224342\nSonstige Registerbekanntmachung\n\nRazor Group Acquisition I GmbH\nGesellschaft mit beschränkter Haftung\nBerlin\n\nAls nicht eingetragen wird veröffentlicht: Der andere Vertragsteil hat den Gläubigern dieses Rechtsträgers, deren Forderungen begründet worden sind, bevor die Eintragung der Beendigung dieses Vertrages in das Handelsregister nach § 10 des Handelsgesetzbuches als bekannt gemacht gilt, Sicherheit zu leisten, wenn sie sich binnen sechs Monaten nach der Bekanntmachung der Eintragung zu diesem Zweck bei ihm melden. Dieses Recht steht den Gläubigern nicht zu, die im Fall des Insolvenzverfahrens ein Recht auf vorzugsweise Befriedigung aus der Deckungsmasse haben, die nach gesetzlicher Vorschrift zu ihrem Schutz errichtet und staatlich überwacht ist.\nDen Gläubigern der an der Verschmelzung beteiligten Rechtsträger ist, wenn sie binnen sechs Monaten nach dem Tag, an dem die Eintragung der Verschmelzung in das Register des Sitzes desjenigen Rechtsträgers, dessen Gläubiger sie sind, als bekannt gemacht gilt, ihren Anspruch nach Grund und Höhe schriftlich anmelden, Sicherheit zu leisten, soweit sie nicht Befriedigung verlangen können. Dieses Recht steht den Gläubigern jedoch nur zu, wenn sie glaubhaft machen, dass durch die Verschmelzung die Erfüllung ihrer Forderung gefährdet wird. Das Recht, Sicherheitsleistung zu verlangen, steht Gläubigern nicht zu, die im Falle der Insolvenz ein Recht auf vorzugsweise Befriedigung aus einer Deckungsmasse haben, die nach gesetzlicher Vorschrift zu ihrem Schutz errichtet und staatlich überwacht ist."
    },
    {
      "date": "2025-09-12",
      "id": "129013",
      "original_text": "Registerbekanntmachung nach dem Umwandlungsgesetz\nBerlin Amtsgericht Berlin (Charlottenburg) HRB 274274\nNimbleX Digital GmbH – Berlin",
      "type": "Registerbekanntmachung nach dem Umwandlungsgesetz",
      "state": "Berlin",
      "amtsgericht": "Amtsgericht Berlin (Charlottenburg)",
      "registernummer": "HRB 274274",
      "registerart": "HRB",
      "company_name": "NimbleX Digital GmbH",
      "company_seat": "Berlin",
      "details": "12.09.2025 (Bekanntmachungsdatum)\n\nBerlin Amtsgericht Berlin (Charlottenburg) HRB 274274\nRegisterbekanntmachung nach dem Umwandlungsgesetz 11.09.2025 (Eintragungsdatum)\n\nNimbleX Digital GmbH\nGesellschaft mit beschränkter Haftung\nBerlin\n\nZu Eintragungsnummer 2 vom 11.09.2025 wird als nicht eingetragen veröffentlicht: Den Gläubigern der an der Spaltung beteiligten Rechtsträger ist, wenn sie binnen sechs Monaten nach dem Tag, an dem die Eintragung der Spaltung in das Register des Sitzes desjenigen Rechtsträgers, dessen Gläubiger sie sind, als bekannt gemacht gilt, ihren Anspruch nach Grund und Höhe schriftlich anmelden, Sicherheit zu leisten, soweit sie nicht Befriedigung verlangen können. Dieses Recht steht den Gläubigern jedoch nur zu, wenn sie glaubhaft machen, dass durch die Spaltung die Erfüllung ihrer Forderung gefährdet wird. Das Recht, Sicherheitsleistung zu verlangen, steht Gläubigern nicht zu, die im Falle der Insolvenz ein Recht auf vorzugsweise Befriedigung aus einer Deckungsmasse haben, die nach gesetzlicher Vorschrift zu ihrem Schutz errichtet und staatlich überwacht ist."
    },
    {
      "date": "2025-09-12",
      "id": "129014",
      "original_text": "Registerbekanntmachung nach dem Umwandlungsgesetz\nMecklenburg-Vorpommern Amtsgericht Neubrandenburg HRB 7132\nMedical-Service GmbH – Sponholz OT Warlin",
      "type": "Registerbekanntmachung nach dem Umwandlungsgesetz",
      "state": "Mecklenburg-Vorpommern",
      "amtsgericht": "Amtsgericht Neubrandenburg",
      "registernummer": "HRB 7132",
      "registerart": "HRB",
      "company_name": "Medical-Service GmbH",
      "company_seat": "Sponholz OT Warlin",
      "details": "12.09.2025 (Bekanntmachungsdatum)\n\nMecklenburg-Vorpommern Amtsgericht Neubrandenburg HRB 7132\nRegisterbekanntmachung nach dem Umwandlungsgesetz 12.09.2025 (Eintragungsdatum)\n\nMedical-Service GmbH\nGesellschaft mit beschränkter Haftung\nSponholz OT Warlin\n\nAls nicht eingetragen wird veröffentlicht: Den Gläubigern der an der Ausgliederung beteiligten Rechtsträger ist, wenn sie binnen sechs Monaten nach dem Tag, an dem die Eintragung der Ausgliederung in das Register des Sitzes desjenigen Rechtsträgers, dessen Gläubiger sie sind, nach § 19 Abs. 3 UmwG als bekannt gemacht gilt, ihren Anspruch nach Grund und Höhe in Textform anmelden,\nSicherheit zu leisten, soweit sie nicht Befriedigung verlangen können. Dieses Recht steht den Gläubigern jedoch nur zu, wenn sie glaubhaft machen, dass durch die Ausgliederung die Erfüllung der Forderung gefährdet wird."
    },
    {
      "date": "2025-09-12",
      "id": "129015",
      "original_text": "Registerbekanntmachung nach dem Umwandlungsgesetz\nMecklenburg-Vorpommern Amtsgericht Neubrandenburg HRA 2366\nEnrico Harwardt e.K. – Sponholz OT Warlin",
      "type": "Registerbekanntmachung nach dem Umwandlungsgesetz",
      "state": "Mecklenburg-Vorpommern",
      "amtsgericht": "Amtsgericht Neubrandenburg",
      "registernummer": "HRA 2366",
      "registerart": "HRA",
      "company_name": "Enrico Harwardt e.K.",
      "company_seat": "Sponholz OT Warlin",
      "details": "12.09.2025 (Bekanntmachungsdatum)\n\nMecklenburg-Vorpommern Amtsgericht Neubrandenburg HRA 2366\nRegisterbekanntmachung nach dem Umwandlungsgesetz 12.09.2025 (Eintragungsdatum)\n\nEnrico Harwardt e.K.\nEinzelkaufmann / Einzelkauffrau\nSponholz OT Warlin\n\nAls nicht eingetragen wird veröffentlicht: Den Gläubigern der an der Ausgliederung beteiligten Rechtsträger ist, wenn sie binnen sechs Monaten nach dem Tag, an dem die Eintragung der Ausgliederung in das Register des Sitzes desjenigen Rechtsträgers, dessen Gläubiger sie sind, nach § 19 Abs. 3 UmwG als bekannt gemacht gilt, ihren Anspruch nach Grund und Höhe in Textform anmelden,\nSicherheit zu leisten, soweit sie nicht Befriedigung verlangen können. Dieses Recht steht den Gläubigern jedoch nur zu, wenn sie glaubhaft machen, dass durch die Ausgliederung die Erfüllung der Forderung gefährdet wird."
    },
    {
      "date": "2025-09-12",
      "id": "129016",
      "original_text": "Sonstige Registerbekanntmachung\nBerlin Amtsgericht Berlin (Charlottenburg) HRB 187237\nManuCo GmbH – Berlin",
      "type": "Sonstige Registerbekanntmachung",
      "state": "Berlin",
      "amtsgericht": "Amtsgericht Berlin (Charlottenburg)",
      "registernummer": "HRB 187237",
      "registerart": "HRB",
      "company_name": "ManuCo GmbH",
      "company_seat": "Berlin",
      "details": "12.09.2025 (Bekanntmachungsdatum)\n\nBerlin Amtsgericht Berlin (Charlottenburg) HRB 187237\nSonstige Registerbekanntmachung\n\nManuCo GmbH\nGesellschaft mit beschränkter Haftung\nBerlin\n\nAls nicht eingetragen wird veröffentlicht: Der andere Vertragsteil hat den Gläubigern dieses Rechtsträgers, deren Forderungen begründet worden sind, bevor die Eintragung der Beendigung dieses Vertrages in das Handelsregister nach § 10 des Handelsgesetzbuches als bekannt gemacht gilt, Sicherheit zu leisten, wenn sie sich binnen sechs Monaten nach der Bekanntmachung der Eintragung zu diesem Zweck bei ihm melden. Dieses Recht steht den Gläubigern nicht zu, die im Fall des Insolvenzverfahrens ein Recht auf vorzugsweise Befriedigung aus der Deckungsmasse haben, die nach gesetzlicher Vorschrift zu ihrem Schutz errichtet und staatlich überwacht ist.\nDen Gläubigern der an der Verschmelzung beteiligten Rechtsträger ist, wenn sie binnen sechs Monaten nach dem Tag, an dem die Eintragung der Verschmelzung in das Register des Sitzes desjenigen Rechtsträgers, dessen Gläubiger sie sind, als bekannt gemacht gilt, ihren Anspruch nach Grund und Höhe schriftlich anmelden, Sicherheit zu leisten, soweit sie nicht Befriedigung verlangen können. Dieses Recht steht den Gläubigern jedoch nur zu, wenn sie glaubhaft machen, dass durch die Verschmelzung die Erfüllung ihrer Forderung gefährdet wird. Das Recht, Sicherheitsleistung zu verlangen, steht Gläubigern nicht zu, die im Falle der Insolvenz ein Recht auf vorzugsweise Befriedigung aus einer Deckungsmasse haben, die nach gesetzlicher Vorschrift zu ihrem Schutz errichtet und staatlich überwacht ist."
    },
    {
      "date": "2025-09-12",
      "id": "129017",
      "original_text": "Registerbekanntmachung nach dem Umwandlungsgesetz\nSaarland Amtsgericht Saarbrücken HRB 111000\nTBS - Technisches Büro Stahlbautechnik GmbH – Saarwellingen",
      "type": "Registerbekanntmachung nach dem Umwandlungsgesetz",
      "state": "Saarland",
      "amtsgericht": "Amtsgericht Saarbrücken",
      "registernummer": "HRB 111000",
      "registerart": "HRB",
      "company_name": "TBS - Technisches Büro Stahlbautechnik GmbH",
      "company_seat": "Saarwellingen",
      "details": "12.09.2025 (Bekanntmachungsdatum)\n\nSaarland Amtsgericht Saarbrücken HRB 111000\nRegisterbekanntmachung nach dem Umwandlungsgesetz 12.09.2025 (Eintragungsdatum)\n\nTBS - Technisches Büro Stahlbautechnik GmbH\nGesellschaft mit beschränkter Haftung\nSaarwellingen\n\nAls nicht eingetragen wird bekannt gemacht: Den Gläubigern der an der Verschmelzung beteiligten Gesellschaften ist, wenn sie binnen sechs Monaten nach dem Tag, an dem die Eintragung der Verschmelzung in das Register des Sitzes desjenigen Rechtsträgers, dessen Gläubiger sie sind, nach § 19 Absatz 3 UmwG bekannt gemacht worden ist, ihren Anspruch nach Grund und Höhe schriftlich anmelden, Sicherheit zu leisten, soweit sie nicht Befriedigung verlangen können. Dieses Recht steht den Gläubigern jedoch nur zu, wenn sie glaubhaft machen, dass durch die Verschmelzung die Erfüllung ihrer Forderung gefährdet wird."
    },
    {
      "date": "2025-09-12",
      "id": "129018",
      "original_text": "Registerbekanntmachung nach dem Umwandlungsgesetz\nBaden-Württemberg Amtsgericht Mannheim HRB 701149\nAquarius Naturheilmittel Handelsgesellschaft mbH – Wertheim",
      "type": "Registerbekanntmachung nach dem Umwandlungsgesetz",
      "state": "Baden-Württemberg",
      "amtsgericht": "Amtsgericht Mannheim",
      "registernummer": "HRB 701149",
      "registerart": "HRB",
      "company_name": "Aquarius Naturheilmittel Handelsgesellschaft mbH",
      "company_seat": "Wertheim",
      "details": "12.09.2025 (Bekanntmachungsdatum)\n\nBaden-Württemberg Amtsgericht Mannheim HRB 701149\nRegisterbekanntmachung nach dem Umwandlungsgesetz 12.09.2025 (Eintragungsdatum)\n\nAquarius Naturheilmittel Handelsgesellschaft mbH\nGesellschaft mit beschränkter Haftung\nWertheim\n\nAls nicht eingetragen wird bekanntgemacht:\nDen Gläubigern der an der Verschmelzung beteiligten Rechtsträger ist, wenn sie binnen sechs Monaten nach dem Tag, an dem die Eintragung der Verschmelzung in das Register des Sitzes desjenigen Rechtsträgers, dessen Gläubiger sie sind, nach § 19 Abs. 3 UmwG als bekanntgemacht gilt, ihren Anspruch nach Grund und Höhe schriftlich anmelden, Sicherheit zu leisten, soweit sie nicht Befriedigung verlangen können. Dieses Recht steht den Gläubigern jedoch nur zu, wenn sie glaubhaft machen, dass durch die Verschmelzung die Erfüllung ihrer Forderung gefährdet wird."
    },
    {
      "date": "2025-09-12",
      "id": "129019",
      "original_text": "Registerbekanntmachung nach dem Umwandlungsgesetz\nBaden-Württemberg Amtsgericht Freiburg HRB 717762\nFürstenberg - THP GmbH – Hüfingen",
      "type": "Registerbekanntmachung nach dem Umwandlungsgesetz",
      "state": "Baden-Württemberg",
      "amtsgericht": "Amtsgericht Freiburg",
      "registernummer": "HRB 717762",
      "registerart": "HRB",
      "company_name": "Fürstenberg - THP GmbH",
      "company_seat": "Hüfingen",
      "details": "12.09.2025 (Bekanntmachungsdatum)\n\nBaden-Württemberg Amtsgericht Freiburg HRB 717762\nRegisterbekanntmachung nach dem Umwandlungsgesetz 12.09.2025 (Eintragungsdatum)\n\nFürstenberg - THP GmbH\nGesellschaft mit beschränkter Haftung\nHüfingen\n\nDen Gläubigern dern an der grenzüberschreitenden Verschmelzung beteiligten übernehmenden Rechtsträger ist, wenn sie binnen sechs Monaten nach dem Tag, an dem die Eintragung der Verschmelzung in das Register des Sitzes desjenigen Rechtsträgers, dessen Gläubiger sie sind, nach § 19 Absatz 3 UmwG als bekanntgemacht gilt, ihren Anspruch nach Grund und Höhe schriftlich anmelden, Sicherheit zu leisten, soweit sie nicht Befriedigung verlangen können. Dieses Recht steht den Gläubigern jedoch nur zu, wenn sie glaubhaft machen, dass durch die Verschmelzung die Erfüllung ihrer Forderung gefährdet wird."
    },
    {
      "date": "2025-09-12",
      "id": "129020",
      "original_text": "Registerbekanntmachung nach dem Umwandlungsgesetz\nBaden-Württemberg Amtsgericht Mannheim HRB 744770\nAquesta GmbH – Wertheim",
      "type": "Registerbekanntmachung nach dem Umwandlungsgesetz",
      "state": "Baden-Württemberg",
      "amtsgericht": "Amtsgericht Mannheim",
      "registernummer": "HRB 744770",
      "registerart": "HRB",
      "company_name": "Aquesta GmbH",
      "company_seat": "Wertheim",
      "details": "12.09.2025 (Bekanntmachungsdatum)\n\nBaden-Württemberg Amtsgericht Mannheim HRB 744770\nRegisterbekanntmachung nach dem Umwandlungsgesetz 12.09.2025 (Eintragungsdatum)\n\nAquesta GmbH\nGesellschaft mit beschränkter Haftung\nWertheim\n\nDen Gläubigern der an der Verschmelzung beteiligten Rechtsträger ist, wenn sie binnen sechs Monaten nach dem Tag, an dem die Eintragung der Verschmelzung in das Register des Sitzes desjenigen Rechtsträgers, dessen Gläubiger sie sind, nach § 19 Abs. 3 UmwG als bekanntgemacht gilt, ihren Anspruch nach Grund und Höhe schriftlich anmelden, Sicherheit zu leisten, soweit sie nicht Befriedigung verlangen können. Dieses Recht steht den Gläubigern jedoch nur zu, wenn sie glaubhaft machen, dass durch die Verschmelzung die Erfüllung ihrer Forderung gefährdet wird."
    },
    {
      "date": "2025-09-12",
      "id": "129021",
      "original_text": "Registerbekanntmachung nach dem Umwandlungsgesetz\nBerlin Amtsgericht Berlin (Charlottenburg) HRB 128182\nalma Vermögensverwaltung GmbH – Berlin",
      "type": "Registerbekanntmachung nach dem Umwandlungsgesetz",
      "state": "Berlin",
      "amtsgericht": "Amtsgericht Berlin (Charlottenburg)",
      "registernummer": "HRB 128182",
      "registerart": "HRB",
      "company_name": "alma Vermögensverwaltung GmbH",
      "company_seat": "Berlin",
      "details": "12.09.2025 (Bekanntmachungsdatum)\n\nBerlin Amtsgericht Berlin (Charlottenburg) HRB 128182\nRegisterbekanntmachung nach dem Umwandlungsgesetz 05.09.2025 (Eintragungsdatum)\n\nalma Vermögensverwaltung GmbH\nGesellschaft mit beschränkter Haftung\nBerlin\n\nZu Eintragungsnummer 10 vom 05.09.2025 wird als nicht eingetragen veröffentlicht:Den Gläubigern der an der Verschmelzung beteiligten Rechtsträger ist, wenn sie binnen sechs Monaten nach dem Tag, an dem die Eintragung der Verschmelzung in das Register des Sitzes desjenigen Rechtsträgers, dessen Gläubiger sie sind, als bekannt gemacht gilt, ihren Anspruch nach Grund und Höhe schriftlich anmelden, Sicherheit zu leisten, soweit sie nicht Befriedigung verlangen können. Dieses Recht steht den Gläubigern jedoch nur zu, wenn sie glaubhaft machen, dass durch die Verschmelzung die Erfüllung ihrer Forderung gefährdet wird. Das Recht, Sicherheitsleistung zu verlangen, steht Gläubigern nicht zu, die im Falle der Insolvenz ein Recht auf vorzugsweise Befriedigung aus einer Deckungsmasse haben, die nach gesetzlicher Vorschrift zu ihrem Schutz errichtet und staatlich überwacht ist."
    },
    {
      "date": "2025-09-12",
      "id": "129022",
      "original_text": "Registerbekanntmachung nach dem Umwandlungsgesetz\nBaden-Württemberg Amtsgericht Stuttgart HRB 794467\nRecruiting Rockstars GmbH – Schwäbisch Hall",
      "type": "Registerbekanntmachung nach dem Umwandlungsgesetz",
      "state": "Baden-Württemberg",
      "amtsgericht": "Amtsgericht Stuttgart",
      "registernummer": "HRB 794467",
      "registerart": "HRB",
      "company_name": "Recruiting Rockstars GmbH",
      "company_seat": "Schwäbisch Hall",
      "details": "12.09.2025 (Bekanntmachungsdatum)\n\nBaden-Württemberg Amtsgericht Stuttgart HRB 794467\nRegisterbekanntmachung nach dem Umwandlungsgesetz 12.09.2025 (Eintragungsdatum)\n\nRecruiting Rockstars GmbH\nGesellschaft mit beschränkter Haftung\nSchwäbisch Hall\n\nDen Gläubigern der an der Verschmelzung beteiligten Rechtsträger ist, wenn sie binnen sechs Monaten nach dem Tag, an dem die Eintragung der Verschmelzung in das Register des Sitzes desjenigen Rechtsträgers, dessen Gläubiger sie sind, nach § 19 Abs. 3 UmwG als bekanntgemacht gilt, ihren Anspruch nach Grund und Höhe schriftlich anmelden, Sicherheit zu leisten, soweit sie nicht Befriedigung verlangen können. Dieses Recht steht den Gläubigern jedoch nur zu, wenn sie glaubhaft machen, dass durch die Verschmelzung die Erfüllung ihrer Forderung gefährdet wird."
    },
    {
      "date": "2025-09-12",
      "id": "129023",
      "original_text": "Registerbekanntmachung nach dem Umwandlungsgesetz\nHamburg Amtsgericht Hamburg HRA 131873\nHotel St. Annen Inh. Marcus van Riesen e.K. – Hamburg",
      "type": "Registerbekanntmachung nach dem Umwandlungsgesetz",
      "state": "Hamburg",
      "amtsgericht": "Amtsgericht Hamburg",
      "registernummer": "HRA 131873",
      "registerart": "HRA",
      "company_name": "Hotel St. Annen Inh. Marcus van Riesen e.K.",
      "company_seat": "Hamburg",
      "details": "12.09.2025 (Bekanntmachungsdatum)\n\nHamburg Amtsgericht Hamburg HRA 131873\nRegisterbekanntmachung nach dem Umwandlungsgesetz 12.09.2025 (Eintragungsdatum)\n\nHotel St. Annen Inh. Marcus van Riesen e.K.\nEinzelkaufmann\nHamburg\n\nAls nicht eingetragen wird bekannt gemacht:\nDen Gläubigern der an der Ausgliederung beteiligten Gesellschaften ist, wenn sie binnen sechs Monaten nach dem Tag, an dem die Eintragung der Ausgliederung in das Register des Sitzes desjenigen Rechtsträgers, dessen Gläubiger sie sind, nach § 19 Absatz 3 UmwG als bekannt gemacht gilt, ihren Anspruch nach Grund und Höhe schriftlich anmelden, Sicherheit zu leisten, soweit sie nicht Befriedigung verlangen können. Dieses Recht steht den Gläubigern jedoch nur zu, wenn sie glaubhaft machen, dass durch die Ausgliederung die Erfüllung ihrer Forderung gefährdet wird."
    },
    {
      "date": "2025-09-12",
      "id": "129024",
      "original_text": "Sonstige Registerbekanntmachung\nBerlin Amtsgericht Berlin (Charlottenburg) HRB 214175\nSporiTrade GmbH – Berlin",
      "type": "Sonstige Registerbekanntmachung",
      "state": "Berlin",
      "amtsgericht": "Amtsgericht Berlin (Charlottenburg)",
      "registernummer": "HRB 214175",
      "registerart": "HRB",
      "company_name": "SporiTrade GmbH",
      "company_seat": "Berlin",
      "details": "12.09.2025 (Bekanntmachungsdatum)\n\nBerlin Amtsgericht Berlin (Charlottenburg) HRB 214175\nSonstige Registerbekanntmachung\n\nSporiTrade GmbH\nGesellschaft mit beschränkter Haftung\nBerlin\n\nAls nicht eingetragen wird veröffentlicht: Den Gläubigern der an der Verschmelzung beteiligten Rechtsträger ist, wenn sie binnen sechs Monaten nach dem Tag, an dem die Eintragung der Verschmelzung in das Register des Sitzes desjenigen Rechtsträgers, dessen Gläubiger sie sind, als bekannt gemacht gilt, ihren Anspruch nach Grund und Höhe schriftlich anmelden, Sicherheit zu leisten, soweit sie nicht Befriedigung verlangen können. Dieses Recht steht den Gläubigern jedoch nur zu, wenn sie glaubhaft machen, dass durch die Verschmelzung die Erfüllung ihrer Forderung gefährdet wird. Das Recht, Sicherheitsleistung zu verlangen, steht Gläubigern nicht zu, die im Falle der Insolvenz ein Recht auf vorzugsweise Befriedigung aus einer Deckungsmasse haben, die nach gesetzlicher Vorschrift zu ihrem Schutz errichtet und staatlich überwacht ist."
    },
    {
      "date": "2025-09-12",
      "id": "129025",
      "original_text": "Registerbekanntmachung nach dem Umwandlungsgesetz\nBaden-Württemberg Amtsgericht Ulm HRA 530761\nReformhaus Marion Escher e.K. – Göppingen",
      "type": "Registerbekanntmachung nach dem Umwandlungsgesetz",
      "state": "Baden-Württemberg",
      "amtsgericht": "Amtsgericht Ulm",
      "registernummer": "HRA 530761",
      "registerart": "HRA",
      "company_name": "Reformhaus Marion Escher e.K.",
      "company_seat": "Göppingen",
      "details": "12.09.2025 (Bekanntmachungsdatum)\n\nBaden-Württemberg Amtsgericht Ulm HRA 530761\nRegisterbekanntmachung nach dem Umwandlungsgesetz 12.09.2025 (Eintragungsdatum)\n\nReformhaus Marion Escher e.K.\nEinzelkaufmann / Einzelkauffrau\nGöppingen\n\nAls nicht eingetragen wird bekanntgemacht:\nDen Gläubigern der an der Ausgliederung beteiligten Rechtsträger ist, wenn sie binnen sechs Monaten nach dem Tag, an dem die Eintragung der Ausgliederung in das Register des Sitzes desjenigen Rechtsträgers, dessen Gläubiger sie sind, nach § 19 Abs. 3 UmwG als bekanntgemacht gilt, ihren Anspruch nach Grund und Höhe schriftlich anmelden, Sicherheit zu leisten, soweit sie nicht Befriedigung verlangen können. Dieses Recht steht den Gläubigern jedoch nur zu, wenn sie glaubhaft machen, dass durch die Ausgliederung die Erfüllung ihrer Forderung gefährdet wird."
    },
    {
      "date": "2025-09-12",
      "id": "129026",
      "original_text": "Sonstige Registerbekanntmachung\nBerlin Amtsgericht Berlin (Charlottenburg) HRB 214175\nSporiTrade GmbH – Berlin",
      "type": "Sonstige Registerbekanntmachung",
      "state": "Berlin",
      "amtsgericht": "Amtsgericht Berlin (Charlottenburg)",
      "registernummer": "HRB 214175",
      "registerart": "HRB",
      "company_name": "SporiTrade GmbH",
      "company_seat": "Berlin",
      "details": "12.09.2025 (Bekanntmachungsdatum)\n\nBerlin Amtsgericht Berlin (Charlottenburg) HRB 214175\nSonstige Registerbekanntmachung\n\nSporiTrade GmbH\nGesellschaft mit beschränkter Haftung\nBerlin\n\nAls nicht eingetragen wird veröffentlicht: Den Gläubigern der an der Verschmelzung beteiligten Rechtsträger ist, wenn sie binnen sechs Monaten nach dem Tag, an dem die Eintragung der Verschmelzung in das Register des Sitzes desjenigen Rechtsträgers, dessen Gläubiger sie sind, als bekannt gemacht gilt, ihren Anspruch nach Grund und Höhe schriftlich anmelden, Sicherheit zu leisten, soweit sie nicht Befriedigung verlangen können. Dieses Recht steht den Gläubigern jedoch nur zu, wenn sie glaubhaft machen, dass durch die Verschmelzung die Erfüllung ihrer Forderung gefährdet wird. Das Recht, Sicherheitsleistung zu verlangen, steht Gläubigern nicht zu, die im Falle der Insolvenz ein Recht auf vorzugsweise Befriedigung aus einer Deckungsmasse haben, die nach gesetzlicher Vorschrift zu ihrem Schutz errichtet und staatlich überwacht ist."
    },
    {
      "date": "2025-09-12",
      "id": "129027",
      "original_text": "Löschungsankündigung\nBerlin Amtsgericht Berlin (Charlottenburg) HRB 220284\nTopalov Bau UG (haftungsbeschränkt) – Berlin",
      "type": "Löschungsankündigung",
      "state": "Berlin",
      "amtsgericht": "Amtsgericht Berlin (Charlottenburg)",
      "registernummer": "HRB 220284",
      "registerart": "HRB",
      "company_name": "Topalov Bau UG (haftungsbeschränkt)",
      "company_seat": "Berlin",
      "details": "12.09.2025 (Bekanntmachungsdatum)\n\nBerlin Amtsgericht Berlin (Charlottenburg) HRB 220284\nLöschungsankündigung\n\nTopalov Bau UG (haftungsbeschränkt)\nGesellschaft mit beschränkter Haftung\nBerlin\n\nBei der nachstehenden Gesellschaft wird das Amtslöschungsverfahren gemäß § 394 FamFG eingeleitet. Widerspruchsfrist: 6 Wochen."
    },
    {
      "date": "2025-09-12",
      "id": "129028",
      "original_text": "Einreichung neuer Dokumente\nSachsen-Anhalt Amtsgericht Stendal HRB 1525\nWohnungsbaugesellschaft Möckern mbH – Möckern",
      "type": "Einreichung neuer Dokumente",
      "state": "Sachsen-Anhalt",
      "amtsgericht": "Amtsgericht Stendal",
      "registernummer": "HRB 1525",
      "registerart": "HRB",
      "company_name": "Wohnungsbaugesellschaft Möckern mbH",
      "company_seat": "Möckern",
      "details": "12.09.2025 (Bekanntmachungsdatum)\n\nSachsen-Anhalt Amtsgericht Stendal HRB 1525\nEinreichung neuer Dokumente 12.09.2025 (Eintragungsdatum)\n\nWohnungsbaugesellschaft Möckern mbH\nGesellschaft mit beschränkter Haftung\nMöckern\n\nEine Liste der Mitglieder des Aufsichtsrates wurde zum Handelsregister eingereicht."
    },
    {
      "date": "2025-09-12",
      "id": "129029",
      "original_text": "Sonstige Registerbekanntmachung\nBerlin Amtsgericht Berlin (Charlottenburg) HRB 214175\nSporiTrade GmbH – Berlin",
      "type": "Sonstige Registerbekanntmachung",
      "state": "Berlin",
      "amtsgericht": "Amtsgericht Berlin (Charlottenburg)",
      "registernummer": "HRB 214175",
      "registerart": "HRB",
      "company_name": "SporiTrade GmbH",
      "company_seat": "Berlin",
      "details": "12.09.2025 (Bekanntmachungsdatum)\n\nBerlin Amtsgericht Berlin (Charlottenburg) HRB 214175\nSonstige Registerbekanntmachung\n\nSporiTrade GmbH\nGesellschaft mit beschränkter Haftung\nBerlin\n\nAls nicht eingetragen wird veröffentlicht: Den Gläubigern der an der Verschmelzung beteiligten Rechtsträger ist, wenn sie binnen sechs Monaten nach dem Tag, an dem die Eintragung der Verschmelzung in das Register des Sitzes desjenigen Rechtsträgers, dessen Gläubiger sie sind, als bekannt gemacht gilt, ihren Anspruch nach Grund und Höhe schriftlich anmelden, Sicherheit zu leisten, soweit sie nicht Befriedigung verlangen können. Dieses Recht steht den Gläubigern jedoch nur zu, wenn sie glaubhaft machen, dass durch die Verschmelzung die Erfüllung ihrer Forderung gefährdet wird. Das Recht, Sicherheitsleistung zu verlangen, steht Gläubigern nicht zu, die im Falle der Insolvenz ein Recht auf vorzugsweise Befriedigung aus einer Deckungsmasse haben, die nach gesetzlicher Vorschrift zu ihrem Schutz errichtet und staatlich überwacht ist."
    },
    {
      "date": "2025-09-12",
      "id": "129030",
      "original_text": "Registerbekanntmachung nach dem Umwandlungsgesetz\nBerlin Amtsgericht Berlin (Charlottenburg) HRB 115338\nSPEED-FIT GmbH – Berlin",
      "type": "Registerbekanntmachung nach dem Umwandlungsgesetz",
      "state": "Berlin",
      "amtsgericht": "Amtsgericht Berlin (Charlottenburg)",
      "registernummer": "HRB 115338",
      "registerart": "HRB",
      "company_name": "SPEED-FIT GmbH",
      "company_seat": "Berlin",
      "details": "12.09.2025 (Bekanntmachungsdatum)\n\nBerlin Amtsgericht Berlin (Charlottenburg) HRB 115338\nRegisterbekanntmachung nach dem Umwandlungsgesetz 11.09.2025 (Eintragungsdatum)\n\nSPEED-FIT GmbH\nGesellschaft mit beschränkter Haftung\nBerlin\n\nZu Eintragungsnummer 4 vom 11.09.2025 wird als nicht eingetragen veröffentlicht: Der andere Vertragsteil hat den Gläubigern dieses Rechtsträgers, deren Forderungen begründet worden sind, bevor die Eintragung der Beendigung dieses Vertrages in das Handelsregister nach § 10 des Handelsgesetzbuches als bekannt gemacht gilt, Sicherheit zu leisten, wenn sie sich binnen sechs Monaten nach der Bekanntmachung der Eintragung zu diesem Zweck bei ihm melden. Dieses Recht steht den Gläubigern nicht zu, die im Fall des Insolvenzverfahrens ein Recht auf vorzugsweise Befriedigung aus der Deckungsmasse haben, die nach gesetzlicher Vorschrift zu ihrem Schutz errichtet und staatlich überwacht ist."
    },
    {
      "date": "2025-09-12",
      "id": "129031",
      "original_text": "Löschungsankündigung\nBrandenburg Amtsgericht Neuruppin HRB 13927\nTECHvandens GmbH – Putlitz",
      "type": "Löschungsankündigung",
      "state": "Brandenburg",
      "amtsgericht": "Amtsgericht Neuruppin",
      "registernummer": "HRB 13927",
      "registerart": "HRB",
      "company_name": "TECHvandens GmbH",
      "company_seat": "Putlitz",
      "details": "12.09.2025 (Bekanntmachungsdatum)\n\nBrandenburg Amtsgericht Neuruppin HRB 13927\nLöschungsankündigung\n\nTECHvandens GmbH\nGesellschaft mit beschränkter Haftung\nPutlitz\n\nBei der nachstehenden Gesellschaft wird das Amtslöschungsverfahren gemäß § 394 FamFG eingeleitet.\nWiderspruchsfrist: 1 Monat"
    },
    {
      "date": "2025-09-12",
      "id": "129032",
      "original_text": "Registerbekanntmachung nach dem Umwandlungsgesetz\nThüringen Amtsgericht Jena HRB 111436\nFromm Plastics GmbH – Kölleda",
      "type": "Registerbekanntmachung nach dem Umwandlungsgesetz",
      "state": "Thüringen",
      "amtsgericht": "Amtsgericht Jena",
      "registernummer": "HRB 111436",
      "registerart": "HRB",
      "company_name": "Fromm Plastics GmbH",
      "company_seat": "Kölleda",
      "details": "12.09.2025 (Bekanntmachungsdatum)\n\nThüringen Amtsgericht Jena HRB 111436\nRegisterbekanntmachung nach dem Umwandlungsgesetz 12.09.2025 (Eintragungsdatum)\n\nFromm Plastics GmbH\nGesellschaft mit beschränkter Haftung\nKölleda\n\nNicht eingetragen: Den Gläubigern der an der Verschmelzung beteiligten Rechtsträger, ist wenn sie binnen sechs Monaten nach dem Tag, an dem die Eintragung der Verschmelzung in das Register des Sitzes desjenigen Rechtsträgers, dessen Gläubiger sie sind,  nach § 19 Abs. 3 UmwG als bekanntgemacht gilt, ihren Anspruch nach Grund und Höhe schriftlich anmelden, Sicherheit zu leisten, soweit sie nicht Befriedigung verlangen können. Dieses Recht steht ihnen jedoch nur zu, wenn sie glaubhaft machen, daß durch die Verschmelzung die Erfüllung ihrer Forderung gefährdet wird."
    },
    {
      "date": "2025-09-12",
      "id": "129033",
      "original_text": "Registerbekanntmachung nach dem Umwandlungsgesetz\nThüringen Amtsgericht Jena HRB 514128\ns-plast GmbH – Gotha",
      "type": "Registerbekanntmachung nach dem Umwandlungsgesetz",
      "state": "Thüringen",
      "amtsgericht": "Amtsgericht Jena",
      "registernummer": "HRB 514128",
      "registerart": "HRB",
      "company_name": "s-plast GmbH",
      "company_seat": "Gotha",
      "details": "12.09.2025 (Bekanntmachungsdatum)\n\nThüringen Amtsgericht Jena HRB 514128\nRegisterbekanntmachung nach dem Umwandlungsgesetz 12.09.2025 (Eintragungsdatum)\n\ns-plast GmbH\nGesellschaft mit beschränkter Haftung\nGotha\n\nNicht eingetragen: Den Gläubigern der an der Verschmelzung beteiligten Rechtsträger, ist wenn sie binnen sechs Monaten nach dem Tag, an dem die Eintragung der Verschmelzung in das Register des Sitzes desjenigen Rechtsträgers, dessen Gläubiger sie sind,  nach § 19 Abs. 3 UmwG als bekanntgemacht gilt, ihren Anspruch nach Grund und Höhe schriftlich anmelden, Sicherheit zu leisten, soweit sie nicht Befriedigung verlangen können. Dieses Recht steht ihnen jedoch nur zu, wenn sie glaubhaft machen, daß durch die Verschmelzung die Erfüllung ihrer Forderung gefährdet wird."
    },
    {
      "date": "2025-09-12",
      "id": "129034",
      "original_text": "Registerbekanntmachung nach dem Umwandlungsgesetz\nSchleswig-Holstein Amtsgericht Kiel HRB 274 SE\nCO Vermögensbeteiligungsgesellschaft mbH – Nehms",
      "type": "Registerbekanntmachung nach dem Umwandlungsgesetz",
      "state": "Schleswig-Holstein",
      "amtsgericht": "Amtsgericht Kiel",
      "registernummer": "HRB 274 SE",
      "registerart": "HRB",
      "company_name": "CO Vermögensbeteiligungsgesellschaft mbH",
      "company_seat": "Nehms",
      "details": "12.09.2025 (Bekanntmachungsdatum)\n\nSchleswig-Holstein Amtsgericht Kiel HRB 274 SE\nRegisterbekanntmachung nach dem Umwandlungsgesetz 11.09.2025 (Eintragungsdatum)\n\nCO Vermögensbeteiligungsgesellschaft mbH\nGesellschaft mit beschränkter Haftung\nNehms\n\nZu Eintragungsnummer 8 vom 11.09.2025 wird als nicht eingetragen veröffentlicht: Als nicht eingetragen wird veröffentlicht: Den Gläubigern der an der Verschmelzung beteiligten Rechtsträger ist, wenn sie binnen sechs Monaten nach dem Tag, an dem die Eintragung der Verschmelzung in das Register des Sitzes desjenigen Rechtsträgers, dessen Gläubiger sie sind, nach § 19 Abs. 3 UmwG bekannt gemacht worden ist, ihren Anspruch nach Grund und Höhe schriftlich anmelden, Sicherheit zu leisten, soweit sie nicht Befriedigung verlangen können. Dieses Recht steht den Gläubigern jedoch nur zu, wenn sie glaubhaft machen, dass durch die Verschmelzung die Erfüllung ihrer Forderung gefährdet wird."
    },
    {
      "date": "2025-09-12",
      "id": "129035",
      "original_text": "Sonstige Registerbekanntmachung\nBerlin Amtsgericht Berlin (Charlottenburg) HRB 81169\nDB JobService GmbH – Berlin",
      "type": "Sonstige Registerbekanntmachung",
      "state": "Berlin",
      "amtsgericht": "Amtsgericht Berlin (Charlottenburg)",
      "registernummer": "HRB 81169",
      "registerart": "HRB",
      "company_name": "DB JobService GmbH",
      "company_seat": "Berlin",
      "details": "12.09.2025 (Bekanntmachungsdatum)\n\nBerlin Amtsgericht Berlin (Charlottenburg) HRB 81169\nSonstige Registerbekanntmachung\n\nDB JobService GmbH\nGesellschaft mit beschränkter Haftung\nBerlin\n\nAls nicht eingetragen wird veröffentlicht:Es wurde eine neue Liste der Aufsichtsratsmitglieder eingereicht (§52 GmbHG)."
    },
    {
      "date": "2025-09-12",
      "id": "129036",
      "original_text": "Registerbekanntmachung nach dem Umwandlungsgesetz\nSchleswig-Holstein Amtsgericht Kiel HRB 274 SE\nCO Vermögensbeteiligungsgesellschaft mbH – Nehms",
      "type": "Registerbekanntmachung nach dem Umwandlungsgesetz",
      "state": "Schleswig-Holstein",
      "amtsgericht": "Amtsgericht Kiel",
      "registernummer": "HRB 274 SE",
      "registerart": "HRB",
      "company_name": "CO Vermögensbeteiligungsgesellschaft mbH",
      "company_seat": "Nehms",
      "details": "12.09.2025 (Bekanntmachungsdatum)\n\nSchleswig-Holstein Amtsgericht Kiel HRB 274 SE\nRegisterbekanntmachung nach dem Umwandlungsgesetz 02.09.2025 (Eintragungsdatum)\n\nCO Vermögensbeteiligungsgesellschaft mbH\nGesellschaft mit beschränkter Haftung\nNehms\n\nZu Eintragungsnummer 7 vom 02.09.2025 wird als nicht eingetragen veröffentlicht: Als nicht eingetragen wird veröffentlicht: Den Gläubigern der an der Verschmelzung beteiligten Rechtsträger ist, wenn sie binnen sechs Monaten nach dem Tag, an dem die Eintragung der Verschmelzung in das Register des Sitzes desjenigen Rechtsträgers, dessen Gläubiger sie sind, nach § 19 Abs. 3 UmwG bekannt gemacht worden ist, ihren Anspruch nach Grund und Höhe schriftlich anmelden, Sicherheit zu leisten, soweit sie nicht Befriedigung verlangen können. Dieses Recht steht den Gläubigern jedoch nur zu, wenn sie glaubhaft machen, dass durch die Verschmelzung die Erfüllung ihrer Forderung gefährdet wird."
    },
    {
      "date": "2025-09-12",
      "id": "129037",
      "original_text": "Löschungsankündigung\nBaden-Württemberg Amtsgericht Freiburg HRA 300430\nBäckerei - Konditorei Michael Schweikert e.K. – Neuenburg am Rhein",
      "type": "Löschungsankündigung",
      "state": "Baden-Württemberg",
      "amtsgericht": "Amtsgericht Freiburg",
      "registernummer": "HRA 300430",
      "registerart": "HRA",
      "company_name": "Bäckerei - Konditorei Michael Schweikert e.K.",
      "company_seat": "Neuenburg am Rhein",
      "details": "12.09.2025 (Bekanntmachungsdatum)\n\nBaden-Württemberg Amtsgericht Freiburg HRA 300430\nLöschungsankündigung\n\nBäckerei - Konditorei Michael Schweikert e.K.\nEinzelkaufmann / Einzelkauffrau\nNeuenburg am Rhein\n\nAls nicht eingetragen wird bekanntgemacht:\nDas Registergericht beabsichtigt, die Firma im Handelsregister von Amts wegen nach § 31 Abs. 2 HGB zu löschen. Die Frist zur Geltendmachung eines Widerspruchs gegen die beabsichtigte Löschung ist auf einen Monat ab Veröffentlichung bestimmt."
    },
    {
      "date": "2025-09-12",
      "id": "129038",
      "original_text": "Registerbekanntmachung nach dem Umwandlungsgesetz\nSchleswig-Holstein Amtsgericht Flensburg HRB 17771\nWEISS-Lackierung GmbH – Flensburg",
      "type": "Registerbekanntmachung nach dem Umwandlungsgesetz",
      "state": "Schleswig-Holstein",
      "amtsgericht": "Amtsgericht Flensburg",
      "registernummer": "HRB 17771",
      "registerart": "HRB",
      "company_name": "WEISS-Lackierung GmbH",
      "company_seat": "Flensburg",
      "details": "12.09.2025 (Bekanntmachungsdatum)\n\nSchleswig-Holstein Amtsgericht Flensburg HRB 17771\nRegisterbekanntmachung nach dem Umwandlungsgesetz 12.09.2025 (Eintragungsdatum)\n\nWEISS-Lackierung GmbH\nGesellschaft mit beschränkter Haftung\nFlensburg\n\nZu Eintragungsnummer 3 vom 12.09.2025 wird als nicht eingetragen veröffentlicht: Den Gläubigern der an der Spaltung beteiligten Rechtsträger ist, wenn sie binnen sechs Monaten nach dem Tag, an dem die Eintragung der Spaltung in das Register des Sitzes desjenigen Rechtsträgers, dessen Gläubiger sie sind, als bekannt gemacht gilt, ihren Anspruch nach Grund und Höhe in Textform anmelden, Sicherheit zu leisten, soweit sie nicht Befriedigung verlangen können. Dieses Recht steht den Gläubigern jedoch nur zu, wenn sie glaubhaft machen, dass durch die Spaltung die Erfüllung ihrer Forderung gefährdet wird."
    },
    {
      "date": "2025-09-12",
      "id": "129039",
      "original_text": "Löschungsankündigung\nBerlin Amtsgericht Berlin (Charlottenburg) HRB 188609\nGrand Fashion Mario Haltermann GmbH – Berlin",
      "type": "Löschungsankündigung",
      "state": "Berlin",
      "amtsgericht": "Amtsgericht Berlin (Charlottenburg)",
      "registernummer": "HRB 188609",
      "registerart": "HRB",
      "company_name": "Grand Fashion Mario Haltermann GmbH",
      "company_seat": "Berlin",
      "details": "12.09.2025 (Bekanntmachungsdatum)\n\nBerlin Amtsgericht Berlin (Charlottenburg) HRB 188609\nLöschungsankündigung\n\nGrand Fashion Mario Haltermann GmbH\nGesellschaft mit beschränkter Haftung\nBerlin\n\nBei der nachstehenden Gesellschaft wird das Amtslöschungsverfahren gemäß § 394 FamFG eingeleitet. Widerspruchsfrist 6 Wochen"
    },
    {
      "date": "2025-09-12",
      "id": "129040",
      "original_text": "Registerbekanntmachung nach dem Umwandlungsgesetz\nHamburg Amtsgericht Hamburg HRA 91127\nKönig & Cie. GmbH & Co. KG – Hamburg",
      "type": "Registerbekanntmachung nach dem Umwandlungsgesetz",
      "state": "Hamburg",
      "amtsgericht": "Amtsgericht Hamburg",
      "registernummer": "HRA 91127",
      "registerart": "HRA",
      "company_name": "König & Cie. GmbH & Co. KG",
      "company_seat": "Hamburg",
      "details": "12.09.2025 (Bekanntmachungsdatum)\n\nHamburg Amtsgericht Hamburg HRA 91127\nRegisterbekanntmachung nach dem Umwandlungsgesetz 12.09.2025 (Eintragungsdatum)\n\nKönig & Cie. GmbH & Co. KG\nKommanditgesellschaft\nHamburg\n\nAls nicht eingetragen wird bekannt gemacht:\nDen Gläubigern der an der Verschmelzung beteiligten Gesellschaften ist, wenn sie binnen sechs Monaten nach dem Tag, an dem die Eintragung der Verschmelzung in das Register des Sitzes desjenigen Rechtsträgers, dessen Gläubiger sie sind, nach § 19 Absatz 3 UmwG als bekannt gemacht gilt, ihren Anspruch nach Grund und Höhe schriftlich anmelden, Sicherheit zu leisten, soweit sie nicht Befriedigung verlangen können. Dieses Recht steht den Gläubigern jedoch nur zu, wenn sie glaubhaft machen, dass durch die Verschmelzung die Erfüllung ihrer Forderung gefährdet wird."
    },
    {
      "date": "2025-09-12",
      "id": "129041",
      "original_text": "Registerbekanntmachung nach dem Umwandlungsgesetz\nHamburg Amtsgericht Hamburg HRB 120073\nakquinet ONE Solutions GmbH – Hamburg",
      "type": "Registerbekanntmachung nach dem Umwandlungsgesetz",
      "state": "Hamburg",
      "amtsgericht": "Amtsgericht Hamburg",
      "registernummer": "HRB 120073",
      "registerart": "HRB",
      "company_name": "akquinet ONE Solutions GmbH",
      "company_seat": "Hamburg",
      "details": "12.09.2025 (Bekanntmachungsdatum)\n\nHamburg Amtsgericht Hamburg HRB 120073\nRegisterbekanntmachung nach dem Umwandlungsgesetz 12.09.2025 (Eintragungsdatum)\n\nakquinet ONE Solutions GmbH\nGesellschaft mit beschränkter Haftung\nHamburg\n\nAls nicht eingetragen wird bekannt gemacht:\nDen Gläubigern der an der Verschmelzung beteiligten Gesellschaften ist, wenn sie binnen sechs Monaten nach dem Tag, an dem die Eintragung der Verschmelzung in das Register des Sitzes derjenigen Rechtsträger deren Gläubiger sie sind, nach § 19 Absatz 3 UmwG als bekannt gemacht gilt, ihren Anspruch nach Grund und Höhe schriftlich anmelden, Sicherheit zu leisten, soweit sie nicht Befriedigung verlangen können. Dieses Recht steht den Gläubigern jedoch nur zu, wenn sie glaubhaft machen, dass durch die Verschmelzung die Erfüllung ihrer Forderung gefährdet wird."
    },
    {
      "date": "2025-09-12",
      "id": "129042",
      "original_text": "Registerbekanntmachung nach dem Umwandlungsgesetz\nHamburg Amtsgericht Hamburg HRA 91127\nKönig & Cie. GmbH & Co. KG – Hamburg",
      "type": "Registerbekanntmachung nach dem Umwandlungsgesetz",
      "state": "Hamburg",
      "amtsgericht": "Amtsgericht Hamburg",
      "registernummer": "HRA 91127",
      "registerart": "HRA",
      "company_name": "König & Cie. GmbH & Co. KG",
      "company_seat": "Hamburg",
      "details": "12.09.2025 (Bekanntmachungsdatum)\n\nHamburg Amtsgericht Hamburg HRA 91127\nRegisterbekanntmachung nach dem Umwandlungsgesetz 12.09.2025 (Eintragungsdatum)\n\nKönig & Cie. GmbH & Co. KG\nKommanditgesellschaft\nHamburg\n\nAls nicht eingetragen wird bekannt gemacht:\nDen Gläubigern der an der Verschmelzung beteiligten Gesellschaften ist, wenn sie binnen sechs Monaten nach dem Tag, an dem die Eintragung der Verschmelzung in das Register des Sitzes desjenigen Rechtsträgers, dessen Gläubiger sie sind, nach § 19 Absatz 3 UmwG als bekannt gemacht gilt, ihren Anspruch nach Grund und Höhe schriftlich anmelden, Sicherheit zu leisten, soweit sie nicht Befriedigung verlangen können. Dieses Recht steht den Gläubigern jedoch nur zu, wenn sie glaubhaft machen, dass durch die Verschmelzung die Erfüllung ihrer Forderung gefährdet wird."
    },
    {
      "date": "2025-09-12",
      "id": "129043",
      "original_text": "Registerbekanntmachung nach dem Umwandlungsgesetz\nHamburg Amtsgericht Hamburg HRB 133439\nakquinet value solutions GmbH – Hamburg",
      "type": "Registerbekanntmachung nach dem Umwandlungsgesetz",
      "state": "Hamburg",
      "amtsgericht": "Amtsgericht Hamburg",
      "registernummer": "HRB 133439",
      "registerart": "HRB",
      "company_name": "akquinet value solutions GmbH",
      "company_seat": "Hamburg",
      "details": "12.09.2025 (Bekanntmachungsdatum)\n\nHamburg Amtsgericht Hamburg HRB 133439\nRegisterbekanntmachung nach dem Umwandlungsgesetz 12.09.2025 (Eintragungsdatum)\n\nakquinet value solutions GmbH\nGesellschaft mit beschränkter Haftung\nHamburg\n\nAls nicht eingetragen wird bekannt gemacht:\nDen Gläubigern der an der Verschmelzung beteiligten Gesellschaften ist, wenn sie binnen sechs Monaten nach dem Tag, an dem die Eintragung der Verschmelzung in das Register des Sitzes desjenigen Rechtsträgers, dessen Gläubiger sie sind, nach § 19 Absatz 3 UmwG als bekannt gemacht gilt, ihren Anspruch nach Grund und Höhe schriftlich anmelden, Sicherheit zu leisten, soweit sie nicht Befriedigung verlangen können. Dieses Recht steht den Gläubigern jedoch nur zu, wenn sie glaubhaft machen, dass durch die Verschmelzung die Erfüllung ihrer Forderung gefährdet wird."
    },
    {
      "date": "2025-09-12",
      "id": "129044",
      "original_text": "Registerbekanntmachung nach dem Umwandlungsgesetz\nHamburg Amtsgericht Hamburg HRB 92802\nKing A Containerschiff Verwaltungs GmbH – Hamburg",
      "type": "Registerbekanntmachung nach dem Umwandlungsgesetz",
      "state": "Hamburg",
      "amtsgericht": "Amtsgericht Hamburg",
      "registernummer": "HRB 92802",
      "registerart": "HRB",
      "company_name": "King A Containerschiff Verwaltungs GmbH",
      "company_seat": "Hamburg",
      "details": "12.09.2025 (Bekanntmachungsdatum)\n\nHamburg Amtsgericht Hamburg HRB 92802\nRegisterbekanntmachung nach dem Umwandlungsgesetz 12.09.2025 (Eintragungsdatum)\n\nKing A Containerschiff Verwaltungs GmbH\nGesellschaft mit beschränkter Haftung\nHamburg\n\nAls nicht eingetragen wird bekannt gemacht:\nDen Gläubigern der an der Verschmelzung beteiligten Gesellschaften ist, wenn sie binnen sechs Monaten nach dem Tag, an dem die Eintragung der Verschmelzung in das Register des Sitzes desjenigen Rechtsträgers, dessen Gläubiger sie sind, nach § 19 Absatz 3 UmwG als bekannt gemacht gilt, ihren Anspruch nach Grund und Höhe schriftlich anmelden, Sicherheit zu leisten, soweit sie nicht Befriedigung verlangen können. Dieses Recht steht den Gläubigern jedoch nur zu, wenn sie glaubhaft machen, dass durch die Verschmelzung die Erfüllung ihrer Forderung gefährdet wird."
    },
    {
      "date": "2025-09-12",
      "id": "129045",
      "original_text": "Registerbekanntmachung nach dem Umwandlungsgesetz\nHamburg Amtsgericht Hamburg HRB 87736\nakquinet EpiX GmbH – Hamburg",
      "type": "Registerbekanntmachung nach dem Umwandlungsgesetz",
      "state": "Hamburg",
      "amtsgericht": "Amtsgericht Hamburg",
      "registernummer": "HRB 87736",
      "registerart": "HRB",
      "company_name": "akquinet EpiX GmbH",
      "company_seat": "Hamburg",
      "details": "12.09.2025 (Bekanntmachungsdatum)\n\nHamburg Amtsgericht Hamburg HRB 87736\nRegisterbekanntmachung nach dem Umwandlungsgesetz 12.09.2025 (Eintragungsdatum)\n\nakquinet EpiX GmbH\nGesellschaft mit beschränkter Haftung\nHamburg\n\nAls nicht eingetragen wird bekannt gemacht:\nDen Gläubigern der an der Verschmelzung beteiligten Gesellschaften ist, wenn sie binnen sechs Monaten nach dem Tag, an dem die Eintragung der Verschmelzung in das Register des Sitzes desjenigen Rechtsträgers, dessen Gläubiger sie sind, nach § 19 Absatz 3 UmwG als bekannt gemacht gilt, ihren Anspruch nach Grund und Höhe schriftlich anmelden, Sicherheit zu leisten, soweit sie nicht Befriedigung verlangen können. Dieses Recht steht den Gläubigern jedoch nur zu, wenn sie glaubhaft machen, dass durch die Verschmelzung die Erfüllung ihrer Forderung gefährdet wird."
    },
    {
      "date": "2025-09-12",
      "id": "129046",
      "original_text": "Registerbekanntmachung nach dem Umwandlungsgesetz\nBaden-Württemberg Amtsgericht Freiburg HRA 709088\nMEDICLIN Klinikum Soltau GmbH & Co. KG – Offenburg",
      "type": "Registerbekanntmachung nach dem Umwandlungsgesetz",
      "state": "Baden-Württemberg",
      "amtsgericht": "Amtsgericht Freiburg",
      "registernummer": "HRA 709088",
      "registerart": "HRA",
      "company_name": "MEDICLIN Klinikum Soltau GmbH & Co. KG",
      "company_seat": "Offenburg",
      "details": "12.09.2025 (Bekanntmachungsdatum)\n\nBaden-Württemberg Amtsgericht Freiburg HRA 709088\nRegisterbekanntmachung nach dem Umwandlungsgesetz 12.09.2025 (Eintragungsdatum)\n\nMEDICLIN Klinikum Soltau GmbH & Co. KG\nKommanditgesellschaft\nOffenburg\n\nAls nicht eingetragen wird bekanntgemacht:\nDen Gläubigern der an der Abspaltung beteiligten Rechtsträger ist, wenn sie binnen sechs Monaten nach dem Tag, an dem die Eintragung der Abspaltung in das Register des Sitzes desjenigen Rechtsträgers, dessen Gläubiger sie sind, nach § 19 Abs. 3 UmwG als bekanntgemacht gilt, ihren Anspruch nach Grund und Höhe schriftlich anmelden, Sicherheit zu leisten, soweit sie nicht Befriedigung verlangen können. Dieses Recht steht den Gläubigern jedoch nur zu, wenn sie glaubhaft machen, dass durch die Abspaltung die Erfüllung ihrer Forderung gefährdet wird."
    },
    {
      "date": "2025-09-12",
      "id": "129047",
      "original_text": "Registerbekanntmachung nach dem Umwandlungsgesetz\nBaden-Württemberg Amtsgericht Freiburg HRA 471526\nMediClin GmbH & Co. KG – Offenburg",
      "type": "Registerbekanntmachung nach dem Umwandlungsgesetz",
      "state": "Baden-Württemberg",
      "amtsgericht": "Amtsgericht Freiburg",
      "registernummer": "HRA 471526",
      "registerart": "HRA",
      "company_name": "MediClin GmbH & Co. KG",
      "company_seat": "Offenburg",
      "details": "12.09.2025 (Bekanntmachungsdatum)\n\nBaden-Württemberg Amtsgericht Freiburg HRA 471526\nRegisterbekanntmachung nach dem Umwandlungsgesetz 12.09.2025 (Eintragungsdatum)\n\nMediClin GmbH & Co. KG\nKommanditgesellschaft\nOffenburg\n\nAls nicht eingetragen wird bekanntgemacht:\nDen Gläubigern der an der Abspaltung beteiligten Rechtsträger ist, wenn sie binnen sechs Monaten nach dem Tag, an dem die Eintragung der Abspaltung in das Register des Sitzes desjenigen Rechtsträgers, dessen Gläubiger sie sind, nach § 19 Abs. 3 UmwG als bekanntgemacht gilt, ihren Anspruch nach Grund und Höhe schriftlich anmelden, Sicherheit zu leisten, soweit sie nicht Befriedigung verlangen können. Dieses Recht steht den Gläubigern jedoch nur zu, wenn sie glaubhaft machen, dass durch die Abspaltung die Erfüllung ihrer Forderung gefährdet wird."
    },
    {
      "date": "2025-09-12",
      "id": "129048",
      "original_text": "Löschungsankündigung\nBerlin Amtsgericht Berlin (Charlottenburg) HRA 53507\nPreußische Handels GmbH & Co. KG – Berlin",
      "type": "Löschungsankündigung",
      "state": "Berlin",
      "amtsgericht": "Amtsgericht Berlin (Charlottenburg)",
      "registernummer": "HRA 53507",
      "registerart": "HRA",
      "company_name": "Preußische Handels GmbH & Co. KG",
      "company_seat": "Berlin",
      "details": "12.09.2025 (Bekanntmachungsdatum)\n\nBerlin Amtsgericht Berlin (Charlottenburg) HRA 53507\nLöschungsankündigung\n\nPreußische Handels GmbH & Co. KG\nKommanditgesellschaft\nBerlin\n\nBei dem nachstehenden Unternehmen / der nachstehenden Gesellschaft wird das Amtslöschungsverfahren gemäß § 31 Abs. 2 HGB eingeleitet. Widerspruchsfrist 6 Wochen"
    },
    {
      "date": "2025-09-12",
      "id": "129049",
      "original_text": "Löschungsankündigung\nBerlin Amtsgericht Berlin (Charlottenburg) HRB 123413\nFIRKon Service GmbH – Berlin",
      "type": "Löschungsankündigung",
      "state": "Berlin",
      "amtsgericht": "Amtsgericht Berlin (Charlottenburg)",
      "registernummer": "HRB 123413",
      "registerart": "HRB",
      "company_name": "FIRKon Service GmbH",
      "company_seat": "Berlin",
      "details": "12.09.2025 (Bekanntmachungsdatum)\n\nBerlin Amtsgericht Berlin (Charlottenburg) HRB 123413\nLöschungsankündigung\n\nFIRKon Service GmbH\nGesellschaft mit beschränkter Haftung\nBerlin\n\nBei der nachstehenden Gesellschaft wird das Amtslöschungsverfahren gemäß § 394 FamFG eingeleitet. Widerspruchsfrist 6 Wochen"
    },
    {
      "date": "2025-09-12",
      "id": "129050",
      "original_text": "Registerbekanntmachung nach dem Umwandlungsgesetz\nBaden-Württemberg Amtsgericht Ulm HRB 750493\nGrillrost.com BBQ Immobilien GmbH – Rottenacker",
      "type": "Registerbekanntmachung nach dem Umwandlungsgesetz",
      "state": "Baden-Württemberg",
      "amtsgericht": "Amtsgericht Ulm",
      "registernummer": "HRB 750493",
      "registerart": "HRB",
      "company_name": "Grillrost.com BBQ Immobilien GmbH",
      "company_seat": "Rottenacker",
      "details": "12.09.2025 (Bekanntmachungsdatum)\n\nBaden-Württemberg Amtsgericht Ulm HRB 750493\nRegisterbekanntmachung nach dem Umwandlungsgesetz 12.09.2025 (Eintragungsdatum)\n\nGrillrost.com BBQ Immobilien GmbH\nGesellschaft mit beschränkter Haftung\nRottenacker\n\nAls nicht eingetragen wird bekanntgemacht:\nDen Gläubigern der an der Abspaltung beteiligten Rechtsträger ist, wenn sie binnen sechs Monaten nach dem Tag, an dem die Eintragung der Abspaltung in das Register des Sitzes desjenigen Rechtsträgers, dessen Gläubiger sie sind, nach § 19 Abs. 3 UmwG als bekanntgemacht gilt, ihren Anspruch nach Grund und Höhe schriftlich anmelden, Sicherheit zu leisten, soweit sie nicht Befriedigung verlangen können. Dieses Recht steht den Gläubigern jedoch nur zu, wenn sie glaubhaft machen, dass durch die Abspaltung die Erfüllung ihrer Forderung gefährdet wird."
    },
    {
      "date": "2025-09-12",
      "id": "129051",
      "original_text": "Sonstige Registerbekanntmachung\nBerlin Amtsgericht Berlin (Charlottenburg) HRB 234080\nAlmafa Immobilien Fünfundvierzig GmbH – Berlin",
      "type": "Sonstige Registerbekanntmachung",
      "state": "Berlin",
      "amtsgericht": "Amtsgericht Berlin (Charlottenburg)",
      "registernummer": "HRB 234080",
      "registerart": "HRB",
      "company_name": "Almafa Immobilien Fünfundvierzig GmbH",
      "company_seat": "Berlin",
      "details": "12.09.2025 (Bekanntmachungsdatum)\n\nBerlin Amtsgericht Berlin (Charlottenburg) HRB 234080\nSonstige Registerbekanntmachung\n\nAlmafa Immobilien Fünfundvierzig GmbH\nGesellschaft mit beschränkter Haftung\nBerlin\n\nAls nicht eingetragen wird veröffentlicht: Den Gläubigern der an der Verschmelzung beteiligten Rechtsträger ist, wenn sie binnen sechs Monaten nach dem Tag, an dem die Eintragung der Verschmelzung in das Register des Sitzes desjenigen Rechtsträgers, dessen Gläubiger sie sind, als bekannt gemacht gilt, ihren Anspruch nach Grund und Höhe schriftlich anmelden, Sicherheit zu leisten, soweit sie nicht Befriedigung verlangen können. Dieses Recht steht den Gläubigern jedoch nur zu, wenn sie glaubhaft machen, dass durch die Verschmelzung die Erfüllung ihrer Forderung gefährdet wird. Das Recht, Sicherheitsleistung zu verlangen, steht Gläubigern nicht zu, die im Falle der Insolvenz ein Recht auf vorzugsweise Befriedigung aus einer Deckungsmasse haben, die nach gesetzlicher Vorschrift zu ihrem Schutz errichtet und staatlich überwacht ist."
    },
    {
      "date": "2025-09-12",
      "id": "129052",
      "original_text": "Registerbekanntmachung nach dem Umwandlungsgesetz\nBerlin Amtsgericht Berlin (Charlottenburg) HRB 187268\nZattoo Deutschland GmbH – Berlin",
      "type": "Registerbekanntmachung nach dem Umwandlungsgesetz",
      "state": "Berlin",
      "amtsgericht": "Amtsgericht Berlin (Charlottenburg)",
      "registernummer": "HRB 187268",
      "registerart": "HRB",
      "company_name": "Zattoo Deutschland GmbH",
      "company_seat": "Berlin",
      "details": "12.09.2025 (Bekanntmachungsdatum)\n\nBerlin Amtsgericht Berlin (Charlottenburg) HRB 187268\nRegisterbekanntmachung nach dem Umwandlungsgesetz 09.09.2025 (Eintragungsdatum)\n\nZattoo Deutschland GmbH\nGesellschaft mit beschränkter Haftung\nBerlin\n\nZu Eintragungsnummer 4 vom 09.09.2025 wird als nicht eingetragen veröffentlicht: Den Gläubigern der an der Verschmelzung beteiligten Rechtsträger ist, wenn sie binnen sechs Monaten nach dem Tag, an dem die Eintragung der Verschmelzung in das Register des Sitzes desjenigen Rechtsträgers, dessen Gläubiger sie sind, als bekannt gemacht gilt, ihren Anspruch nach Grund und Höhe schriftlich anmelden, Sicherheit zu leisten, soweit sie nicht Befriedigung verlangen können. Dieses Recht steht den Gläubigern jedoch nur zu, wenn sie glaubhaft machen, dass durch die Verschmelzung die Erfüllung ihrer Forderung gefährdet wird. Das Recht, Sicherheitsleistung zu verlangen, steht Gläubigern nicht zu, die im Falle der Insolvenz ein Recht auf vorzugsweise Befriedigung aus einer Deckungsmasse haben, die nach gesetzlicher Vorschrift zu ihrem Schutz errichtet und staatlich überwacht ist."
    },
    {
      "date": "2025-09-12",
      "id": "129053",
      "original_text": "Löschungsankündigung\nBaden-Württemberg Amtsgericht Mannheim HRB 700118\nPoint Fashion Outlet GmbH – Mannheim",
      "type": "Löschungsankündigung",
      "state": "Baden-Württemberg",
      "amtsgericht": "Amtsgericht Mannheim",
      "registernummer": "HRB 700118",
      "registerart": "HRB",
      "company_name": "Point Fashion Outlet GmbH",
      "company_seat": "Mannheim",
      "details": "12.09.2025 (Bekanntmachungsdatum)\n\nBaden-Württemberg Amtsgericht Mannheim HRB 700118\nLöschungsankündigung\n\nPoint Fashion Outlet GmbH\nGesellschaft mit beschränkter Haftung\nMannheim\n\n#DV.Auswahl(Text=\"Bitte wählen Sie aus:\",\tEingabe=\n\"#insert(Text=\"VOE_Allgemein\")\"|\"Als nicht eingetragen wird bekanntgemacht:\",\n\"#insert(Text=\"VOE_BKM_Blätter\")\"|\"Bekanntmachungen der Gesellschaft erfolgen...\",\n\"#insert(Text=\"VOE_Aufsichtsrat\")\"|\"Mitglieder des ersten Aufsichtsrats\",\n\"#insert(Text=\"VOE_Sachgründung\")\"|\"Sachgründung\",\n\"#insert(Text=\"VOE_Sacherhöhung\")\"|\"Sacherhöhung\",\n\"#insert(Text=\"VOE_Aufhebung_UV\")\"|\"Aufhebung Unternehmensvertrag\",\n\"#insert(Text=\"VOE_Formwechsel\")\"|\"Formwechsel\",\n\"#insert(Text=\"VOE_Verschmelzung\")\"|\"Verschmelzung\",\n\"#insert(Text=\"VOE_Abspaltung\")\"|\"Abspaltung\",\n\"#insert(Text=\"VOE_Aufspaltung\")\"|\"Aufspaltung\",\n\"#insert(Text=\"VOE_Ausgliederung\")\"|\"Ausgliederung\",\n\"#insert(Text=\"VOE_Vermögensübertragung\")\"|\"Vermögensübertragung\",\n\"#insert(Text=\"Loeschungsankündigung_HR_394\")\"|\"Löschungsankündigung 394 FamFG\",\n\"#insert(Text=\"Loeschungsankündigung_HR_395\")\"|\"Löschungsankündigung 395 FamFG\",\n\"#insert(Text=\"Loeschungsankündigung_HR_397\")\"|\"Löschungsankündigung 397 FamFG\")"
    },
    {
      "date": "2025-09-12",
      "id": "129054",
      "original_text": "Löschungsankündigung\nBaden-Württemberg Amtsgericht Mannheim HRB 700118\nPoint Fashion Outlet GmbH – Mannheim",
      "type": "Löschungsankündigung",
      "state": "Baden-Württemberg",
      "amtsgericht": "Amtsgericht Mannheim",
      "registernummer": "HRB 700118",
      "registerart": "HRB",
      "company_name": "Point Fashion Outlet GmbH",
      "company_seat": "Mannheim",
      "details": "12.09.2025 (Bekanntmachungsdatum)\n\nBaden-Württemberg Amtsgericht Mannheim HRB 700118\nLöschungsankündigung\n\nPoint Fashion Outlet GmbH\nGesellschaft mit beschränkter Haftung\nMannheim\n\nDas Gericht beabsichtigt, die Gesellschaft wegen Vermögenslosigkeit im Handelsregister von Amts wegen nach § 394 FamFG zu löschen. Die Frist zur Geltendmachung eines Widerspruchs gegen die beabsichtigte Löschung ist auf einen Monat ab Veröffentlichung bestimmt."
    },
    {
      "date": "2025-09-12",
      "id": "129055",
      "original_text": "Registerbekanntmachung nach dem Umwandlungsgesetz\nHamburg Amtsgericht Hamburg HRB 137338\nAquila Capital Investment Management IV GmbH – Hamburg",
      "type": "Registerbekanntmachung nach dem Umwandlungsgesetz",
      "state": "Hamburg",
      "amtsgericht": "Amtsgericht Hamburg",
      "registernummer": "HRB 137338",
      "registerart": "HRB",
      "company_name": "Aquila Capital Investment Management IV GmbH",
      "company_seat": "Hamburg",
      "details": "12.09.2025 (Bekanntmachungsdatum)\n\nHamburg Amtsgericht Hamburg HRB 137338\nRegisterbekanntmachung nach dem Umwandlungsgesetz 12.09.2025 (Eintragungsdatum)\n\nAquila Capital Investment Management IV GmbH\nGesellschaft mit beschränkter Haftung\nHamburg\n\nAls nicht eingetragen wird bekannt gemacht:\nDen Gläubigern der an der Verschmelzung beteiligten Gesellschaften ist, wenn sie binnen sechs Monaten nach dem Tag, an dem die Eintragung der Verschmelzung in das Register des Sitzes desjenigen Rechtsträgers, dessen Gläubiger sie sind, nach § 19 Absatz 3 UmwG als bekannt gemacht gilt, ihren Anspruch nach Grund und Höhe schriftlich anmelden, Sicherheit zu leisten, soweit sie nicht Befriedigung verlangen können. Dieses Recht steht den Gläubigern jedoch nur zu, wenn sie glaubhaft machen, dass durch die Verschmelzung die Erfüllung ihrer Forderung gefährdet wird."
    },
    {
      "date": "2025-09-12",
      "id": "129056",
      "original_text": "Registerbekanntmachung nach dem Umwandlungsgesetz\nHamburg Amtsgericht Hamburg HRB 172124\nAquila Capital Growth Holding GmbH – Hamburg",
      "type": "Registerbekanntmachung nach dem Umwandlungsgesetz",
      "state": "Hamburg",
      "amtsgericht": "Amtsgericht Hamburg",
      "registernummer": "HRB 172124",
      "registerart": "HRB",
      "company_name": "Aquila Capital Growth Holding GmbH",
      "company_seat": "Hamburg",
      "details": "12.09.2025 (Bekanntmachungsdatum)\n\nHamburg Amtsgericht Hamburg HRB 172124\nRegisterbekanntmachung nach dem Umwandlungsgesetz 12.09.2025 (Eintragungsdatum)\n\nAquila Capital Growth Holding GmbH\nGesellschaft mit beschränkter Haftung\nHamburg\n\nAls nicht eingetragen wird bekannt gemacht:\nDen Gläubigern der an der Verschmelzung beteiligten Gesellschaften ist, wenn sie binnen sechs Monaten nach dem Tag, an dem die Eintragung der Verschmelzung in das Register des Sitzes derjenigen Rechtsträger deren Gläubiger sie sind, nach § 19 Absatz 3 UmwG als bekannt gemacht gilt, ihren Anspruch nach Grund und Höhe schriftlich anmelden, Sicherheit zu leisten, soweit sie nicht Befriedigung verlangen können. Dieses Recht steht den Gläubigern jedoch nur zu, wenn sie glaubhaft machen, dass durch die Verschmelzung die Erfüllung ihrer Forderung gefährdet wird."
    },
    {
      "date": "2025-09-12",
      "id": "129057",
      "original_text": "Registerbekanntmachung nach dem Umwandlungsgesetz\nHamburg Amtsgericht Hamburg HRB 137357\nAquila Capital Investment Verwaltungsgesellschaft IV mbH – Hamburg",
      "type": "Registerbekanntmachung nach dem Umwandlungsgesetz",
      "state": "Hamburg",
      "amtsgericht": "Amtsgericht Hamburg",
      "registernummer": "HRB 137357",
      "registerart": "HRB",
      "company_name": "Aquila Capital Investment Verwaltungsgesellschaft IV mbH",
      "company_seat": "Hamburg",
      "details": "12.09.2025 (Bekanntmachungsdatum)\n\nHamburg Amtsgericht Hamburg HRB 137357\nRegisterbekanntmachung nach dem Umwandlungsgesetz 12.09.2025 (Eintragungsdatum)\n\nAquila Capital Investment Verwaltungsgesellschaft IV mbH\nGesellschaft mit beschränkter Haftung\nHamburg\n\nAls nicht eingetragen wird bekannt gemacht:\nDen Gläubigern der an der Verschmelzung beteiligten Gesellschaften ist, wenn sie binnen sechs Monaten nach dem Tag, an dem die Eintragung der Verschmelzung in das Register des Sitzes desjenigen Rechtsträgers, dessen Gläubiger sie sind, nach § 19 Absatz 3 UmwG als bekannt gemacht gilt, ihren Anspruch nach Grund und Höhe schriftlich anmelden, Sicherheit zu leisten, soweit sie nicht Befriedigung verlangen können. Dieses Recht steht den Gläubigern jedoch nur zu, wenn sie glaubhaft machen, dass durch die Verschmelzung die Erfüllung ihrer Forderung gefährdet wird."
    },
    {
      "date": "2025-09-12",
      "id": "129058",
      "original_text": "Löschungsankündigung\nBaden-Württemberg Amtsgericht Ulm HRB 738218\nDiVa UG (haftungsbeschränkt) – Aalen",
      "type": "Löschungsankündigung",
      "state": "Baden-Württemberg",
      "amtsgericht": "Amtsgericht Ulm",
      "registernummer": "HRB 738218",
      "registerart": "HRB",
      "company_name": "DiVa UG (haftungsbeschränkt)",
      "company_seat": "Aalen",
      "details": "12.09.2025 (Bekanntmachungsdatum)\n\nBaden-Württemberg Amtsgericht Ulm HRB 738218\nLöschungsankündigung\n\nDiVa UG (haftungsbeschränkt)\nGesellschaft mit beschränkter Haftung\nAalen\n\nDas Gericht beabsichtigt, die Gesellschaft wegen Vermögenslosigkeit im Handelsregister von Amts wegen nach § 394 FamFG zu löschen. Die Frist zur Geltendmachung eines Widerspruchs gegen die beabsichtigte Löschung ist auf  einen Monat ab Veröffentlichung bestimmt. Als nicht eingetragen wird bekanntgemacht:"
    },
    {
      "date": "2025-09-12",
      "id": "129059",
      "original_text": "Registerbekanntmachung nach dem Umwandlungsgesetz\nBaden-Württemberg Amtsgericht Freiburg HRA 610563\nKnöpfle & Fischer, Inhaber Jörg Fischer e. Kfm. – Blumberg",
      "type": "Registerbekanntmachung nach dem Umwandlungsgesetz",
      "state": "Baden-Württemberg",
      "amtsgericht": "Amtsgericht Freiburg",
      "registernummer": "HRA 610563",
      "registerart": "HRA",
      "company_name": "Knöpfle & Fischer, Inhaber Jörg Fischer e. Kfm.",
      "company_seat": "Blumberg",
      "details": "12.09.2025 (Bekanntmachungsdatum)\n\nBaden-Württemberg Amtsgericht Freiburg HRA 610563\nRegisterbekanntmachung nach dem Umwandlungsgesetz 12.09.2025 (Eintragungsdatum)\n\nKnöpfle & Fischer, Inhaber Jörg Fischer e. Kfm.\nEinzelkaufmann / Einzelkauffrau\nBlumberg\n\nDen Gläubigern der an der Ausgliederung beteiligten Rechtsträger ist, wenn sie binnen sechs Monaten nach dem Tag, an dem die Eintragung der Ausgliederung in das Register des Sitzes desjenigen Rechtsträgers, dessen Gläubiger sie sind, nach § 19 Abs. 3 UmwG als bekanntgemacht gilt, ihren Anspruch nach Grund und Höhe schriftlich anmelden, Sicherheit zu leisten, soweit sie nicht Befriedigung verlangen können. Dieses Recht steht den Gläubigern jedoch nur zu, wenn sie glaubhaft machen, dass durch die Ausgliederung die Erfüllung ihrer Forderung gefährdet wird."
    },
    {
      "date": "2025-09-12",
      "id": "129060",
      "original_text": "Registerbekanntmachung nach dem Umwandlungsgesetz\nBaden-Württemberg Amtsgericht Freiburg HRA 709201\nKnöpfle und Fischer Fensterbau GmbH & Co. KG – Blumberg",
      "type": "Registerbekanntmachung nach dem Umwandlungsgesetz",
      "state": "Baden-Württemberg",
      "amtsgericht": "Amtsgericht Freiburg",
      "registernummer": "HRA 709201",
      "registerart": "HRA",
      "company_name": "Knöpfle und Fischer Fensterbau GmbH & Co. KG",
      "company_seat": "Blumberg",
      "details": "12.09.2025 (Bekanntmachungsdatum)\n\nBaden-Württemberg Amtsgericht Freiburg HRA 709201\nRegisterbekanntmachung nach dem Umwandlungsgesetz 12.09.2025 (Eintragungsdatum)\n\nKnöpfle und Fischer Fensterbau GmbH & Co. KG\nKommanditgesellschaft\nBlumberg\n\nDen Gläubigern der an der Ausgliederung beteiligten Rechtsträger ist, wenn sie binnen sechs Monaten nach dem Tag, an dem die Eintragung der Ausgliederung in das Register des Sitzes desjenigen Rechtsträgers, dessen Gläubiger sie sind, nach § 19 Abs. 3 UmwG als bekanntgemacht gilt, ihren Anspruch nach Grund und Höhe schriftlich anmelden, Sicherheit zu leisten, soweit sie nicht Befriedigung verlangen können. Dieses Recht steht den Gläubigern jedoch nur zu, wenn sie glaubhaft machen, dass durch die Ausgliederung die Erfüllung ihrer Forderung gefährdet wird."
    },
    {
      "date": "2025-09-12",
      "id": "129061",
      "original_text": "Löschungsankündigung\nBerlin Amtsgericht Berlin (Charlottenburg) HRB 226040\nTHE7 Automotive UG (haftungsbeschränkt) – Berlin",
      "type": "Löschungsankündigung",
      "state": "Berlin",
      "amtsgericht": "Amtsgericht Berlin (Charlottenburg)",
      "registernummer": "HRB 226040",
      "registerart": "HRB",
      "company_name": "THE7 Automotive UG (haftungsbeschränkt)",
      "company_seat": "Berlin",
      "details": "12.09.2025 (Bekanntmachungsdatum)\n\nBerlin Amtsgericht Berlin (Charlottenburg) HRB 226040\nLöschungsankündigung\n\nTHE7 Automotive UG (haftungsbeschränkt)\nGesellschaft mit beschränkter Haftung\nBerlin\n\nBei der nachstehenden Gesellschaft wird das Amtslöschungsverfahren gemäß § 394 FamFG eingeleitet. Widerspruchsfrist 6 Wochen"
    },
    {
      "date": "2025-09-12",
      "id": "129062",
      "original_text": "Registerbekanntmachung nach dem Umwandlungsgesetz\nBaden-Württemberg Amtsgericht Freiburg HRB 541602\nMaier Holding Verwaltungs GmbH – Singen Hohentwiel",
      "type": "Registerbekanntmachung nach dem Umwandlungsgesetz",
      "state": "Baden-Württemberg",
      "amtsgericht": "Amtsgericht Freiburg",
      "registernummer": "HRB 541602",
      "registerart": "HRB",
      "company_name": "Maier Holding Verwaltungs GmbH",
      "company_seat": "Singen Hohentwiel",
      "details": "12.09.2025 (Bekanntmachungsdatum)\n\nBaden-Württemberg Amtsgericht Freiburg HRB 541602\nRegisterbekanntmachung nach dem Umwandlungsgesetz 12.09.2025 (Eintragungsdatum)\n\nMaier Holding Verwaltungs GmbH\nGesellschaft mit beschränkter Haftung\nSingen Hohentwiel\n\nDen Gläubigern der an der Verschmelzung beteiligten Rechtsträger ist, wenn sie binnen sechs Monaten nach dem Tag, an dem die Eintragung der Verschmelzung in das Register des Sitzes desjenigen Rechtsträgers, dessen Gläubiger sie sind, nach § 19 Abs. 3 UmwG als bekanntgemacht gilt, ihren Anspruch nach Grund und Höhe schriftlich anmelden, Sicherheit zu leisten, soweit sie nicht Befriedigung verlangen können. Dieses Recht steht den Gläubigern jedoch nur zu, wenn sie glaubhaft machen, dass durch die Verschmelzung die Erfüllung ihrer Forderung gefährdet wird."
    },
    {
      "date": "2025-09-12",
      "id": "129063",
      "original_text": "Registerbekanntmachung nach dem Umwandlungsgesetz\nSchleswig-Holstein Amtsgericht Flensburg HRA 3145\nWEISS-Lackierung e.K. – Flensburg",
      "type": "Registerbekanntmachung nach dem Umwandlungsgesetz",
      "state": "Schleswig-Holstein",
      "amtsgericht": "Amtsgericht Flensburg",
      "registernummer": "HRA 3145",
      "registerart": "HRA",
      "company_name": "WEISS-Lackierung e.K.",
      "company_seat": "Flensburg",
      "details": "12.09.2025 (Bekanntmachungsdatum)\n\nSchleswig-Holstein Amtsgericht Flensburg HRA 3145\nRegisterbekanntmachung nach dem Umwandlungsgesetz 12.09.2025 (Eintragungsdatum)\n\nWEISS-Lackierung e.K.\nEinzelkaufmann / Einzelkauffrau\nFlensburg\n\nZu Eintragungsnummer 5 vom 12.09.2025 wird als nicht eingetragen veröffentlicht:  Den Gläubigern der an der Spaltung beteiligten Rechtsträger ist, wenn sie binnen sechs Monaten nach dem Tag, an dem die Eintragung der Spaltung in das Register des Sitzes desjenigen Rechtsträgers, dessen Gläubiger sie sind, als bekannt gemacht gilt, ihren Anspruch nach Grund und Höhe in Textform anmelden, Sicherheit zu leisten, soweit sie nicht Befriedigung verlangen können. Dieses Recht steht den Gläubigern jedoch nur zu, wenn sie glaubhaft machen, dass durch die Spaltung die Erfüllung ihrer Forderung gefährdet wird."
    },
    {
      "date": "2025-09-12",
      "id": "129064",
      "original_text": "Registerbekanntmachung nach dem Umwandlungsgesetz\nSaarland Amtsgericht Saarbrücken HRA 13650\nJakob Vermögensverwaltung GmbH & Co. KG – Eppelborn",
      "type": "Registerbekanntmachung nach dem Umwandlungsgesetz",
      "state": "Saarland",
      "amtsgericht": "Amtsgericht Saarbrücken",
      "registernummer": "HRA 13650",
      "registerart": "HRA",
      "company_name": "Jakob Vermögensverwaltung GmbH & Co. KG",
      "company_seat": "Eppelborn",
      "details": "12.09.2025 (Bekanntmachungsdatum)\n\nSaarland Amtsgericht Saarbrücken HRA 13650\nRegisterbekanntmachung nach dem Umwandlungsgesetz 12.09.2025 (Eintragungsdatum)\n\nJakob Vermögensverwaltung GmbH & Co. KG\nKommanditgesellschaft\nEppelborn\n\nAls nicht eingetragen wird bekannt gemacht: Den Gläubigern der an der Verschmelzung beteiligten Gesellschaften ist, wenn sie binnen sechs Monaten nach dem Tag, an dem die Eintragung der Verschmelzung in das Register des Sitzes desjenigen Rechtsträgers, dessen Gläubiger sie sind, nach § 19 Absatz 3 UmwG bekannt gemacht worden ist, ihren Anspruch nach Grund und Höhe schriftlich anmelden, Sicherheit zu leisten, soweit sie nicht Befriedigung verlangen können. Dieses Recht steht den Gläubigern jedoch nur zu, wenn sie glaubhaft machen, dass durch die Verschmelzung die Erfüllung ihrer Forderung gefährdet wird."
    },
    {
      "date": "2025-09-12",
      "id": "129065",
      "original_text": "Registerbekanntmachung nach dem Umwandlungsgesetz\nHamburg Amtsgericht Hamburg HRB 155913\ne.ventures europe II Komplementär GmbH – Hamburg",
      "type": "Registerbekanntmachung nach dem Umwandlungsgesetz",
      "state": "Hamburg",
      "amtsgericht": "Amtsgericht Hamburg",
      "registernummer": "HRB 155913",
      "registerart": "HRB",
      "company_name": "e.ventures europe II Komplementär GmbH",
      "company_seat": "Hamburg",
      "details": "12.09.2025 (Bekanntmachungsdatum)\n\nHamburg Amtsgericht Hamburg HRB 155913\nRegisterbekanntmachung nach dem Umwandlungsgesetz 12.09.2025 (Eintragungsdatum)\n\ne.ventures europe II Komplementär GmbH\nGesellschaft mit beschränkter Haftung\nHamburg\n\nAls nicht eingetragen wird bekannt gemacht:\nDen Gläubigern der an der Verschmelzung beteiligten Gesellschaften ist, wenn sie binnen sechs Monaten nach dem Tag, an dem die Eintragung der Verschmelzung in das Register des Sitzes desjenigen Rechtsträgers, dessen Gläubiger sie sind, nach § 19 Absatz 3 UmwG als bekannt gemacht gilt, ihren Anspruch nach Grund und Höhe schriftlich anmelden, Sicherheit zu leisten, soweit sie nicht Befriedigung verlangen können. Dieses Recht steht den Gläubigern jedoch nur zu, wenn sie glaubhaft machen, dass durch die Verschmelzung die Erfüllung ihrer Forderung gefährdet wird."
    },
    {
      "date": "2025-09-12",
      "id": "129066",
      "original_text": "Registerbekanntmachung nach dem Umwandlungsgesetz\nHamburg Amtsgericht Hamburg HRB 155215\nHeadline GP GmbH – Hamburg",
      "type": "Registerbekanntmachung nach dem Umwandlungsgesetz",
      "state": "Hamburg",
      "amtsgericht": "Amtsgericht Hamburg",
      "registernummer": "HRB 155215",
      "registerart": "HRB",
      "company_name": "Headline GP GmbH",
      "company_seat": "Hamburg",
      "details": "12.09.2025 (Bekanntmachungsdatum)\n\nHamburg Amtsgericht Hamburg HRB 155215\nRegisterbekanntmachung nach dem Umwandlungsgesetz 12.09.2025 (Eintragungsdatum)\n\nHeadline GP GmbH\nGesellschaft mit beschränkter Haftung\nHamburg\n\nAls nicht eingetragen wird bekannt gemacht:\nDen Gläubigern der an der Verschmelzung beteiligten Gesellschaften ist, wenn sie binnen sechs Monaten nach dem Tag, an dem die Eintragung der Verschmelzung in das Register des Sitzes derjenigen Rechtsträger deren Gläubiger sie sind, nach § 19 Absatz 3 UmwG als bekannt gemacht gilt, ihren Anspruch nach Grund und Höhe schriftlich anmelden, Sicherheit zu leisten, soweit sie nicht Befriedigung verlangen können. Dieses Recht steht den Gläubigern jedoch nur zu, wenn sie glaubhaft machen, dass durch die Verschmelzung die Erfüllung ihrer Forderung gefährdet wird."
    },
    {
      "date": "2025-09-12",
      "id": "129067",
      "original_text": "Registerbekanntmachung nach dem Umwandlungsgesetz\nHamburg Amtsgericht Hamburg HRB 145583\ne.ventures Co-Invest I Komplementär GmbH – Hamburg",
      "type": "Registerbekanntmachung nach dem Umwandlungsgesetz",
      "state": "Hamburg",
      "amtsgericht": "Amtsgericht Hamburg",
      "registernummer": "HRB 145583",
      "registerart": "HRB",
      "company_name": "e.ventures Co-Invest I Komplementär GmbH",
      "company_seat": "Hamburg",
      "details": "12.09.2025 (Bekanntmachungsdatum)\n\nHamburg Amtsgericht Hamburg HRB 145583\nRegisterbekanntmachung nach dem Umwandlungsgesetz 12.09.2025 (Eintragungsdatum)\n\ne.ventures Co-Invest I Komplementär GmbH\nGesellschaft mit beschränkter Haftung\nHamburg\n\nAls nicht eingetragen wird bekannt gemacht:\nDen Gläubigern der an der Verschmelzung beteiligten Gesellschaften ist, wenn sie binnen sechs Monaten nach dem Tag, an dem die Eintragung der Verschmelzung in das Register des Sitzes desjenigen Rechtsträgers, dessen Gläubiger sie sind, nach § 19 Absatz 3 UmwG als bekannt gemacht gilt, ihren Anspruch nach Grund und Höhe schriftlich anmelden, Sicherheit zu leisten, soweit sie nicht Befriedigung verlangen können. Dieses Recht steht den Gläubigern jedoch nur zu, wenn sie glaubhaft machen, dass durch die Verschmelzung die Erfüllung ihrer Forderung gefährdet wird."
    },
    {
      "date": "2025-09-12",
      "id": "129068",
      "original_text": "Registerbekanntmachung nach dem Umwandlungsgesetz\nSaarland Amtsgericht Saarbrücken HRA 13614\nBauschlosserei Martin Jakob e.K. – Eppelborn",
      "type": "Registerbekanntmachung nach dem Umwandlungsgesetz",
      "state": "Saarland",
      "amtsgericht": "Amtsgericht Saarbrücken",
      "registernummer": "HRA 13614",
      "registerart": "HRA",
      "company_name": "Bauschlosserei Martin Jakob e.K.",
      "company_seat": "Eppelborn",
      "details": "12.09.2025 (Bekanntmachungsdatum)\n\nSaarland Amtsgericht Saarbrücken HRA 13614\nRegisterbekanntmachung nach dem Umwandlungsgesetz 12.09.2025 (Eintragungsdatum)\n\nBauschlosserei Martin Jakob e.K.\nEinzelkaufmann / Einzelkauffrau\nEppelborn\n\nAls nicht eingetragen wird bekannt gemacht: Den Gläubigern der an der Verschmelzung beteiligten Gesellschaften ist, wenn sie binnen sechs Monaten nach dem Tag, an dem die Eintragung der Verschmelzung in das Register des Sitzes desjenigen Rechtsträgers, dessen Gläubiger sie sind, nach § 19 Absatz 3 UmwG bekannt gemacht worden ist, ihren Anspruch nach Grund und Höhe schriftlich anmelden, Sicherheit zu leisten, soweit sie nicht Befriedigung verlangen können. Dieses Recht steht den Gläubigern jedoch nur zu, wenn sie glaubhaft machen, dass durch die Verschmelzung die Erfüllung ihrer Forderung gefährdet wird."
    },
    {
      "date": "2025-09-12",
      "id": "129069",
      "original_text": "Registerbekanntmachung nach dem Umwandlungsgesetz\nBaden-Württemberg Amtsgericht Stuttgart HRB 203753\nHEINRICH Getränke-Markt Einzelhandels-GmbH – Kornwestheim",
      "type": "Registerbekanntmachung nach dem Umwandlungsgesetz",
      "state": "Baden-Württemberg",
      "amtsgericht": "Amtsgericht Stuttgart",
      "registernummer": "HRB 203753",
      "registerart": "HRB",
      "company_name": "HEINRICH Getränke-Markt Einzelhandels-GmbH",
      "company_seat": "Kornwestheim",
      "details": "12.09.2025 (Bekanntmachungsdatum)\n\nBaden-Württemberg Amtsgericht Stuttgart HRB 203753\nRegisterbekanntmachung nach dem Umwandlungsgesetz 12.09.2025 (Eintragungsdatum)\n\nHEINRICH Getränke-Markt Einzelhandels-GmbH\nGesellschaft mit beschränkter Haftung\nKornwestheim\n\nAls nicht eingetragen wird bekanntgemacht:\nDen Gläubigern der an der Verschmelzung beteiligten Rechtsträger ist, wenn sie binnen sechs Monaten nach dem Tag, an dem die Eintragung der Verschmelzung in das Register des Sitzes desjenigen Rechtsträgers, dessen Gläubiger sie sind, nach § 19 Abs. 3 UmwG als bekanntgemacht gilt, ihren Anspruch nach Grund und Höhe schriftlich anmelden, Sicherheit zu leisten, soweit sie nicht Befriedigung verlangen können. Dieses Recht steht den Gläubigern jedoch nur zu, wenn sie glaubhaft machen, dass durch die Verschmelzung die Erfüllung ihrer Forderung gefährdet wird."
    },
    {
      "date": "2025-09-12",
      "id": "129070",
      "original_text": "Registerbekanntmachung nach dem Umwandlungsgesetz\nBaden-Württemberg Amtsgericht Stuttgart HRB 772964\nW.O. Projektgesellschaft mbH – Oberriexingen",
      "type": "Registerbekanntmachung nach dem Umwandlungsgesetz",
      "state": "Baden-Württemberg",
      "amtsgericht": "Amtsgericht Stuttgart",
      "registernummer": "HRB 772964",
      "registerart": "HRB",
      "company_name": "W.O. Projektgesellschaft mbH",
      "company_seat": "Oberriexingen",
      "details": "12.09.2025 (Bekanntmachungsdatum)\n\nBaden-Württemberg Amtsgericht Stuttgart HRB 772964\nRegisterbekanntmachung nach dem Umwandlungsgesetz 12.09.2025 (Eintragungsdatum)\n\nW.O. Projektgesellschaft mbH\nGesellschaft mit beschränkter Haftung\nOberriexingen\n\nAls nicht eingetragen wird bekanntgemacht:\nDen Gläubigern der an der Verschmelzung beteiligten Rechtsträger ist, wenn sie binnen sechs Monaten nach dem Tag, an dem die Eintragung der Verschmelzung in das Register des Sitzes desjenigen Rechtsträgers, dessen Gläubiger sie sind, nach § 19 Abs. 3 UmwG als bekanntgemacht gilt, ihren Anspruch nach Grund und Höhe schriftlich anmelden, Sicherheit zu leisten, soweit sie nicht Befriedigung verlangen können. Dieses Recht steht den Gläubigern jedoch nur zu, wenn sie glaubhaft machen, dass durch die Verschmelzung die Erfüllung ihrer Forderung gefährdet wird."
    },
    {
      "date": "2025-09-12",
      "id": "129071",
      "original_text": "Registerbekanntmachung nach dem Umwandlungsgesetz\nBaden-Württemberg Amtsgericht Stuttgart HRB 772965\nWohnbau Oberriexingen Immobilien GmbH – Oberriexingen",
      "type": "Registerbekanntmachung nach dem Umwandlungsgesetz",
      "state": "Baden-Württemberg",
      "amtsgericht": "Amtsgericht Stuttgart",
      "registernummer": "HRB 772965",
      "registerart": "HRB",
      "company_name": "Wohnbau Oberriexingen Immobilien GmbH",
      "company_seat": "Oberriexingen",
      "details": "12.09.2025 (Bekanntmachungsdatum)\n\nBaden-Württemberg Amtsgericht Stuttgart HRB 772965\nRegisterbekanntmachung nach dem Umwandlungsgesetz 12.09.2025 (Eintragungsdatum)\n\nWohnbau Oberriexingen Immobilien GmbH\nGesellschaft mit beschränkter Haftung\nOberriexingen\n\nAls nicht eingetragen wird bekanntgemacht:\nDen Gläubigern der an der Verschmelzung beteiligten Rechtsträger ist, wenn sie binnen sechs Monaten nach dem Tag, an dem die Eintragung der Verschmelzung in das Register des Sitzes desjenigen Rechtsträgers, dessen Gläubiger sie sind, nach § 19 Abs. 3 UmwG als bekanntgemacht gilt, ihren Anspruch nach Grund und Höhe schriftlich anmelden, Sicherheit zu leisten, soweit sie nicht Befriedigung verlangen können. Dieses Recht steht den Gläubigern jedoch nur zu, wenn sie glaubhaft machen, dass durch die Verschmelzung die Erfüllung ihrer Forderung gefährdet wird."
    },
    {
      "date": "2025-09-12",
      "id": "129072",
      "original_text": "Einreichung neuer Dokumente\nBerlin Amtsgericht Berlin (Charlottenburg) HRB 158127\nzeotap GmbH – Berlin",
      "type": "Einreichung neuer Dokumente",
      "state": "Berlin",
      "amtsgericht": "Amtsgericht Berlin (Charlottenburg)",
      "registernummer": "HRB 158127",
      "registerart": "HRB",
      "company_name": "zeotap GmbH",
      "company_seat": "Berlin",
      "details": "12.09.2025 (Bekanntmachungsdatum)\n\nBerlin Amtsgericht Berlin (Charlottenburg) HRB 158127\nEinreichung neuer Dokumente\n\nzeotap GmbH\nGesellschaft mit beschränkter Haftung\nBerlin\n\nAls nicht eingetragen wird veröffentlicht: Es wurde eine neue Liste der Beiratsmitglieder eingereicht (§52 GmbHG)."
    },
    {
      "date": "2025-09-12",
      "id": "129073",
      "original_text": "Registerbekanntmachung nach dem Umwandlungsgesetz\nHamburg Amtsgericht Hamburg HRB 85563\nOptix Post Production GmbH – Hamburg",
      "type": "Registerbekanntmachung nach dem Umwandlungsgesetz",
      "state": "Hamburg",
      "amtsgericht": "Amtsgericht Hamburg",
      "registernummer": "HRB 85563",
      "registerart": "HRB",
      "company_name": "Optix Post Production GmbH",
      "company_seat": "Hamburg",
      "details": "12.09.2025 (Bekanntmachungsdatum)\n\nHamburg Amtsgericht Hamburg HRB 85563\nRegisterbekanntmachung nach dem Umwandlungsgesetz 12.09.2025 (Eintragungsdatum)\n\nOptix Post Production GmbH\nGesellschaft mit beschränkter Haftung\nHamburg\n\nAls nicht eingetragen wird bekannt gemacht:\nDen Gläubigern der an der Verschmelzung beteiligten Gesellschaften ist, wenn sie binnen sechs Monaten nach dem Tag, an dem die Eintragung der Verschmelzung in das Register des Sitzes desjenigen Rechtsträgers, dessen Gläubiger sie sind, nach § 19 Absatz 3 UmwG als bekannt gemacht gilt, ihren Anspruch nach Grund und Höhe schriftlich anmelden, Sicherheit zu leisten, soweit sie nicht Befriedigung verlangen können. Dieses Recht steht den Gläubigern jedoch nur zu, wenn sie glaubhaft machen, dass durch die Verschmelzung die Erfüllung ihrer Forderung gefährdet wird."
    },
    {
      "date": "2025-09-12",
      "id": "129074",
      "original_text": "Registerbekanntmachung nach dem Umwandlungsgesetz\nHamburg Amtsgericht Hamburg HRB 155204\nFJUL GmbH – Hamburg",
      "type": "Registerbekanntmachung nach dem Umwandlungsgesetz",
      "state": "Hamburg",
      "amtsgericht": "Amtsgericht Hamburg",
      "registernummer": "HRB 155204",
      "registerart": "HRB",
      "company_name": "FJUL GmbH",
      "company_seat": "Hamburg",
      "details": "12.09.2025 (Bekanntmachungsdatum)\n\nHamburg Amtsgericht Hamburg HRB 155204\nRegisterbekanntmachung nach dem Umwandlungsgesetz 12.09.2025 (Eintragungsdatum)\n\nFJUL GmbH\nGesellschaft mit beschränkter Haftung\nHamburg\n\nAls nicht eingetragen wird bekannt gemacht:\nDen Gläubigern der an der Verschmelzung beteiligten Gesellschaften ist, wenn sie binnen sechs Monaten nach dem Tag, an dem die Eintragung der Verschmelzung in das Register des Sitzes desjenigen Rechtsträgers, dessen Gläubiger sie sind, nach § 19 Absatz 3 UmwG als bekannt gemacht gilt, ihren Anspruch nach Grund und Höhe schriftlich anmelden, Sicherheit zu leisten, soweit sie nicht Befriedigung verlangen können. Dieses Recht steht den Gläubigern jedoch nur zu, wenn sie glaubhaft machen, dass durch die Verschmelzung die Erfüllung ihrer Forderung gefährdet wird."
    },
    {
      "date": "2025-09-12",
      "id": "129075",
      "original_text": "Registerbekanntmachung nach dem Umwandlungsgesetz\nHamburg Amtsgericht Hamburg HRB 173788\nORBYT GmbH – Hamburg",
      "type": "Registerbekanntmachung nach dem Umwandlungsgesetz",
      "state": "Hamburg",
      "amtsgericht": "Amtsgericht Hamburg",
      "registernummer": "HRB 173788",
      "registerart": "HRB",
      "company_name": "ORBYT GmbH",
      "company_seat": "Hamburg",
      "details": "12.09.2025 (Bekanntmachungsdatum)\n\nHamburg Amtsgericht Hamburg HRB 173788\nRegisterbekanntmachung nach dem Umwandlungsgesetz 12.09.2025 (Eintragungsdatum)\n\nORBYT GmbH\nGesellschaft mit beschränkter Haftung\nHamburg\n\nAls nicht eingetragen wird bekannt gemacht:\nDen Gläubigern der an der Verschmelzung beteiligten Gesellschaften ist, wenn sie binnen sechs Monaten nach dem Tag, an dem die Eintragung der Verschmelzung in das Register des Sitzes desjenigen Rechtsträgers, dessen Gläubiger sie sind, nach § 19 Absatz 3 UmwG als bekannt gemacht gilt, ihren Anspruch nach Grund und Höhe schriftlich anmelden, Sicherheit zu leisten, soweit sie nicht Befriedigung verlangen können. Dieses Recht steht den Gläubigern jedoch nur zu, wenn sie glaubhaft machen, dass durch die Verschmelzung die Erfüllung ihrer Forderung gefährdet wird."
    },
    {
      "date": "2025-09-12",
      "id": "129076",
      "original_text": "Registerbekanntmachung nach dem Umwandlungsgesetz\nHamburg Amtsgericht Hamburg HRB 155204\nFJUL GmbH – Hamburg",
      "type": "Registerbekanntmachung nach dem Umwandlungsgesetz",
      "state": "Hamburg",
      "amtsgericht": "Amtsgericht Hamburg",
      "registernummer": "HRB 155204",
      "registerart": "HRB",
      "company_name": "FJUL GmbH",
      "company_seat": "Hamburg",
      "details": "12.09.2025 (Bekanntmachungsdatum)\n\nHamburg Amtsgericht Hamburg HRB 155204\nRegisterbekanntmachung nach dem Umwandlungsgesetz 12.09.2025 (Eintragungsdatum)\n\nFJUL GmbH\nGesellschaft mit beschränkter Haftung\nHamburg\n\nAls nicht eingetragen wird bekannt gemacht:\nDen Gläubigern der an der Verschmelzung beteiligten Gesellschaften ist, wenn sie binnen sechs Monaten nach dem Tag, an dem die Eintragung der Verschmelzung in das Register des Sitzes desjenigen Rechtsträgers, dessen Gläubiger sie sind, nach § 19 Absatz 3 UmwG als bekannt gemacht gilt, ihren Anspruch nach Grund und Höhe schriftlich anmelden, Sicherheit zu leisten, soweit sie nicht Befriedigung verlangen können. Dieses Recht steht den Gläubigern jedoch nur zu, wenn sie glaubhaft machen, dass durch die Verschmelzung die Erfüllung ihrer Forderung gefährdet wird."
    },
    {
      "date": "2025-09-12",
      "id": "129077",
      "original_text": "Registerbekanntmachung nach dem Umwandlungsgesetz\nBrandenburg Amtsgericht Potsdam HRB 7436\nABE Bauprüf- und -beratungsgesellschaft mbH – Stahnsdorf",
      "type": "Registerbekanntmachung nach dem Umwandlungsgesetz",
      "state": "Brandenburg",
      "amtsgericht": "Amtsgericht Potsdam",
      "registernummer": "HRB 7436",
      "registerart": "HRB",
      "company_name": "ABE Bauprüf- und -beratungsgesellschaft mbH",
      "company_seat": "Stahnsdorf",
      "details": "12.09.2025 (Bekanntmachungsdatum)\n\nBrandenburg Amtsgericht Potsdam HRB 7436\nRegisterbekanntmachung nach dem Umwandlungsgesetz 11.09.2025 (Eintragungsdatum)\n\nABE Bauprüf- und -beratungsgesellschaft mbH\nGesellschaft mit beschränkter Haftung\nStahnsdorf\n\nZu Eintragungsnummer 11 vom 11.09.2025 wird als nicht eingetragen veröffentlicht:\nDen Gläubigern der an der Verschmelzung beteiligten Rechtsträger ist, wenn sie binnen sechs Monaten nach dem Tag, an dem die Eintragung der Verschmelzung in das Register des Sitzes desjenigen Rechtsträgers, dessen Gläubiger sie sind, als bekannt gemacht gilt, ihren Anspruch nach Grund und Höhe schriftlich anmelden, Sicherheit zu leisten, soweit sie nicht Befriedigung verlangen können. Dieses Recht steht den Gläubigern jedoch nur zu, wenn sie glaubhaft machen, dass durch die Verschmelzung die Erfüllung ihrer Forderung gefährdet wird."
    },
    {
      "date": "2025-09-12",
      "id": "129078",
      "original_text": "Löschungsankündigung\nBerlin Amtsgericht Berlin (Charlottenburg) HRB 120838\nHSC Berlin Real Estate GmbH – Berlin",
      "type": "Löschungsankündigung",
      "state": "Berlin",
      "amtsgericht": "Amtsgericht Berlin (Charlottenburg)",
      "registernummer": "HRB 120838",
      "registerart": "HRB",
      "company_name": "HSC Berlin Real Estate GmbH",
      "company_seat": "Berlin",
      "details": "12.09.2025 (Bekanntmachungsdatum)\n\nBerlin Amtsgericht Berlin (Charlottenburg) HRB 120838\nLöschungsankündigung\n\nHSC Berlin Real Estate GmbH\nGesellschaft mit beschränkter Haftung\nBerlin\n\nBei der nachstehenden Gesellschaft wird das Amtslöschungsverfahren gemäß § 394 FamFG eingeleitet. Widerspruchsfrist 6 Wochen"
    },
    {
      "date": "2025-09-12",
      "id": "129079",
      "original_text": "Registerbekanntmachung nach dem Umwandlungsgesetz\nBaden-Württemberg Amtsgericht Freiburg HRA 709060\nTA Stieglitz e.K. – Löffingen",
      "type": "Registerbekanntmachung nach dem Umwandlungsgesetz",
      "state": "Baden-Württemberg",
      "amtsgericht": "Amtsgericht Freiburg",
      "registernummer": "HRA 709060",
      "registerart": "HRA",
      "company_name": "TA Stieglitz e.K.",
      "company_seat": "Löffingen",
      "details": "12.09.2025 (Bekanntmachungsdatum)\n\nBaden-Württemberg Amtsgericht Freiburg HRA 709060\nRegisterbekanntmachung nach dem Umwandlungsgesetz 12.09.2025 (Eintragungsdatum)\n\nTA Stieglitz e.K.\nEinzelkaufmann / Einzelkauffrau\nLöffingen\n\nGemäß Vertrag und Beschluss vom 14.08.2025 ist das Unternehmen zur Aufnahme ausgegliedert auf die \"TradingKompass GmbH\" (Amtsgericht Hamburg, HRB 192619). Den Gläubigern der an der Ausgliederung beteiligten Rechtsträger ist, wenn sie binnen sechs Monaten nach dem Tag, an dem die Eintragung der Ausgliederung in das Register des Sitzes desjenigen Rechtsträgers, dessen Gläubiger sie sind, nach § 19 Abs. 3 UmwG als bekanntgemacht gilt, ihren Anspruch nach Grund und Höhe schriftlich anmelden, Sicherheit zu leisten, soweit sie nicht Befriedigung verlangen können. Dieses Recht steht den Gläubigern jedoch nur zu, wenn sie glaubhaft machen, dass durch die Ausgliederung die Erfüllung ihrer Forderung gefährdet wird."
    },
    {
      "date": "2025-09-12",
      "id": "129080",
      "original_text": "Einreichung neuer Dokumente\nSachsen Amtsgericht Leipzig HRB 26424\nIceFighters Leipzig GmbH – Leipzig",
      "type": "Einreichung neuer Dokumente",
      "state": "Sachsen",
      "amtsgericht": "Amtsgericht Leipzig",
      "registernummer": "HRB 26424",
      "registerart": "HRB",
      "company_name": "IceFighters Leipzig GmbH",
      "company_seat": "Leipzig",
      "details": "12.09.2025 (Bekanntmachungsdatum)\n\nSachsen Amtsgericht Leipzig HRB 26424\nEinreichung neuer Dokumente\n\nIceFighters Leipzig GmbH\nGesellschaft mit beschränkter Haftung\nLeipzig\n\nAm 04.09.2025 wurde beim Handelsregister des Amtsgerichts Leipzig die Liste der Mitglieder des Aufsichtsrats gemäß § 52 GmbHG eingereicht."
    },
    {
      "date": "2025-09-12",
      "id": "129081",
      "original_text": "Registerbekanntmachung nach dem Umwandlungsgesetz\nSachsen Amtsgericht Chemnitz HRB 37564\nBaierl Demmelhuber mdl-k GmbH – Hainichen",
      "type": "Registerbekanntmachung nach dem Umwandlungsgesetz",
      "state": "Sachsen",
      "amtsgericht": "Amtsgericht Chemnitz",
      "registernummer": "HRB 37564",
      "registerart": "HRB",
      "company_name": "Baierl Demmelhuber mdl-k GmbH",
      "company_seat": "Hainichen",
      "details": "12.09.2025 (Bekanntmachungsdatum)\n\nSachsen Amtsgericht Chemnitz HRB 37564\nRegisterbekanntmachung nach dem Umwandlungsgesetz 12.09.2025 (Eintragungsdatum)\n\nBaierl Demmelhuber mdl-k GmbH\nGesellschaft mit beschränkter Haftung\nHainichen\n\nDen Gläubigern der an der Verschmelzung beteiligten Rechtsträger ist, wenn sie binnen sechs Monaten nach dem Tag, an dem die Eintragung der Verschmelzung in das Register des Sitzes desjenigen Rechtsträgers, dessen Gläubiger sie sind, nach § 19 Abs. 3 UmwG als bekannt gemacht gilt, ihren Anspruch nach Grund und Höhe in Textform anmelden, Sicherheit zu leisten, soweit sie nicht Befriedigung verlangen können. Dieses Recht steht den Gläubigern jedoch nur zu, wenn sie glaubhaft machen, dass durch die Verschmelzung die Erfüllung der Forderung gefährdet wird."
    },
    {
      "date": "2025-09-12",
      "id": "129082",
      "original_text": "Registerbekanntmachung nach dem Umwandlungsgesetz\nSachsen Amtsgericht Chemnitz HRB 30136\nB+D Montage Verwaltungs GmbH – Hainichen",
      "type": "Registerbekanntmachung nach dem Umwandlungsgesetz",
      "state": "Sachsen",
      "amtsgericht": "Amtsgericht Chemnitz",
      "registernummer": "HRB 30136",
      "registerart": "HRB",
      "company_name": "B+D Montage Verwaltungs GmbH",
      "company_seat": "Hainichen",
      "details": "12.09.2025 (Bekanntmachungsdatum)\n\nSachsen Amtsgericht Chemnitz HRB 30136\nRegisterbekanntmachung nach dem Umwandlungsgesetz 12.09.2025 (Eintragungsdatum)\n\nB+D Montage Verwaltungs GmbH\nGesellschaft mit beschränkter Haftung\nHainichen\n\nDen Gläubigern der an der Verschmelzung beteiligten Rechtsträger ist, wenn sie binnen sechs Monaten nach dem Tag, an dem die Eintragung der Verschmelzung in das Register des Sitzes desjenigen Rechtsträgers, dessen Gläubiger sie sind, nach § 19 Abs. 3 UmwG als bekannt gemacht gilt, ihren Anspruch nach Grund und Höhe in Textform anmelden, Sicherheit zu leisten, soweit sie nicht Befriedigung verlangen können. Dieses Recht steht den Gläubigern jedoch nur zu, wenn sie glaubhaft machen, dass durch die Verschmelzung die Erfüllung der Forderung gefährdet wird."
    },
    {
      "date": "2025-09-12",
      "id": "129083",
      "original_text": "Einreichung neuer Dokumente\nSachsen Amtsgericht Leipzig HRB 17157\nget AG – Leipzig",
      "type": "Einreichung neuer Dokumente",
      "state": "Sachsen",
      "amtsgericht": "Amtsgericht Leipzig",
      "registernummer": "HRB 17157",
      "registerart": "HRB",
      "company_name": "get AG",
      "company_seat": "Leipzig",
      "details": "12.09.2025 (Bekanntmachungsdatum)\n\nSachsen Amtsgericht Leipzig HRB 17157\nEinreichung neuer Dokumente\n\nget AG\nAktiengesellschaft\nLeipzig\n\nAm 20.08.2025 wurde beim Handelsregister des Amtsgerichts Leipzig die Liste der Mitglieder des Aufsichtsrats gemäß § 106 AktG eingereicht."
    },
    {
      "date": "2025-09-12",
      "id": "129084",
      "original_text": "Registerbekanntmachung nach dem Umwandlungsgesetz\nSachsen Amtsgericht Dresden HRA 7072\nDritte IDEAL Immobilien GmbH & Co. KG – Dresden",
      "type": "Registerbekanntmachung nach dem Umwandlungsgesetz",
      "state": "Sachsen",
      "amtsgericht": "Amtsgericht Dresden",
      "registernummer": "HRA 7072",
      "registerart": "HRA",
      "company_name": "Dritte IDEAL Immobilien GmbH & Co. KG",
      "company_seat": "Dresden",
      "details": "12.09.2025 (Bekanntmachungsdatum)\n\nSachsen Amtsgericht Dresden HRA 7072\nRegisterbekanntmachung nach dem Umwandlungsgesetz 12.09.2025 (Eintragungsdatum)\n\nDritte IDEAL Immobilien GmbH & Co. KG\nKommanditgesellschaft\nDresden\n\nDen Gläubigern der an der Verschmelzung beteiligten Rechtsträger ist, wenn sie binnen sechs Monaten nach dem Tag, an dem die Eintragung der Verschmelzung in das Register des Sitzes desjenigen Rechtsträgers, dessen Gläubiger sie sind, nach § 19 Abs. 3 UmwG als bekannt gemacht gilt, ihren Anspruch nach Grund und Höhe in Textform anmelden, Sicherheit zu leisten, soweit sie nicht Befriedigung verlangen können. Dieses Recht steht den Gläubigern jedoch nur zu, wenn sie glaubhaft machen, dass durch die Verschmelzung die Erfüllung der Forderung gefährdet wird."
    },
    {
      "date": "2025-09-12",
      "id": "129085",
      "original_text": "Registerbekanntmachung nach dem Umwandlungsgesetz\nSachsen Amtsgericht Dresden HRA 7334\nVierte IDEAL Immobilien GmbH & Co. KG – Dresden",
      "type": "Registerbekanntmachung nach dem Umwandlungsgesetz",
      "state": "Sachsen",
      "amtsgericht": "Amtsgericht Dresden",
      "registernummer": "HRA 7334",
      "registerart": "HRA",
      "company_name": "Vierte IDEAL Immobilien GmbH & Co. KG",
      "company_seat": "Dresden",
      "details": "12.09.2025 (Bekanntmachungsdatum)\n\nSachsen Amtsgericht Dresden HRA 7334\nRegisterbekanntmachung nach dem Umwandlungsgesetz 12.09.2025 (Eintragungsdatum)\n\nVierte IDEAL Immobilien GmbH & Co. KG\nKommanditgesellschaft\nDresden\n\nDen Gläubigern der an der Verschmelzung beteiligten Rechtsträger ist, wenn sie binnen sechs Monaten nach dem Tag, an dem die Eintragung der Verschmelzung in das Register des Sitzes desjenigen Rechtsträgers, dessen Gläubiger sie sind, nach § 19 Abs. 3 UmwG als bekannt gemacht gilt, ihren Anspruch nach Grund und Höhe in Textform anmelden, Sicherheit zu leisten, soweit sie nicht Befriedigung verlangen können. Dieses Recht steht den Gläubigern jedoch nur zu, wenn sie glaubhaft machen, dass durch die Verschmelzung die Erfüllung der Forderung gefährdet wird."
    },
    {
      "date": "2025-09-12",
      "id": "129086",
      "original_text": "Registerbekanntmachung nach dem Umwandlungsgesetz\nSachsen Amtsgericht Dresden HRA 7670\nFünfte IDEAL Immobilien GmbH & Co. KG – Dresden",
      "type": "Registerbekanntmachung nach dem Umwandlungsgesetz",
      "state": "Sachsen",
      "amtsgericht": "Amtsgericht Dresden",
      "registernummer": "HRA 7670",
      "registerart": "HRA",
      "company_name": "Fünfte IDEAL Immobilien GmbH & Co. KG",
      "company_seat": "Dresden",
      "details": "12.09.2025 (Bekanntmachungsdatum)\n\nSachsen Amtsgericht Dresden HRA 7670\nRegisterbekanntmachung nach dem Umwandlungsgesetz 12.09.2025 (Eintragungsdatum)\n\nFünfte IDEAL Immobilien GmbH & Co. KG\nKommanditgesellschaft\nDresden\n\nDen Gläubigern der an der Verschmelzung beteiligten Rechtsträger ist, wenn sie binnen sechs Monaten nach dem Tag, an dem die Eintragung der Verschmelzung in das Register des Sitzes desjenigen Rechtsträgers, dessen Gläubiger sie sind, nach § 19 Abs. 3 UmwG als bekannt gemacht gilt, ihren Anspruch nach Grund und Höhe in Textform anmelden, Sicherheit zu leisten, soweit sie nicht Befriedigung verlangen können. Dieses Recht steht den Gläubigern jedoch nur zu, wenn sie glaubhaft machen, dass durch die Verschmelzung die Erfüllung der Forderung gefährdet wird."
    },
    {
      "date": "2025-09-12",
      "id": "129087",
      "original_text": "Registerbekanntmachung nach dem Umwandlungsgesetz\nSachsen Amtsgericht Dresden HRA 7071\nZweite IDEAL Immobilien GmbH & Co. KG – Dresden",
      "type": "Registerbekanntmachung nach dem Umwandlungsgesetz",
      "state": "Sachsen",
      "amtsgericht": "Amtsgericht Dresden",
      "registernummer": "HRA 7071",
      "registerart": "HRA",
      "company_name": "Zweite IDEAL Immobilien GmbH & Co. KG",
      "company_seat": "Dresden",
      "details": "12.09.2025 (Bekanntmachungsdatum)\n\nSachsen Amtsgericht Dresden HRA 7071\nRegisterbekanntmachung nach dem Umwandlungsgesetz 12.09.2025 (Eintragungsdatum)\n\nZweite IDEAL Immobilien GmbH & Co. KG\nKommanditgesellschaft\nDresden\n\nDen Gläubigern der an der Verschmelzung beteiligten Rechtsträger ist, wenn sie binnen sechs Monaten nach dem Tag, an dem die Eintragung der Verschmelzung in das Register des Sitzes desjenigen Rechtsträgers, dessen Gläubiger sie sind, nach § 19 Abs. 3 UmwG als bekannt gemacht gilt, ihren Anspruch nach Grund und Höhe in Textform anmelden, Sicherheit zu leisten, soweit sie nicht Befriedigung verlangen können. Dieses Recht steht den Gläubigern jedoch nur zu, wenn sie glaubhaft machen, dass durch die Verschmelzung die Erfüllung der Forderung gefährdet wird."
    },
    {
      "date": "2025-09-12",
      "id": "129088",
      "original_text": "Registerbekanntmachung nach dem Umwandlungsgesetz\nSachsen Amtsgericht Leipzig HRB 44368\nmyschoolcare Ost GmbH – Leipzig",
      "type": "Registerbekanntmachung nach dem Umwandlungsgesetz",
      "state": "Sachsen",
      "amtsgericht": "Amtsgericht Leipzig",
      "registernummer": "HRB 44368",
      "registerart": "HRB",
      "company_name": "myschoolcare Ost GmbH",
      "company_seat": "Leipzig",
      "details": "12.09.2025 (Bekanntmachungsdatum)\n\nSachsen Amtsgericht Leipzig HRB 44368\nRegisterbekanntmachung nach dem Umwandlungsgesetz 12.09.2025 (Eintragungsdatum)\n\nmyschoolcare Ost GmbH\nGesellschaft mit beschränkter Haftung\nLeipzig\n\nDen Gläubigern der an der Spaltung beteiligten Rechtsträger ist, wenn sie binnen sechs Monaten nach dem Tag, an dem die Eintragung der Spaltung in das Register des Sitzes desjenigen Rechtsträgers, dessen Gläubiger sie sind, nach § 19 Abs. 3 UmwG als bekannt gemacht gilt, ihren Anspruch nach Grund und Höhe in Textform anmelden, Sicherheit zu leisten, soweit sie nicht Befriedigung verlangen können. Dieses Recht steht den Gläubigern jedoch nur zu, wenn sie glaubhaft machen, dass durch die Spaltung die Erfüllung der Forderung gefährdet wird."
    },
    {
      "date": "2025-09-12",
      "id": "129089",
      "original_text": "Registerbekanntmachung nach dem Umwandlungsgesetz\nNiedersachsen Amtsgericht Stadthagen HRB 2972\nG & H Grundstücks- und Hausverwaltungsgesellschaft mbH – Bückeburg",
      "type": "Registerbekanntmachung nach dem Umwandlungsgesetz",
      "state": "Niedersachsen",
      "amtsgericht": "Amtsgericht Stadthagen",
      "registernummer": "HRB 2972",
      "registerart": "HRB",
      "company_name": "G & H Grundstücks- und Hausverwaltungsgesellschaft mbH",
      "company_seat": "Bückeburg",
      "details": "12.09.2025 (Bekanntmachungsdatum)\n\nNiedersachsen Amtsgericht Stadthagen HRB 2972\nRegisterbekanntmachung nach dem Umwandlungsgesetz 04.09.2025 (Eintragungsdatum)\n\nG & H Grundstücks- und Hausverwaltungsgesellschaft mbH\nGesellschaft mit beschränkter Haftung\nBückeburg\n\nDen Gläubigern der an der Verschmelzung beteiligten Rechtsträger ist, wenn sie binnen sechs Monaten nach dem Tag, an dem die Eintragung der Verschmelzung in das Register des Sitzes desjenigen Rechtsträgers, dessen Gläubiger sie sind, nach § 19  Abs.  3 UmwG als bekannt gemacht gilt, ihren Anspruch nach Grund und Höhe schriftlich anmelden, Sicherheit zu leisten, soweit sie nicht Befriedigung verlangen können. Dieses Recht steht den Gläubigern jedoch nur zu, wenn sie glaubhaft machen, dass durch die Verschmelzung die Erfüllung der Forderung gefährdet wird."
    },
    {
      "date": "2025-09-12",
      "id": "129090",
      "original_text": "Registerbekanntmachung nach dem Umwandlungsgesetz\nNiedersachsen Amtsgericht Hannover HRB 213117\nSchnelle Beteiligungs GmbH – Bad Münder",
      "type": "Registerbekanntmachung nach dem Umwandlungsgesetz",
      "state": "Niedersachsen",
      "amtsgericht": "Amtsgericht Hannover",
      "registernummer": "HRB 213117",
      "registerart": "HRB",
      "company_name": "Schnelle Beteiligungs GmbH",
      "company_seat": "Bad Münder",
      "details": "12.09.2025 (Bekanntmachungsdatum)\n\nNiedersachsen Amtsgericht Hannover HRB 213117\nRegisterbekanntmachung nach dem Umwandlungsgesetz 12.09.2025 (Eintragungsdatum)\n\nSchnelle Beteiligungs GmbH\nGesellschaft mit beschränkter Haftung\nBad Münder\n\nDen Gläubigern der an der Verschmelzung beteiligten Rechtsträger ist, wenn sie binnen sechs Monaten nach dem Tag, an dem die Eintragung der Verschmelzung in das Register des Sitzes desjenigen Rechtsträgers, dessen Gläubiger sie sind, nach § 19  Abs.  3 UmwG als bekannt gemacht gilt, ihren Anspruch nach Grund und Höhe schriftlich anmelden, Sicherheit zu leisten, soweit sie nicht Befriedigung verlangen können. Dieses Recht steht den Gläubigern jedoch nur zu, wenn sie glaubhaft machen, dass durch die Verschmelzung die Erfüllung der Forderung gefährdet wird."
    },
    {
      "date": "2025-09-12",
      "id": "129091",
      "original_text": "Registerbekanntmachung nach dem Umwandlungsgesetz\nNiedersachsen Amtsgericht Göttingen HRB 4199\nHenze Beteiligungs-GmbH – Hörden",
      "type": "Registerbekanntmachung nach dem Umwandlungsgesetz",
      "state": "Niedersachsen",
      "amtsgericht": "Amtsgericht Göttingen",
      "registernummer": "HRB 4199",
      "registerart": "HRB",
      "company_name": "Henze Beteiligungs-GmbH",
      "company_seat": "Hörden",
      "details": "12.09.2025 (Bekanntmachungsdatum)\n\nNiedersachsen Amtsgericht Göttingen HRB 4199\nRegisterbekanntmachung nach dem Umwandlungsgesetz 12.09.2025 (Eintragungsdatum)\n\nHenze Beteiligungs-GmbH\nGesellschaft mit beschränkter Haftung\nHörden\n\nDen Gläubigern der an der Verschmelzung beteiligten Rechtsträger ist, wenn sie binnen sechs Monaten nach dem Tag, an dem die Eintragung der Verschmelzung in das Register des Sitzes desjenigen Rechtsträgers, dessen Gläubiger sie sind, nach § 19  Abs.  3 UmwG als bekannt gemacht gilt, ihren Anspruch nach Grund und Höhe schriftlich anmelden, Sicherheit zu leisten, soweit sie nicht Befriedigung verlangen können. Dieses Recht steht den Gläubigern jedoch nur zu, wenn sie glaubhaft machen, dass durch die Verschmelzung die Erfüllung der Forderung gefährdet wird."
    },
    {
      "date": "2025-09-12",
      "id": "129092",
      "original_text": "Registerbekanntmachung nach dem Umwandlungsgesetz\nNiedersachsen Amtsgericht Osnabrück HRB 206692\nBerentzen North America GmbH – Haselünne",
      "type": "Registerbekanntmachung nach dem Umwandlungsgesetz",
      "state": "Niedersachsen",
      "amtsgericht": "Amtsgericht Osnabrück",
      "registernummer": "HRB 206692",
      "registerart": "HRB",
      "company_name": "Berentzen North America GmbH",
      "company_seat": "Haselünne",
      "details": "12.09.2025 (Bekanntmachungsdatum)\n\nNiedersachsen Amtsgericht Osnabrück HRB 206692\nRegisterbekanntmachung nach dem Umwandlungsgesetz 12.09.2025 (Eintragungsdatum)\n\nBerentzen North America GmbH\nGesellschaft mit beschränkter Haftung\nHaselünne\n\nDen Gläubigern der an der Verschmelzung beteiligten Rechtsträger ist, wenn sie binnen sechs Monaten nach dem Tag, an dem die Eintragung der Verschmelzung in das Register des Sitzes desjenigen Rechtsträgers, dessen Gläubiger sie sind, nach § 19  Abs.  3 UmwG als bekannt gemacht gilt, ihren Anspruch nach Grund und Höhe schriftlich anmelden, Sicherheit zu leisten, soweit sie nicht Befriedigung verlangen können. Dieses Recht steht den Gläubigern jedoch nur zu, wenn sie glaubhaft machen, dass durch die Verschmelzung die Erfüllung der Forderung gefährdet wird."
    },
    {
      "date": "2025-09-12",
      "id": "129093",
      "original_text": "Registerbekanntmachung nach dem Umwandlungsgesetz\nNiedersachsen Amtsgericht Osnabrück HRB 120762 früher Amtsgericht Meppen\nStrothmann Spirituosen Verwaltung GmbH – Haselünne",
      "type": "Registerbekanntmachung nach dem Umwandlungsgesetz",
      "state": "Niedersachsen",
      "amtsgericht": "Amtsgericht Osnabrück",
      "registernummer": "HRB 120762",
      "registerart": "HRB",
      "company_name": "Strothmann Spirituosen Verwaltung GmbH",
      "company_seat": "Haselünne",
      "former_amtsgericht": "Meppen",
      "details": "12.09.2025 (Bekanntmachungsdatum)\n\nNiedersachsen Amtsgericht Osnabrück HRB 120762 früher Amtsgericht Meppen\nRegisterbekanntmachung nach dem Umwandlungsgesetz 12.09.2025 (Eintragungsdatum)\n\nStrothmann Spirituosen Verwaltung GmbH\nGesellschaft mit beschränkter Haftung\nHaselünne\n\nDen Gläubigern der an der Verschmelzung beteiligten Rechtsträger ist, wenn sie binnen sechs Monaten nach dem Tag, an dem die Eintragung der Verschmelzung in das Register des Sitzes desjenigen Rechtsträgers, dessen Gläubiger sie sind, nach § 19  Abs.  3 UmwG als bekannt gemacht gilt, ihren Anspruch nach Grund und Höhe schriftlich anmelden, Sicherheit zu leisten, soweit sie nicht Befriedigung verlangen können. Dieses Recht steht den Gläubigern jedoch nur zu, wenn sie glaubhaft machen, dass durch die Verschmelzung die Erfüllung der Forderung gefährdet wird."
    },
    {
      "date": "2025-09-12",
      "id": "129094",
      "original_text": "Registerbekanntmachung nach dem Umwandlungsgesetz\nNiedersachsen Amtsgericht Aurich HRA 204278\nAJ Anlagenvermietung GmbH & Co. KG – Rechtsupweg",
      "type": "Registerbekanntmachung nach dem Umwandlungsgesetz",
      "state": "Niedersachsen",
      "amtsgericht": "Amtsgericht Aurich",
      "registernummer": "HRA 204278",
      "registerart": "HRA",
      "company_name": "AJ Anlagenvermietung GmbH & Co. KG",
      "company_seat": "Rechtsupweg",
      "details": "12.09.2025 (Bekanntmachungsdatum)\n\nNiedersachsen Amtsgericht Aurich HRA 204278\nRegisterbekanntmachung nach dem Umwandlungsgesetz 12.09.2025 (Eintragungsdatum)\n\nAJ Anlagenvermietung GmbH & Co. KG\nKommanditgesellschaft\nRechtsupweg\n\nDen Gläubigern der an der Ausgliederung beteiligten Rechtsträger ist, wenn sie binnen sechs Monaten nach dem Tag, an dem die Eintragung der Ausgliederung in das Register des Sitzes desjenigen Rechtsträgers, dessen Gläubiger sie sind, nach § 19 Abs. 3 UmwG als bekannt gemacht gilt, ihren Anspruch nach Grund und Höhe schriftlich anmelden, Sicherheit zu leisten, soweit sie nicht Befriedigung verlangen können. Dieses Recht steht den Gläubigern jedoch nur zu, wenn sie glaubhaft machen, dass durch die Ausgliederung die Erfüllung der Forderung gefährdet wird."
    },
    {
      "date": "2025-09-12",
      "id": "129095",
      "original_text": "Registerbekanntmachung nach dem Umwandlungsgesetz\nNiedersachsen Amtsgericht Aurich HRA 204271\nAlwin Janssen Lohnunternehmen und Maschinenvermietung e.K. – Rechtsupweg",
      "type": "Registerbekanntmachung nach dem Umwandlungsgesetz",
      "state": "Niedersachsen",
      "amtsgericht": "Amtsgericht Aurich",
      "registernummer": "HRA 204271",
      "registerart": "HRA",
      "company_name": "Alwin Janssen Lohnunternehmen und Maschinenvermietung e.K.",
      "company_seat": "Rechtsupweg",
      "details": "12.09.2025 (Bekanntmachungsdatum)\n\nNiedersachsen Amtsgericht Aurich HRA 204271\nRegisterbekanntmachung nach dem Umwandlungsgesetz 12.09.2025 (Eintragungsdatum)\n\nAlwin Janssen Lohnunternehmen und Maschinenvermietung e.K.\nEinzelkaufmann / Einzelkauffrau\nRechtsupweg\n\nDen Gläubigern der an der Ausgliederung beteiligten Rechtsträger ist, wenn sie binnen sechs Monaten nach dem Tag, an dem die Eintragung der Ausgliederung in das Register des Sitzes desjenigen Rechtsträgers, dessen Gläubiger sie sind, nach § 19 Abs. 3 UmwG als bekannt gemacht gilt, ihren Anspruch nach Grund und Höhe schriftlich anmelden, Sicherheit zu leisten, soweit sie nicht Befriedigung verlangen können. Dieses Recht steht den Gläubigern jedoch nur zu, wenn sie glaubhaft machen, dass durch die Ausgliederung die Erfüllung der Forderung gefährdet wird."
    },
    {
      "date": "2025-09-12",
      "id": "129096",
      "original_text": "Registerbekanntmachung nach dem Umwandlungsgesetz\nNiedersachsen Amtsgericht Hildesheim HRA 203155\nLücke GmbH & Co. KG – Hehlen",
      "type": "Registerbekanntmachung nach dem Umwandlungsgesetz",
      "state": "Niedersachsen",
      "amtsgericht": "Amtsgericht Hildesheim",
      "registernummer": "HRA 203155",
      "registerart": "HRA",
      "company_name": "Lücke GmbH & Co. KG",
      "company_seat": "Hehlen",
      "details": "12.09.2025 (Bekanntmachungsdatum)\n\nNiedersachsen Amtsgericht Hildesheim HRA 203155\nRegisterbekanntmachung nach dem Umwandlungsgesetz 12.09.2025 (Eintragungsdatum)\n\nLücke GmbH & Co. KG\nKommanditgesellschaft\nHehlen\n\nDen Gläubigern der an der Ausgliederung beteiligten Rechtsträger ist, wenn sie binnen sechs Monaten nach dem Tag, an dem die Eintragung der Ausgliederung in das Register des Sitzes desjenigen Rechtsträgers, dessen Gläubiger sie sind, nach § 19 Abs. 3 UmwG als bekannt gemacht gilt, ihren Anspruch nach Grund und Höhe schriftlich anmelden, Sicherheit zu leisten, soweit sie nicht Befriedigung verlangen können. Dieses Recht steht den Gläubigern jedoch nur zu, wenn sie glaubhaft machen, dass durch die Ausgliederung die Erfüllung der Forderung gefährdet wird."
    },
    {
      "date": "2025-09-12",
      "id": "129097",
      "original_text": "Registerbekanntmachung nach dem Umwandlungsgesetz\nNiedersachsen Amtsgericht Hildesheim HRA 203144\nAnnett Lücke Verpachtung Betriebsgebäude e. K. – Hehlen OT Brökeln",
      "type": "Registerbekanntmachung nach dem Umwandlungsgesetz",
      "state": "Niedersachsen",
      "amtsgericht": "Amtsgericht Hildesheim",
      "registernummer": "HRA 203144",
      "registerart": "HRA",
      "company_name": "Annett Lücke Verpachtung Betriebsgebäude e. K.",
      "company_seat": "Hehlen OT Brökeln",
      "details": "12.09.2025 (Bekanntmachungsdatum)\n\nNiedersachsen Amtsgericht Hildesheim HRA 203144\nRegisterbekanntmachung nach dem Umwandlungsgesetz 12.09.2025 (Eintragungsdatum)\n\nAnnett Lücke Verpachtung Betriebsgebäude e. K.\nEinzelkaufmann / Einzelkauffrau\nHehlen OT Brökeln\n\nDen Gläubigern der an der Ausgliederung beteiligten Rechtsträger ist, wenn sie binnen sechs Monaten nach dem Tag, an dem die Eintragung der Ausgliederung in das Register des Sitzes desjenigen Rechtsträgers, dessen Gläubiger sie sind, nach § 19 Abs. 3 UmwG als bekannt gemacht gilt, ihren Anspruch nach Grund und Höhe schriftlich anmelden, Sicherheit zu leisten, soweit sie nicht Befriedigung verlangen können. Dieses Recht steht den Gläubigern jedoch nur zu, wenn sie glaubhaft machen, dass durch die Ausgliederung die Erfüllung der Forderung gefährdet wird."
    },
    {
      "date": "2025-09-12",
      "id": "129098",
      "original_text": "Sonstige Registerbekanntmachung\nNiedersachsen Amtsgericht Hannover HRB 101998 früher Amtsgericht Hameln\nWeserbergland Aktiengesellschaft – Hameln",
      "type": "Sonstige Registerbekanntmachung",
      "state": "Niedersachsen",
      "amtsgericht": "Amtsgericht Hannover",
      "registernummer": "HRB 101998",
      "registerart": "HRB",
      "company_name": "Weserbergland Aktiengesellschaft",
      "company_seat": "Hameln",
      "former_amtsgericht": "Hameln",
      "details": "12.09.2025 (Bekanntmachungsdatum)\n\nNiedersachsen Amtsgericht Hannover HRB 101998 früher Amtsgericht Hameln\nSonstige Registerbekanntmachung\n\nWeserbergland Aktiengesellschaft\nAktiengesellschaft\nHameln\n\nDie Liste der Mitglieder des Aufsichtsrats wurde beim Registergericht eingereicht."
    },
    {
      "date": "2025-09-12",
      "id": "129099",
      "original_text": "Registerbekanntmachung nach dem Umwandlungsgesetz\nNiedersachsen Amtsgericht Hannover HRB 100761 früher Amtsgericht Hameln\nSchnelle Geschäftsführungs GmbH – Bad Münder",
      "type": "Registerbekanntmachung nach dem Umwandlungsgesetz",
      "state": "Niedersachsen",
      "amtsgericht": "Amtsgericht Hannover",
      "registernummer": "HRB 100761",
      "registerart": "HRB",
      "company_name": "Schnelle Geschäftsführungs GmbH",
      "company_seat": "Bad Münder",
      "former_amtsgericht": "Hameln",
      "details": "12.09.2025 (Bekanntmachungsdatum)\n\nNiedersachsen Amtsgericht Hannover HRB 100761 früher Amtsgericht Hameln\nRegisterbekanntmachung nach dem Umwandlungsgesetz 12.09.2025 (Eintragungsdatum)\n\nSchnelle Geschäftsführungs GmbH\nGesellschaft mit beschränkter Haftung\nBad Münder\n\nDen Gläubigern der an der Verschmelzung beteiligten Rechtsträger ist, wenn sie binnen sechs Monaten nach dem Tag, an dem die Eintragung der Verschmelzung in das Register des Sitzes desjenigen Rechtsträgers, dessen Gläubiger sie sind, nach § 19  Abs.  3 UmwG als bekannt gemacht gilt, ihren Anspruch nach Grund und Höhe schriftlich anmelden, Sicherheit zu leisten, soweit sie nicht Befriedigung verlangen können. Dieses Recht steht den Gläubigern jedoch nur zu, wenn sie glaubhaft machen, dass durch die Verschmelzung die Erfüllung der Forderung gefährdet wird."
    },
    {
      "date": "2025-09-12",
      "id": "129100",
      "original_text": "Registerbekanntmachung nach dem Umwandlungsgesetz\nNiedersachsen Amtsgericht Hannover HRB 100769 früher Amtsgericht Hameln\nH & S Logistik GmbH – Bad Münder",
      "type": "Registerbekanntmachung nach dem Umwandlungsgesetz",
      "state": "Niedersachsen",
      "amtsgericht": "Amtsgericht Hannover",
      "registernummer": "HRB 100769",
      "registerart": "HRB",
      "company_name": "H & S Logistik GmbH",
      "company_seat": "Bad Münder",
      "former_amtsgericht": "Hameln",
      "details": "12.09.2025 (Bekanntmachungsdatum)\n\nNiedersachsen Amtsgericht Hannover HRB 100769 früher Amtsgericht Hameln\nRegisterbekanntmachung nach dem Umwandlungsgesetz 12.09.2025 (Eintragungsdatum)\n\nH & S Logistik GmbH\nGesellschaft mit beschränkter Haftung\nBad Münder\n\nDen Gläubigern der an der Verschmelzung beteiligten Rechtsträger ist, wenn sie binnen sechs Monaten nach dem Tag, an dem die Eintragung der Verschmelzung in das Register des Sitzes desjenigen Rechtsträgers, dessen Gläubiger sie sind, nach § 19  Abs.  3 UmwG als bekannt gemacht gilt, ihren Anspruch nach Grund und Höhe schriftlich anmelden, Sicherheit zu leisten, soweit sie nicht Befriedigung verlangen können. Dieses Recht steht den Gläubigern jedoch nur zu, wenn sie glaubhaft machen, dass durch die Verschmelzung die Erfüllung der Forderung gefährdet wird."
    },
    {
      "date": "2025-09-12",
      "id": "129101",
      "original_text": "Löschungsankündigung\nNiedersachsen Amtsgericht Lüneburg HRB 208834\nRBM Logistics & Services GmbH – Seevetal",
      "type": "Löschungsankündigung",
      "state": "Niedersachsen",
      "amtsgericht": "Amtsgericht Lüneburg",
      "registernummer": "HRB 208834",
      "registerart": "HRB",
      "company_name": "RBM Logistics & Services GmbH",
      "company_seat": "Seevetal",
      "details": "12.09.2025 (Bekanntmachungsdatum)\n\nNiedersachsen Amtsgericht Lüneburg HRB 208834\nLöschungsankündigung\n\nRBM Logistics & Services GmbH\nGesellschaft mit beschränkter Haftung\nSeevetal\n\nDas Registergericht beabsichtigt, die Gesellschaft von Amts wegen nach § 394 FamFG zu löschen. Die Frist zur Erhebung eines Widerspruchs ist auf 1 Monat ab dieser Registerbekanntmachung festgesetzt."
    },
    {
      "date": "2025-09-12",
      "id": "129102",
      "original_text": "Einreichung neuer Dokumente\nNiedersachsen Amtsgericht Göttingen HRB 204484\nKreisvolkshochschule Südniedersachsen gGmbH – Göttingen",
      "type": "Einreichung neuer Dokumente",
      "state": "Niedersachsen",
      "amtsgericht": "Amtsgericht Göttingen",
      "registernummer": "HRB 204484",
      "registerart": "HRB",
      "company_name": "Kreisvolkshochschule Südniedersachsen gGmbH",
      "company_seat": "Göttingen",
      "details": "12.09.2025 (Bekanntmachungsdatum)\n\nNiedersachsen Amtsgericht Göttingen HRB 204484\nEinreichung neuer Dokumente\n\nKreisvolkshochschule Südniedersachsen gGmbH\nGesellschaft mit beschränkter Haftung\nGöttingen\n\nDie Liste der Mitglieder des Aufsichtsrats wurde beim Registergericht eingereicht."
    },
    {
      "date": "2025-09-12",
      "id": "129103",
      "original_text": "Registerbekanntmachung nach dem Umwandlungsgesetz\nNiedersachsen Amtsgericht Hildesheim HRB 100860 früher Amtsgericht Gifhorn\nFerdinand Möllring GmbH – Peine",
      "type": "Registerbekanntmachung nach dem Umwandlungsgesetz",
      "state": "Niedersachsen",
      "amtsgericht": "Amtsgericht Hildesheim",
      "registernummer": "HRB 100860",
      "registerart": "HRB",
      "company_name": "Ferdinand Möllring GmbH",
      "company_seat": "Peine",
      "former_amtsgericht": "Gifhorn",
      "details": "12.09.2025 (Bekanntmachungsdatum)\n\nNiedersachsen Amtsgericht Hildesheim HRB 100860 früher Amtsgericht Gifhorn\nRegisterbekanntmachung nach dem Umwandlungsgesetz 12.09.2025 (Eintragungsdatum)\n\nFerdinand Möllring GmbH\nGesellschaft mit beschränkter Haftung\nPeine\n\nDen Gläubigern der an der Verschmelzung beteiligten Rechtsträger ist, wenn sie binnen sechs Monaten nach dem Tag, an dem die Eintragung der Verschmelzung in das Register des Sitzes desjenigen Rechtsträgers, dessen Gläubiger sie sind, nach § 19  Abs.  3 UmwG als bekannt gemacht gilt, ihren Anspruch nach Grund und Höhe schriftlich anmelden, Sicherheit zu leisten, soweit sie nicht Befriedigung verlangen können. Dieses Recht steht den Gläubigern jedoch nur zu, wenn sie glaubhaft machen, dass durch die Verschmelzung die Erfüllung der Forderung gefährdet wird."
    },
    {
      "date": "2025-09-12",
      "id": "129104",
      "original_text": "Löschungsankündigung\nNiedersachsen Amtsgericht Osnabrück HRA 120693 früher Amtsgericht Meppen\nMS \"Rosa\" Schiffahrtsgesellschaft mbH & Co. Reederei KG – Haren (Ems)",
      "type": "Löschungsankündigung",
      "state": "Niedersachsen",
      "amtsgericht": "Amtsgericht Osnabrück",
      "registernummer": "HRA 120693",
      "registerart": "HRA",
      "company_name": "MS \"Rosa\" Schiffahrtsgesellschaft mbH & Co. Reederei KG",
      "company_seat": "Haren (Ems)",
      "former_amtsgericht": "Meppen",
      "details": "12.09.2025 (Bekanntmachungsdatum)\n\nNiedersachsen Amtsgericht Osnabrück HRA 120693 früher Amtsgericht Meppen\nLöschungsankündigung\n\nMS \"Rosa\" Schiffahrtsgesellschaft mbH & Co. Reederei KG\nKommanditgesellschaft\nHaren (Ems)\n\nDas Registergericht beabsichtigt, die Firma von Amts wegen wegen Vermögenslosigkeit nach § 394 FamFG zu löschen. Die Frist zur Erhebung eines Widerspruchs ist auf 1 Monat ab dieser Registerbekanntmachung festgesetzt."
    },
    {
      "date": "2025-09-12",
      "id": "129105",
      "original_text": "Registerbekanntmachung nach dem Umwandlungsgesetz\nNiedersachsen Amtsgericht Stadthagen HRB 201868\nImmoWerk Schaumburg GmbH – Auetal",
      "type": "Registerbekanntmachung nach dem Umwandlungsgesetz",
      "state": "Niedersachsen",
      "amtsgericht": "Amtsgericht Stadthagen",
      "registernummer": "HRB 201868",
      "registerart": "HRB",
      "company_name": "ImmoWerk Schaumburg GmbH",
      "company_seat": "Auetal",
      "details": "12.09.2025 (Bekanntmachungsdatum)\n\nNiedersachsen Amtsgericht Stadthagen HRB 201868\nRegisterbekanntmachung nach dem Umwandlungsgesetz 05.09.2025 (Eintragungsdatum)\n\nImmoWerk Schaumburg GmbH\nGesellschaft mit beschränkter Haftung\nAuetal\n\nDen Gläubigern der an der Verschmelzung beteiligten Rechtsträger ist, wenn sie binnen sechs Monaten nach dem Tag, an dem die Eintragung der Verschmelzung in das Register des Sitzes desjenigen Rechtsträgers, dessen Gläubiger sie sind, nach § 19  Abs.  3 UmwG als bekannt gemacht gilt, ihren Anspruch nach Grund und Höhe schriftlich anmelden, Sicherheit zu leisten, soweit sie nicht Befriedigung verlangen können. Dieses Recht steht den Gläubigern jedoch nur zu, wenn sie glaubhaft machen, dass durch die Verschmelzung die Erfüllung der Forderung gefährdet wird."
    },
    {
      "date": "2025-09-12",
      "id": "129106",
      "original_text": "Registerbekanntmachung nach dem Umwandlungsgesetz\nNiedersachsen Amtsgericht Osnabrück HRB 205480\nBerentzen Distillers Turkey GmbH – Haselünne",
      "type": "Registerbekanntmachung nach dem Umwandlungsgesetz",
      "state": "Niedersachsen",
      "amtsgericht": "Amtsgericht Osnabrück",
      "registernummer": "HRB 205480",
      "registerart": "HRB",
      "company_name": "Berentzen Distillers Turkey GmbH",
      "company_seat": "Haselünne",
      "details": "12.09.2025 (Bekanntmachungsdatum)\n\nNiedersachsen Amtsgericht Osnabrück HRB 205480\nRegisterbekanntmachung nach dem Umwandlungsgesetz 12.09.2025 (Eintragungsdatum)\n\nBerentzen Distillers Turkey GmbH\nGesellschaft mit beschränkter Haftung\nHaselünne\n\nDen Gläubigern der an der Verschmelzung beteiligten Rechtsträger ist, wenn sie binnen sechs Monaten nach dem Tag, an dem die Eintragung der Verschmelzung in das Register des Sitzes desjenigen Rechtsträgers, dessen Gläubiger sie sind, nach § 19  Abs.  3 UmwG als bekannt gemacht gilt, ihren Anspruch nach Grund und Höhe schriftlich anmelden, Sicherheit zu leisten, soweit sie nicht Befriedigung verlangen können. Dieses Recht steht den Gläubigern jedoch nur zu, wenn sie glaubhaft machen, dass durch die Verschmelzung die Erfüllung der Forderung gefährdet wird."
    },
    {
      "date": "2025-09-12",
      "id": "129107",
      "original_text": "Registerbekanntmachung nach dem Umwandlungsgesetz\nNiedersachsen Amtsgericht Hildesheim HRA 200793\nJenssen UG (haftungsbeschränkt) & Co. KG – Peine",
      "type": "Registerbekanntmachung nach dem Umwandlungsgesetz",
      "state": "Niedersachsen",
      "amtsgericht": "Amtsgericht Hildesheim",
      "registernummer": "HRA 200793",
      "registerart": "HRA",
      "company_name": "Jenssen UG (haftungsbeschränkt) & Co. KG",
      "company_seat": "Peine",
      "details": "12.09.2025 (Bekanntmachungsdatum)\n\nNiedersachsen Amtsgericht Hildesheim HRA 200793\nRegisterbekanntmachung nach dem Umwandlungsgesetz 12.09.2025 (Eintragungsdatum)\n\nJenssen UG (haftungsbeschränkt) & Co. KG\nKommanditgesellschaft\nPeine\n\nDen Gläubigern der an der Verschmelzung beteiligten Rechtsträger ist, wenn sie binnen sechs Monaten nach dem Tag, an dem die Eintragung der Verschmelzung in das Register des Sitzes desjenigen Rechtsträgers, dessen Gläubiger sie sind, nach § 19  Abs.  3 UmwG als bekannt gemacht gilt, ihren Anspruch nach Grund und Höhe schriftlich anmelden, Sicherheit zu leisten, soweit sie nicht Befriedigung verlangen können. Dieses Recht steht den Gläubigern jedoch nur zu, wenn sie glaubhaft machen, dass durch die Verschmelzung die Erfüllung der Forderung gefährdet wird."
    },
    {
      "date": "2025-09-12",
      "id": "129108",
      "original_text": "Registerbekanntmachung nach dem Umwandlungsgesetz\nHamburg Amtsgericht Hamburg HRB 119684\nRun Log GmbH – Hamburg",
      "type": "Registerbekanntmachung nach dem Umwandlungsgesetz",
      "state": "Hamburg",
      "amtsgericht": "Amtsgericht Hamburg",
      "registernummer": "HRB 119684",
      "registerart": "HRB",
      "company_name": "Run Log GmbH",
      "company_seat": "Hamburg",
      "details": "12.09.2025 (Bekanntmachungsdatum)\n\nHamburg Amtsgericht Hamburg HRB 119684\nRegisterbekanntmachung nach dem Umwandlungsgesetz 12.09.2025 (Eintragungsdatum)\n\nRun Log GmbH\nGesellschaft mit beschränkter Haftung\nHamburg\n\nAls nicht eingetragen wird bekannt gemacht:\nDen Gläubigern der an der Verschmelzung beteiligten Gesellschaften ist, wenn sie binnen sechs Monaten nach dem Tag, an dem die Eintragung der Verschmelzung in das Register des Sitzes desjenigen Rechtsträgers, dessen Gläubiger sie sind, nach § 19 Absatz 3 UmwG als bekannt gemacht gilt, ihren Anspruch nach Grund und Höhe schriftlich anmelden, Sicherheit zu leisten, soweit sie nicht Befriedigung verlangen können. Dieses Recht steht den Gläubigern jedoch nur zu, wenn sie glaubhaft machen, dass durch die Verschmelzung die Erfüllung ihrer Forderung gefährdet wird."
    },
    {
      "date": "2025-09-12",
      "id": "129109",
      "original_text": "Registerbekanntmachung nach dem Umwandlungsgesetz\nBremen Amtsgericht Bremen HRB 1727 BHV\nHermann Schwerdtfeger GmbH – Bremerhaven",
      "type": "Registerbekanntmachung nach dem Umwandlungsgesetz",
      "state": "Bremen",
      "amtsgericht": "Amtsgericht Bremen",
      "registernummer": "HRB 1727 BHV",
      "registerart": "HRB",
      "company_name": "Hermann Schwerdtfeger GmbH",
      "company_seat": "Bremerhaven",
      "details": "12.09.2025 (Bekanntmachungsdatum)\n\nBremen Amtsgericht Bremen HRB 1727 BHV\nRegisterbekanntmachung nach dem Umwandlungsgesetz 11.09.2025 (Eintragungsdatum)\n\nHermann Schwerdtfeger GmbH\nGesellschaft mit beschränkter Haftung\nBremerhaven\n\nZu Eintragungsnummer 9 vom 11.09.2025 wird als nicht eingetragen veröffentlicht:  Den Gläubigern der an der Verschmelzung beteiligten Rechtsträger ist, wenn sie binnen sechs Monaten nach dem Tag, an dem die Eintragung der Verschmelzung in das Register des Sitzes desjenigen Rechtsträgers, dessen Gläubiger sie sind, als bekannt gemacht gilt, ihren Anspruch nach Grund und Höhe schriftlich anmelden, Sicherheit zu leisten, soweit sie nicht Befriedigung verlangen können. Dieses Recht steht den Gläubigern jedoch nur zu, wenn sie glaubhaft machen, dass durch die Verschmelzung die Erfüllung ihrer Forderung gefährdet wird. Das Recht, Sicherheitsleistung zu verlangen, steht Gläubigern nicht zu, die im Falle der Insolvenz ein Recht auf vorzugsweise Befriedigung aus einer Deckungsmasse haben, die nach gesetzlicher Vorschrift zu ihrem Schutz errichtet und staatlich überwacht ist."
    },
    {
      "date": "2025-09-12",
      "id": "129110",
      "original_text": "Einreichung neuer Dokumente\nBremen Amtsgericht Bremen HRB 4413\nBREMER LAGERHAUS-GESELLSCHAFT -Aktiengesellschaft von 1877- – Bremen",
      "type": "Einreichung neuer Dokumente",
      "state": "Bremen",
      "amtsgericht": "Amtsgericht Bremen",
      "registernummer": "HRB 4413",
      "registerart": "HRB",
      "company_name": "BREMER LAGERHAUS-GESELLSCHAFT -Aktiengesellschaft von 1877-",
      "company_seat": "Bremen",
      "details": "12.09.2025 (Bekanntmachungsdatum)\n\nBremen Amtsgericht Bremen HRB 4413\nEinreichung neuer Dokumente\n\nBREMER LAGERHAUS-GESELLSCHAFT -Aktiengesellschaft von 1877-\nAktiengesellschaft\nBremen\n\nAls nicht eingetragen wird veröffentlicht:  Liste des Aufsichtsrats wurde eingereicht."
    },
    {
      "date": "2025-09-12",
      "id": "129111",
      "original_text": "Registerbekanntmachung nach dem Umwandlungsgesetz\nBremen Amtsgericht Bremen HRB 3641 BHV\nJ.H.K. Management GmbH – Bremerhaven",
      "type": "Registerbekanntmachung nach dem Umwandlungsgesetz",
      "state": "Bremen",
      "amtsgericht": "Amtsgericht Bremen",
      "registernummer": "HRB 3641 BHV",
      "registerart": "HRB",
      "company_name": "J.H.K. Management GmbH",
      "company_seat": "Bremerhaven",
      "details": "12.09.2025 (Bekanntmachungsdatum)\n\nBremen Amtsgericht Bremen HRB 3641 BHV\nRegisterbekanntmachung nach dem Umwandlungsgesetz 08.09.2025 (Eintragungsdatum)\n\nJ.H.K. Management GmbH\nGesellschaft mit beschränkter Haftung\nBremerhaven\n\nAls nicht eingetragen wird veröffentlicht: Den Gläubigern der an der Verschmelzung beteiligten Rechtsträger ist, wenn sie binnen sechs Monaten nach dem Tag, an dem die Eintragung der Verschmelzung in das Register des Sitzes desjenigen Rechtsträgers, dessen Gläubiger sie sind, als bekannt gemacht gilt, ihren Anspruch nach Grund und Höhe schriftlich anmelden, Sicherheit zu leisten, soweit sie nicht Befriedigung verlangen können. Dieses Recht steht den Gläubigern jedoch nur zu, wenn sie glaubhaft machen, dass durch die Verschmelzung die Erfüllung ihrer Forderung gefährdet wird. Das Recht, Sicherheitsleistung zu verlangen, steht Gläubigern nicht zu, die im Falle der Insolvenz ein Recht auf vorzugsweise Befriedigung aus einer Deckungsmasse haben, die nach gesetzlicher Vorschrift zu ihrem Schutz errichtet und staatlich überwacht ist."
    },
    {
      "date": "2025-09-12",
      "id": "129112",
      "original_text": "Registerbekanntmachung nach dem Umwandlungsgesetz\nBremen Amtsgericht Bremen HRB 3559 BHV\nJ.H.K. Anlagenbau und Industrieservice GmbH – Bremerhaven",
      "type": "Registerbekanntmachung nach dem Umwandlungsgesetz",
      "state": "Bremen",
      "amtsgericht": "Amtsgericht Bremen",
      "registernummer": "HRB 3559 BHV",
      "registerart": "HRB",
      "company_name": "J.H.K. Anlagenbau und Industrieservice GmbH",
      "company_seat": "Bremerhaven",
      "details": "12.09.2025 (Bekanntmachungsdatum)\n\nBremen Amtsgericht Bremen HRB 3559 BHV\nRegisterbekanntmachung nach dem Umwandlungsgesetz 08.09.2025 (Eintragungsdatum)\n\nJ.H.K. Anlagenbau und Industrieservice GmbH\nGesellschaft mit beschränkter Haftung\nBremerhaven\n\nAls nicht eingetragen wird veröffentlicht: Den Gläubigern der an der Verschmelzung beteiligten Rechtsträger ist, wenn sie binnen sechs Monaten nach dem Tag, an dem die Eintragung der Verschmelzung in das Register des Sitzes desjenigen Rechtsträgers, dessen Gläubiger sie sind, als bekannt gemacht gilt, ihren Anspruch nach Grund und Höhe schriftlich anmelden, Sicherheit zu leisten, soweit sie nicht Befriedigung verlangen können. Dieses Recht steht den Gläubigern jedoch nur zu, wenn sie glaubhaft machen, dass durch die Verschmelzung die Erfüllung ihrer Forderung gefährdet wird. Das Recht, Sicherheitsleistung zu verlangen, steht Gläubigern nicht zu, die im Falle der Insolvenz ein Recht auf vorzugsweise Befriedigung aus einer Deckungsmasse haben, die nach gesetzlicher Vorschrift zu ihrem Schutz errichtet und staatlich überwacht ist."
    },
    {
      "date": "2025-09-12",
      "id": "129113",
      "original_text": "Registerbekanntmachung nach dem Umwandlungsgesetz\nBremen Amtsgericht Bremen HRB 35063\nJ.H.K. Regeniter GmbH – Bremerhaven",
      "type": "Registerbekanntmachung nach dem Umwandlungsgesetz",
      "state": "Bremen",
      "amtsgericht": "Amtsgericht Bremen",
      "registernummer": "HRB 35063",
      "registerart": "HRB",
      "company_name": "J.H.K. Regeniter GmbH",
      "company_seat": "Bremerhaven",
      "details": "12.09.2025 (Bekanntmachungsdatum)\n\nBremen Amtsgericht Bremen HRB 35063\nRegisterbekanntmachung nach dem Umwandlungsgesetz 08.09.2025 (Eintragungsdatum)\n\nJ.H.K. Regeniter GmbH\nGesellschaft mit beschränkter Haftung\nBremerhaven\n\nAls nicht eingetragen wird veröffentlicht: Den Gläubigern der an der Verschmelzung beteiligten Rechtsträger ist, wenn sie binnen sechs Monaten nach dem Tag, an dem die Eintragung der Verschmelzung in das Register des Sitzes desjenigen Rechtsträgers, dessen Gläubiger sie sind, als bekannt gemacht gilt, ihren Anspruch nach Grund und Höhe schriftlich anmelden, Sicherheit zu leisten, soweit sie nicht Befriedigung verlangen können. Dieses Recht steht den Gläubigern jedoch nur zu, wenn sie glaubhaft machen, dass durch die Verschmelzung die Erfüllung ihrer Forderung gefährdet wird. Das Recht, Sicherheitsleistung zu verlangen, steht Gläubigern nicht zu, die im Falle der Insolvenz ein Recht auf vorzugsweise Befriedigung aus einer Deckungsmasse haben, die nach gesetzlicher Vorschrift zu ihrem Schutz errichtet und staatlich überwacht ist."
    },
    {
      "date": "2025-09-12",
      "id": "129114",
      "original_text": "Registerbekanntmachung nach dem Umwandlungsgesetz\nRheinland-Pfalz Amtsgericht Mainz HRB 6091\nAareon Deutschland GmbH – Mainz",
      "type": "Registerbekanntmachung nach dem Umwandlungsgesetz",
      "state": "Rheinland-Pfalz",
      "amtsgericht": "Amtsgericht Mainz",
      "registernummer": "HRB 6091",
      "registerart": "HRB",
      "company_name": "Aareon Deutschland GmbH",
      "company_seat": "Mainz",
      "details": "12.09.2025 (Bekanntmachungsdatum)\n\nRheinland-Pfalz Amtsgericht Mainz HRB 6091\nRegisterbekanntmachung nach dem Umwandlungsgesetz 12.09.2025 (Eintragungsdatum)\n\nAareon Deutschland GmbH\nGesellschaft mit beschränkter Haftung\nMainz\n\nAls nicht eingetragen wird veröffentlicht: Den Gläubigern der an der Verschmelzung beteiligten Rechtsträger ist, wenn sie binnen sechs Monaten nach dem Tag, an dem die Eintragung der Verschmelzung in das Register des Sitzes desjenigen Rechtsträgers, dessen Gläubiger sie sind, nach § 19 Abs. 3 UmwG als bekannt gemacht gilt, ihren Anspruch nach Grund und Höhe schriftlich anmelden, Sicherheit zu leisten, soweit sie nicht Befriedigung verlangen können. Dieses Recht steht den Gläubigern jedoch nur zu, wenn sie glaubhaft machen, dass durch die Verschmelzung die Erfüllung ihrer Forderung gefährdet wird."
    },
    {
      "date": "2025-09-12",
      "id": "129115",
      "original_text": "Registerbekanntmachung nach dem Umwandlungsgesetz\nRheinland-Pfalz Amtsgericht Mainz HRB 6091\nAareon Deutschland GmbH – Mainz",
      "type": "Registerbekanntmachung nach dem Umwandlungsgesetz",
      "state": "Rheinland-Pfalz",
      "amtsgericht": "Amtsgericht Mainz",
      "registernummer": "HRB 6091",
      "registerart": "HRB",
      "company_name": "Aareon Deutschland GmbH",
      "company_seat": "Mainz",
      "details": "12.09.2025 (Bekanntmachungsdatum)\n\nRheinland-Pfalz Amtsgericht Mainz HRB 6091\nRegisterbekanntmachung nach dem Umwandlungsgesetz 12.09.2025 (Eintragungsdatum)\n\nAareon Deutschland GmbH\nGesellschaft mit beschränkter Haftung\nMainz\n\nAls nicht eingetragen wird veröffentlicht: Den Gläubigern der an der Verschmelzung beteiligten Rechtsträger ist, wenn sie binnen sechs Monaten nach dem Tag, an dem die Eintragung der Verschmelzung in das Register des Sitzes desjenigen Rechtsträgers, dessen Gläubiger sie sind, nach § 19 Abs. 3 UmwG als bekannt gemacht gilt, ihren Anspruch nach Grund und Höhe schriftlich anmelden, Sicherheit zu leisten, soweit sie nicht Befriedigung verlangen können. Dieses Recht steht den Gläubigern jedoch nur zu, wenn sie glaubhaft machen, dass durch die Verschmelzung die Erfüllung ihrer Forderung gefährdet wird."
    },
    {
      "date": "2025-09-12",
      "id": "129116",
      "original_text": "Registerbekanntmachung nach dem Umwandlungsgesetz\nRheinland-Pfalz Amtsgericht Mainz HRB 6091\nAareon Deutschland GmbH – Mainz",
      "type": "Registerbekanntmachung nach dem Umwandlungsgesetz",
      "state": "Rheinland-Pfalz",
      "amtsgericht": "Amtsgericht Mainz",
      "registernummer": "HRB 6091",
      "registerart": "HRB",
      "company_name": "Aareon Deutschland GmbH",
      "company_seat": "Mainz",
      "details": "12.09.2025 (Bekanntmachungsdatum)\n\nRheinland-Pfalz Amtsgericht Mainz HRB 6091\nRegisterbekanntmachung nach dem Umwandlungsgesetz 12.09.2025 (Eintragungsdatum)\n\nAareon Deutschland GmbH\nGesellschaft mit beschränkter Haftung\nMainz\n\nAls nicht eingetragen wird veröffentlicht: Den Gläubigern der an der Verschmelzung beteiligten Rechtsträger ist, wenn sie binnen sechs Monaten nach dem Tag, an dem die Eintragung der Verschmelzung in das Register des Sitzes desjenigen Rechtsträgers, dessen Gläubiger sie sind, nach § 19 Abs. 3 UmwG als bekannt gemacht gilt, ihren Anspruch nach Grund und Höhe schriftlich anmelden, Sicherheit zu leisten, soweit sie nicht Befriedigung verlangen können. Dieses Recht steht den Gläubigern jedoch nur zu, wenn sie glaubhaft machen, dass durch die Verschmelzung die Erfüllung ihrer Forderung gefährdet wird."
    },
    {
      "date": "2025-09-12",
      "id": "129117",
      "original_text": "Registerbekanntmachung nach dem Umwandlungsgesetz\nRheinland-Pfalz Amtsgericht Mainz HRB 6091\nAareon Deutschland GmbH – Mainz",
      "type": "Registerbekanntmachung nach dem Umwandlungsgesetz",
      "state": "Rheinland-Pfalz",
      "amtsgericht": "Amtsgericht Mainz",
      "registernummer": "HRB 6091",
      "registerart": "HRB",
      "company_name": "Aareon Deutschland GmbH",
      "company_seat": "Mainz",
      "details": "12.09.2025 (Bekanntmachungsdatum)\n\nRheinland-Pfalz Amtsgericht Mainz HRB 6091\nRegisterbekanntmachung nach dem Umwandlungsgesetz 12.09.2025 (Eintragungsdatum)\n\nAareon Deutschland GmbH\nGesellschaft mit beschränkter Haftung\nMainz\n\nAls nicht eingetragen wird veröffentlicht: Den Gläubigern der an der Verschmelzung beteiligten Rechtsträger ist, wenn sie binnen sechs Monaten nach dem Tag, an dem die Eintragung der Verschmelzung in das Register des Sitzes desjenigen Rechtsträgers, dessen Gläubiger sie sind, nach § 19 Abs. 3 UmwG als bekannt gemacht gilt, ihren Anspruch nach Grund und Höhe schriftlich anmelden, Sicherheit zu leisten, soweit sie nicht Befriedigung verlangen können. Dieses Recht steht den Gläubigern jedoch nur zu, wenn sie glaubhaft machen, dass durch die Verschmelzung die Erfüllung ihrer Forderung gefährdet wird."
    },
    {
      "date": "2025-09-12",
      "id": "129118",
      "original_text": "Registerbekanntmachung nach dem Umwandlungsgesetz\nRheinland-Pfalz Amtsgericht Mainz HRB 6091\nAareon Deutschland GmbH – Mainz",
      "type": "Registerbekanntmachung nach dem Umwandlungsgesetz",
      "state": "Rheinland-Pfalz",
      "amtsgericht": "Amtsgericht Mainz",
      "registernummer": "HRB 6091",
      "registerart": "HRB",
      "company_name": "Aareon Deutschland GmbH",
      "company_seat": "Mainz",
      "details": "12.09.2025 (Bekanntmachungsdatum)\n\nRheinland-Pfalz Amtsgericht Mainz HRB 6091\nRegisterbekanntmachung nach dem Umwandlungsgesetz 12.09.2025 (Eintragungsdatum)\n\nAareon Deutschland GmbH\nGesellschaft mit beschränkter Haftung\nMainz\n\nAls nicht eingetragen wird veröffentlicht: Den Gläubigern der an der Verschmelzung beteiligten Rechtsträger ist, wenn sie binnen sechs Monaten nach dem Tag, an dem die Eintragung der Verschmelzung in das Register des Sitzes desjenigen Rechtsträgers, dessen Gläubiger sie sind, nach § 19 Abs. 3 UmwG als bekannt gemacht gilt, ihren Anspruch nach Grund und Höhe schriftlich anmelden, Sicherheit zu leisten, soweit sie nicht Befriedigung verlangen können. Dieses Recht steht den Gläubigern jedoch nur zu, wenn sie glaubhaft machen, dass durch die Verschmelzung die Erfüllung ihrerForderung gefährdet wird."
    },
    {
      "date": "2025-09-12",
      "id": "129119",
      "original_text": "Registerbekanntmachung nach dem Umwandlungsgesetz\nRheinland-Pfalz Amtsgericht Mainz HRB 53163\nHausPerfekt GmbH – Mainz",
      "type": "Registerbekanntmachung nach dem Umwandlungsgesetz",
      "state": "Rheinland-Pfalz",
      "amtsgericht": "Amtsgericht Mainz",
      "registernummer": "HRB 53163",
      "registerart": "HRB",
      "company_name": "HausPerfekt GmbH",
      "company_seat": "Mainz",
      "details": "12.09.2025 (Bekanntmachungsdatum)\n\nRheinland-Pfalz Amtsgericht Mainz HRB 53163\nRegisterbekanntmachung nach dem Umwandlungsgesetz 12.09.2025 (Eintragungsdatum)\n\nHausPerfekt GmbH\nGesellschaft mit beschränkter Haftung\nMainz\n\nAls nicht eingetragen wird veröffentlicht: Den Gläubigern der an der Verschmelzung beteiligten Rechtsträger ist, wenn sie binnen sechs Monaten nach dem Tag, an dem die Eintragung der Verschmelzung in das Register des Sitzes desjenigen Rechtsträgers, dessen Gläubiger sie sind, nach § 19 Abs. 3 UmwG als bekannt gemacht gilt, ihren Anspruch nach Grund und Höhe schriftlich anmelden, Sicherheit zu leisten, soweit sie nicht Befriedigung verlangen können. Dieses Recht steht den Gläubigern jedoch nur zu, wenn sie glaubhaft machen, dass durch die Verschmelzung die Erfüllung ihrer Forderung gefährdet wird."
    },
    {
      "date": "2025-09-12",
      "id": "129120",
      "original_text": "Registerbekanntmachung nach dem Umwandlungsgesetz\nRheinland-Pfalz Amtsgericht Mainz HRB 53556\nImmo Software GmbH – Mainz",
      "type": "Registerbekanntmachung nach dem Umwandlungsgesetz",
      "state": "Rheinland-Pfalz",
      "amtsgericht": "Amtsgericht Mainz",
      "registernummer": "HRB 53556",
      "registerart": "HRB",
      "company_name": "Immo Software GmbH",
      "company_seat": "Mainz",
      "details": "12.09.2025 (Bekanntmachungsdatum)\n\nRheinland-Pfalz Amtsgericht Mainz HRB 53556\nRegisterbekanntmachung nach dem Umwandlungsgesetz 12.09.2025 (Eintragungsdatum)\n\nImmo Software GmbH\nGesellschaft mit beschränkter Haftung\nMainz\n\nAls nicht eingetragen wird veröffentlicht: Den Gläubigern der an der Verschmelzung beteiligten Rechtsträger ist, wenn sie binnen sechs Monaten nach dem Tag, an dem die Eintragung der Verschmelzung in das Register des Sitzes desjenigen Rechtsträgers, dessen Gläubiger sie sind, nach § 19 Abs. 3 UmwG als bekannt gemacht gilt, ihren Anspruch nach Grund und Höhe schriftlich anmelden, Sicherheit zu leisten, soweit sie nicht Befriedigung verlangen können. Dieses Recht steht den Gläubigern jedoch nur zu, wenn sie glaubhaft machen, dass durch die Verschmelzung die Erfüllung ihrer Forderung gefährdet wird."
    },
    {
      "date": "2025-09-12",
      "id": "129121",
      "original_text": "Einreichung neuer Dokumente\nRheinland-Pfalz Amtsgericht Koblenz HRB 13990\nThyssenKrupp Rasselstein GmbH – Andernach",
      "type": "Einreichung neuer Dokumente",
      "state": "Rheinland-Pfalz",
      "amtsgericht": "Amtsgericht Koblenz",
      "registernummer": "HRB 13990",
      "registerart": "HRB",
      "company_name": "ThyssenKrupp Rasselstein GmbH",
      "company_seat": "Andernach",
      "details": "12.09.2025 (Bekanntmachungsdatum)\n\nRheinland-Pfalz Amtsgericht Koblenz HRB 13990\nEinreichung neuer Dokumente\n\nThyssenKrupp Rasselstein GmbH\nGesellschaft mit beschränkter Haftung\nAndernach\n\nDem Registergericht ist eine neue Liste der Mitglieder des Aufsichtsrates eingereicht worden."
    },
    {
      "date": "2025-09-12",
      "id": "129122",
      "original_text": "Registerbekanntmachung nach dem Umwandlungsgesetz\nNordrhein-Westfalen Amtsgericht Steinfurt HRB 2054\nGroneweg Verwaltungsgesellschaft mbH – Greven",
      "type": "Registerbekanntmachung nach dem Umwandlungsgesetz",
      "state": "Nordrhein-Westfalen",
      "amtsgericht": "Amtsgericht Steinfurt",
      "registernummer": "HRB 2054",
      "registerart": "HRB",
      "company_name": "Groneweg Verwaltungsgesellschaft mbH",
      "company_seat": "Greven",
      "details": "12.09.2025 (Bekanntmachungsdatum)\n\nNordrhein-Westfalen Amtsgericht Steinfurt HRB 2054\nRegisterbekanntmachung nach dem Umwandlungsgesetz 12.09.2025 (Eintragungsdatum)\n\nGroneweg Verwaltungsgesellschaft mbH\nGesellschaft mit beschränkter Haftung\nGreven\n\nDen Gläubigern der an der Verschmelzung beteiligten Rechtsträger ist, wenn sie binnen sechs Monaten nach dem Tag, an dem die Eintragung der Verschmelzung in das Register des Sitzes derjenigen Rechtsträger deren Gläubiger sie sind, nach § 19 Absatz 3 UmwG als bekanntgemacht gilt, ihren Anspruch nach Grund und Höhe schriftlich anmelden, Sicherheit zu leisten, soweit sie nicht Befriedigung verlangen können. Dieses Recht steht den Gläubigern jedoch nur zu, wenn sie glaubhaft machen, dass durch die Verschmelzung die Erfüllung ihrer Forderung gefährdet wird."
    },
    {
      "date": "2025-09-12",
      "id": "129123",
      "original_text": "Registerbekanntmachung nach dem Umwandlungsgesetz\nNordrhein-Westfalen Amtsgericht Köln HRB 102094\nAttaennchen GmbH – Brühl",
      "type": "Registerbekanntmachung nach dem Umwandlungsgesetz",
      "state": "Nordrhein-Westfalen",
      "amtsgericht": "Amtsgericht Köln",
      "registernummer": "HRB 102094",
      "registerart": "HRB",
      "company_name": "Attaennchen GmbH",
      "company_seat": "Brühl",
      "details": "12.09.2025 (Bekanntmachungsdatum)\n\nNordrhein-Westfalen Amtsgericht Köln HRB 102094\nRegisterbekanntmachung nach dem Umwandlungsgesetz 12.09.2025 (Eintragungsdatum)\n\nAttaennchen GmbH\nGesellschaft mit beschränkter Haftung\nBrühl\n\nDen Gläubigern der an der Verschmelzung beteiligten Rechtsträger ist, wenn sie binnen sechs Monaten nach dem Tag, an dem die Eintragung der Verschmelzung in das Register des Sitzes desjenigen Rechtsträgers, dessen Gläubiger sie sind, nach § 19 Absatz 3 UmwG als bekanntgemacht gilt, ihren Anspruch nach Grund und Höhe schriftlich anmelden, Sicherheit zu leisten, soweit sie nicht Befriedigung verlangen können. Dieses Recht steht den Gläubigern jedoch nur zu, wenn sie glaubhaft machen, dass durch die Verschmelzung die Erfüllung ihrer Forderung gefährdet wird."
    },
    {
      "date": "2025-09-12",
      "id": "129124",
      "original_text": "Registerbekanntmachung nach dem Umwandlungsgesetz\nNordrhein-Westfalen Amtsgericht Köln HRB 113104\nBestattungshaus Christoph Kuckelkorn 1885 GmbH – Köln",
      "type": "Registerbekanntmachung nach dem Umwandlungsgesetz",
      "state": "Nordrhein-Westfalen",
      "amtsgericht": "Amtsgericht Köln",
      "registernummer": "HRB 113104",
      "registerart": "HRB",
      "company_name": "Bestattungshaus Christoph Kuckelkorn 1885 GmbH",
      "company_seat": "Köln",
      "details": "12.09.2025 (Bekanntmachungsdatum)\n\nNordrhein-Westfalen Amtsgericht Köln HRB 113104\nRegisterbekanntmachung nach dem Umwandlungsgesetz 12.09.2025 (Eintragungsdatum)\n\nBestattungshaus Christoph Kuckelkorn 1885 GmbH\nGesellschaft mit beschränkter Haftung\nKöln\n\nDen Gläubigern der an der Verschmelzung beteiligten Rechtsträger ist, wenn sie binnen sechs Monaten nach dem Tag, an dem die Eintragung der Verschmelzung in das Register des Sitzes desjenigen Rechtsträgers, dessen Gläubiger sie sind, nach § 19 Absatz 3 UmwG als bekanntgemacht gilt, ihren Anspruch nach Grund und Höhe schriftlich anmelden, Sicherheit zu leisten, soweit sie nicht Befriedigung verlangen können. Dieses Recht steht den Gläubigern jedoch nur zu, wenn sie glaubhaft machen, dass durch die Verschmelzung die Erfüllung ihrer Forderung gefährdet wird."
    },
    {
      "date": "2025-09-12",
      "id": "129125",
      "original_text": "Registerbekanntmachung nach dem Umwandlungsgesetz\nNordrhein-Westfalen Amtsgericht Paderborn HRA 8825\nSimone Leonard Gerüstbau e. K. – Paderborn",
      "type": "Registerbekanntmachung nach dem Umwandlungsgesetz",
      "state": "Nordrhein-Westfalen",
      "amtsgericht": "Amtsgericht Paderborn",
      "registernummer": "HRA 8825",
      "registerart": "HRA",
      "company_name": "Simone Leonard Gerüstbau e. K.",
      "company_seat": "Paderborn",
      "details": "12.09.2025 (Bekanntmachungsdatum)\n\nNordrhein-Westfalen Amtsgericht Paderborn HRA 8825\nRegisterbekanntmachung nach dem Umwandlungsgesetz 12.09.2025 (Eintragungsdatum)\n\nSimone Leonard Gerüstbau e. K.\nEinzelkaufmann / Einzelkauffrau\nPaderborn\n\nDen Gläubigern der an der Ausgliederung beteiligten Rechtsträger ist, wenn sie binnen sechs Monaten nach dem Tag, an dem die Eintragung der Ausgliederung in das Register des Sitzes desjenigen Rechtsträgers, dessen Gläubiger sie sind, nach § 19 Absatz 3 UmwG als bekanntgemacht gilt, ihren Anspruch nach Grund und Höhe schriftlich anmelden, Sicherheit zu leisten, soweit sie nicht Befriedigung verlangen können. Dieses Recht steht den Gläubigern jedoch nur zu, wenn sie glaubhaft machen, dass durch die Ausgliederung die Erfüllung ihrer Forderung gefährdet wird."
    },
    {
      "date": "2025-09-12",
      "id": "129126",
      "original_text": "Registerbekanntmachung nach dem Umwandlungsgesetz\nNordrhein-Westfalen Amtsgericht Essen PR 4485\nQUADRILOG STEUERN & RECHT Partnerschaft mbB – Düsseldorf",
      "type": "Registerbekanntmachung nach dem Umwandlungsgesetz",
      "state": "Nordrhein-Westfalen",
      "amtsgericht": "Amtsgericht Essen",
      "registernummer": "PR 4485",
      "registerart": "PR",
      "company_name": "QUADRILOG STEUERN & RECHT Partnerschaft mbB",
      "company_seat": "Düsseldorf",
      "details": "12.09.2025 (Bekanntmachungsdatum)\n\nNordrhein-Westfalen Amtsgericht Essen PR 4485\nRegisterbekanntmachung nach dem Umwandlungsgesetz 12.09.2025 (Eintragungsdatum)\n\nQUADRILOG STEUERN & RECHT Partnerschaft mbB\nPartnerschaftsgesellschaft\nDüsseldorf\n\nDen Gläubigern der an der formwechselnden Umwandlung beteiligten Rechtsträger ist, wenn sie binnen sechs Monaten nach dem Tag, an dem die Eintragung der formwechselnden Umwandlung in das Register des Sitzes desjenigen Rechtsträgers, dessen Gläubiger sie sind, nach § 19 Absatz 3 UmwG als bekanntgemacht gilt, ihren Anspruch nach Grund und Höhe schriftlich anmelden, Sicherheit zu leisten, soweit sie nicht Befriedigung verlangen können. Dieses Recht steht den Gläubigern jedoch nur zu, wenn sie glaubhaft machen, dass durch die formwechselnden Umwandlung die Erfüllung ihrer Forderung gefährdet wird."
    },
    {
      "date": "2025-09-12",
      "id": "129127",
      "original_text": "Registerbekanntmachung nach dem Umwandlungsgesetz\nNordrhein-Westfalen Amtsgericht Paderborn HRA 8839\nAllianz Langhans und Fingerhut OHG – Bad Wünnenberg",
      "type": "Registerbekanntmachung nach dem Umwandlungsgesetz",
      "state": "Nordrhein-Westfalen",
      "amtsgericht": "Amtsgericht Paderborn",
      "registernummer": "HRA 8839",
      "registerart": "HRA",
      "company_name": "Allianz Langhans und Fingerhut OHG",
      "company_seat": "Bad Wünnenberg",
      "details": "12.09.2025 (Bekanntmachungsdatum)\n\nNordrhein-Westfalen Amtsgericht Paderborn HRA 8839\nRegisterbekanntmachung nach dem Umwandlungsgesetz 07.08.2025 (Eintragungsdatum)\n\nAllianz Langhans und Fingerhut OHG\nOffene Handelsgesellschaft\nBad Wünnenberg\n\nDen Gläubigern der an der Ausgliederung beteiligten Rechtsträger ist, wenn sie binnen sechs Monaten nach dem Tag, an dem die Eintragung der Ausgliederung in das Register des Sitzes desjenigen Rechtsträgers, dessen Gläubiger sie sind, nach § 19 Absatz 3 UmwG als bekanntgemacht gilt, ihren Anspruch nach Grund und Höhe schriftlich anmelden, Sicherheit zu leisten, soweit sie nicht Befriedigung verlangen können. Dieses Recht steht den Gläubigern jedoch nur zu, wenn sie glaubhaft machen, dass durch die Ausgliederung die Erfüllung ihrer Forderung gefährdet wird."
    },
    {
      "date": "2025-09-12",
      "id": "129128",
      "original_text": "Registerbekanntmachung nach dem Umwandlungsgesetz\nNordrhein-Westfalen Amtsgericht Paderborn HRA 8839\nAllianz Langhans und Fingerhut OHG – Bad Wünnenberg",
      "type": "Registerbekanntmachung nach dem Umwandlungsgesetz",
      "state": "Nordrhein-Westfalen",
      "amtsgericht": "Amtsgericht Paderborn",
      "registernummer": "HRA 8839",
      "registerart": "HRA",
      "company_name": "Allianz Langhans und Fingerhut OHG",
      "company_seat": "Bad Wünnenberg",
      "details": "12.09.2025 (Bekanntmachungsdatum)\n\nNordrhein-Westfalen Amtsgericht Paderborn HRA 8839\nRegisterbekanntmachung nach dem Umwandlungsgesetz 12.09.2025 (Eintragungsdatum)\n\nAllianz Langhans und Fingerhut OHG\nOffene Handelsgesellschaft\nBad Wünnenberg\n\nDen Gläubigern der an der Ausgliederung beteiligten Rechtsträger ist, wenn sie binnen sechs Monaten nach dem Tag, an dem die Eintragung der Ausgliederung in das Register des Sitzes desjenigen Rechtsträgers, dessen Gläubiger sie sind, nach § 19 Absatz 3 UmwG als bekanntgemacht gilt, ihren Anspruch nach Grund und Höhe schriftlich anmelden, Sicherheit zu leisten, soweit sie nicht Befriedigung verlangen können. Dieses Recht steht den Gläubigern jedoch nur zu, wenn sie glaubhaft machen, dass durch die Ausgliederung die Erfüllung ihrer Forderung gefährdet wird."
    },
    {
      "date": "2025-09-12",
      "id": "129129",
      "original_text": "Löschungsankündigung\nNordrhein-Westfalen Amtsgericht Essen HRB 29306\nB & S Kasamovski GmbH – Essen",
      "type": "Löschungsankündigung",
      "state": "Nordrhein-Westfalen",
      "amtsgericht": "Amtsgericht Essen",
      "registernummer": "HRB 29306",
      "registerart": "HRB",
      "company_name": "B & S Kasamovski GmbH",
      "company_seat": "Essen",
      "details": "12.09.2025 (Bekanntmachungsdatum)\n\nNordrhein-Westfalen Amtsgericht Essen HRB 29306\nLöschungsankündigung\n\nB & S Kasamovski GmbH\nGesellschaft mit beschränkter Haftung\nEssen\n\nDas Registergericht beabsichtigt die Gesellschaft von Amts wegen nach § 394 FamFG zu löschen. Die Frist zur Erhebung eines Widerspruchs ist auf einen Monat festgesetzt."
    },
    {
      "date": "2025-09-12",
      "id": "129130",
      "original_text": "Registerbekanntmachung nach dem Umwandlungsgesetz\nNordrhein-Westfalen Amtsgericht Steinfurt HRB 2116\nRAOUL ROUSSO GmbH – Greven",
      "type": "Registerbekanntmachung nach dem Umwandlungsgesetz",
      "state": "Nordrhein-Westfalen",
      "amtsgericht": "Amtsgericht Steinfurt",
      "registernummer": "HRB 2116",
      "registerart": "HRB",
      "company_name": "RAOUL ROUSSO GmbH",
      "company_seat": "Greven",
      "details": "12.09.2025 (Bekanntmachungsdatum)\n\nNordrhein-Westfalen Amtsgericht Steinfurt HRB 2116\nRegisterbekanntmachung nach dem Umwandlungsgesetz 12.09.2025 (Eintragungsdatum)\n\nRAOUL ROUSSO GmbH\nGesellschaft mit beschränkter Haftung\nGreven\n\nDen Gläubigern der an der Verschmelzung beteiligten Rechtsträger ist, wenn sie binnen sechs Monaten nach dem Tag, an dem die Eintragung der Verschmelzung in das Register des Sitzes derjenigen Rechtsträger deren Gläubiger sie sind, nach § 19 Absatz 3 UmwG als bekanntgemacht gilt, ihren Anspruch nach Grund und Höhe schriftlich anmelden, Sicherheit zu leisten, soweit sie nicht Befriedigung verlangen können. Dieses Recht steht den Gläubigern jedoch nur zu, wenn sie glaubhaft machen, dass durch die Verschmelzung die Erfüllung ihrer Forderung gefährdet wird."
    },
    {
      "date": "2025-09-12",
      "id": "129131",
      "original_text": "Registerbekanntmachung nach dem Umwandlungsgesetz\nNordrhein-Westfalen Amtsgericht Köln HRA 21014\nFarm & Stable GmbH & Co. KG – Wiehl",
      "type": "Registerbekanntmachung nach dem Umwandlungsgesetz",
      "state": "Nordrhein-Westfalen",
      "amtsgericht": "Amtsgericht Köln",
      "registernummer": "HRA 21014",
      "registerart": "HRA",
      "company_name": "Farm & Stable GmbH & Co. KG",
      "company_seat": "Wiehl",
      "details": "12.09.2025 (Bekanntmachungsdatum)\n\nNordrhein-Westfalen Amtsgericht Köln HRA 21014\nRegisterbekanntmachung nach dem Umwandlungsgesetz 12.09.2025 (Eintragungsdatum)\n\nFarm & Stable GmbH & Co. KG\nKommanditgesellschaft\nWiehl\n\nDen Gläubigern der an der formwechselnden Umwandlung beteiligten Rechtsträger ist, wenn sie binnen sechs Monaten nach dem Tag, an dem die Eintragung der formwechselnden Umwandlung in das Register des Sitzes derjenigen Rechtsträger deren Gläubiger sie sind, nach § 19 Absatz 3 UmwG als bekanntgemacht gilt, ihren Anspruch nach Grund und Höhe schriftlich anmelden, Sicherheit zu leisten, soweit sie nicht Befriedigung verlangen können. Dieses Recht steht den Gläubigern jedoch nur zu, wenn sie glaubhaft machen, dass durch die formwechselnden Umwandlung die Erfüllung ihrer Forderung gefährdet wird."
    },
    {
      "date": "2025-09-12",
      "id": "129132",
      "original_text": "Löschungsankündigung\nNordrhein-Westfalen Amtsgericht Dortmund HRB 27058\nT-haag GmbH – Dortmund",
      "type": "Löschungsankündigung",
      "state": "Nordrhein-Westfalen",
      "amtsgericht": "Amtsgericht Dortmund",
      "registernummer": "HRB 27058",
      "registerart": "HRB",
      "company_name": "T-haag GmbH",
      "company_seat": "Dortmund",
      "details": "12.09.2025 (Bekanntmachungsdatum)\n\nNordrhein-Westfalen Amtsgericht Dortmund HRB 27058\nLöschungsankündigung 12.09.2025 (Eintragungsdatum)\n\nT-haag GmbH\nGesellschaft mit beschränkter Haftung\nDortmund\n\nDas Registergericht beabsichtigt die Gesellschaft von Amts wegen nach § 394 FamFG zu löschen. Die Frist zur Erhebung eines Widerspruchs ist auf zwei Monate festgesetzt."
    },
    {
      "date": "2025-09-12",
      "id": "129133",
      "original_text": "Einreichung neuer Dokumente\nNordrhein-Westfalen Amtsgericht Duisburg HRB 14649\nPVS holding GmbH – Mülheim an der Ruhr",
      "type": "Einreichung neuer Dokumente",
      "state": "Nordrhein-Westfalen",
      "amtsgericht": "Amtsgericht Duisburg",
      "registernummer": "HRB 14649",
      "registerart": "HRB",
      "company_name": "PVS holding GmbH",
      "company_seat": "Mülheim an der Ruhr",
      "details": "12.09.2025 (Bekanntmachungsdatum)\n\nNordrhein-Westfalen Amtsgericht Duisburg HRB 14649\nEinreichung neuer Dokumente 12.09.2025 (Eintragungsdatum)\n\nPVS holding GmbH\nGesellschaft mit beschränkter Haftung\nMülheim an der Ruhr\n\nDem Registergericht ist eine Liste der Mitglieder des Aufsichtsrates eingereicht worden."
    },
    {
      "date": "2025-09-12",
      "id": "129134",
      "original_text": "Registerbekanntmachung nach dem Umwandlungsgesetz\nNordrhein-Westfalen Amtsgericht Köln HRB 113104\nBestattungshaus Christoph Kuckelkorn 1885 GmbH – Köln",
      "type": "Registerbekanntmachung nach dem Umwandlungsgesetz",
      "state": "Nordrhein-Westfalen",
      "amtsgericht": "Amtsgericht Köln",
      "registernummer": "HRB 113104",
      "registerart": "HRB",
      "company_name": "Bestattungshaus Christoph Kuckelkorn 1885 GmbH",
      "company_seat": "Köln",
      "details": "12.09.2025 (Bekanntmachungsdatum)\n\nNordrhein-Westfalen Amtsgericht Köln HRB 113104\nRegisterbekanntmachung nach dem Umwandlungsgesetz 12.09.2025 (Eintragungsdatum)\n\nBestattungshaus Christoph Kuckelkorn 1885 GmbH\nGesellschaft mit beschränkter Haftung\nKöln\n\nDen Gläubigern der an der Verschmelzung beteiligten Rechtsträger ist, wenn sie binnen sechs Monaten nach dem Tag, an dem die Eintragung der Verschmelzung in das Register des Sitzes desjenigen Rechtsträgers, dessen Gläubiger sie sind, nach § 19 Absatz 3 UmwG als bekanntgemacht gilt, ihren Anspruch nach Grund und Höhe schriftlich anmelden, Sicherheit zu leisten, soweit sie nicht Befriedigung verlangen können. Dieses Recht steht den Gläubigern jedoch nur zu, wenn sie glaubhaft machen, dass durch die Verschmelzung die Erfüllung ihrer Forderung gefährdet wird."
    },
    {
      "date": "2025-09-12",
      "id": "129135",
      "original_text": "Löschungsankündigung\nNordrhein-Westfalen Amtsgericht Düsseldorf HRB 82325\nJankowski Dachdeckerei und Zimmerei UG (haftungsbeschränkt) – Düsseldorf",
      "type": "Löschungsankündigung",
      "state": "Nordrhein-Westfalen",
      "amtsgericht": "Amtsgericht Düsseldorf",
      "registernummer": "HRB 82325",
      "registerart": "HRB",
      "company_name": "Jankowski Dachdeckerei und Zimmerei UG (haftungsbeschränkt)",
      "company_seat": "Düsseldorf",
      "details": "12.09.2025 (Bekanntmachungsdatum)\n\nNordrhein-Westfalen Amtsgericht Düsseldorf HRB 82325\nLöschungsankündigung\n\nJankowski Dachdeckerei und Zimmerei UG (haftungsbeschränkt)\nGesellschaft mit beschränkter Haftung\nDüsseldorf\n\nBetr.: Jankowski Dachdeckerei und Zimmerei UG (haftungsbeschränkt), Ludwigshafener Str. 33B, 40229 Düsseldorf\n\nDas Registergericht beabsichtigt die Gesellschaft von Amts wegen nach § 394 FamFG zu löschen. Die Frist zur Erhebung eines Widerspruchs ist auf 3 Wochen festgesetzt.\n\nRechtsbehelfsbelehrung:\n\nDas Widerspruchsrecht steht jedem zu, der an der Unterlassung der Löschung ein berechtigtes Interesse hat. Der Widerspruch ist bei dem Amtsgericht Düsseldorf -Registergericht-, Werdener Straße 1, 40227 Düsseldorf schriftlich in deutscher Sprache oder zur Niederschrift der Geschäftsstelle einzulegen. Der Widerspruch kann auch zur Niederschrift der Geschäftsstelle eines jeden Amtsgerichtes abgegeben werden. Die Einlegung ist auch durch Übertragung eines elektronischen Dokuments an die elektronische Poststelle des Gerichts möglich. Das elektronische Dokument muss für die Bearbeitung durch das Gericht geeignet und mit einer qualifizierten elektronischen Signatur der verantwortenden Person versehen sein oder von der verantwortenden Person signiert und auf einem sicheren Übermittlungsweg gemäß § 130a ZPO nach näherer Maßgabe der Verordnung über die technischen Rahmenbedingungen des elektronischen Rechtsverkehrs und über das besondere elektronische Behördenpostfach (BGBl. I, S.3803) eingereicht werden. Weitere Informationen erhalten Sie auf der Internetseite www.justiz.de.\nDer Widerspruch muss spätestens innerhalb der gesetzten Frist nach dem Datum der Bekanntmachung der Löschungsankündigung bei dem Amtsgericht - Registergericht - Düsseldorf eingegangen sein.  Dies gilt auch dann, wenn der Widerspruch zur Niederschrift der Geschäftsstelle eines anderen Amtsgerichtes abgegeben wurde. Die Frist beginnt mit dem Tage der Bekanntmachung der Löschungsankündigung in dem für die Bekanntmachung der Eintragungen in das Handelsregister bestimmten elektronischen Informations- und Kommunikationssystem nach § 10 des Handelsgesetzbuches. Fällt das Ende der Frist auf einen Sonntag, einen allgemeinen Feiertag oder Sonnabend, so endet die Frist mit Ablauf des nächsten Werktages.\nDer Widerspruch muss die Bezeichnung der angefochtenen Löschungsankündigung sowie die Erklärung enthalten, dass Widerspruch gegen diese Löschungsankündigung eingelegt wird. Er ist zu unterzeichnen und soll begründet werden."
    },
    {
      "date": "2025-09-12",
      "id": "129136",
      "original_text": "Registerbekanntmachung nach dem Umwandlungsgesetz\nNordrhein-Westfalen Amtsgericht Bielefeld HRB 37865\nrc - research & consulting GmbH – Bielefeld",
      "type": "Registerbekanntmachung nach dem Umwandlungsgesetz",
      "state": "Nordrhein-Westfalen",
      "amtsgericht": "Amtsgericht Bielefeld",
      "registernummer": "HRB 37865",
      "registerart": "HRB",
      "company_name": "rc - research & consulting GmbH",
      "company_seat": "Bielefeld",
      "details": "12.09.2025 (Bekanntmachungsdatum)\n\nNordrhein-Westfalen Amtsgericht Bielefeld HRB 37865\nRegisterbekanntmachung nach dem Umwandlungsgesetz 12.09.2025 (Eintragungsdatum)\n\nrc - research & consulting GmbH\nGesellschaft mit beschränkter Haftung\nBielefeld\n\nDen Gläubigern der an der Verschmelzung beteiligten Rechtsträger ist, wenn sie binnen sechs Monaten nach dem Tag, an dem die Eintragung der Verschmelzung in das Register des Sitzes desjenigen Rechtsträgers, dessen Gläubiger sie sind, nach § 19 Absatz 3 UmwG als bekanntgemacht gilt, ihren Anspruch nach Grund und Höhe schriftlich anmelden, Sicherheit zu leisten, soweit sie nicht Befriedigung verlangen können. Dieses Recht steht den Gläubigern jedoch nur zu, wenn sie glaubhaft machen, dass durch die Verschmelzung die Erfüllung ihrer Forderung gefährdet wird."
    },
    {
      "date": "2025-09-12",
      "id": "129137",
      "original_text": "Löschungsankündigung\nNordrhein-Westfalen Amtsgericht Bochum HRB 21612\nConvent Management GmbH – Bochum",
      "type": "Löschungsankündigung",
      "state": "Nordrhein-Westfalen",
      "amtsgericht": "Amtsgericht Bochum",
      "registernummer": "HRB 21612",
      "registerart": "HRB",
      "company_name": "Convent Management GmbH",
      "company_seat": "Bochum",
      "details": "12.09.2025 (Bekanntmachungsdatum)\n\nNordrhein-Westfalen Amtsgericht Bochum HRB 21612\nLöschungsankündigung 15.09.2025 (Eintragungsdatum)\n\nConvent Management GmbH\nGesellschaft mit beschränkter Haftung\nBochum\n\nDas Registergericht beabsichtigt die Gesellschaft von Amts wegen nach § 394 FamFG zu löschen. Die Frist zur Erhebung eines Widerspruchs ist auf drei Monate festgesetzt."
    },
    {
      "date": "2025-09-12",
      "id": "129138",
      "original_text": "Sonstige Registerbekanntmachung\nNordrhein-Westfalen Amtsgericht Münster HRB 22908\nDecidely AG – Münster",
      "type": "Sonstige Registerbekanntmachung",
      "state": "Nordrhein-Westfalen",
      "amtsgericht": "Amtsgericht Münster",
      "registernummer": "HRB 22908",
      "registerart": "HRB",
      "company_name": "Decidely AG",
      "company_seat": "Münster",
      "details": "12.09.2025 (Bekanntmachungsdatum)\n\nNordrhein-Westfalen Amtsgericht Münster HRB 22908\nSonstige Registerbekanntmachung 12.09.2025 (Eintragungsdatum)\n\nDecidely AG\nAktiengesellschaft\nMünster\n\nDem Registergericht ist eine Liste der Mitglieder des Aufsichtsrates eingereicht worden."
    },
    {
      "date": "2025-09-12",
      "id": "129139",
      "original_text": "Registerbekanntmachung nach dem Umwandlungsgesetz\nNordrhein-Westfalen Amtsgericht Mönchengladbach HRB 2251\nBähren Gesellschaft mit beschränkter Haftung – Mönchengladbach",
      "type": "Registerbekanntmachung nach dem Umwandlungsgesetz",
      "state": "Nordrhein-Westfalen",
      "amtsgericht": "Amtsgericht Mönchengladbach",
      "registernummer": "HRB 2251",
      "registerart": "HRB",
      "company_name": "Bähren Gesellschaft mit beschränkter Haftung",
      "company_seat": "Mönchengladbach",
      "details": "12.09.2025 (Bekanntmachungsdatum)\n\nNordrhein-Westfalen Amtsgericht Mönchengladbach HRB 2251\nRegisterbekanntmachung nach dem Umwandlungsgesetz 12.09.2025 (Eintragungsdatum)\n\nBähren Gesellschaft mit beschränkter Haftung\nGesellschaft mit beschränkter Haftung\nMönchengladbach\n\nDen Gläubigern der an der Verschmelzung beteiligten Rechtsträger ist, wenn sie binnen sechs Monaten nach dem Tag, an dem die Eintragung der Verschmelzung in das Register des Sitzes desjenigen Rechtsträgers, dessen Gläubiger sie sind, nach § 19 Absatz 3 UmwG als bekanntgemacht gilt, ihren Anspruch nach Grund und Höhe schriftlich anmelden, Sicherheit zu leisten, soweit sie nicht Befriedigung verlangen können. Dieses Recht steht den Gläubigern jedoch nur zu, wenn sie glaubhaft machen, dass durch die Verschmelzung die Erfüllung ihrer Forderung gefährdet wird."
    },
    {
      "date": "2025-09-12",
      "id": "129140",
      "original_text": "Sonstige Registerbekanntmachung\nNordrhein-Westfalen Amtsgericht Köln HRB 108159\nCHR GmbH – Bergneustadt",
      "type": "Sonstige Registerbekanntmachung",
      "state": "Nordrhein-Westfalen",
      "amtsgericht": "Amtsgericht Köln",
      "registernummer": "HRB 108159",
      "registerart": "HRB",
      "company_name": "CHR GmbH",
      "company_seat": "Bergneustadt",
      "details": "12.09.2025 (Bekanntmachungsdatum)\n\nNordrhein-Westfalen Amtsgericht Köln HRB 108159\nSonstige Registerbekanntmachung\n\nCHR GmbH\nGesellschaft mit beschränkter Haftung\nBergneustadt\n\nDas Registergericht beabsichtigt Herrn Stefanos Paraskevopoulos, *08.08.1994,  von Amts wegen nach § 395 FamFG als Geschäftsführer zu löschen. Die Frist zur Erhebung eines Widerspruchs ist auf einen Monat festgesetzt."
    },
    {
      "date": "2025-09-12",
      "id": "129141",
      "original_text": "Registerbekanntmachung nach dem Umwandlungsgesetz\nNordrhein-Westfalen Amtsgericht Aachen HRB 12979\nEHC Germany GmbH – Baesweiler",
      "type": "Registerbekanntmachung nach dem Umwandlungsgesetz",
      "state": "Nordrhein-Westfalen",
      "amtsgericht": "Amtsgericht Aachen",
      "registernummer": "HRB 12979",
      "registerart": "HRB",
      "company_name": "EHC Germany GmbH",
      "company_seat": "Baesweiler",
      "details": "12.09.2025 (Bekanntmachungsdatum)\n\nNordrhein-Westfalen Amtsgericht Aachen HRB 12979\nRegisterbekanntmachung nach dem Umwandlungsgesetz 12.09.2025 (Eintragungsdatum)\n\nEHC Germany GmbH\nGesellschaft mit beschränkter Haftung\nBaesweiler\n\nDen Gläubigern der an der Verschmelzung beteiligten Rechtsträger ist, wenn sie binnen sechs Monaten nach dem Tag, an dem die Eintragung der Verschmelzung in das Register des Sitzes derjenigen Rechtsträger deren Gläubiger sie sind, nach § 19 Absatz 3 UmwG als bekanntgemacht gilt, ihren Anspruch nach Grund und Höhe schriftlich anmelden, Sicherheit zu leisten, soweit sie nicht Befriedigung verlangen können. Dieses Recht steht den Gläubigern jedoch nur zu, wenn sie glaubhaft machen, dass durch die Verschmelzung die Erfüllung ihrer Forderung gefährdet wird."
    },
    {
      "date": "2025-09-12",
      "id": "129142",
      "original_text": "Registerbekanntmachung nach dem Umwandlungsgesetz\nNordrhein-Westfalen Amtsgericht Gelsenkirchen HRB 12893\nWilhelm Jaeger GmbH – Gelsenkirchen",
      "type": "Registerbekanntmachung nach dem Umwandlungsgesetz",
      "state": "Nordrhein-Westfalen",
      "amtsgericht": "Amtsgericht Gelsenkirchen",
      "registernummer": "HRB 12893",
      "registerart": "HRB",
      "company_name": "Wilhelm Jaeger GmbH",
      "company_seat": "Gelsenkirchen",
      "details": "12.09.2025 (Bekanntmachungsdatum)\n\nNordrhein-Westfalen Amtsgericht Gelsenkirchen HRB 12893\nRegisterbekanntmachung nach dem Umwandlungsgesetz 12.09.2025 (Eintragungsdatum)\n\nWilhelm Jaeger GmbH\nGesellschaft mit beschränkter Haftung\nGelsenkirchen\n\nDen Gläubigern der an der Verschmelzung beteiligten Rechtsträger ist, wenn sie binnen sechs Monaten nach dem Tag, an dem die Eintragung der Verschmelzung in das Register des Sitzes derjenigen Rechtsträger deren Gläubiger sie sind, nach § 19 Absatz 3 UmwG als bekanntgemacht gilt, ihren Anspruch nach Grund und Höhe schriftlich anmelden, Sicherheit zu leisten, soweit sie nicht Befriedigung verlangen können. Dieses Recht steht den Gläubigern jedoch nur zu, wenn sie glaubhaft machen, dass durch die Verschmelzung die Erfüllung ihrer Forderung gefährdet wird."
    },
    {
      "date": "2025-09-12",
      "id": "129143",
      "original_text": "Löschungsankündigung\nNordrhein-Westfalen Amtsgericht Düren HRB 6406\nHES GmbH – Jülich",
      "type": "Löschungsankündigung",
      "state": "Nordrhein-Westfalen",
      "amtsgericht": "Amtsgericht Düren",
      "registernummer": "HRB 6406",
      "registerart": "HRB",
      "company_name": "HES GmbH",
      "company_seat": "Jülich",
      "details": "12.09.2025 (Bekanntmachungsdatum)\n\nNordrhein-Westfalen Amtsgericht Düren HRB 6406\nLöschungsankündigung\n\nHES GmbH\nGesellschaft mit beschränkter Haftung\nJülich\n\nDas Registergericht beabsichtigt die Gesellschaft von Amts wegen nach § 394 FamFG zu löschen. Die Frist zur Erhebung eines Widerspruchs ist auf drei Monate festgesetzt."
    },
    {
      "date": "2025-09-12",
      "id": "129144",
      "original_text": "Registerbekanntmachung nach dem Umwandlungsgesetz\nNordrhein-Westfalen Amtsgericht Mönchengladbach HRB 23311\nKörber Pharma Packaging Materials GmbH – Mönchengladbach",
      "type": "Registerbekanntmachung nach dem Umwandlungsgesetz",
      "state": "Nordrhein-Westfalen",
      "amtsgericht": "Amtsgericht Mönchengladbach",
      "registernummer": "HRB 23311",
      "registerart": "HRB",
      "company_name": "Körber Pharma Packaging Materials GmbH",
      "company_seat": "Mönchengladbach",
      "details": "12.09.2025 (Bekanntmachungsdatum)\n\nNordrhein-Westfalen Amtsgericht Mönchengladbach HRB 23311\nRegisterbekanntmachung nach dem Umwandlungsgesetz 12.09.2025 (Eintragungsdatum)\n\nKörber Pharma Packaging Materials GmbH\nGesellschaft mit beschränkter Haftung\nMönchengladbach\n\nDen Gläubigern der an der Verschmelzung beteiligten Rechtsträger ist, wenn sie binnen sechs Monaten nach dem Tag, an dem die Eintragung der Verschmelzung in das Register des Sitzes desjenigen Rechtsträgers, dessen Gläubiger sie sind, nach § 19 Absatz 3 UmwG als bekanntgemacht gilt, ihren Anspruch nach Grund und Höhe schriftlich anmelden, Sicherheit zu leisten, soweit sie nicht Befriedigung verlangen können. Dieses Recht steht den Gläubigern jedoch nur zu, wenn sie glaubhaft machen, dass durch die Verschmelzung die Erfüllung ihrer Forderung gefährdet wird."
    },
    {
      "date": "2025-09-12",
      "id": "129145",
      "original_text": "Registerbekanntmachung nach dem Umwandlungsgesetz\nNordrhein-Westfalen Amtsgericht Siegburg HRB 6226\nSYSTEM AG für IT-Lösungen – Lohmar",
      "type": "Registerbekanntmachung nach dem Umwandlungsgesetz",
      "state": "Nordrhein-Westfalen",
      "amtsgericht": "Amtsgericht Siegburg",
      "registernummer": "HRB 6226",
      "registerart": "HRB",
      "company_name": "SYSTEM AG für IT-Lösungen",
      "company_seat": "Lohmar",
      "details": "12.09.2025 (Bekanntmachungsdatum)\n\nNordrhein-Westfalen Amtsgericht Siegburg HRB 6226\nRegisterbekanntmachung nach dem Umwandlungsgesetz\n\nSYSTEM AG für IT-Lösungen\nAktiengesellschaft\nLohmar\n\nDem Registergericht ist ein Vertrag über die geplante Verschmelzung der axis gmbh mit Sitz in Bad Oeynhausen (Amtsgericht Bad Oeynhausen, HRB 14288) mit der System AG für IT-Lösungen mit Sitz in Lohmar (Amtsgericht Siegburg, HRB 6226) eingereicht worden."
    },
    {
      "date": "2025-09-12",
      "id": "129146",
      "original_text": "Registerbekanntmachung nach dem Umwandlungsgesetz\nNordrhein-Westfalen Amtsgericht Köln HRB 32313\nDr. Mortsiefer Management Consulting GmbH – Köln",
      "type": "Registerbekanntmachung nach dem Umwandlungsgesetz",
      "state": "Nordrhein-Westfalen",
      "amtsgericht": "Amtsgericht Köln",
      "registernummer": "HRB 32313",
      "registerart": "HRB",
      "company_name": "Dr. Mortsiefer Management Consulting GmbH",
      "company_seat": "Köln",
      "details": "12.09.2025 (Bekanntmachungsdatum)\n\nNordrhein-Westfalen Amtsgericht Köln HRB 32313\nRegisterbekanntmachung nach dem Umwandlungsgesetz 12.09.2025 (Eintragungsdatum)\n\nDr. Mortsiefer Management Consulting GmbH\nGesellschaft mit beschränkter Haftung\nKöln\n\nDen Gläubigern der an der Verschmelzung beteiligten Rechtsträger ist, wenn sie binnen sechs Monaten nach dem Tag, an dem die Eintragung der Verschmelzung in das Register des Sitzes desjenigen Rechtsträgers, dessen Gläubiger sie sind, nach § 19 Absatz 3 UmwG als bekanntgemacht gilt, ihren Anspruch nach Grund und Höhe schriftlich anmelden, Sicherheit zu leisten, soweit sie nicht Befriedigung verlangen können. Dieses Recht steht den Gläubigern jedoch nur zu, wenn sie glaubhaft machen, dass durch die Verschmelzung die Erfüllung ihrer Forderung gefährdet wird."
    },
    {
      "date": "2025-09-12",
      "id": "129147",
      "original_text": "Registerbekanntmachung nach dem Umwandlungsgesetz\nNordrhein-Westfalen Amtsgericht Köln GsR 2335\nPikfine eGbR – Hückeswagen",
      "type": "Registerbekanntmachung nach dem Umwandlungsgesetz",
      "state": "Nordrhein-Westfalen",
      "amtsgericht": "Amtsgericht Köln",
      "registernummer": "GsR 2335",
      "registerart": "GsR",
      "company_name": "Pikfine eGbR",
      "company_seat": "Hückeswagen",
      "details": "12.09.2025 (Bekanntmachungsdatum)\n\nNordrhein-Westfalen Amtsgericht Köln GsR 2335\nRegisterbekanntmachung nach dem Umwandlungsgesetz 12.09.2025 (Eintragungsdatum)\n\nPikfine eGbR\nGesellschaft bürgerlichen Rechts\nHückeswagen\n\nDen Gläubigern der an der formwechselnden Umwandlung beteiligten Rechtsträger ist, wenn sie binnen sechs Monaten nach dem Tag, an dem die Eintragung der formwechselnden Umwandlung in das Register des Sitzes desjenigen Rechtsträgers, dessen Gläubiger sie sind, nach § 19 Absatz 3 UmwG als bekanntgemacht gilt, ihren Anspruch nach Grund und Höhe schriftlich anmelden, Sicherheit zu leisten, soweit sie nicht Befriedigung verlangen können. Dieses Recht steht den Gläubigern jedoch nur zu, wenn sie glaubhaft machen, dass durch die formwechselnden Umwandlung die Erfüllung ihrer Forderung gefährdet wird."
    },
    {
      "date": "2025-09-12",
      "id": "129148",
      "original_text": "Registerbekanntmachung nach dem Umwandlungsgesetz\nNordrhein-Westfalen Amtsgericht Gelsenkirchen HRB 17800\nkapitalconcept GmbH – Haltern am See",
      "type": "Registerbekanntmachung nach dem Umwandlungsgesetz",
      "state": "Nordrhein-Westfalen",
      "amtsgericht": "Amtsgericht Gelsenkirchen",
      "registernummer": "HRB 17800",
      "registerart": "HRB",
      "company_name": "kapitalconcept GmbH",
      "company_seat": "Haltern am See",
      "details": "12.09.2025 (Bekanntmachungsdatum)\n\nNordrhein-Westfalen Amtsgericht Gelsenkirchen HRB 17800\nRegisterbekanntmachung nach dem Umwandlungsgesetz 12.09.2025 (Eintragungsdatum)\n\nkapitalconcept GmbH\nGesellschaft mit beschränkter Haftung\nHaltern am See\n\nDen Gläubigern der an der Verschmelzung beteiligten Rechtsträger ist, wenn sie binnen sechs Monaten nach dem Tag, an dem die Eintragung der Verschmelzung in das Register des Sitzes desjenigen Rechtsträgers, dessen Gläubiger sie sind, nach § 19 Absatz 3 UmwG als bekanntgemacht gilt, ihren Anspruch nach Grund und Höhe schriftlich anmelden, Sicherheit zu leisten, soweit sie nicht Befriedigung verlangen können. Dieses Recht steht den Gläubigern jedoch nur zu, wenn sie glaubhaft machen, dass durch die Verschmelzung die Erfüllung ihrer Forderung gefährdet wird."
    },
    {
      "date": "2025-09-12",
      "id": "129149",
      "original_text": "Löschungsankündigung\nNordrhein-Westfalen Amtsgericht Dortmund HRA 13201\nDS-Rendite-Fonds Nr. 57 MS Cape Spear GmbH & Co. Containerschiff KG – Dortmund",
      "type": "Löschungsankündigung",
      "state": "Nordrhein-Westfalen",
      "amtsgericht": "Amtsgericht Dortmund",
      "registernummer": "HRA 13201",
      "registerart": "HRA",
      "company_name": "DS-Rendite-Fonds Nr. 57 MS Cape Spear GmbH & Co. Containerschiff KG",
      "company_seat": "Dortmund",
      "details": "12.09.2025 (Bekanntmachungsdatum)\n\nNordrhein-Westfalen Amtsgericht Dortmund HRA 13201\nLöschungsankündigung\n\nDS-Rendite-Fonds Nr. 57 MS Cape Spear GmbH & Co. Containerschiff KG\nKommanditgesellschaft\nDortmund\n\nDas Registergericht beabsichtigt die Firma von Amts wegen nach §§ 31 Abs. 2 HGB, 393 FamFG zu löschen. Die Frist zur Erhebung eines Widerspruchs ist auf drei Monate festgesetzt."
    },
    {
      "date": "2025-09-12",
      "id": "129150",
      "original_text": "Registerbekanntmachung nach dem Umwandlungsgesetz\nNordrhein-Westfalen Amtsgericht Paderborn HRB 16144\nGoldKlang UG (haftungsbeschränkt) – Erwitte",
      "type": "Registerbekanntmachung nach dem Umwandlungsgesetz",
      "state": "Nordrhein-Westfalen",
      "amtsgericht": "Amtsgericht Paderborn",
      "registernummer": "HRB 16144",
      "registerart": "HRB",
      "company_name": "GoldKlang UG (haftungsbeschränkt)",
      "company_seat": "Erwitte",
      "details": "12.09.2025 (Bekanntmachungsdatum)\n\nNordrhein-Westfalen Amtsgericht Paderborn HRB 16144\nRegisterbekanntmachung nach dem Umwandlungsgesetz 12.09.2025 (Eintragungsdatum)\n\nGoldKlang UG (haftungsbeschränkt)\nGesellschaft mit beschränkter Haftung\nErwitte\n\nDen Gläubigern der an der Verschmelzung beteiligten Rechtsträger ist, wenn sie binnen sechs Monaten nach dem Tag, an dem die Eintragung der Verschmelzung in das Register des Sitzes desjenigen Rechtsträgers, dessen Gläubiger sie sind, nach § 19 Absatz 3 UmwG als bekanntgemacht gilt, ihren Anspruch nach Grund und Höhe schriftlich anmelden, Sicherheit zu leisten, soweit sie nicht Befriedigung verlangen können. Dieses Recht steht den Gläubigern jedoch nur zu, wenn sie glaubhaft machen, dass durch die Verschmelzung die Erfüllung ihrer Forderung gefährdet wird."
    },
    {
      "date": "2025-09-12",
      "id": "129151",
      "original_text": "Registerbekanntmachung nach dem Umwandlungsgesetz\nNordrhein-Westfalen Amtsgericht Iserlohn HRB 11039\nImmo-Viva GmbH – Meinerzhagen",
      "type": "Registerbekanntmachung nach dem Umwandlungsgesetz",
      "state": "Nordrhein-Westfalen",
      "amtsgericht": "Amtsgericht Iserlohn",
      "registernummer": "HRB 11039",
      "registerart": "HRB",
      "company_name": "Immo-Viva GmbH",
      "company_seat": "Meinerzhagen",
      "details": "12.09.2025 (Bekanntmachungsdatum)\n\nNordrhein-Westfalen Amtsgericht Iserlohn HRB 11039\nRegisterbekanntmachung nach dem Umwandlungsgesetz 09.09.2025 (Eintragungsdatum)\n\nImmo-Viva GmbH\nGesellschaft mit beschränkter Haftung\nMeinerzhagen\n\nDen Gläubigern der an der Verschmelzung beteiligten Rechtsträger ist, wenn sie binnen sechs Monaten nach dem Tag, an dem die Eintragung der Verschmelzung in das Register des Sitzes desjenigen Rechtsträgers, dessen Gläubiger sie sind, nach § 19 Absatz 3 UmwG als bekanntgemacht gilt, ihren Anspruch nach Grund und Höhe schriftlich anmelden, Sicherheit zu leisten, soweit sie nicht Befriedigung verlangen können. Dieses Recht steht den Gläubigern jedoch nur zu, wenn sie glaubhaft machen, dass durch die Verschmelzung die Erfüllung ihrer Forderung gefährdet wird."
    },
    {
      "date": "2025-09-12",
      "id": "129152",
      "original_text": "Löschungsankündigung\nNordrhein-Westfalen Amtsgericht Mönchengladbach HRB 16434\nMercator Turko GmbH – Mönchengladbach",
      "type": "Löschungsankündigung",
      "state": "Nordrhein-Westfalen",
      "amtsgericht": "Amtsgericht Mönchengladbach",
      "registernummer": "HRB 16434",
      "registerart": "HRB",
      "company_name": "Mercator Turko GmbH",
      "company_seat": "Mönchengladbach",
      "details": "12.09.2025 (Bekanntmachungsdatum)\n\nNordrhein-Westfalen Amtsgericht Mönchengladbach HRB 16434\nLöschungsankündigung\n\nMercator Turko GmbH\nGesellschaft mit beschränkter Haftung\nMönchengladbach\n\nDas Registergericht beabsichtigt die Gesellschaft von Amts wegen nach § 394 FamFG zu löschen. Die Frist zur Erhebung eines Widerspruchs ist auf drei Monate festgesetzt."
    },
    {
      "date": "2025-09-12",
      "id": "129153",
      "original_text": "Registerbekanntmachung nach dem Umwandlungsgesetz\nNordrhein-Westfalen Amtsgericht Steinfurt HRB 2051\nCLUB Feinkost GmbH – Greven",
      "type": "Registerbekanntmachung nach dem Umwandlungsgesetz",
      "state": "Nordrhein-Westfalen",
      "amtsgericht": "Amtsgericht Steinfurt",
      "registernummer": "HRB 2051",
      "registerart": "HRB",
      "company_name": "CLUB Feinkost GmbH",
      "company_seat": "Greven",
      "details": "12.09.2025 (Bekanntmachungsdatum)\n\nNordrhein-Westfalen Amtsgericht Steinfurt HRB 2051\nRegisterbekanntmachung nach dem Umwandlungsgesetz 12.09.2025 (Eintragungsdatum)\n\nCLUB Feinkost GmbH\nGesellschaft mit beschränkter Haftung\nGreven\n\nDen Gläubigern der an der Verschmelzung beteiligten Rechtsträger ist, wenn sie binnen sechs Monaten nach dem Tag, an dem die Eintragung der Verschmelzung in das Register des Sitzes desjenigen Rechtsträgers, dessen Gläubiger sie sind, nach § 19 Absatz 3 UmwG als bekanntgemacht gilt, ihren Anspruch nach Grund und Höhe schriftlich anmelden, Sicherheit zu leisten, soweit sie nicht Befriedigung verlangen können. Dieses Recht steht den Gläubigern jedoch nur zu, wenn sie glaubhaft machen, dass durch die Verschmelzung die Erfüllung ihrer Forderung gefährdet wird."
    },
    {
      "date": "2025-09-12",
      "id": "129154",
      "original_text": "Löschungsankündigung\nNordrhein-Westfalen Amtsgericht Münster HRB 21319\nTaiHe GmbH – Ennigerloh",
      "type": "Löschungsankündigung",
      "state": "Nordrhein-Westfalen",
      "amtsgericht": "Amtsgericht Münster",
      "registernummer": "HRB 21319",
      "registerart": "HRB",
      "company_name": "TaiHe GmbH",
      "company_seat": "Ennigerloh",
      "details": "12.09.2025 (Bekanntmachungsdatum)\n\nNordrhein-Westfalen Amtsgericht Münster HRB 21319\nLöschungsankündigung 09.09.2025 (Eintragungsdatum)\n\nTaiHe GmbH\nGesellschaft mit beschränkter Haftung\nEnnigerloh\n\nDas Registergericht beabsichtigt die Gesellschaft von Amts wegen nach § 394 FamFG zu löschen. Die Frist zur Erhebung eines Widerspruchs ist auf einen Monat festgesetzt."
    },
    {
      "date": "2025-09-12",
      "id": "129155",
      "original_text": "Registerbekanntmachung nach dem Umwandlungsgesetz\nNordrhein-Westfalen Amtsgericht Düsseldorf HRA 25047\nBaker Tilly Steuerberatungsgesellschaft mbH & Co. KG – Düsseldorf",
      "type": "Registerbekanntmachung nach dem Umwandlungsgesetz",
      "state": "Nordrhein-Westfalen",
      "amtsgericht": "Amtsgericht Düsseldorf",
      "registernummer": "HRA 25047",
      "registerart": "HRA",
      "company_name": "Baker Tilly Steuerberatungsgesellschaft mbH & Co. KG",
      "company_seat": "Düsseldorf",
      "details": "12.09.2025 (Bekanntmachungsdatum)\n\nNordrhein-Westfalen Amtsgericht Düsseldorf HRA 25047\nRegisterbekanntmachung nach dem Umwandlungsgesetz 12.09.2025 (Eintragungsdatum)\n\nBaker Tilly Steuerberatungsgesellschaft mbH & Co. KG\nKommanditgesellschaft\nDüsseldorf\n\nDen Gläubigern der an der Ausgliederung beteiligten Rechtsträger ist, wenn sie binnen sechs Monaten nach dem Tag, an dem die Eintragung der Ausgliederung in das Register des Sitzes desjenigen Rechtsträgers, dessen Gläubiger sie sind, nach § 19 Absatz 3 UmwG als bekanntgemacht gilt, ihren Anspruch nach Grund und Höhe schriftlich anmelden, Sicherheit zu leisten, soweit sie nicht Befriedigung verlangen können. Dieses Recht steht den Gläubigern jedoch nur zu, wenn sie glaubhaft machen, dass durch die Ausgliederung die Erfüllung ihrer Forderung gefährdet wird."
    },
    {
      "date": "2025-09-12",
      "id": "129156",
      "original_text": "Einreichung neuer Dokumente\nNordrhein-Westfalen Amtsgericht Bochum HRB 11083\nadvoprax AG – Bochum",
      "type": "Einreichung neuer Dokumente",
      "state": "Nordrhein-Westfalen",
      "amtsgericht": "Amtsgericht Bochum",
      "registernummer": "HRB 11083",
      "registerart": "HRB",
      "company_name": "advoprax AG",
      "company_seat": "Bochum",
      "details": "12.09.2025 (Bekanntmachungsdatum)\n\nNordrhein-Westfalen Amtsgericht Bochum HRB 11083\nEinreichung neuer Dokumente 11.09.0205 (Eintragungsdatum)\n\nadvoprax AG\nAktiengesellschaft\nBochum\n\nDem Registergericht ist eine neue Liste der Mitglieder des Aufsichtsrates eingereicht worden."
    },
    {
      "date": "2025-09-12",
      "id": "129157",
      "original_text": "Registerbekanntmachung nach dem Umwandlungsgesetz\nNordrhein-Westfalen Amtsgericht Düsseldorf HRB 109847\nR. T. Institut GmbH – Düsseldorf",
      "type": "Registerbekanntmachung nach dem Umwandlungsgesetz",
      "state": "Nordrhein-Westfalen",
      "amtsgericht": "Amtsgericht Düsseldorf",
      "registernummer": "HRB 109847",
      "registerart": "HRB",
      "company_name": "R. T. Institut GmbH",
      "company_seat": "Düsseldorf",
      "details": "12.09.2025 (Bekanntmachungsdatum)\n\nNordrhein-Westfalen Amtsgericht Düsseldorf HRB 109847\nRegisterbekanntmachung nach dem Umwandlungsgesetz 12.09.2025 (Eintragungsdatum)\n\nR. T. Institut GmbH\nGesellschaft mit beschränkter Haftung\nDüsseldorf\n\nDen Gläubigern der an der Ausgliederung beteiligten Rechtsträger ist, wenn sie binnen sechs Monaten nach dem Tag, an dem die Eintragung der Ausgliederung in das Register des Sitzes desjenigen Rechtsträgers, dessen Gläubiger sie sind, nach § 19 Absatz 3 UmwG als bekanntgemacht gilt, ihren Anspruch nach Grund und Höhe schriftlich anmelden, Sicherheit zu leisten, soweit sie nicht Befriedigung verlangen können. Dieses Recht steht den Gläubigern jedoch nur zu, wenn sie glaubhaft machen, dass durch die Ausgliederung die Erfüllung ihrer Forderung gefährdet wird."
    },
    {
      "date": "2025-09-12",
      "id": "129158",
      "original_text": "Löschungsankündigung\nNordrhein-Westfalen Amtsgericht Kleve HRB 18053\nA.T.N. Trockenbau UG (haftungsbeschränkt) – Geldern",
      "type": "Löschungsankündigung",
      "state": "Nordrhein-Westfalen",
      "amtsgericht": "Amtsgericht Kleve",
      "registernummer": "HRB 18053",
      "registerart": "HRB",
      "company_name": "A.T.N. Trockenbau UG (haftungsbeschränkt)",
      "company_seat": "Geldern",
      "details": "12.09.2025 (Bekanntmachungsdatum)\n\nNordrhein-Westfalen Amtsgericht Kleve HRB 18053\nLöschungsankündigung\n\nA.T.N. Trockenbau UG (haftungsbeschränkt)\nGesellschaft mit beschränkter Haftung\nGeldern\n\nDas Registergericht beabsichtigt die Gesellschaft von Amts wegen nach § 394 FamFG zu löschen. Die Frist zur Erhebung eines Widerspruchs ist auf einen Monat festgesetzt."
    },
    {
      "date": "2025-09-12",
      "id": "129159",
      "original_text": "Sonstige Registerbekanntmachung\nNordrhein-Westfalen Amtsgericht Bochum HRB 11083\nadvoprax AG – Bochum",
      "type": "Sonstige Registerbekanntmachung",
      "state": "Nordrhein-Westfalen",
      "amtsgericht": "Amtsgericht Bochum",
      "registernummer": "HRB 11083",
      "registerart": "HRB",
      "company_name": "advoprax AG",
      "company_seat": "Bochum",
      "details": "12.09.2025 (Bekanntmachungsdatum)\n\nNordrhein-Westfalen Amtsgericht Bochum HRB 11083\nSonstige Registerbekanntmachung 11.09.2025 (Eintragungsdatum)\n\nadvoprax AG\nAktiengesellschaft\nBochum\n\nDem Registergericht ist eine neue Liste der Mitglieder des Aufsichtsrates eingereicht worden."
    },
    {
      "date": "2025-09-12",
      "id": "129160",
      "original_text": "Registerbekanntmachung nach dem Umwandlungsgesetz\nNordrhein-Westfalen Amtsgericht Mönchengladbach HRB 14551\nKistler Erkelenz GmbH – Erkelenz",
      "type": "Registerbekanntmachung nach dem Umwandlungsgesetz",
      "state": "Nordrhein-Westfalen",
      "amtsgericht": "Amtsgericht Mönchengladbach",
      "registernummer": "HRB 14551",
      "registerart": "HRB",
      "company_name": "Kistler Erkelenz GmbH",
      "company_seat": "Erkelenz",
      "details": "12.09.2025 (Bekanntmachungsdatum)\n\nNordrhein-Westfalen Amtsgericht Mönchengladbach HRB 14551\nRegisterbekanntmachung nach dem Umwandlungsgesetz 12.09.2025 (Eintragungsdatum)\n\nKistler Erkelenz GmbH\nGesellschaft mit beschränkter Haftung\nErkelenz\n\nDen Gläubigern der an der Verschmelzung beteiligten Rechtsträger ist, wenn sie binnen sechs Monaten nach dem Tag, an dem die Eintragung der Verschmelzung in das Register des Sitzes desjenigen Rechtsträgers, dessen Gläubiger sie sind, nach § 19 Absatz 3 UmwG als bekanntgemacht gilt, ihren Anspruch nach Grund und Höhe schriftlich anmelden, Sicherheit zu leisten, soweit sie nicht Befriedigung verlangen können. Dieses Recht steht den Gläubigern jedoch nur zu, wenn sie glaubhaft machen, dass durch die Verschmelzung die Erfüllung ihrer Forderung gefährdet wird."
    },
    {
      "date": "2025-09-12",
      "id": "129161",
      "original_text": "Registerbekanntmachung nach dem Umwandlungsgesetz\nNordrhein-Westfalen Amtsgericht Köln HRB 97011\nKewes Floristik GmbH – Elsdorf",
      "type": "Registerbekanntmachung nach dem Umwandlungsgesetz",
      "state": "Nordrhein-Westfalen",
      "amtsgericht": "Amtsgericht Köln",
      "registernummer": "HRB 97011",
      "registerart": "HRB",
      "company_name": "Kewes Floristik GmbH",
      "company_seat": "Elsdorf",
      "details": "12.09.2025 (Bekanntmachungsdatum)\n\nNordrhein-Westfalen Amtsgericht Köln HRB 97011\nRegisterbekanntmachung nach dem Umwandlungsgesetz 12.09.2025 (Eintragungsdatum)\n\nKewes Floristik GmbH\nGesellschaft mit beschränkter Haftung\nElsdorf\n\nDen Gläubigern der an der Verschmelzung beteiligten Rechtsträger ist, wenn sie binnen sechs Monaten nach dem Tag, an dem die Eintragung der Verschmelzung in das Register des Sitzes desjenigen Rechtsträgers, dessen Gläubiger sie sind, nach § 19 Absatz 3 UmwG als bekanntgemacht gilt, ihren Anspruch nach Grund und Höhe schriftlich anmelden, Sicherheit zu leisten, soweit sie nicht Befriedigung verlangen können. Dieses Recht steht den Gläubigern jedoch nur zu, wenn sie glaubhaft machen, dass durch die Verschmelzung die Erfüllung ihrer Forderung gefährdet wird."
    },
    {
      "date": "2025-09-12",
      "id": "129162",
      "original_text": "Registerbekanntmachung nach dem Umwandlungsgesetz\nNordrhein-Westfalen Amtsgericht Köln HRB 102616\nMortsiefer Estate Management GmbH – Köln",
      "type": "Registerbekanntmachung nach dem Umwandlungsgesetz",
      "state": "Nordrhein-Westfalen",
      "amtsgericht": "Amtsgericht Köln",
      "registernummer": "HRB 102616",
      "registerart": "HRB",
      "company_name": "Mortsiefer Estate Management GmbH",
      "company_seat": "Köln",
      "details": "12.09.2025 (Bekanntmachungsdatum)\n\nNordrhein-Westfalen Amtsgericht Köln HRB 102616\nRegisterbekanntmachung nach dem Umwandlungsgesetz 12.09.2025 (Eintragungsdatum)\n\nMortsiefer Estate Management GmbH\nGesellschaft mit beschränkter Haftung\nKöln\n\nDen Gläubigern der an der Verschmelzung beteiligten Rechtsträger ist, wenn sie binnen sechs Monaten nach dem Tag, an dem die Eintragung der Verschmelzung in das Register des Sitzes desjenigen Rechtsträgers, dessen Gläubiger sie sind, nach § 19 Absatz 3 UmwG als bekanntgemacht gilt, ihren Anspruch nach Grund und Höhe schriftlich anmelden, Sicherheit zu leisten, soweit sie nicht Befriedigung verlangen können. Dieses Recht steht den Gläubigern jedoch nur zu, wenn sie glaubhaft machen, dass durch die Verschmelzung die Erfüllung ihrer Forderung gefährdet wird."
    },
    {
      "date": "2025-09-12",
      "id": "129163",
      "original_text": "Registerbekanntmachung nach dem Umwandlungsgesetz\nNordrhein-Westfalen Amtsgericht Düsseldorf HRB 86811\nInnovationscampus Krefeld LM I GmbH – Monheim am Rhein",
      "type": "Registerbekanntmachung nach dem Umwandlungsgesetz",
      "state": "Nordrhein-Westfalen",
      "amtsgericht": "Amtsgericht Düsseldorf",
      "registernummer": "HRB 86811",
      "registerart": "HRB",
      "company_name": "Innovationscampus Krefeld LM I GmbH",
      "company_seat": "Monheim am Rhein",
      "details": "12.09.2025 (Bekanntmachungsdatum)\n\nNordrhein-Westfalen Amtsgericht Düsseldorf HRB 86811\nRegisterbekanntmachung nach dem Umwandlungsgesetz 12.09.2025 (Eintragungsdatum)\n\nInnovationscampus Krefeld LM I GmbH\nGesellschaft mit beschränkter Haftung\nMonheim am Rhein\n\nDen Gläubigern der an der Verschmelzung beteiligten Rechtsträger ist, wenn sie binnen sechs Monaten nach dem Tag, an dem die Eintragung der Verschmelzung in das Register des Sitzes desjenigen Rechtsträgers, dessen Gläubiger sie sind, nach § 19 Absatz 3 UmwG als bekanntgemacht gilt, ihren Anspruch nach Grund und Höhe schriftlich anmelden, Sicherheit zu leisten, soweit sie nicht Befriedigung verlangen können. Dieses Recht steht den Gläubigern jedoch nur zu, wenn sie glaubhaft machen, dass durch die Verschmelzung die Erfüllung ihrer Forderung gefährdet wird."
    },
    {
      "date": "2025-09-12",
      "id": "129164",
      "original_text": "Löschungsankündigung\nNordrhein-Westfalen Amtsgericht Dortmund HRB 36458\nFliesen und Naturstein UG Schages (haftungsbeschränkt) – Selm",
      "type": "Löschungsankündigung",
      "state": "Nordrhein-Westfalen",
      "amtsgericht": "Amtsgericht Dortmund",
      "registernummer": "HRB 36458",
      "registerart": "HRB",
      "company_name": "Fliesen und Naturstein UG Schages (haftungsbeschränkt)",
      "company_seat": "Selm",
      "details": "12.09.2025 (Bekanntmachungsdatum)\n\nNordrhein-Westfalen Amtsgericht Dortmund HRB 36458\nLöschungsankündigung 12.09.2025 (Eintragungsdatum)\n\nFliesen und Naturstein UG Schages (haftungsbeschränkt)\nGesellschaft mit beschränkter Haftung\nSelm\n\nDas Registergericht beabsichtigt die Gesellschaft von Amts wegen nach § 394 FamFG zu löschen. Die Frist zur Erhebung eines Widerspruchs ist auf zwei Monate festgesetzt."
    },
    {
      "date": "2025-09-12",
      "id": "129165",
      "original_text": "Registerbekanntmachung nach dem Umwandlungsgesetz\nNordrhein-Westfalen Amtsgericht Gelsenkirchen HRB 3497\nLT Leitungs-Tiefbau GmbH – Gelsenkirchen",
      "type": "Registerbekanntmachung nach dem Umwandlungsgesetz",
      "state": "Nordrhein-Westfalen",
      "amtsgericht": "Amtsgericht Gelsenkirchen",
      "registernummer": "HRB 3497",
      "registerart": "HRB",
      "company_name": "LT Leitungs-Tiefbau GmbH",
      "company_seat": "Gelsenkirchen",
      "details": "12.09.2025 (Bekanntmachungsdatum)\n\nNordrhein-Westfalen Amtsgericht Gelsenkirchen HRB 3497\nRegisterbekanntmachung nach dem Umwandlungsgesetz 12.09.2025 (Eintragungsdatum)\n\nLT Leitungs-Tiefbau GmbH\nGesellschaft mit beschränkter Haftung\nGelsenkirchen\n\nDen Gläubigern der an der Verschmelzung beteiligten Rechtsträger ist, wenn sie binnen sechs Monaten nach dem Tag, an dem die Eintragung der Verschmelzung in das Register des Sitzes derjenigen Rechtsträger deren Gläubiger sie sind, nach § 19 Absatz 3 UmwG als bekanntgemacht gilt, ihren Anspruch nach Grund und Höhe schriftlich anmelden, Sicherheit zu leisten, soweit sie nicht Befriedigung verlangen können. Dieses Recht steht den Gläubigern jedoch nur zu, wenn sie glaubhaft machen, dass durch die Verschmelzung die Erfüllung ihrer Forderung gefährdet wird."
    },
    {
      "date": "2025-09-12",
      "id": "129166",
      "original_text": "Registerbekanntmachung nach dem Umwandlungsgesetz\nNordrhein-Westfalen Amtsgericht Neuss HRB 17935\nEden Water & Coffee Deutschland GmbH – Neuss",
      "type": "Registerbekanntmachung nach dem Umwandlungsgesetz",
      "state": "Nordrhein-Westfalen",
      "amtsgericht": "Amtsgericht Neuss",
      "registernummer": "HRB 17935",
      "registerart": "HRB",
      "company_name": "Eden Water & Coffee Deutschland GmbH",
      "company_seat": "Neuss",
      "details": "12.09.2025 (Bekanntmachungsdatum)\n\nNordrhein-Westfalen Amtsgericht Neuss HRB 17935\nRegisterbekanntmachung nach dem Umwandlungsgesetz 12.09.2025 (Eintragungsdatum)\n\nEden Water & Coffee Deutschland GmbH\nGesellschaft mit beschränkter Haftung\nNeuss\n\nDen Gläubigern der an der Verschmelzung beteiligten Rechtsträger ist, wenn sie binnen sechs Monaten nach dem Tag, an dem die Eintragung der Verschmelzung in das Register des Sitzes desjenigen Rechtsträgers, dessen Gläubiger sie sind, nach § 19 Absatz 3 UmwG als bekanntgemacht gilt, ihren Anspruch nach Grund und Höhe schriftlich anmelden, Sicherheit zu leisten, soweit sie nicht Befriedigung verlangen können. Dieses Recht steht den Gläubigern jedoch nur zu, wenn sie glaubhaft machen, dass durch die Verschmelzung die Erfüllung ihrer Forderung gefährdet wird.Den Gläubigern der an der Verschmelzung beteiligten Rechtsträger ist, wenn sie binnen sechs Monaten nach dem Tag, an dem die Eintragung der Verschmelzung in das Register des Sitzes desjenigen Rechtsträgers, dessen Gläubiger sie sind, nach § 19 Absatz 3 UmwG als bekanntgemacht gilt, ihren Anspruch nach Grund und Höhe schriftlich anmelden, Sicherheit zu leisten, soweit sie nicht Befriedigung verlangen können. Dieses Recht steht den Gläubigern jedoch nur zu, wenn sie glaubhaft machen, dass durch die Verschmelzung die Erfüllung ihrer Forderung gefährdet wird."
    },
    {
      "date": "2025-09-12",
      "id": "129167",
      "original_text": "Registerbekanntmachung nach dem Umwandlungsgesetz\nNordrhein-Westfalen Amtsgericht Münster HRA 6940\nPedalo-Zweirad Fachgeschäft Stefan Niemerg – Sassenberg",
      "type": "Registerbekanntmachung nach dem Umwandlungsgesetz",
      "state": "Nordrhein-Westfalen",
      "amtsgericht": "Amtsgericht Münster",
      "registernummer": "HRA 6940",
      "registerart": "HRA",
      "company_name": "Pedalo-Zweirad Fachgeschäft Stefan Niemerg",
      "company_seat": "Sassenberg",
      "details": "12.09.2025 (Bekanntmachungsdatum)\n\nNordrhein-Westfalen Amtsgericht Münster HRA 6940\nRegisterbekanntmachung nach dem Umwandlungsgesetz 12.09.2025 (Eintragungsdatum)\n\nPedalo-Zweirad Fachgeschäft Stefan Niemerg\nEinzelkaufmann / Einzelkauffrau\nSassenberg\n\nDen Gläubigern der an der Ausgliederung beteiligten Rechtsträger ist, wenn sie binnen sechs Monaten nach dem Tag, an dem die Eintragung der Ausgliederung in das Register des Sitzes desjenigen Rechtsträgers, dessen Gläubiger sie sind, nach § 19 Absatz 3 UmwG als bekanntgemacht gilt, ihren Anspruch nach Grund und Höhe schriftlich anmelden, Sicherheit zu leisten, soweit sie nicht Befriedigung verlangen können. Dieses Recht steht den Gläubigern jedoch nur zu, wenn sie glaubhaft machen, dass durch die Ausgliederung die Erfüllung ihrer Forderung gefährdet wird."
    },
    {
      "date": "2025-09-12",
      "id": "129168",
      "original_text": "Löschungsankündigung\nNordrhein-Westfalen Amtsgericht Neuss HRB 23555\nKolonium GmbH – Hasbergen",
      "type": "Löschungsankündigung",
      "state": "Nordrhein-Westfalen",
      "amtsgericht": "Amtsgericht Neuss",
      "registernummer": "HRB 23555",
      "registerart": "HRB",
      "company_name": "Kolonium GmbH",
      "company_seat": "Hasbergen",
      "details": "12.09.2025 (Bekanntmachungsdatum)\n\nNordrhein-Westfalen Amtsgericht Neuss HRB 23555\nLöschungsankündigung 08.09.2025 (Eintragungsdatum)\n\nKolonium GmbH\nGesellschaft mit beschränkter Haftung\nHasbergen\n\nBeschluss: In der Handelsregistersache: Kolonium GmbH, Rheiner Landstr. 19, 49205 Hasbergen wird das Löschungsverfahren eingestellt. Gründe: Nachdem im vorliegenden Amtslöschungsverfahren bislang davon auszugehen war, dass der Geschäftsführer der Gesellschaft unbekannten Aufenthaltes ist, erscheinen jetzt insoweit weitere Ermittlungen von Amts wegen geboten. Diese können aufgrund erfolgten Sitzwechsels der Gesellschaft vom das Verfahren abgebenden Gericht nicht mehr durchgeführt werden."
    },
    {
      "date": "2025-09-12",
      "id": "129169",
      "original_text": "Löschungsankündigung\nNordrhein-Westfalen Amtsgericht Düsseldorf HRA 21143\nHotel Schicklerstrasse Berlin GmbH & Co. KG – Düsseldorf",
      "type": "Löschungsankündigung",
      "state": "Nordrhein-Westfalen",
      "amtsgericht": "Amtsgericht Düsseldorf",
      "registernummer": "HRA 21143",
      "registerart": "HRA",
      "company_name": "Hotel Schicklerstrasse Berlin GmbH & Co. KG",
      "company_seat": "Düsseldorf",
      "details": "12.09.2025 (Bekanntmachungsdatum)\n\nNordrhein-Westfalen Amtsgericht Düsseldorf HRA 21143\nLöschungsankündigung\n\nHotel Schicklerstrasse Berlin GmbH & Co. KG\nKommanditgesellschaft\nDüsseldorf\n\nDas Registergericht beabsichtigt die Firma von Amts wegen nach § 394 FamFG zu löschen. Die Frist zur Erhebung eines Widerspruchs ist auf 3 Wochen festgesetzt.\n\nRechtsbehelfsbelehrung:\nDas Widerspruchsrecht steht jedem zu, der an der Unterlassung der Löschung ein berechtigtes Interesse hat. Der Widerspruch ist bei dem Amtsgericht Düsseldorf -Registergericht-, Werdener Straße 1, 40227 Düsseldorf schriftlich in deutscher Sprache oder zur Niederschrift der Geschäftsstelle einzulegen. Der Widerspruch kann auch zur Niederschrift der Geschäftsstelle eines jeden Amtsgerichtes abgegeben werden. Die Einlegung ist auch durch Übertragung eines elektronischen Dokuments an die elektronische Poststelle des Gerichts möglich. Das elektronische Dokument muss für die Bearbeitung durch das Gericht geeignet und mit einer qualifizierten elektronischen Signatur der verantwortenden Person versehen sein oder von der verantwortenden Person signiert und auf einem sicheren Übermittlungsweg gemäß § 130a ZPO nach näherer Maßgabe der Verordnung über die technischen Rahmenbedingungen des elektronischen Rechtsverkehrs und über das besondere elektronische Behördenpostfach (BGBl. I, S.3803) eingereicht werden. Weitere Informationen erhalten Sie auf der Internetseite www.justiz.de.\nDer Widerspruch muss spätestens innerhalb der gesetzten Frist nach dem Datum der Bekanntmachung der Löschungsankündigung bei dem Amtsgericht - Registergericht - Düsseldorf eingegangen sein.  Dies gilt auch dann, wenn der Widerspruch zur Niederschrift der Geschäftsstelle eines anderen Amtsgerichtes abgegeben wurde. Die Frist beginnt mit dem Tage der Bekanntmachung der Löschungsankündigung in dem für die Bekanntmachung der Eintragungen in das Handelsregister bestimmten elektronischen Informations- und Kommunikationssystem nach § 10 des Handelsgesetzbuches. Fällt das Ende der Frist auf einen Sonntag, einen allgemeinen Feiertag oder Sonnabend, so endet die Frist mit Ablauf des nächsten Werktages.\nDer Widerspruch muss die Bezeichnung der angefochtenen Löschungsankündigung sowie die Erklärung enthalten, dass Widerspruch gegen diese Löschungsankündigung eingelegt wird. Er ist zu unterzeichnen und soll begründet werden."
    },
    {
      "date": "2025-09-12",
      "id": "129170",
      "original_text": "Registerbekanntmachung nach dem Umwandlungsgesetz\nNordrhein-Westfalen Amtsgericht Mönchengladbach HRB 15216\nHausverwaltung Niederrhein GmbH – Mönchengladbach",
      "type": "Registerbekanntmachung nach dem Umwandlungsgesetz",
      "state": "Nordrhein-Westfalen",
      "amtsgericht": "Amtsgericht Mönchengladbach",
      "registernummer": "HRB 15216",
      "registerart": "HRB",
      "company_name": "Hausverwaltung Niederrhein GmbH",
      "company_seat": "Mönchengladbach",
      "details": "12.09.2025 (Bekanntmachungsdatum)\n\nNordrhein-Westfalen Amtsgericht Mönchengladbach HRB 15216\nRegisterbekanntmachung nach dem Umwandlungsgesetz 12.09.2025 (Eintragungsdatum)\n\nHausverwaltung Niederrhein GmbH\nGesellschaft mit beschränkter Haftung\nMönchengladbach\n\nDen Gläubigern der an der Verschmelzung beteiligten Rechtsträger ist, wenn sie binnen sechs Monaten nach dem Tag, an dem die Eintragung der Verschmelzung in das Register des Sitzes desjenigen Rechtsträgers, dessen Gläubiger sie sind, nach § 19 Absatz 3 UmwG als bekanntgemacht gilt, ihren Anspruch nach Grund und Höhe schriftlich anmelden, Sicherheit zu leisten, soweit sie nicht Befriedigung verlangen können. Dieses Recht steht den Gläubigern jedoch nur zu, wenn sie glaubhaft machen, dass durch die Verschmelzung die Erfüllung ihrer Forderung gefährdet wird."
    },
    {
      "date": "2025-09-12",
      "id": "129171",
      "original_text": "Registerbekanntmachung nach dem Umwandlungsgesetz\nNordrhein-Westfalen Amtsgericht Düsseldorf HRB 99956\nLocke and McCloud GmbH – Düsseldorf",
      "type": "Registerbekanntmachung nach dem Umwandlungsgesetz",
      "state": "Nordrhein-Westfalen",
      "amtsgericht": "Amtsgericht Düsseldorf",
      "registernummer": "HRB 99956",
      "registerart": "HRB",
      "company_name": "Locke and McCloud GmbH",
      "company_seat": "Düsseldorf",
      "details": "12.09.2025 (Bekanntmachungsdatum)\n\nNordrhein-Westfalen Amtsgericht Düsseldorf HRB 99956\nRegisterbekanntmachung nach dem Umwandlungsgesetz 12.09.2025 (Eintragungsdatum)\n\nLocke and McCloud GmbH\nGesellschaft mit beschränkter Haftung\nDüsseldorf\n\nDen Gläubigern der an der Verschmelzung beteiligten Rechtsträger ist, wenn sie binnen sechs Monaten nach dem Tag, an dem die Eintragung der Verschmelzung in das Register des Sitzes desjenigen Rechtsträgers, dessen Gläubiger sie sind, nach § 19 Absatz 3 UmwG als bekanntgemacht gilt, ihren Anspruch nach Grund und Höhe schriftlich anmelden, Sicherheit zu leisten, soweit sie nicht Befriedigung verlangen können. Dieses Recht steht den Gläubigern jedoch nur zu, wenn sie glaubhaft machen, dass durch die Verschmelzung die Erfüllung ihrer Forderung gefährdet wird."
    },
    {
      "date": "2025-09-12",
      "id": "129172",
      "original_text": "Registerbekanntmachung nach dem Umwandlungsgesetz\nNordrhein-Westfalen Amtsgericht Mönchengladbach HRB 6540\nIMS Immobilien Management & Service GmbH – Mönchengladbach",
      "type": "Registerbekanntmachung nach dem Umwandlungsgesetz",
      "state": "Nordrhein-Westfalen",
      "amtsgericht": "Amtsgericht Mönchengladbach",
      "registernummer": "HRB 6540",
      "registerart": "HRB",
      "company_name": "IMS Immobilien Management & Service GmbH",
      "company_seat": "Mönchengladbach",
      "details": "12.09.2025 (Bekanntmachungsdatum)\n\nNordrhein-Westfalen Amtsgericht Mönchengladbach HRB 6540\nRegisterbekanntmachung nach dem Umwandlungsgesetz 12.09.2025 (Eintragungsdatum)\n\nIMS Immobilien Management & Service GmbH\nGesellschaft mit beschränkter Haftung\nMönchengladbach\n\nDen Gläubigern der an der Verschmelzung beteiligten Rechtsträger ist, wenn sie binnen sechs Monaten nach dem Tag, an dem die Eintragung der Verschmelzung in das Register des Sitzes desjenigen Rechtsträgers, dessen Gläubiger sie sind, nach § 19 Absatz 3 UmwG als bekanntgemacht gilt, ihren Anspruch nach Grund und Höhe schriftlich anmelden, Sicherheit zu leisten, soweit sie nicht Befriedigung verlangen können. Dieses Recht steht den Gläubigern jedoch nur zu, wenn sie glaubhaft machen, dass durch die Verschmelzung die Erfüllung ihrer Forderung gefährdet wird."
    },
    {
      "date": "2025-09-12",
      "id": "129173",
      "original_text": "Registerbekanntmachung nach dem Umwandlungsgesetz\nNordrhein-Westfalen Amtsgericht Essen HRB 26077\nvan den Borg GmbH – Essen",
      "type": "Registerbekanntmachung nach dem Umwandlungsgesetz",
      "state": "Nordrhein-Westfalen",
      "amtsgericht": "Amtsgericht Essen",
      "registernummer": "HRB 26077",
      "registerart": "HRB",
      "company_name": "van den Borg GmbH",
      "company_seat": "Essen",
      "details": "12.09.2025 (Bekanntmachungsdatum)\n\nNordrhein-Westfalen Amtsgericht Essen HRB 26077\nRegisterbekanntmachung nach dem Umwandlungsgesetz 12.09.2025 (Eintragungsdatum)\n\nvan den Borg GmbH\nGesellschaft mit beschränkter Haftung\nEssen\n\nDen Gläubigern der an der Verschmelzung beteiligten Rechtsträger ist, wenn sie binnen sechs Monaten nach dem Tag, an dem die Eintragung der Verschmelzung in das Register des Sitzes desjenigen Rechtsträgers, dessen Gläubiger sie sind, nach § 19 Absatz 3 UmwG als bekanntgemacht gilt, ihren Anspruch nach Grund und Höhe schriftlich anmelden, Sicherheit zu leisten, soweit sie nicht Befriedigung verlangen können. Dieses Recht steht den Gläubigern jedoch nur zu, wenn sie glaubhaft machen, dass durch die Verschmelzung die Erfüllung ihrer Forderung gefährdet wird."
    },
    {
      "date": "2025-09-12",
      "id": "129174",
      "original_text": "Registerbekanntmachung nach dem Umwandlungsgesetz\nNordrhein-Westfalen Amtsgericht Köln HRB 124716\nFS Animal Health GmbH – Wiehl",
      "type": "Registerbekanntmachung nach dem Umwandlungsgesetz",
      "state": "Nordrhein-Westfalen",
      "amtsgericht": "Amtsgericht Köln",
      "registernummer": "HRB 124716",
      "registerart": "HRB",
      "company_name": "FS Animal Health GmbH",
      "company_seat": "Wiehl",
      "details": "12.09.2025 (Bekanntmachungsdatum)\n\nNordrhein-Westfalen Amtsgericht Köln HRB 124716\nRegisterbekanntmachung nach dem Umwandlungsgesetz 12.09.2025 (Eintragungsdatum)\n\nFS Animal Health GmbH\nGesellschaft mit beschränkter Haftung\nWiehl\n\nDen Gläubigern der an der formwechselnden Umwandlung beteiligten Rechtsträger ist, wenn sie binnen sechs Monaten nach dem Tag, an dem die Eintragung der formwechselnden Umwandlung in das Register des Sitzes desjenigen Rechtsträgers, dessen Gläubiger sie sind, nach § 19 Absatz 3 UmwG als bekanntgemacht gilt, ihren Anspruch nach Grund und Höhe schriftlich anmelden, Sicherheit zu leisten, soweit sie nicht Befriedigung verlangen können. Dieses Recht steht den Gläubigern jedoch nur zu, wenn sie glaubhaft machen, dass durch die formwechselnden Umwandlung die Erfüllung ihrer Forderung gefährdet wird."
    },
    {
      "date": "2025-09-12",
      "id": "129175",
      "original_text": "Löschungsankündigung\nNordrhein-Westfalen Amtsgericht Gelsenkirchen HRB 12421\nPalace UG (haftungsbeschränkt) – Gladbeck",
      "type": "Löschungsankündigung",
      "state": "Nordrhein-Westfalen",
      "amtsgericht": "Amtsgericht Gelsenkirchen",
      "registernummer": "HRB 12421",
      "registerart": "HRB",
      "company_name": "Palace UG (haftungsbeschränkt)",
      "company_seat": "Gladbeck",
      "details": "12.09.2025 (Bekanntmachungsdatum)\n\nNordrhein-Westfalen Amtsgericht Gelsenkirchen HRB 12421\nLöschungsankündigung\n\nPalace UG (haftungsbeschränkt)\nGesellschaft mit beschränkter Haftung\nGladbeck\n\nDas Gericht beabsichtigt, die Gesellschaft Palace UG (haftungsbeschränkt) mit Sitz in Gladbeck, HRB 12421 Amtsgericht Gelsenkirchen, wegen Vermögenslosigkeit zu löschen.\n\nHiermit wird denjenigen, die an der Unterlassung der Löschung ein berechtigtes Interesse haben, gem. § 394 Abs. 2 FamFG Gelegenheit gegeben, gegen dieses Vorhaben binnen eines Monats nach dieser Bekanntmachung Widerspruch einzulegen. Der Widerspruch kann schriftlich oder zu Protokoll der Geschäftsstelle erhoben werden."
    },
    {
      "date": "2025-09-12",
      "id": "129176",
      "original_text": "Registerbekanntmachung nach dem Umwandlungsgesetz\nNordrhein-Westfalen Amtsgericht Köln HRB 40258\nHUTH BESTATTUNGSHAUS GmbH – Pulheim",
      "type": "Registerbekanntmachung nach dem Umwandlungsgesetz",
      "state": "Nordrhein-Westfalen",
      "amtsgericht": "Amtsgericht Köln",
      "registernummer": "HRB 40258",
      "registerart": "HRB",
      "company_name": "HUTH BESTATTUNGSHAUS GmbH",
      "company_seat": "Pulheim",
      "details": "12.09.2025 (Bekanntmachungsdatum)\n\nNordrhein-Westfalen Amtsgericht Köln HRB 40258\nRegisterbekanntmachung nach dem Umwandlungsgesetz 12.09.2025 (Eintragungsdatum)\n\nHUTH BESTATTUNGSHAUS GmbH\nGesellschaft mit beschränkter Haftung\nPulheim\n\nDen Gläubigern der an der Verschmelzung beteiligten Rechtsträger ist, wenn sie binnen sechs Monaten nach dem Tag, an dem die Eintragung der Verschmelzung in das Register des Sitzes desjenigen Rechtsträgers, dessen Gläubiger sie sind, nach § 19 Absatz 3 UmwG als bekanntgemacht gilt, ihren Anspruch nach Grund und Höhe schriftlich anmelden, Sicherheit zu leisten, soweit sie nicht Befriedigung verlangen können. Dieses Recht steht den Gläubigern jedoch nur zu, wenn sie glaubhaft machen, dass durch die Verschmelzung die Erfüllung ihrer Forderung gefährdet wird."
    },
    {
      "date": "2025-09-12",
      "id": "129177",
      "original_text": "Löschungsankündigung\nNordrhein-Westfalen Amtsgericht Bochum HRB 18721\nQut GmbH – Witten",
      "type": "Löschungsankündigung",
      "state": "Nordrhein-Westfalen",
      "amtsgericht": "Amtsgericht Bochum",
      "registernummer": "HRB 18721",
      "registerart": "HRB",
      "company_name": "Qut GmbH",
      "company_seat": "Witten",
      "details": "12.09.2025 (Bekanntmachungsdatum)\n\nNordrhein-Westfalen Amtsgericht Bochum HRB 18721\nLöschungsankündigung 15.09.2025 (Eintragungsdatum)\n\nQut GmbH\nGesellschaft mit beschränkter Haftung\nWitten\n\nDas Registergericht beabsichtigt die Gesellschaft von Amts wegen nach § 394 FamFG zu löschen. Die Frist zur Erhebung eines Widerspruchs ist auf drei Monate festgesetzt."
    },
    {
      "date": "2025-09-12",
      "id": "129178",
      "original_text": "Registerbekanntmachung nach dem Umwandlungsgesetz\nNordrhein-Westfalen Amtsgericht Düsseldorf HRA 28175\nRichard Ahrend e.K. – Düsseldorf",
      "type": "Registerbekanntmachung nach dem Umwandlungsgesetz",
      "state": "Nordrhein-Westfalen",
      "amtsgericht": "Amtsgericht Düsseldorf",
      "registernummer": "HRA 28175",
      "registerart": "HRA",
      "company_name": "Richard Ahrend e.K.",
      "company_seat": "Düsseldorf",
      "details": "12.09.2025 (Bekanntmachungsdatum)\n\nNordrhein-Westfalen Amtsgericht Düsseldorf HRA 28175\nRegisterbekanntmachung nach dem Umwandlungsgesetz 12.09.2025 (Eintragungsdatum)\n\nRichard Ahrend e.K.\nEinzelkaufmann / Einzelkauffrau\nDüsseldorf\n\nDen Gläubigern der an der Ausgliederung beteiligten Rechtsträger ist, wenn sie binnen sechs Monaten nach dem Tag, an dem die Eintragung der Ausgliederung in das Register des Sitzes derjenigen Rechtsträger deren Gläubiger sie sind, nach § 19 Absatz 3 UmwG als bekanntgemacht gilt, ihren Anspruch nach Grund und Höhe schriftlich anmelden, Sicherheit zu leisten, soweit sie nicht Befriedigung verlangen können. Dieses Recht steht den Gläubigern jedoch nur zu, wenn sie glaubhaft machen, dass durch die Ausgliederung die Erfüllung ihrer Forderung gefährdet wird."
    },
    {
      "date": "2025-09-12",
      "id": "129179",
      "original_text": "Löschungsankündigung\nNordrhein-Westfalen Amtsgericht Düsseldorf HRB 99228\nIvadon Trading GmbH – Düsseldorf",
      "type": "Löschungsankündigung",
      "state": "Nordrhein-Westfalen",
      "amtsgericht": "Amtsgericht Düsseldorf",
      "registernummer": "HRB 99228",
      "registerart": "HRB",
      "company_name": "Ivadon Trading GmbH",
      "company_seat": "Düsseldorf",
      "details": "12.09.2025 (Bekanntmachungsdatum)\n\nNordrhein-Westfalen Amtsgericht Düsseldorf HRB 99228\nLöschungsankündigung\n\nIvadon Trading GmbH\nGesellschaft mit beschränkter Haftung\nDüsseldorf\n\nBetr.: Ivadon Trading GmbH, Grafenberger Allee 277-287, 40237 Düsseldorf\n\nDas Registergericht beabsichtigt die Gesellschaft von Amts wegen nach § 394 FamFG zu löschen. Die Frist zur Erhebung eines Widerspruchs ist auf 3 Wochen festgesetzt.\n\nRechtsbehelfsbelehrung:\n\nDas Widerspruchsrecht steht jedem zu, der an der Unterlassung der Löschung ein berechtigtes Interesse hat. Der Widerspruch ist bei dem Amtsgericht Düsseldorf -Registergericht-, Werdener Straße 1, 40227 Düsseldorf schriftlich in deutscher Sprache oder zur Niederschrift der Geschäftsstelle einzulegen. Der Widerspruch kann auch zur Niederschrift der Geschäftsstelle eines jeden Amtsgerichtes abgegeben werden. Die Einlegung ist auch durch Übertragung eines elektronischen Dokuments an die elektronische Poststelle des Gerichts möglich. Das elektronische Dokument muss für die Bearbeitung durch das Gericht geeignet und mit einer qualifizierten elektronischen Signatur der verantwortenden Person versehen sein oder von der verantwortenden Person signiert und auf einem sicheren Übermittlungsweg gemäß § 130a ZPO nach näherer Maßgabe der Verordnung über die technischen Rahmenbedingungen des elektronischen Rechtsverkehrs und über das besondere elektronische Behördenpostfach (BGBl. I, S.3803) eingereicht werden. Weitere Informationen erhalten Sie auf der Internetseite www.justiz.de.\nDer Widerspruch muss spätestens innerhalb der gesetzten Frist nach dem Datum der Bekanntmachung der Löschungsankündigung bei dem Amtsgericht - Registergericht - Düsseldorf eingegangen sein.  Dies gilt auch dann, wenn der Widerspruch zur Niederschrift der Geschäftsstelle eines anderen Amtsgerichtes abgegeben wurde. Die Frist beginnt mit dem Tage der Bekanntmachung der Löschungsankündigung in dem für die Bekanntmachung der Eintragungen in das Handelsregister bestimmten elektronischen Informations- und Kommunikationssystem nach § 10 des Handelsgesetzbuches. Fällt das Ende der Frist auf einen Sonntag, einen allgemeinen Feiertag oder Sonnabend, so endet die Frist mit Ablauf des nächsten Werktages.\nDer Widerspruch muss die Bezeichnung der angefochtenen Löschungsankündigung sowie die Erklärung enthalten, dass Widerspruch gegen diese Löschungsankündigung eingelegt wird. Er ist zu unterzeichnen und soll begründet werden."
    },
    {
      "date": "2025-09-12",
      "id": "129180",
      "original_text": "Registerbekanntmachung nach dem Umwandlungsgesetz\nNordrhein-Westfalen Amtsgericht Köln HRA 38297\nAndreea Bratu e.Kfr. – Köln",
      "type": "Registerbekanntmachung nach dem Umwandlungsgesetz",
      "state": "Nordrhein-Westfalen",
      "amtsgericht": "Amtsgericht Köln",
      "registernummer": "HRA 38297",
      "registerart": "HRA",
      "company_name": "Andreea Bratu e.Kfr.",
      "company_seat": "Köln",
      "details": "12.09.2025 (Bekanntmachungsdatum)\n\nNordrhein-Westfalen Amtsgericht Köln HRA 38297\nRegisterbekanntmachung nach dem Umwandlungsgesetz 12.09.2025 (Eintragungsdatum)\n\nAndreea Bratu e.Kfr.\nEinzelkaufmann / Einzelkauffrau\nKöln\n\nDen Gläubigern der an der Ausgliederung beteiligten Rechtsträger ist, wenn sie binnen sechs Monaten nach dem Tag, an dem die Eintragung der Ausgliederung in das Register des Sitzes derjenigen Rechtsträger deren Gläubiger sie sind, nach § 19 Absatz 3 UmwG als bekanntgemacht gilt, ihren Anspruch nach Grund und Höhe schriftlich anmelden, Sicherheit zu leisten, soweit sie nicht Befriedigung verlangen können. Dieses Recht steht den Gläubigern jedoch nur zu, wenn sie glaubhaft machen, dass durch die Ausgliederung die Erfüllung ihrer Forderung gefährdet wird."
    },
    {
      "date": "2025-09-12",
      "id": "129181",
      "original_text": "Registerbekanntmachung nach dem Umwandlungsgesetz\nNordrhein-Westfalen Amtsgericht Gelsenkirchen HRB 8199\nWilhelm Jaeger Pflasterbau GmbH – Gelsenkirchen",
      "type": "Registerbekanntmachung nach dem Umwandlungsgesetz",
      "state": "Nordrhein-Westfalen",
      "amtsgericht": "Amtsgericht Gelsenkirchen",
      "registernummer": "HRB 8199",
      "registerart": "HRB",
      "company_name": "Wilhelm Jaeger Pflasterbau GmbH",
      "company_seat": "Gelsenkirchen",
      "details": "12.09.2025 (Bekanntmachungsdatum)\n\nNordrhein-Westfalen Amtsgericht Gelsenkirchen HRB 8199\nRegisterbekanntmachung nach dem Umwandlungsgesetz 12.09.2025 (Eintragungsdatum)\n\nWilhelm Jaeger Pflasterbau GmbH\nGesellschaft mit beschränkter Haftung\nGelsenkirchen\n\nDen Gläubigern der an der Verschmelzung beteiligten Rechtsträger ist, wenn sie binnen sechs Monaten nach dem Tag, an dem die Eintragung der Verschmelzung in das Register des Sitzes derjenigen Rechtsträger deren Gläubiger sie sind, nach § 19 Absatz 3 UmwG als bekanntgemacht gilt, ihren Anspruch nach Grund und Höhe schriftlich anmelden, Sicherheit zu leisten, soweit sie nicht Befriedigung verlangen können. Dieses Recht steht den Gläubigern jedoch nur zu, wenn sie glaubhaft machen, dass durch die Verschmelzung die Erfüllung ihrer Forderung gefährdet wird."
    },
    {
      "date": "2025-09-12",
      "id": "129182",
      "original_text": "Registerbekanntmachung nach dem Umwandlungsgesetz\nNordrhein-Westfalen Amtsgericht Köln HRB 97011\nKewes Floristik GmbH – Elsdorf",
      "type": "Registerbekanntmachung nach dem Umwandlungsgesetz",
      "state": "Nordrhein-Westfalen",
      "amtsgericht": "Amtsgericht Köln",
      "registernummer": "HRB 97011",
      "registerart": "HRB",
      "company_name": "Kewes Floristik GmbH",
      "company_seat": "Elsdorf",
      "details": "12.09.2025 (Bekanntmachungsdatum)\n\nNordrhein-Westfalen Amtsgericht Köln HRB 97011\nRegisterbekanntmachung nach dem Umwandlungsgesetz 12.09.2025 (Eintragungsdatum)\n\nKewes Floristik GmbH\nGesellschaft mit beschränkter Haftung\nElsdorf\n\nDen Gläubigern der an der Verschmelzung beteiligten Rechtsträger ist, wenn sie binnen sechs Monaten nach dem Tag, an dem die Eintragung der Verschmelzung in das Register des Sitzes desjenigen Rechtsträgers, dessen Gläubiger sie sind, nach § 19 Absatz 3 UmwG als bekanntgemacht gilt, ihren Anspruch nach Grund und Höhe schriftlich anmelden, Sicherheit zu leisten, soweit sie nicht Befriedigung verlangen können. Dieses Recht steht den Gläubigern jedoch nur zu, wenn sie glaubhaft machen, dass durch die Verschmelzung die Erfüllung ihrer Forderung gefährdet wird."
    },
    {
      "date": "2025-09-12",
      "id": "129183",
      "original_text": "Registerbekanntmachung nach dem Umwandlungsgesetz\nNordrhein-Westfalen Amtsgericht Köln HRB 98145\nPikfine GmbH – Hückeswagen",
      "type": "Registerbekanntmachung nach dem Umwandlungsgesetz",
      "state": "Nordrhein-Westfalen",
      "amtsgericht": "Amtsgericht Köln",
      "registernummer": "HRB 98145",
      "registerart": "HRB",
      "company_name": "Pikfine GmbH",
      "company_seat": "Hückeswagen",
      "details": "12.09.2025 (Bekanntmachungsdatum)\n\nNordrhein-Westfalen Amtsgericht Köln HRB 98145\nRegisterbekanntmachung nach dem Umwandlungsgesetz 12.09.2025 (Eintragungsdatum)\n\nPikfine GmbH\nGesellschaft mit beschränkter Haftung\nHückeswagen\n\nDen Gläubigern der an der formwechselnden Umwandlung beteiligten Rechtsträger ist, wenn sie binnen sechs Monaten nach dem Tag, an dem die Eintragung der formwechselnden Umwandlung in das Register des Sitzes desjenigen Rechtsträgers, dessen Gläubiger sie sind, nach § 19 Absatz 3 UmwG als bekanntgemacht gilt, ihren Anspruch nach Grund und Höhe schriftlich anmelden, Sicherheit zu leisten, soweit sie nicht Befriedigung verlangen können. Dieses Recht steht den Gläubigern jedoch nur zu, wenn sie glaubhaft machen, dass durch die formwechselnden Umwandlung die Erfüllung ihrer Forderung gefährdet wird."
    },
    {
      "date": "2025-09-12",
      "id": "129184",
      "original_text": "Registerbekanntmachung nach dem Umwandlungsgesetz\nNordrhein-Westfalen Amtsgericht Köln HRB 109578\nNature Green NG GmbH – Elsdorf",
      "type": "Registerbekanntmachung nach dem Umwandlungsgesetz",
      "state": "Nordrhein-Westfalen",
      "amtsgericht": "Amtsgericht Köln",
      "registernummer": "HRB 109578",
      "registerart": "HRB",
      "company_name": "Nature Green NG GmbH",
      "company_seat": "Elsdorf",
      "details": "12.09.2025 (Bekanntmachungsdatum)\n\nNordrhein-Westfalen Amtsgericht Köln HRB 109578\nRegisterbekanntmachung nach dem Umwandlungsgesetz 12.09.2025 (Eintragungsdatum)\n\nNature Green NG GmbH\nGesellschaft mit beschränkter Haftung\nElsdorf\n\nDen Gläubigern der an der Verschmelzung beteiligten Rechtsträger ist, wenn sie binnen sechs Monaten nach dem Tag, an dem die Eintragung der Verschmelzung in das Register des Sitzes desjenigen Rechtsträgers, dessen Gläubiger sie sind, nach § 19 Absatz 3 UmwG als bekanntgemacht gilt, ihren Anspruch nach Grund und Höhe schriftlich anmelden, Sicherheit zu leisten, soweit sie nicht Befriedigung verlangen können. Dieses Recht steht den Gläubigern jedoch nur zu, wenn sie glaubhaft machen, dass durch die Verschmelzung die Erfüllung ihrer Forderung gefährdet wird."
    },
    {
      "date": "2025-09-12",
      "id": "129185",
      "original_text": "Registerbekanntmachung nach dem Umwandlungsgesetz\nNordrhein-Westfalen Amtsgericht Siegburg HRB 17182\nAniCura Sankt Augustin GmbH – Sankt Augustin",
      "type": "Registerbekanntmachung nach dem Umwandlungsgesetz",
      "state": "Nordrhein-Westfalen",
      "amtsgericht": "Amtsgericht Siegburg",
      "registernummer": "HRB 17182",
      "registerart": "HRB",
      "company_name": "AniCura Sankt Augustin GmbH",
      "company_seat": "Sankt Augustin",
      "details": "12.09.2025 (Bekanntmachungsdatum)\n\nNordrhein-Westfalen Amtsgericht Siegburg HRB 17182\nRegisterbekanntmachung nach dem Umwandlungsgesetz 12.09.2025 (Eintragungsdatum)\n\nAniCura Sankt Augustin GmbH\nGesellschaft mit beschränkter Haftung\nSankt Augustin\n\nDen Gläubigern der an der Verschmelzung beteiligten Rechtsträger ist, wenn sie binnen sechs Monaten nach dem Tag, an dem die Eintragung der Verschmelzung in das Register des Sitzes desjenigen Rechtsträgers, dessen Gläubiger sie sind, nach § 19 Absatz 3 UmwG als bekanntgemacht gilt, ihren Anspruch nach Grund und Höhe schriftlich anmelden, Sicherheit zu leisten, soweit sie nicht Befriedigung verlangen können. Dieses Recht steht den Gläubigern jedoch nur zu, wenn sie glaubhaft machen, dass durch die Verschmelzung die Erfüllung ihrer Forderung gefährdet wird."
    },
    {
      "date": "2025-09-12",
      "id": "129186",
      "original_text": "Registerbekanntmachung nach dem Umwandlungsgesetz\nNordrhein-Westfalen Amtsgericht Düsseldorf HRB 95273\nLandmarken Deutschland Projekt 1 GmbH – Monheim am Rhein",
      "type": "Registerbekanntmachung nach dem Umwandlungsgesetz",
      "state": "Nordrhein-Westfalen",
      "amtsgericht": "Amtsgericht Düsseldorf",
      "registernummer": "HRB 95273",
      "registerart": "HRB",
      "company_name": "Landmarken Deutschland Projekt 1 GmbH",
      "company_seat": "Monheim am Rhein",
      "details": "12.09.2025 (Bekanntmachungsdatum)\n\nNordrhein-Westfalen Amtsgericht Düsseldorf HRB 95273\nRegisterbekanntmachung nach dem Umwandlungsgesetz 12.09.2025 (Eintragungsdatum)\n\nLandmarken Deutschland Projekt 1 GmbH\nGesellschaft mit beschränkter Haftung\nMonheim am Rhein\n\nDen Gläubigern der an der Verschmelzung beteiligten Rechtsträger ist, wenn sie binnen sechs Monaten nach dem Tag, an dem die Eintragung der Verschmelzung in das Register des Sitzes desjenigen Rechtsträgers, dessen Gläubiger sie sind, nach § 19 Absatz 3 UmwG als bekanntgemacht gilt, ihren Anspruch nach Grund und Höhe schriftlich anmelden, Sicherheit zu leisten, soweit sie nicht Befriedigung verlangen können. Dieses Recht steht den Gläubigern jedoch nur zu, wenn sie glaubhaft machen, dass durch die Verschmelzung die Erfüllung ihrer Forderung gefährdet wird."
    },
    {
      "date": "2025-09-12",
      "id": "129187",
      "original_text": "Registerbekanntmachung nach dem Umwandlungsgesetz\nThüringen Amtsgericht Jena HRB 107081\nB & DT Bürofachhandel und Datentechnik GmbH – Erfurt",
      "type": "Registerbekanntmachung nach dem Umwandlungsgesetz",
      "state": "Thüringen",
      "amtsgericht": "Amtsgericht Jena",
      "registernummer": "HRB 107081",
      "registerart": "HRB",
      "company_name": "B & DT Bürofachhandel und Datentechnik GmbH",
      "company_seat": "Erfurt",
      "details": "12.09.2025 (Bekanntmachungsdatum)\n\nThüringen Amtsgericht Jena HRB 107081\nRegisterbekanntmachung nach dem Umwandlungsgesetz 12.09.2025 (Eintragungsdatum)\n\nB & DT Bürofachhandel und Datentechnik GmbH\nGesellschaft mit beschränkter Haftung\nErfurt\n\nNicht eingetragen: Den Gläubigern der an der Verschmelzung beteiligten Rechtsträger, ist wenn sie binnen sechs Monaten nach dem Tag, an dem die Eintragung der Verschmelzung in das Register des Sitzes desjenigen Rechtsträgers, dessen Gläubiger sie sind,  nach § 19 Abs. 3 UmwG als bekanntgemacht gilt, ihren Anspruch nach Grund und Höhe schriftlich anmelden, Sicherheit zu leisten, soweit sie nicht Befriedigung verlangen können. Dieses Recht steht ihnen jedoch nur zu, wenn sie glaubhaft machen, daß durch die Verschmelzung die Erfüllung ihrer Forderung gefährdet wird."
    },
    {
      "date": "2025-09-12",
      "id": "129188",
      "original_text": "Registerbekanntmachung nach dem Umwandlungsgesetz\nThüringen Amtsgericht Jena HRB 100878\nVOLKER UND WALD GmbH – Erfurt",
      "type": "Registerbekanntmachung nach dem Umwandlungsgesetz",
      "state": "Thüringen",
      "amtsgericht": "Amtsgericht Jena",
      "registernummer": "HRB 100878",
      "registerart": "HRB",
      "company_name": "VOLKER UND WALD GmbH",
      "company_seat": "Erfurt",
      "details": "12.09.2025 (Bekanntmachungsdatum)\n\nThüringen Amtsgericht Jena HRB 100878\nRegisterbekanntmachung nach dem Umwandlungsgesetz 12.09.2025 (Eintragungsdatum)\n\nVOLKER UND WALD GmbH\nGesellschaft mit beschränkter Haftung\nErfurt\n\nNicht eingetragen: Den Gläubigern der an der Verschmelzung beteiligten Rechtsträger, ist wenn sie binnen sechs Monaten nach dem Tag, an dem die Eintragung der Verschmelzung in das Register des Sitzes desjenigen Rechtsträgers, dessen Gläubiger sie sind,  nach § 19 Abs. 3 UmwG als bekanntgemacht gilt, ihren Anspruch nach Grund und Höhe schriftlich anmelden, Sicherheit zu leisten, soweit sie nicht Befriedigung verlangen können. Dieses Recht steht ihnen jedoch nur zu, wenn sie glaubhaft machen, daß durch die Verschmelzung die Erfüllung ihrer Forderung gefährdet wird."
    },
    {
      "date": "2025-09-12",
      "id": "129189",
      "original_text": "Löschungsankündigung\nHessen Amtsgericht Frankfurt am Main HRB 122758\ncomBlu UG (haftungsbeschränkt) – Frankfurt am Main",
      "type": "Löschungsankündigung",
      "state": "Hessen",
      "amtsgericht": "Amtsgericht Frankfurt am Main",
      "registernummer": "HRB 122758",
      "registerart": "HRB",
      "company_name": "comBlu UG (haftungsbeschränkt)",
      "company_seat": "Frankfurt am Main",
      "details": "12.09.2025 (Bekanntmachungsdatum)\n\nHessen Amtsgericht Frankfurt am Main HRB 122758\nLöschungsankündigung\n\ncomBlu UG (haftungsbeschränkt)\nGesellschaft mit beschränkter Haftung\nFrankfurt am Main\n\nEs ist beabsichtigt, die Gesellschaft wegen Vermögenslosigkeit gemäß § 394 FamFG von Amts wegen im Handelsregister zu löschen. Hiergegen kann innerhalb eines Monats nach dieser Veröffentlichung Widerspruch bei dem Amtsgericht Frankfurt am Main eingelegt werden."
    },
    {
      "date": "2025-09-12",
      "id": "129190",
      "original_text": "Registerbekanntmachung nach dem Umwandlungsgesetz\nHessen Amtsgericht Frankfurt am Main HRB 105442\nInnopay DE GmbH – Frankfurt am Main",
      "type": "Registerbekanntmachung nach dem Umwandlungsgesetz",
      "state": "Hessen",
      "amtsgericht": "Amtsgericht Frankfurt am Main",
      "registernummer": "HRB 105442",
      "registerart": "HRB",
      "company_name": "Innopay DE GmbH",
      "company_seat": "Frankfurt am Main",
      "details": "12.09.2025 (Bekanntmachungsdatum)\n\nHessen Amtsgericht Frankfurt am Main HRB 105442\nRegisterbekanntmachung nach dem Umwandlungsgesetz 12.09.2025 (Eintragungsdatum)\n\nInnopay DE GmbH\nGesellschaft mit beschränkter Haftung\nFrankfurt am Main\n\nDen Gläubigern der an der Verschmelzung beteiligten Rechtsträger ist, wenn sie binnen sechs Monaten nach dem Tag, an dem die Eintragung der Verschmelzung in das Register des Sitzes desjenigen Rechtsträgers, dessen Gläubiger sie sind, nach § 19 Absatz 3 UmwG bekannt gemacht worden ist, ihren Anspruch nach Grund und Höhe schriftlich anmelden, Sicherheit zu leisten, soweit sie nicht Befriedigung verlangen können. Dieses Recht steht den Gläubigern jedoch nur zu, wenn sie glaubhaft machen, dass durch die Verschmelzung die Erfüllung ihrer Forderung gefährdet wird."
    },
    {
      "date": "2025-09-12",
      "id": "129191",
      "original_text": "Registerbekanntmachung nach dem Umwandlungsgesetz\nHessen Amtsgericht Frankfurt am Main HRB 110823\nVitalis MEP Verwaltungs GmbH – Frankfurt am Main",
      "type": "Registerbekanntmachung nach dem Umwandlungsgesetz",
      "state": "Hessen",
      "amtsgericht": "Amtsgericht Frankfurt am Main",
      "registernummer": "HRB 110823",
      "registerart": "HRB",
      "company_name": "Vitalis MEP Verwaltungs GmbH",
      "company_seat": "Frankfurt am Main",
      "details": "12.09.2025 (Bekanntmachungsdatum)\n\nHessen Amtsgericht Frankfurt am Main HRB 110823\nRegisterbekanntmachung nach dem Umwandlungsgesetz 12.09.2025 (Eintragungsdatum)\n\nVitalis MEP Verwaltungs GmbH\nGesellschaft mit beschränkter Haftung\nFrankfurt am Main\n\nDen Gläubigern der an der Verschmelzung beteiligten Rechtsträger ist, wenn sie binnen sechs Monaten nach dem Tag, an dem die Eintragung der Verschmelzung in das Register des Sitzes desjenigen Rechtsträgers, dessen Gläubiger sie sind, nach § 19 Absatz 3 UmwG bekannt gemacht worden ist, ihren Anspruch nach Grund und Höhe schriftlich anmelden, Sicherheit zu leisten, soweit sie nicht Befriedigung verlangen können. Dieses Recht steht den Gläubigern jedoch nur zu, wenn sie glaubhaft machen, dass durch die Verschmelzung die Erfüllung ihrer Forderung gefährdet wird."
    },
    {
      "date": "2025-09-12",
      "id": "129192",
      "original_text": "Löschungsankündigung\nHessen Amtsgericht Offenbach am Main HRB 51841\nYA Transport GmbH – Offenbach am Main",
      "type": "Löschungsankündigung",
      "state": "Hessen",
      "amtsgericht": "Amtsgericht Offenbach am Main",
      "registernummer": "HRB 51841",
      "registerart": "HRB",
      "company_name": "YA Transport GmbH",
      "company_seat": "Offenbach am Main",
      "details": "12.09.2025 (Bekanntmachungsdatum)\n\nHessen Amtsgericht Offenbach am Main HRB 51841\nLöschungsankündigung\n\nYA Transport GmbH\nGesellschaft mit beschränkter Haftung\nOffenbach am Main\n\nDas Registergericht beabsichtigt die im Handelsregister eingetragene Gesellschaft von Amts wegen nach § 394 FamFG zu löschen. Die Frist zur Erhebung eines Widerspruchs gegen die beabsichtigte Löschung wird auf 3 Monate festgesetzt."
    },
    {
      "date": "2025-09-12",
      "id": "129193",
      "original_text": "Registerbekanntmachung nach dem Umwandlungsgesetz\nHessen Amtsgericht Frankfurt am Main HRB 123869\nInvesTHOR GmbH – Frankfurt am Main",
      "type": "Registerbekanntmachung nach dem Umwandlungsgesetz",
      "state": "Hessen",
      "amtsgericht": "Amtsgericht Frankfurt am Main",
      "registernummer": "HRB 123869",
      "registerart": "HRB",
      "company_name": "InvesTHOR GmbH",
      "company_seat": "Frankfurt am Main",
      "details": "12.09.2025 (Bekanntmachungsdatum)\n\nHessen Amtsgericht Frankfurt am Main HRB 123869\nRegisterbekanntmachung nach dem Umwandlungsgesetz 12.09.2025 (Eintragungsdatum)\n\nInvesTHOR GmbH\nGesellschaft mit beschränkter Haftung\nFrankfurt am Main\n\nDen Gläubigern der an der Verschmelzung beteiligten Rechtsträger ist, wenn sie binnen sechs Monaten nach dem Tag, an dem die Eintragung der Verschmelzung in das Register des Sitzes desjenigen Rechtsträgers, dessen Gläubiger sie sind, nach § 19 Absatz 3 UmwG bekannt gemacht worden ist, ihren Anspruch nach Grund und Höhe schriftlich anmelden, Sicherheit zu leisten, soweit sie nicht Befriedigung verlangen können. Dieses Recht steht den Gläubigern jedoch nur zu, wenn sie glaubhaft machen, dass durch die Verschmelzung die Erfüllung ihrer Forderung gefährdet wird."
    },
    {
      "date": "2025-09-12",
      "id": "129194",
      "original_text": "Registerbekanntmachung nach dem Umwandlungsgesetz\nHessen Amtsgericht Marburg HRB 6879\nViessmann Solutions & Services GmbH – Allendorf/Eder",
      "type": "Registerbekanntmachung nach dem Umwandlungsgesetz",
      "state": "Hessen",
      "amtsgericht": "Amtsgericht Marburg",
      "registernummer": "HRB 6879",
      "registerart": "HRB",
      "company_name": "Viessmann Solutions & Services GmbH",
      "company_seat": "Allendorf/Eder",
      "details": "12.09.2025 (Bekanntmachungsdatum)\n\nHessen Amtsgericht Marburg HRB 6879\nRegisterbekanntmachung nach dem Umwandlungsgesetz 12.09.2025 (Eintragungsdatum)\n\nViessmann Solutions & Services GmbH\nGesellschaft mit beschränkter Haftung\nAllendorf/Eder\n\nDen Gläubigern der an der Verschmelzung beteiligten Rechtsträger ist, wenn sie binnen sechs Monaten nach dem Tag, an dem die Eintragung der Verschmelzung in das Register des Sitzes desjenigen Rechtsträgers, dessen Gläubiger sie sind, nach § 19 Absatz 3 UmwG bekannt gemacht worden ist, ihren Anspruch nach Grund und Höhe schriftlich anmelden, Sicherheit zu leisten, soweit sie nicht Befriedigung verlangen können. Dieses Recht steht den Gläubigern jedoch nur zu, wenn sie glaubhaft machen, dass durch die Verschmelzung die Erfüllung ihrer Forderung gefährdet wird."
    },
    {
      "date": "2025-09-12",
      "id": "129195",
      "original_text": "Registerbekanntmachung nach dem Umwandlungsgesetz\nHessen Amtsgericht Frankfurt am Main HRB 127195\nCockpitpersonal GmbH – Frankfurt am Main",
      "type": "Registerbekanntmachung nach dem Umwandlungsgesetz",
      "state": "Hessen",
      "amtsgericht": "Amtsgericht Frankfurt am Main",
      "registernummer": "HRB 127195",
      "registerart": "HRB",
      "company_name": "Cockpitpersonal GmbH",
      "company_seat": "Frankfurt am Main",
      "details": "12.09.2025 (Bekanntmachungsdatum)\n\nHessen Amtsgericht Frankfurt am Main HRB 127195\nRegisterbekanntmachung nach dem Umwandlungsgesetz 12.09.2025 (Eintragungsdatum)\n\nCockpitpersonal GmbH\nGesellschaft mit beschränkter Haftung\nFrankfurt am Main\n\nDen Gläubigern der an der Verschmelzung beteiligten Rechtsträger ist, wenn sie binnen sechs Monaten nach dem Tag, an dem die Eintragung der Verschmelzung in das Register des Sitzes desjenigen Rechtsträgers, dessen Gläubiger sie sind, nach § 19 Absatz 3 UmwG bekannt gemacht worden ist, ihren Anspruch nach Grund und Höhe schriftlich anmelden, Sicherheit zu leisten, soweit sie nicht Befriedigung verlangen können. Dieses Recht steht den Gläubigern jedoch nur zu, wenn sie glaubhaft machen, dass durch die Verschmelzung die Erfüllung ihrer Forderung gefährdet wird."
    },
    {
      "date": "2025-09-12",
      "id": "129196",
      "original_text": "Sonstige Registerbekanntmachung\nHessen Amtsgericht Frankfurt am Main HRB 126720\nfirstcolo Holding GmbH – Frankfurt am Main",
      "type": "Sonstige Registerbekanntmachung",
      "state": "Hessen",
      "amtsgericht": "Amtsgericht Frankfurt am Main",
      "registernummer": "HRB 126720",
      "registerart": "HRB",
      "company_name": "firstcolo Holding GmbH",
      "company_seat": "Frankfurt am Main",
      "details": "12.09.2025 (Bekanntmachungsdatum)\n\nHessen Amtsgericht Frankfurt am Main HRB 126720\nSonstige Registerbekanntmachung\n\nfirstcolo Holding GmbH\nGesellschaft mit beschränkter Haftung\nFrankfurt am Main\n\nDurch eine Änderung in den Personen der Aufsichtsratsmitglieder ist eine Liste der Mitglieder des Aufsichtsrates zum Handelsregister eingereicht worden."
    },
    {
      "date": "2025-09-12",
      "id": "129197",
      "original_text": "Registerbekanntmachung nach dem Umwandlungsgesetz\nHessen Amtsgericht Frankfurt am Main HRB 122229\nGEG UT Fondsverwaltungs GmbH – Frankfurt am Main",
      "type": "Registerbekanntmachung nach dem Umwandlungsgesetz",
      "state": "Hessen",
      "amtsgericht": "Amtsgericht Frankfurt am Main",
      "registernummer": "HRB 122229",
      "registerart": "HRB",
      "company_name": "GEG UT Fondsverwaltungs GmbH",
      "company_seat": "Frankfurt am Main",
      "details": "12.09.2025 (Bekanntmachungsdatum)\n\nHessen Amtsgericht Frankfurt am Main HRB 122229\nRegisterbekanntmachung nach dem Umwandlungsgesetz 12.09.2025 (Eintragungsdatum)\n\nGEG UT Fondsverwaltungs GmbH\nGesellschaft mit beschränkter Haftung\nFrankfurt am Main\n\nDen Gläubigern der an der Verschmelzung beteiligten Rechtsträger ist, wenn sie binnen sechs Monaten nach dem Tag, an dem die Eintragung der Verschmelzung in das Register des Sitzes desjenigen Rechtsträgers, dessen Gläubiger sie sind, nach § 19 Absatz 3 UmwG bekannt gemacht worden ist, ihren Anspruch nach Grund und Höhe schriftlich anmelden, Sicherheit zu leisten, soweit sie nicht Befriedigung verlangen können. Dieses Recht steht den Gläubigern jedoch nur zu, wenn sie glaubhaft machen, dass durch die Verschmelzung die Erfüllung ihrer Forderung gefährdet wird."
    },
    {
      "date": "2025-09-12",
      "id": "129198",
      "original_text": "Einreichung neuer Dokumente\nHessen Amtsgericht Frankfurt am Main HRB 10798\nVermögensverwaltungs- und Treuhandgesellschaft der Arbeitsgemeinschaft deutscher Lehrerverbände, Gesellschaft mit beschränkter Haftung – Frankfurt am Main",
      "type": "Einreichung neuer Dokumente",
      "state": "Hessen",
      "amtsgericht": "Amtsgericht Frankfurt am Main",
      "registernummer": "HRB 10798",
      "registerart": "HRB",
      "company_name": "Vermögensverwaltungs- und Treuhandgesellschaft der Arbeitsgemeinschaft deutscher Lehrerverbände, Gesellschaft mit beschränkter Haftung",
      "company_seat": "Frankfurt am Main",
      "details": "12.09.2025 (Bekanntmachungsdatum)\n\nHessen Amtsgericht Frankfurt am Main HRB 10798\nEinreichung neuer Dokumente 12.09.2025 (Eintragungsdatum)\n\nVermögensverwaltungs- und Treuhandgesellschaft der Arbeitsgemeinschaft deutscher Lehrerverbände, Gesellschaft mit beschränkter Haftung\nGesellschaft mit beschränkter Haftung\nFrankfurt am Main\n\nDurch eine Änderung in den Personen der Aufsichtsratsmitglieder ist eine Liste der Mitglieder des Aufsichtsrates zum Handelsregister eingereicht worden."
    },
    {
      "date": "2025-09-12",
      "id": "129199",
      "original_text": "Registerbekanntmachung nach dem Umwandlungsgesetz\nHessen Amtsgericht Frankfurt am Main HRB 110824\nVitalis MEP Warehouse GmbH – Frankfurt am Main",
      "type": "Registerbekanntmachung nach dem Umwandlungsgesetz",
      "state": "Hessen",
      "amtsgericht": "Amtsgericht Frankfurt am Main",
      "registernummer": "HRB 110824",
      "registerart": "HRB",
      "company_name": "Vitalis MEP Warehouse GmbH",
      "company_seat": "Frankfurt am Main",
      "details": "12.09.2025 (Bekanntmachungsdatum)\n\nHessen Amtsgericht Frankfurt am Main HRB 110824\nRegisterbekanntmachung nach dem Umwandlungsgesetz 12.09.2025 (Eintragungsdatum)\n\nVitalis MEP Warehouse GmbH\nGesellschaft mit beschränkter Haftung\nFrankfurt am Main\n\nDen Gläubigern der an der Verschmelzung beteiligten Rechtsträger ist, wenn sie binnen sechs Monaten nach dem Tag, an dem die Eintragung der Verschmelzung in das Register des Sitzes desjenigen Rechtsträgers, dessen Gläubiger sie sind, nach § 19 Absatz 3 UmwG bekannt gemacht worden ist, ihren Anspruch nach Grund und Höhe schriftlich anmelden, Sicherheit zu leisten, soweit sie nicht Befriedigung verlangen können. Dieses Recht steht den Gläubigern jedoch nur zu, wenn sie glaubhaft machen, dass durch die Verschmelzung die Erfüllung ihrer Forderung gefährdet wird."
    },
    {
      "date": "2025-09-12",
      "id": "129200",
      "original_text": "Einreichung neuer Dokumente\nHessen Amtsgericht Wiesbaden HRB 17601\nR + V Lebensversicherung a.G. – Eltville am Rhein",
      "type": "Einreichung neuer Dokumente",
      "state": "Hessen",
      "amtsgericht": "Amtsgericht Wiesbaden",
      "registernummer": "HRB 17601",
      "registerart": "HRB",
      "company_name": "R + V Lebensversicherung a.G.",
      "company_seat": "Eltville am Rhein",
      "details": "12.09.2025 (Bekanntmachungsdatum)\n\nHessen Amtsgericht Wiesbaden HRB 17601\nEinreichung neuer Dokumente 12.09.2025 (Eintragungsdatum)\n\nR + V Lebensversicherung a.G.\nVersicherungsverein auf Gegenseitigkeit\nEltville am Rhein\n\nDurch eine Änderung in den Personen der Aufsichtsratsmitglieder ist eine Liste der Mitglieder des Aufsichtsrates zum Handelsregister eingereicht worden."
    },
    {
      "date": "2025-09-12",
      "id": "129201",
      "original_text": "Registerbekanntmachung nach dem Umwandlungsgesetz\nHessen Amtsgericht Frankfurt am Main HRB 125874\navirtually UG (haftungsbeschränkt) – Frankfurt am Main",
      "type": "Registerbekanntmachung nach dem Umwandlungsgesetz",
      "state": "Hessen",
      "amtsgericht": "Amtsgericht Frankfurt am Main",
      "registernummer": "HRB 125874",
      "registerart": "HRB",
      "company_name": "avirtually UG (haftungsbeschränkt)",
      "company_seat": "Frankfurt am Main",
      "details": "12.09.2025 (Bekanntmachungsdatum)\n\nHessen Amtsgericht Frankfurt am Main HRB 125874\nRegisterbekanntmachung nach dem Umwandlungsgesetz 12.09.2025 (Eintragungsdatum)\n\navirtually UG (haftungsbeschränkt)\nGesellschaft mit beschränkter Haftung\nFrankfurt am Main\n\nDen Gläubigern der an der Verschmelzung beteiligten Rechtsträger ist, wenn sie binnen sechs Monaten nach dem Tag, an dem die Eintragung der Verschmelzung in das Register des Sitzes desjenigen Rechtsträgers, dessen Gläubiger sie sind, nach § 19 Absatz 3 UmwG bekannt gemacht worden ist, ihren Anspruch nach Grund und Höhe schriftlich anmelden, Sicherheit zu leisten, soweit sie nicht Befriedigung verlangen können. Dieses Recht steht den Gläubigern jedoch nur zu, wenn sie glaubhaft machen, dass durch die Verschmelzung die Erfüllung ihrer Forderung gefährdet wird."
    },
    {
      "date": "2025-09-12",
      "id": "129202",
      "original_text": "Registerbekanntmachung nach dem Umwandlungsgesetz\nHessen Amtsgericht Frankfurt am Main HRA 51522\nDIC Asset Portfolio GmbH & Co. KG – Frankfurt am Main",
      "type": "Registerbekanntmachung nach dem Umwandlungsgesetz",
      "state": "Hessen",
      "amtsgericht": "Amtsgericht Frankfurt am Main",
      "registernummer": "HRA 51522",
      "registerart": "HRA",
      "company_name": "DIC Asset Portfolio GmbH & Co. KG",
      "company_seat": "Frankfurt am Main",
      "details": "12.09.2025 (Bekanntmachungsdatum)\n\nHessen Amtsgericht Frankfurt am Main HRA 51522\nRegisterbekanntmachung nach dem Umwandlungsgesetz 12.09.2025 (Eintragungsdatum)\n\nDIC Asset Portfolio GmbH & Co. KG\nKommanditgesellschaft\nFrankfurt am Main\n\nDen Gläubigern der an der Verschmelzung beteiligten Rechtsträger ist, wenn sie binnen sechs Monaten nach dem Tag, an dem die Eintragung der Verschmelzung in das Register des Sitzes desjenigen Rechtsträgers, dessen Gläubiger sie sind, nach § 19 Absatz 3 UmwG bekannt gemacht worden ist, ihren Anspruch nach Grund und Höhe schriftlich anmelden, Sicherheit zu leisten, soweit sie nicht Befriedigung verlangen können. Dieses Recht steht den Gläubigern jedoch nur zu, wenn sie glaubhaft machen, dass durch die Verschmelzung die Erfüllung ihrer Forderung gefährdet wird."
    },
    {
      "date": "2025-09-12",
      "id": "129203",
      "original_text": "Löschungsankündigung\nHessen Amtsgericht Frankfurt am Main HRB 117130\nPyramid Sun Verwaltungs UG (haftungsbeschränkt) – Eschborn",
      "type": "Löschungsankündigung",
      "state": "Hessen",
      "amtsgericht": "Amtsgericht Frankfurt am Main",
      "registernummer": "HRB 117130",
      "registerart": "HRB",
      "company_name": "Pyramid Sun Verwaltungs UG (haftungsbeschränkt)",
      "company_seat": "Eschborn",
      "details": "12.09.2025 (Bekanntmachungsdatum)\n\nHessen Amtsgericht Frankfurt am Main HRB 117130\nLöschungsankündigung\n\nPyramid Sun Verwaltungs UG (haftungsbeschränkt)\nGesellschaft mit beschränkter Haftung\nEschborn\n\nDas Registergericht beabsichtigt die im Handelsregister eingetragene Gesellschaft von Amts wegen nach § 394 FamFG zu löschen. Die Frist zur Erhebung eines Widerspruchs gegen die beabsichtigte Löschung wird auf 1 Monat festgesetzt."
    },
    {
      "date": "2025-09-12",
      "id": "129204",
      "original_text": "Löschungsankündigung\nHessen Amtsgericht Frankfurt am Main HRB 128414\nBEGEL GmbH – Frankfurt am Main",
      "type": "Löschungsankündigung",
      "state": "Hessen",
      "amtsgericht": "Amtsgericht Frankfurt am Main",
      "registernummer": "HRB 128414",
      "registerart": "HRB",
      "company_name": "BEGEL GmbH",
      "company_seat": "Frankfurt am Main",
      "details": "12.09.2025 (Bekanntmachungsdatum)\n\nHessen Amtsgericht Frankfurt am Main HRB 128414\nLöschungsankündigung\n\nBEGEL GmbH\nGesellschaft mit beschränkter Haftung\nFrankfurt am Main\n\nDas Registergericht beabsichtigt die im Handelsregister eingetragene Gesellschaft von Amts wegen nach § 394 FamFG zu löschen. Die Frist zur Erhebung eines Widerspruchs gegen die beabsichtigte Löschung wird auf 3 Monate festgesetzt."
    }
  ]
}