{
  "date": "2025-09-24",
  "date_of_scrape": "2025-10-27T15:24:09.825Z",
  "tool_version": "0.2.0",
  "number_of_announcements": 228,
  "announcements": [
    {
      "date": "2025-09-24",
      "id": "131125",
      "original_text": "Löschungsankündigung\nBayern Amtsgericht Bayreuth VR 200623\nyouTreff e.V. – Weidenberg",
      "type": "Löschungsankündigung",
      "state": "Bayern",
      "amtsgericht": "Amtsgericht Bayreuth",
      "registernummer": "VR 200623",
      "registerart": "VR",
      "company_name": "youTreff e.V.",
      "company_seat": "Weidenberg",
      "details": "24.09.2025 (Bekanntmachungsdatum)\n\nBayern Amtsgericht Bayreuth VR 200623\nLöschungsankündigung\n\nyouTreff e.V.\neingetragener Verein\nWeidenberg\n\nDas Registergericht beabsichtigt, den im Vereinsregister eingetragenen Verein von Amts wegen nach § 395 FamFG zu löschen. Die Frist zur Erhebung eines Widerspruchs ist auf einen Monat festgesetzt."
    },
    {
      "date": "2025-09-24",
      "id": "131126",
      "original_text": "Registerbekanntmachung nach dem Umwandlungsgesetz\nBayern Amtsgericht München HRB 282939\nFoundation Point GmbH – München",
      "type": "Registerbekanntmachung nach dem Umwandlungsgesetz",
      "state": "Bayern",
      "amtsgericht": "Amtsgericht München",
      "registernummer": "HRB 282939",
      "registerart": "HRB",
      "company_name": "Foundation Point GmbH",
      "company_seat": "München",
      "details": "24.09.2025 (Bekanntmachungsdatum)\n\nBayern Amtsgericht München HRB 282939\nRegisterbekanntmachung nach dem Umwandlungsgesetz 23.09.2025 (Eintragungsdatum)\n\nFoundation Point GmbH\nGesellschaft mit beschränkter Haftung\nMünchen\n\nDen Gläubigern der an der Verschmelzung beteiligten Rechtsträger ist, wenn sie binnen sechs Monaten nach dem Tag, an dem die Eintragung der Verschmelzung in das Register des Sitzes desjenigen Rechtsträgers, dessen Gläubiger sie sind, nach § 19 Abs. 3 UmwG als bekannt gemacht gilt, ihren Anspruch nach Grund und Höhe in Textform anmelden, Sicherheit zu leisten, soweit sie nicht Befriedigung verlangen können. Dieses Recht steht den Gläubigern jedoch nur zu, wenn sie glaubhaft machen, dass durch die Verschmelzung die Erfüllung ihrer Forderung gefährdet wird."
    },
    {
      "date": "2025-09-24",
      "id": "131127",
      "original_text": "Einreichung neuer Dokumente\nBayern Amtsgericht München HRB 118634\nCompuSafe Data Systems Aktiengesellschaft – München",
      "type": "Einreichung neuer Dokumente",
      "state": "Bayern",
      "amtsgericht": "Amtsgericht München",
      "registernummer": "HRB 118634",
      "registerart": "HRB",
      "company_name": "CompuSafe Data Systems Aktiengesellschaft",
      "company_seat": "München",
      "details": "24.09.2025 (Bekanntmachungsdatum)\n\nBayern Amtsgericht München HRB 118634\nEinreichung neuer Dokumente\n\nCompuSafe Data Systems Aktiengesellschaft\nAktiengesellschaft\nMünchen\n\nDem Amtsgericht München -Registergericht- ist eine Liste der Mitglieder des Aufsichtsrats eingereicht worden, § 106 AktG."
    },
    {
      "date": "2025-09-24",
      "id": "131128",
      "original_text": "Registerbekanntmachung nach dem Umwandlungsgesetz\nBayern Amtsgericht Nürnberg HRB 24726\nFeser-Joachim Automobil GmbH – Roth",
      "type": "Registerbekanntmachung nach dem Umwandlungsgesetz",
      "state": "Bayern",
      "amtsgericht": "Amtsgericht Nürnberg",
      "registernummer": "HRB 24726",
      "registerart": "HRB",
      "company_name": "Feser-Joachim Automobil GmbH",
      "company_seat": "Roth",
      "details": "24.09.2025 (Bekanntmachungsdatum)\n\nBayern Amtsgericht Nürnberg HRB 24726\nRegisterbekanntmachung nach dem Umwandlungsgesetz 23.09.2025 (Eintragungsdatum)\n\nFeser-Joachim Automobil GmbH\nGesellschaft mit beschränkter Haftung\nRoth\n\nDen Gläubigern der an der Verschmelzung beteiligten Rechtsträger ist, wenn sie binnen sechs Monaten nach dem Tag, an dem die Eintragung der Verschmelzung in das Register des Sitzes desjenigen Rechtsträgers, dessen Gläubiger sie sind, nach § 19 Abs. 3 UmwG als bekannt gemacht gilt, ihren Anspruch nach Grund und Höhe in Textform anmelden, Sicherheit zu leisten, soweit sie nicht Befriedigung verlangen können. Dieses Recht steht den Gläubigern jedoch nur zu, wenn sie glaubhaft machen, dass durch die Verschmelzung die Erfüllung ihrer Forderung gefährdet wird."
    },
    {
      "date": "2025-09-24",
      "id": "131129",
      "original_text": "Registerbekanntmachung nach dem Umwandlungsgesetz\nBayern Amtsgericht Nürnberg HRB 25560\nFeser-Graf Roth GmbH – Roth",
      "type": "Registerbekanntmachung nach dem Umwandlungsgesetz",
      "state": "Bayern",
      "amtsgericht": "Amtsgericht Nürnberg",
      "registernummer": "HRB 25560",
      "registerart": "HRB",
      "company_name": "Feser-Graf Roth GmbH",
      "company_seat": "Roth",
      "details": "24.09.2025 (Bekanntmachungsdatum)\n\nBayern Amtsgericht Nürnberg HRB 25560\nRegisterbekanntmachung nach dem Umwandlungsgesetz 23.09.2025 (Eintragungsdatum)\n\nFeser-Graf Roth GmbH\nGesellschaft mit beschränkter Haftung\nRoth\n\nDen Gläubigern der an der Verschmelzung beteiligten Rechtsträger ist, wenn sie binnen sechs Monaten nach dem Tag, an dem die Eintragung der Verschmelzung in das Register des Sitzes desjenigen Rechtsträgers, dessen Gläubiger sie sind, nach § 19 Abs. 3 UmwG als bekannt gemacht gilt, ihren Anspruch nach Grund und Höhe in Textform anmelden, Sicherheit zu leisten, soweit sie nicht Befriedigung verlangen können. Dieses Recht steht den Gläubigern jedoch nur zu, wenn sie glaubhaft machen, dass durch die Verschmelzung die Erfüllung ihrer Forderung gefährdet wird."
    },
    {
      "date": "2025-09-24",
      "id": "131130",
      "original_text": "Registerbekanntmachung nach dem Umwandlungsgesetz\nBayern Amtsgericht München HRB 297254\nGandalv GmbH – München",
      "type": "Registerbekanntmachung nach dem Umwandlungsgesetz",
      "state": "Bayern",
      "amtsgericht": "Amtsgericht München",
      "registernummer": "HRB 297254",
      "registerart": "HRB",
      "company_name": "Gandalv GmbH",
      "company_seat": "München",
      "details": "24.09.2025 (Bekanntmachungsdatum)\n\nBayern Amtsgericht München HRB 297254\nRegisterbekanntmachung nach dem Umwandlungsgesetz 23.09.2025 (Eintragungsdatum)\n\nGandalv GmbH\nGesellschaft mit beschränkter Haftung\nMünchen\n\nDen Gläubigern der an der Verschmelzung beteiligten Rechtsträger ist, wenn sie binnen sechs Monaten nach dem Tag, an dem die Eintragung der Verschmelzung in das Register des Sitzes desjenigen Rechtsträgers, dessen Gläubiger sie sind, nach § 19 Abs. 3 UmwG als bekannt gemacht gilt, ihren Anspruch nach Grund und Höhe in Textform anmelden, Sicherheit zu leisten, soweit sie nicht Befriedigung verlangen können. Dieses Recht steht den Gläubigern jedoch nur zu, wenn sie glaubhaft machen, dass durch die Verschmelzung die Erfüllung ihrer Forderung gefährdet wird."
    },
    {
      "date": "2025-09-24",
      "id": "131131",
      "original_text": "Registerbekanntmachung nach dem Umwandlungsgesetz\nBayern Amtsgericht München HRB 305313\nE. Hönninger Bauunternehmung GmbH – Kirchseeon",
      "type": "Registerbekanntmachung nach dem Umwandlungsgesetz",
      "state": "Bayern",
      "amtsgericht": "Amtsgericht München",
      "registernummer": "HRB 305313",
      "registerart": "HRB",
      "company_name": "E. Hönninger Bauunternehmung GmbH",
      "company_seat": "Kirchseeon",
      "details": "24.09.2025 (Bekanntmachungsdatum)\n\nBayern Amtsgericht München HRB 305313\nRegisterbekanntmachung nach dem Umwandlungsgesetz 23.09.2025 (Eintragungsdatum)\n\nE. Hönninger Bauunternehmung GmbH\nGesellschaft mit beschränkter Haftung\nKirchseeon\n\nDen Gläubigern der an der Ausgliederung beteiligten Rechtsträger ist, wenn sie binnen sechs Monaten nach dem Tag, an dem die Eintragung der Ausgliederung in das Register des Sitzes desjenigen Rechtsträgers, dessen Gläubiger sie sind, nach §§ 125, 19 Abs. 3 UmwG als bekannt gemacht gilt, ihren Anspruch nach Grund und Höhe in Textform anmelden, Sicherheit zu leisten, soweit sie nicht Befriedigung verlangen können. Dieses Recht steht den Gläubigern jedoch nur zu, wenn sie glaubhaft machen, dass durch die Ausgliederung die Erfüllung ihrer Forderung gefährdet wird."
    },
    {
      "date": "2025-09-24",
      "id": "131132",
      "original_text": "Registerbekanntmachung nach dem Umwandlungsgesetz\nBayern Amtsgericht Coburg HRB 4581\nBauer Gaststätten Betriebs GmbH – Wilhelmsthal-OT Steinberg",
      "type": "Registerbekanntmachung nach dem Umwandlungsgesetz",
      "state": "Bayern",
      "amtsgericht": "Amtsgericht Coburg",
      "registernummer": "HRB 4581",
      "registerart": "HRB",
      "company_name": "Bauer Gaststätten Betriebs GmbH",
      "company_seat": "Wilhelmsthal-OT Steinberg",
      "details": "24.09.2025 (Bekanntmachungsdatum)\n\nBayern Amtsgericht Coburg HRB 4581\nRegisterbekanntmachung nach dem Umwandlungsgesetz 22.09.2025 (Eintragungsdatum)\n\nBauer Gaststätten Betriebs GmbH\nGesellschaft mit beschränkter Haftung\nWilhelmsthal-OT Steinberg\n\nDen Gläubigern der an der Verschmelzung beteiligten Rechtsträger ist, wenn sie binnen sechs Monaten nach dem Tag, an dem die Eintragung der Verschmelzung in das Register des Sitzes desjenigen Rechtsträgers, dessen Gläubiger sie sind, nach § 19 Abs. 3 UmwG als bekannt gemacht gilt, ihren Anspruch nach Grund und Höhe in Textform anmelden, Sicherheit zu leisten, soweit sie nicht Befriedigung verlangen können. Dieses Recht steht den Gläubigern jedoch nur zu, wenn sie glaubhaft machen, dass durch die Verschmelzung die Erfüllung ihrer Forderung gefährdet wird."
    },
    {
      "date": "2025-09-24",
      "id": "131133",
      "original_text": "Registerbekanntmachung nach dem Umwandlungsgesetz\nBayern Amtsgericht München HRB 195739\nANDRIC GmbH – München",
      "type": "Registerbekanntmachung nach dem Umwandlungsgesetz",
      "state": "Bayern",
      "amtsgericht": "Amtsgericht München",
      "registernummer": "HRB 195739",
      "registerart": "HRB",
      "company_name": "ANDRIC GmbH",
      "company_seat": "München",
      "details": "24.09.2025 (Bekanntmachungsdatum)\n\nBayern Amtsgericht München HRB 195739\nRegisterbekanntmachung nach dem Umwandlungsgesetz 23.09.2025 (Eintragungsdatum)\n\nANDRIC GmbH\nGesellschaft mit beschränkter Haftung\nMünchen\n\nDen Gläubigern der an der Verschmelzung beteiligten Rechtsträger ist, wenn sie binnen sechs Monaten nach dem Tag, an dem die Eintragung der Verschmelzung in das Register des Sitzes desjenigen Rechtsträgers, dessen Gläubiger sie sind, nach § 19 Abs. 3 UmwG als bekannt gemacht gilt, ihren Anspruch nach Grund und Höhe in Textform anmelden, Sicherheit zu leisten, soweit sie nicht Befriedigung verlangen können. Dieses Recht steht den Gläubigern jedoch nur zu, wenn sie glaubhaft machen, dass durch die Verschmelzung die Erfüllung ihrer Forderung gefährdet wird."
    },
    {
      "date": "2025-09-24",
      "id": "131134",
      "original_text": "Registerbekanntmachung nach dem Umwandlungsgesetz\nBayern Amtsgericht Amberg HRB 7872\nruoka GmbH – Kümmersbruck",
      "type": "Registerbekanntmachung nach dem Umwandlungsgesetz",
      "state": "Bayern",
      "amtsgericht": "Amtsgericht Amberg",
      "registernummer": "HRB 7872",
      "registerart": "HRB",
      "company_name": "ruoka GmbH",
      "company_seat": "Kümmersbruck",
      "details": "24.09.2025 (Bekanntmachungsdatum)\n\nBayern Amtsgericht Amberg HRB 7872\nRegisterbekanntmachung nach dem Umwandlungsgesetz 23.09.2025 (Eintragungsdatum)\n\nruoka GmbH\nGesellschaft mit beschränkter Haftung\nKümmersbruck\n\nDen Gläubigern der an der Verschmelzung beteiligten Rechtsträger ist, wenn sie binnen sechs Monaten nach dem Tag, an dem die Eintragung der Verschmelzung in das Register des Sitzes desjenigen Rechtsträgers, dessen Gläubiger sie sind, nach § 19 Abs. 3 UmwG als bekannt gemacht gilt, ihren Anspruch nach Grund und Höhe in Textform anmelden, Sicherheit zu leisten, soweit sie nicht Befriedigung verlangen können. Dieses Recht steht den Gläubigern jedoch nur zu, wenn sie glaubhaft machen, dass durch die Verschmelzung die Erfüllung ihrer Forderung gefährdet wird."
    },
    {
      "date": "2025-09-24",
      "id": "131135",
      "original_text": "Registerbekanntmachung nach dem Umwandlungsgesetz\nBayern Amtsgericht Nürnberg HRB 45011\nAnkom Connect GmbH – Nürnberg",
      "type": "Registerbekanntmachung nach dem Umwandlungsgesetz",
      "state": "Bayern",
      "amtsgericht": "Amtsgericht Nürnberg",
      "registernummer": "HRB 45011",
      "registerart": "HRB",
      "company_name": "Ankom Connect GmbH",
      "company_seat": "Nürnberg",
      "details": "24.09.2025 (Bekanntmachungsdatum)\n\nBayern Amtsgericht Nürnberg HRB 45011\nRegisterbekanntmachung nach dem Umwandlungsgesetz 23.09.2025 (Eintragungsdatum)\n\nAnkom Connect GmbH\nGesellschaft mit beschränkter Haftung\nNürnberg\n\nDen Gläubigern der an der Ausgliederung beteiligten Rechtsträger ist, wenn sie binnen sechs Monaten nach dem Tag, an dem die Eintragung der Ausgliederung in das Register des Sitzes desjenigen Rechtsträgers, dessen Gläubiger sie sind, nach §§ 125, 19 Abs. 3 UmwG als bekannt gemacht gilt, ihren Anspruch nach Grund und Höhe in Textform anmelden, Sicherheit zu leisten, soweit sie nicht Befriedigung verlangen können. Dieses Recht steht den Gläubigern jedoch nur zu, wenn sie glaubhaft machen, dass durch die Ausgliederung die Erfüllung ihrer Forderung gefährdet wird."
    },
    {
      "date": "2025-09-24",
      "id": "131136",
      "original_text": "Einreichung neuer Dokumente\nBayern Amtsgericht München HRB 5553\nWWK Allgemeine Versicherung Aktiengesellschaft – München",
      "type": "Einreichung neuer Dokumente",
      "state": "Bayern",
      "amtsgericht": "Amtsgericht München",
      "registernummer": "HRB 5553",
      "registerart": "HRB",
      "company_name": "WWK Allgemeine Versicherung Aktiengesellschaft",
      "company_seat": "München",
      "details": "24.09.2025 (Bekanntmachungsdatum)\n\nBayern Amtsgericht München HRB 5553\nEinreichung neuer Dokumente 23.09.2025 (Eintragungsdatum)\n\nWWK Allgemeine Versicherung Aktiengesellschaft\nAktiengesellschaft\nMünchen\n\nDem Amtsgericht München -Registergericht- ist eine Liste der Mitglieder des Aufsichtsrats eingereicht worden, § 106 AktG."
    },
    {
      "date": "2025-09-24",
      "id": "131137",
      "original_text": "Registerbekanntmachung nach dem Umwandlungsgesetz\nBayern Amtsgericht Amberg HRB 7834\nFelix Söllner holding GmbH – Kümmersbruck",
      "type": "Registerbekanntmachung nach dem Umwandlungsgesetz",
      "state": "Bayern",
      "amtsgericht": "Amtsgericht Amberg",
      "registernummer": "HRB 7834",
      "registerart": "HRB",
      "company_name": "Felix Söllner holding GmbH",
      "company_seat": "Kümmersbruck",
      "details": "24.09.2025 (Bekanntmachungsdatum)\n\nBayern Amtsgericht Amberg HRB 7834\nRegisterbekanntmachung nach dem Umwandlungsgesetz 23.09.2025 (Eintragungsdatum)\n\nFelix Söllner holding GmbH\nGesellschaft mit beschränkter Haftung\nKümmersbruck\n\nDen Gläubigern der an der Verschmelzung beteiligten Rechtsträger ist, wenn sie binnen sechs Monaten nach dem Tag, an dem die Eintragung der Verschmelzung in das Register des Sitzes desjenigen Rechtsträgers, dessen Gläubiger sie sind, nach § 19 Abs. 3 UmwG als bekannt gemacht gilt, ihren Anspruch nach Grund und Höhe in Textform anmelden, Sicherheit zu leisten, soweit sie nicht Befriedigung verlangen können. Dieses Recht steht den Gläubigern jedoch nur zu, wenn sie glaubhaft machen, dass durch die Verschmelzung die Erfüllung ihrer Forderung gefährdet wird."
    },
    {
      "date": "2025-09-24",
      "id": "131138",
      "original_text": "Einreichung neuer Dokumente\nBayern Amtsgericht Augsburg HRB 80\nWALTER Beteiligungen und Immobilien AG – Augsburg",
      "type": "Einreichung neuer Dokumente",
      "state": "Bayern",
      "amtsgericht": "Amtsgericht Augsburg",
      "registernummer": "HRB 80",
      "registerart": "HRB",
      "company_name": "WALTER Beteiligungen und Immobilien AG",
      "company_seat": "Augsburg",
      "details": "24.09.2025 (Bekanntmachungsdatum)\n\nBayern Amtsgericht Augsburg HRB 80\nEinreichung neuer Dokumente 23.09.2025 (Eintragungsdatum)\n\nWALTER Beteiligungen und Immobilien AG\nAktiengesellschaft\nAugsburg\n\nDem Amtsgericht Augsburg -Registergericht- ist eine Liste der Mitglieder des Aufsichtsrats eingereicht worden, § 106 AktG."
    },
    {
      "date": "2025-09-24",
      "id": "131139",
      "original_text": "Registerbekanntmachung nach dem Umwandlungsgesetz\nBayern Amtsgericht München HRB 226477\nPHÖNIX - Haus Silberdistel - Alten u. Pflegeheim GmbH – München",
      "type": "Registerbekanntmachung nach dem Umwandlungsgesetz",
      "state": "Bayern",
      "amtsgericht": "Amtsgericht München",
      "registernummer": "HRB 226477",
      "registerart": "HRB",
      "company_name": "PHÖNIX - Haus Silberdistel - Alten u. Pflegeheim GmbH",
      "company_seat": "München",
      "details": "24.09.2025 (Bekanntmachungsdatum)\n\nBayern Amtsgericht München HRB 226477\nRegisterbekanntmachung nach dem Umwandlungsgesetz 23.09.2025 (Eintragungsdatum)\n\nPHÖNIX - Haus Silberdistel - Alten u. Pflegeheim GmbH\nGesellschaft mit beschränkter Haftung\nMünchen\n\nDen Gläubigern der an der Verschmelzung beteiligten Rechtsträger ist, wenn sie binnen sechs Monaten nach dem Tag, an dem die Eintragung der Verschmelzung in das Register des Sitzes desjenigen Rechtsträgers, dessen Gläubiger sie sind, nach § 19 Abs. 3 UmwG als bekannt gemacht gilt, ihren Anspruch nach Grund und Höhe in Textform anmelden, Sicherheit zu leisten, soweit sie nicht Befriedigung verlangen können. Dieses Recht steht den Gläubigern jedoch nur zu, wenn sie glaubhaft machen, dass durch die Verschmelzung die Erfüllung ihrer Forderung gefährdet wird."
    },
    {
      "date": "2025-09-24",
      "id": "131140",
      "original_text": "Sonstige Registerbekanntmachung\nBayern Amtsgericht Fürth HRB 13085\nPUMA SE – Herzogenaurach",
      "type": "Sonstige Registerbekanntmachung",
      "state": "Bayern",
      "amtsgericht": "Amtsgericht Fürth",
      "registernummer": "HRB 13085",
      "registerart": "HRB",
      "company_name": "PUMA SE",
      "company_seat": "Herzogenaurach",
      "details": "24.09.2025 (Bekanntmachungsdatum)\n\nBayern Amtsgericht Fürth HRB 13085\nSonstige Registerbekanntmachung 23.09.2025 (Eintragungsdatum)\n\nPUMA SE\nEuropäische Aktiengesellschaft (SE)\nHerzogenaurach\n\nDen Gläubigern der Gesellschaft, deren Forderungen begründet worden sind, bevor die Eintragung des Beschlusses bekanntgemacht worden ist, ist, wenn sie sich binnen sechs Monaten nach der Bekanntmachung zu diesem Zweck melden, Sicherheit zu leisten, soweit sie nicht Befriedigung verlangen können. Das Recht, Sicherheitsleistung zu verlangen, steht Gläubigern nicht zu, die im Fall des Insolvenzverfahrens ein Recht auf vorzugsweise Befriedigung aus einer Deckungsmasse haben, die nach gesetzlicher Vorschrift zu ihrem Schutz errichtet und staatlich überwacht ist."
    },
    {
      "date": "2025-09-24",
      "id": "131141",
      "original_text": "Registerbekanntmachung nach dem Umwandlungsgesetz\nBayern Amtsgericht München HRB 275673\nKorian Deutschland GmbH – München",
      "type": "Registerbekanntmachung nach dem Umwandlungsgesetz",
      "state": "Bayern",
      "amtsgericht": "Amtsgericht München",
      "registernummer": "HRB 275673",
      "registerart": "HRB",
      "company_name": "Korian Deutschland GmbH",
      "company_seat": "München",
      "details": "24.09.2025 (Bekanntmachungsdatum)\n\nBayern Amtsgericht München HRB 275673\nRegisterbekanntmachung nach dem Umwandlungsgesetz 23.09.2025 (Eintragungsdatum)\n\nKorian Deutschland GmbH\nGesellschaft mit beschränkter Haftung\nMünchen\n\nDen Gläubigern der an der Verschmelzung beteiligten Rechtsträger ist, wenn sie binnen sechs Monaten nach dem Tag, an dem die Eintragung der Verschmelzung in das Register des Sitzes desjenigen Rechtsträgers, dessen Gläubiger sie sind, nach § 19 Abs. 3 UmwG als bekannt gemacht gilt, ihren Anspruch nach Grund und Höhe in Textform anmelden, Sicherheit zu leisten, soweit sie nicht Befriedigung verlangen können. Dieses Recht steht den Gläubigern jedoch nur zu, wenn sie glaubhaft machen, dass durch die Verschmelzung die Erfüllung ihrer Forderung gefährdet wird."
    },
    {
      "date": "2025-09-24",
      "id": "131142",
      "original_text": "Registerbekanntmachung nach dem Umwandlungsgesetz\nBayern Amtsgericht München HRB 295656\nBlitz 24-893 SE – München",
      "type": "Registerbekanntmachung nach dem Umwandlungsgesetz",
      "state": "Bayern",
      "amtsgericht": "Amtsgericht München",
      "registernummer": "HRB 295656",
      "registerart": "HRB",
      "company_name": "Blitz 24-893 SE",
      "company_seat": "München",
      "details": "24.09.2025 (Bekanntmachungsdatum)\n\nBayern Amtsgericht München HRB 295656\nRegisterbekanntmachung nach dem Umwandlungsgesetz 23.09.2025 (Eintragungsdatum)\n\nBlitz 24-893 SE\nEuropäische Aktiengesellschaft (SE)\nMünchen\n\nDen Gläubigern der an der Verschmelzung beteiligten Rechtsträger ist, wenn sie binnen sechs Monaten nach dem Tag, an dem die Eintragung der Verschmelzung in das Register des Sitzes desjenigen Rechtsträgers, dessen Gläubiger sie sind, nach § 19 Abs. 3 UmwG als bekannt gemacht gilt, ihren Anspruch nach Grund und Höhe in Textform anmelden, Sicherheit zu leisten, soweit sie nicht Befriedigung verlangen können. Dieses Recht steht den Gläubigern jedoch nur zu, wenn sie glaubhaft machen, dass durch die Verschmelzung die Erfüllung ihrer Forderung gefährdet wird."
    },
    {
      "date": "2025-09-24",
      "id": "131143",
      "original_text": "Löschungsankündigung\nBayern Amtsgericht Nürnberg HRB 9934\nIntervisa Beteiligung und Verwaltung GmbH – Nürnberg",
      "type": "Löschungsankündigung",
      "state": "Bayern",
      "amtsgericht": "Amtsgericht Nürnberg",
      "registernummer": "HRB 9934",
      "registerart": "HRB",
      "company_name": "Intervisa Beteiligung und Verwaltung GmbH",
      "company_seat": "Nürnberg",
      "details": "24.09.2025 (Bekanntmachungsdatum)\n\nBayern Amtsgericht Nürnberg HRB 9934\nLöschungsankündigung\n\nIntervisa Beteiligung und Verwaltung GmbH\nGesellschaft mit beschränkter Haftung\nNürnberg\n\nDas Registergericht beabsichtigt, die im Handelsregister eingetragene Gesellschaft wegen Vermögenslosigkeit von Amts wegen nach § 394 FamFG zu löschen. Die Frist zur Erhebung eines Widerspruchs ist auf einen Monat festgesetzt."
    },
    {
      "date": "2025-09-24",
      "id": "131144",
      "original_text": "Löschungsankündigung\nBayern Amtsgericht Fürth HRB 9017\nSanitätshaus Peterreins GmbH – Uffenheim",
      "type": "Löschungsankündigung",
      "state": "Bayern",
      "amtsgericht": "Amtsgericht Fürth",
      "registernummer": "HRB 9017",
      "registerart": "HRB",
      "company_name": "Sanitätshaus Peterreins GmbH",
      "company_seat": "Uffenheim",
      "details": "24.09.2025 (Bekanntmachungsdatum)\n\nBayern Amtsgericht Fürth HRB 9017\nLöschungsankündigung 23.09.2025 (Eintragungsdatum)\n\nSanitätshaus Peterreins GmbH\nGesellschaft mit beschränkter Haftung\nUffenheim\n\nDas Registergericht beabsichtigt, die im Handelsregister eingetragene Gesellschaft wegen Vermögenslosigkeit von Amts wegen nach § 394 FamFG zu löschen. Die Frist zur Erhebung eines Widerspruchs ist auf drei Monate festgesetzt."
    },
    {
      "date": "2025-09-24",
      "id": "131145",
      "original_text": "Einreichung neuer Dokumente\nBayern Amtsgericht München HRB 151905\nMM FARM AG – München",
      "type": "Einreichung neuer Dokumente",
      "state": "Bayern",
      "amtsgericht": "Amtsgericht München",
      "registernummer": "HRB 151905",
      "registerart": "HRB",
      "company_name": "MM FARM AG",
      "company_seat": "München",
      "details": "24.09.2025 (Bekanntmachungsdatum)\n\nBayern Amtsgericht München HRB 151905\nEinreichung neuer Dokumente 23.09.2025 (Eintragungsdatum)\n\nMM FARM AG\nAktiengesellschaft\nMünchen\n\nDem Amtsgericht München -Registergericht- ist eine Liste der Mitglieder des Aufsichtsrats eingereicht worden, § 106 AktG."
    },
    {
      "date": "2025-09-24",
      "id": "131146",
      "original_text": "Löschungsankündigung\nBayern Amtsgericht München HRB 250901\nSaubermann Lebensmittelhygiene GmbH – Fraunberg",
      "type": "Löschungsankündigung",
      "state": "Bayern",
      "amtsgericht": "Amtsgericht München",
      "registernummer": "HRB 250901",
      "registerart": "HRB",
      "company_name": "Saubermann Lebensmittelhygiene GmbH",
      "company_seat": "Fraunberg",
      "details": "24.09.2025 (Bekanntmachungsdatum)\n\nBayern Amtsgericht München HRB 250901\nLöschungsankündigung 23.09.2025 (Eintragungsdatum)\n\nSaubermann Lebensmittelhygiene GmbH\nGesellschaft mit beschränkter Haftung\nFraunberg\n\nDas Registergericht beabsichtigt, die im Handelsregister eingetragene Gesellschaft wegen Vermögenslosigkeit von Amts wegen nach § 394 FamFG zu löschen. Die Frist zur Erhebung eines Widerspruchs ist auf drei Monate festgesetzt."
    },
    {
      "date": "2025-09-24",
      "id": "131147",
      "original_text": "Registerbekanntmachung nach dem Umwandlungsgesetz\nBayern Amtsgericht München HRB 231657\nRay Sono AG – München",
      "type": "Registerbekanntmachung nach dem Umwandlungsgesetz",
      "state": "Bayern",
      "amtsgericht": "Amtsgericht München",
      "registernummer": "HRB 231657",
      "registerart": "HRB",
      "company_name": "Ray Sono AG",
      "company_seat": "München",
      "details": "24.09.2025 (Bekanntmachungsdatum)\n\nBayern Amtsgericht München HRB 231657\nRegisterbekanntmachung nach dem Umwandlungsgesetz 23.09.2025 (Eintragungsdatum)\n\nRay Sono AG\nAktiengesellschaft\nMünchen\n\nDen Gläubigern des formwechselnden Rechtsträgers ist, wenn sie binnen sechs Monaten nach dem Tag, an dem die Eintragung des Formwechsels nach § 201 UmwG als bekannt gemacht gilt, ihren Anspruch nach Grund und Höhe in Textform anmelden, Sicherheit zu leisten, soweit sie nicht Befriedigung verlangen können. Dieses Recht steht den Gläubigern jedoch nur zu, wenn sie glaubhaft machen, dass durch den Formwechsel die Erfüllung ihrer Forderung gefährdet wird."
    },
    {
      "date": "2025-09-24",
      "id": "131148",
      "original_text": "Registerbekanntmachung nach dem Umwandlungsgesetz\nBayern Amtsgericht München HRB 190424\nPGNiG Supply & Trading GmbH – München",
      "type": "Registerbekanntmachung nach dem Umwandlungsgesetz",
      "state": "Bayern",
      "amtsgericht": "Amtsgericht München",
      "registernummer": "HRB 190424",
      "registerart": "HRB",
      "company_name": "PGNiG Supply & Trading GmbH",
      "company_seat": "München",
      "details": "24.09.2025 (Bekanntmachungsdatum)\n\nBayern Amtsgericht München HRB 190424\nRegisterbekanntmachung nach dem Umwandlungsgesetz 23.09.2025 (Eintragungsdatum)\n\nPGNiG Supply & Trading GmbH\nGesellschaft mit beschränkter Haftung\nMünchen\n\nDen Gläubigern der an der Verschmelzung beteiligten Rechtsträger ist, wenn sie binnen sechs Monaten nach dem Tag, an dem die Eintragung der Verschmelzung in das Register des Sitzes desjenigen Rechtsträgers, dessen Gläubiger sie sind, nach § 19 Abs. 3 UmwG als bekannt gemacht gilt, ihren Anspruch nach Grund und Höhe in Textform anmelden, Sicherheit zu leisten, soweit sie nicht Befriedigung verlangen können. Dieses Recht steht den Gläubigern jedoch nur zu, wenn sie glaubhaft machen, dass durch die Verschmelzung die Erfüllung ihrer Forderung gefährdet wird."
    },
    {
      "date": "2025-09-24",
      "id": "131149",
      "original_text": "Registerbekanntmachung nach dem Umwandlungsgesetz\nBayern Amtsgericht Nürnberg HRA 20400\nAyhan Communikations e.K. – Nürnberg",
      "type": "Registerbekanntmachung nach dem Umwandlungsgesetz",
      "state": "Bayern",
      "amtsgericht": "Amtsgericht Nürnberg",
      "registernummer": "HRA 20400",
      "registerart": "HRA",
      "company_name": "Ayhan Communikations e.K.",
      "company_seat": "Nürnberg",
      "details": "24.09.2025 (Bekanntmachungsdatum)\n\nBayern Amtsgericht Nürnberg HRA 20400\nRegisterbekanntmachung nach dem Umwandlungsgesetz 23.09.2025 (Eintragungsdatum)\n\nAyhan Communikations e.K.\nEinzelkaufmann / Einzelkauffrau\nNürnberg\n\nDen Gläubigern der an der Ausgliederung beteiligten Rechtsträger ist, wenn sie binnen sechs Monaten nach dem Tag, an dem die Eintragung der Ausgliederung in das Register des Sitzes desjenigen Rechtsträgers, dessen Gläubiger sie sind, nach §§ 125, 19 Abs. 3 UmwG als bekannt gemacht gilt, ihren Anspruch nach Grund und Höhe in Textform anmelden, Sicherheit zu leisten, soweit sie nicht Befriedigung verlangen können. Dieses Recht steht den Gläubigern jedoch nur zu, wenn sie glaubhaft machen, dass durch die Ausgliederung die Erfüllung ihrer Forderung gefährdet wird."
    },
    {
      "date": "2025-09-24",
      "id": "131150",
      "original_text": "Registerbekanntmachung nach dem Umwandlungsgesetz\nBaden-Württemberg Amtsgericht Stuttgart HRB 797263\nNeckarsee 621. V V GmbH – Bietigheim-Bissingen",
      "type": "Registerbekanntmachung nach dem Umwandlungsgesetz",
      "state": "Baden-Württemberg",
      "amtsgericht": "Amtsgericht Stuttgart",
      "registernummer": "HRB 797263",
      "registerart": "HRB",
      "company_name": "Neckarsee 621. V V GmbH",
      "company_seat": "Bietigheim-Bissingen",
      "details": "24.09.2025 (Bekanntmachungsdatum)\n\nBaden-Württemberg Amtsgericht Stuttgart HRB 797263\nRegisterbekanntmachung nach dem Umwandlungsgesetz 24.09.2025 (Eintragungsdatum)\n\nNeckarsee 621. V V GmbH\nGesellschaft mit beschränkter Haftung\nBietigheim-Bissingen\n\nAls nicht eingetragen wird bekanntgemacht:\nDen Gläubigern der an der Verschmelzung beteiligten Rechtsträger ist, wenn sie binnen sechs Monaten nach dem Tag, an dem die Eintragung der Verschmelzung in das Register des Sitzes desjenigen Rechtsträgers, dessen Gläubiger sie sind, nach § 19 Abs. 3 UmwG als bekanntgemacht gilt, ihren Anspruch nach Grund und Höhe schriftlich anmelden, Sicherheit zu leisten, soweit sie nicht Befriedigung verlangen können. Dieses Recht steht den Gläubigern jedoch nur zu, wenn sie glaubhaft machen, dass durch die Verschmelzung die Erfüllung ihrer Forderung gefährdet wird."
    },
    {
      "date": "2025-09-24",
      "id": "131151",
      "original_text": "Registerbekanntmachung nach dem Umwandlungsgesetz\nBerlin Amtsgericht Berlin (Charlottenburg) HRB 209919\ngranberry GmbH – Berlin",
      "type": "Registerbekanntmachung nach dem Umwandlungsgesetz",
      "state": "Berlin",
      "amtsgericht": "Amtsgericht Berlin (Charlottenburg)",
      "registernummer": "HRB 209919",
      "registerart": "HRB",
      "company_name": "granberry GmbH",
      "company_seat": "Berlin",
      "details": "24.09.2025 (Bekanntmachungsdatum)\n\nBerlin Amtsgericht Berlin (Charlottenburg) HRB 209919\nRegisterbekanntmachung nach dem Umwandlungsgesetz 23.09.2025 (Eintragungsdatum)\n\ngranberry GmbH\nGesellschaft mit beschränkter Haftung\nBerlin\n\nZu Eintragungsnummer 7 vom 23.09.2025 wird als nicht eingetragen veröffentlicht:\nDen Gläubigern der an der Verschmelzung beteiligten Rechtsträger ist, wenn sie binnen sechs Monaten nach dem Tag, an dem die Eintragung der Verschmelzung in das Register des Sitzes desjenigen Rechtsträgers, dessen Gläubiger sie sind, als bekannt gemacht gilt, ihren Anspruch nach Grund und Höhe schriftlich anmelden, Sicherheit zu leisten, soweit sie nicht Befriedigung verlangen können. Dieses Recht steht den Gläubigern jedoch nur zu, wenn sie glaubhaft machen, dass durch die Verschmelzung die Erfüllung ihrer Forderung gefährdet wird. Das Recht, Sicherheitsleistung zu verlangen, steht Gläubigern nicht zu, die im Falle der Insolvenz ein Recht auf vorzugsweise Befriedigung aus einer Deckungsmasse haben, die nach gesetzlicher Vorschrift zu ihrem Schutz errichtet und staatlich überwacht ist."
    },
    {
      "date": "2025-09-24",
      "id": "131152",
      "original_text": "Sonstige Registerbekanntmachung\nBrandenburg Amtsgericht Neuruppin HRB 14328\nDachdeckerei Rau GmbH – Velten",
      "type": "Sonstige Registerbekanntmachung",
      "state": "Brandenburg",
      "amtsgericht": "Amtsgericht Neuruppin",
      "registernummer": "HRB 14328",
      "registerart": "HRB",
      "company_name": "Dachdeckerei Rau GmbH",
      "company_seat": "Velten",
      "details": "24.09.2025 (Bekanntmachungsdatum)\n\nBrandenburg Amtsgericht Neuruppin HRB 14328\nSonstige Registerbekanntmachung 23.09.2025 (Eintragungsdatum)\n\nDachdeckerei Rau GmbH\nGesellschaft mit beschränkter Haftung\nVelten\n\nDie vermögenslose Gesellschaft ist auf Grund des § 394 FamFG von Amts wegen gelöscht."
    },
    {
      "date": "2025-09-24",
      "id": "131153",
      "original_text": "Registerbekanntmachung nach dem Umwandlungsgesetz\nBaden-Württemberg Amtsgericht Stuttgart HRA 730465\nhestomed+helbig Medizintechnik GmbH & Co. KG – Widdern",
      "type": "Registerbekanntmachung nach dem Umwandlungsgesetz",
      "state": "Baden-Württemberg",
      "amtsgericht": "Amtsgericht Stuttgart",
      "registernummer": "HRA 730465",
      "registerart": "HRA",
      "company_name": "hestomed+helbig Medizintechnik GmbH & Co. KG",
      "company_seat": "Widdern",
      "details": "24.09.2025 (Bekanntmachungsdatum)\n\nBaden-Württemberg Amtsgericht Stuttgart HRA 730465\nRegisterbekanntmachung nach dem Umwandlungsgesetz 24.09.2025 (Eintragungsdatum)\n\nhestomed+helbig Medizintechnik GmbH & Co. KG\nKommanditgesellschaft\nWiddern\n\nDen Gläubigern der an der Verschmelzung beteiligten Rechtsträger ist, wenn sie binnen sechs Monaten nach dem Tag, an dem die Eintragung der Verschmelzung in das Register des Sitzes desjenigen Rechtsträgers, dessen Gläubiger sie sind, nach § 19 Abs. 3 UmwG als bekanntgemacht gilt, ihren Anspruch nach Grund und Höhe schriftlich anmelden, Sicherheit zu leisten, soweit sie nicht Befriedigung verlangen können. Dieses Recht steht den Gläubigern jedoch nur zu, wenn sie glaubhaft machen, dass durch die Verschmelzung die Erfüllung ihrer Forderung gefährdet wird."
    },
    {
      "date": "2025-09-24",
      "id": "131154",
      "original_text": "Löschungsankündigung\nSaarland Amtsgericht Saarbrücken HRB 106314\nreset Verwaltungs GmbH – Eppelborn",
      "type": "Löschungsankündigung",
      "state": "Saarland",
      "amtsgericht": "Amtsgericht Saarbrücken",
      "registernummer": "HRB 106314",
      "registerart": "HRB",
      "company_name": "reset Verwaltungs GmbH",
      "company_seat": "Eppelborn",
      "details": "24.09.2025 (Bekanntmachungsdatum)\n\nSaarland Amtsgericht Saarbrücken HRB 106314\nLöschungsankündigung\n\nreset Verwaltungs GmbH\nGesellschaft mit beschränkter Haftung\nEppelborn\n\nEs ist beabsichtigt, die Gesellschaft von Amts wegen gemäß § 394 FamFG wegen Vermögenslosigkeit zu löschen.\nGegen die Löschung von Amts wegen ist das Rechtsmittel des Widerspruchs statthaft. Der Widerspruch ist binnen einer Frist zwei Monaten beginnend mit dem Tag dieser Veröffentlichung durch Einreichen eines Widerspruchsschreibens -schriftlich oder zur Niederschrift der Geschäftsstelle beim Amtsgericht Saarbrücken, -zentrales Handelsregister-, Mainzer Str.178, 66121 Saarbrücken einzulegen.\nDer Widerspruch muss die Bezeichnung der angefochtenen Löschungsankündigung enthalten sowie die Erklärung, dass Widerspruch eingelegt wird. Er ist vom Widerspruchsführer oder seinem Bevollmächtigten zu unterzeichnen.\nDas Widerspruchsschreiben kann auch in der Form eines elektronischen Dokumentes eingereicht werden, das mit einer qualifizierten elektronischen Signatur nach dem Signaturgesetz versehen sein muss (§§ 14 Abs. 2 FamFG, 130a, 298 ZPO)."
    },
    {
      "date": "2025-09-24",
      "id": "131155",
      "original_text": "Löschungsankündigung\nBerlin Amtsgericht Berlin (Charlottenburg) HRB 159944\nVeneno Handelsgesellschaft mbH – Berlin",
      "type": "Löschungsankündigung",
      "state": "Berlin",
      "amtsgericht": "Amtsgericht Berlin (Charlottenburg)",
      "registernummer": "HRB 159944",
      "registerart": "HRB",
      "company_name": "Veneno Handelsgesellschaft mbH",
      "company_seat": "Berlin",
      "details": "24.09.2025 (Bekanntmachungsdatum)\n\nBerlin Amtsgericht Berlin (Charlottenburg) HRB 159944\nLöschungsankündigung\n\nVeneno Handelsgesellschaft mbH\nGesellschaft mit beschränkter Haftung\nBerlin\n\nBei der nachstehenden Gesellschaft wird das Amtslöschungsverfahren gemäß § 394 FamFG eingeleitet. Widerspruchsfrist 6 Wochen"
    },
    {
      "date": "2025-09-24",
      "id": "131156",
      "original_text": "Löschungsankündigung\nBerlin Amtsgericht Berlin (Charlottenburg) HRB 250359\nKaiser und Linden Bau GmbH – Berlin",
      "type": "Löschungsankündigung",
      "state": "Berlin",
      "amtsgericht": "Amtsgericht Berlin (Charlottenburg)",
      "registernummer": "HRB 250359",
      "registerart": "HRB",
      "company_name": "Kaiser und Linden Bau GmbH",
      "company_seat": "Berlin",
      "details": "24.09.2025 (Bekanntmachungsdatum)\n\nBerlin Amtsgericht Berlin (Charlottenburg) HRB 250359\nLöschungsankündigung\n\nKaiser und Linden Bau GmbH\nGesellschaft mit beschränkter Haftung\nBerlin\n\nBei der nachstehenden Gesellschaft wird das Amtslöschungsverfahren gemäß § 394 FamFG eingeleitet. Widerspruchsfrist 6 Wochen"
    },
    {
      "date": "2025-09-24",
      "id": "131157",
      "original_text": "Löschungsankündigung\nBerlin Amtsgericht Berlin (Charlottenburg) HRB 211348\nQ-Verwaltung GmbH – Berlin",
      "type": "Löschungsankündigung",
      "state": "Berlin",
      "amtsgericht": "Amtsgericht Berlin (Charlottenburg)",
      "registernummer": "HRB 211348",
      "registerart": "HRB",
      "company_name": "Q-Verwaltung GmbH",
      "company_seat": "Berlin",
      "details": "24.09.2025 (Bekanntmachungsdatum)\n\nBerlin Amtsgericht Berlin (Charlottenburg) HRB 211348\nLöschungsankündigung\n\nQ-Verwaltung GmbH\nGesellschaft mit beschränkter Haftung\nBerlin\n\nBei der nachstehenden Gesellschaft wird das Amtslöschungsverfahren gemäß § 394 FamFG eingeleitet. Widerspruchsfrist 6 Wochen"
    },
    {
      "date": "2025-09-24",
      "id": "131158",
      "original_text": "Löschungsankündigung\nBaden-Württemberg Amtsgericht Freiburg HRB 710737\nsilodom Verwaltung GmbH – Haslach im Kinzigtal",
      "type": "Löschungsankündigung",
      "state": "Baden-Württemberg",
      "amtsgericht": "Amtsgericht Freiburg",
      "registernummer": "HRB 710737",
      "registerart": "HRB",
      "company_name": "silodom Verwaltung GmbH",
      "company_seat": "Haslach im Kinzigtal",
      "details": "24.09.2025 (Bekanntmachungsdatum)\n\nBaden-Württemberg Amtsgericht Freiburg HRB 710737\nLöschungsankündigung\n\nsilodom Verwaltung GmbH\nGesellschaft mit beschränkter Haftung\nHaslach im Kinzigtal\n\nDas Gericht beabsichtigt, die Gesellschaft wegen Vermögenslosigkeit im Handelsregister von Amts wegen nach § 394 FamFG zu löschen. Die Frist zur Geltendmachung eines Widerspruchs gegen die beabsichtigte Löschung ist auf einen Monat ab Veröffentlichung bestimmt."
    },
    {
      "date": "2025-09-24",
      "id": "131159",
      "original_text": "Sonstige Registerbekanntmachung\nMecklenburg-Vorpommern Amtsgericht Neubrandenburg HRB 22499\nKummert & Kummert GmbH – Ferdinandshof",
      "type": "Sonstige Registerbekanntmachung",
      "state": "Mecklenburg-Vorpommern",
      "amtsgericht": "Amtsgericht Neubrandenburg",
      "registernummer": "HRB 22499",
      "registerart": "HRB",
      "company_name": "Kummert & Kummert GmbH",
      "company_seat": "Ferdinandshof",
      "details": "24.09.2025 (Bekanntmachungsdatum)\n\nMecklenburg-Vorpommern Amtsgericht Neubrandenburg HRB 22499\nSonstige Registerbekanntmachung 24.09.2025 (Eintragungsdatum)\n\nKummert & Kummert GmbH\nGesellschaft mit beschränkter Haftung\nFerdinandshof\n\nAls nicht eingetragen wird veröffentlicht: Den Gläubigern der an der Umwandlung beteiligten Rechtsträger ist, wenn sie binnen sechs\nMonaten nach dem Tag, an dem die Eintragung der Umwandlung in das Register des Sitzes desjenigen Rechtsträgers, dessen Gläubiger sie sind, nach § 19 Abs. 3 UmwG als bekannt gemacht gilt, ihren Anspruch nach Grund und Höhe in Textform anmelden, Sicherheit zu leisten, soweit sie nicht Befriedigung verlangen können. Dieses Recht steht den Gläubigern jedoch nur zu, wenn sie glaubhaft machen, dass durch die Umwandlung die Erfüllung der Forderung gefährdet wird."
    },
    {
      "date": "2025-09-24",
      "id": "131160",
      "original_text": "Registerbekanntmachung nach dem Umwandlungsgesetz\nBaden-Württemberg Amtsgericht Mannheim VR 331152\nHaus- und Grundeigentümerverein Bammental und Umgebung e.V. – Bammental",
      "type": "Registerbekanntmachung nach dem Umwandlungsgesetz",
      "state": "Baden-Württemberg",
      "amtsgericht": "Amtsgericht Mannheim",
      "registernummer": "VR 331152",
      "registerart": "VR",
      "company_name": "Haus- und Grundeigentümerverein Bammental und Umgebung e.V.",
      "company_seat": "Bammental",
      "details": "24.09.2025 (Bekanntmachungsdatum)\n\nBaden-Württemberg Amtsgericht Mannheim VR 331152\nRegisterbekanntmachung nach dem Umwandlungsgesetz 24.09.2025 (Eintragungsdatum)\n\nHaus- und Grundeigentümerverein Bammental und Umgebung e.V.\neingetragener Verein\nBammental\n\nDen Gläubigern der an der Verschmelzung beteiligten Rechtsträger ist, wenn sie binnen sechs Monaten nach dem Tag, an dem die Eintragung der Verschmelzung in das Register des Sitzes desjenigen Rechtsträgers, dessen Gläubiger sie sind, nach § 19 Abs. 3 UmwG als bekanntgemacht gilt, ihren Anspruch nach Grund und Höhe schriftlich anmelden, Sicherheit zu leisten, soweit sie nicht Befriedigung verlangen können. Dieses Recht steht den Gläubigern jedoch nur zu, wenn sie glaubhaft machen, dass durch die Verschmelzung die Erfüllung ihrer Forderung gefährdet wird."
    },
    {
      "date": "2025-09-24",
      "id": "131161",
      "original_text": "Registerbekanntmachung nach dem Umwandlungsgesetz\nBaden-Württemberg Amtsgericht Mannheim VR 331138\nHaus & Grund Neckargemünd-Bammental und Umgebung e.V. – Neckargemünd",
      "type": "Registerbekanntmachung nach dem Umwandlungsgesetz",
      "state": "Baden-Württemberg",
      "amtsgericht": "Amtsgericht Mannheim",
      "registernummer": "VR 331138",
      "registerart": "VR",
      "company_name": "Haus & Grund Neckargemünd-Bammental und Umgebung e.V.",
      "company_seat": "Neckargemünd",
      "details": "24.09.2025 (Bekanntmachungsdatum)\n\nBaden-Württemberg Amtsgericht Mannheim VR 331138\nRegisterbekanntmachung nach dem Umwandlungsgesetz 24.09.2025 (Eintragungsdatum)\n\nHaus & Grund Neckargemünd-Bammental und Umgebung e.V.\neingetragener Verein\nNeckargemünd\n\nDen Gläubigern der an der Verschmelzung beteiligten Rechtsträger ist, wenn sie binnen sechs Monaten nach dem Tag, an dem die Eintragung der Verschmelzung in das Register des Sitzes desjenigen Rechtsträgers, dessen Gläubiger sie sind, nach § 19 Abs. 3 UmwG als bekanntgemacht gilt, ihren Anspruch nach Grund und Höhe schriftlich anmelden, Sicherheit zu leisten, soweit sie nicht Befriedigung verlangen können. Dieses Recht steht den Gläubigern jedoch nur zu, wenn sie glaubhaft machen, dass durch die Verschmelzung die Erfüllung ihrer Forderung gefährdet wird."
    },
    {
      "date": "2025-09-24",
      "id": "131162",
      "original_text": "Registerbekanntmachung nach dem Umwandlungsgesetz\nBrandenburg Amtsgericht Cottbus HRB 19108\nEclaira Extra GmbH – Schönefeld",
      "type": "Registerbekanntmachung nach dem Umwandlungsgesetz",
      "state": "Brandenburg",
      "amtsgericht": "Amtsgericht Cottbus",
      "registernummer": "HRB 19108",
      "registerart": "HRB",
      "company_name": "Eclaira Extra GmbH",
      "company_seat": "Schönefeld",
      "details": "24.09.2025 (Bekanntmachungsdatum)\n\nBrandenburg Amtsgericht Cottbus HRB 19108\nRegisterbekanntmachung nach dem Umwandlungsgesetz 23.09.2025 (Eintragungsdatum)\n\nEclaira Extra GmbH\nGesellschaft mit beschränkter Haftung\nSchönefeld\n\nZu Eintragungsnummer 1 vom 23.09.2025 wird als nicht eingetragen veröffentlicht:\nDen Gläubigern der an der Spaltung beteiligten Rechtsträger ist, wenn sie binnen sechs Monaten nach dem Tag, an dem die Eintragung der Spaltung in das Register des Sitzes desjenigen Rechtsträgers, dessen Gläubiger sie sind, als bekannt gemacht gilt, ihren Anspruch nach Grund und Höhe schriftlich anmelden, Sicherheit zu leisten, soweit sie nicht Befriedigung verlangen können. Dieses Recht steht den Gläubigern jedoch nur zu, wenn sie glaubhaft machen, dass durch die Spaltung die Erfüllung ihrer Forderung gefährdet wird"
    },
    {
      "date": "2025-09-24",
      "id": "131163",
      "original_text": "Registerbekanntmachung nach dem Umwandlungsgesetz\nBaden-Württemberg Amtsgericht Ulm HRB 739860\nPflegekräfte Service GmbH – Giengen an der Brenz",
      "type": "Registerbekanntmachung nach dem Umwandlungsgesetz",
      "state": "Baden-Württemberg",
      "amtsgericht": "Amtsgericht Ulm",
      "registernummer": "HRB 739860",
      "registerart": "HRB",
      "company_name": "Pflegekräfte Service GmbH",
      "company_seat": "Giengen an der Brenz",
      "details": "24.09.2025 (Bekanntmachungsdatum)\n\nBaden-Württemberg Amtsgericht Ulm HRB 739860\nRegisterbekanntmachung nach dem Umwandlungsgesetz 24.09.2025 (Eintragungsdatum)\n\nPflegekräfte Service GmbH\nGesellschaft mit beschränkter Haftung\nGiengen an der Brenz\n\nDen Gläubigern der an der Verschmelzung beteiligten Rechtsträger ist, wenn sie binnen sechs Monaten nach dem Tag, an dem die Eintragung der Verschmelzung in das Register des Sitzes desjenigen Rechtsträgers, dessen Gläubiger sie sind, nach § 19 Abs. 3 UmwG als bekanntgemacht gilt, ihren Anspruch nach Grund und Höhe schriftlich anmelden, Sicherheit zu leisten, soweit sie nicht Befriedigung verlangen können. Dieses Recht steht den Gläubigern jedoch nur zu, wenn sie glaubhaft machen, dass durch die Verschmelzung die Erfüllung ihrer Forderung gefährdet wird."
    },
    {
      "date": "2025-09-24",
      "id": "131164",
      "original_text": "Registerbekanntmachung nach dem Umwandlungsgesetz\nSchleswig-Holstein Amtsgericht Kiel HRB 28251\nEvent Service Nord GmbH – Heikendorf",
      "type": "Registerbekanntmachung nach dem Umwandlungsgesetz",
      "state": "Schleswig-Holstein",
      "amtsgericht": "Amtsgericht Kiel",
      "registernummer": "HRB 28251",
      "registerart": "HRB",
      "company_name": "Event Service Nord GmbH",
      "company_seat": "Heikendorf",
      "details": "24.09.2025 (Bekanntmachungsdatum)\n\nSchleswig-Holstein Amtsgericht Kiel HRB 28251\nRegisterbekanntmachung nach dem Umwandlungsgesetz 23.09.2025 (Eintragungsdatum)\n\nEvent Service Nord GmbH\nGesellschaft mit beschränkter Haftung\nHeikendorf\n\nAls nicht eingetragen wird veröffentlicht: Den Gläubigern der an der Spaltung beteiligten Rechtsträger ist, wenn sie binnen sechs Monaten nach dem Tag, an dem die Eintragung der Spaltung in das Register des Sitzes desjenigen Rechtsträgers, dessen Gläubiger sie sind,  bekannt gemacht worden ist, ihren Anspruch nach Grund und Höhe schriftlich anmelden, Sicherheit zu leisten, soweit sie nicht Befriedigung verlangen können. Dieses Recht steht den Gläubigern jedoch nur zu, wenn sie glaubhaft machen, dass durch die Spaltung die Erfüllung ihrer Forderung gefährdet wird."
    },
    {
      "date": "2025-09-24",
      "id": "131165",
      "original_text": "Registerbekanntmachung nach dem Umwandlungsgesetz\nBaden-Württemberg Amtsgericht Ulm HRB 734198\nMANAGEMENT PLUS X GmbH – Giengen an der Brenz",
      "type": "Registerbekanntmachung nach dem Umwandlungsgesetz",
      "state": "Baden-Württemberg",
      "amtsgericht": "Amtsgericht Ulm",
      "registernummer": "HRB 734198",
      "registerart": "HRB",
      "company_name": "MANAGEMENT PLUS X GmbH",
      "company_seat": "Giengen an der Brenz",
      "details": "24.09.2025 (Bekanntmachungsdatum)\n\nBaden-Württemberg Amtsgericht Ulm HRB 734198\nRegisterbekanntmachung nach dem Umwandlungsgesetz 24.09.2025 (Eintragungsdatum)\n\nMANAGEMENT PLUS X GmbH\nGesellschaft mit beschränkter Haftung\nGiengen an der Brenz\n\nAls nicht eingetragen wird bekanntgemacht:\nDen Gläubigern der an der Verschmelzung beteiligten Rechtsträger ist, wenn sie binnen sechs Monaten nach dem Tag, an dem die Eintragung der Verschmelzung in das Register des Sitzes desjenigen Rechtsträgers, dessen Gläubiger sie sind, nach § 19 Abs. 3 UmwG als bekanntgemacht gilt, ihren Anspruch nach Grund und Höhe schriftlich anmelden, Sicherheit zu leisten, soweit sie nicht Befriedigung verlangen können. Dieses Recht steht den Gläubigern jedoch nur zu, wenn sie glaubhaft machen, dass durch die Verschmelzung die Erfüllung ihrer Forderung gefährdet wird."
    },
    {
      "date": "2025-09-24",
      "id": "131166",
      "original_text": "Einreichung neuer Dokumente\nSaarland Amtsgericht Saarbrücken HRB 5561\nRVI GmbH – Saarbrücken",
      "type": "Einreichung neuer Dokumente",
      "state": "Saarland",
      "amtsgericht": "Amtsgericht Saarbrücken",
      "registernummer": "HRB 5561",
      "registerart": "HRB",
      "company_name": "RVI GmbH",
      "company_seat": "Saarbrücken",
      "details": "24.09.2025 (Bekanntmachungsdatum)\n\nSaarland Amtsgericht Saarbrücken HRB 5561\nEinreichung neuer Dokumente 17.09.2025 (Eintragungsdatum)\n\nRVI GmbH\nGesellschaft mit beschränkter Haftung\nSaarbrücken\n\nDie Geschäftsführung der Gesellschaft hat eine Liste der Mitglieder des Aufsichtsrats zum Handelsregister eingereicht (§ 52 Abs. 3 Satz 2 GmbHG)."
    },
    {
      "date": "2025-09-24",
      "id": "131167",
      "original_text": "Löschungsankündigung\nBrandenburg Amtsgericht Neuruppin HRB 15044\nBerill 369 GmbH – Zühlsdorf",
      "type": "Löschungsankündigung",
      "state": "Brandenburg",
      "amtsgericht": "Amtsgericht Neuruppin",
      "registernummer": "HRB 15044",
      "registerart": "HRB",
      "company_name": "Berill 369 GmbH",
      "company_seat": "Zühlsdorf",
      "details": "24.09.2025 (Bekanntmachungsdatum)\n\nBrandenburg Amtsgericht Neuruppin HRB 15044\nLöschungsankündigung\n\nBerill 369 GmbH\nGesellschaft mit beschränkter Haftung\nZühlsdorf\n\nBei der nachstehenden Gesellschaft wird das Amtslöschungsverfahren gemäß § 394 FamFG eingeleitet.\nWiderspruchsfrist: 1 Monat"
    },
    {
      "date": "2025-09-24",
      "id": "131168",
      "original_text": "Registerbekanntmachung nach dem Umwandlungsgesetz\nHamburg Amtsgericht Hamburg HRB 137421\nParship Group GmbH – Hamburg",
      "type": "Registerbekanntmachung nach dem Umwandlungsgesetz",
      "state": "Hamburg",
      "amtsgericht": "Amtsgericht Hamburg",
      "registernummer": "HRB 137421",
      "registerart": "HRB",
      "company_name": "Parship Group GmbH",
      "company_seat": "Hamburg",
      "details": "24.09.2025 (Bekanntmachungsdatum)\n\nHamburg Amtsgericht Hamburg HRB 137421\nRegisterbekanntmachung nach dem Umwandlungsgesetz 24.09.2025 (Eintragungsdatum)\n\nParship Group GmbH\nGesellschaft mit beschränkter Haftung\nHamburg\n\nAls nicht eingetragen wird bekannt gemacht:\nDen Gläubigern der an der Verschmelzung beteiligten Gesellschaften ist, wenn sie binnen sechs Monaten nach dem Tag, an dem die Eintragung der Verschmelzung in das Register des Sitzes desjenigen Rechtsträgers, dessen Gläubiger sie sind, nach § 19 Absatz 3 UmwG als bekannt gemacht gilt, ihren Anspruch nach Grund und Höhe schriftlich anmelden, Sicherheit zu leisten, soweit sie nicht Befriedigung verlangen können. Dieses Recht steht den Gläubigern jedoch nur zu, wenn sie glaubhaft machen, dass durch die Verschmelzung die Erfüllung ihrer Forderung gefährdet wird."
    },
    {
      "date": "2025-09-24",
      "id": "131169",
      "original_text": "Registerbekanntmachung nach dem Umwandlungsgesetz\nHamburg Amtsgericht Hamburg HRB 163285\nParshipMeet Holding GmbH – Hamburg",
      "type": "Registerbekanntmachung nach dem Umwandlungsgesetz",
      "state": "Hamburg",
      "amtsgericht": "Amtsgericht Hamburg",
      "registernummer": "HRB 163285",
      "registerart": "HRB",
      "company_name": "ParshipMeet Holding GmbH",
      "company_seat": "Hamburg",
      "details": "24.09.2025 (Bekanntmachungsdatum)\n\nHamburg Amtsgericht Hamburg HRB 163285\nRegisterbekanntmachung nach dem Umwandlungsgesetz 24.09.2025 (Eintragungsdatum)\n\nParshipMeet Holding GmbH\nGesellschaft mit beschränkter Haftung\nHamburg\n\nAls nicht eingetragen wird bekannt gemacht:\nDen Gläubigern der an der Verschmelzung beteiligten Gesellschaften ist, wenn sie binnen sechs Monaten nach dem Tag, an dem die Eintragung der Verschmelzung in das Register des Sitzes desjenigen Rechtsträgers, dessen Gläubiger sie sind, nach § 19 Absatz 3 UmwG als bekannt gemacht gilt, ihren Anspruch nach Grund und Höhe schriftlich anmelden, Sicherheit zu leisten, soweit sie nicht Befriedigung verlangen können. Dieses Recht steht den Gläubigern jedoch nur zu, wenn sie glaubhaft machen, dass durch die Verschmelzung die Erfüllung ihrer Forderung gefährdet wird."
    },
    {
      "date": "2025-09-24",
      "id": "131170",
      "original_text": "Registerbekanntmachung nach dem Umwandlungsgesetz\nSchleswig-Holstein Amtsgericht Kiel HRA 12693\nEvent Service Nord e.K. – Heikendorf",
      "type": "Registerbekanntmachung nach dem Umwandlungsgesetz",
      "state": "Schleswig-Holstein",
      "amtsgericht": "Amtsgericht Kiel",
      "registernummer": "HRA 12693",
      "registerart": "HRA",
      "company_name": "Event Service Nord e.K.",
      "company_seat": "Heikendorf",
      "details": "24.09.2025 (Bekanntmachungsdatum)\n\nSchleswig-Holstein Amtsgericht Kiel HRA 12693\nRegisterbekanntmachung nach dem Umwandlungsgesetz 23.09.2025 (Eintragungsdatum)\n\nEvent Service Nord e.K.\nEinzelkaufmann / Einzelkauffrau\nHeikendorf\n\nAls nicht eingetragen wird veröffentlicht: Den Gläubigern der an der Spaltung beteiligten Rechtsträger ist, wenn sie binnen sechs Monaten nach dem Tag, an dem die Eintragung der Spaltung in das Register des Sitzes desjenigen Rechtsträgers, dessen Gläubiger sie sind,  bekannt gemacht worden ist, ihren Anspruch nach Grund und Höhe schriftlich anmelden, Sicherheit zu leisten, soweit sie nicht Befriedigung verlangen können. Dieses Recht steht den Gläubigern jedoch nur zu, wenn sie glaubhaft machen, dass durch die Spaltung die Erfüllung ihrer Forderung gefährdet wird."
    },
    {
      "date": "2025-09-24",
      "id": "131171",
      "original_text": "Löschungsankündigung\nMecklenburg-Vorpommern Amtsgericht Neubrandenburg HRB 22064\nKoloss Bauunternehmen & Dienstleistungen GmbH – Faulenrost",
      "type": "Löschungsankündigung",
      "state": "Mecklenburg-Vorpommern",
      "amtsgericht": "Amtsgericht Neubrandenburg",
      "registernummer": "HRB 22064",
      "registerart": "HRB",
      "company_name": "Koloss Bauunternehmen & Dienstleistungen GmbH",
      "company_seat": "Faulenrost",
      "details": "24.09.2025 (Bekanntmachungsdatum)\n\nMecklenburg-Vorpommern Amtsgericht Neubrandenburg HRB 22064\nLöschungsankündigung 24.09.2025 (Eintragungsdatum)\n\nKoloss Bauunternehmen & Dienstleistungen GmbH\nGesellschaft mit beschränkter Haftung\nFaulenrost\n\nDas Registergericht beabsichtigt, die im Handelsregister eingetragene Gesellschaft von Amts wegen nach § 394 FamFG zu löschen. Die Frist zur Erhebung eines Widerspruchs gegen die beabsichtigte Löschung wird auf drei Monate festgesetzt."
    },
    {
      "date": "2025-09-24",
      "id": "131172",
      "original_text": "Sonstige Registerbekanntmachung\nBerlin Amtsgericht Berlin (Charlottenburg) HRA 48994\nSecond State OHG – Berlin",
      "type": "Sonstige Registerbekanntmachung",
      "state": "Berlin",
      "amtsgericht": "Amtsgericht Berlin (Charlottenburg)",
      "registernummer": "HRA 48994",
      "registerart": "HRA",
      "company_name": "Second State OHG",
      "company_seat": "Berlin",
      "details": "24.09.2025 (Bekanntmachungsdatum)\n\nBerlin Amtsgericht Berlin (Charlottenburg) HRA 48994\nSonstige Registerbekanntmachung\n\nSecond State OHG\nOffene Handelsgesellschaft\nBerlin\n\nAls nicht eingetragen wird veröffentlicht: Den Gläubigern ist, wenn sie binnen sechs Monaten nach dem Tag, an dem die Eintragung der Umwandlung als bekannt gemacht gilt, ihren Anspruch nach Grund und Höhe schriftlich anmelden, Sicherheit zu leisten, soweit sie nicht Befriedigung verlangen können. Dieses Recht steht den Gläubigern jedoch nur zu, wenn sie glaubhaft machen, dass durch die Umwandlung die Erfüllung ihrer Forderung gefährdet wird. Das Recht, Sicherheitsleistung zu verlangen, steht Gläubigern nicht zu, die im Falle der Insolvenz ein Recht auf vorzugsweise Befriedigung aus einer Deckungsmasse haben, die nach gesetzlicher Vorschrift zu ihrem Schutz errichtet und staatlich überwacht ist."
    },
    {
      "date": "2025-09-24",
      "id": "131173",
      "original_text": "Einreichung neuer Dokumente\nBaden-Württemberg Amtsgericht Stuttgart HRB 206572\nITventive AG – Ludwigsburg",
      "type": "Einreichung neuer Dokumente",
      "state": "Baden-Württemberg",
      "amtsgericht": "Amtsgericht Stuttgart",
      "registernummer": "HRB 206572",
      "registerart": "HRB",
      "company_name": "ITventive AG",
      "company_seat": "Ludwigsburg",
      "details": "24.09.2025 (Bekanntmachungsdatum)\n\nBaden-Württemberg Amtsgericht Stuttgart HRB 206572\nEinreichung neuer Dokumente 24.09.2025 (Eintragungsdatum)\n\nITventive AG\nAktiengesellschaft\nLudwigsburg\n\nDie Gesellschaft hat am 18.09.2025 die Liste über die Zusammensetzung des Aufsichtsrats zum Handelsregister eingereicht."
    },
    {
      "date": "2025-09-24",
      "id": "131174",
      "original_text": "Sonstige Registerbekanntmachung\nBerlin Amtsgericht Berlin (Charlottenburg) HRB 279521\nSecond State GmbH – Berlin",
      "type": "Sonstige Registerbekanntmachung",
      "state": "Berlin",
      "amtsgericht": "Amtsgericht Berlin (Charlottenburg)",
      "registernummer": "HRB 279521",
      "registerart": "HRB",
      "company_name": "Second State GmbH",
      "company_seat": "Berlin",
      "details": "24.09.2025 (Bekanntmachungsdatum)\n\nBerlin Amtsgericht Berlin (Charlottenburg) HRB 279521\nSonstige Registerbekanntmachung\n\nSecond State GmbH\nGesellschaft mit beschränkter Haftung\nBerlin\n\nAls nicht eingetragen wird veröffentlicht: Den Gläubigern ist, wenn sie binnen sechs Monaten nach dem Tag, an dem die Eintragung der Umwandlung als bekannt gemacht gilt, ihren Anspruch nach Grund und Höhe schriftlich anmelden, Sicherheit zu leisten, soweit sie nicht Befriedigung verlangen können. Dieses Recht steht den Gläubigern jedoch nur zu, wenn sie glaubhaft machen, dass durch die Umwandlung die Erfüllung ihrer Forderung gefährdet wird. Das Recht, Sicherheitsleistung zu verlangen, steht Gläubigern nicht zu, die im Falle der Insolvenz ein Recht auf vorzugsweise Befriedigung aus einer Deckungsmasse haben, die nach gesetzlicher Vorschrift zu ihrem Schutz errichtet und staatlich überwacht ist."
    },
    {
      "date": "2025-09-24",
      "id": "131175",
      "original_text": "Löschungsankündigung\nBrandenburg Amtsgericht Potsdam HRB 27414\nDach & Holzbau Rosenau UG (haftungsbeschränkt) – Rosenau",
      "type": "Löschungsankündigung",
      "state": "Brandenburg",
      "amtsgericht": "Amtsgericht Potsdam",
      "registernummer": "HRB 27414",
      "registerart": "HRB",
      "company_name": "Dach & Holzbau Rosenau UG (haftungsbeschränkt)",
      "company_seat": "Rosenau",
      "details": "24.09.2025 (Bekanntmachungsdatum)\n\nBrandenburg Amtsgericht Potsdam HRB 27414\nLöschungsankündigung\n\nDach & Holzbau Rosenau UG (haftungsbeschränkt)\nGesellschaft mit beschränkter Haftung\nRosenau\n\nBei der nachstehenden Gesellschaft wird das Amtslöschungsverfahren gemäß § 394 FamFG eingeleitet. Widerspruchsfrist: 8 Wochen"
    },
    {
      "date": "2025-09-24",
      "id": "131176",
      "original_text": "Registerbekanntmachung nach dem Umwandlungsgesetz\nBaden-Württemberg Amtsgericht Stuttgart HRB 795387\nMultilamp Leuchtenvertrieb Gesellschaft mit beschränkter Haftung – Forchtenberg",
      "type": "Registerbekanntmachung nach dem Umwandlungsgesetz",
      "state": "Baden-Württemberg",
      "amtsgericht": "Amtsgericht Stuttgart",
      "registernummer": "HRB 795387",
      "registerart": "HRB",
      "company_name": "Multilamp Leuchtenvertrieb Gesellschaft mit beschränkter Haftung",
      "company_seat": "Forchtenberg",
      "details": "24.09.2025 (Bekanntmachungsdatum)\n\nBaden-Württemberg Amtsgericht Stuttgart HRB 795387\nRegisterbekanntmachung nach dem Umwandlungsgesetz 24.09.2025 (Eintragungsdatum)\n\nMultilamp Leuchtenvertrieb Gesellschaft mit beschränkter Haftung\nGesellschaft mit beschränkter Haftung\nForchtenberg\n\nAls nicht eingetragen wird bekanntgemacht:\nDen Gläubigern der an der Verschmelzung beteiligten Rechtsträger ist, wenn sie binnen sechs Monaten nach dem Tag, an dem die Eintragung der Verschmelzung in das Register des Sitzes desjenigen Rechtsträgers, dessen Gläubiger sie sind, nach § 19 Abs. 3 UmwG als bekanntgemacht gilt, ihren Anspruch nach Grund und Höhe schriftlich anmelden, Sicherheit zu leisten, soweit sie nicht Befriedigung verlangen können. Dieses Recht steht den Gläubigern jedoch nur zu, wenn sie glaubhaft machen, dass durch die Verschmelzung die Erfüllung ihrer Forderung gefährdet wird."
    },
    {
      "date": "2025-09-24",
      "id": "131177",
      "original_text": "Registerbekanntmachung nach dem Umwandlungsgesetz\nBaden-Württemberg Amtsgericht Mannheim HRB 734219\nAutohaus Ernst Rhein-Neckar Verwaltungsgesellschaft mbH – Mannheim",
      "type": "Registerbekanntmachung nach dem Umwandlungsgesetz",
      "state": "Baden-Württemberg",
      "amtsgericht": "Amtsgericht Mannheim",
      "registernummer": "HRB 734219",
      "registerart": "HRB",
      "company_name": "Autohaus Ernst Rhein-Neckar Verwaltungsgesellschaft mbH",
      "company_seat": "Mannheim",
      "details": "24.09.2025 (Bekanntmachungsdatum)\n\nBaden-Württemberg Amtsgericht Mannheim HRB 734219\nRegisterbekanntmachung nach dem Umwandlungsgesetz 24.09.2025 (Eintragungsdatum)\n\nAutohaus Ernst Rhein-Neckar Verwaltungsgesellschaft mbH\nGesellschaft mit beschränkter Haftung\nMannheim\n\nAls nicht eingetragen wird bekanntgemacht: Den Gläubigern der an der Verschmelzung beteiligten Rechtsträger ist, wenn sie binnen sechs Monaten nach dem Tag, an dem die Eintragung der Verschmelzung in das Register des Sitzes desjenigen Rechtsträgers, dessen Gläubiger sie sind, nach § 19 Abs. 3 UmwG als bekanntgemacht gilt, ihren Anspruch nach Grund und Höhe schriftlich anmelden, Sicherheit zu leisten, soweit sie nicht Befriedigung verlangen können. Dieses Recht steht den Gläubigern jedoch nur zu, wenn sie glaubhaft machen, dass durch die Verschmelzung die Erfüllung ihrer Forderung gefährdet wird."
    },
    {
      "date": "2025-09-24",
      "id": "131178",
      "original_text": "Registerbekanntmachung nach dem Umwandlungsgesetz\nBaden-Württemberg Amtsgericht Stuttgart HRB 590280\nLIGHT & MORE GmbH – Forchtenberg",
      "type": "Registerbekanntmachung nach dem Umwandlungsgesetz",
      "state": "Baden-Württemberg",
      "amtsgericht": "Amtsgericht Stuttgart",
      "registernummer": "HRB 590280",
      "registerart": "HRB",
      "company_name": "LIGHT & MORE GmbH",
      "company_seat": "Forchtenberg",
      "details": "24.09.2025 (Bekanntmachungsdatum)\n\nBaden-Württemberg Amtsgericht Stuttgart HRB 590280\nRegisterbekanntmachung nach dem Umwandlungsgesetz 24.09.2025 (Eintragungsdatum)\n\nLIGHT & MORE GmbH\nGesellschaft mit beschränkter Haftung\nForchtenberg\n\nAls nicht eingetragen wird bekanntgemacht:\nDen Gläubigern der an der Verschmelzung beteiligten Rechtsträger ist, wenn sie binnen sechs Monaten nach dem Tag, an dem die Eintragung der Verschmelzung in das Register des Sitzes desjenigen Rechtsträgers, dessen Gläubiger sie sind, nach § 19 Abs. 3 UmwG als bekanntgemacht gilt, ihren Anspruch nach Grund und Höhe schriftlich anmelden, Sicherheit zu leisten, soweit sie nicht Befriedigung verlangen können. Dieses Recht steht den Gläubigern jedoch nur zu, wenn sie glaubhaft machen, dass durch die Verschmelzung die Erfüllung ihrer Forderung gefährdet wird."
    },
    {
      "date": "2025-09-24",
      "id": "131179",
      "original_text": "Registerbekanntmachung nach dem Umwandlungsgesetz\nSachsen-Anhalt Amtsgericht Stendal HRB 114203\nSanitätshaus Klinz GmbH – Bernburg (Saale)",
      "type": "Registerbekanntmachung nach dem Umwandlungsgesetz",
      "state": "Sachsen-Anhalt",
      "amtsgericht": "Amtsgericht Stendal",
      "registernummer": "HRB 114203",
      "registerart": "HRB",
      "company_name": "Sanitätshaus Klinz GmbH",
      "company_seat": "Bernburg (Saale)",
      "details": "24.09.2025 (Bekanntmachungsdatum)\n\nSachsen-Anhalt Amtsgericht Stendal HRB 114203\nRegisterbekanntmachung nach dem Umwandlungsgesetz 24.09.2025 (Eintragungsdatum)\n\nSanitätshaus Klinz GmbH\nGesellschaft mit beschränkter Haftung\nBernburg (Saale)\n\nDie Orthopädietechnik-Sanitätshaus Bollmann GmbH mit dem Sitz in Sangerhausen (Amtsgericht Stendal HRB 7167) ist auf Grund des Verschmelzungsvertrages vom 13.08.2025    und der Beschlüsse der Gesellschafterversammlungen vom selben Tag mit der Gesellschaft verschmolzen.Nicht eingetragen: Den Gläubigern der an der Verschmelzung beteiligten Rechtsträger ist, wenn sie binnen sechs Monaten nach dem Tag, an dem die Eintragung der Verschmelzung nach § 19 Abs. 3 UmwG als bekanntgemacht gilt, ihren Anspruch nach Grund und Höhe schriftlich anmelden, Sicherheit zu leisten, soweit sie nicht Befriedigung verlangen können. Dieses Recht steht ihnen jedoch nur zu, wenn sie glaubhaft machen, dass durch die Verschmelzung die Erfüllung ihrer Forderung gefährdet wird."
    },
    {
      "date": "2025-09-24",
      "id": "131180",
      "original_text": "Registerbekanntmachung nach dem Umwandlungsgesetz\nSachsen-Anhalt Amtsgericht Stendal HRB 7167\nOrthopädietechnik-Sanitätshaus Bollmann GmbH – Sangerhausen",
      "type": "Registerbekanntmachung nach dem Umwandlungsgesetz",
      "state": "Sachsen-Anhalt",
      "amtsgericht": "Amtsgericht Stendal",
      "registernummer": "HRB 7167",
      "registerart": "HRB",
      "company_name": "Orthopädietechnik-Sanitätshaus Bollmann GmbH",
      "company_seat": "Sangerhausen",
      "details": "24.09.2025 (Bekanntmachungsdatum)\n\nSachsen-Anhalt Amtsgericht Stendal HRB 7167\nRegisterbekanntmachung nach dem Umwandlungsgesetz 24.09.2025 (Eintragungsdatum)\n\nOrthopädietechnik-Sanitätshaus Bollmann GmbH\nGesellschaft mit beschränkter Haftung\nSangerhausen\n\nDie Gesellschaft ist auf Grund des Verschmelzungsvertrages vom 13.08.2025 sowie der Beschlüsse der Gesellschafterversammlungen vom selben Tag mit der Sanitätshaus Klinz GmbH mit dem Sitz in Bernburg (Saale) (Amtsgericht Stendal HRB 114203) verschmolzen. Die Verschmelzung ist am 24.09.2025 in das Handelsregister der übernehmenden Gesellschaft eingetragen worden.Nicht eingetragen: Den Gläubigern der an der Verschmelzung beteiligten Rechtsträger ist, wenn sie binnen sechs Monaten nach dem Tag, an dem die Eintragung der Verschmelzung nach § 19 Abs. 3 UmwG als bekanntgemacht gilt, ihren Anspruch nach Grund und Höhe schriftlich anmelden, Sicherheit zu leisten, soweit sie nicht Befriedigung verlangen können. Dieses Recht steht ihnen jedoch nur zu, wenn sie glaubhaft machen, dass durch die Verschmelzung die Erfüllung ihrer Forderung gefährdet wird."
    },
    {
      "date": "2025-09-24",
      "id": "131181",
      "original_text": "Löschungsankündigung\nBerlin Amtsgericht Berlin (Charlottenburg) HRB 178392\nplace2be Holding UG (haftungsbeschränkt) – Berlin",
      "type": "Löschungsankündigung",
      "state": "Berlin",
      "amtsgericht": "Amtsgericht Berlin (Charlottenburg)",
      "registernummer": "HRB 178392",
      "registerart": "HRB",
      "company_name": "place2be Holding UG (haftungsbeschränkt)",
      "company_seat": "Berlin",
      "details": "24.09.2025 (Bekanntmachungsdatum)\n\nBerlin Amtsgericht Berlin (Charlottenburg) HRB 178392\nLöschungsankündigung\n\nplace2be Holding UG (haftungsbeschränkt)\nGesellschaft mit beschränkter Haftung\nBerlin\n\nBei der nachstehenden Gesellschaft wird das Amtslöschungsverfahren gemäß § 394 FamFG eingeleitet. Widerspruchsfrist 6 Wochen"
    },
    {
      "date": "2025-09-24",
      "id": "131182",
      "original_text": "Löschungsankündigung\nBerlin Amtsgericht Berlin (Charlottenburg) HRB 242303\nHofmann Glas- und Gebäudereinigung Service UG (haftungsbeschränkt) – Berlin",
      "type": "Löschungsankündigung",
      "state": "Berlin",
      "amtsgericht": "Amtsgericht Berlin (Charlottenburg)",
      "registernummer": "HRB 242303",
      "registerart": "HRB",
      "company_name": "Hofmann Glas- und Gebäudereinigung Service UG (haftungsbeschränkt)",
      "company_seat": "Berlin",
      "details": "24.09.2025 (Bekanntmachungsdatum)\n\nBerlin Amtsgericht Berlin (Charlottenburg) HRB 242303\nLöschungsankündigung\n\nHofmann Glas- und Gebäudereinigung Service UG (haftungsbeschränkt)\nGesellschaft mit beschränkter Haftung\nBerlin\n\nBei der nachstehenden Gesellschaft wird das Amtslöschungsverfahren gemäß § 394 FamFG eingeleitet. Widerspruchsfrist 6 Wochen"
    },
    {
      "date": "2025-09-24",
      "id": "131183",
      "original_text": "Sonstige Registerbekanntmachung\nBrandenburg Amtsgericht Cottbus HRB 14809\nNeo-Trade GmbH – Königs Wusterhausen",
      "type": "Sonstige Registerbekanntmachung",
      "state": "Brandenburg",
      "amtsgericht": "Amtsgericht Cottbus",
      "registernummer": "HRB 14809",
      "registerart": "HRB",
      "company_name": "Neo-Trade GmbH",
      "company_seat": "Königs Wusterhausen",
      "details": "24.09.2025 (Bekanntmachungsdatum)\n\nBrandenburg Amtsgericht Cottbus HRB 14809\nSonstige Registerbekanntmachung 23.09.2025 (Eintragungsdatum)\n\nNeo-Trade GmbH\nGesellschaft mit beschränkter Haftung\nKönigs Wusterhausen\n\nAls nicht eingetragen wird veröffentlicht:\nDie Gesellschaft ist durch Abweisung des Antrages auf Eröffnung des Insolvenzverfahrens mangels Masse aufgelöst."
    },
    {
      "date": "2025-09-24",
      "id": "131184",
      "original_text": "Registerbekanntmachung nach dem Umwandlungsgesetz\nBaden-Württemberg Amtsgericht Mannheim HRB 7312\nManagementconsult dr. eisele & dr. noll gmbh – Mannheim",
      "type": "Registerbekanntmachung nach dem Umwandlungsgesetz",
      "state": "Baden-Württemberg",
      "amtsgericht": "Amtsgericht Mannheim",
      "registernummer": "HRB 7312",
      "registerart": "HRB",
      "company_name": "Managementconsult dr. eisele & dr. noll gmbh",
      "company_seat": "Mannheim",
      "details": "24.09.2025 (Bekanntmachungsdatum)\n\nBaden-Württemberg Amtsgericht Mannheim HRB 7312\nRegisterbekanntmachung nach dem Umwandlungsgesetz 24.09.2025 (Eintragungsdatum)\n\nManagementconsult dr. eisele & dr. noll gmbh\nGesellschaft mit beschränkter Haftung\nMannheim\n\nAls nicht eingetragen wird bekanntgemacht:\nDen Gläubigern der an der Verschmelzung beteiligten Rechtsträger ist, wenn sie binnen sechs Monaten nach dem Tag, an dem die Eintragung der Verschmelzung in das Register des Sitzes desjenigen Rechtsträgers, dessen Gläubiger sie sind, nach § 19 Abs. 3 UmwG als bekanntgemacht gilt, ihren Anspruch nach Grund und Höhe schriftlich anmelden, Sicherheit zu leisten, soweit sie nicht Befriedigung verlangen können. Dieses Recht steht den Gläubigern jedoch nur zu, wenn sie glaubhaft machen, dass durch die Verschmelzung die Erfüllung ihrer Forderung gefährdet wird."
    },
    {
      "date": "2025-09-24",
      "id": "131185",
      "original_text": "Registerbekanntmachung nach dem Umwandlungsgesetz\nMecklenburg-Vorpommern Amtsgericht Schwerin HRB 11324\nColumbus Cruise Center Wismar GmbH – Wismar",
      "type": "Registerbekanntmachung nach dem Umwandlungsgesetz",
      "state": "Mecklenburg-Vorpommern",
      "amtsgericht": "Amtsgericht Schwerin",
      "registernummer": "HRB 11324",
      "registerart": "HRB",
      "company_name": "Columbus Cruise Center Wismar GmbH",
      "company_seat": "Wismar",
      "details": "24.09.2025 (Bekanntmachungsdatum)\n\nMecklenburg-Vorpommern Amtsgericht Schwerin HRB 11324\nRegisterbekanntmachung nach dem Umwandlungsgesetz 24.09.2025 (Eintragungsdatum)\n\nColumbus Cruise Center Wismar GmbH\nGesellschaft mit beschränkter Haftung\nWismar\n\nDie Gesellschaft hat Gläubigern, deren Forderungen vor dieser Bekanntmachung begründet worden sind, Sicherheit zu leisten, soweit sie nicht Befriedigung verlangen können, wenn sie sich binnen sechs Monaten zu diesem Zweck melden."
    },
    {
      "date": "2025-09-24",
      "id": "131186",
      "original_text": "Registerbekanntmachung nach dem Umwandlungsgesetz\nMecklenburg-Vorpommern Amtsgericht Schwerin HRB 2128\nSeehafen Wismar GmbH – Wismar",
      "type": "Registerbekanntmachung nach dem Umwandlungsgesetz",
      "state": "Mecklenburg-Vorpommern",
      "amtsgericht": "Amtsgericht Schwerin",
      "registernummer": "HRB 2128",
      "registerart": "HRB",
      "company_name": "Seehafen Wismar GmbH",
      "company_seat": "Wismar",
      "details": "24.09.2025 (Bekanntmachungsdatum)\n\nMecklenburg-Vorpommern Amtsgericht Schwerin HRB 2128\nRegisterbekanntmachung nach dem Umwandlungsgesetz 24.09.2025 (Eintragungsdatum)\n\nSeehafen Wismar GmbH\nGesellschaft mit beschränkter Haftung\nWismar\n\nDen Gläubigern der an der Verschmelzung beteiligten Gesellschaften ist, wenn sie binnen sechs Monaten nach dem Tag, an dem die Eintragung der Verschmelzungen in das Register des Sitzes desjenigen Rechtsträgers, dessen Gläubiger sie sind, nach § 19 Absatz 3 UmwG als bekanntgemacht gilt, ihren Anspruch nach Grund und Höhe schriftlich anmelden, Sicherheit zu leisten, soweit sie nicht Befriedigung verlangen können. Dieses Recht steht den Gläubigern jedoch nur zu, wenn sie glaubhaft machen, dass durch die Verschmelzung die Erfüllung ihrer Forderung gefährdet wird."
    },
    {
      "date": "2025-09-24",
      "id": "131187",
      "original_text": "Registerbekanntmachung nach dem Umwandlungsgesetz\nBrandenburg Amtsgericht Cottbus HRA 3653\nEnterra Fünf GmbH & Co. KG – Königs Wusterhausen",
      "type": "Registerbekanntmachung nach dem Umwandlungsgesetz",
      "state": "Brandenburg",
      "amtsgericht": "Amtsgericht Cottbus",
      "registernummer": "HRA 3653",
      "registerart": "HRA",
      "company_name": "Enterra Fünf GmbH & Co. KG",
      "company_seat": "Königs Wusterhausen",
      "details": "24.09.2025 (Bekanntmachungsdatum)\n\nBrandenburg Amtsgericht Cottbus HRA 3653\nRegisterbekanntmachung nach dem Umwandlungsgesetz 23.09.2025 (Eintragungsdatum)\n\nEnterra Fünf GmbH & Co. KG\nKommanditgesellschaft\nKönigs Wusterhausen\n\nDen Gläubigern der an der Verschmelzung beteiligten Rechtsträger ist, wenn sie binnen sechs Monaten nach dem Tag, an dem die Eintragung der Verschmelzung in das Register des Sitzes desjenigen Rechtsträgers, dessen Gläubiger sie sind, als bekannt gemacht gilt, ihren Anspruch nach Grund und Höhe schriftlich anmelden, Sicherheit zu leisten, soweit sie nicht Befriedigung verlangen können. Dieses Recht steht den Gläubigern jedoch nur zu, wenn sie glaubhaft machen, dass durch die Verschmelzung die Erfüllung ihrer Forderung gefährdet wird"
    },
    {
      "date": "2025-09-24",
      "id": "131188",
      "original_text": "Registerbekanntmachung nach dem Umwandlungsgesetz\nBaden-Württemberg Amtsgericht Stuttgart HRB 301795\nValeo Schalter und Sensoren GmbH – Bietigheim-Bissingen",
      "type": "Registerbekanntmachung nach dem Umwandlungsgesetz",
      "state": "Baden-Württemberg",
      "amtsgericht": "Amtsgericht Stuttgart",
      "registernummer": "HRB 301795",
      "registerart": "HRB",
      "company_name": "Valeo Schalter und Sensoren GmbH",
      "company_seat": "Bietigheim-Bissingen",
      "details": "24.09.2025 (Bekanntmachungsdatum)\n\nBaden-Württemberg Amtsgericht Stuttgart HRB 301795\nRegisterbekanntmachung nach dem Umwandlungsgesetz 24.09.2025 (Eintragungsdatum)\n\nValeo Schalter und Sensoren GmbH\nGesellschaft mit beschränkter Haftung\nBietigheim-Bissingen\n\nAls nicht eingetragen wird bekanntgemacht:\nDen Gläubigern der an der Verschmelzung beteiligten Rechtsträger ist, wenn sie binnen sechs Monaten nach dem Tag, an dem die Eintragung der Verschmelzung in das Register des Sitzes desjenigen Rechtsträgers, dessen Gläubiger sie sind, nach § 19 Abs. 3 UmwG als bekanntgemacht gilt, ihren Anspruch nach Grund und Höhe schriftlich anmelden, Sicherheit zu leisten, soweit sie nicht Befriedigung verlangen können. Dieses Recht steht den Gläubigern jedoch nur zu, wenn sie glaubhaft machen, dass durch die Verschmelzung die Erfüllung ihrer Forderung gefährdet wird."
    },
    {
      "date": "2025-09-24",
      "id": "131189",
      "original_text": "Registerbekanntmachung nach dem Umwandlungsgesetz\nBaden-Württemberg Amtsgericht Stuttgart HRB 745286\nCS GmbH – Stuttgart",
      "type": "Registerbekanntmachung nach dem Umwandlungsgesetz",
      "state": "Baden-Württemberg",
      "amtsgericht": "Amtsgericht Stuttgart",
      "registernummer": "HRB 745286",
      "registerart": "HRB",
      "company_name": "CS GmbH",
      "company_seat": "Stuttgart",
      "details": "24.09.2025 (Bekanntmachungsdatum)\n\nBaden-Württemberg Amtsgericht Stuttgart HRB 745286\nRegisterbekanntmachung nach dem Umwandlungsgesetz 24.09.2025 (Eintragungsdatum)\n\nCS GmbH\nGesellschaft mit beschränkter Haftung\nStuttgart\n\nAls nicht eingetragen wird bekanntgemacht:\nDen Gläubigern der an der Verschmelzung beteiligten Rechtsträger ist, wenn sie binnen sechs Monaten nach dem Tag, an dem die Eintragung der Verschmelzung in das Register des Sitzes desjenigen Rechtsträgers, dessen Gläubiger sie sind, nach § 19 Abs. 3 UmwG als bekanntgemacht gilt, ihren Anspruch nach Grund und Höhe schriftlich anmelden, Sicherheit zu leisten, soweit sie nicht Befriedigung verlangen können. Dieses Recht steht den Gläubigern jedoch nur zu, wenn sie glaubhaft machen, dass durch die Verschmelzung die Erfüllung ihrer Forderung gefährdet wird."
    },
    {
      "date": "2025-09-24",
      "id": "131190",
      "original_text": "Registerbekanntmachung nach dem Umwandlungsgesetz\nBaden-Württemberg Amtsgericht Stuttgart HRB 590280\nLIGHT & MORE GmbH – Forchtenberg",
      "type": "Registerbekanntmachung nach dem Umwandlungsgesetz",
      "state": "Baden-Württemberg",
      "amtsgericht": "Amtsgericht Stuttgart",
      "registernummer": "HRB 590280",
      "registerart": "HRB",
      "company_name": "LIGHT & MORE GmbH",
      "company_seat": "Forchtenberg",
      "details": "24.09.2025 (Bekanntmachungsdatum)\n\nBaden-Württemberg Amtsgericht Stuttgart HRB 590280\nRegisterbekanntmachung nach dem Umwandlungsgesetz 16.09.2025 (Eintragungsdatum)\n\nLIGHT & MORE GmbH\nGesellschaft mit beschränkter Haftung\nForchtenberg\n\nAls nicht eingetragen wird bekanntgemacht:\nDen Gläubigern der an der Verschmelzung beteiligten Rechtsträger ist, wenn sie binnen sechs Monaten nach dem Tag, an dem die Eintragung der Verschmelzung in das Register des Sitzes desjenigen Rechtsträgers, dessen Gläubiger sie sind, nach § 19 Abs. 3 UmwG als bekanntgemacht gilt, ihren Anspruch nach Grund und Höhe schriftlich anmelden, Sicherheit zu leisten, soweit sie nicht Befriedigung verlangen können. Dieses Recht steht den Gläubigern jedoch nur zu, wenn sie glaubhaft machen, dass durch die Verschmelzung die Erfüllung ihrer Forderung gefährdet wird."
    },
    {
      "date": "2025-09-24",
      "id": "131191",
      "original_text": "Registerbekanntmachung nach dem Umwandlungsgesetz\nThüringen Amtsgericht Jena HRB 521701\nAfter Inject Cosmetics GmbH – Schleiz",
      "type": "Registerbekanntmachung nach dem Umwandlungsgesetz",
      "state": "Thüringen",
      "amtsgericht": "Amtsgericht Jena",
      "registernummer": "HRB 521701",
      "registerart": "HRB",
      "company_name": "After Inject Cosmetics GmbH",
      "company_seat": "Schleiz",
      "details": "24.09.2025 (Bekanntmachungsdatum)\n\nThüringen Amtsgericht Jena HRB 521701\nRegisterbekanntmachung nach dem Umwandlungsgesetz 24.09.2025 (Eintragungsdatum)\n\nAfter Inject Cosmetics GmbH\nGesellschaft mit beschränkter Haftung\nSchleiz\n\nNicht eingetragen: Den Gläubigern der an der Ausgliederung beteiligten Rechtsträger, ist wenn sie binnen sechs Monaten nach dem Tag, an dem die Eintragung der Ausgliederung in das Register des Sitzes desjenigen Rechtsträgers, dessen Gläubiger sie sind, nach §§125, 19 Abs. 3 UmwG als bekanntgemacht gilt, ihren Anspruch nach Grund und Höhe schriftlich anmelden, Sicherheit zu leisten, soweit sie nicht Befriedigung verlangen können. Dieses Recht steht ihnen jedoch nur zu, wenn sie glaubhaft machen, daß durch die Ausgliederung die Erfüllung ihrer Forderung gefährdet wird."
    },
    {
      "date": "2025-09-24",
      "id": "131192",
      "original_text": "Registerbekanntmachung nach dem Umwandlungsgesetz\nThüringen Amtsgericht Jena HRA 507111\nL. Valentin Handel mit Kosmetik e. K. – Schleiz",
      "type": "Registerbekanntmachung nach dem Umwandlungsgesetz",
      "state": "Thüringen",
      "amtsgericht": "Amtsgericht Jena",
      "registernummer": "HRA 507111",
      "registerart": "HRA",
      "company_name": "L. Valentin Handel mit Kosmetik e. K.",
      "company_seat": "Schleiz",
      "details": "24.09.2025 (Bekanntmachungsdatum)\n\nThüringen Amtsgericht Jena HRA 507111\nRegisterbekanntmachung nach dem Umwandlungsgesetz 24.09.2025 (Eintragungsdatum)\n\nL. Valentin Handel mit Kosmetik e. K.\nEinzelkaufmann / Einzelkauffrau\nSchleiz\n\nNicht eingetragen: Den Gläubigern der an der Ausgliederung beteiligten Rechtsträger, ist wenn sie binnen sechs Monaten nach dem Tag, an dem die Eintragung der Ausgliederung in das Register des Sitzes desjenigen Rechtsträgers, dessen Gläubiger sie sind, nach §§125, 19 Abs. 3 UmwG als bekanntgemacht gilt, ihren Anspruch nach Grund und Höhe schriftlich anmelden, Sicherheit zu leisten, soweit sie nicht Befriedigung verlangen können. Dieses Recht steht ihnen jedoch nur zu, wenn sie glaubhaft machen, daß durch die Ausgliederung die Erfüllung ihrer Forderung gefährdet wird."
    },
    {
      "date": "2025-09-24",
      "id": "131193",
      "original_text": "Registerbekanntmachung nach dem Umwandlungsgesetz\nHamburg Amtsgericht Hamburg HRB 75365\nM-Soft Hamburg GmbH – Hamburg",
      "type": "Registerbekanntmachung nach dem Umwandlungsgesetz",
      "state": "Hamburg",
      "amtsgericht": "Amtsgericht Hamburg",
      "registernummer": "HRB 75365",
      "registerart": "HRB",
      "company_name": "M-Soft Hamburg GmbH",
      "company_seat": "Hamburg",
      "details": "24.09.2025 (Bekanntmachungsdatum)\n\nHamburg Amtsgericht Hamburg HRB 75365\nRegisterbekanntmachung nach dem Umwandlungsgesetz 24.09.2025 (Eintragungsdatum)\n\nM-Soft Hamburg GmbH\nGesellschaft mit beschränkter Haftung\nHamburg\n\nAls nicht eingetragen wird bekannt gemacht:\nDen Gläubigern der an der Verschmelzung beteiligten Gesellschaften ist, wenn sie binnen sechs Monaten nach dem Tag, an dem die Eintragung der Verschmelzung in das Register des Sitzes desjenigen Rechtsträgers, dessen Gläubiger sie sind, nach § 19 Absatz 3 UmwG als bekannt gemacht gilt, ihren Anspruch nach Grund und Höhe schriftlich anmelden, Sicherheit zu leisten, soweit sie nicht Befriedigung verlangen können. Dieses Recht steht den Gläubigern jedoch nur zu, wenn sie glaubhaft machen, dass durch die Verschmelzung die Erfüllung ihrer Forderung gefährdet wird."
    },
    {
      "date": "2025-09-24",
      "id": "131194",
      "original_text": "Registerbekanntmachung nach dem Umwandlungsgesetz\nBerlin Amtsgericht Berlin (Charlottenburg) HRB 277418\nFröhnel Sanitär-Heizungstechnik GmbH – Berlin",
      "type": "Registerbekanntmachung nach dem Umwandlungsgesetz",
      "state": "Berlin",
      "amtsgericht": "Amtsgericht Berlin (Charlottenburg)",
      "registernummer": "HRB 277418",
      "registerart": "HRB",
      "company_name": "Fröhnel Sanitär-Heizungstechnik GmbH",
      "company_seat": "Berlin",
      "details": "24.09.2025 (Bekanntmachungsdatum)\n\nBerlin Amtsgericht Berlin (Charlottenburg) HRB 277418\nRegisterbekanntmachung nach dem Umwandlungsgesetz 19.09.2025 (Eintragungsdatum)\n\nFröhnel Sanitär-Heizungstechnik GmbH\nGesellschaft mit beschränkter Haftung\nBerlin\n\nZu Eintragungsnummer 4 vom 19.09.2025 wird als nicht eingetragen veröffentlicht: Den Gläubigern der an der Spaltung beteiligten Rechtsträger ist, wenn sie binnen sechs Monaten nach dem Tag, an dem die Eintragung der Spaltung in das Register des Sitzes desjenigen Rechtsträgers, dessen Gläubiger sie sind, als bekannt gemacht gilt, ihren Anspruch nach Grund und Höhe schriftlich anmelden, Sicherheit zu leisten, soweit sie nicht Befriedigung verlangen können. Dieses Recht steht den Gläubigern jedoch nur zu, wenn sie glaubhaft machen, dass durch die Spaltung die Erfüllung ihrer Forderung gefährdet wird. Das Recht, Sicherheitsleistung zu verlangen, steht Gläubigern nicht zu, die im Falle der Insolvenz ein Recht auf vorzugsweise Befriedigung aus einer Deckungsmasse haben, die nach gesetzlicher Vorschrift zu ihrem Schutz errichtet und staatlich überwacht ist."
    },
    {
      "date": "2025-09-24",
      "id": "131195",
      "original_text": "Löschungsankündigung\nMecklenburg-Vorpommern Amtsgericht Stralsund HRB 21723\nBaltic Grund und Boden GmbH – Heringsdorf",
      "type": "Löschungsankündigung",
      "state": "Mecklenburg-Vorpommern",
      "amtsgericht": "Amtsgericht Stralsund",
      "registernummer": "HRB 21723",
      "registerart": "HRB",
      "company_name": "Baltic Grund und Boden GmbH",
      "company_seat": "Heringsdorf",
      "details": "24.09.2025 (Bekanntmachungsdatum)\n\nMecklenburg-Vorpommern Amtsgericht Stralsund HRB 21723\nLöschungsankündigung\n\nBaltic Grund und Boden GmbH\nGesellschaft mit beschränkter Haftung\nHeringsdorf\n\nDas Registergericht beabsichtigt, die im Handelsregister eingetragene Gesellschaft von Amts wegen nach § 394 FamFG zu löschen. Die Frist zur Erhebung eines Widerspruchs gegen die beabsichtigte Löschung wird auf 1 Monat festgesetzt."
    },
    {
      "date": "2025-09-24",
      "id": "131196",
      "original_text": "Registerbekanntmachung nach dem Umwandlungsgesetz\nSachsen-Anhalt Amtsgericht Stendal HRB 13027\nivUnion GmbH – Sangerhausen",
      "type": "Registerbekanntmachung nach dem Umwandlungsgesetz",
      "state": "Sachsen-Anhalt",
      "amtsgericht": "Amtsgericht Stendal",
      "registernummer": "HRB 13027",
      "registerart": "HRB",
      "company_name": "ivUnion GmbH",
      "company_seat": "Sangerhausen",
      "details": "24.09.2025 (Bekanntmachungsdatum)\n\nSachsen-Anhalt Amtsgericht Stendal HRB 13027\nRegisterbekanntmachung nach dem Umwandlungsgesetz 24.09.2025 (Eintragungsdatum)\n\nivUnion GmbH\nGesellschaft mit beschränkter Haftung\nSangerhausen\n\nDie Gesellschaft ist auf Grund des Verschmelzungsvertrages vom 10.07.2025 sowie der Beschlüsse der Gesellschafterversammlungen vom selben Tag mit der vialog GmbH mit dem Sitz in Sangerhausen (Amtsgericht Stendal HRB 9716) verschmolzen. Die Verschmelzung wurdeam 24.09.2025 in das Handelsregister der übernehmenden Gesellschaft eingetragen. Nicht eingetragen: Den Gläubigern der an der Verschmelzung beteiligten Rechtsträger ist, wenn sie binnen sechs Monaten nach dem Tag, an dem die Eintragung der Verschmelzung nach § 19 Abs. 3 UmwG als bekanntgemacht gilt, ihren Anspruch nach Grund und Höhe schriftlich anmelden, Sicherheit zu leisten, soweit sie nicht Befriedigung verlangen können. Dieses Recht steht ihnen jedoch nur zu, wenn sie glaubhaft machen, dass durch die Verschmelzung die Erfüllung ihrer Forderung gefährdet wird."
    },
    {
      "date": "2025-09-24",
      "id": "131197",
      "original_text": "Registerbekanntmachung nach dem Umwandlungsgesetz\nSachsen-Anhalt Amtsgericht Stendal HRB 9716\nvialog Konzept GmbH – Sangerhausen",
      "type": "Registerbekanntmachung nach dem Umwandlungsgesetz",
      "state": "Sachsen-Anhalt",
      "amtsgericht": "Amtsgericht Stendal",
      "registernummer": "HRB 9716",
      "registerart": "HRB",
      "company_name": "vialog Konzept GmbH",
      "company_seat": "Sangerhausen",
      "details": "24.09.2025 (Bekanntmachungsdatum)\n\nSachsen-Anhalt Amtsgericht Stendal HRB 9716\nRegisterbekanntmachung nach dem Umwandlungsgesetz 24.09.2025 (Eintragungsdatum)\n\nvialog Konzept GmbH\nGesellschaft mit beschränkter Haftung\nSangerhausen\n\nDie ivUnion GmbH mit dem Sitz in Sangerhausen (Amtsgericht Stendal HRB 13027) ist auf Grund des Verschmelzungsvertrages vom 10.07.2025    und der Beschlüsse der Gesellschafterversammlungen vom selben Tag mit der Gesellschaft verschmolzen.Nicht eingetragen: Den Gläubigern der an der Verschmelzung beteiligten Rechtsträger ist, wenn sie binnen sechs Monaten nach dem Tag, an dem die Eintragung der Verschmelzung nach § 19 Abs. 3 UmwG als bekanntgemacht gilt, ihren Anspruch nach Grund und Höhe schriftlich anmelden, Sicherheit zu leisten, soweit sie nicht Befriedigung verlangen können. Dieses Recht steht ihnen jedoch nur zu, wenn sie glaubhaft machen, dass durch die Verschmelzung die Erfüllung ihrer Forderung gefährdet wird."
    },
    {
      "date": "2025-09-24",
      "id": "131198",
      "original_text": "Registerbekanntmachung nach dem Umwandlungsgesetz\nSchleswig-Holstein Amtsgericht Pinneberg HRA 1297 EL\nGrüning Automobile KG (GmbH & Co) – Elmshorn",
      "type": "Registerbekanntmachung nach dem Umwandlungsgesetz",
      "state": "Schleswig-Holstein",
      "amtsgericht": "Amtsgericht Pinneberg",
      "registernummer": "HRA 1297 EL",
      "registerart": "HRA",
      "company_name": "Grüning Automobile KG (GmbH & Co)",
      "company_seat": "Elmshorn",
      "details": "24.09.2025 (Bekanntmachungsdatum)\n\nSchleswig-Holstein Amtsgericht Pinneberg HRA 1297 EL\nRegisterbekanntmachung nach dem Umwandlungsgesetz 22.09.2025 (Eintragungsdatum)\n\nGrüning Automobile KG (GmbH & Co)\nKommanditgesellschaft\nElmshorn\n\nZu Eintragungsnummer 6 vom 22.09.2025 wird als nicht eingetragen veröffentlicht:  Als nicht eingetragen wird veröffentlicht: Den Gläubigern der an der Verschmelzung beteiligten Rechtsträger ist, wenn sie binnen sechs Monaten nach dem Tag, an dem die Eintragung der Verschmelzung in das Register des Sitzes desjenigen Rechtsträgers, dessen Gläubiger sie sind, als bekannt gemacht gilt, ihren Anspruch nach Grund und Höhe schriftlich anmelden, Sicherheit zu leisten, soweit sie nicht Befriedigung verlangen können. Dieses Recht steht den Gläubigern jedoch nur zu, wenn sie glaubhaft machen, dass durch die Verschmelzung die Erfüllung ihrer Forderung gefährdet wird. Das Recht, Sicherheitsleistung zu verlangen, steht Gläubigern nicht zu, die im Falle der Insolvenz ein Recht auf vorzugsweise Befriedigung aus einer Deckungsmasse haben, die nach gesetzlicher Vorschrift zu ihrem Schutz errichtet und staatlich überwacht ist."
    },
    {
      "date": "2025-09-24",
      "id": "131199",
      "original_text": "Registerbekanntmachung nach dem Umwandlungsgesetz\nBrandenburg Amtsgericht Neuruppin HRA 3942\nAxel Krause e.K. – Löwenberger Land OT Häsen",
      "type": "Registerbekanntmachung nach dem Umwandlungsgesetz",
      "state": "Brandenburg",
      "amtsgericht": "Amtsgericht Neuruppin",
      "registernummer": "HRA 3942",
      "registerart": "HRA",
      "company_name": "Axel Krause e.K.",
      "company_seat": "Löwenberger Land OT Häsen",
      "details": "24.09.2025 (Bekanntmachungsdatum)\n\nBrandenburg Amtsgericht Neuruppin HRA 3942\nRegisterbekanntmachung nach dem Umwandlungsgesetz 24.09.2025 (Eintragungsdatum)\n\nAxel Krause e.K.\nEinzelkaufmann / Einzelkauffrau\nLöwenberger Land OT Häsen\n\nZu Eintragungsnummer 2 vom 24.09.2025 wird als nicht eingetragen veröffentlicht:\n\nDen Gläubigern der an der Umwandlung beteiligten Rechtsträger ist, wenn sie binnen sechs Monaten nach dem Tag, an dem die Eintragung der Umwandlung in das Register des Sitzes desjenigen Rechtsträgers, dessen Gläubiger sie sind, als bekannt gemacht gilt, ihren Anspruch nach Grund und Höhe schriftlich anmelden, Sicherheit zu leisten, soweit sie nicht Befriedigung verlangen können. Dieses Recht steht den Gläubigern jedoch nur zu, wenn sie glaubhaft machen, dass durch die Umwandlung die Erfüllung ihrer Forderung gefährdet wird"
    },
    {
      "date": "2025-09-24",
      "id": "131200",
      "original_text": "Registerbekanntmachung nach dem Umwandlungsgesetz\nBaden-Württemberg Amtsgericht Stuttgart HRB 778958\nLeanovent IT GmbH – Neuenstadt am Kocher",
      "type": "Registerbekanntmachung nach dem Umwandlungsgesetz",
      "state": "Baden-Württemberg",
      "amtsgericht": "Amtsgericht Stuttgart",
      "registernummer": "HRB 778958",
      "registerart": "HRB",
      "company_name": "Leanovent IT GmbH",
      "company_seat": "Neuenstadt am Kocher",
      "details": "24.09.2025 (Bekanntmachungsdatum)\n\nBaden-Württemberg Amtsgericht Stuttgart HRB 778958\nRegisterbekanntmachung nach dem Umwandlungsgesetz 29.08.2025 (Eintragungsdatum)\n\nLeanovent IT GmbH\nGesellschaft mit beschränkter Haftung\nNeuenstadt am Kocher\n\nAls nicht eingetragen wird bekanntgemacht:\nDen Gläubigern der an der Verschmelzung beteiligten Rechtsträger ist, wenn sie binnen sechs Monaten nach dem Tag, an dem die Eintragung der Verschmelzung in das Register des Sitzes desjenigen Rechtsträgers, dessen Gläubiger sie sind, nach § 19 Abs. 3 UmwG als bekanntgemacht gilt, ihren Anspruch nach Grund und Höhe schriftlich anmelden, Sicherheit zu leisten, soweit sie nicht Befriedigung verlangen können. Dieses Recht steht den Gläubigern jedoch nur zu, wenn sie glaubhaft machen, dass durch die Verschmelzung die Erfüllung ihrer Forderung gefährdet wird."
    },
    {
      "date": "2025-09-24",
      "id": "131201",
      "original_text": "Registerbekanntmachung nach dem Umwandlungsgesetz\nSchleswig-Holstein Amtsgericht Lübeck HRB 26493\nMöller Elektrotechnik GmbH – Steinburg",
      "type": "Registerbekanntmachung nach dem Umwandlungsgesetz",
      "state": "Schleswig-Holstein",
      "amtsgericht": "Amtsgericht Lübeck",
      "registernummer": "HRB 26493",
      "registerart": "HRB",
      "company_name": "Möller Elektrotechnik GmbH",
      "company_seat": "Steinburg",
      "details": "24.09.2025 (Bekanntmachungsdatum)\n\nSchleswig-Holstein Amtsgericht Lübeck HRB 26493\nRegisterbekanntmachung nach dem Umwandlungsgesetz 23.09.2025 (Eintragungsdatum)\n\nMöller Elektrotechnik GmbH\nGesellschaft mit beschränkter Haftung\nSteinburg\n\nZu Eintragungsnummer 2 vom 23.09.2025 wird als nicht eingetragen veröffentlicht:  Als nicht eingetragen wird veröffentlicht: Den Gläubigern der an der Verschmelzung beteiligten Rechtsträger ist, wenn sie binnen sechs Monaten nach dem Tag, an dem die Eintragung der Verschmelzung in das Register des Sitzes desjenigen Rechtsträgers, dessen Gläubiger sie sind, als bekannt gemacht gilt, ihren Anspruch nach Grund und Höhe schriftlich anmelden, Sicherheit zu leisten, soweit sie nicht Befriedigung verlangen können. Dieses Recht steht den Gläubigern jedoch nur zu, wenn sie glaubhaft machen, dass durch die Verschmelzung die Erfüllung ihrer Forderung gefährdet wird."
    },
    {
      "date": "2025-09-24",
      "id": "131202",
      "original_text": "Registerbekanntmachung nach dem Umwandlungsgesetz\nBaden-Württemberg Amtsgericht Stuttgart HRB 211557\nGall GmbH – Neuhausen auf den Fildern",
      "type": "Registerbekanntmachung nach dem Umwandlungsgesetz",
      "state": "Baden-Württemberg",
      "amtsgericht": "Amtsgericht Stuttgart",
      "registernummer": "HRB 211557",
      "registerart": "HRB",
      "company_name": "Gall GmbH",
      "company_seat": "Neuhausen auf den Fildern",
      "details": "24.09.2025 (Bekanntmachungsdatum)\n\nBaden-Württemberg Amtsgericht Stuttgart HRB 211557\nRegisterbekanntmachung nach dem Umwandlungsgesetz 24.09.2025 (Eintragungsdatum)\n\nGall GmbH\nGesellschaft mit beschränkter Haftung\nNeuhausen auf den Fildern\n\nAls nicht eingetragen wird bekanntgemacht:\nDen Gläubigern der an der Verschmelzung beteiligten Rechtsträger ist, wenn sie binnen sechs Monaten nach dem Tag, an dem die Eintragung der Verschmelzung in das Register des Sitzes desjenigen Rechtsträgers, dessen Gläubiger sie sind, nach § 19 Abs. 3 UmwG als bekanntgemacht gilt, ihren Anspruch nach Grund und Höhe schriftlich anmelden, Sicherheit zu leisten, soweit sie nicht Befriedigung verlangen können. Dieses Recht steht den Gläubigern jedoch nur zu, wenn sie glaubhaft machen, dass durch die Verschmelzung die Erfüllung ihrer Forderung gefährdet wird."
    },
    {
      "date": "2025-09-24",
      "id": "131203",
      "original_text": "Löschungsankündigung\nBerlin Amtsgericht Berlin (Charlottenburg) HRB 145288\nCAB Holz Group GmbH – Berlin",
      "type": "Löschungsankündigung",
      "state": "Berlin",
      "amtsgericht": "Amtsgericht Berlin (Charlottenburg)",
      "registernummer": "HRB 145288",
      "registerart": "HRB",
      "company_name": "CAB Holz Group GmbH",
      "company_seat": "Berlin",
      "details": "24.09.2025 (Bekanntmachungsdatum)\n\nBerlin Amtsgericht Berlin (Charlottenburg) HRB 145288\nLöschungsankündigung\n\nCAB Holz Group GmbH\nGesellschaft mit beschränkter Haftung\nBerlin\n\nBei der nachstehenden Gesellschaft wird das Amtslöschungsverfahren gemäß § 394 FamFG eingeleitet. Widerspruchsfrist 6 Wochen"
    },
    {
      "date": "2025-09-24",
      "id": "131204",
      "original_text": "Registerbekanntmachung nach dem Umwandlungsgesetz\nSchleswig-Holstein Amtsgericht Lübeck HRA 11536\nMöller Elektrotechnik e.K. – Steinburg",
      "type": "Registerbekanntmachung nach dem Umwandlungsgesetz",
      "state": "Schleswig-Holstein",
      "amtsgericht": "Amtsgericht Lübeck",
      "registernummer": "HRA 11536",
      "registerart": "HRA",
      "company_name": "Möller Elektrotechnik e.K.",
      "company_seat": "Steinburg",
      "details": "24.09.2025 (Bekanntmachungsdatum)\n\nSchleswig-Holstein Amtsgericht Lübeck HRA 11536\nRegisterbekanntmachung nach dem Umwandlungsgesetz 23.09.2025 (Eintragungsdatum)\n\nMöller Elektrotechnik e.K.\nEinzelkaufmann / Einzelkauffrau\nSteinburg\n\nZu Eintragungsnummer 2 vom 23.09.2025 wird als nicht eingetragen veröffentlicht:\nDen Gläubigern der an der Ausgliederung beteiligten Rechtsträger ist, wenn sie binnen sechs Monaten nach dem Tag, an dem die Eintragung der Ausgliederung in das Register des Sitzes desjenigen Rechtsträgers, dessen Gläubiger sie sind, als bekannt gemacht gilt, ihren Anspruch nach Grund und Höhe schriftlich anmelden, Sicherheit zu leisten, soweit sie nicht Befriedigung verlangen können. Dieses Recht steht den Gläubigern jedoch nur zu, wenn sie glaubhaft machen, dass durch die Ausgliederung die Erfüllung ihrer Forderung gefährdet wird."
    },
    {
      "date": "2025-09-24",
      "id": "131205",
      "original_text": "Registerbekanntmachung nach dem Umwandlungsgesetz\nBerlin Amtsgericht Berlin (Charlottenburg) HRA 64403\nNiels Fröhnel Sanitärservice e.K. – Berlin",
      "type": "Registerbekanntmachung nach dem Umwandlungsgesetz",
      "state": "Berlin",
      "amtsgericht": "Amtsgericht Berlin (Charlottenburg)",
      "registernummer": "HRA 64403",
      "registerart": "HRA",
      "company_name": "Niels Fröhnel Sanitärservice e.K.",
      "company_seat": "Berlin",
      "details": "24.09.2025 (Bekanntmachungsdatum)\n\nBerlin Amtsgericht Berlin (Charlottenburg) HRA 64403\nRegisterbekanntmachung nach dem Umwandlungsgesetz 19.09.2025 (Eintragungsdatum)\n\nNiels Fröhnel Sanitärservice e.K.\nEinzelkaufmann / Einzelkauffrau\nBerlin\n\nZu Eintragungsnummer 2 vom 19.09.2025 wird als nicht eingetragen veröffentlicht: Den Gläubigern der an der Spaltung beteiligten Rechtsträger ist, wenn sie binnen sechs Monaten nach dem Tag, an dem die Eintragung der Spaltung in das Register des Sitzes desjenigen Rechtsträgers, dessen Gläubiger sie sind, als bekannt gemacht gilt, ihren Anspruch nach Grund und Höhe schriftlich anmelden, Sicherheit zu leisten, soweit sie nicht Befriedigung verlangen können. Dieses Recht steht den Gläubigern jedoch nur zu, wenn sie glaubhaft machen, dass durch die Spaltung die Erfüllung ihrer Forderung gefährdet wird. Das Recht, Sicherheitsleistung zu verlangen, steht Gläubigern nicht zu, die im Falle der Insolvenz ein Recht auf vorzugsweise Befriedigung aus einer Deckungsmasse haben, die nach gesetzlicher Vorschrift zu ihrem Schutz errichtet und staatlich überwacht ist."
    },
    {
      "date": "2025-09-24",
      "id": "131206",
      "original_text": "Registerbekanntmachung nach dem Umwandlungsgesetz\nBaden-Württemberg Amtsgericht Stuttgart HRA 742656\nWilli Weller Brennstoffe GmbH & Co. KG – Bietigheim-Bissingen",
      "type": "Registerbekanntmachung nach dem Umwandlungsgesetz",
      "state": "Baden-Württemberg",
      "amtsgericht": "Amtsgericht Stuttgart",
      "registernummer": "HRA 742656",
      "registerart": "HRA",
      "company_name": "Willi Weller Brennstoffe GmbH & Co. KG",
      "company_seat": "Bietigheim-Bissingen",
      "details": "24.09.2025 (Bekanntmachungsdatum)\n\nBaden-Württemberg Amtsgericht Stuttgart HRA 742656\nRegisterbekanntmachung nach dem Umwandlungsgesetz 24.09.2025 (Eintragungsdatum)\n\nWilli Weller Brennstoffe GmbH & Co. KG\nKommanditgesellschaft\nBietigheim-Bissingen\n\nAls nicht eingetragen wird bekanntgemacht:\nDen Gläubigern der an der Ausgliederung beteiligten Rechtsträger ist, wenn sie binnen sechs Monaten nach dem Tag, an dem die Eintragung der Ausgliederung in das Register des Sitzes desjenigen Rechtsträgers, dessen Gläubiger sie sind, nach § 19 Abs. 3 UmwG als bekanntgemacht gilt, ihren Anspruch nach Grund und Höhe schriftlich anmelden, Sicherheit zu leisten, soweit sie nicht Befriedigung verlangen können. Dieses Recht steht den Gläubigern jedoch nur zu, wenn sie glaubhaft machen, dass durch die Ausgliederung die Erfüllung ihrer Forderung gefährdet wird."
    },
    {
      "date": "2025-09-24",
      "id": "131207",
      "original_text": "Registerbekanntmachung nach dem Umwandlungsgesetz\nBaden-Württemberg Amtsgericht Ulm HRA 729523\nWerz GmbH & Co. KG – Laupheim",
      "type": "Registerbekanntmachung nach dem Umwandlungsgesetz",
      "state": "Baden-Württemberg",
      "amtsgericht": "Amtsgericht Ulm",
      "registernummer": "HRA 729523",
      "registerart": "HRA",
      "company_name": "Werz GmbH & Co. KG",
      "company_seat": "Laupheim",
      "details": "24.09.2025 (Bekanntmachungsdatum)\n\nBaden-Württemberg Amtsgericht Ulm HRA 729523\nRegisterbekanntmachung nach dem Umwandlungsgesetz 24.09.2025 (Eintragungsdatum)\n\nWerz GmbH & Co. KG\nKommanditgesellschaft\nLaupheim\n\nAls nicht eingetragen wird bekanntgemacht:\nDen Gläubigern der an der Ausgliederung beteiligten Rechtsträger ist, wenn sie binnen sechs Monaten nach dem Tag, an dem die Eintragung der Ausgliederung in das Register des Sitzes desjenigen Rechtsträgers, dessen Gläubiger sie sind, nach § 19 Abs. 3 UmwG als bekanntgemacht gilt, ihren Anspruch nach Grund und Höhe schriftlich anmelden, Sicherheit zu leisten, soweit sie nicht Befriedigung verlangen können. Dieses Recht steht den Gläubigern jedoch nur zu, wenn sie glaubhaft machen, dass durch die Ausgliederung die Erfüllung ihrer Forderung gefährdet wird."
    },
    {
      "date": "2025-09-24",
      "id": "131208",
      "original_text": "Registerbekanntmachung nach dem Umwandlungsgesetz\nBaden-Württemberg Amtsgericht Ulm HRA 729515\nWerz Transact e.K. – Laupheim",
      "type": "Registerbekanntmachung nach dem Umwandlungsgesetz",
      "state": "Baden-Württemberg",
      "amtsgericht": "Amtsgericht Ulm",
      "registernummer": "HRA 729515",
      "registerart": "HRA",
      "company_name": "Werz Transact e.K.",
      "company_seat": "Laupheim",
      "details": "24.09.2025 (Bekanntmachungsdatum)\n\nBaden-Württemberg Amtsgericht Ulm HRA 729515\nRegisterbekanntmachung nach dem Umwandlungsgesetz 24.09.2025 (Eintragungsdatum)\n\nWerz Transact e.K.\nEinzelkaufmann / Einzelkauffrau\nLaupheim\n\nAls nicht eingetragen wird bekanntgemacht:\nDen Gläubigern der an der Ausgliederung beteiligten Rechtsträger ist, wenn sie binnen sechs Monaten nach dem Tag, an dem die Eintragung der Ausgliederung in das Register des Sitzes desjenigen Rechtsträgers, dessen Gläubiger sie sind, nach § 19 Abs. 3 UmwG als bekanntgemacht gilt, ihren Anspruch nach Grund und Höhe schriftlich anmelden, Sicherheit zu leisten, soweit sie nicht Befriedigung verlangen können. Dieses Recht steht den Gläubigern jedoch nur zu, wenn sie glaubhaft machen, dass durch die Ausgliederung die Erfüllung ihrer Forderung gefährdet wird."
    },
    {
      "date": "2025-09-24",
      "id": "131209",
      "original_text": "Löschungsankündigung\nBerlin Amtsgericht Berlin (Charlottenburg) HRB 243279\nFegerin UG (haftungsbeschränkt) – Berlin",
      "type": "Löschungsankündigung",
      "state": "Berlin",
      "amtsgericht": "Amtsgericht Berlin (Charlottenburg)",
      "registernummer": "HRB 243279",
      "registerart": "HRB",
      "company_name": "Fegerin UG (haftungsbeschränkt)",
      "company_seat": "Berlin",
      "details": "24.09.2025 (Bekanntmachungsdatum)\n\nBerlin Amtsgericht Berlin (Charlottenburg) HRB 243279\nLöschungsankündigung\n\nFegerin UG (haftungsbeschränkt)\nGesellschaft mit beschränkter Haftung\nBerlin\n\nBei der nachstehenden Gesellschaft wird das Amtslöschungsverfahren gemäß § 394 FamFG eingeleitet. Widerspruchsfrist 6 Wochen"
    },
    {
      "date": "2025-09-24",
      "id": "131210",
      "original_text": "Registerbekanntmachung nach dem Umwandlungsgesetz\nSachsen-Anhalt Amtsgericht Stendal HRB 18111\nLeinetaler Hochbau GmbH – Sangerhausen",
      "type": "Registerbekanntmachung nach dem Umwandlungsgesetz",
      "state": "Sachsen-Anhalt",
      "amtsgericht": "Amtsgericht Stendal",
      "registernummer": "HRB 18111",
      "registerart": "HRB",
      "company_name": "Leinetaler Hochbau GmbH",
      "company_seat": "Sangerhausen",
      "details": "24.09.2025 (Bekanntmachungsdatum)\n\nSachsen-Anhalt Amtsgericht Stendal HRB 18111\nRegisterbekanntmachung nach dem Umwandlungsgesetz 24.09.2025 (Eintragungsdatum)\n\nLeinetaler Hochbau GmbH\nGesellschaft mit beschränkter Haftung\nSangerhausen\n\nDie Dachdeckerfachbetrieb Maik Gorgas GmbH mit dem Sitz in Sangerhausen (Amtsgericht Stendal HRB 17747) ist auf Grund des Verschmelzungsvertrages vom 25.11.2024    und der Beschlüsse der Gesellschafterversammlungen vom selben Tag mit der Gesellschaft verschmolzen. Nicht eingetragen: Den Gläubigern der an der Verschmelzung beteiligten Rechtsträger ist, wenn sie binnen sechs Monaten nach dem Tag, an dem die Eintragung der Verschmelzung nach § 19 Abs. 3 UmwG als bekanntgemacht gilt, ihren Anspruch nach Grund und Höhe schriftlich anmelden, Sicherheit zu leisten, soweit sie nicht Befriedigung verlangen können. Dieses Recht steht ihnen jedoch nur zu, wenn sie glaubhaft machen, dass durch die Verschmelzung die Erfüllung ihrer Forderung gefährdet wird."
    },
    {
      "date": "2025-09-24",
      "id": "131211",
      "original_text": "Registerbekanntmachung nach dem Umwandlungsgesetz\nSachsen-Anhalt Amtsgericht Stendal HRB 17747\nDachdeckerfachbetrieb Maik Gorgas GmbH – Sangerhausen",
      "type": "Registerbekanntmachung nach dem Umwandlungsgesetz",
      "state": "Sachsen-Anhalt",
      "amtsgericht": "Amtsgericht Stendal",
      "registernummer": "HRB 17747",
      "registerart": "HRB",
      "company_name": "Dachdeckerfachbetrieb Maik Gorgas GmbH",
      "company_seat": "Sangerhausen",
      "details": "24.09.2025 (Bekanntmachungsdatum)\n\nSachsen-Anhalt Amtsgericht Stendal HRB 17747\nRegisterbekanntmachung nach dem Umwandlungsgesetz 24.09.2025 (Eintragungsdatum)\n\nDachdeckerfachbetrieb Maik Gorgas GmbH\nGesellschaft mit beschränkter Haftung\nSangerhausen\n\nDie Gesellschaft ist auf Grund des Verschmelzungsvertrages vom 25.11.2024 sowie der Beschlüsse der Gesellschafterversammlungen vom selben Tag mit der Leinetaler Hochbau GmbH mit dem Sitz in Sangerhausen (Amtsgericht Stendal HRB 18111) verschmolzen. Die Verschmelzung wurde am 24.09.2025 in das Handelsregister der übernehmenden Gesellschaft eingetragen. Nicht eingetragen: Den Gläubigern der an der Verschmelzung beteiligten Rechtsträger ist, wenn sie binnen sechs Monaten nach dem Tag, an dem die Eintragung der Verschmelzung nach § 19 Abs. 3 UmwG als bekanntgemacht gilt, ihren Anspruch nach Grund und Höhe schriftlich anmelden, Sicherheit zu leisten, soweit sie nicht Befriedigung verlangen können. Dieses Recht steht ihnen jedoch nur zu, wenn sie glaubhaft machen, dass durch die Verschmelzung die Erfüllung ihrer Forderung gefährdet wird."
    },
    {
      "date": "2025-09-24",
      "id": "131212",
      "original_text": "Löschungsankündigung\nSchleswig-Holstein Amtsgericht Kiel HRB 14147\nKIELS City Fitness&Wellness GmbH – Kiel",
      "type": "Löschungsankündigung",
      "state": "Schleswig-Holstein",
      "amtsgericht": "Amtsgericht Kiel",
      "registernummer": "HRB 14147",
      "registerart": "HRB",
      "company_name": "KIELS City Fitness&Wellness GmbH",
      "company_seat": "Kiel",
      "details": "24.09.2025 (Bekanntmachungsdatum)\n\nSchleswig-Holstein Amtsgericht Kiel HRB 14147\nLöschungsankündigung\n\nKIELS City Fitness&Wellness GmbH\nGesellschaft mit beschränkter Haftung\nKiel\n\nEs ist die Löschung der nachstehenden Gesellschaft wegen Vermögenslosigkeit gemäß § 394 FamFG beabsichtigt. Widerspruchsfrist: 2 Monate."
    },
    {
      "date": "2025-09-24",
      "id": "131213",
      "original_text": "Löschungsankündigung\nHamburg Amtsgericht Hamburg HRA 122723\nLSMH GmbH & Co. KG – Hamburg",
      "type": "Löschungsankündigung",
      "state": "Hamburg",
      "amtsgericht": "Amtsgericht Hamburg",
      "registernummer": "HRA 122723",
      "registerart": "HRA",
      "company_name": "LSMH GmbH & Co. KG",
      "company_seat": "Hamburg",
      "details": "24.09.2025 (Bekanntmachungsdatum)\n\nHamburg Amtsgericht Hamburg HRA 122723\nLöschungsankündigung\n\nLSMH GmbH & Co. KG\nKommanditgesellschaft\nHamburg\n\nDas Registergericht beabsichtigt, die im Handelsregister eingetragene Firma von Amts wegen nach § 31 Abs. 2 HBG zu löschen. Die Frist zur Erhebung eines Widerspruchs gegen die beabsichtigte Löschung wird auf 3 Monate festgesetzt."
    },
    {
      "date": "2025-09-24",
      "id": "131214",
      "original_text": "Registerbekanntmachung nach dem Umwandlungsgesetz\nHamburg Amtsgericht Hamburg HRB 145129\nCoral Tankers Holding GmbH – Hamburg",
      "type": "Registerbekanntmachung nach dem Umwandlungsgesetz",
      "state": "Hamburg",
      "amtsgericht": "Amtsgericht Hamburg",
      "registernummer": "HRB 145129",
      "registerart": "HRB",
      "company_name": "Coral Tankers Holding GmbH",
      "company_seat": "Hamburg",
      "details": "24.09.2025 (Bekanntmachungsdatum)\n\nHamburg Amtsgericht Hamburg HRB 145129\nRegisterbekanntmachung nach dem Umwandlungsgesetz\n\nCoral Tankers Holding GmbH\nGesellschaft mit beschränkter Haftung\nHamburg\n\nAls nicht eingetragen wird bekanntgemacht:\nEs wird darauf hingewiesen, dass ein Verschmelzungsplan oder sein Entwurf über eine grenzüberschreitende Verschmelzung zur Aufnahme mit der Coral Tankers ApS mit Sitz in Kopenhagen/Dänemark (Erhvervsstyrelsen 39164353) (anpartsselskab - Gesellschaft mit beschränkter Haftung nach dänischem Recht) beim Handelsregister eingereicht worden ist.\nDie Anteilsinhaber, die Gläubiger sowie die zuständigen Betriebsräte der an der grenzüberschreitenden Verschmelzung beteiligten Gesellschaften oder, soweit es keinen Betriebsrat gibt, die Arbeitnehmer der an der grenzüberschreitenden Verschmelzung beteiligten Gesellschaften, können der jeweiligen Gesellschaft spätestens fünf Arbeitstage vor dem Tag der Gesellschafterversammlung, die für den 09.10.2025 angesetzt ist, Bemerkungen zum Verschmelzungsplan übermitteln."
    },
    {
      "date": "2025-09-24",
      "id": "131215",
      "original_text": "Löschungsankündigung\nHamburg Amtsgericht Hamburg HRB 111852\nSAMAR GENERAL TRADING GmbH – Hamburg",
      "type": "Löschungsankündigung",
      "state": "Hamburg",
      "amtsgericht": "Amtsgericht Hamburg",
      "registernummer": "HRB 111852",
      "registerart": "HRB",
      "company_name": "SAMAR GENERAL TRADING GmbH",
      "company_seat": "Hamburg",
      "details": "24.09.2025 (Bekanntmachungsdatum)\n\nHamburg Amtsgericht Hamburg HRB 111852\nLöschungsankündigung\n\nSAMAR GENERAL TRADING GmbH\nGesellschaft mit beschränkter Haftung\nHamburg\n\nDas Registergericht beabsichtigt, die im Handelsregister eingetragene Gesellschaft von Amts wegen nach § 394 FamFG zu löschen. Die Frist zur Erhebung eines Widerspruchs gegen die beabsichtigte Löschung wird auf 3 Monate festgesetzt."
    },
    {
      "date": "2025-09-24",
      "id": "131216",
      "original_text": "Löschungsankündigung\nHamburg Amtsgericht Hamburg VR 22295\nShindokai Kan I-S-L Germany e.V. – Hamburg",
      "type": "Löschungsankündigung",
      "state": "Hamburg",
      "amtsgericht": "Amtsgericht Hamburg",
      "registernummer": "VR 22295",
      "registerart": "VR",
      "company_name": "Shindokai Kan I-S-L Germany e.V.",
      "company_seat": "Hamburg",
      "details": "24.09.2025 (Bekanntmachungsdatum)\n\nHamburg Amtsgericht Hamburg VR 22295\nLöschungsankündigung\n\nShindokai Kan I-S-L Germany e.V.\neingetragener Verein\nHamburg\n\nDas Registergericht beabsichtigt, den im Vereinsregister eingetragenen Verein von Amts wegen nach § 395 FamFG zu löschen, da nach den angestellten  Ermittlungen dieser Verein offenbar nicht mehr besteht. Die Frist zur Erhebung eines Widerspruchs gegen die beabsichtigte Löschung wird auf 3 Monate festgesetzt."
    },
    {
      "date": "2025-09-24",
      "id": "131217",
      "original_text": "Registerbekanntmachung nach dem Umwandlungsgesetz\nSchleswig-Holstein Amtsgericht Kiel HRB 3804 BB\nVerwaltung Roland Gleich Beteiligungsgesellschaft mbH – Kaltenkirchen",
      "type": "Registerbekanntmachung nach dem Umwandlungsgesetz",
      "state": "Schleswig-Holstein",
      "amtsgericht": "Amtsgericht Kiel",
      "registernummer": "HRB 3804 BB",
      "registerart": "HRB",
      "company_name": "Verwaltung Roland Gleich Beteiligungsgesellschaft mbH",
      "company_seat": "Kaltenkirchen",
      "details": "24.09.2025 (Bekanntmachungsdatum)\n\nSchleswig-Holstein Amtsgericht Kiel HRB 3804 BB\nRegisterbekanntmachung nach dem Umwandlungsgesetz 23.09.2025 (Eintragungsdatum)\n\nVerwaltung Roland Gleich Beteiligungsgesellschaft mbH\nGesellschaft mit beschränkter Haftung\nKaltenkirchen\n\nZu Eintragungsnummer 3 vom 23.09.2025 wird als nicht eingetragen veröffentlicht: Als nicht eingetragen wird veröffentlicht: Den Gläubigern ist, wenn sie binnen sechs Monaten nach dem Tag, an dem die Eintragung der Umwandlung bekannt gemacht worden ist, ihren Anspruch nach Grund und Höhe schriftlich anmelden, Sicherheit zu leisten, soweit sie nicht Befriedigung verlangen können. Dieses Recht steht den Gläubigern jedoch nur zu, wenn sie glaubhaft machen, dass durch die Umwandlung die Erfüllung ihrer Forderung gefährdet wird."
    },
    {
      "date": "2025-09-24",
      "id": "131218",
      "original_text": "Löschungsankündigung\nHamburg Amtsgericht Hamburg VR 25682\nInitiative Arbeitgeber und Reserve e.V. – Hamburg",
      "type": "Löschungsankündigung",
      "state": "Hamburg",
      "amtsgericht": "Amtsgericht Hamburg",
      "registernummer": "VR 25682",
      "registerart": "VR",
      "company_name": "Initiative Arbeitgeber und Reserve e.V.",
      "company_seat": "Hamburg",
      "details": "24.09.2025 (Bekanntmachungsdatum)\n\nHamburg Amtsgericht Hamburg VR 25682\nLöschungsankündigung\n\nInitiative Arbeitgeber und Reserve e.V.\neingetragener Verein\nHamburg\n\nDas Registergericht beabsichtigt, den im Vereinsregister eingetragenen Verein von Amts wegen nach § 395 FamFG zu löschen, da nach den angestellten  Ermittlungen dieser Verein offenbar nicht mehr besteht. Die Frist zur Erhebung eines Widerspruchs gegen die beabsichtigte Löschung wird auf 3 Monate festgesetzt."
    },
    {
      "date": "2025-09-24",
      "id": "131219",
      "original_text": "Einreichung neuer Dokumente\nBaden-Württemberg Amtsgericht Stuttgart HRB 766882\nMorpheus AG – Spaichingen",
      "type": "Einreichung neuer Dokumente",
      "state": "Baden-Württemberg",
      "amtsgericht": "Amtsgericht Stuttgart",
      "registernummer": "HRB 766882",
      "registerart": "HRB",
      "company_name": "Morpheus AG",
      "company_seat": "Spaichingen",
      "details": "24.09.2025 (Bekanntmachungsdatum)\n\nBaden-Württemberg Amtsgericht Stuttgart HRB 766882\nEinreichung neuer Dokumente\n\nMorpheus AG\nAktiengesellschaft\nSpaichingen\n\nDie Gesellschaft hat am 17.09.2025 die Liste über die Zusammensetzung des Aufsichtsrats zum Handelsregister eingereicht."
    },
    {
      "date": "2025-09-24",
      "id": "131220",
      "original_text": "Registerbekanntmachung nach dem Umwandlungsgesetz\nSachsen-Anhalt Amtsgericht Stendal HRB 101853\nNetzwerk Kommunikationssysteme GmbH – Barleben",
      "type": "Registerbekanntmachung nach dem Umwandlungsgesetz",
      "state": "Sachsen-Anhalt",
      "amtsgericht": "Amtsgericht Stendal",
      "registernummer": "HRB 101853",
      "registerart": "HRB",
      "company_name": "Netzwerk Kommunikationssysteme GmbH",
      "company_seat": "Barleben",
      "details": "24.09.2025 (Bekanntmachungsdatum)\n\nSachsen-Anhalt Amtsgericht Stendal HRB 101853\nRegisterbekanntmachung nach dem Umwandlungsgesetz 18.09.2025 (Eintragungsdatum)\n\nNetzwerk Kommunikationssysteme GmbH\nGesellschaft mit beschränkter Haftung\nBarleben\n\nDie Gesellschaft ist auf Grund des Verschmelzungsvertrages vom 13.08.2025 sowie der Beschlüsse der Gesellschafterversammlungen vom selben Tag mit der Axians Digital Infrastructure GmbH mit dem Sitz in Berlin (Amtsgericht Charlottenburg HRB 34952 B) verschmolzen. Die Verschmelzung wurde am 18.09.2025 in das Handelsregister der übernehmenden Gesellschaft eingetragen. Nicht eingetragen:Den Gläubigern der an der Verschmelzung beteiligten Rechtsträger ist, wenn sie binnen sechs Monaten nach dem Tag, an dem die Eintragung der Verschmelzung nach § 19 Abs. 3 UmwG als bekanntgemacht gilt, ihren Anspruch nach Grund und Höhe schriftlich anmelden, Sicherheit zu leisten, soweit sie nicht Befriedigung verlangen können. Dieses Recht steht ihnen jedoch nur zu, wenn sie glaubhaft machen, dass durch die Verschmelzung die Erfüllung ihrer Forderung gefährdet wird."
    },
    {
      "date": "2025-09-24",
      "id": "131221",
      "original_text": "Registerbekanntmachung nach dem Umwandlungsgesetz\nBerlin Amtsgericht Berlin (Charlottenburg) HRB 267932\nVoltOne GmbH – Berlin",
      "type": "Registerbekanntmachung nach dem Umwandlungsgesetz",
      "state": "Berlin",
      "amtsgericht": "Amtsgericht Berlin (Charlottenburg)",
      "registernummer": "HRB 267932",
      "registerart": "HRB",
      "company_name": "VoltOne GmbH",
      "company_seat": "Berlin",
      "details": "24.09.2025 (Bekanntmachungsdatum)\n\nBerlin Amtsgericht Berlin (Charlottenburg) HRB 267932\nRegisterbekanntmachung nach dem Umwandlungsgesetz 23.09.2025 (Eintragungsdatum)\n\nVoltOne GmbH\nGesellschaft mit beschränkter Haftung\nBerlin\n\nZu Eintragungsnummer 3 vom 23.09.2025 wird als nicht eingetragen veröffentlicht: Den Gläubigern der an der Verschmelzung beteiligten Rechtsträger ist, wenn sie binnen sechs Monaten nach dem Tag, an dem die Eintragung der Verschmelzung in das Register des Sitzes desjenigen Rechtsträgers, dessen Gläubiger sie sind, als bekannt gemacht gilt, ihren Anspruch nach Grund und Höhe schriftlich anmelden, Sicherheit zu leisten, soweit sie nicht Befriedigung verlangen können. Dieses Recht steht den Gläubigern jedoch nur zu, wenn sie glaubhaft machen, dass durch die Verschmelzung die Erfüllung ihrer Forderung gefährdet wird. Das Recht, Sicherheitsleistung zu verlangen, steht Gläubigern nicht zu, die im Falle der Insolvenz ein Recht auf vorzugsweise Befriedigung aus einer Deckungsmasse haben, die nach gesetzlicher Vorschrift zu ihrem Schutz errichtet und staatlich überwacht ist."
    },
    {
      "date": "2025-09-24",
      "id": "131222",
      "original_text": "Registerbekanntmachung nach dem Umwandlungsgesetz\nHamburg Amtsgericht Hamburg HRB 145669\nVANILLA & PEPPER Marketing GmbH – Hamburg",
      "type": "Registerbekanntmachung nach dem Umwandlungsgesetz",
      "state": "Hamburg",
      "amtsgericht": "Amtsgericht Hamburg",
      "registernummer": "HRB 145669",
      "registerart": "HRB",
      "company_name": "VANILLA & PEPPER Marketing GmbH",
      "company_seat": "Hamburg",
      "details": "24.09.2025 (Bekanntmachungsdatum)\n\nHamburg Amtsgericht Hamburg HRB 145669\nRegisterbekanntmachung nach dem Umwandlungsgesetz 24.09.2025 (Eintragungsdatum)\n\nVANILLA & PEPPER Marketing GmbH\nGesellschaft mit beschränkter Haftung\nHamburg\n\nAls nicht eingetragen wird bekannt gemacht:\nDen Gläubigern der an der Verschmelzung beteiligten Gesellschaften ist, wenn sie binnen sechs Monaten nach dem Tag, an dem die Eintragung der Verschmelzung in das Register des Sitzes desjenigen Rechtsträgers, dessen Gläubiger sie sind, nach § 19 Absatz 3 UmwG als bekannt gemacht gilt, ihren Anspruch nach Grund und Höhe schriftlich anmelden, Sicherheit zu leisten, soweit sie nicht Befriedigung verlangen können. Dieses Recht steht den Gläubigern jedoch nur zu, wenn sie glaubhaft machen, dass durch die Verschmelzung die Erfüllung ihrer Forderung gefährdet wird."
    },
    {
      "date": "2025-09-24",
      "id": "131223",
      "original_text": "Registerbekanntmachung nach dem Umwandlungsgesetz\nBerlin Amtsgericht Berlin (Charlottenburg) HRB 255932\nHDM Müller Handelsgesellschaft mbH – Berlin",
      "type": "Registerbekanntmachung nach dem Umwandlungsgesetz",
      "state": "Berlin",
      "amtsgericht": "Amtsgericht Berlin (Charlottenburg)",
      "registernummer": "HRB 255932",
      "registerart": "HRB",
      "company_name": "HDM Müller Handelsgesellschaft mbH",
      "company_seat": "Berlin",
      "details": "24.09.2025 (Bekanntmachungsdatum)\n\nBerlin Amtsgericht Berlin (Charlottenburg) HRB 255932\nRegisterbekanntmachung nach dem Umwandlungsgesetz 23.09.2025 (Eintragungsdatum)\n\nHDM Müller Handelsgesellschaft mbH\nGesellschaft mit beschränkter Haftung\nBerlin\n\nZu Eintragungsnummer 2 vom 23.09.2025 wird als nicht eingetragen veröffentlicht: Den Gläubigern der an der Verschmelzung beteiligten Rechtsträger ist, wenn sie binnen sechs Monaten nach dem Tag, an dem die Eintragung der Verschmelzung in das Register des Sitzes desjenigen Rechtsträgers, dessen Gläubiger sie sind, als bekannt gemacht gilt, ihren Anspruch nach Grund und Höhe schriftlich anmelden, Sicherheit zu leisten, soweit sie nicht Befriedigung verlangen können. Dieses Recht steht den Gläubigern jedoch nur zu, wenn sie glaubhaft machen, dass durch die Verschmelzung die Erfüllung ihrer Forderung gefährdet wird. Das Recht, Sicherheitsleistung zu verlangen, steht Gläubigern nicht zu, die im Falle der Insolvenz ein Recht auf vorzugsweise Befriedigung aus einer Deckungsmasse haben, die nach gesetzlicher Vorschrift zu ihrem Schutz errichtet und staatlich überwacht ist."
    },
    {
      "date": "2025-09-24",
      "id": "131224",
      "original_text": "Einreichung neuer Dokumente\nBaden-Württemberg Amtsgericht Freiburg HRB 716775\nAmbra Versicherung AG – Büsingen am Hochrhein",
      "type": "Einreichung neuer Dokumente",
      "state": "Baden-Württemberg",
      "amtsgericht": "Amtsgericht Freiburg",
      "registernummer": "HRB 716775",
      "registerart": "HRB",
      "company_name": "Ambra Versicherung AG",
      "company_seat": "Büsingen am Hochrhein",
      "details": "24.09.2025 (Bekanntmachungsdatum)\n\nBaden-Württemberg Amtsgericht Freiburg HRB 716775\nEinreichung neuer Dokumente\n\nAmbra Versicherung AG\nAktiengesellschaft\nBüsingen am Hochrhein\n\nDie Gesellschaft hat am 08.09.2025 die Liste über die Zusammensetzung des Aufsichtsrats zum Handelsregister eingereicht."
    },
    {
      "date": "2025-09-24",
      "id": "131225",
      "original_text": "Registerbekanntmachung nach dem Umwandlungsgesetz\nBaden-Württemberg Amtsgericht Ulm HRB 750554\nMVZ DERMATOPATHOLOGIE Friedrichshafen Bodensee GmbH – Friedrichshafen",
      "type": "Registerbekanntmachung nach dem Umwandlungsgesetz",
      "state": "Baden-Württemberg",
      "amtsgericht": "Amtsgericht Ulm",
      "registernummer": "HRB 750554",
      "registerart": "HRB",
      "company_name": "MVZ DERMATOPATHOLOGIE Friedrichshafen Bodensee GmbH",
      "company_seat": "Friedrichshafen",
      "details": "24.09.2025 (Bekanntmachungsdatum)\n\nBaden-Württemberg Amtsgericht Ulm HRB 750554\nRegisterbekanntmachung nach dem Umwandlungsgesetz 24.09.2025 (Eintragungsdatum)\n\nMVZ DERMATOPATHOLOGIE Friedrichshafen Bodensee GmbH\nGesellschaft mit beschränkter Haftung\nFriedrichshafen\n\nDen Gläubigern des an dem Formwechsel beteiligten Rechtsträgers ist, wenn sie binnen sechs Monaten nach dem Tag, an dem die Eintragung des Formwechsels in das Register des Sitzes desjenigen Rechtsträgers, dessen Gläubiger sie sind, nach § 19 Abs. 3 UmwG als bekanntgemacht gilt, ihren Anspruch nach Grund und Höhe schriftlich anmelden, Sicherheit zu leisten, soweit sie nicht Befriedigung verlangen können. Dieses Recht steht den Gläubigern jedoch nur zu, wenn sie glaubhaft machen, dass durch den Formwechsel die Erfüllung ihrer Forderung gefährdet wird."
    },
    {
      "date": "2025-09-24",
      "id": "131226",
      "original_text": "Registerbekanntmachung nach dem Umwandlungsgesetz\nHamburg Amtsgericht Hamburg HRB 187442\nOYEA GmbH – Hamburg",
      "type": "Registerbekanntmachung nach dem Umwandlungsgesetz",
      "state": "Hamburg",
      "amtsgericht": "Amtsgericht Hamburg",
      "registernummer": "HRB 187442",
      "registerart": "HRB",
      "company_name": "OYEA GmbH",
      "company_seat": "Hamburg",
      "details": "24.09.2025 (Bekanntmachungsdatum)\n\nHamburg Amtsgericht Hamburg HRB 187442\nRegisterbekanntmachung nach dem Umwandlungsgesetz 24.09.2025 (Eintragungsdatum)\n\nOYEA GmbH\nGesellschaft mit beschränkter Haftung\nHamburg\n\nAls nicht eingetragen wird bekannt gemacht:\nDen Gläubigern der an der Verschmelzung beteiligten Gesellschaften ist, wenn sie binnen sechs Monaten nach dem Tag, an dem die Eintragung der Verschmelzung in das Register des Sitzes desjenigen Rechtsträgers, dessen Gläubiger sie sind, nach § 19 Absatz 3 UmwG als bekannt gemacht gilt, ihren Anspruch nach Grund und Höhe schriftlich anmelden, Sicherheit zu leisten, soweit sie nicht Befriedigung verlangen können. Dieses Recht steht den Gläubigern jedoch nur zu, wenn sie glaubhaft machen, dass durch die Verschmelzung die Erfüllung ihrer Forderung gefährdet wird."
    },
    {
      "date": "2025-09-24",
      "id": "131227",
      "original_text": "Registerbekanntmachung nach dem Umwandlungsgesetz\nBaden-Württemberg Amtsgericht Ulm PR 720297\nMedizinisches Versorgungszentrum Dr. med. Markus Hantschke Facharzt für Haut- und Geschlechtskrankheiten Dr. med. Laura Held Fachärztin für Haut- und Geschlechtskrankheiten, Dr. med. Wolfgang Kempter Facharzt für Haut- und Geschlechtskrankheiten, Dr. med. Bruno Paredes Facharzt für Pathologie Dr. med. Leo Schärer Facharzt für Haut- und Geschlechtskrankheiten, Alfonso Martin Vallejo Almeria Facharzt für Pathologie Partnerschaft – Friedrichshafen",
      "type": "Registerbekanntmachung nach dem Umwandlungsgesetz",
      "state": "Baden-Württemberg",
      "amtsgericht": "Amtsgericht Ulm",
      "registernummer": "PR 720297",
      "registerart": "PR",
      "company_name": "Medizinisches Versorgungszentrum Dr. med. Markus Hantschke Facharzt für Haut- und Geschlechtskrankheiten Dr. med. Laura Held Fachärztin für Haut- und Geschlechtskrankheiten, Dr. med. Wolfgang Kempter Facharzt für Haut- und Geschlechtskrankheiten, Dr. med. Bruno Paredes Facharzt für Pathologie Dr. med. Leo Schärer Facharzt für Haut- und Geschlechtskrankheiten, Alfonso Martin Vallejo Almeria Facharzt für Pathologie Partnerschaft",
      "company_seat": "Friedrichshafen",
      "details": "24.09.2025 (Bekanntmachungsdatum)\n\nBaden-Württemberg Amtsgericht Ulm PR 720297\nRegisterbekanntmachung nach dem Umwandlungsgesetz 24.09.2025 (Eintragungsdatum)\n\nMedizinisches Versorgungszentrum Dr. med. Markus Hantschke Facharzt für Haut- und Geschlechtskrankheiten Dr. med. Laura Held Fachärztin für Haut- und Geschlechtskrankheiten, Dr. med. Wolfgang Kempter Facharzt für Haut- und Geschlechtskrankheiten, Dr. med. Bruno Paredes Facharzt für Pathologie Dr. med. Leo Schärer Facharzt für Haut- und Geschlechtskrankheiten, Alfonso Martin Vallejo Almeria Facharzt für Pathologie Partnerschaft\nPartnerschaftsgesellschaft\nFriedrichshafen\n\nAls nicht eingetragen wird bekanntgemacht:\nDen Gläubigern des an dem Formwechsel beteiligten Rechtsträgers ist, wenn sie binnen sechs Monaten nach dem Tag, an dem die Eintragung des Formwechsels in das Register des Sitzes desjenigen Rechtsträgers, dessen Gläubiger sie sind, nach § 19 Abs. 3 UmwG als bekanntgemacht gilt, ihren Anspruch nach Grund und Höhe schriftlich anmelden, Sicherheit zu leisten, soweit sie nicht Befriedigung verlangen können. Dieses Recht steht den Gläubigern jedoch nur zu, wenn sie glaubhaft machen, dass durch den Formwechsel die Erfüllung ihrer Forderung gefährdet wird."
    },
    {
      "date": "2025-09-24",
      "id": "131228",
      "original_text": "Registerbekanntmachung nach dem Umwandlungsgesetz\nSchleswig-Holstein Amtsgericht Lübeck HRB 7879\nCuratio Pflegedienst GmbH – Barsbüttel",
      "type": "Registerbekanntmachung nach dem Umwandlungsgesetz",
      "state": "Schleswig-Holstein",
      "amtsgericht": "Amtsgericht Lübeck",
      "registernummer": "HRB 7879",
      "registerart": "HRB",
      "company_name": "Curatio Pflegedienst GmbH",
      "company_seat": "Barsbüttel",
      "details": "24.09.2025 (Bekanntmachungsdatum)\n\nSchleswig-Holstein Amtsgericht Lübeck HRB 7879\nRegisterbekanntmachung nach dem Umwandlungsgesetz 24.09.2025 (Eintragungsdatum)\n\nCuratio Pflegedienst GmbH\nGesellschaft mit beschränkter Haftung\nBarsbüttel\n\nZu Eintragungsnummer 4 vom 24.09.2025 wird als nicht eingetragen veröffentlicht:\nDen Gläubigern der an der Spaltung beteiligten Rechtsträger ist, wenn sie binnen sechs Monaten nach dem Tag, an dem die Eintragung der Spaltung in das Register des Sitzes desjenigen Rechtsträgers, dessen Gläubiger sie sind, als bekannt gemacht gilt, ihren Anspruch nach Grund und Höhe schriftlich anmelden, Sicherheit zu leisten, soweit sie nicht Befriedigung verlangen können. Dieses Recht steht den Gläubigern jedoch nur zu, wenn sie glaubhaft machen, dass durch die Spaltung die Erfüllung ihrer Forderung gefährdet wird."
    },
    {
      "date": "2025-09-24",
      "id": "131229",
      "original_text": "Löschungsankündigung\nHamburg Amtsgericht Hamburg HRA 82617\nNeef + Stumme Holding GmbH & Co. KG – Hamburg",
      "type": "Löschungsankündigung",
      "state": "Hamburg",
      "amtsgericht": "Amtsgericht Hamburg",
      "registernummer": "HRA 82617",
      "registerart": "HRA",
      "company_name": "Neef + Stumme Holding GmbH & Co. KG",
      "company_seat": "Hamburg",
      "details": "24.09.2025 (Bekanntmachungsdatum)\n\nHamburg Amtsgericht Hamburg HRA 82617\nLöschungsankündigung\n\nNeef + Stumme Holding GmbH & Co. KG\nKommanditgesellschaft\nHamburg\n\nDas Registergericht beabsichtigt, die im Handelsregister eingetragene Gesellschaft von Amts wegen nach § 394 FamFG zu löschen. Die Frist zur Erhebung eines Widerspruchs gegen die beabsichtigte Löschung wird auf 3 Monate festgesetzt."
    },
    {
      "date": "2025-09-24",
      "id": "131230",
      "original_text": "Registerbekanntmachung nach dem Umwandlungsgesetz\nBaden-Württemberg Amtsgericht Stuttgart HRA 741479\nZiegler Zimmerei und Bauservice GmbH & Co. KG – Eppingen",
      "type": "Registerbekanntmachung nach dem Umwandlungsgesetz",
      "state": "Baden-Württemberg",
      "amtsgericht": "Amtsgericht Stuttgart",
      "registernummer": "HRA 741479",
      "registerart": "HRA",
      "company_name": "Ziegler Zimmerei und Bauservice GmbH & Co. KG",
      "company_seat": "Eppingen",
      "details": "24.09.2025 (Bekanntmachungsdatum)\n\nBaden-Württemberg Amtsgericht Stuttgart HRA 741479\nRegisterbekanntmachung nach dem Umwandlungsgesetz 24.09.2025 (Eintragungsdatum)\n\nZiegler Zimmerei und Bauservice GmbH & Co. KG\nKommanditgesellschaft\nEppingen\n\nDen Gläubigern der an der Ausgliederung beteiligten Rechtsträger ist, wenn sie binnen sechs Monaten nach dem Tag, an dem die Eintragung der Ausgliederung in das Register des Sitzes desjenigen Rechtsträgers, dessen Gläubiger sie sind, nach § 19 Abs. 3 UmwG als bekanntgemacht gilt, ihren Anspruch nach Grund und Höhe schriftlich anmelden, Sicherheit zu leisten, soweit sie nicht Befriedigung verlangen können. Dieses Recht steht den Gläubigern jedoch nur zu, wenn sie glaubhaft machen, dass durch die Ausgliederung die Erfüllung ihrer Forderung gefährdet wird."
    },
    {
      "date": "2025-09-24",
      "id": "131231",
      "original_text": "Registerbekanntmachung nach dem Umwandlungsgesetz\nBrandenburg Amtsgericht Neuruppin HRA 3947\nAKRA Dienstleistungen Häsen GmbH & Co. KG – Löwenberger Land",
      "type": "Registerbekanntmachung nach dem Umwandlungsgesetz",
      "state": "Brandenburg",
      "amtsgericht": "Amtsgericht Neuruppin",
      "registernummer": "HRA 3947",
      "registerart": "HRA",
      "company_name": "AKRA Dienstleistungen Häsen GmbH & Co. KG",
      "company_seat": "Löwenberger Land",
      "details": "24.09.2025 (Bekanntmachungsdatum)\n\nBrandenburg Amtsgericht Neuruppin HRA 3947\nRegisterbekanntmachung nach dem Umwandlungsgesetz 24.09.2025 (Eintragungsdatum)\n\nAKRA Dienstleistungen Häsen GmbH & Co. KG\nKommanditgesellschaft\nLöwenberger Land\n\nZu Eintragungsnummer 2 vom 24.09.2025 wird als nicht eingetragen veröffentlicht:\nDen Gläubigern der an der Umwandlung beteiligten Rechtsträger ist, wenn sie binnen sechs Monaten nach dem Tag, an dem die Eintragung der Umwandlung in das Register des Sitzes desjenigen Rechtsträgers, dessen Gläubiger sie sind, als bekannt gemacht gilt, ihren Anspruch nach Grund und Höhe schriftlich anmelden, Sicherheit zu leisten, soweit sie nicht Befriedigung verlangen können. Dieses Recht steht den Gläubigern jedoch nur zu, wenn sie glaubhaft machen, dass durch die Umwandlung die Erfüllung ihrer Forderung gefährdet wird"
    },
    {
      "date": "2025-09-24",
      "id": "131232",
      "original_text": "Löschungsankündigung\nBaden-Württemberg Amtsgericht Stuttgart HRA 731883\nWiTeC Stanz- und Ziehtechnik GmbH & Co. KG – Esslingen am Neckar",
      "type": "Löschungsankündigung",
      "state": "Baden-Württemberg",
      "amtsgericht": "Amtsgericht Stuttgart",
      "registernummer": "HRA 731883",
      "registerart": "HRA",
      "company_name": "WiTeC Stanz- und Ziehtechnik GmbH & Co. KG",
      "company_seat": "Esslingen am Neckar",
      "details": "24.09.2025 (Bekanntmachungsdatum)\n\nBaden-Württemberg Amtsgericht Stuttgart HRA 731883\nLöschungsankündigung\n\nWiTeC Stanz- und Ziehtechnik GmbH & Co. KG\nKommanditgesellschaft\nEsslingen am Neckar\n\nAls nicht eingetragen wird bekanntgemacht:\nDas Gericht beabsichtigt, die Gesellschaft wegen Vermögenslosigkeit im Handelsregister von Amts wegen nach § 394 FamFG zu löschen. Die Frist zur Geltendmachung eines Widerspruchs gegen die beabsichtigte Löschung ist auf zwei Monate ab Veröffentlichung bestimmt."
    },
    {
      "date": "2025-09-24",
      "id": "131233",
      "original_text": "Registerbekanntmachung nach dem Umwandlungsgesetz\nBerlin Amtsgericht Berlin (Charlottenburg) HRB 55462\nSEM GmbH - Schaltschrankbau – Berlin",
      "type": "Registerbekanntmachung nach dem Umwandlungsgesetz",
      "state": "Berlin",
      "amtsgericht": "Amtsgericht Berlin (Charlottenburg)",
      "registernummer": "HRB 55462",
      "registerart": "HRB",
      "company_name": "SEM GmbH - Schaltschrankbau",
      "company_seat": "Berlin",
      "details": "24.09.2025 (Bekanntmachungsdatum)\n\nBerlin Amtsgericht Berlin (Charlottenburg) HRB 55462\nRegisterbekanntmachung nach dem Umwandlungsgesetz 19.09.2025 (Eintragungsdatum)\n\nSEM GmbH - Schaltschrankbau\nGesellschaft mit beschränkter Haftung\nBerlin\n\nZu Eintragungsnummer 7 vom 19.09.2025 wird als nicht eingetragen veröffentlicht: Den Gläubigern der an der Spaltung beteiligten Rechtsträger ist, wenn sie binnen sechs Monaten nach dem Tag, an dem die Eintragung der Spaltung in das Register des Sitzes desjenigen Rechtsträgers, dessen Gläubiger sie sind, als bekannt gemacht gilt, ihren Anspruch nach Grund und Höhe schriftlich anmelden, Sicherheit zu leisten, soweit sie nicht Befriedigung verlangen können. Dieses Recht steht den Gläubigern jedoch nur zu, wenn sie glaubhaft machen, dass durch die Spaltung die Erfüllung ihrer Forderung gefährdet wird. Das Recht, Sicherheitsleistung zu verlangen, steht Gläubigern nicht zu, die im Falle der Insolvenz ein Recht auf vorzugsweise Befriedigung aus einer Deckungsmasse haben, die nach gesetzlicher Vorschrift zu ihrem Schutz errichtet und staatlich überwacht ist."
    },
    {
      "date": "2025-09-24",
      "id": "131234",
      "original_text": "Sonstige Registerbekanntmachung\nBerlin Amtsgericht Berlin (Charlottenburg) HRB 34082\nCSB Holding GmbH – Berlin",
      "type": "Sonstige Registerbekanntmachung",
      "state": "Berlin",
      "amtsgericht": "Amtsgericht Berlin (Charlottenburg)",
      "registernummer": "HRB 34082",
      "registerart": "HRB",
      "company_name": "CSB Holding GmbH",
      "company_seat": "Berlin",
      "details": "24.09.2025 (Bekanntmachungsdatum)\n\nBerlin Amtsgericht Berlin (Charlottenburg) HRB 34082\nSonstige Registerbekanntmachung\n\nCSB Holding GmbH\nGesellschaft mit beschränkter Haftung\nBerlin\n\nAls nicht eingetragen wird veröffentlicht: Den Gläubigern der an der Spaltung beteiligten Rechtsträger ist, wenn sie binnen sechs Monaten nach dem Tag, an dem die Eintragung der Spaltung in das Register des Sitzes desjenigen Rechtsträgers, dessen Gläubiger sie sind, als bekannt gemacht gilt, ihren Anspruch nach Grund und Höhe schriftlich anmelden, Sicherheit zu leisten, soweit sie nicht Befriedigung verlangen können. Dieses Recht steht den Gläubigern jedoch nur zu, wenn sie glaubhaft machen, dass durch die Spaltung die Erfüllung ihrer Forderung gefährdet wird. Das Recht, Sicherheitsleistung zu verlangen, steht Gläubigern nicht zu, die im Falle der Insolvenz ein Recht auf vorzugsweise Befriedigung aus einer Deckungsmasse haben, die nach gesetzlicher Vorschrift zu ihrem Schutz errichtet und staatlich überwacht ist."
    },
    {
      "date": "2025-09-24",
      "id": "131235",
      "original_text": "Registerbekanntmachung nach dem Umwandlungsgesetz\nBerlin Amtsgericht Berlin (Charlottenburg) HRB 279388\nSEM Betriebsgesellschaft mbH - Schalt- und Steuerungsanlagenbau – Berlin",
      "type": "Registerbekanntmachung nach dem Umwandlungsgesetz",
      "state": "Berlin",
      "amtsgericht": "Amtsgericht Berlin (Charlottenburg)",
      "registernummer": "HRB 279388",
      "registerart": "HRB",
      "company_name": "SEM Betriebsgesellschaft mbH - Schalt- und Steuerungsanlagenbau",
      "company_seat": "Berlin",
      "details": "24.09.2025 (Bekanntmachungsdatum)\n\nBerlin Amtsgericht Berlin (Charlottenburg) HRB 279388\nRegisterbekanntmachung nach dem Umwandlungsgesetz 19.09.2025 (Eintragungsdatum)\n\nSEM Betriebsgesellschaft mbH - Schalt- und Steuerungsanlagenbau\nGesellschaft mit beschränkter Haftung\nBerlin\n\nZu Eintragungsnummer 1 vom 19.09.2025 wird als nicht eingetragen veröffentlicht: Den Gläubigern der an der Spaltung beteiligten Rechtsträger ist, wenn sie binnen sechs Monaten nach dem Tag, an dem die Eintragung der Spaltung in das Register des Sitzes desjenigen Rechtsträgers, dessen Gläubiger sie sind, als bekannt gemacht gilt, ihren Anspruch nach Grund und Höhe schriftlich anmelden, Sicherheit zu leisten, soweit sie nicht Befriedigung verlangen können. Dieses Recht steht den Gläubigern jedoch nur zu, wenn sie glaubhaft machen, dass durch die Spaltung die Erfüllung ihrer Forderung gefährdet wird. Das Recht, Sicherheitsleistung zu verlangen, steht Gläubigern nicht zu, die im Falle der Insolvenz ein Recht auf vorzugsweise Befriedigung aus einer Deckungsmasse haben, die nach gesetzlicher Vorschrift zu ihrem Schutz errichtet und staatlich überwacht ist."
    },
    {
      "date": "2025-09-24",
      "id": "131236",
      "original_text": "Sonstige Registerbekanntmachung\nBerlin Amtsgericht Berlin (Charlottenburg) HRB 270891\nCSB Schimmel Automobile GmbH – Berlin",
      "type": "Sonstige Registerbekanntmachung",
      "state": "Berlin",
      "amtsgericht": "Amtsgericht Berlin (Charlottenburg)",
      "registernummer": "HRB 270891",
      "registerart": "HRB",
      "company_name": "CSB Schimmel Automobile GmbH",
      "company_seat": "Berlin",
      "details": "24.09.2025 (Bekanntmachungsdatum)\n\nBerlin Amtsgericht Berlin (Charlottenburg) HRB 270891\nSonstige Registerbekanntmachung\n\nCSB Schimmel Automobile GmbH\nGesellschaft mit beschränkter Haftung\nBerlin\n\nAls nicht eingetragen wird veröffentlicht: Den Gläubigern der an der Spaltung beteiligten Rechtsträger ist, wenn sie binnen sechs Monaten nach dem Tag, an dem die Eintragung der Spaltung in das Register des Sitzes desjenigen Rechtsträgers, dessen Gläubiger sie sind, als bekannt gemacht gilt, ihren Anspruch nach Grund und Höhe schriftlich anmelden, Sicherheit zu leisten, soweit sie nicht Befriedigung verlangen können. Dieses Recht steht den Gläubigern jedoch nur zu, wenn sie glaubhaft machen, dass durch die Spaltung die Erfüllung ihrer Forderung gefährdet wird. Das Recht, Sicherheitsleistung zu verlangen, steht Gläubigern nicht zu, die im Falle der Insolvenz ein Recht auf vorzugsweise Befriedigung aus einer Deckungsmasse haben, die nach gesetzlicher Vorschrift zu ihrem Schutz errichtet und staatlich überwacht ist."
    },
    {
      "date": "2025-09-24",
      "id": "131237",
      "original_text": "Registerbekanntmachung nach dem Umwandlungsgesetz\nBaden-Württemberg Amtsgericht Stuttgart HRB 783745\nDMG MORI EMEA Holding GmbH – Wernau (Neckar)",
      "type": "Registerbekanntmachung nach dem Umwandlungsgesetz",
      "state": "Baden-Württemberg",
      "amtsgericht": "Amtsgericht Stuttgart",
      "registernummer": "HRB 783745",
      "registerart": "HRB",
      "company_name": "DMG MORI EMEA Holding GmbH",
      "company_seat": "Wernau (Neckar)",
      "details": "24.09.2025 (Bekanntmachungsdatum)\n\nBaden-Württemberg Amtsgericht Stuttgart HRB 783745\nRegisterbekanntmachung nach dem Umwandlungsgesetz 24.09.2025 (Eintragungsdatum)\n\nDMG MORI EMEA Holding GmbH\nGesellschaft mit beschränkter Haftung\nWernau (Neckar)\n\nAls nicht eingetragen wird bekanntgemacht:\nDen Gläubigern der an der Verschmelzung beteiligten Rechtsträger ist, wenn sie binnen sechs Monaten nach dem Tag, an dem die Eintragung der Verschmelzung in das Register des Sitzes desjenigen Rechtsträgers, dessen Gläubiger sie sind, nach § 19 Abs. 3 UmwG als bekanntgemacht gilt, ihren Anspruch nach Grund und Höhe schriftlich anmelden, Sicherheit zu leisten, soweit sie nicht Befriedigung verlangen können. Dieses Recht steht den Gläubigern jedoch nur zu, wenn sie glaubhaft machen, dass durch die Verschmelzung die Erfüllung ihrer Forderung gefährdet wird."
    },
    {
      "date": "2025-09-24",
      "id": "131238",
      "original_text": "Einreichung neuer Dokumente\nBaden-Württemberg Amtsgericht Stuttgart HRB 729962\nGemeindewerke Ammerbuch GmbH – Ammerbuch",
      "type": "Einreichung neuer Dokumente",
      "state": "Baden-Württemberg",
      "amtsgericht": "Amtsgericht Stuttgart",
      "registernummer": "HRB 729962",
      "registerart": "HRB",
      "company_name": "Gemeindewerke Ammerbuch GmbH",
      "company_seat": "Ammerbuch",
      "details": "24.09.2025 (Bekanntmachungsdatum)\n\nBaden-Württemberg Amtsgericht Stuttgart HRB 729962\nEinreichung neuer Dokumente\n\nGemeindewerke Ammerbuch GmbH\nGesellschaft mit beschränkter Haftung\nAmmerbuch\n\nDie Gesellschaft hat am 15.09.2025 die Liste über die Zusammensetzung des Aufsichtsrats zum Handelsregister eingereicht."
    },
    {
      "date": "2025-09-24",
      "id": "131239",
      "original_text": "Registerbekanntmachung nach dem Umwandlungsgesetz\nHamburg Amtsgericht Hamburg HRB 157511\nVentuz Technology AG – Hamburg",
      "type": "Registerbekanntmachung nach dem Umwandlungsgesetz",
      "state": "Hamburg",
      "amtsgericht": "Amtsgericht Hamburg",
      "registernummer": "HRB 157511",
      "registerart": "HRB",
      "company_name": "Ventuz Technology AG",
      "company_seat": "Hamburg",
      "details": "24.09.2025 (Bekanntmachungsdatum)\n\nHamburg Amtsgericht Hamburg HRB 157511\nRegisterbekanntmachung nach dem Umwandlungsgesetz 24.09.2025 (Eintragungsdatum)\n\nVentuz Technology AG\nAktiengesellschaft\nHamburg\n\nAls nicht eingetragen wird bekannt gemacht:\nDen Gläubigern der an dem Formwechsel beteiligten Gesellschaft ist, wenn sie binnen sechs Monaten nach dem Tag, an dem die Eintragung des Formwechsels in das Register des Sitzes desjenigen Rechtsträgers, dessen Gläubiger sie sind, nach § 201 UmwG als bekannt gemacht gilt, ihren Anspruch nach Grund und Höhe schriftlich anmelden, Sicherheit zu leisten, soweit sie nicht Befriedigung verlangen können. Dieses Recht steht den Gläubigern jedoch nur zu, wenn sie glaubhaft machen, dass durch den Formwechsel die Erfüllung ihrer Forderung gefährdet wird."
    },
    {
      "date": "2025-09-24",
      "id": "131240",
      "original_text": "Löschungsankündigung\nSchleswig-Holstein Amtsgericht Flensburg HRB 15169\nJCP Commerce UG (haftungsbeschränkt) – Esgrus",
      "type": "Löschungsankündigung",
      "state": "Schleswig-Holstein",
      "amtsgericht": "Amtsgericht Flensburg",
      "registernummer": "HRB 15169",
      "registerart": "HRB",
      "company_name": "JCP Commerce UG (haftungsbeschränkt)",
      "company_seat": "Esgrus",
      "details": "24.09.2025 (Bekanntmachungsdatum)\n\nSchleswig-Holstein Amtsgericht Flensburg HRB 15169\nLöschungsankündigung\n\nJCP Commerce UG (haftungsbeschränkt)\nGesellschaft mit beschränkter Haftung\nEsgrus\n\nEs ist die Löschung der nachstehenden Gesellschaft wegen Vermögenslosigkeit gemäß § 394 FamFG beabsichtigt.\nWiderspruchsfrist: 2 Monate."
    },
    {
      "date": "2025-09-24",
      "id": "131241",
      "original_text": "Registerbekanntmachung nach dem Umwandlungsgesetz\nHamburg Amtsgericht Hamburg HRB 47389\nTVB Transportvermittlungs- und Vertriebsgesellschaft in Bergedorf mbH – Hamburg",
      "type": "Registerbekanntmachung nach dem Umwandlungsgesetz",
      "state": "Hamburg",
      "amtsgericht": "Amtsgericht Hamburg",
      "registernummer": "HRB 47389",
      "registerart": "HRB",
      "company_name": "TVB Transportvermittlungs- und Vertriebsgesellschaft in Bergedorf mbH",
      "company_seat": "Hamburg",
      "details": "24.09.2025 (Bekanntmachungsdatum)\n\nHamburg Amtsgericht Hamburg HRB 47389\nRegisterbekanntmachung nach dem Umwandlungsgesetz 24.09.2025 (Eintragungsdatum)\n\nTVB Transportvermittlungs- und Vertriebsgesellschaft in Bergedorf mbH\nGesellschaft mit beschränkter Haftung\nHamburg\n\nAls nicht eingetragen wird bekannt gemacht:\nDen Gläubigern der an der Verschmelzung beteiligten Gesellschaften ist, wenn sie binnen sechs Monaten nach dem Tag, an dem die Eintragung der Verschmelzung in das Register des Sitzes desjenigen Rechtsträgers, dessen Gläubiger sie sind, nach § 19 Absatz 3 UmwG als bekannt gemacht gilt, ihren Anspruch nach Grund und Höhe schriftlich anmelden, Sicherheit zu leisten, soweit sie nicht Befriedigung verlangen können. Dieses Recht steht den Gläubigern jedoch nur zu, wenn sie glaubhaft machen, dass durch die Verschmelzung die Erfüllung ihrer Forderung gefährdet wird."
    },
    {
      "date": "2025-09-24",
      "id": "131242",
      "original_text": "Registerbekanntmachung nach dem Umwandlungsgesetz\nHamburg Amtsgericht Hamburg HRB 104284\nFUNKE Hamburg Logistik GmbH – Hamburg",
      "type": "Registerbekanntmachung nach dem Umwandlungsgesetz",
      "state": "Hamburg",
      "amtsgericht": "Amtsgericht Hamburg",
      "registernummer": "HRB 104284",
      "registerart": "HRB",
      "company_name": "FUNKE Hamburg Logistik GmbH",
      "company_seat": "Hamburg",
      "details": "24.09.2025 (Bekanntmachungsdatum)\n\nHamburg Amtsgericht Hamburg HRB 104284\nRegisterbekanntmachung nach dem Umwandlungsgesetz 24.09.2025 (Eintragungsdatum)\n\nFUNKE Hamburg Logistik GmbH\nGesellschaft mit beschränkter Haftung\nHamburg\n\nAls nicht eingetragen wird bekannt gemacht:\nDen Gläubigern der an der Verschmelzung beteiligten Gesellschaften ist, wenn sie binnen sechs Monaten nach dem Tag, an dem die Eintragung der Verschmelzung in das Register des Sitzes desjenigen Rechtsträgers, dessen Gläubiger sie sind, nach § 19 Absatz 3 UmwG als bekannt gemacht gilt, ihren Anspruch nach Grund und Höhe schriftlich anmelden, Sicherheit zu leisten, soweit sie nicht Befriedigung verlangen können. Dieses Recht steht den Gläubigern jedoch nur zu, wenn sie glaubhaft machen, dass durch die Verschmelzung die Erfüllung ihrer Forderung gefährdet wird."
    },
    {
      "date": "2025-09-24",
      "id": "131243",
      "original_text": "Registerbekanntmachung nach dem Umwandlungsgesetz\nBaden-Württemberg Amtsgericht Stuttgart HRB 801839\nIngenieurbüro Rätzsch GmbH – Renningen",
      "type": "Registerbekanntmachung nach dem Umwandlungsgesetz",
      "state": "Baden-Württemberg",
      "amtsgericht": "Amtsgericht Stuttgart",
      "registernummer": "HRB 801839",
      "registerart": "HRB",
      "company_name": "Ingenieurbüro Rätzsch GmbH",
      "company_seat": "Renningen",
      "details": "24.09.2025 (Bekanntmachungsdatum)\n\nBaden-Württemberg Amtsgericht Stuttgart HRB 801839\nRegisterbekanntmachung nach dem Umwandlungsgesetz 24.09.2025 (Eintragungsdatum)\n\nIngenieurbüro Rätzsch GmbH\nGesellschaft mit beschränkter Haftung\nRenningen\n\nAls nicht eingetragen wird bekanntgemacht:\nDen Gläubigern des an dem Formwechsel beteiligten Rechtsträgers ist, wenn sie binnen sechs Monaten nach dem Tag, an dem die Eintragung des Formwechsels in das Register des Sitzes desjenigen Rechtsträgers, dessen Gläubiger sie sind, nach § 19 Abs. 3 UmwG als bekanntgemacht gilt, ihren Anspruch nach Grund und Höhe schriftlich anmelden, Sicherheit zu leisten, soweit sie nicht Befriedigung verlangen können. Dieses Recht steht den Gläubigern jedoch nur zu, wenn sie glaubhaft machen, dass durch den Formwechsel die Erfüllung ihrer Forderung gefährdet wird."
    },
    {
      "date": "2025-09-24",
      "id": "131244",
      "original_text": "Einreichung neuer Dokumente\nBaden-Württemberg Amtsgericht Stuttgart HRB 17316\nDaimler Buses GmbH – Stuttgart",
      "type": "Einreichung neuer Dokumente",
      "state": "Baden-Württemberg",
      "amtsgericht": "Amtsgericht Stuttgart",
      "registernummer": "HRB 17316",
      "registerart": "HRB",
      "company_name": "Daimler Buses GmbH",
      "company_seat": "Stuttgart",
      "details": "24.09.2025 (Bekanntmachungsdatum)\n\nBaden-Württemberg Amtsgericht Stuttgart HRB 17316\nEinreichung neuer Dokumente\n\nDaimler Buses GmbH\nGesellschaft mit beschränkter Haftung\nStuttgart\n\nDie Gesellschaft hat am 23.09.2025 die Liste über die Zusammensetzung des Aufsichtsrats zum Handelsregister eingereicht."
    },
    {
      "date": "2025-09-24",
      "id": "131245",
      "original_text": "Registerbekanntmachung nach dem Umwandlungsgesetz\nBaden-Württemberg Amtsgericht Stuttgart HRA 722566\nIngenieurbüro Rätzsch KG – Renningen",
      "type": "Registerbekanntmachung nach dem Umwandlungsgesetz",
      "state": "Baden-Württemberg",
      "amtsgericht": "Amtsgericht Stuttgart",
      "registernummer": "HRA 722566",
      "registerart": "HRA",
      "company_name": "Ingenieurbüro Rätzsch KG",
      "company_seat": "Renningen",
      "details": "24.09.2025 (Bekanntmachungsdatum)\n\nBaden-Württemberg Amtsgericht Stuttgart HRA 722566\nRegisterbekanntmachung nach dem Umwandlungsgesetz 24.09.2025 (Eintragungsdatum)\n\nIngenieurbüro Rätzsch KG\nKommanditgesellschaft\nRenningen\n\nAls nicht eingetragen wird bekanntgemacht:\nDen Gläubigern des an dem Formwechsel beteiligten Rechtsträgers ist, wenn sie binnen sechs Monaten nach dem Tag, an dem die Eintragung des Formwechsels in das Register des Sitzes desjenigen Rechtsträgers, dessen Gläubiger sie sind, nach § 19 Abs. 3 UmwG als bekanntgemacht gilt, ihren Anspruch nach Grund und Höhe schriftlich anmelden, Sicherheit zu leisten, soweit sie nicht Befriedigung verlangen können. Dieses Recht steht den Gläubigern jedoch nur zu, wenn sie glaubhaft machen, dass durch den Formwechsel die Erfüllung ihrer Forderung gefährdet wird."
    },
    {
      "date": "2025-09-24",
      "id": "131246",
      "original_text": "Registerbekanntmachung nach dem Umwandlungsgesetz\nBaden-Württemberg Amtsgericht Stuttgart HRA 722360\nTherapiezentrum Iven OHG – Baiersbronn",
      "type": "Registerbekanntmachung nach dem Umwandlungsgesetz",
      "state": "Baden-Württemberg",
      "amtsgericht": "Amtsgericht Stuttgart",
      "registernummer": "HRA 722360",
      "registerart": "HRA",
      "company_name": "Therapiezentrum Iven OHG",
      "company_seat": "Baiersbronn",
      "details": "24.09.2025 (Bekanntmachungsdatum)\n\nBaden-Württemberg Amtsgericht Stuttgart HRA 722360\nRegisterbekanntmachung nach dem Umwandlungsgesetz 24.09.2025 (Eintragungsdatum)\n\nTherapiezentrum Iven OHG\nOffene Handelsgesellschaft\nBaiersbronn\n\nAls nicht eingetragen wird bekanntgemacht:\nDen Gläubigern der an der Verschmelzung beteiligten Rechtsträger ist, wenn sie binnen sechs Monaten nach dem Tag, an dem die Eintragung der Verschmelzung in das Register des Sitzes desjenigen Rechtsträgers, dessen Gläubiger sie sind, nach § 19 Abs. 3 UmwG als bekanntgemacht gilt, ihren Anspruch nach Grund und Höhe schriftlich anmelden, Sicherheit zu leisten, soweit sie nicht Befriedigung verlangen können. Dieses Recht steht den Gläubigern jedoch nur zu, wenn sie glaubhaft machen, dass durch die Verschmelzung die Erfüllung ihrer Forderung gefährdet wird."
    },
    {
      "date": "2025-09-24",
      "id": "131247",
      "original_text": "Löschungsankündigung\nSachsen Amtsgericht Dresden HRB 37890\nRW Capital Service GmbH – Bautzen",
      "type": "Löschungsankündigung",
      "state": "Sachsen",
      "amtsgericht": "Amtsgericht Dresden",
      "registernummer": "HRB 37890",
      "registerart": "HRB",
      "company_name": "RW Capital Service GmbH",
      "company_seat": "Bautzen",
      "details": "24.09.2025 (Bekanntmachungsdatum)\n\nSachsen Amtsgericht Dresden HRB 37890\nLöschungsankündigung\n\nRW Capital Service GmbH\nGesellschaft mit beschränkter Haftung\nBautzen\n\nDas Registergericht beabsichtigt, die im Handelsregister eingetragene Gesellschaft von Amts wegen nach § 394 FamFG zu löschen. Die Frist zu Erhebung eines Widerspruchs gegen die beabsichtigte Löschung wird auf einen Monat festgesetzt."
    },
    {
      "date": "2025-09-24",
      "id": "131248",
      "original_text": "Registerbekanntmachung nach dem Umwandlungsgesetz\nSachsen Amtsgericht Leipzig HRB 36656\nHolodat GmbH – Leipzig",
      "type": "Registerbekanntmachung nach dem Umwandlungsgesetz",
      "state": "Sachsen",
      "amtsgericht": "Amtsgericht Leipzig",
      "registernummer": "HRB 36656",
      "registerart": "HRB",
      "company_name": "Holodat GmbH",
      "company_seat": "Leipzig",
      "details": "24.09.2025 (Bekanntmachungsdatum)\n\nSachsen Amtsgericht Leipzig HRB 36656\nRegisterbekanntmachung nach dem Umwandlungsgesetz 24.09.2025 (Eintragungsdatum)\n\nHolodat GmbH\nGesellschaft mit beschränkter Haftung\nLeipzig\n\nDen Gläubigern der an der Verschmelzung beteiligten Rechtsträger ist, wenn sie binnen sechs Monaten nach dem Tag, an dem die Eintragung der Verschmelzung in das Register des Sitzes desjenigen Rechtsträgers, dessen Gläubiger sie sind, nach § 19 Abs. 3 UmwG als bekannt gemacht gilt, ihren Anspruch nach Grund und Höhe in Textform anmelden, Sicherheit zu leisten, soweit sie nicht Befriedigung verlangen können. Dieses Recht steht den Gläubigern jedoch nur zu, wenn sie glaubhaft machen, dass durch die Verschmelzung die Erfüllung der Forderung gefährdet wird."
    },
    {
      "date": "2025-09-24",
      "id": "131249",
      "original_text": "Registerbekanntmachung nach dem Umwandlungsgesetz\nSachsen Amtsgericht Leipzig HRB 26798\nHolodat GmbH – Leipzig",
      "type": "Registerbekanntmachung nach dem Umwandlungsgesetz",
      "state": "Sachsen",
      "amtsgericht": "Amtsgericht Leipzig",
      "registernummer": "HRB 26798",
      "registerart": "HRB",
      "company_name": "Holodat GmbH",
      "company_seat": "Leipzig",
      "details": "24.09.2025 (Bekanntmachungsdatum)\n\nSachsen Amtsgericht Leipzig HRB 26798\nRegisterbekanntmachung nach dem Umwandlungsgesetz 24.09.2025 (Eintragungsdatum)\n\nHolodat GmbH\nGesellschaft mit beschränkter Haftung\nLeipzig\n\nDen Gläubigern der an der Verschmelzung beteiligten Rechtsträger ist, wenn sie binnen sechs Monaten nach dem Tag, an dem die Eintragung der Verschmelzung in das Register des Sitzes desjenigen Rechtsträgers, dessen Gläubiger sie sind, nach § 19 Abs. 3 UmwG als bekannt gemacht gilt, ihren Anspruch nach Grund und Höhe in Textform anmelden, Sicherheit zu leisten, soweit sie nicht Befriedigung verlangen können. Dieses Recht steht den Gläubigern jedoch nur zu, wenn sie glaubhaft machen, dass durch die Verschmelzung die Erfüllung der Forderung gefährdet wird."
    },
    {
      "date": "2025-09-24",
      "id": "131250",
      "original_text": "Registerbekanntmachung nach dem Umwandlungsgesetz\nNiedersachsen Amtsgericht Hildesheim HRB 69\nLüder Bauträger GmbH – Hildesheim",
      "type": "Registerbekanntmachung nach dem Umwandlungsgesetz",
      "state": "Niedersachsen",
      "amtsgericht": "Amtsgericht Hildesheim",
      "registernummer": "HRB 69",
      "registerart": "HRB",
      "company_name": "Lüder Bauträger GmbH",
      "company_seat": "Hildesheim",
      "details": "24.09.2025 (Bekanntmachungsdatum)\n\nNiedersachsen Amtsgericht Hildesheim HRB 69\nRegisterbekanntmachung nach dem Umwandlungsgesetz 24.09.2025 (Eintragungsdatum)\n\nLüder Bauträger GmbH\nGesellschaft mit beschränkter Haftung\nHildesheim\n\nDen Gläubigern der an der Verschmelzung beteiligten Rechtsträger ist, wenn sie binnen sechs Monaten nach dem Tag, an dem die Eintragung der Verschmelzung in das Register des Sitzes desjenigen Rechtsträgers, dessen Gläubiger sie sind, nach § 19  Abs.  3 UmwG als bekannt gemacht gilt, ihren Anspruch nach Grund und Höhe schriftlich anmelden, Sicherheit zu leisten, soweit sie nicht Befriedigung verlangen können. Dieses Recht steht den Gläubigern jedoch nur zu, wenn sie glaubhaft machen, dass durch die Verschmelzung die Erfüllung der Forderung gefährdet wird."
    },
    {
      "date": "2025-09-24",
      "id": "131251",
      "original_text": "Löschungsankündigung\nNiedersachsen Amtsgericht Braunschweig HRB 211680\nBOEHMISCH Handels GmbH – Braunschweig",
      "type": "Löschungsankündigung",
      "state": "Niedersachsen",
      "amtsgericht": "Amtsgericht Braunschweig",
      "registernummer": "HRB 211680",
      "registerart": "HRB",
      "company_name": "BOEHMISCH Handels GmbH",
      "company_seat": "Braunschweig",
      "details": "24.09.2025 (Bekanntmachungsdatum)\n\nNiedersachsen Amtsgericht Braunschweig HRB 211680\nLöschungsankündigung\n\nBOEHMISCH Handels GmbH\nGesellschaft mit beschränkter Haftung\nBraunschweig\n\nDas Registergericht beabsichtigt, die Gesellschaft von Amts wegen nach § 394 FamFG zu löschen. Die Frist zur Erhebung eines Widerspruchs ist auf 1 Monat ab dieser Registerbekanntmachung festgesetzt."
    },
    {
      "date": "2025-09-24",
      "id": "131252",
      "original_text": "Registerbekanntmachung nach dem Umwandlungsgesetz\nNiedersachsen Amtsgericht Hannover HRB 50579\nBEGA Betriebsgesellschaft für Gaststätten und Restauration mbH – Hannover",
      "type": "Registerbekanntmachung nach dem Umwandlungsgesetz",
      "state": "Niedersachsen",
      "amtsgericht": "Amtsgericht Hannover",
      "registernummer": "HRB 50579",
      "registerart": "HRB",
      "company_name": "BEGA Betriebsgesellschaft für Gaststätten und Restauration mbH",
      "company_seat": "Hannover",
      "details": "24.09.2025 (Bekanntmachungsdatum)\n\nNiedersachsen Amtsgericht Hannover HRB 50579\nRegisterbekanntmachung nach dem Umwandlungsgesetz 24.09.2025 (Eintragungsdatum)\n\nBEGA Betriebsgesellschaft für Gaststätten und Restauration mbH\nGesellschaft mit beschränkter Haftung\nHannover\n\nDen Gläubigern der an der Verschmelzung beteiligten Rechtsträger ist, wenn sie binnen sechs Monaten nach dem Tag, an dem die Eintragung der Verschmelzung in das Register des Sitzes desjenigen Rechtsträgers, dessen Gläubiger sie sind, nach § 19  Abs.  3 UmwG als bekannt gemacht gilt, ihren Anspruch nach Grund und Höhe schriftlich anmelden, Sicherheit zu leisten, soweit sie nicht Befriedigung verlangen können. Dieses Recht steht den Gläubigern jedoch nur zu, wenn sie glaubhaft machen, dass durch die Verschmelzung die Erfüllung der Forderung gefährdet wird."
    },
    {
      "date": "2025-09-24",
      "id": "131253",
      "original_text": "Einreichung neuer Dokumente\nNiedersachsen Amtsgericht Hildesheim HRB 200977\nHildesheim Marketing GmbH – Hildesheim",
      "type": "Einreichung neuer Dokumente",
      "state": "Niedersachsen",
      "amtsgericht": "Amtsgericht Hildesheim",
      "registernummer": "HRB 200977",
      "registerart": "HRB",
      "company_name": "Hildesheim Marketing GmbH",
      "company_seat": "Hildesheim",
      "details": "24.09.2025 (Bekanntmachungsdatum)\n\nNiedersachsen Amtsgericht Hildesheim HRB 200977\nEinreichung neuer Dokumente 24.09.2025 (Eintragungsdatum)\n\nHildesheim Marketing GmbH\nGesellschaft mit beschränkter Haftung\nHildesheim\n\nDie Liste der Mitglieder des Aufsichtsrats wurde beim Registergericht eingereicht."
    },
    {
      "date": "2025-09-24",
      "id": "131254",
      "original_text": "Registerbekanntmachung nach dem Umwandlungsgesetz\nNiedersachsen Amtsgericht Osnabrück HRB 214576\nRichter Service GmbH – Fürstenau",
      "type": "Registerbekanntmachung nach dem Umwandlungsgesetz",
      "state": "Niedersachsen",
      "amtsgericht": "Amtsgericht Osnabrück",
      "registernummer": "HRB 214576",
      "registerart": "HRB",
      "company_name": "Richter Service GmbH",
      "company_seat": "Fürstenau",
      "details": "24.09.2025 (Bekanntmachungsdatum)\n\nNiedersachsen Amtsgericht Osnabrück HRB 214576\nRegisterbekanntmachung nach dem Umwandlungsgesetz 24.09.2025 (Eintragungsdatum)\n\nRichter Service GmbH\nGesellschaft mit beschränkter Haftung\nFürstenau\n\nDen Gläubigern der an der Verschmelzung beteiligten Rechtsträger ist, wenn sie binnen sechs Monaten nach dem Tag, an dem die Eintragung der Verschmelzung in das Register des Sitzes desjenigen Rechtsträgers, dessen Gläubiger sie sind, nach § 19  Abs.  3 UmwG als bekannt gemacht gilt, ihren Anspruch nach Grund und Höhe schriftlich anmelden, Sicherheit zu leisten, soweit sie nicht Befriedigung verlangen können. Dieses Recht steht den Gläubigern jedoch nur zu, wenn sie glaubhaft machen, dass durch die Verschmelzung die Erfüllung der Forderung gefährdet wird."
    },
    {
      "date": "2025-09-24",
      "id": "131255",
      "original_text": "Registerbekanntmachung nach dem Umwandlungsgesetz\nNiedersachsen Amtsgericht Osnabrück HRA 209728\nJohannes Ewald Hungeling e.K. – Nordhorn",
      "type": "Registerbekanntmachung nach dem Umwandlungsgesetz",
      "state": "Niedersachsen",
      "amtsgericht": "Amtsgericht Osnabrück",
      "registernummer": "HRA 209728",
      "registerart": "HRA",
      "company_name": "Johannes Ewald Hungeling e.K.",
      "company_seat": "Nordhorn",
      "details": "24.09.2025 (Bekanntmachungsdatum)\n\nNiedersachsen Amtsgericht Osnabrück HRA 209728\nRegisterbekanntmachung nach dem Umwandlungsgesetz 24.09.2025 (Eintragungsdatum)\n\nJohannes Ewald Hungeling e.K.\nEinzelkaufmann / Einzelkauffrau\nNordhorn\n\nDen Gläubigern der an der Ausgliederung beteiligten Rechtsträger ist, wenn sie binnen sechs Monaten nach dem Tag, an dem die Eintragung der Ausgliederung in das Register des Sitzes desjenigen Rechtsträgers, dessen Gläubiger sie sind, nach § 19 Abs. 3 UmwG als bekannt gemacht gilt, ihren Anspruch nach Grund und Höhe schriftlich anmelden, Sicherheit zu leisten, soweit sie nicht Befriedigung verlangen können. Dieses Recht steht den Gläubigern jedoch nur zu, wenn sie glaubhaft machen, dass durch die Ausgliederung die Erfüllung der Forderung gefährdet wird."
    },
    {
      "date": "2025-09-24",
      "id": "131256",
      "original_text": "Registerbekanntmachung nach dem Umwandlungsgesetz\nNiedersachsen Amtsgericht Hannover HRB 218039\nEasy Rheider Holding UG (haftungsbeschränkt) – Hameln",
      "type": "Registerbekanntmachung nach dem Umwandlungsgesetz",
      "state": "Niedersachsen",
      "amtsgericht": "Amtsgericht Hannover",
      "registernummer": "HRB 218039",
      "registerart": "HRB",
      "company_name": "Easy Rheider Holding UG (haftungsbeschränkt)",
      "company_seat": "Hameln",
      "details": "24.09.2025 (Bekanntmachungsdatum)\n\nNiedersachsen Amtsgericht Hannover HRB 218039\nRegisterbekanntmachung nach dem Umwandlungsgesetz 24.09.2025 (Eintragungsdatum)\n\nEasy Rheider Holding UG (haftungsbeschränkt)\nGesellschaft mit beschränkter Haftung\nHameln\n\nDen Gläubigern der an der Verschmelzung beteiligten Rechtsträger ist, wenn sie binnen sechs Monaten nach dem Tag, an dem die Eintragung der Verschmelzung in das Register des Sitzes desjenigen Rechtsträgers, dessen Gläubiger sie sind, nach § 19  Abs.  3 UmwG als bekannt gemacht gilt, ihren Anspruch nach Grund und Höhe schriftlich anmelden, Sicherheit zu leisten, soweit sie nicht Befriedigung verlangen können. Dieses Recht steht den Gläubigern jedoch nur zu, wenn sie glaubhaft machen, dass durch die Verschmelzung die Erfüllung der Forderung gefährdet wird."
    },
    {
      "date": "2025-09-24",
      "id": "131257",
      "original_text": "Registerbekanntmachung nach dem Umwandlungsgesetz\nNiedersachsen Amtsgericht Oldenburg (Oldenburg) HRB 209554\nGreen Line Liquid GmbH – Bakum",
      "type": "Registerbekanntmachung nach dem Umwandlungsgesetz",
      "state": "Niedersachsen",
      "amtsgericht": "Amtsgericht Oldenburg (Oldenburg)",
      "registernummer": "HRB 209554",
      "registerart": "HRB",
      "company_name": "Green Line Liquid GmbH",
      "company_seat": "Bakum",
      "details": "24.09.2025 (Bekanntmachungsdatum)\n\nNiedersachsen Amtsgericht Oldenburg (Oldenburg) HRB 209554\nRegisterbekanntmachung nach dem Umwandlungsgesetz 24.09.2025 (Eintragungsdatum)\n\nGreen Line Liquid GmbH\nGesellschaft mit beschränkter Haftung\nBakum\n\nDen Gläubigern der an der Verschmelzung beteiligten Rechtsträger ist, wenn sie binnen sechs Monaten nach dem Tag, an dem die Eintragung der Verschmelzung in das Register des Sitzes desjenigen Rechtsträgers, dessen Gläubiger sie sind, nach § 19  Abs.  3 UmwG als bekannt gemacht gilt, ihren Anspruch nach Grund und Höhe schriftlich anmelden, Sicherheit zu leisten, soweit sie nicht Befriedigung verlangen können. Dieses Recht steht den Gläubigern jedoch nur zu, wenn sie glaubhaft machen, dass durch die Verschmelzung die Erfüllung der Forderung gefährdet wird."
    },
    {
      "date": "2025-09-24",
      "id": "131258",
      "original_text": "Löschungsankündigung\nNiedersachsen Amtsgericht Hannover HRB 452\nE. A. Care GmbH – Wennigsen",
      "type": "Löschungsankündigung",
      "state": "Niedersachsen",
      "amtsgericht": "Amtsgericht Hannover",
      "registernummer": "HRB 452",
      "registerart": "HRB",
      "company_name": "E. A. Care GmbH",
      "company_seat": "Wennigsen",
      "details": "24.09.2025 (Bekanntmachungsdatum)\n\nNiedersachsen Amtsgericht Hannover HRB 452\nLöschungsankündigung 23.09.2025 (Eintragungsdatum)\n\nE. A. Care GmbH\nGesellschaft mit beschränkter Haftung\nWennigsen\n\nDas Registergericht beabsichtigt, die Gesellschaft von Amts wegen nach § 394 FamFG zu löschen. Die Frist zur Erhebung eines Widerspruchs ist auf 1 Monat ab dieser Registerbekanntmachung festgesetzt."
    },
    {
      "date": "2025-09-24",
      "id": "131259",
      "original_text": "Registerbekanntmachung nach dem Umwandlungsgesetz\nNiedersachsen Amtsgericht Oldenburg (Oldenburg) HRB 218331\nGreen Line Liquid Partner GmbH – Bakum-Lüsche",
      "type": "Registerbekanntmachung nach dem Umwandlungsgesetz",
      "state": "Niedersachsen",
      "amtsgericht": "Amtsgericht Oldenburg (Oldenburg)",
      "registernummer": "HRB 218331",
      "registerart": "HRB",
      "company_name": "Green Line Liquid Partner GmbH",
      "company_seat": "Bakum-Lüsche",
      "details": "24.09.2025 (Bekanntmachungsdatum)\n\nNiedersachsen Amtsgericht Oldenburg (Oldenburg) HRB 218331\nRegisterbekanntmachung nach dem Umwandlungsgesetz 24.09.2025 (Eintragungsdatum)\n\nGreen Line Liquid Partner GmbH\nGesellschaft mit beschränkter Haftung\nBakum-Lüsche\n\nDen Gläubigern der an der Verschmelzung beteiligten Rechtsträger ist, wenn sie binnen sechs Monaten nach dem Tag, an dem die Eintragung der Verschmelzung in das Register des Sitzes desjenigen Rechtsträgers, dessen Gläubiger sie sind, nach § 19  Abs.  3 UmwG als bekannt gemacht gilt, ihren Anspruch nach Grund und Höhe schriftlich anmelden, Sicherheit zu leisten, soweit sie nicht Befriedigung verlangen können. Dieses Recht steht den Gläubigern jedoch nur zu, wenn sie glaubhaft machen, dass durch die Verschmelzung die Erfüllung der Forderung gefährdet wird."
    },
    {
      "date": "2025-09-24",
      "id": "131260",
      "original_text": "Registerbekanntmachung nach dem Umwandlungsgesetz\nNiedersachsen Amtsgericht Hildesheim HRB 201696\nPlan W65 GmbH – Hildesheim",
      "type": "Registerbekanntmachung nach dem Umwandlungsgesetz",
      "state": "Niedersachsen",
      "amtsgericht": "Amtsgericht Hildesheim",
      "registernummer": "HRB 201696",
      "registerart": "HRB",
      "company_name": "Plan W65 GmbH",
      "company_seat": "Hildesheim",
      "details": "24.09.2025 (Bekanntmachungsdatum)\n\nNiedersachsen Amtsgericht Hildesheim HRB 201696\nRegisterbekanntmachung nach dem Umwandlungsgesetz 24.09.2025 (Eintragungsdatum)\n\nPlan W65 GmbH\nGesellschaft mit beschränkter Haftung\nHildesheim\n\nDen Gläubigern der an der Verschmelzung beteiligten Rechtsträger ist, wenn sie binnen sechs Monaten nach dem Tag, an dem die Eintragung der Verschmelzung in das Register des Sitzes desjenigen Rechtsträgers, dessen Gläubiger sie sind, nach § 19  Abs.  3 UmwG als bekannt gemacht gilt, ihren Anspruch nach Grund und Höhe schriftlich anmelden, Sicherheit zu leisten, soweit sie nicht Befriedigung verlangen können. Dieses Recht steht den Gläubigern jedoch nur zu, wenn sie glaubhaft machen, dass durch die Verschmelzung die Erfüllung der Forderung gefährdet wird."
    },
    {
      "date": "2025-09-24",
      "id": "131261",
      "original_text": "Registerbekanntmachung nach dem Umwandlungsgesetz\nNiedersachsen Amtsgericht Osnabrück HRA 209740\nHEHBN GmbH & Co. KG – Nordhorn",
      "type": "Registerbekanntmachung nach dem Umwandlungsgesetz",
      "state": "Niedersachsen",
      "amtsgericht": "Amtsgericht Osnabrück",
      "registernummer": "HRA 209740",
      "registerart": "HRA",
      "company_name": "HEHBN GmbH & Co. KG",
      "company_seat": "Nordhorn",
      "details": "24.09.2025 (Bekanntmachungsdatum)\n\nNiedersachsen Amtsgericht Osnabrück HRA 209740\nRegisterbekanntmachung nach dem Umwandlungsgesetz 24.09.2025 (Eintragungsdatum)\n\nHEHBN GmbH & Co. KG\nKommanditgesellschaft\nNordhorn\n\nDen Gläubigern der an der Ausgliederung beteiligten Rechtsträger ist, wenn sie binnen sechs Monaten nach dem Tag, an dem die Eintragung der Ausgliederung in das Register des Sitzes desjenigen Rechtsträgers, dessen Gläubiger sie sind, nach § 19 Abs. 3 UmwG als bekannt gemacht gilt, ihren Anspruch nach Grund und Höhe schriftlich anmelden, Sicherheit zu leisten, soweit sie nicht Befriedigung verlangen können. Dieses Recht steht den Gläubigern jedoch nur zu, wenn sie glaubhaft machen, dass durch die Ausgliederung die Erfüllung der Forderung gefährdet wird."
    },
    {
      "date": "2025-09-24",
      "id": "131262",
      "original_text": "Registerbekanntmachung nach dem Umwandlungsgesetz\nNiedersachsen Amtsgericht Oldenburg (Oldenburg) HRB 217802\nGreen Line Liquid Betriebs GmbH – Bakum",
      "type": "Registerbekanntmachung nach dem Umwandlungsgesetz",
      "state": "Niedersachsen",
      "amtsgericht": "Amtsgericht Oldenburg (Oldenburg)",
      "registernummer": "HRB 217802",
      "registerart": "HRB",
      "company_name": "Green Line Liquid Betriebs GmbH",
      "company_seat": "Bakum",
      "details": "24.09.2025 (Bekanntmachungsdatum)\n\nNiedersachsen Amtsgericht Oldenburg (Oldenburg) HRB 217802\nRegisterbekanntmachung nach dem Umwandlungsgesetz 24.09.2025 (Eintragungsdatum)\n\nGreen Line Liquid Betriebs GmbH\nGesellschaft mit beschränkter Haftung\nBakum\n\nDen Gläubigern der an der Verschmelzung beteiligten Rechtsträger ist, wenn sie binnen sechs Monaten nach dem Tag, an dem die Eintragung der Verschmelzung in das Register des Sitzes desjenigen Rechtsträgers, dessen Gläubiger sie sind, nach § 19  Abs.  3 UmwG als bekannt gemacht gilt, ihren Anspruch nach Grund und Höhe schriftlich anmelden, Sicherheit zu leisten, soweit sie nicht Befriedigung verlangen können. Dieses Recht steht den Gläubigern jedoch nur zu, wenn sie glaubhaft machen, dass durch die Verschmelzung die Erfüllung der Forderung gefährdet wird."
    },
    {
      "date": "2025-09-24",
      "id": "131263",
      "original_text": "Einreichung neuer Dokumente\nNiedersachsen Amtsgericht Hannover HRB 60722\nHDI AG – Hannover",
      "type": "Einreichung neuer Dokumente",
      "state": "Niedersachsen",
      "amtsgericht": "Amtsgericht Hannover",
      "registernummer": "HRB 60722",
      "registerart": "HRB",
      "company_name": "HDI AG",
      "company_seat": "Hannover",
      "details": "24.09.2025 (Bekanntmachungsdatum)\n\nNiedersachsen Amtsgericht Hannover HRB 60722\nEinreichung neuer Dokumente\n\nHDI AG\nAktiengesellschaft\nHannover\n\nDie Liste der Mitglieder des Aufsichtsrats wurde beim Registergericht eingereicht."
    },
    {
      "date": "2025-09-24",
      "id": "131264",
      "original_text": "Einreichung neuer Dokumente\nNiedersachsen Amtsgericht Hildesheim HRB 2484\nHarzwasserwerke Gesellschaft mit beschränkter Haftung – Hildesheim",
      "type": "Einreichung neuer Dokumente",
      "state": "Niedersachsen",
      "amtsgericht": "Amtsgericht Hildesheim",
      "registernummer": "HRB 2484",
      "registerart": "HRB",
      "company_name": "Harzwasserwerke Gesellschaft mit beschränkter Haftung",
      "company_seat": "Hildesheim",
      "details": "24.09.2025 (Bekanntmachungsdatum)\n\nNiedersachsen Amtsgericht Hildesheim HRB 2484\nEinreichung neuer Dokumente\n\nHarzwasserwerke Gesellschaft mit beschränkter Haftung\nGesellschaft mit beschränkter Haftung\nHildesheim\n\nDie Liste der Mitglieder des Aufsichtsrats wurde beim Registergericht eingereicht."
    },
    {
      "date": "2025-09-24",
      "id": "131265",
      "original_text": "Löschungsankündigung\nNiedersachsen Amtsgericht Hannover HRB 225547\nKidas Immobilien UG (haftungsbeschränkt) – Hannover",
      "type": "Löschungsankündigung",
      "state": "Niedersachsen",
      "amtsgericht": "Amtsgericht Hannover",
      "registernummer": "HRB 225547",
      "registerart": "HRB",
      "company_name": "Kidas Immobilien UG (haftungsbeschränkt)",
      "company_seat": "Hannover",
      "details": "24.09.2025 (Bekanntmachungsdatum)\n\nNiedersachsen Amtsgericht Hannover HRB 225547\nLöschungsankündigung\n\nKidas Immobilien UG (haftungsbeschränkt)\nGesellschaft mit beschränkter Haftung\nHannover\n\nDas Registergericht beabsichtigt, die Gesellschaft von Amts wegen nach § 394 FamFG zu löschen. Die Frist zur Erhebung eines Widerspruchs ist auf 1 Monat ab dieser Registerbekanntmachung festgesetzt."
    },
    {
      "date": "2025-09-24",
      "id": "131266",
      "original_text": "Registerbekanntmachung nach dem Umwandlungsgesetz\nNiedersachsen Amtsgericht Osnabrück HRB 18250\nIntan Service Plus Beteiligungs GmbH – Osnabrück",
      "type": "Registerbekanntmachung nach dem Umwandlungsgesetz",
      "state": "Niedersachsen",
      "amtsgericht": "Amtsgericht Osnabrück",
      "registernummer": "HRB 18250",
      "registerart": "HRB",
      "company_name": "Intan Service Plus Beteiligungs GmbH",
      "company_seat": "Osnabrück",
      "details": "24.09.2025 (Bekanntmachungsdatum)\n\nNiedersachsen Amtsgericht Osnabrück HRB 18250\nRegisterbekanntmachung nach dem Umwandlungsgesetz 24.09.2025 (Eintragungsdatum)\n\nIntan Service Plus Beteiligungs GmbH\nGesellschaft mit beschränkter Haftung\nOsnabrück\n\nDen Gläubigern der an der Verschmelzung beteiligten Rechtsträger ist, wenn sie binnen sechs Monaten nach dem Tag, an dem die Eintragung der Verschmelzung in das Register des Sitzes desjenigen Rechtsträgers, dessen Gläubiger sie sind, nach § 19  Abs.  3 UmwG als bekannt gemacht gilt, ihren Anspruch nach Grund und Höhe schriftlich anmelden, Sicherheit zu leisten, soweit sie nicht Befriedigung verlangen können. Dieses Recht steht den Gläubigern jedoch nur zu, wenn sie glaubhaft machen, dass durch die Verschmelzung die Erfüllung der Forderung gefährdet wird."
    },
    {
      "date": "2025-09-24",
      "id": "131267",
      "original_text": "Registerbekanntmachung nach dem Umwandlungsgesetz\nNiedersachsen Amtsgericht Hannover HRB 220393\nMT Maurice Tengler Holding UG (haftungsbeschränkt) – Hannover",
      "type": "Registerbekanntmachung nach dem Umwandlungsgesetz",
      "state": "Niedersachsen",
      "amtsgericht": "Amtsgericht Hannover",
      "registernummer": "HRB 220393",
      "registerart": "HRB",
      "company_name": "MT Maurice Tengler Holding UG (haftungsbeschränkt)",
      "company_seat": "Hannover",
      "details": "24.09.2025 (Bekanntmachungsdatum)\n\nNiedersachsen Amtsgericht Hannover HRB 220393\nRegisterbekanntmachung nach dem Umwandlungsgesetz 24.09.2025 (Eintragungsdatum)\n\nMT Maurice Tengler Holding UG (haftungsbeschränkt)\nGesellschaft mit beschränkter Haftung\nHannover\n\nDen Gläubigern der an der formwechselnden Umwandlung beteiligten Rechtsträger ist, wenn sie binnen sechs Monaten nach dem Tag, an dem die Eintragung der Umwandlung in das Register des Sitzes desjenigen Rechtsträgers, dessen Gläubiger sie sind, nach § 19 Abs. 3 UmwG als bekannt gemacht gilt, ihren Anspruch nach Grund und Höhe schriftlich anmelden, Sicherheit zu leisten, soweit sie nicht Befriedigung verlangen können. Dieses Recht steht den Gläubigern jedoch nur zu, wenn sie glaubhaft machen, dass durch die formwechselnde Umwandlung die Erfüllung der Forderung gefährdet wird."
    },
    {
      "date": "2025-09-24",
      "id": "131268",
      "original_text": "Einreichung neuer Dokumente\nNiedersachsen Amtsgericht Aurich HRB 110337 früher Amtsgericht Leer (Ostfriesland) (Leer)\nJ. Bünting Beteiligungs AG – Leer",
      "type": "Einreichung neuer Dokumente",
      "state": "Niedersachsen",
      "amtsgericht": "Amtsgericht Aurich",
      "registernummer": "HRB 110337",
      "registerart": "HRB",
      "company_name": "J. Bünting Beteiligungs AG",
      "company_seat": "Leer",
      "former_amtsgericht": "Leer (Ostfriesland) (Leer)",
      "details": "24.09.2025 (Bekanntmachungsdatum)\n\nNiedersachsen Amtsgericht Aurich HRB 110337 früher Amtsgericht Leer (Ostfriesland) (Leer)\nEinreichung neuer Dokumente\n\nJ. Bünting Beteiligungs AG\nAktiengesellschaft\nLeer\n\nDie Liste der Mitglieder des Aufsichtsrats wurde beim Registergericht eingereicht."
    },
    {
      "date": "2025-09-24",
      "id": "131269",
      "original_text": "Registerbekanntmachung nach dem Umwandlungsgesetz\nNiedersachsen Amtsgericht Osnabrück GnR 130010 früher Amtsgericht Nordhorn\nGrafschafter Viehvermarktung eG – Uelsen",
      "type": "Registerbekanntmachung nach dem Umwandlungsgesetz",
      "state": "Niedersachsen",
      "amtsgericht": "Amtsgericht Osnabrück",
      "registernummer": "GnR 130010",
      "registerart": "GnR",
      "company_name": "Grafschafter Viehvermarktung eG",
      "company_seat": "Uelsen",
      "former_amtsgericht": "Nordhorn",
      "details": "24.09.2025 (Bekanntmachungsdatum)\n\nNiedersachsen Amtsgericht Osnabrück GnR 130010 früher Amtsgericht Nordhorn\nRegisterbekanntmachung nach dem Umwandlungsgesetz 24.09.2025 (Eintragungsdatum)\n\nGrafschafter Viehvermarktung eG\neingetragene Genossenschaft\nUelsen\n\nDen Gläubigern der an der Verschmelzung beteiligten Rechtsträger ist, wenn sie binnen sechs Monaten nach dem Tag, an dem die Eintragung der Verschmelzung in das Register des Sitzes desjenigen Rechtsträgers, dessen Gläubiger sie sind, nach § 19  Abs.  3 UmwG als bekannt gemacht gilt, ihren Anspruch nach Grund und Höhe schriftlich anmelden, Sicherheit zu leisten, soweit sie nicht Befriedigung verlangen können. Dieses Recht steht den Gläubigern jedoch nur zu, wenn sie glaubhaft machen, dass durch die Verschmelzung die Erfüllung der Forderung gefährdet wird."
    },
    {
      "date": "2025-09-24",
      "id": "131270",
      "original_text": "Registerbekanntmachung nach dem Umwandlungsgesetz\nNiedersachsen Amtsgericht Osnabrück HRB 211359\nzwei.7 Equity GmbH – Osnabrück",
      "type": "Registerbekanntmachung nach dem Umwandlungsgesetz",
      "state": "Niedersachsen",
      "amtsgericht": "Amtsgericht Osnabrück",
      "registernummer": "HRB 211359",
      "registerart": "HRB",
      "company_name": "zwei.7 Equity GmbH",
      "company_seat": "Osnabrück",
      "details": "24.09.2025 (Bekanntmachungsdatum)\n\nNiedersachsen Amtsgericht Osnabrück HRB 211359\nRegisterbekanntmachung nach dem Umwandlungsgesetz 24.09.2025 (Eintragungsdatum)\n\nzwei.7 Equity GmbH\nGesellschaft mit beschränkter Haftung\nOsnabrück\n\nDen Gläubigern der an der Verschmelzung beteiligten Rechtsträger ist, wenn sie binnen sechs Monaten nach dem Tag, an dem die Eintragung der Verschmelzung in das Register des Sitzes desjenigen Rechtsträgers, dessen Gläubiger sie sind, nach § 19  Abs.  3 UmwG als bekannt gemacht gilt, ihren Anspruch nach Grund und Höhe schriftlich anmelden, Sicherheit zu leisten, soweit sie nicht Befriedigung verlangen können. Dieses Recht steht den Gläubigern jedoch nur zu, wenn sie glaubhaft machen, dass durch die Verschmelzung die Erfüllung der Forderung gefährdet wird."
    },
    {
      "date": "2025-09-24",
      "id": "131271",
      "original_text": "Registerbekanntmachung nach dem Umwandlungsgesetz\nNiedersachsen Amtsgericht Walsrode HRB 120666\nVerlag Haus am Weyerberg GmbH – Worpswede",
      "type": "Registerbekanntmachung nach dem Umwandlungsgesetz",
      "state": "Niedersachsen",
      "amtsgericht": "Amtsgericht Walsrode",
      "registernummer": "HRB 120666",
      "registerart": "HRB",
      "company_name": "Verlag Haus am Weyerberg GmbH",
      "company_seat": "Worpswede",
      "details": "24.09.2025 (Bekanntmachungsdatum)\n\nNiedersachsen Amtsgericht Walsrode HRB 120666\nRegisterbekanntmachung nach dem Umwandlungsgesetz 24.09.2025 (Eintragungsdatum)\n\nVerlag Haus am Weyerberg GmbH\nGesellschaft mit beschränkter Haftung\nWorpswede\n\nDen Gläubigern der an der Verschmelzung beteiligten Rechtsträger ist, wenn sie binnen sechs Monaten nach dem Tag, an dem die Eintragung der Verschmelzung in das Register des Sitzes desjenigen Rechtsträgers, dessen Gläubiger sie sind, nach § 19  Abs.  3 UmwG als bekannt gemacht gilt, ihren Anspruch nach Grund und Höhe schriftlich anmelden, Sicherheit zu leisten, soweit sie nicht Befriedigung verlangen können. Dieses Recht steht den Gläubigern jedoch nur zu, wenn sie glaubhaft machen, dass durch die Verschmelzung die Erfüllung der Forderung gefährdet wird."
    },
    {
      "date": "2025-09-24",
      "id": "131272",
      "original_text": "Registerbekanntmachung nach dem Umwandlungsgesetz\nNiedersachsen Amtsgericht Hannover HRB 218022\nWarp 42 UG (haftungsbeschränkt) – Ronnenberg",
      "type": "Registerbekanntmachung nach dem Umwandlungsgesetz",
      "state": "Niedersachsen",
      "amtsgericht": "Amtsgericht Hannover",
      "registernummer": "HRB 218022",
      "registerart": "HRB",
      "company_name": "Warp 42 UG (haftungsbeschränkt)",
      "company_seat": "Ronnenberg",
      "details": "24.09.2025 (Bekanntmachungsdatum)\n\nNiedersachsen Amtsgericht Hannover HRB 218022\nRegisterbekanntmachung nach dem Umwandlungsgesetz 24.09.2025 (Eintragungsdatum)\n\nWarp 42 UG (haftungsbeschränkt)\nGesellschaft mit beschränkter Haftung\nRonnenberg\n\nDen Gläubigern der an der Verschmelzung beteiligten Rechtsträger ist, wenn sie binnen sechs Monaten nach dem Tag, an dem die Eintragung der Verschmelzung in das Register des Sitzes desjenigen Rechtsträgers, dessen Gläubiger sie sind, nach § 19  Abs.  3 UmwG als bekannt gemacht gilt, ihren Anspruch nach Grund und Höhe schriftlich anmelden, Sicherheit zu leisten, soweit sie nicht Befriedigung verlangen können. Dieses Recht steht den Gläubigern jedoch nur zu, wenn sie glaubhaft machen, dass durch die Verschmelzung die Erfüllung der Forderung gefährdet wird."
    },
    {
      "date": "2025-09-24",
      "id": "131273",
      "original_text": "Registerbekanntmachung nach dem Umwandlungsgesetz\nBremen Amtsgericht Bremen HRB 23885\nWPD German Wind Management GmbH – Bremen",
      "type": "Registerbekanntmachung nach dem Umwandlungsgesetz",
      "state": "Bremen",
      "amtsgericht": "Amtsgericht Bremen",
      "registernummer": "HRB 23885",
      "registerart": "HRB",
      "company_name": "WPD German Wind Management GmbH",
      "company_seat": "Bremen",
      "details": "24.09.2025 (Bekanntmachungsdatum)\n\nBremen Amtsgericht Bremen HRB 23885\nRegisterbekanntmachung nach dem Umwandlungsgesetz 23.09.2025 (Eintragungsdatum)\n\nWPD German Wind Management GmbH\nGesellschaft mit beschränkter Haftung\nBremen\n\nZu Eintragungsnummer 27 vom 23.09.2025 wird als nicht eingetragen veröffentlicht: Den Gläubigern der an der Verschmelzung beteiligten Rechtsträger ist, wenn sie binnen sechs Monaten nach dem Tag, an dem die Eintragung der Verschmelzung in das Register des Sitzes desjenigen Rechtsträgers, dessen Gläubiger sie sind, als bekannt gemacht gilt, ihren Anspruch nach Grund und Höhe schriftlich anmelden, Sicherheit zu leisten, soweit sie nicht Befriedigung verlangen können. Dieses Recht steht den Gläubigern jedoch nur zu, wenn sie glaubhaft machen, dass durch die Verschmelzung die Erfüllung ihrer Forderung gefährdet wird. Das Recht, Sicherheitsleistung zu verlangen, steht Gläubigern nicht zu, die im Falle der Insolvenz ein Recht auf vorzugsweise Befriedigung aus einer Deckungsmasse haben, die nach gesetzlicher Vorschrift zu ihrem Schutz errichtet und staatlich überwacht ist."
    },
    {
      "date": "2025-09-24",
      "id": "131274",
      "original_text": "Einreichung neuer Dokumente\nBremen Amtsgericht Bremen HRB 26492\nLamotte AG – Bremen",
      "type": "Einreichung neuer Dokumente",
      "state": "Bremen",
      "amtsgericht": "Amtsgericht Bremen",
      "registernummer": "HRB 26492",
      "registerart": "HRB",
      "company_name": "Lamotte AG",
      "company_seat": "Bremen",
      "details": "24.09.2025 (Bekanntmachungsdatum)\n\nBremen Amtsgericht Bremen HRB 26492\nEinreichung neuer Dokumente\n\nLamotte AG\nAktiengesellschaft\nBremen\n\nAls nicht eingetragen wird veröffentlicht: Liste des Aufsichtsrats wurde eingereicht."
    },
    {
      "date": "2025-09-24",
      "id": "131275",
      "original_text": "Registerbekanntmachung nach dem Umwandlungsgesetz\nBremen Amtsgericht Bremen HRB 30913\nRobinsbalje 1 Projekt- und Entwicklungsgesellschaft mbH – Bremen",
      "type": "Registerbekanntmachung nach dem Umwandlungsgesetz",
      "state": "Bremen",
      "amtsgericht": "Amtsgericht Bremen",
      "registernummer": "HRB 30913",
      "registerart": "HRB",
      "company_name": "Robinsbalje 1 Projekt- und Entwicklungsgesellschaft mbH",
      "company_seat": "Bremen",
      "details": "24.09.2025 (Bekanntmachungsdatum)\n\nBremen Amtsgericht Bremen HRB 30913\nRegisterbekanntmachung nach dem Umwandlungsgesetz 23.09.2025 (Eintragungsdatum)\n\nRobinsbalje 1 Projekt- und Entwicklungsgesellschaft mbH\nGesellschaft mit beschränkter Haftung\nBremen\n\nZu Eintragungsnummer 5 vom 23.09.2025 wird als nicht eingetragen veröffentlicht: Den Gläubigern der an der Verschmelzung beteiligten Rechtsträger ist, wenn sie binnen sechs Monaten nach dem Tag, an dem die Eintragung der Verschmelzung in das Register des Sitzes desjenigen Rechtsträgers, dessen Gläubiger sie sind, als bekannt gemacht gilt, ihren Anspruch nach Grund und Höhe schriftlich anmelden, Sicherheit zu leisten, soweit sie nicht Befriedigung verlangen können. Dieses Recht steht den Gläubigern jedoch nur zu, wenn sie glaubhaft machen, dass durch die Verschmelzung die Erfüllung ihrer Forderung gefährdet wird. Das Recht, Sicherheitsleistung zu verlangen, steht Gläubigern nicht zu, die im Falle der Insolvenz ein Recht auf vorzugsweise Befriedigung aus einer Deckungsmasse haben, die nach gesetzlicher Vorschrift zu ihrem Schutz errichtet und staatlich überwacht ist."
    },
    {
      "date": "2025-09-24",
      "id": "131276",
      "original_text": "Registerbekanntmachung nach dem Umwandlungsgesetz\nRheinland-Pfalz Amtsgericht Landau HRA 31119\nF. Wünstel Sonnenschutztechnik e.K. – Landau in der Pfalz",
      "type": "Registerbekanntmachung nach dem Umwandlungsgesetz",
      "state": "Rheinland-Pfalz",
      "amtsgericht": "Amtsgericht Landau",
      "registernummer": "HRA 31119",
      "registerart": "HRA",
      "company_name": "F. Wünstel Sonnenschutztechnik e.K.",
      "company_seat": "Landau in der Pfalz",
      "details": "24.09.2025 (Bekanntmachungsdatum)\n\nRheinland-Pfalz Amtsgericht Landau HRA 31119\nRegisterbekanntmachung nach dem Umwandlungsgesetz 24.09.2025 (Eintragungsdatum)\n\nF. Wünstel Sonnenschutztechnik e.K.\nEinzelkaufmann / Einzelkauffrau\nLandau in der Pfalz\n\nAls nicht eingetragen wird veröffentlicht: Den Gläubigern der an der Ausgliederung beteiligten Rechtsträger ist, wenn sie binnen sechs Monaten nach dem Tag, an dem die Eintragung der Ausgliederung in das Register des Sitzes desjenigen Rechtsträgers, dessen Gläubiger sie sind, nach § 19 Abs. 3 UmwG als bekannt gemacht gilt, ihren Anspruch nach Grund und Höhe schriftlich anmelden, Sicherheit zu leisten, soweit sie nicht Befriedigung verlangen können. Dieses Recht steht den Gläubigern jedoch nur zu, wenn sie glaubhaft machen, dass durch die Ausgliederung die Erfüllung der Forderung gefährdet wird."
    },
    {
      "date": "2025-09-24",
      "id": "131277",
      "original_text": "Löschungsankündigung\nRheinland-Pfalz Amtsgericht Bad Kreuznach VR 554\nUnterstützungskasse für die Betriebsangehörigen der Firma Holzindustrie Hunsrück GmbH Mathias Tenhaeff in Ellern – Ellern",
      "type": "Löschungsankündigung",
      "state": "Rheinland-Pfalz",
      "amtsgericht": "Amtsgericht Bad Kreuznach",
      "registernummer": "VR 554",
      "registerart": "VR",
      "company_name": "Unterstützungskasse für die Betriebsangehörigen der Firma Holzindustrie Hunsrück GmbH Mathias Tenhaeff in Ellern",
      "company_seat": "Ellern",
      "details": "24.09.2025 (Bekanntmachungsdatum)\n\nRheinland-Pfalz Amtsgericht Bad Kreuznach VR 554\nLöschungsankündigung\n\nUnterstützungskasse für die Betriebsangehörigen der Firma Holzindustrie Hunsrück GmbH Mathias Tenhaeff in Ellern\neingetragener Verein\nEllern\n\nDas Gericht beabsichtigt, die Eintragung des Vereins im Vereinsregister wegen des Mangels einer wesentlichen Voraussetzung von Amts wegen nach § 395 FamFG als unzulässig zu löschen. Die Frist zur Geltendmachung eines Widerspruchs gegen die beabsichtigte Löschung ist auf einen Monat ab Veröffentlichung bestimmt."
    },
    {
      "date": "2025-09-24",
      "id": "131278",
      "original_text": "Löschungsankündigung\nRheinland-Pfalz Amtsgericht Landau HRB 32747\nCakir UG (haftungsbeschränkt) – Bellheim",
      "type": "Löschungsankündigung",
      "state": "Rheinland-Pfalz",
      "amtsgericht": "Amtsgericht Landau",
      "registernummer": "HRB 32747",
      "registerart": "HRB",
      "company_name": "Cakir UG (haftungsbeschränkt)",
      "company_seat": "Bellheim",
      "details": "24.09.2025 (Bekanntmachungsdatum)\n\nRheinland-Pfalz Amtsgericht Landau HRB 32747\nLöschungsankündigung\n\nCakir UG (haftungsbeschränkt)\nGesellschaft mit beschränkter Haftung\nBellheim\n\nDas Registergericht beabsichtigt die Gesellschaft von Amts wegen nach § 394 FamFG zu löschen. Die Frist zur Erhebung eines Widerspruchs ist auf einen Monat festgesetzt."
    },
    {
      "date": "2025-09-24",
      "id": "131279",
      "original_text": "Registerbekanntmachung nach dem Umwandlungsgesetz\nRheinland-Pfalz Amtsgericht Mainz HRA 44855\nLeineweber Consulting e.K. – Ingelheim am Rhein",
      "type": "Registerbekanntmachung nach dem Umwandlungsgesetz",
      "state": "Rheinland-Pfalz",
      "amtsgericht": "Amtsgericht Mainz",
      "registernummer": "HRA 44855",
      "registerart": "HRA",
      "company_name": "Leineweber Consulting e.K.",
      "company_seat": "Ingelheim am Rhein",
      "details": "24.09.2025 (Bekanntmachungsdatum)\n\nRheinland-Pfalz Amtsgericht Mainz HRA 44855\nRegisterbekanntmachung nach dem Umwandlungsgesetz 24.09.2025 (Eintragungsdatum)\n\nLeineweber Consulting e.K.\nEinzelkaufmann / Einzelkauffrau\nIngelheim am Rhein\n\nAls nicht eingetragen wird veröffentlicht: Den Gläubigern der an der Ausgliederung beteiligten Rechtsträger ist, wenn sie binnen sechs Monaten nac hdem Tag, an dem die Eintragung der Ausgliederung in das Register des Sitzes desjenigen Rechtsträgers, dessen Gläubiger sie sind, nach § 19 Abs. 3 UmwG als bekannt gemacht gilt, ihren Anspruch nach Grund und Höhe schriftlich anmelden, Sicherheit zu leisten, soweit sie nicht Befriedigung verlangen können. Dieses Recht steht den Gläubigern jedoch nur zu, wenn sie glaubhaft machen, dass durch die Ausgliederung die Erfüllung der Forderung gefährdet wird."
    },
    {
      "date": "2025-09-24",
      "id": "131280",
      "original_text": "Registerbekanntmachung nach dem Umwandlungsgesetz\nRheinland-Pfalz Amtsgericht Mainz HRB 53737\nLQC Consulting GmbH – Ingelheim am Rhein",
      "type": "Registerbekanntmachung nach dem Umwandlungsgesetz",
      "state": "Rheinland-Pfalz",
      "amtsgericht": "Amtsgericht Mainz",
      "registernummer": "HRB 53737",
      "registerart": "HRB",
      "company_name": "LQC Consulting GmbH",
      "company_seat": "Ingelheim am Rhein",
      "details": "24.09.2025 (Bekanntmachungsdatum)\n\nRheinland-Pfalz Amtsgericht Mainz HRB 53737\nRegisterbekanntmachung nach dem Umwandlungsgesetz 24.09.2025 (Eintragungsdatum)\n\nLQC Consulting GmbH\nGesellschaft mit beschränkter Haftung\nIngelheim am Rhein\n\nAls nicht eingetragen wird veröffentlicht: Den Gläubigern der an der Ausgliederung beteiligten Rechtsträger ist, wenn sie binnen sechs Monaten nac hdem Tag, an dem die Eintragung der Ausgliederung in das Register des Sitzes desjenigen Rechtsträgers, dessen Gläubiger sie sind, nach § 19 Abs. 3 UmwG als bekannt gemacht gilt, ihren Anspruch nach Grund und Höhe schriftlich anmelden, Sicherheit zu leisten, soweit sie nicht Befriedigung verlangen können. Dieses Recht steht den Gläubigern jedoch nur zu, wenn sie glaubhaft machen, dass durch die Ausgliederung die Erfüllung der Forderung gefährdet wird."
    },
    {
      "date": "2025-09-24",
      "id": "131281",
      "original_text": "Registerbekanntmachung nach dem Umwandlungsgesetz\nRheinland-Pfalz Amtsgericht Mainz HRA 44955\nSolveig Klein e.K. – Budenheim",
      "type": "Registerbekanntmachung nach dem Umwandlungsgesetz",
      "state": "Rheinland-Pfalz",
      "amtsgericht": "Amtsgericht Mainz",
      "registernummer": "HRA 44955",
      "registerart": "HRA",
      "company_name": "Solveig Klein e.K.",
      "company_seat": "Budenheim",
      "details": "24.09.2025 (Bekanntmachungsdatum)\n\nRheinland-Pfalz Amtsgericht Mainz HRA 44955\nRegisterbekanntmachung nach dem Umwandlungsgesetz 24.09.2025 (Eintragungsdatum)\n\nSolveig Klein e.K.\nEinzelkaufmann / Einzelkauffrau\nBudenheim\n\nAls nicht eingetragen wird veröffentlicht: Den Gläubigern der an der Verschmelzung beteiligten Rechtsträger ist, wenn sie binnen sechs Monaten nach dem Tag, an dem die Eintragung der Verschmelzung in das Register des Sitzes desjenigen Rechtsträgers, dessen Gläubiger sie sind, nach § 19 Abs. 3 UmwG als bekannt gemacht gilt, ihren Anspruch nach Grund und Höhe schriftlich anmelden, Sicherheit zu leisten, soweit sie nicht Befriedigung verlangen können. Dieses Recht steht den Gläubigern jedoch nur zu, wenn sie glaubhaft machen, dass durch die Verschmelzung die Erfüllung der Forderung gefährdet wird."
    },
    {
      "date": "2025-09-24",
      "id": "131282",
      "original_text": "Registerbekanntmachung nach dem Umwandlungsgesetz\nRheinland-Pfalz Amtsgericht Mainz HRB 50195\nWeinKlein Weinhandel GmbH – Budenheim",
      "type": "Registerbekanntmachung nach dem Umwandlungsgesetz",
      "state": "Rheinland-Pfalz",
      "amtsgericht": "Amtsgericht Mainz",
      "registernummer": "HRB 50195",
      "registerart": "HRB",
      "company_name": "WeinKlein Weinhandel GmbH",
      "company_seat": "Budenheim",
      "details": "24.09.2025 (Bekanntmachungsdatum)\n\nRheinland-Pfalz Amtsgericht Mainz HRB 50195\nRegisterbekanntmachung nach dem Umwandlungsgesetz 24.09.2025 (Eintragungsdatum)\n\nWeinKlein Weinhandel GmbH\nGesellschaft mit beschränkter Haftung\nBudenheim\n\nAls nicht eingetragen wird veröffentlicht: Den Gläubigern der an der Verschmelzung beteiligten Rechtsträger ist, wenn sie binnen sechs Monaten nach dem Tag, an dem die Eintragung der Verschmelzung in das Register des Sitzes desjenigen Rechtsträgers, dessen Gläubiger sie sind, nach § 19 Abs. 3 UmwG als bekannt gemacht gilt, ihren Anspruch nach Grund und Höhe schriftlich anmelden, Sicherheit zu leisten, soweit sie nicht Befriedigung verlangen können. Dieses Recht steht den Gläubigern jedoch nur zu, wenn sie glaubhaft machen, dass durch die Verschmelzung die Erfüllung der Forderung gefährdet wird."
    },
    {
      "date": "2025-09-24",
      "id": "131283",
      "original_text": "Registerbekanntmachung nach dem Umwandlungsgesetz\nRheinland-Pfalz Amtsgericht Montabaur HRA 23339\nArthur Verwaltung GmbH & Co. KG – Staudt",
      "type": "Registerbekanntmachung nach dem Umwandlungsgesetz",
      "state": "Rheinland-Pfalz",
      "amtsgericht": "Amtsgericht Montabaur",
      "registernummer": "HRA 23339",
      "registerart": "HRA",
      "company_name": "Arthur Verwaltung GmbH & Co. KG",
      "company_seat": "Staudt",
      "details": "24.09.2025 (Bekanntmachungsdatum)\n\nRheinland-Pfalz Amtsgericht Montabaur HRA 23339\nRegisterbekanntmachung nach dem Umwandlungsgesetz 24.09.2025 (Eintragungsdatum)\n\nArthur Verwaltung GmbH & Co. KG\nKommanditgesellschaft\nStaudt\n\nAls nicht eingetragen wird veröffentlicht: Den Gläubigern der an der Ausgliederung beteiligten Rechtsträger ist, wenn sie binnen sechs Monaten nach dem Tag, an dem die Eintragung der Ausgliederung in das Register des Sitzes desjenigen Rechtsträgers, dessen Gläubiger sie sind, nach § 19 Abs. 3 UmwG als bekannt gemacht gilt, ihren Anspruch nach Grund und Höhe schriftlich anmelden, Sicherheit zu leisten, soweit sie nicht Befriedigung verlangen können. Dieses Recht steht den Gläubigern jedoch nur zu, wenn sie glaubhaft machen, dass durch die Ausgliederung die Erfüllung der Forderung gefährdet wird."
    },
    {
      "date": "2025-09-24",
      "id": "131284",
      "original_text": "Löschungsankündigung\nRheinland-Pfalz Amtsgericht Montabaur HRB 28739\nDayzit GmbH – Wissen",
      "type": "Löschungsankündigung",
      "state": "Rheinland-Pfalz",
      "amtsgericht": "Amtsgericht Montabaur",
      "registernummer": "HRB 28739",
      "registerart": "HRB",
      "company_name": "Dayzit GmbH",
      "company_seat": "Wissen",
      "details": "24.09.2025 (Bekanntmachungsdatum)\n\nRheinland-Pfalz Amtsgericht Montabaur HRB 28739\nLöschungsankündigung\n\nDayzit GmbH\nGesellschaft mit beschränkter Haftung\nWissen\n\nDas Registergericht beabsichtigt die Gesellschaft von Amts wegen nach § 394 Abs. 1 FamFG zu löschen. Die Frist zur Erhebung eines Widerspruchs ist auf 1 Monat festgesetzt."
    },
    {
      "date": "2025-09-24",
      "id": "131285",
      "original_text": "Registerbekanntmachung nach dem Umwandlungsgesetz\nRheinland-Pfalz Amtsgericht Landau HRB 34373\nWünstel Sonnenschutztechnik GmbH – Landau in der Pfalz",
      "type": "Registerbekanntmachung nach dem Umwandlungsgesetz",
      "state": "Rheinland-Pfalz",
      "amtsgericht": "Amtsgericht Landau",
      "registernummer": "HRB 34373",
      "registerart": "HRB",
      "company_name": "Wünstel Sonnenschutztechnik GmbH",
      "company_seat": "Landau in der Pfalz",
      "details": "24.09.2025 (Bekanntmachungsdatum)\n\nRheinland-Pfalz Amtsgericht Landau HRB 34373\nRegisterbekanntmachung nach dem Umwandlungsgesetz 24.09.2025 (Eintragungsdatum)\n\nWünstel Sonnenschutztechnik GmbH\nGesellschaft mit beschränkter Haftung\nLandau in der Pfalz\n\nAls nicht eingetragen wird veröffentlicht: Den Gläubigern der an der Ausgliederung beteiligten Rechtsträger ist, wenn sie binnen sechs Monaten nach dem Tag, an dem die Eintragung der Ausgliederung in das Register des Sitzes desjenigen Rechtsträgers, dessen Gläubiger sie sind, nach § 19 Abs. 3 UmwG als bekannt gemacht gilt, ihren Anspruch nach Grund und Höhe schriftlich anmelden, Sicherheit zu leisten, soweit sie nicht Befriedigung verlangen können. Dieses Recht steht den Gläubigern jedoch nur zu, wenn sie glaubhaft machen, dass durch die Ausgliederung die Erfüllung der Forderung gefährdet wird."
    },
    {
      "date": "2025-09-24",
      "id": "131286",
      "original_text": "Registerbekanntmachung nach dem Umwandlungsgesetz\nRheinland-Pfalz Amtsgericht Koblenz HRB 30878\nAescudata Merger GmbH – Koblenz",
      "type": "Registerbekanntmachung nach dem Umwandlungsgesetz",
      "state": "Rheinland-Pfalz",
      "amtsgericht": "Amtsgericht Koblenz",
      "registernummer": "HRB 30878",
      "registerart": "HRB",
      "company_name": "Aescudata Merger GmbH",
      "company_seat": "Koblenz",
      "details": "24.09.2025 (Bekanntmachungsdatum)\n\nRheinland-Pfalz Amtsgericht Koblenz HRB 30878\nRegisterbekanntmachung nach dem Umwandlungsgesetz 24.09.2025 (Eintragungsdatum)\n\nAescudata Merger GmbH\nGesellschaft mit beschränkter Haftung\nKoblenz\n\nAls nicht eingetragen wird veröffentlicht: Den Gläubigern der an der Verschmelzung beteiligten Rechtsträger ist, wenn sie binnen sechs Monaten nach dem Tag, an dem die Eintragung der Verschmelzung in das Register des Sitzes desjenigen Rechtsträgers,dessen Gläubiger sie sind, nach § 19 Abs. 3 UmwG als bekannt gemacht gilt, ihren Anspruch nach Grund und Höhe schriftlich anmelden, Sicherheit zu leisten, soweit sie nicht Befriedigung verlangen können. Dieses Recht steht den Gläubigern jedoch nur zu, wenn sie glaubhaft machen, dass durch die Verschmelzung die Erfüllungd er Forderung gefährdet wird."
    },
    {
      "date": "2025-09-24",
      "id": "131287",
      "original_text": "Registerbekanntmachung nach dem Umwandlungsgesetz\nRheinland-Pfalz Amtsgericht Montabaur HRA 4012\nARTHUR Verwaltung e.K. Inh. Ertugrul Akgün – Staudt",
      "type": "Registerbekanntmachung nach dem Umwandlungsgesetz",
      "state": "Rheinland-Pfalz",
      "amtsgericht": "Amtsgericht Montabaur",
      "registernummer": "HRA 4012",
      "registerart": "HRA",
      "company_name": "ARTHUR Verwaltung e.K. Inh. Ertugrul Akgün",
      "company_seat": "Staudt",
      "details": "24.09.2025 (Bekanntmachungsdatum)\n\nRheinland-Pfalz Amtsgericht Montabaur HRA 4012\nRegisterbekanntmachung nach dem Umwandlungsgesetz 24.09.2025 (Eintragungsdatum)\n\nARTHUR Verwaltung e.K. Inh. Ertugrul Akgün\nEinzelkaufmann / Einzelkauffrau\nStaudt\n\nAls nicht eingetragen wird veröffentlicht: Den Gläubigern der an der Ausgliederung beteiligten Rechtsträger ist, wenn sie binnen sechs Monaten nach dem Tag, an dem die Eintragung der Ausgliederung in das Register des Sitzes desjenigen Rechtsträgers, dessen Gläubiger sie sind, nach § 19 Abs. 3 UmwG als bekannt gemacht gilt, ihren Anspruch nach Grund und Höhe schriftlich anmelden, Sicherheit zu leisten, soweit sie nicht Befriedigung verlangen können. Dieses Recht steht den Gläubigern jedoch nur zu, wenn sie glaubhaft machen, dass durch die Ausgliederung die Erfüllung der Forderung gefährdet wird."
    },
    {
      "date": "2025-09-24",
      "id": "131288",
      "original_text": "Registerbekanntmachung nach dem Umwandlungsgesetz\nNordrhein-Westfalen Amtsgericht Dortmund HRB 37612\nEisBerger GmbH – Werne",
      "type": "Registerbekanntmachung nach dem Umwandlungsgesetz",
      "state": "Nordrhein-Westfalen",
      "amtsgericht": "Amtsgericht Dortmund",
      "registernummer": "HRB 37612",
      "registerart": "HRB",
      "company_name": "EisBerger GmbH",
      "company_seat": "Werne",
      "details": "24.09.2025 (Bekanntmachungsdatum)\n\nNordrhein-Westfalen Amtsgericht Dortmund HRB 37612\nRegisterbekanntmachung nach dem Umwandlungsgesetz 24.09.2025 (Eintragungsdatum)\n\nEisBerger GmbH\nGesellschaft mit beschränkter Haftung\nWerne\n\nDen Gläubigern der an der formwechselnden Umwandlung beteiligten Rechtsträger ist, wenn sie binnen sechs Monaten nach dem Tag, an dem die Eintragung der formwechselnden Umwandlung in das Register des Sitzes derjenigen Rechtsträger deren Gläubiger sie sind, nach § 19 Absatz 3 UmwG als bekanntgemacht gilt, ihren Anspruch nach Grund und Höhe schriftlich anmelden, Sicherheit zu leisten, soweit sie nicht Befriedigung verlangen können. Dieses Recht steht den Gläubigern jedoch nur zu, wenn sie glaubhaft machen, dass durch die formwechselnden Umwandlung die Erfüllung ihrer Forderung gefährdet wird."
    },
    {
      "date": "2025-09-24",
      "id": "131289",
      "original_text": "Registerbekanntmachung nach dem Umwandlungsgesetz\nNordrhein-Westfalen Amtsgericht Köln HRB 60095\nProperty Ventures GmbH – Köln",
      "type": "Registerbekanntmachung nach dem Umwandlungsgesetz",
      "state": "Nordrhein-Westfalen",
      "amtsgericht": "Amtsgericht Köln",
      "registernummer": "HRB 60095",
      "registerart": "HRB",
      "company_name": "Property Ventures GmbH",
      "company_seat": "Köln",
      "details": "24.09.2025 (Bekanntmachungsdatum)\n\nNordrhein-Westfalen Amtsgericht Köln HRB 60095\nRegisterbekanntmachung nach dem Umwandlungsgesetz 24.09.2025 (Eintragungsdatum)\n\nProperty Ventures GmbH\nGesellschaft mit beschränkter Haftung\nKöln\n\nDen Gläubigern der an der Verschmelzung beteiligten Rechtsträger ist, wenn sie binnen sechs Monaten nach dem Tag, an dem die Eintragung der Verschmelzung in das Register des Sitzes desjenigen Rechtsträgers, dessen Gläubiger sie sind, nach § 19 Absatz 3 UmwG als bekanntgemacht gilt, ihren Anspruch nach Grund und Höhe schriftlich anmelden, Sicherheit zu leisten, soweit sie nicht Befriedigung verlangen können. Dieses Recht steht den Gläubigern jedoch nur zu, wenn sie glaubhaft machen, dass durch die Verschmelzung die Erfüllung ihrer Forderung gefährdet wird."
    },
    {
      "date": "2025-09-24",
      "id": "131290",
      "original_text": "Registerbekanntmachung nach dem Umwandlungsgesetz\nNordrhein-Westfalen Amtsgericht Köln GsR 2201\nHandorf/Wündrich eGbR – Köln",
      "type": "Registerbekanntmachung nach dem Umwandlungsgesetz",
      "state": "Nordrhein-Westfalen",
      "amtsgericht": "Amtsgericht Köln",
      "registernummer": "GsR 2201",
      "registerart": "GsR",
      "company_name": "Handorf/Wündrich eGbR",
      "company_seat": "Köln",
      "details": "24.09.2025 (Bekanntmachungsdatum)\n\nNordrhein-Westfalen Amtsgericht Köln GsR 2201\nRegisterbekanntmachung nach dem Umwandlungsgesetz 24.09.2025 (Eintragungsdatum)\n\nHandorf/Wündrich eGbR\nGesellschaft bürgerlichen Rechts\nKöln\n\nDen Gläubigern der an der formwechselnden Umwandlung beteiligten Rechtsträger ist, wenn sie binnen sechs Monaten nach dem Tag, an dem die Eintragung der formwechselnden Umwandlung in das Register des Sitzes desjenigen Rechtsträgers, dessen Gläubiger sie sind, nach § 19 Absatz 3 UmwG als bekanntgemacht gilt, ihren Anspruch nach Grund und Höhe schriftlich anmelden, Sicherheit zu leisten, soweit sie nicht Befriedigung verlangen können. Dieses Recht steht den Gläubigern jedoch nur zu, wenn sie glaubhaft machen, dass durch die formwechselnden Umwandlung die Erfüllung ihrer Forderung gefährdet wird."
    },
    {
      "date": "2025-09-24",
      "id": "131291",
      "original_text": "Registerbekanntmachung nach dem Umwandlungsgesetz\nNordrhein-Westfalen Amtsgericht Dortmund HRB 22922\nBechtle GmbH – Dortmund",
      "type": "Registerbekanntmachung nach dem Umwandlungsgesetz",
      "state": "Nordrhein-Westfalen",
      "amtsgericht": "Amtsgericht Dortmund",
      "registernummer": "HRB 22922",
      "registerart": "HRB",
      "company_name": "Bechtle GmbH",
      "company_seat": "Dortmund",
      "details": "24.09.2025 (Bekanntmachungsdatum)\n\nNordrhein-Westfalen Amtsgericht Dortmund HRB 22922\nRegisterbekanntmachung nach dem Umwandlungsgesetz 24.09.2025 (Eintragungsdatum)\n\nBechtle GmbH\nGesellschaft mit beschränkter Haftung\nDortmund\n\nDen Gläubigern der an der Verschmelzung beteiligten Rechtsträger ist, wenn sie binnen sechs Monaten nach dem Tag, an dem die Eintragung der Verschmelzung in das Register des Sitzes desjenigen Rechtsträgers, dessen Gläubiger sie sind, nach § 19 Absatz 3 UmwG als bekanntgemacht gilt, ihren Anspruch nach Grund und Höhe schriftlich anmelden, Sicherheit zu leisten, soweit sie nicht Befriedigung verlangen können. Dieses Recht steht den Gläubigern jedoch nur zu, wenn sie glaubhaft machen, dass durch die Verschmelzung die Erfüllung ihrer Forderung gefährdet wird."
    },
    {
      "date": "2025-09-24",
      "id": "131292",
      "original_text": "Registerbekanntmachung nach dem Umwandlungsgesetz\nNordrhein-Westfalen Amtsgericht Dortmund HRA 19940\nbitop D2C Beteiligungen GmbH & Co. KG – Dortmund",
      "type": "Registerbekanntmachung nach dem Umwandlungsgesetz",
      "state": "Nordrhein-Westfalen",
      "amtsgericht": "Amtsgericht Dortmund",
      "registernummer": "HRA 19940",
      "registerart": "HRA",
      "company_name": "bitop D2C Beteiligungen GmbH & Co. KG",
      "company_seat": "Dortmund",
      "details": "24.09.2025 (Bekanntmachungsdatum)\n\nNordrhein-Westfalen Amtsgericht Dortmund HRA 19940\nRegisterbekanntmachung nach dem Umwandlungsgesetz 24.09.2025 (Eintragungsdatum)\n\nbitop D2C Beteiligungen GmbH & Co. KG\nKommanditgesellschaft\nDortmund\n\nDen Gläubigern der an der Ausgliederung beteiligten Rechtsträger ist, wenn sie binnen sechs Monaten nach dem Tag, an dem die Eintragung der Ausgliederung in das Register des Sitzes desjenigen Rechtsträgers, dessen Gläubiger sie sind, nach § 19 Absatz 3 UmwG als bekanntgemacht gilt, ihren Anspruch nach Grund und Höhe schriftlich anmelden, Sicherheit zu leisten, soweit sie nicht Befriedigung verlangen können. Dieses Recht steht den Gläubigern jedoch nur zu, wenn sie glaubhaft machen, dass durch die Ausgliederung die Erfüllung ihrer Forderung gefährdet wird."
    },
    {
      "date": "2025-09-24",
      "id": "131293",
      "original_text": "Registerbekanntmachung nach dem Umwandlungsgesetz\nNordrhein-Westfalen Amtsgericht Siegen HRB 11147\nViega New Business Holding GmbH – Attendorn",
      "type": "Registerbekanntmachung nach dem Umwandlungsgesetz",
      "state": "Nordrhein-Westfalen",
      "amtsgericht": "Amtsgericht Siegen",
      "registernummer": "HRB 11147",
      "registerart": "HRB",
      "company_name": "Viega New Business Holding GmbH",
      "company_seat": "Attendorn",
      "details": "24.09.2025 (Bekanntmachungsdatum)\n\nNordrhein-Westfalen Amtsgericht Siegen HRB 11147\nRegisterbekanntmachung nach dem Umwandlungsgesetz 24.09.2025 (Eintragungsdatum)\n\nViega New Business Holding GmbH\nGesellschaft mit beschränkter Haftung\nAttendorn\n\nDen Gläubigern der an der Verschmelzung beteiligten Rechtsträger ist, wenn sie binnen sechs Monaten nach dem Tag, an dem die Eintragung der Verschmelzung in das Register des Sitzes derjenigen Rechtsträger deren Gläubiger sie sind, nach § 19 Absatz 3 UmwG als bekanntgemacht gilt, ihren Anspruch nach Grund und Höhe schriftlich anmelden, Sicherheit zu leisten, soweit sie nicht Befriedigung verlangen können. Dieses Recht steht den Gläubigern jedoch nur zu, wenn sie glaubhaft machen, dass durch die Verschmelzung die Erfüllung ihrer Forderung gefährdet wird."
    },
    {
      "date": "2025-09-24",
      "id": "131294",
      "original_text": "Registerbekanntmachung nach dem Umwandlungsgesetz\nNordrhein-Westfalen Amtsgericht Essen HRA 11865\nAndreas Wronna e. K. – Essen",
      "type": "Registerbekanntmachung nach dem Umwandlungsgesetz",
      "state": "Nordrhein-Westfalen",
      "amtsgericht": "Amtsgericht Essen",
      "registernummer": "HRA 11865",
      "registerart": "HRA",
      "company_name": "Andreas Wronna e. K.",
      "company_seat": "Essen",
      "details": "24.09.2025 (Bekanntmachungsdatum)\n\nNordrhein-Westfalen Amtsgericht Essen HRA 11865\nRegisterbekanntmachung nach dem Umwandlungsgesetz 19.09.2025 (Eintragungsdatum)\n\nAndreas Wronna e. K.\nEinzelkaufmann / Einzelkauffrau\nEssen\n\nDen Gläubigern der an der Ausgliederung beteiligten Rechtsträger ist, wenn sie binnen sechs Monaten nach dem Tag, an dem die Eintragung der Ausgliederung in das Register des Sitzes desjenigen Rechtsträgers, dessen Gläubiger sie sind, nach § 19 Absatz 3 UmwG als bekanntgemacht gilt, ihren Anspruch nach Grund und Höhe schriftlich anmelden, Sicherheit zu leisten, soweit sie nicht Befriedigung verlangen können. Dieses Recht steht den Gläubigern jedoch nur zu, wenn sie glaubhaft machen, dass durch die Ausgliederung die Erfüllung ihrer Forderung gefährdet wird."
    },
    {
      "date": "2025-09-24",
      "id": "131295",
      "original_text": "Löschungsankündigung\nNordrhein-Westfalen Amtsgericht Essen HRB 35541\nOneservice Connection 24 GmbH – Essen",
      "type": "Löschungsankündigung",
      "state": "Nordrhein-Westfalen",
      "amtsgericht": "Amtsgericht Essen",
      "registernummer": "HRB 35541",
      "registerart": "HRB",
      "company_name": "Oneservice Connection 24 GmbH",
      "company_seat": "Essen",
      "details": "24.09.2025 (Bekanntmachungsdatum)\n\nNordrhein-Westfalen Amtsgericht Essen HRB 35541\nLöschungsankündigung\n\nOneservice Connection 24 GmbH\nGesellschaft mit beschränkter Haftung\nEssen\n\nDas Registergericht beabsichtigt die Gesellschaft von Amts wegen nach § 394 FamFG zu löschen. Die Frist zur Erhebung eines Widerspruchs ist auf einen Monat festgesetzt."
    },
    {
      "date": "2025-09-24",
      "id": "131296",
      "original_text": "Registerbekanntmachung nach dem Umwandlungsgesetz\nNordrhein-Westfalen Amtsgericht Düsseldorf HRA 28388\nColumbus Vermögensverwaltungs-GmbH & Co. KG – Düsseldorf",
      "type": "Registerbekanntmachung nach dem Umwandlungsgesetz",
      "state": "Nordrhein-Westfalen",
      "amtsgericht": "Amtsgericht Düsseldorf",
      "registernummer": "HRA 28388",
      "registerart": "HRA",
      "company_name": "Columbus Vermögensverwaltungs-GmbH & Co. KG",
      "company_seat": "Düsseldorf",
      "details": "24.09.2025 (Bekanntmachungsdatum)\n\nNordrhein-Westfalen Amtsgericht Düsseldorf HRA 28388\nRegisterbekanntmachung nach dem Umwandlungsgesetz 24.09.2025 (Eintragungsdatum)\n\nColumbus Vermögensverwaltungs-GmbH & Co. KG\nKommanditgesellschaft\nDüsseldorf\n\nDen Gläubigern der an der formwechselnden Umwandlung beteiligten Rechtsträger ist, wenn sie binnen sechs Monaten nach dem Tag, an dem die Eintragung der formwechselnden Umwandlung in das Register des Sitzes desjenigen Rechtsträgers, dessen Gläubiger sie sind, nach § 19 Absatz 3 UmwG als bekanntgemacht gilt, ihren Anspruch nach Grund und Höhe schriftlich anmelden, Sicherheit zu leisten, soweit sie nicht Befriedigung verlangen können. Dieses Recht steht den Gläubigern jedoch nur zu, wenn sie glaubhaft machen, dass durch die formwechselnden Umwandlung die Erfüllung ihrer Forderung gefährdet wird."
    },
    {
      "date": "2025-09-24",
      "id": "131297",
      "original_text": "Registerbekanntmachung nach dem Umwandlungsgesetz\nNordrhein-Westfalen Amtsgericht Duisburg HRB 6411\nKemna GmbH – Duisburg",
      "type": "Registerbekanntmachung nach dem Umwandlungsgesetz",
      "state": "Nordrhein-Westfalen",
      "amtsgericht": "Amtsgericht Duisburg",
      "registernummer": "HRB 6411",
      "registerart": "HRB",
      "company_name": "Kemna GmbH",
      "company_seat": "Duisburg",
      "details": "24.09.2025 (Bekanntmachungsdatum)\n\nNordrhein-Westfalen Amtsgericht Duisburg HRB 6411\nRegisterbekanntmachung nach dem Umwandlungsgesetz 24.09.2025 (Eintragungsdatum)\n\nKemna GmbH\nGesellschaft mit beschränkter Haftung\nDuisburg\n\nDie Gesellschaft hat Gläubigern, deren Forderungen vor dieser Bekanntmachung begründet worden sind, Sicherheit zu leisten, soweit sie nicht Befriedigung verlangen können, wenn sie sich binnen sechs Monaten zu diesem Zweck melden."
    },
    {
      "date": "2025-09-24",
      "id": "131298",
      "original_text": "Einreichung neuer Dokumente\nNordrhein-Westfalen Amtsgericht Düsseldorf HRB 35725\nDGB Rechtsschutz GmbH – Düsseldorf",
      "type": "Einreichung neuer Dokumente",
      "state": "Nordrhein-Westfalen",
      "amtsgericht": "Amtsgericht Düsseldorf",
      "registernummer": "HRB 35725",
      "registerart": "HRB",
      "company_name": "DGB Rechtsschutz GmbH",
      "company_seat": "Düsseldorf",
      "details": "24.09.2025 (Bekanntmachungsdatum)\n\nNordrhein-Westfalen Amtsgericht Düsseldorf HRB 35725\nEinreichung neuer Dokumente\n\nDGB Rechtsschutz GmbH\nGesellschaft mit beschränkter Haftung\nDüsseldorf\n\nDem Registergericht ist eine Liste der Mitglieder des Aufsichtsrates eingereicht worden."
    },
    {
      "date": "2025-09-24",
      "id": "131299",
      "original_text": "Registerbekanntmachung nach dem Umwandlungsgesetz\nNordrhein-Westfalen Amtsgericht Köln HRB 124854\nEchoEcho GmbH – Köln",
      "type": "Registerbekanntmachung nach dem Umwandlungsgesetz",
      "state": "Nordrhein-Westfalen",
      "amtsgericht": "Amtsgericht Köln",
      "registernummer": "HRB 124854",
      "registerart": "HRB",
      "company_name": "EchoEcho GmbH",
      "company_seat": "Köln",
      "details": "24.09.2025 (Bekanntmachungsdatum)\n\nNordrhein-Westfalen Amtsgericht Köln HRB 124854\nRegisterbekanntmachung nach dem Umwandlungsgesetz 24.09.2025 (Eintragungsdatum)\n\nEchoEcho GmbH\nGesellschaft mit beschränkter Haftung\nKöln\n\nDen Gläubigern der an der formwechselnden Umwandlung beteiligten Rechtsträger ist, wenn sie binnen sechs Monaten nach dem Tag, an dem die Eintragung der formwechselnden Umwandlung in das Register des Sitzes desjenigen Rechtsträgers, dessen Gläubiger sie sind, nach § 19 Absatz 3 UmwG als bekanntgemacht gilt, ihren Anspruch nach Grund und Höhe schriftlich anmelden, Sicherheit zu leisten, soweit sie nicht Befriedigung verlangen können. Dieses Recht steht den Gläubigern jedoch nur zu, wenn sie glaubhaft machen, dass durch die formwechselnden Umwandlung die Erfüllung ihrer Forderung gefährdet wird."
    },
    {
      "date": "2025-09-24",
      "id": "131300",
      "original_text": "Registerbekanntmachung nach dem Umwandlungsgesetz\nNordrhein-Westfalen Amtsgericht Gelsenkirchen HRB 19161\nNJ Gymnastics Sports GmbH – Bottrop",
      "type": "Registerbekanntmachung nach dem Umwandlungsgesetz",
      "state": "Nordrhein-Westfalen",
      "amtsgericht": "Amtsgericht Gelsenkirchen",
      "registernummer": "HRB 19161",
      "registerart": "HRB",
      "company_name": "NJ Gymnastics Sports GmbH",
      "company_seat": "Bottrop",
      "details": "24.09.2025 (Bekanntmachungsdatum)\n\nNordrhein-Westfalen Amtsgericht Gelsenkirchen HRB 19161\nRegisterbekanntmachung nach dem Umwandlungsgesetz 24.09.2025 (Eintragungsdatum)\n\nNJ Gymnastics Sports GmbH\nGesellschaft mit beschränkter Haftung\nBottrop\n\nDen Gläubigern der an der Verschmelzung beteiligten Rechtsträger ist, wenn sie binnen sechs Monaten nach dem Tag, an dem die Eintragung der Verschmelzung in das Register des Sitzes desjenigen Rechtsträgers, dessen Gläubiger sie sind, nach § 19 Absatz 3 UmwG als bekanntgemacht gilt, ihren Anspruch nach Grund und Höhe schriftlich anmelden, Sicherheit zu leisten, soweit sie nicht Befriedigung verlangen können. Dieses Recht steht den Gläubigern jedoch nur zu, wenn sie glaubhaft machen, dass durch die Verschmelzung die Erfüllung ihrer Forderung gefährdet wird."
    },
    {
      "date": "2025-09-24",
      "id": "131301",
      "original_text": "Registerbekanntmachung nach dem Umwandlungsgesetz\nNordrhein-Westfalen Amtsgericht Wuppertal HRA 7296\nSTAHLWILLE Eduard Wille GmbH & Co. KG – Wuppertal",
      "type": "Registerbekanntmachung nach dem Umwandlungsgesetz",
      "state": "Nordrhein-Westfalen",
      "amtsgericht": "Amtsgericht Wuppertal",
      "registernummer": "HRA 7296",
      "registerart": "HRA",
      "company_name": "STAHLWILLE Eduard Wille GmbH & Co. KG",
      "company_seat": "Wuppertal",
      "details": "24.09.2025 (Bekanntmachungsdatum)\n\nNordrhein-Westfalen Amtsgericht Wuppertal HRA 7296\nRegisterbekanntmachung nach dem Umwandlungsgesetz 24.09.2025 (Eintragungsdatum)\n\nSTAHLWILLE Eduard Wille GmbH & Co. KG\nKommanditgesellschaft\nWuppertal\n\nDen Gläubigern der an der formwechselnden Umwandlung beteiligten Rechtsträger ist, wenn sie binnen sechs Monaten nach dem Tag, an dem die Eintragung der formwechselnden Umwandlung in das Register des Sitzes derjenigen Rechtsträger deren Gläubiger sie sind, nach § 19 Absatz 3 UmwG als bekanntgemacht gilt, ihren Anspruch nach Grund und Höhe schriftlich anmelden, Sicherheit zu leisten, soweit sie nicht Befriedigung verlangen können. Dieses Recht steht den Gläubigern jedoch nur zu, wenn sie glaubhaft machen, dass durch die formwechselnden Umwandlung die Erfüllung ihrer Forderung gefährdet wird."
    },
    {
      "date": "2025-09-24",
      "id": "131302",
      "original_text": "Registerbekanntmachung nach dem Umwandlungsgesetz\nNordrhein-Westfalen Amtsgericht Düren HRA 3846\nWinfried Hahn e.K., Inhaber Fabian Schmidt, Heizung-Sanitär-Klima-Solar – Düren",
      "type": "Registerbekanntmachung nach dem Umwandlungsgesetz",
      "state": "Nordrhein-Westfalen",
      "amtsgericht": "Amtsgericht Düren",
      "registernummer": "HRA 3846",
      "registerart": "HRA",
      "company_name": "Winfried Hahn e.K., Inhaber Fabian Schmidt, Heizung-Sanitär-Klima-Solar",
      "company_seat": "Düren",
      "details": "24.09.2025 (Bekanntmachungsdatum)\n\nNordrhein-Westfalen Amtsgericht Düren HRA 3846\nRegisterbekanntmachung nach dem Umwandlungsgesetz 24.09.2025 (Eintragungsdatum)\n\nWinfried Hahn e.K., Inhaber Fabian Schmidt, Heizung-Sanitär-Klima-Solar\nEinzelkaufmann / Einzelkauffrau\nDüren\n\nDen Gläubigern der an der Ausgliederung beteiligten Rechtsträger ist, wenn sie binnen sechs Monaten nach dem Tag, an dem die Eintragung der Ausgliederung in das Register des Sitzes desjenigen Rechtsträgers, dessen Gläubiger sie sind, nach § 19 Absatz 3 UmwG als bekanntgemacht gilt, ihren Anspruch nach Grund und Höhe schriftlich anmelden, Sicherheit zu leisten, soweit sie nicht Befriedigung verlangen können. Dieses Recht steht den Gläubigern jedoch nur zu, wenn sie glaubhaft machen, dass durch die Ausgliederung die Erfüllung ihrer Forderung gefährdet wird."
    },
    {
      "date": "2025-09-24",
      "id": "131303",
      "original_text": "Registerbekanntmachung nach dem Umwandlungsgesetz\nNordrhein-Westfalen Amtsgericht Bonn HRB 2584\nkälte cöllen gmbh – Bonn",
      "type": "Registerbekanntmachung nach dem Umwandlungsgesetz",
      "state": "Nordrhein-Westfalen",
      "amtsgericht": "Amtsgericht Bonn",
      "registernummer": "HRB 2584",
      "registerart": "HRB",
      "company_name": "kälte cöllen gmbh",
      "company_seat": "Bonn",
      "details": "24.09.2025 (Bekanntmachungsdatum)\n\nNordrhein-Westfalen Amtsgericht Bonn HRB 2584\nRegisterbekanntmachung nach dem Umwandlungsgesetz 24.09.2025 (Eintragungsdatum)\n\nkälte cöllen gmbh\nGesellschaft mit beschränkter Haftung\nBonn\n\nDen Gläubigern der an der Verschmelzung beteiligten Rechtsträger ist, wenn sie binnen sechs Monaten nach dem Tag, an dem die Eintragung der Verschmelzung in das Register des Sitzes desjenigen Rechtsträgers, dessen Gläubiger sie sind, nach § 19 Absatz 3 UmwG als bekanntgemacht gilt, ihren Anspruch nach Grund und Höhe schriftlich anmelden, Sicherheit zu leisten, soweit sie nicht Befriedigung verlangen können. Dieses Recht steht den Gläubigern jedoch nur zu, wenn sie glaubhaft machen, dass durch die Verschmelzung die Erfüllung ihrer Forderung gefährdet wird."
    },
    {
      "date": "2025-09-24",
      "id": "131304",
      "original_text": "Registerbekanntmachung nach dem Umwandlungsgesetz\nNordrhein-Westfalen Amtsgericht Münster HRA 12186\nGMG 15 GmbH & Co. KG – Oelde",
      "type": "Registerbekanntmachung nach dem Umwandlungsgesetz",
      "state": "Nordrhein-Westfalen",
      "amtsgericht": "Amtsgericht Münster",
      "registernummer": "HRA 12186",
      "registerart": "HRA",
      "company_name": "GMG 15 GmbH & Co. KG",
      "company_seat": "Oelde",
      "details": "24.09.2025 (Bekanntmachungsdatum)\n\nNordrhein-Westfalen Amtsgericht Münster HRA 12186\nRegisterbekanntmachung nach dem Umwandlungsgesetz 24.09.2025 (Eintragungsdatum)\n\nGMG 15 GmbH & Co. KG\nKommanditgesellschaft\nOelde\n\nDen Gläubigern der an der formwechselnden Umwandlung beteiligten Rechtsträger ist, wenn sie binnen sechs Monaten nach dem Tag, an dem die Eintragung der formwechselnden Umwandlung in das Register des Sitzes desjenigen Rechtsträgers, dessen Gläubiger sie sind, nach § 19 Absatz 3 UmwG als bekanntgemacht gilt, ihren Anspruch nach Grund und Höhe schriftlich anmelden, Sicherheit zu leisten, soweit sie nicht Befriedigung verlangen können. Dieses Recht steht den Gläubigern jedoch nur zu, wenn sie glaubhaft machen, dass durch die formwechselnden Umwandlung die Erfüllung ihrer Forderung gefährdet wird."
    },
    {
      "date": "2025-09-24",
      "id": "131305",
      "original_text": "Registerbekanntmachung nach dem Umwandlungsgesetz\nNordrhein-Westfalen Amtsgericht Bonn HRB 20269\nJaros Holding GmbH – Meckenheim",
      "type": "Registerbekanntmachung nach dem Umwandlungsgesetz",
      "state": "Nordrhein-Westfalen",
      "amtsgericht": "Amtsgericht Bonn",
      "registernummer": "HRB 20269",
      "registerart": "HRB",
      "company_name": "Jaros Holding GmbH",
      "company_seat": "Meckenheim",
      "details": "24.09.2025 (Bekanntmachungsdatum)\n\nNordrhein-Westfalen Amtsgericht Bonn HRB 20269\nRegisterbekanntmachung nach dem Umwandlungsgesetz 24.09.2025 (Eintragungsdatum)\n\nJaros Holding GmbH\nGesellschaft mit beschränkter Haftung\nMeckenheim\n\nDen Gläubigern der an der Ausgliederung beteiligten Rechtsträger ist, wenn sie binnen sechs Monaten nach dem Tag, an dem die Eintragung der Ausgliederung in das Register des Sitzes desjenigen Rechtsträgers, dessen Gläubiger sie sind, nach § 19 Absatz 3 UmwG als bekanntgemacht gilt, ihren Anspruch nach Grund und Höhe schriftlich anmelden, Sicherheit zu leisten, soweit sie nicht Befriedigung verlangen können. Dieses Recht steht den Gläubigern jedoch nur zu, wenn sie glaubhaft machen, dass durch die Ausgliederung die Erfüllung ihrer Forderung gefährdet wird."
    },
    {
      "date": "2025-09-24",
      "id": "131306",
      "original_text": "Registerbekanntmachung nach dem Umwandlungsgesetz\nNordrhein-Westfalen Amtsgericht Köln HRA 38279\nBeratung & pädagogische Professionalisierung, Dirk Rohr e.K. – Köln",
      "type": "Registerbekanntmachung nach dem Umwandlungsgesetz",
      "state": "Nordrhein-Westfalen",
      "amtsgericht": "Amtsgericht Köln",
      "registernummer": "HRA 38279",
      "registerart": "HRA",
      "company_name": "Beratung & pädagogische Professionalisierung, Dirk Rohr e.K.",
      "company_seat": "Köln",
      "details": "24.09.2025 (Bekanntmachungsdatum)\n\nNordrhein-Westfalen Amtsgericht Köln HRA 38279\nRegisterbekanntmachung nach dem Umwandlungsgesetz 24.09.2025 (Eintragungsdatum)\n\nBeratung & pädagogische Professionalisierung, Dirk Rohr e.K.\nEinzelkaufmann / Einzelkauffrau\nKöln\n\nDen Gläubigern der an der Ausgliederung beteiligten Rechtsträger ist, wenn sie binnen sechs Monaten nach dem Tag, an dem die Eintragung der Ausgliederung in das Register des Sitzes desjenigen Rechtsträgers, dessen Gläubiger sie sind, nach § 19 Absatz 3 UmwG als bekanntgemacht gilt, ihren Anspruch nach Grund und Höhe schriftlich anmelden, Sicherheit zu leisten, soweit sie nicht Befriedigung verlangen können. Dieses Recht steht den Gläubigern jedoch nur zu, wenn sie glaubhaft machen, dass durch die Ausgliederung die Erfüllung ihrer Forderung gefährdet wird."
    },
    {
      "date": "2025-09-24",
      "id": "131307",
      "original_text": "Registerbekanntmachung nach dem Umwandlungsgesetz\nNordrhein-Westfalen Amtsgericht Dortmund HRB 22922\nBechtle GmbH – Dortmund",
      "type": "Registerbekanntmachung nach dem Umwandlungsgesetz",
      "state": "Nordrhein-Westfalen",
      "amtsgericht": "Amtsgericht Dortmund",
      "registernummer": "HRB 22922",
      "registerart": "HRB",
      "company_name": "Bechtle GmbH",
      "company_seat": "Dortmund",
      "details": "24.09.2025 (Bekanntmachungsdatum)\n\nNordrhein-Westfalen Amtsgericht Dortmund HRB 22922\nRegisterbekanntmachung nach dem Umwandlungsgesetz 24.09.2025 (Eintragungsdatum)\n\nBechtle GmbH\nGesellschaft mit beschränkter Haftung\nDortmund\n\nDen Gläubigern der an der Verschmelzung beteiligten Rechtsträger ist, wenn sie binnen sechs Monaten nach dem Tag, an dem die Eintragung der Verschmelzung in das Register des Sitzes desjenigen Rechtsträgers, dessen Gläubiger sie sind, nach § 19 Absatz 3 UmwG als bekanntgemacht gilt, ihren Anspruch nach Grund und Höhe schriftlich anmelden, Sicherheit zu leisten, soweit sie nicht Befriedigung verlangen können. Dieses Recht steht den Gläubigern jedoch nur zu, wenn sie glaubhaft machen, dass durch die Verschmelzung die Erfüllung ihrer Forderung gefährdet wird."
    },
    {
      "date": "2025-09-24",
      "id": "131308",
      "original_text": "Einreichung neuer Dokumente\nNordrhein-Westfalen Amtsgericht Paderborn HRB 3507\nWINCOR NIXDORF International GmbH – Paderborn",
      "type": "Einreichung neuer Dokumente",
      "state": "Nordrhein-Westfalen",
      "amtsgericht": "Amtsgericht Paderborn",
      "registernummer": "HRB 3507",
      "registerart": "HRB",
      "company_name": "WINCOR NIXDORF International GmbH",
      "company_seat": "Paderborn",
      "details": "24.09.2025 (Bekanntmachungsdatum)\n\nNordrhein-Westfalen Amtsgericht Paderborn HRB 3507\nEinreichung neuer Dokumente\n\nWINCOR NIXDORF International GmbH\nGesellschaft mit beschränkter Haftung\nPaderborn\n\nDem Registergericht ist eine neue Liste der Mitglieder des Aufsichtsrates eingereicht worden."
    },
    {
      "date": "2025-09-24",
      "id": "131309",
      "original_text": "Registerbekanntmachung nach dem Umwandlungsgesetz\nNordrhein-Westfalen Amtsgericht Bielefeld HRB 44439\nFahrschule Fahrwerk Bielefeld GmbH – Bielefeld",
      "type": "Registerbekanntmachung nach dem Umwandlungsgesetz",
      "state": "Nordrhein-Westfalen",
      "amtsgericht": "Amtsgericht Bielefeld",
      "registernummer": "HRB 44439",
      "registerart": "HRB",
      "company_name": "Fahrschule Fahrwerk Bielefeld GmbH",
      "company_seat": "Bielefeld",
      "details": "24.09.2025 (Bekanntmachungsdatum)\n\nNordrhein-Westfalen Amtsgericht Bielefeld HRB 44439\nRegisterbekanntmachung nach dem Umwandlungsgesetz 24.09.2025 (Eintragungsdatum)\n\nFahrschule Fahrwerk Bielefeld GmbH\nGesellschaft mit beschränkter Haftung\nBielefeld\n\nDen Gläubigern der an der Verschmelzung beteiligten Rechtsträger ist, wenn sie binnen sechs Monaten nach dem Tag, an dem die Eintragung der Verschmelzung in das Register des Sitzes desjenigen Rechtsträgers, dessen Gläubiger sie sind, nach § 19 Absatz 3 UmwG als bekanntgemacht gilt, ihren Anspruch nach Grund und Höhe schriftlich anmelden, Sicherheit zu leisten, soweit sie nicht Befriedigung verlangen können. Dieses Recht steht den Gläubigern jedoch nur zu, wenn sie glaubhaft machen, dass durch die Verschmelzung die Erfüllung ihrer Forderung gefährdet wird."
    },
    {
      "date": "2025-09-24",
      "id": "131310",
      "original_text": "Registerbekanntmachung nach dem Umwandlungsgesetz\nNordrhein-Westfalen Amtsgericht Bielefeld HRB 42823\nVerkehrsfachschule Fahrwerk GmbH – Bielefeld",
      "type": "Registerbekanntmachung nach dem Umwandlungsgesetz",
      "state": "Nordrhein-Westfalen",
      "amtsgericht": "Amtsgericht Bielefeld",
      "registernummer": "HRB 42823",
      "registerart": "HRB",
      "company_name": "Verkehrsfachschule Fahrwerk GmbH",
      "company_seat": "Bielefeld",
      "details": "24.09.2025 (Bekanntmachungsdatum)\n\nNordrhein-Westfalen Amtsgericht Bielefeld HRB 42823\nRegisterbekanntmachung nach dem Umwandlungsgesetz 24.09.2025 (Eintragungsdatum)\n\nVerkehrsfachschule Fahrwerk GmbH\nGesellschaft mit beschränkter Haftung\nBielefeld\n\nDen Gläubigern der an der Verschmelzung beteiligten Rechtsträger ist, wenn sie binnen sechs Monaten nach dem Tag, an dem die Eintragung der Verschmelzung in das Register des Sitzes desjenigen Rechtsträgers, dessen Gläubiger sie sind, nach § 19 Absatz 3 UmwG als bekanntgemacht gilt, ihren Anspruch nach Grund und Höhe schriftlich anmelden, Sicherheit zu leisten, soweit sie nicht Befriedigung verlangen können. Dieses Recht steht den Gläubigern jedoch nur zu, wenn sie glaubhaft machen, dass durch die Verschmelzung die Erfüllung ihrer Forderung gefährdet wird."
    },
    {
      "date": "2025-09-24",
      "id": "131311",
      "original_text": "Registerbekanntmachung nach dem Umwandlungsgesetz\nNordrhein-Westfalen Amtsgericht Essen HRB 23726\nR & T Beteiligungs-GmbH – Essen",
      "type": "Registerbekanntmachung nach dem Umwandlungsgesetz",
      "state": "Nordrhein-Westfalen",
      "amtsgericht": "Amtsgericht Essen",
      "registernummer": "HRB 23726",
      "registerart": "HRB",
      "company_name": "R & T Beteiligungs-GmbH",
      "company_seat": "Essen",
      "details": "24.09.2025 (Bekanntmachungsdatum)\n\nNordrhein-Westfalen Amtsgericht Essen HRB 23726\nRegisterbekanntmachung nach dem Umwandlungsgesetz 24.09.2025 (Eintragungsdatum)\n\nR & T Beteiligungs-GmbH\nGesellschaft mit beschränkter Haftung\nEssen\n\nDen Gläubigern der an der Verschmelzung beteiligten Rechtsträger ist, wenn sie binnen sechs Monaten nach dem Tag, an dem die Eintragung der Verschmelzung in das Register des Sitzes desjenigen Rechtsträgers, dessen Gläubiger sie sind, nach § 19 Absatz 3 UmwG als bekanntgemacht gilt, ihren Anspruch nach Grund und Höhe schriftlich anmelden, Sicherheit zu leisten, soweit sie nicht Befriedigung verlangen können. Dieses Recht steht den Gläubigern jedoch nur zu, wenn sie glaubhaft machen, dass durch die Verschmelzung die Erfüllung ihrer Forderung gefährdet wird."
    },
    {
      "date": "2025-09-24",
      "id": "131312",
      "original_text": "Registerbekanntmachung nach dem Umwandlungsgesetz\nNordrhein-Westfalen Amtsgericht Duisburg HRA 4938\nOtto Kemna Gesellschaft mit beschränkter Haftung & Co. Kommanditgesellschaft – Duisburg",
      "type": "Registerbekanntmachung nach dem Umwandlungsgesetz",
      "state": "Nordrhein-Westfalen",
      "amtsgericht": "Amtsgericht Duisburg",
      "registernummer": "HRA 4938",
      "registerart": "HRA",
      "company_name": "Otto Kemna Gesellschaft mit beschränkter Haftung & Co. Kommanditgesellschaft",
      "company_seat": "Duisburg",
      "details": "24.09.2025 (Bekanntmachungsdatum)\n\nNordrhein-Westfalen Amtsgericht Duisburg HRA 4938\nRegisterbekanntmachung nach dem Umwandlungsgesetz 24.09.2025 (Eintragungsdatum)\n\nOtto Kemna Gesellschaft mit beschränkter Haftung & Co. Kommanditgesellschaft\nKommanditgesellschaft\nDuisburg\n\nDie Gesellschaft hat Gläubigern, deren Forderungen vor dieser Bekanntmachung begründet worden sind, Sicherheit zu leisten, soweit sie nicht Befriedigung verlangen können, wenn sie sich binnen sechs Monaten zu diesem Zweck melden."
    },
    {
      "date": "2025-09-24",
      "id": "131313",
      "original_text": "Registerbekanntmachung nach dem Umwandlungsgesetz\nNordrhein-Westfalen Amtsgericht Mönchengladbach HRB 20930\nnano-purification solutions GmbH – Erkelenz",
      "type": "Registerbekanntmachung nach dem Umwandlungsgesetz",
      "state": "Nordrhein-Westfalen",
      "amtsgericht": "Amtsgericht Mönchengladbach",
      "registernummer": "HRB 20930",
      "registerart": "HRB",
      "company_name": "nano-purification solutions GmbH",
      "company_seat": "Erkelenz",
      "details": "24.09.2025 (Bekanntmachungsdatum)\n\nNordrhein-Westfalen Amtsgericht Mönchengladbach HRB 20930\nRegisterbekanntmachung nach dem Umwandlungsgesetz 24.09.2025 (Eintragungsdatum)\n\nnano-purification solutions GmbH\nGesellschaft mit beschränkter Haftung\nErkelenz\n\nDen Gläubigern der an der Verschmelzung beteiligten Rechtsträger ist, wenn sie binnen sechs Monaten nach dem Tag, an dem die Eintragung der Verschmelzung in das Register des Sitzes desjenigen Rechtsträgers, dessen Gläubiger sie sind, nach § 19 Absatz 3 UmwG als bekanntgemacht gilt, ihren Anspruch nach Grund und Höhe schriftlich anmelden, Sicherheit zu leisten, soweit sie nicht Befriedigung verlangen können. Dieses Recht steht den Gläubigern jedoch nur zu, wenn sie glaubhaft machen, dass durch die Verschmelzung die Erfüllung ihrer Forderung gefährdet wird."
    },
    {
      "date": "2025-09-24",
      "id": "131314",
      "original_text": "Einreichung neuer Dokumente\nNordrhein-Westfalen Amtsgericht Köln HRB 2367\nWohnungsgesellschaft der Stadtwerke Köln mit beschränkter Haftung – Köln",
      "type": "Einreichung neuer Dokumente",
      "state": "Nordrhein-Westfalen",
      "amtsgericht": "Amtsgericht Köln",
      "registernummer": "HRB 2367",
      "registerart": "HRB",
      "company_name": "Wohnungsgesellschaft der Stadtwerke Köln mit beschränkter Haftung",
      "company_seat": "Köln",
      "details": "24.09.2025 (Bekanntmachungsdatum)\n\nNordrhein-Westfalen Amtsgericht Köln HRB 2367\nEinreichung neuer Dokumente\n\nWohnungsgesellschaft der Stadtwerke Köln mit beschränkter Haftung\nGesellschaft mit beschränkter Haftung\nKöln\n\nDem Registergericht ist eine Liste der Mitglieder des Aufsichtsrates eingereicht worden."
    },
    {
      "date": "2025-09-24",
      "id": "131315",
      "original_text": "Registerbekanntmachung nach dem Umwandlungsgesetz\nNordrhein-Westfalen Amtsgericht Bad Oeynhausen HRA 5654\nG & K Automobil-Service GmbH & Co. KG – Rahden",
      "type": "Registerbekanntmachung nach dem Umwandlungsgesetz",
      "state": "Nordrhein-Westfalen",
      "amtsgericht": "Amtsgericht Bad Oeynhausen",
      "registernummer": "HRA 5654",
      "registerart": "HRA",
      "company_name": "G & K Automobil-Service GmbH & Co. KG",
      "company_seat": "Rahden",
      "details": "24.09.2025 (Bekanntmachungsdatum)\n\nNordrhein-Westfalen Amtsgericht Bad Oeynhausen HRA 5654\nRegisterbekanntmachung nach dem Umwandlungsgesetz 24.09.2025 (Eintragungsdatum)\n\nG & K Automobil-Service GmbH & Co. KG\nKommanditgesellschaft\nRahden\n\nDen Gläubigern der an der formwechselnden Umwandlung beteiligten Rechtsträger ist, wenn sie binnen sechs Monaten nach dem Tag, an dem die Eintragung der formwechselnden Umwandlung in das Register des Sitzes desjenigen Rechtsträgers, dessen Gläubiger sie sind, nach § 19 Absatz 3 UmwG als bekanntgemacht gilt, ihren Anspruch nach Grund und Höhe schriftlich anmelden, Sicherheit zu leisten, soweit sie nicht Befriedigung verlangen können. Dieses Recht steht den Gläubigern jedoch nur zu, wenn sie glaubhaft machen, dass durch die formwechselnden Umwandlung die Erfüllung ihrer Forderung gefährdet wird."
    },
    {
      "date": "2025-09-24",
      "id": "131316",
      "original_text": "Registerbekanntmachung nach dem Umwandlungsgesetz\nNordrhein-Westfalen Amtsgericht Köln HRB 90951\nPV 5. Objektgesellschaft mbH – Köln",
      "type": "Registerbekanntmachung nach dem Umwandlungsgesetz",
      "state": "Nordrhein-Westfalen",
      "amtsgericht": "Amtsgericht Köln",
      "registernummer": "HRB 90951",
      "registerart": "HRB",
      "company_name": "PV 5. Objektgesellschaft mbH",
      "company_seat": "Köln",
      "details": "24.09.2025 (Bekanntmachungsdatum)\n\nNordrhein-Westfalen Amtsgericht Köln HRB 90951\nRegisterbekanntmachung nach dem Umwandlungsgesetz 24.09.2025 (Eintragungsdatum)\n\nPV 5. Objektgesellschaft mbH\nGesellschaft mit beschränkter Haftung\nKöln\n\nDen Gläubigern der an der Verschmelzung beteiligten Rechtsträger ist, wenn sie binnen sechs Monaten nach dem Tag, an dem die Eintragung der Verschmelzung in das Register des Sitzes desjenigen Rechtsträgers, dessen Gläubiger sie sind, nach § 19 Absatz 3 UmwG als bekanntgemacht gilt, ihren Anspruch nach Grund und Höhe schriftlich anmelden, Sicherheit zu leisten, soweit sie nicht Befriedigung verlangen können. Dieses Recht steht den Gläubigern jedoch nur zu, wenn sie glaubhaft machen, dass durch die Verschmelzung die Erfüllung ihrer Forderung gefährdet wird."
    },
    {
      "date": "2025-09-24",
      "id": "131317",
      "original_text": "Registerbekanntmachung nach dem Umwandlungsgesetz\nNordrhein-Westfalen Amtsgericht Düsseldorf HRB 94048\nColumbus Vermögensverwaltungs-GmbH – Düsseldorf",
      "type": "Registerbekanntmachung nach dem Umwandlungsgesetz",
      "state": "Nordrhein-Westfalen",
      "amtsgericht": "Amtsgericht Düsseldorf",
      "registernummer": "HRB 94048",
      "registerart": "HRB",
      "company_name": "Columbus Vermögensverwaltungs-GmbH",
      "company_seat": "Düsseldorf",
      "details": "24.09.2025 (Bekanntmachungsdatum)\n\nNordrhein-Westfalen Amtsgericht Düsseldorf HRB 94048\nRegisterbekanntmachung nach dem Umwandlungsgesetz 24.09.2025 (Eintragungsdatum)\n\nColumbus Vermögensverwaltungs-GmbH\nGesellschaft mit beschränkter Haftung\nDüsseldorf\n\nDen Gläubigern der an der formwechselnden Umwandlung beteiligten Rechtsträger ist, wenn sie binnen sechs Monaten nach dem Tag, an dem die Eintragung der formwechselnden Umwandlung in das Register des Sitzes desjenigen Rechtsträgers, dessen Gläubiger sie sind, nach § 19 Absatz 3 UmwG als bekanntgemacht gilt, ihren Anspruch nach Grund und Höhe schriftlich anmelden, Sicherheit zu leisten, soweit sie nicht Befriedigung verlangen können. Dieses Recht steht den Gläubigern jedoch nur zu, wenn sie glaubhaft machen, dass durch die formwechselnden Umwandlung die Erfüllung ihrer Forderung gefährdet wird."
    },
    {
      "date": "2025-09-24",
      "id": "131318",
      "original_text": "Sonstige Registerbekanntmachung\nNordrhein-Westfalen Amtsgericht Siegburg GsR 88\neGbR Weilburger Straße – Bad Honnef",
      "type": "Sonstige Registerbekanntmachung",
      "state": "Nordrhein-Westfalen",
      "amtsgericht": "Amtsgericht Siegburg",
      "registernummer": "GsR 88",
      "registerart": "GsR",
      "company_name": "eGbR Weilburger Straße",
      "company_seat": "Bad Honnef",
      "details": "24.09.2025 (Bekanntmachungsdatum)\n\nNordrhein-Westfalen Amtsgericht Siegburg GsR 88\nSonstige Registerbekanntmachung 24.09.2025 (Eintragungsdatum)\n\neGbR Weilburger Straße\nGesellschaft bürgerlichen Rechts\nBad Honnef\n\nDie Gesellschaft hat Gläubigern, deren Forderungen vor dieser Bekanntmachung begründet worden sind, Sicherheit zu leisten, soweit sie nicht Befriedigung verlangen können, wenn sie sich binnen sechs Monaten zu diesem Zweck melden."
    },
    {
      "date": "2025-09-24",
      "id": "131319",
      "original_text": "Löschungsankündigung\nNordrhein-Westfalen Amtsgericht Iserlohn HRB 4889\nAUROTEC GmbH – Schalksmühle",
      "type": "Löschungsankündigung",
      "state": "Nordrhein-Westfalen",
      "amtsgericht": "Amtsgericht Iserlohn",
      "registernummer": "HRB 4889",
      "registerart": "HRB",
      "company_name": "AUROTEC GmbH",
      "company_seat": "Schalksmühle",
      "details": "24.09.2025 (Bekanntmachungsdatum)\n\nNordrhein-Westfalen Amtsgericht Iserlohn HRB 4889\nLöschungsankündigung\n\nAUROTEC GmbH\nGesellschaft mit beschränkter Haftung\nSchalksmühle\n\nDas Registergericht beabsichtigt die Gesellschaft von Amts wegen nach § 394 FamFG zu löschen. Die Frist zur Erhebung eines Widerspruchs ist auf zwei Monate festgesetzt."
    },
    {
      "date": "2025-09-24",
      "id": "131320",
      "original_text": "Registerbekanntmachung nach dem Umwandlungsgesetz\nNordrhein-Westfalen Amtsgericht Düsseldorf HRB 63611\nNeubert & Co GmbH – Düsseldorf",
      "type": "Registerbekanntmachung nach dem Umwandlungsgesetz",
      "state": "Nordrhein-Westfalen",
      "amtsgericht": "Amtsgericht Düsseldorf",
      "registernummer": "HRB 63611",
      "registerart": "HRB",
      "company_name": "Neubert & Co GmbH",
      "company_seat": "Düsseldorf",
      "details": "24.09.2025 (Bekanntmachungsdatum)\n\nNordrhein-Westfalen Amtsgericht Düsseldorf HRB 63611\nRegisterbekanntmachung nach dem Umwandlungsgesetz 24.09.2025 (Eintragungsdatum)\n\nNeubert & Co GmbH\nGesellschaft mit beschränkter Haftung\nDüsseldorf\n\nDen Gläubigern der an der Verschmelzung beteiligten Rechtsträger ist, wenn sie binnen sechs Monaten nach dem Tag, an dem die Eintragung der Verschmelzung in das Register des Sitzes desjenigen Rechtsträgers, dessen Gläubiger sie sind, nach § 19 Absatz 3 UmwG als bekanntgemacht gilt, ihren Anspruch nach Grund und Höhe schriftlich anmelden, Sicherheit zu leisten, soweit sie nicht Befriedigung verlangen können. Dieses Recht steht den Gläubigern jedoch nur zu, wenn sie glaubhaft machen, dass durch die Verschmelzung die Erfüllung ihrer Forderung gefährdet wird."
    },
    {
      "date": "2025-09-24",
      "id": "131321",
      "original_text": "Löschungsankündigung\nNordrhein-Westfalen Amtsgericht Bonn HRB 24411\nRailWatch Services UG (haftungsbeschränkt) – Bonn",
      "type": "Löschungsankündigung",
      "state": "Nordrhein-Westfalen",
      "amtsgericht": "Amtsgericht Bonn",
      "registernummer": "HRB 24411",
      "registerart": "HRB",
      "company_name": "RailWatch Services UG (haftungsbeschränkt)",
      "company_seat": "Bonn",
      "details": "24.09.2025 (Bekanntmachungsdatum)\n\nNordrhein-Westfalen Amtsgericht Bonn HRB 24411\nLöschungsankündigung\n\nRailWatch Services UG (haftungsbeschränkt)\nGesellschaft mit beschränkter Haftung\nBonn\n\nDas Registergericht beabsichtigt die Gesellschaft von Amts wegen nach § 394 FamFG zu löschen. Die Frist zur Erhebung eines Widerspruchs ist auf einen Monat festgesetzt."
    },
    {
      "date": "2025-09-24",
      "id": "131322",
      "original_text": "Registerbekanntmachung nach dem Umwandlungsgesetz\nNordrhein-Westfalen Amtsgericht Gelsenkirchen HRA 6430\nNJ Gymnastics OHG – Bottrop",
      "type": "Registerbekanntmachung nach dem Umwandlungsgesetz",
      "state": "Nordrhein-Westfalen",
      "amtsgericht": "Amtsgericht Gelsenkirchen",
      "registernummer": "HRA 6430",
      "registerart": "HRA",
      "company_name": "NJ Gymnastics OHG",
      "company_seat": "Bottrop",
      "details": "24.09.2025 (Bekanntmachungsdatum)\n\nNordrhein-Westfalen Amtsgericht Gelsenkirchen HRA 6430\nRegisterbekanntmachung nach dem Umwandlungsgesetz 24.09.2025 (Eintragungsdatum)\n\nNJ Gymnastics OHG\nOffene Handelsgesellschaft\nBottrop\n\nDen Gläubigern der an der Verschmelzung beteiligten Rechtsträger ist, wenn sie binnen sechs Monaten nach dem Tag, an dem die Eintragung der Verschmelzung in das Register des Sitzes desjenigen Rechtsträgers, dessen Gläubiger sie sind, nach § 19 Absatz 3 UmwG als bekanntgemacht gilt, ihren Anspruch nach Grund und Höhe schriftlich anmelden, Sicherheit zu leisten, soweit sie nicht Befriedigung verlangen können. Dieses Recht steht den Gläubigern jedoch nur zu, wenn sie glaubhaft machen, dass durch die Verschmelzung die Erfüllung ihrer Forderung gefährdet wird."
    },
    {
      "date": "2025-09-24",
      "id": "131323",
      "original_text": "Registerbekanntmachung nach dem Umwandlungsgesetz\nNordrhein-Westfalen Amtsgericht Gütersloh HRB 8639\nZweite Nagel Real Estate Verwaltungs GmbH – Versmold",
      "type": "Registerbekanntmachung nach dem Umwandlungsgesetz",
      "state": "Nordrhein-Westfalen",
      "amtsgericht": "Amtsgericht Gütersloh",
      "registernummer": "HRB 8639",
      "registerart": "HRB",
      "company_name": "Zweite Nagel Real Estate Verwaltungs GmbH",
      "company_seat": "Versmold",
      "details": "24.09.2025 (Bekanntmachungsdatum)\n\nNordrhein-Westfalen Amtsgericht Gütersloh HRB 8639\nRegisterbekanntmachung nach dem Umwandlungsgesetz 17.09.2025 (Eintragungsdatum)\n\nZweite Nagel Real Estate Verwaltungs GmbH\nGesellschaft mit beschränkter Haftung\nVersmold\n\nDen Gläubigern der an der Verschmelzung beteiligten Rechtsträger ist, wenn sie binnen sechs Monaten nach dem Tag, an dem die Eintragung der Verschmelzung in das Register des Sitzes desjenigen Rechtsträgers, dessen Gläubiger sie sind, nach § 19 Absatz 3 UmwG als bekanntgemacht gilt, ihren Anspruch nach Grund und Höhe schriftlich anmelden, Sicherheit zu leisten, soweit sie nicht Befriedigung verlangen können. Dieses Recht steht den Gläubigern jedoch nur zu, wenn sie glaubhaft machen, dass durch die Verschmelzung die Erfüllung ihrer Forderung gefährdet wird."
    },
    {
      "date": "2025-09-24",
      "id": "131324",
      "original_text": "Registerbekanntmachung nach dem Umwandlungsgesetz\nNordrhein-Westfalen Amtsgericht Bad Oeynhausen HRB 15427\nKarl Schmidt Beteiligungs GmbH – Preußisch Oldendorf",
      "type": "Registerbekanntmachung nach dem Umwandlungsgesetz",
      "state": "Nordrhein-Westfalen",
      "amtsgericht": "Amtsgericht Bad Oeynhausen",
      "registernummer": "HRB 15427",
      "registerart": "HRB",
      "company_name": "Karl Schmidt Beteiligungs GmbH",
      "company_seat": "Preußisch Oldendorf",
      "details": "24.09.2025 (Bekanntmachungsdatum)\n\nNordrhein-Westfalen Amtsgericht Bad Oeynhausen HRB 15427\nRegisterbekanntmachung nach dem Umwandlungsgesetz 24.09.2025 (Eintragungsdatum)\n\nKarl Schmidt Beteiligungs GmbH\nGesellschaft mit beschränkter Haftung\nPreußisch Oldendorf\n\nDen Gläubigern der an der Verschmelzung beteiligten Rechtsträger ist, wenn sie binnen sechs Monaten nach dem Tag, an dem die Eintragung der Verschmelzung in das Register des Sitzes desjenigen Rechtsträgers, dessen Gläubiger sie sind, nach § 19 Absatz 3 UmwG als bekanntgemacht gilt, ihren Anspruch nach Grund und Höhe schriftlich anmelden, Sicherheit zu leisten, soweit sie nicht Befriedigung verlangen können. Dieses Recht steht den Gläubigern jedoch nur zu, wenn sie glaubhaft machen, dass durch die Verschmelzung die Erfüllung ihrer Forderung gefährdet wird."
    },
    {
      "date": "2025-09-24",
      "id": "131325",
      "original_text": "Registerbekanntmachung nach dem Umwandlungsgesetz\nNordrhein-Westfalen Amtsgericht Duisburg HRB 35177\nPIA Immobilien Hünxe GmbH – Hünxe",
      "type": "Registerbekanntmachung nach dem Umwandlungsgesetz",
      "state": "Nordrhein-Westfalen",
      "amtsgericht": "Amtsgericht Duisburg",
      "registernummer": "HRB 35177",
      "registerart": "HRB",
      "company_name": "PIA Immobilien Hünxe GmbH",
      "company_seat": "Hünxe",
      "details": "24.09.2025 (Bekanntmachungsdatum)\n\nNordrhein-Westfalen Amtsgericht Duisburg HRB 35177\nRegisterbekanntmachung nach dem Umwandlungsgesetz 24.09.2025 (Eintragungsdatum)\n\nPIA Immobilien Hünxe GmbH\nGesellschaft mit beschränkter Haftung\nHünxe\n\nDie Gesellschaft hat Gläubigern, deren Forderungen vor dieser Bekanntmachung begründet worden sind, Sicherheit zu leisten, soweit sie nicht Befriedigung verlangen können, wenn sie sich binnen sechs Monaten zu diesem Zweck melden."
    },
    {
      "date": "2025-09-24",
      "id": "131326",
      "original_text": "Einreichung neuer Dokumente\nNordrhein-Westfalen Amtsgericht Bonn HRB 10811\nVerbandswasserwerk Gesellschaft mit beschränkter Haftung – Euskirchen",
      "type": "Einreichung neuer Dokumente",
      "state": "Nordrhein-Westfalen",
      "amtsgericht": "Amtsgericht Bonn",
      "registernummer": "HRB 10811",
      "registerart": "HRB",
      "company_name": "Verbandswasserwerk Gesellschaft mit beschränkter Haftung",
      "company_seat": "Euskirchen",
      "details": "24.09.2025 (Bekanntmachungsdatum)\n\nNordrhein-Westfalen Amtsgericht Bonn HRB 10811\nEinreichung neuer Dokumente\n\nVerbandswasserwerk Gesellschaft mit beschränkter Haftung\nGesellschaft mit beschränkter Haftung\nEuskirchen\n\nDem Registergericht ist eine neue Liste der Mitglieder des Aufsichtsrates eingereicht worden."
    },
    {
      "date": "2025-09-24",
      "id": "131327",
      "original_text": "Registerbekanntmachung nach dem Umwandlungsgesetz\nNordrhein-Westfalen Amtsgericht Düren HRA 4254\nHS Hannes Schmitt e.K. – Düren",
      "type": "Registerbekanntmachung nach dem Umwandlungsgesetz",
      "state": "Nordrhein-Westfalen",
      "amtsgericht": "Amtsgericht Düren",
      "registernummer": "HRA 4254",
      "registerart": "HRA",
      "company_name": "HS Hannes Schmitt e.K.",
      "company_seat": "Düren",
      "details": "24.09.2025 (Bekanntmachungsdatum)\n\nNordrhein-Westfalen Amtsgericht Düren HRA 4254\nRegisterbekanntmachung nach dem Umwandlungsgesetz 24.09.2025 (Eintragungsdatum)\n\nHS Hannes Schmitt e.K.\nEinzelkaufmann / Einzelkauffrau\nDüren\n\nDen Gläubigern der an der Ausgliederung beteiligten Rechtsträger ist, wenn sie binnen sechs Monaten nach dem Tag, an dem die Eintragung der Ausgliederung in das Register des Sitzes desjenigen Rechtsträgers, dessen Gläubiger sie sind, nach § 19 Absatz 3 UmwG als bekanntgemacht gilt, ihren Anspruch nach Grund und Höhe schriftlich anmelden, Sicherheit zu leisten, soweit sie nicht Befriedigung verlangen können. Dieses Recht steht den Gläubigern jedoch nur zu, wenn sie glaubhaft machen, dass durch die Ausgliederung die Erfüllung ihrer Forderung gefährdet wird."
    },
    {
      "date": "2025-09-24",
      "id": "131328",
      "original_text": "Löschungsankündigung\nNordrhein-Westfalen Amtsgericht Gelsenkirchen HRB 14603\nMichalak Berlin GmbH – Marl",
      "type": "Löschungsankündigung",
      "state": "Nordrhein-Westfalen",
      "amtsgericht": "Amtsgericht Gelsenkirchen",
      "registernummer": "HRB 14603",
      "registerart": "HRB",
      "company_name": "Michalak Berlin GmbH",
      "company_seat": "Marl",
      "details": "24.09.2025 (Bekanntmachungsdatum)\n\nNordrhein-Westfalen Amtsgericht Gelsenkirchen HRB 14603\nLöschungsankündigung\n\nMichalak Berlin GmbH\nGesellschaft mit beschränkter Haftung\nMarl\n\nDas Gericht beabsichtigt, die Gesellschaft Michalak Berlin GmbH mit Sitz in Marl, HRB 14603 Amtsgericht Gelsenkirchen, wegen Vermögenslosigkeit zu löschen.\nHiermit wird denjenigen, die an der Unterlassung der Löschung ein berechtigtes Interesse haben, gem. § 394 Abs. 2 FamFG Gelegenheit gegeben, gegen dieses Vorhaben binnen eines Monats nach dieser Bekanntmachung Widerspruch einzulegen. Der Widerspruch kann schriftlich oder zu Protokoll der Geschäftsstelle erhoben werden."
    },
    {
      "date": "2025-09-24",
      "id": "131329",
      "original_text": "Registerbekanntmachung nach dem Umwandlungsgesetz\nThüringen Amtsgericht Jena HRA 501691\nA & H Aufbereitungs- und Holzhandels GmbH & Co. KG – Schkölen",
      "type": "Registerbekanntmachung nach dem Umwandlungsgesetz",
      "state": "Thüringen",
      "amtsgericht": "Amtsgericht Jena",
      "registernummer": "HRA 501691",
      "registerart": "HRA",
      "company_name": "A & H Aufbereitungs- und Holzhandels GmbH & Co. KG",
      "company_seat": "Schkölen",
      "details": "24.09.2025 (Bekanntmachungsdatum)\n\nThüringen Amtsgericht Jena HRA 501691\nRegisterbekanntmachung nach dem Umwandlungsgesetz 24.09.2025 (Eintragungsdatum)\n\nA & H Aufbereitungs- und Holzhandels GmbH & Co. KG\nKommanditgesellschaft\nSchkölen\n\nNicht eingetragen: Den Gläubigern der an der Verschmelzung beteiligten Rechtsträger, ist wenn sie binnen sechs Monaten nach dem Tag, an dem die Eintragung der Verschmelzung in das Register des Sitzes desjenigen Rechtsträgers, dessen Gläubiger sie sind,  nach § 19 Abs. 3 UmwG als bekanntgemacht gilt, ihren Anspruch nach Grund und Höhe schriftlich anmelden, Sicherheit zu leisten, soweit sie nicht Befriedigung verlangen können. Dieses Recht steht ihnen jedoch nur zu, wenn sie glaubhaft machen, daß durch die Verschmelzung die Erfüllung ihrer Forderung gefährdet wird."
    },
    {
      "date": "2025-09-24",
      "id": "131330",
      "original_text": "Registerbekanntmachung nach dem Umwandlungsgesetz\nThüringen Amtsgericht Jena HRB 503349\nBETEX GmbH – Bad Salzungen",
      "type": "Registerbekanntmachung nach dem Umwandlungsgesetz",
      "state": "Thüringen",
      "amtsgericht": "Amtsgericht Jena",
      "registernummer": "HRB 503349",
      "registerart": "HRB",
      "company_name": "BETEX GmbH",
      "company_seat": "Bad Salzungen",
      "details": "24.09.2025 (Bekanntmachungsdatum)\n\nThüringen Amtsgericht Jena HRB 503349\nRegisterbekanntmachung nach dem Umwandlungsgesetz 24.09.2025 (Eintragungsdatum)\n\nBETEX GmbH\nGesellschaft mit beschränkter Haftung\nBad Salzungen\n\nNicht eingetragen: Den Gläubigern der an der Verschmelzung beteiligten Rechtsträger, ist wenn sie binnen sechs Monaten nach dem Tag, an dem die Eintragung der Verschmelzung in das Register des Sitzes desjenigen Rechtsträgers, dessen Gläubiger sie sind,  nach § 19 Abs. 3 UmwG als bekanntgemacht gilt, ihren Anspruch nach Grund und Höhe schriftlich anmelden, Sicherheit zu leisten, soweit sie nicht Befriedigung verlangen können. Dieses Recht steht ihnen jedoch nur zu, wenn sie glaubhaft machen, daß durch die Verschmelzung die Erfüllung ihrer Forderung gefährdet wird."
    },
    {
      "date": "2025-09-24",
      "id": "131331",
      "original_text": "Registerbekanntmachung nach dem Umwandlungsgesetz\nThüringen Amtsgericht Jena HRB 306680\nBETEX GmbH – Bad Salzungen",
      "type": "Registerbekanntmachung nach dem Umwandlungsgesetz",
      "state": "Thüringen",
      "amtsgericht": "Amtsgericht Jena",
      "registernummer": "HRB 306680",
      "registerart": "HRB",
      "company_name": "BETEX GmbH",
      "company_seat": "Bad Salzungen",
      "details": "24.09.2025 (Bekanntmachungsdatum)\n\nThüringen Amtsgericht Jena HRB 306680\nRegisterbekanntmachung nach dem Umwandlungsgesetz 24.09.2025 (Eintragungsdatum)\n\nBETEX GmbH\nGesellschaft mit beschränkter Haftung\nBad Salzungen\n\nNicht eingetragen: Den Gläubigern der an der Verschmelzung beteiligten Rechtsträger, ist wenn sie binnen sechs Monaten nach dem Tag, an dem die Eintragung der Verschmelzung in das Register des Sitzes desjenigen Rechtsträgers, dessen Gläubiger sie sind,  nach § 19 Abs. 3 UmwG als bekanntgemacht gilt, ihren Anspruch nach Grund und Höhe schriftlich anmelden, Sicherheit zu leisten, soweit sie nicht Befriedigung verlangen können. Dieses Recht steht ihnen jedoch nur zu, wenn sie glaubhaft machen, daß durch die Verschmelzung die Erfüllung ihrer Forderung gefährdet wird."
    },
    {
      "date": "2025-09-24",
      "id": "131332",
      "original_text": "Registerbekanntmachung nach dem Umwandlungsgesetz\nThüringen Amtsgericht Jena HRB 208416\nBKS Bio-Kraftwerk Schkölen GmbH – Schkölen",
      "type": "Registerbekanntmachung nach dem Umwandlungsgesetz",
      "state": "Thüringen",
      "amtsgericht": "Amtsgericht Jena",
      "registernummer": "HRB 208416",
      "registerart": "HRB",
      "company_name": "BKS Bio-Kraftwerk Schkölen GmbH",
      "company_seat": "Schkölen",
      "details": "24.09.2025 (Bekanntmachungsdatum)\n\nThüringen Amtsgericht Jena HRB 208416\nRegisterbekanntmachung nach dem Umwandlungsgesetz 24.09.2025 (Eintragungsdatum)\n\nBKS Bio-Kraftwerk Schkölen GmbH\nGesellschaft mit beschränkter Haftung\nSchkölen\n\nNicht eingetragen: Den Gläubigern der an der Verschmelzung beteiligten Rechtsträger, ist wenn sie binnen sechs Monaten nach dem Tag, an dem die Eintragung der Verschmelzung in das Register des Sitzes desjenigen Rechtsträgers, dessen Gläubiger sie sind,  nach § 19 Abs. 3 UmwG als bekanntgemacht gilt, ihren Anspruch nach Grund und Höhe schriftlich anmelden, Sicherheit zu leisten, soweit sie nicht Befriedigung verlangen können. Dieses Recht steht ihnen jedoch nur zu, wenn sie glaubhaft machen, daß durch die Verschmelzung die Erfüllung ihrer Forderung gefährdet wird."
    },
    {
      "date": "2025-09-24",
      "id": "131333",
      "original_text": "Einreichung neuer Dokumente\nHessen Amtsgericht Frankfurt am Main HRB 125208\nSinkaCom Aktiengesellschaft – Frankfurt am Main",
      "type": "Einreichung neuer Dokumente",
      "state": "Hessen",
      "amtsgericht": "Amtsgericht Frankfurt am Main",
      "registernummer": "HRB 125208",
      "registerart": "HRB",
      "company_name": "SinkaCom Aktiengesellschaft",
      "company_seat": "Frankfurt am Main",
      "details": "24.09.2025 (Bekanntmachungsdatum)\n\nHessen Amtsgericht Frankfurt am Main HRB 125208\nEinreichung neuer Dokumente 19.09.2025 (Eintragungsdatum)\n\nSinkaCom Aktiengesellschaft\nAktiengesellschaft\nFrankfurt am Main\n\nDurch eine Änderung in den Personen der Aufsichtsratsmitglieder ist eine Liste der Mitglieder des Aufsichtsrates zum Handelsregister eingereicht worden."
    },
    {
      "date": "2025-09-24",
      "id": "131334",
      "original_text": "Registerbekanntmachung nach dem Umwandlungsgesetz\nHessen Amtsgericht Frankfurt am Main HRB 91058\nPP-Service GmbH – Frankfurt am Main",
      "type": "Registerbekanntmachung nach dem Umwandlungsgesetz",
      "state": "Hessen",
      "amtsgericht": "Amtsgericht Frankfurt am Main",
      "registernummer": "HRB 91058",
      "registerart": "HRB",
      "company_name": "PP-Service GmbH",
      "company_seat": "Frankfurt am Main",
      "details": "24.09.2025 (Bekanntmachungsdatum)\n\nHessen Amtsgericht Frankfurt am Main HRB 91058\nRegisterbekanntmachung nach dem Umwandlungsgesetz 24.09.2025 (Eintragungsdatum)\n\nPP-Service GmbH\nGesellschaft mit beschränkter Haftung\nFrankfurt am Main\n\nDen Gläubigern der an der Verschmelzung beteiligten Rechtsträger ist, wenn sie binnen sechs Monaten nach dem Tag, an dem die Eintragung der Verschmelzung in das Register des Sitzes desjenigen Rechtsträgers, dessen Gläubiger sie sind, nach § 19 Absatz 3 UmwG bekannt gemacht worden ist, ihren Anspruch nach Grund und Höhe schriftlich anmelden, Sicherheit zu leisten, soweit sie nicht Befriedigung verlangen können. Dieses Recht steht den Gläubigern jedoch nur zu, wenn sie glaubhaft machen, dass durch die Verschmelzung die Erfüllung ihrer Forderung gefährdet wird."
    },
    {
      "date": "2025-09-24",
      "id": "131335",
      "original_text": "Registerbekanntmachung nach dem Umwandlungsgesetz\nHessen Amtsgericht Frankfurt am Main HRB 111810\nPP CONSULTING GmbH – Frankfurt am Main",
      "type": "Registerbekanntmachung nach dem Umwandlungsgesetz",
      "state": "Hessen",
      "amtsgericht": "Amtsgericht Frankfurt am Main",
      "registernummer": "HRB 111810",
      "registerart": "HRB",
      "company_name": "PP CONSULTING GmbH",
      "company_seat": "Frankfurt am Main",
      "details": "24.09.2025 (Bekanntmachungsdatum)\n\nHessen Amtsgericht Frankfurt am Main HRB 111810\nRegisterbekanntmachung nach dem Umwandlungsgesetz 24.09.2025 (Eintragungsdatum)\n\nPP CONSULTING GmbH\nGesellschaft mit beschränkter Haftung\nFrankfurt am Main\n\nDen Gläubigern der an der Verschmelzung beteiligten Rechtsträger ist, wenn sie binnen sechs Monaten nach dem Tag, an dem die Eintragung der Verschmelzung in das Register des Sitzes desjenigen Rechtsträgers, dessen Gläubiger sie sind, nach § 19 Absatz 3 UmwG bekannt gemacht worden ist, ihren Anspruch nach Grund und Höhe schriftlich anmelden, Sicherheit zu leisten, soweit sie nicht Befriedigung verlangen können. Dieses Recht steht den Gläubigern jedoch nur zu, wenn sie glaubhaft machen, dass durch die Verschmelzung die Erfüllung ihrer Forderung gefährdet wird."
    },
    {
      "date": "2025-09-24",
      "id": "131336",
      "original_text": "Registerbekanntmachung nach dem Umwandlungsgesetz\nHessen Amtsgericht Darmstadt HRB 100781\nID Logistics Ginsheim GmbH – Griesheim",
      "type": "Registerbekanntmachung nach dem Umwandlungsgesetz",
      "state": "Hessen",
      "amtsgericht": "Amtsgericht Darmstadt",
      "registernummer": "HRB 100781",
      "registerart": "HRB",
      "company_name": "ID Logistics Ginsheim GmbH",
      "company_seat": "Griesheim",
      "details": "24.09.2025 (Bekanntmachungsdatum)\n\nHessen Amtsgericht Darmstadt HRB 100781\nRegisterbekanntmachung nach dem Umwandlungsgesetz 24.09.2025 (Eintragungsdatum)\n\nID Logistics Ginsheim GmbH\nGesellschaft mit beschränkter Haftung\nGriesheim\n\nDen Gläubigern der an der Verschmelzung beteiligten Rechtsträger ist, wenn sie binnen sechs Monaten nach dem Tag, an dem die Eintragung der Verschmelzung in das Register des Sitzes derjenigen Rechtsträger deren Gläubiger sie sind, nach § 19 Absatz 3 UmwG bekannt gemacht worden ist, ihren Anspruch nach Grund und Höhe schriftlich anmelden, Sicherheit zu leisten, soweit sie nicht Befriedigung verlangen können. Dieses Recht steht den Gläubigern jedoch nur zu, wenn sie glaubhaft machen, dass durch die Verschmelzung die Erfüllung ihrer Forderung gefährdet wird."
    },
    {
      "date": "2025-09-24",
      "id": "131337",
      "original_text": "Registerbekanntmachung nach dem Umwandlungsgesetz\nHessen Amtsgericht Frankfurt am Main HRB 26537\nPP LIVE GmbH – Frankfurt am Main",
      "type": "Registerbekanntmachung nach dem Umwandlungsgesetz",
      "state": "Hessen",
      "amtsgericht": "Amtsgericht Frankfurt am Main",
      "registernummer": "HRB 26537",
      "registerart": "HRB",
      "company_name": "PP LIVE GmbH",
      "company_seat": "Frankfurt am Main",
      "details": "24.09.2025 (Bekanntmachungsdatum)\n\nHessen Amtsgericht Frankfurt am Main HRB 26537\nRegisterbekanntmachung nach dem Umwandlungsgesetz 24.09.2025 (Eintragungsdatum)\n\nPP LIVE GmbH\nGesellschaft mit beschränkter Haftung\nFrankfurt am Main\n\nDen Gläubigern der an der Verschmelzung beteiligten Rechtsträger ist, wenn sie binnen sechs Monaten nach dem Tag, an dem die Eintragung der Verschmelzung in das Register des Sitzes desjenigen Rechtsträgers, dessen Gläubiger sie sind, nach § 19 Absatz 3 UmwG bekannt gemacht worden ist, ihren Anspruch nach Grund und Höhe schriftlich anmelden, Sicherheit zu leisten, soweit sie nicht Befriedigung verlangen können. Dieses Recht steht den Gläubigern jedoch nur zu, wenn sie glaubhaft machen, dass durch die Verschmelzung die Erfüllung ihrer Forderung gefährdet wird."
    },
    {
      "date": "2025-09-24",
      "id": "131338",
      "original_text": "Löschungsankündigung\nHessen Amtsgericht Wiesbaden HRB 31541\nFE Consulting Solutions and Engineering UG (haftungsbeschränkt) – Hochheim am Main",
      "type": "Löschungsankündigung",
      "state": "Hessen",
      "amtsgericht": "Amtsgericht Wiesbaden",
      "registernummer": "HRB 31541",
      "registerart": "HRB",
      "company_name": "FE Consulting Solutions and Engineering UG (haftungsbeschränkt)",
      "company_seat": "Hochheim am Main",
      "details": "24.09.2025 (Bekanntmachungsdatum)\n\nHessen Amtsgericht Wiesbaden HRB 31541\nLöschungsankündigung\n\nFE Consulting Solutions and Engineering UG (haftungsbeschränkt)\nGesellschaft mit beschränkter Haftung\nHochheim am Main\n\nDas Registergericht beabsichtigt die im Handelsregister eingetragene Gesellschaft von Amts wegen nach § 394 FamFG zu löschen. Die Frist zur Erhebung eines Widerspruchs gegen die beabsichtigte Löschung wird auf 3 Monate festgesetzt."
    },
    {
      "date": "2025-09-24",
      "id": "131339",
      "original_text": "Löschungsankündigung\nHessen Amtsgericht Darmstadt HRB 100657\nHouston Analytics GmbH – Darmstadt",
      "type": "Löschungsankündigung",
      "state": "Hessen",
      "amtsgericht": "Amtsgericht Darmstadt",
      "registernummer": "HRB 100657",
      "registerart": "HRB",
      "company_name": "Houston Analytics GmbH",
      "company_seat": "Darmstadt",
      "details": "24.09.2025 (Bekanntmachungsdatum)\n\nHessen Amtsgericht Darmstadt HRB 100657\nLöschungsankündigung\n\nHouston Analytics GmbH\nGesellschaft mit beschränkter Haftung\nDarmstadt\n\nDas Registergericht beabsichtigt die im Handelsregister eingetragene Gesellschaft von Amts wegen nach § 394 FamFG zu löschen. Die Frist zur Erhebung eines Widerspruchs gegen die beabsichtigte Löschung wird auf 3 Monate festgesetzt."
    },
    {
      "date": "2025-09-24",
      "id": "131340",
      "original_text": "Registerbekanntmachung nach dem Umwandlungsgesetz\nHessen Amtsgericht Frankfurt am Main HRB 46794\nGrayling Deutschland GmbH – Frankfurt am Main",
      "type": "Registerbekanntmachung nach dem Umwandlungsgesetz",
      "state": "Hessen",
      "amtsgericht": "Amtsgericht Frankfurt am Main",
      "registernummer": "HRB 46794",
      "registerart": "HRB",
      "company_name": "Grayling Deutschland GmbH",
      "company_seat": "Frankfurt am Main",
      "details": "24.09.2025 (Bekanntmachungsdatum)\n\nHessen Amtsgericht Frankfurt am Main HRB 46794\nRegisterbekanntmachung nach dem Umwandlungsgesetz 24.09.2025 (Eintragungsdatum)\n\nGrayling Deutschland GmbH\nGesellschaft mit beschränkter Haftung\nFrankfurt am Main\n\nDen Gläubigern der an der Verschmelzung beteiligten Rechtsträger ist, wenn sie binnen sechs Monaten nach dem Tag, an dem die Eintragung der Verschmelzung in das Register des Sitzes desjenigen Rechtsträgers, dessen Gläubiger sie sind, nach § 19 Absatz 3 UmwG bekannt gemacht worden ist, ihren Anspruch nach Grund und Höhe schriftlich anmelden, Sicherheit zu leisten, soweit sie nicht Befriedigung verlangen können. Dieses Recht steht den Gläubigern jedoch nur zu, wenn sie glaubhaft machen, dass durch die Verschmelzung die Erfüllung ihrer Forderung gefährdet wird."
    },
    {
      "date": "2025-09-24",
      "id": "131341",
      "original_text": "Registerbekanntmachung nach dem Umwandlungsgesetz\nHessen Amtsgericht Frankfurt am Main HRB 31040\nUBS Asset Management (Deutschland) GmbH – Frankfurt am Main",
      "type": "Registerbekanntmachung nach dem Umwandlungsgesetz",
      "state": "Hessen",
      "amtsgericht": "Amtsgericht Frankfurt am Main",
      "registernummer": "HRB 31040",
      "registerart": "HRB",
      "company_name": "UBS Asset Management (Deutschland) GmbH",
      "company_seat": "Frankfurt am Main",
      "details": "24.09.2025 (Bekanntmachungsdatum)\n\nHessen Amtsgericht Frankfurt am Main HRB 31040\nRegisterbekanntmachung nach dem Umwandlungsgesetz 24.09.2025 (Eintragungsdatum)\n\nUBS Asset Management (Deutschland) GmbH\nGesellschaft mit beschränkter Haftung\nFrankfurt am Main\n\nDen Gläubigern der an der grenzüberschreitenden Verschmelzung beteiligten übernehmenden Rechtsträger ist, wenn sie binnen sechs Monaten nach dem Tag, an dem die Eintragung der Verschmelzung in das Register des Sitzes desjenigen Rechtsträgers, dessen Gläubiger sie sind, nach § 19 Absatz 3 UmwG als bekanntgemacht gilt, ihren Anspruch nach Grund und Höhe schriftlich anmelden, Sicherheit zu leisten, soweit sie nicht Befriedigung verlangen können.\n\nDieses Recht steht den Gläubigern jedoch nur zu, wenn sie glaubhaft machen, dass durch die Verschmelzung die Erfüllung ihrer Forderung gefährdet wird."
    },
    {
      "date": "2025-09-24",
      "id": "131342",
      "original_text": "Registerbekanntmachung nach dem Umwandlungsgesetz\nHessen Amtsgericht Frankfurt am Main HRB 26537\nPP LIVE GmbH – Frankfurt am Main",
      "type": "Registerbekanntmachung nach dem Umwandlungsgesetz",
      "state": "Hessen",
      "amtsgericht": "Amtsgericht Frankfurt am Main",
      "registernummer": "HRB 26537",
      "registerart": "HRB",
      "company_name": "PP LIVE GmbH",
      "company_seat": "Frankfurt am Main",
      "details": "24.09.2025 (Bekanntmachungsdatum)\n\nHessen Amtsgericht Frankfurt am Main HRB 26537\nRegisterbekanntmachung nach dem Umwandlungsgesetz 24.09.2025 (Eintragungsdatum)\n\nPP LIVE GmbH\nGesellschaft mit beschränkter Haftung\nFrankfurt am Main\n\nDen Gläubigern der an der Verschmelzung beteiligten Rechtsträger ist, wenn sie binnen sechs Monaten nach dem Tag, an dem die Eintragung der Verschmelzung in das Register des Sitzes desjenigen Rechtsträgers, dessen Gläubiger sie sind, nach § 19 Absatz 3 UmwG bekannt gemacht worden ist, ihren Anspruch nach Grund und Höhe schriftlich anmelden, Sicherheit zu leisten, soweit sie nicht Befriedigung verlangen können. Dieses Recht steht den Gläubigern jedoch nur zu, wenn sie glaubhaft machen, dass durch die Verschmelzung die Erfüllung ihrer Forderung gefährdet wird."
    },
    {
      "date": "2025-09-24",
      "id": "131343",
      "original_text": "Registerbekanntmachung nach dem Umwandlungsgesetz\nHessen Amtsgericht Bad Homburg v.d.H. HRB 15872\nM5 BV Beteiligungs GmbH – Bad Homburg v. d. Höhe",
      "type": "Registerbekanntmachung nach dem Umwandlungsgesetz",
      "state": "Hessen",
      "amtsgericht": "Amtsgericht Bad Homburg v.d.H.",
      "registernummer": "HRB 15872",
      "registerart": "HRB",
      "company_name": "M5 BV Beteiligungs GmbH",
      "company_seat": "Bad Homburg v. d. Höhe",
      "details": "24.09.2025 (Bekanntmachungsdatum)\n\nHessen Amtsgericht Bad Homburg v.d.H. HRB 15872\nRegisterbekanntmachung nach dem Umwandlungsgesetz 24.09.2025 (Eintragungsdatum)\n\nM5 BV Beteiligungs GmbH\nGesellschaft mit beschränkter Haftung\nBad Homburg v. d. Höhe\n\nDen Gläubigern der an der Verschmelzung beteiligten Rechtsträger ist, wenn sie binnen sechs Monaten nach dem Tag, an dem die Eintragung der Verschmelzung in das Register des Sitzes desjenigen Rechtsträgers, dessen Gläubiger sie sind, nach § 19 Absatz 3 UmwG bekannt gemacht worden ist, ihren Anspruch nach Grund und Höhe schriftlich anmelden, Sicherheit zu leisten, soweit sie nicht Befriedigung verlangen können. Dieses Recht steht den Gläubigern jedoch nur zu, wenn sie glaubhaft machen, dass durch die Verschmelzung die Erfüllung ihrer Forderung gefährdet wird."
    },
    {
      "date": "2025-09-24",
      "id": "131344",
      "original_text": "Registerbekanntmachung nach dem Umwandlungsgesetz\nHessen Amtsgericht Bad Homburg v.d.H. HRB 11117\nM5Invest GmbH – Bad Homburg v.d.Höhe",
      "type": "Registerbekanntmachung nach dem Umwandlungsgesetz",
      "state": "Hessen",
      "amtsgericht": "Amtsgericht Bad Homburg v.d.H.",
      "registernummer": "HRB 11117",
      "registerart": "HRB",
      "company_name": "M5Invest GmbH",
      "company_seat": "Bad Homburg v.d.Höhe",
      "details": "24.09.2025 (Bekanntmachungsdatum)\n\nHessen Amtsgericht Bad Homburg v.d.H. HRB 11117\nRegisterbekanntmachung nach dem Umwandlungsgesetz 24.09.2025 (Eintragungsdatum)\n\nM5Invest GmbH\nGesellschaft mit beschränkter Haftung\nBad Homburg v.d.Höhe\n\nDen Gläubigern der an der Verschmelzung beteiligten Rechtsträger ist, wenn sie binnen sechs Monaten nach dem Tag, an dem die Eintragung der Verschmelzung in das Register des Sitzes desjenigen Rechtsträgers, dessen Gläubiger sie sind, nach § 19 Absatz 3 UmwG bekannt gemacht worden ist, ihren Anspruch nach Grund und Höhe schriftlich anmelden, Sicherheit zu leisten, soweit sie nicht Befriedigung verlangen können. Dieses Recht steht den Gläubigern jedoch nur zu, wenn sie glaubhaft machen, dass durch die Verschmelzung die Erfüllung ihrer Forderung gefährdet wird."
    },
    {
      "date": "2025-09-24",
      "id": "131345",
      "original_text": "Registerbekanntmachung nach dem Umwandlungsgesetz\nHessen Amtsgericht Bad Hersfeld HRA 1981\nSimulatortechnik Danz GmbH & Co. KG – Philippsthal",
      "type": "Registerbekanntmachung nach dem Umwandlungsgesetz",
      "state": "Hessen",
      "amtsgericht": "Amtsgericht Bad Hersfeld",
      "registernummer": "HRA 1981",
      "registerart": "HRA",
      "company_name": "Simulatortechnik Danz GmbH & Co. KG",
      "company_seat": "Philippsthal",
      "details": "24.09.2025 (Bekanntmachungsdatum)\n\nHessen Amtsgericht Bad Hersfeld HRA 1981\nRegisterbekanntmachung nach dem Umwandlungsgesetz 24.09.2025 (Eintragungsdatum)\n\nSimulatortechnik Danz GmbH & Co. KG\nKommanditgesellschaft\nPhilippsthal\n\nDen Gläubigern der an der Ausgliederung beteiligten Rechtsträger ist, wenn sie binnen sechs Monaten nach dem Tag, an dem die Eintragung der Ausgliederung in das Register des Sitzes desjenigen Rechtsträgers, dessen Gläubiger sie sind, nach §§ 125, 19 Absatz 3 UmwG bekannt gemacht worden ist, ihren Anspruch nach Grund und Höhe schriftlich anmelden, Sicherheit zu leisten, soweit sie nicht Befriedigung verlangen können. Dieses Recht steht den Gläubigern jedoch nur zu, wenn sie glaubhaft machen, dass durch die Ausgliederung die Erfüllung ihrer Forderung gefährdet wird."
    },
    {
      "date": "2025-09-24",
      "id": "131346",
      "original_text": "Sonstige Registerbekanntmachung\nHessen Amtsgericht Fritzlar VR 3903\nInteressengemeinschaft Oberurff-Schiffelborn e. V. – Oberurff-Schiffelborn",
      "type": "Sonstige Registerbekanntmachung",
      "state": "Hessen",
      "amtsgericht": "Amtsgericht Fritzlar",
      "registernummer": "VR 3903",
      "registerart": "VR",
      "company_name": "Interessengemeinschaft Oberurff-Schiffelborn e. V.",
      "company_seat": "Oberurff-Schiffelborn",
      "details": "24.09.2025 (Bekanntmachungsdatum)\n\nHessen Amtsgericht Fritzlar VR 3903\nSonstige Registerbekanntmachung 24.09.2025 (Eintragungsdatum)\n\nInteressengemeinschaft Oberurff-Schiffelborn e. V.\neingetragener Verein\nOberurff-Schiffelborn\n\nDer Verein ist aufgelöst."
    },
    {
      "date": "2025-09-24",
      "id": "131347",
      "original_text": "Einreichung neuer Dokumente\nHessen Amtsgericht Frankfurt am Main HRB 82129\nAir Liquide Global E&C Solutions Germany GmbH – Frankfurt am Main",
      "type": "Einreichung neuer Dokumente",
      "state": "Hessen",
      "amtsgericht": "Amtsgericht Frankfurt am Main",
      "registernummer": "HRB 82129",
      "registerart": "HRB",
      "company_name": "Air Liquide Global E&C Solutions Germany GmbH",
      "company_seat": "Frankfurt am Main",
      "details": "24.09.2025 (Bekanntmachungsdatum)\n\nHessen Amtsgericht Frankfurt am Main HRB 82129\nEinreichung neuer Dokumente\n\nAir Liquide Global E&C Solutions Germany GmbH\nGesellschaft mit beschränkter Haftung\nFrankfurt am Main\n\nDurch eine Änderung in den Personen der Aufsichtsratsmitglieder ist eine Liste der Mitglieder des Aufsichtsrates zum Handelsregister eingereicht worden."
    },
    {
      "date": "2025-09-24",
      "id": "131348",
      "original_text": "Registerbekanntmachung nach dem Umwandlungsgesetz\nHessen Amtsgericht Frankfurt am Main HRB 138396\nCredit Suisse Deutschland GmbH – Frankfurt am Main",
      "type": "Registerbekanntmachung nach dem Umwandlungsgesetz",
      "state": "Hessen",
      "amtsgericht": "Amtsgericht Frankfurt am Main",
      "registernummer": "HRB 138396",
      "registerart": "HRB",
      "company_name": "Credit Suisse Deutschland GmbH",
      "company_seat": "Frankfurt am Main",
      "details": "24.09.2025 (Bekanntmachungsdatum)\n\nHessen Amtsgericht Frankfurt am Main HRB 138396\nRegisterbekanntmachung nach dem Umwandlungsgesetz 24.09.2025 (Eintragungsdatum)\n\nCredit Suisse Deutschland GmbH\nGesellschaft mit beschränkter Haftung\nFrankfurt am Main\n\nDie Gesellschaft hat den Entwurf des Verschmelzungsvertrages zwischen ihr und der UBS Europe SE mit Sitz in Frankfurt am Main (HRB 107046) beim Amtsgericht Frankfurt am Main (Registergericht) zur Einsichtnahme eingereicht."
    },
    {
      "date": "2025-09-24",
      "id": "131349",
      "original_text": "Registerbekanntmachung nach dem Umwandlungsgesetz\nHessen Amtsgericht Bad Hersfeld HRA 1978\nHolger Danz e.K. – Philippsthal",
      "type": "Registerbekanntmachung nach dem Umwandlungsgesetz",
      "state": "Hessen",
      "amtsgericht": "Amtsgericht Bad Hersfeld",
      "registernummer": "HRA 1978",
      "registerart": "HRA",
      "company_name": "Holger Danz e.K.",
      "company_seat": "Philippsthal",
      "details": "24.09.2025 (Bekanntmachungsdatum)\n\nHessen Amtsgericht Bad Hersfeld HRA 1978\nRegisterbekanntmachung nach dem Umwandlungsgesetz 24.09.2025 (Eintragungsdatum)\n\nHolger Danz e.K.\nEinzelkaufmann / Einzelkauffrau\nPhilippsthal\n\nDen Gläubigern der an der Ausgliederung beteiligten Rechtsträger ist, wenn sie binnen sechs Monaten nach dem Tag, an dem die Eintragung der Ausgliederung in das Register des Sitzes desjenigen Rechtsträgers, dessen Gläubiger sie sind, nach §§ 125, 19 Absatz 3 UmwG bekannt gemacht worden ist, ihren Anspruch nach Grund und Höhe schriftlich anmelden, Sicherheit zu leisten, soweit sie nicht Befriedigung verlangen können. Dieses Recht steht den Gläubigern jedoch nur zu, wenn sie glaubhaft machen, dass durch die Ausgliederung die Erfüllung ihrer Forderung gefährdet wird."
    },
    {
      "date": "2025-09-24",
      "id": "131350",
      "original_text": "Registerbekanntmachung nach dem Umwandlungsgesetz\nHessen Amtsgericht Darmstadt HRB 104936\nID Logistics GmbH – Griesheim",
      "type": "Registerbekanntmachung nach dem Umwandlungsgesetz",
      "state": "Hessen",
      "amtsgericht": "Amtsgericht Darmstadt",
      "registernummer": "HRB 104936",
      "registerart": "HRB",
      "company_name": "ID Logistics GmbH",
      "company_seat": "Griesheim",
      "details": "24.09.2025 (Bekanntmachungsdatum)\n\nHessen Amtsgericht Darmstadt HRB 104936\nRegisterbekanntmachung nach dem Umwandlungsgesetz 24.09.2025 (Eintragungsdatum)\n\nID Logistics GmbH\nGesellschaft mit beschränkter Haftung\nGriesheim\n\nDen Gläubigern der an der Verschmelzung beteiligten Rechtsträger ist, wenn sie binnen sechs Monaten nach dem Tag, an dem die Eintragung der Verschmelzung in das Register des Sitzes derjenigen Rechtsträger deren Gläubiger sie sind, nach § 19 Absatz 3 UmwG bekannt gemacht worden ist, ihren Anspruch nach Grund und Höhe schriftlich anmelden, Sicherheit zu leisten, soweit sie nicht Befriedigung verlangen können. Dieses Recht steht den Gläubigern jedoch nur zu, wenn sie glaubhaft machen, dass durch die Verschmelzung die Erfüllung ihrer Forderung gefährdet wird."
    },
    {
      "date": "2025-09-24",
      "id": "131351",
      "original_text": "Registerbekanntmachung nach dem Umwandlungsgesetz\nHessen Amtsgericht Frankfurt am Main HRB 32914\nGrayling Deutschland GmbH – Frankfurt am Main",
      "type": "Registerbekanntmachung nach dem Umwandlungsgesetz",
      "state": "Hessen",
      "amtsgericht": "Amtsgericht Frankfurt am Main",
      "registernummer": "HRB 32914",
      "registerart": "HRB",
      "company_name": "Grayling Deutschland GmbH",
      "company_seat": "Frankfurt am Main",
      "details": "24.09.2025 (Bekanntmachungsdatum)\n\nHessen Amtsgericht Frankfurt am Main HRB 32914\nRegisterbekanntmachung nach dem Umwandlungsgesetz 24.09.2025 (Eintragungsdatum)\n\nGrayling Deutschland GmbH\nGesellschaft mit beschränkter Haftung\nFrankfurt am Main\n\nDen Gläubigern der an der Verschmelzung beteiligten Rechtsträger ist, wenn sie binnen sechs Monaten nach dem Tag, an dem die Eintragung der Verschmelzung in das Register des Sitzes desjenigen Rechtsträgers, dessen Gläubiger sie sind, nach § 19 Absatz 3 UmwG bekannt gemacht worden ist, ihren Anspruch nach Grund und Höhe schriftlich anmelden, Sicherheit zu leisten, soweit sie nicht Befriedigung verlangen können. Dieses Recht steht den Gläubigern jedoch nur zu, wenn sie glaubhaft machen, dass durch die Verschmelzung die Erfüllung ihrer Forderung gefährdet wird."
    },
    {
      "date": "2025-09-24",
      "id": "131352",
      "original_text": "Registerbekanntmachung nach dem Umwandlungsgesetz\nHessen Amtsgericht Wiesbaden HRA 10633\nDreilich Finance & Credit Kreditversicherungsmakler e.K. – Wiesbaden",
      "type": "Registerbekanntmachung nach dem Umwandlungsgesetz",
      "state": "Hessen",
      "amtsgericht": "Amtsgericht Wiesbaden",
      "registernummer": "HRA 10633",
      "registerart": "HRA",
      "company_name": "Dreilich Finance & Credit Kreditversicherungsmakler e.K.",
      "company_seat": "Wiesbaden",
      "details": "24.09.2025 (Bekanntmachungsdatum)\n\nHessen Amtsgericht Wiesbaden HRA 10633\nRegisterbekanntmachung nach dem Umwandlungsgesetz 24.09.2025 (Eintragungsdatum)\n\nDreilich Finance & Credit Kreditversicherungsmakler e.K.\nEinzelkaufmann / Einzelkauffrau\nWiesbaden\n\nDen Gläubigern der an der Ausgliederung beteiligten Rechtsträger ist, wenn sie binnen sechs Monaten nach dem Tag, an dem die Eintragung der Ausgliederung in das Register des Sitzes derjenigen Rechtsträger deren Gläubiger sie sind, nach §§ 125, 19 Absatz 3 UmwG bekannt gemacht worden ist, ihren Anspruch nach Grund und Höhe schriftlich anmelden, Sicherheit zu leisten, soweit sie nicht Befriedigung verlangen können. Dieses Recht steht den Gläubigern jedoch nur zu, wenn sie glaubhaft machen, dass durch die Ausgliederung die Erfüllung ihrer Forderung gefährdet wird."
    }
  ]
}