{
  "date": "2025-09-07",
  "date_of_scrape": "2025-10-26T14:21:34.776Z",
  "tool_version": "0.2.0",
  "number_of_announcements": 2,
  "announcements": [
    {
      "date": "2025-09-07",
      "id": "127489",
      "original_text": "Registerbekanntmachung nach dem Umwandlungsgesetz\nRheinland-Pfalz Amtsgericht Kaiserslautern HRB 3876\nArtemis Vermögensverwaltung GmbH – Enkenbach-Alsenborn",
      "type": "Registerbekanntmachung nach dem Umwandlungsgesetz",
      "state": "Rheinland-Pfalz",
      "amtsgericht": "Amtsgericht Kaiserslautern",
      "registernummer": "HRB 3876",
      "registerart": "HRB",
      "company_name": "Artemis Vermögensverwaltung GmbH",
      "company_seat": "Enkenbach-Alsenborn",
      "details": "07.09.2025 (Bekanntmachungsdatum)\n\nRheinland-Pfalz Amtsgericht Kaiserslautern HRB 3876\nRegisterbekanntmachung nach dem Umwandlungsgesetz 07.09.2025 (Eintragungsdatum)\n\nArtemis Vermögensverwaltung GmbH\nGesellschaft mit beschränkter Haftung\nEnkenbach-Alsenborn\n\nAls nicht eingetragen wird veröffentlicht: Den Gläubigern der an der Verschmelzung beteiligten Rechtsträger ist, wenn sie binnen sechs Monaten nach dem Tag, an dem die Eintragung der Verschmelzung in das Register des Sitzes desjenigen Rechtsträgers, dessen Gläubiger sie sind, nach § 19 Abs. 3 UmwG als bekannt gemacht gilt, ihren Anspruch nach Grund und Höhe schriftlich anmelden, Sicherheit zu leisten, soweit sie nicht Befriedigung verlangen können. Dieses Recht steht den Gläubigern jedoch nur zu, wenn sie glaubhaft machen, dass durch die Verschmelzung die Erfüllung der Forderung gefährdet wird."
    },
    {
      "date": "2025-09-07",
      "id": "127490",
      "original_text": "Registerbekanntmachung nach dem Umwandlungsgesetz\nNordrhein-Westfalen Amtsgericht Düsseldorf HRB 107812\nKonecranes Port Services GmbH – Düsseldorf",
      "type": "Registerbekanntmachung nach dem Umwandlungsgesetz",
      "state": "Nordrhein-Westfalen",
      "amtsgericht": "Amtsgericht Düsseldorf",
      "registernummer": "HRB 107812",
      "registerart": "HRB",
      "company_name": "Konecranes Port Services GmbH",
      "company_seat": "Düsseldorf",
      "details": "07.09.2025 (Bekanntmachungsdatum)\n\nNordrhein-Westfalen Amtsgericht Düsseldorf HRB 107812\nRegisterbekanntmachung nach dem Umwandlungsgesetz 07.09.2025 (Eintragungsdatum)\n\nKonecranes Port Services GmbH\nGesellschaft mit beschränkter Haftung\nDüsseldorf\n\nDen Gläubigern der an der Abspaltung beteiligten Rechtsträger ist, wenn sie binnen sechs Monaten nach dem Tag, an dem die Eintragung der Abspaltung in das Register des Sitzes desjenigen Rechtsträgers, dessen Gläubiger sie sind, nach § 19 Absatz 3 UmwG als bekanntgemacht gilt, ihren Anspruch nach Grund und Höhe schriftlich anmelden, Sicherheit zu leisten, soweit sie nicht Befriedigung verlangen können. Dieses Recht steht den Gläubigern jedoch nur zu, wenn sie glaubhaft machen, dass durch die Abspaltung die Erfüllung ihrer Forderung gefährdet wird."
    }
  ]
}