{
  "date": "2025-09-18",
  "date_of_scrape": "2025-10-27T10:47:32.936Z",
  "tool_version": "0.2.0",
  "number_of_announcements": 284,
  "announcements": [
    {
      "date": "2025-09-18",
      "id": "130106",
      "original_text": "Registerbekanntmachung nach dem Umwandlungsgesetz\nBayern Amtsgericht Weiden i. d. OPf. HRA 3324\nWITRON Logistik + Informatik GmbH & Co. KG – Parkstein",
      "type": "Registerbekanntmachung nach dem Umwandlungsgesetz",
      "state": "Bayern",
      "amtsgericht": "Amtsgericht Weiden i. d. OPf.",
      "registernummer": "HRA 3324",
      "registerart": "HRA",
      "company_name": "WITRON Logistik + Informatik GmbH & Co. KG",
      "company_seat": "Parkstein",
      "details": "18.09.2025 (Bekanntmachungsdatum)\n\nBayern Amtsgericht Weiden i. d. OPf. HRA 3324\nRegisterbekanntmachung nach dem Umwandlungsgesetz 17.09.2025 (Eintragungsdatum)\n\nWITRON Logistik + Informatik GmbH & Co. KG\nKommanditgesellschaft\nParkstein\n\nDen Gläubigern des formwechselnden Rechtsträgers ist, wenn sie binnen sechs Monaten nach dem Tag, an dem die Eintragung des Formwechsels nach § 201 UmwG als bekannt gemacht gilt, ihren Anspruch nach Grund und Höhe in Textform anmelden, Sicherheit zu leisten, soweit sie nicht Befriedigung verlangen können. Dieses Recht steht den Gläubigern jedoch nur zu, wenn sie glaubhaft machen, dass durch den Formwechsel die Erfüllung ihrer Forderung gefährdet wird."
    },
    {
      "date": "2025-09-18",
      "id": "130107",
      "original_text": "Registerbekanntmachung nach dem Umwandlungsgesetz\nBayern Amtsgericht Nürnberg HRB 13333\nKPK Consulting GmbH – Schwabach",
      "type": "Registerbekanntmachung nach dem Umwandlungsgesetz",
      "state": "Bayern",
      "amtsgericht": "Amtsgericht Nürnberg",
      "registernummer": "HRB 13333",
      "registerart": "HRB",
      "company_name": "KPK Consulting GmbH",
      "company_seat": "Schwabach",
      "details": "18.09.2025 (Bekanntmachungsdatum)\n\nBayern Amtsgericht Nürnberg HRB 13333\nRegisterbekanntmachung nach dem Umwandlungsgesetz 17.09.2025 (Eintragungsdatum)\n\nKPK Consulting GmbH\nGesellschaft mit beschränkter Haftung\nSchwabach\n\nDen Gläubigern der an der Verschmelzung beteiligten Rechtsträger ist, wenn sie binnen sechs Monaten nach dem Tag, an dem die Eintragung der Verschmelzung in das Register des Sitzes desjenigen Rechtsträgers, dessen Gläubiger sie sind, nach § 19 Abs. 3 UmwG als bekannt gemacht gilt, ihren Anspruch nach Grund und Höhe in Textform anmelden, Sicherheit zu leisten, soweit sie nicht Befriedigung verlangen können. Dieses Recht steht den Gläubigern jedoch nur zu, wenn sie glaubhaft machen, dass durch die Verschmelzung die Erfüllung ihrer Forderung gefährdet wird."
    },
    {
      "date": "2025-09-18",
      "id": "130108",
      "original_text": "Registerbekanntmachung nach dem Umwandlungsgesetz\nBayern Amtsgericht München HRB 244558\nDr. Schauer und Margraf Steuerberatungsgesellschaft mbH – Mittenwald",
      "type": "Registerbekanntmachung nach dem Umwandlungsgesetz",
      "state": "Bayern",
      "amtsgericht": "Amtsgericht München",
      "registernummer": "HRB 244558",
      "registerart": "HRB",
      "company_name": "Dr. Schauer und Margraf Steuerberatungsgesellschaft mbH",
      "company_seat": "Mittenwald",
      "details": "18.09.2025 (Bekanntmachungsdatum)\n\nBayern Amtsgericht München HRB 244558\nRegisterbekanntmachung nach dem Umwandlungsgesetz 17.09.2025 (Eintragungsdatum)\n\nDr. Schauer und Margraf Steuerberatungsgesellschaft mbH\nGesellschaft mit beschränkter Haftung\nMittenwald\n\nDen Gläubigern des formwechselnden Rechtsträgers ist, wenn sie binnen sechs Monaten nach dem Tag, an dem die Eintragung des Formwechsels nach § 201 UmwG als bekannt gemacht gilt, ihren Anspruch nach Grund und Höhe in Textform anmelden, Sicherheit zu leisten, soweit sie nicht Befriedigung verlangen können. Dieses Recht steht den Gläubigern jedoch nur zu, wenn sie glaubhaft machen, dass durch den Formwechsel die Erfüllung ihrer Forderung gefährdet wird."
    },
    {
      "date": "2025-09-18",
      "id": "130109",
      "original_text": "Registerbekanntmachung nach dem Umwandlungsgesetz\nBayern Amtsgericht Augsburg HRB 38354\nWithau GmbH – Wehringen",
      "type": "Registerbekanntmachung nach dem Umwandlungsgesetz",
      "state": "Bayern",
      "amtsgericht": "Amtsgericht Augsburg",
      "registernummer": "HRB 38354",
      "registerart": "HRB",
      "company_name": "Withau GmbH",
      "company_seat": "Wehringen",
      "details": "18.09.2025 (Bekanntmachungsdatum)\n\nBayern Amtsgericht Augsburg HRB 38354\nRegisterbekanntmachung nach dem Umwandlungsgesetz 17.09.2025 (Eintragungsdatum)\n\nWithau GmbH\nGesellschaft mit beschränkter Haftung\nWehringen\n\nDen Gläubigern der an der Verschmelzung beteiligten Rechtsträger ist, wenn sie binnen sechs Monaten nach dem Tag, an dem die Eintragung der Verschmelzung in das Register des Sitzes desjenigen Rechtsträgers, dessen Gläubiger sie sind, nach § 19 Abs. 3 UmwG als bekannt gemacht gilt, ihren Anspruch nach Grund und Höhe in Textform anmelden, Sicherheit zu leisten, soweit sie nicht Befriedigung verlangen können. Dieses Recht steht den Gläubigern jedoch nur zu, wenn sie glaubhaft machen, dass durch die Verschmelzung die Erfüllung ihrer Forderung gefährdet wird."
    },
    {
      "date": "2025-09-18",
      "id": "130110",
      "original_text": "Sonstige Registerbekanntmachung\nBayern Amtsgericht Nürnberg HRB 26893\nZippel AG – Altdorf bei Nürnberg",
      "type": "Sonstige Registerbekanntmachung",
      "state": "Bayern",
      "amtsgericht": "Amtsgericht Nürnberg",
      "registernummer": "HRB 26893",
      "registerart": "HRB",
      "company_name": "Zippel AG",
      "company_seat": "Altdorf bei Nürnberg",
      "details": "18.09.2025 (Bekanntmachungsdatum)\n\nBayern Amtsgericht Nürnberg HRB 26893\nSonstige Registerbekanntmachung\n\nZippel AG\nAktiengesellschaft\nAltdorf bei Nürnberg\n\nDem Amtsgericht Nürnberg -Registergericht- ist eine Liste der Mitglieder des Aufsichtsrats eingereicht worden, § 106 AktG."
    },
    {
      "date": "2025-09-18",
      "id": "130111",
      "original_text": "Registerbekanntmachung nach dem Umwandlungsgesetz\nBayern Amtsgericht Fürth HRA 12471\nWollkontor - Nadelei und Genuß Inh. Susanne Preißler e. K. – Uttenreuth",
      "type": "Registerbekanntmachung nach dem Umwandlungsgesetz",
      "state": "Bayern",
      "amtsgericht": "Amtsgericht Fürth",
      "registernummer": "HRA 12471",
      "registerart": "HRA",
      "company_name": "Wollkontor - Nadelei und Genuß Inh. Susanne Preißler e. K.",
      "company_seat": "Uttenreuth",
      "details": "18.09.2025 (Bekanntmachungsdatum)\n\nBayern Amtsgericht Fürth HRA 12471\nRegisterbekanntmachung nach dem Umwandlungsgesetz 17.09.2025 (Eintragungsdatum)\n\nWollkontor - Nadelei und Genuß Inh. Susanne Preißler e. K.\nEinzelkaufmann / Einzelkauffrau\nUttenreuth\n\nDen Gläubigern der an der Verschmelzung beteiligten Rechtsträger ist, wenn sie binnen sechs Monaten nach dem Tag, an dem die Eintragung der Verschmelzung in das Register des Sitzes desjenigen Rechtsträgers, dessen Gläubiger sie sind, nach § 19 Abs. 3 UmwG als bekannt gemacht gilt, ihren Anspruch nach Grund und Höhe in Textform anmelden, Sicherheit zu leisten, soweit sie nicht Befriedigung verlangen können. Dieses Recht steht den Gläubigern jedoch nur zu, wenn sie glaubhaft machen, dass durch die Verschmelzung die Erfüllung ihrer Forderung gefährdet wird."
    },
    {
      "date": "2025-09-18",
      "id": "130112",
      "original_text": "Registerbekanntmachung nach dem Umwandlungsgesetz\nBayern Amtsgericht Würzburg HRA 8999\nRudi Bauer Logistik e.K. – Kist",
      "type": "Registerbekanntmachung nach dem Umwandlungsgesetz",
      "state": "Bayern",
      "amtsgericht": "Amtsgericht Würzburg",
      "registernummer": "HRA 8999",
      "registerart": "HRA",
      "company_name": "Rudi Bauer Logistik e.K.",
      "company_seat": "Kist",
      "details": "18.09.2025 (Bekanntmachungsdatum)\n\nBayern Amtsgericht Würzburg HRA 8999\nRegisterbekanntmachung nach dem Umwandlungsgesetz 17.09.2025 (Eintragungsdatum)\n\nRudi Bauer Logistik e.K.\nEinzelkaufmann / Einzelkauffrau\nKist\n\nDen Gläubigern der an der Ausgliederung beteiligten Rechtsträger ist, wenn sie binnen sechs Monaten nach dem Tag, an dem die Eintragung der Ausgliederung in das Register des Sitzes desjenigen Rechtsträgers, dessen Gläubiger sie sind, nach §§ 125, 19 Abs. 3 UmwG als bekannt gemacht gilt, ihren Anspruch nach Grund und Höhe in Textform anmelden, Sicherheit zu leisten, soweit sie nicht Befriedigung verlangen können. Dieses Recht steht den Gläubigern jedoch nur zu, wenn sie glaubhaft machen, dass durch die Ausgliederung die Erfüllung ihrer Forderung gefährdet wird."
    },
    {
      "date": "2025-09-18",
      "id": "130113",
      "original_text": "Registerbekanntmachung nach dem Umwandlungsgesetz\nBayern Amtsgericht München HRB 305643\nAichhof 2 GmbH – Pullach i.Isartal",
      "type": "Registerbekanntmachung nach dem Umwandlungsgesetz",
      "state": "Bayern",
      "amtsgericht": "Amtsgericht München",
      "registernummer": "HRB 305643",
      "registerart": "HRB",
      "company_name": "Aichhof 2 GmbH",
      "company_seat": "Pullach i.Isartal",
      "details": "18.09.2025 (Bekanntmachungsdatum)\n\nBayern Amtsgericht München HRB 305643\nRegisterbekanntmachung nach dem Umwandlungsgesetz 17.09.2025 (Eintragungsdatum)\n\nAichhof 2 GmbH\nGesellschaft mit beschränkter Haftung\nPullach i.Isartal\n\nDen Gläubigern der an der Spaltung beteiligten Rechtsträger ist, wenn sie binnen sechs Monaten nach dem Tag, an dem die Eintragung der Spaltung in das Register des Sitzes desjenigen Rechtsträgers, dessen Gläubiger sie sind, nach §§ 125, 19 Abs. 3 UmwG als bekannt gemacht gilt, ihren Anspruch nach Grund und Höhe in Textform anmelden, Sicherheit zu leisten, soweit sie nicht Befriedigung verlangen können. Dieses Recht steht den Gläubigern jedoch nur zu, wenn sie glaubhaft machen, dass durch die Spaltung die Erfüllung ihrer Forderung gefährdet wird."
    },
    {
      "date": "2025-09-18",
      "id": "130114",
      "original_text": "Registerbekanntmachung nach dem Umwandlungsgesetz\nBayern Amtsgericht München HRB 189427\nAichhof GmbH – Pullach i. Isartal",
      "type": "Registerbekanntmachung nach dem Umwandlungsgesetz",
      "state": "Bayern",
      "amtsgericht": "Amtsgericht München",
      "registernummer": "HRB 189427",
      "registerart": "HRB",
      "company_name": "Aichhof GmbH",
      "company_seat": "Pullach i. Isartal",
      "details": "18.09.2025 (Bekanntmachungsdatum)\n\nBayern Amtsgericht München HRB 189427\nRegisterbekanntmachung nach dem Umwandlungsgesetz 17.09.2025 (Eintragungsdatum)\n\nAichhof GmbH\nGesellschaft mit beschränkter Haftung\nPullach i. Isartal\n\nDen Gläubigern der an der Spaltung beteiligten Rechtsträger ist, wenn sie binnen sechs Monaten nach dem Tag, an dem die Eintragung der Spaltung in das Register des Sitzes desjenigen Rechtsträgers, dessen Gläubiger sie sind, nach §§ 125, 19 Abs. 3 UmwG als bekannt gemacht gilt, ihren Anspruch nach Grund und Höhe in Textform anmelden, Sicherheit zu leisten, soweit sie nicht Befriedigung verlangen können. Dieses Recht steht den Gläubigern jedoch nur zu, wenn sie glaubhaft machen, dass durch die Spaltung die Erfüllung ihrer Forderung gefährdet wird."
    },
    {
      "date": "2025-09-18",
      "id": "130115",
      "original_text": "Registerbekanntmachung nach dem Umwandlungsgesetz\nBayern Amtsgericht Fürth HRB 16794\nC. Schütz Verwaltungs GmbH – Erlangen",
      "type": "Registerbekanntmachung nach dem Umwandlungsgesetz",
      "state": "Bayern",
      "amtsgericht": "Amtsgericht Fürth",
      "registernummer": "HRB 16794",
      "registerart": "HRB",
      "company_name": "C. Schütz Verwaltungs GmbH",
      "company_seat": "Erlangen",
      "details": "18.09.2025 (Bekanntmachungsdatum)\n\nBayern Amtsgericht Fürth HRB 16794\nRegisterbekanntmachung nach dem Umwandlungsgesetz 17.09.2025 (Eintragungsdatum)\n\nC. Schütz Verwaltungs GmbH\nGesellschaft mit beschränkter Haftung\nErlangen\n\nDen Gläubigern der an der Verschmelzung beteiligten Rechtsträger ist, wenn sie binnen sechs Monaten nach dem Tag, an dem die Eintragung der Verschmelzung in das Register des Sitzes desjenigen Rechtsträgers, dessen Gläubiger sie sind, nach § 19 Abs. 3 UmwG als bekannt gemacht gilt, ihren Anspruch nach Grund und Höhe in Textform anmelden, Sicherheit zu leisten, soweit sie nicht Befriedigung verlangen können. Dieses Recht steht den Gläubigern jedoch nur zu, wenn sie glaubhaft machen, dass durch die Verschmelzung die Erfüllung ihrer Forderung gefährdet wird."
    },
    {
      "date": "2025-09-18",
      "id": "130116",
      "original_text": "Registerbekanntmachung nach dem Umwandlungsgesetz\nBayern Amtsgericht Ingolstadt HRB 10456\nBAUER Resources GmbH – Schrobenhausen",
      "type": "Registerbekanntmachung nach dem Umwandlungsgesetz",
      "state": "Bayern",
      "amtsgericht": "Amtsgericht Ingolstadt",
      "registernummer": "HRB 10456",
      "registerart": "HRB",
      "company_name": "BAUER Resources GmbH",
      "company_seat": "Schrobenhausen",
      "details": "18.09.2025 (Bekanntmachungsdatum)\n\nBayern Amtsgericht Ingolstadt HRB 10456\nRegisterbekanntmachung nach dem Umwandlungsgesetz 17.09.2025 (Eintragungsdatum)\n\nBAUER Resources GmbH\nGesellschaft mit beschränkter Haftung\nSchrobenhausen\n\nDen Gläubigern der an der Verschmelzung beteiligten Rechtsträger ist, wenn sie binnen sechs Monaten nach dem Tag, an dem die Eintragung der Verschmelzung in das Register des Sitzes desjenigen Rechtsträgers, dessen Gläubiger sie sind, nach § 19 Abs. 3 UmwG als bekannt gemacht gilt, ihren Anspruch nach Grund und Höhe in Textform anmelden, Sicherheit zu leisten, soweit sie nicht Befriedigung verlangen können. Dieses Recht steht den Gläubigern jedoch nur zu, wenn sie glaubhaft machen, dass durch die Verschmelzung die Erfüllung ihrer Forderung gefährdet wird."
    },
    {
      "date": "2025-09-18",
      "id": "130117",
      "original_text": "Registerbekanntmachung nach dem Umwandlungsgesetz\nBayern Amtsgericht München HRB 133076\nD.O.B. & Völk GmbH – Antdorf",
      "type": "Registerbekanntmachung nach dem Umwandlungsgesetz",
      "state": "Bayern",
      "amtsgericht": "Amtsgericht München",
      "registernummer": "HRB 133076",
      "registerart": "HRB",
      "company_name": "D.O.B. & Völk GmbH",
      "company_seat": "Antdorf",
      "details": "18.09.2025 (Bekanntmachungsdatum)\n\nBayern Amtsgericht München HRB 133076\nRegisterbekanntmachung nach dem Umwandlungsgesetz 17.09.2025 (Eintragungsdatum)\n\nD.O.B. & Völk GmbH\nGesellschaft mit beschränkter Haftung\nAntdorf\n\nDen Gläubigern der an der Verschmelzung beteiligten Rechtsträger ist, wenn sie binnen sechs Monaten nach dem Tag, an dem die Eintragung der Verschmelzung in das Register des Sitzes desjenigen Rechtsträgers, dessen Gläubiger sie sind, nach § 19 Abs. 3 UmwG als bekannt gemacht gilt, ihren Anspruch nach Grund und Höhe in Textform anmelden, Sicherheit zu leisten, soweit sie nicht Befriedigung verlangen können. Dieses Recht steht den Gläubigern jedoch nur zu, wenn sie glaubhaft machen, dass durch die Verschmelzung die Erfüllung ihrer Forderung gefährdet wird."
    },
    {
      "date": "2025-09-18",
      "id": "130118",
      "original_text": "Registerbekanntmachung nach dem Umwandlungsgesetz\nBayern Amtsgericht Landshut HRA 11777\nSEAC Invest 6 GmbH & Co. KG – Hebertsfelden",
      "type": "Registerbekanntmachung nach dem Umwandlungsgesetz",
      "state": "Bayern",
      "amtsgericht": "Amtsgericht Landshut",
      "registernummer": "HRA 11777",
      "registerart": "HRA",
      "company_name": "SEAC Invest 6 GmbH & Co. KG",
      "company_seat": "Hebertsfelden",
      "details": "18.09.2025 (Bekanntmachungsdatum)\n\nBayern Amtsgericht Landshut HRA 11777\nRegisterbekanntmachung nach dem Umwandlungsgesetz 17.09.2025 (Eintragungsdatum)\n\nSEAC Invest 6 GmbH & Co. KG\nKommanditgesellschaft\nHebertsfelden\n\nDen Gläubigern der an der Verschmelzung beteiligten Rechtsträger ist, wenn sie binnen sechs Monaten nach dem Tag, an dem die Eintragung der Verschmelzung in das Register des Sitzes desjenigen Rechtsträgers, dessen Gläubiger sie sind, nach § 19 Abs. 3 UmwG als bekannt gemacht gilt, ihren Anspruch nach Grund und Höhe in Textform anmelden, Sicherheit zu leisten, soweit sie nicht Befriedigung verlangen können. Dieses Recht steht den Gläubigern jedoch nur zu, wenn sie glaubhaft machen, dass durch die Verschmelzung die Erfüllung ihrer Forderung gefährdet wird."
    },
    {
      "date": "2025-09-18",
      "id": "130119",
      "original_text": "Registerbekanntmachung nach dem Umwandlungsgesetz\nBayern Amtsgericht Landshut HRB 3890\nSBL Landshut GmbH – Landshut",
      "type": "Registerbekanntmachung nach dem Umwandlungsgesetz",
      "state": "Bayern",
      "amtsgericht": "Amtsgericht Landshut",
      "registernummer": "HRB 3890",
      "registerart": "HRB",
      "company_name": "SBL Landshut GmbH",
      "company_seat": "Landshut",
      "details": "18.09.2025 (Bekanntmachungsdatum)\n\nBayern Amtsgericht Landshut HRB 3890\nRegisterbekanntmachung nach dem Umwandlungsgesetz 17.09.2025 (Eintragungsdatum)\n\nSBL Landshut GmbH\nGesellschaft mit beschränkter Haftung\nLandshut\n\nDen Gläubigern der an der Verschmelzung beteiligten Rechtsträger ist, wenn sie binnen sechs Monaten nach dem Tag, an dem die Eintragung der Verschmelzung in das Register des Sitzes desjenigen Rechtsträgers, dessen Gläubiger sie sind, nach § 19 Abs. 3 UmwG als bekannt gemacht gilt, ihren Anspruch nach Grund und Höhe in Textform anmelden, Sicherheit zu leisten, soweit sie nicht Befriedigung verlangen können. Dieses Recht steht den Gläubigern jedoch nur zu, wenn sie glaubhaft machen, dass durch die Verschmelzung die Erfüllung ihrer Forderung gefährdet wird."
    },
    {
      "date": "2025-09-18",
      "id": "130120",
      "original_text": "Registerbekanntmachung nach dem Umwandlungsgesetz\nBayern Amtsgericht München HRA 121525\nTwist e.K. – München",
      "type": "Registerbekanntmachung nach dem Umwandlungsgesetz",
      "state": "Bayern",
      "amtsgericht": "Amtsgericht München",
      "registernummer": "HRA 121525",
      "registerart": "HRA",
      "company_name": "Twist e.K.",
      "company_seat": "München",
      "details": "18.09.2025 (Bekanntmachungsdatum)\n\nBayern Amtsgericht München HRA 121525\nRegisterbekanntmachung nach dem Umwandlungsgesetz 17.09.2025 (Eintragungsdatum)\n\nTwist e.K.\nEinzelkaufmann / Einzelkauffrau\nMünchen\n\nDen Gläubigern der an der Ausgliederung beteiligten Rechtsträger ist, wenn sie binnen sechs Monaten nach dem Tag, an dem die Eintragung der Ausgliederung in das Register des Sitzes desjenigen Rechtsträgers, dessen Gläubiger sie sind, nach §§ 125, 19 Abs. 3 UmwG als bekannt gemacht gilt, ihren Anspruch nach Grund und Höhe in Textform anmelden, Sicherheit zu leisten, soweit sie nicht Befriedigung verlangen können. Dieses Recht steht den Gläubigern jedoch nur zu, wenn sie glaubhaft machen, dass durch die Ausgliederung die Erfüllung ihrer Forderung gefährdet wird."
    },
    {
      "date": "2025-09-18",
      "id": "130121",
      "original_text": "Löschungsankündigung\nBayern Amtsgericht München HRB 213837\nSGCON GmbH – München",
      "type": "Löschungsankündigung",
      "state": "Bayern",
      "amtsgericht": "Amtsgericht München",
      "registernummer": "HRB 213837",
      "registerart": "HRB",
      "company_name": "SGCON GmbH",
      "company_seat": "München",
      "details": "18.09.2025 (Bekanntmachungsdatum)\n\nBayern Amtsgericht München HRB 213837\nLöschungsankündigung 17.09.2025 (Eintragungsdatum)\n\nSGCON GmbH\nGesellschaft mit beschränkter Haftung\nMünchen\n\nDas Registergericht beabsichtigt, den im Handelsregister eingetragenen Geschäftsführer wegen fehlender Eignung nach § 395 FamFG zu löschen. Die Frist zur Erhebung eines Widerspruchs ist auf drei Monate festgesetzt."
    },
    {
      "date": "2025-09-18",
      "id": "130122",
      "original_text": "Registerbekanntmachung nach dem Umwandlungsgesetz\nBayern Amtsgericht Landshut HRB 14997\nKopp Garten- & Landschaftsbau GmbH – Hohenthann",
      "type": "Registerbekanntmachung nach dem Umwandlungsgesetz",
      "state": "Bayern",
      "amtsgericht": "Amtsgericht Landshut",
      "registernummer": "HRB 14997",
      "registerart": "HRB",
      "company_name": "Kopp Garten- & Landschaftsbau GmbH",
      "company_seat": "Hohenthann",
      "details": "18.09.2025 (Bekanntmachungsdatum)\n\nBayern Amtsgericht Landshut HRB 14997\nRegisterbekanntmachung nach dem Umwandlungsgesetz 17.09.2025 (Eintragungsdatum)\n\nKopp Garten- & Landschaftsbau GmbH\nGesellschaft mit beschränkter Haftung\nHohenthann"
    },
    {
      "date": "2025-09-18",
      "id": "130123",
      "original_text": "Registerbekanntmachung nach dem Umwandlungsgesetz\nBayern Amtsgericht Weiden i. d. OPf. GsR 80\nKI für Menschen eGbR – Erbendorf",
      "type": "Registerbekanntmachung nach dem Umwandlungsgesetz",
      "state": "Bayern",
      "amtsgericht": "Amtsgericht Weiden i. d. OPf.",
      "registernummer": "GsR 80",
      "registerart": "GsR",
      "company_name": "KI für Menschen eGbR",
      "company_seat": "Erbendorf",
      "details": "18.09.2025 (Bekanntmachungsdatum)\n\nBayern Amtsgericht Weiden i. d. OPf. GsR 80\nRegisterbekanntmachung nach dem Umwandlungsgesetz 17.09.2025 (Eintragungsdatum)\n\nKI für Menschen eGbR\nGesellschaft bürgerlichen Rechts\nErbendorf\n\nDen Gläubigern der an der Verschmelzung beteiligten Rechtsträger ist, wenn sie binnen sechs Monaten nach dem Tag, an dem die Eintragung der Verschmelzung in das Register des Sitzes desjenigen Rechtsträgers, dessen Gläubiger sie sind, nach § 19 Abs. 3 UmwG als bekannt gemacht gilt, ihren Anspruch nach Grund und Höhe in Textform anmelden, Sicherheit zu leisten, soweit sie nicht Befriedigung verlangen können. Dieses Recht steht den Gläubigern jedoch nur zu, wenn sie glaubhaft machen, dass durch die Verschmelzung die Erfüllung ihrer Forderung gefährdet wird."
    },
    {
      "date": "2025-09-18",
      "id": "130124",
      "original_text": "Registerbekanntmachung nach dem Umwandlungsgesetz\nBayern Amtsgericht Augsburg HRA 22035\nINNOMEDIA Videotechnik für Sportstätten GmbH & Co. KG – Friedberg",
      "type": "Registerbekanntmachung nach dem Umwandlungsgesetz",
      "state": "Bayern",
      "amtsgericht": "Amtsgericht Augsburg",
      "registernummer": "HRA 22035",
      "registerart": "HRA",
      "company_name": "INNOMEDIA Videotechnik für Sportstätten GmbH & Co. KG",
      "company_seat": "Friedberg",
      "details": "18.09.2025 (Bekanntmachungsdatum)\n\nBayern Amtsgericht Augsburg HRA 22035\nRegisterbekanntmachung nach dem Umwandlungsgesetz 17.09.2025 (Eintragungsdatum)\n\nINNOMEDIA Videotechnik für Sportstätten GmbH & Co. KG\nKommanditgesellschaft\nFriedberg\n\nDen Gläubigern der an der Ausgliederung beteiligten Rechtsträger ist, wenn sie binnen sechs Monaten nach dem Tag, an dem die Eintragung der Ausgliederung in das Register des Sitzes desjenigen Rechtsträgers, dessen Gläubiger sie sind, nach §§ 125, 19 Abs. 3 UmwG als bekannt gemacht gilt, ihren Anspruch nach Grund und Höhe in Textform anmelden, Sicherheit zu leisten, soweit sie nicht Befriedigung verlangen können. Dieses Recht steht den Gläubigern jedoch nur zu, wenn sie glaubhaft machen, dass durch die Ausgliederung die Erfüllung ihrer Forderung gefährdet wird."
    },
    {
      "date": "2025-09-18",
      "id": "130125",
      "original_text": "Registerbekanntmachung nach dem Umwandlungsgesetz\nBayern Amtsgericht Augsburg HRA 22023\nKarsten Mick - INNOMEDIA e.K. – Friedberg",
      "type": "Registerbekanntmachung nach dem Umwandlungsgesetz",
      "state": "Bayern",
      "amtsgericht": "Amtsgericht Augsburg",
      "registernummer": "HRA 22023",
      "registerart": "HRA",
      "company_name": "Karsten Mick - INNOMEDIA e.K.",
      "company_seat": "Friedberg",
      "details": "18.09.2025 (Bekanntmachungsdatum)\n\nBayern Amtsgericht Augsburg HRA 22023\nRegisterbekanntmachung nach dem Umwandlungsgesetz 17.09.2025 (Eintragungsdatum)\n\nKarsten Mick - INNOMEDIA e.K.\nEinzelkaufmann / Einzelkauffrau\nFriedberg\n\nDen Gläubigern der an der Ausgliederung beteiligten Rechtsträger ist, wenn sie binnen sechs Monaten nach dem Tag, an dem die Eintragung der Ausgliederung in das Register des Sitzes desjenigen Rechtsträgers, dessen Gläubiger sie sind, nach §§ 125, 19 Abs. 3 UmwG als bekannt gemacht gilt, ihren Anspruch nach Grund und Höhe in Textform anmelden, Sicherheit zu leisten, soweit sie nicht Befriedigung verlangen können. Dieses Recht steht den Gläubigern jedoch nur zu, wenn sie glaubhaft machen, dass durch die Ausgliederung die Erfüllung ihrer Forderung gefährdet wird."
    },
    {
      "date": "2025-09-18",
      "id": "130126",
      "original_text": "Registerbekanntmachung nach dem Umwandlungsgesetz\nBayern Amtsgericht Landshut HRB 14995\nGSJ Besitz GmbH – Triftern",
      "type": "Registerbekanntmachung nach dem Umwandlungsgesetz",
      "state": "Bayern",
      "amtsgericht": "Amtsgericht Landshut",
      "registernummer": "HRB 14995",
      "registerart": "HRB",
      "company_name": "GSJ Besitz GmbH",
      "company_seat": "Triftern",
      "details": "18.09.2025 (Bekanntmachungsdatum)\n\nBayern Amtsgericht Landshut HRB 14995\nRegisterbekanntmachung nach dem Umwandlungsgesetz 17.09.2025 (Eintragungsdatum)\n\nGSJ Besitz GmbH\nGesellschaft mit beschränkter Haftung\nTriftern"
    },
    {
      "date": "2025-09-18",
      "id": "130127",
      "original_text": "Sonstige Registerbekanntmachung\nBayern Amtsgericht Bayreuth HRB 6668\nMÜNCH Holding GmbH – Rugendorf",
      "type": "Sonstige Registerbekanntmachung",
      "state": "Bayern",
      "amtsgericht": "Amtsgericht Bayreuth",
      "registernummer": "HRB 6668",
      "registerart": "HRB",
      "company_name": "MÜNCH Holding GmbH",
      "company_seat": "Rugendorf",
      "details": "18.09.2025 (Bekanntmachungsdatum)\n\nBayern Amtsgericht Bayreuth HRB 6668\nSonstige Registerbekanntmachung 17.09.2025 (Eintragungsdatum)\n\nMÜNCH Holding GmbH\nGesellschaft mit beschränkter Haftung\nRugendorf\n\nDen Gläubigern der an der Spaltung beteiligten Rechtsträger ist, wenn sie binnen sechs Monaten nach dem Tag, an dem die Eintragung der Spaltung in das Register des Sitzes desjenigen Rechtsträgers, dessen Gläubiger sie sind, nach §§ 125, 19 Abs. 3 UmwG als bekannt gemacht gilt, ihren Anspruch nach Grund und Höhe in Textform anmelden, Sicherheit zu leisten, soweit sie nicht Befriedigung verlangen können. Dieses Recht steht den Gläubigern jedoch nur zu, wenn sie glaubhaft machen, dass durch die Spaltung die Erfüllung ihrer Forderung gefährdet wird."
    },
    {
      "date": "2025-09-18",
      "id": "130128",
      "original_text": "Registerbekanntmachung nach dem Umwandlungsgesetz\nBayern Amtsgericht Augsburg HRB 17784\nHof Verwaltungs GmbH – Augsburg",
      "type": "Registerbekanntmachung nach dem Umwandlungsgesetz",
      "state": "Bayern",
      "amtsgericht": "Amtsgericht Augsburg",
      "registernummer": "HRB 17784",
      "registerart": "HRB",
      "company_name": "Hof Verwaltungs GmbH",
      "company_seat": "Augsburg",
      "details": "18.09.2025 (Bekanntmachungsdatum)\n\nBayern Amtsgericht Augsburg HRB 17784\nRegisterbekanntmachung nach dem Umwandlungsgesetz 17.09.2025 (Eintragungsdatum)\n\nHof Verwaltungs GmbH\nGesellschaft mit beschränkter Haftung\nAugsburg\n\nDen Gläubigern der an der Verschmelzung beteiligten Rechtsträger ist, wenn sie binnen sechs Monaten nach dem Tag, an dem die Eintragung der Verschmelzung in das Register des Sitzes desjenigen Rechtsträgers, dessen Gläubiger sie sind, nach § 19 Abs. 3 UmwG als bekannt gemacht gilt, ihren Anspruch nach Grund und Höhe in Textform anmelden, Sicherheit zu leisten, soweit sie nicht Befriedigung verlangen können. Dieses Recht steht den Gläubigern jedoch nur zu, wenn sie glaubhaft machen, dass durch die Verschmelzung die Erfüllung ihrer Forderung gefährdet wird."
    },
    {
      "date": "2025-09-18",
      "id": "130129",
      "original_text": "Registerbekanntmachung nach dem Umwandlungsgesetz\nBayern Amtsgericht Fürth HRB 18524\nWollkontor GmbH - Nadelei und Genuß – Uttenreuth",
      "type": "Registerbekanntmachung nach dem Umwandlungsgesetz",
      "state": "Bayern",
      "amtsgericht": "Amtsgericht Fürth",
      "registernummer": "HRB 18524",
      "registerart": "HRB",
      "company_name": "Wollkontor GmbH - Nadelei und Genuß",
      "company_seat": "Uttenreuth",
      "details": "18.09.2025 (Bekanntmachungsdatum)\n\nBayern Amtsgericht Fürth HRB 18524\nRegisterbekanntmachung nach dem Umwandlungsgesetz 17.09.2025 (Eintragungsdatum)\n\nWollkontor GmbH - Nadelei und Genuß\nGesellschaft mit beschränkter Haftung\nUttenreuth\n\nDen Gläubigern #dv.auswahl(Text=\"Bitte zutreffendes auswählen:\",Eingabe=\n\n\"der an der Verschmelzung beteiligten Rechtsträger ist, wenn sie binnen sechs Monaten nach dem Tag, an dem die Eintragung der Verschmelzung in das Register des Sitzes desjenigen Rechtsträgers, dessen Gläubiger sie sind, nach § 19 Abs. 3 UmwG als bekannt gemacht gilt, ihren Anspruch nach Grund und Höhe in Textform anmelden, Sicherheit zu leisten, soweit sie nicht Befriedigung verlangen können. Dieses Recht steht den Gläubigern jedoch nur zu, wenn sie glaubhaft machen, dass durch die Verschmelzung die Erfüllung ihrer Forderung gefährdet wird.\"|\"Verschmelzung\",\n\n\"der an der Spaltung beteiligten Rechtsträger ist, wenn sie binnen sechs Monaten nach dem Tag, an dem die Eintragung der Spaltung in das Register des Sitzes desjenigen Rechtsträgers, dessen Gläubiger sie sind, nach §§ 125, 19 Abs. 3 UmwG als bekannt gemacht gilt, ihren Anspruch nach Grund und Höhe in Textform anmelden, Sicherheit zu leisten, soweit sie nicht Befriedigung verlangen können. Dieses Recht steht den Gläubigern jedoch nur zu, wenn sie glaubhaft machen, dass durch die Spaltung die Erfüllung ihrer Forderung gefährdet wird.\"|\"Spaltung\",\n\n\"des formwechselnden Rechtsträgers ist, wenn sie binnen sechs Monaten nach dem Tag, an dem die Eintragung des Formwechsels nach § 201 UmwG als bekannt gemacht gilt, ihren Anspruch nach Grund und Höhe in Textform anmelden, Sicherheit zu leisten, soweit sie nicht Befriedigung verlangen können. Dieses Recht steht den Gläubigern jedoch nur zu, wenn sie glaubhaft machen, dass durch den Formwechsel die Erfüllung ihrer Forderung gefährdet wird.\"|\"formwechselnde Umwandlung\",\n\n\"der an der Ausgliederung beteiligten Rechtsträger ist, wenn sie binnen sechs Monaten nach dem Tag, an dem die Eintragung der Ausgliederung in das Register des Sitzes desjenigen Rechtsträgers, dessen Gläubiger sie sind, nach §§ 125, 19 Abs. 3 UmwG als bekannt gemacht gilt, ihren Anspruch nach Grund und Höhe in Textform anmelden, Sicherheit zu leisten, soweit sie nicht Befriedigung verlangen können. Dieses Recht steht den Gläubigern jedoch nur zu, wenn sie glaubhaft machen, dass durch die Ausgliederung die Erfüllung ihrer Forderung gefährdet wird.\"|\"Ausgliederung\")"
    },
    {
      "date": "2025-09-18",
      "id": "130130",
      "original_text": "Registerbekanntmachung nach dem Umwandlungsgesetz\nBayern Amtsgericht Augsburg HRB 38528\nMaison Tehl GmbH – Stadtbergen",
      "type": "Registerbekanntmachung nach dem Umwandlungsgesetz",
      "state": "Bayern",
      "amtsgericht": "Amtsgericht Augsburg",
      "registernummer": "HRB 38528",
      "registerart": "HRB",
      "company_name": "Maison Tehl GmbH",
      "company_seat": "Stadtbergen",
      "details": "18.09.2025 (Bekanntmachungsdatum)\n\nBayern Amtsgericht Augsburg HRB 38528\nRegisterbekanntmachung nach dem Umwandlungsgesetz 17.09.2025 (Eintragungsdatum)\n\nMaison Tehl GmbH\nGesellschaft mit beschränkter Haftung\nStadtbergen\n\nDen Gläubigern der an der Verschmelzung beteiligten Rechtsträger ist, wenn sie binnen sechs Monaten nach dem Tag, an dem die Eintragung der Verschmelzung in das Register des Sitzes desjenigen Rechtsträgers, dessen Gläubiger sie sind, nach § 19 Abs. 3 UmwG als bekannt gemacht gilt, ihren Anspruch nach Grund und Höhe in Textform anmelden, Sicherheit zu leisten, soweit sie nicht Befriedigung verlangen können. Dieses Recht steht den Gläubigern jedoch nur zu, wenn sie glaubhaft machen, dass durch die Verschmelzung die Erfüllung ihrer Forderung gefährdet wird."
    },
    {
      "date": "2025-09-18",
      "id": "130131",
      "original_text": "Registerbekanntmachung nach dem Umwandlungsgesetz\nBayern Amtsgericht München HRB 288397\nDF1 Medien GmbH – Unterföhring",
      "type": "Registerbekanntmachung nach dem Umwandlungsgesetz",
      "state": "Bayern",
      "amtsgericht": "Amtsgericht München",
      "registernummer": "HRB 288397",
      "registerart": "HRB",
      "company_name": "DF1 Medien GmbH",
      "company_seat": "Unterföhring",
      "details": "18.09.2025 (Bekanntmachungsdatum)\n\nBayern Amtsgericht München HRB 288397\nRegisterbekanntmachung nach dem Umwandlungsgesetz 17.09.2025 (Eintragungsdatum)\n\nDF1 Medien GmbH\nGesellschaft mit beschränkter Haftung\nUnterföhring\n\nDen Gläubigern des formwechselnden Rechtsträgers ist, wenn sie binnen sechs Monaten nach dem Tag, an dem die Eintragung des Formwechsels nach § 201 UmwG als bekannt gemacht gilt, ihren Anspruch nach Grund und Höhe in Textform anmelden, Sicherheit zu leisten, soweit sie nicht Befriedigung verlangen können. Dieses Recht steht den Gläubigern jedoch nur zu, wenn sie glaubhaft machen, dass durch den Formwechsel die Erfüllung ihrer Forderung gefährdet wird."
    },
    {
      "date": "2025-09-18",
      "id": "130132",
      "original_text": "Registerbekanntmachung nach dem Umwandlungsgesetz\nBayern Amtsgericht Würzburg HRB 18079\nBauer Fahrzeugservice GmbH – Hettstadt",
      "type": "Registerbekanntmachung nach dem Umwandlungsgesetz",
      "state": "Bayern",
      "amtsgericht": "Amtsgericht Würzburg",
      "registernummer": "HRB 18079",
      "registerart": "HRB",
      "company_name": "Bauer Fahrzeugservice GmbH",
      "company_seat": "Hettstadt",
      "details": "18.09.2025 (Bekanntmachungsdatum)\n\nBayern Amtsgericht Würzburg HRB 18079\nRegisterbekanntmachung nach dem Umwandlungsgesetz 17.09.2025 (Eintragungsdatum)\n\nBauer Fahrzeugservice GmbH\nGesellschaft mit beschränkter Haftung\nHettstadt\n\nDen Gläubigern der an der Ausgliederung beteiligten Rechtsträger ist, wenn sie binnen sechs Monaten nach dem Tag, an dem die Eintragung der Ausgliederung in das Register des Sitzes desjenigen Rechtsträgers, dessen Gläubiger sie sind, nach §§ 125, 19 Abs. 3 UmwG als bekannt gemacht gilt, ihren Anspruch nach Grund und Höhe in Textform anmelden, Sicherheit zu leisten, soweit sie nicht Befriedigung verlangen können. Dieses Recht steht den Gläubigern jedoch nur zu, wenn sie glaubhaft machen, dass durch die Ausgliederung die Erfüllung ihrer Forderung gefährdet wird."
    },
    {
      "date": "2025-09-18",
      "id": "130133",
      "original_text": "Registerbekanntmachung nach dem Umwandlungsgesetz\nBayern Amtsgericht Augsburg HRB 38164\nThaube GmbH – Wehringen",
      "type": "Registerbekanntmachung nach dem Umwandlungsgesetz",
      "state": "Bayern",
      "amtsgericht": "Amtsgericht Augsburg",
      "registernummer": "HRB 38164",
      "registerart": "HRB",
      "company_name": "Thaube GmbH",
      "company_seat": "Wehringen",
      "details": "18.09.2025 (Bekanntmachungsdatum)\n\nBayern Amtsgericht Augsburg HRB 38164\nRegisterbekanntmachung nach dem Umwandlungsgesetz 17.09.2025 (Eintragungsdatum)\n\nThaube GmbH\nGesellschaft mit beschränkter Haftung\nWehringen\n\nDen Gläubigern der an der Verschmelzung beteiligten Rechtsträger ist, wenn sie binnen sechs Monaten nach dem Tag, an dem die Eintragung der Verschmelzung in das Register des Sitzes desjenigen Rechtsträgers, dessen Gläubiger sie sind, nach § 19 Abs. 3 UmwG als bekannt gemacht gilt, ihren Anspruch nach Grund und Höhe in Textform anmelden, Sicherheit zu leisten, soweit sie nicht Befriedigung verlangen können. Dieses Recht steht den Gläubigern jedoch nur zu, wenn sie glaubhaft machen, dass durch die Verschmelzung die Erfüllung ihrer Forderung gefährdet wird."
    },
    {
      "date": "2025-09-18",
      "id": "130134",
      "original_text": "Registerbekanntmachung nach dem Umwandlungsgesetz\nBayern Amtsgericht Augsburg HRB 36714\nThomas Aubele Holding UG (haftungsbeschränkt) – Wehringen",
      "type": "Registerbekanntmachung nach dem Umwandlungsgesetz",
      "state": "Bayern",
      "amtsgericht": "Amtsgericht Augsburg",
      "registernummer": "HRB 36714",
      "registerart": "HRB",
      "company_name": "Thomas Aubele Holding UG (haftungsbeschränkt)",
      "company_seat": "Wehringen",
      "details": "18.09.2025 (Bekanntmachungsdatum)\n\nBayern Amtsgericht Augsburg HRB 36714\nRegisterbekanntmachung nach dem Umwandlungsgesetz 17.09.2025 (Eintragungsdatum)\n\nThomas Aubele Holding UG (haftungsbeschränkt)\nGesellschaft mit beschränkter Haftung\nWehringen\n\nDen Gläubigern der an der Verschmelzung beteiligten Rechtsträger ist, wenn sie binnen sechs Monaten nach dem Tag, an dem die Eintragung der Verschmelzung in das Register des Sitzes desjenigen Rechtsträgers, dessen Gläubiger sie sind, nach § 19 Abs. 3 UmwG als bekannt gemacht gilt, ihren Anspruch nach Grund und Höhe in Textform anmelden, Sicherheit zu leisten, soweit sie nicht Befriedigung verlangen können. Dieses Recht steht den Gläubigern jedoch nur zu, wenn sie glaubhaft machen, dass durch die Verschmelzung die Erfüllung ihrer Forderung gefährdet wird."
    },
    {
      "date": "2025-09-18",
      "id": "130135",
      "original_text": "Registerbekanntmachung nach dem Umwandlungsgesetz\nBayern Amtsgericht München HRA 121630\nTwist Consulting GmbH & Co. KG – München",
      "type": "Registerbekanntmachung nach dem Umwandlungsgesetz",
      "state": "Bayern",
      "amtsgericht": "Amtsgericht München",
      "registernummer": "HRA 121630",
      "registerart": "HRA",
      "company_name": "Twist Consulting GmbH & Co. KG",
      "company_seat": "München",
      "details": "18.09.2025 (Bekanntmachungsdatum)\n\nBayern Amtsgericht München HRA 121630\nRegisterbekanntmachung nach dem Umwandlungsgesetz 17.09.2025 (Eintragungsdatum)\n\nTwist Consulting GmbH & Co. KG\nKommanditgesellschaft\nMünchen\n\nDen Gläubigern der an der Ausgliederung beteiligten Rechtsträger ist, wenn sie binnen sechs Monaten nach dem Tag, an dem die Eintragung der Ausgliederung in das Register des Sitzes desjenigen Rechtsträgers, dessen Gläubiger sie sind, nach §§ 125, 19 Abs. 3 UmwG als bekannt gemacht gilt, ihren Anspruch nach Grund und Höhe in Textform anmelden, Sicherheit zu leisten, soweit sie nicht Befriedigung verlangen können. Dieses Recht steht den Gläubigern jedoch nur zu, wenn sie glaubhaft machen, dass durch die Ausgliederung die Erfüllung ihrer Forderung gefährdet wird."
    },
    {
      "date": "2025-09-18",
      "id": "130136",
      "original_text": "Löschungsankündigung\nBayern Amtsgericht München HRB 192894\nVision (AS) UG (haftungsbeschränkt) – München",
      "type": "Löschungsankündigung",
      "state": "Bayern",
      "amtsgericht": "Amtsgericht München",
      "registernummer": "HRB 192894",
      "registerart": "HRB",
      "company_name": "Vision (AS) UG (haftungsbeschränkt)",
      "company_seat": "München",
      "details": "18.09.2025 (Bekanntmachungsdatum)\n\nBayern Amtsgericht München HRB 192894\nLöschungsankündigung\n\nVision (AS) UG (haftungsbeschränkt)\nGesellschaft mit beschränkter Haftung\nMünchen\n\nDas Registergericht beabsichtigt, die im Handelsregister eingetragene Gesellschaft wegen Vermögenslosigkeit von Amts wegen nach § 394 FamFG zu löschen. Die Frist zur Erhebung eines Widerspruchs ist auf drei Monate festgesetzt."
    },
    {
      "date": "2025-09-18",
      "id": "130137",
      "original_text": "Registerbekanntmachung nach dem Umwandlungsgesetz\nBayern Amtsgericht Landshut HRA 12900\nThomas Kopp Garten- & Landschaftsbau e.K. – Hohenthann",
      "type": "Registerbekanntmachung nach dem Umwandlungsgesetz",
      "state": "Bayern",
      "amtsgericht": "Amtsgericht Landshut",
      "registernummer": "HRA 12900",
      "registerart": "HRA",
      "company_name": "Thomas Kopp Garten- & Landschaftsbau e.K.",
      "company_seat": "Hohenthann",
      "details": "18.09.2025 (Bekanntmachungsdatum)\n\nBayern Amtsgericht Landshut HRA 12900\nRegisterbekanntmachung nach dem Umwandlungsgesetz 17.09.2025 (Eintragungsdatum)\n\nThomas Kopp Garten- & Landschaftsbau e.K.\nEinzelkaufmann / Einzelkauffrau\nHohenthann\n\nDen Gläubigern der an der Ausgliederung beteiligten Rechtsträger ist, wenn sie binnen sechs Monaten nach dem Tag, an dem die Eintragung der Ausgliederung in das Register des Sitzes desjenigen Rechtsträgers, dessen Gläubiger sie sind, nach §§ 125, 19 Abs. 3 UmwG als bekannt gemacht gilt, ihren Anspruch nach Grund und Höhe in Textform anmelden, Sicherheit zu leisten, soweit sie nicht Befriedigung verlangen können. Dieses Recht steht den Gläubigern jedoch nur zu, wenn sie glaubhaft machen, dass durch die Ausgliederung die Erfüllung ihrer Forderung gefährdet wird."
    },
    {
      "date": "2025-09-18",
      "id": "130138",
      "original_text": "Löschungsankündigung\nBayern Amtsgericht München HRB 261184\nDavincE Capital GmbH – München",
      "type": "Löschungsankündigung",
      "state": "Bayern",
      "amtsgericht": "Amtsgericht München",
      "registernummer": "HRB 261184",
      "registerart": "HRB",
      "company_name": "DavincE Capital GmbH",
      "company_seat": "München",
      "details": "18.09.2025 (Bekanntmachungsdatum)\n\nBayern Amtsgericht München HRB 261184\nLöschungsankündigung 17.09.2025 (Eintragungsdatum)\n\nDavincE Capital GmbH\nGesellschaft mit beschränkter Haftung\nMünchen\n\nDas Registergericht beabsichtigt, die im Handelsregister eingetragene Gesellschaft wegen Vermögenslosigkeit von Amts wegen nach § 394 FamFG zu löschen. Die Frist zur Erhebung eines Widerspruchs ist auf drei Monate festgesetzt."
    },
    {
      "date": "2025-09-18",
      "id": "130139",
      "original_text": "Registerbekanntmachung nach dem Umwandlungsgesetz\nBayern Amtsgericht Landshut HRB 11463\nSolarpark Fürstenwalde Verwaltungs UG (haftungsbeschränkt) – Hebertsfelden",
      "type": "Registerbekanntmachung nach dem Umwandlungsgesetz",
      "state": "Bayern",
      "amtsgericht": "Amtsgericht Landshut",
      "registernummer": "HRB 11463",
      "registerart": "HRB",
      "company_name": "Solarpark Fürstenwalde Verwaltungs UG (haftungsbeschränkt)",
      "company_seat": "Hebertsfelden",
      "details": "18.09.2025 (Bekanntmachungsdatum)\n\nBayern Amtsgericht Landshut HRB 11463\nRegisterbekanntmachung nach dem Umwandlungsgesetz 17.09.2025 (Eintragungsdatum)\n\nSolarpark Fürstenwalde Verwaltungs UG (haftungsbeschränkt)\nGesellschaft mit beschränkter Haftung\nHebertsfelden\n\nDen Gläubigern der an der Verschmelzung beteiligten Rechtsträger ist, wenn sie binnen sechs Monaten nach dem Tag, an dem die Eintragung der Verschmelzung in das Register des Sitzes desjenigen Rechtsträgers, dessen Gläubiger sie sind, nach § 19 Abs. 3 UmwG als bekannt gemacht gilt, ihren Anspruch nach Grund und Höhe in Textform anmelden, Sicherheit zu leisten, soweit sie nicht Befriedigung verlangen können. Dieses Recht steht den Gläubigern jedoch nur zu, wenn sie glaubhaft machen, dass durch die Verschmelzung die Erfüllung ihrer Forderung gefährdet wird."
    },
    {
      "date": "2025-09-18",
      "id": "130140",
      "original_text": "Registerbekanntmachung nach dem Umwandlungsgesetz\nBayern Amtsgericht Nürnberg HRB 25610\nCrossiva Consulting Unternehmergesellschaft (haftungsbeschränkt) – Schwabach",
      "type": "Registerbekanntmachung nach dem Umwandlungsgesetz",
      "state": "Bayern",
      "amtsgericht": "Amtsgericht Nürnberg",
      "registernummer": "HRB 25610",
      "registerart": "HRB",
      "company_name": "Crossiva Consulting Unternehmergesellschaft (haftungsbeschränkt)",
      "company_seat": "Schwabach",
      "details": "18.09.2025 (Bekanntmachungsdatum)\n\nBayern Amtsgericht Nürnberg HRB 25610\nRegisterbekanntmachung nach dem Umwandlungsgesetz 17.09.2025 (Eintragungsdatum)\n\nCrossiva Consulting Unternehmergesellschaft (haftungsbeschränkt)\nGesellschaft mit beschränkter Haftung\nSchwabach\n\nDen Gläubigern der an der Verschmelzung beteiligten Rechtsträger ist, wenn sie binnen sechs Monaten nach dem Tag, an dem die Eintragung der Verschmelzung in das Register des Sitzes desjenigen Rechtsträgers, dessen Gläubiger sie sind, nach § 19 Abs. 3 UmwG als bekannt gemacht gilt, ihren Anspruch nach Grund und Höhe in Textform anmelden, Sicherheit zu leisten, soweit sie nicht Befriedigung verlangen können. Dieses Recht steht den Gläubigern jedoch nur zu, wenn sie glaubhaft machen, dass durch die Verschmelzung die Erfüllung ihrer Forderung gefährdet wird."
    },
    {
      "date": "2025-09-18",
      "id": "130141",
      "original_text": "Registerbekanntmachung nach dem Umwandlungsgesetz\nBayern Amtsgericht Nürnberg HRB 35963\nMyDot GmbH – Nürnberg",
      "type": "Registerbekanntmachung nach dem Umwandlungsgesetz",
      "state": "Bayern",
      "amtsgericht": "Amtsgericht Nürnberg",
      "registernummer": "HRB 35963",
      "registerart": "HRB",
      "company_name": "MyDot GmbH",
      "company_seat": "Nürnberg",
      "details": "18.09.2025 (Bekanntmachungsdatum)\n\nBayern Amtsgericht Nürnberg HRB 35963\nRegisterbekanntmachung nach dem Umwandlungsgesetz 17.09.2025 (Eintragungsdatum)\n\nMyDot GmbH\nGesellschaft mit beschränkter Haftung\nNürnberg\n\nDen Gläubigern der an der Verschmelzung beteiligten Rechtsträger ist, wenn sie binnen sechs Monaten nach dem Tag, an dem die Eintragung der Verschmelzung in das Register des Sitzes desjenigen Rechtsträgers, dessen Gläubiger sie sind, nach § 19 Abs. 3 UmwG als bekannt gemacht gilt, ihren Anspruch nach Grund und Höhe in Textform anmelden, Sicherheit zu leisten, soweit sie nicht Befriedigung verlangen können. Dieses Recht steht den Gläubigern jedoch nur zu, wenn sie glaubhaft machen, dass durch die Verschmelzung die Erfüllung ihrer Forderung gefährdet wird."
    },
    {
      "date": "2025-09-18",
      "id": "130142",
      "original_text": "Registerbekanntmachung nach dem Umwandlungsgesetz\nBayern Amtsgericht München HRB 284591\nHollfelder Uhren und Schmuck GmbH Tegernsee – Rottach-Egern",
      "type": "Registerbekanntmachung nach dem Umwandlungsgesetz",
      "state": "Bayern",
      "amtsgericht": "Amtsgericht München",
      "registernummer": "HRB 284591",
      "registerart": "HRB",
      "company_name": "Hollfelder Uhren und Schmuck GmbH Tegernsee",
      "company_seat": "Rottach-Egern",
      "details": "18.09.2025 (Bekanntmachungsdatum)\n\nBayern Amtsgericht München HRB 284591\nRegisterbekanntmachung nach dem Umwandlungsgesetz 17.09.2025 (Eintragungsdatum)\n\nHollfelder Uhren und Schmuck GmbH Tegernsee\nGesellschaft mit beschränkter Haftung\nRottach-Egern\n\nDen Gläubigern der an der Verschmelzung beteiligten Rechtsträger ist, wenn sie binnen sechs Monaten nach dem Tag, an dem die Eintragung der Verschmelzung in das Register des Sitzes desjenigen Rechtsträgers, dessen Gläubiger sie sind, nach § 19 Abs. 3 UmwG als bekannt gemacht gilt, ihren Anspruch nach Grund und Höhe in Textform anmelden, Sicherheit zu leisten, soweit sie nicht Befriedigung verlangen können. Dieses Recht steht den Gläubigern jedoch nur zu, wenn sie glaubhaft machen, dass durch die Verschmelzung die Erfüllung ihrer Forderung gefährdet wird."
    },
    {
      "date": "2025-09-18",
      "id": "130143",
      "original_text": "Registerbekanntmachung nach dem Umwandlungsgesetz\nBayern Amtsgericht Fürth HRB 19086\nAndreas Kerle GmbH – Erlangen",
      "type": "Registerbekanntmachung nach dem Umwandlungsgesetz",
      "state": "Bayern",
      "amtsgericht": "Amtsgericht Fürth",
      "registernummer": "HRB 19086",
      "registerart": "HRB",
      "company_name": "Andreas Kerle GmbH",
      "company_seat": "Erlangen",
      "details": "18.09.2025 (Bekanntmachungsdatum)\n\nBayern Amtsgericht Fürth HRB 19086\nRegisterbekanntmachung nach dem Umwandlungsgesetz 17.09.2025 (Eintragungsdatum)\n\nAndreas Kerle GmbH\nGesellschaft mit beschränkter Haftung\nErlangen\n\nDen Gläubigern der an der Verschmelzung beteiligten Rechtsträger ist, wenn sie binnen sechs Monaten nach dem Tag, an dem die Eintragung der Verschmelzung in das Register des Sitzes desjenigen Rechtsträgers, dessen Gläubiger sie sind, nach § 19 Abs. 3 UmwG als bekannt gemacht gilt, ihren Anspruch nach Grund und Höhe in Textform anmelden, Sicherheit zu leisten, soweit sie nicht Befriedigung verlangen können. Dieses Recht steht den Gläubigern jedoch nur zu, wenn sie glaubhaft machen, dass durch die Verschmelzung die Erfüllung ihrer Forderung gefährdet wird."
    },
    {
      "date": "2025-09-18",
      "id": "130144",
      "original_text": "Löschungsankündigung\nBayern Amtsgericht München HRB 213837\nSGCON GmbH – München",
      "type": "Löschungsankündigung",
      "state": "Bayern",
      "amtsgericht": "Amtsgericht München",
      "registernummer": "HRB 213837",
      "registerart": "HRB",
      "company_name": "SGCON GmbH",
      "company_seat": "München",
      "details": "18.09.2025 (Bekanntmachungsdatum)\n\nBayern Amtsgericht München HRB 213837\nLöschungsankündigung 17.09.2025 (Eintragungsdatum)\n\nSGCON GmbH\nGesellschaft mit beschränkter Haftung\nMünchen\n\nDas Registergericht beabsichtigt, die im Handelsregister eingetragene Gesellschaft wegen Vermögenslosigkeit von Amts wegen nach § 394 FamFG zu löschen. Die Frist zur Erhebung eines Widerspruchs ist auf drei Monate festgesetzt."
    },
    {
      "date": "2025-09-18",
      "id": "130145",
      "original_text": "Registerbekanntmachung nach dem Umwandlungsgesetz\nBayern Amtsgericht Augsburg HRB 33268\nBricks & Mortar Immobilien Augsburg GmbH – Gersthofen",
      "type": "Registerbekanntmachung nach dem Umwandlungsgesetz",
      "state": "Bayern",
      "amtsgericht": "Amtsgericht Augsburg",
      "registernummer": "HRB 33268",
      "registerart": "HRB",
      "company_name": "Bricks & Mortar Immobilien Augsburg GmbH",
      "company_seat": "Gersthofen",
      "details": "18.09.2025 (Bekanntmachungsdatum)\n\nBayern Amtsgericht Augsburg HRB 33268\nRegisterbekanntmachung nach dem Umwandlungsgesetz 17.09.2025 (Eintragungsdatum)\n\nBricks & Mortar Immobilien Augsburg GmbH\nGesellschaft mit beschränkter Haftung\nGersthofen\n\nDen Gläubigern der an der Verschmelzung beteiligten Rechtsträger ist, wenn sie binnen sechs Monaten nach dem Tag, an dem die Eintragung der Verschmelzung in das Register des Sitzes desjenigen Rechtsträgers, dessen Gläubiger sie sind, nach § 19 Abs. 3 UmwG als bekannt gemacht gilt, ihren Anspruch nach Grund und Höhe in Textform anmelden, Sicherheit zu leisten, soweit sie nicht Befriedigung verlangen können. Dieses Recht steht den Gläubigern jedoch nur zu, wenn sie glaubhaft machen, dass durch die Verschmelzung die Erfüllung ihrer Forderung gefährdet wird."
    },
    {
      "date": "2025-09-18",
      "id": "130146",
      "original_text": "Löschungsankündigung\nBayern Amtsgericht München HRB 245059\nPflegemax Team 24 Verwaltungs UG (haftungsbeschränkt) – München",
      "type": "Löschungsankündigung",
      "state": "Bayern",
      "amtsgericht": "Amtsgericht München",
      "registernummer": "HRB 245059",
      "registerart": "HRB",
      "company_name": "Pflegemax Team 24 Verwaltungs UG (haftungsbeschränkt)",
      "company_seat": "München",
      "details": "18.09.2025 (Bekanntmachungsdatum)\n\nBayern Amtsgericht München HRB 245059\nLöschungsankündigung 17.09.2025 (Eintragungsdatum)\n\nPflegemax Team 24 Verwaltungs UG (haftungsbeschränkt)\nGesellschaft mit beschränkter Haftung\nMünchen\n\nDas Registergericht beabsichtigt, den im Handelsregister eingetragenen Geschäftsführer Nagy György, geb. 27.12.1968, wegen fehlender Eignung nach § 395 FamFG zu löschen. Die Frist zur Erhebung eines Widerspruchs ist auf drei Monate festgesetzt."
    },
    {
      "date": "2025-09-18",
      "id": "130147",
      "original_text": "Registerbekanntmachung nach dem Umwandlungsgesetz\nBayern Amtsgericht Fürth HRB 4842\nRLH Agrar GmbH – Markt Erlbach",
      "type": "Registerbekanntmachung nach dem Umwandlungsgesetz",
      "state": "Bayern",
      "amtsgericht": "Amtsgericht Fürth",
      "registernummer": "HRB 4842",
      "registerart": "HRB",
      "company_name": "RLH Agrar GmbH",
      "company_seat": "Markt Erlbach",
      "details": "18.09.2025 (Bekanntmachungsdatum)\n\nBayern Amtsgericht Fürth HRB 4842\nRegisterbekanntmachung nach dem Umwandlungsgesetz 17.09.2025 (Eintragungsdatum)\n\nRLH Agrar GmbH\nGesellschaft mit beschränkter Haftung\nMarkt Erlbach\n\nDen Gläubigern der an der Verschmelzung beteiligten Rechtsträger ist, wenn sie binnen sechs Monaten nach dem Tag, an dem die Eintragung der Verschmelzung in das Register des Sitzes desjenigen Rechtsträgers, dessen Gläubiger sie sind, nach § 19 Abs. 3 UmwG als bekannt gemacht gilt, ihren Anspruch nach Grund und Höhe in Textform anmelden, Sicherheit zu leisten, soweit sie nicht Befriedigung verlangen können. Dieses Recht steht den Gläubigern jedoch nur zu, wenn sie glaubhaft machen, dass durch die Verschmelzung die Erfüllung ihrer Forderung gefährdet wird."
    },
    {
      "date": "2025-09-18",
      "id": "130148",
      "original_text": "Löschungsankündigung\nBayern Amtsgericht Nürnberg HRB 17054\nDW Transport GmbH – Feucht",
      "type": "Löschungsankündigung",
      "state": "Bayern",
      "amtsgericht": "Amtsgericht Nürnberg",
      "registernummer": "HRB 17054",
      "registerart": "HRB",
      "company_name": "DW Transport GmbH",
      "company_seat": "Feucht",
      "details": "18.09.2025 (Bekanntmachungsdatum)\n\nBayern Amtsgericht Nürnberg HRB 17054\nLöschungsankündigung\n\nDW Transport GmbH\nGesellschaft mit beschränkter Haftung\nFeucht\n\nDas Registergericht beabsichtigt, die im Handelsregister eingetragene Gesellschaft wegen Vermögenslosigkeit von Amts wegen nach § 394 FamFG zu löschen. Die Frist zur Erhebung eines Widerspruchs ist auf einen Monat festgesetzt."
    },
    {
      "date": "2025-09-18",
      "id": "130149",
      "original_text": "Registerbekanntmachung nach dem Umwandlungsgesetz\nBayern Amtsgericht Augsburg HRB 2023\nHof Verwaltungs-AG – Augsburg",
      "type": "Registerbekanntmachung nach dem Umwandlungsgesetz",
      "state": "Bayern",
      "amtsgericht": "Amtsgericht Augsburg",
      "registernummer": "HRB 2023",
      "registerart": "HRB",
      "company_name": "Hof Verwaltungs-AG",
      "company_seat": "Augsburg",
      "details": "18.09.2025 (Bekanntmachungsdatum)\n\nBayern Amtsgericht Augsburg HRB 2023\nRegisterbekanntmachung nach dem Umwandlungsgesetz 17.09.2025 (Eintragungsdatum)\n\nHof Verwaltungs-AG\nAktiengesellschaft\nAugsburg\n\nDen Gläubigern der an der Verschmelzung beteiligten Rechtsträger ist, wenn sie binnen sechs Monaten nach dem Tag, an dem die Eintragung der Verschmelzung in das Register des Sitzes desjenigen Rechtsträgers, dessen Gläubiger sie sind, nach § 19 Abs. 3 UmwG als bekannt gemacht gilt, ihren Anspruch nach Grund und Höhe in Textform anmelden, Sicherheit zu leisten, soweit sie nicht Befriedigung verlangen können. Dieses Recht steht den Gläubigern jedoch nur zu, wenn sie glaubhaft machen, dass durch die Verschmelzung die Erfüllung ihrer Forderung gefährdet wird."
    },
    {
      "date": "2025-09-18",
      "id": "130150",
      "original_text": "Registerbekanntmachung nach dem Umwandlungsgesetz\nBayern Amtsgericht Landshut HRA 12920\nSchreinerei Gottfried Blüml e.K. – Triftern",
      "type": "Registerbekanntmachung nach dem Umwandlungsgesetz",
      "state": "Bayern",
      "amtsgericht": "Amtsgericht Landshut",
      "registernummer": "HRA 12920",
      "registerart": "HRA",
      "company_name": "Schreinerei Gottfried Blüml e.K.",
      "company_seat": "Triftern",
      "details": "18.09.2025 (Bekanntmachungsdatum)\n\nBayern Amtsgericht Landshut HRA 12920\nRegisterbekanntmachung nach dem Umwandlungsgesetz 17.09.2025 (Eintragungsdatum)\n\nSchreinerei Gottfried Blüml e.K.\nEinzelkaufmann / Einzelkauffrau\nTriftern\n\nDen Gläubigern der an der Ausgliederung beteiligten Rechtsträger ist, wenn sie binnen sechs Monaten nach dem Tag, an dem die Eintragung der Ausgliederung in das Register des Sitzes desjenigen Rechtsträgers, dessen Gläubiger sie sind, nach §§ 125, 19 Abs. 3 UmwG als bekannt gemacht gilt, ihren Anspruch nach Grund und Höhe in Textform anmelden, Sicherheit zu leisten, soweit sie nicht Befriedigung verlangen können. Dieses Recht steht den Gläubigern jedoch nur zu, wenn sie glaubhaft machen, dass durch die Ausgliederung die Erfüllung ihrer Forderung gefährdet wird."
    },
    {
      "date": "2025-09-18",
      "id": "130151",
      "original_text": "Löschungsankündigung\nBayern Amtsgericht München HRB 245059\nPflegemax Team 24 Verwaltungs UG (haftungsbeschränkt) – München",
      "type": "Löschungsankündigung",
      "state": "Bayern",
      "amtsgericht": "Amtsgericht München",
      "registernummer": "HRB 245059",
      "registerart": "HRB",
      "company_name": "Pflegemax Team 24 Verwaltungs UG (haftungsbeschränkt)",
      "company_seat": "München",
      "details": "18.09.2025 (Bekanntmachungsdatum)\n\nBayern Amtsgericht München HRB 245059\nLöschungsankündigung 17.09.2025 (Eintragungsdatum)\n\nPflegemax Team 24 Verwaltungs UG (haftungsbeschränkt)\nGesellschaft mit beschränkter Haftung\nMünchen\n\nDas Registergericht beabsichtigt, den im Handelsregister eingetragenen Geschäftsführer wegen fehlender Eignung nach § 395 FamFG zu löschen. Die Frist zur Erhebung eines Widerspruchs ist auf drei Monate festgesetzt."
    },
    {
      "date": "2025-09-18",
      "id": "130152",
      "original_text": "Registerbekanntmachung nach dem Umwandlungsgesetz\nBayern Amtsgericht Weiden i. d. OPf. HRB 153\nWITRON Logistik + Informatik GmbH – Parkstein",
      "type": "Registerbekanntmachung nach dem Umwandlungsgesetz",
      "state": "Bayern",
      "amtsgericht": "Amtsgericht Weiden i. d. OPf.",
      "registernummer": "HRB 153",
      "registerart": "HRB",
      "company_name": "WITRON Logistik + Informatik GmbH",
      "company_seat": "Parkstein",
      "details": "18.09.2025 (Bekanntmachungsdatum)\n\nBayern Amtsgericht Weiden i. d. OPf. HRB 153\nRegisterbekanntmachung nach dem Umwandlungsgesetz 17.09.2025 (Eintragungsdatum)\n\nWITRON Logistik + Informatik GmbH\nGesellschaft mit beschränkter Haftung\nParkstein\n\nDen Gläubigern des formwechselnden Rechtsträgers ist, wenn sie binnen sechs Monaten nach dem Tag, an dem die Eintragung des Formwechsels nach § 201 UmwG als bekannt gemacht gilt, ihren Anspruch nach Grund und Höhe in Textform anmelden, Sicherheit zu leisten, soweit sie nicht Befriedigung verlangen können. Dieses Recht steht den Gläubigern jedoch nur zu, wenn sie glaubhaft machen, dass durch den Formwechsel die Erfüllung ihrer Forderung gefährdet wird."
    },
    {
      "date": "2025-09-18",
      "id": "130153",
      "original_text": "Registerbekanntmachung nach dem Umwandlungsgesetz\nBaden-Württemberg Amtsgericht Stuttgart HRB 264932\nCombi-Plus Verwaltungsgesellschaft mbH – Winnenden",
      "type": "Registerbekanntmachung nach dem Umwandlungsgesetz",
      "state": "Baden-Württemberg",
      "amtsgericht": "Amtsgericht Stuttgart",
      "registernummer": "HRB 264932",
      "registerart": "HRB",
      "company_name": "Combi-Plus Verwaltungsgesellschaft mbH",
      "company_seat": "Winnenden",
      "details": "18.09.2025 (Bekanntmachungsdatum)\n\nBaden-Württemberg Amtsgericht Stuttgart HRB 264932\nRegisterbekanntmachung nach dem Umwandlungsgesetz 18.09.2025 (Eintragungsdatum)\n\nCombi-Plus Verwaltungsgesellschaft mbH\nGesellschaft mit beschränkter Haftung\nWinnenden\n\nDen Gläubigern der an der Verschmelzung beteiligten Rechtsträger ist, wenn sie binnen sechs Monaten nach dem Tag, an dem die Eintragung der Verschmelzung in das Register des Sitzes desjenigen Rechtsträgers, dessen Gläubiger sie sind, nach § 19 Abs. 3 UmwG als bekanntgemacht gilt, ihren Anspruch nach Grund und Höhe schriftlich anmelden, Sicherheit zu leisten, soweit sie nicht Befriedigung verlangen können. Dieses Recht steht den Gläubigern jedoch nur zu, wenn sie glaubhaft machen, dass durch die Verschmelzung die Erfüllung ihrer Forderung gefährdet wird."
    },
    {
      "date": "2025-09-18",
      "id": "130154",
      "original_text": "Registerbekanntmachung nach dem Umwandlungsgesetz\nBaden-Württemberg Amtsgericht Stuttgart HRB 265070\nCombiSystems GmbH – Berglen",
      "type": "Registerbekanntmachung nach dem Umwandlungsgesetz",
      "state": "Baden-Württemberg",
      "amtsgericht": "Amtsgericht Stuttgart",
      "registernummer": "HRB 265070",
      "registerart": "HRB",
      "company_name": "CombiSystems GmbH",
      "company_seat": "Berglen",
      "details": "18.09.2025 (Bekanntmachungsdatum)\n\nBaden-Württemberg Amtsgericht Stuttgart HRB 265070\nRegisterbekanntmachung nach dem Umwandlungsgesetz 18.09.2025 (Eintragungsdatum)\n\nCombiSystems GmbH\nGesellschaft mit beschränkter Haftung\nBerglen\n\nAls nicht eingetragen wird bekanntgemacht:\nDen Gläubigern der an der Verschmelzung beteiligten Rechtsträger ist, wenn sie binnen sechs Monaten nach dem Tag, an dem die Eintragung der Verschmelzung in das Register des Sitzes desjenigen Rechtsträgers, dessen Gläubiger sie sind, nach § 19 Abs. 3 UmwG als bekanntgemacht gilt, ihren Anspruch nach Grund und Höhe schriftlich anmelden, Sicherheit zu leisten, soweit sie nicht Befriedigung verlangen können. Dieses Recht steht den Gläubigern jedoch nur zu, wenn sie glaubhaft machen, dass durch die Verschmelzung die Erfüllung ihrer Forderung gefährdet wird."
    },
    {
      "date": "2025-09-18",
      "id": "130155",
      "original_text": "Registerbekanntmachung nach dem Umwandlungsgesetz\nSaarland Amtsgericht Saarbrücken HRB 104457\nKAMPOS Vertriebs GmbH – Homburg/Saar",
      "type": "Registerbekanntmachung nach dem Umwandlungsgesetz",
      "state": "Saarland",
      "amtsgericht": "Amtsgericht Saarbrücken",
      "registernummer": "HRB 104457",
      "registerart": "HRB",
      "company_name": "KAMPOS Vertriebs GmbH",
      "company_seat": "Homburg/Saar",
      "details": "18.09.2025 (Bekanntmachungsdatum)\n\nSaarland Amtsgericht Saarbrücken HRB 104457\nRegisterbekanntmachung nach dem Umwandlungsgesetz 18.09.2025 (Eintragungsdatum)\n\nKAMPOS Vertriebs GmbH\nGesellschaft mit beschränkter Haftung\nHomburg/Saar\n\nAls nicht eingetragen wird bekannt gemacht: Den Gläubigern der an der Verschmelzung beteiligten Gesellschaften ist, wenn sie binnen sechs Monaten nach dem Tag, an dem die Eintragung der Verschmelzung in das Register des Sitzes desjenigen Rechtsträgers, dessen Gläubiger sie sind, nach § 19 Absatz 3 UmwG bekannt gemacht worden ist, ihren Anspruch nach Grund und Höhe schriftlich anmelden, Sicherheit zu leisten, soweit sie nicht Befriedigung verlangen können. Dieses Recht steht den Gläubigern jedoch nur zu, wenn sie glaubhaft machen, dass durch die Verschmelzung die Erfüllung ihrer Forderung gefährdet wird."
    },
    {
      "date": "2025-09-18",
      "id": "130156",
      "original_text": "Registerbekanntmachung nach dem Umwandlungsgesetz\nBaden-Württemberg Amtsgericht Stuttgart HRB 801112\nM & K Solutions GmbH – Böblingen",
      "type": "Registerbekanntmachung nach dem Umwandlungsgesetz",
      "state": "Baden-Württemberg",
      "amtsgericht": "Amtsgericht Stuttgart",
      "registernummer": "HRB 801112",
      "registerart": "HRB",
      "company_name": "M & K Solutions GmbH",
      "company_seat": "Böblingen",
      "details": "18.09.2025 (Bekanntmachungsdatum)\n\nBaden-Württemberg Amtsgericht Stuttgart HRB 801112\nRegisterbekanntmachung nach dem Umwandlungsgesetz 18.09.2025 (Eintragungsdatum)\n\nM & K Solutions GmbH\nGesellschaft mit beschränkter Haftung\nBöblingen\n\nAls nicht eingetragen wird bekanntgemacht:\nDen Gläubigern der an der Ausgliederung beteiligten Rechtsträger ist, wenn sie binnen sechs Monaten nach dem Tag, an dem die Eintragung der Ausgliederung in das Register des Sitzes desjenigen Rechtsträgers, dessen Gläubiger sie sind, nach § 19 Abs. 3 UmwG als bekanntgemacht gilt, ihren Anspruch nach Grund und Höhe schriftlich anmelden, Sicherheit zu leisten, soweit sie nicht Befriedigung verlangen können. Dieses Recht steht den Gläubigern jedoch nur zu, wenn sie glaubhaft machen, dass durch die Ausgliederung die Erfüllung ihrer Forderung gefährdet wird."
    },
    {
      "date": "2025-09-18",
      "id": "130157",
      "original_text": "Löschungsankündigung\nBrandenburg Amtsgericht Potsdam HRB 24979\nBRB Logistics GmbH – Brandenburg an der Havel",
      "type": "Löschungsankündigung",
      "state": "Brandenburg",
      "amtsgericht": "Amtsgericht Potsdam",
      "registernummer": "HRB 24979",
      "registerart": "HRB",
      "company_name": "BRB Logistics GmbH",
      "company_seat": "Brandenburg an der Havel",
      "details": "18.09.2025 (Bekanntmachungsdatum)\n\nBrandenburg Amtsgericht Potsdam HRB 24979\nLöschungsankündigung\n\nBRB Logistics GmbH\nGesellschaft mit beschränkter Haftung\nBrandenburg an der Havel\n\nBei der nachstehenden Gesellschaft wird das Amtslöschungsverfahren gemäß § 394 FamFG eingeleitet. Widerspruchsfrist: 8 Wochen."
    },
    {
      "date": "2025-09-18",
      "id": "130158",
      "original_text": "Registerbekanntmachung nach dem Umwandlungsgesetz\nBaden-Württemberg Amtsgericht Mannheim HRB 501764\nJohanneshaus Wohnen und Pflege gGmbH – Niefern-Öschelbronn",
      "type": "Registerbekanntmachung nach dem Umwandlungsgesetz",
      "state": "Baden-Württemberg",
      "amtsgericht": "Amtsgericht Mannheim",
      "registernummer": "HRB 501764",
      "registerart": "HRB",
      "company_name": "Johanneshaus Wohnen und Pflege gGmbH",
      "company_seat": "Niefern-Öschelbronn",
      "details": "18.09.2025 (Bekanntmachungsdatum)\n\nBaden-Württemberg Amtsgericht Mannheim HRB 501764\nRegisterbekanntmachung nach dem Umwandlungsgesetz 18.09.2025 (Eintragungsdatum)\n\nJohanneshaus Wohnen und Pflege gGmbH\nGesellschaft mit beschränkter Haftung\nNiefern-Öschelbronn\n\nDen Gläubigern der an der Verschmelzung beteiligten Rechtsträger ist, wenn sie binnen sechs Monaten nach dem Tag, an dem die Eintragung der Verschmelzung in das Register des Sitzes desjenigen Rechtsträgers, dessen Gläubiger sie sind, nach § 19 Abs. 3 UmwG als bekanntgemacht gilt, ihren Anspruch nach Grund und Höhe schriftlich anmelden, Sicherheit zu leisten, soweit sie nicht Befriedigung verlangen können. Dieses Recht steht den Gläubigern jedoch nur zu, wenn sie glaubhaft machen, dass durch die Verschmelzung die Erfüllung ihrer Forderung gefährdet wird."
    },
    {
      "date": "2025-09-18",
      "id": "130159",
      "original_text": "Löschungsankündigung\nBerlin Amtsgericht Berlin (Charlottenburg) HRB 206364\nECOB GmbH – Berlin",
      "type": "Löschungsankündigung",
      "state": "Berlin",
      "amtsgericht": "Amtsgericht Berlin (Charlottenburg)",
      "registernummer": "HRB 206364",
      "registerart": "HRB",
      "company_name": "ECOB GmbH",
      "company_seat": "Berlin",
      "details": "18.09.2025 (Bekanntmachungsdatum)\n\nBerlin Amtsgericht Berlin (Charlottenburg) HRB 206364\nLöschungsankündigung\n\nECOB GmbH\nGesellschaft mit beschränkter Haftung\nBerlin\n\nBei der nachstehenden Gesellschaft wird das Amtslöschungsverfahren gemäß § 394 FamFG eingeleitet. Widerspruchsfrist 6 Wochen"
    },
    {
      "date": "2025-09-18",
      "id": "130160",
      "original_text": "Registerbekanntmachung nach dem Umwandlungsgesetz\nBaden-Württemberg Amtsgericht Mannheim HRB 743858\nPro Concept Immobilien-Betriebsgesellschaft mbH – Mannheim",
      "type": "Registerbekanntmachung nach dem Umwandlungsgesetz",
      "state": "Baden-Württemberg",
      "amtsgericht": "Amtsgericht Mannheim",
      "registernummer": "HRB 743858",
      "registerart": "HRB",
      "company_name": "Pro Concept Immobilien-Betriebsgesellschaft mbH",
      "company_seat": "Mannheim",
      "details": "18.09.2025 (Bekanntmachungsdatum)\n\nBaden-Württemberg Amtsgericht Mannheim HRB 743858\nRegisterbekanntmachung nach dem Umwandlungsgesetz 18.09.2025 (Eintragungsdatum)\n\nPro Concept Immobilien-Betriebsgesellschaft mbH\nGesellschaft mit beschränkter Haftung\nMannheim\n\nAls nicht eingetragen wird bekanntgemacht: Den Gläubigern der an der Verschmelzung beteiligten Rechtsträger ist, wenn sie binnen sechs Monaten nach dem Tag, an dem die Eintragung der Verschmelzung in das Register des Sitzes desjenigen Rechtsträgers, dessen Gläubiger sie sind, nach § 19 Abs. 3 UmwG als bekanntgemacht gilt, ihren Anspruch nach Grund und Höhe schriftlich anmelden, Sicherheit zu leisten, soweit sie nicht Befriedigung verlangen können. Dieses Recht steht den Gläubigern jedoch nur zu, wenn sie glaubhaft machen, dass durch die Verschmelzung die Erfüllung ihrer Forderung gefährdet wird."
    },
    {
      "date": "2025-09-18",
      "id": "130161",
      "original_text": "Registerbekanntmachung nach dem Umwandlungsgesetz\nBaden-Württemberg Amtsgericht Freiburg HRA 3537\nKur-Apotheke Dr. Juliane Iltgen-Breburda e.K. – Kirchzarten",
      "type": "Registerbekanntmachung nach dem Umwandlungsgesetz",
      "state": "Baden-Württemberg",
      "amtsgericht": "Amtsgericht Freiburg",
      "registernummer": "HRA 3537",
      "registerart": "HRA",
      "company_name": "Kur-Apotheke Dr. Juliane Iltgen-Breburda e.K.",
      "company_seat": "Kirchzarten",
      "details": "18.09.2025 (Bekanntmachungsdatum)\n\nBaden-Württemberg Amtsgericht Freiburg HRA 3537\nRegisterbekanntmachung nach dem Umwandlungsgesetz 18.09.2025 (Eintragungsdatum)\n\nKur-Apotheke Dr. Juliane Iltgen-Breburda e.K.\nEinzelkaufmann / Einzelkauffrau\nKirchzarten\n\nDen Gläubigern der an der Ausgliederung beteiligten Rechtsträger ist, wenn sie binnen sechs Monaten nach dem Tag, an dem die Eintragung der Ausgliederung in das Register des Sitzes desjenigen Rechtsträgers, dessen Gläubiger sie sind, nach § 19 Abs. 3 UmwG als bekanntgemacht gilt, ihren Anspruch nach Grund und Höhe schriftlich anmelden, Sicherheit zu leisten, soweit sie nicht Befriedigung verlangen können. Dieses Recht steht den Gläubigern jedoch nur zu, wenn sie glaubhaft machen, dass durch die Ausgliederung die Erfüllung ihrer Forderung gefährdet wird."
    },
    {
      "date": "2025-09-18",
      "id": "130162",
      "original_text": "Löschungsankündigung\nBerlin Amtsgericht Berlin (Charlottenburg) HRB 185821\nPied Pipers Sound UG (haftungsbeschränkt) – Berlin",
      "type": "Löschungsankündigung",
      "state": "Berlin",
      "amtsgericht": "Amtsgericht Berlin (Charlottenburg)",
      "registernummer": "HRB 185821",
      "registerart": "HRB",
      "company_name": "Pied Pipers Sound UG (haftungsbeschränkt)",
      "company_seat": "Berlin",
      "details": "18.09.2025 (Bekanntmachungsdatum)\n\nBerlin Amtsgericht Berlin (Charlottenburg) HRB 185821\nLöschungsankündigung\n\nPied Pipers Sound UG (haftungsbeschränkt)\nGesellschaft mit beschränkter Haftung\nBerlin\n\nBei der nachstehenden Gesellschaft wird das Amtslöschungsverfahren gemäß § 394 FamFG eingeleitet. Widerspruchsfrist 6 Wochen"
    },
    {
      "date": "2025-09-18",
      "id": "130163",
      "original_text": "Löschungsankündigung\nBerlin Amtsgericht Berlin (Charlottenburg) HRB 223809\nR & K Real Estate GmbH – Berlin",
      "type": "Löschungsankündigung",
      "state": "Berlin",
      "amtsgericht": "Amtsgericht Berlin (Charlottenburg)",
      "registernummer": "HRB 223809",
      "registerart": "HRB",
      "company_name": "R & K Real Estate GmbH",
      "company_seat": "Berlin",
      "details": "18.09.2025 (Bekanntmachungsdatum)\n\nBerlin Amtsgericht Berlin (Charlottenburg) HRB 223809\nLöschungsankündigung\n\nR & K Real Estate GmbH\nGesellschaft mit beschränkter Haftung\nBerlin\n\nBei der nachstehenden Gesellschaft wird das Amtslöschungsverfahren gemäß § 394 FamFG eingeleitet. Widerspruchsfrist 6 Wochen"
    },
    {
      "date": "2025-09-18",
      "id": "130164",
      "original_text": "Registerbekanntmachung nach dem Umwandlungsgesetz\nBaden-Württemberg Amtsgericht Freiburg HRA 708801\nLieblings-Apotheken OHG Koch-Iltgen – Freiburg im Breisgau",
      "type": "Registerbekanntmachung nach dem Umwandlungsgesetz",
      "state": "Baden-Württemberg",
      "amtsgericht": "Amtsgericht Freiburg",
      "registernummer": "HRA 708801",
      "registerart": "HRA",
      "company_name": "Lieblings-Apotheken OHG Koch-Iltgen",
      "company_seat": "Freiburg im Breisgau",
      "details": "18.09.2025 (Bekanntmachungsdatum)\n\nBaden-Württemberg Amtsgericht Freiburg HRA 708801\nRegisterbekanntmachung nach dem Umwandlungsgesetz 18.09.2025 (Eintragungsdatum)\n\nLieblings-Apotheken OHG Koch-Iltgen\nOffene Handelsgesellschaft\nFreiburg im Breisgau\n\nDen Gläubigern der an der Ausgliederung beteiligten Rechtsträger ist, wenn sie binnen sechs Monaten nach dem Tag, an dem die Eintragung der Ausgliederung in das Register des Sitzes desjenigen Rechtsträgers, dessen Gläubiger sie sind, nach § 19 Abs. 3 UmwG als bekanntgemacht gilt, ihren Anspruch nach Grund und Höhe schriftlich anmelden, Sicherheit zu leisten, soweit sie nicht Befriedigung verlangen können. Dieses Recht steht den Gläubigern jedoch nur zu, wenn sie glaubhaft machen, dass durch die Ausgliederung die Erfüllung ihrer Forderung gefährdet wird."
    },
    {
      "date": "2025-09-18",
      "id": "130165",
      "original_text": "Registerbekanntmachung nach dem Umwandlungsgesetz\nBaden-Württemberg Amtsgericht Freiburg HRA 2866\nHexental-Apotheke Dr. Sybille Koch e.K. – Merzhausen",
      "type": "Registerbekanntmachung nach dem Umwandlungsgesetz",
      "state": "Baden-Württemberg",
      "amtsgericht": "Amtsgericht Freiburg",
      "registernummer": "HRA 2866",
      "registerart": "HRA",
      "company_name": "Hexental-Apotheke Dr. Sybille Koch e.K.",
      "company_seat": "Merzhausen",
      "details": "18.09.2025 (Bekanntmachungsdatum)\n\nBaden-Württemberg Amtsgericht Freiburg HRA 2866\nRegisterbekanntmachung nach dem Umwandlungsgesetz 18.09.2025 (Eintragungsdatum)\n\nHexental-Apotheke Dr. Sybille Koch e.K.\nEinzelkaufmann / Einzelkauffrau\nMerzhausen\n\nAls nicht eingetragen wird bekanntgemacht:\nDen Gläubigern der an der Ausgliederung beteiligten Rechtsträger ist, wenn sie binnen sechs Monaten nach dem Tag, an dem die Eintragung der Ausgliederung in das Register des Sitzes desjenigen Rechtsträgers, dessen Gläubiger sie sind, nach § 19 Abs. 3 UmwG als bekanntgemacht gilt, ihren Anspruch nach Grund und Höhe schriftlich anmelden, Sicherheit zu leisten, soweit sie nicht Befriedigung verlangen können. Dieses Recht steht den Gläubigern jedoch nur zu, wenn sie glaubhaft machen, dass durch die Ausgliederung die Erfüllung ihrer Forderung gefährdet wird."
    },
    {
      "date": "2025-09-18",
      "id": "130166",
      "original_text": "Registerbekanntmachung nach dem Umwandlungsgesetz\nBaden-Württemberg Amtsgericht Mannheim HRB 450230\nStadtmüller GmbH – Osterburken",
      "type": "Registerbekanntmachung nach dem Umwandlungsgesetz",
      "state": "Baden-Württemberg",
      "amtsgericht": "Amtsgericht Mannheim",
      "registernummer": "HRB 450230",
      "registerart": "HRB",
      "company_name": "Stadtmüller GmbH",
      "company_seat": "Osterburken",
      "details": "18.09.2025 (Bekanntmachungsdatum)\n\nBaden-Württemberg Amtsgericht Mannheim HRB 450230\nRegisterbekanntmachung nach dem Umwandlungsgesetz 18.09.2025 (Eintragungsdatum)\n\nStadtmüller GmbH\nGesellschaft mit beschränkter Haftung\nOsterburken\n\nDen Gläubigern der an der Verschmelzung beteiligten Rechtsträger ist, wenn sie binnen sechs Monaten nach dem Tag, an dem die Eintragung der Verschmelzung in das Register des Sitzes desjenigen Rechtsträgers, dessen Gläubiger sie sind, nach § 19 Abs. 3 UmwG als bekanntgemacht gilt, ihren Anspruch nach Grund und Höhe schriftlich anmelden, Sicherheit zu leisten, soweit sie nicht Befriedigung verlangen können. Dieses Recht steht den Gläubigern jedoch nur zu, wenn sie glaubhaft machen, dass durch die Verschmelzung die Erfüllung ihrer Forderung gefährdet wird."
    },
    {
      "date": "2025-09-18",
      "id": "130167",
      "original_text": "Einreichung neuer Dokumente\nSachsen-Anhalt Amtsgericht Stendal HRB 36375\nH2 Green Power & Logistics AG – Magdeburg",
      "type": "Einreichung neuer Dokumente",
      "state": "Sachsen-Anhalt",
      "amtsgericht": "Amtsgericht Stendal",
      "registernummer": "HRB 36375",
      "registerart": "HRB",
      "company_name": "H2 Green Power & Logistics AG",
      "company_seat": "Magdeburg",
      "details": "18.09.2025 (Bekanntmachungsdatum)\n\nSachsen-Anhalt Amtsgericht Stendal HRB 36375\nEinreichung neuer Dokumente\n\nH2 Green Power & Logistics AG\nAktiengesellschaft\nMagdeburg\n\nEine Liste der Mitglieder des Aufsichtsrates wurde zum Handelsregister eingereicht."
    },
    {
      "date": "2025-09-18",
      "id": "130168",
      "original_text": "Registerbekanntmachung nach dem Umwandlungsgesetz\nSchleswig-Holstein Amtsgericht Lübeck HRA 11540\nFamilie Christophel GmbH & Co. KG – Lübeck",
      "type": "Registerbekanntmachung nach dem Umwandlungsgesetz",
      "state": "Schleswig-Holstein",
      "amtsgericht": "Amtsgericht Lübeck",
      "registernummer": "HRA 11540",
      "registerart": "HRA",
      "company_name": "Familie Christophel GmbH & Co. KG",
      "company_seat": "Lübeck",
      "details": "18.09.2025 (Bekanntmachungsdatum)\n\nSchleswig-Holstein Amtsgericht Lübeck HRA 11540\nRegisterbekanntmachung nach dem Umwandlungsgesetz 17.09.2025 (Eintragungsdatum)\n\nFamilie Christophel GmbH & Co. KG\nKommanditgesellschaft\nLübeck\n\nZu Eintragungsnummer 2 vom 17.09.2025 wird als nicht eingetragen veröffentlicht:\nDen Gläubigern der an der Ausgliederung beteiligten Rechtsträger ist, wenn sie binnen sechs Monaten nach dem Tag, an dem die Eintragung der Ausgliederung in das Register des Sitzes desjenigen Rechtsträgers, dessen Gläubiger sie sind, als bekannt gemacht gilt, ihren Anspruch nach Grund und Höhe schriftlich anmelden, Sicherheit zu leisten, soweit sie nicht Befriedigung verlangen können. Dieses Recht steht den Gläubigern jedoch nur zu, wenn sie glaubhaft machen, dass durch die Ausgliederung die Erfüllung ihrer Forderung gefährdet wird."
    },
    {
      "date": "2025-09-18",
      "id": "130169",
      "original_text": "Registerbekanntmachung nach dem Umwandlungsgesetz\nBaden-Württemberg Amtsgericht Mannheim HRB 718292\nIsaak Holding GmbH – Boxberg",
      "type": "Registerbekanntmachung nach dem Umwandlungsgesetz",
      "state": "Baden-Württemberg",
      "amtsgericht": "Amtsgericht Mannheim",
      "registernummer": "HRB 718292",
      "registerart": "HRB",
      "company_name": "Isaak Holding GmbH",
      "company_seat": "Boxberg",
      "details": "18.09.2025 (Bekanntmachungsdatum)\n\nBaden-Württemberg Amtsgericht Mannheim HRB 718292\nRegisterbekanntmachung nach dem Umwandlungsgesetz 18.09.2025 (Eintragungsdatum)\n\nIsaak Holding GmbH\nGesellschaft mit beschränkter Haftung\nBoxberg\n\nAls nicht eingetragen wird bekanntgemacht:\nDen Gläubigern der an der Verschmelzung beteiligten Rechtsträger ist, wenn sie binnen sechs Monaten nach dem Tag, an dem die Eintragung der Verschmelzung in das Register des Sitzes desjenigen Rechtsträgers, dessen Gläubiger sie sind, nach § 19 Abs. 3 UmwG als bekanntgemacht gilt, ihren Anspruch nach Grund und Höhe schriftlich anmelden, Sicherheit zu leisten, soweit sie nicht Befriedigung verlangen können. Dieses Recht steht den Gläubigern jedoch nur zu, wenn sie glaubhaft machen, dass durch die Verschmelzung die Erfüllung ihrer Forderung gefährdet wird."
    },
    {
      "date": "2025-09-18",
      "id": "130170",
      "original_text": "Registerbekanntmachung nach dem Umwandlungsgesetz\nMecklenburg-Vorpommern Amtsgericht Neubrandenburg HRB 22140\nFairWind Deutschland GmbH – Blankensee",
      "type": "Registerbekanntmachung nach dem Umwandlungsgesetz",
      "state": "Mecklenburg-Vorpommern",
      "amtsgericht": "Amtsgericht Neubrandenburg",
      "registernummer": "HRB 22140",
      "registerart": "HRB",
      "company_name": "FairWind Deutschland GmbH",
      "company_seat": "Blankensee",
      "details": "18.09.2025 (Bekanntmachungsdatum)\n\nMecklenburg-Vorpommern Amtsgericht Neubrandenburg HRB 22140\nRegisterbekanntmachung nach dem Umwandlungsgesetz 18.09.2025 (Eintragungsdatum)\n\nFairWind Deutschland GmbH\nGesellschaft mit beschränkter Haftung\nBlankensee\n\nAls nicht eingetragen wird veröffentlicht: Den Gläubigern der an der Umwandlung beteiligten Rechtsträger ist, wenn sie binnen sechs\nMonaten nach dem Tag, an dem die Eintragung der Umwandlung in das Register des Sitzes desjenigen Rechtsträgers, dessen Gläubiger sie sind, nach § 19 Abs. 3 UmwG als bekannt gemacht gilt, ihren Anspruch nach Grund und Höhe in Textform anmelden, Sicherheit zu leisten, soweit sie nicht Befriedigung verlangen können. Dieses Recht steht den Gläubigern jedoch nur zu, wenn sie glaubhaft machen, dass durch die Umwandlung die Erfüllung der Forderung gefährdet wird."
    },
    {
      "date": "2025-09-18",
      "id": "130171",
      "original_text": "Registerbekanntmachung nach dem Umwandlungsgesetz\nSchleswig-Holstein Amtsgericht Lübeck VR 272 OL\nDeutsches Rotes Kreuz Ortsverein Neustadt in Holstein e.V. – Neustadt in Holstein",
      "type": "Registerbekanntmachung nach dem Umwandlungsgesetz",
      "state": "Schleswig-Holstein",
      "amtsgericht": "Amtsgericht Lübeck",
      "registernummer": "VR 272 OL",
      "registerart": "VR",
      "company_name": "Deutsches Rotes Kreuz Ortsverein Neustadt in Holstein e.V.",
      "company_seat": "Neustadt in Holstein",
      "details": "18.09.2025 (Bekanntmachungsdatum)\n\nSchleswig-Holstein Amtsgericht Lübeck VR 272 OL\nRegisterbekanntmachung nach dem Umwandlungsgesetz 17.09.2025 (Eintragungsdatum)\n\nDeutsches Rotes Kreuz Ortsverein Neustadt in Holstein e.V.\neingetragener Verein\nNeustadt in Holstein\n\nZu Eintragungsnummer 15 vom 17.09.2025 wird als nicht eingetragen veröffentlicht:\nDen Gläubigern der an der Verschmelzung beteiligten Rechtsträger ist, wenn sie binnen sechs Monaten nach dem Tag, an dem die Eintragung der Verschmelzung in das Register des Sitzes desjenigen Rechtsträgers, dessen Gläubiger sie sind, als bekannt gemacht gilt, ihren Anspruch nach Grund und Höhe schriftlich anmelden, Sicherheit zu leisten, soweit sie nicht Befriedigung verlangen können. Dieses Recht steht den Gläubigern jedoch nur zu, wenn sie glaubhaft machen, dass durch die Verschmelzung die Erfüllung ihrer Forderung gefährdet wird."
    },
    {
      "date": "2025-09-18",
      "id": "130172",
      "original_text": "Registerbekanntmachung nach dem Umwandlungsgesetz\nBaden-Württemberg Amtsgericht Stuttgart HRA 742505\nHasan Yildizbas - Hotel am Schillerplatz - e.K. – Pleidelsheim",
      "type": "Registerbekanntmachung nach dem Umwandlungsgesetz",
      "state": "Baden-Württemberg",
      "amtsgericht": "Amtsgericht Stuttgart",
      "registernummer": "HRA 742505",
      "registerart": "HRA",
      "company_name": "Hasan Yildizbas - Hotel am Schillerplatz - e.K.",
      "company_seat": "Pleidelsheim",
      "details": "18.09.2025 (Bekanntmachungsdatum)\n\nBaden-Württemberg Amtsgericht Stuttgart HRA 742505\nRegisterbekanntmachung nach dem Umwandlungsgesetz 18.09.2025 (Eintragungsdatum)\n\nHasan Yildizbas - Hotel am Schillerplatz - e.K.\nEinzelkaufmann / Einzelkauffrau\nPleidelsheim\n\nDen Gläubigern der an der Ausgliederung beteiligten Rechtsträger ist, wenn sie binnen sechs Monaten nach dem Tag, an dem die Eintragung der Ausgliederung in das Register des Sitzes desjenigen Rechtsträgers, dessen Gläubiger sie sind, nach § 19 Abs. 3 UmwG als bekanntgemacht gilt, ihren Anspruch nach Grund und Höhe schriftlich anmelden, Sicherheit zu leisten, soweit sie nicht Befriedigung verlangen können. Dieses Recht steht den Gläubigern jedoch nur zu, wenn sie glaubhaft machen, dass durch die Ausgliederung die Erfüllung ihrer Forderung gefährdet wird."
    },
    {
      "date": "2025-09-18",
      "id": "130173",
      "original_text": "Einreichung neuer Dokumente\nSaarland Amtsgericht Saarbrücken HRB 26590\nSHS - Stahl-Holding-Saar GmbH & Co. KGaA – Dillingen",
      "type": "Einreichung neuer Dokumente",
      "state": "Saarland",
      "amtsgericht": "Amtsgericht Saarbrücken",
      "registernummer": "HRB 26590",
      "registerart": "HRB",
      "company_name": "SHS - Stahl-Holding-Saar GmbH & Co. KGaA",
      "company_seat": "Dillingen",
      "details": "18.09.2025 (Bekanntmachungsdatum)\n\nSaarland Amtsgericht Saarbrücken HRB 26590\nEinreichung neuer Dokumente 18.09.2025 (Eintragungsdatum)\n\nSHS - Stahl-Holding-Saar GmbH & Co. KGaA\nKommanditgesellschaft auf Aktien\nDillingen\n\nDer bzw. die persönlich haftende/n Gesellschafter der Gesellschaft haben eine Liste der Mitglieder des Aufsichtsrats zum Handelsregister eingereicht (§§ 278, 106 AktG)."
    },
    {
      "date": "2025-09-18",
      "id": "130174",
      "original_text": "Registerbekanntmachung nach dem Umwandlungsgesetz\nBaden-Württemberg Amtsgericht Stuttgart HRB 792903\nMessl Holding GmbH – Neckarwestheim",
      "type": "Registerbekanntmachung nach dem Umwandlungsgesetz",
      "state": "Baden-Württemberg",
      "amtsgericht": "Amtsgericht Stuttgart",
      "registernummer": "HRB 792903",
      "registerart": "HRB",
      "company_name": "Messl Holding GmbH",
      "company_seat": "Neckarwestheim",
      "details": "18.09.2025 (Bekanntmachungsdatum)\n\nBaden-Württemberg Amtsgericht Stuttgart HRB 792903\nRegisterbekanntmachung nach dem Umwandlungsgesetz 18.09.2025 (Eintragungsdatum)\n\nMessl Holding GmbH\nGesellschaft mit beschränkter Haftung\nNeckarwestheim\n\nDen Gläubigern der an der Verschmelzung beteiligten Rechtsträger ist, wenn sie binnen sechs Monaten nach dem Tag, an dem die Eintragung der Verschmelzung in das Register des Sitzes desjenigen Rechtsträgers, dessen Gläubiger sie sind, nach § 19 Abs. 3 UmwG als bekanntgemacht gilt, ihren Anspruch nach Grund und Höhe schriftlich anmelden, Sicherheit zu leisten, soweit sie nicht Befriedigung verlangen können. Dieses Recht steht den Gläubigern jedoch nur zu, wenn sie glaubhaft machen, dass durch die Verschmelzung die Erfüllung ihrer Forderung gefährdet wird."
    },
    {
      "date": "2025-09-18",
      "id": "130175",
      "original_text": "Löschungsankündigung\nBerlin Amtsgericht Berlin (Charlottenburg) HRB 175871\nMoxley Services UG (haftungsbeschränkt) – Berlin",
      "type": "Löschungsankündigung",
      "state": "Berlin",
      "amtsgericht": "Amtsgericht Berlin (Charlottenburg)",
      "registernummer": "HRB 175871",
      "registerart": "HRB",
      "company_name": "Moxley Services UG (haftungsbeschränkt)",
      "company_seat": "Berlin",
      "details": "18.09.2025 (Bekanntmachungsdatum)\n\nBerlin Amtsgericht Berlin (Charlottenburg) HRB 175871\nLöschungsankündigung\n\nMoxley Services UG (haftungsbeschränkt)\nGesellschaft mit beschränkter Haftung\nBerlin\n\nBei der nachstehenden Gesellschaft wird das Amtslöschungsverfahren gemäß § 394 FamFG eingeleitet. Widerspruchsfrist 6 Wochen"
    },
    {
      "date": "2025-09-18",
      "id": "130176",
      "original_text": "Einreichung neuer Dokumente\nBerlin Amtsgericht Berlin (Charlottenburg) HRB 91791\nVivantes Service GmbH – Berlin",
      "type": "Einreichung neuer Dokumente",
      "state": "Berlin",
      "amtsgericht": "Amtsgericht Berlin (Charlottenburg)",
      "registernummer": "HRB 91791",
      "registerart": "HRB",
      "company_name": "Vivantes Service GmbH",
      "company_seat": "Berlin",
      "details": "18.09.2025 (Bekanntmachungsdatum)\n\nBerlin Amtsgericht Berlin (Charlottenburg) HRB 91791\nEinreichung neuer Dokumente\n\nVivantes Service GmbH\nGesellschaft mit beschränkter Haftung\nBerlin\n\nAls nicht eingetragen wird veröffentlicht: Es wurde eine neue Liste der Aufsichtsratsmitglieder eingereicht (§52 GmbHG)."
    },
    {
      "date": "2025-09-18",
      "id": "130177",
      "original_text": "Registerbekanntmachung nach dem Umwandlungsgesetz\nSchleswig-Holstein Amtsgericht Lübeck VR 3438\nDeutsches Rotes Kreuz Ortsverein Schashagen e.V. – Schashagen",
      "type": "Registerbekanntmachung nach dem Umwandlungsgesetz",
      "state": "Schleswig-Holstein",
      "amtsgericht": "Amtsgericht Lübeck",
      "registernummer": "VR 3438",
      "registerart": "VR",
      "company_name": "Deutsches Rotes Kreuz Ortsverein Schashagen e.V.",
      "company_seat": "Schashagen",
      "details": "18.09.2025 (Bekanntmachungsdatum)\n\nSchleswig-Holstein Amtsgericht Lübeck VR 3438\nRegisterbekanntmachung nach dem Umwandlungsgesetz 17.09.2025 (Eintragungsdatum)\n\nDeutsches Rotes Kreuz Ortsverein Schashagen e.V.\neingetragener Verein\nSchashagen\n\nZu Eintragungsnummer 4 vom 17.09.2025 wird als nicht eingetragen veröffentlicht:\nDen Gläubigern der an der Verschmelzung beteiligten Rechtsträger ist, wenn sie binnen sechs Monaten nach dem Tag, an dem die Eintragung der Verschmelzung in das Register des Sitzes desjenigen Rechtsträgers, dessen Gläubiger sie sind, als bekannt gemacht gilt, ihren Anspruch nach Grund und Höhe schriftlich anmelden, Sicherheit zu leisten, soweit sie nicht Befriedigung verlangen können. Dieses Recht steht den Gläubigern jedoch nur zu, wenn sie glaubhaft machen, dass durch die Verschmelzung die Erfüllung ihrer Forderung gefährdet wird."
    },
    {
      "date": "2025-09-18",
      "id": "130178",
      "original_text": "Registerbekanntmachung nach dem Umwandlungsgesetz\nBerlin Amtsgericht Berlin (Charlottenburg) HRB 176365\nTele Columbus Netz GmbH – Berlin",
      "type": "Registerbekanntmachung nach dem Umwandlungsgesetz",
      "state": "Berlin",
      "amtsgericht": "Amtsgericht Berlin (Charlottenburg)",
      "registernummer": "HRB 176365",
      "registerart": "HRB",
      "company_name": "Tele Columbus Netz GmbH",
      "company_seat": "Berlin",
      "details": "18.09.2025 (Bekanntmachungsdatum)\n\nBerlin Amtsgericht Berlin (Charlottenburg) HRB 176365\nRegisterbekanntmachung nach dem Umwandlungsgesetz 17.09.2025 (Eintragungsdatum)\n\nTele Columbus Netz GmbH\nGesellschaft mit beschränkter Haftung\nBerlin\n\nZu Eintragungsnummer 33 vom 17.09.2025 wird als nicht eingetragen veröffentlicht:Den Gläubigern der an der Verschmelzung beteiligten Rechtsträger ist, wenn sie binnen sechs Monaten nach dem Tag, an dem die Eintragung der Verschmelzung in das Register des Sitzes desjenigen Rechtsträgers, dessen Gläubiger sie sind, als bekannt gemacht gilt, ihren Anspruch nach Grund und Höhe schriftlich anmelden, Sicherheit zu leisten, soweit sie nicht Befriedigung verlangen können. Dieses Recht steht den Gläubigern jedoch nur zu, wenn sie glaubhaft machen, dass durch die Verschmelzung die Erfüllung ihrer Forderung gefährdet wird. Das Recht, Sicherheitsleistung zu verlangen, steht Gläubigern nicht zu, die im Falle der Insolvenz ein Recht auf vorzugsweise Befriedigung aus einer Deckungsmasse haben, die nach gesetzlicher Vorschrift zu ihrem Schutz errichtet und staatlich überwacht ist."
    },
    {
      "date": "2025-09-18",
      "id": "130179",
      "original_text": "Registerbekanntmachung nach dem Umwandlungsgesetz\nBaden-Württemberg Amtsgericht Stuttgart HRA 742627\nStellrecht Elektrotechnik Service Obersulm GmbH & Co. KG – Obersulm",
      "type": "Registerbekanntmachung nach dem Umwandlungsgesetz",
      "state": "Baden-Württemberg",
      "amtsgericht": "Amtsgericht Stuttgart",
      "registernummer": "HRA 742627",
      "registerart": "HRA",
      "company_name": "Stellrecht Elektrotechnik Service Obersulm GmbH & Co. KG",
      "company_seat": "Obersulm",
      "details": "18.09.2025 (Bekanntmachungsdatum)\n\nBaden-Württemberg Amtsgericht Stuttgart HRA 742627\nRegisterbekanntmachung nach dem Umwandlungsgesetz 18.09.2025 (Eintragungsdatum)\n\nStellrecht Elektrotechnik Service Obersulm GmbH & Co. KG\nKommanditgesellschaft\nObersulm\n\nDen Gläubigern der an der Ausgliederung beteiligten Rechtsträger ist, wenn sie binnen sechs Monaten nach dem Tag, an dem die Eintragung der Ausgliederung in das Register des Sitzes desjenigen Rechtsträgers, dessen Gläubiger sie sind, nach § 19 Abs. 3 UmwG als bekanntgemacht gilt, ihren Anspruch nach Grund und Höhe schriftlich anmelden, Sicherheit zu leisten, soweit sie nicht Befriedigung verlangen können. Dieses Recht steht den Gläubigern jedoch nur zu, wenn sie glaubhaft machen, dass durch die Ausgliederung die Erfüllung ihrer Forderung gefährdet wird."
    },
    {
      "date": "2025-09-18",
      "id": "130180",
      "original_text": "Einreichung neuer Dokumente\nBrandenburg Amtsgericht Cottbus HRB 9380\nFlughafen Berlin Brandenburg GmbH – Schönefeld",
      "type": "Einreichung neuer Dokumente",
      "state": "Brandenburg",
      "amtsgericht": "Amtsgericht Cottbus",
      "registernummer": "HRB 9380",
      "registerart": "HRB",
      "company_name": "Flughafen Berlin Brandenburg GmbH",
      "company_seat": "Schönefeld",
      "details": "18.09.2025 (Bekanntmachungsdatum)\n\nBrandenburg Amtsgericht Cottbus HRB 9380\nEinreichung neuer Dokumente\n\nFlughafen Berlin Brandenburg GmbH\nGesellschaft mit beschränkter Haftung\nSchönefeld\n\nDer Geschäftsführer hat eine Liste der Aufsichtsratsmitglieder gem. § 52 Abs. 2 Satz 2 GmbHG zum Handelsregister eingereicht"
    },
    {
      "date": "2025-09-18",
      "id": "130181",
      "original_text": "Registerbekanntmachung nach dem Umwandlungsgesetz\nBaden-Württemberg Amtsgericht Mannheim HRA 712431\nSauer Sports GmbH & Co. KG – Remchingen",
      "type": "Registerbekanntmachung nach dem Umwandlungsgesetz",
      "state": "Baden-Württemberg",
      "amtsgericht": "Amtsgericht Mannheim",
      "registernummer": "HRA 712431",
      "registerart": "HRA",
      "company_name": "Sauer Sports GmbH & Co. KG",
      "company_seat": "Remchingen",
      "details": "18.09.2025 (Bekanntmachungsdatum)\n\nBaden-Württemberg Amtsgericht Mannheim HRA 712431\nRegisterbekanntmachung nach dem Umwandlungsgesetz 18.09.2025 (Eintragungsdatum)\n\nSauer Sports GmbH & Co. KG\nKommanditgesellschaft\nRemchingen\n\nAls nicht eingetragen wird bekanntgemacht:\nDen Gläubigern der an der Ausgliederung beteiligten Rechtsträger ist, wenn sie binnen sechs Monaten nach dem Tag, an dem die Eintragung der Ausgliederung in das Register des Sitzes desjenigen Rechtsträgers, dessen Gläubiger sie sind, nach § 19 Abs. 3 UmwG als bekanntgemacht gilt, ihren Anspruch nach Grund und Höhe schriftlich anmelden, Sicherheit zu leisten, soweit sie nicht Befriedigung verlangen können. Dieses Recht steht den Gläubigern jedoch nur zu, wenn sie glaubhaft machen, dass durch die Ausgliederung die Erfüllung ihrer Forderung gefährdet wird."
    },
    {
      "date": "2025-09-18",
      "id": "130182",
      "original_text": "Registerbekanntmachung nach dem Umwandlungsgesetz\nSchleswig-Holstein Amtsgericht Lübeck HRA 11537\nChristophel e.K. – Lübeck",
      "type": "Registerbekanntmachung nach dem Umwandlungsgesetz",
      "state": "Schleswig-Holstein",
      "amtsgericht": "Amtsgericht Lübeck",
      "registernummer": "HRA 11537",
      "registerart": "HRA",
      "company_name": "Christophel e.K.",
      "company_seat": "Lübeck",
      "details": "18.09.2025 (Bekanntmachungsdatum)\n\nSchleswig-Holstein Amtsgericht Lübeck HRA 11537\nRegisterbekanntmachung nach dem Umwandlungsgesetz 17.09.2025 (Eintragungsdatum)\n\nChristophel e.K.\nEinzelkaufmann / Einzelkauffrau\nLübeck\n\nZu Eintragungsnummer 2 vom 17.09.2025 wird als nicht eingetragen veröffentlicht:\nDen Gläubigern der an der Ausgliederung beteiligten Rechtsträger ist, wenn sie binnen sechs Monaten nach dem Tag, an dem die Eintragung der Ausgliederung in das Register des Sitzes desjenigen Rechtsträgers, dessen Gläubiger sie sind, als bekannt gemacht gilt, ihren Anspruch nach Grund und Höhe schriftlich anmelden, Sicherheit zu leisten, soweit sie nicht Befriedigung verlangen können. Dieses Recht steht den Gläubigern jedoch nur zu, wenn sie glaubhaft machen, dass durch die Ausgliederung die Erfüllung ihrer Forderung gefährdet wird."
    },
    {
      "date": "2025-09-18",
      "id": "130183",
      "original_text": "Registerbekanntmachung nach dem Umwandlungsgesetz\nBaden-Württemberg Amtsgericht Mannheim HRA 712257\nHerbert Sauer e.K. – Remchingen",
      "type": "Registerbekanntmachung nach dem Umwandlungsgesetz",
      "state": "Baden-Württemberg",
      "amtsgericht": "Amtsgericht Mannheim",
      "registernummer": "HRA 712257",
      "registerart": "HRA",
      "company_name": "Herbert Sauer e.K.",
      "company_seat": "Remchingen",
      "details": "18.09.2025 (Bekanntmachungsdatum)\n\nBaden-Württemberg Amtsgericht Mannheim HRA 712257\nRegisterbekanntmachung nach dem Umwandlungsgesetz 18.09.2025 (Eintragungsdatum)\n\nHerbert Sauer e.K.\nEinzelkaufmann / Einzelkauffrau\nRemchingen\n\nAls nicht eingetragen wird bekanntgemacht:\nDen Gläubigern der an der Ausgliederung beteiligten Rechtsträger ist, wenn sie binnen sechs Monaten nach dem Tag, an dem die Eintragung der Ausgliederung in das Register des Sitzes desjenigen Rechtsträgers, dessen Gläubiger sie sind, nach § 19 Abs. 3 UmwG als bekanntgemacht gilt, ihren Anspruch nach Grund und Höhe schriftlich anmelden, Sicherheit zu leisten, soweit sie nicht Befriedigung verlangen können. Dieses Recht steht den Gläubigern jedoch nur zu, wenn sie glaubhaft machen, dass durch die Ausgliederung die Erfüllung ihrer Forderung gefährdet wird."
    },
    {
      "date": "2025-09-18",
      "id": "130184",
      "original_text": "Löschungsankündigung\nBerlin Amtsgericht Berlin (Charlottenburg) HRB 133272\nBIP-Business in Progress UG (haftungsbeschränkt) – Berlin",
      "type": "Löschungsankündigung",
      "state": "Berlin",
      "amtsgericht": "Amtsgericht Berlin (Charlottenburg)",
      "registernummer": "HRB 133272",
      "registerart": "HRB",
      "company_name": "BIP-Business in Progress UG (haftungsbeschränkt)",
      "company_seat": "Berlin",
      "details": "18.09.2025 (Bekanntmachungsdatum)\n\nBerlin Amtsgericht Berlin (Charlottenburg) HRB 133272\nLöschungsankündigung\n\nBIP-Business in Progress UG (haftungsbeschränkt)\nGesellschaft mit beschränkter Haftung\nBerlin\n\nBei der nachstehenden Gesellschaft wird das Amtslöschungsverfahren gemäß § 394 FamFG eingeleitet. Widerspruchsfrist 6 Wochen"
    },
    {
      "date": "2025-09-18",
      "id": "130185",
      "original_text": "Registerbekanntmachung nach dem Umwandlungsgesetz\nBaden-Württemberg Amtsgericht Stuttgart HRA 738069\nStellrecht Elektrotechnik e.K. – Obersulm",
      "type": "Registerbekanntmachung nach dem Umwandlungsgesetz",
      "state": "Baden-Württemberg",
      "amtsgericht": "Amtsgericht Stuttgart",
      "registernummer": "HRA 738069",
      "registerart": "HRA",
      "company_name": "Stellrecht Elektrotechnik e.K.",
      "company_seat": "Obersulm",
      "details": "18.09.2025 (Bekanntmachungsdatum)\n\nBaden-Württemberg Amtsgericht Stuttgart HRA 738069\nRegisterbekanntmachung nach dem Umwandlungsgesetz 18.09.2025 (Eintragungsdatum)\n\nStellrecht Elektrotechnik e.K.\nEinzelkaufmann / Einzelkauffrau\nObersulm\n\nAls nicht eingetragen wird bekanntgemacht:\nDen Gläubigern der an der Ausgliederung beteiligten Rechtsträger ist, wenn sie binnen sechs Monaten nach dem Tag, an dem die Eintragung der Ausgliederung in das Register des Sitzes desjenigen Rechtsträgers, dessen Gläubiger sie sind, nach § 19 Abs. 3 UmwG als bekanntgemacht gilt, ihren Anspruch nach Grund und Höhe schriftlich anmelden, Sicherheit zu leisten, soweit sie nicht Befriedigung verlangen können. Dieses Recht steht den Gläubigern jedoch nur zu, wenn sie glaubhaft machen, dass durch die Ausgliederung die Erfüllung ihrer Forderung gefährdet wird."
    },
    {
      "date": "2025-09-18",
      "id": "130186",
      "original_text": "Löschungsankündigung\nBerlin Amtsgericht Berlin (Charlottenburg) HRB 198126\nGodd Food & Beverage GmbH – Berlin",
      "type": "Löschungsankündigung",
      "state": "Berlin",
      "amtsgericht": "Amtsgericht Berlin (Charlottenburg)",
      "registernummer": "HRB 198126",
      "registerart": "HRB",
      "company_name": "Godd Food & Beverage GmbH",
      "company_seat": "Berlin",
      "details": "18.09.2025 (Bekanntmachungsdatum)\n\nBerlin Amtsgericht Berlin (Charlottenburg) HRB 198126\nLöschungsankündigung\n\nGodd Food & Beverage GmbH\nGesellschaft mit beschränkter Haftung\nBerlin\n\nBei der nachstehenden Gesellschaft wird das Amtslöschungsverfahren gemäß § 394 FamFG eingeleitet. Widerspruchsfrist 6 Wochen"
    },
    {
      "date": "2025-09-18",
      "id": "130187",
      "original_text": "Registerbekanntmachung nach dem Umwandlungsgesetz\nHamburg Amtsgericht Hamburg HRB 183404\nANYWR Germany GmbH – Hamburg",
      "type": "Registerbekanntmachung nach dem Umwandlungsgesetz",
      "state": "Hamburg",
      "amtsgericht": "Amtsgericht Hamburg",
      "registernummer": "HRB 183404",
      "registerart": "HRB",
      "company_name": "ANYWR Germany GmbH",
      "company_seat": "Hamburg",
      "details": "18.09.2025 (Bekanntmachungsdatum)\n\nHamburg Amtsgericht Hamburg HRB 183404\nRegisterbekanntmachung nach dem Umwandlungsgesetz 18.09.2025 (Eintragungsdatum)\n\nANYWR Germany GmbH\nGesellschaft mit beschränkter Haftung\nHamburg\n\nAls nicht eingetragen wird bekannt gemacht:\nDen Gläubigern der an der formwechselnden Umwandlung beteiligten Gesellschaften ist, wenn sie binnen sechs Monaten nach dem Tag, an dem die Eintragung der formwechselnden Umwandlung in das Register des Sitzes desjenigen Rechtsträgers, dessen Gläubiger sie sind, nach § 19 Absatz 3 UmwG als bekannt gemacht gilt, ihren Anspruch nach Grund und Höhe schriftlich anmelden, Sicherheit zu leisten, soweit sie nicht Befriedigung verlangen können. Dieses Recht steht den Gläubigern jedoch nur zu, wenn sie glaubhaft machen, dass durch die formwechselnde Umwandlung die Erfüllung ihrer Forderung gefährdet wird."
    },
    {
      "date": "2025-09-18",
      "id": "130188",
      "original_text": "Registerbekanntmachung nach dem Umwandlungsgesetz\nHamburg Amtsgericht Hamburg HRB 184135\nLazaridis Beteiligungs GmbH – Hamburg",
      "type": "Registerbekanntmachung nach dem Umwandlungsgesetz",
      "state": "Hamburg",
      "amtsgericht": "Amtsgericht Hamburg",
      "registernummer": "HRB 184135",
      "registerart": "HRB",
      "company_name": "Lazaridis Beteiligungs GmbH",
      "company_seat": "Hamburg",
      "details": "18.09.2025 (Bekanntmachungsdatum)\n\nHamburg Amtsgericht Hamburg HRB 184135\nRegisterbekanntmachung nach dem Umwandlungsgesetz 18.09.2025 (Eintragungsdatum)\n\nLazaridis Beteiligungs GmbH\nGesellschaft mit beschränkter Haftung\nHamburg\n\nAls nicht eingetragen wird bekannt gemacht:\nDen Gläubigern der an der Verschmelzung beteiligten Gesellschaften ist, wenn sie binnen sechs Monaten nach dem Tag, an dem die Eintragung der Verschmelzung in das Register des Sitzes desjenigen Rechtsträgers, dessen Gläubiger sie sind, nach § 19 Absatz 3 UmwG als bekannt gemacht gilt, ihren Anspruch nach Grund und Höhe schriftlich anmelden, Sicherheit zu leisten, soweit sie nicht Befriedigung verlangen können. Dieses Recht steht den Gläubigern jedoch nur zu, wenn sie glaubhaft machen, dass durch die Verschmelzung die Erfüllung ihrer Forderung gefährdet wird."
    },
    {
      "date": "2025-09-18",
      "id": "130189",
      "original_text": "Registerbekanntmachung nach dem Umwandlungsgesetz\nHamburg Amtsgericht Hamburg HRA 132815\nANYWR SAS & Co. KG – Hamburg",
      "type": "Registerbekanntmachung nach dem Umwandlungsgesetz",
      "state": "Hamburg",
      "amtsgericht": "Amtsgericht Hamburg",
      "registernummer": "HRA 132815",
      "registerart": "HRA",
      "company_name": "ANYWR SAS & Co. KG",
      "company_seat": "Hamburg",
      "details": "18.09.2025 (Bekanntmachungsdatum)\n\nHamburg Amtsgericht Hamburg HRA 132815\nRegisterbekanntmachung nach dem Umwandlungsgesetz 18.09.2025 (Eintragungsdatum)\n\nANYWR SAS & Co. KG\nKommanditgesellschaft\nHamburg\n\nAls nicht eingetragen wird bekannt gemacht:\nDen Gläubigern der an der Ausgliederung beteiligten Gesellschaften ist, wenn sie binnen sechs Monaten nach dem Tag, an dem die Eintragung der Ausgliederung in das Register des Sitzes desjenigen Rechtsträgers, dessen Gläubiger sie sind, nach § 19 Absatz 3 UmwG als bekannt gemacht gilt, ihren Anspruch nach Grund und Höhe schriftlich anmelden, Sicherheit zu leisten, soweit sie nicht Befriedigung verlangen können. Dieses Recht steht den Gläubigern jedoch nur zu, wenn sie glaubhaft machen, dass durch die Ausgliederung die Erfüllung ihrer Forderung gefährdet wird."
    },
    {
      "date": "2025-09-18",
      "id": "130190",
      "original_text": "Löschungsankündigung\nMecklenburg-Vorpommern Amtsgericht Rostock HRB 8075\nMULTICOM GMBH – Bad Doberan",
      "type": "Löschungsankündigung",
      "state": "Mecklenburg-Vorpommern",
      "amtsgericht": "Amtsgericht Rostock",
      "registernummer": "HRB 8075",
      "registerart": "HRB",
      "company_name": "MULTICOM GMBH",
      "company_seat": "Bad Doberan",
      "details": "18.09.2025 (Bekanntmachungsdatum)\n\nMecklenburg-Vorpommern Amtsgericht Rostock HRB 8075\nLöschungsankündigung\n\nMULTICOM GMBH\nGesellschaft mit beschränkter Haftung\nBad Doberan\n\nDas Registergericht beabsichtigt, die im Handelsregister eingetragene Gesellschaft von Amts wegen nach § 394 FamFG zu löschen. Die Frist zur Erhebung eines Widerspruchs gegen die beabsichtigte Löschung wird auf 1 Monat festgesetzt."
    },
    {
      "date": "2025-09-18",
      "id": "130191",
      "original_text": "Registerbekanntmachung nach dem Umwandlungsgesetz\nBaden-Württemberg Amtsgericht Mannheim HRB 742502\nAugenblick Mannheim-Zentrum MVZ GmbH – Mannheim",
      "type": "Registerbekanntmachung nach dem Umwandlungsgesetz",
      "state": "Baden-Württemberg",
      "amtsgericht": "Amtsgericht Mannheim",
      "registernummer": "HRB 742502",
      "registerart": "HRB",
      "company_name": "Augenblick Mannheim-Zentrum MVZ GmbH",
      "company_seat": "Mannheim",
      "details": "18.09.2025 (Bekanntmachungsdatum)\n\nBaden-Württemberg Amtsgericht Mannheim HRB 742502\nRegisterbekanntmachung nach dem Umwandlungsgesetz 18.09.2025 (Eintragungsdatum)\n\nAugenblick Mannheim-Zentrum MVZ GmbH\nGesellschaft mit beschränkter Haftung\nMannheim\n\nDen Gläubigern der an der Verschmelzung beteiligten Rechtsträger ist, wenn sie binnen sechs Monaten nach dem Tag, an dem die Eintragung der Verschmelzung in das Register des Sitzes desjenigen Rechtsträgers, dessen Gläubiger sie sind, nach § 19 Abs. 3 UmwG als bekanntgemacht gilt, ihren Anspruch nach Grund und Höhe schriftlich anmelden, Sicherheit zu leisten, soweit sie nicht Befriedigung verlangen können. Dieses Recht steht den Gläubigern jedoch nur zu, wenn sie glaubhaft machen, dass durch die Verschmelzung die Erfüllung ihrer Forderung gefährdet wird."
    },
    {
      "date": "2025-09-18",
      "id": "130192",
      "original_text": "Registerbekanntmachung nach dem Umwandlungsgesetz\nBaden-Württemberg Amtsgericht Stuttgart HRB 22881\nFIBEG GMBH – Stuttgart",
      "type": "Registerbekanntmachung nach dem Umwandlungsgesetz",
      "state": "Baden-Württemberg",
      "amtsgericht": "Amtsgericht Stuttgart",
      "registernummer": "HRB 22881",
      "registerart": "HRB",
      "company_name": "FIBEG GMBH",
      "company_seat": "Stuttgart",
      "details": "18.09.2025 (Bekanntmachungsdatum)\n\nBaden-Württemberg Amtsgericht Stuttgart HRB 22881\nRegisterbekanntmachung nach dem Umwandlungsgesetz 18.09.2025 (Eintragungsdatum)\n\nFIBEG GMBH\nGesellschaft mit beschränkter Haftung\nStuttgart\n\nAls nicht eingetragen wird bekanntgemacht:\nDen Gläubigern der an der Verschmelzung beteiligten Rechtsträger ist, wenn sie binnen sechs Monaten nach dem Tag, an dem die Eintragung der Verschmelzung in das Register des Sitzes desjenigen Rechtsträgers, dessen Gläubiger sie sind, nach § 19 Abs. 3 UmwG als bekanntgemacht gilt, ihren Anspruch nach Grund und Höhe schriftlich anmelden, Sicherheit zu leisten, soweit sie nicht Befriedigung verlangen können. Dieses Recht steht den Gläubigern jedoch nur zu, wenn sie glaubhaft machen, dass durch die Verschmelzung die Erfüllung ihrer Forderung gefährdet wird."
    },
    {
      "date": "2025-09-18",
      "id": "130193",
      "original_text": "Registerbekanntmachung nach dem Umwandlungsgesetz\nHamburg Amtsgericht Hamburg HRB 188622\nNCR Invest 2 GmbH – Hamburg",
      "type": "Registerbekanntmachung nach dem Umwandlungsgesetz",
      "state": "Hamburg",
      "amtsgericht": "Amtsgericht Hamburg",
      "registernummer": "HRB 188622",
      "registerart": "HRB",
      "company_name": "NCR Invest 2 GmbH",
      "company_seat": "Hamburg",
      "details": "18.09.2025 (Bekanntmachungsdatum)\n\nHamburg Amtsgericht Hamburg HRB 188622\nRegisterbekanntmachung nach dem Umwandlungsgesetz 18.09.2025 (Eintragungsdatum)\n\nNCR Invest 2 GmbH\nGesellschaft mit beschränkter Haftung\nHamburg\n\nAls nicht eingetragen wird bekannt gemacht:\nDen Gläubigern der an der grenzüberschreitenden Verschmelzung beteiligten übernehmenden Rechtsträger ist, wenn sie binnen sechs Monaten nach dem Tag, an dem die Eintragung der Verschmelzung in das Register des Sitzes desjenigen Rechtsträgers, dessen Gläubiger sie sind, nach § 19 Absatz 3 UmwG als bekanntgemacht gilt, ihren Anspruch nach Grund und Höhe schriftlich anmelden, Sicherheit zu leisten, soweit sie nicht Befriedigung verlangen können.\nDieses Recht steht den Gläubigern jedoch nur zu, wenn sie glaubhaft machen, dass durch die Verschmelzung die Erfüllung ihrer Forderung gefährdet wird."
    },
    {
      "date": "2025-09-18",
      "id": "130194",
      "original_text": "Registerbekanntmachung nach dem Umwandlungsgesetz\nHamburg Amtsgericht Hamburg HRB 182475\nLazaridis Verwaltungs GmbH – Hamburg",
      "type": "Registerbekanntmachung nach dem Umwandlungsgesetz",
      "state": "Hamburg",
      "amtsgericht": "Amtsgericht Hamburg",
      "registernummer": "HRB 182475",
      "registerart": "HRB",
      "company_name": "Lazaridis Verwaltungs GmbH",
      "company_seat": "Hamburg",
      "details": "18.09.2025 (Bekanntmachungsdatum)\n\nHamburg Amtsgericht Hamburg HRB 182475\nRegisterbekanntmachung nach dem Umwandlungsgesetz 18.09.2025 (Eintragungsdatum)\n\nLazaridis Verwaltungs GmbH\nGesellschaft mit beschränkter Haftung\nHamburg\n\nAls nicht eingetragen wird bekannt gemacht:\nDen Gläubigern der an der Verschmelzung beteiligten Gesellschaften ist, wenn sie binnen sechs Monaten nach dem Tag, an dem die Eintragung der Verschmelzung in das Register des Sitzes desjenigen Rechtsträgers, dessen Gläubiger sie sind, nach § 19 Absatz 3 UmwG als bekannt gemacht gilt, ihren Anspruch nach Grund und Höhe schriftlich anmelden, Sicherheit zu leisten, soweit sie nicht Befriedigung verlangen können. Dieses Recht steht den Gläubigern jedoch nur zu, wenn sie glaubhaft machen, dass durch die Verschmelzung die Erfüllung ihrer Forderung gefährdet wird."
    },
    {
      "date": "2025-09-18",
      "id": "130195",
      "original_text": "Registerbekanntmachung nach dem Umwandlungsgesetz\nBaden-Württemberg Amtsgericht Mannheim HRA 712764\nKöksal Ördek e.K. – Mannheim",
      "type": "Registerbekanntmachung nach dem Umwandlungsgesetz",
      "state": "Baden-Württemberg",
      "amtsgericht": "Amtsgericht Mannheim",
      "registernummer": "HRA 712764",
      "registerart": "HRA",
      "company_name": "Köksal Ördek e.K.",
      "company_seat": "Mannheim",
      "details": "18.09.2025 (Bekanntmachungsdatum)\n\nBaden-Württemberg Amtsgericht Mannheim HRA 712764\nRegisterbekanntmachung nach dem Umwandlungsgesetz 18.09.2025 (Eintragungsdatum)\n\nKöksal Ördek e.K.\nEinzelkaufmann / Einzelkauffrau\nMannheim\n\nDen Gläubigern der an der Ausgliederung beteiligten Rechtsträger ist, wenn sie binnen sechs Monaten nach dem Tag, an dem die Eintragung der Ausgliederung in das Register des Sitzes desjenigen Rechtsträgers, dessen Gläubiger sie sind, nach § 19 Abs. 3 UmwG als bekanntgemacht gilt, ihren Anspruch nach Grund und Höhe schriftlich anmelden, Sicherheit zu leisten, soweit sie nicht Befriedigung verlangen können. Dieses Recht steht den Gläubigern jedoch nur zu, wenn sie glaubhaft machen, dass durch die Ausgliederung die Erfüllung ihrer Forderung gefährdet wird."
    },
    {
      "date": "2025-09-18",
      "id": "130196",
      "original_text": "Registerbekanntmachung nach dem Umwandlungsgesetz\nBaden-Württemberg Amtsgericht Stuttgart HRB 226115\nBerliner Elektro-Technik GmbH – Tuttlingen",
      "type": "Registerbekanntmachung nach dem Umwandlungsgesetz",
      "state": "Baden-Württemberg",
      "amtsgericht": "Amtsgericht Stuttgart",
      "registernummer": "HRB 226115",
      "registerart": "HRB",
      "company_name": "Berliner Elektro-Technik GmbH",
      "company_seat": "Tuttlingen",
      "details": "18.09.2025 (Bekanntmachungsdatum)\n\nBaden-Württemberg Amtsgericht Stuttgart HRB 226115\nRegisterbekanntmachung nach dem Umwandlungsgesetz 18.09.2025 (Eintragungsdatum)\n\nBerliner Elektro-Technik GmbH\nGesellschaft mit beschränkter Haftung\nTuttlingen\n\nDen Gläubigern der an der Abspaltung beteiligten Rechtsträger ist, wenn sie binnen sechs Monaten nach dem Tag, an dem die Eintragung der Abspaltung in das Register des Sitzes desjenigen Rechtsträgers, dessen Gläubiger sie sind, nach § 19 Abs. 3 UmwG als bekanntgemacht gilt, ihren Anspruch nach Grund und Höhe schriftlich anmelden, Sicherheit zu leisten, soweit sie nicht Befriedigung verlangen können. Dieses Recht steht den Gläubigern jedoch nur zu, wenn sie glaubhaft machen, dass durch die Abspaltung die Erfüllung ihrer Forderung gefährdet wird."
    },
    {
      "date": "2025-09-18",
      "id": "130197",
      "original_text": "Registerbekanntmachung nach dem Umwandlungsgesetz\nBaden-Württemberg Amtsgericht Mannheim HRB 753565\nAIP ADESSA-BaWü GmbH – Mannheim",
      "type": "Registerbekanntmachung nach dem Umwandlungsgesetz",
      "state": "Baden-Württemberg",
      "amtsgericht": "Amtsgericht Mannheim",
      "registernummer": "HRB 753565",
      "registerart": "HRB",
      "company_name": "AIP ADESSA-BaWü GmbH",
      "company_seat": "Mannheim",
      "details": "18.09.2025 (Bekanntmachungsdatum)\n\nBaden-Württemberg Amtsgericht Mannheim HRB 753565\nRegisterbekanntmachung nach dem Umwandlungsgesetz 18.09.2025 (Eintragungsdatum)\n\nAIP ADESSA-BaWü GmbH\nGesellschaft mit beschränkter Haftung\nMannheim\n\nDen Gläubigern der an der Ausgliederung beteiligten Rechtsträger ist, wenn sie binnen sechs Monaten nach dem Tag, an dem die Eintragung der Ausgliederung in das Register des Sitzes desjenigen Rechtsträgers, dessen Gläubiger sie sind, nach § 19 Abs. 3 UmwG als bekanntgemacht gilt, ihren Anspruch nach Grund und Höhe schriftlich anmelden, Sicherheit zu leisten, soweit sie nicht Befriedigung verlangen können. Dieses Recht steht den Gläubigern jedoch nur zu, wenn sie glaubhaft machen, dass durch die Ausgliederung die Erfüllung ihrer Forderung gefährdet wird."
    },
    {
      "date": "2025-09-18",
      "id": "130198",
      "original_text": "Registerbekanntmachung nach dem Umwandlungsgesetz\nBerlin Amtsgericht Berlin (Charlottenburg) HRB 155099\nCenero Energy GmbH – Berlin",
      "type": "Registerbekanntmachung nach dem Umwandlungsgesetz",
      "state": "Berlin",
      "amtsgericht": "Amtsgericht Berlin (Charlottenburg)",
      "registernummer": "HRB 155099",
      "registerart": "HRB",
      "company_name": "Cenero Energy GmbH",
      "company_seat": "Berlin",
      "details": "18.09.2025 (Bekanntmachungsdatum)\n\nBerlin Amtsgericht Berlin (Charlottenburg) HRB 155099\nRegisterbekanntmachung nach dem Umwandlungsgesetz 16.09.2025 (Eintragungsdatum)\n\nCenero Energy GmbH\nGesellschaft mit beschränkter Haftung\nBerlin\n\nZu Eintragungsnummer 4 vom 16.09.2025 wird als nicht eingetragen veröffentlicht:Den Gläubigern der an der Verschmelzung beteiligten Rechtsträger ist, wenn sie binnen sechs Monaten nach dem Tag, an dem die Eintragung der Verschmelzung in das Register des Sitzes desjenigen Rechtsträgers, dessen Gläubiger sie sind, als bekannt gemacht gilt, ihren Anspruch nach Grund und Höhe schriftlich anmelden, Sicherheit zu leisten, soweit sie nicht Befriedigung verlangen können. Dieses Recht steht den Gläubigern jedoch nur zu, wenn sie glaubhaft machen, dass durch die Verschmelzung die Erfüllung ihrer Forderung gefährdet wird. Das Recht, Sicherheitsleistung zu verlangen, steht Gläubigern nicht zu, die im Falle der Insolvenz ein Recht auf vorzugsweise Befriedigung aus einer Deckungsmasse haben, die nach gesetzlicher Vorschrift zu ihrem Schutz errichtet und staatlich überwacht ist."
    },
    {
      "date": "2025-09-18",
      "id": "130199",
      "original_text": "Registerbekanntmachung nach dem Umwandlungsgesetz\nThüringen Amtsgericht Jena HRB 506249\nWartburg Brauerei Eisenach GmbH – Eisenach",
      "type": "Registerbekanntmachung nach dem Umwandlungsgesetz",
      "state": "Thüringen",
      "amtsgericht": "Amtsgericht Jena",
      "registernummer": "HRB 506249",
      "registerart": "HRB",
      "company_name": "Wartburg Brauerei Eisenach GmbH",
      "company_seat": "Eisenach",
      "details": "18.09.2025 (Bekanntmachungsdatum)\n\nThüringen Amtsgericht Jena HRB 506249\nRegisterbekanntmachung nach dem Umwandlungsgesetz 18.09.2025 (Eintragungsdatum)\n\nWartburg Brauerei Eisenach GmbH\nGesellschaft mit beschränkter Haftung\nEisenach\n\nNicht eingetragen: Den Gläubigern der an der Verschmelzung beteiligten Rechtsträger, ist wenn sie binnen sechs Monaten nach dem Tag, an dem die Eintragung der Verschmelzung in das Register des Sitzes desjenigen Rechtsträgers, dessen Gläubiger sie sind,  nach § 19 Abs. 3 UmwG als bekanntgemacht gilt, ihren Anspruch nach Grund und Höhe schriftlich anmelden, Sicherheit zu leisten, soweit sie nicht Befriedigung verlangen können. Dieses Recht steht ihnen jedoch nur zu, wenn sie glaubhaft machen, daß durch die Verschmelzung die Erfüllung ihrer Forderung gefährdet wird."
    },
    {
      "date": "2025-09-18",
      "id": "130200",
      "original_text": "Registerbekanntmachung nach dem Umwandlungsgesetz\nThüringen Amtsgericht Jena HRA 300815\nSWM Werkzeugfabrik GmbH & Co. KG – Steinbach-Hallenberg",
      "type": "Registerbekanntmachung nach dem Umwandlungsgesetz",
      "state": "Thüringen",
      "amtsgericht": "Amtsgericht Jena",
      "registernummer": "HRA 300815",
      "registerart": "HRA",
      "company_name": "SWM Werkzeugfabrik GmbH & Co. KG",
      "company_seat": "Steinbach-Hallenberg",
      "details": "18.09.2025 (Bekanntmachungsdatum)\n\nThüringen Amtsgericht Jena HRA 300815\nRegisterbekanntmachung nach dem Umwandlungsgesetz 18.09.2025 (Eintragungsdatum)\n\nSWM Werkzeugfabrik GmbH & Co. KG\nKommanditgesellschaft\nSteinbach-Hallenberg\n\nNicht eingetragen: Den Gläubigern des formwechselnden  Rechtsträgers, ist wenn sie binnen sechs Monaten nach dem Tag, an dem die Eintragung des Formwechsels nach § 201 UmwG als bekanntgemacht gilt, ihren Anspruch nach Grund und Höhe schriftlich anmelden, Sicherheit zu leisten, soweit sie nicht Befriedigung verlangen können. Dieses Recht steht ihnen jedoch nur zu, wenn sie glaubhaft machen, daß durch den Formwechsel die Erfüllung ihrer Forderung gefährdet wird."
    },
    {
      "date": "2025-09-18",
      "id": "130201",
      "original_text": "Registerbekanntmachung nach dem Umwandlungsgesetz\nThüringen Amtsgericht Jena HRB 506269\nBrauhausviertel Immobilien GmbH – Eisenach",
      "type": "Registerbekanntmachung nach dem Umwandlungsgesetz",
      "state": "Thüringen",
      "amtsgericht": "Amtsgericht Jena",
      "registernummer": "HRB 506269",
      "registerart": "HRB",
      "company_name": "Brauhausviertel Immobilien GmbH",
      "company_seat": "Eisenach",
      "details": "18.09.2025 (Bekanntmachungsdatum)\n\nThüringen Amtsgericht Jena HRB 506269\nRegisterbekanntmachung nach dem Umwandlungsgesetz 18.09.2025 (Eintragungsdatum)\n\nBrauhausviertel Immobilien GmbH\nGesellschaft mit beschränkter Haftung\nEisenach\n\nNicht eingetragen: Den Gläubigern der an der Verschmelzung beteiligten Rechtsträger, ist wenn sie binnen sechs Monaten nach dem Tag, an dem die Eintragung der Verschmelzung in das Register des Sitzes desjenigen Rechtsträgers, dessen Gläubiger sie sind,  nach § 19 Abs. 3 UmwG als bekanntgemacht gilt, ihren Anspruch nach Grund und Höhe schriftlich anmelden, Sicherheit zu leisten, soweit sie nicht Befriedigung verlangen können. Dieses Recht steht ihnen jedoch nur zu, wenn sie glaubhaft machen, daß durch die Verschmelzung die Erfüllung ihrer Forderung gefährdet wird."
    },
    {
      "date": "2025-09-18",
      "id": "130202",
      "original_text": "Registerbekanntmachung nach dem Umwandlungsgesetz\nThüringen Amtsgericht Jena HRB 521451\nC. Ebers Holding GmbH – Altenburg",
      "type": "Registerbekanntmachung nach dem Umwandlungsgesetz",
      "state": "Thüringen",
      "amtsgericht": "Amtsgericht Jena",
      "registernummer": "HRB 521451",
      "registerart": "HRB",
      "company_name": "C. Ebers Holding GmbH",
      "company_seat": "Altenburg",
      "details": "18.09.2025 (Bekanntmachungsdatum)\n\nThüringen Amtsgericht Jena HRB 521451\nRegisterbekanntmachung nach dem Umwandlungsgesetz 18.09.2025 (Eintragungsdatum)\n\nC. Ebers Holding GmbH\nGesellschaft mit beschränkter Haftung\nAltenburg\n\nNicht eingetragen: Den Gläubigern der an der Verschmelzung beteiligten Rechtsträger, ist wenn sie binnen sechs Monaten nach dem Tag, an dem die Eintragung der Verschmelzung in das Register des Sitzes desjenigen Rechtsträgers, dessen Gläubiger sie sind,  nach § 19 Abs. 3 UmwG als bekanntgemacht gilt, ihren Anspruch nach Grund und Höhe schriftlich anmelden, Sicherheit zu leisten, soweit sie nicht Befriedigung verlangen können. Dieses Recht steht ihnen jedoch nur zu, wenn sie glaubhaft machen, daß durch die Verschmelzung die Erfüllung ihrer Forderung gefährdet wird."
    },
    {
      "date": "2025-09-18",
      "id": "130203",
      "original_text": "Einreichung neuer Dokumente\nSchleswig-Holstein Amtsgericht Kiel HRB 14826\nfreenet DLS GmbH – Büdelsdorf",
      "type": "Einreichung neuer Dokumente",
      "state": "Schleswig-Holstein",
      "amtsgericht": "Amtsgericht Kiel",
      "registernummer": "HRB 14826",
      "registerart": "HRB",
      "company_name": "freenet DLS GmbH",
      "company_seat": "Büdelsdorf",
      "details": "18.09.2025 (Bekanntmachungsdatum)\n\nSchleswig-Holstein Amtsgericht Kiel HRB 14826\nEinreichung neuer Dokumente\n\nfreenet DLS GmbH\nGesellschaft mit beschränkter Haftung\nBüdelsdorf\n\nAls nicht eingetragen wird veröffentlicht: Eine neue Liste der Aufsichtsratsmitglieder ist eingereicht worden."
    },
    {
      "date": "2025-09-18",
      "id": "130204",
      "original_text": "Registerbekanntmachung nach dem Umwandlungsgesetz\nBaden-Württemberg Amtsgericht Mannheim HRB 742503\nAugenblick Mannheim MVZ GmbH – Mannheim",
      "type": "Registerbekanntmachung nach dem Umwandlungsgesetz",
      "state": "Baden-Württemberg",
      "amtsgericht": "Amtsgericht Mannheim",
      "registernummer": "HRB 742503",
      "registerart": "HRB",
      "company_name": "Augenblick Mannheim MVZ GmbH",
      "company_seat": "Mannheim",
      "details": "18.09.2025 (Bekanntmachungsdatum)\n\nBaden-Württemberg Amtsgericht Mannheim HRB 742503\nRegisterbekanntmachung nach dem Umwandlungsgesetz 18.09.2025 (Eintragungsdatum)\n\nAugenblick Mannheim MVZ GmbH\nGesellschaft mit beschränkter Haftung\nMannheim\n\nAls nicht eingetragen wird bekanntgemacht:\nDen Gläubigern der an der Verschmelzung beteiligten Rechtsträger ist, wenn sie binnen sechs Monaten nach dem Tag, an dem die Eintragung der Verschmelzung in das Register des Sitzes desjenigen Rechtsträgers, dessen Gläubiger sie sind, nach § 19 Abs. 3 UmwG als bekanntgemacht gilt, ihren Anspruch nach Grund und Höhe schriftlich anmelden, Sicherheit zu leisten, soweit sie nicht Befriedigung verlangen können. Dieses Recht steht den Gläubigern jedoch nur zu, wenn sie glaubhaft machen, dass durch die Verschmelzung die Erfüllung ihrer Forderung gefährdet wird."
    },
    {
      "date": "2025-09-18",
      "id": "130205",
      "original_text": "Registerbekanntmachung nach dem Umwandlungsgesetz\nBerlin Amtsgericht Berlin (Charlottenburg) HRB 85174\nBLUE ONE Investment GmbH – Berlin",
      "type": "Registerbekanntmachung nach dem Umwandlungsgesetz",
      "state": "Berlin",
      "amtsgericht": "Amtsgericht Berlin (Charlottenburg)",
      "registernummer": "HRB 85174",
      "registerart": "HRB",
      "company_name": "BLUE ONE Investment GmbH",
      "company_seat": "Berlin",
      "details": "18.09.2025 (Bekanntmachungsdatum)\n\nBerlin Amtsgericht Berlin (Charlottenburg) HRB 85174\nRegisterbekanntmachung nach dem Umwandlungsgesetz 15.09.2025 (Eintragungsdatum)\n\nBLUE ONE Investment GmbH\nGesellschaft mit beschränkter Haftung\nBerlin\n\nZu Eintragungsnummer 8 vom 15.09.2025 wird als nicht eingetragen veröffentlicht:Den Gläubigern der an der Verschmelzung beteiligten Rechtsträger ist, wenn sie binnen sechs Monaten nach dem Tag, an dem die Eintragung der Verschmelzung in das Register des Sitzes desjenigen Rechtsträgers, dessen Gläubiger sie sind, als bekannt gemacht gilt, ihren Anspruch nach Grund und Höhe schriftlich anmelden, Sicherheit zu leisten, soweit sie nicht Befriedigung verlangen können. Dieses Recht steht den Gläubigern jedoch nur zu, wenn sie glaubhaft machen, dass durch die Verschmelzung die Erfüllung ihrer Forderung gefährdet wird. Das Recht, Sicherheitsleistung zu verlangen, steht Gläubigern nicht zu, die im Falle der Insolvenz ein Recht auf vorzugsweise Befriedigung aus einer Deckungsmasse haben, die nach gesetzlicher Vorschrift zu ihrem Schutz errichtet und staatlich überwacht ist."
    },
    {
      "date": "2025-09-18",
      "id": "130206",
      "original_text": "Registerbekanntmachung nach dem Umwandlungsgesetz\nHamburg Amtsgericht Hamburg HRB 125906\nKiTA Paula und Max - Wandsbeker Chaussee GmbH – Hamburg",
      "type": "Registerbekanntmachung nach dem Umwandlungsgesetz",
      "state": "Hamburg",
      "amtsgericht": "Amtsgericht Hamburg",
      "registernummer": "HRB 125906",
      "registerart": "HRB",
      "company_name": "KiTA Paula und Max - Wandsbeker Chaussee GmbH",
      "company_seat": "Hamburg",
      "details": "18.09.2025 (Bekanntmachungsdatum)\n\nHamburg Amtsgericht Hamburg HRB 125906\nRegisterbekanntmachung nach dem Umwandlungsgesetz 18.09.2025 (Eintragungsdatum)\n\nKiTA Paula und Max - Wandsbeker Chaussee GmbH\nGesellschaft mit beschränkter Haftung\nHamburg\n\nAls nicht eingetragen wird bekannt gemacht:\nDen Gläubigern der an der Verschmelzung beteiligten Gesellschaften ist, wenn sie binnen sechs Monaten nach dem Tag, an dem die Eintragung der Verschmelzung in das Register des Sitzes desjenigen Rechtsträgers, dessen Gläubiger sie sind, nach § 19 Absatz 3 UmwG als bekannt gemacht gilt, ihren Anspruch nach Grund und Höhe schriftlich anmelden, Sicherheit zu leisten, soweit sie nicht Befriedigung verlangen können. Dieses Recht steht den Gläubigern jedoch nur zu, wenn sie glaubhaft machen, dass durch die Verschmelzung die Erfüllung ihrer Forderung gefährdet wird."
    },
    {
      "date": "2025-09-18",
      "id": "130207",
      "original_text": "Sonstige Registerbekanntmachung\nBerlin Amtsgericht Berlin (Charlottenburg) HRB 1387\nEisenbahn-Siedlungs-Gesellschaft Berlin mit beschränkter Haftung – Berlin",
      "type": "Sonstige Registerbekanntmachung",
      "state": "Berlin",
      "amtsgericht": "Amtsgericht Berlin (Charlottenburg)",
      "registernummer": "HRB 1387",
      "registerart": "HRB",
      "company_name": "Eisenbahn-Siedlungs-Gesellschaft Berlin mit beschränkter Haftung",
      "company_seat": "Berlin",
      "details": "18.09.2025 (Bekanntmachungsdatum)\n\nBerlin Amtsgericht Berlin (Charlottenburg) HRB 1387\nSonstige Registerbekanntmachung\n\nEisenbahn-Siedlungs-Gesellschaft Berlin mit beschränkter Haftung\nGesellschaft mit beschränkter Haftung\nBerlin\n\nAls nicht eingetragen wird veröffentlicht: Es wurde eine neue Liste der Aufsichtsratsmitglieder eingereicht (§52 GmbHG)."
    },
    {
      "date": "2025-09-18",
      "id": "130208",
      "original_text": "Registerbekanntmachung nach dem Umwandlungsgesetz\nBerlin Amtsgericht Berlin (Charlottenburg) HRB 71227\nBLUE ONE Ventures GmbH – Berlin",
      "type": "Registerbekanntmachung nach dem Umwandlungsgesetz",
      "state": "Berlin",
      "amtsgericht": "Amtsgericht Berlin (Charlottenburg)",
      "registernummer": "HRB 71227",
      "registerart": "HRB",
      "company_name": "BLUE ONE Ventures GmbH",
      "company_seat": "Berlin",
      "details": "18.09.2025 (Bekanntmachungsdatum)\n\nBerlin Amtsgericht Berlin (Charlottenburg) HRB 71227\nRegisterbekanntmachung nach dem Umwandlungsgesetz 15.09.2025 (Eintragungsdatum)\n\nBLUE ONE Ventures GmbH\nGesellschaft mit beschränkter Haftung\nBerlin\n\nZu Eintragungsnummer 6 vom 15.09.2025 wird als nicht eingetragen veröffentlicht: Den Gläubigern der an der Verschmelzung beteiligten Rechtsträger ist, wenn sie binnen sechs Monaten nach dem Tag, an dem die Eintragung der Verschmelzung in das Register des Sitzes desjenigen Rechtsträgers, dessen Gläubiger sie sind, als bekannt gemacht gilt, ihren Anspruch nach Grund und Höhe schriftlich anmelden, Sicherheit zu leisten, soweit sie nicht Befriedigung verlangen können. Dieses Recht steht den Gläubigern jedoch nur zu, wenn sie glaubhaft machen, dass durch die Verschmelzung die Erfüllung ihrer Forderung gefährdet wird. Das Recht, Sicherheitsleistung zu verlangen, steht Gläubigern nicht zu, die im Falle der Insolvenz ein Recht auf vorzugsweise Befriedigung aus einer Deckungsmasse haben, die nach gesetzlicher Vorschrift zu ihrem Schutz errichtet und staatlich überwacht ist."
    },
    {
      "date": "2025-09-18",
      "id": "130209",
      "original_text": "Löschungsankündigung\nSchleswig-Holstein Amtsgericht Kiel HRA 2601 NO\nWalter Gross Inh. Bernd Steinbrecher e.K. – Alveslohe",
      "type": "Löschungsankündigung",
      "state": "Schleswig-Holstein",
      "amtsgericht": "Amtsgericht Kiel",
      "registernummer": "HRA 2601 NO",
      "registerart": "HRA",
      "company_name": "Walter Gross Inh. Bernd Steinbrecher e.K.",
      "company_seat": "Alveslohe",
      "details": "18.09.2025 (Bekanntmachungsdatum)\n\nSchleswig-Holstein Amtsgericht Kiel HRA 2601 NO\nLöschungsankündigung\n\nWalter Gross Inh. Bernd Steinbrecher e.K.\nEinzelkaufmann / Einzelkauffrau\nAlveslohe\n\nBei der nachstehenden Firma wird das Amtslöschungsverfahren gemäß § 31 Abs. 2 HGB eingeleitet. Widerspruchsfrist: 2 Monate."
    },
    {
      "date": "2025-09-18",
      "id": "130210",
      "original_text": "Löschungsankündigung\nBrandenburg Amtsgericht Potsdam HRB 30362\nAC-CÖ Multi Secur UG (haftungsbeschränkt) – Blankenfelde-Mahlow",
      "type": "Löschungsankündigung",
      "state": "Brandenburg",
      "amtsgericht": "Amtsgericht Potsdam",
      "registernummer": "HRB 30362",
      "registerart": "HRB",
      "company_name": "AC-CÖ Multi Secur UG (haftungsbeschränkt)",
      "company_seat": "Blankenfelde-Mahlow",
      "details": "18.09.2025 (Bekanntmachungsdatum)\n\nBrandenburg Amtsgericht Potsdam HRB 30362\nLöschungsankündigung\n\nAC-CÖ Multi Secur UG (haftungsbeschränkt)\nGesellschaft mit beschränkter Haftung\nBlankenfelde-Mahlow\n\nBei der nachstehenden Gesellschaft wird das Amtslöschungsverfahren gemäß § 394 FamFG eingeleitet. Widerspruchsfrist: 8 Wochen."
    },
    {
      "date": "2025-09-18",
      "id": "130211",
      "original_text": "Sonstige Registerbekanntmachung\nBerlin Amtsgericht Berlin (Charlottenburg) HRB 100262\n1blu AG – Berlin",
      "type": "Sonstige Registerbekanntmachung",
      "state": "Berlin",
      "amtsgericht": "Amtsgericht Berlin (Charlottenburg)",
      "registernummer": "HRB 100262",
      "registerart": "HRB",
      "company_name": "1blu AG",
      "company_seat": "Berlin",
      "details": "18.09.2025 (Bekanntmachungsdatum)\n\nBerlin Amtsgericht Berlin (Charlottenburg) HRB 100262\nSonstige Registerbekanntmachung\n\n1blu AG\nAktiengesellschaft\nBerlin\n\nAls nicht eingetragen wird veröffentlicht: Den Gläubigern ist, wenn sie binnen sechs Monaten nach dem Tag, an dem die Eintragung der Umwandlung als bekannt gemacht gilt, ihren Anspruch nach Grund und Höhe schriftlich anmelden, Sicherheit zu leisten, soweit sie nicht Befriedigung verlangen können. Dieses Recht steht den Gläubigern jedoch nur zu, wenn sie glaubhaft machen, dass durch die Umwandlung die Erfüllung ihrer Forderung gefährdet wird. Das Recht, Sicherheitsleistung zu verlangen, steht Gläubigern nicht zu, die im Falle der Insolvenz ein Recht auf vorzugsweise Befriedigung aus einer Deckungsmasse haben, die nach gesetzlicher Vorschrift zu ihrem Schutz errichtet und staatlich überwacht ist."
    },
    {
      "date": "2025-09-18",
      "id": "130212",
      "original_text": "Löschungsankündigung\nBerlin Amtsgericht Berlin (Charlottenburg) HRB 163648\nMP Spareparts UG (haftungsbeschränkt) – Berlin",
      "type": "Löschungsankündigung",
      "state": "Berlin",
      "amtsgericht": "Amtsgericht Berlin (Charlottenburg)",
      "registernummer": "HRB 163648",
      "registerart": "HRB",
      "company_name": "MP Spareparts UG (haftungsbeschränkt)",
      "company_seat": "Berlin",
      "details": "18.09.2025 (Bekanntmachungsdatum)\n\nBerlin Amtsgericht Berlin (Charlottenburg) HRB 163648\nLöschungsankündigung\n\nMP Spareparts UG (haftungsbeschränkt)\nGesellschaft mit beschränkter Haftung\nBerlin\n\nBei der nachstehenden Gesellschaft wird das Amtslöschungsverfahren gemäß § 394 FamFG eingeleitet. Widerspruchsfrist 6 Wochen"
    },
    {
      "date": "2025-09-18",
      "id": "130213",
      "original_text": "Sonstige Registerbekanntmachung\nBerlin Amtsgericht Berlin (Charlottenburg) HRB 279241\n1blu GmbH – Berlin",
      "type": "Sonstige Registerbekanntmachung",
      "state": "Berlin",
      "amtsgericht": "Amtsgericht Berlin (Charlottenburg)",
      "registernummer": "HRB 279241",
      "registerart": "HRB",
      "company_name": "1blu GmbH",
      "company_seat": "Berlin",
      "details": "18.09.2025 (Bekanntmachungsdatum)\n\nBerlin Amtsgericht Berlin (Charlottenburg) HRB 279241\nSonstige Registerbekanntmachung\n\n1blu GmbH\nGesellschaft mit beschränkter Haftung\nBerlin\n\nAls nicht eingetragen wird veröffentlicht: Den Gläubigern ist, wenn sie binnen sechs Monaten nach dem Tag, an dem die Eintragung der Umwandlung als bekannt gemacht gilt, ihren Anspruch nach Grund und Höhe schriftlich anmelden, Sicherheit zu leisten, soweit sie nicht Befriedigung verlangen können. Dieses Recht steht den Gläubigern jedoch nur zu, wenn sie glaubhaft machen, dass durch die Umwandlung die Erfüllung ihrer Forderung gefährdet wird. Das Recht, Sicherheitsleistung zu verlangen, steht Gläubigern nicht zu, die im Falle der Insolvenz ein Recht auf vorzugsweise Befriedigung aus einer Deckungsmasse haben, die nach gesetzlicher Vorschrift zu ihrem Schutz errichtet und staatlich überwacht ist."
    },
    {
      "date": "2025-09-18",
      "id": "130214",
      "original_text": "Einreichung neuer Dokumente\nHamburg Amtsgericht Hamburg HRB 133192\nHolsten-Brauerei Aktiengesellschaft – Hamburg",
      "type": "Einreichung neuer Dokumente",
      "state": "Hamburg",
      "amtsgericht": "Amtsgericht Hamburg",
      "registernummer": "HRB 133192",
      "registerart": "HRB",
      "company_name": "Holsten-Brauerei Aktiengesellschaft",
      "company_seat": "Hamburg",
      "details": "18.09.2025 (Bekanntmachungsdatum)\n\nHamburg Amtsgericht Hamburg HRB 133192\nEinreichung neuer Dokumente\n\nHolsten-Brauerei Aktiengesellschaft\nAktiengesellschaft\nHamburg\n\nAls nicht eingetragen wird bekannt gemacht: Liste des Aufsichtsrats wurde eingereicht."
    },
    {
      "date": "2025-09-18",
      "id": "130215",
      "original_text": "Registerbekanntmachung nach dem Umwandlungsgesetz\nBaden-Württemberg Amtsgericht Stuttgart HRB 460681\nTeknia Stuttgart GmbH – Mahlstetten",
      "type": "Registerbekanntmachung nach dem Umwandlungsgesetz",
      "state": "Baden-Württemberg",
      "amtsgericht": "Amtsgericht Stuttgart",
      "registernummer": "HRB 460681",
      "registerart": "HRB",
      "company_name": "Teknia Stuttgart GmbH",
      "company_seat": "Mahlstetten",
      "details": "18.09.2025 (Bekanntmachungsdatum)\n\nBaden-Württemberg Amtsgericht Stuttgart HRB 460681\nRegisterbekanntmachung nach dem Umwandlungsgesetz 18.09.2025 (Eintragungsdatum)\n\nTeknia Stuttgart GmbH\nGesellschaft mit beschränkter Haftung\nMahlstetten\n\nDen Gläubigern der an der Verschmelzung beteiligten Rechtsträger ist, wenn sie binnen sechs Monaten nach dem Tag, an dem die Eintragung der Verschmelzung in das Register des Sitzes desjenigen Rechtsträgers, dessen Gläubiger sie sind, nach § 19 Abs. 3 UmwG als bekanntgemacht gilt, ihren Anspruch nach Grund und Höhe schriftlich anmelden, Sicherheit zu leisten, soweit sie nicht Befriedigung verlangen können. Dieses Recht steht den Gläubigern jedoch nur zu, wenn sie glaubhaft machen, dass durch die Verschmelzung die Erfüllung ihrer Forderung gefährdet wird."
    },
    {
      "date": "2025-09-18",
      "id": "130216",
      "original_text": "Registerbekanntmachung nach dem Umwandlungsgesetz\nBaden-Württemberg Amtsgericht Stuttgart HRB 727964\nTEKNIA GERMANY GmbH – Stuttgart",
      "type": "Registerbekanntmachung nach dem Umwandlungsgesetz",
      "state": "Baden-Württemberg",
      "amtsgericht": "Amtsgericht Stuttgart",
      "registernummer": "HRB 727964",
      "registerart": "HRB",
      "company_name": "TEKNIA GERMANY GmbH",
      "company_seat": "Stuttgart",
      "details": "18.09.2025 (Bekanntmachungsdatum)\n\nBaden-Württemberg Amtsgericht Stuttgart HRB 727964\nRegisterbekanntmachung nach dem Umwandlungsgesetz 18.09.2025 (Eintragungsdatum)\n\nTEKNIA GERMANY GmbH\nGesellschaft mit beschränkter Haftung\nStuttgart\n\nDen Gläubigern der an der Verschmelzung beteiligten Rechtsträger ist, wenn sie binnen sechs Monaten nach dem Tag, an dem die Eintragung der Verschmelzung in das Register des Sitzes desjenigen Rechtsträgers, dessen Gläubiger sie sind, nach § 19 Abs. 3 UmwG als bekanntgemacht gilt, ihren Anspruch nach Grund und Höhe schriftlich anmelden, Sicherheit zu leisten, soweit sie nicht Befriedigung verlangen können. Dieses Recht steht den Gläubigern jedoch nur zu, wenn sie glaubhaft machen, dass durch die Verschmelzung die Erfüllung ihrer Forderung gefährdet wird."
    },
    {
      "date": "2025-09-18",
      "id": "130217",
      "original_text": "Registerbekanntmachung nach dem Umwandlungsgesetz\nHamburg Amtsgericht Hamburg HRB 80831\nschönknecht: kommunikation gesellschaft für public relations und marketing mbh – Hamburg",
      "type": "Registerbekanntmachung nach dem Umwandlungsgesetz",
      "state": "Hamburg",
      "amtsgericht": "Amtsgericht Hamburg",
      "registernummer": "HRB 80831",
      "registerart": "HRB",
      "company_name": "schönknecht: kommunikation gesellschaft für public relations und marketing mbh",
      "company_seat": "Hamburg",
      "details": "18.09.2025 (Bekanntmachungsdatum)\n\nHamburg Amtsgericht Hamburg HRB 80831\nRegisterbekanntmachung nach dem Umwandlungsgesetz 18.09.2025 (Eintragungsdatum)\n\nschönknecht: kommunikation gesellschaft für public relations und marketing mbh\nGesellschaft mit beschränkter Haftung\nHamburg\n\nAls nicht eingetragen wird bekannt gemacht:\nDen Gläubigern der an der Verschmelzung beteiligten Gesellschaften ist, wenn sie binnen sechs Monaten nach dem Tag, an dem die Eintragung der Verschmelzung in das Register des Sitzes desjenigen Rechtsträgers, dessen Gläubiger sie sind, nach § 19 Absatz 3 UmwG als bekannt gemacht gilt, ihren Anspruch nach Grund und Höhe schriftlich anmelden, Sicherheit zu leisten, soweit sie nicht Befriedigung verlangen können. Dieses Recht steht den Gläubigern jedoch nur zu, wenn sie glaubhaft machen, dass durch die Verschmelzung die Erfüllung ihrer Forderung gefährdet wird."
    },
    {
      "date": "2025-09-18",
      "id": "130218",
      "original_text": "Löschungsankündigung\nBerlin Amtsgericht Berlin (Charlottenburg) HRB 216479\nR606 Holding GmbH – Berlin",
      "type": "Löschungsankündigung",
      "state": "Berlin",
      "amtsgericht": "Amtsgericht Berlin (Charlottenburg)",
      "registernummer": "HRB 216479",
      "registerart": "HRB",
      "company_name": "R606 Holding GmbH",
      "company_seat": "Berlin",
      "details": "18.09.2025 (Bekanntmachungsdatum)\n\nBerlin Amtsgericht Berlin (Charlottenburg) HRB 216479\nLöschungsankündigung\n\nR606 Holding GmbH\nGesellschaft mit beschränkter Haftung\nBerlin\n\nBei der nachstehenden Gesellschaft wird das Amtslöschungsverfahren gemäß § 394 FamFG eingeleitet. Widerspruchsfrist 6 Wochen"
    },
    {
      "date": "2025-09-18",
      "id": "130219",
      "original_text": "Löschungsankündigung\nBerlin Amtsgericht Berlin (Charlottenburg) HRB 240650\nRBT GmbH – Berlin",
      "type": "Löschungsankündigung",
      "state": "Berlin",
      "amtsgericht": "Amtsgericht Berlin (Charlottenburg)",
      "registernummer": "HRB 240650",
      "registerart": "HRB",
      "company_name": "RBT GmbH",
      "company_seat": "Berlin",
      "details": "18.09.2025 (Bekanntmachungsdatum)\n\nBerlin Amtsgericht Berlin (Charlottenburg) HRB 240650\nLöschungsankündigung\n\nRBT GmbH\nGesellschaft mit beschränkter Haftung\nBerlin\n\nBei der nachstehenden Gesellschaft wird das Amtslöschungsverfahren gemäß § 394 FamFG eingeleitet. Widerspruchsfrist 6 Wochen"
    },
    {
      "date": "2025-09-18",
      "id": "130220",
      "original_text": "Registerbekanntmachung nach dem Umwandlungsgesetz\nHamburg Amtsgericht Hamburg HRB 136009\nEXERGENE Technologie GmbH – Hamburg",
      "type": "Registerbekanntmachung nach dem Umwandlungsgesetz",
      "state": "Hamburg",
      "amtsgericht": "Amtsgericht Hamburg",
      "registernummer": "HRB 136009",
      "registerart": "HRB",
      "company_name": "EXERGENE Technologie GmbH",
      "company_seat": "Hamburg",
      "details": "18.09.2025 (Bekanntmachungsdatum)\n\nHamburg Amtsgericht Hamburg HRB 136009\nRegisterbekanntmachung nach dem Umwandlungsgesetz 18.09.2025 (Eintragungsdatum)\n\nEXERGENE Technologie GmbH\nGesellschaft mit beschränkter Haftung\nHamburg\n\nAls nicht eingetragen wird bekannt gemacht:\nDen Gläubigern der an der Verschmelzung beteiligten Gesellschaften ist, wenn sie binnen sechs Monaten nach dem Tag, an dem die Eintragung der Verschmelzung in das Register des Sitzes desjenigen Rechtsträgers, dessen Gläubiger sie sind, nach § 19 Absatz 3 UmwG als bekannt gemacht gilt, ihren Anspruch nach Grund und Höhe schriftlich anmelden, Sicherheit zu leisten, soweit sie nicht Befriedigung verlangen können. Dieses Recht steht den Gläubigern jedoch nur zu, wenn sie glaubhaft machen, dass durch die Verschmelzung die Erfüllung ihrer Forderung gefährdet wird."
    },
    {
      "date": "2025-09-18",
      "id": "130221",
      "original_text": "Löschungsankündigung\nBerlin Amtsgericht Berlin (Charlottenburg) HRB 256484\nYaran GmbH – Berlin",
      "type": "Löschungsankündigung",
      "state": "Berlin",
      "amtsgericht": "Amtsgericht Berlin (Charlottenburg)",
      "registernummer": "HRB 256484",
      "registerart": "HRB",
      "company_name": "Yaran GmbH",
      "company_seat": "Berlin",
      "details": "18.09.2025 (Bekanntmachungsdatum)\n\nBerlin Amtsgericht Berlin (Charlottenburg) HRB 256484\nLöschungsankündigung\n\nYaran GmbH\nGesellschaft mit beschränkter Haftung\nBerlin\n\nBei der nachstehenden Gesellschaft wird das Amtslöschungsverfahren gemäß § 394 FamFG eingeleitet. Widerspruchsfrist 6 Wochen"
    },
    {
      "date": "2025-09-18",
      "id": "130222",
      "original_text": "Registerbekanntmachung nach dem Umwandlungsgesetz\nBerlin Amtsgericht Berlin (Charlottenburg) HRB 203646\nPCH Recordings GmbH – Berlin",
      "type": "Registerbekanntmachung nach dem Umwandlungsgesetz",
      "state": "Berlin",
      "amtsgericht": "Amtsgericht Berlin (Charlottenburg)",
      "registernummer": "HRB 203646",
      "registerart": "HRB",
      "company_name": "PCH Recordings GmbH",
      "company_seat": "Berlin",
      "details": "18.09.2025 (Bekanntmachungsdatum)\n\nBerlin Amtsgericht Berlin (Charlottenburg) HRB 203646\nRegisterbekanntmachung nach dem Umwandlungsgesetz 17.09.2025 (Eintragungsdatum)\n\nPCH Recordings GmbH\nGesellschaft mit beschränkter Haftung\nBerlin\n\nZu Eintragungsnummer 4 vom 17.09.2025 wird als nicht eingetragen veröffentlicht: Den Gläubigern der an der Verschmelzung beteiligten Rechtsträger ist, wenn sie binnen sechs Monaten nach dem Tag, an dem die Eintragung der Verschmelzung in das Register des Sitzes desjenigen Rechtsträgers, dessen Gläubiger sie sind, als bekannt gemacht gilt, ihren Anspruch nach Grund und Höhe schriftlich anmelden, Sicherheit zu leisten, soweit sie nicht Befriedigung verlangen können. Dieses Recht steht den Gläubigern jedoch nur zu, wenn sie glaubhaft machen, dass durch die Verschmelzung die Erfüllung ihrer Forderung gefährdet wird. Das Recht, Sicherheitsleistung zu verlangen, steht Gläubigern nicht zu, die im Falle der Insolvenz ein Recht auf vorzugsweise Befriedigung aus einer Deckungsmasse haben, die nach gesetzlicher Vorschrift zu ihrem Schutz errichtet und staatlich überwacht ist."
    },
    {
      "date": "2025-09-18",
      "id": "130223",
      "original_text": "Registerbekanntmachung nach dem Umwandlungsgesetz\nBaden-Württemberg Amtsgericht Stuttgart HRB 779648\nCollabStack GmbH – Oedheim",
      "type": "Registerbekanntmachung nach dem Umwandlungsgesetz",
      "state": "Baden-Württemberg",
      "amtsgericht": "Amtsgericht Stuttgart",
      "registernummer": "HRB 779648",
      "registerart": "HRB",
      "company_name": "CollabStack GmbH",
      "company_seat": "Oedheim",
      "details": "18.09.2025 (Bekanntmachungsdatum)\n\nBaden-Württemberg Amtsgericht Stuttgart HRB 779648\nRegisterbekanntmachung nach dem Umwandlungsgesetz 18.09.2025 (Eintragungsdatum)\n\nCollabStack GmbH\nGesellschaft mit beschränkter Haftung\nOedheim\n\nAls nicht eingetragen wird bekanntgemacht:\nDen Gläubigern der an der Verschmelzung beteiligten Rechtsträger ist, wenn sie binnen sechs Monaten nach dem Tag, an dem die Eintragung der Verschmelzung in das Register des Sitzes desjenigen Rechtsträgers, dessen Gläubiger sie sind, nach § 19 Abs. 3 UmwG als bekanntgemacht gilt, ihren Anspruch nach Grund und Höhe schriftlich anmelden, Sicherheit zu leisten, soweit sie nicht Befriedigung verlangen können. Dieses Recht steht den Gläubigern jedoch nur zu, wenn sie glaubhaft machen, dass durch die Verschmelzung die Erfüllung ihrer Forderung gefährdet wird."
    },
    {
      "date": "2025-09-18",
      "id": "130224",
      "original_text": "Einreichung neuer Dokumente\nBerlin Amtsgericht Berlin (Charlottenburg) HRB 239061\nPlanetHome Investment AG – Berlin",
      "type": "Einreichung neuer Dokumente",
      "state": "Berlin",
      "amtsgericht": "Amtsgericht Berlin (Charlottenburg)",
      "registernummer": "HRB 239061",
      "registerart": "HRB",
      "company_name": "PlanetHome Investment AG",
      "company_seat": "Berlin",
      "details": "18.09.2025 (Bekanntmachungsdatum)\n\nBerlin Amtsgericht Berlin (Charlottenburg) HRB 239061\nEinreichung neuer Dokumente\n\nPlanetHome Investment AG\nAktiengesellschaft\nBerlin\n\nAls nicht eingetragen wird veröffentlicht:\nEs wurde eine neue Liste der Aufsichtsratsmitglieder eingereicht (§ 106 AktG)."
    },
    {
      "date": "2025-09-18",
      "id": "130225",
      "original_text": "Registerbekanntmachung nach dem Umwandlungsgesetz\nBrandenburg Amtsgericht Neuruppin HRB 11741\nSebastian Schirmer GmbH – Hohen Neuendorf",
      "type": "Registerbekanntmachung nach dem Umwandlungsgesetz",
      "state": "Brandenburg",
      "amtsgericht": "Amtsgericht Neuruppin",
      "registernummer": "HRB 11741",
      "registerart": "HRB",
      "company_name": "Sebastian Schirmer GmbH",
      "company_seat": "Hohen Neuendorf",
      "details": "18.09.2025 (Bekanntmachungsdatum)\n\nBrandenburg Amtsgericht Neuruppin HRB 11741\nRegisterbekanntmachung nach dem Umwandlungsgesetz 16.09.2025 (Eintragungsdatum)\n\nSebastian Schirmer GmbH\nGesellschaft mit beschränkter Haftung\nHohen Neuendorf\n\nZu Eintragungsnummer 2 vom 16.09.2025 wird als nicht eingetragen veröffentlicht:\nDen Gläubigern der an der Umwandlung beteiligten Rechtsträger ist, wenn sie binnen sechs Monaten nach dem Tag, an dem die Eintragung der Umwandlung in das Register des Sitzes desjenigen Rechtsträgers, dessen Gläubiger sie sind, als bekannt gemacht gilt, ihren Anspruch nach Grund und Höhe schriftlich anmelden, Sicherheit zu leisten, soweit sie nicht Befriedigung verlangen können. Dieses Recht steht den Gläubigern jedoch nur zu, wenn sie glaubhaft machen, dass durch die Umwandlung die Erfüllung ihrer Forderung gefährdet wird"
    },
    {
      "date": "2025-09-18",
      "id": "130226",
      "original_text": "Registerbekanntmachung nach dem Umwandlungsgesetz\nBaden-Württemberg Amtsgericht Stuttgart HRB 792796\nEsslinger Consulting Vertrieb GmbH – Neckarwestheim",
      "type": "Registerbekanntmachung nach dem Umwandlungsgesetz",
      "state": "Baden-Württemberg",
      "amtsgericht": "Amtsgericht Stuttgart",
      "registernummer": "HRB 792796",
      "registerart": "HRB",
      "company_name": "Esslinger Consulting Vertrieb GmbH",
      "company_seat": "Neckarwestheim",
      "details": "18.09.2025 (Bekanntmachungsdatum)\n\nBaden-Württemberg Amtsgericht Stuttgart HRB 792796\nRegisterbekanntmachung nach dem Umwandlungsgesetz 18.09.2025 (Eintragungsdatum)\n\nEsslinger Consulting Vertrieb GmbH\nGesellschaft mit beschränkter Haftung\nNeckarwestheim\n\nAls nicht eingetragen wird bekanntgemacht:\nDen Gläubigern der an der Verschmelzung beteiligten Rechtsträger ist, wenn sie binnen sechs Monaten nach dem Tag, an dem die Eintragung der Verschmelzung in das Register des Sitzes desjenigen Rechtsträgers, dessen Gläubiger sie sind, nach § 19 Abs. 3 UmwG als bekanntgemacht gilt, ihren Anspruch nach Grund und Höhe schriftlich anmelden, Sicherheit zu leisten, soweit sie nicht Befriedigung verlangen können. Dieses Recht steht den Gläubigern jedoch nur zu, wenn sie glaubhaft machen, dass durch die Verschmelzung die Erfüllung ihrer Forderung gefährdet wird."
    },
    {
      "date": "2025-09-18",
      "id": "130227",
      "original_text": "Einreichung neuer Dokumente\nBerlin Amtsgericht Berlin (Charlottenburg) HRB 126605\nDEUWES AG – Berlin",
      "type": "Einreichung neuer Dokumente",
      "state": "Berlin",
      "amtsgericht": "Amtsgericht Berlin (Charlottenburg)",
      "registernummer": "HRB 126605",
      "registerart": "HRB",
      "company_name": "DEUWES AG",
      "company_seat": "Berlin",
      "details": "18.09.2025 (Bekanntmachungsdatum)\n\nBerlin Amtsgericht Berlin (Charlottenburg) HRB 126605\nEinreichung neuer Dokumente\n\nDEUWES AG\nAktiengesellschaft\nBerlin\n\nAls nicht eingetragen wird veröffentlicht: Es wurde eine neue Liste der Aufsichtsratsmitglieder eingereicht (§ 106 AktG)."
    },
    {
      "date": "2025-09-18",
      "id": "130228",
      "original_text": "Löschungsankündigung\nBerlin Amtsgericht Berlin (Charlottenburg) HRB 86529\nReal Beteiligungs Holding GmbH – Berlin",
      "type": "Löschungsankündigung",
      "state": "Berlin",
      "amtsgericht": "Amtsgericht Berlin (Charlottenburg)",
      "registernummer": "HRB 86529",
      "registerart": "HRB",
      "company_name": "Real Beteiligungs Holding GmbH",
      "company_seat": "Berlin",
      "details": "18.09.2025 (Bekanntmachungsdatum)\n\nBerlin Amtsgericht Berlin (Charlottenburg) HRB 86529\nLöschungsankündigung\n\nReal Beteiligungs Holding GmbH\nGesellschaft mit beschränkter Haftung\nBerlin\n\nBei der nachstehenden Gesellschaft wird das Amtslöschungsverfahren gemäß § 394 FamFG eingeleitet. Widerspruchsfrist 6 Wochen"
    },
    {
      "date": "2025-09-18",
      "id": "130229",
      "original_text": "Löschungsankündigung\nBerlin Amtsgericht Berlin (Charlottenburg) HRB 170267\nDIE PAINT DEALER H&S Unternehmergesellschaft (haftungsbeschränkt) – Berlin",
      "type": "Löschungsankündigung",
      "state": "Berlin",
      "amtsgericht": "Amtsgericht Berlin (Charlottenburg)",
      "registernummer": "HRB 170267",
      "registerart": "HRB",
      "company_name": "DIE PAINT DEALER H&S Unternehmergesellschaft (haftungsbeschränkt)",
      "company_seat": "Berlin",
      "details": "18.09.2025 (Bekanntmachungsdatum)\n\nBerlin Amtsgericht Berlin (Charlottenburg) HRB 170267\nLöschungsankündigung\n\nDIE PAINT DEALER H&S Unternehmergesellschaft (haftungsbeschränkt)\nGesellschaft mit beschränkter Haftung\nBerlin\n\nBei der nachstehenden Gesellschaft wird das Amtslöschungsverfahren gemäß § 394 FamFG eingeleitet. Widerspruchsfrist 6 Wochen"
    },
    {
      "date": "2025-09-18",
      "id": "130230",
      "original_text": "Registerbekanntmachung nach dem Umwandlungsgesetz\nBrandenburg Amtsgericht Neuruppin HRB 12921\nBBS Versicherungskanzlei GmbH – Borgsdorf/Hohen Neuendorf",
      "type": "Registerbekanntmachung nach dem Umwandlungsgesetz",
      "state": "Brandenburg",
      "amtsgericht": "Amtsgericht Neuruppin",
      "registernummer": "HRB 12921",
      "registerart": "HRB",
      "company_name": "BBS Versicherungskanzlei GmbH",
      "company_seat": "Borgsdorf/Hohen Neuendorf",
      "details": "18.09.2025 (Bekanntmachungsdatum)\n\nBrandenburg Amtsgericht Neuruppin HRB 12921\nRegisterbekanntmachung nach dem Umwandlungsgesetz 16.09.2025 (Eintragungsdatum)\n\nBBS Versicherungskanzlei GmbH\nGesellschaft mit beschränkter Haftung\nBorgsdorf/Hohen Neuendorf\n\nZu Eintragungsnummer 5 vom 16.09.2025 wird als nicht eingetragen veröffentlicht:\nDen Gläubigern der an der Umwandlung beteiligten Rechtsträger ist, wenn sie binnen sechs Monaten nach dem Tag, an dem die Eintragung der Umwandlung in das Register des Sitzes desjenigen Rechtsträgers, dessen Gläubiger sie sind, als bekannt gemacht gilt, ihren Anspruch nach Grund und Höhe schriftlich anmelden, Sicherheit zu leisten, soweit sie nicht Befriedigung verlangen können. Dieses Recht steht den Gläubigern jedoch nur zu, wenn sie glaubhaft machen, dass durch die Umwandlung die Erfüllung ihrer Forderung gefährdet wird"
    },
    {
      "date": "2025-09-18",
      "id": "130231",
      "original_text": "Registerbekanntmachung nach dem Umwandlungsgesetz\nHamburg Amtsgericht Hamburg HRB 99204\nalstria office AG – Hamburg",
      "type": "Registerbekanntmachung nach dem Umwandlungsgesetz",
      "state": "Hamburg",
      "amtsgericht": "Amtsgericht Hamburg",
      "registernummer": "HRB 99204",
      "registerart": "HRB",
      "company_name": "alstria office AG",
      "company_seat": "Hamburg",
      "details": "18.09.2025 (Bekanntmachungsdatum)\n\nHamburg Amtsgericht Hamburg HRB 99204\nRegisterbekanntmachung nach dem Umwandlungsgesetz 18.09.2025 (Eintragungsdatum)\n\nalstria office AG\nAktiengesellschaft\nHamburg\n\nAls nicht eingetragen wird bekannt gemacht:\nDen Gläubigern der an der Ausgliederung beteiligten Gesellschaften ist, wenn sie binnen sechs Monaten nach dem Tag, an dem die Eintragung der Ausgliederung in das Register des Sitzes desjenigen Rechtsträgers, dessen Gläubiger sie sind, nach § 19 Absatz 3 UmwG als bekannt gemacht gilt, ihren Anspruch nach Grund und Höhe schriftlich anmelden, Sicherheit zu leisten, soweit sie nicht Befriedigung verlangen können. Dieses Recht steht den Gläubigern jedoch nur zu, wenn sie glaubhaft machen, dass durch die Ausgliederung die Erfüllung ihrer Forderung gefährdet wird."
    },
    {
      "date": "2025-09-18",
      "id": "130232",
      "original_text": "Registerbekanntmachung nach dem Umwandlungsgesetz\nHamburg Amtsgericht Hamburg HRB 192213\nalstria advisors GmbH – Hamburg",
      "type": "Registerbekanntmachung nach dem Umwandlungsgesetz",
      "state": "Hamburg",
      "amtsgericht": "Amtsgericht Hamburg",
      "registernummer": "HRB 192213",
      "registerart": "HRB",
      "company_name": "alstria advisors GmbH",
      "company_seat": "Hamburg",
      "details": "18.09.2025 (Bekanntmachungsdatum)\n\nHamburg Amtsgericht Hamburg HRB 192213\nRegisterbekanntmachung nach dem Umwandlungsgesetz 18.09.2025 (Eintragungsdatum)\n\nalstria advisors GmbH\nGesellschaft mit beschränkter Haftung\nHamburg\n\nAls nicht eingetragen wird bekannt gemacht:\nDen Gläubigern der an der Ausgliederung beteiligten Gesellschaften ist, wenn sie binnen sechs Monaten nach dem Tag, an dem die Eintragung der Ausgliederung in das Register des Sitzes desjenigen Rechtsträgers, dessen Gläubiger sie sind, nach § 19 Absatz 3 UmwG als bekannt gemacht gilt, ihren Anspruch nach Grund und Höhe schriftlich anmelden, Sicherheit zu leisten, soweit sie nicht Befriedigung verlangen können. Dieses Recht steht den Gläubigern jedoch nur zu, wenn sie glaubhaft machen, dass durch die Ausgliederung die Erfüllung ihrer Forderung gefährdet wird."
    },
    {
      "date": "2025-09-18",
      "id": "130233",
      "original_text": "Löschungsankündigung\nMecklenburg-Vorpommern Amtsgericht Stralsund HRA 2677\nYES-Dienstleistungen e.K. – Wolgast",
      "type": "Löschungsankündigung",
      "state": "Mecklenburg-Vorpommern",
      "amtsgericht": "Amtsgericht Stralsund",
      "registernummer": "HRA 2677",
      "registerart": "HRA",
      "company_name": "YES-Dienstleistungen e.K.",
      "company_seat": "Wolgast",
      "details": "18.09.2025 (Bekanntmachungsdatum)\n\nMecklenburg-Vorpommern Amtsgericht Stralsund HRA 2677\nLöschungsankündigung\n\nYES-Dienstleistungen e.K.\nEinzelkaufmann / Einzelkauffrau\nWolgast\n\nDas Registergericht beabsichtigt, die im Handelsregister eingetragene Kauffrau von Amts wegen nach § 393 FamFG zu löschen. Die Frist zur Erhebung eines Widerspruchs gegen die beabsichtigte Löschung wird auf einen Monat festgesetzt."
    },
    {
      "date": "2025-09-18",
      "id": "130234",
      "original_text": "Einreichung neuer Dokumente\nSachsen Amtsgericht Chemnitz HRB 10959\nFreiberger Stromversorgung GmbH (FSG) – Freiberg",
      "type": "Einreichung neuer Dokumente",
      "state": "Sachsen",
      "amtsgericht": "Amtsgericht Chemnitz",
      "registernummer": "HRB 10959",
      "registerart": "HRB",
      "company_name": "Freiberger Stromversorgung GmbH (FSG)",
      "company_seat": "Freiberg",
      "details": "18.09.2025 (Bekanntmachungsdatum)\n\nSachsen Amtsgericht Chemnitz HRB 10959\nEinreichung neuer Dokumente\n\nFreiberger Stromversorgung GmbH (FSG)\nGesellschaft mit beschränkter Haftung\nFreiberg\n\nAm 10.09.2025 wurde beim Handelsregister des Amtsgerichts Chemnitz die Liste der Mitglieder des Aufsichtsrats gemäß § 52 GmbHG eingereicht."
    },
    {
      "date": "2025-09-18",
      "id": "130235",
      "original_text": "Registerbekanntmachung nach dem Umwandlungsgesetz\nSachsen Amtsgericht Dresden HRB 8530\nHelmut Deeg Heizungs- und Lüftungsbau GmbH – Johnsdorf",
      "type": "Registerbekanntmachung nach dem Umwandlungsgesetz",
      "state": "Sachsen",
      "amtsgericht": "Amtsgericht Dresden",
      "registernummer": "HRB 8530",
      "registerart": "HRB",
      "company_name": "Helmut Deeg Heizungs- und Lüftungsbau GmbH",
      "company_seat": "Johnsdorf",
      "details": "18.09.2025 (Bekanntmachungsdatum)\n\nSachsen Amtsgericht Dresden HRB 8530\nRegisterbekanntmachung nach dem Umwandlungsgesetz 18.09.2025 (Eintragungsdatum)\n\nHelmut Deeg Heizungs- und Lüftungsbau GmbH\nGesellschaft mit beschränkter Haftung\nJohnsdorf\n\nDen Gläubigern der an der Verschmelzung beteiligten Rechtsträger ist, wenn sie binnen sechs Monaten nach dem Tag, an dem die Eintragung der Verschmelzung in das Register des Sitzes desjenigen Rechtsträgers, dessen Gläubiger sie sind, nach § 19 Abs. 3 UmwG als bekannt gemacht gilt, ihren Anspruch nach Grund und Höhe in Textform anmelden, Sicherheit zu leisten, soweit sie nicht Befriedigung verlangen können. Dieses Recht steht den Gläubigern jedoch nur zu, wenn sie glaubhaft machen, dass durch die Verschmelzung die Erfüllung der Forderung gefährdet wird."
    },
    {
      "date": "2025-09-18",
      "id": "130236",
      "original_text": "Registerbekanntmachung nach dem Umwandlungsgesetz\nSachsen Amtsgericht Chemnitz HRB 31700\nJR Optionsstrategien Beratung GmbH – Zwickau",
      "type": "Registerbekanntmachung nach dem Umwandlungsgesetz",
      "state": "Sachsen",
      "amtsgericht": "Amtsgericht Chemnitz",
      "registernummer": "HRB 31700",
      "registerart": "HRB",
      "company_name": "JR Optionsstrategien Beratung GmbH",
      "company_seat": "Zwickau",
      "details": "18.09.2025 (Bekanntmachungsdatum)\n\nSachsen Amtsgericht Chemnitz HRB 31700\nRegisterbekanntmachung nach dem Umwandlungsgesetz 18.09.2025 (Eintragungsdatum)\n\nJR Optionsstrategien Beratung GmbH\nGesellschaft mit beschränkter Haftung\nZwickau\n\nDen Gläubigern der an der Ausgliederung beteiligten Rechtsträger ist, wenn sie binnen sechs Monaten nach dem Tag, an dem die Eintragung der Ausgliederung in das Register des Sitzes desjenigen Rechtsträgers, dessen Gläubiger sie sind, nach § 19 Abs. 3 UmwG als bekannt gemacht gilt, ihren Anspruch nach Grund und Höhe in Textform anmelden, Sicherheit zu leisten, soweit sie nicht Befriedigung verlangen können. Dieses Recht steht den Gläubigern jedoch nur zu, wenn sie glaubhaft machen, dass durch die Ausgliederung die Erfüllung der Forderung gefährdet wird."
    },
    {
      "date": "2025-09-18",
      "id": "130237",
      "original_text": "Sonstige Registerbekanntmachung\nSachsen Amtsgericht Chemnitz HRB 26216\nKabel - Leitungs- und Umweltprojektbau GmbH – Schöneck/Vogtl.",
      "type": "Sonstige Registerbekanntmachung",
      "state": "Sachsen",
      "amtsgericht": "Amtsgericht Chemnitz",
      "registernummer": "HRB 26216",
      "registerart": "HRB",
      "company_name": "Kabel - Leitungs- und Umweltprojektbau GmbH",
      "company_seat": "Schöneck/Vogtl.",
      "details": "18.09.2025 (Bekanntmachungsdatum)\n\nSachsen Amtsgericht Chemnitz HRB 26216\nSonstige Registerbekanntmachung 18.09.2025 (Eintragungsdatum)\n\nKabel - Leitungs- und Umweltprojektbau GmbH\nGesellschaft mit beschränkter Haftung\nSchöneck/Vogtl.\n\nHRB 26216\nKabel - Leitungs- und Umweltprojektbau GmbH, Schöneck/Vogtl.,\nWaldstraße 8, 08261 Schöneck/Vogtl.\n\nAufgrund der Verschmelzung der Netzkontor Fiberservice GmbH (vormals: Amtsgericht Charlottenburg, HRB 216692 B; zuletzt: Amtsgericht Hamburg, HRB 183648) auf die Netzkontor GmbH mit dem Sitz in Hamburg (Amtsgericht Hamburg, HRB 183104) als übernehmender Gesellschaft, wirksam geworden am 30.07.2025, besteht der Gewinnabführungsvertrag vom 28.09.2023 nunmehr mit der Netzkontor GmbH mit dem Sitz in Hamburg (Amtsgericht Hamburg, HRB 183104) als herrschendem Unternehmen."
    },
    {
      "date": "2025-09-18",
      "id": "130238",
      "original_text": "Registerbekanntmachung nach dem Umwandlungsgesetz\nSachsen Amtsgericht Chemnitz HRB 28479\nr2:finance GmbH – Zwickau",
      "type": "Registerbekanntmachung nach dem Umwandlungsgesetz",
      "state": "Sachsen",
      "amtsgericht": "Amtsgericht Chemnitz",
      "registernummer": "HRB 28479",
      "registerart": "HRB",
      "company_name": "r2:finance GmbH",
      "company_seat": "Zwickau",
      "details": "18.09.2025 (Bekanntmachungsdatum)\n\nSachsen Amtsgericht Chemnitz HRB 28479\nRegisterbekanntmachung nach dem Umwandlungsgesetz 18.09.2025 (Eintragungsdatum)\n\nr2:finance GmbH\nGesellschaft mit beschränkter Haftung\nZwickau\n\nDen Gläubigern der an der Ausgliederung beteiligten Rechtsträger ist, wenn sie binnen sechs Monaten nach dem Tag, an dem die Eintragung der Ausgliederung in das Register des Sitzes desjenigen Rechtsträgers, dessen Gläubiger sie sind, nach § 19 Abs. 3 UmwG als bekannt gemacht gilt, ihren Anspruch nach Grund und Höhe in Textform anmelden, Sicherheit zu leisten, soweit sie nicht Befriedigung verlangen können. Dieses Recht steht den Gläubigern jedoch nur zu, wenn sie glaubhaft machen, dass durch die Ausgliederung die Erfüllung der Forderung gefährdet wird."
    },
    {
      "date": "2025-09-18",
      "id": "130239",
      "original_text": "Registerbekanntmachung nach dem Umwandlungsgesetz\nNiedersachsen Amtsgericht Tostedt HRA 205507\nMarvin Kattau e.K. – Bremervörde",
      "type": "Registerbekanntmachung nach dem Umwandlungsgesetz",
      "state": "Niedersachsen",
      "amtsgericht": "Amtsgericht Tostedt",
      "registernummer": "HRA 205507",
      "registerart": "HRA",
      "company_name": "Marvin Kattau e.K.",
      "company_seat": "Bremervörde",
      "details": "18.09.2025 (Bekanntmachungsdatum)\n\nNiedersachsen Amtsgericht Tostedt HRA 205507\nRegisterbekanntmachung nach dem Umwandlungsgesetz 18.09.2025 (Eintragungsdatum)\n\nMarvin Kattau e.K.\nEinzelkaufmann / Einzelkauffrau\nBremervörde\n\nDen Gläubigern der an der Ausgliederung beteiligten Rechtsträger ist, wenn sie binnen sechs Monaten nach dem Tag, an dem die Eintragung der Ausgliederung in das Register des Sitzes desjenigen Rechtsträgers, dessen Gläubiger sie sind, nach § 19 Abs. 3 UmwG als bekannt gemacht gilt, ihren Anspruch nach Grund und Höhe schriftlich anmelden, Sicherheit zu leisten, soweit sie nicht Befriedigung verlangen können. Dieses Recht steht den Gläubigern jedoch nur zu, wenn sie glaubhaft machen, dass durch die Ausgliederung die Erfüllung der Forderung gefährdet wird."
    },
    {
      "date": "2025-09-18",
      "id": "130240",
      "original_text": "Registerbekanntmachung nach dem Umwandlungsgesetz\nNiedersachsen Amtsgericht Hannover HRB 217166\ninterev GmbH – Langenhagen",
      "type": "Registerbekanntmachung nach dem Umwandlungsgesetz",
      "state": "Niedersachsen",
      "amtsgericht": "Amtsgericht Hannover",
      "registernummer": "HRB 217166",
      "registerart": "HRB",
      "company_name": "interev GmbH",
      "company_seat": "Langenhagen",
      "details": "18.09.2025 (Bekanntmachungsdatum)\n\nNiedersachsen Amtsgericht Hannover HRB 217166\nRegisterbekanntmachung nach dem Umwandlungsgesetz 18.09.2025 (Eintragungsdatum)\n\ninterev GmbH\nGesellschaft mit beschränkter Haftung\nLangenhagen\n\nDen Gläubigern der an der Verschmelzung beteiligten Rechtsträger ist, wenn sie binnen sechs Monaten nach dem Tag, an dem die Eintragung der Verschmelzung in das Register des Sitzes desjenigen Rechtsträgers, dessen Gläubiger sie sind, nach § 19  Abs.  3 UmwG als bekannt gemacht gilt, ihren Anspruch nach Grund und Höhe schriftlich anmelden, Sicherheit zu leisten, soweit sie nicht Befriedigung verlangen können. Dieses Recht steht den Gläubigern jedoch nur zu, wenn sie glaubhaft machen, dass durch die Verschmelzung die Erfüllung der Forderung gefährdet wird."
    },
    {
      "date": "2025-09-18",
      "id": "130241",
      "original_text": "Registerbekanntmachung nach dem Umwandlungsgesetz\nNiedersachsen Amtsgericht Hildesheim HRA 21130\nGustav Schiwy Zweirad-Fachgeschäft e.K. – Burgdorf",
      "type": "Registerbekanntmachung nach dem Umwandlungsgesetz",
      "state": "Niedersachsen",
      "amtsgericht": "Amtsgericht Hildesheim",
      "registernummer": "HRA 21130",
      "registerart": "HRA",
      "company_name": "Gustav Schiwy Zweirad-Fachgeschäft e.K.",
      "company_seat": "Burgdorf",
      "details": "18.09.2025 (Bekanntmachungsdatum)\n\nNiedersachsen Amtsgericht Hildesheim HRA 21130\nRegisterbekanntmachung nach dem Umwandlungsgesetz 18.09.2025 (Eintragungsdatum)\n\nGustav Schiwy Zweirad-Fachgeschäft e.K.\nEinzelkaufmann / Einzelkauffrau\nBurgdorf\n\nDen Gläubigern der an der Ausgliederung beteiligten Rechtsträger ist, wenn sie binnen sechs Monaten nach dem Tag, an dem die Eintragung der Ausgliederung in das Register des Sitzes desjenigen Rechtsträgers, dessen Gläubiger sie sind, nach § 19 Abs. 3 UmwG als bekannt gemacht gilt, ihren Anspruch nach Grund und Höhe schriftlich anmelden, Sicherheit zu leisten, soweit sie nicht Befriedigung verlangen können. Dieses Recht steht den Gläubigern jedoch nur zu, wenn sie glaubhaft machen, dass durch die Ausgliederung die Erfüllung der Forderung gefährdet wird."
    },
    {
      "date": "2025-09-18",
      "id": "130242",
      "original_text": "Registerbekanntmachung nach dem Umwandlungsgesetz\nNiedersachsen Amtsgericht Hildesheim HRB 210292\nFahrrad Schiwy GmbH – Burgdorf",
      "type": "Registerbekanntmachung nach dem Umwandlungsgesetz",
      "state": "Niedersachsen",
      "amtsgericht": "Amtsgericht Hildesheim",
      "registernummer": "HRB 210292",
      "registerart": "HRB",
      "company_name": "Fahrrad Schiwy GmbH",
      "company_seat": "Burgdorf",
      "details": "18.09.2025 (Bekanntmachungsdatum)\n\nNiedersachsen Amtsgericht Hildesheim HRB 210292\nRegisterbekanntmachung nach dem Umwandlungsgesetz 18.09.2025 (Eintragungsdatum)\n\nFahrrad Schiwy GmbH\nGesellschaft mit beschränkter Haftung\nBurgdorf\n\nDen Gläubigern der an der Ausgliederung beteiligten Rechtsträger ist, wenn sie binnen sechs Monaten nach dem Tag, an dem die Eintragung der Ausgliederung in das Register des Sitzes desjenigen Rechtsträgers, dessen Gläubiger sie sind, nach § 19 Abs. 3 UmwG als bekannt gemacht gilt, ihren Anspruch nach Grund und Höhe schriftlich anmelden, Sicherheit zu leisten, soweit sie nicht Befriedigung verlangen können. Dieses Recht steht den Gläubigern jedoch nur zu, wenn sie glaubhaft machen, dass durch die Ausgliederung die Erfüllung der Forderung gefährdet wird."
    },
    {
      "date": "2025-09-18",
      "id": "130243",
      "original_text": "Registerbekanntmachung nach dem Umwandlungsgesetz\nNiedersachsen Amtsgericht Tostedt HRA 205550\nKattau Haustechnik GmbH & Co.KG – Alfstedt",
      "type": "Registerbekanntmachung nach dem Umwandlungsgesetz",
      "state": "Niedersachsen",
      "amtsgericht": "Amtsgericht Tostedt",
      "registernummer": "HRA 205550",
      "registerart": "HRA",
      "company_name": "Kattau Haustechnik GmbH & Co.KG",
      "company_seat": "Alfstedt",
      "details": "18.09.2025 (Bekanntmachungsdatum)\n\nNiedersachsen Amtsgericht Tostedt HRA 205550\nRegisterbekanntmachung nach dem Umwandlungsgesetz 18.09.2025 (Eintragungsdatum)\n\nKattau Haustechnik GmbH & Co.KG\nKommanditgesellschaft\nAlfstedt\n\nDen Gläubigern der an der Ausgliederung beteiligten Rechtsträger ist, wenn sie binnen sechs Monaten nach dem Tag, an dem die Eintragung der Ausgliederung in das Register des Sitzes desjenigen Rechtsträgers, dessen Gläubiger sie sind, nach § 19 Abs. 3 UmwG als bekannt gemacht gilt, ihren Anspruch nach Grund und Höhe schriftlich anmelden, Sicherheit zu leisten, soweit sie nicht Befriedigung verlangen können. Dieses Recht steht den Gläubigern jedoch nur zu, wenn sie glaubhaft machen, dass durch die Ausgliederung die Erfüllung der Forderung gefährdet wird."
    },
    {
      "date": "2025-09-18",
      "id": "130244",
      "original_text": "Registerbekanntmachung nach dem Umwandlungsgesetz\nNiedersachsen Amtsgericht Tostedt HRB 208472\nJörg Goos Maler- und Lackiermeister UG (haftungsbeschränkt) – Cuxhaven",
      "type": "Registerbekanntmachung nach dem Umwandlungsgesetz",
      "state": "Niedersachsen",
      "amtsgericht": "Amtsgericht Tostedt",
      "registernummer": "HRB 208472",
      "registerart": "HRB",
      "company_name": "Jörg Goos Maler- und Lackiermeister UG (haftungsbeschränkt)",
      "company_seat": "Cuxhaven",
      "details": "18.09.2025 (Bekanntmachungsdatum)\n\nNiedersachsen Amtsgericht Tostedt HRB 208472\nRegisterbekanntmachung nach dem Umwandlungsgesetz 18.09.2025 (Eintragungsdatum)\n\nJörg Goos Maler- und Lackiermeister UG (haftungsbeschränkt)\nGesellschaft mit beschränkter Haftung\nCuxhaven\n\nDen Gläubigern der an der Verschmelzung beteiligten Rechtsträger ist, wenn sie binnen sechs Monaten nach dem Tag, an dem die Eintragung der Verschmelzung in das Register des Sitzes desjenigen Rechtsträgers, dessen Gläubiger sie sind, nach § 19  Abs.  3 UmwG als bekannt gemacht gilt, ihren Anspruch nach Grund und Höhe schriftlich anmelden, Sicherheit zu leisten, soweit sie nicht Befriedigung verlangen können. Dieses Recht steht den Gläubigern jedoch nur zu, wenn sie glaubhaft machen, dass durch die Verschmelzung die Erfüllung der Forderung gefährdet wird."
    },
    {
      "date": "2025-09-18",
      "id": "130245",
      "original_text": "Registerbekanntmachung nach dem Umwandlungsgesetz\nNiedersachsen Amtsgericht Lüneburg HRA 204464\nFox Training e.K. – Lüchow (Wendland)",
      "type": "Registerbekanntmachung nach dem Umwandlungsgesetz",
      "state": "Niedersachsen",
      "amtsgericht": "Amtsgericht Lüneburg",
      "registernummer": "HRA 204464",
      "registerart": "HRA",
      "company_name": "Fox Training e.K.",
      "company_seat": "Lüchow (Wendland)",
      "details": "18.09.2025 (Bekanntmachungsdatum)\n\nNiedersachsen Amtsgericht Lüneburg HRA 204464\nRegisterbekanntmachung nach dem Umwandlungsgesetz 18.09.2025 (Eintragungsdatum)\n\nFox Training e.K.\nEinzelkaufmann / Einzelkauffrau\nLüchow (Wendland)\n\nDen Gläubigern der an der Ausgliederung beteiligten Rechtsträger ist, wenn sie binnen sechs Monaten nach dem Tag, an dem die Eintragung der Ausgliederung in das Register des Sitzes desjenigen Rechtsträgers, dessen Gläubiger sie sind, nach § 19 Abs. 3 UmwG als bekannt gemacht gilt, ihren Anspruch nach Grund und Höhe schriftlich anmelden, Sicherheit zu leisten, soweit sie nicht Befriedigung verlangen können. Dieses Recht steht den Gläubigern jedoch nur zu, wenn sie glaubhaft machen, dass durch die Ausgliederung die Erfüllung der Forderung gefährdet wird."
    },
    {
      "date": "2025-09-18",
      "id": "130246",
      "original_text": "Registerbekanntmachung nach dem Umwandlungsgesetz\nNiedersachsen Amtsgericht Stadthagen HRB 201350\nStansch Vermögensstrategien GmbH – Bückeburg",
      "type": "Registerbekanntmachung nach dem Umwandlungsgesetz",
      "state": "Niedersachsen",
      "amtsgericht": "Amtsgericht Stadthagen",
      "registernummer": "HRB 201350",
      "registerart": "HRB",
      "company_name": "Stansch Vermögensstrategien GmbH",
      "company_seat": "Bückeburg",
      "details": "18.09.2025 (Bekanntmachungsdatum)\n\nNiedersachsen Amtsgericht Stadthagen HRB 201350\nRegisterbekanntmachung nach dem Umwandlungsgesetz 08.09.2025 (Eintragungsdatum)\n\nStansch Vermögensstrategien GmbH\nGesellschaft mit beschränkter Haftung\nBückeburg\n\nDen Gläubigern der an der Verschmelzung beteiligten Rechtsträger ist, wenn sie binnen sechs Monaten nach dem Tag, an dem die Eintragung der Verschmelzung in das Register des Sitzes desjenigen Rechtsträgers, dessen Gläubiger sie sind, nach § 19  Abs.  3 UmwG als bekannt gemacht gilt, ihren Anspruch nach Grund und Höhe schriftlich anmelden, Sicherheit zu leisten, soweit sie nicht Befriedigung verlangen können. Dieses Recht steht den Gläubigern jedoch nur zu, wenn sie glaubhaft machen, dass durch die Verschmelzung die Erfüllung der Forderung gefährdet wird."
    },
    {
      "date": "2025-09-18",
      "id": "130247",
      "original_text": "Registerbekanntmachung nach dem Umwandlungsgesetz\nNiedersachsen Amtsgericht Osnabrück HRB 120578 früher Amtsgericht Meppen\nBerentzen Distillers International GmbH – Haselünne",
      "type": "Registerbekanntmachung nach dem Umwandlungsgesetz",
      "state": "Niedersachsen",
      "amtsgericht": "Amtsgericht Osnabrück",
      "registernummer": "HRB 120578",
      "registerart": "HRB",
      "company_name": "Berentzen Distillers International GmbH",
      "company_seat": "Haselünne",
      "former_amtsgericht": "Meppen",
      "details": "18.09.2025 (Bekanntmachungsdatum)\n\nNiedersachsen Amtsgericht Osnabrück HRB 120578 früher Amtsgericht Meppen\nRegisterbekanntmachung nach dem Umwandlungsgesetz 18.09.2025 (Eintragungsdatum)\n\nBerentzen Distillers International GmbH\nGesellschaft mit beschränkter Haftung\nHaselünne\n\nDen Gläubigern der an der Verschmelzung beteiligten Rechtsträger ist, wenn sie binnen sechs Monaten nach dem Tag, an dem die Eintragung der Verschmelzung in das Register des Sitzes desjenigen Rechtsträgers, dessen Gläubiger sie sind, nach § 19  Abs.  3 UmwG als bekannt gemacht gilt, ihren Anspruch nach Grund und Höhe schriftlich anmelden, Sicherheit zu leisten, soweit sie nicht Befriedigung verlangen können. Dieses Recht steht den Gläubigern jedoch nur zu, wenn sie glaubhaft machen, dass durch die Verschmelzung die Erfüllung der Forderung gefährdet wird."
    },
    {
      "date": "2025-09-18",
      "id": "130248",
      "original_text": "Registerbekanntmachung nach dem Umwandlungsgesetz\nNiedersachsen Amtsgericht Osnabrück HRB 120578 früher Amtsgericht Meppen\nBerentzen Distillers International GmbH – Haselünne",
      "type": "Registerbekanntmachung nach dem Umwandlungsgesetz",
      "state": "Niedersachsen",
      "amtsgericht": "Amtsgericht Osnabrück",
      "registernummer": "HRB 120578",
      "registerart": "HRB",
      "company_name": "Berentzen Distillers International GmbH",
      "company_seat": "Haselünne",
      "former_amtsgericht": "Meppen",
      "details": "18.09.2025 (Bekanntmachungsdatum)\n\nNiedersachsen Amtsgericht Osnabrück HRB 120578 früher Amtsgericht Meppen\nRegisterbekanntmachung nach dem Umwandlungsgesetz 18.09.2025 (Eintragungsdatum)\n\nBerentzen Distillers International GmbH\nGesellschaft mit beschränkter Haftung\nHaselünne\n\nDen Gläubigern der an der Verschmelzung beteiligten Rechtsträger ist, wenn sie binnen sechs Monaten nach dem Tag, an dem die Eintragung der Verschmelzung in das Register des Sitzes desjenigen Rechtsträgers, dessen Gläubiger sie sind, nach § 19  Abs.  3 UmwG als bekannt gemacht gilt, ihren Anspruch nach Grund und Höhe schriftlich anmelden, Sicherheit zu leisten, soweit sie nicht Befriedigung verlangen können. Dieses Recht steht den Gläubigern jedoch nur zu, wenn sie glaubhaft machen, dass durch die Verschmelzung die Erfüllung der Forderung gefährdet wird."
    },
    {
      "date": "2025-09-18",
      "id": "130249",
      "original_text": "Registerbekanntmachung nach dem Umwandlungsgesetz\nNiedersachsen Amtsgericht Osnabrück HRB 120578 früher Amtsgericht Meppen\nBerentzen Distillers International GmbH – Haselünne",
      "type": "Registerbekanntmachung nach dem Umwandlungsgesetz",
      "state": "Niedersachsen",
      "amtsgericht": "Amtsgericht Osnabrück",
      "registernummer": "HRB 120578",
      "registerart": "HRB",
      "company_name": "Berentzen Distillers International GmbH",
      "company_seat": "Haselünne",
      "former_amtsgericht": "Meppen",
      "details": "18.09.2025 (Bekanntmachungsdatum)\n\nNiedersachsen Amtsgericht Osnabrück HRB 120578 früher Amtsgericht Meppen\nRegisterbekanntmachung nach dem Umwandlungsgesetz 18.09.2025 (Eintragungsdatum)\n\nBerentzen Distillers International GmbH\nGesellschaft mit beschränkter Haftung\nHaselünne\n\nDen Gläubigern der an der Verschmelzung beteiligten Rechtsträger ist, wenn sie binnen sechs Monaten nach dem Tag, an dem die Eintragung der Verschmelzung in das Register des Sitzes desjenigen Rechtsträgers, dessen Gläubiger sie sind, nach § 19  Abs.  3 UmwG als bekannt gemacht gilt, ihren Anspruch nach Grund und Höhe schriftlich anmelden, Sicherheit zu leisten, soweit sie nicht Befriedigung verlangen können. Dieses Recht steht den Gläubigern jedoch nur zu, wenn sie glaubhaft machen, dass durch die Verschmelzung die Erfüllung der Forderung gefährdet wird."
    },
    {
      "date": "2025-09-18",
      "id": "130250",
      "original_text": "Registerbekanntmachung nach dem Umwandlungsgesetz\nNiedersachsen Amtsgericht Osnabrück HRB 120578 früher Amtsgericht Meppen\nBerentzen Distillers International GmbH – Haselünne",
      "type": "Registerbekanntmachung nach dem Umwandlungsgesetz",
      "state": "Niedersachsen",
      "amtsgericht": "Amtsgericht Osnabrück",
      "registernummer": "HRB 120578",
      "registerart": "HRB",
      "company_name": "Berentzen Distillers International GmbH",
      "company_seat": "Haselünne",
      "former_amtsgericht": "Meppen",
      "details": "18.09.2025 (Bekanntmachungsdatum)\n\nNiedersachsen Amtsgericht Osnabrück HRB 120578 früher Amtsgericht Meppen\nRegisterbekanntmachung nach dem Umwandlungsgesetz 18.09.2025 (Eintragungsdatum)\n\nBerentzen Distillers International GmbH\nGesellschaft mit beschränkter Haftung\nHaselünne\n\nDen Gläubigern der an der Verschmelzung beteiligten Rechtsträger ist, wenn sie binnen sechs Monaten nach dem Tag, an dem die Eintragung der Verschmelzung in das Register des Sitzes desjenigen Rechtsträgers, dessen Gläubiger sie sind, nach § 19  Abs.  3 UmwG als bekannt gemacht gilt, ihren Anspruch nach Grund und Höhe schriftlich anmelden, Sicherheit zu leisten, soweit sie nicht Befriedigung verlangen können. Dieses Recht steht den Gläubigern jedoch nur zu, wenn sie glaubhaft machen, dass durch die Verschmelzung die Erfüllung der Forderung gefährdet wird."
    },
    {
      "date": "2025-09-18",
      "id": "130251",
      "original_text": "Registerbekanntmachung nach dem Umwandlungsgesetz\nNiedersachsen Amtsgericht Braunschweig HRB 212523\nAudi Immobilien GmbH – Wolfsburg",
      "type": "Registerbekanntmachung nach dem Umwandlungsgesetz",
      "state": "Niedersachsen",
      "amtsgericht": "Amtsgericht Braunschweig",
      "registernummer": "HRB 212523",
      "registerart": "HRB",
      "company_name": "Audi Immobilien GmbH",
      "company_seat": "Wolfsburg",
      "details": "18.09.2025 (Bekanntmachungsdatum)\n\nNiedersachsen Amtsgericht Braunschweig HRB 212523\nRegisterbekanntmachung nach dem Umwandlungsgesetz 18.09.2025 (Eintragungsdatum)\n\nAudi Immobilien GmbH\nGesellschaft mit beschränkter Haftung\nWolfsburg\n\nDen Gläubigern der an der formwechselnden Umwandlung beteiligten Rechtsträger ist, wenn sie binnen sechs Monaten nach dem Tag, an dem die Eintragung der Umwandlung in das Register des Sitzes desjenigen Rechtsträgers, dessen Gläubiger sie sind, nach § 19 Abs. 3 UmwG als bekannt gemacht gilt, ihren Anspruch nach Grund und Höhe schriftlich anmelden, Sicherheit zu leisten, soweit sie nicht Befriedigung verlangen können. Dieses Recht steht den Gläubigern jedoch nur zu, wenn sie glaubhaft machen, dass durch die formwechselnde Umwandlung die Erfüllung der Forderung gefährdet wird."
    },
    {
      "date": "2025-09-18",
      "id": "130252",
      "original_text": "Registerbekanntmachung nach dem Umwandlungsgesetz\nNiedersachsen Amtsgericht Göttingen HRB 205106\nSerEye GmbH – Göttingen",
      "type": "Registerbekanntmachung nach dem Umwandlungsgesetz",
      "state": "Niedersachsen",
      "amtsgericht": "Amtsgericht Göttingen",
      "registernummer": "HRB 205106",
      "registerart": "HRB",
      "company_name": "SerEye GmbH",
      "company_seat": "Göttingen",
      "details": "18.09.2025 (Bekanntmachungsdatum)\n\nNiedersachsen Amtsgericht Göttingen HRB 205106\nRegisterbekanntmachung nach dem Umwandlungsgesetz 18.09.2025 (Eintragungsdatum)\n\nSerEye GmbH\nGesellschaft mit beschränkter Haftung\nGöttingen\n\nDen Gläubigern der an der Verschmelzung beteiligten Rechtsträger ist, wenn sie binnen sechs Monaten nach dem Tag, an dem die Eintragung der Verschmelzung in das Register des Sitzes desjenigen Rechtsträgers, dessen Gläubiger sie sind, nach § 19  Abs.  3 UmwG als bekannt gemacht gilt, ihren Anspruch nach Grund und Höhe schriftlich anmelden, Sicherheit zu leisten, soweit sie nicht Befriedigung verlangen können. Dieses Recht steht den Gläubigern jedoch nur zu, wenn sie glaubhaft machen, dass durch die Verschmelzung die Erfüllung der Forderung gefährdet wird."
    },
    {
      "date": "2025-09-18",
      "id": "130253",
      "original_text": "Löschungsankündigung\nNiedersachsen Amtsgericht Stadthagen HRB 201661\nKavalier-GmbH – Stadthagen",
      "type": "Löschungsankündigung",
      "state": "Niedersachsen",
      "amtsgericht": "Amtsgericht Stadthagen",
      "registernummer": "HRB 201661",
      "registerart": "HRB",
      "company_name": "Kavalier-GmbH",
      "company_seat": "Stadthagen",
      "details": "18.09.2025 (Bekanntmachungsdatum)\n\nNiedersachsen Amtsgericht Stadthagen HRB 201661\nLöschungsankündigung\n\nKavalier-GmbH\nGesellschaft mit beschränkter Haftung\nStadthagen\n\nDas Registergericht beabsichtigt, die Gesellschaft von Amts wegen nach § 394 FamFG zu löschen. Die Frist zur Erhebung eines Widerspruchs ist auf 1 Monat ab dieser Registerbekanntmachung festgesetzt."
    },
    {
      "date": "2025-09-18",
      "id": "130254",
      "original_text": "Löschungsankündigung\nNiedersachsen Amtsgericht Braunschweig HRB 205782\nBraunschweig Laures GmbH – Braunschweig",
      "type": "Löschungsankündigung",
      "state": "Niedersachsen",
      "amtsgericht": "Amtsgericht Braunschweig",
      "registernummer": "HRB 205782",
      "registerart": "HRB",
      "company_name": "Braunschweig Laures GmbH",
      "company_seat": "Braunschweig",
      "details": "18.09.2025 (Bekanntmachungsdatum)\n\nNiedersachsen Amtsgericht Braunschweig HRB 205782\nLöschungsankündigung\n\nBraunschweig Laures GmbH\nGesellschaft mit beschränkter Haftung\nBraunschweig\n\nDas Registergericht beabsichtigt, die Gesellschaft von Amts wegen nach § 394 FamFG zu löschen. Die Frist zur Erhebung eines Widerspruchs ist auf 1 Monat ab dieser Registerbekanntmachung festgesetzt."
    },
    {
      "date": "2025-09-18",
      "id": "130255",
      "original_text": "Registerbekanntmachung nach dem Umwandlungsgesetz\nNiedersachsen Amtsgericht Hannover HRB 211683\ninterev GmbH – Langenhagen",
      "type": "Registerbekanntmachung nach dem Umwandlungsgesetz",
      "state": "Niedersachsen",
      "amtsgericht": "Amtsgericht Hannover",
      "registernummer": "HRB 211683",
      "registerart": "HRB",
      "company_name": "interev GmbH",
      "company_seat": "Langenhagen",
      "details": "18.09.2025 (Bekanntmachungsdatum)\n\nNiedersachsen Amtsgericht Hannover HRB 211683\nRegisterbekanntmachung nach dem Umwandlungsgesetz 18.09.2025 (Eintragungsdatum)\n\ninterev GmbH\nGesellschaft mit beschränkter Haftung\nLangenhagen\n\nDen Gläubigern der an der Verschmelzung beteiligten Rechtsträger ist, wenn sie binnen sechs Monaten nach dem Tag, an dem die Eintragung der Verschmelzung in das Register des Sitzes desjenigen Rechtsträgers, dessen Gläubiger sie sind, nach § 19  Abs.  3 UmwG als bekannt gemacht gilt, ihren Anspruch nach Grund und Höhe schriftlich anmelden, Sicherheit zu leisten, soweit sie nicht Befriedigung verlangen können. Dieses Recht steht den Gläubigern jedoch nur zu, wenn sie glaubhaft machen, dass durch die Verschmelzung die Erfüllung der Forderung gefährdet wird."
    },
    {
      "date": "2025-09-18",
      "id": "130256",
      "original_text": "Registerbekanntmachung nach dem Umwandlungsgesetz\nNiedersachsen Amtsgericht Aurich HRB 203797\nnorden trading GmbH – Norden",
      "type": "Registerbekanntmachung nach dem Umwandlungsgesetz",
      "state": "Niedersachsen",
      "amtsgericht": "Amtsgericht Aurich",
      "registernummer": "HRB 203797",
      "registerart": "HRB",
      "company_name": "norden trading GmbH",
      "company_seat": "Norden",
      "details": "18.09.2025 (Bekanntmachungsdatum)\n\nNiedersachsen Amtsgericht Aurich HRB 203797\nRegisterbekanntmachung nach dem Umwandlungsgesetz 01.09.2025 (Eintragungsdatum)\n\nnorden trading GmbH\nGesellschaft mit beschränkter Haftung\nNorden\n\nDen Gläubigern der an der Verschmelzung beteiligten Rechtsträger ist, wenn sie binnen sechs Monaten nach dem Tag, an dem die Eintragung der Verschmelzung in das Register des Sitzes desjenigen Rechtsträgers, dessen Gläubiger sie sind, nach § 19  Abs.  3 UmwG als bekannt gemacht gilt, ihren Anspruch nach Grund und Höhe schriftlich anmelden, Sicherheit zu leisten, soweit sie nicht Befriedigung verlangen können. Dieses Recht steht den Gläubigern jedoch nur zu, wenn sie glaubhaft machen, dass durch die Verschmelzung die Erfüllung der Forderung gefährdet wird."
    },
    {
      "date": "2025-09-18",
      "id": "130257",
      "original_text": "Einreichung neuer Dokumente\nNiedersachsen Amtsgericht Braunschweig HRB 100516 früher Amtsgericht Wolfsburg\nVolkswagen Group Services GmbH – Wolfsburg",
      "type": "Einreichung neuer Dokumente",
      "state": "Niedersachsen",
      "amtsgericht": "Amtsgericht Braunschweig",
      "registernummer": "HRB 100516",
      "registerart": "HRB",
      "company_name": "Volkswagen Group Services GmbH",
      "company_seat": "Wolfsburg",
      "former_amtsgericht": "Wolfsburg",
      "details": "18.09.2025 (Bekanntmachungsdatum)\n\nNiedersachsen Amtsgericht Braunschweig HRB 100516 früher Amtsgericht Wolfsburg\nEinreichung neuer Dokumente 18.09.2025 (Eintragungsdatum)\n\nVolkswagen Group Services GmbH\nGesellschaft mit beschränkter Haftung\nWolfsburg\n\nDie Liste der Mitglieder des Aufsichtsrats wurde beim Registergericht eingereicht."
    },
    {
      "date": "2025-09-18",
      "id": "130258",
      "original_text": "Registerbekanntmachung nach dem Umwandlungsgesetz\nNiedersachsen Amtsgericht Tostedt HRA 205554\nOffice Data Solutions Michael Fitschen e. K. – Heeslingen",
      "type": "Registerbekanntmachung nach dem Umwandlungsgesetz",
      "state": "Niedersachsen",
      "amtsgericht": "Amtsgericht Tostedt",
      "registernummer": "HRA 205554",
      "registerart": "HRA",
      "company_name": "Office Data Solutions Michael Fitschen e. K.",
      "company_seat": "Heeslingen",
      "details": "18.09.2025 (Bekanntmachungsdatum)\n\nNiedersachsen Amtsgericht Tostedt HRA 205554\nRegisterbekanntmachung nach dem Umwandlungsgesetz 18.09.2025 (Eintragungsdatum)\n\nOffice Data Solutions Michael Fitschen e. K.\nEinzelkaufmann / Einzelkauffrau\nHeeslingen\n\nDen Gläubigern der an der Ausgliederung beteiligten Rechtsträger ist, wenn sie binnen sechs Monaten nach dem Tag, an dem die Eintragung der Ausgliederung in das Register des Sitzes desjenigen Rechtsträgers, dessen Gläubiger sie sind, nach § 19 Abs. 3 UmwG als bekannt gemacht gilt, ihren Anspruch nach Grund und Höhe schriftlich anmelden, Sicherheit zu leisten, soweit sie nicht Befriedigung verlangen können. Dieses Recht steht den Gläubigern jedoch nur zu, wenn sie glaubhaft machen, dass durch die Ausgliederung die Erfüllung der Forderung gefährdet wird."
    },
    {
      "date": "2025-09-18",
      "id": "130259",
      "original_text": "Registerbekanntmachung nach dem Umwandlungsgesetz\nNiedersachsen Amtsgericht Tostedt HRB 209232\nblackhead consulting & invest UG (haftungsbeschränkt) – Buchholz",
      "type": "Registerbekanntmachung nach dem Umwandlungsgesetz",
      "state": "Niedersachsen",
      "amtsgericht": "Amtsgericht Tostedt",
      "registernummer": "HRB 209232",
      "registerart": "HRB",
      "company_name": "blackhead consulting & invest UG (haftungsbeschränkt)",
      "company_seat": "Buchholz",
      "details": "18.09.2025 (Bekanntmachungsdatum)\n\nNiedersachsen Amtsgericht Tostedt HRB 209232\nRegisterbekanntmachung nach dem Umwandlungsgesetz 18.09.2025 (Eintragungsdatum)\n\nblackhead consulting & invest UG (haftungsbeschränkt)\nGesellschaft mit beschränkter Haftung\nBuchholz\n\nDen Gläubigern der an der Verschmelzung beteiligten Rechtsträger ist, wenn sie binnen sechs Monaten nach dem Tag, an dem die Eintragung der Verschmelzung in das Register des Sitzes desjenigen Rechtsträgers, dessen Gläubiger sie sind, nach § 19  Abs.  3 UmwG als bekannt gemacht gilt, ihren Anspruch nach Grund und Höhe schriftlich anmelden, Sicherheit zu leisten, soweit sie nicht Befriedigung verlangen können. Dieses Recht steht den Gläubigern jedoch nur zu, wenn sie glaubhaft machen, dass durch die Verschmelzung die Erfüllung der Forderung gefährdet wird."
    },
    {
      "date": "2025-09-18",
      "id": "130260",
      "original_text": "Registerbekanntmachung nach dem Umwandlungsgesetz\nNiedersachsen Amtsgericht Braunschweig HRA 202970\nAUDI Immobilien GmbH & Co. KG – Wolfsburg",
      "type": "Registerbekanntmachung nach dem Umwandlungsgesetz",
      "state": "Niedersachsen",
      "amtsgericht": "Amtsgericht Braunschweig",
      "registernummer": "HRA 202970",
      "registerart": "HRA",
      "company_name": "AUDI Immobilien GmbH & Co. KG",
      "company_seat": "Wolfsburg",
      "details": "18.09.2025 (Bekanntmachungsdatum)\n\nNiedersachsen Amtsgericht Braunschweig HRA 202970\nRegisterbekanntmachung nach dem Umwandlungsgesetz 18.09.2025 (Eintragungsdatum)\n\nAUDI Immobilien GmbH & Co. KG\nKommanditgesellschaft\nWolfsburg\n\nDen Gläubigern der an der formwechselnden Umwandlung beteiligten Rechtsträger ist, wenn sie binnen sechs Monaten nach dem Tag, an dem die Eintragung der Umwandlung in das Register des Sitzes desjenigen Rechtsträgers, dessen Gläubiger sie sind, nach § 19 Abs. 3 UmwG als bekannt gemacht gilt, ihren Anspruch nach Grund und Höhe schriftlich anmelden, Sicherheit zu leisten, soweit sie nicht Befriedigung verlangen können. Dieses Recht steht den Gläubigern jedoch nur zu, wenn sie glaubhaft machen, dass durch die formwechselnde Umwandlung die Erfüllung der Forderung gefährdet wird."
    },
    {
      "date": "2025-09-18",
      "id": "130261",
      "original_text": "Registerbekanntmachung nach dem Umwandlungsgesetz\nNiedersachsen Amtsgericht Tostedt HRA 205603\nAdam Poltorak e.K. – Geestland",
      "type": "Registerbekanntmachung nach dem Umwandlungsgesetz",
      "state": "Niedersachsen",
      "amtsgericht": "Amtsgericht Tostedt",
      "registernummer": "HRA 205603",
      "registerart": "HRA",
      "company_name": "Adam Poltorak e.K.",
      "company_seat": "Geestland",
      "details": "18.09.2025 (Bekanntmachungsdatum)\n\nNiedersachsen Amtsgericht Tostedt HRA 205603\nRegisterbekanntmachung nach dem Umwandlungsgesetz 18.09.2025 (Eintragungsdatum)\n\nAdam Poltorak e.K.\nEinzelkaufmann / Einzelkauffrau\nGeestland\n\nDen Gläubigern der an der Ausgliederung beteiligten Rechtsträger ist, wenn sie binnen sechs Monaten nach dem Tag, an dem die Eintragung der Ausgliederung in das Register des Sitzes desjenigen Rechtsträgers, dessen Gläubiger sie sind, nach § 19 Abs. 3 UmwG als bekannt gemacht gilt, ihren Anspruch nach Grund und Höhe schriftlich anmelden, Sicherheit zu leisten, soweit sie nicht Befriedigung verlangen können. Dieses Recht steht den Gläubigern jedoch nur zu, wenn sie glaubhaft machen, dass durch die Ausgliederung die Erfüllung der Forderung gefährdet wird."
    },
    {
      "date": "2025-09-18",
      "id": "130262",
      "original_text": "Sonstige Registerbekanntmachung\nNiedersachsen Amtsgericht Hannover HRB 213496\nGemeinde Wedemark Bau- und Entwicklungsgesellschaft mbH – Wedemark",
      "type": "Sonstige Registerbekanntmachung",
      "state": "Niedersachsen",
      "amtsgericht": "Amtsgericht Hannover",
      "registernummer": "HRB 213496",
      "registerart": "HRB",
      "company_name": "Gemeinde Wedemark Bau- und Entwicklungsgesellschaft mbH",
      "company_seat": "Wedemark",
      "details": "18.09.2025 (Bekanntmachungsdatum)\n\nNiedersachsen Amtsgericht Hannover HRB 213496\nSonstige Registerbekanntmachung\n\nGemeinde Wedemark Bau- und Entwicklungsgesellschaft mbH\nGesellschaft mit beschränkter Haftung\nWedemark\n\nDie Liste der Mitglieder des Aufsichtsrats wurde beim Registergericht eingereicht."
    },
    {
      "date": "2025-09-18",
      "id": "130263",
      "original_text": "Registerbekanntmachung nach dem Umwandlungsgesetz\nNiedersachsen Amtsgericht Stadthagen HRB 2239\nStansch Kapitalmanagement & Service GmbH – Bückeburg",
      "type": "Registerbekanntmachung nach dem Umwandlungsgesetz",
      "state": "Niedersachsen",
      "amtsgericht": "Amtsgericht Stadthagen",
      "registernummer": "HRB 2239",
      "registerart": "HRB",
      "company_name": "Stansch Kapitalmanagement & Service GmbH",
      "company_seat": "Bückeburg",
      "details": "18.09.2025 (Bekanntmachungsdatum)\n\nNiedersachsen Amtsgericht Stadthagen HRB 2239\nRegisterbekanntmachung nach dem Umwandlungsgesetz 09.09.2025 (Eintragungsdatum)\n\nStansch Kapitalmanagement & Service GmbH\nGesellschaft mit beschränkter Haftung\nBückeburg\n\nDen Gläubigern der an der Verschmelzung beteiligten Rechtsträger ist, wenn sie binnen sechs Monaten nach dem Tag, an dem die Eintragung der Verschmelzung in das Register des Sitzes desjenigen Rechtsträgers, dessen Gläubiger sie sind, nach § 19  Abs.  3 UmwG als bekannt gemacht gilt, ihren Anspruch nach Grund und Höhe schriftlich anmelden, Sicherheit zu leisten, soweit sie nicht Befriedigung verlangen können. Dieses Recht steht den Gläubigern jedoch nur zu, wenn sie glaubhaft machen, dass durch die Verschmelzung die Erfüllung der Forderung gefährdet wird."
    },
    {
      "date": "2025-09-18",
      "id": "130264",
      "original_text": "Registerbekanntmachung nach dem Umwandlungsgesetz\nNiedersachsen Amtsgericht Osnabrück HRB 207609\nbit9 GmbH – Haren",
      "type": "Registerbekanntmachung nach dem Umwandlungsgesetz",
      "state": "Niedersachsen",
      "amtsgericht": "Amtsgericht Osnabrück",
      "registernummer": "HRB 207609",
      "registerart": "HRB",
      "company_name": "bit9 GmbH",
      "company_seat": "Haren",
      "details": "18.09.2025 (Bekanntmachungsdatum)\n\nNiedersachsen Amtsgericht Osnabrück HRB 207609\nRegisterbekanntmachung nach dem Umwandlungsgesetz 18.09.2025 (Eintragungsdatum)\n\nbit9 GmbH\nGesellschaft mit beschränkter Haftung\nHaren\n\nDen Gläubigern der an der Verschmelzung beteiligten Rechtsträger ist, wenn sie binnen sechs Monaten nach dem Tag, an dem die Eintragung der Verschmelzung in das Register des Sitzes desjenigen Rechtsträgers, dessen Gläubiger sie sind, nach § 19  Abs.  3 UmwG als bekannt gemacht gilt, ihren Anspruch nach Grund und Höhe schriftlich anmelden, Sicherheit zu leisten, soweit sie nicht Befriedigung verlangen können. Dieses Recht steht den Gläubigern jedoch nur zu, wenn sie glaubhaft machen, dass durch die Verschmelzung die Erfüllung der Forderung gefährdet wird."
    },
    {
      "date": "2025-09-18",
      "id": "130265",
      "original_text": "Registerbekanntmachung nach dem Umwandlungsgesetz\nNiedersachsen Amtsgericht Osnabrück HRB 120578 früher Amtsgericht Meppen\nBerentzen Distillers International GmbH – Haselünne",
      "type": "Registerbekanntmachung nach dem Umwandlungsgesetz",
      "state": "Niedersachsen",
      "amtsgericht": "Amtsgericht Osnabrück",
      "registernummer": "HRB 120578",
      "registerart": "HRB",
      "company_name": "Berentzen Distillers International GmbH",
      "company_seat": "Haselünne",
      "former_amtsgericht": "Meppen",
      "details": "18.09.2025 (Bekanntmachungsdatum)\n\nNiedersachsen Amtsgericht Osnabrück HRB 120578 früher Amtsgericht Meppen\nRegisterbekanntmachung nach dem Umwandlungsgesetz 18.09.2025 (Eintragungsdatum)\n\nBerentzen Distillers International GmbH\nGesellschaft mit beschränkter Haftung\nHaselünne\n\nDen Gläubigern der an der Verschmelzung beteiligten Rechtsträger ist, wenn sie binnen sechs Monaten nach dem Tag, an dem die Eintragung der Verschmelzung in das Register des Sitzes desjenigen Rechtsträgers, dessen Gläubiger sie sind, nach § 19  Abs.  3 UmwG als bekannt gemacht gilt, ihren Anspruch nach Grund und Höhe schriftlich anmelden, Sicherheit zu leisten, soweit sie nicht Befriedigung verlangen können. Dieses Recht steht den Gläubigern jedoch nur zu, wenn sie glaubhaft machen, dass durch die Verschmelzung die Erfüllung der Forderung gefährdet wird."
    },
    {
      "date": "2025-09-18",
      "id": "130266",
      "original_text": "Registerbekanntmachung nach dem Umwandlungsgesetz\nNiedersachsen Amtsgericht Osnabrück HRB 120578 früher Amtsgericht Meppen\nBerentzen Distillers International GmbH – Haselünne",
      "type": "Registerbekanntmachung nach dem Umwandlungsgesetz",
      "state": "Niedersachsen",
      "amtsgericht": "Amtsgericht Osnabrück",
      "registernummer": "HRB 120578",
      "registerart": "HRB",
      "company_name": "Berentzen Distillers International GmbH",
      "company_seat": "Haselünne",
      "former_amtsgericht": "Meppen",
      "details": "18.09.2025 (Bekanntmachungsdatum)\n\nNiedersachsen Amtsgericht Osnabrück HRB 120578 früher Amtsgericht Meppen\nRegisterbekanntmachung nach dem Umwandlungsgesetz 18.09.2025 (Eintragungsdatum)\n\nBerentzen Distillers International GmbH\nGesellschaft mit beschränkter Haftung\nHaselünne\n\nDen Gläubigern der an der Verschmelzung beteiligten Rechtsträger ist, wenn sie binnen sechs Monaten nach dem Tag, an dem die Eintragung der Verschmelzung in das Register des Sitzes desjenigen Rechtsträgers, dessen Gläubiger sie sind, nach § 19  Abs.  3 UmwG als bekannt gemacht gilt, ihren Anspruch nach Grund und Höhe schriftlich anmelden, Sicherheit zu leisten, soweit sie nicht Befriedigung verlangen können. Dieses Recht steht den Gläubigern jedoch nur zu, wenn sie glaubhaft machen, dass durch die Verschmelzung die Erfüllung der Forderung gefährdet wird."
    },
    {
      "date": "2025-09-18",
      "id": "130267",
      "original_text": "Registerbekanntmachung nach dem Umwandlungsgesetz\nNiedersachsen Amtsgericht Osnabrück HRB 120578 früher Amtsgericht Meppen\nBerentzen Distillers International GmbH – Haselünne",
      "type": "Registerbekanntmachung nach dem Umwandlungsgesetz",
      "state": "Niedersachsen",
      "amtsgericht": "Amtsgericht Osnabrück",
      "registernummer": "HRB 120578",
      "registerart": "HRB",
      "company_name": "Berentzen Distillers International GmbH",
      "company_seat": "Haselünne",
      "former_amtsgericht": "Meppen",
      "details": "18.09.2025 (Bekanntmachungsdatum)\n\nNiedersachsen Amtsgericht Osnabrück HRB 120578 früher Amtsgericht Meppen\nRegisterbekanntmachung nach dem Umwandlungsgesetz 18.09.2025 (Eintragungsdatum)\n\nBerentzen Distillers International GmbH\nGesellschaft mit beschränkter Haftung\nHaselünne\n\nDen Gläubigern der an der Verschmelzung beteiligten Rechtsträger ist, wenn sie binnen sechs Monaten nach dem Tag, an dem die Eintragung der Verschmelzung in das Register des Sitzes desjenigen Rechtsträgers, dessen Gläubiger sie sind, nach § 19  Abs.  3 UmwG als bekannt gemacht gilt, ihren Anspruch nach Grund und Höhe schriftlich anmelden, Sicherheit zu leisten, soweit sie nicht Befriedigung verlangen können. Dieses Recht steht den Gläubigern jedoch nur zu, wenn sie glaubhaft machen, dass durch die Verschmelzung die Erfüllung der Forderung gefährdet wird."
    },
    {
      "date": "2025-09-18",
      "id": "130268",
      "original_text": "Registerbekanntmachung nach dem Umwandlungsgesetz\nNiedersachsen Amtsgericht Osnabrück HRB 120578 früher Amtsgericht Meppen\nBerentzen Distillers International GmbH – Haselünne",
      "type": "Registerbekanntmachung nach dem Umwandlungsgesetz",
      "state": "Niedersachsen",
      "amtsgericht": "Amtsgericht Osnabrück",
      "registernummer": "HRB 120578",
      "registerart": "HRB",
      "company_name": "Berentzen Distillers International GmbH",
      "company_seat": "Haselünne",
      "former_amtsgericht": "Meppen",
      "details": "18.09.2025 (Bekanntmachungsdatum)\n\nNiedersachsen Amtsgericht Osnabrück HRB 120578 früher Amtsgericht Meppen\nRegisterbekanntmachung nach dem Umwandlungsgesetz 18.09.2025 (Eintragungsdatum)\n\nBerentzen Distillers International GmbH\nGesellschaft mit beschränkter Haftung\nHaselünne\n\nDen Gläubigern der an der Verschmelzung beteiligten Rechtsträger ist, wenn sie binnen sechs Monaten nach dem Tag, an dem die Eintragung der Verschmelzung in das Register des Sitzes desjenigen Rechtsträgers, dessen Gläubiger sie sind, nach § 19  Abs.  3 UmwG als bekannt gemacht gilt, ihren Anspruch nach Grund und Höhe schriftlich anmelden, Sicherheit zu leisten, soweit sie nicht Befriedigung verlangen können. Dieses Recht steht den Gläubigern jedoch nur zu, wenn sie glaubhaft machen, dass durch die Verschmelzung die Erfüllung der Forderung gefährdet wird."
    },
    {
      "date": "2025-09-18",
      "id": "130269",
      "original_text": "Registerbekanntmachung nach dem Umwandlungsgesetz\nNiedersachsen Amtsgericht Oldenburg (Oldenburg) HRB 151140 früher Amtsgericht Cloppenburg\nVION Property Emstek GmbH – Emstek",
      "type": "Registerbekanntmachung nach dem Umwandlungsgesetz",
      "state": "Niedersachsen",
      "amtsgericht": "Amtsgericht Oldenburg (Oldenburg)",
      "registernummer": "HRB 151140",
      "registerart": "HRB",
      "company_name": "VION Property Emstek GmbH",
      "company_seat": "Emstek",
      "former_amtsgericht": "Cloppenburg",
      "details": "18.09.2025 (Bekanntmachungsdatum)\n\nNiedersachsen Amtsgericht Oldenburg (Oldenburg) HRB 151140 früher Amtsgericht Cloppenburg\nRegisterbekanntmachung nach dem Umwandlungsgesetz 18.09.2025 (Eintragungsdatum)\n\nVION Property Emstek GmbH\nGesellschaft mit beschränkter Haftung\nEmstek\n\nDen Gläubigern der an der Verschmelzung beteiligten Rechtsträger ist, wenn sie binnen sechs Monaten nach dem Tag, an dem die Eintragung der Verschmelzung in das Register des Sitzes desjenigen Rechtsträgers, dessen Gläubiger sie sind, nach § 19  Abs.  3 UmwG als bekannt gemacht gilt, ihren Anspruch nach Grund und Höhe schriftlich anmelden, Sicherheit zu leisten, soweit sie nicht Befriedigung verlangen können. Dieses Recht steht den Gläubigern jedoch nur zu, wenn sie glaubhaft machen, dass durch die Verschmelzung die Erfüllung der Forderung gefährdet wird."
    },
    {
      "date": "2025-09-18",
      "id": "130270",
      "original_text": "Löschungsankündigung\nNiedersachsen Amtsgericht Oldenburg (Oldenburg) HRA 203640\nFerdinand-Oldenburg GmbH & Co. KG – Oldenburg",
      "type": "Löschungsankündigung",
      "state": "Niedersachsen",
      "amtsgericht": "Amtsgericht Oldenburg (Oldenburg)",
      "registernummer": "HRA 203640",
      "registerart": "HRA",
      "company_name": "Ferdinand-Oldenburg GmbH & Co. KG",
      "company_seat": "Oldenburg",
      "details": "18.09.2025 (Bekanntmachungsdatum)\n\nNiedersachsen Amtsgericht Oldenburg (Oldenburg) HRA 203640\nLöschungsankündigung\n\nFerdinand-Oldenburg GmbH & Co. KG\nKommanditgesellschaft\nOldenburg\n\nDas Registergericht beabsichtigt, die Firma von Amts wegen nach § 31 Abs. 2 Satz 2 HGB, § 393 FamFG zu löschen. Die Frist zur Erhebung eines Widerspruchs ist auf 1 Monat ab dieser Registerbekanntmachung festgesetzt."
    },
    {
      "date": "2025-09-18",
      "id": "130271",
      "original_text": "Einreichung neuer Dokumente\nNiedersachsen Amtsgericht Hannover HRB 54404\nBildungswerk der Niedersächsischen Wirtschaft gemeinnützige GmbH – Hannover",
      "type": "Einreichung neuer Dokumente",
      "state": "Niedersachsen",
      "amtsgericht": "Amtsgericht Hannover",
      "registernummer": "HRB 54404",
      "registerart": "HRB",
      "company_name": "Bildungswerk der Niedersächsischen Wirtschaft gemeinnützige GmbH",
      "company_seat": "Hannover",
      "details": "18.09.2025 (Bekanntmachungsdatum)\n\nNiedersachsen Amtsgericht Hannover HRB 54404\nEinreichung neuer Dokumente 18.09.2025 (Eintragungsdatum)\n\nBildungswerk der Niedersächsischen Wirtschaft gemeinnützige GmbH\nGesellschaft mit beschränkter Haftung\nHannover\n\nDie Liste der Mitglieder des Aufsichtsrats wurde beim Registergericht eingereicht."
    },
    {
      "date": "2025-09-18",
      "id": "130272",
      "original_text": "Löschungsankündigung\nNiedersachsen Amtsgericht Göttingen HRB 206338\nIMMO-37 GmbH – Göttingen",
      "type": "Löschungsankündigung",
      "state": "Niedersachsen",
      "amtsgericht": "Amtsgericht Göttingen",
      "registernummer": "HRB 206338",
      "registerart": "HRB",
      "company_name": "IMMO-37 GmbH",
      "company_seat": "Göttingen",
      "details": "18.09.2025 (Bekanntmachungsdatum)\n\nNiedersachsen Amtsgericht Göttingen HRB 206338\nLöschungsankündigung\n\nIMMO-37 GmbH\nGesellschaft mit beschränkter Haftung\nGöttingen\n\nEs ist beabsichtigt die Gesellschaft von Amts wegen wegen Vermögenslosigkeit zu löschen. Es wird Gelegenheit gegeben zur Erhebung eines Widerspruchs binnen 1 Monats."
    },
    {
      "date": "2025-09-18",
      "id": "130273",
      "original_text": "Registerbekanntmachung nach dem Umwandlungsgesetz\nNiedersachsen Amtsgericht Stadthagen HRB 200288\nOptic Center Schaumburg GmbH – Obernkirchen",
      "type": "Registerbekanntmachung nach dem Umwandlungsgesetz",
      "state": "Niedersachsen",
      "amtsgericht": "Amtsgericht Stadthagen",
      "registernummer": "HRB 200288",
      "registerart": "HRB",
      "company_name": "Optic Center Schaumburg GmbH",
      "company_seat": "Obernkirchen",
      "details": "18.09.2025 (Bekanntmachungsdatum)\n\nNiedersachsen Amtsgericht Stadthagen HRB 200288\nRegisterbekanntmachung nach dem Umwandlungsgesetz 04.09.2025 (Eintragungsdatum)\n\nOptic Center Schaumburg GmbH\nGesellschaft mit beschränkter Haftung\nObernkirchen\n\nDen Gläubigern der an der Verschmelzung beteiligten Rechtsträger ist, wenn sie binnen sechs Monaten nach dem Tag, an dem die Eintragung der Verschmelzung in das Register des Sitzes desjenigen Rechtsträgers, dessen Gläubiger sie sind, nach § 19  Abs.  3 UmwG als bekannt gemacht gilt, ihren Anspruch nach Grund und Höhe schriftlich anmelden, Sicherheit zu leisten, soweit sie nicht Befriedigung verlangen können. Dieses Recht steht den Gläubigern jedoch nur zu, wenn sie glaubhaft machen, dass durch die Verschmelzung die Erfüllung der Forderung gefährdet wird."
    },
    {
      "date": "2025-09-18",
      "id": "130274",
      "original_text": "Löschungsankündigung\nNiedersachsen Amtsgericht Stadthagen HRB 201256\nIBMS Masters Society UG (haftungsbeschränkt) – Heeßen",
      "type": "Löschungsankündigung",
      "state": "Niedersachsen",
      "amtsgericht": "Amtsgericht Stadthagen",
      "registernummer": "HRB 201256",
      "registerart": "HRB",
      "company_name": "IBMS Masters Society UG (haftungsbeschränkt)",
      "company_seat": "Heeßen",
      "details": "18.09.2025 (Bekanntmachungsdatum)\n\nNiedersachsen Amtsgericht Stadthagen HRB 201256\nLöschungsankündigung\n\nIBMS Masters Society UG (haftungsbeschränkt)\nGesellschaft mit beschränkter Haftung\nHeeßen\n\nDas Registergericht beabsichtigt, die Gesellschaft von Amts wegen nach § 394 FamFG zu löschen. Die Frist zur Erhebung eines Widerspruchs ist auf 1 Monat ab dieser Registerbekanntmachung festgesetzt."
    },
    {
      "date": "2025-09-18",
      "id": "130275",
      "original_text": "Registerbekanntmachung nach dem Umwandlungsgesetz\nNiedersachsen Amtsgericht Tostedt HRB 211742\nAP Performance GmbH – Geestland",
      "type": "Registerbekanntmachung nach dem Umwandlungsgesetz",
      "state": "Niedersachsen",
      "amtsgericht": "Amtsgericht Tostedt",
      "registernummer": "HRB 211742",
      "registerart": "HRB",
      "company_name": "AP Performance GmbH",
      "company_seat": "Geestland",
      "details": "18.09.2025 (Bekanntmachungsdatum)\n\nNiedersachsen Amtsgericht Tostedt HRB 211742\nRegisterbekanntmachung nach dem Umwandlungsgesetz 18.09.2025 (Eintragungsdatum)\n\nAP Performance GmbH\nGesellschaft mit beschränkter Haftung\nGeestland\n\nDen Gläubigern der an der Ausgliederung beteiligten Rechtsträger ist, wenn sie binnen sechs Monaten nach dem Tag, an dem die Eintragung der Ausgliederung in das Register des Sitzes desjenigen Rechtsträgers, dessen Gläubiger sie sind, nach § 19 Abs. 3 UmwG als bekannt gemacht gilt, ihren Anspruch nach Grund und Höhe schriftlich anmelden, Sicherheit zu leisten, soweit sie nicht Befriedigung verlangen können. Dieses Recht steht den Gläubigern jedoch nur zu, wenn sie glaubhaft machen, dass durch die Ausgliederung die Erfüllung der Forderung gefährdet wird."
    },
    {
      "date": "2025-09-18",
      "id": "130276",
      "original_text": "Registerbekanntmachung nach dem Umwandlungsgesetz\nNiedersachsen Amtsgericht Oldenburg (Oldenburg) HRB 213450\nHansalinie-A1-Vermögensverwaltungs- und Beteiligungs-GmbH – Großenkneten",
      "type": "Registerbekanntmachung nach dem Umwandlungsgesetz",
      "state": "Niedersachsen",
      "amtsgericht": "Amtsgericht Oldenburg (Oldenburg)",
      "registernummer": "HRB 213450",
      "registerart": "HRB",
      "company_name": "Hansalinie-A1-Vermögensverwaltungs- und Beteiligungs-GmbH",
      "company_seat": "Großenkneten",
      "details": "18.09.2025 (Bekanntmachungsdatum)\n\nNiedersachsen Amtsgericht Oldenburg (Oldenburg) HRB 213450\nRegisterbekanntmachung nach dem Umwandlungsgesetz 18.09.2025 (Eintragungsdatum)\n\nHansalinie-A1-Vermögensverwaltungs- und Beteiligungs-GmbH\nGesellschaft mit beschränkter Haftung\nGroßenkneten\n\nDen Gläubigern der an der Verschmelzung beteiligten Rechtsträger ist, wenn sie binnen sechs Monaten nach dem Tag, an dem die Eintragung der Verschmelzung in das Register des Sitzes desjenigen Rechtsträgers, dessen Gläubiger sie sind, nach § 19  Abs.  3 UmwG als bekannt gemacht gilt, ihren Anspruch nach Grund und Höhe schriftlich anmelden, Sicherheit zu leisten, soweit sie nicht Befriedigung verlangen können. Dieses Recht steht den Gläubigern jedoch nur zu, wenn sie glaubhaft machen, dass durch die Verschmelzung die Erfüllung der Forderung gefährdet wird."
    },
    {
      "date": "2025-09-18",
      "id": "130277",
      "original_text": "Löschungsankündigung\nNiedersachsen Amtsgericht Stadthagen HRB 202322\nM. Ference UG (haftungsbeschränkt) – Niedernwöhren",
      "type": "Löschungsankündigung",
      "state": "Niedersachsen",
      "amtsgericht": "Amtsgericht Stadthagen",
      "registernummer": "HRB 202322",
      "registerart": "HRB",
      "company_name": "M. Ference UG (haftungsbeschränkt)",
      "company_seat": "Niedernwöhren",
      "details": "18.09.2025 (Bekanntmachungsdatum)\n\nNiedersachsen Amtsgericht Stadthagen HRB 202322\nLöschungsankündigung\n\nM. Ference UG (haftungsbeschränkt)\nGesellschaft mit beschränkter Haftung\nNiedernwöhren\n\nDas Registergericht beabsichtigt, die Gesellschaft von Amts wegen nach § 394 FamFG zu löschen. Die Frist zur Erhebung eines Widerspruchs ist auf 1 Monat ab dieser Registerbekanntmachung festgesetzt."
    },
    {
      "date": "2025-09-18",
      "id": "130278",
      "original_text": "Registerbekanntmachung nach dem Umwandlungsgesetz\nNiedersachsen Amtsgericht Stadthagen HRB 2712\nFinanz-Zirkel GmbH – Bückeburg",
      "type": "Registerbekanntmachung nach dem Umwandlungsgesetz",
      "state": "Niedersachsen",
      "amtsgericht": "Amtsgericht Stadthagen",
      "registernummer": "HRB 2712",
      "registerart": "HRB",
      "company_name": "Finanz-Zirkel GmbH",
      "company_seat": "Bückeburg",
      "details": "18.09.2025 (Bekanntmachungsdatum)\n\nNiedersachsen Amtsgericht Stadthagen HRB 2712\nRegisterbekanntmachung nach dem Umwandlungsgesetz 05.09.2025 (Eintragungsdatum)\n\nFinanz-Zirkel GmbH\nGesellschaft mit beschränkter Haftung\nBückeburg\n\nDen Gläubigern der an der Verschmelzung beteiligten Rechtsträger ist, wenn sie binnen sechs Monaten nach dem Tag, an dem die Eintragung der Verschmelzung in das Register des Sitzes desjenigen Rechtsträgers, dessen Gläubiger sie sind, nach § 19  Abs.  3 UmwG als bekannt gemacht gilt, ihren Anspruch nach Grund und Höhe schriftlich anmelden, Sicherheit zu leisten, soweit sie nicht Befriedigung verlangen können. Dieses Recht steht den Gläubigern jedoch nur zu, wenn sie glaubhaft machen, dass durch die Verschmelzung die Erfüllung der Forderung gefährdet wird."
    },
    {
      "date": "2025-09-18",
      "id": "130279",
      "original_text": "Registerbekanntmachung nach dem Umwandlungsgesetz\nNiedersachsen Amtsgericht Oldenburg (Oldenburg) HRB 213453\nMPH Vermögensverwaltungs- und Beteiligungs-GmbH – Großenkneten",
      "type": "Registerbekanntmachung nach dem Umwandlungsgesetz",
      "state": "Niedersachsen",
      "amtsgericht": "Amtsgericht Oldenburg (Oldenburg)",
      "registernummer": "HRB 213453",
      "registerart": "HRB",
      "company_name": "MPH Vermögensverwaltungs- und Beteiligungs-GmbH",
      "company_seat": "Großenkneten",
      "details": "18.09.2025 (Bekanntmachungsdatum)\n\nNiedersachsen Amtsgericht Oldenburg (Oldenburg) HRB 213453\nRegisterbekanntmachung nach dem Umwandlungsgesetz 18.09.2025 (Eintragungsdatum)\n\nMPH Vermögensverwaltungs- und Beteiligungs-GmbH\nGesellschaft mit beschränkter Haftung\nGroßenkneten\n\nDen Gläubigern der an der Verschmelzung beteiligten Rechtsträger ist, wenn sie binnen sechs Monaten nach dem Tag, an dem die Eintragung der Verschmelzung in das Register des Sitzes desjenigen Rechtsträgers, dessen Gläubiger sie sind, nach § 19  Abs.  3 UmwG als bekannt gemacht gilt, ihren Anspruch nach Grund und Höhe schriftlich anmelden, Sicherheit zu leisten, soweit sie nicht Befriedigung verlangen können. Dieses Recht steht den Gläubigern jedoch nur zu, wenn sie glaubhaft machen, dass durch die Verschmelzung die Erfüllung der Forderung gefährdet wird."
    },
    {
      "date": "2025-09-18",
      "id": "130280",
      "original_text": "Registerbekanntmachung nach dem Umwandlungsgesetz\nNiedersachsen Amtsgericht Stadthagen HRB 202181\nASSEKURANZMAKLER Wacker & Link GmbH – Bückeburg",
      "type": "Registerbekanntmachung nach dem Umwandlungsgesetz",
      "state": "Niedersachsen",
      "amtsgericht": "Amtsgericht Stadthagen",
      "registernummer": "HRB 202181",
      "registerart": "HRB",
      "company_name": "ASSEKURANZMAKLER Wacker & Link GmbH",
      "company_seat": "Bückeburg",
      "details": "18.09.2025 (Bekanntmachungsdatum)\n\nNiedersachsen Amtsgericht Stadthagen HRB 202181\nRegisterbekanntmachung nach dem Umwandlungsgesetz 04.09.2025 (Eintragungsdatum)\n\nASSEKURANZMAKLER Wacker & Link GmbH\nGesellschaft mit beschränkter Haftung\nBückeburg\n\nDen Gläubigern der an der Verschmelzung beteiligten Rechtsträger ist, wenn sie binnen sechs Monaten nach dem Tag, an dem die Eintragung der Verschmelzung in das Register des Sitzes desjenigen Rechtsträgers, dessen Gläubiger sie sind, nach § 19  Abs.  3 UmwG als bekannt gemacht gilt, ihren Anspruch nach Grund und Höhe schriftlich anmelden, Sicherheit zu leisten, soweit sie nicht Befriedigung verlangen können. Dieses Recht steht den Gläubigern jedoch nur zu, wenn sie glaubhaft machen, dass durch die Verschmelzung die Erfüllung der Forderung gefährdet wird."
    },
    {
      "date": "2025-09-18",
      "id": "130281",
      "original_text": "Registerbekanntmachung nach dem Umwandlungsgesetz\nNiedersachsen Amtsgericht Tostedt HRB 209225\nblackhead UG (haftungsbeschränkt) – Buchholz",
      "type": "Registerbekanntmachung nach dem Umwandlungsgesetz",
      "state": "Niedersachsen",
      "amtsgericht": "Amtsgericht Tostedt",
      "registernummer": "HRB 209225",
      "registerart": "HRB",
      "company_name": "blackhead UG (haftungsbeschränkt)",
      "company_seat": "Buchholz",
      "details": "18.09.2025 (Bekanntmachungsdatum)\n\nNiedersachsen Amtsgericht Tostedt HRB 209225\nRegisterbekanntmachung nach dem Umwandlungsgesetz 18.09.2025 (Eintragungsdatum)\n\nblackhead UG (haftungsbeschränkt)\nGesellschaft mit beschränkter Haftung\nBuchholz\n\nDen Gläubigern der an der Verschmelzung beteiligten Rechtsträger ist, wenn sie binnen sechs Monaten nach dem Tag, an dem die Eintragung der Verschmelzung in das Register des Sitzes desjenigen Rechtsträgers, dessen Gläubiger sie sind, nach § 19  Abs.  3 UmwG als bekannt gemacht gilt, ihren Anspruch nach Grund und Höhe schriftlich anmelden, Sicherheit zu leisten, soweit sie nicht Befriedigung verlangen können. Dieses Recht steht den Gläubigern jedoch nur zu, wenn sie glaubhaft machen, dass durch die Verschmelzung die Erfüllung der Forderung gefährdet wird."
    },
    {
      "date": "2025-09-18",
      "id": "130282",
      "original_text": "Registerbekanntmachung nach dem Umwandlungsgesetz\nNiedersachsen Amtsgericht Tostedt HRB 211728\nO.D.S. Consulting GmbH – Heeslingen",
      "type": "Registerbekanntmachung nach dem Umwandlungsgesetz",
      "state": "Niedersachsen",
      "amtsgericht": "Amtsgericht Tostedt",
      "registernummer": "HRB 211728",
      "registerart": "HRB",
      "company_name": "O.D.S. Consulting GmbH",
      "company_seat": "Heeslingen",
      "details": "18.09.2025 (Bekanntmachungsdatum)\n\nNiedersachsen Amtsgericht Tostedt HRB 211728\nRegisterbekanntmachung nach dem Umwandlungsgesetz 18.09.2025 (Eintragungsdatum)\n\nO.D.S. Consulting GmbH\nGesellschaft mit beschränkter Haftung\nHeeslingen\n\nDen Gläubigern der an der Ausgliederung beteiligten Rechtsträger ist, wenn sie binnen sechs Monaten nach dem Tag, an dem die Eintragung der Ausgliederung in das Register des Sitzes desjenigen Rechtsträgers, dessen Gläubiger sie sind, nach § 19 Abs. 3 UmwG als bekannt gemacht gilt, ihren Anspruch nach Grund und Höhe schriftlich anmelden, Sicherheit zu leisten, soweit sie nicht Befriedigung verlangen können. Dieses Recht steht den Gläubigern jedoch nur zu, wenn sie glaubhaft machen, dass durch die Ausgliederung die Erfüllung der Forderung gefährdet wird."
    },
    {
      "date": "2025-09-18",
      "id": "130283",
      "original_text": "Registerbekanntmachung nach dem Umwandlungsgesetz\nSchleswig-Holstein Amtsgericht Lübeck HRB 802 SB\nKlaus Michaelis GmbH – Wentorf bei Hamburg",
      "type": "Registerbekanntmachung nach dem Umwandlungsgesetz",
      "state": "Schleswig-Holstein",
      "amtsgericht": "Amtsgericht Lübeck",
      "registernummer": "HRB 802 SB",
      "registerart": "HRB",
      "company_name": "Klaus Michaelis GmbH",
      "company_seat": "Wentorf bei Hamburg",
      "details": "18.09.2025 (Bekanntmachungsdatum)\n\nSchleswig-Holstein Amtsgericht Lübeck HRB 802 SB\nRegisterbekanntmachung nach dem Umwandlungsgesetz 17.09.2025 (Eintragungsdatum)\n\nKlaus Michaelis GmbH\nGesellschaft mit beschränkter Haftung\nWentorf bei Hamburg\n\nZu Eintragungsnummer 4 vom 17.09.2025 wird als nicht eingetragen veröffentlicht: Den Gläubigern der an der Verschmelzung beteiligten Rechtsträger ist, wenn sie binnen sechs Monaten nach dem Tag, an dem die Eintragung der Verschmelzung in das Register des Sitzes desjenigen Rechtsträgers, dessen Gläubiger sie sind, als bekannt gemacht gilt, ihren Anspruch nach Grund und Höhe schriftlich anmelden, Sicherheit zu leisten, soweit sie nicht Befriedigung verlangen können. Dieses Recht steht den Gläubigern jedoch nur zu, wenn sie glaubhaft machen, dass durch die Verschmelzung die Erfüllung ihrer Forderung gefährdet wird."
    },
    {
      "date": "2025-09-18",
      "id": "130284",
      "original_text": "Registerbekanntmachung nach dem Umwandlungsgesetz\nRheinland-Pfalz Amtsgericht Landau HRA 31123\nGaststätte Bächeleck e.K. – St. Martin",
      "type": "Registerbekanntmachung nach dem Umwandlungsgesetz",
      "state": "Rheinland-Pfalz",
      "amtsgericht": "Amtsgericht Landau",
      "registernummer": "HRA 31123",
      "registerart": "HRA",
      "company_name": "Gaststätte Bächeleck e.K.",
      "company_seat": "St. Martin",
      "details": "18.09.2025 (Bekanntmachungsdatum)\n\nRheinland-Pfalz Amtsgericht Landau HRA 31123\nRegisterbekanntmachung nach dem Umwandlungsgesetz 18.09.2025 (Eintragungsdatum)\n\nGaststätte Bächeleck e.K.\nEinzelkaufmann / Einzelkauffrau\nSt. Martin\n\nAls nicht eingetragen wird veröffentlicht: Den Gläubigern der an der Ausgliederung beteiligten Rechtsträger ist, wenn sie binnen sechs Monaten nac hdem Tag, an dem die Eintragung der Ausgliederung in das Register des Sitzes desjenigen Rechtsträgers, dessen Gläubiger sie sind, nach § 19 Abs. 3 UmwG als bekannt gemacht gilt, ihren Anspruch nach Grund und Höhe schriftlich anmelden, Sicherheit zu leisten, soweit sie nicht Befriedigung verlangen können. Dieses Recht steht den Gläubigern jedoch nur zu, wenn sie glaubhaft machen, dass durch die Ausgliederung die Erfüllung der Forderung gefährdet wird."
    },
    {
      "date": "2025-09-18",
      "id": "130285",
      "original_text": "Registerbekanntmachung nach dem Umwandlungsgesetz\nRheinland-Pfalz Amtsgericht Landau HRB 1363\nHaag GmbH – Landau in der Pfalz",
      "type": "Registerbekanntmachung nach dem Umwandlungsgesetz",
      "state": "Rheinland-Pfalz",
      "amtsgericht": "Amtsgericht Landau",
      "registernummer": "HRB 1363",
      "registerart": "HRB",
      "company_name": "Haag GmbH",
      "company_seat": "Landau in der Pfalz",
      "details": "18.09.2025 (Bekanntmachungsdatum)\n\nRheinland-Pfalz Amtsgericht Landau HRB 1363\nRegisterbekanntmachung nach dem Umwandlungsgesetz 18.09.2025 (Eintragungsdatum)\n\nHaag GmbH\nGesellschaft mit beschränkter Haftung\nLandau in der Pfalz\n\nAls nicht eingetragen wird veröffentlicht: Den Gläubigern der an der Verschmelzung beteiligten Rechtsträger ist, wenn sie binnen sechs Monaten nach dem Tag, an dem die Eintragung der Verschmelzung in das Register des Sitzes desjenigen Rechtsträgers, dessen Gläubiger sie sind, nach § 19 Abs. 3 UmwG als bekannt gemacht gilt, ihren Anspruch nach Grund und Höhe schriftlich anmelden, Sicherheit zu leisten, soweit sie nicht Befriedigung verlangen können. Dieses Recht steht den Gläubigern jedoch nur zu, wenn sie glaubhaft machen, dass durch die Verschmelzung die Erfüllung der Forderung gefährdet wird."
    },
    {
      "date": "2025-09-18",
      "id": "130286",
      "original_text": "Sonstige Registerbekanntmachung\nRheinland-Pfalz Amtsgericht Landau HRB 31225\nZIELBAU GmbH – Germersheim",
      "type": "Sonstige Registerbekanntmachung",
      "state": "Rheinland-Pfalz",
      "amtsgericht": "Amtsgericht Landau",
      "registernummer": "HRB 31225",
      "registerart": "HRB",
      "company_name": "ZIELBAU GmbH",
      "company_seat": "Germersheim",
      "details": "18.09.2025 (Bekanntmachungsdatum)\n\nRheinland-Pfalz Amtsgericht Landau HRB 31225\nSonstige Registerbekanntmachung\n\nZIELBAU GmbH\nGesellschaft mit beschränkter Haftung\nGermersheim\n\nDas Gericht beabsichtigt, im Handelsregister gemäß § 395 FamFG von Amts wegen einzutragen, dass Rexhep Krasniqi nicht mehr Geschäftsführer ist.\nDie Frist zur Erhebung eines Widerspruchs ist auf einen Monat festgesetzt."
    },
    {
      "date": "2025-09-18",
      "id": "130287",
      "original_text": "Registerbekanntmachung nach dem Umwandlungsgesetz\nRheinland-Pfalz Amtsgericht Wittlich HRB 31409\nG. Hoffmann Badlift-GmbH – Watzerath",
      "type": "Registerbekanntmachung nach dem Umwandlungsgesetz",
      "state": "Rheinland-Pfalz",
      "amtsgericht": "Amtsgericht Wittlich",
      "registernummer": "HRB 31409",
      "registerart": "HRB",
      "company_name": "G. Hoffmann Badlift-GmbH",
      "company_seat": "Watzerath",
      "details": "18.09.2025 (Bekanntmachungsdatum)\n\nRheinland-Pfalz Amtsgericht Wittlich HRB 31409\nRegisterbekanntmachung nach dem Umwandlungsgesetz 18.09.2025 (Eintragungsdatum)\n\nG. Hoffmann Badlift-GmbH\nGesellschaft mit beschränkter Haftung\nWatzerath\n\nAls nicht eingetragen wird veröffentlicht: Den Gläubigern der an der Verschmelzung beteiligten Rechtsträger ist, wenn sie binnen sechs Monaten nach dem Tag, an dem die Eintragung der Verschmelzung in das Register des Sitzes desjenigen Rechtsträgers,dessen Gläubiger sie sind, nach § 19 Abs. 3 UmwG als bekannt gemacht gilt, ihren Anspruch nach Grund und Höhe schriftlich anmelden, Sicherheit zu leisten, soweit sie nicht Befriedigung verlangen können. Dieses Recht steht den Gläubigern jedoch nur zu, wenn sie glaubhaft machen, dass durch die Verschmelzung die Erfüllung der Forderung gefährdet wird."
    },
    {
      "date": "2025-09-18",
      "id": "130288",
      "original_text": "Registerbekanntmachung nach dem Umwandlungsgesetz\nRheinland-Pfalz Amtsgericht Landau HRB 34093\nBächeleck GmbH – St. Martin",
      "type": "Registerbekanntmachung nach dem Umwandlungsgesetz",
      "state": "Rheinland-Pfalz",
      "amtsgericht": "Amtsgericht Landau",
      "registernummer": "HRB 34093",
      "registerart": "HRB",
      "company_name": "Bächeleck GmbH",
      "company_seat": "St. Martin",
      "details": "18.09.2025 (Bekanntmachungsdatum)\n\nRheinland-Pfalz Amtsgericht Landau HRB 34093\nRegisterbekanntmachung nach dem Umwandlungsgesetz 18.09.2025 (Eintragungsdatum)\n\nBächeleck GmbH\nGesellschaft mit beschränkter Haftung\nSt. Martin\n\nAls nicht eingetragen wird veröffentlicht: Den Gläubigern der an der Ausgliederung beteiligten Rechtsträger ist, wenn sie binnen sechs Monaten nac hdem Tag, an dem die Eintragung der Ausgliederung in das Register des Sitzes desjenigen Rechtsträgers, dessen Gläubiger sie sind, nach § 19 Abs. 3 UmwG als bekannt gemacht gilt, ihren Anspruch nach Grund und Höhe schriftlich anmelden, Sicherheit zu leisten, soweit sie nicht Befriedigung verlangen können. Dieses Recht steht den Gläubigern jedoch nur zu, wenn sie glaubhaft machen, dass durch die Ausgliederung die Erfüllung der Forderung gefährdet wird."
    },
    {
      "date": "2025-09-18",
      "id": "130289",
      "original_text": "Sonstige Registerbekanntmachung\nRheinland-Pfalz Amtsgericht Landau HRB 31670\nHB Wohnbau GmbH – Germersheim",
      "type": "Sonstige Registerbekanntmachung",
      "state": "Rheinland-Pfalz",
      "amtsgericht": "Amtsgericht Landau",
      "registernummer": "HRB 31670",
      "registerart": "HRB",
      "company_name": "HB Wohnbau GmbH",
      "company_seat": "Germersheim",
      "details": "18.09.2025 (Bekanntmachungsdatum)\n\nRheinland-Pfalz Amtsgericht Landau HRB 31670\nSonstige Registerbekanntmachung\n\nHB Wohnbau GmbH\nGesellschaft mit beschränkter Haftung\nGermersheim\n\nDas Registergericht beabsichtigt den Geschäftsführer von Amts wegen nach § 395 FamFG zu löschen. Die Frist zur Erhebung eines Widerspruchs ist auf einen Monat festgesetzt."
    },
    {
      "date": "2025-09-18",
      "id": "130290",
      "original_text": "Registerbekanntmachung nach dem Umwandlungsgesetz\nBremen Amtsgericht Bremen HRA 17356\nNanu - Nana Joachim Hoepp GmbH & Co.KG – Bremen",
      "type": "Registerbekanntmachung nach dem Umwandlungsgesetz",
      "state": "Bremen",
      "amtsgericht": "Amtsgericht Bremen",
      "registernummer": "HRA 17356",
      "registerart": "HRA",
      "company_name": "Nanu - Nana Joachim Hoepp GmbH & Co.KG",
      "company_seat": "Bremen",
      "details": "18.09.2025 (Bekanntmachungsdatum)\n\nBremen Amtsgericht Bremen HRA 17356\nRegisterbekanntmachung nach dem Umwandlungsgesetz 17.09.2025 (Eintragungsdatum)\n\nNanu - Nana Joachim Hoepp GmbH & Co.KG\nKommanditgesellschaft\nBremen\n\nZu Eintragungsnummer 15 vom 17.09.2025 wird als nicht eingetragen veröffentlicht: Den Gläubigern der an der Verschmelzung beteiligten Rechtsträger ist, wenn sie binnen sechs Monaten nach dem Tag, an dem die Eintragung der Verschmelzung in das Register des Sitzes desjenigen Rechtsträgers, dessen Gläubiger sie sind, als bekannt gemacht gilt, ihren Anspruch nach Grund und Höhe schriftlich anmelden, Sicherheit zu leisten, soweit sie nicht Befriedigung verlangen können. Dieses Recht steht den Gläubigern jedoch nur zu, wenn sie glaubhaft machen, dass durch die Verschmelzung die Erfüllung ihrer Forderung gefährdet wird. Das Recht, Sicherheitsleistung zu verlangen, steht Gläubigern nicht zu, die im Falle der Insolvenz ein Recht auf vorzugsweise Befriedigung aus einer Deckungsmasse haben, die nach gesetzlicher Vorschrift zu ihrem Schutz errichtet und staatlich überwacht ist."
    },
    {
      "date": "2025-09-18",
      "id": "130291",
      "original_text": "Registerbekanntmachung nach dem Umwandlungsgesetz\nBremen Amtsgericht Bremen HRB 40685\nAF Erwerbs GmbH – Bremen",
      "type": "Registerbekanntmachung nach dem Umwandlungsgesetz",
      "state": "Bremen",
      "amtsgericht": "Amtsgericht Bremen",
      "registernummer": "HRB 40685",
      "registerart": "HRB",
      "company_name": "AF Erwerbs GmbH",
      "company_seat": "Bremen",
      "details": "18.09.2025 (Bekanntmachungsdatum)\n\nBremen Amtsgericht Bremen HRB 40685\nRegisterbekanntmachung nach dem Umwandlungsgesetz 17.09.2025 (Eintragungsdatum)\n\nAF Erwerbs GmbH\nGesellschaft mit beschränkter Haftung\nBremen\n\nZu Eintragungsnummer 4 vom 17.09.2025 wird als nicht eingetragen veröffentlicht: Den Gläubigern der an der Verschmelzung beteiligten Rechtsträger ist, wenn sie binnen sechs Monaten nach dem Tag, an dem die Eintragung der Verschmelzung in das Register des Sitzes desjenigen Rechtsträgers, dessen Gläubiger sie sind, als bekannt gemacht gilt, ihren Anspruch nach Grund und Höhe schriftlich anmelden, Sicherheit zu leisten, soweit sie nicht Befriedigung verlangen können. Dieses Recht steht den Gläubigern jedoch nur zu, wenn sie glaubhaft machen, dass durch die Verschmelzung die Erfüllung ihrer Forderung gefährdet wird. Das Recht, Sicherheitsleistung zu verlangen, steht Gläubigern nicht zu, die im Falle der Insolvenz ein Recht auf vorzugsweise Befriedigung aus einer Deckungsmasse haben, die nach gesetzlicher Vorschrift zu ihrem Schutz errichtet und staatlich überwacht ist."
    },
    {
      "date": "2025-09-18",
      "id": "130292",
      "original_text": "Registerbekanntmachung nach dem Umwandlungsgesetz\nNordrhein-Westfalen Amtsgericht Bielefeld HRB 40392\nDiamant Immobilien Beteiligungs GmbH – Bielefeld",
      "type": "Registerbekanntmachung nach dem Umwandlungsgesetz",
      "state": "Nordrhein-Westfalen",
      "amtsgericht": "Amtsgericht Bielefeld",
      "registernummer": "HRB 40392",
      "registerart": "HRB",
      "company_name": "Diamant Immobilien Beteiligungs GmbH",
      "company_seat": "Bielefeld",
      "details": "18.09.2025 (Bekanntmachungsdatum)\n\nNordrhein-Westfalen Amtsgericht Bielefeld HRB 40392\nRegisterbekanntmachung nach dem Umwandlungsgesetz 18.09.2025 (Eintragungsdatum)\n\nDiamant Immobilien Beteiligungs GmbH\nGesellschaft mit beschränkter Haftung\nBielefeld\n\nDen Gläubigern der an der Verschmelzung beteiligten Rechtsträger ist, wenn sie binnen sechs Monaten nach dem Tag, an dem die Eintragung der Verschmelzung in das Register des Sitzes desjenigen Rechtsträgers, dessen Gläubiger sie sind, nach § 19 Absatz 3 UmwG als bekanntgemacht gilt, ihren Anspruch nach Grund und Höhe schriftlich anmelden, Sicherheit zu leisten, soweit sie nicht Befriedigung verlangen können. Dieses Recht steht den Gläubigern jedoch nur zu, wenn sie glaubhaft machen, dass durch die Verschmelzung die Erfüllung ihrer Forderung gefährdet wird."
    },
    {
      "date": "2025-09-18",
      "id": "130293",
      "original_text": "Einreichung neuer Dokumente\nNordrhein-Westfalen Amtsgericht Paderborn HRB 17763\ndSPACE Management SE – Paderborn",
      "type": "Einreichung neuer Dokumente",
      "state": "Nordrhein-Westfalen",
      "amtsgericht": "Amtsgericht Paderborn",
      "registernummer": "HRB 17763",
      "registerart": "HRB",
      "company_name": "dSPACE Management SE",
      "company_seat": "Paderborn",
      "details": "18.09.2025 (Bekanntmachungsdatum)\n\nNordrhein-Westfalen Amtsgericht Paderborn HRB 17763\nEinreichung neuer Dokumente 18.09.2025 (Eintragungsdatum)\n\ndSPACE Management SE\nEuropäische Aktiengesellschaft (SE)\nPaderborn\n\nDem Registergericht ist eine neue Liste der Mitglieder des Verwaltungsrates eingereicht worden."
    },
    {
      "date": "2025-09-18",
      "id": "130294",
      "original_text": "Registerbekanntmachung nach dem Umwandlungsgesetz\nNordrhein-Westfalen Amtsgericht Düsseldorf HRB 93903\nObjekta DUS IX GmbH – Düsseldorf",
      "type": "Registerbekanntmachung nach dem Umwandlungsgesetz",
      "state": "Nordrhein-Westfalen",
      "amtsgericht": "Amtsgericht Düsseldorf",
      "registernummer": "HRB 93903",
      "registerart": "HRB",
      "company_name": "Objekta DUS IX GmbH",
      "company_seat": "Düsseldorf",
      "details": "18.09.2025 (Bekanntmachungsdatum)\n\nNordrhein-Westfalen Amtsgericht Düsseldorf HRB 93903\nRegisterbekanntmachung nach dem Umwandlungsgesetz 18.09.2025 (Eintragungsdatum)\n\nObjekta DUS IX GmbH\nGesellschaft mit beschränkter Haftung\nDüsseldorf\n\nDen Gläubigern der an der formwechselnden Umwandlung beteiligten Rechtsträger ist, wenn sie binnen sechs Monaten nach dem Tag, an dem die Eintragung der formwechselnden Umwandlung in das Register des Sitzes desjenigen Rechtsträgers, dessen Gläubiger sie sind, nach § 19 Absatz 3 UmwG als bekanntgemacht gilt, ihren Anspruch nach Grund und Höhe schriftlich anmelden, Sicherheit zu leisten, soweit sie nicht Befriedigung verlangen können. Dieses Recht steht den Gläubigern jedoch nur zu, wenn sie glaubhaft machen, dass durch die formwechselnden Umwandlung die Erfüllung ihrer Forderung gefährdet wird."
    },
    {
      "date": "2025-09-18",
      "id": "130295",
      "original_text": "Registerbekanntmachung nach dem Umwandlungsgesetz\nNordrhein-Westfalen Amtsgericht Duisburg HRB 28135\nCWS Complete Washroom Concepts GmbH – Duisburg",
      "type": "Registerbekanntmachung nach dem Umwandlungsgesetz",
      "state": "Nordrhein-Westfalen",
      "amtsgericht": "Amtsgericht Duisburg",
      "registernummer": "HRB 28135",
      "registerart": "HRB",
      "company_name": "CWS Complete Washroom Concepts GmbH",
      "company_seat": "Duisburg",
      "details": "18.09.2025 (Bekanntmachungsdatum)\n\nNordrhein-Westfalen Amtsgericht Duisburg HRB 28135\nRegisterbekanntmachung nach dem Umwandlungsgesetz 18.09.2025 (Eintragungsdatum)\n\nCWS Complete Washroom Concepts GmbH\nGesellschaft mit beschränkter Haftung\nDuisburg\n\nDie Gesellschaft hat Gläubigern, deren Forderungen vor dieser Bekanntmachung begründet worden sind, Sicherheit zu leisten, soweit sie nicht Befriedigung verlangen können, wenn sie sich binnen sechs Monaten zu diesem Zweck melden."
    },
    {
      "date": "2025-09-18",
      "id": "130296",
      "original_text": "Einreichung neuer Dokumente\nNordrhein-Westfalen Amtsgericht Paderborn HRB 17806\ndSPACE Beta Management SE – Paderborn",
      "type": "Einreichung neuer Dokumente",
      "state": "Nordrhein-Westfalen",
      "amtsgericht": "Amtsgericht Paderborn",
      "registernummer": "HRB 17806",
      "registerart": "HRB",
      "company_name": "dSPACE Beta Management SE",
      "company_seat": "Paderborn",
      "details": "18.09.2025 (Bekanntmachungsdatum)\n\nNordrhein-Westfalen Amtsgericht Paderborn HRB 17806\nEinreichung neuer Dokumente 18.09.2025 (Eintragungsdatum)\n\ndSPACE Beta Management SE\nEuropäische Aktiengesellschaft (SE)\nPaderborn\n\nDem Registergericht ist eine neue Liste der Mitglieder des Aufsichtsrates eingereicht worden."
    },
    {
      "date": "2025-09-18",
      "id": "130297",
      "original_text": "Registerbekanntmachung nach dem Umwandlungsgesetz\nNordrhein-Westfalen Amtsgericht Neuss HRB 23878\nBond & Beyond Consulting Group GmbH – Kaarst",
      "type": "Registerbekanntmachung nach dem Umwandlungsgesetz",
      "state": "Nordrhein-Westfalen",
      "amtsgericht": "Amtsgericht Neuss",
      "registernummer": "HRB 23878",
      "registerart": "HRB",
      "company_name": "Bond & Beyond Consulting Group GmbH",
      "company_seat": "Kaarst",
      "details": "18.09.2025 (Bekanntmachungsdatum)\n\nNordrhein-Westfalen Amtsgericht Neuss HRB 23878\nRegisterbekanntmachung nach dem Umwandlungsgesetz 18.09.2025 (Eintragungsdatum)\n\nBond & Beyond Consulting Group GmbH\nGesellschaft mit beschränkter Haftung\nKaarst\n\nDen Gläubigern der an der Verschmelzung beteiligten Rechtsträger ist, wenn sie binnen sechs Monaten nach dem Tag, an dem die Eintragung der Verschmelzung in das Register des Sitzes desjenigen Rechtsträgers, dessen Gläubiger sie sind, nach § 19 Absatz 3 UmwG als bekanntgemacht gilt, ihren Anspruch nach Grund und Höhe schriftlich anmelden, Sicherheit zu leisten, soweit sie nicht Befriedigung verlangen können. Dieses Recht steht den Gläubigern jedoch nur zu, wenn sie glaubhaft machen, dass durch die Verschmelzung die Erfüllung ihrer Forderung gefährdet wird."
    },
    {
      "date": "2025-09-18",
      "id": "130298",
      "original_text": "Registerbekanntmachung nach dem Umwandlungsgesetz\nNordrhein-Westfalen Amtsgericht Duisburg HRB 25635\nHaniel Immobilien Verwaltungsgesellschaft mbH – Duisburg",
      "type": "Registerbekanntmachung nach dem Umwandlungsgesetz",
      "state": "Nordrhein-Westfalen",
      "amtsgericht": "Amtsgericht Duisburg",
      "registernummer": "HRB 25635",
      "registerart": "HRB",
      "company_name": "Haniel Immobilien Verwaltungsgesellschaft mbH",
      "company_seat": "Duisburg",
      "details": "18.09.2025 (Bekanntmachungsdatum)\n\nNordrhein-Westfalen Amtsgericht Duisburg HRB 25635\nRegisterbekanntmachung nach dem Umwandlungsgesetz 18.09.2025 (Eintragungsdatum)\n\nHaniel Immobilien Verwaltungsgesellschaft mbH\nGesellschaft mit beschränkter Haftung\nDuisburg\n\nDie Gesellschaft hat Gläubigern, deren Forderungen vor dieser Bekanntmachung begründet worden sind, Sicherheit zu leisten, soweit sie nicht Befriedigung verlangen können, wenn sie sich binnen sechs Monaten zu diesem Zweck melden."
    },
    {
      "date": "2025-09-18",
      "id": "130299",
      "original_text": "Registerbekanntmachung nach dem Umwandlungsgesetz\nNordrhein-Westfalen Amtsgericht Bielefeld HRA 17573\nLKS GmbH & Co. KG – Bielefeld",
      "type": "Registerbekanntmachung nach dem Umwandlungsgesetz",
      "state": "Nordrhein-Westfalen",
      "amtsgericht": "Amtsgericht Bielefeld",
      "registernummer": "HRA 17573",
      "registerart": "HRA",
      "company_name": "LKS GmbH & Co. KG",
      "company_seat": "Bielefeld",
      "details": "18.09.2025 (Bekanntmachungsdatum)\n\nNordrhein-Westfalen Amtsgericht Bielefeld HRA 17573\nRegisterbekanntmachung nach dem Umwandlungsgesetz 18.09.2025 (Eintragungsdatum)\n\nLKS GmbH & Co. KG\nKommanditgesellschaft\nBielefeld\n\nDen Gläubigern der an der formwechselnden Umwandlung beteiligten Rechtsträger ist, wenn sie binnen sechs Monaten nach dem Tag, an dem die Eintragung der formwechselnden Umwandlung in das Register des Sitzes desjenigen Rechtsträgers, dessen Gläubiger sie sind, nach § 19 Absatz 3 UmwG als bekanntgemacht gilt, ihren Anspruch nach Grund und Höhe schriftlich anmelden, Sicherheit zu leisten, soweit sie nicht Befriedigung verlangen können. Dieses Recht steht den Gläubigern jedoch nur zu, wenn sie glaubhaft machen, dass durch die formwechselnden Umwandlung die Erfüllung ihrer Forderung gefährdet wird."
    },
    {
      "date": "2025-09-18",
      "id": "130300",
      "original_text": "Registerbekanntmachung nach dem Umwandlungsgesetz\nNordrhein-Westfalen Amtsgericht Dortmund HRB 37587\nBerger Solutions GmbH – Werne",
      "type": "Registerbekanntmachung nach dem Umwandlungsgesetz",
      "state": "Nordrhein-Westfalen",
      "amtsgericht": "Amtsgericht Dortmund",
      "registernummer": "HRB 37587",
      "registerart": "HRB",
      "company_name": "Berger Solutions GmbH",
      "company_seat": "Werne",
      "details": "18.09.2025 (Bekanntmachungsdatum)\n\nNordrhein-Westfalen Amtsgericht Dortmund HRB 37587\nRegisterbekanntmachung nach dem Umwandlungsgesetz 18.09.2025 (Eintragungsdatum)\n\nBerger Solutions GmbH\nGesellschaft mit beschränkter Haftung\nWerne\n\nDen Gläubigern der an der formwechselnden Umwandlung beteiligten Rechtsträger ist, wenn sie binnen sechs Monaten nach dem Tag, an dem die Eintragung der formwechselnden Umwandlung in das Register des Sitzes desjenigen Rechtsträgers, dessen Gläubiger sie sind, nach § 19 Absatz 3 UmwG als bekanntgemacht gilt, ihren Anspruch nach Grund und Höhe schriftlich anmelden, Sicherheit zu leisten, soweit sie nicht Befriedigung verlangen können. Dieses Recht steht den Gläubigern jedoch nur zu, wenn sie glaubhaft machen, dass durch die formwechselnden Umwandlung die Erfüllung ihrer Forderung gefährdet wird."
    },
    {
      "date": "2025-09-18",
      "id": "130301",
      "original_text": "Registerbekanntmachung nach dem Umwandlungsgesetz\nNordrhein-Westfalen Amtsgericht Düsseldorf HRA 28140\nRidvan Tosun e. K. – Düsseldorf",
      "type": "Registerbekanntmachung nach dem Umwandlungsgesetz",
      "state": "Nordrhein-Westfalen",
      "amtsgericht": "Amtsgericht Düsseldorf",
      "registernummer": "HRA 28140",
      "registerart": "HRA",
      "company_name": "Ridvan Tosun e. K.",
      "company_seat": "Düsseldorf",
      "details": "18.09.2025 (Bekanntmachungsdatum)\n\nNordrhein-Westfalen Amtsgericht Düsseldorf HRA 28140\nRegisterbekanntmachung nach dem Umwandlungsgesetz 18.09.2025 (Eintragungsdatum)\n\nRidvan Tosun e. K.\nEinzelkaufmann / Einzelkauffrau\nDüsseldorf\n\nDen Gläubigern der an der Ausgliederung beteiligten Rechtsträger ist, wenn sie binnen sechs Monaten nach dem Tag, an dem die Eintragung der Ausgliederung in das Register des Sitzes desjenigen Rechtsträgers, dessen Gläubiger sie sind, nach § 19 Absatz 3 UmwG als bekanntgemacht gilt, ihren Anspruch nach Grund und Höhe schriftlich anmelden, Sicherheit zu leisten, soweit sie nicht Befriedigung verlangen können. Dieses Recht steht den Gläubigern jedoch nur zu, wenn sie glaubhaft machen, dass durch die Ausgliederung die Erfüllung ihrer Forderung gefährdet wird."
    },
    {
      "date": "2025-09-18",
      "id": "130302",
      "original_text": "Registerbekanntmachung nach dem Umwandlungsgesetz\nNordrhein-Westfalen Amtsgericht Münster HRB 22913\nMatheMind GmbH – Münster",
      "type": "Registerbekanntmachung nach dem Umwandlungsgesetz",
      "state": "Nordrhein-Westfalen",
      "amtsgericht": "Amtsgericht Münster",
      "registernummer": "HRB 22913",
      "registerart": "HRB",
      "company_name": "MatheMind GmbH",
      "company_seat": "Münster",
      "details": "18.09.2025 (Bekanntmachungsdatum)\n\nNordrhein-Westfalen Amtsgericht Münster HRB 22913\nRegisterbekanntmachung nach dem Umwandlungsgesetz 15.09.2025 (Eintragungsdatum)\n\nMatheMind GmbH\nGesellschaft mit beschränkter Haftung\nMünster\n\nDen Gläubigern der an der formwechselnden Umwandlung beteiligten Rechtsträger ist, wenn sie binnen sechs Monaten nach dem Tag, an dem die Eintragung der formwechselnden Umwandlung in das Register des Sitzes desjenigen Rechtsträgers, dessen Gläubiger sie sind, nach § 19 Absatz 3 UmwG als bekanntgemacht gilt, ihren Anspruch nach Grund und Höhe schriftlich anmelden, Sicherheit zu leisten, soweit sie nicht Befriedigung verlangen können. Dieses Recht steht den Gläubigern jedoch nur zu, wenn sie glaubhaft machen, dass durch die formwechselnden Umwandlung die Erfüllung ihrer Forderung gefährdet wird."
    },
    {
      "date": "2025-09-18",
      "id": "130303",
      "original_text": "Registerbekanntmachung nach dem Umwandlungsgesetz\nNordrhein-Westfalen Amtsgericht Duisburg HRB 37641\nADOMO Green Solutions GmbH – Mülheim an der Ruhr",
      "type": "Registerbekanntmachung nach dem Umwandlungsgesetz",
      "state": "Nordrhein-Westfalen",
      "amtsgericht": "Amtsgericht Duisburg",
      "registernummer": "HRB 37641",
      "registerart": "HRB",
      "company_name": "ADOMO Green Solutions GmbH",
      "company_seat": "Mülheim an der Ruhr",
      "details": "18.09.2025 (Bekanntmachungsdatum)\n\nNordrhein-Westfalen Amtsgericht Duisburg HRB 37641\nRegisterbekanntmachung nach dem Umwandlungsgesetz 18.09.2025 (Eintragungsdatum)\n\nADOMO Green Solutions GmbH\nGesellschaft mit beschränkter Haftung\nMülheim an der Ruhr\n\nDie Gesellschaft hat Gläubigern, deren Forderungen vor dieser Bekanntmachung begründet worden sind, Sicherheit zu leisten, soweit sie nicht Befriedigung verlangen können, wenn sie sich binnen sechs Monaten zu diesem Zweck melden."
    },
    {
      "date": "2025-09-18",
      "id": "130304",
      "original_text": "Registerbekanntmachung nach dem Umwandlungsgesetz\nNordrhein-Westfalen Amtsgericht Essen HRA 7634\nBüttner & Saure, Spediteure, GmbH & Co. KG – Sprockhövel",
      "type": "Registerbekanntmachung nach dem Umwandlungsgesetz",
      "state": "Nordrhein-Westfalen",
      "amtsgericht": "Amtsgericht Essen",
      "registernummer": "HRA 7634",
      "registerart": "HRA",
      "company_name": "Büttner & Saure, Spediteure, GmbH & Co. KG",
      "company_seat": "Sprockhövel",
      "details": "18.09.2025 (Bekanntmachungsdatum)\n\nNordrhein-Westfalen Amtsgericht Essen HRA 7634\nRegisterbekanntmachung nach dem Umwandlungsgesetz 18.09.2025 (Eintragungsdatum)\n\nBüttner & Saure, Spediteure, GmbH & Co. KG\nKommanditgesellschaft\nSprockhövel\n\nDen Gläubigern der an der Verschmelzung beteiligten Rechtsträger ist, wenn sie binnen sechs Monaten nach dem Tag, an dem die Eintragung der Verschmelzung in das Register des Sitzes desjenigen Rechtsträgers, dessen Gläubiger sie sind, nach § 19 Absatz 3 UmwG als bekanntgemacht gilt, ihren Anspruch nach Grund und Höhe schriftlich anmelden, Sicherheit zu leisten, soweit sie nicht Befriedigung verlangen können. Dieses Recht steht den Gläubigern jedoch nur zu, wenn sie glaubhaft machen, dass durch die Verschmelzung die Erfüllung ihrer Forderung gefährdet wird."
    },
    {
      "date": "2025-09-18",
      "id": "130305",
      "original_text": "Registerbekanntmachung nach dem Umwandlungsgesetz\nNordrhein-Westfalen Amtsgericht Bonn HRB 23691\nBrokerport GmbH – Bonn",
      "type": "Registerbekanntmachung nach dem Umwandlungsgesetz",
      "state": "Nordrhein-Westfalen",
      "amtsgericht": "Amtsgericht Bonn",
      "registernummer": "HRB 23691",
      "registerart": "HRB",
      "company_name": "Brokerport GmbH",
      "company_seat": "Bonn",
      "details": "18.09.2025 (Bekanntmachungsdatum)\n\nNordrhein-Westfalen Amtsgericht Bonn HRB 23691\nRegisterbekanntmachung nach dem Umwandlungsgesetz 18.09.2025 (Eintragungsdatum)\n\nBrokerport GmbH\nGesellschaft mit beschränkter Haftung\nBonn\n\nDen Gläubigern der an der Verschmelzung beteiligten Rechtsträger ist, wenn sie binnen sechs Monaten nach dem Tag, an dem die Eintragung der Verschmelzung in das Register des Sitzes desjenigen Rechtsträgers, dessen Gläubiger sie sind, nach § 19 Absatz 3 UmwG als bekanntgemacht gilt, ihren Anspruch nach Grund und Höhe schriftlich anmelden, Sicherheit zu leisten, soweit sie nicht Befriedigung verlangen können. Dieses Recht steht den Gläubigern jedoch nur zu, wenn sie glaubhaft machen, dass durch die Verschmelzung die Erfüllung ihrer Forderung gefährdet wird."
    },
    {
      "date": "2025-09-18",
      "id": "130306",
      "original_text": "Löschungsankündigung\nNordrhein-Westfalen Amtsgericht Duisburg HRB 37713\nTBG Tower Bau GmbH – Duisburg",
      "type": "Löschungsankündigung",
      "state": "Nordrhein-Westfalen",
      "amtsgericht": "Amtsgericht Duisburg",
      "registernummer": "HRB 37713",
      "registerart": "HRB",
      "company_name": "TBG Tower Bau GmbH",
      "company_seat": "Duisburg",
      "details": "18.09.2025 (Bekanntmachungsdatum)\n\nNordrhein-Westfalen Amtsgericht Duisburg HRB 37713\nLöschungsankündigung 18.09.2025 (Eintragungsdatum)\n\nTBG Tower Bau GmbH\nGesellschaft mit beschränkter Haftung\nDuisburg\n\nHRB 37713:\nBTBG Tower Bau GmbH, Duisburg\nZiegrarstr. 11, 12057 Berlin.\nDas Registergericht beabsichtigt, die im Handelsregister eingetragene Gesellschaft gemäß § 394 FamFG wegen Vermögenslosigkeit von Amts wegen zu löschen. Gegen diese Verfügung kann Widerspruch eingelegt werden. Die Frist zur Erhebung eines Widerspruchs gegen die beabsichtigte Löschung von Amts wegen ist auf drei Monate festgesetzt.\nRechtsbehelfsbelehrung Der Widerspruch ist bei dem Amtsgericht Duisburg, Kardinal-Galen-Str. 124-132, 47058 Duisburg schriftlich in deutscher Sprache oder zur Niederschrift der Geschäftsstelle einzulegen. Der Widerspruch kann auch zur Niederschrift der Geschäftsstelle eines jeden Amtsgerichtes abgegeben werden. Die Einlegung ist auch durch Übertragung eines elektronischen Dokuments an die elektronische Poststelle des Gerichts möglich. Das elektronische Dokument muss für die Bearbeitung durch das Gericht geeignet und mit einer qualifizierten elektronischen Signatur der verantwortenden Person versehen sein oder von der verantwortenden Person signiert und auf einem sicheren Übermittlungsweg gemäß § 130 a ZPO nach näherer Maßgabe der Verordnung über die technischen Rahmenbedingungen des elektronischen Rechtsverkehrs und über das besondere elektronische Behördenpostfach (BGBl. I, S. 3803) eingereicht werden. Weitere Informationen erhalten Sie auf der Internetseite www.justiz.de <http://www.justiz.de>. Der Widerspruch muss spätestens innerhalb der gesetzten Frist bei dem Amtsgericht Duisburg eingegangen sein. Dies gilt auch dann, wenn der Widerspruch zur Niederschrift der Geschäftsstelle eines anderen Amtsgerichtes abgegeben wurde. Die Frist beginnt mit der Veröffentlichung. Fällt das Ende der Frist auf einen Sonntag, einen allgemeinen Feiertag oder Sonnabend, so endet die Frist mit Ablauf des nächsten Werktages. Der Widerspruch muss die Bezeichnung der angefochtenen Verfügung sowie die Erklärung enthalten, dass Widerspruch gegen diese Verfügung eingelegt wird. Er ist zu unterzeichnen und soll begründet werden."
    },
    {
      "date": "2025-09-18",
      "id": "130307",
      "original_text": "Registerbekanntmachung nach dem Umwandlungsgesetz\nNordrhein-Westfalen Amtsgericht Münster HRB 19862\nProfimed Verwaltungs GmbH – Warendorf",
      "type": "Registerbekanntmachung nach dem Umwandlungsgesetz",
      "state": "Nordrhein-Westfalen",
      "amtsgericht": "Amtsgericht Münster",
      "registernummer": "HRB 19862",
      "registerart": "HRB",
      "company_name": "Profimed Verwaltungs GmbH",
      "company_seat": "Warendorf",
      "details": "18.09.2025 (Bekanntmachungsdatum)\n\nNordrhein-Westfalen Amtsgericht Münster HRB 19862\nRegisterbekanntmachung nach dem Umwandlungsgesetz 18.09.2025 (Eintragungsdatum)\n\nProfimed Verwaltungs GmbH\nGesellschaft mit beschränkter Haftung\nWarendorf\n\nDen Gläubigern der an der Verschmelzung beteiligten Rechtsträger ist, wenn sie binnen sechs Monaten nach dem Tag, an dem die Eintragung der Verschmelzung in das Register des Sitzes desjenigen Rechtsträgers, dessen Gläubiger sie sind, nach § 19 Absatz 3 UmwG als bekanntgemacht gilt, ihren Anspruch nach Grund und Höhe schriftlich anmelden, Sicherheit zu leisten, soweit sie nicht Befriedigung verlangen können. Dieses Recht steht den Gläubigern jedoch nur zu, wenn sie glaubhaft machen, dass durch die Verschmelzung die Erfüllung ihrer Forderung gefährdet wird."
    },
    {
      "date": "2025-09-18",
      "id": "130308",
      "original_text": "Registerbekanntmachung nach dem Umwandlungsgesetz\nNordrhein-Westfalen Amtsgericht Mönchengladbach HRA 10180\nFrank-Albert Beier GmbH & Co. KG – Mönchengladbach",
      "type": "Registerbekanntmachung nach dem Umwandlungsgesetz",
      "state": "Nordrhein-Westfalen",
      "amtsgericht": "Amtsgericht Mönchengladbach",
      "registernummer": "HRA 10180",
      "registerart": "HRA",
      "company_name": "Frank-Albert Beier GmbH & Co. KG",
      "company_seat": "Mönchengladbach",
      "details": "18.09.2025 (Bekanntmachungsdatum)\n\nNordrhein-Westfalen Amtsgericht Mönchengladbach HRA 10180\nRegisterbekanntmachung nach dem Umwandlungsgesetz 18.09.2025 (Eintragungsdatum)\n\nFrank-Albert Beier GmbH & Co. KG\nKommanditgesellschaft\nMönchengladbach\n\nDen Gläubigern der an der Ausgliederung beteiligten Rechtsträger ist, wenn sie binnen sechs Monaten nach dem Tag, an dem die Eintragung der Ausgliederung in das Register des Sitzes desjenigen Rechtsträgers, dessen Gläubiger sie sind, nach § 19 Absatz 3 UmwG als bekanntgemacht gilt, ihren Anspruch nach Grund und Höhe schriftlich anmelden, Sicherheit zu leisten, soweit sie nicht Befriedigung verlangen können. Dieses Recht steht den Gläubigern jedoch nur zu, wenn sie glaubhaft machen, dass durch die Ausgliederung die Erfüllung ihrer Forderung gefährdet wird."
    },
    {
      "date": "2025-09-18",
      "id": "130309",
      "original_text": "Registerbekanntmachung nach dem Umwandlungsgesetz\nNordrhein-Westfalen Amtsgericht Düsseldorf HRB 86811\nInnovationscampus Krefeld LM I GmbH – Monheim am Rhein",
      "type": "Registerbekanntmachung nach dem Umwandlungsgesetz",
      "state": "Nordrhein-Westfalen",
      "amtsgericht": "Amtsgericht Düsseldorf",
      "registernummer": "HRB 86811",
      "registerart": "HRB",
      "company_name": "Innovationscampus Krefeld LM I GmbH",
      "company_seat": "Monheim am Rhein",
      "details": "18.09.2025 (Bekanntmachungsdatum)\n\nNordrhein-Westfalen Amtsgericht Düsseldorf HRB 86811\nRegisterbekanntmachung nach dem Umwandlungsgesetz 18.09.2025 (Eintragungsdatum)\n\nInnovationscampus Krefeld LM I GmbH\nGesellschaft mit beschränkter Haftung\nMonheim am Rhein\n\nDen Gläubigern der an der Verschmelzung beteiligten Rechtsträger ist, wenn sie binnen sechs Monaten nach dem Tag, an dem die Eintragung der Verschmelzung in das Register des Sitzes desjenigen Rechtsträgers, dessen Gläubiger sie sind, nach § 19 Absatz 3 UmwG als bekanntgemacht gilt, ihren Anspruch nach Grund und Höhe schriftlich anmelden, Sicherheit zu leisten, soweit sie nicht Befriedigung verlangen können. Dieses Recht steht den Gläubigern jedoch nur zu, wenn sie glaubhaft machen, dass durch die Verschmelzung die Erfüllung ihrer Forderung gefährdet wird."
    },
    {
      "date": "2025-09-18",
      "id": "130310",
      "original_text": "Registerbekanntmachung nach dem Umwandlungsgesetz\nNordrhein-Westfalen Amtsgericht Mönchengladbach HRB 23548\nValor Makler GmbH – Mönchengladbach",
      "type": "Registerbekanntmachung nach dem Umwandlungsgesetz",
      "state": "Nordrhein-Westfalen",
      "amtsgericht": "Amtsgericht Mönchengladbach",
      "registernummer": "HRB 23548",
      "registerart": "HRB",
      "company_name": "Valor Makler GmbH",
      "company_seat": "Mönchengladbach",
      "details": "18.09.2025 (Bekanntmachungsdatum)\n\nNordrhein-Westfalen Amtsgericht Mönchengladbach HRB 23548\nRegisterbekanntmachung nach dem Umwandlungsgesetz 18.09.2025 (Eintragungsdatum)\n\nValor Makler GmbH\nGesellschaft mit beschränkter Haftung\nMönchengladbach\n\nDen Gläubigern der an der Ausgliederung beteiligten Rechtsträger ist, wenn sie binnen sechs Monaten nach dem Tag, an dem die Eintragung der Ausgliederung in das Register des Sitzes desjenigen Rechtsträgers, dessen Gläubiger sie sind, nach § 19 Absatz 3 UmwG als bekanntgemacht gilt, ihren Anspruch nach Grund und Höhe schriftlich anmelden, Sicherheit zu leisten, soweit sie nicht Befriedigung verlangen können. Dieses Recht steht den Gläubigern jedoch nur zu, wenn sie glaubhaft machen, dass durch die Ausgliederung die Erfüllung ihrer Forderung gefährdet wird."
    },
    {
      "date": "2025-09-18",
      "id": "130311",
      "original_text": "Löschungsankündigung\nNordrhein-Westfalen Amtsgericht Düsseldorf HRB 101576\nGyrochef Germany GmbH – Düsseldorf",
      "type": "Löschungsankündigung",
      "state": "Nordrhein-Westfalen",
      "amtsgericht": "Amtsgericht Düsseldorf",
      "registernummer": "HRB 101576",
      "registerart": "HRB",
      "company_name": "Gyrochef Germany GmbH",
      "company_seat": "Düsseldorf",
      "details": "18.09.2025 (Bekanntmachungsdatum)\n\nNordrhein-Westfalen Amtsgericht Düsseldorf HRB 101576\nLöschungsankündigung\n\nGyrochef Germany GmbH\nGesellschaft mit beschränkter Haftung\nDüsseldorf\n\nDas Registergericht beabsichtigt die Gesellschaft von Amts wegen nach § 394 FamFG zu löschen. Die Frist zur Erhebung eines Widerspruchs ist auf 3 Wochen festgesetzt.\n\nRechtsbehelfsbelehrung:\nDas Widerspruchsrecht steht jedem zu, der an der Unterlassung der Löschung ein berechtigtes Interesse hat. Der Widerspruch ist bei dem Amtsgericht Düsseldorf -Registergericht-, Werdener Straße 1, 40227 Düsseldorf schriftlich in deutscher Sprache oder zur Niederschrift der Geschäftsstelle einzulegen. Der Widerspruch kann auch zur Niederschrift der Geschäftsstelle eines jeden Amtsgerichtes abgegeben werden. Die Einlegung ist auch durch Übertragung eines elektronischen Dokuments an die elektronische Poststelle des Gerichts möglich. Das elektronische Dokument muss für die Bearbeitung durch das Gericht geeignet und mit einer qualifizierten elektronischen Signatur der verantwortenden Person versehen sein oder von der verantwortenden Person signiert und auf einem sicheren Übermittlungsweg gemäß § 130a ZPO nach näherer Maßgabe der Verordnung über die technischen Rahmenbedingungen des elektronischen Rechtsverkehrs und über das besondere elektronische Behördenpostfach (BGBl. I, S.3803) eingereicht werden. Weitere Informationen erhalten Sie auf der Internetseite www.justiz.de.\nDer Widerspruch muss spätestens innerhalb der gesetzten Frist nach dem Datum der Bekanntmachung der Löschungsankündigung bei dem Amtsgericht - Registergericht - Düsseldorf eingegangen sein.  Dies gilt auch dann, wenn der Widerspruch zur Niederschrift der Geschäftsstelle eines anderen Amtsgerichtes abgegeben wurde. Die Frist beginnt mit dem Tage der Bekanntmachung der Löschungsankündigung in dem für die Bekanntmachung der Eintragungen in das Handelsregister bestimmten elektronischen Informations- und Kommunikationssystem nach § 10 des Handelsgesetzbuches. Fällt das Ende der Frist auf einen Sonntag, einen allgemeinen Feiertag oder Sonnabend, so endet die Frist mit Ablauf des nächsten Werktages.\nDer Widerspruch muss die Bezeichnung der angefochtenen Löschungsankündigung sowie die Erklärung enthalten, dass Widerspruch gegen diese Löschungsankündigung eingelegt wird. Er ist zu unterzeichnen und soll begründet werden."
    },
    {
      "date": "2025-09-18",
      "id": "130312",
      "original_text": "Registerbekanntmachung nach dem Umwandlungsgesetz\nNordrhein-Westfalen Amtsgericht Bad Oeynhausen HRA 10665\nHS Rotation Inh. Henning Speckmann e.K. – Stemwede",
      "type": "Registerbekanntmachung nach dem Umwandlungsgesetz",
      "state": "Nordrhein-Westfalen",
      "amtsgericht": "Amtsgericht Bad Oeynhausen",
      "registernummer": "HRA 10665",
      "registerart": "HRA",
      "company_name": "HS Rotation Inh. Henning Speckmann e.K.",
      "company_seat": "Stemwede",
      "details": "18.09.2025 (Bekanntmachungsdatum)\n\nNordrhein-Westfalen Amtsgericht Bad Oeynhausen HRA 10665\nRegisterbekanntmachung nach dem Umwandlungsgesetz 18.09.2025 (Eintragungsdatum)\n\nHS Rotation Inh. Henning Speckmann e.K.\nEinzelkaufmann / Einzelkauffrau\nStemwede\n\nDen Gläubigern der an der Verschmelzung beteiligten Rechtsträger ist, wenn sie binnen sechs Monaten nach dem Tag, an dem die Eintragung der Verschmelzung in das Register des Sitzes desjenigen Rechtsträgers, dessen Gläubiger sie sind, nach § 19 Absatz 3 UmwG als bekanntgemacht gilt, ihren Anspruch nach Grund und Höhe schriftlich anmelden, Sicherheit zu leisten, soweit sie nicht Befriedigung verlangen können. Dieses Recht steht den Gläubigern jedoch nur zu, wenn sie glaubhaft machen, dass durch die Verschmelzung die Erfüllung ihrer Forderung gefährdet wird."
    },
    {
      "date": "2025-09-18",
      "id": "130313",
      "original_text": "Löschungsankündigung\nNordrhein-Westfalen Amtsgericht Düsseldorf HRB 95076\nSchuhe Net Express GmbH – Düsseldorf",
      "type": "Löschungsankündigung",
      "state": "Nordrhein-Westfalen",
      "amtsgericht": "Amtsgericht Düsseldorf",
      "registernummer": "HRB 95076",
      "registerart": "HRB",
      "company_name": "Schuhe Net Express GmbH",
      "company_seat": "Düsseldorf",
      "details": "18.09.2025 (Bekanntmachungsdatum)\n\nNordrhein-Westfalen Amtsgericht Düsseldorf HRB 95076\nLöschungsankündigung\n\nSchuhe Net Express GmbH\nGesellschaft mit beschränkter Haftung\nDüsseldorf\n\nDas Registergericht beabsichtigt die Gesellschaft von Amts wegen nach § 394 FamFG zu löschen. Die Frist zur Erhebung eines Widerspruchs ist auf 3 Wochen festgesetzt.\n\nRechtsbehelfsbelehrung:\nDas Widerspruchsrecht steht jedem zu, der an der Unterlassung der Löschung ein berechtigtes Interesse hat. Der Widerspruch ist bei dem Amtsgericht Düsseldorf -Registergericht-, Werdener Straße 1, 40227 Düsseldorf schriftlich in deutscher Sprache oder zur Niederschrift der Geschäftsstelle einzulegen. Der Widerspruch kann auch zur Niederschrift der Geschäftsstelle eines jeden Amtsgerichtes abgegeben werden. Die Einlegung ist auch durch Übertragung eines elektronischen Dokuments an die elektronische Poststelle des Gerichts möglich. Das elektronische Dokument muss für die Bearbeitung durch das Gericht geeignet und mit einer qualifizierten elektronischen Signatur der verantwortenden Person versehen sein oder von der verantwortenden Person signiert und auf einem sicheren Übermittlungsweg gemäß § 130a ZPO nach näherer Maßgabe der Verordnung über die technischen Rahmenbedingungen des elektronischen Rechtsverkehrs und über das besondere elektronische Behördenpostfach (BGBl. I, S.3803) eingereicht werden. Weitere Informationen erhalten Sie auf der Internetseite www.justiz.de.\nDer Widerspruch muss spätestens innerhalb der gesetzten Frist nach dem Datum der Bekanntmachung der Löschungsankündigung bei dem Amtsgericht - Registergericht - Düsseldorf eingegangen sein.  Dies gilt auch dann, wenn der Widerspruch zur Niederschrift der Geschäftsstelle eines anderen Amtsgerichtes abgegeben wurde. Die Frist beginnt mit dem Tage der Bekanntmachung der Löschungsankündigung in dem für die Bekanntmachung der Eintragungen in das Handelsregister bestimmten elektronischen Informations- und Kommunikationssystem nach § 10 des Handelsgesetzbuches. Fällt das Ende der Frist auf einen Sonntag, einen allgemeinen Feiertag oder Sonnabend, so endet die Frist mit Ablauf des nächsten Werktages.\nDer Widerspruch muss die Bezeichnung der angefochtenen Löschungsankündigung sowie die Erklärung enthalten, dass Widerspruch gegen diese Löschungsankündigung eingelegt wird. Er ist zu unterzeichnen und soll begründet werden."
    },
    {
      "date": "2025-09-18",
      "id": "130314",
      "original_text": "Löschungsankündigung\nNordrhein-Westfalen Amtsgericht Düsseldorf HRB 64993\nGerman Investment Fund GmbH – Düsseldorf",
      "type": "Löschungsankündigung",
      "state": "Nordrhein-Westfalen",
      "amtsgericht": "Amtsgericht Düsseldorf",
      "registernummer": "HRB 64993",
      "registerart": "HRB",
      "company_name": "German Investment Fund GmbH",
      "company_seat": "Düsseldorf",
      "details": "18.09.2025 (Bekanntmachungsdatum)\n\nNordrhein-Westfalen Amtsgericht Düsseldorf HRB 64993\nLöschungsankündigung\n\nGerman Investment Fund GmbH\nGesellschaft mit beschränkter Haftung\nDüsseldorf\n\nGerman Investment Fund GmbH, Fürstenwall 30 A, 40219 Düsseldorf\n\nDas Registergericht beabsichtigt die Gesellschaft von Amts wegen nach § 394 FamFG zu löschen. Die Frist zur Erhebung eines Widerspruchs ist auf 3 Wochen festgesetzt.\n\nRechtsbehelfsbelehrung:\n\nDas Widerspruchsrecht steht jedem zu, der an der Unterlassung der Löschung ein berechtigtes Interesse hat. Der Widerspruch ist bei dem Amtsgericht Düsseldorf -Registergericht-, Werdener Straße 1, 40227 Düsseldorf schriftlich in deutscher Sprache oder zur Niederschrift der Geschäftsstelle einzulegen. Der Widerspruch kann auch zur Niederschrift der Geschäftsstelle eines jeden Amtsgerichtes abgegeben werden. Die Einlegung ist auch durch Übertragung eines elektronischen Dokuments an die elektronische Poststelle des Gerichts möglich. Das elektronische Dokument muss für die Bearbeitung durch das Gericht geeignet und mit einer qualifizierten elektronischen Signatur der verantwortenden Person versehen sein oder von der verantwortenden Person signiert und auf einem sicheren Übermittlungsweg gemäß § 130a ZPO nach näherer Maßgabe der Verordnung über die technischen Rahmenbedingungen des elektronischen Rechtsverkehrs und über das besondere elektronische Behördenpostfach (BGBl. I, S.3803) eingereicht werden. Weitere Informationen erhalten Sie auf der Internetseite www.justiz.de.\nDer Widerspruch muss spätestens innerhalb der gesetzten Frist nach dem Datum der Bekanntmachung der Löschungsankündigung bei dem Amtsgericht - Registergericht - Düsseldorf eingegangen sein.  Dies gilt auch dann, wenn der Widerspruch zur Niederschrift der Geschäftsstelle eines anderen Amtsgerichtes abgegeben wurde. Die Frist beginnt mit dem Tage der Bekanntmachung der Löschungsankündigung in dem für die Bekanntmachung der Eintragungen in das Handelsregister bestimmten elektronischen Informations- und Kommunikationssystem nach § 10 des Handelsgesetzbuches. Fällt das Ende der Frist auf einen Sonntag, einen allgemeinen Feiertag oder Sonnabend, so endet die Frist mit Ablauf des nächsten Werktages.\nDer Widerspruch muss die Bezeichnung der angefochtenen Löschungsankündigung sowie die Erklärung enthalten, dass Widerspruch gegen diese Löschungsankündigung eingelegt wird. Er ist zu unterzeichnen und soll begründet werden."
    },
    {
      "date": "2025-09-18",
      "id": "130315",
      "original_text": "Registerbekanntmachung nach dem Umwandlungsgesetz\nNordrhein-Westfalen Amtsgericht Bad Oeynhausen HRA 6135\nBack-System GmbH & Co. KG'03 – Löhne",
      "type": "Registerbekanntmachung nach dem Umwandlungsgesetz",
      "state": "Nordrhein-Westfalen",
      "amtsgericht": "Amtsgericht Bad Oeynhausen",
      "registernummer": "HRA 6135",
      "registerart": "HRA",
      "company_name": "Back-System GmbH & Co. KG'03",
      "company_seat": "Löhne",
      "details": "18.09.2025 (Bekanntmachungsdatum)\n\nNordrhein-Westfalen Amtsgericht Bad Oeynhausen HRA 6135\nRegisterbekanntmachung nach dem Umwandlungsgesetz 18.09.2025 (Eintragungsdatum)\n\nBack-System GmbH & Co. KG'03\nKommanditgesellschaft\nLöhne\n\nDen Gläubigern der an der Verschmelzung beteiligten Rechtsträger ist, wenn sie binnen sechs Monaten nach dem Tag, an dem die Eintragung der Verschmelzung in das Register des Sitzes desjenigen Rechtsträgers, dessen Gläubiger sie sind, nach § 19 Absatz 3 UmwG als bekanntgemacht gilt, ihren Anspruch nach Grund und Höhe schriftlich anmelden, Sicherheit zu leisten, soweit sie nicht Befriedigung verlangen können. Dieses Recht steht den Gläubigern jedoch nur zu, wenn sie glaubhaft machen, dass durch die Verschmelzung die Erfüllung ihrer Forderung gefährdet wird."
    },
    {
      "date": "2025-09-18",
      "id": "130316",
      "original_text": "Löschungsankündigung\nNordrhein-Westfalen Amtsgericht Aachen HRB 11906\nCodaex Deutschland GmbH – Eschweiler",
      "type": "Löschungsankündigung",
      "state": "Nordrhein-Westfalen",
      "amtsgericht": "Amtsgericht Aachen",
      "registernummer": "HRB 11906",
      "registerart": "HRB",
      "company_name": "Codaex Deutschland GmbH",
      "company_seat": "Eschweiler",
      "details": "18.09.2025 (Bekanntmachungsdatum)\n\nNordrhein-Westfalen Amtsgericht Aachen HRB 11906\nLöschungsankündigung\n\nCodaex Deutschland GmbH\nGesellschaft mit beschränkter Haftung\nEschweiler\n\nDas Registergericht beabsichtigt, von Amts wegen die Gesellschaft wegen Vermögenslosigkeit nach § 394 FamFG zu löschen, weil das Insolvenzverfahren Amtsgericht Aachen (91 IN 122/14) beendet und Vermögen der Gesellschaft nicht mehr erkennbar ist, da inzwischen auch nicht mehr mit Zahlungseingängen aus der angeordneten Nachtragsverteilung zu rechnen ist.\n\nZur Geltendmachung des Widerspruchs gegen die beabsichtigte Löschung wird hiermit eine Frist von einem Monat ab Veröffentlichung dieser Ankündigung bestimmt.\n\nRechtsbehelfsbelehrung:\n\nGegen diese Verfügung kann Widerspruch eingelegt werden. Zum Widerspruch ist jeder berechtigt, der an der Unterlassung der Löschung ein berechtigtes Interesse hat.\n\nDer Widerspruch ist bei dem Amtsgericht Aachen, Adalbertsteinweg 92, 52070 Aachen schriftlich in deutscher Sprache oder zur Niederschrift der Geschäftsstelle einzulegen. Der Widerspruch kann auch zur Niederschrift der Geschäftsstelle eines jeden Amtsgerichtes abgegeben werden.\n\nDer Widerspruch muss spätestens innerhalb der gesetzten Frist nach der Bekanntgabe der Verfügung bei dem Amtsgericht Aachen eingegangen sein. Dies gilt auch dann, wenn der Widerspruch zur Niederschrift der Geschäftsstelle eines anderen Amtsgerichtes abgegeben wurde. Die Frist beginnt mit der Bekanntgabe der Verfügung durch Veröffentlichung. Fällt das Ende der Frist auf einen Sonntag, einen allgemeinen Feiertag oder Sonnabend, so endet die Frist mit Ablauf des nächsten Werktages.\n\nDer Widerspruch muss die Bezeichnung der angefochtenen Verfügung sowie die Erklärung enthalten, dass Widerspruch gegen diese Verfügung eingelegt wird. Er ist zu unterzeichnen und soll begründet werden.\n\nDie Einlegung ist auch durch Übertragung eines elektronischen Dokuments an die elektronische Poststelle des Gerichts möglich. Das elektronische Dokument muss für die Bearbeitung durch das Gericht geeignet und mit einer qualifizierten elektronischen Signatur der verantwortenden Person versehen sein oder von der verantwortenden Person signiert und auf einem sicheren Übermittlungsweg gemäß § 130 a ZPO nach näherer Maßgabe der Verordnung über die technischen Rahmenbedingungen des elektronischen Rechtsverkehrs und über das besondere elektronische Behördenpostfach (BGBl. I, S. 3803) eingereicht werden. Weitere Informationen erhalten Sie auf der Internetseite www.justiz.de."
    },
    {
      "date": "2025-09-18",
      "id": "130317",
      "original_text": "Registerbekanntmachung nach dem Umwandlungsgesetz\nNordrhein-Westfalen Amtsgericht Düsseldorf HRB 91487\nRED Construction Verwaltungs GmbH – Düsseldorf",
      "type": "Registerbekanntmachung nach dem Umwandlungsgesetz",
      "state": "Nordrhein-Westfalen",
      "amtsgericht": "Amtsgericht Düsseldorf",
      "registernummer": "HRB 91487",
      "registerart": "HRB",
      "company_name": "RED Construction Verwaltungs GmbH",
      "company_seat": "Düsseldorf",
      "details": "18.09.2025 (Bekanntmachungsdatum)\n\nNordrhein-Westfalen Amtsgericht Düsseldorf HRB 91487\nRegisterbekanntmachung nach dem Umwandlungsgesetz 18.09.2025 (Eintragungsdatum)\n\nRED Construction Verwaltungs GmbH\nGesellschaft mit beschränkter Haftung\nDüsseldorf\n\nDen Gläubigern der an der Verschmelzung beteiligten Rechtsträger ist, wenn sie binnen sechs Monaten nach dem Tag, an dem die Eintragung der Verschmelzung in das Register des Sitzes desjenigen Rechtsträgers, dessen Gläubiger sie sind, nach § 19 Absatz 3 UmwG als bekanntgemacht gilt, ihren Anspruch nach Grund und Höhe schriftlich anmelden, Sicherheit zu leisten, soweit sie nicht Befriedigung verlangen können. Dieses Recht steht den Gläubigern jedoch nur zu, wenn sie glaubhaft machen, dass durch die Verschmelzung die Erfüllung ihrer Forderung gefährdet wird."
    },
    {
      "date": "2025-09-18",
      "id": "130318",
      "original_text": "Registerbekanntmachung nach dem Umwandlungsgesetz\nNordrhein-Westfalen Amtsgericht Köln HRA 38162\nAlarmanlagenbau Ludwig e. K. – Burscheid",
      "type": "Registerbekanntmachung nach dem Umwandlungsgesetz",
      "state": "Nordrhein-Westfalen",
      "amtsgericht": "Amtsgericht Köln",
      "registernummer": "HRA 38162",
      "registerart": "HRA",
      "company_name": "Alarmanlagenbau Ludwig e. K.",
      "company_seat": "Burscheid",
      "details": "18.09.2025 (Bekanntmachungsdatum)\n\nNordrhein-Westfalen Amtsgericht Köln HRA 38162\nRegisterbekanntmachung nach dem Umwandlungsgesetz 18.09.2025 (Eintragungsdatum)\n\nAlarmanlagenbau Ludwig e. K.\nEinzelkaufmann / Einzelkauffrau\nBurscheid\n\nDen Gläubigern der an der Ausgliederung beteiligten Rechtsträger ist, wenn sie binnen sechs Monaten nach dem Tag, an dem die Eintragung der Ausgliederung in das Register des Sitzes desjenigen Rechtsträgers, dessen Gläubiger sie sind, nach § 19 Absatz 3 UmwG als bekanntgemacht gilt, ihren Anspruch nach Grund und Höhe schriftlich anmelden, Sicherheit zu leisten, soweit sie nicht Befriedigung verlangen können. Dieses Recht steht den Gläubigern jedoch nur zu, wenn sie glaubhaft machen, dass durch die Ausgliederung die Erfüllung ihrer Forderung gefährdet wird."
    },
    {
      "date": "2025-09-18",
      "id": "130319",
      "original_text": "Registerbekanntmachung nach dem Umwandlungsgesetz\nNordrhein-Westfalen Amtsgericht Köln HRB 123623\nAlarmanlagenbau Ludwig GmbH – Burscheid",
      "type": "Registerbekanntmachung nach dem Umwandlungsgesetz",
      "state": "Nordrhein-Westfalen",
      "amtsgericht": "Amtsgericht Köln",
      "registernummer": "HRB 123623",
      "registerart": "HRB",
      "company_name": "Alarmanlagenbau Ludwig GmbH",
      "company_seat": "Burscheid",
      "details": "18.09.2025 (Bekanntmachungsdatum)\n\nNordrhein-Westfalen Amtsgericht Köln HRB 123623\nRegisterbekanntmachung nach dem Umwandlungsgesetz 18.09.2025 (Eintragungsdatum)\n\nAlarmanlagenbau Ludwig GmbH\nGesellschaft mit beschränkter Haftung\nBurscheid\n\nDen Gläubigern der an der Ausgliederung beteiligten Rechtsträger ist, wenn sie binnen sechs Monaten nach dem Tag, an dem die Eintragung der Ausgliederung in das Register des Sitzes desjenigen Rechtsträgers, dessen Gläubiger sie sind, nach § 19 Absatz 3 UmwG als bekanntgemacht gilt, ihren Anspruch nach Grund und Höhe schriftlich anmelden, Sicherheit zu leisten, soweit sie nicht Befriedigung verlangen können. Dieses Recht steht den Gläubigern jedoch nur zu, wenn sie glaubhaft machen, dass durch die Ausgliederung die Erfüllung ihrer Forderung gefährdet wird."
    },
    {
      "date": "2025-09-18",
      "id": "130320",
      "original_text": "Registerbekanntmachung nach dem Umwandlungsgesetz\nNordrhein-Westfalen Amtsgericht Mönchengladbach HRA 10131\nFrank Mehl Haustechnik GmbH & Co. KG – Hückelhoven",
      "type": "Registerbekanntmachung nach dem Umwandlungsgesetz",
      "state": "Nordrhein-Westfalen",
      "amtsgericht": "Amtsgericht Mönchengladbach",
      "registernummer": "HRA 10131",
      "registerart": "HRA",
      "company_name": "Frank Mehl Haustechnik GmbH & Co. KG",
      "company_seat": "Hückelhoven",
      "details": "18.09.2025 (Bekanntmachungsdatum)\n\nNordrhein-Westfalen Amtsgericht Mönchengladbach HRA 10131\nRegisterbekanntmachung nach dem Umwandlungsgesetz 18.09.2025 (Eintragungsdatum)\n\nFrank Mehl Haustechnik GmbH & Co. KG\nKommanditgesellschaft\nHückelhoven\n\nDen Gläubigern der an der Ausgliederung beteiligten Rechtsträger ist, wenn sie binnen sechs Monaten nach dem Tag, an dem die Eintragung der Ausgliederung in das Register des Sitzes desjenigen Rechtsträgers, dessen Gläubiger sie sind, nach § 19 Absatz 3 UmwG als bekanntgemacht gilt, ihren Anspruch nach Grund und Höhe schriftlich anmelden, Sicherheit zu leisten, soweit sie nicht Befriedigung verlangen können. Dieses Recht steht den Gläubigern jedoch nur zu, wenn sie glaubhaft machen, dass durch die Ausgliederung die Erfüllung ihrer Forderung gefährdet wird."
    },
    {
      "date": "2025-09-18",
      "id": "130321",
      "original_text": "Löschungsankündigung\nNordrhein-Westfalen Amtsgericht Duisburg HRB 33640\nBardasu GmbH – Duisburg",
      "type": "Löschungsankündigung",
      "state": "Nordrhein-Westfalen",
      "amtsgericht": "Amtsgericht Duisburg",
      "registernummer": "HRB 33640",
      "registerart": "HRB",
      "company_name": "Bardasu GmbH",
      "company_seat": "Duisburg",
      "details": "18.09.2025 (Bekanntmachungsdatum)\n\nNordrhein-Westfalen Amtsgericht Duisburg HRB 33640\nLöschungsankündigung\n\nBardasu GmbH\nGesellschaft mit beschränkter Haftung\nDuisburg\n\nHR B 33640\nBardasu GmbH,\nDuisburg,\nKaßlerfelder Straße 2,\n47059 Duisburg.\nDas Registergericht beabsichtigt, die im Handelsregister eingetragene Gesellschaft gemäß § 394 Absatz 1 FamFG wegen Vermögenslosigkeit von Amts wegen zu löschen. Gegen diese Verfügung kann Widerspruch eingelegt werden. Die Frist zur Erhebung eines Widerspruchs gegen die beabsichtigte Löschung von Amts wegen ist auf drei Monate festgesetzt. Rechtsbehelfsbelehrung Der Widerspruch ist bei dem Amtsgericht Duisburg, Kardinal-Galen-Str. 124-132, 47058 Duisburg schriftlich in deutscher Sprache oder zur Niederschrift der Geschäftsstelle einzulegen. Der Widerspruch kann auch zur Niederschrift der Geschäftsstelle eines jeden Amtsgerichtes abgegeben werden. Die Einlegung ist auch durch Übertragung eines elektronischen Dokuments an die elektronische Poststelle des Gerichts möglich. Das elektronische Dokument muss für die Bearbeitung durch das Gericht geeignet und mit einer qualifizierten elektronischen Signatur der verantwortenden Person versehen sein oder von der verantwortenden Person signiert und auf einem sicheren Übermittlungsweg gemäß § 130 a ZPO nach näherer Maßgabe der Verordnung über die technischen Rahmenbedingungen des elektronischen Rechtsverkehrs und über das besondere elektronische Behördenpostfach (BGBl. I, S. 3803) eingereicht werden. Weitere Informationen erhalten Sie auf der Internetseite www.justiz.de <http://www.justiz.de>. Der Widerspruch muss spätestens innerhalb der gesetzten Frist bei dem Amtsgericht Duisburg eingegangen sein. Dies gilt auch dann, wenn der Widerspruch zur Niederschrift der Geschäftsstelle eines anderen Amtsgerichtes abgegeben wurde. Die Frist beginnt mit der Veröffentlichung. Fällt das Ende der Frist auf einen Sonntag, einen allgemeinen Feiertag oder Sonnabend, so endet die Frist mit Ablauf des nächsten Werktages. Der Widerspruch muss die Bezeichnung der angefochtenen Verfügung sowie die Erklärung enthalten, dass Widerspruch gegen diese Verfügung eingelegt wird. Er ist zu unterzeichnen und soll begründet werden."
    },
    {
      "date": "2025-09-18",
      "id": "130322",
      "original_text": "Registerbekanntmachung nach dem Umwandlungsgesetz\nNordrhein-Westfalen Amtsgericht Münster HRB 2373\nRoxeler-Betonsanierungsgesellschaft mbH – Münster",
      "type": "Registerbekanntmachung nach dem Umwandlungsgesetz",
      "state": "Nordrhein-Westfalen",
      "amtsgericht": "Amtsgericht Münster",
      "registernummer": "HRB 2373",
      "registerart": "HRB",
      "company_name": "Roxeler-Betonsanierungsgesellschaft mbH",
      "company_seat": "Münster",
      "details": "18.09.2025 (Bekanntmachungsdatum)\n\nNordrhein-Westfalen Amtsgericht Münster HRB 2373\nRegisterbekanntmachung nach dem Umwandlungsgesetz 14.09.2025 (Eintragungsdatum)\n\nRoxeler-Betonsanierungsgesellschaft mbH\nGesellschaft mit beschränkter Haftung\nMünster\n\nDen Gläubigern der an der Verschmelzung beteiligten Rechtsträger ist, wenn sie binnen sechs Monaten nach dem Tag, an dem die Eintragung der Verschmelzung in das Register des Sitzes desjenigen Rechtsträgers, dessen Gläubiger sie sind, nach § 19 Absatz 3 UmwG als bekanntgemacht gilt, ihren Anspruch nach Grund und Höhe schriftlich anmelden, Sicherheit zu leisten, soweit sie nicht Befriedigung verlangen können. Dieses Recht steht den Gläubigern jedoch nur zu, wenn sie glaubhaft machen, dass durch die Verschmelzung die Erfüllung ihrer Forderung gefährdet wird."
    },
    {
      "date": "2025-09-18",
      "id": "130323",
      "original_text": "Registerbekanntmachung nach dem Umwandlungsgesetz\nNordrhein-Westfalen Amtsgericht Mönchengladbach HRA 10193\nNoah Cloeters e. K. – Mönchengladbach",
      "type": "Registerbekanntmachung nach dem Umwandlungsgesetz",
      "state": "Nordrhein-Westfalen",
      "amtsgericht": "Amtsgericht Mönchengladbach",
      "registernummer": "HRA 10193",
      "registerart": "HRA",
      "company_name": "Noah Cloeters e. K.",
      "company_seat": "Mönchengladbach",
      "details": "18.09.2025 (Bekanntmachungsdatum)\n\nNordrhein-Westfalen Amtsgericht Mönchengladbach HRA 10193\nRegisterbekanntmachung nach dem Umwandlungsgesetz 18.09.2025 (Eintragungsdatum)\n\nNoah Cloeters e. K.\nEinzelkaufmann / Einzelkauffrau\nMönchengladbach\n\nDen Gläubigern der an der Ausgliederung beteiligten Rechtsträger ist, wenn sie binnen sechs Monaten nach dem Tag, an dem die Eintragung der Ausgliederung in das Register des Sitzes desjenigen Rechtsträgers, dessen Gläubiger sie sind, nach § 19 Absatz 3 UmwG als bekanntgemacht gilt, ihren Anspruch nach Grund und Höhe schriftlich anmelden, Sicherheit zu leisten, soweit sie nicht Befriedigung verlangen können. Dieses Recht steht den Gläubigern jedoch nur zu, wenn sie glaubhaft machen, dass durch die Ausgliederung die Erfüllung ihrer Forderung gefährdet wird."
    },
    {
      "date": "2025-09-18",
      "id": "130324",
      "original_text": "Registerbekanntmachung nach dem Umwandlungsgesetz\nNordrhein-Westfalen Amtsgericht Bielefeld HRB 40404\nDiamant Immobilien Geschäftsführungs GmbH – Bielefeld",
      "type": "Registerbekanntmachung nach dem Umwandlungsgesetz",
      "state": "Nordrhein-Westfalen",
      "amtsgericht": "Amtsgericht Bielefeld",
      "registernummer": "HRB 40404",
      "registerart": "HRB",
      "company_name": "Diamant Immobilien Geschäftsführungs GmbH",
      "company_seat": "Bielefeld",
      "details": "18.09.2025 (Bekanntmachungsdatum)\n\nNordrhein-Westfalen Amtsgericht Bielefeld HRB 40404\nRegisterbekanntmachung nach dem Umwandlungsgesetz 18.09.2025 (Eintragungsdatum)\n\nDiamant Immobilien Geschäftsführungs GmbH\nGesellschaft mit beschränkter Haftung\nBielefeld\n\nDen Gläubigern der an der Verschmelzung beteiligten Rechtsträger ist, wenn sie binnen sechs Monaten nach dem Tag, an dem die Eintragung der Verschmelzung in das Register des Sitzes desjenigen Rechtsträgers, dessen Gläubiger sie sind, nach § 19 Absatz 3 UmwG als bekanntgemacht gilt, ihren Anspruch nach Grund und Höhe schriftlich anmelden, Sicherheit zu leisten, soweit sie nicht Befriedigung verlangen können. Dieses Recht steht den Gläubigern jedoch nur zu, wenn sie glaubhaft machen, dass durch die Verschmelzung die Erfüllung ihrer Forderung gefährdet wird."
    },
    {
      "date": "2025-09-18",
      "id": "130325",
      "original_text": "Löschungsankündigung\nNordrhein-Westfalen Amtsgericht Dortmund HRB 32127\nGrünes Tal für Obst und Gemüse GmbH – Dortmund",
      "type": "Löschungsankündigung",
      "state": "Nordrhein-Westfalen",
      "amtsgericht": "Amtsgericht Dortmund",
      "registernummer": "HRB 32127",
      "registerart": "HRB",
      "company_name": "Grünes Tal für Obst und Gemüse GmbH",
      "company_seat": "Dortmund",
      "details": "18.09.2025 (Bekanntmachungsdatum)\n\nNordrhein-Westfalen Amtsgericht Dortmund HRB 32127\nLöschungsankündigung\n\nGrünes Tal für Obst und Gemüse GmbH\nGesellschaft mit beschränkter Haftung\nDortmund\n\nDas Registergericht beabsichtigt die Gesellschaft von Amts wegen nach § 394 FamFG zu löschen. Die Frist zur Erhebung eines Widerspruchs ist auf zwei Monate festgesetzt."
    },
    {
      "date": "2025-09-18",
      "id": "130326",
      "original_text": "Registerbekanntmachung nach dem Umwandlungsgesetz\nNordrhein-Westfalen Amtsgericht Duisburg HRB 18438\nGartengestaltung Kadner & Jacob GmbH – Mülheim an der Ruhr",
      "type": "Registerbekanntmachung nach dem Umwandlungsgesetz",
      "state": "Nordrhein-Westfalen",
      "amtsgericht": "Amtsgericht Duisburg",
      "registernummer": "HRB 18438",
      "registerart": "HRB",
      "company_name": "Gartengestaltung Kadner & Jacob GmbH",
      "company_seat": "Mülheim an der Ruhr",
      "details": "18.09.2025 (Bekanntmachungsdatum)\n\nNordrhein-Westfalen Amtsgericht Duisburg HRB 18438\nRegisterbekanntmachung nach dem Umwandlungsgesetz 18.09.2025 (Eintragungsdatum)\n\nGartengestaltung Kadner & Jacob GmbH\nGesellschaft mit beschränkter Haftung\nMülheim an der Ruhr\n\nDie Gesellschaft hat Gläubigern, deren Forderungen vor dieser Bekanntmachung begründet worden sind, Sicherheit zu leisten, soweit sie nicht Befriedigung verlangen können, wenn sie sich binnen sechs Monaten zu diesem Zweck melden."
    },
    {
      "date": "2025-09-18",
      "id": "130327",
      "original_text": "Registerbekanntmachung nach dem Umwandlungsgesetz\nNordrhein-Westfalen Amtsgericht Düsseldorf HRB 90976\nE + E 24 UG (haftungsbeschränkt) – Düsseldorf",
      "type": "Registerbekanntmachung nach dem Umwandlungsgesetz",
      "state": "Nordrhein-Westfalen",
      "amtsgericht": "Amtsgericht Düsseldorf",
      "registernummer": "HRB 90976",
      "registerart": "HRB",
      "company_name": "E + E 24 UG (haftungsbeschränkt)",
      "company_seat": "Düsseldorf",
      "details": "18.09.2025 (Bekanntmachungsdatum)\n\nNordrhein-Westfalen Amtsgericht Düsseldorf HRB 90976\nRegisterbekanntmachung nach dem Umwandlungsgesetz 18.09.2025 (Eintragungsdatum)\n\nE + E 24 UG (haftungsbeschränkt)\nGesellschaft mit beschränkter Haftung\nDüsseldorf\n\nDen Gläubigern der an der Verschmelzung beteiligten Rechtsträger ist, wenn sie binnen sechs Monaten nach dem Tag, an dem die Eintragung der Verschmelzung in das Register des Sitzes desjenigen Rechtsträgers, dessen Gläubiger sie sind, nach § 19 Absatz 3 UmwG als bekanntgemacht gilt, ihren Anspruch nach Grund und Höhe schriftlich anmelden, Sicherheit zu leisten, soweit sie nicht Befriedigung verlangen können. Dieses Recht steht den Gläubigern jedoch nur zu, wenn sie glaubhaft machen, dass durch die Verschmelzung die Erfüllung ihrer Forderung gefährdet wird."
    },
    {
      "date": "2025-09-18",
      "id": "130328",
      "original_text": "Registerbekanntmachung nach dem Umwandlungsgesetz\nNordrhein-Westfalen Amtsgericht Neuss HRB 24805\nTrainingsraum Herfurtner Korschenbroich GmbH – Korschenbroich",
      "type": "Registerbekanntmachung nach dem Umwandlungsgesetz",
      "state": "Nordrhein-Westfalen",
      "amtsgericht": "Amtsgericht Neuss",
      "registernummer": "HRB 24805",
      "registerart": "HRB",
      "company_name": "Trainingsraum Herfurtner Korschenbroich GmbH",
      "company_seat": "Korschenbroich",
      "details": "18.09.2025 (Bekanntmachungsdatum)\n\nNordrhein-Westfalen Amtsgericht Neuss HRB 24805\nRegisterbekanntmachung nach dem Umwandlungsgesetz 18.09.2025 (Eintragungsdatum)\n\nTrainingsraum Herfurtner Korschenbroich GmbH\nGesellschaft mit beschränkter Haftung\nKorschenbroich\n\nDen Gläubigern der an der Ausgliederung beteiligten Rechtsträger ist, wenn sie binnen sechs Monaten nach dem Tag, an dem die Eintragung der Ausgliederung in das Register des Sitzes desjenigen Rechtsträgers, dessen Gläubiger sie sind, nach § 19 Absatz 3 UmwG als bekanntgemacht gilt, ihren Anspruch nach Grund und Höhe schriftlich anmelden, Sicherheit zu leisten, soweit sie nicht Befriedigung verlangen können. Dieses Recht steht den Gläubigern jedoch nur zu, wenn sie glaubhaft machen, dass durch die Ausgliederung die Erfüllung ihrer Forderung gefährdet wird."
    },
    {
      "date": "2025-09-18",
      "id": "130329",
      "original_text": "Einreichung neuer Dokumente\nNordrhein-Westfalen Amtsgericht Essen HRB 227\nWohnungsgesellschaft Ruhr-Niederrhein mbH Essen. – Essen",
      "type": "Einreichung neuer Dokumente",
      "state": "Nordrhein-Westfalen",
      "amtsgericht": "Amtsgericht Essen",
      "registernummer": "HRB 227",
      "registerart": "HRB",
      "company_name": "Wohnungsgesellschaft Ruhr-Niederrhein mbH Essen.",
      "company_seat": "Essen",
      "details": "18.09.2025 (Bekanntmachungsdatum)\n\nNordrhein-Westfalen Amtsgericht Essen HRB 227\nEinreichung neuer Dokumente\n\nWohnungsgesellschaft Ruhr-Niederrhein mbH Essen.\nGesellschaft mit beschränkter Haftung\nEssen\n\nDem Registergericht ist eine neue Liste der Mitglieder des Aufsichtsrates eingereicht worden."
    },
    {
      "date": "2025-09-18",
      "id": "130330",
      "original_text": "Registerbekanntmachung nach dem Umwandlungsgesetz\nNordrhein-Westfalen Amtsgericht Düsseldorf HRB 102288\nDB Contemporary Art GmbH – Düsseldorf",
      "type": "Registerbekanntmachung nach dem Umwandlungsgesetz",
      "state": "Nordrhein-Westfalen",
      "amtsgericht": "Amtsgericht Düsseldorf",
      "registernummer": "HRB 102288",
      "registerart": "HRB",
      "company_name": "DB Contemporary Art GmbH",
      "company_seat": "Düsseldorf",
      "details": "18.09.2025 (Bekanntmachungsdatum)\n\nNordrhein-Westfalen Amtsgericht Düsseldorf HRB 102288\nRegisterbekanntmachung nach dem Umwandlungsgesetz 18.09.2025 (Eintragungsdatum)\n\nDB Contemporary Art GmbH\nGesellschaft mit beschränkter Haftung\nDüsseldorf\n\nDen Gläubigern der an der Ausgliederung beteiligten Rechtsträger ist, wenn sie binnen sechs Monaten nach dem Tag, an dem die Eintragung der Ausgliederung in das Register des Sitzes desjenigen Rechtsträgers, dessen Gläubiger sie sind, nach § 19 Absatz 3 UmwG als bekanntgemacht gilt, ihren Anspruch nach Grund und Höhe schriftlich anmelden, Sicherheit zu leisten, soweit sie nicht Befriedigung verlangen können. Dieses Recht steht den Gläubigern jedoch nur zu, wenn sie glaubhaft machen, dass durch die Ausgliederung die Erfüllung ihrer Forderung gefährdet wird."
    },
    {
      "date": "2025-09-18",
      "id": "130331",
      "original_text": "Registerbekanntmachung nach dem Umwandlungsgesetz\nNordrhein-Westfalen Amtsgericht Düsseldorf HRB 87187\nInnovationscampus Krefeld LM II GmbH – Monheim am Rhein",
      "type": "Registerbekanntmachung nach dem Umwandlungsgesetz",
      "state": "Nordrhein-Westfalen",
      "amtsgericht": "Amtsgericht Düsseldorf",
      "registernummer": "HRB 87187",
      "registerart": "HRB",
      "company_name": "Innovationscampus Krefeld LM II GmbH",
      "company_seat": "Monheim am Rhein",
      "details": "18.09.2025 (Bekanntmachungsdatum)\n\nNordrhein-Westfalen Amtsgericht Düsseldorf HRB 87187\nRegisterbekanntmachung nach dem Umwandlungsgesetz 18.09.2025 (Eintragungsdatum)\n\nInnovationscampus Krefeld LM II GmbH\nGesellschaft mit beschränkter Haftung\nMonheim am Rhein\n\nDen Gläubigern der an der Verschmelzung beteiligten Rechtsträger ist, wenn sie binnen sechs Monaten nach dem Tag, an dem die Eintragung der Verschmelzung in das Register des Sitzes desjenigen Rechtsträgers, dessen Gläubiger sie sind, nach § 19 Absatz 3 UmwG als bekanntgemacht gilt, ihren Anspruch nach Grund und Höhe schriftlich anmelden, Sicherheit zu leisten, soweit sie nicht Befriedigung verlangen können. Dieses Recht steht den Gläubigern jedoch nur zu, wenn sie glaubhaft machen, dass durch die Verschmelzung die Erfüllung ihrer Forderung gefährdet wird."
    },
    {
      "date": "2025-09-18",
      "id": "130332",
      "original_text": "Registerbekanntmachung nach dem Umwandlungsgesetz\nNordrhein-Westfalen Amtsgericht Dortmund HRB 34342\nproLogistik GmbH – Dortmund",
      "type": "Registerbekanntmachung nach dem Umwandlungsgesetz",
      "state": "Nordrhein-Westfalen",
      "amtsgericht": "Amtsgericht Dortmund",
      "registernummer": "HRB 34342",
      "registerart": "HRB",
      "company_name": "proLogistik GmbH",
      "company_seat": "Dortmund",
      "details": "18.09.2025 (Bekanntmachungsdatum)\n\nNordrhein-Westfalen Amtsgericht Dortmund HRB 34342\nRegisterbekanntmachung nach dem Umwandlungsgesetz 18.09.2025 (Eintragungsdatum)\n\nproLogistik GmbH\nGesellschaft mit beschränkter Haftung\nDortmund\n\nDen Gläubigern der an der Verschmelzung beteiligten Rechtsträger ist, wenn sie binnen sechs Monaten nach dem Tag, an dem die Eintragung der Verschmelzung in das Register des Sitzes desjenigen Rechtsträgers, dessen Gläubiger sie sind, nach § 19 Absatz 3 UmwG als bekanntgemacht gilt, ihren Anspruch nach Grund und Höhe schriftlich anmelden, Sicherheit zu leisten, soweit sie nicht Befriedigung verlangen können. Dieses Recht steht den Gläubigern jedoch nur zu, wenn sie glaubhaft machen, dass durch die Verschmelzung die Erfüllung ihrer Forderung gefährdet wird."
    },
    {
      "date": "2025-09-18",
      "id": "130333",
      "original_text": "Registerbekanntmachung nach dem Umwandlungsgesetz\nNordrhein-Westfalen Amtsgericht Mönchengladbach HRA 10075\nMehl Haustechnik Hückelhoven e.K. – Hückelhoven",
      "type": "Registerbekanntmachung nach dem Umwandlungsgesetz",
      "state": "Nordrhein-Westfalen",
      "amtsgericht": "Amtsgericht Mönchengladbach",
      "registernummer": "HRA 10075",
      "registerart": "HRA",
      "company_name": "Mehl Haustechnik Hückelhoven e.K.",
      "company_seat": "Hückelhoven",
      "details": "18.09.2025 (Bekanntmachungsdatum)\n\nNordrhein-Westfalen Amtsgericht Mönchengladbach HRA 10075\nRegisterbekanntmachung nach dem Umwandlungsgesetz 18.09.2025 (Eintragungsdatum)\n\nMehl Haustechnik Hückelhoven e.K.\nEinzelkaufmann / Einzelkauffrau\nHückelhoven\n\nDen Gläubigern der an der Ausgliederung beteiligten Rechtsträger ist, wenn sie binnen sechs Monaten nach dem Tag, an dem die Eintragung der Ausgliederung in das Register des Sitzes desjenigen Rechtsträgers, dessen Gläubiger sie sind, nach § 19 Absatz 3 UmwG als bekanntgemacht gilt, ihren Anspruch nach Grund und Höhe schriftlich anmelden, Sicherheit zu leisten, soweit sie nicht Befriedigung verlangen können. Dieses Recht steht den Gläubigern jedoch nur zu, wenn sie glaubhaft machen, dass durch die Ausgliederung die Erfüllung ihrer Forderung gefährdet wird."
    },
    {
      "date": "2025-09-18",
      "id": "130334",
      "original_text": "Registerbekanntmachung nach dem Umwandlungsgesetz\nNordrhein-Westfalen Amtsgericht Mönchengladbach HRA 10188\nLennartz Finanzen e.K. – Erkelenz",
      "type": "Registerbekanntmachung nach dem Umwandlungsgesetz",
      "state": "Nordrhein-Westfalen",
      "amtsgericht": "Amtsgericht Mönchengladbach",
      "registernummer": "HRA 10188",
      "registerart": "HRA",
      "company_name": "Lennartz Finanzen e.K.",
      "company_seat": "Erkelenz",
      "details": "18.09.2025 (Bekanntmachungsdatum)\n\nNordrhein-Westfalen Amtsgericht Mönchengladbach HRA 10188\nRegisterbekanntmachung nach dem Umwandlungsgesetz 18.09.2025 (Eintragungsdatum)\n\nLennartz Finanzen e.K.\nEinzelkaufmann / Einzelkauffrau\nErkelenz\n\nDen Gläubigern der an der Ausgliederung beteiligten Rechtsträger ist, wenn sie binnen sechs Monaten nach dem Tag, an dem die Eintragung der Ausgliederung in das Register des Sitzes desjenigen Rechtsträgers, dessen Gläubiger sie sind, nach § 19 Absatz 3 UmwG als bekanntgemacht gilt, ihren Anspruch nach Grund und Höhe schriftlich anmelden, Sicherheit zu leisten, soweit sie nicht Befriedigung verlangen können. Dieses Recht steht den Gläubigern jedoch nur zu, wenn sie glaubhaft machen, dass durch die Ausgliederung die Erfüllung ihrer Forderung gefährdet wird."
    },
    {
      "date": "2025-09-18",
      "id": "130335",
      "original_text": "Löschungsankündigung\nNordrhein-Westfalen Amtsgericht Duisburg HRB 27200\nS.C. Marketing GmbH – Duisburg",
      "type": "Löschungsankündigung",
      "state": "Nordrhein-Westfalen",
      "amtsgericht": "Amtsgericht Duisburg",
      "registernummer": "HRB 27200",
      "registerart": "HRB",
      "company_name": "S.C. Marketing GmbH",
      "company_seat": "Duisburg",
      "details": "18.09.2025 (Bekanntmachungsdatum)\n\nNordrhein-Westfalen Amtsgericht Duisburg HRB 27200\nLöschungsankündigung\n\nS.C. Marketing GmbH\nGesellschaft mit beschränkter Haftung\nDuisburg\n\nHR B 27200\nS.C. Marketing GmbH,\nDuisburg,\nFrankenstraße 152,\n90461 Nürnberg.\nDas Registergericht beabsichtigt, die im Handelsregister eingetragene Gesellschaft gemäß § 394 Absatz 1 FamFG wegen Vermögenslosigkeit von Amts wegen zu löschen. Gegen diese Verfügung kann Widerspruch eingelegt werden. Die Frist zur Erhebung eines Widerspruchs gegen die beabsichtigte Löschung von Amts wegen ist auf drei Monate festgesetzt. Rechtsbehelfsbelehrung Der Widerspruch ist bei dem Amtsgericht Duisburg, Kardinal-Galen-Str. 124-132, 47058 Duisburg schriftlich in deutscher Sprache oder zur Niederschrift der Geschäftsstelle einzulegen. Der Widerspruch kann auch zur Niederschrift der Geschäftsstelle eines jeden Amtsgerichtes abgegeben werden. Die Einlegung ist auch durch Übertragung eines elektronischen Dokuments an die elektronische Poststelle des Gerichts möglich. Das elektronische Dokument muss für die Bearbeitung durch das Gericht geeignet und mit einer qualifizierten elektronischen Signatur der verantwortenden Person versehen sein oder von der verantwortenden Person signiert und auf einem sicheren Übermittlungsweg gemäß § 130 a ZPO nach näherer Maßgabe der Verordnung über die technischen Rahmenbedingungen des elektronischen Rechtsverkehrs und über das besondere elektronische Behördenpostfach (BGBl. I, S. 3803) eingereicht werden. Weitere Informationen erhalten Sie auf der Internetseite www.justiz.de <http://www.justiz.de>. Der Widerspruch muss spätestens innerhalb der gesetzten Frist bei dem Amtsgericht Duisburg eingegangen sein. Dies gilt auch dann, wenn der Widerspruch zur Niederschrift der Geschäftsstelle eines anderen Amtsgerichtes abgegeben wurde. Die Frist beginnt mit der Veröffentlichung. Fällt das Ende der Frist auf einen Sonntag, einen allgemeinen Feiertag oder Sonnabend, so endet die Frist mit Ablauf des nächsten Werktages. Der Widerspruch muss die Bezeichnung der angefochtenen Verfügung sowie die Erklärung enthalten, dass Widerspruch gegen diese Verfügung eingelegt wird. Er ist zu unterzeichnen und soll begründet werden."
    },
    {
      "date": "2025-09-18",
      "id": "130336",
      "original_text": "Registerbekanntmachung nach dem Umwandlungsgesetz\nNordrhein-Westfalen Amtsgericht Aachen HRB 15487\nLandmarken Pontviertel GmbH – Aachen",
      "type": "Registerbekanntmachung nach dem Umwandlungsgesetz",
      "state": "Nordrhein-Westfalen",
      "amtsgericht": "Amtsgericht Aachen",
      "registernummer": "HRB 15487",
      "registerart": "HRB",
      "company_name": "Landmarken Pontviertel GmbH",
      "company_seat": "Aachen",
      "details": "18.09.2025 (Bekanntmachungsdatum)\n\nNordrhein-Westfalen Amtsgericht Aachen HRB 15487\nRegisterbekanntmachung nach dem Umwandlungsgesetz 18.09.2025 (Eintragungsdatum)\n\nLandmarken Pontviertel GmbH\nGesellschaft mit beschränkter Haftung\nAachen\n\nDen Gläubigern der an der Verschmelzung beteiligten Rechtsträger ist, wenn sie binnen sechs Monaten nach dem Tag, an dem die Eintragung der Verschmelzung in das Register des Sitzes desjenigen Rechtsträgers, dessen Gläubiger sie sind, nach § 19 Absatz 3 UmwG als bekanntgemacht gilt, ihren Anspruch nach Grund und Höhe schriftlich anmelden, Sicherheit zu leisten, soweit sie nicht Befriedigung verlangen können. Dieses Recht steht den Gläubigern jedoch nur zu, wenn sie glaubhaft machen, dass durch die Verschmelzung die Erfüllung ihrer Forderung gefährdet wird."
    },
    {
      "date": "2025-09-18",
      "id": "130337",
      "original_text": "Löschungsankündigung\nNordrhein-Westfalen Amtsgericht Recklinghausen HRB 9692\nCaPa Foods GmbH – Herten",
      "type": "Löschungsankündigung",
      "state": "Nordrhein-Westfalen",
      "amtsgericht": "Amtsgericht Recklinghausen",
      "registernummer": "HRB 9692",
      "registerart": "HRB",
      "company_name": "CaPa Foods GmbH",
      "company_seat": "Herten",
      "details": "18.09.2025 (Bekanntmachungsdatum)\n\nNordrhein-Westfalen Amtsgericht Recklinghausen HRB 9692\nLöschungsankündigung\n\nCaPa Foods GmbH\nGesellschaft mit beschränkter Haftung\nHerten\n\nDas Registergericht beabsichtigt die Gesellschaft von Amts wegen nach § 394 FamFG zu löschen. Die Frist zur Erhebung eines Widerspruchs ist auf drei Monate festgesetzt."
    },
    {
      "date": "2025-09-18",
      "id": "130338",
      "original_text": "Registerbekanntmachung nach dem Umwandlungsgesetz\nNordrhein-Westfalen Amtsgericht Münster HRB 4845\nVernhold GmbH – Münster",
      "type": "Registerbekanntmachung nach dem Umwandlungsgesetz",
      "state": "Nordrhein-Westfalen",
      "amtsgericht": "Amtsgericht Münster",
      "registernummer": "HRB 4845",
      "registerart": "HRB",
      "company_name": "Vernhold GmbH",
      "company_seat": "Münster",
      "details": "18.09.2025 (Bekanntmachungsdatum)\n\nNordrhein-Westfalen Amtsgericht Münster HRB 4845\nRegisterbekanntmachung nach dem Umwandlungsgesetz 18.09.2025 (Eintragungsdatum)\n\nVernhold GmbH\nGesellschaft mit beschränkter Haftung\nMünster\n\nDen Gläubigern der an der Verschmelzung beteiligten Rechtsträger ist, wenn sie binnen sechs Monaten nach dem Tag, an dem die Eintragung der Verschmelzung in das Register des Sitzes desjenigen Rechtsträgers, dessen Gläubiger sie sind, nach § 19 Absatz 3 UmwG als bekanntgemacht gilt, ihren Anspruch nach Grund und Höhe schriftlich anmelden, Sicherheit zu leisten, soweit sie nicht Befriedigung verlangen können. Dieses Recht steht den Gläubigern jedoch nur zu, wenn sie glaubhaft machen, dass durch die Verschmelzung die Erfüllung ihrer Forderung gefährdet wird."
    },
    {
      "date": "2025-09-18",
      "id": "130339",
      "original_text": "Registerbekanntmachung nach dem Umwandlungsgesetz\nNordrhein-Westfalen Amtsgericht Iserlohn HRB 11418\nSchulte-Maas Landschaftsbau GmbH – Neuenrade",
      "type": "Registerbekanntmachung nach dem Umwandlungsgesetz",
      "state": "Nordrhein-Westfalen",
      "amtsgericht": "Amtsgericht Iserlohn",
      "registernummer": "HRB 11418",
      "registerart": "HRB",
      "company_name": "Schulte-Maas Landschaftsbau GmbH",
      "company_seat": "Neuenrade",
      "details": "18.09.2025 (Bekanntmachungsdatum)\n\nNordrhein-Westfalen Amtsgericht Iserlohn HRB 11418\nRegisterbekanntmachung nach dem Umwandlungsgesetz 17.09.2025 (Eintragungsdatum)\n\nSchulte-Maas Landschaftsbau GmbH\nGesellschaft mit beschränkter Haftung\nNeuenrade\n\nDen Gläubigern der an der Ausgliederung beteiligten Rechtsträger ist, wenn sie binnen sechs Monaten nach dem Tag, an dem die Eintragung der Ausgliederung in das Register des Sitzes desjenigen Rechtsträgers, dessen Gläubiger sie sind, nach § 19 Absatz 3 UmwG als bekanntgemacht gilt, ihren Anspruch nach Grund und Höhe schriftlich anmelden, Sicherheit zu leisten, soweit sie nicht Befriedigung verlangen können. Dieses Recht steht den Gläubigern jedoch nur zu, wenn sie glaubhaft machen, dass durch die Ausgliederung die Erfüllung ihrer Forderung gefährdet wird."
    },
    {
      "date": "2025-09-18",
      "id": "130340",
      "original_text": "Löschungsankündigung\nNordrhein-Westfalen Amtsgericht Düsseldorf HRB 95618\nMizaru Dienstleistungen GmbH – Düsseldorf",
      "type": "Löschungsankündigung",
      "state": "Nordrhein-Westfalen",
      "amtsgericht": "Amtsgericht Düsseldorf",
      "registernummer": "HRB 95618",
      "registerart": "HRB",
      "company_name": "Mizaru Dienstleistungen GmbH",
      "company_seat": "Düsseldorf",
      "details": "18.09.2025 (Bekanntmachungsdatum)\n\nNordrhein-Westfalen Amtsgericht Düsseldorf HRB 95618\nLöschungsankündigung\n\nMizaru Dienstleistungen GmbH\nGesellschaft mit beschränkter Haftung\nDüsseldorf\n\nDas Registergericht beabsichtigt die Gesellschaft von Amts wegen nach § 394 FamFG zu löschen. Die Frist zur Erhebung eines Widerspruchs ist auf 3 Wochen festgesetzt.\n\nRechtsbehelfsbelehrung:\nDas Widerspruchsrecht steht jedem zu, der an der Unterlassung der Löschung ein berechtigtes Interesse hat. Der Widerspruch ist bei dem Amtsgericht Düsseldorf -Registergericht-, Werdener Straße 1, 40227 Düsseldorf schriftlich in deutscher Sprache oder zur Niederschrift der Geschäftsstelle einzulegen. Der Widerspruch kann auch zur Niederschrift der Geschäftsstelle eines jeden Amtsgerichtes abgegeben werden. Die Einlegung ist auch durch Übertragung eines elektronischen Dokuments an die elektronische Poststelle des Gerichts möglich. Das elektronische Dokument muss für die Bearbeitung durch das Gericht geeignet und mit einer qualifizierten elektronischen Signatur der verantwortenden Person versehen sein oder von der verantwortenden Person signiert und auf einem sicheren Übermittlungsweg gemäß § 130a ZPO nach näherer Maßgabe der Verordnung über die technischen Rahmenbedingungen des elektronischen Rechtsverkehrs und über das besondere elektronische Behördenpostfach (BGBl. I, S.3803) eingereicht werden. Weitere Informationen erhalten Sie auf der Internetseite www.justiz.de.\nDer Widerspruch muss spätestens innerhalb der gesetzten Frist nach dem Datum der Bekanntmachung der Löschungsankündigung bei dem Amtsgericht - Registergericht - Düsseldorf eingegangen sein.  Dies gilt auch dann, wenn der Widerspruch zur Niederschrift der Geschäftsstelle eines anderen Amtsgerichtes abgegeben wurde. Die Frist beginnt mit dem Tage der Bekanntmachung der Löschungsankündigung in dem für die Bekanntmachung der Eintragungen in das Handelsregister bestimmten elektronischen Informations- und Kommunikationssystem nach § 10 des Handelsgesetzbuches. Fällt das Ende der Frist auf einen Sonntag, einen allgemeinen Feiertag oder Sonnabend, so endet die Frist mit Ablauf des nächsten Werktages.\nDer Widerspruch muss die Bezeichnung der angefochtenen Löschungsankündigung sowie die Erklärung enthalten, dass Widerspruch gegen diese Löschungsankündigung eingelegt wird. Er ist zu unterzeichnen und soll begründet werden."
    },
    {
      "date": "2025-09-18",
      "id": "130341",
      "original_text": "Registerbekanntmachung nach dem Umwandlungsgesetz\nNordrhein-Westfalen Amtsgericht Essen HRB 28595\nMyLetics GmbH – Essen",
      "type": "Registerbekanntmachung nach dem Umwandlungsgesetz",
      "state": "Nordrhein-Westfalen",
      "amtsgericht": "Amtsgericht Essen",
      "registernummer": "HRB 28595",
      "registerart": "HRB",
      "company_name": "MyLetics GmbH",
      "company_seat": "Essen",
      "details": "18.09.2025 (Bekanntmachungsdatum)\n\nNordrhein-Westfalen Amtsgericht Essen HRB 28595\nRegisterbekanntmachung nach dem Umwandlungsgesetz 16.09.2025 (Eintragungsdatum)\n\nMyLetics GmbH\nGesellschaft mit beschränkter Haftung\nEssen\n\nDen Gläubigern der an der Verschmelzung beteiligten Rechtsträger ist, wenn sie binnen sechs Monaten nach dem Tag, an dem die Eintragung der Verschmelzung in das Register des Sitzes desjenigen Rechtsträgers, dessen Gläubiger sie sind, nach § 19 Absatz 3 UmwG als bekanntgemacht gilt, ihren Anspruch nach Grund und Höhe schriftlich anmelden, Sicherheit zu leisten, soweit sie nicht Befriedigung verlangen können. Dieses Recht steht den Gläubigern jedoch nur zu, wenn sie glaubhaft machen, dass durch die Verschmelzung die Erfüllung ihrer Forderung gefährdet wird."
    },
    {
      "date": "2025-09-18",
      "id": "130342",
      "original_text": "Registerbekanntmachung nach dem Umwandlungsgesetz\nNordrhein-Westfalen Amtsgericht Bonn HRB 23758\nMedixfinder UG (haftungsbeschränkt) – Bonn",
      "type": "Registerbekanntmachung nach dem Umwandlungsgesetz",
      "state": "Nordrhein-Westfalen",
      "amtsgericht": "Amtsgericht Bonn",
      "registernummer": "HRB 23758",
      "registerart": "HRB",
      "company_name": "Medixfinder UG (haftungsbeschränkt)",
      "company_seat": "Bonn",
      "details": "18.09.2025 (Bekanntmachungsdatum)\n\nNordrhein-Westfalen Amtsgericht Bonn HRB 23758\nRegisterbekanntmachung nach dem Umwandlungsgesetz 18.09.2025 (Eintragungsdatum)\n\nMedixfinder UG (haftungsbeschränkt)\nGesellschaft mit beschränkter Haftung\nBonn\n\nDen Gläubigern der an der Verschmelzung beteiligten Rechtsträger ist, wenn sie binnen sechs Monaten nach dem Tag, an dem die Eintragung der Verschmelzung in das Register des Sitzes desjenigen Rechtsträgers, dessen Gläubiger sie sind, nach § 19 Absatz 3 UmwG als bekanntgemacht gilt, ihren Anspruch nach Grund und Höhe schriftlich anmelden, Sicherheit zu leisten, soweit sie nicht Befriedigung verlangen können. Dieses Recht steht den Gläubigern jedoch nur zu, wenn sie glaubhaft machen, dass durch die Verschmelzung die Erfüllung ihrer Forderung gefährdet wird."
    },
    {
      "date": "2025-09-18",
      "id": "130343",
      "original_text": "Registerbekanntmachung nach dem Umwandlungsgesetz\nNordrhein-Westfalen Amtsgericht Münster HRB 21692\nLab481 GmbH – Münster",
      "type": "Registerbekanntmachung nach dem Umwandlungsgesetz",
      "state": "Nordrhein-Westfalen",
      "amtsgericht": "Amtsgericht Münster",
      "registernummer": "HRB 21692",
      "registerart": "HRB",
      "company_name": "Lab481 GmbH",
      "company_seat": "Münster",
      "details": "18.09.2025 (Bekanntmachungsdatum)\n\nNordrhein-Westfalen Amtsgericht Münster HRB 21692\nRegisterbekanntmachung nach dem Umwandlungsgesetz 18.09.2025 (Eintragungsdatum)\n\nLab481 GmbH\nGesellschaft mit beschränkter Haftung\nMünster\n\nDen Gläubigern der an der Abspaltung beteiligten Rechtsträger ist, wenn sie binnen sechs Monaten nach dem Tag, an dem die Eintragung der Abspaltung in das Register des Sitzes desjenigen Rechtsträgers, dessen Gläubiger sie sind, nach § 19 Absatz 3 UmwG als bekanntgemacht gilt, ihren Anspruch nach Grund und Höhe schriftlich anmelden, Sicherheit zu leisten, soweit sie nicht Befriedigung verlangen können. Dieses Recht steht den Gläubigern jedoch nur zu, wenn sie glaubhaft machen, dass durch die Abspaltung die Erfüllung ihrer Forderung gefährdet wird."
    },
    {
      "date": "2025-09-18",
      "id": "130344",
      "original_text": "Einreichung neuer Dokumente\nNordrhein-Westfalen Amtsgericht Köln HRB 27124\nTÜV Rheinland Kraftfahrt GmbH – Köln",
      "type": "Einreichung neuer Dokumente",
      "state": "Nordrhein-Westfalen",
      "amtsgericht": "Amtsgericht Köln",
      "registernummer": "HRB 27124",
      "registerart": "HRB",
      "company_name": "TÜV Rheinland Kraftfahrt GmbH",
      "company_seat": "Köln",
      "details": "18.09.2025 (Bekanntmachungsdatum)\n\nNordrhein-Westfalen Amtsgericht Köln HRB 27124\nEinreichung neuer Dokumente\n\nTÜV Rheinland Kraftfahrt GmbH\nGesellschaft mit beschränkter Haftung\nKöln\n\nDem Registergericht ist eine Liste der Mitglieder des Aufsichtsrates eingereicht worden."
    },
    {
      "date": "2025-09-18",
      "id": "130345",
      "original_text": "Registerbekanntmachung nach dem Umwandlungsgesetz\nNordrhein-Westfalen Amtsgericht Münster HRB 18714\nMUUV GmbH – Münster",
      "type": "Registerbekanntmachung nach dem Umwandlungsgesetz",
      "state": "Nordrhein-Westfalen",
      "amtsgericht": "Amtsgericht Münster",
      "registernummer": "HRB 18714",
      "registerart": "HRB",
      "company_name": "MUUV GmbH",
      "company_seat": "Münster",
      "details": "18.09.2025 (Bekanntmachungsdatum)\n\nNordrhein-Westfalen Amtsgericht Münster HRB 18714\nRegisterbekanntmachung nach dem Umwandlungsgesetz 18.09.2025 (Eintragungsdatum)\n\nMUUV GmbH\nGesellschaft mit beschränkter Haftung\nMünster\n\nDen Gläubigern der an der Verschmelzung beteiligten Rechtsträger ist, wenn sie binnen sechs Monaten nach dem Tag, an dem die Eintragung der Verschmelzung in das Register des Sitzes desjenigen Rechtsträgers, dessen Gläubiger sie sind, nach § 19 Absatz 3 UmwG als bekanntgemacht gilt, ihren Anspruch nach Grund und Höhe schriftlich anmelden, Sicherheit zu leisten, soweit sie nicht Befriedigung verlangen können. Dieses Recht steht den Gläubigern jedoch nur zu, wenn sie glaubhaft machen, dass durch die Verschmelzung die Erfüllung ihrer Forderung gefährdet wird."
    },
    {
      "date": "2025-09-18",
      "id": "130346",
      "original_text": "Einreichung neuer Dokumente\nNordrhein-Westfalen Amtsgericht Gelsenkirchen HRB 11233\nInnovation City Management GmbH – Bottrop",
      "type": "Einreichung neuer Dokumente",
      "state": "Nordrhein-Westfalen",
      "amtsgericht": "Amtsgericht Gelsenkirchen",
      "registernummer": "HRB 11233",
      "registerart": "HRB",
      "company_name": "Innovation City Management GmbH",
      "company_seat": "Bottrop",
      "details": "18.09.2025 (Bekanntmachungsdatum)\n\nNordrhein-Westfalen Amtsgericht Gelsenkirchen HRB 11233\nEinreichung neuer Dokumente\n\nInnovation City Management GmbH\nGesellschaft mit beschränkter Haftung\nBottrop\n\nDem Registergericht ist eine Liste der Mitglieder des Aufsichtsrates eingereicht worden."
    },
    {
      "date": "2025-09-18",
      "id": "130347",
      "original_text": "Registerbekanntmachung nach dem Umwandlungsgesetz\nNordrhein-Westfalen Amtsgericht Bonn HRB 18956\nKallenbach Elektronik GmbH – Euskirchen",
      "type": "Registerbekanntmachung nach dem Umwandlungsgesetz",
      "state": "Nordrhein-Westfalen",
      "amtsgericht": "Amtsgericht Bonn",
      "registernummer": "HRB 18956",
      "registerart": "HRB",
      "company_name": "Kallenbach Elektronik GmbH",
      "company_seat": "Euskirchen",
      "details": "18.09.2025 (Bekanntmachungsdatum)\n\nNordrhein-Westfalen Amtsgericht Bonn HRB 18956\nRegisterbekanntmachung nach dem Umwandlungsgesetz 18.09.2025 (Eintragungsdatum)\n\nKallenbach Elektronik GmbH\nGesellschaft mit beschränkter Haftung\nEuskirchen\n\nDen Gläubigern der an der Verschmelzung beteiligten Rechtsträger ist, wenn sie binnen sechs Monaten nach dem Tag, an dem die Eintragung der Verschmelzung in das Register des Sitzes desjenigen Rechtsträgers, dessen Gläubiger sie sind, nach § 19 Absatz 3 UmwG als bekanntgemacht gilt, ihren Anspruch nach Grund und Höhe schriftlich anmelden, Sicherheit zu leisten, soweit sie nicht Befriedigung verlangen können. Dieses Recht steht den Gläubigern jedoch nur zu, wenn sie glaubhaft machen, dass durch die Verschmelzung die Erfüllung ihrer Forderung gefährdet wird."
    },
    {
      "date": "2025-09-18",
      "id": "130348",
      "original_text": "Registerbekanntmachung nach dem Umwandlungsgesetz\nNordrhein-Westfalen Amtsgericht Bielefeld HRB 43809\nLKS UG (haftungsbeschränkt) – Bielefeld",
      "type": "Registerbekanntmachung nach dem Umwandlungsgesetz",
      "state": "Nordrhein-Westfalen",
      "amtsgericht": "Amtsgericht Bielefeld",
      "registernummer": "HRB 43809",
      "registerart": "HRB",
      "company_name": "LKS UG (haftungsbeschränkt)",
      "company_seat": "Bielefeld",
      "details": "18.09.2025 (Bekanntmachungsdatum)\n\nNordrhein-Westfalen Amtsgericht Bielefeld HRB 43809\nRegisterbekanntmachung nach dem Umwandlungsgesetz 18.09.2025 (Eintragungsdatum)\n\nLKS UG (haftungsbeschränkt)\nGesellschaft mit beschränkter Haftung\nBielefeld\n\nDen Gläubigern der an der formwechselnden Umwandlung beteiligten Rechtsträger ist, wenn sie binnen sechs Monaten nach dem Tag, an dem die Eintragung der formwechselnden Umwandlung in das Register des Sitzes desjenigen Rechtsträgers, dessen Gläubiger sie sind, nach § 19 Absatz 3 UmwG als bekanntgemacht gilt, ihren Anspruch nach Grund und Höhe schriftlich anmelden, Sicherheit zu leisten, soweit sie nicht Befriedigung verlangen können. Dieses Recht steht den Gläubigern jedoch nur zu, wenn sie glaubhaft machen, dass durch die formwechselnden Umwandlung die Erfüllung ihrer Forderung gefährdet wird."
    },
    {
      "date": "2025-09-18",
      "id": "130349",
      "original_text": "Registerbekanntmachung nach dem Umwandlungsgesetz\nNordrhein-Westfalen Amtsgericht Bonn HRB 29905\nKfz-Sachverständigenbüro Feifer GmbH – Bonn",
      "type": "Registerbekanntmachung nach dem Umwandlungsgesetz",
      "state": "Nordrhein-Westfalen",
      "amtsgericht": "Amtsgericht Bonn",
      "registernummer": "HRB 29905",
      "registerart": "HRB",
      "company_name": "Kfz-Sachverständigenbüro Feifer GmbH",
      "company_seat": "Bonn",
      "details": "18.09.2025 (Bekanntmachungsdatum)\n\nNordrhein-Westfalen Amtsgericht Bonn HRB 29905\nRegisterbekanntmachung nach dem Umwandlungsgesetz 18.09.2025 (Eintragungsdatum)\n\nKfz-Sachverständigenbüro Feifer GmbH\nGesellschaft mit beschränkter Haftung\nBonn\n\nDen Gläubigern der an der Ausgliederung beteiligten Rechtsträger ist, wenn sie binnen sechs Monaten nach dem Tag, an dem die Eintragung der Ausgliederung in das Register des Sitzes desjenigen Rechtsträgers, dessen Gläubiger sie sind, nach § 19 Absatz 3 UmwG als bekanntgemacht gilt, ihren Anspruch nach Grund und Höhe schriftlich anmelden, Sicherheit zu leisten, soweit sie nicht Befriedigung verlangen können. Dieses Recht steht den Gläubigern jedoch nur zu, wenn sie glaubhaft machen, dass durch die Ausgliederung die Erfüllung ihrer Forderung gefährdet wird."
    },
    {
      "date": "2025-09-18",
      "id": "130350",
      "original_text": "Registerbekanntmachung nach dem Umwandlungsgesetz\nNordrhein-Westfalen Amtsgericht Düsseldorf HRB 110310\nLH Haustechnik GmbH – Düsseldorf",
      "type": "Registerbekanntmachung nach dem Umwandlungsgesetz",
      "state": "Nordrhein-Westfalen",
      "amtsgericht": "Amtsgericht Düsseldorf",
      "registernummer": "HRB 110310",
      "registerart": "HRB",
      "company_name": "LH Haustechnik GmbH",
      "company_seat": "Düsseldorf",
      "details": "18.09.2025 (Bekanntmachungsdatum)\n\nNordrhein-Westfalen Amtsgericht Düsseldorf HRB 110310\nRegisterbekanntmachung nach dem Umwandlungsgesetz 18.09.2025 (Eintragungsdatum)\n\nLH Haustechnik GmbH\nGesellschaft mit beschränkter Haftung\nDüsseldorf\n\nDen Gläubigern der an der Ausgliederung beteiligten Rechtsträger ist, wenn sie binnen sechs Monaten nach dem Tag, an dem die Eintragung der Ausgliederung in das Register des Sitzes desjenigen Rechtsträgers, dessen Gläubiger sie sind, nach § 19 Absatz 3 UmwG als bekanntgemacht gilt, ihren Anspruch nach Grund und Höhe schriftlich anmelden, Sicherheit zu leisten, soweit sie nicht Befriedigung verlangen können. Dieses Recht steht den Gläubigern jedoch nur zu, wenn sie glaubhaft machen, dass durch die Ausgliederung die Erfüllung ihrer Forderung gefährdet wird."
    },
    {
      "date": "2025-09-18",
      "id": "130351",
      "original_text": "Löschungsankündigung\nNordrhein-Westfalen Amtsgericht Essen HRB 27498\nHans Dampf Betriebs GmbH – Essen",
      "type": "Löschungsankündigung",
      "state": "Nordrhein-Westfalen",
      "amtsgericht": "Amtsgericht Essen",
      "registernummer": "HRB 27498",
      "registerart": "HRB",
      "company_name": "Hans Dampf Betriebs GmbH",
      "company_seat": "Essen",
      "details": "18.09.2025 (Bekanntmachungsdatum)\n\nNordrhein-Westfalen Amtsgericht Essen HRB 27498\nLöschungsankündigung\n\nHans Dampf Betriebs GmbH\nGesellschaft mit beschränkter Haftung\nEssen\n\nDas Registergericht beabsichtigt die Gesellschaft von Amts wegen nach § 394 FamFG zu löschen. Die Frist zur Erhebung eines Widerspruchs ist auf zwei Monate festgesetzt."
    },
    {
      "date": "2025-09-18",
      "id": "130352",
      "original_text": "Registerbekanntmachung nach dem Umwandlungsgesetz\nNordrhein-Westfalen Amtsgericht Duisburg HRB 28135\nCWS Complete Washroom Concepts GmbH – Duisburg",
      "type": "Registerbekanntmachung nach dem Umwandlungsgesetz",
      "state": "Nordrhein-Westfalen",
      "amtsgericht": "Amtsgericht Duisburg",
      "registernummer": "HRB 28135",
      "registerart": "HRB",
      "company_name": "CWS Complete Washroom Concepts GmbH",
      "company_seat": "Duisburg",
      "details": "18.09.2025 (Bekanntmachungsdatum)\n\nNordrhein-Westfalen Amtsgericht Duisburg HRB 28135\nRegisterbekanntmachung nach dem Umwandlungsgesetz 18.09.2025 (Eintragungsdatum)\n\nCWS Complete Washroom Concepts GmbH\nGesellschaft mit beschränkter Haftung\nDuisburg\n\nDie Gesellschaft hat Gläubigern, deren Forderungen vor dieser Bekanntmachung begründet worden sind, Sicherheit zu leisten, soweit sie nicht Befriedigung verlangen können, wenn sie sich binnen sechs Monaten zu diesem Zweck melden."
    },
    {
      "date": "2025-09-18",
      "id": "130353",
      "original_text": "Einreichung neuer Dokumente\nNordrhein-Westfalen Amtsgericht Köln HRB 63919\nMerten GmbH – Wiehl",
      "type": "Einreichung neuer Dokumente",
      "state": "Nordrhein-Westfalen",
      "amtsgericht": "Amtsgericht Köln",
      "registernummer": "HRB 63919",
      "registerart": "HRB",
      "company_name": "Merten GmbH",
      "company_seat": "Wiehl",
      "details": "18.09.2025 (Bekanntmachungsdatum)\n\nNordrhein-Westfalen Amtsgericht Köln HRB 63919\nEinreichung neuer Dokumente\n\nMerten GmbH\nGesellschaft mit beschränkter Haftung\nWiehl\n\nDem Registergericht ist eine Liste der Mitglieder des Aufsichtsrates eingereicht worden."
    },
    {
      "date": "2025-09-18",
      "id": "130354",
      "original_text": "Registerbekanntmachung nach dem Umwandlungsgesetz\nNordrhein-Westfalen Amtsgericht Mönchengladbach HRA 9787\nFrank-Albert Beier e. K. – Mönchengladbach",
      "type": "Registerbekanntmachung nach dem Umwandlungsgesetz",
      "state": "Nordrhein-Westfalen",
      "amtsgericht": "Amtsgericht Mönchengladbach",
      "registernummer": "HRA 9787",
      "registerart": "HRA",
      "company_name": "Frank-Albert Beier e. K.",
      "company_seat": "Mönchengladbach",
      "details": "18.09.2025 (Bekanntmachungsdatum)\n\nNordrhein-Westfalen Amtsgericht Mönchengladbach HRA 9787\nRegisterbekanntmachung nach dem Umwandlungsgesetz 18.09.2025 (Eintragungsdatum)\n\nFrank-Albert Beier e. K.\nEinzelkaufmann / Einzelkauffrau\nMönchengladbach\n\nDen Gläubigern der an der Ausgliederung beteiligten Rechtsträger ist, wenn sie binnen sechs Monaten nach dem Tag, an dem die Eintragung der Ausgliederung in das Register des Sitzes desjenigen Rechtsträgers, dessen Gläubiger sie sind, nach § 19 Absatz 3 UmwG als bekanntgemacht gilt, ihren Anspruch nach Grund und Höhe schriftlich anmelden, Sicherheit zu leisten, soweit sie nicht Befriedigung verlangen können. Dieses Recht steht den Gläubigern jedoch nur zu, wenn sie glaubhaft machen, dass durch die Ausgliederung die Erfüllung ihrer Forderung gefährdet wird."
    },
    {
      "date": "2025-09-18",
      "id": "130355",
      "original_text": "Registerbekanntmachung nach dem Umwandlungsgesetz\nThüringen Amtsgericht Jena HRB 523695\nKfz Technik Neumann GmbH – Oppurg",
      "type": "Registerbekanntmachung nach dem Umwandlungsgesetz",
      "state": "Thüringen",
      "amtsgericht": "Amtsgericht Jena",
      "registernummer": "HRB 523695",
      "registerart": "HRB",
      "company_name": "Kfz Technik Neumann GmbH",
      "company_seat": "Oppurg",
      "details": "18.09.2025 (Bekanntmachungsdatum)\n\nThüringen Amtsgericht Jena HRB 523695\nRegisterbekanntmachung nach dem Umwandlungsgesetz 18.09.2025 (Eintragungsdatum)\n\nKfz Technik Neumann GmbH\nGesellschaft mit beschränkter Haftung\nOppurg\n\nNicht eingetragen: Den Gläubigern des formwechselnden  Rechtsträgers, ist wenn sie binnen sechs Monaten nach dem Tag, an dem die Eintragung des Formwechsels nach § 201 UmwG als bekanntgemacht gilt, ihren Anspruch nach Grund und Höhe schriftlich anmelden, Sicherheit zu leisten, soweit sie nicht Befriedigung verlangen können. Dieses Recht steht ihnen jedoch nur zu, wenn sie glaubhaft machen, daß durch den Formwechsel die Erfüllung ihrer Forderung gefährdet wird."
    },
    {
      "date": "2025-09-18",
      "id": "130356",
      "original_text": "Registerbekanntmachung nach dem Umwandlungsgesetz\nThüringen Amtsgericht Jena HRB 515451\nDJS Immobilienverwaltung GmbH – Uder",
      "type": "Registerbekanntmachung nach dem Umwandlungsgesetz",
      "state": "Thüringen",
      "amtsgericht": "Amtsgericht Jena",
      "registernummer": "HRB 515451",
      "registerart": "HRB",
      "company_name": "DJS Immobilienverwaltung GmbH",
      "company_seat": "Uder",
      "details": "18.09.2025 (Bekanntmachungsdatum)\n\nThüringen Amtsgericht Jena HRB 515451\nRegisterbekanntmachung nach dem Umwandlungsgesetz 18.09.2025 (Eintragungsdatum)\n\nDJS Immobilienverwaltung GmbH\nGesellschaft mit beschränkter Haftung\nUder\n\nNicht eingetragen: Den Gläubigern der an der Verschmelzung beteiligten Rechtsträger, ist wenn sie binnen sechs Monaten nach dem Tag, an dem die Eintragung der Verschmelzung in das Register des Sitzes desjenigen Rechtsträgers, dessen Gläubiger sie sind,  nach § 19 Abs. 3 UmwG als bekanntgemacht gilt, ihren Anspruch nach Grund und Höhe schriftlich anmelden, Sicherheit zu leisten, soweit sie nicht Befriedigung verlangen können. Dieses Recht steht ihnen jedoch nur zu, wenn sie glaubhaft machen, daß durch die Verschmelzung die Erfüllung ihrer Forderung gefährdet wird."
    },
    {
      "date": "2025-09-18",
      "id": "130357",
      "original_text": "Registerbekanntmachung nach dem Umwandlungsgesetz\nThüringen Amtsgericht Jena HRB 523700\nDöring Reisen GmbH – Geismar",
      "type": "Registerbekanntmachung nach dem Umwandlungsgesetz",
      "state": "Thüringen",
      "amtsgericht": "Amtsgericht Jena",
      "registernummer": "HRB 523700",
      "registerart": "HRB",
      "company_name": "Döring Reisen GmbH",
      "company_seat": "Geismar",
      "details": "18.09.2025 (Bekanntmachungsdatum)\n\nThüringen Amtsgericht Jena HRB 523700\nRegisterbekanntmachung nach dem Umwandlungsgesetz 18.09.2025 (Eintragungsdatum)\n\nDöring Reisen GmbH\nGesellschaft mit beschränkter Haftung\nGeismar\n\nNicht eingetragen: Den Gläubigern der an der Ausgliederung beteiligten Rechtsträger, ist wenn sie binnen sechs Monaten nach dem Tag, an dem die Eintragung der Ausgliederung in das Register des Sitzes desjenigen Rechtsträgers, dessen Gläubiger sie sind, nach §§125, 19 Abs. 3 UmwG als bekanntgemacht gilt, ihren Anspruch nach Grund und Höhe schriftlich anmelden, Sicherheit zu leisten, soweit sie nicht Befriedigung verlangen können. Dieses Recht steht ihnen jedoch nur zu, wenn sie glaubhaft machen, daß durch die Ausgliederung die Erfüllung ihrer Forderung gefährdet wird."
    },
    {
      "date": "2025-09-18",
      "id": "130358",
      "original_text": "Registerbekanntmachung nach dem Umwandlungsgesetz\nThüringen Amtsgericht Jena GsR 441\nKfz Technik Neumann eGbR – Oppurg",
      "type": "Registerbekanntmachung nach dem Umwandlungsgesetz",
      "state": "Thüringen",
      "amtsgericht": "Amtsgericht Jena",
      "registernummer": "GsR 441",
      "registerart": "GsR",
      "company_name": "Kfz Technik Neumann eGbR",
      "company_seat": "Oppurg",
      "details": "18.09.2025 (Bekanntmachungsdatum)\n\nThüringen Amtsgericht Jena GsR 441\nRegisterbekanntmachung nach dem Umwandlungsgesetz 18.09.2025 (Eintragungsdatum)\n\nKfz Technik Neumann eGbR\nGesellschaft bürgerlichen Rechts\nOppurg\n\nNicht eingetragen: Den Gläubigern des formwechselnden  Rechtsträgers, ist wenn sie binnen sechs Monaten nach dem Tag, an dem die Eintragung des Formwechsels nach § 201 UmwG als bekanntgemacht gilt, ihren Anspruch nach Grund und Höhe schriftlich anmelden, Sicherheit zu leisten, soweit sie nicht Befriedigung verlangen können. Dieses Recht steht ihnen jedoch nur zu, wenn sie glaubhaft machen, daß durch den Formwechsel die Erfüllung ihrer Forderung gefährdet wird."
    },
    {
      "date": "2025-09-18",
      "id": "130359",
      "original_text": "Löschungsankündigung\nThüringen Amtsgericht Jena HRB 304056\nAuto - Service Weih GmbH – Dermbach",
      "type": "Löschungsankündigung",
      "state": "Thüringen",
      "amtsgericht": "Amtsgericht Jena",
      "registernummer": "HRB 304056",
      "registerart": "HRB",
      "company_name": "Auto - Service Weih GmbH",
      "company_seat": "Dermbach",
      "details": "18.09.2025 (Bekanntmachungsdatum)\n\nThüringen Amtsgericht Jena HRB 304056\nLöschungsankündigung\n\nAuto - Service Weih GmbH\nGesellschaft mit beschränkter Haftung\nDermbach\n\nDas Registergericht beabsichtigt, die im Handelsregister eingetragene Gesellschaft wegen Vermögenslosigkeit nach § 394 FamFG von Amts wegen zu löschen. Die Frist zur Erhebung eines Widerspruchs gegen die beabsichtigte Löschung wird auf 6 Wochen festgesetzt."
    },
    {
      "date": "2025-09-18",
      "id": "130360",
      "original_text": "Registerbekanntmachung nach dem Umwandlungsgesetz\nThüringen Amtsgericht Jena HRA 505171\nDöring Reisen e.K. – Geismar",
      "type": "Registerbekanntmachung nach dem Umwandlungsgesetz",
      "state": "Thüringen",
      "amtsgericht": "Amtsgericht Jena",
      "registernummer": "HRA 505171",
      "registerart": "HRA",
      "company_name": "Döring Reisen e.K.",
      "company_seat": "Geismar",
      "details": "18.09.2025 (Bekanntmachungsdatum)\n\nThüringen Amtsgericht Jena HRA 505171\nRegisterbekanntmachung nach dem Umwandlungsgesetz 18.09.2025 (Eintragungsdatum)\n\nDöring Reisen e.K.\nEinzelkaufmann / Einzelkauffrau\nGeismar\n\nNicht eingetragen: Den Gläubigern der an der Ausgliederung beteiligten Rechtsträger, ist wenn sie binnen sechs Monaten nach dem Tag, an dem die Eintragung der Ausgliederung in das Register des Sitzes desjenigen Rechtsträgers, dessen Gläubiger sie sind, nach §§125, 19 Abs. 3 UmwG als bekanntgemacht gilt, ihren Anspruch nach Grund und Höhe schriftlich anmelden, Sicherheit zu leisten, soweit sie nicht Befriedigung verlangen können. Dieses Recht steht ihnen jedoch nur zu, wenn sie glaubhaft machen, daß durch die Ausgliederung die Erfüllung ihrer Forderung gefährdet wird."
    },
    {
      "date": "2025-09-18",
      "id": "130361",
      "original_text": "Löschungsankündigung\nNordrhein-Westfalen Amtsgericht Gelsenkirchen HRB 15545\nReuter Businessflight GmbH – Marl",
      "type": "Löschungsankündigung",
      "state": "Nordrhein-Westfalen",
      "amtsgericht": "Amtsgericht Gelsenkirchen",
      "registernummer": "HRB 15545",
      "registerart": "HRB",
      "company_name": "Reuter Businessflight GmbH",
      "company_seat": "Marl",
      "details": "18.09.2025 (Bekanntmachungsdatum)\n\nNordrhein-Westfalen Amtsgericht Gelsenkirchen HRB 15545\nLöschungsankündigung\n\nReuter Businessflight GmbH\nGesellschaft mit beschränkter Haftung\nMarl\n\nDas Gericht beabsichtigt, die im Handelsregister eingetragene Reuter Businessflight GmbH mit Sitz in Marl, HRB 15545, Amtsgericht Gelsenkirchen, wegen Vermögenslosigkeit zu löschen.\nHiermit wird denjenigen, die an der Unterlassung der Löschung ein berechtigtes Interesse haben, gem. § 394 Abs. 2 FamFG Gelegenheit gegeben, gegen dieses Vorhaben binnen eines Monats nach dieser Bekanntmachung Widerspruch einzulegen. Der Widerspruch kann schriftlich oder zu Protokoll der Geschäftsstelle erhoben werden."
    },
    {
      "date": "2025-09-18",
      "id": "130362",
      "original_text": "Registerbekanntmachung nach dem Umwandlungsgesetz\nHessen Amtsgericht Frankfurt am Main HRA 54032\nStefan Gollub Verwaltungs GmbH & Co. KG – Hofheim am Main",
      "type": "Registerbekanntmachung nach dem Umwandlungsgesetz",
      "state": "Hessen",
      "amtsgericht": "Amtsgericht Frankfurt am Main",
      "registernummer": "HRA 54032",
      "registerart": "HRA",
      "company_name": "Stefan Gollub Verwaltungs GmbH & Co. KG",
      "company_seat": "Hofheim am Main",
      "details": "18.09.2025 (Bekanntmachungsdatum)\n\nHessen Amtsgericht Frankfurt am Main HRA 54032\nRegisterbekanntmachung nach dem Umwandlungsgesetz 18.09.2025 (Eintragungsdatum)\n\nStefan Gollub Verwaltungs GmbH & Co. KG\nKommanditgesellschaft\nHofheim am Main\n\nDen Gläubigern der an der Ausgliederung beteiligten Rechtsträger ist, wenn sie binnen sechs Monaten nach dem Tag, an dem die Eintragung der Ausgliederung in das Register des Sitzes desjenigen Rechtsträgers, dessen Gläubiger sie sind, nach §§ 125, 19 Absatz 3 UmwG bekannt gemacht worden ist, ihren Anspruch nach Grund und Höhe schriftlich anmelden, Sicherheit zu leisten, soweit sie nicht Befriedigung verlangen können. Dieses Recht steht den Gläubigern jedoch nur zu, wenn sie glaubhaft machen, dass durch die Ausgliederung die Erfüllung ihrer Forderung gefährdet wird."
    },
    {
      "date": "2025-09-18",
      "id": "130363",
      "original_text": "Registerbekanntmachung nach dem Umwandlungsgesetz\nHessen Amtsgericht Frankfurt am Main HRB 121294\nPANDEMED GmbH – Eschborn",
      "type": "Registerbekanntmachung nach dem Umwandlungsgesetz",
      "state": "Hessen",
      "amtsgericht": "Amtsgericht Frankfurt am Main",
      "registernummer": "HRB 121294",
      "registerart": "HRB",
      "company_name": "PANDEMED GmbH",
      "company_seat": "Eschborn",
      "details": "18.09.2025 (Bekanntmachungsdatum)\n\nHessen Amtsgericht Frankfurt am Main HRB 121294\nRegisterbekanntmachung nach dem Umwandlungsgesetz 18.09.2025 (Eintragungsdatum)\n\nPANDEMED GmbH\nGesellschaft mit beschränkter Haftung\nEschborn\n\nDen Gläubigern der an der Verschmelzung beteiligten Rechtsträger ist, wenn sie binnen sechs Monaten nach dem Tag, an dem die Eintragung der Verschmelzung in das Register des Sitzes desjenigen Rechtsträgers, dessen Gläubiger sie sind, nach § 19 Absatz 3 UmwG bekannt gemacht worden ist, ihren Anspruch nach Grund und Höhe schriftlich anmelden, Sicherheit zu leisten, soweit sie nicht Befriedigung verlangen können. Dieses Recht steht den Gläubigern jedoch nur zu, wenn sie glaubhaft machen, dass durch die Verschmelzung die Erfüllung ihrer Forderung gefährdet wird."
    },
    {
      "date": "2025-09-18",
      "id": "130364",
      "original_text": "Sonstige Registerbekanntmachung\nHessen Amtsgericht Darmstadt VR 84472\nKulturradius e.V. – Wald-Michelbach",
      "type": "Sonstige Registerbekanntmachung",
      "state": "Hessen",
      "amtsgericht": "Amtsgericht Darmstadt",
      "registernummer": "VR 84472",
      "registerart": "VR",
      "company_name": "Kulturradius e.V.",
      "company_seat": "Wald-Michelbach",
      "details": "18.09.2025 (Bekanntmachungsdatum)\n\nHessen Amtsgericht Darmstadt VR 84472\nSonstige Registerbekanntmachung 18.09.2025 (Eintragungsdatum)\n\nKulturradius e.V.\neingetragener Verein\nWald-Michelbach\n\nDer Verein ist aufgelöst."
    },
    {
      "date": "2025-09-18",
      "id": "130365",
      "original_text": "Registerbekanntmachung nach dem Umwandlungsgesetz\nHessen Amtsgericht Gießen HRA 4309\nProCon automatic systems GmbH & Co.KG – Mücke",
      "type": "Registerbekanntmachung nach dem Umwandlungsgesetz",
      "state": "Hessen",
      "amtsgericht": "Amtsgericht Gießen",
      "registernummer": "HRA 4309",
      "registerart": "HRA",
      "company_name": "ProCon automatic systems GmbH & Co.KG",
      "company_seat": "Mücke",
      "details": "18.09.2025 (Bekanntmachungsdatum)\n\nHessen Amtsgericht Gießen HRA 4309\nRegisterbekanntmachung nach dem Umwandlungsgesetz 18.09.2025 (Eintragungsdatum)\n\nProCon automatic systems GmbH & Co.KG\nKommanditgesellschaft\nMücke\n\nDen Gläubigern der an der formwechselnden Umwandlung beteiligten Rechtsträger ist, wenn sie binnen sechs Monaten nach dem Tag, an dem die Eintragung der formwechselnden Umwandlung in das Register des Sitzes desjenigen Rechtsträgers, dessen Gläubiger sie sind, nach § 201 UmwG bekannt gemacht worden ist, ihren Anspruch nach Grund und Höhe schriftlich anmelden, Sicherheit zu leisten, soweit sie nicht Befriedigung verlangen können. Dieses Recht steht den Gläubigern jedoch nur zu, wenn sie glaubhaft machen, dass durch die formwechselnden Umwandlung die Erfüllung ihrer Forderung gefährdet wird."
    },
    {
      "date": "2025-09-18",
      "id": "130366",
      "original_text": "Registerbekanntmachung nach dem Umwandlungsgesetz\nHessen Amtsgericht Frankfurt am Main HRB 136004\nBlitz F24-461 GmbH – Frankfurt am Main",
      "type": "Registerbekanntmachung nach dem Umwandlungsgesetz",
      "state": "Hessen",
      "amtsgericht": "Amtsgericht Frankfurt am Main",
      "registernummer": "HRB 136004",
      "registerart": "HRB",
      "company_name": "Blitz F24-461 GmbH",
      "company_seat": "Frankfurt am Main",
      "details": "18.09.2025 (Bekanntmachungsdatum)\n\nHessen Amtsgericht Frankfurt am Main HRB 136004\nRegisterbekanntmachung nach dem Umwandlungsgesetz 18.09.2025 (Eintragungsdatum)\n\nBlitz F24-461 GmbH\nGesellschaft mit beschränkter Haftung\nFrankfurt am Main\n\nDen Gläubigern der Gesellschaft, deren Forderungen begründet worden sind, bevor die Eintragung der Beendigung des Vertrags in das Handelsregister nach § 10 HGB bekannt gemacht worden ist, ist vom anderen Vertragsteil Sicherheit zu leisten, wenn sie sich binnen seDen Gläubigern der an der Verschmelzung beteiligten Rechtsträger ist, wenn sie binnen sechs Monaten nach dem Tag, an dem die Eintragung der Verschmelzung in das Register des Sitzes desjenigen Rechtsträgers, dessen Gläubiger sie sind, nach § 19 Absatz 3 UmwG bekannt gemacht worden ist, ihren Anspruch nach Grund und Höhe schriftlich anmelden, Sicherheit zu leisten, soweit sie nicht Befriedigung verlangen können. Dieses Recht steht den Gläubigern jedoch nur zu, wenn sie glaubhaft machen, dass durch die Verschmelzung die Erfüllung ihrer Forderung gefährdet wird.chs Monaten nach dieser Bekanntmachung zu diesem Zweck bei ihm melden."
    },
    {
      "date": "2025-09-18",
      "id": "130367",
      "original_text": "Sonstige Registerbekanntmachung\nHessen Amtsgericht Wiesbaden HRB 8043\nInterRisk Versicherungs-AG Vienna Insurance Group – Wiesbaden",
      "type": "Sonstige Registerbekanntmachung",
      "state": "Hessen",
      "amtsgericht": "Amtsgericht Wiesbaden",
      "registernummer": "HRB 8043",
      "registerart": "HRB",
      "company_name": "InterRisk Versicherungs-AG Vienna Insurance Group",
      "company_seat": "Wiesbaden",
      "details": "18.09.2025 (Bekanntmachungsdatum)\n\nHessen Amtsgericht Wiesbaden HRB 8043\nSonstige Registerbekanntmachung 18.09.2025 (Eintragungsdatum)\n\nInterRisk Versicherungs-AG Vienna Insurance Group\nAktiengesellschaft\nWiesbaden\n\nDurch eine Änderung in den Personen der Aufsichtsratsmitglieder ist eine Liste der Mitglieder des Aufsichtsrates zum Handelsregister eingereicht worden."
    },
    {
      "date": "2025-09-18",
      "id": "130368",
      "original_text": "Registerbekanntmachung nach dem Umwandlungsgesetz\nHessen Amtsgericht Frankfurt am Main HRB 135396\nBlitz F24-448 GmbH – Frankfurt am Main",
      "type": "Registerbekanntmachung nach dem Umwandlungsgesetz",
      "state": "Hessen",
      "amtsgericht": "Amtsgericht Frankfurt am Main",
      "registernummer": "HRB 135396",
      "registerart": "HRB",
      "company_name": "Blitz F24-448 GmbH",
      "company_seat": "Frankfurt am Main",
      "details": "18.09.2025 (Bekanntmachungsdatum)\n\nHessen Amtsgericht Frankfurt am Main HRB 135396\nRegisterbekanntmachung nach dem Umwandlungsgesetz 18.09.2025 (Eintragungsdatum)\n\nBlitz F24-448 GmbH\nGesellschaft mit beschränkter Haftung\nFrankfurt am Main\n\nDen Gläubigern der an der Verschmelzung beteiligten Rechtsträger ist, wenn sie binnen sechs Monaten nach dem Tag, an dem die Eintragung der Verschmelzung in das Register des Sitzes desjenigen Rechtsträgers, dessen Gläubiger sie sind, nach § 19 Absatz 3 UmwG bekannt gemacht worden ist, ihren Anspruch nach Grund und Höhe schriftlich anmelden, Sicherheit zu leisten, soweit sie nicht Befriedigung verlangen können. Dieses Recht steht den Gläubigern jedoch nur zu, wenn sie glaubhaft machen, dass durch die Verschmelzung die Erfüllung ihrer Forderung gefährdet wird."
    },
    {
      "date": "2025-09-18",
      "id": "130369",
      "original_text": "Löschungsankündigung\nHessen Amtsgericht Wiesbaden HRB 29429\nAlphatouch UG (haftungsbeschränkt) – Wiesbaden",
      "type": "Löschungsankündigung",
      "state": "Hessen",
      "amtsgericht": "Amtsgericht Wiesbaden",
      "registernummer": "HRB 29429",
      "registerart": "HRB",
      "company_name": "Alphatouch UG (haftungsbeschränkt)",
      "company_seat": "Wiesbaden",
      "details": "18.09.2025 (Bekanntmachungsdatum)\n\nHessen Amtsgericht Wiesbaden HRB 29429\nLöschungsankündigung\n\nAlphatouch UG (haftungsbeschränkt)\nGesellschaft mit beschränkter Haftung\nWiesbaden\n\nDas Registergericht beabsichtigt die im Handelsregister eingetragene Gesellschaft von Amts wegen nach § 394 FamFG zu löschen. Die Frist zur Erhebung eines Widerspruchs gegen die beabsichtigte Löschung wird auf 3 Monate festgesetzt."
    },
    {
      "date": "2025-09-18",
      "id": "130370",
      "original_text": "Registerbekanntmachung nach dem Umwandlungsgesetz\nHessen Amtsgericht Frankfurt am Main HRB 114700\nECOVIS W+ST International GmbH Wirtschaftsprüfungsgesellschaft – Frankfurt am Main",
      "type": "Registerbekanntmachung nach dem Umwandlungsgesetz",
      "state": "Hessen",
      "amtsgericht": "Amtsgericht Frankfurt am Main",
      "registernummer": "HRB 114700",
      "registerart": "HRB",
      "company_name": "ECOVIS W+ST International GmbH Wirtschaftsprüfungsgesellschaft",
      "company_seat": "Frankfurt am Main",
      "details": "18.09.2025 (Bekanntmachungsdatum)\n\nHessen Amtsgericht Frankfurt am Main HRB 114700\nRegisterbekanntmachung nach dem Umwandlungsgesetz 18.09.2025 (Eintragungsdatum)\n\nECOVIS W+ST International GmbH Wirtschaftsprüfungsgesellschaft\nGesellschaft mit beschränkter Haftung\nFrankfurt am Main\n\nDen Gläubigern der an der Verschmelzung beteiligten Rechtsträger ist, wenn sie binnen sechs Monaten nach dem Tag, an dem die Eintragung der Verschmelzung in das Register des Sitzes desjenigen Rechtsträgers, dessen Gläubiger sie sind, nach § 19 Absatz 3 UmwG bekannt gemacht worden ist, ihren Anspruch nach Grund und Höhe schriftlich anmelden, Sicherheit zu leisten, soweit sie nicht Befriedigung verlangen können. Dieses Recht steht den Gläubigern jedoch nur zu, wenn sie glaubhaft machen, dass durch die Verschmelzung die Erfüllung ihrer Forderung gefährdet wird."
    },
    {
      "date": "2025-09-18",
      "id": "130371",
      "original_text": "Löschungsankündigung\nHessen Amtsgericht Frankfurt am Main HRB 73115\nKultur & Meer Touristik GmbH – Frankfurt am Main",
      "type": "Löschungsankündigung",
      "state": "Hessen",
      "amtsgericht": "Amtsgericht Frankfurt am Main",
      "registernummer": "HRB 73115",
      "registerart": "HRB",
      "company_name": "Kultur & Meer Touristik GmbH",
      "company_seat": "Frankfurt am Main",
      "details": "18.09.2025 (Bekanntmachungsdatum)\n\nHessen Amtsgericht Frankfurt am Main HRB 73115\nLöschungsankündigung 18.09.2025 (Eintragungsdatum)\n\nKultur & Meer Touristik GmbH\nGesellschaft mit beschränkter Haftung\nFrankfurt am Main\n\nDas Registergericht beabsichtigt die im Handelsregister eingetragene Gesellschaft von Amts wegen nach § 394 FamFG zu löschen. Die Frist zur Erhebung eines Widerspruchs gegen die beabsichtigte Löschung wird auf 1 Monat festgesetzt."
    },
    {
      "date": "2025-09-18",
      "id": "130372",
      "original_text": "Sonstige Registerbekanntmachung\nHessen Amtsgericht Frankfurt am Main HRB 117334\nGORE German Office Real Estate AG – Frankfurt am Main",
      "type": "Sonstige Registerbekanntmachung",
      "state": "Hessen",
      "amtsgericht": "Amtsgericht Frankfurt am Main",
      "registernummer": "HRB 117334",
      "registerart": "HRB",
      "company_name": "GORE German Office Real Estate AG",
      "company_seat": "Frankfurt am Main",
      "details": "18.09.2025 (Bekanntmachungsdatum)\n\nHessen Amtsgericht Frankfurt am Main HRB 117334\nSonstige Registerbekanntmachung\n\nGORE German Office Real Estate AG\nAktiengesellschaft\nFrankfurt am Main\n\nDurch eine Änderung in den Personen der Aufsichtsratsmitglieder ist eine Liste der Mitglieder des Aufsichtsrates zum Handelsregister eingereicht worden."
    },
    {
      "date": "2025-09-18",
      "id": "130373",
      "original_text": "Registerbekanntmachung nach dem Umwandlungsgesetz\nHessen Amtsgericht Frankfurt am Main HRB 125734\nMedPro Handels GmbH – Eschborn",
      "type": "Registerbekanntmachung nach dem Umwandlungsgesetz",
      "state": "Hessen",
      "amtsgericht": "Amtsgericht Frankfurt am Main",
      "registernummer": "HRB 125734",
      "registerart": "HRB",
      "company_name": "MedPro Handels GmbH",
      "company_seat": "Eschborn",
      "details": "18.09.2025 (Bekanntmachungsdatum)\n\nHessen Amtsgericht Frankfurt am Main HRB 125734\nRegisterbekanntmachung nach dem Umwandlungsgesetz 18.09.2025 (Eintragungsdatum)\n\nMedPro Handels GmbH\nGesellschaft mit beschränkter Haftung\nEschborn\n\nDen Gläubigern der an der Verschmelzung beteiligten Rechtsträger ist, wenn sie binnen sechs Monaten nach dem Tag, an dem die Eintragung der Verschmelzung in das Register des Sitzes desjenigen Rechtsträgers, dessen Gläubiger sie sind, nach § 19 Absatz 3 UmwG bekannt gemacht worden ist, ihren Anspruch nach Grund und Höhe schriftlich anmelden, Sicherheit zu leisten, soweit sie nicht Befriedigung verlangen können. Dieses Recht steht den Gläubigern jedoch nur zu, wenn sie glaubhaft machen, dass durch die Verschmelzung die Erfüllung ihrer Forderung gefährdet wird."
    },
    {
      "date": "2025-09-18",
      "id": "130374",
      "original_text": "Löschungsankündigung\nHessen Amtsgericht Wetzlar HRB 8539\nAnaniadis Immobilien und Verwaltung GmbH – Aßlar",
      "type": "Löschungsankündigung",
      "state": "Hessen",
      "amtsgericht": "Amtsgericht Wetzlar",
      "registernummer": "HRB 8539",
      "registerart": "HRB",
      "company_name": "Ananiadis Immobilien und Verwaltung GmbH",
      "company_seat": "Aßlar",
      "details": "18.09.2025 (Bekanntmachungsdatum)\n\nHessen Amtsgericht Wetzlar HRB 8539\nLöschungsankündigung\n\nAnaniadis Immobilien und Verwaltung GmbH\nGesellschaft mit beschränkter Haftung\nAßlar\n\nDas Registergericht beabsichtigt die im Handelsregister eingetragene Gesellschaft von Amts wegen nach § 394 FamFG zu löschen. Die Frist zur Erhebung eines Widerspruchs gegen die beabsichtigte Löschung wird auf 1 Monat festgesetzt."
    },
    {
      "date": "2025-09-18",
      "id": "130375",
      "original_text": "Registerbekanntmachung nach dem Umwandlungsgesetz\nHessen Amtsgericht Gießen HRB 12005\nElektrotechnik Weiß GmbH – Lauterbach (Hessen)",
      "type": "Registerbekanntmachung nach dem Umwandlungsgesetz",
      "state": "Hessen",
      "amtsgericht": "Amtsgericht Gießen",
      "registernummer": "HRB 12005",
      "registerart": "HRB",
      "company_name": "Elektrotechnik Weiß GmbH",
      "company_seat": "Lauterbach (Hessen)",
      "details": "18.09.2025 (Bekanntmachungsdatum)\n\nHessen Amtsgericht Gießen HRB 12005\nRegisterbekanntmachung nach dem Umwandlungsgesetz 18.09.2025 (Eintragungsdatum)\n\nElektrotechnik Weiß GmbH\nGesellschaft mit beschränkter Haftung\nLauterbach (Hessen)\n\nDen Gläubigern der an der Ausgliederung beteiligten Rechtsträger ist, wenn sie binnen sechs Monaten nach dem Tag, an dem die Eintragung der Ausgliederung in das Register des Sitzes desjenigen Rechtsträgers, dessen Gläubiger sie sind, nach §§ 125, 19 Absatz 3 UmwG bekannt gemacht worden ist, ihren Anspruch nach Grund und Höhe schriftlich anmelden, Sicherheit zu leisten, soweit sie nicht Befriedigung verlangen können. Dieses Recht steht den Gläubigern jedoch nur zu, wenn sie glaubhaft machen, dass durch die Ausgliederung die Erfüllung ihrer Forderung gefährdet wird."
    },
    {
      "date": "2025-09-18",
      "id": "130376",
      "original_text": "Registerbekanntmachung nach dem Umwandlungsgesetz\nHessen Amtsgericht Frankfurt am Main HRB 135396\nBlitz F24-448 GmbH – Frankfurt am Main",
      "type": "Registerbekanntmachung nach dem Umwandlungsgesetz",
      "state": "Hessen",
      "amtsgericht": "Amtsgericht Frankfurt am Main",
      "registernummer": "HRB 135396",
      "registerart": "HRB",
      "company_name": "Blitz F24-448 GmbH",
      "company_seat": "Frankfurt am Main",
      "details": "18.09.2025 (Bekanntmachungsdatum)\n\nHessen Amtsgericht Frankfurt am Main HRB 135396\nRegisterbekanntmachung nach dem Umwandlungsgesetz 18.09.2025 (Eintragungsdatum)\n\nBlitz F24-448 GmbH\nGesellschaft mit beschränkter Haftung\nFrankfurt am Main\n\nDen Gläubigern der an der Verschmelzung beteiligten Rechtsträger ist, wenn sie binnen sechs Monaten nach dem Tag, an dem die Eintragung der Verschmelzung in das Register des Sitzes desjenigen Rechtsträgers, dessen Gläubiger sie sind, nach § 19 Absatz 3 UmwG bekannt gemacht worden ist, ihren Anspruch nach Grund und Höhe schriftlich anmelden, Sicherheit zu leisten, soweit sie nicht Befriedigung verlangen können. Dieses Recht steht den Gläubigern jedoch nur zu, wenn sie glaubhaft machen, dass durch die Verschmelzung die Erfüllung ihrer Forderung gefährdet wird."
    },
    {
      "date": "2025-09-18",
      "id": "130377",
      "original_text": "Löschungsankündigung\nHessen Amtsgericht Frankfurt am Main HRB 117058\nIdeal Bau GmbH – Sulzbach",
      "type": "Löschungsankündigung",
      "state": "Hessen",
      "amtsgericht": "Amtsgericht Frankfurt am Main",
      "registernummer": "HRB 117058",
      "registerart": "HRB",
      "company_name": "Ideal Bau GmbH",
      "company_seat": "Sulzbach",
      "details": "18.09.2025 (Bekanntmachungsdatum)\n\nHessen Amtsgericht Frankfurt am Main HRB 117058\nLöschungsankündigung\n\nIdeal Bau GmbH\nGesellschaft mit beschränkter Haftung\nSulzbach\n\nEs ist beabsichtigt, die Gesellschaft wegen Vermögenslosigkeit gemäß § 394 FamFG von Amts wegen im Handelsregister zu löschen. Hiergegen kann innerhalb eines Monats nach dieser Veröffentlichung Widerspruch bei dem Amtsgericht Frankfurt am Main eingelegt werden."
    },
    {
      "date": "2025-09-18",
      "id": "130378",
      "original_text": "Registerbekanntmachung nach dem Umwandlungsgesetz\nHessen Amtsgericht Wetzlar HRB 4382\nRoos + Dr. Schlappig GmbH Steuerberatungsgesellschaft – Herborn-Merkenbach",
      "type": "Registerbekanntmachung nach dem Umwandlungsgesetz",
      "state": "Hessen",
      "amtsgericht": "Amtsgericht Wetzlar",
      "registernummer": "HRB 4382",
      "registerart": "HRB",
      "company_name": "Roos + Dr. Schlappig GmbH Steuerberatungsgesellschaft",
      "company_seat": "Herborn-Merkenbach",
      "details": "18.09.2025 (Bekanntmachungsdatum)\n\nHessen Amtsgericht Wetzlar HRB 4382\nRegisterbekanntmachung nach dem Umwandlungsgesetz 18.09.2025 (Eintragungsdatum)\n\nRoos + Dr. Schlappig GmbH Steuerberatungsgesellschaft\nGesellschaft mit beschränkter Haftung\nHerborn-Merkenbach\n\nDen Gläubigern der an der Verschmelzung beteiligten Rechtsträger ist, wenn sie binnen sechs Monaten nach dem Tag, an dem die Eintragung der Verschmelzung in das Register des Sitzes desjenigen Rechtsträgers, dessen Gläubiger sie sind, nach § 19 Absatz 3 UmwG bekannt gemacht worden ist, ihren Anspruch nach Grund und Höhe schriftlich anmelden, Sicherheit zu leisten, soweit sie nicht Befriedigung verlangen können. Dieses Recht steht den Gläubigern jedoch nur zu, wenn sie glaubhaft machen, dass durch die Verschmelzung die Erfüllung ihrer Forderung gefährdet wird."
    },
    {
      "date": "2025-09-18",
      "id": "130379",
      "original_text": "Löschungsankündigung\nHessen Amtsgericht Hanau HRB 95809\nRVH Projekt Management und Baudienstleistungen GmbH – Hanau",
      "type": "Löschungsankündigung",
      "state": "Hessen",
      "amtsgericht": "Amtsgericht Hanau",
      "registernummer": "HRB 95809",
      "registerart": "HRB",
      "company_name": "RVH Projekt Management und Baudienstleistungen GmbH",
      "company_seat": "Hanau",
      "details": "18.09.2025 (Bekanntmachungsdatum)\n\nHessen Amtsgericht Hanau HRB 95809\nLöschungsankündigung\n\nRVH Projekt Management und Baudienstleistungen GmbH\nGesellschaft mit beschränkter Haftung\nHanau\n\nDas Registergericht beabsichtigt die im Handelsregister eingetragene Gesellschaft von Amts wegen nach § 394 FamFG zu löschen. Die Frist zur Erhebung eines Widerspruchs gegen die beabsichtigte Löschung wird auf 3 Monate festgesetzt."
    },
    {
      "date": "2025-09-18",
      "id": "130380",
      "original_text": "Löschungsankündigung\nHessen Amtsgericht Darmstadt HRB 105238\nTimm GmbH – Nauheim",
      "type": "Löschungsankündigung",
      "state": "Hessen",
      "amtsgericht": "Amtsgericht Darmstadt",
      "registernummer": "HRB 105238",
      "registerart": "HRB",
      "company_name": "Timm GmbH",
      "company_seat": "Nauheim",
      "details": "18.09.2025 (Bekanntmachungsdatum)\n\nHessen Amtsgericht Darmstadt HRB 105238\nLöschungsankündigung\n\nTimm GmbH\nGesellschaft mit beschränkter Haftung\nNauheim\n\nDas Registergericht beabsichtigt die im Handelsregister eingetragene Gesellschaft von Amts wegen nach § 394 FamFG zu löschen. Die Frist zur Erhebung eines Widerspruchs gegen die beabsichtigte Löschung wird auf 3 Monate festgesetzt."
    },
    {
      "date": "2025-09-18",
      "id": "130381",
      "original_text": "Registerbekanntmachung nach dem Umwandlungsgesetz\nHessen Amtsgericht Gießen HRB 12269\nProCon automatic systems GmbH – Mücke",
      "type": "Registerbekanntmachung nach dem Umwandlungsgesetz",
      "state": "Hessen",
      "amtsgericht": "Amtsgericht Gießen",
      "registernummer": "HRB 12269",
      "registerart": "HRB",
      "company_name": "ProCon automatic systems GmbH",
      "company_seat": "Mücke",
      "details": "18.09.2025 (Bekanntmachungsdatum)\n\nHessen Amtsgericht Gießen HRB 12269\nRegisterbekanntmachung nach dem Umwandlungsgesetz 18.09.2025 (Eintragungsdatum)\n\nProCon automatic systems GmbH\nGesellschaft mit beschränkter Haftung\nMücke\n\nDen Gläubigern der an der formwechselnden Umwandlung beteiligten Rechtsträger ist, wenn sie binnen sechs Monaten nach dem Tag, an dem die Eintragung der formwechselnden Umwandlung in das Register des Sitzes desjenigen Rechtsträgers, dessen Gläubiger sie sind, nach § 201 UmwG bekannt gemacht worden ist, ihren Anspruch nach Grund und Höhe schriftlich anmelden, Sicherheit zu leisten, soweit sie nicht Befriedigung verlangen können. Dieses Recht steht den Gläubigern jedoch nur zu, wenn sie glaubhaft machen, dass durch die formwechselnden Umwandlung die Erfüllung ihrer Forderung gefährdet wird."
    },
    {
      "date": "2025-09-18",
      "id": "130382",
      "original_text": "Registerbekanntmachung nach dem Umwandlungsgesetz\nHessen Amtsgericht Frankfurt am Main HRA 53932\nStefan Gollub e.K. – Hofheim am Taunus",
      "type": "Registerbekanntmachung nach dem Umwandlungsgesetz",
      "state": "Hessen",
      "amtsgericht": "Amtsgericht Frankfurt am Main",
      "registernummer": "HRA 53932",
      "registerart": "HRA",
      "company_name": "Stefan Gollub e.K.",
      "company_seat": "Hofheim am Taunus",
      "details": "18.09.2025 (Bekanntmachungsdatum)\n\nHessen Amtsgericht Frankfurt am Main HRA 53932\nRegisterbekanntmachung nach dem Umwandlungsgesetz 18.09.2025 (Eintragungsdatum)\n\nStefan Gollub e.K.\nEinzelkaufmann / Einzelkauffrau\nHofheim am Taunus\n\nDen Gläubigern der an der Ausgliederung beteiligten Rechtsträger ist, wenn sie binnen sechs Monaten nach dem Tag, an dem die Eintragung der Ausgliederung in das Register des Sitzes desjenigen Rechtsträgers, dessen Gläubiger sie sind, nach §§ 125, 19 Absatz 3 UmwG bekannt gemacht worden ist, ihren Anspruch nach Grund und Höhe schriftlich anmelden, Sicherheit zu leisten, soweit sie nicht Befriedigung verlangen können. Dieses Recht steht den Gläubigern jedoch nur zu, wenn sie glaubhaft machen, dass durch die Ausgliederung die Erfüllung ihrer Forderung gefährdet wird."
    },
    {
      "date": "2025-09-18",
      "id": "130383",
      "original_text": "Registerbekanntmachung nach dem Umwandlungsgesetz\nHessen Amtsgericht Darmstadt HRB 101812\nPositioniert GmbH – Kelsterbach",
      "type": "Registerbekanntmachung nach dem Umwandlungsgesetz",
      "state": "Hessen",
      "amtsgericht": "Amtsgericht Darmstadt",
      "registernummer": "HRB 101812",
      "registerart": "HRB",
      "company_name": "Positioniert GmbH",
      "company_seat": "Kelsterbach",
      "details": "18.09.2025 (Bekanntmachungsdatum)\n\nHessen Amtsgericht Darmstadt HRB 101812\nRegisterbekanntmachung nach dem Umwandlungsgesetz 18.09.2025 (Eintragungsdatum)\n\nPositioniert GmbH\nGesellschaft mit beschränkter Haftung\nKelsterbach\n\nDen Gläubigern der an der Verschmelzung beteiligten Rechtsträger ist, wenn sie binnen sechs Monaten nach dem Tag, an dem die Eintragung der Verschmelzung in das Register des Sitzes derjenigen Rechtsträger deren Gläubiger sie sind, nach § 19 Absatz 3 UmwG bekannt gemacht worden ist, ihren Anspruch nach Grund und Höhe schriftlich anmelden, Sicherheit zu leisten, soweit sie nicht Befriedigung verlangen können. Dieses Recht steht den Gläubigern jedoch nur zu, wenn sie glaubhaft machen, dass durch die Verschmelzung die Erfüllung ihrer Forderung gefährdet wird."
    },
    {
      "date": "2025-09-18",
      "id": "130384",
      "original_text": "Registerbekanntmachung nach dem Umwandlungsgesetz\nHessen Amtsgericht Darmstadt HRB 32798\nHESA Innovations GmbH – Dieburg",
      "type": "Registerbekanntmachung nach dem Umwandlungsgesetz",
      "state": "Hessen",
      "amtsgericht": "Amtsgericht Darmstadt",
      "registernummer": "HRB 32798",
      "registerart": "HRB",
      "company_name": "HESA Innovations GmbH",
      "company_seat": "Dieburg",
      "details": "18.09.2025 (Bekanntmachungsdatum)\n\nHessen Amtsgericht Darmstadt HRB 32798\nRegisterbekanntmachung nach dem Umwandlungsgesetz 18.09.2025 (Eintragungsdatum)\n\nHESA Innovations GmbH\nGesellschaft mit beschränkter Haftung\nDieburg\n\nDen Gläubigern der an der Verschmelzung beteiligten Rechtsträger ist, wenn sie binnen sechs Monaten nach dem Tag, an dem die Eintragung der Verschmelzung in das Register des Sitzes derjenigen Rechtsträger deren Gläubiger sie sind, nach § 19 Absatz 3 UmwG bekannt gemacht worden ist, ihren Anspruch nach Grund und Höhe schriftlich anmelden, Sicherheit zu leisten, soweit sie nicht Befriedigung verlangen können. Dieses Recht steht den Gläubigern jedoch nur zu, wenn sie glaubhaft machen, dass durch die Verschmelzung die Erfüllung ihrer Forderung gefährdet wird."
    },
    {
      "date": "2025-09-18",
      "id": "130385",
      "original_text": "Sonstige Registerbekanntmachung\nHessen Amtsgericht Frankfurt am Main HRB 6670\nFrankfurter Aufbau-Aktiengesellschaft – Frankfurt am Main",
      "type": "Sonstige Registerbekanntmachung",
      "state": "Hessen",
      "amtsgericht": "Amtsgericht Frankfurt am Main",
      "registernummer": "HRB 6670",
      "registerart": "HRB",
      "company_name": "Frankfurter Aufbau-Aktiengesellschaft",
      "company_seat": "Frankfurt am Main",
      "details": "18.09.2025 (Bekanntmachungsdatum)\n\nHessen Amtsgericht Frankfurt am Main HRB 6670\nSonstige Registerbekanntmachung\n\nFrankfurter Aufbau-Aktiengesellschaft\nAktiengesellschaft\nFrankfurt am Main\n\nDurch eine Änderung in den Personen der Aufsichtsratsmitglieder ist eine Liste der Mitglieder des Aufsichtsrates zum Handelsregister eingereicht worden."
    },
    {
      "date": "2025-09-18",
      "id": "130386",
      "original_text": "Registerbekanntmachung nach dem Umwandlungsgesetz\nHessen Amtsgericht Frankfurt am Main HRB 135395\nBlitz F24-447 GmbH – Frankfurt am Main",
      "type": "Registerbekanntmachung nach dem Umwandlungsgesetz",
      "state": "Hessen",
      "amtsgericht": "Amtsgericht Frankfurt am Main",
      "registernummer": "HRB 135395",
      "registerart": "HRB",
      "company_name": "Blitz F24-447 GmbH",
      "company_seat": "Frankfurt am Main",
      "details": "18.09.2025 (Bekanntmachungsdatum)\n\nHessen Amtsgericht Frankfurt am Main HRB 135395\nRegisterbekanntmachung nach dem Umwandlungsgesetz 18.09.2025 (Eintragungsdatum)\n\nBlitz F24-447 GmbH\nGesellschaft mit beschränkter Haftung\nFrankfurt am Main\n\nDen Gläubigern der an der Verschmelzung beteiligten Rechtsträger ist, wenn sie binnen sechs Monaten nach dem Tag, an dem die Eintragung der Verschmelzung in das Register des Sitzes desjenigen Rechtsträgers, dessen Gläubiger sie sind, nach § 19 Absatz 3 UmwG bekannt gemacht worden ist, ihren Anspruch nach Grund und Höhe schriftlich anmelden, Sicherheit zu leisten, soweit sie nicht Befriedigung verlangen können. Dieses Recht steht den Gläubigern jedoch nur zu, wenn sie glaubhaft machen, dass durch die Verschmelzung die Erfüllung ihrer Forderung gefährdet wird."
    },
    {
      "date": "2025-09-18",
      "id": "130387",
      "original_text": "Registerbekanntmachung nach dem Umwandlungsgesetz\nHessen Amtsgericht Darmstadt HRB 32578\nWeber Verwaltungsgesellschaft mbH – Dieburg",
      "type": "Registerbekanntmachung nach dem Umwandlungsgesetz",
      "state": "Hessen",
      "amtsgericht": "Amtsgericht Darmstadt",
      "registernummer": "HRB 32578",
      "registerart": "HRB",
      "company_name": "Weber Verwaltungsgesellschaft mbH",
      "company_seat": "Dieburg",
      "details": "18.09.2025 (Bekanntmachungsdatum)\n\nHessen Amtsgericht Darmstadt HRB 32578\nRegisterbekanntmachung nach dem Umwandlungsgesetz 18.09.2025 (Eintragungsdatum)\n\nWeber Verwaltungsgesellschaft mbH\nGesellschaft mit beschränkter Haftung\nDieburg\n\nDen Gläubigern der an der Verschmelzung beteiligten Rechtsträger ist, wenn sie binnen sechs Monaten nach dem Tag, an dem die Eintragung der Verschmelzung in das Register des Sitzes derjenigen Rechtsträger deren Gläubiger sie sind, nach § 19 Absatz 3 UmwG bekannt gemacht worden ist, ihren Anspruch nach Grund und Höhe schriftlich anmelden, Sicherheit zu leisten, soweit sie nicht Befriedigung verlangen können. Dieses Recht steht den Gläubigern jedoch nur zu, wenn sie glaubhaft machen, dass durch die Verschmelzung die Erfüllung ihrer Forderung gefährdet wird."
    },
    {
      "date": "2025-09-18",
      "id": "130388",
      "original_text": "Einreichung neuer Dokumente\nHessen Amtsgericht Frankfurt am Main HRB 77306\nOYAK ANKER Bank GmbH – Frankfurt am Main",
      "type": "Einreichung neuer Dokumente",
      "state": "Hessen",
      "amtsgericht": "Amtsgericht Frankfurt am Main",
      "registernummer": "HRB 77306",
      "registerart": "HRB",
      "company_name": "OYAK ANKER Bank GmbH",
      "company_seat": "Frankfurt am Main",
      "details": "18.09.2025 (Bekanntmachungsdatum)\n\nHessen Amtsgericht Frankfurt am Main HRB 77306\nEinreichung neuer Dokumente 17.09.2025 (Eintragungsdatum)\n\nOYAK ANKER Bank GmbH\nGesellschaft mit beschränkter Haftung\nFrankfurt am Main\n\nDurch eine Änderung in den Personen der Aufsichtsratsmitglieder ist eine Liste der Mitglieder des Aufsichtsrates zum Handelsregister eingereicht worden."
    },
    {
      "date": "2025-09-18",
      "id": "130389",
      "original_text": "Registerbekanntmachung nach dem Umwandlungsgesetz\nHessen Amtsgericht Frankfurt am Main HRB 135615\noptus 1011. GmbH – Frankfurt am Main",
      "type": "Registerbekanntmachung nach dem Umwandlungsgesetz",
      "state": "Hessen",
      "amtsgericht": "Amtsgericht Frankfurt am Main",
      "registernummer": "HRB 135615",
      "registerart": "HRB",
      "company_name": "optus 1011. GmbH",
      "company_seat": "Frankfurt am Main",
      "details": "18.09.2025 (Bekanntmachungsdatum)\n\nHessen Amtsgericht Frankfurt am Main HRB 135615\nRegisterbekanntmachung nach dem Umwandlungsgesetz 18.09.2025 (Eintragungsdatum)\n\noptus 1011. GmbH\nGesellschaft mit beschränkter Haftung\nFrankfurt am Main\n\nDen Gläubigern der an der Verschmelzung beteiligten Rechtsträger ist, wenn sie binnen sechs Monaten nach dem Tag, an dem die Eintragung der Verschmelzung in das Register des Sitzes desjenigen Rechtsträgers, dessen Gläubiger sie sind, nach §§ 122a Absatz 2, 19 Absatz 3 UmwG bekannt gemacht worden ist, ihren Anspruch nach Grund und Höhe schriftlich anmelden, Sicherheit zu leisten, soweit sie nicht Befriedigung verlangen können. Dieses Recht steht den Gläubigern jedoch nur zu, wenn sie glaubhaft machen, dass durch die Verschmelzung die Erfüllung ihrer Forderung gefährdet wird."
    }
  ]
}