{
  "date": "2025-09-13",
  "date_of_scrape": "2025-10-27T07:36:48.195Z",
  "tool_version": "0.2.0",
  "number_of_announcements": 43,
  "announcements": [
    {
      "date": "2025-09-13",
      "id": "129205",
      "original_text": "Registerbekanntmachung nach dem Umwandlungsgesetz\nBayern Amtsgericht Hof HRA 478\nLinseis GmbH & Co. KG – Selb",
      "type": "Registerbekanntmachung nach dem Umwandlungsgesetz",
      "state": "Bayern",
      "amtsgericht": "Amtsgericht Hof",
      "registernummer": "HRA 478",
      "registerart": "HRA",
      "company_name": "Linseis GmbH & Co. KG",
      "company_seat": "Selb",
      "details": "13.09.2025 (Bekanntmachungsdatum)\n\nBayern Amtsgericht Hof HRA 478\nRegisterbekanntmachung nach dem Umwandlungsgesetz 12.09.2025 (Eintragungsdatum)\n\nLinseis GmbH & Co. KG\nKommanditgesellschaft\nSelb\n\nDen Gläubigern des formwechselnden Rechtsträgers ist, wenn sie binnen sechs Monaten nach dem Tag, an dem die Eintragung des Formwechsels nach § 201 UmwG als bekannt gemacht gilt, ihren Anspruch nach Grund und Höhe in Textform anmelden, Sicherheit zu leisten, soweit sie nicht Befriedigung verlangen können. Dieses Recht steht den Gläubigern jedoch nur zu, wenn sie glaubhaft machen, dass durch den Formwechsel die Erfüllung ihrer Forderung gefährdet wird."
    },
    {
      "date": "2025-09-13",
      "id": "129206",
      "original_text": "Löschungsankündigung\nBayern Amtsgericht München HRB 197701\n1voraus UG (haftungsbeschränkt) – Geretsried",
      "type": "Löschungsankündigung",
      "state": "Bayern",
      "amtsgericht": "Amtsgericht München",
      "registernummer": "HRB 197701",
      "registerart": "HRB",
      "company_name": "1voraus UG (haftungsbeschränkt)",
      "company_seat": "Geretsried",
      "details": "13.09.2025 (Bekanntmachungsdatum)\n\nBayern Amtsgericht München HRB 197701\nLöschungsankündigung 12.09.2025 (Eintragungsdatum)\n\n1voraus UG (haftungsbeschränkt)\nGesellschaft mit beschränkter Haftung\nGeretsried\n\nDas Registergericht beabsichtigt, die im Handelsregister eingetragene Gesellschaft wegen Vermögenslosigkeit von Amts wegen nach § 394 FamFG zu löschen. Die Frist zur Erhebung eines Widerspruchs ist auf drei Monate festgesetzt."
    },
    {
      "date": "2025-09-13",
      "id": "129207",
      "original_text": "Registerbekanntmachung nach dem Umwandlungsgesetz\nBayern Amtsgericht Augsburg HRB 10102\nAlpha-Handels- und Verwaltungs-GmbH – Augsburg",
      "type": "Registerbekanntmachung nach dem Umwandlungsgesetz",
      "state": "Bayern",
      "amtsgericht": "Amtsgericht Augsburg",
      "registernummer": "HRB 10102",
      "registerart": "HRB",
      "company_name": "Alpha-Handels- und Verwaltungs-GmbH",
      "company_seat": "Augsburg",
      "details": "13.09.2025 (Bekanntmachungsdatum)\n\nBayern Amtsgericht Augsburg HRB 10102\nRegisterbekanntmachung nach dem Umwandlungsgesetz 12.09.2025 (Eintragungsdatum)\n\nAlpha-Handels- und Verwaltungs-GmbH\nGesellschaft mit beschränkter Haftung\nAugsburg\n\nDen Gläubigern der an der Verschmelzung beteiligten Rechtsträger ist, wenn sie binnen sechs Monaten nach dem Tag, an dem die Eintragung der Verschmelzung in das Register des Sitzes desjenigen Rechtsträgers, dessen Gläubiger sie sind, nach § 19 Abs. 3 UmwG als bekannt gemacht gilt, ihren Anspruch nach Grund und Höhe in Textform anmelden, Sicherheit zu leisten, soweit sie nicht Befriedigung verlangen können. Dieses Recht steht den Gläubigern jedoch nur zu, wenn sie glaubhaft machen, dass durch die Verschmelzung die Erfüllung ihrer Forderung gefährdet wird."
    },
    {
      "date": "2025-09-13",
      "id": "129208",
      "original_text": "Löschungsankündigung\nBayern Amtsgericht Schweinfurt HRB 9240\nAbaco Projekt GmbH – Bad Kissingen",
      "type": "Löschungsankündigung",
      "state": "Bayern",
      "amtsgericht": "Amtsgericht Schweinfurt",
      "registernummer": "HRB 9240",
      "registerart": "HRB",
      "company_name": "Abaco Projekt GmbH",
      "company_seat": "Bad Kissingen",
      "details": "13.09.2025 (Bekanntmachungsdatum)\n\nBayern Amtsgericht Schweinfurt HRB 9240\nLöschungsankündigung\n\nAbaco Projekt GmbH\nGesellschaft mit beschränkter Haftung\nBad Kissingen\n\nDas Registergericht beabsichtigt, die im Handelsregister eingetragene Gesellschaft wegen Vermögenslosigkeit von Amts wegen nach § 394 FamFG zu löschen. Die Frist zur Erhebung eines Widerspruchs ist auf einen Monat festgesetzt."
    },
    {
      "date": "2025-09-13",
      "id": "129209",
      "original_text": "Einreichung neuer Dokumente\nBayern Amtsgericht Ingolstadt HRB 101738\nBAUER Maschinen GmbH – Schrobenhausen",
      "type": "Einreichung neuer Dokumente",
      "state": "Bayern",
      "amtsgericht": "Amtsgericht Ingolstadt",
      "registernummer": "HRB 101738",
      "registerart": "HRB",
      "company_name": "BAUER Maschinen GmbH",
      "company_seat": "Schrobenhausen",
      "details": "13.09.2025 (Bekanntmachungsdatum)\n\nBayern Amtsgericht Ingolstadt HRB 101738\nEinreichung neuer Dokumente\n\nBAUER Maschinen GmbH\nGesellschaft mit beschränkter Haftung\nSchrobenhausen\n\nDem Amtsgericht Ingolstadt -Registergericht- ist eine Liste der Mitglieder des Aufsichtsrats eingereicht worden, § 52 Abs. 3 S. 2 GmbHG."
    },
    {
      "date": "2025-09-13",
      "id": "129210",
      "original_text": "Registerbekanntmachung nach dem Umwandlungsgesetz\nBayern Amtsgericht München GnR 2896\nSOL Invest eG – Grünwald",
      "type": "Registerbekanntmachung nach dem Umwandlungsgesetz",
      "state": "Bayern",
      "amtsgericht": "Amtsgericht München",
      "registernummer": "GnR 2896",
      "registerart": "GnR",
      "company_name": "SOL Invest eG",
      "company_seat": "Grünwald",
      "details": "13.09.2025 (Bekanntmachungsdatum)\n\nBayern Amtsgericht München GnR 2896\nRegisterbekanntmachung nach dem Umwandlungsgesetz 12.09.2025 (Eintragungsdatum)\n\nSOL Invest eG\neingetragene Genossenschaft\nGrünwald\n\nDen Gläubigern des formwechselnden Rechtsträgers ist, wenn sie binnen sechs Monaten nach dem Tag, an dem die Eintragung des Formwechsels nach § 201 UmwG als bekannt gemacht gilt, ihren Anspruch nach Grund und Höhe in Textform anmelden, Sicherheit zu leisten, soweit sie nicht Befriedigung verlangen können. Dieses Recht steht den Gläubigern jedoch nur zu, wenn sie glaubhaft machen, dass durch den Formwechsel die Erfüllung ihrer Forderung gefährdet wird."
    },
    {
      "date": "2025-09-13",
      "id": "129211",
      "original_text": "Registerbekanntmachung nach dem Umwandlungsgesetz\nBayern Amtsgericht Fürth HRA 12554\nJS-Sicherheitstechnik e.K. – Oberasbach",
      "type": "Registerbekanntmachung nach dem Umwandlungsgesetz",
      "state": "Bayern",
      "amtsgericht": "Amtsgericht Fürth",
      "registernummer": "HRA 12554",
      "registerart": "HRA",
      "company_name": "JS-Sicherheitstechnik e.K.",
      "company_seat": "Oberasbach",
      "details": "13.09.2025 (Bekanntmachungsdatum)\n\nBayern Amtsgericht Fürth HRA 12554\nRegisterbekanntmachung nach dem Umwandlungsgesetz 12.09.2025 (Eintragungsdatum)\n\nJS-Sicherheitstechnik e.K.\nEinzelkaufmann / Einzelkauffrau\nOberasbach\n\nDen Gläubigern der an der Ausgliederung beteiligten Rechtsträger ist, wenn sie binnen sechs Monaten nach dem Tag, an dem die Eintragung der Ausgliederung in das Register des Sitzes desjenigen Rechtsträgers, dessen Gläubiger sie sind, nach §§ 125, 19 Abs. 3 UmwG als bekannt gemacht gilt, ihren Anspruch nach Grund und Höhe in Textform anmelden, Sicherheit zu leisten, soweit sie nicht Befriedigung verlangen können. Dieses Recht steht den Gläubigern jedoch nur zu, wenn sie glaubhaft machen, dass durch die Ausgliederung die Erfüllung ihrer Forderung gefährdet wird."
    },
    {
      "date": "2025-09-13",
      "id": "129212",
      "original_text": "Registerbekanntmachung nach dem Umwandlungsgesetz\nBayern Amtsgericht München HRB 304676\nup First GmbH – München",
      "type": "Registerbekanntmachung nach dem Umwandlungsgesetz",
      "state": "Bayern",
      "amtsgericht": "Amtsgericht München",
      "registernummer": "HRB 304676",
      "registerart": "HRB",
      "company_name": "up First GmbH",
      "company_seat": "München",
      "details": "13.09.2025 (Bekanntmachungsdatum)\n\nBayern Amtsgericht München HRB 304676\nRegisterbekanntmachung nach dem Umwandlungsgesetz 12.09.2025 (Eintragungsdatum)\n\nup First GmbH\nGesellschaft mit beschränkter Haftung\nMünchen\n\nDen Gläubigern der an der Verschmelzung beteiligten Rechtsträger ist, wenn sie binnen sechs Monaten nach dem Tag, an dem die Eintragung der Verschmelzung in das Register des Sitzes desjenigen Rechtsträgers, dessen Gläubiger sie sind, nach § 19 Abs. 3 UmwG als bekannt gemacht gilt, ihren Anspruch nach Grund und Höhe in Textform anmelden, Sicherheit zu leisten, soweit sie nicht Befriedigung verlangen können. Dieses Recht steht den Gläubigern jedoch nur zu, wenn sie glaubhaft machen, dass durch die Verschmelzung die Erfüllung ihrer Forderung gefährdet wird. Den Gläubigern der an der Verschmelzung beteiligten Rechtsträger ist, wenn sie binnen sechs Monaten nach dem Tag, an dem die Eintragung der Verschmelzung in das Register des Sitzes desjenigen Rechtsträgers, dessen Gläubiger sie sind, nach § 19 Abs. 3 UmwG als bekannt gemacht gilt, ihren Anspruch nach Grund und Höhe in Textform anmelden, Sicherheit zu leisten, soweit sie nicht Befriedigung verlangen können. Dieses Recht steht den Gläubigern jedoch nur zu, wenn sie glaubhaft machen, dass durch die Verschmelzung die Erfüllung ihrer Forderung gefährdet wird."
    },
    {
      "date": "2025-09-13",
      "id": "129213",
      "original_text": "Registerbekanntmachung nach dem Umwandlungsgesetz\nBayern Amtsgericht München HRB 258079\nFJA FBO Munich GmbH – München",
      "type": "Registerbekanntmachung nach dem Umwandlungsgesetz",
      "state": "Bayern",
      "amtsgericht": "Amtsgericht München",
      "registernummer": "HRB 258079",
      "registerart": "HRB",
      "company_name": "FJA FBO Munich GmbH",
      "company_seat": "München",
      "details": "13.09.2025 (Bekanntmachungsdatum)\n\nBayern Amtsgericht München HRB 258079\nRegisterbekanntmachung nach dem Umwandlungsgesetz 12.09.2025 (Eintragungsdatum)\n\nFJA FBO Munich GmbH\nGesellschaft mit beschränkter Haftung\nMünchen\n\nDen Gläubigern der an der Verschmelzung beteiligten Rechtsträger ist, wenn sie binnen sechs Monaten nach dem Tag, an dem die Eintragung der Verschmelzung in das Register des Sitzes desjenigen Rechtsträgers, dessen Gläubiger sie sind, nach § 19 Abs. 3 UmwG als bekannt gemacht gilt, ihren Anspruch nach Grund und Höhe in Textform anmelden, Sicherheit zu leisten, soweit sie nicht Befriedigung verlangen können. Dieses Recht steht den Gläubigern jedoch nur zu, wenn sie glaubhaft machen, dass durch die Verschmelzung die Erfüllung ihrer Forderung gefährdet wird."
    },
    {
      "date": "2025-09-13",
      "id": "129214",
      "original_text": "Registerbekanntmachung nach dem Umwandlungsgesetz\nBayern Amtsgericht Landshut HRB 11672\nBBS GmbH – Neufraunhofen",
      "type": "Registerbekanntmachung nach dem Umwandlungsgesetz",
      "state": "Bayern",
      "amtsgericht": "Amtsgericht Landshut",
      "registernummer": "HRB 11672",
      "registerart": "HRB",
      "company_name": "BBS GmbH",
      "company_seat": "Neufraunhofen",
      "details": "13.09.2025 (Bekanntmachungsdatum)\n\nBayern Amtsgericht Landshut HRB 11672\nRegisterbekanntmachung nach dem Umwandlungsgesetz 12.09.2025 (Eintragungsdatum)\n\nBBS GmbH\nGesellschaft mit beschränkter Haftung\nNeufraunhofen"
    },
    {
      "date": "2025-09-13",
      "id": "129215",
      "original_text": "Registerbekanntmachung nach dem Umwandlungsgesetz\nBayern Amtsgericht München HRA 121426\nMonica Gomis e.K. – München",
      "type": "Registerbekanntmachung nach dem Umwandlungsgesetz",
      "state": "Bayern",
      "amtsgericht": "Amtsgericht München",
      "registernummer": "HRA 121426",
      "registerart": "HRA",
      "company_name": "Monica Gomis e.K.",
      "company_seat": "München",
      "details": "13.09.2025 (Bekanntmachungsdatum)\n\nBayern Amtsgericht München HRA 121426\nRegisterbekanntmachung nach dem Umwandlungsgesetz 12.09.2025 (Eintragungsdatum)\n\nMonica Gomis e.K.\nEinzelkaufmann / Einzelkauffrau\nMünchen\n\nDen Gläubigern der an der Ausgliederung beteiligten Rechtsträger ist, wenn sie binnen sechs Monaten nach dem Tag, an dem die Eintragung der Ausgliederung in das Register des Sitzes desjenigen Rechtsträgers, dessen Gläubiger sie sind, nach §§ 125, 19 Abs. 3 UmwG als bekannt gemacht gilt, ihren Anspruch nach Grund und Höhe in Textform anmelden, Sicherheit zu leisten, soweit sie nicht Befriedigung verlangen können. Dieses Recht steht den Gläubigern jedoch nur zu, wenn sie glaubhaft machen, dass durch die Ausgliederung die Erfüllung ihrer Forderung gefährdet wird."
    },
    {
      "date": "2025-09-13",
      "id": "129216",
      "original_text": "Registerbekanntmachung nach dem Umwandlungsgesetz\nBayern Amtsgericht Augsburg HRB 33458\nDONAUTON GmbH – Forheim",
      "type": "Registerbekanntmachung nach dem Umwandlungsgesetz",
      "state": "Bayern",
      "amtsgericht": "Amtsgericht Augsburg",
      "registernummer": "HRB 33458",
      "registerart": "HRB",
      "company_name": "DONAUTON GmbH",
      "company_seat": "Forheim",
      "details": "13.09.2025 (Bekanntmachungsdatum)\n\nBayern Amtsgericht Augsburg HRB 33458\nRegisterbekanntmachung nach dem Umwandlungsgesetz 12.09.2025 (Eintragungsdatum)\n\nDONAUTON GmbH\nGesellschaft mit beschränkter Haftung\nForheim\n\nDen Gläubigern der an der Verschmelzung beteiligten Rechtsträger ist, wenn sie binnen sechs Monaten nach dem Tag, an dem die Eintragung der Verschmelzung in das Register des Sitzes desjenigen Rechtsträgers, dessen Gläubiger sie sind, nach § 19 Abs. 3 UmwG als bekannt gemacht gilt, ihren Anspruch nach Grund und Höhe in Textform anmelden, Sicherheit zu leisten, soweit sie nicht Befriedigung verlangen können. Dieses Recht steht den Gläubigern jedoch nur zu, wenn sie glaubhaft machen, dass durch die Verschmelzung die Erfüllung ihrer Forderung gefährdet wird."
    },
    {
      "date": "2025-09-13",
      "id": "129217",
      "original_text": "Registerbekanntmachung nach dem Umwandlungsgesetz\nBayern Amtsgericht München HRA 51281\nKOMET Gebäudereinigung und Servicedienste GmbH & Co. KG – München",
      "type": "Registerbekanntmachung nach dem Umwandlungsgesetz",
      "state": "Bayern",
      "amtsgericht": "Amtsgericht München",
      "registernummer": "HRA 51281",
      "registerart": "HRA",
      "company_name": "KOMET Gebäudereinigung und Servicedienste GmbH & Co. KG",
      "company_seat": "München",
      "details": "13.09.2025 (Bekanntmachungsdatum)\n\nBayern Amtsgericht München HRA 51281\nRegisterbekanntmachung nach dem Umwandlungsgesetz 12.09.2025 (Eintragungsdatum)\n\nKOMET Gebäudereinigung und Servicedienste GmbH & Co. KG\nKommanditgesellschaft\nMünchen\n\nDen Gläubigern der an der Spaltung beteiligten Rechtsträger ist, wenn sie binnen sechs Monaten nach dem Tag, an dem die Eintragung der Spaltung in das Register des Sitzes desjenigen Rechtsträgers, dessen Gläubiger sie sind, nach §§ 125, 19 Abs. 3 UmwG als bekannt gemacht gilt, ihren Anspruch nach Grund und Höhe in Textform anmelden, Sicherheit zu leisten, soweit sie nicht Befriedigung verlangen können. Dieses Recht steht den Gläubigern jedoch nur zu, wenn sie glaubhaft machen, dass durch die Spaltung die Erfüllung ihrer Forderung gefährdet wird."
    },
    {
      "date": "2025-09-13",
      "id": "129218",
      "original_text": "Registerbekanntmachung nach dem Umwandlungsgesetz\nBayern Amtsgericht Augsburg HRB 32343\nOP Management- und Beteiligungs GmbH – Gersthofen",
      "type": "Registerbekanntmachung nach dem Umwandlungsgesetz",
      "state": "Bayern",
      "amtsgericht": "Amtsgericht Augsburg",
      "registernummer": "HRB 32343",
      "registerart": "HRB",
      "company_name": "OP Management- und Beteiligungs GmbH",
      "company_seat": "Gersthofen",
      "details": "13.09.2025 (Bekanntmachungsdatum)\n\nBayern Amtsgericht Augsburg HRB 32343\nRegisterbekanntmachung nach dem Umwandlungsgesetz 12.09.2025 (Eintragungsdatum)\n\nOP Management- und Beteiligungs GmbH\nGesellschaft mit beschränkter Haftung\nGersthofen\n\nDen Gläubigern der an der Verschmelzung beteiligten Rechtsträger ist, wenn sie binnen sechs Monaten nach dem Tag, an dem die Eintragung der Verschmelzung in das Register des Sitzes desjenigen Rechtsträgers, dessen Gläubiger sie sind, nach § 19 Abs. 3 UmwG als bekannt gemacht gilt, ihren Anspruch nach Grund und Höhe in Textform anmelden, Sicherheit zu leisten, soweit sie nicht Befriedigung verlangen können. Dieses Recht steht den Gläubigern jedoch nur zu, wenn sie glaubhaft machen, dass durch die Verschmelzung die Erfüllung ihrer Forderung gefährdet wird."
    },
    {
      "date": "2025-09-13",
      "id": "129219",
      "original_text": "Registerbekanntmachung nach dem Umwandlungsgesetz\nBayern Amtsgericht Augsburg HRB 24456\nF&G Beteiligungen GmbH – Augsburg",
      "type": "Registerbekanntmachung nach dem Umwandlungsgesetz",
      "state": "Bayern",
      "amtsgericht": "Amtsgericht Augsburg",
      "registernummer": "HRB 24456",
      "registerart": "HRB",
      "company_name": "F&G Beteiligungen GmbH",
      "company_seat": "Augsburg",
      "details": "13.09.2025 (Bekanntmachungsdatum)\n\nBayern Amtsgericht Augsburg HRB 24456\nRegisterbekanntmachung nach dem Umwandlungsgesetz 12.09.2025 (Eintragungsdatum)\n\nF&G Beteiligungen GmbH\nGesellschaft mit beschränkter Haftung\nAugsburg\n\nDen Gläubigern der an der Verschmelzung beteiligten Rechtsträger ist, wenn sie binnen sechs Monaten nach dem Tag, an dem die Eintragung der Verschmelzung in das Register des Sitzes desjenigen Rechtsträgers, dessen Gläubiger sie sind, nach § 19 Abs. 3 UmwG als bekannt gemacht gilt, ihren Anspruch nach Grund und Höhe in Textform anmelden, Sicherheit zu leisten, soweit sie nicht Befriedigung verlangen können. Dieses Recht steht den Gläubigern jedoch nur zu, wenn sie glaubhaft machen, dass durch die Verschmelzung die Erfüllung ihrer Forderung gefährdet wird."
    },
    {
      "date": "2025-09-13",
      "id": "129220",
      "original_text": "Registerbekanntmachung nach dem Umwandlungsgesetz\nBayern Amtsgericht Landshut HRB 12569\nSchlöglmann GmbH – Neufraunhofen",
      "type": "Registerbekanntmachung nach dem Umwandlungsgesetz",
      "state": "Bayern",
      "amtsgericht": "Amtsgericht Landshut",
      "registernummer": "HRB 12569",
      "registerart": "HRB",
      "company_name": "Schlöglmann GmbH",
      "company_seat": "Neufraunhofen",
      "details": "13.09.2025 (Bekanntmachungsdatum)\n\nBayern Amtsgericht Landshut HRB 12569\nRegisterbekanntmachung nach dem Umwandlungsgesetz 12.09.2025 (Eintragungsdatum)\n\nSchlöglmann GmbH\nGesellschaft mit beschränkter Haftung\nNeufraunhofen\n\nDen Gläubigern der an der Verschmelzung beteiligten Rechtsträger ist, wenn sie binnen sechs Monaten nach dem Tag, an dem die Eintragung der Verschmelzung in das Register des Sitzes desjenigen Rechtsträgers, dessen Gläubiger sie sind, nach § 19 Abs. 3 UmwG als bekannt gemacht gilt, ihren Anspruch nach Grund und Höhe in Textform anmelden, Sicherheit zu leisten, soweit sie nicht Befriedigung verlangen können. Dieses Recht steht den Gläubigern jedoch nur zu, wenn sie glaubhaft machen, dass durch die Verschmelzung die Erfüllung ihrer Forderung gefährdet wird."
    },
    {
      "date": "2025-09-13",
      "id": "129221",
      "original_text": "Registerbekanntmachung nach dem Umwandlungsgesetz\nBayern Amtsgericht Nürnberg HRB 10285\nB8 Park GmbH – Freystadt",
      "type": "Registerbekanntmachung nach dem Umwandlungsgesetz",
      "state": "Bayern",
      "amtsgericht": "Amtsgericht Nürnberg",
      "registernummer": "HRB 10285",
      "registerart": "HRB",
      "company_name": "B8 Park GmbH",
      "company_seat": "Freystadt",
      "details": "13.09.2025 (Bekanntmachungsdatum)\n\nBayern Amtsgericht Nürnberg HRB 10285\nRegisterbekanntmachung nach dem Umwandlungsgesetz 12.09.2025 (Eintragungsdatum)\n\nB8 Park GmbH\nGesellschaft mit beschränkter Haftung\nFreystadt\n\nDen Gläubigern der an der Ausgliederung beteiligten Rechtsträger ist, wenn sie binnen sechs Monaten nach dem Tag, an dem die Eintragung der Ausgliederung in das Register des Sitzes desjenigen Rechtsträgers, dessen Gläubiger sie sind, nach §§ 125, 19 Abs. 3 UmwG als bekannt gemacht gilt, ihren Anspruch nach Grund und Höhe in Textform anmelden, Sicherheit zu leisten, soweit sie nicht Befriedigung verlangen können. Dieses Recht steht den Gläubigern jedoch nur zu, wenn sie glaubhaft machen, dass durch die Ausgliederung die Erfüllung ihrer Forderung gefährdet wird."
    },
    {
      "date": "2025-09-13",
      "id": "129222",
      "original_text": "Registerbekanntmachung nach dem Umwandlungsgesetz\nBayern Amtsgericht Augsburg GnR 203\nRaiffeisenbank Aindling eG – Aindling",
      "type": "Registerbekanntmachung nach dem Umwandlungsgesetz",
      "state": "Bayern",
      "amtsgericht": "Amtsgericht Augsburg",
      "registernummer": "GnR 203",
      "registerart": "GnR",
      "company_name": "Raiffeisenbank Aindling eG",
      "company_seat": "Aindling",
      "details": "13.09.2025 (Bekanntmachungsdatum)\n\nBayern Amtsgericht Augsburg GnR 203\nRegisterbekanntmachung nach dem Umwandlungsgesetz 12.09.2025 (Eintragungsdatum)\n\nRaiffeisenbank Aindling eG\neingetragene Genossenschaft\nAindling\n\nDen Gläubigern der an der Verschmelzung beteiligten Rechtsträger ist, wenn sie binnen sechs Monaten nach dem Tag, an dem die Eintragung der Verschmelzung in das Register des Sitzes desjenigen Rechtsträgers, dessen Gläubiger sie sind, nach § 19 Abs. 3 UmwG als bekannt gemacht gilt, ihren Anspruch nach Grund und Höhe in Textform anmelden, Sicherheit zu leisten, soweit sie nicht Befriedigung verlangen können. Dieses Recht steht den Gläubigern jedoch nur zu, wenn sie glaubhaft machen, dass durch die Verschmelzung die Erfüllung ihrer Forderung gefährdet wird."
    },
    {
      "date": "2025-09-13",
      "id": "129223",
      "original_text": "Registerbekanntmachung nach dem Umwandlungsgesetz\nBayern Amtsgericht Augsburg GnR 98\nRaiffeisen-Volksbank Wemding eG – Wemding",
      "type": "Registerbekanntmachung nach dem Umwandlungsgesetz",
      "state": "Bayern",
      "amtsgericht": "Amtsgericht Augsburg",
      "registernummer": "GnR 98",
      "registerart": "GnR",
      "company_name": "Raiffeisen-Volksbank Wemding eG",
      "company_seat": "Wemding",
      "details": "13.09.2025 (Bekanntmachungsdatum)\n\nBayern Amtsgericht Augsburg GnR 98\nRegisterbekanntmachung nach dem Umwandlungsgesetz 12.09.2025 (Eintragungsdatum)\n\nRaiffeisen-Volksbank Wemding eG\neingetragene Genossenschaft\nWemding\n\nDen Gläubigern der an der Verschmelzung beteiligten Rechtsträger ist, wenn sie binnen sechs Monaten nach dem Tag, an dem die Eintragung der Verschmelzung in das Register des Sitzes desjenigen Rechtsträgers, dessen Gläubiger sie sind, nach § 19 Abs. 3 UmwG als bekannt gemacht gilt, ihren Anspruch nach Grund und Höhe in Textform anmelden, Sicherheit zu leisten, soweit sie nicht Befriedigung verlangen können. Dieses Recht steht den Gläubigern jedoch nur zu, wenn sie glaubhaft machen, dass durch die Verschmelzung die Erfüllung ihrer Forderung gefährdet wird."
    },
    {
      "date": "2025-09-13",
      "id": "129224",
      "original_text": "Löschungsankündigung\nBayern Amtsgericht Nürnberg HRA 15481\nHKA Textilservice GmbH & Co. KG – Nürnberg",
      "type": "Löschungsankündigung",
      "state": "Bayern",
      "amtsgericht": "Amtsgericht Nürnberg",
      "registernummer": "HRA 15481",
      "registerart": "HRA",
      "company_name": "HKA Textilservice GmbH & Co. KG",
      "company_seat": "Nürnberg",
      "details": "13.09.2025 (Bekanntmachungsdatum)\n\nBayern Amtsgericht Nürnberg HRA 15481\nLöschungsankündigung\n\nHKA Textilservice GmbH & Co. KG\nKommanditgesellschaft\nNürnberg\n\nDas Registergericht beabsichtigt, die im Handelsregister eingetragene Firma wegen Vermögenslosigkeit von Amts wegen nach § 394 FamFG zu löschen. Die Frist zur Erhebung eines Widerspruchs ist auf einen Monat festgesetzt."
    },
    {
      "date": "2025-09-13",
      "id": "129225",
      "original_text": "Registerbekanntmachung nach dem Umwandlungsgesetz\nBayern Amtsgericht Augsburg GnR 96\nRaiffeisen-Volksbank Ries eG – Nördlingen",
      "type": "Registerbekanntmachung nach dem Umwandlungsgesetz",
      "state": "Bayern",
      "amtsgericht": "Amtsgericht Augsburg",
      "registernummer": "GnR 96",
      "registerart": "GnR",
      "company_name": "Raiffeisen-Volksbank Ries eG",
      "company_seat": "Nördlingen",
      "details": "13.09.2025 (Bekanntmachungsdatum)\n\nBayern Amtsgericht Augsburg GnR 96\nRegisterbekanntmachung nach dem Umwandlungsgesetz 12.09.2025 (Eintragungsdatum)\n\nRaiffeisen-Volksbank Ries eG\neingetragene Genossenschaft\nNördlingen\n\nDen Gläubigern der an der Verschmelzung beteiligten Rechtsträger ist, wenn sie binnen sechs Monaten nach dem Tag, an dem die Eintragung der Verschmelzung in das Register des Sitzes desjenigen Rechtsträgers, dessen Gläubiger sie sind, nach § 19 Abs. 3 UmwG als bekannt gemacht gilt, ihren Anspruch nach Grund und Höhe in Textform anmelden, Sicherheit zu leisten, soweit sie nicht Befriedigung verlangen können. Dieses Recht steht den Gläubigern jedoch nur zu, wenn sie glaubhaft machen, dass durch die Verschmelzung die Erfüllung ihrer Forderung gefährdet wird."
    },
    {
      "date": "2025-09-13",
      "id": "129226",
      "original_text": "Registerbekanntmachung nach dem Umwandlungsgesetz\nBayern Amtsgericht Nürnberg HRA 20241\nFrank Brandl e. K. – Freystadt",
      "type": "Registerbekanntmachung nach dem Umwandlungsgesetz",
      "state": "Bayern",
      "amtsgericht": "Amtsgericht Nürnberg",
      "registernummer": "HRA 20241",
      "registerart": "HRA",
      "company_name": "Frank Brandl e. K.",
      "company_seat": "Freystadt",
      "details": "13.09.2025 (Bekanntmachungsdatum)\n\nBayern Amtsgericht Nürnberg HRA 20241\nRegisterbekanntmachung nach dem Umwandlungsgesetz 12.09.2025 (Eintragungsdatum)\n\nFrank Brandl e. K.\nEinzelkaufmann / Einzelkauffrau\nFreystadt\n\nDen Gläubigern der an der Ausgliederung beteiligten Rechtsträger ist, wenn sie binnen sechs Monaten nach dem Tag, an dem die Eintragung der Ausgliederung in das Register des Sitzes desjenigen Rechtsträgers, dessen Gläubiger sie sind, nach §§ 125, 19 Abs. 3 UmwG als bekannt gemacht gilt, ihren Anspruch nach Grund und Höhe in Textform anmelden, Sicherheit zu leisten, soweit sie nicht Befriedigung verlangen können. Dieses Recht steht den Gläubigern jedoch nur zu, wenn sie glaubhaft machen, dass durch die Ausgliederung die Erfüllung ihrer Forderung gefährdet wird."
    },
    {
      "date": "2025-09-13",
      "id": "129227",
      "original_text": "Löschungsankündigung\nBayern Amtsgericht Nürnberg HRB 34720\nFITNIK GmbH – Lupburg",
      "type": "Löschungsankündigung",
      "state": "Bayern",
      "amtsgericht": "Amtsgericht Nürnberg",
      "registernummer": "HRB 34720",
      "registerart": "HRB",
      "company_name": "FITNIK GmbH",
      "company_seat": "Lupburg",
      "details": "13.09.2025 (Bekanntmachungsdatum)\n\nBayern Amtsgericht Nürnberg HRB 34720\nLöschungsankündigung\n\nFITNIK GmbH\nGesellschaft mit beschränkter Haftung\nLupburg\n\nDas Registergericht beabsichtigt, die im Handelsregister eingetragene Gesellschaft wegen Vermögenslosigkeit von Amts wegen nach § 394 FamFG zu löschen. Die Frist zur Erhebung eines Widerspruchs ist auf einen Monat festgesetzt."
    },
    {
      "date": "2025-09-13",
      "id": "129228",
      "original_text": "Registerbekanntmachung nach dem Umwandlungsgesetz\nBayern Amtsgericht Augsburg HRB 20702\nM + F Media und Facility GmbH – Augsburg",
      "type": "Registerbekanntmachung nach dem Umwandlungsgesetz",
      "state": "Bayern",
      "amtsgericht": "Amtsgericht Augsburg",
      "registernummer": "HRB 20702",
      "registerart": "HRB",
      "company_name": "M + F Media und Facility GmbH",
      "company_seat": "Augsburg",
      "details": "13.09.2025 (Bekanntmachungsdatum)\n\nBayern Amtsgericht Augsburg HRB 20702\nRegisterbekanntmachung nach dem Umwandlungsgesetz 12.09.2025 (Eintragungsdatum)\n\nM + F Media und Facility GmbH\nGesellschaft mit beschränkter Haftung\nAugsburg\n\nDen Gläubigern der an der Verschmelzung beteiligten Rechtsträger ist, wenn sie binnen sechs Monaten nach dem Tag, an dem die Eintragung der Verschmelzung in das Register des Sitzes desjenigen Rechtsträgers, dessen Gläubiger sie sind, nach § 19 Abs. 3 UmwG als bekannt gemacht gilt, ihren Anspruch nach Grund und Höhe in Textform anmelden, Sicherheit zu leisten, soweit sie nicht Befriedigung verlangen können. Dieses Recht steht den Gläubigern jedoch nur zu, wenn sie glaubhaft machen, dass durch die Verschmelzung die Erfüllung ihrer Forderung gefährdet wird."
    },
    {
      "date": "2025-09-13",
      "id": "129229",
      "original_text": "Löschungsankündigung\nBayern Amtsgericht Nürnberg HRB 33186\nFliesen- und Fugentechnik Schmidt UG (haftungsbeschränkt) – Schwabach",
      "type": "Löschungsankündigung",
      "state": "Bayern",
      "amtsgericht": "Amtsgericht Nürnberg",
      "registernummer": "HRB 33186",
      "registerart": "HRB",
      "company_name": "Fliesen- und Fugentechnik Schmidt UG (haftungsbeschränkt)",
      "company_seat": "Schwabach",
      "details": "13.09.2025 (Bekanntmachungsdatum)\n\nBayern Amtsgericht Nürnberg HRB 33186\nLöschungsankündigung\n\nFliesen- und Fugentechnik Schmidt UG (haftungsbeschränkt)\nGesellschaft mit beschränkter Haftung\nSchwabach\n\nDas Registergericht beabsichtigt, die im Handelsregister eingetragene Gesellschaft wegen Vermögenslosigkeit von Amts wegen nach § 394 FamFG zu löschen. Die Frist zur Erhebung eines Widerspruchs ist auf einen Monat festgesetzt."
    },
    {
      "date": "2025-09-13",
      "id": "129230",
      "original_text": "Löschungsankündigung\nBayern Amtsgericht München HRB 274900\nGASHI und METALIA UG (haftungsbeschränkt) – München",
      "type": "Löschungsankündigung",
      "state": "Bayern",
      "amtsgericht": "Amtsgericht München",
      "registernummer": "HRB 274900",
      "registerart": "HRB",
      "company_name": "GASHI und METALIA UG (haftungsbeschränkt)",
      "company_seat": "München",
      "details": "13.09.2025 (Bekanntmachungsdatum)\n\nBayern Amtsgericht München HRB 274900\nLöschungsankündigung 12.09.2025 (Eintragungsdatum)\n\nGASHI und METALIA UG (haftungsbeschränkt)\nGesellschaft mit beschränkter Haftung\nMünchen\n\nDas Registergericht beabsichtigt, die im Handelsregister eingetragene Gesellschaft wegen Vermögenslosigkeit von Amts wegen nach § 394 FamFG zu löschen. Die Frist zur Erhebung eines Widerspruchs ist auf drei Monate festgesetzt."
    },
    {
      "date": "2025-09-13",
      "id": "129231",
      "original_text": "Registerbekanntmachung nach dem Umwandlungsgesetz\nBayern Amtsgericht Landshut HRB 11517\nNETTEC GmbH – Neufraunhofen",
      "type": "Registerbekanntmachung nach dem Umwandlungsgesetz",
      "state": "Bayern",
      "amtsgericht": "Amtsgericht Landshut",
      "registernummer": "HRB 11517",
      "registerart": "HRB",
      "company_name": "NETTEC GmbH",
      "company_seat": "Neufraunhofen",
      "details": "13.09.2025 (Bekanntmachungsdatum)\n\nBayern Amtsgericht Landshut HRB 11517\nRegisterbekanntmachung nach dem Umwandlungsgesetz 12.09.2025 (Eintragungsdatum)\n\nNETTEC GmbH\nGesellschaft mit beschränkter Haftung\nNeufraunhofen\n\nDen Gläubigern der an der Verschmelzung beteiligten Rechtsträger ist, wenn sie binnen sechs Monaten nach dem Tag, an dem die Eintragung der Verschmelzung in das Register des Sitzes desjenigen Rechtsträgers, dessen Gläubiger sie sind, nach § 19 Abs. 3 UmwG als bekannt gemacht gilt, ihren Anspruch nach Grund und Höhe in Textform anmelden, Sicherheit zu leisten, soweit sie nicht Befriedigung verlangen können. Dieses Recht steht den Gläubigern jedoch nur zu, wenn sie glaubhaft machen, dass durch die Verschmelzung die Erfüllung ihrer Forderung gefährdet wird."
    },
    {
      "date": "2025-09-13",
      "id": "129232",
      "original_text": "Registerbekanntmachung nach dem Umwandlungsgesetz\nBayern Amtsgericht Augsburg HRB 27200\nDONAUTON Studio GmbH – Forheim",
      "type": "Registerbekanntmachung nach dem Umwandlungsgesetz",
      "state": "Bayern",
      "amtsgericht": "Amtsgericht Augsburg",
      "registernummer": "HRB 27200",
      "registerart": "HRB",
      "company_name": "DONAUTON Studio GmbH",
      "company_seat": "Forheim",
      "details": "13.09.2025 (Bekanntmachungsdatum)\n\nBayern Amtsgericht Augsburg HRB 27200\nRegisterbekanntmachung nach dem Umwandlungsgesetz 12.09.2025 (Eintragungsdatum)\n\nDONAUTON Studio GmbH\nGesellschaft mit beschränkter Haftung\nForheim\n\nDen Gläubigern der an der Verschmelzung beteiligten Rechtsträger ist, wenn sie binnen sechs Monaten nach dem Tag, an dem die Eintragung der Verschmelzung in das Register des Sitzes desjenigen Rechtsträgers, dessen Gläubiger sie sind, nach § 19 Abs. 3 UmwG als bekannt gemacht gilt, ihren Anspruch nach Grund und Höhe in Textform anmelden, Sicherheit zu leisten, soweit sie nicht Befriedigung verlangen können. Dieses Recht steht den Gläubigern jedoch nur zu, wenn sie glaubhaft machen, dass durch die Verschmelzung die Erfüllung ihrer Forderung gefährdet wird."
    },
    {
      "date": "2025-09-13",
      "id": "129233",
      "original_text": "Registerbekanntmachung nach dem Umwandlungsgesetz\nBayern Amtsgericht Augsburg HRB 39058\nDG FirmenMedien Verwaltungs GmbH – Augsburg",
      "type": "Registerbekanntmachung nach dem Umwandlungsgesetz",
      "state": "Bayern",
      "amtsgericht": "Amtsgericht Augsburg",
      "registernummer": "HRB 39058",
      "registerart": "HRB",
      "company_name": "DG FirmenMedien Verwaltungs GmbH",
      "company_seat": "Augsburg",
      "details": "13.09.2025 (Bekanntmachungsdatum)\n\nBayern Amtsgericht Augsburg HRB 39058\nRegisterbekanntmachung nach dem Umwandlungsgesetz 12.09.2025 (Eintragungsdatum)\n\nDG FirmenMedien Verwaltungs GmbH\nGesellschaft mit beschränkter Haftung\nAugsburg\n\nDen Gläubigern der an der Verschmelzung beteiligten Rechtsträger ist, wenn sie binnen sechs Monaten nach dem Tag, an dem die Eintragung der Verschmelzung in das Register des Sitzes desjenigen Rechtsträgers, dessen Gläubiger sie sind, nach § 19 Abs. 3 UmwG als bekannt gemacht gilt, ihren Anspruch nach Grund und Höhe in Textform anmelden, Sicherheit zu leisten, soweit sie nicht Befriedigung verlangen können. Dieses Recht steht den Gläubigern jedoch nur zu, wenn sie glaubhaft machen, dass durch die Verschmelzung die Erfüllung ihrer Forderung gefährdet wird."
    },
    {
      "date": "2025-09-13",
      "id": "129234",
      "original_text": "Registerbekanntmachung nach dem Umwandlungsgesetz\nBayern Amtsgericht Nürnberg HRB 31686\nBRITTING STUCK GmbH – Neunkirchen a. Sand",
      "type": "Registerbekanntmachung nach dem Umwandlungsgesetz",
      "state": "Bayern",
      "amtsgericht": "Amtsgericht Nürnberg",
      "registernummer": "HRB 31686",
      "registerart": "HRB",
      "company_name": "BRITTING STUCK GmbH",
      "company_seat": "Neunkirchen a. Sand",
      "details": "13.09.2025 (Bekanntmachungsdatum)\n\nBayern Amtsgericht Nürnberg HRB 31686\nRegisterbekanntmachung nach dem Umwandlungsgesetz 12.09.2025 (Eintragungsdatum)\n\nBRITTING STUCK GmbH\nGesellschaft mit beschränkter Haftung\nNeunkirchen a. Sand\n\nDen Gläubigern der an der Verschmelzung beteiligten Rechtsträger ist, wenn sie binnen sechs Monaten nach dem Tag, an dem die Eintragung der Verschmelzung in das Register des Sitzes desjenigen Rechtsträgers, dessen Gläubiger sie sind, nach § 19 Abs. 3 UmwG als bekannt gemacht gilt, ihren Anspruch nach Grund und Höhe in Textform anmelden, Sicherheit zu leisten, soweit sie nicht Befriedigung verlangen können. Dieses Recht steht den Gläubigern jedoch nur zu, wenn sie glaubhaft machen, dass durch die Verschmelzung die Erfüllung ihrer Forderung gefährdet wird."
    },
    {
      "date": "2025-09-13",
      "id": "129235",
      "original_text": "Registerbekanntmachung nach dem Umwandlungsgesetz\nBayern Amtsgericht Augsburg HRB 37972\nOP Holding GmbH – Gersthofen",
      "type": "Registerbekanntmachung nach dem Umwandlungsgesetz",
      "state": "Bayern",
      "amtsgericht": "Amtsgericht Augsburg",
      "registernummer": "HRB 37972",
      "registerart": "HRB",
      "company_name": "OP Holding GmbH",
      "company_seat": "Gersthofen",
      "details": "13.09.2025 (Bekanntmachungsdatum)\n\nBayern Amtsgericht Augsburg HRB 37972\nRegisterbekanntmachung nach dem Umwandlungsgesetz 12.09.2025 (Eintragungsdatum)\n\nOP Holding GmbH\nGesellschaft mit beschränkter Haftung\nGersthofen\n\nDen Gläubigern der an der Verschmelzung beteiligten Rechtsträger ist, wenn sie binnen sechs Monaten nach dem Tag, an dem die Eintragung der Verschmelzung in das Register des Sitzes desjenigen Rechtsträgers, dessen Gläubiger sie sind, nach § 19 Abs. 3 UmwG als bekannt gemacht gilt, ihren Anspruch nach Grund und Höhe in Textform anmelden, Sicherheit zu leisten, soweit sie nicht Befriedigung verlangen können. Dieses Recht steht den Gläubigern jedoch nur zu, wenn sie glaubhaft machen, dass durch die Verschmelzung die Erfüllung ihrer Forderung gefährdet wird."
    },
    {
      "date": "2025-09-13",
      "id": "129236",
      "original_text": "Registerbekanntmachung nach dem Umwandlungsgesetz\nNordrhein-Westfalen Amtsgericht Bad Oeynhausen HRA 7526\nBack-System GmbH & Co. KG '05 – Löhne",
      "type": "Registerbekanntmachung nach dem Umwandlungsgesetz",
      "state": "Nordrhein-Westfalen",
      "amtsgericht": "Amtsgericht Bad Oeynhausen",
      "registernummer": "HRA 7526",
      "registerart": "HRA",
      "company_name": "Back-System GmbH & Co. KG '05",
      "company_seat": "Löhne",
      "details": "13.09.2025 (Bekanntmachungsdatum)\n\nNordrhein-Westfalen Amtsgericht Bad Oeynhausen HRA 7526\nRegisterbekanntmachung nach dem Umwandlungsgesetz 13.09.2025 (Eintragungsdatum)\n\nBack-System GmbH & Co. KG '05\nKommanditgesellschaft\nLöhne\n\nDen Gläubigern der an der Verschmelzung beteiligten Rechtsträger ist, wenn sie binnen sechs Monaten nach dem Tag, an dem die Eintragung der Verschmelzung in das Register des Sitzes derjenigen Rechtsträger deren Gläubiger sie sind, nach § 19 Absatz 3 UmwG als bekanntgemacht gilt, ihren Anspruch nach Grund und Höhe schriftlich anmelden, Sicherheit zu leisten, soweit sie nicht Befriedigung verlangen können. Dieses Recht steht den Gläubigern jedoch nur zu, wenn sie glaubhaft machen, dass durch die Verschmelzung die Erfüllung ihrer Forderung gefährdet wird."
    },
    {
      "date": "2025-09-13",
      "id": "129237",
      "original_text": "Registerbekanntmachung nach dem Umwandlungsgesetz\nNordrhein-Westfalen Amtsgericht Bad Oeynhausen HRA 2492\nBack-System GmbH & Co. KG'01 – Löhne",
      "type": "Registerbekanntmachung nach dem Umwandlungsgesetz",
      "state": "Nordrhein-Westfalen",
      "amtsgericht": "Amtsgericht Bad Oeynhausen",
      "registernummer": "HRA 2492",
      "registerart": "HRA",
      "company_name": "Back-System GmbH & Co. KG'01",
      "company_seat": "Löhne",
      "details": "13.09.2025 (Bekanntmachungsdatum)\n\nNordrhein-Westfalen Amtsgericht Bad Oeynhausen HRA 2492\nRegisterbekanntmachung nach dem Umwandlungsgesetz 13.09.2025 (Eintragungsdatum)\n\nBack-System GmbH & Co. KG'01\nKommanditgesellschaft\nLöhne\n\nDen Gläubigern der an der Verschmelzung beteiligten Rechtsträger ist, wenn sie binnen sechs Monaten nach dem Tag, an dem die Eintragung der Verschmelzung in das Register des Sitzes derjenigen Rechtsträger deren Gläubiger sie sind, nach § 19 Absatz 3 UmwG als bekanntgemacht gilt, ihren Anspruch nach Grund und Höhe schriftlich anmelden, Sicherheit zu leisten, soweit sie nicht Befriedigung verlangen können. Dieses Recht steht den Gläubigern jedoch nur zu, wenn sie glaubhaft machen, dass durch die Verschmelzung die Erfüllung ihrer Forderung gefährdet wird."
    },
    {
      "date": "2025-09-13",
      "id": "129238",
      "original_text": "Registerbekanntmachung nach dem Umwandlungsgesetz\nNordrhein-Westfalen Amtsgericht Bad Oeynhausen HRB 16644\nHEROPLAS GmbH – Bünde",
      "type": "Registerbekanntmachung nach dem Umwandlungsgesetz",
      "state": "Nordrhein-Westfalen",
      "amtsgericht": "Amtsgericht Bad Oeynhausen",
      "registernummer": "HRB 16644",
      "registerart": "HRB",
      "company_name": "HEROPLAS GmbH",
      "company_seat": "Bünde",
      "details": "13.09.2025 (Bekanntmachungsdatum)\n\nNordrhein-Westfalen Amtsgericht Bad Oeynhausen HRB 16644\nRegisterbekanntmachung nach dem Umwandlungsgesetz 13.09.2025 (Eintragungsdatum)\n\nHEROPLAS GmbH\nGesellschaft mit beschränkter Haftung\nBünde\n\nDen Gläubigern der an der Verschmelzung beteiligten Rechtsträger ist, wenn sie binnen sechs Monaten nach dem Tag, an dem die Eintragung der Verschmelzung in das Register des Sitzes desjenigen Rechtsträgers, dessen Gläubiger sie sind, nach § 19 Absatz 3 UmwG als bekanntgemacht gilt, ihren Anspruch nach Grund und Höhe schriftlich anmelden, Sicherheit zu leisten, soweit sie nicht Befriedigung verlangen können. Dieses Recht steht den Gläubigern jedoch nur zu, wenn sie glaubhaft machen, dass durch die Verschmelzung die Erfüllung ihrer Forderung gefährdet wird."
    },
    {
      "date": "2025-09-13",
      "id": "129239",
      "original_text": "Registerbekanntmachung nach dem Umwandlungsgesetz\nNordrhein-Westfalen Amtsgericht Bad Oeynhausen HRB 10008\nGero Holding AG – Preußisch Oldendorf",
      "type": "Registerbekanntmachung nach dem Umwandlungsgesetz",
      "state": "Nordrhein-Westfalen",
      "amtsgericht": "Amtsgericht Bad Oeynhausen",
      "registernummer": "HRB 10008",
      "registerart": "HRB",
      "company_name": "Gero Holding AG",
      "company_seat": "Preußisch Oldendorf",
      "details": "13.09.2025 (Bekanntmachungsdatum)\n\nNordrhein-Westfalen Amtsgericht Bad Oeynhausen HRB 10008\nRegisterbekanntmachung nach dem Umwandlungsgesetz 13.09.2025 (Eintragungsdatum)\n\nGero Holding AG\nAktiengesellschaft\nPreußisch Oldendorf\n\nDen Gläubigern der an der Verschmelzung beteiligten Rechtsträger ist, wenn sie binnen sechs Monaten nach dem Tag, an dem die Eintragung der Verschmelzung in das Register des Sitzes desjenigen Rechtsträgers, dessen Gläubiger sie sind, nach § 19 Absatz 3 UmwG als bekanntgemacht gilt, ihren Anspruch nach Grund und Höhe schriftlich anmelden, Sicherheit zu leisten, soweit sie nicht Befriedigung verlangen können. Dieses Recht steht den Gläubigern jedoch nur zu, wenn sie glaubhaft machen, dass durch die Verschmelzung die Erfüllung ihrer Forderung gefährdet wird."
    },
    {
      "date": "2025-09-13",
      "id": "129240",
      "original_text": "Registerbekanntmachung nach dem Umwandlungsgesetz\nNordrhein-Westfalen Amtsgericht Bad Oeynhausen HRB 19803\nGERO Verwaltungs GmbH – Preußisch Oldendorf",
      "type": "Registerbekanntmachung nach dem Umwandlungsgesetz",
      "state": "Nordrhein-Westfalen",
      "amtsgericht": "Amtsgericht Bad Oeynhausen",
      "registernummer": "HRB 19803",
      "registerart": "HRB",
      "company_name": "GERO Verwaltungs GmbH",
      "company_seat": "Preußisch Oldendorf",
      "details": "13.09.2025 (Bekanntmachungsdatum)\n\nNordrhein-Westfalen Amtsgericht Bad Oeynhausen HRB 19803\nRegisterbekanntmachung nach dem Umwandlungsgesetz 13.09.2025 (Eintragungsdatum)\n\nGERO Verwaltungs GmbH\nGesellschaft mit beschränkter Haftung\nPreußisch Oldendorf\n\nDen Gläubigern der an der Verschmelzung beteiligten Rechtsträger ist, wenn sie binnen sechs Monaten nach dem Tag, an dem die Eintragung der Verschmelzung in das Register des Sitzes desjenigen Rechtsträgers, dessen Gläubiger sie sind, nach § 19 Absatz 3 UmwG als bekanntgemacht gilt, ihren Anspruch nach Grund und Höhe schriftlich anmelden, Sicherheit zu leisten, soweit sie nicht Befriedigung verlangen können. Dieses Recht steht den Gläubigern jedoch nur zu, wenn sie glaubhaft machen, dass durch die Verschmelzung die Erfüllung ihrer Forderung gefährdet wird."
    },
    {
      "date": "2025-09-13",
      "id": "129241",
      "original_text": "Registerbekanntmachung nach dem Umwandlungsgesetz\nNordrhein-Westfalen Amtsgericht Münster HRB 19779\nSG Management GmbH – Münster",
      "type": "Registerbekanntmachung nach dem Umwandlungsgesetz",
      "state": "Nordrhein-Westfalen",
      "amtsgericht": "Amtsgericht Münster",
      "registernummer": "HRB 19779",
      "registerart": "HRB",
      "company_name": "SG Management GmbH",
      "company_seat": "Münster",
      "details": "13.09.2025 (Bekanntmachungsdatum)\n\nNordrhein-Westfalen Amtsgericht Münster HRB 19779\nRegisterbekanntmachung nach dem Umwandlungsgesetz\n\nSG Management GmbH\nGesellschaft mit beschränkter Haftung\nMünster\n\nDen Gläubigern der an der Verschmelzung beteiligten Rechtsträger ist, wenn sie binnen sechs Monaten nach dem Tag, an dem die Eintragung der Verschmelzung in das Register des Sitzes desjenigen Rechtsträgers, dessen Gläubiger sie sind, nach § 19 Absatz 3 UmwG als bekanntgemacht gilt, ihren Anspruch nach Grund und Höhe schriftlich anmelden, Sicherheit zu leisten, soweit sie nicht Befriedigung verlangen können. Dieses Recht steht den Gläubigern jedoch nur zu, wenn sie glaubhaft machen, dass durch die Verschmelzung die Erfüllung ihrer Forderung gefährdet wird."
    },
    {
      "date": "2025-09-13",
      "id": "129242",
      "original_text": "Registerbekanntmachung nach dem Umwandlungsgesetz\nNordrhein-Westfalen Amtsgericht Münster HRB 17403\nieQ Zentrale Dienste Verwaltungs-GmbH – Münster",
      "type": "Registerbekanntmachung nach dem Umwandlungsgesetz",
      "state": "Nordrhein-Westfalen",
      "amtsgericht": "Amtsgericht Münster",
      "registernummer": "HRB 17403",
      "registerart": "HRB",
      "company_name": "ieQ Zentrale Dienste Verwaltungs-GmbH",
      "company_seat": "Münster",
      "details": "13.09.2025 (Bekanntmachungsdatum)\n\nNordrhein-Westfalen Amtsgericht Münster HRB 17403\nRegisterbekanntmachung nach dem Umwandlungsgesetz 13.09.2025 (Eintragungsdatum)\n\nieQ Zentrale Dienste Verwaltungs-GmbH\nGesellschaft mit beschränkter Haftung\nMünster\n\nDen Gläubigern der an der Verschmelzung beteiligten Rechtsträger ist, wenn sie binnen sechs Monaten nach dem Tag, an dem die Eintragung der Verschmelzung in das Register des Sitzes desjenigen Rechtsträgers, dessen Gläubiger sie sind, nach § 19 Absatz 3 UmwG als bekanntgemacht gilt, ihren Anspruch nach Grund und Höhe schriftlich anmelden, Sicherheit zu leisten, soweit sie nicht Befriedigung verlangen können. Dieses Recht steht den Gläubigern jedoch nur zu, wenn sie glaubhaft machen, dass durch die Verschmelzung die Erfüllung ihrer Forderung gefährdet wird."
    },
    {
      "date": "2025-09-13",
      "id": "129243",
      "original_text": "Registerbekanntmachung nach dem Umwandlungsgesetz\nNordrhein-Westfalen Amtsgericht Bad Oeynhausen HRA 2511\nBack-System GmbH & Co. KG'02 – Löhne",
      "type": "Registerbekanntmachung nach dem Umwandlungsgesetz",
      "state": "Nordrhein-Westfalen",
      "amtsgericht": "Amtsgericht Bad Oeynhausen",
      "registernummer": "HRA 2511",
      "registerart": "HRA",
      "company_name": "Back-System GmbH & Co. KG'02",
      "company_seat": "Löhne",
      "details": "13.09.2025 (Bekanntmachungsdatum)\n\nNordrhein-Westfalen Amtsgericht Bad Oeynhausen HRA 2511\nRegisterbekanntmachung nach dem Umwandlungsgesetz 13.09.2025 (Eintragungsdatum)\n\nBack-System GmbH & Co. KG'02\nKommanditgesellschaft\nLöhne\n\nDen Gläubigern der an der Verschmelzung beteiligten Rechtsträger ist, wenn sie binnen sechs Monaten nach dem Tag, an dem die Eintragung der Verschmelzung in das Register des Sitzes derjenigen Rechtsträger deren Gläubiger sie sind, nach § 19 Absatz 3 UmwG als bekanntgemacht gilt, ihren Anspruch nach Grund und Höhe schriftlich anmelden, Sicherheit zu leisten, soweit sie nicht Befriedigung verlangen können. Dieses Recht steht den Gläubigern jedoch nur zu, wenn sie glaubhaft machen, dass durch die Verschmelzung die Erfüllung ihrer Forderung gefährdet wird."
    },
    {
      "date": "2025-09-13",
      "id": "129244",
      "original_text": "Registerbekanntmachung nach dem Umwandlungsgesetz\nNordrhein-Westfalen Amtsgericht Münster HRB 5173\nCorona Dentis Zahntechnisches Labor GmbH – Münster",
      "type": "Registerbekanntmachung nach dem Umwandlungsgesetz",
      "state": "Nordrhein-Westfalen",
      "amtsgericht": "Amtsgericht Münster",
      "registernummer": "HRB 5173",
      "registerart": "HRB",
      "company_name": "Corona Dentis Zahntechnisches Labor GmbH",
      "company_seat": "Münster",
      "details": "13.09.2025 (Bekanntmachungsdatum)\n\nNordrhein-Westfalen Amtsgericht Münster HRB 5173\nRegisterbekanntmachung nach dem Umwandlungsgesetz 13.09.2025 (Eintragungsdatum)\n\nCorona Dentis Zahntechnisches Labor GmbH\nGesellschaft mit beschränkter Haftung\nMünster\n\nDen Gläubigern der an der Verschmelzung beteiligten Rechtsträger ist, wenn sie binnen sechs Monaten nach dem Tag, an dem die Eintragung der Verschmelzung in das Register des Sitzes desjenigen Rechtsträgers, dessen Gläubiger sie sind, nach § 19 Absatz 3 UmwG als bekanntgemacht gilt, ihren Anspruch nach Grund und Höhe schriftlich anmelden, Sicherheit zu leisten, soweit sie nicht Befriedigung verlangen können. Dieses Recht steht den Gläubigern jedoch nur zu, wenn sie glaubhaft machen, dass durch die Verschmelzung die Erfüllung ihrer Forderung gefährdet wird."
    },
    {
      "date": "2025-09-13",
      "id": "129245",
      "original_text": "Registerbekanntmachung nach dem Umwandlungsgesetz\nNordrhein-Westfalen Amtsgericht Bad Oeynhausen HRA 8688\nBack-System GmbH & Co. KG '06 – Löhne",
      "type": "Registerbekanntmachung nach dem Umwandlungsgesetz",
      "state": "Nordrhein-Westfalen",
      "amtsgericht": "Amtsgericht Bad Oeynhausen",
      "registernummer": "HRA 8688",
      "registerart": "HRA",
      "company_name": "Back-System GmbH & Co. KG '06",
      "company_seat": "Löhne",
      "details": "13.09.2025 (Bekanntmachungsdatum)\n\nNordrhein-Westfalen Amtsgericht Bad Oeynhausen HRA 8688\nRegisterbekanntmachung nach dem Umwandlungsgesetz 13.09.2025 (Eintragungsdatum)\n\nBack-System GmbH & Co. KG '06\nKommanditgesellschaft\nLöhne\n\nDen Gläubigern der an der Verschmelzung beteiligten Rechtsträger ist, wenn sie binnen sechs Monaten nach dem Tag, an dem die Eintragung der Verschmelzung in das Register des Sitzes derjenigen Rechtsträger deren Gläubiger sie sind, nach § 19 Absatz 3 UmwG als bekanntgemacht gilt, ihren Anspruch nach Grund und Höhe schriftlich anmelden, Sicherheit zu leisten, soweit sie nicht Befriedigung verlangen können. Dieses Recht steht den Gläubigern jedoch nur zu, wenn sie glaubhaft machen, dass durch die Verschmelzung die Erfüllung ihrer Forderung gefährdet wird."
    },
    {
      "date": "2025-09-13",
      "id": "129246",
      "original_text": "Registerbekanntmachung nach dem Umwandlungsgesetz\nNordrhein-Westfalen Amtsgericht Bad Oeynhausen HRB 8229\nSITRAPLAS GmbH – Bünde",
      "type": "Registerbekanntmachung nach dem Umwandlungsgesetz",
      "state": "Nordrhein-Westfalen",
      "amtsgericht": "Amtsgericht Bad Oeynhausen",
      "registernummer": "HRB 8229",
      "registerart": "HRB",
      "company_name": "SITRAPLAS GmbH",
      "company_seat": "Bünde",
      "details": "13.09.2025 (Bekanntmachungsdatum)\n\nNordrhein-Westfalen Amtsgericht Bad Oeynhausen HRB 8229\nRegisterbekanntmachung nach dem Umwandlungsgesetz 13.09.2025 (Eintragungsdatum)\n\nSITRAPLAS GmbH\nGesellschaft mit beschränkter Haftung\nBünde\n\nDen Gläubigern der an der Verschmelzung beteiligten Rechtsträger ist, wenn sie binnen sechs Monaten nach dem Tag, an dem die Eintragung der Verschmelzung in das Register des Sitzes desjenigen Rechtsträgers, dessen Gläubiger sie sind, nach § 19 Absatz 3 UmwG als bekanntgemacht gilt, ihren Anspruch nach Grund und Höhe schriftlich anmelden, Sicherheit zu leisten, soweit sie nicht Befriedigung verlangen können. Dieses Recht steht den Gläubigern jedoch nur zu, wenn sie glaubhaft machen, dass durch die Verschmelzung die Erfüllung ihrer Forderung gefährdet wird."
    },
    {
      "date": "2025-09-13",
      "id": "129247",
      "original_text": "Registerbekanntmachung nach dem Umwandlungsgesetz\nNordrhein-Westfalen Amtsgericht Siegburg HRB 17667\nBarBotix GmbH – Hennef (Sieg)",
      "type": "Registerbekanntmachung nach dem Umwandlungsgesetz",
      "state": "Nordrhein-Westfalen",
      "amtsgericht": "Amtsgericht Siegburg",
      "registernummer": "HRB 17667",
      "registerart": "HRB",
      "company_name": "BarBotix GmbH",
      "company_seat": "Hennef (Sieg)",
      "details": "13.09.2025 (Bekanntmachungsdatum)\n\nNordrhein-Westfalen Amtsgericht Siegburg HRB 17667\nRegisterbekanntmachung nach dem Umwandlungsgesetz 13.09.2025 (Eintragungsdatum)\n\nBarBotix GmbH\nGesellschaft mit beschränkter Haftung\nHennef (Sieg)\n\nDen Gläubigern der an der Verschmelzung beteiligten Rechtsträger ist, wenn sie binnen sechs Monaten nach dem Tag, an dem die Eintragung der Verschmelzung in das Register des Sitzes desjenigen Rechtsträgers, dessen Gläubiger sie sind, nach § 19 Absatz 3 UmwG als bekanntgemacht gilt, ihren Anspruch nach Grund und Höhe schriftlich anmelden, Sicherheit zu leisten, soweit sie nicht Befriedigung verlangen können. Dieses Recht steht den Gläubigern jedoch nur zu, wenn sie glaubhaft machen, dass durch die Verschmelzung die Erfüllung ihrer Forderung gefährdet wird."
    }
  ]
}