{
  "date": "2025-09-14",
  "date_of_scrape": "2025-10-27T07:37:43.436Z",
  "tool_version": "0.2.0",
  "number_of_announcements": 12,
  "announcements": [
    {
      "date": "2025-09-14",
      "id": "129248",
      "original_text": "Sonstige Registerbekanntmachung\nNiedersachsen Amtsgericht Hannover HRB 202670\nCOMRAMO AG – Hannover",
      "type": "Sonstige Registerbekanntmachung",
      "state": "Niedersachsen",
      "amtsgericht": "Amtsgericht Hannover",
      "registernummer": "HRB 202670",
      "registerart": "HRB",
      "company_name": "COMRAMO AG",
      "company_seat": "Hannover",
      "details": "14.09.2025 (Bekanntmachungsdatum)\n\nNiedersachsen Amtsgericht Hannover HRB 202670\nSonstige Registerbekanntmachung 14.09.2025 (Eintragungsdatum)\n\nCOMRAMO AG\nAktiengesellschaft\nHannover\n\nDie Liste der Mitglieder des Aufsichtsrats wurde beim Registergericht eingereicht."
    },
    {
      "date": "2025-09-14",
      "id": "129249",
      "original_text": "Registerbekanntmachung nach dem Umwandlungsgesetz\nNordrhein-Westfalen Amtsgericht Münster HRB 14272\nRadio Münsterland Digital Verwaltungs GmbH – Münster",
      "type": "Registerbekanntmachung nach dem Umwandlungsgesetz",
      "state": "Nordrhein-Westfalen",
      "amtsgericht": "Amtsgericht Münster",
      "registernummer": "HRB 14272",
      "registerart": "HRB",
      "company_name": "Radio Münsterland Digital Verwaltungs GmbH",
      "company_seat": "Münster",
      "details": "14.09.2025 (Bekanntmachungsdatum)\n\nNordrhein-Westfalen Amtsgericht Münster HRB 14272\nRegisterbekanntmachung nach dem Umwandlungsgesetz 14.09.2025 (Eintragungsdatum)\n\nRadio Münsterland Digital Verwaltungs GmbH\nGesellschaft mit beschränkter Haftung\nMünster\n\nDen Gläubigern der an der Verschmelzung beteiligten Rechtsträger ist, wenn sie binnen sechs Monaten nach dem Tag, an dem die Eintragung der Verschmelzung in das Register des Sitzes desjenigen Rechtsträgers, dessen Gläubiger sie sind, nach § 19 Absatz 3 UmwG als bekanntgemacht gilt, ihren Anspruch nach Grund und Höhe schriftlich anmelden, Sicherheit zu leisten, soweit sie nicht Befriedigung verlangen können. Dieses Recht steht den Gläubigern jedoch nur zu, wenn sie glaubhaft machen, dass durch die Verschmelzung die Erfüllung ihrer Forderung gefährdet wird."
    },
    {
      "date": "2025-09-14",
      "id": "129250",
      "original_text": "Registerbekanntmachung nach dem Umwandlungsgesetz\nNordrhein-Westfalen Amtsgericht Münster HRB 14284\nRoxeler Oberflächentechnik GmbH – Münster",
      "type": "Registerbekanntmachung nach dem Umwandlungsgesetz",
      "state": "Nordrhein-Westfalen",
      "amtsgericht": "Amtsgericht Münster",
      "registernummer": "HRB 14284",
      "registerart": "HRB",
      "company_name": "Roxeler Oberflächentechnik GmbH",
      "company_seat": "Münster",
      "details": "14.09.2025 (Bekanntmachungsdatum)\n\nNordrhein-Westfalen Amtsgericht Münster HRB 14284\nRegisterbekanntmachung nach dem Umwandlungsgesetz 14.09.2025 (Eintragungsdatum)\n\nRoxeler Oberflächentechnik GmbH\nGesellschaft mit beschränkter Haftung\nMünster\n\nDen Gläubigern der an der Verschmelzung beteiligten Rechtsträger ist, wenn sie binnen sechs Monaten nach dem Tag, an dem die Eintragung der Verschmelzung in das Register des Sitzes desjenigen Rechtsträgers, dessen Gläubiger sie sind, nach § 19 Absatz 3 UmwG als bekanntgemacht gilt, ihren Anspruch nach Grund und Höhe schriftlich anmelden, Sicherheit zu leisten, soweit sie nicht Befriedigung verlangen können. Dieses Recht steht den Gläubigern jedoch nur zu, wenn sie glaubhaft machen, dass durch die Verschmelzung die Erfüllung ihrer Forderung gefährdet wird."
    },
    {
      "date": "2025-09-14",
      "id": "129251",
      "original_text": "Registerbekanntmachung nach dem Umwandlungsgesetz\nNordrhein-Westfalen Amtsgericht Münster HRB 12529\nArGe OTLG Beteiligungs-Verwaltungs GmbH – Münster",
      "type": "Registerbekanntmachung nach dem Umwandlungsgesetz",
      "state": "Nordrhein-Westfalen",
      "amtsgericht": "Amtsgericht Münster",
      "registernummer": "HRB 12529",
      "registerart": "HRB",
      "company_name": "ArGe OTLG Beteiligungs-Verwaltungs GmbH",
      "company_seat": "Münster",
      "details": "14.09.2025 (Bekanntmachungsdatum)\n\nNordrhein-Westfalen Amtsgericht Münster HRB 12529\nRegisterbekanntmachung nach dem Umwandlungsgesetz 14.09.2025 (Eintragungsdatum)\n\nArGe OTLG Beteiligungs-Verwaltungs GmbH\nGesellschaft mit beschränkter Haftung\nMünster\n\nDen Gläubigern der an der Verschmelzung beteiligten Rechtsträger ist, wenn sie binnen sechs Monaten nach dem Tag, an dem die Eintragung der Verschmelzung in das Register des Sitzes desjenigen Rechtsträgers, dessen Gläubiger sie sind, nach § 19 Absatz 3 UmwG als bekanntgemacht gilt, ihren Anspruch nach Grund und Höhe schriftlich anmelden, Sicherheit zu leisten, soweit sie nicht Befriedigung verlangen können. Dieses Recht steht den Gläubigern jedoch nur zu, wenn sie glaubhaft machen, dass durch die Verschmelzung die Erfüllung ihrer Forderung gefährdet wird."
    },
    {
      "date": "2025-09-14",
      "id": "129252",
      "original_text": "Registerbekanntmachung nach dem Umwandlungsgesetz\nNordrhein-Westfalen Amtsgericht Münster HRA 11451\nProfimed GmbH & Co. KG – Warendorf",
      "type": "Registerbekanntmachung nach dem Umwandlungsgesetz",
      "state": "Nordrhein-Westfalen",
      "amtsgericht": "Amtsgericht Münster",
      "registernummer": "HRA 11451",
      "registerart": "HRA",
      "company_name": "Profimed GmbH & Co. KG",
      "company_seat": "Warendorf",
      "details": "14.09.2025 (Bekanntmachungsdatum)\n\nNordrhein-Westfalen Amtsgericht Münster HRA 11451\nRegisterbekanntmachung nach dem Umwandlungsgesetz 14.09.2025 (Eintragungsdatum)\n\nProfimed GmbH & Co. KG\nKommanditgesellschaft\nWarendorf\n\nDen Gläubigern der an der Verschmelzung beteiligten Rechtsträger ist, wenn sie binnen sechs Monaten nach dem Tag, an dem die Eintragung der Verschmelzung in das Register des Sitzes desjenigen Rechtsträgers, dessen Gläubiger sie sind, nach § 19 Absatz 3 UmwG als bekanntgemacht gilt, ihren Anspruch nach Grund und Höhe schriftlich anmelden, Sicherheit zu leisten, soweit sie nicht Befriedigung verlangen können. Dieses Recht steht den Gläubigern jedoch nur zu, wenn sie glaubhaft machen, dass durch die Verschmelzung die Erfüllung ihrer Forderung gefährdet wird."
    },
    {
      "date": "2025-09-14",
      "id": "129253",
      "original_text": "Registerbekanntmachung nach dem Umwandlungsgesetz\nNordrhein-Westfalen Amtsgericht Münster HRB 20299\n#002 SCALE UP SPV UG (haftungsbeschränkt) – Münster",
      "type": "Registerbekanntmachung nach dem Umwandlungsgesetz",
      "state": "Nordrhein-Westfalen",
      "amtsgericht": "Amtsgericht Münster",
      "registernummer": "HRB 20299",
      "registerart": "HRB",
      "company_name": "#002 SCALE UP SPV UG (haftungsbeschränkt)",
      "company_seat": "Münster",
      "details": "14.09.2025 (Bekanntmachungsdatum)\n\nNordrhein-Westfalen Amtsgericht Münster HRB 20299\nRegisterbekanntmachung nach dem Umwandlungsgesetz 14.09.2025 (Eintragungsdatum)\n\n#002 SCALE UP SPV UG (haftungsbeschränkt)\nGesellschaft mit beschränkter Haftung\nMünster\n\nDen Gläubigern der an der Verschmelzung beteiligten Rechtsträger ist, wenn sie binnen sechs Monaten nach dem Tag, an dem die Eintragung der Verschmelzung in das Register des Sitzes desjenigen Rechtsträgers, dessen Gläubiger sie sind, nach § 19 Absatz 3 UmwG als bekanntgemacht gilt, ihren Anspruch nach Grund und Höhe schriftlich anmelden, Sicherheit zu leisten, soweit sie nicht Befriedigung verlangen können. Dieses Recht steht den Gläubigern jedoch nur zu, wenn sie glaubhaft machen, dass durch die Verschmelzung die Erfüllung ihrer Forderung gefährdet wird."
    },
    {
      "date": "2025-09-14",
      "id": "129254",
      "original_text": "Registerbekanntmachung nach dem Umwandlungsgesetz\nNordrhein-Westfalen Amtsgericht Münster HRB 20331\n#005 SCALE UP SPV UG (haftungsbeschränkt) – Münster",
      "type": "Registerbekanntmachung nach dem Umwandlungsgesetz",
      "state": "Nordrhein-Westfalen",
      "amtsgericht": "Amtsgericht Münster",
      "registernummer": "HRB 20331",
      "registerart": "HRB",
      "company_name": "#005 SCALE UP SPV UG (haftungsbeschränkt)",
      "company_seat": "Münster",
      "details": "14.09.2025 (Bekanntmachungsdatum)\n\nNordrhein-Westfalen Amtsgericht Münster HRB 20331\nRegisterbekanntmachung nach dem Umwandlungsgesetz 14.09.2025 (Eintragungsdatum)\n\n#005 SCALE UP SPV UG (haftungsbeschränkt)\nGesellschaft mit beschränkter Haftung\nMünster\n\nDen Gläubigern der an der Verschmelzung beteiligten Rechtsträger ist, wenn sie binnen sechs Monaten nach dem Tag, an dem die Eintragung der Verschmelzung in das Register des Sitzes desjenigen Rechtsträgers, dessen Gläubiger sie sind, nach § 19 Absatz 3 UmwG als bekanntgemacht gilt, ihren Anspruch nach Grund und Höhe schriftlich anmelden, Sicherheit zu leisten, soweit sie nicht Befriedigung verlangen können. Dieses Recht steht den Gläubigern jedoch nur zu, wenn sie glaubhaft machen, dass durch die Verschmelzung die Erfüllung ihrer Forderung gefährdet wird."
    },
    {
      "date": "2025-09-14",
      "id": "129255",
      "original_text": "Registerbekanntmachung nach dem Umwandlungsgesetz\nNordrhein-Westfalen Amtsgericht Münster HRB 20300\n#004 SCALE UP SPV UG (haftungsbeschränkt) – Münster",
      "type": "Registerbekanntmachung nach dem Umwandlungsgesetz",
      "state": "Nordrhein-Westfalen",
      "amtsgericht": "Amtsgericht Münster",
      "registernummer": "HRB 20300",
      "registerart": "HRB",
      "company_name": "#004 SCALE UP SPV UG (haftungsbeschränkt)",
      "company_seat": "Münster",
      "details": "14.09.2025 (Bekanntmachungsdatum)\n\nNordrhein-Westfalen Amtsgericht Münster HRB 20300\nRegisterbekanntmachung nach dem Umwandlungsgesetz 14.09.2025 (Eintragungsdatum)\n\n#004 SCALE UP SPV UG (haftungsbeschränkt)\nGesellschaft mit beschränkter Haftung\nMünster\n\nDen Gläubigern der an der Verschmelzung beteiligten Rechtsträger ist, wenn sie binnen sechs Monaten nach dem Tag, an dem die Eintragung der Verschmelzung in das Register des Sitzes desjenigen Rechtsträgers, dessen Gläubiger sie sind, nach § 19 Absatz 3 UmwG als bekanntgemacht gilt, ihren Anspruch nach Grund und Höhe schriftlich anmelden, Sicherheit zu leisten, soweit sie nicht Befriedigung verlangen können. Dieses Recht steht den Gläubigern jedoch nur zu, wenn sie glaubhaft machen, dass durch die Verschmelzung die Erfüllung ihrer Forderung gefährdet wird."
    },
    {
      "date": "2025-09-14",
      "id": "129256",
      "original_text": "Registerbekanntmachung nach dem Umwandlungsgesetz\nNordrhein-Westfalen Amtsgericht Münster HRB 20317\n#003 SCALE UP SPV UG (haftungsbeschränkt) – Münster",
      "type": "Registerbekanntmachung nach dem Umwandlungsgesetz",
      "state": "Nordrhein-Westfalen",
      "amtsgericht": "Amtsgericht Münster",
      "registernummer": "HRB 20317",
      "registerart": "HRB",
      "company_name": "#003 SCALE UP SPV UG (haftungsbeschränkt)",
      "company_seat": "Münster",
      "details": "14.09.2025 (Bekanntmachungsdatum)\n\nNordrhein-Westfalen Amtsgericht Münster HRB 20317\nRegisterbekanntmachung nach dem Umwandlungsgesetz 14.09.2025 (Eintragungsdatum)\n\n#003 SCALE UP SPV UG (haftungsbeschränkt)\nGesellschaft mit beschränkter Haftung\nMünster\n\nDen Gläubigern der an der Verschmelzung beteiligten Rechtsträger ist, wenn sie binnen sechs Monaten nach dem Tag, an dem die Eintragung der Verschmelzung in das Register des Sitzes desjenigen Rechtsträgers, dessen Gläubiger sie sind, nach § 19 Absatz 3 UmwG als bekanntgemacht gilt, ihren Anspruch nach Grund und Höhe schriftlich anmelden, Sicherheit zu leisten, soweit sie nicht Befriedigung verlangen können. Dieses Recht steht den Gläubigern jedoch nur zu, wenn sie glaubhaft machen, dass durch die Verschmelzung die Erfüllung ihrer Forderung gefährdet wird."
    },
    {
      "date": "2025-09-14",
      "id": "129257",
      "original_text": "Registerbekanntmachung nach dem Umwandlungsgesetz\nNordrhein-Westfalen Amtsgericht Münster HRB 20230\nniulabs GmbH – Münster",
      "type": "Registerbekanntmachung nach dem Umwandlungsgesetz",
      "state": "Nordrhein-Westfalen",
      "amtsgericht": "Amtsgericht Münster",
      "registernummer": "HRB 20230",
      "registerart": "HRB",
      "company_name": "niulabs GmbH",
      "company_seat": "Münster",
      "details": "14.09.2025 (Bekanntmachungsdatum)\n\nNordrhein-Westfalen Amtsgericht Münster HRB 20230\nRegisterbekanntmachung nach dem Umwandlungsgesetz 14.09.2025 (Eintragungsdatum)\n\nniulabs GmbH\nGesellschaft mit beschränkter Haftung\nMünster\n\nDen Gläubigern der an der Verschmelzung beteiligten Rechtsträger ist, wenn sie binnen sechs Monaten nach dem Tag, an dem die Eintragung der Verschmelzung in das Register des Sitzes desjenigen Rechtsträgers, dessen Gläubiger sie sind, nach § 19 Absatz 3 UmwG als bekanntgemacht gilt, ihren Anspruch nach Grund und Höhe schriftlich anmelden, Sicherheit zu leisten, soweit sie nicht Befriedigung verlangen können. Dieses Recht steht den Gläubigern jedoch nur zu, wenn sie glaubhaft machen, dass durch die Verschmelzung die Erfüllung ihrer Forderung gefährdet wird."
    },
    {
      "date": "2025-09-14",
      "id": "129258",
      "original_text": "Registerbekanntmachung nach dem Umwandlungsgesetz\nRheinland-Pfalz Amtsgericht Montabaur HRB 20109\nVermögensverwaltung PS GmbH – Gebhardshain",
      "type": "Registerbekanntmachung nach dem Umwandlungsgesetz",
      "state": "Rheinland-Pfalz",
      "amtsgericht": "Amtsgericht Montabaur",
      "registernummer": "HRB 20109",
      "registerart": "HRB",
      "company_name": "Vermögensverwaltung PS GmbH",
      "company_seat": "Gebhardshain",
      "details": "14.09.2025 (Bekanntmachungsdatum)\n\nRheinland-Pfalz Amtsgericht Montabaur HRB 20109\nRegisterbekanntmachung nach dem Umwandlungsgesetz 14.09.2025 (Eintragungsdatum)\n\nVermögensverwaltung PS GmbH\nGesellschaft mit beschränkter Haftung\nGebhardshain\n\nAls nicht eingetragen wird veröffentlicht: Den Gläubigern der an der Verschmelzung beteiligten Rechtsträger ist, wenn sie binnen sechs Monaten nach dem Tag, an dem die Eintragung der Verschmelzung in das Register des Sitzes desjenigen Rechtsträgers,dessen Gläubiger sie sind, nach § 19 Abs. 3 UmwG als bekannt gemacht gilt, ihren Anspruch nach Grund und Höhe schriftlich anmelden, Sicherheit zu leisten, soweit sie nicht Befriedigung verlangen können. Dieses Recht steht den Gläubigern jedoch nur zu, wenn sie glaubhaft machen, dass durch die Verschmelzung die Erfüllungd er Forderung gefährdet wird."
    },
    {
      "date": "2025-09-14",
      "id": "129259",
      "original_text": "Registerbekanntmachung nach dem Umwandlungsgesetz\nNordrhein-Westfalen Amtsgericht Münster HRB 5908\nnicos Aktiengesellschaft – Münster",
      "type": "Registerbekanntmachung nach dem Umwandlungsgesetz",
      "state": "Nordrhein-Westfalen",
      "amtsgericht": "Amtsgericht Münster",
      "registernummer": "HRB 5908",
      "registerart": "HRB",
      "company_name": "nicos Aktiengesellschaft",
      "company_seat": "Münster",
      "details": "14.09.2025 (Bekanntmachungsdatum)\n\nNordrhein-Westfalen Amtsgericht Münster HRB 5908\nRegisterbekanntmachung nach dem Umwandlungsgesetz 14.09.2025 (Eintragungsdatum)\n\nnicos Aktiengesellschaft\nAktiengesellschaft\nMünster\n\nDen Gläubigern der an der Verschmelzung beteiligten Rechtsträger ist, wenn sie binnen sechs Monaten nach dem Tag, an dem die Eintragung der Verschmelzung in das Register des Sitzes desjenigen Rechtsträgers, dessen Gläubiger sie sind, nach § 19 Absatz 3 UmwG als bekanntgemacht gilt, ihren Anspruch nach Grund und Höhe schriftlich anmelden, Sicherheit zu leisten, soweit sie nicht Befriedigung verlangen können. Dieses Recht steht den Gläubigern jedoch nur zu, wenn sie glaubhaft machen, dass durch die Verschmelzung die Erfüllung ihrer Forderung gefährdet wird."
    }
  ]
}