{
  "date": "2025-09-27",
  "date_of_scrape": "2025-10-27T15:38:22.752Z",
  "tool_version": "0.2.0",
  "number_of_announcements": 20,
  "announcements": [
    {
      "date": "2025-09-27",
      "id": "131716",
      "original_text": "Löschungsankündigung\nBayern Amtsgericht Ingolstadt HRB 10668\nBePresent UG (haftungsbeschränkt) – Ingolstadt",
      "type": "Löschungsankündigung",
      "state": "Bayern",
      "amtsgericht": "Amtsgericht Ingolstadt",
      "registernummer": "HRB 10668",
      "registerart": "HRB",
      "company_name": "BePresent UG (haftungsbeschränkt)",
      "company_seat": "Ingolstadt",
      "details": "27.09.2025 (Bekanntmachungsdatum)\n\nBayern Amtsgericht Ingolstadt HRB 10668\nLöschungsankündigung\n\nBePresent UG (haftungsbeschränkt)\nGesellschaft mit beschränkter Haftung\nIngolstadt\n\nDas Registergericht beabsichtigt, die im Handelsregister eingetragene Gesellschaft wegen Vermögenslosigkeit von Amts wegen nach § 394 FamFG zu löschen. Die Frist zur Erhebung eines Widerspruchs ist auf einen Monat festgesetzt."
    },
    {
      "date": "2025-09-27",
      "id": "131717",
      "original_text": "Registerbekanntmachung nach dem Umwandlungsgesetz\nBayern Amtsgericht Fürth HRB 13348\nHWS Zentrale Dienste und Service GmbH – Neustadt a.d. Aisch",
      "type": "Registerbekanntmachung nach dem Umwandlungsgesetz",
      "state": "Bayern",
      "amtsgericht": "Amtsgericht Fürth",
      "registernummer": "HRB 13348",
      "registerart": "HRB",
      "company_name": "HWS Zentrale Dienste und Service GmbH",
      "company_seat": "Neustadt a.d. Aisch",
      "details": "27.09.2025 (Bekanntmachungsdatum)\n\nBayern Amtsgericht Fürth HRB 13348\nRegisterbekanntmachung nach dem Umwandlungsgesetz 26.09.2025 (Eintragungsdatum)\n\nHWS Zentrale Dienste und Service GmbH\nGesellschaft mit beschränkter Haftung\nNeustadt a.d. Aisch\n\nDen Gläubigern der an der Verschmelzung beteiligten Rechtsträger ist, wenn sie binnen sechs Monaten nach dem Tag, an dem die Eintragung der Verschmelzung in das Register des Sitzes desjenigen Rechtsträgers, dessen Gläubiger sie sind, nach § 19 Abs. 3 UmwG als bekannt gemacht gilt, ihren Anspruch nach Grund und Höhe in Textform anmelden, Sicherheit zu leisten, soweit sie nicht Befriedigung verlangen können. Dieses Recht steht den Gläubigern jedoch nur zu, wenn sie glaubhaft machen, dass durch die Verschmelzung die Erfüllung ihrer Forderung gefährdet wird."
    },
    {
      "date": "2025-09-27",
      "id": "131718",
      "original_text": "Registerbekanntmachung nach dem Umwandlungsgesetz\nBayern Amtsgericht München HRB 285128\nSOL Invest GmbH – Grünwald",
      "type": "Registerbekanntmachung nach dem Umwandlungsgesetz",
      "state": "Bayern",
      "amtsgericht": "Amtsgericht München",
      "registernummer": "HRB 285128",
      "registerart": "HRB",
      "company_name": "SOL Invest GmbH",
      "company_seat": "Grünwald",
      "details": "27.09.2025 (Bekanntmachungsdatum)\n\nBayern Amtsgericht München HRB 285128\nRegisterbekanntmachung nach dem Umwandlungsgesetz 26.09.2025 (Eintragungsdatum)\n\nSOL Invest GmbH\nGesellschaft mit beschränkter Haftung\nGrünwald\n\nDen Gläubigern des formwechselnden Rechtsträgers ist, wenn sie binnen sechs Monaten nach dem Tag, an dem die Eintragung des Formwechsels nach § 201 UmwG als bekannt gemacht gilt, ihren Anspruch nach Grund und Höhe in Textform anmelden, Sicherheit zu leisten, soweit sie nicht Befriedigung verlangen können. Dieses Recht steht den Gläubigern jedoch nur zu, wenn sie glaubhaft machen, dass durch den Formwechsel die Erfüllung ihrer Forderung gefährdet wird."
    },
    {
      "date": "2025-09-27",
      "id": "131719",
      "original_text": "Registerbekanntmachung nach dem Umwandlungsgesetz\nBayern Amtsgericht Fürth HRB 22090\nHaYo Logistik GmbH – Fürth",
      "type": "Registerbekanntmachung nach dem Umwandlungsgesetz",
      "state": "Bayern",
      "amtsgericht": "Amtsgericht Fürth",
      "registernummer": "HRB 22090",
      "registerart": "HRB",
      "company_name": "HaYo Logistik GmbH",
      "company_seat": "Fürth",
      "details": "27.09.2025 (Bekanntmachungsdatum)\n\nBayern Amtsgericht Fürth HRB 22090\nRegisterbekanntmachung nach dem Umwandlungsgesetz 26.09.2025 (Eintragungsdatum)\n\nHaYo Logistik GmbH\nGesellschaft mit beschränkter Haftung\nFürth\n\nDen Gläubigern der an der Ausgliederung beteiligten Rechtsträger ist, wenn sie binnen sechs Monaten nach dem Tag, an dem die Eintragung der Ausgliederung in das Register des Sitzes desjenigen Rechtsträgers, dessen Gläubiger sie sind, nach §§ 125, 19 Abs. 3 UmwG als bekannt gemacht gilt, ihren Anspruch nach Grund und Höhe in Textform anmelden, Sicherheit zu leisten, soweit sie nicht Befriedigung verlangen können. Dieses Recht steht den Gläubigern jedoch nur zu, wenn sie glaubhaft machen, dass durch die Ausgliederung die Erfüllung ihrer Forderung gefährdet wird."
    },
    {
      "date": "2025-09-27",
      "id": "131720",
      "original_text": "Registerbekanntmachung nach dem Umwandlungsgesetz\nBayern Amtsgericht Nürnberg HRB 40816\nmsg BiN GmbH – Nürnberg",
      "type": "Registerbekanntmachung nach dem Umwandlungsgesetz",
      "state": "Bayern",
      "amtsgericht": "Amtsgericht Nürnberg",
      "registernummer": "HRB 40816",
      "registerart": "HRB",
      "company_name": "msg BiN GmbH",
      "company_seat": "Nürnberg",
      "details": "27.09.2025 (Bekanntmachungsdatum)\n\nBayern Amtsgericht Nürnberg HRB 40816\nRegisterbekanntmachung nach dem Umwandlungsgesetz 26.09.2025 (Eintragungsdatum)\n\nmsg BiN GmbH\nGesellschaft mit beschränkter Haftung\nNürnberg\n\nDen Gläubigern der an der Verschmelzung beteiligten Rechtsträger ist, wenn sie binnen sechs Monaten nach dem Tag, an dem die Eintragung der Verschmelzung in das Register des Sitzes desjenigen Rechtsträgers, dessen Gläubiger sie sind, nach § 19 Abs. 3 UmwG als bekannt gemacht gilt, ihren Anspruch nach Grund und Höhe in Textform anmelden, Sicherheit zu leisten, soweit sie nicht Befriedigung verlangen können. Dieses Recht steht den Gläubigern jedoch nur zu, wenn sie glaubhaft machen, dass durch die Verschmelzung die Erfüllung ihrer Forderung gefährdet wird."
    },
    {
      "date": "2025-09-27",
      "id": "131721",
      "original_text": "Einreichung neuer Dokumente\nBayern Amtsgericht München HRB 7684\nWohnbau GmbH – München",
      "type": "Einreichung neuer Dokumente",
      "state": "Bayern",
      "amtsgericht": "Amtsgericht München",
      "registernummer": "HRB 7684",
      "registerart": "HRB",
      "company_name": "Wohnbau GmbH",
      "company_seat": "München",
      "details": "27.09.2025 (Bekanntmachungsdatum)\n\nBayern Amtsgericht München HRB 7684\nEinreichung neuer Dokumente\n\nWohnbau GmbH\nGesellschaft mit beschränkter Haftung\nMünchen\n\nDem Amtsgericht München -Registergericht- ist eine Liste der Mitglieder des Aufsichtsrats eingereicht worden, § 52 Abs. 3 S. 2 GmbHG."
    },
    {
      "date": "2025-09-27",
      "id": "131722",
      "original_text": "Registerbekanntmachung nach dem Umwandlungsgesetz\nBayern Amtsgericht München HRB 295982\nDMG MORI Europe Operations GmbH – München",
      "type": "Registerbekanntmachung nach dem Umwandlungsgesetz",
      "state": "Bayern",
      "amtsgericht": "Amtsgericht München",
      "registernummer": "HRB 295982",
      "registerart": "HRB",
      "company_name": "DMG MORI Europe Operations GmbH",
      "company_seat": "München",
      "details": "27.09.2025 (Bekanntmachungsdatum)\n\nBayern Amtsgericht München HRB 295982\nRegisterbekanntmachung nach dem Umwandlungsgesetz 26.09.2025 (Eintragungsdatum)\n\nDMG MORI Europe Operations GmbH\nGesellschaft mit beschränkter Haftung\nMünchen\n\nDen Gläubigern der an der Verschmelzung beteiligten Rechtsträger ist, wenn sie binnen sechs Monaten nach dem Tag, an dem die Eintragung der Verschmelzung in das Register des Sitzes desjenigen Rechtsträgers, dessen Gläubiger sie sind, nach § 19 Abs. 3 UmwG als bekannt gemacht gilt, ihren Anspruch nach Grund und Höhe in Textform anmelden, Sicherheit zu leisten, soweit sie nicht Befriedigung verlangen können. Dieses Recht steht den Gläubigern jedoch nur zu, wenn sie glaubhaft machen, dass durch die Verschmelzung die Erfüllung ihrer Forderung gefährdet wird."
    },
    {
      "date": "2025-09-27",
      "id": "131723",
      "original_text": "Registerbekanntmachung nach dem Umwandlungsgesetz\nBayern Amtsgericht München HRA 121377\nBenedikt Böhm e.K. – Grünwald",
      "type": "Registerbekanntmachung nach dem Umwandlungsgesetz",
      "state": "Bayern",
      "amtsgericht": "Amtsgericht München",
      "registernummer": "HRA 121377",
      "registerart": "HRA",
      "company_name": "Benedikt Böhm e.K.",
      "company_seat": "Grünwald",
      "details": "27.09.2025 (Bekanntmachungsdatum)\n\nBayern Amtsgericht München HRA 121377\nRegisterbekanntmachung nach dem Umwandlungsgesetz 26.09.2025 (Eintragungsdatum)\n\nBenedikt Böhm e.K.\nEinzelkaufmann / Einzelkauffrau\nGrünwald\n\nDen Gläubigern der an der Ausgliederung beteiligten Rechtsträger ist, wenn sie binnen sechs Monaten nach dem Tag, an dem die Eintragung der Ausgliederung in das Register des Sitzes desjenigen Rechtsträgers, dessen Gläubiger sie sind, nach §§ 125, 19 Abs. 3 UmwG als bekannt gemacht gilt, ihren Anspruch nach Grund und Höhe in Textform anmelden, Sicherheit zu leisten, soweit sie nicht Befriedigung verlangen können. Dieses Recht steht den Gläubigern jedoch nur zu, wenn sie glaubhaft machen, dass durch die Ausgliederung die Erfüllung ihrer Forderung gefährdet wird."
    },
    {
      "date": "2025-09-27",
      "id": "131724",
      "original_text": "Registerbekanntmachung nach dem Umwandlungsgesetz\nBayern Amtsgericht Augsburg HRB 29031\nPaula & Max Kindertagesstätten GmbH – Friedberg",
      "type": "Registerbekanntmachung nach dem Umwandlungsgesetz",
      "state": "Bayern",
      "amtsgericht": "Amtsgericht Augsburg",
      "registernummer": "HRB 29031",
      "registerart": "HRB",
      "company_name": "Paula & Max Kindertagesstätten GmbH",
      "company_seat": "Friedberg",
      "details": "27.09.2025 (Bekanntmachungsdatum)\n\nBayern Amtsgericht Augsburg HRB 29031\nRegisterbekanntmachung nach dem Umwandlungsgesetz 26.09.2025 (Eintragungsdatum)\n\nPaula & Max Kindertagesstätten GmbH\nGesellschaft mit beschränkter Haftung\nFriedberg\n\nDen Gläubigern der an der Verschmelzung beteiligten Rechtsträger ist, wenn sie binnen sechs Monaten nach dem Tag, an dem die Eintragung der Verschmelzung in das Register des Sitzes desjenigen Rechtsträgers, dessen Gläubiger sie sind, nach § 19 Abs. 3 UmwG als bekannt gemacht gilt, ihren Anspruch nach Grund und Höhe in Textform anmelden, Sicherheit zu leisten, soweit sie nicht Befriedigung verlangen können. Dieses Recht steht den Gläubigern jedoch nur zu, wenn sie glaubhaft machen, dass durch die Verschmelzung die Erfüllung ihrer Forderung gefährdet wird."
    },
    {
      "date": "2025-09-27",
      "id": "131725",
      "original_text": "Löschungsankündigung\nBayern Amtsgericht München HRB 229466\nISARNEMA GmbH – München",
      "type": "Löschungsankündigung",
      "state": "Bayern",
      "amtsgericht": "Amtsgericht München",
      "registernummer": "HRB 229466",
      "registerart": "HRB",
      "company_name": "ISARNEMA GmbH",
      "company_seat": "München",
      "details": "27.09.2025 (Bekanntmachungsdatum)\n\nBayern Amtsgericht München HRB 229466\nLöschungsankündigung\n\nISARNEMA GmbH\nGesellschaft mit beschränkter Haftung\nMünchen\n\nDas Registergericht beabsichtigt, die im Handelsregister eingetragene Gesellschaft wegen Vermögenslosigkeit von Amts wegen nach § 394 FamFG zu löschen. Die Frist zur Erhebung eines Widerspruchs ist auf drei Monate festgesetzt."
    },
    {
      "date": "2025-09-27",
      "id": "131726",
      "original_text": "Registerbekanntmachung nach dem Umwandlungsgesetz\nBayern Amtsgericht Würzburg HRB 18117\nSachs Entsorgung GmbH – Burgsinn",
      "type": "Registerbekanntmachung nach dem Umwandlungsgesetz",
      "state": "Bayern",
      "amtsgericht": "Amtsgericht Würzburg",
      "registernummer": "HRB 18117",
      "registerart": "HRB",
      "company_name": "Sachs Entsorgung GmbH",
      "company_seat": "Burgsinn",
      "details": "27.09.2025 (Bekanntmachungsdatum)\n\nBayern Amtsgericht Würzburg HRB 18117\nRegisterbekanntmachung nach dem Umwandlungsgesetz 26.09.2025 (Eintragungsdatum)\n\nSachs Entsorgung GmbH\nGesellschaft mit beschränkter Haftung\nBurgsinn\n\nDen Gläubigern des formwechselnden Rechtsträgers ist, wenn sie binnen sechs Monaten nach dem Tag, an dem die Eintragung des Formwechsels nach § 201 UmwG als bekannt gemacht gilt, ihren Anspruch nach Grund und Höhe in Textform anmelden, Sicherheit zu leisten, soweit sie nicht Befriedigung verlangen können. Dieses Recht steht den Gläubigern jedoch nur zu, wenn sie glaubhaft machen, dass durch den Formwechsel die Erfüllung ihrer Forderung gefährdet wird."
    },
    {
      "date": "2025-09-27",
      "id": "131727",
      "original_text": "Löschungsankündigung\nBayern Amtsgericht Fürth HRB 18797\nMITRONIX GmbH – Eckental",
      "type": "Löschungsankündigung",
      "state": "Bayern",
      "amtsgericht": "Amtsgericht Fürth",
      "registernummer": "HRB 18797",
      "registerart": "HRB",
      "company_name": "MITRONIX GmbH",
      "company_seat": "Eckental",
      "details": "27.09.2025 (Bekanntmachungsdatum)\n\nBayern Amtsgericht Fürth HRB 18797\nLöschungsankündigung 26.09.2025 (Eintragungsdatum)\n\nMITRONIX GmbH\nGesellschaft mit beschränkter Haftung\nEckental\n\nDas Registergericht beabsichtigt, die im Handelsregister eingetragene Gesellschaft wegen Vermögenslosigkeit von Amts wegen nach § 394 FamFG zu löschen. Die Frist zur Erhebung eines Widerspruchs ist auf drei Monate festgesetzt."
    },
    {
      "date": "2025-09-27",
      "id": "131728",
      "original_text": "Registerbekanntmachung nach dem Umwandlungsgesetz\nBayern Amtsgericht München HRB 305904\nETCON GmbH – München",
      "type": "Registerbekanntmachung nach dem Umwandlungsgesetz",
      "state": "Bayern",
      "amtsgericht": "Amtsgericht München",
      "registernummer": "HRB 305904",
      "registerart": "HRB",
      "company_name": "ETCON GmbH",
      "company_seat": "München",
      "details": "27.09.2025 (Bekanntmachungsdatum)\n\nBayern Amtsgericht München HRB 305904\nRegisterbekanntmachung nach dem Umwandlungsgesetz 26.09.2025 (Eintragungsdatum)\n\nETCON GmbH\nGesellschaft mit beschränkter Haftung\nMünchen\n\nDen Gläubigern des formwechselnden Rechtsträgers ist, wenn sie binnen sechs Monaten nach dem Tag, an dem die Eintragung des Formwechsels nach § 201 UmwG als bekannt gemacht gilt, ihren Anspruch nach Grund und Höhe in Textform anmelden, Sicherheit zu leisten, soweit sie nicht Befriedigung verlangen können. Dieses Recht steht den Gläubigern jedoch nur zu, wenn sie glaubhaft machen, dass durch den Formwechsel die Erfüllung ihrer Forderung gefährdet wird."
    },
    {
      "date": "2025-09-27",
      "id": "131729",
      "original_text": "Registerbekanntmachung nach dem Umwandlungsgesetz\nBayern Amtsgericht München HRB 130324\nETCON Aktiengesellschaft – München",
      "type": "Registerbekanntmachung nach dem Umwandlungsgesetz",
      "state": "Bayern",
      "amtsgericht": "Amtsgericht München",
      "registernummer": "HRB 130324",
      "registerart": "HRB",
      "company_name": "ETCON Aktiengesellschaft",
      "company_seat": "München",
      "details": "27.09.2025 (Bekanntmachungsdatum)\n\nBayern Amtsgericht München HRB 130324\nRegisterbekanntmachung nach dem Umwandlungsgesetz 26.09.2025 (Eintragungsdatum)\n\nETCON Aktiengesellschaft\nAktiengesellschaft\nMünchen\n\nDen Gläubigern des formwechselnden Rechtsträgers ist, wenn sie binnen sechs Monaten nach dem Tag, an dem die Eintragung des Formwechsels nach § 201 UmwG als bekannt gemacht gilt, ihren Anspruch nach Grund und Höhe in Textform anmelden, Sicherheit zu leisten, soweit sie nicht Befriedigung verlangen können. Dieses Recht steht den Gläubigern jedoch nur zu, wenn sie glaubhaft machen, dass durch den Formwechsel die Erfüllung ihrer Forderung gefährdet wird."
    },
    {
      "date": "2025-09-27",
      "id": "131730",
      "original_text": "Registerbekanntmachung nach dem Umwandlungsgesetz\nBayern Amtsgericht Fürth HRB 20270\na modo mio - Chauffeurservice GmbH – Fürth",
      "type": "Registerbekanntmachung nach dem Umwandlungsgesetz",
      "state": "Bayern",
      "amtsgericht": "Amtsgericht Fürth",
      "registernummer": "HRB 20270",
      "registerart": "HRB",
      "company_name": "a modo mio - Chauffeurservice GmbH",
      "company_seat": "Fürth",
      "details": "27.09.2025 (Bekanntmachungsdatum)\n\nBayern Amtsgericht Fürth HRB 20270\nRegisterbekanntmachung nach dem Umwandlungsgesetz 26.09.2025 (Eintragungsdatum)\n\na modo mio - Chauffeurservice GmbH\nGesellschaft mit beschränkter Haftung\nFürth\n\nDen Gläubigern der an der Verschmelzung beteiligten Rechtsträger ist, wenn sie binnen sechs Monaten nach dem Tag, an dem die Eintragung der Verschmelzung in das Register des Sitzes desjenigen Rechtsträgers, dessen Gläubiger sie sind, nach § 19 Abs. 3 UmwG als bekannt gemacht gilt, ihren Anspruch nach Grund und Höhe in Textform anmelden, Sicherheit zu leisten, soweit sie nicht Befriedigung verlangen können. Dieses Recht steht den Gläubigern jedoch nur zu, wenn sie glaubhaft machen, dass durch die Verschmelzung die Erfüllung ihrer Forderung gefährdet wird."
    },
    {
      "date": "2025-09-27",
      "id": "131731",
      "original_text": "Einreichung neuer Dokumente\nBayern Amtsgericht München HRB 169902\nBBH AG Wirtschaftsprüfungsgesellschaft – München",
      "type": "Einreichung neuer Dokumente",
      "state": "Bayern",
      "amtsgericht": "Amtsgericht München",
      "registernummer": "HRB 169902",
      "registerart": "HRB",
      "company_name": "BBH AG Wirtschaftsprüfungsgesellschaft",
      "company_seat": "München",
      "details": "27.09.2025 (Bekanntmachungsdatum)\n\nBayern Amtsgericht München HRB 169902\nEinreichung neuer Dokumente 26.09.2025 (Eintragungsdatum)\n\nBBH AG Wirtschaftsprüfungsgesellschaft\nAktiengesellschaft\nMünchen\n\nDem Amtsgericht München -Registergericht- ist eine Liste der Mitglieder des Aufsichtsrats eingereicht worden, § 106 AktG."
    },
    {
      "date": "2025-09-27",
      "id": "131732",
      "original_text": "Registerbekanntmachung nach dem Umwandlungsgesetz\nBayern Amtsgericht Nürnberg HRB 45018\nLYRA Bleistiftfabrik GmbH – Nürnberg",
      "type": "Registerbekanntmachung nach dem Umwandlungsgesetz",
      "state": "Bayern",
      "amtsgericht": "Amtsgericht Nürnberg",
      "registernummer": "HRB 45018",
      "registerart": "HRB",
      "company_name": "LYRA Bleistiftfabrik GmbH",
      "company_seat": "Nürnberg",
      "details": "27.09.2025 (Bekanntmachungsdatum)\n\nBayern Amtsgericht Nürnberg HRB 45018\nRegisterbekanntmachung nach dem Umwandlungsgesetz 26.09.2025 (Eintragungsdatum)\n\nLYRA Bleistiftfabrik GmbH\nGesellschaft mit beschränkter Haftung\nNürnberg\n\nDen Gläubigern der an der Verschmelzung beteiligten Rechtsträger ist, wenn sie binnen sechs Monaten nach dem Tag, an dem die Eintragung der Verschmelzung in das Register des Sitzes desjenigen Rechtsträgers, dessen Gläubiger sie sind, nach § 19 Abs. 3 UmwG als bekannt gemacht gilt, ihren Anspruch nach Grund und Höhe in Textform anmelden, Sicherheit zu leisten, soweit sie nicht Befriedigung verlangen können. Dieses Recht steht den Gläubigern jedoch nur zu, wenn sie glaubhaft machen, dass durch die Verschmelzung die Erfüllung ihrer Forderung gefährdet wird."
    },
    {
      "date": "2025-09-27",
      "id": "131733",
      "original_text": "Registerbekanntmachung nach dem Umwandlungsgesetz\nBayern Amtsgericht Würzburg HRA 8011\nSachs Entsorgung GmbH & Co. KG – Burgsinn",
      "type": "Registerbekanntmachung nach dem Umwandlungsgesetz",
      "state": "Bayern",
      "amtsgericht": "Amtsgericht Würzburg",
      "registernummer": "HRA 8011",
      "registerart": "HRA",
      "company_name": "Sachs Entsorgung GmbH & Co. KG",
      "company_seat": "Burgsinn",
      "details": "27.09.2025 (Bekanntmachungsdatum)\n\nBayern Amtsgericht Würzburg HRA 8011\nRegisterbekanntmachung nach dem Umwandlungsgesetz 26.09.2025 (Eintragungsdatum)\n\nSachs Entsorgung GmbH & Co. KG\nKommanditgesellschaft\nBurgsinn\n\nDen Gläubigern des formwechselnden Rechtsträgers ist, wenn sie binnen sechs Monaten nach dem Tag, an dem die Eintragung des Formwechsels nach § 201 UmwG als bekannt gemacht gilt, ihren Anspruch nach Grund und Höhe in Textform anmelden, Sicherheit zu leisten, soweit sie nicht Befriedigung verlangen können. Dieses Recht steht den Gläubigern jedoch nur zu, wenn sie glaubhaft machen, dass durch den Formwechsel die Erfüllung ihrer Forderung gefährdet wird."
    },
    {
      "date": "2025-09-27",
      "id": "131734",
      "original_text": "Einreichung neuer Dokumente\nSachsen-Anhalt Amtsgericht Stendal HRB 352\nStadtwerke Stendal GmbH – Stendal",
      "type": "Einreichung neuer Dokumente",
      "state": "Sachsen-Anhalt",
      "amtsgericht": "Amtsgericht Stendal",
      "registernummer": "HRB 352",
      "registerart": "HRB",
      "company_name": "Stadtwerke Stendal GmbH",
      "company_seat": "Stendal",
      "details": "27.09.2025 (Bekanntmachungsdatum)\n\nSachsen-Anhalt Amtsgericht Stendal HRB 352\nEinreichung neuer Dokumente\n\nStadtwerke Stendal GmbH\nGesellschaft mit beschränkter Haftung\nStendal\n\nEine Liste der Mitglieder des Aufsichtsrates wurde zum Handelsregister eingereicht."
    },
    {
      "date": "2025-09-27",
      "id": "131735",
      "original_text": "Löschungsankündigung\nBrandenburg Amtsgericht Potsdam HRB 18585\nKolf Glas- und Beschlaege GmbH – Teltow",
      "type": "Löschungsankündigung",
      "state": "Brandenburg",
      "amtsgericht": "Amtsgericht Potsdam",
      "registernummer": "HRB 18585",
      "registerart": "HRB",
      "company_name": "Kolf Glas- und Beschlaege GmbH",
      "company_seat": "Teltow",
      "details": "27.09.2025 (Bekanntmachungsdatum)\n\nBrandenburg Amtsgericht Potsdam HRB 18585\nLöschungsankündigung\n\nKolf Glas- und Beschlaege GmbH\nGesellschaft mit beschränkter Haftung\nTeltow\n\nBei der nachstehenden Gesellschaft wird das Amtslöschungsverfahren gemäß § 394 FamFG eingeleitet.\nDie Widerspruchsfrist beträgt 8 Wochen."
    }
  ]
}