{
  "date": "2025-09-26",
  "date_of_scrape": "2025-10-27T15:37:32.000Z",
  "tool_version": "0.2.0",
  "number_of_announcements": 161,
  "announcements": [
    {
      "date": "2025-09-26",
      "id": "131555",
      "original_text": "Registerbekanntmachung nach dem Umwandlungsgesetz\nBayern Amtsgericht München HRB 66636\nDehner Versicherungsmakler GmbH – München",
      "type": "Registerbekanntmachung nach dem Umwandlungsgesetz",
      "state": "Bayern",
      "amtsgericht": "Amtsgericht München",
      "registernummer": "HRB 66636",
      "registerart": "HRB",
      "company_name": "Dehner Versicherungsmakler GmbH",
      "company_seat": "München",
      "details": "26.09.2025 (Bekanntmachungsdatum)\n\nBayern Amtsgericht München HRB 66636\nRegisterbekanntmachung nach dem Umwandlungsgesetz 25.09.2025 (Eintragungsdatum)\n\nDehner Versicherungsmakler GmbH\nGesellschaft mit beschränkter Haftung\nMünchen\n\nDen Gläubigern der an der Verschmelzung beteiligten Rechtsträger ist, wenn sie binnen sechs Monaten nach dem Tag, an dem die Eintragung der Verschmelzung in das Register des Sitzes desjenigen Rechtsträgers, dessen Gläubiger sie sind, nach § 19 Abs. 3 UmwG als bekannt gemacht gilt, ihren Anspruch nach Grund und Höhe in Textform anmelden, Sicherheit zu leisten, soweit sie nicht Befriedigung verlangen können. Dieses Recht steht den Gläubigern jedoch nur zu, wenn sie glaubhaft machen, dass durch die Verschmelzung die Erfüllung ihrer Forderung gefährdet wird."
    },
    {
      "date": "2025-09-26",
      "id": "131556",
      "original_text": "Registerbekanntmachung nach dem Umwandlungsgesetz\nBayern Amtsgericht Landshut HRA 7070\nLWB Steinl GmbH & Co. KG – Altdorf",
      "type": "Registerbekanntmachung nach dem Umwandlungsgesetz",
      "state": "Bayern",
      "amtsgericht": "Amtsgericht Landshut",
      "registernummer": "HRA 7070",
      "registerart": "HRA",
      "company_name": "LWB Steinl GmbH & Co. KG",
      "company_seat": "Altdorf",
      "details": "26.09.2025 (Bekanntmachungsdatum)\n\nBayern Amtsgericht Landshut HRA 7070\nRegisterbekanntmachung nach dem Umwandlungsgesetz 25.09.2025 (Eintragungsdatum)\n\nLWB Steinl GmbH & Co. KG\nKommanditgesellschaft\nAltdorf\n\nDen Gläubigern des formwechselnden Rechtsträgers ist, wenn sie binnen sechs Monaten nach dem Tag, an dem die Eintragung des Formwechsels nach § 201 UmwG als bekannt gemacht gilt, ihren Anspruch nach Grund und Höhe in Textform anmelden, Sicherheit zu leisten, soweit sie nicht Befriedigung verlangen können. Dieses Recht steht den Gläubigern jedoch nur zu, wenn sie glaubhaft machen, dass durch den Formwechsel die Erfüllung ihrer Forderung gefährdet wird."
    },
    {
      "date": "2025-09-26",
      "id": "131557",
      "original_text": "Registerbekanntmachung nach dem Umwandlungsgesetz\nBayern Amtsgericht Fürth HRB 22090\nHaYo Logistik GmbH – Fürth",
      "type": "Registerbekanntmachung nach dem Umwandlungsgesetz",
      "state": "Bayern",
      "amtsgericht": "Amtsgericht Fürth",
      "registernummer": "HRB 22090",
      "registerart": "HRB",
      "company_name": "HaYo Logistik GmbH",
      "company_seat": "Fürth",
      "details": "26.09.2025 (Bekanntmachungsdatum)\n\nBayern Amtsgericht Fürth HRB 22090\nRegisterbekanntmachung nach dem Umwandlungsgesetz 25.09.2025 (Eintragungsdatum)\n\nHaYo Logistik GmbH\nGesellschaft mit beschränkter Haftung\nFürth\n\nDen Gläubigern der an der Ausgliederung beteiligten Rechtsträger ist, wenn sie binnen sechs Monaten nach dem Tag, an dem die Eintragung der Ausgliederung in das Register des Sitzes desjenigen Rechtsträgers, dessen Gläubiger sie sind, nach §§ 125, 19 Abs. 3 UmwG als bekannt gemacht gilt, ihren Anspruch nach Grund und Höhe in Textform anmelden, Sicherheit zu leisten, soweit sie nicht Befriedigung verlangen können. Dieses Recht steht den Gläubigern jedoch nur zu, wenn sie glaubhaft machen, dass durch die Ausgliederung die Erfüllung ihrer Forderung gefährdet wird."
    },
    {
      "date": "2025-09-26",
      "id": "131558",
      "original_text": "Registerbekanntmachung nach dem Umwandlungsgesetz\nBayern Amtsgericht Nürnberg HRB 45018\nLYRA Bleistiftfabrik GmbH – Nürnberg",
      "type": "Registerbekanntmachung nach dem Umwandlungsgesetz",
      "state": "Bayern",
      "amtsgericht": "Amtsgericht Nürnberg",
      "registernummer": "HRB 45018",
      "registerart": "HRB",
      "company_name": "LYRA Bleistiftfabrik GmbH",
      "company_seat": "Nürnberg",
      "details": "26.09.2025 (Bekanntmachungsdatum)\n\nBayern Amtsgericht Nürnberg HRB 45018\nRegisterbekanntmachung nach dem Umwandlungsgesetz 25.09.2025 (Eintragungsdatum)\n\nLYRA Bleistiftfabrik GmbH\nGesellschaft mit beschränkter Haftung\nNürnberg\n\nDen Gläubigern des formwechselnden Rechtsträgers ist, wenn sie binnen sechs Monaten nach dem Tag, an dem die Eintragung des Formwechsels nach § 201 UmwG als bekannt gemacht gilt, ihren Anspruch nach Grund und Höhe in Textform anmelden, Sicherheit zu leisten, soweit sie nicht Befriedigung verlangen können. Dieses Recht steht den Gläubigern jedoch nur zu, wenn sie glaubhaft machen, dass durch den Formwechsel die Erfüllung ihrer Forderung gefährdet wird."
    },
    {
      "date": "2025-09-26",
      "id": "131559",
      "original_text": "Einreichung neuer Dokumente\nBayern Amtsgericht Ingolstadt HRB 9891\nAUMOVIO Microelectronic GmbH – Ingolstadt",
      "type": "Einreichung neuer Dokumente",
      "state": "Bayern",
      "amtsgericht": "Amtsgericht Ingolstadt",
      "registernummer": "HRB 9891",
      "registerart": "HRB",
      "company_name": "AUMOVIO Microelectronic GmbH",
      "company_seat": "Ingolstadt",
      "details": "26.09.2025 (Bekanntmachungsdatum)\n\nBayern Amtsgericht Ingolstadt HRB 9891\nEinreichung neuer Dokumente\n\nAUMOVIO Microelectronic GmbH\nGesellschaft mit beschränkter Haftung\nIngolstadt\n\nDem Amtsgericht Ingolstadt -Registergericht- ist eine Liste der Mitglieder des Aufsichtsrats eingereicht worden, § 52 Abs. 3 S. 2 GmbHG."
    },
    {
      "date": "2025-09-26",
      "id": "131560",
      "original_text": "Löschungsankündigung\nBayern Amtsgericht Nürnberg HRB 27676\ncallMAXX Vertriebsgesellschaft mbH – Lauf a.d.Pegnitz",
      "type": "Löschungsankündigung",
      "state": "Bayern",
      "amtsgericht": "Amtsgericht Nürnberg",
      "registernummer": "HRB 27676",
      "registerart": "HRB",
      "company_name": "callMAXX Vertriebsgesellschaft mbH",
      "company_seat": "Lauf a.d.Pegnitz",
      "details": "26.09.2025 (Bekanntmachungsdatum)\n\nBayern Amtsgericht Nürnberg HRB 27676\nLöschungsankündigung\n\ncallMAXX Vertriebsgesellschaft mbH\nGesellschaft mit beschränkter Haftung\nLauf a.d.Pegnitz\n\nDas Registergericht beabsichtigt, den im Handelsregister eingetragenen Geschäftsführer wegen fehlender Eignung nach § 395 FamFG zu löschen. Die Frist zur Erhebung eines Widerspruchs ist auf zwei Monate festgesetzt."
    },
    {
      "date": "2025-09-26",
      "id": "131561",
      "original_text": "Registerbekanntmachung nach dem Umwandlungsgesetz\nBayern Amtsgericht München HRB 108093\nPeter Kaletsch GmbH – München",
      "type": "Registerbekanntmachung nach dem Umwandlungsgesetz",
      "state": "Bayern",
      "amtsgericht": "Amtsgericht München",
      "registernummer": "HRB 108093",
      "registerart": "HRB",
      "company_name": "Peter Kaletsch GmbH",
      "company_seat": "München",
      "details": "26.09.2025 (Bekanntmachungsdatum)\n\nBayern Amtsgericht München HRB 108093\nRegisterbekanntmachung nach dem Umwandlungsgesetz 25.09.2025 (Eintragungsdatum)\n\nPeter Kaletsch GmbH\nGesellschaft mit beschränkter Haftung\nMünchen\n\nDen Gläubigern der an der Ausgliederung beteiligten Rechtsträger ist, wenn sie binnen sechs Monaten nach dem Tag, an dem die Eintragung der Ausgliederung in das Register des Sitzes desjenigen Rechtsträgers, dessen Gläubiger sie sind, nach §§ 125, 19 Abs. 3 UmwG als bekannt gemacht gilt, ihren Anspruch nach Grund und Höhe in Textform anmelden, Sicherheit zu leisten, soweit sie nicht Befriedigung verlangen können. Dieses Recht steht den Gläubigern jedoch nur zu, wenn sie glaubhaft machen, dass durch die Ausgliederung die Erfüllung ihrer Forderung gefährdet wird."
    },
    {
      "date": "2025-09-26",
      "id": "131562",
      "original_text": "Registerbekanntmachung nach dem Umwandlungsgesetz\nBayern Amtsgericht Landshut HRB 15009\nLWB Steinl GmbH – Altdorf",
      "type": "Registerbekanntmachung nach dem Umwandlungsgesetz",
      "state": "Bayern",
      "amtsgericht": "Amtsgericht Landshut",
      "registernummer": "HRB 15009",
      "registerart": "HRB",
      "company_name": "LWB Steinl GmbH",
      "company_seat": "Altdorf",
      "details": "26.09.2025 (Bekanntmachungsdatum)\n\nBayern Amtsgericht Landshut HRB 15009\nRegisterbekanntmachung nach dem Umwandlungsgesetz 25.09.2025 (Eintragungsdatum)\n\nLWB Steinl GmbH\nGesellschaft mit beschränkter Haftung\nAltdorf"
    },
    {
      "date": "2025-09-26",
      "id": "131563",
      "original_text": "Einreichung neuer Dokumente\nBayern Amtsgericht Memmingen HRB 14199\nS.D.L. Süddeutsche Leasing AG – Elchingen",
      "type": "Einreichung neuer Dokumente",
      "state": "Bayern",
      "amtsgericht": "Amtsgericht Memmingen",
      "registernummer": "HRB 14199",
      "registerart": "HRB",
      "company_name": "S.D.L. Süddeutsche Leasing AG",
      "company_seat": "Elchingen",
      "details": "26.09.2025 (Bekanntmachungsdatum)\n\nBayern Amtsgericht Memmingen HRB 14199\nEinreichung neuer Dokumente\n\nS.D.L. Süddeutsche Leasing AG\nAktiengesellschaft\nElchingen\n\nDem Amtsgericht Memmingen -Registergericht- ist eine Liste der Mitglieder des Aufsichtsrats eingereicht worden, § 106 AktG."
    },
    {
      "date": "2025-09-26",
      "id": "131564",
      "original_text": "Registerbekanntmachung nach dem Umwandlungsgesetz\nBayern Amtsgericht München HRB 199542\nXOOL GmbH – München",
      "type": "Registerbekanntmachung nach dem Umwandlungsgesetz",
      "state": "Bayern",
      "amtsgericht": "Amtsgericht München",
      "registernummer": "HRB 199542",
      "registerart": "HRB",
      "company_name": "XOOL GmbH",
      "company_seat": "München",
      "details": "26.09.2025 (Bekanntmachungsdatum)\n\nBayern Amtsgericht München HRB 199542\nRegisterbekanntmachung nach dem Umwandlungsgesetz 25.09.2025 (Eintragungsdatum)\n\nXOOL GmbH\nGesellschaft mit beschränkter Haftung\nMünchen\n\nDen Gläubigern der an der Verschmelzung beteiligten Rechtsträger ist, wenn sie binnen sechs Monaten nach dem Tag, an dem die Eintragung der Verschmelzung in das Register des Sitzes desjenigen Rechtsträgers, dessen Gläubiger sie sind, nach § 19 Abs. 3 UmwG als bekannt gemacht gilt, ihren Anspruch nach Grund und Höhe in Textform anmelden, Sicherheit zu leisten, soweit sie nicht Befriedigung verlangen können. Dieses Recht steht den Gläubigern jedoch nur zu, wenn sie glaubhaft machen, dass durch die Verschmelzung die Erfüllung ihrer Forderung gefährdet wird."
    },
    {
      "date": "2025-09-26",
      "id": "131565",
      "original_text": "Registerbekanntmachung nach dem Umwandlungsgesetz\nBayern Amtsgericht München HRA 74782\nSchuh & Rose GmbH & Co. KG – München",
      "type": "Registerbekanntmachung nach dem Umwandlungsgesetz",
      "state": "Bayern",
      "amtsgericht": "Amtsgericht München",
      "registernummer": "HRA 74782",
      "registerart": "HRA",
      "company_name": "Schuh & Rose GmbH & Co. KG",
      "company_seat": "München",
      "details": "26.09.2025 (Bekanntmachungsdatum)\n\nBayern Amtsgericht München HRA 74782\nRegisterbekanntmachung nach dem Umwandlungsgesetz 25.09.2025 (Eintragungsdatum)\n\nSchuh & Rose GmbH & Co. KG\nKommanditgesellschaft\nMünchen\n\nDen Gläubigern des formwechselnden Rechtsträgers ist, wenn sie binnen sechs Monaten nach dem Tag, an dem die Eintragung des Formwechsels nach § 201 UmwG als bekannt gemacht gilt, ihren Anspruch nach Grund und Höhe in Textform anmelden, Sicherheit zu leisten, soweit sie nicht Befriedigung verlangen können. Dieses Recht steht den Gläubigern jedoch nur zu, wenn sie glaubhaft machen, dass durch den Formwechsel die Erfüllung ihrer Forderung gefährdet wird."
    },
    {
      "date": "2025-09-26",
      "id": "131566",
      "original_text": "Registerbekanntmachung nach dem Umwandlungsgesetz\nBayern Amtsgericht München HRB 271718\nkaimo holding GmbH – Grünwald",
      "type": "Registerbekanntmachung nach dem Umwandlungsgesetz",
      "state": "Bayern",
      "amtsgericht": "Amtsgericht München",
      "registernummer": "HRB 271718",
      "registerart": "HRB",
      "company_name": "kaimo holding GmbH",
      "company_seat": "Grünwald",
      "details": "26.09.2025 (Bekanntmachungsdatum)\n\nBayern Amtsgericht München HRB 271718\nRegisterbekanntmachung nach dem Umwandlungsgesetz 25.09.2025 (Eintragungsdatum)\n\nkaimo holding GmbH\nGesellschaft mit beschränkter Haftung\nGrünwald\n\nDen Gläubigern der an der Verschmelzung beteiligten Rechtsträger ist, wenn sie binnen sechs Monaten nach dem Tag, an dem die Eintragung der Verschmelzung in das Register des Sitzes desjenigen Rechtsträgers, dessen Gläubiger sie sind, nach § 19 Abs. 3 UmwG als bekannt gemacht gilt, ihren Anspruch nach Grund und Höhe in Textform anmelden, Sicherheit zu leisten, soweit sie nicht Befriedigung verlangen können. Dieses Recht steht den Gläubigern jedoch nur zu, wenn sie glaubhaft machen, dass durch die Verschmelzung die Erfüllung ihrer Forderung gefährdet wird."
    },
    {
      "date": "2025-09-26",
      "id": "131567",
      "original_text": "Registerbekanntmachung nach dem Umwandlungsgesetz\nBayern Amtsgericht Aschaffenburg HRB 14823\nProWohnen - Miteinander leben GmbH – Eschau",
      "type": "Registerbekanntmachung nach dem Umwandlungsgesetz",
      "state": "Bayern",
      "amtsgericht": "Amtsgericht Aschaffenburg",
      "registernummer": "HRB 14823",
      "registerart": "HRB",
      "company_name": "ProWohnen - Miteinander leben GmbH",
      "company_seat": "Eschau",
      "details": "26.09.2025 (Bekanntmachungsdatum)\n\nBayern Amtsgericht Aschaffenburg HRB 14823\nRegisterbekanntmachung nach dem Umwandlungsgesetz 25.09.2025 (Eintragungsdatum)\n\nProWohnen - Miteinander leben GmbH\nGesellschaft mit beschränkter Haftung\nEschau\n\nDen Gläubigern der an der Verschmelzung beteiligten Rechtsträger ist, wenn sie binnen sechs Monaten nach dem Tag, an dem die Eintragung der Verschmelzung in das Register des Sitzes desjenigen Rechtsträgers, dessen Gläubiger sie sind, nach § 19 Abs. 3 UmwG als bekannt gemacht gilt, ihren Anspruch nach Grund und Höhe in Textform anmelden, Sicherheit zu leisten, soweit sie nicht Befriedigung verlangen können. Dieses Recht steht den Gläubigern jedoch nur zu, wenn sie glaubhaft machen, dass durch die Verschmelzung die Erfüllung ihrer Forderung gefährdet wird."
    },
    {
      "date": "2025-09-26",
      "id": "131568",
      "original_text": "Registerbekanntmachung nach dem Umwandlungsgesetz\nBayern Amtsgericht Bamberg HRB 6467\nLutz GmbH – Baunach",
      "type": "Registerbekanntmachung nach dem Umwandlungsgesetz",
      "state": "Bayern",
      "amtsgericht": "Amtsgericht Bamberg",
      "registernummer": "HRB 6467",
      "registerart": "HRB",
      "company_name": "Lutz GmbH",
      "company_seat": "Baunach",
      "details": "26.09.2025 (Bekanntmachungsdatum)\n\nBayern Amtsgericht Bamberg HRB 6467\nRegisterbekanntmachung nach dem Umwandlungsgesetz 25.09.2025 (Eintragungsdatum)\n\nLutz GmbH\nGesellschaft mit beschränkter Haftung\nBaunach\n\nDen Gläubigern der an der Ausgliederung beteiligten Rechtsträger ist, wenn sie binnen sechs Monaten nach dem Tag, an dem die Eintragung der Ausgliederung in das Register des Sitzes desjenigen Rechtsträgers, dessen Gläubiger sie sind, nach §§ 125, 19 Abs. 3 UmwG als bekannt gemacht gilt, ihren Anspruch nach Grund und Höhe in Textform anmelden, Sicherheit zu leisten, soweit sie nicht Befriedigung verlangen können. Dieses Recht steht den Gläubigern jedoch nur zu, wenn sie glaubhaft machen, dass durch die Ausgliederung die Erfüllung ihrer Forderung gefährdet wird."
    },
    {
      "date": "2025-09-26",
      "id": "131569",
      "original_text": "Registerbekanntmachung nach dem Umwandlungsgesetz\nBayern Amtsgericht Regensburg HRB 5026\ncafé+co Deutschland GmbH – Wenzenbach",
      "type": "Registerbekanntmachung nach dem Umwandlungsgesetz",
      "state": "Bayern",
      "amtsgericht": "Amtsgericht Regensburg",
      "registernummer": "HRB 5026",
      "registerart": "HRB",
      "company_name": "café+co Deutschland GmbH",
      "company_seat": "Wenzenbach",
      "details": "26.09.2025 (Bekanntmachungsdatum)\n\nBayern Amtsgericht Regensburg HRB 5026\nRegisterbekanntmachung nach dem Umwandlungsgesetz 25.09.2025 (Eintragungsdatum)\n\ncafé+co Deutschland GmbH\nGesellschaft mit beschränkter Haftung\nWenzenbach\n\nDen Gläubigern der an der Verschmelzung beteiligten Rechtsträger ist, wenn sie binnen sechs Monaten nach dem Tag, an dem die Eintragung der Verschmelzung in das Register des Sitzes desjenigen Rechtsträgers, dessen Gläubiger sie sind, nach § 19 Abs. 3 UmwG als bekannt gemacht gilt, ihren Anspruch nach Grund und Höhe in Textform anmelden, Sicherheit zu leisten, soweit sie nicht Befriedigung verlangen können. Dieses Recht steht den Gläubigern jedoch nur zu, wenn sie glaubhaft machen, dass durch die Verschmelzung die Erfüllung ihrer Forderung gefährdet wird."
    },
    {
      "date": "2025-09-26",
      "id": "131570",
      "original_text": "Registerbekanntmachung nach dem Umwandlungsgesetz\nBayern Amtsgericht Nürnberg HRB 43425\nBSQ Residuum GmbH – Nürnberg",
      "type": "Registerbekanntmachung nach dem Umwandlungsgesetz",
      "state": "Bayern",
      "amtsgericht": "Amtsgericht Nürnberg",
      "registernummer": "HRB 43425",
      "registerart": "HRB",
      "company_name": "BSQ Residuum GmbH",
      "company_seat": "Nürnberg",
      "details": "26.09.2025 (Bekanntmachungsdatum)\n\nBayern Amtsgericht Nürnberg HRB 43425\nRegisterbekanntmachung nach dem Umwandlungsgesetz 25.09.2025 (Eintragungsdatum)\n\nBSQ Residuum GmbH\nGesellschaft mit beschränkter Haftung\nNürnberg\n\nDen Gläubigern der an der Verschmelzung beteiligten Rechtsträger ist, wenn sie binnen sechs Monaten nach dem Tag, an dem die Eintragung der Verschmelzung in das Register des Sitzes desjenigen Rechtsträgers, dessen Gläubiger sie sind, nach § 19 Abs. 3 UmwG als bekannt gemacht gilt, ihren Anspruch nach Grund und Höhe in Textform anmelden, Sicherheit zu leisten, soweit sie nicht Befriedigung verlangen können. Dieses Recht steht den Gläubigern jedoch nur zu, wenn sie glaubhaft machen, dass durch die Verschmelzung die Erfüllung ihrer Forderung gefährdet wird."
    },
    {
      "date": "2025-09-26",
      "id": "131571",
      "original_text": "Registerbekanntmachung nach dem Umwandlungsgesetz\nBayern Amtsgericht Nürnberg HRB 45020\nKK Sport GmbH – Schwaig",
      "type": "Registerbekanntmachung nach dem Umwandlungsgesetz",
      "state": "Bayern",
      "amtsgericht": "Amtsgericht Nürnberg",
      "registernummer": "HRB 45020",
      "registerart": "HRB",
      "company_name": "KK Sport GmbH",
      "company_seat": "Schwaig",
      "details": "26.09.2025 (Bekanntmachungsdatum)\n\nBayern Amtsgericht Nürnberg HRB 45020\nRegisterbekanntmachung nach dem Umwandlungsgesetz 25.09.2025 (Eintragungsdatum)\n\nKK Sport GmbH\nGesellschaft mit beschränkter Haftung\nSchwaig\n\nDen Gläubigern der an der Ausgliederung beteiligten Rechtsträger ist, wenn sie binnen sechs Monaten nach dem Tag, an dem die Eintragung der Ausgliederung in das Register des Sitzes desjenigen Rechtsträgers, dessen Gläubiger sie sind, nach §§ 125, 19 Abs. 3 UmwG als bekannt gemacht gilt, ihren Anspruch nach Grund und Höhe in Textform anmelden, Sicherheit zu leisten, soweit sie nicht Befriedigung verlangen können. Dieses Recht steht den Gläubigern jedoch nur zu, wenn sie glaubhaft machen, dass durch die Ausgliederung die Erfüllung ihrer Forderung gefährdet wird."
    },
    {
      "date": "2025-09-26",
      "id": "131572",
      "original_text": "Registerbekanntmachung nach dem Umwandlungsgesetz\nBayern Amtsgericht Nürnberg HRA 20388\nKK Sport e.K. – Schwaig",
      "type": "Registerbekanntmachung nach dem Umwandlungsgesetz",
      "state": "Bayern",
      "amtsgericht": "Amtsgericht Nürnberg",
      "registernummer": "HRA 20388",
      "registerart": "HRA",
      "company_name": "KK Sport e.K.",
      "company_seat": "Schwaig",
      "details": "26.09.2025 (Bekanntmachungsdatum)\n\nBayern Amtsgericht Nürnberg HRA 20388\nRegisterbekanntmachung nach dem Umwandlungsgesetz 25.09.2025 (Eintragungsdatum)\n\nKK Sport e.K.\nEinzelkaufmann / Einzelkauffrau\nSchwaig\n\nDen Gläubigern der an der Ausgliederung beteiligten Rechtsträger ist, wenn sie binnen sechs Monaten nach dem Tag, an dem die Eintragung der Ausgliederung in das Register des Sitzes desjenigen Rechtsträgers, dessen Gläubiger sie sind, nach §§ 125, 19 Abs. 3 UmwG als bekannt gemacht gilt, ihren Anspruch nach Grund und Höhe in Textform anmelden, Sicherheit zu leisten, soweit sie nicht Befriedigung verlangen können. Dieses Recht steht den Gläubigern jedoch nur zu, wenn sie glaubhaft machen, dass durch die Ausgliederung die Erfüllung ihrer Forderung gefährdet wird."
    },
    {
      "date": "2025-09-26",
      "id": "131573",
      "original_text": "Einreichung neuer Dokumente\nBayern Amtsgericht Augsburg HRB 20757\nFaurecia Emissions Control Technologies, Germany GmbH – Augsburg",
      "type": "Einreichung neuer Dokumente",
      "state": "Bayern",
      "amtsgericht": "Amtsgericht Augsburg",
      "registernummer": "HRB 20757",
      "registerart": "HRB",
      "company_name": "Faurecia Emissions Control Technologies, Germany GmbH",
      "company_seat": "Augsburg",
      "details": "26.09.2025 (Bekanntmachungsdatum)\n\nBayern Amtsgericht Augsburg HRB 20757\nEinreichung neuer Dokumente 25.09.2025 (Eintragungsdatum)\n\nFaurecia Emissions Control Technologies, Germany GmbH\nGesellschaft mit beschränkter Haftung\nAugsburg\n\nDem Amtsgericht Augsburg -Registergericht- ist eine Liste der Mitglieder des Aufsichtsrats eingereicht worden, § 52 Abs. 3 S. 2 GmbHG."
    },
    {
      "date": "2025-09-26",
      "id": "131574",
      "original_text": "Registerbekanntmachung nach dem Umwandlungsgesetz\nBayern Amtsgericht Coburg HRB 3824\nMetallbautechnik Ohland GmbH – Bad Rodach",
      "type": "Registerbekanntmachung nach dem Umwandlungsgesetz",
      "state": "Bayern",
      "amtsgericht": "Amtsgericht Coburg",
      "registernummer": "HRB 3824",
      "registerart": "HRB",
      "company_name": "Metallbautechnik Ohland GmbH",
      "company_seat": "Bad Rodach",
      "details": "26.09.2025 (Bekanntmachungsdatum)\n\nBayern Amtsgericht Coburg HRB 3824\nRegisterbekanntmachung nach dem Umwandlungsgesetz 22.09.2025 (Eintragungsdatum)\n\nMetallbautechnik Ohland GmbH\nGesellschaft mit beschränkter Haftung\nBad Rodach\n\nDen Gläubigern der an der Verschmelzung beteiligten Rechtsträger ist, wenn sie binnen sechs Monaten nach dem Tag, an dem die Eintragung der Verschmelzung in das Register des Sitzes desjenigen Rechtsträgers, dessen Gläubiger sie sind, nach § 19 Abs. 3 UmwG als bekannt gemacht gilt, ihren Anspruch nach Grund und Höhe in Textform anmelden, Sicherheit zu leisten, soweit sie nicht Befriedigung verlangen können. Dieses Recht steht den Gläubigern jedoch nur zu, wenn sie glaubhaft machen, dass durch die Verschmelzung die Erfüllung ihrer Forderung gefährdet wird."
    },
    {
      "date": "2025-09-26",
      "id": "131575",
      "original_text": "Registerbekanntmachung nach dem Umwandlungsgesetz\nBayern Amtsgericht Bamberg HRB 12151\nspaceless GmbH – Baunach",
      "type": "Registerbekanntmachung nach dem Umwandlungsgesetz",
      "state": "Bayern",
      "amtsgericht": "Amtsgericht Bamberg",
      "registernummer": "HRB 12151",
      "registerart": "HRB",
      "company_name": "spaceless GmbH",
      "company_seat": "Baunach",
      "details": "26.09.2025 (Bekanntmachungsdatum)\n\nBayern Amtsgericht Bamberg HRB 12151\nRegisterbekanntmachung nach dem Umwandlungsgesetz 25.09.2025 (Eintragungsdatum)\n\nspaceless GmbH\nGesellschaft mit beschränkter Haftung\nBaunach\n\nDen Gläubigern der an der Ausgliederung beteiligten Rechtsträger ist, wenn sie binnen sechs Monaten nach dem Tag, an dem die Eintragung der Ausgliederung in das Register des Sitzes desjenigen Rechtsträgers, dessen Gläubiger sie sind, nach §§ 125, 19 Abs. 3 UmwG als bekannt gemacht gilt, ihren Anspruch nach Grund und Höhe in Textform anmelden, Sicherheit zu leisten, soweit sie nicht Befriedigung verlangen können. Dieses Recht steht den Gläubigern jedoch nur zu, wenn sie glaubhaft machen, dass durch die Ausgliederung die Erfüllung ihrer Forderung gefährdet wird."
    },
    {
      "date": "2025-09-26",
      "id": "131576",
      "original_text": "Registerbekanntmachung nach dem Umwandlungsgesetz\nBayern Amtsgericht München HRB 261209\nNew Outcome GmbH – München",
      "type": "Registerbekanntmachung nach dem Umwandlungsgesetz",
      "state": "Bayern",
      "amtsgericht": "Amtsgericht München",
      "registernummer": "HRB 261209",
      "registerart": "HRB",
      "company_name": "New Outcome GmbH",
      "company_seat": "München",
      "details": "26.09.2025 (Bekanntmachungsdatum)\n\nBayern Amtsgericht München HRB 261209\nRegisterbekanntmachung nach dem Umwandlungsgesetz 25.09.2025 (Eintragungsdatum)\n\nNew Outcome GmbH\nGesellschaft mit beschränkter Haftung\nMünchen\n\nDen Gläubigern der an der Verschmelzung beteiligten Rechtsträger ist, wenn sie binnen sechs Monaten nach dem Tag, an dem die Eintragung der Verschmelzung in das Register des Sitzes desjenigen Rechtsträgers, dessen Gläubiger sie sind, nach § 19 Abs. 3 UmwG als bekannt gemacht gilt, ihren Anspruch nach Grund und Höhe in Textform anmelden, Sicherheit zu leisten, soweit sie nicht Befriedigung verlangen können. Dieses Recht steht den Gläubigern jedoch nur zu, wenn sie glaubhaft machen, dass durch die Verschmelzung die Erfüllung ihrer Forderung gefährdet wird."
    },
    {
      "date": "2025-09-26",
      "id": "131577",
      "original_text": "Registerbekanntmachung nach dem Umwandlungsgesetz\nBayern Amtsgericht Würzburg HRA 8992\nHugo Kämpf GmbH & Co. KG – Thüngen",
      "type": "Registerbekanntmachung nach dem Umwandlungsgesetz",
      "state": "Bayern",
      "amtsgericht": "Amtsgericht Würzburg",
      "registernummer": "HRA 8992",
      "registerart": "HRA",
      "company_name": "Hugo Kämpf GmbH & Co. KG",
      "company_seat": "Thüngen",
      "details": "26.09.2025 (Bekanntmachungsdatum)\n\nBayern Amtsgericht Würzburg HRA 8992\nRegisterbekanntmachung nach dem Umwandlungsgesetz 25.09.2025 (Eintragungsdatum)\n\nHugo Kämpf GmbH & Co. KG\nKommanditgesellschaft\nThüngen\n\nDen Gläubigern der an der Ausgliederung beteiligten Rechtsträger ist, wenn sie binnen sechs Monaten nach dem Tag, an dem die Eintragung der Ausgliederung in das Register des Sitzes desjenigen Rechtsträgers, dessen Gläubiger sie sind, nach §§ 125, 19 Abs. 3 UmwG als bekannt gemacht gilt, ihren Anspruch nach Grund und Höhe in Textform anmelden, Sicherheit zu leisten, soweit sie nicht Befriedigung verlangen können. Dieses Recht steht den Gläubigern jedoch nur zu, wenn sie glaubhaft machen, dass durch die Ausgliederung die Erfüllung ihrer Forderung gefährdet wird."
    },
    {
      "date": "2025-09-26",
      "id": "131578",
      "original_text": "Registerbekanntmachung nach dem Umwandlungsgesetz\nBayern Amtsgericht Nürnberg HRB 4919\nLyra-Bleistift-Fabrik Verwaltungs-GmbH – Nürnberg",
      "type": "Registerbekanntmachung nach dem Umwandlungsgesetz",
      "state": "Bayern",
      "amtsgericht": "Amtsgericht Nürnberg",
      "registernummer": "HRB 4919",
      "registerart": "HRB",
      "company_name": "Lyra-Bleistift-Fabrik Verwaltungs-GmbH",
      "company_seat": "Nürnberg",
      "details": "26.09.2025 (Bekanntmachungsdatum)\n\nBayern Amtsgericht Nürnberg HRB 4919\nRegisterbekanntmachung nach dem Umwandlungsgesetz 25.09.2025 (Eintragungsdatum)\n\nLyra-Bleistift-Fabrik Verwaltungs-GmbH\nGesellschaft mit beschränkter Haftung\nNürnberg\n\nDen Gläubigern der an der Verschmelzung beteiligten Rechtsträger ist, wenn sie binnen sechs Monaten nach dem Tag, an dem die Eintragung der Verschmelzung in das Register des Sitzes desjenigen Rechtsträgers, dessen Gläubiger sie sind, nach § 19 Abs. 3 UmwG als bekannt gemacht gilt, ihren Anspruch nach Grund und Höhe in Textform anmelden, Sicherheit zu leisten, soweit sie nicht Befriedigung verlangen können. Dieses Recht steht den Gläubigern jedoch nur zu, wenn sie glaubhaft machen, dass durch die Verschmelzung die Erfüllung ihrer Forderung gefährdet wird."
    },
    {
      "date": "2025-09-26",
      "id": "131579",
      "original_text": "Registerbekanntmachung nach dem Umwandlungsgesetz\nBayern Amtsgericht München HRB 289909\nVimata Group GmbH – München",
      "type": "Registerbekanntmachung nach dem Umwandlungsgesetz",
      "state": "Bayern",
      "amtsgericht": "Amtsgericht München",
      "registernummer": "HRB 289909",
      "registerart": "HRB",
      "company_name": "Vimata Group GmbH",
      "company_seat": "München",
      "details": "26.09.2025 (Bekanntmachungsdatum)\n\nBayern Amtsgericht München HRB 289909\nRegisterbekanntmachung nach dem Umwandlungsgesetz 25.09.2025 (Eintragungsdatum)\n\nVimata Group GmbH\nGesellschaft mit beschränkter Haftung\nMünchen\n\nDen Gläubigern der an der Verschmelzung beteiligten Rechtsträger ist, wenn sie binnen sechs Monaten nach dem Tag, an dem die Eintragung der Verschmelzung in das Register des Sitzes desjenigen Rechtsträgers, dessen Gläubiger sie sind, nach § 19 Abs. 3 UmwG als bekannt gemacht gilt, ihren Anspruch nach Grund und Höhe in Textform anmelden, Sicherheit zu leisten, soweit sie nicht Befriedigung verlangen können. Dieses Recht steht den Gläubigern jedoch nur zu, wenn sie glaubhaft machen, dass durch die Verschmelzung die Erfüllung ihrer Forderung gefährdet wird."
    },
    {
      "date": "2025-09-26",
      "id": "131580",
      "original_text": "Registerbekanntmachung nach dem Umwandlungsgesetz\nBayern Amtsgericht Fürth HRA 12591\nHayatti Yoldas e.K. – Fürth",
      "type": "Registerbekanntmachung nach dem Umwandlungsgesetz",
      "state": "Bayern",
      "amtsgericht": "Amtsgericht Fürth",
      "registernummer": "HRA 12591",
      "registerart": "HRA",
      "company_name": "Hayatti Yoldas e.K.",
      "company_seat": "Fürth",
      "details": "26.09.2025 (Bekanntmachungsdatum)\n\nBayern Amtsgericht Fürth HRA 12591\nRegisterbekanntmachung nach dem Umwandlungsgesetz 25.09.2025 (Eintragungsdatum)\n\nHayatti Yoldas e.K.\nEinzelkaufmann / Einzelkauffrau\nFürth\n\nDen Gläubigern der an der Ausgliederung beteiligten Rechtsträger ist, wenn sie binnen sechs Monaten nach dem Tag, an dem die Eintragung der Ausgliederung in das Register des Sitzes desjenigen Rechtsträgers, dessen Gläubiger sie sind, nach §§ 125, 19 Abs. 3 UmwG als bekannt gemacht gilt, ihren Anspruch nach Grund und Höhe in Textform anmelden, Sicherheit zu leisten, soweit sie nicht Befriedigung verlangen können. Dieses Recht steht den Gläubigern jedoch nur zu, wenn sie glaubhaft machen, dass durch die Ausgliederung die Erfüllung ihrer Forderung gefährdet wird."
    },
    {
      "date": "2025-09-26",
      "id": "131581",
      "original_text": "Einreichung neuer Dokumente\nBayern Amtsgericht Nürnberg HRB 31069\nFIT AG – Lupburg",
      "type": "Einreichung neuer Dokumente",
      "state": "Bayern",
      "amtsgericht": "Amtsgericht Nürnberg",
      "registernummer": "HRB 31069",
      "registerart": "HRB",
      "company_name": "FIT AG",
      "company_seat": "Lupburg",
      "details": "26.09.2025 (Bekanntmachungsdatum)\n\nBayern Amtsgericht Nürnberg HRB 31069\nEinreichung neuer Dokumente\n\nFIT AG\nAktiengesellschaft\nLupburg\n\nDem Amtsgericht Nürnberg -Registergericht- ist eine Liste der Mitglieder des Aufsichtsrats eingereicht worden, § 106 AktG."
    },
    {
      "date": "2025-09-26",
      "id": "131582",
      "original_text": "Löschungsankündigung\nBayern Amtsgericht München HRB 221001\nTUMA Verwaltungs UG (haftungsbeschränkt) – München",
      "type": "Löschungsankündigung",
      "state": "Bayern",
      "amtsgericht": "Amtsgericht München",
      "registernummer": "HRB 221001",
      "registerart": "HRB",
      "company_name": "TUMA Verwaltungs UG (haftungsbeschränkt)",
      "company_seat": "München",
      "details": "26.09.2025 (Bekanntmachungsdatum)\n\nBayern Amtsgericht München HRB 221001\nLöschungsankündigung 25.09.2025 (Eintragungsdatum)\n\nTUMA Verwaltungs UG (haftungsbeschränkt)\nGesellschaft mit beschränkter Haftung\nMünchen\n\nDas Registergericht beabsichtigt, die im Handelsregister eingetragene Gesellschaft wegen Vermögenslosigkeit von Amts wegen nach § 394 FamFG zu löschen. Die Frist zur Erhebung eines Widerspruchs ist auf drei Monate festgesetzt."
    },
    {
      "date": "2025-09-26",
      "id": "131583",
      "original_text": "Registerbekanntmachung nach dem Umwandlungsgesetz\nBayern Amtsgericht Aschaffenburg HRB 9555\nProWohnen - Miteinander leben GmbH – Eschau",
      "type": "Registerbekanntmachung nach dem Umwandlungsgesetz",
      "state": "Bayern",
      "amtsgericht": "Amtsgericht Aschaffenburg",
      "registernummer": "HRB 9555",
      "registerart": "HRB",
      "company_name": "ProWohnen - Miteinander leben GmbH",
      "company_seat": "Eschau",
      "details": "26.09.2025 (Bekanntmachungsdatum)\n\nBayern Amtsgericht Aschaffenburg HRB 9555\nRegisterbekanntmachung nach dem Umwandlungsgesetz 25.09.2025 (Eintragungsdatum)\n\nProWohnen - Miteinander leben GmbH\nGesellschaft mit beschränkter Haftung\nEschau\n\nDen Gläubigern der an der Verschmelzung beteiligten Rechtsträger ist, wenn sie binnen sechs Monaten nach dem Tag, an dem die Eintragung der Verschmelzung in das Register des Sitzes desjenigen Rechtsträgers, dessen Gläubiger sie sind, nach § 19 Abs. 3 UmwG als bekannt gemacht gilt, ihren Anspruch nach Grund und Höhe in Textform anmelden, Sicherheit zu leisten, soweit sie nicht Befriedigung verlangen können. Dieses Recht steht den Gläubigern jedoch nur zu, wenn sie glaubhaft machen, dass durch die Verschmelzung die Erfüllung ihrer Forderung gefährdet wird."
    },
    {
      "date": "2025-09-26",
      "id": "131584",
      "original_text": "Registerbekanntmachung nach dem Umwandlungsgesetz\nBayern Amtsgericht München HRB 225209\nHETA SFP Verwaltung GmbH – München",
      "type": "Registerbekanntmachung nach dem Umwandlungsgesetz",
      "state": "Bayern",
      "amtsgericht": "Amtsgericht München",
      "registernummer": "HRB 225209",
      "registerart": "HRB",
      "company_name": "HETA SFP Verwaltung GmbH",
      "company_seat": "München",
      "details": "26.09.2025 (Bekanntmachungsdatum)\n\nBayern Amtsgericht München HRB 225209\nRegisterbekanntmachung nach dem Umwandlungsgesetz 25.09.2025 (Eintragungsdatum)\n\nHETA SFP Verwaltung GmbH\nGesellschaft mit beschränkter Haftung\nMünchen\n\nDen Gläubigern der an der Verschmelzung beteiligten Rechtsträger ist, wenn sie binnen sechs Monaten nach dem Tag, an dem die Eintragung der Verschmelzung in das Register des Sitzes desjenigen Rechtsträgers, dessen Gläubiger sie sind, nach § 19 Abs. 3 UmwG als bekannt gemacht gilt, ihren Anspruch nach Grund und Höhe in Textform anmelden, Sicherheit zu leisten, soweit sie nicht Befriedigung verlangen können. Dieses Recht steht den Gläubigern jedoch nur zu, wenn sie glaubhaft machen, dass durch die Verschmelzung die Erfüllung ihrer Forderung gefährdet wird."
    },
    {
      "date": "2025-09-26",
      "id": "131585",
      "original_text": "Registerbekanntmachung nach dem Umwandlungsgesetz\nBayern Amtsgericht Memmingen HRA 14295\nKRIEGSMANN Montage + Service e.K. – Leipheim",
      "type": "Registerbekanntmachung nach dem Umwandlungsgesetz",
      "state": "Bayern",
      "amtsgericht": "Amtsgericht Memmingen",
      "registernummer": "HRA 14295",
      "registerart": "HRA",
      "company_name": "KRIEGSMANN Montage + Service e.K.",
      "company_seat": "Leipheim",
      "details": "26.09.2025 (Bekanntmachungsdatum)\n\nBayern Amtsgericht Memmingen HRA 14295\nRegisterbekanntmachung nach dem Umwandlungsgesetz 25.09.2025 (Eintragungsdatum)\n\nKRIEGSMANN Montage + Service e.K.\nEinzelkaufmann / Einzelkauffrau\nLeipheim\n\nDen Gläubigern der an der Ausgliederung beteiligten Rechtsträger ist, wenn sie binnen sechs Monaten nach dem Tag, an dem die Eintragung der Ausgliederung in das Register des Sitzes desjenigen Rechtsträgers, dessen Gläubiger sie sind, nach §§ 125, 19 Abs. 3 UmwG als bekannt gemacht gilt, ihren Anspruch nach Grund und Höhe in Textform anmelden, Sicherheit zu leisten, soweit sie nicht Befriedigung verlangen können. Dieses Recht steht den Gläubigern jedoch nur zu, wenn sie glaubhaft machen, dass durch die Ausgliederung die Erfüllung ihrer Forderung gefährdet wird."
    },
    {
      "date": "2025-09-26",
      "id": "131586",
      "original_text": "Registerbekanntmachung nach dem Umwandlungsgesetz\nBayern Amtsgericht München HRB 158981\nPaulaner Brauerei Gruppe GmbH & Co. KGaA – München",
      "type": "Registerbekanntmachung nach dem Umwandlungsgesetz",
      "state": "Bayern",
      "amtsgericht": "Amtsgericht München",
      "registernummer": "HRB 158981",
      "registerart": "HRB",
      "company_name": "Paulaner Brauerei Gruppe GmbH & Co. KGaA",
      "company_seat": "München",
      "details": "26.09.2025 (Bekanntmachungsdatum)\n\nBayern Amtsgericht München HRB 158981\nRegisterbekanntmachung nach dem Umwandlungsgesetz 25.09.2025 (Eintragungsdatum)\n\nPaulaner Brauerei Gruppe GmbH & Co. KGaA\nKommanditgesellschaft auf Aktien\nMünchen\n\nDen Gläubigern der an der Spaltung beteiligten Rechtsträger ist, wenn sie binnen sechs Monaten nach dem Tag, an dem die Eintragung der Spaltung in das Register des Sitzes desjenigen Rechtsträgers, dessen Gläubiger sie sind, nach §§ 125, 19 Abs. 3 UmwG als bekannt gemacht gilt, ihren Anspruch nach Grund und Höhe in Textform anmelden, Sicherheit zu leisten, soweit sie nicht Befriedigung verlangen können. Dieses Recht steht den Gläubigern jedoch nur zu, wenn sie glaubhaft machen, dass durch die Spaltung die Erfüllung ihrer Forderung gefährdet wird."
    },
    {
      "date": "2025-09-26",
      "id": "131587",
      "original_text": "Registerbekanntmachung nach dem Umwandlungsgesetz\nBayern Amtsgericht München HRB 271504\nAdhesive Tapes Holding GmbH – München",
      "type": "Registerbekanntmachung nach dem Umwandlungsgesetz",
      "state": "Bayern",
      "amtsgericht": "Amtsgericht München",
      "registernummer": "HRB 271504",
      "registerart": "HRB",
      "company_name": "Adhesive Tapes Holding GmbH",
      "company_seat": "München",
      "details": "26.09.2025 (Bekanntmachungsdatum)\n\nBayern Amtsgericht München HRB 271504\nRegisterbekanntmachung nach dem Umwandlungsgesetz 25.09.2025 (Eintragungsdatum)\n\nAdhesive Tapes Holding GmbH\nGesellschaft mit beschränkter Haftung\nMünchen\n\nDen Gläubigern der an der Verschmelzung beteiligten Rechtsträger ist, wenn sie binnen sechs Monaten nach dem Tag, an dem die Eintragung der Verschmelzung in das Register des Sitzes desjenigen Rechtsträgers, dessen Gläubiger sie sind, nach § 19 Abs. 3 UmwG als bekannt gemacht gilt, ihren Anspruch nach Grund und Höhe in Textform anmelden, Sicherheit zu leisten, soweit sie nicht Befriedigung verlangen können. Dieses Recht steht den Gläubigern jedoch nur zu, wenn sie glaubhaft machen, dass durch die Verschmelzung die Erfüllung ihrer Forderung gefährdet wird."
    },
    {
      "date": "2025-09-26",
      "id": "131588",
      "original_text": "Einreichung neuer Dokumente\nBayern Amtsgericht München HRB 199543\nApollo 5 GmbH – Starnberg",
      "type": "Einreichung neuer Dokumente",
      "state": "Bayern",
      "amtsgericht": "Amtsgericht München",
      "registernummer": "HRB 199543",
      "registerart": "HRB",
      "company_name": "Apollo 5 GmbH",
      "company_seat": "Starnberg",
      "details": "26.09.2025 (Bekanntmachungsdatum)\n\nBayern Amtsgericht München HRB 199543\nEinreichung neuer Dokumente\n\nApollo 5 GmbH\nGesellschaft mit beschränkter Haftung\nStarnberg\n\nDem Amtsgericht München -Registergericht- ist eine Liste der Mitglieder des Aufsichtsrats eingereicht worden, § 52 Abs. 3 S. 2 GmbHG."
    },
    {
      "date": "2025-09-26",
      "id": "131589",
      "original_text": "Registerbekanntmachung nach dem Umwandlungsgesetz\nBayern Amtsgericht München HRB 135437\nDr. Knecht & Cie. GmbH – Feldkirchen",
      "type": "Registerbekanntmachung nach dem Umwandlungsgesetz",
      "state": "Bayern",
      "amtsgericht": "Amtsgericht München",
      "registernummer": "HRB 135437",
      "registerart": "HRB",
      "company_name": "Dr. Knecht & Cie. GmbH",
      "company_seat": "Feldkirchen",
      "details": "26.09.2025 (Bekanntmachungsdatum)\n\nBayern Amtsgericht München HRB 135437\nRegisterbekanntmachung nach dem Umwandlungsgesetz 25.09.2025 (Eintragungsdatum)\n\nDr. Knecht & Cie. GmbH\nGesellschaft mit beschränkter Haftung\nFeldkirchen\n\nDen Gläubigern der an der Verschmelzung beteiligten Rechtsträger ist, wenn sie binnen sechs Monaten nach dem Tag, an dem die Eintragung der Verschmelzung in das Register des Sitzes desjenigen Rechtsträgers, dessen Gläubiger sie sind, nach § 19 Abs. 3 UmwG als bekannt gemacht gilt, ihren Anspruch nach Grund und Höhe in Textform anmelden, Sicherheit zu leisten, soweit sie nicht Befriedigung verlangen können. Dieses Recht steht den Gläubigern jedoch nur zu, wenn sie glaubhaft machen, dass durch die Verschmelzung die Erfüllung ihrer Forderung gefährdet wird."
    },
    {
      "date": "2025-09-26",
      "id": "131590",
      "original_text": "Registerbekanntmachung nach dem Umwandlungsgesetz\nBayern Amtsgericht München HRB 168399\nStargate Capital GmbH – München",
      "type": "Registerbekanntmachung nach dem Umwandlungsgesetz",
      "state": "Bayern",
      "amtsgericht": "Amtsgericht München",
      "registernummer": "HRB 168399",
      "registerart": "HRB",
      "company_name": "Stargate Capital GmbH",
      "company_seat": "München",
      "details": "26.09.2025 (Bekanntmachungsdatum)\n\nBayern Amtsgericht München HRB 168399\nRegisterbekanntmachung nach dem Umwandlungsgesetz 25.09.2025 (Eintragungsdatum)\n\nStargate Capital GmbH\nGesellschaft mit beschränkter Haftung\nMünchen\n\nDen Gläubigern der an der Verschmelzung beteiligten Rechtsträger ist, wenn sie binnen sechs Monaten nach dem Tag, an dem die Eintragung der Verschmelzung in das Register des Sitzes desjenigen Rechtsträgers, dessen Gläubiger sie sind, nach § 19 Abs. 3 UmwG als bekannt gemacht gilt, ihren Anspruch nach Grund und Höhe in Textform anmelden, Sicherheit zu leisten, soweit sie nicht Befriedigung verlangen können. Dieses Recht steht den Gläubigern jedoch nur zu, wenn sie glaubhaft machen, dass durch die Verschmelzung die Erfüllung ihrer Forderung gefährdet wird."
    },
    {
      "date": "2025-09-26",
      "id": "131591",
      "original_text": "Registerbekanntmachung nach dem Umwandlungsgesetz\nBayern Amtsgericht Würzburg HRB 9578\nHugo Kämpf Holding GmbH – Thüngen",
      "type": "Registerbekanntmachung nach dem Umwandlungsgesetz",
      "state": "Bayern",
      "amtsgericht": "Amtsgericht Würzburg",
      "registernummer": "HRB 9578",
      "registerart": "HRB",
      "company_name": "Hugo Kämpf Holding GmbH",
      "company_seat": "Thüngen",
      "details": "26.09.2025 (Bekanntmachungsdatum)\n\nBayern Amtsgericht Würzburg HRB 9578\nRegisterbekanntmachung nach dem Umwandlungsgesetz 25.09.2025 (Eintragungsdatum)\n\nHugo Kämpf Holding GmbH\nGesellschaft mit beschränkter Haftung\nThüngen\n\nDen Gläubigern der an der Ausgliederung beteiligten Rechtsträger ist, wenn sie binnen sechs Monaten nach dem Tag, an dem die Eintragung der Ausgliederung in das Register des Sitzes desjenigen Rechtsträgers, dessen Gläubiger sie sind, nach §§ 125, 19 Abs. 3 UmwG als bekannt gemacht gilt, ihren Anspruch nach Grund und Höhe in Textform anmelden, Sicherheit zu leisten, soweit sie nicht Befriedigung verlangen können. Dieses Recht steht den Gläubigern jedoch nur zu, wenn sie glaubhaft machen, dass durch die Ausgliederung die Erfüllung ihrer Forderung gefährdet wird."
    },
    {
      "date": "2025-09-26",
      "id": "131592",
      "original_text": "Löschungsankündigung\nBayern Amtsgericht München HRB 214390\nDo Brasil City GmbH – München",
      "type": "Löschungsankündigung",
      "state": "Bayern",
      "amtsgericht": "Amtsgericht München",
      "registernummer": "HRB 214390",
      "registerart": "HRB",
      "company_name": "Do Brasil City GmbH",
      "company_seat": "München",
      "details": "26.09.2025 (Bekanntmachungsdatum)\n\nBayern Amtsgericht München HRB 214390\nLöschungsankündigung\n\nDo Brasil City GmbH\nGesellschaft mit beschränkter Haftung\nMünchen\n\nDas Registergericht beabsichtigt, die im Handelsregister eingetragene Gesellschaft wegen Vermögenslosigkeit von Amts wegen nach § 394 FamFG zu löschen. Die Frist zur Erhebung eines Widerspruchs ist auf drei Monate festgesetzt."
    },
    {
      "date": "2025-09-26",
      "id": "131593",
      "original_text": "Registerbekanntmachung nach dem Umwandlungsgesetz\nBayern Amtsgericht Regensburg HRB 20641\ncafé+co Deutschland Beteiligungs-GmbH – Wenzenbach",
      "type": "Registerbekanntmachung nach dem Umwandlungsgesetz",
      "state": "Bayern",
      "amtsgericht": "Amtsgericht Regensburg",
      "registernummer": "HRB 20641",
      "registerart": "HRB",
      "company_name": "café+co Deutschland Beteiligungs-GmbH",
      "company_seat": "Wenzenbach",
      "details": "26.09.2025 (Bekanntmachungsdatum)\n\nBayern Amtsgericht Regensburg HRB 20641\nRegisterbekanntmachung nach dem Umwandlungsgesetz 25.09.2025 (Eintragungsdatum)\n\ncafé+co Deutschland Beteiligungs-GmbH\nGesellschaft mit beschränkter Haftung\nWenzenbach\n\nDen Gläubigern der an der Verschmelzung beteiligten Rechtsträger ist, wenn sie binnen sechs Monaten nach dem Tag, an dem die Eintragung der Verschmelzung in das Register des Sitzes desjenigen Rechtsträgers, dessen Gläubiger sie sind, nach § 19 Abs. 3 UmwG als bekannt gemacht gilt, ihren Anspruch nach Grund und Höhe in Textform anmelden, Sicherheit zu leisten, soweit sie nicht Befriedigung verlangen können. Dieses Recht steht den Gläubigern jedoch nur zu, wenn sie glaubhaft machen, dass durch die Verschmelzung die Erfüllung ihrer Forderung gefährdet wird."
    },
    {
      "date": "2025-09-26",
      "id": "131594",
      "original_text": "Einreichung neuer Dokumente\nBaden-Württemberg Amtsgericht Ulm HRB 701678\nRobert Bosch Automotive Steering GmbH – Schwäbisch Gmünd",
      "type": "Einreichung neuer Dokumente",
      "state": "Baden-Württemberg",
      "amtsgericht": "Amtsgericht Ulm",
      "registernummer": "HRB 701678",
      "registerart": "HRB",
      "company_name": "Robert Bosch Automotive Steering GmbH",
      "company_seat": "Schwäbisch Gmünd",
      "details": "26.09.2025 (Bekanntmachungsdatum)\n\nBaden-Württemberg Amtsgericht Ulm HRB 701678\nEinreichung neuer Dokumente 26.09.2025 (Eintragungsdatum)\n\nRobert Bosch Automotive Steering GmbH\nGesellschaft mit beschränkter Haftung\nSchwäbisch Gmünd\n\nDie Gesellschaft hat am 25.09.2025 die Liste über die Zusammensetzung des Aufsichtsrats zum Handelsregister eingereicht."
    },
    {
      "date": "2025-09-26",
      "id": "131595",
      "original_text": "Registerbekanntmachung nach dem Umwandlungsgesetz\nBerlin Amtsgericht Berlin (Charlottenburg) HRB 105473\nMCP - Media Competence Pool GmbH – Berlin",
      "type": "Registerbekanntmachung nach dem Umwandlungsgesetz",
      "state": "Berlin",
      "amtsgericht": "Amtsgericht Berlin (Charlottenburg)",
      "registernummer": "HRB 105473",
      "registerart": "HRB",
      "company_name": "MCP - Media Competence Pool GmbH",
      "company_seat": "Berlin",
      "details": "26.09.2025 (Bekanntmachungsdatum)\n\nBerlin Amtsgericht Berlin (Charlottenburg) HRB 105473\nRegisterbekanntmachung nach dem Umwandlungsgesetz 25.09.2025 (Eintragungsdatum)\n\nMCP - Media Competence Pool GmbH\nGesellschaft mit beschränkter Haftung\nBerlin\n\nZu Eintragungsnummer 4 vom 25.09.2025 wird als nicht eingetragen veröffentlicht: Den Gläubigern der an der Verschmelzung beteiligten Rechtsträger ist, wenn sie binnen sechs Monaten nach dem Tag, an dem die Eintragung der Verschmelzung in das Register des Sitzes desjenigen Rechtsträgers, dessen Gläubiger sie sind, als bekannt gemacht gilt, ihren Anspruch nach Grund und Höhe schriftlich anmelden, Sicherheit zu leisten, soweit sie nicht Befriedigung verlangen können. Dieses Recht steht den Gläubigern jedoch nur zu, wenn sie glaubhaft machen, dass durch die Verschmelzung die Erfüllung ihrer Forderung gefährdet wird. Das Recht, Sicherheitsleistung zu verlangen, steht Gläubigern nicht zu, die im Falle der Insolvenz ein Recht auf vorzugsweise Befriedigung aus einer Deckungsmasse haben, die nach gesetzlicher Vorschrift zu ihrem Schutz errichtet und staatlich überwacht ist."
    },
    {
      "date": "2025-09-26",
      "id": "131596",
      "original_text": "Registerbekanntmachung nach dem Umwandlungsgesetz\nBerlin Amtsgericht Berlin (Charlottenburg) HRB 135567\nundBitte Production GmbH – Berlin",
      "type": "Registerbekanntmachung nach dem Umwandlungsgesetz",
      "state": "Berlin",
      "amtsgericht": "Amtsgericht Berlin (Charlottenburg)",
      "registernummer": "HRB 135567",
      "registerart": "HRB",
      "company_name": "undBitte Production GmbH",
      "company_seat": "Berlin",
      "details": "26.09.2025 (Bekanntmachungsdatum)\n\nBerlin Amtsgericht Berlin (Charlottenburg) HRB 135567\nRegisterbekanntmachung nach dem Umwandlungsgesetz 25.09.2025 (Eintragungsdatum)\n\nundBitte Production GmbH\nGesellschaft mit beschränkter Haftung\nBerlin\n\nZu Eintragungsnummer 3 vom 25.09.2025 wird als nicht eingetragen veröffentlicht: Den Gläubigern der an der Verschmelzung beteiligten Rechtsträger ist, wenn sie binnen sechs Monaten nach dem Tag, an dem die Eintragung der Verschmelzung in das Register des Sitzes desjenigen Rechtsträgers, dessen Gläubiger sie sind, als bekannt gemacht gilt, ihren Anspruch nach Grund und Höhe schriftlich anmelden, Sicherheit zu leisten, soweit sie nicht Befriedigung verlangen können. Dieses Recht steht den Gläubigern jedoch nur zu, wenn sie glaubhaft machen, dass durch die Verschmelzung die Erfüllung ihrer Forderung gefährdet wird. Das Recht, Sicherheitsleistung zu verlangen, steht Gläubigern nicht zu, die im Falle der Insolvenz ein Recht auf vorzugsweise Befriedigung aus einer Deckungsmasse haben, die nach gesetzlicher Vorschrift zu ihrem Schutz errichtet und staatlich überwacht ist."
    },
    {
      "date": "2025-09-26",
      "id": "131597",
      "original_text": "Löschungsankündigung\nBerlin Amtsgericht Berlin (Charlottenburg) HRB 235497\nXerex UG (haftungsbeschränkt) – Berlin",
      "type": "Löschungsankündigung",
      "state": "Berlin",
      "amtsgericht": "Amtsgericht Berlin (Charlottenburg)",
      "registernummer": "HRB 235497",
      "registerart": "HRB",
      "company_name": "Xerex UG (haftungsbeschränkt)",
      "company_seat": "Berlin",
      "details": "26.09.2025 (Bekanntmachungsdatum)\n\nBerlin Amtsgericht Berlin (Charlottenburg) HRB 235497\nLöschungsankündigung\n\nXerex UG (haftungsbeschränkt)\nGesellschaft mit beschränkter Haftung\nBerlin\n\nBei der nachstehenden Gesellschaft wird das Amtslöschungsverfahren gemäß § 394 FamFG eingeleitet. Widerspruchsfrist 6 Wochen"
    },
    {
      "date": "2025-09-26",
      "id": "131598",
      "original_text": "Löschungsankündigung\nBerlin Amtsgericht Berlin (Charlottenburg) HRB 73039\nDominanz 2000 Immobilienverwaltungs- und Betreuungsgesellschaft mbH – Berlin",
      "type": "Löschungsankündigung",
      "state": "Berlin",
      "amtsgericht": "Amtsgericht Berlin (Charlottenburg)",
      "registernummer": "HRB 73039",
      "registerart": "HRB",
      "company_name": "Dominanz 2000 Immobilienverwaltungs- und Betreuungsgesellschaft mbH",
      "company_seat": "Berlin",
      "details": "26.09.2025 (Bekanntmachungsdatum)\n\nBerlin Amtsgericht Berlin (Charlottenburg) HRB 73039\nLöschungsankündigung\n\nDominanz 2000 Immobilienverwaltungs- und Betreuungsgesellschaft mbH\nGesellschaft mit beschränkter Haftung\nBerlin\n\nBei der nachstehenden Gesellschaft wird das Amtslöschungsverfahren gemäß § 394 FamFG eingeleitet. Widerspruchsfrist 6 Wochen"
    },
    {
      "date": "2025-09-26",
      "id": "131599",
      "original_text": "Löschungsankündigung\nBaden-Württemberg Amtsgericht Mannheim HRB 737395\nCiTo UG (haftungsbeschränkt) – Karlsruhe",
      "type": "Löschungsankündigung",
      "state": "Baden-Württemberg",
      "amtsgericht": "Amtsgericht Mannheim",
      "registernummer": "HRB 737395",
      "registerart": "HRB",
      "company_name": "CiTo UG (haftungsbeschränkt)",
      "company_seat": "Karlsruhe",
      "details": "26.09.2025 (Bekanntmachungsdatum)\n\nBaden-Württemberg Amtsgericht Mannheim HRB 737395\nLöschungsankündigung\n\nCiTo UG (haftungsbeschränkt)\nGesellschaft mit beschränkter Haftung\nKarlsruhe\n\nAls nicht eingetragen wird bekanntgemacht:\nDas Gericht beabsichtigt, die Gesellschaft wegen Vermögenslosigkeit im Handelsregister von Amts wegen nach § 394 FamFG zu löschen. Die Frist zur Geltendmachung eines Widerspruchs gegen die beabsichtigte Löschung ist auf einen Monat ab Veröffentlichung bestimmt."
    },
    {
      "date": "2025-09-26",
      "id": "131600",
      "original_text": "Registerbekanntmachung nach dem Umwandlungsgesetz\nBaden-Württemberg Amtsgericht Stuttgart HRA 742559\nAutoform Friedrich Allgaier e.K. – Owen",
      "type": "Registerbekanntmachung nach dem Umwandlungsgesetz",
      "state": "Baden-Württemberg",
      "amtsgericht": "Amtsgericht Stuttgart",
      "registernummer": "HRA 742559",
      "registerart": "HRA",
      "company_name": "Autoform Friedrich Allgaier e.K.",
      "company_seat": "Owen",
      "details": "26.09.2025 (Bekanntmachungsdatum)\n\nBaden-Württemberg Amtsgericht Stuttgart HRA 742559\nRegisterbekanntmachung nach dem Umwandlungsgesetz 26.09.2025 (Eintragungsdatum)\n\nAutoform Friedrich Allgaier e.K.\nEinzelkaufmann / Einzelkauffrau\nOwen\n\nDen Gläubigern der an der Ausgliederung beteiligten Rechtsträger ist, wenn sie binnen sechs Monaten nach dem Tag, an dem die Eintragung der Ausgliederung in das Register des Sitzes desjenigen Rechtsträgers, dessen Gläubiger sie sind, nach § 19 Abs. 3 UmwG als bekanntgemacht gilt, ihren Anspruch nach Grund und Höhe schriftlich anmelden, Sicherheit zu leisten, soweit sie nicht Befriedigung verlangen können. Dieses Recht steht den Gläubigern jedoch nur zu, wenn sie glaubhaft machen, dass durch die Ausgliederung die Erfüllung ihrer Forderung gefährdet wird."
    },
    {
      "date": "2025-09-26",
      "id": "131601",
      "original_text": "Registerbekanntmachung nach dem Umwandlungsgesetz\nBaden-Württemberg Amtsgericht Mannheim HRB 8718\nGeBeP, Gesellschaft zur Betreuung und Pflege alter Menschen gGmbH – Mannheim",
      "type": "Registerbekanntmachung nach dem Umwandlungsgesetz",
      "state": "Baden-Württemberg",
      "amtsgericht": "Amtsgericht Mannheim",
      "registernummer": "HRB 8718",
      "registerart": "HRB",
      "company_name": "GeBeP, Gesellschaft zur Betreuung und Pflege alter Menschen gGmbH",
      "company_seat": "Mannheim",
      "details": "26.09.2025 (Bekanntmachungsdatum)\n\nBaden-Württemberg Amtsgericht Mannheim HRB 8718\nRegisterbekanntmachung nach dem Umwandlungsgesetz 26.09.2025 (Eintragungsdatum)\n\nGeBeP, Gesellschaft zur Betreuung und Pflege alter Menschen gGmbH\nGesellschaft mit beschränkter Haftung\nMannheim\n\nDen Gläubigern der an der Verschmelzung beteiligten Rechtsträger ist, wenn sie binnen sechs Monaten nach dem Tag, an dem die Eintragung der Verschmelzung in das Register des Sitzes desjenigen Rechtsträgers, dessen Gläubiger sie sind, nach § 19 Abs. 3 UmwG als bekanntgemacht gilt, ihren Anspruch nach Grund und Höhe schriftlich anmelden, Sicherheit zu leisten, soweit sie nicht Befriedigung verlangen können. Dieses Recht steht den Gläubigern jedoch nur zu, wenn sie glaubhaft machen, dass durch die Verschmelzung die Erfüllung ihrer Forderung gefährdet wird."
    },
    {
      "date": "2025-09-26",
      "id": "131602",
      "original_text": "Registerbekanntmachung nach dem Umwandlungsgesetz\nBaden-Württemberg Amtsgericht Mannheim HRB 734268\nAutohaus Ernst Verwaltungsgesellschaft mbH Mannheim – Mannheim",
      "type": "Registerbekanntmachung nach dem Umwandlungsgesetz",
      "state": "Baden-Württemberg",
      "amtsgericht": "Amtsgericht Mannheim",
      "registernummer": "HRB 734268",
      "registerart": "HRB",
      "company_name": "Autohaus Ernst Verwaltungsgesellschaft mbH Mannheim",
      "company_seat": "Mannheim",
      "details": "26.09.2025 (Bekanntmachungsdatum)\n\nBaden-Württemberg Amtsgericht Mannheim HRB 734268\nRegisterbekanntmachung nach dem Umwandlungsgesetz 26.09.2025 (Eintragungsdatum)\n\nAutohaus Ernst Verwaltungsgesellschaft mbH Mannheim\nGesellschaft mit beschränkter Haftung\nMannheim\n\nAls nicht eingetragen wird bekanntgemacht: Den Gläubigern der an der Verschmelzung beteiligten Rechtsträger ist, wenn sie binnen sechs Monaten nach dem Tag, an dem die Eintragung der Verschmelzung in das Register des Sitzes desjenigen Rechtsträgers, dessen Gläubiger sie sind, nach § 19 Abs. 3 UmwG als bekanntgemacht gilt, ihren Anspruch nach Grund und Höhe schriftlich anmelden, Sicherheit zu leisten, soweit sie nicht Befriedigung verlangen können. Dieses Recht steht den Gläubigern jedoch nur zu, wenn sie glaubhaft machen, dass durch die Verschmelzung die Erfüllung ihrer Forderung gefährdet wird."
    },
    {
      "date": "2025-09-26",
      "id": "131603",
      "original_text": "Einreichung neuer Dokumente\nHamburg Amtsgericht Hamburg HRB 136433\nE.ON Grid Solutions GmbH – Hamburg",
      "type": "Einreichung neuer Dokumente",
      "state": "Hamburg",
      "amtsgericht": "Amtsgericht Hamburg",
      "registernummer": "HRB 136433",
      "registerart": "HRB",
      "company_name": "E.ON Grid Solutions GmbH",
      "company_seat": "Hamburg",
      "details": "26.09.2025 (Bekanntmachungsdatum)\n\nHamburg Amtsgericht Hamburg HRB 136433\nEinreichung neuer Dokumente\n\nE.ON Grid Solutions GmbH\nGesellschaft mit beschränkter Haftung\nHamburg\n\nAls nicht eingetragen wird bekannt gemacht: Liste des Aufsichtsrats wurde eingereicht."
    },
    {
      "date": "2025-09-26",
      "id": "131604",
      "original_text": "Registerbekanntmachung nach dem Umwandlungsgesetz\nBaden-Württemberg Amtsgericht Stuttgart HRB 797442\nFM Gebäudedienste GmbH – Fellbach",
      "type": "Registerbekanntmachung nach dem Umwandlungsgesetz",
      "state": "Baden-Württemberg",
      "amtsgericht": "Amtsgericht Stuttgart",
      "registernummer": "HRB 797442",
      "registerart": "HRB",
      "company_name": "FM Gebäudedienste GmbH",
      "company_seat": "Fellbach",
      "details": "26.09.2025 (Bekanntmachungsdatum)\n\nBaden-Württemberg Amtsgericht Stuttgart HRB 797442\nRegisterbekanntmachung nach dem Umwandlungsgesetz 26.09.2025 (Eintragungsdatum)\n\nFM Gebäudedienste GmbH\nGesellschaft mit beschränkter Haftung\nFellbach\n\nAls nicht eingetragen wird bekanntgemacht: Den Gläubigern der an der Ausgliederung beteiligten Rechtsträger ist, wenn sie binnen sechs Monaten nach dem Tag, an dem die Eintragung der Ausgliederung in das Register des Sitzes desjenigen Rechtsträgers, dessen Gläubiger sie sind, nach § 19 Abs. 3 UmwG als bekanntgemacht gilt, ihren Anspruch nach Grund und Höhe schriftlich anmelden, Sicherheit zu leisten, soweit sie nicht Befriedigung verlangen können. Dieses Recht steht den Gläubigern jedoch nur zu, wenn sie glaubhaft machen, dass durch die Ausgliederung die Erfüllung ihrer Forderung gefährdet wird."
    },
    {
      "date": "2025-09-26",
      "id": "131605",
      "original_text": "Registerbekanntmachung nach dem Umwandlungsgesetz\nBrandenburg Amtsgericht Cottbus HRA 4489\nBerlinfoodfeast e.K. – Schönefeld",
      "type": "Registerbekanntmachung nach dem Umwandlungsgesetz",
      "state": "Brandenburg",
      "amtsgericht": "Amtsgericht Cottbus",
      "registernummer": "HRA 4489",
      "registerart": "HRA",
      "company_name": "Berlinfoodfeast e.K.",
      "company_seat": "Schönefeld",
      "details": "26.09.2025 (Bekanntmachungsdatum)\n\nBrandenburg Amtsgericht Cottbus HRA 4489\nRegisterbekanntmachung nach dem Umwandlungsgesetz 25.09.2025 (Eintragungsdatum)\n\nBerlinfoodfeast e.K.\nEinzelkaufmann / Einzelkauffrau\nSchönefeld\n\nDen Gläubigern der an der Spaltung beteiligten Rechtsträger ist, wenn sie binnen sechs Monaten nach dem Tag, an dem die Eintragung der Spaltung in das Register des Sitzes desjenigen Rechtsträgers, dessen Gläubiger sie sind, als bekannt gemacht gilt, ihren Anspruch nach Grund und Höhe schriftlich anmelden, Sicherheit zu leisten, soweit sie nicht Befriedigung verlangen können. Dieses Recht steht den Gläubigern jedoch nur zu, wenn sie glaubhaft machen, dass durch die Spaltung die Erfüllung ihrer Forderung gefährdet wird"
    },
    {
      "date": "2025-09-26",
      "id": "131606",
      "original_text": "Registerbekanntmachung nach dem Umwandlungsgesetz\nSaarland Amtsgericht Saarbrücken HRB 111610\nHomekonzept Schadenmanagement GmbH – Saarwellingen",
      "type": "Registerbekanntmachung nach dem Umwandlungsgesetz",
      "state": "Saarland",
      "amtsgericht": "Amtsgericht Saarbrücken",
      "registernummer": "HRB 111610",
      "registerart": "HRB",
      "company_name": "Homekonzept Schadenmanagement GmbH",
      "company_seat": "Saarwellingen",
      "details": "26.09.2025 (Bekanntmachungsdatum)\n\nSaarland Amtsgericht Saarbrücken HRB 111610\nRegisterbekanntmachung nach dem Umwandlungsgesetz 26.09.2025 (Eintragungsdatum)\n\nHomekonzept Schadenmanagement GmbH\nGesellschaft mit beschränkter Haftung\nSaarwellingen\n\nAls nicht eingetragen wird bekannt gemacht: Den Gläubigern der an der Ausgliederung beteiligten Gesellschaften ist, wenn sie binnen sechs Monaten nach dem Tag, an dem die Eintragung der Ausgliederung in das Register des Sitzes desjenigen Rechtsträgers, dessen Gläubiger sie sind, nach § 19 Absatz 3 UmwG bekannt gemacht worden ist, ihren Anspruch nach Grund und Höhe schriftlich anmelden, Sicherheit zu leisten, soweit sie nicht Befriedigung verlangen können. Dieses Recht steht den Gläubigern jedoch nur zu, wenn sie glaubhaft machen, dass durch die Ausgliederung die Erfüllung ihrer Forderung gefährdet wird."
    },
    {
      "date": "2025-09-26",
      "id": "131607",
      "original_text": "Registerbekanntmachung nach dem Umwandlungsgesetz\nBerlin Amtsgericht Berlin (Charlottenburg) HRB 152643\nTwilio Berlin GmbH – Berlin",
      "type": "Registerbekanntmachung nach dem Umwandlungsgesetz",
      "state": "Berlin",
      "amtsgericht": "Amtsgericht Berlin (Charlottenburg)",
      "registernummer": "HRB 152643",
      "registerart": "HRB",
      "company_name": "Twilio Berlin GmbH",
      "company_seat": "Berlin",
      "details": "26.09.2025 (Bekanntmachungsdatum)\n\nBerlin Amtsgericht Berlin (Charlottenburg) HRB 152643\nRegisterbekanntmachung nach dem Umwandlungsgesetz 02.09.2025 (Eintragungsdatum)\n\nTwilio Berlin GmbH\nGesellschaft mit beschränkter Haftung\nBerlin\n\nZu Eintragungsnummer 17 vom 02.09.2025 wird als nicht eingetragen veröffentlicht: Den Gläubigern der an der Verschmelzung beteiligten Rechtsträger ist, wenn sie binnen sechs Monaten nach dem Tag, an dem die Eintragung der Verschmelzung in das Register des Sitzes desjenigen Rechtsträgers, dessen Gläubiger sie sind, als bekannt gemacht gilt, ihren Anspruch nach Grund und Höhe schriftlich anmelden, Sicherheit zu leisten, soweit sie nicht Befriedigung verlangen können. Dieses Recht steht den Gläubigern jedoch nur zu, wenn sie glaubhaft machen, dass durch die Verschmelzung die Erfüllung ihrer Forderung gefährdet wird. Das Recht, Sicherheitsleistung zu verlangen, steht Gläubigern nicht zu, die im Falle der Insolvenz ein Recht auf vorzugsweise Befriedigung aus einer Deckungsmasse haben, die nach gesetzlicher Vorschrift zu ihrem Schutz errichtet und staatlich überwacht ist."
    },
    {
      "date": "2025-09-26",
      "id": "131608",
      "original_text": "Sonstige Registerbekanntmachung\nBerlin Amtsgericht Berlin (Charlottenburg) VR 28748\nUNITI Bundesverband EnergieMittelstand e.V. – Berlin",
      "type": "Sonstige Registerbekanntmachung",
      "state": "Berlin",
      "amtsgericht": "Amtsgericht Berlin (Charlottenburg)",
      "registernummer": "VR 28748",
      "registerart": "VR",
      "company_name": "UNITI Bundesverband EnergieMittelstand e.V.",
      "company_seat": "Berlin",
      "details": "26.09.2025 (Bekanntmachungsdatum)\n\nBerlin Amtsgericht Berlin (Charlottenburg) VR 28748\nSonstige Registerbekanntmachung 25.09.2025 (Eintragungsdatum)\n\nUNITI Bundesverband EnergieMittelstand e.V.\neingetragener Verein\nBerlin\n\nAls nicht eingetragen wird veröffentlicht:Den Gläubigern der an der Verschmelzung beteiligten Rechtsträger ist, wenn sie binnen sechs Monaten nach dem Tag, an dem die Eintragung der Verschmelzung in das Register des Sitzes desjenigen Rechtsträgers, dessen Gläubiger sie sind, als bekannt gemacht gilt, ihren Anspruch nach Grund und Höhe schriftlich anmelden, Sicherheit zu leisten, soweit sie nicht Befriedigung verlangen können. Dieses Recht steht den Gläubigern jedoch nur zu, wenn sie glaubhaft machen, dass durch die Verschmelzung die Erfüllung ihrer Forderung gefährdet wird. Das Recht, Sicherheitsleistung zu verlangen, steht Gläubigern nicht zu, die im Falle der Insolvenz ein Recht auf vorzugsweise Befriedigung aus einer Deckungsmasse haben, die nach gesetzlicher Vorschrift zu ihrem Schutz errichtet und staatlich überwacht ist."
    },
    {
      "date": "2025-09-26",
      "id": "131609",
      "original_text": "Löschungsankündigung\nBerlin Amtsgericht Berlin (Charlottenburg) HRB 116410\nVita Trans S.Ü.D. GmbH – Berlin",
      "type": "Löschungsankündigung",
      "state": "Berlin",
      "amtsgericht": "Amtsgericht Berlin (Charlottenburg)",
      "registernummer": "HRB 116410",
      "registerart": "HRB",
      "company_name": "Vita Trans S.Ü.D. GmbH",
      "company_seat": "Berlin",
      "details": "26.09.2025 (Bekanntmachungsdatum)\n\nBerlin Amtsgericht Berlin (Charlottenburg) HRB 116410\nLöschungsankündigung\n\nVita Trans S.Ü.D. GmbH\nGesellschaft mit beschränkter Haftung\nBerlin\n\nBei der nachstehenden Gesellschaft wird das Amtslöschungsverfahren gemäß § 394 FamFG eingeleitet. Widerspruchsfrist 6 Wochen"
    },
    {
      "date": "2025-09-26",
      "id": "131610",
      "original_text": "Löschungsankündigung\nBerlin Amtsgericht Berlin (Charlottenburg) HRB 239447\nBauVision GmbH – Berlin",
      "type": "Löschungsankündigung",
      "state": "Berlin",
      "amtsgericht": "Amtsgericht Berlin (Charlottenburg)",
      "registernummer": "HRB 239447",
      "registerart": "HRB",
      "company_name": "BauVision GmbH",
      "company_seat": "Berlin",
      "details": "26.09.2025 (Bekanntmachungsdatum)\n\nBerlin Amtsgericht Berlin (Charlottenburg) HRB 239447\nLöschungsankündigung\n\nBauVision GmbH\nGesellschaft mit beschränkter Haftung\nBerlin\n\nBei der nachstehenden Gesellschaft wird das Amtslöschungsverfahren gemäß § 394 FamFG eingeleitet. Widerspruchsfrist 6 Wochen"
    },
    {
      "date": "2025-09-26",
      "id": "131611",
      "original_text": "Registerbekanntmachung nach dem Umwandlungsgesetz\nSchleswig-Holstein Amtsgericht Lübeck VR 301 EU\nTurnerschaft \"Riemann v. 1821\" e.V. Eutin – Eutin",
      "type": "Registerbekanntmachung nach dem Umwandlungsgesetz",
      "state": "Schleswig-Holstein",
      "amtsgericht": "Amtsgericht Lübeck",
      "registernummer": "VR 301 EU",
      "registerart": "VR",
      "company_name": "Turnerschaft \"Riemann v. 1821\" e.V. Eutin",
      "company_seat": "Eutin",
      "details": "26.09.2025 (Bekanntmachungsdatum)\n\nSchleswig-Holstein Amtsgericht Lübeck VR 301 EU\nRegisterbekanntmachung nach dem Umwandlungsgesetz 25.09.2025 (Eintragungsdatum)\n\nTurnerschaft \"Riemann v. 1821\" e.V. Eutin\neingetragener Verein\nEutin\n\nZu Eintragungsnummer 8 vom 25.09.2025 wird als nicht eingetragen veröffentlicht: Den Gläubigern der an der Verschmelzung beteiligten Rechtsträger ist, wenn sie binnen sechs Monaten nach dem Tag, an dem die Eintragung der Verschmelzung in das Register des Sitzes desjenigen Rechtsträgers, dessen Gläubiger sie sind, als bekannt gemacht gilt, ihren Anspruch nach Grund und Höhe schriftlich anmelden, Sicherheit zu leisten, soweit sie nicht Befriedigung verlangen können. Dieses Recht steht den Gläubigern jedoch nur zu, wenn sie glaubhaft machen, dass durch die Verschmelzung die Erfüllung ihrer Forderung gefährdet wird."
    },
    {
      "date": "2025-09-26",
      "id": "131612",
      "original_text": "Registerbekanntmachung nach dem Umwandlungsgesetz\nSchleswig-Holstein Amtsgericht Lübeck HRB 17378\nKBT-Kern-Bohr-Technik GmbH – Lübeck",
      "type": "Registerbekanntmachung nach dem Umwandlungsgesetz",
      "state": "Schleswig-Holstein",
      "amtsgericht": "Amtsgericht Lübeck",
      "registernummer": "HRB 17378",
      "registerart": "HRB",
      "company_name": "KBT-Kern-Bohr-Technik GmbH",
      "company_seat": "Lübeck",
      "details": "26.09.2025 (Bekanntmachungsdatum)\n\nSchleswig-Holstein Amtsgericht Lübeck HRB 17378\nRegisterbekanntmachung nach dem Umwandlungsgesetz 25.09.2025 (Eintragungsdatum)\n\nKBT-Kern-Bohr-Technik GmbH\nGesellschaft mit beschränkter Haftung\nLübeck\n\nZu Eintragungsnummer 5 vom 25.09.2025 wird als nicht eingetragen veröffentlicht: Den Gläubigern der an der Verschmelzung beteiligten Rechtsträger ist, wenn sie binnen sechs Monaten nach dem Tag, an dem die Eintragung der Verschmelzung in das Register des Sitzes desjenigen Rechtsträgers, dessen Gläubiger sie sind, als bekannt gemacht gilt, ihren Anspruch nach Grund und Höhe schriftlich anmelden, Sicherheit zu leisten, soweit sie nicht Befriedigung verlangen können. Dieses Recht steht den Gläubigern jedoch nur zu, wenn sie glaubhaft machen, dass durch die Verschmelzung die Erfüllung ihrer Forderung gefährdet wird."
    },
    {
      "date": "2025-09-26",
      "id": "131613",
      "original_text": "Registerbekanntmachung nach dem Umwandlungsgesetz\nBaden-Württemberg Amtsgericht Mannheim HRA 712759\nFülbier Garten- und Landschaftspflege e.K. – Ilvesheim",
      "type": "Registerbekanntmachung nach dem Umwandlungsgesetz",
      "state": "Baden-Württemberg",
      "amtsgericht": "Amtsgericht Mannheim",
      "registernummer": "HRA 712759",
      "registerart": "HRA",
      "company_name": "Fülbier Garten- und Landschaftspflege e.K.",
      "company_seat": "Ilvesheim",
      "details": "26.09.2025 (Bekanntmachungsdatum)\n\nBaden-Württemberg Amtsgericht Mannheim HRA 712759\nRegisterbekanntmachung nach dem Umwandlungsgesetz 26.09.2025 (Eintragungsdatum)\n\nFülbier Garten- und Landschaftspflege e.K.\nEinzelkaufmann / Einzelkauffrau\nIlvesheim\n\nDen Gläubigern der an der Ausgliederung beteiligten Rechtsträger ist, wenn sie binnen sechs Monaten nach dem Tag, an dem die Eintragung der Ausgliederung in das Register des Sitzes desjenigen Rechtsträgers, dessen Gläubiger sie sind, nach § 19 Abs. 3 UmwG als bekanntgemacht gilt, ihren Anspruch nach Grund und Höhe schriftlich anmelden, Sicherheit zu leisten, soweit sie nicht Befriedigung verlangen können. Dieses Recht steht den Gläubigern jedoch nur zu, wenn sie glaubhaft machen, dass durch die Ausgliederung die Erfüllung ihrer Forderung gefährdet wird."
    },
    {
      "date": "2025-09-26",
      "id": "131614",
      "original_text": "Registerbekanntmachung nach dem Umwandlungsgesetz\nBaden-Württemberg Amtsgericht Mannheim HRA 712828\nHeinz Ketterer e.K. – Walldorf",
      "type": "Registerbekanntmachung nach dem Umwandlungsgesetz",
      "state": "Baden-Württemberg",
      "amtsgericht": "Amtsgericht Mannheim",
      "registernummer": "HRA 712828",
      "registerart": "HRA",
      "company_name": "Heinz Ketterer e.K.",
      "company_seat": "Walldorf",
      "details": "26.09.2025 (Bekanntmachungsdatum)\n\nBaden-Württemberg Amtsgericht Mannheim HRA 712828\nRegisterbekanntmachung nach dem Umwandlungsgesetz 26.09.2025 (Eintragungsdatum)\n\nHeinz Ketterer e.K.\nEinzelkaufmann / Einzelkauffrau\nWalldorf\n\nAls nicht eingetragen wird bekanntgemacht:\nDen Gläubigern der an der Verschmelzung beteiligten Rechtsträger ist, wenn sie binnen sechs Monaten nach dem Tag, an dem die Eintragung der Verschmelzung in das Register des Sitzes desjenigen Rechtsträgers, dessen Gläubiger sie sind, nach § 19 Abs. 3 UmwG als bekanntgemacht gilt, ihren Anspruch nach Grund und Höhe schriftlich anmelden, Sicherheit zu leisten, soweit sie nicht Befriedigung verlangen können. Dieses Recht steht den Gläubigern jedoch nur zu, wenn sie glaubhaft machen, dass durch die Verschmelzung die Erfüllung ihrer Forderung gefährdet wird."
    },
    {
      "date": "2025-09-26",
      "id": "131615",
      "original_text": "Einreichung neuer Dokumente\nBaden-Württemberg Amtsgericht Stuttgart HRB 220205\nDeutsche Sporflex GmbH – Nürtingen",
      "type": "Einreichung neuer Dokumente",
      "state": "Baden-Württemberg",
      "amtsgericht": "Amtsgericht Stuttgart",
      "registernummer": "HRB 220205",
      "registerart": "HRB",
      "company_name": "Deutsche Sporflex GmbH",
      "company_seat": "Nürtingen",
      "details": "26.09.2025 (Bekanntmachungsdatum)\n\nBaden-Württemberg Amtsgericht Stuttgart HRB 220205\nEinreichung neuer Dokumente 26.09.2025 (Eintragungsdatum)\n\nDeutsche Sporflex GmbH\nGesellschaft mit beschränkter Haftung\nNürtingen\n\nDie Gesellschaft hat am 22.09.2025 die Liste über die Zusammensetzung des Aufsichtsrats zum Handelsregister eingereicht."
    },
    {
      "date": "2025-09-26",
      "id": "131616",
      "original_text": "Registerbekanntmachung nach dem Umwandlungsgesetz\nBaden-Württemberg Amtsgericht Stuttgart HRB 774063\nSeedbox Ventures GmbH – Stuttgart",
      "type": "Registerbekanntmachung nach dem Umwandlungsgesetz",
      "state": "Baden-Württemberg",
      "amtsgericht": "Amtsgericht Stuttgart",
      "registernummer": "HRB 774063",
      "registerart": "HRB",
      "company_name": "Seedbox Ventures GmbH",
      "company_seat": "Stuttgart",
      "details": "26.09.2025 (Bekanntmachungsdatum)\n\nBaden-Württemberg Amtsgericht Stuttgart HRB 774063\nRegisterbekanntmachung nach dem Umwandlungsgesetz 26.09.2025 (Eintragungsdatum)\n\nSeedbox Ventures GmbH\nGesellschaft mit beschränkter Haftung\nStuttgart\n\nDen Gläubigern der an der Verschmelzung beteiligten Rechtsträger ist, wenn sie binnen sechs Monaten nach dem Tag, an dem die Eintragung der Verschmelzung in das Register des Sitzes desjenigen Rechtsträgers, dessen Gläubiger sie sind, nach § 19 Abs. 3 UmwG als bekanntgemacht gilt, ihren Anspruch nach Grund und Höhe schriftlich anmelden, Sicherheit zu leisten, soweit sie nicht Befriedigung verlangen können. Dieses Recht steht den Gläubigern jedoch nur zu, wenn sie glaubhaft machen, dass durch die Verschmelzung die Erfüllung ihrer Forderung gefährdet wird."
    },
    {
      "date": "2025-09-26",
      "id": "131617",
      "original_text": "Registerbekanntmachung nach dem Umwandlungsgesetz\nBaden-Württemberg Amtsgericht Mannheim HRB 753641\nFülbier GmbH – Ilvesheim",
      "type": "Registerbekanntmachung nach dem Umwandlungsgesetz",
      "state": "Baden-Württemberg",
      "amtsgericht": "Amtsgericht Mannheim",
      "registernummer": "HRB 753641",
      "registerart": "HRB",
      "company_name": "Fülbier GmbH",
      "company_seat": "Ilvesheim",
      "details": "26.09.2025 (Bekanntmachungsdatum)\n\nBaden-Württemberg Amtsgericht Mannheim HRB 753641\nRegisterbekanntmachung nach dem Umwandlungsgesetz 26.09.2025 (Eintragungsdatum)\n\nFülbier GmbH\nGesellschaft mit beschränkter Haftung\nIlvesheim\n\nAls nicht eingetragen wird bekanntgemacht: Den Gläubigern der an der Ausgliederung beteiligten Rechtsträger ist, wenn sie binnen sechs Monaten nach dem Tag, an dem die Eintragung der Ausgliederung in das Register des Sitzes desjenigen Rechtsträgers, dessen Gläubiger sie sind, nach § 19 Abs. 3 UmwG als bekanntgemacht gilt, ihren Anspruch nach Grund und Höhe schriftlich anmelden, Sicherheit zu leisten, soweit sie nicht Befriedigung verlangen können. Dieses Recht steht den Gläubigern jedoch nur zu, wenn sie glaubhaft machen, dass durch die Ausgliederung die Erfüllung ihrer Forderung gefährdet wird."
    },
    {
      "date": "2025-09-26",
      "id": "131618",
      "original_text": "Registerbekanntmachung nach dem Umwandlungsgesetz\nBerlin Amtsgericht Berlin (Charlottenburg) HRA 16312\nBIOTRONIK Beteiligungs GmbH & Co. KG – Berlin",
      "type": "Registerbekanntmachung nach dem Umwandlungsgesetz",
      "state": "Berlin",
      "amtsgericht": "Amtsgericht Berlin (Charlottenburg)",
      "registernummer": "HRA 16312",
      "registerart": "HRA",
      "company_name": "BIOTRONIK Beteiligungs GmbH & Co. KG",
      "company_seat": "Berlin",
      "details": "26.09.2025 (Bekanntmachungsdatum)\n\nBerlin Amtsgericht Berlin (Charlottenburg) HRA 16312\nRegisterbekanntmachung nach dem Umwandlungsgesetz 23.09.2025 (Eintragungsdatum)\n\nBIOTRONIK Beteiligungs GmbH & Co. KG\nKommanditgesellschaft\nBerlin\n\nZu Eintragungsnummer 4 vom 23.09.2025 wird als nicht eingetragen veröffentlicht: Den Gläubigern ist, wenn sie binnen sechs Monaten nach dem Tag, an dem die Eintragung der Umwandlung als bekannt gemacht gilt, ihren Anspruch nach Grund und Höhe schriftlich anmelden, Sicherheit zu leisten, soweit sie nicht Befriedigung verlangen können. Dieses Recht steht den Gläubigern jedoch nur zu, wenn sie glaubhaft machen, dass durch die Umwandlung die Erfüllung ihrer Forderung gefährdet wird. Das Recht, Sicherheitsleistung zu verlangen, steht Gläubigern nicht zu, die im Falle der Insolvenz ein Recht auf vorzugsweise Befriedigung aus einer Deckungsmasse haben, die nach gesetzlicher Vorschrift zu ihrem Schutz errichtet und staatlich überwacht ist."
    },
    {
      "date": "2025-09-26",
      "id": "131619",
      "original_text": "Registerbekanntmachung nach dem Umwandlungsgesetz\nBaden-Württemberg Amtsgericht Mannheim HRB 352135\nPrint-Partner GmbH – Walldorf",
      "type": "Registerbekanntmachung nach dem Umwandlungsgesetz",
      "state": "Baden-Württemberg",
      "amtsgericht": "Amtsgericht Mannheim",
      "registernummer": "HRB 352135",
      "registerart": "HRB",
      "company_name": "Print-Partner GmbH",
      "company_seat": "Walldorf",
      "details": "26.09.2025 (Bekanntmachungsdatum)\n\nBaden-Württemberg Amtsgericht Mannheim HRB 352135\nRegisterbekanntmachung nach dem Umwandlungsgesetz 26.09.2025 (Eintragungsdatum)\n\nPrint-Partner GmbH\nGesellschaft mit beschränkter Haftung\nWalldorf\n\nDen Gläubigern der an der Verschmelzung beteiligten Rechtsträger ist, wenn sie binnen sechs Monaten nach dem Tag, an dem die Eintragung der Verschmelzung in das Register des Sitzes desjenigen Rechtsträgers, dessen Gläubiger sie sind, nach § 19 Abs. 3 UmwG als bekanntgemacht gilt, ihren Anspruch nach Grund und Höhe schriftlich anmelden, Sicherheit zu leisten, soweit sie nicht Befriedigung verlangen können. Dieses Recht steht den Gläubigern jedoch nur zu, wenn sie glaubhaft machen, dass durch die Verschmelzung die Erfüllung ihrer Forderung gefährdet wird."
    },
    {
      "date": "2025-09-26",
      "id": "131620",
      "original_text": "Registerbekanntmachung nach dem Umwandlungsgesetz\nBerlin Amtsgericht Berlin (Charlottenburg) HRB 279502\nBIOTRONIK Beteiligungs GmbH – Berlin",
      "type": "Registerbekanntmachung nach dem Umwandlungsgesetz",
      "state": "Berlin",
      "amtsgericht": "Amtsgericht Berlin (Charlottenburg)",
      "registernummer": "HRB 279502",
      "registerart": "HRB",
      "company_name": "BIOTRONIK Beteiligungs GmbH",
      "company_seat": "Berlin",
      "details": "26.09.2025 (Bekanntmachungsdatum)\n\nBerlin Amtsgericht Berlin (Charlottenburg) HRB 279502\nRegisterbekanntmachung nach dem Umwandlungsgesetz 23.09.2025 (Eintragungsdatum)\n\nBIOTRONIK Beteiligungs GmbH\nGesellschaft mit beschränkter Haftung\nBerlin\n\nZu Eintragungsnummer 1 vom 23.09.2025 wird als nicht eingetragen veröffentlicht: Den Gläubigern ist, wenn sie binnen sechs Monaten nach dem Tag, an dem die Eintragung der Umwandlung als bekannt gemacht gilt, ihren Anspruch nach Grund und Höhe schriftlich anmelden, Sicherheit zu leisten, soweit sie nicht Befriedigung verlangen können. Dieses Recht steht den Gläubigern jedoch nur zu, wenn sie glaubhaft machen, dass durch die Umwandlung die Erfüllung ihrer Forderung gefährdet wird. Das Recht, Sicherheitsleistung zu verlangen, steht Gläubigern nicht zu, die im Falle der Insolvenz ein Recht auf vorzugsweise Befriedigung aus einer Deckungsmasse haben, die nach gesetzlicher Vorschrift zu ihrem Schutz errichtet und staatlich überwacht ist."
    },
    {
      "date": "2025-09-26",
      "id": "131621",
      "original_text": "Löschungsankündigung\nSaarland Amtsgericht Saarbrücken HRB 103208\nSRG Riedel UG (haftungsbeschränkt) – Überherrn",
      "type": "Löschungsankündigung",
      "state": "Saarland",
      "amtsgericht": "Amtsgericht Saarbrücken",
      "registernummer": "HRB 103208",
      "registerart": "HRB",
      "company_name": "SRG Riedel UG (haftungsbeschränkt)",
      "company_seat": "Überherrn",
      "details": "26.09.2025 (Bekanntmachungsdatum)\n\nSaarland Amtsgericht Saarbrücken HRB 103208\nLöschungsankündigung\n\nSRG Riedel UG (haftungsbeschränkt)\nGesellschaft mit beschränkter Haftung\nÜberherrn\n\nEs ist beabsichtigt, die Gesellschaft von Amts wegen gemäß § 394 FamFG wegen Vermögenslosigkeit zu löschen.\nGegen die Löschung von Amts wegen ist das Rechtsmittel des Widerspruchs statthaft. Der Widerspruch ist binnen einer Frist einem Monat beginnend mit dem Tag dieser Veröffentlichung durch Einreichen eines Widerspruchsschreibens -schriftlich oder zur Niederschrift der Geschäftsstelle beim Amtsgericht Saarbrücken, -zentrales Handelsregister-, Mainzer Str.178, 66121 Saarbrücken einzulegen.\nDer Widerspruch muss die Bezeichnung der angefochtenen Löschungsankündigung enthalten sowie die Erklärung, dass Widerspruch eingelegt wird. Er ist vom Widerspruchsführer oder seinem Bevollmächtigten zu unterzeichnen.\nDas Widerspruchsschreiben kann auch in der Form eines elektronischen Dokumentes eingereicht werden, das mit einer qualifizierten elektronischen Signatur nach dem Signaturgesetz versehen sein muss (§§ 14 Abs. 2 FamFG, 130a, 298 ZPO)."
    },
    {
      "date": "2025-09-26",
      "id": "131622",
      "original_text": "Löschungsankündigung\nBerlin Amtsgericht Berlin (Charlottenburg) HRB 122164\nCash Money Brothers GmbH – Berlin",
      "type": "Löschungsankündigung",
      "state": "Berlin",
      "amtsgericht": "Amtsgericht Berlin (Charlottenburg)",
      "registernummer": "HRB 122164",
      "registerart": "HRB",
      "company_name": "Cash Money Brothers GmbH",
      "company_seat": "Berlin",
      "details": "26.09.2025 (Bekanntmachungsdatum)\n\nBerlin Amtsgericht Berlin (Charlottenburg) HRB 122164\nLöschungsankündigung\n\nCash Money Brothers GmbH\nGesellschaft mit beschränkter Haftung\nBerlin\n\nBei der nachstehenden Gesellschaft wird das Amtslöschungsverfahren gemäß § 394 FamFG eingeleitet. Widerspruchsfrist 6 Wochen"
    },
    {
      "date": "2025-09-26",
      "id": "131623",
      "original_text": "Löschungsankündigung\nBerlin Amtsgericht Berlin (Charlottenburg) HRB 188645\nImmobilienbesitzgesellschaft Berliner41 mbH – Berlin",
      "type": "Löschungsankündigung",
      "state": "Berlin",
      "amtsgericht": "Amtsgericht Berlin (Charlottenburg)",
      "registernummer": "HRB 188645",
      "registerart": "HRB",
      "company_name": "Immobilienbesitzgesellschaft Berliner41 mbH",
      "company_seat": "Berlin",
      "details": "26.09.2025 (Bekanntmachungsdatum)\n\nBerlin Amtsgericht Berlin (Charlottenburg) HRB 188645\nLöschungsankündigung\n\nImmobilienbesitzgesellschaft Berliner41 mbH\nGesellschaft mit beschränkter Haftung\nBerlin\n\nBei der nachstehenden Gesellschaft wird das Amtslöschungsverfahren gemäß § 394 FamFG eingeleitet. Widerspruchsfrist 6 Wochen"
    },
    {
      "date": "2025-09-26",
      "id": "131624",
      "original_text": "Registerbekanntmachung nach dem Umwandlungsgesetz\nBaden-Württemberg Amtsgericht Stuttgart HRB 264147\nSCHMALZ+SCHÖN Eastcargo GmbH – Fellbach",
      "type": "Registerbekanntmachung nach dem Umwandlungsgesetz",
      "state": "Baden-Württemberg",
      "amtsgericht": "Amtsgericht Stuttgart",
      "registernummer": "HRB 264147",
      "registerart": "HRB",
      "company_name": "SCHMALZ+SCHÖN Eastcargo GmbH",
      "company_seat": "Fellbach",
      "details": "26.09.2025 (Bekanntmachungsdatum)\n\nBaden-Württemberg Amtsgericht Stuttgart HRB 264147\nRegisterbekanntmachung nach dem Umwandlungsgesetz 26.09.2025 (Eintragungsdatum)\n\nSCHMALZ+SCHÖN Eastcargo GmbH\nGesellschaft mit beschränkter Haftung\nFellbach\n\nAls nicht eingetragen wird bekanntgemacht:\nDen Gläubigern der an der Verschmelzung beteiligten Rechtsträger ist, wenn sie binnen sechs Monaten nach dem Tag, an dem die Eintragung der Verschmelzung in das Register des Sitzes desjenigen Rechtsträgers, dessen Gläubiger sie sind, nach § 19 Abs. 3 UmwG als bekanntgemacht gilt, ihren Anspruch nach Grund und Höhe schriftlich anmelden, Sicherheit zu leisten, soweit sie nicht Befriedigung verlangen können. Dieses Recht steht den Gläubigern jedoch nur zu, wenn sie glaubhaft machen, dass durch die Verschmelzung die Erfüllung ihrer Forderung gefährdet wird."
    },
    {
      "date": "2025-09-26",
      "id": "131625",
      "original_text": "Sonstige Registerbekanntmachung\nBaden-Württemberg Amtsgericht Mannheim HRB 703951\nHäusliche Kinderkrankenpflege Hotzenplotz GmbH – Pforzheim",
      "type": "Sonstige Registerbekanntmachung",
      "state": "Baden-Württemberg",
      "amtsgericht": "Amtsgericht Mannheim",
      "registernummer": "HRB 703951",
      "registerart": "HRB",
      "company_name": "Häusliche Kinderkrankenpflege Hotzenplotz GmbH",
      "company_seat": "Pforzheim",
      "details": "26.09.2025 (Bekanntmachungsdatum)\n\nBaden-Württemberg Amtsgericht Mannheim HRB 703951\nSonstige Registerbekanntmachung 26.09.2025 (Eintragungsdatum)\n\nHäusliche Kinderkrankenpflege Hotzenplotz GmbH\nGesellschaft mit beschränkter Haftung\nPforzheim\n\nAls nicht eingetragen wird bekanntgemacht:\nDen Gläubigern der Gesellschaft, deren Forderungen begründet worden sind, bevor die Eintragung der Beendigung des Vertrages in das Handelsregister nach § 10 HGB als bekanntgemacht gilt, ist vom anderen Vertragsteil Sicherheit zu leisten, wenn sie sich binnen sechs Monaten nach der Bekanntmachung zu diesem Zweck bei ihm melden."
    },
    {
      "date": "2025-09-26",
      "id": "131626",
      "original_text": "Löschungsankündigung\nThüringen Amtsgericht Jena HRB 306555\nLAUMAX GmbH – Leutersdorf",
      "type": "Löschungsankündigung",
      "state": "Thüringen",
      "amtsgericht": "Amtsgericht Jena",
      "registernummer": "HRB 306555",
      "registerart": "HRB",
      "company_name": "LAUMAX GmbH",
      "company_seat": "Leutersdorf",
      "details": "26.09.2025 (Bekanntmachungsdatum)\n\nThüringen Amtsgericht Jena HRB 306555\nLöschungsankündigung\n\nLAUMAX GmbH\nGesellschaft mit beschränkter Haftung\nLeutersdorf\n\nDas Registergericht beabsichtigt, die im Handelsregister eingetragene Gesellschaft wegen Vermögenslosigkeit nach § 394 FamFG von Amts wegen zu löschen. Die Frist zur Erhebung eines Widerspruchs gegen die beabsichtigte Löschung wird auf 6 Wochen festgesetzt."
    },
    {
      "date": "2025-09-26",
      "id": "131627",
      "original_text": "Löschungsankündigung\nThüringen Amtsgericht Jena HRB 512094\ndynaheat Energietechnik GmbH – Altenburg",
      "type": "Löschungsankündigung",
      "state": "Thüringen",
      "amtsgericht": "Amtsgericht Jena",
      "registernummer": "HRB 512094",
      "registerart": "HRB",
      "company_name": "dynaheat Energietechnik GmbH",
      "company_seat": "Altenburg",
      "details": "26.09.2025 (Bekanntmachungsdatum)\n\nThüringen Amtsgericht Jena HRB 512094\nLöschungsankündigung\n\ndynaheat Energietechnik GmbH\nGesellschaft mit beschränkter Haftung\nAltenburg\n\nDas Registergericht beabsichtigt, die im Handelsregister eingetragene Gesellschaft wegen Vermögenslosigkeit nach § 394 FamFG von Amts wegen zu löschen. Die Frist zur Erhebung eines Widerspruchs gegen die beabsichtigte Löschung wird auf 6 Wochen festgesetzt."
    },
    {
      "date": "2025-09-26",
      "id": "131628",
      "original_text": "Registerbekanntmachung nach dem Umwandlungsgesetz\nThüringen Amtsgericht Jena GnR 400074\nAgrargenossenschaft \"Im Ohnetal\" eG – Niederorschel",
      "type": "Registerbekanntmachung nach dem Umwandlungsgesetz",
      "state": "Thüringen",
      "amtsgericht": "Amtsgericht Jena",
      "registernummer": "GnR 400074",
      "registerart": "GnR",
      "company_name": "Agrargenossenschaft \"Im Ohnetal\" eG",
      "company_seat": "Niederorschel",
      "details": "26.09.2025 (Bekanntmachungsdatum)\n\nThüringen Amtsgericht Jena GnR 400074\nRegisterbekanntmachung nach dem Umwandlungsgesetz 26.09.2025 (Eintragungsdatum)\n\nAgrargenossenschaft \"Im Ohnetal\" eG\neingetragene Genossenschaft\nNiederorschel\n\nNicht eingetragen: Den Gläubigern des formwechselnden  Rechtsträgers, ist wenn sie binnen sechs Monaten nach dem Tag, an dem die Eintragung des Formwechsels nach § 201 UmwG als bekanntgemacht gilt, ihren Anspruch nach Grund und Höhe schriftlich anmelden, Sicherheit zu leisten, soweit sie nicht Befriedigung verlangen können. Dieses Recht steht ihnen jedoch nur zu, wenn sie glaubhaft machen, daß durch den Formwechsel die Erfüllung ihrer Forderung gefährdet wird."
    },
    {
      "date": "2025-09-26",
      "id": "131629",
      "original_text": "Registerbekanntmachung nach dem Umwandlungsgesetz\nBaden-Württemberg Amtsgericht Mannheim HRB 746404\nAnders Verlagshaus GmbH – Mannheim",
      "type": "Registerbekanntmachung nach dem Umwandlungsgesetz",
      "state": "Baden-Württemberg",
      "amtsgericht": "Amtsgericht Mannheim",
      "registernummer": "HRB 746404",
      "registerart": "HRB",
      "company_name": "Anders Verlagshaus GmbH",
      "company_seat": "Mannheim",
      "details": "26.09.2025 (Bekanntmachungsdatum)\n\nBaden-Württemberg Amtsgericht Mannheim HRB 746404\nRegisterbekanntmachung nach dem Umwandlungsgesetz 26.09.2025 (Eintragungsdatum)\n\nAnders Verlagshaus GmbH\nGesellschaft mit beschränkter Haftung\nMannheim\n\nAls nicht eingetragen wird bekanntgemacht:\nDen Gläubigern des an dem Formwechsel beteiligten Rechtsträgers ist, wenn sie binnen sechs Monaten nach dem Tag, an dem die Eintragung des Formwechsels in das Register des Sitzes desjenigen Rechtsträgers, dessen Gläubiger sie sind, nach § 19 Abs. 3 UmwG als bekanntgemacht gilt, ihren Anspruch nach Grund und Höhe schriftlich anmelden, Sicherheit zu leisten, soweit sie nicht Befriedigung verlangen können. Dieses Recht steht den Gläubigern jedoch nur zu, wenn sie glaubhaft machen, dass durch den Formwechsel die Erfüllung ihrer Forderung gefährdet wird."
    },
    {
      "date": "2025-09-26",
      "id": "131630",
      "original_text": "Sonstige Registerbekanntmachung\nBerlin Amtsgericht Berlin (Charlottenburg) HRB 79505\nUV Interactive Entertainment GmbH – Berlin",
      "type": "Sonstige Registerbekanntmachung",
      "state": "Berlin",
      "amtsgericht": "Amtsgericht Berlin (Charlottenburg)",
      "registernummer": "HRB 79505",
      "registerart": "HRB",
      "company_name": "UV Interactive Entertainment GmbH",
      "company_seat": "Berlin",
      "details": "26.09.2025 (Bekanntmachungsdatum)\n\nBerlin Amtsgericht Berlin (Charlottenburg) HRB 79505\nSonstige Registerbekanntmachung\n\nUV Interactive Entertainment GmbH\nGesellschaft mit beschränkter Haftung\nBerlin\n\nAls nicht eingetragen wird veröffentlicht: Der andere Vertragsteil hat den Gläubigern dieses Rechtsträgers, deren Forderungen begründet worden sind, bevor die Eintragung der Beendigung dieses Vertrages in das Handelsregister nach § 10 des Handelsgesetzbuches als bekannt gemacht gilt, Sicherheit zu leisten, wenn sie sich binnen sechs Monaten nach der Bekanntmachung der Eintragung zu diesem Zweck bei ihm melden. Dieses Recht steht den Gläubigern nicht zu, die im Fall des Insolvenzverfahrens ein Recht auf vorzugsweise Befriedigung aus der Deckungsmasse haben, die nach gesetzlicher Vorschrift zu ihrem Schutz errichtet und staatlich überwacht ist."
    },
    {
      "date": "2025-09-26",
      "id": "131631",
      "original_text": "Registerbekanntmachung nach dem Umwandlungsgesetz\nSchleswig-Holstein Amtsgericht Lübeck HRB 23866\nKBT-Brandschutz GmbH – Lübeck",
      "type": "Registerbekanntmachung nach dem Umwandlungsgesetz",
      "state": "Schleswig-Holstein",
      "amtsgericht": "Amtsgericht Lübeck",
      "registernummer": "HRB 23866",
      "registerart": "HRB",
      "company_name": "KBT-Brandschutz GmbH",
      "company_seat": "Lübeck",
      "details": "26.09.2025 (Bekanntmachungsdatum)\n\nSchleswig-Holstein Amtsgericht Lübeck HRB 23866\nRegisterbekanntmachung nach dem Umwandlungsgesetz 25.09.2025 (Eintragungsdatum)\n\nKBT-Brandschutz GmbH\nGesellschaft mit beschränkter Haftung\nLübeck\n\nZu Eintragungsnummer 3 vom 25.09.2025 wird als nicht eingetragen veröffentlicht:  Als nicht eingetragen wird veröffentlicht: Den Gläubigern der an der Verschmelzung beteiligten Rechtsträger ist, wenn sie binnen sechs Monaten nach dem Tag, an dem die Eintragung der Verschmelzung in das Register des Sitzes desjenigen Rechtsträgers, dessen Gläubiger sie sind, als bekannt gemacht gilt, ihren Anspruch nach Grund und Höhe schriftlich anmelden, Sicherheit zu leisten, soweit sie nicht Befriedigung verlangen können. Dieses Recht steht den Gläubigern jedoch nur zu, wenn sie glaubhaft machen, dass durch die Verschmelzung die Erfüllung ihrer Forderung gefährdet wird."
    },
    {
      "date": "2025-09-26",
      "id": "131632",
      "original_text": "Registerbekanntmachung nach dem Umwandlungsgesetz\nHamburg Amtsgericht Hamburg HRB 92904\nElenxis-Media-Funds-Holding GmbH – Hamburg",
      "type": "Registerbekanntmachung nach dem Umwandlungsgesetz",
      "state": "Hamburg",
      "amtsgericht": "Amtsgericht Hamburg",
      "registernummer": "HRB 92904",
      "registerart": "HRB",
      "company_name": "Elenxis-Media-Funds-Holding GmbH",
      "company_seat": "Hamburg",
      "details": "26.09.2025 (Bekanntmachungsdatum)\n\nHamburg Amtsgericht Hamburg HRB 92904\nRegisterbekanntmachung nach dem Umwandlungsgesetz 26.09.2025 (Eintragungsdatum)\n\nElenxis-Media-Funds-Holding GmbH\nGesellschaft mit beschränkter Haftung\nHamburg\n\nAls nicht eingetragen wird bekannt gemacht:\nDen Gläubigern der an der Verschmelzung beteiligten Gesellschaften ist, wenn sie binnen sechs Monaten nach dem Tag, an dem die Eintragung der Verschmelzung in das Register des Sitzes desjenigen Rechtsträgers, dessen Gläubiger sie sind, nach § 19 Absatz 3 UmwG als bekannt gemacht gilt, ihren Anspruch nach Grund und Höhe schriftlich anmelden, Sicherheit zu leisten, soweit sie nicht Befriedigung verlangen können. Dieses Recht steht den Gläubigern jedoch nur zu, wenn sie glaubhaft machen, dass durch die Verschmelzung die Erfüllung ihrer Forderung gefährdet wird."
    },
    {
      "date": "2025-09-26",
      "id": "131633",
      "original_text": "Registerbekanntmachung nach dem Umwandlungsgesetz\nBaden-Württemberg Amtsgericht Stuttgart HRB 801392\nMein Quartier Köngen Betriebsgesellschaft mbH – Köngen",
      "type": "Registerbekanntmachung nach dem Umwandlungsgesetz",
      "state": "Baden-Württemberg",
      "amtsgericht": "Amtsgericht Stuttgart",
      "registernummer": "HRB 801392",
      "registerart": "HRB",
      "company_name": "Mein Quartier Köngen Betriebsgesellschaft mbH",
      "company_seat": "Köngen",
      "details": "26.09.2025 (Bekanntmachungsdatum)\n\nBaden-Württemberg Amtsgericht Stuttgart HRB 801392\nRegisterbekanntmachung nach dem Umwandlungsgesetz 16.09.2025 (Eintragungsdatum)\n\nMein Quartier Köngen Betriebsgesellschaft mbH\nGesellschaft mit beschränkter Haftung\nKöngen\n\nAls nicht eingetragen wird bekanntgemacht:\nDen Gläubigern der an der Verschmelzung beteiligten Rechtsträger ist, wenn sie binnen sechs Monaten nach dem Tag, an dem die Eintragung der Verschmelzung in das Register des Sitzes desjenigen Rechtsträgers, dessen Gläubiger sie sind, nach § 19 Abs. 3 UmwG als bekanntgemacht gilt, ihren Anspruch nach Grund und Höhe schriftlich anmelden, Sicherheit zu leisten, soweit sie nicht Befriedigung verlangen können. Dieses Recht steht den Gläubigern jedoch nur zu, wenn sie glaubhaft machen, dass durch die Verschmelzung die Erfüllung ihrer Forderung gefährdet wird."
    },
    {
      "date": "2025-09-26",
      "id": "131634",
      "original_text": "Registerbekanntmachung nach dem Umwandlungsgesetz\nSchleswig-Holstein Amtsgericht Lübeck VR 215 EU\nTurn - und Sportverein Fissau e.V. – Eutin/Fissau",
      "type": "Registerbekanntmachung nach dem Umwandlungsgesetz",
      "state": "Schleswig-Holstein",
      "amtsgericht": "Amtsgericht Lübeck",
      "registernummer": "VR 215 EU",
      "registerart": "VR",
      "company_name": "Turn - und Sportverein Fissau e.V.",
      "company_seat": "Eutin/Fissau",
      "details": "26.09.2025 (Bekanntmachungsdatum)\n\nSchleswig-Holstein Amtsgericht Lübeck VR 215 EU\nRegisterbekanntmachung nach dem Umwandlungsgesetz 25.09.2025 (Eintragungsdatum)\n\nTurn - und Sportverein Fissau e.V.\neingetragener Verein\nEutin/Fissau\n\nZu Eintragungsnummer 6 vom 25.09.2025 wird als nicht eingetragen veröffentlicht:\nDen Gläubigern der an der Verschmelzung beteiligten Rechtsträger ist, wenn sie binnen sechs Monaten nach dem Tag, an dem die Eintragung der Verschmelzung in das Register des Sitzes desjenigen Rechtsträgers, dessen Gläubiger sie sind, als bekannt gemacht gilt, ihren Anspruch nach Grund und Höhe schriftlich anmelden, Sicherheit zu leisten, soweit sie nicht Befriedigung verlangen können. Dieses Recht steht den Gläubigern jedoch nur zu, wenn sie glaubhaft machen, dass durch die Verschmelzung die Erfüllung ihrer Forderung gefährdet wird."
    },
    {
      "date": "2025-09-26",
      "id": "131635",
      "original_text": "Registerbekanntmachung nach dem Umwandlungsgesetz\nBaden-Württemberg Amtsgericht Mannheim HRB 727107\nthingsTHINKING GmbH – Karlsruhe",
      "type": "Registerbekanntmachung nach dem Umwandlungsgesetz",
      "state": "Baden-Württemberg",
      "amtsgericht": "Amtsgericht Mannheim",
      "registernummer": "HRB 727107",
      "registerart": "HRB",
      "company_name": "thingsTHINKING GmbH",
      "company_seat": "Karlsruhe",
      "details": "26.09.2025 (Bekanntmachungsdatum)\n\nBaden-Württemberg Amtsgericht Mannheim HRB 727107\nRegisterbekanntmachung nach dem Umwandlungsgesetz 26.09.2025 (Eintragungsdatum)\n\nthingsTHINKING GmbH\nGesellschaft mit beschränkter Haftung\nKarlsruhe\n\nAls nicht eingetragen wird bekanntgemacht:\nDen Gläubigern der an der Verschmelzung beteiligten Rechtsträger ist, wenn sie binnen sechs Monaten nach dem Tag, an dem die Eintragung der Verschmelzung in das Register des Sitzes desjenigen Rechtsträgers, dessen Gläubiger sie sind, nach § 19 Abs. 3 UmwG als bekanntgemacht gilt, ihren Anspruch nach Grund und Höhe schriftlich anmelden, Sicherheit zu leisten, soweit sie nicht Befriedigung verlangen können. Dieses Recht steht den Gläubigern jedoch nur zu, wenn sie glaubhaft machen, dass durch die Verschmelzung die Erfüllung ihrer Forderung gefährdet wird."
    },
    {
      "date": "2025-09-26",
      "id": "131636",
      "original_text": "Registerbekanntmachung nach dem Umwandlungsgesetz\nBaden-Württemberg Amtsgericht Mannheim HRB 732804\nAleph Alpha GmbH – Heidelberg",
      "type": "Registerbekanntmachung nach dem Umwandlungsgesetz",
      "state": "Baden-Württemberg",
      "amtsgericht": "Amtsgericht Mannheim",
      "registernummer": "HRB 732804",
      "registerart": "HRB",
      "company_name": "Aleph Alpha GmbH",
      "company_seat": "Heidelberg",
      "details": "26.09.2025 (Bekanntmachungsdatum)\n\nBaden-Württemberg Amtsgericht Mannheim HRB 732804\nRegisterbekanntmachung nach dem Umwandlungsgesetz 26.09.2025 (Eintragungsdatum)\n\nAleph Alpha GmbH\nGesellschaft mit beschränkter Haftung\nHeidelberg\n\nAls nicht eingetragen wird bekanntgemacht:\nDen Gläubigern der an der Verschmelzung beteiligten Rechtsträger ist, wenn sie binnen sechs Monaten nach dem Tag, an dem die Eintragung der Verschmelzung in das Register des Sitzes desjenigen Rechtsträgers, dessen Gläubiger sie sind, nach § 19 Abs. 3 UmwG als bekanntgemacht gilt, ihren Anspruch nach Grund und Höhe schriftlich anmelden, Sicherheit zu leisten, soweit sie nicht Befriedigung verlangen können. Dieses Recht steht den Gläubigern jedoch nur zu, wenn sie glaubhaft machen, dass durch die Verschmelzung die Erfüllung ihrer Forderung gefährdet wird."
    },
    {
      "date": "2025-09-26",
      "id": "131637",
      "original_text": "Einreichung neuer Dokumente\nBerlin Amtsgericht Berlin (Charlottenburg) HRB 203542\nJumia Technologies AG – Berlin",
      "type": "Einreichung neuer Dokumente",
      "state": "Berlin",
      "amtsgericht": "Amtsgericht Berlin (Charlottenburg)",
      "registernummer": "HRB 203542",
      "registerart": "HRB",
      "company_name": "Jumia Technologies AG",
      "company_seat": "Berlin",
      "details": "26.09.2025 (Bekanntmachungsdatum)\n\nBerlin Amtsgericht Berlin (Charlottenburg) HRB 203542\nEinreichung neuer Dokumente\n\nJumia Technologies AG\nAktiengesellschaft\nBerlin\n\nAls nicht eingetragen wird veröffentlicht: Es wurde eine neue Liste der Aufsichtsratsmitglieder eingereicht (§ 106 AktG)."
    },
    {
      "date": "2025-09-26",
      "id": "131638",
      "original_text": "Registerbekanntmachung nach dem Umwandlungsgesetz\nHamburg Amtsgericht Hamburg VR 15410\niKV-inline Kurier Verein e.V. – Hamburg",
      "type": "Registerbekanntmachung nach dem Umwandlungsgesetz",
      "state": "Hamburg",
      "amtsgericht": "Amtsgericht Hamburg",
      "registernummer": "VR 15410",
      "registerart": "VR",
      "company_name": "iKV-inline Kurier Verein e.V.",
      "company_seat": "Hamburg",
      "details": "26.09.2025 (Bekanntmachungsdatum)\n\nHamburg Amtsgericht Hamburg VR 15410\nRegisterbekanntmachung nach dem Umwandlungsgesetz\n\niKV-inline Kurier Verein e.V.\neingetragener Verein\nHamburg\n\nAls nicht eingetragen wird bekannt gemacht:\nDen Gläubigern der an der formwechselnden Umwandlung beteiligten Rechtsträger ist, wenn sie binnen sechs Monaten nach dem Tag, an dem die Eintragung der formwechselnden Umwandlung in das Register des Sitzes desjenigen Rechtsträgers, dessen Gläubiger sie sind, nach § 19 Absatz 3 UmwG als bekannt gemacht gilt, ihren Anspruch nach Grund und Höhe schriftlich anmelden, Sicherheit zu leisten, soweit sie nicht Befriedigung verlangen können. Dieses Recht steht den Gläubigern jedoch nur zu, wenn sie glaubhaft machen, dass durch die formwechselnde Umwandlung die Erfüllung ihrer Forderung gefährdet wird."
    },
    {
      "date": "2025-09-26",
      "id": "131639",
      "original_text": "Registerbekanntmachung nach dem Umwandlungsgesetz\nHamburg Amtsgericht Hamburg GnR 1186\ninline Kurier eG – Hamburg",
      "type": "Registerbekanntmachung nach dem Umwandlungsgesetz",
      "state": "Hamburg",
      "amtsgericht": "Amtsgericht Hamburg",
      "registernummer": "GnR 1186",
      "registerart": "GnR",
      "company_name": "inline Kurier eG",
      "company_seat": "Hamburg",
      "details": "26.09.2025 (Bekanntmachungsdatum)\n\nHamburg Amtsgericht Hamburg GnR 1186\nRegisterbekanntmachung nach dem Umwandlungsgesetz 26.09.2025 (Eintragungsdatum)\n\ninline Kurier eG\neingetragene Genossenschaft\nHamburg\n\nAls nicht eingetragen wird bekannt gemacht:\nDen Gläubigern der an der formwechselnden Umwandlung beteiligten Rechtsträger ist, wenn sie binnen sechs Monaten nach dem Tag, an dem die Eintragung der formwechselnden Umwandlung in das Register des Sitzes desjenigen Rechtsträgers, dessen Gläubiger sie sind, nach § 19 Absatz 3 UmwG als bekannt gemacht gilt, ihren Anspruch nach Grund und Höhe schriftlich anmelden, Sicherheit zu leisten, soweit sie nicht Befriedigung verlangen können. Dieses Recht steht den Gläubigern jedoch nur zu, wenn sie glaubhaft machen, dass durch die formwechselnde Umwandlung die Erfüllung ihrer Forderung gefährdet wird."
    },
    {
      "date": "2025-09-26",
      "id": "131640",
      "original_text": "Löschungsankündigung\nBerlin Amtsgericht Berlin (Charlottenburg) HRB 184370\nOrganic Label GmbH – Berlin",
      "type": "Löschungsankündigung",
      "state": "Berlin",
      "amtsgericht": "Amtsgericht Berlin (Charlottenburg)",
      "registernummer": "HRB 184370",
      "registerart": "HRB",
      "company_name": "Organic Label GmbH",
      "company_seat": "Berlin",
      "details": "26.09.2025 (Bekanntmachungsdatum)\n\nBerlin Amtsgericht Berlin (Charlottenburg) HRB 184370\nLöschungsankündigung\n\nOrganic Label GmbH\nGesellschaft mit beschränkter Haftung\nBerlin\n\nBei der nachstehenden Gesellschaft wird das Amtslöschungsverfahren gemäß § 394 FamFG eingeleitet. Widerspruchsfrist 6 Wochen"
    },
    {
      "date": "2025-09-26",
      "id": "131641",
      "original_text": "Löschungsankündigung\nBaden-Württemberg Amtsgericht Stuttgart HRB 757436\nLaWe-Languages UG (haftungsbeschränkt) – Reutlingen",
      "type": "Löschungsankündigung",
      "state": "Baden-Württemberg",
      "amtsgericht": "Amtsgericht Stuttgart",
      "registernummer": "HRB 757436",
      "registerart": "HRB",
      "company_name": "LaWe-Languages UG (haftungsbeschränkt)",
      "company_seat": "Reutlingen",
      "details": "26.09.2025 (Bekanntmachungsdatum)\n\nBaden-Württemberg Amtsgericht Stuttgart HRB 757436\nLöschungsankündigung\n\nLaWe-Languages UG (haftungsbeschränkt)\nGesellschaft mit beschränkter Haftung\nReutlingen\n\nAls nicht eingetragen wird bekanntgemacht:\nDas Gericht beabsichtigt, die Gesellschaft wegen Vermögenslosigkeit im Handelsregister von Amts wegen nach § 394 FamFG zu löschen. Die Frist zur Geltendmachung eines Widerspruchs gegen die beabsichtigte Löschung ist auf zwei Monate ab Veröffentlichung bestimmt."
    },
    {
      "date": "2025-09-26",
      "id": "131642",
      "original_text": "Registerbekanntmachung nach dem Umwandlungsgesetz\nSchleswig-Holstein Amtsgericht Lübeck HRB 2966\nHWP Maler & Ausbauer SH GmbH – Lübeck",
      "type": "Registerbekanntmachung nach dem Umwandlungsgesetz",
      "state": "Schleswig-Holstein",
      "amtsgericht": "Amtsgericht Lübeck",
      "registernummer": "HRB 2966",
      "registerart": "HRB",
      "company_name": "HWP Maler & Ausbauer SH GmbH",
      "company_seat": "Lübeck",
      "details": "26.09.2025 (Bekanntmachungsdatum)\n\nSchleswig-Holstein Amtsgericht Lübeck HRB 2966\nRegisterbekanntmachung nach dem Umwandlungsgesetz 26.09.2025 (Eintragungsdatum)\n\nHWP Maler & Ausbauer SH GmbH\nGesellschaft mit beschränkter Haftung\nLübeck\n\nZu Eintragungsnummer 14 vom 26.09.2025 wird als nicht eingetragen veröffentlicht:  Als nicht eingetragen wird veröffentlicht: Den Gläubigern der an der Spaltung beteiligten Rechtsträger ist, wenn sie binnen sechs Monaten nach dem Tag, an dem die Eintragung der Spaltung in das Register des Sitzes desjenigen Rechtsträgers, dessen Gläubiger sie sind, als bekannt gemacht gilt, ihren Anspruch nach Grund und Höhe schriftlich anmelden, Sicherheit zu leisten, soweit sie nicht Befriedigung verlangen können. Dieses Recht steht den Gläubigern jedoch nur zu, wenn sie glaubhaft machen, dass durch die Spaltung die Erfüllung ihrer Forderung gefährdet wird."
    },
    {
      "date": "2025-09-26",
      "id": "131643",
      "original_text": "Löschungsankündigung\nSachsen Amtsgericht Chemnitz HRB 15651\nHOMAS-Anlagentechnik GmbH – Eppendorf",
      "type": "Löschungsankündigung",
      "state": "Sachsen",
      "amtsgericht": "Amtsgericht Chemnitz",
      "registernummer": "HRB 15651",
      "registerart": "HRB",
      "company_name": "HOMAS-Anlagentechnik GmbH",
      "company_seat": "Eppendorf",
      "details": "26.09.2025 (Bekanntmachungsdatum)\n\nSachsen Amtsgericht Chemnitz HRB 15651\nLöschungsankündigung\n\nHOMAS-Anlagentechnik GmbH\nGesellschaft mit beschränkter Haftung\nEppendorf\n\nDas Registergericht beabsichtigt, die im Handelsregister eingetragene Gesellschaft von Amts wegen nach § 394 FamFG zu löschen. Die Frist zu Erhebung eines Widerspruchs gegen die beabsichtigte Löschung wird auf einen Monat festgesetzt."
    },
    {
      "date": "2025-09-26",
      "id": "131644",
      "original_text": "Löschungsankündigung\nSachsen Amtsgericht Chemnitz HRB 33110\nAllround Secondhand Heising UG (haftungsbeschränkt) – Mittweida",
      "type": "Löschungsankündigung",
      "state": "Sachsen",
      "amtsgericht": "Amtsgericht Chemnitz",
      "registernummer": "HRB 33110",
      "registerart": "HRB",
      "company_name": "Allround Secondhand Heising UG (haftungsbeschränkt)",
      "company_seat": "Mittweida",
      "details": "26.09.2025 (Bekanntmachungsdatum)\n\nSachsen Amtsgericht Chemnitz HRB 33110\nLöschungsankündigung 26.09.2025 (Eintragungsdatum)\n\nAllround Secondhand Heising UG (haftungsbeschränkt)\nGesellschaft mit beschränkter Haftung\nMittweida\n\nDas Registergericht beabsichtigt, die im Handelsregister eingetragene Gesellschaft von Amts wegen nach § 394 FamFG zu löschen. Die Frist zu Erhebung eines Widerspruchs gegen die beabsichtigte Löschung wird auf einen Monat festgesetzt."
    },
    {
      "date": "2025-09-26",
      "id": "131645",
      "original_text": "Sonstige Registerbekanntmachung\nNiedersachsen Amtsgericht Hannover HRB 3669\nContinental Automotive Technologies GmbH – Hannover",
      "type": "Sonstige Registerbekanntmachung",
      "state": "Niedersachsen",
      "amtsgericht": "Amtsgericht Hannover",
      "registernummer": "HRB 3669",
      "registerart": "HRB",
      "company_name": "Continental Automotive Technologies GmbH",
      "company_seat": "Hannover",
      "details": "26.09.2025 (Bekanntmachungsdatum)\n\nNiedersachsen Amtsgericht Hannover HRB 3669\nSonstige Registerbekanntmachung\n\nContinental Automotive Technologies GmbH\nGesellschaft mit beschränkter Haftung\nHannover\n\nDie Liste der Mitglieder des Aufsichtsrats wurde beim Registergericht eingereicht."
    },
    {
      "date": "2025-09-26",
      "id": "131646",
      "original_text": "Registerbekanntmachung nach dem Umwandlungsgesetz\nNiedersachsen Amtsgericht Stadthagen HRA 200752\nTrans-Solution-Service Inhaberin Edeltraud Schaarschmidt e. Kfr. – Rinteln",
      "type": "Registerbekanntmachung nach dem Umwandlungsgesetz",
      "state": "Niedersachsen",
      "amtsgericht": "Amtsgericht Stadthagen",
      "registernummer": "HRA 200752",
      "registerart": "HRA",
      "company_name": "Trans-Solution-Service Inhaberin Edeltraud Schaarschmidt e. Kfr.",
      "company_seat": "Rinteln",
      "details": "26.09.2025 (Bekanntmachungsdatum)\n\nNiedersachsen Amtsgericht Stadthagen HRA 200752\nRegisterbekanntmachung nach dem Umwandlungsgesetz 25.09.2025 (Eintragungsdatum)\n\nTrans-Solution-Service Inhaberin Edeltraud Schaarschmidt e. Kfr.\nEinzelkaufmann / Einzelkauffrau\nRinteln\n\nDen Gläubigern der an der Ausgliederung beteiligten Rechtsträger ist, wenn sie binnen sechs Monaten nach dem Tag, an dem die Eintragung der Ausgliederung in das Register des Sitzes desjenigen Rechtsträgers, dessen Gläubiger sie sind, nach § 19 Abs. 3 UmwG als bekannt gemacht gilt, ihren Anspruch nach Grund und Höhe schriftlich anmelden, Sicherheit zu leisten, soweit sie nicht Befriedigung verlangen können. Dieses Recht steht den Gläubigern jedoch nur zu, wenn sie glaubhaft machen, dass durch die Ausgliederung die Erfüllung der Forderung gefährdet wird."
    },
    {
      "date": "2025-09-26",
      "id": "131647",
      "original_text": "Sonstige Registerbekanntmachung\nNiedersachsen Amtsgericht Göttingen HRB 3601\nGöttinger Verkehrsbetriebe GmbH – Göttingen",
      "type": "Sonstige Registerbekanntmachung",
      "state": "Niedersachsen",
      "amtsgericht": "Amtsgericht Göttingen",
      "registernummer": "HRB 3601",
      "registerart": "HRB",
      "company_name": "Göttinger Verkehrsbetriebe GmbH",
      "company_seat": "Göttingen",
      "details": "26.09.2025 (Bekanntmachungsdatum)\n\nNiedersachsen Amtsgericht Göttingen HRB 3601\nSonstige Registerbekanntmachung 26.09.2025 (Eintragungsdatum)\n\nGöttinger Verkehrsbetriebe GmbH\nGesellschaft mit beschränkter Haftung\nGöttingen\n\nDie Liste der Mitglieder des Aufsichtsrats wurde beim Registergericht eingereicht."
    },
    {
      "date": "2025-09-26",
      "id": "131648",
      "original_text": "Registerbekanntmachung nach dem Umwandlungsgesetz\nNiedersachsen Amtsgericht Göttingen HRB 205134\nFN Verwaltungs GmbH – Göttingen",
      "type": "Registerbekanntmachung nach dem Umwandlungsgesetz",
      "state": "Niedersachsen",
      "amtsgericht": "Amtsgericht Göttingen",
      "registernummer": "HRB 205134",
      "registerart": "HRB",
      "company_name": "FN Verwaltungs GmbH",
      "company_seat": "Göttingen",
      "details": "26.09.2025 (Bekanntmachungsdatum)\n\nNiedersachsen Amtsgericht Göttingen HRB 205134\nRegisterbekanntmachung nach dem Umwandlungsgesetz 26.09.2025 (Eintragungsdatum)\n\nFN Verwaltungs GmbH\nGesellschaft mit beschränkter Haftung\nGöttingen\n\nDen Gläubigern der an der Verschmelzung beteiligten Rechtsträger ist, wenn sie binnen sechs Monaten nach dem Tag, an dem die Eintragung der Verschmelzung in das Register des Sitzes desjenigen Rechtsträgers, dessen Gläubiger sie sind, nach § 19  Abs.  3 UmwG als bekannt gemacht gilt, ihren Anspruch nach Grund und Höhe schriftlich anmelden, Sicherheit zu leisten, soweit sie nicht Befriedigung verlangen können. Dieses Recht steht den Gläubigern jedoch nur zu, wenn sie glaubhaft machen, dass durch die Verschmelzung die Erfüllung der Forderung gefährdet wird. Den Gläubigern der an der Verschmelzung beteiligten Rechtsträger ist, wenn sie binnen sechs Monaten nach dem Tag, an dem die Eintragung der Verschmelzung in das Register des Sitzes desjenigen Rechtsträgers, dessen Gläubiger sie sind, nach § 19  Abs.  3 UmwG als bekannt gemacht gilt, ihren Anspruch nach Grund und Höhe schriftlich anmelden, Sicherheit zu leisten, soweit sie nicht Befriedigung verlangen können. Dieses Recht steht den Gläubigern jedoch nur zu, wenn sie glaubhaft machen, dass durch die Verschmelzung die Erfüllung der Forderung gefährdet wird."
    },
    {
      "date": "2025-09-26",
      "id": "131649",
      "original_text": "Löschungsankündigung\nNiedersachsen Amtsgericht Aurich HRB 203047\nBauunternehmen Taute UG (haftungsbeschränkt) – Rhauderfehn",
      "type": "Löschungsankündigung",
      "state": "Niedersachsen",
      "amtsgericht": "Amtsgericht Aurich",
      "registernummer": "HRB 203047",
      "registerart": "HRB",
      "company_name": "Bauunternehmen Taute UG (haftungsbeschränkt)",
      "company_seat": "Rhauderfehn",
      "details": "26.09.2025 (Bekanntmachungsdatum)\n\nNiedersachsen Amtsgericht Aurich HRB 203047\nLöschungsankündigung\n\nBauunternehmen Taute UG (haftungsbeschränkt)\nGesellschaft mit beschränkter Haftung\nRhauderfehn\n\nDas Registergericht beabsichtigt, die Gesellschaft von Amts wegen nach § 394 FamFG zu löschen. Die Frist zur Erhebung eines Widerspruchs ist auf 1 Monat ab dieser Registerbekanntmachung festgesetzt."
    },
    {
      "date": "2025-09-26",
      "id": "131650",
      "original_text": "Registerbekanntmachung nach dem Umwandlungsgesetz\nNiedersachsen Amtsgericht Stadthagen HRA 200766\nEA Schaarschmidt GmbH & Co. KG – Rinteln",
      "type": "Registerbekanntmachung nach dem Umwandlungsgesetz",
      "state": "Niedersachsen",
      "amtsgericht": "Amtsgericht Stadthagen",
      "registernummer": "HRA 200766",
      "registerart": "HRA",
      "company_name": "EA Schaarschmidt GmbH & Co. KG",
      "company_seat": "Rinteln",
      "details": "26.09.2025 (Bekanntmachungsdatum)\n\nNiedersachsen Amtsgericht Stadthagen HRA 200766\nRegisterbekanntmachung nach dem Umwandlungsgesetz 25.09.2025 (Eintragungsdatum)\n\nEA Schaarschmidt GmbH & Co. KG\nKommanditgesellschaft\nRinteln\n\nDen Gläubigern der an der Ausgliederung beteiligten Rechtsträger ist, wenn sie binnen sechs Monaten nach dem Tag, an dem die Eintragung der Ausgliederung in das Register des Sitzes desjenigen Rechtsträgers, dessen Gläubiger sie sind, nach § 19 Abs. 3 UmwG als bekannt gemacht gilt, ihren Anspruch nach Grund und Höhe schriftlich anmelden, Sicherheit zu leisten, soweit sie nicht Befriedigung verlangen können. Dieses Recht steht den Gläubigern jedoch nur zu, wenn sie glaubhaft machen, dass durch die Ausgliederung die Erfüllung der Forderung gefährdet wird."
    },
    {
      "date": "2025-09-26",
      "id": "131651",
      "original_text": "Löschungsankündigung\nNiedersachsen Amtsgericht Stadthagen HRB 200204\nFST- Gaststättenbetriebs-GmbH – Auhagen",
      "type": "Löschungsankündigung",
      "state": "Niedersachsen",
      "amtsgericht": "Amtsgericht Stadthagen",
      "registernummer": "HRB 200204",
      "registerart": "HRB",
      "company_name": "FST- Gaststättenbetriebs-GmbH",
      "company_seat": "Auhagen",
      "details": "26.09.2025 (Bekanntmachungsdatum)\n\nNiedersachsen Amtsgericht Stadthagen HRB 200204\nLöschungsankündigung\n\nFST- Gaststättenbetriebs-GmbH\nGesellschaft mit beschränkter Haftung\nAuhagen\n\nDas Registergericht beabsichtigt, die Gesellschaft von Amts wegen nach § 394 FamFG zu löschen. Die Frist zur Erhebung eines Widerspruchs ist auf 1 Monat ab dieser Registerbekanntmachung festgesetzt."
    },
    {
      "date": "2025-09-26",
      "id": "131652",
      "original_text": "Registerbekanntmachung nach dem Umwandlungsgesetz\nNiedersachsen Amtsgericht Osnabrück HRA 209715\nMarkus Klutzny GmbH & Co. KG – Schüttorf",
      "type": "Registerbekanntmachung nach dem Umwandlungsgesetz",
      "state": "Niedersachsen",
      "amtsgericht": "Amtsgericht Osnabrück",
      "registernummer": "HRA 209715",
      "registerart": "HRA",
      "company_name": "Markus Klutzny GmbH & Co. KG",
      "company_seat": "Schüttorf",
      "details": "26.09.2025 (Bekanntmachungsdatum)\n\nNiedersachsen Amtsgericht Osnabrück HRA 209715\nRegisterbekanntmachung nach dem Umwandlungsgesetz 26.09.2025 (Eintragungsdatum)\n\nMarkus Klutzny GmbH & Co. KG\nKommanditgesellschaft\nSchüttorf\n\nDen Gläubigern der an der Ausgliederung beteiligten Rechtsträger ist, wenn sie binnen sechs Monaten nach dem Tag, an dem die Eintragung der Ausgliederung in das Register des Sitzes desjenigen Rechtsträgers, dessen Gläubiger sie sind, nach § 19 Abs. 3 UmwG als bekannt gemacht gilt, ihren Anspruch nach Grund und Höhe schriftlich anmelden, Sicherheit zu leisten, soweit sie nicht Befriedigung verlangen können. Dieses Recht steht den Gläubigern jedoch nur zu, wenn sie glaubhaft machen, dass durch die Ausgliederung die Erfüllung der Forderung gefährdet wird."
    },
    {
      "date": "2025-09-26",
      "id": "131653",
      "original_text": "Registerbekanntmachung nach dem Umwandlungsgesetz\nNiedersachsen Amtsgericht Lüneburg HRB 208253\nFreihoff Sicherheitsservice Nord GmbH – Stelle",
      "type": "Registerbekanntmachung nach dem Umwandlungsgesetz",
      "state": "Niedersachsen",
      "amtsgericht": "Amtsgericht Lüneburg",
      "registernummer": "HRB 208253",
      "registerart": "HRB",
      "company_name": "Freihoff Sicherheitsservice Nord GmbH",
      "company_seat": "Stelle",
      "details": "26.09.2025 (Bekanntmachungsdatum)\n\nNiedersachsen Amtsgericht Lüneburg HRB 208253\nRegisterbekanntmachung nach dem Umwandlungsgesetz 26.09.2025 (Eintragungsdatum)\n\nFreihoff Sicherheitsservice Nord GmbH\nGesellschaft mit beschränkter Haftung\nStelle\n\nDen Gläubigern der an der Verschmelzung beteiligten Rechtsträger ist, wenn sie binnen sechs Monaten nach dem Tag, an dem die Eintragung der Verschmelzung in das Register des Sitzes desjenigen Rechtsträgers, dessen Gläubiger sie sind, nach § 19  Abs.  3 UmwG als bekannt gemacht gilt, ihren Anspruch nach Grund und Höhe schriftlich anmelden, Sicherheit zu leisten, soweit sie nicht Befriedigung verlangen können. Dieses Recht steht den Gläubigern jedoch nur zu, wenn sie glaubhaft machen, dass durch die Verschmelzung die Erfüllung der Forderung gefährdet wird."
    },
    {
      "date": "2025-09-26",
      "id": "131654",
      "original_text": "Registerbekanntmachung nach dem Umwandlungsgesetz\nNiedersachsen Amtsgericht Braunschweig HRB 9768\nSattler Media GmbH – Hornburg",
      "type": "Registerbekanntmachung nach dem Umwandlungsgesetz",
      "state": "Niedersachsen",
      "amtsgericht": "Amtsgericht Braunschweig",
      "registernummer": "HRB 9768",
      "registerart": "HRB",
      "company_name": "Sattler Media GmbH",
      "company_seat": "Hornburg",
      "details": "26.09.2025 (Bekanntmachungsdatum)\n\nNiedersachsen Amtsgericht Braunschweig HRB 9768\nRegisterbekanntmachung nach dem Umwandlungsgesetz 26.09.2025 (Eintragungsdatum)\n\nSattler Media GmbH\nGesellschaft mit beschränkter Haftung\nHornburg\n\nDen Gläubigern der an der Verschmelzung beteiligten Rechtsträger ist, wenn sie binnen sechs Monaten nach dem Tag, an dem die Eintragung der Verschmelzung in das Register des Sitzes desjenigen Rechtsträgers, dessen Gläubiger sie sind, nach § 19  Abs.  3 UmwG als bekannt gemacht gilt, ihren Anspruch nach Grund und Höhe schriftlich anmelden, Sicherheit zu leisten, soweit sie nicht Befriedigung verlangen können. Dieses Recht steht den Gläubigern jedoch nur zu, wenn sie glaubhaft machen, dass durch die Verschmelzung die Erfüllung der Forderung gefährdet wird."
    },
    {
      "date": "2025-09-26",
      "id": "131655",
      "original_text": "Löschungsankündigung\nNiedersachsen Amtsgericht Braunschweig HRB 206698\npassgenau Personalberatung GmbH – Helmstedt",
      "type": "Löschungsankündigung",
      "state": "Niedersachsen",
      "amtsgericht": "Amtsgericht Braunschweig",
      "registernummer": "HRB 206698",
      "registerart": "HRB",
      "company_name": "passgenau Personalberatung GmbH",
      "company_seat": "Helmstedt",
      "details": "26.09.2025 (Bekanntmachungsdatum)\n\nNiedersachsen Amtsgericht Braunschweig HRB 206698\nLöschungsankündigung\n\npassgenau Personalberatung GmbH\nGesellschaft mit beschränkter Haftung\nHelmstedt\n\nDas Registergericht beabsichtigt, die Gesellschaft von Amts wegen nach § 394 FamFG zu löschen. Die Frist zur Erhebung eines Widerspruchs ist auf 1 Monat ab dieser Registerbekanntmachung festgesetzt."
    },
    {
      "date": "2025-09-26",
      "id": "131656",
      "original_text": "Löschungsankündigung\nNiedersachsen Amtsgericht Hannover HRB 210681\nL³ Oberflächentechnik GmbH – Hannover",
      "type": "Löschungsankündigung",
      "state": "Niedersachsen",
      "amtsgericht": "Amtsgericht Hannover",
      "registernummer": "HRB 210681",
      "registerart": "HRB",
      "company_name": "L³ Oberflächentechnik GmbH",
      "company_seat": "Hannover",
      "details": "26.09.2025 (Bekanntmachungsdatum)\n\nNiedersachsen Amtsgericht Hannover HRB 210681\nLöschungsankündigung\n\nL³ Oberflächentechnik GmbH\nGesellschaft mit beschränkter Haftung\nHannover\n\nDas Registergericht beabsichtigt, die Gesellschaft von Amts wegen nach § 394 FamFG zu löschen. Die Frist zur Erhebung eines Widerspruchs ist auf 1 Monat ab dieser Registerbekanntmachung festgesetzt."
    },
    {
      "date": "2025-09-26",
      "id": "131657",
      "original_text": "Registerbekanntmachung nach dem Umwandlungsgesetz\nRheinland-Pfalz Amtsgericht Zweibrücken HRA 30847\nJonas Melzer e.K. – Münchweiler",
      "type": "Registerbekanntmachung nach dem Umwandlungsgesetz",
      "state": "Rheinland-Pfalz",
      "amtsgericht": "Amtsgericht Zweibrücken",
      "registernummer": "HRA 30847",
      "registerart": "HRA",
      "company_name": "Jonas Melzer e.K.",
      "company_seat": "Münchweiler",
      "details": "26.09.2025 (Bekanntmachungsdatum)\n\nRheinland-Pfalz Amtsgericht Zweibrücken HRA 30847\nRegisterbekanntmachung nach dem Umwandlungsgesetz 26.09.2025 (Eintragungsdatum)\n\nJonas Melzer e.K.\nEinzelkaufmann / Einzelkauffrau\nMünchweiler\n\nAls nicht eingetragen wird veröffentlicht: Den Gläubigern der an der Ausgliederung beteiligten Rechtsträger ist, wenn sie binnen sechs Monaten nac hdem Tag, an dem die Eintragung der Ausgliederung in das Register des Sitzes desjenigen Rechtsträgers,dessen Gläubiger sie sind, nach § 19 Abs. 3 UmwG als bekannt gemacht gilt, ihren Anspruch nach Grund und Höhe schriftlich anmelden, Sicherheit zu leisten, soweit sie nicht Befriedigung verlangen können. Dieses Recht steht den Gläubigern jedoch nur zu, wenn sie glaubhaft machen, dass durch die Ausgliederung die Erfüllung der Forderung gefährdet wird."
    },
    {
      "date": "2025-09-26",
      "id": "131658",
      "original_text": "Registerbekanntmachung nach dem Umwandlungsgesetz\nRheinland-Pfalz Amtsgericht Zweibrücken HRB 33388\nFresh Media GmbH – Münchweiler",
      "type": "Registerbekanntmachung nach dem Umwandlungsgesetz",
      "state": "Rheinland-Pfalz",
      "amtsgericht": "Amtsgericht Zweibrücken",
      "registernummer": "HRB 33388",
      "registerart": "HRB",
      "company_name": "Fresh Media GmbH",
      "company_seat": "Münchweiler",
      "details": "26.09.2025 (Bekanntmachungsdatum)\n\nRheinland-Pfalz Amtsgericht Zweibrücken HRB 33388\nRegisterbekanntmachung nach dem Umwandlungsgesetz 26.09.2025 (Eintragungsdatum)\n\nFresh Media GmbH\nGesellschaft mit beschränkter Haftung\nMünchweiler\n\nAls nicht eingetragen wird veröffentlicht: Den Gläubigern der an der Ausgliederung beteiligten Rechtsträger ist, wenn sie binnen sechs Monaten nac hdem Tag, an dem die Eintragung der Ausgliederung in das Register des Sitzes desjenigen Rechtsträgers,dessen Gläubiger sie sind, nach § 19 Abs. 3 UmwG als bekannt gemacht gilt, ihren Anspruch nach Grund und Höhe schriftlich anmelden, Sicherheit zu leisten, soweit sie nicht Befriedigung verlangen können. Dieses Recht steht den Gläubigern jedoch nur zu, wenn sie glaubhaft machen, dass durch die Ausgliederung die Erfüllung der Forderung gefährdet wird."
    },
    {
      "date": "2025-09-26",
      "id": "131659",
      "original_text": "Registerbekanntmachung nach dem Umwandlungsgesetz\nRheinland-Pfalz Amtsgericht Landau HRB 34378\nDer Dienstleister TK GmbH – Birkenhördt",
      "type": "Registerbekanntmachung nach dem Umwandlungsgesetz",
      "state": "Rheinland-Pfalz",
      "amtsgericht": "Amtsgericht Landau",
      "registernummer": "HRB 34378",
      "registerart": "HRB",
      "company_name": "Der Dienstleister TK GmbH",
      "company_seat": "Birkenhördt",
      "details": "26.09.2025 (Bekanntmachungsdatum)\n\nRheinland-Pfalz Amtsgericht Landau HRB 34378\nRegisterbekanntmachung nach dem Umwandlungsgesetz 26.09.2025 (Eintragungsdatum)\n\nDer Dienstleister TK GmbH\nGesellschaft mit beschränkter Haftung\nBirkenhördt\n\nAls nicht eingetragen wird veröffentlicht: Den Gläubigern der an der Ausgliederung beteiligten Rechtsträger ist, wenn sie binnen sechs Monaten nach\ndem Tag, an dem die Eintragung der Ausgliederung in das Register des Sitzes desjenigen Rechtsträgers, dessen Gläubiger sie sind, nach § 19 Abs. 3 UmwG als bekannt gemacht gilt, ihren Anspruch nach Grund und Höhe schriftlich anmelden, Sicherheit zu leisten, soweit sie nicht Befriedigung verlangen können. Dieses Recht steht den Gläubigern jedoch nur zu, wenn sie glaubhaft machen, dass durch die Ausgliederung die Erfüllung der Forderung gefährdet wird."
    },
    {
      "date": "2025-09-26",
      "id": "131660",
      "original_text": "Registerbekanntmachung nach dem Umwandlungsgesetz\nRheinland-Pfalz Amtsgericht Wittlich HRB 12307\nsuki.international GmbH – Landscheid",
      "type": "Registerbekanntmachung nach dem Umwandlungsgesetz",
      "state": "Rheinland-Pfalz",
      "amtsgericht": "Amtsgericht Wittlich",
      "registernummer": "HRB 12307",
      "registerart": "HRB",
      "company_name": "suki.international GmbH",
      "company_seat": "Landscheid",
      "details": "26.09.2025 (Bekanntmachungsdatum)\n\nRheinland-Pfalz Amtsgericht Wittlich HRB 12307\nRegisterbekanntmachung nach dem Umwandlungsgesetz 26.09.2025 (Eintragungsdatum)\n\nsuki.international GmbH\nGesellschaft mit beschränkter Haftung\nLandscheid\n\nAls nicht eingetragen wird veröffentlicht: Den Gläubigern der an der Ausgliederung beteiligten Rechtsträger ist, wenn sie binnen sechs Monaten nach dem Tag, an dem die Eintragung der Ausgliederung in das Register des Sitzes desjenigen Rechtsträgers, dessen Gläubiger sie sind, nach § 19 Abs. 3 UmwG als bekannt gemacht gilt, ihren Anspruch nach Grund und Höhe schriftlich anmelden, Sicherheit zu leisten, soweit sie nicht Befriedigung verlangen können. Dieses Recht steht den Gläubigern jedoch nur zu, wenn sie glaubhaft machen, dass durch die Ausgliederung die Erfüllung der Forderung gefährdet wird."
    },
    {
      "date": "2025-09-26",
      "id": "131661",
      "original_text": "Registerbekanntmachung nach dem Umwandlungsgesetz\nRheinland-Pfalz Amtsgericht Mainz HRB 49740\nPowertrain-Germany GmbH – Budenheim",
      "type": "Registerbekanntmachung nach dem Umwandlungsgesetz",
      "state": "Rheinland-Pfalz",
      "amtsgericht": "Amtsgericht Mainz",
      "registernummer": "HRB 49740",
      "registerart": "HRB",
      "company_name": "Powertrain-Germany GmbH",
      "company_seat": "Budenheim",
      "details": "26.09.2025 (Bekanntmachungsdatum)\n\nRheinland-Pfalz Amtsgericht Mainz HRB 49740\nRegisterbekanntmachung nach dem Umwandlungsgesetz 26.09.2025 (Eintragungsdatum)\n\nPowertrain-Germany GmbH\nGesellschaft mit beschränkter Haftung\nBudenheim\n\nAls nicht eingetragen wird veröffentlicht: Den Gläubigern der an der Verschmelzung beteiligten Rechtsträger ist, wenn sie binnen sechs Monaten nach dem Tag, an dem die Eintragung der Verschmelzung in das Register des Sitzes desjenigen Rechtsträgers,dessen Gläubiger sie sind, nach § 19 Abs. 3 UmwG als bekannt gemacht gilt, ihren Anspruch nach Grund und Höhe schriftlich anmelden, Sicherheit zu leisten, soweit sie nicht Befriedigung verlangen können. Dieses Recht steht den Gläubigern jedoch nur zu, wenn sie glaubhaft machen, dass durch die Verschmelzung die Erfüllung der Forderung gefährdet wird."
    },
    {
      "date": "2025-09-26",
      "id": "131662",
      "original_text": "Registerbekanntmachung nach dem Umwandlungsgesetz\nNordrhein-Westfalen Amtsgericht Duisburg HRA 13672\nKevin Maibom Metallbau e.K. – Hamminkeln",
      "type": "Registerbekanntmachung nach dem Umwandlungsgesetz",
      "state": "Nordrhein-Westfalen",
      "amtsgericht": "Amtsgericht Duisburg",
      "registernummer": "HRA 13672",
      "registerart": "HRA",
      "company_name": "Kevin Maibom Metallbau e.K.",
      "company_seat": "Hamminkeln",
      "details": "26.09.2025 (Bekanntmachungsdatum)\n\nNordrhein-Westfalen Amtsgericht Duisburg HRA 13672\nRegisterbekanntmachung nach dem Umwandlungsgesetz 26.09.2025 (Eintragungsdatum)\n\nKevin Maibom Metallbau e.K.\nEinzelkaufmann / Einzelkauffrau\nHamminkeln\n\nDie Gesellschaft hat Gläubigern, deren Forderungen vor dieser Bekanntmachung begründet worden sind, Sicherheit zu leisten, soweit sie nicht Befriedigung verlangen können, wenn sie sich binnen sechs Monaten zu diesem Zweck melden."
    },
    {
      "date": "2025-09-26",
      "id": "131663",
      "original_text": "Löschungsankündigung\nNordrhein-Westfalen Amtsgericht Krefeld HRB 19398\nKaral Verwaltungs GmbH – Tönisvorst",
      "type": "Löschungsankündigung",
      "state": "Nordrhein-Westfalen",
      "amtsgericht": "Amtsgericht Krefeld",
      "registernummer": "HRB 19398",
      "registerart": "HRB",
      "company_name": "Karal Verwaltungs GmbH",
      "company_seat": "Tönisvorst",
      "details": "26.09.2025 (Bekanntmachungsdatum)\n\nNordrhein-Westfalen Amtsgericht Krefeld HRB 19398\nLöschungsankündigung\n\nKaral Verwaltungs GmbH\nGesellschaft mit beschränkter Haftung\nTönisvorst\n\nDas Registergericht beabsichtigt die Gesellschaft von Amts wegen nach § 394 FamFG zu löschen. Die Frist zur Erhebung eines Widerspruchs ist auf einen Monat festgesetzt."
    },
    {
      "date": "2025-09-26",
      "id": "131664",
      "original_text": "Registerbekanntmachung nach dem Umwandlungsgesetz\nNordrhein-Westfalen Amtsgericht Duisburg HRB 16967\nduisport industrial solutions NordWest GmbH – Duisburg",
      "type": "Registerbekanntmachung nach dem Umwandlungsgesetz",
      "state": "Nordrhein-Westfalen",
      "amtsgericht": "Amtsgericht Duisburg",
      "registernummer": "HRB 16967",
      "registerart": "HRB",
      "company_name": "duisport industrial solutions NordWest GmbH",
      "company_seat": "Duisburg",
      "details": "26.09.2025 (Bekanntmachungsdatum)\n\nNordrhein-Westfalen Amtsgericht Duisburg HRB 16967\nRegisterbekanntmachung nach dem Umwandlungsgesetz 26.09.2025 (Eintragungsdatum)\n\nduisport industrial solutions NordWest GmbH\nGesellschaft mit beschränkter Haftung\nDuisburg\n\nDie Gesellschaft hat Gläubigern, deren Forderungen vor dieser Bekanntmachung begründet worden sind, Sicherheit zu leisten, soweit sie nicht Befriedigung verlangen können, wenn sie sich binnen sechs Monaten zu diesem Zweck melden."
    },
    {
      "date": "2025-09-26",
      "id": "131665",
      "original_text": "Registerbekanntmachung nach dem Umwandlungsgesetz\nNordrhein-Westfalen Amtsgericht Neuss HRB 4845\nNISSIN TRANSPORT GmbH – Neuss",
      "type": "Registerbekanntmachung nach dem Umwandlungsgesetz",
      "state": "Nordrhein-Westfalen",
      "amtsgericht": "Amtsgericht Neuss",
      "registernummer": "HRB 4845",
      "registerart": "HRB",
      "company_name": "NISSIN TRANSPORT GmbH",
      "company_seat": "Neuss",
      "details": "26.09.2025 (Bekanntmachungsdatum)\n\nNordrhein-Westfalen Amtsgericht Neuss HRB 4845\nRegisterbekanntmachung nach dem Umwandlungsgesetz 26.09.2025 (Eintragungsdatum)\n\nNISSIN TRANSPORT GmbH\nGesellschaft mit beschränkter Haftung\nNeuss\n\nDem Registergericht ist nach § 308 Abs. 1 S. 1 UmwG der Entwurf des Verschmelzungsplans über die grenzüberschreitende Verschmelzung der NISSIN TRANSPORT GESELLSCHAFT m.b.H., einer nach dem Recht von Österreich gegründeten Gesellschaft mit beschränkter Haftung, mit Sitz in der Gemeinde Groß-Enzersdorf, Österreich, und der Geschäftsanschrift Kasernstraße 5, 2301 Groß-Enzersdorf, Österreich, eingetragen im Firmenbuch des Landes - als Handelsgerichts Korneuburg unter FN 114602 h, als übertragendem Rechtsträger und der NISSIN TRANSPORT GmbH, einer nach deutschem Recht gegründeten Gesellschaft mit beschränkter Haftung mit Sitz in Neuss, Deutschland, eingetragen im Handelsregister des Amtsgericht Neuss unter HRB 4845, als übernehmendem Rechtsträger eingereicht worden.\n\nDie Anteilsinhaber und Gläubiger der an der grenzüberschreitenden Verschmelzung beteiligten Gesellschaften und die Betriebsräte der beteiligten  Gesellschaften oder, soweit kein Betriebsrat existiert, die Arbeitnehmer der an der grenzüberschreitenden Verschmelzung beteiligten Gesellschaften werden darauf hingewiesen, dass sie der jeweiligen Gesellschaft spätestens fünf Arbeitstage vor dem Tag der Beurkundung der Zustimmung der Anteilsinhaber der Gesellschaft zum Verschmelzungsplan (§ 308 Abs. 1 S. 4 UmwG) Bemerkungen zum Verschmelzungsplan übermitteln können.\n\nDer Termin für die Beurkundung der Zustimmung der Anteilsinhaber steht gegenwärtig noch nicht fest, wird aber nicht vor dem 15. Dezember 2025 stattfinden."
    },
    {
      "date": "2025-09-26",
      "id": "131666",
      "original_text": "Registerbekanntmachung nach dem Umwandlungsgesetz\nNordrhein-Westfalen Amtsgericht Bielefeld HRA 17555\nSvenson-Plumbing e.K. – Bielefeld",
      "type": "Registerbekanntmachung nach dem Umwandlungsgesetz",
      "state": "Nordrhein-Westfalen",
      "amtsgericht": "Amtsgericht Bielefeld",
      "registernummer": "HRA 17555",
      "registerart": "HRA",
      "company_name": "Svenson-Plumbing e.K.",
      "company_seat": "Bielefeld",
      "details": "26.09.2025 (Bekanntmachungsdatum)\n\nNordrhein-Westfalen Amtsgericht Bielefeld HRA 17555\nRegisterbekanntmachung nach dem Umwandlungsgesetz 26.09.2025 (Eintragungsdatum)\n\nSvenson-Plumbing e.K.\nEinzelkaufmann / Einzelkauffrau\nBielefeld\n\nDen Gläubigern der an der Ausgliederung beteiligten Rechtsträger ist, wenn sie binnen sechs Monaten nach dem Tag, an dem die Eintragung der Ausgliederung in das Register des Sitzes desjenigen Rechtsträgers, dessen Gläubiger sie sind, nach § 19 Absatz 3 UmwG als bekanntgemacht gilt, ihren Anspruch nach Grund und Höhe schriftlich anmelden, Sicherheit zu leisten, soweit sie nicht Befriedigung verlangen können. Dieses Recht steht den Gläubigern jedoch nur zu, wenn sie glaubhaft machen, dass durch die Ausgliederung die Erfüllung ihrer Forderung gefährdet wird."
    },
    {
      "date": "2025-09-26",
      "id": "131667",
      "original_text": "Registerbekanntmachung nach dem Umwandlungsgesetz\nNordrhein-Westfalen Amtsgericht Hamm HRB 10534\nPro Claims Solutions GmbH – Unna",
      "type": "Registerbekanntmachung nach dem Umwandlungsgesetz",
      "state": "Nordrhein-Westfalen",
      "amtsgericht": "Amtsgericht Hamm",
      "registernummer": "HRB 10534",
      "registerart": "HRB",
      "company_name": "Pro Claims Solutions GmbH",
      "company_seat": "Unna",
      "details": "26.09.2025 (Bekanntmachungsdatum)\n\nNordrhein-Westfalen Amtsgericht Hamm HRB 10534\nRegisterbekanntmachung nach dem Umwandlungsgesetz 26.09.2025 (Eintragungsdatum)\n\nPro Claims Solutions GmbH\nGesellschaft mit beschränkter Haftung\nUnna\n\nDen Gläubigern der an der Verschmelzung beteiligten Rechtsträger ist, wenn sie binnen sechs Monaten nach dem Tag, an dem die Eintragung der Verschmelzung in das Register des Sitzes derjenigen Rechtsträger deren Gläubiger sie sind, nach § 19 Absatz 3 UmwG als bekanntgemacht gilt, ihren Anspruch nach Grund und Höhe schriftlich anmelden, Sicherheit zu leisten, soweit sie nicht Befriedigung verlangen können. Dieses Recht steht den Gläubigern jedoch nur zu, wenn sie glaubhaft machen, dass durch die Verschmelzung die Erfüllung ihrer Forderung gefährdet wird."
    },
    {
      "date": "2025-09-26",
      "id": "131668",
      "original_text": "Registerbekanntmachung nach dem Umwandlungsgesetz\nNordrhein-Westfalen Amtsgericht Duisburg HRB 39310\nMetallbau Maibom GmbH – Hamminkeln",
      "type": "Registerbekanntmachung nach dem Umwandlungsgesetz",
      "state": "Nordrhein-Westfalen",
      "amtsgericht": "Amtsgericht Duisburg",
      "registernummer": "HRB 39310",
      "registerart": "HRB",
      "company_name": "Metallbau Maibom GmbH",
      "company_seat": "Hamminkeln",
      "details": "26.09.2025 (Bekanntmachungsdatum)\n\nNordrhein-Westfalen Amtsgericht Duisburg HRB 39310\nRegisterbekanntmachung nach dem Umwandlungsgesetz 26.09.2025 (Eintragungsdatum)\n\nMetallbau Maibom GmbH\nGesellschaft mit beschränkter Haftung\nHamminkeln\n\nDie Gesellschaft hat Gläubigern, deren Forderungen vor dieser Bekanntmachung begründet worden sind, Sicherheit zu leisten, soweit sie nicht Befriedigung verlangen können, wenn sie sich binnen sechs Monaten zu diesem Zweck melden."
    },
    {
      "date": "2025-09-26",
      "id": "131669",
      "original_text": "Einreichung neuer Dokumente\nNordrhein-Westfalen Amtsgericht Köln HRB 57922\n450connect GmbH – Köln",
      "type": "Einreichung neuer Dokumente",
      "state": "Nordrhein-Westfalen",
      "amtsgericht": "Amtsgericht Köln",
      "registernummer": "HRB 57922",
      "registerart": "HRB",
      "company_name": "450connect GmbH",
      "company_seat": "Köln",
      "details": "26.09.2025 (Bekanntmachungsdatum)\n\nNordrhein-Westfalen Amtsgericht Köln HRB 57922\nEinreichung neuer Dokumente\n\n450connect GmbH\nGesellschaft mit beschränkter Haftung\nKöln\n\nDem Registergericht ist eine Liste der Mitglieder des Aufsichtsrates eingereicht worden."
    },
    {
      "date": "2025-09-26",
      "id": "131670",
      "original_text": "Registerbekanntmachung nach dem Umwandlungsgesetz\nNordrhein-Westfalen Amtsgericht Essen HRB 17372\nMP Verwaltungsgesellschaft mbH – Essen",
      "type": "Registerbekanntmachung nach dem Umwandlungsgesetz",
      "state": "Nordrhein-Westfalen",
      "amtsgericht": "Amtsgericht Essen",
      "registernummer": "HRB 17372",
      "registerart": "HRB",
      "company_name": "MP Verwaltungsgesellschaft mbH",
      "company_seat": "Essen",
      "details": "26.09.2025 (Bekanntmachungsdatum)\n\nNordrhein-Westfalen Amtsgericht Essen HRB 17372\nRegisterbekanntmachung nach dem Umwandlungsgesetz 26.09.2025 (Eintragungsdatum)\n\nMP Verwaltungsgesellschaft mbH\nGesellschaft mit beschränkter Haftung\nEssen\n\nDen Gläubigern der an der Verschmelzung beteiligten Rechtsträger ist, wenn sie binnen sechs Monaten nach dem Tag, an dem die Eintragung der Verschmelzung in das Register des Sitzes desjenigen Rechtsträgers, dessen Gläubiger sie sind, nach § 19 Absatz 3 UmwG als bekanntgemacht gilt, ihren Anspruch nach Grund und Höhe schriftlich anmelden, Sicherheit zu leisten, soweit sie nicht Befriedigung verlangen können. Dieses Recht steht den Gläubigern jedoch nur zu, wenn sie glaubhaft machen, dass durch die Verschmelzung die Erfüllung ihrer Forderung gefährdet wird."
    },
    {
      "date": "2025-09-26",
      "id": "131671",
      "original_text": "Registerbekanntmachung nach dem Umwandlungsgesetz\nNordrhein-Westfalen Amtsgericht Essen HRB 15451\nHerbert Gottschlich GmbH – Sprockhövel",
      "type": "Registerbekanntmachung nach dem Umwandlungsgesetz",
      "state": "Nordrhein-Westfalen",
      "amtsgericht": "Amtsgericht Essen",
      "registernummer": "HRB 15451",
      "registerart": "HRB",
      "company_name": "Herbert Gottschlich GmbH",
      "company_seat": "Sprockhövel",
      "details": "26.09.2025 (Bekanntmachungsdatum)\n\nNordrhein-Westfalen Amtsgericht Essen HRB 15451\nRegisterbekanntmachung nach dem Umwandlungsgesetz 26.09.2025 (Eintragungsdatum)\n\nHerbert Gottschlich GmbH\nGesellschaft mit beschränkter Haftung\nSprockhövel\n\nDen Gläubigern der an der Verschmelzung beteiligten Rechtsträger ist, wenn sie binnen sechs Monaten nach dem Tag, an dem die Eintragung der Verschmelzung in das Register des Sitzes desjenigen Rechtsträgers, dessen Gläubiger sie sind, nach § 19 Absatz 3 UmwG als bekanntgemacht gilt, ihren Anspruch nach Grund und Höhe schriftlich anmelden, Sicherheit zu leisten, soweit sie nicht Befriedigung verlangen können. Dieses Recht steht den Gläubigern jedoch nur zu, wenn sie glaubhaft machen, dass durch die Verschmelzung die Erfüllung ihrer Forderung gefährdet wird."
    },
    {
      "date": "2025-09-26",
      "id": "131672",
      "original_text": "Löschungsankündigung\nNordrhein-Westfalen Amtsgericht Hamm HRB 11370\nJuwap UG (haftungsbeschränkt) – Hamm",
      "type": "Löschungsankündigung",
      "state": "Nordrhein-Westfalen",
      "amtsgericht": "Amtsgericht Hamm",
      "registernummer": "HRB 11370",
      "registerart": "HRB",
      "company_name": "Juwap UG (haftungsbeschränkt)",
      "company_seat": "Hamm",
      "details": "26.09.2025 (Bekanntmachungsdatum)\n\nNordrhein-Westfalen Amtsgericht Hamm HRB 11370\nLöschungsankündigung\n\nJuwap UG (haftungsbeschränkt)\nGesellschaft mit beschränkter Haftung\nHamm\n\nDas Registergericht beabsichtigt die Gesellschaft von Amts wegen nach § 394 FamFG zu löschen. Die Frist zur Erhebung eines Widerspruchs ist auf drei Monate festgesetzt."
    },
    {
      "date": "2025-09-26",
      "id": "131673",
      "original_text": "Einreichung neuer Dokumente\nNordrhein-Westfalen Amtsgericht Köln HRB 24148\nConsortia Vermögensverwaltung AG – Köln",
      "type": "Einreichung neuer Dokumente",
      "state": "Nordrhein-Westfalen",
      "amtsgericht": "Amtsgericht Köln",
      "registernummer": "HRB 24148",
      "registerart": "HRB",
      "company_name": "Consortia Vermögensverwaltung AG",
      "company_seat": "Köln",
      "details": "26.09.2025 (Bekanntmachungsdatum)\n\nNordrhein-Westfalen Amtsgericht Köln HRB 24148\nEinreichung neuer Dokumente 26.09.2025 (Eintragungsdatum)\n\nConsortia Vermögensverwaltung AG\nAktiengesellschaft\nKöln\n\nDem Registergericht ist eine neue Liste der Mitglieder des Aufsichtsrates eingereicht worden."
    },
    {
      "date": "2025-09-26",
      "id": "131674",
      "original_text": "Löschungsankündigung\nNordrhein-Westfalen Amtsgericht Wuppertal HRB 29744\nFuchs Bau GmbH – Erkrath",
      "type": "Löschungsankündigung",
      "state": "Nordrhein-Westfalen",
      "amtsgericht": "Amtsgericht Wuppertal",
      "registernummer": "HRB 29744",
      "registerart": "HRB",
      "company_name": "Fuchs Bau GmbH",
      "company_seat": "Erkrath",
      "details": "26.09.2025 (Bekanntmachungsdatum)\n\nNordrhein-Westfalen Amtsgericht Wuppertal HRB 29744\nLöschungsankündigung\n\nFuchs Bau GmbH\nGesellschaft mit beschränkter Haftung\nErkrath\n\nDas Registergericht beabsichtigt die Gesellschaft von Amts wegen nach § 394 FamFG zu löschen. Die Frist zur Erhebung eines Widerspruchs ist auf einen Monat festgesetzt."
    },
    {
      "date": "2025-09-26",
      "id": "131675",
      "original_text": "Löschungsankündigung\nNordrhein-Westfalen Amtsgericht Düsseldorf HRB 102281\nMarci Gastro GmbH – Düsseldorf",
      "type": "Löschungsankündigung",
      "state": "Nordrhein-Westfalen",
      "amtsgericht": "Amtsgericht Düsseldorf",
      "registernummer": "HRB 102281",
      "registerart": "HRB",
      "company_name": "Marci Gastro GmbH",
      "company_seat": "Düsseldorf",
      "details": "26.09.2025 (Bekanntmachungsdatum)\n\nNordrhein-Westfalen Amtsgericht Düsseldorf HRB 102281\nLöschungsankündigung\n\nMarci Gastro GmbH\nGesellschaft mit beschränkter Haftung\nDüsseldorf\n\nDas Registergericht beabsichtigt die Gesellschaft von Amts wegen nach § 394 FamFG zu löschen. Die Frist zur Erhebung eines Widerspruchs ist auf 3 Wochen festgesetzt.\n\nRechtsbehelfsbelehrung:\nDas Widerspruchsrecht steht jedem zu, der an der Unterlassung der Löschung ein berechtigtes Interesse hat. Der Widerspruch ist bei dem Amtsgericht Düsseldorf -Registergericht-, Werdener Straße 1, 40227 Düsseldorf schriftlich in deutscher Sprache oder zur Niederschrift der Geschäftsstelle einzulegen. Der Widerspruch kann auch zur Niederschrift der Geschäftsstelle eines jeden Amtsgerichtes abgegeben werden. Die Einlegung ist auch durch Übertragung eines elektronischen Dokuments an die elektronische Poststelle des Gerichts möglich. Das elektronische Dokument muss für die Bearbeitung durch das Gericht geeignet und mit einer qualifizierten elektronischen Signatur der verantwortenden Person versehen sein oder von der verantwortenden Person signiert und auf einem sicheren Übermittlungsweg gemäß § 130a ZPO nach näherer Maßgabe der Verordnung über die technischen Rahmenbedingungen des elektronischen Rechtsverkehrs und über das besondere elektronische Behördenpostfach (BGBl. I, S.3803) eingereicht werden. Weitere Informationen erhalten Sie auf der Internetseite www.justiz.de.\nDer Widerspruch muss spätestens innerhalb der gesetzten Frist nach dem Datum der Bekanntmachung der Löschungsankündigung bei dem Amtsgericht - Registergericht - Düsseldorf eingegangen sein.  Dies gilt auch dann, wenn der Widerspruch zur Niederschrift der Geschäftsstelle eines anderen Amtsgerichtes abgegeben wurde. Die Frist beginnt mit dem Tage der Bekanntmachung der Löschungsankündigung in dem für die Bekanntmachung der Eintragungen in das Handelsregister bestimmten elektronischen Informations- und Kommunikationssystem nach § 10 des Handelsgesetzbuches. Fällt das Ende der Frist auf einen Sonntag, einen allgemeinen Feiertag oder Sonnabend, so endet die Frist mit Ablauf des nächsten Werktages.\nDer Widerspruch muss die Bezeichnung der angefochtenen Löschungsankündigung sowie die Erklärung enthalten, dass Widerspruch gegen diese Löschungsankündigung eingelegt wird. Er ist zu unterzeichnen und soll begründet werden."
    },
    {
      "date": "2025-09-26",
      "id": "131676",
      "original_text": "Registerbekanntmachung nach dem Umwandlungsgesetz\nNordrhein-Westfalen Amtsgericht Wuppertal HRA 26007\nMalerbetrieb Zinn e.K. – Mettmann",
      "type": "Registerbekanntmachung nach dem Umwandlungsgesetz",
      "state": "Nordrhein-Westfalen",
      "amtsgericht": "Amtsgericht Wuppertal",
      "registernummer": "HRA 26007",
      "registerart": "HRA",
      "company_name": "Malerbetrieb Zinn e.K.",
      "company_seat": "Mettmann",
      "details": "26.09.2025 (Bekanntmachungsdatum)\n\nNordrhein-Westfalen Amtsgericht Wuppertal HRA 26007\nRegisterbekanntmachung nach dem Umwandlungsgesetz 26.09.2025 (Eintragungsdatum)\n\nMalerbetrieb Zinn e.K.\nEinzelkaufmann / Einzelkauffrau\nMettmann\n\nDen Gläubigern der an der Ausgliederung beteiligten Rechtsträger ist, wenn sie binnen sechs Monaten nach dem Tag, an dem die Eintragung der Ausgliederung in das Register des Sitzes derjenigen Rechtsträger deren Gläubiger sie sind, nach § 19 Absatz 3 UmwG als bekanntgemacht gilt, ihren Anspruch nach Grund und Höhe schriftlich anmelden, Sicherheit zu leisten, soweit sie nicht Befriedigung verlangen können. Dieses Recht steht den Gläubigern jedoch nur zu, wenn sie glaubhaft machen, dass durch die Ausgliederung die Erfüllung ihrer Forderung gefährdet wird."
    },
    {
      "date": "2025-09-26",
      "id": "131677",
      "original_text": "Registerbekanntmachung nach dem Umwandlungsgesetz\nNordrhein-Westfalen Amtsgericht Düsseldorf VR 8447\nIPV-ERGO-Unterstützungskasse e.V. – Düsseldorf",
      "type": "Registerbekanntmachung nach dem Umwandlungsgesetz",
      "state": "Nordrhein-Westfalen",
      "amtsgericht": "Amtsgericht Düsseldorf",
      "registernummer": "VR 8447",
      "registerart": "VR",
      "company_name": "IPV-ERGO-Unterstützungskasse e.V.",
      "company_seat": "Düsseldorf",
      "details": "26.09.2025 (Bekanntmachungsdatum)\n\nNordrhein-Westfalen Amtsgericht Düsseldorf VR 8447\nRegisterbekanntmachung nach dem Umwandlungsgesetz 26.09.2025 (Eintragungsdatum)\n\nIPV-ERGO-Unterstützungskasse e.V.\neingetragener Verein\nDüsseldorf\n\nDen Gläubigern der an der Verschmelzung beteiligten Rechtsträger ist, wenn sie binnen sechs Monaten nach dem Tag, an dem die Eintragung der Verschmelzung in das Register des Sitzes desjenigen Rechtsträgers, dessen Gläubiger sie sind, nach § 19 Absatz 3 UmwG als bekanntgemacht gilt, ihren Anspruch nach Grund und Höhe schriftlich anmelden, Sicherheit zu leisten, soweit sie nicht Befriedigung verlangen können. Dieses Recht steht den Gläubigern jedoch nur zu, wenn sie glaubhaft machen, dass durch die Verschmelzung die Erfüllung ihrer Forderung gefährdet wird."
    },
    {
      "date": "2025-09-26",
      "id": "131678",
      "original_text": "Registerbekanntmachung nach dem Umwandlungsgesetz\nNordrhein-Westfalen Amtsgericht Gütersloh HRB 4775\nConform GmbH – Halle (Westf.)",
      "type": "Registerbekanntmachung nach dem Umwandlungsgesetz",
      "state": "Nordrhein-Westfalen",
      "amtsgericht": "Amtsgericht Gütersloh",
      "registernummer": "HRB 4775",
      "registerart": "HRB",
      "company_name": "Conform GmbH",
      "company_seat": "Halle (Westf.)",
      "details": "26.09.2025 (Bekanntmachungsdatum)\n\nNordrhein-Westfalen Amtsgericht Gütersloh HRB 4775\nRegisterbekanntmachung nach dem Umwandlungsgesetz 26.09.2025 (Eintragungsdatum)\n\nConform GmbH\nGesellschaft mit beschränkter Haftung\nHalle (Westf.)\n\nDen Gläubigern der an der Verschmelzung beteiligten Rechtsträger ist, wenn sie binnen sechs Monaten nach dem Tag, an dem die Eintragung der Verschmelzung in das Register des Sitzes desjenigen Rechtsträgers, dessen Gläubiger sie sind, nach § 19 Absatz 3 UmwG als bekanntgemacht gilt, ihren Anspruch nach Grund und Höhe schriftlich anmelden, Sicherheit zu leisten, soweit sie nicht Befriedigung verlangen können. Dieses Recht steht den Gläubigern jedoch nur zu, wenn sie glaubhaft machen, dass durch die Verschmelzung die Erfüllung ihrer Forderung gefährdet wird."
    },
    {
      "date": "2025-09-26",
      "id": "131679",
      "original_text": "Registerbekanntmachung nach dem Umwandlungsgesetz\nNordrhein-Westfalen Amtsgericht Wuppertal HRA 26054\nDipl. Ing. Gregor Icking e. K. – Wuppertal",
      "type": "Registerbekanntmachung nach dem Umwandlungsgesetz",
      "state": "Nordrhein-Westfalen",
      "amtsgericht": "Amtsgericht Wuppertal",
      "registernummer": "HRA 26054",
      "registerart": "HRA",
      "company_name": "Dipl. Ing. Gregor Icking e. K.",
      "company_seat": "Wuppertal",
      "details": "26.09.2025 (Bekanntmachungsdatum)\n\nNordrhein-Westfalen Amtsgericht Wuppertal HRA 26054\nRegisterbekanntmachung nach dem Umwandlungsgesetz 26.09.2025 (Eintragungsdatum)\n\nDipl. Ing. Gregor Icking e. K.\nEinzelkaufmann / Einzelkauffrau\nWuppertal\n\nDen Gläubigern der an der Ausgliederung beteiligten Rechtsträger ist, wenn sie binnen sechs Monaten nach dem Tag, an dem die Eintragung der Ausgliederung in das Register des Sitzes derjenigen Rechtsträger deren Gläubiger sie sind, nach § 19 Absatz 3 UmwG als bekanntgemacht gilt, ihren Anspruch nach Grund und Höhe schriftlich anmelden, Sicherheit zu leisten, soweit sie nicht Befriedigung verlangen können. Dieses Recht steht den Gläubigern jedoch nur zu, wenn sie glaubhaft machen, dass durch die Ausgliederung die Erfüllung ihrer Forderung gefährdet wird."
    },
    {
      "date": "2025-09-26",
      "id": "131680",
      "original_text": "Registerbekanntmachung nach dem Umwandlungsgesetz\nNordrhein-Westfalen Amtsgericht Gütersloh HRA 8603\nJohann Schmidt e.K. – Rheda-Wiedenbrück",
      "type": "Registerbekanntmachung nach dem Umwandlungsgesetz",
      "state": "Nordrhein-Westfalen",
      "amtsgericht": "Amtsgericht Gütersloh",
      "registernummer": "HRA 8603",
      "registerart": "HRA",
      "company_name": "Johann Schmidt e.K.",
      "company_seat": "Rheda-Wiedenbrück",
      "details": "26.09.2025 (Bekanntmachungsdatum)\n\nNordrhein-Westfalen Amtsgericht Gütersloh HRA 8603\nRegisterbekanntmachung nach dem Umwandlungsgesetz 26.09.2025 (Eintragungsdatum)\n\nJohann Schmidt e.K.\nEinzelkaufmann / Einzelkauffrau\nRheda-Wiedenbrück\n\nDen Gläubigern der an der Ausgliederung beteiligten Rechtsträger ist, wenn sie binnen sechs Monaten nach dem Tag, an dem die Eintragung der Ausgliederung in das Register des Sitzes desjenigen Rechtsträgers, dessen Gläubiger sie sind, nach § 19 Absatz 3 UmwG als bekanntgemacht gilt, ihren Anspruch nach Grund und Höhe schriftlich anmelden, Sicherheit zu leisten, soweit sie nicht Befriedigung verlangen können. Dieses Recht steht den Gläubigern jedoch nur zu, wenn sie glaubhaft machen, dass durch die Ausgliederung die Erfüllung ihrer Forderung gefährdet wird."
    },
    {
      "date": "2025-09-26",
      "id": "131681",
      "original_text": "Registerbekanntmachung nach dem Umwandlungsgesetz\nNordrhein-Westfalen Amtsgericht Bielefeld HRB 40190\nAdvanz Pharma Germany GmbH – Bielefeld",
      "type": "Registerbekanntmachung nach dem Umwandlungsgesetz",
      "state": "Nordrhein-Westfalen",
      "amtsgericht": "Amtsgericht Bielefeld",
      "registernummer": "HRB 40190",
      "registerart": "HRB",
      "company_name": "Advanz Pharma Germany GmbH",
      "company_seat": "Bielefeld",
      "details": "26.09.2025 (Bekanntmachungsdatum)\n\nNordrhein-Westfalen Amtsgericht Bielefeld HRB 40190\nRegisterbekanntmachung nach dem Umwandlungsgesetz 26.09.2025 (Eintragungsdatum)\n\nAdvanz Pharma Germany GmbH\nGesellschaft mit beschränkter Haftung\nBielefeld\n\nDen Gläubigern der an der Verschmelzung beteiligten Rechtsträger ist, wenn sie binnen sechs Monaten nach dem Tag, an dem die Eintragung der Verschmelzung in das Register des Sitzes desjenigen Rechtsträgers, dessen Gläubiger sie sind, nach § 19 Absatz 3 UmwG als bekanntgemacht gilt, ihren Anspruch nach Grund und Höhe schriftlich anmelden, Sicherheit zu leisten, soweit sie nicht Befriedigung verlangen können. Dieses Recht steht den Gläubigern jedoch nur zu, wenn sie glaubhaft machen, dass durch die Verschmelzung die Erfüllung ihrer Forderung gefährdet wird."
    },
    {
      "date": "2025-09-26",
      "id": "131682",
      "original_text": "Löschungsankündigung\nNordrhein-Westfalen Amtsgericht Düsseldorf HRB 79532\nAlgolstern GmbH – Düsseldorf",
      "type": "Löschungsankündigung",
      "state": "Nordrhein-Westfalen",
      "amtsgericht": "Amtsgericht Düsseldorf",
      "registernummer": "HRB 79532",
      "registerart": "HRB",
      "company_name": "Algolstern GmbH",
      "company_seat": "Düsseldorf",
      "details": "26.09.2025 (Bekanntmachungsdatum)\n\nNordrhein-Westfalen Amtsgericht Düsseldorf HRB 79532\nLöschungsankündigung\n\nAlgolstern GmbH\nGesellschaft mit beschränkter Haftung\nDüsseldorf\n\nDas Registergericht beabsichtigt die Gesellschaft von Amts wegen nach § 394 FamFG zu löschen. Die Frist zur Erhebung eines Widerspruchs ist auf 3 Wochen festgesetzt.\n\nRechtsbehelfsbelehrung:\nDas Widerspruchsrecht steht jedem zu, der an der Unterlassung der Löschung ein berechtigtes Interesse hat. Der Widerspruch ist bei dem Amtsgericht Düsseldorf -Registergericht-, Werdener Straße 1, 40227 Düsseldorf schriftlich in deutscher Sprache oder zur Niederschrift der Geschäftsstelle einzulegen. Der Widerspruch kann auch zur Niederschrift der Geschäftsstelle eines jeden Amtsgerichtes abgegeben werden. Die Einlegung ist auch durch Übertragung eines elektronischen Dokuments an die elektronische Poststelle des Gerichts möglich. Das elektronische Dokument muss für die Bearbeitung durch das Gericht geeignet und mit einer qualifizierten elektronischen Signatur der verantwortenden Person versehen sein oder von der verantwortenden Person signiert und auf einem sicheren Übermittlungsweg gemäß § 130a ZPO nach näherer Maßgabe der Verordnung über die technischen Rahmenbedingungen des elektronischen Rechtsverkehrs und über das besondere elektronische Behördenpostfach (BGBl. I, S.3803) eingereicht werden. Weitere Informationen erhalten Sie auf der Internetseite www.justiz.de.\nDer Widerspruch muss spätestens innerhalb der gesetzten Frist nach dem Datum der Bekanntmachung der Löschungsankündigung bei dem Amtsgericht - Registergericht - Düsseldorf eingegangen sein.  Dies gilt auch dann, wenn der Widerspruch zur Niederschrift der Geschäftsstelle eines anderen Amtsgerichtes abgegeben wurde. Die Frist beginnt mit dem Tage der Bekanntmachung der Löschungsankündigung in dem für die Bekanntmachung der Eintragungen in das Handelsregister bestimmten elektronischen Informations- und Kommunikationssystem nach § 10 des Handelsgesetzbuches. Fällt das Ende der Frist auf einen Sonntag, einen allgemeinen Feiertag oder Sonnabend, so endet die Frist mit Ablauf des nächsten Werktages.\nDer Widerspruch muss die Bezeichnung der angefochtenen Löschungsankündigung sowie die Erklärung enthalten, dass Widerspruch gegen diese Löschungsankündigung eingelegt wird. Er ist zu unterzeichnen und soll begründet werden."
    },
    {
      "date": "2025-09-26",
      "id": "131683",
      "original_text": "Löschungsankündigung\nNordrhein-Westfalen Amtsgericht Düsseldorf HRA 17374\nWTI World Technology Invest GmbH & Co. KG – Düsseldorf",
      "type": "Löschungsankündigung",
      "state": "Nordrhein-Westfalen",
      "amtsgericht": "Amtsgericht Düsseldorf",
      "registernummer": "HRA 17374",
      "registerart": "HRA",
      "company_name": "WTI World Technology Invest GmbH & Co. KG",
      "company_seat": "Düsseldorf",
      "details": "26.09.2025 (Bekanntmachungsdatum)\n\nNordrhein-Westfalen Amtsgericht Düsseldorf HRA 17374\nLöschungsankündigung\n\nWTI World Technology Invest GmbH & Co. KG\nKommanditgesellschaft\nDüsseldorf\n\nDas Registergericht beabsichtigt die Firma von Amts wegen nach § 31 Abs. 2 HGB zu löschen. Die Frist zur Erhebung eines Widerspruchs ist auf drei Monate festgesetzt.\n\nRechtsbehelfsbelehrung:\nDas Widerspruchsrecht steht jedem zu, der an der Unterlassung der Löschung ein berechtigtes Interesse hat. Der Widerspruch ist bei dem Amtsgericht Düsseldorf -Registergericht-, Werdener Straße 1, 40227 Düsseldorf schriftlich in deutscher Sprache oder zur Niederschrift der Geschäftsstelle einzulegen. Der Widerspruch kann auch zur Niederschrift der Geschäftsstelle eines jeden Amtsgerichtes abgegeben werden. Die Einlegung ist auch durch Übertragung eines elektronischen Dokuments an die elektronische Poststelle des Gerichts möglich. Das elektronische Dokument muss für die Bearbeitung durch das Gericht geeignet und mit einer qualifizierten elektronischen Signatur der verantwortenden Person versehen sein oder von der verantwortenden Person signiert und auf einem sicheren Übermittlungsweg gemäß § 130a ZPO nach näherer Maßgabe der Verordnung über die technischen Rahmenbedingungen des elektronischen Rechtsverkehrs und über das besondere elektronische Behördenpostfach (BGBl. I, S.3803) eingereicht werden. Weitere Informationen erhalten Sie auf der Internetseite www.justiz.de.\nDer Widerspruch muss spätestens innerhalb der gesetzten Frist nach dem Datum der Bekanntmachung der Löschungsankündigung bei dem Amtsgericht - Registergericht - Düsseldorf eingegangen sein.  Dies gilt auch dann, wenn der Widerspruch zur Niederschrift der Geschäftsstelle eines anderen Amtsgerichtes abgegeben wurde. Die Frist beginnt mit dem Tage der Bekanntmachung der Löschungsankündigung in dem für die Bekanntmachung der Eintragungen in das Handelsregister bestimmten elektronischen Informations- und Kommunikationssystem nach § 10 des Handelsgesetzbuches. Fällt das Ende der Frist auf einen Sonntag, einen allgemeinen Feiertag oder Sonnabend, so endet die Frist mit Ablauf des nächsten Werktages.\nDer Widerspruch muss die Bezeichnung der angefochtenen Löschungsankündigung sowie die Erklärung enthalten, dass Widerspruch gegen diese Löschungsankündigung eingelegt wird. Er ist zu unterzeichnen und soll begründet werden."
    },
    {
      "date": "2025-09-26",
      "id": "131684",
      "original_text": "Löschungsankündigung\nNordrhein-Westfalen Amtsgericht Siegburg HRB 15418\nVardar&Schaal UG (haftungsbeschränkt) – Troisdorf",
      "type": "Löschungsankündigung",
      "state": "Nordrhein-Westfalen",
      "amtsgericht": "Amtsgericht Siegburg",
      "registernummer": "HRB 15418",
      "registerart": "HRB",
      "company_name": "Vardar&Schaal UG (haftungsbeschränkt)",
      "company_seat": "Troisdorf",
      "details": "26.09.2025 (Bekanntmachungsdatum)\n\nNordrhein-Westfalen Amtsgericht Siegburg HRB 15418\nLöschungsankündigung\n\nVardar&Schaal UG (haftungsbeschränkt)\nGesellschaft mit beschränkter Haftung\nTroisdorf\n\nDas Registergericht hat glaubhafte Kenntnis erlangt, dass die Gesellschaft vermögenslos geworden ist.\n\nEs ist daher beabsichtigt, die Gesellschaft nach § 394 FamFG im Handelsregister wegen Vermögenslosigkeit zu löschen.\n\nEinwände gegen die Löschung sind durch Widerspruch binnen einer Frist von 3 Monaten geltend zu machen, andernfalls die Löschung erfolgen wird.\n\nEinzulegen ist der Widerspruch bei dem Amtsgericht Siegburg, Neue Poststraße 16, 53721 Siegburg, und zwar entweder schriftlich in deutscher Sprache oder mündlich zur Niederschrift der Geschäftsstelle. Der Widerspruch kann auch zur Niederschrift der Geschäftsstelle eines jeden Amtsgerichts abgegeben werden. Der Widerspruch ist binnen der in der Verfügung bestimmten Frist einzulegen. Die Frist ist nur gewahrt, wenn der Widerspruch rechtzeitig bei dem Amtsgericht Siegburg eingeht, auch wenn der Widerspruch zur Niederschrift der Geschäftsstelle eines anderen Amtsgerichts abgegeben wurde. Die Frist beginnt jeweils mit der schriftlichen Bekanntgabe der Verfügung an die Beteiligten. Kann die schriftliche Bekanntgabe an einen Beteiligten nicht bewirkt werden, beginnt die Frist spätestens mit Ablauf von fünf Monaten nach Erlass der Verfügung. Die Bekanntgabe ist entweder durch Zustellung oder am dritten Tage nach Aufgabe zur Post bewirkt. Sofern die Löschung noch nicht erfolgt ist, kann der Widerspruch auch noch nach Ablauf der Frist eingelegt werden. Fällt das Ende der Frist auf einen Sonnabend, einen Sonntag oder einen allgemeinen Feiertag, endet die Frist mit Ablauf des nächsten Werktages. Der Widerspruch ist zu unterzeichnen. Eine Begründung des Widerspruchs ist nicht vorgeschrieben."
    },
    {
      "date": "2025-09-26",
      "id": "131685",
      "original_text": "Registerbekanntmachung nach dem Umwandlungsgesetz\nNordrhein-Westfalen Amtsgericht Paderborn HRA 8975\nBorgmeier Elektrotechnik GmbH & Co. KG – Borgentreich",
      "type": "Registerbekanntmachung nach dem Umwandlungsgesetz",
      "state": "Nordrhein-Westfalen",
      "amtsgericht": "Amtsgericht Paderborn",
      "registernummer": "HRA 8975",
      "registerart": "HRA",
      "company_name": "Borgmeier Elektrotechnik GmbH & Co. KG",
      "company_seat": "Borgentreich",
      "details": "26.09.2025 (Bekanntmachungsdatum)\n\nNordrhein-Westfalen Amtsgericht Paderborn HRA 8975\nRegisterbekanntmachung nach dem Umwandlungsgesetz 26.09.2025 (Eintragungsdatum)\n\nBorgmeier Elektrotechnik GmbH & Co. KG\nKommanditgesellschaft\nBorgentreich\n\nDen Gläubigern der an der Ausgliederung beteiligten Rechtsträger ist, wenn sie binnen sechs Monaten nach dem Tag, an dem die Eintragung der Ausgliederung in das Register des Sitzes desjenigen Rechtsträgers, dessen Gläubiger sie sind, nach § 19 Absatz 3 UmwG als bekanntgemacht gilt, ihren Anspruch nach Grund und Höhe schriftlich anmelden, Sicherheit zu leisten, soweit sie nicht Befriedigung verlangen können. Dieses Recht steht den Gläubigern jedoch nur zu, wenn sie glaubhaft machen, dass durch die Ausgliederung die Erfüllung ihrer Forderung gefährdet wird."
    },
    {
      "date": "2025-09-26",
      "id": "131686",
      "original_text": "Löschungsankündigung\nNordrhein-Westfalen Amtsgericht Siegburg HRB 7492\nEdmund Weller GmbH Straßen- und Tiefbau – Reichshof-Wildbergerhütte",
      "type": "Löschungsankündigung",
      "state": "Nordrhein-Westfalen",
      "amtsgericht": "Amtsgericht Siegburg",
      "registernummer": "HRB 7492",
      "registerart": "HRB",
      "company_name": "Edmund Weller GmbH Straßen- und Tiefbau",
      "company_seat": "Reichshof-Wildbergerhütte",
      "details": "26.09.2025 (Bekanntmachungsdatum)\n\nNordrhein-Westfalen Amtsgericht Siegburg HRB 7492\nLöschungsankündigung\n\nEdmund Weller GmbH Straßen- und Tiefbau\nGesellschaft mit beschränkter Haftung\nReichshof-Wildbergerhütte\n\nDas Registergericht hat glaubhafte Kenntnis erlangt, dass die Gesellschaft vermögenslos geworden ist, da ein Insolvenzverfahren wegen Masselosigkeit nach § 207 InsO eingestellt wurde.\n\nEs ist daher beabsichtigt, die Gesellschaft nach § 394 FamFG im Handelsregister wegen Vermögenslosigkeit zu löschen.\n\nEinwände gegen die Löschung sind durch Widerspruch binnen einer Frist von 3 Monaten geltend zu machen, andernfalls die Löschung erfolgen wird.\n\nEinzulegen ist der Widerspruch bei dem Amtsgericht Siegburg, Neue Poststraße 16, 53721 Siegburg, und zwar entweder schriftlich in deutscher Sprache oder mündlich zur Niederschrift der Geschäftsstelle. Der Widerspruch kann auch zur Niederschrift der Geschäftsstelle eines jeden Amtsgerichts abgegeben werden. Der Widerspruch ist binnen der in der Verfügung bestimmten Frist einzulegen. Die Frist ist nur gewahrt, wenn der Widerspruch rechtzeitig bei dem Amtsgericht Siegburg eingeht, auch wenn der Widerspruch zur Niederschrift der Geschäftsstelle eines anderen Amtsgerichts abgegeben wurde. Die Frist beginnt jeweils mit der schriftlichen Bekanntgabe der Verfügung an die Beteiligten. Kann die schriftliche Bekanntgabe an einen Beteiligten nicht bewirkt werden, beginnt die Frist spätestens mit Ablauf von fünf Monaten nach Erlass der Verfügung. Die Bekanntgabe ist entweder durch Zustellung oder am dritten Tage nach Aufgabe zur Post bewirkt. Sofern die Löschung noch nicht erfolgt ist, kann der Widerspruch auch noch nach Ablauf der Frist eingelegt werden. Fällt das Ende der Frist auf einen Sonnabend, einen Sonntag oder einen allgemeinen Feiertag, endet die Frist mit Ablauf des nächsten Werktages. Der Widerspruch ist zu unterzeichnen. Eine Begründung des Widerspruchs ist nicht vorgeschrieben."
    },
    {
      "date": "2025-09-26",
      "id": "131687",
      "original_text": "Registerbekanntmachung nach dem Umwandlungsgesetz\nNordrhein-Westfalen Amtsgericht Wuppertal HRB 36090\nTGA Icking GmbH – Wuppertal",
      "type": "Registerbekanntmachung nach dem Umwandlungsgesetz",
      "state": "Nordrhein-Westfalen",
      "amtsgericht": "Amtsgericht Wuppertal",
      "registernummer": "HRB 36090",
      "registerart": "HRB",
      "company_name": "TGA Icking GmbH",
      "company_seat": "Wuppertal",
      "details": "26.09.2025 (Bekanntmachungsdatum)\n\nNordrhein-Westfalen Amtsgericht Wuppertal HRB 36090\nRegisterbekanntmachung nach dem Umwandlungsgesetz 26.09.2025 (Eintragungsdatum)\n\nTGA Icking GmbH\nGesellschaft mit beschränkter Haftung\nWuppertal\n\nDen Gläubigern der an der Ausgliederung beteiligten Rechtsträger ist, wenn sie binnen sechs Monaten nach dem Tag, an dem die Eintragung der Ausgliederung in das Register des Sitzes derjenigen Rechtsträger deren Gläubiger sie sind, nach § 19 Absatz 3 UmwG als bekanntgemacht gilt, ihren Anspruch nach Grund und Höhe schriftlich anmelden, Sicherheit zu leisten, soweit sie nicht Befriedigung verlangen können. Dieses Recht steht den Gläubigern jedoch nur zu, wenn sie glaubhaft machen, dass durch die Ausgliederung die Erfüllung ihrer Forderung gefährdet wird."
    },
    {
      "date": "2025-09-26",
      "id": "131688",
      "original_text": "Einreichung neuer Dokumente\nNordrhein-Westfalen Amtsgericht Aachen HRB 21825\nTSV Alemannia Aachen GmbH – Aachen",
      "type": "Einreichung neuer Dokumente",
      "state": "Nordrhein-Westfalen",
      "amtsgericht": "Amtsgericht Aachen",
      "registernummer": "HRB 21825",
      "registerart": "HRB",
      "company_name": "TSV Alemannia Aachen GmbH",
      "company_seat": "Aachen",
      "details": "26.09.2025 (Bekanntmachungsdatum)\n\nNordrhein-Westfalen Amtsgericht Aachen HRB 21825\nEinreichung neuer Dokumente\n\nTSV Alemannia Aachen GmbH\nGesellschaft mit beschränkter Haftung\nAachen\n\nDem Registergericht sind fünf Listen der Mitglieder des Aufsichtsrates eingereicht worden."
    },
    {
      "date": "2025-09-26",
      "id": "131689",
      "original_text": "Registerbekanntmachung nach dem Umwandlungsgesetz\nNordrhein-Westfalen Amtsgericht Bielefeld HRA 10753\nZeitungsverlag NEUE WESTFÄLISCHE Gesellschaft mit beschränkter Haftung & Co. Kommanditgesellschaft – Bielefeld",
      "type": "Registerbekanntmachung nach dem Umwandlungsgesetz",
      "state": "Nordrhein-Westfalen",
      "amtsgericht": "Amtsgericht Bielefeld",
      "registernummer": "HRA 10753",
      "registerart": "HRA",
      "company_name": "Zeitungsverlag NEUE WESTFÄLISCHE Gesellschaft mit beschränkter Haftung & Co. Kommanditgesellschaft",
      "company_seat": "Bielefeld",
      "details": "26.09.2025 (Bekanntmachungsdatum)\n\nNordrhein-Westfalen Amtsgericht Bielefeld HRA 10753\nRegisterbekanntmachung nach dem Umwandlungsgesetz 26.09.2025 (Eintragungsdatum)\n\nZeitungsverlag NEUE WESTFÄLISCHE Gesellschaft mit beschränkter Haftung & Co. Kommanditgesellschaft\nKommanditgesellschaft\nBielefeld\n\nDen Gläubigern der an der Verschmelzung beteiligten Rechtsträger ist, wenn sie binnen sechs Monaten nach dem Tag, an dem die Eintragung der Verschmelzung in das Register des Sitzes desjenigen Rechtsträgers, dessen Gläubiger sie sind, nach § 19 Absatz 3 UmwG als bekanntgemacht gilt, ihren Anspruch nach Grund und Höhe schriftlich anmelden, Sicherheit zu leisten, soweit sie nicht Befriedigung verlangen können. Dieses Recht steht den Gläubigern jedoch nur zu, wenn sie glaubhaft machen, dass durch die Verschmelzung die Erfüllung ihrer Forderung gefährdet wird."
    },
    {
      "date": "2025-09-26",
      "id": "131690",
      "original_text": "Registerbekanntmachung nach dem Umwandlungsgesetz\nNordrhein-Westfalen Amtsgericht Köln HRB 122197\nAtec Sanitär- und Heizungstechnik GmbH – Köln",
      "type": "Registerbekanntmachung nach dem Umwandlungsgesetz",
      "state": "Nordrhein-Westfalen",
      "amtsgericht": "Amtsgericht Köln",
      "registernummer": "HRB 122197",
      "registerart": "HRB",
      "company_name": "Atec Sanitär- und Heizungstechnik GmbH",
      "company_seat": "Köln",
      "details": "26.09.2025 (Bekanntmachungsdatum)\n\nNordrhein-Westfalen Amtsgericht Köln HRB 122197\nRegisterbekanntmachung nach dem Umwandlungsgesetz 26.09.2025 (Eintragungsdatum)\n\nAtec Sanitär- und Heizungstechnik GmbH\nGesellschaft mit beschränkter Haftung\nKöln\n\nDen Gläubigern der an der Ausgliederung beteiligten Rechtsträger ist, wenn sie binnen sechs Monaten nach dem Tag, an dem die Eintragung der Ausgliederung in das Register des Sitzes desjenigen Rechtsträgers, dessen Gläubiger sie sind, nach § 19 Absatz 3 UmwG als bekanntgemacht gilt, ihren Anspruch nach Grund und Höhe schriftlich anmelden, Sicherheit zu leisten, soweit sie nicht Befriedigung verlangen können. Dieses Recht steht den Gläubigern jedoch nur zu, wenn sie glaubhaft machen, dass durch die Ausgliederung die Erfüllung ihrer Forderung gefährdet wird."
    },
    {
      "date": "2025-09-26",
      "id": "131691",
      "original_text": "Löschungsankündigung\nThüringen Amtsgericht Jena HRB 505741\nKONTINENTAL IAS GmbH – Jena",
      "type": "Löschungsankündigung",
      "state": "Thüringen",
      "amtsgericht": "Amtsgericht Jena",
      "registernummer": "HRB 505741",
      "registerart": "HRB",
      "company_name": "KONTINENTAL IAS GmbH",
      "company_seat": "Jena",
      "details": "26.09.2025 (Bekanntmachungsdatum)\n\nThüringen Amtsgericht Jena HRB 505741\nLöschungsankündigung\n\nKONTINENTAL IAS GmbH\nGesellschaft mit beschränkter Haftung\nJena\n\nDas Registergericht beabsichtigt, die im Handelsregister eingetragene Gesellschaft wegen Vermögenslosigkeit nach § 394 FamFG von Amts wegen zu löschen. Die Frist zur Erhebung eines Widerspruchs gegen die beabsichtigte Löschung wird auf 6 Wochen festgesetzt."
    },
    {
      "date": "2025-09-26",
      "id": "131692",
      "original_text": "Registerbekanntmachung nach dem Umwandlungsgesetz\nThüringen Amtsgericht Jena HRB 515674\nclyxop devices GmbH – Erfurt",
      "type": "Registerbekanntmachung nach dem Umwandlungsgesetz",
      "state": "Thüringen",
      "amtsgericht": "Amtsgericht Jena",
      "registernummer": "HRB 515674",
      "registerart": "HRB",
      "company_name": "clyxop devices GmbH",
      "company_seat": "Erfurt",
      "details": "26.09.2025 (Bekanntmachungsdatum)\n\nThüringen Amtsgericht Jena HRB 515674\nRegisterbekanntmachung nach dem Umwandlungsgesetz 26.09.2025 (Eintragungsdatum)\n\nclyxop devices GmbH\nGesellschaft mit beschränkter Haftung\nErfurt\n\nNicht eingetragen: Den Gläubigern der an der Verschmelzung beteiligten Rechtsträger, ist wenn sie binnen sechs Monaten nach dem Tag, an dem die Eintragung der Verschmelzung in das Register des Sitzes desjenigen Rechtsträgers, dessen Gläubiger sie sind,  nach § 19 Abs. 3 UmwG als bekanntgemacht gilt, ihren Anspruch nach Grund und Höhe schriftlich anmelden, Sicherheit zu leisten, soweit sie nicht Befriedigung verlangen können. Dieses Recht steht ihnen jedoch nur zu, wenn sie glaubhaft machen, daß durch die Verschmelzung die Erfüllung ihrer Forderung gefährdet wird."
    },
    {
      "date": "2025-09-26",
      "id": "131693",
      "original_text": "Löschungsankündigung\nHessen Amtsgericht Wiesbaden HRB 33393\nd.i.i. Vertriebs GmbH – Wiesbaden",
      "type": "Löschungsankündigung",
      "state": "Hessen",
      "amtsgericht": "Amtsgericht Wiesbaden",
      "registernummer": "HRB 33393",
      "registerart": "HRB",
      "company_name": "d.i.i. Vertriebs GmbH",
      "company_seat": "Wiesbaden",
      "details": "26.09.2025 (Bekanntmachungsdatum)\n\nHessen Amtsgericht Wiesbaden HRB 33393\nLöschungsankündigung\n\nd.i.i. Vertriebs GmbH\nGesellschaft mit beschränkter Haftung\nWiesbaden\n\nDas Registergericht beabsichtigt die im Handelsregister eingetragene Gesellschaft von Amts wegen nach § 394 FamFG zu löschen. Die Frist zur Erhebung eines Widerspruchs gegen die beabsichtigte Löschung wird auf 3 Monate festgesetzt."
    },
    {
      "date": "2025-09-26",
      "id": "131694",
      "original_text": "Registerbekanntmachung nach dem Umwandlungsgesetz\nHessen Amtsgericht Eschwege HRB 3672\nStadtwerke Großalmerode GmbH – Großalmerode",
      "type": "Registerbekanntmachung nach dem Umwandlungsgesetz",
      "state": "Hessen",
      "amtsgericht": "Amtsgericht Eschwege",
      "registernummer": "HRB 3672",
      "registerart": "HRB",
      "company_name": "Stadtwerke Großalmerode GmbH",
      "company_seat": "Großalmerode",
      "details": "26.09.2025 (Bekanntmachungsdatum)\n\nHessen Amtsgericht Eschwege HRB 3672\nRegisterbekanntmachung nach dem Umwandlungsgesetz 26.09.2025 (Eintragungsdatum)\n\nStadtwerke Großalmerode GmbH\nGesellschaft mit beschränkter Haftung\nGroßalmerode\n\nDen Gläubigern der an der Verschmelzung beteiligten Rechtsträger ist, wenn sie binnen sechs Monaten nach dem Tag, an dem die Eintragung der Verschmelzung in das Register des Sitzes desjenigen Rechtsträgers, dessen Gläubiger sie sind, nach § 19 Absatz 3 UmwG bekannt gemacht worden ist, ihren Anspruch nach Grund und Höhe schriftlich anmelden, Sicherheit zu leisten, soweit sie nicht Befriedigung verlangen können. Dieses Recht steht den Gläubigern jedoch nur zu, wenn sie glaubhaft machen, dass durch die Verschmelzung die Erfüllung ihrer Forderung gefährdet wird."
    },
    {
      "date": "2025-09-26",
      "id": "131695",
      "original_text": "Registerbekanntmachung nach dem Umwandlungsgesetz\nHessen Amtsgericht Frankfurt am Main HRB 137475\nSchaeffler KWK Verwaltungs GmbH – Frankfurt am Main",
      "type": "Registerbekanntmachung nach dem Umwandlungsgesetz",
      "state": "Hessen",
      "amtsgericht": "Amtsgericht Frankfurt am Main",
      "registernummer": "HRB 137475",
      "registerart": "HRB",
      "company_name": "Schaeffler KWK Verwaltungs GmbH",
      "company_seat": "Frankfurt am Main",
      "details": "26.09.2025 (Bekanntmachungsdatum)\n\nHessen Amtsgericht Frankfurt am Main HRB 137475\nRegisterbekanntmachung nach dem Umwandlungsgesetz 26.09.2025 (Eintragungsdatum)\n\nSchaeffler KWK Verwaltungs GmbH\nGesellschaft mit beschränkter Haftung\nFrankfurt am Main\n\nDen Gläubigern der an der Verschmelzung beteiligten Rechtsträger ist, wenn sie binnen sechs Monaten nach dem Tag, an dem die Eintragung der Verschmelzung in das Register des Sitzes desjenigen Rechtsträgers, dessen Gläubiger sie sind, nach § 19 Absatz 3 UmwG bekannt gemacht worden ist, ihren Anspruch nach Grund und Höhe schriftlich anmelden, Sicherheit zu leisten, soweit sie nicht Befriedigung verlangen können. Dieses Recht steht den Gläubigern jedoch nur zu, wenn sie glaubhaft machen, dass durch die Verschmelzung die Erfüllung ihrer Forderung gefährdet wird."
    },
    {
      "date": "2025-09-26",
      "id": "131696",
      "original_text": "Einreichung neuer Dokumente\nHessen Amtsgericht Frankfurt am Main HRB 76752\nContinental Engineering Services GmbH – Frankfurt am Main",
      "type": "Einreichung neuer Dokumente",
      "state": "Hessen",
      "amtsgericht": "Amtsgericht Frankfurt am Main",
      "registernummer": "HRB 76752",
      "registerart": "HRB",
      "company_name": "Continental Engineering Services GmbH",
      "company_seat": "Frankfurt am Main",
      "details": "26.09.2025 (Bekanntmachungsdatum)\n\nHessen Amtsgericht Frankfurt am Main HRB 76752\nEinreichung neuer Dokumente 26.09.2025 (Eintragungsdatum)\n\nContinental Engineering Services GmbH\nGesellschaft mit beschränkter Haftung\nFrankfurt am Main\n\nDurch eine Änderung in den Personen der Aufsichtsratsmitglieder ist eine Liste der Mitglieder des Aufsichtsrates zum Handelsregister eingereicht worden."
    },
    {
      "date": "2025-09-26",
      "id": "131697",
      "original_text": "Sonstige Registerbekanntmachung\nHessen Amtsgericht Wiesbaden VR 6081\nHEVA e.V. – Wiesbaden",
      "type": "Sonstige Registerbekanntmachung",
      "state": "Hessen",
      "amtsgericht": "Amtsgericht Wiesbaden",
      "registernummer": "VR 6081",
      "registerart": "VR",
      "company_name": "HEVA e.V.",
      "company_seat": "Wiesbaden",
      "details": "26.09.2025 (Bekanntmachungsdatum)\n\nHessen Amtsgericht Wiesbaden VR 6081\nSonstige Registerbekanntmachung 26.09.2025 (Eintragungsdatum)\n\nHEVA e.V.\neingetragener Verein\nWiesbaden\n\nDer Verein ist aufgelöst und erloschen."
    },
    {
      "date": "2025-09-26",
      "id": "131698",
      "original_text": "Sonstige Registerbekanntmachung\nHessen Amtsgericht Wetzlar VR 2800\nTeam SBM e.V. – Schöffengrund",
      "type": "Sonstige Registerbekanntmachung",
      "state": "Hessen",
      "amtsgericht": "Amtsgericht Wetzlar",
      "registernummer": "VR 2800",
      "registerart": "VR",
      "company_name": "Team SBM e.V.",
      "company_seat": "Schöffengrund",
      "details": "26.09.2025 (Bekanntmachungsdatum)\n\nHessen Amtsgericht Wetzlar VR 2800\nSonstige Registerbekanntmachung 26.09.2025 (Eintragungsdatum)\n\nTeam SBM e.V.\neingetragener Verein\nSchöffengrund\n\nDer Verein ist aufgelöst."
    },
    {
      "date": "2025-09-26",
      "id": "131699",
      "original_text": "Sonstige Registerbekanntmachung\nHessen Amtsgericht Frankfurt am Main HRB 138483\nAUMОVIО SE – Frankfurt am Main",
      "type": "Sonstige Registerbekanntmachung",
      "state": "Hessen",
      "amtsgericht": "Amtsgericht Frankfurt am Main",
      "registernummer": "HRB 138483",
      "registerart": "HRB",
      "company_name": "AUMОVIО SE",
      "company_seat": "Frankfurt am Main",
      "details": "26.09.2025 (Bekanntmachungsdatum)\n\nHessen Amtsgericht Frankfurt am Main HRB 138483\nSonstige Registerbekanntmachung 26.09.2025 (Eintragungsdatum)\n\nAUMОVIО SE\nEuropäische Aktiengesellschaft (SE)\nFrankfurt am Main\n\nDurch eine Änderung in den Personen der Aufsichtsratsmitglieder ist eine Liste der Mitglieder des Aufsichtsrates zum Handelsregister eingereicht worden."
    },
    {
      "date": "2025-09-26",
      "id": "131700",
      "original_text": "Registerbekanntmachung nach dem Umwandlungsgesetz\nHessen Amtsgericht Gießen HRB 10756\nConrad & Terlaak Sales Advisory GmbH – Ulrichstein",
      "type": "Registerbekanntmachung nach dem Umwandlungsgesetz",
      "state": "Hessen",
      "amtsgericht": "Amtsgericht Gießen",
      "registernummer": "HRB 10756",
      "registerart": "HRB",
      "company_name": "Conrad & Terlaak Sales Advisory GmbH",
      "company_seat": "Ulrichstein",
      "details": "26.09.2025 (Bekanntmachungsdatum)\n\nHessen Amtsgericht Gießen HRB 10756\nRegisterbekanntmachung nach dem Umwandlungsgesetz 26.09.2025 (Eintragungsdatum)\n\nConrad & Terlaak Sales Advisory GmbH\nGesellschaft mit beschränkter Haftung\nUlrichstein\n\nDen Gläubigern der an der formwechselnden Umwandlung beteiligten Rechtsträger ist, wenn sie binnen sechs Monaten nach dem Tag, an dem die Eintragung der formwechselnden Umwandlung in das Register des Sitzes desjenigen Rechtsträgers, dessen Gläubiger sie sind, nach § 201 UmwG bekannt gemacht worden ist, ihren Anspruch nach Grund und Höhe schriftlich anmelden, Sicherheit zu leisten, soweit sie nicht Befriedigung verlangen können. Dieses Recht steht den Gläubigern jedoch nur zu, wenn sie glaubhaft machen, dass durch die formwechselnde Umwandlung die Erfüllung ihrer Forderung gefährdet wird."
    },
    {
      "date": "2025-09-26",
      "id": "131701",
      "original_text": "Registerbekanntmachung nach dem Umwandlungsgesetz\nHessen Amtsgericht Offenbach am Main HRB 8848\nCAM Fitness GmbH – Offenbach am Main",
      "type": "Registerbekanntmachung nach dem Umwandlungsgesetz",
      "state": "Hessen",
      "amtsgericht": "Amtsgericht Offenbach am Main",
      "registernummer": "HRB 8848",
      "registerart": "HRB",
      "company_name": "CAM Fitness GmbH",
      "company_seat": "Offenbach am Main",
      "details": "26.09.2025 (Bekanntmachungsdatum)\n\nHessen Amtsgericht Offenbach am Main HRB 8848\nRegisterbekanntmachung nach dem Umwandlungsgesetz 26.09.2025 (Eintragungsdatum)\n\nCAM Fitness GmbH\nGesellschaft mit beschränkter Haftung\nOffenbach am Main\n\nDen Gläubigern der an der Verschmelzung beteiligten Rechtsträger ist, wenn sie binnen sechs Monaten nach dem Tag, an dem die Eintragung der Verschmelzung in das Register des Sitzes desjenigen Rechtsträgers, dessen Gläubiger sie sind, nach § 19 Absatz 3 UmwG bekannt gemacht worden ist, ihren Anspruch nach Grund und Höhe schriftlich anmelden, Sicherheit zu leisten, soweit sie nicht Befriedigung verlangen können. Dieses Recht steht den Gläubigern jedoch nur zu, wenn sie glaubhaft machen, dass durch die Verschmelzung die Erfüllung ihrer Forderung gefährdet wird."
    },
    {
      "date": "2025-09-26",
      "id": "131702",
      "original_text": "Einreichung neuer Dokumente\nHessen Amtsgericht Frankfurt am Main HRB 28852\na.a.a. aktiengesellschaft allgemeine anlageverwaltung – Frankfurt am Main",
      "type": "Einreichung neuer Dokumente",
      "state": "Hessen",
      "amtsgericht": "Amtsgericht Frankfurt am Main",
      "registernummer": "HRB 28852",
      "registerart": "HRB",
      "company_name": "a.a.a. aktiengesellschaft allgemeine anlageverwaltung",
      "company_seat": "Frankfurt am Main",
      "details": "26.09.2025 (Bekanntmachungsdatum)\n\nHessen Amtsgericht Frankfurt am Main HRB 28852\nEinreichung neuer Dokumente 26.09.2025 (Eintragungsdatum)\n\na.a.a. aktiengesellschaft allgemeine anlageverwaltung\nAktiengesellschaft\nFrankfurt am Main\n\nDie Gesellschaft hat die Entwürfe der Verschmelzungsverträges zwischen ihr und der Grundstücksverwaltung Voltenseestraße2 GmbH, Frankfurt am Main (Amtsgericht Frankfurt am Main HRB 27367), Grundstücksverwaltung Chemnitz Jagdschänkenstraße17 GmbH, Frankfurt am Main (Amtsgericht Frankfurt am Main HRB 58788) und GVW Grundstücksverwaltung Wächtersbacher Str. 83 GmbH, Frankfurt am Main (Amtsgericht Frankfurt am Main HRB 29235) beim Amtsgericht Frankfurt am Main (Registergericht) zur Einsichtnahme eingereicht."
    },
    {
      "date": "2025-09-26",
      "id": "131703",
      "original_text": "Registerbekanntmachung nach dem Umwandlungsgesetz\nHessen Amtsgericht Eschwege HRB 2824\nStadtwerke Großalmerode Verwaltungs GmbH – Großalmerode",
      "type": "Registerbekanntmachung nach dem Umwandlungsgesetz",
      "state": "Hessen",
      "amtsgericht": "Amtsgericht Eschwege",
      "registernummer": "HRB 2824",
      "registerart": "HRB",
      "company_name": "Stadtwerke Großalmerode Verwaltungs GmbH",
      "company_seat": "Großalmerode",
      "details": "26.09.2025 (Bekanntmachungsdatum)\n\nHessen Amtsgericht Eschwege HRB 2824\nRegisterbekanntmachung nach dem Umwandlungsgesetz 26.09.2025 (Eintragungsdatum)\n\nStadtwerke Großalmerode Verwaltungs GmbH\nGesellschaft mit beschränkter Haftung\nGroßalmerode\n\nDen Gläubigern der an der Verschmelzung beteiligten Rechtsträger ist, wenn sie binnen sechs Monaten nach dem Tag, an dem die Eintragung der Verschmelzung in das Register des Sitzes desjenigen Rechtsträgers, dessen Gläubiger sie sind, nach § 19 Absatz 3 UmwG bekannt gemacht worden ist, ihren Anspruch nach Grund und Höhe schriftlich anmelden, Sicherheit zu leisten, soweit sie nicht Befriedigung verlangen können. Dieses Recht steht den Gläubigern jedoch nur zu, wenn sie glaubhaft machen, dass durch die Verschmelzung die Erfüllung ihrer Forderung gefährdet wird."
    },
    {
      "date": "2025-09-26",
      "id": "131704",
      "original_text": "Registerbekanntmachung nach dem Umwandlungsgesetz\nHessen Amtsgericht Frankfurt am Main HRA 54390\nNatural HoldCo GmbH & Co. KG – Frankfurt am Main",
      "type": "Registerbekanntmachung nach dem Umwandlungsgesetz",
      "state": "Hessen",
      "amtsgericht": "Amtsgericht Frankfurt am Main",
      "registernummer": "HRA 54390",
      "registerart": "HRA",
      "company_name": "Natural HoldCo GmbH & Co. KG",
      "company_seat": "Frankfurt am Main",
      "details": "26.09.2025 (Bekanntmachungsdatum)\n\nHessen Amtsgericht Frankfurt am Main HRA 54390\nRegisterbekanntmachung nach dem Umwandlungsgesetz 26.09.2025 (Eintragungsdatum)\n\nNatural HoldCo GmbH & Co. KG\nKommanditgesellschaft\nFrankfurt am Main\n\nDen Gläubigern der an der formwechselnden Umwandlung beteiligten Rechtsträger ist, wenn sie binnen sechs Monaten nach dem Tag, an dem die Eintragung der formwechselnden Umwandlung in das Register des Sitzes desjenigen Rechtsträgers, dessen Gläubiger sie sind, nach § 201 UmwG bekannt gemacht worden ist, ihren Anspruch nach Grund und Höhe schriftlich anmelden, Sicherheit zu leisten, soweit sie nicht Befriedigung verlangen können. Dieses Recht steht den Gläubigern jedoch nur zu, wenn sie glaubhaft machen, dass durch die formwechselnden Umwandlung die Erfüllung ihrer Forderung gefährdet wird."
    },
    {
      "date": "2025-09-26",
      "id": "131705",
      "original_text": "Löschungsankündigung\nHessen Amtsgericht Friedberg HRB 7087\nHandydealer 24 GmbH – Butzbach",
      "type": "Löschungsankündigung",
      "state": "Hessen",
      "amtsgericht": "Amtsgericht Friedberg",
      "registernummer": "HRB 7087",
      "registerart": "HRB",
      "company_name": "Handydealer 24 GmbH",
      "company_seat": "Butzbach",
      "details": "26.09.2025 (Bekanntmachungsdatum)\n\nHessen Amtsgericht Friedberg HRB 7087\nLöschungsankündigung\n\nHandydealer 24 GmbH\nGesellschaft mit beschränkter Haftung\nButzbach\n\nDas Registergericht beabsichtigt die im Handelsregister eingetragene Gesellschaft von Amts wegen nach § 394 FamFG zu löschen. Die Frist zur Erhebung eines Widerspruchs gegen die beabsichtigte Löschung wird auf 3 Monate festgesetzt."
    },
    {
      "date": "2025-09-26",
      "id": "131706",
      "original_text": "Löschungsankündigung\nHessen Amtsgericht Offenbach am Main HRB 51964\nIG Dienstleistungen UG (haftungsbeschränkt) – Mühlheim am Main",
      "type": "Löschungsankündigung",
      "state": "Hessen",
      "amtsgericht": "Amtsgericht Offenbach am Main",
      "registernummer": "HRB 51964",
      "registerart": "HRB",
      "company_name": "IG Dienstleistungen UG (haftungsbeschränkt)",
      "company_seat": "Mühlheim am Main",
      "details": "26.09.2025 (Bekanntmachungsdatum)\n\nHessen Amtsgericht Offenbach am Main HRB 51964\nLöschungsankündigung\n\nIG Dienstleistungen UG (haftungsbeschränkt)\nGesellschaft mit beschränkter Haftung\nMühlheim am Main\n\nDas Registergericht beabsichtigt die im Handelsregister eingetragene Gesellschaft von Amts wegen nach § 394 FamFG zu löschen. Die Frist zur Erhebung eines Widerspruchs gegen die beabsichtigte Löschung wird auf 3 Monate festgesetzt."
    },
    {
      "date": "2025-09-26",
      "id": "131707",
      "original_text": "Registerbekanntmachung nach dem Umwandlungsgesetz\nHessen Amtsgericht Hanau HRB 97233\nEV SR Immobilien GmbH – Hanau",
      "type": "Registerbekanntmachung nach dem Umwandlungsgesetz",
      "state": "Hessen",
      "amtsgericht": "Amtsgericht Hanau",
      "registernummer": "HRB 97233",
      "registerart": "HRB",
      "company_name": "EV SR Immobilien GmbH",
      "company_seat": "Hanau",
      "details": "26.09.2025 (Bekanntmachungsdatum)\n\nHessen Amtsgericht Hanau HRB 97233\nRegisterbekanntmachung nach dem Umwandlungsgesetz 26.09.2025 (Eintragungsdatum)\n\nEV SR Immobilien GmbH\nGesellschaft mit beschränkter Haftung\nHanau\n\nDen Gläubigern der an der Verschmelzung beteiligten Rechtsträger ist, wenn sie binnen sechs Monaten nach dem Tag, an dem die Eintragung der Verschmelzung in das Register des Sitzes desjenigen Rechtsträgers, dessen Gläubiger sie sind, nach § 19 Absatz 3 UmwG bekannt gemacht worden ist, ihren Anspruch nach Grund und Höhe schriftlich anmelden, Sicherheit zu leisten, soweit sie nicht Befriedigung verlangen können. Dieses Recht steht den Gläubigern jedoch nur zu, wenn sie glaubhaft machen, dass durch die Verschmelzung die Erfüllung ihrer Forderung gefährdet wird."
    },
    {
      "date": "2025-09-26",
      "id": "131708",
      "original_text": "Registerbekanntmachung nach dem Umwandlungsgesetz\nHessen Amtsgericht Frankfurt am Main HRB 114648\nHLU Coaching Akademie GmbH – Frankfurt am Main",
      "type": "Registerbekanntmachung nach dem Umwandlungsgesetz",
      "state": "Hessen",
      "amtsgericht": "Amtsgericht Frankfurt am Main",
      "registernummer": "HRB 114648",
      "registerart": "HRB",
      "company_name": "HLU Coaching Akademie GmbH",
      "company_seat": "Frankfurt am Main",
      "details": "26.09.2025 (Bekanntmachungsdatum)\n\nHessen Amtsgericht Frankfurt am Main HRB 114648\nRegisterbekanntmachung nach dem Umwandlungsgesetz 26.09.2025 (Eintragungsdatum)\n\nHLU Coaching Akademie GmbH\nGesellschaft mit beschränkter Haftung\nFrankfurt am Main\n\nDen Gläubigern der an der Verschmelzung beteiligten Rechtsträger ist, wenn sie binnen sechs Monaten nach dem Tag, an dem die Eintragung der Verschmelzung in das Register des Sitzes desjenigen Rechtsträgers, dessen Gläubiger sie sind, nach § 19 Absatz 3 UmwG bekannt gemacht worden ist, ihren Anspruch nach Grund und Höhe schriftlich anmelden, Sicherheit zu leisten, soweit sie nicht Befriedigung verlangen können. Dieses Recht steht den Gläubigern jedoch nur zu, wenn sie glaubhaft machen, dass durch die Verschmelzung die Erfüllung ihrer Forderung gefährdet wird."
    },
    {
      "date": "2025-09-26",
      "id": "131709",
      "original_text": "Einreichung neuer Dokumente\nHessen Amtsgericht Wiesbaden HRB 23690\nCONIATOS AG – Wiesbaden",
      "type": "Einreichung neuer Dokumente",
      "state": "Hessen",
      "amtsgericht": "Amtsgericht Wiesbaden",
      "registernummer": "HRB 23690",
      "registerart": "HRB",
      "company_name": "CONIATOS AG",
      "company_seat": "Wiesbaden",
      "details": "26.09.2025 (Bekanntmachungsdatum)\n\nHessen Amtsgericht Wiesbaden HRB 23690\nEinreichung neuer Dokumente 26.09.2025 (Eintragungsdatum)\n\nCONIATOS AG\nAktiengesellschaft\nWiesbaden\n\nDurch eine Änderung in den Personen der Aufsichtsratsmitglieder ist eine Liste der Mitglieder des Aufsichtsrates zum Handelsregister eingereicht worden."
    },
    {
      "date": "2025-09-26",
      "id": "131710",
      "original_text": "Registerbekanntmachung nach dem Umwandlungsgesetz\nHessen Amtsgericht Wiesbaden HRB 23690\nCONIATOS AG – Wiesbaden",
      "type": "Registerbekanntmachung nach dem Umwandlungsgesetz",
      "state": "Hessen",
      "amtsgericht": "Amtsgericht Wiesbaden",
      "registernummer": "HRB 23690",
      "registerart": "HRB",
      "company_name": "CONIATOS AG",
      "company_seat": "Wiesbaden",
      "details": "26.09.2025 (Bekanntmachungsdatum)\n\nHessen Amtsgericht Wiesbaden HRB 23690\nRegisterbekanntmachung nach dem Umwandlungsgesetz 26.09.2025 (Eintragungsdatum)\n\nCONIATOS AG\nAktiengesellschaft\nWiesbaden\n\nDen Gläubigern der an der formwechselnden Umwandlung beteiligten Rechtsträger ist, wenn sie binnen sechs Monaten nach dem Tag, an dem die Eintragung der formwechselnden Umwandlung in das Register des Sitzes desjenigen Rechtsträgers, dessen Gläubiger sie sind, nach § 201 UmwG bekannt gemacht worden ist, ihren Anspruch nach Grund und Höhe schriftlich anmelden, Sicherheit zu leisten, soweit sie nicht Befriedigung verlangen können. Dieses Recht steht den Gläubigern jedoch nur zu, wenn sie glaubhaft machen, dass durch die formwechselnden Umwandlung die Erfüllung ihrer Forderung gefährdet wird."
    },
    {
      "date": "2025-09-26",
      "id": "131711",
      "original_text": "Einreichung neuer Dokumente\nHessen Amtsgericht Frankfurt am Main HRB 82299\nFraCareServices GmbH – Frankfurt am Main",
      "type": "Einreichung neuer Dokumente",
      "state": "Hessen",
      "amtsgericht": "Amtsgericht Frankfurt am Main",
      "registernummer": "HRB 82299",
      "registerart": "HRB",
      "company_name": "FraCareServices GmbH",
      "company_seat": "Frankfurt am Main",
      "details": "26.09.2025 (Bekanntmachungsdatum)\n\nHessen Amtsgericht Frankfurt am Main HRB 82299\nEinreichung neuer Dokumente\n\nFraCareServices GmbH\nGesellschaft mit beschränkter Haftung\nFrankfurt am Main\n\nDurch eine Änderung in den Personen der Aufsichtsratsmitglieder ist eine Liste der Mitglieder des Aufsichtsrates zum Handelsregister eingereicht worden."
    },
    {
      "date": "2025-09-26",
      "id": "131712",
      "original_text": "Registerbekanntmachung nach dem Umwandlungsgesetz\nHessen Amtsgericht Frankfurt am Main HRB 79986\nSolactive Aktiengesellschaft – Frankfurt am Main",
      "type": "Registerbekanntmachung nach dem Umwandlungsgesetz",
      "state": "Hessen",
      "amtsgericht": "Amtsgericht Frankfurt am Main",
      "registernummer": "HRB 79986",
      "registerart": "HRB",
      "company_name": "Solactive Aktiengesellschaft",
      "company_seat": "Frankfurt am Main",
      "details": "26.09.2025 (Bekanntmachungsdatum)\n\nHessen Amtsgericht Frankfurt am Main HRB 79986\nRegisterbekanntmachung nach dem Umwandlungsgesetz 26.09.2025 (Eintragungsdatum)\n\nSolactive Aktiengesellschaft\nAktiengesellschaft\nFrankfurt am Main\n\nDen Gläubigern der an der Verschmelzung beteiligten Rechtsträger ist, wenn sie binnen sechs Monaten nach dem Tag, an dem die Eintragung der Verschmelzung in das Register des Sitzes desjenigen Rechtsträgers, dessen Gläubiger sie sind, nach § 19 Absatz 3 UmwG bekannt gemacht worden ist, ihren Anspruch nach Grund und Höhe schriftlich anmelden, Sicherheit zu leisten, soweit sie nicht Befriedigung verlangen können. Dieses Recht steht den Gläubigern jedoch nur zu, wenn sie glaubhaft machen, dass durch die Verschmelzung die Erfüllung ihrer Forderung gefährdet wird."
    },
    {
      "date": "2025-09-26",
      "id": "131713",
      "original_text": "Registerbekanntmachung nach dem Umwandlungsgesetz\nHessen Amtsgericht Frankfurt am Main HRB 133822\nNatural HoldCo GmbH – Frankfurt am Main",
      "type": "Registerbekanntmachung nach dem Umwandlungsgesetz",
      "state": "Hessen",
      "amtsgericht": "Amtsgericht Frankfurt am Main",
      "registernummer": "HRB 133822",
      "registerart": "HRB",
      "company_name": "Natural HoldCo GmbH",
      "company_seat": "Frankfurt am Main",
      "details": "26.09.2025 (Bekanntmachungsdatum)\n\nHessen Amtsgericht Frankfurt am Main HRB 133822\nRegisterbekanntmachung nach dem Umwandlungsgesetz 26.09.2025 (Eintragungsdatum)\n\nNatural HoldCo GmbH\nGesellschaft mit beschränkter Haftung\nFrankfurt am Main\n\nDen Gläubigern der an der formwechselnden Umwandlung beteiligten Rechtsträger ist, wenn sie binnen sechs Monaten nach dem Tag, an dem die Eintragung der formwechselnden Umwandlung in das Register des Sitzes desjenigen Rechtsträgers, dessen Gläubiger sie sind, nach § 201 UmwG bekannt gemacht worden ist, ihren Anspruch nach Grund und Höhe schriftlich anmelden, Sicherheit zu leisten, soweit sie nicht Befriedigung verlangen können. Dieses Recht steht den Gläubigern jedoch nur zu, wenn sie glaubhaft machen, dass durch die formwechselnden Umwandlung die Erfüllung ihrer Forderung gefährdet wird."
    },
    {
      "date": "2025-09-26",
      "id": "131714",
      "original_text": "Löschungsankündigung\nHessen Amtsgericht Frankfurt am Main HRB 123581\nYangZhi Handel GmbH – Frankfurt am Main",
      "type": "Löschungsankündigung",
      "state": "Hessen",
      "amtsgericht": "Amtsgericht Frankfurt am Main",
      "registernummer": "HRB 123581",
      "registerart": "HRB",
      "company_name": "YangZhi Handel GmbH",
      "company_seat": "Frankfurt am Main",
      "details": "26.09.2025 (Bekanntmachungsdatum)\n\nHessen Amtsgericht Frankfurt am Main HRB 123581\nLöschungsankündigung 26.09.2025 (Eintragungsdatum)\n\nYangZhi Handel GmbH\nGesellschaft mit beschränkter Haftung\nFrankfurt am Main\n\nDas Registergericht beabsichtigt die im Handelsregister eingetragene Gesellschaft von Amts wegen nach § 394 FamFG zu löschen. Die Frist zur Erhebung eines Widerspruchs gegen die beabsichtigte Löschung wird auf 1 Monat festgesetzt."
    },
    {
      "date": "2025-09-26",
      "id": "131715",
      "original_text": "Löschungsankündigung\nHessen Amtsgericht Wiesbaden HRB 27027\nCellDoc GmbH – Wiesbaden",
      "type": "Löschungsankündigung",
      "state": "Hessen",
      "amtsgericht": "Amtsgericht Wiesbaden",
      "registernummer": "HRB 27027",
      "registerart": "HRB",
      "company_name": "CellDoc GmbH",
      "company_seat": "Wiesbaden",
      "details": "26.09.2025 (Bekanntmachungsdatum)\n\nHessen Amtsgericht Wiesbaden HRB 27027\nLöschungsankündigung\n\nCellDoc GmbH\nGesellschaft mit beschränkter Haftung\nWiesbaden\n\nDas Registergericht beabsichtigt die im Handelsregister eingetragene Gesellschaft von Amts wegen nach § 394 FamFG zu löschen. Die Frist zur Erhebung eines Widerspruchs gegen die beabsichtigte Löschung wird auf 3 Monate festgesetzt."
    }
  ]
}