{
  "date": "2025-09-20",
  "date_of_scrape": "2025-10-27T12:15:49.228Z",
  "tool_version": "0.2.0",
  "number_of_announcements": 41,
  "announcements": [
    {
      "date": "2025-09-20",
      "id": "130625",
      "original_text": "Registerbekanntmachung nach dem Umwandlungsgesetz\nBayern Amtsgericht Memmingen HRA 14312\nSpeisemeisterei Burgthalschenke e.K. – Vöhringen",
      "type": "Registerbekanntmachung nach dem Umwandlungsgesetz",
      "state": "Bayern",
      "amtsgericht": "Amtsgericht Memmingen",
      "registernummer": "HRA 14312",
      "registerart": "HRA",
      "company_name": "Speisemeisterei Burgthalschenke e.K.",
      "company_seat": "Vöhringen",
      "details": "20.09.2025 (Bekanntmachungsdatum)\n\nBayern Amtsgericht Memmingen HRA 14312\nRegisterbekanntmachung nach dem Umwandlungsgesetz 19.09.2025 (Eintragungsdatum)\n\nSpeisemeisterei Burgthalschenke e.K.\nEinzelkaufmann / Einzelkauffrau\nVöhringen\n\nDen Gläubigern der an der Ausgliederung beteiligten Rechtsträger ist, wenn sie binnen sechs Monaten nach dem Tag, an dem die Eintragung der Ausgliederung in das Register des Sitzes desjenigen Rechtsträgers, dessen Gläubiger sie sind, nach §§ 125, 19 Abs. 3 UmwG als bekannt gemacht gilt, ihren Anspruch nach Grund und Höhe in Textform anmelden, Sicherheit zu leisten, soweit sie nicht Befriedigung verlangen können. Dieses Recht steht den Gläubigern jedoch nur zu, wenn sie glaubhaft machen, dass durch die Ausgliederung die Erfüllung ihrer Forderung gefährdet wird."
    },
    {
      "date": "2025-09-20",
      "id": "130626",
      "original_text": "Registerbekanntmachung nach dem Umwandlungsgesetz\nBayern Amtsgericht Weiden i. d. OPf. HRA 1551\nMühlmeier ENORM-FORM GmbH & Co. KG – Bärnau, Ortsteil Schwarzenbach",
      "type": "Registerbekanntmachung nach dem Umwandlungsgesetz",
      "state": "Bayern",
      "amtsgericht": "Amtsgericht Weiden i. d. OPf.",
      "registernummer": "HRA 1551",
      "registerart": "HRA",
      "company_name": "Mühlmeier ENORM-FORM GmbH & Co. KG",
      "company_seat": "Bärnau, Ortsteil Schwarzenbach",
      "details": "20.09.2025 (Bekanntmachungsdatum)\n\nBayern Amtsgericht Weiden i. d. OPf. HRA 1551\nRegisterbekanntmachung nach dem Umwandlungsgesetz 19.09.2025 (Eintragungsdatum)\n\nMühlmeier ENORM-FORM GmbH & Co. KG\nKommanditgesellschaft\nBärnau, Ortsteil Schwarzenbach\n\nDen Gläubigern der an der Verschmelzung beteiligten Rechtsträger ist, wenn sie binnen sechs Monaten nach dem Tag, an dem die Eintragung der Verschmelzung in das Register des Sitzes desjenigen Rechtsträgers, dessen Gläubiger sie sind, nach § 19 Abs. 3 UmwG als bekannt gemacht gilt, ihren Anspruch nach Grund und Höhe in Textform anmelden, Sicherheit zu leisten, soweit sie nicht Befriedigung verlangen können. Dieses Recht steht den Gläubigern jedoch nur zu, wenn sie glaubhaft machen, dass durch die Verschmelzung die Erfüllung ihrer Forderung gefährdet wird."
    },
    {
      "date": "2025-09-20",
      "id": "130627",
      "original_text": "Einreichung neuer Dokumente\nBayern Amtsgericht Kempten (Allgäu) HRB 1102\nKur- und Sporthotel Appartementhaus GmbH – Hindelang",
      "type": "Einreichung neuer Dokumente",
      "state": "Bayern",
      "amtsgericht": "Amtsgericht Kempten (Allgäu)",
      "registernummer": "HRB 1102",
      "registerart": "HRB",
      "company_name": "Kur- und Sporthotel Appartementhaus GmbH",
      "company_seat": "Hindelang",
      "details": "20.09.2025 (Bekanntmachungsdatum)\n\nBayern Amtsgericht Kempten (Allgäu) HRB 1102\nEinreichung neuer Dokumente 19.09.2025 (Eintragungsdatum)\n\nKur- und Sporthotel Appartementhaus GmbH\nGesellschaft mit beschränkter Haftung\nHindelang\n\nDem Amtsgericht Kempten (Allgäu) -Registergericht- ist eine Liste der Mitglieder des Aufsichtsrats eingereicht worden, § 52 Abs. 3 S. 2 GmbHG."
    },
    {
      "date": "2025-09-20",
      "id": "130628",
      "original_text": "Registerbekanntmachung nach dem Umwandlungsgesetz\nBayern Amtsgericht Würzburg HRB 12563\nMBT Brautechnik GmbH – Schwarzach a. Main",
      "type": "Registerbekanntmachung nach dem Umwandlungsgesetz",
      "state": "Bayern",
      "amtsgericht": "Amtsgericht Würzburg",
      "registernummer": "HRB 12563",
      "registerart": "HRB",
      "company_name": "MBT Brautechnik GmbH",
      "company_seat": "Schwarzach a. Main",
      "details": "20.09.2025 (Bekanntmachungsdatum)\n\nBayern Amtsgericht Würzburg HRB 12563\nRegisterbekanntmachung nach dem Umwandlungsgesetz 19.09.2025 (Eintragungsdatum)\n\nMBT Brautechnik GmbH\nGesellschaft mit beschränkter Haftung\nSchwarzach a. Main\n\nDen Gläubigern der an der Verschmelzung beteiligten Rechtsträger ist, wenn sie binnen sechs Monaten nach dem Tag, an dem die Eintragung der Verschmelzung in das Register des Sitzes desjenigen Rechtsträgers, dessen Gläubiger sie sind, nach § 19 Abs. 3 UmwG als bekannt gemacht gilt, ihren Anspruch nach Grund und Höhe in Textform anmelden, Sicherheit zu leisten, soweit sie nicht Befriedigung verlangen können. Dieses Recht steht den Gläubigern jedoch nur zu, wenn sie glaubhaft machen, dass durch die Verschmelzung die Erfüllung ihrer Forderung gefährdet wird."
    },
    {
      "date": "2025-09-20",
      "id": "130629",
      "original_text": "Registerbekanntmachung nach dem Umwandlungsgesetz\nBayern Amtsgericht Kempten (Allgäu) HRB 8198\nV-Markt Füssen Management GmbH – Mauerstetten",
      "type": "Registerbekanntmachung nach dem Umwandlungsgesetz",
      "state": "Bayern",
      "amtsgericht": "Amtsgericht Kempten (Allgäu)",
      "registernummer": "HRB 8198",
      "registerart": "HRB",
      "company_name": "V-Markt Füssen Management GmbH",
      "company_seat": "Mauerstetten",
      "details": "20.09.2025 (Bekanntmachungsdatum)\n\nBayern Amtsgericht Kempten (Allgäu) HRB 8198\nRegisterbekanntmachung nach dem Umwandlungsgesetz 19.09.2025 (Eintragungsdatum)\n\nV-Markt Füssen Management GmbH\nGesellschaft mit beschränkter Haftung\nMauerstetten\n\nDen Gläubigern der an der Verschmelzung beteiligten Rechtsträger ist, wenn sie binnen sechs Monaten nach dem Tag, an dem die Eintragung der Verschmelzung in das Register des Sitzes desjenigen Rechtsträgers, dessen Gläubiger sie sind, nach § 19 Abs. 3 UmwG als bekannt gemacht gilt, ihren Anspruch nach Grund und Höhe in Textform anmelden, Sicherheit zu leisten, soweit sie nicht Befriedigung verlangen können. Dieses Recht steht den Gläubigern jedoch nur zu, wenn sie glaubhaft machen, dass durch die Verschmelzung die Erfüllung ihrer Forderung gefährdet wird."
    },
    {
      "date": "2025-09-20",
      "id": "130630",
      "original_text": "Registerbekanntmachung nach dem Umwandlungsgesetz\nBayern Amtsgericht Nürnberg HRB 40419\nVIVABUS GmbH – Nürnberg",
      "type": "Registerbekanntmachung nach dem Umwandlungsgesetz",
      "state": "Bayern",
      "amtsgericht": "Amtsgericht Nürnberg",
      "registernummer": "HRB 40419",
      "registerart": "HRB",
      "company_name": "VIVABUS GmbH",
      "company_seat": "Nürnberg",
      "details": "20.09.2025 (Bekanntmachungsdatum)\n\nBayern Amtsgericht Nürnberg HRB 40419\nRegisterbekanntmachung nach dem Umwandlungsgesetz 19.09.2025 (Eintragungsdatum)\n\nVIVABUS GmbH\nGesellschaft mit beschränkter Haftung\nNürnberg\n\nDen Gläubigern der an der Verschmelzung beteiligten Rechtsträger ist, wenn sie binnen sechs Monaten nach dem Tag, an dem die Eintragung der Verschmelzung in das Register des Sitzes desjenigen Rechtsträgers, dessen Gläubiger sie sind, nach § 19 Abs. 3 UmwG als bekannt gemacht gilt, ihren Anspruch nach Grund und Höhe in Textform anmelden, Sicherheit zu leisten, soweit sie nicht Befriedigung verlangen können. Dieses Recht steht den Gläubigern jedoch nur zu, wenn sie glaubhaft machen, dass durch die Verschmelzung die Erfüllung ihrer Forderung gefährdet wird."
    },
    {
      "date": "2025-09-20",
      "id": "130631",
      "original_text": "Sonstige Registerbekanntmachung\nBayern Amtsgericht Bayreuth HRB 2943\nC.P.A. Dr. Dück Management GmbH – Kulmbach",
      "type": "Sonstige Registerbekanntmachung",
      "state": "Bayern",
      "amtsgericht": "Amtsgericht Bayreuth",
      "registernummer": "HRB 2943",
      "registerart": "HRB",
      "company_name": "C.P.A. Dr. Dück Management GmbH",
      "company_seat": "Kulmbach",
      "details": "20.09.2025 (Bekanntmachungsdatum)\n\nBayern Amtsgericht Bayreuth HRB 2943\nSonstige Registerbekanntmachung 19.09.2025 (Eintragungsdatum)\n\nC.P.A. Dr. Dück Management GmbH\nGesellschaft mit beschränkter Haftung\nKulmbach\n\nDen Gläubigern der an der Verschmelzung beteiligten Rechtsträger ist, wenn sie binnen sechs Monaten nach dem Tag, an dem die Eintragung der Verschmelzung in das Register des Sitzes desjenigen Rechtsträgers, dessen Gläubiger sie sind, nach § 19 Abs. 3 UmwG als bekannt gemacht gilt, ihren Anspruch nach Grund und Höhe in Textform anmelden, Sicherheit zu leisten, soweit sie nicht Befriedigung verlangen können. Dieses Recht steht den Gläubigern jedoch nur zu, wenn sie glaubhaft machen, dass durch die Verschmelzung die Erfüllung ihrer Forderung gefährdet wird."
    },
    {
      "date": "2025-09-20",
      "id": "130632",
      "original_text": "Registerbekanntmachung nach dem Umwandlungsgesetz\nBayern Amtsgericht München HRA 116594\n\"Oliva\" Marienplatz Ali Alkan e.K. – München",
      "type": "Registerbekanntmachung nach dem Umwandlungsgesetz",
      "state": "Bayern",
      "amtsgericht": "Amtsgericht München",
      "registernummer": "HRA 116594",
      "registerart": "HRA",
      "company_name": "\"Oliva\" Marienplatz Ali Alkan e.K.",
      "company_seat": "München",
      "details": "20.09.2025 (Bekanntmachungsdatum)\n\nBayern Amtsgericht München HRA 116594\nRegisterbekanntmachung nach dem Umwandlungsgesetz 19.09.2025 (Eintragungsdatum)\n\n\"Oliva\" Marienplatz Ali Alkan e.K.\nEinzelkaufmann / Einzelkauffrau\nMünchen\n\nDen Gläubigern der an der Ausgliederung beteiligten Rechtsträger ist, wenn sie binnen sechs Monaten nach dem Tag, an dem die Eintragung der Ausgliederung in das Register des Sitzes desjenigen Rechtsträgers, dessen Gläubiger sie sind, nach §§ 125, 19 Abs. 3 UmwG als bekannt gemacht gilt, ihren Anspruch nach Grund und Höhe in Textform anmelden, Sicherheit zu leisten, soweit sie nicht Befriedigung verlangen können. Dieses Recht steht den Gläubigern jedoch nur zu, wenn sie glaubhaft machen, dass durch die Ausgliederung die Erfüllung ihrer Forderung gefährdet wird."
    },
    {
      "date": "2025-09-20",
      "id": "130633",
      "original_text": "Registerbekanntmachung nach dem Umwandlungsgesetz\nBayern Amtsgericht München HRA 116593\n\"Oliva\" Rotkreuzplatz Ali Alkan e.K. – München",
      "type": "Registerbekanntmachung nach dem Umwandlungsgesetz",
      "state": "Bayern",
      "amtsgericht": "Amtsgericht München",
      "registernummer": "HRA 116593",
      "registerart": "HRA",
      "company_name": "\"Oliva\" Rotkreuzplatz Ali Alkan e.K.",
      "company_seat": "München",
      "details": "20.09.2025 (Bekanntmachungsdatum)\n\nBayern Amtsgericht München HRA 116593\nRegisterbekanntmachung nach dem Umwandlungsgesetz 19.09.2025 (Eintragungsdatum)\n\n\"Oliva\" Rotkreuzplatz Ali Alkan e.K.\nEinzelkaufmann / Einzelkauffrau\nMünchen\n\nDen Gläubigern der an der Ausgliederung beteiligten Rechtsträger ist, wenn sie binnen sechs Monaten nach dem Tag, an dem die Eintragung der Ausgliederung in das Register des Sitzes desjenigen Rechtsträgers, dessen Gläubiger sie sind, nach §§ 125, 19 Abs. 3 UmwG als bekannt gemacht gilt, ihren Anspruch nach Grund und Höhe in Textform anmelden, Sicherheit zu leisten, soweit sie nicht Befriedigung verlangen können. Dieses Recht steht den Gläubigern jedoch nur zu, wenn sie glaubhaft machen, dass durch die Ausgliederung die Erfüllung ihrer Forderung gefährdet wird."
    },
    {
      "date": "2025-09-20",
      "id": "130634",
      "original_text": "Einreichung neuer Dokumente\nBayern Amtsgericht München HRB 131804\nBrainloop AG – München",
      "type": "Einreichung neuer Dokumente",
      "state": "Bayern",
      "amtsgericht": "Amtsgericht München",
      "registernummer": "HRB 131804",
      "registerart": "HRB",
      "company_name": "Brainloop AG",
      "company_seat": "München",
      "details": "20.09.2025 (Bekanntmachungsdatum)\n\nBayern Amtsgericht München HRB 131804\nEinreichung neuer Dokumente 19.09.2025 (Eintragungsdatum)\n\nBrainloop AG\nAktiengesellschaft\nMünchen\n\nDem Amtsgericht München -Registergericht- ist eine Liste der Mitglieder des Aufsichtsrats eingereicht worden, § 106 AktG."
    },
    {
      "date": "2025-09-20",
      "id": "130635",
      "original_text": "Registerbekanntmachung nach dem Umwandlungsgesetz\nBayern Amtsgericht Nürnberg HRB 40422\nVIVA Reisen GmbH – Nürnberg",
      "type": "Registerbekanntmachung nach dem Umwandlungsgesetz",
      "state": "Bayern",
      "amtsgericht": "Amtsgericht Nürnberg",
      "registernummer": "HRB 40422",
      "registerart": "HRB",
      "company_name": "VIVA Reisen GmbH",
      "company_seat": "Nürnberg",
      "details": "20.09.2025 (Bekanntmachungsdatum)\n\nBayern Amtsgericht Nürnberg HRB 40422\nRegisterbekanntmachung nach dem Umwandlungsgesetz 19.09.2025 (Eintragungsdatum)\n\nVIVA Reisen GmbH\nGesellschaft mit beschränkter Haftung\nNürnberg\n\nDen Gläubigern der an der Verschmelzung beteiligten Rechtsträger ist, wenn sie binnen sechs Monaten nach dem Tag, an dem die Eintragung der Verschmelzung in das Register des Sitzes desjenigen Rechtsträgers, dessen Gläubiger sie sind, nach § 19 Abs. 3 UmwG als bekannt gemacht gilt, ihren Anspruch nach Grund und Höhe in Textform anmelden, Sicherheit zu leisten, soweit sie nicht Befriedigung verlangen können. Dieses Recht steht den Gläubigern jedoch nur zu, wenn sie glaubhaft machen, dass durch die Verschmelzung die Erfüllung ihrer Forderung gefährdet wird."
    },
    {
      "date": "2025-09-20",
      "id": "130636",
      "original_text": "Einreichung neuer Dokumente\nBayern Amtsgericht München HRB 115761\nMedigene AG – Planegg, Ortsteil Martinsried",
      "type": "Einreichung neuer Dokumente",
      "state": "Bayern",
      "amtsgericht": "Amtsgericht München",
      "registernummer": "HRB 115761",
      "registerart": "HRB",
      "company_name": "Medigene AG",
      "company_seat": "Planegg, Ortsteil Martinsried",
      "details": "20.09.2025 (Bekanntmachungsdatum)\n\nBayern Amtsgericht München HRB 115761\nEinreichung neuer Dokumente 19.09.2025 (Eintragungsdatum)\n\nMedigene AG\nAktiengesellschaft\nPlanegg, Ortsteil Martinsried\n\nDem Amtsgericht München -Registergericht- ist eine Liste der Mitglieder des Aufsichtsrats eingereicht worden, § 106 AktG."
    },
    {
      "date": "2025-09-20",
      "id": "130637",
      "original_text": "Registerbekanntmachung nach dem Umwandlungsgesetz\nBayern Amtsgericht München HRB 290434\nPrinz von Hessen Gastro GmbH – München",
      "type": "Registerbekanntmachung nach dem Umwandlungsgesetz",
      "state": "Bayern",
      "amtsgericht": "Amtsgericht München",
      "registernummer": "HRB 290434",
      "registerart": "HRB",
      "company_name": "Prinz von Hessen Gastro GmbH",
      "company_seat": "München",
      "details": "20.09.2025 (Bekanntmachungsdatum)\n\nBayern Amtsgericht München HRB 290434\nRegisterbekanntmachung nach dem Umwandlungsgesetz 19.09.2025 (Eintragungsdatum)\n\nPrinz von Hessen Gastro GmbH\nGesellschaft mit beschränkter Haftung\nMünchen\n\nDen Gläubigern des formwechselnden Rechtsträgers ist, wenn sie binnen sechs Monaten nach dem Tag, an dem die Eintragung des Formwechsels nach § 201 UmwG als bekannt gemacht gilt, ihren Anspruch nach Grund und Höhe in Textform anmelden, Sicherheit zu leisten, soweit sie nicht Befriedigung verlangen können. Dieses Recht steht den Gläubigern jedoch nur zu, wenn sie glaubhaft machen, dass durch den Formwechsel die Erfüllung ihrer Forderung gefährdet wird."
    },
    {
      "date": "2025-09-20",
      "id": "130638",
      "original_text": "Registerbekanntmachung nach dem Umwandlungsgesetz\nBayern Amtsgericht Memmingen HRA 14300\nFernwärme Memmingen GmbH & Co. KG – Memmingen",
      "type": "Registerbekanntmachung nach dem Umwandlungsgesetz",
      "state": "Bayern",
      "amtsgericht": "Amtsgericht Memmingen",
      "registernummer": "HRA 14300",
      "registerart": "HRA",
      "company_name": "Fernwärme Memmingen GmbH & Co. KG",
      "company_seat": "Memmingen",
      "details": "20.09.2025 (Bekanntmachungsdatum)\n\nBayern Amtsgericht Memmingen HRA 14300\nRegisterbekanntmachung nach dem Umwandlungsgesetz 19.09.2025 (Eintragungsdatum)\n\nFernwärme Memmingen GmbH & Co. KG\nKommanditgesellschaft\nMemmingen\n\nDen Gläubigern der an der Ausgliederung beteiligten Rechtsträger ist, wenn sie binnen sechs Monaten nach dem Tag, an dem die Eintragung der Ausgliederung in das Register des Sitzes desjenigen Rechtsträgers, dessen Gläubiger sie sind, nach §§ 125, 19 Abs. 3 UmwG als bekannt gemacht gilt, ihren Anspruch nach Grund und Höhe in Textform anmelden, Sicherheit zu leisten, soweit sie nicht Befriedigung verlangen können. Dieses Recht steht den Gläubigern jedoch nur zu, wenn sie glaubhaft machen, dass durch die Ausgliederung die Erfüllung ihrer Forderung gefährdet wird."
    },
    {
      "date": "2025-09-20",
      "id": "130639",
      "original_text": "Löschungsankündigung\nBayern Amtsgericht Memmingen HRB 2126\nAna Begus GmbH – Landensberg",
      "type": "Löschungsankündigung",
      "state": "Bayern",
      "amtsgericht": "Amtsgericht Memmingen",
      "registernummer": "HRB 2126",
      "registerart": "HRB",
      "company_name": "Ana Begus GmbH",
      "company_seat": "Landensberg",
      "details": "20.09.2025 (Bekanntmachungsdatum)\n\nBayern Amtsgericht Memmingen HRB 2126\nLöschungsankündigung\n\nAna Begus GmbH\nGesellschaft mit beschränkter Haftung\nLandensberg\n\nDas Registergericht beabsichtigt, die im Handelsregister eingetragene Gesellschaft wegen Vermögenslosigkeit von Amts wegen nach § 394 FamFG zu löschen. Die Frist zur Erhebung eines Widerspruchs ist auf einen Monat festgesetzt."
    },
    {
      "date": "2025-09-20",
      "id": "130640",
      "original_text": "Registerbekanntmachung nach dem Umwandlungsgesetz\nBayern Amtsgericht Kempten (Allgäu) HRB 8199\nV-Markt Schongau Management GmbH – Mauerstetten",
      "type": "Registerbekanntmachung nach dem Umwandlungsgesetz",
      "state": "Bayern",
      "amtsgericht": "Amtsgericht Kempten (Allgäu)",
      "registernummer": "HRB 8199",
      "registerart": "HRB",
      "company_name": "V-Markt Schongau Management GmbH",
      "company_seat": "Mauerstetten",
      "details": "20.09.2025 (Bekanntmachungsdatum)\n\nBayern Amtsgericht Kempten (Allgäu) HRB 8199\nRegisterbekanntmachung nach dem Umwandlungsgesetz 19.09.2025 (Eintragungsdatum)\n\nV-Markt Schongau Management GmbH\nGesellschaft mit beschränkter Haftung\nMauerstetten\n\nDen Gläubigern der an der Verschmelzung beteiligten Rechtsträger ist, wenn sie binnen sechs Monaten nach dem Tag, an dem die Eintragung der Verschmelzung in das Register des Sitzes desjenigen Rechtsträgers, dessen Gläubiger sie sind, nach § 19 Abs. 3 UmwG als bekannt gemacht gilt, ihren Anspruch nach Grund und Höhe in Textform anmelden, Sicherheit zu leisten, soweit sie nicht Befriedigung verlangen können. Dieses Recht steht den Gläubigern jedoch nur zu, wenn sie glaubhaft machen, dass durch die Verschmelzung die Erfüllung ihrer Forderung gefährdet wird."
    },
    {
      "date": "2025-09-20",
      "id": "130641",
      "original_text": "Registerbekanntmachung nach dem Umwandlungsgesetz\nBayern Amtsgericht München HRA 115484\n\"Oliva\" Münchner Freiheit Ali Alkan e.K. – Neufahrn b.Freising",
      "type": "Registerbekanntmachung nach dem Umwandlungsgesetz",
      "state": "Bayern",
      "amtsgericht": "Amtsgericht München",
      "registernummer": "HRA 115484",
      "registerart": "HRA",
      "company_name": "\"Oliva\" Münchner Freiheit Ali Alkan e.K.",
      "company_seat": "Neufahrn b.Freising",
      "details": "20.09.2025 (Bekanntmachungsdatum)\n\nBayern Amtsgericht München HRA 115484\nRegisterbekanntmachung nach dem Umwandlungsgesetz 19.09.2025 (Eintragungsdatum)\n\n\"Oliva\" Münchner Freiheit Ali Alkan e.K.\nEinzelkaufmann / Einzelkauffrau\nNeufahrn b.Freising\n\nDen Gläubigern der an der Ausgliederung beteiligten Rechtsträger ist, wenn sie binnen sechs Monaten nach dem Tag, an dem die Eintragung der Ausgliederung in das Register des Sitzes desjenigen Rechtsträgers, dessen Gläubiger sie sind, nach §§ 125, 19 Abs. 3 UmwG als bekannt gemacht gilt, ihren Anspruch nach Grund und Höhe in Textform anmelden, Sicherheit zu leisten, soweit sie nicht Befriedigung verlangen können. Dieses Recht steht den Gläubigern jedoch nur zu, wenn sie glaubhaft machen, dass durch die Ausgliederung die Erfüllung ihrer Forderung gefährdet wird."
    },
    {
      "date": "2025-09-20",
      "id": "130642",
      "original_text": "Registerbekanntmachung nach dem Umwandlungsgesetz\nBayern Amtsgericht München HRA 116592\n\"Oliva\" Hauptbahnhof Ali Alkan e.K. – München",
      "type": "Registerbekanntmachung nach dem Umwandlungsgesetz",
      "state": "Bayern",
      "amtsgericht": "Amtsgericht München",
      "registernummer": "HRA 116592",
      "registerart": "HRA",
      "company_name": "\"Oliva\" Hauptbahnhof Ali Alkan e.K.",
      "company_seat": "München",
      "details": "20.09.2025 (Bekanntmachungsdatum)\n\nBayern Amtsgericht München HRA 116592\nRegisterbekanntmachung nach dem Umwandlungsgesetz 19.09.2025 (Eintragungsdatum)\n\n\"Oliva\" Hauptbahnhof Ali Alkan e.K.\nEinzelkaufmann / Einzelkauffrau\nMünchen\n\nDen Gläubigern der an der Ausgliederung beteiligten Rechtsträger ist, wenn sie binnen sechs Monaten nach dem Tag, an dem die Eintragung der Ausgliederung in das Register des Sitzes desjenigen Rechtsträgers, dessen Gläubiger sie sind, nach §§ 125, 19 Abs. 3 UmwG als bekannt gemacht gilt, ihren Anspruch nach Grund und Höhe in Textform anmelden, Sicherheit zu leisten, soweit sie nicht Befriedigung verlangen können. Dieses Recht steht den Gläubigern jedoch nur zu, wenn sie glaubhaft machen, dass durch die Ausgliederung die Erfüllung ihrer Forderung gefährdet wird."
    },
    {
      "date": "2025-09-20",
      "id": "130643",
      "original_text": "Registerbekanntmachung nach dem Umwandlungsgesetz\nBayern Amtsgericht München HRB 118229\nSHS VIVEON AG – München",
      "type": "Registerbekanntmachung nach dem Umwandlungsgesetz",
      "state": "Bayern",
      "amtsgericht": "Amtsgericht München",
      "registernummer": "HRB 118229",
      "registerart": "HRB",
      "company_name": "SHS VIVEON AG",
      "company_seat": "München",
      "details": "20.09.2025 (Bekanntmachungsdatum)\n\nBayern Amtsgericht München HRB 118229\nRegisterbekanntmachung nach dem Umwandlungsgesetz 19.09.2025 (Eintragungsdatum)\n\nSHS VIVEON AG\nAktiengesellschaft\nMünchen\n\nDen Gläubigern der an der Verschmelzung beteiligten Rechtsträger ist, wenn sie binnen sechs Monaten nach dem Tag, an dem die Eintragung der Verschmelzung in das Register des Sitzes desjenigen Rechtsträgers, dessen Gläubiger sie sind, nach § 19 Abs. 3 UmwG als bekannt gemacht gilt, ihren Anspruch nach Grund und Höhe in Textform anmelden, Sicherheit zu leisten, soweit sie nicht Befriedigung verlangen können. Dieses Recht steht den Gläubigern jedoch nur zu, wenn sie glaubhaft machen, dass durch die Verschmelzung die Erfüllung ihrer Forderung gefährdet wird."
    },
    {
      "date": "2025-09-20",
      "id": "130644",
      "original_text": "Sonstige Registerbekanntmachung\nBayern Amtsgericht München HRB 79508\nSportScheck GmbH – München",
      "type": "Sonstige Registerbekanntmachung",
      "state": "Bayern",
      "amtsgericht": "Amtsgericht München",
      "registernummer": "HRB 79508",
      "registerart": "HRB",
      "company_name": "SportScheck GmbH",
      "company_seat": "München",
      "details": "20.09.2025 (Bekanntmachungsdatum)\n\nBayern Amtsgericht München HRB 79508\nSonstige Registerbekanntmachung 19.09.2025 (Eintragungsdatum)\n\nSportScheck GmbH\nGesellschaft mit beschränkter Haftung\nMünchen\n\nDem Amtsgericht München -Registergericht- ist eine Liste der Mitglieder des Aufsichtsrats eingereicht worden, § 52 Abs. 3 S. 2 GmbHG."
    },
    {
      "date": "2025-09-20",
      "id": "130645",
      "original_text": "Löschungsankündigung\nBayern Amtsgericht Memmingen HRB 18229\nCartential GmbH – Ziemetshausen",
      "type": "Löschungsankündigung",
      "state": "Bayern",
      "amtsgericht": "Amtsgericht Memmingen",
      "registernummer": "HRB 18229",
      "registerart": "HRB",
      "company_name": "Cartential GmbH",
      "company_seat": "Ziemetshausen",
      "details": "20.09.2025 (Bekanntmachungsdatum)\n\nBayern Amtsgericht Memmingen HRB 18229\nLöschungsankündigung\n\nCartential GmbH\nGesellschaft mit beschränkter Haftung\nZiemetshausen\n\nDas Registergericht beabsichtigt, die im Handelsregister eingetragene Gesellschaft wegen Vermögenslosigkeit von Amts wegen nach § 394 FamFG zu löschen. Die Frist zur Erhebung eines Widerspruchs ist auf einen Monat festgesetzt."
    },
    {
      "date": "2025-09-20",
      "id": "130646",
      "original_text": "Registerbekanntmachung nach dem Umwandlungsgesetz\nBayern Amtsgericht Amberg HRB 6751\nSAS Group GmbH – Amberg",
      "type": "Registerbekanntmachung nach dem Umwandlungsgesetz",
      "state": "Bayern",
      "amtsgericht": "Amtsgericht Amberg",
      "registernummer": "HRB 6751",
      "registerart": "HRB",
      "company_name": "SAS Group GmbH",
      "company_seat": "Amberg",
      "details": "20.09.2025 (Bekanntmachungsdatum)\n\nBayern Amtsgericht Amberg HRB 6751\nRegisterbekanntmachung nach dem Umwandlungsgesetz 19.09.2025 (Eintragungsdatum)\n\nSAS Group GmbH\nGesellschaft mit beschränkter Haftung\nAmberg\n\nDen Gläubigern der an der Verschmelzung beteiligten Rechtsträger ist, wenn sie binnen sechs Monaten nach dem Tag, an dem die Eintragung der Verschmelzung in das Register des Sitzes desjenigen Rechtsträgers, dessen Gläubiger sie sind, nach § 19 Abs. 3 UmwG als bekannt gemacht gilt, ihren Anspruch nach Grund und Höhe in Textform anmelden, Sicherheit zu leisten, soweit sie nicht Befriedigung verlangen können. Dieses Recht steht den Gläubigern jedoch nur zu, wenn sie glaubhaft machen, dass durch die Verschmelzung die Erfüllung ihrer Forderung gefährdet wird."
    },
    {
      "date": "2025-09-20",
      "id": "130647",
      "original_text": "Registerbekanntmachung nach dem Umwandlungsgesetz\nBayern Amtsgericht Memmingen HRB 12774\nE-CON AG – Memmingen",
      "type": "Registerbekanntmachung nach dem Umwandlungsgesetz",
      "state": "Bayern",
      "amtsgericht": "Amtsgericht Memmingen",
      "registernummer": "HRB 12774",
      "registerart": "HRB",
      "company_name": "E-CON AG",
      "company_seat": "Memmingen",
      "details": "20.09.2025 (Bekanntmachungsdatum)\n\nBayern Amtsgericht Memmingen HRB 12774\nRegisterbekanntmachung nach dem Umwandlungsgesetz 19.09.2025 (Eintragungsdatum)\n\nE-CON AG\nAktiengesellschaft\nMemmingen\n\nDen Gläubigern der an der Ausgliederung beteiligten Rechtsträger ist, wenn sie binnen sechs Monaten nach dem Tag, an dem die Eintragung der Ausgliederung in das Register des Sitzes desjenigen Rechtsträgers, dessen Gläubiger sie sind, nach §§ 125, 19 Abs. 3 UmwG als bekannt gemacht gilt, ihren Anspruch nach Grund und Höhe in Textform anmelden, Sicherheit zu leisten, soweit sie nicht Befriedigung verlangen können. Dieses Recht steht den Gläubigern jedoch nur zu, wenn sie glaubhaft machen, dass durch die Ausgliederung die Erfüllung ihrer Forderung gefährdet wird."
    },
    {
      "date": "2025-09-20",
      "id": "130648",
      "original_text": "Löschungsankündigung\nBayern Amtsgericht Memmingen HRB 16016\nSchwartner & Co. GmbH – Memmingen",
      "type": "Löschungsankündigung",
      "state": "Bayern",
      "amtsgericht": "Amtsgericht Memmingen",
      "registernummer": "HRB 16016",
      "registerart": "HRB",
      "company_name": "Schwartner & Co. GmbH",
      "company_seat": "Memmingen",
      "details": "20.09.2025 (Bekanntmachungsdatum)\n\nBayern Amtsgericht Memmingen HRB 16016\nLöschungsankündigung\n\nSchwartner & Co. GmbH\nGesellschaft mit beschränkter Haftung\nMemmingen\n\nDas Registergericht beabsichtigt, die im Handelsregister eingetragene Gesellschaft wegen Vermögenslosigkeit von Amts wegen nach § 394 FamFG zu löschen. Die Frist zur Erhebung eines Widerspruchs ist auf einen Monat festgesetzt."
    },
    {
      "date": "2025-09-20",
      "id": "130649",
      "original_text": "Registerbekanntmachung nach dem Umwandlungsgesetz\nBayern Amtsgericht München HRA 121642\nXSOL e.K. – Germering",
      "type": "Registerbekanntmachung nach dem Umwandlungsgesetz",
      "state": "Bayern",
      "amtsgericht": "Amtsgericht München",
      "registernummer": "HRA 121642",
      "registerart": "HRA",
      "company_name": "XSOL e.K.",
      "company_seat": "Germering",
      "details": "20.09.2025 (Bekanntmachungsdatum)\n\nBayern Amtsgericht München HRA 121642\nRegisterbekanntmachung nach dem Umwandlungsgesetz 19.09.2025 (Eintragungsdatum)\n\nXSOL e.K.\nEinzelkaufmann / Einzelkauffrau\nGermering\n\nDen Gläubigern der an der Verschmelzung beteiligten Rechtsträger ist, wenn sie binnen sechs Monaten nach dem Tag, an dem die Eintragung der Verschmelzung in das Register des Sitzes desjenigen Rechtsträgers, dessen Gläubiger sie sind, nach § 19 Abs. 3 UmwG als bekannt gemacht gilt, ihren Anspruch nach Grund und Höhe in Textform anmelden, Sicherheit zu leisten, soweit sie nicht Befriedigung verlangen können. Dieses Recht steht den Gläubigern jedoch nur zu, wenn sie glaubhaft machen, dass durch die Verschmelzung die Erfüllung ihrer Forderung gefährdet wird."
    },
    {
      "date": "2025-09-20",
      "id": "130650",
      "original_text": "Löschungsankündigung\nBayern Amtsgericht Coburg HRB 2941\nK + W Krauss & Weinbeer Möbel GmbH – Lichtenfels",
      "type": "Löschungsankündigung",
      "state": "Bayern",
      "amtsgericht": "Amtsgericht Coburg",
      "registernummer": "HRB 2941",
      "registerart": "HRB",
      "company_name": "K + W Krauss & Weinbeer Möbel GmbH",
      "company_seat": "Lichtenfels",
      "details": "20.09.2025 (Bekanntmachungsdatum)\n\nBayern Amtsgericht Coburg HRB 2941\nLöschungsankündigung 09.09.2025 (Eintragungsdatum)\n\nK + W Krauss & Weinbeer Möbel GmbH\nGesellschaft mit beschränkter Haftung\nLichtenfels\n\nDas Registergericht beabsichtigt, die im Handelsregister eingetragene Gesellschaft wegen Vermögenslosigkeit von Amts wegen nach § 394 FamFG zu löschen. Die Frist zur Erhebung eines Widerspruchs ist auf sechs Wochen festgesetzt."
    },
    {
      "date": "2025-09-20",
      "id": "130651",
      "original_text": "Registerbekanntmachung nach dem Umwandlungsgesetz\nBayern Amtsgericht Würzburg GsR 424\nLaMa Consulting eGbR – Marktbreit",
      "type": "Registerbekanntmachung nach dem Umwandlungsgesetz",
      "state": "Bayern",
      "amtsgericht": "Amtsgericht Würzburg",
      "registernummer": "GsR 424",
      "registerart": "GsR",
      "company_name": "LaMa Consulting eGbR",
      "company_seat": "Marktbreit",
      "details": "20.09.2025 (Bekanntmachungsdatum)\n\nBayern Amtsgericht Würzburg GsR 424\nRegisterbekanntmachung nach dem Umwandlungsgesetz 19.09.2025 (Eintragungsdatum)\n\nLaMa Consulting eGbR\nGesellschaft bürgerlichen Rechts\nMarktbreit\n\nDen Gläubigern des formwechselnden Rechtsträgers ist, wenn sie binnen sechs Monaten nach dem Tag, an dem die Eintragung des Formwechsels nach § 201 UmwG als bekannt gemacht gilt, ihren Anspruch nach Grund und Höhe in Textform anmelden, Sicherheit zu leisten, soweit sie nicht Befriedigung verlangen können. Dieses Recht steht den Gläubigern jedoch nur zu, wenn sie glaubhaft machen, dass durch den Formwechsel die Erfüllung ihrer Forderung gefährdet wird."
    },
    {
      "date": "2025-09-20",
      "id": "130652",
      "original_text": "Registerbekanntmachung nach dem Umwandlungsgesetz\nBayern Amtsgericht Nürnberg HRB 40405\nVIVA Reisen & Logistik GmbH – Nürnberg",
      "type": "Registerbekanntmachung nach dem Umwandlungsgesetz",
      "state": "Bayern",
      "amtsgericht": "Amtsgericht Nürnberg",
      "registernummer": "HRB 40405",
      "registerart": "HRB",
      "company_name": "VIVA Reisen & Logistik GmbH",
      "company_seat": "Nürnberg",
      "details": "20.09.2025 (Bekanntmachungsdatum)\n\nBayern Amtsgericht Nürnberg HRB 40405\nRegisterbekanntmachung nach dem Umwandlungsgesetz 19.09.2025 (Eintragungsdatum)\n\nVIVA Reisen & Logistik GmbH\nGesellschaft mit beschränkter Haftung\nNürnberg\n\nDen Gläubigern der an der Verschmelzung beteiligten Rechtsträger ist, wenn sie binnen sechs Monaten nach dem Tag, an dem die Eintragung der Verschmelzung in das Register des Sitzes desjenigen Rechtsträgers, dessen Gläubiger sie sind, nach § 19 Abs. 3 UmwG als bekannt gemacht gilt, ihren Anspruch nach Grund und Höhe in Textform anmelden, Sicherheit zu leisten, soweit sie nicht Befriedigung verlangen können. Dieses Recht steht den Gläubigern jedoch nur zu, wenn sie glaubhaft machen, dass durch die Verschmelzung die Erfüllung ihrer Forderung gefährdet wird."
    },
    {
      "date": "2025-09-20",
      "id": "130653",
      "original_text": "Registerbekanntmachung nach dem Umwandlungsgesetz\nBayern Amtsgericht München HRB 46591\nLHI Leasing GmbH – Pullach i. Isartal",
      "type": "Registerbekanntmachung nach dem Umwandlungsgesetz",
      "state": "Bayern",
      "amtsgericht": "Amtsgericht München",
      "registernummer": "HRB 46591",
      "registerart": "HRB",
      "company_name": "LHI Leasing GmbH",
      "company_seat": "Pullach i. Isartal",
      "details": "20.09.2025 (Bekanntmachungsdatum)\n\nBayern Amtsgericht München HRB 46591\nRegisterbekanntmachung nach dem Umwandlungsgesetz 19.09.2025 (Eintragungsdatum)\n\nLHI Leasing GmbH\nGesellschaft mit beschränkter Haftung\nPullach i. Isartal\n\nDen Gläubigern der an der Verschmelzung beteiligten Rechtsträger ist, wenn sie binnen sechs Monaten nach dem Tag, an dem die Eintragung der Verschmelzung in das Register des Sitzes desjenigen Rechtsträgers, dessen Gläubiger sie sind, nach § 19 Abs. 3 UmwG als bekannt gemacht gilt, ihren Anspruch nach Grund und Höhe in Textform anmelden, Sicherheit zu leisten, soweit sie nicht Befriedigung verlangen können. Dieses Recht steht den Gläubigern jedoch nur zu, wenn sie glaubhaft machen, dass durch die Verschmelzung die Erfüllung ihrer Forderung gefährdet wird."
    },
    {
      "date": "2025-09-20",
      "id": "130654",
      "original_text": "Registerbekanntmachung nach dem Umwandlungsgesetz\nBayern Amtsgericht Nürnberg HRB 26245\nNÜRNBERGER AutoMobil Versicherungsdienst GmbH – Nürnberg",
      "type": "Registerbekanntmachung nach dem Umwandlungsgesetz",
      "state": "Bayern",
      "amtsgericht": "Amtsgericht Nürnberg",
      "registernummer": "HRB 26245",
      "registerart": "HRB",
      "company_name": "NÜRNBERGER AutoMobil Versicherungsdienst GmbH",
      "company_seat": "Nürnberg",
      "details": "20.09.2025 (Bekanntmachungsdatum)\n\nBayern Amtsgericht Nürnberg HRB 26245\nRegisterbekanntmachung nach dem Umwandlungsgesetz 19.09.2025 (Eintragungsdatum)\n\nNÜRNBERGER AutoMobil Versicherungsdienst GmbH\nGesellschaft mit beschränkter Haftung\nNürnberg\n\nDen Gläubigern der an der Verschmelzung beteiligten Rechtsträger ist, wenn sie binnen sechs Monaten nach dem Tag, an dem die Eintragung der Verschmelzung in das Register des Sitzes desjenigen Rechtsträgers, dessen Gläubiger sie sind, nach § 19 Abs. 3 UmwG als bekannt gemacht gilt, ihren Anspruch nach Grund und Höhe in Textform anmelden, Sicherheit zu leisten, soweit sie nicht Befriedigung verlangen können. Dieses Recht steht den Gläubigern jedoch nur zu, wenn sie glaubhaft machen, dass durch die Verschmelzung die Erfüllung ihrer Forderung gefährdet wird."
    },
    {
      "date": "2025-09-20",
      "id": "130655",
      "original_text": "Einreichung neuer Dokumente\nBayern Amtsgericht Kempten (Allgäu) HRB 12323\nElektrizitätsnetze Allgäu GmbH – Lindenberg i. Allgäu",
      "type": "Einreichung neuer Dokumente",
      "state": "Bayern",
      "amtsgericht": "Amtsgericht Kempten (Allgäu)",
      "registernummer": "HRB 12323",
      "registerart": "HRB",
      "company_name": "Elektrizitätsnetze Allgäu GmbH",
      "company_seat": "Lindenberg i. Allgäu",
      "details": "20.09.2025 (Bekanntmachungsdatum)\n\nBayern Amtsgericht Kempten (Allgäu) HRB 12323\nEinreichung neuer Dokumente 19.09.2025 (Eintragungsdatum)\n\nElektrizitätsnetze Allgäu GmbH\nGesellschaft mit beschränkter Haftung\nLindenberg i. Allgäu\n\nDem Amtsgericht Kempten (Allgäu) -Registergericht- ist eine Liste der Mitglieder des Aufsichtsrats eingereicht worden, § 52 Abs. 3 S. 2 GmbHG."
    },
    {
      "date": "2025-09-20",
      "id": "130656",
      "original_text": "Registerbekanntmachung nach dem Umwandlungsgesetz\nBayern Amtsgericht Kempten (Allgäu) HRB 15689\nV - Markt Neugablonz Management GmbH – Mauerstetten",
      "type": "Registerbekanntmachung nach dem Umwandlungsgesetz",
      "state": "Bayern",
      "amtsgericht": "Amtsgericht Kempten (Allgäu)",
      "registernummer": "HRB 15689",
      "registerart": "HRB",
      "company_name": "V - Markt Neugablonz Management GmbH",
      "company_seat": "Mauerstetten",
      "details": "20.09.2025 (Bekanntmachungsdatum)\n\nBayern Amtsgericht Kempten (Allgäu) HRB 15689\nRegisterbekanntmachung nach dem Umwandlungsgesetz 19.09.2025 (Eintragungsdatum)\n\nV - Markt Neugablonz Management GmbH\nGesellschaft mit beschränkter Haftung\nMauerstetten\n\nDen Gläubigern der an der Verschmelzung beteiligten Rechtsträger ist, wenn sie binnen sechs Monaten nach dem Tag, an dem die Eintragung der Verschmelzung in das Register des Sitzes desjenigen Rechtsträgers, dessen Gläubiger sie sind, nach § 19 Abs. 3 UmwG als bekannt gemacht gilt, ihren Anspruch nach Grund und Höhe in Textform anmelden, Sicherheit zu leisten, soweit sie nicht Befriedigung verlangen können. Dieses Recht steht den Gläubigern jedoch nur zu, wenn sie glaubhaft machen, dass durch die Verschmelzung die Erfüllung ihrer Forderung gefährdet wird."
    },
    {
      "date": "2025-09-20",
      "id": "130657",
      "original_text": "Registerbekanntmachung nach dem Umwandlungsgesetz\nBayern Amtsgericht Kempten (Allgäu) GsR 536\nT.HE MAMAK eGbR – Kempten (Allgäu)",
      "type": "Registerbekanntmachung nach dem Umwandlungsgesetz",
      "state": "Bayern",
      "amtsgericht": "Amtsgericht Kempten (Allgäu)",
      "registernummer": "GsR 536",
      "registerart": "GsR",
      "company_name": "T.HE MAMAK eGbR",
      "company_seat": "Kempten (Allgäu)",
      "details": "20.09.2025 (Bekanntmachungsdatum)\n\nBayern Amtsgericht Kempten (Allgäu) GsR 536\nRegisterbekanntmachung nach dem Umwandlungsgesetz 19.09.2025 (Eintragungsdatum)\n\nT.HE MAMAK eGbR\nGesellschaft bürgerlichen Rechts\nKempten (Allgäu)\n\nDen Gläubigern des formwechselnden Rechtsträgers ist, wenn sie binnen sechs Monaten nach dem Tag, an dem die Eintragung des Formwechsels nach § 201 UmwG als bekannt gemacht gilt, ihren Anspruch nach Grund und Höhe in Textform anmelden, Sicherheit zu leisten, soweit sie nicht Befriedigung verlangen können. Dieses Recht steht den Gläubigern jedoch nur zu, wenn sie glaubhaft machen, dass durch den Formwechsel die Erfüllung ihrer Forderung gefährdet wird."
    },
    {
      "date": "2025-09-20",
      "id": "130658",
      "original_text": "Einreichung neuer Dokumente\nBayern Amtsgericht München HRB 225814\nAcconsis Holding AG Steuerberatungsgesellschaft – München",
      "type": "Einreichung neuer Dokumente",
      "state": "Bayern",
      "amtsgericht": "Amtsgericht München",
      "registernummer": "HRB 225814",
      "registerart": "HRB",
      "company_name": "Acconsis Holding AG Steuerberatungsgesellschaft",
      "company_seat": "München",
      "details": "20.09.2025 (Bekanntmachungsdatum)\n\nBayern Amtsgericht München HRB 225814\nEinreichung neuer Dokumente\n\nAcconsis Holding AG Steuerberatungsgesellschaft\nAktiengesellschaft\nMünchen\n\nDem Amtsgericht München -Registergericht- ist eine Liste der Mitglieder des Aufsichtsrats eingereicht worden, § 106 AktG."
    },
    {
      "date": "2025-09-20",
      "id": "130659",
      "original_text": "Registerbekanntmachung nach dem Umwandlungsgesetz\nBayern Amtsgericht München HRB 272313\nsaroo holding GmbH – Grünwald",
      "type": "Registerbekanntmachung nach dem Umwandlungsgesetz",
      "state": "Bayern",
      "amtsgericht": "Amtsgericht München",
      "registernummer": "HRB 272313",
      "registerart": "HRB",
      "company_name": "saroo holding GmbH",
      "company_seat": "Grünwald",
      "details": "20.09.2025 (Bekanntmachungsdatum)\n\nBayern Amtsgericht München HRB 272313\nRegisterbekanntmachung nach dem Umwandlungsgesetz 19.09.2025 (Eintragungsdatum)\n\nsaroo holding GmbH\nGesellschaft mit beschränkter Haftung\nGrünwald\n\nDen Gläubigern der an der Verschmelzung beteiligten Rechtsträger ist, wenn sie binnen sechs Monaten nach dem Tag, an dem die Eintragung der Verschmelzung in das Register des Sitzes desjenigen Rechtsträgers, dessen Gläubiger sie sind, nach § 19 Abs. 3 UmwG als bekannt gemacht gilt, ihren Anspruch nach Grund und Höhe in Textform anmelden, Sicherheit zu leisten, soweit sie nicht Befriedigung verlangen können. Dieses Recht steht den Gläubigern jedoch nur zu, wenn sie glaubhaft machen, dass durch die Verschmelzung die Erfüllung ihrer Forderung gefährdet wird."
    },
    {
      "date": "2025-09-20",
      "id": "130660",
      "original_text": "Registerbekanntmachung nach dem Umwandlungsgesetz\nBayern Amtsgericht Kempten (Allgäu) HRB 18440\nAlpen & Grund GmbH – Kempten (Allgäu)",
      "type": "Registerbekanntmachung nach dem Umwandlungsgesetz",
      "state": "Bayern",
      "amtsgericht": "Amtsgericht Kempten (Allgäu)",
      "registernummer": "HRB 18440",
      "registerart": "HRB",
      "company_name": "Alpen & Grund GmbH",
      "company_seat": "Kempten (Allgäu)",
      "details": "20.09.2025 (Bekanntmachungsdatum)\n\nBayern Amtsgericht Kempten (Allgäu) HRB 18440\nRegisterbekanntmachung nach dem Umwandlungsgesetz 19.09.2025 (Eintragungsdatum)\n\nAlpen & Grund GmbH\nGesellschaft mit beschränkter Haftung\nKempten (Allgäu)\n\nDen Gläubigern des formwechselnden Rechtsträgers ist, wenn sie binnen sechs Monaten nach dem Tag, an dem die Eintragung des Formwechsels nach § 201 UmwG als bekannt gemacht gilt, ihren Anspruch nach Grund und Höhe in Textform anmelden, Sicherheit zu leisten, soweit sie nicht Befriedigung verlangen können. Dieses Recht steht den Gläubigern jedoch nur zu, wenn sie glaubhaft machen, dass durch den Formwechsel die Erfüllung ihrer Forderung gefährdet wird."
    },
    {
      "date": "2025-09-20",
      "id": "130661",
      "original_text": "Registerbekanntmachung nach dem Umwandlungsgesetz\nBayern Amtsgericht Weiden i. d. OPf. HRA 1418\nWilhelm Bauer GmbH & Co. KG – Erbendorf",
      "type": "Registerbekanntmachung nach dem Umwandlungsgesetz",
      "state": "Bayern",
      "amtsgericht": "Amtsgericht Weiden i. d. OPf.",
      "registernummer": "HRA 1418",
      "registerart": "HRA",
      "company_name": "Wilhelm Bauer GmbH & Co. KG",
      "company_seat": "Erbendorf",
      "details": "20.09.2025 (Bekanntmachungsdatum)\n\nBayern Amtsgericht Weiden i. d. OPf. HRA 1418\nRegisterbekanntmachung nach dem Umwandlungsgesetz 19.09.2025 (Eintragungsdatum)\n\nWilhelm Bauer GmbH & Co. KG\nKommanditgesellschaft\nErbendorf\n\nDen Gläubigern der an der Spaltung beteiligten Rechtsträger ist, wenn sie binnen sechs Monaten nach dem Tag, an dem die Eintragung der Spaltung in das Register des Sitzes desjenigen Rechtsträgers, dessen Gläubiger sie sind, nach §§ 125, 19 Abs. 3 UmwG als bekannt gemacht gilt, ihren Anspruch nach Grund und Höhe in Textform anmelden, Sicherheit zu leisten, soweit sie nicht Befriedigung verlangen können. Dieses Recht steht den Gläubigern jedoch nur zu, wenn sie glaubhaft machen, dass durch die Spaltung die Erfüllung ihrer Forderung gefährdet wird."
    },
    {
      "date": "2025-09-20",
      "id": "130662",
      "original_text": "Registerbekanntmachung nach dem Umwandlungsgesetz\nBayern Amtsgericht München HRA 72803\nDipl.-Ing. Emil Hönninger GmbH & Co. Bauunternehmung KG – Kirchseeon",
      "type": "Registerbekanntmachung nach dem Umwandlungsgesetz",
      "state": "Bayern",
      "amtsgericht": "Amtsgericht München",
      "registernummer": "HRA 72803",
      "registerart": "HRA",
      "company_name": "Dipl.-Ing. Emil Hönninger GmbH & Co. Bauunternehmung KG",
      "company_seat": "Kirchseeon",
      "details": "20.09.2025 (Bekanntmachungsdatum)\n\nBayern Amtsgericht München HRA 72803\nRegisterbekanntmachung nach dem Umwandlungsgesetz 19.09.2025 (Eintragungsdatum)\n\nDipl.-Ing. Emil Hönninger GmbH & Co. Bauunternehmung KG\nKommanditgesellschaft\nKirchseeon\n\nDen Gläubigern der an der Ausgliederung beteiligten Rechtsträger ist, wenn sie binnen sechs Monaten nach dem Tag, an dem die Eintragung der Ausgliederung in das Register des Sitzes desjenigen Rechtsträgers, dessen Gläubiger sie sind, nach §§ 125, 19 Abs. 3 UmwG als bekannt gemacht gilt, ihren Anspruch nach Grund und Höhe in Textform anmelden, Sicherheit zu leisten, soweit sie nicht Befriedigung verlangen können. Dieses Recht steht den Gläubigern jedoch nur zu, wenn sie glaubhaft machen, dass durch die Ausgliederung die Erfüllung ihrer Forderung gefährdet wird."
    },
    {
      "date": "2025-09-20",
      "id": "130663",
      "original_text": "Registerbekanntmachung nach dem Umwandlungsgesetz\nBayern Amtsgericht Würzburg HRA 7339\nMBT Brautechnik GmbH & Co. KG – Bergtheim",
      "type": "Registerbekanntmachung nach dem Umwandlungsgesetz",
      "state": "Bayern",
      "amtsgericht": "Amtsgericht Würzburg",
      "registernummer": "HRA 7339",
      "registerart": "HRA",
      "company_name": "MBT Brautechnik GmbH & Co. KG",
      "company_seat": "Bergtheim",
      "details": "20.09.2025 (Bekanntmachungsdatum)\n\nBayern Amtsgericht Würzburg HRA 7339\nRegisterbekanntmachung nach dem Umwandlungsgesetz 19.09.2025 (Eintragungsdatum)\n\nMBT Brautechnik GmbH & Co. KG\nKommanditgesellschaft\nBergtheim\n\nDen Gläubigern der an der Verschmelzung beteiligten Rechtsträger ist, wenn sie binnen sechs Monaten nach dem Tag, an dem die Eintragung der Verschmelzung in das Register des Sitzes desjenigen Rechtsträgers, dessen Gläubiger sie sind, nach § 19 Abs. 3 UmwG als bekannt gemacht gilt, ihren Anspruch nach Grund und Höhe in Textform anmelden, Sicherheit zu leisten, soweit sie nicht Befriedigung verlangen können. Dieses Recht steht den Gläubigern jedoch nur zu, wenn sie glaubhaft machen, dass durch die Verschmelzung die Erfüllung ihrer Forderung gefährdet wird."
    },
    {
      "date": "2025-09-20",
      "id": "130664",
      "original_text": "Registerbekanntmachung nach dem Umwandlungsgesetz\nBayern Amtsgericht Würzburg HRA 7339\nMBT Brautechnik GmbH & Co. KG – Bergtheim",
      "type": "Registerbekanntmachung nach dem Umwandlungsgesetz",
      "state": "Bayern",
      "amtsgericht": "Amtsgericht Würzburg",
      "registernummer": "HRA 7339",
      "registerart": "HRA",
      "company_name": "MBT Brautechnik GmbH & Co. KG",
      "company_seat": "Bergtheim",
      "details": "20.09.2025 (Bekanntmachungsdatum)\n\nBayern Amtsgericht Würzburg HRA 7339\nRegisterbekanntmachung nach dem Umwandlungsgesetz 19.09.2025 (Eintragungsdatum)\n\nMBT Brautechnik GmbH & Co. KG\nKommanditgesellschaft\nBergtheim\n\nDen Gläubigern der an der Verschmelzung beteiligten Rechtsträger ist, wenn sie binnen sechs Monaten nach dem Tag, an dem die Eintragung der Verschmelzung in das Register des Sitzes desjenigen Rechtsträgers, dessen Gläubiger sie sind, nach § 19 Abs. 3 UmwG als bekannt gemacht gilt, ihren Anspruch nach Grund und Höhe in Textform anmelden, Sicherheit zu leisten, soweit sie nicht Befriedigung verlangen können. Dieses Recht steht den Gläubigern jedoch nur zu, wenn sie glaubhaft machen, dass durch die Verschmelzung die Erfüllung ihrer Forderung gefährdet wird."
    },
    {
      "date": "2025-09-20",
      "id": "130665",
      "original_text": "Registerbekanntmachung nach dem Umwandlungsgesetz\nBayern Amtsgericht Weiden i. d. OPf. HRA 2032\nCyclon GmbH & Co. KG – Bärnau",
      "type": "Registerbekanntmachung nach dem Umwandlungsgesetz",
      "state": "Bayern",
      "amtsgericht": "Amtsgericht Weiden i. d. OPf.",
      "registernummer": "HRA 2032",
      "registerart": "HRA",
      "company_name": "Cyclon GmbH & Co. KG",
      "company_seat": "Bärnau",
      "details": "20.09.2025 (Bekanntmachungsdatum)\n\nBayern Amtsgericht Weiden i. d. OPf. HRA 2032\nRegisterbekanntmachung nach dem Umwandlungsgesetz 19.09.2025 (Eintragungsdatum)\n\nCyclon GmbH & Co. KG\nKommanditgesellschaft\nBärnau\n\nDen Gläubigern der an der Verschmelzung beteiligten Rechtsträger ist, wenn sie binnen sechs Monaten nach dem Tag, an dem die Eintragung der Verschmelzung in das Register des Sitzes desjenigen Rechtsträgers, dessen Gläubiger sie sind, nach § 19 Abs. 3 UmwG als bekannt gemacht gilt, ihren Anspruch nach Grund und Höhe in Textform anmelden, Sicherheit zu leisten, soweit sie nicht Befriedigung verlangen können. Dieses Recht steht den Gläubigern jedoch nur zu, wenn sie glaubhaft machen, dass durch die Verschmelzung die Erfüllung ihrer Forderung gefährdet wird."
    }
  ]
}