{
  "date": "2025-09-23",
  "date_of_scrape": "2025-10-27T15:15:44.823Z",
  "tool_version": "0.2.0",
  "number_of_announcements": 256,
  "announcements": [
    {
      "date": "2025-09-23",
      "id": "130869",
      "original_text": "Löschungsankündigung\nBayern Amtsgericht Kempten (Allgäu) HRB 14951\nBio Power GmbH – Durach",
      "type": "Löschungsankündigung",
      "state": "Bayern",
      "amtsgericht": "Amtsgericht Kempten (Allgäu)",
      "registernummer": "HRB 14951",
      "registerart": "HRB",
      "company_name": "Bio Power GmbH",
      "company_seat": "Durach",
      "details": "23.09.2025 (Bekanntmachungsdatum)\n\nBayern Amtsgericht Kempten (Allgäu) HRB 14951\nLöschungsankündigung\n\nBio Power GmbH\nGesellschaft mit beschränkter Haftung\nDurach\n\nDas Registergericht beabsichtigt, die im Handelsregister eingetragene Gesellschaft wegen Vermögenslosigkeit von Amts wegen nach § 394 FamFG zu löschen. Die Frist zur Erhebung eines Widerspruchs ist auf einen Monat festgesetzt."
    },
    {
      "date": "2025-09-23",
      "id": "130870",
      "original_text": "Registerbekanntmachung nach dem Umwandlungsgesetz\nBayern Amtsgericht Ansbach HRB 5858\nMHB Montage GmbH – Merkendorf",
      "type": "Registerbekanntmachung nach dem Umwandlungsgesetz",
      "state": "Bayern",
      "amtsgericht": "Amtsgericht Ansbach",
      "registernummer": "HRB 5858",
      "registerart": "HRB",
      "company_name": "MHB Montage GmbH",
      "company_seat": "Merkendorf",
      "details": "23.09.2025 (Bekanntmachungsdatum)\n\nBayern Amtsgericht Ansbach HRB 5858\nRegisterbekanntmachung nach dem Umwandlungsgesetz 22.09.2025 (Eintragungsdatum)\n\nMHB Montage GmbH\nGesellschaft mit beschränkter Haftung\nMerkendorf\n\nDen Gläubigern der an der Verschmelzung beteiligten Rechtsträger ist, wenn sie binnen sechs Monaten nach dem Tag, an dem die Eintragung der Verschmelzung in das Register des Sitzes desjenigen Rechtsträgers, dessen Gläubiger sie sind, nach § 19 Abs. 3 UmwG als bekannt gemacht gilt, ihren Anspruch nach Grund und Höhe in Textform anmelden, Sicherheit zu leisten, soweit sie nicht Befriedigung verlangen können. Dieses Recht steht den Gläubigern jedoch nur zu, wenn sie glaubhaft machen, dass durch die Verschmelzung die Erfüllung ihrer Forderung gefährdet wird."
    },
    {
      "date": "2025-09-23",
      "id": "130871",
      "original_text": "Registerbekanntmachung nach dem Umwandlungsgesetz\nBayern Amtsgericht Aschaffenburg HRA 6749\nPommes AB City Galerie e.Kfr. – Aschaffenburg",
      "type": "Registerbekanntmachung nach dem Umwandlungsgesetz",
      "state": "Bayern",
      "amtsgericht": "Amtsgericht Aschaffenburg",
      "registernummer": "HRA 6749",
      "registerart": "HRA",
      "company_name": "Pommes AB City Galerie e.Kfr.",
      "company_seat": "Aschaffenburg",
      "details": "23.09.2025 (Bekanntmachungsdatum)\n\nBayern Amtsgericht Aschaffenburg HRA 6749\nRegisterbekanntmachung nach dem Umwandlungsgesetz 22.09.2025 (Eintragungsdatum)\n\nPommes AB City Galerie e.Kfr.\nEinzelkaufmann / Einzelkauffrau\nAschaffenburg\n\nDen Gläubigern der an der Verschmelzung beteiligten Rechtsträger ist, wenn sie binnen sechs Monaten nach dem Tag, an dem die Eintragung der Verschmelzung in das Register des Sitzes desjenigen Rechtsträgers, dessen Gläubiger sie sind, nach § 19 Abs. 3 UmwG als bekannt gemacht gilt, ihren Anspruch nach Grund und Höhe in Textform anmelden, Sicherheit zu leisten, soweit sie nicht Befriedigung verlangen können. Dieses Recht steht den Gläubigern jedoch nur zu, wenn sie glaubhaft machen, dass durch die Verschmelzung die Erfüllung ihrer Forderung gefährdet wird."
    },
    {
      "date": "2025-09-23",
      "id": "130872",
      "original_text": "Registerbekanntmachung nach dem Umwandlungsgesetz\nBayern Amtsgericht Fürth HRB 4158\nSchaeffler Versicherungs- Vermittlungs GmbH – Herzogenaurach",
      "type": "Registerbekanntmachung nach dem Umwandlungsgesetz",
      "state": "Bayern",
      "amtsgericht": "Amtsgericht Fürth",
      "registernummer": "HRB 4158",
      "registerart": "HRB",
      "company_name": "Schaeffler Versicherungs- Vermittlungs GmbH",
      "company_seat": "Herzogenaurach",
      "details": "23.09.2025 (Bekanntmachungsdatum)\n\nBayern Amtsgericht Fürth HRB 4158\nRegisterbekanntmachung nach dem Umwandlungsgesetz 22.09.2025 (Eintragungsdatum)\n\nSchaeffler Versicherungs- Vermittlungs GmbH\nGesellschaft mit beschränkter Haftung\nHerzogenaurach\n\nDen Gläubigern der an der Verschmelzung beteiligten Rechtsträger ist, wenn sie binnen sechs Monaten nach dem Tag, an dem die Eintragung der Verschmelzung in das Register des Sitzes desjenigen Rechtsträgers, dessen Gläubiger sie sind, nach § 19 Abs. 3 UmwG als bekannt gemacht gilt, ihren Anspruch nach Grund und Höhe in Textform anmelden, Sicherheit zu leisten, soweit sie nicht Befriedigung verlangen können. Dieses Recht steht den Gläubigern jedoch nur zu, wenn sie glaubhaft machen, dass durch die Verschmelzung die Erfüllung ihrer Forderung gefährdet wird."
    },
    {
      "date": "2025-09-23",
      "id": "130873",
      "original_text": "Registerbekanntmachung nach dem Umwandlungsgesetz\nBayern Amtsgericht München HRB 138300\nLudwig Beck Beteiligungs GmbH – München",
      "type": "Registerbekanntmachung nach dem Umwandlungsgesetz",
      "state": "Bayern",
      "amtsgericht": "Amtsgericht München",
      "registernummer": "HRB 138300",
      "registerart": "HRB",
      "company_name": "Ludwig Beck Beteiligungs GmbH",
      "company_seat": "München",
      "details": "23.09.2025 (Bekanntmachungsdatum)\n\nBayern Amtsgericht München HRB 138300\nRegisterbekanntmachung nach dem Umwandlungsgesetz 22.09.2025 (Eintragungsdatum)\n\nLudwig Beck Beteiligungs GmbH\nGesellschaft mit beschränkter Haftung\nMünchen\n\nDen Gläubigern der an der Verschmelzung beteiligten Rechtsträger ist, wenn sie binnen sechs Monaten nach dem Tag, an dem die Eintragung der Verschmelzung in das Register des Sitzes desjenigen Rechtsträgers, dessen Gläubiger sie sind, nach § 19 Abs. 3 UmwG als bekannt gemacht gilt, ihren Anspruch nach Grund und Höhe in Textform anmelden, Sicherheit zu leisten, soweit sie nicht Befriedigung verlangen können. Dieses Recht steht den Gläubigern jedoch nur zu, wenn sie glaubhaft machen, dass durch die Verschmelzung die Erfüllung ihrer Forderung gefährdet wird."
    },
    {
      "date": "2025-09-23",
      "id": "130874",
      "original_text": "Registerbekanntmachung nach dem Umwandlungsgesetz\nBayern Amtsgericht München HRB 251436\nTransConnect Unternehmensberatungs- und Beteiligungs GmbH – München",
      "type": "Registerbekanntmachung nach dem Umwandlungsgesetz",
      "state": "Bayern",
      "amtsgericht": "Amtsgericht München",
      "registernummer": "HRB 251436",
      "registerart": "HRB",
      "company_name": "TransConnect Unternehmensberatungs- und Beteiligungs GmbH",
      "company_seat": "München",
      "details": "23.09.2025 (Bekanntmachungsdatum)\n\nBayern Amtsgericht München HRB 251436\nRegisterbekanntmachung nach dem Umwandlungsgesetz 22.09.2025 (Eintragungsdatum)\n\nTransConnect Unternehmensberatungs- und Beteiligungs GmbH\nGesellschaft mit beschränkter Haftung\nMünchen\n\nDen Gläubigern der an der Verschmelzung beteiligten Rechtsträger ist, wenn sie binnen sechs Monaten nach dem Tag, an dem die Eintragung der Verschmelzung in das Register des Sitzes desjenigen Rechtsträgers, dessen Gläubiger sie sind, nach § 19 Abs. 3 UmwG als bekannt gemacht gilt, ihren Anspruch nach Grund und Höhe in Textform anmelden, Sicherheit zu leisten, soweit sie nicht Befriedigung verlangen können. Dieses Recht steht den Gläubigern jedoch nur zu, wenn sie glaubhaft machen, dass durch die Verschmelzung die Erfüllung ihrer Forderung gefährdet wird."
    },
    {
      "date": "2025-09-23",
      "id": "130875",
      "original_text": "Registerbekanntmachung nach dem Umwandlungsgesetz\nBayern Amtsgericht Nürnberg HRB 25554\nDie Krieger des Lichts GmbH – Nürnberg",
      "type": "Registerbekanntmachung nach dem Umwandlungsgesetz",
      "state": "Bayern",
      "amtsgericht": "Amtsgericht Nürnberg",
      "registernummer": "HRB 25554",
      "registerart": "HRB",
      "company_name": "Die Krieger des Lichts GmbH",
      "company_seat": "Nürnberg",
      "details": "23.09.2025 (Bekanntmachungsdatum)\n\nBayern Amtsgericht Nürnberg HRB 25554\nRegisterbekanntmachung nach dem Umwandlungsgesetz 22.09.2025 (Eintragungsdatum)\n\nDie Krieger des Lichts GmbH\nGesellschaft mit beschränkter Haftung\nNürnberg\n\nDen Gläubigern der an der Verschmelzung beteiligten Rechtsträger ist, wenn sie binnen sechs Monaten nach dem Tag, an dem die Eintragung der Verschmelzung in das Register des Sitzes desjenigen Rechtsträgers, dessen Gläubiger sie sind, nach § 19 Abs. 3 UmwG als bekannt gemacht gilt, ihren Anspruch nach Grund und Höhe in Textform anmelden, Sicherheit zu leisten, soweit sie nicht Befriedigung verlangen können. Dieses Recht steht den Gläubigern jedoch nur zu, wenn sie glaubhaft machen, dass durch die Verschmelzung die Erfüllung ihrer Forderung gefährdet wird."
    },
    {
      "date": "2025-09-23",
      "id": "130876",
      "original_text": "Löschungsankündigung\nBayern Amtsgericht Amberg HRB 6543\nELEKTRO-CONECT Group GmbH – Amberg",
      "type": "Löschungsankündigung",
      "state": "Bayern",
      "amtsgericht": "Amtsgericht Amberg",
      "registernummer": "HRB 6543",
      "registerart": "HRB",
      "company_name": "ELEKTRO-CONECT Group GmbH",
      "company_seat": "Amberg",
      "details": "23.09.2025 (Bekanntmachungsdatum)\n\nBayern Amtsgericht Amberg HRB 6543\nLöschungsankündigung\n\nELEKTRO-CONECT Group GmbH\nGesellschaft mit beschränkter Haftung\nAmberg\n\nDas Registergericht beabsichtigt, die im Handelsregister eingetragene Gesellschaft wegen Vermögenslosigkeit von Amts wegen nach § 394 FamFG zu löschen. Die Frist zur Erhebung eines Widerspruchs ist auf einen Monat festgesetzt."
    },
    {
      "date": "2025-09-23",
      "id": "130877",
      "original_text": "Registerbekanntmachung nach dem Umwandlungsgesetz\nBayern Amtsgericht Amberg HRA 4226\nAuto Ortner e.K. – Amberg",
      "type": "Registerbekanntmachung nach dem Umwandlungsgesetz",
      "state": "Bayern",
      "amtsgericht": "Amtsgericht Amberg",
      "registernummer": "HRA 4226",
      "registerart": "HRA",
      "company_name": "Auto Ortner e.K.",
      "company_seat": "Amberg",
      "details": "23.09.2025 (Bekanntmachungsdatum)\n\nBayern Amtsgericht Amberg HRA 4226\nRegisterbekanntmachung nach dem Umwandlungsgesetz 22.09.2025 (Eintragungsdatum)\n\nAuto Ortner e.K.\nEinzelkaufmann / Einzelkauffrau\nAmberg\n\nDen Gläubigern der an der Ausgliederung beteiligten Rechtsträger ist, wenn sie binnen sechs Monaten nach dem Tag, an dem die Eintragung der Ausgliederung in das Register des Sitzes desjenigen Rechtsträgers, dessen Gläubiger sie sind, nach §§ 125, 19 Abs. 3 UmwG als bekannt gemacht gilt, ihren Anspruch nach Grund und Höhe in Textform anmelden, Sicherheit zu leisten, soweit sie nicht Befriedigung verlangen können. Dieses Recht steht den Gläubigern jedoch nur zu, wenn sie glaubhaft machen, dass durch die Ausgliederung die Erfüllung ihrer Forderung gefährdet wird."
    },
    {
      "date": "2025-09-23",
      "id": "130878",
      "original_text": "Registerbekanntmachung nach dem Umwandlungsgesetz\nBayern Amtsgericht München HRB 50510\nHauptmann GmbH – München",
      "type": "Registerbekanntmachung nach dem Umwandlungsgesetz",
      "state": "Bayern",
      "amtsgericht": "Amtsgericht München",
      "registernummer": "HRB 50510",
      "registerart": "HRB",
      "company_name": "Hauptmann GmbH",
      "company_seat": "München",
      "details": "23.09.2025 (Bekanntmachungsdatum)\n\nBayern Amtsgericht München HRB 50510\nRegisterbekanntmachung nach dem Umwandlungsgesetz 22.09.2025 (Eintragungsdatum)\n\nHauptmann GmbH\nGesellschaft mit beschränkter Haftung\nMünchen\n\nDen Gläubigern der an der Verschmelzung beteiligten Rechtsträger ist, wenn sie binnen sechs Monaten nach dem Tag, an dem die Eintragung der Verschmelzung in das Register des Sitzes desjenigen Rechtsträgers, dessen Gläubiger sie sind, nach § 19 Abs. 3 UmwG als bekannt gemacht gilt, ihren Anspruch nach Grund und Höhe in Textform anmelden, Sicherheit zu leisten, soweit sie nicht Befriedigung verlangen können. Dieses Recht steht den Gläubigern jedoch nur zu, wenn sie glaubhaft machen, dass durch die Verschmelzung die Erfüllung ihrer Forderung gefährdet wird."
    },
    {
      "date": "2025-09-23",
      "id": "130879",
      "original_text": "Registerbekanntmachung nach dem Umwandlungsgesetz\nBayern Amtsgericht München HRA 121479\nGniza Versicherungsmakler GmbH & Co. KG – Neuried",
      "type": "Registerbekanntmachung nach dem Umwandlungsgesetz",
      "state": "Bayern",
      "amtsgericht": "Amtsgericht München",
      "registernummer": "HRA 121479",
      "registerart": "HRA",
      "company_name": "Gniza Versicherungsmakler GmbH & Co. KG",
      "company_seat": "Neuried",
      "details": "23.09.2025 (Bekanntmachungsdatum)\n\nBayern Amtsgericht München HRA 121479\nRegisterbekanntmachung nach dem Umwandlungsgesetz 22.09.2025 (Eintragungsdatum)\n\nGniza Versicherungsmakler GmbH & Co. KG\nKommanditgesellschaft\nNeuried\n\nDen Gläubigern der an der Ausgliederung beteiligten Rechtsträger ist, wenn sie binnen sechs Monaten nach dem Tag, an dem die Eintragung der Ausgliederung in das Register des Sitzes desjenigen Rechtsträgers, dessen Gläubiger sie sind, nach §§ 125, 19 Abs. 3 UmwG als bekannt gemacht gilt, ihren Anspruch nach Grund und Höhe in Textform anmelden, Sicherheit zu leisten, soweit sie nicht Befriedigung verlangen können. Dieses Recht steht den Gläubigern jedoch nur zu, wenn sie glaubhaft machen, dass durch die Ausgliederung die Erfüllung ihrer Forderung gefährdet wird."
    },
    {
      "date": "2025-09-23",
      "id": "130880",
      "original_text": "Löschungsankündigung\nBayern Amtsgericht München HRB 271682\nHello Chef GmbH – München",
      "type": "Löschungsankündigung",
      "state": "Bayern",
      "amtsgericht": "Amtsgericht München",
      "registernummer": "HRB 271682",
      "registerart": "HRB",
      "company_name": "Hello Chef GmbH",
      "company_seat": "München",
      "details": "23.09.2025 (Bekanntmachungsdatum)\n\nBayern Amtsgericht München HRB 271682\nLöschungsankündigung 22.09.2025 (Eintragungsdatum)\n\nHello Chef GmbH\nGesellschaft mit beschränkter Haftung\nMünchen\n\nDas Registergericht beabsichtigt, die im Handelsregister eingetragene Gesellschaft wegen Vermögenslosigkeit von Amts wegen nach § 394 FamFG zu löschen. Die Frist zur Erhebung eines Widerspruchs ist auf drei Monate festgesetzt."
    },
    {
      "date": "2025-09-23",
      "id": "130881",
      "original_text": "Registerbekanntmachung nach dem Umwandlungsgesetz\nBayern Amtsgericht Coburg HRB 3276\nDr. Dück Verwaltungs-GmbH – Altenkunstadt",
      "type": "Registerbekanntmachung nach dem Umwandlungsgesetz",
      "state": "Bayern",
      "amtsgericht": "Amtsgericht Coburg",
      "registernummer": "HRB 3276",
      "registerart": "HRB",
      "company_name": "Dr. Dück Verwaltungs-GmbH",
      "company_seat": "Altenkunstadt",
      "details": "23.09.2025 (Bekanntmachungsdatum)\n\nBayern Amtsgericht Coburg HRB 3276\nRegisterbekanntmachung nach dem Umwandlungsgesetz 17.09.2025 (Eintragungsdatum)\n\nDr. Dück Verwaltungs-GmbH\nGesellschaft mit beschränkter Haftung\nAltenkunstadt\n\nDen Gläubigern der an der Verschmelzung beteiligten Rechtsträger ist, wenn sie binnen sechs Monaten nach dem Tag, an dem die Eintragung der Verschmelzung in das Register des Sitzes desjenigen Rechtsträgers, dessen Gläubiger sie sind, nach § 19 Abs. 3 UmwG als bekannt gemacht gilt, ihren Anspruch nach Grund und Höhe in Textform anmelden, Sicherheit zu leisten, soweit sie nicht Befriedigung verlangen können. Dieses Recht steht den Gläubigern jedoch nur zu, wenn sie glaubhaft machen, dass durch die Verschmelzung die Erfüllung ihrer Forderung gefährdet wird."
    },
    {
      "date": "2025-09-23",
      "id": "130882",
      "original_text": "Registerbekanntmachung nach dem Umwandlungsgesetz\nBayern Amtsgericht München HRB 57932\nROSCO Film GmbH – München",
      "type": "Registerbekanntmachung nach dem Umwandlungsgesetz",
      "state": "Bayern",
      "amtsgericht": "Amtsgericht München",
      "registernummer": "HRB 57932",
      "registerart": "HRB",
      "company_name": "ROSCO Film GmbH",
      "company_seat": "München",
      "details": "23.09.2025 (Bekanntmachungsdatum)\n\nBayern Amtsgericht München HRB 57932\nRegisterbekanntmachung nach dem Umwandlungsgesetz 22.09.2025 (Eintragungsdatum)\n\nROSCO Film GmbH\nGesellschaft mit beschränkter Haftung\nMünchen\n\nDen Gläubigern der an der Verschmelzung beteiligten Rechtsträger ist, wenn sie binnen sechs Monaten nach dem Tag, an dem die Eintragung der Verschmelzung in das Register des Sitzes desjenigen Rechtsträgers, dessen Gläubiger sie sind, nach § 19 Abs. 3 UmwG als bekannt gemacht gilt, ihren Anspruch nach Grund und Höhe in Textform anmelden, Sicherheit zu leisten, soweit sie nicht Befriedigung verlangen können. Dieses Recht steht den Gläubigern jedoch nur zu, wenn sie glaubhaft machen, dass durch die Verschmelzung die Erfüllung ihrer Forderung gefährdet wird."
    },
    {
      "date": "2025-09-23",
      "id": "130883",
      "original_text": "Löschungsankündigung\nBayern Amtsgericht München HRB 192281\nPlatinum Vitalis AG – München",
      "type": "Löschungsankündigung",
      "state": "Bayern",
      "amtsgericht": "Amtsgericht München",
      "registernummer": "HRB 192281",
      "registerart": "HRB",
      "company_name": "Platinum Vitalis AG",
      "company_seat": "München",
      "details": "23.09.2025 (Bekanntmachungsdatum)\n\nBayern Amtsgericht München HRB 192281\nLöschungsankündigung 22.09.2025 (Eintragungsdatum)\n\nPlatinum Vitalis AG\nAktiengesellschaft\nMünchen\n\nDem Amtsgericht München -Registergericht- ist eine Liste der Mitglieder des Aufsichtsrats eingereicht worden, § 106 AktG.Das Registergericht beabsichtigt, die im Handelsregister eingetragene Gesellschaft wegen Vermögenslosigkeit von Amts wegen nach § 394 FamFG zu löschen. Die Frist zur Erhebung eines Widerspruchs ist auf drei Monate festgesetzt."
    },
    {
      "date": "2025-09-23",
      "id": "130884",
      "original_text": "Registerbekanntmachung nach dem Umwandlungsgesetz\nBayern Amtsgericht Aschaffenburg HRB 12451\nTZ-Medien-Service GmbH – Aschaffenburg",
      "type": "Registerbekanntmachung nach dem Umwandlungsgesetz",
      "state": "Bayern",
      "amtsgericht": "Amtsgericht Aschaffenburg",
      "registernummer": "HRB 12451",
      "registerart": "HRB",
      "company_name": "TZ-Medien-Service GmbH",
      "company_seat": "Aschaffenburg",
      "details": "23.09.2025 (Bekanntmachungsdatum)\n\nBayern Amtsgericht Aschaffenburg HRB 12451\nRegisterbekanntmachung nach dem Umwandlungsgesetz 22.09.2025 (Eintragungsdatum)\n\nTZ-Medien-Service GmbH\nGesellschaft mit beschränkter Haftung\nAschaffenburg\n\nDen Gläubigern der an der Verschmelzung beteiligten Rechtsträger ist, wenn sie binnen sechs Monaten nach dem Tag, an dem die Eintragung der Verschmelzung in das Register des Sitzes desjenigen Rechtsträgers, dessen Gläubiger sie sind, nach § 19 Abs. 3 UmwG als bekannt gemacht gilt, ihren Anspruch nach Grund und Höhe in Textform anmelden, Sicherheit zu leisten, soweit sie nicht Befriedigung verlangen können. Dieses Recht steht den Gläubigern jedoch nur zu, wenn sie glaubhaft machen, dass durch die Verschmelzung die Erfüllung ihrer Forderung gefährdet wird."
    },
    {
      "date": "2025-09-23",
      "id": "130885",
      "original_text": "Löschungsankündigung\nBayern Amtsgericht München HRB 195623\nStahl Baggerbetrieb München GmbH – München",
      "type": "Löschungsankündigung",
      "state": "Bayern",
      "amtsgericht": "Amtsgericht München",
      "registernummer": "HRB 195623",
      "registerart": "HRB",
      "company_name": "Stahl Baggerbetrieb München GmbH",
      "company_seat": "München",
      "details": "23.09.2025 (Bekanntmachungsdatum)\n\nBayern Amtsgericht München HRB 195623\nLöschungsankündigung 22.09.2025 (Eintragungsdatum)\n\nStahl Baggerbetrieb München GmbH\nGesellschaft mit beschränkter Haftung\nMünchen\n\nDas Registergericht beabsichtigt, die im Handelsregister eingetragene Gesellschaft wegen Vermögenslosigkeit von Amts wegen nach § 394 FamFG zu löschen. Die Frist zur Erhebung eines Widerspruchs ist auf drei Monate festgesetzt."
    },
    {
      "date": "2025-09-23",
      "id": "130886",
      "original_text": "Registerbekanntmachung nach dem Umwandlungsgesetz\nBayern Amtsgericht München HRB 140149\nmsg systems AG – Ismaning",
      "type": "Registerbekanntmachung nach dem Umwandlungsgesetz",
      "state": "Bayern",
      "amtsgericht": "Amtsgericht München",
      "registernummer": "HRB 140149",
      "registerart": "HRB",
      "company_name": "msg systems AG",
      "company_seat": "Ismaning",
      "details": "23.09.2025 (Bekanntmachungsdatum)\n\nBayern Amtsgericht München HRB 140149\nRegisterbekanntmachung nach dem Umwandlungsgesetz 22.09.2025 (Eintragungsdatum)\n\nmsg systems AG\nAktiengesellschaft\nIsmaning\n\nDen Gläubigern der an der Verschmelzung beteiligten Rechtsträger ist, wenn sie binnen sechs Monaten nach dem Tag, an dem die Eintragung der Verschmelzung in das Register des Sitzes desjenigen Rechtsträgers, dessen Gläubiger sie sind, nach § 19 Abs. 3 UmwG als bekannt gemacht gilt, ihren Anspruch nach Grund und Höhe in Textform anmelden, Sicherheit zu leisten, soweit sie nicht Befriedigung verlangen können. Dieses Recht steht den Gläubigern jedoch nur zu, wenn sie glaubhaft machen, dass durch die Verschmelzung die Erfüllung ihrer Forderung gefährdet wird."
    },
    {
      "date": "2025-09-23",
      "id": "130887",
      "original_text": "Registerbekanntmachung nach dem Umwandlungsgesetz\nBayern Amtsgericht München HRB 248488\nTATIN INSTITUTE GmbH – München",
      "type": "Registerbekanntmachung nach dem Umwandlungsgesetz",
      "state": "Bayern",
      "amtsgericht": "Amtsgericht München",
      "registernummer": "HRB 248488",
      "registerart": "HRB",
      "company_name": "TATIN INSTITUTE GmbH",
      "company_seat": "München",
      "details": "23.09.2025 (Bekanntmachungsdatum)\n\nBayern Amtsgericht München HRB 248488\nRegisterbekanntmachung nach dem Umwandlungsgesetz 22.09.2025 (Eintragungsdatum)\n\nTATIN INSTITUTE GmbH\nGesellschaft mit beschränkter Haftung\nMünchen\n\nDen Gläubigern der an der Verschmelzung beteiligten Rechtsträger ist, wenn sie binnen sechs Monaten nach dem Tag, an dem die Eintragung der Verschmelzung in das Register des Sitzes desjenigen Rechtsträgers, dessen Gläubiger sie sind, nach § 19 Abs. 3 UmwG als bekannt gemacht gilt, ihren Anspruch nach Grund und Höhe in Textform anmelden, Sicherheit zu leisten, soweit sie nicht Befriedigung verlangen können. Dieses Recht steht den Gläubigern jedoch nur zu, wenn sie glaubhaft machen, dass durch die Verschmelzung die Erfüllung ihrer Forderung gefährdet wird."
    },
    {
      "date": "2025-09-23",
      "id": "130888",
      "original_text": "Registerbekanntmachung nach dem Umwandlungsgesetz\nBayern Amtsgericht Aschaffenburg HRB 16623\nPommes AB City Galerie GmbH – Aschaffenburg",
      "type": "Registerbekanntmachung nach dem Umwandlungsgesetz",
      "state": "Bayern",
      "amtsgericht": "Amtsgericht Aschaffenburg",
      "registernummer": "HRB 16623",
      "registerart": "HRB",
      "company_name": "Pommes AB City Galerie GmbH",
      "company_seat": "Aschaffenburg",
      "details": "23.09.2025 (Bekanntmachungsdatum)\n\nBayern Amtsgericht Aschaffenburg HRB 16623\nRegisterbekanntmachung nach dem Umwandlungsgesetz 22.09.2025 (Eintragungsdatum)\n\nPommes AB City Galerie GmbH\nGesellschaft mit beschränkter Haftung\nAschaffenburg\n\nDen Gläubigern der an der Verschmelzung beteiligten Rechtsträger ist, wenn sie binnen sechs Monaten nach dem Tag, an dem die Eintragung der Verschmelzung in das Register des Sitzes desjenigen Rechtsträgers, dessen Gläubiger sie sind, nach § 19 Abs. 3 UmwG als bekannt gemacht gilt, ihren Anspruch nach Grund und Höhe in Textform anmelden, Sicherheit zu leisten, soweit sie nicht Befriedigung verlangen können. Dieses Recht steht den Gläubigern jedoch nur zu, wenn sie glaubhaft machen, dass durch die Verschmelzung die Erfüllung ihrer Forderung gefährdet wird."
    },
    {
      "date": "2025-09-23",
      "id": "130889",
      "original_text": "Registerbekanntmachung nach dem Umwandlungsgesetz\nBayern Amtsgericht Amberg HRB 8157\nAuto Ortner GmbH – Amberg",
      "type": "Registerbekanntmachung nach dem Umwandlungsgesetz",
      "state": "Bayern",
      "amtsgericht": "Amtsgericht Amberg",
      "registernummer": "HRB 8157",
      "registerart": "HRB",
      "company_name": "Auto Ortner GmbH",
      "company_seat": "Amberg",
      "details": "23.09.2025 (Bekanntmachungsdatum)\n\nBayern Amtsgericht Amberg HRB 8157\nRegisterbekanntmachung nach dem Umwandlungsgesetz 22.09.2025 (Eintragungsdatum)\n\nAuto Ortner GmbH\nGesellschaft mit beschränkter Haftung\nAmberg\n\nDen Gläubigern der an der Ausgliederung beteiligten Rechtsträger ist, wenn sie binnen sechs Monaten nach dem Tag, an dem die Eintragung der Ausgliederung in das Register des Sitzes desjenigen Rechtsträgers, dessen Gläubiger sie sind, nach §§ 125, 19 Abs. 3 UmwG als bekannt gemacht gilt, ihren Anspruch nach Grund und Höhe in Textform anmelden, Sicherheit zu leisten, soweit sie nicht Befriedigung verlangen können. Dieses Recht steht den Gläubigern jedoch nur zu, wenn sie glaubhaft machen, dass durch die Ausgliederung die Erfüllung ihrer Forderung gefährdet wird."
    },
    {
      "date": "2025-09-23",
      "id": "130890",
      "original_text": "Registerbekanntmachung nach dem Umwandlungsgesetz\nBayern Amtsgericht München HRB 199542\nXOOL GmbH – München",
      "type": "Registerbekanntmachung nach dem Umwandlungsgesetz",
      "state": "Bayern",
      "amtsgericht": "Amtsgericht München",
      "registernummer": "HRB 199542",
      "registerart": "HRB",
      "company_name": "XOOL GmbH",
      "company_seat": "München",
      "details": "23.09.2025 (Bekanntmachungsdatum)\n\nBayern Amtsgericht München HRB 199542\nRegisterbekanntmachung nach dem Umwandlungsgesetz 22.09.2025 (Eintragungsdatum)\n\nXOOL GmbH\nGesellschaft mit beschränkter Haftung\nMünchen\n\nDen Gläubigern der an der Verschmelzung beteiligten Rechtsträger ist, wenn sie binnen sechs Monaten nach dem Tag, an dem die Eintragung der Verschmelzung in das Register des Sitzes desjenigen Rechtsträgers, dessen Gläubiger sie sind, nach § 19 Abs. 3 UmwG als bekannt gemacht gilt, ihren Anspruch nach Grund und Höhe in Textform anmelden, Sicherheit zu leisten, soweit sie nicht Befriedigung verlangen können. Dieses Recht steht den Gläubigern jedoch nur zu, wenn sie glaubhaft machen, dass durch die Verschmelzung die Erfüllung ihrer Forderung gefährdet wird."
    },
    {
      "date": "2025-09-23",
      "id": "130891",
      "original_text": "Registerbekanntmachung nach dem Umwandlungsgesetz\nBayern Amtsgericht München HRB 253426\nAURELIUS H&FS Holding GmbH – Grünwald",
      "type": "Registerbekanntmachung nach dem Umwandlungsgesetz",
      "state": "Bayern",
      "amtsgericht": "Amtsgericht München",
      "registernummer": "HRB 253426",
      "registerart": "HRB",
      "company_name": "AURELIUS H&FS Holding GmbH",
      "company_seat": "Grünwald",
      "details": "23.09.2025 (Bekanntmachungsdatum)\n\nBayern Amtsgericht München HRB 253426\nRegisterbekanntmachung nach dem Umwandlungsgesetz 22.09.2025 (Eintragungsdatum)\n\nAURELIUS H&FS Holding GmbH\nGesellschaft mit beschränkter Haftung\nGrünwald\n\nDen Gläubigern der an der Verschmelzung beteiligten Rechtsträger ist, wenn sie binnen sechs Monaten nach dem Tag, an dem die Eintragung der Verschmelzung in das Register des Sitzes desjenigen Rechtsträgers, dessen Gläubiger sie sind, nach § 19 Abs. 3 UmwG als bekannt gemacht gilt, ihren Anspruch nach Grund und Höhe in Textform anmelden, Sicherheit zu leisten, soweit sie nicht Befriedigung verlangen können. Dieses Recht steht den Gläubigern jedoch nur zu, wenn sie glaubhaft machen, dass durch die Verschmelzung die Erfüllung ihrer Forderung gefährdet wird."
    },
    {
      "date": "2025-09-23",
      "id": "130892",
      "original_text": "Registerbekanntmachung nach dem Umwandlungsgesetz\nBayern Amtsgericht München HRA 121301\nPeter Gniza Versicherungsmakler e.K. – Neuried",
      "type": "Registerbekanntmachung nach dem Umwandlungsgesetz",
      "state": "Bayern",
      "amtsgericht": "Amtsgericht München",
      "registernummer": "HRA 121301",
      "registerart": "HRA",
      "company_name": "Peter Gniza Versicherungsmakler e.K.",
      "company_seat": "Neuried",
      "details": "23.09.2025 (Bekanntmachungsdatum)\n\nBayern Amtsgericht München HRA 121301\nRegisterbekanntmachung nach dem Umwandlungsgesetz 22.09.2025 (Eintragungsdatum)\n\nPeter Gniza Versicherungsmakler e.K.\nEinzelkaufmann / Einzelkauffrau\nNeuried\n\nDen Gläubigern der an der Ausgliederung beteiligten Rechtsträger ist, wenn sie binnen sechs Monaten nach dem Tag, an dem die Eintragung der Ausgliederung in das Register des Sitzes desjenigen Rechtsträgers, dessen Gläubiger sie sind, nach §§ 125, 19 Abs. 3 UmwG als bekannt gemacht gilt, ihren Anspruch nach Grund und Höhe in Textform anmelden, Sicherheit zu leisten, soweit sie nicht Befriedigung verlangen können. Dieses Recht steht den Gläubigern jedoch nur zu, wenn sie glaubhaft machen, dass durch die Ausgliederung die Erfüllung ihrer Forderung gefährdet wird."
    },
    {
      "date": "2025-09-23",
      "id": "130893",
      "original_text": "Registerbekanntmachung nach dem Umwandlungsgesetz\nBayern Amtsgericht Ingolstadt HRA 4385\nAndrej Gebel e.K. – Neuburg a.d.Donau",
      "type": "Registerbekanntmachung nach dem Umwandlungsgesetz",
      "state": "Bayern",
      "amtsgericht": "Amtsgericht Ingolstadt",
      "registernummer": "HRA 4385",
      "registerart": "HRA",
      "company_name": "Andrej Gebel e.K.",
      "company_seat": "Neuburg a.d.Donau",
      "details": "23.09.2025 (Bekanntmachungsdatum)\n\nBayern Amtsgericht Ingolstadt HRA 4385\nRegisterbekanntmachung nach dem Umwandlungsgesetz 22.09.2025 (Eintragungsdatum)\n\nAndrej Gebel e.K.\nEinzelkaufmann / Einzelkauffrau\nNeuburg a.d.Donau\n\nDen Gläubigern der an der Ausgliederung beteiligten Rechtsträger ist, wenn sie binnen sechs Monaten nach dem Tag, an dem die Eintragung der Ausgliederung in das Register des Sitzes desjenigen Rechtsträgers, dessen Gläubiger sie sind, nach §§ 125, 19 Abs. 3 UmwG als bekannt gemacht gilt, ihren Anspruch nach Grund und Höhe in Textform anmelden, Sicherheit zu leisten, soweit sie nicht Befriedigung verlangen können. Dieses Recht steht den Gläubigern jedoch nur zu, wenn sie glaubhaft machen, dass durch die Ausgliederung die Erfüllung ihrer Forderung gefährdet wird."
    },
    {
      "date": "2025-09-23",
      "id": "130894",
      "original_text": "Registerbekanntmachung nach dem Umwandlungsgesetz\nBayern Amtsgericht Ansbach HRB 7750\nMHB Merkendorf GmbH – Merkendorf",
      "type": "Registerbekanntmachung nach dem Umwandlungsgesetz",
      "state": "Bayern",
      "amtsgericht": "Amtsgericht Ansbach",
      "registernummer": "HRB 7750",
      "registerart": "HRB",
      "company_name": "MHB Merkendorf GmbH",
      "company_seat": "Merkendorf",
      "details": "23.09.2025 (Bekanntmachungsdatum)\n\nBayern Amtsgericht Ansbach HRB 7750\nRegisterbekanntmachung nach dem Umwandlungsgesetz 22.09.2025 (Eintragungsdatum)\n\nMHB Merkendorf GmbH\nGesellschaft mit beschränkter Haftung\nMerkendorf\n\nDen Gläubigern der an der Verschmelzung beteiligten Rechtsträger ist, wenn sie binnen sechs Monaten nach dem Tag, an dem die Eintragung der Verschmelzung in das Register des Sitzes desjenigen Rechtsträgers, dessen Gläubiger sie sind, nach § 19 Abs. 3 UmwG als bekannt gemacht gilt, ihren Anspruch nach Grund und Höhe in Textform anmelden, Sicherheit zu leisten, soweit sie nicht Befriedigung verlangen können. Dieses Recht steht den Gläubigern jedoch nur zu, wenn sie glaubhaft machen, dass durch die Verschmelzung die Erfüllung ihrer Forderung gefährdet wird."
    },
    {
      "date": "2025-09-23",
      "id": "130895",
      "original_text": "Registerbekanntmachung nach dem Umwandlungsgesetz\nBayern Amtsgericht München HRA 116940\nSchreinerei Christian Berger e.K. – Starnberg",
      "type": "Registerbekanntmachung nach dem Umwandlungsgesetz",
      "state": "Bayern",
      "amtsgericht": "Amtsgericht München",
      "registernummer": "HRA 116940",
      "registerart": "HRA",
      "company_name": "Schreinerei Christian Berger e.K.",
      "company_seat": "Starnberg",
      "details": "23.09.2025 (Bekanntmachungsdatum)\n\nBayern Amtsgericht München HRA 116940\nRegisterbekanntmachung nach dem Umwandlungsgesetz 22.09.2025 (Eintragungsdatum)\n\nSchreinerei Christian Berger e.K.\nEinzelkaufmann / Einzelkauffrau\nStarnberg\n\nDen Gläubigern der an der Ausgliederung beteiligten Rechtsträger ist, wenn sie binnen sechs Monaten nach dem Tag, an dem die Eintragung der Ausgliederung in das Register des Sitzes desjenigen Rechtsträgers, dessen Gläubiger sie sind, nach §§ 125, 19 Abs. 3 UmwG als bekannt gemacht gilt, ihren Anspruch nach Grund und Höhe in Textform anmelden, Sicherheit zu leisten, soweit sie nicht Befriedigung verlangen können. Dieses Recht steht den Gläubigern jedoch nur zu, wenn sie glaubhaft machen, dass durch die Ausgliederung die Erfüllung ihrer Forderung gefährdet wird."
    },
    {
      "date": "2025-09-23",
      "id": "130896",
      "original_text": "Registerbekanntmachung nach dem Umwandlungsgesetz\nBayern Amtsgericht Ingolstadt HRB 12515\nToniZ GmbH – Neuburg a.d. Donau",
      "type": "Registerbekanntmachung nach dem Umwandlungsgesetz",
      "state": "Bayern",
      "amtsgericht": "Amtsgericht Ingolstadt",
      "registernummer": "HRB 12515",
      "registerart": "HRB",
      "company_name": "ToniZ GmbH",
      "company_seat": "Neuburg a.d. Donau",
      "details": "23.09.2025 (Bekanntmachungsdatum)\n\nBayern Amtsgericht Ingolstadt HRB 12515\nRegisterbekanntmachung nach dem Umwandlungsgesetz 22.09.2025 (Eintragungsdatum)\n\nToniZ GmbH\nGesellschaft mit beschränkter Haftung\nNeuburg a.d. Donau\n\nDen Gläubigern der an der Ausgliederung beteiligten Rechtsträger ist, wenn sie binnen sechs Monaten nach dem Tag, an dem die Eintragung der Ausgliederung in das Register des Sitzes desjenigen Rechtsträgers, dessen Gläubiger sie sind, nach §§ 125, 19 Abs. 3 UmwG als bekannt gemacht gilt, ihren Anspruch nach Grund und Höhe in Textform anmelden, Sicherheit zu leisten, soweit sie nicht Befriedigung verlangen können. Dieses Recht steht den Gläubigern jedoch nur zu, wenn sie glaubhaft machen, dass durch die Ausgliederung die Erfüllung ihrer Forderung gefährdet wird."
    },
    {
      "date": "2025-09-23",
      "id": "130897",
      "original_text": "Registerbekanntmachung nach dem Umwandlungsgesetz\nBayern Amtsgericht Fürth HRB 22059\nJS-Sicherheitstechnik GmbH – Oberasbach",
      "type": "Registerbekanntmachung nach dem Umwandlungsgesetz",
      "state": "Bayern",
      "amtsgericht": "Amtsgericht Fürth",
      "registernummer": "HRB 22059",
      "registerart": "HRB",
      "company_name": "JS-Sicherheitstechnik GmbH",
      "company_seat": "Oberasbach",
      "details": "23.09.2025 (Bekanntmachungsdatum)\n\nBayern Amtsgericht Fürth HRB 22059\nRegisterbekanntmachung nach dem Umwandlungsgesetz 22.09.2025 (Eintragungsdatum)\n\nJS-Sicherheitstechnik GmbH\nGesellschaft mit beschränkter Haftung\nOberasbach\n\nDen Gläubigern der an der Ausgliederung beteiligten Rechtsträger ist, wenn sie binnen sechs Monaten nach dem Tag, an dem die Eintragung der Ausgliederung in das Register des Sitzes desjenigen Rechtsträgers, dessen Gläubiger sie sind, nach §§ 125, 19 Abs. 3 UmwG als bekannt gemacht gilt, ihren Anspruch nach Grund und Höhe in Textform anmelden, Sicherheit zu leisten, soweit sie nicht Befriedigung verlangen können. Dieses Recht steht den Gläubigern jedoch nur zu, wenn sie glaubhaft machen, dass durch die Ausgliederung die Erfüllung ihrer Forderung gefährdet wird."
    },
    {
      "date": "2025-09-23",
      "id": "130898",
      "original_text": "Einreichung neuer Dokumente\nBayern Amtsgericht München HRB 211\nWWK Lebensversicherung auf Gegenseitigkeit – München",
      "type": "Einreichung neuer Dokumente",
      "state": "Bayern",
      "amtsgericht": "Amtsgericht München",
      "registernummer": "HRB 211",
      "registerart": "HRB",
      "company_name": "WWK Lebensversicherung auf Gegenseitigkeit",
      "company_seat": "München",
      "details": "23.09.2025 (Bekanntmachungsdatum)\n\nBayern Amtsgericht München HRB 211\nEinreichung neuer Dokumente\n\nWWK Lebensversicherung auf Gegenseitigkeit\nVersicherungsverein auf Gegenseitigkeit\nMünchen\n\nDem Amtsgericht München -Registergericht- ist eine Liste der Mitglieder des Aufsichtsrats eingereicht worden, §§ 189 Abs. 3 Satz 1 VAG, 106 AktG."
    },
    {
      "date": "2025-09-23",
      "id": "130899",
      "original_text": "Registerbekanntmachung nach dem Umwandlungsgesetz\nBayern Amtsgericht München HRB 162423\nPfandfinanz Holding AG – Ismaning",
      "type": "Registerbekanntmachung nach dem Umwandlungsgesetz",
      "state": "Bayern",
      "amtsgericht": "Amtsgericht München",
      "registernummer": "HRB 162423",
      "registerart": "HRB",
      "company_name": "Pfandfinanz Holding AG",
      "company_seat": "Ismaning",
      "details": "23.09.2025 (Bekanntmachungsdatum)\n\nBayern Amtsgericht München HRB 162423\nRegisterbekanntmachung nach dem Umwandlungsgesetz 21.09.2025 (Eintragungsdatum)\n\nPfandfinanz Holding AG\nAktiengesellschaft\nIsmaning\n\nDen Gläubigern der an der Verschmelzung beteiligten Rechtsträger ist, wenn sie binnen sechs Monaten nach dem Tag, an dem die Eintragung der Verschmelzung in das Register des Sitzes desjenigen Rechtsträgers, dessen Gläubiger sie sind, nach § 19 Abs. 3 UmwG als bekannt gemacht gilt, ihren Anspruch nach Grund und Höhe in Textform anmelden, Sicherheit zu leisten, soweit sie nicht Befriedigung verlangen können. Dieses Recht steht den Gläubigern jedoch nur zu, wenn sie glaubhaft machen, dass durch die Verschmelzung die Erfüllung ihrer Forderung gefährdet wird."
    },
    {
      "date": "2025-09-23",
      "id": "130900",
      "original_text": "Registerbekanntmachung nach dem Umwandlungsgesetz\nBayern Amtsgericht Ansbach HRB 8209\nMHB Projektentwicklungs GmbH – Merkendorf",
      "type": "Registerbekanntmachung nach dem Umwandlungsgesetz",
      "state": "Bayern",
      "amtsgericht": "Amtsgericht Ansbach",
      "registernummer": "HRB 8209",
      "registerart": "HRB",
      "company_name": "MHB Projektentwicklungs GmbH",
      "company_seat": "Merkendorf",
      "details": "23.09.2025 (Bekanntmachungsdatum)\n\nBayern Amtsgericht Ansbach HRB 8209\nRegisterbekanntmachung nach dem Umwandlungsgesetz 22.09.2025 (Eintragungsdatum)\n\nMHB Projektentwicklungs GmbH\nGesellschaft mit beschränkter Haftung\nMerkendorf\n\nDen Gläubigern der an der Verschmelzung beteiligten Rechtsträger ist, wenn sie binnen sechs Monaten nach dem Tag, an dem die Eintragung der Verschmelzung in das Register des Sitzes desjenigen Rechtsträgers, dessen Gläubiger sie sind, nach § 19 Abs. 3 UmwG als bekannt gemacht gilt, ihren Anspruch nach Grund und Höhe in Textform anmelden, Sicherheit zu leisten, soweit sie nicht Befriedigung verlangen können. Dieses Recht steht den Gläubigern jedoch nur zu, wenn sie glaubhaft machen, dass durch die Verschmelzung die Erfüllung ihrer Forderung gefährdet wird."
    },
    {
      "date": "2025-09-23",
      "id": "130901",
      "original_text": "Registerbekanntmachung nach dem Umwandlungsgesetz\nBayern Amtsgericht Landshut GsR 253\nKMS Immobilien eGbR – Wurmannsquick",
      "type": "Registerbekanntmachung nach dem Umwandlungsgesetz",
      "state": "Bayern",
      "amtsgericht": "Amtsgericht Landshut",
      "registernummer": "GsR 253",
      "registerart": "GsR",
      "company_name": "KMS Immobilien eGbR",
      "company_seat": "Wurmannsquick",
      "details": "23.09.2025 (Bekanntmachungsdatum)\n\nBayern Amtsgericht Landshut GsR 253\nRegisterbekanntmachung nach dem Umwandlungsgesetz 22.09.2025 (Eintragungsdatum)\n\nKMS Immobilien eGbR\nGesellschaft bürgerlichen Rechts\nWurmannsquick\n\nDen Gläubigern des formwechselnden Rechtsträgers ist, wenn sie binnen sechs Monaten nach dem Tag, an dem die Eintragung des Formwechsels nach § 201 UmwG als bekannt gemacht gilt, ihren Anspruch nach Grund und Höhe in Textform anmelden, Sicherheit zu leisten, soweit sie nicht Befriedigung verlangen können. Dieses Recht steht den Gläubigern jedoch nur zu, wenn sie glaubhaft machen, dass durch den Formwechsel die Erfüllung ihrer Forderung gefährdet wird."
    },
    {
      "date": "2025-09-23",
      "id": "130902",
      "original_text": "Registerbekanntmachung nach dem Umwandlungsgesetz\nBayern Amtsgericht München HRB 191897\ntechcos GmbH – München",
      "type": "Registerbekanntmachung nach dem Umwandlungsgesetz",
      "state": "Bayern",
      "amtsgericht": "Amtsgericht München",
      "registernummer": "HRB 191897",
      "registerart": "HRB",
      "company_name": "techcos GmbH",
      "company_seat": "München",
      "details": "23.09.2025 (Bekanntmachungsdatum)\n\nBayern Amtsgericht München HRB 191897\nRegisterbekanntmachung nach dem Umwandlungsgesetz 22.09.2025 (Eintragungsdatum)\n\ntechcos GmbH\nGesellschaft mit beschränkter Haftung\nMünchen\n\nDen Gläubigern der an der Verschmelzung beteiligten Rechtsträger ist, wenn sie binnen sechs Monaten nach dem Tag, an dem die Eintragung der Verschmelzung in das Register des Sitzes desjenigen Rechtsträgers, dessen Gläubiger sie sind, nach § 19 Abs. 3 UmwG als bekannt gemacht gilt, ihren Anspruch nach Grund und Höhe in Textform anmelden, Sicherheit zu leisten, soweit sie nicht Befriedigung verlangen können. Dieses Recht steht den Gläubigern jedoch nur zu, wenn sie glaubhaft machen, dass durch die Verschmelzung die Erfüllung ihrer Forderung gefährdet wird."
    },
    {
      "date": "2025-09-23",
      "id": "130903",
      "original_text": "Registerbekanntmachung nach dem Umwandlungsgesetz\nBayern Amtsgericht München HRA 121250\nMarkus Lackner e.K. – Putzbrunn",
      "type": "Registerbekanntmachung nach dem Umwandlungsgesetz",
      "state": "Bayern",
      "amtsgericht": "Amtsgericht München",
      "registernummer": "HRA 121250",
      "registerart": "HRA",
      "company_name": "Markus Lackner e.K.",
      "company_seat": "Putzbrunn",
      "details": "23.09.2025 (Bekanntmachungsdatum)\n\nBayern Amtsgericht München HRA 121250\nRegisterbekanntmachung nach dem Umwandlungsgesetz 22.09.2025 (Eintragungsdatum)\n\nMarkus Lackner e.K.\nEinzelkaufmann / Einzelkauffrau\nPutzbrunn\n\nDen Gläubigern der an der Ausgliederung beteiligten Rechtsträger ist, wenn sie binnen sechs Monaten nach dem Tag, an dem die Eintragung der Ausgliederung in das Register des Sitzes desjenigen Rechtsträgers, dessen Gläubiger sie sind, nach §§ 125, 19 Abs. 3 UmwG als bekannt gemacht gilt, ihren Anspruch nach Grund und Höhe in Textform anmelden, Sicherheit zu leisten, soweit sie nicht Befriedigung verlangen können. Dieses Recht steht den Gläubigern jedoch nur zu, wenn sie glaubhaft machen, dass durch die Ausgliederung die Erfüllung ihrer Forderung gefährdet wird."
    },
    {
      "date": "2025-09-23",
      "id": "130904",
      "original_text": "Registerbekanntmachung nach dem Umwandlungsgesetz\nBayern Amtsgericht München HRB 175147\nBleichert Holding GmbH – München",
      "type": "Registerbekanntmachung nach dem Umwandlungsgesetz",
      "state": "Bayern",
      "amtsgericht": "Amtsgericht München",
      "registernummer": "HRB 175147",
      "registerart": "HRB",
      "company_name": "Bleichert Holding GmbH",
      "company_seat": "München",
      "details": "23.09.2025 (Bekanntmachungsdatum)\n\nBayern Amtsgericht München HRB 175147\nRegisterbekanntmachung nach dem Umwandlungsgesetz 22.09.2025 (Eintragungsdatum)\n\nBleichert Holding GmbH\nGesellschaft mit beschränkter Haftung\nMünchen\n\nDen Gläubigern der an der Verschmelzung beteiligten Rechtsträger ist, wenn sie binnen sechs Monaten nach dem Tag, an dem die Eintragung der Verschmelzung in das Register des Sitzes desjenigen Rechtsträgers, dessen Gläubiger sie sind, nach § 19 Abs. 3 UmwG als bekannt gemacht gilt, ihren Anspruch nach Grund und Höhe in Textform anmelden, Sicherheit zu leisten, soweit sie nicht Befriedigung verlangen können. Dieses Recht steht den Gläubigern jedoch nur zu, wenn sie glaubhaft machen, dass durch die Verschmelzung die Erfüllung ihrer Forderung gefährdet wird."
    },
    {
      "date": "2025-09-23",
      "id": "130905",
      "original_text": "Registerbekanntmachung nach dem Umwandlungsgesetz\nBayern Amtsgericht München HRB 175147\nBleichert Holding GmbH – München",
      "type": "Registerbekanntmachung nach dem Umwandlungsgesetz",
      "state": "Bayern",
      "amtsgericht": "Amtsgericht München",
      "registernummer": "HRB 175147",
      "registerart": "HRB",
      "company_name": "Bleichert Holding GmbH",
      "company_seat": "München",
      "details": "23.09.2025 (Bekanntmachungsdatum)\n\nBayern Amtsgericht München HRB 175147\nRegisterbekanntmachung nach dem Umwandlungsgesetz 22.09.2025 (Eintragungsdatum)\n\nBleichert Holding GmbH\nGesellschaft mit beschränkter Haftung\nMünchen\n\nDen Gläubigern der an der Verschmelzung beteiligten Rechtsträger ist, wenn sie binnen sechs Monaten nach dem Tag, an dem die Eintragung der Verschmelzung in das Register des Sitzes desjenigen Rechtsträgers, dessen Gläubiger sie sind, nach § 19 Abs. 3 UmwG als bekannt gemacht gilt, ihren Anspruch nach Grund und Höhe in Textform anmelden, Sicherheit zu leisten, soweit sie nicht Befriedigung verlangen können. Dieses Recht steht den Gläubigern jedoch nur zu, wenn sie glaubhaft machen, dass durch die Verschmelzung die Erfüllung ihrer Forderung gefährdet wird."
    },
    {
      "date": "2025-09-23",
      "id": "130906",
      "original_text": "Registerbekanntmachung nach dem Umwandlungsgesetz\nBayern Amtsgericht München HRB 305783\n3 B Immobilien GmbH – Geretsried",
      "type": "Registerbekanntmachung nach dem Umwandlungsgesetz",
      "state": "Bayern",
      "amtsgericht": "Amtsgericht München",
      "registernummer": "HRB 305783",
      "registerart": "HRB",
      "company_name": "3 B Immobilien GmbH",
      "company_seat": "Geretsried",
      "details": "23.09.2025 (Bekanntmachungsdatum)\n\nBayern Amtsgericht München HRB 305783\nRegisterbekanntmachung nach dem Umwandlungsgesetz 22.09.2025 (Eintragungsdatum)\n\n3 B Immobilien GmbH\nGesellschaft mit beschränkter Haftung\nGeretsried\n\nDen Gläubigern der an der Ausgliederung beteiligten Rechtsträger ist, wenn sie binnen sechs Monaten nach dem Tag, an dem die Eintragung der Ausgliederung in das Register des Sitzes desjenigen Rechtsträgers, dessen Gläubiger sie sind, nach §§ 125, 19 Abs. 3 UmwG als bekannt gemacht gilt, ihren Anspruch nach Grund und Höhe in Textform anmelden, Sicherheit zu leisten, soweit sie nicht Befriedigung verlangen können. Dieses Recht steht den Gläubigern jedoch nur zu, wenn sie glaubhaft machen, dass durch die Ausgliederung die Erfüllung ihrer Forderung gefährdet wird."
    },
    {
      "date": "2025-09-23",
      "id": "130907",
      "original_text": "Sonstige Registerbekanntmachung\nBayern Amtsgericht Bayreuth HRB 6668\nMÜNCH Holding GmbH – Rugendorf",
      "type": "Sonstige Registerbekanntmachung",
      "state": "Bayern",
      "amtsgericht": "Amtsgericht Bayreuth",
      "registernummer": "HRB 6668",
      "registerart": "HRB",
      "company_name": "MÜNCH Holding GmbH",
      "company_seat": "Rugendorf",
      "details": "23.09.2025 (Bekanntmachungsdatum)\n\nBayern Amtsgericht Bayreuth HRB 6668\nSonstige Registerbekanntmachung 22.09.2025 (Eintragungsdatum)\n\nMÜNCH Holding GmbH\nGesellschaft mit beschränkter Haftung\nRugendorf\n\nDen Gläubigern der Gesellschaft, deren Forderungen begründet worden sind, bevor die Eintragung der Beendigung des Den Gläubigern der an der Spaltung beteiligten Rechtsträger ist, wenn sie binnen sechs Monaten nach dem Tag, an dem die Eintragung der Spaltung in das Register des Sitzes desjenigen Rechtsträgers, dessen Gläubiger sie sind, nach §§ 125, 19 Abs. 3 UmwG als bekannt gemacht gilt, ihren Anspruch nach Grund und Höhe in Textform anmelden, Sicherheit zu leisten, soweit sie nicht Befriedigung verlangen können. Dieses Recht steht den Gläubigern jedoch nur zu, wenn sie glaubhaft machen, dass durch die Spaltung die Erfüllung ihrer Forderung gefährdet wird.#DV.art(Text=\"Bitte Art des Vertrages auswählen\",Eingabe=\n\"Beherrschungs- und Gewinnabführungsvertrages\",\n\"Beherrschungsvertrages\",\n\"Gewinnabführungsvertrages\",\n\"Teilgewinnabführungsvertrages\") in das Handelsregister nach § 10 des Handelsgesetzbuches als bekanntgemacht gilt, hat der andere Vertragsteil Sicherheit zu leisten, wenn sie sich binnen sechs Monaten nach der Bekanntmachung der Eintragung zu diesem Zweck bei ihm melden.Den Gläubigern #dv.auswahl(Text=\"Bitte zutreffendes auswählen:\",Eingabe=\n\n\"der an der Verschmelzung beteiligten Rechtsträger ist, wenn sie binnen sechs Monaten nach dem Tag, an dem die Eintragung der Verschmelzung in das Register des Sitzes desjenigen Rechtsträgers, dessen Gläubiger sie sind, nach § 19 Abs. 3 UmwG als bekannt gemacht gilt, ihren Anspruch nach Grund und Höhe in Textform anmelden, Sicherheit zu leisten, soweit sie nicht Befriedigung verlangen können. Dieses Recht steht den Gläubigern jedoch nur zu, wenn sie glaubhaft machen, dass durch die Verschmelzung die Erfüllung ihrer Forderung gefährdet wird.\"|\"Verschmelzung\",\n\n\"der an der Spaltung beteiligten Rechtsträger ist, wenn sie binnen sechs Monaten nach dem Tag, an dem die Eintragung der Spaltung in das Register des Sitzes desjenigen Rechtsträgers, dessen Gläubiger sie sind, nach §§ 125, 19 Abs. 3 UmwG als bekannt gemacht gilt, ihren Anspruch nach Grund und Höhe in Textform anmelden, Sicherheit zu leisten, soweit sie nicht Befriedigung verlangen können. Dieses Recht steht den Gläubigern jedoch nur zu, wenn sie glaubhaft machen, dass durch die Spaltung die Erfüllung ihrer Forderung gefährdet wird.\"|\"Spaltung\",\n\n\"des formwechselnden Rechtsträgers ist, wenn sie binnen sechs Monaten nach dem Tag, an dem die Eintragung des Formwechsels nach § 201 UmwG als bekannt gemacht gilt, ihren Anspruch nach Grund und Höhe in Textform anmelden, Sicherheit zu leisten, soweit sie nicht Befriedigung verlangen können. Dieses Recht steht den Gläubigern jedoch nur zu, wenn sie glaubhaft machen, dass durch den Formwechsel die Erfüllung ihrer Forderung gefährdet wird.\"|\"formwechselnde Umwandlung\",\n\n\"der an der Ausgliederung beteiligten Rechtsträger ist, wenn sie binnen sechs Monaten nach dem Tag, an dem die Eintragung der Ausgliederung in das Register des Sitzes desjenigen Rechtsträgers, dessen Gläubiger sie sind, nach §§ 125, 19 Abs. 3 UmwG als bekannt gemacht gilt, ihren Anspruch nach Grund und Höhe in Textform anmelden, Sicherheit zu leisten, soweit sie nicht Befriedigung verlangen können. Dieses Recht steht den Gläubigern jedoch nur zu, wenn sie glaubhaft machen, dass durch die Ausgliederung die Erfüllung ihrer Forderung gefährdet wird.\"|\"Ausgliederung\")"
    },
    {
      "date": "2025-09-23",
      "id": "130908",
      "original_text": "Registerbekanntmachung nach dem Umwandlungsgesetz\nBayern Amtsgericht Amberg HRB 8158\nGenius Beteiligungs-GmbH – Amberg",
      "type": "Registerbekanntmachung nach dem Umwandlungsgesetz",
      "state": "Bayern",
      "amtsgericht": "Amtsgericht Amberg",
      "registernummer": "HRB 8158",
      "registerart": "HRB",
      "company_name": "Genius Beteiligungs-GmbH",
      "company_seat": "Amberg",
      "details": "23.09.2025 (Bekanntmachungsdatum)\n\nBayern Amtsgericht Amberg HRB 8158\nRegisterbekanntmachung nach dem Umwandlungsgesetz 22.09.2025 (Eintragungsdatum)\n\nGenius Beteiligungs-GmbH\nGesellschaft mit beschränkter Haftung\nAmberg\n\nDen Gläubigern des formwechselnden Rechtsträgers ist, wenn sie binnen sechs Monaten nach dem Tag, an dem die Eintragung des Formwechsels nach § 201 UmwG als bekannt gemacht gilt, ihren Anspruch nach Grund und Höhe in Textform anmelden, Sicherheit zu leisten, soweit sie nicht Befriedigung verlangen können. Dieses Recht steht den Gläubigern jedoch nur zu, wenn sie glaubhaft machen, dass durch den Formwechsel die Erfüllung ihrer Forderung gefährdet wird."
    },
    {
      "date": "2025-09-23",
      "id": "130909",
      "original_text": "Registerbekanntmachung nach dem Umwandlungsgesetz\nBayern Amtsgericht Ingolstadt HRB 191300\nAutohaus am Kuglhof GmbH – Pfaffenhofen a.d.Ilm",
      "type": "Registerbekanntmachung nach dem Umwandlungsgesetz",
      "state": "Bayern",
      "amtsgericht": "Amtsgericht Ingolstadt",
      "registernummer": "HRB 191300",
      "registerart": "HRB",
      "company_name": "Autohaus am Kuglhof GmbH",
      "company_seat": "Pfaffenhofen a.d.Ilm",
      "details": "23.09.2025 (Bekanntmachungsdatum)\n\nBayern Amtsgericht Ingolstadt HRB 191300\nRegisterbekanntmachung nach dem Umwandlungsgesetz 22.09.2025 (Eintragungsdatum)\n\nAutohaus am Kuglhof GmbH\nGesellschaft mit beschränkter Haftung\nPfaffenhofen a.d.Ilm\n\nDen Gläubigern der an der Verschmelzung beteiligten Rechtsträger ist, wenn sie binnen sechs Monaten nach dem Tag, an dem die Eintragung der Verschmelzung in das Register des Sitzes desjenigen Rechtsträgers, dessen Gläubiger sie sind, nach § 19 Abs. 3 UmwG als bekannt gemacht gilt, ihren Anspruch nach Grund und Höhe in Textform anmelden, Sicherheit zu leisten, soweit sie nicht Befriedigung verlangen können. Dieses Recht steht den Gläubigern jedoch nur zu, wenn sie glaubhaft machen, dass durch die Verschmelzung die Erfüllung ihrer Forderung gefährdet wird."
    },
    {
      "date": "2025-09-23",
      "id": "130910",
      "original_text": "Registerbekanntmachung nach dem Umwandlungsgesetz\nBayern Amtsgericht Ingolstadt HRB 191148\nAuto Schweiger GmbH – Reichertshofen",
      "type": "Registerbekanntmachung nach dem Umwandlungsgesetz",
      "state": "Bayern",
      "amtsgericht": "Amtsgericht Ingolstadt",
      "registernummer": "HRB 191148",
      "registerart": "HRB",
      "company_name": "Auto Schweiger GmbH",
      "company_seat": "Reichertshofen",
      "details": "23.09.2025 (Bekanntmachungsdatum)\n\nBayern Amtsgericht Ingolstadt HRB 191148\nRegisterbekanntmachung nach dem Umwandlungsgesetz 22.09.2025 (Eintragungsdatum)\n\nAuto Schweiger GmbH\nGesellschaft mit beschränkter Haftung\nReichertshofen\n\nDen Gläubigern der an der Verschmelzung beteiligten Rechtsträger ist, wenn sie binnen sechs Monaten nach dem Tag, an dem die Eintragung der Verschmelzung in das Register des Sitzes desjenigen Rechtsträgers, dessen Gläubiger sie sind, nach § 19 Abs. 3 UmwG als bekannt gemacht gilt, ihren Anspruch nach Grund und Höhe in Textform anmelden, Sicherheit zu leisten, soweit sie nicht Befriedigung verlangen können. Dieses Recht steht den Gläubigern jedoch nur zu, wenn sie glaubhaft machen, dass durch die Verschmelzung die Erfüllung ihrer Forderung gefährdet wird."
    },
    {
      "date": "2025-09-23",
      "id": "130911",
      "original_text": "Registerbekanntmachung nach dem Umwandlungsgesetz\nBayern Amtsgericht Amberg HRA 1936\nGenius Beteiligungs-GmbH & Co KG. – Amberg",
      "type": "Registerbekanntmachung nach dem Umwandlungsgesetz",
      "state": "Bayern",
      "amtsgericht": "Amtsgericht Amberg",
      "registernummer": "HRA 1936",
      "registerart": "HRA",
      "company_name": "Genius Beteiligungs-GmbH & Co KG.",
      "company_seat": "Amberg",
      "details": "23.09.2025 (Bekanntmachungsdatum)\n\nBayern Amtsgericht Amberg HRA 1936\nRegisterbekanntmachung nach dem Umwandlungsgesetz 22.09.2025 (Eintragungsdatum)\n\nGenius Beteiligungs-GmbH & Co KG.\nKommanditgesellschaft\nAmberg\n\nDen Gläubigern des formwechselnden Rechtsträgers ist, wenn sie binnen sechs Monaten nach dem Tag, an dem die Eintragung des Formwechsels nach § 201 UmwG als bekannt gemacht gilt, ihren Anspruch nach Grund und Höhe in Textform anmelden, Sicherheit zu leisten, soweit sie nicht Befriedigung verlangen können. Dieses Recht steht den Gläubigern jedoch nur zu, wenn sie glaubhaft machen, dass durch den Formwechsel die Erfüllung ihrer Forderung gefährdet wird."
    },
    {
      "date": "2025-09-23",
      "id": "130912",
      "original_text": "Sonstige Registerbekanntmachung\nBaden-Württemberg Amtsgericht Mannheim HRB 740873\nLiPoWi GmbH – Waghäusel",
      "type": "Sonstige Registerbekanntmachung",
      "state": "Baden-Württemberg",
      "amtsgericht": "Amtsgericht Mannheim",
      "registernummer": "HRB 740873",
      "registerart": "HRB",
      "company_name": "LiPoWi GmbH",
      "company_seat": "Waghäusel",
      "details": "23.09.2025 (Bekanntmachungsdatum)\n\nBaden-Württemberg Amtsgericht Mannheim HRB 740873\nSonstige Registerbekanntmachung\n\nLiPoWi GmbH\nGesellschaft mit beschränkter Haftung\nWaghäusel\n\nDie Gesellschaft hat am 22.09.2025 die Liste über die Zusammensetzung des Aufsichtsrats zum Handelsregister eingereicht."
    },
    {
      "date": "2025-09-23",
      "id": "130913",
      "original_text": "Registerbekanntmachung nach dem Umwandlungsgesetz\nBerlin Amtsgericht Berlin (Charlottenburg) HRB 148255\nCyber Akademie GmbH (CAk) – Berlin",
      "type": "Registerbekanntmachung nach dem Umwandlungsgesetz",
      "state": "Berlin",
      "amtsgericht": "Amtsgericht Berlin (Charlottenburg)",
      "registernummer": "HRB 148255",
      "registerart": "HRB",
      "company_name": "Cyber Akademie GmbH (CAk)",
      "company_seat": "Berlin",
      "details": "23.09.2025 (Bekanntmachungsdatum)\n\nBerlin Amtsgericht Berlin (Charlottenburg) HRB 148255\nRegisterbekanntmachung nach dem Umwandlungsgesetz 18.09.2025 (Eintragungsdatum)\n\nCyber Akademie GmbH (CAk)\nGesellschaft mit beschränkter Haftung\nBerlin\n\nZu Eintragungsnummer 4 vom 18.09.2025 wird als nicht eingetragen veröffentlicht: Den Gläubigern der an der Verschmelzung beteiligten Rechtsträger ist, wenn sie binnen sechs Monaten nach dem Tag, an dem die Eintragung der Verschmelzung in das Register des Sitzes desjenigen Rechtsträgers, dessen Gläubiger sie sind, als bekannt gemacht gilt, ihren Anspruch nach Grund und Höhe schriftlich anmelden, Sicherheit zu leisten, soweit sie nicht Befriedigung verlangen können. Dieses Recht steht den Gläubigern jedoch nur zu, wenn sie glaubhaft machen, dass durch die Verschmelzung die Erfüllung ihrer Forderung gefährdet wird. Das Recht, Sicherheitsleistung zu verlangen, steht Gläubigern nicht zu, die im Falle der Insolvenz ein Recht auf vorzugsweise Befriedigung aus einer Deckungsmasse haben, die nach gesetzlicher Vorschrift zu ihrem Schutz errichtet und staatlich überwacht ist."
    },
    {
      "date": "2025-09-23",
      "id": "130914",
      "original_text": "Registerbekanntmachung nach dem Umwandlungsgesetz\nBaden-Württemberg Amtsgericht Stuttgart HRB 790450\nSensirion Europe GmbH – Stuttgart",
      "type": "Registerbekanntmachung nach dem Umwandlungsgesetz",
      "state": "Baden-Württemberg",
      "amtsgericht": "Amtsgericht Stuttgart",
      "registernummer": "HRB 790450",
      "registerart": "HRB",
      "company_name": "Sensirion Europe GmbH",
      "company_seat": "Stuttgart",
      "details": "23.09.2025 (Bekanntmachungsdatum)\n\nBaden-Württemberg Amtsgericht Stuttgart HRB 790450\nRegisterbekanntmachung nach dem Umwandlungsgesetz 23.09.2025 (Eintragungsdatum)\n\nSensirion Europe GmbH\nGesellschaft mit beschränkter Haftung\nStuttgart\n\nDen Gläubigern der an der Verschmelzung beteiligten Rechtsträger ist, wenn sie binnen sechs Monaten nach dem Tag, an dem die Eintragung der Verschmelzung in das Register des Sitzes desjenigen Rechtsträgers, dessen Gläubiger sie sind, nach § 19 Abs. 3 UmwG als bekanntgemacht gilt, ihren Anspruch nach Grund und Höhe schriftlich anmelden, Sicherheit zu leisten, soweit sie nicht Befriedigung verlangen können. Dieses Recht steht den Gläubigern jedoch nur zu, wenn sie glaubhaft machen, dass durch die Verschmelzung die Erfüllung ihrer Forderung gefährdet wird."
    },
    {
      "date": "2025-09-23",
      "id": "130915",
      "original_text": "Registerbekanntmachung nach dem Umwandlungsgesetz\nSchleswig-Holstein Amtsgericht Pinneberg HRB 2974\nWalter Burmester GmbH – Rellingen",
      "type": "Registerbekanntmachung nach dem Umwandlungsgesetz",
      "state": "Schleswig-Holstein",
      "amtsgericht": "Amtsgericht Pinneberg",
      "registernummer": "HRB 2974",
      "registerart": "HRB",
      "company_name": "Walter Burmester GmbH",
      "company_seat": "Rellingen",
      "details": "23.09.2025 (Bekanntmachungsdatum)\n\nSchleswig-Holstein Amtsgericht Pinneberg HRB 2974\nRegisterbekanntmachung nach dem Umwandlungsgesetz 22.09.2025 (Eintragungsdatum)\n\nWalter Burmester GmbH\nGesellschaft mit beschränkter Haftung\nRellingen\n\nZu Eintragungsnummer 16 vom 22.09.2025 wird als nicht eingetragen veröffentlicht:  Als nicht eingetragen wird veröffentlicht: Den Gläubigern der an der Spaltung beteiligten Rechtsträger ist, wenn sie binnen sechs Monaten nach dem Tag, an dem die Eintragung der Spaltung in das Register des Sitzes desjenigen Rechtsträgers, dessen Gläubiger sie sind, als bekannt gemacht gilt, ihren Anspruch nach Grund und Höhe schriftlich anmelden, Sicherheit zu leisten, soweit sie nicht Befriedigung verlangen können. Dieses Recht steht den Gläubigern jedoch nur zu, wenn sie glaubhaft machen, dass durch die Spaltung die Erfüllung ihrer Forderung gefährdet wird. Das Recht, Sicherheitsleistung zu verlangen, steht Gläubigern nicht zu, die im Falle der Insolvenz ein Recht auf vorzugsweise Befriedigung aus einer Deckungsmasse haben, die nach gesetzlicher Vorschrift zu ihrem Schutz errichtet und staatlich überwacht ist."
    },
    {
      "date": "2025-09-23",
      "id": "130916",
      "original_text": "Registerbekanntmachung nach dem Umwandlungsgesetz\nBrandenburg Amtsgericht Neuruppin HRA 3161\nH.V.P. Vermögensverwaltungs GmbH & Co. KG – Schwedt/Oder",
      "type": "Registerbekanntmachung nach dem Umwandlungsgesetz",
      "state": "Brandenburg",
      "amtsgericht": "Amtsgericht Neuruppin",
      "registernummer": "HRA 3161",
      "registerart": "HRA",
      "company_name": "H.V.P. Vermögensverwaltungs GmbH & Co. KG",
      "company_seat": "Schwedt/Oder",
      "details": "23.09.2025 (Bekanntmachungsdatum)\n\nBrandenburg Amtsgericht Neuruppin HRA 3161\nRegisterbekanntmachung nach dem Umwandlungsgesetz 22.09.2025 (Eintragungsdatum)\n\nH.V.P. Vermögensverwaltungs GmbH & Co. KG\nKommanditgesellschaft\nSchwedt/Oder\n\nZu Eintragungsnummer 4 vom 22.09.2025 wird als nicht eingetragen veröffentlicht:\nDen Gläubigern der an der Umwandlung beteiligten Rechtsträger ist, wenn sie binnen sechs Monaten nach dem Tag, an dem die Eintragung der Umwandlung in das Register des Sitzes desjenigen Rechtsträgers, dessen Gläubiger sie sind, als bekannt gemacht gilt, ihren Anspruch nach Grund und Höhe schriftlich anmelden, Sicherheit zu leisten, soweit sie nicht Befriedigung verlangen können. Dieses Recht steht den Gläubigern jedoch nur zu, wenn sie glaubhaft machen, dass durch die Umwandlung die Erfüllung ihrer Forderung gefährdet wird"
    },
    {
      "date": "2025-09-23",
      "id": "130917",
      "original_text": "Registerbekanntmachung nach dem Umwandlungsgesetz\nBaden-Württemberg Amtsgericht Mannheim HRB 752893\nVermessung3D GmbH – Mannheim",
      "type": "Registerbekanntmachung nach dem Umwandlungsgesetz",
      "state": "Baden-Württemberg",
      "amtsgericht": "Amtsgericht Mannheim",
      "registernummer": "HRB 752893",
      "registerart": "HRB",
      "company_name": "Vermessung3D GmbH",
      "company_seat": "Mannheim",
      "details": "23.09.2025 (Bekanntmachungsdatum)\n\nBaden-Württemberg Amtsgericht Mannheim HRB 752893\nRegisterbekanntmachung nach dem Umwandlungsgesetz 23.09.2025 (Eintragungsdatum)\n\nVermessung3D GmbH\nGesellschaft mit beschränkter Haftung\nMannheim\n\nDen Gläubigern der an der Ausgliederung beteiligten Rechtsträger ist, wenn sie binnen sechs Monaten nach dem Tag, an dem die Eintragung der Ausgliederung in das Register des Sitzes desjenigen Rechtsträgers, dessen Gläubiger sie sind, nach § 19 Abs. 3 UmwG als bekanntgemacht gilt, ihren Anspruch nach Grund und Höhe schriftlich anmelden, Sicherheit zu leisten, soweit sie nicht Befriedigung verlangen können. Dieses Recht steht den Gläubigern jedoch nur zu, wenn sie glaubhaft machen, dass durch die Ausgliederung die Erfüllung ihrer Forderung gefährdet wird."
    },
    {
      "date": "2025-09-23",
      "id": "130918",
      "original_text": "Registerbekanntmachung nach dem Umwandlungsgesetz\nBaden-Württemberg Amtsgericht Mannheim VR 100183\nBadischer Handball-Verband e.V. – Karlsruhe",
      "type": "Registerbekanntmachung nach dem Umwandlungsgesetz",
      "state": "Baden-Württemberg",
      "amtsgericht": "Amtsgericht Mannheim",
      "registernummer": "VR 100183",
      "registerart": "VR",
      "company_name": "Badischer Handball-Verband e.V.",
      "company_seat": "Karlsruhe",
      "details": "23.09.2025 (Bekanntmachungsdatum)\n\nBaden-Württemberg Amtsgericht Mannheim VR 100183\nRegisterbekanntmachung nach dem Umwandlungsgesetz 23.09.2025 (Eintragungsdatum)\n\nBadischer Handball-Verband e.V.\neingetragener Verein\nKarlsruhe\n\nAls nicht eingetragen wird bekanntgemacht:\nDen Gläubigern der an der Verschmelzung beteiligten Rechtsträger ist, wenn sie binnen sechs Monaten nach dem Tag, an dem die Eintragung der Verschmelzung in das Register des Sitzes desjenigen Rechtsträgers, dessen Gläubiger sie sind, nach § 19 Abs. 3 UmwG als bekanntgemacht gilt, ihren Anspruch nach Grund und Höhe schriftlich anmelden, Sicherheit zu leisten, soweit sie nicht Befriedigung verlangen können. Dieses Recht steht den Gläubigern jedoch nur zu, wenn sie glaubhaft machen, dass durch die Verschmelzung die Erfüllung ihrer Forderung gefährdet wird."
    },
    {
      "date": "2025-09-23",
      "id": "130919",
      "original_text": "Registerbekanntmachung nach dem Umwandlungsgesetz\nBaden-Württemberg Amtsgericht Stuttgart HRB 783837\nSeedbox Ventures Tech & Al Lab GmbH – Stuttgart",
      "type": "Registerbekanntmachung nach dem Umwandlungsgesetz",
      "state": "Baden-Württemberg",
      "amtsgericht": "Amtsgericht Stuttgart",
      "registernummer": "HRB 783837",
      "registerart": "HRB",
      "company_name": "Seedbox Ventures Tech & Al Lab GmbH",
      "company_seat": "Stuttgart",
      "details": "23.09.2025 (Bekanntmachungsdatum)\n\nBaden-Württemberg Amtsgericht Stuttgart HRB 783837\nRegisterbekanntmachung nach dem Umwandlungsgesetz 23.09.2025 (Eintragungsdatum)\n\nSeedbox Ventures Tech & Al Lab GmbH\nGesellschaft mit beschränkter Haftung\nStuttgart\n\nAls nicht eingetragen wird bekanntgemacht:\nDen Gläubigern der an der Verschmelzung beteiligten Rechtsträger ist, wenn sie binnen sechs Monaten nach dem Tag, an dem die Eintragung der Verschmelzung in das Register des Sitzes desjenigen Rechtsträgers, dessen Gläubiger sie sind, nach § 19 Abs. 3 UmwG als bekanntgemacht gilt, ihren Anspruch nach Grund und Höhe schriftlich anmelden, Sicherheit zu leisten, soweit sie nicht Befriedigung verlangen können. Dieses Recht steht den Gläubigern jedoch nur zu, wenn sie glaubhaft machen, dass durch die Verschmelzung die Erfüllung ihrer Forderung gefährdet wird."
    },
    {
      "date": "2025-09-23",
      "id": "130920",
      "original_text": "Löschungsankündigung\nBaden-Württemberg Amtsgericht Mannheim HRB 735074\nAstoria Invest GmbH – Heidelberg",
      "type": "Löschungsankündigung",
      "state": "Baden-Württemberg",
      "amtsgericht": "Amtsgericht Mannheim",
      "registernummer": "HRB 735074",
      "registerart": "HRB",
      "company_name": "Astoria Invest GmbH",
      "company_seat": "Heidelberg",
      "details": "23.09.2025 (Bekanntmachungsdatum)\n\nBaden-Württemberg Amtsgericht Mannheim HRB 735074\nLöschungsankündigung\n\nAstoria Invest GmbH\nGesellschaft mit beschränkter Haftung\nHeidelberg\n\nDas Gericht beabsichtigt, die Gesellschaft wegen Vermögenslosigkeit im Handelsregister von Amts wegen nach § 394 FamFG zu löschen. Die Frist zur Geltendmachung eines Widerspruchs gegen die beabsichtigte Löschung ist auf einen Monat ab Veröffentlichung bestimmt."
    },
    {
      "date": "2025-09-23",
      "id": "130921",
      "original_text": "Löschungsankündigung\nBrandenburg Amtsgericht Potsdam HRA 4430\np:i ShapeClub UG (haftungsbeschränkt) & Co. KG – Potsdam",
      "type": "Löschungsankündigung",
      "state": "Brandenburg",
      "amtsgericht": "Amtsgericht Potsdam",
      "registernummer": "HRA 4430",
      "registerart": "HRA",
      "company_name": "p:i ShapeClub UG (haftungsbeschränkt) & Co. KG",
      "company_seat": "Potsdam",
      "details": "23.09.2025 (Bekanntmachungsdatum)\n\nBrandenburg Amtsgericht Potsdam HRA 4430\nLöschungsankündigung\n\np:i ShapeClub UG (haftungsbeschränkt) & Co. KG\nKommanditgesellschaft\nPotsdam\n\nBei der nachstehenden Gesellschaft wird das Amtslöschungsverfahren gemäß § 394 FamFG eingeleitet. Widerspruchsfrist: 2 Monate."
    },
    {
      "date": "2025-09-23",
      "id": "130922",
      "original_text": "Löschungsankündigung\nBrandenburg Amtsgericht Potsdam HRB 32561\nMAAD Dienstleistung GmbH – Premnitz",
      "type": "Löschungsankündigung",
      "state": "Brandenburg",
      "amtsgericht": "Amtsgericht Potsdam",
      "registernummer": "HRB 32561",
      "registerart": "HRB",
      "company_name": "MAAD Dienstleistung GmbH",
      "company_seat": "Premnitz",
      "details": "23.09.2025 (Bekanntmachungsdatum)\n\nBrandenburg Amtsgericht Potsdam HRB 32561\nLöschungsankündigung\n\nMAAD Dienstleistung GmbH\nGesellschaft mit beschränkter Haftung\nPremnitz\n\nBei der nachstehenden Gesellschaft wird das Amtslöschungsverfahren gemäß § 394 FamFG eingeleitet."
    },
    {
      "date": "2025-09-23",
      "id": "130923",
      "original_text": "Registerbekanntmachung nach dem Umwandlungsgesetz\nBaden-Württemberg Amtsgericht Stuttgart HRB 772539\nWohnraumengel GmbH – Kornwestheim",
      "type": "Registerbekanntmachung nach dem Umwandlungsgesetz",
      "state": "Baden-Württemberg",
      "amtsgericht": "Amtsgericht Stuttgart",
      "registernummer": "HRB 772539",
      "registerart": "HRB",
      "company_name": "Wohnraumengel GmbH",
      "company_seat": "Kornwestheim",
      "details": "23.09.2025 (Bekanntmachungsdatum)\n\nBaden-Württemberg Amtsgericht Stuttgart HRB 772539\nRegisterbekanntmachung nach dem Umwandlungsgesetz 23.09.2025 (Eintragungsdatum)\n\nWohnraumengel GmbH\nGesellschaft mit beschränkter Haftung\nKornwestheim\n\nAls nicht eingetragen wird bekanntgemacht:\nDen Gläubigern der an der Verschmelzung beteiligten Rechtsträger ist, wenn sie binnen sechs Monaten nach dem Tag, an dem die Eintragung der Verschmelzung in das Register des Sitzes desjenigen Rechtsträgers, dessen Gläubiger sie sind, nach § 19 Abs. 3 UmwG als bekanntgemacht gilt, ihren Anspruch nach Grund und Höhe schriftlich anmelden, Sicherheit zu leisten, soweit sie nicht Befriedigung verlangen können. Dieses Recht steht den Gläubigern jedoch nur zu, wenn sie glaubhaft machen, dass durch die Verschmelzung die Erfüllung ihrer Forderung gefährdet wird."
    },
    {
      "date": "2025-09-23",
      "id": "130924",
      "original_text": "Registerbekanntmachung nach dem Umwandlungsgesetz\nBaden-Württemberg Amtsgericht Stuttgart HRB 785076\nDC-Messtechnik GmbH – Oberndorf am Neckar",
      "type": "Registerbekanntmachung nach dem Umwandlungsgesetz",
      "state": "Baden-Württemberg",
      "amtsgericht": "Amtsgericht Stuttgart",
      "registernummer": "HRB 785076",
      "registerart": "HRB",
      "company_name": "DC-Messtechnik GmbH",
      "company_seat": "Oberndorf am Neckar",
      "details": "23.09.2025 (Bekanntmachungsdatum)\n\nBaden-Württemberg Amtsgericht Stuttgart HRB 785076\nRegisterbekanntmachung nach dem Umwandlungsgesetz 23.09.2025 (Eintragungsdatum)\n\nDC-Messtechnik GmbH\nGesellschaft mit beschränkter Haftung\nOberndorf am Neckar\n\nAls nicht eingetragen wird bekanntgemacht:\nDen Gläubigern der an der Verschmelzung beteiligten Rechtsträger ist, wenn sie binnen sechs Monaten nach dem Tag, an dem die Eintragung der Verschmelzung in das Register des Sitzes desjenigen Rechtsträgers, dessen Gläubiger sie sind, nach § 19 Abs. 3 UmwG als bekanntgemacht gilt, ihren Anspruch nach Grund und Höhe schriftlich anmelden, Sicherheit zu leisten, soweit sie nicht Befriedigung verlangen können. Dieses Recht steht den Gläubigern jedoch nur zu, wenn sie glaubhaft machen, dass durch die Verschmelzung die Erfüllung ihrer Forderung gefährdet wird."
    },
    {
      "date": "2025-09-23",
      "id": "130925",
      "original_text": "Registerbekanntmachung nach dem Umwandlungsgesetz\nHamburg Amtsgericht Hamburg HRA 114467\nClouds Hill GmbH & Co. KG – Hamburg",
      "type": "Registerbekanntmachung nach dem Umwandlungsgesetz",
      "state": "Hamburg",
      "amtsgericht": "Amtsgericht Hamburg",
      "registernummer": "HRA 114467",
      "registerart": "HRA",
      "company_name": "Clouds Hill GmbH & Co. KG",
      "company_seat": "Hamburg",
      "details": "23.09.2025 (Bekanntmachungsdatum)\n\nHamburg Amtsgericht Hamburg HRA 114467\nRegisterbekanntmachung nach dem Umwandlungsgesetz 23.09.2025 (Eintragungsdatum)\n\nClouds Hill GmbH & Co. KG\nKommanditgesellschaft\nHamburg\n\nAls nicht eingetragen wird bekannt gemacht:\nDen Gläubigern der an der Verschmelzung beteiligten Gesellschaften ist, wenn sie binnen sechs Monaten nach dem Tag, an dem die Eintragung der Verschmelzung in das Register des Sitzes desjenigen Rechtsträgers, dessen Gläubiger sie sind, nach § 19 Absatz 3 UmwG als bekannt gemacht gilt, ihren Anspruch nach Grund und Höhe schriftlich anmelden, Sicherheit zu leisten, soweit sie nicht Befriedigung verlangen können. Dieses Recht steht den Gläubigern jedoch nur zu, wenn sie glaubhaft machen, dass durch die Verschmelzung die Erfüllung ihrer Forderung gefährdet wird."
    },
    {
      "date": "2025-09-23",
      "id": "130926",
      "original_text": "Löschungsankündigung\nBrandenburg Amtsgericht Frankfurt/Oder HRB 12884\nFarbkonzept GmbH – Hoppegarten",
      "type": "Löschungsankündigung",
      "state": "Brandenburg",
      "amtsgericht": "Amtsgericht Frankfurt/Oder",
      "registernummer": "HRB 12884",
      "registerart": "HRB",
      "company_name": "Farbkonzept GmbH",
      "company_seat": "Hoppegarten",
      "details": "23.09.2025 (Bekanntmachungsdatum)\n\nBrandenburg Amtsgericht Frankfurt/Oder HRB 12884\nLöschungsankündigung\n\nFarbkonzept GmbH\nGesellschaft mit beschränkter Haftung\nHoppegarten\n\nBei der nachstehenden Gesellschaft wird das Amtslöschungsverfahren gemäß § 394 FamFG eingeleitet."
    },
    {
      "date": "2025-09-23",
      "id": "130927",
      "original_text": "Registerbekanntmachung nach dem Umwandlungsgesetz\nSchleswig-Holstein Amtsgericht Kiel HRB 17017\nMurken Holding GmbH – Kiel",
      "type": "Registerbekanntmachung nach dem Umwandlungsgesetz",
      "state": "Schleswig-Holstein",
      "amtsgericht": "Amtsgericht Kiel",
      "registernummer": "HRB 17017",
      "registerart": "HRB",
      "company_name": "Murken Holding GmbH",
      "company_seat": "Kiel",
      "details": "23.09.2025 (Bekanntmachungsdatum)\n\nSchleswig-Holstein Amtsgericht Kiel HRB 17017\nRegisterbekanntmachung nach dem Umwandlungsgesetz 21.09.2025 (Eintragungsdatum)\n\nMurken Holding GmbH\nGesellschaft mit beschränkter Haftung\nKiel\n\nZu Eintragungsnummer 5 vom 21.09.2025 wird als nicht eingetragen veröffentlicht: Den Gläubigern der an der Verschmelzung beteiligten Rechtsträger ist, wenn sie binnen sechs Monaten nach dem Tag, an dem die Eintragung der Verschmelzung in das Register des Sitzes desjenigen Rechtsträgers, dessen Gläubiger sie sind, nach § 19 Abs. 3 UmwG bekannt gemacht worden ist, ihren Anspruch nach Grund und Höhe schriftlich anmelden, Sicherheit zu leisten, soweit sie nicht Befriedigung verlangen können. Dieses Recht steht den Gläubigern jedoch nur zu, wenn sie glaubhaft machen, dass durch die Verschmelzung die Erfüllung ihrer Forderung gefährdet wird."
    },
    {
      "date": "2025-09-23",
      "id": "130928",
      "original_text": "Registerbekanntmachung nach dem Umwandlungsgesetz\nBaden-Württemberg Amtsgericht Stuttgart HRB 798065\nEK-TEAM Elektronik und Kunststofftechnik GmbH – Oppenweiler",
      "type": "Registerbekanntmachung nach dem Umwandlungsgesetz",
      "state": "Baden-Württemberg",
      "amtsgericht": "Amtsgericht Stuttgart",
      "registernummer": "HRB 798065",
      "registerart": "HRB",
      "company_name": "EK-TEAM Elektronik und Kunststofftechnik GmbH",
      "company_seat": "Oppenweiler",
      "details": "23.09.2025 (Bekanntmachungsdatum)\n\nBaden-Württemberg Amtsgericht Stuttgart HRB 798065\nRegisterbekanntmachung nach dem Umwandlungsgesetz 23.09.2025 (Eintragungsdatum)\n\nEK-TEAM Elektronik und Kunststofftechnik GmbH\nGesellschaft mit beschränkter Haftung\nOppenweiler\n\nDen Gläubigern der an der Verschmelzung beteiligten Rechtsträger ist, wenn sie binnen sechs Monaten nach dem Tag, an dem die Eintragung der Verschmelzung in das Register des Sitzes desjenigen Rechtsträgers, dessen Gläubiger sie sind, nach § 19 Abs. 3 UmwG als bekanntgemacht gilt, ihren Anspruch nach Grund und Höhe schriftlich anmelden, Sicherheit zu leisten, soweit sie nicht Befriedigung verlangen können. Dieses Recht steht den Gläubigern jedoch nur zu, wenn sie glaubhaft machen, dass durch die Verschmelzung die Erfüllung ihrer Forderung gefährdet wird."
    },
    {
      "date": "2025-09-23",
      "id": "130929",
      "original_text": "Registerbekanntmachung nach dem Umwandlungsgesetz\nSachsen-Anhalt Amtsgericht Stendal HRB 15160\nSerumwerk Bernburg Vertriebs GmbH – Bernburg (Saale)",
      "type": "Registerbekanntmachung nach dem Umwandlungsgesetz",
      "state": "Sachsen-Anhalt",
      "amtsgericht": "Amtsgericht Stendal",
      "registernummer": "HRB 15160",
      "registerart": "HRB",
      "company_name": "Serumwerk Bernburg Vertriebs GmbH",
      "company_seat": "Bernburg (Saale)",
      "details": "23.09.2025 (Bekanntmachungsdatum)\n\nSachsen-Anhalt Amtsgericht Stendal HRB 15160\nRegisterbekanntmachung nach dem Umwandlungsgesetz 23.09.2025 (Eintragungsdatum)\n\nSerumwerk Bernburg Vertriebs GmbH\nGesellschaft mit beschränkter Haftung\nBernburg (Saale)\n\nNicht eingetragen:\nDen Gläubigern der an der Verschmelzung beteiligten Rechtsträger ist, wenn sie binnen sechs Monaten nach dem Tag, an dem die Eintragung der Verschmelzung nach § 19 Abs. 3 UmwG als bekanntgemacht gilt, ihren Anspruch nach Grund und Höhe schriftlich anmelden, Sicherheit zu leisten, soweit sie nicht Befriedigung verlangen können. Dieses Recht steht ihnen jedoch nur zu, wenn sie glaubhaft machen, dass durch die Verschmelzung die Erfüllung ihrer Forderung gefährdet wird."
    },
    {
      "date": "2025-09-23",
      "id": "130930",
      "original_text": "Registerbekanntmachung nach dem Umwandlungsgesetz\nSachsen-Anhalt Amtsgericht Stendal HRB 24716\nSerumwerk Bernburg Vertriebs GmbH – Bernburg (Saale)",
      "type": "Registerbekanntmachung nach dem Umwandlungsgesetz",
      "state": "Sachsen-Anhalt",
      "amtsgericht": "Amtsgericht Stendal",
      "registernummer": "HRB 24716",
      "registerart": "HRB",
      "company_name": "Serumwerk Bernburg Vertriebs GmbH",
      "company_seat": "Bernburg (Saale)",
      "details": "23.09.2025 (Bekanntmachungsdatum)\n\nSachsen-Anhalt Amtsgericht Stendal HRB 24716\nRegisterbekanntmachung nach dem Umwandlungsgesetz 23.09.2025 (Eintragungsdatum)\n\nSerumwerk Bernburg Vertriebs GmbH\nGesellschaft mit beschränkter Haftung\nBernburg (Saale)\n\nNicht eingetragen:\nDen Gläubigern der an der Verschmelzung beteiligten Rechtsträger ist, wenn sie binnen sechs Monaten nach dem Tag, an dem die Eintragung der Verschmelzung nach § 19 Abs. 3 UmwG als bekanntgemacht gilt, ihren Anspruch nach Grund und Höhe schriftlich anmelden, Sicherheit zu leisten, soweit sie nicht Befriedigung verlangen können. Dieses Recht steht ihnen jedoch nur zu, wenn sie glaubhaft machen, dass durch die Verschmelzung die Erfüllung ihrer Forderung gefährdet wird."
    },
    {
      "date": "2025-09-23",
      "id": "130931",
      "original_text": "Registerbekanntmachung nach dem Umwandlungsgesetz\nBaden-Württemberg Amtsgericht Mannheim HRB 722509\nvi2vi Retail Solution GmbH – Malsch",
      "type": "Registerbekanntmachung nach dem Umwandlungsgesetz",
      "state": "Baden-Württemberg",
      "amtsgericht": "Amtsgericht Mannheim",
      "registernummer": "HRB 722509",
      "registerart": "HRB",
      "company_name": "vi2vi Retail Solution GmbH",
      "company_seat": "Malsch",
      "details": "23.09.2025 (Bekanntmachungsdatum)\n\nBaden-Württemberg Amtsgericht Mannheim HRB 722509\nRegisterbekanntmachung nach dem Umwandlungsgesetz 23.09.2025 (Eintragungsdatum)\n\nvi2vi Retail Solution GmbH\nGesellschaft mit beschränkter Haftung\nMalsch\n\nAls nicht eingetragen wird bekanntgemacht: Den Gläubigern der an der Verschmelzung beteiligten Rechtsträger ist, wenn sie binnen sechs Monaten nach dem Tag, an dem die Eintragung der Verschmelzung in das Register des Sitzes desjenigen Rechtsträgers, dessen Gläubiger sie sind, nach § 19 Abs. 3 UmwG als bekanntgemacht gilt, ihren Anspruch nach Grund und Höhe schriftlich anmelden, Sicherheit zu leisten, soweit sie nicht Befriedigung verlangen können. Dieses Recht steht den Gläubigern jedoch nur zu, wenn sie glaubhaft machen, dass durch die Verschmelzung die Erfüllung ihrer Forderung gefährdet wird."
    },
    {
      "date": "2025-09-23",
      "id": "130932",
      "original_text": "Registerbekanntmachung nach dem Umwandlungsgesetz\nBaden-Württemberg Amtsgericht Mannheim HRB 722509\nvi2vi Retail Solution GmbH – Malsch",
      "type": "Registerbekanntmachung nach dem Umwandlungsgesetz",
      "state": "Baden-Württemberg",
      "amtsgericht": "Amtsgericht Mannheim",
      "registernummer": "HRB 722509",
      "registerart": "HRB",
      "company_name": "vi2vi Retail Solution GmbH",
      "company_seat": "Malsch",
      "details": "23.09.2025 (Bekanntmachungsdatum)\n\nBaden-Württemberg Amtsgericht Mannheim HRB 722509\nRegisterbekanntmachung nach dem Umwandlungsgesetz 23.09.2025 (Eintragungsdatum)\n\nvi2vi Retail Solution GmbH\nGesellschaft mit beschränkter Haftung\nMalsch\n\nAls nicht eingetragen wird bekanntgemacht: Den Gläubigern der an der Verschmelzung beteiligten Rechtsträger ist, wenn sie binnen sechs Monaten nach dem Tag, an dem die Eintragung der Verschmelzung in das Register des Sitzes desjenigen Rechtsträgers, dessen Gläubiger sie sind, nach § 19 Abs. 3 UmwG als bekanntgemacht gilt, ihren Anspruch nach Grund und Höhe schriftlich anmelden, Sicherheit zu leisten, soweit sie nicht Befriedigung verlangen können. Dieses Recht steht den Gläubigern jedoch nur zu, wenn sie glaubhaft machen, dass durch die Verschmelzung die Erfüllung ihrer Forderung gefährdet wird."
    },
    {
      "date": "2025-09-23",
      "id": "130933",
      "original_text": "Registerbekanntmachung nach dem Umwandlungsgesetz\nBaden-Württemberg Amtsgericht Mannheim HRB 722509\nvi2vi Retail Solution GmbH – Malsch",
      "type": "Registerbekanntmachung nach dem Umwandlungsgesetz",
      "state": "Baden-Württemberg",
      "amtsgericht": "Amtsgericht Mannheim",
      "registernummer": "HRB 722509",
      "registerart": "HRB",
      "company_name": "vi2vi Retail Solution GmbH",
      "company_seat": "Malsch",
      "details": "23.09.2025 (Bekanntmachungsdatum)\n\nBaden-Württemberg Amtsgericht Mannheim HRB 722509\nRegisterbekanntmachung nach dem Umwandlungsgesetz 23.09.2025 (Eintragungsdatum)\n\nvi2vi Retail Solution GmbH\nGesellschaft mit beschränkter Haftung\nMalsch\n\nAls nicht eingetragen wird bekanntgemacht: Den Gläubigern der an der Verschmelzung beteiligten Rechtsträger ist, wenn sie binnen sechs Monaten nach dem Tag, an dem die Eintragung der Verschmelzung in das Register des Sitzes desjenigen Rechtsträgers, dessen Gläubiger sie sind, nach § 19 Abs. 3 UmwG als bekanntgemacht gilt, ihren Anspruch nach Grund und Höhe schriftlich anmelden, Sicherheit zu leisten, soweit sie nicht Befriedigung verlangen können. Dieses Recht steht den Gläubigern jedoch nur zu, wenn sie glaubhaft machen, dass durch die Verschmelzung die Erfüllung ihrer Forderung gefährdet wird."
    },
    {
      "date": "2025-09-23",
      "id": "130934",
      "original_text": "Registerbekanntmachung nach dem Umwandlungsgesetz\nBaden-Württemberg Amtsgericht Mannheim HRB 722509\nvi2vi Retail Solution GmbH – Malsch",
      "type": "Registerbekanntmachung nach dem Umwandlungsgesetz",
      "state": "Baden-Württemberg",
      "amtsgericht": "Amtsgericht Mannheim",
      "registernummer": "HRB 722509",
      "registerart": "HRB",
      "company_name": "vi2vi Retail Solution GmbH",
      "company_seat": "Malsch",
      "details": "23.09.2025 (Bekanntmachungsdatum)\n\nBaden-Württemberg Amtsgericht Mannheim HRB 722509\nRegisterbekanntmachung nach dem Umwandlungsgesetz 23.09.2025 (Eintragungsdatum)\n\nvi2vi Retail Solution GmbH\nGesellschaft mit beschränkter Haftung\nMalsch\n\nAls nicht eingetragen wird bekanntgemacht: Den Gläubigern der an der Verschmelzung beteiligten Rechtsträger ist, wenn sie binnen sechs Monaten nach dem Tag, an dem die Eintragung der Verschmelzung in das Register des Sitzes desjenigen Rechtsträgers, dessen Gläubiger sie sind, nach § 19 Abs. 3 UmwG als bekanntgemacht gilt, ihren Anspruch nach Grund und Höhe schriftlich anmelden, Sicherheit zu leisten, soweit sie nicht Befriedigung verlangen können. Dieses Recht steht den Gläubigern jedoch nur zu, wenn sie glaubhaft machen, dass durch die Verschmelzung die Erfüllung ihrer Forderung gefährdet wird."
    },
    {
      "date": "2025-09-23",
      "id": "130935",
      "original_text": "Registerbekanntmachung nach dem Umwandlungsgesetz\nHamburg Amtsgericht Hamburg HRB 72745\nSCHOLZ & FRIENDS Hamburg GmbH – Hamburg",
      "type": "Registerbekanntmachung nach dem Umwandlungsgesetz",
      "state": "Hamburg",
      "amtsgericht": "Amtsgericht Hamburg",
      "registernummer": "HRB 72745",
      "registerart": "HRB",
      "company_name": "SCHOLZ & FRIENDS Hamburg GmbH",
      "company_seat": "Hamburg",
      "details": "23.09.2025 (Bekanntmachungsdatum)\n\nHamburg Amtsgericht Hamburg HRB 72745\nRegisterbekanntmachung nach dem Umwandlungsgesetz 23.09.2025 (Eintragungsdatum)\n\nSCHOLZ & FRIENDS Hamburg GmbH\nGesellschaft mit beschränkter Haftung\nHamburg\n\nAls nicht eingetragen wird bekannt gemacht:\nDen Gläubigern der an der Verschmelzung beteiligten Gesellschaften ist, wenn sie binnen sechs Monaten nach dem Tag, an dem die Eintragung der Verschmelzung in das Register des Sitzes desjenigen Rechtsträgers, dessen Gläubiger sie sind, nach § 19 Absatz 3 UmwG als bekannt gemacht gilt, ihren Anspruch nach Grund und Höhe schriftlich anmelden, Sicherheit zu leisten, soweit sie nicht Befriedigung verlangen können. Dieses Recht steht den Gläubigern jedoch nur zu, wenn sie glaubhaft machen, dass durch die Verschmelzung die Erfüllung ihrer Forderung gefährdet wird."
    },
    {
      "date": "2025-09-23",
      "id": "130936",
      "original_text": "Registerbekanntmachung nach dem Umwandlungsgesetz\nBerlin Amtsgericht Berlin (Charlottenburg) HRA 64737\nGhenie Studios GmbH & Co. KG – Berlin",
      "type": "Registerbekanntmachung nach dem Umwandlungsgesetz",
      "state": "Berlin",
      "amtsgericht": "Amtsgericht Berlin (Charlottenburg)",
      "registernummer": "HRA 64737",
      "registerart": "HRA",
      "company_name": "Ghenie Studios GmbH & Co. KG",
      "company_seat": "Berlin",
      "details": "23.09.2025 (Bekanntmachungsdatum)\n\nBerlin Amtsgericht Berlin (Charlottenburg) HRA 64737\nRegisterbekanntmachung nach dem Umwandlungsgesetz 18.09.2025 (Eintragungsdatum)\n\nGhenie Studios GmbH & Co. KG\nKommanditgesellschaft\nBerlin\n\nZu Eintragungsnummer 1 vom 18.09.2025 wird als nicht eingetragen veröffentlicht: Den Gläubigern ist, wenn sie binnen sechs Monaten nach dem Tag, an dem die Eintragung der Umwandlung als bekannt gemacht gilt, ihren Anspruch nach Grund und Höhe schriftlich anmelden, Sicherheit zu leisten, soweit sie nicht Befriedigung verlangen können. Dieses Recht steht den Gläubigern jedoch nur zu, wenn sie glaubhaft machen, dass durch die Umwandlung die Erfüllung ihrer Forderung gefährdet wird. Das Recht, Sicherheitsleistung zu verlangen, steht Gläubigern nicht zu, die im Falle der Insolvenz ein Recht auf vorzugsweise Befriedigung aus einer Deckungsmasse haben, die nach gesetzlicher Vorschrift zu ihrem Schutz errichtet und staatlich überwacht ist."
    },
    {
      "date": "2025-09-23",
      "id": "130937",
      "original_text": "Registerbekanntmachung nach dem Umwandlungsgesetz\nBerlin Amtsgericht Berlin (Charlottenburg) HRB 227995\nGerman Organic Brands GmbH – Berlin",
      "type": "Registerbekanntmachung nach dem Umwandlungsgesetz",
      "state": "Berlin",
      "amtsgericht": "Amtsgericht Berlin (Charlottenburg)",
      "registernummer": "HRB 227995",
      "registerart": "HRB",
      "company_name": "German Organic Brands GmbH",
      "company_seat": "Berlin",
      "details": "23.09.2025 (Bekanntmachungsdatum)\n\nBerlin Amtsgericht Berlin (Charlottenburg) HRB 227995\nRegisterbekanntmachung nach dem Umwandlungsgesetz 22.09.2025 (Eintragungsdatum)\n\nGerman Organic Brands GmbH\nGesellschaft mit beschränkter Haftung\nBerlin\n\nZu Eintragungsnummer 4 vom 22.09.2025 wird als nicht eingetragen veröffentlicht: Den Gläubigern der an der Verschmelzung beteiligten Rechtsträger ist, wenn sie binnen sechs Monaten nach dem Tag, an dem die Eintragung der Verschmelzung in das Register des Sitzes desjenigen Rechtsträgers, dessen Gläubiger sie sind, als bekannt gemacht gilt, ihren Anspruch nach Grund und Höhe schriftlich anmelden, Sicherheit zu leisten, soweit sie nicht Befriedigung verlangen können. Dieses Recht steht den Gläubigern jedoch nur zu, wenn sie glaubhaft machen, dass durch die Verschmelzung die Erfüllung ihrer Forderung gefährdet wird. Das Recht, Sicherheitsleistung zu verlangen, steht Gläubigern nicht zu, die im Falle der Insolvenz ein Recht auf vorzugsweise Befriedigung aus einer Deckungsmasse haben, die nach gesetzlicher Vorschrift zu ihrem Schutz errichtet und staatlich überwacht ist."
    },
    {
      "date": "2025-09-23",
      "id": "130938",
      "original_text": "Registerbekanntmachung nach dem Umwandlungsgesetz\nBaden-Württemberg Amtsgericht Mannheim HRB 731001\nPro Concept Projektbau Wredestraße GmbH – Mannheim",
      "type": "Registerbekanntmachung nach dem Umwandlungsgesetz",
      "state": "Baden-Württemberg",
      "amtsgericht": "Amtsgericht Mannheim",
      "registernummer": "HRB 731001",
      "registerart": "HRB",
      "company_name": "Pro Concept Projektbau Wredestraße GmbH",
      "company_seat": "Mannheim",
      "details": "23.09.2025 (Bekanntmachungsdatum)\n\nBaden-Württemberg Amtsgericht Mannheim HRB 731001\nRegisterbekanntmachung nach dem Umwandlungsgesetz 23.09.2025 (Eintragungsdatum)\n\nPro Concept Projektbau Wredestraße GmbH\nGesellschaft mit beschränkter Haftung\nMannheim\n\nDen Gläubigern der an der Verschmelzung beteiligten Rechtsträger ist, wenn sie binnen sechs Monaten nach dem Tag, an dem die Eintragung der Verschmelzung in das Register des Sitzes desjenigen Rechtsträgers, dessen Gläubiger sie sind, nach § 19 Abs. 3 UmwG als bekanntgemacht gilt, ihren Anspruch nach Grund und Höhe schriftlich anmelden, Sicherheit zu leisten, soweit sie nicht Befriedigung verlangen können. Dieses Recht steht den Gläubigern jedoch nur zu, wenn sie glaubhaft machen, dass durch die Verschmelzung die Erfüllung ihrer Forderung gefährdet wird."
    },
    {
      "date": "2025-09-23",
      "id": "130939",
      "original_text": "Registerbekanntmachung nach dem Umwandlungsgesetz\nBaden-Württemberg Amtsgericht Mannheim HRB 722774\nvi2vi GMS GmbH – Malsch",
      "type": "Registerbekanntmachung nach dem Umwandlungsgesetz",
      "state": "Baden-Württemberg",
      "amtsgericht": "Amtsgericht Mannheim",
      "registernummer": "HRB 722774",
      "registerart": "HRB",
      "company_name": "vi2vi GMS GmbH",
      "company_seat": "Malsch",
      "details": "23.09.2025 (Bekanntmachungsdatum)\n\nBaden-Württemberg Amtsgericht Mannheim HRB 722774\nRegisterbekanntmachung nach dem Umwandlungsgesetz 23.09.2025 (Eintragungsdatum)\n\nvi2vi GMS GmbH\nGesellschaft mit beschränkter Haftung\nMalsch\n\nDen Gläubigern der an der Verschmelzung beteiligten Rechtsträger ist, wenn sie binnen sechs Monaten nach dem Tag, an dem die Eintragung der Verschmelzung in das Register des Sitzes desjenigen Rechtsträgers, dessen Gläubiger sie sind, nach § 19 Abs. 3 UmwG als bekanntgemacht gilt, ihren Anspruch nach Grund und Höhe schriftlich anmelden, Sicherheit zu leisten, soweit sie nicht Befriedigung verlangen können. Dieses Recht steht den Gläubigern jedoch nur zu, wenn sie glaubhaft machen, dass durch die Verschmelzung die Erfüllung ihrer Forderung gefährdet wird."
    },
    {
      "date": "2025-09-23",
      "id": "130940",
      "original_text": "Löschungsankündigung\nSchleswig-Holstein Amtsgericht Flensburg HRB 14100\nimmo-admin24.de GmbH – Glücksburg",
      "type": "Löschungsankündigung",
      "state": "Schleswig-Holstein",
      "amtsgericht": "Amtsgericht Flensburg",
      "registernummer": "HRB 14100",
      "registerart": "HRB",
      "company_name": "immo-admin24.de GmbH",
      "company_seat": "Glücksburg",
      "details": "23.09.2025 (Bekanntmachungsdatum)\n\nSchleswig-Holstein Amtsgericht Flensburg HRB 14100\nLöschungsankündigung\n\nimmo-admin24.de GmbH\nGesellschaft mit beschränkter Haftung\nGlücksburg\n\nEs ist die Löschung der nachstehenden Gesellschaft wegen Vermögenslosigkeit gemäß § 394 FamFG beabsichtigt.\nWiderspruchsfrist: 2 Monate."
    },
    {
      "date": "2025-09-23",
      "id": "130941",
      "original_text": "Registerbekanntmachung nach dem Umwandlungsgesetz\nBerlin Amtsgericht Berlin (Charlottenburg) HRB 45934\nB & P Dentatech GmbH – Berlin",
      "type": "Registerbekanntmachung nach dem Umwandlungsgesetz",
      "state": "Berlin",
      "amtsgericht": "Amtsgericht Berlin (Charlottenburg)",
      "registernummer": "HRB 45934",
      "registerart": "HRB",
      "company_name": "B & P Dentatech GmbH",
      "company_seat": "Berlin",
      "details": "23.09.2025 (Bekanntmachungsdatum)\n\nBerlin Amtsgericht Berlin (Charlottenburg) HRB 45934\nRegisterbekanntmachung nach dem Umwandlungsgesetz 22.09.2025 (Eintragungsdatum)\n\nB & P Dentatech GmbH\nGesellschaft mit beschränkter Haftung\nBerlin\n\nZu Eintragungsnummer 5 vom 22.09.2025 wird als nicht eingetragen veröffentlicht:\n\nDen Gläubigern der an der Verschmelzung beteiligten Rechtsträger ist, wenn sie binnen sechs Monaten nach dem Tag, an dem die Eintragung der Verschmelzung in das Register des Sitzes desjenigen Rechtsträgers, dessen Gläubiger sie sind, als bekannt gemacht gilt, ihren Anspruch nach Grund und Höhe schriftlich anmelden, Sicherheit zu leisten, soweit sie nicht Befriedigung verlangen können. Dieses Recht steht den Gläubigern jedoch nur zu, wenn sie glaubhaft machen, dass durch die Verschmelzung die Erfüllung ihrer Forderung gefährdet wird. Das Recht, Sicherheitsleistung zu verlangen, steht Gläubigern nicht zu, die im Falle der Insolvenz ein Recht auf vorzugsweise Befriedigung aus einer Deckungsmasse haben, die nach gesetzlicher Vorschrift zu ihrem Schutz errichtet und staatlich überwacht ist."
    },
    {
      "date": "2025-09-23",
      "id": "130942",
      "original_text": "Registerbekanntmachung nach dem Umwandlungsgesetz\nBaden-Württemberg Amtsgericht Mannheim HRA 712760\nskin [mi] Labor & Labels e.K. – Baden-Baden",
      "type": "Registerbekanntmachung nach dem Umwandlungsgesetz",
      "state": "Baden-Württemberg",
      "amtsgericht": "Amtsgericht Mannheim",
      "registernummer": "HRA 712760",
      "registerart": "HRA",
      "company_name": "skin [mi] Labor & Labels e.K.",
      "company_seat": "Baden-Baden",
      "details": "23.09.2025 (Bekanntmachungsdatum)\n\nBaden-Württemberg Amtsgericht Mannheim HRA 712760\nRegisterbekanntmachung nach dem Umwandlungsgesetz 23.09.2025 (Eintragungsdatum)\n\nskin [mi] Labor & Labels e.K.\nEinzelkaufmann / Einzelkauffrau\nBaden-Baden\n\nAls nicht eingetragen wird bekanntgemacht:\nDen Gläubigern der an der Ausgliederung beteiligten Rechtsträger ist, wenn sie binnen sechs Monaten nach dem Tag, an dem die Eintragung der Ausgliederung in das Register des Sitzes desjenigen Rechtsträgers, dessen Gläubiger sie sind, nach § 19 Abs. 3 UmwG als bekanntgemacht gilt, ihren Anspruch nach Grund und Höhe schriftlich anmelden, Sicherheit zu leisten, soweit sie nicht Befriedigung verlangen können. Dieses Recht steht den Gläubigern jedoch nur zu, wenn sie glaubhaft machen, dass durch die Ausgliederung die Erfüllung ihrer Forderung gefährdet wird."
    },
    {
      "date": "2025-09-23",
      "id": "130943",
      "original_text": "Registerbekanntmachung nach dem Umwandlungsgesetz\nBaden-Württemberg Amtsgericht Freiburg HRB 717285\nHAR Holding AG – Oppenau",
      "type": "Registerbekanntmachung nach dem Umwandlungsgesetz",
      "state": "Baden-Württemberg",
      "amtsgericht": "Amtsgericht Freiburg",
      "registernummer": "HRB 717285",
      "registerart": "HRB",
      "company_name": "HAR Holding AG",
      "company_seat": "Oppenau",
      "details": "23.09.2025 (Bekanntmachungsdatum)\n\nBaden-Württemberg Amtsgericht Freiburg HRB 717285\nRegisterbekanntmachung nach dem Umwandlungsgesetz\n\nHAR Holding AG\nAktiengesellschaft\nOppenau\n\nAls nicht eingetragen wird bekanntgemacht:\nDie Gesellschaft hat am 18.09.2025 den Umwandlungsplan betreffend die formwechselnde Umwandlung der hiesigen Gesellschaft \"HAR Holding AG\", Oppenau (Amtsgericht Freiburg i. Br. HRB 717285) in die “HAR Group SE“, Oppenau zum Handelsregister eingereicht."
    },
    {
      "date": "2025-09-23",
      "id": "130944",
      "original_text": "Registerbekanntmachung nach dem Umwandlungsgesetz\nBaden-Württemberg Amtsgericht Mannheim HRB 731001\nPro Concept Projektbau Wredestraße GmbH – Mannheim",
      "type": "Registerbekanntmachung nach dem Umwandlungsgesetz",
      "state": "Baden-Württemberg",
      "amtsgericht": "Amtsgericht Mannheim",
      "registernummer": "HRB 731001",
      "registerart": "HRB",
      "company_name": "Pro Concept Projektbau Wredestraße GmbH",
      "company_seat": "Mannheim",
      "details": "23.09.2025 (Bekanntmachungsdatum)\n\nBaden-Württemberg Amtsgericht Mannheim HRB 731001\nRegisterbekanntmachung nach dem Umwandlungsgesetz 23.09.2025 (Eintragungsdatum)\n\nPro Concept Projektbau Wredestraße GmbH\nGesellschaft mit beschränkter Haftung\nMannheim\n\nDen Gläubigern der an der Verschmelzung beteiligten Rechtsträger ist, wenn sie binnen sechs Monaten nach dem Tag, an dem die Eintragung der Verschmelzung in das Register des Sitzes desjenigen Rechtsträgers, dessen Gläubiger sie sind, nach § 19 Abs. 3 UmwG als bekanntgemacht gilt, ihren Anspruch nach Grund und Höhe schriftlich anmelden, Sicherheit zu leisten, soweit sie nicht Befriedigung verlangen können. Dieses Recht steht den Gläubigern jedoch nur zu, wenn sie glaubhaft machen, dass durch die Verschmelzung die Erfüllung ihrer Forderung gefährdet wird."
    },
    {
      "date": "2025-09-23",
      "id": "130945",
      "original_text": "Registerbekanntmachung nach dem Umwandlungsgesetz\nBaden-Württemberg Amtsgericht Stuttgart HRB 800909\nHenzler Dienstleistungen GmbH – Riederich",
      "type": "Registerbekanntmachung nach dem Umwandlungsgesetz",
      "state": "Baden-Württemberg",
      "amtsgericht": "Amtsgericht Stuttgart",
      "registernummer": "HRB 800909",
      "registerart": "HRB",
      "company_name": "Henzler Dienstleistungen GmbH",
      "company_seat": "Riederich",
      "details": "23.09.2025 (Bekanntmachungsdatum)\n\nBaden-Württemberg Amtsgericht Stuttgart HRB 800909\nRegisterbekanntmachung nach dem Umwandlungsgesetz 23.09.2025 (Eintragungsdatum)\n\nHenzler Dienstleistungen GmbH\nGesellschaft mit beschränkter Haftung\nRiederich\n\nDen Gläubigern der an der Ausgliederung beteiligten Rechtsträger ist, wenn sie binnen sechs Monaten nach dem Tag, an dem die Eintragung der Ausgliederung in das Register des Sitzes desjenigen Rechtsträgers, dessen Gläubiger sie sind, nach § 19 Abs. 3 UmwG als bekanntgemacht gilt, ihren Anspruch nach Grund und Höhe schriftlich anmelden, Sicherheit zu leisten, soweit sie nicht Befriedigung verlangen können. Dieses Recht steht den Gläubigern jedoch nur zu, wenn sie glaubhaft machen, dass durch die Ausgliederung die Erfüllung ihrer Forderung gefährdet wird."
    },
    {
      "date": "2025-09-23",
      "id": "130946",
      "original_text": "Registerbekanntmachung nach dem Umwandlungsgesetz\nBaden-Württemberg Amtsgericht Mannheim HRB 755311\nskin [mi] GmbH – Baden-Baden",
      "type": "Registerbekanntmachung nach dem Umwandlungsgesetz",
      "state": "Baden-Württemberg",
      "amtsgericht": "Amtsgericht Mannheim",
      "registernummer": "HRB 755311",
      "registerart": "HRB",
      "company_name": "skin [mi] GmbH",
      "company_seat": "Baden-Baden",
      "details": "23.09.2025 (Bekanntmachungsdatum)\n\nBaden-Württemberg Amtsgericht Mannheim HRB 755311\nRegisterbekanntmachung nach dem Umwandlungsgesetz 23.09.2025 (Eintragungsdatum)\n\nskin [mi] GmbH\nGesellschaft mit beschränkter Haftung\nBaden-Baden\n\nAls nicht eingetragen wird bekanntgemacht:\nDen Gläubigern der an der Ausgliederung beteiligten Rechtsträger ist, wenn sie binnen sechs Monaten nach dem Tag, an dem die Eintragung der Ausgliederung in das Register des Sitzes desjenigen Rechtsträgers, dessen Gläubiger sie sind, nach § 19 Abs. 3 UmwG als bekanntgemacht gilt, ihren Anspruch nach Grund und Höhe schriftlich anmelden, Sicherheit zu leisten, soweit sie nicht Befriedigung verlangen können. Dieses Recht steht den Gläubigern jedoch nur zu, wenn sie glaubhaft machen, dass durch die Ausgliederung die Erfüllung ihrer Forderung gefährdet wird."
    },
    {
      "date": "2025-09-23",
      "id": "130947",
      "original_text": "Registerbekanntmachung nach dem Umwandlungsgesetz\nBaden-Württemberg Amtsgericht Mannheim HRB 731001\nPro Concept Projektbau Wredestraße GmbH – Mannheim",
      "type": "Registerbekanntmachung nach dem Umwandlungsgesetz",
      "state": "Baden-Württemberg",
      "amtsgericht": "Amtsgericht Mannheim",
      "registernummer": "HRB 731001",
      "registerart": "HRB",
      "company_name": "Pro Concept Projektbau Wredestraße GmbH",
      "company_seat": "Mannheim",
      "details": "23.09.2025 (Bekanntmachungsdatum)\n\nBaden-Württemberg Amtsgericht Mannheim HRB 731001\nRegisterbekanntmachung nach dem Umwandlungsgesetz 23.09.2025 (Eintragungsdatum)\n\nPro Concept Projektbau Wredestraße GmbH\nGesellschaft mit beschränkter Haftung\nMannheim\n\nDen Gläubigern der an der Verschmelzung beteiligten Rechtsträger ist, wenn sie binnen sechs Monaten nach dem Tag, an dem die Eintragung der Verschmelzung in das Register des Sitzes desjenigen Rechtsträgers, dessen Gläubiger sie sind, nach § 19 Abs. 3 UmwG als bekanntgemacht gilt, ihren Anspruch nach Grund und Höhe schriftlich anmelden, Sicherheit zu leisten, soweit sie nicht Befriedigung verlangen können. Dieses Recht steht den Gläubigern jedoch nur zu, wenn sie glaubhaft machen, dass durch die Verschmelzung die Erfüllung ihrer Forderung gefährdet wird."
    },
    {
      "date": "2025-09-23",
      "id": "130948",
      "original_text": "Löschungsankündigung\nMecklenburg-Vorpommern Amtsgericht Neubrandenburg HRB 5307\nU & V Umwelttechnik-Vertriebs GmbH – Dargun",
      "type": "Löschungsankündigung",
      "state": "Mecklenburg-Vorpommern",
      "amtsgericht": "Amtsgericht Neubrandenburg",
      "registernummer": "HRB 5307",
      "registerart": "HRB",
      "company_name": "U & V Umwelttechnik-Vertriebs GmbH",
      "company_seat": "Dargun",
      "details": "23.09.2025 (Bekanntmachungsdatum)\n\nMecklenburg-Vorpommern Amtsgericht Neubrandenburg HRB 5307\nLöschungsankündigung 23.09.2025 (Eintragungsdatum)\n\nU & V Umwelttechnik-Vertriebs GmbH\nGesellschaft mit beschränkter Haftung\nDargun\n\nDas Registergericht beabsichtigt, die im Handelsregister eingetragene Gesellschaft von Amts wegen nach § 394 FamFG zu löschen. Die Frist zur Erhebung eines Widerspruchs gegen die beabsichtigte Löschung wird auf drei Monate festgesetzt."
    },
    {
      "date": "2025-09-23",
      "id": "130949",
      "original_text": "Sonstige Registerbekanntmachung\nBerlin Amtsgericht Berlin (Charlottenburg) HRB 172305\nCEO Transformation GmbH – Berlin",
      "type": "Sonstige Registerbekanntmachung",
      "state": "Berlin",
      "amtsgericht": "Amtsgericht Berlin (Charlottenburg)",
      "registernummer": "HRB 172305",
      "registerart": "HRB",
      "company_name": "CEO Transformation GmbH",
      "company_seat": "Berlin",
      "details": "23.09.2025 (Bekanntmachungsdatum)\n\nBerlin Amtsgericht Berlin (Charlottenburg) HRB 172305\nSonstige Registerbekanntmachung\n\nCEO Transformation GmbH\nGesellschaft mit beschränkter Haftung\nBerlin\n\nAls nicht eingetragen wird veröffentlicht:\n\nDer andere Vertragsteil hat den Gläubigern dieses Rechtsträgers, deren Forderungen begründet worden sind, bevor die Eintragung der Beendigung dieses Vertrages in das Handelsregister nach § 10 des Handelsgesetzbuches als bekannt gemacht gilt, Sicherheit zu leisten, wenn sie sich binnen sechs Monaten nach der Bekanntmachung der Eintragung zu diesem Zweck bei ihm melden. Dieses Recht steht den Gläubigern nicht zu, die im Fall des Insolvenzverfahrens ein Recht auf vorzugsweise Befriedigung aus der Deckungsmasse haben, die nach gesetzlicher Vorschrift zu ihrem Schutz errichtet und staatlich überwacht ist."
    },
    {
      "date": "2025-09-23",
      "id": "130950",
      "original_text": "Registerbekanntmachung nach dem Umwandlungsgesetz\nSchleswig-Holstein Amtsgericht Lübeck HRB 24453\nNorthern Capital and Trade 23 GmbH – Stapelfeld",
      "type": "Registerbekanntmachung nach dem Umwandlungsgesetz",
      "state": "Schleswig-Holstein",
      "amtsgericht": "Amtsgericht Lübeck",
      "registernummer": "HRB 24453",
      "registerart": "HRB",
      "company_name": "Northern Capital and Trade 23 GmbH",
      "company_seat": "Stapelfeld",
      "details": "23.09.2025 (Bekanntmachungsdatum)\n\nSchleswig-Holstein Amtsgericht Lübeck HRB 24453\nRegisterbekanntmachung nach dem Umwandlungsgesetz 22.09.2025 (Eintragungsdatum)\n\nNorthern Capital and Trade 23 GmbH\nGesellschaft mit beschränkter Haftung\nStapelfeld\n\nZu Eintragungsnummer 5 vom 22.09.2025 wird als nicht eingetragen veröffentlicht: Den Gläubigern der an der Verschmelzung beteiligten Rechtsträger ist, wenn sie binnen sechs Monaten nach dem Tag, an dem die Eintragung der Verschmelzung in das Register des Sitzes desjenigen Rechtsträgers, dessen Gläubiger sie sind, als bekannt gemacht gilt, ihren Anspruch nach Grund und Höhe schriftlich anmelden, Sicherheit zu leisten, soweit sie nicht Befriedigung verlangen können. Dieses Recht steht den Gläubigern jedoch nur zu, wenn sie glaubhaft machen, dass durch die Verschmelzung die Erfüllung ihrer Forderung gefährdet wird."
    },
    {
      "date": "2025-09-23",
      "id": "130951",
      "original_text": "Registerbekanntmachung nach dem Umwandlungsgesetz\nBaden-Württemberg Amtsgericht Mannheim HRA 712486\nSchollmeier ITK GmbH & Co. KG – Mannheim",
      "type": "Registerbekanntmachung nach dem Umwandlungsgesetz",
      "state": "Baden-Württemberg",
      "amtsgericht": "Amtsgericht Mannheim",
      "registernummer": "HRA 712486",
      "registerart": "HRA",
      "company_name": "Schollmeier ITK GmbH & Co. KG",
      "company_seat": "Mannheim",
      "details": "23.09.2025 (Bekanntmachungsdatum)\n\nBaden-Württemberg Amtsgericht Mannheim HRA 712486\nRegisterbekanntmachung nach dem Umwandlungsgesetz 23.09.2025 (Eintragungsdatum)\n\nSchollmeier ITK GmbH & Co. KG\nKommanditgesellschaft\nMannheim\n\nDen Gläubigern der an der Ausgliederung beteiligten Rechtsträger ist, wenn sie binnen sechs Monaten nach dem Tag, an dem die Eintragung der Ausgliederung in das Register des Sitzes desjenigen Rechtsträgers, dessen Gläubiger sie sind, nach § 19 Abs. 3 UmwG als bekanntgemacht gilt, ihren Anspruch nach Grund und Höhe schriftlich anmelden, Sicherheit zu leisten, soweit sie nicht Befriedigung verlangen können. Dieses Recht steht den Gläubigern jedoch nur zu, wenn sie glaubhaft machen, dass durch die Ausgliederung die Erfüllung ihrer Forderung gefährdet wird."
    },
    {
      "date": "2025-09-23",
      "id": "130952",
      "original_text": "Sonstige Registerbekanntmachung\nHamburg Amtsgericht Hamburg HRB 66321\nPerkunos Capital AG – Hamburg",
      "type": "Sonstige Registerbekanntmachung",
      "state": "Hamburg",
      "amtsgericht": "Amtsgericht Hamburg",
      "registernummer": "HRB 66321",
      "registerart": "HRB",
      "company_name": "Perkunos Capital AG",
      "company_seat": "Hamburg",
      "details": "23.09.2025 (Bekanntmachungsdatum)\n\nHamburg Amtsgericht Hamburg HRB 66321\nSonstige Registerbekanntmachung\n\nPerkunos Capital AG\nAktiengesellschaft\nHamburg\n\nAls nicht eingetragen wird bekannt gemacht: Liste des Aufsichtsrats wurde eingereicht."
    },
    {
      "date": "2025-09-23",
      "id": "130953",
      "original_text": "Registerbekanntmachung nach dem Umwandlungsgesetz\nBerlin Amtsgericht Berlin (Charlottenburg) HRA 64254\nHotel Brandies Berlin e.K. – Berlin",
      "type": "Registerbekanntmachung nach dem Umwandlungsgesetz",
      "state": "Berlin",
      "amtsgericht": "Amtsgericht Berlin (Charlottenburg)",
      "registernummer": "HRA 64254",
      "registerart": "HRA",
      "company_name": "Hotel Brandies Berlin e.K.",
      "company_seat": "Berlin",
      "details": "23.09.2025 (Bekanntmachungsdatum)\n\nBerlin Amtsgericht Berlin (Charlottenburg) HRA 64254\nRegisterbekanntmachung nach dem Umwandlungsgesetz 22.09.2025 (Eintragungsdatum)\n\nHotel Brandies Berlin e.K.\nEinzelkaufmann / Einzelkauffrau\nBerlin\n\nZu Eintragungsnummer 2 vom 22.09.2025 wird als nicht eingetragen veröffentlicht: Den Gläubigern der an der Spaltung beteiligten Rechtsträger ist, wenn sie binnen sechs Monaten nach dem Tag, an dem die Eintragung der Spaltung in das Register des Sitzes desjenigen Rechtsträgers, dessen Gläubiger sie sind, als bekannt gemacht gilt, ihren Anspruch nach Grund und Höhe schriftlich anmelden, Sicherheit zu leisten, soweit sie nicht Befriedigung verlangen können. Dieses Recht steht den Gläubigern jedoch nur zu, wenn sie glaubhaft machen, dass durch die Spaltung die Erfüllung ihrer Forderung gefährdet wird. Das Recht, Sicherheitsleistung zu verlangen, steht Gläubigern nicht zu, die im Falle der Insolvenz ein Recht auf vorzugsweise Befriedigung aus einer Deckungsmasse haben, die nach gesetzlicher Vorschrift zu ihrem Schutz errichtet und staatlich überwacht ist."
    },
    {
      "date": "2025-09-23",
      "id": "130954",
      "original_text": "Registerbekanntmachung nach dem Umwandlungsgesetz\nBaden-Württemberg Amtsgericht Mannheim HRA 2526\nSchollmeier Autofunk e.K. – Mannheim",
      "type": "Registerbekanntmachung nach dem Umwandlungsgesetz",
      "state": "Baden-Württemberg",
      "amtsgericht": "Amtsgericht Mannheim",
      "registernummer": "HRA 2526",
      "registerart": "HRA",
      "company_name": "Schollmeier Autofunk e.K.",
      "company_seat": "Mannheim",
      "details": "23.09.2025 (Bekanntmachungsdatum)\n\nBaden-Württemberg Amtsgericht Mannheim HRA 2526\nRegisterbekanntmachung nach dem Umwandlungsgesetz 23.09.2025 (Eintragungsdatum)\n\nSchollmeier Autofunk e.K.\nEinzelkaufmann / Einzelkauffrau\nMannheim\n\nDen Gläubigern der an der Ausgliederung beteiligten Rechtsträger ist, wenn sie binnen sechs Monaten nach dem Tag, an dem die Eintragung der Ausgliederung in das Register des Sitzes desjenigen Rechtsträgers, dessen Gläubiger sie sind, nach § 19 Abs. 3 UmwG als bekanntgemacht gilt, ihren Anspruch nach Grund und Höhe schriftlich anmelden, Sicherheit zu leisten, soweit sie nicht Befriedigung verlangen können. Dieses Recht steht den Gläubigern jedoch nur zu, wenn sie glaubhaft machen, dass durch die Ausgliederung die Erfüllung ihrer Forderung gefährdet wird."
    },
    {
      "date": "2025-09-23",
      "id": "130955",
      "original_text": "Registerbekanntmachung nach dem Umwandlungsgesetz\nSachsen-Anhalt Amtsgericht Stendal GsR 756\nIK - Industrieservice eGbR – Colbitz",
      "type": "Registerbekanntmachung nach dem Umwandlungsgesetz",
      "state": "Sachsen-Anhalt",
      "amtsgericht": "Amtsgericht Stendal",
      "registernummer": "GsR 756",
      "registerart": "GsR",
      "company_name": "IK - Industrieservice eGbR",
      "company_seat": "Colbitz",
      "details": "23.09.2025 (Bekanntmachungsdatum)\n\nSachsen-Anhalt Amtsgericht Stendal GsR 756\nRegisterbekanntmachung nach dem Umwandlungsgesetz 23.09.2025 (Eintragungsdatum)\n\nIK - Industrieservice eGbR\nGesellschaft bürgerlichen Rechts\nColbitz\n\nNicht eingetragen:\nDen Gläubigern des formwechselnden  Rechtsträgers, ist wenn sie binnen sechs Monaten nach dem Tag, an dem die Eintragung des Formwechsels nach § 201 UmwG als bekanntgemacht gilt, ihren Anspruch nach Grund und Höhe schriftlich anmelden, Sicherheit zu leisten, soweit sie nicht Befriedigung verlangen können. Dieses Recht steht ihnen jedoch nur zu, wenn sie glaubhaft machen, dass durch den Formwechsel die Erfüllung ihrer Forderung gefährdet wird."
    },
    {
      "date": "2025-09-23",
      "id": "130956",
      "original_text": "Löschungsankündigung\nBerlin Amtsgericht Berlin (Charlottenburg) HRB 209469\nFratelli La Bufala Germany GmbH – Berlin",
      "type": "Löschungsankündigung",
      "state": "Berlin",
      "amtsgericht": "Amtsgericht Berlin (Charlottenburg)",
      "registernummer": "HRB 209469",
      "registerart": "HRB",
      "company_name": "Fratelli La Bufala Germany GmbH",
      "company_seat": "Berlin",
      "details": "23.09.2025 (Bekanntmachungsdatum)\n\nBerlin Amtsgericht Berlin (Charlottenburg) HRB 209469\nLöschungsankündigung\n\nFratelli La Bufala Germany GmbH\nGesellschaft mit beschränkter Haftung\nBerlin\n\nBei der nachstehenden Gesellschaft wird das Amtslöschungsverfahren gemäß § 394 FamFG eingeleitet. Widerspruchsfrist 6 Wochen"
    },
    {
      "date": "2025-09-23",
      "id": "130957",
      "original_text": "Registerbekanntmachung nach dem Umwandlungsgesetz\nBaden-Württemberg Amtsgericht Mannheim HRB 729213\nMB Invest Service GmbH – Malsch",
      "type": "Registerbekanntmachung nach dem Umwandlungsgesetz",
      "state": "Baden-Württemberg",
      "amtsgericht": "Amtsgericht Mannheim",
      "registernummer": "HRB 729213",
      "registerart": "HRB",
      "company_name": "MB Invest Service GmbH",
      "company_seat": "Malsch",
      "details": "23.09.2025 (Bekanntmachungsdatum)\n\nBaden-Württemberg Amtsgericht Mannheim HRB 729213\nRegisterbekanntmachung nach dem Umwandlungsgesetz 23.09.2025 (Eintragungsdatum)\n\nMB Invest Service GmbH\nGesellschaft mit beschränkter Haftung\nMalsch\n\nAls nicht eingetragen wird bekanntgemacht:\nDen Gläubigern der an der Verschmelzung beteiligten Rechtsträger ist, wenn sie binnen sechs Monaten nach dem Tag, an dem die Eintragung der Verschmelzung in das Register des Sitzes desjenigen Rechtsträgers, dessen Gläubiger sie sind, nach § 19 Abs. 3 UmwG als bekanntgemacht gilt, ihren Anspruch nach Grund und Höhe schriftlich anmelden, Sicherheit zu leisten, soweit sie nicht Befriedigung verlangen können. Dieses Recht steht den Gläubigern jedoch nur zu, wenn sie glaubhaft machen, dass durch die Verschmelzung die Erfüllung ihrer Forderung gefährdet wird."
    },
    {
      "date": "2025-09-23",
      "id": "130958",
      "original_text": "Registerbekanntmachung nach dem Umwandlungsgesetz\nHamburg Amtsgericht Hamburg HRB 125903\nKiTA Paula und Max im August-Lütgens Park GmbH – Hamburg",
      "type": "Registerbekanntmachung nach dem Umwandlungsgesetz",
      "state": "Hamburg",
      "amtsgericht": "Amtsgericht Hamburg",
      "registernummer": "HRB 125903",
      "registerart": "HRB",
      "company_name": "KiTA Paula und Max im August-Lütgens Park GmbH",
      "company_seat": "Hamburg",
      "details": "23.09.2025 (Bekanntmachungsdatum)\n\nHamburg Amtsgericht Hamburg HRB 125903\nRegisterbekanntmachung nach dem Umwandlungsgesetz 23.09.2025 (Eintragungsdatum)\n\nKiTA Paula und Max im August-Lütgens Park GmbH\nGesellschaft mit beschränkter Haftung\nHamburg\n\nAls nicht eingetragen wird bekannt gemacht:\nDen Gläubigern der an der Verschmelzung beteiligten Gesellschaften ist, wenn sie binnen sechs Monaten nach dem Tag, an dem die Eintragung der Verschmelzung in das Register des Sitzes desjenigen Rechtsträgers, dessen Gläubiger sie sind, nach § 19 Absatz 3 UmwG als bekannt gemacht gilt, ihren Anspruch nach Grund und Höhe schriftlich anmelden, Sicherheit zu leisten, soweit sie nicht Befriedigung verlangen können. Dieses Recht steht den Gläubigern jedoch nur zu, wenn sie glaubhaft machen, dass durch die Verschmelzung die Erfüllung ihrer Forderung gefährdet wird."
    },
    {
      "date": "2025-09-23",
      "id": "130959",
      "original_text": "Registerbekanntmachung nach dem Umwandlungsgesetz\nHamburg Amtsgericht Hamburg HRB 149541\nGS 2 Vermögensverwaltungs GmbH – Hamburg",
      "type": "Registerbekanntmachung nach dem Umwandlungsgesetz",
      "state": "Hamburg",
      "amtsgericht": "Amtsgericht Hamburg",
      "registernummer": "HRB 149541",
      "registerart": "HRB",
      "company_name": "GS 2 Vermögensverwaltungs GmbH",
      "company_seat": "Hamburg",
      "details": "23.09.2025 (Bekanntmachungsdatum)\n\nHamburg Amtsgericht Hamburg HRB 149541\nRegisterbekanntmachung nach dem Umwandlungsgesetz 23.09.2025 (Eintragungsdatum)\n\nGS 2 Vermögensverwaltungs GmbH\nGesellschaft mit beschränkter Haftung\nHamburg\n\nAls nicht eingetragen wird bekannt gemacht:\nDen Gläubigern der an der Verschmelzung beteiligten Gesellschaften ist, wenn sie binnen sechs Monaten nach dem Tag, an dem die Eintragung der Verschmelzung in das Register des Sitzes desjenigen Rechtsträgers, dessen Gläubiger sie sind, nach § 19 Absatz 3 UmwG als bekannt gemacht gilt, ihren Anspruch nach Grund und Höhe schriftlich anmelden, Sicherheit zu leisten, soweit sie nicht Befriedigung verlangen können. Dieses Recht steht den Gläubigern jedoch nur zu, wenn sie glaubhaft machen, dass durch die Verschmelzung die Erfüllung ihrer Forderung gefährdet wird."
    },
    {
      "date": "2025-09-23",
      "id": "130960",
      "original_text": "Registerbekanntmachung nach dem Umwandlungsgesetz\nBerlin Amtsgericht Berlin (Charlottenburg) HRB 279476\nHotel Brandies Berlin GmbH – Berlin",
      "type": "Registerbekanntmachung nach dem Umwandlungsgesetz",
      "state": "Berlin",
      "amtsgericht": "Amtsgericht Berlin (Charlottenburg)",
      "registernummer": "HRB 279476",
      "registerart": "HRB",
      "company_name": "Hotel Brandies Berlin GmbH",
      "company_seat": "Berlin",
      "details": "23.09.2025 (Bekanntmachungsdatum)\n\nBerlin Amtsgericht Berlin (Charlottenburg) HRB 279476\nRegisterbekanntmachung nach dem Umwandlungsgesetz 22.09.2025 (Eintragungsdatum)\n\nHotel Brandies Berlin GmbH\nGesellschaft mit beschränkter Haftung\nBerlin\n\nZu Eintragungsnummer 1 vom 22.09.2025 wird als nicht eingetragen veröffentlicht: Den Gläubigern der an der Spaltung beteiligten Rechtsträger ist, wenn sie binnen sechs Monaten nach dem Tag, an dem die Eintragung der Spaltung in das Register des Sitzes desjenigen Rechtsträgers, dessen Gläubiger sie sind, als bekannt gemacht gilt, ihren Anspruch nach Grund und Höhe schriftlich anmelden, Sicherheit zu leisten, soweit sie nicht Befriedigung verlangen können. Dieses Recht steht den Gläubigern jedoch nur zu, wenn sie glaubhaft machen, dass durch die Spaltung die Erfüllung ihrer Forderung gefährdet wird. Das Recht, Sicherheitsleistung zu verlangen, steht Gläubigern nicht zu, die im Falle der Insolvenz ein Recht auf vorzugsweise Befriedigung aus einer Deckungsmasse haben, die nach gesetzlicher Vorschrift zu ihrem Schutz errichtet und staatlich überwacht ist."
    },
    {
      "date": "2025-09-23",
      "id": "130961",
      "original_text": "Registerbekanntmachung nach dem Umwandlungsgesetz\nHamburg Amtsgericht Hamburg HRA 127582\nElektrotechnik Schulz GmbH & Co. KG – Hamburg",
      "type": "Registerbekanntmachung nach dem Umwandlungsgesetz",
      "state": "Hamburg",
      "amtsgericht": "Amtsgericht Hamburg",
      "registernummer": "HRA 127582",
      "registerart": "HRA",
      "company_name": "Elektrotechnik Schulz GmbH & Co. KG",
      "company_seat": "Hamburg",
      "details": "23.09.2025 (Bekanntmachungsdatum)\n\nHamburg Amtsgericht Hamburg HRA 127582\nRegisterbekanntmachung nach dem Umwandlungsgesetz 23.09.2025 (Eintragungsdatum)\n\nElektrotechnik Schulz GmbH & Co. KG\nKommanditgesellschaft\nHamburg\n\nAls nicht eingetragen wird bekannt gemacht:\nDen Gläubigern der an der formwechselnden Umwandlung beteiligten Gesellschaften ist, wenn sie binnen sechs Monaten nach dem Tag, an dem die Eintragung der formwechselnden Umwandlung in das Register des Sitzes desjenigen Rechtsträgers, dessen Gläubiger sie sind, nach § 19 Absatz 3 UmwG als bekannt gemacht gilt, ihren Anspruch nach Grund und Höhe schriftlich anmelden, Sicherheit zu leisten, soweit sie nicht Befriedigung verlangen können. Dieses Recht steht den Gläubigern jedoch nur zu, wenn sie glaubhaft machen, dass durch die formwechselnde Umwandlung die Erfüllung ihrer Forderung gefährdet wird."
    },
    {
      "date": "2025-09-23",
      "id": "130962",
      "original_text": "Sonstige Registerbekanntmachung\nHamburg Amtsgericht Hamburg HRB 182174\nmaxingvest GmbH & Co. KGaA – Hamburg",
      "type": "Sonstige Registerbekanntmachung",
      "state": "Hamburg",
      "amtsgericht": "Amtsgericht Hamburg",
      "registernummer": "HRB 182174",
      "registerart": "HRB",
      "company_name": "maxingvest GmbH & Co. KGaA",
      "company_seat": "Hamburg",
      "details": "23.09.2025 (Bekanntmachungsdatum)\n\nHamburg Amtsgericht Hamburg HRB 182174\nSonstige Registerbekanntmachung\n\nmaxingvest GmbH & Co. KGaA\nKommanditgesellschaft auf Aktien\nHamburg\n\nAls nicht eingetragen wird bekannt gemacht: Liste des Aufsichtsrats wurde eingereicht."
    },
    {
      "date": "2025-09-23",
      "id": "130963",
      "original_text": "Registerbekanntmachung nach dem Umwandlungsgesetz\nBaden-Württemberg Amtsgericht Stuttgart HRA 450664\nAndreas Dausch e.K. – Wurmlingen",
      "type": "Registerbekanntmachung nach dem Umwandlungsgesetz",
      "state": "Baden-Württemberg",
      "amtsgericht": "Amtsgericht Stuttgart",
      "registernummer": "HRA 450664",
      "registerart": "HRA",
      "company_name": "Andreas Dausch e.K.",
      "company_seat": "Wurmlingen",
      "details": "23.09.2025 (Bekanntmachungsdatum)\n\nBaden-Württemberg Amtsgericht Stuttgart HRA 450664\nRegisterbekanntmachung nach dem Umwandlungsgesetz 23.09.2025 (Eintragungsdatum)\n\nAndreas Dausch e.K.\nEinzelkaufmann / Einzelkauffrau\nWurmlingen\n\nAls nicht eingetragen wird bekanntgemacht:\nDen Gläubigern der an der Ausgliederung beteiligten Rechtsträger ist, wenn sie binnen sechs Monaten nach dem Tag, an dem die Eintragung der Ausgliederung in das Register des Sitzes desjenigen Rechtsträgers, dessen Gläubiger sie sind, nach § 19 Abs. 3 UmwG als bekanntgemacht gilt, ihren Anspruch nach Grund und Höhe schriftlich anmelden, Sicherheit zu leisten, soweit sie nicht Befriedigung verlangen können. Dieses Recht steht den Gläubigern jedoch nur zu, wenn sie glaubhaft machen, dass durch die Ausgliederung die Erfüllung ihrer Forderung gefährdet wird."
    },
    {
      "date": "2025-09-23",
      "id": "130964",
      "original_text": "Löschungsankündigung\nBerlin Amtsgericht Berlin (Charlottenburg) HRB 190426\nG&C food GmbH – Berlin",
      "type": "Löschungsankündigung",
      "state": "Berlin",
      "amtsgericht": "Amtsgericht Berlin (Charlottenburg)",
      "registernummer": "HRB 190426",
      "registerart": "HRB",
      "company_name": "G&C food GmbH",
      "company_seat": "Berlin",
      "details": "23.09.2025 (Bekanntmachungsdatum)\n\nBerlin Amtsgericht Berlin (Charlottenburg) HRB 190426\nLöschungsankündigung\n\nG&C food GmbH\nGesellschaft mit beschränkter Haftung\nBerlin\n\nBei der nachstehenden Gesellschaft wird das Amtslöschungsverfahren gemäß § 394 FamFG eingeleitet. Widerspruchsfrist 6 Wochen"
    },
    {
      "date": "2025-09-23",
      "id": "130965",
      "original_text": "Registerbekanntmachung nach dem Umwandlungsgesetz\nBaden-Württemberg Amtsgericht Mannheim HRB 6924\ntrio-group communication & marketing gmbh – Mannheim",
      "type": "Registerbekanntmachung nach dem Umwandlungsgesetz",
      "state": "Baden-Württemberg",
      "amtsgericht": "Amtsgericht Mannheim",
      "registernummer": "HRB 6924",
      "registerart": "HRB",
      "company_name": "trio-group communication & marketing gmbh",
      "company_seat": "Mannheim",
      "details": "23.09.2025 (Bekanntmachungsdatum)\n\nBaden-Württemberg Amtsgericht Mannheim HRB 6924\nRegisterbekanntmachung nach dem Umwandlungsgesetz 23.09.2025 (Eintragungsdatum)\n\ntrio-group communication & marketing gmbh\nGesellschaft mit beschränkter Haftung\nMannheim\n\nAls nicht eingetragen wird bekanntgemacht:\nDen Gläubigern der an der Verschmelzung beteiligten Rechtsträger ist, wenn sie binnen sechs Monaten nach dem Tag, an dem die Eintragung der Verschmelzung in das Register des Sitzes desjenigen Rechtsträgers, dessen Gläubiger sie sind, nach § 19 Abs. 3 UmwG als bekanntgemacht gilt, ihren Anspruch nach Grund und Höhe schriftlich anmelden, Sicherheit zu leisten, soweit sie nicht Befriedigung verlangen können. Dieses Recht steht den Gläubigern jedoch nur zu, wenn sie glaubhaft machen, dass durch die Verschmelzung die Erfüllung ihrer Forderung gefährdet wird."
    },
    {
      "date": "2025-09-23",
      "id": "130966",
      "original_text": "Registerbekanntmachung nach dem Umwandlungsgesetz\nBerlin Amtsgericht Berlin (Charlottenburg) HRB 81840\nDomus Verlags- und Servicegesellschaft mbH – Berlin",
      "type": "Registerbekanntmachung nach dem Umwandlungsgesetz",
      "state": "Berlin",
      "amtsgericht": "Amtsgericht Berlin (Charlottenburg)",
      "registernummer": "HRB 81840",
      "registerart": "HRB",
      "company_name": "Domus Verlags- und Servicegesellschaft mbH",
      "company_seat": "Berlin",
      "details": "23.09.2025 (Bekanntmachungsdatum)\n\nBerlin Amtsgericht Berlin (Charlottenburg) HRB 81840\nRegisterbekanntmachung nach dem Umwandlungsgesetz 22.09.2025 (Eintragungsdatum)\n\nDomus Verlags- und Servicegesellschaft mbH\nGesellschaft mit beschränkter Haftung\nBerlin\n\nZu Eintragungsnummer 5 vom 22.09.2025 wird als nicht eingetragen veröffentlicht:\nDen Gläubigern der an der Verschmelzung beteiligten Rechtsträger ist, wenn sie binnen sechs Monaten nach dem Tag, an dem die Eintragung der Verschmelzung in das Register des Sitzes desjenigen Rechtsträgers, dessen Gläubiger sie sind, als bekannt gemacht gilt, ihren Anspruch nach Grund und Höhe schriftlich anmelden, Sicherheit zu leisten, soweit sie nicht Befriedigung verlangen können. Dieses Recht steht den Gläubigern jedoch nur zu, wenn sie glaubhaft machen, dass durch die Verschmelzung die Erfüllung ihrer Forderung gefährdet wird. Das Recht, Sicherheitsleistung zu verlangen, steht Gläubigern nicht zu, die im Falle der Insolvenz ein Recht auf vorzugsweise Befriedigung aus einer Deckungsmasse haben, die nach gesetzlicher Vorschrift zu ihrem Schutz errichtet und staatlich überwacht ist."
    },
    {
      "date": "2025-09-23",
      "id": "130967",
      "original_text": "Registerbekanntmachung nach dem Umwandlungsgesetz\nThüringen Amtsgericht Jena HRA 507173\nAlexander Rau Bauunternehmen e. K. – Frankenblick",
      "type": "Registerbekanntmachung nach dem Umwandlungsgesetz",
      "state": "Thüringen",
      "amtsgericht": "Amtsgericht Jena",
      "registernummer": "HRA 507173",
      "registerart": "HRA",
      "company_name": "Alexander Rau Bauunternehmen e. K.",
      "company_seat": "Frankenblick",
      "details": "23.09.2025 (Bekanntmachungsdatum)\n\nThüringen Amtsgericht Jena HRA 507173\nRegisterbekanntmachung nach dem Umwandlungsgesetz 23.09.2025 (Eintragungsdatum)\n\nAlexander Rau Bauunternehmen e. K.\nEinzelkaufmann / Einzelkauffrau\nFrankenblick\n\nNicht eingetragen: Den Gläubigern der an der Ausgliederung beteiligten Rechtsträger, ist wenn sie binnen sechs Monaten nach dem Tag, an dem die Eintragung der Ausgliederung in das Register des Sitzes desjenigen Rechtsträgers, dessen Gläubiger sie sind, nach §§125, 19 Abs. 3 UmwG als bekanntgemacht gilt, ihren Anspruch nach Grund und Höhe schriftlich anmelden, Sicherheit zu leisten, soweit sie nicht Befriedigung verlangen können. Dieses Recht steht ihnen jedoch nur zu, wenn sie glaubhaft machen, daß durch die Ausgliederung die Erfüllung ihrer Forderung gefährdet wird."
    },
    {
      "date": "2025-09-23",
      "id": "130968",
      "original_text": "Registerbekanntmachung nach dem Umwandlungsgesetz\nMecklenburg-Vorpommern Amtsgericht Stralsund HRB 22978\nG+S Lagergesellschaft mbH – Greifswald",
      "type": "Registerbekanntmachung nach dem Umwandlungsgesetz",
      "state": "Mecklenburg-Vorpommern",
      "amtsgericht": "Amtsgericht Stralsund",
      "registernummer": "HRB 22978",
      "registerart": "HRB",
      "company_name": "G+S Lagergesellschaft mbH",
      "company_seat": "Greifswald",
      "details": "23.09.2025 (Bekanntmachungsdatum)\n\nMecklenburg-Vorpommern Amtsgericht Stralsund HRB 22978\nRegisterbekanntmachung nach dem Umwandlungsgesetz 23.09.2025 (Eintragungsdatum)\n\nG+S Lagergesellschaft mbH\nGesellschaft mit beschränkter Haftung\nGreifswald\n\nAls nicht eingetragen wird veröffentlicht: Den Gläubigern der an der Umwandlung beteiligten Rechtsträger ist, wenn sie binnen sechs\nMonaten nach dem Tag, an dem die Eintragung der Umwandlung in das Register des Sitzes desjenigen Rechtsträgers, dessen Gläubiger sie sind, nach § 19 Abs. 3 UmwG als bekannt gemacht gilt, ihren Anspruch nach Grund und Höhe in Textform anmelden, Sicherheit zu leisten, soweit sie nicht Befriedigung verlangen können. Dieses Recht steht den Gläubigern jedoch nur zu, wenn sie glaubhaft machen, dass durch die Umwandlung die Erfüllung der Forderung gefährdet wird."
    },
    {
      "date": "2025-09-23",
      "id": "130969",
      "original_text": "Registerbekanntmachung nach dem Umwandlungsgesetz\nMecklenburg-Vorpommern Amtsgericht Stralsund GsR 78\nG+S Lagergesellschaft eGbR – Greifswald",
      "type": "Registerbekanntmachung nach dem Umwandlungsgesetz",
      "state": "Mecklenburg-Vorpommern",
      "amtsgericht": "Amtsgericht Stralsund",
      "registernummer": "GsR 78",
      "registerart": "GsR",
      "company_name": "G+S Lagergesellschaft eGbR",
      "company_seat": "Greifswald",
      "details": "23.09.2025 (Bekanntmachungsdatum)\n\nMecklenburg-Vorpommern Amtsgericht Stralsund GsR 78\nRegisterbekanntmachung nach dem Umwandlungsgesetz 23.09.2025 (Eintragungsdatum)\n\nG+S Lagergesellschaft eGbR\nGesellschaft bürgerlichen Rechts\nGreifswald\n\nAls nicht eingetragen wird veröffentlicht: Den Gläubigern der an der Umwandlung beteiligten Rechtsträger ist, wenn sie binnen sechs\nMonaten nach dem Tag, an dem die Eintragung der Umwandlung in das Register des Sitzes desjenigen Rechtsträgers, dessen Gläubiger sie sind, nach § 19 Abs. 3 UmwG als bekannt gemacht gilt, ihren Anspruch nach Grund und Höhe in Textform anmelden, Sicherheit zu leisten, soweit sie nicht Befriedigung verlangen können. Dieses Recht steht den Gläubigern jedoch nur zu, wenn sie glaubhaft machen, dass durch die Umwandlung die Erfüllung der Forderung gefährdet wird."
    },
    {
      "date": "2025-09-23",
      "id": "130970",
      "original_text": "Löschungsankündigung\nBerlin Amtsgericht Berlin (Charlottenburg) HRB 145721\nBawadi Group GmbH – Berlin",
      "type": "Löschungsankündigung",
      "state": "Berlin",
      "amtsgericht": "Amtsgericht Berlin (Charlottenburg)",
      "registernummer": "HRB 145721",
      "registerart": "HRB",
      "company_name": "Bawadi Group GmbH",
      "company_seat": "Berlin",
      "details": "23.09.2025 (Bekanntmachungsdatum)\n\nBerlin Amtsgericht Berlin (Charlottenburg) HRB 145721\nLöschungsankündigung\n\nBawadi Group GmbH\nGesellschaft mit beschränkter Haftung\nBerlin\n\nBei der nachstehenden Gesellschaft wird das Amtslöschungsverfahren gemäß § 394 FamFG eingeleitet. Widerspruchsfrist 6 Wochen"
    },
    {
      "date": "2025-09-23",
      "id": "130971",
      "original_text": "Löschungsankündigung\nBerlin Amtsgericht Berlin (Charlottenburg) HRB 152721\nBaydar Bau GmbH – Berlin",
      "type": "Löschungsankündigung",
      "state": "Berlin",
      "amtsgericht": "Amtsgericht Berlin (Charlottenburg)",
      "registernummer": "HRB 152721",
      "registerart": "HRB",
      "company_name": "Baydar Bau GmbH",
      "company_seat": "Berlin",
      "details": "23.09.2025 (Bekanntmachungsdatum)\n\nBerlin Amtsgericht Berlin (Charlottenburg) HRB 152721\nLöschungsankündigung\n\nBaydar Bau GmbH\nGesellschaft mit beschränkter Haftung\nBerlin\n\nBei der nachstehenden Gesellschaft wird das Amtslöschungsverfahren gemäß § 394 FamFG eingeleitet. Widerspruchsfrist 6 Wochen"
    },
    {
      "date": "2025-09-23",
      "id": "130972",
      "original_text": "Löschungsankündigung\nBerlin Amtsgericht Berlin (Charlottenburg) HRB 235183\nQR-Line GmbH – Berlin",
      "type": "Löschungsankündigung",
      "state": "Berlin",
      "amtsgericht": "Amtsgericht Berlin (Charlottenburg)",
      "registernummer": "HRB 235183",
      "registerart": "HRB",
      "company_name": "QR-Line GmbH",
      "company_seat": "Berlin",
      "details": "23.09.2025 (Bekanntmachungsdatum)\n\nBerlin Amtsgericht Berlin (Charlottenburg) HRB 235183\nLöschungsankündigung\n\nQR-Line GmbH\nGesellschaft mit beschränkter Haftung\nBerlin\n\nBei der nachstehenden Gesellschaft wird das Amtslöschungsverfahren gemäß § 394 FamFG eingeleitet. Widerspruchsfrist 6 Wochen"
    },
    {
      "date": "2025-09-23",
      "id": "130973",
      "original_text": "Einreichung neuer Dokumente\nBerlin Amtsgericht Berlin (Charlottenburg) HRB 271693\nN26 SE – Berlin",
      "type": "Einreichung neuer Dokumente",
      "state": "Berlin",
      "amtsgericht": "Amtsgericht Berlin (Charlottenburg)",
      "registernummer": "HRB 271693",
      "registerart": "HRB",
      "company_name": "N26 SE",
      "company_seat": "Berlin",
      "details": "23.09.2025 (Bekanntmachungsdatum)\n\nBerlin Amtsgericht Berlin (Charlottenburg) HRB 271693\nEinreichung neuer Dokumente\n\nN26 SE\nEuropäische Aktiengesellschaft (SE)\nBerlin\n\nAls nicht eingetragen wird veröffentlicht: Es wurde eine neue Liste der Aufsichtsratsmitglieder eingereicht (§ 106 AktG)."
    },
    {
      "date": "2025-09-23",
      "id": "130974",
      "original_text": "Einreichung neuer Dokumente\nBerlin Amtsgericht Berlin (Charlottenburg) HRB 237635\nGrover Holding SE – Berlin",
      "type": "Einreichung neuer Dokumente",
      "state": "Berlin",
      "amtsgericht": "Amtsgericht Berlin (Charlottenburg)",
      "registernummer": "HRB 237635",
      "registerart": "HRB",
      "company_name": "Grover Holding SE",
      "company_seat": "Berlin",
      "details": "23.09.2025 (Bekanntmachungsdatum)\n\nBerlin Amtsgericht Berlin (Charlottenburg) HRB 237635\nEinreichung neuer Dokumente\n\nGrover Holding SE\nEuropäische Aktiengesellschaft (SE)\nBerlin\n\nAls nicht eingetragen wird veröffentlicht: Es wurde eine neue Liste der Aufsichtsratsmitglieder eingereicht (§ 106 AktG)."
    },
    {
      "date": "2025-09-23",
      "id": "130975",
      "original_text": "Registerbekanntmachung nach dem Umwandlungsgesetz\nBerlin Amtsgericht Berlin (Charlottenburg) HRB 192634\nJoMi Gartenbau GmbH – Berlin",
      "type": "Registerbekanntmachung nach dem Umwandlungsgesetz",
      "state": "Berlin",
      "amtsgericht": "Amtsgericht Berlin (Charlottenburg)",
      "registernummer": "HRB 192634",
      "registerart": "HRB",
      "company_name": "JoMi Gartenbau GmbH",
      "company_seat": "Berlin",
      "details": "23.09.2025 (Bekanntmachungsdatum)\n\nBerlin Amtsgericht Berlin (Charlottenburg) HRB 192634\nRegisterbekanntmachung nach dem Umwandlungsgesetz 22.09.2025 (Eintragungsdatum)\n\nJoMi Gartenbau GmbH\nGesellschaft mit beschränkter Haftung\nBerlin\n\nZu Eintragungsnummer 3 vom 22.09.2025 wird als nicht eingetragen veröffentlicht: Den Gläubigern der an der Verschmelzung beteiligten Rechtsträger ist, wenn sie binnen sechs Monaten nach dem Tag, an dem die Eintragung der Verschmelzung in das Register des Sitzes desjenigen Rechtsträgers, dessen Gläubiger sie sind, als bekannt gemacht gilt, ihren Anspruch nach Grund und Höhe schriftlich anmelden, Sicherheit zu leisten, soweit sie nicht Befriedigung verlangen können. Dieses Recht steht den Gläubigern jedoch nur zu, wenn sie glaubhaft machen, dass durch die Verschmelzung die Erfüllung ihrer Forderung gefährdet wird. Das Recht, Sicherheitsleistung zu verlangen, steht Gläubigern nicht zu, die im Falle der Insolvenz ein Recht auf vorzugsweise Befriedigung aus einer Deckungsmasse haben, die nach gesetzlicher Vorschrift zu ihrem Schutz errichtet und staatlich überwacht ist."
    },
    {
      "date": "2025-09-23",
      "id": "130976",
      "original_text": "Registerbekanntmachung nach dem Umwandlungsgesetz\nBerlin Amtsgericht Berlin (Charlottenburg) HRB 243448\nUnited Dresden GmbH – Berlin",
      "type": "Registerbekanntmachung nach dem Umwandlungsgesetz",
      "state": "Berlin",
      "amtsgericht": "Amtsgericht Berlin (Charlottenburg)",
      "registernummer": "HRB 243448",
      "registerart": "HRB",
      "company_name": "United Dresden GmbH",
      "company_seat": "Berlin",
      "details": "23.09.2025 (Bekanntmachungsdatum)\n\nBerlin Amtsgericht Berlin (Charlottenburg) HRB 243448\nRegisterbekanntmachung nach dem Umwandlungsgesetz 18.09.2025 (Eintragungsdatum)\n\nUnited Dresden GmbH\nGesellschaft mit beschränkter Haftung\nBerlin\n\nZu Eintragungsnummer 3 vom 18.09.2025 wird als nicht eingetragen veröffentlicht: Den Gläubigern der an der Verschmelzung beteiligten Rechtsträger ist, wenn sie binnen sechs Monaten nach dem Tag, an dem die Eintragung der Verschmelzung in das Register des Sitzes desjenigen Rechtsträgers, dessen Gläubiger sie sind, als bekannt gemacht gilt, ihren Anspruch nach Grund und Höhe schriftlich anmelden, Sicherheit zu leisten, soweit sie nicht Befriedigung verlangen können. Dieses Recht steht den Gläubigern jedoch nur zu, wenn sie glaubhaft machen, dass durch die Verschmelzung die Erfüllung ihrer Forderung gefährdet wird. Das Recht, Sicherheitsleistung zu verlangen, steht Gläubigern nicht zu, die im Falle der Insolvenz ein Recht auf vorzugsweise Befriedigung aus einer Deckungsmasse haben, die nach gesetzlicher Vorschrift zu ihrem Schutz errichtet und staatlich überwacht ist."
    },
    {
      "date": "2025-09-23",
      "id": "130977",
      "original_text": "Registerbekanntmachung nach dem Umwandlungsgesetz\nBerlin Amtsgericht Berlin (Charlottenburg) HRB 192634\nJoMi Gartenbau GmbH – Berlin",
      "type": "Registerbekanntmachung nach dem Umwandlungsgesetz",
      "state": "Berlin",
      "amtsgericht": "Amtsgericht Berlin (Charlottenburg)",
      "registernummer": "HRB 192634",
      "registerart": "HRB",
      "company_name": "JoMi Gartenbau GmbH",
      "company_seat": "Berlin",
      "details": "23.09.2025 (Bekanntmachungsdatum)\n\nBerlin Amtsgericht Berlin (Charlottenburg) HRB 192634\nRegisterbekanntmachung nach dem Umwandlungsgesetz 22.09.2025 (Eintragungsdatum)\n\nJoMi Gartenbau GmbH\nGesellschaft mit beschränkter Haftung\nBerlin\n\nZu Eintragungsnummer 4 vom 22.09.2025 wird als nicht eingetragen veröffentlicht: Den Gläubigern der an der Verschmelzung beteiligten Rechtsträger ist, wenn sie binnen sechs Monaten nach dem Tag, an dem die Eintragung der Verschmelzung in das Register des Sitzes desjenigen Rechtsträgers, dessen Gläubiger sie sind, als bekannt gemacht gilt, ihren Anspruch nach Grund und Höhe schriftlich anmelden, Sicherheit zu leisten, soweit sie nicht Befriedigung verlangen können. Dieses Recht steht den Gläubigern jedoch nur zu, wenn sie glaubhaft machen, dass durch die Verschmelzung die Erfüllung ihrer Forderung gefährdet wird. Das Recht, Sicherheitsleistung zu verlangen, steht Gläubigern nicht zu, die im Falle der Insolvenz ein Recht auf vorzugsweise Befriedigung aus einer Deckungsmasse haben, die nach gesetzlicher Vorschrift zu ihrem Schutz errichtet und staatlich überwacht ist."
    },
    {
      "date": "2025-09-23",
      "id": "130978",
      "original_text": "Registerbekanntmachung nach dem Umwandlungsgesetz\nBerlin Amtsgericht Berlin (Charlottenburg) HRA 49022\nJOMI Garten- und Landschaftsbau GmbH & Co. KG – Berlin",
      "type": "Registerbekanntmachung nach dem Umwandlungsgesetz",
      "state": "Berlin",
      "amtsgericht": "Amtsgericht Berlin (Charlottenburg)",
      "registernummer": "HRA 49022",
      "registerart": "HRA",
      "company_name": "JOMI Garten- und Landschaftsbau GmbH & Co. KG",
      "company_seat": "Berlin",
      "details": "23.09.2025 (Bekanntmachungsdatum)\n\nBerlin Amtsgericht Berlin (Charlottenburg) HRA 49022\nRegisterbekanntmachung nach dem Umwandlungsgesetz 22.09.2025 (Eintragungsdatum)\n\nJOMI Garten- und Landschaftsbau GmbH & Co. KG\nKommanditgesellschaft\nBerlin\n\nZu Eintragungsnummer 5 vom 22.09.2025 wird als nicht eingetragen veröffentlicht: Den Gläubigern der an der Verschmelzung beteiligten Rechtsträger ist, wenn sie binnen sechs Monaten nach dem Tag, an dem die Eintragung der Verschmelzung in das Register des Sitzes desjenigen Rechtsträgers, dessen Gläubiger sie sind, als bekannt gemacht gilt, ihren Anspruch nach Grund und Höhe schriftlich anmelden, Sicherheit zu leisten, soweit sie nicht Befriedigung verlangen können. Dieses Recht steht den Gläubigern jedoch nur zu, wenn sie glaubhaft machen, dass durch die Verschmelzung die Erfüllung ihrer Forderung gefährdet wird. Das Recht, Sicherheitsleistung zu verlangen, steht Gläubigern nicht zu, die im Falle der Insolvenz ein Recht auf vorzugsweise Befriedigung aus einer Deckungsmasse haben, die nach gesetzlicher Vorschrift zu ihrem Schutz errichtet und staatlich überwacht ist."
    },
    {
      "date": "2025-09-23",
      "id": "130979",
      "original_text": "Registerbekanntmachung nach dem Umwandlungsgesetz\nBerlin Amtsgericht Berlin (Charlottenburg) HRB 154994\nJOMI Garten- und Landschaftsbau, Verwaltungs GmbH – Berlin",
      "type": "Registerbekanntmachung nach dem Umwandlungsgesetz",
      "state": "Berlin",
      "amtsgericht": "Amtsgericht Berlin (Charlottenburg)",
      "registernummer": "HRB 154994",
      "registerart": "HRB",
      "company_name": "JOMI Garten- und Landschaftsbau, Verwaltungs GmbH",
      "company_seat": "Berlin",
      "details": "23.09.2025 (Bekanntmachungsdatum)\n\nBerlin Amtsgericht Berlin (Charlottenburg) HRB 154994\nRegisterbekanntmachung nach dem Umwandlungsgesetz 22.09.2025 (Eintragungsdatum)\n\nJOMI Garten- und Landschaftsbau, Verwaltungs GmbH\nGesellschaft mit beschränkter Haftung\nBerlin\n\nZu Eintragungsnummer 4 vom 22.09.2025 wird als nicht eingetragen veröffentlicht: Den Gläubigern der an der Verschmelzung beteiligten Rechtsträger ist, wenn sie binnen sechs Monaten nach dem Tag, an dem die Eintragung der Verschmelzung in das Register des Sitzes desjenigen Rechtsträgers, dessen Gläubiger sie sind, als bekannt gemacht gilt, ihren Anspruch nach Grund und Höhe schriftlich anmelden, Sicherheit zu leisten, soweit sie nicht Befriedigung verlangen können. Dieses Recht steht den Gläubigern jedoch nur zu, wenn sie glaubhaft machen, dass durch die Verschmelzung die Erfüllung ihrer Forderung gefährdet wird. Das Recht, Sicherheitsleistung zu verlangen, steht Gläubigern nicht zu, die im Falle der Insolvenz ein Recht auf vorzugsweise Befriedigung aus einer Deckungsmasse haben, die nach gesetzlicher Vorschrift zu ihrem Schutz errichtet und staatlich überwacht ist."
    },
    {
      "date": "2025-09-23",
      "id": "130980",
      "original_text": "Registerbekanntmachung nach dem Umwandlungsgesetz\nBerlin Amtsgericht Berlin (Charlottenburg) HRB 122592\nDomus Beteiligungsgesellschaft der Privaten Bausparkassen mbH – Berlin",
      "type": "Registerbekanntmachung nach dem Umwandlungsgesetz",
      "state": "Berlin",
      "amtsgericht": "Amtsgericht Berlin (Charlottenburg)",
      "registernummer": "HRB 122592",
      "registerart": "HRB",
      "company_name": "Domus Beteiligungsgesellschaft der Privaten Bausparkassen mbH",
      "company_seat": "Berlin",
      "details": "23.09.2025 (Bekanntmachungsdatum)\n\nBerlin Amtsgericht Berlin (Charlottenburg) HRB 122592\nRegisterbekanntmachung nach dem Umwandlungsgesetz 22.09.2025 (Eintragungsdatum)\n\nDomus Beteiligungsgesellschaft der Privaten Bausparkassen mbH\nGesellschaft mit beschränkter Haftung\nBerlin\n\nZu Eintragungsnummer 6 vom 22.09.2025 wird als nicht eingetragen veröffentlicht: Den Gläubigern der an der Verschmelzung beteiligten Rechtsträger ist, wenn sie binnen sechs Monaten nach dem Tag, an dem die Eintragung der Verschmelzung in das Register des Sitzes desjenigen Rechtsträgers, dessen Gläubiger sie sind, als bekannt gemacht gilt, ihren Anspruch nach Grund und Höhe schriftlich anmelden, Sicherheit zu leisten, soweit sie nicht Befriedigung verlangen können. Dieses Recht steht den Gläubigern jedoch nur zu, wenn sie glaubhaft machen, dass durch die Verschmelzung die Erfüllung ihrer Forderung gefährdet wird. Das Recht, Sicherheitsleistung zu verlangen, steht Gläubigern nicht zu, die im Falle der Insolvenz ein Recht auf vorzugsweise Befriedigung aus einer Deckungsmasse haben, die nach gesetzlicher Vorschrift zu ihrem Schutz errichtet und staatlich überwacht ist."
    },
    {
      "date": "2025-09-23",
      "id": "130981",
      "original_text": "Registerbekanntmachung nach dem Umwandlungsgesetz\nBerlin Amtsgericht Berlin (Charlottenburg) HRB 122592\nDomus Beteiligungsgesellschaft der Privaten Bausparkassen mbH – Berlin",
      "type": "Registerbekanntmachung nach dem Umwandlungsgesetz",
      "state": "Berlin",
      "amtsgericht": "Amtsgericht Berlin (Charlottenburg)",
      "registernummer": "HRB 122592",
      "registerart": "HRB",
      "company_name": "Domus Beteiligungsgesellschaft der Privaten Bausparkassen mbH",
      "company_seat": "Berlin",
      "details": "23.09.2025 (Bekanntmachungsdatum)\n\nBerlin Amtsgericht Berlin (Charlottenburg) HRB 122592\nRegisterbekanntmachung nach dem Umwandlungsgesetz 22.09.2025 (Eintragungsdatum)\n\nDomus Beteiligungsgesellschaft der Privaten Bausparkassen mbH\nGesellschaft mit beschränkter Haftung\nBerlin\n\nZu Eintragungsnummer 5 vom 22.09.2025 wird als nicht eingetragen veröffentlicht:\nDen Gläubigern der an der Verschmelzung beteiligten Rechtsträger ist, wenn sie binnen sechs Monaten nach dem Tag, an dem die Eintragung der Verschmelzung in das Register des Sitzes desjenigen Rechtsträgers, dessen Gläubiger sie sind, als bekannt gemacht gilt, ihren Anspruch nach Grund und Höhe schriftlich anmelden, Sicherheit zu leisten, soweit sie nicht Befriedigung verlangen können. Dieses Recht steht den Gläubigern jedoch nur zu, wenn sie glaubhaft machen, dass durch die Verschmelzung die Erfüllung ihrer Forderung gefährdet wird. Das Recht, Sicherheitsleistung zu verlangen, steht Gläubigern nicht zu, die im Falle der Insolvenz ein Recht auf vorzugsweise Befriedigung aus einer Deckungsmasse haben, die nach gesetzlicher Vorschrift zu ihrem Schutz errichtet und staatlich überwacht ist."
    },
    {
      "date": "2025-09-23",
      "id": "130982",
      "original_text": "Registerbekanntmachung nach dem Umwandlungsgesetz\nBaden-Württemberg Amtsgericht Mannheim HRB 736035\nPro Concept Projektbau Silberstreifen GmbH – Mannheim",
      "type": "Registerbekanntmachung nach dem Umwandlungsgesetz",
      "state": "Baden-Württemberg",
      "amtsgericht": "Amtsgericht Mannheim",
      "registernummer": "HRB 736035",
      "registerart": "HRB",
      "company_name": "Pro Concept Projektbau Silberstreifen GmbH",
      "company_seat": "Mannheim",
      "details": "23.09.2025 (Bekanntmachungsdatum)\n\nBaden-Württemberg Amtsgericht Mannheim HRB 736035\nRegisterbekanntmachung nach dem Umwandlungsgesetz 23.09.2025 (Eintragungsdatum)\n\nPro Concept Projektbau Silberstreifen GmbH\nGesellschaft mit beschränkter Haftung\nMannheim\n\nDen Gläubigern der an der Verschmelzung beteiligten Rechtsträger ist, wenn sie binnen sechs Monaten nach dem Tag, an dem die Eintragung der Verschmelzung in das Register des Sitzes desjenigen Rechtsträgers, dessen Gläubiger sie sind, nach § 19 Abs. 3 UmwG als bekanntgemacht gilt, ihren Anspruch nach Grund und Höhe schriftlich anmelden, Sicherheit zu leisten, soweit sie nicht Befriedigung verlangen können. Dieses Recht steht den Gläubigern jedoch nur zu, wenn sie glaubhaft machen, dass durch die Verschmelzung die Erfüllung ihrer Forderung gefährdet wird."
    },
    {
      "date": "2025-09-23",
      "id": "130983",
      "original_text": "Registerbekanntmachung nach dem Umwandlungsgesetz\nHamburg Amtsgericht Hamburg HRB 125905\nKiTA Paula und Max - Eilbeker Weg GmbH – Hamburg",
      "type": "Registerbekanntmachung nach dem Umwandlungsgesetz",
      "state": "Hamburg",
      "amtsgericht": "Amtsgericht Hamburg",
      "registernummer": "HRB 125905",
      "registerart": "HRB",
      "company_name": "KiTA Paula und Max - Eilbeker Weg GmbH",
      "company_seat": "Hamburg",
      "details": "23.09.2025 (Bekanntmachungsdatum)\n\nHamburg Amtsgericht Hamburg HRB 125905\nRegisterbekanntmachung nach dem Umwandlungsgesetz 23.09.2025 (Eintragungsdatum)\n\nKiTA Paula und Max - Eilbeker Weg GmbH\nGesellschaft mit beschränkter Haftung\nHamburg\n\nAls nicht eingetragen wird bekannt gemacht:\nDen Gläubigern der an der Verschmelzung beteiligten Gesellschaften ist, wenn sie binnen sechs Monaten nach dem Tag, an dem die Eintragung der Verschmelzung in das Register des Sitzes desjenigen Rechtsträgers, dessen Gläubiger sie sind, nach § 19 Absatz 3 UmwG als bekannt gemacht gilt, ihren Anspruch nach Grund und Höhe schriftlich anmelden, Sicherheit zu leisten, soweit sie nicht Befriedigung verlangen können. Dieses Recht steht den Gläubigern jedoch nur zu, wenn sie glaubhaft machen, dass durch die Verschmelzung die Erfüllung ihrer Forderung gefährdet wird."
    },
    {
      "date": "2025-09-23",
      "id": "130984",
      "original_text": "Registerbekanntmachung nach dem Umwandlungsgesetz\nHamburg Amtsgericht Hamburg HRB 125904\nKiTA Paula und Max - Hoheluftchaussee GmbH – Hamburg",
      "type": "Registerbekanntmachung nach dem Umwandlungsgesetz",
      "state": "Hamburg",
      "amtsgericht": "Amtsgericht Hamburg",
      "registernummer": "HRB 125904",
      "registerart": "HRB",
      "company_name": "KiTA Paula und Max - Hoheluftchaussee GmbH",
      "company_seat": "Hamburg",
      "details": "23.09.2025 (Bekanntmachungsdatum)\n\nHamburg Amtsgericht Hamburg HRB 125904\nRegisterbekanntmachung nach dem Umwandlungsgesetz 23.09.2025 (Eintragungsdatum)\n\nKiTA Paula und Max - Hoheluftchaussee GmbH\nGesellschaft mit beschränkter Haftung\nHamburg\n\nAls nicht eingetragen wird bekannt gemacht:\nDen Gläubigern der an der Verschmelzung beteiligten Gesellschaften ist, wenn sie binnen sechs Monaten nach dem Tag, an dem die Eintragung der Verschmelzung in das Register des Sitzes desjenigen Rechtsträgers, dessen Gläubiger sie sind, nach § 19 Absatz 3 UmwG als bekannt gemacht gilt, ihren Anspruch nach Grund und Höhe schriftlich anmelden, Sicherheit zu leisten, soweit sie nicht Befriedigung verlangen können. Dieses Recht steht den Gläubigern jedoch nur zu, wenn sie glaubhaft machen, dass durch die Verschmelzung die Erfüllung ihrer Forderung gefährdet wird."
    },
    {
      "date": "2025-09-23",
      "id": "130985",
      "original_text": "Registerbekanntmachung nach dem Umwandlungsgesetz\nBaden-Württemberg Amtsgericht Freiburg HRB 713357\nAdvanced Analytics GmbH – Konstanz",
      "type": "Registerbekanntmachung nach dem Umwandlungsgesetz",
      "state": "Baden-Württemberg",
      "amtsgericht": "Amtsgericht Freiburg",
      "registernummer": "HRB 713357",
      "registerart": "HRB",
      "company_name": "Advanced Analytics GmbH",
      "company_seat": "Konstanz",
      "details": "23.09.2025 (Bekanntmachungsdatum)\n\nBaden-Württemberg Amtsgericht Freiburg HRB 713357\nRegisterbekanntmachung nach dem Umwandlungsgesetz 23.09.2025 (Eintragungsdatum)\n\nAdvanced Analytics GmbH\nGesellschaft mit beschränkter Haftung\nKonstanz\n\nDie Gesellschaft ist gemäß Vertrag und Beschluss vom 08.08.2025 zur Aufnahme auf die \"Crisis24 GmbH\" (Amtsgericht Freiburg, HRB 705035) verschmolzen. Den Gläubigern der an der Verschmelzung beteiligten Rechtsträger ist, wenn sie binnen sechs Monaten nach dem Tag, an dem die Eintragung der Verschmelzung in das Register des Sitzes desjenigen Rechtsträgers, dessen Gläubiger sie sind, nach § 19 Abs. 3 UmwG als bekanntgemacht gilt, ihren Anspruch nach Grund und Höhe schriftlich anmelden, Sicherheit zu leisten, soweit sie nicht Befriedigung verlangen können. Dieses Recht steht den Gläubigern jedoch nur zu, wenn sie glaubhaft machen, dass durch die Verschmelzung die Erfüllung ihrer Forderung gefährdet wird."
    },
    {
      "date": "2025-09-23",
      "id": "130986",
      "original_text": "Registerbekanntmachung nach dem Umwandlungsgesetz\nBaden-Württemberg Amtsgericht Mannheim HRB 731001\nPro Concept Projektbau Wredestraße GmbH – Mannheim",
      "type": "Registerbekanntmachung nach dem Umwandlungsgesetz",
      "state": "Baden-Württemberg",
      "amtsgericht": "Amtsgericht Mannheim",
      "registernummer": "HRB 731001",
      "registerart": "HRB",
      "company_name": "Pro Concept Projektbau Wredestraße GmbH",
      "company_seat": "Mannheim",
      "details": "23.09.2025 (Bekanntmachungsdatum)\n\nBaden-Württemberg Amtsgericht Mannheim HRB 731001\nRegisterbekanntmachung nach dem Umwandlungsgesetz 23.09.2025 (Eintragungsdatum)\n\nPro Concept Projektbau Wredestraße GmbH\nGesellschaft mit beschränkter Haftung\nMannheim\n\nDen Gläubigern der an der Verschmelzung beteiligten Rechtsträger ist, wenn sie binnen sechs Monaten nach dem Tag, an dem die Eintragung der Verschmelzung in das Register des Sitzes desjenigen Rechtsträgers, dessen Gläubiger sie sind, nach § 19 Abs. 3 UmwG als bekanntgemacht gilt, ihren Anspruch nach Grund und Höhe schriftlich anmelden, Sicherheit zu leisten, soweit sie nicht Befriedigung verlangen können. Dieses Recht steht den Gläubigern jedoch nur zu, wenn sie glaubhaft machen, dass durch die Verschmelzung die Erfüllung ihrer Forderung gefährdet wird."
    },
    {
      "date": "2025-09-23",
      "id": "130987",
      "original_text": "Einreichung neuer Dokumente\nHamburg Amtsgericht Hamburg HRB 180266\nDRS Holding AG – Hamburg",
      "type": "Einreichung neuer Dokumente",
      "state": "Hamburg",
      "amtsgericht": "Amtsgericht Hamburg",
      "registernummer": "HRB 180266",
      "registerart": "HRB",
      "company_name": "DRS Holding AG",
      "company_seat": "Hamburg",
      "details": "23.09.2025 (Bekanntmachungsdatum)\n\nHamburg Amtsgericht Hamburg HRB 180266\nEinreichung neuer Dokumente\n\nDRS Holding AG\nAktiengesellschaft\nHamburg\n\nAls nicht eingetragen wird bekannt gemacht: Liste des Aufsichtsrats wurde eingereicht."
    },
    {
      "date": "2025-09-23",
      "id": "130988",
      "original_text": "Löschungsankündigung\nMecklenburg-Vorpommern Amtsgericht Neubrandenburg HRB 8172\nBeTo Brandschutz GmbH – Pasewalk",
      "type": "Löschungsankündigung",
      "state": "Mecklenburg-Vorpommern",
      "amtsgericht": "Amtsgericht Neubrandenburg",
      "registernummer": "HRB 8172",
      "registerart": "HRB",
      "company_name": "BeTo Brandschutz GmbH",
      "company_seat": "Pasewalk",
      "details": "23.09.2025 (Bekanntmachungsdatum)\n\nMecklenburg-Vorpommern Amtsgericht Neubrandenburg HRB 8172\nLöschungsankündigung 23.09.2025 (Eintragungsdatum)\n\nBeTo Brandschutz GmbH\nGesellschaft mit beschränkter Haftung\nPasewalk\n\nDas Registergericht beabsichtigt, die im Handelsregister eingetragene Gesellschaft von Amts wegen nach § 394 FamFG zu löschen. Die Frist zur Erhebung eines Widerspruchs gegen die beabsichtigte Löschung wird auf drei Monate festgesetzt."
    },
    {
      "date": "2025-09-23",
      "id": "130989",
      "original_text": "Löschungsankündigung\nBerlin Amtsgericht Berlin (Charlottenburg) HRB 135191\nTRIDENT CARS EXPORT SERVICE Verwaltungs-GMBH – Berlin",
      "type": "Löschungsankündigung",
      "state": "Berlin",
      "amtsgericht": "Amtsgericht Berlin (Charlottenburg)",
      "registernummer": "HRB 135191",
      "registerart": "HRB",
      "company_name": "TRIDENT CARS EXPORT SERVICE Verwaltungs-GMBH",
      "company_seat": "Berlin",
      "details": "23.09.2025 (Bekanntmachungsdatum)\n\nBerlin Amtsgericht Berlin (Charlottenburg) HRB 135191\nLöschungsankündigung\n\nTRIDENT CARS EXPORT SERVICE Verwaltungs-GMBH\nGesellschaft mit beschränkter Haftung\nBerlin\n\nBei der nachstehenden Gesellschaft wird das Amtslöschungsverfahren gemäß § 394 FamFG eingeleitet. Widerspruchsfrist 6 Wochen"
    },
    {
      "date": "2025-09-23",
      "id": "130990",
      "original_text": "Registerbekanntmachung nach dem Umwandlungsgesetz\nBerlin Amtsgericht Berlin (Charlottenburg) HRB 219566\nFJA FBO Berlin GmbH – Berlin",
      "type": "Registerbekanntmachung nach dem Umwandlungsgesetz",
      "state": "Berlin",
      "amtsgericht": "Amtsgericht Berlin (Charlottenburg)",
      "registernummer": "HRB 219566",
      "registerart": "HRB",
      "company_name": "FJA FBO Berlin GmbH",
      "company_seat": "Berlin",
      "details": "23.09.2025 (Bekanntmachungsdatum)\n\nBerlin Amtsgericht Berlin (Charlottenburg) HRB 219566\nRegisterbekanntmachung nach dem Umwandlungsgesetz 23.09.2025 (Eintragungsdatum)\n\nFJA FBO Berlin GmbH\nGesellschaft mit beschränkter Haftung\nBerlin\n\nZu Eintragungsnummer 6 vom 23.09.2025 wird als nicht eingetragen veröffentlicht: Den Gläubigern der an der Verschmelzung beteiligten Rechtsträger ist, wenn sie binnen sechs Monaten nach dem Tag, an dem die Eintragung der Verschmelzung in das Register des Sitzes desjenigen Rechtsträgers, dessen Gläubiger sie sind, als bekannt gemacht gilt, ihren Anspruch nach Grund und Höhe schriftlich anmelden, Sicherheit zu leisten, soweit sie nicht Befriedigung verlangen können. Dieses Recht steht den Gläubigern jedoch nur zu, wenn sie glaubhaft machen, dass durch die Verschmelzung die Erfüllung ihrer Forderung gefährdet wird. Das Recht, Sicherheitsleistung zu verlangen, steht Gläubigern nicht zu, die im Falle der Insolvenz ein Recht auf vorzugsweise Befriedigung aus einer Deckungsmasse haben, die nach gesetzlicher Vorschrift zu ihrem Schutz errichtet und staatlich überwacht ist."
    },
    {
      "date": "2025-09-23",
      "id": "130991",
      "original_text": "Registerbekanntmachung nach dem Umwandlungsgesetz\nBerlin Amtsgericht Berlin (Charlottenburg) HRA 64653\nRestaurant Marea Inh. Mandeep Singh Rakhra e. K. – Berlin",
      "type": "Registerbekanntmachung nach dem Umwandlungsgesetz",
      "state": "Berlin",
      "amtsgericht": "Amtsgericht Berlin (Charlottenburg)",
      "registernummer": "HRA 64653",
      "registerart": "HRA",
      "company_name": "Restaurant Marea Inh. Mandeep Singh Rakhra e. K.",
      "company_seat": "Berlin",
      "details": "23.09.2025 (Bekanntmachungsdatum)\n\nBerlin Amtsgericht Berlin (Charlottenburg) HRA 64653\nRegisterbekanntmachung nach dem Umwandlungsgesetz 22.09.2025 (Eintragungsdatum)\n\nRestaurant Marea Inh. Mandeep Singh Rakhra e. K.\nEinzelkaufmann / Einzelkauffrau\nBerlin\n\nZu Eintragungsnummer 2 vom 22.09.2025 wird als nicht eingetragen veröffentlicht: Den Gläubigern der an der Spaltung beteiligten Rechtsträger ist, wenn sie binnen sechs Monaten nach dem Tag, an dem die Eintragung der Spaltung in das Register des Sitzes desjenigen Rechtsträgers, dessen Gläubiger sie sind, als bekannt gemacht gilt, ihren Anspruch nach Grund und Höhe schriftlich anmelden, Sicherheit zu leisten, soweit sie nicht Befriedigung verlangen können. Dieses Recht steht den Gläubigern jedoch nur zu, wenn sie glaubhaft machen, dass durch die Spaltung die Erfüllung ihrer Forderung gefährdet wird. Das Recht, Sicherheitsleistung zu verlangen, steht Gläubigern nicht zu, die im Falle der Insolvenz ein Recht auf vorzugsweise Befriedigung aus einer Deckungsmasse haben, die nach gesetzlicher Vorschrift zu ihrem Schutz errichtet und staatlich überwacht ist."
    },
    {
      "date": "2025-09-23",
      "id": "130992",
      "original_text": "Registerbekanntmachung nach dem Umwandlungsgesetz\nBaden-Württemberg Amtsgericht Freiburg HRB 705035\nCrisis24 GmbH – Konstanz",
      "type": "Registerbekanntmachung nach dem Umwandlungsgesetz",
      "state": "Baden-Württemberg",
      "amtsgericht": "Amtsgericht Freiburg",
      "registernummer": "HRB 705035",
      "registerart": "HRB",
      "company_name": "Crisis24 GmbH",
      "company_seat": "Konstanz",
      "details": "23.09.2025 (Bekanntmachungsdatum)\n\nBaden-Württemberg Amtsgericht Freiburg HRB 705035\nRegisterbekanntmachung nach dem Umwandlungsgesetz 23.09.2025 (Eintragungsdatum)\n\nCrisis24 GmbH\nGesellschaft mit beschränkter Haftung\nKonstanz\n\nDen Gläubigern der an der Verschmelzung beteiligten Rechtsträger ist, wenn sie binnen sechs Monaten nach dem Tag, an dem die Eintragung der Verschmelzung in das Register des Sitzes desjenigen Rechtsträgers, dessen Gläubiger sie sind, nach § 19 Abs. 3 UmwG als bekanntgemacht gilt, ihren Anspruch nach Grund und Höhe schriftlich anmelden, Sicherheit zu leisten, soweit sie nicht Befriedigung verlangen können. Dieses Recht steht den Gläubigern jedoch nur zu, wenn sie glaubhaft machen, dass durch die Verschmelzung die Erfüllung ihrer Forderung gefährdet wird."
    },
    {
      "date": "2025-09-23",
      "id": "130993",
      "original_text": "Registerbekanntmachung nach dem Umwandlungsgesetz\nBerlin Amtsgericht Berlin (Charlottenburg) HRB 279475\nM & G Gastro GmbH – Berlin",
      "type": "Registerbekanntmachung nach dem Umwandlungsgesetz",
      "state": "Berlin",
      "amtsgericht": "Amtsgericht Berlin (Charlottenburg)",
      "registernummer": "HRB 279475",
      "registerart": "HRB",
      "company_name": "M & G Gastro GmbH",
      "company_seat": "Berlin",
      "details": "23.09.2025 (Bekanntmachungsdatum)\n\nBerlin Amtsgericht Berlin (Charlottenburg) HRB 279475\nRegisterbekanntmachung nach dem Umwandlungsgesetz 22.09.2025 (Eintragungsdatum)\n\nM & G Gastro GmbH\nGesellschaft mit beschränkter Haftung\nBerlin\n\nZu Eintragungsnummer 1 vom 22.09.2025 wird als nicht eingetragen veröffentlicht: Den Gläubigern der an der Spaltung beteiligten Rechtsträger ist, wenn sie binnen sechs Monaten nach dem Tag, an dem die Eintragung der Spaltung in das Register des Sitzes desjenigen Rechtsträgers, dessen Gläubiger sie sind, als bekannt gemacht gilt, ihren Anspruch nach Grund und Höhe schriftlich anmelden, Sicherheit zu leisten, soweit sie nicht Befriedigung verlangen können. Dieses Recht steht den Gläubigern jedoch nur zu, wenn sie glaubhaft machen, dass durch die Spaltung die Erfüllung ihrer Forderung gefährdet wird. Das Recht, Sicherheitsleistung zu verlangen, steht Gläubigern nicht zu, die im Falle der Insolvenz ein Recht auf vorzugsweise Befriedigung aus einer Deckungsmasse haben, die nach gesetzlicher Vorschrift zu ihrem Schutz errichtet und staatlich überwacht ist."
    },
    {
      "date": "2025-09-23",
      "id": "130994",
      "original_text": "Registerbekanntmachung nach dem Umwandlungsgesetz\nHamburg Amtsgericht Hamburg HRA 126377\nSTERNPARTNER SE & Co. KG – Hamburg",
      "type": "Registerbekanntmachung nach dem Umwandlungsgesetz",
      "state": "Hamburg",
      "amtsgericht": "Amtsgericht Hamburg",
      "registernummer": "HRA 126377",
      "registerart": "HRA",
      "company_name": "STERNPARTNER SE & Co. KG",
      "company_seat": "Hamburg",
      "details": "23.09.2025 (Bekanntmachungsdatum)\n\nHamburg Amtsgericht Hamburg HRA 126377\nRegisterbekanntmachung nach dem Umwandlungsgesetz 23.09.2025 (Eintragungsdatum)\n\nSTERNPARTNER SE & Co. KG\nKommanditgesellschaft\nHamburg\n\nAls nicht eingetragen wird bekannt gemacht:\nDen Gläubigern der an der Verschmelzung beteiligten Gesellschaften ist, wenn sie binnen sechs Monaten nach dem Tag, an dem die Eintragung der Verschmelzung in das Register des Sitzes desjenigen Rechtsträgers, dessen Gläubiger sie sind, nach § 19 Absatz 3 UmwG als bekannt gemacht gilt, ihren Anspruch nach Grund und Höhe schriftlich anmelden, Sicherheit zu leisten, soweit sie nicht Befriedigung verlangen können. Dieses Recht steht den Gläubigern jedoch nur zu, wenn sie glaubhaft machen, dass durch die Verschmelzung die Erfüllung ihrer Forderung gefährdet wird."
    },
    {
      "date": "2025-09-23",
      "id": "130995",
      "original_text": "Registerbekanntmachung nach dem Umwandlungsgesetz\nSchleswig-Holstein Amtsgericht Pinneberg HRB 434 EL\nHandelsgesellschaft Thies Kremer mbH – Barmstedt",
      "type": "Registerbekanntmachung nach dem Umwandlungsgesetz",
      "state": "Schleswig-Holstein",
      "amtsgericht": "Amtsgericht Pinneberg",
      "registernummer": "HRB 434 EL",
      "registerart": "HRB",
      "company_name": "Handelsgesellschaft Thies Kremer mbH",
      "company_seat": "Barmstedt",
      "details": "23.09.2025 (Bekanntmachungsdatum)\n\nSchleswig-Holstein Amtsgericht Pinneberg HRB 434 EL\nRegisterbekanntmachung nach dem Umwandlungsgesetz 23.09.2025 (Eintragungsdatum)\n\nHandelsgesellschaft Thies Kremer mbH\nGesellschaft mit beschränkter Haftung\nBarmstedt\n\nZu Eintragungsnummer 8 vom 23.09.2025 wird als nicht eingetragen veröffentlicht: Den Gläubigern der an der Verschmelzung beteiligten Rechtsträger ist, wenn sie binnen sechs Monaten nach dem Tag, an dem die Eintragung der Verschmelzung in das Register des Sitzes desjenigen Rechtsträgers, dessen Gläubiger sie sind, als bekannt gemacht gilt, ihren Anspruch nach Grund und Höhe schriftlich anmelden, Sicherheit zu leisten, soweit sie nicht Befriedigung verlangen können. Dieses Recht steht den Gläubigern jedoch nur zu, wenn sie glaubhaft machen, dass durch die Verschmelzung die Erfüllung ihrer Forderung gefährdet wird. Das Recht, Sicherheitsleistung zu verlangen, steht Gläubigern nicht zu, die im Falle der Insolvenz ein Recht auf vorzugsweise Befriedigung aus einer Deckungsmasse haben, die nach gesetzlicher Vorschrift zu ihrem Schutz errichtet und staatlich überwacht ist."
    },
    {
      "date": "2025-09-23",
      "id": "130996",
      "original_text": "Einreichung neuer Dokumente\nBerlin Amtsgericht Berlin (Charlottenburg) HRB 271697\nN26 Bank SE – Berlin",
      "type": "Einreichung neuer Dokumente",
      "state": "Berlin",
      "amtsgericht": "Amtsgericht Berlin (Charlottenburg)",
      "registernummer": "HRB 271697",
      "registerart": "HRB",
      "company_name": "N26 Bank SE",
      "company_seat": "Berlin",
      "details": "23.09.2025 (Bekanntmachungsdatum)\n\nBerlin Amtsgericht Berlin (Charlottenburg) HRB 271697\nEinreichung neuer Dokumente\n\nN26 Bank SE\nEuropäische Aktiengesellschaft (SE)\nBerlin\n\nAls nicht eingetragen wird veröffentlicht: Es wurde eine neue Liste der Aufsichtsratsmitglieder eingereicht (§ 106 AktG)."
    },
    {
      "date": "2025-09-23",
      "id": "130997",
      "original_text": "Registerbekanntmachung nach dem Umwandlungsgesetz\nSchleswig-Holstein Amtsgericht Pinneberg HRB 166 EL\nVerwaltungsgesellschaft Kremer GmbH – Elmshorn",
      "type": "Registerbekanntmachung nach dem Umwandlungsgesetz",
      "state": "Schleswig-Holstein",
      "amtsgericht": "Amtsgericht Pinneberg",
      "registernummer": "HRB 166 EL",
      "registerart": "HRB",
      "company_name": "Verwaltungsgesellschaft Kremer GmbH",
      "company_seat": "Elmshorn",
      "details": "23.09.2025 (Bekanntmachungsdatum)\n\nSchleswig-Holstein Amtsgericht Pinneberg HRB 166 EL\nRegisterbekanntmachung nach dem Umwandlungsgesetz 23.09.2025 (Eintragungsdatum)\n\nVerwaltungsgesellschaft Kremer GmbH\nGesellschaft mit beschränkter Haftung\nElmshorn\n\nZu Eintragungsnummer 3 vom 23.09.2025 wird als nicht eingetragen veröffentlicht:  Als nicht eingetragen wird veröffentlicht: Den Gläubigern der an der Verschmelzung beteiligten Rechtsträger ist, wenn sie binnen sechs Monaten nach dem Tag, an dem die Eintragung der Verschmelzung in das Register des Sitzes desjenigen Rechtsträgers, dessen Gläubiger sie sind, als bekannt gemacht gilt, ihren Anspruch nach Grund und Höhe schriftlich anmelden, Sicherheit zu leisten, soweit sie nicht Befriedigung verlangen können. Dieses Recht steht den Gläubigern jedoch nur zu, wenn sie glaubhaft machen, dass durch die Verschmelzung die Erfüllung ihrer Forderung gefährdet wird. Das Recht, Sicherheitsleistung zu verlangen, steht Gläubigern nicht zu, die im Falle der Insolvenz ein Recht auf vorzugsweise Befriedigung aus einer Deckungsmasse haben, die nach gesetzlicher Vorschrift zu ihrem Schutz errichtet und staatlich überwacht ist."
    },
    {
      "date": "2025-09-23",
      "id": "130998",
      "original_text": "Löschungsankündigung\nBrandenburg Amtsgericht Frankfurt/Oder HRB 17333\nCONCEPTS Training & Recruiting Services UG (haftungsbeschränkt) – Gosen-Neu Zittau",
      "type": "Löschungsankündigung",
      "state": "Brandenburg",
      "amtsgericht": "Amtsgericht Frankfurt/Oder",
      "registernummer": "HRB 17333",
      "registerart": "HRB",
      "company_name": "CONCEPTS Training & Recruiting Services UG (haftungsbeschränkt)",
      "company_seat": "Gosen-Neu Zittau",
      "details": "23.09.2025 (Bekanntmachungsdatum)\n\nBrandenburg Amtsgericht Frankfurt/Oder HRB 17333\nLöschungsankündigung\n\nCONCEPTS Training & Recruiting Services UG (haftungsbeschränkt)\nGesellschaft mit beschränkter Haftung\nGosen-Neu Zittau\n\nBei der nachstehenden Gesellschaft wird das Amtslöschungsverfahren gemäß § 394 FamFG eingeleitet."
    },
    {
      "date": "2025-09-23",
      "id": "130999",
      "original_text": "Registerbekanntmachung nach dem Umwandlungsgesetz\nBerlin Amtsgericht Berlin (Charlottenburg) HRB 215897\nMein Versicherungskontor GmbH – Berlin",
      "type": "Registerbekanntmachung nach dem Umwandlungsgesetz",
      "state": "Berlin",
      "amtsgericht": "Amtsgericht Berlin (Charlottenburg)",
      "registernummer": "HRB 215897",
      "registerart": "HRB",
      "company_name": "Mein Versicherungskontor GmbH",
      "company_seat": "Berlin",
      "details": "23.09.2025 (Bekanntmachungsdatum)\n\nBerlin Amtsgericht Berlin (Charlottenburg) HRB 215897\nRegisterbekanntmachung nach dem Umwandlungsgesetz 23.09.2025 (Eintragungsdatum)\n\nMein Versicherungskontor GmbH\nGesellschaft mit beschränkter Haftung\nBerlin\n\nZu Eintragungsnummer 4 vom 23.09.2025 wird als nicht eingetragen veröffentlicht:\nDen Gläubigern der an der Verschmelzung beteiligten Rechtsträger ist, wenn sie binnen sechs Monaten nach dem Tag, an dem die Eintragung der Verschmelzung in das Register des Sitzes desjenigen Rechtsträgers, dessen Gläubiger sie sind, als bekannt gemacht gilt, ihren Anspruch nach Grund und Höhe schriftlich anmelden, Sicherheit zu leisten, soweit sie nicht Befriedigung verlangen können. Dieses Recht steht den Gläubigern jedoch nur zu, wenn sie glaubhaft machen, dass durch die Verschmelzung die Erfüllung ihrer Forderung gefährdet wird. Das Recht, Sicherheitsleistung zu verlangen, steht Gläubigern nicht zu, die im Falle der Insolvenz ein Recht auf vorzugsweise Befriedigung aus einer Deckungsmasse haben, die nach gesetzlicher Vorschrift zu ihrem Schutz errichtet und staatlich überwacht ist."
    },
    {
      "date": "2025-09-23",
      "id": "131000",
      "original_text": "Registerbekanntmachung nach dem Umwandlungsgesetz\nBaden-Württemberg Amtsgericht Stuttgart HRB 744176\ncf Fitness Bad Rappenau GmbH – Bad Rappenau",
      "type": "Registerbekanntmachung nach dem Umwandlungsgesetz",
      "state": "Baden-Württemberg",
      "amtsgericht": "Amtsgericht Stuttgart",
      "registernummer": "HRB 744176",
      "registerart": "HRB",
      "company_name": "cf Fitness Bad Rappenau GmbH",
      "company_seat": "Bad Rappenau",
      "details": "23.09.2025 (Bekanntmachungsdatum)\n\nBaden-Württemberg Amtsgericht Stuttgart HRB 744176\nRegisterbekanntmachung nach dem Umwandlungsgesetz 23.09.2025 (Eintragungsdatum)\n\ncf Fitness Bad Rappenau GmbH\nGesellschaft mit beschränkter Haftung\nBad Rappenau\n\nAls nicht eingetragen wird bekanntgemacht:\nDen Gläubigern der an der Verschmelzung beteiligten Rechtsträger ist, wenn sie binnen sechs Monaten nach dem Tag, an dem die Eintragung der Verschmelzung in das Register des Sitzes desjenigen Rechtsträgers, dessen Gläubiger sie sind, nach § 19 Abs. 3 UmwG als bekanntgemacht gilt, ihren Anspruch nach Grund und Höhe schriftlich anmelden, Sicherheit zu leisten, soweit sie nicht Befriedigung verlangen können. Dieses Recht steht den Gläubigern jedoch nur zu, wenn sie glaubhaft machen, dass durch die Verschmelzung die Erfüllung ihrer Forderung gefährdet wird."
    },
    {
      "date": "2025-09-23",
      "id": "131001",
      "original_text": "Löschungsankündigung\nBrandenburg Amtsgericht Potsdam HRB 35552\nD+K Sport & Freizeit GmbH – Werder (Havel)",
      "type": "Löschungsankündigung",
      "state": "Brandenburg",
      "amtsgericht": "Amtsgericht Potsdam",
      "registernummer": "HRB 35552",
      "registerart": "HRB",
      "company_name": "D+K Sport & Freizeit GmbH",
      "company_seat": "Werder (Havel)",
      "details": "23.09.2025 (Bekanntmachungsdatum)\n\nBrandenburg Amtsgericht Potsdam HRB 35552\nLöschungsankündigung\n\nD+K Sport & Freizeit GmbH\nGesellschaft mit beschränkter Haftung\nWerder (Havel)\n\nBei der nachstehenden Gesellschaft wird das Amtslöschungsverfahren gemäß § 394 FamFG eingeleitet. Widerspruchsfrist: 8  Wochen."
    },
    {
      "date": "2025-09-23",
      "id": "131002",
      "original_text": "Registerbekanntmachung nach dem Umwandlungsgesetz\nBaden-Württemberg Amtsgericht Stuttgart HRA 722118\nIven und Iven-Finkbeiner Therapiezentrum OHG – Baiersbronn",
      "type": "Registerbekanntmachung nach dem Umwandlungsgesetz",
      "state": "Baden-Württemberg",
      "amtsgericht": "Amtsgericht Stuttgart",
      "registernummer": "HRA 722118",
      "registerart": "HRA",
      "company_name": "Iven und Iven-Finkbeiner Therapiezentrum OHG",
      "company_seat": "Baiersbronn",
      "details": "23.09.2025 (Bekanntmachungsdatum)\n\nBaden-Württemberg Amtsgericht Stuttgart HRA 722118\nRegisterbekanntmachung nach dem Umwandlungsgesetz 23.09.2025 (Eintragungsdatum)\n\nIven und Iven-Finkbeiner Therapiezentrum OHG\nOffene Handelsgesellschaft\nBaiersbronn\n\nAls nicht eingetragen wird bekanntgemacht:\nDen Gläubigern der an der Verschmelzung beteiligten Rechtsträger ist, wenn sie binnen sechs Monaten nach dem Tag, an dem die Eintragung der Verschmelzung in das Register des Sitzes desjenigen Rechtsträgers, dessen Gläubiger sie sind, nach § 19 Abs. 3 UmwG als bekanntgemacht gilt, ihren Anspruch nach Grund und Höhe schriftlich anmelden, Sicherheit zu leisten, soweit sie nicht Befriedigung verlangen können. Dieses Recht steht den Gläubigern jedoch nur zu, wenn sie glaubhaft machen, dass durch die Verschmelzung die Erfüllung ihrer Forderung gefährdet wird."
    },
    {
      "date": "2025-09-23",
      "id": "131003",
      "original_text": "Löschungsankündigung\nSachsen Amtsgericht Chemnitz HRB 32383\nKAL Baugesellschaft UG (haftungsbeschränkt) – Burgstädt",
      "type": "Löschungsankündigung",
      "state": "Sachsen",
      "amtsgericht": "Amtsgericht Chemnitz",
      "registernummer": "HRB 32383",
      "registerart": "HRB",
      "company_name": "KAL Baugesellschaft UG (haftungsbeschränkt)",
      "company_seat": "Burgstädt",
      "details": "23.09.2025 (Bekanntmachungsdatum)\n\nSachsen Amtsgericht Chemnitz HRB 32383\nLöschungsankündigung\n\nKAL Baugesellschaft UG (haftungsbeschränkt)\nGesellschaft mit beschränkter Haftung\nBurgstädt\n\nDas Registergericht beabsichtigt, die im Handelsregister eingetragene Gesellschaft von Amts wegen nach § 394 FamFG zu löschen. Die Frist zu Erhebung eines Widerspruchs gegen die beabsichtigte Löschung wird auf einen Monat festgesetzt."
    },
    {
      "date": "2025-09-23",
      "id": "131004",
      "original_text": "Einreichung neuer Dokumente\nSachsen Amtsgericht Leipzig HRB 42939\nQUARTERBACK New Energy Holding GmbH – Leipzig",
      "type": "Einreichung neuer Dokumente",
      "state": "Sachsen",
      "amtsgericht": "Amtsgericht Leipzig",
      "registernummer": "HRB 42939",
      "registerart": "HRB",
      "company_name": "QUARTERBACK New Energy Holding GmbH",
      "company_seat": "Leipzig",
      "details": "23.09.2025 (Bekanntmachungsdatum)\n\nSachsen Amtsgericht Leipzig HRB 42939\nEinreichung neuer Dokumente\n\nQUARTERBACK New Energy Holding GmbH\nGesellschaft mit beschränkter Haftung\nLeipzig\n\nAm 11.09.2025 wurde beim Handelsregister des Amtsgerichts Leipzig die Liste der Mitglieder des Aufsichtsrats gemäß § 52 GmbHG eingereicht."
    },
    {
      "date": "2025-09-23",
      "id": "131005",
      "original_text": "Sonstige Registerbekanntmachung\nSachsen Amtsgericht Leipzig HRB 34230\nAone Deutschland AG – Leipzig",
      "type": "Sonstige Registerbekanntmachung",
      "state": "Sachsen",
      "amtsgericht": "Amtsgericht Leipzig",
      "registernummer": "HRB 34230",
      "registerart": "HRB",
      "company_name": "Aone Deutschland AG",
      "company_seat": "Leipzig",
      "details": "23.09.2025 (Bekanntmachungsdatum)\n\nSachsen Amtsgericht Leipzig HRB 34230\nSonstige Registerbekanntmachung\n\nAone Deutschland AG\nAktiengesellschaft\nLeipzig\n\nAm 19.06.2025 wurde beim Handelsregister des Amtsgerichts Leipzig die Liste der Mitglieder des Aufsichtsrats gemäß § 106 AktG eingereicht."
    },
    {
      "date": "2025-09-23",
      "id": "131006",
      "original_text": "Löschungsankündigung\nSachsen Amtsgericht Dresden HRB 23067\nDamwild Vermarktung \"PROVO\" GmbH – Rosenthal-Bielatal",
      "type": "Löschungsankündigung",
      "state": "Sachsen",
      "amtsgericht": "Amtsgericht Dresden",
      "registernummer": "HRB 23067",
      "registerart": "HRB",
      "company_name": "Damwild Vermarktung \"PROVO\" GmbH",
      "company_seat": "Rosenthal-Bielatal",
      "details": "23.09.2025 (Bekanntmachungsdatum)\n\nSachsen Amtsgericht Dresden HRB 23067\nLöschungsankündigung\n\nDamwild Vermarktung \"PROVO\" GmbH\nGesellschaft mit beschränkter Haftung\nRosenthal-Bielatal\n\nDas Registergericht beabsichtigt, die im Handelsregister eingetragene Gesellschaft von Amts wegen nach § 394 FamFG zu löschen. Die Frist zu Erhebung eines Widerspruchs gegen die beabsichtigte Löschung wird auf einen Monat festgesetzt."
    },
    {
      "date": "2025-09-23",
      "id": "131007",
      "original_text": "Registerbekanntmachung nach dem Umwandlungsgesetz\nNiedersachsen Amtsgericht Aurich HRA 204222\nSergio Casto Lizenzgeber Inh. Sergio Casto e.K. – Norderney",
      "type": "Registerbekanntmachung nach dem Umwandlungsgesetz",
      "state": "Niedersachsen",
      "amtsgericht": "Amtsgericht Aurich",
      "registernummer": "HRA 204222",
      "registerart": "HRA",
      "company_name": "Sergio Casto Lizenzgeber Inh. Sergio Casto e.K.",
      "company_seat": "Norderney",
      "details": "23.09.2025 (Bekanntmachungsdatum)\n\nNiedersachsen Amtsgericht Aurich HRA 204222\nRegisterbekanntmachung nach dem Umwandlungsgesetz 23.09.2025 (Eintragungsdatum)\n\nSergio Casto Lizenzgeber Inh. Sergio Casto e.K.\nEinzelkaufmann / Einzelkauffrau\nNorderney\n\nDen Gläubigern der an der Ausgliederung beteiligten Rechtsträger ist, wenn sie binnen sechs Monaten nach dem Tag, an dem die Eintragung der Ausgliederung in das Register des Sitzes desjenigen Rechtsträgers, dessen Gläubiger sie sind, nach § 19 Abs. 3 UmwG als bekannt gemacht gilt, ihren Anspruch nach Grund und Höhe schriftlich anmelden, Sicherheit zu leisten, soweit sie nicht Befriedigung verlangen können. Dieses Recht steht den Gläubigern jedoch nur zu, wenn sie glaubhaft machen, dass durch die Ausgliederung die Erfüllung der Forderung gefährdet wird."
    },
    {
      "date": "2025-09-23",
      "id": "131008",
      "original_text": "Registerbekanntmachung nach dem Umwandlungsgesetz\nNiedersachsen Amtsgericht Hannover HRA 206788\nOlaf Kirchner e.K. – Hemmingen",
      "type": "Registerbekanntmachung nach dem Umwandlungsgesetz",
      "state": "Niedersachsen",
      "amtsgericht": "Amtsgericht Hannover",
      "registernummer": "HRA 206788",
      "registerart": "HRA",
      "company_name": "Olaf Kirchner e.K.",
      "company_seat": "Hemmingen",
      "details": "23.09.2025 (Bekanntmachungsdatum)\n\nNiedersachsen Amtsgericht Hannover HRA 206788\nRegisterbekanntmachung nach dem Umwandlungsgesetz 23.09.2025 (Eintragungsdatum)\n\nOlaf Kirchner e.K.\nEinzelkaufmann / Einzelkauffrau\nHemmingen\n\nDen Gläubigern der an der Verschmelzung beteiligten Rechtsträger ist, wenn sie binnen sechs Monaten nach dem Tag, an dem die Eintragung der Verschmelzung in das Register des Sitzes desjenigen Rechtsträgers, dessen Gläubiger sie sind, nach § 19  Abs.  3 UmwG als bekannt gemacht gilt, ihren Anspruch nach Grund und Höhe schriftlich anmelden, Sicherheit zu leisten, soweit sie nicht Befriedigung verlangen können. Dieses Recht steht den Gläubigern jedoch nur zu, wenn sie glaubhaft machen, dass durch die Verschmelzung die Erfüllung der Forderung gefährdet wird."
    },
    {
      "date": "2025-09-23",
      "id": "131009",
      "original_text": "Registerbekanntmachung nach dem Umwandlungsgesetz\nNiedersachsen Amtsgericht Tostedt HRA 203244\nBauvertragsunterstützung Yasser Chehade e.K. – Neu Wulmstorf",
      "type": "Registerbekanntmachung nach dem Umwandlungsgesetz",
      "state": "Niedersachsen",
      "amtsgericht": "Amtsgericht Tostedt",
      "registernummer": "HRA 203244",
      "registerart": "HRA",
      "company_name": "Bauvertragsunterstützung Yasser Chehade e.K.",
      "company_seat": "Neu Wulmstorf",
      "details": "23.09.2025 (Bekanntmachungsdatum)\n\nNiedersachsen Amtsgericht Tostedt HRA 203244\nRegisterbekanntmachung nach dem Umwandlungsgesetz 23.09.2025 (Eintragungsdatum)\n\nBauvertragsunterstützung Yasser Chehade e.K.\nEinzelkaufmann / Einzelkauffrau\nNeu Wulmstorf\n\nDen Gläubigern der an der Verschmelzung beteiligten Rechtsträger ist, wenn sie binnen sechs Monaten nach dem Tag, an dem die Eintragung der Verschmelzung in das Register des Sitzes desjenigen Rechtsträgers, dessen Gläubiger sie sind, nach § 19  Abs.  3 UmwG als bekannt gemacht gilt, ihren Anspruch nach Grund und Höhe schriftlich anmelden, Sicherheit zu leisten, soweit sie nicht Befriedigung verlangen können. Dieses Recht steht den Gläubigern jedoch nur zu, wenn sie glaubhaft machen, dass durch die Verschmelzung die Erfüllung der Forderung gefährdet wird."
    },
    {
      "date": "2025-09-23",
      "id": "131010",
      "original_text": "Registerbekanntmachung nach dem Umwandlungsgesetz\nNiedersachsen Amtsgericht Aurich HRB 207731\nDa Sergio Lizenzgesellschaft mbH – Norderney",
      "type": "Registerbekanntmachung nach dem Umwandlungsgesetz",
      "state": "Niedersachsen",
      "amtsgericht": "Amtsgericht Aurich",
      "registernummer": "HRB 207731",
      "registerart": "HRB",
      "company_name": "Da Sergio Lizenzgesellschaft mbH",
      "company_seat": "Norderney",
      "details": "23.09.2025 (Bekanntmachungsdatum)\n\nNiedersachsen Amtsgericht Aurich HRB 207731\nRegisterbekanntmachung nach dem Umwandlungsgesetz 23.09.2025 (Eintragungsdatum)\n\nDa Sergio Lizenzgesellschaft mbH\nGesellschaft mit beschränkter Haftung\nNorderney\n\nDen Gläubigern der an der Ausgliederung beteiligten Rechtsträger ist, wenn sie binnen sechs Monaten nach dem Tag, an dem die Eintragung der Ausgliederung in das Register des Sitzes desjenigen Rechtsträgers, dessen Gläubiger sie sind, nach § 19 Abs. 3 UmwG als bekannt gemacht gilt, ihren Anspruch nach Grund und Höhe schriftlich anmelden, Sicherheit zu leisten, soweit sie nicht Befriedigung verlangen können. Dieses Recht steht den Gläubigern jedoch nur zu, wenn sie glaubhaft machen, dass durch die Ausgliederung die Erfüllung der Forderung gefährdet wird."
    },
    {
      "date": "2025-09-23",
      "id": "131011",
      "original_text": "Löschungsankündigung\nNiedersachsen Amtsgericht Hannover HRB 215487\nEffekt Messe Lichtwerbung & Messebau UG (haftungsbeschränkt) – Hameln",
      "type": "Löschungsankündigung",
      "state": "Niedersachsen",
      "amtsgericht": "Amtsgericht Hannover",
      "registernummer": "HRB 215487",
      "registerart": "HRB",
      "company_name": "Effekt Messe Lichtwerbung & Messebau UG (haftungsbeschränkt)",
      "company_seat": "Hameln",
      "details": "23.09.2025 (Bekanntmachungsdatum)\n\nNiedersachsen Amtsgericht Hannover HRB 215487\nLöschungsankündigung\n\nEffekt Messe Lichtwerbung & Messebau UG (haftungsbeschränkt)\nGesellschaft mit beschränkter Haftung\nHameln\n\nDas Registergericht beabsichtigt, die Gesellschaft von Amts wegen nach § 394 FamFG zu löschen. Die Frist zur Erhebung eines Widerspruchs ist auf 1 Monat ab dieser Registerbekanntmachung festgesetzt."
    },
    {
      "date": "2025-09-23",
      "id": "131012",
      "original_text": "Registerbekanntmachung nach dem Umwandlungsgesetz\nNiedersachsen Amtsgericht Hannover HRB 202916\nDavidoff GmbH – Hannover",
      "type": "Registerbekanntmachung nach dem Umwandlungsgesetz",
      "state": "Niedersachsen",
      "amtsgericht": "Amtsgericht Hannover",
      "registernummer": "HRB 202916",
      "registerart": "HRB",
      "company_name": "Davidoff GmbH",
      "company_seat": "Hannover",
      "details": "23.09.2025 (Bekanntmachungsdatum)\n\nNiedersachsen Amtsgericht Hannover HRB 202916\nRegisterbekanntmachung nach dem Umwandlungsgesetz 23.09.2025 (Eintragungsdatum)\n\nDavidoff GmbH\nGesellschaft mit beschränkter Haftung\nHannover\n\nDen Gläubigern der an der Abspaltung beteiligten Rechtsträger ist, wenn sie binnen sechs Monaten nach dem Tag, an dem die Eintragung der Abspaltung in das Register des Sitzes desjenigen Rechtsträgers, dessen Gläubiger sie sind, nach § 19 Abs. 3 UmwG als bekannt gemacht gilt, ihren Anspruch nach Grund und Höhe schriftlich anmelden, Sicherheit zu leisten, soweit sie nicht Befriedigung verlangen können. Dieses Recht steht den Gläubigern jedoch nur zu, wenn sie glaubhaft machen, dass durch die Abspaltung die Erfüllung der Forderung gefährdet wird."
    },
    {
      "date": "2025-09-23",
      "id": "131013",
      "original_text": "Registerbekanntmachung nach dem Umwandlungsgesetz\nNiedersachsen Amtsgericht Hannover HRB 215186\nOKCS UG (haftungsbeschränkt) – Hannover",
      "type": "Registerbekanntmachung nach dem Umwandlungsgesetz",
      "state": "Niedersachsen",
      "amtsgericht": "Amtsgericht Hannover",
      "registernummer": "HRB 215186",
      "registerart": "HRB",
      "company_name": "OKCS UG (haftungsbeschränkt)",
      "company_seat": "Hannover",
      "details": "23.09.2025 (Bekanntmachungsdatum)\n\nNiedersachsen Amtsgericht Hannover HRB 215186\nRegisterbekanntmachung nach dem Umwandlungsgesetz 23.09.2025 (Eintragungsdatum)\n\nOKCS UG (haftungsbeschränkt)\nGesellschaft mit beschränkter Haftung\nHannover\n\nDen Gläubigern der an der Verschmelzung beteiligten Rechtsträger ist, wenn sie binnen sechs Monaten nach dem Tag, an dem die Eintragung der Verschmelzung in das Register des Sitzes desjenigen Rechtsträgers, dessen Gläubiger sie sind, nach § 19  Abs.  3 UmwG als bekannt gemacht gilt, ihren Anspruch nach Grund und Höhe schriftlich anmelden, Sicherheit zu leisten, soweit sie nicht Befriedigung verlangen können. Dieses Recht steht den Gläubigern jedoch nur zu, wenn sie glaubhaft machen, dass durch die Verschmelzung die Erfüllung der Forderung gefährdet wird."
    },
    {
      "date": "2025-09-23",
      "id": "131014",
      "original_text": "Registerbekanntmachung nach dem Umwandlungsgesetz\nNiedersachsen Amtsgericht Walsrode HRB 213033\nRunnebaum Holding GmbH – Diepholz",
      "type": "Registerbekanntmachung nach dem Umwandlungsgesetz",
      "state": "Niedersachsen",
      "amtsgericht": "Amtsgericht Walsrode",
      "registernummer": "HRB 213033",
      "registerart": "HRB",
      "company_name": "Runnebaum Holding GmbH",
      "company_seat": "Diepholz",
      "details": "23.09.2025 (Bekanntmachungsdatum)\n\nNiedersachsen Amtsgericht Walsrode HRB 213033\nRegisterbekanntmachung nach dem Umwandlungsgesetz 23.09.2025 (Eintragungsdatum)\n\nRunnebaum Holding GmbH\nGesellschaft mit beschränkter Haftung\nDiepholz\n\nDen Gläubigern der an der formwechselnden Umwandlung beteiligten Rechtsträger ist, wenn sie binnen sechs Monaten nach dem Tag, an dem die Eintragung der Umwandlung in das Register des Sitzes desjenigen Rechtsträgers, dessen Gläubiger sie sind, nach § 19 Abs. 3 UmwG als bekannt gemacht gilt, ihren Anspruch nach Grund und Höhe schriftlich anmelden, Sicherheit zu leisten, soweit sie nicht Befriedigung verlangen können. Dieses Recht steht den Gläubigern jedoch nur zu, wenn sie glaubhaft machen, dass durch die formwechselnde Umwandlung die Erfüllung der Forderung gefährdet wird."
    },
    {
      "date": "2025-09-23",
      "id": "131015",
      "original_text": "Registerbekanntmachung nach dem Umwandlungsgesetz\nNiedersachsen Amtsgericht Göttingen HRB 206638\nBettels Performance GmbH – Northeim",
      "type": "Registerbekanntmachung nach dem Umwandlungsgesetz",
      "state": "Niedersachsen",
      "amtsgericht": "Amtsgericht Göttingen",
      "registernummer": "HRB 206638",
      "registerart": "HRB",
      "company_name": "Bettels Performance GmbH",
      "company_seat": "Northeim",
      "details": "23.09.2025 (Bekanntmachungsdatum)\n\nNiedersachsen Amtsgericht Göttingen HRB 206638\nRegisterbekanntmachung nach dem Umwandlungsgesetz 23.09.2025 (Eintragungsdatum)\n\nBettels Performance GmbH\nGesellschaft mit beschränkter Haftung\nNortheim\n\nDen Gläubigern der an der formwechselnden Umwandlung beteiligten Rechtsträger ist, wenn sie binnen sechs Monaten nach dem Tag, an dem die Eintragung der Umwandlung in das Register des Sitzes desjenigen Rechtsträgers, dessen Gläubiger sie sind, nach § 19 Abs. 3 UmwG als bekannt gemacht gilt, ihren Anspruch nach Grund und Höhe schriftlich anmelden, Sicherheit zu leisten, soweit sie nicht Befriedigung verlangen können. Dieses Recht steht den Gläubigern jedoch nur zu, wenn sie glaubhaft machen, dass durch die formwechselnde Umwandlung die Erfüllung der Forderung gefährdet wird."
    },
    {
      "date": "2025-09-23",
      "id": "131016",
      "original_text": "Löschungsankündigung\nNiedersachsen Amtsgericht Braunschweig HRB 208612\nFixBau GmbH – Salzgitter",
      "type": "Löschungsankündigung",
      "state": "Niedersachsen",
      "amtsgericht": "Amtsgericht Braunschweig",
      "registernummer": "HRB 208612",
      "registerart": "HRB",
      "company_name": "FixBau GmbH",
      "company_seat": "Salzgitter",
      "details": "23.09.2025 (Bekanntmachungsdatum)\n\nNiedersachsen Amtsgericht Braunschweig HRB 208612\nLöschungsankündigung\n\nFixBau GmbH\nGesellschaft mit beschränkter Haftung\nSalzgitter\n\nDas Registergericht beabsichtigt, die Gesellschaft von Amts wegen nach § 394 FamFG zu löschen. Die Frist zur Erhebung eines Widerspruchs ist auf 1 Monat ab dieser Registerbekanntmachung festgesetzt."
    },
    {
      "date": "2025-09-23",
      "id": "131017",
      "original_text": "Registerbekanntmachung nach dem Umwandlungsgesetz\nNiedersachsen Amtsgericht Osnabrück HRA 209643\nMK Markus Klutzny e.K. – Schüttorf",
      "type": "Registerbekanntmachung nach dem Umwandlungsgesetz",
      "state": "Niedersachsen",
      "amtsgericht": "Amtsgericht Osnabrück",
      "registernummer": "HRA 209643",
      "registerart": "HRA",
      "company_name": "MK Markus Klutzny e.K.",
      "company_seat": "Schüttorf",
      "details": "23.09.2025 (Bekanntmachungsdatum)\n\nNiedersachsen Amtsgericht Osnabrück HRA 209643\nRegisterbekanntmachung nach dem Umwandlungsgesetz 23.09.2025 (Eintragungsdatum)\n\nMK Markus Klutzny e.K.\nEinzelkaufmann / Einzelkauffrau\nSchüttorf\n\nDen Gläubigern der an der Ausgliederung beteiligten Rechtsträger ist, wenn sie binnen sechs Monaten nach dem Tag, an dem die Eintragung der Ausgliederung in das Register des Sitzes desjenigen Rechtsträgers, dessen Gläubiger sie sind, nach § 19 Abs. 3 UmwG als bekannt gemacht gilt, ihren Anspruch nach Grund und Höhe schriftlich anmelden, Sicherheit zu leisten, soweit sie nicht Befriedigung verlangen können. Dieses Recht steht den Gläubigern jedoch nur zu, wenn sie glaubhaft machen, dass durch die Ausgliederung die Erfüllung der Forderung gefährdet wird."
    },
    {
      "date": "2025-09-23",
      "id": "131018",
      "original_text": "Registerbekanntmachung nach dem Umwandlungsgesetz\nNiedersachsen Amtsgericht Hildesheim HRB 208853\nPueblo Immobilienservice GmbH – Hildesheim",
      "type": "Registerbekanntmachung nach dem Umwandlungsgesetz",
      "state": "Niedersachsen",
      "amtsgericht": "Amtsgericht Hildesheim",
      "registernummer": "HRB 208853",
      "registerart": "HRB",
      "company_name": "Pueblo Immobilienservice GmbH",
      "company_seat": "Hildesheim",
      "details": "23.09.2025 (Bekanntmachungsdatum)\n\nNiedersachsen Amtsgericht Hildesheim HRB 208853\nRegisterbekanntmachung nach dem Umwandlungsgesetz 23.09.2025 (Eintragungsdatum)\n\nPueblo Immobilienservice GmbH\nGesellschaft mit beschränkter Haftung\nHildesheim\n\nDen Gläubigern der an der Verschmelzung beteiligten Rechtsträger ist, wenn sie binnen sechs Monaten nach dem Tag, an dem die Eintragung der Verschmelzung in das Register des Sitzes desjenigen Rechtsträgers, dessen Gläubiger sie sind, nach § 19  Abs.  3 UmwG als bekannt gemacht gilt, ihren Anspruch nach Grund und Höhe schriftlich anmelden, Sicherheit zu leisten, soweit sie nicht Befriedigung verlangen können. Dieses Recht steht den Gläubigern jedoch nur zu, wenn sie glaubhaft machen, dass durch die Verschmelzung die Erfüllung der Forderung gefährdet wird."
    },
    {
      "date": "2025-09-23",
      "id": "131019",
      "original_text": "Registerbekanntmachung nach dem Umwandlungsgesetz\nNiedersachsen Amtsgericht Hannover HRB 221014\nCorpance GmbH – Hannover",
      "type": "Registerbekanntmachung nach dem Umwandlungsgesetz",
      "state": "Niedersachsen",
      "amtsgericht": "Amtsgericht Hannover",
      "registernummer": "HRB 221014",
      "registerart": "HRB",
      "company_name": "Corpance GmbH",
      "company_seat": "Hannover",
      "details": "23.09.2025 (Bekanntmachungsdatum)\n\nNiedersachsen Amtsgericht Hannover HRB 221014\nRegisterbekanntmachung nach dem Umwandlungsgesetz 23.09.2025 (Eintragungsdatum)\n\nCorpance GmbH\nGesellschaft mit beschränkter Haftung\nHannover\n\nDen Gläubigern der an der Verschmelzung beteiligten Rechtsträger ist, wenn sie binnen sechs Monaten nach dem Tag, an dem die Eintragung der Verschmelzung in das Register des Sitzes desjenigen Rechtsträgers, dessen Gläubiger sie sind, nach § 19  Abs.  3 UmwG als bekannt gemacht gilt, ihren Anspruch nach Grund und Höhe schriftlich anmelden, Sicherheit zu leisten, soweit sie nicht Befriedigung verlangen können. Dieses Recht steht den Gläubigern jedoch nur zu, wenn sie glaubhaft machen, dass durch die Verschmelzung die Erfüllung der Forderung gefährdet wird."
    },
    {
      "date": "2025-09-23",
      "id": "131020",
      "original_text": "Registerbekanntmachung nach dem Umwandlungsgesetz\nNiedersachsen Amtsgericht Hannover HRB 229523\nD2 Management GmbH – Hannover",
      "type": "Registerbekanntmachung nach dem Umwandlungsgesetz",
      "state": "Niedersachsen",
      "amtsgericht": "Amtsgericht Hannover",
      "registernummer": "HRB 229523",
      "registerart": "HRB",
      "company_name": "D2 Management GmbH",
      "company_seat": "Hannover",
      "details": "23.09.2025 (Bekanntmachungsdatum)\n\nNiedersachsen Amtsgericht Hannover HRB 229523\nRegisterbekanntmachung nach dem Umwandlungsgesetz 23.09.2025 (Eintragungsdatum)\n\nD2 Management GmbH\nGesellschaft mit beschränkter Haftung\nHannover\n\nDen Gläubigern der an der Abspaltung beteiligten Rechtsträger ist, wenn sie binnen sechs Monaten nach dem Tag, an dem die Eintragung der Abspaltung in das Register des Sitzes desjenigen Rechtsträgers, dessen Gläubiger sie sind, nach § 19 Abs. 3 UmwG als bekannt gemacht gilt, ihren Anspruch nach Grund und Höhe schriftlich anmelden, Sicherheit zu leisten, soweit sie nicht Befriedigung verlangen können. Dieses Recht steht den Gläubigern jedoch nur zu, wenn sie glaubhaft machen, dass durch die Abspaltung die Erfüllung der Forderung gefährdet wird."
    },
    {
      "date": "2025-09-23",
      "id": "131021",
      "original_text": "Registerbekanntmachung nach dem Umwandlungsgesetz\nNiedersachsen Amtsgericht Osnabrück HRB 218125\nzwei.7 Equity VII GmbH – Osnabrück",
      "type": "Registerbekanntmachung nach dem Umwandlungsgesetz",
      "state": "Niedersachsen",
      "amtsgericht": "Amtsgericht Osnabrück",
      "registernummer": "HRB 218125",
      "registerart": "HRB",
      "company_name": "zwei.7 Equity VII GmbH",
      "company_seat": "Osnabrück",
      "details": "23.09.2025 (Bekanntmachungsdatum)\n\nNiedersachsen Amtsgericht Osnabrück HRB 218125\nRegisterbekanntmachung nach dem Umwandlungsgesetz 23.09.2025 (Eintragungsdatum)\n\nzwei.7 Equity VII GmbH\nGesellschaft mit beschränkter Haftung\nOsnabrück\n\nDen Gläubigern der an der Verschmelzung beteiligten Rechtsträger ist, wenn sie binnen sechs Monaten nach dem Tag, an dem die Eintragung der Verschmelzung in das Register des Sitzes desjenigen Rechtsträgers, dessen Gläubiger sie sind, nach § 19  Abs.  3 UmwG als bekannt gemacht gilt, ihren Anspruch nach Grund und Höhe schriftlich anmelden, Sicherheit zu leisten, soweit sie nicht Befriedigung verlangen können. Dieses Recht steht den Gläubigern jedoch nur zu, wenn sie glaubhaft machen, dass durch die Verschmelzung die Erfüllung der Forderung gefährdet wird."
    },
    {
      "date": "2025-09-23",
      "id": "131022",
      "original_text": "Registerbekanntmachung nach dem Umwandlungsgesetz\nNiedersachsen Amtsgericht Osnabrück HRB 131261 früher Amtsgericht Nordhorn\nHahn Putzlappen GmbH – Nordhorn",
      "type": "Registerbekanntmachung nach dem Umwandlungsgesetz",
      "state": "Niedersachsen",
      "amtsgericht": "Amtsgericht Osnabrück",
      "registernummer": "HRB 131261",
      "registerart": "HRB",
      "company_name": "Hahn Putzlappen GmbH",
      "company_seat": "Nordhorn",
      "former_amtsgericht": "Nordhorn",
      "details": "23.09.2025 (Bekanntmachungsdatum)\n\nNiedersachsen Amtsgericht Osnabrück HRB 131261 früher Amtsgericht Nordhorn\nRegisterbekanntmachung nach dem Umwandlungsgesetz 23.09.2025 (Eintragungsdatum)\n\nHahn Putzlappen GmbH\nGesellschaft mit beschränkter Haftung\nNordhorn\n\nDen Gläubigern der an der Verschmelzung beteiligten Rechtsträger ist, wenn sie binnen sechs Monaten nach dem Tag, an dem die Eintragung der Verschmelzung in das Register des Sitzes desjenigen Rechtsträgers, dessen Gläubiger sie sind, nach § 19  Abs.  3 UmwG als bekannt gemacht gilt, ihren Anspruch nach Grund und Höhe schriftlich anmelden, Sicherheit zu leisten, soweit sie nicht Befriedigung verlangen können. Dieses Recht steht den Gläubigern jedoch nur zu, wenn sie glaubhaft machen, dass durch die Verschmelzung die Erfüllung der Forderung gefährdet wird."
    },
    {
      "date": "2025-09-23",
      "id": "131023",
      "original_text": "Registerbekanntmachung nach dem Umwandlungsgesetz\nNiedersachsen Amtsgericht Aurich HRA 204276\nChr. Folkerts e.K. – Westoverledingen",
      "type": "Registerbekanntmachung nach dem Umwandlungsgesetz",
      "state": "Niedersachsen",
      "amtsgericht": "Amtsgericht Aurich",
      "registernummer": "HRA 204276",
      "registerart": "HRA",
      "company_name": "Chr. Folkerts e.K.",
      "company_seat": "Westoverledingen",
      "details": "23.09.2025 (Bekanntmachungsdatum)\n\nNiedersachsen Amtsgericht Aurich HRA 204276\nRegisterbekanntmachung nach dem Umwandlungsgesetz 23.09.2025 (Eintragungsdatum)\n\nChr. Folkerts e.K.\nEinzelkaufmann / Einzelkauffrau\nWestoverledingen\n\nDen Gläubigern der an der Ausgliederung beteiligten Rechtsträger ist, wenn sie binnen sechs Monaten nach dem Tag, an dem die Eintragung der Ausgliederung in das Register des Sitzes desjenigen Rechtsträgers, dessen Gläubiger sie sind, nach § 19 Abs. 3 UmwG als bekannt gemacht gilt, ihren Anspruch nach Grund und Höhe schriftlich anmelden, Sicherheit zu leisten, soweit sie nicht Befriedigung verlangen können. Dieses Recht steht den Gläubigern jedoch nur zu, wenn sie glaubhaft machen, dass durch die Ausgliederung die Erfüllung der Forderung gefährdet wird."
    },
    {
      "date": "2025-09-23",
      "id": "131024",
      "original_text": "Registerbekanntmachung nach dem Umwandlungsgesetz\nNiedersachsen Amtsgericht Osnabrück HRA 206956\nHörgeräte-direkt GmbH & Co. KG – Wallenhorst",
      "type": "Registerbekanntmachung nach dem Umwandlungsgesetz",
      "state": "Niedersachsen",
      "amtsgericht": "Amtsgericht Osnabrück",
      "registernummer": "HRA 206956",
      "registerart": "HRA",
      "company_name": "Hörgeräte-direkt GmbH & Co. KG",
      "company_seat": "Wallenhorst",
      "details": "23.09.2025 (Bekanntmachungsdatum)\n\nNiedersachsen Amtsgericht Osnabrück HRA 206956\nRegisterbekanntmachung nach dem Umwandlungsgesetz 23.09.2025 (Eintragungsdatum)\n\nHörgeräte-direkt GmbH & Co. KG\nKommanditgesellschaft\nWallenhorst\n\nDen Gläubigern der an der formwechselnden Umwandlung beteiligten Rechtsträger ist, wenn sie binnen sechs Monaten nach dem Tag, an dem die Eintragung der Umwandlung in das Register des Sitzes desjenigen Rechtsträgers, dessen Gläubiger sie sind, nach § 19 Abs. 3 UmwG als bekannt gemacht gilt, ihren Anspruch nach Grund und Höhe schriftlich anmelden, Sicherheit zu leisten, soweit sie nicht Befriedigung verlangen können. Dieses Recht steht den Gläubigern jedoch nur zu, wenn sie glaubhaft machen, dass durch die formwechselnde Umwandlung die Erfüllung der Forderung gefährdet wird."
    },
    {
      "date": "2025-09-23",
      "id": "131025",
      "original_text": "Registerbekanntmachung nach dem Umwandlungsgesetz\nNiedersachsen Amtsgericht Osnabrück HRB 100658 früher Amtsgericht Lingen (Ems)\nemco electroroller GmbH – Lingen",
      "type": "Registerbekanntmachung nach dem Umwandlungsgesetz",
      "state": "Niedersachsen",
      "amtsgericht": "Amtsgericht Osnabrück",
      "registernummer": "HRB 100658",
      "registerart": "HRB",
      "company_name": "emco electroroller GmbH",
      "company_seat": "Lingen",
      "former_amtsgericht": "Lingen (Ems)",
      "details": "23.09.2025 (Bekanntmachungsdatum)\n\nNiedersachsen Amtsgericht Osnabrück HRB 100658 früher Amtsgericht Lingen (Ems)\nRegisterbekanntmachung nach dem Umwandlungsgesetz 23.09.2025 (Eintragungsdatum)\n\nemco electroroller GmbH\nGesellschaft mit beschränkter Haftung\nLingen\n\nDen Gläubigern der an der Verschmelzung beteiligten Rechtsträger ist, wenn sie binnen sechs Monaten nach dem Tag, an dem die Eintragung der Verschmelzung in das Register des Sitzes desjenigen Rechtsträgers, dessen Gläubiger sie sind, nach § 19  Abs.  3 UmwG als bekannt gemacht gilt, ihren Anspruch nach Grund und Höhe schriftlich anmelden, Sicherheit zu leisten, soweit sie nicht Befriedigung verlangen können. Dieses Recht steht den Gläubigern jedoch nur zu, wenn sie glaubhaft machen, dass durch die Verschmelzung die Erfüllung der Forderung gefährdet wird."
    },
    {
      "date": "2025-09-23",
      "id": "131026",
      "original_text": "Registerbekanntmachung nach dem Umwandlungsgesetz\nNiedersachsen Amtsgericht Tostedt HRB 205564\nPaPS Verwaltung GmbH – Neu Wulmstorf",
      "type": "Registerbekanntmachung nach dem Umwandlungsgesetz",
      "state": "Niedersachsen",
      "amtsgericht": "Amtsgericht Tostedt",
      "registernummer": "HRB 205564",
      "registerart": "HRB",
      "company_name": "PaPS Verwaltung GmbH",
      "company_seat": "Neu Wulmstorf",
      "details": "23.09.2025 (Bekanntmachungsdatum)\n\nNiedersachsen Amtsgericht Tostedt HRB 205564\nRegisterbekanntmachung nach dem Umwandlungsgesetz 23.09.2025 (Eintragungsdatum)\n\nPaPS Verwaltung GmbH\nGesellschaft mit beschränkter Haftung\nNeu Wulmstorf\n\nDen Gläubigern der an der Verschmelzung beteiligten Rechtsträger ist, wenn sie binnen sechs Monaten nach dem Tag, an dem die Eintragung der Verschmelzung in das Register des Sitzes desjenigen Rechtsträgers, dessen Gläubiger sie sind, nach § 19  Abs.  3 UmwG als bekannt gemacht gilt, ihren Anspruch nach Grund und Höhe schriftlich anmelden, Sicherheit zu leisten, soweit sie nicht Befriedigung verlangen können. Dieses Recht steht den Gläubigern jedoch nur zu, wenn sie glaubhaft machen, dass durch die Verschmelzung die Erfüllung der Forderung gefährdet wird."
    },
    {
      "date": "2025-09-23",
      "id": "131027",
      "original_text": "Registerbekanntmachung nach dem Umwandlungsgesetz\nNiedersachsen Amtsgericht Hannover HRB 211921\nOKCS Handel GmbH – Hannover",
      "type": "Registerbekanntmachung nach dem Umwandlungsgesetz",
      "state": "Niedersachsen",
      "amtsgericht": "Amtsgericht Hannover",
      "registernummer": "HRB 211921",
      "registerart": "HRB",
      "company_name": "OKCS Handel GmbH",
      "company_seat": "Hannover",
      "details": "23.09.2025 (Bekanntmachungsdatum)\n\nNiedersachsen Amtsgericht Hannover HRB 211921\nRegisterbekanntmachung nach dem Umwandlungsgesetz 23.09.2025 (Eintragungsdatum)\n\nOKCS Handel GmbH\nGesellschaft mit beschränkter Haftung\nHannover\n\nDen Gläubigern der an der Verschmelzung beteiligten Rechtsträger ist, wenn sie binnen sechs Monaten nach dem Tag, an dem die Eintragung der Verschmelzung in das Register des Sitzes desjenigen Rechtsträgers, dessen Gläubiger sie sind, nach § 19  Abs.  3 UmwG als bekannt gemacht gilt, ihren Anspruch nach Grund und Höhe schriftlich anmelden, Sicherheit zu leisten, soweit sie nicht Befriedigung verlangen können. Dieses Recht steht den Gläubigern jedoch nur zu, wenn sie glaubhaft machen, dass durch die Verschmelzung die Erfüllung der Forderung gefährdet wird."
    },
    {
      "date": "2025-09-23",
      "id": "131028",
      "original_text": "Registerbekanntmachung nach dem Umwandlungsgesetz\nNiedersachsen Amtsgericht Tostedt VR 150045\nDeutsches Rotes Kreuz Kreisverband Bremervörde-Rotenburg e. V. – Bremervörde",
      "type": "Registerbekanntmachung nach dem Umwandlungsgesetz",
      "state": "Niedersachsen",
      "amtsgericht": "Amtsgericht Tostedt",
      "registernummer": "VR 150045",
      "registerart": "VR",
      "company_name": "Deutsches Rotes Kreuz Kreisverband Bremervörde-Rotenburg e. V.",
      "company_seat": "Bremervörde",
      "details": "23.09.2025 (Bekanntmachungsdatum)\n\nNiedersachsen Amtsgericht Tostedt VR 150045\nRegisterbekanntmachung nach dem Umwandlungsgesetz 23.09.2025 (Eintragungsdatum)\n\nDeutsches Rotes Kreuz Kreisverband Bremervörde-Rotenburg e. V.\neingetragener Verein\nBremervörde\n\nDen Gläubigern der an der Verschmelzung beteiligten Rechtsträger ist, wenn sie binnen sechs Monaten nach dem Tag, an dem die Eintragung der Verschmelzung in das Register des Sitzes desjenigen Rechtsträgers, dessen Gläubiger sie sind, nach § 19  Abs.  3 UmwG als bekannt gemacht gilt, ihren Anspruch nach Grund und Höhe schriftlich anmelden, Sicherheit zu leisten, soweit sie nicht Befriedigung verlangen können. Dieses Recht steht den Gläubigern jedoch nur zu, wenn sie glaubhaft machen, dass durch die Verschmelzung die Erfüllung der Forderung gefährdet wird."
    },
    {
      "date": "2025-09-23",
      "id": "131029",
      "original_text": "Löschungsankündigung\nNiedersachsen Amtsgericht Lüneburg HRB 206961\nS & Heininger Health UG (haftungsbeschränkt) – Toppenstedt",
      "type": "Löschungsankündigung",
      "state": "Niedersachsen",
      "amtsgericht": "Amtsgericht Lüneburg",
      "registernummer": "HRB 206961",
      "registerart": "HRB",
      "company_name": "S & Heininger Health UG (haftungsbeschränkt)",
      "company_seat": "Toppenstedt",
      "details": "23.09.2025 (Bekanntmachungsdatum)\n\nNiedersachsen Amtsgericht Lüneburg HRB 206961\nLöschungsankündigung\n\nS & Heininger Health UG (haftungsbeschränkt)\nGesellschaft mit beschränkter Haftung\nToppenstedt\n\nDas Registergericht beabsichtigt, die Gesellschaft von Amts wegen nach § 394 FamFG zu löschen. Die Frist zur Erhebung eines Widerspruchs ist auf 1 Monat ab dieser Registerbekanntmachung festgesetzt."
    },
    {
      "date": "2025-09-23",
      "id": "131030",
      "original_text": "Registerbekanntmachung nach dem Umwandlungsgesetz\nNiedersachsen Amtsgericht Aurich HRA 204257\nViehhandlung Folkerts GmbH & Co. KG – Westoverledingen",
      "type": "Registerbekanntmachung nach dem Umwandlungsgesetz",
      "state": "Niedersachsen",
      "amtsgericht": "Amtsgericht Aurich",
      "registernummer": "HRA 204257",
      "registerart": "HRA",
      "company_name": "Viehhandlung Folkerts GmbH & Co. KG",
      "company_seat": "Westoverledingen",
      "details": "23.09.2025 (Bekanntmachungsdatum)\n\nNiedersachsen Amtsgericht Aurich HRA 204257\nRegisterbekanntmachung nach dem Umwandlungsgesetz 23.09.2025 (Eintragungsdatum)\n\nViehhandlung Folkerts GmbH & Co. KG\nKommanditgesellschaft\nWestoverledingen\n\nDen Gläubigern der an der Ausgliederung beteiligten Rechtsträger ist, wenn sie binnen sechs Monaten nach dem Tag, an dem die Eintragung der Ausgliederung in das Register des Sitzes desjenigen Rechtsträgers, dessen Gläubiger sie sind, nach § 19 Abs. 3 UmwG als bekannt gemacht gilt, ihren Anspruch nach Grund und Höhe schriftlich anmelden, Sicherheit zu leisten, soweit sie nicht Befriedigung verlangen können. Dieses Recht steht den Gläubigern jedoch nur zu, wenn sie glaubhaft machen, dass durch die Ausgliederung die Erfüllung der Forderung gefährdet wird."
    },
    {
      "date": "2025-09-23",
      "id": "131031",
      "original_text": "Registerbekanntmachung nach dem Umwandlungsgesetz\nNiedersachsen Amtsgericht Walsrode GsR 633\nCM Runnebaum Grundstückserwerbs- und Verwaltungsgesellschaft eGbR – Diepholz",
      "type": "Registerbekanntmachung nach dem Umwandlungsgesetz",
      "state": "Niedersachsen",
      "amtsgericht": "Amtsgericht Walsrode",
      "registernummer": "GsR 633",
      "registerart": "GsR",
      "company_name": "CM Runnebaum Grundstückserwerbs- und Verwaltungsgesellschaft eGbR",
      "company_seat": "Diepholz",
      "details": "23.09.2025 (Bekanntmachungsdatum)\n\nNiedersachsen Amtsgericht Walsrode GsR 633\nRegisterbekanntmachung nach dem Umwandlungsgesetz\n\nCM Runnebaum Grundstückserwerbs- und Verwaltungsgesellschaft eGbR\nGesellschaft bürgerlichen Rechts\nDiepholz\n\nDen Gläubigern der an der formwechselnden Umwandlung beteiligten Rechtsträger ist, wenn sie binnen sechs Monaten nach dem Tag, an dem die Eintragung der Umwandlung in das Register des Sitzes desjenigen Rechtsträgers, dessen Gläubiger sie sind, nach § 19 Abs. 3 UmwG als bekannt gemacht gilt, ihren Anspruch nach Grund und Höhe schriftlich anmelden, Sicherheit zu leisten, soweit sie nicht Befriedigung verlangen können. Dieses Recht steht den Gläubigern jedoch nur zu, wenn sie glaubhaft machen, dass durch die formwechselnde Umwandlung die Erfüllung der Forderung gefährdet wird."
    },
    {
      "date": "2025-09-23",
      "id": "131032",
      "original_text": "Registerbekanntmachung nach dem Umwandlungsgesetz\nNiedersachsen Amtsgericht Hildesheim HRB 43\nGlamox GmbH – Hildesheim",
      "type": "Registerbekanntmachung nach dem Umwandlungsgesetz",
      "state": "Niedersachsen",
      "amtsgericht": "Amtsgericht Hildesheim",
      "registernummer": "HRB 43",
      "registerart": "HRB",
      "company_name": "Glamox GmbH",
      "company_seat": "Hildesheim",
      "details": "23.09.2025 (Bekanntmachungsdatum)\n\nNiedersachsen Amtsgericht Hildesheim HRB 43\nRegisterbekanntmachung nach dem Umwandlungsgesetz 23.09.2025 (Eintragungsdatum)\n\nGlamox GmbH\nGesellschaft mit beschränkter Haftung\nHildesheim\n\nDen Gläubigern der an der Verschmelzung beteiligten Rechtsträger ist, wenn sie binnen sechs Monaten nach dem Tag, an dem die Eintragung der Verschmelzung in das Register des Sitzes desjenigen Rechtsträgers, dessen Gläubiger sie sind, nach § 19  Abs.  3 UmwG als bekannt gemacht gilt, ihren Anspruch nach Grund und Höhe schriftlich anmelden, Sicherheit zu leisten, soweit sie nicht Befriedigung verlangen können. Dieses Recht steht den Gläubigern jedoch nur zu, wenn sie glaubhaft machen, dass durch die Verschmelzung die Erfüllung der Forderung gefährdet wird."
    },
    {
      "date": "2025-09-23",
      "id": "131033",
      "original_text": "Registerbekanntmachung nach dem Umwandlungsgesetz\nNiedersachsen Amtsgericht Hannover HRA 206788\nOlaf Kirchner e.K. – Hemmingen",
      "type": "Registerbekanntmachung nach dem Umwandlungsgesetz",
      "state": "Niedersachsen",
      "amtsgericht": "Amtsgericht Hannover",
      "registernummer": "HRA 206788",
      "registerart": "HRA",
      "company_name": "Olaf Kirchner e.K.",
      "company_seat": "Hemmingen",
      "details": "23.09.2025 (Bekanntmachungsdatum)\n\nNiedersachsen Amtsgericht Hannover HRA 206788\nRegisterbekanntmachung nach dem Umwandlungsgesetz 23.09.2025 (Eintragungsdatum)\n\nOlaf Kirchner e.K.\nEinzelkaufmann / Einzelkauffrau\nHemmingen\n\nDen Gläubigern der an der Verschmelzung beteiligten Rechtsträger ist, wenn sie binnen sechs Monaten nach dem Tag, an dem die Eintragung der Verschmelzung in das Register des Sitzes desjenigen Rechtsträgers, dessen Gläubiger sie sind, nach § 19  Abs.  3 UmwG als bekannt gemacht gilt, ihren Anspruch nach Grund und Höhe schriftlich anmelden, Sicherheit zu leisten, soweit sie nicht Befriedigung verlangen können. Dieses Recht steht den Gläubigern jedoch nur zu, wenn sie glaubhaft machen, dass durch die Verschmelzung die Erfüllung der Forderung gefährdet wird."
    },
    {
      "date": "2025-09-23",
      "id": "131034",
      "original_text": "Löschungsankündigung\nNiedersachsen Amtsgericht Hannover HRB 209657\nME Gastrogesellschaft mbH Garbsen – Garbsen",
      "type": "Löschungsankündigung",
      "state": "Niedersachsen",
      "amtsgericht": "Amtsgericht Hannover",
      "registernummer": "HRB 209657",
      "registerart": "HRB",
      "company_name": "ME Gastrogesellschaft mbH Garbsen",
      "company_seat": "Garbsen",
      "details": "23.09.2025 (Bekanntmachungsdatum)\n\nNiedersachsen Amtsgericht Hannover HRB 209657\nLöschungsankündigung\n\nME Gastrogesellschaft mbH Garbsen\nGesellschaft mit beschränkter Haftung\nGarbsen\n\nDas Registergericht beabsichtigt, die Gesellschaft von Amts wegen nach § 394 FamFG zu löschen. Die Frist zur Erhebung eines Widerspruchs ist auf 1 Monat ab dieser Registerbekanntmachung festgesetzt."
    },
    {
      "date": "2025-09-23",
      "id": "131035",
      "original_text": "Löschungsankündigung\nBremen Amtsgericht Bremen HRB 29473\nFREIHEIT SKYTECH GmbH – Bremen",
      "type": "Löschungsankündigung",
      "state": "Bremen",
      "amtsgericht": "Amtsgericht Bremen",
      "registernummer": "HRB 29473",
      "registerart": "HRB",
      "company_name": "FREIHEIT SKYTECH GmbH",
      "company_seat": "Bremen",
      "details": "23.09.2025 (Bekanntmachungsdatum)\n\nBremen Amtsgericht Bremen HRB 29473\nLöschungsankündigung\n\nFREIHEIT SKYTECH GmbH\nGesellschaft mit beschränkter Haftung\nBremen\n\nEs ist beabsichtigt die im Handelsregister eingetragene Gesellschaft von Amts wegen gemäß § 394 FamFG zu löschen. Gegen die Löschung kann beim AG Bremen schriftlich oder zu Protokoll der Geschäftsstelle Widerspruch eingelegt werden. Widerspruchsfrist 4 Wochen."
    },
    {
      "date": "2025-09-23",
      "id": "131036",
      "original_text": "Löschungsankündigung\nBremen Amtsgericht Bremen HRB 27971\nRoland Gastro Service GmbH – Bremen",
      "type": "Löschungsankündigung",
      "state": "Bremen",
      "amtsgericht": "Amtsgericht Bremen",
      "registernummer": "HRB 27971",
      "registerart": "HRB",
      "company_name": "Roland Gastro Service GmbH",
      "company_seat": "Bremen",
      "details": "23.09.2025 (Bekanntmachungsdatum)\n\nBremen Amtsgericht Bremen HRB 27971\nLöschungsankündigung\n\nRoland Gastro Service GmbH\nGesellschaft mit beschränkter Haftung\nBremen\n\nEs ist beabsichtigt die im Handelsregister eingetragene Gesellschaft von Amts wegen gemäß § 394 FamFG zu löschen. Gegen die Löschung kann beim AG Bremen schriftlich oder zu Protokoll der Geschäftsstelle Widerspruch eingelegt werden. Widerspruchsfrist 4 Wochen."
    },
    {
      "date": "2025-09-23",
      "id": "131037",
      "original_text": "Registerbekanntmachung nach dem Umwandlungsgesetz\nBremen Amtsgericht Bremen HRA 30769\nHotel Heidquelle Blumenthal e.K. – Bremen",
      "type": "Registerbekanntmachung nach dem Umwandlungsgesetz",
      "state": "Bremen",
      "amtsgericht": "Amtsgericht Bremen",
      "registernummer": "HRA 30769",
      "registerart": "HRA",
      "company_name": "Hotel Heidquelle Blumenthal e.K.",
      "company_seat": "Bremen",
      "details": "23.09.2025 (Bekanntmachungsdatum)\n\nBremen Amtsgericht Bremen HRA 30769\nRegisterbekanntmachung nach dem Umwandlungsgesetz 22.09.2025 (Eintragungsdatum)\n\nHotel Heidquelle Blumenthal e.K.\nEinzelkaufmann / Einzelkauffrau\nBremen\n\nZu Eintragungsnummer 2 vom 22.09.2025 wird als nicht eingetragen veröffentlicht: Den Gläubigern der an der Spaltung beteiligten Rechtsträger ist, wenn sie binnen sechs Monaten nach dem Tag, an dem die Eintragung der Spaltung in das Register des Sitzes desjenigen Rechtsträgers, dessen Gläubiger sie sind, als bekannt gemacht gilt, ihren Anspruch nach Grund und Höhe schriftlich anmelden, Sicherheit zu leisten, soweit sie nicht Befriedigung verlangen können. Dieses Recht steht den Gläubigern jedoch nur zu, wenn sie glaubhaft machen, dass durch die Spaltung die Erfüllung ihrer Forderung gefährdet wird. Das Recht, Sicherheitsleistung zu verlangen, steht Gläubigern nicht zu, die im Falle der Insolvenz ein Recht auf vorzugsweise Befriedigung aus einer Deckungsmasse haben, die nach gesetzlicher Vorschrift zu ihrem Schutz errichtet und staatlich überwacht ist."
    },
    {
      "date": "2025-09-23",
      "id": "131038",
      "original_text": "Registerbekanntmachung nach dem Umwandlungsgesetz\nBremen Amtsgericht Bremen HRA 30775\nHeidquelle Verwaltungsgesellschaft mbH & Co. KG – Bremen",
      "type": "Registerbekanntmachung nach dem Umwandlungsgesetz",
      "state": "Bremen",
      "amtsgericht": "Amtsgericht Bremen",
      "registernummer": "HRA 30775",
      "registerart": "HRA",
      "company_name": "Heidquelle Verwaltungsgesellschaft mbH & Co. KG",
      "company_seat": "Bremen",
      "details": "23.09.2025 (Bekanntmachungsdatum)\n\nBremen Amtsgericht Bremen HRA 30775\nRegisterbekanntmachung nach dem Umwandlungsgesetz 22.09.2025 (Eintragungsdatum)\n\nHeidquelle Verwaltungsgesellschaft mbH & Co. KG\nKommanditgesellschaft\nBremen\n\nZu Eintragungsnummer 2 vom 22.09.2025 wird als nicht eingetragen veröffentlicht: Den Gläubigern der an der Spaltung beteiligten Rechtsträger ist, wenn sie binnen sechs Monaten nach dem Tag, an dem die Eintragung der Spaltung in das Register des Sitzes desjenigen Rechtsträgers, dessen Gläubiger sie sind, als bekannt gemacht gilt, ihren Anspruch nach Grund und Höhe schriftlich anmelden, Sicherheit zu leisten, soweit sie nicht Befriedigung verlangen können. Dieses Recht steht den Gläubigern jedoch nur zu, wenn sie glaubhaft machen, dass durch die Spaltung die Erfüllung ihrer Forderung gefährdet wird. Das Recht, Sicherheitsleistung zu verlangen, steht Gläubigern nicht zu, die im Falle der Insolvenz ein Recht auf vorzugsweise Befriedigung aus einer Deckungsmasse haben, die nach gesetzlicher Vorschrift zu ihrem Schutz errichtet und staatlich überwacht ist."
    },
    {
      "date": "2025-09-23",
      "id": "131039",
      "original_text": "Löschungsankündigung\nBremen Amtsgericht Bremen HRB 40715\nBKS Projektbau GmbH – Bremen",
      "type": "Löschungsankündigung",
      "state": "Bremen",
      "amtsgericht": "Amtsgericht Bremen",
      "registernummer": "HRB 40715",
      "registerart": "HRB",
      "company_name": "BKS Projektbau GmbH",
      "company_seat": "Bremen",
      "details": "23.09.2025 (Bekanntmachungsdatum)\n\nBremen Amtsgericht Bremen HRB 40715\nLöschungsankündigung\n\nBKS Projektbau GmbH\nGesellschaft mit beschränkter Haftung\nBremen\n\nEs ist beabsichtigt die im Handelsregister eingetragene Gesellschaft von Amts wegen gemäß § 394 FamFG zu löschen. Gegen die Löschung kann beim AG Bremen schriftlich oder zu Protokoll der Geschäftsstelle Widerspruch eingelegt werden. Widerspruchsfrist 4 Wochen."
    },
    {
      "date": "2025-09-23",
      "id": "131040",
      "original_text": "Registerbekanntmachung nach dem Umwandlungsgesetz\nRheinland-Pfalz Amtsgericht Ludwigshafen a.Rhein (Ludwigshafen) HRB 70417\nVBZ Verwaltungs- und Betreuungszentrum Ludwigshafen am Rhein GmbH – Ludwigshafen am Rhein",
      "type": "Registerbekanntmachung nach dem Umwandlungsgesetz",
      "state": "Rheinland-Pfalz",
      "amtsgericht": "Amtsgericht Ludwigshafen a.Rhein (Ludwigshafen)",
      "registernummer": "HRB 70417",
      "registerart": "HRB",
      "company_name": "VBZ Verwaltungs- und Betreuungszentrum Ludwigshafen am Rhein GmbH",
      "company_seat": "Ludwigshafen am Rhein",
      "details": "23.09.2025 (Bekanntmachungsdatum)\n\nRheinland-Pfalz Amtsgericht Ludwigshafen a.Rhein (Ludwigshafen) HRB 70417\nRegisterbekanntmachung nach dem Umwandlungsgesetz 22.09.2025 (Eintragungsdatum)\n\nVBZ Verwaltungs- und Betreuungszentrum Ludwigshafen am Rhein GmbH\nGesellschaft mit beschränkter Haftung\nLudwigshafen am Rhein\n\nAls nicht eingetragen wird veröffentlicht: Den Gläubigern der an der Verschmelzung beteiligten Rechtsträger ist, wenn sie binnen sechs Monaten nach dem Tag, an dem die Eintragung der Verschmelzung in das Register des Sitzes desjenigen Rechtsträgers,dessen Gläubiger sie sind, nach § 19 Abs. 3 UmwG als bekannt gemacht gilt, ihren Anspruch nach Grund und Höhe schriftlich anmelden, Sicherheit zu leisten, soweit sie nicht Befriedigung verlangen können. Dieses Recht steht den Gläubigern jedoch nur zu, wenn sie glaubhaft machen, dass durch die Verschmelzung die Erfüllungd er Forderung gefährdet wird."
    },
    {
      "date": "2025-09-23",
      "id": "131041",
      "original_text": "Registerbekanntmachung nach dem Umwandlungsgesetz\nRheinland-Pfalz Amtsgericht Ludwigshafen a.Rhein (Ludwigshafen) HRA 61707\nMedien Union Grundbesitz Niedersachsen GmbH & Co. KG – Ludwigshafen am Rhein",
      "type": "Registerbekanntmachung nach dem Umwandlungsgesetz",
      "state": "Rheinland-Pfalz",
      "amtsgericht": "Amtsgericht Ludwigshafen a.Rhein (Ludwigshafen)",
      "registernummer": "HRA 61707",
      "registerart": "HRA",
      "company_name": "Medien Union Grundbesitz Niedersachsen GmbH & Co. KG",
      "company_seat": "Ludwigshafen am Rhein",
      "details": "23.09.2025 (Bekanntmachungsdatum)\n\nRheinland-Pfalz Amtsgericht Ludwigshafen a.Rhein (Ludwigshafen) HRA 61707\nRegisterbekanntmachung nach dem Umwandlungsgesetz 23.09.2025 (Eintragungsdatum)\n\nMedien Union Grundbesitz Niedersachsen GmbH & Co. KG\nKommanditgesellschaft\nLudwigshafen am Rhein\n\nGläubigern des bisherigen Rechtsträgers ist unter den Voraussetzungen der §§ 204, 22 UmwG Sicherheit zu leisten.Als nicht eingetragen wird veröffentlicht:\nDen Gläubigern des formwechselnden Rechtsträgers ist, wenn sie binnen sechs Monaten nach dem Tag, an dem die Eintragung des Formwechsels nach § 201 UmwG als bekannt gemacht gilt, ihren Anspruch nach Grund und Höhe schriftlich anmelden, Sicherheit zu leisten, soweit sie nicht Befriedigung verlangen können. Dieses Recht steht den Gläubigern jedoch nur zu, wenn sie glaubhaft machen, dass durch den Formwechsel die Erfüllung der Forderung gefährdet wird."
    },
    {
      "date": "2025-09-23",
      "id": "131042",
      "original_text": "Registerbekanntmachung nach dem Umwandlungsgesetz\nRheinland-Pfalz Amtsgericht Ludwigshafen a.Rhein (Ludwigshafen) HRB 1154\nFrischbeton GmbH – Ludwigshafen am Rhein",
      "type": "Registerbekanntmachung nach dem Umwandlungsgesetz",
      "state": "Rheinland-Pfalz",
      "amtsgericht": "Amtsgericht Ludwigshafen a.Rhein (Ludwigshafen)",
      "registernummer": "HRB 1154",
      "registerart": "HRB",
      "company_name": "Frischbeton GmbH",
      "company_seat": "Ludwigshafen am Rhein",
      "details": "23.09.2025 (Bekanntmachungsdatum)\n\nRheinland-Pfalz Amtsgericht Ludwigshafen a.Rhein (Ludwigshafen) HRB 1154\nRegisterbekanntmachung nach dem Umwandlungsgesetz 17.09.2025 (Eintragungsdatum)\n\nFrischbeton GmbH\nGesellschaft mit beschränkter Haftung\nLudwigshafen am Rhein\n\nAls nicht eingetragen wird veröffentlicht: Den Gläubigern der an der Umwandlungbeteiligten Rechtsträger ist, wenn sie binnen sechs Monaten nach dem Tag, an dem die Eintragung der Umwandlung in das Register des Sitzes desjenigen Rechtsträgers, dessen Gläubiger sie sind, nach § 19 Abs. 3 UmwG als bekannt gemacht gilt, ihren Anspruch nach Grund und Höhe schriftlich anmelden, Sicherheit zu leisten, soweit sie nicht Befriedigung verlangen können. Dieses Recht steht den Gläubigern jedoch nur zu, wenn sie glaubhaft machen, dass durch die Umwandlung die Erfüllung der Forderung gefährdet wird."
    },
    {
      "date": "2025-09-23",
      "id": "131043",
      "original_text": "Registerbekanntmachung nach dem Umwandlungsgesetz\nRheinland-Pfalz Amtsgericht Ludwigshafen a.Rhein (Ludwigshafen) HRB 62331\nWendt SIT Management GmbH – Frankenthal",
      "type": "Registerbekanntmachung nach dem Umwandlungsgesetz",
      "state": "Rheinland-Pfalz",
      "amtsgericht": "Amtsgericht Ludwigshafen a.Rhein (Ludwigshafen)",
      "registernummer": "HRB 62331",
      "registerart": "HRB",
      "company_name": "Wendt SIT Management GmbH",
      "company_seat": "Frankenthal",
      "details": "23.09.2025 (Bekanntmachungsdatum)\n\nRheinland-Pfalz Amtsgericht Ludwigshafen a.Rhein (Ludwigshafen) HRB 62331\nRegisterbekanntmachung nach dem Umwandlungsgesetz 23.09.2025 (Eintragungsdatum)\n\nWendt SIT Management GmbH\nGesellschaft mit beschränkter Haftung\nFrankenthal\n\nAls nicht eingetragen wird veröffentlicht: Den Gläubigern der an der Verschmelzung beteiligten Rechtsträger ist, wenn sie binnen sechs Monaten nach dem Tag, an dem die Eintragung der Verschmelzung in das Register des Sitzes desjenigen Rechtsträgers,dessen Gläubiger sie sind, nach § 19 Abs. 3 UmwG als bekannt gemacht gilt, ihren Anspruch nach Grund und Höhe schriftlich anmelden, Sicherheit zu leisten, soweit sie nicht Befriedigung verlangen können. Dieses Recht steht den Gläubigern jedoch nur zu, wenn sie glaubhaft machen, dass durch die Verschmelzung die Erfüllung der Forderung gefährdet wird."
    },
    {
      "date": "2025-09-23",
      "id": "131044",
      "original_text": "Registerbekanntmachung nach dem Umwandlungsgesetz\nRheinland-Pfalz Amtsgericht Zweibrücken HRB 33360\nIBH Pfalz GmbH – Pirmasens",
      "type": "Registerbekanntmachung nach dem Umwandlungsgesetz",
      "state": "Rheinland-Pfalz",
      "amtsgericht": "Amtsgericht Zweibrücken",
      "registernummer": "HRB 33360",
      "registerart": "HRB",
      "company_name": "IBH Pfalz GmbH",
      "company_seat": "Pirmasens",
      "details": "23.09.2025 (Bekanntmachungsdatum)\n\nRheinland-Pfalz Amtsgericht Zweibrücken HRB 33360\nRegisterbekanntmachung nach dem Umwandlungsgesetz 23.09.2025 (Eintragungsdatum)\n\nIBH Pfalz GmbH\nGesellschaft mit beschränkter Haftung\nPirmasens\n\nAls nicht eingetragen wird veröffentlicht: Den Gläubigern der an der Ausgliederung beteiligten Rechtsträger ist, wenn sie binnen sechs Monaten nac hdem Tag, an dem die Eintragung der Ausgliederung in das Register des Sitzes desjenigen Rechtsträgers,dessen Gläubiger sie sind, nach § 19 Abs. 3 UmwG als bekannt gemacht gilt, ihren Anspruch nach Grund und Höhe schriftlich anmelden, Sicherheit zu leisten, soweit sie nicht Befriedigung verlangen können. Dieses Recht steht den Gläubigern jedoch nur zu, wenn sie glaubhaft machen, dass durch die Ausgliederung die Erfüllung der Forderung gefährdet wird."
    },
    {
      "date": "2025-09-23",
      "id": "131045",
      "original_text": "Registerbekanntmachung nach dem Umwandlungsgesetz\nRheinland-Pfalz Amtsgericht Montabaur HRA 21144\nGWK GmbH & Co. KG – Straßenhaus",
      "type": "Registerbekanntmachung nach dem Umwandlungsgesetz",
      "state": "Rheinland-Pfalz",
      "amtsgericht": "Amtsgericht Montabaur",
      "registernummer": "HRA 21144",
      "registerart": "HRA",
      "company_name": "GWK GmbH & Co. KG",
      "company_seat": "Straßenhaus",
      "details": "23.09.2025 (Bekanntmachungsdatum)\n\nRheinland-Pfalz Amtsgericht Montabaur HRA 21144\nRegisterbekanntmachung nach dem Umwandlungsgesetz 23.09.2025 (Eintragungsdatum)\n\nGWK GmbH & Co. KG\nKommanditgesellschaft\nStraßenhaus\n\nAls nicht eingetragen wird veröffentlicht: Den Gläubigern der an der Ausgliederung beteiligten Rechtsträger ist, wenn sie binnen sechs Monaten nach dem Tag, an dem die Eintragung der Ausgliederung in das Register des Sitzes desjenigen Rechtsträgers,dessen Gläubiger sie sind, nach § 19 Abs. 3 UmwG als bekannt gemacht gilt, ihren Anspruch nach Grund und Höhe schriftlich anmelden, Sicherheit zu leisten, soweit sie nicht Befriedigung verlangen können. Dieses Recht steht den Gläubigern jedoch nur zu, wenn sie glaubhaft machen, dass durch die Ausgliederung die Erfüllung der Forderung gefährdet wird."
    },
    {
      "date": "2025-09-23",
      "id": "131046",
      "original_text": "Registerbekanntmachung nach dem Umwandlungsgesetz\nRheinland-Pfalz Amtsgericht Ludwigshafen a.Rhein (Ludwigshafen) HRA 62429\nOtt Bau & Montageservice e. K. – Altrip",
      "type": "Registerbekanntmachung nach dem Umwandlungsgesetz",
      "state": "Rheinland-Pfalz",
      "amtsgericht": "Amtsgericht Ludwigshafen a.Rhein (Ludwigshafen)",
      "registernummer": "HRA 62429",
      "registerart": "HRA",
      "company_name": "Ott Bau & Montageservice e. K.",
      "company_seat": "Altrip",
      "details": "23.09.2025 (Bekanntmachungsdatum)\n\nRheinland-Pfalz Amtsgericht Ludwigshafen a.Rhein (Ludwigshafen) HRA 62429\nRegisterbekanntmachung nach dem Umwandlungsgesetz 23.09.2025 (Eintragungsdatum)\n\nOtt Bau & Montageservice e. K.\nEinzelkaufmann / Einzelkauffrau\nAltrip\n\nAls nicht eingetragen wird veröffentlicht: Den Gläubigern der an der Ausgliederung beteiligten Rechtsträger ist, wenn sie binnen sechs Monaten nach dem Tag, an dem die Eintragung der Ausgliederung in das Register des Sitzes desjenigen Rechtsträgers, dessen Gläubiger sie sind, nach § 19 Abs. 3 UmwG als bekannt gemacht gilt, ihren Anspruch nach Grund und Höhe schriftlich anmelden, Sicherheit zu leisten, soweit sie nicht Befriedigung verlangen können. Dieses Recht steht den Gläubigern jedoch nur zu, wenn sie glaubhaft machen, dass durch die Ausgliederung die Erfüllung der Forderung gefährdet wird."
    },
    {
      "date": "2025-09-23",
      "id": "131047",
      "original_text": "Registerbekanntmachung nach dem Umwandlungsgesetz\nRheinland-Pfalz Amtsgericht Ludwigshafen a.Rhein (Ludwigshafen) HRB 70420\nMedien Union Grundbesitz Niedersachsen GmbH – Ludwigshafen",
      "type": "Registerbekanntmachung nach dem Umwandlungsgesetz",
      "state": "Rheinland-Pfalz",
      "amtsgericht": "Amtsgericht Ludwigshafen a.Rhein (Ludwigshafen)",
      "registernummer": "HRB 70420",
      "registerart": "HRB",
      "company_name": "Medien Union Grundbesitz Niedersachsen GmbH",
      "company_seat": "Ludwigshafen",
      "details": "23.09.2025 (Bekanntmachungsdatum)\n\nRheinland-Pfalz Amtsgericht Ludwigshafen a.Rhein (Ludwigshafen) HRB 70420\nRegisterbekanntmachung nach dem Umwandlungsgesetz 23.09.2025 (Eintragungsdatum)\n\nMedien Union Grundbesitz Niedersachsen GmbH\nGesellschaft mit beschränkter Haftung\nLudwigshafen\n\nAls nicht eingetragen wird veröffentlicht: Den Gläubigern der an der Als nicht eingetragen wird veröffentlicht:\nDen Gläubigern des formwechselnden Rechtsträgers ist, wenn sie binnen sechs Monaten nach dem Tag, an dem die Eintragung des Formwechsels nach § 201 UmwG als bekannt gemacht gilt, ihren Anspruch nach Grund und Höhe schriftlich anmelden, Sicherheit zu leisten, soweit sie nicht Befriedigung verlangen können. Dieses Recht steht den Gläubigern jedoch nur zu, wenn sie glaubhaft machen, dass durch den Formwechsel die Erfüllung der Forderung gefährdet wird. Umwandlungbeteiligten Rechtsträger ist, wenn sie binnen sechs Monaten nach dem Tag, an dem die Eintragung der Umwandlung in das Register des Sitzes desjenigen Rechtsträgers, dessen Gläubiger sie sind, nach § 19 Abs. 3 UmwG als bekannt gemacht gilt, ihren Anspruch nach Grund und Höhe schriftlich anmelden, Sicherheit zu leisten, soweit sie nicht Befriedigung verlangen können. Dieses Recht steht den Gläubigern jedoch nur zu, wenn sie glaubhaft machen, dass durch die Umwandlung die Erfüllung der Forderung gefährdet wird."
    },
    {
      "date": "2025-09-23",
      "id": "131048",
      "original_text": "Registerbekanntmachung nach dem Umwandlungsgesetz\nRheinland-Pfalz Amtsgericht Ludwigshafen a.Rhein (Ludwigshafen) HRB 70418\nOtt Fenster & Innenausbau GmbH – Altrip",
      "type": "Registerbekanntmachung nach dem Umwandlungsgesetz",
      "state": "Rheinland-Pfalz",
      "amtsgericht": "Amtsgericht Ludwigshafen a.Rhein (Ludwigshafen)",
      "registernummer": "HRB 70418",
      "registerart": "HRB",
      "company_name": "Ott Fenster & Innenausbau GmbH",
      "company_seat": "Altrip",
      "details": "23.09.2025 (Bekanntmachungsdatum)\n\nRheinland-Pfalz Amtsgericht Ludwigshafen a.Rhein (Ludwigshafen) HRB 70418\nRegisterbekanntmachung nach dem Umwandlungsgesetz 23.09.2025 (Eintragungsdatum)\n\nOtt Fenster & Innenausbau GmbH\nGesellschaft mit beschränkter Haftung\nAltrip\n\nAls nicht eingetragen wird veröffentlicht: Den Gläubigern der an der Ausgliederung beteiligten Rechtsträger ist, wenn sie binnen sechs Monaten nach dem Tag, an dem die Eintragung der Ausgliederung in das Register des Sitzes desjenigen Rechtsträgers, dessen Gläubiger sie sind, nach § 19 Abs. 3 UmwG als bekannt gemacht gilt, ihren Anspruch nach Grund und Höhe schriftlich anmelden, Sicherheit zu leisten, soweit sie nicht Befriedigung verlangen können. Dieses Recht steht den Gläubigern jedoch nur zu, wenn sie glaubhaft machen, dass durch die Ausgliederung die Erfüllung der Forderung gefährdet wird."
    },
    {
      "date": "2025-09-23",
      "id": "131049",
      "original_text": "Registerbekanntmachung nach dem Umwandlungsgesetz\nRheinland-Pfalz Amtsgericht Ludwigshafen a.Rhein (Ludwigshafen) HRB 66146\nWendt Beteiligungs-GmbH – Frankenthal",
      "type": "Registerbekanntmachung nach dem Umwandlungsgesetz",
      "state": "Rheinland-Pfalz",
      "amtsgericht": "Amtsgericht Ludwigshafen a.Rhein (Ludwigshafen)",
      "registernummer": "HRB 66146",
      "registerart": "HRB",
      "company_name": "Wendt Beteiligungs-GmbH",
      "company_seat": "Frankenthal",
      "details": "23.09.2025 (Bekanntmachungsdatum)\n\nRheinland-Pfalz Amtsgericht Ludwigshafen a.Rhein (Ludwigshafen) HRB 66146\nRegisterbekanntmachung nach dem Umwandlungsgesetz 23.09.2025 (Eintragungsdatum)\n\nWendt Beteiligungs-GmbH\nGesellschaft mit beschränkter Haftung\nFrankenthal\n\nAls nicht eingetragen wird veröffentlicht: Den Gläubigern der an der Verschmelzung beteiligten Rechtsträger ist, wenn sie binnen sechs Monaten nach dem Tag, an dem die Eintragung der Verschmelzung in das Register des Sitzes desjenigen Rechtsträgers,dessen Gläubiger sie sind, nach § 19 Abs. 3 UmwG als bekannt gemacht gilt, ihren Anspruch nach Grund und Höhe schriftlich anmelden, Sicherheit zu leisten, soweit sie nicht Befriedigung verlangen können. Dieses Recht steht den Gläubigern jedoch nur zu, wenn sie glaubhaft machen, dass durch die Verschmelzung die Erfüllung der Forderung gefährdet wird."
    },
    {
      "date": "2025-09-23",
      "id": "131050",
      "original_text": "Löschungsankündigung\nNordrhein-Westfalen Amtsgericht Bochum HRB 3863\nGES Gesellschaft für Elektroinstallation und Sicherheitstechnik mit beschränkter Haftung – Bochum",
      "type": "Löschungsankündigung",
      "state": "Nordrhein-Westfalen",
      "amtsgericht": "Amtsgericht Bochum",
      "registernummer": "HRB 3863",
      "registerart": "HRB",
      "company_name": "GES Gesellschaft für Elektroinstallation und Sicherheitstechnik mit beschränkter Haftung",
      "company_seat": "Bochum",
      "details": "23.09.2025 (Bekanntmachungsdatum)\n\nNordrhein-Westfalen Amtsgericht Bochum HRB 3863\nLöschungsankündigung\n\nGES Gesellschaft für Elektroinstallation und Sicherheitstechnik mit beschränkter Haftung\nGesellschaft mit beschränkter Haftung\nBochum\n\nDas Registergericht beabsichtigt die Gesellschaft von Amts wegen nach § 394 FamFG zu löschen. Die Frist zur Erhebung eines Widerspruchs ist auf drei Monate festgesetzt."
    },
    {
      "date": "2025-09-23",
      "id": "131051",
      "original_text": "Löschungsankündigung\nNordrhein-Westfalen Amtsgericht Bochum HRB 3863\nGES Gesellschaft für Elektroinstallation und Sicherheitstechnik mit beschränkter Haftung – Bochum",
      "type": "Löschungsankündigung",
      "state": "Nordrhein-Westfalen",
      "amtsgericht": "Amtsgericht Bochum",
      "registernummer": "HRB 3863",
      "registerart": "HRB",
      "company_name": "GES Gesellschaft für Elektroinstallation und Sicherheitstechnik mit beschränkter Haftung",
      "company_seat": "Bochum",
      "details": "23.09.2025 (Bekanntmachungsdatum)\n\nNordrhein-Westfalen Amtsgericht Bochum HRB 3863\nLöschungsankündigung 23.09.2025 (Eintragungsdatum)\n\nGES Gesellschaft für Elektroinstallation und Sicherheitstechnik mit beschränkter Haftung\nGesellschaft mit beschränkter Haftung\nBochum\n\nDas Registergericht beabsichtigt die Gesellschaft von Amts wegen nach § 394 FamFG zu löschen. Die Frist zur Erhebung eines Widerspruchs ist auf drei Monate festgesetzt."
    },
    {
      "date": "2025-09-23",
      "id": "131052",
      "original_text": "Einreichung neuer Dokumente\nNordrhein-Westfalen Amtsgericht Aachen HRB 13990\nHemoteq AG – Würselen",
      "type": "Einreichung neuer Dokumente",
      "state": "Nordrhein-Westfalen",
      "amtsgericht": "Amtsgericht Aachen",
      "registernummer": "HRB 13990",
      "registerart": "HRB",
      "company_name": "Hemoteq AG",
      "company_seat": "Würselen",
      "details": "23.09.2025 (Bekanntmachungsdatum)\n\nNordrhein-Westfalen Amtsgericht Aachen HRB 13990\nEinreichung neuer Dokumente\n\nHemoteq AG\nAktiengesellschaft\nWürselen\n\nDem Registergericht ist eine Liste der Mitglieder des Aufsichtsrates eingereicht worden."
    },
    {
      "date": "2025-09-23",
      "id": "131053",
      "original_text": "Registerbekanntmachung nach dem Umwandlungsgesetz\nNordrhein-Westfalen Amtsgericht Krefeld HRB 19799\nisales GmbH – Krefeld",
      "type": "Registerbekanntmachung nach dem Umwandlungsgesetz",
      "state": "Nordrhein-Westfalen",
      "amtsgericht": "Amtsgericht Krefeld",
      "registernummer": "HRB 19799",
      "registerart": "HRB",
      "company_name": "isales GmbH",
      "company_seat": "Krefeld",
      "details": "23.09.2025 (Bekanntmachungsdatum)\n\nNordrhein-Westfalen Amtsgericht Krefeld HRB 19799\nRegisterbekanntmachung nach dem Umwandlungsgesetz 23.09.2025 (Eintragungsdatum)\n\nisales GmbH\nGesellschaft mit beschränkter Haftung\nKrefeld\n\nDen Gläubigern der an der Verschmelzung beteiligten Rechtsträger ist, wenn sie binnen sechs Monaten nach dem Tag, an dem die Eintragung der Verschmelzung in das Register des Sitzes desjenigen Rechtsträgers, dessen Gläubiger sie sind, nach § 19 Absatz 3 UmwG als bekanntgemacht gilt, ihren Anspruch nach Grund und Höhe schriftlich anmelden, Sicherheit zu leisten, soweit sie nicht Befriedigung verlangen können. Dieses Recht steht den Gläubigern jedoch nur zu, wenn sie glaubhaft machen, dass durch die Verschmelzung die Erfüllung ihrer Forderung gefährdet wird."
    },
    {
      "date": "2025-09-23",
      "id": "131054",
      "original_text": "Löschungsankündigung\nNordrhein-Westfalen Amtsgericht Köln HRA 20498\nLutz Diese e.K. – Köln",
      "type": "Löschungsankündigung",
      "state": "Nordrhein-Westfalen",
      "amtsgericht": "Amtsgericht Köln",
      "registernummer": "HRA 20498",
      "registerart": "HRA",
      "company_name": "Lutz Diese e.K.",
      "company_seat": "Köln",
      "details": "23.09.2025 (Bekanntmachungsdatum)\n\nNordrhein-Westfalen Amtsgericht Köln HRA 20498\nLöschungsankündigung 23.09.2025 (Eintragungsdatum)\n\nLutz Diese e.K.\nEinzelkaufmann / Einzelkauffrau\nKöln\n\nDas Registergericht beabsichtigt die Firma von Amts wegen nach § 31 Abs. 2 HGB, § 393 FamFG zu löschen. Die Frist zur Erhebung eines Widerspruchs ist auf #DV.Fr(Text=\"Bitte wählen Sie die Widerspruchsfrist aus!\",Eingabe=\"einen Monat\",\"zwei Monate\",\"drei Monate\",\"#insert(Text=\"Freitext\")\"|\"freier Text\") festgesetzt."
    },
    {
      "date": "2025-09-23",
      "id": "131055",
      "original_text": "Löschungsankündigung\nNordrhein-Westfalen Amtsgericht Köln HRA 20498\nLutz Diese e.K. – Köln",
      "type": "Löschungsankündigung",
      "state": "Nordrhein-Westfalen",
      "amtsgericht": "Amtsgericht Köln",
      "registernummer": "HRA 20498",
      "registerart": "HRA",
      "company_name": "Lutz Diese e.K.",
      "company_seat": "Köln",
      "details": "23.09.2025 (Bekanntmachungsdatum)\n\nNordrhein-Westfalen Amtsgericht Köln HRA 20498\nLöschungsankündigung 23.09.2025 (Eintragungsdatum)\n\nLutz Diese e.K.\nEinzelkaufmann / Einzelkauffrau\nKöln\n\nDas Registergericht beabsichtigt die Firma von Amts wegen nach § 31 Abs. 2 HGB, § 393 FamFG zu löschen. Die Frist zur Erhebung eines Widerspruchs ist auf zwei Monate festgesetzt."
    },
    {
      "date": "2025-09-23",
      "id": "131056",
      "original_text": "Registerbekanntmachung nach dem Umwandlungsgesetz\nNordrhein-Westfalen Amtsgericht Bochum HRB 20069\nMEERKAT Home GmbH – Bochum",
      "type": "Registerbekanntmachung nach dem Umwandlungsgesetz",
      "state": "Nordrhein-Westfalen",
      "amtsgericht": "Amtsgericht Bochum",
      "registernummer": "HRB 20069",
      "registerart": "HRB",
      "company_name": "MEERKAT Home GmbH",
      "company_seat": "Bochum",
      "details": "23.09.2025 (Bekanntmachungsdatum)\n\nNordrhein-Westfalen Amtsgericht Bochum HRB 20069\nRegisterbekanntmachung nach dem Umwandlungsgesetz 08.08.2025 (Eintragungsdatum)\n\nMEERKAT Home GmbH\nGesellschaft mit beschränkter Haftung\nBochum\n\nDen Gläubigern der an der Verschmelzung beteiligten Rechtsträger ist, wenn sie binnen sechs Monaten nach dem Tag, an dem die Eintragung der Verschmelzung in das Register des Sitzes desjenigen Rechtsträgers, dessen Gläubiger sie sind, nach § 19 Absatz 3 UmwG als bekanntgemacht gilt, ihren Anspruch nach Grund und Höhe schriftlich anmelden, Sicherheit zu leisten, soweit sie nicht Befriedigung verlangen können. Dieses Recht steht den Gläubigern jedoch nur zu, wenn sie glaubhaft machen, dass durch die Verschmelzung die Erfüllung ihrer Forderung gefährdet wird."
    },
    {
      "date": "2025-09-23",
      "id": "131057",
      "original_text": "Registerbekanntmachung nach dem Umwandlungsgesetz\nNordrhein-Westfalen Amtsgericht Duisburg HRB 34977\nLaue Group GmbH – Mülheim an der Ruhr",
      "type": "Registerbekanntmachung nach dem Umwandlungsgesetz",
      "state": "Nordrhein-Westfalen",
      "amtsgericht": "Amtsgericht Duisburg",
      "registernummer": "HRB 34977",
      "registerart": "HRB",
      "company_name": "Laue Group GmbH",
      "company_seat": "Mülheim an der Ruhr",
      "details": "23.09.2025 (Bekanntmachungsdatum)\n\nNordrhein-Westfalen Amtsgericht Duisburg HRB 34977\nRegisterbekanntmachung nach dem Umwandlungsgesetz 23.09.2025 (Eintragungsdatum)\n\nLaue Group GmbH\nGesellschaft mit beschränkter Haftung\nMülheim an der Ruhr\n\nDie Gesellschaft hat Gläubigern, deren Forderungen vor dieser Bekanntmachung begründet worden sind, Sicherheit zu leisten, soweit sie nicht Befriedigung verlangen können, wenn sie sich binnen sechs Monaten zu diesem Zweck melden."
    },
    {
      "date": "2025-09-23",
      "id": "131058",
      "original_text": "Registerbekanntmachung nach dem Umwandlungsgesetz\nNordrhein-Westfalen Amtsgericht Düsseldorf HRB 86811\nInnovationscampus Krefeld LM I GmbH – Monheim am Rhein",
      "type": "Registerbekanntmachung nach dem Umwandlungsgesetz",
      "state": "Nordrhein-Westfalen",
      "amtsgericht": "Amtsgericht Düsseldorf",
      "registernummer": "HRB 86811",
      "registerart": "HRB",
      "company_name": "Innovationscampus Krefeld LM I GmbH",
      "company_seat": "Monheim am Rhein",
      "details": "23.09.2025 (Bekanntmachungsdatum)\n\nNordrhein-Westfalen Amtsgericht Düsseldorf HRB 86811\nRegisterbekanntmachung nach dem Umwandlungsgesetz 23.09.2025 (Eintragungsdatum)\n\nInnovationscampus Krefeld LM I GmbH\nGesellschaft mit beschränkter Haftung\nMonheim am Rhein\n\nDen Gläubigern der an der Verschmelzung beteiligten Rechtsträger ist, wenn sie binnen sechs Monaten nach dem Tag, an dem die Eintragung der Verschmelzung in das Register des Sitzes desjenigen Rechtsträgers, dessen Gläubiger sie sind, nach § 19 Absatz 3 UmwG als bekanntgemacht gilt, ihren Anspruch nach Grund und Höhe schriftlich anmelden, Sicherheit zu leisten, soweit sie nicht Befriedigung verlangen können. Dieses Recht steht den Gläubigern jedoch nur zu, wenn sie glaubhaft machen, dass durch die Verschmelzung die Erfüllung ihrer Forderung gefährdet wird."
    },
    {
      "date": "2025-09-23",
      "id": "131059",
      "original_text": "Registerbekanntmachung nach dem Umwandlungsgesetz\nNordrhein-Westfalen Amtsgericht Gelsenkirchen HRB 18770\nMerlin Digital GmbH – Bottrop",
      "type": "Registerbekanntmachung nach dem Umwandlungsgesetz",
      "state": "Nordrhein-Westfalen",
      "amtsgericht": "Amtsgericht Gelsenkirchen",
      "registernummer": "HRB 18770",
      "registerart": "HRB",
      "company_name": "Merlin Digital GmbH",
      "company_seat": "Bottrop",
      "details": "23.09.2025 (Bekanntmachungsdatum)\n\nNordrhein-Westfalen Amtsgericht Gelsenkirchen HRB 18770\nRegisterbekanntmachung nach dem Umwandlungsgesetz 23.09.2025 (Eintragungsdatum)\n\nMerlin Digital GmbH\nGesellschaft mit beschränkter Haftung\nBottrop\n\nDen Gläubigern der an der Verschmelzung beteiligten Rechtsträger ist, wenn sie binnen sechs Monaten nach dem Tag, an dem die Eintragung der Verschmelzung in das Register des Sitzes desjenigen Rechtsträgers, dessen Gläubiger sie sind, nach § 19 Absatz 3 UmwG als bekanntgemacht gilt, ihren Anspruch nach Grund und Höhe schriftlich anmelden, Sicherheit zu leisten, soweit sie nicht Befriedigung verlangen können. Dieses Recht steht den Gläubigern jedoch nur zu, wenn sie glaubhaft machen, dass durch die Verschmelzung die Erfüllung ihrer Forderung gefährdet wird."
    },
    {
      "date": "2025-09-23",
      "id": "131060",
      "original_text": "Löschungsankündigung\nNordrhein-Westfalen Amtsgericht Bochum HRB 19695\nCeGu Dienstleistung GmbH – Herne",
      "type": "Löschungsankündigung",
      "state": "Nordrhein-Westfalen",
      "amtsgericht": "Amtsgericht Bochum",
      "registernummer": "HRB 19695",
      "registerart": "HRB",
      "company_name": "CeGu Dienstleistung GmbH",
      "company_seat": "Herne",
      "details": "23.09.2025 (Bekanntmachungsdatum)\n\nNordrhein-Westfalen Amtsgericht Bochum HRB 19695\nLöschungsankündigung 24.09.2025 (Eintragungsdatum)\n\nCeGu Dienstleistung GmbH\nGesellschaft mit beschränkter Haftung\nHerne\n\nDas Registergericht beabsichtigt die Gesellschaft von Amts wegen nach § 394 FamFG zu löschen. Die Frist zur Erhebung eines Widerspruchs ist auf drei Monate festgesetzt."
    },
    {
      "date": "2025-09-23",
      "id": "131061",
      "original_text": "Löschungsankündigung\nNordrhein-Westfalen Amtsgericht Siegburg HRB 14179\nEltron Elektrotechnik GmbH – Lohmar",
      "type": "Löschungsankündigung",
      "state": "Nordrhein-Westfalen",
      "amtsgericht": "Amtsgericht Siegburg",
      "registernummer": "HRB 14179",
      "registerart": "HRB",
      "company_name": "Eltron Elektrotechnik GmbH",
      "company_seat": "Lohmar",
      "details": "23.09.2025 (Bekanntmachungsdatum)\n\nNordrhein-Westfalen Amtsgericht Siegburg HRB 14179\nLöschungsankündigung\n\nEltron Elektrotechnik GmbH\nGesellschaft mit beschränkter Haftung\nLohmar\n\nDas Registergericht hat glaubhafte Kenntnis erlangt, dass die Gesellschaft vermögenslos geworden ist.\n\nEs ist daher beabsichtigt, die Gesellschaft nach § 394 FamFG im Handelsregister wegen Vermögenslosigkeit zu löschen.\n\nEinwände gegen die Löschung sind durch Widerspruch binnen einer Frist von 3 Monaten geltend zu machen, andernfalls die Löschung erfolgen wird.\n\nEinzulegen ist der Widerspruch bei dem Amtsgericht Siegburg, Neue Poststraße 16, 53721 Siegburg, und zwar entweder schriftlich in deutscher Sprache oder mündlich zur Niederschrift der Geschäftsstelle. Der Widerspruch kann auch zur Niederschrift der Geschäftsstelle eines jeden Amtsgerichts abgegeben werden. Der Widerspruch ist binnen der in der Verfügung bestimmten Frist einzulegen. Die Frist ist nur gewahrt, wenn der Widerspruch rechtzeitig bei dem Amtsgericht Siegburg eingeht, auch wenn der Widerspruch zur Niederschrift der Geschäftsstelle eines anderen Amtsgerichts abgegeben wurde. Die Frist beginnt jeweils mit der schriftlichen Bekanntgabe der Verfügung an die Beteiligten. Kann die schriftliche Bekanntgabe an einen Beteiligten nicht bewirkt werden, beginnt die Frist spätestens mit Ablauf von fünf Monaten nach Erlass der Verfügung. Die Bekanntgabe ist entweder durch Zustellung oder am dritten Tage nach Aufgabe zur Post bewirkt. Sofern die Löschung noch nicht erfolgt ist, kann der Widerspruch auch noch nach Ablauf der Frist eingelegt werden. Fällt das Ende der Frist auf einen Sonnabend, einen Sonntag oder einen allgemeinen Feiertag, endet die Frist mit Ablauf des nächsten Werktages. Der Widerspruch ist zu unterzeichnen. Eine Begründung des Widerspruchs ist nicht vorgeschrieben."
    },
    {
      "date": "2025-09-23",
      "id": "131062",
      "original_text": "Registerbekanntmachung nach dem Umwandlungsgesetz\nNordrhein-Westfalen Amtsgericht Duisburg HRB 29316\nIsomax Beteiligungsgesellschaft mbH – Duisburg",
      "type": "Registerbekanntmachung nach dem Umwandlungsgesetz",
      "state": "Nordrhein-Westfalen",
      "amtsgericht": "Amtsgericht Duisburg",
      "registernummer": "HRB 29316",
      "registerart": "HRB",
      "company_name": "Isomax Beteiligungsgesellschaft mbH",
      "company_seat": "Duisburg",
      "details": "23.09.2025 (Bekanntmachungsdatum)\n\nNordrhein-Westfalen Amtsgericht Duisburg HRB 29316\nRegisterbekanntmachung nach dem Umwandlungsgesetz 23.09.2025 (Eintragungsdatum)\n\nIsomax Beteiligungsgesellschaft mbH\nGesellschaft mit beschränkter Haftung\nDuisburg\n\nDie Gesellschaft hat Gläubigern, deren Forderungen vor dieser Bekanntmachung begründet worden sind, Sicherheit zu leisten, soweit sie nicht Befriedigung verlangen können, wenn sie sich binnen sechs Monaten zu diesem Zweck melden."
    },
    {
      "date": "2025-09-23",
      "id": "131063",
      "original_text": "Registerbekanntmachung nach dem Umwandlungsgesetz\nNordrhein-Westfalen Amtsgericht Dortmund HRA 19817\nEisBerger GmbH & Co. KG – Werne",
      "type": "Registerbekanntmachung nach dem Umwandlungsgesetz",
      "state": "Nordrhein-Westfalen",
      "amtsgericht": "Amtsgericht Dortmund",
      "registernummer": "HRA 19817",
      "registerart": "HRA",
      "company_name": "EisBerger GmbH & Co. KG",
      "company_seat": "Werne",
      "details": "23.09.2025 (Bekanntmachungsdatum)\n\nNordrhein-Westfalen Amtsgericht Dortmund HRA 19817\nRegisterbekanntmachung nach dem Umwandlungsgesetz 22.09.2025 (Eintragungsdatum)\n\nEisBerger GmbH & Co. KG\nKommanditgesellschaft\nWerne\n\nDen Gläubigern der an der formwechselnden Umwandlung beteiligten Rechtsträger ist, wenn sie binnen sechs Monaten nach dem Tag, an dem die Eintragung der formwechselnden Umwandlung in das Register des Sitzes desjenigen Rechtsträgers, dessen Gläubiger sie sind, nach § 19 Absatz 3 UmwG als bekanntgemacht gilt, ihren Anspruch nach Grund und Höhe schriftlich anmelden, Sicherheit zu leisten, soweit sie nicht Befriedigung verlangen können. Dieses Recht steht den Gläubigern jedoch nur zu, wenn sie glaubhaft machen, dass durch die formwechselnden Umwandlung die Erfüllung ihrer Forderung gefährdet wird."
    },
    {
      "date": "2025-09-23",
      "id": "131064",
      "original_text": "Löschungsankündigung\nNordrhein-Westfalen Amtsgericht Dortmund HRB 18849\nFock GmbH – Dortmund",
      "type": "Löschungsankündigung",
      "state": "Nordrhein-Westfalen",
      "amtsgericht": "Amtsgericht Dortmund",
      "registernummer": "HRB 18849",
      "registerart": "HRB",
      "company_name": "Fock GmbH",
      "company_seat": "Dortmund",
      "details": "23.09.2025 (Bekanntmachungsdatum)\n\nNordrhein-Westfalen Amtsgericht Dortmund HRB 18849\nLöschungsankündigung\n\nFock GmbH\nGesellschaft mit beschränkter Haftung\nDortmund\n\nDas Registergericht beabsichtigt die Gesellschaft von Amts wegen nach § 394 FamFG zu löschen. Die Frist zur Erhebung eines Widerspruchs ist auf zwei Monate festgesetzt."
    },
    {
      "date": "2025-09-23",
      "id": "131065",
      "original_text": "Registerbekanntmachung nach dem Umwandlungsgesetz\nNordrhein-Westfalen Amtsgericht Siegburg HRB 11189\nKünzelmann Unternehmergesellschaft (haftungsbeschränkt) – Sankt Augustin",
      "type": "Registerbekanntmachung nach dem Umwandlungsgesetz",
      "state": "Nordrhein-Westfalen",
      "amtsgericht": "Amtsgericht Siegburg",
      "registernummer": "HRB 11189",
      "registerart": "HRB",
      "company_name": "Künzelmann Unternehmergesellschaft (haftungsbeschränkt)",
      "company_seat": "Sankt Augustin",
      "details": "23.09.2025 (Bekanntmachungsdatum)\n\nNordrhein-Westfalen Amtsgericht Siegburg HRB 11189\nRegisterbekanntmachung nach dem Umwandlungsgesetz 23.09.2025 (Eintragungsdatum)\n\nKünzelmann Unternehmergesellschaft (haftungsbeschränkt)\nGesellschaft mit beschränkter Haftung\nSankt Augustin\n\nDen Gläubigern der an der Verschmelzung beteiligten Rechtsträger ist, wenn sie binnen sechs Monaten nach dem Tag, an dem die Eintragung der Verschmelzung in das Register des Sitzes desjenigen Rechtsträgers, dessen Gläubiger sie sind, nach § 19 Absatz 3 UmwG als bekanntgemacht gilt, ihren Anspruch nach Grund und Höhe schriftlich anmelden, Sicherheit zu leisten, soweit sie nicht Befriedigung verlangen können. Dieses Recht steht den Gläubigern jedoch nur zu, wenn sie glaubhaft machen, dass durch die Verschmelzung die Erfüllung ihrer Forderung gefährdet wird."
    },
    {
      "date": "2025-09-23",
      "id": "131066",
      "original_text": "Registerbekanntmachung nach dem Umwandlungsgesetz\nNordrhein-Westfalen Amtsgericht Bad Oeynhausen HRA 10667\nHäcker Holding GmbH & Co. KG – Rödinghausen",
      "type": "Registerbekanntmachung nach dem Umwandlungsgesetz",
      "state": "Nordrhein-Westfalen",
      "amtsgericht": "Amtsgericht Bad Oeynhausen",
      "registernummer": "HRA 10667",
      "registerart": "HRA",
      "company_name": "Häcker Holding GmbH & Co. KG",
      "company_seat": "Rödinghausen",
      "details": "23.09.2025 (Bekanntmachungsdatum)\n\nNordrhein-Westfalen Amtsgericht Bad Oeynhausen HRA 10667\nRegisterbekanntmachung nach dem Umwandlungsgesetz 23.09.2025 (Eintragungsdatum)\n\nHäcker Holding GmbH & Co. KG\nKommanditgesellschaft\nRödinghausen\n\nDen Gläubigern der an der formwechselnden Umwandlung beteiligten Rechtsträger ist, wenn sie binnen sechs Monaten nach dem Tag, an dem die Eintragung der formwechselnden Umwandlung in das Register des Sitzes desjenigen Rechtsträgers, dessen Gläubiger sie sind, nach § 19 Absatz 3 UmwG als bekanntgemacht gilt, ihren Anspruch nach Grund und Höhe schriftlich anmelden, Sicherheit zu leisten, soweit sie nicht Befriedigung verlangen können. Dieses Recht steht den Gläubigern jedoch nur zu, wenn sie glaubhaft machen, dass durch die formwechselnden Umwandlung die Erfüllung ihrer Forderung gefährdet wird."
    },
    {
      "date": "2025-09-23",
      "id": "131067",
      "original_text": "Registerbekanntmachung nach dem Umwandlungsgesetz\nNordrhein-Westfalen Amtsgericht Köln HRA 28165\nStein Immobilien GmbH & Co. KG – Engelskirchen",
      "type": "Registerbekanntmachung nach dem Umwandlungsgesetz",
      "state": "Nordrhein-Westfalen",
      "amtsgericht": "Amtsgericht Köln",
      "registernummer": "HRA 28165",
      "registerart": "HRA",
      "company_name": "Stein Immobilien GmbH & Co. KG",
      "company_seat": "Engelskirchen",
      "details": "23.09.2025 (Bekanntmachungsdatum)\n\nNordrhein-Westfalen Amtsgericht Köln HRA 28165\nRegisterbekanntmachung nach dem Umwandlungsgesetz 23.09.2025 (Eintragungsdatum)\n\nStein Immobilien GmbH & Co. KG\nKommanditgesellschaft\nEngelskirchen\n\nDen Gläubigern der an der Verschmelzung beteiligten Rechtsträger ist, wenn sie binnen sechs Monaten nach dem Tag, an dem die Eintragung der Verschmelzung in das Register des Sitzes derjenigen Rechtsträger deren Gläubiger sie sind, nach § 19 Absatz 3 UmwG als bekanntgemacht gilt, ihren Anspruch nach Grund und Höhe schriftlich anmelden, Sicherheit zu leisten, soweit sie nicht Befriedigung verlangen können. Dieses Recht steht den Gläubigern jedoch nur zu, wenn sie glaubhaft machen, dass durch die Verschmelzung die Erfüllung ihrer Forderung gefährdet wird."
    },
    {
      "date": "2025-09-23",
      "id": "131068",
      "original_text": "Registerbekanntmachung nach dem Umwandlungsgesetz\nNordrhein-Westfalen Amtsgericht Köln HRA 37228\nWS Immobilien GmbH & Co. KG – Engelskirchen",
      "type": "Registerbekanntmachung nach dem Umwandlungsgesetz",
      "state": "Nordrhein-Westfalen",
      "amtsgericht": "Amtsgericht Köln",
      "registernummer": "HRA 37228",
      "registerart": "HRA",
      "company_name": "WS Immobilien GmbH & Co. KG",
      "company_seat": "Engelskirchen",
      "details": "23.09.2025 (Bekanntmachungsdatum)\n\nNordrhein-Westfalen Amtsgericht Köln HRA 37228\nRegisterbekanntmachung nach dem Umwandlungsgesetz 23.09.2025 (Eintragungsdatum)\n\nWS Immobilien GmbH & Co. KG\nKommanditgesellschaft\nEngelskirchen\n\nDen Gläubigern der an der Verschmelzung beteiligten Rechtsträger ist, wenn sie binnen sechs Monaten nach dem Tag, an dem die Eintragung der Verschmelzung in das Register des Sitzes desjenigen Rechtsträgers, dessen Gläubiger sie sind, nach § 19 Absatz 3 UmwG als bekanntgemacht gilt, ihren Anspruch nach Grund und Höhe schriftlich anmelden, Sicherheit zu leisten, soweit sie nicht Befriedigung verlangen können. Dieses Recht steht den Gläubigern jedoch nur zu, wenn sie glaubhaft machen, dass durch die Verschmelzung die Erfüllung ihrer Forderung gefährdet wird."
    },
    {
      "date": "2025-09-23",
      "id": "131069",
      "original_text": "Registerbekanntmachung nach dem Umwandlungsgesetz\nNordrhein-Westfalen Amtsgericht Gelsenkirchen HRB 15550\nJeKo Vermögens Verwaltungs GmbH – Marl",
      "type": "Registerbekanntmachung nach dem Umwandlungsgesetz",
      "state": "Nordrhein-Westfalen",
      "amtsgericht": "Amtsgericht Gelsenkirchen",
      "registernummer": "HRB 15550",
      "registerart": "HRB",
      "company_name": "JeKo Vermögens Verwaltungs GmbH",
      "company_seat": "Marl",
      "details": "23.09.2025 (Bekanntmachungsdatum)\n\nNordrhein-Westfalen Amtsgericht Gelsenkirchen HRB 15550\nRegisterbekanntmachung nach dem Umwandlungsgesetz 23.09.2025 (Eintragungsdatum)\n\nJeKo Vermögens Verwaltungs GmbH\nGesellschaft mit beschränkter Haftung\nMarl\n\nDen Gläubigern der an der Verschmelzung beteiligten Rechtsträger ist, wenn sie binnen sechs Monaten nach dem Tag, an dem die Eintragung der Verschmelzung in das Register des Sitzes derjenigen Rechtsträger, deren Gläubiger sie sind, nach § 19 Absatz 3 UmwG als bekanntgemacht gilt, ihren Anspruch nach Grund und Höhe schriftlich anmelden, Sicherheit zu leisten, soweit sie nicht Befriedigung verlangen können. Dieses Recht steht den Gläubigern jedoch nur zu, wenn sie glaubhaft machen, dass durch die Verschmelzung die Erfüllung ihrer Forderung gefährdet wird."
    },
    {
      "date": "2025-09-23",
      "id": "131070",
      "original_text": "Registerbekanntmachung nach dem Umwandlungsgesetz\nNordrhein-Westfalen Amtsgericht Essen HRB 33414\nADOMO Deutschland Holding GmbH – Essen",
      "type": "Registerbekanntmachung nach dem Umwandlungsgesetz",
      "state": "Nordrhein-Westfalen",
      "amtsgericht": "Amtsgericht Essen",
      "registernummer": "HRB 33414",
      "registerart": "HRB",
      "company_name": "ADOMO Deutschland Holding GmbH",
      "company_seat": "Essen",
      "details": "23.09.2025 (Bekanntmachungsdatum)\n\nNordrhein-Westfalen Amtsgericht Essen HRB 33414\nRegisterbekanntmachung nach dem Umwandlungsgesetz 23.09.2025 (Eintragungsdatum)\n\nADOMO Deutschland Holding GmbH\nGesellschaft mit beschränkter Haftung\nEssen\n\nDen Gläubigern der an der Verschmelzung beteiligten Rechtsträger ist, wenn sie binnen sechs Monaten nach dem Tag, an dem die Eintragung der Verschmelzung in das Register des Sitzes desjenigen Rechtsträgers, dessen Gläubiger sie sind, nach § 19 Absatz 3 UmwG als bekanntgemacht gilt, ihren Anspruch nach Grund und Höhe schriftlich anmelden, Sicherheit zu leisten, soweit sie nicht Befriedigung verlangen können. Dieses Recht steht den Gläubigern jedoch nur zu, wenn sie glaubhaft machen, dass durch die Verschmelzung die Erfüllung ihrer Forderung gefährdet wird."
    },
    {
      "date": "2025-09-23",
      "id": "131071",
      "original_text": "Löschungsankündigung\nNordrhein-Westfalen Amtsgericht Bochum HRB 19598\nSTB Sternbau Bochum GmbH – Bochum",
      "type": "Löschungsankündigung",
      "state": "Nordrhein-Westfalen",
      "amtsgericht": "Amtsgericht Bochum",
      "registernummer": "HRB 19598",
      "registerart": "HRB",
      "company_name": "STB Sternbau Bochum GmbH",
      "company_seat": "Bochum",
      "details": "23.09.2025 (Bekanntmachungsdatum)\n\nNordrhein-Westfalen Amtsgericht Bochum HRB 19598\nLöschungsankündigung 23.09.2025 (Eintragungsdatum)\n\nSTB Sternbau Bochum GmbH\nGesellschaft mit beschränkter Haftung\nBochum\n\nDas Registergericht beabsichtigt die Gesellschaft von Amts wegen nach § 394 FamFG zu löschen. Die Frist zur Erhebung eines Widerspruchs ist auf drei Monate festgesetzt."
    },
    {
      "date": "2025-09-23",
      "id": "131072",
      "original_text": "Registerbekanntmachung nach dem Umwandlungsgesetz\nNordrhein-Westfalen Amtsgericht Mönchengladbach HRB 3939\nSantander Consumer Leasing GmbH – Mönchengladbach",
      "type": "Registerbekanntmachung nach dem Umwandlungsgesetz",
      "state": "Nordrhein-Westfalen",
      "amtsgericht": "Amtsgericht Mönchengladbach",
      "registernummer": "HRB 3939",
      "registerart": "HRB",
      "company_name": "Santander Consumer Leasing GmbH",
      "company_seat": "Mönchengladbach",
      "details": "23.09.2025 (Bekanntmachungsdatum)\n\nNordrhein-Westfalen Amtsgericht Mönchengladbach HRB 3939\nRegisterbekanntmachung nach dem Umwandlungsgesetz 23.09.2025 (Eintragungsdatum)\n\nSantander Consumer Leasing GmbH\nGesellschaft mit beschränkter Haftung\nMönchengladbach\n\nDen Gläubigern der an der Verschmelzung beteiligten Rechtsträger ist, wenn sie binnen sechs Monaten nach dem Tag, an dem die Eintragung der Verschmelzung in das Register des Sitzes desjenigen Rechtsträgers, dessen Gläubiger sie sind, nach § 19 Absatz 3 UmwG als bekanntgemacht gilt, ihren Anspruch nach Grund und Höhe schriftlich anmelden, Sicherheit zu leisten, soweit sie nicht Befriedigung verlangen können. Dieses Recht steht den Gläubigern jedoch nur zu, wenn sie glaubhaft machen, dass durch die Verschmelzung die Erfüllung ihrer Forderung gefährdet wird."
    },
    {
      "date": "2025-09-23",
      "id": "131073",
      "original_text": "Löschungsankündigung\nNordrhein-Westfalen Amtsgericht Aachen VR 2175\nForum berufliche Bildung – Herzogenrath",
      "type": "Löschungsankündigung",
      "state": "Nordrhein-Westfalen",
      "amtsgericht": "Amtsgericht Aachen",
      "registernummer": "VR 2175",
      "registerart": "VR",
      "company_name": "Forum berufliche Bildung",
      "company_seat": "Herzogenrath",
      "details": "23.09.2025 (Bekanntmachungsdatum)\n\nNordrhein-Westfalen Amtsgericht Aachen VR 2175\nLöschungsankündigung\n\nForum berufliche Bildung\neingetragener Verein\nHerzogenrath\n\nDas Registergericht beabsichtigt, von Amts wegen den Verein wegen Wegfalls aller Mitglieder wegen Unzulässigkeit nach § 395 FamFG zu löschen.\n\nZur Geltendmachung des Widerspruchs gegen die beabsichtigte Löschung wird hiermit eine Frist von einem Monat ab Veröffentlichung dieser Ankündigung bestimmt.\n\nRechtsbehelfsbelehrung:\n\nGegen diese Verfügung kann Widerspruch eingelegt werden. Zum Widerspruch ist jeder berechtigt, der an der Unterlassung der Löschung ein berechtigtes Interesse hat.\n\nDer Widerspruch ist bei dem Amtsgericht Aachen, Adalbertsteinweg 92, 52070 Aachen schriftlich in deutscher Sprache oder zur Niederschrift der Geschäftsstelle einzulegen. Der Widerspruch kann auch zur Niederschrift der Geschäftsstelle eines jeden Amtsgerichtes abgegeben werden.\n\nDer Widerspruch muss spätestens innerhalb der gesetzten Frist nach der Bekanntgabe der Verfügung bei dem Amtsgericht Aachen eingegangen sein. Dies gilt auch dann, wenn der Widerspruch zur Niederschrift der Geschäftsstelle eines anderen Amtsgerichtes abgegeben wurde. Die Frist beginnt mit der Bekanntgabe der Verfügung durch Veröffentlichung. Fällt das Ende der Frist auf einen Sonntag, einen allgemeinen Feiertag oder Sonnabend, so endet die Frist mit Ablauf des nächsten Werktages.\n\nDer Widerspruch muss die Bezeichnung der angefochtenen Verfügung sowie die Erklärung enthalten, dass Widerspruch gegen diese Verfügung eingelegt wird. Er ist zu unterzeichnen und soll begründet werden.\n\nDie Einlegung ist auch durch Übertragung eines elektronischen Dokuments an die elektronische Poststelle des Gerichts möglich. Das elektronische Dokument muss für die Bearbeitung durch das Gericht geeignet und mit einer qualifizierten elektronischen Signatur der verantwortenden Person versehen sein oder von der verantwortenden Person signiert und auf einem sicheren Übermittlungsweg gemäß § 130 a ZPO nach näherer Maßgabe der Verordnung über die technischen Rahmenbedingungen des elektronischen Rechtsverkehrs und über das besondere elektronische Behördenpostfach (BGBl. I, S. 3803) eingereicht werden. Weitere Informationen erhalten Sie auf der Internetseite www.justiz.de."
    },
    {
      "date": "2025-09-23",
      "id": "131074",
      "original_text": "Registerbekanntmachung nach dem Umwandlungsgesetz\nNordrhein-Westfalen Amtsgericht Bielefeld HRB 37639\nGrundstücksgesellschaft P 12 mbH – Bielefeld",
      "type": "Registerbekanntmachung nach dem Umwandlungsgesetz",
      "state": "Nordrhein-Westfalen",
      "amtsgericht": "Amtsgericht Bielefeld",
      "registernummer": "HRB 37639",
      "registerart": "HRB",
      "company_name": "Grundstücksgesellschaft P 12 mbH",
      "company_seat": "Bielefeld",
      "details": "23.09.2025 (Bekanntmachungsdatum)\n\nNordrhein-Westfalen Amtsgericht Bielefeld HRB 37639\nRegisterbekanntmachung nach dem Umwandlungsgesetz 18.09.2025 (Eintragungsdatum)\n\nGrundstücksgesellschaft P 12 mbH\nGesellschaft mit beschränkter Haftung\nBielefeld\n\nDen Gläubigern der an der Verschmelzung beteiligten Rechtsträger ist, wenn sie binnen sechs Monaten nach dem Tag, an dem die Eintragung der Verschmelzung in das Register des Sitzes desjenigen Rechtsträgers, dessen Gläubiger sie sind, nach § 19 Absatz 3 UmwG als bekanntgemacht gilt, ihren Anspruch nach Grund und Höhe schriftlich anmelden, Sicherheit zu leisten, soweit sie nicht Befriedigung verlangen können. Dieses Recht steht den Gläubigern jedoch nur zu, wenn sie glaubhaft machen, dass durch die Verschmelzung die Erfüllung ihrer Forderung gefährdet wird."
    },
    {
      "date": "2025-09-23",
      "id": "131075",
      "original_text": "Registerbekanntmachung nach dem Umwandlungsgesetz\nNordrhein-Westfalen Amtsgericht Düsseldorf HRB 51238\nGERRESHEIMER GLAS GmbH – Düsseldorf",
      "type": "Registerbekanntmachung nach dem Umwandlungsgesetz",
      "state": "Nordrhein-Westfalen",
      "amtsgericht": "Amtsgericht Düsseldorf",
      "registernummer": "HRB 51238",
      "registerart": "HRB",
      "company_name": "GERRESHEIMER GLAS GmbH",
      "company_seat": "Düsseldorf",
      "details": "23.09.2025 (Bekanntmachungsdatum)\n\nNordrhein-Westfalen Amtsgericht Düsseldorf HRB 51238\nRegisterbekanntmachung nach dem Umwandlungsgesetz\n\nGERRESHEIMER GLAS GmbH\nGesellschaft mit beschränkter Haftung\nDüsseldorf\n\nDem Registergericht ist ein Verschmelzungsplan über die geplante Verschmelzung der Gesellschaft mit beschränkter Haftung\nnach dem Recht des Großherzogtums Luxemburg unter Firma Blitz LuxCo SARL mit Sitz in Luxemburg, Großherzogtum Luxemburg (Handels- und Gesellschaftsregister von Luxemburg (Registre de Commerce et des Societes de Luxembourg) unter der Nummer B216094 mit der Gesellschaft mit beschränkter Haftung nach deutschem Recht unter der Firma GERRESHEIMER GLAS GmbH mit Sitz in Düsseldorf (Amtsgericht Düsseldorf unter Nummer HRB 51238) eingereicht worden.\nDie Gesellschafterversammlung der GERRESHEIMER GLAS GmbH wird\nvoraussichtlich am 29. Oktober 2025 über die Zustimmung zu dem\nPlan für die grenzüberschreitende Verschmelzung beschließen.\nAnteilsinhaber und Gläubiger der an der grenzüberschreitenden\nVerschmelzung beteiligten Gesellschaften können der Gesellschaft\nbis spätestens fünf Arbeitstage vor dem Tag der Gesellschafterversammlung,\nalso bis zum Dienstag, den 22. Oktober 2025, 24:00 Uhr, Bemerkungen zum Verschmelzungsplan an die Geschäftsanschrift der Gesellschaft Peter-Müller-Straße 3, D-40468 Düsseldorf, oder per Email an\ntobias.bage@gerresheimer.com übermitteln. Bis zu demselben Termin\nkönnen an diese Adressen auch Bemerkungen zum Verschmelzungsplan\ndurch die Arbeitnehmer der GERRESHEIMER GLAS GmbH\nübermittelt werden."
    },
    {
      "date": "2025-09-23",
      "id": "131076",
      "original_text": "Registerbekanntmachung nach dem Umwandlungsgesetz\nNordrhein-Westfalen Amtsgericht Duisburg HRB 35170\nISOMAX Lagersysteme GmbH – Duisburg",
      "type": "Registerbekanntmachung nach dem Umwandlungsgesetz",
      "state": "Nordrhein-Westfalen",
      "amtsgericht": "Amtsgericht Duisburg",
      "registernummer": "HRB 35170",
      "registerart": "HRB",
      "company_name": "ISOMAX Lagersysteme GmbH",
      "company_seat": "Duisburg",
      "details": "23.09.2025 (Bekanntmachungsdatum)\n\nNordrhein-Westfalen Amtsgericht Duisburg HRB 35170\nRegisterbekanntmachung nach dem Umwandlungsgesetz 23.09.2025 (Eintragungsdatum)\n\nISOMAX Lagersysteme GmbH\nGesellschaft mit beschränkter Haftung\nDuisburg\n\nDie Gesellschaft hat Gläubigern, deren Forderungen vor dieser Bekanntmachung begründet worden sind, Sicherheit zu leisten, soweit sie nicht Befriedigung verlangen können, wenn sie sich binnen sechs Monaten zu diesem Zweck melden."
    },
    {
      "date": "2025-09-23",
      "id": "131077",
      "original_text": "Registerbekanntmachung nach dem Umwandlungsgesetz\nNordrhein-Westfalen Amtsgericht Duisburg HRB 36261\nRuhrCapital Invest GmbH – Mülheim an der Ruhr",
      "type": "Registerbekanntmachung nach dem Umwandlungsgesetz",
      "state": "Nordrhein-Westfalen",
      "amtsgericht": "Amtsgericht Duisburg",
      "registernummer": "HRB 36261",
      "registerart": "HRB",
      "company_name": "RuhrCapital Invest GmbH",
      "company_seat": "Mülheim an der Ruhr",
      "details": "23.09.2025 (Bekanntmachungsdatum)\n\nNordrhein-Westfalen Amtsgericht Duisburg HRB 36261\nRegisterbekanntmachung nach dem Umwandlungsgesetz 23.09.2025 (Eintragungsdatum)\n\nRuhrCapital Invest GmbH\nGesellschaft mit beschränkter Haftung\nMülheim an der Ruhr\n\nDie Gesellschaft hat Gläubigern, deren Forderungen vor dieser Bekanntmachung begründet worden sind, Sicherheit zu leisten, soweit sie nicht Befriedigung verlangen können, wenn sie sich binnen sechs Monaten zu diesem Zweck melden."
    },
    {
      "date": "2025-09-23",
      "id": "131078",
      "original_text": "Registerbekanntmachung nach dem Umwandlungsgesetz\nNordrhein-Westfalen Amtsgericht Köln HRA 38140\nYou Name It Management e.K. – Leverkusen",
      "type": "Registerbekanntmachung nach dem Umwandlungsgesetz",
      "state": "Nordrhein-Westfalen",
      "amtsgericht": "Amtsgericht Köln",
      "registernummer": "HRA 38140",
      "registerart": "HRA",
      "company_name": "You Name It Management e.K.",
      "company_seat": "Leverkusen",
      "details": "23.09.2025 (Bekanntmachungsdatum)\n\nNordrhein-Westfalen Amtsgericht Köln HRA 38140\nRegisterbekanntmachung nach dem Umwandlungsgesetz 23.09.2025 (Eintragungsdatum)\n\nYou Name It Management e.K.\nEinzelkaufmann / Einzelkauffrau\nLeverkusen\n\nDen Gläubigern der an der Ausgliederung beteiligten Rechtsträger ist, wenn sie binnen sechs Monaten nach dem Tag, an dem die Eintragung der Ausgliederung in das Register des Sitzes desjenigen Rechtsträgers, dessen Gläubiger sie sind, nach § 19 Absatz 3 UmwG als bekanntgemacht gilt, ihren Anspruch nach Grund und Höhe schriftlich anmelden, Sicherheit zu leisten, soweit sie nicht Befriedigung verlangen können. Dieses Recht steht den Gläubigern jedoch nur zu, wenn sie glaubhaft machen, dass durch die Ausgliederung die Erfüllung ihrer Forderung gefährdet wird."
    },
    {
      "date": "2025-09-23",
      "id": "131079",
      "original_text": "Löschungsankündigung\nNordrhein-Westfalen Amtsgericht Siegburg HRB 633\nSchlösser GmbH Anlagentechnik – Hennef",
      "type": "Löschungsankündigung",
      "state": "Nordrhein-Westfalen",
      "amtsgericht": "Amtsgericht Siegburg",
      "registernummer": "HRB 633",
      "registerart": "HRB",
      "company_name": "Schlösser GmbH Anlagentechnik",
      "company_seat": "Hennef",
      "details": "23.09.2025 (Bekanntmachungsdatum)\n\nNordrhein-Westfalen Amtsgericht Siegburg HRB 633\nLöschungsankündigung\n\nSchlösser GmbH Anlagentechnik\nGesellschaft mit beschränkter Haftung\nHennef\n\nDas Registergericht hat glaubhafte Kenntnis erlangt, dass die Gesellschaft vermögenslos geworden ist, da ein Insolvenzverfahren durchgeführt und nach § 200 InsO aufgehoben wurde.\n\nEs ist daher beabsichtigt, die Gesellschaft nach § 394 FamFG im Handelsregister wegen Vermögenslosigkeit zu löschen.\n\nEinwände gegen die Löschung sind durch Widerspruch binnen einer Frist von 3 Monaten geltend zu machen, andernfalls die Löschung erfolgen wird.\n\nEinzulegen ist der Widerspruch bei dem Amtsgericht Siegburg, Neue Poststraße 16, 53721 Siegburg, und zwar entweder schriftlich in deutscher Sprache oder mündlich zur Niederschrift der Geschäftsstelle. Der Widerspruch kann auch zur Niederschrift der Geschäftsstelle eines jeden Amtsgerichts abgegeben werden. Der Widerspruch ist binnen der in der Verfügung bestimmten Frist einzulegen. Die Frist ist nur gewahrt, wenn der Widerspruch rechtzeitig bei dem Amtsgericht Siegburg eingeht, auch wenn der Widerspruch zur Niederschrift der Geschäftsstelle eines anderen Amtsgerichts abgegeben wurde. Die Frist beginnt jeweils mit der schriftlichen Bekanntgabe der Verfügung an die Beteiligten. Kann die schriftliche Bekanntgabe an einen Beteiligten nicht bewirkt werden, beginnt die Frist spätestens mit Ablauf von fünf Monaten nach Erlass der Verfügung. Die Bekanntgabe ist entweder durch Zustellung oder am dritten Tage nach Aufgabe zur Post bewirkt. Sofern die Löschung noch nicht erfolgt ist, kann der Widerspruch auch noch nach Ablauf der Frist eingelegt werden. Fällt das Ende der Frist auf einen Sonnabend, einen Sonntag oder einen allgemeinen Feiertag, endet die Frist mit Ablauf des nächsten Werktages. Der Widerspruch ist zu unterzeichnen. Eine Begründung des Widerspruchs ist nicht vorgeschrieben."
    },
    {
      "date": "2025-09-23",
      "id": "131080",
      "original_text": "Registerbekanntmachung nach dem Umwandlungsgesetz\nNordrhein-Westfalen Amtsgericht Gelsenkirchen HRB 15611\nOstseestraße 18 Recklinghausen Vermögens Verwaltungs GmbH – Marl",
      "type": "Registerbekanntmachung nach dem Umwandlungsgesetz",
      "state": "Nordrhein-Westfalen",
      "amtsgericht": "Amtsgericht Gelsenkirchen",
      "registernummer": "HRB 15611",
      "registerart": "HRB",
      "company_name": "Ostseestraße 18 Recklinghausen Vermögens Verwaltungs GmbH",
      "company_seat": "Marl",
      "details": "23.09.2025 (Bekanntmachungsdatum)\n\nNordrhein-Westfalen Amtsgericht Gelsenkirchen HRB 15611\nRegisterbekanntmachung nach dem Umwandlungsgesetz 23.09.2025 (Eintragungsdatum)\n\nOstseestraße 18 Recklinghausen Vermögens Verwaltungs GmbH\nGesellschaft mit beschränkter Haftung\nMarl\n\nDen Gläubigern der an der Verschmelzung beteiligten Rechtsträger ist, wenn sie binnen sechs Monaten nach dem Tag, an dem die Eintragung der Verschmelzung in das Register des Sitzes derjenigen Rechtsträger deren Gläubiger sie sind, nach § 19 Absatz 3 UmwG als bekanntgemacht gilt, ihren Anspruch nach Grund und Höhe schriftlich anmelden, Sicherheit zu leisten, soweit sie nicht Befriedigung verlangen können. Dieses Recht steht den Gläubigern jedoch nur zu, wenn sie glaubhaft machen, dass durch die Verschmelzung die Erfüllung ihrer Forderung gefährdet wird."
    },
    {
      "date": "2025-09-23",
      "id": "131081",
      "original_text": "Registerbekanntmachung nach dem Umwandlungsgesetz\nNordrhein-Westfalen Amtsgericht Gelsenkirchen HRB 15621\nQuellberg 35 Recklinghausen Vermögens Verwaltungs GmbH – Marl",
      "type": "Registerbekanntmachung nach dem Umwandlungsgesetz",
      "state": "Nordrhein-Westfalen",
      "amtsgericht": "Amtsgericht Gelsenkirchen",
      "registernummer": "HRB 15621",
      "registerart": "HRB",
      "company_name": "Quellberg 35 Recklinghausen Vermögens Verwaltungs GmbH",
      "company_seat": "Marl",
      "details": "23.09.2025 (Bekanntmachungsdatum)\n\nNordrhein-Westfalen Amtsgericht Gelsenkirchen HRB 15621\nRegisterbekanntmachung nach dem Umwandlungsgesetz 23.09.2025 (Eintragungsdatum)\n\nQuellberg 35 Recklinghausen Vermögens Verwaltungs GmbH\nGesellschaft mit beschränkter Haftung\nMarl\n\nDen Gläubigern der an der Verschmelzung beteiligten Rechtsträger ist, wenn sie binnen sechs Monaten nach dem Tag, an dem die Eintragung der Verschmelzung in das Register des Sitzes derjenigen Rechtsträger deren Gläubiger sie sind, nach § 19 Absatz 3 UmwG als bekanntgemacht gilt, ihren Anspruch nach Grund und Höhe schriftlich anmelden, Sicherheit zu leisten, soweit sie nicht Befriedigung verlangen können. Dieses Recht steht den Gläubigern jedoch nur zu, wenn sie glaubhaft machen, dass durch die Verschmelzung die Erfüllung ihrer Forderung gefährdet wird."
    },
    {
      "date": "2025-09-23",
      "id": "131082",
      "original_text": "Löschungsankündigung\nNordrhein-Westfalen Amtsgericht Dortmund HRB 27157\n# 3 Gatter 3 Technik GmbH – Dortmund",
      "type": "Löschungsankündigung",
      "state": "Nordrhein-Westfalen",
      "amtsgericht": "Amtsgericht Dortmund",
      "registernummer": "HRB 27157",
      "registerart": "HRB",
      "company_name": "# 3 Gatter 3 Technik GmbH",
      "company_seat": "Dortmund",
      "details": "23.09.2025 (Bekanntmachungsdatum)\n\nNordrhein-Westfalen Amtsgericht Dortmund HRB 27157\nLöschungsankündigung 23.09.2025 (Eintragungsdatum)\n\n# 3 Gatter 3 Technik GmbH\nGesellschaft mit beschränkter Haftung\nDortmund\n\nDen Gläubigern der an der Verschmelzung beteiligten Rechtsträger ist, wenn sie binnen sechs Monaten nach dem Tag, an dem die Eintragung der Verschmelzung in das Register des Sitzes desjenigen Rechtsträgers, dessen Gläubiger sie sind, nach § 19 Absatz 3 UmwG als bekanntgemacht gilt, ihren Anspruch nach Grund und Höhe schriftlich anmelden, Sicherheit zu leisten, soweit sie nicht Befriedigung verlangen können. Dieses Recht steht den Gläubigern jedoch nur zu, wenn sie glaubhaft machen, dass durch die Verschmelzung die Erfüllung ihrer Forderung gefährdet wird."
    },
    {
      "date": "2025-09-23",
      "id": "131083",
      "original_text": "Registerbekanntmachung nach dem Umwandlungsgesetz\nNordrhein-Westfalen Amtsgericht Münster HRB 22023\nScholz Industrielackierungen GmbH – Münster",
      "type": "Registerbekanntmachung nach dem Umwandlungsgesetz",
      "state": "Nordrhein-Westfalen",
      "amtsgericht": "Amtsgericht Münster",
      "registernummer": "HRB 22023",
      "registerart": "HRB",
      "company_name": "Scholz Industrielackierungen GmbH",
      "company_seat": "Münster",
      "details": "23.09.2025 (Bekanntmachungsdatum)\n\nNordrhein-Westfalen Amtsgericht Münster HRB 22023\nRegisterbekanntmachung nach dem Umwandlungsgesetz 23.09.2025 (Eintragungsdatum)\n\nScholz Industrielackierungen GmbH\nGesellschaft mit beschränkter Haftung\nMünster\n\nDen Gläubigern der an der Verschmelzung beteiligten Rechtsträger ist, wenn sie binnen sechs Monaten nach dem Tag, an dem die Eintragung der Verschmelzung in das Register des Sitzes desjenigen Rechtsträgers, dessen Gläubiger sie sind, nach § 19 Absatz 3 UmwG als bekanntgemacht gilt, ihren Anspruch nach Grund und Höhe schriftlich anmelden, Sicherheit zu leisten, soweit sie nicht Befriedigung verlangen können. Dieses Recht steht den Gläubigern jedoch nur zu, wenn sie glaubhaft machen, dass durch die Verschmelzung die Erfüllung ihrer Forderung gefährdet wird."
    },
    {
      "date": "2025-09-23",
      "id": "131084",
      "original_text": "Löschungsankündigung\nNordrhein-Westfalen Amtsgericht Dortmund HRB 12222\nLIGO GmbH – Dortmund",
      "type": "Löschungsankündigung",
      "state": "Nordrhein-Westfalen",
      "amtsgericht": "Amtsgericht Dortmund",
      "registernummer": "HRB 12222",
      "registerart": "HRB",
      "company_name": "LIGO GmbH",
      "company_seat": "Dortmund",
      "details": "23.09.2025 (Bekanntmachungsdatum)\n\nNordrhein-Westfalen Amtsgericht Dortmund HRB 12222\nLöschungsankündigung 23.09.2025 (Eintragungsdatum)\n\nLIGO GmbH\nGesellschaft mit beschränkter Haftung\nDortmund\n\nDen Gläubigern der an der Verschmelzung beteiligten Rechtsträger ist, wenn sie binnen sechs Monaten nach dem Tag, an dem die Eintragung der Verschmelzung in das Register des Sitzes desjenigen Rechtsträgers, dessen Gläubiger sie sind, nach § 19 Absatz 3 UmwG als bekanntgemacht gilt, ihren Anspruch nach Grund und Höhe schriftlich anmelden, Sicherheit zu leisten, soweit sie nicht Befriedigung verlangen können. Dieses Recht steht den Gläubigern jedoch nur zu, wenn sie glaubhaft machen, dass durch die Verschmelzung die Erfüllung ihrer Forderung gefährdet wird."
    },
    {
      "date": "2025-09-23",
      "id": "131085",
      "original_text": "Registerbekanntmachung nach dem Umwandlungsgesetz\nNordrhein-Westfalen Amtsgericht Bochum HRB 22646\nDach Schellenbach GmbH – Bochum",
      "type": "Registerbekanntmachung nach dem Umwandlungsgesetz",
      "state": "Nordrhein-Westfalen",
      "amtsgericht": "Amtsgericht Bochum",
      "registernummer": "HRB 22646",
      "registerart": "HRB",
      "company_name": "Dach Schellenbach GmbH",
      "company_seat": "Bochum",
      "details": "23.09.2025 (Bekanntmachungsdatum)\n\nNordrhein-Westfalen Amtsgericht Bochum HRB 22646\nRegisterbekanntmachung nach dem Umwandlungsgesetz 23.09.2025 (Eintragungsdatum)\n\nDach Schellenbach GmbH\nGesellschaft mit beschränkter Haftung\nBochum\n\nDen Gläubigern der an der Ausgliederung beteiligten Rechtsträger ist, wenn sie binnen sechs Monaten nach dem Tag, an dem die Eintragung der Ausgliederung in das Register des Sitzes desjenigen Rechtsträgers, dessen Gläubiger sie sind, nach § 19 Absatz 3 UmwG als bekanntgemacht gilt, ihren Anspruch nach Grund und Höhe schriftlich anmelden, Sicherheit zu leisten, soweit sie nicht Befriedigung verlangen können. Dieses Recht steht den Gläubigern jedoch nur zu, wenn sie glaubhaft machen, dass durch die Ausgliederung die Erfüllung ihrer Forderung gefährdet wird."
    },
    {
      "date": "2025-09-23",
      "id": "131086",
      "original_text": "Registerbekanntmachung nach dem Umwandlungsgesetz\nNordrhein-Westfalen Amtsgericht Gelsenkirchen HRB 18838\nMerlin Digital GmbH – Bottrop",
      "type": "Registerbekanntmachung nach dem Umwandlungsgesetz",
      "state": "Nordrhein-Westfalen",
      "amtsgericht": "Amtsgericht Gelsenkirchen",
      "registernummer": "HRB 18838",
      "registerart": "HRB",
      "company_name": "Merlin Digital GmbH",
      "company_seat": "Bottrop",
      "details": "23.09.2025 (Bekanntmachungsdatum)\n\nNordrhein-Westfalen Amtsgericht Gelsenkirchen HRB 18838\nRegisterbekanntmachung nach dem Umwandlungsgesetz 23.09.2025 (Eintragungsdatum)\n\nMerlin Digital GmbH\nGesellschaft mit beschränkter Haftung\nBottrop\n\nDen Gläubigern der an der Verschmelzung beteiligten Rechtsträger ist, wenn sie binnen sechs Monaten nach dem Tag, an dem die Eintragung der Verschmelzung in das Register des Sitzes desjenigen Rechtsträgers, dessen Gläubiger sie sind, nach § 19 Absatz 3 UmwG als bekanntgemacht gilt, ihren Anspruch nach Grund und Höhe schriftlich anmelden, Sicherheit zu leisten, soweit sie nicht Befriedigung verlangen können. Dieses Recht steht den Gläubigern jedoch nur zu, wenn sie glaubhaft machen, dass durch die Verschmelzung die Erfüllung ihrer Forderung gefährdet wird."
    },
    {
      "date": "2025-09-23",
      "id": "131087",
      "original_text": "Registerbekanntmachung nach dem Umwandlungsgesetz\nNordrhein-Westfalen Amtsgericht Bochum HRB 22655\nSperling Bags GmbH – Bochum",
      "type": "Registerbekanntmachung nach dem Umwandlungsgesetz",
      "state": "Nordrhein-Westfalen",
      "amtsgericht": "Amtsgericht Bochum",
      "registernummer": "HRB 22655",
      "registerart": "HRB",
      "company_name": "Sperling Bags GmbH",
      "company_seat": "Bochum",
      "details": "23.09.2025 (Bekanntmachungsdatum)\n\nNordrhein-Westfalen Amtsgericht Bochum HRB 22655\nRegisterbekanntmachung nach dem Umwandlungsgesetz 22.09.2025 (Eintragungsdatum)\n\nSperling Bags GmbH\nGesellschaft mit beschränkter Haftung\nBochum\n\nDen Gläubigern der an der Ausgliederung beteiligten Rechtsträger ist, wenn sie binnen sechs Monaten nach dem Tag, an dem die Eintragung der Ausgliederung in das Register des Sitzes derjenigen Rechtsträger deren Gläubiger sie sind, nach § 19 Absatz 3 UmwG als bekanntgemacht gilt, ihren Anspruch nach Grund und Höhe schriftlich anmelden, Sicherheit zu leisten, soweit sie nicht Befriedigung verlangen können. Dieses Recht steht den Gläubigern jedoch nur zu, wenn sie glaubhaft machen, dass durch die Ausgliederung die Erfüllung ihrer Forderung gefährdet wird."
    },
    {
      "date": "2025-09-23",
      "id": "131088",
      "original_text": "Registerbekanntmachung nach dem Umwandlungsgesetz\nNordrhein-Westfalen Amtsgericht Bad Oeynhausen HRB 15729\nSanAgil Sanitätshaus GmbH – Minden",
      "type": "Registerbekanntmachung nach dem Umwandlungsgesetz",
      "state": "Nordrhein-Westfalen",
      "amtsgericht": "Amtsgericht Bad Oeynhausen",
      "registernummer": "HRB 15729",
      "registerart": "HRB",
      "company_name": "SanAgil Sanitätshaus GmbH",
      "company_seat": "Minden",
      "details": "23.09.2025 (Bekanntmachungsdatum)\n\nNordrhein-Westfalen Amtsgericht Bad Oeynhausen HRB 15729\nRegisterbekanntmachung nach dem Umwandlungsgesetz 23.09.2025 (Eintragungsdatum)\n\nSanAgil Sanitätshaus GmbH\nGesellschaft mit beschränkter Haftung\nMinden\n\nDen Gläubigern der an der Ausgliederung beteiligten Rechtsträger ist, wenn sie binnen sechs Monaten nach dem Tag, an dem die Eintragung der Ausgliederung in das Register des Sitzes desjenigen Rechtsträgers, dessen Gläubiger sie sind, nach § 19 Absatz 3 UmwG als bekanntgemacht gilt, ihren Anspruch nach Grund und Höhe schriftlich anmelden, Sicherheit zu leisten, soweit sie nicht Befriedigung verlangen können. Dieses Recht steht den Gläubigern jedoch nur zu, wenn sie glaubhaft machen, dass durch die Ausgliederung die Erfüllung ihrer Forderung gefährdet wird."
    },
    {
      "date": "2025-09-23",
      "id": "131089",
      "original_text": "Löschungsankündigung\nNordrhein-Westfalen Amtsgericht Siegburg HRB 11089\nDML Solution GmbH – Morsbach - Wallerhausen",
      "type": "Löschungsankündigung",
      "state": "Nordrhein-Westfalen",
      "amtsgericht": "Amtsgericht Siegburg",
      "registernummer": "HRB 11089",
      "registerart": "HRB",
      "company_name": "DML Solution GmbH",
      "company_seat": "Morsbach - Wallerhausen",
      "details": "23.09.2025 (Bekanntmachungsdatum)\n\nNordrhein-Westfalen Amtsgericht Siegburg HRB 11089\nLöschungsankündigung\n\nDML Solution GmbH\nGesellschaft mit beschränkter Haftung\nMorsbach - Wallerhausen\n\nDas Registergericht hat glaubhafte Kenntnis erlangt, dass die Gesellschaft vermögenslos geworden ist.\n\nEs ist daher beabsichtigt, die Gesellschaft nach § 394 FamFG im Handelsregister wegen Vermögenslosigkeit zu löschen.\n\nEinwände gegen die Löschung sind durch Widerspruch binnen einer Frist von 3 Monaten geltend zu machen, andernfalls die Löschung erfolgen wird.\n\nEinzulegen ist der Widerspruch bei dem Amtsgericht Siegburg, Neue Poststraße 16, 53721 Siegburg, und zwar entweder schriftlich in deutscher Sprache oder mündlich zur Niederschrift der Geschäftsstelle. Der Widerspruch kann auch zur Niederschrift der Geschäftsstelle eines jeden Amtsgerichts abgegeben werden. Der Widerspruch ist binnen der in der Verfügung bestimmten Frist einzulegen. Die Frist ist nur gewahrt, wenn der Widerspruch rechtzeitig bei dem Amtsgericht Siegburg eingeht, auch wenn der Widerspruch zur Niederschrift der Geschäftsstelle eines anderen Amtsgerichts abgegeben wurde. Die Frist beginnt jeweils mit der schriftlichen Bekanntgabe der Verfügung an die Beteiligten. Kann die schriftliche Bekanntgabe an einen Beteiligten nicht bewirkt werden, beginnt die Frist spätestens mit Ablauf von fünf Monaten nach Erlass der Verfügung. Die Bekanntgabe ist entweder durch Zustellung oder am dritten Tage nach Aufgabe zur Post bewirkt. Sofern die Löschung noch nicht erfolgt ist, kann der Widerspruch auch noch nach Ablauf der Frist eingelegt werden. Fällt das Ende der Frist auf einen Sonnabend, einen Sonntag oder einen allgemeinen Feiertag, endet die Frist mit Ablauf des nächsten Werktages. Der Widerspruch ist zu unterzeichnen. Eine Begründung des Widerspruchs ist nicht vorgeschrieben."
    },
    {
      "date": "2025-09-23",
      "id": "131090",
      "original_text": "Registerbekanntmachung nach dem Umwandlungsgesetz\nNordrhein-Westfalen Amtsgericht Siegburg HRB 6594\nun-be-ze EDV-Beratungsgesellschaft mbH – Much",
      "type": "Registerbekanntmachung nach dem Umwandlungsgesetz",
      "state": "Nordrhein-Westfalen",
      "amtsgericht": "Amtsgericht Siegburg",
      "registernummer": "HRB 6594",
      "registerart": "HRB",
      "company_name": "un-be-ze EDV-Beratungsgesellschaft mbH",
      "company_seat": "Much",
      "details": "23.09.2025 (Bekanntmachungsdatum)\n\nNordrhein-Westfalen Amtsgericht Siegburg HRB 6594\nRegisterbekanntmachung nach dem Umwandlungsgesetz 23.09.2025 (Eintragungsdatum)\n\nun-be-ze EDV-Beratungsgesellschaft mbH\nGesellschaft mit beschränkter Haftung\nMuch\n\nDen Gläubigern der an der Verschmelzung beteiligten Rechtsträger ist, wenn sie binnen sechs Monaten nach dem Tag, an dem die Eintragung der Verschmelzung in das Register des Sitzes desjenigen Rechtsträgers, dessen Gläubiger sie sind, nach § 19 Absatz 3 UmwG als bekanntgemacht gilt, ihren Anspruch nach Grund und Höhe schriftlich anmelden, Sicherheit zu leisten, soweit sie nicht Befriedigung verlangen können. Dieses Recht steht den Gläubigern jedoch nur zu, wenn sie glaubhaft machen, dass durch die Verschmelzung die Erfüllung ihrer Forderung gefährdet wird."
    },
    {
      "date": "2025-09-23",
      "id": "131091",
      "original_text": "Registerbekanntmachung nach dem Umwandlungsgesetz\nNordrhein-Westfalen Amtsgericht Köln HRB 54696\nadhoc4acp - GmbH – Köln",
      "type": "Registerbekanntmachung nach dem Umwandlungsgesetz",
      "state": "Nordrhein-Westfalen",
      "amtsgericht": "Amtsgericht Köln",
      "registernummer": "HRB 54696",
      "registerart": "HRB",
      "company_name": "adhoc4acp - GmbH",
      "company_seat": "Köln",
      "details": "23.09.2025 (Bekanntmachungsdatum)\n\nNordrhein-Westfalen Amtsgericht Köln HRB 54696\nRegisterbekanntmachung nach dem Umwandlungsgesetz 23.09.2025 (Eintragungsdatum)\n\nadhoc4acp - GmbH\nGesellschaft mit beschränkter Haftung\nKöln\n\nDen Gläubigern der an der Verschmelzung beteiligten Rechtsträger ist, wenn sie binnen sechs Monaten nach dem Tag, an dem die Eintragung der Verschmelzung in das Register des Sitzes desjenigen Rechtsträgers, dessen Gläubiger sie sind, nach § 19 Absatz 3 UmwG als bekanntgemacht gilt, ihren Anspruch nach Grund und Höhe schriftlich anmelden, Sicherheit zu leisten, soweit sie nicht Befriedigung verlangen können. Dieses Recht steht den Gläubigern jedoch nur zu, wenn sie glaubhaft machen, dass durch die Verschmelzung die Erfüllung ihrer Forderung gefährdet wird."
    },
    {
      "date": "2025-09-23",
      "id": "131092",
      "original_text": "Registerbekanntmachung nach dem Umwandlungsgesetz\nNordrhein-Westfalen Amtsgericht Gelsenkirchen HRB 19309\nNLL-Vermögensverwaltungs GmbH – Gelsenkirchen",
      "type": "Registerbekanntmachung nach dem Umwandlungsgesetz",
      "state": "Nordrhein-Westfalen",
      "amtsgericht": "Amtsgericht Gelsenkirchen",
      "registernummer": "HRB 19309",
      "registerart": "HRB",
      "company_name": "NLL-Vermögensverwaltungs GmbH",
      "company_seat": "Gelsenkirchen",
      "details": "23.09.2025 (Bekanntmachungsdatum)\n\nNordrhein-Westfalen Amtsgericht Gelsenkirchen HRB 19309\nRegisterbekanntmachung nach dem Umwandlungsgesetz 23.09.2025 (Eintragungsdatum)\n\nNLL-Vermögensverwaltungs GmbH\nGesellschaft mit beschränkter Haftung\nGelsenkirchen\n\nDen Gläubigern der an der Abspaltung beteiligten Rechtsträger ist, wenn sie binnen sechs Monaten nach dem Tag, an dem die Eintragung der Abspaltung in das Register des Sitzes desjenigen Rechtsträgers, dessen Gläubiger sie sind, nach § 19 Absatz 3 UmwG als bekanntgemacht gilt, ihren Anspruch nach Grund und Höhe schriftlich anmelden, Sicherheit zu leisten, soweit sie nicht Befriedigung verlangen können. Dieses Recht steht den Gläubigern jedoch nur zu, wenn sie glaubhaft machen, dass durch die Abspaltung die Erfüllung ihrer Forderung gefährdet wird."
    },
    {
      "date": "2025-09-23",
      "id": "131093",
      "original_text": "Registerbekanntmachung nach dem Umwandlungsgesetz\nNordrhein-Westfalen Amtsgericht Paderborn HRB 15426\nRB - Vertrieb West GmbH – Salzkotten",
      "type": "Registerbekanntmachung nach dem Umwandlungsgesetz",
      "state": "Nordrhein-Westfalen",
      "amtsgericht": "Amtsgericht Paderborn",
      "registernummer": "HRB 15426",
      "registerart": "HRB",
      "company_name": "RB - Vertrieb West GmbH",
      "company_seat": "Salzkotten",
      "details": "23.09.2025 (Bekanntmachungsdatum)\n\nNordrhein-Westfalen Amtsgericht Paderborn HRB 15426\nRegisterbekanntmachung nach dem Umwandlungsgesetz 23.09.2025 (Eintragungsdatum)\n\nRB - Vertrieb West GmbH\nGesellschaft mit beschränkter Haftung\nSalzkotten\n\nDie Gesellschaft hat Gläubigern, deren Forderungen vor dieser Bekanntmachung begründet worden sind, Sicherheit zu leisten, soweit sie nicht Befriedigung verlangen können, wenn sie sich binnen sechs Monaten zu diesem Zweck melden."
    },
    {
      "date": "2025-09-23",
      "id": "131094",
      "original_text": "Registerbekanntmachung nach dem Umwandlungsgesetz\nThüringen Amtsgericht Jena HRA 507171\nBestattungs-Institut Holger Reinhold e.K. – Zeulenroda-Triebes",
      "type": "Registerbekanntmachung nach dem Umwandlungsgesetz",
      "state": "Thüringen",
      "amtsgericht": "Amtsgericht Jena",
      "registernummer": "HRA 507171",
      "registerart": "HRA",
      "company_name": "Bestattungs-Institut Holger Reinhold e.K.",
      "company_seat": "Zeulenroda-Triebes",
      "details": "23.09.2025 (Bekanntmachungsdatum)\n\nThüringen Amtsgericht Jena HRA 507171\nRegisterbekanntmachung nach dem Umwandlungsgesetz 23.09.2025 (Eintragungsdatum)\n\nBestattungs-Institut Holger Reinhold e.K.\nEinzelkaufmann / Einzelkauffrau\nZeulenroda-Triebes\n\nNicht eingetragen: Den Gläubigern der an der Ausgliederung beteiligten Rechtsträger, ist wenn sie binnen sechs Monaten nach dem Tag, an dem die Eintragung der Ausgliederung in das Register des Sitzes desjenigen Rechtsträgers, dessen Gläubiger sie sind, nach §§125, 19 Abs. 3 UmwG als bekanntgemacht gilt, ihren Anspruch nach Grund und Höhe schriftlich anmelden, Sicherheit zu leisten, soweit sie nicht Befriedigung verlangen können. Dieses Recht steht ihnen jedoch nur zu, wenn sie glaubhaft machen, daß durch die Ausgliederung die Erfüllung ihrer Forderung gefährdet wird."
    },
    {
      "date": "2025-09-23",
      "id": "131095",
      "original_text": "Registerbekanntmachung nach dem Umwandlungsgesetz\nThüringen Amtsgericht Jena HRB 503245\nRALU Haustechnik GmbH – Zeulenroda-Triebes",
      "type": "Registerbekanntmachung nach dem Umwandlungsgesetz",
      "state": "Thüringen",
      "amtsgericht": "Amtsgericht Jena",
      "registernummer": "HRB 503245",
      "registerart": "HRB",
      "company_name": "RALU Haustechnik GmbH",
      "company_seat": "Zeulenroda-Triebes",
      "details": "23.09.2025 (Bekanntmachungsdatum)\n\nThüringen Amtsgericht Jena HRB 503245\nRegisterbekanntmachung nach dem Umwandlungsgesetz 23.09.2025 (Eintragungsdatum)\n\nRALU Haustechnik GmbH\nGesellschaft mit beschränkter Haftung\nZeulenroda-Triebes\n\nNicht eingetragen: Den Gläubigern der an der Verschmelzung beteiligten Rechtsträger, ist wenn sie binnen sechs Monaten nach dem Tag, an dem die Eintragung der Verschmelzung in das Register des Sitzes desjenigen Rechtsträgers, dessen Gläubiger sie sind,  nach § 19 Abs. 3 UmwG als bekanntgemacht gilt, ihren Anspruch nach Grund und Höhe schriftlich anmelden, Sicherheit zu leisten, soweit sie nicht Befriedigung verlangen können. Dieses Recht steht ihnen jedoch nur zu, wenn sie glaubhaft machen, daß durch die Verschmelzung die Erfüllung ihrer Forderung gefährdet wird."
    },
    {
      "date": "2025-09-23",
      "id": "131096",
      "original_text": "Registerbekanntmachung nach dem Umwandlungsgesetz\nThüringen Amtsgericht Jena HRB 523712\nBestattungs-Institut Holger Reinhold GmbH – Zeulenroda-Triebes",
      "type": "Registerbekanntmachung nach dem Umwandlungsgesetz",
      "state": "Thüringen",
      "amtsgericht": "Amtsgericht Jena",
      "registernummer": "HRB 523712",
      "registerart": "HRB",
      "company_name": "Bestattungs-Institut Holger Reinhold GmbH",
      "company_seat": "Zeulenroda-Triebes",
      "details": "23.09.2025 (Bekanntmachungsdatum)\n\nThüringen Amtsgericht Jena HRB 523712\nRegisterbekanntmachung nach dem Umwandlungsgesetz 23.09.2025 (Eintragungsdatum)\n\nBestattungs-Institut Holger Reinhold GmbH\nGesellschaft mit beschränkter Haftung\nZeulenroda-Triebes\n\nNicht eingetragen: Den Gläubigern der an der Ausgliederung beteiligten Rechtsträger, ist wenn sie binnen sechs Monaten nach dem Tag, an dem die Eintragung der Ausgliederung in das Register des Sitzes desjenigen Rechtsträgers, dessen Gläubiger sie sind, nach §§125, 19 Abs. 3 UmwG als bekanntgemacht gilt, ihren Anspruch nach Grund und Höhe schriftlich anmelden, Sicherheit zu leisten, soweit sie nicht Befriedigung verlangen können. Dieses Recht steht ihnen jedoch nur zu, wenn sie glaubhaft machen, daß durch die Ausgliederung die Erfüllung ihrer Forderung gefährdet wird."
    },
    {
      "date": "2025-09-23",
      "id": "131097",
      "original_text": "Registerbekanntmachung nach dem Umwandlungsgesetz\nThüringen Amtsgericht Jena HRB 502652\nHosch schwerlastconcept GmbH – Zella-Mehlis",
      "type": "Registerbekanntmachung nach dem Umwandlungsgesetz",
      "state": "Thüringen",
      "amtsgericht": "Amtsgericht Jena",
      "registernummer": "HRB 502652",
      "registerart": "HRB",
      "company_name": "Hosch schwerlastconcept GmbH",
      "company_seat": "Zella-Mehlis",
      "details": "23.09.2025 (Bekanntmachungsdatum)\n\nThüringen Amtsgericht Jena HRB 502652\nRegisterbekanntmachung nach dem Umwandlungsgesetz 23.09.2025 (Eintragungsdatum)\n\nHosch schwerlastconcept GmbH\nGesellschaft mit beschränkter Haftung\nZella-Mehlis\n\nDie H&K Logistik GmbH mit dem Sitz in Zella-Mehlis (Amtsgericht Jena HRB 508736) ist auf Grund des Verschmelzungsvertrages vom 04.08.2025 und der Beschlüsse der Gesellschafterversammlungen vom selben Tag mit der Gesellschaft verschmolzen. Tag der Eintragung: 23.09.2025\nNicht eingetragen: Den Gläubigern der an der Verschmelzung beteiligten Rechtsträger, ist wenn sie binnen sechs Monaten nach dem Tag, an dem die Eintragung der Verschmelzung in das Register des Sitzes desjenigen Rechtsträgers, dessen Gläubiger sie sind,  nach § 19 Abs. 3 UmwG als bekanntgemacht gilt, ihren Anspruch nach Grund und Höhe schriftlich anmelden, Sicherheit zu leisten, soweit sie nicht Befriedigung verlangen können. Dieses Recht steht ihnen jedoch nur zu, wenn sie glaubhaft machen, daß durch die Verschmelzung die Erfüllung ihrer Forderung gefährdet wird."
    },
    {
      "date": "2025-09-23",
      "id": "131098",
      "original_text": "Registerbekanntmachung nach dem Umwandlungsgesetz\nThüringen Amtsgericht Jena HRA 200503\nPRO-TEC Deutschland Werner Urban e.K. – Probstzella",
      "type": "Registerbekanntmachung nach dem Umwandlungsgesetz",
      "state": "Thüringen",
      "amtsgericht": "Amtsgericht Jena",
      "registernummer": "HRA 200503",
      "registerart": "HRA",
      "company_name": "PRO-TEC Deutschland Werner Urban e.K.",
      "company_seat": "Probstzella",
      "details": "23.09.2025 (Bekanntmachungsdatum)\n\nThüringen Amtsgericht Jena HRA 200503\nRegisterbekanntmachung nach dem Umwandlungsgesetz 23.09.2025 (Eintragungsdatum)\n\nPRO-TEC Deutschland Werner Urban e.K.\nEinzelkaufmann / Einzelkauffrau\nProbstzella\n\nNicht eingetragen: Den Gläubigern der an der Ausgliederung beteiligten Rechtsträger, ist wenn sie binnen sechs Monaten nach dem Tag, an dem die Eintragung der Ausgliederung in das Register des Sitzes desjenigen Rechtsträgers, dessen Gläubiger sie sind, nach §§125, 19 Abs. 3 UmwG als bekanntgemacht gilt, ihren Anspruch nach Grund und Höhe schriftlich anmelden, Sicherheit zu leisten, soweit sie nicht Befriedigung verlangen können. Dieses Recht steht ihnen jedoch nur zu, wenn sie glaubhaft machen, daß durch die Ausgliederung die Erfüllung ihrer Forderung gefährdet wird."
    },
    {
      "date": "2025-09-23",
      "id": "131099",
      "original_text": "Registerbekanntmachung nach dem Umwandlungsgesetz\nThüringen Amtsgericht Jena HRB 516376\nRALU GmbH – Zeulenroda-Triebes",
      "type": "Registerbekanntmachung nach dem Umwandlungsgesetz",
      "state": "Thüringen",
      "amtsgericht": "Amtsgericht Jena",
      "registernummer": "HRB 516376",
      "registerart": "HRB",
      "company_name": "RALU GmbH",
      "company_seat": "Zeulenroda-Triebes",
      "details": "23.09.2025 (Bekanntmachungsdatum)\n\nThüringen Amtsgericht Jena HRB 516376\nRegisterbekanntmachung nach dem Umwandlungsgesetz 23.09.2025 (Eintragungsdatum)\n\nRALU GmbH\nGesellschaft mit beschränkter Haftung\nZeulenroda-Triebes\n\nNicht eingetragen: Den Gläubigern der an der Verschmelzung beteiligten Rechtsträger, ist wenn sie binnen sechs Monaten nach dem Tag, an dem die Eintragung der Verschmelzung in das Register des Sitzes desjenigen Rechtsträgers, dessen Gläubiger sie sind,  nach § 19 Abs. 3 UmwG als bekanntgemacht gilt, ihren Anspruch nach Grund und Höhe schriftlich anmelden, Sicherheit zu leisten, soweit sie nicht Befriedigung verlangen können. Dieses Recht steht ihnen jedoch nur zu, wenn sie glaubhaft machen, daß durch die Verschmelzung die Erfüllung ihrer Forderung gefährdet wird."
    },
    {
      "date": "2025-09-23",
      "id": "131100",
      "original_text": "Registerbekanntmachung nach dem Umwandlungsgesetz\nThüringen Amtsgericht Jena HRB 508736\nH&K Logistik GmbH – Zella-Mehlis",
      "type": "Registerbekanntmachung nach dem Umwandlungsgesetz",
      "state": "Thüringen",
      "amtsgericht": "Amtsgericht Jena",
      "registernummer": "HRB 508736",
      "registerart": "HRB",
      "company_name": "H&K Logistik GmbH",
      "company_seat": "Zella-Mehlis",
      "details": "23.09.2025 (Bekanntmachungsdatum)\n\nThüringen Amtsgericht Jena HRB 508736\nRegisterbekanntmachung nach dem Umwandlungsgesetz 23.09.2025 (Eintragungsdatum)\n\nH&K Logistik GmbH\nGesellschaft mit beschränkter Haftung\nZella-Mehlis\n\nDie Gesellschaft ist auf Grund des Verschmelzungsvertrages vom 04.08.2025 sowie der Beschlüsse der Gesellschafterversammlungen vom selben Tag mit der Hosch schwerlastconcept GmbH mit dem Sitz in Zehla-Mehlis (Amtsgericht Jena HRB 502652) verschmolzen. Die Verschmelzung ist mit der gleichzeitigen Eintragung der Verschmelzung in das Handelsregister der übernehmenden Gesellschaft  wirksam geworden.Tag der Eintragung:23.09.2025\nNicht eingetragen: Den Gläubigern der an der Verschmelzung beteiligten Rechtsträger, ist wenn sie binnen sechs Monaten nach dem Tag, an dem die Eintragung der Verschmelzung in das Register des Sitzes desjenigen Rechtsträgers, dessen Gläubiger sie sind,  nach § 19 Abs. 3 UmwG als bekanntgemacht gilt, ihren Anspruch nach Grund und Höhe schriftlich anmelden, Sicherheit zu leisten, soweit sie nicht Befriedigung verlangen können. Dieses Recht steht ihnen jedoch nur zu, wenn sie glaubhaft machen, daß durch die Verschmelzung die Erfüllung ihrer Forderung gefährdet wird."
    },
    {
      "date": "2025-09-23",
      "id": "131101",
      "original_text": "Registerbekanntmachung nach dem Umwandlungsgesetz\nThüringen Amtsgericht Jena HRA 507115\nbluechemGROUP Holding GmbH & Co. KG – Probstzella",
      "type": "Registerbekanntmachung nach dem Umwandlungsgesetz",
      "state": "Thüringen",
      "amtsgericht": "Amtsgericht Jena",
      "registernummer": "HRA 507115",
      "registerart": "HRA",
      "company_name": "bluechemGROUP Holding GmbH & Co. KG",
      "company_seat": "Probstzella",
      "details": "23.09.2025 (Bekanntmachungsdatum)\n\nThüringen Amtsgericht Jena HRA 507115\nRegisterbekanntmachung nach dem Umwandlungsgesetz 23.09.2025 (Eintragungsdatum)\n\nbluechemGROUP Holding GmbH & Co. KG\nKommanditgesellschaft\nProbstzella\n\nNicht eingetragen: Den Gläubigern der an der Ausgliederung beteiligten Rechtsträger, ist wenn sie binnen sechs Monaten nach dem Tag, an dem die Eintragung der Ausgliederung in das Register des Sitzes desjenigen Rechtsträgers, dessen Gläubiger sie sind, nach §§125, 19 Abs. 3 UmwG als bekanntgemacht gilt, ihren Anspruch nach Grund und Höhe schriftlich anmelden, Sicherheit zu leisten, soweit sie nicht Befriedigung verlangen können. Dieses Recht steht ihnen jedoch nur zu, wenn sie glaubhaft machen, daß durch die Ausgliederung die Erfüllung ihrer Forderung gefährdet wird."
    },
    {
      "date": "2025-09-23",
      "id": "131102",
      "original_text": "Registerbekanntmachung nach dem Umwandlungsgesetz\nHessen Amtsgericht Frankfurt am Main HRB 109678\nMorgan Stanley Europe Holding SE – Frankfurt am Main",
      "type": "Registerbekanntmachung nach dem Umwandlungsgesetz",
      "state": "Hessen",
      "amtsgericht": "Amtsgericht Frankfurt am Main",
      "registernummer": "HRB 109678",
      "registerart": "HRB",
      "company_name": "Morgan Stanley Europe Holding SE",
      "company_seat": "Frankfurt am Main",
      "details": "23.09.2025 (Bekanntmachungsdatum)\n\nHessen Amtsgericht Frankfurt am Main HRB 109678\nRegisterbekanntmachung nach dem Umwandlungsgesetz 23.09.2025 (Eintragungsdatum)\n\nMorgan Stanley Europe Holding SE\nEuropäische Aktiengesellschaft (SE)\nFrankfurt am Main\n\nDen Gläubigern der an der Verschmelzung beteiligten Rechtsträger ist, wenn sie binnen sechs Monaten nach dem Tag, an dem die Eintragung der Verschmelzung in das Register des Sitzes desjenigen Rechtsträgers, dessen Gläubiger sie sind, nach § 19 Absatz 3 UmwG bekannt gemacht worden ist, ihren Anspruch nach Grund und Höhe schriftlich anmelden, Sicherheit zu leisten, soweit sie nicht Befriedigung verlangen können. Dieses Recht steht den Gläubigern jedoch nur zu, wenn sie glaubhaft machen, dass durch die Verschmelzung die Erfüllung ihrer Forderung gefährdet wird."
    },
    {
      "date": "2025-09-23",
      "id": "131103",
      "original_text": "Registerbekanntmachung nach dem Umwandlungsgesetz\nHessen Amtsgericht Fulda HRB 7895\nSchritt ins Leben - das ACT Peer Programm UG (haftungsbeschränkt) – Petersberg",
      "type": "Registerbekanntmachung nach dem Umwandlungsgesetz",
      "state": "Hessen",
      "amtsgericht": "Amtsgericht Fulda",
      "registernummer": "HRB 7895",
      "registerart": "HRB",
      "company_name": "Schritt ins Leben - das ACT Peer Programm UG (haftungsbeschränkt)",
      "company_seat": "Petersberg",
      "details": "23.09.2025 (Bekanntmachungsdatum)\n\nHessen Amtsgericht Fulda HRB 7895\nRegisterbekanntmachung nach dem Umwandlungsgesetz 23.09.2025 (Eintragungsdatum)\n\nSchritt ins Leben - das ACT Peer Programm UG (haftungsbeschränkt)\nGesellschaft mit beschränkter Haftung\nPetersberg\n\nDen Gläubigern der an der Verschmelzung beteiligten Rechtsträger ist, wenn sie binnen sechs Monaten nach dem Tag, an dem die Eintragung der Verschmelzung in das Register des Sitzes desjenigen Rechtsträgers, dessen Gläubiger sie sind, nach § 19 Absatz 3 UmwG bekannt gemacht worden ist, ihren Anspruch nach Grund und Höhe schriftlich anmelden, Sicherheit zu leisten, soweit sie nicht Befriedigung verlangen können. Dieses Recht steht den Gläubigern jedoch nur zu, wenn sie glaubhaft machen, dass durch die Verschmelzung die Erfüllung ihrer Forderung gefährdet wird."
    },
    {
      "date": "2025-09-23",
      "id": "131104",
      "original_text": "Registerbekanntmachung nach dem Umwandlungsgesetz\nHessen Amtsgericht Offenbach am Main HRB 23412\nAriston-Nord-West-Ring Schuh GmbH – Mainhausen",
      "type": "Registerbekanntmachung nach dem Umwandlungsgesetz",
      "state": "Hessen",
      "amtsgericht": "Amtsgericht Offenbach am Main",
      "registernummer": "HRB 23412",
      "registerart": "HRB",
      "company_name": "Ariston-Nord-West-Ring Schuh GmbH",
      "company_seat": "Mainhausen",
      "details": "23.09.2025 (Bekanntmachungsdatum)\n\nHessen Amtsgericht Offenbach am Main HRB 23412\nRegisterbekanntmachung nach dem Umwandlungsgesetz 23.09.2025 (Eintragungsdatum)\n\nAriston-Nord-West-Ring Schuh GmbH\nGesellschaft mit beschränkter Haftung\nMainhausen\n\nDen Gläubigern der an der Verschmelzung beteiligten Rechtsträger ist, wenn sie binnen sechs Monaten nach dem Tag, an dem die Eintragung der Verschmelzung in das Register des Sitzes desjenigen Rechtsträgers, dessen Gläubiger sie sind, nach § 19 Absatz 3 UmwG bekannt gemacht worden ist, ihren Anspruch nach Grund und Höhe schriftlich anmelden, Sicherheit zu leisten, soweit sie nicht Befriedigung verlangen können. Dieses Recht steht den Gläubigern jedoch nur zu, wenn sie glaubhaft machen, dass durch die Verschmelzung die Erfüllung ihrer Forderung gefährdet wird."
    },
    {
      "date": "2025-09-23",
      "id": "131105",
      "original_text": "Registerbekanntmachung nach dem Umwandlungsgesetz\nHessen Amtsgericht Offenbach am Main HRB 41326\nKH Beteiligungsgesellschaft mbH – Rodgau",
      "type": "Registerbekanntmachung nach dem Umwandlungsgesetz",
      "state": "Hessen",
      "amtsgericht": "Amtsgericht Offenbach am Main",
      "registernummer": "HRB 41326",
      "registerart": "HRB",
      "company_name": "KH Beteiligungsgesellschaft mbH",
      "company_seat": "Rodgau",
      "details": "23.09.2025 (Bekanntmachungsdatum)\n\nHessen Amtsgericht Offenbach am Main HRB 41326\nRegisterbekanntmachung nach dem Umwandlungsgesetz 23.09.2025 (Eintragungsdatum)\n\nKH Beteiligungsgesellschaft mbH\nGesellschaft mit beschränkter Haftung\nRodgau\n\nDen Gläubigern der an der Verschmelzung beteiligten Rechtsträger ist, wenn sie binnen sechs Monaten nach dem Tag, an dem die Eintragung der Verschmelzung in das Register des Sitzes desjenigen Rechtsträgers, dessen Gläubiger sie sind, nach § 19 Absatz 3 UmwG bekannt gemacht worden ist, ihren Anspruch nach Grund und Höhe schriftlich anmelden, Sicherheit zu leisten, soweit sie nicht Befriedigung verlangen können. Dieses Recht steht den Gläubigern jedoch nur zu, wenn sie glaubhaft machen, dass durch die Verschmelzung die Erfüllung ihrer Forderung gefährdet wird."
    },
    {
      "date": "2025-09-23",
      "id": "131106",
      "original_text": "Einreichung neuer Dokumente\nHessen Amtsgericht Offenbach am Main HRB 43331\nOPAL Catering GmbH – Offenbach am Main",
      "type": "Einreichung neuer Dokumente",
      "state": "Hessen",
      "amtsgericht": "Amtsgericht Offenbach am Main",
      "registernummer": "HRB 43331",
      "registerart": "HRB",
      "company_name": "OPAL Catering GmbH",
      "company_seat": "Offenbach am Main",
      "details": "23.09.2025 (Bekanntmachungsdatum)\n\nHessen Amtsgericht Offenbach am Main HRB 43331\nEinreichung neuer Dokumente\n\nOPAL Catering GmbH\nGesellschaft mit beschränkter Haftung\nOffenbach am Main\n\nDurch eine Änderung in den Personen der Aufsichtsratsmitglieder ist eine Liste der Mitglieder des Aufsichtsrates zum Handelsregister eingereicht worden."
    },
    {
      "date": "2025-09-23",
      "id": "131107",
      "original_text": "Registerbekanntmachung nach dem Umwandlungsgesetz\nHessen Amtsgericht Frankfurt am Main HRB 109880\nMorgan Stanley Europe SE – Frankfurt am Main",
      "type": "Registerbekanntmachung nach dem Umwandlungsgesetz",
      "state": "Hessen",
      "amtsgericht": "Amtsgericht Frankfurt am Main",
      "registernummer": "HRB 109880",
      "registerart": "HRB",
      "company_name": "Morgan Stanley Europe SE",
      "company_seat": "Frankfurt am Main",
      "details": "23.09.2025 (Bekanntmachungsdatum)\n\nHessen Amtsgericht Frankfurt am Main HRB 109880\nRegisterbekanntmachung nach dem Umwandlungsgesetz 23.09.2025 (Eintragungsdatum)\n\nMorgan Stanley Europe SE\nEuropäische Aktiengesellschaft (SE)\nFrankfurt am Main\n\nDen Gläubigern der an der Verschmelzung beteiligten Rechtsträger ist, wenn sie binnen sechs Monaten nach dem Tag, an dem die Eintragung der Verschmelzung in das Register des Sitzes desjenigen Rechtsträgers, dessen Gläubiger sie sind, nach § 19 Absatz 3 UmwG bekannt gemacht worden ist, ihren Anspruch nach Grund und Höhe schriftlich anmelden, Sicherheit zu leisten, soweit sie nicht Befriedigung verlangen können. Dieses Recht steht den Gläubigern jedoch nur zu, wenn sie glaubhaft machen, dass durch die Verschmelzung die Erfüllung ihrer Forderung gefährdet wird."
    },
    {
      "date": "2025-09-23",
      "id": "131108",
      "original_text": "Sonstige Registerbekanntmachung\nHessen Amtsgericht Frankfurt am Main HRB 8610\nBWG Frankfurt am Main Bundesbahn-Wohnungsgesellschaft mbH – Frankfurt am Main",
      "type": "Sonstige Registerbekanntmachung",
      "state": "Hessen",
      "amtsgericht": "Amtsgericht Frankfurt am Main",
      "registernummer": "HRB 8610",
      "registerart": "HRB",
      "company_name": "BWG Frankfurt am Main Bundesbahn-Wohnungsgesellschaft mbH",
      "company_seat": "Frankfurt am Main",
      "details": "23.09.2025 (Bekanntmachungsdatum)\n\nHessen Amtsgericht Frankfurt am Main HRB 8610\nSonstige Registerbekanntmachung\n\nBWG Frankfurt am Main Bundesbahn-Wohnungsgesellschaft mbH\nGesellschaft mit beschränkter Haftung\nFrankfurt am Main\n\nDurch eine Änderung in den Personen der Aufsichtsratsmitglieder ist eine Liste der Mitglieder des Aufsichtsrates zum Handelsregister eingereicht worden."
    },
    {
      "date": "2025-09-23",
      "id": "131109",
      "original_text": "Einreichung neuer Dokumente\nHessen Amtsgericht Frankfurt am Main HRB 50977\nDB Regio Aktiengesellschaft – Frankfurt am Main",
      "type": "Einreichung neuer Dokumente",
      "state": "Hessen",
      "amtsgericht": "Amtsgericht Frankfurt am Main",
      "registernummer": "HRB 50977",
      "registerart": "HRB",
      "company_name": "DB Regio Aktiengesellschaft",
      "company_seat": "Frankfurt am Main",
      "details": "23.09.2025 (Bekanntmachungsdatum)\n\nHessen Amtsgericht Frankfurt am Main HRB 50977\nEinreichung neuer Dokumente\n\nDB Regio Aktiengesellschaft\nAktiengesellschaft\nFrankfurt am Main\n\nDurch eine Änderung in den Personen der Aufsichtsratsmitglieder ist eine Liste der Mitglieder des Aufsichtsrates zum Handelsregister eingereicht worden."
    },
    {
      "date": "2025-09-23",
      "id": "131110",
      "original_text": "Einreichung neuer Dokumente\nHessen Amtsgericht Frankfurt am Main HRB 50977\nDB Regio Aktiengesellschaft – Frankfurt am Main",
      "type": "Einreichung neuer Dokumente",
      "state": "Hessen",
      "amtsgericht": "Amtsgericht Frankfurt am Main",
      "registernummer": "HRB 50977",
      "registerart": "HRB",
      "company_name": "DB Regio Aktiengesellschaft",
      "company_seat": "Frankfurt am Main",
      "details": "23.09.2025 (Bekanntmachungsdatum)\n\nHessen Amtsgericht Frankfurt am Main HRB 50977\nEinreichung neuer Dokumente 23.09.2025 (Eintragungsdatum)\n\nDB Regio Aktiengesellschaft\nAktiengesellschaft\nFrankfurt am Main\n\nDurch eine Änderung in den Personen der Aufsichtsratsmitglieder ist eine Liste der Mitglieder des Aufsichtsrates zum Handelsregister eingereicht worden."
    },
    {
      "date": "2025-09-23",
      "id": "131111",
      "original_text": "Registerbekanntmachung nach dem Umwandlungsgesetz\nHessen Amtsgericht Offenbach am Main HRB 54746\nfrabat GmbH – Dietzenbach",
      "type": "Registerbekanntmachung nach dem Umwandlungsgesetz",
      "state": "Hessen",
      "amtsgericht": "Amtsgericht Offenbach am Main",
      "registernummer": "HRB 54746",
      "registerart": "HRB",
      "company_name": "frabat GmbH",
      "company_seat": "Dietzenbach",
      "details": "23.09.2025 (Bekanntmachungsdatum)\n\nHessen Amtsgericht Offenbach am Main HRB 54746\nRegisterbekanntmachung nach dem Umwandlungsgesetz 23.09.2025 (Eintragungsdatum)\n\nfrabat GmbH\nGesellschaft mit beschränkter Haftung\nDietzenbach\n\nDen Gläubigern der an der Verschmelzung beteiligten Rechtsträger ist, wenn sie binnen sechs Monaten nach dem Tag, an dem die Eintragung der Verschmelzung in das Register des Sitzes desjenigen Rechtsträgers, dessen Gläubiger sie sind, nach § 19 Absatz 3 UmwG bekannt gemacht worden ist, ihren Anspruch nach Grund und Höhe schriftlich anmelden, Sicherheit zu leisten, soweit sie nicht Befriedigung verlangen können. Dieses Recht steht den Gläubigern jedoch nur zu, wenn sie glaubhaft machen, dass durch die Verschmelzung die Erfüllung ihrer Forderung gefährdet wird."
    },
    {
      "date": "2025-09-23",
      "id": "131112",
      "original_text": "Registerbekanntmachung nach dem Umwandlungsgesetz\nHessen Amtsgericht Hanau HRB 100665\nEurolflamm GmbH – Maintal",
      "type": "Registerbekanntmachung nach dem Umwandlungsgesetz",
      "state": "Hessen",
      "amtsgericht": "Amtsgericht Hanau",
      "registernummer": "HRB 100665",
      "registerart": "HRB",
      "company_name": "Eurolflamm GmbH",
      "company_seat": "Maintal",
      "details": "23.09.2025 (Bekanntmachungsdatum)\n\nHessen Amtsgericht Hanau HRB 100665\nRegisterbekanntmachung nach dem Umwandlungsgesetz 23.09.2025 (Eintragungsdatum)\n\nEurolflamm GmbH\nGesellschaft mit beschränkter Haftung\nMaintal\n\nDen Gläubigern der an der Verschmelzung beteiligten Rechtsträger ist, wenn sie binnen sechs Monaten nach dem Tag, an dem die Eintragung der Verschmelzung in das Register des Sitzes desjenigen Rechtsträgers, dessen Gläubiger sie sind, nach § 19 Absatz 3 UmwG bekannt gemacht worden ist, ihren Anspruch nach Grund und Höhe schriftlich anmelden, Sicherheit zu leisten, soweit sie nicht Befriedigung verlangen können. Dieses Recht steht den Gläubigern jedoch nur zu, wenn sie glaubhaft machen, dass durch die Verschmelzung die Erfüllung ihrer Forderung gefährdet wird."
    },
    {
      "date": "2025-09-23",
      "id": "131113",
      "original_text": "Einreichung neuer Dokumente\nHessen Amtsgericht Frankfurt am Main HRB 80376\nEURO Kartensysteme GmbH – Frankfurt am Main",
      "type": "Einreichung neuer Dokumente",
      "state": "Hessen",
      "amtsgericht": "Amtsgericht Frankfurt am Main",
      "registernummer": "HRB 80376",
      "registerart": "HRB",
      "company_name": "EURO Kartensysteme GmbH",
      "company_seat": "Frankfurt am Main",
      "details": "23.09.2025 (Bekanntmachungsdatum)\n\nHessen Amtsgericht Frankfurt am Main HRB 80376\nEinreichung neuer Dokumente\n\nEURO Kartensysteme GmbH\nGesellschaft mit beschränkter Haftung\nFrankfurt am Main\n\nDurch eine Änderung in den Personen der Aufsichtsratsmitglieder ist eine Liste der Mitglieder des Aufsichtsrates zum Handelsregister eingereicht worden."
    },
    {
      "date": "2025-09-23",
      "id": "131114",
      "original_text": "Registerbekanntmachung nach dem Umwandlungsgesetz\nHessen Amtsgericht Wetzlar GsR 96\nKfz-Ingenieurbüro Prüfzentrum Mittelhessen eGbR – Aßlar",
      "type": "Registerbekanntmachung nach dem Umwandlungsgesetz",
      "state": "Hessen",
      "amtsgericht": "Amtsgericht Wetzlar",
      "registernummer": "GsR 96",
      "registerart": "GsR",
      "company_name": "Kfz-Ingenieurbüro Prüfzentrum Mittelhessen eGbR",
      "company_seat": "Aßlar",
      "details": "23.09.2025 (Bekanntmachungsdatum)\n\nHessen Amtsgericht Wetzlar GsR 96\nRegisterbekanntmachung nach dem Umwandlungsgesetz 23.09.2025 (Eintragungsdatum)\n\nKfz-Ingenieurbüro Prüfzentrum Mittelhessen eGbR\nGesellschaft bürgerlichen Rechts\nAßlar\n\nDen Gläubigern der an der formwechselnden Umwandlung beteiligten Rechtsträger ist, wenn sie binnen sechs Monaten nach dem Tag, an dem die Eintragung der formwechselnden Umwandlung in das Register des Sitzes desjenigen Rechtsträgers, dessen Gläubiger sie sind, nach § 201 UmwG bekannt gemacht worden ist, ihren Anspruch nach Grund und Höhe schriftlich anmelden, Sicherheit zu leisten, soweit sie nicht Befriedigung verlangen können. Dieses Recht steht den Gläubigern jedoch nur zu, wenn sie glaubhaft machen, dass durch die formwechselnden Umwandlung die Erfüllung ihrer Forderung gefährdet wird."
    },
    {
      "date": "2025-09-23",
      "id": "131115",
      "original_text": "Registerbekanntmachung nach dem Umwandlungsgesetz\nHessen Amtsgericht Wetzlar HRB 9493\nKfz-Ingenieurbüro Prüfzentrum Mittelhessen GmbH – Aßlar",
      "type": "Registerbekanntmachung nach dem Umwandlungsgesetz",
      "state": "Hessen",
      "amtsgericht": "Amtsgericht Wetzlar",
      "registernummer": "HRB 9493",
      "registerart": "HRB",
      "company_name": "Kfz-Ingenieurbüro Prüfzentrum Mittelhessen GmbH",
      "company_seat": "Aßlar",
      "details": "23.09.2025 (Bekanntmachungsdatum)\n\nHessen Amtsgericht Wetzlar HRB 9493\nRegisterbekanntmachung nach dem Umwandlungsgesetz 23.09.2025 (Eintragungsdatum)\n\nKfz-Ingenieurbüro Prüfzentrum Mittelhessen GmbH\nGesellschaft mit beschränkter Haftung\nAßlar\n\nDen Gläubigern der an der formwechselnden Umwandlung beteiligten Rechtsträger ist, wenn sie binnen sechs Monaten nach dem Tag, an dem die Eintragung der formwechselnden Umwandlung in das Register des Sitzes desjenigen Rechtsträgers, dessen Gläubiger sie sind, nach § 201 UmwG bekannt gemacht worden ist, ihren Anspruch nach Grund und Höhe schriftlich anmelden, Sicherheit zu leisten, soweit sie nicht Befriedigung verlangen können. Dieses Recht steht den Gläubigern jedoch nur zu, wenn sie glaubhaft machen, dass durch die formwechselnden Umwandlung die Erfüllung ihrer Forderung gefährdet wird."
    },
    {
      "date": "2025-09-23",
      "id": "131116",
      "original_text": "Einreichung neuer Dokumente\nHessen Amtsgericht Offenbach am Main HRB 49468\nViridium Holding AG – Neu-Isenburg",
      "type": "Einreichung neuer Dokumente",
      "state": "Hessen",
      "amtsgericht": "Amtsgericht Offenbach am Main",
      "registernummer": "HRB 49468",
      "registerart": "HRB",
      "company_name": "Viridium Holding AG",
      "company_seat": "Neu-Isenburg",
      "details": "23.09.2025 (Bekanntmachungsdatum)\n\nHessen Amtsgericht Offenbach am Main HRB 49468\nEinreichung neuer Dokumente 23.09.2025 (Eintragungsdatum)\n\nViridium Holding AG\nAktiengesellschaft\nNeu-Isenburg\n\nDurch eine Änderung in den Personen der Aufsichtsratsmitglieder ist eine Liste der Mitglieder des Aufsichtsrates zum Handelsregister eingereicht worden."
    },
    {
      "date": "2025-09-23",
      "id": "131117",
      "original_text": "Sonstige Registerbekanntmachung\nHessen Amtsgericht Frankfurt am Main HRB 128490\nCan Bau GmbH – Frankfurt am Main",
      "type": "Sonstige Registerbekanntmachung",
      "state": "Hessen",
      "amtsgericht": "Amtsgericht Frankfurt am Main",
      "registernummer": "HRB 128490",
      "registerart": "HRB",
      "company_name": "Can Bau GmbH",
      "company_seat": "Frankfurt am Main",
      "details": "23.09.2025 (Bekanntmachungsdatum)\n\nHessen Amtsgericht Frankfurt am Main HRB 128490\nSonstige Registerbekanntmachung\n\nCan Bau GmbH\nGesellschaft mit beschränkter Haftung\nFrankfurt am Main\n\nEs ist beabsichtigt, die Löschung der Gesellschaft wegen Vermögenslosigkeit gemäß § 394 FamFG gemäß § 395 FamFG von Amtswegen aus dem Handelsregister zu löschen und die Gesellschaft wieder einzutragen, da ein Insolvenzantragsverfahren zum Zeitpunkt der Löschung bestand und das Insolvenzverfahren am 25.07.2025 eröffnet wurde. Hiergegen kann innerhalb eines Zeitraums von einem Monat dieser Veröffentlichung Widerspruch bei dem Amtsgericht Frankfurt am Main eingelegt werden."
    },
    {
      "date": "2025-09-23",
      "id": "131118",
      "original_text": "Registerbekanntmachung nach dem Umwandlungsgesetz\nHessen Amtsgericht Frankfurt am Main HRB 112220\nExperis Verwaltungs GmbH – Frankfurt am Main",
      "type": "Registerbekanntmachung nach dem Umwandlungsgesetz",
      "state": "Hessen",
      "amtsgericht": "Amtsgericht Frankfurt am Main",
      "registernummer": "HRB 112220",
      "registerart": "HRB",
      "company_name": "Experis Verwaltungs GmbH",
      "company_seat": "Frankfurt am Main",
      "details": "23.09.2025 (Bekanntmachungsdatum)\n\nHessen Amtsgericht Frankfurt am Main HRB 112220\nRegisterbekanntmachung nach dem Umwandlungsgesetz 23.09.2025 (Eintragungsdatum)\n\nExperis Verwaltungs GmbH\nGesellschaft mit beschränkter Haftung\nFrankfurt am Main\n\nDen Gläubigern der an der Verschmelzung beteiligten Rechtsträger ist, wenn sie binnen sechs Monaten nach dem Tag, an dem die Eintragung der Verschmelzung in das Register des Sitzes desjenigen Rechtsträgers, dessen Gläubiger sie sind, nach § 19 Absatz 3 UmwG bekannt gemacht worden ist, ihren Anspruch nach Grund und Höhe schriftlich anmelden, Sicherheit zu leisten, soweit sie nicht Befriedigung verlangen können. Dieses Recht steht den Gläubigern jedoch nur zu, wenn sie glaubhaft machen, dass durch die Verschmelzung die Erfüllung ihrer Forderung gefährdet wird."
    },
    {
      "date": "2025-09-23",
      "id": "131119",
      "original_text": "Registerbekanntmachung nach dem Umwandlungsgesetz\nHessen Amtsgericht Frankfurt am Main HRB 53042\nExperis GmbH – Eschborn",
      "type": "Registerbekanntmachung nach dem Umwandlungsgesetz",
      "state": "Hessen",
      "amtsgericht": "Amtsgericht Frankfurt am Main",
      "registernummer": "HRB 53042",
      "registerart": "HRB",
      "company_name": "Experis GmbH",
      "company_seat": "Eschborn",
      "details": "23.09.2025 (Bekanntmachungsdatum)\n\nHessen Amtsgericht Frankfurt am Main HRB 53042\nRegisterbekanntmachung nach dem Umwandlungsgesetz 23.09.2025 (Eintragungsdatum)\n\nExperis GmbH\nGesellschaft mit beschränkter Haftung\nEschborn\n\nDen Gläubigern der an der Verschmelzung beteiligten Rechtsträger ist, wenn sie binnen sechs Monaten nach dem Tag, an dem die Eintragung der Verschmelzung in das Register des Sitzes desjenigen Rechtsträgers, dessen Gläubiger sie sind, nach § 19 Absatz 3 UmwG bekannt gemacht worden ist, ihren Anspruch nach Grund und Höhe schriftlich anmelden, Sicherheit zu leisten, soweit sie nicht Befriedigung verlangen können. Dieses Recht steht den Gläubigern jedoch nur zu, wenn sie glaubhaft machen, dass durch die Verschmelzung die Erfüllung ihrer Forderung gefährdet wird."
    },
    {
      "date": "2025-09-23",
      "id": "131120",
      "original_text": "Registerbekanntmachung nach dem Umwandlungsgesetz\nHessen Amtsgericht Wiesbaden HRA 11824\nDMG Packaging GmbH & Co. KG – Flörsheim am Main",
      "type": "Registerbekanntmachung nach dem Umwandlungsgesetz",
      "state": "Hessen",
      "amtsgericht": "Amtsgericht Wiesbaden",
      "registernummer": "HRA 11824",
      "registerart": "HRA",
      "company_name": "DMG Packaging GmbH & Co. KG",
      "company_seat": "Flörsheim am Main",
      "details": "23.09.2025 (Bekanntmachungsdatum)\n\nHessen Amtsgericht Wiesbaden HRA 11824\nRegisterbekanntmachung nach dem Umwandlungsgesetz 23.09.2025 (Eintragungsdatum)\n\nDMG Packaging GmbH & Co. KG\nKommanditgesellschaft\nFlörsheim am Main\n\nDen Gläubigern der an der Ausgliederung beteiligten Rechtsträger ist, wenn sie binnen sechs Monaten nach dem Tag, an dem die Eintragung der Ausgliederung in das Register des Sitzes desjenigen Rechtsträgers, dessen Gläubiger sie sind, nach §§ 125, 19 Absatz 3 UmwG bekannt gemacht worden ist, ihren Anspruch nach Grund und Höhe schriftlich anmelden, Sicherheit zu leisten, soweit sie nicht Befriedigung verlangen können. Dieses Recht steht den Gläubigern jedoch nur zu, wenn sie glaubhaft machen, dass durch die Ausgliederung die Erfüllung ihrer Forderung gefährdet wird."
    },
    {
      "date": "2025-09-23",
      "id": "131121",
      "original_text": "Löschungsankündigung\nHessen Amtsgericht Frankfurt am Main HRB 119414\nGotex Management UG (haftungsbeschränkt) – Karben",
      "type": "Löschungsankündigung",
      "state": "Hessen",
      "amtsgericht": "Amtsgericht Frankfurt am Main",
      "registernummer": "HRB 119414",
      "registerart": "HRB",
      "company_name": "Gotex Management UG (haftungsbeschränkt)",
      "company_seat": "Karben",
      "details": "23.09.2025 (Bekanntmachungsdatum)\n\nHessen Amtsgericht Frankfurt am Main HRB 119414\nLöschungsankündigung 23.09.2025 (Eintragungsdatum)\n\nGotex Management UG (haftungsbeschränkt)\nGesellschaft mit beschränkter Haftung\nKarben\n\nDas Registergericht beabsichtigt die im Handelsregister eingetragene Gesellschaft von Amts wegen nach § 394 FamFG zu löschen. Die Frist zur Erhebung eines Widerspruchs gegen die beabsichtigte Löschung wird auf 1 Monat festgesetzt."
    },
    {
      "date": "2025-09-23",
      "id": "131122",
      "original_text": "Registerbekanntmachung nach dem Umwandlungsgesetz\nHessen Amtsgericht Offenbach am Main HRB 23061\nKegelmann Technik GmbH – Rodgau",
      "type": "Registerbekanntmachung nach dem Umwandlungsgesetz",
      "state": "Hessen",
      "amtsgericht": "Amtsgericht Offenbach am Main",
      "registernummer": "HRB 23061",
      "registerart": "HRB",
      "company_name": "Kegelmann Technik GmbH",
      "company_seat": "Rodgau",
      "details": "23.09.2025 (Bekanntmachungsdatum)\n\nHessen Amtsgericht Offenbach am Main HRB 23061\nRegisterbekanntmachung nach dem Umwandlungsgesetz 23.09.2025 (Eintragungsdatum)\n\nKegelmann Technik GmbH\nGesellschaft mit beschränkter Haftung\nRodgau\n\nDen Gläubigern der an der Verschmelzung beteiligten Rechtsträger ist, wenn sie binnen sechs Monaten nach dem Tag, an dem die Eintragung der Verschmelzung in das Register des Sitzes desjenigen Rechtsträgers, dessen Gläubiger sie sind, nach § 19 Absatz 3 UmwG bekannt gemacht worden ist, ihren Anspruch nach Grund und Höhe schriftlich anmelden, Sicherheit zu leisten, soweit sie nicht Befriedigung verlangen können. Dieses Recht steht den Gläubigern jedoch nur zu, wenn sie glaubhaft machen, dass durch die Verschmelzung die Erfüllung ihrer Forderung gefährdet wird."
    },
    {
      "date": "2025-09-23",
      "id": "131123",
      "original_text": "Registerbekanntmachung nach dem Umwandlungsgesetz\nHessen Amtsgericht Frankfurt am Main HRB 122909\nPrecision Werks Group Verwaltungs GmbH – Frankfurt am Main",
      "type": "Registerbekanntmachung nach dem Umwandlungsgesetz",
      "state": "Hessen",
      "amtsgericht": "Amtsgericht Frankfurt am Main",
      "registernummer": "HRB 122909",
      "registerart": "HRB",
      "company_name": "Precision Werks Group Verwaltungs GmbH",
      "company_seat": "Frankfurt am Main",
      "details": "23.09.2025 (Bekanntmachungsdatum)\n\nHessen Amtsgericht Frankfurt am Main HRB 122909\nRegisterbekanntmachung nach dem Umwandlungsgesetz 23.09.2025 (Eintragungsdatum)\n\nPrecision Werks Group Verwaltungs GmbH\nGesellschaft mit beschränkter Haftung\nFrankfurt am Main\n\nDen Gläubigern der an der Verschmelzung beteiligten Rechtsträger ist, wenn sie binnen sechs Monaten nach dem Tag, an dem die Eintragung der Verschmelzung in das Register des Sitzes desjenigen Rechtsträgers, dessen Gläubiger sie sind, nach § 19 Absatz 3 UmwG bekannt gemacht worden ist, ihren Anspruch nach Grund und Höhe schriftlich anmelden, Sicherheit zu leisten, soweit sie nicht Befriedigung verlangen können. Dieses Recht steht den Gläubigern jedoch nur zu, wenn sie glaubhaft machen, dass durch die Verschmelzung die Erfüllung ihrer Forderung gefährdet wird."
    },
    {
      "date": "2025-09-23",
      "id": "131124",
      "original_text": "Registerbekanntmachung nach dem Umwandlungsgesetz\nHessen Amtsgericht Frankfurt am Main HRB 53042\nExperis GmbH – Eschborn",
      "type": "Registerbekanntmachung nach dem Umwandlungsgesetz",
      "state": "Hessen",
      "amtsgericht": "Amtsgericht Frankfurt am Main",
      "registernummer": "HRB 53042",
      "registerart": "HRB",
      "company_name": "Experis GmbH",
      "company_seat": "Eschborn",
      "details": "23.09.2025 (Bekanntmachungsdatum)\n\nHessen Amtsgericht Frankfurt am Main HRB 53042\nRegisterbekanntmachung nach dem Umwandlungsgesetz 23.09.2025 (Eintragungsdatum)\n\nExperis GmbH\nGesellschaft mit beschränkter Haftung\nEschborn\n\nDen Gläubigern der an der Verschmelzung beteiligten Rechtsträger ist, wenn sie binnen sechs Monaten nach dem Tag, an dem die Eintragung der Verschmelzung in das Register des Sitzes desjenigen Rechtsträgers, dessen Gläubiger sie sind, nach § 19 Absatz 3 UmwG bekannt gemacht worden ist, ihren Anspruch nach Grund und Höhe schriftlich anmelden, Sicherheit zu leisten, soweit sie nicht Befriedigung verlangen können. Dieses Recht steht den Gläubigern jedoch nur zu, wenn sie glaubhaft machen, dass durch die Verschmelzung die Erfüllung ihrer Forderung gefährdet wird."
    }
  ]
}