{
  "date": "2024-11-05",
  "date_of_scrape": "2024-12-07T10:25:00.254Z",
  "tool_version": "0.2.0",
  "number_of_announcements": 157,
  "announcements": [
    {
      "date": "2024-11-05",
      "id": "92484",
      "original_text": "Löschungsankündigung\nBayern Amtsgericht München HRB 266709\ntwenty two cards UG (haftungsbeschränkt) – München",
      "type": "Löschungsankündigung",
      "state": "Bayern",
      "amtsgericht": "Amtsgericht München",
      "registernummer": "HRB 266709",
      "registerart": "HRB",
      "company_name": "twenty two cards UG (haftungsbeschränkt)",
      "company_seat": "München",
      "details": "05.11.2024 (Bekanntmachungsdatum)\n\nBayern Amtsgericht München HRB 266709\nLöschungsankündigung 04.11.2024 (Eintragungsdatum)\n\ntwenty two cards UG (haftungsbeschränkt)\nGesellschaft mit beschränkter Haftung\nMünchen\n\nDas Registergericht beabsichtigt, die im Handelsregister eingetragene Gesellschaft wegen Vermögenslosigkeit von Amts wegen nach § 394 FamFG zu löschen. Die Frist zur Erhebung eines Widerspruchs ist auf drei Monate festgesetzt."
    },
    {
      "date": "2024-11-05",
      "id": "92485",
      "original_text": "Löschungsankündigung\nBayern Amtsgericht Nürnberg HRA 17496\nSE&CA Management GmbH & Co. KG – Nürnberg",
      "type": "Löschungsankündigung",
      "state": "Bayern",
      "amtsgericht": "Amtsgericht Nürnberg",
      "registernummer": "HRA 17496",
      "registerart": "HRA",
      "company_name": "SE&CA Management GmbH & Co. KG",
      "company_seat": "Nürnberg",
      "details": "05.11.2024 (Bekanntmachungsdatum)\n\nBayern Amtsgericht Nürnberg HRA 17496\nLöschungsankündigung\n\nSE&CA Management GmbH & Co. KG\nKommanditgesellschaft\nNürnberg\n\nDas Registergericht beabsichtigt, die im Handelsregister eingetragene Firma von Amts wegen nach § 31 Abs. 2 HGB zu löschen. Die Frist zur Erhebung eines Widerspruchs ist auf einen Monat festgesetzt."
    },
    {
      "date": "2024-11-05",
      "id": "92486",
      "original_text": "Registerbekanntmachung nach dem Umwandlungsgesetz\nBayern Amtsgericht Ingolstadt HRB 10207\nPlaymobil International GmbH – Ingolstadt",
      "type": "Registerbekanntmachung nach dem Umwandlungsgesetz",
      "state": "Bayern",
      "amtsgericht": "Amtsgericht Ingolstadt",
      "registernummer": "HRB 10207",
      "registerart": "HRB",
      "company_name": "Playmobil International GmbH",
      "company_seat": "Ingolstadt",
      "details": "05.11.2024 (Bekanntmachungsdatum)\n\nBayern Amtsgericht Ingolstadt HRB 10207\nRegisterbekanntmachung nach dem Umwandlungsgesetz 04.11.2024 (Eintragungsdatum)\n\nPlaymobil International GmbH\nGesellschaft mit beschränkter Haftung\nIngolstadt\n\nDen Gläubigern der an der Verschmelzung beteiligten Rechtsträger ist, wenn sie binnen sechs Monaten nach dem Tag, an dem die Eintragung der Verschmelzung in das Register des Sitzes desjenigen Rechtsträgers, dessen Gläubiger sie sind, nach § 19 Abs. 3 UmwG als bekannt gemacht gilt, ihren Anspruch nach Grund und Höhe schriftlich anmelden, Sicherheit zu leisten, soweit sie nicht Befriedigung verlangen können. Dieses Recht steht den Gläubigern jedoch nur zu, wenn sie glaubhaft machen, dass durch die Verschmelzung die Erfüllung ihrer Forderung gefährdet wird."
    },
    {
      "date": "2024-11-05",
      "id": "92487",
      "original_text": "Registerbekanntmachung nach dem Umwandlungsgesetz\nBayern Amtsgericht München HRA 79714\nServiceplan BOOSTing Health GmbH & Co. KG – München",
      "type": "Registerbekanntmachung nach dem Umwandlungsgesetz",
      "state": "Bayern",
      "amtsgericht": "Amtsgericht München",
      "registernummer": "HRA 79714",
      "registerart": "HRA",
      "company_name": "Serviceplan BOOSTing Health GmbH & Co. KG",
      "company_seat": "München",
      "details": "05.11.2024 (Bekanntmachungsdatum)\n\nBayern Amtsgericht München HRA 79714\nRegisterbekanntmachung nach dem Umwandlungsgesetz 04.11.2024 (Eintragungsdatum)\n\nServiceplan BOOSTing Health GmbH & Co. KG\nKommanditgesellschaft\nMünchen\n\nZur Verschmelzung der BOOSTing Communication GmbH mit Sitz in München, Amtsgericht München, HRB 174430 als übertragender Rechtsträger mit der vormaligen Serviceplan Health & Life GmbH & Co. KG, nunmehr: Serviceplan BOOSTing Health GmbH & Co. KG mit Sitz in München, HRA 79714:\nDen Gläubigern der an der Verschmelzung beteiligten Rechtsträger ist, wenn sie binnen sechs Monaten nach dem Tag, an dem die Eintragung der Verschmelzung in das Register des Sitzes desjenigen Rechtsträgers, dessen Gläubiger sie sind, nach § 19 Abs. 3 UmwG als bekannt gemacht gilt, ihren Anspruch nach Grund und Höhe schriftlich anmelden, Sicherheit zu leisten, soweit sie nicht Befriedigung verlangen können. Dieses Recht steht den Gläubigern jedoch nur zu, wenn sie glaubhaft machen, dass durch die Verschmelzung die Erfüllung ihrer Forderung gefährdet wird."
    },
    {
      "date": "2024-11-05",
      "id": "92488",
      "original_text": "Registerbekanntmachung nach dem Umwandlungsgesetz\nBayern Amtsgericht München HRB 297269\nGER Linde 2 GmbH – Pullach i.Isartal",
      "type": "Registerbekanntmachung nach dem Umwandlungsgesetz",
      "state": "Bayern",
      "amtsgericht": "Amtsgericht München",
      "registernummer": "HRB 297269",
      "registerart": "HRB",
      "company_name": "GER Linde 2 GmbH",
      "company_seat": "Pullach i.Isartal",
      "details": "05.11.2024 (Bekanntmachungsdatum)\n\nBayern Amtsgericht München HRB 297269\nRegisterbekanntmachung nach dem Umwandlungsgesetz 04.11.2024 (Eintragungsdatum)\n\nGER Linde 2 GmbH\nGesellschaft mit beschränkter Haftung\nPullach i.Isartal\n\nDen Gläubigern der an der Spaltung beteiligten Rechtsträger ist, wenn sie binnen sechs Monaten nach dem Tag, an dem die Eintragung der Spaltung in das Register des Sitzes desjenigen Rechtsträgers, dessen Gläubiger sie sind, nach §§ 125, 19 Abs. 3 UmwG als bekannt gemacht gilt, ihren Anspruch nach Grund und Höhe schriftlich anmelden, Sicherheit zu leisten, soweit sie nicht Befriedigung verlangen können. Dieses Recht steht den Gläubigern jedoch nur zu, wenn sie glaubhaft machen, dass durch die Spaltung die Erfüllung ihrer Forderung gefährdet wird."
    },
    {
      "date": "2024-11-05",
      "id": "92489",
      "original_text": "Einreichung neuer Dokumente\nBayern Amtsgericht Ingolstadt HRB 3231\nStadtwerke Ingolstadt Beteiligungen GmbH – Ingolstadt",
      "type": "Einreichung neuer Dokumente",
      "state": "Bayern",
      "amtsgericht": "Amtsgericht Ingolstadt",
      "registernummer": "HRB 3231",
      "registerart": "HRB",
      "company_name": "Stadtwerke Ingolstadt Beteiligungen GmbH",
      "company_seat": "Ingolstadt",
      "details": "05.11.2024 (Bekanntmachungsdatum)\n\nBayern Amtsgericht Ingolstadt HRB 3231\nEinreichung neuer Dokumente\n\nStadtwerke Ingolstadt Beteiligungen GmbH\nGesellschaft mit beschränkter Haftung\nIngolstadt\n\nDem Amtsgericht Ingolstadt -Registergericht- ist eine Liste der Mitglieder des Aufsichtsrats eingereicht worden, § 52 Abs. 3 S. 2 GmbHG."
    },
    {
      "date": "2024-11-05",
      "id": "92490",
      "original_text": "Löschungsankündigung\nBayern Amtsgericht Aschaffenburg HRB 10064\nVeriZY Technologies GmbH – Großwallstadt",
      "type": "Löschungsankündigung",
      "state": "Bayern",
      "amtsgericht": "Amtsgericht Aschaffenburg",
      "registernummer": "HRB 10064",
      "registerart": "HRB",
      "company_name": "VeriZY Technologies GmbH",
      "company_seat": "Großwallstadt",
      "details": "05.11.2024 (Bekanntmachungsdatum)\n\nBayern Amtsgericht Aschaffenburg HRB 10064\nLöschungsankündigung\n\nVeriZY Technologies GmbH\nGesellschaft mit beschränkter Haftung\nGroßwallstadt\n\nIn der Handelsregistersache VariZY Technologies GmbH, Sitz: Großwallstadt, ergeht folgender Beschluss: Das Amtslöschungsverfahren wird eingestellt, da die Sitzverlegung beantrag wurde. Rechtsbehelfsblehrung: Gegen diese Entscheidung ist kein Rechtsbehelf statthaft. Aschaffenburg, 31.10.2024, Dr. Roth, Richter am Amtsgericht."
    },
    {
      "date": "2024-11-05",
      "id": "92491",
      "original_text": "Registerbekanntmachung nach dem Umwandlungsgesetz\nBayern Amtsgericht München HRB 48087\nOfenstein Werbeagentur GmbH – München",
      "type": "Registerbekanntmachung nach dem Umwandlungsgesetz",
      "state": "Bayern",
      "amtsgericht": "Amtsgericht München",
      "registernummer": "HRB 48087",
      "registerart": "HRB",
      "company_name": "Ofenstein Werbeagentur GmbH",
      "company_seat": "München",
      "details": "05.11.2024 (Bekanntmachungsdatum)\n\nBayern Amtsgericht München HRB 48087\nRegisterbekanntmachung nach dem Umwandlungsgesetz 04.11.2024 (Eintragungsdatum)\n\nOfenstein Werbeagentur GmbH\nGesellschaft mit beschränkter Haftung\nMünchen\n\nDen Gläubigern der an der Verschmelzung beteiligten Rechtsträger ist, wenn sie binnen sechs Monaten nach dem Tag, an dem die Eintragung der Verschmelzung in das Register des Sitzes desjenigen Rechtsträgers, dessen Gläubiger sie sind, nach § 19 Abs. 3 UmwG als bekannt gemacht gilt, ihren Anspruch nach Grund und Höhe schriftlich anmelden, Sicherheit zu leisten, soweit sie nicht Befriedigung verlangen können. Dieses Recht steht den Gläubigern jedoch nur zu, wenn sie glaubhaft machen, dass durch die Verschmelzung die Erfüllung ihrer Forderung gefährdet wird."
    },
    {
      "date": "2024-11-05",
      "id": "92492",
      "original_text": "Registerbekanntmachung nach dem Umwandlungsgesetz\nBayern Amtsgericht München HRB 187218\nEl Estero Haftungs GmbH – München",
      "type": "Registerbekanntmachung nach dem Umwandlungsgesetz",
      "state": "Bayern",
      "amtsgericht": "Amtsgericht München",
      "registernummer": "HRB 187218",
      "registerart": "HRB",
      "company_name": "El Estero Haftungs GmbH",
      "company_seat": "München",
      "details": "05.11.2024 (Bekanntmachungsdatum)\n\nBayern Amtsgericht München HRB 187218\nRegisterbekanntmachung nach dem Umwandlungsgesetz 04.11.2024 (Eintragungsdatum)\n\nEl Estero Haftungs GmbH\nGesellschaft mit beschränkter Haftung\nMünchen\n\nBeim Handelsregister ist nach § 308 Abs. 1 Satz 1 UmwG der Entwurf des Verschmelzungsplans über die grenzüberschreitende Verschmelzung der El Estero Haftungs GmbH mit Sitz in München, Deutschland, sowie der Grit 61. Vermögensverwaltungs GmbH mit Sitz in München, Deutschland, und der Grit 62. Vermögensverwaltungs GmbH mit Sitz in München, Deutschland, alle als übertragende Rechtsträger auf die INVERSIONES CAECIUS, S.L.U. mit Sitz in Madrid, Spanien, als übernehmenden Rechtsträger eingereicht worden. An der grenzüberschreitenden Verschmelzung sind die folgenden Gesellschaften beteiligt: Die El Estero Haftungs GmbH, eine Gesellschaft mit beschränkter Haftung nach deutschem Recht mit Sitz in München, Deutschland, als übertragender Rechtsträger. Die Grit 61. Vermögensverwaltungs GmbH, eine Gesellschaft mit beschränkter Haftung nach deutschem Recht mit Sitz in München, Deutschland, als weiterer übertragender Rechtsträger. Die Grit 62. Vermögensverwaltungs GmbH, eine Gesellschaft mit beschränkter Haftung nach deutschem Recht mit Sitz in München, Deutschland, ebenfalls als weiterer übertragender Rechtsträger. Die INVERSIONES CAE-CIUS, S.L.U., eine Gesellschaft mit beschränkter Haftung und nur einem Gesellschafter nach spanischem Recht mit Sitz in Madrid, Spanien, als übernehmender Rechtsträger. Die an der grenzüberschreitenden Verschmelzung beteiligten Gesellschaften sind wie folgt im jeweiligen nationalen Register eingetragen: Die El Estero Haftungs GmbH als übertragender Rechtsträger ist eingetragen im Handelsregister des Amtsgerichts München unter HRB 187218. Die Grit 61. Vermögensverwaltungs GmbH als weiterer übertragender Rechtsträger ist eingetragen im Handelsregister des Amtsgerichts München unter HRB 184523. Die Grit 62. Vermögensverwaltungs GmbH als weiterer übertragender Rechtsträger ist eingetragen im Handelsregister des Amtsgerichts München unter HRB 184488.Die INVERSIONES CAE-CIUS, S.L.U. als übernehmender Rechtsträger ist eingetragen im Gesellschaftsregister von Madrid (Registro Mercantil de Madrid) unter Band 36.007, Seite 147, Blatt M-646.981. Weder bei dem übernehmenden Rechtsträger noch bei den übertragenden Rechtsträgern besteht ein Betriebsrat, und weder der übernehmende Rechtsträger noch die übertragenden Rechtsträger beschäftigen Arbeitnehmer. Die Anteilsinhaber und Gläubiger der an der grenzüberschreitenden Verschmelzung beteiligten Rechtsträger werden darauf hingewiesen, dass sie der Gesellschaft spätestens fünf Arbeitstage vor dem Tag der Beurkundung des gemeinsamen Verschmelzungsplans Bemerkungen zum gemeinsamen Verschmelzungsplan übermitteln können. Sämtliche Bemerkungen sind bis zum 10. Dezember 2024 unmittelbar an die El Estero Haftungs GmbH an ihre Geschäftsanschrift Eschersheimer Landstraße 14, 60322 Frankfurt am Main, Deutschland, (E-Mail: vrodriguez@ga-p.com) zu übermitteln."
    },
    {
      "date": "2024-11-05",
      "id": "92493",
      "original_text": "Löschungsankündigung\nBayern Amtsgericht Ingolstadt HRB 7093\nKaZi Bau GmbH – Rohrbach",
      "type": "Löschungsankündigung",
      "state": "Bayern",
      "amtsgericht": "Amtsgericht Ingolstadt",
      "registernummer": "HRB 7093",
      "registerart": "HRB",
      "company_name": "KaZi Bau GmbH",
      "company_seat": "Rohrbach",
      "details": "05.11.2024 (Bekanntmachungsdatum)\n\nBayern Amtsgericht Ingolstadt HRB 7093\nLöschungsankündigung\n\nKaZi Bau GmbH\nGesellschaft mit beschränkter Haftung\nRohrbach\n\nDas Registergericht beabsichtigt, die im Handelsregister eingetragene Gesellschaft wegen Vermögenslosigkeit von Amts wegen nach § 394 FamFG zu löschen. #insert(Text=\"zztb_V_Widerspruchsfrist\")"
    },
    {
      "date": "2024-11-05",
      "id": "92494",
      "original_text": "Löschungsankündigung\nBayern Amtsgericht München HRB 179998\nEKOPETROL GmbH – München",
      "type": "Löschungsankündigung",
      "state": "Bayern",
      "amtsgericht": "Amtsgericht München",
      "registernummer": "HRB 179998",
      "registerart": "HRB",
      "company_name": "EKOPETROL GmbH",
      "company_seat": "München",
      "details": "05.11.2024 (Bekanntmachungsdatum)\n\nBayern Amtsgericht München HRB 179998\nLöschungsankündigung\n\nEKOPETROL GmbH\nGesellschaft mit beschränkter Haftung\nMünchen\n\nDas Registergericht beabsichtigt, die im Handelsregister eingetragene Gesellschaft wegen Vermögenslosigkeit von Amts wegen nach § 394 FamFG zu löschen. Die Frist zur Erhebung eines Widerspruchs ist auf drei Monate festgesetzt."
    },
    {
      "date": "2024-11-05",
      "id": "92495",
      "original_text": "Registerbekanntmachung nach dem Umwandlungsgesetz\nBayern Amtsgericht Augsburg HRA 17965\nGraf Buchheim GmbH & Co. KG – Aichach",
      "type": "Registerbekanntmachung nach dem Umwandlungsgesetz",
      "state": "Bayern",
      "amtsgericht": "Amtsgericht Augsburg",
      "registernummer": "HRA 17965",
      "registerart": "HRA",
      "company_name": "Graf Buchheim GmbH & Co. KG",
      "company_seat": "Aichach",
      "details": "05.11.2024 (Bekanntmachungsdatum)\n\nBayern Amtsgericht Augsburg HRA 17965\nRegisterbekanntmachung nach dem Umwandlungsgesetz 04.11.2024 (Eintragungsdatum)\n\nGraf Buchheim GmbH & Co. KG\nKommanditgesellschaft\nAichach\n\nDen Gläubigern der an der Verschmelzung beteiligten Rechtsträger ist, wenn sie binnen sechs Monaten nach dem Tag, an dem die Eintragung der Verschmelzung in das Register des Sitzes desjenigen Rechtsträgers, dessen Gläubiger sie sind, nach § 19 Abs. 3 UmwG als bekannt gemacht gilt, ihren Anspruch nach Grund und Höhe schriftlich anmelden, Sicherheit zu leisten, soweit sie nicht Befriedigung verlangen können. Dieses Recht steht den Gläubigern jedoch nur zu, wenn sie glaubhaft machen, dass durch die Verschmelzung die Erfüllung ihrer Forderung gefährdet wird."
    },
    {
      "date": "2024-11-05",
      "id": "92496",
      "original_text": "Registerbekanntmachung nach dem Umwandlungsgesetz\nBayern Amtsgericht Fürth HRB 8804\nTop Grade Fashion Solutions GmbH – Langenzenn",
      "type": "Registerbekanntmachung nach dem Umwandlungsgesetz",
      "state": "Bayern",
      "amtsgericht": "Amtsgericht Fürth",
      "registernummer": "HRB 8804",
      "registerart": "HRB",
      "company_name": "Top Grade Fashion Solutions GmbH",
      "company_seat": "Langenzenn",
      "details": "05.11.2024 (Bekanntmachungsdatum)\n\nBayern Amtsgericht Fürth HRB 8804\nRegisterbekanntmachung nach dem Umwandlungsgesetz 04.11.2024 (Eintragungsdatum)\n\nTop Grade Fashion Solutions GmbH\nGesellschaft mit beschränkter Haftung\nLangenzenn\n\nDen Gläubigern der an der Verschmelzung beteiligten Rechtsträger ist, wenn sie binnen sechs Monaten nach dem Tag, an dem die Eintragung der Verschmelzung in das Register des Sitzes desjenigen Rechtsträgers, dessen Gläubiger sie sind, nach § 19 Abs. 3 UmwG als bekannt gemacht gilt, ihren Anspruch nach Grund und Höhe schriftlich anmelden, Sicherheit zu leisten, soweit sie nicht Befriedigung verlangen können. Dieses Recht steht den Gläubigern jedoch nur zu, wenn sie glaubhaft machen, dass durch die Verschmelzung die Erfüllung ihrer Forderung gefährdet wird."
    },
    {
      "date": "2024-11-05",
      "id": "92497",
      "original_text": "Registerbekanntmachung nach dem Umwandlungsgesetz\nBayern Amtsgericht Fürth HRB 15038\nKnoWear Fashion GmbH – Langenzenn",
      "type": "Registerbekanntmachung nach dem Umwandlungsgesetz",
      "state": "Bayern",
      "amtsgericht": "Amtsgericht Fürth",
      "registernummer": "HRB 15038",
      "registerart": "HRB",
      "company_name": "KnoWear Fashion GmbH",
      "company_seat": "Langenzenn",
      "details": "05.11.2024 (Bekanntmachungsdatum)\n\nBayern Amtsgericht Fürth HRB 15038\nRegisterbekanntmachung nach dem Umwandlungsgesetz 04.11.2024 (Eintragungsdatum)\n\nKnoWear Fashion GmbH\nGesellschaft mit beschränkter Haftung\nLangenzenn\n\nDen Gläubigern der an der Verschmelzung beteiligten Rechtsträger ist, wenn sie binnen sechs Monaten nach dem Tag, an dem die Eintragung der Verschmelzung in das Register des Sitzes desjenigen Rechtsträgers, dessen Gläubiger sie sind, nach § 19 Abs. 3 UmwG als bekannt gemacht gilt, ihren Anspruch nach Grund und Höhe schriftlich anmelden, Sicherheit zu leisten, soweit sie nicht Befriedigung verlangen können. Dieses Recht steht den Gläubigern jedoch nur zu, wenn sie glaubhaft machen, dass durch die Verschmelzung die Erfüllung ihrer Forderung gefährdet wird."
    },
    {
      "date": "2024-11-05",
      "id": "92498",
      "original_text": "Registerbekanntmachung nach dem Umwandlungsgesetz\nBayern Amtsgericht Schweinfurt HRB 6392\nS & W GmbH – Strahlungen",
      "type": "Registerbekanntmachung nach dem Umwandlungsgesetz",
      "state": "Bayern",
      "amtsgericht": "Amtsgericht Schweinfurt",
      "registernummer": "HRB 6392",
      "registerart": "HRB",
      "company_name": "S & W GmbH",
      "company_seat": "Strahlungen",
      "details": "05.11.2024 (Bekanntmachungsdatum)\n\nBayern Amtsgericht Schweinfurt HRB 6392\nRegisterbekanntmachung nach dem Umwandlungsgesetz 04.11.2024 (Eintragungsdatum)\n\nS & W GmbH\nGesellschaft mit beschränkter Haftung\nStrahlungen\n\nDen Gläubigern der an der Verschmelzung beteiligten Rechtsträger ist, wenn sie binnen sechs Monaten nach dem Tag, an dem die Eintragung der Verschmelzung in das Register des Sitzes desjenigen Rechtsträgers, dessen Gläubiger sie sind, nach § 19 Abs. 3 UmwG als bekannt gemacht gilt, ihren Anspruch nach Grund und Höhe schriftlich anmelden, Sicherheit zu leisten, soweit sie nicht Befriedigung verlangen können. Dieses Recht steht den Gläubigern jedoch nur zu, wenn sie glaubhaft machen, dass durch die Verschmelzung die Erfüllung ihrer Forderung gefährdet wird."
    },
    {
      "date": "2024-11-05",
      "id": "92499",
      "original_text": "Löschungsankündigung\nBayern Amtsgericht München HRB 266978\nBasitex 1001 UG (haftungsbeschränkt) – Grünwald",
      "type": "Löschungsankündigung",
      "state": "Bayern",
      "amtsgericht": "Amtsgericht München",
      "registernummer": "HRB 266978",
      "registerart": "HRB",
      "company_name": "Basitex 1001 UG (haftungsbeschränkt)",
      "company_seat": "Grünwald",
      "details": "05.11.2024 (Bekanntmachungsdatum)\n\nBayern Amtsgericht München HRB 266978\nLöschungsankündigung\n\nBasitex 1001 UG (haftungsbeschränkt)\nGesellschaft mit beschränkter Haftung\nGrünwald\n\nDas Registergericht beabsichtigt, die im Handelsregister eingetragene Gesellschaft wegen Vermögenslosigkeit von Amts wegen nach § 394 FamFG zu löschen. Die Frist zur Erhebung eines Widerspruchs ist auf drei Monate festgesetzt."
    },
    {
      "date": "2024-11-05",
      "id": "92500",
      "original_text": "Löschungsankündigung\nBayern Amtsgericht München HRB 266010\nEmporium CAEMA GmbH – München",
      "type": "Löschungsankündigung",
      "state": "Bayern",
      "amtsgericht": "Amtsgericht München",
      "registernummer": "HRB 266010",
      "registerart": "HRB",
      "company_name": "Emporium CAEMA GmbH",
      "company_seat": "München",
      "details": "05.11.2024 (Bekanntmachungsdatum)\n\nBayern Amtsgericht München HRB 266010\nLöschungsankündigung 04.11.2024 (Eintragungsdatum)\n\nEmporium CAEMA GmbH\nGesellschaft mit beschränkter Haftung\nMünchen\n\nDas Registergericht beabsichtigt, die im Handelsregister eingetragene Gesellschaft wegen Vermögenslosigkeit von Amts wegen nach § 394 FamFG zu löschen. Die Frist zur Erhebung eines Widerspruchs ist auf drei Monate festgesetzt."
    },
    {
      "date": "2024-11-05",
      "id": "92501",
      "original_text": "Registerbekanntmachung nach dem Umwandlungsgesetz\nBayern Amtsgericht Nürnberg HRB 31700\nophono GmbH – Nürnberg",
      "type": "Registerbekanntmachung nach dem Umwandlungsgesetz",
      "state": "Bayern",
      "amtsgericht": "Amtsgericht Nürnberg",
      "registernummer": "HRB 31700",
      "registerart": "HRB",
      "company_name": "ophono GmbH",
      "company_seat": "Nürnberg",
      "details": "05.11.2024 (Bekanntmachungsdatum)\n\nBayern Amtsgericht Nürnberg HRB 31700\nRegisterbekanntmachung nach dem Umwandlungsgesetz 04.11.2024 (Eintragungsdatum)\n\nophono GmbH\nGesellschaft mit beschränkter Haftung\nNürnberg\n\nDen Gläubigern der an der Verschmelzung beteiligten Rechtsträger ist, wenn sie binnen sechs Monaten nach dem Tag, an dem die Eintragung der Verschmelzung in das Register des Sitzes desjenigen Rechtsträgers, dessen Gläubiger sie sind, nach § 19 Abs. 3 UmwG als bekannt gemacht gilt, ihren Anspruch nach Grund und Höhe schriftlich anmelden, Sicherheit zu leisten, soweit sie nicht Befriedigung verlangen können. Dieses Recht steht den Gläubigern jedoch nur zu, wenn sie glaubhaft machen, dass durch die Verschmelzung die Erfüllung ihrer Forderung gefährdet wird."
    },
    {
      "date": "2024-11-05",
      "id": "92502",
      "original_text": "Registerbekanntmachung nach dem Umwandlungsgesetz\nBayern Amtsgericht Nürnberg HRA 11659\nTucher Stiftung Grundstücksgesellschaft Simmelsdorf GmbH & Co. KG – Nürnberg",
      "type": "Registerbekanntmachung nach dem Umwandlungsgesetz",
      "state": "Bayern",
      "amtsgericht": "Amtsgericht Nürnberg",
      "registernummer": "HRA 11659",
      "registerart": "HRA",
      "company_name": "Tucher Stiftung Grundstücksgesellschaft Simmelsdorf GmbH & Co. KG",
      "company_seat": "Nürnberg",
      "details": "05.11.2024 (Bekanntmachungsdatum)\n\nBayern Amtsgericht Nürnberg HRA 11659\nRegisterbekanntmachung nach dem Umwandlungsgesetz 04.11.2024 (Eintragungsdatum)\n\nTucher Stiftung Grundstücksgesellschaft Simmelsdorf GmbH & Co. KG\nKommanditgesellschaft\nNürnberg\n\nDen Gläubigern der an der Verschmelzung beteiligten Rechtsträger ist, wenn sie binnen sechs Monaten nach dem Tag, an dem die Eintragung der Verschmelzung in das Register des Sitzes desjenigen Rechtsträgers, dessen Gläubiger sie sind, nach § 19 Abs. 3 UmwG als bekannt gemacht gilt, ihren Anspruch nach Grund und Höhe schriftlich anmelden, Sicherheit zu leisten, soweit sie nicht Befriedigung verlangen können. Dieses Recht steht den Gläubigern jedoch nur zu, wenn sie glaubhaft machen, dass durch die Verschmelzung die Erfüllung ihrer Forderung gefährdet wird."
    },
    {
      "date": "2024-11-05",
      "id": "92503",
      "original_text": "Löschungsankündigung\nBayern Amtsgericht München HRB 273610\nDreamfaster UG (haftungsbeschränkt) – Freising",
      "type": "Löschungsankündigung",
      "state": "Bayern",
      "amtsgericht": "Amtsgericht München",
      "registernummer": "HRB 273610",
      "registerart": "HRB",
      "company_name": "Dreamfaster UG (haftungsbeschränkt)",
      "company_seat": "Freising",
      "details": "05.11.2024 (Bekanntmachungsdatum)\n\nBayern Amtsgericht München HRB 273610\nLöschungsankündigung 04.11.2024 (Eintragungsdatum)\n\nDreamfaster UG (haftungsbeschränkt)\nGesellschaft mit beschränkter Haftung\nFreising\n\nDas Registergericht beabsichtigt, die im Handelsregister eingetragene Gesellschaft wegen Vermögenslosigkeit von Amts wegen nach § 394 FamFG zu löschen. Die Frist zur Erhebung eines Widerspruchs ist auf drei Monate festgesetzt."
    },
    {
      "date": "2024-11-05",
      "id": "92504",
      "original_text": "Löschungsankündigung\nBayern Amtsgericht München HRB 252642\nBrend GmbH – München",
      "type": "Löschungsankündigung",
      "state": "Bayern",
      "amtsgericht": "Amtsgericht München",
      "registernummer": "HRB 252642",
      "registerart": "HRB",
      "company_name": "Brend GmbH",
      "company_seat": "München",
      "details": "05.11.2024 (Bekanntmachungsdatum)\n\nBayern Amtsgericht München HRB 252642\nLöschungsankündigung 04.11.2024 (Eintragungsdatum)\n\nBrend GmbH\nGesellschaft mit beschränkter Haftung\nMünchen\n\nDas Registergericht beabsichtigt, die im Handelsregister eingetragene Gesellschaft wegen Vermögenslosigkeit von Amts wegen nach § 394 FamFG zu löschen. Die Frist zur Erhebung eines Widerspruchs ist auf drei Monate festgesetzt."
    },
    {
      "date": "2024-11-05",
      "id": "92505",
      "original_text": "Löschungsankündigung\nBayern Amtsgericht München HRB 272843\nAsteca Trade UG (haftungsbeschränkt) – München",
      "type": "Löschungsankündigung",
      "state": "Bayern",
      "amtsgericht": "Amtsgericht München",
      "registernummer": "HRB 272843",
      "registerart": "HRB",
      "company_name": "Asteca Trade UG (haftungsbeschränkt)",
      "company_seat": "München",
      "details": "05.11.2024 (Bekanntmachungsdatum)\n\nBayern Amtsgericht München HRB 272843\nLöschungsankündigung 04.11.2024 (Eintragungsdatum)\n\nAsteca Trade UG (haftungsbeschränkt)\nGesellschaft mit beschränkter Haftung\nMünchen\n\nDas Registergericht beabsichtigt, die im Handelsregister eingetragene Gesellschaft wegen Vermögenslosigkeit von Amts wegen nach § 394 FamFG zu löschen. Die Frist zur Erhebung eines Widerspruchs ist auf drei Monate festgesetzt."
    },
    {
      "date": "2024-11-05",
      "id": "92506",
      "original_text": "Löschungsankündigung\nBayern Amtsgericht München HRB 206713\n2Y MEDIA GmbH – München",
      "type": "Löschungsankündigung",
      "state": "Bayern",
      "amtsgericht": "Amtsgericht München",
      "registernummer": "HRB 206713",
      "registerart": "HRB",
      "company_name": "2Y MEDIA GmbH",
      "company_seat": "München",
      "details": "05.11.2024 (Bekanntmachungsdatum)\n\nBayern Amtsgericht München HRB 206713\nLöschungsankündigung 04.11.2024 (Eintragungsdatum)\n\n2Y MEDIA GmbH\nGesellschaft mit beschränkter Haftung\nMünchen\n\nDas Registergericht beabsichtigt, die im Handelsregister eingetragene Gesellschaft wegen Vermögenslosigkeit von Amts wegen nach § 394 FamFG zu löschen. Die Frist zur Erhebung eines Widerspruchs ist auf drei Monate festgesetzt."
    },
    {
      "date": "2024-11-05",
      "id": "92507",
      "original_text": "Registerbekanntmachung nach dem Umwandlungsgesetz\nBayern Amtsgericht Aschaffenburg HRB 8217\nIVG - Immobilien-Verwaltungs-Gesellschaft Amorbach mbH – Amorbach",
      "type": "Registerbekanntmachung nach dem Umwandlungsgesetz",
      "state": "Bayern",
      "amtsgericht": "Amtsgericht Aschaffenburg",
      "registernummer": "HRB 8217",
      "registerart": "HRB",
      "company_name": "IVG - Immobilien-Verwaltungs-Gesellschaft Amorbach mbH",
      "company_seat": "Amorbach",
      "details": "05.11.2024 (Bekanntmachungsdatum)\n\nBayern Amtsgericht Aschaffenburg HRB 8217\nRegisterbekanntmachung nach dem Umwandlungsgesetz 04.11.2024 (Eintragungsdatum)\n\nIVG - Immobilien-Verwaltungs-Gesellschaft Amorbach mbH\nGesellschaft mit beschränkter Haftung\nAmorbach\n\nDen Gläubigern der an der Ausgliederung beteiligten Rechtsträger ist, wenn sie binnen sechs Monaten nach dem Tag, an dem die Eintragung der Ausgliederung in das Register des Sitzes desjenigen Rechtsträgers, dessen Gläubiger sie sind, nach §§ 125, 19 Abs. 3 UmwG als bekannt gemacht gilt, ihren Anspruch nach Grund und Höhe schriftlich anmelden, Sicherheit zu leisten, soweit sie nicht Befriedigung verlangen können. Dieses Recht steht den Gläubigern jedoch nur zu, wenn sie glaubhaft machen, dass durch die Ausgliederung die Erfüllung ihrer Forderung gefährdet wird."
    },
    {
      "date": "2024-11-05",
      "id": "92508",
      "original_text": "Registerbekanntmachung nach dem Umwandlungsgesetz\nBayern Amtsgericht Nürnberg HRA 15995\nTucher Stiftung Wohnen GmbH & Co. KG – Nürnberg",
      "type": "Registerbekanntmachung nach dem Umwandlungsgesetz",
      "state": "Bayern",
      "amtsgericht": "Amtsgericht Nürnberg",
      "registernummer": "HRA 15995",
      "registerart": "HRA",
      "company_name": "Tucher Stiftung Wohnen GmbH & Co. KG",
      "company_seat": "Nürnberg",
      "details": "05.11.2024 (Bekanntmachungsdatum)\n\nBayern Amtsgericht Nürnberg HRA 15995\nRegisterbekanntmachung nach dem Umwandlungsgesetz 04.11.2024 (Eintragungsdatum)\n\nTucher Stiftung Wohnen GmbH & Co. KG\nKommanditgesellschaft\nNürnberg\n\nDen Gläubigern der an der Verschmelzung beteiligten Rechtsträger ist, wenn sie binnen sechs Monaten nach dem Tag, an dem die Eintragung der Verschmelzung in das Register des Sitzes desjenigen Rechtsträgers, dessen Gläubiger sie sind, nach § 19 Abs. 3 UmwG als bekannt gemacht gilt, ihren Anspruch nach Grund und Höhe schriftlich anmelden, Sicherheit zu leisten, soweit sie nicht Befriedigung verlangen können. Dieses Recht steht den Gläubigern jedoch nur zu, wenn sie glaubhaft machen, dass durch die Verschmelzung die Erfüllung ihrer Forderung gefährdet wird."
    },
    {
      "date": "2024-11-05",
      "id": "92509",
      "original_text": "Registerbekanntmachung nach dem Umwandlungsgesetz\nBayern Amtsgericht Nürnberg HRB 42846\nDGbAV - Deutsche Gesellschaft für betriebliche Altersversorgung AG – Nürnberg",
      "type": "Registerbekanntmachung nach dem Umwandlungsgesetz",
      "state": "Bayern",
      "amtsgericht": "Amtsgericht Nürnberg",
      "registernummer": "HRB 42846",
      "registerart": "HRB",
      "company_name": "DGbAV - Deutsche Gesellschaft für betriebliche Altersversorgung AG",
      "company_seat": "Nürnberg",
      "details": "05.11.2024 (Bekanntmachungsdatum)\n\nBayern Amtsgericht Nürnberg HRB 42846\nRegisterbekanntmachung nach dem Umwandlungsgesetz 04.11.2024 (Eintragungsdatum)\n\nDGbAV - Deutsche Gesellschaft für betriebliche Altersversorgung AG\nAktiengesellschaft\nNürnberg\n\nDen Gläubigern der an der Verschmelzung beteiligten Rechtsträger ist, wenn sie binnen sechs Monaten nach dem Tag, an dem die Eintragung der Verschmelzung in das Register des Sitzes desjenigen Rechtsträgers, dessen Gläubiger sie sind, nach § 19 Abs. 3 UmwG als bekannt gemacht gilt, ihren Anspruch nach Grund und Höhe schriftlich anmelden, Sicherheit zu leisten, soweit sie nicht Befriedigung verlangen können. Dieses Recht steht den Gläubigern jedoch nur zu, wenn sie glaubhaft machen, dass durch die Verschmelzung die Erfüllung ihrer Forderung gefährdet wird."
    },
    {
      "date": "2024-11-05",
      "id": "92510",
      "original_text": "Einreichung neuer Dokumente\nBayern Amtsgericht Ingolstadt HRB 9891\nConti Temic microelectronic GmbH – Ingolstadt",
      "type": "Einreichung neuer Dokumente",
      "state": "Bayern",
      "amtsgericht": "Amtsgericht Ingolstadt",
      "registernummer": "HRB 9891",
      "registerart": "HRB",
      "company_name": "Conti Temic microelectronic GmbH",
      "company_seat": "Ingolstadt",
      "details": "05.11.2024 (Bekanntmachungsdatum)\n\nBayern Amtsgericht Ingolstadt HRB 9891\nEinreichung neuer Dokumente\n\nConti Temic microelectronic GmbH\nGesellschaft mit beschränkter Haftung\nIngolstadt\n\nDem Amtsgericht Ingolstadt -Registergericht- ist eine Liste der Mitglieder des Aufsichtsrats eingereicht worden, § 52 Abs. 3 S. 2 GmbHG."
    },
    {
      "date": "2024-11-05",
      "id": "92511",
      "original_text": "Einreichung neuer Dokumente\nBayern Amtsgericht Regensburg HRB 19340\nKaufmela GmbH – Regensburg",
      "type": "Einreichung neuer Dokumente",
      "state": "Bayern",
      "amtsgericht": "Amtsgericht Regensburg",
      "registernummer": "HRB 19340",
      "registerart": "HRB",
      "company_name": "Kaufmela GmbH",
      "company_seat": "Regensburg",
      "details": "05.11.2024 (Bekanntmachungsdatum)\n\nBayern Amtsgericht Regensburg HRB 19340\nEinreichung neuer Dokumente 04.11.2024 (Eintragungsdatum)\n\nKaufmela GmbH\nGesellschaft mit beschränkter Haftung\nRegensburg\n\nDem Amtsgericht Regensburg -Registergericht- ist eine Liste der Mitglieder des Aufsichtsrats eingereicht worden, § 52 Abs. 3 S. 2 GmbHG."
    },
    {
      "date": "2024-11-05",
      "id": "92512",
      "original_text": "Löschungsankündigung\nBayern Amtsgericht München HRB 229809\nCeres Games GmbH – München",
      "type": "Löschungsankündigung",
      "state": "Bayern",
      "amtsgericht": "Amtsgericht München",
      "registernummer": "HRB 229809",
      "registerart": "HRB",
      "company_name": "Ceres Games GmbH",
      "company_seat": "München",
      "details": "05.11.2024 (Bekanntmachungsdatum)\n\nBayern Amtsgericht München HRB 229809\nLöschungsankündigung 04.11.2024 (Eintragungsdatum)\n\nCeres Games GmbH\nGesellschaft mit beschränkter Haftung\nMünchen\n\nDas Registergericht beabsichtigt, die im Handelsregister eingetragene Gesellschaft wegen Vermögenslosigkeit von Amts wegen nach § 394 FamFG zu löschen. Die Frist zur Erhebung eines Widerspruchs ist auf drei Monate festgesetzt."
    },
    {
      "date": "2024-11-05",
      "id": "92513",
      "original_text": "Löschungsankündigung\nBayern Amtsgericht München HRA 82160\nBIM Fondsverwaltungsgesellschaft mbH & Co. München/Holzkirchen KG – Holzkirchen",
      "type": "Löschungsankündigung",
      "state": "Bayern",
      "amtsgericht": "Amtsgericht München",
      "registernummer": "HRA 82160",
      "registerart": "HRA",
      "company_name": "BIM Fondsverwaltungsgesellschaft mbH & Co. München/Holzkirchen KG",
      "company_seat": "Holzkirchen",
      "details": "05.11.2024 (Bekanntmachungsdatum)\n\nBayern Amtsgericht München HRA 82160\nLöschungsankündigung 04.11.2024 (Eintragungsdatum)\n\nBIM Fondsverwaltungsgesellschaft mbH & Co. München/Holzkirchen KG\nKommanditgesellschaft\nHolzkirchen\n\nDas Registergericht beabsichtigt, die im Handelsregister eingetragene Firma von Amts wegen nach § 31 Abs. 2 HGB zu löschen. Die Frist zur Erhebung eines Widerspruchs ist auf 2 Monate festgesetzt."
    },
    {
      "date": "2024-11-05",
      "id": "92514",
      "original_text": "Registerbekanntmachung nach dem Umwandlungsgesetz\nBayern Amtsgericht Nürnberg HRB 43420\nDG-Gruppe Beratung und Betreuung GmbH – Nürnberg",
      "type": "Registerbekanntmachung nach dem Umwandlungsgesetz",
      "state": "Bayern",
      "amtsgericht": "Amtsgericht Nürnberg",
      "registernummer": "HRB 43420",
      "registerart": "HRB",
      "company_name": "DG-Gruppe Beratung und Betreuung GmbH",
      "company_seat": "Nürnberg",
      "details": "05.11.2024 (Bekanntmachungsdatum)\n\nBayern Amtsgericht Nürnberg HRB 43420\nRegisterbekanntmachung nach dem Umwandlungsgesetz 04.11.2024 (Eintragungsdatum)\n\nDG-Gruppe Beratung und Betreuung GmbH\nGesellschaft mit beschränkter Haftung\nNürnberg\n\nDen Gläubigern der an der Verschmelzung beteiligten Rechtsträger ist, wenn sie binnen sechs Monaten nach dem Tag, an dem die Eintragung der Verschmelzung in das Register des Sitzes desjenigen Rechtsträgers, dessen Gläubiger sie sind, nach § 19 Abs. 3 UmwG als bekannt gemacht gilt, ihren Anspruch nach Grund und Höhe schriftlich anmelden, Sicherheit zu leisten, soweit sie nicht Befriedigung verlangen können. Dieses Recht steht den Gläubigern jedoch nur zu, wenn sie glaubhaft machen, dass durch die Verschmelzung die Erfüllung ihrer Forderung gefährdet wird."
    },
    {
      "date": "2024-11-05",
      "id": "92515",
      "original_text": "Registerbekanntmachung nach dem Umwandlungsgesetz\nBayern Amtsgericht Nürnberg HRB 28189\nDeufol Nürnberg GmbH – Nürnberg",
      "type": "Registerbekanntmachung nach dem Umwandlungsgesetz",
      "state": "Bayern",
      "amtsgericht": "Amtsgericht Nürnberg",
      "registernummer": "HRB 28189",
      "registerart": "HRB",
      "company_name": "Deufol Nürnberg GmbH",
      "company_seat": "Nürnberg",
      "details": "05.11.2024 (Bekanntmachungsdatum)\n\nBayern Amtsgericht Nürnberg HRB 28189\nRegisterbekanntmachung nach dem Umwandlungsgesetz 04.11.2024 (Eintragungsdatum)\n\nDeufol Nürnberg GmbH\nGesellschaft mit beschränkter Haftung\nNürnberg\n\nDen Gläubigern der an der Verschmelzung beteiligten Rechtsträger ist, wenn sie binnen sechs Monaten nach dem Tag, an dem die Eintragung der Verschmelzung in das Register des Sitzes desjenigen Rechtsträgers, dessen Gläubiger sie sind, nach § 19 Abs. 3 UmwG als bekannt gemacht gilt, ihren Anspruch nach Grund und Höhe schriftlich anmelden, Sicherheit zu leisten, soweit sie nicht Befriedigung verlangen können. Dieses Recht steht den Gläubigern jedoch nur zu, wenn sie glaubhaft machen, dass durch die Verschmelzung die Erfüllung ihrer Forderung gefährdet wird."
    },
    {
      "date": "2024-11-05",
      "id": "92516",
      "original_text": "Registerbekanntmachung nach dem Umwandlungsgesetz\nBayern Amtsgericht München HRB 248178\nGBA - Global Brand Activation GmbH – München",
      "type": "Registerbekanntmachung nach dem Umwandlungsgesetz",
      "state": "Bayern",
      "amtsgericht": "Amtsgericht München",
      "registernummer": "HRB 248178",
      "registerart": "HRB",
      "company_name": "GBA - Global Brand Activation GmbH",
      "company_seat": "München",
      "details": "05.11.2024 (Bekanntmachungsdatum)\n\nBayern Amtsgericht München HRB 248178\nRegisterbekanntmachung nach dem Umwandlungsgesetz 04.11.2024 (Eintragungsdatum)\n\nGBA - Global Brand Activation GmbH\nGesellschaft mit beschränkter Haftung\nMünchen\n\nDen Gläubigern der an der Verschmelzung beteiligten Rechtsträger ist, wenn sie binnen sechs Monaten nach dem Tag, an dem die Eintragung der Verschmelzung in das Register des Sitzes desjenigen Rechtsträgers, dessen Gläubiger sie sind, nach § 19 Abs. 3 UmwG als bekannt gemacht gilt, ihren Anspruch nach Grund und Höhe schriftlich anmelden, Sicherheit zu leisten, soweit sie nicht Befriedigung verlangen können. Dieses Recht steht den Gläubigern jedoch nur zu, wenn sie glaubhaft machen, dass durch die Verschmelzung die Erfüllung ihrer Forderung gefährdet wird."
    },
    {
      "date": "2024-11-05",
      "id": "92517",
      "original_text": "Sonstige Registerbekanntmachung\nBaden-Württemberg Amtsgericht Mannheim HRB 106389\nVAMED Rehazentrum Karlsruhe GmbH – Karlsruhe",
      "type": "Sonstige Registerbekanntmachung",
      "state": "Baden-Württemberg",
      "amtsgericht": "Amtsgericht Mannheim",
      "registernummer": "HRB 106389",
      "registerart": "HRB",
      "company_name": "VAMED Rehazentrum Karlsruhe GmbH",
      "company_seat": "Karlsruhe",
      "details": "05.11.2024 (Bekanntmachungsdatum)\n\nBaden-Württemberg Amtsgericht Mannheim HRB 106389\nSonstige Registerbekanntmachung 05.11.2024 (Eintragungsdatum)\n\nVAMED Rehazentrum Karlsruhe GmbH\nGesellschaft mit beschränkter Haftung\nKarlsruhe\n\nAls nicht eingetragen wird bekanntgemacht:\nDen Gläubigern der Gesellschaft, deren Forderungen begründet worden sind, bevor die Eintragung der Beendigung des Vertrages in das Handelsregister nach § 10 HGB als bekanntgemacht gilt, ist vom anderen Vertragsteil Sicherheit zu leisten, wenn sie sich binnen sechs Monaten nach der Bekanntmachung zu diesem Zweck bei ihm melden."
    },
    {
      "date": "2024-11-05",
      "id": "92518",
      "original_text": "Löschungsankündigung\nBaden-Württemberg Amtsgericht Stuttgart HRA 320224\nPB Immobilienabwicklungsgesellschaft GmbH & Co. KG – Brackenheim",
      "type": "Löschungsankündigung",
      "state": "Baden-Württemberg",
      "amtsgericht": "Amtsgericht Stuttgart",
      "registernummer": "HRA 320224",
      "registerart": "HRA",
      "company_name": "PB Immobilienabwicklungsgesellschaft GmbH & Co. KG",
      "company_seat": "Brackenheim",
      "details": "05.11.2024 (Bekanntmachungsdatum)\n\nBaden-Württemberg Amtsgericht Stuttgart HRA 320224\nLöschungsankündigung\n\nPB Immobilienabwicklungsgesellschaft GmbH & Co. KG\nKommanditgesellschaft\nBrackenheim\n\nAls nicht eingetragen wird bekanntgemacht:\nDas Gericht beabsichtigt, die Gesellschaft wegen Vermögenslosigkeit im Handelsregister von Amts wegen nach § 394 FamFG zu löschen. Die Frist zur Geltendmachung eines Widerspruchs gegen die beabsichtigte Löschung ist auf zwei Monate ab Veröffentlichung bestimmt."
    },
    {
      "date": "2024-11-05",
      "id": "92519",
      "original_text": "Löschungsankündigung\nSchleswig-Holstein Amtsgericht Lübeck HRA 237 EU\nWerner Grimm Metallbau – Bockholt/Gemeinde Süsel",
      "type": "Löschungsankündigung",
      "state": "Schleswig-Holstein",
      "amtsgericht": "Amtsgericht Lübeck",
      "registernummer": "HRA 237 EU",
      "registerart": "HRA",
      "company_name": "Werner Grimm Metallbau",
      "company_seat": "Bockholt/Gemeinde Süsel",
      "details": "05.11.2024 (Bekanntmachungsdatum)\n\nSchleswig-Holstein Amtsgericht Lübeck HRA 237 EU\nLöschungsankündigung\n\nWerner Grimm Metallbau\nEinzelkaufmann / Einzelkauffrau\nBockholt/Gemeinde Süsel\n\nBei der nachstehenden Firma wird das Amtslöschungsverfahren gemäß § 31 Abs. 2 HGB eingeleitet."
    },
    {
      "date": "2024-11-05",
      "id": "92520",
      "original_text": "Registerbekanntmachung nach dem Umwandlungsgesetz\nSchleswig-Holstein Amtsgericht Pinneberg VR 1074\nBerufliche Bildung im Deutschen Hausfrauen-Bund e.V. – Pinneberg",
      "type": "Registerbekanntmachung nach dem Umwandlungsgesetz",
      "state": "Schleswig-Holstein",
      "amtsgericht": "Amtsgericht Pinneberg",
      "registernummer": "VR 1074",
      "registerart": "VR",
      "company_name": "Berufliche Bildung im Deutschen Hausfrauen-Bund e.V.",
      "company_seat": "Pinneberg",
      "details": "05.11.2024 (Bekanntmachungsdatum)\n\nSchleswig-Holstein Amtsgericht Pinneberg VR 1074\nRegisterbekanntmachung nach dem Umwandlungsgesetz 04.11.2024 (Eintragungsdatum)\n\nBerufliche Bildung im Deutschen Hausfrauen-Bund e.V.\neingetragener Verein\nPinneberg\n\nZu Eintragungsnummer 4 vom 04.11.2024 wird als nicht eingetragen veröffentlicht: Als nicht eingetragen wird veröffentlicht: Den Gläubigern ist, wenn sie binnen sechs Monaten nach dem Tag, an dem die Eintragung der Umwandlung als bekannt gemacht gilt, ihren Anspruch nach Grund und Höhe schriftlich anmelden, Sicherheit zu leisten, soweit sie nicht Befriedigung verlangen können. Dieses Recht steht den Gläubigern jedoch nur zu, wenn sie glaubhaft machen, dass durch die Umwandlung die Erfüllung ihrer Forderung gefährdet wird. Das Recht, Sicherheitsleistung zu verlangen, steht Gläubigern nicht zu, die im Falle der Insolvenz ein Recht auf vorzugsweise Befriedigung aus einer Deckungsmasse haben, die nach gesetzlicher Vorschrift zu ihrem Schutz errichtet und staatlich überwacht ist."
    },
    {
      "date": "2024-11-05",
      "id": "92521",
      "original_text": "Sonstige Registerbekanntmachung\nBrandenburg Amtsgericht Neuruppin HRB 12022\nLSO Life Science Oberhavel GmbH – Hennigsdorf",
      "type": "Sonstige Registerbekanntmachung",
      "state": "Brandenburg",
      "amtsgericht": "Amtsgericht Neuruppin",
      "registernummer": "HRB 12022",
      "registerart": "HRB",
      "company_name": "LSO Life Science Oberhavel GmbH",
      "company_seat": "Hennigsdorf",
      "details": "05.11.2024 (Bekanntmachungsdatum)\n\nBrandenburg Amtsgericht Neuruppin HRB 12022\nSonstige Registerbekanntmachung\n\nLSO Life Science Oberhavel GmbH\nGesellschaft mit beschränkter Haftung\nHennigsdorf\n\nAls nicht eingetragen wird veröffentlicht: Eine Liste der Mitglieder des Aufsichtsrates wurde zum Handelsregister eingereicht."
    },
    {
      "date": "2024-11-05",
      "id": "92522",
      "original_text": "Löschungsankündigung\nSaarland Amtsgericht Saarbrücken HRB 101170\nElektro-EDV Uwe Brandstetter UG (haftungsbeschränkt) – Spiesen-Elversberg",
      "type": "Löschungsankündigung",
      "state": "Saarland",
      "amtsgericht": "Amtsgericht Saarbrücken",
      "registernummer": "HRB 101170",
      "registerart": "HRB",
      "company_name": "Elektro-EDV Uwe Brandstetter UG (haftungsbeschränkt)",
      "company_seat": "Spiesen-Elversberg",
      "details": "05.11.2024 (Bekanntmachungsdatum)\n\nSaarland Amtsgericht Saarbrücken HRB 101170\nLöschungsankündigung\n\nElektro-EDV Uwe Brandstetter UG (haftungsbeschränkt)\nGesellschaft mit beschränkter Haftung\nSpiesen-Elversberg\n\nEs ist beabsichtigt, die Gesellschaft von Amts wegen gemäß § 394 FamFG wegen Vermögenslosigkeit zu löschen.\nGegen die Löschung von Amts wegen ist das Rechtsmittel des Widerspruchs statthaft. Der Widerspruch ist binnen einer Frist drei Monaten beginnend mit dem Tag dieser Veröffentlichung durch Einreichen eines Widerspruchsschreibens -schriftlich oder zur Niederschrift der Geschäftsstelle beim Amtsgericht Saarbrücken, -zentrales Handelsregister-, Mainzerstr.178, 66121 Saarbrücken einzulegen.\nDer Widerspruch muss die Bezeichnung der angefochtenen Löschungsankündigung enthalten sowie die Erklärung, dass Widerspruch eingelegt wird. Er ist vom Widerspruchsführer oder seinem Bevollmächtigten zu unterzeichnen.\nDas Widerspruchsschreiben kann auch in der Form eines elektronischen Dokumentes eingereicht werden, das mit einer qualifizierten elektronischen Signatur nach dem Signaturgesetz versehen sein muss (§§ 14 Abs. 2 FamFG, 130a, 298 ZPO)."
    },
    {
      "date": "2024-11-05",
      "id": "92523",
      "original_text": "Registerbekanntmachung nach dem Umwandlungsgesetz\nBaden-Württemberg Amtsgericht Freiburg HRB 729089\nKammerer Gewindetechnik GmbH – Hornberg",
      "type": "Registerbekanntmachung nach dem Umwandlungsgesetz",
      "state": "Baden-Württemberg",
      "amtsgericht": "Amtsgericht Freiburg",
      "registernummer": "HRB 729089",
      "registerart": "HRB",
      "company_name": "Kammerer Gewindetechnik GmbH",
      "company_seat": "Hornberg",
      "details": "05.11.2024 (Bekanntmachungsdatum)\n\nBaden-Württemberg Amtsgericht Freiburg HRB 729089\nRegisterbekanntmachung nach dem Umwandlungsgesetz 05.11.2024 (Eintragungsdatum)\n\nKammerer Gewindetechnik GmbH\nGesellschaft mit beschränkter Haftung\nHornberg\n\nAls nicht eingetragen wird bekanntgemacht:\nDen Gläubigern des an dem Formwechsel beteiligten Rechtsträgers ist, wenn sie binnen sechs Monaten nach dem Tag, an dem die Eintragung des Formwechsels in das Register des Sitzes desjenigen Rechtsträgers, dessen Gläubiger sie sind, nach § 19 Abs. 3 UmwG als bekanntgemacht gilt, ihren Anspruch nach Grund und Höhe schriftlich anmelden, Sicherheit zu leisten, soweit sie nicht Befriedigung verlangen können. Dieses Recht steht den Gläubigern jedoch nur zu, wenn sie glaubhaft machen, dass durch den Formwechsel die Erfüllung ihrer Forderung gefährdet wird."
    },
    {
      "date": "2024-11-05",
      "id": "92524",
      "original_text": "Registerbekanntmachung nach dem Umwandlungsgesetz\nSachsen-Anhalt Amtsgericht Stendal HRB 21228\nSauenhaltung Glöthe GmbH – Staßfurt",
      "type": "Registerbekanntmachung nach dem Umwandlungsgesetz",
      "state": "Sachsen-Anhalt",
      "amtsgericht": "Amtsgericht Stendal",
      "registernummer": "HRB 21228",
      "registerart": "HRB",
      "company_name": "Sauenhaltung Glöthe GmbH",
      "company_seat": "Staßfurt",
      "details": "05.11.2024 (Bekanntmachungsdatum)\n\nSachsen-Anhalt Amtsgericht Stendal HRB 21228\nRegisterbekanntmachung nach dem Umwandlungsgesetz 05.11.2024 (Eintragungsdatum)\n\nSauenhaltung Glöthe GmbH\nGesellschaft mit beschränkter Haftung\nStaßfurt\n\nNicht eingetragen:\nDen Gläubigern der an der Verschmelzung beteiligten Rechtsträger ist, wenn sie binnen sechs Monaten nach dem Tag, an dem die Eintragung der Verschmelzung nach § 19 Abs. 3 UmwG als bekanntgemacht gilt, ihren Anspruch nach Grund und Höhe schriftlich anmelden, Sicherheit zu leisten, soweit sie nicht Befriedigung verlangen können. Dieses Recht steht ihnen jedoch nur zu, wenn sie glaubhaft machen, dass durch die Verschmelzung die Erfüllung ihrer Forderung gefährdet wird."
    },
    {
      "date": "2024-11-05",
      "id": "92525",
      "original_text": "Registerbekanntmachung nach dem Umwandlungsgesetz\nSachsen-Anhalt Amtsgericht Stendal HRB 21279\nFerkelaufzucht Glöthe GmbH – Staßfurt",
      "type": "Registerbekanntmachung nach dem Umwandlungsgesetz",
      "state": "Sachsen-Anhalt",
      "amtsgericht": "Amtsgericht Stendal",
      "registernummer": "HRB 21279",
      "registerart": "HRB",
      "company_name": "Ferkelaufzucht Glöthe GmbH",
      "company_seat": "Staßfurt",
      "details": "05.11.2024 (Bekanntmachungsdatum)\n\nSachsen-Anhalt Amtsgericht Stendal HRB 21279\nRegisterbekanntmachung nach dem Umwandlungsgesetz 05.11.2024 (Eintragungsdatum)\n\nFerkelaufzucht Glöthe GmbH\nGesellschaft mit beschränkter Haftung\nStaßfurt\n\nNicht eingetragen:\nDen Gläubigern der an der Verschmelzung beteiligten Rechtsträger ist, wenn sie binnen sechs Monaten nach dem Tag, an dem die Eintragung der Verschmelzung nach § 19 Abs. 3 UmwG als bekanntgemacht gilt, ihren Anspruch nach Grund und Höhe schriftlich anmelden, Sicherheit zu leisten, soweit sie nicht Befriedigung verlangen können. Dieses Recht steht ihnen jedoch nur zu, wenn sie glaubhaft machen, dass durch die Verschmelzung die Erfüllung ihrer Forderung gefährdet wird."
    },
    {
      "date": "2024-11-05",
      "id": "92526",
      "original_text": "Einreichung neuer Dokumente\nMecklenburg-Vorpommern Amtsgericht Neubrandenburg HRB 3302\n\"Wohnungsbaugesellschaft Pasewalk GmbH\" – Pasewalk",
      "type": "Einreichung neuer Dokumente",
      "state": "Mecklenburg-Vorpommern",
      "amtsgericht": "Amtsgericht Neubrandenburg",
      "registernummer": "HRB 3302",
      "registerart": "HRB",
      "company_name": "\"Wohnungsbaugesellschaft Pasewalk GmbH\"",
      "company_seat": "Pasewalk",
      "details": "05.11.2024 (Bekanntmachungsdatum)\n\nMecklenburg-Vorpommern Amtsgericht Neubrandenburg HRB 3302\nEinreichung neuer Dokumente\n\n\"Wohnungsbaugesellschaft Pasewalk GmbH\"\nGesellschaft mit beschränkter Haftung\nPasewalk\n\nEine Liste der Mitglieder des Aufsichtsrats ist zum Handelsregister eingereicht worden."
    },
    {
      "date": "2024-11-05",
      "id": "92527",
      "original_text": "Registerbekanntmachung nach dem Umwandlungsgesetz\nBaden-Württemberg Amtsgericht Freiburg HRB 729123\nSchober Investment Group GmbH – Singen Hohentwiel",
      "type": "Registerbekanntmachung nach dem Umwandlungsgesetz",
      "state": "Baden-Württemberg",
      "amtsgericht": "Amtsgericht Freiburg",
      "registernummer": "HRB 729123",
      "registerart": "HRB",
      "company_name": "Schober Investment Group GmbH",
      "company_seat": "Singen Hohentwiel",
      "details": "05.11.2024 (Bekanntmachungsdatum)\n\nBaden-Württemberg Amtsgericht Freiburg HRB 729123\nRegisterbekanntmachung nach dem Umwandlungsgesetz 05.11.2024 (Eintragungsdatum)\n\nSchober Investment Group GmbH\nGesellschaft mit beschränkter Haftung\nSingen Hohentwiel\n\nAls nicht eingetragen wird bekanntgemacht:\nDen Gläubigern der an der Verschmelzung beteiligten Rechtsträger (Schober Investment Group GmbH, Singen Hohentwiel und Red Rocket Investment GmbH, Singen Hohentwiel)  ist, wenn sie binnen sechs Monaten nach dem Tag, an dem die Eintragung der Verschmelzung in das Register des Sitzes desjenigen Rechtsträgers, dessen Gläubiger sie sind, nach § 19 Abs. 3 UmwG als bekanntgemacht gilt, ihren Anspruch nach Grund und Höhe schriftlich anmelden, Sicherheit zu leisten, soweit sie nicht Befriedigung verlangen können. Dieses Recht steht den Gläubigern jedoch nur zu, wenn sie glaubhaft machen, dass durch die Verschmelzung die Erfüllung ihrer Forderung gefährdet wird."
    },
    {
      "date": "2024-11-05",
      "id": "92528",
      "original_text": "Registerbekanntmachung nach dem Umwandlungsgesetz\nBerlin Amtsgericht Berlin (Charlottenburg) HRB 103576\nEuropean IT Consultancy EITCO GmbH – Berlin",
      "type": "Registerbekanntmachung nach dem Umwandlungsgesetz",
      "state": "Berlin",
      "amtsgericht": "Amtsgericht Berlin (Charlottenburg)",
      "registernummer": "HRB 103576",
      "registerart": "HRB",
      "company_name": "European IT Consultancy EITCO GmbH",
      "company_seat": "Berlin",
      "details": "05.11.2024 (Bekanntmachungsdatum)\n\nBerlin Amtsgericht Berlin (Charlottenburg) HRB 103576\nRegisterbekanntmachung nach dem Umwandlungsgesetz 04.11.2024 (Eintragungsdatum)\n\nEuropean IT Consultancy EITCO GmbH\nGesellschaft mit beschränkter Haftung\nBerlin\n\nZu Eintragungsnummer 18 vom 04.11.2024 wird als nicht eingetragen veröffentlicht: Den Gläubigern der an der Verschmelzung beteiligten Rechtsträger ist, wenn sie binnen sechs Monaten nach dem Tag, an dem die Eintragung der Verschmelzung in das Register des Sitzes desjenigen Rechtsträgers, dessen Gläubiger sie sind, als bekannt gemacht gilt, ihren Anspruch nach Grund und Höhe schriftlich anmelden, Sicherheit zu leisten, soweit sie nicht Befriedigung verlangen können. Dieses Recht steht den Gläubigern jedoch nur zu, wenn sie glaubhaft machen, dass durch die Verschmelzung die Erfüllung ihrer Forderung gefährdet wird. Das Recht, Sicherheitsleistung zu verlangen, steht Gläubigern nicht zu, die im Falle der Insolvenz ein Recht auf vorzugsweise Befriedigung aus einer Deckungsmasse haben, die nach gesetzlicher Vorschrift zu ihrem Schutz errichtet und staatlich überwacht ist."
    },
    {
      "date": "2024-11-05",
      "id": "92529",
      "original_text": "Registerbekanntmachung nach dem Umwandlungsgesetz\nBerlin Amtsgericht Berlin (Charlottenburg) HRB 175592\nCLICKVALID GmbH – Berlin",
      "type": "Registerbekanntmachung nach dem Umwandlungsgesetz",
      "state": "Berlin",
      "amtsgericht": "Amtsgericht Berlin (Charlottenburg)",
      "registernummer": "HRB 175592",
      "registerart": "HRB",
      "company_name": "CLICKVALID GmbH",
      "company_seat": "Berlin",
      "details": "05.11.2024 (Bekanntmachungsdatum)\n\nBerlin Amtsgericht Berlin (Charlottenburg) HRB 175592\nRegisterbekanntmachung nach dem Umwandlungsgesetz 04.11.2024 (Eintragungsdatum)\n\nCLICKVALID GmbH\nGesellschaft mit beschränkter Haftung\nBerlin\n\nZu Eintragungsnummer 8 vom 04.11.2024 wird als nicht eingetragen veröffentlicht: Den Gläubigern der an der Verschmelzung beteiligten Rechtsträger ist, wenn sie binnen sechs Monaten nach dem Tag, an dem die Eintragung der Verschmelzung in das Register des Sitzes desjenigen Rechtsträgers, dessen Gläubiger sie sind, als bekannt gemacht gilt, ihren Anspruch nach Grund und Höhe schriftlich anmelden, Sicherheit zu leisten, soweit sie nicht Befriedigung verlangen können. Dieses Recht steht den Gläubigern jedoch nur zu, wenn sie glaubhaft machen, dass durch die Verschmelzung die Erfüllung ihrer Forderung gefährdet wird. Das Recht, Sicherheitsleistung zu verlangen, steht Gläubigern nicht zu, die im Falle der Insolvenz ein Recht auf vorzugsweise Befriedigung aus einer Deckungsmasse haben, die nach gesetzlicher Vorschrift zu ihrem Schutz errichtet und staatlich überwacht ist."
    },
    {
      "date": "2024-11-05",
      "id": "92530",
      "original_text": "Registerbekanntmachung nach dem Umwandlungsgesetz\nBaden-Württemberg Amtsgericht Freiburg HRB 729142\nRed Rocket Investment GmbH – Singen Hohentwiel",
      "type": "Registerbekanntmachung nach dem Umwandlungsgesetz",
      "state": "Baden-Württemberg",
      "amtsgericht": "Amtsgericht Freiburg",
      "registernummer": "HRB 729142",
      "registerart": "HRB",
      "company_name": "Red Rocket Investment GmbH",
      "company_seat": "Singen Hohentwiel",
      "details": "05.11.2024 (Bekanntmachungsdatum)\n\nBaden-Württemberg Amtsgericht Freiburg HRB 729142\nRegisterbekanntmachung nach dem Umwandlungsgesetz 05.11.2024 (Eintragungsdatum)\n\nRed Rocket Investment GmbH\nGesellschaft mit beschränkter Haftung\nSingen Hohentwiel\n\nAls nicht eingetragen wird bekanntgemacht:\nDen Gläubigern der an der Verschmelzung beteiligten Rechtsträger ist, wenn sie binnen sechs Monaten nach dem Tag, an dem die Eintragung der Verschmelzung in das Register des Sitzes desjenigen Rechtsträgers, dessen Gläubiger sie sind, nach § 19 Abs. 3 UmwG als bekanntgemacht gilt, ihren Anspruch nach Grund und Höhe schriftlich anmelden, Sicherheit zu leisten, soweit sie nicht Befriedigung verlangen können. Dieses Recht steht den Gläubigern jedoch nur zu, wenn sie glaubhaft machen, dass durch die Verschmelzung die Erfüllung ihrer Forderung gefährdet wird."
    },
    {
      "date": "2024-11-05",
      "id": "92531",
      "original_text": "Löschungsankündigung\nSaarland Amtsgericht Saarbrücken HRB 19184\nTimes Gastro GmbH – St. Ingbert",
      "type": "Löschungsankündigung",
      "state": "Saarland",
      "amtsgericht": "Amtsgericht Saarbrücken",
      "registernummer": "HRB 19184",
      "registerart": "HRB",
      "company_name": "Times Gastro GmbH",
      "company_seat": "St. Ingbert",
      "details": "05.11.2024 (Bekanntmachungsdatum)\n\nSaarland Amtsgericht Saarbrücken HRB 19184\nLöschungsankündigung\n\nTimes Gastro GmbH\nGesellschaft mit beschränkter Haftung\nSt. Ingbert\n\nEs ist beabsichtigt, die Gesellschaft von Amts wegen gemäß § 394 FamFG wegen Vermögenslosigkeit zu löschen.\nGegen die Löschung von Amts wegen ist das Rechtsmittel des Widerspruchs statthaft. Der Widerspruch ist binnen einer Frist zwei Monaten beginnend mit dem Tag dieser Veröffentlichung durch Einreichen eines Widerspruchsschreibens -schriftlich oder zur Niederschrift der Geschäftsstelle beim Amtsgericht Saarbrücken, -zentrales Handelsregister-, Mainzerstr.178, 66121 Saarbrücken einzulegen.\nDer Widerspruch muss die Bezeichnung der angefochtenen Löschungsankündigung enthalten sowie die Erklärung, dass Widerspruch eingelegt wird. Er ist vom Widerspruchsführer oder seinem Bevollmächtigten zu unterzeichnen.\nDas Widerspruchsschreiben kann auch in der Form eines elektronischen Dokumentes eingereicht werden, das mit einer qualifizierten elektronischen Signatur nach dem Signaturgesetz versehen sein muss (§§ 14 Abs. 2 FamFG, 130a, 298 ZPO)."
    },
    {
      "date": "2024-11-05",
      "id": "92532",
      "original_text": "Registerbekanntmachung nach dem Umwandlungsgesetz\nHamburg Amtsgericht Hamburg HRB 189249\nFRANK Immobilien und Lebensformate GmbH – Hamburg",
      "type": "Registerbekanntmachung nach dem Umwandlungsgesetz",
      "state": "Hamburg",
      "amtsgericht": "Amtsgericht Hamburg",
      "registernummer": "HRB 189249",
      "registerart": "HRB",
      "company_name": "FRANK Immobilien und Lebensformate GmbH",
      "company_seat": "Hamburg",
      "details": "05.11.2024 (Bekanntmachungsdatum)\n\nHamburg Amtsgericht Hamburg HRB 189249\nRegisterbekanntmachung nach dem Umwandlungsgesetz 05.11.2024 (Eintragungsdatum)\n\nFRANK Immobilien und Lebensformate GmbH\nGesellschaft mit beschränkter Haftung\nHamburg\n\nAls nicht eingetragen wird bekannt gemacht:\nDen Gläubigern der an der Verschmelzung beteiligten Gesellschaften ist, wenn sie binnen sechs Monaten nach dem Tag, an dem die Eintragung der Verschmelzung in das Register des Sitzes desjenigen Rechtsträgers, dessen Gläubiger sie sind, nach § 19 Absatz 3 UmwG als bekannt gemacht gilt, ihren Anspruch nach Grund und Höhe schriftlich anmelden, Sicherheit zu leisten, soweit sie nicht Befriedigung verlangen können. Dieses Recht steht den Gläubigern jedoch nur zu, wenn sie glaubhaft machen, dass durch die Verschmelzung die Erfüllung ihrer Forderung gefährdet wird."
    },
    {
      "date": "2024-11-05",
      "id": "92533",
      "original_text": "Löschungsankündigung\nMecklenburg-Vorpommern Amtsgericht Stralsund HRB 8859\nIK Grundinvest GmbH – Glowe",
      "type": "Löschungsankündigung",
      "state": "Mecklenburg-Vorpommern",
      "amtsgericht": "Amtsgericht Stralsund",
      "registernummer": "HRB 8859",
      "registerart": "HRB",
      "company_name": "IK Grundinvest GmbH",
      "company_seat": "Glowe",
      "details": "05.11.2024 (Bekanntmachungsdatum)\n\nMecklenburg-Vorpommern Amtsgericht Stralsund HRB 8859\nLöschungsankündigung\n\nIK Grundinvest GmbH\nGesellschaft mit beschränkter Haftung\nGlowe\n\nDas Registergericht beabsichtigt, die im Handelsregister eingetragene Gesellschaft von Amts wegen nach § 394 FamFG zu löschen. Die Frist zur Erhebung eines Widerspruchs gegen die beabsichtigte Löschung wird auf 1 Monat festgesetzt."
    },
    {
      "date": "2024-11-05",
      "id": "92534",
      "original_text": "Löschungsankündigung\nSaarland Amtsgericht Saarbrücken HRB 102994\nThermoSel GmbH – Merchweiler",
      "type": "Löschungsankündigung",
      "state": "Saarland",
      "amtsgericht": "Amtsgericht Saarbrücken",
      "registernummer": "HRB 102994",
      "registerart": "HRB",
      "company_name": "ThermoSel GmbH",
      "company_seat": "Merchweiler",
      "details": "05.11.2024 (Bekanntmachungsdatum)\n\nSaarland Amtsgericht Saarbrücken HRB 102994\nLöschungsankündigung\n\nThermoSel GmbH\nGesellschaft mit beschränkter Haftung\nMerchweiler\n\nEs ist beabsichtigt, die Gesellschaft von Amts wegen gemäß § 394 FamFG wegen Vermögenslosigkeit zu löschen. Gegen die Löschung von Amts wegen ist das Rechtsmittel des Widerspruchs statthaft. Der Widerspruch ist binnen einer Frist von 1 Monat beginnend mit dem Tag dieser Veröffentlichung durch Einreichen eines Widerspruchsschreibens -schriftlich oder zur Niederschrift der Geschäftsstelle- beim Amtsgericht Saarbrücken, -zentrales Handelsregister-, Mainzerstr.178, 66121 Saarbrücken einzulegen. Der Widerspruch muss die Bezeichnung der angefochtenen Löschungsankündigung enthalten sowie die Erklärung, dass Widerspruch eingelegt wird. Er ist vom Widerspruchsführer oder seinem Bevollmächtigten zu unterzeichnen."
    },
    {
      "date": "2024-11-05",
      "id": "92535",
      "original_text": "Löschungsankündigung\nBerlin Amtsgericht Berlin (Charlottenburg) HRA 48478\nTARSAP Immobilien GmbH & Co. KG – Berlin",
      "type": "Löschungsankündigung",
      "state": "Berlin",
      "amtsgericht": "Amtsgericht Berlin (Charlottenburg)",
      "registernummer": "HRA 48478",
      "registerart": "HRA",
      "company_name": "TARSAP Immobilien GmbH & Co. KG",
      "company_seat": "Berlin",
      "details": "05.11.2024 (Bekanntmachungsdatum)\n\nBerlin Amtsgericht Berlin (Charlottenburg) HRA 48478\nLöschungsankündigung\n\nTARSAP Immobilien GmbH & Co. KG\nKommanditgesellschaft\nBerlin\n\nBei dem nachstehenden Unternehmen / der nachstehenden Gesellschaft wird das Amtslöschungsverfahren gemäß § 31 Abs. 2 HGB eingeleitet. Widerspruchsfrist 6 Wochen"
    },
    {
      "date": "2024-11-05",
      "id": "92536",
      "original_text": "Registerbekanntmachung nach dem Umwandlungsgesetz\nSchleswig-Holstein Amtsgericht Lübeck HRA 11234\nDM-Service-Umzüge Denis Timko e.K. – Wesenberg",
      "type": "Registerbekanntmachung nach dem Umwandlungsgesetz",
      "state": "Schleswig-Holstein",
      "amtsgericht": "Amtsgericht Lübeck",
      "registernummer": "HRA 11234",
      "registerart": "HRA",
      "company_name": "DM-Service-Umzüge Denis Timko e.K.",
      "company_seat": "Wesenberg",
      "details": "05.11.2024 (Bekanntmachungsdatum)\n\nSchleswig-Holstein Amtsgericht Lübeck HRA 11234\nRegisterbekanntmachung nach dem Umwandlungsgesetz 05.11.2024 (Eintragungsdatum)\n\nDM-Service-Umzüge Denis Timko e.K.\nEinzelkaufmann / Einzelkauffrau\nWesenberg\n\nZu Eintragungsnummer 2 vom 05.11.2024 wird als nicht eingetragen veröffentlicht: Den Gläubigern der an der Spaltung beteiligten Rechtsträger ist, wenn sie binnen sechs Monaten nach dem Tag, an dem die Eintragung der Spaltung in das Register des Sitzes desjenigen Rechtsträgers, dessen Gläubiger sie sind, als bekannt gemacht gilt, ihren Anspruch nach Grund und Höhe schriftlich anmelden, Sicherheit zu leisten, soweit sie nicht Befriedigung verlangen können. Dieses Recht steht den Gläubigern jedoch nur zu, wenn sie glaubhaft machen, dass durch die Spaltung die Erfüllung ihrer Forderung gefährdet wird."
    },
    {
      "date": "2024-11-05",
      "id": "92537",
      "original_text": "Löschungsankündigung\nBerlin Amtsgericht Berlin (Charlottenburg) HRB 244507\nIstanbau UG (haftungsbeschränkt) – Berlin",
      "type": "Löschungsankündigung",
      "state": "Berlin",
      "amtsgericht": "Amtsgericht Berlin (Charlottenburg)",
      "registernummer": "HRB 244507",
      "registerart": "HRB",
      "company_name": "Istanbau UG (haftungsbeschränkt)",
      "company_seat": "Berlin",
      "details": "05.11.2024 (Bekanntmachungsdatum)\n\nBerlin Amtsgericht Berlin (Charlottenburg) HRB 244507\nLöschungsankündigung\n\nIstanbau UG (haftungsbeschränkt)\nGesellschaft mit beschränkter Haftung\nBerlin\n\nBei der nachstehenden Gesellschaft wird das Amtslöschungsverfahren gemäß § 394 FamFG eingeleitet. Widerspruchsfrist 6 Wochen"
    },
    {
      "date": "2024-11-05",
      "id": "92538",
      "original_text": "Registerbekanntmachung nach dem Umwandlungsgesetz\nBerlin Amtsgericht Berlin (Charlottenburg) HRA 63157\nAufzugsverbund Deutschland GmbH & Co. KG – Berlin",
      "type": "Registerbekanntmachung nach dem Umwandlungsgesetz",
      "state": "Berlin",
      "amtsgericht": "Amtsgericht Berlin (Charlottenburg)",
      "registernummer": "HRA 63157",
      "registerart": "HRA",
      "company_name": "Aufzugsverbund Deutschland GmbH & Co. KG",
      "company_seat": "Berlin",
      "details": "05.11.2024 (Bekanntmachungsdatum)\n\nBerlin Amtsgericht Berlin (Charlottenburg) HRA 63157\nRegisterbekanntmachung nach dem Umwandlungsgesetz 04.11.2024 (Eintragungsdatum)\n\nAufzugsverbund Deutschland GmbH & Co. KG\nKommanditgesellschaft\nBerlin\n\nZu Eintragungsnummer 7 vom 04.11.2024 wird als nicht eingetragen veröffentlicht:Den Gläubigern der an der Verschmelzung beteiligten Rechtsträger ist, wenn sie binnen sechs Monaten nach dem Tag, an dem die Eintragung der Verschmelzung in das Register des Sitzes desjenigen Rechtsträgers, dessen Gläubiger sie sind, als bekannt gemacht gilt, ihren Anspruch nach Grund und Höhe schriftlich anmelden, Sicherheit zu leisten, soweit sie nicht Befriedigung verlangen können. Dieses Recht steht den Gläubigern jedoch nur zu, wenn sie glaubhaft machen, dass durch die Verschmelzung die Erfüllung ihrer Forderung gefährdet wird. Das Recht, Sicherheitsleistung zu verlangen, steht Gläubigern nicht zu, die im Falle der Insolvenz ein Recht auf vorzugsweise Befriedigung aus einer Deckungsmasse haben, die nach gesetzlicher Vorschrift zu ihrem Schutz errichtet und staatlich überwacht ist."
    },
    {
      "date": "2024-11-05",
      "id": "92539",
      "original_text": "Registerbekanntmachung nach dem Umwandlungsgesetz\nBerlin Amtsgericht Berlin (Charlottenburg) HRA 63157\nAufzugsverbund Deutschland GmbH & Co. KG – Berlin",
      "type": "Registerbekanntmachung nach dem Umwandlungsgesetz",
      "state": "Berlin",
      "amtsgericht": "Amtsgericht Berlin (Charlottenburg)",
      "registernummer": "HRA 63157",
      "registerart": "HRA",
      "company_name": "Aufzugsverbund Deutschland GmbH & Co. KG",
      "company_seat": "Berlin",
      "details": "05.11.2024 (Bekanntmachungsdatum)\n\nBerlin Amtsgericht Berlin (Charlottenburg) HRA 63157\nRegisterbekanntmachung nach dem Umwandlungsgesetz 04.11.2024 (Eintragungsdatum)\n\nAufzugsverbund Deutschland GmbH & Co. KG\nKommanditgesellschaft\nBerlin\n\nZu Eintragungsnummer 8 vom 04.11.2024 wird als nicht eingetragen veröffentlicht: Den Gläubigern der an der Verschmelzung beteiligten Rechtsträger ist, wenn sie binnen sechs Monaten nach dem Tag, an dem die Eintragung der Verschmelzung in das Register des Sitzes desjenigen Rechtsträgers, dessen Gläubiger sie sind, als bekannt gemacht gilt, ihren Anspruch nach Grund und Höhe schriftlich anmelden, Sicherheit zu leisten, soweit sie nicht Befriedigung verlangen können. Dieses Recht steht den Gläubigern jedoch nur zu, wenn sie glaubhaft machen, dass durch die Verschmelzung die Erfüllung ihrer Forderung gefährdet wird. Das Recht, Sicherheitsleistung zu verlangen, steht Gläubigern nicht zu, die im Falle der Insolvenz ein Recht auf vorzugsweise Befriedigung aus einer Deckungsmasse haben, die nach gesetzlicher Vorschrift zu ihrem Schutz errichtet und staatlich überwacht ist."
    },
    {
      "date": "2024-11-05",
      "id": "92540",
      "original_text": "Registerbekanntmachung nach dem Umwandlungsgesetz\nBaden-Württemberg Amtsgericht Mannheim HRA 333401\nAlte Eppelheimer 11 Verwaltungs GmbH & Co. KG – Heidelberg",
      "type": "Registerbekanntmachung nach dem Umwandlungsgesetz",
      "state": "Baden-Württemberg",
      "amtsgericht": "Amtsgericht Mannheim",
      "registernummer": "HRA 333401",
      "registerart": "HRA",
      "company_name": "Alte Eppelheimer 11 Verwaltungs GmbH & Co. KG",
      "company_seat": "Heidelberg",
      "details": "05.11.2024 (Bekanntmachungsdatum)\n\nBaden-Württemberg Amtsgericht Mannheim HRA 333401\nRegisterbekanntmachung nach dem Umwandlungsgesetz 05.11.2024 (Eintragungsdatum)\n\nAlte Eppelheimer 11 Verwaltungs GmbH & Co. KG\nKommanditgesellschaft\nHeidelberg\n\nDen Gläubigern der an der Verschmelzung beteiligten Rechtsträger ist, wenn sie binnen sechs Monaten nach dem Tag, an dem die Eintragung der Verschmelzung in das Register des Sitzes desjenigen Rechtsträgers, dessen Gläubiger sie sind, nach § 19 Abs. 3 UmwG als bekanntgemacht gilt, ihren Anspruch nach Grund und Höhe schriftlich anmelden, Sicherheit zu leisten, soweit sie nicht Befriedigung verlangen können. Dieses Recht steht den Gläubigern jedoch nur zu, wenn sie glaubhaft machen, dass durch die Verschmelzung die Erfüllung ihrer Forderung gefährdet wird."
    },
    {
      "date": "2024-11-05",
      "id": "92541",
      "original_text": "Registerbekanntmachung nach dem Umwandlungsgesetz\nBerlin Amtsgericht Berlin (Charlottenburg) HRB 192508\nPrüfer & Co. Aufzugbau GmbH – Berlin",
      "type": "Registerbekanntmachung nach dem Umwandlungsgesetz",
      "state": "Berlin",
      "amtsgericht": "Amtsgericht Berlin (Charlottenburg)",
      "registernummer": "HRB 192508",
      "registerart": "HRB",
      "company_name": "Prüfer & Co. Aufzugbau GmbH",
      "company_seat": "Berlin",
      "details": "05.11.2024 (Bekanntmachungsdatum)\n\nBerlin Amtsgericht Berlin (Charlottenburg) HRB 192508\nRegisterbekanntmachung nach dem Umwandlungsgesetz 04.11.2024 (Eintragungsdatum)\n\nPrüfer & Co. Aufzugbau GmbH\nGesellschaft mit beschränkter Haftung\nBerlin\n\nZu Eintragungsnummer 12 vom 04.11.2024 wird als nicht eingetragen veröffentlicht: Den Gläubigern der an der Verschmelzung beteiligten Rechtsträger ist, wenn sie binnen sechs Monaten nach dem Tag, an dem die Eintragung der Verschmelzung in das Register des Sitzes desjenigen Rechtsträgers, dessen Gläubiger sie sind, als bekannt gemacht gilt, ihren Anspruch nach Grund und Höhe schriftlich anmelden, Sicherheit zu leisten, soweit sie nicht Befriedigung verlangen können. Dieses Recht steht den Gläubigern jedoch nur zu, wenn sie glaubhaft machen, dass durch die Verschmelzung die Erfüllung ihrer Forderung gefährdet wird. Das Recht, Sicherheitsleistung zu verlangen, steht Gläubigern nicht zu, die im Falle der Insolvenz ein Recht auf vorzugsweise Befriedigung aus einer Deckungsmasse haben, die nach gesetzlicher Vorschrift zu ihrem Schutz errichtet und staatlich überwacht ist."
    },
    {
      "date": "2024-11-05",
      "id": "92542",
      "original_text": "Einreichung neuer Dokumente\nThüringen Amtsgericht Jena HRB 401122\nBerufsbildungszentrum Nordhausen gemeinnützige Gesellschaft mit beschränkter Haftung – Nordhausen",
      "type": "Einreichung neuer Dokumente",
      "state": "Thüringen",
      "amtsgericht": "Amtsgericht Jena",
      "registernummer": "HRB 401122",
      "registerart": "HRB",
      "company_name": "Berufsbildungszentrum Nordhausen gemeinnützige Gesellschaft mit beschränkter Haftung",
      "company_seat": "Nordhausen",
      "details": "05.11.2024 (Bekanntmachungsdatum)\n\nThüringen Amtsgericht Jena HRB 401122\nEinreichung neuer Dokumente\n\nBerufsbildungszentrum Nordhausen gemeinnützige Gesellschaft mit beschränkter Haftung\nGesellschaft mit beschränkter Haftung\nNordhausen\n\nBekanntmachung gem. § 52 Abs. 3 Satz 2 GmbHG: Aufgrund einer Veränderung in den Personen der Aufsichtsratsmitglieder ist durch die Geschäftsführer eine neue Liste zum Handelsregister eingereicht worden."
    },
    {
      "date": "2024-11-05",
      "id": "92543",
      "original_text": "Löschungsankündigung\nBerlin Amtsgericht Berlin (Charlottenburg) HRB 220795\nFFC Fachkräfte und Consulting GmbH – Berlin",
      "type": "Löschungsankündigung",
      "state": "Berlin",
      "amtsgericht": "Amtsgericht Berlin (Charlottenburg)",
      "registernummer": "HRB 220795",
      "registerart": "HRB",
      "company_name": "FFC Fachkräfte und Consulting GmbH",
      "company_seat": "Berlin",
      "details": "05.11.2024 (Bekanntmachungsdatum)\n\nBerlin Amtsgericht Berlin (Charlottenburg) HRB 220795\nLöschungsankündigung\n\nFFC Fachkräfte und Consulting GmbH\nGesellschaft mit beschränkter Haftung\nBerlin\n\nBei der nachstehenden Gesellschaft wird das Amtslöschungsverfahren gemäß § 394 FamFG eingeleitet. Widerspruchsfrist 6 Wochen"
    },
    {
      "date": "2024-11-05",
      "id": "92544",
      "original_text": "Löschungsankündigung\nBerlin Amtsgericht Berlin (Charlottenburg) HRB 211799\nHeimdall Personal- & Wachdienste GmbH – Berlin",
      "type": "Löschungsankündigung",
      "state": "Berlin",
      "amtsgericht": "Amtsgericht Berlin (Charlottenburg)",
      "registernummer": "HRB 211799",
      "registerart": "HRB",
      "company_name": "Heimdall Personal- & Wachdienste GmbH",
      "company_seat": "Berlin",
      "details": "05.11.2024 (Bekanntmachungsdatum)\n\nBerlin Amtsgericht Berlin (Charlottenburg) HRB 211799\nLöschungsankündigung\n\nHeimdall Personal- & Wachdienste GmbH\nGesellschaft mit beschränkter Haftung\nBerlin\n\nBei der nachstehenden Gesellschaft wird das Amtslöschungsverfahren gemäß § 394 FamFG eingeleitet. Widerspruchsfrist 6 Wochen"
    },
    {
      "date": "2024-11-05",
      "id": "92545",
      "original_text": "Löschungsankündigung\nBaden-Württemberg Amtsgericht Mannheim HRB 740774\nTrostmann Bauunternehmung GmbH – Mannheim",
      "type": "Löschungsankündigung",
      "state": "Baden-Württemberg",
      "amtsgericht": "Amtsgericht Mannheim",
      "registernummer": "HRB 740774",
      "registerart": "HRB",
      "company_name": "Trostmann Bauunternehmung GmbH",
      "company_seat": "Mannheim",
      "details": "05.11.2024 (Bekanntmachungsdatum)\n\nBaden-Württemberg Amtsgericht Mannheim HRB 740774\nLöschungsankündigung\n\nTrostmann Bauunternehmung GmbH\nGesellschaft mit beschränkter Haftung\nMannheim\n\nDas Gericht beabsichtigt, die Gesellschaft wegen Vermögenslosigkeit im Handelsregister von Amts wegen nach § 394 FamFG zu löschen. Die Frist zur Geltendmachung eines Widerspruchs gegen die beabsichtigte Löschung ist auf einen Monat ab Veröffentlichung bestimmt."
    },
    {
      "date": "2024-11-05",
      "id": "92546",
      "original_text": "Registerbekanntmachung nach dem Umwandlungsgesetz\nBerlin Amtsgericht Berlin (Charlottenburg) HRB 247326\nCCN SG Vorrat 03 UG (haftungsbeschränkt) – Berlin",
      "type": "Registerbekanntmachung nach dem Umwandlungsgesetz",
      "state": "Berlin",
      "amtsgericht": "Amtsgericht Berlin (Charlottenburg)",
      "registernummer": "HRB 247326",
      "registerart": "HRB",
      "company_name": "CCN SG Vorrat 03 UG (haftungsbeschränkt)",
      "company_seat": "Berlin",
      "details": "05.11.2024 (Bekanntmachungsdatum)\n\nBerlin Amtsgericht Berlin (Charlottenburg) HRB 247326\nRegisterbekanntmachung nach dem Umwandlungsgesetz 04.11.2024 (Eintragungsdatum)\n\nCCN SG Vorrat 03 UG (haftungsbeschränkt)\nGesellschaft mit beschränkter Haftung\nBerlin\n\nZu Eintragungsnummer 2 vom 04.11.2024 wird als nicht eingetragen veröffentlicht:Den Gläubigern der an der Verschmelzung beteiligten Rechtsträger ist, wenn sie binnen sechs Monaten nach dem Tag, an dem die Eintragung der Verschmelzung in das Register des Sitzes desjenigen Rechtsträgers, dessen Gläubiger sie sind, als bekannt gemacht gilt, ihren Anspruch nach Grund und Höhe schriftlich anmelden, Sicherheit zu leisten, soweit sie nicht Befriedigung verlangen können. Dieses Recht steht den Gläubigern jedoch nur zu, wenn sie glaubhaft machen, dass durch die Verschmelzung die Erfüllung ihrer Forderung gefährdet wird. Das Recht, Sicherheitsleistung zu verlangen, steht Gläubigern nicht zu, die im Falle der Insolvenz ein Recht auf vorzugsweise Befriedigung aus einer Deckungsmasse haben, die nach gesetzlicher Vorschrift zu ihrem Schutz errichtet und staatlich überwacht ist."
    },
    {
      "date": "2024-11-05",
      "id": "92547",
      "original_text": "Registerbekanntmachung nach dem Umwandlungsgesetz\nBerlin Amtsgericht Berlin (Charlottenburg) HRB 234158\nBE Scheeder UG (haftungsbeschränkt) – Berlin",
      "type": "Registerbekanntmachung nach dem Umwandlungsgesetz",
      "state": "Berlin",
      "amtsgericht": "Amtsgericht Berlin (Charlottenburg)",
      "registernummer": "HRB 234158",
      "registerart": "HRB",
      "company_name": "BE Scheeder UG (haftungsbeschränkt)",
      "company_seat": "Berlin",
      "details": "05.11.2024 (Bekanntmachungsdatum)\n\nBerlin Amtsgericht Berlin (Charlottenburg) HRB 234158\nRegisterbekanntmachung nach dem Umwandlungsgesetz 04.11.2024 (Eintragungsdatum)\n\nBE Scheeder UG (haftungsbeschränkt)\nGesellschaft mit beschränkter Haftung\nBerlin\n\nZu Eintragungsnummer 2 vom 04.11.2024 wird als nicht eingetragen veröffentlicht:Den Gläubigern der an der Verschmelzung beteiligten Rechtsträger ist, wenn sie binnen sechs Monaten nach dem Tag, an dem die Eintragung der Verschmelzung in das Register des Sitzes desjenigen Rechtsträgers, dessen Gläubiger sie sind, als bekannt gemacht gilt, ihren Anspruch nach Grund und Höhe schriftlich anmelden, Sicherheit zu leisten, soweit sie nicht Befriedigung verlangen können. Dieses Recht steht den Gläubigern jedoch nur zu, wenn sie glaubhaft machen, dass durch die Verschmelzung die Erfüllung ihrer Forderung gefährdet wird. Das Recht, Sicherheitsleistung zu verlangen, steht Gläubigern nicht zu, die im Falle der Insolvenz ein Recht auf vorzugsweise Befriedigung aus einer Deckungsmasse haben, die nach gesetzlicher Vorschrift zu ihrem Schutz errichtet und staatlich überwacht ist."
    },
    {
      "date": "2024-11-05",
      "id": "92548",
      "original_text": "Registerbekanntmachung nach dem Umwandlungsgesetz\nBerlin Amtsgericht Berlin (Charlottenburg) HRB 247335\nCCN Vorrat 03 UG (haftungsbeschränkt) – Berlin",
      "type": "Registerbekanntmachung nach dem Umwandlungsgesetz",
      "state": "Berlin",
      "amtsgericht": "Amtsgericht Berlin (Charlottenburg)",
      "registernummer": "HRB 247335",
      "registerart": "HRB",
      "company_name": "CCN Vorrat 03 UG (haftungsbeschränkt)",
      "company_seat": "Berlin",
      "details": "05.11.2024 (Bekanntmachungsdatum)\n\nBerlin Amtsgericht Berlin (Charlottenburg) HRB 247335\nRegisterbekanntmachung nach dem Umwandlungsgesetz 04.11.2024 (Eintragungsdatum)\n\nCCN Vorrat 03 UG (haftungsbeschränkt)\nGesellschaft mit beschränkter Haftung\nBerlin\n\nZu Eintragungsnummer 2 vom 04.11.2024 wird als nicht eingetragen veröffentlicht:Den Gläubigern der an der Verschmelzung beteiligten Rechtsträger ist, wenn sie binnen sechs Monaten nach dem Tag, an dem die Eintragung der Verschmelzung in das Register des Sitzes desjenigen Rechtsträgers, dessen Gläubiger sie sind, als bekannt gemacht gilt, ihren Anspruch nach Grund und Höhe schriftlich anmelden, Sicherheit zu leisten, soweit sie nicht Befriedigung verlangen können. Dieses Recht steht den Gläubigern jedoch nur zu, wenn sie glaubhaft machen, dass durch die Verschmelzung die Erfüllung ihrer Forderung gefährdet wird. Das Recht, Sicherheitsleistung zu verlangen, steht Gläubigern nicht zu, die im Falle der Insolvenz ein Recht auf vorzugsweise Befriedigung aus einer Deckungsmasse haben, die nach gesetzlicher Vorschrift zu ihrem Schutz errichtet und staatlich überwacht ist."
    },
    {
      "date": "2024-11-05",
      "id": "92549",
      "original_text": "Einreichung neuer Dokumente\nBerlin Amtsgericht Berlin (Charlottenburg) HRB 142946\nAIOS Tax AG Steuerberatungsgesellschaft – Berlin",
      "type": "Einreichung neuer Dokumente",
      "state": "Berlin",
      "amtsgericht": "Amtsgericht Berlin (Charlottenburg)",
      "registernummer": "HRB 142946",
      "registerart": "HRB",
      "company_name": "AIOS Tax AG Steuerberatungsgesellschaft",
      "company_seat": "Berlin",
      "details": "05.11.2024 (Bekanntmachungsdatum)\n\nBerlin Amtsgericht Berlin (Charlottenburg) HRB 142946\nEinreichung neuer Dokumente\n\nAIOS Tax AG Steuerberatungsgesellschaft\nAktiengesellschaft\nBerlin\n\nAls nicht eingetragen wird veröffentlicht:\n\nEs wurde eine neue Liste der Aufsichtsratsmitglieder eingereicht (§ 106 AktG)."
    },
    {
      "date": "2024-11-05",
      "id": "92550",
      "original_text": "Registerbekanntmachung nach dem Umwandlungsgesetz\nBaden-Württemberg Amtsgericht Stuttgart HRB 796975\nHutchinson Stop-Choc GmbH – Renningen",
      "type": "Registerbekanntmachung nach dem Umwandlungsgesetz",
      "state": "Baden-Württemberg",
      "amtsgericht": "Amtsgericht Stuttgart",
      "registernummer": "HRB 796975",
      "registerart": "HRB",
      "company_name": "Hutchinson Stop-Choc GmbH",
      "company_seat": "Renningen",
      "details": "05.11.2024 (Bekanntmachungsdatum)\n\nBaden-Württemberg Amtsgericht Stuttgart HRB 796975\nRegisterbekanntmachung nach dem Umwandlungsgesetz 05.11.2024 (Eintragungsdatum)\n\nHutchinson Stop-Choc GmbH\nGesellschaft mit beschränkter Haftung\nRenningen\n\nAls nicht eingetragen wird bekanntgemacht:\nDen Gläubigern des an dem Formwechsel beteiligten Rechtsträgers ist, wenn sie binnen sechs Monaten nach dem Tag, an dem die Eintragung des Formwechsels in das Register des Sitzes desjenigen Rechtsträgers, dessen Gläubiger sie sind, nach § 19 Abs. 3 UmwG als bekanntgemacht gilt, ihren Anspruch nach Grund und Höhe schriftlich anmelden, Sicherheit zu leisten, soweit sie nicht Befriedigung verlangen können. Dieses Recht steht den Gläubigern jedoch nur zu, wenn sie glaubhaft machen, dass durch den Formwechsel die Erfüllung ihrer Forderung gefährdet wird."
    },
    {
      "date": "2024-11-05",
      "id": "92551",
      "original_text": "Registerbekanntmachung nach dem Umwandlungsgesetz\nBaden-Württemberg Amtsgericht Stuttgart HRA 253935\nHutchinson Stop-Choc GmbH & Co. KG – Renningen",
      "type": "Registerbekanntmachung nach dem Umwandlungsgesetz",
      "state": "Baden-Württemberg",
      "amtsgericht": "Amtsgericht Stuttgart",
      "registernummer": "HRA 253935",
      "registerart": "HRA",
      "company_name": "Hutchinson Stop-Choc GmbH & Co. KG",
      "company_seat": "Renningen",
      "details": "05.11.2024 (Bekanntmachungsdatum)\n\nBaden-Württemberg Amtsgericht Stuttgart HRA 253935\nRegisterbekanntmachung nach dem Umwandlungsgesetz 05.11.2024 (Eintragungsdatum)\n\nHutchinson Stop-Choc GmbH & Co. KG\nKommanditgesellschaft\nRenningen\n\nAls nicht eingetragen wird bekanntgemacht:\nDen Gläubigern des an dem Formwechsel beteiligten Rechtsträgers ist, wenn sie binnen sechs Monaten nach dem Tag, an dem die Eintragung des Formwechsels in das Register des Sitzes desjenigen Rechtsträgers, dessen Gläubiger sie sind, nach § 19 Abs. 3 UmwG als bekanntgemacht gilt, ihren Anspruch nach Grund und Höhe schriftlich anmelden, Sicherheit zu leisten, soweit sie nicht Befriedigung verlangen können. Dieses Recht steht den Gläubigern jedoch nur zu, wenn sie glaubhaft machen, dass durch den Formwechsel die Erfüllung ihrer Forderung gefährdet wird."
    },
    {
      "date": "2024-11-05",
      "id": "92552",
      "original_text": "Registerbekanntmachung nach dem Umwandlungsgesetz\nBerlin Amtsgericht Berlin (Charlottenburg) HRB 248075\nCCN Vorrat 05 UG (haftungsbeschränkt) – Berlin",
      "type": "Registerbekanntmachung nach dem Umwandlungsgesetz",
      "state": "Berlin",
      "amtsgericht": "Amtsgericht Berlin (Charlottenburg)",
      "registernummer": "HRB 248075",
      "registerart": "HRB",
      "company_name": "CCN Vorrat 05 UG (haftungsbeschränkt)",
      "company_seat": "Berlin",
      "details": "05.11.2024 (Bekanntmachungsdatum)\n\nBerlin Amtsgericht Berlin (Charlottenburg) HRB 248075\nRegisterbekanntmachung nach dem Umwandlungsgesetz 04.11.2024 (Eintragungsdatum)\n\nCCN Vorrat 05 UG (haftungsbeschränkt)\nGesellschaft mit beschränkter Haftung\nBerlin\n\nZu Eintragungsnummer 2 vom 04.11.2024 wird als nicht eingetragen veröffentlicht:Den Gläubigern der an der Verschmelzung beteiligten Rechtsträger ist, wenn sie binnen sechs Monaten nach dem Tag, an dem die Eintragung der Verschmelzung in das Register des Sitzes desjenigen Rechtsträgers, dessen Gläubiger sie sind, als bekannt gemacht gilt, ihren Anspruch nach Grund und Höhe schriftlich anmelden, Sicherheit zu leisten, soweit sie nicht Befriedigung verlangen können. Dieses Recht steht den Gläubigern jedoch nur zu, wenn sie glaubhaft machen, dass durch die Verschmelzung die Erfüllung ihrer Forderung gefährdet wird. Das Recht, Sicherheitsleistung zu verlangen, steht Gläubigern nicht zu, die im Falle der Insolvenz ein Recht auf vorzugsweise Befriedigung aus einer Deckungsmasse haben, die nach gesetzlicher Vorschrift zu ihrem Schutz errichtet und staatlich überwacht ist."
    },
    {
      "date": "2024-11-05",
      "id": "92553",
      "original_text": "Registerbekanntmachung nach dem Umwandlungsgesetz\nBaden-Württemberg Amtsgericht Mannheim HRA 710328\nAlte Eppelheimer Straße 11 Projektentwicklungs GmbH & Co. KG – Heidelberg",
      "type": "Registerbekanntmachung nach dem Umwandlungsgesetz",
      "state": "Baden-Württemberg",
      "amtsgericht": "Amtsgericht Mannheim",
      "registernummer": "HRA 710328",
      "registerart": "HRA",
      "company_name": "Alte Eppelheimer Straße 11 Projektentwicklungs GmbH & Co. KG",
      "company_seat": "Heidelberg",
      "details": "05.11.2024 (Bekanntmachungsdatum)\n\nBaden-Württemberg Amtsgericht Mannheim HRA 710328\nRegisterbekanntmachung nach dem Umwandlungsgesetz 05.11.2024 (Eintragungsdatum)\n\nAlte Eppelheimer Straße 11 Projektentwicklungs GmbH & Co. KG\nKommanditgesellschaft\nHeidelberg\n\nDen Gläubigern der an der Verschmelzung beteiligten Rechtsträger ist, wenn sie binnen sechs Monaten nach dem Tag, an dem die Eintragung der Verschmelzung in das Register des Sitzes desjenigen Rechtsträgers, dessen Gläubiger sie sind, nach § 19 Abs. 3 UmwG als bekanntgemacht gilt, ihren Anspruch nach Grund und Höhe schriftlich anmelden, Sicherheit zu leisten, soweit sie nicht Befriedigung verlangen können. Dieses Recht steht den Gläubigern jedoch nur zu, wenn sie glaubhaft machen, dass durch die Verschmelzung die Erfüllung ihrer Forderung gefährdet wird."
    },
    {
      "date": "2024-11-05",
      "id": "92554",
      "original_text": "Registerbekanntmachung nach dem Umwandlungsgesetz\nBerlin Amtsgericht Berlin (Charlottenburg) HRB 247365\nCCN SG Vorrat 05 UG (haftungsbeschränkt) – Berlin",
      "type": "Registerbekanntmachung nach dem Umwandlungsgesetz",
      "state": "Berlin",
      "amtsgericht": "Amtsgericht Berlin (Charlottenburg)",
      "registernummer": "HRB 247365",
      "registerart": "HRB",
      "company_name": "CCN SG Vorrat 05 UG (haftungsbeschränkt)",
      "company_seat": "Berlin",
      "details": "05.11.2024 (Bekanntmachungsdatum)\n\nBerlin Amtsgericht Berlin (Charlottenburg) HRB 247365\nRegisterbekanntmachung nach dem Umwandlungsgesetz 04.11.2024 (Eintragungsdatum)\n\nCCN SG Vorrat 05 UG (haftungsbeschränkt)\nGesellschaft mit beschränkter Haftung\nBerlin\n\nZu Eintragungsnummer 2 vom 04.11.2024 wird als nicht eingetragen veröffentlicht:Den Gläubigern der an der Verschmelzung beteiligten Rechtsträger ist, wenn sie binnen sechs Monaten nach dem Tag, an dem die Eintragung der Verschmelzung in das Register des Sitzes desjenigen Rechtsträgers, dessen Gläubiger sie sind, als bekannt gemacht gilt, ihren Anspruch nach Grund und Höhe schriftlich anmelden, Sicherheit zu leisten, soweit sie nicht Befriedigung verlangen können. Dieses Recht steht den Gläubigern jedoch nur zu, wenn sie glaubhaft machen, dass durch die Verschmelzung die Erfüllung ihrer Forderung gefährdet wird. Das Recht, Sicherheitsleistung zu verlangen, steht Gläubigern nicht zu, die im Falle der Insolvenz ein Recht auf vorzugsweise Befriedigung aus einer Deckungsmasse haben, die nach gesetzlicher Vorschrift zu ihrem Schutz errichtet und staatlich überwacht ist."
    },
    {
      "date": "2024-11-05",
      "id": "92555",
      "original_text": "Registerbekanntmachung nach dem Umwandlungsgesetz\nBerlin Amtsgericht Berlin (Charlottenburg) HRB 238747\nCCN SG Lion Timber UG (haftungsbeschränkt) – Berlin",
      "type": "Registerbekanntmachung nach dem Umwandlungsgesetz",
      "state": "Berlin",
      "amtsgericht": "Amtsgericht Berlin (Charlottenburg)",
      "registernummer": "HRB 238747",
      "registerart": "HRB",
      "company_name": "CCN SG Lion Timber UG (haftungsbeschränkt)",
      "company_seat": "Berlin",
      "details": "05.11.2024 (Bekanntmachungsdatum)\n\nBerlin Amtsgericht Berlin (Charlottenburg) HRB 238747\nRegisterbekanntmachung nach dem Umwandlungsgesetz 04.11.2024 (Eintragungsdatum)\n\nCCN SG Lion Timber UG (haftungsbeschränkt)\nGesellschaft mit beschränkter Haftung\nBerlin\n\nZu Eintragungsnummer 2 vom 04.11.2024 wird als nicht eingetragen veröffentlicht:Den Gläubigern der an der Verschmelzung beteiligten Rechtsträger ist, wenn sie binnen sechs Monaten nach dem Tag, an dem die Eintragung der Verschmelzung in das Register des Sitzes desjenigen Rechtsträgers, dessen Gläubiger sie sind, als bekannt gemacht gilt, ihren Anspruch nach Grund und Höhe schriftlich anmelden, Sicherheit zu leisten, soweit sie nicht Befriedigung verlangen können. Dieses Recht steht den Gläubigern jedoch nur zu, wenn sie glaubhaft machen, dass durch die Verschmelzung die Erfüllung ihrer Forderung gefährdet wird. Das Recht, Sicherheitsleistung zu verlangen, steht Gläubigern nicht zu, die im Falle der Insolvenz ein Recht auf vorzugsweise Befriedigung aus einer Deckungsmasse haben, die nach gesetzlicher Vorschrift zu ihrem Schutz errichtet und staatlich überwacht ist."
    },
    {
      "date": "2024-11-05",
      "id": "92556",
      "original_text": "Registerbekanntmachung nach dem Umwandlungsgesetz\nBerlin Amtsgericht Berlin (Charlottenburg) HRB 238802\nCCN SGE Aschersleben UG (haftungsbeschränkt) – Berlin",
      "type": "Registerbekanntmachung nach dem Umwandlungsgesetz",
      "state": "Berlin",
      "amtsgericht": "Amtsgericht Berlin (Charlottenburg)",
      "registernummer": "HRB 238802",
      "registerart": "HRB",
      "company_name": "CCN SGE Aschersleben UG (haftungsbeschränkt)",
      "company_seat": "Berlin",
      "details": "05.11.2024 (Bekanntmachungsdatum)\n\nBerlin Amtsgericht Berlin (Charlottenburg) HRB 238802\nRegisterbekanntmachung nach dem Umwandlungsgesetz 04.11.2024 (Eintragungsdatum)\n\nCCN SGE Aschersleben UG (haftungsbeschränkt)\nGesellschaft mit beschränkter Haftung\nBerlin\n\nZu Eintragungsnummer 2 vom 04.11.2024 wird als nicht eingetragen veröffentlicht:Den Gläubigern der an der Verschmelzung beteiligten Rechtsträger ist, wenn sie binnen sechs Monaten nach dem Tag, an dem die Eintragung der Verschmelzung in das Register des Sitzes desjenigen Rechtsträgers, dessen Gläubiger sie sind, als bekannt gemacht gilt, ihren Anspruch nach Grund und Höhe schriftlich anmelden, Sicherheit zu leisten, soweit sie nicht Befriedigung verlangen können. Dieses Recht steht den Gläubigern jedoch nur zu, wenn sie glaubhaft machen, dass durch die Verschmelzung die Erfüllung ihrer Forderung gefährdet wird. Das Recht, Sicherheitsleistung zu verlangen, steht Gläubigern nicht zu, die im Falle der Insolvenz ein Recht auf vorzugsweise Befriedigung aus einer Deckungsmasse haben, die nach gesetzlicher Vorschrift zu ihrem Schutz errichtet und staatlich überwacht ist."
    },
    {
      "date": "2024-11-05",
      "id": "92557",
      "original_text": "Registerbekanntmachung nach dem Umwandlungsgesetz\nBerlin Amtsgericht Berlin (Charlottenburg) HRB 248068\nCCN SG Vorrat 02 UG (haftungsbeschränkt) – Berlin",
      "type": "Registerbekanntmachung nach dem Umwandlungsgesetz",
      "state": "Berlin",
      "amtsgericht": "Amtsgericht Berlin (Charlottenburg)",
      "registernummer": "HRB 248068",
      "registerart": "HRB",
      "company_name": "CCN SG Vorrat 02 UG (haftungsbeschränkt)",
      "company_seat": "Berlin",
      "details": "05.11.2024 (Bekanntmachungsdatum)\n\nBerlin Amtsgericht Berlin (Charlottenburg) HRB 248068\nRegisterbekanntmachung nach dem Umwandlungsgesetz 04.11.2024 (Eintragungsdatum)\n\nCCN SG Vorrat 02 UG (haftungsbeschränkt)\nGesellschaft mit beschränkter Haftung\nBerlin\n\nZu Eintragungsnummer 2 vom 04.11.2024 wird als nicht eingetragen veröffentlicht:Den Gläubigern der an der Verschmelzung beteiligten Rechtsträger ist, wenn sie binnen sechs Monaten nach dem Tag, an dem die Eintragung der Verschmelzung in das Register des Sitzes desjenigen Rechtsträgers, dessen Gläubiger sie sind, als bekannt gemacht gilt, ihren Anspruch nach Grund und Höhe schriftlich anmelden, Sicherheit zu leisten, soweit sie nicht Befriedigung verlangen können. Dieses Recht steht den Gläubigern jedoch nur zu, wenn sie glaubhaft machen, dass durch die Verschmelzung die Erfüllung ihrer Forderung gefährdet wird. Das Recht, Sicherheitsleistung zu verlangen, steht Gläubigern nicht zu, die im Falle der Insolvenz ein Recht auf vorzugsweise Befriedigung aus einer Deckungsmasse haben, die nach gesetzlicher Vorschrift zu ihrem Schutz errichtet und staatlich überwacht ist."
    },
    {
      "date": "2024-11-05",
      "id": "92558",
      "original_text": "Registerbekanntmachung nach dem Umwandlungsgesetz\nBerlin Amtsgericht Berlin (Charlottenburg) HRB 248123\nCCN Vorrat 02 UG (haftungsbeschränkt) – Berlin",
      "type": "Registerbekanntmachung nach dem Umwandlungsgesetz",
      "state": "Berlin",
      "amtsgericht": "Amtsgericht Berlin (Charlottenburg)",
      "registernummer": "HRB 248123",
      "registerart": "HRB",
      "company_name": "CCN Vorrat 02 UG (haftungsbeschränkt)",
      "company_seat": "Berlin",
      "details": "05.11.2024 (Bekanntmachungsdatum)\n\nBerlin Amtsgericht Berlin (Charlottenburg) HRB 248123\nRegisterbekanntmachung nach dem Umwandlungsgesetz 04.11.2024 (Eintragungsdatum)\n\nCCN Vorrat 02 UG (haftungsbeschränkt)\nGesellschaft mit beschränkter Haftung\nBerlin\n\nZu Eintragungsnummer 2 vom 04.11.2024 wird als nicht eingetragen veröffentlicht:Den Gläubigern der an der Verschmelzung beteiligten Rechtsträger ist, wenn sie binnen sechs Monaten nach dem Tag, an dem die Eintragung der Verschmelzung in das Register des Sitzes desjenigen Rechtsträgers, dessen Gläubiger sie sind, als bekannt gemacht gilt, ihren Anspruch nach Grund und Höhe schriftlich anmelden, Sicherheit zu leisten, soweit sie nicht Befriedigung verlangen können. Dieses Recht steht den Gläubigern jedoch nur zu, wenn sie glaubhaft machen, dass durch die Verschmelzung die Erfüllung ihrer Forderung gefährdet wird. Das Recht, Sicherheitsleistung zu verlangen, steht Gläubigern nicht zu, die im Falle der Insolvenz ein Recht auf vorzugsweise Befriedigung aus einer Deckungsmasse haben, die nach gesetzlicher Vorschrift zu ihrem Schutz errichtet und staatlich überwacht ist."
    },
    {
      "date": "2024-11-05",
      "id": "92559",
      "original_text": "Registerbekanntmachung nach dem Umwandlungsgesetz\nSchleswig-Holstein Amtsgericht Kiel HRA 12348\nHansen + Klümpen e.K., Inhaber: Dirk Hansen – Neumünster",
      "type": "Registerbekanntmachung nach dem Umwandlungsgesetz",
      "state": "Schleswig-Holstein",
      "amtsgericht": "Amtsgericht Kiel",
      "registernummer": "HRA 12348",
      "registerart": "HRA",
      "company_name": "Hansen + Klümpen e.K., Inhaber: Dirk Hansen",
      "company_seat": "Neumünster",
      "details": "05.11.2024 (Bekanntmachungsdatum)\n\nSchleswig-Holstein Amtsgericht Kiel HRA 12348\nRegisterbekanntmachung nach dem Umwandlungsgesetz 30.10.2024 (Eintragungsdatum)\n\nHansen + Klümpen e.K., Inhaber: Dirk Hansen\nEinzelkaufmann / Einzelkauffrau\nNeumünster\n\nZu Eintragungsnummer 2 vom 30.10.2024 wird als nicht eingetragen veröffentlicht: Als nicht eingetragen wird veröffentlicht: Den Gläubigern der an der Spaltung beteiligten Rechtsträger ist, wenn sie binnen sechs Monaten nach dem Tag, an dem die Eintragung der Spaltung in das Register des Sitzes desjenigen Rechtsträgers, dessen Gläubiger sie sind,  bekannt gemacht worden ist, ihren Anspruch nach Grund und Höhe schriftlich anmelden, Sicherheit zu leisten, soweit sie nicht Befriedigung verlangen können. Dieses Recht steht den Gläubigern jedoch nur zu, wenn sie glaubhaft machen, dass durch die Spaltung die Erfüllung ihrer Forderung gefährdet wird."
    },
    {
      "date": "2024-11-05",
      "id": "92560",
      "original_text": "Löschungsankündigung\nBaden-Württemberg Amtsgericht Stuttgart HRB 762942\nJDS Security GmbH – Stuttgart",
      "type": "Löschungsankündigung",
      "state": "Baden-Württemberg",
      "amtsgericht": "Amtsgericht Stuttgart",
      "registernummer": "HRB 762942",
      "registerart": "HRB",
      "company_name": "JDS Security GmbH",
      "company_seat": "Stuttgart",
      "details": "05.11.2024 (Bekanntmachungsdatum)\n\nBaden-Württemberg Amtsgericht Stuttgart HRB 762942\nLöschungsankündigung\n\nJDS Security GmbH\nGesellschaft mit beschränkter Haftung\nStuttgart\n\nAls nicht eingetragen wird bekanntgemacht:\nDas Gericht beabsichtigt, die Gesellschaft wegen Vermögenslosigkeit im Handelsregister von Amts wegen nach § 394 FamFG zu löschen. Die Frist zur Geltendmachung eines Widerspruchs gegen die beabsichtigte Löschung ist auf zwei Monate ab Veröffentlichung bestimmt."
    },
    {
      "date": "2024-11-05",
      "id": "92561",
      "original_text": "Registerbekanntmachung nach dem Umwandlungsgesetz\nBaden-Württemberg Amtsgericht Mannheim HRB 422271\nAlex & Gross Digital GmbH – Mannheim",
      "type": "Registerbekanntmachung nach dem Umwandlungsgesetz",
      "state": "Baden-Württemberg",
      "amtsgericht": "Amtsgericht Mannheim",
      "registernummer": "HRB 422271",
      "registerart": "HRB",
      "company_name": "Alex & Gross Digital GmbH",
      "company_seat": "Mannheim",
      "details": "05.11.2024 (Bekanntmachungsdatum)\n\nBaden-Württemberg Amtsgericht Mannheim HRB 422271\nRegisterbekanntmachung nach dem Umwandlungsgesetz 05.11.2024 (Eintragungsdatum)\n\nAlex & Gross Digital GmbH\nGesellschaft mit beschränkter Haftung\nMannheim\n\nDen Gläubigern der an der Verschmelzung beteiligten Rechtsträger ist, wenn sie binnen sechs Monaten nach dem Tag, an dem die Eintragung der Verschmelzung in das Register des Sitzes desjenigen Rechtsträgers, dessen Gläubiger sie sind, nach § 19 Abs. 3 UmwG als bekanntgemacht gilt, ihren Anspruch nach Grund und Höhe schriftlich anmelden, Sicherheit zu leisten, soweit sie nicht Befriedigung verlangen können. Dieses Recht steht den Gläubigern jedoch nur zu, wenn sie glaubhaft machen, dass durch die Verschmelzung die Erfüllung ihrer Forderung gefährdet wird."
    },
    {
      "date": "2024-11-05",
      "id": "92562",
      "original_text": "Einreichung neuer Dokumente\nBaden-Württemberg Amtsgericht Ulm HRB 743370\nRegionalwert AG Bodensee-Oberschwaben – Ravensburg",
      "type": "Einreichung neuer Dokumente",
      "state": "Baden-Württemberg",
      "amtsgericht": "Amtsgericht Ulm",
      "registernummer": "HRB 743370",
      "registerart": "HRB",
      "company_name": "Regionalwert AG Bodensee-Oberschwaben",
      "company_seat": "Ravensburg",
      "details": "05.11.2024 (Bekanntmachungsdatum)\n\nBaden-Württemberg Amtsgericht Ulm HRB 743370\nEinreichung neuer Dokumente\n\nRegionalwert AG Bodensee-Oberschwaben\nAktiengesellschaft\nRavensburg\n\nDie Gesellschaft hat am 31.10.2024 die Liste über die Zusammensetzung des Aufsichtsrats zum Handelsregister eingereicht."
    },
    {
      "date": "2024-11-05",
      "id": "92563",
      "original_text": "Einreichung neuer Dokumente\nSaarland Amtsgericht Saarbrücken HRB 81095\nSBT SCHAUMBERGBAD THOLEY GmbH – Tholey",
      "type": "Einreichung neuer Dokumente",
      "state": "Saarland",
      "amtsgericht": "Amtsgericht Saarbrücken",
      "registernummer": "HRB 81095",
      "registerart": "HRB",
      "company_name": "SBT SCHAUMBERGBAD THOLEY GmbH",
      "company_seat": "Tholey",
      "details": "05.11.2024 (Bekanntmachungsdatum)\n\nSaarland Amtsgericht Saarbrücken HRB 81095\nEinreichung neuer Dokumente\n\nSBT SCHAUMBERGBAD THOLEY GmbH\nGesellschaft mit beschränkter Haftung\nTholey\n\nDie Geschäftsführung der Gesellschaft hat eine Liste der Mitglieder des Aufsichtsrats zum Handelsregister eingereicht (§ 52 Abs. 3 Satz 2 GmbHG)."
    },
    {
      "date": "2024-11-05",
      "id": "92564",
      "original_text": "Löschungsankündigung\nBaden-Württemberg Amtsgericht Freiburg HRB 712105\nDualtherm GmbH – Gottmadingen",
      "type": "Löschungsankündigung",
      "state": "Baden-Württemberg",
      "amtsgericht": "Amtsgericht Freiburg",
      "registernummer": "HRB 712105",
      "registerart": "HRB",
      "company_name": "Dualtherm GmbH",
      "company_seat": "Gottmadingen",
      "details": "05.11.2024 (Bekanntmachungsdatum)\n\nBaden-Württemberg Amtsgericht Freiburg HRB 712105\nLöschungsankündigung\n\nDualtherm GmbH\nGesellschaft mit beschränkter Haftung\nGottmadingen\n\nDas Gericht beabsichtigt, die Gesellschaft wegen Vermögenslosigkeit im Handelsregister von Amts wegen nach § 394 FamFG zu löschen. Die Frist zur Geltendmachung eines Widerspruchs gegen die beabsichtigte Löschung ist auf einen Monat ab Veröffentlichung bestimmt."
    },
    {
      "date": "2024-11-05",
      "id": "92565",
      "original_text": "Löschungsankündigung\nSchleswig-Holstein Amtsgericht Kiel HRB 19206\nBoden-Concepte UG (haftungsbeschränkt) – Flintbek",
      "type": "Löschungsankündigung",
      "state": "Schleswig-Holstein",
      "amtsgericht": "Amtsgericht Kiel",
      "registernummer": "HRB 19206",
      "registerart": "HRB",
      "company_name": "Boden-Concepte UG (haftungsbeschränkt)",
      "company_seat": "Flintbek",
      "details": "05.11.2024 (Bekanntmachungsdatum)\n\nSchleswig-Holstein Amtsgericht Kiel HRB 19206\nLöschungsankündigung\n\nBoden-Concepte UG (haftungsbeschränkt)\nGesellschaft mit beschränkter Haftung\nFlintbek\n\nEs ist die Löschung der nachstehenden Gesellschaft wegen Vermögenslosigkeit gemäß § 394 FamFG beabsichtigt. Widerspruchsfrist: 2 Monate."
    },
    {
      "date": "2024-11-05",
      "id": "92566",
      "original_text": "Registerbekanntmachung nach dem Umwandlungsgesetz\nMecklenburg-Vorpommern Amtsgericht Schwerin HRB 8614\nAutohaus am Mittelweg GmbH – Schwerin",
      "type": "Registerbekanntmachung nach dem Umwandlungsgesetz",
      "state": "Mecklenburg-Vorpommern",
      "amtsgericht": "Amtsgericht Schwerin",
      "registernummer": "HRB 8614",
      "registerart": "HRB",
      "company_name": "Autohaus am Mittelweg GmbH",
      "company_seat": "Schwerin",
      "details": "05.11.2024 (Bekanntmachungsdatum)\n\nMecklenburg-Vorpommern Amtsgericht Schwerin HRB 8614\nRegisterbekanntmachung nach dem Umwandlungsgesetz 05.11.2024 (Eintragungsdatum)\n\nAutohaus am Mittelweg GmbH\nGesellschaft mit beschränkter Haftung\nSchwerin\n\nAls nicht eingetragen wird veröffentlicht: Den Gläubigern der an der Verschmelzung beteiligten Rechtsträger ist, wenn sie binnen sechs Monaten nach dem Tag, an dem die Eintragung der Verschmelzung in das Register des Sitzes desjenigen Rechtsträgers, dessen Gläubiger sie sind, nach § 19 Abs. 3 UmwG als bekannt gemacht gilt,\nihren Anspruch nach Grund und Höhe schriftlich anmelden, Sicherheit zu leisten, soweit sie nicht Befriedigung verlangen können. Dieses Recht steht den Gläubigern jedoch nur zu, wenn sie glaubhaft machen, dass durch die Verschmelzung die Erfüllung der Forderung gefährdet wird."
    },
    {
      "date": "2024-11-05",
      "id": "92567",
      "original_text": "Einreichung neuer Dokumente\nSachsen Amtsgericht Chemnitz HRB 651\nChemnitzer Verkehrs-Aktiengesellschaft – Chemnitz",
      "type": "Einreichung neuer Dokumente",
      "state": "Sachsen",
      "amtsgericht": "Amtsgericht Chemnitz",
      "registernummer": "HRB 651",
      "registerart": "HRB",
      "company_name": "Chemnitzer Verkehrs-Aktiengesellschaft",
      "company_seat": "Chemnitz",
      "details": "05.11.2024 (Bekanntmachungsdatum)\n\nSachsen Amtsgericht Chemnitz HRB 651\nEinreichung neuer Dokumente\n\nChemnitzer Verkehrs-Aktiengesellschaft\nAktiengesellschaft\nChemnitz\n\nAm 04.11.2024 wurde beim Handelsregister des Amtsgerichts Chemnitz die Liste der Mitglieder des Aufsichtsrats gemäß § 106 AktG eingereicht."
    },
    {
      "date": "2024-11-05",
      "id": "92568",
      "original_text": "Einreichung neuer Dokumente\nSachsen Amtsgericht Dresden HRB 4800\nWohnungsbaugesellschaft Sebnitz mit beschränkter Haftung – Sebnitz",
      "type": "Einreichung neuer Dokumente",
      "state": "Sachsen",
      "amtsgericht": "Amtsgericht Dresden",
      "registernummer": "HRB 4800",
      "registerart": "HRB",
      "company_name": "Wohnungsbaugesellschaft Sebnitz mit beschränkter Haftung",
      "company_seat": "Sebnitz",
      "details": "05.11.2024 (Bekanntmachungsdatum)\n\nSachsen Amtsgericht Dresden HRB 4800\nEinreichung neuer Dokumente\n\nWohnungsbaugesellschaft Sebnitz mit beschränkter Haftung\nGesellschaft mit beschränkter Haftung\nSebnitz\n\nAm 01.11.2024 wurde beim Handelsregister des Amtsgerichts Dresden die Liste der Mitglieder des Aufsichtsrats gemäß § 52 GmbHG eingereicht."
    },
    {
      "date": "2024-11-05",
      "id": "92569",
      "original_text": "Einreichung neuer Dokumente\nSachsen Amtsgericht Dresden HRB 1378\nElbe Flugzeugwerke GmbH – Dresden",
      "type": "Einreichung neuer Dokumente",
      "state": "Sachsen",
      "amtsgericht": "Amtsgericht Dresden",
      "registernummer": "HRB 1378",
      "registerart": "HRB",
      "company_name": "Elbe Flugzeugwerke GmbH",
      "company_seat": "Dresden",
      "details": "05.11.2024 (Bekanntmachungsdatum)\n\nSachsen Amtsgericht Dresden HRB 1378\nEinreichung neuer Dokumente\n\nElbe Flugzeugwerke GmbH\nGesellschaft mit beschränkter Haftung\nDresden\n\nAm 04.11.2024 wurde beim Handelsregister des Amtsgerichts Dresden die Liste der Mitglieder des Aufsichtsrats gemäß § 52 GmbHG eingereicht."
    },
    {
      "date": "2024-11-05",
      "id": "92570",
      "original_text": "Löschungsankündigung\nSachsen Amtsgericht Dresden HRB 28997\nWERTREFORMH Wohnbau GmbH – Dresden",
      "type": "Löschungsankündigung",
      "state": "Sachsen",
      "amtsgericht": "Amtsgericht Dresden",
      "registernummer": "HRB 28997",
      "registerart": "HRB",
      "company_name": "WERTREFORMH Wohnbau GmbH",
      "company_seat": "Dresden",
      "details": "05.11.2024 (Bekanntmachungsdatum)\n\nSachsen Amtsgericht Dresden HRB 28997\nLöschungsankündigung\n\nWERTREFORMH Wohnbau GmbH\nGesellschaft mit beschränkter Haftung\nDresden\n\nDas Registergericht beabsichtigt, die im Handelsregister eingetragene Gesellschaft von Amts wegen nach § 394 FamFG zu löschen. Die Frist zu Erhebung eines Widerspruchs gegen die beabsichtigte Löschung wird auf einen Monat festgesetzt."
    },
    {
      "date": "2024-11-05",
      "id": "92571",
      "original_text": "Sonstige Registerbekanntmachung\nSachsen Amtsgericht Leipzig HRB 19294\ne-dox AG – Leipzig",
      "type": "Sonstige Registerbekanntmachung",
      "state": "Sachsen",
      "amtsgericht": "Amtsgericht Leipzig",
      "registernummer": "HRB 19294",
      "registerart": "HRB",
      "company_name": "e-dox AG",
      "company_seat": "Leipzig",
      "details": "05.11.2024 (Bekanntmachungsdatum)\n\nSachsen Amtsgericht Leipzig HRB 19294\nSonstige Registerbekanntmachung\n\ne-dox AG\nAktiengesellschaft\nLeipzig\n\nAm 04.11.2024 wurde beim Handelsregister des Amtsgerichts Leipzig die Liste der Mitglieder des Aufsichtsrats gemäß § 106 AktG eingereicht."
    },
    {
      "date": "2024-11-05",
      "id": "92572",
      "original_text": "Sonstige Registerbekanntmachung\nSachsen Amtsgericht Leipzig HRB 23498\nAerologic GmbH – Schkeuditz",
      "type": "Sonstige Registerbekanntmachung",
      "state": "Sachsen",
      "amtsgericht": "Amtsgericht Leipzig",
      "registernummer": "HRB 23498",
      "registerart": "HRB",
      "company_name": "Aerologic GmbH",
      "company_seat": "Schkeuditz",
      "details": "05.11.2024 (Bekanntmachungsdatum)\n\nSachsen Amtsgericht Leipzig HRB 23498\nSonstige Registerbekanntmachung\n\nAerologic GmbH\nGesellschaft mit beschränkter Haftung\nSchkeuditz\n\nAm 05.11.2024 wurde beim Handelsregister des Amtsgerichts Leipzig die Liste der Mitglieder des Aufsichtsrats gemäß § 52 GmbHG eingereicht."
    },
    {
      "date": "2024-11-05",
      "id": "92573",
      "original_text": "Einreichung neuer Dokumente\nSachsen Amtsgericht Dresden HRB 19716\nTourismus- und Dienstleistungsgesellschaft Sebnitz mbH – Sebnitz",
      "type": "Einreichung neuer Dokumente",
      "state": "Sachsen",
      "amtsgericht": "Amtsgericht Dresden",
      "registernummer": "HRB 19716",
      "registerart": "HRB",
      "company_name": "Tourismus- und Dienstleistungsgesellschaft Sebnitz mbH",
      "company_seat": "Sebnitz",
      "details": "05.11.2024 (Bekanntmachungsdatum)\n\nSachsen Amtsgericht Dresden HRB 19716\nEinreichung neuer Dokumente\n\nTourismus- und Dienstleistungsgesellschaft Sebnitz mbH\nGesellschaft mit beschränkter Haftung\nSebnitz\n\nAm 01.11.2024 wurde beim Handelsregister des Amtsgerichts Dresden die Liste der Mitglieder des Aufsichtsrats gemäß § 52 GmbHG eingereicht."
    },
    {
      "date": "2024-11-05",
      "id": "92574",
      "original_text": "Löschungsankündigung\nSachsen Amtsgericht Dresden HRA 6644\nWohnart Müller GmbH + Co. KG – Dresden",
      "type": "Löschungsankündigung",
      "state": "Sachsen",
      "amtsgericht": "Amtsgericht Dresden",
      "registernummer": "HRA 6644",
      "registerart": "HRA",
      "company_name": "Wohnart Müller GmbH + Co. KG",
      "company_seat": "Dresden",
      "details": "05.11.2024 (Bekanntmachungsdatum)\n\nSachsen Amtsgericht Dresden HRA 6644\nLöschungsankündigung\n\nWohnart Müller GmbH + Co. KG\nKommanditgesellschaft\nDresden\n\nDas Registergericht beabsichtigt, die im Handelsregister eingetragene Gesellschaft von Amts wegen nach § 394 FamFG zu löschen. Die Frist zu Erhebung eines Widerspruchs gegen die beabsichtigte Löschung wird auf einen Monat festgesetzt."
    },
    {
      "date": "2024-11-05",
      "id": "92575",
      "original_text": "Registerbekanntmachung nach dem Umwandlungsgesetz\nNiedersachsen Amtsgericht Tostedt HRA 205343\nThomas Brandt e. K. – Heeslingen",
      "type": "Registerbekanntmachung nach dem Umwandlungsgesetz",
      "state": "Niedersachsen",
      "amtsgericht": "Amtsgericht Tostedt",
      "registernummer": "HRA 205343",
      "registerart": "HRA",
      "company_name": "Thomas Brandt e. K.",
      "company_seat": "Heeslingen",
      "details": "05.11.2024 (Bekanntmachungsdatum)\n\nNiedersachsen Amtsgericht Tostedt HRA 205343\nRegisterbekanntmachung nach dem Umwandlungsgesetz 05.11.2024 (Eintragungsdatum)\n\nThomas Brandt e. K.\nEinzelkaufmann / Einzelkauffrau\nHeeslingen\n\nDen Gläubigern der an der Verschmelzung beteiligten Rechtsträger ist, wenn sie binnen sechs Monaten nach dem Tag, an dem die Eintragung der Verschmelzung in das Register des Sitzes desjenigen Rechtsträgers, dessen Gläubiger sie sind, nach § 19  Abs.  3 UmwG als bekannt gemacht gilt, ihren Anspruch nach Grund und Höhe schriftlich anmelden, Sicherheit zu leisten, soweit sie nicht Befriedigung verlangen können. Dieses Recht steht den Gläubigern jedoch nur zu, wenn sie glaubhaft machen, dass durch die Verschmelzung die Erfüllung der Forderung gefährdet wird."
    },
    {
      "date": "2024-11-05",
      "id": "92576",
      "original_text": "Löschungsankündigung\nNiedersachsen Amtsgericht Lüneburg HRB 206361\nII Sino Ship Verwaltungs GmbH – Winsen (Luhe)",
      "type": "Löschungsankündigung",
      "state": "Niedersachsen",
      "amtsgericht": "Amtsgericht Lüneburg",
      "registernummer": "HRB 206361",
      "registerart": "HRB",
      "company_name": "II Sino Ship Verwaltungs GmbH",
      "company_seat": "Winsen (Luhe)",
      "details": "05.11.2024 (Bekanntmachungsdatum)\n\nNiedersachsen Amtsgericht Lüneburg HRB 206361\nLöschungsankündigung\n\nII Sino Ship Verwaltungs GmbH\nGesellschaft mit beschränkter Haftung\nWinsen (Luhe)\n\nDas Registergericht beabsichtigt, die Gesellschaft von Amts wegen nach § 394 FamFG zu löschen. Die Frist zur Erhebung eines Widerspruchs ist auf 2 Monate ab dieser Registerbekanntmachung festgesetzt."
    },
    {
      "date": "2024-11-05",
      "id": "92577",
      "original_text": "Registerbekanntmachung nach dem Umwandlungsgesetz\nNiedersachsen Amtsgericht Oldenburg (Oldenburg) HRA 208580\nSahand Tahamtan e.K. – Wangerooge",
      "type": "Registerbekanntmachung nach dem Umwandlungsgesetz",
      "state": "Niedersachsen",
      "amtsgericht": "Amtsgericht Oldenburg (Oldenburg)",
      "registernummer": "HRA 208580",
      "registerart": "HRA",
      "company_name": "Sahand Tahamtan e.K.",
      "company_seat": "Wangerooge",
      "details": "05.11.2024 (Bekanntmachungsdatum)\n\nNiedersachsen Amtsgericht Oldenburg (Oldenburg) HRA 208580\nRegisterbekanntmachung nach dem Umwandlungsgesetz 05.11.2024 (Eintragungsdatum)\n\nSahand Tahamtan e.K.\nEinzelkaufmann / Einzelkauffrau\nWangerooge\n\nDen Gläubigern der an der Ausgliederung beteiligten Rechtsträger ist, wenn sie binnen sechs Monaten nach dem Tag, an dem die Eintragung der Ausgliederung in das Register des Sitzes desjenigen Rechtsträgers, dessen Gläubiger sie sind, nach § 19 Abs. 3 UmwG als bekannt gemacht gilt, ihren Anspruch nach Grund und Höhe schriftlich anmelden, Sicherheit zu leisten, soweit sie nicht Befriedigung verlangen können. Dieses Recht steht den Gläubigern jedoch nur zu, wenn sie glaubhaft machen, dass durch die Ausgliederung die Erfüllung der Forderung gefährdet wird."
    },
    {
      "date": "2024-11-05",
      "id": "92578",
      "original_text": "Registerbekanntmachung nach dem Umwandlungsgesetz\nNiedersachsen Amtsgericht Tostedt HRB 204409\nBM Metallbau GmbH – Heeslingen-Boitzen",
      "type": "Registerbekanntmachung nach dem Umwandlungsgesetz",
      "state": "Niedersachsen",
      "amtsgericht": "Amtsgericht Tostedt",
      "registernummer": "HRB 204409",
      "registerart": "HRB",
      "company_name": "BM Metallbau GmbH",
      "company_seat": "Heeslingen-Boitzen",
      "details": "05.11.2024 (Bekanntmachungsdatum)\n\nNiedersachsen Amtsgericht Tostedt HRB 204409\nRegisterbekanntmachung nach dem Umwandlungsgesetz 05.11.2024 (Eintragungsdatum)\n\nBM Metallbau GmbH\nGesellschaft mit beschränkter Haftung\nHeeslingen-Boitzen\n\nDen Gläubigern der an der Verschmelzung beteiligten Rechtsträger ist, wenn sie binnen sechs Monaten nach dem Tag, an dem die Eintragung der Verschmelzung in das Register des Sitzes desjenigen Rechtsträgers, dessen Gläubiger sie sind, nach § 19  Abs.  3 UmwG als bekannt gemacht gilt, ihren Anspruch nach Grund und Höhe schriftlich anmelden, Sicherheit zu leisten, soweit sie nicht Befriedigung verlangen können. Dieses Recht steht den Gläubigern jedoch nur zu, wenn sie glaubhaft machen, dass durch die Verschmelzung die Erfüllung der Forderung gefährdet wird."
    },
    {
      "date": "2024-11-05",
      "id": "92579",
      "original_text": "Einreichung neuer Dokumente\nNiedersachsen Amtsgericht Tostedt HRB 110360 früher Amtsgericht Langen\nPNE AG – Cuxhaven",
      "type": "Einreichung neuer Dokumente",
      "state": "Niedersachsen",
      "amtsgericht": "Amtsgericht Tostedt",
      "registernummer": "HRB 110360",
      "registerart": "HRB",
      "company_name": "PNE AG",
      "company_seat": "Cuxhaven",
      "former_amtsgericht": "Langen",
      "details": "05.11.2024 (Bekanntmachungsdatum)\n\nNiedersachsen Amtsgericht Tostedt HRB 110360 früher Amtsgericht Langen\nEinreichung neuer Dokumente\n\nPNE AG\nAktiengesellschaft\nCuxhaven\n\nDie Liste der Mitglieder des Aufsichtsrats wurde beim Registergericht eingereicht."
    },
    {
      "date": "2024-11-05",
      "id": "92580",
      "original_text": "Registerbekanntmachung nach dem Umwandlungsgesetz\nNiedersachsen Amtsgericht Göttingen HRA 202215\nBernhard Schirutschke Garten- und Landschaftsbau e.K. – Friedland",
      "type": "Registerbekanntmachung nach dem Umwandlungsgesetz",
      "state": "Niedersachsen",
      "amtsgericht": "Amtsgericht Göttingen",
      "registernummer": "HRA 202215",
      "registerart": "HRA",
      "company_name": "Bernhard Schirutschke Garten- und Landschaftsbau e.K.",
      "company_seat": "Friedland",
      "details": "05.11.2024 (Bekanntmachungsdatum)\n\nNiedersachsen Amtsgericht Göttingen HRA 202215\nRegisterbekanntmachung nach dem Umwandlungsgesetz 05.11.2024 (Eintragungsdatum)\n\nBernhard Schirutschke Garten- und Landschaftsbau e.K.\nEinzelkaufmann / Einzelkauffrau\nFriedland\n\nDen Gläubigern der an der Ausgliederung beteiligten Rechtsträger ist, wenn sie binnen sechs Monaten nach dem Tag, an dem die Eintragung der Ausgliederung in das Register des Sitzes desjenigen Rechtsträgers, dessen Gläubiger sie sind, nach § 19 Abs. 3 UmwG als bekannt gemacht gilt, ihren Anspruch nach Grund und Höhe schriftlich anmelden, Sicherheit zu leisten, soweit sie nicht Befriedigung verlangen können. Dieses Recht steht den Gläubigern jedoch nur zu, wenn sie glaubhaft machen, dass durch die Ausgliederung die Erfüllung der Forderung gefährdet wird."
    },
    {
      "date": "2024-11-05",
      "id": "92581",
      "original_text": "Löschungsankündigung\nNiedersachsen Amtsgericht Tostedt HRB 205795\nEliteauto Nordheide GmbH – Buchholz",
      "type": "Löschungsankündigung",
      "state": "Niedersachsen",
      "amtsgericht": "Amtsgericht Tostedt",
      "registernummer": "HRB 205795",
      "registerart": "HRB",
      "company_name": "Eliteauto Nordheide GmbH",
      "company_seat": "Buchholz",
      "details": "05.11.2024 (Bekanntmachungsdatum)\n\nNiedersachsen Amtsgericht Tostedt HRB 205795\nLöschungsankündigung\n\nEliteauto Nordheide GmbH\nGesellschaft mit beschränkter Haftung\nBuchholz\n\nDas Registergericht beabsichtigt, die Gesellschaft von Amts wegen nach § 394 FamFG zu löschen. Die Frist zur Erhebung eines Widerspruchs ist auf 1 Monat ab dieser Registerbekanntmachung festgesetzt."
    },
    {
      "date": "2024-11-05",
      "id": "92582",
      "original_text": "Registerbekanntmachung nach dem Umwandlungsgesetz\nNiedersachsen Amtsgericht Oldenburg (Oldenburg) HRB 206012\nHK Bioenergie GmbH – Lastrup/ Klein Roscharden",
      "type": "Registerbekanntmachung nach dem Umwandlungsgesetz",
      "state": "Niedersachsen",
      "amtsgericht": "Amtsgericht Oldenburg (Oldenburg)",
      "registernummer": "HRB 206012",
      "registerart": "HRB",
      "company_name": "HK Bioenergie GmbH",
      "company_seat": "Lastrup/ Klein Roscharden",
      "details": "05.11.2024 (Bekanntmachungsdatum)\n\nNiedersachsen Amtsgericht Oldenburg (Oldenburg) HRB 206012\nRegisterbekanntmachung nach dem Umwandlungsgesetz 05.11.2024 (Eintragungsdatum)\n\nHK Bioenergie GmbH\nGesellschaft mit beschränkter Haftung\nLastrup/ Klein Roscharden\n\nDen Gläubigern der an der formwechselnden Umwandlung beteiligten Rechtsträger ist, wenn sie binnen sechs Monaten nach dem Tag, an dem die Eintragung der Umwandlung in das Register des Sitzes desjenigen Rechtsträgers, dessen Gläubiger sie sind, nach § 19 Abs. 3 UmwG als bekannt gemacht gilt, ihren Anspruch nach Grund und Höhe schriftlich anmelden, Sicherheit zu leisten, soweit sie nicht Befriedigung verlangen können. Dieses Recht steht den Gläubigern jedoch nur zu, wenn sie glaubhaft machen, dass durch die formwechselnde Umwandlung die Erfüllung der Forderung gefährdet wird."
    },
    {
      "date": "2024-11-05",
      "id": "92583",
      "original_text": "Einreichung neuer Dokumente\nNiedersachsen Amtsgericht Braunschweig HRB 201970\nNEW YORKER SE – Braunschweig",
      "type": "Einreichung neuer Dokumente",
      "state": "Niedersachsen",
      "amtsgericht": "Amtsgericht Braunschweig",
      "registernummer": "HRB 201970",
      "registerart": "HRB",
      "company_name": "NEW YORKER SE",
      "company_seat": "Braunschweig",
      "details": "05.11.2024 (Bekanntmachungsdatum)\n\nNiedersachsen Amtsgericht Braunschweig HRB 201970\nEinreichung neuer Dokumente\n\nNEW YORKER SE\nEuropäische Aktiengesellschaft (SE)\nBraunschweig\n\nDie Liste der Mitglieder des Aufsichtsrats wurde beim Registergericht eingereicht."
    },
    {
      "date": "2024-11-05",
      "id": "92584",
      "original_text": "Registerbekanntmachung nach dem Umwandlungsgesetz\nNiedersachsen Amtsgericht Oldenburg (Oldenburg) HRA 207499\nFischbar UG (haftungsbeschränkt) & Co. KG – Wangerooge",
      "type": "Registerbekanntmachung nach dem Umwandlungsgesetz",
      "state": "Niedersachsen",
      "amtsgericht": "Amtsgericht Oldenburg (Oldenburg)",
      "registernummer": "HRA 207499",
      "registerart": "HRA",
      "company_name": "Fischbar UG (haftungsbeschränkt) & Co. KG",
      "company_seat": "Wangerooge",
      "details": "05.11.2024 (Bekanntmachungsdatum)\n\nNiedersachsen Amtsgericht Oldenburg (Oldenburg) HRA 207499\nRegisterbekanntmachung nach dem Umwandlungsgesetz 05.11.2024 (Eintragungsdatum)\n\nFischbar UG (haftungsbeschränkt) & Co. KG\nKommanditgesellschaft\nWangerooge\n\nDen Gläubigern der an der Ausgliederung beteiligten Rechtsträger ist, wenn sie binnen sechs Monaten nach dem Tag, an dem die Eintragung der Ausgliederung in das Register des Sitzes desjenigen Rechtsträgers, dessen Gläubiger sie sind, nach § 19 Abs. 3 UmwG als bekannt gemacht gilt, ihren Anspruch nach Grund und Höhe schriftlich anmelden, Sicherheit zu leisten, soweit sie nicht Befriedigung verlangen können. Dieses Recht steht den Gläubigern jedoch nur zu, wenn sie glaubhaft machen, dass durch die Ausgliederung die Erfüllung der Forderung gefährdet wird."
    },
    {
      "date": "2024-11-05",
      "id": "92585",
      "original_text": "Löschungsankündigung\nNiedersachsen Amtsgericht Hannover HRB 219450\nJuss Drink Germany GmbH – Langenhagen",
      "type": "Löschungsankündigung",
      "state": "Niedersachsen",
      "amtsgericht": "Amtsgericht Hannover",
      "registernummer": "HRB 219450",
      "registerart": "HRB",
      "company_name": "Juss Drink Germany GmbH",
      "company_seat": "Langenhagen",
      "details": "05.11.2024 (Bekanntmachungsdatum)\n\nNiedersachsen Amtsgericht Hannover HRB 219450\nLöschungsankündigung\n\nJuss Drink Germany GmbH\nGesellschaft mit beschränkter Haftung\nLangenhagen\n\nDas Registergericht beabsichtigt, die Gesellschaft von Amts wegen nach § 394 FamFG zu löschen. Die Frist zur Erhebung eines Widerspruchs ist auf 1 Monat ab dieser Registerbekanntmachung festgesetzt."
    },
    {
      "date": "2024-11-05",
      "id": "92586",
      "original_text": "Löschungsankündigung\nBremen Amtsgericht Bremen HRB 34671\nB - G Gerüstbau GmbH – Bremerhaven",
      "type": "Löschungsankündigung",
      "state": "Bremen",
      "amtsgericht": "Amtsgericht Bremen",
      "registernummer": "HRB 34671",
      "registerart": "HRB",
      "company_name": "B - G Gerüstbau GmbH",
      "company_seat": "Bremerhaven",
      "details": "05.11.2024 (Bekanntmachungsdatum)\n\nBremen Amtsgericht Bremen HRB 34671\nLöschungsankündigung\n\nB - G Gerüstbau GmbH\nGesellschaft mit beschränkter Haftung\nBremerhaven\n\nEs ist beabsichtigt die im Handelsregister eingetragene Gesellschaft von Amts wegen gemäß § 394 FamFG zu löschen. Gegen die Löschung kann beim AG Bremen schriftlich oder zu Protokoll der Geschäftsstelle Widerspruch eingelegt werden. Widerspruchsfrist 4 Wochen."
    },
    {
      "date": "2024-11-05",
      "id": "92587",
      "original_text": "Registerbekanntmachung nach dem Umwandlungsgesetz\nRheinland-Pfalz Amtsgericht Zweibrücken HRB 33211\nFrank Breitenborn Baggerbetrieb GmbH – Oberarnbach",
      "type": "Registerbekanntmachung nach dem Umwandlungsgesetz",
      "state": "Rheinland-Pfalz",
      "amtsgericht": "Amtsgericht Zweibrücken",
      "registernummer": "HRB 33211",
      "registerart": "HRB",
      "company_name": "Frank Breitenborn Baggerbetrieb GmbH",
      "company_seat": "Oberarnbach",
      "details": "05.11.2024 (Bekanntmachungsdatum)\n\nRheinland-Pfalz Amtsgericht Zweibrücken HRB 33211\nRegisterbekanntmachung nach dem Umwandlungsgesetz 05.11.2024 (Eintragungsdatum)\n\nFrank Breitenborn Baggerbetrieb GmbH\nGesellschaft mit beschränkter Haftung\nOberarnbach\n\nAls nicht eingetragen wird veröffentlicht: Den Gläubigern der an der Ausgliederung beteiligten Rechtsträger ist, wenn sie binnen sechs Monaten nac hdem Tag, an dem die Eintragung der Ausgliederung in das Register des Sitzes desjenigen Rechtsträgers,dessen Gläubiger sie sind, nach § 19 Abs. 3 UmwG als bekannt gemacht gilt, ihren Anspruch nach Grund und Höhe schriftlich anmelden, Sicherheit zu leisten, soweit sie nicht Befriedigung verlangen können. Dieses Recht steht den Gläubigern jedoch nur zu, wenn sie glaubhaft machen, dass durch die Ausgliederung die Erfüllung der Forderung gefährdet wird."
    },
    {
      "date": "2024-11-05",
      "id": "92588",
      "original_text": "Einreichung neuer Dokumente\nRheinland-Pfalz Amtsgericht Mainz HRB 651\nMainzer Stadtwerke AG – Mainz",
      "type": "Einreichung neuer Dokumente",
      "state": "Rheinland-Pfalz",
      "amtsgericht": "Amtsgericht Mainz",
      "registernummer": "HRB 651",
      "registerart": "HRB",
      "company_name": "Mainzer Stadtwerke AG",
      "company_seat": "Mainz",
      "details": "05.11.2024 (Bekanntmachungsdatum)\n\nRheinland-Pfalz Amtsgericht Mainz HRB 651\nEinreichung neuer Dokumente\n\nMainzer Stadtwerke AG\nAktiengesellschaft\nMainz\n\nDem Registergericht ist eine Liste der Mitglieder des Aufsichtsrates eingereicht worden."
    },
    {
      "date": "2024-11-05",
      "id": "92589",
      "original_text": "Registerbekanntmachung nach dem Umwandlungsgesetz\nRheinland-Pfalz Amtsgericht Zweibrücken HRA 30807\nFrank Breitenborn Baggerbetrieb e.K. – Oberarnbach",
      "type": "Registerbekanntmachung nach dem Umwandlungsgesetz",
      "state": "Rheinland-Pfalz",
      "amtsgericht": "Amtsgericht Zweibrücken",
      "registernummer": "HRA 30807",
      "registerart": "HRA",
      "company_name": "Frank Breitenborn Baggerbetrieb e.K.",
      "company_seat": "Oberarnbach",
      "details": "05.11.2024 (Bekanntmachungsdatum)\n\nRheinland-Pfalz Amtsgericht Zweibrücken HRA 30807\nRegisterbekanntmachung nach dem Umwandlungsgesetz 05.11.2024 (Eintragungsdatum)\n\nFrank Breitenborn Baggerbetrieb e.K.\nEinzelkaufmann / Einzelkauffrau\nOberarnbach\n\nAls nicht eingetragen wird veröffentlicht: Den Gläubigern der an der Ausgliederung beteiligten Rechtsträger ist, wenn sie binnen sechs Monaten nac hdem Tag, an dem die Eintragung der Ausgliederung in das Register des Sitzes desjenigen Rechtsträgers,dessen Gläubiger sie sind, nach § 19 Abs. 3 UmwG als bekannt gemacht gilt, ihren Anspruch nach Grund und Höhe schriftlich anmelden, Sicherheit zu leisten, soweit sie nicht Befriedigung verlangen können. Dieses Recht steht den Gläubigern jedoch nur zu, wenn sie glaubhaft machen, dass durch die Ausgliederung die Erfüllung der Forderung gefährdet wird."
    },
    {
      "date": "2024-11-05",
      "id": "92590",
      "original_text": "Registerbekanntmachung nach dem Umwandlungsgesetz\nRheinland-Pfalz Amtsgericht Koblenz HRB 22901\nCompuGroup Medical Deutschland AG – Koblenz",
      "type": "Registerbekanntmachung nach dem Umwandlungsgesetz",
      "state": "Rheinland-Pfalz",
      "amtsgericht": "Amtsgericht Koblenz",
      "registernummer": "HRB 22901",
      "registerart": "HRB",
      "company_name": "CompuGroup Medical Deutschland AG",
      "company_seat": "Koblenz",
      "details": "05.11.2024 (Bekanntmachungsdatum)\n\nRheinland-Pfalz Amtsgericht Koblenz HRB 22901\nRegisterbekanntmachung nach dem Umwandlungsgesetz 05.11.2024 (Eintragungsdatum)\n\nCompuGroup Medical Deutschland AG\nAktiengesellschaft\nKoblenz\n\nAls nicht eingetragen wird veröffentlicht: Den Gläubigern der an der Verschmelzung beteiligten Rechtsträger ist, wenn sie binnen sechs Monaten nach dem Tag, an dem die Eintragung der Verschmelzung in das Register des Sitzes desjenigen Rechtsträgers,dessen Gläubiger sie sind, nach § 19 Abs. 3 UmwG als bekannt gemacht gilt, ihren Anspruch nach Grund und Höhe schriftlich anmelden, Sicherheit zu leisten, soweit sie nicht Befriedigung verlangen können. Dieses Recht steht den Gläubigern jedoch nur zu, wenn sie glaubhaft machen, dass durch die Verschmelzung die Erfüllungd er Forderung gefährdet wird."
    },
    {
      "date": "2024-11-05",
      "id": "92591",
      "original_text": "Einreichung neuer Dokumente\nRheinland-Pfalz Amtsgericht Landau HRB 32121\nInterbran Systems AG – Lingenfeld",
      "type": "Einreichung neuer Dokumente",
      "state": "Rheinland-Pfalz",
      "amtsgericht": "Amtsgericht Landau",
      "registernummer": "HRB 32121",
      "registerart": "HRB",
      "company_name": "Interbran Systems AG",
      "company_seat": "Lingenfeld",
      "details": "05.11.2024 (Bekanntmachungsdatum)\n\nRheinland-Pfalz Amtsgericht Landau HRB 32121\nEinreichung neuer Dokumente\n\nInterbran Systems AG\nAktiengesellschaft\nLingenfeld\n\nDem Registergericht ist eine Liste der Mitglieder des Aufsichtsrates eingereicht worden."
    },
    {
      "date": "2024-11-05",
      "id": "92592",
      "original_text": "Löschungsankündigung\nRheinland-Pfalz Amtsgericht Bad Kreuznach HRB 23908\nFGIC GmbH – Hoppstädten-Weiersbach",
      "type": "Löschungsankündigung",
      "state": "Rheinland-Pfalz",
      "amtsgericht": "Amtsgericht Bad Kreuznach",
      "registernummer": "HRB 23908",
      "registerart": "HRB",
      "company_name": "FGIC GmbH",
      "company_seat": "Hoppstädten-Weiersbach",
      "details": "05.11.2024 (Bekanntmachungsdatum)\n\nRheinland-Pfalz Amtsgericht Bad Kreuznach HRB 23908\nLöschungsankündigung\n\nFGIC GmbH\nGesellschaft mit beschränkter Haftung\nHoppstädten-Weiersbach\n\nDas Registergericht beabsichtigt die Gesellschaft wegen Vermögenslosigkeit im Handelsregister von Amts wegen nach § 394 FamFG zu löschen. Die Frist zur Erhebung eines Widerspruchs gegen die beabsichtigte Löschung ist auf einen Monat ab Veröffentlichung bestimmt."
    },
    {
      "date": "2024-11-05",
      "id": "92593",
      "original_text": "Einreichung neuer Dokumente\nRheinland-Pfalz Amtsgericht Mainz HRB 22311\nWohnungsbaugesellschaft Ingelheim am Rhein GmbH – Ingelheim am Rhein",
      "type": "Einreichung neuer Dokumente",
      "state": "Rheinland-Pfalz",
      "amtsgericht": "Amtsgericht Mainz",
      "registernummer": "HRB 22311",
      "registerart": "HRB",
      "company_name": "Wohnungsbaugesellschaft Ingelheim am Rhein GmbH",
      "company_seat": "Ingelheim am Rhein",
      "details": "05.11.2024 (Bekanntmachungsdatum)\n\nRheinland-Pfalz Amtsgericht Mainz HRB 22311\nEinreichung neuer Dokumente\n\nWohnungsbaugesellschaft Ingelheim am Rhein GmbH\nGesellschaft mit beschränkter Haftung\nIngelheim am Rhein\n\nDem Registergericht ist eine neue Liste der Mitglieder des Aufsichtsrates eingereicht worden."
    },
    {
      "date": "2024-11-05",
      "id": "92594",
      "original_text": "Registerbekanntmachung nach dem Umwandlungsgesetz\nRheinland-Pfalz Amtsgericht Koblenz HRB 22901\nCompuGroup Medical Deutschland AG – Koblenz",
      "type": "Registerbekanntmachung nach dem Umwandlungsgesetz",
      "state": "Rheinland-Pfalz",
      "amtsgericht": "Amtsgericht Koblenz",
      "registernummer": "HRB 22901",
      "registerart": "HRB",
      "company_name": "CompuGroup Medical Deutschland AG",
      "company_seat": "Koblenz",
      "details": "05.11.2024 (Bekanntmachungsdatum)\n\nRheinland-Pfalz Amtsgericht Koblenz HRB 22901\nRegisterbekanntmachung nach dem Umwandlungsgesetz 05.11.2024 (Eintragungsdatum)\n\nCompuGroup Medical Deutschland AG\nAktiengesellschaft\nKoblenz\n\nAls nicht eingetragen wird veröffentlicht: Den Gläubigern der an der Verschmelzung beteiligten Rechtsträger ist, wenn sie binnen sechs Monaten nach dem Tag, an dem die Eintragung der Verschmelzung in das Register des Sitzes desjenigen Rechtsträgers,dessen Gläubiger sie sind, nach § 19 Abs. 3 UmwG als bekannt gemacht gilt, ihren Anspruch nach Grund und Höhe schriftlich anmelden, Sicherheit zu leisten, soweit sie nicht Befriedigung verlangen können. Dieses Recht steht den Gläubigern jedoch nur zu, wenn sie glaubhaft machen, dass durch die Verschmelzung die Erfüllungd er Forderung gefährdet wird."
    },
    {
      "date": "2024-11-05",
      "id": "92595",
      "original_text": "Registerbekanntmachung nach dem Umwandlungsgesetz\nRheinland-Pfalz Amtsgericht Koblenz HRA 22802\nJan Niklas Schwab e.K. – Koblenz",
      "type": "Registerbekanntmachung nach dem Umwandlungsgesetz",
      "state": "Rheinland-Pfalz",
      "amtsgericht": "Amtsgericht Koblenz",
      "registernummer": "HRA 22802",
      "registerart": "HRA",
      "company_name": "Jan Niklas Schwab e.K.",
      "company_seat": "Koblenz",
      "details": "05.11.2024 (Bekanntmachungsdatum)\n\nRheinland-Pfalz Amtsgericht Koblenz HRA 22802\nRegisterbekanntmachung nach dem Umwandlungsgesetz 05.11.2024 (Eintragungsdatum)\n\nJan Niklas Schwab e.K.\nEinzelkaufmann / Einzelkauffrau\nKoblenz\n\nAls nicht eingetragen wird veröffentlicht: Den Gläubigern der an der Ausgliederung beteiligten Rechtsträger ist, wenn sie binnen sechs Monaten nac hdem Tag, an dem die Eintragung der Ausgliederung in das Register des Sitzes desjenigen Rechtsträgers,dessen Gläubiger sie sind, nach § 19 Abs. 3 UmwG als bekannt gemacht gilt, ihren Anspruch nach Grund und Höhe schriftlich anmelden, Sicherheit zu leisten, soweit sie nicht Befriedigung verlangen können. Dieses Recht steht den Gläubigern jedoch nur zu, wenn sie glaubhaft machen, dass durch die Ausgliederung die Erfüllung der Forderung gefährdet wird."
    },
    {
      "date": "2024-11-05",
      "id": "92596",
      "original_text": "Löschungsankündigung\nRheinland-Pfalz Amtsgericht Koblenz HRB 23710\nKunst Verwaltungs GmbH – Kaisersesch",
      "type": "Löschungsankündigung",
      "state": "Rheinland-Pfalz",
      "amtsgericht": "Amtsgericht Koblenz",
      "registernummer": "HRB 23710",
      "registerart": "HRB",
      "company_name": "Kunst Verwaltungs GmbH",
      "company_seat": "Kaisersesch",
      "details": "05.11.2024 (Bekanntmachungsdatum)\n\nRheinland-Pfalz Amtsgericht Koblenz HRB 23710\nLöschungsankündigung\n\nKunst Verwaltungs GmbH\nGesellschaft mit beschränkter Haftung\nKaisersesch\n\nDas Registergericht beabsichtigt die Gesellschaft von Amts wegen nach § 394 FamFG zu löschen. Die Frist zur Erhebung eines Widerspruchs ist auf einen Monat festgesetzt."
    },
    {
      "date": "2024-11-05",
      "id": "92597",
      "original_text": "Einreichung neuer Dokumente\nRheinland-Pfalz Amtsgericht Koblenz HRB 22901\nCompuGroup Medical Deutschland AG – Koblenz",
      "type": "Einreichung neuer Dokumente",
      "state": "Rheinland-Pfalz",
      "amtsgericht": "Amtsgericht Koblenz",
      "registernummer": "HRB 22901",
      "registerart": "HRB",
      "company_name": "CompuGroup Medical Deutschland AG",
      "company_seat": "Koblenz",
      "details": "05.11.2024 (Bekanntmachungsdatum)\n\nRheinland-Pfalz Amtsgericht Koblenz HRB 22901\nEinreichung neuer Dokumente\n\nCompuGroup Medical Deutschland AG\nAktiengesellschaft\nKoblenz\n\nDem Registergericht ist eine neue Liste der Mitglieder des Aufsichtsrates eingereicht worden."
    },
    {
      "date": "2024-11-05",
      "id": "92598",
      "original_text": "Löschungsankündigung\nNordrhein-Westfalen Amtsgericht Köln HRB 107321\nkleiner Astronaut GmbH – Köln",
      "type": "Löschungsankündigung",
      "state": "Nordrhein-Westfalen",
      "amtsgericht": "Amtsgericht Köln",
      "registernummer": "HRB 107321",
      "registerart": "HRB",
      "company_name": "kleiner Astronaut GmbH",
      "company_seat": "Köln",
      "details": "05.11.2024 (Bekanntmachungsdatum)\n\nNordrhein-Westfalen Amtsgericht Köln HRB 107321\nLöschungsankündigung\n\nkleiner Astronaut GmbH\nGesellschaft mit beschränkter Haftung\nKöln\n\nDas Registergericht beabsichtigt die Gesellschaft von Amts wegen nach § 394 FamFG zu löschen. Die Frist zur Erhebung eines Widerspruchs ist auf einen Monat festgesetzt."
    },
    {
      "date": "2024-11-05",
      "id": "92599",
      "original_text": "Einreichung neuer Dokumente\nNordrhein-Westfalen Amtsgericht Essen HRB 31635\nSTEAG Power GmbH – Essen",
      "type": "Einreichung neuer Dokumente",
      "state": "Nordrhein-Westfalen",
      "amtsgericht": "Amtsgericht Essen",
      "registernummer": "HRB 31635",
      "registerart": "HRB",
      "company_name": "STEAG Power GmbH",
      "company_seat": "Essen",
      "details": "05.11.2024 (Bekanntmachungsdatum)\n\nNordrhein-Westfalen Amtsgericht Essen HRB 31635\nEinreichung neuer Dokumente\n\nSTEAG Power GmbH\nGesellschaft mit beschränkter Haftung\nEssen\n\nAls nicht eingetragen wird bekannt gemacht:\nDem Registergericht ist eine neue Liste der Mitglieder des Aufsichtsrates eingereicht worden."
    },
    {
      "date": "2024-11-05",
      "id": "92600",
      "original_text": "Registerbekanntmachung nach dem Umwandlungsgesetz\nNordrhein-Westfalen Amtsgericht Gütersloh HRA 8523\nKückmann GmbH & Co. KG – Rietberg",
      "type": "Registerbekanntmachung nach dem Umwandlungsgesetz",
      "state": "Nordrhein-Westfalen",
      "amtsgericht": "Amtsgericht Gütersloh",
      "registernummer": "HRA 8523",
      "registerart": "HRA",
      "company_name": "Kückmann GmbH & Co. KG",
      "company_seat": "Rietberg",
      "details": "05.11.2024 (Bekanntmachungsdatum)\n\nNordrhein-Westfalen Amtsgericht Gütersloh HRA 8523\nRegisterbekanntmachung nach dem Umwandlungsgesetz 05.11.2024 (Eintragungsdatum)\n\nKückmann GmbH & Co. KG\nKommanditgesellschaft\nRietberg\n\nDen Gläubigern der an der Ausgliederung beteiligten Rechtsträger ist, wenn sie binnen sechs Monaten nach dem Tag, an dem die Eintragung der Ausgliederung in das Register des Sitzes desjenigen Rechtsträgers, dessen Gläubiger sie sind, nach § 19 Absatz 3 UmwG als bekanntgemacht gilt, ihren Anspruch nach Grund und Höhe schriftlich anmelden, Sicherheit zu leisten, soweit sie nicht Befriedigung verlangen können. Dieses Recht steht den Gläubigern jedoch nur zu, wenn sie glaubhaft machen, dass durch die Ausgliederung die Erfüllung ihrer Forderung gefährdet wird."
    },
    {
      "date": "2024-11-05",
      "id": "92601",
      "original_text": "Registerbekanntmachung nach dem Umwandlungsgesetz\nNordrhein-Westfalen Amtsgericht Köln HRA 37709\nAlfred Widding e.K. – Elsdorf",
      "type": "Registerbekanntmachung nach dem Umwandlungsgesetz",
      "state": "Nordrhein-Westfalen",
      "amtsgericht": "Amtsgericht Köln",
      "registernummer": "HRA 37709",
      "registerart": "HRA",
      "company_name": "Alfred Widding e.K.",
      "company_seat": "Elsdorf",
      "details": "05.11.2024 (Bekanntmachungsdatum)\n\nNordrhein-Westfalen Amtsgericht Köln HRA 37709\nRegisterbekanntmachung nach dem Umwandlungsgesetz 05.11.2024 (Eintragungsdatum)\n\nAlfred Widding e.K.\nEinzelkaufmann / Einzelkauffrau\nElsdorf\n\nDen Gläubigern der an der Ausgliederung beteiligten Rechtsträger ist, wenn sie binnen sechs Monaten nach dem Tag, an dem die Eintragung der Ausgliederung in das Register des Sitzes desjenigen Rechtsträgers, dessen Gläubiger sie sind, nach § 19 Absatz 3 UmwG als bekanntgemacht gilt, ihren Anspruch nach Grund und Höhe schriftlich anmelden, Sicherheit zu leisten, soweit sie nicht Befriedigung verlangen können. Dieses Recht steht den Gläubigern jedoch nur zu, wenn sie glaubhaft machen, dass durch die Ausgliederung die Erfüllung ihrer Forderung gefährdet wird."
    },
    {
      "date": "2024-11-05",
      "id": "92602",
      "original_text": "Registerbekanntmachung nach dem Umwandlungsgesetz\nNordrhein-Westfalen Amtsgericht Iserlohn HRB 8908\nHeinrich Erdmann GmbH – Hemer",
      "type": "Registerbekanntmachung nach dem Umwandlungsgesetz",
      "state": "Nordrhein-Westfalen",
      "amtsgericht": "Amtsgericht Iserlohn",
      "registernummer": "HRB 8908",
      "registerart": "HRB",
      "company_name": "Heinrich Erdmann GmbH",
      "company_seat": "Hemer",
      "details": "05.11.2024 (Bekanntmachungsdatum)\n\nNordrhein-Westfalen Amtsgericht Iserlohn HRB 8908\nRegisterbekanntmachung nach dem Umwandlungsgesetz 04.11.2024 (Eintragungsdatum)\n\nHeinrich Erdmann GmbH\nGesellschaft mit beschränkter Haftung\nHemer\n\nDen Gläubigern der an der Verschmelzung beteiligten Rechtsträger ist, wenn sie binnen sechs Monaten nach dem Tag, an dem die Eintragung der Verschmelzung in das Register des Sitzes desjenigen Rechtsträgers, dessen Gläubiger sie sind, nach § 19 Absatz 3 UmwG als bekanntgemacht gilt, ihren Anspruch nach Grund und Höhe schriftlich anmelden, Sicherheit zu leisten, soweit sie nicht Befriedigung verlangen können. Dieses Recht steht den Gläubigern jedoch nur zu, wenn sie glaubhaft machen, dass durch die Verschmelzung die Erfüllung ihrer Forderung gefährdet wird."
    },
    {
      "date": "2024-11-05",
      "id": "92603",
      "original_text": "Registerbekanntmachung nach dem Umwandlungsgesetz\nNordrhein-Westfalen Amtsgericht Iserlohn HRB 9680\nManVision GmbH – Hemer",
      "type": "Registerbekanntmachung nach dem Umwandlungsgesetz",
      "state": "Nordrhein-Westfalen",
      "amtsgericht": "Amtsgericht Iserlohn",
      "registernummer": "HRB 9680",
      "registerart": "HRB",
      "company_name": "ManVision GmbH",
      "company_seat": "Hemer",
      "details": "05.11.2024 (Bekanntmachungsdatum)\n\nNordrhein-Westfalen Amtsgericht Iserlohn HRB 9680\nRegisterbekanntmachung nach dem Umwandlungsgesetz 04.11.2024 (Eintragungsdatum)\n\nManVision GmbH\nGesellschaft mit beschränkter Haftung\nHemer\n\nDen Gläubigern der an der formwechselnden Umwandlung beteiligten Rechtsträger ist, wenn sie binnen sechs Monaten nach dem Tag, an dem die Eintragung der formwechselnden Umwandlung in das Register des Sitzes desjenigen Rechtsträgers, dessen Gläubiger sie sind, nach § 19 Absatz 3 UmwG als bekanntgemacht gilt, ihren Anspruch nach Grund und Höhe schriftlich anmelden, Sicherheit zu leisten, soweit sie nicht Befriedigung verlangen können. Dieses Recht steht den Gläubigern jedoch nur zu, wenn sie glaubhaft machen, dass durch die formwechselnden Umwandlung die Erfüllung ihrer Forderung gefährdet wird."
    },
    {
      "date": "2024-11-05",
      "id": "92604",
      "original_text": "Registerbekanntmachung nach dem Umwandlungsgesetz\nNordrhein-Westfalen Amtsgericht Gütersloh HRA 8450\nZimmerei Heinz Kückmann e.K., Inh. Tobias Kückmann – Rietberg",
      "type": "Registerbekanntmachung nach dem Umwandlungsgesetz",
      "state": "Nordrhein-Westfalen",
      "amtsgericht": "Amtsgericht Gütersloh",
      "registernummer": "HRA 8450",
      "registerart": "HRA",
      "company_name": "Zimmerei Heinz Kückmann e.K., Inh. Tobias Kückmann",
      "company_seat": "Rietberg",
      "details": "05.11.2024 (Bekanntmachungsdatum)\n\nNordrhein-Westfalen Amtsgericht Gütersloh HRA 8450\nRegisterbekanntmachung nach dem Umwandlungsgesetz 05.11.2024 (Eintragungsdatum)\n\nZimmerei Heinz Kückmann e.K., Inh. Tobias Kückmann\nEinzelkaufmann / Einzelkauffrau\nRietberg\n\nDen Gläubigern der an der Ausgliederung beteiligten Rechtsträger ist, wenn sie binnen sechs Monaten nach dem Tag, an dem die Eintragung der Ausgliederung in das Register des Sitzes desjenigen Rechtsträgers, dessen Gläubiger sie sind, nach § 19 Absatz 3 UmwG als bekanntgemacht gilt, ihren Anspruch nach Grund und Höhe schriftlich anmelden, Sicherheit zu leisten, soweit sie nicht Befriedigung verlangen können. Dieses Recht steht den Gläubigern jedoch nur zu, wenn sie glaubhaft machen, dass durch die Ausgliederung die Erfüllung ihrer Forderung gefährdet wird."
    },
    {
      "date": "2024-11-05",
      "id": "92605",
      "original_text": "Registerbekanntmachung nach dem Umwandlungsgesetz\nNordrhein-Westfalen Amtsgericht Düsseldorf VR 9194\nBerufsverband genossenschaftlicher Geschäftsleiter e.V. – Düsseldorf",
      "type": "Registerbekanntmachung nach dem Umwandlungsgesetz",
      "state": "Nordrhein-Westfalen",
      "amtsgericht": "Amtsgericht Düsseldorf",
      "registernummer": "VR 9194",
      "registerart": "VR",
      "company_name": "Berufsverband genossenschaftlicher Geschäftsleiter e.V.",
      "company_seat": "Düsseldorf",
      "details": "05.11.2024 (Bekanntmachungsdatum)\n\nNordrhein-Westfalen Amtsgericht Düsseldorf VR 9194\nRegisterbekanntmachung nach dem Umwandlungsgesetz 05.11.2024 (Eintragungsdatum)\n\nBerufsverband genossenschaftlicher Geschäftsleiter e.V.\neingetragener Verein\nDüsseldorf\n\nDen Gläubigern der an der Verschmelzung beteiligten Rechtsträger ist, wenn sie binnen sechs Monaten nach dem Tag, an dem die Eintragung der Verschmelzung in das Register des Sitzes desjenigen Rechtsträgers, dessen Gläubiger sie sind, nach § 19 Absatz 3 UmwG als bekanntgemacht gilt, ihren Anspruch nach Grund und Höhe schriftlich anmelden, Sicherheit zu leisten, soweit sie nicht Befriedigung verlangen können. Dieses Recht steht den Gläubigern jedoch nur zu, wenn sie glaubhaft machen, dass durch die Verschmelzung die Erfüllung ihrer Forderung gefährdet wird."
    },
    {
      "date": "2024-11-05",
      "id": "92606",
      "original_text": "Löschungsankündigung\nNordrhein-Westfalen Amtsgericht Köln HRB 117033\nCandy Town Online GmbH – Köln",
      "type": "Löschungsankündigung",
      "state": "Nordrhein-Westfalen",
      "amtsgericht": "Amtsgericht Köln",
      "registernummer": "HRB 117033",
      "registerart": "HRB",
      "company_name": "Candy Town Online GmbH",
      "company_seat": "Köln",
      "details": "05.11.2024 (Bekanntmachungsdatum)\n\nNordrhein-Westfalen Amtsgericht Köln HRB 117033\nLöschungsankündigung\n\nCandy Town Online GmbH\nGesellschaft mit beschränkter Haftung\nKöln\n\nDas Registergericht beabsichtigt die Gesellschaft von Amts wegen nach § 394 FamFG zu löschen. Die Frist zur Erhebung eines Widerspruchs ist auf einen Monat festgesetzt."
    },
    {
      "date": "2024-11-05",
      "id": "92607",
      "original_text": "Registerbekanntmachung nach dem Umwandlungsgesetz\nNordrhein-Westfalen Amtsgericht Gütersloh HRA 7554\nheroal Verpachtungs GmbH & Co.KG – Verl",
      "type": "Registerbekanntmachung nach dem Umwandlungsgesetz",
      "state": "Nordrhein-Westfalen",
      "amtsgericht": "Amtsgericht Gütersloh",
      "registernummer": "HRA 7554",
      "registerart": "HRA",
      "company_name": "heroal Verpachtungs GmbH & Co.KG",
      "company_seat": "Verl",
      "details": "05.11.2024 (Bekanntmachungsdatum)\n\nNordrhein-Westfalen Amtsgericht Gütersloh HRA 7554\nRegisterbekanntmachung nach dem Umwandlungsgesetz 05.11.2024 (Eintragungsdatum)\n\nheroal Verpachtungs GmbH & Co.KG\nKommanditgesellschaft\nVerl\n\nDen Gläubigern der an der Aufspaltung beteiligten Rechtsträger ist, wenn sie binnen sechs Monaten nach dem Tag, an dem die Eintragung der Aufspaltung in das Register des Sitzes derjenigen Rechtsträger deren Gläubiger sie sind, nach § 19 Absatz 3 UmwG als bekanntgemacht gilt, ihren Anspruch nach Grund und Höhe schriftlich anmelden, Sicherheit zu leisten, soweit sie nicht Befriedigung verlangen können. Dieses Recht steht den Gläubigern jedoch nur zu, wenn sie glaubhaft machen, dass durch die Aufspaltung die Erfüllung ihrer Forderung gefährdet wird."
    },
    {
      "date": "2024-11-05",
      "id": "92608",
      "original_text": "Löschungsankündigung\nNordrhein-Westfalen Amtsgericht Dortmund HRB 34727\nWestfälischer Transportservice UG (haftungsbeschränkt) – Werne",
      "type": "Löschungsankündigung",
      "state": "Nordrhein-Westfalen",
      "amtsgericht": "Amtsgericht Dortmund",
      "registernummer": "HRB 34727",
      "registerart": "HRB",
      "company_name": "Westfälischer Transportservice UG (haftungsbeschränkt)",
      "company_seat": "Werne",
      "details": "05.11.2024 (Bekanntmachungsdatum)\n\nNordrhein-Westfalen Amtsgericht Dortmund HRB 34727\nLöschungsankündigung 04.11.2024 (Eintragungsdatum)\n\nWestfälischer Transportservice UG (haftungsbeschränkt)\nGesellschaft mit beschränkter Haftung\nWerne\n\nDas Registergericht beabsichtigt die Gesellschaft von Amts wegen nach § 394 FamFG zu löschen. Die Frist zur Erhebung eines Widerspruchs ist auf zwei Monate festgesetzt."
    },
    {
      "date": "2024-11-05",
      "id": "92609",
      "original_text": "Registerbekanntmachung nach dem Umwandlungsgesetz\nNordrhein-Westfalen Amtsgericht Iserlohn HRA 5734\nGrefe Immobilien GmbH & Co. KG – Altena",
      "type": "Registerbekanntmachung nach dem Umwandlungsgesetz",
      "state": "Nordrhein-Westfalen",
      "amtsgericht": "Amtsgericht Iserlohn",
      "registernummer": "HRA 5734",
      "registerart": "HRA",
      "company_name": "Grefe Immobilien GmbH & Co. KG",
      "company_seat": "Altena",
      "details": "05.11.2024 (Bekanntmachungsdatum)\n\nNordrhein-Westfalen Amtsgericht Iserlohn HRA 5734\nRegisterbekanntmachung nach dem Umwandlungsgesetz 31.10.2024 (Eintragungsdatum)\n\nGrefe Immobilien GmbH & Co. KG\nKommanditgesellschaft\nAltena\n\nDen Gläubigern der an der formwechselnden Umwandlung beteiligten Rechtsträger ist, wenn sie binnen sechs Monaten nach dem Tag, an dem die Eintragung der formwechselnden Umwandlung in das Register des Sitzes desjenigen Rechtsträgers, dessen Gläubiger sie sind, nach § 19 Absatz 3 UmwG als bekanntgemacht gilt, ihren Anspruch nach Grund und Höhe schriftlich anmelden, Sicherheit zu leisten, soweit sie nicht Befriedigung verlangen können. Dieses Recht steht den Gläubigern jedoch nur zu, wenn sie glaubhaft machen, dass durch die formwechselnden Umwandlung die Erfüllung ihrer Forderung gefährdet wird."
    },
    {
      "date": "2024-11-05",
      "id": "92610",
      "original_text": "Einreichung neuer Dokumente\nNordrhein-Westfalen Amtsgericht Essen HRB 19649\nSTEAG GmbH – Essen",
      "type": "Einreichung neuer Dokumente",
      "state": "Nordrhein-Westfalen",
      "amtsgericht": "Amtsgericht Essen",
      "registernummer": "HRB 19649",
      "registerart": "HRB",
      "company_name": "STEAG GmbH",
      "company_seat": "Essen",
      "details": "05.11.2024 (Bekanntmachungsdatum)\n\nNordrhein-Westfalen Amtsgericht Essen HRB 19649\nEinreichung neuer Dokumente\n\nSTEAG GmbH\nGesellschaft mit beschränkter Haftung\nEssen\n\nDem Registergericht ist eine neue Liste der Mitglieder des Aufsichtsrates eingereicht worden."
    },
    {
      "date": "2024-11-05",
      "id": "92611",
      "original_text": "Sonstige Registerbekanntmachung\nNordrhein-Westfalen Amtsgericht Düsseldorf HRB 94037\nPotzler & Stroschän Wirtschaftsberatung GmbH – Düsseldorf",
      "type": "Sonstige Registerbekanntmachung",
      "state": "Nordrhein-Westfalen",
      "amtsgericht": "Amtsgericht Düsseldorf",
      "registernummer": "HRB 94037",
      "registerart": "HRB",
      "company_name": "Potzler & Stroschän Wirtschaftsberatung GmbH",
      "company_seat": "Düsseldorf",
      "details": "05.11.2024 (Bekanntmachungsdatum)\n\nNordrhein-Westfalen Amtsgericht Düsseldorf HRB 94037\nSonstige Registerbekanntmachung 05.11.2024 (Eintragungsdatum)\n\nPotzler & Stroschän Wirtschaftsberatung GmbH\nGesellschaft mit beschränkter Haftung\nDüsseldorf\n\nDie Gesellschaft ist aufgelöst. Von Amts wegen eingetragen."
    },
    {
      "date": "2024-11-05",
      "id": "92612",
      "original_text": "Registerbekanntmachung nach dem Umwandlungsgesetz\nNordrhein-Westfalen Amtsgericht Köln HRB 16527\nMicro Matic Deutschland GmbH – Wesseling",
      "type": "Registerbekanntmachung nach dem Umwandlungsgesetz",
      "state": "Nordrhein-Westfalen",
      "amtsgericht": "Amtsgericht Köln",
      "registernummer": "HRB 16527",
      "registerart": "HRB",
      "company_name": "Micro Matic Deutschland GmbH",
      "company_seat": "Wesseling",
      "details": "05.11.2024 (Bekanntmachungsdatum)\n\nNordrhein-Westfalen Amtsgericht Köln HRB 16527\nRegisterbekanntmachung nach dem Umwandlungsgesetz 05.11.2024 (Eintragungsdatum)\n\nMicro Matic Deutschland GmbH\nGesellschaft mit beschränkter Haftung\nWesseling\n\nDen Gläubigern der an der Verschmelzung beteiligten Rechtsträger ist, wenn sie binnen sechs Monaten nach dem Tag, an dem die Eintragung der Verschmelzung in das Register des Sitzes desjenigen Rechtsträgers, dessen Gläubiger sie sind, nach § 19 Absatz 3 UmwG als bekanntgemacht gilt, ihren Anspruch nach Grund und Höhe schriftlich anmelden, Sicherheit zu leisten, soweit sie nicht Befriedigung verlangen können. Dieses Recht steht den Gläubigern jedoch nur zu, wenn sie glaubhaft machen, dass durch die Verschmelzung die Erfüllung ihrer Forderung gefährdet wird."
    },
    {
      "date": "2024-11-05",
      "id": "92613",
      "original_text": "Löschungsankündigung\nNordrhein-Westfalen Amtsgericht Dortmund HRB 28647\nIntensiv Care Lünen UG (haftungsbeschränkt) – Lünen",
      "type": "Löschungsankündigung",
      "state": "Nordrhein-Westfalen",
      "amtsgericht": "Amtsgericht Dortmund",
      "registernummer": "HRB 28647",
      "registerart": "HRB",
      "company_name": "Intensiv Care Lünen UG (haftungsbeschränkt)",
      "company_seat": "Lünen",
      "details": "05.11.2024 (Bekanntmachungsdatum)\n\nNordrhein-Westfalen Amtsgericht Dortmund HRB 28647\nLöschungsankündigung 05.11.2024 (Eintragungsdatum)\n\nIntensiv Care Lünen UG (haftungsbeschränkt)\nGesellschaft mit beschränkter Haftung\nLünen\n\nDas Registergericht beabsichtigt die Gesellschaft von Amts wegen nach § 394 FamFG zu löschen. Die Frist zur Erhebung eines Widerspruchs ist auf zwei Monate festgesetzt."
    },
    {
      "date": "2024-11-05",
      "id": "92614",
      "original_text": "Löschungsankündigung\nNordrhein-Westfalen Amtsgericht Paderborn VR 1450\nAbendländisches Hilfswerk (A.H.W.) – Paderborn",
      "type": "Löschungsankündigung",
      "state": "Nordrhein-Westfalen",
      "amtsgericht": "Amtsgericht Paderborn",
      "registernummer": "VR 1450",
      "registerart": "VR",
      "company_name": "Abendländisches Hilfswerk (A.H.W.)",
      "company_seat": "Paderborn",
      "details": "05.11.2024 (Bekanntmachungsdatum)\n\nNordrhein-Westfalen Amtsgericht Paderborn VR 1450\nLöschungsankündigung\n\nAbendländisches Hilfswerk (A.H.W.)\neingetragener Verein\nPaderborn\n\nDas Registergericht beabsichtigt, den im Vereinsregister eingetragenen Verein gemäß Wegfall sämtlicher Mitglieder von Amts wegen zu löschen.\n\nGegen diese Verfügung kann Widerspruch eingelegt werden. Die Frist zur Erhebung eines Widerspruchs gegen die beabsichtigte Löschung von Amts wegen ist auf einen Monat festgesetzt.\n\nRechtsbehelfsbelehrung:\n\nGegen diese Verfügung können Sie Widerspruch einlegen.\n\nDer Widerspruch ist bei dem Amtsgericht Paderborn, Am Bogen 2 - 4, 33098 Paderborn schriftlich in deutscher Sprache oder zur Niederschrift der Geschäftsstelle einzulegen. Der Widerspruch kann auch zur Niederschrift der Geschäftsstelle eines jeden Amtsgerichtes abgegeben werden.\nDie Einlegung ist auch durch Übertragung eines elektronischen Dokuments an die elektronische Poststelle des Gerichts möglich. Das elektronische Dokument muss für die Bearbeitung durch das Gericht geeignet und mit einer qualifizierten elektronischen Signatur der verantwortenden Person versehen sein oder von der verantwortenden Person signiert und auf einem sicheren Übermittlungsweg gemäß § 130a ZPO nach näherer Maßgabe der Verordnung über die technischen Rahmenbedingungen des elektronischen Rechtsverkehrs und über das besondere elektronische Behördenpostfach (BGBl. I, S.3803) eingereicht werden. Weitere Informationen erhalten Sie auf der Internetseite www.justiz.de.\n\nDer Widerspruch muss spätestens innerhalb der gesetzten Frist bei dem Amtsgericht Paderborn eingegangen sein. Dies gilt auch dann, wenn der Widerspruch zur Niederschrift der Geschäftsstelle eines anderen Amtsgerichtes abgegeben wurde. Die Frist beginnt mit der Veröffentlichung. Fällt das Ende der Frist auf einen Sonntag, einen allgemeinen Feiertag oder Sonnabend, so endet die Frist mit Ablauf des nächsten Werktages.\n\nDer Widerspruch muss die Bezeichnung der angefochtenen Verfügung sowie die Erklärung enthalten, dass Widerspruch gegen diese Verfügung eingelegt wird. Er ist zu unterzeichnen und soll begründet werden."
    },
    {
      "date": "2024-11-05",
      "id": "92615",
      "original_text": "Sonstige Registerbekanntmachung\nNordrhein-Westfalen Amtsgericht Lemgo HRB 10486\nbuero.de Handel AG – Detmold",
      "type": "Sonstige Registerbekanntmachung",
      "state": "Nordrhein-Westfalen",
      "amtsgericht": "Amtsgericht Lemgo",
      "registernummer": "HRB 10486",
      "registerart": "HRB",
      "company_name": "buero.de Handel AG",
      "company_seat": "Detmold",
      "details": "05.11.2024 (Bekanntmachungsdatum)\n\nNordrhein-Westfalen Amtsgericht Lemgo HRB 10486\nSonstige Registerbekanntmachung\n\nbuero.de Handel AG\nAktiengesellschaft\nDetmold\n\nDem Registergericht ist eine neue Liste der Mitglieder des Aufsichtsrates eingereicht worden."
    },
    {
      "date": "2024-11-05",
      "id": "92616",
      "original_text": "Löschungsankündigung\nNordrhein-Westfalen Amtsgericht Dortmund HRB 32296\nGfl GmbH – Dortmund",
      "type": "Löschungsankündigung",
      "state": "Nordrhein-Westfalen",
      "amtsgericht": "Amtsgericht Dortmund",
      "registernummer": "HRB 32296",
      "registerart": "HRB",
      "company_name": "Gfl GmbH",
      "company_seat": "Dortmund",
      "details": "05.11.2024 (Bekanntmachungsdatum)\n\nNordrhein-Westfalen Amtsgericht Dortmund HRB 32296\nLöschungsankündigung 04.11.2024 (Eintragungsdatum)\n\nGfl GmbH\nGesellschaft mit beschränkter Haftung\nDortmund\n\nDas Registergericht beabsichtigt die Gesellschaft von Amts wegen nach § 394 FamFG zu löschen. Die Frist zur Erhebung eines Widerspruchs ist auf zwei Monate festgesetzt."
    },
    {
      "date": "2024-11-05",
      "id": "92617",
      "original_text": "Registerbekanntmachung nach dem Umwandlungsgesetz\nNordrhein-Westfalen Amtsgericht Köln HRA 37707\nAlfred Widding und Sohn OHG – Elsdorf",
      "type": "Registerbekanntmachung nach dem Umwandlungsgesetz",
      "state": "Nordrhein-Westfalen",
      "amtsgericht": "Amtsgericht Köln",
      "registernummer": "HRA 37707",
      "registerart": "HRA",
      "company_name": "Alfred Widding und Sohn OHG",
      "company_seat": "Elsdorf",
      "details": "05.11.2024 (Bekanntmachungsdatum)\n\nNordrhein-Westfalen Amtsgericht Köln HRA 37707\nRegisterbekanntmachung nach dem Umwandlungsgesetz 05.11.2024 (Eintragungsdatum)\n\nAlfred Widding und Sohn OHG\nOffene Handelsgesellschaft\nElsdorf\n\nDen Gläubigern der an der Ausgliederung beteiligten Rechtsträger ist, wenn sie binnen sechs Monaten nach dem Tag, an dem die Eintragung der Ausgliederung in das Register des Sitzes desjenigen Rechtsträgers, dessen Gläubiger sie sind, nach § 19 Absatz 3 UmwG als bekanntgemacht gilt, ihren Anspruch nach Grund und Höhe schriftlich anmelden, Sicherheit zu leisten, soweit sie nicht Befriedigung verlangen können. Dieses Recht steht den Gläubigern jedoch nur zu, wenn sie glaubhaft machen, dass durch die Ausgliederung die Erfüllung ihrer Forderung gefährdet wird."
    },
    {
      "date": "2024-11-05",
      "id": "92618",
      "original_text": "Löschungsankündigung\nNordrhein-Westfalen Amtsgericht Düsseldorf HRB 89138\nTrading Mall GmbH – Düsseldorf",
      "type": "Löschungsankündigung",
      "state": "Nordrhein-Westfalen",
      "amtsgericht": "Amtsgericht Düsseldorf",
      "registernummer": "HRB 89138",
      "registerart": "HRB",
      "company_name": "Trading Mall GmbH",
      "company_seat": "Düsseldorf",
      "details": "05.11.2024 (Bekanntmachungsdatum)\n\nNordrhein-Westfalen Amtsgericht Düsseldorf HRB 89138\nLöschungsankündigung\n\nTrading Mall GmbH\nGesellschaft mit beschränkter Haftung\nDüsseldorf\n\nDas Registergericht beabsichtigt die Gesellschaft von Amts wegen nach § 394 FamFG zu löschen. Die Frist zur Erhebung eines Widerspruchs ist auf 3 Wochen festgesetzt.\n\nRechtsbehelfsbelehrung:\nDas Widerspruchsrecht steht jedem zu, der an der Unterlassung der Löschung ein berechtigtes Interesse hat. Der Widerspruch ist bei dem Amtsgericht Düsseldorf -Registergericht-, Werdener Straße 1, 40227 Düsseldorf schriftlich in deutscher Sprache oder zur Niederschrift der Geschäftsstelle einzulegen. Der Widerspruch kann auch zur Niederschrift der Geschäftsstelle eines jeden Amtsgerichtes abgegeben werden. Die Einlegung ist auch durch Übertragung eines elektronischen Dokuments an die elektronische Poststelle des Gerichts möglich. Das elektronische Dokument muss für die Bearbeitung durch das Gericht geeignet und mit einer qualifizierten elektronischen Signatur der verantwortenden Person versehen sein oder von der verantwortenden Person signiert und auf einem sicheren Übermittlungsweg gemäß § 130a ZPO nach näherer Maßgabe der Verordnung über die technischen Rahmenbedingungen des elektronischen Rechtsverkehrs und über das besondere elektronische Behördenpostfach (BGBl. I, S.3803) eingereicht werden. Weitere Informationen erhalten Sie auf der Internetseite www.justiz.de.\nDer Widerspruch muss spätestens innerhalb der gesetzten Frist nach dem Datum der Bekanntmachung der Löschungsankündigung bei dem Amtsgericht - Registergericht - Düsseldorf eingegangen sein.  Dies gilt auch dann, wenn der Widerspruch zur Niederschrift der Geschäftsstelle eines anderen Amtsgerichtes abgegeben wurde. Die Frist beginnt mit dem Tage der Bekanntmachung der Löschungsankündigung in dem für die Bekanntmachung der Eintragungen in das Handelsregister bestimmten elektronischen Informations- und Kommunikationssystem nach § 10 des Handelsgesetzbuches. Fällt das Ende der Frist auf einen Sonntag, einen allgemeinen Feiertag oder Sonnabend, so endet die Frist mit Ablauf des nächsten Werktages.\nDer Widerspruch muss die Bezeichnung der angefochtenen Löschungsankündigung sowie die Erklärung enthalten, dass Widerspruch gegen diese Löschungsankündigung eingelegt wird. Er ist zu unterzeichnen und soll begründet werden."
    },
    {
      "date": "2024-11-05",
      "id": "92619",
      "original_text": "Registerbekanntmachung nach dem Umwandlungsgesetz\nNordrhein-Westfalen Amtsgericht Hagen HRA 6556\nMathias Feuerstack e.K. – Hagen",
      "type": "Registerbekanntmachung nach dem Umwandlungsgesetz",
      "state": "Nordrhein-Westfalen",
      "amtsgericht": "Amtsgericht Hagen",
      "registernummer": "HRA 6556",
      "registerart": "HRA",
      "company_name": "Mathias Feuerstack e.K.",
      "company_seat": "Hagen",
      "details": "05.11.2024 (Bekanntmachungsdatum)\n\nNordrhein-Westfalen Amtsgericht Hagen HRA 6556\nRegisterbekanntmachung nach dem Umwandlungsgesetz 05.11.2024 (Eintragungsdatum)\n\nMathias Feuerstack e.K.\nEinzelkaufmann / Einzelkauffrau\nHagen\n\nDen Gläubigern der an der Ausgliederung beteiligten Rechtsträger ist, wenn sie binnen sechs Monaten nach dem Tag, an dem die Eintragung der Ausgliederung in das Register des Sitzes desjenigen Rechtsträgers, dessen Gläubiger sie sind, nach § 19 Absatz 3 UmwG als bekanntgemacht gilt, ihren Anspruch nach Grund und Höhe schriftlich anmelden, Sicherheit zu leisten, soweit sie nicht Befriedigung verlangen können. Dieses Recht steht den Gläubigern jedoch nur zu, wenn sie glaubhaft machen, dass durch die Ausgliederung die Erfüllung ihrer Forderung gefährdet wird."
    },
    {
      "date": "2024-11-05",
      "id": "92620",
      "original_text": "Registerbekanntmachung nach dem Umwandlungsgesetz\nNordrhein-Westfalen Amtsgericht Köln HRB 87217\nKaufhof Ulm GmbH – Köln",
      "type": "Registerbekanntmachung nach dem Umwandlungsgesetz",
      "state": "Nordrhein-Westfalen",
      "amtsgericht": "Amtsgericht Köln",
      "registernummer": "HRB 87217",
      "registerart": "HRB",
      "company_name": "Kaufhof Ulm GmbH",
      "company_seat": "Köln",
      "details": "05.11.2024 (Bekanntmachungsdatum)\n\nNordrhein-Westfalen Amtsgericht Köln HRB 87217\nRegisterbekanntmachung nach dem Umwandlungsgesetz 05.11.2024 (Eintragungsdatum)\n\nKaufhof Ulm GmbH\nGesellschaft mit beschränkter Haftung\nKöln\n\nDen Gläubigern der an der formwechselnden Umwandlung beteiligten Rechtsträger ist, wenn sie binnen sechs Monaten nach dem Tag, an dem die Eintragung der formwechselnden Umwandlung in das Register des Sitzes derjenigen Rechtsträger deren Gläubiger sie sind, nach § 19 Absatz 3 UmwG als bekanntgemacht gilt, ihren Anspruch nach Grund und Höhe schriftlich anmelden, Sicherheit zu leisten, soweit sie nicht Befriedigung verlangen können. Dieses Recht steht den Gläubigern jedoch nur zu, wenn sie glaubhaft machen, dass durch die formwechselnden Umwandlung die Erfüllung ihrer Forderung gefährdet wird."
    },
    {
      "date": "2024-11-05",
      "id": "92621",
      "original_text": "Einreichung neuer Dokumente\nNordrhein-Westfalen Amtsgericht Duisburg HRB 14649\nPVS holding GmbH – Mülheim an der Ruhr",
      "type": "Einreichung neuer Dokumente",
      "state": "Nordrhein-Westfalen",
      "amtsgericht": "Amtsgericht Duisburg",
      "registernummer": "HRB 14649",
      "registerart": "HRB",
      "company_name": "PVS holding GmbH",
      "company_seat": "Mülheim an der Ruhr",
      "details": "05.11.2024 (Bekanntmachungsdatum)\n\nNordrhein-Westfalen Amtsgericht Duisburg HRB 14649\nEinreichung neuer Dokumente\n\nPVS holding GmbH\nGesellschaft mit beschränkter Haftung\nMülheim an der Ruhr\n\nDem Registergericht ist eine Liste der Mitglieder des Aufsichtsrates eingereicht worden."
    },
    {
      "date": "2024-11-05",
      "id": "92622",
      "original_text": "Registerbekanntmachung nach dem Umwandlungsgesetz\nNordrhein-Westfalen Amtsgericht Bad Oeynhausen HRA 10403\nSanitätshaus Dirk Schröer e.K. – Vlotho",
      "type": "Registerbekanntmachung nach dem Umwandlungsgesetz",
      "state": "Nordrhein-Westfalen",
      "amtsgericht": "Amtsgericht Bad Oeynhausen",
      "registernummer": "HRA 10403",
      "registerart": "HRA",
      "company_name": "Sanitätshaus Dirk Schröer e.K.",
      "company_seat": "Vlotho",
      "details": "05.11.2024 (Bekanntmachungsdatum)\n\nNordrhein-Westfalen Amtsgericht Bad Oeynhausen HRA 10403\nRegisterbekanntmachung nach dem Umwandlungsgesetz 05.11.2024 (Eintragungsdatum)\n\nSanitätshaus Dirk Schröer e.K.\nEinzelkaufmann / Einzelkauffrau\nVlotho\n\nDen Gläubigern der an der Ausgliederung beteiligten Rechtsträger ist, wenn sie binnen sechs Monaten nach dem Tag, an dem die Eintragung der Ausgliederung in das Register des Sitzes desjenigen Rechtsträgers, dessen Gläubiger sie sind, nach § 19 Absatz 3 UmwG als bekanntgemacht gilt, ihren Anspruch nach Grund und Höhe schriftlich anmelden, Sicherheit zu leisten, soweit sie nicht Befriedigung verlangen können. Dieses Recht steht den Gläubigern jedoch nur zu, wenn sie glaubhaft machen, dass durch die Ausgliederung die Erfüllung ihrer Forderung gefährdet wird."
    },
    {
      "date": "2024-11-05",
      "id": "92623",
      "original_text": "Registerbekanntmachung nach dem Umwandlungsgesetz\nNordrhein-Westfalen Amtsgericht Gütersloh HRA 3714\nheroal - Johann Henkenjohann GmbH & Co. KG – Verl",
      "type": "Registerbekanntmachung nach dem Umwandlungsgesetz",
      "state": "Nordrhein-Westfalen",
      "amtsgericht": "Amtsgericht Gütersloh",
      "registernummer": "HRA 3714",
      "registerart": "HRA",
      "company_name": "heroal - Johann Henkenjohann GmbH & Co. KG",
      "company_seat": "Verl",
      "details": "05.11.2024 (Bekanntmachungsdatum)\n\nNordrhein-Westfalen Amtsgericht Gütersloh HRA 3714\nRegisterbekanntmachung nach dem Umwandlungsgesetz 05.11.2024 (Eintragungsdatum)\n\nheroal - Johann Henkenjohann GmbH & Co. KG\nKommanditgesellschaft\nVerl\n\nDen Gläubigern der an der Aufspaltung beteiligten Rechtsträger ist, wenn sie binnen sechs Monaten nach dem Tag, an dem die Eintragung der Aufspaltung in das Register des Sitzes derjenigen Rechtsträger deren Gläubiger sie sind, nach § 19 Absatz 3 UmwG als bekanntgemacht gilt, ihren Anspruch nach Grund und Höhe schriftlich anmelden, Sicherheit zu leisten, soweit sie nicht Befriedigung verlangen können. Dieses Recht steht den Gläubigern jedoch nur zu, wenn sie glaubhaft machen, dass durch die Aufspaltung die Erfüllung ihrer Forderung gefährdet wird."
    },
    {
      "date": "2024-11-05",
      "id": "92624",
      "original_text": "Löschungsankündigung\nNordrhein-Westfalen Amtsgericht Wuppertal HRB 11377\nCaspar Hahn Verwaltungs-GmbH – Remscheid",
      "type": "Löschungsankündigung",
      "state": "Nordrhein-Westfalen",
      "amtsgericht": "Amtsgericht Wuppertal",
      "registernummer": "HRB 11377",
      "registerart": "HRB",
      "company_name": "Caspar Hahn Verwaltungs-GmbH",
      "company_seat": "Remscheid",
      "details": "05.11.2024 (Bekanntmachungsdatum)\n\nNordrhein-Westfalen Amtsgericht Wuppertal HRB 11377\nLöschungsankündigung\n\nCaspar Hahn Verwaltungs-GmbH\nGesellschaft mit beschränkter Haftung\nRemscheid\n\nDas Registergericht beabsichtigt die Gesellschaft von Amts wegen nach § 394 FamFG zu löschen. Die Frist zur Erhebung eines Widerspruchs ist auf einen Monat festgesetzt."
    },
    {
      "date": "2024-11-05",
      "id": "92625",
      "original_text": "Einreichung neuer Dokumente\nNordrhein-Westfalen Amtsgericht Aachen HRB 13990\nHemoteq AG – Würselen",
      "type": "Einreichung neuer Dokumente",
      "state": "Nordrhein-Westfalen",
      "amtsgericht": "Amtsgericht Aachen",
      "registernummer": "HRB 13990",
      "registerart": "HRB",
      "company_name": "Hemoteq AG",
      "company_seat": "Würselen",
      "details": "05.11.2024 (Bekanntmachungsdatum)\n\nNordrhein-Westfalen Amtsgericht Aachen HRB 13990\nEinreichung neuer Dokumente 31.10.2024 (Eintragungsdatum)\n\nHemoteq AG\nAktiengesellschaft\nWürselen\n\nDem Registergericht ist eine neue Liste der Mitglieder des Aufsichtsrates eingereicht worden."
    },
    {
      "date": "2024-11-05",
      "id": "92626",
      "original_text": "Löschungsankündigung\nNordrhein-Westfalen Amtsgericht Düsseldorf HRB 90159\nGenia Investment Group GmbH – Düsseldorf",
      "type": "Löschungsankündigung",
      "state": "Nordrhein-Westfalen",
      "amtsgericht": "Amtsgericht Düsseldorf",
      "registernummer": "HRB 90159",
      "registerart": "HRB",
      "company_name": "Genia Investment Group GmbH",
      "company_seat": "Düsseldorf",
      "details": "05.11.2024 (Bekanntmachungsdatum)\n\nNordrhein-Westfalen Amtsgericht Düsseldorf HRB 90159\nLöschungsankündigung\n\nGenia Investment Group GmbH\nGesellschaft mit beschränkter Haftung\nDüsseldorf\n\nDas Registergericht beabsichtigt die Gesellschaft von Amts wegen nach § 394 FamFG zu löschen. Die Frist zur Erhebung eines Widerspruchs ist auf 3 Wochen festgesetzt.\n\nRechtsbehelfsbelehrung:\nDas Widerspruchsrecht steht jedem zu, der an der Unterlassung der Löschung ein berechtigtes Interesse hat. Der Widerspruch ist bei dem Amtsgericht Düsseldorf -Registergericht-, Werdener Straße 1, 40227 Düsseldorf schriftlich in deutscher Sprache oder zur Niederschrift der Geschäftsstelle einzulegen. Der Widerspruch kann auch zur Niederschrift der Geschäftsstelle eines jeden Amtsgerichtes abgegeben werden. Die Einlegung ist auch durch Übertragung eines elektronischen Dokuments an die elektronische Poststelle des Gerichts möglich. Das elektronische Dokument muss für die Bearbeitung durch das Gericht geeignet und mit einer qualifizierten elektronischen Signatur der verantwortenden Person versehen sein oder von der verantwortenden Person signiert und auf einem sicheren Übermittlungsweg gemäß § 130a ZPO nach näherer Maßgabe der Verordnung über die technischen Rahmenbedingungen des elektronischen Rechtsverkehrs und über das besondere elektronische Behördenpostfach (BGBl. I, S.3803) eingereicht werden. Weitere Informationen erhalten Sie auf der Internetseite www.justiz.de.\nDer Widerspruch muss spätestens innerhalb der gesetzten Frist nach dem Datum der Bekanntmachung der Löschungsankündigung bei dem Amtsgericht - Registergericht - Düsseldorf eingegangen sein.  Dies gilt auch dann, wenn der Widerspruch zur Niederschrift der Geschäftsstelle eines anderen Amtsgerichtes abgegeben wurde. Die Frist beginnt mit dem Tage der Bekanntmachung der Löschungsankündigung in dem für die Bekanntmachung der Eintragungen in das Handelsregister bestimmten elektronischen Informations- und Kommunikationssystem nach § 10 des Handelsgesetzbuches. Fällt das Ende der Frist auf einen Sonntag, einen allgemeinen Feiertag oder Sonnabend, so endet die Frist mit Ablauf des nächsten Werktages.\nDer Widerspruch muss die Bezeichnung der angefochtenen Löschungsankündigung sowie die Erklärung enthalten, dass Widerspruch gegen diese Löschungsankündigung eingelegt wird. Er ist zu unterzeichnen und soll begründet werden."
    },
    {
      "date": "2024-11-05",
      "id": "92627",
      "original_text": "Löschungsankündigung\nNordrhein-Westfalen Amtsgericht Dortmund HRB 32658\nMero GmbH – Dortmund",
      "type": "Löschungsankündigung",
      "state": "Nordrhein-Westfalen",
      "amtsgericht": "Amtsgericht Dortmund",
      "registernummer": "HRB 32658",
      "registerart": "HRB",
      "company_name": "Mero GmbH",
      "company_seat": "Dortmund",
      "details": "05.11.2024 (Bekanntmachungsdatum)\n\nNordrhein-Westfalen Amtsgericht Dortmund HRB 32658\nLöschungsankündigung 05.11.2024 (Eintragungsdatum)\n\nMero GmbH\nGesellschaft mit beschränkter Haftung\nDortmund\n\nDas Registergericht beabsichtigt die Gesellschaft von Amts wegen nach § 394 FamFG zu löschen. Die Frist zur Erhebung eines Widerspruchs ist auf zwei Monate festgesetzt."
    },
    {
      "date": "2024-11-05",
      "id": "92628",
      "original_text": "Registerbekanntmachung nach dem Umwandlungsgesetz\nNordrhein-Westfalen Amtsgericht Bielefeld HRA 14755\nDralle Aufzüge GmbH & Co. KG – Bielefeld",
      "type": "Registerbekanntmachung nach dem Umwandlungsgesetz",
      "state": "Nordrhein-Westfalen",
      "amtsgericht": "Amtsgericht Bielefeld",
      "registernummer": "HRA 14755",
      "registerart": "HRA",
      "company_name": "Dralle Aufzüge GmbH & Co. KG",
      "company_seat": "Bielefeld",
      "details": "05.11.2024 (Bekanntmachungsdatum)\n\nNordrhein-Westfalen Amtsgericht Bielefeld HRA 14755\nRegisterbekanntmachung nach dem Umwandlungsgesetz 05.11.2024 (Eintragungsdatum)\n\nDralle Aufzüge GmbH & Co. KG\nKommanditgesellschaft\nBielefeld\n\nDen Gläubigern der an der Verschmelzung beteiligten Rechtsträger ist, wenn sie binnen sechs Monaten nach dem Tag, an dem die Eintragung der Verschmelzung in das Register des Sitzes desjenigen Rechtsträgers, dessen Gläubiger sie sind, nach § 19 Absatz 3 UmwG als bekanntgemacht gilt, ihren Anspruch nach Grund und Höhe schriftlich anmelden, Sicherheit zu leisten, soweit sie nicht Befriedigung verlangen können. Dieses Recht steht den Gläubigern jedoch nur zu, wenn sie glaubhaft machen, dass durch die Verschmelzung die Erfüllung ihrer Forderung gefährdet wird."
    },
    {
      "date": "2024-11-05",
      "id": "92629",
      "original_text": "Löschungsankündigung\nHessen Amtsgericht Darmstadt HRB 99459\nGerman Green Tec International GmbH – Mörfelden-Walldorf",
      "type": "Löschungsankündigung",
      "state": "Hessen",
      "amtsgericht": "Amtsgericht Darmstadt",
      "registernummer": "HRB 99459",
      "registerart": "HRB",
      "company_name": "German Green Tec International GmbH",
      "company_seat": "Mörfelden-Walldorf",
      "details": "05.11.2024 (Bekanntmachungsdatum)\n\nHessen Amtsgericht Darmstadt HRB 99459\nLöschungsankündigung\n\nGerman Green Tec International GmbH\nGesellschaft mit beschränkter Haftung\nMörfelden-Walldorf\n\nDas Registergericht beabsichtigt die im Handelsregister eingetragene Gesellschaft von Amts wegen nach § 394 FamFG zu löschen. Die Frist zur Erhebung eines Widerspruchs gegen die beabsichtigte Löschung wird auf 3 Monate festgesetzt."
    },
    {
      "date": "2024-11-05",
      "id": "92630",
      "original_text": "Einreichung neuer Dokumente\nHessen Amtsgericht Marburg HRB 2282\nINOSOFT AG – Marburg",
      "type": "Einreichung neuer Dokumente",
      "state": "Hessen",
      "amtsgericht": "Amtsgericht Marburg",
      "registernummer": "HRB 2282",
      "registerart": "HRB",
      "company_name": "INOSOFT AG",
      "company_seat": "Marburg",
      "details": "05.11.2024 (Bekanntmachungsdatum)\n\nHessen Amtsgericht Marburg HRB 2282\nEinreichung neuer Dokumente\n\nINOSOFT AG\nAktiengesellschaft\nMarburg\n\nDurch eine Änderung in den Personen der Aufsichtsratsmitglieder ist eine Liste der Mitglieder des Aufsichtsrates zum Handelsregister eingereicht worden."
    },
    {
      "date": "2024-11-05",
      "id": "92631",
      "original_text": "Registerbekanntmachung nach dem Umwandlungsgesetz\nHessen Amtsgericht Darmstadt HRA 87547\nMarneth e. K. – Wald-Michelbach",
      "type": "Registerbekanntmachung nach dem Umwandlungsgesetz",
      "state": "Hessen",
      "amtsgericht": "Amtsgericht Darmstadt",
      "registernummer": "HRA 87547",
      "registerart": "HRA",
      "company_name": "Marneth e. K.",
      "company_seat": "Wald-Michelbach",
      "details": "05.11.2024 (Bekanntmachungsdatum)\n\nHessen Amtsgericht Darmstadt HRA 87547\nRegisterbekanntmachung nach dem Umwandlungsgesetz 05.11.2024 (Eintragungsdatum)\n\nMarneth e. K.\nEinzelkaufmann / Einzelkauffrau\nWald-Michelbach\n\nDen Gläubigern der an der Verschmelzung beteiligten Rechtsträger ist, wenn sie binnen sechs Monaten nach dem Tag, an dem die Eintragung der Verschmelzung in das Register des Sitzes derjenigen Rechtsträger deren Gläubiger sie sind, nach § 19 Absatz 3 UmwG bekannt gemacht worden ist, ihren Anspruch nach Grund und Höhe schriftlich anmelden, Sicherheit zu leisten, soweit sie nicht Befriedigung verlangen können. Dieses Recht steht den Gläubigern jedoch nur zu, wenn sie glaubhaft machen, dass durch die Verschmelzung die Erfüllung ihrer Forderung gefährdet wird."
    },
    {
      "date": "2024-11-05",
      "id": "92632",
      "original_text": "Registerbekanntmachung nach dem Umwandlungsgesetz\nHessen Amtsgericht Hanau HRB 95771\nHera Equinox Verwaltungs-GmbH – Linsengericht",
      "type": "Registerbekanntmachung nach dem Umwandlungsgesetz",
      "state": "Hessen",
      "amtsgericht": "Amtsgericht Hanau",
      "registernummer": "HRB 95771",
      "registerart": "HRB",
      "company_name": "Hera Equinox Verwaltungs-GmbH",
      "company_seat": "Linsengericht",
      "details": "05.11.2024 (Bekanntmachungsdatum)\n\nHessen Amtsgericht Hanau HRB 95771\nRegisterbekanntmachung nach dem Umwandlungsgesetz 05.11.2024 (Eintragungsdatum)\n\nHera Equinox Verwaltungs-GmbH\nGesellschaft mit beschränkter Haftung\nLinsengericht\n\nDen Gläubigern der an der Verschmelzung beteiligten Rechtsträger ist, wenn sie binnen sechs Monaten nach dem Tag, an dem die Eintragung der Verschmelzung in das Register des Sitzes desjenigen Rechtsträgers, dessen Gläubiger sie sind, nach § 19 Absatz 3 UmwG bekannt gemacht worden ist, ihren Anspruch nach Grund und Höhe schriftlich anmelden, Sicherheit zu leisten, soweit sie nicht Befriedigung verlangen können. Dieses Recht steht den Gläubigern jedoch nur zu, wenn sie glaubhaft machen, dass durch die Verschmelzung die Erfüllung ihrer Forderung gefährdet wird."
    },
    {
      "date": "2024-11-05",
      "id": "92633",
      "original_text": "Registerbekanntmachung nach dem Umwandlungsgesetz\nHessen Amtsgericht Darmstadt HRB 99355\nMarneth Verwaltungs GmbH – Wald-Michelbach",
      "type": "Registerbekanntmachung nach dem Umwandlungsgesetz",
      "state": "Hessen",
      "amtsgericht": "Amtsgericht Darmstadt",
      "registernummer": "HRB 99355",
      "registerart": "HRB",
      "company_name": "Marneth Verwaltungs GmbH",
      "company_seat": "Wald-Michelbach",
      "details": "05.11.2024 (Bekanntmachungsdatum)\n\nHessen Amtsgericht Darmstadt HRB 99355\nRegisterbekanntmachung nach dem Umwandlungsgesetz 05.11.2024 (Eintragungsdatum)\n\nMarneth Verwaltungs GmbH\nGesellschaft mit beschränkter Haftung\nWald-Michelbach\n\nDen Gläubigern der an der Verschmelzung beteiligten Rechtsträger ist, wenn sie binnen sechs Monaten nach dem Tag, an dem die Eintragung der Verschmelzung in das Register des Sitzes derjenigen Rechtsträger deren Gläubiger sie sind, nach § 19 Absatz 3 UmwG bekannt gemacht worden ist, ihren Anspruch nach Grund und Höhe schriftlich anmelden, Sicherheit zu leisten, soweit sie nicht Befriedigung verlangen können. Dieses Recht steht den Gläubigern jedoch nur zu, wenn sie glaubhaft machen, dass durch die Verschmelzung die Erfüllung ihrer Forderung gefährdet wird."
    },
    {
      "date": "2024-11-05",
      "id": "92634",
      "original_text": "Löschungsankündigung\nHessen Amtsgericht Offenbach am Main HRB 51987\nGani Dienstleistung Gebäudeservice GmbH – Dreieich",
      "type": "Löschungsankündigung",
      "state": "Hessen",
      "amtsgericht": "Amtsgericht Offenbach am Main",
      "registernummer": "HRB 51987",
      "registerart": "HRB",
      "company_name": "Gani Dienstleistung Gebäudeservice GmbH",
      "company_seat": "Dreieich",
      "details": "05.11.2024 (Bekanntmachungsdatum)\n\nHessen Amtsgericht Offenbach am Main HRB 51987\nLöschungsankündigung\n\nGani Dienstleistung Gebäudeservice GmbH\nGesellschaft mit beschränkter Haftung\nDreieich\n\nDas Registergericht beabsichtigt die im Handelsregister eingetragene Gesellschaft von Amts wegen nach § 394 FamFG zu löschen. Die Frist zur Erhebung eines Widerspruchs gegen die beabsichtigte Löschung wird auf 3 Monate festgesetzt."
    },
    {
      "date": "2024-11-05",
      "id": "92635",
      "original_text": "Löschungsankündigung\nHessen Amtsgericht Darmstadt HRB 96811\nStar Cargo Trans GmbH – Kelsterbach",
      "type": "Löschungsankündigung",
      "state": "Hessen",
      "amtsgericht": "Amtsgericht Darmstadt",
      "registernummer": "HRB 96811",
      "registerart": "HRB",
      "company_name": "Star Cargo Trans GmbH",
      "company_seat": "Kelsterbach",
      "details": "05.11.2024 (Bekanntmachungsdatum)\n\nHessen Amtsgericht Darmstadt HRB 96811\nLöschungsankündigung\n\nStar Cargo Trans GmbH\nGesellschaft mit beschränkter Haftung\nKelsterbach\n\nDas Registergericht beabsichtigt die im Handelsregister eingetragene Gesellschaft von Amts wegen nach § 394 FamFG zu löschen. Die Frist zur Erhebung eines Widerspruchs gegen die beabsichtigte Löschung wird auf 3 Monate festgesetzt."
    },
    {
      "date": "2024-11-05",
      "id": "92636",
      "original_text": "Löschungsankündigung\nHessen Amtsgericht Hanau HRB 95680\nHera Linsengericht GmbH – Gelnhausen",
      "type": "Löschungsankündigung",
      "state": "Hessen",
      "amtsgericht": "Amtsgericht Hanau",
      "registernummer": "HRB 95680",
      "registerart": "HRB",
      "company_name": "Hera Linsengericht GmbH",
      "company_seat": "Gelnhausen",
      "details": "05.11.2024 (Bekanntmachungsdatum)\n\nHessen Amtsgericht Hanau HRB 95680\nLöschungsankündigung 05.11.2024 (Eintragungsdatum)\n\nHera Linsengericht GmbH\nGesellschaft mit beschränkter Haftung\nGelnhausen\n\nDen Gläubigern der an der Verschmelzung beteiligten Rechtsträger ist, wenn sie binnen sechs Monaten nach dem Tag, an dem die Eintragung der Verschmelzung in das Register des Sitzes desjenigen Rechtsträgers, dessen Gläubiger sie sind, nach § 19 Absatz 3 UmwG bekannt gemacht worden ist, ihren Anspruch nach Grund und Höhe schriftlich anmelden, Sicherheit zu leisten, soweit sie nicht Befriedigung verlangen können. Dieses Recht steht den Gläubigern jedoch nur zu, wenn sie glaubhaft machen, dass durch die Verschmelzung die Erfüllung ihrer Forderung gefährdet wird."
    },
    {
      "date": "2024-11-05",
      "id": "92637",
      "original_text": "Löschungsankündigung\nHessen Amtsgericht Offenbach am Main HRB 53517\nZH Ventures GmbH – Neu-Isenburg",
      "type": "Löschungsankündigung",
      "state": "Hessen",
      "amtsgericht": "Amtsgericht Offenbach am Main",
      "registernummer": "HRB 53517",
      "registerart": "HRB",
      "company_name": "ZH Ventures GmbH",
      "company_seat": "Neu-Isenburg",
      "details": "05.11.2024 (Bekanntmachungsdatum)\n\nHessen Amtsgericht Offenbach am Main HRB 53517\nLöschungsankündigung\n\nZH Ventures GmbH\nGesellschaft mit beschränkter Haftung\nNeu-Isenburg\n\nDas Registergericht beabsichtigt die im Handelsregister eingetragene Gesellschaft von Amts wegen nach § 394 FamFG zu löschen. Die Frist zur Erhebung eines Widerspruchs gegen die beabsichtigte Löschung wird auf 3 Monate festgesetzt."
    },
    {
      "date": "2024-11-05",
      "id": "92638",
      "original_text": "Löschungsankündigung\nHessen Amtsgericht Frankfurt am Main HRB 105271\nAIB.CONTRAC AG – Frankfurt am Main",
      "type": "Löschungsankündigung",
      "state": "Hessen",
      "amtsgericht": "Amtsgericht Frankfurt am Main",
      "registernummer": "HRB 105271",
      "registerart": "HRB",
      "company_name": "AIB.CONTRAC AG",
      "company_seat": "Frankfurt am Main",
      "details": "05.11.2024 (Bekanntmachungsdatum)\n\nHessen Amtsgericht Frankfurt am Main HRB 105271\nLöschungsankündigung\n\nAIB.CONTRAC AG\nAktiengesellschaft\nFrankfurt am Main\n\nDas Registergericht beabsichtigt die im Handelsregister eingetragene Gesellschaft von Amts wegen nach § 394 FamFG zu löschen. Die Frist zur Erhebung eines Widerspruchs gegen die beabsichtigte Löschung wird auf 1 Monate festgesetzt."
    },
    {
      "date": "2024-11-05",
      "id": "92639",
      "original_text": "Einreichung neuer Dokumente\nHessen Amtsgericht Offenbach am Main HRB 51609\nViridium Rückversicherung AG – Neu-Isenburg",
      "type": "Einreichung neuer Dokumente",
      "state": "Hessen",
      "amtsgericht": "Amtsgericht Offenbach am Main",
      "registernummer": "HRB 51609",
      "registerart": "HRB",
      "company_name": "Viridium Rückversicherung AG",
      "company_seat": "Neu-Isenburg",
      "details": "05.11.2024 (Bekanntmachungsdatum)\n\nHessen Amtsgericht Offenbach am Main HRB 51609\nEinreichung neuer Dokumente 05.11.2024 (Eintragungsdatum)\n\nViridium Rückversicherung AG\nAktiengesellschaft\nNeu-Isenburg\n\nDurch eine Änderung in den Personen der Aufsichtsratsmitglieder ist eine Liste der Mitglieder des Aufsichtsrates zum Handelsregister eingereicht worden."
    },
    {
      "date": "2024-11-05",
      "id": "92640",
      "original_text": "Löschungsankündigung\nHessen Amtsgericht Offenbach am Main HRB 48187\nBWS GmbH – Offenbach am Main",
      "type": "Löschungsankündigung",
      "state": "Hessen",
      "amtsgericht": "Amtsgericht Offenbach am Main",
      "registernummer": "HRB 48187",
      "registerart": "HRB",
      "company_name": "BWS GmbH",
      "company_seat": "Offenbach am Main",
      "details": "05.11.2024 (Bekanntmachungsdatum)\n\nHessen Amtsgericht Offenbach am Main HRB 48187\nLöschungsankündigung\n\nBWS GmbH\nGesellschaft mit beschränkter Haftung\nOffenbach am Main\n\nDas Registergericht beabsichtigt die im Handelsregister eingetragene Gesellschaft von Amts wegen nach § 394 FamFG zu löschen. Die Frist zur Erhebung eines Widerspruchs gegen die beabsichtigte Löschung wird auf 3 Monate festgesetzt."
    }
  ]
}