{
  "date": "2024-11-14",
  "date_of_scrape": "2024-11-30T13:12:05.535Z",
  "tool_version": "0.2.0",
  "number_of_announcements": 186,
  "announcements": [
    {
      "date": "2024-11-14",
      "id": "93573",
      "original_text": "Löschungsankündigung\nNordrhein-Westfalen Amtsgericht Paderborn HRA 4506\n\"Meierhof\" Privatbrauerei GmbH & Co. KG – Höxter-Ottbergen",
      "type": "Löschungsankündigung",
      "state": "Nordrhein-Westfalen",
      "amtsgericht": "Amtsgericht Paderborn",
      "registernummer": "HRA 4506",
      "registerart": "HRA",
      "company_name": "\"Meierhof\" Privatbrauerei GmbH & Co. KG",
      "company_seat": "Höxter-Ottbergen",
      "details": "14.11.2024 (Bekanntmachungsdatum)\n\nNordrhein-Westfalen Amtsgericht Paderborn HRA 4506\nLöschungsankündigung 14.11.2024 (Eintragungsdatum)\n\n\"Meierhof\" Privatbrauerei GmbH & Co. KG\nKommanditgesellschaft\nHöxter-Ottbergen\n\nDas Registergericht beabsichtigt die Firma von Amts wegen nach § 394 FamFG zu löschen. Die Frist zur Erhebung eines Widerspruchs ist auf einen Monat festgesetzt."
    },
    {
      "date": "2024-11-14",
      "id": "93576",
      "original_text": "Löschungsankündigung\nNordrhein-Westfalen Amtsgericht Paderborn HRA 4506\n\"Meierhof\" Privatbrauerei GmbH & Co. KG – Höxter-Ottbergen",
      "type": "Löschungsankündigung",
      "state": "Nordrhein-Westfalen",
      "amtsgericht": "Amtsgericht Paderborn",
      "registernummer": "HRA 4506",
      "registerart": "HRA",
      "company_name": "\"Meierhof\" Privatbrauerei GmbH & Co. KG",
      "company_seat": "Höxter-Ottbergen",
      "details": "14.11.2024 (Bekanntmachungsdatum)\n\nNordrhein-Westfalen Amtsgericht Paderborn HRA 4506\nLöschungsankündigung 14.11.2024 (Eintragungsdatum)\n\n\"Meierhof\" Privatbrauerei GmbH & Co. KG\nKommanditgesellschaft\nHöxter-Ottbergen\n\nDas Registergericht beabsichtigt die Firma von Amts wegen nach § 394 FamFG zu löschen. Die Frist zur Erhebung eines Widerspruchs ist auf einen Monat festgesetzt."
    },
    {
      "date": "2024-11-14",
      "id": "93463",
      "original_text": "Sonstige Registerbekanntmachung\nBaden-Württemberg Amtsgericht Stuttgart HRB 753340\nA. + G. Anlagenbau GmbH – Stuttgart",
      "type": "Sonstige Registerbekanntmachung",
      "state": "Baden-Württemberg",
      "amtsgericht": "Amtsgericht Stuttgart",
      "registernummer": "HRB 753340",
      "registerart": "HRB",
      "company_name": "A. + G. Anlagenbau GmbH",
      "company_seat": "Stuttgart",
      "details": "14.11.2024 (Bekanntmachungsdatum)\n\nBaden-Württemberg Amtsgericht Stuttgart HRB 753340\nSonstige Registerbekanntmachung\n\nA. + G. Anlagenbau GmbH\nGesellschaft mit beschränkter Haftung\nStuttgart\n\nDas Gericht beabsichtigt, die Eintragung der Geschäftsführerin der Gesellschaft Frau Alexandra Rütten, *14.08.1973, zuletzt wohnhaft Waiblingen im Handelsregister wegen des Mangels einer wesentlichen Voraussetzung von Amts wegen nach § 395 FamFG als unzulässig zu löschen. Die Frist zur Geltendmachung eines Widerspruchs gegen die beabsichtigte Löschung ist auf einen Monat ab Veröffentlichung bestimmt."
    },
    {
      "date": "2024-11-14",
      "id": "93497",
      "original_text": "Löschungsankündigung\nHamburg Amtsgericht Hamburg HRB 169939\nABORDER PRODUCTS GmbH – Hamburg",
      "type": "Löschungsankündigung",
      "state": "Hamburg",
      "amtsgericht": "Amtsgericht Hamburg",
      "registernummer": "HRB 169939",
      "registerart": "HRB",
      "company_name": "ABORDER PRODUCTS GmbH",
      "company_seat": "Hamburg",
      "details": "14.11.2024 (Bekanntmachungsdatum)\n\nHamburg Amtsgericht Hamburg HRB 169939\nLöschungsankündigung\n\nABORDER PRODUCTS GmbH\nGesellschaft mit beschränkter Haftung\nHamburg\n\nDas Registergericht beabsichtigt, die im Handelsregister eingetragene Gesellschaft von Amts wegen nach § 394 FamFG zu löschen. Die Frist zur Erhebung eines Widerspruchs gegen die beabsichtigte Löschung wird auf 3 Monate festgesetzt."
    },
    {
      "date": "2024-11-14",
      "id": "93490",
      "original_text": "Löschungsankündigung\nHamburg Amtsgericht Hamburg HRB 158903\nACK Agri GmbH – Hamburg",
      "type": "Löschungsankündigung",
      "state": "Hamburg",
      "amtsgericht": "Amtsgericht Hamburg",
      "registernummer": "HRB 158903",
      "registerart": "HRB",
      "company_name": "ACK Agri GmbH",
      "company_seat": "Hamburg",
      "details": "14.11.2024 (Bekanntmachungsdatum)\n\nHamburg Amtsgericht Hamburg HRB 158903\nLöschungsankündigung\n\nACK Agri GmbH\nGesellschaft mit beschränkter Haftung\nHamburg\n\nDas Registergericht beabsichtigt, die im Handelsregister eingetragene Gesellschaft von Amts wegen nach § 394 FamFG zu löschen. Die Frist zur Erhebung eines Widerspruchs gegen die beabsichtigte Löschung wird auf 3 Monate festgesetzt."
    },
    {
      "date": "2024-11-14",
      "id": "93491",
      "original_text": "Löschungsankündigung\nHamburg Amtsgericht Hamburg HRB 162804\nADRIA Vino Kovac UG (haftungsbeschränkt) – Hamburg",
      "type": "Löschungsankündigung",
      "state": "Hamburg",
      "amtsgericht": "Amtsgericht Hamburg",
      "registernummer": "HRB 162804",
      "registerart": "HRB",
      "company_name": "ADRIA Vino Kovac UG (haftungsbeschränkt)",
      "company_seat": "Hamburg",
      "details": "14.11.2024 (Bekanntmachungsdatum)\n\nHamburg Amtsgericht Hamburg HRB 162804\nLöschungsankündigung\n\nADRIA Vino Kovac UG (haftungsbeschränkt)\nGesellschaft mit beschränkter Haftung\nHamburg\n\nDas Registergericht beabsichtigt, die im Handelsregister eingetragene Gesellschaft von Amts wegen nach § 394 FamFG zu löschen. Die Frist zur Erhebung eines Widerspruchs gegen die beabsichtigte Löschung wird auf 3 Monate festgesetzt."
    },
    {
      "date": "2024-11-14",
      "id": "93456",
      "original_text": "Löschungsankündigung\nBerlin Amtsgericht Berlin (Charlottenburg) HRB 132335\nADVO Verwaltungsgesellschaft mbH – Berlin",
      "type": "Löschungsankündigung",
      "state": "Berlin",
      "amtsgericht": "Amtsgericht Berlin (Charlottenburg)",
      "registernummer": "HRB 132335",
      "registerart": "HRB",
      "company_name": "ADVO Verwaltungsgesellschaft mbH",
      "company_seat": "Berlin",
      "details": "14.11.2024 (Bekanntmachungsdatum)\n\nBerlin Amtsgericht Berlin (Charlottenburg) HRB 132335\nLöschungsankündigung\n\nADVO Verwaltungsgesellschaft mbH\nGesellschaft mit beschränkter Haftung\nBerlin\n\nBei der nachstehenden Gesellschaft wird das Amtslöschungsverfahren gemäß § 394 FamFG eingeleitet. Widerspruchsfrist 6 Wochen"
    },
    {
      "date": "2024-11-14",
      "id": "93587",
      "original_text": "Registerbekanntmachung nach dem Umwandlungsgesetz\nNordrhein-Westfalen Amtsgericht Essen HRB 31726\nAHT GROUP GmbH – Essen",
      "type": "Registerbekanntmachung nach dem Umwandlungsgesetz",
      "state": "Nordrhein-Westfalen",
      "amtsgericht": "Amtsgericht Essen",
      "registernummer": "HRB 31726",
      "registerart": "HRB",
      "company_name": "AHT GROUP GmbH",
      "company_seat": "Essen",
      "details": "14.11.2024 (Bekanntmachungsdatum)\n\nNordrhein-Westfalen Amtsgericht Essen HRB 31726\nRegisterbekanntmachung nach dem Umwandlungsgesetz 14.11.2024 (Eintragungsdatum)\n\nAHT GROUP GmbH\nGesellschaft mit beschränkter Haftung\nEssen\n\nDen Gläubigern der an der Verschmelzung beteiligten Rechtsträger ist, wenn sie binnen sechs Monaten nach dem Tag, an dem die Eintragung der Verschmelzung in das Register des Sitzes derjenigen Rechtsträger deren Gläubiger sie sind, nach § 19 Absatz 3 UmwG als bekanntgemacht gilt, ihren Anspruch nach Grund und Höhe schriftlich anmelden, Sicherheit zu leisten, soweit sie nicht Befriedigung verlangen können. Dieses Recht steht den Gläubigern jedoch nur zu, wenn sie glaubhaft machen, dass durch die Verschmelzung die Erfüllung ihrer Forderung gefährdet wird."
    },
    {
      "date": "2024-11-14",
      "id": "93572",
      "original_text": "Registerbekanntmachung nach dem Umwandlungsgesetz\nNordrhein-Westfalen Amtsgericht Köln HRB 106124\nALDI Kerpen Verwaltungs-SE – Kerpen",
      "type": "Registerbekanntmachung nach dem Umwandlungsgesetz",
      "state": "Nordrhein-Westfalen",
      "amtsgericht": "Amtsgericht Köln",
      "registernummer": "HRB 106124",
      "registerart": "HRB",
      "company_name": "ALDI Kerpen Verwaltungs-SE",
      "company_seat": "Kerpen",
      "details": "14.11.2024 (Bekanntmachungsdatum)\n\nNordrhein-Westfalen Amtsgericht Köln HRB 106124\nRegisterbekanntmachung nach dem Umwandlungsgesetz\n\nALDI Kerpen Verwaltungs-SE\nEuropäische Aktiengesellschaft (SE)\nKerpen\n\nDem Registergericht ist eine neue Liste der Mitglieder des Aufsichtsrates eingereicht worden."
    },
    {
      "date": "2024-11-14",
      "id": "93488",
      "original_text": "Einreichung neuer Dokumente\nBaden-Württemberg Amtsgericht Stuttgart HRB 778946\nALDI Schwaben Verwaltungs-SE – Murr",
      "type": "Einreichung neuer Dokumente",
      "state": "Baden-Württemberg",
      "amtsgericht": "Amtsgericht Stuttgart",
      "registernummer": "HRB 778946",
      "registerart": "HRB",
      "company_name": "ALDI Schwaben Verwaltungs-SE",
      "company_seat": "Murr",
      "details": "14.11.2024 (Bekanntmachungsdatum)\n\nBaden-Württemberg Amtsgericht Stuttgart HRB 778946\nEinreichung neuer Dokumente\n\nALDI Schwaben Verwaltungs-SE\nEuropäische Aktiengesellschaft (SE)\nMurr\n\nDie Gesellschaft hat am 12.11.2024 die Liste über die Zusammensetzung des Aufsichtsrats zum Handelsregister eingereicht."
    },
    {
      "date": "2024-11-14",
      "id": "93556",
      "original_text": "Einreichung neuer Dokumente\nRheinland-Pfalz Amtsgericht Ludwigshafen a.Rhein (Ludwigshafen) HRB 66849\nALDI Süd-West Verwaltungs-SE – Kirchheim",
      "type": "Einreichung neuer Dokumente",
      "state": "Rheinland-Pfalz",
      "amtsgericht": "Amtsgericht Ludwigshafen a.Rhein (Ludwigshafen)",
      "registernummer": "HRB 66849",
      "registerart": "HRB",
      "company_name": "ALDI Süd-West Verwaltungs-SE",
      "company_seat": "Kirchheim",
      "details": "14.11.2024 (Bekanntmachungsdatum)\n\nRheinland-Pfalz Amtsgericht Ludwigshafen a.Rhein (Ludwigshafen) HRB 66849\nEinreichung neuer Dokumente\n\nALDI Süd-West Verwaltungs-SE\nEuropäische Aktiengesellschaft (SE)\nKirchheim\n\nDem Registergericht ist eine neue Liste der Mitglieder desVerwaltungsrates eingereicht worden."
    },
    {
      "date": "2024-11-14",
      "id": "93484",
      "original_text": "Löschungsankündigung\nHamburg Amtsgericht Hamburg HRB 125656\nALTA Nord-Handels-GmbH – Hamburg",
      "type": "Löschungsankündigung",
      "state": "Hamburg",
      "amtsgericht": "Amtsgericht Hamburg",
      "registernummer": "HRB 125656",
      "registerart": "HRB",
      "company_name": "ALTA Nord-Handels-GmbH",
      "company_seat": "Hamburg",
      "details": "14.11.2024 (Bekanntmachungsdatum)\n\nHamburg Amtsgericht Hamburg HRB 125656\nLöschungsankündigung\n\nALTA Nord-Handels-GmbH\nGesellschaft mit beschränkter Haftung\nHamburg\n\nDas Registergericht beabsichtigt, die im Handelsregister eingetragene Gesellschaft von Amts wegen nach § 394 FamFG zu löschen. Die Frist zur Erhebung eines Widerspruchs gegen die beabsichtigte Löschung wird auf 3 Monate festgesetzt."
    },
    {
      "date": "2024-11-14",
      "id": "93514",
      "original_text": "Registerbekanntmachung nach dem Umwandlungsgesetz\nSaarland Amtsgericht Saarbrücken HRB 110412\nAWA GmbH – St. Wendel",
      "type": "Registerbekanntmachung nach dem Umwandlungsgesetz",
      "state": "Saarland",
      "amtsgericht": "Amtsgericht Saarbrücken",
      "registernummer": "HRB 110412",
      "registerart": "HRB",
      "company_name": "AWA GmbH",
      "company_seat": "St. Wendel",
      "details": "14.11.2024 (Bekanntmachungsdatum)\n\nSaarland Amtsgericht Saarbrücken HRB 110412\nRegisterbekanntmachung nach dem Umwandlungsgesetz 14.11.2024 (Eintragungsdatum)\n\nAWA GmbH\nGesellschaft mit beschränkter Haftung\nSt. Wendel\n\nAls nicht eingetragen wird bekannt gemacht: Den Gläubigern der an der Ausgliederung beteiligten Gesellschaften ist, wenn sie binnen sechs Monaten nach dem Tag, an dem die Eintragung der Ausgliederung in das Register des Sitzes derjenigen Rechtsträger deren Gläubiger sie sind, nach § 19 Absatz 3 UmwG bekannt gemacht worden ist, ihren Anspruch nach Grund und Höhe schriftlich anmelden, Sicherheit zu leisten, soweit sie nicht Befriedigung verlangen können. Dieses Recht steht den Gläubigern jedoch nur zu, wenn sie glaubhaft machen, dass durch die Ausgliederung die Erfüllung ihrer Forderung gefährdet wird."
    },
    {
      "date": "2024-11-14",
      "id": "93545",
      "original_text": "Löschungsankündigung\nNiedersachsen Amtsgericht Hannover HRB 203297\nAYLIN GmbH – Hannover",
      "type": "Löschungsankündigung",
      "state": "Niedersachsen",
      "amtsgericht": "Amtsgericht Hannover",
      "registernummer": "HRB 203297",
      "registerart": "HRB",
      "company_name": "AYLIN GmbH",
      "company_seat": "Hannover",
      "details": "14.11.2024 (Bekanntmachungsdatum)\n\nNiedersachsen Amtsgericht Hannover HRB 203297\nLöschungsankündigung\n\nAYLIN GmbH\nGesellschaft mit beschränkter Haftung\nHannover\n\nDas Registergericht beabsichtigt, die Gesellschaft von Amts wegen nach § 394 FamFG zu löschen. Die Frist zur Erhebung eines Widerspruchs ist auf 1 Monat ab dieser Registerbekanntmachung festgesetzt."
    },
    {
      "date": "2024-11-14",
      "id": "93499",
      "original_text": "Löschungsankündigung\nHamburg Amtsgericht Hamburg HRB 175793\nAngel Care System GmbH – Hamburg",
      "type": "Löschungsankündigung",
      "state": "Hamburg",
      "amtsgericht": "Amtsgericht Hamburg",
      "registernummer": "HRB 175793",
      "registerart": "HRB",
      "company_name": "Angel Care System GmbH",
      "company_seat": "Hamburg",
      "details": "14.11.2024 (Bekanntmachungsdatum)\n\nHamburg Amtsgericht Hamburg HRB 175793\nLöschungsankündigung\n\nAngel Care System GmbH\nGesellschaft mit beschränkter Haftung\nHamburg\n\nDas Registergericht beabsichtigt, die im Handelsregister eingetragene Gesellschaft von Amts wegen nach § 394 FamFG zu löschen. Die Frist zur Erhebung eines Widerspruchs gegen die beabsichtigte Löschung wird auf 3 Monate festgesetzt."
    },
    {
      "date": "2024-11-14",
      "id": "93508",
      "original_text": "Löschungsankündigung\nHamburg Amtsgericht Hamburg VR 7005\nAngel Sport Verein \"Gut Fisch\" von 1964 e.V. – Hamburg",
      "type": "Löschungsankündigung",
      "state": "Hamburg",
      "amtsgericht": "Amtsgericht Hamburg",
      "registernummer": "VR 7005",
      "registerart": "VR",
      "company_name": "Angel Sport Verein \"Gut Fisch\" von 1964 e.V.",
      "company_seat": "Hamburg",
      "details": "14.11.2024 (Bekanntmachungsdatum)\n\nHamburg Amtsgericht Hamburg VR 7005\nLöschungsankündigung\n\nAngel Sport Verein \"Gut Fisch\" von 1964 e.V.\neingetragener Verein\nHamburg\n\nDas Registergericht beabsichtigt, den im Vereinsregister eingetragenen Verein von Amts wegen nach § 395 FamFG zu löschen, da nach den angestellten Ermittlungen dieser Verein offenbar nicht mehr besteht. Die Frist zur Erhebung eines Widerspruchs gegen die beabsichtigte Löschung wird auf 3 Monate festgesetzt."
    },
    {
      "date": "2024-11-14",
      "id": "93513",
      "original_text": "Registerbekanntmachung nach dem Umwandlungsgesetz\nSaarland Amtsgericht Saarbrücken HRA 13581\nAnnette Werle e.Kfr. – St. Wendel",
      "type": "Registerbekanntmachung nach dem Umwandlungsgesetz",
      "state": "Saarland",
      "amtsgericht": "Amtsgericht Saarbrücken",
      "registernummer": "HRA 13581",
      "registerart": "HRA",
      "company_name": "Annette Werle e.Kfr.",
      "company_seat": "St. Wendel",
      "details": "14.11.2024 (Bekanntmachungsdatum)\n\nSaarland Amtsgericht Saarbrücken HRA 13581\nRegisterbekanntmachung nach dem Umwandlungsgesetz 14.11.2024 (Eintragungsdatum)\n\nAnnette Werle e.Kfr.\nEinzelkaufmann / Einzelkauffrau\nSt. Wendel\n\nAls nicht eingetragen wird bekannt gemacht: Den Gläubigern der an der Ausgliederung beteiligten Gesellschaften ist, wenn sie binnen sechs Monaten nach dem Tag, an dem die Eintragung der Ausgliederung in das Register des Sitzes derjenigen Rechtsträger deren Gläubiger sie sind, nach § 19 Absatz 3 UmwG bekannt gemacht worden ist, ihren Anspruch nach Grund und Höhe schriftlich anmelden, Sicherheit zu leisten, soweit sie nicht Befriedigung verlangen können. Dieses Recht steht den Gläubigern jedoch nur zu, wenn sie glaubhaft machen, dass durch die Ausgliederung die Erfüllung ihrer Forderung gefährdet wird."
    },
    {
      "date": "2024-11-14",
      "id": "93539",
      "original_text": "Registerbekanntmachung nach dem Umwandlungsgesetz\nNiedersachsen Amtsgericht Walsrode HRA 61804\nApotheke Große Verdener Straße e.K. – Rotenburg (Wümme)",
      "type": "Registerbekanntmachung nach dem Umwandlungsgesetz",
      "state": "Niedersachsen",
      "amtsgericht": "Amtsgericht Walsrode",
      "registernummer": "HRA 61804",
      "registerart": "HRA",
      "company_name": "Apotheke Große Verdener Straße e.K.",
      "company_seat": "Rotenburg (Wümme)",
      "details": "14.11.2024 (Bekanntmachungsdatum)\n\nNiedersachsen Amtsgericht Walsrode HRA 61804\nRegisterbekanntmachung nach dem Umwandlungsgesetz 14.11.2024 (Eintragungsdatum)\n\nApotheke Große Verdener Straße e.K.\nEinzelkaufmann / Einzelkauffrau\nRotenburg (Wümme)\n\nDen Gläubigern der an der Ausgliederung beteiligten Rechtsträger ist, wenn sie binnen sechs Monaten nach dem Tag, an dem die Eintragung der Ausgliederung in das Register des Sitzes desjenigen Rechtsträgers, dessen Gläubiger sie sind, nach § 19 Abs. 3 UmwG als bekannt gemacht gilt, ihren Anspruch nach Grund und Höhe schriftlich anmelden, Sicherheit zu leisten, soweit sie nicht Befriedigung verlangen können. Dieses Recht steht den Gläubigern jedoch nur zu, wenn sie glaubhaft machen, dass durch die Ausgliederung die Erfüllung der Forderung gefährdet wird."
    },
    {
      "date": "2024-11-14",
      "id": "93478",
      "original_text": "Löschungsankündigung\nHamburg Amtsgericht Hamburg HRB 102814\nAsian Bamboo AG – Hamburg",
      "type": "Löschungsankündigung",
      "state": "Hamburg",
      "amtsgericht": "Amtsgericht Hamburg",
      "registernummer": "HRB 102814",
      "registerart": "HRB",
      "company_name": "Asian Bamboo AG",
      "company_seat": "Hamburg",
      "details": "14.11.2024 (Bekanntmachungsdatum)\n\nHamburg Amtsgericht Hamburg HRB 102814\nLöschungsankündigung\n\nAsian Bamboo AG\nAktiengesellschaft\nHamburg\n\nDas Registergericht beabsichtigt, die im Handelsregister eingetragene Gesellschaft von Amts wegen nach § 394 FamFG zu löschen. Die Frist zur Erhebung eines Widerspruchs gegen die beabsichtigte Löschung wird auf 3 Monate festgesetzt."
    },
    {
      "date": "2024-11-14",
      "id": "93574",
      "original_text": "Löschungsankündigung\nNordrhein-Westfalen Amtsgericht Iserlohn HRB 9904\nAtaseven Oberflächenbearbeitung UG (haftungsbeschränkt) – Hemer",
      "type": "Löschungsankündigung",
      "state": "Nordrhein-Westfalen",
      "amtsgericht": "Amtsgericht Iserlohn",
      "registernummer": "HRB 9904",
      "registerart": "HRB",
      "company_name": "Ataseven Oberflächenbearbeitung UG (haftungsbeschränkt)",
      "company_seat": "Hemer",
      "details": "14.11.2024 (Bekanntmachungsdatum)\n\nNordrhein-Westfalen Amtsgericht Iserlohn HRB 9904\nLöschungsankündigung\n\nAtaseven Oberflächenbearbeitung UG (haftungsbeschränkt)\nGesellschaft mit beschränkter Haftung\nHemer\n\nDas Registergericht beabsichtigt, die im Handelsregister eingetragene Gesellschaft gemäß § 394 Absatz 1 FamFG wegen Vermögenslosigkeit von Amts wegen zu löschen. Gegen diese Verfügung kann Widerspruch eingelegt werden. Die Frist zur Erhebung eines Widerspruchs gegen die beabsichtigte Löschung von Amts wegen ist auf zwei Monate festgesetzt.\n\nRechtsbehelfsbelehrung:\nGegen diese Verfügung können Sie Widerspruch einlegen.\nDer Widerspruch ist bei dem Amtsgericht Iserlohn, Friedrichstraße 108-110, 58636 Iserlohn schriftlich in deutscher Sprache oder zur Niederschrift der Geschäftsstelle einzulegen. Der Widerspruch kann auch zur Niederschrift der Geschäftsstelle eines jeden Amtsgerichtes abgegeben werden.\nDer Widerspruch muss spätestens innerhalb der gesetzten Frist bei dem Amtsgericht Iserlohn eingegangen sein. Dies gilt auch dann, wenn der Widerspruch zur Niederschrift der Geschäftsstelle eines anderen Amtsgerichtes abgegeben wurde. Die Frist beginnt mit der Veröffentlichung. Fällt das Ende der Frist auf einen Sonntag, einen allgemeinen Feiertag oder Sonnabend, so endet die Frist mit Ablauf des nächsten Werktages.\nDer Widerspruch muss die Bezeichnung der angefochtenen Verfügung sowie die Erklärung enthalten, dass Widerspruch gegen diese Verfügung eingelegt wird. Er ist zu unterzeichnen und soll begründet werden."
    },
    {
      "date": "2024-11-14",
      "id": "93464",
      "original_text": "Registerbekanntmachung nach dem Umwandlungsgesetz\nBerlin Amtsgericht Berlin (Charlottenburg) HRA 63157\nAufzugsverbund Deutschland GmbH & Co. KG – Berlin",
      "type": "Registerbekanntmachung nach dem Umwandlungsgesetz",
      "state": "Berlin",
      "amtsgericht": "Amtsgericht Berlin (Charlottenburg)",
      "registernummer": "HRA 63157",
      "registerart": "HRA",
      "company_name": "Aufzugsverbund Deutschland GmbH & Co. KG",
      "company_seat": "Berlin",
      "details": "14.11.2024 (Bekanntmachungsdatum)\n\nBerlin Amtsgericht Berlin (Charlottenburg) HRA 63157\nRegisterbekanntmachung nach dem Umwandlungsgesetz 13.11.2024 (Eintragungsdatum)\n\nAufzugsverbund Deutschland GmbH & Co. KG\nKommanditgesellschaft\nBerlin\n\nZu Eintragungsnummer 9 vom 13.11.2024 wird als nicht eingetragen veröffentlicht: Den Gläubigern der an der Verschmelzung beteiligten Rechtsträger ist, wenn sie binnen sechs Monaten nach dem Tag, an dem die Eintragung der Verschmelzung in das Register des Sitzes desjenigen Rechtsträgers, dessen Gläubiger sie sind, als bekannt gemacht gilt, ihren Anspruch nach Grund und Höhe schriftlich anmelden, Sicherheit zu leisten, soweit sie nicht Befriedigung verlangen können. Dieses Recht steht den Gläubigern jedoch nur zu, wenn sie glaubhaft machen, dass durch die Verschmelzung die Erfüllung ihrer Forderung gefährdet wird. Das Recht, Sicherheitsleistung zu verlangen, steht Gläubigern nicht zu, die im Falle der Insolvenz ein Recht auf vorzugsweise Befriedigung aus einer Deckungsmasse haben, die nach gesetzlicher Vorschrift zu ihrem Schutz errichtet und staatlich überwacht ist."
    },
    {
      "date": "2024-11-14",
      "id": "93467",
      "original_text": "Registerbekanntmachung nach dem Umwandlungsgesetz\nBerlin Amtsgericht Berlin (Charlottenburg) HRA 63157\nAufzugsverbund Deutschland GmbH & Co. KG – Berlin",
      "type": "Registerbekanntmachung nach dem Umwandlungsgesetz",
      "state": "Berlin",
      "amtsgericht": "Amtsgericht Berlin (Charlottenburg)",
      "registernummer": "HRA 63157",
      "registerart": "HRA",
      "company_name": "Aufzugsverbund Deutschland GmbH & Co. KG",
      "company_seat": "Berlin",
      "details": "14.11.2024 (Bekanntmachungsdatum)\n\nBerlin Amtsgericht Berlin (Charlottenburg) HRA 63157\nRegisterbekanntmachung nach dem Umwandlungsgesetz 13.11.2024 (Eintragungsdatum)\n\nAufzugsverbund Deutschland GmbH & Co. KG\nKommanditgesellschaft\nBerlin\n\nZu Eintragungsnummer 10 vom 13.11.2024 wird als nicht eingetragen veröffentlicht: Den Gläubigern der an der Verschmelzung beteiligten Rechtsträger ist, wenn sie binnen sechs Monaten nach dem Tag, an dem die Eintragung der Verschmelzung in das Register des Sitzes desjenigen Rechtsträgers, dessen Gläubiger sie sind, als bekannt gemacht gilt, ihren Anspruch nach Grund und Höhe schriftlich anmelden, Sicherheit zu leisten, soweit sie nicht Befriedigung verlangen können. Dieses Recht steht den Gläubigern jedoch nur zu, wenn sie glaubhaft machen, dass durch die Verschmelzung die Erfüllung ihrer Forderung gefährdet wird. Das Recht, Sicherheitsleistung zu verlangen, steht Gläubigern nicht zu, die im Falle der Insolvenz ein Recht auf vorzugsweise Befriedigung aus einer Deckungsmasse haben, die nach gesetzlicher Vorschrift zu ihrem Schutz errichtet und staatlich überwacht ist."
    },
    {
      "date": "2024-11-14",
      "id": "93436",
      "original_text": "Einreichung neuer Dokumente\nBayern Amtsgericht München HRB 295603\nAutomotive Vision AG – Grünwald",
      "type": "Einreichung neuer Dokumente",
      "state": "Bayern",
      "amtsgericht": "Amtsgericht München",
      "registernummer": "HRB 295603",
      "registerart": "HRB",
      "company_name": "Automotive Vision AG",
      "company_seat": "Grünwald",
      "details": "14.11.2024 (Bekanntmachungsdatum)\n\nBayern Amtsgericht München HRB 295603\nEinreichung neuer Dokumente 13.11.2024 (Eintragungsdatum)\n\nAutomotive Vision AG\nAktiengesellschaft\nGrünwald\n\nDem Amtsgericht München -Registergericht- ist eine Liste der Mitglieder des Aufsichtsrats eingereicht worden, § 106 AktG."
    },
    {
      "date": "2024-11-14",
      "id": "93442",
      "original_text": "Löschungsankündigung\nBayern Amtsgericht München HRB 120165\nB & B Business Beteiligungs GmbH – München",
      "type": "Löschungsankündigung",
      "state": "Bayern",
      "amtsgericht": "Amtsgericht München",
      "registernummer": "HRB 120165",
      "registerart": "HRB",
      "company_name": "B & B Business Beteiligungs GmbH",
      "company_seat": "München",
      "details": "14.11.2024 (Bekanntmachungsdatum)\n\nBayern Amtsgericht München HRB 120165\nLöschungsankündigung 13.11.2024 (Eintragungsdatum)\n\nB & B Business Beteiligungs GmbH\nGesellschaft mit beschränkter Haftung\nMünchen\n\nDas Registergericht beabsichtigt, die im Handelsregister eingetragene Gesellschaft wegen Vermögenslosigkeit von Amts wegen nach § 394 FamFG zu löschen. Die Frist zur Erhebung eines Widerspruchs ist auf drei Monate festgesetzt."
    },
    {
      "date": "2024-11-14",
      "id": "93509",
      "original_text": "Löschungsankündigung\nHamburg Amtsgericht Hamburg HRB 186546\nBER Bau und Reinigung UG (haftungsbeschränkt) – Hamburg",
      "type": "Löschungsankündigung",
      "state": "Hamburg",
      "amtsgericht": "Amtsgericht Hamburg",
      "registernummer": "HRB 186546",
      "registerart": "HRB",
      "company_name": "BER Bau und Reinigung UG (haftungsbeschränkt)",
      "company_seat": "Hamburg",
      "details": "14.11.2024 (Bekanntmachungsdatum)\n\nHamburg Amtsgericht Hamburg HRB 186546\nLöschungsankündigung\n\nBER Bau und Reinigung UG (haftungsbeschränkt)\nGesellschaft mit beschränkter Haftung\nHamburg\n\nDas Registergericht beabsichtigt, die im Handelsregister eingetragene Gesellschaft von Amts wegen nach § 394 FamFG zu löschen. Die Frist zur Erhebung eines Widerspruchs gegen die beabsichtigte Löschung wird auf 3 Monate festgesetzt."
    },
    {
      "date": "2024-11-14",
      "id": "93471",
      "original_text": "Einreichung neuer Dokumente\nSachsen-Anhalt Amtsgericht Stendal HRB 13025\nBFG-Bernburger Freizeit GmbH – Bernburg (Saale)",
      "type": "Einreichung neuer Dokumente",
      "state": "Sachsen-Anhalt",
      "amtsgericht": "Amtsgericht Stendal",
      "registernummer": "HRB 13025",
      "registerart": "HRB",
      "company_name": "BFG-Bernburger Freizeit GmbH",
      "company_seat": "Bernburg (Saale)",
      "details": "14.11.2024 (Bekanntmachungsdatum)\n\nSachsen-Anhalt Amtsgericht Stendal HRB 13025\nEinreichung neuer Dokumente\n\nBFG-Bernburger Freizeit GmbH\nGesellschaft mit beschränkter Haftung\nBernburg (Saale)\n\nEine Liste der Mitglieder des Aufsichtsrates wurde zum Handelsregister eingereicht."
    },
    {
      "date": "2024-11-14",
      "id": "93516",
      "original_text": "Einreichung neuer Dokumente\nBaden-Württemberg Amtsgericht Freiburg HRB 381792\nBHS Städtebau Bodensee/Hegau GmbH – Konstanz",
      "type": "Einreichung neuer Dokumente",
      "state": "Baden-Württemberg",
      "amtsgericht": "Amtsgericht Freiburg",
      "registernummer": "HRB 381792",
      "registerart": "HRB",
      "company_name": "BHS Städtebau Bodensee/Hegau GmbH",
      "company_seat": "Konstanz",
      "details": "14.11.2024 (Bekanntmachungsdatum)\n\nBaden-Württemberg Amtsgericht Freiburg HRB 381792\nEinreichung neuer Dokumente 14.11.2024 (Eintragungsdatum)\n\nBHS Städtebau Bodensee/Hegau GmbH\nGesellschaft mit beschränkter Haftung\nKonstanz\n\nAls nicht eingetragen wird bekanntgemacht:\nDie Gesellschaft hat am 13.11.2024 die Liste über die Zusammensetzung des Aufsichtsrats zum Handelsregister eingereicht."
    },
    {
      "date": "2024-11-14",
      "id": "93450",
      "original_text": "Löschungsankündigung\nBayern Amtsgericht München HRB 247618\nBKJ Service UG (haftungsbeschränkt) – München",
      "type": "Löschungsankündigung",
      "state": "Bayern",
      "amtsgericht": "Amtsgericht München",
      "registernummer": "HRB 247618",
      "registerart": "HRB",
      "company_name": "BKJ Service UG (haftungsbeschränkt)",
      "company_seat": "München",
      "details": "14.11.2024 (Bekanntmachungsdatum)\n\nBayern Amtsgericht München HRB 247618\nLöschungsankündigung 13.11.2024 (Eintragungsdatum)\n\nBKJ Service UG (haftungsbeschränkt)\nGesellschaft mit beschränkter Haftung\nMünchen\n\nDas Registergericht beabsichtigt, die im Handelsregister eingetragene Gesellschaft wegen Vermögenslosigkeit von Amts wegen nach § 394 FamFG zu löschen. Die Frist zur Erhebung eines Widerspruchs ist auf drei Monate festgesetzt."
    },
    {
      "date": "2024-11-14",
      "id": "93593",
      "original_text": "Registerbekanntmachung nach dem Umwandlungsgesetz\nNordrhein-Westfalen Amtsgericht Dortmund HRB 15814\nBRAINSTORM GmbH – Dortmund",
      "type": "Registerbekanntmachung nach dem Umwandlungsgesetz",
      "state": "Nordrhein-Westfalen",
      "amtsgericht": "Amtsgericht Dortmund",
      "registernummer": "HRB 15814",
      "registerart": "HRB",
      "company_name": "BRAINSTORM GmbH",
      "company_seat": "Dortmund",
      "details": "14.11.2024 (Bekanntmachungsdatum)\n\nNordrhein-Westfalen Amtsgericht Dortmund HRB 15814\nRegisterbekanntmachung nach dem Umwandlungsgesetz 14.11.2024 (Eintragungsdatum)\n\nBRAINSTORM GmbH\nGesellschaft mit beschränkter Haftung\nDortmund\n\nDie Gesellschaft hat Gläubigern, deren Forderungen vor dieser Bekanntmachung begründet worden sind, Sicherheit zu leisten, soweit sie nicht Befriedigung verlangen können, wenn sie sich binnen sechs Monaten zu diesem Zweck melden."
    },
    {
      "date": "2024-11-14",
      "id": "93451",
      "original_text": "Löschungsankündigung\nSaarland Amtsgericht Saarbrücken HRB 106447\nBSD Raubuch UG (haftungsbeschränkt) – Schmelz",
      "type": "Löschungsankündigung",
      "state": "Saarland",
      "amtsgericht": "Amtsgericht Saarbrücken",
      "registernummer": "HRB 106447",
      "registerart": "HRB",
      "company_name": "BSD Raubuch UG (haftungsbeschränkt)",
      "company_seat": "Schmelz",
      "details": "14.11.2024 (Bekanntmachungsdatum)\n\nSaarland Amtsgericht Saarbrücken HRB 106447\nLöschungsankündigung\n\nBSD Raubuch UG (haftungsbeschränkt)\nGesellschaft mit beschränkter Haftung\nSchmelz\n\nEs ist beabsichtigt, die Gesellschaft von Amts wegen gemäß § 394 FamFG wegen Vermögenslosigkeit zu löschen.\nGegen die Löschung von Amts wegen ist das Rechtsmittel des Widerspruchs statthaft. Der Widerspruch ist binnen einer Frist zwei Monaten beginnend mit dem Tag dieser Veröffentlichung durch Einreichen eines Widerspruchsschreibens -schriftlich oder zur Niederschrift der Geschäftsstelle beim Amtsgericht Saarbrücken, -zentrales Handelsregister-, Mainzerstr.178, 66121 Saarbrücken einzulegen.\nDer Widerspruch muss die Bezeichnung der angefochtenen Löschungsankündigung enthalten sowie die Erklärung, dass Widerspruch eingelegt wird. Er ist vom Widerspruchsführer oder seinem Bevollmächtigten zu unterzeichnen.\nDas Widerspruchsschreiben kann auch in der Form eines elektronischen Dokumentes eingereicht werden, das mit einer qualifizierten elektronischen Signatur nach dem Signaturgesetz versehen sein muss (§§ 14 Abs. 2 FamFG, 130a, 298 ZPO)."
    },
    {
      "date": "2024-11-14",
      "id": "93570",
      "original_text": "Einreichung neuer Dokumente\nNordrhein-Westfalen Amtsgericht Bonn HRB 15251\nBWI GmbH – Meckenheim",
      "type": "Einreichung neuer Dokumente",
      "state": "Nordrhein-Westfalen",
      "amtsgericht": "Amtsgericht Bonn",
      "registernummer": "HRB 15251",
      "registerart": "HRB",
      "company_name": "BWI GmbH",
      "company_seat": "Meckenheim",
      "details": "14.11.2024 (Bekanntmachungsdatum)\n\nNordrhein-Westfalen Amtsgericht Bonn HRB 15251\nEinreichung neuer Dokumente\n\nBWI GmbH\nGesellschaft mit beschränkter Haftung\nMeckenheim\n\nDem Registergericht ist eine neue Liste der Mitglieder des Aufsichtsrates eingereicht worden."
    },
    {
      "date": "2024-11-14",
      "id": "93537",
      "original_text": "Einreichung neuer Dokumente\nSachsen Amtsgericht Dresden HRB 30205\nBad Muskau Touristik GmbH – Bad Muskau",
      "type": "Einreichung neuer Dokumente",
      "state": "Sachsen",
      "amtsgericht": "Amtsgericht Dresden",
      "registernummer": "HRB 30205",
      "registerart": "HRB",
      "company_name": "Bad Muskau Touristik GmbH",
      "company_seat": "Bad Muskau",
      "details": "14.11.2024 (Bekanntmachungsdatum)\n\nSachsen Amtsgericht Dresden HRB 30205\nEinreichung neuer Dokumente\n\nBad Muskau Touristik GmbH\nGesellschaft mit beschränkter Haftung\nBad Muskau\n\nAm 13.11.2024 wurde beim Handelsregister des Amtsgerichts Dresden die Liste der Mitglieder des Aufsichtsrats gemäß § 52 GmbHG eingereicht."
    },
    {
      "date": "2024-11-14",
      "id": "93495",
      "original_text": "Löschungsankündigung\nHamburg Amtsgericht Hamburg HRB 171618\nBauservice Fischer GmbH – Hamburg",
      "type": "Löschungsankündigung",
      "state": "Hamburg",
      "amtsgericht": "Amtsgericht Hamburg",
      "registernummer": "HRB 171618",
      "registerart": "HRB",
      "company_name": "Bauservice Fischer GmbH",
      "company_seat": "Hamburg",
      "details": "14.11.2024 (Bekanntmachungsdatum)\n\nHamburg Amtsgericht Hamburg HRB 171618\nLöschungsankündigung\n\nBauservice Fischer GmbH\nGesellschaft mit beschränkter Haftung\nHamburg\n\nDas Registergericht beabsichtigt, die im Handelsregister eingetragene Gesellschaft von Amts wegen nach § 394 FamFG zu löschen. Die Frist zur Erhebung eines Widerspruchs gegen die beabsichtigte Löschung wird auf 3 Monate festgesetzt."
    },
    {
      "date": "2024-11-14",
      "id": "93534",
      "original_text": "Löschungsankündigung\nSachsen Amtsgericht Leipzig HRB 36716\nBauunternehmer Terra UG (haftungsbeschränkt) – Grimma OT Mutzschen",
      "type": "Löschungsankündigung",
      "state": "Sachsen",
      "amtsgericht": "Amtsgericht Leipzig",
      "registernummer": "HRB 36716",
      "registerart": "HRB",
      "company_name": "Bauunternehmer Terra UG (haftungsbeschränkt)",
      "company_seat": "Grimma OT Mutzschen",
      "details": "14.11.2024 (Bekanntmachungsdatum)\n\nSachsen Amtsgericht Leipzig HRB 36716\nLöschungsankündigung 14.11.2024 (Eintragungsdatum)\n\nBauunternehmer Terra UG (haftungsbeschränkt)\nGesellschaft mit beschränkter Haftung\nGrimma OT Mutzschen\n\nDas Registergericht beabsichtigt, die im Handelsregister eingetragene Gesellschaft von Amts wegen nach § 394 FamFG zu löschen. Die Frist zu Erhebung eines Widerspruchs gegen die beabsichtigte Löschung wird auf einen Monat festgesetzt."
    },
    {
      "date": "2024-11-14",
      "id": "93575",
      "original_text": "Löschungsankündigung\nNordrhein-Westfalen Amtsgericht Paderborn HRB 16049\nBavin International UG (haftungsbeschränkt) – Paderborn",
      "type": "Löschungsankündigung",
      "state": "Nordrhein-Westfalen",
      "amtsgericht": "Amtsgericht Paderborn",
      "registernummer": "HRB 16049",
      "registerart": "HRB",
      "company_name": "Bavin International UG (haftungsbeschränkt)",
      "company_seat": "Paderborn",
      "details": "14.11.2024 (Bekanntmachungsdatum)\n\nNordrhein-Westfalen Amtsgericht Paderborn HRB 16049\nLöschungsankündigung 14.11.2024 (Eintragungsdatum)\n\nBavin International UG (haftungsbeschränkt)\nGesellschaft mit beschränkter Haftung\nPaderborn\n\nDas Registergericht beabsichtigt die Gesellschaft von Amts wegen nach § 394 FamFG zu löschen. Die Frist zur Erhebung eines Widerspruchs ist auf einen Monat festgesetzt."
    },
    {
      "date": "2024-11-14",
      "id": "93480",
      "original_text": "Löschungsankündigung\nHamburg Amtsgericht Hamburg HRB 133420\nBest Fruchtgroßhandel GmbH – Hamburg",
      "type": "Löschungsankündigung",
      "state": "Hamburg",
      "amtsgericht": "Amtsgericht Hamburg",
      "registernummer": "HRB 133420",
      "registerart": "HRB",
      "company_name": "Best Fruchtgroßhandel GmbH",
      "company_seat": "Hamburg",
      "details": "14.11.2024 (Bekanntmachungsdatum)\n\nHamburg Amtsgericht Hamburg HRB 133420\nLöschungsankündigung\n\nBest Fruchtgroßhandel GmbH\nGesellschaft mit beschränkter Haftung\nHamburg\n\nDas Registergericht beabsichtigt, die im Handelsregister eingetragene Gesellschaft von Amts wegen nach § 394 FamFG zu löschen. Die Frist zur Erhebung eines Widerspruchs gegen die beabsichtigte Löschung wird auf 3 Monate festgesetzt."
    },
    {
      "date": "2024-11-14",
      "id": "93596",
      "original_text": "Registerbekanntmachung nach dem Umwandlungsgesetz\nThüringen Amtsgericht Jena HRB 522517\nBiocraft Nohra GmbH – Grammetal",
      "type": "Registerbekanntmachung nach dem Umwandlungsgesetz",
      "state": "Thüringen",
      "amtsgericht": "Amtsgericht Jena",
      "registernummer": "HRB 522517",
      "registerart": "HRB",
      "company_name": "Biocraft Nohra GmbH",
      "company_seat": "Grammetal",
      "details": "14.11.2024 (Bekanntmachungsdatum)\n\nThüringen Amtsgericht Jena HRB 522517\nRegisterbekanntmachung nach dem Umwandlungsgesetz 14.11.2024 (Eintragungsdatum)\n\nBiocraft Nohra GmbH\nGesellschaft mit beschränkter Haftung\nGrammetal\n\nNicht eingetragen: Den Gläubigern des formwechselnden  Rechtsträgers, ist wenn sie binnen sechs Monaten nach dem Tag, an dem die Eintragung des Formwechsels nach § 201 UmwG als bekanntgemacht gilt, ihren Anspruch nach Grund und Höhe schriftlich anmelden, Sicherheit zu leisten, soweit sie nicht Befriedigung verlangen können. Dieses Recht steht ihnen jedoch nur zu, wenn sie glaubhaft machen, daß durch den Formwechsel die Erfüllung ihrer Forderung gefährdet wird."
    },
    {
      "date": "2024-11-14",
      "id": "93595",
      "original_text": "Registerbekanntmachung nach dem Umwandlungsgesetz\nThüringen Amtsgericht Jena HRA 502095\nBiocraft Nohra GmbH & Co. KG – Grammetal",
      "type": "Registerbekanntmachung nach dem Umwandlungsgesetz",
      "state": "Thüringen",
      "amtsgericht": "Amtsgericht Jena",
      "registernummer": "HRA 502095",
      "registerart": "HRA",
      "company_name": "Biocraft Nohra GmbH & Co. KG",
      "company_seat": "Grammetal",
      "details": "14.11.2024 (Bekanntmachungsdatum)\n\nThüringen Amtsgericht Jena HRA 502095\nRegisterbekanntmachung nach dem Umwandlungsgesetz 14.11.2024 (Eintragungsdatum)\n\nBiocraft Nohra GmbH & Co. KG\nKommanditgesellschaft\nGrammetal\n\nNicht eingetragen: Den Gläubigern des formwechselnden  Rechtsträgers, ist wenn sie binnen sechs Monaten nach dem Tag, an dem die Eintragung des Formwechsels nach § 201 UmwG als bekanntgemacht gilt, ihren Anspruch nach Grund und Höhe schriftlich anmelden, Sicherheit zu leisten, soweit sie nicht Befriedigung verlangen können. Dieses Recht steht ihnen jedoch nur zu, wenn sie glaubhaft machen, daß durch den Formwechsel die Erfüllung ihrer Forderung gefährdet wird."
    },
    {
      "date": "2024-11-14",
      "id": "93483",
      "original_text": "Löschungsankündigung\nHamburg Amtsgericht Hamburg HRB 116904\nBlack Diamond Casino GmbH – Hamburg",
      "type": "Löschungsankündigung",
      "state": "Hamburg",
      "amtsgericht": "Amtsgericht Hamburg",
      "registernummer": "HRB 116904",
      "registerart": "HRB",
      "company_name": "Black Diamond Casino GmbH",
      "company_seat": "Hamburg",
      "details": "14.11.2024 (Bekanntmachungsdatum)\n\nHamburg Amtsgericht Hamburg HRB 116904\nLöschungsankündigung\n\nBlack Diamond Casino GmbH\nGesellschaft mit beschränkter Haftung\nHamburg\n\nDas Registergericht beabsichtigt, die im Handelsregister eingetragene Gesellschaft von Amts wegen nach § 394 FamFG zu löschen. Die Frist zur Erhebung eines Widerspruchs gegen die beabsichtigte Löschung wird auf 3 Monate festgesetzt."
    },
    {
      "date": "2024-11-14",
      "id": "93610",
      "original_text": "Löschungsankündigung\nHessen Amtsgericht Hanau HRB 91127\nBlaut Immobilien GmbH – Bruchköbel",
      "type": "Löschungsankündigung",
      "state": "Hessen",
      "amtsgericht": "Amtsgericht Hanau",
      "registernummer": "HRB 91127",
      "registerart": "HRB",
      "company_name": "Blaut Immobilien GmbH",
      "company_seat": "Bruchköbel",
      "details": "14.11.2024 (Bekanntmachungsdatum)\n\nHessen Amtsgericht Hanau HRB 91127\nLöschungsankündigung\n\nBlaut Immobilien GmbH\nGesellschaft mit beschränkter Haftung\nBruchköbel\n\nDas Registergericht beabsichtigt die im Handelsregister eingetragene Gesellschaft von Amts wegen nach § 394 FamFG zu löschen. Die Frist zur Erhebung eines Widerspruchs gegen die beabsichtigte Löschung wird auf 3 Monate festgesetzt."
    },
    {
      "date": "2024-11-14",
      "id": "93584",
      "original_text": "Löschungsankündigung\nBremen Amtsgericht Bremen HRB 34387\nBuschtransporte GmbH – Bremerhaven",
      "type": "Löschungsankündigung",
      "state": "Bremen",
      "amtsgericht": "Amtsgericht Bremen",
      "registernummer": "HRB 34387",
      "registerart": "HRB",
      "company_name": "Buschtransporte GmbH",
      "company_seat": "Bremerhaven",
      "details": "14.11.2024 (Bekanntmachungsdatum)\n\nBremen Amtsgericht Bremen HRB 34387\nLöschungsankündigung\n\nBuschtransporte GmbH\nGesellschaft mit beschränkter Haftung\nBremerhaven\n\nEs ist beabsichtigt die im Handelsregister eingetragene Gesellschaft von Amts wegen gemäß § 394 FamFG zu löschen. Gegen die Löschung kann beim AG Bremen schriftlich oder zu Protokoll der Geschäftsstelle Widerspruch eingelegt werden. Widerspruchsfrist 4 Wochen."
    },
    {
      "date": "2024-11-14",
      "id": "93510",
      "original_text": "Registerbekanntmachung nach dem Umwandlungsgesetz\nBerlin Amtsgericht Berlin (Charlottenburg) HRB 269409\nCLEP Converse Large Energy Projects GmbH – Berlin",
      "type": "Registerbekanntmachung nach dem Umwandlungsgesetz",
      "state": "Berlin",
      "amtsgericht": "Amtsgericht Berlin (Charlottenburg)",
      "registernummer": "HRB 269409",
      "registerart": "HRB",
      "company_name": "CLEP Converse Large Energy Projects GmbH",
      "company_seat": "Berlin",
      "details": "14.11.2024 (Bekanntmachungsdatum)\n\nBerlin Amtsgericht Berlin (Charlottenburg) HRB 269409\nRegisterbekanntmachung nach dem Umwandlungsgesetz 13.11.2024 (Eintragungsdatum)\n\nCLEP Converse Large Energy Projects GmbH\nGesellschaft mit beschränkter Haftung\nBerlin\n\nZu Eintragungsnummer 1 vom 13.11.2024 wird als nicht eingetragen veröffentlicht: Den Gläubigern der an der Spaltung beteiligten Rechtsträger ist, wenn sie binnen sechs Monaten nach dem Tag, an dem die Eintragung der Spaltung in das Register des Sitzes desjenigen Rechtsträgers, dessen Gläubiger sie sind, als bekannt gemacht gilt, ihren Anspruch nach Grund und Höhe schriftlich anmelden, Sicherheit zu leisten, soweit sie nicht Befriedigung verlangen können. Dieses Recht steht den Gläubigern jedoch nur zu, wenn sie glaubhaft machen, dass durch die Spaltung die Erfüllung ihrer Forderung gefährdet wird. Das Recht, Sicherheitsleistung zu verlangen, steht Gläubigern nicht zu, die im Falle der Insolvenz ein Recht auf vorzugsweise Befriedigung aus einer Deckungsmasse haben, die nach gesetzlicher Vorschrift zu ihrem Schutz errichtet und staatlich überwacht ist."
    },
    {
      "date": "2024-11-14",
      "id": "93476",
      "original_text": "Löschungsankündigung\nHamburg Amtsgericht Hamburg HRB 152610\nCSM-Detektei UG (haftungsbeschränkt) – Hamburg",
      "type": "Löschungsankündigung",
      "state": "Hamburg",
      "amtsgericht": "Amtsgericht Hamburg",
      "registernummer": "HRB 152610",
      "registerart": "HRB",
      "company_name": "CSM-Detektei UG (haftungsbeschränkt)",
      "company_seat": "Hamburg",
      "details": "14.11.2024 (Bekanntmachungsdatum)\n\nHamburg Amtsgericht Hamburg HRB 152610\nLöschungsankündigung\n\nCSM-Detektei UG (haftungsbeschränkt)\nGesellschaft mit beschränkter Haftung\nHamburg\n\nDas Registergericht beabsichtigt, die im Handelsregister eingetragene Gesellschaft von Amts wegen nach § 394 FamFG zu löschen. Die Frist zur Erhebung eines Widerspruchs gegen die beabsichtigte Löschung wird auf 3 Monate festgesetzt."
    },
    {
      "date": "2024-11-14",
      "id": "93571",
      "original_text": "Registerbekanntmachung nach dem Umwandlungsgesetz\nNordrhein-Westfalen Amtsgericht Wuppertal HRA 25913\nCavo Management und Verwaltung GmbH & Co. KG – Mettmann",
      "type": "Registerbekanntmachung nach dem Umwandlungsgesetz",
      "state": "Nordrhein-Westfalen",
      "amtsgericht": "Amtsgericht Wuppertal",
      "registernummer": "HRA 25913",
      "registerart": "HRA",
      "company_name": "Cavo Management und Verwaltung GmbH & Co. KG",
      "company_seat": "Mettmann",
      "details": "14.11.2024 (Bekanntmachungsdatum)\n\nNordrhein-Westfalen Amtsgericht Wuppertal HRA 25913\nRegisterbekanntmachung nach dem Umwandlungsgesetz 14.11.2024 (Eintragungsdatum)\n\nCavo Management und Verwaltung GmbH & Co. KG\nKommanditgesellschaft\nMettmann\n\nDen Gläubigern der an der Verschmelzung beteiligten Rechtsträger ist, wenn sie binnen sechs Monaten nach dem Tag, an dem die Eintragung der Verschmelzung in das Register des Sitzes desjenigen Rechtsträgers, dessen Gläubiger sie sind, nach § 19 Absatz 3 UmwG als bekanntgemacht gilt, ihren Anspruch nach Grund und Höhe schriftlich anmelden, Sicherheit zu leisten, soweit sie nicht Befriedigung verlangen können. Dieses Recht steht den Gläubigern jedoch nur zu, wenn sie glaubhaft machen, dass durch die Verschmelzung die Erfüllung ihrer Forderung gefährdet wird."
    },
    {
      "date": "2024-11-14",
      "id": "93549",
      "original_text": "Sonstige Registerbekanntmachung\nNiedersachsen Amtsgericht Göttingen HRB 112017\nContiTech MGW GmbH – Hann. Münden",
      "type": "Sonstige Registerbekanntmachung",
      "state": "Niedersachsen",
      "amtsgericht": "Amtsgericht Göttingen",
      "registernummer": "HRB 112017",
      "registerart": "HRB",
      "company_name": "ContiTech MGW GmbH",
      "company_seat": "Hann. Münden",
      "details": "14.11.2024 (Bekanntmachungsdatum)\n\nNiedersachsen Amtsgericht Göttingen HRB 112017\nSonstige Registerbekanntmachung 07.11.2024 (Eintragungsdatum)\n\nContiTech MGW GmbH\nGesellschaft mit beschränkter Haftung\nHann. Münden\n\nDie Liste der Mitglieder des Aufsichtsrats wurde beim Registergericht eingereicht."
    },
    {
      "date": "2024-11-14",
      "id": "93599",
      "original_text": "Registerbekanntmachung nach dem Umwandlungsgesetz\nThüringen Amtsgericht Jena HRA 506851\nDIKIDA UG (haftungsbeschränkt) & Co. KG – Ohrdruf",
      "type": "Registerbekanntmachung nach dem Umwandlungsgesetz",
      "state": "Thüringen",
      "amtsgericht": "Amtsgericht Jena",
      "registernummer": "HRA 506851",
      "registerart": "HRA",
      "company_name": "DIKIDA UG (haftungsbeschränkt) & Co. KG",
      "company_seat": "Ohrdruf",
      "details": "14.11.2024 (Bekanntmachungsdatum)\n\nThüringen Amtsgericht Jena HRA 506851\nRegisterbekanntmachung nach dem Umwandlungsgesetz 14.11.2024 (Eintragungsdatum)\n\nDIKIDA UG (haftungsbeschränkt) & Co. KG\nKommanditgesellschaft\nOhrdruf\n\nNicht eingetragen: Den Gläubigern der an der Ausgliederung beteiligten Rechtsträger, ist wenn sie binnen sechs Monaten nach dem Tag, an dem die Eintragung der Ausgliederung in das Register des Sitzes desjenigen Rechtsträgers, dessen Gläubiger sie sind, nach §§125, 19 Abs. 3 UmwG als bekanntgemacht gilt, ihren Anspruch nach Grund und Höhe schriftlich anmelden, Sicherheit zu leisten, soweit sie nicht Befriedigung verlangen können. Dieses Recht steht ihnen jedoch nur zu, wenn sie glaubhaft machen, daß durch die Ausgliederung die Erfüllung ihrer Forderung gefährdet wird."
    },
    {
      "date": "2024-11-14",
      "id": "93521",
      "original_text": "Registerbekanntmachung nach dem Umwandlungsgesetz\nBerlin Amtsgericht Berlin (Charlottenburg) HRA 61337\nDaniel Krämer e.K. – Berlin",
      "type": "Registerbekanntmachung nach dem Umwandlungsgesetz",
      "state": "Berlin",
      "amtsgericht": "Amtsgericht Berlin (Charlottenburg)",
      "registernummer": "HRA 61337",
      "registerart": "HRA",
      "company_name": "Daniel Krämer e.K.",
      "company_seat": "Berlin",
      "details": "14.11.2024 (Bekanntmachungsdatum)\n\nBerlin Amtsgericht Berlin (Charlottenburg) HRA 61337\nRegisterbekanntmachung nach dem Umwandlungsgesetz 13.11.2024 (Eintragungsdatum)\n\nDaniel Krämer e.K.\nEinzelkaufmann / Einzelkauffrau\nBerlin\n\nDen Gläubigern der an der Spaltung beteiligten Rechtsträger ist, wenn sie binnen sechs Monaten nach dem Tag, an dem die Eintragung der Spaltung in das Register des Sitzes desjenigen Rechtsträgers, dessen Gläubiger sie sind, als bekannt gemacht gilt, ihren Anspruch nach Grund und Höhe schriftlich anmelden, Sicherheit zu leisten, soweit sie nicht Befriedigung verlangen können. Dieses Recht steht den Gläubigern jedoch nur zu, wenn sie glaubhaft machen, dass durch die Spaltung die Erfüllung ihrer Forderung gefährdet wird. Das Recht, Sicherheitsleistung zu verlangen, steht Gläubigern nicht zu, die im Falle der Insolvenz ein Recht auf vorzugsweise Befriedigung aus einer Deckungsmasse haben, die nach gesetzlicher Vorschrift zu ihrem Schutz errichtet und staatlich überwacht ist.Zu Eintragungsnummer 2 vom 13.11.2024 wird als nicht eingetragen veröffentlicht:"
    },
    {
      "date": "2024-11-14",
      "id": "93580",
      "original_text": "Registerbekanntmachung nach dem Umwandlungsgesetz\nNordrhein-Westfalen Amtsgericht Hagen HRA 6588\nDouglas Group Technology GmbH & Co. KG – Hagen",
      "type": "Registerbekanntmachung nach dem Umwandlungsgesetz",
      "state": "Nordrhein-Westfalen",
      "amtsgericht": "Amtsgericht Hagen",
      "registernummer": "HRA 6588",
      "registerart": "HRA",
      "company_name": "Douglas Group Technology GmbH & Co. KG",
      "company_seat": "Hagen",
      "details": "14.11.2024 (Bekanntmachungsdatum)\n\nNordrhein-Westfalen Amtsgericht Hagen HRA 6588\nRegisterbekanntmachung nach dem Umwandlungsgesetz 14.11.2024 (Eintragungsdatum)\n\nDouglas Group Technology GmbH & Co. KG\nKommanditgesellschaft\nHagen\n\nDen Gläubigern der an der formwechselnden Umwandlung beteiligten Rechtsträger ist, wenn sie binnen sechs Monaten nach dem Tag, an dem die Eintragung der formwechselnden Umwandlung in das Register des Sitzes desjenigen Rechtsträgers, dessen Gläubiger sie sind, nach § 19 Absatz 3 UmwG als bekanntgemacht gilt, ihren Anspruch nach Grund und Höhe schriftlich anmelden, Sicherheit zu leisten, soweit sie nicht Befriedigung verlangen können. Dieses Recht steht den Gläubigern jedoch nur zu, wenn sie glaubhaft machen, dass durch die formwechselnden Umwandlung die Erfüllung ihrer Forderung gefährdet wird."
    },
    {
      "date": "2024-11-14",
      "id": "93530",
      "original_text": "Löschungsankündigung\nBerlin Amtsgericht Berlin (Charlottenburg) HRB 260703\nDream Selling GmbH – Berlin",
      "type": "Löschungsankündigung",
      "state": "Berlin",
      "amtsgericht": "Amtsgericht Berlin (Charlottenburg)",
      "registernummer": "HRB 260703",
      "registerart": "HRB",
      "company_name": "Dream Selling GmbH",
      "company_seat": "Berlin",
      "details": "14.11.2024 (Bekanntmachungsdatum)\n\nBerlin Amtsgericht Berlin (Charlottenburg) HRB 260703\nLöschungsankündigung\n\nDream Selling GmbH\nGesellschaft mit beschränkter Haftung\nBerlin\n\nBei der nachstehenden Gesellschaft wird das Amtslöschungsverfahren gemäß § 394 FamFG eingeleitet. Widerspruchsfrist 6 Wochen"
    },
    {
      "date": "2024-11-14",
      "id": "93604",
      "original_text": "Löschungsankündigung\nHessen Amtsgericht Offenbach am Main HRB 53927\nEMC Dienstleistungs-GmbH – Dreieich",
      "type": "Löschungsankündigung",
      "state": "Hessen",
      "amtsgericht": "Amtsgericht Offenbach am Main",
      "registernummer": "HRB 53927",
      "registerart": "HRB",
      "company_name": "EMC Dienstleistungs-GmbH",
      "company_seat": "Dreieich",
      "details": "14.11.2024 (Bekanntmachungsdatum)\n\nHessen Amtsgericht Offenbach am Main HRB 53927\nLöschungsankündigung\n\nEMC Dienstleistungs-GmbH\nGesellschaft mit beschränkter Haftung\nDreieich\n\nDas Registergericht beabsichtigt die im Handelsregister eingetragene Gesellschaft von Amts wegen nach § 394 FamFG zu löschen. Die Frist zur Erhebung eines Widerspruchs gegen die beabsichtigte Löschung wird auf 3 Monate festgesetzt"
    },
    {
      "date": "2024-11-14",
      "id": "93430",
      "original_text": "Registerbekanntmachung nach dem Umwandlungsgesetz\nBayern Amtsgericht Fürth HRB 5631\nESS - Erlanger Sicherheits-Service GmbH – Erlangen",
      "type": "Registerbekanntmachung nach dem Umwandlungsgesetz",
      "state": "Bayern",
      "amtsgericht": "Amtsgericht Fürth",
      "registernummer": "HRB 5631",
      "registerart": "HRB",
      "company_name": "ESS - Erlanger Sicherheits-Service GmbH",
      "company_seat": "Erlangen",
      "details": "14.11.2024 (Bekanntmachungsdatum)\n\nBayern Amtsgericht Fürth HRB 5631\nRegisterbekanntmachung nach dem Umwandlungsgesetz 13.11.2024 (Eintragungsdatum)\n\nESS - Erlanger Sicherheits-Service GmbH\nGesellschaft mit beschränkter Haftung\nErlangen\n\nDen Gläubigern der an der Verschmelzung beteiligten Rechtsträger ist, wenn sie binnen sechs Monaten nach dem Tag, an dem die Eintragung der Verschmelzung in das Register des Sitzes desjenigen Rechtsträgers, dessen Gläubiger sie sind, nach § 19 Abs. 3 UmwG als bekannt gemacht gilt, ihren Anspruch nach Grund und Höhe schriftlich anmelden, Sicherheit zu leisten, soweit sie nicht Befriedigung verlangen können. Dieses Recht steht den Gläubigern jedoch nur zu, wenn sie glaubhaft machen, dass durch die Verschmelzung die Erfüllung ihrer Forderung gefährdet wird."
    },
    {
      "date": "2024-11-14",
      "id": "93579",
      "original_text": "Löschungsankündigung\nNordrhein-Westfalen Amtsgericht Kleve HRB 1790\nESTRO Bauträger-GmbH – Kleve",
      "type": "Löschungsankündigung",
      "state": "Nordrhein-Westfalen",
      "amtsgericht": "Amtsgericht Kleve",
      "registernummer": "HRB 1790",
      "registerart": "HRB",
      "company_name": "ESTRO Bauträger-GmbH",
      "company_seat": "Kleve",
      "details": "14.11.2024 (Bekanntmachungsdatum)\n\nNordrhein-Westfalen Amtsgericht Kleve HRB 1790\nLöschungsankündigung\n\nESTRO Bauträger-GmbH\nGesellschaft mit beschränkter Haftung\nKleve\n\nDas Registergericht beabsichtigt die Gesellschaft von Amts wegen nach § 394 FamFG zu löschen. Die Frist zur Erhebung eines Widerspruchs ist auf einen Monat festgesetzt."
    },
    {
      "date": "2024-11-14",
      "id": "93588",
      "original_text": "Löschungsankündigung\nNordrhein-Westfalen Amtsgericht Düsseldorf HRB 91470\nEco Gastro Concept GmbH – Düsseldorf",
      "type": "Löschungsankündigung",
      "state": "Nordrhein-Westfalen",
      "amtsgericht": "Amtsgericht Düsseldorf",
      "registernummer": "HRB 91470",
      "registerart": "HRB",
      "company_name": "Eco Gastro Concept GmbH",
      "company_seat": "Düsseldorf",
      "details": "14.11.2024 (Bekanntmachungsdatum)\n\nNordrhein-Westfalen Amtsgericht Düsseldorf HRB 91470\nLöschungsankündigung\n\nEco Gastro Concept GmbH\nGesellschaft mit beschränkter Haftung\nDüsseldorf\n\nDas Registergericht beabsichtigt die Gesellschaft von Amts wegen nach § 394 Abs. 1 FamFG zu löschen. Die Frist zur Erhebung eines Widerspruchs ist auf 3 Wochen festgesetzt.\n\nRechtsbehelfsbelehrung:\nDas Widerspruchsrecht steht jedem zu, der an der Unterlassung der Löschung ein berechtigtes Interesse hat. Der Widerspruch ist bei dem Amtsgericht Düsseldorf -Registergericht-, Werdener Straße 1, 40227 Düsseldorf schriftlich in deutscher Sprache oder zur Niederschrift der Geschäftsstelle einzulegen. Der Widerspruch kann auch zur Niederschrift der Geschäftsstelle eines jeden Amtsgerichtes abgegeben werden. Die Einlegung ist auch durch Übertragung eines elektronischen Dokuments an die elektronische Poststelle des Gerichts möglich. Das elektronische Dokument muss für die Bearbeitung durch das Gericht geeignet und mit einer qualifizierten elektronischen Signatur der verantwortenden Person versehen sein oder von der verantwortenden Person signiert und auf einem sicheren Übermittlungsweg gemäß § 130a ZPO nach näherer Maßgabe der Verordnung über die technischen Rahmenbedingungen des elektronischen Rechtsverkehrs und über das besondere elektronische Behördenpostfach (BGBl. I, S.3803) eingereicht werden. Weitere Informationen erhalten Sie auf der Internetseite www.justiz.de.\nDer Widerspruch muss spätestens innerhalb der gesetzten Frist nach dem Datum der Bekanntmachung der Löschungsankündigung bei dem Amtsgericht - Registergericht - Düsseldorf eingegangen sein.  Dies gilt auch dann, wenn der Widerspruch zur Niederschrift der Geschäftsstelle eines anderen Amtsgerichtes abgegeben wurde. Die Frist beginnt mit dem Tage der Bekanntmachung der Löschungsankündigung in dem für die Bekanntmachung der Eintragungen in das Handelsregister bestimmten elektronischen Informations- und Kommunikationssystem nach § 10 des Handelsgesetzbuches. Fällt das Ende der Frist auf einen Sonntag, einen allgemeinen Feiertag oder Sonnabend, so endet die Frist mit Ablauf des nächsten Werktages.\nDer Widerspruch muss die Bezeichnung der angefochtenen Löschungsankündigung sowie die Erklärung enthalten, dass Widerspruch gegen diese Löschungsankündigung eingelegt wird. Er ist zu unterzeichnen und soll begründet werden."
    },
    {
      "date": "2024-11-14",
      "id": "93526",
      "original_text": "Registerbekanntmachung nach dem Umwandlungsgesetz\nBaden-Württemberg Amtsgericht Ulm HRB 738328\nElectrostar GmbH – Ebersbach an der Fils",
      "type": "Registerbekanntmachung nach dem Umwandlungsgesetz",
      "state": "Baden-Württemberg",
      "amtsgericht": "Amtsgericht Ulm",
      "registernummer": "HRB 738328",
      "registerart": "HRB",
      "company_name": "Electrostar GmbH",
      "company_seat": "Ebersbach an der Fils",
      "details": "14.11.2024 (Bekanntmachungsdatum)\n\nBaden-Württemberg Amtsgericht Ulm HRB 738328\nRegisterbekanntmachung nach dem Umwandlungsgesetz 14.11.2024 (Eintragungsdatum)\n\nElectrostar GmbH\nGesellschaft mit beschränkter Haftung\nEbersbach an der Fils\n\nDen Gläubigern der an der grenzüberschreitenden Abspaltung beteiligten übernehmenden Rechtsträger ist, wenn sie binnen sechs Monaten nach dem Tag, an dem die Eintragung der Spaltung in das Register des Sitzes desjenigen Rechtsträgers, dessen Gläubiger sie sind, nach § 19 Absatz 3 UmwG als bekanntgemacht gilt, ihren Anspruch nach Grund und Höhe schriftlich anmelden, Sicherheit zu leisten, soweit sie nicht Befriedigung verlangen können.\nDieses Recht steht den Gläubigern jedoch nur zu, wenn sie glaubhaft machen, dass durch die Spaltung die Erfüllung ihrer Forderung gefährdet wird."
    },
    {
      "date": "2024-11-14",
      "id": "93439",
      "original_text": "Registerbekanntmachung nach dem Umwandlungsgesetz\nBayern Amtsgericht Fürth HRB 2380\nErlanger Wach- u. Sicherheitsdienst GmbH – Erlangen",
      "type": "Registerbekanntmachung nach dem Umwandlungsgesetz",
      "state": "Bayern",
      "amtsgericht": "Amtsgericht Fürth",
      "registernummer": "HRB 2380",
      "registerart": "HRB",
      "company_name": "Erlanger Wach- u. Sicherheitsdienst GmbH",
      "company_seat": "Erlangen",
      "details": "14.11.2024 (Bekanntmachungsdatum)\n\nBayern Amtsgericht Fürth HRB 2380\nRegisterbekanntmachung nach dem Umwandlungsgesetz 13.11.2024 (Eintragungsdatum)\n\nErlanger Wach- u. Sicherheitsdienst GmbH\nGesellschaft mit beschränkter Haftung\nErlangen\n\nDen Gläubigern der an der Verschmelzung beteiligten Rechtsträger ist, wenn sie binnen sechs Monaten nach dem Tag, an dem die Eintragung der Verschmelzung in das Register des Sitzes desjenigen Rechtsträgers, dessen Gläubiger sie sind, nach § 19 Abs. 3 UmwG als bekannt gemacht gilt, ihren Anspruch nach Grund und Höhe schriftlich anmelden, Sicherheit zu leisten, soweit sie nicht Befriedigung verlangen können. Dieses Recht steht den Gläubigern jedoch nur zu, wenn sie glaubhaft machen, dass durch die Verschmelzung die Erfüllung ihrer Forderung gefährdet wird."
    },
    {
      "date": "2024-11-14",
      "id": "93482",
      "original_text": "Löschungsankündigung\nHamburg Amtsgericht Hamburg HRB 144113\nEurope Techno Trade GmbH – Hamburg",
      "type": "Löschungsankündigung",
      "state": "Hamburg",
      "amtsgericht": "Amtsgericht Hamburg",
      "registernummer": "HRB 144113",
      "registerart": "HRB",
      "company_name": "Europe Techno Trade GmbH",
      "company_seat": "Hamburg",
      "details": "14.11.2024 (Bekanntmachungsdatum)\n\nHamburg Amtsgericht Hamburg HRB 144113\nLöschungsankündigung\n\nEurope Techno Trade GmbH\nGesellschaft mit beschränkter Haftung\nHamburg\n\nDas Registergericht beabsichtigt, die im Handelsregister eingetragene Gesellschaft von Amts wegen nach § 394 FamFG zu löschen. Die Frist zur Erhebung eines Widerspruchs gegen die beabsichtigte Löschung wird auf 3 Monate festgesetzt."
    },
    {
      "date": "2024-11-14",
      "id": "93498",
      "original_text": "Löschungsankündigung\nHamburg Amtsgericht Hamburg HRB 170388\nFIX Spedition & Logistik GmbH – Hamburg",
      "type": "Löschungsankündigung",
      "state": "Hamburg",
      "amtsgericht": "Amtsgericht Hamburg",
      "registernummer": "HRB 170388",
      "registerart": "HRB",
      "company_name": "FIX Spedition & Logistik GmbH",
      "company_seat": "Hamburg",
      "details": "14.11.2024 (Bekanntmachungsdatum)\n\nHamburg Amtsgericht Hamburg HRB 170388\nLöschungsankündigung\n\nFIX Spedition & Logistik GmbH\nGesellschaft mit beschränkter Haftung\nHamburg\n\nDas Registergericht beabsichtigt, die im Handelsregister eingetragene Gesellschaft von Amts wegen nach § 394 FamFG zu löschen. Die Frist zur Erhebung eines Widerspruchs gegen die beabsichtigte Löschung wird auf 3 Monate festgesetzt."
    },
    {
      "date": "2024-11-14",
      "id": "93522",
      "original_text": "Registerbekanntmachung nach dem Umwandlungsgesetz\nMecklenburg-Vorpommern Amtsgericht Stralsund HRB 21860\nFT Mukran Concrete GmbH – Sassnitz",
      "type": "Registerbekanntmachung nach dem Umwandlungsgesetz",
      "state": "Mecklenburg-Vorpommern",
      "amtsgericht": "Amtsgericht Stralsund",
      "registernummer": "HRB 21860",
      "registerart": "HRB",
      "company_name": "FT Mukran Concrete GmbH",
      "company_seat": "Sassnitz",
      "details": "14.11.2024 (Bekanntmachungsdatum)\n\nMecklenburg-Vorpommern Amtsgericht Stralsund HRB 21860\nRegisterbekanntmachung nach dem Umwandlungsgesetz 14.11.2024 (Eintragungsdatum)\n\nFT Mukran Concrete GmbH\nGesellschaft mit beschränkter Haftung\nSassnitz\n\nAls nicht eingetragen wird veröffentlicht: Den Gläubigern der an der Verschmelzung beteiligten Rechtsträger ist, wenn sie binnen sechs Monaten nach dem Tag, an dem die Eintragung der Verschmelzung in das Register des Sitzes desjenigen Rechtsträgers, dessen Gläubiger sie sind, nach § 19 Abs. 3 UmwG als bekannt gemacht gilt,\nihren Anspruch nach Grund und Höhe schriftlich anmelden, Sicherheit zu leisten, soweit sie nicht Befriedigung verlangen können. Dieses Recht steht den Gläubigern jedoch nur zu, wenn sie glaubhaft machen, dass durch die Verschmelzung die Erfüllung der Forderung gefährdet wird."
    },
    {
      "date": "2024-11-14",
      "id": "93582",
      "original_text": "Löschungsankündigung\nNordrhein-Westfalen Amtsgericht Düsseldorf HRB 98950\nFacility Management Rübesam UG (haftungsbeschränkt) – Düsseldorf",
      "type": "Löschungsankündigung",
      "state": "Nordrhein-Westfalen",
      "amtsgericht": "Amtsgericht Düsseldorf",
      "registernummer": "HRB 98950",
      "registerart": "HRB",
      "company_name": "Facility Management Rübesam UG (haftungsbeschränkt)",
      "company_seat": "Düsseldorf",
      "details": "14.11.2024 (Bekanntmachungsdatum)\n\nNordrhein-Westfalen Amtsgericht Düsseldorf HRB 98950\nLöschungsankündigung\n\nFacility Management Rübesam UG (haftungsbeschränkt)\nGesellschaft mit beschränkter Haftung\nDüsseldorf\n\nDas Registergericht beabsichtigt die Gesellschaft von Amts wegen nach § 394 Abs. 1 FamFG zu löschen. Die Frist zur Erhebung eines Widerspruchs ist auf 3 Wochen festgesetzt.\n\nRechtsbehelfsbelehrung:\nDas Widerspruchsrecht steht jedem zu, der an der Unterlassung der Löschung ein berechtigtes Interesse hat. Der Widerspruch ist bei dem Amtsgericht Düsseldorf -Registergericht-, Werdener Straße 1, 40227 Düsseldorf schriftlich in deutscher Sprache oder zur Niederschrift der Geschäftsstelle einzulegen. Der Widerspruch kann auch zur Niederschrift der Geschäftsstelle eines jeden Amtsgerichtes abgegeben werden. Die Einlegung ist auch durch Übertragung eines elektronischen Dokuments an die elektronische Poststelle des Gerichts möglich. Das elektronische Dokument muss für die Bearbeitung durch das Gericht geeignet und mit einer qualifizierten elektronischen Signatur der verantwortenden Person versehen sein oder von der verantwortenden Person signiert und auf einem sicheren Übermittlungsweg gemäß § 130a ZPO nach näherer Maßgabe der Verordnung über die technischen Rahmenbedingungen des elektronischen Rechtsverkehrs und über das besondere elektronische Behördenpostfach (BGBl. I, S.3803) eingereicht werden. Weitere Informationen erhalten Sie auf der Internetseite www.justiz.de.\nDer Widerspruch muss spätestens innerhalb der gesetzten Frist nach dem Datum der Bekanntmachung der Löschungsankündigung bei dem Amtsgericht - Registergericht - Düsseldorf eingegangen sein.  Dies gilt auch dann, wenn der Widerspruch zur Niederschrift der Geschäftsstelle eines anderen Amtsgerichtes abgegeben wurde. Die Frist beginnt mit dem Tage der Bekanntmachung der Löschungsankündigung in dem für die Bekanntmachung der Eintragungen in das Handelsregister bestimmten elektronischen Informations- und Kommunikationssystem nach § 10 des Handelsgesetzbuches. Fällt das Ende der Frist auf einen Sonntag, einen allgemeinen Feiertag oder Sonnabend, so endet die Frist mit Ablauf des nächsten Werktages.\nDer Widerspruch muss die Bezeichnung der angefochtenen Löschungsankündigung sowie die Erklärung enthalten, dass Widerspruch gegen diese Löschungsankündigung eingelegt wird. Er ist zu unterzeichnen und soll begründet werden."
    },
    {
      "date": "2024-11-14",
      "id": "93550",
      "original_text": "Registerbekanntmachung nach dem Umwandlungsgesetz\nRheinland-Pfalz Amtsgericht Montabaur HRB 25453\nFischer Management Company GmbH – Katzenelnbogen",
      "type": "Registerbekanntmachung nach dem Umwandlungsgesetz",
      "state": "Rheinland-Pfalz",
      "amtsgericht": "Amtsgericht Montabaur",
      "registernummer": "HRB 25453",
      "registerart": "HRB",
      "company_name": "Fischer Management Company GmbH",
      "company_seat": "Katzenelnbogen",
      "details": "14.11.2024 (Bekanntmachungsdatum)\n\nRheinland-Pfalz Amtsgericht Montabaur HRB 25453\nRegisterbekanntmachung nach dem Umwandlungsgesetz 14.11.2024 (Eintragungsdatum)\n\nFischer Management Company GmbH\nGesellschaft mit beschränkter Haftung\nKatzenelnbogen\n\nDen Gläubigern der an der erschmelzung beteiligten übernehmenden Rechtsträger ist, wenn sie binnen sechs Monaten nach dem Tag, an dem die Eintragung der Spaltung in das Register des Sitzes desjenigen Rechtsträgers, dessen Gläubiger sie sind, nach § 19 Absatz 3 UmwG als bekanntgemacht gilt, ihren Anspruch nach Grund und Höhe schriftlich anmelden, Sicherheit zu leisten, soweit sie nicht Befriedigung verlangen können.\nDieses Recht steht den Gläubigern jedoch nur zu, wenn sie glaubhaft machen, dass durch die Verschmelzung die Erfüllung ihrer Forderung gefährdet wird."
    },
    {
      "date": "2024-11-14",
      "id": "93473",
      "original_text": "Registerbekanntmachung nach dem Umwandlungsgesetz\nSachsen-Anhalt Amtsgericht Stendal HRB 13022\nFlechtinger-Baulogistik GmbH – Flechtingen",
      "type": "Registerbekanntmachung nach dem Umwandlungsgesetz",
      "state": "Sachsen-Anhalt",
      "amtsgericht": "Amtsgericht Stendal",
      "registernummer": "HRB 13022",
      "registerart": "HRB",
      "company_name": "Flechtinger-Baulogistik GmbH",
      "company_seat": "Flechtingen",
      "details": "14.11.2024 (Bekanntmachungsdatum)\n\nSachsen-Anhalt Amtsgericht Stendal HRB 13022\nRegisterbekanntmachung nach dem Umwandlungsgesetz 14.11.2024 (Eintragungsdatum)\n\nFlechtinger-Baulogistik GmbH\nGesellschaft mit beschränkter Haftung\nFlechtingen\n\nNicht eingetragen:\nDen Gläubigern der an der Verschmelzung beteiligten Rechtsträger ist, wenn sie binnen sechs Monaten nach dem Tag, an dem die Eintragung der Verschmelzung nach § 19 Abs. 3 UmwG als bekanntgemacht gilt, ihren Anspruch nach Grund und Höhe schriftlich anmelden, Sicherheit zu leisten, soweit sie nicht Befriedigung verlangen können. Dieses Recht steht ihnen jedoch nur zu, wenn sie glaubhaft machen, dass durch die Verschmelzung die Erfüllung ihrer Forderung gefährdet wird."
    },
    {
      "date": "2024-11-14",
      "id": "93470",
      "original_text": "Löschungsankündigung\nSaarland Amtsgericht Saarbrücken HRB 106510\nGBSAAR GmbH – Saarbrücken",
      "type": "Löschungsankündigung",
      "state": "Saarland",
      "amtsgericht": "Amtsgericht Saarbrücken",
      "registernummer": "HRB 106510",
      "registerart": "HRB",
      "company_name": "GBSAAR GmbH",
      "company_seat": "Saarbrücken",
      "details": "14.11.2024 (Bekanntmachungsdatum)\n\nSaarland Amtsgericht Saarbrücken HRB 106510\nLöschungsankündigung\n\nGBSAAR GmbH\nGesellschaft mit beschränkter Haftung\nSaarbrücken\n\nEs ist beabsichtigt, die Gesellschaft von Amts wegen gemäß § 394 FamFG wegen Vermögenslosigkeit zu löschen.\nGegen die Löschung von Amts wegen ist das Rechtsmittel des Widerspruchs statthaft. Der Widerspruch ist binnen einer Frist zwei Monaten beginnend mit dem Tag dieser Veröffentlichung durch Einreichen eines Widerspruchsschreibens -schriftlich oder zur Niederschrift der Geschäftsstelle beim Amtsgericht Saarbrücken, -zentrales Handelsregister-, Mainzer Str.178, 66121 Saarbrücken einzulegen.\nDer Widerspruch muss die Bezeichnung der angefochtenen Löschungsankündigung enthalten sowie die Erklärung, dass Widerspruch eingelegt wird. Er ist vom Widerspruchsführer oder seinem Bevollmächtigten zu unterzeichnen.\nDas Widerspruchsschreiben kann auch in der Form eines elektronischen Dokumentes eingereicht werden, das mit einer qualifizierten elektronischen Signatur nach dem Signaturgesetz versehen sein muss (§§ 14 Abs. 2 FamFG, 130a, 298 ZPO)."
    },
    {
      "date": "2024-11-14",
      "id": "93577",
      "original_text": "Registerbekanntmachung nach dem Umwandlungsgesetz\nNordrhein-Westfalen Amtsgericht Kleve HRB 18399\nGTW Trading GmbH – Emmerich am Rhein",
      "type": "Registerbekanntmachung nach dem Umwandlungsgesetz",
      "state": "Nordrhein-Westfalen",
      "amtsgericht": "Amtsgericht Kleve",
      "registernummer": "HRB 18399",
      "registerart": "HRB",
      "company_name": "GTW Trading GmbH",
      "company_seat": "Emmerich am Rhein",
      "details": "14.11.2024 (Bekanntmachungsdatum)\n\nNordrhein-Westfalen Amtsgericht Kleve HRB 18399\nRegisterbekanntmachung nach dem Umwandlungsgesetz 14.11.2024 (Eintragungsdatum)\n\nGTW Trading GmbH\nGesellschaft mit beschränkter Haftung\nEmmerich am Rhein\n\nDen Gläubigern der an der Verschmelzung beteiligten Rechtsträger ist, wenn sie binnen sechs Monaten nach dem Tag, an dem die Eintragung der Verschmelzung in das Register des Sitzes desjenigen Rechtsträgers, dessen Gläubiger sie sind, nach § 19 Absatz 3 UmwG als bekanntgemacht gilt, ihren Anspruch nach Grund und Höhe schriftlich anmelden, Sicherheit zu leisten, soweit sie nicht Befriedigung verlangen können. Dieses Recht steht den Gläubigern jedoch nur zu, wenn sie glaubhaft machen, dass durch die Verschmelzung die Erfüllung ihrer Forderung gefährdet wird."
    },
    {
      "date": "2024-11-14",
      "id": "93590",
      "original_text": "Löschungsankündigung\nNordrhein-Westfalen Amtsgericht Neuss HRB 22533\nGlobal Log. 24 GmbH – Kaarst",
      "type": "Löschungsankündigung",
      "state": "Nordrhein-Westfalen",
      "amtsgericht": "Amtsgericht Neuss",
      "registernummer": "HRB 22533",
      "registerart": "HRB",
      "company_name": "Global Log. 24 GmbH",
      "company_seat": "Kaarst",
      "details": "14.11.2024 (Bekanntmachungsdatum)\n\nNordrhein-Westfalen Amtsgericht Neuss HRB 22533\nLöschungsankündigung 14.11.2024 (Eintragungsdatum)\n\nGlobal Log. 24 GmbH\nGesellschaft mit beschränkter Haftung\nKaarst\n\nDas Registergericht beabsichtigt ,die Gesellschaft wegen Vermögenslosigkeit aufgrund des § 394 Abs. 1 FamFG zu löschen. Frist zur Geltendmachung eines Widerspruchs: 1 Monat.\nRechtsbehelfsbelehrung:\nGegen diese Verfügung können Sie Widerspruch einlegen.\nDer Widerspruch ist bei dem Amtsgericht Neuss - Registergericht -, Breite Str. 48, 41460 Neuss schriftlich in deutscher Sprache oder zur Niederschrift der Geschäftsstelle einzulegen.\nDer Widerspruch kann auch zur Niederschrift der Geschäftsstelle eines jeden Amtsgerichtes abgegeben werden.\nDie Einlegung ist auch durch Übertragung eines elektronischen Dokuments an die elektronische Poststelle des Gerichts möglich. Das elektronische Dokument muss für die Bearbeitung durch das Gericht geeignet und mit einer qualifizierten elektronischen Signatur der verantwortenden Person versehen sein oder von der verantwortenden Person signiert und auf einem sicheren Übermittlungsweg gemäß § 130a ZPO nach näherer Maßgabe der Verordnung über die technischen Rahmenbedingungen des elektronischen Rechtsverkehrs und über das besondere elektronische Behördenpostfach (BGBl. I, S.3803) eingereicht werden. Weitere Informationen erhalten Sie auf der Internetseite www.justiz.de.\nDer Widerspruch muss spätestens innerhalb der gesetzten Frist nach der schriftlichen Bekanntgabe der Verfügung bei dem Amtsgericht - Registergericht - Neuss eingegangen sein. Dies gilt auch dann, wenn der Widerspruch zur Niederschrift der Geschäftsstelle eines anderen Amtsgerichtes abgegeben wurde. Die Frist beginnt mit der schriftlichen Bekanntgabe der Verfügung. Die Bekanntgabe ist entweder durch Zustellung oder am dritten Tage nach Aufgabe zur Post bewirkt. Fällt das Ende der Frist auf einen Sonntag, einen allgemeinen Feiertag oder Sonnabend, so endet die Frist mit Ablauf des nächsten Werktages.\nDer Widerspruch muss die Bezeichnung der angefochtenen Verfügung sowie die Erklärung enthalten, dass Widerspruch gegen diese Verfügung eingelegt wird. Er ist zu unterzeichnen und soll begründet werden."
    },
    {
      "date": "2024-11-14",
      "id": "93608",
      "original_text": "Löschungsankündigung\nHessen Amtsgericht Frankfurt am Main HRB 124906\nGrün Bau GmbH – Frankfurt am Main",
      "type": "Löschungsankündigung",
      "state": "Hessen",
      "amtsgericht": "Amtsgericht Frankfurt am Main",
      "registernummer": "HRB 124906",
      "registerart": "HRB",
      "company_name": "Grün Bau GmbH",
      "company_seat": "Frankfurt am Main",
      "details": "14.11.2024 (Bekanntmachungsdatum)\n\nHessen Amtsgericht Frankfurt am Main HRB 124906\nLöschungsankündigung\n\nGrün Bau GmbH\nGesellschaft mit beschränkter Haftung\nFrankfurt am Main\n\nDas Registergericht beabsichtigt die im Handelsregister eingetragene Gesellschaft von Amts wegen nach § 394 FamFG zu löschen. Die Frist zur Erhebung eines Widerspruchs gegen die beabsichtigte Löschung wird auf 1 Monat festgesetzt."
    },
    {
      "date": "2024-11-14",
      "id": "93589",
      "original_text": "Sonstige Registerbekanntmachung\nNordrhein-Westfalen Amtsgericht Münster HRB 16040\nGuido Maria Kretschmer Corporate Fashion GmbH – Münster",
      "type": "Sonstige Registerbekanntmachung",
      "state": "Nordrhein-Westfalen",
      "amtsgericht": "Amtsgericht Münster",
      "registernummer": "HRB 16040",
      "registerart": "HRB",
      "company_name": "Guido Maria Kretschmer Corporate Fashion GmbH",
      "company_seat": "Münster",
      "details": "14.11.2024 (Bekanntmachungsdatum)\n\nNordrhein-Westfalen Amtsgericht Münster HRB 16040\nSonstige Registerbekanntmachung 14.11.2024 (Eintragungsdatum)\n\nGuido Maria Kretschmer Corporate Fashion GmbH\nGesellschaft mit beschränkter Haftung\nMünster\n\nAls nicht eingetragen wird veröffentlicht: Den Gläubigern der Gesellschaft, deren Forderungen begründet worden sind bevor die Eintragung der Beendigung des Gewinnabführungsvertrages  in das Handelsregister nach § 10 des Handelsgesetzbuches als bekanntgemacht gilt, hat der andere Vertragsteil Sicherheit zu leisten, wenn sie sich binnen sechs Monaten nach der Bekanntmachung der Eintragung zu diesem Zweck bei ihm melden."
    },
    {
      "date": "2024-11-14",
      "id": "93597",
      "original_text": "Löschungsankündigung\nThüringen Amtsgericht Jena HRB 110416\nH. S. B. GmbH – Erfurt",
      "type": "Löschungsankündigung",
      "state": "Thüringen",
      "amtsgericht": "Amtsgericht Jena",
      "registernummer": "HRB 110416",
      "registerart": "HRB",
      "company_name": "H. S. B. GmbH",
      "company_seat": "Erfurt",
      "details": "14.11.2024 (Bekanntmachungsdatum)\n\nThüringen Amtsgericht Jena HRB 110416\nLöschungsankündigung\n\nH. S. B. GmbH\nGesellschaft mit beschränkter Haftung\nErfurt\n\nDas Registergericht beabsichtigt, die im Handelsregister eingetragene Gesellschaft wegen Vermögenslosigkeit nach § 394 FamFG von Amts wegen zu löschen. Die Frist zur Erhebung eines Widerspruchs gegen die beabsichtigte Löschung wird auf 6 Wochen festgesetzt."
    },
    {
      "date": "2024-11-14",
      "id": "93489",
      "original_text": "Einreichung neuer Dokumente\nBerlin Amtsgericht Berlin (Charlottenburg) HRB 152369\nHELIOS Klinikum Berlin-Buch GmbH – Berlin",
      "type": "Einreichung neuer Dokumente",
      "state": "Berlin",
      "amtsgericht": "Amtsgericht Berlin (Charlottenburg)",
      "registernummer": "HRB 152369",
      "registerart": "HRB",
      "company_name": "HELIOS Klinikum Berlin-Buch GmbH",
      "company_seat": "Berlin",
      "details": "14.11.2024 (Bekanntmachungsdatum)\n\nBerlin Amtsgericht Berlin (Charlottenburg) HRB 152369\nEinreichung neuer Dokumente\n\nHELIOS Klinikum Berlin-Buch GmbH\nGesellschaft mit beschränkter Haftung\nBerlin\n\nAls nicht eingetragen wird veröffentlicht:Es wurde eine neue Liste der Aufsichtsratsmitglieder eingereicht (§52 GmbHG)."
    },
    {
      "date": "2024-11-14",
      "id": "93477",
      "original_text": "Löschungsankündigung\nHamburg Amtsgericht Hamburg HRB 149537\nHHB Hamburger Holz - & Bautenschutz GmbH – Hamburg",
      "type": "Löschungsankündigung",
      "state": "Hamburg",
      "amtsgericht": "Amtsgericht Hamburg",
      "registernummer": "HRB 149537",
      "registerart": "HRB",
      "company_name": "HHB Hamburger Holz - & Bautenschutz GmbH",
      "company_seat": "Hamburg",
      "details": "14.11.2024 (Bekanntmachungsdatum)\n\nHamburg Amtsgericht Hamburg HRB 149537\nLöschungsankündigung\n\nHHB Hamburger Holz - & Bautenschutz GmbH\nGesellschaft mit beschränkter Haftung\nHamburg\n\nDas Registergericht beabsichtigt, die im Handelsregister eingetragene Gesellschaft von Amts wegen nach § 394 FamFG zu löschen. Die Frist zur Erhebung eines Widerspruchs gegen die beabsichtigte Löschung wird auf 3 Monate festgesetzt."
    },
    {
      "date": "2024-11-14",
      "id": "93443",
      "original_text": "Registerbekanntmachung nach dem Umwandlungsgesetz\nBayern Amtsgericht Fürth HRB 15716\nHIG Hahn ImmobilienGesellschaft mbH – Uffenheim",
      "type": "Registerbekanntmachung nach dem Umwandlungsgesetz",
      "state": "Bayern",
      "amtsgericht": "Amtsgericht Fürth",
      "registernummer": "HRB 15716",
      "registerart": "HRB",
      "company_name": "HIG Hahn ImmobilienGesellschaft mbH",
      "company_seat": "Uffenheim",
      "details": "14.11.2024 (Bekanntmachungsdatum)\n\nBayern Amtsgericht Fürth HRB 15716\nRegisterbekanntmachung nach dem Umwandlungsgesetz 13.11.2024 (Eintragungsdatum)\n\nHIG Hahn ImmobilienGesellschaft mbH\nGesellschaft mit beschränkter Haftung\nUffenheim\n\nDen Gläubigern der an der Verschmelzung beteiligten Rechtsträger ist, wenn sie binnen sechs Monaten nach dem Tag, an dem die Eintragung der Verschmelzung in das Register des Sitzes desjenigen Rechtsträgers, dessen Gläubiger sie sind, nach § 19 Abs. 3 UmwG als bekannt gemacht gilt, ihren Anspruch nach Grund und Höhe schriftlich anmelden, Sicherheit zu leisten, soweit sie nicht Befriedigung verlangen können. Dieses Recht steht den Gläubigern jedoch nur zu, wenn sie glaubhaft machen, dass durch die Verschmelzung die Erfüllung ihrer Forderung gefährdet wird."
    },
    {
      "date": "2024-11-14",
      "id": "93445",
      "original_text": "Registerbekanntmachung nach dem Umwandlungsgesetz\nBayern Amtsgericht Fürth HRB 17086\nHNB Energietechnologien GmbH – Erlangen",
      "type": "Registerbekanntmachung nach dem Umwandlungsgesetz",
      "state": "Bayern",
      "amtsgericht": "Amtsgericht Fürth",
      "registernummer": "HRB 17086",
      "registerart": "HRB",
      "company_name": "HNB Energietechnologien GmbH",
      "company_seat": "Erlangen",
      "details": "14.11.2024 (Bekanntmachungsdatum)\n\nBayern Amtsgericht Fürth HRB 17086\nRegisterbekanntmachung nach dem Umwandlungsgesetz 13.11.2024 (Eintragungsdatum)\n\nHNB Energietechnologien GmbH\nGesellschaft mit beschränkter Haftung\nErlangen\n\nDen Gläubigern der an der Verschmelzung beteiligten Rechtsträger ist, wenn sie binnen sechs Monaten nach dem Tag, an dem die Eintragung der Verschmelzung in das Register des Sitzes desjenigen Rechtsträgers, dessen Gläubiger sie sind, nach § 19 Abs. 3 UmwG als bekannt gemacht gilt, ihren Anspruch nach Grund und Höhe schriftlich anmelden, Sicherheit zu leisten, soweit sie nicht Befriedigung verlangen können. Dieses Recht steht den Gläubigern jedoch nur zu, wenn sie glaubhaft machen, dass durch die Verschmelzung die Erfüllung ihrer Forderung gefährdet wird."
    },
    {
      "date": "2024-11-14",
      "id": "93481",
      "original_text": "Löschungsankündigung\nHamburg Amtsgericht Hamburg HRB 141804\nHSS GREENENERGIE GmbH – Hamburg",
      "type": "Löschungsankündigung",
      "state": "Hamburg",
      "amtsgericht": "Amtsgericht Hamburg",
      "registernummer": "HRB 141804",
      "registerart": "HRB",
      "company_name": "HSS GREENENERGIE GmbH",
      "company_seat": "Hamburg",
      "details": "14.11.2024 (Bekanntmachungsdatum)\n\nHamburg Amtsgericht Hamburg HRB 141804\nLöschungsankündigung\n\nHSS GREENENERGIE GmbH\nGesellschaft mit beschränkter Haftung\nHamburg\n\nDas Registergericht beabsichtigt, die im Handelsregister eingetragene Gesellschaft von Amts wegen nach § 394 FamFG zu löschen. Die Frist zur Erhebung eines Widerspruchs gegen die beabsichtigte Löschung wird auf 3 Monate festgesetzt."
    },
    {
      "date": "2024-11-14",
      "id": "93462",
      "original_text": "Einreichung neuer Dokumente\nSachsen-Anhalt Amtsgericht Stendal HRB 204481\nHallesche Wohnungsgesellschaft mit beschränkter Haftung – Halle/Saale",
      "type": "Einreichung neuer Dokumente",
      "state": "Sachsen-Anhalt",
      "amtsgericht": "Amtsgericht Stendal",
      "registernummer": "HRB 204481",
      "registerart": "HRB",
      "company_name": "Hallesche Wohnungsgesellschaft mit beschränkter Haftung",
      "company_seat": "Halle/Saale",
      "details": "14.11.2024 (Bekanntmachungsdatum)\n\nSachsen-Anhalt Amtsgericht Stendal HRB 204481\nEinreichung neuer Dokumente\n\nHallesche Wohnungsgesellschaft mit beschränkter Haftung\nGesellschaft mit beschränkter Haftung\nHalle/Saale\n\nEine Liste der Mitglieder des Aufsichtsrates wurde zum Handelsregister eingereicht."
    },
    {
      "date": "2024-11-14",
      "id": "93486",
      "original_text": "Löschungsankündigung\nHamburg Amtsgericht Hamburg HRB 143291\nHelia International GmbH – Hamburg",
      "type": "Löschungsankündigung",
      "state": "Hamburg",
      "amtsgericht": "Amtsgericht Hamburg",
      "registernummer": "HRB 143291",
      "registerart": "HRB",
      "company_name": "Helia International GmbH",
      "company_seat": "Hamburg",
      "details": "14.11.2024 (Bekanntmachungsdatum)\n\nHamburg Amtsgericht Hamburg HRB 143291\nLöschungsankündigung\n\nHelia International GmbH\nGesellschaft mit beschränkter Haftung\nHamburg\n\nDas Registergericht beabsichtigt, die im Handelsregister eingetragene Gesellschaft von Amts wegen nach § 394 FamFG zu löschen. Die Frist zur Erhebung eines Widerspruchs gegen die beabsichtigte Löschung wird auf 3 Monate festgesetzt."
    },
    {
      "date": "2024-11-14",
      "id": "93568",
      "original_text": "Registerbekanntmachung nach dem Umwandlungsgesetz\nNordrhein-Westfalen Amtsgericht Krefeld HRA 7457\nHelmut Lennartz Zaunbau e. K. – Nettetal",
      "type": "Registerbekanntmachung nach dem Umwandlungsgesetz",
      "state": "Nordrhein-Westfalen",
      "amtsgericht": "Amtsgericht Krefeld",
      "registernummer": "HRA 7457",
      "registerart": "HRA",
      "company_name": "Helmut Lennartz Zaunbau e. K.",
      "company_seat": "Nettetal",
      "details": "14.11.2024 (Bekanntmachungsdatum)\n\nNordrhein-Westfalen Amtsgericht Krefeld HRA 7457\nRegisterbekanntmachung nach dem Umwandlungsgesetz 14.11.2024 (Eintragungsdatum)\n\nHelmut Lennartz Zaunbau e. K.\nEinzelkaufmann / Einzelkauffrau\nNettetal\n\nDen Gläubigern der an der Ausgliederung beteiligten Rechtsträger ist, wenn sie binnen sechs Monaten nach dem Tag, an dem die Eintragung der Ausgliederung in das Register des Sitzes desjenigen Rechtsträgers, dessen Gläubiger sie sind, nach § 19 Absatz 3 UmwG als bekanntgemacht gilt, ihren Anspruch nach Grund und Höhe schriftlich anmelden, Sicherheit zu leisten, soweit sie nicht Befriedigung verlangen können. Dieses Recht steht den Gläubigern jedoch nur zu, wenn sie glaubhaft machen, dass durch die Ausgliederung die Erfüllung ihrer Forderung gefährdet wird."
    },
    {
      "date": "2024-11-14",
      "id": "93591",
      "original_text": "Sonstige Registerbekanntmachung\nNordrhein-Westfalen Amtsgericht Köln HRB 120564\nHui-Hui UG (haftungsbeschränkt) – Köln",
      "type": "Sonstige Registerbekanntmachung",
      "state": "Nordrhein-Westfalen",
      "amtsgericht": "Amtsgericht Köln",
      "registernummer": "HRB 120564",
      "registerart": "HRB",
      "company_name": "Hui-Hui UG (haftungsbeschränkt)",
      "company_seat": "Köln",
      "details": "14.11.2024 (Bekanntmachungsdatum)\n\nNordrhein-Westfalen Amtsgericht Köln HRB 120564\nSonstige Registerbekanntmachung\n\nHui-Hui UG (haftungsbeschränkt)\nGesellschaft mit beschränkter Haftung\nKöln\n\nDas Registergericht beabsichtigt die inländische Geschäftsanschrift von Amts wegen nach § 395 FamFG zu löschen. Die Frist zur Erhebung eines Widerspruchs ist auf 2 Wochen festgesetzt."
    },
    {
      "date": "2024-11-14",
      "id": "93472",
      "original_text": "Registerbekanntmachung nach dem Umwandlungsgesetz\nSachsen-Anhalt Amtsgericht Stendal HRB 113646\nHummel Transport GmbH – Magdeburg",
      "type": "Registerbekanntmachung nach dem Umwandlungsgesetz",
      "state": "Sachsen-Anhalt",
      "amtsgericht": "Amtsgericht Stendal",
      "registernummer": "HRB 113646",
      "registerart": "HRB",
      "company_name": "Hummel Transport GmbH",
      "company_seat": "Magdeburg",
      "details": "14.11.2024 (Bekanntmachungsdatum)\n\nSachsen-Anhalt Amtsgericht Stendal HRB 113646\nRegisterbekanntmachung nach dem Umwandlungsgesetz 14.11.2024 (Eintragungsdatum)\n\nHummel Transport GmbH\nGesellschaft mit beschränkter Haftung\nMagdeburg\n\nNicht eingetragen:\nDen Gläubigern der an der Verschmelzung beteiligten Rechtsträger ist, wenn sie binnen sechs Monaten nach dem Tag, an dem die Eintragung der Verschmelzung nach § 19 Abs. 3 UmwG als bekanntgemacht gilt, ihren Anspruch nach Grund und Höhe schriftlich anmelden, Sicherheit zu leisten, soweit sie nicht Befriedigung verlangen können. Dieses Recht steht ihnen jedoch nur zu, wenn sie glaubhaft machen, dass durch die Verschmelzung die Erfüllung ihrer Forderung gefährdet wird."
    },
    {
      "date": "2024-11-14",
      "id": "93432",
      "original_text": "Registerbekanntmachung nach dem Umwandlungsgesetz\nBayern Amtsgericht Fürth HRB 19520\nHyperCuff GmbH – Erlangen",
      "type": "Registerbekanntmachung nach dem Umwandlungsgesetz",
      "state": "Bayern",
      "amtsgericht": "Amtsgericht Fürth",
      "registernummer": "HRB 19520",
      "registerart": "HRB",
      "company_name": "HyperCuff GmbH",
      "company_seat": "Erlangen",
      "details": "14.11.2024 (Bekanntmachungsdatum)\n\nBayern Amtsgericht Fürth HRB 19520\nRegisterbekanntmachung nach dem Umwandlungsgesetz 13.11.2024 (Eintragungsdatum)\n\nHyperCuff GmbH\nGesellschaft mit beschränkter Haftung\nErlangen\n\nDen Gläubigern der an der Verschmelzung beteiligten Rechtsträger ist, wenn sie binnen sechs Monaten nach dem Tag, an dem die Eintragung der Verschmelzung in das Register des Sitzes desjenigen Rechtsträgers, dessen Gläubiger sie sind, nach § 19 Abs. 3 UmwG als bekannt gemacht gilt, ihren Anspruch nach Grund und Höhe schriftlich anmelden, Sicherheit zu leisten, soweit sie nicht Befriedigung verlangen können. Dieses Recht steht den Gläubigern jedoch nur zu, wenn sie glaubhaft machen, dass durch die Verschmelzung die Erfüllung ihrer Forderung gefährdet wird."
    },
    {
      "date": "2024-11-14",
      "id": "93581",
      "original_text": "Einreichung neuer Dokumente\nNordrhein-Westfalen Amtsgericht Dortmund HRB 34470\nIMAG Immobilienmakler AG – Dortmund",
      "type": "Einreichung neuer Dokumente",
      "state": "Nordrhein-Westfalen",
      "amtsgericht": "Amtsgericht Dortmund",
      "registernummer": "HRB 34470",
      "registerart": "HRB",
      "company_name": "IMAG Immobilienmakler AG",
      "company_seat": "Dortmund",
      "details": "14.11.2024 (Bekanntmachungsdatum)\n\nNordrhein-Westfalen Amtsgericht Dortmund HRB 34470\nEinreichung neuer Dokumente\n\nIMAG Immobilienmakler AG\nAktiengesellschaft\nDortmund\n\nDem Registergericht ist eine neue Liste der Mitglieder des Aufsichtsrates eingereicht worden."
    },
    {
      "date": "2024-11-14",
      "id": "93515",
      "original_text": "Löschungsankündigung\nSachsen-Anhalt Amtsgericht Stendal HRB 18630\nIMT Recycling und Dialyse GmbH – Zerbst/Anhalt",
      "type": "Löschungsankündigung",
      "state": "Sachsen-Anhalt",
      "amtsgericht": "Amtsgericht Stendal",
      "registernummer": "HRB 18630",
      "registerart": "HRB",
      "company_name": "IMT Recycling und Dialyse GmbH",
      "company_seat": "Zerbst/Anhalt",
      "details": "14.11.2024 (Bekanntmachungsdatum)\n\nSachsen-Anhalt Amtsgericht Stendal HRB 18630\nLöschungsankündigung\n\nIMT Recycling und Dialyse GmbH\nGesellschaft mit beschränkter Haftung\nZerbst/Anhalt\n\nDas Registergericht beabsichtigt, nachfolgende Gesellschaften wegen Vermögenslosigkeit von Amts wegen nach § 394 FamFG zu löschen. Die Frist zur Erhebung eines Widerspruchs gegen die beabsichtigte Löschung wird auf drei Monate festgesetzt."
    },
    {
      "date": "2024-11-14",
      "id": "93438",
      "original_text": "Registerbekanntmachung nach dem Umwandlungsgesetz\nBayern Amtsgericht Fürth HRB 8571\nINNO Unternehmens-Infrastruktur-Planung GmbH – Erlangen",
      "type": "Registerbekanntmachung nach dem Umwandlungsgesetz",
      "state": "Bayern",
      "amtsgericht": "Amtsgericht Fürth",
      "registernummer": "HRB 8571",
      "registerart": "HRB",
      "company_name": "INNO Unternehmens-Infrastruktur-Planung GmbH",
      "company_seat": "Erlangen",
      "details": "14.11.2024 (Bekanntmachungsdatum)\n\nBayern Amtsgericht Fürth HRB 8571\nRegisterbekanntmachung nach dem Umwandlungsgesetz 13.11.2024 (Eintragungsdatum)\n\nINNO Unternehmens-Infrastruktur-Planung GmbH\nGesellschaft mit beschränkter Haftung\nErlangen\n\nDen Gläubigern der an der Verschmelzung beteiligten Rechtsträger ist, wenn sie binnen sechs Monaten nach dem Tag, an dem die Eintragung der Verschmelzung in das Register des Sitzes desjenigen Rechtsträgers, dessen Gläubiger sie sind, nach § 19 Abs. 3 UmwG als bekannt gemacht gilt, ihren Anspruch nach Grund und Höhe schriftlich anmelden, Sicherheit zu leisten, soweit sie nicht Befriedigung verlangen können. Dieses Recht steht den Gläubigern jedoch nur zu, wenn sie glaubhaft machen, dass durch die Verschmelzung die Erfüllung ihrer Forderung gefährdet wird."
    },
    {
      "date": "2024-11-14",
      "id": "93426",
      "original_text": "Registerbekanntmachung nach dem Umwandlungsgesetz\nBayern Amtsgericht München HRB 254091\nIgoSolid GmbH – München",
      "type": "Registerbekanntmachung nach dem Umwandlungsgesetz",
      "state": "Bayern",
      "amtsgericht": "Amtsgericht München",
      "registernummer": "HRB 254091",
      "registerart": "HRB",
      "company_name": "IgoSolid GmbH",
      "company_seat": "München",
      "details": "14.11.2024 (Bekanntmachungsdatum)\n\nBayern Amtsgericht München HRB 254091\nRegisterbekanntmachung nach dem Umwandlungsgesetz 13.11.2024 (Eintragungsdatum)\n\nIgoSolid GmbH\nGesellschaft mit beschränkter Haftung\nMünchen\n\nDen Gläubigern des formwechselnden Rechtsträgers ist, wenn sie binnen sechs Monaten nach dem Tag, an dem die Eintragung des Formwechsels nach § 201 UmwG als bekannt gemacht gilt, ihren Anspruch nach Grund und Höhe schriftlich anmelden, Sicherheit zu leisten, soweit sie nicht Befriedigung verlangen können. Dieses Recht steht den Gläubigern jedoch nur zu, wenn sie glaubhaft machen, dass durch den Formwechsel die Erfüllung ihrer Forderung gefährdet wird."
    },
    {
      "date": "2024-11-14",
      "id": "93553",
      "original_text": "Registerbekanntmachung nach dem Umwandlungsgesetz\nRheinland-Pfalz Amtsgericht Montabaur HRA 4191\nJächel Kälte Klima Getränketechnik GmbH & Co.KG – Ruppach-Goldhausen",
      "type": "Registerbekanntmachung nach dem Umwandlungsgesetz",
      "state": "Rheinland-Pfalz",
      "amtsgericht": "Amtsgericht Montabaur",
      "registernummer": "HRA 4191",
      "registerart": "HRA",
      "company_name": "Jächel Kälte Klima Getränketechnik GmbH & Co.KG",
      "company_seat": "Ruppach-Goldhausen",
      "details": "14.11.2024 (Bekanntmachungsdatum)\n\nRheinland-Pfalz Amtsgericht Montabaur HRA 4191\nRegisterbekanntmachung nach dem Umwandlungsgesetz 14.11.2024 (Eintragungsdatum)\n\nJächel Kälte Klima Getränketechnik GmbH & Co.KG\nKommanditgesellschaft\nRuppach-Goldhausen\n\nAls nicht eingetragen wird veröffentlicht:\nDen Gläubigern des formwechselnden Rechtsträgers ist, wenn sie binnen sechs Monaten nach dem Tag, an dem die Eintragung des Formwechsels nach § 201 UmwG als bekannt gemacht gilt, ihren Anspruch nach Grund und Höhe schriftlich anmelden, Sicherheit zu leisten, soweit sie nicht Befriedigung verlangen können. Dieses Recht steht den Gläubigern jedoch nur zu, wenn sie glaubhaft machen, dass durch den Formwechsel die Erfüllung der Forderung gefährdet wird."
    },
    {
      "date": "2024-11-14",
      "id": "93546",
      "original_text": "Registerbekanntmachung nach dem Umwandlungsgesetz\nNiedersachsen Amtsgericht Osnabrück HRB 205065\nK. L. Kaschier- und Laminier GmbH – Bad Bentheim",
      "type": "Registerbekanntmachung nach dem Umwandlungsgesetz",
      "state": "Niedersachsen",
      "amtsgericht": "Amtsgericht Osnabrück",
      "registernummer": "HRB 205065",
      "registerart": "HRB",
      "company_name": "K. L. Kaschier- und Laminier GmbH",
      "company_seat": "Bad Bentheim",
      "details": "14.11.2024 (Bekanntmachungsdatum)\n\nNiedersachsen Amtsgericht Osnabrück HRB 205065\nRegisterbekanntmachung nach dem Umwandlungsgesetz 14.11.2024 (Eintragungsdatum)\n\nK. L. Kaschier- und Laminier GmbH\nGesellschaft mit beschränkter Haftung\nBad Bentheim\n\nDen Gläubigern der an der Verschmelzung beteiligten Rechtsträger ist, wenn sie binnen sechs Monaten nach dem Tag, an dem die Eintragung der Verschmelzung in das Register des Sitzes desjenigen Rechtsträgers, dessen Gläubiger sie sind, nach § 19  Abs.  3 UmwG als bekannt gemacht gilt, ihren Anspruch nach Grund und Höhe schriftlich anmelden, Sicherheit zu leisten, soweit sie nicht Befriedigung verlangen können. Dieses Recht steht den Gläubigern jedoch nur zu, wenn sie glaubhaft machen, dass durch die Verschmelzung die Erfüllung der Forderung gefährdet wird."
    },
    {
      "date": "2024-11-14",
      "id": "93520",
      "original_text": "Registerbekanntmachung nach dem Umwandlungsgesetz\nNordrhein-Westfalen Amtsgericht Coesfeld HRB 18467\nKARACHEM GmbH – Olfen",
      "type": "Registerbekanntmachung nach dem Umwandlungsgesetz",
      "state": "Nordrhein-Westfalen",
      "amtsgericht": "Amtsgericht Coesfeld",
      "registernummer": "HRB 18467",
      "registerart": "HRB",
      "company_name": "KARACHEM GmbH",
      "company_seat": "Olfen",
      "details": "14.11.2024 (Bekanntmachungsdatum)\n\nNordrhein-Westfalen Amtsgericht Coesfeld HRB 18467\nRegisterbekanntmachung nach dem Umwandlungsgesetz 14.11.2024 (Eintragungsdatum)\n\nKARACHEM GmbH\nGesellschaft mit beschränkter Haftung\nOlfen\n\nDen Gläubigern der an der Abspaltung beteiligten Rechtsträger ist, wenn sie binnen sechs Monaten nach dem Tag, an dem die Eintragung der Abspaltung in das Register des Sitzes derjenigen Rechtsträger deren Gläubiger sie sind, nach § 19 Absatz 3 UmwG als bekanntgemacht gilt, ihren Anspruch nach Grund und Höhe schriftlich anmelden, Sicherheit zu leisten, soweit sie nicht Befriedigung verlangen können. Dieses Recht steht den Gläubigern jedoch nur zu, wenn sie glaubhaft machen, dass durch die Abspaltung die Erfüllung ihrer Forderung gefährdet wird."
    },
    {
      "date": "2024-11-14",
      "id": "93469",
      "original_text": "Registerbekanntmachung nach dem Umwandlungsgesetz\nSchleswig-Holstein Amtsgericht Lübeck HRB 25527\nKEEPSEVEN GmbH – Lübeck",
      "type": "Registerbekanntmachung nach dem Umwandlungsgesetz",
      "state": "Schleswig-Holstein",
      "amtsgericht": "Amtsgericht Lübeck",
      "registernummer": "HRB 25527",
      "registerart": "HRB",
      "company_name": "KEEPSEVEN GmbH",
      "company_seat": "Lübeck",
      "details": "14.11.2024 (Bekanntmachungsdatum)\n\nSchleswig-Holstein Amtsgericht Lübeck HRB 25527\nRegisterbekanntmachung nach dem Umwandlungsgesetz 13.11.2024 (Eintragungsdatum)\n\nKEEPSEVEN GmbH\nGesellschaft mit beschränkter Haftung\nLübeck\n\nZu Eintragungsnummer 1 vom 13.11.2024 wird als nicht eingetragen veröffentlicht:  Als nicht eingetragen wird veröffentlicht: Den Gläubigern ist, wenn sie binnen sechs Monaten nach dem Tag, an dem die Eintragung der Umwandlung als bekannt gemacht gilt, ihren Anspruch nach Grund und Höhe schriftlich anmelden, Sicherheit zu leisten, soweit sie nicht Befriedigung verlangen können. Dieses Recht steht den Gläubigern jedoch nur zu, wenn sie glaubhaft machen, dass durch die Umwandlung die Erfüllung ihrer Forderung gefährdet wird."
    },
    {
      "date": "2024-11-14",
      "id": "93465",
      "original_text": "Registerbekanntmachung nach dem Umwandlungsgesetz\nSchleswig-Holstein Amtsgericht Lübeck HRA 11108\nKEEPSEVEN oHG – Lübeck",
      "type": "Registerbekanntmachung nach dem Umwandlungsgesetz",
      "state": "Schleswig-Holstein",
      "amtsgericht": "Amtsgericht Lübeck",
      "registernummer": "HRA 11108",
      "registerart": "HRA",
      "company_name": "KEEPSEVEN oHG",
      "company_seat": "Lübeck",
      "details": "14.11.2024 (Bekanntmachungsdatum)\n\nSchleswig-Holstein Amtsgericht Lübeck HRA 11108\nRegisterbekanntmachung nach dem Umwandlungsgesetz 13.11.2024 (Eintragungsdatum)\n\nKEEPSEVEN oHG\nOffene Handelsgesellschaft\nLübeck\n\nZu Eintragungsnummer 3 vom 13.11.2024 wird als nicht eingetragen veröffentlicht:  Als nicht eingetragen wird veröffentlicht: Den Gläubigern ist, wenn sie binnen sechs Monaten nach dem Tag, an dem die Eintragung der Umwandlung als bekannt gemacht gilt, ihren Anspruch nach Grund und Höhe schriftlich anmelden, Sicherheit zu leisten, soweit sie nicht Befriedigung verlangen können. Dieses Recht steht den Gläubigern jedoch nur zu, wenn sie glaubhaft machen, dass durch die Umwandlung die Erfüllung ihrer Forderung gefährdet wird."
    },
    {
      "date": "2024-11-14",
      "id": "93523",
      "original_text": "Registerbekanntmachung nach dem Umwandlungsgesetz\nNordrhein-Westfalen Amtsgericht Coesfeld HRB 15113\nKaraloon GmbH – Olfen",
      "type": "Registerbekanntmachung nach dem Umwandlungsgesetz",
      "state": "Nordrhein-Westfalen",
      "amtsgericht": "Amtsgericht Coesfeld",
      "registernummer": "HRB 15113",
      "registerart": "HRB",
      "company_name": "Karaloon GmbH",
      "company_seat": "Olfen",
      "details": "14.11.2024 (Bekanntmachungsdatum)\n\nNordrhein-Westfalen Amtsgericht Coesfeld HRB 15113\nRegisterbekanntmachung nach dem Umwandlungsgesetz 14.11.2024 (Eintragungsdatum)\n\nKaraloon GmbH\nGesellschaft mit beschränkter Haftung\nOlfen\n\nDen Gläubigern der an der Abspaltung beteiligten Rechtsträger ist, wenn sie binnen sechs Monaten nach dem Tag, an dem die Eintragung der Abspaltung in das Register des Sitzes derjenigen Rechtsträger deren Gläubiger sie sind, nach § 19 Absatz 3 UmwG als bekanntgemacht gilt, ihren Anspruch nach Grund und Höhe schriftlich anmelden, Sicherheit zu leisten, soweit sie nicht Befriedigung verlangen können. Dieses Recht steht den Gläubigern jedoch nur zu, wenn sie glaubhaft machen, dass durch die Abspaltung die Erfüllung ihrer Forderung gefährdet wird."
    },
    {
      "date": "2024-11-14",
      "id": "93454",
      "original_text": "Einreichung neuer Dokumente\nBaden-Württemberg Amtsgericht Mannheim HRB 105780\nKarlsruher Fächer GmbH – Karlsruhe",
      "type": "Einreichung neuer Dokumente",
      "state": "Baden-Württemberg",
      "amtsgericht": "Amtsgericht Mannheim",
      "registernummer": "HRB 105780",
      "registerart": "HRB",
      "company_name": "Karlsruher Fächer GmbH",
      "company_seat": "Karlsruhe",
      "details": "14.11.2024 (Bekanntmachungsdatum)\n\nBaden-Württemberg Amtsgericht Mannheim HRB 105780\nEinreichung neuer Dokumente\n\nKarlsruher Fächer GmbH\nGesellschaft mit beschränkter Haftung\nKarlsruhe\n\nDie Gesellschaft hat am 12.11.2024 die Liste über die Zusammensetzung des Aufsichtsrats zum Handelsregister eingereicht."
    },
    {
      "date": "2024-11-14",
      "id": "93547",
      "original_text": "Registerbekanntmachung nach dem Umwandlungsgesetz\nNiedersachsen Amtsgericht Hildesheim VR 836\nKatholische Erwachsenenbildung in der Diözese Hildesheim e.V. – Hildesheim",
      "type": "Registerbekanntmachung nach dem Umwandlungsgesetz",
      "state": "Niedersachsen",
      "amtsgericht": "Amtsgericht Hildesheim",
      "registernummer": "VR 836",
      "registerart": "VR",
      "company_name": "Katholische Erwachsenenbildung in der Diözese Hildesheim e.V.",
      "company_seat": "Hildesheim",
      "details": "14.11.2024 (Bekanntmachungsdatum)\n\nNiedersachsen Amtsgericht Hildesheim VR 836\nRegisterbekanntmachung nach dem Umwandlungsgesetz 14.11.2024 (Eintragungsdatum)\n\nKatholische Erwachsenenbildung in der Diözese Hildesheim e.V.\neingetragener Verein\nHildesheim\n\nDen Gläubigern der an der Verschmelzung beteiligten Rechtsträger ist, wenn sie binnen sechs Monaten nach dem Tag, an dem die Eintragung der Verschmelzung in das Register des Sitzes desjenigen Rechtsträgers, dessen Gläubiger sie sind, nach § 19  Abs.  3 UmwG als bekannt gemacht gilt, ihren Anspruch nach Grund und Höhe schriftlich anmelden, Sicherheit zu leisten, soweit sie nicht Befriedigung verlangen können. Dieses Recht steht den Gläubigern jedoch nur zu, wenn sie glaubhaft machen, dass durch die Verschmelzung die Erfüllung der Forderung gefährdet wird."
    },
    {
      "date": "2024-11-14",
      "id": "93500",
      "original_text": "Registerbekanntmachung nach dem Umwandlungsgesetz\nSaarland Amtsgericht Saarbrücken HRB 63218\nKleemann GmbH – Merzig",
      "type": "Registerbekanntmachung nach dem Umwandlungsgesetz",
      "state": "Saarland",
      "amtsgericht": "Amtsgericht Saarbrücken",
      "registernummer": "HRB 63218",
      "registerart": "HRB",
      "company_name": "Kleemann GmbH",
      "company_seat": "Merzig",
      "details": "14.11.2024 (Bekanntmachungsdatum)\n\nSaarland Amtsgericht Saarbrücken HRB 63218\nRegisterbekanntmachung nach dem Umwandlungsgesetz 14.11.2024 (Eintragungsdatum)\n\nKleemann GmbH\nGesellschaft mit beschränkter Haftung\nMerzig\n\nAls nicht eingetragen wird bekannt gemacht: Den Gläubigern der an der Verschmelzung beteiligten Gesellschaften ist, wenn sie binnen sechs Monaten nach dem Tag, an dem die Eintragung der Verschmelzung in das Register des Sitzes derjenigen Rechtsträger deren Gläubiger sie sind, nach § 19 Absatz 3 UmwG bekannt gemacht worden ist, ihren Anspruch nach Grund und Höhe schriftlich anmelden, Sicherheit zu leisten, soweit sie nicht Befriedigung verlangen können. Dieses Recht steht den Gläubigern jedoch nur zu, wenn sie glaubhaft machen, dass durch die Verschmelzung die Erfüllung ihrer Forderung gefährdet wird."
    },
    {
      "date": "2024-11-14",
      "id": "93501",
      "original_text": "Registerbekanntmachung nach dem Umwandlungsgesetz\nSaarland Amtsgericht Saarbrücken HRB 17703\nKleemann Logistik GmbH – Merzig",
      "type": "Registerbekanntmachung nach dem Umwandlungsgesetz",
      "state": "Saarland",
      "amtsgericht": "Amtsgericht Saarbrücken",
      "registernummer": "HRB 17703",
      "registerart": "HRB",
      "company_name": "Kleemann Logistik GmbH",
      "company_seat": "Merzig",
      "details": "14.11.2024 (Bekanntmachungsdatum)\n\nSaarland Amtsgericht Saarbrücken HRB 17703\nRegisterbekanntmachung nach dem Umwandlungsgesetz 14.11.2024 (Eintragungsdatum)\n\nKleemann Logistik GmbH\nGesellschaft mit beschränkter Haftung\nMerzig\n\nAls nicht eingetragen wird bekannt gemacht: Den Gläubigern der an der Verschmelzung beteiligten Gesellschaften ist, wenn sie binnen sechs Monaten nach dem Tag, an dem die Eintragung der Verschmelzung in das Register des Sitzes derjenigen Rechtsträger deren Gläubiger sie sind, nach § 19 Absatz 3 UmwG bekannt gemacht worden ist, ihren Anspruch nach Grund und Höhe schriftlich anmelden, Sicherheit zu leisten, soweit sie nicht Befriedigung verlangen können. Dieses Recht steht den Gläubigern jedoch nur zu, wenn sie glaubhaft machen, dass durch die Verschmelzung die Erfüllung ihrer Forderung gefährdet wird."
    },
    {
      "date": "2024-11-14",
      "id": "93538",
      "original_text": "Löschungsankündigung\nSachsen Amtsgericht Leipzig VR 8051\nKulturGut Kahnsdorf e.V. – Neukieritzsch",
      "type": "Löschungsankündigung",
      "state": "Sachsen",
      "amtsgericht": "Amtsgericht Leipzig",
      "registernummer": "VR 8051",
      "registerart": "VR",
      "company_name": "KulturGut Kahnsdorf e.V.",
      "company_seat": "Neukieritzsch",
      "details": "14.11.2024 (Bekanntmachungsdatum)\n\nSachsen Amtsgericht Leipzig VR 8051\nLöschungsankündigung\n\nKulturGut Kahnsdorf e.V.\neingetragener Verein\nNeukieritzsch\n\nDas Gericht beabsichtigt, gemäß § 4 Absatz 2 Ziffer 1 der Verordnung über das Vereinsregister das Registerblatt  des Vereins zu schließen, da nach Mitteilung  eines Beteiligten vom 13.08.2024 sämtliche Mitglieder aus dem Verein ausgeschieden sind. Zur Geltendmachung eines Widerspruchs gegen die beabsichtigte Schließung wird eine Frist von einem Monat nach der Veröffentlichung bestimmt."
    },
    {
      "date": "2024-11-14",
      "id": "93507",
      "original_text": "Löschungsankündigung\nHamburg Amtsgericht Hamburg HRA 106813\nKönig & Cie. Erste Schiffahrts GmbH & Co. KG – Hamburg",
      "type": "Löschungsankündigung",
      "state": "Hamburg",
      "amtsgericht": "Amtsgericht Hamburg",
      "registernummer": "HRA 106813",
      "registerart": "HRA",
      "company_name": "König & Cie. Erste Schiffahrts GmbH & Co. KG",
      "company_seat": "Hamburg",
      "details": "14.11.2024 (Bekanntmachungsdatum)\n\nHamburg Amtsgericht Hamburg HRA 106813\nLöschungsankündigung\n\nKönig & Cie. Erste Schiffahrts GmbH & Co. KG\nKommanditgesellschaft\nHamburg\n\nDas Registergericht beabsichtigt, die im Handelsregister eingetragene Gesellschaft von Amts wegen nach § 394 FamFG zu löschen. Die Frist zur Erhebung eines Widerspruchs gegen die beabsichtigte Löschung wird auf 3 Monate festgesetzt."
    },
    {
      "date": "2024-11-14",
      "id": "93428",
      "original_text": "Registerbekanntmachung nach dem Umwandlungsgesetz\nBayern Amtsgericht München HRB 277146\nLAYA Group Holding GmbH – München",
      "type": "Registerbekanntmachung nach dem Umwandlungsgesetz",
      "state": "Bayern",
      "amtsgericht": "Amtsgericht München",
      "registernummer": "HRB 277146",
      "registerart": "HRB",
      "company_name": "LAYA Group Holding GmbH",
      "company_seat": "München",
      "details": "14.11.2024 (Bekanntmachungsdatum)\n\nBayern Amtsgericht München HRB 277146\nRegisterbekanntmachung nach dem Umwandlungsgesetz 13.11.2024 (Eintragungsdatum)\n\nLAYA Group Holding GmbH\nGesellschaft mit beschränkter Haftung\nMünchen\n\nDen Gläubigern der an der Verschmelzung beteiligten Rechtsträger ist, wenn sie binnen sechs Monaten nach dem Tag, an dem die Eintragung der Verschmelzung in das Register des Sitzes desjenigen Rechtsträgers, dessen Gläubiger sie sind, nach § 19 Abs. 3 UmwG als bekannt gemacht gilt, ihren Anspruch nach Grund und Höhe schriftlich anmelden, Sicherheit zu leisten, soweit sie nicht Befriedigung verlangen können. Dieses Recht steht den Gläubigern jedoch nur zu, wenn sie glaubhaft machen, dass durch die Verschmelzung die Erfüllung ihrer Forderung gefährdet wird."
    },
    {
      "date": "2024-11-14",
      "id": "93448",
      "original_text": "Registerbekanntmachung nach dem Umwandlungsgesetz\nBayern Amtsgericht München HRB 277146\nLAYA Group Holding GmbH – München",
      "type": "Registerbekanntmachung nach dem Umwandlungsgesetz",
      "state": "Bayern",
      "amtsgericht": "Amtsgericht München",
      "registernummer": "HRB 277146",
      "registerart": "HRB",
      "company_name": "LAYA Group Holding GmbH",
      "company_seat": "München",
      "details": "14.11.2024 (Bekanntmachungsdatum)\n\nBayern Amtsgericht München HRB 277146\nRegisterbekanntmachung nach dem Umwandlungsgesetz 13.11.2024 (Eintragungsdatum)\n\nLAYA Group Holding GmbH\nGesellschaft mit beschränkter Haftung\nMünchen\n\nDen Gläubigern der an der Verschmelzung beteiligten Rechtsträger ist, wenn sie binnen sechs Monaten nach dem Tag, an dem die Eintragung der Verschmelzung in das Register des Sitzes desjenigen Rechtsträgers, dessen Gläubiger sie sind, nach § 19 Abs. 3 UmwG als bekannt gemacht gilt, ihren Anspruch nach Grund und Höhe schriftlich anmelden, Sicherheit zu leisten, soweit sie nicht Befriedigung verlangen können. Dieses Recht steht den Gläubigern jedoch nur zu, wenn sie glaubhaft machen, dass durch die Verschmelzung die Erfüllung ihrer Forderung gefährdet wird."
    },
    {
      "date": "2024-11-14",
      "id": "93512",
      "original_text": "Sonstige Registerbekanntmachung\nBaden-Württemberg Amtsgericht Stuttgart HRA 741492\nLUISA CERANO GmbH & Co. KG – Nürtingen",
      "type": "Sonstige Registerbekanntmachung",
      "state": "Baden-Württemberg",
      "amtsgericht": "Amtsgericht Stuttgart",
      "registernummer": "HRA 741492",
      "registerart": "HRA",
      "company_name": "LUISA CERANO GmbH & Co. KG",
      "company_seat": "Nürtingen",
      "details": "14.11.2024 (Bekanntmachungsdatum)\n\nBaden-Württemberg Amtsgericht Stuttgart HRA 741492\nSonstige Registerbekanntmachung 14.11.2024 (Eintragungsdatum)\n\nLUISA CERANO GmbH & Co. KG\nKommanditgesellschaft\nNürtingen\n\nDen Gläubigern der Gesellschaft, deren Forderungen begründet worden sind, bevor die Eintragung der Beendigung des Vertrages in das Handelsregister nach § 10 HGB als bekanntgemacht gilt, ist vom anderen Vertragsteil Sicherheit zu leisten, wenn sie sich binnen sechs Monaten nach der Bekanntmachung zu diesem Zweck bei ihm melden."
    },
    {
      "date": "2024-11-14",
      "id": "93560",
      "original_text": "Einreichung neuer Dokumente\nNordrhein-Westfalen Amtsgericht Münster HRB 18330\nLWL-Sozialstiftung gemeinnützige GmbH – Münster",
      "type": "Einreichung neuer Dokumente",
      "state": "Nordrhein-Westfalen",
      "amtsgericht": "Amtsgericht Münster",
      "registernummer": "HRB 18330",
      "registerart": "HRB",
      "company_name": "LWL-Sozialstiftung gemeinnützige GmbH",
      "company_seat": "Münster",
      "details": "14.11.2024 (Bekanntmachungsdatum)\n\nNordrhein-Westfalen Amtsgericht Münster HRB 18330\nEinreichung neuer Dokumente\n\nLWL-Sozialstiftung gemeinnützige GmbH\nGesellschaft mit beschränkter Haftung\nMünster\n\nDem Registergericht ist eine neue Liste der Mitglieder des Aufsichtsrates eingereicht worden."
    },
    {
      "date": "2024-11-14",
      "id": "93427",
      "original_text": "Löschungsankündigung\nBayern Amtsgericht München HRB 261037\nLa Cure Gourmande München GmbH – München",
      "type": "Löschungsankündigung",
      "state": "Bayern",
      "amtsgericht": "Amtsgericht München",
      "registernummer": "HRB 261037",
      "registerart": "HRB",
      "company_name": "La Cure Gourmande München GmbH",
      "company_seat": "München",
      "details": "14.11.2024 (Bekanntmachungsdatum)\n\nBayern Amtsgericht München HRB 261037\nLöschungsankündigung 08.11.2024 (Eintragungsdatum)\n\nLa Cure Gourmande München GmbH\nGesellschaft mit beschränkter Haftung\nMünchen\n\nDas Registergericht beabsichtigt, die im Handelsregister eingetragene Gesellschaft wegen Vermögenslosigkeit von Amts wegen nach § 394 FamFG zu löschen. Die Frist zur Erhebung eines Widerspruchs ist auf drei Monate festgesetzt."
    },
    {
      "date": "2024-11-14",
      "id": "93600",
      "original_text": "Löschungsankündigung\nHessen Amtsgericht Fulda HRB 910\nLagerei und Logistik GmbH Olbrich & Partner – Fulda",
      "type": "Löschungsankündigung",
      "state": "Hessen",
      "amtsgericht": "Amtsgericht Fulda",
      "registernummer": "HRB 910",
      "registerart": "HRB",
      "company_name": "Lagerei und Logistik GmbH Olbrich & Partner",
      "company_seat": "Fulda",
      "details": "14.11.2024 (Bekanntmachungsdatum)\n\nHessen Amtsgericht Fulda HRB 910\nLöschungsankündigung\n\nLagerei und Logistik GmbH Olbrich & Partner\nGesellschaft mit beschränkter Haftung\nFulda\n\nDas Registergericht beabsichtigt die im Handelsregister eingetragene Gesellschaft von Amts wegen nach § 394 FamFG zu löschen. Die Frist zur Erhebung eines Widerspruchs gegen die beabsichtigte Löschung wird auf 3 Monate festgesetzt."
    },
    {
      "date": "2024-11-14",
      "id": "93431",
      "original_text": "Registerbekanntmachung nach dem Umwandlungsgesetz\nBayern Amtsgericht München HRB 295116\nLudwig Behrens GmbH – München",
      "type": "Registerbekanntmachung nach dem Umwandlungsgesetz",
      "state": "Bayern",
      "amtsgericht": "Amtsgericht München",
      "registernummer": "HRB 295116",
      "registerart": "HRB",
      "company_name": "Ludwig Behrens GmbH",
      "company_seat": "München",
      "details": "14.11.2024 (Bekanntmachungsdatum)\n\nBayern Amtsgericht München HRB 295116\nRegisterbekanntmachung nach dem Umwandlungsgesetz 13.11.2024 (Eintragungsdatum)\n\nLudwig Behrens GmbH\nGesellschaft mit beschränkter Haftung\nMünchen\n\nDen Gläubigern der an der Verschmelzung beteiligten Rechtsträger ist, wenn sie binnen sechs Monaten nach dem Tag, an dem die Eintragung der Verschmelzung in das Register des Sitzes desjenigen Rechtsträgers, dessen Gläubiger sie sind, nach § 19 Abs. 3 UmwG als bekannt gemacht gilt, ihren Anspruch nach Grund und Höhe schriftlich anmelden, Sicherheit zu leisten, soweit sie nicht Befriedigung verlangen können. Dieses Recht steht den Gläubigern jedoch nur zu, wenn sie glaubhaft machen, dass durch die Verschmelzung die Erfüllung ihrer Forderung gefährdet wird."
    },
    {
      "date": "2024-11-14",
      "id": "93606",
      "original_text": "Löschungsankündigung\nHessen Amtsgericht Frankfurt am Main HRB 117133\nMETRA CONSULTING GmbH – Frankfurt am Main",
      "type": "Löschungsankündigung",
      "state": "Hessen",
      "amtsgericht": "Amtsgericht Frankfurt am Main",
      "registernummer": "HRB 117133",
      "registerart": "HRB",
      "company_name": "METRA CONSULTING GmbH",
      "company_seat": "Frankfurt am Main",
      "details": "14.11.2024 (Bekanntmachungsdatum)\n\nHessen Amtsgericht Frankfurt am Main HRB 117133\nLöschungsankündigung\n\nMETRA CONSULTING GmbH\nGesellschaft mit beschränkter Haftung\nFrankfurt am Main\n\nEs ist beabsichtigt die Gesellschaft wegen Vermögenslosigkeit gemäß § 394 FamFG von Amts wegen zu löschen. Hiergegen kann innerhalb eines Monats nach dieser Veröffentlichung Widerspruch bei dem Amtsgericht Frankfurt am Main eingelegt werden."
    },
    {
      "date": "2024-11-14",
      "id": "93461",
      "original_text": "Registerbekanntmachung nach dem Umwandlungsgesetz\nBerlin Amtsgericht Berlin (Charlottenburg) HRB 269445\nMIBABS Schädlingsbekämpfung GmbH – Berlin",
      "type": "Registerbekanntmachung nach dem Umwandlungsgesetz",
      "state": "Berlin",
      "amtsgericht": "Amtsgericht Berlin (Charlottenburg)",
      "registernummer": "HRB 269445",
      "registerart": "HRB",
      "company_name": "MIBABS Schädlingsbekämpfung GmbH",
      "company_seat": "Berlin",
      "details": "14.11.2024 (Bekanntmachungsdatum)\n\nBerlin Amtsgericht Berlin (Charlottenburg) HRB 269445\nRegisterbekanntmachung nach dem Umwandlungsgesetz 13.11.2024 (Eintragungsdatum)\n\nMIBABS Schädlingsbekämpfung GmbH\nGesellschaft mit beschränkter Haftung\nBerlin\n\nZu Eintragungsnummer 1 vom 13.11.2024 wird als nicht eingetragen veröffentlich: Den Gläubigern der an der Spaltung beteiligten Rechtsträger ist, wenn sie binnen sechs Monaten nach dem Tag, an dem die Eintragung der Spaltung in das Register des Sitzes desjenigen Rechtsträgers, dessen Gläubiger sie sind, als bekannt gemacht gilt, ihren Anspruch nach Grund und Höhe schriftlich anmelden, Sicherheit zu leisten, soweit sie nicht Befriedigung verlangen können. Dieses Recht steht den Gläubigern jedoch nur zu, wenn sie glaubhaft machen, dass durch die Spaltung die Erfüllung ihrer Forderung gefährdet wird. Das Recht, Sicherheitsleistung zu verlangen, steht Gläubigern nicht zu, die im Falle der Insolvenz ein Recht auf vorzugsweise Befriedigung aus einer Deckungsmasse haben, die nach gesetzlicher Vorschrift zu ihrem Schutz errichtet und staatlich überwacht ist."
    },
    {
      "date": "2024-11-14",
      "id": "93466",
      "original_text": "Löschungsankündigung\nSchleswig-Holstein Amtsgericht Flensburg HRB 16227\nMSD project GmbH – Böklund",
      "type": "Löschungsankündigung",
      "state": "Schleswig-Holstein",
      "amtsgericht": "Amtsgericht Flensburg",
      "registernummer": "HRB 16227",
      "registerart": "HRB",
      "company_name": "MSD project GmbH",
      "company_seat": "Böklund",
      "details": "14.11.2024 (Bekanntmachungsdatum)\n\nSchleswig-Holstein Amtsgericht Flensburg HRB 16227\nLöschungsankündigung\n\nMSD project GmbH\nGesellschaft mit beschränkter Haftung\nBöklund\n\nEs ist die Löschung der nachstehenden Gesellschaft wegen Vermögenslosigkeit gemäß § 394 FamFG beabsichtigt.\nWiderspruchsfrist: 2 Monate"
    },
    {
      "date": "2024-11-14",
      "id": "93567",
      "original_text": "Einreichung neuer Dokumente\nNordrhein-Westfalen Amtsgericht Dortmund HRB 31760\nMVZ Knappschaft Kliniken Ost GmbH – Dortmund",
      "type": "Einreichung neuer Dokumente",
      "state": "Nordrhein-Westfalen",
      "amtsgericht": "Amtsgericht Dortmund",
      "registernummer": "HRB 31760",
      "registerart": "HRB",
      "company_name": "MVZ Knappschaft Kliniken Ost GmbH",
      "company_seat": "Dortmund",
      "details": "14.11.2024 (Bekanntmachungsdatum)\n\nNordrhein-Westfalen Amtsgericht Dortmund HRB 31760\nEinreichung neuer Dokumente\n\nMVZ Knappschaft Kliniken Ost GmbH\nGesellschaft mit beschränkter Haftung\nDortmund\n\nDem Registergericht ist eine neue Liste der Mitglieder des Aufsichtsrates eingereicht worden."
    },
    {
      "date": "2024-11-14",
      "id": "93458",
      "original_text": "Löschungsankündigung\nSchleswig-Holstein Amtsgericht Flensburg HRB 14039\nMa Ra 24 h Fachpflegedienst UG (haftungsbeschränkt) – Schleswig",
      "type": "Löschungsankündigung",
      "state": "Schleswig-Holstein",
      "amtsgericht": "Amtsgericht Flensburg",
      "registernummer": "HRB 14039",
      "registerart": "HRB",
      "company_name": "Ma Ra 24 h Fachpflegedienst UG (haftungsbeschränkt)",
      "company_seat": "Schleswig",
      "details": "14.11.2024 (Bekanntmachungsdatum)\n\nSchleswig-Holstein Amtsgericht Flensburg HRB 14039\nLöschungsankündigung\n\nMa Ra 24 h Fachpflegedienst UG (haftungsbeschränkt)\nGesellschaft mit beschränkter Haftung\nSchleswig\n\nEs ist die Löschung der nachstehenden Gesellschaft wegen Vermögenslosigkeit gemäß § 394 FamFG beabsichtigt.\nWiderspruchsfrist: 2 Monate"
    },
    {
      "date": "2024-11-14",
      "id": "93602",
      "original_text": "Registerbekanntmachung nach dem Umwandlungsgesetz\nHessen Amtsgericht Wiesbaden HRB 35364\nMesa Germany GmbH – Waldems",
      "type": "Registerbekanntmachung nach dem Umwandlungsgesetz",
      "state": "Hessen",
      "amtsgericht": "Amtsgericht Wiesbaden",
      "registernummer": "HRB 35364",
      "registerart": "HRB",
      "company_name": "Mesa Germany GmbH",
      "company_seat": "Waldems",
      "details": "14.11.2024 (Bekanntmachungsdatum)\n\nHessen Amtsgericht Wiesbaden HRB 35364\nRegisterbekanntmachung nach dem Umwandlungsgesetz 14.11.2024 (Eintragungsdatum)\n\nMesa Germany GmbH\nGesellschaft mit beschränkter Haftung\nWaldems\n\nDen Gläubigern der an der Verschmelzung beteiligten Rechtsträger ist, wenn sie binnen sechs Monaten nach dem Tag, an dem die Eintragung der Verschmelzung in das Register des Sitzes desjenigen Rechtsträgers, dessen Gläubiger sie sind, nach § 19 Absatz 3 UmwG bekannt gemacht worden ist, ihren Anspruch nach Grund und Höhe schriftlich anmelden, Sicherheit zu leisten, soweit sie nicht Befriedigung verlangen können. Dieses Recht steht den Gläubigern jedoch nur zu, wenn sie glaubhaft machen, dass durch die Verschmelzung die Erfüllung ihrer Forderung gefährdet wird."
    },
    {
      "date": "2024-11-14",
      "id": "93603",
      "original_text": "Registerbekanntmachung nach dem Umwandlungsgesetz\nHessen Amtsgericht Wiesbaden HRB 35364\nMesa Germany GmbH – Waldems",
      "type": "Registerbekanntmachung nach dem Umwandlungsgesetz",
      "state": "Hessen",
      "amtsgericht": "Amtsgericht Wiesbaden",
      "registernummer": "HRB 35364",
      "registerart": "HRB",
      "company_name": "Mesa Germany GmbH",
      "company_seat": "Waldems",
      "details": "14.11.2024 (Bekanntmachungsdatum)\n\nHessen Amtsgericht Wiesbaden HRB 35364\nRegisterbekanntmachung nach dem Umwandlungsgesetz 14.11.2024 (Eintragungsdatum)\n\nMesa Germany GmbH\nGesellschaft mit beschränkter Haftung\nWaldems\n\nDen Gläubigern der an der Verschmelzung beteiligten Rechtsträger ist, wenn sie binnen sechs Monaten nach dem Tag, an dem die Eintragung der Verschmelzung in das Register des Sitzes desjenigen Rechtsträgers, dessen Gläubiger sie sind, nach § 19 Absatz 3 UmwG bekannt gemacht worden ist, ihren Anspruch nach Grund und Höhe schriftlich anmelden, Sicherheit zu leisten, soweit sie nicht Befriedigung verlangen können. Dieses Recht steht den Gläubigern jedoch nur zu, wenn sie glaubhaft machen, dass durch die Verschmelzung die Erfüllung ihrer Forderung gefährdet wird."
    },
    {
      "date": "2024-11-14",
      "id": "93541",
      "original_text": "Registerbekanntmachung nach dem Umwandlungsgesetz\nNiedersachsen Amtsgericht Oldenburg (Oldenburg) HRA 208533\nMichael Bode Metall e.K. – Edewecht",
      "type": "Registerbekanntmachung nach dem Umwandlungsgesetz",
      "state": "Niedersachsen",
      "amtsgericht": "Amtsgericht Oldenburg (Oldenburg)",
      "registernummer": "HRA 208533",
      "registerart": "HRA",
      "company_name": "Michael Bode Metall e.K.",
      "company_seat": "Edewecht",
      "details": "14.11.2024 (Bekanntmachungsdatum)\n\nNiedersachsen Amtsgericht Oldenburg (Oldenburg) HRA 208533\nRegisterbekanntmachung nach dem Umwandlungsgesetz 14.11.2024 (Eintragungsdatum)\n\nMichael Bode Metall e.K.\nEinzelkaufmann / Einzelkauffrau\nEdewecht\n\nDen Gläubigern der an der Ausgliederung beteiligten Rechtsträger ist, wenn sie binnen sechs Monaten nach dem Tag, an dem die Eintragung der Ausgliederung in das Register des Sitzes desjenigen Rechtsträgers, dessen Gläubiger sie sind, nach § 19 Abs. 3 UmwG als bekannt gemacht gilt, ihren Anspruch nach Grund und Höhe schriftlich anmelden, Sicherheit zu leisten, soweit sie nicht Befriedigung verlangen können. Dieses Recht steht den Gläubigern jedoch nur zu, wenn sie glaubhaft machen, dass durch die Ausgliederung die Erfüllung der Forderung gefährdet wird."
    },
    {
      "date": "2024-11-14",
      "id": "93457",
      "original_text": "Einreichung neuer Dokumente\nSachsen-Anhalt Amtsgericht Stendal HRB 104283\nMittelständische Beteiligungsgesellschaft Sachsen-Anhalt (MBG) mbH – Magdeburg",
      "type": "Einreichung neuer Dokumente",
      "state": "Sachsen-Anhalt",
      "amtsgericht": "Amtsgericht Stendal",
      "registernummer": "HRB 104283",
      "registerart": "HRB",
      "company_name": "Mittelständische Beteiligungsgesellschaft Sachsen-Anhalt (MBG) mbH",
      "company_seat": "Magdeburg",
      "details": "14.11.2024 (Bekanntmachungsdatum)\n\nSachsen-Anhalt Amtsgericht Stendal HRB 104283\nEinreichung neuer Dokumente\n\nMittelständische Beteiligungsgesellschaft Sachsen-Anhalt (MBG) mbH\nGesellschaft mit beschränkter Haftung\nMagdeburg\n\nEine Liste der Mitglieder des Aufsichtsrates wurde zum Handelsregister eingereicht."
    },
    {
      "date": "2024-11-14",
      "id": "93479",
      "original_text": "Löschungsankündigung\nHamburg Amtsgericht Hamburg HRB 123656\nMonedo Germany GmbH – Hamburg",
      "type": "Löschungsankündigung",
      "state": "Hamburg",
      "amtsgericht": "Amtsgericht Hamburg",
      "registernummer": "HRB 123656",
      "registerart": "HRB",
      "company_name": "Monedo Germany GmbH",
      "company_seat": "Hamburg",
      "details": "14.11.2024 (Bekanntmachungsdatum)\n\nHamburg Amtsgericht Hamburg HRB 123656\nLöschungsankündigung\n\nMonedo Germany GmbH\nGesellschaft mit beschränkter Haftung\nHamburg\n\nDas Registergericht beabsichtigt, die im Handelsregister eingetragene Gesellschaft von Amts wegen nach § 394 FamFG zu löschen. Die Frist zur Erhebung eines Widerspruchs gegen die beabsichtigte Löschung wird auf 3 Monate festgesetzt."
    },
    {
      "date": "2024-11-14",
      "id": "93585",
      "original_text": "Löschungsankündigung\nBremen Amtsgericht Bremen HRB 38169\nMoog Beleuchtung Lichttechnik GmbH – Bremerhaven",
      "type": "Löschungsankündigung",
      "state": "Bremen",
      "amtsgericht": "Amtsgericht Bremen",
      "registernummer": "HRB 38169",
      "registerart": "HRB",
      "company_name": "Moog Beleuchtung Lichttechnik GmbH",
      "company_seat": "Bremerhaven",
      "details": "14.11.2024 (Bekanntmachungsdatum)\n\nBremen Amtsgericht Bremen HRB 38169\nLöschungsankündigung\n\nMoog Beleuchtung Lichttechnik GmbH\nGesellschaft mit beschränkter Haftung\nBremerhaven\n\nEs ist beabsichtigt die im Handelsregister eingetragene Gesellschaft von Amts wegen gemäß § 394 FamFG zu löschen. Gegen die Löschung kann beim AG Bremen schriftlich oder zu Protokoll der Geschäftsstelle Widerspruch eingelegt werden. Widerspruchsfrist 4 Wochen."
    },
    {
      "date": "2024-11-14",
      "id": "93598",
      "original_text": "Registerbekanntmachung nach dem Umwandlungsgesetz\nThüringen Amtsgericht Jena HRA 506814\nMöbeltischlerei-Messebau Dirk Schweinforth e. K. – Ohrdruf",
      "type": "Registerbekanntmachung nach dem Umwandlungsgesetz",
      "state": "Thüringen",
      "amtsgericht": "Amtsgericht Jena",
      "registernummer": "HRA 506814",
      "registerart": "HRA",
      "company_name": "Möbeltischlerei-Messebau Dirk Schweinforth e. K.",
      "company_seat": "Ohrdruf",
      "details": "14.11.2024 (Bekanntmachungsdatum)\n\nThüringen Amtsgericht Jena HRA 506814\nRegisterbekanntmachung nach dem Umwandlungsgesetz 14.11.2024 (Eintragungsdatum)\n\nMöbeltischlerei-Messebau Dirk Schweinforth e. K.\nEinzelkaufmann / Einzelkauffrau\nOhrdruf\n\nNicht eingetragen: Den Gläubigern der an der Ausgliederung beteiligten Rechtsträger, ist wenn sie binnen sechs Monaten nach dem Tag, an dem die Eintragung der Ausgliederung in das Register des Sitzes desjenigen Rechtsträgers, dessen Gläubiger sie sind, nach §§125, 19 Abs. 3 UmwG als bekanntgemacht gilt, ihren Anspruch nach Grund und Höhe schriftlich anmelden, Sicherheit zu leisten, soweit sie nicht Befriedigung verlangen können. Dieses Recht steht ihnen jedoch nur zu, wenn sie glaubhaft machen, daß durch die Ausgliederung die Erfüllung ihrer Forderung gefährdet wird."
    },
    {
      "date": "2024-11-14",
      "id": "93434",
      "original_text": "Registerbekanntmachung nach dem Umwandlungsgesetz\nBayern Amtsgericht Fürth HRB 18430\nNWE Planungsgesellschaft mbH – Erlangen",
      "type": "Registerbekanntmachung nach dem Umwandlungsgesetz",
      "state": "Bayern",
      "amtsgericht": "Amtsgericht Fürth",
      "registernummer": "HRB 18430",
      "registerart": "HRB",
      "company_name": "NWE Planungsgesellschaft mbH",
      "company_seat": "Erlangen",
      "details": "14.11.2024 (Bekanntmachungsdatum)\n\nBayern Amtsgericht Fürth HRB 18430\nRegisterbekanntmachung nach dem Umwandlungsgesetz 13.11.2024 (Eintragungsdatum)\n\nNWE Planungsgesellschaft mbH\nGesellschaft mit beschränkter Haftung\nErlangen\n\nDen Gläubigern der an der Verschmelzung beteiligten Rechtsträger ist, wenn sie binnen sechs Monaten nach dem Tag, an dem die Eintragung der Verschmelzung in das Register des Sitzes desjenigen Rechtsträgers, dessen Gläubiger sie sind, nach § 19 Abs. 3 UmwG als bekannt gemacht gilt, ihren Anspruch nach Grund und Höhe schriftlich anmelden, Sicherheit zu leisten, soweit sie nicht Befriedigung verlangen können. Dieses Recht steht den Gläubigern jedoch nur zu, wenn sie glaubhaft machen, dass durch die Verschmelzung die Erfüllung ihrer Forderung gefährdet wird."
    },
    {
      "date": "2024-11-14",
      "id": "93528",
      "original_text": "Registerbekanntmachung nach dem Umwandlungsgesetz\nHamburg Amtsgericht Hamburg HRB 171563\nNovem GmbH – Hamburg",
      "type": "Registerbekanntmachung nach dem Umwandlungsgesetz",
      "state": "Hamburg",
      "amtsgericht": "Amtsgericht Hamburg",
      "registernummer": "HRB 171563",
      "registerart": "HRB",
      "company_name": "Novem GmbH",
      "company_seat": "Hamburg",
      "details": "14.11.2024 (Bekanntmachungsdatum)\n\nHamburg Amtsgericht Hamburg HRB 171563\nRegisterbekanntmachung nach dem Umwandlungsgesetz 14.11.2024 (Eintragungsdatum)\n\nNovem GmbH\nGesellschaft mit beschränkter Haftung\nHamburg\n\nAls nicht eingetragen wird bekannt gemacht:\nDen Gläubigern der an der Verschmelzung beteiligten Gesellschaften ist, wenn sie binnen sechs Monaten nach dem Tag, an dem die Eintragung der Verschmelzung in das Register des Sitzes desjenigen Rechtsträgers, dessen Gläubiger sie sind, nach § 19 Absatz 3 UmwG als bekannt gemacht gilt, ihren Anspruch nach Grund und Höhe schriftlich anmelden, Sicherheit zu leisten, soweit sie nicht Befriedigung verlangen können. Dieses Recht steht den Gläubigern jedoch nur zu, wenn sie glaubhaft machen, dass durch die Verschmelzung die Erfüllung ihrer Forderung gefährdet wird."
    },
    {
      "date": "2024-11-14",
      "id": "93475",
      "original_text": "Löschungsankündigung\nHamburg Amtsgericht Hamburg HRB 148221\nOXXAN CAPITAL GmbH – Hamburg",
      "type": "Löschungsankündigung",
      "state": "Hamburg",
      "amtsgericht": "Amtsgericht Hamburg",
      "registernummer": "HRB 148221",
      "registerart": "HRB",
      "company_name": "OXXAN CAPITAL GmbH",
      "company_seat": "Hamburg",
      "details": "14.11.2024 (Bekanntmachungsdatum)\n\nHamburg Amtsgericht Hamburg HRB 148221\nLöschungsankündigung\n\nOXXAN CAPITAL GmbH\nGesellschaft mit beschränkter Haftung\nHamburg\n\nDas Registergericht beabsichtigt, die im Handelsregister eingetragene Gesellschaft von Amts wegen nach § 394 FamFG zu löschen. Die Frist zur Erhebung eines Widerspruchs gegen die beabsichtigte Löschung wird auf 3 Monate festgesetzt."
    },
    {
      "date": "2024-11-14",
      "id": "93557",
      "original_text": "Registerbekanntmachung nach dem Umwandlungsgesetz\nRheinland-Pfalz Amtsgericht Bad Kreuznach HRA 21303\nOliver Neufeld Mix Markt 128 e.K. – Bad Kreuznach",
      "type": "Registerbekanntmachung nach dem Umwandlungsgesetz",
      "state": "Rheinland-Pfalz",
      "amtsgericht": "Amtsgericht Bad Kreuznach",
      "registernummer": "HRA 21303",
      "registerart": "HRA",
      "company_name": "Oliver Neufeld Mix Markt 128 e.K.",
      "company_seat": "Bad Kreuznach",
      "details": "14.11.2024 (Bekanntmachungsdatum)\n\nRheinland-Pfalz Amtsgericht Bad Kreuznach HRA 21303\nRegisterbekanntmachung nach dem Umwandlungsgesetz 14.11.2024 (Eintragungsdatum)\n\nOliver Neufeld Mix Markt 128 e.K.\nEinzelkaufmann / Einzelkauffrau\nBad Kreuznach\n\nAls nicht eingetragen wird veröffentlicht: Den Gläubigern der an der Ausgliederung beteiligten Rechtsträger ist, wenn sie binnen sechs Monaten nach dem Tag, an dem die Eintragung der Ausgliederung in das Register des Sitzes desjenigen Rechtsträgers, dessen Gläubiger sie sind, nach § 19 Abs. 3 UmwG als bekannt gemacht gilt, ihren Anspruch nach Grund und Höhe schriftlich anmelden, Sicherheit zu leisten, soweit sie nicht Befriedigung verlangen können. Dieses Recht steht den Gläubigern jedoch nur zu, wenn sie glaubhaft machen, dass durch die Ausgliederung die Erfüllung der Forderung gefährdet wird."
    },
    {
      "date": "2024-11-14",
      "id": "93561",
      "original_text": "Löschungsankündigung\nNordrhein-Westfalen Amtsgericht Köln HRB 105600\nOne-SZ Service UG (haftungsbeschränkt) – Frechen",
      "type": "Löschungsankündigung",
      "state": "Nordrhein-Westfalen",
      "amtsgericht": "Amtsgericht Köln",
      "registernummer": "HRB 105600",
      "registerart": "HRB",
      "company_name": "One-SZ Service UG (haftungsbeschränkt)",
      "company_seat": "Frechen",
      "details": "14.11.2024 (Bekanntmachungsdatum)\n\nNordrhein-Westfalen Amtsgericht Köln HRB 105600\nLöschungsankündigung\n\nOne-SZ Service UG (haftungsbeschränkt)\nGesellschaft mit beschränkter Haftung\nFrechen\n\nDas Registergericht beabsichtigt die Gesellschaft von Amts wegen nach § 394 FamFG zu löschen. Die Frist zur Erhebung eines Widerspruchs ist auf einen Monat festgesetzt."
    },
    {
      "date": "2024-11-14",
      "id": "93532",
      "original_text": "Einreichung neuer Dokumente\nSachsen Amtsgericht Leipzig HRB 11231\nOschatzer Freizeitstätten GmbH – Oschatz",
      "type": "Einreichung neuer Dokumente",
      "state": "Sachsen",
      "amtsgericht": "Amtsgericht Leipzig",
      "registernummer": "HRB 11231",
      "registerart": "HRB",
      "company_name": "Oschatzer Freizeitstätten GmbH",
      "company_seat": "Oschatz",
      "details": "14.11.2024 (Bekanntmachungsdatum)\n\nSachsen Amtsgericht Leipzig HRB 11231\nEinreichung neuer Dokumente 14.11.2024 (Eintragungsdatum)\n\nOschatzer Freizeitstätten GmbH\nGesellschaft mit beschränkter Haftung\nOschatz\n\nAm 06.11.2024 wurde beim Handelsregister des Amtsgerichts Leipzig die Liste der Mitglieder des Aufsichtsrats gemäß § 52 GmbHG eingereicht."
    },
    {
      "date": "2024-11-14",
      "id": "93536",
      "original_text": "Einreichung neuer Dokumente\nSachsen Amtsgericht Leipzig HRB 1852\nOschatzer Wohnstätten GmbH – Oschatz",
      "type": "Einreichung neuer Dokumente",
      "state": "Sachsen",
      "amtsgericht": "Amtsgericht Leipzig",
      "registernummer": "HRB 1852",
      "registerart": "HRB",
      "company_name": "Oschatzer Wohnstätten GmbH",
      "company_seat": "Oschatz",
      "details": "14.11.2024 (Bekanntmachungsdatum)\n\nSachsen Amtsgericht Leipzig HRB 1852\nEinreichung neuer Dokumente 14.11.2024 (Eintragungsdatum)\n\nOschatzer Wohnstätten GmbH\nGesellschaft mit beschränkter Haftung\nOschatz\n\nAm 06.11.2024 wurde beim Handelsregister des Amtsgerichts Leipzig die Liste der Mitglieder des Aufsichtsrats gemäß § 52 GmbHG eingereicht."
    },
    {
      "date": "2024-11-14",
      "id": "93562",
      "original_text": "Löschungsankündigung\nNordrhein-Westfalen Amtsgericht Dortmund HRB 26909\nOttmann Consulting GmbH – Dortmund",
      "type": "Löschungsankündigung",
      "state": "Nordrhein-Westfalen",
      "amtsgericht": "Amtsgericht Dortmund",
      "registernummer": "HRB 26909",
      "registerart": "HRB",
      "company_name": "Ottmann Consulting GmbH",
      "company_seat": "Dortmund",
      "details": "14.11.2024 (Bekanntmachungsdatum)\n\nNordrhein-Westfalen Amtsgericht Dortmund HRB 26909\nLöschungsankündigung\n\nOttmann Consulting GmbH\nGesellschaft mit beschränkter Haftung\nDortmund\n\nDas Registergericht beabsichtigt die Gesellschaft von Amts wegen nach § 394 FamFG zu löschen. Die Frist zur Erhebung eines Widerspruchs ist auf zwei Monate festgesetzt."
    },
    {
      "date": "2024-11-14",
      "id": "93511",
      "original_text": "Einreichung neuer Dokumente\nBerlin Amtsgericht Berlin (Charlottenburg) HRB 255242\nPSI Software SE – Berlin",
      "type": "Einreichung neuer Dokumente",
      "state": "Berlin",
      "amtsgericht": "Amtsgericht Berlin (Charlottenburg)",
      "registernummer": "HRB 255242",
      "registerart": "HRB",
      "company_name": "PSI Software SE",
      "company_seat": "Berlin",
      "details": "14.11.2024 (Bekanntmachungsdatum)\n\nBerlin Amtsgericht Berlin (Charlottenburg) HRB 255242\nEinreichung neuer Dokumente\n\nPSI Software SE\nEuropäische Aktiengesellschaft (SE)\nBerlin\n\nAls nicht eingetragen wird veröffentlicht: Es wurde eine neue Liste der Aufsichtsratsmitglieder eingereicht (§ 106 AktG)."
    },
    {
      "date": "2024-11-14",
      "id": "93609",
      "original_text": "Löschungsankündigung\nHessen Amtsgericht Wiesbaden HRB 29491\nPatera Projektmanagement & Entwicklungs GmbH – Idstein",
      "type": "Löschungsankündigung",
      "state": "Hessen",
      "amtsgericht": "Amtsgericht Wiesbaden",
      "registernummer": "HRB 29491",
      "registerart": "HRB",
      "company_name": "Patera Projektmanagement & Entwicklungs GmbH",
      "company_seat": "Idstein",
      "details": "14.11.2024 (Bekanntmachungsdatum)\n\nHessen Amtsgericht Wiesbaden HRB 29491\nLöschungsankündigung\n\nPatera Projektmanagement & Entwicklungs GmbH\nGesellschaft mit beschränkter Haftung\nIdstein\n\nDas Registergericht beabsichtigt die im Handelsregister eingetragene Gesellschaft von Amts wegen nach § 394 FamFG zu löschen. Die Frist zur Erhebung eines Widerspruchs gegen die beabsichtigte Löschung wird auf 3 Monate festgesetzt."
    },
    {
      "date": "2024-11-14",
      "id": "93525",
      "original_text": "Registerbekanntmachung nach dem Umwandlungsgesetz\nBaden-Württemberg Amtsgericht Mannheim HRB 745874\nPflegeagentur Erni GmbH – Kappelrodeck",
      "type": "Registerbekanntmachung nach dem Umwandlungsgesetz",
      "state": "Baden-Württemberg",
      "amtsgericht": "Amtsgericht Mannheim",
      "registernummer": "HRB 745874",
      "registerart": "HRB",
      "company_name": "Pflegeagentur Erni GmbH",
      "company_seat": "Kappelrodeck",
      "details": "14.11.2024 (Bekanntmachungsdatum)\n\nBaden-Württemberg Amtsgericht Mannheim HRB 745874\nRegisterbekanntmachung nach dem Umwandlungsgesetz 14.11.2024 (Eintragungsdatum)\n\nPflegeagentur Erni GmbH\nGesellschaft mit beschränkter Haftung\nKappelrodeck\n\nDen Gläubigern der an der Ausgliederung beteiligten Rechtsträger ist, wenn sie binnen sechs Monaten nach dem Tag, an dem die Eintragung der Ausgliederung in das Register des Sitzes desjenigen Rechtsträgers, dessen Gläubiger sie sind, nach § 19 Abs. 3 UmwG als bekanntgemacht gilt, ihren Anspruch nach Grund und Höhe schriftlich anmelden, Sicherheit zu leisten, soweit sie nicht Befriedigung verlangen können. Dieses Recht steht den Gläubigern jedoch nur zu, wenn sie glaubhaft machen, dass durch die Ausgliederung die Erfüllung ihrer Forderung gefährdet wird."
    },
    {
      "date": "2024-11-14",
      "id": "93527",
      "original_text": "Registerbekanntmachung nach dem Umwandlungsgesetz\nBaden-Württemberg Amtsgericht Mannheim HRA 712127\nPflegeagentur, Inh. Marc Oliver Erni e.K. – Kappelrodeck",
      "type": "Registerbekanntmachung nach dem Umwandlungsgesetz",
      "state": "Baden-Württemberg",
      "amtsgericht": "Amtsgericht Mannheim",
      "registernummer": "HRA 712127",
      "registerart": "HRA",
      "company_name": "Pflegeagentur, Inh. Marc Oliver Erni e.K.",
      "company_seat": "Kappelrodeck",
      "details": "14.11.2024 (Bekanntmachungsdatum)\n\nBaden-Württemberg Amtsgericht Mannheim HRA 712127\nRegisterbekanntmachung nach dem Umwandlungsgesetz 14.11.2024 (Eintragungsdatum)\n\nPflegeagentur, Inh. Marc Oliver Erni e.K.\nEinzelkaufmann / Einzelkauffrau\nKappelrodeck\n\nDen Gläubigern der an der Ausgliederung beteiligten Rechtsträger ist, wenn sie binnen sechs Monaten nach dem Tag, an dem die Eintragung der Ausgliederung in das Register des Sitzes desjenigen Rechtsträgers, dessen Gläubiger sie sind, nach § 19 Abs. 3 UmwG als bekanntgemacht gilt, ihren Anspruch nach Grund und Höhe schriftlich anmelden, Sicherheit zu leisten, soweit sie nicht Befriedigung verlangen können. Dieses Recht steht den Gläubigern jedoch nur zu, wenn sie glaubhaft machen, dass durch die Ausgliederung die Erfüllung ihrer Forderung gefährdet wird."
    },
    {
      "date": "2024-11-14",
      "id": "93592",
      "original_text": "Registerbekanntmachung nach dem Umwandlungsgesetz\nNordrhein-Westfalen Amtsgericht Düsseldorf HRB 94488\nProcessWeb Verwaltungs GmbH – Düsseldorf",
      "type": "Registerbekanntmachung nach dem Umwandlungsgesetz",
      "state": "Nordrhein-Westfalen",
      "amtsgericht": "Amtsgericht Düsseldorf",
      "registernummer": "HRB 94488",
      "registerart": "HRB",
      "company_name": "ProcessWeb Verwaltungs GmbH",
      "company_seat": "Düsseldorf",
      "details": "14.11.2024 (Bekanntmachungsdatum)\n\nNordrhein-Westfalen Amtsgericht Düsseldorf HRB 94488\nRegisterbekanntmachung nach dem Umwandlungsgesetz 14.11.2024 (Eintragungsdatum)\n\nProcessWeb Verwaltungs GmbH\nGesellschaft mit beschränkter Haftung\nDüsseldorf\n\nDen Gläubigern der an der Verschmelzung beteiligten Rechtsträger ist, wenn sie binnen sechs Monaten nach dem Tag, an dem die Eintragung der Verschmelzung in das Register des Sitzes desjenigen Rechtsträgers, dessen Gläubiger sie sind, nach § 19 Absatz 3 UmwG als bekanntgemacht gilt, ihren Anspruch nach Grund und Höhe schriftlich anmelden, Sicherheit zu leisten, soweit sie nicht Befriedigung verlangen können. Dieses Recht steht den Gläubigern jedoch nur zu, wenn sie glaubhaft machen, dass durch die Verschmelzung die Erfüllung ihrer Forderung gefährdet wird."
    },
    {
      "date": "2024-11-14",
      "id": "93578",
      "original_text": "Einreichung neuer Dokumente\nNordrhein-Westfalen Amtsgericht Duisburg HRB 19131\nProjektentwicklung Gewerbepark Chemnitz-Mitte AG – Dinslaken",
      "type": "Einreichung neuer Dokumente",
      "state": "Nordrhein-Westfalen",
      "amtsgericht": "Amtsgericht Duisburg",
      "registernummer": "HRB 19131",
      "registerart": "HRB",
      "company_name": "Projektentwicklung Gewerbepark Chemnitz-Mitte AG",
      "company_seat": "Dinslaken",
      "details": "14.11.2024 (Bekanntmachungsdatum)\n\nNordrhein-Westfalen Amtsgericht Duisburg HRB 19131\nEinreichung neuer Dokumente 14.11.2024 (Eintragungsdatum)\n\nProjektentwicklung Gewerbepark Chemnitz-Mitte AG\nAktiengesellschaft\nDinslaken\n\nDem Registergericht ist eine Liste der Mitglieder des Aufsichtsrates eingereicht worden."
    },
    {
      "date": "2024-11-14",
      "id": "93566",
      "original_text": "Registerbekanntmachung nach dem Umwandlungsgesetz\nNordrhein-Westfalen Amtsgericht Düsseldorf HRB 71769\nProtego 24 Service GmbH – Langenfeld",
      "type": "Registerbekanntmachung nach dem Umwandlungsgesetz",
      "state": "Nordrhein-Westfalen",
      "amtsgericht": "Amtsgericht Düsseldorf",
      "registernummer": "HRB 71769",
      "registerart": "HRB",
      "company_name": "Protego 24 Service GmbH",
      "company_seat": "Langenfeld",
      "details": "14.11.2024 (Bekanntmachungsdatum)\n\nNordrhein-Westfalen Amtsgericht Düsseldorf HRB 71769\nRegisterbekanntmachung nach dem Umwandlungsgesetz 14.11.2024 (Eintragungsdatum)\n\nProtego 24 Service GmbH\nGesellschaft mit beschränkter Haftung\nLangenfeld\n\nDen Gläubigern der an der Verschmelzung beteiligten Rechtsträger ist, wenn sie binnen sechs Monaten nach dem Tag, an dem die Eintragung der Verschmelzung in das Register des Sitzes desjenigen Rechtsträgers, dessen Gläubiger sie sind, nach § 19 Absatz 3 UmwG als bekanntgemacht gilt, ihren Anspruch nach Grund und Höhe schriftlich anmelden, Sicherheit zu leisten, soweit sie nicht Befriedigung verlangen können. Dieses Recht steht den Gläubigern jedoch nur zu, wenn sie glaubhaft machen, dass durch die Verschmelzung die Erfüllung ihrer Forderung gefährdet wird."
    },
    {
      "date": "2024-11-14",
      "id": "93601",
      "original_text": "Löschungsankündigung\nHessen Amtsgericht Wetzlar HRA 7340\nPulverich Druck, Inh. Herbert J. Müller e. K. – Haiger",
      "type": "Löschungsankündigung",
      "state": "Hessen",
      "amtsgericht": "Amtsgericht Wetzlar",
      "registernummer": "HRA 7340",
      "registerart": "HRA",
      "company_name": "Pulverich Druck, Inh. Herbert J. Müller e. K.",
      "company_seat": "Haiger",
      "details": "14.11.2024 (Bekanntmachungsdatum)\n\nHessen Amtsgericht Wetzlar HRA 7340\nLöschungsankündigung\n\nPulverich Druck, Inh. Herbert J. Müller e. K.\nEinzelkaufmann / Einzelkauffrau\nHaiger\n\nDas Registergericht beabsichtigt die im Handelsregister eingetragene Firma von Amts wegen nach § 31 Abs. 2 HGB zu löschen. Die Frist zur Erhebung eines Widerspruchs gegen die beabsichtigte Löschung wird auf 3 Monate festgesetzt."
    },
    {
      "date": "2024-11-14",
      "id": "93492",
      "original_text": "Löschungsankündigung\nHamburg Amtsgericht Hamburg HRB 156574\nRBL Dienstleistungen GmbH – Hamburg",
      "type": "Löschungsankündigung",
      "state": "Hamburg",
      "amtsgericht": "Amtsgericht Hamburg",
      "registernummer": "HRB 156574",
      "registerart": "HRB",
      "company_name": "RBL Dienstleistungen GmbH",
      "company_seat": "Hamburg",
      "details": "14.11.2024 (Bekanntmachungsdatum)\n\nHamburg Amtsgericht Hamburg HRB 156574\nLöschungsankündigung\n\nRBL Dienstleistungen GmbH\nGesellschaft mit beschränkter Haftung\nHamburg\n\nDas Registergericht beabsichtigt, die im Handelsregister eingetragene Gesellschaft von Amts wegen nach § 394 FamFG zu löschen. Die Frist zur Erhebung eines Widerspruchs gegen die beabsichtigte Löschung wird auf 3 Monate festgesetzt."
    },
    {
      "date": "2024-11-14",
      "id": "93493",
      "original_text": "Löschungsankündigung\nHamburg Amtsgericht Hamburg HRB 159237\nRC Deutschland Marketing und Vertrieb UG (haftungsbeschränkt) – Hamburg",
      "type": "Löschungsankündigung",
      "state": "Hamburg",
      "amtsgericht": "Amtsgericht Hamburg",
      "registernummer": "HRB 159237",
      "registerart": "HRB",
      "company_name": "RC Deutschland Marketing und Vertrieb UG (haftungsbeschränkt)",
      "company_seat": "Hamburg",
      "details": "14.11.2024 (Bekanntmachungsdatum)\n\nHamburg Amtsgericht Hamburg HRB 159237\nLöschungsankündigung\n\nRC Deutschland Marketing und Vertrieb UG (haftungsbeschränkt)\nGesellschaft mit beschränkter Haftung\nHamburg\n\nDas Registergericht beabsichtigt, die im Handelsregister eingetragene Gesellschaft von Amts wegen nach § 394 FamFG zu löschen. Die Frist zur Erhebung eines Widerspruchs gegen die beabsichtigte Löschung wird auf 3 Monate festgesetzt."
    },
    {
      "date": "2024-11-14",
      "id": "93447",
      "original_text": "Registerbekanntmachung nach dem Umwandlungsgesetz\nBayern Amtsgericht Ansbach HRA 1139\nRIWA Wagener OHG – Dietenhofen",
      "type": "Registerbekanntmachung nach dem Umwandlungsgesetz",
      "state": "Bayern",
      "amtsgericht": "Amtsgericht Ansbach",
      "registernummer": "HRA 1139",
      "registerart": "HRA",
      "company_name": "RIWA Wagener OHG",
      "company_seat": "Dietenhofen",
      "details": "14.11.2024 (Bekanntmachungsdatum)\n\nBayern Amtsgericht Ansbach HRA 1139\nRegisterbekanntmachung nach dem Umwandlungsgesetz 13.11.2024 (Eintragungsdatum)\n\nRIWA Wagener OHG\nOffene Handelsgesellschaft\nDietenhofen\n\nDen Gläubigern der an der Verschmelzung beteiligten Rechtsträger ist, wenn sie binnen sechs Monaten nach dem Tag, an dem die Eintragung der Verschmelzung in das Register des Sitzes desjenigen Rechtsträgers, dessen Gläubiger sie sind, nach § 19 Abs. 3 UmwG als bekannt gemacht gilt, ihren Anspruch nach Grund und Höhe schriftlich anmelden, Sicherheit zu leisten, soweit sie nicht Befriedigung verlangen können. Dieses Recht steht den Gläubigern jedoch nur zu, wenn sie glaubhaft machen, dass durch die Verschmelzung die Erfüllung ihrer Forderung gefährdet wird."
    },
    {
      "date": "2024-11-14",
      "id": "93607",
      "original_text": "Registerbekanntmachung nach dem Umwandlungsgesetz\nHessen Amtsgericht Frankfurt am Main HRB 119395\nRazor Group Acquisition V UG (haftungsbeschränkt) – Frankfurt am Main",
      "type": "Registerbekanntmachung nach dem Umwandlungsgesetz",
      "state": "Hessen",
      "amtsgericht": "Amtsgericht Frankfurt am Main",
      "registernummer": "HRB 119395",
      "registerart": "HRB",
      "company_name": "Razor Group Acquisition V UG (haftungsbeschränkt)",
      "company_seat": "Frankfurt am Main",
      "details": "14.11.2024 (Bekanntmachungsdatum)\n\nHessen Amtsgericht Frankfurt am Main HRB 119395\nRegisterbekanntmachung nach dem Umwandlungsgesetz 14.11.2024 (Eintragungsdatum)\n\nRazor Group Acquisition V UG (haftungsbeschränkt)\nGesellschaft mit beschränkter Haftung\nFrankfurt am Main\n\nDen Gläubigern der an der Verschmelzung beteiligten Rechtsträger ist, wenn sie binnen sechs Monaten nach dem Tag, an dem die Eintragung der Verschmelzung in das Register des Sitzes desjenigen Rechtsträgers, dessen Gläubiger sie sind, nach § 19 Absatz 3 UmwG bekannt gemacht worden ist, ihren Anspruch nach Grund und Höhe schriftlich anmelden, Sicherheit zu leisten, soweit sie nicht Befriedigung verlangen können. Dieses Recht steht den Gläubigern jedoch nur zu, wenn sie glaubhaft machen, dass durch die Verschmelzung die Erfüllung ihrer Forderung gefährdet wird."
    },
    {
      "date": "2024-11-14",
      "id": "93453",
      "original_text": "Sonstige Registerbekanntmachung\nBrandenburg Amtsgericht Neuruppin HRB 1203\nRegionale Entwicklungsgesellschaft in Oberhavel-Nord (REGiO-Nord) mbH – Gransee",
      "type": "Sonstige Registerbekanntmachung",
      "state": "Brandenburg",
      "amtsgericht": "Amtsgericht Neuruppin",
      "registernummer": "HRB 1203",
      "registerart": "HRB",
      "company_name": "Regionale Entwicklungsgesellschaft in Oberhavel-Nord (REGiO-Nord) mbH",
      "company_seat": "Gransee",
      "details": "14.11.2024 (Bekanntmachungsdatum)\n\nBrandenburg Amtsgericht Neuruppin HRB 1203\nSonstige Registerbekanntmachung\n\nRegionale Entwicklungsgesellschaft in Oberhavel-Nord (REGiO-Nord) mbH\nGesellschaft mit beschränkter Haftung\nGransee\n\nAls nicht eingetragen wird veröffentlicht: Eine Liste der Mitglieder des Aufsichtsrates wurde zum Handelsregister eingereicht."
    },
    {
      "date": "2024-11-14",
      "id": "93565",
      "original_text": "Einreichung neuer Dokumente\nNordrhein-Westfalen Amtsgericht Köln HRB 7432\nRegionalverkehr Köln Gesellschaft mit beschränkter Haftung ( RVK) – Köln",
      "type": "Einreichung neuer Dokumente",
      "state": "Nordrhein-Westfalen",
      "amtsgericht": "Amtsgericht Köln",
      "registernummer": "HRB 7432",
      "registerart": "HRB",
      "company_name": "Regionalverkehr Köln Gesellschaft mit beschränkter Haftung ( RVK)",
      "company_seat": "Köln",
      "details": "14.11.2024 (Bekanntmachungsdatum)\n\nNordrhein-Westfalen Amtsgericht Köln HRB 7432\nEinreichung neuer Dokumente\n\nRegionalverkehr Köln Gesellschaft mit beschränkter Haftung ( RVK)\nGesellschaft mit beschränkter Haftung\nKöln\n\nDem Registergericht ist eine Liste der Mitglieder des Aufsichtsrates eingereicht worden."
    },
    {
      "date": "2024-11-14",
      "id": "93529",
      "original_text": "Löschungsankündigung\nBaden-Württemberg Amtsgericht Stuttgart HRB 720855\nReisebüro Hohenneuffen GmbH – Frickenhausen",
      "type": "Löschungsankündigung",
      "state": "Baden-Württemberg",
      "amtsgericht": "Amtsgericht Stuttgart",
      "registernummer": "HRB 720855",
      "registerart": "HRB",
      "company_name": "Reisebüro Hohenneuffen GmbH",
      "company_seat": "Frickenhausen",
      "details": "14.11.2024 (Bekanntmachungsdatum)\n\nBaden-Württemberg Amtsgericht Stuttgart HRB 720855\nLöschungsankündigung\n\nReisebüro Hohenneuffen GmbH\nGesellschaft mit beschränkter Haftung\nFrickenhausen\n\nAls nicht eingetragen wird bekanntgemacht:\nDas Gericht beabsichtigt, die Gesellschaft wegen Vermögenslosigkeit im Handelsregister von Amts wegen nach § 394 FamFG zu löschen. Die Frist zur Geltendmachung eines Widerspruchs gegen die beabsichtigte Löschung ist auf zwei Monate ab Veröffentlichung bestimmt."
    },
    {
      "date": "2024-11-14",
      "id": "93543",
      "original_text": "Registerbekanntmachung nach dem Umwandlungsgesetz\nNiedersachsen Amtsgericht Walsrode HRA 205415\nRené Große und Sufian Osso Apotheken OHG – Rotenburg (Wümme)",
      "type": "Registerbekanntmachung nach dem Umwandlungsgesetz",
      "state": "Niedersachsen",
      "amtsgericht": "Amtsgericht Walsrode",
      "registernummer": "HRA 205415",
      "registerart": "HRA",
      "company_name": "René Große und Sufian Osso Apotheken OHG",
      "company_seat": "Rotenburg (Wümme)",
      "details": "14.11.2024 (Bekanntmachungsdatum)\n\nNiedersachsen Amtsgericht Walsrode HRA 205415\nRegisterbekanntmachung nach dem Umwandlungsgesetz 14.11.2024 (Eintragungsdatum)\n\nRené Große und Sufian Osso Apotheken OHG\nOffene Handelsgesellschaft\nRotenburg (Wümme)\n\nDen Gläubigern der an der Ausgliederung beteiligten Rechtsträger ist, wenn sie binnen sechs Monaten nach dem Tag, an dem die Eintragung der Ausgliederung in das Register des Sitzes desjenigen Rechtsträgers, dessen Gläubiger sie sind, nach § 19 Abs. 3 UmwG als bekannt gemacht gilt, ihren Anspruch nach Grund und Höhe schriftlich anmelden, Sicherheit zu leisten, soweit sie nicht Befriedigung verlangen können. Dieses Recht steht den Gläubigern jedoch nur zu, wenn sie glaubhaft machen, dass durch die Ausgliederung die Erfüllung der Forderung gefährdet wird."
    },
    {
      "date": "2024-11-14",
      "id": "93605",
      "original_text": "Löschungsankündigung\nHessen Amtsgericht Offenbach am Main HRB 50883\nRoyalhome GmbH – Dreieich",
      "type": "Löschungsankündigung",
      "state": "Hessen",
      "amtsgericht": "Amtsgericht Offenbach am Main",
      "registernummer": "HRB 50883",
      "registerart": "HRB",
      "company_name": "Royalhome GmbH",
      "company_seat": "Dreieich",
      "details": "14.11.2024 (Bekanntmachungsdatum)\n\nHessen Amtsgericht Offenbach am Main HRB 50883\nLöschungsankündigung\n\nRoyalhome GmbH\nGesellschaft mit beschränkter Haftung\nDreieich\n\nDas Registergericht beabsichtigt die im Handelsregister eingetragene Gesellschaft von Amts wegen nach § 394 FamFG zu löschen. Die Frist zur Erhebung eines Widerspruchs gegen die beabsichtigte Löschung wird auf 3 Monate festgesetzt."
    },
    {
      "date": "2024-11-14",
      "id": "93435",
      "original_text": "Löschungsankündigung\nBayern Amtsgericht München HRB 284454\nSIMARLO UG (haftungsbeschränkt) – München",
      "type": "Löschungsankündigung",
      "state": "Bayern",
      "amtsgericht": "Amtsgericht München",
      "registernummer": "HRB 284454",
      "registerart": "HRB",
      "company_name": "SIMARLO UG (haftungsbeschränkt)",
      "company_seat": "München",
      "details": "14.11.2024 (Bekanntmachungsdatum)\n\nBayern Amtsgericht München HRB 284454\nLöschungsankündigung 13.11.2024 (Eintragungsdatum)\n\nSIMARLO UG (haftungsbeschränkt)\nGesellschaft mit beschränkter Haftung\nMünchen\n\nDas Registergericht beabsichtigt, die im Handelsregister eingetragene Gesellschaft wegen Vermögenslosigkeit von Amts wegen nach § 394 FamFG zu löschen. Die Frist zur Erhebung eines Widerspruchs ist auf drei Monate festgesetzt."
    },
    {
      "date": "2024-11-14",
      "id": "93449",
      "original_text": "Registerbekanntmachung nach dem Umwandlungsgesetz\nBayern Amtsgericht München HRB 103522\nSIMICON GmbH – München",
      "type": "Registerbekanntmachung nach dem Umwandlungsgesetz",
      "state": "Bayern",
      "amtsgericht": "Amtsgericht München",
      "registernummer": "HRB 103522",
      "registerart": "HRB",
      "company_name": "SIMICON GmbH",
      "company_seat": "München",
      "details": "14.11.2024 (Bekanntmachungsdatum)\n\nBayern Amtsgericht München HRB 103522\nRegisterbekanntmachung nach dem Umwandlungsgesetz 13.11.2024 (Eintragungsdatum)\n\nSIMICON GmbH\nGesellschaft mit beschränkter Haftung\nMünchen\n\nDen Gläubigern der an der Verschmelzung beteiligten Rechtsträger ist, wenn sie binnen sechs Monaten nach dem Tag, an dem die Eintragung der Verschmelzung in das Register des Sitzes desjenigen Rechtsträgers, dessen Gläubiger sie sind, nach § 19 Abs. 3 UmwG als bekannt gemacht gilt, ihren Anspruch nach Grund und Höhe schriftlich anmelden, Sicherheit zu leisten, soweit sie nicht Befriedigung verlangen können. Dieses Recht steht den Gläubigern jedoch nur zu, wenn sie glaubhaft machen, dass durch die Verschmelzung die Erfüllung ihrer Forderung gefährdet wird."
    },
    {
      "date": "2024-11-14",
      "id": "93611",
      "original_text": "Einreichung neuer Dokumente\nHessen Amtsgericht Kassel HRB 3972\nSMA Solar Technology AG – Niestetal",
      "type": "Einreichung neuer Dokumente",
      "state": "Hessen",
      "amtsgericht": "Amtsgericht Kassel",
      "registernummer": "HRB 3972",
      "registerart": "HRB",
      "company_name": "SMA Solar Technology AG",
      "company_seat": "Niestetal",
      "details": "14.11.2024 (Bekanntmachungsdatum)\n\nHessen Amtsgericht Kassel HRB 3972\nEinreichung neuer Dokumente\n\nSMA Solar Technology AG\nAktiengesellschaft\nNiestetal\n\nDurch eine Änderung in den Personen der Aufsichtsratsmitglieder ist eine Liste der Mitglieder des Aufsichtsrates zum Handelsregister eingereicht worden."
    },
    {
      "date": "2024-11-14",
      "id": "93551",
      "original_text": "Registerbekanntmachung nach dem Umwandlungsgesetz\nRheinland-Pfalz Amtsgericht Ludwigshafen a.Rhein (Ludwigshafen) HRB 69156\nSOFTTECH GmbH – Neustadt an der Weinstraße",
      "type": "Registerbekanntmachung nach dem Umwandlungsgesetz",
      "state": "Rheinland-Pfalz",
      "amtsgericht": "Amtsgericht Ludwigshafen a.Rhein (Ludwigshafen)",
      "registernummer": "HRB 69156",
      "registerart": "HRB",
      "company_name": "SOFTTECH GmbH",
      "company_seat": "Neustadt an der Weinstraße",
      "details": "14.11.2024 (Bekanntmachungsdatum)\n\nRheinland-Pfalz Amtsgericht Ludwigshafen a.Rhein (Ludwigshafen) HRB 69156\nRegisterbekanntmachung nach dem Umwandlungsgesetz 14.11.2024 (Eintragungsdatum)\n\nSOFTTECH GmbH\nGesellschaft mit beschränkter Haftung\nNeustadt an der Weinstraße\n\nAls nicht eingetragen wird veröffentlicht: Den Gläubigern der an der Ausgliederung beteiligten Rechtsträger ist, wenn sie binnen sechs Monaten nach dem Tag, an dem die Eintragung der Ausgliederung in das Register des Sitzes desjenigen Rechtsträgers, dessen Gläubiger sie sind, nach § 19 Abs. 3 UmwG als bekannt gemacht gilt, ihren Anspruch nach Grund und Höhe schriftlich anmelden, Sicherheit zu leisten, soweit sie nicht Befriedigung verlangen können. Dieses Recht steht den Gläubigern jedoch nur zu, wenn sie glaubhaft machen, dass durch die Ausgliederung die Erfüllung der Forderung gefährdet wird."
    },
    {
      "date": "2024-11-14",
      "id": "93440",
      "original_text": "Registerbekanntmachung nach dem Umwandlungsgesetz\nBayern Amtsgericht Fürth HRB 19439\nSTARGO Holding GmbH – Zirndorf",
      "type": "Registerbekanntmachung nach dem Umwandlungsgesetz",
      "state": "Bayern",
      "amtsgericht": "Amtsgericht Fürth",
      "registernummer": "HRB 19439",
      "registerart": "HRB",
      "company_name": "STARGO Holding GmbH",
      "company_seat": "Zirndorf",
      "details": "14.11.2024 (Bekanntmachungsdatum)\n\nBayern Amtsgericht Fürth HRB 19439\nRegisterbekanntmachung nach dem Umwandlungsgesetz 13.11.2024 (Eintragungsdatum)\n\nSTARGO Holding GmbH\nGesellschaft mit beschränkter Haftung\nZirndorf\n\nDen Gläubigern der an der Verschmelzung beteiligten Rechtsträger ist, wenn sie binnen sechs Monaten nach dem Tag, an dem die Eintragung der Verschmelzung in das Register des Sitzes desjenigen Rechtsträgers, dessen Gläubiger sie sind, nach § 19 Abs. 3 UmwG als bekannt gemacht gilt, ihren Anspruch nach Grund und Höhe schriftlich anmelden, Sicherheit zu leisten, soweit sie nicht Befriedigung verlangen können. Dieses Recht steht den Gläubigern jedoch nur zu, wenn sie glaubhaft machen, dass durch die Verschmelzung die Erfüllung ihrer Forderung gefährdet wird."
    },
    {
      "date": "2024-11-14",
      "id": "93494",
      "original_text": "Löschungsankündigung\nHamburg Amtsgericht Hamburg HRB 163369\nSVP GmbH – Hamburg",
      "type": "Löschungsankündigung",
      "state": "Hamburg",
      "amtsgericht": "Amtsgericht Hamburg",
      "registernummer": "HRB 163369",
      "registerart": "HRB",
      "company_name": "SVP GmbH",
      "company_seat": "Hamburg",
      "details": "14.11.2024 (Bekanntmachungsdatum)\n\nHamburg Amtsgericht Hamburg HRB 163369\nLöschungsankündigung\n\nSVP GmbH\nGesellschaft mit beschränkter Haftung\nHamburg\n\nDas Registergericht beabsichtigt, die im Handelsregister eingetragene Gesellschaft von Amts wegen nach § 394 FamFG zu löschen. Die Frist zur Erhebung eines Widerspruchs gegen die beabsichtigte Löschung wird auf 3 Monate festgesetzt."
    },
    {
      "date": "2024-11-14",
      "id": "93548",
      "original_text": "Registerbekanntmachung nach dem Umwandlungsgesetz\nNiedersachsen Amtsgericht Göttingen HRB 207485\nSVV GmbH – Duderstadt",
      "type": "Registerbekanntmachung nach dem Umwandlungsgesetz",
      "state": "Niedersachsen",
      "amtsgericht": "Amtsgericht Göttingen",
      "registernummer": "HRB 207485",
      "registerart": "HRB",
      "company_name": "SVV GmbH",
      "company_seat": "Duderstadt",
      "details": "14.11.2024 (Bekanntmachungsdatum)\n\nNiedersachsen Amtsgericht Göttingen HRB 207485\nRegisterbekanntmachung nach dem Umwandlungsgesetz 14.11.2024 (Eintragungsdatum)\n\nSVV GmbH\nGesellschaft mit beschränkter Haftung\nDuderstadt\n\nDen Gläubigern der an der Verschmelzung beteiligten Rechtsträger ist, wenn sie binnen sechs Monaten nach dem Tag, an dem die Eintragung der Verschmelzung in das Register des Sitzes desjenigen Rechtsträgers, dessen Gläubiger sie sind, nach § 19  Abs.  3 UmwG als bekannt gemacht gilt, ihren Anspruch nach Grund und Höhe schriftlich anmelden, Sicherheit zu leisten, soweit sie nicht Befriedigung verlangen können. Dieses Recht steht den Gläubigern jedoch nur zu, wenn sie glaubhaft machen, dass durch die Verschmelzung die Erfüllung der Forderung gefährdet wird."
    },
    {
      "date": "2024-11-14",
      "id": "93533",
      "original_text": "Einreichung neuer Dokumente\nSachsen Amtsgericht Dresden HRB 965\nSachsenEnergie AG – Dresden",
      "type": "Einreichung neuer Dokumente",
      "state": "Sachsen",
      "amtsgericht": "Amtsgericht Dresden",
      "registernummer": "HRB 965",
      "registerart": "HRB",
      "company_name": "SachsenEnergie AG",
      "company_seat": "Dresden",
      "details": "14.11.2024 (Bekanntmachungsdatum)\n\nSachsen Amtsgericht Dresden HRB 965\nEinreichung neuer Dokumente 14.11.2024 (Eintragungsdatum)\n\nSachsenEnergie AG\nAktiengesellschaft\nDresden\n\nAm 13.11.2024 wurde beim Handelsregister des Amtsgerichts Dresden die Liste der Mitglieder des Aufsichtsrats gemäß § 106 AktG eingereicht."
    },
    {
      "date": "2024-11-14",
      "id": "93542",
      "original_text": "Löschungsankündigung\nNiedersachsen Amtsgericht Lüneburg HRB 208980\nSaigon Nails UG (haftungsbeschränkt) – Seevetal OT Meckelfeld",
      "type": "Löschungsankündigung",
      "state": "Niedersachsen",
      "amtsgericht": "Amtsgericht Lüneburg",
      "registernummer": "HRB 208980",
      "registerart": "HRB",
      "company_name": "Saigon Nails UG (haftungsbeschränkt)",
      "company_seat": "Seevetal OT Meckelfeld",
      "details": "14.11.2024 (Bekanntmachungsdatum)\n\nNiedersachsen Amtsgericht Lüneburg HRB 208980\nLöschungsankündigung\n\nSaigon Nails UG (haftungsbeschränkt)\nGesellschaft mit beschränkter Haftung\nSeevetal OT Meckelfeld\n\nDas Registergericht beabsichtigt, vorstehende Gesellschaft von Amts wegen nach § 394 FamFG zu löschen. Die Frist zur Erhebung eines Widerspruchs ist auf 1 Monat ab Veröffentlichung festgesetzt."
    },
    {
      "date": "2024-11-14",
      "id": "93468",
      "original_text": "Löschungsankündigung\nBrandenburg Amtsgericht Potsdam HRB 36006\nSchwaPo GmbH – Potsdam",
      "type": "Löschungsankündigung",
      "state": "Brandenburg",
      "amtsgericht": "Amtsgericht Potsdam",
      "registernummer": "HRB 36006",
      "registerart": "HRB",
      "company_name": "SchwaPo GmbH",
      "company_seat": "Potsdam",
      "details": "14.11.2024 (Bekanntmachungsdatum)\n\nBrandenburg Amtsgericht Potsdam HRB 36006\nLöschungsankündigung\n\nSchwaPo GmbH\nGesellschaft mit beschränkter Haftung\nPotsdam\n\nBei der nachstehenden Gesellschaft wird das Amtslöschungsverfahren gemäß § 394 FamFG eingeleitet. Widerspruchsfrist 8 Wochen."
    },
    {
      "date": "2024-11-14",
      "id": "93485",
      "original_text": "Löschungsankündigung\nHamburg Amtsgericht Hamburg HRB 141772\nSecurity Service Barmbek GmbH – Hamburg",
      "type": "Löschungsankündigung",
      "state": "Hamburg",
      "amtsgericht": "Amtsgericht Hamburg",
      "registernummer": "HRB 141772",
      "registerart": "HRB",
      "company_name": "Security Service Barmbek GmbH",
      "company_seat": "Hamburg",
      "details": "14.11.2024 (Bekanntmachungsdatum)\n\nHamburg Amtsgericht Hamburg HRB 141772\nLöschungsankündigung\n\nSecurity Service Barmbek GmbH\nGesellschaft mit beschränkter Haftung\nHamburg\n\nDas Registergericht beabsichtigt, die im Handelsregister eingetragene Gesellschaft von Amts wegen nach § 394 FamFG zu löschen. Die Frist zur Erhebung eines Widerspruchs gegen die beabsichtigte Löschung wird auf 3 Monate festgesetzt."
    },
    {
      "date": "2024-11-14",
      "id": "93531",
      "original_text": "Sonstige Registerbekanntmachung\nBrandenburg Amtsgericht Frankfurt/Oder HRB 1229\nSeelower Dachdecker GmbH – Seelow",
      "type": "Sonstige Registerbekanntmachung",
      "state": "Brandenburg",
      "amtsgericht": "Amtsgericht Frankfurt/Oder",
      "registernummer": "HRB 1229",
      "registerart": "HRB",
      "company_name": "Seelower Dachdecker GmbH",
      "company_seat": "Seelow",
      "details": "14.11.2024 (Bekanntmachungsdatum)\n\nBrandenburg Amtsgericht Frankfurt/Oder HRB 1229\nSonstige Registerbekanntmachung\n\nSeelower Dachdecker GmbH\nGesellschaft mit beschränkter Haftung\nSeelow\n\nIn dem unternehmensrechtlichen Verfahren der am 11.10.2006 gelöschten Seelower Dachdecker GmbH mit Sitz in Seelow, eingetragen beim Amtsgericht Frankfurt (Oder) unter HRB 1229,  ist beabsichtigt, Frau Rechtsanwältin Nina Haverkamp aus Köln  zur  Nachtragsliquidatorin zum Zwecke der Abwicklung einer Sicherungshypothek im Grundbuch von Manschnow Blatt 44 zu bestellen.  Die unbekannten Gesellschafter der Gesellschaft werden hierzu angehört. Sie erhalten Gelegenheit zur Stellungnahme zur beabsichtigten Bestellung der Nachtragsliquidatorin binnen einer Frist von 3 Wochen.\nFrankfurt (Oder), 11.11.2024\n\nBrose\nRechtspflegerin"
    },
    {
      "date": "2024-11-14",
      "id": "93474",
      "original_text": "Löschungsankündigung\nHamburg Amtsgericht Hamburg HRB 144890\nSenftenberger Gummiwerke GmbH – Hamburg",
      "type": "Löschungsankündigung",
      "state": "Hamburg",
      "amtsgericht": "Amtsgericht Hamburg",
      "registernummer": "HRB 144890",
      "registerart": "HRB",
      "company_name": "Senftenberger Gummiwerke GmbH",
      "company_seat": "Hamburg",
      "details": "14.11.2024 (Bekanntmachungsdatum)\n\nHamburg Amtsgericht Hamburg HRB 144890\nLöschungsankündigung\n\nSenftenberger Gummiwerke GmbH\nGesellschaft mit beschränkter Haftung\nHamburg\n\nDas Registergericht beabsichtigt, die im Handelsregister eingetragene Gesellschaft von Amts wegen nach § 394 FamFG zu löschen. Die Frist zur Erhebung eines Widerspruchs gegen die beabsichtigte Löschung wird auf 3 Monate festgesetzt."
    },
    {
      "date": "2024-11-14",
      "id": "93540",
      "original_text": "Einreichung neuer Dokumente\nNiedersachsen Amtsgericht Lüneburg HRB 111058 früher Amtsgericht Winsen\nStadtwerke Winsen (Luhe) GmbH – Winsen (Luhe)",
      "type": "Einreichung neuer Dokumente",
      "state": "Niedersachsen",
      "amtsgericht": "Amtsgericht Lüneburg",
      "registernummer": "HRB 111058",
      "registerart": "HRB",
      "company_name": "Stadtwerke Winsen (Luhe) GmbH",
      "company_seat": "Winsen (Luhe)",
      "former_amtsgericht": "Winsen",
      "details": "14.11.2024 (Bekanntmachungsdatum)\n\nNiedersachsen Amtsgericht Lüneburg HRB 111058 früher Amtsgericht Winsen\nEinreichung neuer Dokumente 14.11.2024 (Eintragungsdatum)\n\nStadtwerke Winsen (Luhe) GmbH\nGesellschaft mit beschränkter Haftung\nWinsen (Luhe)\n\nDie Liste der Mitglieder des Aufsichtsrats wurde beim Registergericht eingereicht."
    },
    {
      "date": "2024-11-14",
      "id": "93487",
      "original_text": "Einreichung neuer Dokumente\nBaden-Württemberg Amtsgericht Stuttgart HRB 2643\nStuttgarter Versorgungs- und Verkehrsgesellschaft mit beschränkter Haftung – Stuttgart",
      "type": "Einreichung neuer Dokumente",
      "state": "Baden-Württemberg",
      "amtsgericht": "Amtsgericht Stuttgart",
      "registernummer": "HRB 2643",
      "registerart": "HRB",
      "company_name": "Stuttgarter Versorgungs- und Verkehrsgesellschaft mit beschränkter Haftung",
      "company_seat": "Stuttgart",
      "details": "14.11.2024 (Bekanntmachungsdatum)\n\nBaden-Württemberg Amtsgericht Stuttgart HRB 2643\nEinreichung neuer Dokumente\n\nStuttgarter Versorgungs- und Verkehrsgesellschaft mit beschränkter Haftung\nGesellschaft mit beschränkter Haftung\nStuttgart\n\nDie Gesellschaft hat am 12.11.2024 die Liste über die Zusammensetzung des Aufsichtsrats zum Handelsregister eingereicht."
    },
    {
      "date": "2024-11-14",
      "id": "93444",
      "original_text": "Registerbekanntmachung nach dem Umwandlungsgesetz\nBayern Amtsgericht München HRB 256425\nTENVA GmbH – Poing",
      "type": "Registerbekanntmachung nach dem Umwandlungsgesetz",
      "state": "Bayern",
      "amtsgericht": "Amtsgericht München",
      "registernummer": "HRB 256425",
      "registerart": "HRB",
      "company_name": "TENVA GmbH",
      "company_seat": "Poing",
      "details": "14.11.2024 (Bekanntmachungsdatum)\n\nBayern Amtsgericht München HRB 256425\nRegisterbekanntmachung nach dem Umwandlungsgesetz 13.11.2024 (Eintragungsdatum)\n\nTENVA GmbH\nGesellschaft mit beschränkter Haftung\nPoing\n\nDen Gläubigern der an der Verschmelzung beteiligten Rechtsträger ist, wenn sie binnen sechs Monaten nach dem Tag, an dem die Eintragung der Verschmelzung in das Register des Sitzes desjenigen Rechtsträgers, dessen Gläubiger sie sind, nach § 19 Abs. 3 UmwG als bekannt gemacht gilt, ihren Anspruch nach Grund und Höhe schriftlich anmelden, Sicherheit zu leisten, soweit sie nicht Befriedigung verlangen können. Dieses Recht steht den Gläubigern jedoch nur zu, wenn sie glaubhaft machen, dass durch die Verschmelzung die Erfüllung ihrer Forderung gefährdet wird."
    },
    {
      "date": "2024-11-14",
      "id": "93433",
      "original_text": "Löschungsankündigung\nBayern Amtsgericht München HRB 183827\nTR-Bauservice GmbH – Kirchseeon",
      "type": "Löschungsankündigung",
      "state": "Bayern",
      "amtsgericht": "Amtsgericht München",
      "registernummer": "HRB 183827",
      "registerart": "HRB",
      "company_name": "TR-Bauservice GmbH",
      "company_seat": "Kirchseeon",
      "details": "14.11.2024 (Bekanntmachungsdatum)\n\nBayern Amtsgericht München HRB 183827\nLöschungsankündigung 13.11.2024 (Eintragungsdatum)\n\nTR-Bauservice GmbH\nGesellschaft mit beschränkter Haftung\nKirchseeon\n\nDas Registergericht beabsichtigt, die im Handelsregister eingetragene Gesellschaft wegen Vermögenslosigkeit von Amts wegen nach § 394 FamFG zu löschen. Die Frist zur Erhebung eines Widerspruchs ist auf drei Monate festgesetzt."
    },
    {
      "date": "2024-11-14",
      "id": "93564",
      "original_text": "Sonstige Registerbekanntmachung\nNordrhein-Westfalen Amtsgericht Gütersloh HRB 9825\nTeutoburger Wald Eisenbahn GmbH – Gütersloh",
      "type": "Sonstige Registerbekanntmachung",
      "state": "Nordrhein-Westfalen",
      "amtsgericht": "Amtsgericht Gütersloh",
      "registernummer": "HRB 9825",
      "registerart": "HRB",
      "company_name": "Teutoburger Wald Eisenbahn GmbH",
      "company_seat": "Gütersloh",
      "details": "14.11.2024 (Bekanntmachungsdatum)\n\nNordrhein-Westfalen Amtsgericht Gütersloh HRB 9825\nSonstige Registerbekanntmachung 14.11.2024 (Eintragungsdatum)\n\nTeutoburger Wald Eisenbahn GmbH\nGesellschaft mit beschränkter Haftung\nGütersloh\n\nAls nicht eingetragen wird veröffentlicht: Den Gläubigern der Gesellschaft, deren Forderungen begründet worden sind bevor die Eintragung der Beendigung des Gewinnabführungsvertrages  in das Handelsregister nach § 10 des Handelsgesetzbuches als bekanntgemacht gilt, hat der andere Vertragsteil Sicherheit zu leisten, wenn sie sich binnen sechs Monaten nach der Bekanntmachung der Eintragung zu diesem Zweck bei ihm melden."
    },
    {
      "date": "2024-11-14",
      "id": "93544",
      "original_text": "Registerbekanntmachung nach dem Umwandlungsgesetz\nNiedersachsen Amtsgericht Osnabrück HRA 207715\nTreelivery GmbH & Co. KG – Georgsmarienhütte",
      "type": "Registerbekanntmachung nach dem Umwandlungsgesetz",
      "state": "Niedersachsen",
      "amtsgericht": "Amtsgericht Osnabrück",
      "registernummer": "HRA 207715",
      "registerart": "HRA",
      "company_name": "Treelivery GmbH & Co. KG",
      "company_seat": "Georgsmarienhütte",
      "details": "14.11.2024 (Bekanntmachungsdatum)\n\nNiedersachsen Amtsgericht Osnabrück HRA 207715\nRegisterbekanntmachung nach dem Umwandlungsgesetz 14.11.2024 (Eintragungsdatum)\n\nTreelivery GmbH & Co. KG\nKommanditgesellschaft\nGeorgsmarienhütte\n\nDen Gläubigern der an der formwechselnden Umwandlung beteiligten Rechtsträger ist, wenn sie binnen sechs Monaten nach dem Tag, an dem die Eintragung der Umwandlung in das Register des Sitzes desjenigen Rechtsträgers, dessen Gläubiger sie sind, nach § 19 Abs. 3 UmwG als bekannt gemacht gilt, ihren Anspruch nach Grund und Höhe schriftlich anmelden, Sicherheit zu leisten, soweit sie nicht Befriedigung verlangen können. Dieses Recht steht den Gläubigern jedoch nur zu, wenn sie glaubhaft machen, dass durch die formwechselnde Umwandlung die Erfüllung der Forderung gefährdet wird."
    },
    {
      "date": "2024-11-14",
      "id": "93437",
      "original_text": "Registerbekanntmachung nach dem Umwandlungsgesetz\nBayern Amtsgericht Fürth HRB 8780\nTreubilanz Treuhand GmbH – Uffenheim",
      "type": "Registerbekanntmachung nach dem Umwandlungsgesetz",
      "state": "Bayern",
      "amtsgericht": "Amtsgericht Fürth",
      "registernummer": "HRB 8780",
      "registerart": "HRB",
      "company_name": "Treubilanz Treuhand GmbH",
      "company_seat": "Uffenheim",
      "details": "14.11.2024 (Bekanntmachungsdatum)\n\nBayern Amtsgericht Fürth HRB 8780\nRegisterbekanntmachung nach dem Umwandlungsgesetz 13.11.2024 (Eintragungsdatum)\n\nTreubilanz Treuhand GmbH\nGesellschaft mit beschränkter Haftung\nUffenheim\n\nDen Gläubigern der an der Verschmelzung beteiligten Rechtsträger ist, wenn sie binnen sechs Monaten nach dem Tag, an dem die Eintragung der Verschmelzung in das Register des Sitzes desjenigen Rechtsträgers, dessen Gläubiger sie sind, nach § 19 Abs. 3 UmwG als bekannt gemacht gilt, ihren Anspruch nach Grund und Höhe schriftlich anmelden, Sicherheit zu leisten, soweit sie nicht Befriedigung verlangen können. Dieses Recht steht den Gläubigern jedoch nur zu, wenn sie glaubhaft machen, dass durch die Verschmelzung die Erfüllung ihrer Forderung gefährdet wird."
    },
    {
      "date": "2024-11-14",
      "id": "93505",
      "original_text": "Löschungsankündigung\nHamburg Amtsgericht Hamburg VR 9682\nTürkische Gemeinde-Hamburg e.V. – Hamburg",
      "type": "Löschungsankündigung",
      "state": "Hamburg",
      "amtsgericht": "Amtsgericht Hamburg",
      "registernummer": "VR 9682",
      "registerart": "VR",
      "company_name": "Türkische Gemeinde-Hamburg e.V.",
      "company_seat": "Hamburg",
      "details": "14.11.2024 (Bekanntmachungsdatum)\n\nHamburg Amtsgericht Hamburg VR 9682\nLöschungsankündigung\n\nTürkische Gemeinde-Hamburg e.V.\neingetragener Verein\nHamburg\n\nDas Registergericht beabsichtigt, den im Vereinsregister eingetragenen Verein von Amts wegen nach § 395 FamFG zu löschen, da nach den angestellten Ermittlungen dieser Verein offenbar nicht mehr besteht. Die Frist zur Erhebung eines Widerspruchs gegen die beabsichtigte Löschung wird auf 3 Monate festgesetzt."
    },
    {
      "date": "2024-11-14",
      "id": "93452",
      "original_text": "Einreichung neuer Dokumente\nBaden-Württemberg Amtsgericht Mannheim HRB 422250\nUNOLD AG – Hockenheim",
      "type": "Einreichung neuer Dokumente",
      "state": "Baden-Württemberg",
      "amtsgericht": "Amtsgericht Mannheim",
      "registernummer": "HRB 422250",
      "registerart": "HRB",
      "company_name": "UNOLD AG",
      "company_seat": "Hockenheim",
      "details": "14.11.2024 (Bekanntmachungsdatum)\n\nBaden-Württemberg Amtsgericht Mannheim HRB 422250\nEinreichung neuer Dokumente 14.11.2024 (Eintragungsdatum)\n\nUNOLD AG\nAktiengesellschaft\nHockenheim\n\nDie Gesellschaft hat am 07.11.2024 die Liste über die Zusammensetzung des Aufsichtsrats zum Handelsregister eingereicht."
    },
    {
      "date": "2024-11-14",
      "id": "93441",
      "original_text": "Löschungsankündigung\nBayern Amtsgericht Regensburg HRB 19112\nV und W Bau UG (haftungsbeschränkt) – Neutraubling",
      "type": "Löschungsankündigung",
      "state": "Bayern",
      "amtsgericht": "Amtsgericht Regensburg",
      "registernummer": "HRB 19112",
      "registerart": "HRB",
      "company_name": "V und W Bau UG (haftungsbeschränkt)",
      "company_seat": "Neutraubling",
      "details": "14.11.2024 (Bekanntmachungsdatum)\n\nBayern Amtsgericht Regensburg HRB 19112\nLöschungsankündigung\n\nV und W Bau UG (haftungsbeschränkt)\nGesellschaft mit beschränkter Haftung\nNeutraubling\n\nDas Registergericht beabsichtigt, die im Handelsregister eingetragene Gesellschaft wegen Vermögenslosigkeit von Amts wegen nach § 394 FamFG zu löschen. Die Frist zur Erhebung eines Widerspruchs ist auf einen Monat festgesetzt."
    },
    {
      "date": "2024-11-14",
      "id": "93455",
      "original_text": "Sonstige Registerbekanntmachung\nSachsen-Anhalt Amtsgericht Stendal HRB 25885\nVAMED Senioren- und Pflegeheim Hettstedt GmbH – Hettstedt",
      "type": "Sonstige Registerbekanntmachung",
      "state": "Sachsen-Anhalt",
      "amtsgericht": "Amtsgericht Stendal",
      "registernummer": "HRB 25885",
      "registerart": "HRB",
      "company_name": "VAMED Senioren- und Pflegeheim Hettstedt GmbH",
      "company_seat": "Hettstedt",
      "details": "14.11.2024 (Bekanntmachungsdatum)\n\nSachsen-Anhalt Amtsgericht Stendal HRB 25885\nSonstige Registerbekanntmachung 14.11.2024 (Eintragungsdatum)\n\nVAMED Senioren- und Pflegeheim Hettstedt GmbH\nGesellschaft mit beschränkter Haftung\nHettstedt\n\nNicht eingetragen:\nAls nicht eingetragen wird veröffentlicht: Den Gläubigern der Gesellschaft, deren Forderungen begründet worden sind bevor die Eintragung der Beendigung des Ergebnisabführungsvertrages in das Handelsregister nach § 10 des Handelsgesetzbuches als bekanntgemacht gilt, hat der andere Vertragsteil Sicherheit zu leisten, wenn sie sich binnen sechs Monaten nach der Bekanntmachung der Eintragung zu diesem Zweck bei ihm melden."
    },
    {
      "date": "2024-11-14",
      "id": "93496",
      "original_text": "Löschungsankündigung\nHamburg Amtsgericht Hamburg HRB 176587\nVF Medical Products GmbH – Hamburg",
      "type": "Löschungsankündigung",
      "state": "Hamburg",
      "amtsgericht": "Amtsgericht Hamburg",
      "registernummer": "HRB 176587",
      "registerart": "HRB",
      "company_name": "VF Medical Products GmbH",
      "company_seat": "Hamburg",
      "details": "14.11.2024 (Bekanntmachungsdatum)\n\nHamburg Amtsgericht Hamburg HRB 176587\nLöschungsankündigung\n\nVF Medical Products GmbH\nGesellschaft mit beschränkter Haftung\nHamburg\n\nDas Registergericht beabsichtigt, die im Handelsregister eingetragene Gesellschaft von Amts wegen nach § 394 FamFG zu löschen. Die Frist zur Erhebung eines Widerspruchs gegen die beabsichtigte Löschung wird auf 3 Monate festgesetzt."
    },
    {
      "date": "2024-11-14",
      "id": "93506",
      "original_text": "Löschungsankündigung\nHamburg Amtsgericht Hamburg HRB 186828\nVZ Sanierung & Bauservice GmbH – Hamburg",
      "type": "Löschungsankündigung",
      "state": "Hamburg",
      "amtsgericht": "Amtsgericht Hamburg",
      "registernummer": "HRB 186828",
      "registerart": "HRB",
      "company_name": "VZ Sanierung & Bauservice GmbH",
      "company_seat": "Hamburg",
      "details": "14.11.2024 (Bekanntmachungsdatum)\n\nHamburg Amtsgericht Hamburg HRB 186828\nLöschungsankündigung\n\nVZ Sanierung & Bauservice GmbH\nGesellschaft mit beschränkter Haftung\nHamburg\n\nDas Registergericht beabsichtigt, die im Handelsregister eingetragene Gesellschaft von Amts wegen nach § 394 FamFG zu löschen. Die Frist zur Erhebung eines Widerspruchs gegen die beabsichtigte Löschung wird auf 3 Monate festgesetzt."
    },
    {
      "date": "2024-11-14",
      "id": "93502",
      "original_text": "Einreichung neuer Dokumente\nBaden-Württemberg Amtsgericht Mannheim HRB 560453\nVerkehrsgesellschaft Main- Tauber mbH (VGMT) – Lauda-Königshofen",
      "type": "Einreichung neuer Dokumente",
      "state": "Baden-Württemberg",
      "amtsgericht": "Amtsgericht Mannheim",
      "registernummer": "HRB 560453",
      "registerart": "HRB",
      "company_name": "Verkehrsgesellschaft Main- Tauber mbH (VGMT)",
      "company_seat": "Lauda-Königshofen",
      "details": "14.11.2024 (Bekanntmachungsdatum)\n\nBaden-Württemberg Amtsgericht Mannheim HRB 560453\nEinreichung neuer Dokumente\n\nVerkehrsgesellschaft Main- Tauber mbH (VGMT)\nGesellschaft mit beschränkter Haftung\nLauda-Königshofen\n\nDie Gesellschaft hat am 13.11.2024 die Liste über die Zusammensetzung des Aufsichtsrats zum Handelsregister eingereicht."
    },
    {
      "date": "2024-11-14",
      "id": "93460",
      "original_text": "Registerbekanntmachung nach dem Umwandlungsgesetz\nBaden-Württemberg Amtsgericht Stuttgart HRB 770034\nW. Kipp UG (haftungsbeschränkt) – Dietingen",
      "type": "Registerbekanntmachung nach dem Umwandlungsgesetz",
      "state": "Baden-Württemberg",
      "amtsgericht": "Amtsgericht Stuttgart",
      "registernummer": "HRB 770034",
      "registerart": "HRB",
      "company_name": "W. Kipp UG (haftungsbeschränkt)",
      "company_seat": "Dietingen",
      "details": "14.11.2024 (Bekanntmachungsdatum)\n\nBaden-Württemberg Amtsgericht Stuttgart HRB 770034\nRegisterbekanntmachung nach dem Umwandlungsgesetz 14.11.2024 (Eintragungsdatum)\n\nW. Kipp UG (haftungsbeschränkt)\nGesellschaft mit beschränkter Haftung\nDietingen\n\nAls nicht eingetragen wird bekanntgemacht:\nDen Gläubigern der an der Verschmelzung beteiligten Rechtsträger ist, wenn sie binnen sechs Monaten nach dem Tag, an dem die Eintragung der Verschmelzung in das Register des Sitzes desjenigen Rechtsträgers, dessen Gläubiger sie sind, nach § 19 Abs. 3 UmwG als bekanntgemacht gilt, ihren Anspruch nach Grund und Höhe schriftlich anmelden, Sicherheit zu leisten, soweit sie nicht Befriedigung verlangen können. Dieses Recht steht den Gläubigern jedoch nur zu, wenn sie glaubhaft machen, dass durch die Verschmelzung die Erfüllung ihrer Forderung gefährdet wird."
    },
    {
      "date": "2024-11-14",
      "id": "93552",
      "original_text": "Löschungsankündigung\nRheinland-Pfalz Amtsgericht Landau HRB 32941\nWELEBO UG (haftungsbeschränkt) – Landau in der Pfalz",
      "type": "Löschungsankündigung",
      "state": "Rheinland-Pfalz",
      "amtsgericht": "Amtsgericht Landau",
      "registernummer": "HRB 32941",
      "registerart": "HRB",
      "company_name": "WELEBO UG (haftungsbeschränkt)",
      "company_seat": "Landau in der Pfalz",
      "details": "14.11.2024 (Bekanntmachungsdatum)\n\nRheinland-Pfalz Amtsgericht Landau HRB 32941\nLöschungsankündigung\n\nWELEBO UG (haftungsbeschränkt)\nGesellschaft mit beschränkter Haftung\nLandau in der Pfalz\n\nDas Registergericht beabsichtigt die Gesellschaft von Amts wegen nach § 394 FamFG zu löschen. Die Frist zur Erhebung eines Widerspruchs ist auf zwei Monate festgesetzt."
    },
    {
      "date": "2024-11-14",
      "id": "93429",
      "original_text": "Registerbekanntmachung nach dem Umwandlungsgesetz\nBayern Amtsgericht Ansbach HRB 1630\nWagener Beteiligungs GmbH – Dietenhofen",
      "type": "Registerbekanntmachung nach dem Umwandlungsgesetz",
      "state": "Bayern",
      "amtsgericht": "Amtsgericht Ansbach",
      "registernummer": "HRB 1630",
      "registerart": "HRB",
      "company_name": "Wagener Beteiligungs GmbH",
      "company_seat": "Dietenhofen",
      "details": "14.11.2024 (Bekanntmachungsdatum)\n\nBayern Amtsgericht Ansbach HRB 1630\nRegisterbekanntmachung nach dem Umwandlungsgesetz 13.11.2024 (Eintragungsdatum)\n\nWagener Beteiligungs GmbH\nGesellschaft mit beschränkter Haftung\nDietenhofen\n\nDen Gläubigern der an der Verschmelzung beteiligten Rechtsträger ist, wenn sie binnen sechs Monaten nach dem Tag, an dem die Eintragung der Verschmelzung in das Register des Sitzes desjenigen Rechtsträgers, dessen Gläubiger sie sind, nach § 19 Abs. 3 UmwG als bekannt gemacht gilt, ihren Anspruch nach Grund und Höhe schriftlich anmelden, Sicherheit zu leisten, soweit sie nicht Befriedigung verlangen können. Dieses Recht steht den Gläubigern jedoch nur zu, wenn sie glaubhaft machen, dass durch die Verschmelzung die Erfüllung ihrer Forderung gefährdet wird."
    },
    {
      "date": "2024-11-14",
      "id": "93459",
      "original_text": "Registerbekanntmachung nach dem Umwandlungsgesetz\nBaden-Württemberg Amtsgericht Stuttgart HRA 741803\nWerner E. Kipp e. K. – Dietingen",
      "type": "Registerbekanntmachung nach dem Umwandlungsgesetz",
      "state": "Baden-Württemberg",
      "amtsgericht": "Amtsgericht Stuttgart",
      "registernummer": "HRA 741803",
      "registerart": "HRA",
      "company_name": "Werner E. Kipp e. K.",
      "company_seat": "Dietingen",
      "details": "14.11.2024 (Bekanntmachungsdatum)\n\nBaden-Württemberg Amtsgericht Stuttgart HRA 741803\nRegisterbekanntmachung nach dem Umwandlungsgesetz 14.11.2024 (Eintragungsdatum)\n\nWerner E. Kipp e. K.\nEinzelkaufmann / Einzelkauffrau\nDietingen\n\nAls nicht eingetragen wird bekanntgemacht:\nDen Gläubigern der an der Verschmelzung beteiligten Rechtsträger ist, wenn sie binnen sechs Monaten nach dem Tag, an dem die Eintragung der Verschmelzung in das Register des Sitzes desjenigen Rechtsträgers, dessen Gläubiger sie sind, nach § 19 Abs. 3 UmwG als bekanntgemacht gilt, ihren Anspruch nach Grund und Höhe schriftlich anmelden, Sicherheit zu leisten, soweit sie nicht Befriedigung verlangen können. Dieses Recht steht den Gläubigern jedoch nur zu, wenn sie glaubhaft machen, dass durch die Verschmelzung die Erfüllung ihrer Forderung gefährdet wird."
    },
    {
      "date": "2024-11-14",
      "id": "93563",
      "original_text": "Einreichung neuer Dokumente\nNordrhein-Westfalen Amtsgericht Münster HRB 21970\nWinkhaus Verwaltungs SE – Telgte",
      "type": "Einreichung neuer Dokumente",
      "state": "Nordrhein-Westfalen",
      "amtsgericht": "Amtsgericht Münster",
      "registernummer": "HRB 21970",
      "registerart": "HRB",
      "company_name": "Winkhaus Verwaltungs SE",
      "company_seat": "Telgte",
      "details": "14.11.2024 (Bekanntmachungsdatum)\n\nNordrhein-Westfalen Amtsgericht Münster HRB 21970\nEinreichung neuer Dokumente\n\nWinkhaus Verwaltungs SE\nEuropäische Aktiengesellschaft (SE)\nTelgte\n\nDem Registergericht ist eine neue Liste der Mitglieder des Aufsichtsrates eingereicht worden."
    },
    {
      "date": "2024-11-14",
      "id": "93535",
      "original_text": "Einreichung neuer Dokumente\nSachsen Amtsgericht Dresden HRB 43309\nWohnungsdienstleistungsgesellschaft mbH Hoyerswerda – Hoyerswerda",
      "type": "Einreichung neuer Dokumente",
      "state": "Sachsen",
      "amtsgericht": "Amtsgericht Dresden",
      "registernummer": "HRB 43309",
      "registerart": "HRB",
      "company_name": "Wohnungsdienstleistungsgesellschaft mbH Hoyerswerda",
      "company_seat": "Hoyerswerda",
      "details": "14.11.2024 (Bekanntmachungsdatum)\n\nSachsen Amtsgericht Dresden HRB 43309\nEinreichung neuer Dokumente\n\nWohnungsdienstleistungsgesellschaft mbH Hoyerswerda\nGesellschaft mit beschränkter Haftung\nHoyerswerda\n\nAm 13.11.2024 wurde beim Handelsregister des Amtsgerichts Dresden die Liste der Mitglieder des Aufsichtsrats gemäß § 52 GmbHG eingereicht."
    },
    {
      "date": "2024-11-14",
      "id": "93504",
      "original_text": "Löschungsankündigung\nHamburg Amtsgericht Hamburg HRA 122148\nWärmenetz Landegge GmbH & Co. KG – Hamburg",
      "type": "Löschungsankündigung",
      "state": "Hamburg",
      "amtsgericht": "Amtsgericht Hamburg",
      "registernummer": "HRA 122148",
      "registerart": "HRA",
      "company_name": "Wärmenetz Landegge GmbH & Co. KG",
      "company_seat": "Hamburg",
      "details": "14.11.2024 (Bekanntmachungsdatum)\n\nHamburg Amtsgericht Hamburg HRA 122148\nLöschungsankündigung\n\nWärmenetz Landegge GmbH & Co. KG\nKommanditgesellschaft\nHamburg\n\nDas Registergericht beabsichtigt, die im Handelsregister eingetragene Firma von Amts wegen nach § 31 Abs. 2 HGB zu löschen. Die Frist zur Erhebung eines Widerspruchs gegen die beabsichtigte Löschung wird auf 3 Monate festgesetzt."
    },
    {
      "date": "2024-11-14",
      "id": "93594",
      "original_text": "Registerbekanntmachung nach dem Umwandlungsgesetz\nNordrhein-Westfalen Amtsgericht Krefeld HRB 20716\nZaunbau Lennartz und Zohlen GmbH – Nettetal",
      "type": "Registerbekanntmachung nach dem Umwandlungsgesetz",
      "state": "Nordrhein-Westfalen",
      "amtsgericht": "Amtsgericht Krefeld",
      "registernummer": "HRB 20716",
      "registerart": "HRB",
      "company_name": "Zaunbau Lennartz und Zohlen GmbH",
      "company_seat": "Nettetal",
      "details": "14.11.2024 (Bekanntmachungsdatum)\n\nNordrhein-Westfalen Amtsgericht Krefeld HRB 20716\nRegisterbekanntmachung nach dem Umwandlungsgesetz 14.11.2024 (Eintragungsdatum)\n\nZaunbau Lennartz und Zohlen GmbH\nGesellschaft mit beschränkter Haftung\nNettetal\n\nDen Gläubigern der an der Ausgliederung beteiligten Rechtsträger ist, wenn sie binnen sechs Monaten nach dem Tag, an dem die Eintragung der Ausgliederung in das Register des Sitzes desjenigen Rechtsträgers, dessen Gläubiger sie sind, nach § 19 Absatz 3 UmwG als bekanntgemacht gilt, ihren Anspruch nach Grund und Höhe schriftlich anmelden, Sicherheit zu leisten, soweit sie nicht Befriedigung verlangen können. Dieses Recht steht den Gläubigern jedoch nur zu, wenn sie glaubhaft machen, dass durch die Ausgliederung die Erfüllung ihrer Forderung gefährdet wird."
    },
    {
      "date": "2024-11-14",
      "id": "93555",
      "original_text": "Einreichung neuer Dokumente\nRheinland-Pfalz Amtsgericht Mainz HRB 43019\nZentrale Beteiligungsgesellschaft der Stadt Mainz mit beschränkter Haftung – Mainz",
      "type": "Einreichung neuer Dokumente",
      "state": "Rheinland-Pfalz",
      "amtsgericht": "Amtsgericht Mainz",
      "registernummer": "HRB 43019",
      "registerart": "HRB",
      "company_name": "Zentrale Beteiligungsgesellschaft der Stadt Mainz mit beschränkter Haftung",
      "company_seat": "Mainz",
      "details": "14.11.2024 (Bekanntmachungsdatum)\n\nRheinland-Pfalz Amtsgericht Mainz HRB 43019\nEinreichung neuer Dokumente\n\nZentrale Beteiligungsgesellschaft der Stadt Mainz mit beschränkter Haftung\nGesellschaft mit beschränkter Haftung\nMainz\n\nDem Registergericht ist eine neue Liste der Mitglieder des Aufsichtsrates eingereicht worden."
    },
    {
      "date": "2024-11-14",
      "id": "93517",
      "original_text": "Registerbekanntmachung nach dem Umwandlungsgesetz\nNordrhein-Westfalen Amtsgericht Coesfeld HRB 22436\naddhucate GmbH – Gescher",
      "type": "Registerbekanntmachung nach dem Umwandlungsgesetz",
      "state": "Nordrhein-Westfalen",
      "amtsgericht": "Amtsgericht Coesfeld",
      "registernummer": "HRB 22436",
      "registerart": "HRB",
      "company_name": "addhucate GmbH",
      "company_seat": "Gescher",
      "details": "14.11.2024 (Bekanntmachungsdatum)\n\nNordrhein-Westfalen Amtsgericht Coesfeld HRB 22436\nRegisterbekanntmachung nach dem Umwandlungsgesetz 14.11.2024 (Eintragungsdatum)\n\naddhucate GmbH\nGesellschaft mit beschränkter Haftung\nGescher\n\nDen Gläubigern der an der Verschmelzung beteiligten Rechtsträger ist, wenn sie binnen sechs Monaten nach dem Tag, an dem die Eintragung der Verschmelzung in das Register des Sitzes derjenigen Rechtsträger deren Gläubiger sie sind, nach § 19 Absatz 3 UmwG als bekanntgemacht gilt, ihren Anspruch nach Grund und Höhe schriftlich anmelden, Sicherheit zu leisten, soweit sie nicht Befriedigung verlangen können. Dieses Recht steht den Gläubigern jedoch nur zu, wenn sie glaubhaft machen, dass durch die Verschmelzung die Erfüllung ihrer Forderung gefährdet wird."
    },
    {
      "date": "2024-11-14",
      "id": "93583",
      "original_text": "Registerbekanntmachung nach dem Umwandlungsgesetz\nNordrhein-Westfalen Amtsgericht Münster HRB 18267\nagn Projektmanagement GmbH – Münster",
      "type": "Registerbekanntmachung nach dem Umwandlungsgesetz",
      "state": "Nordrhein-Westfalen",
      "amtsgericht": "Amtsgericht Münster",
      "registernummer": "HRB 18267",
      "registerart": "HRB",
      "company_name": "agn Projektmanagement GmbH",
      "company_seat": "Münster",
      "details": "14.11.2024 (Bekanntmachungsdatum)\n\nNordrhein-Westfalen Amtsgericht Münster HRB 18267\nRegisterbekanntmachung nach dem Umwandlungsgesetz 14.11.2024 (Eintragungsdatum)\n\nagn Projektmanagement GmbH\nGesellschaft mit beschränkter Haftung\nMünster\n\nDen Gläubigern der an der Verschmelzung beteiligten Rechtsträger ist, wenn sie binnen sechs Monaten nach dem Tag, an dem die Eintragung der Verschmelzung in das Register des Sitzes derjenigen Rechtsträger deren Gläubiger sie sind, nach § 19 Absatz 3 UmwG als bekanntgemacht gilt, ihren Anspruch nach Grund und Höhe schriftlich anmelden, Sicherheit zu leisten, soweit sie nicht Befriedigung verlangen können. Dieses Recht steht den Gläubigern jedoch nur zu, wenn sie glaubhaft machen, dass durch die Verschmelzung die Erfüllung ihrer Forderung gefährdet wird."
    },
    {
      "date": "2024-11-14",
      "id": "93586",
      "original_text": "Registerbekanntmachung nach dem Umwandlungsgesetz\nNordrhein-Westfalen Amtsgericht Münster HRB 18267\nagn Projektmanagement GmbH – Münster",
      "type": "Registerbekanntmachung nach dem Umwandlungsgesetz",
      "state": "Nordrhein-Westfalen",
      "amtsgericht": "Amtsgericht Münster",
      "registernummer": "HRB 18267",
      "registerart": "HRB",
      "company_name": "agn Projektmanagement GmbH",
      "company_seat": "Münster",
      "details": "14.11.2024 (Bekanntmachungsdatum)\n\nNordrhein-Westfalen Amtsgericht Münster HRB 18267\nRegisterbekanntmachung nach dem Umwandlungsgesetz 14.11.2024 (Eintragungsdatum)\n\nagn Projektmanagement GmbH\nGesellschaft mit beschränkter Haftung\nMünster\n\nDen Gläubigern der an der Verschmelzung beteiligten Rechtsträger ist, wenn sie binnen sechs Monaten nach dem Tag, an dem die Eintragung der Verschmelzung in das Register des Sitzes derjenigen Rechtsträger deren Gläubiger sie sind, nach § 19 Absatz 3 UmwG als bekanntgemacht gilt, ihren Anspruch nach Grund und Höhe schriftlich anmelden, Sicherheit zu leisten, soweit sie nicht Befriedigung verlangen können. Dieses Recht steht den Gläubigern jedoch nur zu, wenn sie glaubhaft machen, dass durch die Verschmelzung die Erfüllung ihrer Forderung gefährdet wird."
    },
    {
      "date": "2024-11-14",
      "id": "93503",
      "original_text": "Registerbekanntmachung nach dem Umwandlungsgesetz\nBerlin Amtsgericht Berlin (Charlottenburg) HRB 128182\nalma Vermögensverwaltung GmbH – Berlin",
      "type": "Registerbekanntmachung nach dem Umwandlungsgesetz",
      "state": "Berlin",
      "amtsgericht": "Amtsgericht Berlin (Charlottenburg)",
      "registernummer": "HRB 128182",
      "registerart": "HRB",
      "company_name": "alma Vermögensverwaltung GmbH",
      "company_seat": "Berlin",
      "details": "14.11.2024 (Bekanntmachungsdatum)\n\nBerlin Amtsgericht Berlin (Charlottenburg) HRB 128182\nRegisterbekanntmachung nach dem Umwandlungsgesetz 13.11.2024 (Eintragungsdatum)\n\nalma Vermögensverwaltung GmbH\nGesellschaft mit beschränkter Haftung\nBerlin\n\nZu Eintragungsnummer 9 vom 13.11.2024 wird als nicht eingetragen veröffentlicht: Den Gläubigern der an der Verschmelzung beteiligten Rechtsträger ist, wenn sie binnen sechs Monaten nach dem Tag, an dem die Eintragung der Verschmelzung in das Register des Sitzes desjenigen Rechtsträgers, dessen Gläubiger sie sind, als bekannt gemacht gilt, ihren Anspruch nach Grund und Höhe schriftlich anmelden, Sicherheit zu leisten, soweit sie nicht Befriedigung verlangen können. Dieses Recht steht den Gläubigern jedoch nur zu, wenn sie glaubhaft machen, dass durch die Verschmelzung die Erfüllung ihrer Forderung gefährdet wird. Das Recht, Sicherheitsleistung zu verlangen, steht Gläubigern nicht zu, die im Falle der Insolvenz ein Recht auf vorzugsweise Befriedigung aus einer Deckungsmasse haben, die nach gesetzlicher Vorschrift zu ihrem Schutz errichtet und staatlich überwacht ist."
    },
    {
      "date": "2024-11-14",
      "id": "93559",
      "original_text": "Registerbekanntmachung nach dem Umwandlungsgesetz\nRheinland-Pfalz Amtsgericht Ludwigshafen a.Rhein (Ludwigshafen) HRB 42688\nbrevis financial strategy GmbH – Neustadt/Weinstraße",
      "type": "Registerbekanntmachung nach dem Umwandlungsgesetz",
      "state": "Rheinland-Pfalz",
      "amtsgericht": "Amtsgericht Ludwigshafen a.Rhein (Ludwigshafen)",
      "registernummer": "HRB 42688",
      "registerart": "HRB",
      "company_name": "brevis financial strategy GmbH",
      "company_seat": "Neustadt/Weinstraße",
      "details": "14.11.2024 (Bekanntmachungsdatum)\n\nRheinland-Pfalz Amtsgericht Ludwigshafen a.Rhein (Ludwigshafen) HRB 42688\nRegisterbekanntmachung nach dem Umwandlungsgesetz 14.11.2024 (Eintragungsdatum)\n\nbrevis financial strategy GmbH\nGesellschaft mit beschränkter Haftung\nNeustadt/Weinstraße\n\nAls nicht eingetragen wird veröffentlicht: Den Gläubigern der an der Verschmelzung beteiligten Rechtsträger ist, wenn sie binnen sechs Monaten nach dem Tag, an dem die Eintragung der Verschmelzung in das Register des Sitzes desjenigen Rechtsträgers,dessen Gläubiger sie sind, nach § 19 Abs. 3 UmwG als bekannt gemacht gilt, ihren Anspruch nach Grund und Höhe schriftlich anmelden, Sicherheit zu leisten, soweit sie nicht Befriedigung verlangen können. Dieses Recht steht den Gläubigern jedoch nur zu, wenn sie glaubhaft machen, dass durch die Verschmelzung die Erfüllungd er Forderung gefährdet wird."
    },
    {
      "date": "2024-11-14",
      "id": "93558",
      "original_text": "Registerbekanntmachung nach dem Umwandlungsgesetz\nRheinland-Pfalz Amtsgericht Ludwigshafen a.Rhein (Ludwigshafen) HRB 42686\nbrevis holding GmbH – Neustadt/Weinstraße",
      "type": "Registerbekanntmachung nach dem Umwandlungsgesetz",
      "state": "Rheinland-Pfalz",
      "amtsgericht": "Amtsgericht Ludwigshafen a.Rhein (Ludwigshafen)",
      "registernummer": "HRB 42686",
      "registerart": "HRB",
      "company_name": "brevis holding GmbH",
      "company_seat": "Neustadt/Weinstraße",
      "details": "14.11.2024 (Bekanntmachungsdatum)\n\nRheinland-Pfalz Amtsgericht Ludwigshafen a.Rhein (Ludwigshafen) HRB 42686\nRegisterbekanntmachung nach dem Umwandlungsgesetz 14.11.2024 (Eintragungsdatum)\n\nbrevis holding GmbH\nGesellschaft mit beschränkter Haftung\nNeustadt/Weinstraße\n\nAls nicht eingetragen wird veröffentlicht: Den Gläubigern der an der Verschmelzung beteiligten Rechtsträger ist, wenn sie binnen sechs Monaten nach dem Tag, an dem die Eintragung der Verschmelzung in das Register des Sitzes desjenigen Rechtsträgers,dessen Gläubiger sie sind, nach § 19 Abs. 3 UmwG als bekannt gemacht gilt, ihren Anspruch nach Grund und Höhe schriftlich anmelden, Sicherheit zu leisten, soweit sie nicht Befriedigung verlangen können. Dieses Recht steht den Gläubigern jedoch nur zu, wenn sie glaubhaft machen, dass durch die Verschmelzung die Erfüllungd er Forderung gefährdet wird."
    },
    {
      "date": "2024-11-14",
      "id": "93569",
      "original_text": "Löschungsankündigung\nNordrhein-Westfalen Amtsgericht Köln HRB 88117\nfibertech optics GmbH – Köln",
      "type": "Löschungsankündigung",
      "state": "Nordrhein-Westfalen",
      "amtsgericht": "Amtsgericht Köln",
      "registernummer": "HRB 88117",
      "registerart": "HRB",
      "company_name": "fibertech optics GmbH",
      "company_seat": "Köln",
      "details": "14.11.2024 (Bekanntmachungsdatum)\n\nNordrhein-Westfalen Amtsgericht Köln HRB 88117\nLöschungsankündigung\n\nfibertech optics GmbH\nGesellschaft mit beschränkter Haftung\nKöln\n\nDas Registergericht beabsichtigt die Gesellschaft von Amts wegen nach § 394 FamFG zu löschen. Die Frist zur Erhebung eines Widerspruchs ist auf einen Monat festgesetzt."
    },
    {
      "date": "2024-11-14",
      "id": "93519",
      "original_text": "Einreichung neuer Dokumente\nBerlin Amtsgericht Berlin (Charlottenburg) HRB 248174\nmomox Holding SE – Berlin",
      "type": "Einreichung neuer Dokumente",
      "state": "Berlin",
      "amtsgericht": "Amtsgericht Berlin (Charlottenburg)",
      "registernummer": "HRB 248174",
      "registerart": "HRB",
      "company_name": "momox Holding SE",
      "company_seat": "Berlin",
      "details": "14.11.2024 (Bekanntmachungsdatum)\n\nBerlin Amtsgericht Berlin (Charlottenburg) HRB 248174\nEinreichung neuer Dokumente\n\nmomox Holding SE\nEuropäische Aktiengesellschaft (SE)\nBerlin\n\nAls nicht eingetragen wird veröffentlicht:Es wurde eine neue Liste der Aufsichtsratsmitglieder eingereicht (§ 106 AktG)."
    },
    {
      "date": "2024-11-14",
      "id": "93518",
      "original_text": "Einreichung neuer Dokumente\nBerlin Amtsgericht Berlin (Charlottenburg) HRB 248162\nmomox SE – Berlin",
      "type": "Einreichung neuer Dokumente",
      "state": "Berlin",
      "amtsgericht": "Amtsgericht Berlin (Charlottenburg)",
      "registernummer": "HRB 248162",
      "registerart": "HRB",
      "company_name": "momox SE",
      "company_seat": "Berlin",
      "details": "14.11.2024 (Bekanntmachungsdatum)\n\nBerlin Amtsgericht Berlin (Charlottenburg) HRB 248162\nEinreichung neuer Dokumente\n\nmomox SE\nEuropäische Aktiengesellschaft (SE)\nBerlin\n\nAls nicht eingetragen wird veröffentlicht:Es wurde eine neue Liste der Aufsichtsratsmitglieder eingereicht (§ 106 AktG)."
    },
    {
      "date": "2024-11-14",
      "id": "93554",
      "original_text": "Registerbekanntmachung nach dem Umwandlungsgesetz\nRheinland-Pfalz Amtsgericht Ludwigshafen a.Rhein (Ludwigshafen) HRB 69668\nscaffmax GmbH – Neustadt an der Weinstraße",
      "type": "Registerbekanntmachung nach dem Umwandlungsgesetz",
      "state": "Rheinland-Pfalz",
      "amtsgericht": "Amtsgericht Ludwigshafen a.Rhein (Ludwigshafen)",
      "registernummer": "HRB 69668",
      "registerart": "HRB",
      "company_name": "scaffmax GmbH",
      "company_seat": "Neustadt an der Weinstraße",
      "details": "14.11.2024 (Bekanntmachungsdatum)\n\nRheinland-Pfalz Amtsgericht Ludwigshafen a.Rhein (Ludwigshafen) HRB 69668\nRegisterbekanntmachung nach dem Umwandlungsgesetz 14.11.2024 (Eintragungsdatum)\n\nscaffmax GmbH\nGesellschaft mit beschränkter Haftung\nNeustadt an der Weinstraße\n\nAls nicht eingetragen wird veröffentlicht: Den Gläubigern der an der Ausgliederung beteiligten Rechtsträger ist, wenn sie binnen sechs Monaten nach dem Tag, an dem die Eintragung der Ausgliederung in das Register des Sitzes desjenigen Rechtsträgers, dessen Gläubiger sie sind, nach § 19 Abs. 3 UmwG als bekannt gemacht gilt, ihren Anspruch nach Grund und Höhe schriftlich anmelden, Sicherheit zu leisten, soweit sie nicht Befriedigung verlangen können. Dieses Recht steht den Gläubigern jedoch nur zu, wenn sie glaubhaft machen, dass durch die Ausgliederung die Erfüllung der Forderung gefährdet wird."
    },
    {
      "date": "2024-11-14",
      "id": "93524",
      "original_text": "Registerbekanntmachung nach dem Umwandlungsgesetz\nNordrhein-Westfalen Amtsgericht Coesfeld HRB 9858\nten Brinke Göttsch Verwaltungsgesellschaft mbH – Bocholt",
      "type": "Registerbekanntmachung nach dem Umwandlungsgesetz",
      "state": "Nordrhein-Westfalen",
      "amtsgericht": "Amtsgericht Coesfeld",
      "registernummer": "HRB 9858",
      "registerart": "HRB",
      "company_name": "ten Brinke Göttsch Verwaltungsgesellschaft mbH",
      "company_seat": "Bocholt",
      "details": "14.11.2024 (Bekanntmachungsdatum)\n\nNordrhein-Westfalen Amtsgericht Coesfeld HRB 9858\nRegisterbekanntmachung nach dem Umwandlungsgesetz 14.11.2024 (Eintragungsdatum)\n\nten Brinke Göttsch Verwaltungsgesellschaft mbH\nGesellschaft mit beschränkter Haftung\nBocholt\n\nDen Gläubigern der an der Verschmelzung beteiligten Rechtsträger ist, wenn sie binnen sechs Monaten nach dem Tag, an dem die Eintragung der Verschmelzung in das Register des Sitzes derjenigen Rechtsträger deren Gläubiger sie sind, nach § 19 Absatz 3 UmwG als bekanntgemacht gilt, ihren Anspruch nach Grund und Höhe schriftlich anmelden, Sicherheit zu leisten, soweit sie nicht Befriedigung verlangen können. Dieses Recht steht den Gläubigern jedoch nur zu, wenn sie glaubhaft machen, dass durch die Verschmelzung die Erfüllung ihrer Forderung gefährdet wird."
    },
    {
      "date": "2024-11-14",
      "id": "93446",
      "original_text": "Registerbekanntmachung nach dem Umwandlungsgesetz\nBayern Amtsgericht Fürth HRB 15844\nwhitespot GmbH – Heroldsberg",
      "type": "Registerbekanntmachung nach dem Umwandlungsgesetz",
      "state": "Bayern",
      "amtsgericht": "Amtsgericht Fürth",
      "registernummer": "HRB 15844",
      "registerart": "HRB",
      "company_name": "whitespot GmbH",
      "company_seat": "Heroldsberg",
      "details": "14.11.2024 (Bekanntmachungsdatum)\n\nBayern Amtsgericht Fürth HRB 15844\nRegisterbekanntmachung nach dem Umwandlungsgesetz 13.11.2024 (Eintragungsdatum)\n\nwhitespot GmbH\nGesellschaft mit beschränkter Haftung\nHeroldsberg\n\nDen Gläubigern der an der Verschmelzung beteiligten Rechtsträger ist, wenn sie binnen sechs Monaten nach dem Tag, an dem die Eintragung der Verschmelzung in das Register des Sitzes desjenigen Rechtsträgers, dessen Gläubiger sie sind, nach § 19 Abs. 3 UmwG als bekannt gemacht gilt, ihren Anspruch nach Grund und Höhe schriftlich anmelden, Sicherheit zu leisten, soweit sie nicht Befriedigung verlangen können. Dieses Recht steht den Gläubigern jedoch nur zu, wenn sie glaubhaft machen, dass durch die Verschmelzung die Erfüllung ihrer Forderung gefährdet wird."
    }
  ]
}