{
  "date": "2024-11-12",
  "date_of_scrape": "2024-11-30T13:12:29.461Z",
  "tool_version": "0.2.0",
  "number_of_announcements": 124,
  "announcements": [
    {
      "date": "2024-11-12",
      "id": "93231",
      "original_text": "Löschungsankündigung\nSchleswig-Holstein Amtsgericht Lübeck HRB 2508\n\"Tosch\" Werbeagentur GmbH – Lübeck",
      "type": "Löschungsankündigung",
      "state": "Schleswig-Holstein",
      "amtsgericht": "Amtsgericht Lübeck",
      "registernummer": "HRB 2508",
      "registerart": "HRB",
      "company_name": "\"Tosch\" Werbeagentur GmbH",
      "company_seat": "Lübeck",
      "details": "12.11.2024 (Bekanntmachungsdatum)\n\nSchleswig-Holstein Amtsgericht Lübeck HRB 2508\nLöschungsankündigung\n\n\"Tosch\" Werbeagentur GmbH\nGesellschaft mit beschränkter Haftung\nLübeck\n\nEs ist die Löschung der nachstehenden Gesellschaft wegen Vermögenslosigkeit gemäß § 394 FamFG beabsichtigt. Widerspruchsfrist: 1 Monat."
    },
    {
      "date": "2024-11-12",
      "id": "93268",
      "original_text": "Löschungsankündigung\nBremen Amtsgericht Bremen HRB 25831\nA. G. Transline GmbH – Bremen",
      "type": "Löschungsankündigung",
      "state": "Bremen",
      "amtsgericht": "Amtsgericht Bremen",
      "registernummer": "HRB 25831",
      "registerart": "HRB",
      "company_name": "A. G. Transline GmbH",
      "company_seat": "Bremen",
      "details": "12.11.2024 (Bekanntmachungsdatum)\n\nBremen Amtsgericht Bremen HRB 25831\nLöschungsankündigung\n\nA. G. Transline GmbH\nGesellschaft mit beschränkter Haftung\nBremen\n\nEs ist beabsichtigt die im Handelsregister eingetragene Gesellschaft von Amts wegen gemäß § 394 FamFG zu löschen. Gegen die Löschung kann beim AG Bremen schriftlich oder zu Protokoll der Geschäftsstelle Widerspruch eingelegt werden. Widerspruchsfrist 4 Wochen."
    },
    {
      "date": "2024-11-12",
      "id": "93269",
      "original_text": "Registerbekanntmachung nach dem Umwandlungsgesetz\nRheinland-Pfalz Amtsgericht Ludwigshafen a.Rhein (Ludwigshafen) HRB 62895\nA.C.S. Logistic GmbH – Frankenthal",
      "type": "Registerbekanntmachung nach dem Umwandlungsgesetz",
      "state": "Rheinland-Pfalz",
      "amtsgericht": "Amtsgericht Ludwigshafen a.Rhein (Ludwigshafen)",
      "registernummer": "HRB 62895",
      "registerart": "HRB",
      "company_name": "A.C.S. Logistic GmbH",
      "company_seat": "Frankenthal",
      "details": "12.11.2024 (Bekanntmachungsdatum)\n\nRheinland-Pfalz Amtsgericht Ludwigshafen a.Rhein (Ludwigshafen) HRB 62895\nRegisterbekanntmachung nach dem Umwandlungsgesetz 29.10.2024 (Eintragungsdatum)\n\nA.C.S. Logistic GmbH\nGesellschaft mit beschränkter Haftung\nFrankenthal\n\nDen Gläubigern der an dem grenzüberschreitenden Formwechsel beteiligten übernehmenden Rechtsträger ist, wenn sie binnen sechs Monaten nach dem Tag, an dem die Eintragung der Spaltung in das Register des Sitzes desjenigen Rechtsträgers, dessen Gläubiger sie sind, nach § 19 Absatz 3 UmwG als bekanntgemacht gilt, ihren Anspruch nach Grund und Höhe schriftlich anmelden, Sicherheit zu leisten, soweit sie nicht Befriedigung verlangen können.\n\nDieses Recht steht den Gläubigern jedoch nur zu, wenn sie glaubhaft machen, dass durch den Formwechsel die Erfüllung ihrer Forderung gefährdet wird."
    },
    {
      "date": "2024-11-12",
      "id": "93281",
      "original_text": "Löschungsankündigung\nNordrhein-Westfalen Amtsgericht Düren HRB 7857\nAKONA GmbH – Düren",
      "type": "Löschungsankündigung",
      "state": "Nordrhein-Westfalen",
      "amtsgericht": "Amtsgericht Düren",
      "registernummer": "HRB 7857",
      "registerart": "HRB",
      "company_name": "AKONA GmbH",
      "company_seat": "Düren",
      "details": "12.11.2024 (Bekanntmachungsdatum)\n\nNordrhein-Westfalen Amtsgericht Düren HRB 7857\nLöschungsankündigung\n\nAKONA GmbH\nGesellschaft mit beschränkter Haftung\nDüren\n\nDas Registergericht beabsichtigt die Gesellschaft von Amts wegen nach § 394 FamFG zu löschen. Die Frist zur Erhebung eines Widerspruchs ist auf drei Monate festgesetzt."
    },
    {
      "date": "2024-11-12",
      "id": "93299",
      "original_text": "Registerbekanntmachung nach dem Umwandlungsgesetz\nHessen Amtsgericht Frankfurt am Main HRB 115394\nANHK GmbH – Frankfurt am Main",
      "type": "Registerbekanntmachung nach dem Umwandlungsgesetz",
      "state": "Hessen",
      "amtsgericht": "Amtsgericht Frankfurt am Main",
      "registernummer": "HRB 115394",
      "registerart": "HRB",
      "company_name": "ANHK GmbH",
      "company_seat": "Frankfurt am Main",
      "details": "12.11.2024 (Bekanntmachungsdatum)\n\nHessen Amtsgericht Frankfurt am Main HRB 115394\nRegisterbekanntmachung nach dem Umwandlungsgesetz 12.11.2024 (Eintragungsdatum)\n\nANHK GmbH\nGesellschaft mit beschränkter Haftung\nFrankfurt am Main\n\nDen Gläubigern der an der Verschmelzung beteiligten Rechtsträger ist, wenn sie binnen sechs Monaten nach dem Tag, an dem die Eintragung der Verschmelzung in das Register des Sitzes desjenigen Rechtsträgers, dessen Gläubiger sie sind, nach § 19 Absatz 3 UmwG bekannt gemacht worden ist, ihren Anspruch nach Grund und Höhe schriftlich anmelden, Sicherheit zu leisten, soweit sie nicht Befriedigung verlangen können. Dieses Recht steht den Gläubigern jedoch nur zu, wenn sie glaubhaft machen, dass durch die Verschmelzung die Erfüllung ihrer Forderung gefährdet wird."
    },
    {
      "date": "2024-11-12",
      "id": "93199",
      "original_text": "Registerbekanntmachung nach dem Umwandlungsgesetz\nBayern Amtsgericht München HRB 221100\nAURELIUS Equity Opportunities SE & Co. KGaA – Grünwald",
      "type": "Registerbekanntmachung nach dem Umwandlungsgesetz",
      "state": "Bayern",
      "amtsgericht": "Amtsgericht München",
      "registernummer": "HRB 221100",
      "registerart": "HRB",
      "company_name": "AURELIUS Equity Opportunities SE & Co. KGaA",
      "company_seat": "Grünwald",
      "details": "12.11.2024 (Bekanntmachungsdatum)\n\nBayern Amtsgericht München HRB 221100\nRegisterbekanntmachung nach dem Umwandlungsgesetz 11.11.2024 (Eintragungsdatum)\n\nAURELIUS Equity Opportunities SE & Co. KGaA\nKommanditgesellschaft auf Aktien\nGrünwald\n\nDen Gläubigern der an der Verschmelzung beteiligten Rechtsträger ist, wenn sie binnen sechs Monaten nach dem Tag, an dem die Eintragung der Verschmelzung in das Register des Sitzes desjenigen Rechtsträgers, dessen Gläubiger sie sind, nach § 19 Abs. 3 UmwG als bekannt gemacht gilt, ihren Anspruch nach Grund und Höhe schriftlich anmelden, Sicherheit zu leisten, soweit sie nicht Befriedigung verlangen können. Dieses Recht steht den Gläubigern jedoch nur zu, wenn sie glaubhaft machen, dass durch die Verschmelzung die Erfüllung ihrer Forderung gefährdet wird."
    },
    {
      "date": "2024-11-12",
      "id": "93240",
      "original_text": "Registerbekanntmachung nach dem Umwandlungsgesetz\nBaden-Württemberg Amtsgericht Stuttgart HRB 746011\nAVL Finanzvermittlung Beteiligungen GmbH – Weinstadt",
      "type": "Registerbekanntmachung nach dem Umwandlungsgesetz",
      "state": "Baden-Württemberg",
      "amtsgericht": "Amtsgericht Stuttgart",
      "registernummer": "HRB 746011",
      "registerart": "HRB",
      "company_name": "AVL Finanzvermittlung Beteiligungen GmbH",
      "company_seat": "Weinstadt",
      "details": "12.11.2024 (Bekanntmachungsdatum)\n\nBaden-Württemberg Amtsgericht Stuttgart HRB 746011\nRegisterbekanntmachung nach dem Umwandlungsgesetz 12.11.2024 (Eintragungsdatum)\n\nAVL Finanzvermittlung Beteiligungen GmbH\nGesellschaft mit beschränkter Haftung\nWeinstadt\n\nAls nicht eingetragen wird bekanntgemacht:\nDen Gläubigern der an der Verschmelzung beteiligten Rechtsträger ist, wenn sie binnen sechs Monaten nach dem Tag, an dem die Eintragung der Verschmelzung in das Register des Sitzes desjenigen Rechtsträgers, dessen Gläubiger sie sind, nach § 19 Abs. 3 UmwG als bekanntgemacht gilt, ihren Anspruch nach Grund und Höhe schriftlich anmelden, Sicherheit zu leisten, soweit sie nicht Befriedigung verlangen können. Dieses Recht steht den Gläubigern jedoch nur zu, wenn sie glaubhaft machen, dass durch die Verschmelzung die Erfüllung ihrer Forderung gefährdet wird."
    },
    {
      "date": "2024-11-12",
      "id": "93196",
      "original_text": "Einreichung neuer Dokumente\nBayern Amtsgericht München HRB 215844\nAirbus Bank GmbH – München",
      "type": "Einreichung neuer Dokumente",
      "state": "Bayern",
      "amtsgericht": "Amtsgericht München",
      "registernummer": "HRB 215844",
      "registerart": "HRB",
      "company_name": "Airbus Bank GmbH",
      "company_seat": "München",
      "details": "12.11.2024 (Bekanntmachungsdatum)\n\nBayern Amtsgericht München HRB 215844\nEinreichung neuer Dokumente 11.11.2024 (Eintragungsdatum)\n\nAirbus Bank GmbH\nGesellschaft mit beschränkter Haftung\nMünchen\n\nDem Amtsgericht München -Registergericht- ist eine Liste der Mitglieder des Aufsichtsrats eingereicht worden, § 52 Abs. 3 S. 2 GmbHG."
    },
    {
      "date": "2024-11-12",
      "id": "93243",
      "original_text": "Registerbekanntmachung nach dem Umwandlungsgesetz\nSchleswig-Holstein Amtsgericht Pinneberg HRB 1410 IZ\nArchitekturbüro Dipl.-Ing. Khalil GmbH – Kellinghusen",
      "type": "Registerbekanntmachung nach dem Umwandlungsgesetz",
      "state": "Schleswig-Holstein",
      "amtsgericht": "Amtsgericht Pinneberg",
      "registernummer": "HRB 1410 IZ",
      "registerart": "HRB",
      "company_name": "Architekturbüro Dipl.-Ing. Khalil GmbH",
      "company_seat": "Kellinghusen",
      "details": "12.11.2024 (Bekanntmachungsdatum)\n\nSchleswig-Holstein Amtsgericht Pinneberg HRB 1410 IZ\nRegisterbekanntmachung nach dem Umwandlungsgesetz 07.11.2024 (Eintragungsdatum)\n\nArchitekturbüro Dipl.-Ing. Khalil GmbH\nGesellschaft mit beschränkter Haftung\nKellinghusen\n\nZu Eintragungsnummer 3 vom 07.11.2024 wird als nicht eingetragen veröffentlicht: Den Gläubigern der an der Verschmelzung beteiligten Rechtsträger ist, wenn sie binnen sechs Monaten nach dem Tag, an dem die Eintragung der Verschmelzung in das Register des Sitzes desjenigen Rechtsträgers, dessen Gläubiger sie sind, als bekannt gemacht gilt, ihren Anspruch nach Grund und Höhe schriftlich anmelden, Sicherheit zu leisten, soweit sie nicht Befriedigung verlangen können. Dieses Recht steht den Gläubigern jedoch nur zu, wenn sie glaubhaft machen, dass durch die Verschmelzung die Erfüllung ihrer Forderung gefährdet wird. Das Recht, Sicherheitsleistung zu verlangen, steht Gläubigern nicht zu, die im Falle der Insolvenz ein Recht auf vorzugsweise Befriedigung aus einer Deckungsmasse haben, die nach gesetzlicher Vorschrift zu ihrem Schutz errichtet und staatlich überwacht ist."
    },
    {
      "date": "2024-11-12",
      "id": "93239",
      "original_text": "Registerbekanntmachung nach dem Umwandlungsgesetz\nBerlin Amtsgericht Berlin (Charlottenburg) HRB 60146\nAriston Vertriebs GmbH – Berlin",
      "type": "Registerbekanntmachung nach dem Umwandlungsgesetz",
      "state": "Berlin",
      "amtsgericht": "Amtsgericht Berlin (Charlottenburg)",
      "registernummer": "HRB 60146",
      "registerart": "HRB",
      "company_name": "Ariston Vertriebs GmbH",
      "company_seat": "Berlin",
      "details": "12.11.2024 (Bekanntmachungsdatum)\n\nBerlin Amtsgericht Berlin (Charlottenburg) HRB 60146\nRegisterbekanntmachung nach dem Umwandlungsgesetz 11.11.2024 (Eintragungsdatum)\n\nAriston Vertriebs GmbH\nGesellschaft mit beschränkter Haftung\nBerlin\n\nZu Eintragungsnummer 10 vom 11.11.2024 wird als nicht eingetragen veröffentlicht: Den Gläubigern der an der Verschmelzung beteiligten Rechtsträger ist, wenn sie binnen sechs Monaten nach dem Tag, an dem die Eintragung der Verschmelzung in das Register des Sitzes desjenigen Rechtsträgers, dessen Gläubiger sie sind, als bekannt gemacht gilt, ihren Anspruch nach Grund und Höhe schriftlich anmelden, Sicherheit zu leisten, soweit sie nicht Befriedigung verlangen können. Dieses Recht steht den Gläubigern jedoch nur zu, wenn sie glaubhaft machen, dass durch die Verschmelzung die Erfüllung ihrer Forderung gefährdet wird. Das Recht, Sicherheitsleistung zu verlangen, steht Gläubigern nicht zu, die im Falle der Insolvenz ein Recht auf vorzugsweise Befriedigung aus einer Deckungsmasse haben, die nach gesetzlicher Vorschrift zu ihrem Schutz errichtet und staatlich überwacht ist."
    },
    {
      "date": "2024-11-12",
      "id": "93180",
      "original_text": "Registerbekanntmachung nach dem Umwandlungsgesetz\nBayern Amtsgericht München HRB 272719\nAutohaus Wickenhäuser GmbH – München",
      "type": "Registerbekanntmachung nach dem Umwandlungsgesetz",
      "state": "Bayern",
      "amtsgericht": "Amtsgericht München",
      "registernummer": "HRB 272719",
      "registerart": "HRB",
      "company_name": "Autohaus Wickenhäuser GmbH",
      "company_seat": "München",
      "details": "12.11.2024 (Bekanntmachungsdatum)\n\nBayern Amtsgericht München HRB 272719\nRegisterbekanntmachung nach dem Umwandlungsgesetz 11.11.2024 (Eintragungsdatum)\n\nAutohaus Wickenhäuser GmbH\nGesellschaft mit beschränkter Haftung\nMünchen\n\nDen Gläubigern der an der Verschmelzung beteiligten Rechtsträger ist, wenn sie binnen sechs Monaten nach dem Tag, an dem die Eintragung der Verschmelzung in das Register des Sitzes desjenigen Rechtsträgers, dessen Gläubiger sie sind, nach § 19 Abs. 3 UmwG als bekannt gemacht gilt, ihren Anspruch nach Grund und Höhe schriftlich anmelden, Sicherheit zu leisten, soweit sie nicht Befriedigung verlangen können. Dieses Recht steht den Gläubigern jedoch nur zu, wenn sie glaubhaft machen, dass durch die Verschmelzung die Erfüllung ihrer Forderung gefährdet wird."
    },
    {
      "date": "2024-11-12",
      "id": "93293",
      "original_text": "Einreichung neuer Dokumente\nHessen Amtsgericht Fritzlar HRB 12403\nB. Braun SE – Melsungen",
      "type": "Einreichung neuer Dokumente",
      "state": "Hessen",
      "amtsgericht": "Amtsgericht Fritzlar",
      "registernummer": "HRB 12403",
      "registerart": "HRB",
      "company_name": "B. Braun SE",
      "company_seat": "Melsungen",
      "details": "12.11.2024 (Bekanntmachungsdatum)\n\nHessen Amtsgericht Fritzlar HRB 12403\nEinreichung neuer Dokumente 12.11.2024 (Eintragungsdatum)\n\nB. Braun SE\nEuropäische Aktiengesellschaft (SE)\nMelsungen\n\nDurch eine Änderung in den Personen der Aufsichtsratsmitglieder ist eine Liste der Mitglieder des Aufsichtsrates zum Handelsregister eingereicht worden."
    },
    {
      "date": "2024-11-12",
      "id": "93292",
      "original_text": "Löschungsankündigung\nNordrhein-Westfalen Amtsgericht Dortmund HRB 28847\nBHSZ GmbH – Dortmund",
      "type": "Löschungsankündigung",
      "state": "Nordrhein-Westfalen",
      "amtsgericht": "Amtsgericht Dortmund",
      "registernummer": "HRB 28847",
      "registerart": "HRB",
      "company_name": "BHSZ GmbH",
      "company_seat": "Dortmund",
      "details": "12.11.2024 (Bekanntmachungsdatum)\n\nNordrhein-Westfalen Amtsgericht Dortmund HRB 28847\nLöschungsankündigung 12.11.2024 (Eintragungsdatum)\n\nBHSZ GmbH\nGesellschaft mit beschränkter Haftung\nDortmund\n\nDas Registergericht beabsichtigt die Gesellschaft von Amts wegen nach § 394 FamFG zu löschen. Die Frist zur Erhebung eines Widerspruchs ist auf zwei Monate festgesetzt."
    },
    {
      "date": "2024-11-12",
      "id": "93273",
      "original_text": "Löschungsankündigung\nRheinland-Pfalz Amtsgericht Wittlich HRB 43571\nBL Financial Solutions GmbH – Sehlem",
      "type": "Löschungsankündigung",
      "state": "Rheinland-Pfalz",
      "amtsgericht": "Amtsgericht Wittlich",
      "registernummer": "HRB 43571",
      "registerart": "HRB",
      "company_name": "BL Financial Solutions GmbH",
      "company_seat": "Sehlem",
      "details": "12.11.2024 (Bekanntmachungsdatum)\n\nRheinland-Pfalz Amtsgericht Wittlich HRB 43571\nLöschungsankündigung 12.11.2024 (Eintragungsdatum)\n\nBL Financial Solutions GmbH\nGesellschaft mit beschränkter Haftung\nSehlem\n\nDas Registergericht beabsichtigt die Gesellschaft von Amts wegen nach § 394 FamFG zu löschen. Die Frist zur Erhebung eines Widerspruchs ist auf einen Monat festgesetzt."
    },
    {
      "date": "2024-11-12",
      "id": "93194",
      "original_text": "Löschungsankündigung\nBayern Amtsgericht München HRB 183400\nBLK GmbH – Puchheim",
      "type": "Löschungsankündigung",
      "state": "Bayern",
      "amtsgericht": "Amtsgericht München",
      "registernummer": "HRB 183400",
      "registerart": "HRB",
      "company_name": "BLK GmbH",
      "company_seat": "Puchheim",
      "details": "12.11.2024 (Bekanntmachungsdatum)\n\nBayern Amtsgericht München HRB 183400\nLöschungsankündigung 11.11.2024 (Eintragungsdatum)\n\nBLK GmbH\nGesellschaft mit beschränkter Haftung\nPuchheim\n\nDas Registergericht beabsichtigt, die im Handelsregister eingetragene Gesellschaft wegen Vermögenslosigkeit von Amts wegen nach § 394 FamFG zu löschen. Die Frist zur Erhebung eines Widerspruchs ist auf drei Monate festgesetzt."
    },
    {
      "date": "2024-11-12",
      "id": "93303",
      "original_text": "Einreichung neuer Dokumente\nHessen Amtsgericht Frankfurt am Main HRB 80499\nBetriebs-Center für Banken AG – Frankfurt am Main",
      "type": "Einreichung neuer Dokumente",
      "state": "Hessen",
      "amtsgericht": "Amtsgericht Frankfurt am Main",
      "registernummer": "HRB 80499",
      "registerart": "HRB",
      "company_name": "Betriebs-Center für Banken AG",
      "company_seat": "Frankfurt am Main",
      "details": "12.11.2024 (Bekanntmachungsdatum)\n\nHessen Amtsgericht Frankfurt am Main HRB 80499\nEinreichung neuer Dokumente\n\nBetriebs-Center für Banken AG\nAktiengesellschaft\nFrankfurt am Main\n\nDurch eine Änderung in den Personen der Aufsichtsratsmitglieder ist eine Liste der Mitglieder des Aufsichtsrates zum Handelsregister eingereicht worden."
    },
    {
      "date": "2024-11-12",
      "id": "93222",
      "original_text": "Registerbekanntmachung nach dem Umwandlungsgesetz\nSaarland Amtsgericht Saarbrücken HRB 108889\nCS Event GmbH – St. Wendel",
      "type": "Registerbekanntmachung nach dem Umwandlungsgesetz",
      "state": "Saarland",
      "amtsgericht": "Amtsgericht Saarbrücken",
      "registernummer": "HRB 108889",
      "registerart": "HRB",
      "company_name": "CS Event GmbH",
      "company_seat": "St. Wendel",
      "details": "12.11.2024 (Bekanntmachungsdatum)\n\nSaarland Amtsgericht Saarbrücken HRB 108889\nRegisterbekanntmachung nach dem Umwandlungsgesetz 12.11.2024 (Eintragungsdatum)\n\nCS Event GmbH\nGesellschaft mit beschränkter Haftung\nSt. Wendel\n\nAls nicht eingetragen wird bekannt gemacht: Den Gläubigern der an der Verschmelzung beteiligten Gesellschaften ist, wenn sie binnen sechs Monaten nach dem Tag, an dem die Eintragung der Verschmelzung in das Register des Sitzes desjenigen Rechtsträgers, dessen Gläubiger sie sind, nach § 19 Absatz 3 UmwG bekannt gemacht worden ist, ihren Anspruch nach Grund und Höhe schriftlich anmelden, Sicherheit zu leisten, soweit sie nicht Befriedigung verlangen können. Dieses Recht steht den Gläubigern jedoch nur zu, wenn sie glaubhaft machen, dass durch die Verschmelzung die Erfüllung ihrer Forderung gefährdet wird."
    },
    {
      "date": "2024-11-12",
      "id": "93223",
      "original_text": "Registerbekanntmachung nach dem Umwandlungsgesetz\nSaarland Amtsgericht Saarbrücken HRB 108877\nCS Event GmbH – St. Wendel",
      "type": "Registerbekanntmachung nach dem Umwandlungsgesetz",
      "state": "Saarland",
      "amtsgericht": "Amtsgericht Saarbrücken",
      "registernummer": "HRB 108877",
      "registerart": "HRB",
      "company_name": "CS Event GmbH",
      "company_seat": "St. Wendel",
      "details": "12.11.2024 (Bekanntmachungsdatum)\n\nSaarland Amtsgericht Saarbrücken HRB 108877\nRegisterbekanntmachung nach dem Umwandlungsgesetz 12.11.2024 (Eintragungsdatum)\n\nCS Event GmbH\nGesellschaft mit beschränkter Haftung\nSt. Wendel\n\nAls nicht eingetragen wird bekannt gemacht: Den Gläubigern der an der Verschmelzung beteiligten Gesellschaften ist, wenn sie binnen sechs Monaten nach dem Tag, an dem die Eintragung der Verschmelzung in das Register des Sitzes desjenigen Rechtsträgers, dessen Gläubiger sie sind, nach § 19 Absatz 3 UmwG bekannt gemacht worden ist, ihren Anspruch nach Grund und Höhe schriftlich anmelden, Sicherheit zu leisten, soweit sie nicht Befriedigung verlangen können. Dieses Recht steht den Gläubigern jedoch nur zu, wenn sie glaubhaft machen, dass durch die Verschmelzung die Erfüllung ihrer Forderung gefährdet wird."
    },
    {
      "date": "2024-11-12",
      "id": "93235",
      "original_text": "Löschungsankündigung\nBerlin Amtsgericht Berlin (Charlottenburg) HRB 184908\nCafé Mugrabi UG (haftungsbeschränkt) – Berlin",
      "type": "Löschungsankündigung",
      "state": "Berlin",
      "amtsgericht": "Amtsgericht Berlin (Charlottenburg)",
      "registernummer": "HRB 184908",
      "registerart": "HRB",
      "company_name": "Café Mugrabi UG (haftungsbeschränkt)",
      "company_seat": "Berlin",
      "details": "12.11.2024 (Bekanntmachungsdatum)\n\nBerlin Amtsgericht Berlin (Charlottenburg) HRB 184908\nLöschungsankündigung\n\nCafé Mugrabi UG (haftungsbeschränkt)\nGesellschaft mit beschränkter Haftung\nBerlin\n\nEs ist beabsichtigt, die Eintragung des Geschäftsführers Guy Balassiano wegen Mangels einer wesentlichen Voraussetzung gemäß § 395 Abs. 2 FamFG von Amts wegen zu löschen. Widerspruchsfrist 6 Wochen"
    },
    {
      "date": "2024-11-12",
      "id": "93264",
      "original_text": "Registerbekanntmachung nach dem Umwandlungsgesetz\nNiedersachsen Amtsgericht Hildesheim HRB 207196\nCare Academy GmbH – Hildesheim",
      "type": "Registerbekanntmachung nach dem Umwandlungsgesetz",
      "state": "Niedersachsen",
      "amtsgericht": "Amtsgericht Hildesheim",
      "registernummer": "HRB 207196",
      "registerart": "HRB",
      "company_name": "Care Academy GmbH",
      "company_seat": "Hildesheim",
      "details": "12.11.2024 (Bekanntmachungsdatum)\n\nNiedersachsen Amtsgericht Hildesheim HRB 207196\nRegisterbekanntmachung nach dem Umwandlungsgesetz 12.11.2024 (Eintragungsdatum)\n\nCare Academy GmbH\nGesellschaft mit beschränkter Haftung\nHildesheim\n\nDen Gläubigern der an der Verschmelzung beteiligten Rechtsträger ist, wenn sie binnen sechs Monaten nach dem Tag, an dem die Eintragung der Verschmelzung in das Register des Sitzes desjenigen Rechtsträgers, dessen Gläubiger sie sind, nach § 19  Abs.  3 UmwG als bekannt gemacht gilt, ihren Anspruch nach Grund und Höhe schriftlich anmelden, Sicherheit zu leisten, soweit sie nicht Befriedigung verlangen können. Dieses Recht steht den Gläubigern jedoch nur zu, wenn sie glaubhaft machen, dass durch die Verschmelzung die Erfüllung der Forderung gefährdet wird."
    },
    {
      "date": "2024-11-12",
      "id": "93297",
      "original_text": "Registerbekanntmachung nach dem Umwandlungsgesetz\nHessen Amtsgericht Frankfurt am Main HRB 111708\nCastanea Rubra Assets GmbH – Frankfurt am Main",
      "type": "Registerbekanntmachung nach dem Umwandlungsgesetz",
      "state": "Hessen",
      "amtsgericht": "Amtsgericht Frankfurt am Main",
      "registernummer": "HRB 111708",
      "registerart": "HRB",
      "company_name": "Castanea Rubra Assets GmbH",
      "company_seat": "Frankfurt am Main",
      "details": "12.11.2024 (Bekanntmachungsdatum)\n\nHessen Amtsgericht Frankfurt am Main HRB 111708\nRegisterbekanntmachung nach dem Umwandlungsgesetz 12.11.2024 (Eintragungsdatum)\n\nCastanea Rubra Assets GmbH\nGesellschaft mit beschränkter Haftung\nFrankfurt am Main\n\nDen Gläubigern der an der Verschmelzung beteiligten Rechtsträger ist, wenn sie binnen sechs Monaten nach dem Tag, an dem die Eintragung der Verschmelzung in das Register des Sitzes desjenigen Rechtsträgers, dessen Gläubiger sie sind, nach § 19 Absatz 3 UmwG bekannt gemacht worden ist, ihren Anspruch nach Grund und Höhe schriftlich anmelden, Sicherheit zu leisten, soweit sie nicht Befriedigung verlangen können. Dieses Recht steht den Gläubigern jedoch nur zu, wenn sie glaubhaft machen, dass durch die Verschmelzung die Erfüllung ihrer Forderung gefährdet wird."
    },
    {
      "date": "2024-11-12",
      "id": "93228",
      "original_text": "Sonstige Registerbekanntmachung\nBerlin Amtsgericht Berlin (Charlottenburg) HRB 179568\nCellbricks GmbH – Berlin",
      "type": "Sonstige Registerbekanntmachung",
      "state": "Berlin",
      "amtsgericht": "Amtsgericht Berlin (Charlottenburg)",
      "registernummer": "HRB 179568",
      "registerart": "HRB",
      "company_name": "Cellbricks GmbH",
      "company_seat": "Berlin",
      "details": "12.11.2024 (Bekanntmachungsdatum)\n\nBerlin Amtsgericht Berlin (Charlottenburg) HRB 179568\nSonstige Registerbekanntmachung\n\nCellbricks GmbH\nGesellschaft mit beschränkter Haftung\nBerlin\n\nAls nicht eingetragen wird veröffentlicht: Es wurde eine neue Liste der Beiratsmitglieder eingereicht (§52 GmbHG)."
    },
    {
      "date": "2024-11-12",
      "id": "93208",
      "original_text": "Sonstige Registerbekanntmachung\nBaden-Württemberg Amtsgericht Mannheim HRB 733251\nCloudRail GmbH – Mannheim",
      "type": "Sonstige Registerbekanntmachung",
      "state": "Baden-Württemberg",
      "amtsgericht": "Amtsgericht Mannheim",
      "registernummer": "HRB 733251",
      "registerart": "HRB",
      "company_name": "CloudRail GmbH",
      "company_seat": "Mannheim",
      "details": "12.11.2024 (Bekanntmachungsdatum)\n\nBaden-Württemberg Amtsgericht Mannheim HRB 733251\nSonstige Registerbekanntmachung 11.11.2024 (Eintragungsdatum)\n\nCloudRail GmbH\nGesellschaft mit beschränkter Haftung\nMannheim\n\nAls nicht eingetragen wird bekanntgemacht:\nDen Gläubigern der Gesellschaft, deren Forderungen begründet worden sind, bevor die Eintragung der Beendigung des Vertrages in das Handelsregister nach § 10 HGB als bekanntgemacht gilt, ist vom anderen Vertragsteil Sicherheit zu leisten, wenn sie sich binnen sechs Monaten nach der Bekanntmachung zu diesem Zweck bei ihm melden."
    },
    {
      "date": "2024-11-12",
      "id": "93258",
      "original_text": "Löschungsankündigung\nSachsen Amtsgericht Dresden HRB 19334\nCompact Transport GmbH – Dresden",
      "type": "Löschungsankündigung",
      "state": "Sachsen",
      "amtsgericht": "Amtsgericht Dresden",
      "registernummer": "HRB 19334",
      "registerart": "HRB",
      "company_name": "Compact Transport GmbH",
      "company_seat": "Dresden",
      "details": "12.11.2024 (Bekanntmachungsdatum)\n\nSachsen Amtsgericht Dresden HRB 19334\nLöschungsankündigung\n\nCompact Transport GmbH\nGesellschaft mit beschränkter Haftung\nDresden\n\nDas Registergericht beabsichtigt, die im Handelsregister eingetragene Gesellschaft von Amts wegen nach § 394 FamFG zu löschen. Die Frist zu Erhebung eines Widerspruchs gegen die beabsichtigte Löschung wird auf einen Monat festgesetzt."
    },
    {
      "date": "2024-11-12",
      "id": "93192",
      "original_text": "Registerbekanntmachung nach dem Umwandlungsgesetz\nBayern Amtsgericht München HRB 282455\nDFI Holding GmbH – München",
      "type": "Registerbekanntmachung nach dem Umwandlungsgesetz",
      "state": "Bayern",
      "amtsgericht": "Amtsgericht München",
      "registernummer": "HRB 282455",
      "registerart": "HRB",
      "company_name": "DFI Holding GmbH",
      "company_seat": "München",
      "details": "12.11.2024 (Bekanntmachungsdatum)\n\nBayern Amtsgericht München HRB 282455\nRegisterbekanntmachung nach dem Umwandlungsgesetz 11.11.2024 (Eintragungsdatum)\n\nDFI Holding GmbH\nGesellschaft mit beschränkter Haftung\nMünchen\n\nDen Gläubigern der an der Verschmelzung beteiligten Rechtsträger ist, wenn sie binnen sechs Monaten nach dem Tag, an dem die Eintragung der Verschmelzung in das Register des Sitzes desjenigen Rechtsträgers, dessen Gläubiger sie sind, nach § 19 Abs. 3 UmwG als bekannt gemacht gilt, ihren Anspruch nach Grund und Höhe schriftlich anmelden, Sicherheit zu leisten, soweit sie nicht Befriedigung verlangen können. Dieses Recht steht den Gläubigern jedoch nur zu, wenn sie glaubhaft machen, dass durch die Verschmelzung die Erfüllung ihrer Forderung gefährdet wird."
    },
    {
      "date": "2024-11-12",
      "id": "93300",
      "original_text": "Löschungsankündigung\nHessen Amtsgericht Offenbach am Main HRB 51076\nDV Frankfurt GmbH – Neu-Isenburg",
      "type": "Löschungsankündigung",
      "state": "Hessen",
      "amtsgericht": "Amtsgericht Offenbach am Main",
      "registernummer": "HRB 51076",
      "registerart": "HRB",
      "company_name": "DV Frankfurt GmbH",
      "company_seat": "Neu-Isenburg",
      "details": "12.11.2024 (Bekanntmachungsdatum)\n\nHessen Amtsgericht Offenbach am Main HRB 51076\nLöschungsankündigung\n\nDV Frankfurt GmbH\nGesellschaft mit beschränkter Haftung\nNeu-Isenburg\n\nDas Registergericht beabsichtigt die im Handelsregister eingetragene Geselslchaft von Amts wegen nach § 394 FamFG zu löschen. Die Frist zur Erhebung eines Widerspruchs gegen die beabsichtigte Löschung wird auf 3 Monate festgesetzt."
    },
    {
      "date": "2024-11-12",
      "id": "93197",
      "original_text": "Registerbekanntmachung nach dem Umwandlungsgesetz\nBayern Amtsgericht Nürnberg HRB 32520\nDeutsche Gastransport Holding GmbH – Schwaig b. Nürnberg",
      "type": "Registerbekanntmachung nach dem Umwandlungsgesetz",
      "state": "Bayern",
      "amtsgericht": "Amtsgericht Nürnberg",
      "registernummer": "HRB 32520",
      "registerart": "HRB",
      "company_name": "Deutsche Gastransport Holding GmbH",
      "company_seat": "Schwaig b. Nürnberg",
      "details": "12.11.2024 (Bekanntmachungsdatum)\n\nBayern Amtsgericht Nürnberg HRB 32520\nRegisterbekanntmachung nach dem Umwandlungsgesetz 11.11.2024 (Eintragungsdatum)\n\nDeutsche Gastransport Holding GmbH\nGesellschaft mit beschränkter Haftung\nSchwaig b. Nürnberg\n\nDen Gläubigern der an der Verschmelzung beteiligten Rechtsträger ist, wenn sie binnen sechs Monaten nach dem Tag, an dem die Eintragung der Verschmelzung in das Register des Sitzes desjenigen Rechtsträgers, dessen Gläubiger sie sind, nach § 19 Abs. 3 UmwG als bekannt gemacht gilt, ihren Anspruch nach Grund und Höhe schriftlich anmelden, Sicherheit zu leisten, soweit sie nicht Befriedigung verlangen können. Dieses Recht steht den Gläubigern jedoch nur zu, wenn sie glaubhaft machen, dass durch die Verschmelzung die Erfüllung ihrer Forderung gefährdet wird."
    },
    {
      "date": "2024-11-12",
      "id": "93254",
      "original_text": "Löschungsankündigung\nSachsen Amtsgericht Dresden HRB 37113\nDeutsche Kraftwerks- und Umwelttechnologie GmbH – Dresden",
      "type": "Löschungsankündigung",
      "state": "Sachsen",
      "amtsgericht": "Amtsgericht Dresden",
      "registernummer": "HRB 37113",
      "registerart": "HRB",
      "company_name": "Deutsche Kraftwerks- und Umwelttechnologie GmbH",
      "company_seat": "Dresden",
      "details": "12.11.2024 (Bekanntmachungsdatum)\n\nSachsen Amtsgericht Dresden HRB 37113\nLöschungsankündigung\n\nDeutsche Kraftwerks- und Umwelttechnologie GmbH\nGesellschaft mit beschränkter Haftung\nDresden\n\nDas Registergericht beabsichtigt, die im Handelsregister eingetragene Gesellschaft von Amts wegen nach § 394 FamFG zu löschen. Die Frist zu Erhebung eines Widerspruchs gegen die beabsichtigte Löschung wird auf einen Monat festgesetzt."
    },
    {
      "date": "2024-11-12",
      "id": "93226",
      "original_text": "Löschungsankündigung\nThüringen Amtsgericht Jena HRB 113893\nDrachenschmiede Restaurierungen GmbH – Luisenthal",
      "type": "Löschungsankündigung",
      "state": "Thüringen",
      "amtsgericht": "Amtsgericht Jena",
      "registernummer": "HRB 113893",
      "registerart": "HRB",
      "company_name": "Drachenschmiede Restaurierungen GmbH",
      "company_seat": "Luisenthal",
      "details": "12.11.2024 (Bekanntmachungsdatum)\n\nThüringen Amtsgericht Jena HRB 113893\nLöschungsankündigung\n\nDrachenschmiede Restaurierungen GmbH\nGesellschaft mit beschränkter Haftung\nLuisenthal\n\nDas Registergericht beabsichtigt, die im Handelsregister eingetragene Gesellschaft wegen Vermögenslosigkeit nach § 394 FamFG von Amts wegen zu löschen. Die Frist zur Erhebung eines Widerspruchs gegen die beabsichtigte Löschung wird auf 6 Wochen festgesetzt."
    },
    {
      "date": "2024-11-12",
      "id": "93285",
      "original_text": "Registerbekanntmachung nach dem Umwandlungsgesetz\nNordrhein-Westfalen Amtsgericht Dortmund HRB 35873\nEDEL X Bau GmbH – Dortmund",
      "type": "Registerbekanntmachung nach dem Umwandlungsgesetz",
      "state": "Nordrhein-Westfalen",
      "amtsgericht": "Amtsgericht Dortmund",
      "registernummer": "HRB 35873",
      "registerart": "HRB",
      "company_name": "EDEL X Bau GmbH",
      "company_seat": "Dortmund",
      "details": "12.11.2024 (Bekanntmachungsdatum)\n\nNordrhein-Westfalen Amtsgericht Dortmund HRB 35873\nRegisterbekanntmachung nach dem Umwandlungsgesetz 08.11.2024 (Eintragungsdatum)\n\nEDEL X Bau GmbH\nGesellschaft mit beschränkter Haftung\nDortmund\n\nDen Gläubigern der an der Ausgliederung beteiligten Rechtsträger ist, wenn sie binnen sechs Monaten nach dem Tag, an dem die Eintragung der Ausgliederung in das Register des Sitzes desjenigen Rechtsträgers, dessen Gläubiger sie sind, nach § 19 Absatz 3 UmwG als bekanntgemacht gilt, ihren Anspruch nach Grund und Höhe schriftlich anmelden, Sicherheit zu leisten, soweit sie nicht Befriedigung verlangen können. Dieses Recht steht den Gläubigern jedoch nur zu, wenn sie glaubhaft machen, dass durch die Ausgliederung die Erfüllung ihrer Forderung gefährdet wird."
    },
    {
      "date": "2024-11-12",
      "id": "93275",
      "original_text": "Einreichung neuer Dokumente\nNordrhein-Westfalen Amtsgericht Mönchengladbach HRB 8152\nEGN Entsorgungsgesellschaft Niederrhein mbH – Viersen",
      "type": "Einreichung neuer Dokumente",
      "state": "Nordrhein-Westfalen",
      "amtsgericht": "Amtsgericht Mönchengladbach",
      "registernummer": "HRB 8152",
      "registerart": "HRB",
      "company_name": "EGN Entsorgungsgesellschaft Niederrhein mbH",
      "company_seat": "Viersen",
      "details": "12.11.2024 (Bekanntmachungsdatum)\n\nNordrhein-Westfalen Amtsgericht Mönchengladbach HRB 8152\nEinreichung neuer Dokumente\n\nEGN Entsorgungsgesellschaft Niederrhein mbH\nGesellschaft mit beschränkter Haftung\nViersen\n\nDem Registergericht ist eine neue Liste der Mitglieder des Aufsichtsrates eingereicht worden."
    },
    {
      "date": "2024-11-12",
      "id": "93213",
      "original_text": "Löschungsankündigung\nBrandenburg Amtsgericht Potsdam HRB 33944\nELDEF Baumangement GmbH – Ludwigsfelde",
      "type": "Löschungsankündigung",
      "state": "Brandenburg",
      "amtsgericht": "Amtsgericht Potsdam",
      "registernummer": "HRB 33944",
      "registerart": "HRB",
      "company_name": "ELDEF Baumangement GmbH",
      "company_seat": "Ludwigsfelde",
      "details": "12.11.2024 (Bekanntmachungsdatum)\n\nBrandenburg Amtsgericht Potsdam HRB 33944\nLöschungsankündigung\n\nELDEF Baumangement GmbH\nGesellschaft mit beschränkter Haftung\nLudwigsfelde\n\nBei der nachstehenden Gesellschaft wird das Amtslöschungsverfahren gemäß § 394 FamFG eingeleitet. Widerspruchsfrist 8 Wochen."
    },
    {
      "date": "2024-11-12",
      "id": "93186",
      "original_text": "Registerbekanntmachung nach dem Umwandlungsgesetz\nBayern Amtsgericht München HRB 282456\nEverGrowth GmbH – München",
      "type": "Registerbekanntmachung nach dem Umwandlungsgesetz",
      "state": "Bayern",
      "amtsgericht": "Amtsgericht München",
      "registernummer": "HRB 282456",
      "registerart": "HRB",
      "company_name": "EverGrowth GmbH",
      "company_seat": "München",
      "details": "12.11.2024 (Bekanntmachungsdatum)\n\nBayern Amtsgericht München HRB 282456\nRegisterbekanntmachung nach dem Umwandlungsgesetz 11.11.2024 (Eintragungsdatum)\n\nEverGrowth GmbH\nGesellschaft mit beschränkter Haftung\nMünchen\n\nDen Gläubigern der an der Verschmelzung beteiligten Rechtsträger ist, wenn sie binnen sechs Monaten nach dem Tag, an dem die Eintragung der Verschmelzung in das Register des Sitzes desjenigen Rechtsträgers, dessen Gläubiger sie sind, nach § 19 Abs. 3 UmwG als bekannt gemacht gilt, ihren Anspruch nach Grund und Höhe schriftlich anmelden, Sicherheit zu leisten, soweit sie nicht Befriedigung verlangen können. Dieses Recht steht den Gläubigern jedoch nur zu, wenn sie glaubhaft machen, dass durch die Verschmelzung die Erfüllung ihrer Forderung gefährdet wird."
    },
    {
      "date": "2024-11-12",
      "id": "93207",
      "original_text": "Löschungsankündigung\nBaden-Württemberg Amtsgericht Mannheim HRB 701904\nFraTrans Speditions GmbH – Bietigheim",
      "type": "Löschungsankündigung",
      "state": "Baden-Württemberg",
      "amtsgericht": "Amtsgericht Mannheim",
      "registernummer": "HRB 701904",
      "registerart": "HRB",
      "company_name": "FraTrans Speditions GmbH",
      "company_seat": "Bietigheim",
      "details": "12.11.2024 (Bekanntmachungsdatum)\n\nBaden-Württemberg Amtsgericht Mannheim HRB 701904\nLöschungsankündigung\n\nFraTrans Speditions GmbH\nGesellschaft mit beschränkter Haftung\nBietigheim\n\nDas Gericht beabsichtigt, die Gesellschaft wegen Vermögenslosigkeit im Handelsregister von Amts wegen nach § 394 FamFG zu löschen. Die Frist zur Geltendmachung eines Widerspruchs gegen die beabsichtigte Löschung ist auf einen Monat ab Veröffentlichung bestimmt."
    },
    {
      "date": "2024-11-12",
      "id": "93187",
      "original_text": "Registerbekanntmachung nach dem Umwandlungsgesetz\nBayern Amtsgericht Nürnberg HRA 13267\nFuchs TransConTec GmbH & Co. KG – Berching",
      "type": "Registerbekanntmachung nach dem Umwandlungsgesetz",
      "state": "Bayern",
      "amtsgericht": "Amtsgericht Nürnberg",
      "registernummer": "HRA 13267",
      "registerart": "HRA",
      "company_name": "Fuchs TransConTec GmbH & Co. KG",
      "company_seat": "Berching",
      "details": "12.11.2024 (Bekanntmachungsdatum)\n\nBayern Amtsgericht Nürnberg HRA 13267\nRegisterbekanntmachung nach dem Umwandlungsgesetz 11.11.2024 (Eintragungsdatum)\n\nFuchs TransConTec GmbH & Co. KG\nKommanditgesellschaft\nBerching\n\nDen Gläubigern der an der Verschmelzung beteiligten Rechtsträger ist, wenn sie binnen sechs Monaten nach dem Tag, an dem die Eintragung der Verschmelzung in das Register des Sitzes desjenigen Rechtsträgers, dessen Gläubiger sie sind, nach § 19 Abs. 3 UmwG als bekannt gemacht gilt, ihren Anspruch nach Grund und Höhe schriftlich anmelden, Sicherheit zu leisten, soweit sie nicht Befriedigung verlangen können. Dieses Recht steht den Gläubigern jedoch nur zu, wenn sie glaubhaft machen, dass durch die Verschmelzung die Erfüllung ihrer Forderung gefährdet wird."
    },
    {
      "date": "2024-11-12",
      "id": "93198",
      "original_text": "Löschungsankündigung\nBayern Amtsgericht München HRB 159125\nG1-Networks GmbH – Taufkirchen",
      "type": "Löschungsankündigung",
      "state": "Bayern",
      "amtsgericht": "Amtsgericht München",
      "registernummer": "HRB 159125",
      "registerart": "HRB",
      "company_name": "G1-Networks GmbH",
      "company_seat": "Taufkirchen",
      "details": "12.11.2024 (Bekanntmachungsdatum)\n\nBayern Amtsgericht München HRB 159125\nLöschungsankündigung 11.11.2024 (Eintragungsdatum)\n\nG1-Networks GmbH\nGesellschaft mit beschränkter Haftung\nTaufkirchen\n\nDas Registergericht beabsichtigt, die im Handelsregister eingetragene Gesellschaft wegen Vermögenslosigkeit von Amts wegen nach § 394 FamFG zu löschen. Die Frist zur Erhebung eines Widerspruchs ist auf drei Monate festgesetzt."
    },
    {
      "date": "2024-11-12",
      "id": "93220",
      "original_text": "Einreichung neuer Dokumente\nSchleswig-Holstein Amtsgericht Kiel HRB 1720 NM\nGOES Gesellschaft für die Organisation der Entsorgung von Sonderabfällen mbH – Neumünster",
      "type": "Einreichung neuer Dokumente",
      "state": "Schleswig-Holstein",
      "amtsgericht": "Amtsgericht Kiel",
      "registernummer": "HRB 1720 NM",
      "registerart": "HRB",
      "company_name": "GOES Gesellschaft für die Organisation der Entsorgung von Sonderabfällen mbH",
      "company_seat": "Neumünster",
      "details": "12.11.2024 (Bekanntmachungsdatum)\n\nSchleswig-Holstein Amtsgericht Kiel HRB 1720 NM\nEinreichung neuer Dokumente\n\nGOES Gesellschaft für die Organisation der Entsorgung von Sonderabfällen mbH\nGesellschaft mit beschränkter Haftung\nNeumünster\n\nEine neue Liste der Aufsichtsratsmitglieder ist eingereicht worden."
    },
    {
      "date": "2024-11-12",
      "id": "93271",
      "original_text": "Registerbekanntmachung nach dem Umwandlungsgesetz\nRheinland-Pfalz Amtsgericht Montabaur HRA 3319\nGSH Gerd Schneider GmbH & Co. KG – Hillscheid",
      "type": "Registerbekanntmachung nach dem Umwandlungsgesetz",
      "state": "Rheinland-Pfalz",
      "amtsgericht": "Amtsgericht Montabaur",
      "registernummer": "HRA 3319",
      "registerart": "HRA",
      "company_name": "GSH Gerd Schneider GmbH & Co. KG",
      "company_seat": "Hillscheid",
      "details": "12.11.2024 (Bekanntmachungsdatum)\n\nRheinland-Pfalz Amtsgericht Montabaur HRA 3319\nRegisterbekanntmachung nach dem Umwandlungsgesetz 12.11.2024 (Eintragungsdatum)\n\nGSH Gerd Schneider GmbH & Co. KG\nKommanditgesellschaft\nHillscheid\n\nAls nicht eingetragen wird veröffentlicht:\nDen Gläubigern des formwechselnden Rechtsträgers ist, wenn sie binnen sechs Monaten nach dem Tag, an dem die Eintragung des Formwechsels nach § 201 UmwG als bekannt gemacht gilt, ihren Anspruch nach Grund und Höhe schriftlich anmelden, Sicherheit zu leisten, soweit sie nicht Befriedigung verlangen können. Dieses Recht steht den Gläubigern jedoch nur zu, wenn sie glaubhaft machen, dass durch den Formwechsel die Erfüllung der Forderung gefährdet wird."
    },
    {
      "date": "2024-11-12",
      "id": "93259",
      "original_text": "Löschungsankündigung\nNiedersachsen Amtsgericht Hildesheim VR 120103\nGebrauchshundsportverein Immensen Mitglied im Deutschen Verband der Gebrauchshundsportvereine (DVG) - Sportverband für das Polizei- und Schutzhundwesen e.V. – Burgdorf",
      "type": "Löschungsankündigung",
      "state": "Niedersachsen",
      "amtsgericht": "Amtsgericht Hildesheim",
      "registernummer": "VR 120103",
      "registerart": "VR",
      "company_name": "Gebrauchshundsportverein Immensen Mitglied im Deutschen Verband der Gebrauchshundsportvereine (DVG) - Sportverband für das Polizei- und Schutzhundwesen e.V.",
      "company_seat": "Burgdorf",
      "details": "12.11.2024 (Bekanntmachungsdatum)\n\nNiedersachsen Amtsgericht Hildesheim VR 120103\nLöschungsankündigung\n\nGebrauchshundsportverein Immensen Mitglied im Deutschen Verband der Gebrauchshundsportvereine (DVG) - Sportverband für das Polizei- und Schutzhundwesen e.V.\neingetragener Verein\nBurgdorf\n\nDas Registergericht beabsichtigt, den Verein von Amts wegen nach § 395 FamFG zu löschen. Die Frist zur Erhebung eines Widerspruchs ist auf 1 Monat ab dieser Registerbekanntmachung festgesetzt."
    },
    {
      "date": "2024-11-12",
      "id": "93242",
      "original_text": "Registerbekanntmachung nach dem Umwandlungsgesetz\nBerlin Amtsgericht Berlin (Charlottenburg) HRB 196515\nGermendorfer Allee 18 Grundstücksentwicklungsgesellschaft mbH – Berlin",
      "type": "Registerbekanntmachung nach dem Umwandlungsgesetz",
      "state": "Berlin",
      "amtsgericht": "Amtsgericht Berlin (Charlottenburg)",
      "registernummer": "HRB 196515",
      "registerart": "HRB",
      "company_name": "Germendorfer Allee 18 Grundstücksentwicklungsgesellschaft mbH",
      "company_seat": "Berlin",
      "details": "12.11.2024 (Bekanntmachungsdatum)\n\nBerlin Amtsgericht Berlin (Charlottenburg) HRB 196515\nRegisterbekanntmachung nach dem Umwandlungsgesetz 11.11.2024 (Eintragungsdatum)\n\nGermendorfer Allee 18 Grundstücksentwicklungsgesellschaft mbH\nGesellschaft mit beschränkter Haftung\nBerlin\n\nZu Eintragungsnummer 10 vom 11.11.2024 wird als nicht eingetragen veröffentlicht: Den Gläubigern ist, wenn sie binnen sechs Monaten nach dem Tag, an dem die Eintragung der Umwandlung als bekannt gemacht gilt, ihren Anspruch nach Grund und Höhe schriftlich anmelden, Sicherheit zu leisten, soweit sie nicht Befriedigung verlangen können. Dieses Recht steht den Gläubigern jedoch nur zu, wenn sie glaubhaft machen, dass durch die Umwandlung die Erfüllung ihrer Forderung gefährdet wird. Das Recht, Sicherheitsleistung zu verlangen, steht Gläubigern nicht zu, die im Falle der Insolvenz ein Recht auf vorzugsweise Befriedigung aus einer Deckungsmasse haben, die nach gesetzlicher Vorschrift zu ihrem Schutz errichtet und staatlich überwacht ist."
    },
    {
      "date": "2024-11-12",
      "id": "93278",
      "original_text": "Einreichung neuer Dokumente\nNordrhein-Westfalen Amtsgericht Köln HRB 56824\nGothaer Pensionskasse AG – Köln",
      "type": "Einreichung neuer Dokumente",
      "state": "Nordrhein-Westfalen",
      "amtsgericht": "Amtsgericht Köln",
      "registernummer": "HRB 56824",
      "registerart": "HRB",
      "company_name": "Gothaer Pensionskasse AG",
      "company_seat": "Köln",
      "details": "12.11.2024 (Bekanntmachungsdatum)\n\nNordrhein-Westfalen Amtsgericht Köln HRB 56824\nEinreichung neuer Dokumente\n\nGothaer Pensionskasse AG\nAktiengesellschaft\nKöln\n\nDem Registergericht ist eine neue Liste der Mitglieder des Aufsichtsrates eingereicht worden."
    },
    {
      "date": "2024-11-12",
      "id": "93288",
      "original_text": "Sonstige Registerbekanntmachung\nNordrhein-Westfalen Amtsgericht Köln HRB 73729\nGothaer Vertriebs-Service AG – Köln",
      "type": "Sonstige Registerbekanntmachung",
      "state": "Nordrhein-Westfalen",
      "amtsgericht": "Amtsgericht Köln",
      "registernummer": "HRB 73729",
      "registerart": "HRB",
      "company_name": "Gothaer Vertriebs-Service AG",
      "company_seat": "Köln",
      "details": "12.11.2024 (Bekanntmachungsdatum)\n\nNordrhein-Westfalen Amtsgericht Köln HRB 73729\nSonstige Registerbekanntmachung\n\nGothaer Vertriebs-Service AG\nAktiengesellschaft\nKöln\n\nDem Registergericht ist eine Liste der Mitglieder des Aufsichtsrates eingereicht worden."
    },
    {
      "date": "2024-11-12",
      "id": "93221",
      "original_text": "Sonstige Registerbekanntmachung\nBerlin Amtsgericht Berlin (Charlottenburg) HRB 237567\nGrover Europe SE – Berlin",
      "type": "Sonstige Registerbekanntmachung",
      "state": "Berlin",
      "amtsgericht": "Amtsgericht Berlin (Charlottenburg)",
      "registernummer": "HRB 237567",
      "registerart": "HRB",
      "company_name": "Grover Europe SE",
      "company_seat": "Berlin",
      "details": "12.11.2024 (Bekanntmachungsdatum)\n\nBerlin Amtsgericht Berlin (Charlottenburg) HRB 237567\nSonstige Registerbekanntmachung\n\nGrover Europe SE\nEuropäische Aktiengesellschaft (SE)\nBerlin\n\nAls nicht eingetragen wird veröffentlicht: Es wurde eine neue Liste der Aufsichtsratsmitglieder eingereicht (§ 106 AktG)."
    },
    {
      "date": "2024-11-12",
      "id": "93188",
      "original_text": "Registerbekanntmachung nach dem Umwandlungsgesetz\nBayern Amtsgericht Schweinfurt HRB 7138\nHCM GmbH – Bad Neustadt a.d. Saale",
      "type": "Registerbekanntmachung nach dem Umwandlungsgesetz",
      "state": "Bayern",
      "amtsgericht": "Amtsgericht Schweinfurt",
      "registernummer": "HRB 7138",
      "registerart": "HRB",
      "company_name": "HCM GmbH",
      "company_seat": "Bad Neustadt a.d. Saale",
      "details": "12.11.2024 (Bekanntmachungsdatum)\n\nBayern Amtsgericht Schweinfurt HRB 7138\nRegisterbekanntmachung nach dem Umwandlungsgesetz 11.11.2024 (Eintragungsdatum)\n\nHCM GmbH\nGesellschaft mit beschränkter Haftung\nBad Neustadt a.d. Saale\n\nDen Gläubigern des formwechselnden Rechtsträgers ist, wenn sie binnen sechs Monaten nach dem Tag, an dem die Eintragung des Formwechsels nach § 201 UmwG als bekannt gemacht gilt, ihren Anspruch nach Grund und Höhe schriftlich anmelden, Sicherheit zu leisten, soweit sie nicht Befriedigung verlangen können. Dieses Recht steht den Gläubigern jedoch nur zu, wenn sie glaubhaft machen, dass durch den Formwechsel die Erfüllung ihrer Forderung gefährdet wird."
    },
    {
      "date": "2024-11-12",
      "id": "93267",
      "original_text": "Registerbekanntmachung nach dem Umwandlungsgesetz\nBremen Amtsgericht Bremen HRB 34169\nHandelshaus Bremen Verwaltungs GmbH – Bremen",
      "type": "Registerbekanntmachung nach dem Umwandlungsgesetz",
      "state": "Bremen",
      "amtsgericht": "Amtsgericht Bremen",
      "registernummer": "HRB 34169",
      "registerart": "HRB",
      "company_name": "Handelshaus Bremen Verwaltungs GmbH",
      "company_seat": "Bremen",
      "details": "12.11.2024 (Bekanntmachungsdatum)\n\nBremen Amtsgericht Bremen HRB 34169\nRegisterbekanntmachung nach dem Umwandlungsgesetz 11.11.2024 (Eintragungsdatum)\n\nHandelshaus Bremen Verwaltungs GmbH\nGesellschaft mit beschränkter Haftung\nBremen\n\nZu Eintragungsnummer 5 vom 11.11.2024 wird als nicht eingetragen veröffentlicht:\nDen Gläubigern der an der Verschmelzung beteiligten Rechtsträger ist, wenn sie binnen sechs Monaten nach dem Tag, an dem die Eintragung der Verschmelzung in das Register des Sitzes desjenigen Rechtsträgers, dessen Gläubiger sie sind, als bekannt gemacht gilt, ihren Anspruch nach Grund und Höhe schriftlich anmelden, Sicherheit zu leisten, soweit sie nicht Befriedigung verlangen können. Dieses Recht steht den Gläubigern jedoch nur zu, wenn sie glaubhaft machen, dass durch die Verschmelzung die Erfüllung ihrer Forderung gefährdet wird. Das Recht, Sicherheitsleistung zu verlangen, steht Gläubigern nicht zu, die im Falle der Insolvenz ein Recht auf vorzugsweise Befriedigung aus einer Deckungsmasse haben, die nach gesetzlicher Vorschrift zu ihrem Schutz errichtet und staatlich überwacht ist."
    },
    {
      "date": "2024-11-12",
      "id": "93206",
      "original_text": "Registerbekanntmachung nach dem Umwandlungsgesetz\nSchleswig-Holstein Amtsgericht Pinneberg HRB 834 EL\nHans-Joachim Weitzel & Co. GmbH – Tornesch",
      "type": "Registerbekanntmachung nach dem Umwandlungsgesetz",
      "state": "Schleswig-Holstein",
      "amtsgericht": "Amtsgericht Pinneberg",
      "registernummer": "HRB 834 EL",
      "registerart": "HRB",
      "company_name": "Hans-Joachim Weitzel & Co. GmbH",
      "company_seat": "Tornesch",
      "details": "12.11.2024 (Bekanntmachungsdatum)\n\nSchleswig-Holstein Amtsgericht Pinneberg HRB 834 EL\nRegisterbekanntmachung nach dem Umwandlungsgesetz 11.11.2024 (Eintragungsdatum)\n\nHans-Joachim Weitzel & Co. GmbH\nGesellschaft mit beschränkter Haftung\nTornesch\n\nAls nicht eingetragen wird veröffentlicht: Den Gläubigern der an der Verschmelzung beteiligten Rechtsträger ist, wenn sie binnen sechs Monaten nach dem Tag, an dem die Eintragung der Verschmelzung in das Register des Sitzes desjenigen Rechtsträgers, dessen Gläubiger sie sind, als bekannt gemacht gilt, ihren Anspruch nach Grund und Höhe schriftlich anmelden, Sicherheit zu leisten, soweit sie nicht Befriedigung verlangen können. Dieses Recht steht den Gläubigern jedoch nur zu, wenn sie glaubhaft machen, dass durch die Verschmelzung die Erfüllung ihrer Forderung gefährdet wird. Das Recht, Sicherheitsleistung zu verlangen, steht Gläubigern nicht zu, die im Falle der Insolvenz ein Recht auf vorzugsweise Befriedigung aus einer Deckungsmasse haben, die nach gesetzlicher Vorschrift zu ihrem Schutz errichtet und staatlich überwacht ist."
    },
    {
      "date": "2024-11-12",
      "id": "93294",
      "original_text": "Sonstige Registerbekanntmachung\nHessen Amtsgericht Wetzlar VR 4551\nHerborn is(s)t bunt e. V. – Herborn",
      "type": "Sonstige Registerbekanntmachung",
      "state": "Hessen",
      "amtsgericht": "Amtsgericht Wetzlar",
      "registernummer": "VR 4551",
      "registerart": "VR",
      "company_name": "Herborn is(s)t bunt e. V.",
      "company_seat": "Herborn",
      "details": "12.11.2024 (Bekanntmachungsdatum)\n\nHessen Amtsgericht Wetzlar VR 4551\nSonstige Registerbekanntmachung 12.11.2024 (Eintragungsdatum)\n\nHerborn is(s)t bunt e. V.\neingetragener Verein\nHerborn\n\nDer Verein ist aufgelöst."
    },
    {
      "date": "2024-11-12",
      "id": "93284",
      "original_text": "Registerbekanntmachung nach dem Umwandlungsgesetz\nNordrhein-Westfalen Amtsgericht Essen PR 5539\nHeyartz Stockem Partnerschaft Steuerberater, Landwirtschaftliche Buchstelle – Elsdorf",
      "type": "Registerbekanntmachung nach dem Umwandlungsgesetz",
      "state": "Nordrhein-Westfalen",
      "amtsgericht": "Amtsgericht Essen",
      "registernummer": "PR 5539",
      "registerart": "PR",
      "company_name": "Heyartz Stockem Partnerschaft Steuerberater, Landwirtschaftliche Buchstelle",
      "company_seat": "Elsdorf",
      "details": "12.11.2024 (Bekanntmachungsdatum)\n\nNordrhein-Westfalen Amtsgericht Essen PR 5539\nRegisterbekanntmachung nach dem Umwandlungsgesetz 12.11.2024 (Eintragungsdatum)\n\nHeyartz Stockem Partnerschaft Steuerberater, Landwirtschaftliche Buchstelle\nPartnerschaftsgesellschaft\nElsdorf\n\nDen Gläubigern der an der Abspaltung beteiligten Rechtsträger ist, wenn sie binnen sechs Monaten nach dem Tag, an dem die Eintragung der Abspaltung in das Register des Sitzes desjenigen Rechtsträgers, dessen Gläubiger sie sind, nach § 19 Absatz 3 UmwG als bekanntgemacht gilt, ihren Anspruch nach Grund und Höhe schriftlich anmelden, Sicherheit zu leisten, soweit sie nicht Befriedigung verlangen können. Dieses Recht steht den Gläubigern jedoch nur zu, wenn sie glaubhaft machen, dass durch die Abspaltung die Erfüllung ihrer Forderung gefährdet wird."
    },
    {
      "date": "2024-11-12",
      "id": "93224",
      "original_text": "Registerbekanntmachung nach dem Umwandlungsgesetz\nSchleswig-Holstein Amtsgericht Pinneberg HRA 387 IZ\nHorst Mengel, Landmaschinen, Inh. Dirk Mengel e.K. – Vaale",
      "type": "Registerbekanntmachung nach dem Umwandlungsgesetz",
      "state": "Schleswig-Holstein",
      "amtsgericht": "Amtsgericht Pinneberg",
      "registernummer": "HRA 387 IZ",
      "registerart": "HRA",
      "company_name": "Horst Mengel, Landmaschinen, Inh. Dirk Mengel e.K.",
      "company_seat": "Vaale",
      "details": "12.11.2024 (Bekanntmachungsdatum)\n\nSchleswig-Holstein Amtsgericht Pinneberg HRA 387 IZ\nRegisterbekanntmachung nach dem Umwandlungsgesetz 06.11.2024 (Eintragungsdatum)\n\nHorst Mengel, Landmaschinen, Inh. Dirk Mengel e.K.\nEinzelkaufmann / Einzelkauffrau\nVaale\n\nZu Eintragungsnummer 3 vom 06.11.2024 wird als nicht eingetragen veröffentlicht: Als nicht eingetragen wird veröffentlicht: Den Gläubigern ist, wenn sie binnen sechs Monaten nach dem Tag, an dem die Eintragung der Umwandlung als bekannt gemacht gilt, ihren Anspruch nach Grund und Höhe schriftlich anmelden, Sicherheit zu leisten, soweit sie nicht Befriedigung verlangen können. Dieses Recht steht den Gläubigern jedoch nur zu, wenn sie glaubhaft machen, dass durch die Umwandlung die Erfüllung ihrer Forderung gefährdet wird. Das Recht, Sicherheitsleistung zu verlangen, steht Gläubigern nicht zu, die im Falle der Insolvenz ein Recht auf vorzugsweise Befriedigung aus einer Deckungsmasse haben, die nach gesetzlicher Vorschrift zu ihrem Schutz errichtet und staatlich überwacht ist."
    },
    {
      "date": "2024-11-12",
      "id": "93289",
      "original_text": "Löschungsankündigung\nNordrhein-Westfalen Amtsgericht Mönchengladbach HRB 6664\nIBG Monforts Oekotec Verwaltungs GmbH – Mönchengladbach",
      "type": "Löschungsankündigung",
      "state": "Nordrhein-Westfalen",
      "amtsgericht": "Amtsgericht Mönchengladbach",
      "registernummer": "HRB 6664",
      "registerart": "HRB",
      "company_name": "IBG Monforts Oekotec Verwaltungs GmbH",
      "company_seat": "Mönchengladbach",
      "details": "12.11.2024 (Bekanntmachungsdatum)\n\nNordrhein-Westfalen Amtsgericht Mönchengladbach HRB 6664\nLöschungsankündigung 12.11.2024 (Eintragungsdatum)\n\nIBG Monforts Oekotec Verwaltungs GmbH\nGesellschaft mit beschränkter Haftung\nMönchengladbach\n\nDas Registergericht beabsichtigt die Gesellschaft von Amts wegen nach § 394 FamFG zu löschen. Die Frist zur Erhebung eines Widerspruchs ist auf drei Monate festgesetzt."
    },
    {
      "date": "2024-11-12",
      "id": "93272",
      "original_text": "Löschungsankündigung\nRheinland-Pfalz Amtsgericht Mainz HRB 51115\nINROMONT Schweißtechnik GmbH – Nierstein",
      "type": "Löschungsankündigung",
      "state": "Rheinland-Pfalz",
      "amtsgericht": "Amtsgericht Mainz",
      "registernummer": "HRB 51115",
      "registerart": "HRB",
      "company_name": "INROMONT Schweißtechnik GmbH",
      "company_seat": "Nierstein",
      "details": "12.11.2024 (Bekanntmachungsdatum)\n\nRheinland-Pfalz Amtsgericht Mainz HRB 51115\nLöschungsankündigung\n\nINROMONT Schweißtechnik GmbH\nGesellschaft mit beschränkter Haftung\nNierstein\n\nDas Registergericht beabsichtigt die Gesellschaft von Amts wegen nach § 394 FamFG zu löschen. Die Frist zur Erhebung eines Widerspruchs ist auf einen Monat festgesetzt."
    },
    {
      "date": "2024-11-12",
      "id": "93282",
      "original_text": "Einreichung neuer Dokumente\nNordrhein-Westfalen Amtsgericht Köln HRB 35073\nIR.on Aktiengesellschaft – Köln",
      "type": "Einreichung neuer Dokumente",
      "state": "Nordrhein-Westfalen",
      "amtsgericht": "Amtsgericht Köln",
      "registernummer": "HRB 35073",
      "registerart": "HRB",
      "company_name": "IR.on Aktiengesellschaft",
      "company_seat": "Köln",
      "details": "12.11.2024 (Bekanntmachungsdatum)\n\nNordrhein-Westfalen Amtsgericht Köln HRB 35073\nEinreichung neuer Dokumente\n\nIR.on Aktiengesellschaft\nAktiengesellschaft\nKöln\n\nDem Registergericht ist eine neue Liste der Mitglieder des Aufsichtsrates eingereicht worden."
    },
    {
      "date": "2024-11-12",
      "id": "93252",
      "original_text": "Einreichung neuer Dokumente\nSachsen Amtsgericht Dresden HRB 19553\nIndustrie-Center Neustadt GmbH – Neustadt/Sachsen",
      "type": "Einreichung neuer Dokumente",
      "state": "Sachsen",
      "amtsgericht": "Amtsgericht Dresden",
      "registernummer": "HRB 19553",
      "registerart": "HRB",
      "company_name": "Industrie-Center Neustadt GmbH",
      "company_seat": "Neustadt/Sachsen",
      "details": "12.11.2024 (Bekanntmachungsdatum)\n\nSachsen Amtsgericht Dresden HRB 19553\nEinreichung neuer Dokumente\n\nIndustrie-Center Neustadt GmbH\nGesellschaft mit beschränkter Haftung\nNeustadt/Sachsen\n\nAm 11.11.2024 wurde beim Handelsregister des Amtsgerichts Dresden die Liste der Mitglieder des Aufsichtsrats gemäß § 52 GmbHG eingereicht."
    },
    {
      "date": "2024-11-12",
      "id": "93286",
      "original_text": "Löschungsankündigung\nNordrhein-Westfalen Amtsgericht Krefeld HRB 18713\nJN Objektsanierung GmbH – Krefeld",
      "type": "Löschungsankündigung",
      "state": "Nordrhein-Westfalen",
      "amtsgericht": "Amtsgericht Krefeld",
      "registernummer": "HRB 18713",
      "registerart": "HRB",
      "company_name": "JN Objektsanierung GmbH",
      "company_seat": "Krefeld",
      "details": "12.11.2024 (Bekanntmachungsdatum)\n\nNordrhein-Westfalen Amtsgericht Krefeld HRB 18713\nLöschungsankündigung\n\nJN Objektsanierung GmbH\nGesellschaft mit beschränkter Haftung\nKrefeld\n\nDas Registergericht beabsichtigt die Gesellschaft von Amts wegen nach § 394 FamFG zu löschen. Die Frist zur Erhebung eines Widerspruchs ist auf einen Monat festgesetzt."
    },
    {
      "date": "2024-11-12",
      "id": "93279",
      "original_text": "Löschungsankündigung\nNordrhein-Westfalen Amtsgericht Düsseldorf HRB 75885\nJUSTWE GmbH – Düsseldorf",
      "type": "Löschungsankündigung",
      "state": "Nordrhein-Westfalen",
      "amtsgericht": "Amtsgericht Düsseldorf",
      "registernummer": "HRB 75885",
      "registerart": "HRB",
      "company_name": "JUSTWE GmbH",
      "company_seat": "Düsseldorf",
      "details": "12.11.2024 (Bekanntmachungsdatum)\n\nNordrhein-Westfalen Amtsgericht Düsseldorf HRB 75885\nLöschungsankündigung\n\nJUSTWE GmbH\nGesellschaft mit beschränkter Haftung\nDüsseldorf\n\nBetr.: JUSTWE GmbH, c/o RLT Ruhrmann Tieben & Partner mbB, Am Wehrhahn 36, 40211 Düsseldorf\n\nDas Registergericht beabsichtigt die Gesellschaft von Amts wegen nach § 394 FamFG zu löschen. Die Frist zur Erhebung eines Widerspruchs ist auf 3 Wochen festgesetzt.\n\nRechtsbehelfsbelehrung:\n\nDas Widerspruchsrecht steht jedem zu, der an der Unterlassung der Löschung ein berechtigtes Interesse hat. Der Widerspruch ist bei dem Amtsgericht Düsseldorf -Registergericht-, Werdener Straße 1, 40227 Düsseldorf schriftlich in deutscher Sprache oder zur Niederschrift der Geschäftsstelle einzulegen. Der Widerspruch kann auch zur Niederschrift der Geschäftsstelle eines jeden Amtsgerichtes abgegeben werden. Die Einlegung ist auch durch Übertragung eines elektronischen Dokuments an die elektronische Poststelle des Gerichts möglich. Das elektronische Dokument muss für die Bearbeitung durch das Gericht geeignet und mit einer qualifizierten elektronischen Signatur der verantwortenden Person versehen sein oder von der verantwortenden Person signiert und auf einem sicheren Übermittlungsweg gemäß § 130a ZPO nach näherer Maßgabe der Verordnung über die technischen Rahmenbedingungen des elektronischen Rechtsverkehrs und über das besondere elektronische Behördenpostfach (BGBl. I, S.3803) eingereicht werden. Weitere Informationen erhalten Sie auf der Internetseite www.justiz.de.\nDer Widerspruch muss spätestens innerhalb der gesetzten Frist nach dem Datum der Bekanntmachung der Löschungsankündigung bei dem Amtsgericht - Registergericht - Düsseldorf eingegangen sein.  Dies gilt auch dann, wenn der Widerspruch zur Niederschrift der Geschäftsstelle eines anderen Amtsgerichtes abgegeben wurde. Die Frist beginnt mit dem Tage der Bekanntmachung der Löschungsankündigung in dem für die Bekanntmachung der Eintragungen in das Handelsregister bestimmten elektronischen Informations- und Kommunikationssystem nach § 10 des Handelsgesetzbuches. Fällt das Ende der Frist auf einen Sonntag, einen allgemeinen Feiertag oder Sonnabend, so endet die Frist mit Ablauf des nächsten Werktages.\nDer Widerspruch muss die Bezeichnung der angefochtenen Löschungsankündigung sowie die Erklärung enthalten, dass Widerspruch gegen diese Löschungsankündigung eingelegt wird. Er ist zu unterzeichnen und soll begründet werden."
    },
    {
      "date": "2024-11-12",
      "id": "93230",
      "original_text": "Löschungsankündigung\nBerlin Amtsgericht Berlin (Charlottenburg) HRB 182730\nKNP Bau-Konsortium GmbH – Berlin",
      "type": "Löschungsankündigung",
      "state": "Berlin",
      "amtsgericht": "Amtsgericht Berlin (Charlottenburg)",
      "registernummer": "HRB 182730",
      "registerart": "HRB",
      "company_name": "KNP Bau-Konsortium GmbH",
      "company_seat": "Berlin",
      "details": "12.11.2024 (Bekanntmachungsdatum)\n\nBerlin Amtsgericht Berlin (Charlottenburg) HRB 182730\nLöschungsankündigung\n\nKNP Bau-Konsortium GmbH\nGesellschaft mit beschränkter Haftung\nBerlin\n\nBei der nachstehenden Gesellschaft wird das Amtslöschungsverfahren gemäß § 394 FamFG eingeleitet. Widerspruchsfrist 6 Wochen"
    },
    {
      "date": "2024-11-12",
      "id": "93204",
      "original_text": "Löschungsankündigung\nBaden-Württemberg Amtsgericht Stuttgart HRB 762045\nKR - Trockenbau und Akustik UG (haftungsbeschränkt) – Siegelsbach",
      "type": "Löschungsankündigung",
      "state": "Baden-Württemberg",
      "amtsgericht": "Amtsgericht Stuttgart",
      "registernummer": "HRB 762045",
      "registerart": "HRB",
      "company_name": "KR - Trockenbau und Akustik UG (haftungsbeschränkt)",
      "company_seat": "Siegelsbach",
      "details": "12.11.2024 (Bekanntmachungsdatum)\n\nBaden-Württemberg Amtsgericht Stuttgart HRB 762045\nLöschungsankündigung\n\nKR - Trockenbau und Akustik UG (haftungsbeschränkt)\nGesellschaft mit beschränkter Haftung\nSiegelsbach\n\nDas Gericht beabsichtigt, die Gesellschaft wegen Vermögenslosigkeit im Handelsregister von Amts wegen nach § 394 FamFG zu löschen. Die Frist zur Geltendmachung eines Widerspruchs gegen die beabsichtigte Löschung ist auf zwei Monate ab Veröffentlichung bestimmt."
    },
    {
      "date": "2024-11-12",
      "id": "93257",
      "original_text": "Registerbekanntmachung nach dem Umwandlungsgesetz\nSachsen Amtsgericht Leipzig HRB 42896\nKfz- und Reifenservice Steinert GmbH – Leipzig",
      "type": "Registerbekanntmachung nach dem Umwandlungsgesetz",
      "state": "Sachsen",
      "amtsgericht": "Amtsgericht Leipzig",
      "registernummer": "HRB 42896",
      "registerart": "HRB",
      "company_name": "Kfz- und Reifenservice Steinert GmbH",
      "company_seat": "Leipzig",
      "details": "12.11.2024 (Bekanntmachungsdatum)\n\nSachsen Amtsgericht Leipzig HRB 42896\nRegisterbekanntmachung nach dem Umwandlungsgesetz 12.11.2024 (Eintragungsdatum)\n\nKfz- und Reifenservice Steinert GmbH\nGesellschaft mit beschränkter Haftung\nLeipzig\n\nDen Gläubigern der an der Ausgliederung beteiligten Rechtsträger ist, wenn sie binnen sechs Monaten nach dem Tag, an dem die Eintragung der Ausgliederung in das Register des Sitzes desjenigen Rechtsträgers, dessen Gläubiger sie sind, nach § 19 Abs. 3 UmwG als bekannt gemacht gilt, ihren Anspruch nach Grund und Höhe schriftlich anmelden, Sicherheit zu leisten, soweit sie nicht Befriedigung verlangen können. Dieses Recht steht den Gläubigern jedoch nur zu, wenn sie glaubhaft machen, dass durch die Ausgliederung die Erfüllung der Forderung gefährdet wird."
    },
    {
      "date": "2024-11-12",
      "id": "93265",
      "original_text": "Registerbekanntmachung nach dem Umwandlungsgesetz\nNiedersachsen Amtsgericht Tostedt HRB 204876\nKooperation International, Vermögensverwaltungs- und Beratungsgesellschaft mbH – Loxstedt",
      "type": "Registerbekanntmachung nach dem Umwandlungsgesetz",
      "state": "Niedersachsen",
      "amtsgericht": "Amtsgericht Tostedt",
      "registernummer": "HRB 204876",
      "registerart": "HRB",
      "company_name": "Kooperation International, Vermögensverwaltungs- und Beratungsgesellschaft mbH",
      "company_seat": "Loxstedt",
      "details": "12.11.2024 (Bekanntmachungsdatum)\n\nNiedersachsen Amtsgericht Tostedt HRB 204876\nRegisterbekanntmachung nach dem Umwandlungsgesetz 12.11.2024 (Eintragungsdatum)\n\nKooperation International, Vermögensverwaltungs- und Beratungsgesellschaft mbH\nGesellschaft mit beschränkter Haftung\nLoxstedt\n\nDen Gläubigern der an der Verschmelzung beteiligten Rechtsträger ist, wenn sie binnen sechs Monaten nach dem Tag, an dem die Eintragung der Verschmelzung in das Register des Sitzes desjenigen Rechtsträgers, dessen Gläubiger sie sind, nach § 19  Abs.  3 UmwG als bekannt gemacht gilt, ihren Anspruch nach Grund und Höhe schriftlich anmelden, Sicherheit zu leisten, soweit sie nicht Befriedigung verlangen können. Dieses Recht steht den Gläubigern jedoch nur zu, wenn sie glaubhaft machen, dass durch die Verschmelzung die Erfüllung der Forderung gefährdet wird."
    },
    {
      "date": "2024-11-12",
      "id": "93287",
      "original_text": "Löschungsankündigung\nNordrhein-Westfalen Amtsgericht Düsseldorf HRB 55400\nKosta-Plan GmbH – Düsseldorf",
      "type": "Löschungsankündigung",
      "state": "Nordrhein-Westfalen",
      "amtsgericht": "Amtsgericht Düsseldorf",
      "registernummer": "HRB 55400",
      "registerart": "HRB",
      "company_name": "Kosta-Plan GmbH",
      "company_seat": "Düsseldorf",
      "details": "12.11.2024 (Bekanntmachungsdatum)\n\nNordrhein-Westfalen Amtsgericht Düsseldorf HRB 55400\nLöschungsankündigung\n\nKosta-Plan GmbH\nGesellschaft mit beschränkter Haftung\nDüsseldorf\n\nDas Registergericht beabsichtigt die Gesellschaft von Amts wegen nach § 394 Abs. 1 FamFG zu löschen. Die Frist zur Erhebung eines Widerspruchs ist auf 3 Wochen festgesetzt.\n\nRechtsbehelfsbelehrung:\nDas Widerspruchsrecht steht jedem zu, der an der Unterlassung der Löschung ein berechtigtes Interesse hat. Der Widerspruch ist bei dem Amtsgericht Düsseldorf -Registergericht-, Werdener Straße 1, 40227 Düsseldorf schriftlich in deutscher Sprache oder zur Niederschrift der Geschäftsstelle einzulegen. Der Widerspruch kann auch zur Niederschrift der Geschäftsstelle eines jeden Amtsgerichtes abgegeben werden. Die Einlegung ist auch durch Übertragung eines elektronischen Dokuments an die elektronische Poststelle des Gerichts möglich. Das elektronische Dokument muss für die Bearbeitung durch das Gericht geeignet und mit einer qualifizierten elektronischen Signatur der verantwortenden Person versehen sein oder von der verantwortenden Person signiert und auf einem sicheren Übermittlungsweg gemäß § 130a ZPO nach näherer Maßgabe der Verordnung über die technischen Rahmenbedingungen des elektronischen Rechtsverkehrs und über das besondere elektronische Behördenpostfach (BGBl. I, S.3803) eingereicht werden. Weitere Informationen erhalten Sie auf der Internetseite www.justiz.de.\nDer Widerspruch muss spätestens innerhalb der gesetzten Frist nach dem Datum der Bekanntmachung der Löschungsankündigung bei dem Amtsgericht - Registergericht - Düsseldorf eingegangen sein.  Dies gilt auch dann, wenn der Widerspruch zur Niederschrift der Geschäftsstelle eines anderen Amtsgerichtes abgegeben wurde. Die Frist beginnt mit dem Tage der Bekanntmachung der Löschungsankündigung in dem für die Bekanntmachung der Eintragungen in das Handelsregister bestimmten elektronischen Informations- und Kommunikationssystem nach § 10 des Handelsgesetzbuches. Fällt das Ende der Frist auf einen Sonntag, einen allgemeinen Feiertag oder Sonnabend, so endet die Frist mit Ablauf des nächsten Werktages.\nDer Widerspruch muss die Bezeichnung der angefochtenen Löschungsankündigung sowie die Erklärung enthalten, dass Widerspruch gegen diese Löschungsankündigung eingelegt wird. Er ist zu unterzeichnen und soll begründet werden."
    },
    {
      "date": "2024-11-12",
      "id": "93238",
      "original_text": "Einreichung neuer Dokumente\nMecklenburg-Vorpommern Amtsgericht Neubrandenburg HRB 7907\nKreiskrankenhaus Demmin GmbH (KKH DM GmbH) – Demmin",
      "type": "Einreichung neuer Dokumente",
      "state": "Mecklenburg-Vorpommern",
      "amtsgericht": "Amtsgericht Neubrandenburg",
      "registernummer": "HRB 7907",
      "registerart": "HRB",
      "company_name": "Kreiskrankenhaus Demmin GmbH (KKH DM GmbH)",
      "company_seat": "Demmin",
      "details": "12.11.2024 (Bekanntmachungsdatum)\n\nMecklenburg-Vorpommern Amtsgericht Neubrandenburg HRB 7907\nEinreichung neuer Dokumente\n\nKreiskrankenhaus Demmin GmbH (KKH DM GmbH)\nGesellschaft mit beschränkter Haftung\nDemmin\n\nEine Liste der Mitglieder des Aufsichtsrats ist zum Handelsregister eingereicht worden."
    },
    {
      "date": "2024-11-12",
      "id": "93277",
      "original_text": "Löschungsankündigung\nNordrhein-Westfalen Amtsgericht Wuppertal HRB 25464\nLUXOMED Deutschland GmbH – Wuppertal",
      "type": "Löschungsankündigung",
      "state": "Nordrhein-Westfalen",
      "amtsgericht": "Amtsgericht Wuppertal",
      "registernummer": "HRB 25464",
      "registerart": "HRB",
      "company_name": "LUXOMED Deutschland GmbH",
      "company_seat": "Wuppertal",
      "details": "12.11.2024 (Bekanntmachungsdatum)\n\nNordrhein-Westfalen Amtsgericht Wuppertal HRB 25464\nLöschungsankündigung\n\nLUXOMED Deutschland GmbH\nGesellschaft mit beschränkter Haftung\nWuppertal\n\nDas Registergericht beabsichtigt die Gesellschaft von Amts wegen nach § 394 FamFG zu löschen. Die Frist zur Erhebung eines Widerspruchs ist auf einen Monat festgesetzt."
    },
    {
      "date": "2024-11-12",
      "id": "93301",
      "original_text": "Löschungsankündigung\nHessen Amtsgericht Darmstadt HRB 100962\nLa Cura GmbH – Viernheim",
      "type": "Löschungsankündigung",
      "state": "Hessen",
      "amtsgericht": "Amtsgericht Darmstadt",
      "registernummer": "HRB 100962",
      "registerart": "HRB",
      "company_name": "La Cura GmbH",
      "company_seat": "Viernheim",
      "details": "12.11.2024 (Bekanntmachungsdatum)\n\nHessen Amtsgericht Darmstadt HRB 100962\nLöschungsankündigung\n\nLa Cura GmbH\nGesellschaft mit beschränkter Haftung\nViernheim\n\nDas Registergericht beabsichtigt die im Handelsregister eingetragene Gesellschaft von Amts wegen nach § 394 FamFG zu löschen. Die Frist zur Erhebung eines Widerspruchs gegen die beabsichtigte Löschung wird auf 3 Monate festgesetzt."
    },
    {
      "date": "2024-11-12",
      "id": "93262",
      "original_text": "Löschungsankündigung\nNiedersachsen Amtsgericht Walsrode HRB 208272\nLiason Nederland GmbH – Weyhe-Dreye",
      "type": "Löschungsankündigung",
      "state": "Niedersachsen",
      "amtsgericht": "Amtsgericht Walsrode",
      "registernummer": "HRB 208272",
      "registerart": "HRB",
      "company_name": "Liason Nederland GmbH",
      "company_seat": "Weyhe-Dreye",
      "details": "12.11.2024 (Bekanntmachungsdatum)\n\nNiedersachsen Amtsgericht Walsrode HRB 208272\nLöschungsankündigung\n\nLiason Nederland GmbH\nGesellschaft mit beschränkter Haftung\nWeyhe-Dreye\n\nEs ist beabsichtigt, die Gesellschaft wegen Vermögenslosigkeit von Amts wegen im Handelsregister zu löschen (§ 394 FamFG).\nBis zum 13.12.2024 können Sie beim Amtsgericht Walsrode gegen die angekündigte Löschung schriftlich oder zu Protokoll der Geschäftsstelle Widerspruch unter Angabe von Gründen erheben."
    },
    {
      "date": "2024-11-12",
      "id": "93225",
      "original_text": "Löschungsankündigung\nThüringen Amtsgericht Jena HRB 207282\nM. Zapf GmbH Isolierung für Kälte-Wärme-Schall und Brandschutz – Saalfeld/Saale",
      "type": "Löschungsankündigung",
      "state": "Thüringen",
      "amtsgericht": "Amtsgericht Jena",
      "registernummer": "HRB 207282",
      "registerart": "HRB",
      "company_name": "M. Zapf GmbH Isolierung für Kälte-Wärme-Schall und Brandschutz",
      "company_seat": "Saalfeld/Saale",
      "details": "12.11.2024 (Bekanntmachungsdatum)\n\nThüringen Amtsgericht Jena HRB 207282\nLöschungsankündigung\n\nM. Zapf GmbH Isolierung für Kälte-Wärme-Schall und Brandschutz\nGesellschaft mit beschränkter Haftung\nSaalfeld/Saale\n\nDas Registergericht beabsichtigt, die im Handelsregister eingetragene Gesellschaft wegen Vermögenslosigkeit nach § 394 FamFG von Amts wegen zu löschen. Die Frist zur Erhebung eines Widerspruchs gegen die beabsichtigte Löschung wird auf 6 Wochen festgesetzt."
    },
    {
      "date": "2024-11-12",
      "id": "93276",
      "original_text": "Löschungsankündigung\nNordrhein-Westfalen Amtsgericht Wuppertal HRB 11293\nMBW Müller-Ewert GmbH – Remscheid",
      "type": "Löschungsankündigung",
      "state": "Nordrhein-Westfalen",
      "amtsgericht": "Amtsgericht Wuppertal",
      "registernummer": "HRB 11293",
      "registerart": "HRB",
      "company_name": "MBW Müller-Ewert GmbH",
      "company_seat": "Remscheid",
      "details": "12.11.2024 (Bekanntmachungsdatum)\n\nNordrhein-Westfalen Amtsgericht Wuppertal HRB 11293\nLöschungsankündigung\n\nMBW Müller-Ewert GmbH\nGesellschaft mit beschränkter Haftung\nRemscheid\n\nDas Registergericht beabsichtigt die Gesellschaft von Amts wegen nach § 394 FamFG zu löschen. Die Frist zur Erhebung eines Widerspruchs ist auf einen Monat festgesetzt."
    },
    {
      "date": "2024-11-12",
      "id": "93203",
      "original_text": "Registerbekanntmachung nach dem Umwandlungsgesetz\nSchleswig-Holstein Amtsgericht Pinneberg HRA 8227\nMEMA Immobiliengesellschaft mbH & Co. KG – Bönningstedt",
      "type": "Registerbekanntmachung nach dem Umwandlungsgesetz",
      "state": "Schleswig-Holstein",
      "amtsgericht": "Amtsgericht Pinneberg",
      "registernummer": "HRA 8227",
      "registerart": "HRA",
      "company_name": "MEMA Immobiliengesellschaft mbH & Co. KG",
      "company_seat": "Bönningstedt",
      "details": "12.11.2024 (Bekanntmachungsdatum)\n\nSchleswig-Holstein Amtsgericht Pinneberg HRA 8227\nRegisterbekanntmachung nach dem Umwandlungsgesetz 06.11.2024 (Eintragungsdatum)\n\nMEMA Immobiliengesellschaft mbH & Co. KG\nKommanditgesellschaft\nBönningstedt\n\nAls nicht eingetragen wird veröffentlicht: Den Gläubigern ist, wenn sie binnen sechs Monaten nach dem Tag, an dem die Eintragung der Umwandlung als bekannt gemacht gilt, ihren Anspruch nach Grund und Höhe schriftlich anmelden, Sicherheit zu leisten, soweit sie nicht Befriedigung verlangen können. Dieses Recht steht den Gläubigern jedoch nur zu, wenn sie glaubhaft machen, dass durch die Umwandlung die Erfüllung ihrer Forderung gefährdet wird. Das Recht, Sicherheitsleistung zu verlangen, steht Gläubigern nicht zu, die im Falle der Insolvenz ein Recht auf vorzugsweise Befriedigung aus einer Deckungsmasse haben, die nach gesetzlicher Vorschrift zu ihrem Schutz errichtet und staatlich überwacht ist."
    },
    {
      "date": "2024-11-12",
      "id": "93253",
      "original_text": "Löschungsankündigung\nSachsen Amtsgericht Chemnitz HRB 25300\nMEXON GmbH – Oelsnitz/Vogtl.",
      "type": "Löschungsankündigung",
      "state": "Sachsen",
      "amtsgericht": "Amtsgericht Chemnitz",
      "registernummer": "HRB 25300",
      "registerart": "HRB",
      "company_name": "MEXON GmbH",
      "company_seat": "Oelsnitz/Vogtl.",
      "details": "12.11.2024 (Bekanntmachungsdatum)\n\nSachsen Amtsgericht Chemnitz HRB 25300\nLöschungsankündigung\n\nMEXON GmbH\nGesellschaft mit beschränkter Haftung\nOelsnitz/Vogtl.\n\nDas Registergericht beabsichtigt, die im Handelsregister eingetragene Gesellschaft von Amts wegen nach § 394 FamFG zu löschen. Die Frist zu Erhebung eines Widerspruchs gegen die beabsichtigte Löschung wird auf einen Monat festgesetzt."
    },
    {
      "date": "2024-11-12",
      "id": "93234",
      "original_text": "Löschungsankündigung\nSaarland Amtsgericht Saarbrücken HRB 105630\nMW MEHRaufWAND UG (haftungsbeschränkt) – Spiesen-Elversberg",
      "type": "Löschungsankündigung",
      "state": "Saarland",
      "amtsgericht": "Amtsgericht Saarbrücken",
      "registernummer": "HRB 105630",
      "registerart": "HRB",
      "company_name": "MW MEHRaufWAND UG (haftungsbeschränkt)",
      "company_seat": "Spiesen-Elversberg",
      "details": "12.11.2024 (Bekanntmachungsdatum)\n\nSaarland Amtsgericht Saarbrücken HRB 105630\nLöschungsankündigung\n\nMW MEHRaufWAND UG (haftungsbeschränkt)\nGesellschaft mit beschränkter Haftung\nSpiesen-Elversberg\n\nEs ist beabsichtigt, die Gesellschaft von Amts wegen gemäß § 394 FamFG wegen Vermögenslosigkeit zu löschen.\nGegen die Löschung von Amts wegen ist das Rechtsmittel des Widerspruchs statthaft. Der Widerspruch ist binnen einer Frist zwei Monaten beginnend mit dem Tag dieser Veröffentlichung durch Einreichen eines Widerspruchsschreibens -schriftlich oder zur Niederschrift der Geschäftsstelle beim Amtsgericht Saarbrücken, -zentrales Handelsregister-, Mainzerstr.178, 66121 Saarbrücken einzulegen.\nDer Widerspruch muss die Bezeichnung der angefochtenen Löschungsankündigung enthalten sowie die Erklärung, dass Widerspruch eingelegt wird. Er ist vom Widerspruchsführer oder seinem Bevollmächtigten zu unterzeichnen.\nDas Widerspruchsschreiben kann auch in der Form eines elektronischen Dokumentes eingereicht werden, das mit einer qualifizierten elektronischen Signatur nach dem Signaturgesetz versehen sein muss (§§ 14 Abs. 2 FamFG, 130a, 298 ZPO)."
    },
    {
      "date": "2024-11-12",
      "id": "93216",
      "original_text": "Löschungsankündigung\nBaden-Württemberg Amtsgericht Stuttgart HRB 763458\nMagMax/Magnetic Deutschland UG (haftungsbeschränkt) – Stuttgart",
      "type": "Löschungsankündigung",
      "state": "Baden-Württemberg",
      "amtsgericht": "Amtsgericht Stuttgart",
      "registernummer": "HRB 763458",
      "registerart": "HRB",
      "company_name": "MagMax/Magnetic Deutschland UG (haftungsbeschränkt)",
      "company_seat": "Stuttgart",
      "details": "12.11.2024 (Bekanntmachungsdatum)\n\nBaden-Württemberg Amtsgericht Stuttgart HRB 763458\nLöschungsankündigung\n\nMagMax/Magnetic Deutschland UG (haftungsbeschränkt)\nGesellschaft mit beschränkter Haftung\nStuttgart\n\nAls nicht eingetragen wird bekanntgemacht:\nDas Gericht beabsichtigt, die Gesellschaft wegen Vermögenslosigkeit im Handelsregister von Amts wegen nach § 394 FamFG zu löschen. Die Frist zur Geltendmachung eines Widerspruchs gegen die beabsichtigte Löschung ist auf zwei Monate ab Veröffentlichung bestimmt."
    },
    {
      "date": "2024-11-12",
      "id": "93232",
      "original_text": "Löschungsankündigung\nBaden-Württemberg Amtsgericht Mannheim HRB 734290\nMarasca Verwaltungs GmbH – Mühlacker",
      "type": "Löschungsankündigung",
      "state": "Baden-Württemberg",
      "amtsgericht": "Amtsgericht Mannheim",
      "registernummer": "HRB 734290",
      "registerart": "HRB",
      "company_name": "Marasca Verwaltungs GmbH",
      "company_seat": "Mühlacker",
      "details": "12.11.2024 (Bekanntmachungsdatum)\n\nBaden-Württemberg Amtsgericht Mannheim HRB 734290\nLöschungsankündigung\n\nMarasca Verwaltungs GmbH\nGesellschaft mit beschränkter Haftung\nMühlacker\n\nDas Gericht beabsichtigt, die Gesellschaft wegen Vermögenslosigkeit im Handelsregister von Amts wegen nach § 394 FamFG zu löschen. Die Frist zur Geltendmachung eines Widerspruchs gegen die beabsichtigte Löschung ist auf einen Monat ab Veröffentlichung bestimmt."
    },
    {
      "date": "2024-11-12",
      "id": "93256",
      "original_text": "Einreichung neuer Dokumente\nSachsen Amtsgericht Dresden HRB 4060\nMeißener Stadtwerke GmbH (MSW) – Meißen",
      "type": "Einreichung neuer Dokumente",
      "state": "Sachsen",
      "amtsgericht": "Amtsgericht Dresden",
      "registernummer": "HRB 4060",
      "registerart": "HRB",
      "company_name": "Meißener Stadtwerke GmbH (MSW)",
      "company_seat": "Meißen",
      "details": "12.11.2024 (Bekanntmachungsdatum)\n\nSachsen Amtsgericht Dresden HRB 4060\nEinreichung neuer Dokumente 12.11.2024 (Eintragungsdatum)\n\nMeißener Stadtwerke GmbH (MSW)\nGesellschaft mit beschränkter Haftung\nMeißen\n\nAm 11.11.2024 wurde beim Handelsregister des Amtsgerichts Dresden die Liste der Mitglieder des Aufsichtsrats gemäß § 52 GmbHG eingereicht."
    },
    {
      "date": "2024-11-12",
      "id": "93182",
      "original_text": "Sonstige Registerbekanntmachung\nBayern Amtsgericht München HRB 218608\nMoore Deutschland AG Wirtschaftsprüfungsgesellschaft – München",
      "type": "Sonstige Registerbekanntmachung",
      "state": "Bayern",
      "amtsgericht": "Amtsgericht München",
      "registernummer": "HRB 218608",
      "registerart": "HRB",
      "company_name": "Moore Deutschland AG Wirtschaftsprüfungsgesellschaft",
      "company_seat": "München",
      "details": "12.11.2024 (Bekanntmachungsdatum)\n\nBayern Amtsgericht München HRB 218608\nSonstige Registerbekanntmachung 11.11.2024 (Eintragungsdatum)\n\nMoore Deutschland AG Wirtschaftsprüfungsgesellschaft\nAktiengesellschaft\nMünchen\n\nDen Gläubigern der Gesellschaft, deren Forderungen begründet worden sind, bevor die Eintragung des Beschlusses bekanntgemacht worden ist, ist, wenn sie sich binnen sechs Monaten nach der Bekanntmachung zu diesem Zweck melden, Sicherheit zu leisten, soweit sie nicht Befriedigung verlangen können. Das Recht, Sicherheitsleistung zu verlangen, steht Gläubigern nicht zu, die im Fall des Insolvenzverfahrens ein Recht auf vorzugsweise Befriedigung aus einer Deckungsmasse haben, die nach gesetzlicher Vorschrift zu ihrem Schutz errichtet und staatlich überwacht ist."
    },
    {
      "date": "2024-11-12",
      "id": "93280",
      "original_text": "Löschungsankündigung\nNordrhein-Westfalen Amtsgericht Wuppertal HRB 22695\nMühlengrund UG (haftungsbeschränkt) – Haan",
      "type": "Löschungsankündigung",
      "state": "Nordrhein-Westfalen",
      "amtsgericht": "Amtsgericht Wuppertal",
      "registernummer": "HRB 22695",
      "registerart": "HRB",
      "company_name": "Mühlengrund UG (haftungsbeschränkt)",
      "company_seat": "Haan",
      "details": "12.11.2024 (Bekanntmachungsdatum)\n\nNordrhein-Westfalen Amtsgericht Wuppertal HRB 22695\nLöschungsankündigung 11.11.2024 (Eintragungsdatum)\n\nMühlengrund UG (haftungsbeschränkt)\nGesellschaft mit beschränkter Haftung\nHaan\n\nDas Registergericht beabsichtigt die Gesellschaft von Amts wegen nach § 394 FamFG zu löschen. Die Frist zur Erhebung eines Widerspruchs ist auf einen Monat festgesetzt."
    },
    {
      "date": "2024-11-12",
      "id": "93201",
      "original_text": "Einreichung neuer Dokumente\nBerlin Amtsgericht Berlin (Charlottenburg) HRB 247466\nN26 Bank AG – Berlin",
      "type": "Einreichung neuer Dokumente",
      "state": "Berlin",
      "amtsgericht": "Amtsgericht Berlin (Charlottenburg)",
      "registernummer": "HRB 247466",
      "registerart": "HRB",
      "company_name": "N26 Bank AG",
      "company_seat": "Berlin",
      "details": "12.11.2024 (Bekanntmachungsdatum)\n\nBerlin Amtsgericht Berlin (Charlottenburg) HRB 247466\nEinreichung neuer Dokumente\n\nN26 Bank AG\nAktiengesellschaft\nBerlin\n\nAls nicht eingetragen wird veröffentlicht: Es wurde eine neue Liste der Aufsichtsratsmitglieder eingereicht (§ 106 AktG)."
    },
    {
      "date": "2024-11-12",
      "id": "93202",
      "original_text": "Löschungsankündigung\nSachsen-Anhalt Amtsgericht Stendal HRB 28907\nNEBI Baugesellschaft mbH – Magdeburg",
      "type": "Löschungsankündigung",
      "state": "Sachsen-Anhalt",
      "amtsgericht": "Amtsgericht Stendal",
      "registernummer": "HRB 28907",
      "registerart": "HRB",
      "company_name": "NEBI Baugesellschaft mbH",
      "company_seat": "Magdeburg",
      "details": "12.11.2024 (Bekanntmachungsdatum)\n\nSachsen-Anhalt Amtsgericht Stendal HRB 28907\nLöschungsankündigung\n\nNEBI Baugesellschaft mbH\nGesellschaft mit beschränkter Haftung\nMagdeburg\n\nDas Registergericht beabsichtigt, nachfolgende im Handelregister eingetragenen Firmen von Amts wegen nach § 394 FamFG zu löschen. Die Frist zu Erhebung eines Widerspruchs wird auf drei Monate festgesetzt."
    },
    {
      "date": "2024-11-12",
      "id": "93296",
      "original_text": "Einreichung neuer Dokumente\nHessen Amtsgericht Frankfurt am Main HRB 94743\nNeumann Capital AG – Frankfurt am Main",
      "type": "Einreichung neuer Dokumente",
      "state": "Hessen",
      "amtsgericht": "Amtsgericht Frankfurt am Main",
      "registernummer": "HRB 94743",
      "registerart": "HRB",
      "company_name": "Neumann Capital AG",
      "company_seat": "Frankfurt am Main",
      "details": "12.11.2024 (Bekanntmachungsdatum)\n\nHessen Amtsgericht Frankfurt am Main HRB 94743\nEinreichung neuer Dokumente 12.11.2024 (Eintragungsdatum)\n\nNeumann Capital AG\nAktiengesellschaft\nFrankfurt am Main\n\nDurch eine Änderung in den Personen der Aufsichtsratsmitglieder ist eine Liste der Mitglieder des Aufsichtsrates zum Handelsregister eingereicht worden."
    },
    {
      "date": "2024-11-12",
      "id": "93193",
      "original_text": "Registerbekanntmachung nach dem Umwandlungsgesetz\nBayern Amtsgericht Nürnberg HRB 43482\nNewCo1 NeueDGH GmbH – Schwaig b. Nürnberg",
      "type": "Registerbekanntmachung nach dem Umwandlungsgesetz",
      "state": "Bayern",
      "amtsgericht": "Amtsgericht Nürnberg",
      "registernummer": "HRB 43482",
      "registerart": "HRB",
      "company_name": "NewCo1 NeueDGH GmbH",
      "company_seat": "Schwaig b. Nürnberg",
      "details": "12.11.2024 (Bekanntmachungsdatum)\n\nBayern Amtsgericht Nürnberg HRB 43482\nRegisterbekanntmachung nach dem Umwandlungsgesetz 11.11.2024 (Eintragungsdatum)\n\nNewCo1 NeueDGH GmbH\nGesellschaft mit beschränkter Haftung\nSchwaig b. Nürnberg\n\nDen Gläubigern der an der Verschmelzung beteiligten Rechtsträger ist, wenn sie binnen sechs Monaten nach dem Tag, an dem die Eintragung der Verschmelzung in das Register des Sitzes desjenigen Rechtsträgers, dessen Gläubiger sie sind, nach § 19 Abs. 3 UmwG als bekannt gemacht gilt, ihren Anspruch nach Grund und Höhe schriftlich anmelden, Sicherheit zu leisten, soweit sie nicht Befriedigung verlangen können. Dieses Recht steht den Gläubigern jedoch nur zu, wenn sie glaubhaft machen, dass durch die Verschmelzung die Erfüllung ihrer Forderung gefährdet wird."
    },
    {
      "date": "2024-11-12",
      "id": "93236",
      "original_text": "Löschungsankündigung\nBaden-Württemberg Amtsgericht Freiburg HRB 382078\nOFS Optik für Strahlquellen GmbH – Konstanz",
      "type": "Löschungsankündigung",
      "state": "Baden-Württemberg",
      "amtsgericht": "Amtsgericht Freiburg",
      "registernummer": "HRB 382078",
      "registerart": "HRB",
      "company_name": "OFS Optik für Strahlquellen GmbH",
      "company_seat": "Konstanz",
      "details": "12.11.2024 (Bekanntmachungsdatum)\n\nBaden-Württemberg Amtsgericht Freiburg HRB 382078\nLöschungsankündigung\n\nOFS Optik für Strahlquellen GmbH\nGesellschaft mit beschränkter Haftung\nKonstanz\n\nAls nicht eingetragen wird bekanntgemacht:\nDas Gericht beabsichtigt, die Gesellschaft wegen Vermögenslosigkeit im Handelsregister von Amts wegen nach § 394 FamFG zu löschen. Die Frist zur Geltendmachung eines Widerspruchs gegen die beabsichtigte Löschung ist auf einen Monat ab Veröffentlichung bestimmt."
    },
    {
      "date": "2024-11-12",
      "id": "93245",
      "original_text": "Löschungsankündigung\nMecklenburg-Vorpommern Amtsgericht Rostock HRB 15031\nOstseegolf Tessin UG (haftungsbeschränkt) – Tessin",
      "type": "Löschungsankündigung",
      "state": "Mecklenburg-Vorpommern",
      "amtsgericht": "Amtsgericht Rostock",
      "registernummer": "HRB 15031",
      "registerart": "HRB",
      "company_name": "Ostseegolf Tessin UG (haftungsbeschränkt)",
      "company_seat": "Tessin",
      "details": "12.11.2024 (Bekanntmachungsdatum)\n\nMecklenburg-Vorpommern Amtsgericht Rostock HRB 15031\nLöschungsankündigung\n\nOstseegolf Tessin UG (haftungsbeschränkt)\nGesellschaft mit beschränkter Haftung\nTessin\n\nDas Registergericht beabsichtigt, die im Handelsregister eingetragene Gesellschaft von Amts wegen nach § 394 FamFG zu löschen. Die Frist zur Erhebung eines Widerspruchs gegen die beabsichtigte Löschung wird auf einen Monat festgesetzt."
    },
    {
      "date": "2024-11-12",
      "id": "93244",
      "original_text": "Löschungsankündigung\nMecklenburg-Vorpommern Amtsgericht Rostock HRB 14436\nPW-Hands and Events UG (haftungsbeschränkt) – Rostock",
      "type": "Löschungsankündigung",
      "state": "Mecklenburg-Vorpommern",
      "amtsgericht": "Amtsgericht Rostock",
      "registernummer": "HRB 14436",
      "registerart": "HRB",
      "company_name": "PW-Hands and Events UG (haftungsbeschränkt)",
      "company_seat": "Rostock",
      "details": "12.11.2024 (Bekanntmachungsdatum)\n\nMecklenburg-Vorpommern Amtsgericht Rostock HRB 14436\nLöschungsankündigung\n\nPW-Hands and Events UG (haftungsbeschränkt)\nGesellschaft mit beschränkter Haftung\nRostock\n\nDas Registergericht beabsichtigt, die im Handelsregister eingetragene Gesellschaft von Amts wegen nach § 394 FamFG zu löschen. Die Frist zur Erhebung eines Widerspruchs gegen die beabsichtigte Löschung wird auf einen Monat festgesetzt."
    },
    {
      "date": "2024-11-12",
      "id": "93266",
      "original_text": "Registerbekanntmachung nach dem Umwandlungsgesetz\nBrandenburg Amtsgericht Cottbus HRA 3172\nPfennig Gutteich GmbH & Co. KG – Forst (Lausitz)",
      "type": "Registerbekanntmachung nach dem Umwandlungsgesetz",
      "state": "Brandenburg",
      "amtsgericht": "Amtsgericht Cottbus",
      "registernummer": "HRA 3172",
      "registerart": "HRA",
      "company_name": "Pfennig Gutteich GmbH & Co. KG",
      "company_seat": "Forst (Lausitz)",
      "details": "12.11.2024 (Bekanntmachungsdatum)\n\nBrandenburg Amtsgericht Cottbus HRA 3172\nRegisterbekanntmachung nach dem Umwandlungsgesetz 11.11.2024 (Eintragungsdatum)\n\nPfennig Gutteich GmbH & Co. KG\nKommanditgesellschaft\nForst (Lausitz)\n\nZu Eintragungsnummer 5 vom 11.11.2024 wird als nicht eingetragen veröffentlicht:\nAls nicht eingetragen wird veröffentlicht:\nDen Gläubigern der an der Umwandlung beteiligten Rechtsträger ist, wenn sie binnen sechs Monaten nach dem Tag, an dem die Eintragung der Umwandlung in das Register des Sitzes desjenigen Rechtsträgers, dessen Gläubiger sie sind, als bekannt gemacht gilt, ihren Anspruch nach Grund und Höhe schriftlich anmelden, Sicherheit zu leisten, soweit sie nicht Befriedigung verlangen können. Dieses Recht steht den Gläubigern jedoch nur zu, wenn sie glaubhaft machen, dass durch die Umwandlung die Erfüllung ihrer Forderung gefährdet wird"
    },
    {
      "date": "2024-11-12",
      "id": "93295",
      "original_text": "Löschungsankündigung\nHessen Amtsgericht Frankfurt am Main HRB 86070\nPiramida Distribution UG (haftungsbeschränkt) – Frankfurt am Main",
      "type": "Löschungsankündigung",
      "state": "Hessen",
      "amtsgericht": "Amtsgericht Frankfurt am Main",
      "registernummer": "HRB 86070",
      "registerart": "HRB",
      "company_name": "Piramida Distribution UG (haftungsbeschränkt)",
      "company_seat": "Frankfurt am Main",
      "details": "12.11.2024 (Bekanntmachungsdatum)\n\nHessen Amtsgericht Frankfurt am Main HRB 86070\nLöschungsankündigung\n\nPiramida Distribution UG (haftungsbeschränkt)\nGesellschaft mit beschränkter Haftung\nFrankfurt am Main\n\nDas Registergericht beabsichtigt die im Handelsregister eingetragene Gesellschaft von Amts wegen nach § 394 FamFG zu löschen. Die Frist zur Erhebung eines Widerspruchs gegen die beabsichtigte Löschung wird auf 1 Monate festgesetzt."
    },
    {
      "date": "2024-11-12",
      "id": "93247",
      "original_text": "Löschungsankündigung\nBrandenburg Amtsgericht Frankfurt/Oder VR 6200\nPro Vision e.V. – Storkow (Mark)",
      "type": "Löschungsankündigung",
      "state": "Brandenburg",
      "amtsgericht": "Amtsgericht Frankfurt/Oder",
      "registernummer": "VR 6200",
      "registerart": "VR",
      "company_name": "Pro Vision e.V.",
      "company_seat": "Storkow (Mark)",
      "details": "12.11.2024 (Bekanntmachungsdatum)\n\nBrandenburg Amtsgericht Frankfurt/Oder VR 6200\nLöschungsankündigung\n\nPro Vision e.V.\neingetragener Verein\nStorkow (Mark)\n\nBei dem nachstehenden Verein wird das Amtslöschungsverfahren gemäß § 395 FamFG eingeleitet."
    },
    {
      "date": "2024-11-12",
      "id": "93184",
      "original_text": "Registerbekanntmachung nach dem Umwandlungsgesetz\nBayern Amtsgericht Nürnberg HRB 42688\nProjektgesellschaft Königsbrücker Straße 117 Dresden mbH – Berching",
      "type": "Registerbekanntmachung nach dem Umwandlungsgesetz",
      "state": "Bayern",
      "amtsgericht": "Amtsgericht Nürnberg",
      "registernummer": "HRB 42688",
      "registerart": "HRB",
      "company_name": "Projektgesellschaft Königsbrücker Straße 117 Dresden mbH",
      "company_seat": "Berching",
      "details": "12.11.2024 (Bekanntmachungsdatum)\n\nBayern Amtsgericht Nürnberg HRB 42688\nRegisterbekanntmachung nach dem Umwandlungsgesetz 11.11.2024 (Eintragungsdatum)\n\nProjektgesellschaft Königsbrücker Straße 117 Dresden mbH\nGesellschaft mit beschränkter Haftung\nBerching\n\nDen Gläubigern der an der Verschmelzung beteiligten Rechtsträger ist, wenn sie binnen sechs Monaten nach dem Tag, an dem die Eintragung der Verschmelzung in das Register des Sitzes desjenigen Rechtsträgers, dessen Gläubiger sie sind, nach § 19 Abs. 3 UmwG als bekannt gemacht gilt, ihren Anspruch nach Grund und Höhe schriftlich anmelden, Sicherheit zu leisten, soweit sie nicht Befriedigung verlangen können. Dieses Recht steht den Gläubigern jedoch nur zu, wenn sie glaubhaft machen, dass durch die Verschmelzung die Erfüllung ihrer Forderung gefährdet wird."
    },
    {
      "date": "2024-11-12",
      "id": "93191",
      "original_text": "Einreichung neuer Dokumente\nBayern Amtsgericht München HRB 167896\nRandstad Digital Germany AG – München",
      "type": "Einreichung neuer Dokumente",
      "state": "Bayern",
      "amtsgericht": "Amtsgericht München",
      "registernummer": "HRB 167896",
      "registerart": "HRB",
      "company_name": "Randstad Digital Germany AG",
      "company_seat": "München",
      "details": "12.11.2024 (Bekanntmachungsdatum)\n\nBayern Amtsgericht München HRB 167896\nEinreichung neuer Dokumente\n\nRandstad Digital Germany AG\nAktiengesellschaft\nMünchen\n\nDem Amtsgericht München -Registergericht- ist eine Liste der Mitglieder des Aufsichtsrats eingereicht worden, § 106 AktG."
    },
    {
      "date": "2024-11-12",
      "id": "93214",
      "original_text": "Sonstige Registerbekanntmachung\nMecklenburg-Vorpommern Amtsgericht Schwerin HRB 13106\nRattunde AG – Ludwigslust",
      "type": "Sonstige Registerbekanntmachung",
      "state": "Mecklenburg-Vorpommern",
      "amtsgericht": "Amtsgericht Schwerin",
      "registernummer": "HRB 13106",
      "registerart": "HRB",
      "company_name": "Rattunde AG",
      "company_seat": "Ludwigslust",
      "details": "12.11.2024 (Bekanntmachungsdatum)\n\nMecklenburg-Vorpommern Amtsgericht Schwerin HRB 13106\nSonstige Registerbekanntmachung 12.11.2024 (Eintragungsdatum)\n\nRattunde AG\nAktiengesellschaft\nLudwigslust\n\nEine Liste der Mitglieder des Aufsichtsrats ist zum Handelsregister eingereicht worden."
    },
    {
      "date": "2024-11-12",
      "id": "93205",
      "original_text": "Einreichung neuer Dokumente\nSaarland Amtsgericht Saarbrücken HRB 104331\nRiddle Technologies AG – Saarbrücken",
      "type": "Einreichung neuer Dokumente",
      "state": "Saarland",
      "amtsgericht": "Amtsgericht Saarbrücken",
      "registernummer": "HRB 104331",
      "registerart": "HRB",
      "company_name": "Riddle Technologies AG",
      "company_seat": "Saarbrücken",
      "details": "12.11.2024 (Bekanntmachungsdatum)\n\nSaarland Amtsgericht Saarbrücken HRB 104331\nEinreichung neuer Dokumente\n\nRiddle Technologies AG\nAktiengesellschaft\nSaarbrücken\n\nDer Vorstand der Gesellschaft hat eine Liste der Mitglieder des Aufsichtsrats zum Handelsregister eingereicht (§ 106 AktG)."
    },
    {
      "date": "2024-11-12",
      "id": "93237",
      "original_text": "Löschungsankündigung\nBerlin Amtsgericht Berlin (Charlottenburg) HRB 234716\nRushford Business School GmbH – Berlin",
      "type": "Löschungsankündigung",
      "state": "Berlin",
      "amtsgericht": "Amtsgericht Berlin (Charlottenburg)",
      "registernummer": "HRB 234716",
      "registerart": "HRB",
      "company_name": "Rushford Business School GmbH",
      "company_seat": "Berlin",
      "details": "12.11.2024 (Bekanntmachungsdatum)\n\nBerlin Amtsgericht Berlin (Charlottenburg) HRB 234716\nLöschungsankündigung\n\nRushford Business School GmbH\nGesellschaft mit beschränkter Haftung\nBerlin\n\nBei der nachstehenden Gesellschaft wird das Amtslöschungsverfahren gemäß § 394 FamFG eingeleitet. Widerspruchsfrist 6 Wochen"
    },
    {
      "date": "2024-11-12",
      "id": "93302",
      "original_text": "Registerbekanntmachung nach dem Umwandlungsgesetz\nHessen Amtsgericht Fulda HRB 5597\nSCC Communication Center GmbH – Fulda",
      "type": "Registerbekanntmachung nach dem Umwandlungsgesetz",
      "state": "Hessen",
      "amtsgericht": "Amtsgericht Fulda",
      "registernummer": "HRB 5597",
      "registerart": "HRB",
      "company_name": "SCC Communication Center GmbH",
      "company_seat": "Fulda",
      "details": "12.11.2024 (Bekanntmachungsdatum)\n\nHessen Amtsgericht Fulda HRB 5597\nRegisterbekanntmachung nach dem Umwandlungsgesetz 12.11.2024 (Eintragungsdatum)\n\nSCC Communication Center GmbH\nGesellschaft mit beschränkter Haftung\nFulda\n\nDen Gläubigern der an der Verschmelzung beteiligten Rechtsträger ist, wenn sie binnen sechs Monaten nach dem Tag, an dem die Eintragung der Verschmelzung in das Register des Sitzes desjenigen Rechtsträgers, dessen Gläubiger sie sind, nach § 19 Absatz 3 UmwG bekannt gemacht worden ist, ihren Anspruch nach Grund und Höhe schriftlich anmelden, Sicherheit zu leisten, soweit sie nicht Befriedigung verlangen können. Dieses Recht steht den Gläubigern jedoch nur zu, wenn sie glaubhaft machen, dass durch die Verschmelzung die Erfüllung ihrer Forderung gefährdet wird."
    },
    {
      "date": "2024-11-12",
      "id": "93246",
      "original_text": "Einreichung neuer Dokumente\nBaden-Württemberg Amtsgericht Stuttgart HRB 106124\nSLK-Kliniken Heilbronn GmbH – Heilbronn",
      "type": "Einreichung neuer Dokumente",
      "state": "Baden-Württemberg",
      "amtsgericht": "Amtsgericht Stuttgart",
      "registernummer": "HRB 106124",
      "registerart": "HRB",
      "company_name": "SLK-Kliniken Heilbronn GmbH",
      "company_seat": "Heilbronn",
      "details": "12.11.2024 (Bekanntmachungsdatum)\n\nBaden-Württemberg Amtsgericht Stuttgart HRB 106124\nEinreichung neuer Dokumente\n\nSLK-Kliniken Heilbronn GmbH\nGesellschaft mit beschränkter Haftung\nHeilbronn\n\nDie Gesellschaft hat am 08.11.2024 die Liste über die Zusammensetzung des Aufsichtsrats zum Handelsregister eingereicht."
    },
    {
      "date": "2024-11-12",
      "id": "93219",
      "original_text": "Einreichung neuer Dokumente\nMecklenburg-Vorpommern Amtsgericht Stralsund HRB 1565 früher Amtsgericht Rostock\nSWS Stadtwerke Stralsund GmbH – Stralsund",
      "type": "Einreichung neuer Dokumente",
      "state": "Mecklenburg-Vorpommern",
      "amtsgericht": "Amtsgericht Stralsund",
      "registernummer": "HRB 1565",
      "registerart": "HRB",
      "company_name": "SWS Stadtwerke Stralsund GmbH",
      "company_seat": "Stralsund",
      "former_amtsgericht": "Rostock",
      "details": "12.11.2024 (Bekanntmachungsdatum)\n\nMecklenburg-Vorpommern Amtsgericht Stralsund HRB 1565 früher Amtsgericht Rostock\nEinreichung neuer Dokumente\n\nSWS Stadtwerke Stralsund GmbH\nGesellschaft mit beschränkter Haftung\nStralsund\n\nEine Liste der Mitglieder des Aufsichtsrats ist zum Handelsregister eingereicht worden."
    },
    {
      "date": "2024-11-12",
      "id": "93181",
      "original_text": "Einreichung neuer Dokumente\nBayern Amtsgericht München HRB 246540\nSYNLAB AG – München",
      "type": "Einreichung neuer Dokumente",
      "state": "Bayern",
      "amtsgericht": "Amtsgericht München",
      "registernummer": "HRB 246540",
      "registerart": "HRB",
      "company_name": "SYNLAB AG",
      "company_seat": "München",
      "details": "12.11.2024 (Bekanntmachungsdatum)\n\nBayern Amtsgericht München HRB 246540\nEinreichung neuer Dokumente 11.11.2024 (Eintragungsdatum)\n\nSYNLAB AG\nAktiengesellschaft\nMünchen\n\nDem Amtsgericht München -Registergericht- ist eine Liste der Mitglieder des Aufsichtsrats eingereicht worden, § 106 AktG."
    },
    {
      "date": "2024-11-12",
      "id": "93185",
      "original_text": "Registerbekanntmachung nach dem Umwandlungsgesetz\nBayern Amtsgericht München HRB 288700\nSmall Bore Pistons Holding GmbH – München",
      "type": "Registerbekanntmachung nach dem Umwandlungsgesetz",
      "state": "Bayern",
      "amtsgericht": "Amtsgericht München",
      "registernummer": "HRB 288700",
      "registerart": "HRB",
      "company_name": "Small Bore Pistons Holding GmbH",
      "company_seat": "München",
      "details": "12.11.2024 (Bekanntmachungsdatum)\n\nBayern Amtsgericht München HRB 288700\nRegisterbekanntmachung nach dem Umwandlungsgesetz 11.11.2024 (Eintragungsdatum)\n\nSmall Bore Pistons Holding GmbH\nGesellschaft mit beschränkter Haftung\nMünchen\n\nDen Gläubigern der an der Verschmelzung beteiligten Rechtsträger ist, wenn sie binnen sechs Monaten nach dem Tag, an dem die Eintragung der Verschmelzung in das Register des Sitzes desjenigen Rechtsträgers, dessen Gläubiger sie sind, nach § 19 Abs. 3 UmwG als bekannt gemacht gilt, ihren Anspruch nach Grund und Höhe schriftlich anmelden, Sicherheit zu leisten, soweit sie nicht Befriedigung verlangen können. Dieses Recht steht den Gläubigern jedoch nur zu, wenn sie glaubhaft machen, dass durch die Verschmelzung die Erfüllung ihrer Forderung gefährdet wird."
    },
    {
      "date": "2024-11-12",
      "id": "93210",
      "original_text": "Registerbekanntmachung nach dem Umwandlungsgesetz\nBerlin Amtsgericht Berlin (Charlottenburg) HRB 231601\nSoulicious GmbH – Berlin",
      "type": "Registerbekanntmachung nach dem Umwandlungsgesetz",
      "state": "Berlin",
      "amtsgericht": "Amtsgericht Berlin (Charlottenburg)",
      "registernummer": "HRB 231601",
      "registerart": "HRB",
      "company_name": "Soulicious GmbH",
      "company_seat": "Berlin",
      "details": "12.11.2024 (Bekanntmachungsdatum)\n\nBerlin Amtsgericht Berlin (Charlottenburg) HRB 231601\nRegisterbekanntmachung nach dem Umwandlungsgesetz 07.11.2024 (Eintragungsdatum)\n\nSoulicious GmbH\nGesellschaft mit beschränkter Haftung\nBerlin\n\nZu Eintragungsnummer 3 vom 07.11.2024 wird als nicht eingetragen veröffentlicht: Den Gläubigern ist, wenn sie binnen sechs Monaten nach dem Tag, an dem die Eintragung der Umwandlung als bekannt gemacht gilt, ihren Anspruch nach Grund und Höhe schriftlich anmelden, Sicherheit zu leisten, soweit sie nicht Befriedigung verlangen können. Dieses Recht steht den Gläubigern jedoch nur zu, wenn sie glaubhaft machen, dass durch die Umwandlung die Erfüllung ihrer Forderung gefährdet wird. Das Recht, Sicherheitsleistung zu verlangen, steht Gläubigern nicht zu, die im Falle der Insolvenz ein Recht auf vorzugsweise Befriedigung aus einer Deckungsmasse haben, die nach gesetzlicher Vorschrift zu ihrem Schutz errichtet und staatlich überwacht ist."
    },
    {
      "date": "2024-11-12",
      "id": "93211",
      "original_text": "Registerbekanntmachung nach dem Umwandlungsgesetz\nBerlin Amtsgericht Berlin (Charlottenburg) GsR 2239\nSoulicious-Nachfolge eGbR – Berlin",
      "type": "Registerbekanntmachung nach dem Umwandlungsgesetz",
      "state": "Berlin",
      "amtsgericht": "Amtsgericht Berlin (Charlottenburg)",
      "registernummer": "GsR 2239",
      "registerart": "GsR",
      "company_name": "Soulicious-Nachfolge eGbR",
      "company_seat": "Berlin",
      "details": "12.11.2024 (Bekanntmachungsdatum)\n\nBerlin Amtsgericht Berlin (Charlottenburg) GsR 2239\nRegisterbekanntmachung nach dem Umwandlungsgesetz 07.11.2024 (Eintragungsdatum)\n\nSoulicious-Nachfolge eGbR\nGesellschaft bürgerlichen Rechts\nBerlin\n\nZu Eintragungsnummer 1 vom 07.11.2024 wird als nicht eingetragen veröffentlicht: Den Gläubigern ist, wenn sie binnen sechs Monaten nach dem Tag, an dem die Eintragung der Umwandlung als bekannt gemacht gilt, ihren Anspruch nach Grund und Höhe schriftlich anmelden, Sicherheit zu leisten, soweit sie nicht Befriedigung verlangen können. Dieses Recht steht den Gläubigern jedoch nur zu, wenn sie glaubhaft machen, dass durch die Umwandlung die Erfüllung ihrer Forderung gefährdet wird. Das Recht, Sicherheitsleistung zu verlangen, steht Gläubigern nicht zu, die im Falle der Insolvenz ein Recht auf vorzugsweise Befriedigung aus einer Deckungsmasse haben, die nach gesetzlicher Vorschrift zu ihrem Schutz errichtet und staatlich überwacht ist."
    },
    {
      "date": "2024-11-12",
      "id": "93215",
      "original_text": "Registerbekanntmachung nach dem Umwandlungsgesetz\nBaden-Württemberg Amtsgericht Stuttgart HRA 741483\nSporlastic GmbH & Co. KG – Nürtingen",
      "type": "Registerbekanntmachung nach dem Umwandlungsgesetz",
      "state": "Baden-Württemberg",
      "amtsgericht": "Amtsgericht Stuttgart",
      "registernummer": "HRA 741483",
      "registerart": "HRA",
      "company_name": "Sporlastic GmbH & Co. KG",
      "company_seat": "Nürtingen",
      "details": "12.11.2024 (Bekanntmachungsdatum)\n\nBaden-Württemberg Amtsgericht Stuttgart HRA 741483\nRegisterbekanntmachung nach dem Umwandlungsgesetz 12.11.2024 (Eintragungsdatum)\n\nSporlastic GmbH & Co. KG\nKommanditgesellschaft\nNürtingen\n\nAls nicht eingetragen wird bekanntgemacht:\nDen Gläubigern der an der Ausgliederung beteiligten Rechtsträger ist, wenn sie binnen sechs Monaten nach dem Tag, an dem die Eintragung der Ausgliederung in das Register des Sitzes desjenigen Rechtsträgers, dessen Gläubiger sie sind, nach § 19 Abs. 3 UmwG als bekanntgemacht gilt, ihren Anspruch nach Grund und Höhe schriftlich anmelden, Sicherheit zu leisten, soweit sie nicht Befriedigung verlangen können. Dieses Recht steht den Gläubigern jedoch nur zu, wenn sie glaubhaft machen, dass durch die Ausgliederung die Erfüllung ihrer Forderung gefährdet wird."
    },
    {
      "date": "2024-11-12",
      "id": "93233",
      "original_text": "Sonstige Registerbekanntmachung\nBaden-Württemberg Amtsgericht Stuttgart HRA 741483\nSporlastic GmbH & Co. KG – Nürtingen",
      "type": "Sonstige Registerbekanntmachung",
      "state": "Baden-Württemberg",
      "amtsgericht": "Amtsgericht Stuttgart",
      "registernummer": "HRA 741483",
      "registerart": "HRA",
      "company_name": "Sporlastic GmbH & Co. KG",
      "company_seat": "Nürtingen",
      "details": "12.11.2024 (Bekanntmachungsdatum)\n\nBaden-Württemberg Amtsgericht Stuttgart HRA 741483\nSonstige Registerbekanntmachung 12.11.2024 (Eintragungsdatum)\n\nSporlastic GmbH & Co. KG\nKommanditgesellschaft\nNürtingen\n\nAls nicht eingetragen wird bekanntgemacht:\nDen Gläubigern der Gesellschaft, deren Forderungen begründet worden sind, bevor die Eintragung der Beendigung des Vertrages in das Handelsregister nach § 10 HGB als bekanntgemacht gilt, ist vom anderen Vertragsteil Sicherheit zu leisten, wenn sie sich binnen sechs Monaten nach der Bekanntmachung zu diesem Zweck bei ihm melden."
    },
    {
      "date": "2024-11-12",
      "id": "93209",
      "original_text": "Sonstige Registerbekanntmachung\nMecklenburg-Vorpommern Amtsgericht Rostock HRB 2962\nStadtwerke Neubukow GmbH – Neubukow",
      "type": "Sonstige Registerbekanntmachung",
      "state": "Mecklenburg-Vorpommern",
      "amtsgericht": "Amtsgericht Rostock",
      "registernummer": "HRB 2962",
      "registerart": "HRB",
      "company_name": "Stadtwerke Neubukow GmbH",
      "company_seat": "Neubukow",
      "details": "12.11.2024 (Bekanntmachungsdatum)\n\nMecklenburg-Vorpommern Amtsgericht Rostock HRB 2962\nSonstige Registerbekanntmachung\n\nStadtwerke Neubukow GmbH\nGesellschaft mit beschränkter Haftung\nNeubukow\n\nEine Liste der Mitglieder des Aufsichtsrats ist zum Handelsregister eingereicht worden."
    },
    {
      "date": "2024-11-12",
      "id": "93290",
      "original_text": "Registerbekanntmachung nach dem Umwandlungsgesetz\nNordrhein-Westfalen Amtsgericht Köln HRB 84055\nStaycity Hamburg GmbH – Köln",
      "type": "Registerbekanntmachung nach dem Umwandlungsgesetz",
      "state": "Nordrhein-Westfalen",
      "amtsgericht": "Amtsgericht Köln",
      "registernummer": "HRB 84055",
      "registerart": "HRB",
      "company_name": "Staycity Hamburg GmbH",
      "company_seat": "Köln",
      "details": "12.11.2024 (Bekanntmachungsdatum)\n\nNordrhein-Westfalen Amtsgericht Köln HRB 84055\nRegisterbekanntmachung nach dem Umwandlungsgesetz 12.11.2024 (Eintragungsdatum)\n\nStaycity Hamburg GmbH\nGesellschaft mit beschränkter Haftung\nKöln\n\nDen Gläubigern der an der Ausgliederung beteiligten Rechtsträger ist, wenn sie binnen sechs Monaten nach dem Tag, an dem die Eintragung der Ausgliederung in das Register des Sitzes desjenigen Rechtsträgers, dessen Gläubiger sie sind, nach § 19 Absatz 3 UmwG als bekanntgemacht gilt, ihren Anspruch nach Grund und Höhe schriftlich anmelden, Sicherheit zu leisten, soweit sie nicht Befriedigung verlangen können. Dieses Recht steht den Gläubigern jedoch nur zu, wenn sie glaubhaft machen, dass durch die Ausgliederung die Erfüllung ihrer Forderung gefährdet wird."
    },
    {
      "date": "2024-11-12",
      "id": "93263",
      "original_text": "Registerbekanntmachung nach dem Umwandlungsgesetz\nNiedersachsen Amtsgericht Tostedt HRB 201482\nStukenborg Holding Verwaltungs- und Beteiligunggesellschaft mbH – Loxstedt-Düring",
      "type": "Registerbekanntmachung nach dem Umwandlungsgesetz",
      "state": "Niedersachsen",
      "amtsgericht": "Amtsgericht Tostedt",
      "registernummer": "HRB 201482",
      "registerart": "HRB",
      "company_name": "Stukenborg Holding Verwaltungs- und Beteiligunggesellschaft mbH",
      "company_seat": "Loxstedt-Düring",
      "details": "12.11.2024 (Bekanntmachungsdatum)\n\nNiedersachsen Amtsgericht Tostedt HRB 201482\nRegisterbekanntmachung nach dem Umwandlungsgesetz 12.11.2024 (Eintragungsdatum)\n\nStukenborg Holding Verwaltungs- und Beteiligunggesellschaft mbH\nGesellschaft mit beschränkter Haftung\nLoxstedt-Düring\n\nDen Gläubigern der an der Verschmelzung beteiligten Rechtsträger ist, wenn sie binnen sechs Monaten nach dem Tag, an dem die Eintragung der Verschmelzung in das Register des Sitzes desjenigen Rechtsträgers, dessen Gläubiger sie sind, nach § 19  Abs.  3 UmwG als bekannt gemacht gilt, ihren Anspruch nach Grund und Höhe schriftlich anmelden, Sicherheit zu leisten, soweit sie nicht Befriedigung verlangen können. Dieses Recht steht den Gläubigern jedoch nur zu, wenn sie glaubhaft machen, dass durch die Verschmelzung die Erfüllung der Forderung gefährdet wird."
    },
    {
      "date": "2024-11-12",
      "id": "93283",
      "original_text": "Löschungsankündigung\nNordrhein-Westfalen Amtsgericht Düsseldorf HRB 69241\nTAM Investor GmbH – Düsseldorf",
      "type": "Löschungsankündigung",
      "state": "Nordrhein-Westfalen",
      "amtsgericht": "Amtsgericht Düsseldorf",
      "registernummer": "HRB 69241",
      "registerart": "HRB",
      "company_name": "TAM Investor GmbH",
      "company_seat": "Düsseldorf",
      "details": "12.11.2024 (Bekanntmachungsdatum)\n\nNordrhein-Westfalen Amtsgericht Düsseldorf HRB 69241\nLöschungsankündigung\n\nTAM Investor GmbH\nGesellschaft mit beschränkter Haftung\nDüsseldorf\n\nDas Registergericht beabsichtigt die Gesellschaft von Amts wegen nach § 394 FamFG zu löschen. Die Frist zur Erhebung eines Widerspruchs ist auf 3 Wochen festgesetzt.\n\nRechtsbehelfsbelehrung:\nDas Widerspruchsrecht steht jedem zu, der an der Unterlassung der Löschung ein berechtigtes Interesse hat. Der Widerspruch ist bei dem Amtsgericht Düsseldorf -Registergericht-, Werdener Straße 1, 40227 Düsseldorf schriftlich in deutscher Sprache oder zur Niederschrift der Geschäftsstelle einzulegen. Der Widerspruch kann auch zur Niederschrift der Geschäftsstelle eines jeden Amtsgerichtes abgegeben werden. Die Einlegung ist auch durch Übertragung eines elektronischen Dokuments an die elektronische Poststelle des Gerichts möglich. Das elektronische Dokument muss für die Bearbeitung durch das Gericht geeignet und mit einer qualifizierten elektronischen Signatur der verantwortenden Person versehen sein oder von der verantwortenden Person signiert und auf einem sicheren Übermittlungsweg gemäß § 130a ZPO nach näherer Maßgabe der Verordnung über die technischen Rahmenbedingungen des elektronischen Rechtsverkehrs und über das besondere elektronische Behördenpostfach (BGBl. I, S.3803) eingereicht werden. Weitere Informationen erhalten Sie auf der Internetseite www.justiz.de.\nDer Widerspruch muss spätestens innerhalb der gesetzten Frist nach dem Datum der Bekanntmachung der Löschungsankündigung bei dem Amtsgericht - Registergericht - Düsseldorf eingegangen sein.  Dies gilt auch dann, wenn der Widerspruch zur Niederschrift der Geschäftsstelle eines anderen Amtsgerichtes abgegeben wurde. Die Frist beginnt mit dem Tage der Bekanntmachung der Löschungsankündigung in dem für die Bekanntmachung der Eintragungen in das Handelsregister bestimmten elektronischen Informations- und Kommunikationssystem nach § 10 des Handelsgesetzbuches. Fällt das Ende der Frist auf einen Sonntag, einen allgemeinen Feiertag oder Sonnabend, so endet die Frist mit Ablauf des nächsten Werktages.\nDer Widerspruch muss die Bezeichnung der angefochtenen Löschungsankündigung sowie die Erklärung enthalten, dass Widerspruch gegen diese Löschungsankündigung eingelegt wird. Er ist zu unterzeichnen und soll begründet werden."
    },
    {
      "date": "2024-11-12",
      "id": "93255",
      "original_text": "Registerbekanntmachung nach dem Umwandlungsgesetz\nSachsen Amtsgericht Leipzig HRA 19588\nThomas Steinert e.K. – Leipzig",
      "type": "Registerbekanntmachung nach dem Umwandlungsgesetz",
      "state": "Sachsen",
      "amtsgericht": "Amtsgericht Leipzig",
      "registernummer": "HRA 19588",
      "registerart": "HRA",
      "company_name": "Thomas Steinert e.K.",
      "company_seat": "Leipzig",
      "details": "12.11.2024 (Bekanntmachungsdatum)\n\nSachsen Amtsgericht Leipzig HRA 19588\nRegisterbekanntmachung nach dem Umwandlungsgesetz 12.11.2024 (Eintragungsdatum)\n\nThomas Steinert e.K.\nEinzelkaufmann / Einzelkauffrau\nLeipzig\n\nDen Gläubigern der an der Ausgliederung beteiligten Rechtsträger ist, wenn sie binnen sechs Monaten nach dem Tag, an dem die Eintragung der Ausgliederung in das Register des Sitzes desjenigen Rechtsträgers, dessen Gläubiger sie sind, nach § 19 Abs. 3 UmwG als bekannt gemacht gilt, ihren Anspruch nach Grund und Höhe schriftlich anmelden, Sicherheit zu leisten, soweit sie nicht Befriedigung verlangen können. Dieses Recht steht den Gläubigern jedoch nur zu, wenn sie glaubhaft machen, dass durch die Ausgliederung die Erfüllung der Forderung gefährdet wird."
    },
    {
      "date": "2024-11-12",
      "id": "93217",
      "original_text": "Löschungsankündigung\nBaden-Württemberg Amtsgericht Stuttgart HRB 786259\nTiger Fane Bau GmbH – Böblingen",
      "type": "Löschungsankündigung",
      "state": "Baden-Württemberg",
      "amtsgericht": "Amtsgericht Stuttgart",
      "registernummer": "HRB 786259",
      "registerart": "HRB",
      "company_name": "Tiger Fane Bau GmbH",
      "company_seat": "Böblingen",
      "details": "12.11.2024 (Bekanntmachungsdatum)\n\nBaden-Württemberg Amtsgericht Stuttgart HRB 786259\nLöschungsankündigung\n\nTiger Fane Bau GmbH\nGesellschaft mit beschränkter Haftung\nBöblingen\n\nAls nicht eingetragen wird bekanntgemacht:\nDas Gericht beabsichtigt, die Gesellschaft wegen Vermögenslosigkeit im Handelsregister von Amts wegen nach § 394 FamFG zu löschen. Die Frist zur Geltendmachung eines Widerspruchs gegen die beabsichtigte Löschung ist auf zwei Monate ab Veröffentlichung bestimmt."
    },
    {
      "date": "2024-11-12",
      "id": "93274",
      "original_text": "Sonstige Registerbekanntmachung\nNordrhein-Westfalen Amtsgericht Köln HRB 56171\nTÜV Rheinland Energy & Environment GmbH – Köln",
      "type": "Sonstige Registerbekanntmachung",
      "state": "Nordrhein-Westfalen",
      "amtsgericht": "Amtsgericht Köln",
      "registernummer": "HRB 56171",
      "registerart": "HRB",
      "company_name": "TÜV Rheinland Energy & Environment GmbH",
      "company_seat": "Köln",
      "details": "12.11.2024 (Bekanntmachungsdatum)\n\nNordrhein-Westfalen Amtsgericht Köln HRB 56171\nSonstige Registerbekanntmachung 12.11.2024 (Eintragungsdatum)\n\nTÜV Rheinland Energy & Environment GmbH\nGesellschaft mit beschränkter Haftung\nKöln\n\nAls nicht eingetragen wird veröffentlicht: Den Gläubigern der Gesellschaft, deren Forderungen begründet worden sind bevor die Eintragung der Beendigung des Beherrschungs- und Gewinnabführungsvertrages  in das Handelsregister nach § 10 des Handelsgesetzbuches als bekanntgemacht gilt, hat der andere Vertragsteil Sicherheit zu leisten, wenn sie sich binnen sechs Monaten nach der Bekanntmachung der Eintragung zu diesem Zweck bei ihm melden."
    },
    {
      "date": "2024-11-12",
      "id": "93261",
      "original_text": "Löschungsankündigung\nNiedersachsen Amtsgericht Hannover HRB 215476\nTörtchen Events & Catering UG (haftungsbeschränkt) – Ronnenberg",
      "type": "Löschungsankündigung",
      "state": "Niedersachsen",
      "amtsgericht": "Amtsgericht Hannover",
      "registernummer": "HRB 215476",
      "registerart": "HRB",
      "company_name": "Törtchen Events & Catering UG (haftungsbeschränkt)",
      "company_seat": "Ronnenberg",
      "details": "12.11.2024 (Bekanntmachungsdatum)\n\nNiedersachsen Amtsgericht Hannover HRB 215476\nLöschungsankündigung\n\nTörtchen Events & Catering UG (haftungsbeschränkt)\nGesellschaft mit beschränkter Haftung\nRonnenberg\n\nDas Registergericht beabsichtigt, die Gesellschaft von Amts wegen nach § 394 FamFG zu löschen. Die Frist zur Erhebung eines Widerspruchs ist auf 1 Monat ab dieser Registerbekanntmachung festgesetzt."
    },
    {
      "date": "2024-11-12",
      "id": "93251",
      "original_text": "Sonstige Registerbekanntmachung\nSachsen Amtsgericht Dresden HRB 34882\nVAMED Klinik Schloss Pulsnitz GmbH – Pulsnitz",
      "type": "Sonstige Registerbekanntmachung",
      "state": "Sachsen",
      "amtsgericht": "Amtsgericht Dresden",
      "registernummer": "HRB 34882",
      "registerart": "HRB",
      "company_name": "VAMED Klinik Schloss Pulsnitz GmbH",
      "company_seat": "Pulsnitz",
      "details": "12.11.2024 (Bekanntmachungsdatum)\n\nSachsen Amtsgericht Dresden HRB 34882\nSonstige Registerbekanntmachung 12.11.2024 (Eintragungsdatum)\n\nVAMED Klinik Schloss Pulsnitz GmbH\nGesellschaft mit beschränkter Haftung\nPulsnitz\n\nDen Gläubigern der Gesellschaft, deren Forderungen begründet worden sind bevor die Eintragung der Beendigung des Beherrschungs- und Gewinnabführungsvertrages in das Handelsregister nach § 10 des Handelsgesetzbuches als bekanntgemacht gilt, hat der andere Vertragsteil Sicherheit zu leisten, wenn sie sich binnen sechs Monaten nach der Bekanntmachung der Eintragung zu diesem Zweck bei ihm melden."
    },
    {
      "date": "2024-11-12",
      "id": "93250",
      "original_text": "Sonstige Registerbekanntmachung\nSachsen Amtsgericht Dresden HRB 34926\nVAMED Rehaklinik Schwedenstein GmbH – Pulsnitz",
      "type": "Sonstige Registerbekanntmachung",
      "state": "Sachsen",
      "amtsgericht": "Amtsgericht Dresden",
      "registernummer": "HRB 34926",
      "registerart": "HRB",
      "company_name": "VAMED Rehaklinik Schwedenstein GmbH",
      "company_seat": "Pulsnitz",
      "details": "12.11.2024 (Bekanntmachungsdatum)\n\nSachsen Amtsgericht Dresden HRB 34926\nSonstige Registerbekanntmachung 12.11.2024 (Eintragungsdatum)\n\nVAMED Rehaklinik Schwedenstein GmbH\nGesellschaft mit beschränkter Haftung\nPulsnitz\n\nDen Gläubigern der Gesellschaft, deren Forderungen begründet worden sind bevor die Eintragung der Beendigung des Beherrschungs- und Gewinnabführungsvertrages in das Handelsregister nach § 10 des Handelsgesetzbuches als bekanntgemacht gilt, hat der andere Vertragsteil Sicherheit zu leisten, wenn sie sich binnen sechs Monaten nach der Bekanntmachung der Eintragung zu diesem Zweck bei ihm melden."
    },
    {
      "date": "2024-11-12",
      "id": "93212",
      "original_text": "Einreichung neuer Dokumente\nBerlin Amtsgericht Berlin (Charlottenburg) HRB 179282\nVattenfall Wasserkraft GmbH – Berlin",
      "type": "Einreichung neuer Dokumente",
      "state": "Berlin",
      "amtsgericht": "Amtsgericht Berlin (Charlottenburg)",
      "registernummer": "HRB 179282",
      "registerart": "HRB",
      "company_name": "Vattenfall Wasserkraft GmbH",
      "company_seat": "Berlin",
      "details": "12.11.2024 (Bekanntmachungsdatum)\n\nBerlin Amtsgericht Berlin (Charlottenburg) HRB 179282\nEinreichung neuer Dokumente\n\nVattenfall Wasserkraft GmbH\nGesellschaft mit beschränkter Haftung\nBerlin\n\nAls nicht eingetragen wird veröffentlicht: Es wurde eine neue Liste der Aufsichtsratsmitglieder eingereicht (§52 GmbHG)"
    },
    {
      "date": "2024-11-12",
      "id": "93298",
      "original_text": "Sonstige Registerbekanntmachung\nHessen Amtsgericht Wetzlar HRB 2426\nVerkehrsgesellschaft Lahn-Dill-Weil mbH – Wetzlar",
      "type": "Sonstige Registerbekanntmachung",
      "state": "Hessen",
      "amtsgericht": "Amtsgericht Wetzlar",
      "registernummer": "HRB 2426",
      "registerart": "HRB",
      "company_name": "Verkehrsgesellschaft Lahn-Dill-Weil mbH",
      "company_seat": "Wetzlar",
      "details": "12.11.2024 (Bekanntmachungsdatum)\n\nHessen Amtsgericht Wetzlar HRB 2426\nSonstige Registerbekanntmachung\n\nVerkehrsgesellschaft Lahn-Dill-Weil mbH\nGesellschaft mit beschränkter Haftung\nWetzlar\n\nDurch eine Änderung in den Personen der Aufsichtsratsmitglieder ist eine Liste der Mitglieder des Aufsichtsrates zum Handelsregister eingereicht worden."
    },
    {
      "date": "2024-11-12",
      "id": "93270",
      "original_text": "Registerbekanntmachung nach dem Umwandlungsgesetz\nRheinland-Pfalz Amtsgericht Wittlich HRA 42097\nW&S Dachdeckerei Osburg e.K. – Osburg",
      "type": "Registerbekanntmachung nach dem Umwandlungsgesetz",
      "state": "Rheinland-Pfalz",
      "amtsgericht": "Amtsgericht Wittlich",
      "registernummer": "HRA 42097",
      "registerart": "HRA",
      "company_name": "W&S Dachdeckerei Osburg e.K.",
      "company_seat": "Osburg",
      "details": "12.11.2024 (Bekanntmachungsdatum)\n\nRheinland-Pfalz Amtsgericht Wittlich HRA 42097\nRegisterbekanntmachung nach dem Umwandlungsgesetz 12.11.2024 (Eintragungsdatum)\n\nW&S Dachdeckerei Osburg e.K.\nEinzelkaufmann / Einzelkauffrau\nOsburg\n\nAls nicht eingetragen wird veröffentlicht: Den Gläubigern der an der Ausgliederung beteiligten Rechtsträger ist, wenn sie binnen sechs Monaten nach dem Tag, an dem die Eintragung der Ausgliederung in das Register des Sitzes desjenigen Rechtsträgers,dessen Gläubiger sie sind, nach § 19 Abs. 3 UmwG als bekannt gemacht gilt, ihren Anspruch nach Grund und Höhe schriftlich anmelden, Sicherheit zu leisten, soweit sie nicht Befriedigung verlangen können. Dieses Recht steht den Gläubigern jedoch nur zu, wenn sie glaubhaft machen, dass durch die Ausgliederung die Erfüllung der Forderung gefährdet wird."
    },
    {
      "date": "2024-11-12",
      "id": "93248",
      "original_text": "Registerbekanntmachung nach dem Umwandlungsgesetz\nBaden-Württemberg Amtsgericht Ulm HRB 728253\nWalter Solar PV-Anlagen GmbH – Ellwangen Jagst",
      "type": "Registerbekanntmachung nach dem Umwandlungsgesetz",
      "state": "Baden-Württemberg",
      "amtsgericht": "Amtsgericht Ulm",
      "registernummer": "HRB 728253",
      "registerart": "HRB",
      "company_name": "Walter Solar PV-Anlagen GmbH",
      "company_seat": "Ellwangen Jagst",
      "details": "12.11.2024 (Bekanntmachungsdatum)\n\nBaden-Württemberg Amtsgericht Ulm HRB 728253\nRegisterbekanntmachung nach dem Umwandlungsgesetz 12.11.2024 (Eintragungsdatum)\n\nWalter Solar PV-Anlagen GmbH\nGesellschaft mit beschränkter Haftung\nEllwangen Jagst\n\nDen Gläubigern der an der Verschmelzung beteiligten Rechtsträger ist, wenn sie binnen sechs Monaten nach dem Tag, an dem die Eintragung der Verschmelzung in das Register des Sitzes desjenigen Rechtsträgers, dessen Gläubiger sie sind, nach § 19 Abs. 3 UmwG als bekanntgemacht gilt, ihren Anspruch nach Grund und Höhe schriftlich anmelden, Sicherheit zu leisten, soweit sie nicht Befriedigung verlangen können. Dieses Recht steht den Gläubigern jedoch nur zu, wenn sie glaubhaft machen, dass durch die Verschmelzung die Erfüllung ihrer Forderung gefährdet wird."
    },
    {
      "date": "2024-11-12",
      "id": "93249",
      "original_text": "Registerbekanntmachung nach dem Umwandlungsgesetz\nBaden-Württemberg Amtsgericht Ulm HRA 728523\nWalter solar pv-anlagen GmbH & Co. KG – Bopfingen",
      "type": "Registerbekanntmachung nach dem Umwandlungsgesetz",
      "state": "Baden-Württemberg",
      "amtsgericht": "Amtsgericht Ulm",
      "registernummer": "HRA 728523",
      "registerart": "HRA",
      "company_name": "Walter solar pv-anlagen GmbH & Co. KG",
      "company_seat": "Bopfingen",
      "details": "12.11.2024 (Bekanntmachungsdatum)\n\nBaden-Württemberg Amtsgericht Ulm HRA 728523\nRegisterbekanntmachung nach dem Umwandlungsgesetz 12.11.2024 (Eintragungsdatum)\n\nWalter solar pv-anlagen GmbH & Co. KG\nKommanditgesellschaft\nBopfingen\n\nDen Gläubigern der an der Verschmelzung beteiligten Rechtsträger ist, wenn sie binnen sechs Monaten nach dem Tag, an dem die Eintragung der Verschmelzung in das Register des Sitzes desjenigen Rechtsträgers, dessen Gläubiger sie sind, nach § 19 Abs. 3 UmwG als bekanntgemacht gilt, ihren Anspruch nach Grund und Höhe schriftlich anmelden, Sicherheit zu leisten, soweit sie nicht Befriedigung verlangen können. Dieses Recht steht den Gläubigern jedoch nur zu, wenn sie glaubhaft machen, dass durch die Verschmelzung die Erfüllung ihrer Forderung gefährdet wird."
    },
    {
      "date": "2024-11-12",
      "id": "93229",
      "original_text": "Sonstige Registerbekanntmachung\nBerlin Amtsgericht Berlin (Charlottenburg) HRB 67092\nWindrose Finest Travel GmbH – Berlin",
      "type": "Sonstige Registerbekanntmachung",
      "state": "Berlin",
      "amtsgericht": "Amtsgericht Berlin (Charlottenburg)",
      "registernummer": "HRB 67092",
      "registerart": "HRB",
      "company_name": "Windrose Finest Travel GmbH",
      "company_seat": "Berlin",
      "details": "12.11.2024 (Bekanntmachungsdatum)\n\nBerlin Amtsgericht Berlin (Charlottenburg) HRB 67092\nSonstige Registerbekanntmachung\n\nWindrose Finest Travel GmbH\nGesellschaft mit beschränkter Haftung\nBerlin\n\nAls nicht eingetragen wird veröffentlicht:Der andere Vertragsteil hat den Gläubigern dieses Rechtsträgers, deren Forderungen begründet worden sind, bevor die Eintragung der Beendigung dieses Vertrages in das Handelsregister nach § 10 des Handelsgesetzbuches als bekannt gemacht gilt, Sicherheit zu leisten, wenn sie sich binnen sechs Monaten nach der Bekanntmachung der Eintragung zu diesem Zweck bei ihm melden. Dieses Recht steht den Gläubigern nicht zu, die im Fall des Insolvenzverfahrens ein Recht auf vorzugsweise Befriedigung aus der Deckungsmasse haben, die nach gesetzlicher Vorschrift zu ihrem Schutz errichtet und staatlich überwacht ist."
    },
    {
      "date": "2024-11-12",
      "id": "93200",
      "original_text": "Einreichung neuer Dokumente\nBayern Amtsgericht Ingolstadt HRB 3493\nWittmann & Hofmann AG – Ingolstadt",
      "type": "Einreichung neuer Dokumente",
      "state": "Bayern",
      "amtsgericht": "Amtsgericht Ingolstadt",
      "registernummer": "HRB 3493",
      "registerart": "HRB",
      "company_name": "Wittmann & Hofmann AG",
      "company_seat": "Ingolstadt",
      "details": "12.11.2024 (Bekanntmachungsdatum)\n\nBayern Amtsgericht Ingolstadt HRB 3493\nEinreichung neuer Dokumente\n\nWittmann & Hofmann AG\nAktiengesellschaft\nIngolstadt\n\nDem Amtsgericht Ingolstadt -Registergericht- ist eine Liste der Mitglieder des Aufsichtsrats eingereicht worden, § 106 AktG."
    },
    {
      "date": "2024-11-12",
      "id": "93183",
      "original_text": "Einreichung neuer Dokumente\nBayern Amtsgericht Fürth HRB 7821\nWohnen in Deutschland AG – Erlangen",
      "type": "Einreichung neuer Dokumente",
      "state": "Bayern",
      "amtsgericht": "Amtsgericht Fürth",
      "registernummer": "HRB 7821",
      "registerart": "HRB",
      "company_name": "Wohnen in Deutschland AG",
      "company_seat": "Erlangen",
      "details": "12.11.2024 (Bekanntmachungsdatum)\n\nBayern Amtsgericht Fürth HRB 7821\nEinreichung neuer Dokumente\n\nWohnen in Deutschland AG\nAktiengesellschaft\nErlangen\n\nDem Amtsgericht Fürth -Registergericht- ist eine Liste der Mitglieder des Aufsichtsrats eingereicht worden, § 106 AktG."
    },
    {
      "date": "2024-11-12",
      "id": "93227",
      "original_text": "Löschungsankündigung\nBerlin Amtsgericht Berlin (Charlottenburg) HRB 178608\nairberry GmbH – Berlin",
      "type": "Löschungsankündigung",
      "state": "Berlin",
      "amtsgericht": "Amtsgericht Berlin (Charlottenburg)",
      "registernummer": "HRB 178608",
      "registerart": "HRB",
      "company_name": "airberry GmbH",
      "company_seat": "Berlin",
      "details": "12.11.2024 (Bekanntmachungsdatum)\n\nBerlin Amtsgericht Berlin (Charlottenburg) HRB 178608\nLöschungsankündigung\n\nairberry GmbH\nGesellschaft mit beschränkter Haftung\nBerlin\n\nBei der nachstehenden Gesellschaft wird das Amtslöschungsverfahren gemäß § 394 FamFG eingeleitet. Widerspruchsfrist 6 Wochen"
    },
    {
      "date": "2024-11-12",
      "id": "93189",
      "original_text": "Einreichung neuer Dokumente\nBayern Amtsgericht Augsburg HRB 19907\navg Augsburger Verkehrsgesellschaft mbH – Augsburg",
      "type": "Einreichung neuer Dokumente",
      "state": "Bayern",
      "amtsgericht": "Amtsgericht Augsburg",
      "registernummer": "HRB 19907",
      "registerart": "HRB",
      "company_name": "avg Augsburger Verkehrsgesellschaft mbH",
      "company_seat": "Augsburg",
      "details": "12.11.2024 (Bekanntmachungsdatum)\n\nBayern Amtsgericht Augsburg HRB 19907\nEinreichung neuer Dokumente 11.11.2024 (Eintragungsdatum)\n\navg Augsburger Verkehrsgesellschaft mbH\nGesellschaft mit beschränkter Haftung\nAugsburg\n\nDem Registergericht Augsburg ist eine Liste der Mitglieder des Aufsichtsrats eingereicht worden, § 52 Abs. 3 S. 2 GmbHG."
    },
    {
      "date": "2024-11-12",
      "id": "93260",
      "original_text": "Registerbekanntmachung nach dem Umwandlungsgesetz\nNiedersachsen Amtsgericht Hannover HRB 57821\nblumaks GmbH – Hannover",
      "type": "Registerbekanntmachung nach dem Umwandlungsgesetz",
      "state": "Niedersachsen",
      "amtsgericht": "Amtsgericht Hannover",
      "registernummer": "HRB 57821",
      "registerart": "HRB",
      "company_name": "blumaks GmbH",
      "company_seat": "Hannover",
      "details": "12.11.2024 (Bekanntmachungsdatum)\n\nNiedersachsen Amtsgericht Hannover HRB 57821\nRegisterbekanntmachung nach dem Umwandlungsgesetz 12.11.2024 (Eintragungsdatum)\n\nblumaks GmbH\nGesellschaft mit beschränkter Haftung\nHannover\n\nDen Gläubigern der an der Verschmelzung beteiligten Rechtsträger ist, wenn sie binnen sechs Monaten nach dem Tag, an dem die Eintragung der Verschmelzung in das Register des Sitzes desjenigen Rechtsträgers, dessen Gläubiger sie sind, nach § 19  Abs.  3 UmwG als bekannt gemacht gilt, ihren Anspruch nach Grund und Höhe schriftlich anmelden, Sicherheit zu leisten, soweit sie nicht Befriedigung verlangen können. Dieses Recht steht den Gläubigern jedoch nur zu, wenn sie glaubhaft machen, dass durch die Verschmelzung die Erfüllung der Forderung gefährdet wird."
    },
    {
      "date": "2024-11-12",
      "id": "93241",
      "original_text": "Registerbekanntmachung nach dem Umwandlungsgesetz\nBaden-Württemberg Amtsgericht Stuttgart HRB 756437\nhi tx GmbH – Filderstadt",
      "type": "Registerbekanntmachung nach dem Umwandlungsgesetz",
      "state": "Baden-Württemberg",
      "amtsgericht": "Amtsgericht Stuttgart",
      "registernummer": "HRB 756437",
      "registerart": "HRB",
      "company_name": "hi tx GmbH",
      "company_seat": "Filderstadt",
      "details": "12.11.2024 (Bekanntmachungsdatum)\n\nBaden-Württemberg Amtsgericht Stuttgart HRB 756437\nRegisterbekanntmachung nach dem Umwandlungsgesetz 12.11.2024 (Eintragungsdatum)\n\nhi tx GmbH\nGesellschaft mit beschränkter Haftung\nFilderstadt\n\nDen Gläubigern der an der Verschmelzung beteiligten Rechtsträger ist, wenn sie binnen sechs Monaten nach dem Tag, an dem die Eintragung der Verschmelzung in das Register des Sitzes desjenigen Rechtsträgers, dessen Gläubiger sie sind, nach § 19 Abs. 3 UmwG als bekanntgemacht gilt, ihren Anspruch nach Grund und Höhe schriftlich anmelden, Sicherheit zu leisten, soweit sie nicht Befriedigung verlangen können. Dieses Recht steht den Gläubigern jedoch nur zu, wenn sie glaubhaft machen, dass durch die Verschmelzung die Erfüllung ihrer Forderung gefährdet wird."
    },
    {
      "date": "2024-11-12",
      "id": "93218",
      "original_text": "Einreichung neuer Dokumente\nBerlin Amtsgericht Berlin (Charlottenburg) HRB 206131\nhy Team AG – Berlin",
      "type": "Einreichung neuer Dokumente",
      "state": "Berlin",
      "amtsgericht": "Amtsgericht Berlin (Charlottenburg)",
      "registernummer": "HRB 206131",
      "registerart": "HRB",
      "company_name": "hy Team AG",
      "company_seat": "Berlin",
      "details": "12.11.2024 (Bekanntmachungsdatum)\n\nBerlin Amtsgericht Berlin (Charlottenburg) HRB 206131\nEinreichung neuer Dokumente\n\nhy Team AG\nAktiengesellschaft\nBerlin\n\nAls nicht eingetragen wird veröffentlicht: Es wurde eine neue Liste der Aufsichtsratsmitglieder eingereicht (§ 106 AktG)."
    },
    {
      "date": "2024-11-12",
      "id": "93195",
      "original_text": "Einreichung neuer Dokumente\nBayern Amtsgericht München HRB 158525\nsalesforce.com Germany GmbH – München",
      "type": "Einreichung neuer Dokumente",
      "state": "Bayern",
      "amtsgericht": "Amtsgericht München",
      "registernummer": "HRB 158525",
      "registerart": "HRB",
      "company_name": "salesforce.com Germany GmbH",
      "company_seat": "München",
      "details": "12.11.2024 (Bekanntmachungsdatum)\n\nBayern Amtsgericht München HRB 158525\nEinreichung neuer Dokumente 11.11.2024 (Eintragungsdatum)\n\nsalesforce.com Germany GmbH\nGesellschaft mit beschränkter Haftung\nMünchen\n\nDem Amtsgericht München -Registergericht- ist eine Liste der Mitglieder des Aufsichtsrats eingereicht worden, § 52 Abs. 3 S. 2 GmbHG."
    },
    {
      "date": "2024-11-12",
      "id": "93190",
      "original_text": "Einreichung neuer Dokumente\nBayern Amtsgericht Augsburg HRB 29882\nswa Netze GmbH – Augsburg",
      "type": "Einreichung neuer Dokumente",
      "state": "Bayern",
      "amtsgericht": "Amtsgericht Augsburg",
      "registernummer": "HRB 29882",
      "registerart": "HRB",
      "company_name": "swa Netze GmbH",
      "company_seat": "Augsburg",
      "details": "12.11.2024 (Bekanntmachungsdatum)\n\nBayern Amtsgericht Augsburg HRB 29882\nEinreichung neuer Dokumente\n\nswa Netze GmbH\nGesellschaft mit beschränkter Haftung\nAugsburg\n\nDem Amtsgericht Augsburg -Registergericht- ist eine Liste der Mitglieder des Aufsichtsrats eingereicht worden, § 52 Abs. 3 S. 2 GmbHG."
    },
    {
      "date": "2024-11-12",
      "id": "93291",
      "original_text": "Einreichung neuer Dokumente\nNordrhein-Westfalen Amtsgericht Essen HRB 32725\nthyssenkrupp Automotive Body Solutions GmbH – Essen",
      "type": "Einreichung neuer Dokumente",
      "state": "Nordrhein-Westfalen",
      "amtsgericht": "Amtsgericht Essen",
      "registernummer": "HRB 32725",
      "registerart": "HRB",
      "company_name": "thyssenkrupp Automotive Body Solutions GmbH",
      "company_seat": "Essen",
      "details": "12.11.2024 (Bekanntmachungsdatum)\n\nNordrhein-Westfalen Amtsgericht Essen HRB 32725\nEinreichung neuer Dokumente\n\nthyssenkrupp Automotive Body Solutions GmbH\nGesellschaft mit beschränkter Haftung\nEssen\n\nDem Registergericht ist eine neue Liste der Mitglieder des Aufsichtsrates eingereicht worden."
    }
  ]
}