{
  "date": "2024-11-26",
  "date_of_scrape": "2024-11-27T04:10:12.861Z",
  "tool_version": "0.1.0",
  "number_of_announcements": 158,
  "announcements": [
    {
      "date": "2024-11-26",
      "original_text": "Löschungsankündigung\nNordrhein-Westfalen Amtsgericht Bochum HRB 5620\n\"Thobra Verwaltungsgesellschaft mbH\" – Bochum",
      "type": "Löschungsankündigung",
      "state": "Nordrhein-Westfalen",
      "amtsgericht": "Amtsgericht Bochum",
      "registernummer": "HRB 5620",
      "registerart": "HRB",
      "company_name": "\"Thobra Verwaltungsgesellschaft mbH\"",
      "company_seat": "Bochum",
      "details": "26.11.2024 (Bekanntmachungsdatum)\n\nNordrhein-Westfalen Amtsgericht Bochum HRB 5620\nLöschungsankündigung\n\n\"Thobra Verwaltungsgesellschaft mbH\"\nGesellschaft mit beschränkter Haftung\nBochum\n\nDas Registergericht beabsichtigt die Gesellschaft von Amts wegen nach § 394 FamFG zu löschen. Die Frist zur Erhebung eines Widerspruchs ist auf drei Monate festgesetzt."
    },
    {
      "date": "2024-11-26",
      "original_text": "Löschungsankündigung\nBerlin Amtsgericht Berlin (Charlottenburg) HRB 131423\n\"böser Junge\" UG (haftungsbeschränkt) – Berlin",
      "type": "Löschungsankündigung",
      "state": "Berlin",
      "amtsgericht": "Amtsgericht Berlin (Charlottenburg)",
      "registernummer": "HRB 131423",
      "registerart": "HRB",
      "company_name": "\"böser Junge\" UG (haftungsbeschränkt)",
      "company_seat": "Berlin",
      "details": "26.11.2024 (Bekanntmachungsdatum)\n\nBerlin Amtsgericht Berlin (Charlottenburg) HRB 131423\nLöschungsankündigung\n\n\"böser Junge\" UG (haftungsbeschränkt)\nGesellschaft mit beschränkter Haftung\nBerlin\n\nBei der nachstehenden Gesellschaft wird das Amtslöschungsverfahren gemäß § 394 FamFG eingeleitet. Widerspruchsfrist 6 Wochen"
    },
    {
      "date": "2024-11-26",
      "original_text": "Löschungsankündigung\nBayern Amtsgericht München HRB 189482\n123 Selbstständig GmbH – München",
      "type": "Löschungsankündigung",
      "state": "Bayern",
      "amtsgericht": "Amtsgericht München",
      "registernummer": "HRB 189482",
      "registerart": "HRB",
      "company_name": "123 Selbstständig GmbH",
      "company_seat": "München",
      "details": "26.11.2024 (Bekanntmachungsdatum)\n\nBayern Amtsgericht München HRB 189482\nLöschungsankündigung\n\n123 Selbstständig GmbH\nGesellschaft mit beschränkter Haftung\nMünchen\n\nDas Registergericht beabsichtigt, die im Handelsregister eingetragene Gesellschaft wegen Vermögenslosigkeit von Amts wegen nach § 394 FamFG zu löschen. Die Frist zur Erhebung eines Widerspruchs ist auf drei Monate festgesetzt."
    },
    {
      "date": "2024-11-26",
      "original_text": "Löschungsankündigung\nMecklenburg-Vorpommern Amtsgericht Rostock HRB 9259\n4Ego Lifestyle GmbH – Rostock",
      "type": "Löschungsankündigung",
      "state": "Mecklenburg-Vorpommern",
      "amtsgericht": "Amtsgericht Rostock",
      "registernummer": "HRB 9259",
      "registerart": "HRB",
      "company_name": "4Ego Lifestyle GmbH",
      "company_seat": "Rostock",
      "details": "26.11.2024 (Bekanntmachungsdatum)\n\nMecklenburg-Vorpommern Amtsgericht Rostock HRB 9259\nLöschungsankündigung\n\n4Ego Lifestyle GmbH\nGesellschaft mit beschränkter Haftung\nRostock\n\nDas Registergericht beabsichtigt, die im Handelsregister eingetragene Gesellschaft von Amts wegen nach § 394 FamFG zu löschen. Die Frist zur Erhebung eines Widerspruchs gegen die beabsichtigte Löschung wird auf einen Monat festgesetzt."
    },
    {
      "date": "2024-11-26",
      "original_text": "Sonstige Registerbekanntmachung\nBayern Amtsgericht München HRB 79233\nA. Huber & Co. Internationale Assekuranz-Makler GmbH – Starnberg",
      "type": "Sonstige Registerbekanntmachung",
      "state": "Bayern",
      "amtsgericht": "Amtsgericht München",
      "registernummer": "HRB 79233",
      "registerart": "HRB",
      "company_name": "A. Huber & Co. Internationale Assekuranz-Makler GmbH",
      "company_seat": "Starnberg",
      "details": "26.11.2024 (Bekanntmachungsdatum)\n\nBayern Amtsgericht München HRB 79233\nSonstige Registerbekanntmachung 25.11.2024 (Eintragungsdatum)\n\nA. Huber & Co. Internationale Assekuranz-Makler GmbH\nGesellschaft mit beschränkter Haftung\nStarnberg\n\nDen Gläubigern der Gesellschaft, deren Forderungen begründet worden sind, bevor die Eintragung der Beendigung des Beherrschungs- und Gewinnabführungsvertrages in das Handelsregister nach § 10 des Handelsgesetzbuches als bekanntgemacht gilt, hat der andere Vertragsteil Sicherheit zu leisten, wenn sie sich binnen sechs Monaten nach der Bekanntmachung der Eintragung zu diesem Zweck bei ihm melden."
    },
    {
      "date": "2024-11-26",
      "original_text": "Löschungsankündigung\nBaden-Württemberg Amtsgericht Mannheim HRB 730654\nA.M.E. Baudienstleistungs- und Handels GmbH – Mannheim",
      "type": "Löschungsankündigung",
      "state": "Baden-Württemberg",
      "amtsgericht": "Amtsgericht Mannheim",
      "registernummer": "HRB 730654",
      "registerart": "HRB",
      "company_name": "A.M.E. Baudienstleistungs- und Handels GmbH",
      "company_seat": "Mannheim",
      "details": "26.11.2024 (Bekanntmachungsdatum)\n\nBaden-Württemberg Amtsgericht Mannheim HRB 730654\nLöschungsankündigung\n\nA.M.E. Baudienstleistungs- und Handels GmbH\nGesellschaft mit beschränkter Haftung\nMannheim\n\nDas Gericht beabsichtigt, die Gesellschaft wegen Vermögenslosigkeit im Handelsregister von Amts wegen nach § 394 FamFG zu löschen. Die Frist zur Geltendmachung eines Widerspruchs gegen die beabsichtigte Löschung ist auf einen Monat ab Veröffentlichung bestimmt."
    },
    {
      "date": "2024-11-26",
      "original_text": "Registerbekanntmachung nach dem Umwandlungsgesetz\nBayern Amtsgericht Traunstein HRB 12714\nACP IT Solutions AG – Kolbermoor",
      "type": "Registerbekanntmachung nach dem Umwandlungsgesetz",
      "state": "Bayern",
      "amtsgericht": "Amtsgericht Traunstein",
      "registernummer": "HRB 12714",
      "registerart": "HRB",
      "company_name": "ACP IT Solutions AG",
      "company_seat": "Kolbermoor",
      "details": "26.11.2024 (Bekanntmachungsdatum)\n\nBayern Amtsgericht Traunstein HRB 12714\nRegisterbekanntmachung nach dem Umwandlungsgesetz 25.11.2024 (Eintragungsdatum)\n\nACP IT Solutions AG\nAktiengesellschaft\nKolbermoor\n\nDen Gläubigern der an der Verschmelzung beteiligten Rechtsträger ist, wenn sie binnen sechs Monaten nach dem Tag, an dem die Eintragung der Verschmelzung in das Register des Sitzes desjenigen Rechtsträgers, dessen Gläubiger sie sind, nach § 19 Abs. 3 UmwG als bekannt gemacht gilt, ihren Anspruch nach Grund und Höhe schriftlich anmelden, Sicherheit zu leisten, soweit sie nicht Befriedigung verlangen können. Dieses Recht steht den Gläubigern jedoch nur zu, wenn sie glaubhaft machen, dass durch die Verschmelzung die Erfüllung ihrer Forderung gefährdet wird."
    },
    {
      "date": "2024-11-26",
      "original_text": "Löschungsankündigung\nBaden-Württemberg Amtsgericht Stuttgart HRB 202611\nAGM Service GmbH – Möglingen",
      "type": "Löschungsankündigung",
      "state": "Baden-Württemberg",
      "amtsgericht": "Amtsgericht Stuttgart",
      "registernummer": "HRB 202611",
      "registerart": "HRB",
      "company_name": "AGM Service GmbH",
      "company_seat": "Möglingen",
      "details": "26.11.2024 (Bekanntmachungsdatum)\n\nBaden-Württemberg Amtsgericht Stuttgart HRB 202611\nLöschungsankündigung\n\nAGM Service GmbH\nGesellschaft mit beschränkter Haftung\nMöglingen\n\nAls nicht eingetragen wird bekanntgemacht:\nDas Gericht beabsichtigt, die Gesellschaft wegen Vermögenslosigkeit im Handelsregister von Amts wegen nach § 394 FamFG zu löschen. Die Frist zur Geltendmachung eines Widerspruchs gegen die beabsichtigte Löschung ist auf zwei Monate ab Veröffentlichung bestimmt."
    },
    {
      "date": "2024-11-26",
      "original_text": "Registerbekanntmachung nach dem Umwandlungsgesetz\nBaden-Württemberg Amtsgericht Mannheim HRB 732446\nAP Soft GmbH – Heidelberg",
      "type": "Registerbekanntmachung nach dem Umwandlungsgesetz",
      "state": "Baden-Württemberg",
      "amtsgericht": "Amtsgericht Mannheim",
      "registernummer": "HRB 732446",
      "registerart": "HRB",
      "company_name": "AP Soft GmbH",
      "company_seat": "Heidelberg",
      "details": "26.11.2024 (Bekanntmachungsdatum)\n\nBaden-Württemberg Amtsgericht Mannheim HRB 732446\nRegisterbekanntmachung nach dem Umwandlungsgesetz 26.11.2024 (Eintragungsdatum)\n\nAP Soft GmbH\nGesellschaft mit beschränkter Haftung\nHeidelberg\n\nDen Gläubigern der an der Verschmelzung beteiligten Rechtsträger ist, wenn sie binnen sechs Monaten nach dem Tag, an dem die Eintragung der Verschmelzung in das Register des Sitzes desjenigen Rechtsträgers, dessen Gläubiger sie sind, nach § 19 Abs. 3 UmwG als bekanntgemacht gilt, ihren Anspruch nach Grund und Höhe schriftlich anmelden, Sicherheit zu leisten, soweit sie nicht Befriedigung verlangen können. Dieses Recht steht den Gläubigern jedoch nur zu, wenn sie glaubhaft machen, dass durch die Verschmelzung die Erfüllung ihrer Forderung gefährdet wird."
    },
    {
      "date": "2024-11-26",
      "original_text": "Löschungsankündigung\nNordrhein-Westfalen Amtsgericht Köln HRB 81078\nAST Bauträger GmbH – Frechen",
      "type": "Löschungsankündigung",
      "state": "Nordrhein-Westfalen",
      "amtsgericht": "Amtsgericht Köln",
      "registernummer": "HRB 81078",
      "registerart": "HRB",
      "company_name": "AST Bauträger GmbH",
      "company_seat": "Frechen",
      "details": "26.11.2024 (Bekanntmachungsdatum)\n\nNordrhein-Westfalen Amtsgericht Köln HRB 81078\nLöschungsankündigung\n\nAST Bauträger GmbH\nGesellschaft mit beschränkter Haftung\nFrechen\n\nDas Registergericht beabsichtigt, die im Handelsregister eingetragene Gesellschaft gemäß § 394 Absatz 1 FamFG wegen Vermögenslosigkeit von Amts wegen zu löschen. Gegen diese Verfügung kann Widerspruch eingelegt werden. Die Frist zur Erhebung eines Widerspruchs gegen die beabsichtigte Löschung von Amts wegen ist auf einen Monat festgesetzt. Rechtsbehelfsbelehrung: Gegen diese Verfügung können Sie Widerspruch einlegen. Der Widerspruch ist bei dem Amtsgericht Köln, Reichenspergerplatz 1, 50670 Köln schriftlich in deutscher Sprache oder zur Niederschrift der Geschäftsstelle einzulegen. Der Widerspruch kann auch zur Niederschrift der Geschäftsstelle eines jeden Amtsgerichtes abgegeben werden. Die Einlegung ist auch durch Übertragung eines elektronischen Dokuments an die elektronische Poststelle des Gerichts möglich. Das elektronische Dokument muss für die Bearbeitung durch das Gericht geeignet und mit einer qualifizierten elektronischen Signatur der verantwortenden Person versehen sein oder von der verantwortenden Person signiert und auf einem sicheren Übermittlungsweg gemäß § 130a ZPO nach näherer Maßgabe der Verordnung über die technischen Rahmenbedingungen des elektronischen Rechtsverkehrs und über das besondere elektronische Behördenpostfach (BGBl. I, S.3803) eingereicht werden. Weitere Informationen erhalten Sie auf der Internetseite www.justiz.de.Der Widerspruch muss spätestens innerhalb der gesetzten Frist bei dem Amtsgericht Köln eingegangen sein. Dies gilt auch dann, wenn der Widerspruch zur Niederschrift der Geschäftsstelle eines anderen Amtsgerichtes abgegeben wurde. Die Frist beginnt mit der Veröffentlichung. Fällt das Ende der Frist auf einen Sonntag, einen allgemeinen Feiertag oder Sonnabend, so endet die Frist mit Ablauf des nächsten Werktages.\n\nDer Widerspruch muss die Bezeichnung der angefochtenen Verfügung sowie die Erklärung enthalten, dass Widerspruch gegen diese Verfügung eingelegt wird. Er ist zu unterzeichnen und soll begründet werden."
    },
    {
      "date": "2024-11-26",
      "original_text": "Einreichung neuer Dokumente\nBaden-Württemberg Amtsgericht Stuttgart HRB 20992\nATR International AG – Denkendorf",
      "type": "Einreichung neuer Dokumente",
      "state": "Baden-Württemberg",
      "amtsgericht": "Amtsgericht Stuttgart",
      "registernummer": "HRB 20992",
      "registerart": "HRB",
      "company_name": "ATR International AG",
      "company_seat": "Denkendorf",
      "details": "26.11.2024 (Bekanntmachungsdatum)\n\nBaden-Württemberg Amtsgericht Stuttgart HRB 20992\nEinreichung neuer Dokumente\n\nATR International AG\nAktiengesellschaft\nDenkendorf\n\nDie Gesellschaft hat am 25.11.2024 die Liste über die Zusammensetzung des Aufsichtsrats zum Handelsregister eingereicht."
    },
    {
      "date": "2024-11-26",
      "original_text": "Löschungsankündigung\nBaden-Württemberg Amtsgericht Mannheim HRA 705553\nATX Oil & Gas Fonds GmbH & Co. KG – Pforzheim",
      "type": "Löschungsankündigung",
      "state": "Baden-Württemberg",
      "amtsgericht": "Amtsgericht Mannheim",
      "registernummer": "HRA 705553",
      "registerart": "HRA",
      "company_name": "ATX Oil & Gas Fonds GmbH & Co. KG",
      "company_seat": "Pforzheim",
      "details": "26.11.2024 (Bekanntmachungsdatum)\n\nBaden-Württemberg Amtsgericht Mannheim HRA 705553\nLöschungsankündigung\n\nATX Oil & Gas Fonds GmbH & Co. KG\nKommanditgesellschaft\nPforzheim\n\nDas Gericht beabsichtigt, die Gesellschaft wegen Vermögenslosigkeit im Handelsregister von Amts wegen nach § 394 FamFG zu löschen. Die Frist zur Geltendmachung eines Widerspruchs gegen die beabsichtigte Löschung ist auf einen Monat ab Veröffentlichung bestimmt."
    },
    {
      "date": "2024-11-26",
      "original_text": "Sonstige Registerbekanntmachung\nBerlin Amtsgericht Berlin (Charlottenburg) HRB 103848\nAccess Microfinance Holding AG – Berlin",
      "type": "Sonstige Registerbekanntmachung",
      "state": "Berlin",
      "amtsgericht": "Amtsgericht Berlin (Charlottenburg)",
      "registernummer": "HRB 103848",
      "registerart": "HRB",
      "company_name": "Access Microfinance Holding AG",
      "company_seat": "Berlin",
      "details": "26.11.2024 (Bekanntmachungsdatum)\n\nBerlin Amtsgericht Berlin (Charlottenburg) HRB 103848\nSonstige Registerbekanntmachung\n\nAccess Microfinance Holding AG\nAktiengesellschaft\nBerlin\n\nAls nicht eingetragen wird veröffentlicht:Es wurde eine neue Liste der Aufsichtsratsmitglieder eingereicht (§ 106 AktG)."
    },
    {
      "date": "2024-11-26",
      "original_text": "Löschungsankündigung\nSachsen Amtsgericht Dresden HRB 40372\nAngelov Projekt & Verwaltung GmbH – Riesa",
      "type": "Löschungsankündigung",
      "state": "Sachsen",
      "amtsgericht": "Amtsgericht Dresden",
      "registernummer": "HRB 40372",
      "registerart": "HRB",
      "company_name": "Angelov Projekt & Verwaltung GmbH",
      "company_seat": "Riesa",
      "details": "26.11.2024 (Bekanntmachungsdatum)\n\nSachsen Amtsgericht Dresden HRB 40372\nLöschungsankündigung\n\nAngelov Projekt & Verwaltung GmbH\nGesellschaft mit beschränkter Haftung\nRiesa\n\nDas Registergericht beabsichtigt, die im Handelsregister eingetragene Gesellschaft von Amts wegen nach § 394 FamFG zu löschen. Die Frist zu Erhebung eines Widerspruchs gegen die beabsichtigte Löschung wird auf einen Monat festgesetzt."
    },
    {
      "date": "2024-11-26",
      "original_text": "Einreichung neuer Dokumente\nThüringen Amtsgericht Jena HRB 106937\nApoldaer Stadtentwicklungsgesellschaft mbH – Apolda",
      "type": "Einreichung neuer Dokumente",
      "state": "Thüringen",
      "amtsgericht": "Amtsgericht Jena",
      "registernummer": "HRB 106937",
      "registerart": "HRB",
      "company_name": "Apoldaer Stadtentwicklungsgesellschaft mbH",
      "company_seat": "Apolda",
      "details": "26.11.2024 (Bekanntmachungsdatum)\n\nThüringen Amtsgericht Jena HRB 106937\nEinreichung neuer Dokumente\n\nApoldaer Stadtentwicklungsgesellschaft mbH\nGesellschaft mit beschränkter Haftung\nApolda\n\nBekanntmachung gem. § 52 Abs. 3 Satz 2 GmbHG: Aufgrund einer Veränderung in den Personen der Aufsichtsratsmitglieder ist durch die Geschäftsführer eine neue Liste zum Handelsregister eingereicht worden."
    },
    {
      "date": "2024-11-26",
      "original_text": "Löschungsankündigung\nBremen Amtsgericht Bremen HRB 39378\nArian Bauleistungen GmbH – Bremerhaven",
      "type": "Löschungsankündigung",
      "state": "Bremen",
      "amtsgericht": "Amtsgericht Bremen",
      "registernummer": "HRB 39378",
      "registerart": "HRB",
      "company_name": "Arian Bauleistungen GmbH",
      "company_seat": "Bremerhaven",
      "details": "26.11.2024 (Bekanntmachungsdatum)\n\nBremen Amtsgericht Bremen HRB 39378\nLöschungsankündigung\n\nArian Bauleistungen GmbH\nGesellschaft mit beschränkter Haftung\nBremerhaven\n\nEs ist beabsichtigt die im Handelsregister eingetragene Gesellschaft von Amts wegen gemäß § 394 FamFG zu löschen. Gegen die Löschung kann beim AG Bremen schriftlich oder zu Protokoll der Geschäftsstelle Widerspruch eingelegt werden. Widerspruchsfrist 4 Wochen."
    },
    {
      "date": "2024-11-26",
      "original_text": "Registerbekanntmachung nach dem Umwandlungsgesetz\nBaden-Württemberg Amtsgericht Mannheim HRB 702497\nAutomated Precision Europe GmbH – Heidelberg",
      "type": "Registerbekanntmachung nach dem Umwandlungsgesetz",
      "state": "Baden-Württemberg",
      "amtsgericht": "Amtsgericht Mannheim",
      "registernummer": "HRB 702497",
      "registerart": "HRB",
      "company_name": "Automated Precision Europe GmbH",
      "company_seat": "Heidelberg",
      "details": "26.11.2024 (Bekanntmachungsdatum)\n\nBaden-Württemberg Amtsgericht Mannheim HRB 702497\nRegisterbekanntmachung nach dem Umwandlungsgesetz 26.11.2024 (Eintragungsdatum)\n\nAutomated Precision Europe GmbH\nGesellschaft mit beschränkter Haftung\nHeidelberg\n\nDen Gläubigern der an der Verschmelzung beteiligten Rechtsträger ist, wenn sie binnen sechs Monaten nach dem Tag, an dem die Eintragung der Verschmelzung in das Register des Sitzes desjenigen Rechtsträgers, dessen Gläubiger sie sind, nach § 19 Abs. 3 UmwG als bekanntgemacht gilt, ihren Anspruch nach Grund und Höhe schriftlich anmelden, Sicherheit zu leisten, soweit sie nicht Befriedigung verlangen können. Dieses Recht steht den Gläubigern jedoch nur zu, wenn sie glaubhaft machen, dass durch die Verschmelzung die Erfüllung ihrer Forderung gefährdet wird."
    },
    {
      "date": "2024-11-26",
      "original_text": "Löschungsankündigung\nBayern Amtsgericht München HRB 203476\nAutomobile Bauer GmbH – Oberding",
      "type": "Löschungsankündigung",
      "state": "Bayern",
      "amtsgericht": "Amtsgericht München",
      "registernummer": "HRB 203476",
      "registerart": "HRB",
      "company_name": "Automobile Bauer GmbH",
      "company_seat": "Oberding",
      "details": "26.11.2024 (Bekanntmachungsdatum)\n\nBayern Amtsgericht München HRB 203476\nLöschungsankündigung\n\nAutomobile Bauer GmbH\nGesellschaft mit beschränkter Haftung\nOberding\n\nDas Registergericht beabsichtigt, die im Handelsregister eingetragene Gesellschaft wegen Vermögenslosigkeit von Amts wegen nach § 394 FamFG zu löschen. Die Frist zur Erhebung eines Widerspruchs ist auf drei Monate festgesetzt."
    },
    {
      "date": "2024-11-26",
      "original_text": "Löschungsankündigung\nBayern Amtsgericht München HRB 136674\nAvelion GmbH – München",
      "type": "Löschungsankündigung",
      "state": "Bayern",
      "amtsgericht": "Amtsgericht München",
      "registernummer": "HRB 136674",
      "registerart": "HRB",
      "company_name": "Avelion GmbH",
      "company_seat": "München",
      "details": "26.11.2024 (Bekanntmachungsdatum)\n\nBayern Amtsgericht München HRB 136674\nLöschungsankündigung\n\nAvelion GmbH\nGesellschaft mit beschränkter Haftung\nMünchen\n\nDas Registergericht beabsichtigt, die im Handelsregister eingetragene Gesellschaft wegen Vermögenslosigkeit von Amts wegen nach § 394 FamFG zu löschen. Die Frist zur Erhebung eines Widerspruchs ist auf drei Monate festgesetzt."
    },
    {
      "date": "2024-11-26",
      "original_text": "Sonderregisterbekanntmachung OHNE Bezug zum elektr. Register\nSachsen-Anhalt Amtsgericht Stendal\nHRB 100540\nBAU-INVEST GmbH Generalunternehmen für Bauten aller Art",
      "type": "Sonderregisterbekanntmachung OHNE Bezug zum elektr. Register",
      "state": "Sachsen-Anhalt",
      "amtsgericht": "Amtsgericht Stendal",
      "company_name": "BAU-INVEST GmbH Generalunternehmen für Bauten aller Art",
      "sonderegister_referenz": "HRB 100540",
      "details": "26.11.2024 (Bekanntmachungsdatum)\n\nSachsen-Anhalt Amtsgericht Stendal\nHRB 100540\nSonderregisterbekanntmachung OHNE Bezug zum elektr. Register\n\nBAU-INVEST GmbH Generalunternehmen für Bauten aller Art\n\nDas Registergericht beabsichtigt, Herrn Matthias Claßen zum Nachtragsliquidator für die bereits gelöschte Gesellschaft zur Bereinigung des im Eigentum der Gesellschaft befindlichen Grundbuchs von Wolmirsleben Blatt 2002 zu bestellen. Die Frist zur Erhebung eines Widerspruchs gegen die beabsichtigte Bestellung wird auf einen Monat festgesetzt."
    },
    {
      "date": "2024-11-26",
      "original_text": "Sonstige Registerbekanntmachung\nNordrhein-Westfalen Amtsgericht Düsseldorf HRB 91636\nBGR Transporte GmbH – Düsseldorf",
      "type": "Sonstige Registerbekanntmachung",
      "state": "Nordrhein-Westfalen",
      "amtsgericht": "Amtsgericht Düsseldorf",
      "registernummer": "HRB 91636",
      "registerart": "HRB",
      "company_name": "BGR Transporte GmbH",
      "company_seat": "Düsseldorf",
      "details": "26.11.2024 (Bekanntmachungsdatum)\n\nNordrhein-Westfalen Amtsgericht Düsseldorf HRB 91636\nSonstige Registerbekanntmachung 26.11.2024 (Eintragungsdatum)\n\nBGR Transporte GmbH\nGesellschaft mit beschränkter Haftung\nDüsseldorf\n\nDie Gesellschaft ist aufgelöst. Von Amts wegen eingetragen."
    },
    {
      "date": "2024-11-26",
      "original_text": "Registerbekanntmachung nach dem Umwandlungsgesetz\nBayern Amtsgericht München HRB 83861\nBLM Verwaltungs GmbH – Pullach",
      "type": "Registerbekanntmachung nach dem Umwandlungsgesetz",
      "state": "Bayern",
      "amtsgericht": "Amtsgericht München",
      "registernummer": "HRB 83861",
      "registerart": "HRB",
      "company_name": "BLM Verwaltungs GmbH",
      "company_seat": "Pullach",
      "details": "26.11.2024 (Bekanntmachungsdatum)\n\nBayern Amtsgericht München HRB 83861\nRegisterbekanntmachung nach dem Umwandlungsgesetz 25.11.2024 (Eintragungsdatum)\n\nBLM Verwaltungs GmbH\nGesellschaft mit beschränkter Haftung\nPullach\n\nDen Gläubigern der an der Verschmelzung beteiligten Rechtsträger ist, wenn sie binnen sechs Monaten nach dem Tag, an dem die Eintragung der Verschmelzung in das Register des Sitzes desjenigen Rechtsträgers, dessen Gläubiger sie sind, nach § 19 Abs. 3 UmwG als bekannt gemacht gilt, ihren Anspruch nach Grund und Höhe schriftlich anmelden, Sicherheit zu leisten, soweit sie nicht Befriedigung verlangen können. Dieses Recht steht den Gläubigern jedoch nur zu, wenn sie glaubhaft machen, dass durch die Verschmelzung die Erfüllung ihrer Forderung gefährdet wird."
    },
    {
      "date": "2024-11-26",
      "original_text": "Löschungsankündigung\nBaden-Württemberg Amtsgericht Mannheim HRB 720760\nBOMAS UG (haftungsbeschränkt) – Knittlingen",
      "type": "Löschungsankündigung",
      "state": "Baden-Württemberg",
      "amtsgericht": "Amtsgericht Mannheim",
      "registernummer": "HRB 720760",
      "registerart": "HRB",
      "company_name": "BOMAS UG (haftungsbeschränkt)",
      "company_seat": "Knittlingen",
      "details": "26.11.2024 (Bekanntmachungsdatum)\n\nBaden-Württemberg Amtsgericht Mannheim HRB 720760\nLöschungsankündigung\n\nBOMAS UG (haftungsbeschränkt)\nGesellschaft mit beschränkter Haftung\nKnittlingen\n\nDas Gericht beabsichtigt, die Gesellschaft wegen Vermögenslosigkeit im Handelsregister von Amts wegen nach § 394 FamFG zu löschen. Die Frist zur Geltendmachung eines Widerspruchs gegen die beabsichtigte Löschung ist auf einen Monat ab Veröffentlichung bestimmt."
    },
    {
      "date": "2024-11-26",
      "original_text": "Einreichung neuer Dokumente\nHessen Amtsgericht Friedberg HRB 2254\nBad Nauheim Stadtmarketing und Tourismus GmbH – Bad Nauheim",
      "type": "Einreichung neuer Dokumente",
      "state": "Hessen",
      "amtsgericht": "Amtsgericht Friedberg",
      "registernummer": "HRB 2254",
      "registerart": "HRB",
      "company_name": "Bad Nauheim Stadtmarketing und Tourismus GmbH",
      "company_seat": "Bad Nauheim",
      "details": "26.11.2024 (Bekanntmachungsdatum)\n\nHessen Amtsgericht Friedberg HRB 2254\nEinreichung neuer Dokumente\n\nBad Nauheim Stadtmarketing und Tourismus GmbH\nGesellschaft mit beschränkter Haftung\nBad Nauheim\n\nDurch eine Änderung in den Personen der Aufsichtsratsmitglieder ist eine Liste der Mitglieder des Aufsichtsrates zum Handelsregister eingereicht worden."
    },
    {
      "date": "2024-11-26",
      "original_text": "Löschungsankündigung\nNiedersachsen Amtsgericht Hannover HRB 225274\nBauPlus GmbH – Hannover",
      "type": "Löschungsankündigung",
      "state": "Niedersachsen",
      "amtsgericht": "Amtsgericht Hannover",
      "registernummer": "HRB 225274",
      "registerart": "HRB",
      "company_name": "BauPlus GmbH",
      "company_seat": "Hannover",
      "details": "26.11.2024 (Bekanntmachungsdatum)\n\nNiedersachsen Amtsgericht Hannover HRB 225274\nLöschungsankündigung\n\nBauPlus GmbH\nGesellschaft mit beschränkter Haftung\nHannover\n\nDas Registergericht beabsichtigt, die Gesellschaft von Amts wegen nach § 395 FamFG zu löschen. Die Frist zur Erhebung eines Widerspruchs ist auf 1 Monat ab dieser Registerbekanntmachung festgesetzt."
    },
    {
      "date": "2024-11-26",
      "original_text": "Registerbekanntmachung nach dem Umwandlungsgesetz\nHessen Amtsgericht Darmstadt HRA 87375\nBettis-Pflegedienst GmbH & Co. KG – Zwingenberg",
      "type": "Registerbekanntmachung nach dem Umwandlungsgesetz",
      "state": "Hessen",
      "amtsgericht": "Amtsgericht Darmstadt",
      "registernummer": "HRA 87375",
      "registerart": "HRA",
      "company_name": "Bettis-Pflegedienst GmbH & Co. KG",
      "company_seat": "Zwingenberg",
      "details": "26.11.2024 (Bekanntmachungsdatum)\n\nHessen Amtsgericht Darmstadt HRA 87375\nRegisterbekanntmachung nach dem Umwandlungsgesetz 26.11.2024 (Eintragungsdatum)\n\nBettis-Pflegedienst GmbH & Co. KG\nKommanditgesellschaft\nZwingenberg\n\nDen Gläubigern der an der Ausgliederung beteiligten Rechtsträger ist, wenn sie binnen sechs Monaten nach dem Tag, an dem die Eintragung der Ausgliederung in das Register des Sitzes derjenigen Rechtsträger deren Gläubiger sie sind, nach §§ 125, 19 Absatz 3 UmwG bekannt gemacht worden ist, ihren Anspruch nach Grund und Höhe schriftlich anmelden, Sicherheit zu leisten, soweit sie nicht Befriedigung verlangen können. Dieses Recht steht den Gläubigern jedoch nur zu, wenn sie glaubhaft machen, dass durch die Ausgliederung die Erfüllung ihrer Forderung gefährdet wird."
    },
    {
      "date": "2024-11-26",
      "original_text": "Registerbekanntmachung nach dem Umwandlungsgesetz\nHessen Amtsgericht Darmstadt HRA 86886\nBettis-Pflegedienst e.K. – Zwingenberg",
      "type": "Registerbekanntmachung nach dem Umwandlungsgesetz",
      "state": "Hessen",
      "amtsgericht": "Amtsgericht Darmstadt",
      "registernummer": "HRA 86886",
      "registerart": "HRA",
      "company_name": "Bettis-Pflegedienst e.K.",
      "company_seat": "Zwingenberg",
      "details": "26.11.2024 (Bekanntmachungsdatum)\n\nHessen Amtsgericht Darmstadt HRA 86886\nRegisterbekanntmachung nach dem Umwandlungsgesetz 26.11.2024 (Eintragungsdatum)\n\nBettis-Pflegedienst e.K.\nEinzelkaufmann / Einzelkauffrau\nZwingenberg\n\nDen Gläubigern der an der Ausgliederung beteiligten Rechtsträger ist, wenn sie binnen sechs Monaten nach dem Tag, an dem die Eintragung der Ausgliederung in das Register des Sitzes derjenigen Rechtsträger deren Gläubiger sie sind, nach §§ 125, 19 Absatz 3 UmwG bekannt gemacht worden ist, ihren Anspruch nach Grund und Höhe schriftlich anmelden, Sicherheit zu leisten, soweit sie nicht Befriedigung verlangen können. Dieses Recht steht den Gläubigern jedoch nur zu, wenn sie glaubhaft machen, dass durch die Ausgliederung die Erfüllung ihrer Forderung gefährdet wird."
    },
    {
      "date": "2024-11-26",
      "original_text": "Registerbekanntmachung nach dem Umwandlungsgesetz\nSchleswig-Holstein Amtsgericht Flensburg HRA 11378\nBiogas Schwabe GmbH & Co. KG – Enge-Sande",
      "type": "Registerbekanntmachung nach dem Umwandlungsgesetz",
      "state": "Schleswig-Holstein",
      "amtsgericht": "Amtsgericht Flensburg",
      "registernummer": "HRA 11378",
      "registerart": "HRA",
      "company_name": "Biogas Schwabe GmbH & Co. KG",
      "company_seat": "Enge-Sande",
      "details": "26.11.2024 (Bekanntmachungsdatum)\n\nSchleswig-Holstein Amtsgericht Flensburg HRA 11378\nRegisterbekanntmachung nach dem Umwandlungsgesetz 26.11.2024 (Eintragungsdatum)\n\nBiogas Schwabe GmbH & Co. KG\nKommanditgesellschaft\nEnge-Sande\n\nZu Eintragungsnummer 2 vom 26.11.2024 wird als nicht eingetragen veröffentlicht: Den Gläubigern der an der Spaltung beteiligten Rechtsträger ist, wenn sie binnen sechs Monaten nach dem Tag, an dem die Eintragung der Spaltung in das Register des Sitzes desjenigen Rechtsträgers, dessen Gläubiger sie sind, als bekannt gemacht gilt, ihren Anspruch nach Grund und Höhe schriftlich anmelden, Sicherheit zu leisten, soweit sie nicht Befriedigung verlangen können. Dieses Recht steht den Gläubigern jedoch nur zu, wenn sie glaubhaft machen, dass durch die Spaltung die Erfüllung ihrer Forderung gefährdet wird."
    },
    {
      "date": "2024-11-26",
      "original_text": "Registerbekanntmachung nach dem Umwandlungsgesetz\nSchleswig-Holstein Amtsgericht Flensburg HRA 11381\nBiogasanlage Hermann Hansen e.K. – Enge-Sande",
      "type": "Registerbekanntmachung nach dem Umwandlungsgesetz",
      "state": "Schleswig-Holstein",
      "amtsgericht": "Amtsgericht Flensburg",
      "registernummer": "HRA 11381",
      "registerart": "HRA",
      "company_name": "Biogasanlage Hermann Hansen e.K.",
      "company_seat": "Enge-Sande",
      "details": "26.11.2024 (Bekanntmachungsdatum)\n\nSchleswig-Holstein Amtsgericht Flensburg HRA 11381\nRegisterbekanntmachung nach dem Umwandlungsgesetz 26.11.2024 (Eintragungsdatum)\n\nBiogasanlage Hermann Hansen e.K.\nEinzelkaufmann / Einzelkauffrau\nEnge-Sande\n\nZu Eintragungsnummer 2 vom 26.11.2024 wird als nicht eingetragen veröffentlicht: Den Gläubigern der an der Spaltung beteiligten Rechtsträger ist, wenn sie binnen sechs Monaten nach dem Tag, an dem die Eintragung der Spaltung in das Register des Sitzes desjenigen Rechtsträgers, dessen Gläubiger sie sind, als bekannt gemacht gilt, ihren Anspruch nach Grund und Höhe schriftlich anmelden, Sicherheit zu leisten, soweit sie nicht Befriedigung verlangen können. Dieses Recht steht den Gläubigern jedoch nur zu, wenn sie glaubhaft machen, dass durch die Spaltung die Erfüllung ihrer Forderung gefährdet wird."
    },
    {
      "date": "2024-11-26",
      "original_text": "Löschungsankündigung\nMecklenburg-Vorpommern Amtsgericht Neubrandenburg HRB 20034\nBiogasverwertung Groß Roge GmbH – Stavenhagen",
      "type": "Löschungsankündigung",
      "state": "Mecklenburg-Vorpommern",
      "amtsgericht": "Amtsgericht Neubrandenburg",
      "registernummer": "HRB 20034",
      "registerart": "HRB",
      "company_name": "Biogasverwertung Groß Roge GmbH",
      "company_seat": "Stavenhagen",
      "details": "26.11.2024 (Bekanntmachungsdatum)\n\nMecklenburg-Vorpommern Amtsgericht Neubrandenburg HRB 20034\nLöschungsankündigung\n\nBiogasverwertung Groß Roge GmbH\nGesellschaft mit beschränkter Haftung\nStavenhagen\n\nDas Registergericht beabsichtigt, die im Handelsregister eingetragene Gesellschaft von Amts wegen nach § 394 FamFG zu löschen. Die Frist zur Erhebung eines Widerspruchs gegen die beabsichtigte Löschung wird auf drei Monate festgesetzt."
    },
    {
      "date": "2024-11-26",
      "original_text": "Löschungsankündigung\nBrandenburg Amtsgericht Frankfurt/Oder HRB 14958\nCL Clean Trade GmbH – Bernau bei Berlin",
      "type": "Löschungsankündigung",
      "state": "Brandenburg",
      "amtsgericht": "Amtsgericht Frankfurt/Oder",
      "registernummer": "HRB 14958",
      "registerart": "HRB",
      "company_name": "CL Clean Trade GmbH",
      "company_seat": "Bernau bei Berlin",
      "details": "26.11.2024 (Bekanntmachungsdatum)\n\nBrandenburg Amtsgericht Frankfurt/Oder HRB 14958\nLöschungsankündigung\n\nCL Clean Trade GmbH\nGesellschaft mit beschränkter Haftung\nBernau bei Berlin\n\nBei der nachstehenden Gesellschaft wird das Amtslöschungsverfahren gemäß § 394 FamFG eingeleitet."
    },
    {
      "date": "2024-11-26",
      "original_text": "Einreichung neuer Dokumente\nBaden-Württemberg Amtsgericht Freiburg HRB 712362\nCONVOTIS Freiburg AG – Freiburg im Breisgau",
      "type": "Einreichung neuer Dokumente",
      "state": "Baden-Württemberg",
      "amtsgericht": "Amtsgericht Freiburg",
      "registernummer": "HRB 712362",
      "registerart": "HRB",
      "company_name": "CONVOTIS Freiburg AG",
      "company_seat": "Freiburg im Breisgau",
      "details": "26.11.2024 (Bekanntmachungsdatum)\n\nBaden-Württemberg Amtsgericht Freiburg HRB 712362\nEinreichung neuer Dokumente 26.11.2024 (Eintragungsdatum)\n\nCONVOTIS Freiburg AG\nAktiengesellschaft\nFreiburg im Breisgau\n\nDie Gesellschaft hat am 25.11.2024 die Liste über die Zusammensetzung des Aufsichtsrats zum Handelsregister eingereicht."
    },
    {
      "date": "2024-11-26",
      "original_text": "Löschungsankündigung\nBremen Amtsgericht Bremen HRA 29114\nCP Greifswald GmbH & Co. KG – Bremen",
      "type": "Löschungsankündigung",
      "state": "Bremen",
      "amtsgericht": "Amtsgericht Bremen",
      "registernummer": "HRA 29114",
      "registerart": "HRA",
      "company_name": "CP Greifswald GmbH & Co. KG",
      "company_seat": "Bremen",
      "details": "26.11.2024 (Bekanntmachungsdatum)\n\nBremen Amtsgericht Bremen HRA 29114\nLöschungsankündigung\n\nCP Greifswald GmbH & Co. KG\nKommanditgesellschaft\nBremen\n\nEs ist beabsichtigt die im Handelsregister eingetragene Firma von Amts wegen gemäß § 31 Abs.2 HGB zu löschen. Gegen die Löschung kann beim AG Bremen schriftlich oder zu Protokoll der Geschäftsstelle Widerspruch eingelegt werden. Widerspruchsfrist 4 Wochen."
    },
    {
      "date": "2024-11-26",
      "original_text": "Löschungsankündigung\nHamburg Amtsgericht Hamburg VR 20771\nCameroon Diaspora Network - Germany (CDN.G) e.V. – Hamburg",
      "type": "Löschungsankündigung",
      "state": "Hamburg",
      "amtsgericht": "Amtsgericht Hamburg",
      "registernummer": "VR 20771",
      "registerart": "VR",
      "company_name": "Cameroon Diaspora Network - Germany (CDN.G) e.V.",
      "company_seat": "Hamburg",
      "details": "26.11.2024 (Bekanntmachungsdatum)\n\nHamburg Amtsgericht Hamburg VR 20771\nLöschungsankündigung\n\nCameroon Diaspora Network - Germany (CDN.G) e.V.\neingetragener Verein\nHamburg\n\nDas Registergericht beabsichtigt, den im Vereinsregister eingetragenen Verein von Amts wegen nach § 395 FamFG zu löschen, da nach den angestellten Ermittlungen dieser Verein offenbar nicht mehr besteht. Die Frist zur Erhebung eines Widerspruchs gegen die beabsichtigte Löschung wird auf 3 Monate festgesetzt."
    },
    {
      "date": "2024-11-26",
      "original_text": "Löschungsankündigung\nBayern Amtsgericht Augsburg HRB 24334\nDNC Dörrschuck Network Consulting GmbH – Augsburg",
      "type": "Löschungsankündigung",
      "state": "Bayern",
      "amtsgericht": "Amtsgericht Augsburg",
      "registernummer": "HRB 24334",
      "registerart": "HRB",
      "company_name": "DNC Dörrschuck Network Consulting GmbH",
      "company_seat": "Augsburg",
      "details": "26.11.2024 (Bekanntmachungsdatum)\n\nBayern Amtsgericht Augsburg HRB 24334\nLöschungsankündigung 25.11.2024 (Eintragungsdatum)\n\nDNC Dörrschuck Network Consulting GmbH\nGesellschaft mit beschränkter Haftung\nAugsburg\n\nDas Registergericht beabsichtigt, die im Handelsregister eingetragene Gesellschaft wegen Vermögenslosigkeit von Amts wegen nach § 394 FamFG zu löschen. Die Frist zur Erhebung eines Widerspruchs ist auf einen Monat festgesetzt."
    },
    {
      "date": "2024-11-26",
      "original_text": "Einreichung neuer Dokumente\nBayern Amtsgericht Aschaffenburg HRB 8887\nDPD Deutschland GmbH – Aschaffenburg",
      "type": "Einreichung neuer Dokumente",
      "state": "Bayern",
      "amtsgericht": "Amtsgericht Aschaffenburg",
      "registernummer": "HRB 8887",
      "registerart": "HRB",
      "company_name": "DPD Deutschland GmbH",
      "company_seat": "Aschaffenburg",
      "details": "26.11.2024 (Bekanntmachungsdatum)\n\nBayern Amtsgericht Aschaffenburg HRB 8887\nEinreichung neuer Dokumente\n\nDPD Deutschland GmbH\nGesellschaft mit beschränkter Haftung\nAschaffenburg\n\nDem Amtsgericht Aschaffenburg -Registergericht- ist eine Liste der Mitglieder des Aufsichtsrats eingereicht worden, § 52 Abs. 3 S. 2 GmbHG."
    },
    {
      "date": "2024-11-26",
      "original_text": "Registerbekanntmachung nach dem Umwandlungsgesetz\nNiedersachsen Amtsgericht Osnabrück HRB 19998\nDeGeFa GmbH – Badbergen",
      "type": "Registerbekanntmachung nach dem Umwandlungsgesetz",
      "state": "Niedersachsen",
      "amtsgericht": "Amtsgericht Osnabrück",
      "registernummer": "HRB 19998",
      "registerart": "HRB",
      "company_name": "DeGeFa GmbH",
      "company_seat": "Badbergen",
      "details": "26.11.2024 (Bekanntmachungsdatum)\n\nNiedersachsen Amtsgericht Osnabrück HRB 19998\nRegisterbekanntmachung nach dem Umwandlungsgesetz 26.11.2024 (Eintragungsdatum)\n\nDeGeFa GmbH\nGesellschaft mit beschränkter Haftung\nBadbergen\n\nDen Gläubigern der an der Verschmelzung beteiligten Rechtsträger ist, wenn sie binnen sechs Monaten nach dem Tag, an dem die Eintragung der Verschmelzung in das Register des Sitzes desjenigen Rechtsträgers, dessen Gläubiger sie sind, nach § 19  Abs.  3 UmwG als bekannt gemacht gilt, ihren Anspruch nach Grund und Höhe schriftlich anmelden, Sicherheit zu leisten, soweit sie nicht Befriedigung verlangen können. Dieses Recht steht den Gläubigern jedoch nur zu, wenn sie glaubhaft machen, dass durch die Verschmelzung die Erfüllung der Forderung gefährdet wird."
    },
    {
      "date": "2024-11-26",
      "original_text": "Registerbekanntmachung nach dem Umwandlungsgesetz\nBayern Amtsgericht Hof HRA 4937\nDenis Beck e.K. – Selb",
      "type": "Registerbekanntmachung nach dem Umwandlungsgesetz",
      "state": "Bayern",
      "amtsgericht": "Amtsgericht Hof",
      "registernummer": "HRA 4937",
      "registerart": "HRA",
      "company_name": "Denis Beck e.K.",
      "company_seat": "Selb",
      "details": "26.11.2024 (Bekanntmachungsdatum)\n\nBayern Amtsgericht Hof HRA 4937\nRegisterbekanntmachung nach dem Umwandlungsgesetz 25.11.2024 (Eintragungsdatum)\n\nDenis Beck e.K.\nEinzelkaufmann / Einzelkauffrau\nSelb\n\nDen Gläubigern der an der Ausgliederung beteiligten Rechtsträger ist, wenn sie binnen sechs Monaten nach dem Tag, an dem die Eintragung der Ausgliederung in das Register des Sitzes desjenigen Rechtsträgers, dessen Gläubiger sie sind, nach §§ 125, 19 Abs. 3 UmwG als bekannt gemacht gilt, ihren Anspruch nach Grund und Höhe schriftlich anmelden, Sicherheit zu leisten, soweit sie nicht Befriedigung verlangen können. Dieses Recht steht den Gläubigern jedoch nur zu, wenn sie glaubhaft machen, dass durch die Ausgliederung die Erfüllung ihrer Forderung gefährdet wird."
    },
    {
      "date": "2024-11-26",
      "original_text": "Einreichung neuer Dokumente\nNordrhein-Westfalen Amtsgericht Bielefeld HRB 44105\nDürkopp Adler GmbH – Bielefeld",
      "type": "Einreichung neuer Dokumente",
      "state": "Nordrhein-Westfalen",
      "amtsgericht": "Amtsgericht Bielefeld",
      "registernummer": "HRB 44105",
      "registerart": "HRB",
      "company_name": "Dürkopp Adler GmbH",
      "company_seat": "Bielefeld",
      "details": "26.11.2024 (Bekanntmachungsdatum)\n\nNordrhein-Westfalen Amtsgericht Bielefeld HRB 44105\nEinreichung neuer Dokumente 26.11.2024 (Eintragungsdatum)\n\nDürkopp Adler GmbH\nGesellschaft mit beschränkter Haftung\nBielefeld\n\nDem Registergericht ist eine neue Liste der Mitglieder des Aufsichtsrates/Gesellschafterausschusses eingereicht worden."
    },
    {
      "date": "2024-11-26",
      "original_text": "Löschungsankündigung\nBayern Amtsgericht München HRB 247349\nELEKTROBLITZ Elektroinstallationen UG (haftungsbeschränkt) – München",
      "type": "Löschungsankündigung",
      "state": "Bayern",
      "amtsgericht": "Amtsgericht München",
      "registernummer": "HRB 247349",
      "registerart": "HRB",
      "company_name": "ELEKTROBLITZ Elektroinstallationen UG (haftungsbeschränkt)",
      "company_seat": "München",
      "details": "26.11.2024 (Bekanntmachungsdatum)\n\nBayern Amtsgericht München HRB 247349\nLöschungsankündigung 25.11.2024 (Eintragungsdatum)\n\nELEKTROBLITZ Elektroinstallationen UG (haftungsbeschränkt)\nGesellschaft mit beschränkter Haftung\nMünchen\n\nDas Registergericht beabsichtigt, die im Handelsregister eingetragene Gesellschaft wegen Vermögenslosigkeit von Amts wegen nach § 394 FamFG zu löschen. Die Frist zur Erhebung eines Widerspruchs ist auf drei Monate festgesetzt."
    },
    {
      "date": "2024-11-26",
      "original_text": "Einreichung neuer Dokumente\nThüringen Amtsgericht Jena HRB 202420\nEnergieversorgung Greiz GmbH – Greiz",
      "type": "Einreichung neuer Dokumente",
      "state": "Thüringen",
      "amtsgericht": "Amtsgericht Jena",
      "registernummer": "HRB 202420",
      "registerart": "HRB",
      "company_name": "Energieversorgung Greiz GmbH",
      "company_seat": "Greiz",
      "details": "26.11.2024 (Bekanntmachungsdatum)\n\nThüringen Amtsgericht Jena HRB 202420\nEinreichung neuer Dokumente 30.10.2024 (Eintragungsdatum)\n\nEnergieversorgung Greiz GmbH\nGesellschaft mit beschränkter Haftung\nGreiz\n\nBekanntmachung gem. § 52 Abs. 3 Satz 2 GmbHG: Aufgrund einer Veränderung in den Personen der Aufsichtsratsmitglieder ist durch die Geschäftsführer eine neue Liste zum Handelsregister eingereicht worden."
    },
    {
      "date": "2024-11-26",
      "original_text": "Einreichung neuer Dokumente\nThüringen Amtsgericht Jena HRB 102528\nEnergieversorgung Inselsberg GmbH – Waltershausen",
      "type": "Einreichung neuer Dokumente",
      "state": "Thüringen",
      "amtsgericht": "Amtsgericht Jena",
      "registernummer": "HRB 102528",
      "registerart": "HRB",
      "company_name": "Energieversorgung Inselsberg GmbH",
      "company_seat": "Waltershausen",
      "details": "26.11.2024 (Bekanntmachungsdatum)\n\nThüringen Amtsgericht Jena HRB 102528\nEinreichung neuer Dokumente\n\nEnergieversorgung Inselsberg GmbH\nGesellschaft mit beschränkter Haftung\nWaltershausen\n\nBekanntmachung gem. § 52 Abs. 3 Satz 2 GmbHG: Aufgrund einer Veränderung in den Personen der Aufsichtsratsmitglieder ist durch die Geschäftsführer eine neue Liste zum Handelsregister eingereicht worden."
    },
    {
      "date": "2024-11-26",
      "original_text": "Löschungsankündigung\nBrandenburg Amtsgericht Potsdam HRB 11943\nFINANZKONTOR Vater & Co. GmbH – Potsdam",
      "type": "Löschungsankündigung",
      "state": "Brandenburg",
      "amtsgericht": "Amtsgericht Potsdam",
      "registernummer": "HRB 11943",
      "registerart": "HRB",
      "company_name": "FINANZKONTOR Vater & Co. GmbH",
      "company_seat": "Potsdam",
      "details": "26.11.2024 (Bekanntmachungsdatum)\n\nBrandenburg Amtsgericht Potsdam HRB 11943\nLöschungsankündigung\n\nFINANZKONTOR Vater & Co. GmbH\nGesellschaft mit beschränkter Haftung\nPotsdam\n\nBei der nachstehenden Gesellschaft wird das Amtslöschungsverfahren gemäß § 394 FamFG eingeleitet. Widerspruchsfrist: 8 Wochen."
    },
    {
      "date": "2024-11-26",
      "original_text": "Registerbekanntmachung nach dem Umwandlungsgesetz\nBayern Amtsgericht Deggendorf HRB 5961\nFOElite Unternehmergesellschaft (haftungsbeschränkt) – Deggendorf",
      "type": "Registerbekanntmachung nach dem Umwandlungsgesetz",
      "state": "Bayern",
      "amtsgericht": "Amtsgericht Deggendorf",
      "registernummer": "HRB 5961",
      "registerart": "HRB",
      "company_name": "FOElite Unternehmergesellschaft (haftungsbeschränkt)",
      "company_seat": "Deggendorf",
      "details": "26.11.2024 (Bekanntmachungsdatum)\n\nBayern Amtsgericht Deggendorf HRB 5961\nRegisterbekanntmachung nach dem Umwandlungsgesetz 05.09.2024 (Eintragungsdatum)\n\nFOElite Unternehmergesellschaft (haftungsbeschränkt)\nGesellschaft mit beschränkter Haftung\nDeggendorf\n\nDen Gläubigern des formwechselnden Rechtsträgers ist, wenn sie binnen sechs Monaten nach dem Tag, an dem die Eintragung des Formwechsels nach § 201 UmwG als bekannt gemacht gilt, ihren Anspruch nach Grund und Höhe schriftlich anmelden, Sicherheit zu leisten, soweit sie nicht Befriedigung verlangen können. Dieses Recht steht den Gläubigern jedoch nur zu, wenn sie glaubhaft machen, dass durch den Formwechsel die Erfüllung ihrer Forderung gefährdet wird."
    },
    {
      "date": "2024-11-26",
      "original_text": "Sonstige Registerbekanntmachung\nBayern Amtsgericht Fürth HRB 17094\nFUTRE SOFTWARE SOLUTIONS GMBH – Erlangen",
      "type": "Sonstige Registerbekanntmachung",
      "state": "Bayern",
      "amtsgericht": "Amtsgericht Fürth",
      "registernummer": "HRB 17094",
      "registerart": "HRB",
      "company_name": "FUTRE SOFTWARE SOLUTIONS GMBH",
      "company_seat": "Erlangen",
      "details": "26.11.2024 (Bekanntmachungsdatum)\n\nBayern Amtsgericht Fürth HRB 17094\nSonstige Registerbekanntmachung\n\nFUTRE SOFTWARE SOLUTIONS GMBH\nGesellschaft mit beschränkter Haftung\nErlangen\n\nDas mit Verfügung vom 23.07.2024 eingeleitete Amtslöschungsverfahren wird aufgehoben. Die Frist zur Erhebung eines Widerspruchs ist auf einen Monat festgesetzt."
    },
    {
      "date": "2024-11-26",
      "original_text": "Registerbekanntmachung nach dem Umwandlungsgesetz\nBaden-Württemberg Amtsgericht Mannheim HRB 716945\nFicus Vermögensverwaltungs GmbH – Baden-Baden",
      "type": "Registerbekanntmachung nach dem Umwandlungsgesetz",
      "state": "Baden-Württemberg",
      "amtsgericht": "Amtsgericht Mannheim",
      "registernummer": "HRB 716945",
      "registerart": "HRB",
      "company_name": "Ficus Vermögensverwaltungs GmbH",
      "company_seat": "Baden-Baden",
      "details": "26.11.2024 (Bekanntmachungsdatum)\n\nBaden-Württemberg Amtsgericht Mannheim HRB 716945\nRegisterbekanntmachung nach dem Umwandlungsgesetz 26.11.2024 (Eintragungsdatum)\n\nFicus Vermögensverwaltungs GmbH\nGesellschaft mit beschränkter Haftung\nBaden-Baden\n\nAls nicht eingetragen wird bekanntgemacht:\nDen Gläubigern der an der Verschmelzung beteiligten Rechtsträger ist, wenn sie binnen sechs Monaten nach dem Tag, an dem die Eintragung der Verschmelzung in das Register des Sitzes desjenigen Rechtsträgers, dessen Gläubiger sie sind, nach § 19 Abs. 3 UmwG als bekanntgemacht gilt, ihren Anspruch nach Grund und Höhe schriftlich anmelden, Sicherheit zu leisten, soweit sie nicht Befriedigung verlangen können. Dieses Recht steht den Gläubigern jedoch nur zu, wenn sie glaubhaft machen, dass durch die Verschmelzung die Erfüllung ihrer Forderung gefährdet wird."
    },
    {
      "date": "2024-11-26",
      "original_text": "Registerbekanntmachung nach dem Umwandlungsgesetz\nBaden-Württemberg Amtsgericht Mannheim HRB 716945\nFicus Vermögensverwaltungs GmbH – Baden-Baden",
      "type": "Registerbekanntmachung nach dem Umwandlungsgesetz",
      "state": "Baden-Württemberg",
      "amtsgericht": "Amtsgericht Mannheim",
      "registernummer": "HRB 716945",
      "registerart": "HRB",
      "company_name": "Ficus Vermögensverwaltungs GmbH",
      "company_seat": "Baden-Baden",
      "details": "26.11.2024 (Bekanntmachungsdatum)\n\nBaden-Württemberg Amtsgericht Mannheim HRB 716945\nRegisterbekanntmachung nach dem Umwandlungsgesetz 26.11.2024 (Eintragungsdatum)\n\nFicus Vermögensverwaltungs GmbH\nGesellschaft mit beschränkter Haftung\nBaden-Baden\n\nAls nicht eingetragen wird bekanntgemacht:\nDen Gläubigern der an der Verschmelzung beteiligten Rechtsträger ist, wenn sie binnen sechs Monaten nach dem Tag, an dem die Eintragung der Verschmelzung in das Register des Sitzes desjenigen Rechtsträgers, dessen Gläubiger sie sind, nach § 19 Abs. 3 UmwG als bekanntgemacht gilt, ihren Anspruch nach Grund und Höhe schriftlich anmelden, Sicherheit zu leisten, soweit sie nicht Befriedigung verlangen können. Dieses Recht steht den Gläubigern jedoch nur zu, wenn sie glaubhaft machen, dass durch die Verschmelzung die Erfüllung ihrer Forderung gefährdet wird."
    },
    {
      "date": "2024-11-26",
      "original_text": "Registerbekanntmachung nach dem Umwandlungsgesetz\nBayern Amtsgericht Traunstein HRB 8674\nFliegl Agrartechnik GmbH – Mühldorf a. Inn",
      "type": "Registerbekanntmachung nach dem Umwandlungsgesetz",
      "state": "Bayern",
      "amtsgericht": "Amtsgericht Traunstein",
      "registernummer": "HRB 8674",
      "registerart": "HRB",
      "company_name": "Fliegl Agrartechnik GmbH",
      "company_seat": "Mühldorf a. Inn",
      "details": "26.11.2024 (Bekanntmachungsdatum)\n\nBayern Amtsgericht Traunstein HRB 8674\nRegisterbekanntmachung nach dem Umwandlungsgesetz 25.11.2024 (Eintragungsdatum)\n\nFliegl Agrartechnik GmbH\nGesellschaft mit beschränkter Haftung\nMühldorf a. Inn\n\nDen Gläubigern der an der Spaltung beteiligten Rechtsträger ist, wenn sie binnen sechs Monaten nach dem Tag, an dem die Eintragung der Spaltung in das Register des Sitzes desjenigen Rechtsträgers, dessen Gläubiger sie sind, nach §§ 125, 19 Abs. 3 UmwG als bekannt gemacht gilt, ihren Anspruch nach Grund und Höhe schriftlich anmelden, Sicherheit zu leisten, soweit sie nicht Befriedigung verlangen können. Dieses Recht steht den Gläubigern jedoch nur zu, wenn sie glaubhaft machen, dass durch die Spaltung die Erfüllung ihrer Forderung gefährdet wird."
    },
    {
      "date": "2024-11-26",
      "original_text": "Registerbekanntmachung nach dem Umwandlungsgesetz\nBayern Amtsgericht Traunstein HRB 8674\nFliegl Agrartechnik GmbH – Mühldorf a. Inn",
      "type": "Registerbekanntmachung nach dem Umwandlungsgesetz",
      "state": "Bayern",
      "amtsgericht": "Amtsgericht Traunstein",
      "registernummer": "HRB 8674",
      "registerart": "HRB",
      "company_name": "Fliegl Agrartechnik GmbH",
      "company_seat": "Mühldorf a. Inn",
      "details": "26.11.2024 (Bekanntmachungsdatum)\n\nBayern Amtsgericht Traunstein HRB 8674\nRegisterbekanntmachung nach dem Umwandlungsgesetz 25.11.2024 (Eintragungsdatum)\n\nFliegl Agrartechnik GmbH\nGesellschaft mit beschränkter Haftung\nMühldorf a. Inn\n\nDen Gläubigern der an der Spaltung beteiligten Rechtsträger ist, wenn sie binnen sechs Monaten nach dem Tag, an dem die Eintragung der Spaltung in das Register des Sitzes desjenigen Rechtsträgers, dessen Gläubiger sie sind, nach §§ 125, 19 Abs. 3 UmwG als bekannt gemacht gilt, ihren Anspruch nach Grund und Höhe schriftlich anmelden, Sicherheit zu leisten, soweit sie nicht Befriedigung verlangen können. Dieses Recht steht den Gläubigern jedoch nur zu, wenn sie glaubhaft machen, dass durch die Spaltung die Erfüllung ihrer Forderung gefährdet wird."
    },
    {
      "date": "2024-11-26",
      "original_text": "Löschungsankündigung\nBrandenburg Amtsgericht Frankfurt/Oder HRB 12249\nFliesen Borchert GmbH – Eberswalde",
      "type": "Löschungsankündigung",
      "state": "Brandenburg",
      "amtsgericht": "Amtsgericht Frankfurt/Oder",
      "registernummer": "HRB 12249",
      "registerart": "HRB",
      "company_name": "Fliesen Borchert GmbH",
      "company_seat": "Eberswalde",
      "details": "26.11.2024 (Bekanntmachungsdatum)\n\nBrandenburg Amtsgericht Frankfurt/Oder HRB 12249\nLöschungsankündigung\n\nFliesen Borchert GmbH\nGesellschaft mit beschränkter Haftung\nEberswalde\n\nBei der nachstehenden Gesellschaft wird das Amtslöschungsverfahren gemäß § 394 FamFG eingeleitet."
    },
    {
      "date": "2024-11-26",
      "original_text": "Löschungsankündigung\nBrandenburg Amtsgericht Frankfurt/Oder HRB 12336\nG. B. Immobilienverwaltungs GmbH – Beiersdorf-Freudenberg",
      "type": "Löschungsankündigung",
      "state": "Brandenburg",
      "amtsgericht": "Amtsgericht Frankfurt/Oder",
      "registernummer": "HRB 12336",
      "registerart": "HRB",
      "company_name": "G. B. Immobilienverwaltungs GmbH",
      "company_seat": "Beiersdorf-Freudenberg",
      "details": "26.11.2024 (Bekanntmachungsdatum)\n\nBrandenburg Amtsgericht Frankfurt/Oder HRB 12336\nLöschungsankündigung\n\nG. B. Immobilienverwaltungs GmbH\nGesellschaft mit beschränkter Haftung\nBeiersdorf-Freudenberg\n\nBei der nachstehenden Gesellschaft wird das Amtslöschungsverfahren gemäß § 394 Abs. 1 FamFG eingeleitet."
    },
    {
      "date": "2024-11-26",
      "original_text": "Einreichung neuer Dokumente\nNiedersachsen Amtsgericht Walsrode HRB 204621\nGBN Kabelunternehmen GmbH Nienburg/Weser – Nienburg",
      "type": "Einreichung neuer Dokumente",
      "state": "Niedersachsen",
      "amtsgericht": "Amtsgericht Walsrode",
      "registernummer": "HRB 204621",
      "registerart": "HRB",
      "company_name": "GBN Kabelunternehmen GmbH Nienburg/Weser",
      "company_seat": "Nienburg",
      "details": "26.11.2024 (Bekanntmachungsdatum)\n\nNiedersachsen Amtsgericht Walsrode HRB 204621\nEinreichung neuer Dokumente 26.11.2024 (Eintragungsdatum)\n\nGBN Kabelunternehmen GmbH Nienburg/Weser\nGesellschaft mit beschränkter Haftung\nNienburg\n\nDie Liste der Mitglieder des Aufsichtsrats wurde beim Registergericht eingereicht."
    },
    {
      "date": "2024-11-26",
      "original_text": "Einreichung neuer Dokumente\nNiedersachsen Amtsgericht Walsrode HRB 30021\nGBN Wohnungsunternehmen GmbH Nienburg/Weser – Nienburg/Weser",
      "type": "Einreichung neuer Dokumente",
      "state": "Niedersachsen",
      "amtsgericht": "Amtsgericht Walsrode",
      "registernummer": "HRB 30021",
      "registerart": "HRB",
      "company_name": "GBN Wohnungsunternehmen GmbH Nienburg/Weser",
      "company_seat": "Nienburg/Weser",
      "details": "26.11.2024 (Bekanntmachungsdatum)\n\nNiedersachsen Amtsgericht Walsrode HRB 30021\nEinreichung neuer Dokumente 26.11.2024 (Eintragungsdatum)\n\nGBN Wohnungsunternehmen GmbH Nienburg/Weser\nGesellschaft mit beschränkter Haftung\nNienburg/Weser\n\nDie Liste der Mitglieder des Aufsichtsrats wurde beim Registergericht eingereicht."
    },
    {
      "date": "2024-11-26",
      "original_text": "Registerbekanntmachung nach dem Umwandlungsgesetz\nBayern Amtsgericht Hof HRB 7011\nGEASUS GmbH – Selb",
      "type": "Registerbekanntmachung nach dem Umwandlungsgesetz",
      "state": "Bayern",
      "amtsgericht": "Amtsgericht Hof",
      "registernummer": "HRB 7011",
      "registerart": "HRB",
      "company_name": "GEASUS GmbH",
      "company_seat": "Selb",
      "details": "26.11.2024 (Bekanntmachungsdatum)\n\nBayern Amtsgericht Hof HRB 7011\nRegisterbekanntmachung nach dem Umwandlungsgesetz 25.11.2024 (Eintragungsdatum)\n\nGEASUS GmbH\nGesellschaft mit beschränkter Haftung\nSelb\n\nDen Gläubigern der an der Ausgliederung beteiligten Rechtsträger ist, wenn sie binnen sechs Monaten nach dem Tag, an dem die Eintragung der Ausgliederung in das Register des Sitzes desjenigen Rechtsträgers, dessen Gläubiger sie sind, nach §§ 125, 19 Abs. 3 UmwG als bekannt gemacht gilt, ihren Anspruch nach Grund und Höhe schriftlich anmelden, Sicherheit zu leisten, soweit sie nicht Befriedigung verlangen können. Dieses Recht steht den Gläubigern jedoch nur zu, wenn sie glaubhaft machen, dass durch die Ausgliederung die Erfüllung ihrer Forderung gefährdet wird."
    },
    {
      "date": "2024-11-26",
      "original_text": "Löschungsankündigung\nBayern Amtsgericht München HRB 165172\nGFN Vermögensverwaltung GmbH – Dachau",
      "type": "Löschungsankündigung",
      "state": "Bayern",
      "amtsgericht": "Amtsgericht München",
      "registernummer": "HRB 165172",
      "registerart": "HRB",
      "company_name": "GFN Vermögensverwaltung GmbH",
      "company_seat": "Dachau",
      "details": "26.11.2024 (Bekanntmachungsdatum)\n\nBayern Amtsgericht München HRB 165172\nLöschungsankündigung\n\nGFN Vermögensverwaltung GmbH\nGesellschaft mit beschränkter Haftung\nDachau\n\nDas Registergericht beabsichtigt, die im Handelsregister eingetragene Gesellschaft wegen Vermögenslosigkeit von Amts wegen nach § 394 FamFG zu löschen. Die Frist zur Erhebung eines Widerspruchs ist auf drei Monate festgesetzt."
    },
    {
      "date": "2024-11-26",
      "original_text": "Registerbekanntmachung nach dem Umwandlungsgesetz\nBayern Amtsgericht Fürth HRB 17261\nGGS Grundbesitz Burgbernheim GmbH – Burgbernheim",
      "type": "Registerbekanntmachung nach dem Umwandlungsgesetz",
      "state": "Bayern",
      "amtsgericht": "Amtsgericht Fürth",
      "registernummer": "HRB 17261",
      "registerart": "HRB",
      "company_name": "GGS Grundbesitz Burgbernheim GmbH",
      "company_seat": "Burgbernheim",
      "details": "26.11.2024 (Bekanntmachungsdatum)\n\nBayern Amtsgericht Fürth HRB 17261\nRegisterbekanntmachung nach dem Umwandlungsgesetz\n\nGGS Grundbesitz Burgbernheim GmbH\nGesellschaft mit beschränkter Haftung\nBurgbernheim\n\nDem Amtsgericht Fürth -Registergericht- ist am 21.11.2024 der Entwurf eines Formwechselplanes über den geplanten grenzüberschreitenden Formwechsel der GGS Grundbesitz Burgbernheim GmbH, eingetragen beim Amtsgericht Fürth -Registergericht- unter HRB 17261, in eine société à responsabilité limitée nach dem Recht des Großherzogtums Luxemburg unter der Firma GGS Grundbesitz Burgbernheim S.à.r.l. mit Sitz in Stadt Luxemburg/Luxemburg mit der Gesellschaft als übertragendem Rechtsträger eingereicht worden."
    },
    {
      "date": "2024-11-26",
      "original_text": "Einreichung neuer Dokumente\nNordrhein-Westfalen Amtsgericht Köln HRB 660\nGOTHAER Versicherungsbank VVaG – Köln",
      "type": "Einreichung neuer Dokumente",
      "state": "Nordrhein-Westfalen",
      "amtsgericht": "Amtsgericht Köln",
      "registernummer": "HRB 660",
      "registerart": "HRB",
      "company_name": "GOTHAER Versicherungsbank VVaG",
      "company_seat": "Köln",
      "details": "26.11.2024 (Bekanntmachungsdatum)\n\nNordrhein-Westfalen Amtsgericht Köln HRB 660\nEinreichung neuer Dokumente\n\nGOTHAER Versicherungsbank VVaG\nVersicherungsverein auf Gegenseitigkeit\nKöln\n\nDem Registergericht ist eine neue Liste der Mitglieder des Aufsichtsrates eingereicht worden."
    },
    {
      "date": "2024-11-26",
      "original_text": "Registerbekanntmachung nach dem Umwandlungsgesetz\nBaden-Württemberg Amtsgericht Mannheim HRB 752749\nGRUND-Idee Immobilienverwaltungen GmbH – Hockenheim",
      "type": "Registerbekanntmachung nach dem Umwandlungsgesetz",
      "state": "Baden-Württemberg",
      "amtsgericht": "Amtsgericht Mannheim",
      "registernummer": "HRB 752749",
      "registerart": "HRB",
      "company_name": "GRUND-Idee Immobilienverwaltungen GmbH",
      "company_seat": "Hockenheim",
      "details": "26.11.2024 (Bekanntmachungsdatum)\n\nBaden-Württemberg Amtsgericht Mannheim HRB 752749\nRegisterbekanntmachung nach dem Umwandlungsgesetz 26.11.2024 (Eintragungsdatum)\n\nGRUND-Idee Immobilienverwaltungen GmbH\nGesellschaft mit beschränkter Haftung\nHockenheim\n\nDen Gläubigern der an der grenzüberschreitenden Abspaltung beteiligten übernehmenden Rechtsträger ist, wenn sie binnen sechs Monaten nach dem Tag, an dem die Eintragung der Spaltung in das Register des Sitzes desjenigen Rechtsträgers, dessen Gläubiger sie sind, nach § 19 Absatz 3 UmwG als bekanntgemacht gilt, ihren Anspruch nach Grund und Höhe schriftlich anmelden, Sicherheit zu leisten, soweit sie nicht Befriedigung verlangen können.\nDieses Recht steht den Gläubigern jedoch nur zu, wenn sie glaubhaft machen, dass durch die Spaltung die Erfüllung ihrer Forderung gefährdet wird."
    },
    {
      "date": "2024-11-26",
      "original_text": "Registerbekanntmachung nach dem Umwandlungsgesetz\nBaden-Württemberg Amtsgericht Mannheim HRB 421384\nGRUND-Idee Management & Consulting GmbH – Hockenheim",
      "type": "Registerbekanntmachung nach dem Umwandlungsgesetz",
      "state": "Baden-Württemberg",
      "amtsgericht": "Amtsgericht Mannheim",
      "registernummer": "HRB 421384",
      "registerart": "HRB",
      "company_name": "GRUND-Idee Management & Consulting GmbH",
      "company_seat": "Hockenheim",
      "details": "26.11.2024 (Bekanntmachungsdatum)\n\nBaden-Württemberg Amtsgericht Mannheim HRB 421384\nRegisterbekanntmachung nach dem Umwandlungsgesetz 26.11.2024 (Eintragungsdatum)\n\nGRUND-Idee Management & Consulting GmbH\nGesellschaft mit beschränkter Haftung\nHockenheim\n\nDen Gläubigern der an der Abspaltung beteiligten Rechtsträger ist, wenn sie binnen sechs Monaten nach dem Tag, an dem die Eintragung der Abspaltung in das Register des Sitzes desjenigen Rechtsträgers, dessen Gläubiger sie sind, nach § 19 Abs. 3 UmwG als bekanntgemacht gilt, ihren Anspruch nach Grund und Höhe schriftlich anmelden, Sicherheit zu leisten, soweit sie nicht Befriedigung verlangen können. Dieses Recht steht den Gläubigern jedoch nur zu, wenn sie glaubhaft machen, dass durch die Abspaltung die Erfüllung ihrer Forderung gefährdet wird."
    },
    {
      "date": "2024-11-26",
      "original_text": "Sonstige Registerbekanntmachung\nNordrhein-Westfalen Amtsgericht Köln HRB 21433\nGothaer Allgemeine Versicherung AG – Köln",
      "type": "Sonstige Registerbekanntmachung",
      "state": "Nordrhein-Westfalen",
      "amtsgericht": "Amtsgericht Köln",
      "registernummer": "HRB 21433",
      "registerart": "HRB",
      "company_name": "Gothaer Allgemeine Versicherung AG",
      "company_seat": "Köln",
      "details": "26.11.2024 (Bekanntmachungsdatum)\n\nNordrhein-Westfalen Amtsgericht Köln HRB 21433\nSonstige Registerbekanntmachung\n\nGothaer Allgemeine Versicherung AG\nAktiengesellschaft\nKöln\n\nDem Registergericht ist eine Liste der Mitglieder des Aufsichtsrates eingereicht worden."
    },
    {
      "date": "2024-11-26",
      "original_text": "Sonstige Registerbekanntmachung\nNordrhein-Westfalen Amtsgericht Köln HRB 56769\nGothaer Lebensversicherung Aktiengesellschaft – Köln",
      "type": "Sonstige Registerbekanntmachung",
      "state": "Nordrhein-Westfalen",
      "amtsgericht": "Amtsgericht Köln",
      "registernummer": "HRB 56769",
      "registerart": "HRB",
      "company_name": "Gothaer Lebensversicherung Aktiengesellschaft",
      "company_seat": "Köln",
      "details": "26.11.2024 (Bekanntmachungsdatum)\n\nNordrhein-Westfalen Amtsgericht Köln HRB 56769\nSonstige Registerbekanntmachung\n\nGothaer Lebensversicherung Aktiengesellschaft\nAktiengesellschaft\nKöln\n\nDem Registergericht ist eine Liste der Mitglieder des Aufsichtsrates eingereicht worden."
    },
    {
      "date": "2024-11-26",
      "original_text": "Registerbekanntmachung nach dem Umwandlungsgesetz\nBayern Amtsgericht Nürnberg HRB 40591\nGreeno Solarprojekt 54 GmbH – Nürnberg",
      "type": "Registerbekanntmachung nach dem Umwandlungsgesetz",
      "state": "Bayern",
      "amtsgericht": "Amtsgericht Nürnberg",
      "registernummer": "HRB 40591",
      "registerart": "HRB",
      "company_name": "Greeno Solarprojekt 54 GmbH",
      "company_seat": "Nürnberg",
      "details": "26.11.2024 (Bekanntmachungsdatum)\n\nBayern Amtsgericht Nürnberg HRB 40591\nRegisterbekanntmachung nach dem Umwandlungsgesetz 25.11.2024 (Eintragungsdatum)\n\nGreeno Solarprojekt 54 GmbH\nGesellschaft mit beschränkter Haftung\nNürnberg\n\nDen Gläubigern des formwechselnden Rechtsträgers ist, wenn sie binnen sechs Monaten nach dem Tag, an dem die Eintragung des Formwechsels nach § 201 UmwG als bekannt gemacht gilt, ihren Anspruch nach Grund und Höhe schriftlich anmelden, Sicherheit zu leisten, soweit sie nicht Befriedigung verlangen können. Dieses Recht steht den Gläubigern jedoch nur zu, wenn sie glaubhaft machen, dass durch den Formwechsel die Erfüllung ihrer Forderung gefährdet wird."
    },
    {
      "date": "2024-11-26",
      "original_text": "Sonstige Registerbekanntmachung\nNordrhein-Westfalen Amtsgericht Duisburg HRB 105\nGrillo-Werke Aktiengesellschaft – Duisburg",
      "type": "Sonstige Registerbekanntmachung",
      "state": "Nordrhein-Westfalen",
      "amtsgericht": "Amtsgericht Duisburg",
      "registernummer": "HRB 105",
      "registerart": "HRB",
      "company_name": "Grillo-Werke Aktiengesellschaft",
      "company_seat": "Duisburg",
      "details": "26.11.2024 (Bekanntmachungsdatum)\n\nNordrhein-Westfalen Amtsgericht Duisburg HRB 105\nSonstige Registerbekanntmachung 30.10.2024 (Eintragungsdatum)\n\nGrillo-Werke Aktiengesellschaft\nAktiengesellschaft\nDuisburg\n\nDem Registergericht ist eine geänderte Liste der Mitglieder des Aufsichtsrates vom 19.03.2024 eingereicht worden (§ 106 AktG)."
    },
    {
      "date": "2024-11-26",
      "original_text": "Einreichung neuer Dokumente\nNiedersachsen Amtsgericht Göttingen HRB 3601\nGöttinger Verkehrsbetriebe GmbH – Göttingen",
      "type": "Einreichung neuer Dokumente",
      "state": "Niedersachsen",
      "amtsgericht": "Amtsgericht Göttingen",
      "registernummer": "HRB 3601",
      "registerart": "HRB",
      "company_name": "Göttinger Verkehrsbetriebe GmbH",
      "company_seat": "Göttingen",
      "details": "26.11.2024 (Bekanntmachungsdatum)\n\nNiedersachsen Amtsgericht Göttingen HRB 3601\nEinreichung neuer Dokumente\n\nGöttinger Verkehrsbetriebe GmbH\nGesellschaft mit beschränkter Haftung\nGöttingen\n\nDie Liste der Mitglieder des Aufsichtsrats wurde beim Registergericht eingereicht."
    },
    {
      "date": "2024-11-26",
      "original_text": "Registerbekanntmachung nach dem Umwandlungsgesetz\nBaden-Württemberg Amtsgericht Mannheim HRB 711011\nHLX Touristik GmbH – Baden-Baden",
      "type": "Registerbekanntmachung nach dem Umwandlungsgesetz",
      "state": "Baden-Württemberg",
      "amtsgericht": "Amtsgericht Mannheim",
      "registernummer": "HRB 711011",
      "registerart": "HRB",
      "company_name": "HLX Touristik GmbH",
      "company_seat": "Baden-Baden",
      "details": "26.11.2024 (Bekanntmachungsdatum)\n\nBaden-Württemberg Amtsgericht Mannheim HRB 711011\nRegisterbekanntmachung nach dem Umwandlungsgesetz 26.11.2024 (Eintragungsdatum)\n\nHLX Touristik GmbH\nGesellschaft mit beschränkter Haftung\nBaden-Baden\n\nAls nicht eingetragen wird bekanntgemacht:\nDen Gläubigern der an der Verschmelzung beteiligten Rechtsträger ist, wenn sie binnen sechs Monaten nach dem Tag, an dem die Eintragung der Verschmelzung in das Register des Sitzes desjenigen Rechtsträgers, dessen Gläubiger sie sind, nach § 19 Abs. 3 UmwG als bekanntgemacht gilt, ihren Anspruch nach Grund und Höhe schriftlich anmelden, Sicherheit zu leisten, soweit sie nicht Befriedigung verlangen können. Dieses Recht steht den Gläubigern jedoch nur zu, wenn sie glaubhaft machen, dass durch die Verschmelzung die Erfüllung ihrer Forderung gefährdet wird."
    },
    {
      "date": "2024-11-26",
      "original_text": "Löschungsankündigung\nHessen Amtsgericht Offenbach am Main VR 5573\nHandharmonika-Club \"AHOI\" Dietzenbach – Dietzenbach",
      "type": "Löschungsankündigung",
      "state": "Hessen",
      "amtsgericht": "Amtsgericht Offenbach am Main",
      "registernummer": "VR 5573",
      "registerart": "VR",
      "company_name": "Handharmonika-Club \"AHOI\" Dietzenbach",
      "company_seat": "Dietzenbach",
      "details": "26.11.2024 (Bekanntmachungsdatum)\n\nHessen Amtsgericht Offenbach am Main VR 5573\nLöschungsankündigung 31.01.2024 (Eintragungsdatum)\n\nHandharmonika-Club \"AHOI\" Dietzenbach\neingetragener Verein\nDietzenbach\n\nDer Verein ist aufgelöst."
    },
    {
      "date": "2024-11-26",
      "original_text": "Registerbekanntmachung nach dem Umwandlungsgesetz\nSchleswig-Holstein Amtsgericht Lübeck HRB 16043\nHermes Online Service GmbH – Reinbek",
      "type": "Registerbekanntmachung nach dem Umwandlungsgesetz",
      "state": "Schleswig-Holstein",
      "amtsgericht": "Amtsgericht Lübeck",
      "registernummer": "HRB 16043",
      "registerart": "HRB",
      "company_name": "Hermes Online Service GmbH",
      "company_seat": "Reinbek",
      "details": "26.11.2024 (Bekanntmachungsdatum)\n\nSchleswig-Holstein Amtsgericht Lübeck HRB 16043\nRegisterbekanntmachung nach dem Umwandlungsgesetz 25.11.2024 (Eintragungsdatum)\n\nHermes Online Service GmbH\nGesellschaft mit beschränkter Haftung\nReinbek\n\nZu Eintragungsnummer 5 vom 25.11.2024 wird als nicht eingetragen veröffentlicht:\nDen Gläubigern der an der Verschmelzung beteiligten Rechtsträger ist, wenn sie binnen sechs Monaten nach dem Tag, an dem die Eintragung der Verschmelzung in das Register des Sitzes desjenigen Rechtsträgers, dessen Gläubiger sie sind, als bekannt gemacht gilt, ihren Anspruch nach Grund und Höhe schriftlich anmelden, Sicherheit zu leisten, soweit sie nicht Befriedigung verlangen können. Dieses Recht steht den Gläubigern jedoch nur zu, wenn sie glaubhaft machen, dass durch die Verschmelzung die Erfüllung ihrer Forderung gefährdet wird."
    },
    {
      "date": "2024-11-26",
      "original_text": "Löschungsankündigung\nBayern Amtsgericht Passau HRB 11566\nHungaro Gourmet Group GmbH – Passau",
      "type": "Löschungsankündigung",
      "state": "Bayern",
      "amtsgericht": "Amtsgericht Passau",
      "registernummer": "HRB 11566",
      "registerart": "HRB",
      "company_name": "Hungaro Gourmet Group GmbH",
      "company_seat": "Passau",
      "details": "26.11.2024 (Bekanntmachungsdatum)\n\nBayern Amtsgericht Passau HRB 11566\nLöschungsankündigung\n\nHungaro Gourmet Group GmbH\nGesellschaft mit beschränkter Haftung\nPassau\n\nDas Registergericht beabsichtigt, die im Handelsregister eingetragene Gesellschaft wegen Vermögenslosigkeit von Amts wegen nach § 394 FamFG zu löschen. Die Frist zur Erhebung eines Widerspruchs ist auf einen Monat festgesetzt."
    },
    {
      "date": "2024-11-26",
      "original_text": "Einreichung neuer Dokumente\nSaarland Amtsgericht Saarbrücken HRB 8499\nIZES gGmbH – Saarbrücken",
      "type": "Einreichung neuer Dokumente",
      "state": "Saarland",
      "amtsgericht": "Amtsgericht Saarbrücken",
      "registernummer": "HRB 8499",
      "registerart": "HRB",
      "company_name": "IZES gGmbH",
      "company_seat": "Saarbrücken",
      "details": "26.11.2024 (Bekanntmachungsdatum)\n\nSaarland Amtsgericht Saarbrücken HRB 8499\nEinreichung neuer Dokumente\n\nIZES gGmbH\nGesellschaft mit beschränkter Haftung\nSaarbrücken\n\nDie Geschäftsführung der Gesellschaft hat eine Liste der Mitglieder des Aufsichtsrats zum Handelsregister eingereicht (§ 52 Abs. 3 Satz 2 GmbHG)."
    },
    {
      "date": "2024-11-26",
      "original_text": "Löschungsankündigung\nHessen Amtsgericht Frankfurt am Main HRB 78041\nJBI Handels-GmbH – Frankfurt am Main",
      "type": "Löschungsankündigung",
      "state": "Hessen",
      "amtsgericht": "Amtsgericht Frankfurt am Main",
      "registernummer": "HRB 78041",
      "registerart": "HRB",
      "company_name": "JBI Handels-GmbH",
      "company_seat": "Frankfurt am Main",
      "details": "26.11.2024 (Bekanntmachungsdatum)\n\nHessen Amtsgericht Frankfurt am Main HRB 78041\nLöschungsankündigung\n\nJBI Handels-GmbH\nGesellschaft mit beschränkter Haftung\nFrankfurt am Main\n\nEs ist beabsichtigt, die Gesellschaft wegen Vermögenslosigkeit gemäß §394 FamFG von Amts wegen im Handelsregister zu lösche.\n\nHiergegen kann innerhalb eines Zautraums von 1 Monat nach dieser Veröffentlichung Widerspruch bei dem Amtsgericht Frankfurt am Main eingelegt werden."
    },
    {
      "date": "2024-11-26",
      "original_text": "Registerbekanntmachung nach dem Umwandlungsgesetz\nBayern Amtsgericht Traunstein HRB 33103\nJF-Invest Holding GmbH – Mühldorf a.Inn",
      "type": "Registerbekanntmachung nach dem Umwandlungsgesetz",
      "state": "Bayern",
      "amtsgericht": "Amtsgericht Traunstein",
      "registernummer": "HRB 33103",
      "registerart": "HRB",
      "company_name": "JF-Invest Holding GmbH",
      "company_seat": "Mühldorf a.Inn",
      "details": "26.11.2024 (Bekanntmachungsdatum)\n\nBayern Amtsgericht Traunstein HRB 33103\nRegisterbekanntmachung nach dem Umwandlungsgesetz 25.11.2024 (Eintragungsdatum)\n\nJF-Invest Holding GmbH\nGesellschaft mit beschränkter Haftung\nMühldorf a.Inn\n\nDen Gläubigern der an der Spaltung beteiligten Rechtsträger ist, wenn sie binnen sechs Monaten nach dem Tag, an dem die Eintragung der Spaltung in das Register des Sitzes desjenigen Rechtsträgers, dessen Gläubiger sie sind, nach §§ 125, 19 Abs. 3 UmwG als bekannt gemacht gilt, ihren Anspruch nach Grund und Höhe schriftlich anmelden, Sicherheit zu leisten, soweit sie nicht Befriedigung verlangen können. Dieses Recht steht den Gläubigern jedoch nur zu, wenn sie glaubhaft machen, dass durch die Spaltung die Erfüllung ihrer Forderung gefährdet wird."
    },
    {
      "date": "2024-11-26",
      "original_text": "Registerbekanntmachung nach dem Umwandlungsgesetz\nBayern Amtsgericht Traunstein HRB 32500\nJF-K Holding GmbH – Mühldorf a.Inn",
      "type": "Registerbekanntmachung nach dem Umwandlungsgesetz",
      "state": "Bayern",
      "amtsgericht": "Amtsgericht Traunstein",
      "registernummer": "HRB 32500",
      "registerart": "HRB",
      "company_name": "JF-K Holding GmbH",
      "company_seat": "Mühldorf a.Inn",
      "details": "26.11.2024 (Bekanntmachungsdatum)\n\nBayern Amtsgericht Traunstein HRB 32500\nRegisterbekanntmachung nach dem Umwandlungsgesetz 25.11.2024 (Eintragungsdatum)\n\nJF-K Holding GmbH\nGesellschaft mit beschränkter Haftung\nMühldorf a.Inn\n\nDen Gläubigern der an der Spaltung beteiligten Rechtsträger ist, wenn sie binnen sechs Monaten nach dem Tag, an dem die Eintragung der Spaltung in das Register des Sitzes desjenigen Rechtsträgers, dessen Gläubiger sie sind, nach §§ 125, 19 Abs. 3 UmwG als bekannt gemacht gilt, ihren Anspruch nach Grund und Höhe schriftlich anmelden, Sicherheit zu leisten, soweit sie nicht Befriedigung verlangen können. Dieses Recht steht den Gläubigern jedoch nur zu, wenn sie glaubhaft machen, dass durch die Spaltung die Erfüllung ihrer Forderung gefährdet wird."
    },
    {
      "date": "2024-11-26",
      "original_text": "Löschungsankündigung\nSachsen Amtsgericht Dresden HRB 39410\nJUNGBRUNNEN-DRESDEN LIMITED – Dresden",
      "type": "Löschungsankündigung",
      "state": "Sachsen",
      "amtsgericht": "Amtsgericht Dresden",
      "registernummer": "HRB 39410",
      "registerart": "HRB",
      "company_name": "JUNGBRUNNEN-DRESDEN LIMITED",
      "company_seat": "Dresden",
      "details": "26.11.2024 (Bekanntmachungsdatum)\n\nSachsen Amtsgericht Dresden HRB 39410\nLöschungsankündigung\n\nJUNGBRUNNEN-DRESDEN LIMITED\nRechtsform ausländischen Rechts HRB\nDresden\n\nDas Registergericht beabsichtigt, die im Handelsregister eingetragene Gesellschaft von Amts wegen nach § 394 FamFG zu löschen. Die Frist zu Erhebung eines Widerspruchs gegen die beabsichtigte Löschung wird auf einen Monat festgesetzt."
    },
    {
      "date": "2024-11-26",
      "original_text": "Registerbekanntmachung nach dem Umwandlungsgesetz\nBaden-Württemberg Amtsgericht Mannheim HRB 9109\nKAIROS Partners on time consulting GmbH – Mannheim",
      "type": "Registerbekanntmachung nach dem Umwandlungsgesetz",
      "state": "Baden-Württemberg",
      "amtsgericht": "Amtsgericht Mannheim",
      "registernummer": "HRB 9109",
      "registerart": "HRB",
      "company_name": "KAIROS Partners on time consulting GmbH",
      "company_seat": "Mannheim",
      "details": "26.11.2024 (Bekanntmachungsdatum)\n\nBaden-Württemberg Amtsgericht Mannheim HRB 9109\nRegisterbekanntmachung nach dem Umwandlungsgesetz 26.11.2024 (Eintragungsdatum)\n\nKAIROS Partners on time consulting GmbH\nGesellschaft mit beschränkter Haftung\nMannheim\n\nAls nicht eingetragen wird bekanntgemacht: Den Gläubigern der an der Verschmelzung beteiligten Rechtsträger ist, wenn sie binnen sechs Monaten nach dem Tag, an dem die Eintragung der Verschmelzung in das Register des Sitzes desjenigen Rechtsträgers, dessen Gläubiger sie sind, nach § 19 Abs. 3 UmwG als bekanntgemacht gilt, ihren Anspruch nach Grund und Höhe schriftlich anmelden, Sicherheit zu leisten, soweit sie nicht Befriedigung verlangen können. Dieses Recht steht den Gläubigern jedoch nur zu, wenn sie glaubhaft machen, dass durch die Verschmelzung die Erfüllung ihrer Forderung gefährdet wird."
    },
    {
      "date": "2024-11-26",
      "original_text": "Registerbekanntmachung nach dem Umwandlungsgesetz\nSachsen-Anhalt Amtsgericht Stendal HRB 32770\nKarosserie Schäfer GmbH – Magdeburg",
      "type": "Registerbekanntmachung nach dem Umwandlungsgesetz",
      "state": "Sachsen-Anhalt",
      "amtsgericht": "Amtsgericht Stendal",
      "registernummer": "HRB 32770",
      "registerart": "HRB",
      "company_name": "Karosserie Schäfer GmbH",
      "company_seat": "Magdeburg",
      "details": "26.11.2024 (Bekanntmachungsdatum)\n\nSachsen-Anhalt Amtsgericht Stendal HRB 32770\nRegisterbekanntmachung nach dem Umwandlungsgesetz 26.11.2024 (Eintragungsdatum)\n\nKarosserie Schäfer GmbH\nGesellschaft mit beschränkter Haftung\nMagdeburg\n\nNicht eingetragen:\nDen Gläubigern der an der Ausgliederung beteiligten Rechtsträger, ist wenn sie binnen sechs Monaten nach dem Tag, an dem die Eintragung der Ausgliederung nach §§125, 19 Abs. 3 UmwG als bekanntgemacht gilt, ihren Anspruch nach Grund und Höhe schriftlich anmelden, Sicherheit zu leisten, soweit sie nicht Befriedigung verlangen können. Diese Recht steht ihnen jedoch nur zu, wenn sie glaubhaft machen, dass durch die Ausgliederung die Erfüllung ihrer Forderung gefährdet wird."
    },
    {
      "date": "2024-11-26",
      "original_text": "Registerbekanntmachung nach dem Umwandlungsgesetz\nSachsen-Anhalt Amtsgericht Stendal HRA 2818\nKarosserie Schäfer Inhaber Alexander Hinz e.K. – Magdeburg",
      "type": "Registerbekanntmachung nach dem Umwandlungsgesetz",
      "state": "Sachsen-Anhalt",
      "amtsgericht": "Amtsgericht Stendal",
      "registernummer": "HRA 2818",
      "registerart": "HRA",
      "company_name": "Karosserie Schäfer Inhaber Alexander Hinz e.K.",
      "company_seat": "Magdeburg",
      "details": "26.11.2024 (Bekanntmachungsdatum)\n\nSachsen-Anhalt Amtsgericht Stendal HRA 2818\nRegisterbekanntmachung nach dem Umwandlungsgesetz 26.11.2024 (Eintragungsdatum)\n\nKarosserie Schäfer Inhaber Alexander Hinz e.K.\nEinzelkaufmann / Einzelkauffrau\nMagdeburg\n\nNicht eingetragen:\nDen Gläubigern der an der Ausgliederung beteiligten Rechtsträger, ist wenn sie binnen sechs Monaten nach dem Tag, an dem die Eintragung der Ausgliederung nach §§125, 19 Abs. 3 UmwG als bekanntgemacht gilt, ihren Anspruch nach Grund und Höhe schriftlich anmelden, Sicherheit zu leisten, soweit sie nicht Befriedigung verlangen können. Diese Recht steht ihnen jedoch nur zu, wenn sie glaubhaft machen, dass durch die Ausgliederung die Erfüllung ihrer Forderung gefährdet wird."
    },
    {
      "date": "2024-11-26",
      "original_text": "Sonstige Registerbekanntmachung\nSachsen Amtsgericht Leipzig HRB 3775\nKommunale Wasserwerke Leipzig GmbH – Leipzig",
      "type": "Sonstige Registerbekanntmachung",
      "state": "Sachsen",
      "amtsgericht": "Amtsgericht Leipzig",
      "registernummer": "HRB 3775",
      "registerart": "HRB",
      "company_name": "Kommunale Wasserwerke Leipzig GmbH",
      "company_seat": "Leipzig",
      "details": "26.11.2024 (Bekanntmachungsdatum)\n\nSachsen Amtsgericht Leipzig HRB 3775\nSonstige Registerbekanntmachung\n\nKommunale Wasserwerke Leipzig GmbH\nGesellschaft mit beschränkter Haftung\nLeipzig\n\nAm 25.11.2024 wurde beim Handelsregister des Amtsgerichts Leipzig die Liste der Mitglieder des Aufsichtsrats gemäß § 52 GmbHG eingereicht."
    },
    {
      "date": "2024-11-26",
      "original_text": "Registerbekanntmachung nach dem Umwandlungsgesetz\nHessen Amtsgericht Offenbach am Main HRB 51966\nKomsana GmbH – Offenbach am Main",
      "type": "Registerbekanntmachung nach dem Umwandlungsgesetz",
      "state": "Hessen",
      "amtsgericht": "Amtsgericht Offenbach am Main",
      "registernummer": "HRB 51966",
      "registerart": "HRB",
      "company_name": "Komsana GmbH",
      "company_seat": "Offenbach am Main",
      "details": "26.11.2024 (Bekanntmachungsdatum)\n\nHessen Amtsgericht Offenbach am Main HRB 51966\nRegisterbekanntmachung nach dem Umwandlungsgesetz 26.11.2024 (Eintragungsdatum)\n\nKomsana GmbH\nGesellschaft mit beschränkter Haftung\nOffenbach am Main\n\nDen Gläubigern der an der #DV.UmF(Text=\"Bitte wählen Sie die zutreffende Art nach UmwG aus!\",Eingabe=\"Verschmelzung\",\"Aufspaltung\",\"Abspaltung\",\"Ausgliederung\",\"Vermögensübertragung\",\"formwechselnden Umwandlung\") beteiligten Rechtsträger ist, wenn sie binnen sechs Monaten nach dem Tag, an dem die Eintragung der #DV.UmF in das Register des Sitzes #DV.RTr(Text=\"Bitte wählen Sie aus, ob ein oder mehrere andere Rechtsträger betroffen sind!\",Eingabe=\"desjenigen Rechtsträgers, dessen Gläubiger\",\"derjenigen Rechtsträger deren Gläubiger\") sie sind, nach #DV.Auswahl(Text=\"Bitte wählen Sie die zutreffende Vorschrift aus!\",Eingabe=\"§ 19 Absatz 3 UmwG\"|\"§ 19 Absatz 3 UmwG (=Verschmelzung)\",\"§§ 122a Absatz 2, 19 Absatz 3 UmwG\"|\"§§ 122a Absatz 2, 19 Absatz 3 UmwG (=grenzüberschreitende Verschmelzung)\",\"§§ 125, 19 Absatz 3 UmwG\"|\"§§ 125, 19 Absatz 3 UmwG (=Spaltung)\",\"§ 201 UmwG\"|\"§ 201 UmwG (=Formwechsel)\",\"#insert(Text=\"Freitext\") UmwG\"|\"freie Eingabe\") bekannt gemacht worden ist, ihren Anspruch nach Grund und Höhe schriftlich anmelden, Sicherheit zu leisten, soweit sie nicht Befriedigung verlangen können. Dieses Recht steht den Gläubigern jedoch nur zu, wenn sie glaubhaft machen, dass durch die #DV.UmF die Erfüllung ihrer Forderung gefährdet wird."
    },
    {
      "date": "2024-11-26",
      "original_text": "Registerbekanntmachung nach dem Umwandlungsgesetz\nBayern Amtsgericht München HRA 119839\nKonWis LLC & Co. KG – München",
      "type": "Registerbekanntmachung nach dem Umwandlungsgesetz",
      "state": "Bayern",
      "amtsgericht": "Amtsgericht München",
      "registernummer": "HRA 119839",
      "registerart": "HRA",
      "company_name": "KonWis LLC & Co. KG",
      "company_seat": "München",
      "details": "26.11.2024 (Bekanntmachungsdatum)\n\nBayern Amtsgericht München HRA 119839\nRegisterbekanntmachung nach dem Umwandlungsgesetz 25.11.2024 (Eintragungsdatum)\n\nKonWis LLC & Co. KG\nKommanditgesellschaft\nMünchen\n\nDen Gläubigern der an der Verschmelzung beteiligten Rechtsträger ist, wenn sie binnen sechs Monaten nach dem Tag, an dem die Eintragung der Verschmelzung in das Register des Sitzes desjenigen Rechtsträgers, dessen Gläubiger sie sind, nach § 19 Abs. 3 UmwG als bekannt gemacht gilt, ihren Anspruch nach Grund und Höhe schriftlich anmelden, Sicherheit zu leisten, soweit sie nicht Befriedigung verlangen können. Dieses Recht steht den Gläubigern jedoch nur zu, wenn sie glaubhaft machen, dass durch die Verschmelzung die Erfüllung ihrer Forderung gefährdet wird."
    },
    {
      "date": "2024-11-26",
      "original_text": "Sonstige Registerbekanntmachung\nBayern Amtsgericht Bayreuth HRB 8306\nKonrad Friedrichs GmbH – Kulmbach",
      "type": "Sonstige Registerbekanntmachung",
      "state": "Bayern",
      "amtsgericht": "Amtsgericht Bayreuth",
      "registernummer": "HRB 8306",
      "registerart": "HRB",
      "company_name": "Konrad Friedrichs GmbH",
      "company_seat": "Kulmbach",
      "details": "26.11.2024 (Bekanntmachungsdatum)\n\nBayern Amtsgericht Bayreuth HRB 8306\nSonstige Registerbekanntmachung 25.11.2024 (Eintragungsdatum)\n\nKonrad Friedrichs GmbH\nGesellschaft mit beschränkter Haftung\nKulmbach\n\nDen Gläubigern des formwechselnden Rechtsträgers ist, wenn sie binnen sechs Monaten nach dem Tag, an dem die Eintragung des Formwechsels nach § 201 UmwG als bekannt gemacht gilt, ihren Anspruch nach Grund und Höhe schriftlich anmelden, Sicherheit zu leisten, soweit sie nicht Befriedigung verlangen können. Dieses Recht steht den Gläubigern jedoch nur zu, wenn sie glaubhaft machen, dass durch den Formwechsel die Erfüllung ihrer Forderung gefährdet wird."
    },
    {
      "date": "2024-11-26",
      "original_text": "Registerbekanntmachung nach dem Umwandlungsgesetz\nBayern Amtsgericht Bayreuth HRA 2195\nKonrad Friedrichs GmbH & Co. KG – Kulmbach",
      "type": "Registerbekanntmachung nach dem Umwandlungsgesetz",
      "state": "Bayern",
      "amtsgericht": "Amtsgericht Bayreuth",
      "registernummer": "HRA 2195",
      "registerart": "HRA",
      "company_name": "Konrad Friedrichs GmbH & Co. KG",
      "company_seat": "Kulmbach",
      "details": "26.11.2024 (Bekanntmachungsdatum)\n\nBayern Amtsgericht Bayreuth HRA 2195\nRegisterbekanntmachung nach dem Umwandlungsgesetz 25.11.2024 (Eintragungsdatum)\n\nKonrad Friedrichs GmbH & Co. KG\nKommanditgesellschaft\nKulmbach\n\nDen Gläubigern des formwechselnden Rechtsträgers ist, wenn sie binnen sechs Monaten nach dem Tag, an dem die Eintragung des Formwechsels nach § 201 UmwG als bekannt gemacht gilt, ihren Anspruch nach Grund und Höhe schriftlich anmelden, Sicherheit zu leisten, soweit sie nicht Befriedigung verlangen können. Dieses Recht steht den Gläubigern jedoch nur zu, wenn sie glaubhaft machen, dass durch den Formwechsel die Erfüllung ihrer Forderung gefährdet wird."
    },
    {
      "date": "2024-11-26",
      "original_text": "Einreichung neuer Dokumente\nSachsen-Anhalt Amtsgericht Stendal HRB 12153\nKulturwerk MSH gemeinnützige GmbH – Lutherstadt Eisleben",
      "type": "Einreichung neuer Dokumente",
      "state": "Sachsen-Anhalt",
      "amtsgericht": "Amtsgericht Stendal",
      "registernummer": "HRB 12153",
      "registerart": "HRB",
      "company_name": "Kulturwerk MSH gemeinnützige GmbH",
      "company_seat": "Lutherstadt Eisleben",
      "details": "26.11.2024 (Bekanntmachungsdatum)\n\nSachsen-Anhalt Amtsgericht Stendal HRB 12153\nEinreichung neuer Dokumente\n\nKulturwerk MSH gemeinnützige GmbH\nGesellschaft mit beschränkter Haftung\nLutherstadt Eisleben\n\nEine Liste der Mitglieder des Aufsichtsrates wurde zum Handelsregister eingereicht."
    },
    {
      "date": "2024-11-26",
      "original_text": "Löschungsankündigung\nBerlin Amtsgericht Berlin (Charlottenburg) HRB 143802\nKurfood GmbH – Berlin",
      "type": "Löschungsankündigung",
      "state": "Berlin",
      "amtsgericht": "Amtsgericht Berlin (Charlottenburg)",
      "registernummer": "HRB 143802",
      "registerart": "HRB",
      "company_name": "Kurfood GmbH",
      "company_seat": "Berlin",
      "details": "26.11.2024 (Bekanntmachungsdatum)\n\nBerlin Amtsgericht Berlin (Charlottenburg) HRB 143802\nLöschungsankündigung\n\nKurfood GmbH\nGesellschaft mit beschränkter Haftung\nBerlin\n\nBei der nachstehenden Gesellschaft wird das Amtslöschungsverfahren gemäß § 394 FamFG eingeleitet. Widerspruchsfrist 6 Wochen"
    },
    {
      "date": "2024-11-26",
      "original_text": "Einreichung neuer Dokumente\nBaden-Württemberg Amtsgericht Mannheim HRB 707330\nLawo AG – Rastatt",
      "type": "Einreichung neuer Dokumente",
      "state": "Baden-Württemberg",
      "amtsgericht": "Amtsgericht Mannheim",
      "registernummer": "HRB 707330",
      "registerart": "HRB",
      "company_name": "Lawo AG",
      "company_seat": "Rastatt",
      "details": "26.11.2024 (Bekanntmachungsdatum)\n\nBaden-Württemberg Amtsgericht Mannheim HRB 707330\nEinreichung neuer Dokumente\n\nLawo AG\nAktiengesellschaft\nRastatt\n\nDie Gesellschaft hat am 22.11.2024 die Liste über die Zusammensetzung des Aufsichtsrats zum Handelsregister eingereicht."
    },
    {
      "date": "2024-11-26",
      "original_text": "Einreichung neuer Dokumente\nBaden-Württemberg Amtsgericht Mannheim HRB 521919\nLawo Holding AG – Rastatt",
      "type": "Einreichung neuer Dokumente",
      "state": "Baden-Württemberg",
      "amtsgericht": "Amtsgericht Mannheim",
      "registernummer": "HRB 521919",
      "registerart": "HRB",
      "company_name": "Lawo Holding AG",
      "company_seat": "Rastatt",
      "details": "26.11.2024 (Bekanntmachungsdatum)\n\nBaden-Württemberg Amtsgericht Mannheim HRB 521919\nEinreichung neuer Dokumente\n\nLawo Holding AG\nAktiengesellschaft\nRastatt\n\nDie Gesellschaft hat am 22.11.2024 die Liste über die Zusammensetzung des Aufsichtsrats zum Handelsregister eingereicht."
    },
    {
      "date": "2024-11-26",
      "original_text": "Löschungsankündigung\nSachsen Amtsgericht Dresden HRB 32373\nLeinweber Gastro UG (haftungsbeschränkt) – Hoyerswerda",
      "type": "Löschungsankündigung",
      "state": "Sachsen",
      "amtsgericht": "Amtsgericht Dresden",
      "registernummer": "HRB 32373",
      "registerart": "HRB",
      "company_name": "Leinweber Gastro UG (haftungsbeschränkt)",
      "company_seat": "Hoyerswerda",
      "details": "26.11.2024 (Bekanntmachungsdatum)\n\nSachsen Amtsgericht Dresden HRB 32373\nLöschungsankündigung\n\nLeinweber Gastro UG (haftungsbeschränkt)\nGesellschaft mit beschränkter Haftung\nHoyerswerda\n\nDas Registergericht beabsichtigt, die im Handelsregister eingetragene Gesellschaft von Amts wegen nach § 394 FamFG zu löschen. Die Frist zu Erhebung eines Widerspruchs gegen die beabsichtigte Löschung wird auf einen Monat festgesetzt."
    },
    {
      "date": "2024-11-26",
      "original_text": "Löschungsankündigung\nNordrhein-Westfalen Amtsgericht Hagen HRB 10799\nM-GD Performance UG (haftungsbeschränkt) – Schwerte",
      "type": "Löschungsankündigung",
      "state": "Nordrhein-Westfalen",
      "amtsgericht": "Amtsgericht Hagen",
      "registernummer": "HRB 10799",
      "registerart": "HRB",
      "company_name": "M-GD Performance UG (haftungsbeschränkt)",
      "company_seat": "Schwerte",
      "details": "26.11.2024 (Bekanntmachungsdatum)\n\nNordrhein-Westfalen Amtsgericht Hagen HRB 10799\nLöschungsankündigung\n\nM-GD Performance UG (haftungsbeschränkt)\nGesellschaft mit beschränkter Haftung\nSchwerte\n\nDas Registergericht beabsichtigt, die im Handelsregister eingetragene Gesellschaft gemäß § 394 I FamFG wegen Vermögenslosigkeit von Amts wegen zu löschen. Gegen diese Verfügung kann Widerspruch eingelegt werden. Die Frist zur Erhebung eines Widerspruchs gegen die beabsichtigte Löschung von Amts wegen ist auf drei Monate festgesetzt.\n\nRechtsbehelfsbelehrung:\nGegen diese Verfügung können Sie Widerspruch einlegen.\n\nDer Widerspruch ist bei dem Amtsgericht Hagen, Heinitzstraße 42, 58097 Hagen schriftlich in deutscher Sprache oder zur Niederschrift der Geschäftsstelle einzulegen. Der Widerspruch kann auch zur Niederschrift der Geschäftsstelle eines jeden Amtsgerichts abgegeben werden.\n\nDer Widerspruch muss spätestens innerhalb der gesetzten Frist bei dem Amtsgericht Hagen eingegangen sein. Dies gilt auch dann, wenn der Widerspruch zur Geschäftsstelle eines anderen Amtsgerichtes abgegeben wurde. Die Frist beginnt mit der Veröffentlichung. Fällt das Ende der Frist auf einen Sonntag, einen allgemeinen Feiertag oder Sonnabend, so endet die Frist mit Ablauf des nächsten Werktages.\n\nDer Widerspruch muss die Bezeichnung der angefochtenen Verfügung sowie die Erklärung erhalten, dass Widerspruch gegen diese Verfügung eingelegt wird. Er ist zu unterzeichnen und soll begründet werden."
    },
    {
      "date": "2024-11-26",
      "original_text": "Registerbekanntmachung nach dem Umwandlungsgesetz\nBaden-Württemberg Amtsgericht Mannheim HRA 705132\nMAM media and more GmbH & Co. KG – Baden-Baden",
      "type": "Registerbekanntmachung nach dem Umwandlungsgesetz",
      "state": "Baden-Württemberg",
      "amtsgericht": "Amtsgericht Mannheim",
      "registernummer": "HRA 705132",
      "registerart": "HRA",
      "company_name": "MAM media and more GmbH & Co. KG",
      "company_seat": "Baden-Baden",
      "details": "26.11.2024 (Bekanntmachungsdatum)\n\nBaden-Württemberg Amtsgericht Mannheim HRA 705132\nRegisterbekanntmachung nach dem Umwandlungsgesetz 26.11.2024 (Eintragungsdatum)\n\nMAM media and more GmbH & Co. KG\nKommanditgesellschaft\nBaden-Baden\n\nDen Gläubigern der an der Verschmelzung beteiligten Rechtsträger ist, wenn sie binnen sechs Monaten nach dem Tag, an dem die Eintragung der Verschmelzung in das Register des Sitzes desjenigen Rechtsträgers, dessen Gläubiger sie sind, nach § 19 Abs. 3 UmwG als bekanntgemacht gilt, ihren Anspruch nach Grund und Höhe schriftlich anmelden, Sicherheit zu leisten, soweit sie nicht Befriedigung verlangen können. Dieses Recht steht den Gläubigern jedoch nur zu, wenn sie glaubhaft machen, dass durch die Verschmelzung die Erfüllung ihrer Forderung gefährdet wird."
    },
    {
      "date": "2024-11-26",
      "original_text": "Löschungsankündigung\nNordrhein-Westfalen Amtsgericht Köln HRA 33812\nMARCHER LIMITED & CO. KG – Köln",
      "type": "Löschungsankündigung",
      "state": "Nordrhein-Westfalen",
      "amtsgericht": "Amtsgericht Köln",
      "registernummer": "HRA 33812",
      "registerart": "HRA",
      "company_name": "MARCHER LIMITED & CO. KG",
      "company_seat": "Köln",
      "details": "26.11.2024 (Bekanntmachungsdatum)\n\nNordrhein-Westfalen Amtsgericht Köln HRA 33812\nLöschungsankündigung\n\nMARCHER LIMITED & CO. KG\nKommanditgesellschaft\nKöln\n\nDas Registergericht beabsichtigt nachfolgende Firmen von Amts wegen nach § 31 Abs. 2 HGB zu löschen. Die Frist zur Erhebung eines Widerspruchs ist auf 2 Monate festgesetzt."
    },
    {
      "date": "2024-11-26",
      "original_text": "Löschungsankündigung\nBerlin Amtsgericht Berlin (Charlottenburg) HRB 55306\nMITEK Gesellschaft für medizinische Instrumente, Technologie und kommerzielle Beratung mbH – Berlin",
      "type": "Löschungsankündigung",
      "state": "Berlin",
      "amtsgericht": "Amtsgericht Berlin (Charlottenburg)",
      "registernummer": "HRB 55306",
      "registerart": "HRB",
      "company_name": "MITEK Gesellschaft für medizinische Instrumente, Technologie und kommerzielle Beratung mbH",
      "company_seat": "Berlin",
      "details": "26.11.2024 (Bekanntmachungsdatum)\n\nBerlin Amtsgericht Berlin (Charlottenburg) HRB 55306\nLöschungsankündigung\n\nMITEK Gesellschaft für medizinische Instrumente, Technologie und kommerzielle Beratung mbH\nGesellschaft mit beschränkter Haftung\nBerlin\n\nBei der nachstehenden Gesellschaft wird das Amtslöschungsverfahren gemäß § 394 FamFG eingeleitet. Widerspruchsfrist 6 Wochen"
    },
    {
      "date": "2024-11-26",
      "original_text": "Löschungsankündigung\nThüringen Amtsgericht Jena HRB 503919\nMT Metalltechnik UG (haftungsbeschränkt) – Gera",
      "type": "Löschungsankündigung",
      "state": "Thüringen",
      "amtsgericht": "Amtsgericht Jena",
      "registernummer": "HRB 503919",
      "registerart": "HRB",
      "company_name": "MT Metalltechnik UG (haftungsbeschränkt)",
      "company_seat": "Gera",
      "details": "26.11.2024 (Bekanntmachungsdatum)\n\nThüringen Amtsgericht Jena HRB 503919\nLöschungsankündigung\n\nMT Metalltechnik UG (haftungsbeschränkt)\nGesellschaft mit beschränkter Haftung\nGera\n\nDas Registergericht beabsichtigt, die im Handelsregister eingetragene Gesellschaft wegen Vermögenslosigkeit nach § 394 FamFG von Amts wegen zu löschen. Die Frist zur Erhebung eines Widerspruchs gegen die beabsichtigte Löschung wird auf 6 Wochen festgesetzt."
    },
    {
      "date": "2024-11-26",
      "original_text": "Registerbekanntmachung nach dem Umwandlungsgesetz\nNiedersachsen Amtsgericht Osnabrück HRA 209176\nMartin Heitker e.K. – Lingen (Ems)",
      "type": "Registerbekanntmachung nach dem Umwandlungsgesetz",
      "state": "Niedersachsen",
      "amtsgericht": "Amtsgericht Osnabrück",
      "registernummer": "HRA 209176",
      "registerart": "HRA",
      "company_name": "Martin Heitker e.K.",
      "company_seat": "Lingen (Ems)",
      "details": "26.11.2024 (Bekanntmachungsdatum)\n\nNiedersachsen Amtsgericht Osnabrück HRA 209176\nRegisterbekanntmachung nach dem Umwandlungsgesetz 26.11.2024 (Eintragungsdatum)\n\nMartin Heitker e.K.\nEinzelkaufmann / Einzelkauffrau\nLingen (Ems)\n\nDen Gläubigern der an der Ausgliederung beteiligten Rechtsträger ist, wenn sie binnen sechs Monaten nach dem Tag, an dem die Eintragung der Ausgliederung in das Register des Sitzes desjenigen Rechtsträgers, dessen Gläubiger sie sind, nach § 19 Abs. 3 UmwG als bekannt gemacht gilt, ihren Anspruch nach Grund und Höhe schriftlich anmelden, Sicherheit zu leisten, soweit sie nicht Befriedigung verlangen können. Dieses Recht steht den Gläubigern jedoch nur zu, wenn sie glaubhaft machen, dass durch die Ausgliederung die Erfüllung der Forderung gefährdet wird."
    },
    {
      "date": "2024-11-26",
      "original_text": "Löschungsankündigung\nNordrhein-Westfalen Amtsgericht Duisburg HRB 35937\nMax Food GmbH – Dinslaken",
      "type": "Löschungsankündigung",
      "state": "Nordrhein-Westfalen",
      "amtsgericht": "Amtsgericht Duisburg",
      "registernummer": "HRB 35937",
      "registerart": "HRB",
      "company_name": "Max Food GmbH",
      "company_seat": "Dinslaken",
      "details": "26.11.2024 (Bekanntmachungsdatum)\n\nNordrhein-Westfalen Amtsgericht Duisburg HRB 35937\nLöschungsankündigung 26.11.2024 (Eintragungsdatum)\n\nMax Food GmbH\nGesellschaft mit beschränkter Haftung\nDinslaken\n\nHRB 35937:\nMax Food GmbH, Duisburg\nThyssenstr.179, 46535 Dinslaken.\nDas Registergericht beabsichtigt, die im Handelsregister eingetragene Gesellschaft gemäß § 394 FamFG wegen Vermögenslosigkeit von Amts wegen zu löschen. Gegen diese Verfügung kann Widerspruch eingelegt werden. Die Frist zur Erhebung eines Widerspruchs gegen die beabsichtigte Löschung von Amts wegen ist auf drei Monate festgesetzt. Rechtsbehelfsbelehrung Der Widerspruch ist bei dem Amtsgericht Duisburg, Kardinal-Galen-Str. 124-132, 47058 Duisburg schriftlich in deutscher Sprache oder zur Niederschrift der Geschäftsstelle einzulegen. Der Widerspruch kann auch zur Niederschrift der Geschäftsstelle eines jeden Amtsgerichtes abgegeben werden. Die Einlegung ist auch durch Übertragung eines elektronischen Dokuments an die elektronische Poststelle des Gerichts möglich. Das elektronische Dokument muss für die Bearbeitung durch das Gericht geeignet und mit einer qualifizierten elektronischen Signatur der verantwortenden Person versehen sein oder von der verantwortenden Person signiert und auf einem sicheren Übermittlungsweg gemäß § 130 a ZPO nach näherer Maßgabe der Verordnung über die technischen Rahmenbedingungen des elektronischen Rechtsverkehrs und über das besondere elektronische Behördenpostfach (BGBl. I, S. 3803) eingereicht werden. Weitere Informationen erhalten Sie auf der Internetseite www.justiz.de <http://www.justiz.de>. Der Widerspruch muss spätestens innerhalb der gesetzten Frist bei dem Amtsgericht Duisburg eingegangen sein. Dies gilt auch dann, wenn der Widerspruch zur Niederschrift der Geschäftsstelle eines anderen Amtsgerichtes abgegeben wurde. Die Frist beginnt mit der Veröffentlichung. Fällt das Ende der Frist auf einen Sonntag, einen allgemeinen Feiertag oder Sonnabend, so endet die Frist mit Ablauf des nächsten Werktages. Der Widerspruch muss die Bezeichnung der angefochtenen Verfügung sowie die Erklärung enthalten, dass Widerspruch gegen diese Verfügung eingelegt wird. Er ist zu unterzeichnen und soll begründet werden."
    },
    {
      "date": "2024-11-26",
      "original_text": "Löschungsankündigung\nThüringen Amtsgericht Jena HRB 504300\nMichalke Finanzdienste GmbH – Hildburghausen",
      "type": "Löschungsankündigung",
      "state": "Thüringen",
      "amtsgericht": "Amtsgericht Jena",
      "registernummer": "HRB 504300",
      "registerart": "HRB",
      "company_name": "Michalke Finanzdienste GmbH",
      "company_seat": "Hildburghausen",
      "details": "26.11.2024 (Bekanntmachungsdatum)\n\nThüringen Amtsgericht Jena HRB 504300\nLöschungsankündigung\n\nMichalke Finanzdienste GmbH\nGesellschaft mit beschränkter Haftung\nHildburghausen\n\nDas Registergericht beabsichtigt, die im Handelsregister eingetragene Gesellschaft wegen Vermögenslosigkeit nach § 394 FamFG von Amts wegen zu löschen. Die Frist zur Erhebung eines Widerspruchs gegen die beabsichtigte Löschung wird auf 6 Wochen festgesetzt."
    },
    {
      "date": "2024-11-26",
      "original_text": "Löschungsankündigung\nBerlin Amtsgericht Berlin (Charlottenburg) HRB 188540\nMila UG (haftungsbeschränkt) – Berlin",
      "type": "Löschungsankündigung",
      "state": "Berlin",
      "amtsgericht": "Amtsgericht Berlin (Charlottenburg)",
      "registernummer": "HRB 188540",
      "registerart": "HRB",
      "company_name": "Mila UG (haftungsbeschränkt)",
      "company_seat": "Berlin",
      "details": "26.11.2024 (Bekanntmachungsdatum)\n\nBerlin Amtsgericht Berlin (Charlottenburg) HRB 188540\nLöschungsankündigung\n\nMila UG (haftungsbeschränkt)\nGesellschaft mit beschränkter Haftung\nBerlin\n\nBei der nachstehenden Gesellschaft wird das Amtslöschungsverfahren gemäß § 394 FamFG eingeleitet. Widerspruchsfrist 6 Wochen"
    },
    {
      "date": "2024-11-26",
      "original_text": "Löschungsankündigung\nBaden-Württemberg Amtsgericht Stuttgart HRB 741770\nMiss Peppas GmbH – Bietigheim-Bissingen",
      "type": "Löschungsankündigung",
      "state": "Baden-Württemberg",
      "amtsgericht": "Amtsgericht Stuttgart",
      "registernummer": "HRB 741770",
      "registerart": "HRB",
      "company_name": "Miss Peppas GmbH",
      "company_seat": "Bietigheim-Bissingen",
      "details": "26.11.2024 (Bekanntmachungsdatum)\n\nBaden-Württemberg Amtsgericht Stuttgart HRB 741770\nLöschungsankündigung 26.11.2024 (Eintragungsdatum)\n\nMiss Peppas GmbH\nGesellschaft mit beschränkter Haftung\nBietigheim-Bissingen\n\nAls nicht eingetragen wird bekanntgemacht:\nDas Gericht beabsichtigt, die Gesellschaft wegen Vermögenslosigkeit im Handelsregister von Amts wegen nach § 394 FamFG zu löschen. Die Frist zur Geltendmachung eines Widerspruchs gegen die beabsichtigte Löschung ist auf zwei Monate ab Veröffentlichung bestimmt."
    },
    {
      "date": "2024-11-26",
      "original_text": "Löschungsankündigung\nNiedersachsen Amtsgericht Lüneburg HRB 200754\nMosmann Furniere GmbH – Wendisch-Evern",
      "type": "Löschungsankündigung",
      "state": "Niedersachsen",
      "amtsgericht": "Amtsgericht Lüneburg",
      "registernummer": "HRB 200754",
      "registerart": "HRB",
      "company_name": "Mosmann Furniere GmbH",
      "company_seat": "Wendisch-Evern",
      "details": "26.11.2024 (Bekanntmachungsdatum)\n\nNiedersachsen Amtsgericht Lüneburg HRB 200754\nLöschungsankündigung\n\nMosmann Furniere GmbH\nGesellschaft mit beschränkter Haftung\nWendisch-Evern\n\nDas Registergericht beabsichtigt, die Gesellschaft von Amts wegen nach § 394 FamFG zu löschen. Die Frist zur Erhebung eines Widerspruchs ist auf 1 Monat ab dieser Registerbekanntmachung festgesetzt."
    },
    {
      "date": "2024-11-26",
      "original_text": "Registerbekanntmachung nach dem Umwandlungsgesetz\nBayern Amtsgericht Nürnberg HRB 20826\nNEFtv GmbH – Nürnberg",
      "type": "Registerbekanntmachung nach dem Umwandlungsgesetz",
      "state": "Bayern",
      "amtsgericht": "Amtsgericht Nürnberg",
      "registernummer": "HRB 20826",
      "registerart": "HRB",
      "company_name": "NEFtv GmbH",
      "company_seat": "Nürnberg",
      "details": "26.11.2024 (Bekanntmachungsdatum)\n\nBayern Amtsgericht Nürnberg HRB 20826\nRegisterbekanntmachung nach dem Umwandlungsgesetz 25.11.2024 (Eintragungsdatum)\n\nNEFtv GmbH\nGesellschaft mit beschränkter Haftung\nNürnberg\n\nDen Gläubigern der an der Verschmelzung beteiligten Rechtsträger ist, wenn sie binnen sechs Monaten nach dem Tag, an dem die Eintragung der Verschmelzung in das Register des Sitzes desjenigen Rechtsträgers, dessen Gläubiger sie sind, nach § 19 Abs. 3 UmwG als bekannt gemacht gilt, ihren Anspruch nach Grund und Höhe schriftlich anmelden, Sicherheit zu leisten, soweit sie nicht Befriedigung verlangen können. Dieses Recht steht den Gläubigern jedoch nur zu, wenn sie glaubhaft machen, dass durch die Verschmelzung die Erfüllung ihrer Forderung gefährdet wird."
    },
    {
      "date": "2024-11-26",
      "original_text": "Registerbekanntmachung nach dem Umwandlungsgesetz\nSachsen Amtsgericht Dresden HRB 41689\nNFW24 Marketing UG (haftungsbeschränkt) – Dresden",
      "type": "Registerbekanntmachung nach dem Umwandlungsgesetz",
      "state": "Sachsen",
      "amtsgericht": "Amtsgericht Dresden",
      "registernummer": "HRB 41689",
      "registerart": "HRB",
      "company_name": "NFW24 Marketing UG (haftungsbeschränkt)",
      "company_seat": "Dresden",
      "details": "26.11.2024 (Bekanntmachungsdatum)\n\nSachsen Amtsgericht Dresden HRB 41689\nRegisterbekanntmachung nach dem Umwandlungsgesetz 26.11.2024 (Eintragungsdatum)\n\nNFW24 Marketing UG (haftungsbeschränkt)\nGesellschaft mit beschränkter Haftung\nDresden\n\nDen Gläubigern der an der Verschmelzung beteiligten Rechtsträger ist, wenn sie binnen sechs Monaten nach dem Tag, an dem die Eintragung der Verschmelzung in das Register des Sitzes desjenigen Rechtsträgers, dessen Gläubiger sie sind, nach § 19 Abs. 3 UmwG als bekannt gemacht gilt, ihren Anspruch nach Grund und Höhe schriftlich anmelden, Sicherheit zu leisten, soweit sie nicht Befriedigung verlangen können. Dieses Recht steht den Gläubigern jedoch nur zu, wenn sie glaubhaft machen, dass durch die Verschmelzung die Erfüllung der Forderung gefährdet wird."
    },
    {
      "date": "2024-11-26",
      "original_text": "Löschungsankündigung\nBayern Amtsgericht Fürth HRB 14699\nNantosuelta - Produktions- und Beteiligungs UG (haftungsbeschränkt) – Fürth",
      "type": "Löschungsankündigung",
      "state": "Bayern",
      "amtsgericht": "Amtsgericht Fürth",
      "registernummer": "HRB 14699",
      "registerart": "HRB",
      "company_name": "Nantosuelta - Produktions- und Beteiligungs UG (haftungsbeschränkt)",
      "company_seat": "Fürth",
      "details": "26.11.2024 (Bekanntmachungsdatum)\n\nBayern Amtsgericht Fürth HRB 14699\nLöschungsankündigung\n\nNantosuelta - Produktions- und Beteiligungs UG (haftungsbeschränkt)\nGesellschaft mit beschränkter Haftung\nFürth\n\nDas Registergericht beabsichtigt, die im Handelsregister eingetragene Gesellschaft wegen Vermögenslosigkeit von Amts wegen nach § 394 FamFG zu löschen. Die Frist zur Erhebung eines Widerspruchs ist auf drei Monate festgesetzt."
    },
    {
      "date": "2024-11-26",
      "original_text": "Löschungsankündigung\nHessen Amtsgericht Offenbach am Main HRB 52763\nNavi Bau GmbH – Offenbach am Main",
      "type": "Löschungsankündigung",
      "state": "Hessen",
      "amtsgericht": "Amtsgericht Offenbach am Main",
      "registernummer": "HRB 52763",
      "registerart": "HRB",
      "company_name": "Navi Bau GmbH",
      "company_seat": "Offenbach am Main",
      "details": "26.11.2024 (Bekanntmachungsdatum)\n\nHessen Amtsgericht Offenbach am Main HRB 52763\nLöschungsankündigung\n\nNavi Bau GmbH\nGesellschaft mit beschränkter Haftung\nOffenbach am Main\n\nEs ist beabsichtigt, die Geschäftsführerin Yildirim, Tugba von Amts wegen im Handelsregister zu löschen, nachdem ihre Eignung gemäß § 6 Abs. 2 Ziffer 3 GmbHG aufgrund Untersagung jeder selbstständigen gewerblichen Tätigkeit sowie auf die Tätigkeit als Vertretungsberechtigter eines Gewerbetreibenden oder als mit der Leitung eines Gewerbebetriebs beaufragte Person weggefallen ist. Wern an der Unterlassung der Löschung ein berechtigtes Interesse hat, kann innerhalb eines Monats ab Bekanntmachung Widerspruch beim Amtsgericht Offenbach am Main einlegen."
    },
    {
      "date": "2024-11-26",
      "original_text": "Registerbekanntmachung nach dem Umwandlungsgesetz\nSaarland Amtsgericht Saarbrücken HRA 13502\nObjekt Ensdorf-Aschersleben GmbH & Co. KG – Saarbrücken",
      "type": "Registerbekanntmachung nach dem Umwandlungsgesetz",
      "state": "Saarland",
      "amtsgericht": "Amtsgericht Saarbrücken",
      "registernummer": "HRA 13502",
      "registerart": "HRA",
      "company_name": "Objekt Ensdorf-Aschersleben GmbH & Co. KG",
      "company_seat": "Saarbrücken",
      "details": "26.11.2024 (Bekanntmachungsdatum)\n\nSaarland Amtsgericht Saarbrücken HRA 13502\nRegisterbekanntmachung nach dem Umwandlungsgesetz 26.11.2024 (Eintragungsdatum)\n\nObjekt Ensdorf-Aschersleben GmbH & Co. KG\nKommanditgesellschaft\nSaarbrücken\n\nAls nicht eingetragen wird bekannt gemacht: Den Gläubigern der an der Verschmelzung beteiligten Gesellschaften ist, wenn sie binnen sechs Monaten nach dem Tag, an dem die Eintragung der Verschmelzung in das Register des Sitzes desjenigen Rechtsträgers, dessen Gläubiger sie sind, nach § 19 Absatz 3 UmwG bekannt gemacht worden ist, ihren Anspruch nach Grund und Höhe schriftlich anmelden, Sicherheit zu leisten, soweit sie nicht Befriedigung verlangen können. Dieses Recht steht den Gläubigern jedoch nur zu, wenn sie glaubhaft machen, dass durch die Verschmelzung die Erfüllung ihrer Forderung gefährdet wird."
    },
    {
      "date": "2024-11-26",
      "original_text": "Registerbekanntmachung nach dem Umwandlungsgesetz\nSaarland Amtsgericht Saarbrücken HRA 13450\nObjekt Staufenberg Vor der Hecke 2 GmbH & Co. KG – Saarbrücken",
      "type": "Registerbekanntmachung nach dem Umwandlungsgesetz",
      "state": "Saarland",
      "amtsgericht": "Amtsgericht Saarbrücken",
      "registernummer": "HRA 13450",
      "registerart": "HRA",
      "company_name": "Objekt Staufenberg Vor der Hecke 2 GmbH & Co. KG",
      "company_seat": "Saarbrücken",
      "details": "26.11.2024 (Bekanntmachungsdatum)\n\nSaarland Amtsgericht Saarbrücken HRA 13450\nRegisterbekanntmachung nach dem Umwandlungsgesetz 26.11.2024 (Eintragungsdatum)\n\nObjekt Staufenberg Vor der Hecke 2 GmbH & Co. KG\nKommanditgesellschaft\nSaarbrücken\n\nAls nicht eingetragen wird bekannt gemacht: Den Gläubigern der an der Verschmelzung beteiligten Gesellschaften ist, wenn sie binnen sechs Monaten nach dem Tag, an dem die Eintragung der Verschmelzung in das Register des Sitzes desjenigen Rechtsträgers, dessen Gläubiger sie sind, nach § 19 Absatz 3 UmwG bekannt gemacht worden ist, ihren Anspruch nach Grund und Höhe schriftlich anmelden, Sicherheit zu leisten, soweit sie nicht Befriedigung verlangen können. Dieses Recht steht den Gläubigern jedoch nur zu, wenn sie glaubhaft machen, dass durch die Verschmelzung die Erfüllung ihrer Forderung gefährdet wird."
    },
    {
      "date": "2024-11-26",
      "original_text": "Registerbekanntmachung nach dem Umwandlungsgesetz\nNordrhein-Westfalen Amtsgericht Siegen HRB 10918\nOehmetic Werkzeugbau GmbH – Wilnsdorf",
      "type": "Registerbekanntmachung nach dem Umwandlungsgesetz",
      "state": "Nordrhein-Westfalen",
      "amtsgericht": "Amtsgericht Siegen",
      "registernummer": "HRB 10918",
      "registerart": "HRB",
      "company_name": "Oehmetic Werkzeugbau GmbH",
      "company_seat": "Wilnsdorf",
      "details": "26.11.2024 (Bekanntmachungsdatum)\n\nNordrhein-Westfalen Amtsgericht Siegen HRB 10918\nRegisterbekanntmachung nach dem Umwandlungsgesetz 26.11.2024 (Eintragungsdatum)\n\nOehmetic Werkzeugbau GmbH\nGesellschaft mit beschränkter Haftung\nWilnsdorf\n\nDen Gläubigern der an der Verschmelzung beteiligten Rechtsträger ist, wenn sie binnen sechs Monaten nach dem Tag, an dem die Eintragung der Verschmelzung in das Register des Sitzes desjenigen Rechtsträgers, dessen Gläubiger sie sind, nach § 19 Absatz 3 UmwG als bekanntgemacht gilt, ihren Anspruch nach Grund und Höhe schriftlich anmelden, Sicherheit zu leisten, soweit sie nicht Befriedigung verlangen können. Dieses Recht steht den Gläubigern jedoch nur zu, wenn sie glaubhaft machen, dass durch die Verschmelzung die Erfüllung ihrer Forderung gefährdet wird."
    },
    {
      "date": "2024-11-26",
      "original_text": "Löschungsankündigung\nBerlin Amtsgericht Berlin (Charlottenburg) HRB 177874\nOffizin Projekt Teterow GmbH – Berlin",
      "type": "Löschungsankündigung",
      "state": "Berlin",
      "amtsgericht": "Amtsgericht Berlin (Charlottenburg)",
      "registernummer": "HRB 177874",
      "registerart": "HRB",
      "company_name": "Offizin Projekt Teterow GmbH",
      "company_seat": "Berlin",
      "details": "26.11.2024 (Bekanntmachungsdatum)\n\nBerlin Amtsgericht Berlin (Charlottenburg) HRB 177874\nLöschungsankündigung\n\nOffizin Projekt Teterow GmbH\nGesellschaft mit beschränkter Haftung\nBerlin\n\nBei der nachstehenden Gesellschaft wird das Amtslöschungsverfahren gemäß § 394 FamFG eingeleitet. Widerspruchsfrist 6 Wochen"
    },
    {
      "date": "2024-11-26",
      "original_text": "Sonstige Registerbekanntmachung\nBaden-Württemberg Amtsgericht Mannheim HRB 503750\nOtto Hutt GmbH – Königsbach-Stein",
      "type": "Sonstige Registerbekanntmachung",
      "state": "Baden-Württemberg",
      "amtsgericht": "Amtsgericht Mannheim",
      "registernummer": "HRB 503750",
      "registerart": "HRB",
      "company_name": "Otto Hutt GmbH",
      "company_seat": "Königsbach-Stein",
      "details": "26.11.2024 (Bekanntmachungsdatum)\n\nBaden-Württemberg Amtsgericht Mannheim HRB 503750\nSonstige Registerbekanntmachung 26.11.2024 (Eintragungsdatum)\n\nOtto Hutt GmbH\nGesellschaft mit beschränkter Haftung\nKönigsbach-Stein\n\nDen Gläubigern der Gesellschaft, deren Forderungen begründet worden sind, bevor die Eintragung der Beendigung des Vertrages in das Handelsregister nach § 10 HGB als bekanntgemacht gilt, ist vom anderen Vertragsteil Sicherheit zu leisten, wenn sie sich binnen sechs Monaten nach der Bekanntmachung zu diesem Zweck bei ihm melden."
    },
    {
      "date": "2024-11-26",
      "original_text": "Registerbekanntmachung nach dem Umwandlungsgesetz\nBerlin Amtsgericht Berlin (Charlottenburg) HRB 252639\nPF Portfolios Finanz GmbH – Berlin",
      "type": "Registerbekanntmachung nach dem Umwandlungsgesetz",
      "state": "Berlin",
      "amtsgericht": "Amtsgericht Berlin (Charlottenburg)",
      "registernummer": "HRB 252639",
      "registerart": "HRB",
      "company_name": "PF Portfolios Finanz GmbH",
      "company_seat": "Berlin",
      "details": "26.11.2024 (Bekanntmachungsdatum)\n\nBerlin Amtsgericht Berlin (Charlottenburg) HRB 252639\nRegisterbekanntmachung nach dem Umwandlungsgesetz 25.11.2024 (Eintragungsdatum)\n\nPF Portfolios Finanz GmbH\nGesellschaft mit beschränkter Haftung\nBerlin\n\nZu Eintragungsnummer 2 vom 25.11.2024 wird als nicht eingetragen veröffentlicht: Den Gläubigern ist, wenn sie binnen sechs Monaten nach dem Tag, an dem die Eintragung der Umwandlung als bekannt gemacht gilt, ihren Anspruch nach Grund und Höhe schriftlich anmelden, Sicherheit zu leisten, soweit sie nicht Befriedigung verlangen können. Dieses Recht steht den Gläubigern jedoch nur zu, wenn sie glaubhaft machen, dass durch die Umwandlung die Erfüllung ihrer Forderung gefährdet wird. Das Recht, Sicherheitsleistung zu verlangen, steht Gläubigern nicht zu, die im Falle der Insolvenz ein Recht auf vorzugsweise Befriedigung aus einer Deckungsmasse haben, die nach gesetzlicher Vorschrift zu ihrem Schutz errichtet und staatlich überwacht ist."
    },
    {
      "date": "2024-11-26",
      "original_text": "Löschungsankündigung\nNiedersachsen Amtsgericht Osnabrück HRA 206671\nPMD GmbH & Co KG – Quakenbrück",
      "type": "Löschungsankündigung",
      "state": "Niedersachsen",
      "amtsgericht": "Amtsgericht Osnabrück",
      "registernummer": "HRA 206671",
      "registerart": "HRA",
      "company_name": "PMD GmbH & Co KG",
      "company_seat": "Quakenbrück",
      "details": "26.11.2024 (Bekanntmachungsdatum)\n\nNiedersachsen Amtsgericht Osnabrück HRA 206671\nLöschungsankündigung\n\nPMD GmbH & Co KG\nKommanditgesellschaft\nQuakenbrück\n\nDas Registergericht beabsichtigt, die Firma von Amts wegen nach § 394 FamFG wegen Vermögenslosigkeit zu löschen. Die Frist zur Erhebung eines Widerspruchs ist auf 1 Monat ab dieser Registerbekanntmachung festgesetzt."
    },
    {
      "date": "2024-11-26",
      "original_text": "Registerbekanntmachung nach dem Umwandlungsgesetz\nBayern Amtsgericht München HRB 234802\nPP Silvretta TopCo GmbH – München",
      "type": "Registerbekanntmachung nach dem Umwandlungsgesetz",
      "state": "Bayern",
      "amtsgericht": "Amtsgericht München",
      "registernummer": "HRB 234802",
      "registerart": "HRB",
      "company_name": "PP Silvretta TopCo GmbH",
      "company_seat": "München",
      "details": "26.11.2024 (Bekanntmachungsdatum)\n\nBayern Amtsgericht München HRB 234802\nRegisterbekanntmachung nach dem Umwandlungsgesetz\n\nPP Silvretta TopCo GmbH\nGesellschaft mit beschränkter Haftung\nMünchen\n\nEs wird darauf hingewiesen, dass ein Verschmelzungsplan oder sein Entwurf über eine grenzüberschreitende Verschmelzung zur Aufnahme mit der Swiss Life Gloria S.à.r.l. mit Sitz in 4a, rue Albert Borschette, L-1246 Luxemburg/Luxemburg (Registre de commerce et des sociétés B286083) (société à responsabilité limitée - Gesellschaft mit beschränkter Haftung nach luxemburgischem Recht) als übernehmende Rechtsträgerin beim Handelsregister eingereicht worden ist.\nDie Anteilsinhaber, die Gläubiger sowie die zuständigen Betriebsräte der an der grenzüberschreitenden Verschmelzung beteiligten Gesellschaften oder, soweit es keinen Betriebsrat gibt, die Arbeitnehmer der an der grenzüberschreitenden Verschmelzung beteiligten Gesellschaften, können der jeweiligen Gesellschaft spätestens fünf Arbeitstage vor dem Tag der Gesellschafterversammlung Bemerkungen zum Verschmelzungsplan übermitteln."
    },
    {
      "date": "2024-11-26",
      "original_text": "Registerbekanntmachung nach dem Umwandlungsgesetz\nBaden-Württemberg Amtsgericht Stuttgart HRA 729432\nParkhotel Neckarsulm GmbH & Co. KG – Neckarsulm",
      "type": "Registerbekanntmachung nach dem Umwandlungsgesetz",
      "state": "Baden-Württemberg",
      "amtsgericht": "Amtsgericht Stuttgart",
      "registernummer": "HRA 729432",
      "registerart": "HRA",
      "company_name": "Parkhotel Neckarsulm GmbH & Co. KG",
      "company_seat": "Neckarsulm",
      "details": "26.11.2024 (Bekanntmachungsdatum)\n\nBaden-Württemberg Amtsgericht Stuttgart HRA 729432\nRegisterbekanntmachung nach dem Umwandlungsgesetz 26.11.2024 (Eintragungsdatum)\n\nParkhotel Neckarsulm GmbH & Co. KG\nKommanditgesellschaft\nNeckarsulm\n\n#DV.Auswahl(Text=\"Bitte wählen Sie aus:\",\tEingabe=\n\"#insert(Text=\"VOE_Allgemein\")\"|\"Als nicht eingetragen wird bekanntgemacht:\",\n\"#insert(Text=\"VOE_Aufhebung_UV\")\"|\"Aufhebung Unternehmensvertrag\",\n\"#insert(Text=\"VOE_Formwechsel\")\"|\"Formwechsel\",\n\"#insert(Text=\"VOE_Verschmelzung\")\"|\"Verschmelzung\",\n\"#insert(Text=\"VOE_Abspaltung\")\"|\"Abspaltung\",\n\"#insert(Text=\"VOE_Ausgliederung\")\"|\"Ausgliederung\",\n\"#insert(Text=\"Loeschungsankündigung_HR_394\")\"|\"Löschungsankündigung\")"
    },
    {
      "date": "2024-11-26",
      "original_text": "Registerbekanntmachung nach dem Umwandlungsgesetz\nNordrhein-Westfalen Amtsgericht Düsseldorf HRB 75806\nPasing Arcaden GmbH – Düsseldorf",
      "type": "Registerbekanntmachung nach dem Umwandlungsgesetz",
      "state": "Nordrhein-Westfalen",
      "amtsgericht": "Amtsgericht Düsseldorf",
      "registernummer": "HRB 75806",
      "registerart": "HRB",
      "company_name": "Pasing Arcaden GmbH",
      "company_seat": "Düsseldorf",
      "details": "26.11.2024 (Bekanntmachungsdatum)\n\nNordrhein-Westfalen Amtsgericht Düsseldorf HRB 75806\nRegisterbekanntmachung nach dem Umwandlungsgesetz 26.11.2024 (Eintragungsdatum)\n\nPasing Arcaden GmbH\nGesellschaft mit beschränkter Haftung\nDüsseldorf\n\nDen Gläubigern der an der formwechselnden Umwandlung beteiligten Rechtsträger ist, wenn sie binnen sechs Monaten nach dem Tag, an dem die Eintragung der formwechselnden Umwandlung in das Register des Sitzes desjenigen Rechtsträgers, dessen Gläubiger sie sind, nach § 19 Absatz 3 UmwG als bekanntgemacht gilt, ihren Anspruch nach Grund und Höhe schriftlich anmelden, Sicherheit zu leisten, soweit sie nicht Befriedigung verlangen können. Dieses Recht steht den Gläubigern jedoch nur zu, wenn sie glaubhaft machen, dass durch die formwechselnden Umwandlung die Erfüllung ihrer Forderung gefährdet wird."
    },
    {
      "date": "2024-11-26",
      "original_text": "Löschungsankündigung\nBerlin Amtsgericht Berlin (Charlottenburg) HRB 147218\nPeerage Unternehmergesellschaft (haftungsbeschränkt) – Berlin",
      "type": "Löschungsankündigung",
      "state": "Berlin",
      "amtsgericht": "Amtsgericht Berlin (Charlottenburg)",
      "registernummer": "HRB 147218",
      "registerart": "HRB",
      "company_name": "Peerage Unternehmergesellschaft (haftungsbeschränkt)",
      "company_seat": "Berlin",
      "details": "26.11.2024 (Bekanntmachungsdatum)\n\nBerlin Amtsgericht Berlin (Charlottenburg) HRB 147218\nLöschungsankündigung\n\nPeerage Unternehmergesellschaft (haftungsbeschränkt)\nGesellschaft mit beschränkter Haftung\nBerlin\n\nBei der nachstehenden Gesellschaft wird das Amtslöschungsverfahren gemäß § 394 FamFG eingeleitet. Widerspruchsfrist 6 Wochen"
    },
    {
      "date": "2024-11-26",
      "original_text": "Löschungsankündigung\nHamburg Amtsgericht Hamburg HRA 112850\nPetit Muës Feinkosthandel e.K. – Hamburg",
      "type": "Löschungsankündigung",
      "state": "Hamburg",
      "amtsgericht": "Amtsgericht Hamburg",
      "registernummer": "HRA 112850",
      "registerart": "HRA",
      "company_name": "Petit Muës Feinkosthandel e.K.",
      "company_seat": "Hamburg",
      "details": "26.11.2024 (Bekanntmachungsdatum)\n\nHamburg Amtsgericht Hamburg HRA 112850\nLöschungsankündigung\n\nPetit Muës Feinkosthandel e.K.\nEinzelkaufmann\nHamburg\n\nDas Registergericht beabsichtigt, die im Handelsregister eingetragene Firma von Amts wegen nach § 31 Abs. 2 HGB zu löschen. Die Frist zur Erhebung eines Widerspruchs gegen die beabsichtigte Löschung wird auf 3 Monate festgesetzt."
    },
    {
      "date": "2024-11-26",
      "original_text": "Löschungsankündigung\nRheinland-Pfalz Amtsgericht Ludwigshafen a.Rhein (Ludwigshafen) HRB 64676\nPhönix Enterprises UG (haftungsbeschränkt) – Speyer",
      "type": "Löschungsankündigung",
      "state": "Rheinland-Pfalz",
      "amtsgericht": "Amtsgericht Ludwigshafen a.Rhein (Ludwigshafen)",
      "registernummer": "HRB 64676",
      "registerart": "HRB",
      "company_name": "Phönix Enterprises UG (haftungsbeschränkt)",
      "company_seat": "Speyer",
      "details": "26.11.2024 (Bekanntmachungsdatum)\n\nRheinland-Pfalz Amtsgericht Ludwigshafen a.Rhein (Ludwigshafen) HRB 64676\nLöschungsankündigung\n\nPhönix Enterprises UG (haftungsbeschränkt)\nGesellschaft mit beschränkter Haftung\nSpeyer\n\nDas Registergericht beabsichtigt die Gesellschaft von Amts wegen nach § 394 FamFG zu löschen. Die Frist zur Erhebung eines Widerspruchs ist auf einen Monat festgesetzt."
    },
    {
      "date": "2024-11-26",
      "original_text": "Einreichung neuer Dokumente\nRheinland-Pfalz Amtsgericht Kaiserslautern HRB 4103\nProCampus GmbH – Kaiserslautern",
      "type": "Einreichung neuer Dokumente",
      "state": "Rheinland-Pfalz",
      "amtsgericht": "Amtsgericht Kaiserslautern",
      "registernummer": "HRB 4103",
      "registerart": "HRB",
      "company_name": "ProCampus GmbH",
      "company_seat": "Kaiserslautern",
      "details": "26.11.2024 (Bekanntmachungsdatum)\n\nRheinland-Pfalz Amtsgericht Kaiserslautern HRB 4103\nEinreichung neuer Dokumente\n\nProCampus GmbH\nGesellschaft mit beschränkter Haftung\nKaiserslautern\n\nDem Registergericht ist eine Liste der Mitglieder des Aufsichtsrates eingereicht worden."
    },
    {
      "date": "2024-11-26",
      "original_text": "Registerbekanntmachung nach dem Umwandlungsgesetz\nBaden-Württemberg Amtsgericht Stuttgart HRB 796650\nREGALWERK GmbH – Korntal-Münchingen",
      "type": "Registerbekanntmachung nach dem Umwandlungsgesetz",
      "state": "Baden-Württemberg",
      "amtsgericht": "Amtsgericht Stuttgart",
      "registernummer": "HRB 796650",
      "registerart": "HRB",
      "company_name": "REGALWERK GmbH",
      "company_seat": "Korntal-Münchingen",
      "details": "26.11.2024 (Bekanntmachungsdatum)\n\nBaden-Württemberg Amtsgericht Stuttgart HRB 796650\nRegisterbekanntmachung nach dem Umwandlungsgesetz 26.11.2024 (Eintragungsdatum)\n\nREGALWERK GmbH\nGesellschaft mit beschränkter Haftung\nKorntal-Münchingen\n\nAls nicht eingetragen wird bekanntgemacht:\nDen Gläubigern der an der Ausgliederung beteiligten Rechtsträger ist, wenn sie binnen sechs Monaten nach dem Tag, an dem die Eintragung der Ausgliederung in das Register des Sitzes desjenigen Rechtsträgers, dessen Gläubiger sie sind, nach § 19 Abs. 3 UmwG als bekanntgemacht gilt, ihren Anspruch nach Grund und Höhe schriftlich anmelden, Sicherheit zu leisten, soweit sie nicht Befriedigung verlangen können. Dieses Recht steht den Gläubigern jedoch nur zu, wenn sie glaubhaft machen, dass durch die Ausgliederung die Erfüllung ihrer Forderung gefährdet wird."
    },
    {
      "date": "2024-11-26",
      "original_text": "Registerbekanntmachung nach dem Umwandlungsgesetz\nSchleswig-Holstein Amtsgericht Pinneberg HRB 16162\nRH Freizeit und Rätseltouren UG (haftungsbeschränkt) – Nordhastedt",
      "type": "Registerbekanntmachung nach dem Umwandlungsgesetz",
      "state": "Schleswig-Holstein",
      "amtsgericht": "Amtsgericht Pinneberg",
      "registernummer": "HRB 16162",
      "registerart": "HRB",
      "company_name": "RH Freizeit und Rätseltouren UG (haftungsbeschränkt)",
      "company_seat": "Nordhastedt",
      "details": "26.11.2024 (Bekanntmachungsdatum)\n\nSchleswig-Holstein Amtsgericht Pinneberg HRB 16162\nRegisterbekanntmachung nach dem Umwandlungsgesetz 26.11.2024 (Eintragungsdatum)\n\nRH Freizeit und Rätseltouren UG (haftungsbeschränkt)\nGesellschaft mit beschränkter Haftung\nNordhastedt\n\nZu Eintragungsnummer 3 vom 26.11.2024 wird als nicht eingetragen veröffentlicht:  Als nicht eingetragen wird veröffentlicht: Den Gläubigern der an der Verschmelzung beteiligten Rechtsträger ist, wenn sie binnen sechs Monaten nach dem Tag, an dem die Eintragung der Verschmelzung in das Register des Sitzes desjenigen Rechtsträgers, dessen Gläubiger sie sind, als bekannt gemacht gilt, ihren Anspruch nach Grund und Höhe schriftlich anmelden, Sicherheit zu leisten, soweit sie nicht Befriedigung verlangen können. Dieses Recht steht den Gläubigern jedoch nur zu, wenn sie glaubhaft machen, dass durch die Verschmelzung die Erfüllung ihrer Forderung gefährdet wird. Das Recht, Sicherheitsleistung zu verlangen, steht Gläubigern nicht zu, die im Falle der Insolvenz ein Recht auf vorzugsweise Befriedigung aus einer Deckungsmasse haben, die nach gesetzlicher Vorschrift zu ihrem Schutz errichtet und staatlich überwacht ist."
    },
    {
      "date": "2024-11-26",
      "original_text": "Registerbekanntmachung nach dem Umwandlungsgesetz\nBaden-Württemberg Amtsgericht Stuttgart HRA 203114\nRegalwerk e.K. – Korntal-Münchingen",
      "type": "Registerbekanntmachung nach dem Umwandlungsgesetz",
      "state": "Baden-Württemberg",
      "amtsgericht": "Amtsgericht Stuttgart",
      "registernummer": "HRA 203114",
      "registerart": "HRA",
      "company_name": "Regalwerk e.K.",
      "company_seat": "Korntal-Münchingen",
      "details": "26.11.2024 (Bekanntmachungsdatum)\n\nBaden-Württemberg Amtsgericht Stuttgart HRA 203114\nRegisterbekanntmachung nach dem Umwandlungsgesetz 26.11.2024 (Eintragungsdatum)\n\nRegalwerk e.K.\nEinzelkaufmann / Einzelkauffrau\nKorntal-Münchingen\n\nAls nicht eingetragen wird bekanntgemacht:\nDen Gläubigern der an der Ausgliederung beteiligten Rechtsträger ist, wenn sie binnen sechs Monaten nach dem Tag, an dem die Eintragung der Ausgliederung in das Register des Sitzes desjenigen Rechtsträgers, dessen Gläubiger sie sind, nach § 19 Abs. 3 UmwG als bekanntgemacht gilt, ihren Anspruch nach Grund und Höhe schriftlich anmelden, Sicherheit zu leisten, soweit sie nicht Befriedigung verlangen können. Dieses Recht steht den Gläubigern jedoch nur zu, wenn sie glaubhaft machen, dass durch die Ausgliederung die Erfüllung ihrer Forderung gefährdet wird."
    },
    {
      "date": "2024-11-26",
      "original_text": "Registerbekanntmachung nach dem Umwandlungsgesetz\nBaden-Württemberg Amtsgericht Freiburg HRB 411902\nS & R Versicherungs-Vermittlungs GmbH – Rheinfelden Baden",
      "type": "Registerbekanntmachung nach dem Umwandlungsgesetz",
      "state": "Baden-Württemberg",
      "amtsgericht": "Amtsgericht Freiburg",
      "registernummer": "HRB 411902",
      "registerart": "HRB",
      "company_name": "S & R Versicherungs-Vermittlungs GmbH",
      "company_seat": "Rheinfelden Baden",
      "details": "26.11.2024 (Bekanntmachungsdatum)\n\nBaden-Württemberg Amtsgericht Freiburg HRB 411902\nRegisterbekanntmachung nach dem Umwandlungsgesetz 26.11.2024 (Eintragungsdatum)\n\nS & R Versicherungs-Vermittlungs GmbH\nGesellschaft mit beschränkter Haftung\nRheinfelden Baden\n\nDen Gläubigern der an der Verschmelzung beteiligten Rechtsträger ist, wenn sie binnen sechs Monaten nach dem Tag, an dem die Eintragung der Verschmelzung in das Register des Sitzes desjenigen Rechtsträgers, dessen Gläubiger sie sind, nach § 19 Abs. 3 UmwG als bekanntgemacht gilt, ihren Anspruch nach Grund und Höhe schriftlich anmelden, Sicherheit zu leisten, soweit sie nicht Befriedigung verlangen können. Dieses Recht steht den Gläubigern jedoch nur zu, wenn sie glaubhaft machen, dass durch die Verschmelzung die Erfüllung ihrer Forderung gefährdet wird."
    },
    {
      "date": "2024-11-26",
      "original_text": "Löschungsankündigung\nNiedersachsen Amtsgericht Osnabrück HRB 218114\nSEL - BAU GmbH – Osnabrück",
      "type": "Löschungsankündigung",
      "state": "Niedersachsen",
      "amtsgericht": "Amtsgericht Osnabrück",
      "registernummer": "HRB 218114",
      "registerart": "HRB",
      "company_name": "SEL - BAU GmbH",
      "company_seat": "Osnabrück",
      "details": "26.11.2024 (Bekanntmachungsdatum)\n\nNiedersachsen Amtsgericht Osnabrück HRB 218114\nLöschungsankündigung 26.11.2024 (Eintragungsdatum)\n\nSEL - BAU GmbH\nGesellschaft mit beschränkter Haftung\nOsnabrück\n\nDas Registergericht beabsichtigt, die Gesellschaft von Amts wegen nach § 394 FamFG wegen Vermögenslosigkeit zu löschen. Die Frist zur Erhebung eines Widerspruchs ist auf 1 Monat ab dieser Registerbekanntmachung festgesetzt."
    },
    {
      "date": "2024-11-26",
      "original_text": "Einreichung neuer Dokumente\nBayern Amtsgericht Kempten (Allgäu) HRB 1024\nSOZIAL-WIRTSCHAFTS-WERK des Landkreises Oberallgäu Wohnungsbau-Gesellschaft mit beschränkter Haftung – Sonthofen",
      "type": "Einreichung neuer Dokumente",
      "state": "Bayern",
      "amtsgericht": "Amtsgericht Kempten (Allgäu)",
      "registernummer": "HRB 1024",
      "registerart": "HRB",
      "company_name": "SOZIAL-WIRTSCHAFTS-WERK des Landkreises Oberallgäu Wohnungsbau-Gesellschaft mit beschränkter Haftung",
      "company_seat": "Sonthofen",
      "details": "26.11.2024 (Bekanntmachungsdatum)\n\nBayern Amtsgericht Kempten (Allgäu) HRB 1024\nEinreichung neuer Dokumente 25.11.2024 (Eintragungsdatum)\n\nSOZIAL-WIRTSCHAFTS-WERK des Landkreises Oberallgäu Wohnungsbau-Gesellschaft mit beschränkter Haftung\nGesellschaft mit beschränkter Haftung\nSonthofen\n\nDem Amtsgericht Kempten (Allgäu) -Registergericht- ist eine Liste der Mitglieder des Aufsichtsrats eingereicht worden, § 52 Abs. 3 S. 2 GmbHG."
    },
    {
      "date": "2024-11-26",
      "original_text": "Löschungsankündigung\nHessen Amtsgericht Frankfurt am Main HRB 111554\nSPOBI GmbH – Frankfurt am Main",
      "type": "Löschungsankündigung",
      "state": "Hessen",
      "amtsgericht": "Amtsgericht Frankfurt am Main",
      "registernummer": "HRB 111554",
      "registerart": "HRB",
      "company_name": "SPOBI GmbH",
      "company_seat": "Frankfurt am Main",
      "details": "26.11.2024 (Bekanntmachungsdatum)\n\nHessen Amtsgericht Frankfurt am Main HRB 111554\nLöschungsankündigung\n\nSPOBI GmbH\nGesellschaft mit beschränkter Haftung\nFrankfurt am Main\n\nEs ist beabsichtigt, die Gesellschaft wegen Vermögenslosigkeit gemäß § 394 FamFG von Amts wegen im Handelsregister zu löschen. Hiergegen kann innerhalb eines Monats nach dieser Veröffentlichung Widerspruch bei dem Amtsgericht Frankfurt am Main eingelegt werden."
    },
    {
      "date": "2024-11-26",
      "original_text": "Registerbekanntmachung nach dem Umwandlungsgesetz\nNordrhein-Westfalen Amtsgericht Lemgo HRB 11316\nSadurski Erdwärme GmbH – Leopoldshöhe",
      "type": "Registerbekanntmachung nach dem Umwandlungsgesetz",
      "state": "Nordrhein-Westfalen",
      "amtsgericht": "Amtsgericht Lemgo",
      "registernummer": "HRB 11316",
      "registerart": "HRB",
      "company_name": "Sadurski Erdwärme GmbH",
      "company_seat": "Leopoldshöhe",
      "details": "26.11.2024 (Bekanntmachungsdatum)\n\nNordrhein-Westfalen Amtsgericht Lemgo HRB 11316\nRegisterbekanntmachung nach dem Umwandlungsgesetz 26.11.2024 (Eintragungsdatum)\n\nSadurski Erdwärme GmbH\nGesellschaft mit beschränkter Haftung\nLeopoldshöhe\n\nDen Gläubigern der an der Verschmelzung beteiligten Rechtsträger ist, wenn sie binnen sechs Monaten nach dem Tag, an dem die Eintragung der Verschmelzung in das Register des Sitzes desjenigen Rechtsträgers, dessen Gläubiger sie sind, nach § 19 Absatz 3 UmwG als bekanntgemacht gilt, ihren Anspruch nach Grund und Höhe schriftlich anmelden, Sicherheit zu leisten, soweit sie nicht Befriedigung verlangen können. Dieses Recht steht den Gläubigern jedoch nur zu, wenn sie glaubhaft machen, dass durch die Verschmelzung die Erfüllung ihrer Forderung gefährdet wird."
    },
    {
      "date": "2024-11-26",
      "original_text": "Registerbekanntmachung nach dem Umwandlungsgesetz\nNordrhein-Westfalen Amtsgericht Lemgo HRB 6375\nSadurski Verwaltungs GmbH – Leopoldshöhe",
      "type": "Registerbekanntmachung nach dem Umwandlungsgesetz",
      "state": "Nordrhein-Westfalen",
      "amtsgericht": "Amtsgericht Lemgo",
      "registernummer": "HRB 6375",
      "registerart": "HRB",
      "company_name": "Sadurski Verwaltungs GmbH",
      "company_seat": "Leopoldshöhe",
      "details": "26.11.2024 (Bekanntmachungsdatum)\n\nNordrhein-Westfalen Amtsgericht Lemgo HRB 6375\nRegisterbekanntmachung nach dem Umwandlungsgesetz 26.11.2024 (Eintragungsdatum)\n\nSadurski Verwaltungs GmbH\nGesellschaft mit beschränkter Haftung\nLeopoldshöhe\n\nDen Gläubigern der an der Verschmelzung beteiligten Rechtsträger ist, wenn sie binnen sechs Monaten nach dem Tag, an dem die Eintragung der Verschmelzung in das Register des Sitzes desjenigen Rechtsträgers, dessen Gläubiger sie sind, nach § 19 Absatz 3 UmwG als bekanntgemacht gilt, ihren Anspruch nach Grund und Höhe schriftlich anmelden, Sicherheit zu leisten, soweit sie nicht Befriedigung verlangen können. Dieses Recht steht den Gläubigern jedoch nur zu, wenn sie glaubhaft machen, dass durch die Verschmelzung die Erfüllung ihrer Forderung gefährdet wird."
    },
    {
      "date": "2024-11-26",
      "original_text": "Löschungsankündigung\nBremen Amtsgericht Bremen HRA 27889\nSchlüterPartner GmbH & Co. KG – Bremen",
      "type": "Löschungsankündigung",
      "state": "Bremen",
      "amtsgericht": "Amtsgericht Bremen",
      "registernummer": "HRA 27889",
      "registerart": "HRA",
      "company_name": "SchlüterPartner GmbH & Co. KG",
      "company_seat": "Bremen",
      "details": "26.11.2024 (Bekanntmachungsdatum)\n\nBremen Amtsgericht Bremen HRA 27889\nLöschungsankündigung\n\nSchlüterPartner GmbH & Co. KG\nKommanditgesellschaft\nBremen\n\nEs ist beabsichtigt die im Handelsregister eingetragene Gesellschaft von Amts wegen gemäß § 394 FamFG zu löschen. Gegen die Löschung kann beim AG Bremen schriftlich oder zu Protokoll der Geschäftsstelle Widerspruch eingelegt werden. Widerspruchsfrist 4 Wochen."
    },
    {
      "date": "2024-11-26",
      "original_text": "Löschungsankündigung\nHessen Amtsgericht Darmstadt HRB 96051\nSchäffner Edelstahl & Design GmbH – Groß-Gerau",
      "type": "Löschungsankündigung",
      "state": "Hessen",
      "amtsgericht": "Amtsgericht Darmstadt",
      "registernummer": "HRB 96051",
      "registerart": "HRB",
      "company_name": "Schäffner Edelstahl & Design GmbH",
      "company_seat": "Groß-Gerau",
      "details": "26.11.2024 (Bekanntmachungsdatum)\n\nHessen Amtsgericht Darmstadt HRB 96051\nLöschungsankündigung\n\nSchäffner Edelstahl & Design GmbH\nGesellschaft mit beschränkter Haftung\nGroß-Gerau\n\nDas Registergericht beabsichtigt die im Handelsregister eingetragene Gesellschaft von Amts wegen nach § 394 FamFG zu löschen. Die Frist zur Erhebung eines Widerspruchs gegen die beabsichtigte Löschung wird auf 3 Monate festgesetzt."
    },
    {
      "date": "2024-11-26",
      "original_text": "Registerbekanntmachung nach dem Umwandlungsgesetz\nBayern Amtsgericht Fürth HRB 3683\nSeel Verwaltungs GmbH – Herzogenaurach",
      "type": "Registerbekanntmachung nach dem Umwandlungsgesetz",
      "state": "Bayern",
      "amtsgericht": "Amtsgericht Fürth",
      "registernummer": "HRB 3683",
      "registerart": "HRB",
      "company_name": "Seel Verwaltungs GmbH",
      "company_seat": "Herzogenaurach",
      "details": "26.11.2024 (Bekanntmachungsdatum)\n\nBayern Amtsgericht Fürth HRB 3683\nRegisterbekanntmachung nach dem Umwandlungsgesetz 25.11.2024 (Eintragungsdatum)\n\nSeel Verwaltungs GmbH\nGesellschaft mit beschränkter Haftung\nHerzogenaurach\n\nDen Gläubigern der an der Verschmelzung beteiligten Rechtsträger ist, wenn sie binnen sechs Monaten nach dem Tag, an dem die Eintragung der Verschmelzung in das Register des Sitzes desjenigen Rechtsträgers, dessen Gläubiger sie sind, nach § 19 Abs. 3 UmwG als bekannt gemacht gilt, ihren Anspruch nach Grund und Höhe schriftlich anmelden, Sicherheit zu leisten, soweit sie nicht Befriedigung verlangen können. Dieses Recht steht den Gläubigern jedoch nur zu, wenn sie glaubhaft machen, dass durch die Verschmelzung die Erfüllung ihrer Forderung gefährdet wird."
    },
    {
      "date": "2024-11-26",
      "original_text": "Sonstige Registerbekanntmachung\nNiedersachsen Amtsgericht Oldenburg (Oldenburg) HRB 220855\nSeniorenzentrum Wiefelstede GmbH – Wiefelstede",
      "type": "Sonstige Registerbekanntmachung",
      "state": "Niedersachsen",
      "amtsgericht": "Amtsgericht Oldenburg (Oldenburg)",
      "registernummer": "HRB 220855",
      "registerart": "HRB",
      "company_name": "Seniorenzentrum Wiefelstede GmbH",
      "company_seat": "Wiefelstede",
      "details": "26.11.2024 (Bekanntmachungsdatum)\n\nNiedersachsen Amtsgericht Oldenburg (Oldenburg) HRB 220855\nSonstige Registerbekanntmachung 26.11.2024 (Eintragungsdatum)\n\nSeniorenzentrum Wiefelstede GmbH\nGesellschaft mit beschränkter Haftung\nWiefelstede\n\nDen Gläubigern der Gesellschaft, deren Forderungen begründet worden sind, bevor die Eintragung der Beendigung des Vertrages in das Handelsregister nach § 10 HGB als bekanntgemacht gilt, ist vom anderen Vertragsteil Sicherheit zu leisten, wenn sie sich binnen sechs Monaten nach der Bekanntmachung zu diesem Zweck bei ihm melden."
    },
    {
      "date": "2024-11-26",
      "original_text": "Registerbekanntmachung nach dem Umwandlungsgesetz\nRheinland-Pfalz Amtsgericht Mainz HRB 23344\nSiSt Vermögensverwaltungs AG – Bingen am Rhein",
      "type": "Registerbekanntmachung nach dem Umwandlungsgesetz",
      "state": "Rheinland-Pfalz",
      "amtsgericht": "Amtsgericht Mainz",
      "registernummer": "HRB 23344",
      "registerart": "HRB",
      "company_name": "SiSt Vermögensverwaltungs AG",
      "company_seat": "Bingen am Rhein",
      "details": "26.11.2024 (Bekanntmachungsdatum)\n\nRheinland-Pfalz Amtsgericht Mainz HRB 23344\nRegisterbekanntmachung nach dem Umwandlungsgesetz\n\nSiSt Vermögensverwaltungs AG\nAktiengesellschaft\nBingen am Rhein\n\nAls nicht eingetragen wird veröffentlicht:\nDen Gläubigern des formwechselnden Rechtsträgers ist, wenn sie binnen sechs Monaten nach dem Tag, an dem die Eintragung des Formwechsels nach § 201 UmwG als bekannt gemacht gilt, ihren Anspruch nach Grund und Höhe schriftlich anmelden, Sicherheit zu leisten, soweit sie nicht Befriedigung verlangen können. Dieses Recht steht den Gläubigern jedoch nur zu, wenn sie glaubhaft machen, dass durch den Formwechsel die Erfüllung der Forderung gefährdet wird."
    },
    {
      "date": "2024-11-26",
      "original_text": "Registerbekanntmachung nach dem Umwandlungsgesetz\nRheinland-Pfalz Amtsgericht Mainz HRB 53304\nSiSt Vermögensverwaltungs GmbH – Bingen am Rhein",
      "type": "Registerbekanntmachung nach dem Umwandlungsgesetz",
      "state": "Rheinland-Pfalz",
      "amtsgericht": "Amtsgericht Mainz",
      "registernummer": "HRB 53304",
      "registerart": "HRB",
      "company_name": "SiSt Vermögensverwaltungs GmbH",
      "company_seat": "Bingen am Rhein",
      "details": "26.11.2024 (Bekanntmachungsdatum)\n\nRheinland-Pfalz Amtsgericht Mainz HRB 53304\nRegisterbekanntmachung nach dem Umwandlungsgesetz 26.11.2024 (Eintragungsdatum)\n\nSiSt Vermögensverwaltungs GmbH\nGesellschaft mit beschränkter Haftung\nBingen am Rhein\n\nAls nicht eingetragen wird veröffentlicht:\nDen Gläubigern des formwechselnden Rechtsträgers ist, wenn sie binnen sechs Monaten nach dem Tag, an dem die Eintragung des Formwechsels nach § 201 UmwG als bekannt gemacht gilt, ihren Anspruch nach Grund und Höhe schriftlich anmelden, Sicherheit zu leisten, soweit sie nicht Befriedigung verlangen können. Dieses Recht steht den Gläubigern jedoch nur zu, wenn sie glaubhaft machen, dass durch den Formwechsel die Erfüllung der Forderung gefährdet wird."
    },
    {
      "date": "2024-11-26",
      "original_text": "Registerbekanntmachung nach dem Umwandlungsgesetz\nBayern Amtsgericht Traunstein HRB 10083\nSieger und Huber Steuerberatungsgesellschaft mbH – Bruckmühl",
      "type": "Registerbekanntmachung nach dem Umwandlungsgesetz",
      "state": "Bayern",
      "amtsgericht": "Amtsgericht Traunstein",
      "registernummer": "HRB 10083",
      "registerart": "HRB",
      "company_name": "Sieger und Huber Steuerberatungsgesellschaft mbH",
      "company_seat": "Bruckmühl",
      "details": "26.11.2024 (Bekanntmachungsdatum)\n\nBayern Amtsgericht Traunstein HRB 10083\nRegisterbekanntmachung nach dem Umwandlungsgesetz 25.11.2024 (Eintragungsdatum)\n\nSieger und Huber Steuerberatungsgesellschaft mbH\nGesellschaft mit beschränkter Haftung\nBruckmühl\n\nDen Gläubigern des formwechselnden Rechtsträgers ist, wenn sie binnen sechs Monaten nach dem Tag, an dem die Eintragung des Formwechsels nach § 201 UmwG als bekannt gemacht gilt, ihren Anspruch nach Grund und Höhe schriftlich anmelden, Sicherheit zu leisten, soweit sie nicht Befriedigung verlangen können. Dieses Recht steht den Gläubigern jedoch nur zu, wenn sie glaubhaft machen, dass durch den Formwechsel die Erfüllung ihrer Forderung gefährdet wird."
    },
    {
      "date": "2024-11-26",
      "original_text": "Einreichung neuer Dokumente\nHessen Amtsgericht Offenbach am Main HRB 43873\nSport und Freizeit GmbH Offenbach – Offenbach am Main",
      "type": "Einreichung neuer Dokumente",
      "state": "Hessen",
      "amtsgericht": "Amtsgericht Offenbach am Main",
      "registernummer": "HRB 43873",
      "registerart": "HRB",
      "company_name": "Sport und Freizeit GmbH Offenbach",
      "company_seat": "Offenbach am Main",
      "details": "26.11.2024 (Bekanntmachungsdatum)\n\nHessen Amtsgericht Offenbach am Main HRB 43873\nEinreichung neuer Dokumente\n\nSport und Freizeit GmbH Offenbach\nGesellschaft mit beschränkter Haftung\nOffenbach am Main\n\nDurch eine Änderung in den Personen der Aufsichtsratsmitglieder ist eine Liste der Mitglieder des Aufsichtsrates zum Handelsregister eingereicht worden."
    },
    {
      "date": "2024-11-26",
      "original_text": "Registerbekanntmachung nach dem Umwandlungsgesetz\nBerlin Amtsgericht Berlin (Charlottenburg) HRB 253862\nSued Depo UG (haftungsbeschränkt) – Berlin",
      "type": "Registerbekanntmachung nach dem Umwandlungsgesetz",
      "state": "Berlin",
      "amtsgericht": "Amtsgericht Berlin (Charlottenburg)",
      "registernummer": "HRB 253862",
      "registerart": "HRB",
      "company_name": "Sued Depo UG (haftungsbeschränkt)",
      "company_seat": "Berlin",
      "details": "26.11.2024 (Bekanntmachungsdatum)\n\nBerlin Amtsgericht Berlin (Charlottenburg) HRB 253862\nRegisterbekanntmachung nach dem Umwandlungsgesetz 26.11.2024 (Eintragungsdatum)\n\nSued Depo UG (haftungsbeschränkt)\nGesellschaft mit beschränkter Haftung\nBerlin\n\nZu Eintragungsnummer 2 vom 26.11.2024 wird als nicht eingetragen veröffentlicht: Den Gläubigern der an der Verschmelzung beteiligten Rechtsträger ist, wenn sie binnen sechs Monaten nach dem Tag, an dem die Eintragung der Verschmelzung in das Register des Sitzes desjenigen Rechtsträgers, dessen Gläubiger sie sind, als bekannt gemacht gilt, ihren Anspruch nach Grund und Höhe schriftlich anmelden, Sicherheit zu leisten, soweit sie nicht Befriedigung verlangen können. Dieses Recht steht den Gläubigern jedoch nur zu, wenn sie glaubhaft machen, dass durch die Verschmelzung die Erfüllung ihrer Forderung gefährdet wird. Das Recht, Sicherheitsleistung zu verlangen, steht Gläubigern nicht zu, die im Falle der Insolvenz ein Recht auf vorzugsweise Befriedigung aus einer Deckungsmasse haben, die nach gesetzlicher Vorschrift zu ihrem Schutz errichtet und staatlich überwacht ist."
    },
    {
      "date": "2024-11-26",
      "original_text": "Registerbekanntmachung nach dem Umwandlungsgesetz\nBayern Amtsgericht München HRB 186953\nTOPO Munich Beteiligungs GmbH – Pullach i. Isartal",
      "type": "Registerbekanntmachung nach dem Umwandlungsgesetz",
      "state": "Bayern",
      "amtsgericht": "Amtsgericht München",
      "registernummer": "HRB 186953",
      "registerart": "HRB",
      "company_name": "TOPO Munich Beteiligungs GmbH",
      "company_seat": "Pullach i. Isartal",
      "details": "26.11.2024 (Bekanntmachungsdatum)\n\nBayern Amtsgericht München HRB 186953\nRegisterbekanntmachung nach dem Umwandlungsgesetz 25.11.2024 (Eintragungsdatum)\n\nTOPO Munich Beteiligungs GmbH\nGesellschaft mit beschränkter Haftung\nPullach i. Isartal\n\nDen Gläubigern #dv.auswahl(Text=\"Bitte zutreffendes auswählen:\",Eingabe=\n\n\"der an der Verschmelzung beteiligten Rechtsträger ist, wenn sie binnen sechs Monaten nach dem Tag, an dem die Eintragung der Verschmelzung in das Register des Sitzes desjenigen Rechtsträgers, dessen Gläubiger sie sind, nach § 19 Abs. 3 UmwG als bekannt gemacht gilt, ihren Anspruch nach Grund und Höhe schriftlich anmelden, Sicherheit zu leisten, soweit sie nicht Befriedigung verlangen können. Dieses Recht steht den Gläubigern jedoch nur zu, wenn sie glaubhaft machen, dass durch die Verschmelzung die Erfüllung ihrer Forderung gefährdet wird.\"|\"Verschmelzung\",\n\n\"der an der Spaltung beteiligten Rechtsträger ist, wenn sie binnen sechs Monaten nach dem Tag, an dem die Eintragung der Spaltung in das Register des Sitzes desjenigen Rechtsträgers, dessen Gläubiger sie sind, nach §§ 125, 19 Abs. 3 UmwG als bekannt gemacht gilt, ihren Anspruch nach Grund und Höhe schriftlich anmelden, Sicherheit zu leisten, soweit sie nicht Befriedigung verlangen können. Dieses Recht steht den Gläubigern jedoch nur zu, wenn sie glaubhaft machen, dass durch die Spaltung die Erfüllung ihrer Forderung gefährdet wird.\"|\"Spaltung\",\n\n\"des formwechselnden Rechtsträgers ist, wenn sie binnen sechs Monaten nach dem Tag, an dem die Eintragung des Formwechsels nach § 201 UmwG als bekannt gemacht gilt, ihren Anspruch nach Grund und Höhe schriftlich anmelden, Sicherheit zu leisten, soweit sie nicht Befriedigung verlangen können. Dieses Recht steht den Gläubigern jedoch nur zu, wenn sie glaubhaft machen, dass durch den Formwechsel die Erfüllung ihrer Forderung gefährdet wird.\"|\"formwechselnde Umwandlung\",\n\n\"der an der Ausgliederung beteiligten Rechtsträger ist, wenn sie binnen sechs Monaten nach dem Tag, an dem die Eintragung der Ausgliederung in das Register des Sitzes desjenigen Rechtsträgers, dessen Gläubiger sie sind, nach §§ 125, 19 Abs. 3 UmwG als bekannt gemacht gilt, ihren Anspruch nach Grund und Höhe schriftlich anmelden, Sicherheit zu leisten, soweit sie nicht Befriedigung verlangen können. Dieses Recht steht den Gläubigern jedoch nur zu, wenn sie glaubhaft machen, dass durch die Ausgliederung die Erfüllung ihrer Forderung gefährdet wird.\"|\"Ausgliederung\")"
    },
    {
      "date": "2024-11-26",
      "original_text": "Löschungsankündigung\nNordrhein-Westfalen Amtsgericht Siegburg HRB 10782\nTeSOS Bau UG (haftungsbeschränkt) – Sankt Augustin",
      "type": "Löschungsankündigung",
      "state": "Nordrhein-Westfalen",
      "amtsgericht": "Amtsgericht Siegburg",
      "registernummer": "HRB 10782",
      "registerart": "HRB",
      "company_name": "TeSOS Bau UG (haftungsbeschränkt)",
      "company_seat": "Sankt Augustin",
      "details": "26.11.2024 (Bekanntmachungsdatum)\n\nNordrhein-Westfalen Amtsgericht Siegburg HRB 10782\nLöschungsankündigung\n\nTeSOS Bau UG (haftungsbeschränkt)\nGesellschaft mit beschränkter Haftung\nSankt Augustin\n\nDas Registergericht hat glaubhafte Kenntnis erlangt, dass die Gesellschaft vermögenslos geworden ist, da ein Insolvenzverfahren durchgeführt und nach § 200 InsO aufgehoben wurde.\n\nEs ist daher beabsichtigt, die Gesellschaft nach § 394 FamFG im Handelsregister wegen Vermögenslosigkeit zu löschen.\n\nEinwände gegen die Löschung sind durch Widerspruch binnen einer Frist von 3 Monaten geltend zu machen, andernfalls die Löschung erfolgen wird.\n\nEinzulegen ist der Widerspruch bei dem Amtsgericht Siegburg, Neue Poststraße 16, 53721 Siegburg, und zwar entweder schriftlich in deutscher Sprache oder mündlich zur Niederschrift der Geschäftsstelle. Der Widerspruch kann auch zur Niederschrift der Geschäftsstelle eines jeden Amtsgerichts abgegeben werden. Der Widerspruch ist binnen der in der Verfügung bestimmten Frist einzulegen. Die Frist ist nur gewahrt, wenn der Widerspruch rechtzeitig bei dem Amtsgericht Siegburg eingeht, auch wenn der Widerspruch zur Niederschrift der Geschäftsstelle eines anderen Amtsgerichts abgegeben wurde. Die Frist beginnt jeweils mit der schriftlichen Bekanntgabe der Verfügung an die Beteiligten. Kann die schriftliche Bekanntgabe an einen Beteiligten nicht bewirkt werden, beginnt die Frist spätestens mit Ablauf von fünf Monaten nach Erlass der Verfügung. Die Bekanntgabe ist entweder durch Zustellung oder am dritten Tage nach Aufgabe zur Post bewirkt. Sofern die Löschung noch nicht erfolgt ist, kann der Widerspruch auch noch nach Ablauf der Frist eingelegt werden. Fällt das Ende der Frist auf einen Sonnabend, einen Sonntag oder einen allgemeinen Feiertag, endet die Frist mit Ablauf des nächsten Werktages. Der Widerspruch ist zu unterzeichnen. Eine Begründung des Widerspruchs ist nicht vorgeschrieben."
    },
    {
      "date": "2024-11-26",
      "original_text": "Registerbekanntmachung nach dem Umwandlungsgesetz\nBayern Amtsgericht München HRB 284714\nTemetic Automotive GmbH – München",
      "type": "Registerbekanntmachung nach dem Umwandlungsgesetz",
      "state": "Bayern",
      "amtsgericht": "Amtsgericht München",
      "registernummer": "HRB 284714",
      "registerart": "HRB",
      "company_name": "Temetic Automotive GmbH",
      "company_seat": "München",
      "details": "26.11.2024 (Bekanntmachungsdatum)\n\nBayern Amtsgericht München HRB 284714\nRegisterbekanntmachung nach dem Umwandlungsgesetz 25.11.2024 (Eintragungsdatum)\n\nTemetic Automotive GmbH\nGesellschaft mit beschränkter Haftung\nMünchen\n\nDen Gläubigern der an der Verschmelzung beteiligten Rechtsträger ist, wenn sie binnen sechs Monaten nach dem Tag, an dem die Eintragung der Verschmelzung in das Register des Sitzes desjenigen Rechtsträgers, dessen Gläubiger sie sind, nach § 19 Abs. 3 UmwG als bekannt gemacht gilt, ihren Anspruch nach Grund und Höhe schriftlich anmelden, Sicherheit zu leisten, soweit sie nicht Befriedigung verlangen können. Dieses Recht steht den Gläubigern jedoch nur zu, wenn sie glaubhaft machen, dass durch die Verschmelzung die Erfüllung ihrer Forderung gefährdet wird."
    },
    {
      "date": "2024-11-26",
      "original_text": "Registerbekanntmachung nach dem Umwandlungsgesetz\nNordrhein-Westfalen Amtsgericht Siegen HRB 9993\nTemetic GmbH – Wilnsdorf",
      "type": "Registerbekanntmachung nach dem Umwandlungsgesetz",
      "state": "Nordrhein-Westfalen",
      "amtsgericht": "Amtsgericht Siegen",
      "registernummer": "HRB 9993",
      "registerart": "HRB",
      "company_name": "Temetic GmbH",
      "company_seat": "Wilnsdorf",
      "details": "26.11.2024 (Bekanntmachungsdatum)\n\nNordrhein-Westfalen Amtsgericht Siegen HRB 9993\nRegisterbekanntmachung nach dem Umwandlungsgesetz 26.11.2024 (Eintragungsdatum)\n\nTemetic GmbH\nGesellschaft mit beschränkter Haftung\nWilnsdorf\n\nDen Gläubigern der an der Verschmelzung beteiligten Rechtsträger ist, wenn sie binnen sechs Monaten nach dem Tag, an dem die Eintragung der Verschmelzung in das Register des Sitzes desjenigen Rechtsträgers, dessen Gläubiger sie sind, nach § 19 Absatz 3 UmwG als bekanntgemacht gilt, ihren Anspruch nach Grund und Höhe schriftlich anmelden, Sicherheit zu leisten, soweit sie nicht Befriedigung verlangen können. Dieses Recht steht den Gläubigern jedoch nur zu, wenn sie glaubhaft machen, dass durch die Verschmelzung die Erfüllung ihrer Forderung gefährdet wird."
    },
    {
      "date": "2024-11-26",
      "original_text": "Registerbekanntmachung nach dem Umwandlungsgesetz\nNordrhein-Westfalen Amtsgericht Siegen HRB 9993\nTemetic GmbH – Wilnsdorf",
      "type": "Registerbekanntmachung nach dem Umwandlungsgesetz",
      "state": "Nordrhein-Westfalen",
      "amtsgericht": "Amtsgericht Siegen",
      "registernummer": "HRB 9993",
      "registerart": "HRB",
      "company_name": "Temetic GmbH",
      "company_seat": "Wilnsdorf",
      "details": "26.11.2024 (Bekanntmachungsdatum)\n\nNordrhein-Westfalen Amtsgericht Siegen HRB 9993\nRegisterbekanntmachung nach dem Umwandlungsgesetz 26.11.2024 (Eintragungsdatum)\n\nTemetic GmbH\nGesellschaft mit beschränkter Haftung\nWilnsdorf\n\nDen Gläubigern der an der Verschmelzung beteiligten Rechtsträger ist, wenn sie binnen sechs Monaten nach dem Tag, an dem die Eintragung der Verschmelzung in das Register des Sitzes desjenigen Rechtsträgers, dessen Gläubiger sie sind, nach § 19 Absatz 3 UmwG als bekanntgemacht gilt, ihren Anspruch nach Grund und Höhe schriftlich anmelden, Sicherheit zu leisten, soweit sie nicht Befriedigung verlangen können. Dieses Recht steht den Gläubigern jedoch nur zu, wenn sie glaubhaft machen, dass durch die Verschmelzung die Erfüllung ihrer Forderung gefährdet wird."
    },
    {
      "date": "2024-11-26",
      "original_text": "Registerbekanntmachung nach dem Umwandlungsgesetz\nSaarland Amtsgericht Saarbrücken HRB 100107\nThea Grundstücksverwaltungsgesellschaft mbH – Saarbrücken",
      "type": "Registerbekanntmachung nach dem Umwandlungsgesetz",
      "state": "Saarland",
      "amtsgericht": "Amtsgericht Saarbrücken",
      "registernummer": "HRB 100107",
      "registerart": "HRB",
      "company_name": "Thea Grundstücksverwaltungsgesellschaft mbH",
      "company_seat": "Saarbrücken",
      "details": "26.11.2024 (Bekanntmachungsdatum)\n\nSaarland Amtsgericht Saarbrücken HRB 100107\nRegisterbekanntmachung nach dem Umwandlungsgesetz 26.11.2024 (Eintragungsdatum)\n\nThea Grundstücksverwaltungsgesellschaft mbH\nGesellschaft mit beschränkter Haftung\nSaarbrücken\n\nAls nicht eingetragen wird bekannt gemacht: Den Gläubigern der an der Verschmelzung beteiligten Gesellschaften ist, wenn sie binnen sechs Monaten nach dem Tag, an dem die Eintragung der Verschmelzung in das Register des Sitzes desjenigen Rechtsträgers, dessen Gläubiger sie sind, nach § 19 Absatz 3 UmwG bekannt gemacht worden ist, ihren Anspruch nach Grund und Höhe schriftlich anmelden, Sicherheit zu leisten, soweit sie nicht Befriedigung verlangen können. Dieses Recht steht den Gläubigern jedoch nur zu, wenn sie glaubhaft machen, dass durch die Verschmelzung die Erfüllung ihrer Forderung gefährdet wird."
    },
    {
      "date": "2024-11-26",
      "original_text": "Einreichung neuer Dokumente\nHessen Amtsgericht Frankfurt am Main HRB 50291\nTrading Places AG – Frankfurt am Main",
      "type": "Einreichung neuer Dokumente",
      "state": "Hessen",
      "amtsgericht": "Amtsgericht Frankfurt am Main",
      "registernummer": "HRB 50291",
      "registerart": "HRB",
      "company_name": "Trading Places AG",
      "company_seat": "Frankfurt am Main",
      "details": "26.11.2024 (Bekanntmachungsdatum)\n\nHessen Amtsgericht Frankfurt am Main HRB 50291\nEinreichung neuer Dokumente 26.11.2024 (Eintragungsdatum)\n\nTrading Places AG\nAktiengesellschaft\nFrankfurt am Main\n\nDurch eine Änderung in den Personen der Aufsichtsratsmitglieder ist eine Liste der Mitglieder des Aufsichtsrates zum Handelsregister eingereicht worden."
    },
    {
      "date": "2024-11-26",
      "original_text": "Registerbekanntmachung nach dem Umwandlungsgesetz\nBayern Amtsgericht München HRA 93441\nVTC GmbH & Co. KG – München",
      "type": "Registerbekanntmachung nach dem Umwandlungsgesetz",
      "state": "Bayern",
      "amtsgericht": "Amtsgericht München",
      "registernummer": "HRA 93441",
      "registerart": "HRA",
      "company_name": "VTC GmbH & Co. KG",
      "company_seat": "München",
      "details": "26.11.2024 (Bekanntmachungsdatum)\n\nBayern Amtsgericht München HRA 93441\nRegisterbekanntmachung nach dem Umwandlungsgesetz 25.11.2024 (Eintragungsdatum)\n\nVTC GmbH & Co. KG\nKommanditgesellschaft\nMünchen\n\nDen Gläubigern der an der Verschmelzung beteiligten Rechtsträger ist, wenn sie binnen sechs Monaten nach dem Tag, an dem die Eintragung der Verschmelzung in das Register des Sitzes desjenigen Rechtsträgers, dessen Gläubiger sie sind, nach § 19 Abs. 3 UmwG als bekannt gemacht gilt, ihren Anspruch nach Grund und Höhe schriftlich anmelden, Sicherheit zu leisten, soweit sie nicht Befriedigung verlangen können. Dieses Recht steht den Gläubigern jedoch nur zu, wenn sie glaubhaft machen, dass durch die Verschmelzung die Erfüllung ihrer Forderung gefährdet wird."
    },
    {
      "date": "2024-11-26",
      "original_text": "Sonstige Registerbekanntmachung\nSachsen-Anhalt Amtsgericht Stendal GnR 1898\nVolksbank Börde-Bernburg eG – Bernburg (Saale)",
      "type": "Sonstige Registerbekanntmachung",
      "state": "Sachsen-Anhalt",
      "amtsgericht": "Amtsgericht Stendal",
      "registernummer": "GnR 1898",
      "registerart": "GnR",
      "company_name": "Volksbank Börde-Bernburg eG",
      "company_seat": "Bernburg (Saale)",
      "details": "26.11.2024 (Bekanntmachungsdatum)\n\nSachsen-Anhalt Amtsgericht Stendal GnR 1898\nSonstige Registerbekanntmachung 26.10.2023 (Eintragungsdatum)\n\nVolksbank Börde-Bernburg eG\neingetragene Genossenschaft\nBernburg (Saale)\n\nDie Generalversammlung vom 29.06.2023 hat die Aufhebung der Nachschusspflicht beschlossen.\nAls nicht eingetragen wird veröffentlicht:\nDen Gläubigern der Genossenschaft ist, wenn sie sich binnen 6 Monaten nach der Bekanntmachung bei der Genossenschaft zu diesem Zweck melden, Sicherheit zu leisten, soweit sie nicht Befriedigung verlangen können (§ 22 Abs. 1 bis 3 GenG)."
    },
    {
      "date": "2024-11-26",
      "original_text": "Sonstige Registerbekanntmachung\nSachsen-Anhalt Amtsgericht Stendal GnR 3140\nVolksbank eG – Sangerhausen",
      "type": "Sonstige Registerbekanntmachung",
      "state": "Sachsen-Anhalt",
      "amtsgericht": "Amtsgericht Stendal",
      "registernummer": "GnR 3140",
      "registerart": "GnR",
      "company_name": "Volksbank eG",
      "company_seat": "Sangerhausen",
      "details": "26.11.2024 (Bekanntmachungsdatum)\n\nSachsen-Anhalt Amtsgericht Stendal GnR 3140\nSonstige Registerbekanntmachung 26.11.2024 (Eintragungsdatum)\n\nVolksbank eG\neingetragene Genossenschaft\nSangerhausen\n\nDie Generalversammlung vom 07.09.2021 hat die Änderung der Satzung in § 10 (Auseinandersetzung), § 19 (Willensbildung), § 33 (Abstimmungen und Wahlen), § 35 (Versammlungsniederschrift), § (36 Teilnahme der Verbände), § 40 (Nachschusspflicht) und § 42 (Jahresabschluss und Lagebericht).\n\nAls nicht eingetragen wird veröffentlicht:\n\nDen Gläubigern der Genossenschaft ist, wenn sie sich binnen 6 Monaten nach der Bekanntmachung bei der Genossenschaft zu diesem Zweck melden, Sicherheit zu leisten, soweit sie nicht Befriedigung verlangen können (§ 22 Abs. 1 bis 3 GenG)."
    },
    {
      "date": "2024-11-26",
      "original_text": "Registerbekanntmachung nach dem Umwandlungsgesetz\nNiedersachsen Amtsgericht Braunschweig HRB 210842\nVolkswagen Financial Services AG – Braunschweig",
      "type": "Registerbekanntmachung nach dem Umwandlungsgesetz",
      "state": "Niedersachsen",
      "amtsgericht": "Amtsgericht Braunschweig",
      "registernummer": "HRB 210842",
      "registerart": "HRB",
      "company_name": "Volkswagen Financial Services AG",
      "company_seat": "Braunschweig",
      "details": "26.11.2024 (Bekanntmachungsdatum)\n\nNiedersachsen Amtsgericht Braunschweig HRB 210842\nRegisterbekanntmachung nach dem Umwandlungsgesetz 26.11.2024 (Eintragungsdatum)\n\nVolkswagen Financial Services AG\nAktiengesellschaft\nBraunschweig\n\nDen Gläubigern der an der grenzüberschreitenden Verschmelzung beteiligten übernehmenden Rechtsträger ist, wenn sie binnen sechs Monaten nach dem Tag, an dem die Eintragung der Verschmelzung in das Register des Sitzes desjenigen Rechtsträgers, dessen Gläubiger sie sind, nach § 19 Absatz 3 UmwG als bekanntgemacht gilt, ihren Anspruch nach Grund und Höhe schriftlich anmelden, Sicherheit zu leisten, soweit sie nicht Befriedigung verlangen können.\n\nDieses Recht steht den Gläubigern jedoch nur zu, wenn sie glaubhaft machen, dass durch die Verschmelzung die Erfüllung ihrer Forderung gefährdet wird."
    },
    {
      "date": "2024-11-26",
      "original_text": "Einreichung neuer Dokumente\nBaden-Württemberg Amtsgericht Mannheim HRB 210864\nVolkswohnung Bauträger GmbH – Karlsruhe",
      "type": "Einreichung neuer Dokumente",
      "state": "Baden-Württemberg",
      "amtsgericht": "Amtsgericht Mannheim",
      "registernummer": "HRB 210864",
      "registerart": "HRB",
      "company_name": "Volkswohnung Bauträger GmbH",
      "company_seat": "Karlsruhe",
      "details": "26.11.2024 (Bekanntmachungsdatum)\n\nBaden-Württemberg Amtsgericht Mannheim HRB 210864\nEinreichung neuer Dokumente\n\nVolkswohnung Bauträger GmbH\nGesellschaft mit beschränkter Haftung\nKarlsruhe\n\nDie Gesellschaft hat am 22.11.2024 die Liste über die Zusammensetzung des Aufsichtsrats zum Handelsregister eingereicht."
    },
    {
      "date": "2024-11-26",
      "original_text": "Einreichung neuer Dokumente\nBaden-Württemberg Amtsgericht Mannheim HRB 100159\nVolkswohnung GmbH – Karlsruhe",
      "type": "Einreichung neuer Dokumente",
      "state": "Baden-Württemberg",
      "amtsgericht": "Amtsgericht Mannheim",
      "registernummer": "HRB 100159",
      "registerart": "HRB",
      "company_name": "Volkswohnung GmbH",
      "company_seat": "Karlsruhe",
      "details": "26.11.2024 (Bekanntmachungsdatum)\n\nBaden-Württemberg Amtsgericht Mannheim HRB 100159\nEinreichung neuer Dokumente\n\nVolkswohnung GmbH\nGesellschaft mit beschränkter Haftung\nKarlsruhe\n\nDie Gesellschaft hat am 22.11.2024 die Liste über die Zusammensetzung des Aufsichtsrats zum Handelsregister eingereicht."
    },
    {
      "date": "2024-11-26",
      "original_text": "Löschungsankündigung\nSaarland Amtsgericht Saarbrücken HRB 103005\nWIG Wohn-Invest GmbH – Kirkel",
      "type": "Löschungsankündigung",
      "state": "Saarland",
      "amtsgericht": "Amtsgericht Saarbrücken",
      "registernummer": "HRB 103005",
      "registerart": "HRB",
      "company_name": "WIG Wohn-Invest GmbH",
      "company_seat": "Kirkel",
      "details": "26.11.2024 (Bekanntmachungsdatum)\n\nSaarland Amtsgericht Saarbrücken HRB 103005\nLöschungsankündigung\n\nWIG Wohn-Invest GmbH\nGesellschaft mit beschränkter Haftung\nKirkel\n\nEs ist beabsichtigt, die Gesellschaft von Amts wegen gemäß § 394 FamFG wegen Vermögenslosigkeit zu löschen.\nGegen die Löschung von Amts wegen ist das Rechtsmittel des Widerspruchs statthaft. Der Widerspruch ist binnen einer Frist zwei Monaten beginnend mit dem Tag dieser Veröffentlichung durch Einreichen eines Widerspruchsschreibens -schriftlich oder zur Niederschrift der Geschäftsstelle beim Amtsgericht Saarbrücken, -zentrales Handelsregister-, Mainzerstr.178, 66121 Saarbrücken einzulegen.\nDer Widerspruch muss die Bezeichnung der angefochtenen Löschungsankündigung enthalten sowie die Erklärung, dass Widerspruch eingelegt wird. Er ist vom Widerspruchsführer oder seinem Bevollmächtigten zu unterzeichnen.\nDas Widerspruchsschreiben kann auch in der Form eines elektronischen Dokumentes eingereicht werden, das mit einer qualifizierten elektronischen Signatur nach dem Signaturgesetz versehen sein muss (§§ 14 Abs. 2 FamFG, 130a, 298 ZPO)."
    },
    {
      "date": "2024-11-26",
      "original_text": "Löschungsankündigung\nNordrhein-Westfalen Amtsgericht Dortmund HRA 17904\nWhiteWood GmbH & Co.KG – Lünen",
      "type": "Löschungsankündigung",
      "state": "Nordrhein-Westfalen",
      "amtsgericht": "Amtsgericht Dortmund",
      "registernummer": "HRA 17904",
      "registerart": "HRA",
      "company_name": "WhiteWood GmbH & Co.KG",
      "company_seat": "Lünen",
      "details": "26.11.2024 (Bekanntmachungsdatum)\n\nNordrhein-Westfalen Amtsgericht Dortmund HRA 17904\nLöschungsankündigung\n\nWhiteWood GmbH & Co.KG\nKommanditgesellschaft\nLünen\n\nDas Registergericht beabsichtigt die Firma von Amts wegen nach § 394 FamFG zu löschen. Die Frist zur Erhebung eines Widerspruchs ist auf drei Monate festgesetzt."
    },
    {
      "date": "2024-11-26",
      "original_text": "Einreichung neuer Dokumente\nBrandenburg Amtsgericht Cottbus HRB 10145\nWildauer Sportbetriebsgesellschaft mbH – Wildau",
      "type": "Einreichung neuer Dokumente",
      "state": "Brandenburg",
      "amtsgericht": "Amtsgericht Cottbus",
      "registernummer": "HRB 10145",
      "registerart": "HRB",
      "company_name": "Wildauer Sportbetriebsgesellschaft mbH",
      "company_seat": "Wildau",
      "details": "26.11.2024 (Bekanntmachungsdatum)\n\nBrandenburg Amtsgericht Cottbus HRB 10145\nEinreichung neuer Dokumente\n\nWildauer Sportbetriebsgesellschaft mbH\nGesellschaft mit beschränkter Haftung\nWildau\n\nAls nicht eingetragen wird veröffentlicht:\nDie aktuelle Liste der Aufsichtsratsmitglieder wurde zum Handelsregister gem. § 52 Abs. 3 GmbHG eingereicht."
    },
    {
      "date": "2024-11-26",
      "original_text": "Einreichung neuer Dokumente\nBrandenburg Amtsgericht Cottbus HRB 9422\nWildauer Wohnungsbaugesellschaft mbH – Wildau",
      "type": "Einreichung neuer Dokumente",
      "state": "Brandenburg",
      "amtsgericht": "Amtsgericht Cottbus",
      "registernummer": "HRB 9422",
      "registerart": "HRB",
      "company_name": "Wildauer Wohnungsbaugesellschaft mbH",
      "company_seat": "Wildau",
      "details": "26.11.2024 (Bekanntmachungsdatum)\n\nBrandenburg Amtsgericht Cottbus HRB 9422\nEinreichung neuer Dokumente\n\nWildauer Wohnungsbaugesellschaft mbH\nGesellschaft mit beschränkter Haftung\nWildau\n\nAls nicht eingetragen wird veröffentlicht:\nDer Geschäftsführer hat eine Liste der Aufsichtsratsmitglieder gem. § 52 Abs. 2 Satz 2 GmbHG zum Handelsregister eingereicht"
    },
    {
      "date": "2024-11-26",
      "original_text": "Registerbekanntmachung nach dem Umwandlungsgesetz\nBayern Amtsgericht München HRB 269370\nWine in Black Brazil GmbH – München",
      "type": "Registerbekanntmachung nach dem Umwandlungsgesetz",
      "state": "Bayern",
      "amtsgericht": "Amtsgericht München",
      "registernummer": "HRB 269370",
      "registerart": "HRB",
      "company_name": "Wine in Black Brazil GmbH",
      "company_seat": "München",
      "details": "26.11.2024 (Bekanntmachungsdatum)\n\nBayern Amtsgericht München HRB 269370\nRegisterbekanntmachung nach dem Umwandlungsgesetz\n\nWine in Black Brazil GmbH\nGesellschaft mit beschränkter Haftung\nMünchen\n\nEs wird darauf hingewiesen, dass ein Verschmelzungsplan oder sein Entwurf über eine grenzüberschreitende Verschmelzung zur Aufnahme mit der OVEO, LDA. mit Sitz in Braga/Portugal (Handelsregisteramt von Vila Nova de Gaia Registrierungs- und Steuerzahlernummer 513669850) (Sociedade por quotas - Gesellschaft mit beschränkter Haftung nach portugiesischen Recht) beim Handelsregister eingereicht worden ist.\nDie Anteilsinhaber sowie die Gläubiger der an der grenzüberschreitenden Verschmelzung beteiligten Gesellschaften, können der jeweiligen Gesellschaft spätestens fünf Arbeitstage vor dem 17.12.2024 (dies ist der Tag, an dem der Verschmelzungsplan beurkundet werden soll und Verschmelzungsbeschlüsse - sofern sie erforderlich oder dienlich sind - gefasst werden sollen) Bemerkungen zum Verschmelzungsplan übermitteln."
    },
    {
      "date": "2024-11-26",
      "original_text": "Registerbekanntmachung nach dem Umwandlungsgesetz\nRheinland-Pfalz Amtsgericht Ludwigshafen a.Rhein (Ludwigshafen) HRA 60274\nWittmann Immobilien UG (haftungsbeschränkt) & Co. KG – Ludwigshafen am Rhein",
      "type": "Registerbekanntmachung nach dem Umwandlungsgesetz",
      "state": "Rheinland-Pfalz",
      "amtsgericht": "Amtsgericht Ludwigshafen a.Rhein (Ludwigshafen)",
      "registernummer": "HRA 60274",
      "registerart": "HRA",
      "company_name": "Wittmann Immobilien UG (haftungsbeschränkt) & Co. KG",
      "company_seat": "Ludwigshafen am Rhein",
      "details": "26.11.2024 (Bekanntmachungsdatum)\n\nRheinland-Pfalz Amtsgericht Ludwigshafen a.Rhein (Ludwigshafen) HRA 60274\nRegisterbekanntmachung nach dem Umwandlungsgesetz 19.11.2024 (Eintragungsdatum)\n\nWittmann Immobilien UG (haftungsbeschränkt) & Co. KG\nKommanditgesellschaft\nLudwigshafen am Rhein\n\nAls nicht eingetragen wird veröffentlicht: Den Gläubigern der an der Umwandlungbeteiligten Rechtsträger ist, wenn sie binnen sechs Monaten nach dem Tag, an dem die Eintragung der Umwandlung in das Register des Sitzes desjenigen Rechtsträgers, dessen Gläubiger sie sind, nach § 19 Abs. 3 UmwG als bekannt gemacht gilt, ihren Anspruch nach Grund und Höhe schriftlich anmelden, Sicherheit zu leisten, soweit sie nicht Befriedigung verlangen können. Dieses Recht steht den Gläubigern jedoch nur zu, wenn sie glaubhaft machen, dass durch die Umwandlung die Erfüllung der Forderung gefährdet wird."
    },
    {
      "date": "2024-11-26",
      "original_text": "Registerbekanntmachung nach dem Umwandlungsgesetz\nSaarland Amtsgericht Saarbrücken HRB 9637\nZWF digitale Informationstechnologie GmbH – Saarbrücken",
      "type": "Registerbekanntmachung nach dem Umwandlungsgesetz",
      "state": "Saarland",
      "amtsgericht": "Amtsgericht Saarbrücken",
      "registernummer": "HRB 9637",
      "registerart": "HRB",
      "company_name": "ZWF digitale Informationstechnologie GmbH",
      "company_seat": "Saarbrücken",
      "details": "26.11.2024 (Bekanntmachungsdatum)\n\nSaarland Amtsgericht Saarbrücken HRB 9637\nRegisterbekanntmachung nach dem Umwandlungsgesetz 26.11.2024 (Eintragungsdatum)\n\nZWF digitale Informationstechnologie GmbH\nGesellschaft mit beschränkter Haftung\nSaarbrücken\n\nAls nicht eingetragen wird bekannt gemacht: Den Gläubigern der an der Verschmelzung beteiligten Gesellschaften ist, wenn sie binnen sechs Monaten nach dem Tag, an dem die Eintragung der Verschmelzung in das Register des Sitzes desjenigen Rechtsträgers, dessen Gläubiger sie sind, nach § 19 Absatz 3 UmwG bekannt gemacht worden ist, ihren Anspruch nach Grund und Höhe schriftlich anmelden, Sicherheit zu leisten, soweit sie nicht Befriedigung verlangen können. Dieses Recht steht den Gläubigern jedoch nur zu, wenn sie glaubhaft machen, dass durch die Verschmelzung die Erfüllung ihrer Forderung gefährdet wird."
    },
    {
      "date": "2024-11-26",
      "original_text": "Einreichung neuer Dokumente\nBaden-Württemberg Amtsgericht Ulm HRB 729780\nZeppelin Systems GmbH – Friedrichshafen",
      "type": "Einreichung neuer Dokumente",
      "state": "Baden-Württemberg",
      "amtsgericht": "Amtsgericht Ulm",
      "registernummer": "HRB 729780",
      "registerart": "HRB",
      "company_name": "Zeppelin Systems GmbH",
      "company_seat": "Friedrichshafen",
      "details": "26.11.2024 (Bekanntmachungsdatum)\n\nBaden-Württemberg Amtsgericht Ulm HRB 729780\nEinreichung neuer Dokumente\n\nZeppelin Systems GmbH\nGesellschaft mit beschränkter Haftung\nFriedrichshafen\n\nDie Gesellschaft hat am 25.11.2024 die Liste über die Zusammensetzung des Aufsichtsrats zum Handelsregister eingereicht."
    },
    {
      "date": "2024-11-26",
      "original_text": "Löschungsankündigung\nBremen Amtsgericht Bremen HRB 16184\nbauteam-bremen GmbH – Bremen",
      "type": "Löschungsankündigung",
      "state": "Bremen",
      "amtsgericht": "Amtsgericht Bremen",
      "registernummer": "HRB 16184",
      "registerart": "HRB",
      "company_name": "bauteam-bremen GmbH",
      "company_seat": "Bremen",
      "details": "26.11.2024 (Bekanntmachungsdatum)\n\nBremen Amtsgericht Bremen HRB 16184\nLöschungsankündigung\n\nbauteam-bremen GmbH\nGesellschaft mit beschränkter Haftung\nBremen\n\nEs ist beabsichtigt die im Handelsregister eingetragene Gesellschaft von Amts wegen gemäß § 394 FamFG zu löschen. Gegen die Löschung kann beim AG Bremen schriftlich oder zu Protokoll der Geschäftsstelle Widerspruch eingelegt werden. Widerspruchsfrist 4 Wochen."
    },
    {
      "date": "2024-11-26",
      "original_text": "Registerbekanntmachung nach dem Umwandlungsgesetz\nBaden-Württemberg Amtsgericht Mannheim HRB 728866\njatac JF UG (haftungsbeschränkt) – Stutensee",
      "type": "Registerbekanntmachung nach dem Umwandlungsgesetz",
      "state": "Baden-Württemberg",
      "amtsgericht": "Amtsgericht Mannheim",
      "registernummer": "HRB 728866",
      "registerart": "HRB",
      "company_name": "jatac JF UG (haftungsbeschränkt)",
      "company_seat": "Stutensee",
      "details": "26.11.2024 (Bekanntmachungsdatum)\n\nBaden-Württemberg Amtsgericht Mannheim HRB 728866\nRegisterbekanntmachung nach dem Umwandlungsgesetz 26.11.2024 (Eintragungsdatum)\n\njatac JF UG (haftungsbeschränkt)\nGesellschaft mit beschränkter Haftung\nStutensee\n\nAls nicht eingetragen wird bekanntgemacht:\nDen Gläubigern der an der Verschmelzung beteiligten Rechtsträger ist, wenn sie binnen sechs Monaten nach dem Tag, an dem die Eintragung der Verschmelzung in das Register des Sitzes desjenigen Rechtsträgers, dessen Gläubiger sie sind, nach § 19 Abs. 3 UmwG als bekanntgemacht gilt, ihren Anspruch nach Grund und Höhe schriftlich anmelden, Sicherheit zu leisten, soweit sie nicht Befriedigung verlangen können. Dieses Recht steht den Gläubigern jedoch nur zu, wenn sie glaubhaft machen, dass durch die Verschmelzung die Erfüllung ihrer Forderung gefährdet wird."
    },
    {
      "date": "2024-11-26",
      "original_text": "Registerbekanntmachung nach dem Umwandlungsgesetz\nBayern Amtsgericht Nürnberg HRB 31700\nophono GmbH – Nürnberg",
      "type": "Registerbekanntmachung nach dem Umwandlungsgesetz",
      "state": "Bayern",
      "amtsgericht": "Amtsgericht Nürnberg",
      "registernummer": "HRB 31700",
      "registerart": "HRB",
      "company_name": "ophono GmbH",
      "company_seat": "Nürnberg",
      "details": "26.11.2024 (Bekanntmachungsdatum)\n\nBayern Amtsgericht Nürnberg HRB 31700\nRegisterbekanntmachung nach dem Umwandlungsgesetz 25.11.2024 (Eintragungsdatum)\n\nophono GmbH\nGesellschaft mit beschränkter Haftung\nNürnberg\n\nDen Gläubigern der an der Verschmelzung beteiligten Rechtsträger ist, wenn sie binnen sechs Monaten nach dem Tag, an dem die Eintragung der Verschmelzung in das Register des Sitzes desjenigen Rechtsträgers, dessen Gläubiger sie sind, nach § 19 Abs. 3 UmwG als bekannt gemacht gilt, ihren Anspruch nach Grund und Höhe schriftlich anmelden, Sicherheit zu leisten, soweit sie nicht Befriedigung verlangen können. Dieses Recht steht den Gläubigern jedoch nur zu, wenn sie glaubhaft machen, dass durch die Verschmelzung die Erfüllung ihrer Forderung gefährdet wird."
    },
    {
      "date": "2024-11-26",
      "original_text": "Löschungsankündigung\nBrandenburg Amtsgericht Potsdam HRB 31380\nsmitex GmbH – Niederer Fläming",
      "type": "Löschungsankündigung",
      "state": "Brandenburg",
      "amtsgericht": "Amtsgericht Potsdam",
      "registernummer": "HRB 31380",
      "registerart": "HRB",
      "company_name": "smitex GmbH",
      "company_seat": "Niederer Fläming",
      "details": "26.11.2024 (Bekanntmachungsdatum)\n\nBrandenburg Amtsgericht Potsdam HRB 31380\nLöschungsankündigung\n\nsmitex GmbH\nGesellschaft mit beschränkter Haftung\nNiederer Fläming\n\nBei der nachstehenden Gesellschaft wird das Amtslöschungsverfahren gemäß § 394 FamFG eingeleitet. Widerspruchsfrist: 8 Wochen."
    }
  ]
}