{
  "date": "2024-11-23",
  "date_of_scrape": "2024-11-24T04:04:16.998Z",
  "tool_version": "0.1.0",
  "announcements": [
    {
      "date": "2024-11-23",
      "original_text": "Einreichung neuer Dokumente\nBayern Amtsgericht Ingolstadt HRB 9560\nALDI Oberbayern Verwaltungs-SE – Geisenfeld",
      "type": "Einreichung neuer Dokumente",
      "state": "Bayern",
      "amtsgericht": "Amtsgericht Ingolstadt",
      "registernummer": "HRB 9560",
      "registerart": "HRB",
      "company_name": "ALDI Oberbayern Verwaltungs-SE",
      "company_seat": "Geisenfeld",
      "details": "23.11.2024 (Bekanntmachungsdatum)\n\nBayern Amtsgericht Ingolstadt HRB 9560\nEinreichung neuer Dokumente\n\nALDI Oberbayern Verwaltungs-SE\nEuropäische Aktiengesellschaft (SE)\nGeisenfeld\n\nDem Amtsgericht Ingolstadt -Registergericht- ist eine Liste der Mitglieder des Verwaltungsrats eingereicht worden."
    },
    {
      "date": "2024-11-23",
      "original_text": "Löschungsankündigung\nBayern Amtsgericht Ingolstadt HRB 4680\nBC-MONT GmbH – Manching",
      "type": "Löschungsankündigung",
      "state": "Bayern",
      "amtsgericht": "Amtsgericht Ingolstadt",
      "registernummer": "HRB 4680",
      "registerart": "HRB",
      "company_name": "BC-MONT GmbH",
      "company_seat": "Manching",
      "details": "23.11.2024 (Bekanntmachungsdatum)\n\nBayern Amtsgericht Ingolstadt HRB 4680\nLöschungsankündigung\n\nBC-MONT GmbH\nGesellschaft mit beschränkter Haftung\nManching\n\nDas Registergericht beabsichtigt, die im Handelsregister eingetragene Gesellschaft wegen Vermögenslosigkeit von Amts wegen nach § 394 FamFG zu löschen. #insert(Text=\"zztb_V_Widerspruchsfrist\")"
    },
    {
      "date": "2024-11-23",
      "original_text": "Registerbekanntmachung nach dem Umwandlungsgesetz\nBayern Amtsgericht Fürth HRB 7677\nBRODOS AG – Baiersdorf",
      "type": "Registerbekanntmachung nach dem Umwandlungsgesetz",
      "state": "Bayern",
      "amtsgericht": "Amtsgericht Fürth",
      "registernummer": "HRB 7677",
      "registerart": "HRB",
      "company_name": "BRODOS AG",
      "company_seat": "Baiersdorf",
      "details": "23.11.2024 (Bekanntmachungsdatum)\n\nBayern Amtsgericht Fürth HRB 7677\nRegisterbekanntmachung nach dem Umwandlungsgesetz 22.11.2024 (Eintragungsdatum)\n\nBRODOS AG\nAktiengesellschaft\nBaiersdorf\n\nDen Gläubigern der an der Verschmelzung beteiligten Rechtsträger ist, wenn sie binnen sechs Monaten nach dem Tag, an dem die Eintragung der Verschmelzung in das Register des Sitzes desjenigen Rechtsträgers, dessen Gläubiger sie sind, nach § 19 Abs. 3 UmwG als bekannt gemacht gilt, ihren Anspruch nach Grund und Höhe schriftlich anmelden, Sicherheit zu leisten, soweit sie nicht Befriedigung verlangen können. Dieses Recht steht den Gläubigern jedoch nur zu, wenn sie glaubhaft machen, dass durch die Verschmelzung die Erfüllung ihrer Forderung gefährdet wird."
    },
    {
      "date": "2024-11-23",
      "original_text": "Registerbekanntmachung nach dem Umwandlungsgesetz\nBayern Amtsgericht München HRB 140065\nDMG Beteiligungs GmbH – Münsing",
      "type": "Registerbekanntmachung nach dem Umwandlungsgesetz",
      "state": "Bayern",
      "amtsgericht": "Amtsgericht München",
      "registernummer": "HRB 140065",
      "registerart": "HRB",
      "company_name": "DMG Beteiligungs GmbH",
      "company_seat": "Münsing",
      "details": "23.11.2024 (Bekanntmachungsdatum)\n\nBayern Amtsgericht München HRB 140065\nRegisterbekanntmachung nach dem Umwandlungsgesetz 22.11.2024 (Eintragungsdatum)\n\nDMG Beteiligungs GmbH\nGesellschaft mit beschränkter Haftung\nMünsing\n\nDen Gläubigern der an der Spaltung beteiligten Rechtsträger ist, wenn sie binnen sechs Monaten nach dem Tag, an dem die Eintragung der Spaltung in das Register des Sitzes desjenigen Rechtsträgers, dessen Gläubiger sie sind, nach §§ 125, 19 Abs. 3 UmwG als bekannt gemacht gilt, ihren Anspruch nach Grund und Höhe schriftlich anmelden, Sicherheit zu leisten, soweit sie nicht Befriedigung verlangen können. Dieses Recht steht den Gläubigern jedoch nur zu, wenn sie glaubhaft machen, dass durch die Spaltung die Erfüllung ihrer Forderung gefährdet wird."
    },
    {
      "date": "2024-11-23",
      "original_text": "Registerbekanntmachung nach dem Umwandlungsgesetz\nBayern Amtsgericht Deggendorf HRB 4594\nHSN Verwaltungs GmbH – Deggendorf",
      "type": "Registerbekanntmachung nach dem Umwandlungsgesetz",
      "state": "Bayern",
      "amtsgericht": "Amtsgericht Deggendorf",
      "registernummer": "HRB 4594",
      "registerart": "HRB",
      "company_name": "HSN Verwaltungs GmbH",
      "company_seat": "Deggendorf",
      "details": "23.11.2024 (Bekanntmachungsdatum)\n\nBayern Amtsgericht Deggendorf HRB 4594\nRegisterbekanntmachung nach dem Umwandlungsgesetz 22.10.2024 (Eintragungsdatum)\n\nHSN Verwaltungs GmbH\nGesellschaft mit beschränkter Haftung\nDeggendorf\n\nDen Gläubigern der an der Verschmelzung beteiligten Rechtsträger ist, wenn sie binnen sechs Monaten nach dem Tag, an dem die Eintragung der Verschmelzung in das Register des Sitzes desjenigen Rechtsträgers, dessen Gläubiger sie sind, nach § 19 Abs. 3 UmwG als bekannt gemacht gilt, ihren Anspruch nach Grund und Höhe schriftlich anmelden, Sicherheit zu leisten, soweit sie nicht Befriedigung verlangen können. Dieses Recht steht den Gläubigern jedoch nur zu, wenn sie glaubhaft machen, dass durch die Verschmelzung die Erfüllung ihrer Forderung gefährdet wird."
    },
    {
      "date": "2024-11-23",
      "original_text": "Registerbekanntmachung nach dem Umwandlungsgesetz\nBayern Amtsgericht Fürth HRB 14250\nInterSolTec GmbH – Bad Windsheim",
      "type": "Registerbekanntmachung nach dem Umwandlungsgesetz",
      "state": "Bayern",
      "amtsgericht": "Amtsgericht Fürth",
      "registernummer": "HRB 14250",
      "registerart": "HRB",
      "company_name": "InterSolTec GmbH",
      "company_seat": "Bad Windsheim",
      "details": "23.11.2024 (Bekanntmachungsdatum)\n\nBayern Amtsgericht Fürth HRB 14250\nRegisterbekanntmachung nach dem Umwandlungsgesetz 22.11.2024 (Eintragungsdatum)\n\nInterSolTec GmbH\nGesellschaft mit beschränkter Haftung\nBad Windsheim\n\nDen Gläubigern der an der Verschmelzung beteiligten Rechtsträger ist, wenn sie binnen sechs Monaten nach dem Tag, an dem die Eintragung der Verschmelzung in das Register des Sitzes desjenigen Rechtsträgers, dessen Gläubiger sie sind, nach § 19 Abs. 3 UmwG als bekannt gemacht gilt, ihren Anspruch nach Grund und Höhe schriftlich anmelden, Sicherheit zu leisten, soweit sie nicht Befriedigung verlangen können. Dieses Recht steht den Gläubigern jedoch nur zu, wenn sie glaubhaft machen, dass durch die Verschmelzung die Erfüllung ihrer Forderung gefährdet wird."
    },
    {
      "date": "2024-11-23",
      "original_text": "Löschungsankündigung\nBayern Amtsgericht München HRB 241168\nInternational Trading GmbH – München",
      "type": "Löschungsankündigung",
      "state": "Bayern",
      "amtsgericht": "Amtsgericht München",
      "registernummer": "HRB 241168",
      "registerart": "HRB",
      "company_name": "International Trading GmbH",
      "company_seat": "München",
      "details": "23.11.2024 (Bekanntmachungsdatum)\n\nBayern Amtsgericht München HRB 241168\nLöschungsankündigung\n\nInternational Trading GmbH\nGesellschaft mit beschränkter Haftung\nMünchen\n\nDas Registergericht beabsichtigt, die im Handelsregister eingetragene Gesellschaft wegen Vermögenslosigkeit von Amts wegen nach § 394 FamFG zu löschen. Die Frist zur Erhebung eines Widerspruchs ist auf drei Monate festgesetzt."
    },
    {
      "date": "2024-11-23",
      "original_text": "Registerbekanntmachung nach dem Umwandlungsgesetz\nBayern Amtsgericht München HRB 296971\nM&C One GmbH – Grünwald",
      "type": "Registerbekanntmachung nach dem Umwandlungsgesetz",
      "state": "Bayern",
      "amtsgericht": "Amtsgericht München",
      "registernummer": "HRB 296971",
      "registerart": "HRB",
      "company_name": "M&C One GmbH",
      "company_seat": "Grünwald",
      "details": "23.11.2024 (Bekanntmachungsdatum)\n\nBayern Amtsgericht München HRB 296971\nRegisterbekanntmachung nach dem Umwandlungsgesetz 22.11.2024 (Eintragungsdatum)\n\nM&C One GmbH\nGesellschaft mit beschränkter Haftung\nGrünwald\n\nDen Gläubigern der an der Spaltung beteiligten Rechtsträger ist, wenn sie binnen sechs Monaten nach dem Tag, an dem die Eintragung der Spaltung in das Register des Sitzes desjenigen Rechtsträgers, dessen Gläubiger sie sind, nach §§ 125, 19 Abs. 3 UmwG als bekannt gemacht gilt, ihren Anspruch nach Grund und Höhe schriftlich anmelden, Sicherheit zu leisten, soweit sie nicht Befriedigung verlangen können. Dieses Recht steht den Gläubigern jedoch nur zu, wenn sie glaubhaft machen, dass durch die Spaltung die Erfüllung ihrer Forderung gefährdet wird."
    },
    {
      "date": "2024-11-23",
      "original_text": "Löschungsankündigung\nBayern Amtsgericht München HRB 43333\nRENA Maschinen- und Anlagenbau GmbH – Geretsried",
      "type": "Löschungsankündigung",
      "state": "Bayern",
      "amtsgericht": "Amtsgericht München",
      "registernummer": "HRB 43333",
      "registerart": "HRB",
      "company_name": "RENA Maschinen- und Anlagenbau GmbH",
      "company_seat": "Geretsried",
      "details": "23.11.2024 (Bekanntmachungsdatum)\n\nBayern Amtsgericht München HRB 43333\nLöschungsankündigung 22.11.2024 (Eintragungsdatum)\n\nRENA Maschinen- und Anlagenbau GmbH\nGesellschaft mit beschränkter Haftung\nGeretsried\n\nDas Registergericht beabsichtigt, die im Handelsregister eingetragene Gesellschaft wegen Vermögenslosigkeit von Amts wegen nach § 394 FamFG zu löschen. Die Frist zur Erhebung eines Widerspruchs ist auf drei Monate festgesetzt."
    },
    {
      "date": "2024-11-23",
      "original_text": "Registerbekanntmachung nach dem Umwandlungsgesetz\nBayern Amtsgericht Fürth HRB 14257\nROFRA Elektro - Energietechnik GmbH – Bad Windsheim",
      "type": "Registerbekanntmachung nach dem Umwandlungsgesetz",
      "state": "Bayern",
      "amtsgericht": "Amtsgericht Fürth",
      "registernummer": "HRB 14257",
      "registerart": "HRB",
      "company_name": "ROFRA Elektro - Energietechnik GmbH",
      "company_seat": "Bad Windsheim",
      "details": "23.11.2024 (Bekanntmachungsdatum)\n\nBayern Amtsgericht Fürth HRB 14257\nRegisterbekanntmachung nach dem Umwandlungsgesetz 22.11.2024 (Eintragungsdatum)\n\nROFRA Elektro - Energietechnik GmbH\nGesellschaft mit beschränkter Haftung\nBad Windsheim\n\nDen Gläubigern der an der Verschmelzung beteiligten Rechtsträger ist, wenn sie binnen sechs Monaten nach dem Tag, an dem die Eintragung der Verschmelzung in das Register des Sitzes desjenigen Rechtsträgers, dessen Gläubiger sie sind, nach § 19 Abs. 3 UmwG als bekannt gemacht gilt, ihren Anspruch nach Grund und Höhe schriftlich anmelden, Sicherheit zu leisten, soweit sie nicht Befriedigung verlangen können. Dieses Recht steht den Gläubigern jedoch nur zu, wenn sie glaubhaft machen, dass durch die Verschmelzung die Erfüllung ihrer Forderung gefährdet wird."
    },
    {
      "date": "2024-11-23",
      "original_text": "Registerbekanntmachung nach dem Umwandlungsgesetz\nBayern Amtsgericht Deggendorf HRB 4915\nRSD Grundstücks GmbH – Deggendorf",
      "type": "Registerbekanntmachung nach dem Umwandlungsgesetz",
      "state": "Bayern",
      "amtsgericht": "Amtsgericht Deggendorf",
      "registernummer": "HRB 4915",
      "registerart": "HRB",
      "company_name": "RSD Grundstücks GmbH",
      "company_seat": "Deggendorf",
      "details": "23.11.2024 (Bekanntmachungsdatum)\n\nBayern Amtsgericht Deggendorf HRB 4915\nRegisterbekanntmachung nach dem Umwandlungsgesetz 22.10.2024 (Eintragungsdatum)\n\nRSD Grundstücks GmbH\nGesellschaft mit beschränkter Haftung\nDeggendorf\n\nDen Gläubigern der an der Verschmelzung beteiligten Rechtsträger ist, wenn sie binnen sechs Monaten nach dem Tag, an dem die Eintragung der Verschmelzung in das Register des Sitzes desjenigen Rechtsträgers, dessen Gläubiger sie sind, nach § 19 Abs. 3 UmwG als bekannt gemacht gilt, ihren Anspruch nach Grund und Höhe schriftlich anmelden, Sicherheit zu leisten, soweit sie nicht Befriedigung verlangen können. Dieses Recht steht den Gläubigern jedoch nur zu, wenn sie glaubhaft machen, dass durch die Verschmelzung die Erfüllung ihrer Forderung gefährdet wird."
    },
    {
      "date": "2024-11-23",
      "original_text": "Löschungsankündigung\nBayern Amtsgericht München HRB 259871\nSHOWERTEC Trading GmbH – München",
      "type": "Löschungsankündigung",
      "state": "Bayern",
      "amtsgericht": "Amtsgericht München",
      "registernummer": "HRB 259871",
      "registerart": "HRB",
      "company_name": "SHOWERTEC Trading GmbH",
      "company_seat": "München",
      "details": "23.11.2024 (Bekanntmachungsdatum)\n\nBayern Amtsgericht München HRB 259871\nLöschungsankündigung\n\nSHOWERTEC Trading GmbH\nGesellschaft mit beschränkter Haftung\nMünchen\n\nDas Registergericht beabsichtigt, die im Handelsregister eingetragene Gesellschaft wegen Vermögenslosigkeit von Amts wegen nach § 394 FamFG zu löschen. Die Frist zur Erhebung eines Widerspruchs ist auf drei Monate festgesetzt."
    },
    {
      "date": "2024-11-23",
      "original_text": "Registerbekanntmachung nach dem Umwandlungsgesetz\nBayern Amtsgericht Weiden i. d. OPf. HRB 5824\nSPUR Technik GmbH – Weiden i.d.OPf.",
      "type": "Registerbekanntmachung nach dem Umwandlungsgesetz",
      "state": "Bayern",
      "amtsgericht": "Amtsgericht Weiden i. d. OPf.",
      "registernummer": "HRB 5824",
      "registerart": "HRB",
      "company_name": "SPUR Technik GmbH",
      "company_seat": "Weiden i.d.OPf.",
      "details": "23.11.2024 (Bekanntmachungsdatum)\n\nBayern Amtsgericht Weiden i. d. OPf. HRB 5824\nRegisterbekanntmachung nach dem Umwandlungsgesetz 22.11.2024 (Eintragungsdatum)\n\nSPUR Technik GmbH\nGesellschaft mit beschränkter Haftung\nWeiden i.d.OPf.\n\nDen Gläubigern des formwechselnden Rechtsträgers ist, wenn sie binnen sechs Monaten nach dem Tag, an dem die Eintragung des Formwechsels nach § 201 UmwG als bekannt gemacht gilt, ihren Anspruch nach Grund und Höhe schriftlich anmelden, Sicherheit zu leisten, soweit sie nicht Befriedigung verlangen können. Dieses Recht steht den Gläubigern jedoch nur zu, wenn sie glaubhaft machen, dass durch den Formwechsel die Erfüllung ihrer Forderung gefährdet wird."
    },
    {
      "date": "2024-11-23",
      "original_text": "Registerbekanntmachung nach dem Umwandlungsgesetz\nBayern Amtsgericht München HRB 209510\nSiemens Advanta Solutions GmbH – München",
      "type": "Registerbekanntmachung nach dem Umwandlungsgesetz",
      "state": "Bayern",
      "amtsgericht": "Amtsgericht München",
      "registernummer": "HRB 209510",
      "registerart": "HRB",
      "company_name": "Siemens Advanta Solutions GmbH",
      "company_seat": "München",
      "details": "23.11.2024 (Bekanntmachungsdatum)\n\nBayern Amtsgericht München HRB 209510\nRegisterbekanntmachung nach dem Umwandlungsgesetz 22.11.2024 (Eintragungsdatum)\n\nSiemens Advanta Solutions GmbH\nGesellschaft mit beschränkter Haftung\nMünchen\n\nDen Gläubigern der an der Ausgliederung beteiligten Rechtsträger ist, wenn sie binnen sechs Monaten nach dem Tag, an dem die Eintragung der Ausgliederung in das Register des Sitzes desjenigen Rechtsträgers, dessen Gläubiger sie sind, nach §§ 125, 19 Abs. 3 UmwG als bekannt gemacht gilt, ihren Anspruch nach Grund und Höhe schriftlich anmelden, Sicherheit zu leisten, soweit sie nicht Befriedigung verlangen können. Dieses Recht steht den Gläubigern jedoch nur zu, wenn sie glaubhaft machen, dass durch die Ausgliederung die Erfüllung ihrer Forderung gefährdet wird."
    },
    {
      "date": "2024-11-23",
      "original_text": "Registerbekanntmachung nach dem Umwandlungsgesetz\nBayern Amtsgericht München HRB 197885\nSixt International Services GmbH – Pullach i. Isartal",
      "type": "Registerbekanntmachung nach dem Umwandlungsgesetz",
      "state": "Bayern",
      "amtsgericht": "Amtsgericht München",
      "registernummer": "HRB 197885",
      "registerart": "HRB",
      "company_name": "Sixt International Services GmbH",
      "company_seat": "Pullach i. Isartal",
      "details": "23.11.2024 (Bekanntmachungsdatum)\n\nBayern Amtsgericht München HRB 197885\nRegisterbekanntmachung nach dem Umwandlungsgesetz 22.11.2024 (Eintragungsdatum)\n\nSixt International Services GmbH\nGesellschaft mit beschränkter Haftung\nPullach i. Isartal\n\nDen Gläubigern der an der Verschmelzung beteiligten Rechtsträger ist, wenn sie binnen sechs Monaten nach dem Tag, an dem die Eintragung der Verschmelzung in das Register des Sitzes desjenigen Rechtsträgers, dessen Gläubiger sie sind, nach § 19 Abs. 3 UmwG als bekannt gemacht gilt, ihren Anspruch nach Grund und Höhe schriftlich anmelden, Sicherheit zu leisten, soweit sie nicht Befriedigung verlangen können. Dieses Recht steht den Gläubigern jedoch nur zu, wenn sie glaubhaft machen, dass durch die Verschmelzung die Erfüllung ihrer Forderung gefährdet wird."
    },
    {
      "date": "2024-11-23",
      "original_text": "Registerbekanntmachung nach dem Umwandlungsgesetz\nBayern Amtsgericht Fürth GsR 231\nVolker und Steffen Koch eGbR – Herzogenaurach",
      "type": "Registerbekanntmachung nach dem Umwandlungsgesetz",
      "state": "Bayern",
      "amtsgericht": "Amtsgericht Fürth",
      "registernummer": "GsR 231",
      "registerart": "GsR",
      "company_name": "Volker und Steffen Koch eGbR",
      "company_seat": "Herzogenaurach",
      "details": "23.11.2024 (Bekanntmachungsdatum)\n\nBayern Amtsgericht Fürth GsR 231\nRegisterbekanntmachung nach dem Umwandlungsgesetz 22.11.2024 (Eintragungsdatum)\n\nVolker und Steffen Koch eGbR\nGesellschaft bürgerlichen Rechts\nHerzogenaurach\n\nDen Gläubigern des formwechselnden Rechtsträgers ist, wenn sie binnen sechs Monaten nach dem Tag, an dem die Eintragung des Formwechsels nach § 201 UmwG als bekannt gemacht gilt, ihren Anspruch nach Grund und Höhe schriftlich anmelden, Sicherheit zu leisten, soweit sie nicht Befriedigung verlangen können. Dieses Recht steht den Gläubigern jedoch nur zu, wenn sie glaubhaft machen, dass durch den Formwechsel die Erfüllung ihrer Forderung gefährdet wird."
    },
    {
      "date": "2024-11-23",
      "original_text": "Registerbekanntmachung nach dem Umwandlungsgesetz\nBayern Amtsgericht München HRB 244390\nWealthcap Objekt-Vorrat 25 Komplementär GmbH – München",
      "type": "Registerbekanntmachung nach dem Umwandlungsgesetz",
      "state": "Bayern",
      "amtsgericht": "Amtsgericht München",
      "registernummer": "HRB 244390",
      "registerart": "HRB",
      "company_name": "Wealthcap Objekt-Vorrat 25 Komplementär GmbH",
      "company_seat": "München",
      "details": "23.11.2024 (Bekanntmachungsdatum)\n\nBayern Amtsgericht München HRB 244390\nRegisterbekanntmachung nach dem Umwandlungsgesetz 22.11.2024 (Eintragungsdatum)\n\nWealthcap Objekt-Vorrat 25 Komplementär GmbH\nGesellschaft mit beschränkter Haftung\nMünchen\n\nDen Gläubigern der an der Verschmelzung beteiligten Rechtsträger ist, wenn sie binnen sechs Monaten nach dem Tag, an dem die Eintragung der Verschmelzung in das Register des Sitzes desjenigen Rechtsträgers, dessen Gläubiger sie sind, nach § 19 Abs. 3 UmwG als bekannt gemacht gilt, ihren Anspruch nach Grund und Höhe schriftlich anmelden, Sicherheit zu leisten, soweit sie nicht Befriedigung verlangen können. Dieses Recht steht den Gläubigern jedoch nur zu, wenn sie glaubhaft machen, dass durch die Verschmelzung die Erfüllung ihrer Forderung gefährdet wird."
    },
    {
      "date": "2024-11-23",
      "original_text": "Registerbekanntmachung nach dem Umwandlungsgesetz\nBayern Amtsgericht Nürnberg HRB 43778\nZollhof Betreiber GmbH – Nürnberg",
      "type": "Registerbekanntmachung nach dem Umwandlungsgesetz",
      "state": "Bayern",
      "amtsgericht": "Amtsgericht Nürnberg",
      "registernummer": "HRB 43778",
      "registerart": "HRB",
      "company_name": "Zollhof Betreiber GmbH",
      "company_seat": "Nürnberg",
      "details": "23.11.2024 (Bekanntmachungsdatum)\n\nBayern Amtsgericht Nürnberg HRB 43778\nRegisterbekanntmachung nach dem Umwandlungsgesetz 22.11.2024 (Eintragungsdatum)\n\nZollhof Betreiber GmbH\nGesellschaft mit beschränkter Haftung\nNürnberg\n\nDen Gläubigern der an der Ausgliederung beteiligten Rechtsträger ist, wenn sie binnen sechs Monaten nach dem Tag, an dem die Eintragung der Ausgliederung in das Register des Sitzes desjenigen Rechtsträgers, dessen Gläubiger sie sind, nach §§ 125, 19 Abs. 3 UmwG als bekannt gemacht gilt, ihren Anspruch nach Grund und Höhe schriftlich anmelden, Sicherheit zu leisten, soweit sie nicht Befriedigung verlangen können. Dieses Recht steht den Gläubigern jedoch nur zu, wenn sie glaubhaft machen, dass durch die Ausgliederung die Erfüllung ihrer Forderung gefährdet wird."
    },
    {
      "date": "2024-11-23",
      "original_text": "Registerbekanntmachung nach dem Umwandlungsgesetz\nBayern Amtsgericht Nürnberg HRB 33400\nZollhof Holding GmbH – Nürnberg",
      "type": "Registerbekanntmachung nach dem Umwandlungsgesetz",
      "state": "Bayern",
      "amtsgericht": "Amtsgericht Nürnberg",
      "registernummer": "HRB 33400",
      "registerart": "HRB",
      "company_name": "Zollhof Holding GmbH",
      "company_seat": "Nürnberg",
      "details": "23.11.2024 (Bekanntmachungsdatum)\n\nBayern Amtsgericht Nürnberg HRB 33400\nRegisterbekanntmachung nach dem Umwandlungsgesetz 22.11.2024 (Eintragungsdatum)\n\nZollhof Holding GmbH\nGesellschaft mit beschränkter Haftung\nNürnberg\n\nDen Gläubigern der an der Ausgliederung beteiligten Rechtsträger ist, wenn sie binnen sechs Monaten nach dem Tag, an dem die Eintragung der Ausgliederung in das Register des Sitzes desjenigen Rechtsträgers, dessen Gläubiger sie sind, nach §§ 125, 19 Abs. 3 UmwG als bekannt gemacht gilt, ihren Anspruch nach Grund und Höhe schriftlich anmelden, Sicherheit zu leisten, soweit sie nicht Befriedigung verlangen können. Dieses Recht steht den Gläubigern jedoch nur zu, wenn sie glaubhaft machen, dass durch die Ausgliederung die Erfüllung ihrer Forderung gefährdet wird."
    }
  ]
}