{
  "date": "2024-11-25",
  "date_of_scrape": "2024-11-26T04:07:39.269Z",
  "tool_version": "0.1.0",
  "number_of_announcements": 111,
  "announcements": [
    {
      "date": "2024-11-25",
      "original_text": "Registerbekanntmachung nach dem Umwandlungsgesetz\nHessen Amtsgericht Wiesbaden HRB 24224\n\"Dieter Frohnapfel Unternehmens- u. DV-Beratung GmbH\" – Wiesbaden",
      "type": "Registerbekanntmachung nach dem Umwandlungsgesetz",
      "state": "Hessen",
      "amtsgericht": "Amtsgericht Wiesbaden",
      "registernummer": "HRB 24224",
      "registerart": "HRB",
      "company_name": "\"Dieter Frohnapfel Unternehmens- u. DV-Beratung GmbH\"",
      "company_seat": "Wiesbaden",
      "details": "25.11.2024 (Bekanntmachungsdatum)\n\nHessen Amtsgericht Wiesbaden HRB 24224\nRegisterbekanntmachung nach dem Umwandlungsgesetz 25.11.2024 (Eintragungsdatum)\n\n\"Dieter Frohnapfel Unternehmens- u. DV-Beratung GmbH\"\nGesellschaft mit beschränkter Haftung\nWiesbaden\n\nDen Gläubigern der an der Verschmelzung beteiligten Rechtsträger ist, wenn sie binnen sechs Monaten nach dem Tag, an dem die Eintragung der Verschmelzung in das Register des Sitzes desjenigen Rechtsträgers, dessen Gläubiger sie sind, nach § 19 Absatz 3 UmwG bekannt gemacht worden ist, ihren Anspruch nach Grund und Höhe schriftlich anmelden, Sicherheit zu leisten, soweit sie nicht Befriedigung verlangen können. Dieses Recht steht den Gläubigern jedoch nur zu, wenn sie glaubhaft machen, dass durch die Verschmelzung die Erfüllung ihrer Forderung gefährdet wird."
    },
    {
      "date": "2024-11-25",
      "original_text": "Registerbekanntmachung nach dem Umwandlungsgesetz\nBaden-Württemberg Amtsgericht Stuttgart HRB 729059\nALPHA Premium GmbH – Leinfelden-Echterdingen",
      "type": "Registerbekanntmachung nach dem Umwandlungsgesetz",
      "state": "Baden-Württemberg",
      "amtsgericht": "Amtsgericht Stuttgart",
      "registernummer": "HRB 729059",
      "registerart": "HRB",
      "company_name": "ALPHA Premium GmbH",
      "company_seat": "Leinfelden-Echterdingen",
      "details": "25.11.2024 (Bekanntmachungsdatum)\n\nBaden-Württemberg Amtsgericht Stuttgart HRB 729059\nRegisterbekanntmachung nach dem Umwandlungsgesetz 25.11.2024 (Eintragungsdatum)\n\nALPHA Premium GmbH\nGesellschaft mit beschränkter Haftung\nLeinfelden-Echterdingen\n\nAls nicht eingetragen wird bekanntgemacht:\nDen Gläubigern des an dem Formwechsel beteiligten Rechtsträgers ist, wenn sie binnen sechs Monaten nach dem Tag, an dem die Eintragung des Formwechsels in das Register des Sitzes desjenigen Rechtsträgers, dessen Gläubiger sie sind, nach § 19 Abs. 3 UmwG als bekanntgemacht gilt, ihren Anspruch nach Grund und Höhe schriftlich anmelden, Sicherheit zu leisten, soweit sie nicht Befriedigung verlangen können. Dieses Recht steht den Gläubigern jedoch nur zu, wenn sie glaubhaft machen, dass durch den Formwechsel die Erfüllung ihrer Forderung gefährdet wird."
    },
    {
      "date": "2024-11-25",
      "original_text": "Löschungsankündigung\nSchleswig-Holstein Amtsgericht Kiel HRA 5528\nAgro Handel GmbH & Co. KG – Nortorf",
      "type": "Löschungsankündigung",
      "state": "Schleswig-Holstein",
      "amtsgericht": "Amtsgericht Kiel",
      "registernummer": "HRA 5528",
      "registerart": "HRA",
      "company_name": "Agro Handel GmbH & Co. KG",
      "company_seat": "Nortorf",
      "details": "25.11.2024 (Bekanntmachungsdatum)\n\nSchleswig-Holstein Amtsgericht Kiel HRA 5528\nLöschungsankündigung\n\nAgro Handel GmbH & Co. KG\nKommanditgesellschaft\nNortorf\n\nBei der nachstehenden Firma wird das Amtslöschungsverfahren gemäß § 31 Abs. 2 HGB eingeleitet. Widerspruchsfrist: 2 Monate."
    },
    {
      "date": "2024-11-25",
      "original_text": "Löschungsankündigung\nSachsen-Anhalt Amtsgericht Stendal GnR 1892\nAgrochemisches Zentrum Lindau i.L. – Lindau",
      "type": "Löschungsankündigung",
      "state": "Sachsen-Anhalt",
      "amtsgericht": "Amtsgericht Stendal",
      "registernummer": "GnR 1892",
      "registerart": "GnR",
      "company_name": "Agrochemisches Zentrum Lindau i.L.",
      "company_seat": "Lindau",
      "details": "25.11.2024 (Bekanntmachungsdatum)\n\nSachsen-Anhalt Amtsgericht Stendal GnR 1892\nLöschungsankündigung\n\nAgrochemisches Zentrum Lindau i.L.\neingetragene Genossenschaft\nLindau\n\nDas Registergericht beabsichtigt, nachfolgende Genossenschaft wegen Vermögenslosigkeit von Amts wegen nach § 394 FamFG zu löschen. Die Frist zur Erhebung eines Widerspruchs gegen die beabsichtigte Löschung wird auf drei Monate festgesetzt."
    },
    {
      "date": "2024-11-25",
      "original_text": "Löschungsankündigung\nHessen Amtsgericht Frankfurt am Main HRB 94464\nAirfreight Network Services Gesellschaft mit beschränkter Haftung – Kriftel",
      "type": "Löschungsankündigung",
      "state": "Hessen",
      "amtsgericht": "Amtsgericht Frankfurt am Main",
      "registernummer": "HRB 94464",
      "registerart": "HRB",
      "company_name": "Airfreight Network Services Gesellschaft mit beschränkter Haftung",
      "company_seat": "Kriftel",
      "details": "25.11.2024 (Bekanntmachungsdatum)\n\nHessen Amtsgericht Frankfurt am Main HRB 94464\nLöschungsankündigung\n\nAirfreight Network Services Gesellschaft mit beschränkter Haftung\nGesellschaft mit beschränkter Haftung\nKriftel\n\nDas Registergericht beabsichtigt die im Handelsregister eingetragene Gesellschaft von Amts wegen nach § 394 FamFG zu löschen. Die Frist zur Erhebung eines Widerspruchs gegen die beabsichtigte Löschung wird auf 3 Monate festgesetzt."
    },
    {
      "date": "2024-11-25",
      "original_text": "Registerbekanntmachung nach dem Umwandlungsgesetz\nNordrhein-Westfalen Amtsgericht Duisburg HRA 13537\nAndré Netzler e.K. – Mülheim an der Ruhr",
      "type": "Registerbekanntmachung nach dem Umwandlungsgesetz",
      "state": "Nordrhein-Westfalen",
      "amtsgericht": "Amtsgericht Duisburg",
      "registernummer": "HRA 13537",
      "registerart": "HRA",
      "company_name": "André Netzler e.K.",
      "company_seat": "Mülheim an der Ruhr",
      "details": "25.11.2024 (Bekanntmachungsdatum)\n\nNordrhein-Westfalen Amtsgericht Duisburg HRA 13537\nRegisterbekanntmachung nach dem Umwandlungsgesetz 25.11.2024 (Eintragungsdatum)\n\nAndré Netzler e.K.\nEinzelkaufmann / Einzelkauffrau\nMülheim an der Ruhr\n\nDie Gesellschaft hat Gläubigern, deren Forderungen vor dieser Bekanntmachung begründet worden sind, Sicherheit zu leisten, soweit sie nicht Befriedigung verlangen können, wenn sie sich binnen sechs Monaten zu diesem Zweck melden."
    },
    {
      "date": "2024-11-25",
      "original_text": "Registerbekanntmachung nach dem Umwandlungsgesetz\nMecklenburg-Vorpommern Amtsgericht Schwerin HRA 4639\nAnke Kniephoff-Schütt e.K. – Wismar",
      "type": "Registerbekanntmachung nach dem Umwandlungsgesetz",
      "state": "Mecklenburg-Vorpommern",
      "amtsgericht": "Amtsgericht Schwerin",
      "registernummer": "HRA 4639",
      "registerart": "HRA",
      "company_name": "Anke Kniephoff-Schütt e.K.",
      "company_seat": "Wismar",
      "details": "25.11.2024 (Bekanntmachungsdatum)\n\nMecklenburg-Vorpommern Amtsgericht Schwerin HRA 4639\nRegisterbekanntmachung nach dem Umwandlungsgesetz 25.11.2024 (Eintragungsdatum)\n\nAnke Kniephoff-Schütt e.K.\nEinzelkaufmann / Einzelkauffrau\nWismar\n\nAls nicht eingetragen wird veröffentlicht: Den Gläubigern der an der Ausgliederung beteiligten Rechtsträger ist, wenn sie binnen sechs Monaten nach dem Tag, an dem die Eintragung der Ausgliederung in das Register des Sitzes desjenigen Rechtsträgers, dessen Gläubiger sie sind, nach § 19 Abs. 3 UmwG als bekannt gemacht gilt, ihren Anspruch nach Grund und Höhe schriftlich anmelden,\nSicherheit zu leisten, soweit sie nicht Befriedigung verlangen können. Dieses Recht steht den Gläubigern jedoch nur zu, wenn sie glaubhaft machen, dass durch die Ausgliederung die Erfüllung der Forderung gefährdet wird."
    },
    {
      "date": "2024-11-25",
      "original_text": "Einreichung neuer Dokumente\nHamburg Amtsgericht Hamburg HRB 186826\nAntares Management SE – Hamburg",
      "type": "Einreichung neuer Dokumente",
      "state": "Hamburg",
      "amtsgericht": "Amtsgericht Hamburg",
      "registernummer": "HRB 186826",
      "registerart": "HRB",
      "company_name": "Antares Management SE",
      "company_seat": "Hamburg",
      "details": "25.11.2024 (Bekanntmachungsdatum)\n\nHamburg Amtsgericht Hamburg HRB 186826\nEinreichung neuer Dokumente\n\nAntares Management SE\nEuropäische Aktiengesellschaft (SE)\nHamburg\n\nAls nicht eingetragen wird bekannt gemacht: Liste des Aufsichtsrats wurde eingereicht."
    },
    {
      "date": "2024-11-25",
      "original_text": "Einreichung neuer Dokumente\nBaden-Württemberg Amtsgericht Mannheim HRB 737166\nAudiotainment Südwest Verwaltungs-GmbH – Mannheim",
      "type": "Einreichung neuer Dokumente",
      "state": "Baden-Württemberg",
      "amtsgericht": "Amtsgericht Mannheim",
      "registernummer": "HRB 737166",
      "registerart": "HRB",
      "company_name": "Audiotainment Südwest Verwaltungs-GmbH",
      "company_seat": "Mannheim",
      "details": "25.11.2024 (Bekanntmachungsdatum)\n\nBaden-Württemberg Amtsgericht Mannheim HRB 737166\nEinreichung neuer Dokumente\n\nAudiotainment Südwest Verwaltungs-GmbH\nGesellschaft mit beschränkter Haftung\nMannheim\n\nDie Gesellschaft hat am 21.11.2024 die Liste über die Zusammensetzung des Aufsichtsrats zum Handelsregister eingereicht."
    },
    {
      "date": "2024-11-25",
      "original_text": "Löschungsankündigung\nSchleswig-Holstein Amtsgericht Flensburg HRB 3287\nAutoland Harrislee GmbH – Harrislee",
      "type": "Löschungsankündigung",
      "state": "Schleswig-Holstein",
      "amtsgericht": "Amtsgericht Flensburg",
      "registernummer": "HRB 3287",
      "registerart": "HRB",
      "company_name": "Autoland Harrislee GmbH",
      "company_seat": "Harrislee",
      "details": "25.11.2024 (Bekanntmachungsdatum)\n\nSchleswig-Holstein Amtsgericht Flensburg HRB 3287\nLöschungsankündigung\n\nAutoland Harrislee GmbH\nGesellschaft mit beschränkter Haftung\nHarrislee\n\nEs ist die Löschung der nachstehenden Gesellschaft wegen Vermögenslosigkeit gemäß § 394 FamFG beabsichtigt.\nWiderspruchsfrist: 2 Monate."
    },
    {
      "date": "2024-11-25",
      "original_text": "Registerbekanntmachung nach dem Umwandlungsgesetz\nNordrhein-Westfalen Amtsgericht Bochum HRB 14746\nBENTO Performance GmbH – Bochum",
      "type": "Registerbekanntmachung nach dem Umwandlungsgesetz",
      "state": "Nordrhein-Westfalen",
      "amtsgericht": "Amtsgericht Bochum",
      "registernummer": "HRB 14746",
      "registerart": "HRB",
      "company_name": "BENTO Performance GmbH",
      "company_seat": "Bochum",
      "details": "25.11.2024 (Bekanntmachungsdatum)\n\nNordrhein-Westfalen Amtsgericht Bochum HRB 14746\nRegisterbekanntmachung nach dem Umwandlungsgesetz 21.11.2024 (Eintragungsdatum)\n\nBENTO Performance GmbH\nGesellschaft mit beschränkter Haftung\nBochum\n\nDen Gläubigern der an der Verschmelzung beteiligten Rechtsträger ist, wenn sie binnen sechs Monaten nach dem Tag, an dem die Eintragung der Verschmelzung in das Register des Sitzes derjenigen Rechtsträger deren Gläubiger sie sind, nach § 19 Absatz 3 UmwG als bekanntgemacht gilt, ihren Anspruch nach Grund und Höhe schriftlich anmelden, Sicherheit zu leisten, soweit sie nicht Befriedigung verlangen können. Dieses Recht steht den Gläubigern jedoch nur zu, wenn sie glaubhaft machen, dass durch die Verschmelzung die Erfüllung ihrer Forderung gefährdet wird."
    },
    {
      "date": "2024-11-25",
      "original_text": "Löschungsankündigung\nHessen Amtsgericht Frankfurt am Main HRB 108033\nBUZZER international GmbH – Frankfurt am Main",
      "type": "Löschungsankündigung",
      "state": "Hessen",
      "amtsgericht": "Amtsgericht Frankfurt am Main",
      "registernummer": "HRB 108033",
      "registerart": "HRB",
      "company_name": "BUZZER international GmbH",
      "company_seat": "Frankfurt am Main",
      "details": "25.11.2024 (Bekanntmachungsdatum)\n\nHessen Amtsgericht Frankfurt am Main HRB 108033\nLöschungsankündigung\n\nBUZZER international GmbH\nGesellschaft mit beschränkter Haftung\nFrankfurt am Main\n\nEs ist beabsichtigt die Gesellschaft wegen Vermögenslosigkeit gemäß § 394 FamFG von Amts wegen zu löschen. Hiergegen kann innerhalb eines Monats nach dieser Veröffentlichung Widerspruch bei dem Amtsgericht Frankfurt am Main eingelegt werden."
    },
    {
      "date": "2024-11-25",
      "original_text": "Einreichung neuer Dokumente\nNordrhein-Westfalen Amtsgericht Wuppertal HRB 3871\nBarmenia Versicherungen a.G. – Wuppertal",
      "type": "Einreichung neuer Dokumente",
      "state": "Nordrhein-Westfalen",
      "amtsgericht": "Amtsgericht Wuppertal",
      "registernummer": "HRB 3871",
      "registerart": "HRB",
      "company_name": "Barmenia Versicherungen a.G.",
      "company_seat": "Wuppertal",
      "details": "25.11.2024 (Bekanntmachungsdatum)\n\nNordrhein-Westfalen Amtsgericht Wuppertal HRB 3871\nEinreichung neuer Dokumente 25.11.2024 (Eintragungsdatum)\n\nBarmenia Versicherungen a.G.\nVersicherungsverein auf Gegenseitigkeit\nWuppertal\n\nDem Registergericht ist eine neue Liste der Mitglieder des Aufsichtsrates eingereicht worden."
    },
    {
      "date": "2024-11-25",
      "original_text": "Registerbekanntmachung nach dem Umwandlungsgesetz\nBaden-Württemberg Amtsgericht Stuttgart HRB 796591\nBerger Group GmbH – Korntal-Münchingen",
      "type": "Registerbekanntmachung nach dem Umwandlungsgesetz",
      "state": "Baden-Württemberg",
      "amtsgericht": "Amtsgericht Stuttgart",
      "registernummer": "HRB 796591",
      "registerart": "HRB",
      "company_name": "Berger Group GmbH",
      "company_seat": "Korntal-Münchingen",
      "details": "25.11.2024 (Bekanntmachungsdatum)\n\nBaden-Württemberg Amtsgericht Stuttgart HRB 796591\nRegisterbekanntmachung nach dem Umwandlungsgesetz 25.11.2024 (Eintragungsdatum)\n\nBerger Group GmbH\nGesellschaft mit beschränkter Haftung\nKorntal-Münchingen\n\nAls nicht eingetragen wird bekanntgemacht:\nDen Gläubigern der an der Ausgliederung beteiligten Rechtsträger ist, wenn sie binnen sechs Monaten nach dem Tag, an dem die Eintragung der Ausgliederung in das Register des Sitzes desjenigen Rechtsträgers, dessen Gläubiger sie sind, nach § 19 Abs. 3 UmwG als bekanntgemacht gilt, ihren Anspruch nach Grund und Höhe schriftlich anmelden, Sicherheit zu leisten, soweit sie nicht Befriedigung verlangen können. Dieses Recht steht den Gläubigern jedoch nur zu, wenn sie glaubhaft machen, dass durch die Ausgliederung die Erfüllung ihrer Forderung gefährdet wird."
    },
    {
      "date": "2024-11-25",
      "original_text": "Löschungsankündigung\nHessen Amtsgericht Offenbach am Main VR 573\nBiochemischer Gesundheitsverein Offenbach am Main – Offenbach am Main",
      "type": "Löschungsankündigung",
      "state": "Hessen",
      "amtsgericht": "Amtsgericht Offenbach am Main",
      "registernummer": "VR 573",
      "registerart": "VR",
      "company_name": "Biochemischer Gesundheitsverein Offenbach am Main",
      "company_seat": "Offenbach am Main",
      "details": "25.11.2024 (Bekanntmachungsdatum)\n\nHessen Amtsgericht Offenbach am Main VR 573\nLöschungsankündigung 20.03.2023 (Eintragungsdatum)\n\nBiochemischer Gesundheitsverein Offenbach am Main\neingetragener Verein\nOffenbach am Main\n\nDer Verein ist aufgelöst."
    },
    {
      "date": "2024-11-25",
      "original_text": "Löschungsankündigung\nThüringen Amtsgericht Jena HRB 110891\nCCC Customer Care Center Gesellschaft mit beschränkter Haftung – Erfurt",
      "type": "Löschungsankündigung",
      "state": "Thüringen",
      "amtsgericht": "Amtsgericht Jena",
      "registernummer": "HRB 110891",
      "registerart": "HRB",
      "company_name": "CCC Customer Care Center Gesellschaft mit beschränkter Haftung",
      "company_seat": "Erfurt",
      "details": "25.11.2024 (Bekanntmachungsdatum)\n\nThüringen Amtsgericht Jena HRB 110891\nLöschungsankündigung\n\nCCC Customer Care Center Gesellschaft mit beschränkter Haftung\nGesellschaft mit beschränkter Haftung\nErfurt\n\nDas Registergericht beabsichtigt, die im Handelsregister eingetragene Gesellschaft wegen Vermögenslosigkeit nach § 394 FamFG von Amts wegen zu löschen. Die Frist zur Erhebung eines Widerspruchs gegen die beabsichtigte Löschung wird auf 6 Wochen festgesetzt."
    },
    {
      "date": "2024-11-25",
      "original_text": "Registerbekanntmachung nach dem Umwandlungsgesetz\nHessen Amtsgericht Frankfurt am Main HRB 88649\nCOPiTOS ACADEMY GmbH – Frankfurt am Main",
      "type": "Registerbekanntmachung nach dem Umwandlungsgesetz",
      "state": "Hessen",
      "amtsgericht": "Amtsgericht Frankfurt am Main",
      "registernummer": "HRB 88649",
      "registerart": "HRB",
      "company_name": "COPiTOS ACADEMY GmbH",
      "company_seat": "Frankfurt am Main",
      "details": "25.11.2024 (Bekanntmachungsdatum)\n\nHessen Amtsgericht Frankfurt am Main HRB 88649\nRegisterbekanntmachung nach dem Umwandlungsgesetz 25.11.2024 (Eintragungsdatum)\n\nCOPiTOS ACADEMY GmbH\nGesellschaft mit beschränkter Haftung\nFrankfurt am Main\n\nDen Gläubigern der an der Verschmelzung beteiligten Rechtsträger ist, wenn sie binnen sechs Monaten nach dem Tag, an dem die Eintragung der Verschmelzung in das Register des Sitzes desjenigen Rechtsträgers, dessen Gläubiger sie sind, nach § 19 Absatz 3 UmwG bekannt gemacht worden ist, ihren Anspruch nach Grund und Höhe schriftlich anmelden, Sicherheit zu leisten, soweit sie nicht Befriedigung verlangen können. Dieses Recht steht den Gläubigern jedoch nur zu, wenn sie glaubhaft machen, dass durch die Verschmelzung die Erfüllung ihrer Forderung gefährdet wird."
    },
    {
      "date": "2024-11-25",
      "original_text": "Registerbekanntmachung nach dem Umwandlungsgesetz\nSachsen Amtsgericht Dresden HRB 16640\nCREAVAC-Creative Vakuumbeschichtung GmbH – Dresden",
      "type": "Registerbekanntmachung nach dem Umwandlungsgesetz",
      "state": "Sachsen",
      "amtsgericht": "Amtsgericht Dresden",
      "registernummer": "HRB 16640",
      "registerart": "HRB",
      "company_name": "CREAVAC-Creative Vakuumbeschichtung GmbH",
      "company_seat": "Dresden",
      "details": "25.11.2024 (Bekanntmachungsdatum)\n\nSachsen Amtsgericht Dresden HRB 16640\nRegisterbekanntmachung nach dem Umwandlungsgesetz 25.11.2024 (Eintragungsdatum)\n\nCREAVAC-Creative Vakuumbeschichtung GmbH\nGesellschaft mit beschränkter Haftung\nDresden\n\nDen Gläubigern der an der Umwandlung beteiligten Rechtsträger ist, wenn sie binnen sechs Monaten nach dem Tag, an dem die Eintragung der Umwandlung  in das Register des Sitzes desjenigen Rechtsträgers, dessen Gläubiger sie sind, nach § 19 Abs. 3 UmwG als bekannt gemacht gilt, ihren Anspruch nach Grund und Höhe schriftlich anmelden, Sicherheit zu leisten, soweit sie nicht Befriedigung verlangen können. Dieses Recht steht den Gläubigern jedoch nur zu, wenn sie glaubhaft machen, dass durch die Umwandlung die Erfüllung der Forderung gefährdet wird."
    },
    {
      "date": "2024-11-25",
      "original_text": "Löschungsankündigung\nNordrhein-Westfalen Amtsgericht Krefeld HRB 16931\nCS Combustion Solutions GmbH – Grefrath",
      "type": "Löschungsankündigung",
      "state": "Nordrhein-Westfalen",
      "amtsgericht": "Amtsgericht Krefeld",
      "registernummer": "HRB 16931",
      "registerart": "HRB",
      "company_name": "CS Combustion Solutions GmbH",
      "company_seat": "Grefrath",
      "details": "25.11.2024 (Bekanntmachungsdatum)\n\nNordrhein-Westfalen Amtsgericht Krefeld HRB 16931\nLöschungsankündigung\n\nCS Combustion Solutions GmbH\nGesellschaft mit beschränkter Haftung\nGrefrath\n\nDas Registergericht beabsichtigt die Gesellschaft von Amts wegen nach § 394 FamFG zu löschen. Die Frist zur Erhebung eines Widerspruchs ist auf einen Monat festgesetzt."
    },
    {
      "date": "2024-11-25",
      "original_text": "Löschungsankündigung\nBerlin Amtsgericht Berlin (Charlottenburg) HRB 170868\nClayallee FAS Service GmbH – Berlin",
      "type": "Löschungsankündigung",
      "state": "Berlin",
      "amtsgericht": "Amtsgericht Berlin (Charlottenburg)",
      "registernummer": "HRB 170868",
      "registerart": "HRB",
      "company_name": "Clayallee FAS Service GmbH",
      "company_seat": "Berlin",
      "details": "25.11.2024 (Bekanntmachungsdatum)\n\nBerlin Amtsgericht Berlin (Charlottenburg) HRB 170868\nLöschungsankündigung\n\nClayallee FAS Service GmbH\nGesellschaft mit beschränkter Haftung\nBerlin\n\nBei der nachstehenden Gesellschaft wird das Amtslöschungsverfahren gemäß § 394 FamFG eingeleitet. Widerspruchsfrist 6 Wochen."
    },
    {
      "date": "2024-11-25",
      "original_text": "Einreichung neuer Dokumente\nNiedersachsen Amtsgericht Hannover HRB 52030\nContiTech Antriebssysteme GmbH – Hannover",
      "type": "Einreichung neuer Dokumente",
      "state": "Niedersachsen",
      "amtsgericht": "Amtsgericht Hannover",
      "registernummer": "HRB 52030",
      "registerart": "HRB",
      "company_name": "ContiTech Antriebssysteme GmbH",
      "company_seat": "Hannover",
      "details": "25.11.2024 (Bekanntmachungsdatum)\n\nNiedersachsen Amtsgericht Hannover HRB 52030\nEinreichung neuer Dokumente\n\nContiTech Antriebssysteme GmbH\nGesellschaft mit beschränkter Haftung\nHannover\n\nDie Liste der Mitglieder des Aufsichtsrats wurde beim Registergericht eingereicht."
    },
    {
      "date": "2024-11-25",
      "original_text": "Registerbekanntmachung nach dem Umwandlungsgesetz\nBaden-Württemberg Amtsgericht Stuttgart HRB 758721\nDATAGROUP SE – Pliezhausen",
      "type": "Registerbekanntmachung nach dem Umwandlungsgesetz",
      "state": "Baden-Württemberg",
      "amtsgericht": "Amtsgericht Stuttgart",
      "registernummer": "HRB 758721",
      "registerart": "HRB",
      "company_name": "DATAGROUP SE",
      "company_seat": "Pliezhausen",
      "details": "25.11.2024 (Bekanntmachungsdatum)\n\nBaden-Württemberg Amtsgericht Stuttgart HRB 758721\nRegisterbekanntmachung nach dem Umwandlungsgesetz\n\nDATAGROUP SE\nEuropäische Aktiengesellschaft (SE)\nPliezhausen\n\nDie Gesellschaft hat am 21.11.2024 den Spaltungsvertrag vom 21.11.2024 zwischen \"DATAGROUP Business Solutions GmbH\", Siegburg (Amtsgericht Amtsgericht Siegburg HRB 10683)\nund der hiesigen Gesellschaft (übernehmender Rechtsträger) zum Handelsregister eingereicht."
    },
    {
      "date": "2024-11-25",
      "original_text": "Löschungsankündigung\nSachsen Amtsgericht Chemnitz HRB 36036\nDE Ewigkeit Progress International GmbH – Chemnitz",
      "type": "Löschungsankündigung",
      "state": "Sachsen",
      "amtsgericht": "Amtsgericht Chemnitz",
      "registernummer": "HRB 36036",
      "registerart": "HRB",
      "company_name": "DE Ewigkeit Progress International GmbH",
      "company_seat": "Chemnitz",
      "details": "25.11.2024 (Bekanntmachungsdatum)\n\nSachsen Amtsgericht Chemnitz HRB 36036\nLöschungsankündigung\n\nDE Ewigkeit Progress International GmbH\nGesellschaft mit beschränkter Haftung\nChemnitz\n\nDas Registergericht beabsichtigt, die im Handelsregister eingetragene Gesellschaft von Amts wegen nach § 394 FamFG zu löschen. Die Frist zu Erhebung eines Widerspruchs gegen die beabsichtigte Löschung wird auf einen Monat festgesetzt."
    },
    {
      "date": "2024-11-25",
      "original_text": "Löschungsankündigung\nBerlin Amtsgericht Berlin (Charlottenburg) HRB 155765\nDIV Deutsche Insolvenzverwertung GmbH – Berlin",
      "type": "Löschungsankündigung",
      "state": "Berlin",
      "amtsgericht": "Amtsgericht Berlin (Charlottenburg)",
      "registernummer": "HRB 155765",
      "registerart": "HRB",
      "company_name": "DIV Deutsche Insolvenzverwertung GmbH",
      "company_seat": "Berlin",
      "details": "25.11.2024 (Bekanntmachungsdatum)\n\nBerlin Amtsgericht Berlin (Charlottenburg) HRB 155765\nLöschungsankündigung\n\nDIV Deutsche Insolvenzverwertung GmbH\nGesellschaft mit beschränkter Haftung\nBerlin\n\nBei der nachstehenden Gesellschaft wird das Amtslöschungsverfahren gemäß § 394 FamFG eingeleitet. Widerspruchsfrist 6 Wochen"
    },
    {
      "date": "2024-11-25",
      "original_text": "Registerbekanntmachung nach dem Umwandlungsgesetz\nHamburg Amtsgericht Hamburg HRB 152868\nDROEGE HOLDING GmbH – Hamburg",
      "type": "Registerbekanntmachung nach dem Umwandlungsgesetz",
      "state": "Hamburg",
      "amtsgericht": "Amtsgericht Hamburg",
      "registernummer": "HRB 152868",
      "registerart": "HRB",
      "company_name": "DROEGE HOLDING GmbH",
      "company_seat": "Hamburg",
      "details": "25.11.2024 (Bekanntmachungsdatum)\n\nHamburg Amtsgericht Hamburg HRB 152868\nRegisterbekanntmachung nach dem Umwandlungsgesetz 25.11.2024 (Eintragungsdatum)\n\nDROEGE HOLDING GmbH\nGesellschaft mit beschränkter Haftung\nHamburg\n\nAls nicht eingetragen wird bekannt gemacht:\nDen Gläubigern der an der Verschmelzung beteiligten Gesellschaften ist, wenn sie binnen sechs Monaten nach dem Tag, an dem die Eintragung der Verschmelzung in das Register des Sitzes desjenigen Rechtsträgers, dessen Gläubiger sie sind, nach § 19 Absatz 3 UmwG als bekannt gemacht gilt, ihren Anspruch nach Grund und Höhe schriftlich anmelden, Sicherheit zu leisten, soweit sie nicht Befriedigung verlangen können. Dieses Recht steht den Gläubigern jedoch nur zu, wenn sie glaubhaft machen, dass durch die Verschmelzung die Erfüllung ihrer Forderung gefährdet wird."
    },
    {
      "date": "2024-11-25",
      "original_text": "Registerbekanntmachung nach dem Umwandlungsgesetz\nNordrhein-Westfalen Amtsgericht Düsseldorf HRA 27983\nDigitalberatung.NRW e.K. – Düsseldorf",
      "type": "Registerbekanntmachung nach dem Umwandlungsgesetz",
      "state": "Nordrhein-Westfalen",
      "amtsgericht": "Amtsgericht Düsseldorf",
      "registernummer": "HRA 27983",
      "registerart": "HRA",
      "company_name": "Digitalberatung.NRW e.K.",
      "company_seat": "Düsseldorf",
      "details": "25.11.2024 (Bekanntmachungsdatum)\n\nNordrhein-Westfalen Amtsgericht Düsseldorf HRA 27983\nRegisterbekanntmachung nach dem Umwandlungsgesetz 25.11.2024 (Eintragungsdatum)\n\nDigitalberatung.NRW e.K.\nEinzelkaufmann / Einzelkauffrau\nDüsseldorf\n\nDen Gläubigern der an der Ausgliederung beteiligten Rechtsträger ist, wenn sie binnen sechs Monaten nach dem Tag, an dem die Eintragung der Ausgliederung in das Register des Sitzes desjenigen Rechtsträgers, dessen Gläubiger sie sind, nach § 19 Absatz 3 UmwG als bekanntgemacht gilt, ihren Anspruch nach Grund und Höhe schriftlich anmelden, Sicherheit zu leisten, soweit sie nicht Befriedigung verlangen können. Dieses Recht steht den Gläubigern jedoch nur zu, wenn sie glaubhaft machen, dass durch die Ausgliederung die Erfüllung ihrer Forderung gefährdet wird."
    },
    {
      "date": "2024-11-25",
      "original_text": "Löschungsankündigung\nNordrhein-Westfalen Amtsgericht Arnsberg HRB 11767\nDiklea GmbH – Werl",
      "type": "Löschungsankündigung",
      "state": "Nordrhein-Westfalen",
      "amtsgericht": "Amtsgericht Arnsberg",
      "registernummer": "HRB 11767",
      "registerart": "HRB",
      "company_name": "Diklea GmbH",
      "company_seat": "Werl",
      "details": "25.11.2024 (Bekanntmachungsdatum)\n\nNordrhein-Westfalen Amtsgericht Arnsberg HRB 11767\nLöschungsankündigung\n\nDiklea GmbH\nGesellschaft mit beschränkter Haftung\nWerl\n\nDas Registergericht beabsichtigt die Gesellschaft von Amts wegen nach § 394 FamFG zu löschen. Die Frist zur Erhebung eines Widerspruchs ist auf einen Monat festgesetzt."
    },
    {
      "date": "2024-11-25",
      "original_text": "Löschungsankündigung\nNiedersachsen Amtsgericht Osnabrück HRB 205162\nEnTeThe GmbH – Bad Essen",
      "type": "Löschungsankündigung",
      "state": "Niedersachsen",
      "amtsgericht": "Amtsgericht Osnabrück",
      "registernummer": "HRB 205162",
      "registerart": "HRB",
      "company_name": "EnTeThe GmbH",
      "company_seat": "Bad Essen",
      "details": "25.11.2024 (Bekanntmachungsdatum)\n\nNiedersachsen Amtsgericht Osnabrück HRB 205162\nLöschungsankündigung 25.11.2024 (Eintragungsdatum)\n\nEnTeThe GmbH\nGesellschaft mit beschränkter Haftung\nBad Essen\n\nDas Registergericht beabsichtigt, die Gesellschaft von Amts wegen nach § 394 FamFG wegen Vermögenslosigkeit zu löschen. Die Frist zur Erhebung eines Widerspruchs ist auf 1 Monat ab dieser Registerbekanntmachung festgesetzt."
    },
    {
      "date": "2024-11-25",
      "original_text": "Einreichung neuer Dokumente\nHamburg Amtsgericht Hamburg HRB 162517\nF&P Executive Solutions AG – Hamburg",
      "type": "Einreichung neuer Dokumente",
      "state": "Hamburg",
      "amtsgericht": "Amtsgericht Hamburg",
      "registernummer": "HRB 162517",
      "registerart": "HRB",
      "company_name": "F&P Executive Solutions AG",
      "company_seat": "Hamburg",
      "details": "25.11.2024 (Bekanntmachungsdatum)\n\nHamburg Amtsgericht Hamburg HRB 162517\nEinreichung neuer Dokumente\n\nF&P Executive Solutions AG\nAktiengesellschaft\nHamburg\n\nAls nicht eingetragen wird bekannt gemacht: Liste des Aufsichtsrats wurde eingereicht."
    },
    {
      "date": "2024-11-25",
      "original_text": "Registerbekanntmachung nach dem Umwandlungsgesetz\nBaden-Württemberg Amtsgericht Mannheim HRB 751117\nFB-VD GmbH – Mönsheim",
      "type": "Registerbekanntmachung nach dem Umwandlungsgesetz",
      "state": "Baden-Württemberg",
      "amtsgericht": "Amtsgericht Mannheim",
      "registernummer": "HRB 751117",
      "registerart": "HRB",
      "company_name": "FB-VD GmbH",
      "company_seat": "Mönsheim",
      "details": "25.11.2024 (Bekanntmachungsdatum)\n\nBaden-Württemberg Amtsgericht Mannheim HRB 751117\nRegisterbekanntmachung nach dem Umwandlungsgesetz 25.11.2024 (Eintragungsdatum)\n\nFB-VD GmbH\nGesellschaft mit beschränkter Haftung\nMönsheim\n\nDen Gläubigern der an der Ausgliederung beteiligten Rechtsträger ist, wenn sie binnen sechs Monaten nach dem Tag, an dem die Eintragung der Ausgliederung in das Register des Sitzes desjenigen Rechtsträgers, dessen Gläubiger sie sind, nach § 19 Abs. 3 UmwG als bekanntgemacht gilt, ihren Anspruch nach Grund und Höhe schriftlich anmelden, Sicherheit zu leisten, soweit sie nicht Befriedigung verlangen können. Dieses Recht steht den Gläubigern jedoch nur zu, wenn sie glaubhaft machen, dass durch die Ausgliederung die Erfüllung ihrer Forderung gefährdet wird."
    },
    {
      "date": "2024-11-25",
      "original_text": "Registerbekanntmachung nach dem Umwandlungsgesetz\nBaden-Württemberg Amtsgericht Mannheim HRB 725174\nFBM GmbH – Mönsheim",
      "type": "Registerbekanntmachung nach dem Umwandlungsgesetz",
      "state": "Baden-Württemberg",
      "amtsgericht": "Amtsgericht Mannheim",
      "registernummer": "HRB 725174",
      "registerart": "HRB",
      "company_name": "FBM GmbH",
      "company_seat": "Mönsheim",
      "details": "25.11.2024 (Bekanntmachungsdatum)\n\nBaden-Württemberg Amtsgericht Mannheim HRB 725174\nRegisterbekanntmachung nach dem Umwandlungsgesetz 25.11.2024 (Eintragungsdatum)\n\nFBM GmbH\nGesellschaft mit beschränkter Haftung\nMönsheim\n\nDen Gläubigern der an der Ausgliederung beteiligten Rechtsträger ist, wenn sie binnen sechs Monaten nach dem Tag, an dem die Eintragung der Ausgliederung in das Register des Sitzes desjenigen Rechtsträgers, dessen Gläubiger sie sind, nach § 19 Abs. 3 UmwG als bekanntgemacht gilt, ihren Anspruch nach Grund und Höhe schriftlich anmelden, Sicherheit zu leisten, soweit sie nicht Befriedigung verlangen können. Dieses Recht steht den Gläubigern jedoch nur zu, wenn sie glaubhaft machen, dass durch die Ausgliederung die Erfüllung ihrer Forderung gefährdet wird."
    },
    {
      "date": "2024-11-25",
      "original_text": "Registerbekanntmachung nach dem Umwandlungsgesetz\nNordrhein-Westfalen Amtsgericht Iserlohn HRB 6419\nFCNP - HOLDING GmbH – Lüdenscheid",
      "type": "Registerbekanntmachung nach dem Umwandlungsgesetz",
      "state": "Nordrhein-Westfalen",
      "amtsgericht": "Amtsgericht Iserlohn",
      "registernummer": "HRB 6419",
      "registerart": "HRB",
      "company_name": "FCNP - HOLDING GmbH",
      "company_seat": "Lüdenscheid",
      "details": "25.11.2024 (Bekanntmachungsdatum)\n\nNordrhein-Westfalen Amtsgericht Iserlohn HRB 6419\nRegisterbekanntmachung nach dem Umwandlungsgesetz\n\nFCNP - HOLDING GmbH\nGesellschaft mit beschränkter Haftung\nLüdenscheid\n\nDem Registergericht ist der Entwurf eines Spaltungsplans eingereicht worden über die beabsichtigte Abspaltung der Geschäftsanteile der FCNP - HOLDING GmbH an der BAPO Beteiligungs GmbH, einer Gesellschaft mit beschränkter Haftung österreichischen Rechts, eingetragen im Firmenbuch des Landesgerichts Wiener Neustadt unter FN 630822 f als übertragender Rechtsträger als Gesamtheit mit allen Rechten und Pflichten zur Neugründung nach den Vorschriften betreffend die Spaltung von Kapitalgesellschaften aus verschiedenen Mitgliedstaaten der Europäischen Union auf die dadurch neu gegründete OT 3008 Beteiligungen und Management GmbH, eine Gesellschaft mit beschränkter Haftung österreichischen Rechts, mit satzungsmäßigem Sitz in Berndorf (Österreich) und einem Stammkapital von EUR 10.000,00."
    },
    {
      "date": "2024-11-25",
      "original_text": "Löschungsankündigung\nBrandenburg Amtsgericht Potsdam HRB 36810\nFahrer-Campus GmbH – Großbeeren",
      "type": "Löschungsankündigung",
      "state": "Brandenburg",
      "amtsgericht": "Amtsgericht Potsdam",
      "registernummer": "HRB 36810",
      "registerart": "HRB",
      "company_name": "Fahrer-Campus GmbH",
      "company_seat": "Großbeeren",
      "details": "25.11.2024 (Bekanntmachungsdatum)\n\nBrandenburg Amtsgericht Potsdam HRB 36810\nLöschungsankündigung\n\nFahrer-Campus GmbH\nGesellschaft mit beschränkter Haftung\nGroßbeeren\n\nBei der nachstehenden Gesellschaft wird das Amtslöschungsverfahren gemäß § 394 FamFG eingeleitet. Widerspruchsfrist: 8 Wochen."
    },
    {
      "date": "2024-11-25",
      "original_text": "Registerbekanntmachung nach dem Umwandlungsgesetz\nHessen Amtsgericht Wiesbaden HRB 11814\nFalkatus GmbH – Wiesbaden",
      "type": "Registerbekanntmachung nach dem Umwandlungsgesetz",
      "state": "Hessen",
      "amtsgericht": "Amtsgericht Wiesbaden",
      "registernummer": "HRB 11814",
      "registerart": "HRB",
      "company_name": "Falkatus GmbH",
      "company_seat": "Wiesbaden",
      "details": "25.11.2024 (Bekanntmachungsdatum)\n\nHessen Amtsgericht Wiesbaden HRB 11814\nRegisterbekanntmachung nach dem Umwandlungsgesetz 25.11.2024 (Eintragungsdatum)\n\nFalkatus GmbH\nGesellschaft mit beschränkter Haftung\nWiesbaden\n\nDen Gläubigern der an der formwechselnden Umwandlung beteiligten Rechtsträger ist, wenn sie binnen sechs Monaten nach dem Tag, an dem die Eintragung der formwechselnden Umwandlung in das Register des Sitzes desjenigen Rechtsträgers, dessen Gläubiger sie sind, nach § 201 UmwG bekannt gemacht worden ist, ihren Anspruch nach Grund und Höhe schriftlich anmelden, Sicherheit zu leisten, soweit sie nicht Befriedigung verlangen können. Dieses Recht steht den Gläubigern jedoch nur zu, wenn sie glaubhaft machen, dass durch die formwechselnden Umwandlung die Erfüllung ihrer Forderung gefährdet wird."
    },
    {
      "date": "2024-11-25",
      "original_text": "Registerbekanntmachung nach dem Umwandlungsgesetz\nNordrhein-Westfalen Amtsgericht Bonn HRB 25819\nFor You Verwaltungs GmbH – Weilerswist",
      "type": "Registerbekanntmachung nach dem Umwandlungsgesetz",
      "state": "Nordrhein-Westfalen",
      "amtsgericht": "Amtsgericht Bonn",
      "registernummer": "HRB 25819",
      "registerart": "HRB",
      "company_name": "For You Verwaltungs GmbH",
      "company_seat": "Weilerswist",
      "details": "25.11.2024 (Bekanntmachungsdatum)\n\nNordrhein-Westfalen Amtsgericht Bonn HRB 25819\nRegisterbekanntmachung nach dem Umwandlungsgesetz 25.11.2024 (Eintragungsdatum)\n\nFor You Verwaltungs GmbH\nGesellschaft mit beschränkter Haftung\nWeilerswist\n\nDen Gläubigern der an der Verschmelzung beteiligten Rechtsträger ist, wenn sie binnen sechs Monaten nach dem Tag, an dem die Eintragung der Verschmelzung in das Register des Sitzes desjenigen Rechtsträgers, dessen Gläubiger sie sind, nach § 19 Absatz 3 UmwG als bekanntgemacht gilt, ihren Anspruch nach Grund und Höhe schriftlich anmelden, Sicherheit zu leisten, soweit sie nicht Befriedigung verlangen können. Dieses Recht steht den Gläubigern jedoch nur zu, wenn sie glaubhaft machen, dass durch die Verschmelzung die Erfüllung ihrer Forderung gefährdet wird."
    },
    {
      "date": "2024-11-25",
      "original_text": "Registerbekanntmachung nach dem Umwandlungsgesetz\nBaden-Württemberg Amtsgericht Mannheim HRA 706943\nFriedrich Binder GmbH & Co. KG – Mönsheim",
      "type": "Registerbekanntmachung nach dem Umwandlungsgesetz",
      "state": "Baden-Württemberg",
      "amtsgericht": "Amtsgericht Mannheim",
      "registernummer": "HRA 706943",
      "registerart": "HRA",
      "company_name": "Friedrich Binder GmbH & Co. KG",
      "company_seat": "Mönsheim",
      "details": "25.11.2024 (Bekanntmachungsdatum)\n\nBaden-Württemberg Amtsgericht Mannheim HRA 706943\nRegisterbekanntmachung nach dem Umwandlungsgesetz 25.11.2024 (Eintragungsdatum)\n\nFriedrich Binder GmbH & Co. KG\nKommanditgesellschaft\nMönsheim\n\nAls nicht eingetragen wird bekanntgemacht:\nDen Gläubigern der an der Ausgliederung beteiligten Rechtsträger ist, wenn sie binnen sechs Monaten nach dem Tag, an dem die Eintragung der Ausgliederung in das Register des Sitzes desjenigen Rechtsträgers, dessen Gläubiger sie sind, nach § 19 Abs. 3 UmwG als bekanntgemacht gilt, ihren Anspruch nach Grund und Höhe schriftlich anmelden, Sicherheit zu leisten, soweit sie nicht Befriedigung verlangen können. Dieses Recht steht den Gläubigern jedoch nur zu, wenn sie glaubhaft machen, dass durch die Ausgliederung die Erfüllung ihrer Forderung gefährdet wird."
    },
    {
      "date": "2024-11-25",
      "original_text": "Registerbekanntmachung nach dem Umwandlungsgesetz\nBaden-Württemberg Amtsgericht Mannheim HRA 706943\nFriedrich Binder GmbH & Co. KG – Mönsheim",
      "type": "Registerbekanntmachung nach dem Umwandlungsgesetz",
      "state": "Baden-Württemberg",
      "amtsgericht": "Amtsgericht Mannheim",
      "registernummer": "HRA 706943",
      "registerart": "HRA",
      "company_name": "Friedrich Binder GmbH & Co. KG",
      "company_seat": "Mönsheim",
      "details": "25.11.2024 (Bekanntmachungsdatum)\n\nBaden-Württemberg Amtsgericht Mannheim HRA 706943\nRegisterbekanntmachung nach dem Umwandlungsgesetz 25.11.2024 (Eintragungsdatum)\n\nFriedrich Binder GmbH & Co. KG\nKommanditgesellschaft\nMönsheim\n\nAls nicht eingetragen wird bekanntgemacht:\nDen Gläubigern der an der Ausgliederung beteiligten Rechtsträger ist, wenn sie binnen sechs Monaten nach dem Tag, an dem die Eintragung der Ausgliederung in das Register des Sitzes desjenigen Rechtsträgers, dessen Gläubiger sie sind, nach § 19 Abs. 3 UmwG als bekanntgemacht gilt, ihren Anspruch nach Grund und Höhe schriftlich anmelden, Sicherheit zu leisten, soweit sie nicht Befriedigung verlangen können. Dieses Recht steht den Gläubigern jedoch nur zu, wenn sie glaubhaft machen, dass durch die Ausgliederung die Erfüllung ihrer Forderung gefährdet wird."
    },
    {
      "date": "2024-11-25",
      "original_text": "Löschungsankündigung\nBrandenburg Amtsgericht Potsdam HRB 19589\nFünfte Garden Grundstücks GmbH – Kloster Lehnin",
      "type": "Löschungsankündigung",
      "state": "Brandenburg",
      "amtsgericht": "Amtsgericht Potsdam",
      "registernummer": "HRB 19589",
      "registerart": "HRB",
      "company_name": "Fünfte Garden Grundstücks GmbH",
      "company_seat": "Kloster Lehnin",
      "details": "25.11.2024 (Bekanntmachungsdatum)\n\nBrandenburg Amtsgericht Potsdam HRB 19589\nLöschungsankündigung\n\nFünfte Garden Grundstücks GmbH\nGesellschaft mit beschränkter Haftung\nKloster Lehnin\n\nBei der nachstehenden Gesellschaft wird das Amtslöschungsverfahren gemäß § 394 FamFG eingeleitet. Widerspruchsfrist 8 Wochen."
    },
    {
      "date": "2024-11-25",
      "original_text": "Einreichung neuer Dokumente\nBerlin Amtsgericht Berlin (Charlottenburg) HRB 188372\nGB infraVelo GmbH – Berlin",
      "type": "Einreichung neuer Dokumente",
      "state": "Berlin",
      "amtsgericht": "Amtsgericht Berlin (Charlottenburg)",
      "registernummer": "HRB 188372",
      "registerart": "HRB",
      "company_name": "GB infraVelo GmbH",
      "company_seat": "Berlin",
      "details": "25.11.2024 (Bekanntmachungsdatum)\n\nBerlin Amtsgericht Berlin (Charlottenburg) HRB 188372\nEinreichung neuer Dokumente\n\nGB infraVelo GmbH\nGesellschaft mit beschränkter Haftung\nBerlin\n\nAls nicht eingetragen wird veröffentlicht:Es wurde eine neue Liste der Aufsichtsratsmitglieder eingereicht (§52 GmbHG)."
    },
    {
      "date": "2024-11-25",
      "original_text": "Löschungsankündigung\nBerlin Amtsgericht Berlin (Charlottenburg) HRB 211546\nGDI GmbH – Berlin",
      "type": "Löschungsankündigung",
      "state": "Berlin",
      "amtsgericht": "Amtsgericht Berlin (Charlottenburg)",
      "registernummer": "HRB 211546",
      "registerart": "HRB",
      "company_name": "GDI GmbH",
      "company_seat": "Berlin",
      "details": "25.11.2024 (Bekanntmachungsdatum)\n\nBerlin Amtsgericht Berlin (Charlottenburg) HRB 211546\nLöschungsankündigung\n\nGDI GmbH\nGesellschaft mit beschränkter Haftung\nBerlin\n\nBei der nachstehenden Gesellschaft wird das Amtslöschungsverfahren gemäß § 394 FamFG eingeleitet. Widerspruchsfrist 6 Wochen"
    },
    {
      "date": "2024-11-25",
      "original_text": "Registerbekanntmachung nach dem Umwandlungsgesetz\nHamburg Amtsgericht Hamburg HRB 167551\nGGW Group GmbH – Hamburg",
      "type": "Registerbekanntmachung nach dem Umwandlungsgesetz",
      "state": "Hamburg",
      "amtsgericht": "Amtsgericht Hamburg",
      "registernummer": "HRB 167551",
      "registerart": "HRB",
      "company_name": "GGW Group GmbH",
      "company_seat": "Hamburg",
      "details": "25.11.2024 (Bekanntmachungsdatum)\n\nHamburg Amtsgericht Hamburg HRB 167551\nRegisterbekanntmachung nach dem Umwandlungsgesetz 25.11.2024 (Eintragungsdatum)\n\nGGW Group GmbH\nGesellschaft mit beschränkter Haftung\nHamburg\n\nAls nicht eingetragen wird bekannt gemacht:\nDen Gläubigern der an der Verschmelzung beteiligten Gesellschaften ist, wenn sie binnen sechs Monaten nach dem Tag, an dem die Eintragung der Verschmelzung in das Register des Sitzes desjenigen Rechtsträgers, dessen Gläubiger sie sind, nach § 19 Absatz 3 UmwG als bekannt gemacht gilt, ihren Anspruch nach Grund und Höhe schriftlich anmelden, Sicherheit zu leisten, soweit sie nicht Befriedigung verlangen können. Dieses Recht steht den Gläubigern jedoch nur zu, wenn sie glaubhaft machen, dass durch die Verschmelzung die Erfüllung ihrer Forderung gefährdet wird."
    },
    {
      "date": "2024-11-25",
      "original_text": "Einreichung neuer Dokumente\nBaden-Württemberg Amtsgericht Mannheim HRB 502113\nGanztagesschule Pforzheim GmbH – Pforzheim",
      "type": "Einreichung neuer Dokumente",
      "state": "Baden-Württemberg",
      "amtsgericht": "Amtsgericht Mannheim",
      "registernummer": "HRB 502113",
      "registerart": "HRB",
      "company_name": "Ganztagesschule Pforzheim GmbH",
      "company_seat": "Pforzheim",
      "details": "25.11.2024 (Bekanntmachungsdatum)\n\nBaden-Württemberg Amtsgericht Mannheim HRB 502113\nEinreichung neuer Dokumente 21.11.2024 (Eintragungsdatum)\n\nGanztagesschule Pforzheim GmbH\nGesellschaft mit beschränkter Haftung\nPforzheim\n\nDie Gesellschaft hat am 21.11.2024 die Liste über die Zusammensetzung des Aufsichtsrats zum Handelsregister eingereicht."
    },
    {
      "date": "2024-11-25",
      "original_text": "Löschungsankündigung\nBaden-Württemberg Amtsgericht Stuttgart HRB 763998\nGlobal Metal Trader GmbH – Stuttgart",
      "type": "Löschungsankündigung",
      "state": "Baden-Württemberg",
      "amtsgericht": "Amtsgericht Stuttgart",
      "registernummer": "HRB 763998",
      "registerart": "HRB",
      "company_name": "Global Metal Trader GmbH",
      "company_seat": "Stuttgart",
      "details": "25.11.2024 (Bekanntmachungsdatum)\n\nBaden-Württemberg Amtsgericht Stuttgart HRB 763998\nLöschungsankündigung\n\nGlobal Metal Trader GmbH\nGesellschaft mit beschränkter Haftung\nStuttgart\n\nAls nicht eingetragen wird bekanntgemacht:\nDas Gericht beabsichtigt, die Gesellschaft wegen Vermögenslosigkeit im Handelsregister von Amts wegen nach § 394 FamFG zu löschen. Die Frist zur Geltendmachung eines Widerspruchs gegen die beabsichtigte Löschung ist auf zwei Monate ab Veröffentlichung bestimmt."
    },
    {
      "date": "2024-11-25",
      "original_text": "Löschungsankündigung\nBaden-Württemberg Amtsgericht Freiburg HRB 726395\nGodan´s Immobilien UG haftungsbeschränkt) – Jestetten",
      "type": "Löschungsankündigung",
      "state": "Baden-Württemberg",
      "amtsgericht": "Amtsgericht Freiburg",
      "registernummer": "HRB 726395",
      "registerart": "HRB",
      "company_name": "Godan´s Immobilien UG haftungsbeschränkt)",
      "company_seat": "Jestetten",
      "details": "25.11.2024 (Bekanntmachungsdatum)\n\nBaden-Württemberg Amtsgericht Freiburg HRB 726395\nLöschungsankündigung 25.11.2024 (Eintragungsdatum)\n\nGodan´s Immobilien UG haftungsbeschränkt)\nGesellschaft mit beschränkter Haftung\nJestetten\n\nAls nicht eingetragen wird bekanntgemacht:\nDas Gericht beabsichtigt, die Gesellschaft wegen Vermögenslosigkeit im Handelsregister von Amts wegen nach § 394 FamFG zu löschen. Die Frist zur Geltendmachung eines Widerspruchs gegen die beabsichtigte Löschung ist auf einen Monat ab Veröffentlichung bestimmt."
    },
    {
      "date": "2024-11-25",
      "original_text": "Löschungsankündigung\nNiedersachsen Amtsgericht Osnabrück HRB 214534\nGrünewelt Photovoltaik + Heizungstechnik UG (haftungsbeschränkt) – Sögel",
      "type": "Löschungsankündigung",
      "state": "Niedersachsen",
      "amtsgericht": "Amtsgericht Osnabrück",
      "registernummer": "HRB 214534",
      "registerart": "HRB",
      "company_name": "Grünewelt Photovoltaik + Heizungstechnik UG (haftungsbeschränkt)",
      "company_seat": "Sögel",
      "details": "25.11.2024 (Bekanntmachungsdatum)\n\nNiedersachsen Amtsgericht Osnabrück HRB 214534\nLöschungsankündigung 25.11.2024 (Eintragungsdatum)\n\nGrünewelt Photovoltaik + Heizungstechnik UG (haftungsbeschränkt)\nGesellschaft mit beschränkter Haftung\nSögel\n\nDas Registergericht beabsichtigt, die Gesellschaft von Amts wegen nach § 394 FamFG wegen Vermögenslosigkeit zu löschen. Die Frist zur Erhebung eines Widerspruchs ist auf 1 Monat ab dieser Registerbekanntmachung festgesetzt."
    },
    {
      "date": "2024-11-25",
      "original_text": "Registerbekanntmachung nach dem Umwandlungsgesetz\nRheinland-Pfalz Amtsgericht Koblenz GsR 216\nGuski-Link-eGbR – Kettig",
      "type": "Registerbekanntmachung nach dem Umwandlungsgesetz",
      "state": "Rheinland-Pfalz",
      "amtsgericht": "Amtsgericht Koblenz",
      "registernummer": "GsR 216",
      "registerart": "GsR",
      "company_name": "Guski-Link-eGbR",
      "company_seat": "Kettig",
      "details": "25.11.2024 (Bekanntmachungsdatum)\n\nRheinland-Pfalz Amtsgericht Koblenz GsR 216\nRegisterbekanntmachung nach dem Umwandlungsgesetz 25.11.2024 (Eintragungsdatum)\n\nGuski-Link-eGbR\nGesellschaft bürgerlichen Rechts\nKettig\n\nAls nicht eingetragen wird veröffentlicht: Den Gläubigern der an der Umwandlung beteiligten Rechtsträger ist, wenn sie binnen sechs Monaten nach dem Tag, an dem die Eintragung der Umwandlung in das Register des Sitzes desjenigen Rechtsträgers, dessen Gläubiger sie sind, nach § 19 Abs. 3 UmwG als bekannt gemacht gilt, ihren Anspruch nach Grund und Höhe schriftlich anmelden, Sicherheit zu leisten, soweit sie nicht Befriedigung verlangen können. Dieses Recht steht den Gläubigern jedoch nur zu, wenn sie glaubhaft machen, dass durch die Umwandlung die Erfüllung der Forderung gefährdet wird."
    },
    {
      "date": "2024-11-25",
      "original_text": "Einreichung neuer Dokumente\nNiedersachsen Amtsgericht Hannover HRB 58934\nHDI Versicherung AG – Hannover",
      "type": "Einreichung neuer Dokumente",
      "state": "Niedersachsen",
      "amtsgericht": "Amtsgericht Hannover",
      "registernummer": "HRB 58934",
      "registerart": "HRB",
      "company_name": "HDI Versicherung AG",
      "company_seat": "Hannover",
      "details": "25.11.2024 (Bekanntmachungsdatum)\n\nNiedersachsen Amtsgericht Hannover HRB 58934\nEinreichung neuer Dokumente\n\nHDI Versicherung AG\nAktiengesellschaft\nHannover\n\nDie Liste der Mitglieder des Aufsichtsrats wurde beim Registergericht eingereicht."
    },
    {
      "date": "2024-11-25",
      "original_text": "Einreichung neuer Dokumente\nHessen Amtsgericht Frankfurt am Main HRB 52468\nHFM Managementgesellschaft für Hafen und Markt mit beschränkter Haftung – Frankfurt am Main",
      "type": "Einreichung neuer Dokumente",
      "state": "Hessen",
      "amtsgericht": "Amtsgericht Frankfurt am Main",
      "registernummer": "HRB 52468",
      "registerart": "HRB",
      "company_name": "HFM Managementgesellschaft für Hafen und Markt mit beschränkter Haftung",
      "company_seat": "Frankfurt am Main",
      "details": "25.11.2024 (Bekanntmachungsdatum)\n\nHessen Amtsgericht Frankfurt am Main HRB 52468\nEinreichung neuer Dokumente 25.11.2024 (Eintragungsdatum)\n\nHFM Managementgesellschaft für Hafen und Markt mit beschränkter Haftung\nGesellschaft mit beschränkter Haftung\nFrankfurt am Main\n\nDurch eine Änderung in den Personen der Aufsichtsratsmitglieder ist eine Liste der Mitglieder des Aufsichtsrates zum Handelsregister eingereicht worden."
    },
    {
      "date": "2024-11-25",
      "original_text": "Einreichung neuer Dokumente\nThüringen Amtsgericht Jena HRB 110582\nHKS Gebäudetechnik GmbH Apolda – Apolda",
      "type": "Einreichung neuer Dokumente",
      "state": "Thüringen",
      "amtsgericht": "Amtsgericht Jena",
      "registernummer": "HRB 110582",
      "registerart": "HRB",
      "company_name": "HKS Gebäudetechnik GmbH Apolda",
      "company_seat": "Apolda",
      "details": "25.11.2024 (Bekanntmachungsdatum)\n\nThüringen Amtsgericht Jena HRB 110582\nEinreichung neuer Dokumente\n\nHKS Gebäudetechnik GmbH Apolda\nGesellschaft mit beschränkter Haftung\nApolda\n\nBekanntmachung gem. § 52 Abs. 3 Satz 2 GmbHG: Aufgrund einer Veränderung in den Personen der Aufsichtsratsmitglieder ist durch die Geschäftsführer eine neue Liste zum Handelsregister eingereicht worden."
    },
    {
      "date": "2024-11-25",
      "original_text": "Löschungsankündigung\nSchleswig-Holstein Amtsgericht Pinneberg HRB 14897\nHLS GmbH – Hohenlockstedt",
      "type": "Löschungsankündigung",
      "state": "Schleswig-Holstein",
      "amtsgericht": "Amtsgericht Pinneberg",
      "registernummer": "HRB 14897",
      "registerart": "HRB",
      "company_name": "HLS GmbH",
      "company_seat": "Hohenlockstedt",
      "details": "25.11.2024 (Bekanntmachungsdatum)\n\nSchleswig-Holstein Amtsgericht Pinneberg HRB 14897\nLöschungsankündigung\n\nHLS GmbH\nGesellschaft mit beschränkter Haftung\nHohenlockstedt\n\nEs ist die Löschung der nachstehenden Gesellschaft wegen Vermögenslosigkeit gemäß § 394 FamFG beabsichtigt. Widerspruchsfrist: 2 Monate."
    },
    {
      "date": "2024-11-25",
      "original_text": "Einreichung neuer Dokumente\nBrandenburg Amtsgericht Frankfurt/Oder HRB 2896\nHaus-, Grundstücks- und Baubetreuungsgesellschaft mbH, Wriezen – Wriezen",
      "type": "Einreichung neuer Dokumente",
      "state": "Brandenburg",
      "amtsgericht": "Amtsgericht Frankfurt/Oder",
      "registernummer": "HRB 2896",
      "registerart": "HRB",
      "company_name": "Haus-, Grundstücks- und Baubetreuungsgesellschaft mbH, Wriezen",
      "company_seat": "Wriezen",
      "details": "25.11.2024 (Bekanntmachungsdatum)\n\nBrandenburg Amtsgericht Frankfurt/Oder HRB 2896\nEinreichung neuer Dokumente\n\nHaus-, Grundstücks- und Baubetreuungsgesellschaft mbH, Wriezen\nGesellschaft mit beschränkter Haftung\nWriezen\n\nAls nicht eingetragen wird veröffentlicht: Bekanntmachung gem. § 106 AktG\nDie Gesellschaft hat Änderungen in der Besetzung des Aufsichtsrates angezeigt."
    },
    {
      "date": "2024-11-25",
      "original_text": "Registerbekanntmachung nach dem Umwandlungsgesetz\nBaden-Württemberg Amtsgericht Mannheim HRB 746803\nHey Social GmbH – Mannheim",
      "type": "Registerbekanntmachung nach dem Umwandlungsgesetz",
      "state": "Baden-Württemberg",
      "amtsgericht": "Amtsgericht Mannheim",
      "registernummer": "HRB 746803",
      "registerart": "HRB",
      "company_name": "Hey Social GmbH",
      "company_seat": "Mannheim",
      "details": "25.11.2024 (Bekanntmachungsdatum)\n\nBaden-Württemberg Amtsgericht Mannheim HRB 746803\nRegisterbekanntmachung nach dem Umwandlungsgesetz 25.11.2024 (Eintragungsdatum)\n\nHey Social GmbH\nGesellschaft mit beschränkter Haftung\nMannheim\n\nAls nicht eingetragen wird bekanntgemacht:\nDen Gläubigern der an der Ausgliederung beteiligten Rechtsträger ist, wenn sie binnen sechs Monaten nach dem Tag, an dem die Eintragung der Ausgliederung in das Register des Sitzes desjenigen Rechtsträgers, dessen Gläubiger sie sind, nach § 19 Abs. 3 UmwG als bekanntgemacht gilt, ihren Anspruch nach Grund und Höhe schriftlich anmelden, Sicherheit zu leisten, soweit sie nicht Befriedigung verlangen können. Dieses Recht steht den Gläubigern jedoch nur zu, wenn sie glaubhaft machen, dass durch die Ausgliederung die Erfüllung ihrer Forderung gefährdet wird."
    },
    {
      "date": "2024-11-25",
      "original_text": "Löschungsankündigung\nNiedersachsen Amtsgericht Osnabrück HRB 20467\nHolztec GmbH – Bramsche",
      "type": "Löschungsankündigung",
      "state": "Niedersachsen",
      "amtsgericht": "Amtsgericht Osnabrück",
      "registernummer": "HRB 20467",
      "registerart": "HRB",
      "company_name": "Holztec GmbH",
      "company_seat": "Bramsche",
      "details": "25.11.2024 (Bekanntmachungsdatum)\n\nNiedersachsen Amtsgericht Osnabrück HRB 20467\nLöschungsankündigung\n\nHolztec GmbH\nGesellschaft mit beschränkter Haftung\nBramsche\n\nDas Registergericht beabsichtigt, die Gesellschaft von Amts wegen nach § 394 FamFG wegen Vermögenslosigkeit zu löschen. Die Frist zur Erhebung eines Widerspruchs ist auf 1 Monat ab dieser Registerbekanntmachung festgesetzt."
    },
    {
      "date": "2024-11-25",
      "original_text": "Löschungsankündigung\nSchleswig-Holstein Amtsgericht Flensburg HRB 14347\nHygge unverpackt Franchise GmbH – Glücksburg",
      "type": "Löschungsankündigung",
      "state": "Schleswig-Holstein",
      "amtsgericht": "Amtsgericht Flensburg",
      "registernummer": "HRB 14347",
      "registerart": "HRB",
      "company_name": "Hygge unverpackt Franchise GmbH",
      "company_seat": "Glücksburg",
      "details": "25.11.2024 (Bekanntmachungsdatum)\n\nSchleswig-Holstein Amtsgericht Flensburg HRB 14347\nLöschungsankündigung\n\nHygge unverpackt Franchise GmbH\nGesellschaft mit beschränkter Haftung\nGlücksburg\n\nEs ist die Löschung der nachstehenden Gesellschaft wegen Vermögenslosigkeit gemäß § 394 FamFG beabsichtigt.\nWiderspruchsfrist: 2 Monate."
    },
    {
      "date": "2024-11-25",
      "original_text": "Löschungsankündigung\nBaden-Württemberg Amtsgericht Ulm HRB 744592\nHärtsfelder Gala Bau UG (haftungsbeschränkt) – Heidenheim an der Brenz",
      "type": "Löschungsankündigung",
      "state": "Baden-Württemberg",
      "amtsgericht": "Amtsgericht Ulm",
      "registernummer": "HRB 744592",
      "registerart": "HRB",
      "company_name": "Härtsfelder Gala Bau UG (haftungsbeschränkt)",
      "company_seat": "Heidenheim an der Brenz",
      "details": "25.11.2024 (Bekanntmachungsdatum)\n\nBaden-Württemberg Amtsgericht Ulm HRB 744592\nLöschungsankündigung\n\nHärtsfelder Gala Bau UG (haftungsbeschränkt)\nGesellschaft mit beschränkter Haftung\nHeidenheim an der Brenz\n\nDas Gericht beabsichtigt, die Gesellschaft wegen Vermögenslosigkeit im Handelsregister von Amts wegen nach § 394 FamFG zu löschen. Die Frist zur Geltendmachung eines Widerspruchs gegen die beabsichtigte Löschung ist auf  einen Monat ab Veröffentlichung bestimmt."
    },
    {
      "date": "2024-11-25",
      "original_text": "Registerbekanntmachung nach dem Umwandlungsgesetz\nNordrhein-Westfalen Amtsgericht Bad Oeynhausen HRB 19561\nHäusliche Kranken- und Altenpflege GmbH – Löhne",
      "type": "Registerbekanntmachung nach dem Umwandlungsgesetz",
      "state": "Nordrhein-Westfalen",
      "amtsgericht": "Amtsgericht Bad Oeynhausen",
      "registernummer": "HRB 19561",
      "registerart": "HRB",
      "company_name": "Häusliche Kranken- und Altenpflege GmbH",
      "company_seat": "Löhne",
      "details": "25.11.2024 (Bekanntmachungsdatum)\n\nNordrhein-Westfalen Amtsgericht Bad Oeynhausen HRB 19561\nRegisterbekanntmachung nach dem Umwandlungsgesetz 25.11.2024 (Eintragungsdatum)\n\nHäusliche Kranken- und Altenpflege GmbH\nGesellschaft mit beschränkter Haftung\nLöhne\n\nDen Gläubigern der an der Ausgliederung beteiligten Rechtsträger ist, wenn sie binnen sechs Monaten nach dem Tag, an dem die Eintragung der Ausgliederung in das Register des Sitzes desjenigen Rechtsträgers, dessen Gläubiger sie sind, nach § 19 Absatz 3 UmwG als bekanntgemacht gilt, ihren Anspruch nach Grund und Höhe schriftlich anmelden, Sicherheit zu leisten, soweit sie nicht Befriedigung verlangen können. Dieses Recht steht den Gläubigern jedoch nur zu, wenn sie glaubhaft machen, dass durch die Ausgliederung die Erfüllung ihrer Forderung gefährdet wird."
    },
    {
      "date": "2024-11-25",
      "original_text": "Registerbekanntmachung nach dem Umwandlungsgesetz\nSchleswig-Holstein Amtsgericht Kiel HRA 12478\nJakob Strehlow e.K. – Kiel",
      "type": "Registerbekanntmachung nach dem Umwandlungsgesetz",
      "state": "Schleswig-Holstein",
      "amtsgericht": "Amtsgericht Kiel",
      "registernummer": "HRA 12478",
      "registerart": "HRA",
      "company_name": "Jakob Strehlow e.K.",
      "company_seat": "Kiel",
      "details": "25.11.2024 (Bekanntmachungsdatum)\n\nSchleswig-Holstein Amtsgericht Kiel HRA 12478\nRegisterbekanntmachung nach dem Umwandlungsgesetz 22.11.2024 (Eintragungsdatum)\n\nJakob Strehlow e.K.\nEinzelkaufmann / Einzelkauffrau\nKiel\n\nZu Eintragungsnummer 2 vom 22.11.2024 wird als nicht eingetragen veröffentlicht: Als nicht eingetragen wird veröffentlicht: Den Gläubigern der an der Spaltung beteiligten Rechtsträger ist, wenn sie binnen sechs Monaten nach dem Tag, an dem die Eintragung der Spaltung in das Register des Sitzes desjenigen Rechtsträgers, dessen Gläubiger sie sind,  bekannt gemacht worden ist, ihren Anspruch nach Grund und Höhe schriftlich anmelden, Sicherheit zu leisten, soweit sie nicht Befriedigung verlangen können. Dieses Recht steht den Gläubigern jedoch nur zu, wenn sie glaubhaft machen, dass durch die Spaltung die Erfüllung ihrer Forderung gefährdet wird."
    },
    {
      "date": "2024-11-25",
      "original_text": "Löschungsankündigung\nBaden-Württemberg Amtsgericht Ulm HRB 726872\nJaksa Stahl- und Maschinenbau GmbH – Süßen",
      "type": "Löschungsankündigung",
      "state": "Baden-Württemberg",
      "amtsgericht": "Amtsgericht Ulm",
      "registernummer": "HRB 726872",
      "registerart": "HRB",
      "company_name": "Jaksa Stahl- und Maschinenbau GmbH",
      "company_seat": "Süßen",
      "details": "25.11.2024 (Bekanntmachungsdatum)\n\nBaden-Württemberg Amtsgericht Ulm HRB 726872\nLöschungsankündigung\n\nJaksa Stahl- und Maschinenbau GmbH\nGesellschaft mit beschränkter Haftung\nSüßen\n\nDas Gericht beabsichtigt, die Gesellschaft wegen Vermögenslosigkeit im Handelsregister von Amts wegen nach § 394 FamFG zu löschen. Die Frist zur Geltendmachung eines Widerspruchs gegen die beabsichtigte Löschung ist auf  einen Monat ab Veröffentlichung bestimmt."
    },
    {
      "date": "2024-11-25",
      "original_text": "Registerbekanntmachung nach dem Umwandlungsgesetz\nNordrhein-Westfalen Amtsgericht Iserlohn HRB 10785\nKIRCHHOFF Automotive AG – Iserlohn",
      "type": "Registerbekanntmachung nach dem Umwandlungsgesetz",
      "state": "Nordrhein-Westfalen",
      "amtsgericht": "Amtsgericht Iserlohn",
      "registernummer": "HRB 10785",
      "registerart": "HRB",
      "company_name": "KIRCHHOFF Automotive AG",
      "company_seat": "Iserlohn",
      "details": "25.11.2024 (Bekanntmachungsdatum)\n\nNordrhein-Westfalen Amtsgericht Iserlohn HRB 10785\nRegisterbekanntmachung nach dem Umwandlungsgesetz 22.11.2024 (Eintragungsdatum)\n\nKIRCHHOFF Automotive AG\nAktiengesellschaft\nIserlohn\n\nDen Gläubigern der an der Verschmelzung beteiligten Rechtsträger ist, wenn sie binnen sechs Monaten nach dem Tag, an dem die Eintragung der Verschmelzung in das Register des Sitzes desjenigen Rechtsträgers, dessen Gläubiger sie sind, nach § 19 Absatz 3 UmwG als bekanntgemacht gilt, ihren Anspruch nach Grund und Höhe schriftlich anmelden, Sicherheit zu leisten, soweit sie nicht Befriedigung verlangen können. Dieses Recht steht den Gläubigern jedoch nur zu, wenn sie glaubhaft machen, dass durch die Verschmelzung die Erfüllung ihrer Forderung gefährdet wird."
    },
    {
      "date": "2024-11-25",
      "original_text": "Löschungsankündigung\nSchleswig-Holstein Amtsgericht Flensburg HRB 1433\nKRISTRONICS GmbH – Harrislee",
      "type": "Löschungsankündigung",
      "state": "Schleswig-Holstein",
      "amtsgericht": "Amtsgericht Flensburg",
      "registernummer": "HRB 1433",
      "registerart": "HRB",
      "company_name": "KRISTRONICS GmbH",
      "company_seat": "Harrislee",
      "details": "25.11.2024 (Bekanntmachungsdatum)\n\nSchleswig-Holstein Amtsgericht Flensburg HRB 1433\nLöschungsankündigung\n\nKRISTRONICS GmbH\nGesellschaft mit beschränkter Haftung\nHarrislee\n\nEs ist die Löschung der nachstehenden Gesellschaft wegen Vermögenslosigkeit gemäß § 394 FamFG beabsichtigt.\nWiderspruchsfrist: 2 Monate"
    },
    {
      "date": "2024-11-25",
      "original_text": "Einreichung neuer Dokumente\nSachsen Amtsgericht Chemnitz HRB 7917\nKreisentsorgungs GmbH Vogtland – Oelsnitz/Vogtl.",
      "type": "Einreichung neuer Dokumente",
      "state": "Sachsen",
      "amtsgericht": "Amtsgericht Chemnitz",
      "registernummer": "HRB 7917",
      "registerart": "HRB",
      "company_name": "Kreisentsorgungs GmbH Vogtland",
      "company_seat": "Oelsnitz/Vogtl.",
      "details": "25.11.2024 (Bekanntmachungsdatum)\n\nSachsen Amtsgericht Chemnitz HRB 7917\nEinreichung neuer Dokumente\n\nKreisentsorgungs GmbH Vogtland\nGesellschaft mit beschränkter Haftung\nOelsnitz/Vogtl.\n\nAm 22.11.2024 wurde beim Handelsregister des Amtsgerichts Chemnitz die Liste der Mitglieder des Aufsichtsrats gemäß § 52 GmbHG eingereicht."
    },
    {
      "date": "2024-11-25",
      "original_text": "Registerbekanntmachung nach dem Umwandlungsgesetz\nSachsen Amtsgericht Leipzig HRB 17977\nKulturhaus Immobilien und Verwaltungsgesellschaft der Stadt Torgau mbH – Torgau",
      "type": "Registerbekanntmachung nach dem Umwandlungsgesetz",
      "state": "Sachsen",
      "amtsgericht": "Amtsgericht Leipzig",
      "registernummer": "HRB 17977",
      "registerart": "HRB",
      "company_name": "Kulturhaus Immobilien und Verwaltungsgesellschaft der Stadt Torgau mbH",
      "company_seat": "Torgau",
      "details": "25.11.2024 (Bekanntmachungsdatum)\n\nSachsen Amtsgericht Leipzig HRB 17977\nRegisterbekanntmachung nach dem Umwandlungsgesetz 25.11.2024 (Eintragungsdatum)\n\nKulturhaus Immobilien und Verwaltungsgesellschaft der Stadt Torgau mbH\nGesellschaft mit beschränkter Haftung\nTorgau\n\nDen Gläubigern der an der Verschmelzung beteiligten Rechtsträger ist, wenn sie binnen sechs Monaten nach dem Tag, an dem die Eintragung der Verschmelzung in das Register des Sitzes desjenigen Rechtsträgers, dessen Gläubiger sie sind, nach § 19 Abs. 3 UmwG als bekannt gemacht gilt, ihren Anspruch nach Grund und Höhe schriftlich anmelden, Sicherheit zu leisten, soweit sie nicht Befriedigung verlangen können. Dieses Recht steht den Gläubigern jedoch nur zu, wenn sie glaubhaft machen, dass durch die Verschmelzung die Erfüllung der Forderung gefährdet wird."
    },
    {
      "date": "2024-11-25",
      "original_text": "Einreichung neuer Dokumente\nSachsen-Anhalt Amtsgericht Stendal HRB 16356\nKöthen Kultur und Marketing GmbH – Köthen (Anhalt)",
      "type": "Einreichung neuer Dokumente",
      "state": "Sachsen-Anhalt",
      "amtsgericht": "Amtsgericht Stendal",
      "registernummer": "HRB 16356",
      "registerart": "HRB",
      "company_name": "Köthen Kultur und Marketing GmbH",
      "company_seat": "Köthen (Anhalt)",
      "details": "25.11.2024 (Bekanntmachungsdatum)\n\nSachsen-Anhalt Amtsgericht Stendal HRB 16356\nEinreichung neuer Dokumente\n\nKöthen Kultur und Marketing GmbH\nGesellschaft mit beschränkter Haftung\nKöthen (Anhalt)\n\nEine Liste der Mitglieder des Aufsichtsrates wurde zum Handelsregister eingereicht."
    },
    {
      "date": "2024-11-25",
      "original_text": "Löschungsankündigung\nBerlin Amtsgericht Berlin (Charlottenburg) HRB 186433\nLACUS Nord GmbH – Berlin",
      "type": "Löschungsankündigung",
      "state": "Berlin",
      "amtsgericht": "Amtsgericht Berlin (Charlottenburg)",
      "registernummer": "HRB 186433",
      "registerart": "HRB",
      "company_name": "LACUS Nord GmbH",
      "company_seat": "Berlin",
      "details": "25.11.2024 (Bekanntmachungsdatum)\n\nBerlin Amtsgericht Berlin (Charlottenburg) HRB 186433\nLöschungsankündigung\n\nLACUS Nord GmbH\nGesellschaft mit beschränkter Haftung\nBerlin\n\nBei der nachstehenden Gesellschaft wird das Amtslöschungsverfahren gemäß § 394 FamFG eingeleitet. Widerspruchsfrist 6 Wochen"
    },
    {
      "date": "2024-11-25",
      "original_text": "Einreichung neuer Dokumente\nBaden-Württemberg Amtsgericht Freiburg HRB 722081\nMVZ Bad Säckingen GmbH – Bad Säckingen",
      "type": "Einreichung neuer Dokumente",
      "state": "Baden-Württemberg",
      "amtsgericht": "Amtsgericht Freiburg",
      "registernummer": "HRB 722081",
      "registerart": "HRB",
      "company_name": "MVZ Bad Säckingen GmbH",
      "company_seat": "Bad Säckingen",
      "details": "25.11.2024 (Bekanntmachungsdatum)\n\nBaden-Württemberg Amtsgericht Freiburg HRB 722081\nEinreichung neuer Dokumente\n\nMVZ Bad Säckingen GmbH\nGesellschaft mit beschränkter Haftung\nBad Säckingen\n\nDie Gesellschaft hat am 22.11.2024 die Liste über die Zusammensetzung des Aufsichtsrats zum Handelsregister eingereicht."
    },
    {
      "date": "2024-11-25",
      "original_text": "Löschungsankündigung\nNordrhein-Westfalen Amtsgericht Siegburg HRB 12059\nMeba Projekt GmbH – Reichshof",
      "type": "Löschungsankündigung",
      "state": "Nordrhein-Westfalen",
      "amtsgericht": "Amtsgericht Siegburg",
      "registernummer": "HRB 12059",
      "registerart": "HRB",
      "company_name": "Meba Projekt GmbH",
      "company_seat": "Reichshof",
      "details": "25.11.2024 (Bekanntmachungsdatum)\n\nNordrhein-Westfalen Amtsgericht Siegburg HRB 12059\nLöschungsankündigung\n\nMeba Projekt GmbH\nGesellschaft mit beschränkter Haftung\nReichshof\n\nDas Registergericht hat glaubhafte Kenntnis erlangt, dass die Gesellschaft vermögenslos geworden ist.\n\nEs ist daher beabsichtigt, die Gesellschaft nach § 394 FamFG im Handelsregister wegen Vermögenslosigkeit zu löschen.\nEinwände gegen die Löschung sind durch Widerspruch binnen einer Frist von 3 Monaten geltend zu machen, andernfalls die Löschung erfolgen wird.\n\nEinzulegen ist der Widerspruch bei dem Amtsgericht Siegburg, Neue Poststraße 16, 53721 Siegburg, und zwar entweder schriftlich in deutscher Sprache oder mündlich zur Niederschrift der Geschäftsstelle. Der Widerspruch kann auch zur Niederschrift der Geschäftsstelle eines jeden Amtsgerichts abgegeben werden. Der Widerspruch ist binnen der in der Verfügung bestimmten Frist einzulegen. Die Frist ist nur gewahrt, wenn der Widerspruch rechtzeitig bei dem Amtsgericht Siegburg eingeht, auch wenn der Widerspruch zur Niederschrift der Geschäftsstelle eines anderen Amtsgerichts abgegeben wurde. Die Frist beginnt jeweils mit der schriftlichen Bekanntgabe der Verfügung an die Beteiligten. Kann die schriftliche Bekanntgabe an einen Beteiligten nicht bewirkt werden, beginnt die Frist spätestens mit Ablauf von fünf Monaten nach Erlass der Verfügung. Die Bekanntgabe ist entweder durch Zustellung oder am dritten Tage nach Aufgabe zur Post bewirkt. Sofern die Löschung noch nicht erfolgt ist, kann der Widerspruch auch noch nach Ablauf der Frist eingelegt werden. Fällt das Ende der Frist auf einen Sonnabend, einen Sonntag oder einen allgemeinen Feiertag, endet die Frist mit Ablauf des nächsten Werktages. Der Widerspruch ist zu unterzeichnen. Eine Begründung des Widerspruchs ist nicht vorgeschrieben."
    },
    {
      "date": "2024-11-25",
      "original_text": "Registerbekanntmachung nach dem Umwandlungsgesetz\nBremen Amtsgericht Bremen HRB 34886\nMeyer Menü Bremen Verwaltungs-GmbH – Bremen",
      "type": "Registerbekanntmachung nach dem Umwandlungsgesetz",
      "state": "Bremen",
      "amtsgericht": "Amtsgericht Bremen",
      "registernummer": "HRB 34886",
      "registerart": "HRB",
      "company_name": "Meyer Menü Bremen Verwaltungs-GmbH",
      "company_seat": "Bremen",
      "details": "25.11.2024 (Bekanntmachungsdatum)\n\nBremen Amtsgericht Bremen HRB 34886\nRegisterbekanntmachung nach dem Umwandlungsgesetz 22.11.2024 (Eintragungsdatum)\n\nMeyer Menü Bremen Verwaltungs-GmbH\nGesellschaft mit beschränkter Haftung\nBremen\n\nZu Eintragungsnummer 2 vom 22.11.2024 wird als nicht eingetragen veröffentlicht: Den Gläubigern der an der Verschmelzung beteiligten Rechtsträger ist, wenn sie binnen sechs Monaten nach dem Tag, an dem die Eintragung der Verschmelzung in das Register des Sitzes desjenigen Rechtsträgers, dessen Gläubiger sie sind, als bekannt gemacht gilt, ihren Anspruch nach Grund und Höhe schriftlich anmelden, Sicherheit zu leisten, soweit sie nicht Befriedigung verlangen können. Dieses Recht steht den Gläubigern jedoch nur zu, wenn sie glaubhaft machen, dass durch die Verschmelzung die Erfüllung ihrer Forderung gefährdet wird. Das Recht, Sicherheitsleistung zu verlangen, steht Gläubigern nicht zu, die im Falle der Insolvenz ein Recht auf vorzugsweise Befriedigung aus einer Deckungsmasse haben, die nach gesetzlicher Vorschrift zu ihrem Schutz errichtet und staatlich überwacht ist."
    },
    {
      "date": "2024-11-25",
      "original_text": "Registerbekanntmachung nach dem Umwandlungsgesetz\nBremen Amtsgericht Bremen HRB 40813\nMeyer Menü HB GmbH – Bremen",
      "type": "Registerbekanntmachung nach dem Umwandlungsgesetz",
      "state": "Bremen",
      "amtsgericht": "Amtsgericht Bremen",
      "registernummer": "HRB 40813",
      "registerart": "HRB",
      "company_name": "Meyer Menü HB GmbH",
      "company_seat": "Bremen",
      "details": "25.11.2024 (Bekanntmachungsdatum)\n\nBremen Amtsgericht Bremen HRB 40813\nRegisterbekanntmachung nach dem Umwandlungsgesetz 22.11.2024 (Eintragungsdatum)\n\nMeyer Menü HB GmbH\nGesellschaft mit beschränkter Haftung\nBremen\n\nZu Eintragungsnummer 2 vom 22.11.2024 wird als nicht eingetragen veröffentlicht: Den Gläubigern der an der Verschmelzung beteiligten Rechtsträger ist, wenn sie binnen sechs Monaten nach dem Tag, an dem die Eintragung der Verschmelzung in das Register des Sitzes desjenigen Rechtsträgers, dessen Gläubiger sie sind, als bekannt gemacht gilt, ihren Anspruch nach Grund und Höhe schriftlich anmelden, Sicherheit zu leisten, soweit sie nicht Befriedigung verlangen können. Dieses Recht steht den Gläubigern jedoch nur zu, wenn sie glaubhaft machen, dass durch die Verschmelzung die Erfüllung ihrer Forderung gefährdet wird. Das Recht, Sicherheitsleistung zu verlangen, steht Gläubigern nicht zu, die im Falle der Insolvenz ein Recht auf vorzugsweise Befriedigung aus einer Deckungsmasse haben, die nach gesetzlicher Vorschrift zu ihrem Schutz errichtet und staatlich überwacht ist."
    },
    {
      "date": "2024-11-25",
      "original_text": "Registerbekanntmachung nach dem Umwandlungsgesetz\nNordrhein-Westfalen Amtsgericht Duisburg HRB 28504\nNetzler-Technik UG (haftungsbeschränkt) – Mülheim an der Ruhr",
      "type": "Registerbekanntmachung nach dem Umwandlungsgesetz",
      "state": "Nordrhein-Westfalen",
      "amtsgericht": "Amtsgericht Duisburg",
      "registernummer": "HRB 28504",
      "registerart": "HRB",
      "company_name": "Netzler-Technik UG (haftungsbeschränkt)",
      "company_seat": "Mülheim an der Ruhr",
      "details": "25.11.2024 (Bekanntmachungsdatum)\n\nNordrhein-Westfalen Amtsgericht Duisburg HRB 28504\nRegisterbekanntmachung nach dem Umwandlungsgesetz 25.11.2024 (Eintragungsdatum)\n\nNetzler-Technik UG (haftungsbeschränkt)\nGesellschaft mit beschränkter Haftung\nMülheim an der Ruhr\n\nDie Gesellschaft hat Gläubigern, deren Forderungen vor dieser Bekanntmachung begründet worden sind, Sicherheit zu leisten, soweit sie nicht Befriedigung verlangen können, wenn sie sich binnen sechs Monaten zu diesem Zweck melden."
    },
    {
      "date": "2024-11-25",
      "original_text": "Einreichung neuer Dokumente\nSachsen-Anhalt Amtsgericht Stendal HRB 10156\nNeue Bitterfelder Wohnungs- und Baugesellschaft mbH – Bitterfeld-Wolfen",
      "type": "Einreichung neuer Dokumente",
      "state": "Sachsen-Anhalt",
      "amtsgericht": "Amtsgericht Stendal",
      "registernummer": "HRB 10156",
      "registerart": "HRB",
      "company_name": "Neue Bitterfelder Wohnungs- und Baugesellschaft mbH",
      "company_seat": "Bitterfeld-Wolfen",
      "details": "25.11.2024 (Bekanntmachungsdatum)\n\nSachsen-Anhalt Amtsgericht Stendal HRB 10156\nEinreichung neuer Dokumente\n\nNeue Bitterfelder Wohnungs- und Baugesellschaft mbH\nGesellschaft mit beschränkter Haftung\nBitterfeld-Wolfen\n\nEine Liste der Mitglieder des Aufsichtsrates wurde zum Handelsregister eingereicht."
    },
    {
      "date": "2024-11-25",
      "original_text": "Löschungsankündigung\nNordrhein-Westfalen Amtsgericht Köln HRB 100240\nO-VIVA GmbH – Wesseling",
      "type": "Löschungsankündigung",
      "state": "Nordrhein-Westfalen",
      "amtsgericht": "Amtsgericht Köln",
      "registernummer": "HRB 100240",
      "registerart": "HRB",
      "company_name": "O-VIVA GmbH",
      "company_seat": "Wesseling",
      "details": "25.11.2024 (Bekanntmachungsdatum)\n\nNordrhein-Westfalen Amtsgericht Köln HRB 100240\nLöschungsankündigung\n\nO-VIVA GmbH\nGesellschaft mit beschränkter Haftung\nWesseling\n\nDas Registergericht beabsichtigt die Gesellschaft von Amts wegen nach § 394 FamFG zu löschen. Die Frist zur Erhebung eines Widerspruchs ist auf einen Monat festgesetzt."
    },
    {
      "date": "2024-11-25",
      "original_text": "Einreichung neuer Dokumente\nBaden-Württemberg Amtsgericht Ulm HRB 680806\nPALUX Aktiengesellschaft – Bad Mergentheim",
      "type": "Einreichung neuer Dokumente",
      "state": "Baden-Württemberg",
      "amtsgericht": "Amtsgericht Ulm",
      "registernummer": "HRB 680806",
      "registerart": "HRB",
      "company_name": "PALUX Aktiengesellschaft",
      "company_seat": "Bad Mergentheim",
      "details": "25.11.2024 (Bekanntmachungsdatum)\n\nBaden-Württemberg Amtsgericht Ulm HRB 680806\nEinreichung neuer Dokumente 25.11.2024 (Eintragungsdatum)\n\nPALUX Aktiengesellschaft\nAktiengesellschaft\nBad Mergentheim\n\nDie Gesellschaft hat am 12.11.2024 die Liste über die Zusammensetzung des Aufsichtsrats zum Handelsregister eingereicht."
    },
    {
      "date": "2024-11-25",
      "original_text": "Registerbekanntmachung nach dem Umwandlungsgesetz\nNiedersachsen Amtsgericht Osnabrück HRB 209614\nPRO Automotive GmbH – Emsbüren",
      "type": "Registerbekanntmachung nach dem Umwandlungsgesetz",
      "state": "Niedersachsen",
      "amtsgericht": "Amtsgericht Osnabrück",
      "registernummer": "HRB 209614",
      "registerart": "HRB",
      "company_name": "PRO Automotive GmbH",
      "company_seat": "Emsbüren",
      "details": "25.11.2024 (Bekanntmachungsdatum)\n\nNiedersachsen Amtsgericht Osnabrück HRB 209614\nRegisterbekanntmachung nach dem Umwandlungsgesetz 25.11.2024 (Eintragungsdatum)\n\nPRO Automotive GmbH\nGesellschaft mit beschränkter Haftung\nEmsbüren\n\nDen Gläubigern der an der #DV.Auswahl(Text=\"Betreffende Alternative auswählen\",Eingabe=\"Verschmelzung beteiligten Rechtsträger ist, wenn sie binnen sechs Monaten nach dem Tag, an dem die Eintragung der Verschmelzung in das Register des Sitzes desjenigen Rechtsträgers, dessen Gläubiger sie sind, nach § 19  Abs.  3 UmwG als bekannt gemacht gilt, ihren Anspruch nach Grund und Höhe schriftlich anmelden, Sicherheit zu leisten, soweit sie nicht Befriedigung verlangen können. Dieses Recht steht den Gläubigern jedoch nur zu, wenn sie glaubhaft machen, dass durch die Verschmelzung die Erfüllung der Forderung gefährdet wird.\"|\"Verschmelzung\",\"Abspaltung beteiligten Rechtsträger ist, wenn sie binnen sechs Monaten nach dem Tag, an dem die Eintragung der Abspaltung in das Register des Sitzes desjenigen Rechtsträgers, dessen Gläubiger sie sind, nach § 19 Abs. 3 UmwG als bekannt gemacht gilt, ihren Anspruch nach Grund und Höhe schriftlich anmelden, Sicherheit zu leisten, soweit sie nicht Befriedigung verlangen können. Dieses Recht steht den Gläubigern jedoch nur zu, wenn sie glaubhaft machen, dass durch die Abspaltung die Erfüllung der Forderung gefährdet wird.\"|\"Abspaltung\",\"Aufspaltung beteiligten Rechtsträger ist, wenn sie binnen sechs Monaten nach dem Tag, an dem die Eintragung der Aufspaltung in das Register des Sitzes desjenigen Rechtsträgers, dessen Gläubiger sie sind, nach § 19 Abs. 3 UmwG als bekannt gemacht gilt, ihren Anspruch nach Grund und Höhe schriftlich anmelden, Sicherheit zu leisten, soweit sie nicht Befriedigung verlangen können. Dieses Recht steht den Gläubigern jedoch nur zu, wenn sie glaubhaft machen, dass durch die Aufspaltung die Erfüllung der Forderung gefährdet wird.\"|\"Aufspaltung\",\"formwechselnden Umwandlung beteiligten Rechtsträger ist, wenn sie binnen sechs Monaten nach dem Tag, an dem die Eintragung der Umwandlung in das Register des Sitzes desjenigen Rechtsträgers, dessen Gläubiger sie sind, nach § 19 Abs. 3 UmwG als bekannt gemacht gilt, ihren Anspruch nach Grund und Höhe schriftlich anmelden, Sicherheit zu leisten, soweit sie nicht Befriedigung verlangen können. Dieses Recht steht den Gläubigern jedoch nur zu, wenn sie glaubhaft machen, dass durch die formwechselnde Umwandlung die Erfüllung der Forderung gefährdet wird.\"|\"formwechselnden Umwandlung\",\"Ausgliederung beteiligten Rechtsträger ist, wenn sie binnen sechs Monaten nach dem Tag, an dem die Eintragung der Ausgliederung in das Register des Sitzes desjenigen Rechtsträgers, dessen Gläubiger sie sind, nach § 19 Abs. 3 UmwG als bekannt gemacht gilt, ihren Anspruch nach Grund und Höhe schriftlich anmelden, Sicherheit zu leisten, soweit sie nicht Befriedigung verlangen können. Dieses Recht steht den Gläubigern jedoch nur zu, wenn sie glaubhaft machen, dass durch die Ausgliederung die Erfüllung der Forderung gefährdet wird.\"|\"Ausgliederung\",\"Vermögensübertragung beteiligten Rechtsträger ist, wenn sie binnen sechs Monaten nach dem Tag, an dem die Eintragung der Spaltung in das Register des Sitzes desjenigen Rechtsträgers, dessen Gläubiger sie sind, nach § 19 Abs. 3 UmwG als bekannt gemacht gilt, ihren Anspruch nach Grund und Höhe schriftlich anmelden, Sicherheit zu leisten, soweit sie nicht Befriedigung verlangen können. Dieses Recht steht den Gläubigern jedoch nur zu, wenn sie glaubhaft machen, dass durch die Spaltung die Erfüllung der Forderung gefährdet wird.\"|\"Vermögensübertragung\")"
    },
    {
      "date": "2024-11-25",
      "original_text": "Löschungsankündigung\nNordrhein-Westfalen Amtsgericht Krefeld HRB 5678\nPTFE Coatings Gesellschaft für technische Beschichtungen mbH – Willich",
      "type": "Löschungsankündigung",
      "state": "Nordrhein-Westfalen",
      "amtsgericht": "Amtsgericht Krefeld",
      "registernummer": "HRB 5678",
      "registerart": "HRB",
      "company_name": "PTFE Coatings Gesellschaft für technische Beschichtungen mbH",
      "company_seat": "Willich",
      "details": "25.11.2024 (Bekanntmachungsdatum)\n\nNordrhein-Westfalen Amtsgericht Krefeld HRB 5678\nLöschungsankündigung\n\nPTFE Coatings Gesellschaft für technische Beschichtungen mbH\nGesellschaft mit beschränkter Haftung\nWillich\n\nDas Registergericht beabsichtigt die Gesellschaft von Amts wegen nach § 394 FamFG zu löschen. Die Frist zur Erhebung eines Widerspruchs ist auf einen Monat festgesetzt."
    },
    {
      "date": "2024-11-25",
      "original_text": "Registerbekanntmachung nach dem Umwandlungsgesetz\nNordrhein-Westfalen Amtsgericht Münster HRB 15942\nPapke Consulting GmbH – Münster",
      "type": "Registerbekanntmachung nach dem Umwandlungsgesetz",
      "state": "Nordrhein-Westfalen",
      "amtsgericht": "Amtsgericht Münster",
      "registernummer": "HRB 15942",
      "registerart": "HRB",
      "company_name": "Papke Consulting GmbH",
      "company_seat": "Münster",
      "details": "25.11.2024 (Bekanntmachungsdatum)\n\nNordrhein-Westfalen Amtsgericht Münster HRB 15942\nRegisterbekanntmachung nach dem Umwandlungsgesetz 25.11.2024 (Eintragungsdatum)\n\nPapke Consulting GmbH\nGesellschaft mit beschränkter Haftung\nMünster\n\nDen Gläubigern der an der Ausgliederung beteiligten Rechtsträger ist, wenn sie binnen sechs Monaten nach dem Tag, an dem die Eintragung der Ausgliederung in das Register des Sitzes desjenigen Rechtsträgers, dessen Gläubiger sie sind, nach § 19 Absatz 3 UmwG als bekanntgemacht gilt, ihren Anspruch nach Grund und Höhe schriftlich anmelden, Sicherheit zu leisten, soweit sie nicht Befriedigung verlangen können. Dieses Recht steht den Gläubigern jedoch nur zu, wenn sie glaubhaft machen, dass durch die Ausgliederung die Erfüllung ihrer Forderung gefährdet wird.Den Gläubigern der an der Ausgliederung beteiligten Rechtsträger ist, wenn sie binnen sechs Monaten nach dem Tag, an dem die Eintragung der Ausgliederung in das Register des Sitzes desjenigen Rechtsträgers, dessen Gläubiger sie sind, nach § 19 Absatz 3 UmwG als bekanntgemacht gilt, ihren Anspruch nach Grund und Höhe schriftlich anmelden, Sicherheit zu leisten, soweit sie nicht Befriedigung verlangen können. Dieses Recht steht den Gläubigern jedoch nur zu, wenn sie glaubhaft machen, dass durch die Ausgliederung die Erfüllung ihrer Forderung gefährdet wird."
    },
    {
      "date": "2024-11-25",
      "original_text": "Registerbekanntmachung nach dem Umwandlungsgesetz\nNordrhein-Westfalen Amtsgericht Duisburg HRA 13364\nPaul Underberg e.K. – Schermbeck",
      "type": "Registerbekanntmachung nach dem Umwandlungsgesetz",
      "state": "Nordrhein-Westfalen",
      "amtsgericht": "Amtsgericht Duisburg",
      "registernummer": "HRA 13364",
      "registerart": "HRA",
      "company_name": "Paul Underberg e.K.",
      "company_seat": "Schermbeck",
      "details": "25.11.2024 (Bekanntmachungsdatum)\n\nNordrhein-Westfalen Amtsgericht Duisburg HRA 13364\nRegisterbekanntmachung nach dem Umwandlungsgesetz 25.11.2024 (Eintragungsdatum)\n\nPaul Underberg e.K.\nEinzelkaufmann / Einzelkauffrau\nSchermbeck\n\nDie Gesellschaft hat Gläubigern, deren Forderungen vor dieser Bekanntmachung begründet worden sind, Sicherheit zu leisten, soweit sie nicht Befriedigung verlangen können, wenn sie sich binnen sechs Monaten zu diesem Zweck melden."
    },
    {
      "date": "2024-11-25",
      "original_text": "Löschungsankündigung\nBerlin Amtsgericht Berlin (Charlottenburg) HRB 187153\nPiwowa Bau GmbH – Berlin",
      "type": "Löschungsankündigung",
      "state": "Berlin",
      "amtsgericht": "Amtsgericht Berlin (Charlottenburg)",
      "registernummer": "HRB 187153",
      "registerart": "HRB",
      "company_name": "Piwowa Bau GmbH",
      "company_seat": "Berlin",
      "details": "25.11.2024 (Bekanntmachungsdatum)\n\nBerlin Amtsgericht Berlin (Charlottenburg) HRB 187153\nLöschungsankündigung\n\nPiwowa Bau GmbH\nGesellschaft mit beschränkter Haftung\nBerlin\n\nBei der nachstehenden Gesellschaft wird das Amtslöschungsverfahren gemäß § 394 FamFG eingeleitet. Widerspruchsfrist 6 Wochen"
    },
    {
      "date": "2024-11-25",
      "original_text": "Löschungsankündigung\nSachsen Amtsgericht Dresden HRB 41571\nPlanHero Software GmbH – Dresden",
      "type": "Löschungsankündigung",
      "state": "Sachsen",
      "amtsgericht": "Amtsgericht Dresden",
      "registernummer": "HRB 41571",
      "registerart": "HRB",
      "company_name": "PlanHero Software GmbH",
      "company_seat": "Dresden",
      "details": "25.11.2024 (Bekanntmachungsdatum)\n\nSachsen Amtsgericht Dresden HRB 41571\nLöschungsankündigung\n\nPlanHero Software GmbH\nGesellschaft mit beschränkter Haftung\nDresden\n\nDas Registergericht beabsichtigt, die im Handelsregister eingetragene Gesellschaft von Amts wegen nach § 394 FamFG zu löschen. Die Frist zu Erhebung eines Widerspruchs gegen die beabsichtigte Löschung wird auf einen Monat festgesetzt."
    },
    {
      "date": "2024-11-25",
      "original_text": "Löschungsankündigung\nBrandenburg Amtsgericht Potsdam HRB 22133\nQ-mo solar AG – Teltow",
      "type": "Löschungsankündigung",
      "state": "Brandenburg",
      "amtsgericht": "Amtsgericht Potsdam",
      "registernummer": "HRB 22133",
      "registerart": "HRB",
      "company_name": "Q-mo solar AG",
      "company_seat": "Teltow",
      "details": "25.11.2024 (Bekanntmachungsdatum)\n\nBrandenburg Amtsgericht Potsdam HRB 22133\nLöschungsankündigung\n\nQ-mo solar AG\nAktiengesellschaft\nTeltow\n\nBei der nachstehenden Gesellschaft wird das Amtslöschungsverfahren gemäß § 394 FamFG eingeleitet. Widerspruchsfrist: 8 Wochen."
    },
    {
      "date": "2024-11-25",
      "original_text": "Einreichung neuer Dokumente\nBerlin Amtsgericht Berlin (Charlottenburg) HRB 199432\nQuantica GmbH – Berlin",
      "type": "Einreichung neuer Dokumente",
      "state": "Berlin",
      "amtsgericht": "Amtsgericht Berlin (Charlottenburg)",
      "registernummer": "HRB 199432",
      "registerart": "HRB",
      "company_name": "Quantica GmbH",
      "company_seat": "Berlin",
      "details": "25.11.2024 (Bekanntmachungsdatum)\n\nBerlin Amtsgericht Berlin (Charlottenburg) HRB 199432\nEinreichung neuer Dokumente\n\nQuantica GmbH\nGesellschaft mit beschränkter Haftung\nBerlin\n\nAls nicht eingetragen wird veröffentlicht: Es wurde eine neue Liste der Aufsichtsratsmitglieder eingereicht (§52 GmbHG)."
    },
    {
      "date": "2024-11-25",
      "original_text": "Löschungsankündigung\nBaden-Württemberg Amtsgericht Stuttgart HRB 750835\nR & S Pflanzenöle GmbH – Marbach am Neckar",
      "type": "Löschungsankündigung",
      "state": "Baden-Württemberg",
      "amtsgericht": "Amtsgericht Stuttgart",
      "registernummer": "HRB 750835",
      "registerart": "HRB",
      "company_name": "R & S Pflanzenöle GmbH",
      "company_seat": "Marbach am Neckar",
      "details": "25.11.2024 (Bekanntmachungsdatum)\n\nBaden-Württemberg Amtsgericht Stuttgart HRB 750835\nLöschungsankündigung\n\nR & S Pflanzenöle GmbH\nGesellschaft mit beschränkter Haftung\nMarbach am Neckar\n\nAls nicht eingetragen wird bekanntgemacht:\nDas Gericht beabsichtigt, die Gesellschaft wegen Vermögenslosigkeit im Handelsregister von Amts wegen nach § 394 FamFG zu löschen. Die Frist zur Geltendmachung eines Widerspruchs gegen die beabsichtigte Löschung ist auf zwei Monate ab Veröffentlichung bestimmt."
    },
    {
      "date": "2024-11-25",
      "original_text": "Löschungsankündigung\nRheinland-Pfalz Amtsgericht Montabaur HRB 29329\nR-Clean GmbH Gebäudeservice – Wissen",
      "type": "Löschungsankündigung",
      "state": "Rheinland-Pfalz",
      "amtsgericht": "Amtsgericht Montabaur",
      "registernummer": "HRB 29329",
      "registerart": "HRB",
      "company_name": "R-Clean GmbH Gebäudeservice",
      "company_seat": "Wissen",
      "details": "25.11.2024 (Bekanntmachungsdatum)\n\nRheinland-Pfalz Amtsgericht Montabaur HRB 29329\nLöschungsankündigung\n\nR-Clean GmbH Gebäudeservice\nGesellschaft mit beschränkter Haftung\nWissen\n\nDas Registergericht beabsichtigt die Gesellschaft von Amts wegen nach § 394 FamFG zu löschen. Die Frist zur Erhebung eines Widerspruchs ist auf einen Monat festgesetzt."
    },
    {
      "date": "2024-11-25",
      "original_text": "Registerbekanntmachung nach dem Umwandlungsgesetz\nBaden-Württemberg Amtsgericht Mannheim HRB 738599\nRaben Germany Immobilien GmbH – Mannheim",
      "type": "Registerbekanntmachung nach dem Umwandlungsgesetz",
      "state": "Baden-Württemberg",
      "amtsgericht": "Amtsgericht Mannheim",
      "registernummer": "HRB 738599",
      "registerart": "HRB",
      "company_name": "Raben Germany Immobilien GmbH",
      "company_seat": "Mannheim",
      "details": "25.11.2024 (Bekanntmachungsdatum)\n\nBaden-Württemberg Amtsgericht Mannheim HRB 738599\nRegisterbekanntmachung nach dem Umwandlungsgesetz 25.11.2024 (Eintragungsdatum)\n\nRaben Germany Immobilien GmbH\nGesellschaft mit beschränkter Haftung\nMannheim\n\nDen Gläubigern der an der Verschmelzung beteiligten Rechtsträger ist, wenn sie binnen sechs Monaten nach dem Tag, an dem die Eintragung der Verschmelzung in das Register des Sitzes desjenigen Rechtsträgers, dessen Gläubiger sie sind, nach § 19 Abs. 3 UmwG als bekanntgemacht gilt, ihren Anspruch nach Grund und Höhe schriftlich anmelden, Sicherheit zu leisten, soweit sie nicht Befriedigung verlangen können. Dieses Recht steht den Gläubigern jedoch nur zu, wenn sie glaubhaft machen, dass durch die Verschmelzung die Erfüllung ihrer Forderung gefährdet wird."
    },
    {
      "date": "2024-11-25",
      "original_text": "Löschungsankündigung\nBremen Amtsgericht Bremen HRB 31974\nS A B A Gebäudereinigung GmbH – Bremen",
      "type": "Löschungsankündigung",
      "state": "Bremen",
      "amtsgericht": "Amtsgericht Bremen",
      "registernummer": "HRB 31974",
      "registerart": "HRB",
      "company_name": "S A B A Gebäudereinigung GmbH",
      "company_seat": "Bremen",
      "details": "25.11.2024 (Bekanntmachungsdatum)\n\nBremen Amtsgericht Bremen HRB 31974\nLöschungsankündigung\n\nS A B A Gebäudereinigung GmbH\nGesellschaft mit beschränkter Haftung\nBremen\n\nEs ist beabsichtigt die im Handelsregister eingetragene Gesellschaft von Amts wegen gemäß § 394 FamFG zu löschen. Gegen die Löschung kann beim AG Bremen schriftlich oder zu Protokoll der Geschäftsstelle Widerspruch eingelegt werden. Widerspruchsfrist 4 Wochen."
    },
    {
      "date": "2024-11-25",
      "original_text": "Löschungsankündigung\nHessen Amtsgericht Offenbach am Main HRB 49960\nSAFETY Medical UG (haftungsbeschränkt) – Offenbach am Main",
      "type": "Löschungsankündigung",
      "state": "Hessen",
      "amtsgericht": "Amtsgericht Offenbach am Main",
      "registernummer": "HRB 49960",
      "registerart": "HRB",
      "company_name": "SAFETY Medical UG (haftungsbeschränkt)",
      "company_seat": "Offenbach am Main",
      "details": "25.11.2024 (Bekanntmachungsdatum)\n\nHessen Amtsgericht Offenbach am Main HRB 49960\nLöschungsankündigung\n\nSAFETY Medical UG (haftungsbeschränkt)\nGesellschaft mit beschränkter Haftung\nOffenbach am Main\n\nDas Registergericht beabsichtigt die im Handelsregister eingetragene Gesellschaft von Amts wegen nach § 394 FamFG zu löschen. Die Frist zur Erhebung eines Widerspruchs gegen die beabsichtigte Löschung wird auf 3 Monate festgesetzt."
    },
    {
      "date": "2024-11-25",
      "original_text": "Einreichung neuer Dokumente\nMecklenburg-Vorpommern Amtsgericht Stralsund HRB 2209\nSWS Energie GmbH – Stralsund",
      "type": "Einreichung neuer Dokumente",
      "state": "Mecklenburg-Vorpommern",
      "amtsgericht": "Amtsgericht Stralsund",
      "registernummer": "HRB 2209",
      "registerart": "HRB",
      "company_name": "SWS Energie GmbH",
      "company_seat": "Stralsund",
      "details": "25.11.2024 (Bekanntmachungsdatum)\n\nMecklenburg-Vorpommern Amtsgericht Stralsund HRB 2209\nEinreichung neuer Dokumente\n\nSWS Energie GmbH\nGesellschaft mit beschränkter Haftung\nStralsund\n\nEine Liste der Mitglieder des Aufsichtsrats ist zum Handelsregister eingereicht worden."
    },
    {
      "date": "2024-11-25",
      "original_text": "Einreichung neuer Dokumente\nSachsen Amtsgericht Dresden HRB 24980\nSachsenNetze GmbH – Dresden",
      "type": "Einreichung neuer Dokumente",
      "state": "Sachsen",
      "amtsgericht": "Amtsgericht Dresden",
      "registernummer": "HRB 24980",
      "registerart": "HRB",
      "company_name": "SachsenNetze GmbH",
      "company_seat": "Dresden",
      "details": "25.11.2024 (Bekanntmachungsdatum)\n\nSachsen Amtsgericht Dresden HRB 24980\nEinreichung neuer Dokumente\n\nSachsenNetze GmbH\nGesellschaft mit beschränkter Haftung\nDresden\n\nAm 22.11.2024 wurde beim Handelsregister des Amtsgerichts Dresden die Liste der Mitglieder des Aufsichtsrats gemäß § 52 GmbHG eingereicht."
    },
    {
      "date": "2024-11-25",
      "original_text": "Einreichung neuer Dokumente\nSachsen Amtsgericht Dresden HRB 24998\nSachsenNetze HS.HD GmbH – Dresden",
      "type": "Einreichung neuer Dokumente",
      "state": "Sachsen",
      "amtsgericht": "Amtsgericht Dresden",
      "registernummer": "HRB 24998",
      "registerart": "HRB",
      "company_name": "SachsenNetze HS.HD GmbH",
      "company_seat": "Dresden",
      "details": "25.11.2024 (Bekanntmachungsdatum)\n\nSachsen Amtsgericht Dresden HRB 24998\nEinreichung neuer Dokumente\n\nSachsenNetze HS.HD GmbH\nGesellschaft mit beschränkter Haftung\nDresden\n\nAm 22.11.2024 wurde beim Handelsregister des Amtsgerichts Dresden die Liste der Mitglieder des Aufsichtsrats gemäß § 52 GmbHG eingereicht."
    },
    {
      "date": "2024-11-25",
      "original_text": "Löschungsankündigung\nNordrhein-Westfalen Amtsgericht Gelsenkirchen HRB 11529\nSari Immobilien Management GmbH – Bottrop",
      "type": "Löschungsankündigung",
      "state": "Nordrhein-Westfalen",
      "amtsgericht": "Amtsgericht Gelsenkirchen",
      "registernummer": "HRB 11529",
      "registerart": "HRB",
      "company_name": "Sari Immobilien Management GmbH",
      "company_seat": "Bottrop",
      "details": "25.11.2024 (Bekanntmachungsdatum)\n\nNordrhein-Westfalen Amtsgericht Gelsenkirchen HRB 11529\nLöschungsankündigung\n\nSari Immobilien Management GmbH\nGesellschaft mit beschränkter Haftung\nBottrop\n\nDas Gericht beabsichtigt, die Gesellschaft Sari Immobilien Management GmbH mit Sitz in Bottrop, HRB 11529 Amtsgericht Gelsenkirchen, wegen Vermögenslosigkeit zu löschen.\n\nHiermit wird denjenigen, die an der Unterlassung der Löschung ein berechtigtes Interesse haben, gem. § 394 Abs. 2 FamFG Gelegenheit gegeben, gegen dieses Vorhaben binnen eines Monats nach dieser Bekanntmachung Widerspruch einzulegen. Der Widerspruch kann schriftlich oder zu Protokoll der Geschäftsstelle erhoben werden."
    },
    {
      "date": "2024-11-25",
      "original_text": "Registerbekanntmachung nach dem Umwandlungsgesetz\nNordrhein-Westfalen Amtsgericht Düsseldorf HRB 86458\nShow Management Investor Beteiligungs GmbH – Düsseldorf",
      "type": "Registerbekanntmachung nach dem Umwandlungsgesetz",
      "state": "Nordrhein-Westfalen",
      "amtsgericht": "Amtsgericht Düsseldorf",
      "registernummer": "HRB 86458",
      "registerart": "HRB",
      "company_name": "Show Management Investor Beteiligungs GmbH",
      "company_seat": "Düsseldorf",
      "details": "25.11.2024 (Bekanntmachungsdatum)\n\nNordrhein-Westfalen Amtsgericht Düsseldorf HRB 86458\nRegisterbekanntmachung nach dem Umwandlungsgesetz 25.11.2024 (Eintragungsdatum)\n\nShow Management Investor Beteiligungs GmbH\nGesellschaft mit beschränkter Haftung\nDüsseldorf\n\nDen Gläubigern der an der Verschmelzung beteiligten Rechtsträger ist, wenn sie binnen sechs Monaten nach dem Tag, an dem die Eintragung der Verschmelzung in das Register des Sitzes desjenigen Rechtsträgers, dessen Gläubiger sie sind, nach § 19 Absatz 3 UmwG als bekanntgemacht gilt, ihren Anspruch nach Grund und Höhe schriftlich anmelden, Sicherheit zu leisten, soweit sie nicht Befriedigung verlangen können. Dieses Recht steht den Gläubigern jedoch nur zu, wenn sie glaubhaft machen, dass durch die Verschmelzung die Erfüllung ihrer Forderung gefährdet wird."
    },
    {
      "date": "2024-11-25",
      "original_text": "Löschungsankündigung\nNordrhein-Westfalen Amtsgericht Coesfeld HRB 19780\nSmart Protect Deutschland UG (haftungsbeschränkt) – Gronau",
      "type": "Löschungsankündigung",
      "state": "Nordrhein-Westfalen",
      "amtsgericht": "Amtsgericht Coesfeld",
      "registernummer": "HRB 19780",
      "registerart": "HRB",
      "company_name": "Smart Protect Deutschland UG (haftungsbeschränkt)",
      "company_seat": "Gronau",
      "details": "25.11.2024 (Bekanntmachungsdatum)\n\nNordrhein-Westfalen Amtsgericht Coesfeld HRB 19780\nLöschungsankündigung\n\nSmart Protect Deutschland UG (haftungsbeschränkt)\nGesellschaft mit beschränkter Haftung\nGronau\n\nDas Registergericht beabsichtigt, den Rechtsträger wegen Vermögenslosigkeit gemäß § 394 FamFG von Amts wegen zu löschen.\n\nGegen diese Verfügung kann Widerspruch eingelegt werden. Die Frist zur Erhebung eines Widerspruchs gegen die beabsichtigte Löschung ist auf zwei Monate ab Veröffentlichung festgesetzt."
    },
    {
      "date": "2024-11-25",
      "original_text": "Einreichung neuer Dokumente\nNordrhein-Westfalen Amtsgericht Aachen HRB 14607\nStW aachen SERVICE gmbh – Aachen",
      "type": "Einreichung neuer Dokumente",
      "state": "Nordrhein-Westfalen",
      "amtsgericht": "Amtsgericht Aachen",
      "registernummer": "HRB 14607",
      "registerart": "HRB",
      "company_name": "StW aachen SERVICE gmbh",
      "company_seat": "Aachen",
      "details": "25.11.2024 (Bekanntmachungsdatum)\n\nNordrhein-Westfalen Amtsgericht Aachen HRB 14607\nEinreichung neuer Dokumente 25.11.2024 (Eintragungsdatum)\n\nStW aachen SERVICE gmbh\nGesellschaft mit beschränkter Haftung\nAachen\n\nDem Registergericht ist eine neue Liste der Mitglieder des Aufsichtsrates eingereicht worden."
    },
    {
      "date": "2024-11-25",
      "original_text": "Einreichung neuer Dokumente\nSaarland Amtsgericht Saarbrücken HRB 63710\nStadtwerke Merzig Gesellschaft mit beschränkter Haftung – Merzig",
      "type": "Einreichung neuer Dokumente",
      "state": "Saarland",
      "amtsgericht": "Amtsgericht Saarbrücken",
      "registernummer": "HRB 63710",
      "registerart": "HRB",
      "company_name": "Stadtwerke Merzig Gesellschaft mit beschränkter Haftung",
      "company_seat": "Merzig",
      "details": "25.11.2024 (Bekanntmachungsdatum)\n\nSaarland Amtsgericht Saarbrücken HRB 63710\nEinreichung neuer Dokumente\n\nStadtwerke Merzig Gesellschaft mit beschränkter Haftung\nGesellschaft mit beschränkter Haftung\nMerzig\n\nDie Geschäftsführung der Gesellschaft hat eine Liste der Mitglieder des Aufsichtsrats zum Handelsregister eingereicht (§ 52 Abs. 3 Satz 2 GmbHG)."
    },
    {
      "date": "2024-11-25",
      "original_text": "Einreichung neuer Dokumente\nMecklenburg-Vorpommern Amtsgericht Schwerin HRB 7105\nStädtische Kindertageseinrichtungen der Landeshauptstadt Schwerin gemeinnützige GmbH - Kita gGmbH – Schwerin",
      "type": "Einreichung neuer Dokumente",
      "state": "Mecklenburg-Vorpommern",
      "amtsgericht": "Amtsgericht Schwerin",
      "registernummer": "HRB 7105",
      "registerart": "HRB",
      "company_name": "Städtische Kindertageseinrichtungen der Landeshauptstadt Schwerin gemeinnützige GmbH - Kita gGmbH",
      "company_seat": "Schwerin",
      "details": "25.11.2024 (Bekanntmachungsdatum)\n\nMecklenburg-Vorpommern Amtsgericht Schwerin HRB 7105\nEinreichung neuer Dokumente 25.11.2024 (Eintragungsdatum)\n\nStädtische Kindertageseinrichtungen der Landeshauptstadt Schwerin gemeinnützige GmbH - Kita gGmbH\nGesellschaft mit beschränkter Haftung\nSchwerin\n\nEine Liste der Mitglieder des Aufsichtsrats ist zum Handelsregister eingereicht worden."
    },
    {
      "date": "2024-11-25",
      "original_text": "Einreichung neuer Dokumente\nBaden-Württemberg Amtsgericht Mannheim HRB 350098\nStädtische Wohnungsbaugesellschaft Wiesloch mit beschränkter Haftung – Wiesloch",
      "type": "Einreichung neuer Dokumente",
      "state": "Baden-Württemberg",
      "amtsgericht": "Amtsgericht Mannheim",
      "registernummer": "HRB 350098",
      "registerart": "HRB",
      "company_name": "Städtische Wohnungsbaugesellschaft Wiesloch mit beschränkter Haftung",
      "company_seat": "Wiesloch",
      "details": "25.11.2024 (Bekanntmachungsdatum)\n\nBaden-Württemberg Amtsgericht Mannheim HRB 350098\nEinreichung neuer Dokumente\n\nStädtische Wohnungsbaugesellschaft Wiesloch mit beschränkter Haftung\nGesellschaft mit beschränkter Haftung\nWiesloch\n\nDie Gesellschaft hat am 20.11.2024 die Liste über die Zusammensetzung des Aufsichtsrats zum Handelsregister eingereicht."
    },
    {
      "date": "2024-11-25",
      "original_text": "Löschungsankündigung\nHessen Amtsgericht Frankfurt am Main HRB 107009\nSynergy Construct Deutschland GmbH – Frankfurt am Main",
      "type": "Löschungsankündigung",
      "state": "Hessen",
      "amtsgericht": "Amtsgericht Frankfurt am Main",
      "registernummer": "HRB 107009",
      "registerart": "HRB",
      "company_name": "Synergy Construct Deutschland GmbH",
      "company_seat": "Frankfurt am Main",
      "details": "25.11.2024 (Bekanntmachungsdatum)\n\nHessen Amtsgericht Frankfurt am Main HRB 107009\nLöschungsankündigung\n\nSynergy Construct Deutschland GmbH\nGesellschaft mit beschränkter Haftung\nFrankfurt am Main\n\nDas Registergericht beabsichtigt die im Handelsregister eingetragene Gesellschaft von Amts wegen nach § 394 FamFG zu löschen. Die Frist zur Erhebung eines Widerspruchs gegen die beabsichtigte Löschung wird auf  Monat festgesetzt."
    },
    {
      "date": "2024-11-25",
      "original_text": "Einreichung neuer Dokumente\nNordrhein-Westfalen Amtsgericht Bochum HRB 9353 früher Amtsgericht Herne\nTGG Tagungsstätten- und Gastronomiegesellschaft Herne mbH – Herne",
      "type": "Einreichung neuer Dokumente",
      "state": "Nordrhein-Westfalen",
      "amtsgericht": "Amtsgericht Bochum",
      "registernummer": "HRB 9353",
      "registerart": "HRB",
      "company_name": "TGG Tagungsstätten- und Gastronomiegesellschaft Herne mbH",
      "company_seat": "Herne",
      "former_amtsgericht": "Herne",
      "details": "25.11.2024 (Bekanntmachungsdatum)\n\nNordrhein-Westfalen Amtsgericht Bochum HRB 9353 früher Amtsgericht Herne\nEinreichung neuer Dokumente 25.11.2024 (Eintragungsdatum)\n\nTGG Tagungsstätten- und Gastronomiegesellschaft Herne mbH\nGesellschaft mit beschränkter Haftung\nHerne\n\nDem Registergericht ist eine Liste der Mitglieder des Aufsichtsrates eingereicht worden."
    },
    {
      "date": "2024-11-25",
      "original_text": "Einreichung neuer Dokumente\nNordrhein-Westfalen Amtsgericht Bochum HRB 9353 früher Amtsgericht Herne\nTGG Tagungsstätten- und Gastronomiegesellschaft Herne mbH – Herne",
      "type": "Einreichung neuer Dokumente",
      "state": "Nordrhein-Westfalen",
      "amtsgericht": "Amtsgericht Bochum",
      "registernummer": "HRB 9353",
      "registerart": "HRB",
      "company_name": "TGG Tagungsstätten- und Gastronomiegesellschaft Herne mbH",
      "company_seat": "Herne",
      "former_amtsgericht": "Herne",
      "details": "25.11.2024 (Bekanntmachungsdatum)\n\nNordrhein-Westfalen Amtsgericht Bochum HRB 9353 früher Amtsgericht Herne\nEinreichung neuer Dokumente 25.11.2024 (Eintragungsdatum)\n\nTGG Tagungsstätten- und Gastronomiegesellschaft Herne mbH\nGesellschaft mit beschränkter Haftung\nHerne\n\nDem Registergericht ist eine Liste der Mitglieder des Aufsichtsrates eingereicht worden."
    },
    {
      "date": "2024-11-25",
      "original_text": "Registerbekanntmachung nach dem Umwandlungsgesetz\nSachsen-Anhalt Amtsgericht Stendal HRA 7523\nTino Graßhof e.K. – Magdeburg",
      "type": "Registerbekanntmachung nach dem Umwandlungsgesetz",
      "state": "Sachsen-Anhalt",
      "amtsgericht": "Amtsgericht Stendal",
      "registernummer": "HRA 7523",
      "registerart": "HRA",
      "company_name": "Tino Graßhof e.K.",
      "company_seat": "Magdeburg",
      "details": "25.11.2024 (Bekanntmachungsdatum)\n\nSachsen-Anhalt Amtsgericht Stendal HRA 7523\nRegisterbekanntmachung nach dem Umwandlungsgesetz 25.11.2024 (Eintragungsdatum)\n\nTino Graßhof e.K.\nEinzelkaufmann / Einzelkauffrau\nMagdeburg\n\nNicht eingetragen:\nDen Gläubigern der an der Ausgliederung beteiligten Rechtsträger, ist wenn sie binnen sechs Monaten nach dem Tag, an dem die Eintragung der Ausgliederung nach §§125, 19 Abs. 3 UmwG als bekanntgemacht gilt, ihren Anspruch nach Grund und Höhe schriftlich anmelden, Sicherheit zu leisten, soweit sie nicht Befriedigung verlangen können. Diese Recht steht ihnen jedoch nur zu, wenn sie glaubhaft machen, dass durch die Ausgliederung die Erfüllung ihrer Forderung gefährdet wird."
    },
    {
      "date": "2024-11-25",
      "original_text": "Registerbekanntmachung nach dem Umwandlungsgesetz\nBrandenburg Amtsgericht Potsdam HRA 8499\nTischlerei Stein e.K. – Ludwigsfelde",
      "type": "Registerbekanntmachung nach dem Umwandlungsgesetz",
      "state": "Brandenburg",
      "amtsgericht": "Amtsgericht Potsdam",
      "registernummer": "HRA 8499",
      "registerart": "HRA",
      "company_name": "Tischlerei Stein e.K.",
      "company_seat": "Ludwigsfelde",
      "details": "25.11.2024 (Bekanntmachungsdatum)\n\nBrandenburg Amtsgericht Potsdam HRA 8499\nRegisterbekanntmachung nach dem Umwandlungsgesetz 22.11.2024 (Eintragungsdatum)\n\nTischlerei Stein e.K.\nEinzelkaufmann / Einzelkauffrau\nLudwigsfelde\n\nZu Eintragungsnummer 2 vom 22.11.2024 wird als nicht eingetragen veröffentlicht: Den Gläubigern der an der Ausgliederung beteiligten Rechtsträger ist, wenn sie binnen sechs Monaten nach dem Tag, an dem die Eintragung der Ausgliederung in das Register des Sitzes desjenigen Rechtsträgers, dessen Gläubiger sie sind, als bekannt gemacht gilt, ihren Anspruch nach Grund und Höhe schriftlich anmelden, Sicherheit zu leisten, soweit sie nicht Befriedigung verlangen können. Dieses Recht steht den Gläubigern jedoch nur zu, wenn sie glaubhaft machen, dass durch die Ausgliederung die Erfüllung ihrer Forderung gefährdet wird."
    },
    {
      "date": "2024-11-25",
      "original_text": "Sonstige Registerbekanntmachung\nNordrhein-Westfalen Amtsgericht Siegen HRB 9512\nTuS Ferndorf Handball GmbH – Kreuztal",
      "type": "Sonstige Registerbekanntmachung",
      "state": "Nordrhein-Westfalen",
      "amtsgericht": "Amtsgericht Siegen",
      "registernummer": "HRB 9512",
      "registerart": "HRB",
      "company_name": "TuS Ferndorf Handball GmbH",
      "company_seat": "Kreuztal",
      "details": "25.11.2024 (Bekanntmachungsdatum)\n\nNordrhein-Westfalen Amtsgericht Siegen HRB 9512\nSonstige Registerbekanntmachung 25.11.2024 (Eintragungsdatum)\n\nTuS Ferndorf Handball GmbH\nGesellschaft mit beschränkter Haftung\nKreuztal\n\nDem Registergericht ist eine neue Liste der Mitglieder des Aufsichtsrates eingereicht worden."
    },
    {
      "date": "2024-11-25",
      "original_text": "Löschungsankündigung\nRheinland-Pfalz Amtsgericht Mainz HRA 43141\nVArea GmbH & Co. KG – Mainz",
      "type": "Löschungsankündigung",
      "state": "Rheinland-Pfalz",
      "amtsgericht": "Amtsgericht Mainz",
      "registernummer": "HRA 43141",
      "registerart": "HRA",
      "company_name": "VArea GmbH & Co. KG",
      "company_seat": "Mainz",
      "details": "25.11.2024 (Bekanntmachungsdatum)\n\nRheinland-Pfalz Amtsgericht Mainz HRA 43141\nLöschungsankündigung\n\nVArea GmbH & Co. KG\nKommanditgesellschaft\nMainz\n\nDas Registergericht beabsichtigt die Firma von Amts wegen nach § 394 FamFG zu löschen. Die Frist zur Erhebung eines Widerspruchs ist auf einen Monat festgesetzt."
    },
    {
      "date": "2024-11-25",
      "original_text": "Registerbekanntmachung nach dem Umwandlungsgesetz\nHessen Amtsgericht Offenbach am Main HRB 48478\nViridium Service Management GmbH – Neu-Isenburg",
      "type": "Registerbekanntmachung nach dem Umwandlungsgesetz",
      "state": "Hessen",
      "amtsgericht": "Amtsgericht Offenbach am Main",
      "registernummer": "HRB 48478",
      "registerart": "HRB",
      "company_name": "Viridium Service Management GmbH",
      "company_seat": "Neu-Isenburg",
      "details": "25.11.2024 (Bekanntmachungsdatum)\n\nHessen Amtsgericht Offenbach am Main HRB 48478\nRegisterbekanntmachung nach dem Umwandlungsgesetz 25.11.2024 (Eintragungsdatum)\n\nViridium Service Management GmbH\nGesellschaft mit beschränkter Haftung\nNeu-Isenburg\n\nDen Gläubigern der an der Verschmelzung beteiligten Rechtsträger ist, wenn sie binnen sechs Monaten nach dem Tag, an dem die Eintragung der Verschmelzung in das Register des Sitzes desjenigen Rechtsträgers, dessen Gläubiger sie sind, nach § 19 Absatz 3 UmwG bekannt gemacht worden ist, ihren Anspruch nach Grund und Höhe schriftlich anmelden, Sicherheit zu leisten, soweit sie nicht Befriedigung verlangen können. Dieses Recht steht den Gläubigern jedoch nur zu, wenn sie glaubhaft machen, dass durch die Verschmelzung die Erfüllung ihrer Forderung gefährdet wird."
    },
    {
      "date": "2024-11-25",
      "original_text": "Registerbekanntmachung nach dem Umwandlungsgesetz\nMecklenburg-Vorpommern Amtsgericht Schwerin VR 4180\nVolkssolidarität, Kreisverband Schwerin/Nordwestmecklenburg e.V. – Gadebusch",
      "type": "Registerbekanntmachung nach dem Umwandlungsgesetz",
      "state": "Mecklenburg-Vorpommern",
      "amtsgericht": "Amtsgericht Schwerin",
      "registernummer": "VR 4180",
      "registerart": "VR",
      "company_name": "Volkssolidarität, Kreisverband Schwerin/Nordwestmecklenburg e.V.",
      "company_seat": "Gadebusch",
      "details": "25.11.2024 (Bekanntmachungsdatum)\n\nMecklenburg-Vorpommern Amtsgericht Schwerin VR 4180\nRegisterbekanntmachung nach dem Umwandlungsgesetz 25.11.2024 (Eintragungsdatum)\n\nVolkssolidarität, Kreisverband Schwerin/Nordwestmecklenburg e.V.\neingetragener Verein\nGadebusch\n\nAls nicht eingetragen wird veröffentlicht: Den Gläubigern der an dem Formwechsel beteiligten Rechtsträger ist, wenn sie binnen sechs\nMonaten nach dem Tag, an dem die Eintragung des Formwechsels in das Register des Sitzes desjenigen Rechtsträgers, dessen Gläubiger sie sind, nach § 19 Abs. 3 UmwG als bekannt gemacht gilt, ihren Anspruch nach Grund und Höhe schriftlich anmelden, Sicherheit zu leisten, soweit sie nicht Befriedigung verlangen können. Dieses Recht steht den Gläubigern jedoch nur zu, wenn sie glaubhaft machen, dass durch die Umwandlung die Erfüllung der Forderung gefährdet wird."
    },
    {
      "date": "2024-11-25",
      "original_text": "Einreichung neuer Dokumente\nBaden-Württemberg Amtsgericht Mannheim HRB 105385\nVolkswohnung Service GmbH – Karlsruhe",
      "type": "Einreichung neuer Dokumente",
      "state": "Baden-Württemberg",
      "amtsgericht": "Amtsgericht Mannheim",
      "registernummer": "HRB 105385",
      "registerart": "HRB",
      "company_name": "Volkswohnung Service GmbH",
      "company_seat": "Karlsruhe",
      "details": "25.11.2024 (Bekanntmachungsdatum)\n\nBaden-Württemberg Amtsgericht Mannheim HRB 105385\nEinreichung neuer Dokumente\n\nVolkswohnung Service GmbH\nGesellschaft mit beschränkter Haftung\nKarlsruhe\n\nDie Gesellschaft hat am 22.11.2024 die Liste über die Zusammensetzung des Aufsichtsrats zum Handelsregister eingereicht."
    },
    {
      "date": "2024-11-25",
      "original_text": "Registerbekanntmachung nach dem Umwandlungsgesetz\nSachsen Amtsgericht Leipzig HRB 14154\nWirtschaftsförderungs- und Projektentwicklungsgesellschaft der Stadt Torgau mbH – Torgau",
      "type": "Registerbekanntmachung nach dem Umwandlungsgesetz",
      "state": "Sachsen",
      "amtsgericht": "Amtsgericht Leipzig",
      "registernummer": "HRB 14154",
      "registerart": "HRB",
      "company_name": "Wirtschaftsförderungs- und Projektentwicklungsgesellschaft der Stadt Torgau mbH",
      "company_seat": "Torgau",
      "details": "25.11.2024 (Bekanntmachungsdatum)\n\nSachsen Amtsgericht Leipzig HRB 14154\nRegisterbekanntmachung nach dem Umwandlungsgesetz 25.11.2024 (Eintragungsdatum)\n\nWirtschaftsförderungs- und Projektentwicklungsgesellschaft der Stadt Torgau mbH\nGesellschaft mit beschränkter Haftung\nTorgau\n\nDen Gläubigern der an der Verschmelzung beteiligten Rechtsträger ist, wenn sie binnen sechs Monaten nach dem Tag, an dem die Eintragung der Verschmelzung in das Register des Sitzes desjenigen Rechtsträgers, dessen Gläubiger sie sind, nach § 19 Abs. 3 UmwG als bekannt gemacht gilt, ihren Anspruch nach Grund und Höhe schriftlich anmelden, Sicherheit zu leisten, soweit sie nicht Befriedigung verlangen können. Dieses Recht steht den Gläubigern jedoch nur zu, wenn sie glaubhaft machen, dass durch die Verschmelzung die Erfüllung der Forderung gefährdet wird."
    },
    {
      "date": "2024-11-25",
      "original_text": "Einreichung neuer Dokumente\nBaden-Württemberg Amtsgericht Freiburg HRB 721134\nWohn- und Gewerbeförderung Allensbach GmbH – Allensbach",
      "type": "Einreichung neuer Dokumente",
      "state": "Baden-Württemberg",
      "amtsgericht": "Amtsgericht Freiburg",
      "registernummer": "HRB 721134",
      "registerart": "HRB",
      "company_name": "Wohn- und Gewerbeförderung Allensbach GmbH",
      "company_seat": "Allensbach",
      "details": "25.11.2024 (Bekanntmachungsdatum)\n\nBaden-Württemberg Amtsgericht Freiburg HRB 721134\nEinreichung neuer Dokumente\n\nWohn- und Gewerbeförderung Allensbach GmbH\nGesellschaft mit beschränkter Haftung\nAllensbach\n\nDie Gesellschaft hat am 24.11.2024 die Liste über die Zusammensetzung des Aufsichtsrats zum Handelsregister eingereicht."
    },
    {
      "date": "2024-11-25",
      "original_text": "Registerbekanntmachung nach dem Umwandlungsgesetz\nBaden-Württemberg Amtsgericht Mannheim HRA 712108\nbe.social e.K. Inhaber Paul Przyklek – Mannheim",
      "type": "Registerbekanntmachung nach dem Umwandlungsgesetz",
      "state": "Baden-Württemberg",
      "amtsgericht": "Amtsgericht Mannheim",
      "registernummer": "HRA 712108",
      "registerart": "HRA",
      "company_name": "be.social e.K. Inhaber Paul Przyklek",
      "company_seat": "Mannheim",
      "details": "25.11.2024 (Bekanntmachungsdatum)\n\nBaden-Württemberg Amtsgericht Mannheim HRA 712108\nRegisterbekanntmachung nach dem Umwandlungsgesetz 25.11.2024 (Eintragungsdatum)\n\nbe.social e.K. Inhaber Paul Przyklek\nEinzelkaufmann / Einzelkauffrau\nMannheim\n\nDen Gläubigern der an der Ausgliederung beteiligten Rechtsträger ist, wenn sie binnen sechs Monaten nach dem Tag, an dem die Eintragung der Ausgliederung in das Register des Sitzes desjenigen Rechtsträgers, dessen Gläubiger sie sind, nach § 19 Abs. 3 UmwG als bekanntgemacht gilt, ihren Anspruch nach Grund und Höhe schriftlich anmelden, Sicherheit zu leisten, soweit sie nicht Befriedigung verlangen können. Dieses Recht steht den Gläubigern jedoch nur zu, wenn sie glaubhaft machen, dass durch die Ausgliederung die Erfüllung ihrer Forderung gefährdet wird."
    },
    {
      "date": "2024-11-25",
      "original_text": "Einreichung neuer Dokumente\nNordrhein-Westfalen Amtsgericht Köln HRB 42852\nmatratzen direct AG – Köln",
      "type": "Einreichung neuer Dokumente",
      "state": "Nordrhein-Westfalen",
      "amtsgericht": "Amtsgericht Köln",
      "registernummer": "HRB 42852",
      "registerart": "HRB",
      "company_name": "matratzen direct AG",
      "company_seat": "Köln",
      "details": "25.11.2024 (Bekanntmachungsdatum)\n\nNordrhein-Westfalen Amtsgericht Köln HRB 42852\nEinreichung neuer Dokumente 12.11.2024 (Eintragungsdatum)\n\nmatratzen direct AG\nAktiengesellschaft\nKöln\n\nDem Registergericht ist eine Liste der Mitglieder des Aufsichtsrates eingereicht worden."
    },
    {
      "date": "2024-11-25",
      "original_text": "Registerbekanntmachung nach dem Umwandlungsgesetz\nBaden-Württemberg Amtsgericht Stuttgart HRB 771033\nparsionate GmbH – Stuttgart",
      "type": "Registerbekanntmachung nach dem Umwandlungsgesetz",
      "state": "Baden-Württemberg",
      "amtsgericht": "Amtsgericht Stuttgart",
      "registernummer": "HRB 771033",
      "registerart": "HRB",
      "company_name": "parsionate GmbH",
      "company_seat": "Stuttgart",
      "details": "25.11.2024 (Bekanntmachungsdatum)\n\nBaden-Württemberg Amtsgericht Stuttgart HRB 771033\nRegisterbekanntmachung nach dem Umwandlungsgesetz 25.11.2024 (Eintragungsdatum)\n\nparsionate GmbH\nGesellschaft mit beschränkter Haftung\nStuttgart\n\nAls nicht eingetragen wird bekanntgemacht:\nDen Gläubigern der an der Verschmelzung beteiligten Rechtsträger ist, wenn sie binnen sechs Monaten nach dem Tag, an dem die Eintragung der Verschmelzung in das Register des Sitzes desjenigen Rechtsträgers, dessen Gläubiger sie sind, nach § 19 Abs. 3 UmwG als bekanntgemacht gilt, ihren Anspruch nach Grund und Höhe schriftlich anmelden, Sicherheit zu leisten, soweit sie nicht Befriedigung verlangen können. Dieses Recht steht den Gläubigern jedoch nur zu, wenn sie glaubhaft machen, dass durch die Verschmelzung die Erfüllung ihrer Forderung gefährdet wird."
    },
    {
      "date": "2024-11-25",
      "original_text": "Einreichung neuer Dokumente\nNiedersachsen Amtsgericht Osnabrück HRB 18010\npbr Planungsbüro Rohling AG – Osnabrück",
      "type": "Einreichung neuer Dokumente",
      "state": "Niedersachsen",
      "amtsgericht": "Amtsgericht Osnabrück",
      "registernummer": "HRB 18010",
      "registerart": "HRB",
      "company_name": "pbr Planungsbüro Rohling AG",
      "company_seat": "Osnabrück",
      "details": "25.11.2024 (Bekanntmachungsdatum)\n\nNiedersachsen Amtsgericht Osnabrück HRB 18010\nEinreichung neuer Dokumente\n\npbr Planungsbüro Rohling AG\nAktiengesellschaft\nOsnabrück\n\nDie Liste der Mitglieder des Aufsichtsrats wurde beim Registergericht eingereicht."
    }
  ]
}