{
  "date": "2024-11-22",
  "date_of_scrape": "2024-11-30T13:09:06.373Z",
  "tool_version": "0.2.0",
  "number_of_announcements": 102,
  "announcements": [
    {
      "date": "2024-11-22",
      "id": "94381",
      "original_text": "Registerbekanntmachung nach dem Umwandlungsgesetz\nNiedersachsen Amtsgericht Walsrode HRB 121603\nACS achim gmbh – Achim",
      "type": "Registerbekanntmachung nach dem Umwandlungsgesetz",
      "state": "Niedersachsen",
      "amtsgericht": "Amtsgericht Walsrode",
      "registernummer": "HRB 121603",
      "registerart": "HRB",
      "company_name": "ACS achim gmbh",
      "company_seat": "Achim",
      "details": "22.11.2024 (Bekanntmachungsdatum)\n\nNiedersachsen Amtsgericht Walsrode HRB 121603\nRegisterbekanntmachung nach dem Umwandlungsgesetz 22.11.2024 (Eintragungsdatum)\n\nACS achim gmbh\nGesellschaft mit beschränkter Haftung\nAchim\n\nDen Gläubigern der an der Verschmelzung beteiligten Rechtsträger ist, wenn sie binnen sechs Monaten nach dem Tag, an dem die Eintragung der Verschmelzung in das Register des Sitzes desjenigen Rechtsträgers, dessen Gläubiger sie sind, nach § 19  Abs.  3 UmwG als bekannt gemacht gilt, ihren Anspruch nach Grund und Höhe schriftlich anmelden, Sicherheit zu leisten, soweit sie nicht Befriedigung verlangen können. Dieses Recht steht den Gläubigern jedoch nur zu, wenn sie glaubhaft machen, dass durch die Verschmelzung die Erfüllung der Forderung gefährdet wird."
    },
    {
      "date": "2024-11-22",
      "id": "94321",
      "original_text": "Registerbekanntmachung nach dem Umwandlungsgesetz\nBayern Amtsgericht Traunstein HRB 32470\nAF-K Holding GmbH – Kastl",
      "type": "Registerbekanntmachung nach dem Umwandlungsgesetz",
      "state": "Bayern",
      "amtsgericht": "Amtsgericht Traunstein",
      "registernummer": "HRB 32470",
      "registerart": "HRB",
      "company_name": "AF-K Holding GmbH",
      "company_seat": "Kastl",
      "details": "22.11.2024 (Bekanntmachungsdatum)\n\nBayern Amtsgericht Traunstein HRB 32470\nRegisterbekanntmachung nach dem Umwandlungsgesetz 21.11.2024 (Eintragungsdatum)\n\nAF-K Holding GmbH\nGesellschaft mit beschränkter Haftung\nKastl\n\nDen Gläubigern der an der Spaltung beteiligten Rechtsträger ist, wenn sie binnen sechs Monaten nach dem Tag, an dem die Eintragung der Spaltung in das Register des Sitzes desjenigen Rechtsträgers, dessen Gläubiger sie sind, nach §§ 125, 19 Abs. 3 UmwG als bekannt gemacht gilt, ihren Anspruch nach Grund und Höhe schriftlich anmelden, Sicherheit zu leisten, soweit sie nicht Befriedigung verlangen können. Dieses Recht steht den Gläubigern jedoch nur zu, wenn sie glaubhaft machen, dass durch die Spaltung die Erfüllung ihrer Forderung gefährdet wird."
    },
    {
      "date": "2024-11-22",
      "id": "94387",
      "original_text": "Löschungsankündigung\nRheinland-Pfalz Amtsgericht Ludwigshafen a.Rhein (Ludwigshafen) HRB 42382\nAZAK BÄCKEREI & KONDITOREI GmbH – Neustadt/Weinstraße",
      "type": "Löschungsankündigung",
      "state": "Rheinland-Pfalz",
      "amtsgericht": "Amtsgericht Ludwigshafen a.Rhein (Ludwigshafen)",
      "registernummer": "HRB 42382",
      "registerart": "HRB",
      "company_name": "AZAK BÄCKEREI & KONDITOREI GmbH",
      "company_seat": "Neustadt/Weinstraße",
      "details": "22.11.2024 (Bekanntmachungsdatum)\n\nRheinland-Pfalz Amtsgericht Ludwigshafen a.Rhein (Ludwigshafen) HRB 42382\nLöschungsankündigung\n\nAZAK BÄCKEREI & KONDITOREI GmbH\nGesellschaft mit beschränkter Haftung\nNeustadt/Weinstraße\n\nDas Registergericht beabsichtigt die Gesellschaft von Amts wegen nach § 394 FamFG zu löschen. Die Frist zur Erhebung eines Widerspruchs ist auf einen Monat festgesetzt."
    },
    {
      "date": "2024-11-22",
      "id": "94409",
      "original_text": "Registerbekanntmachung nach dem Umwandlungsgesetz\nNordrhein-Westfalen Amtsgericht Arnsberg HRA 4845\nAmecke GmbH & Co. KG – Menden",
      "type": "Registerbekanntmachung nach dem Umwandlungsgesetz",
      "state": "Nordrhein-Westfalen",
      "amtsgericht": "Amtsgericht Arnsberg",
      "registernummer": "HRA 4845",
      "registerart": "HRA",
      "company_name": "Amecke GmbH & Co. KG",
      "company_seat": "Menden",
      "details": "22.11.2024 (Bekanntmachungsdatum)\n\nNordrhein-Westfalen Amtsgericht Arnsberg HRA 4845\nRegisterbekanntmachung nach dem Umwandlungsgesetz 21.11.2024 (Eintragungsdatum)\n\nAmecke GmbH & Co. KG\nKommanditgesellschaft\nMenden\n\nDen Gläubigern der an der Verschmelzung beteiligten Rechtsträger ist, wenn sie binnen sechs Monaten nach dem Tag, an dem die Eintragung der Verschmelzung in das Register des Sitzes desjenigen Rechtsträgers, dessen Gläubiger sie sind, nach § 19 Absatz 3 UmwG als bekanntgemacht gilt, ihren Anspruch nach Grund und Höhe schriftlich anmelden, Sicherheit zu leisten, soweit sie nicht Befriedigung verlangen können. Dieses Recht steht den Gläubigern jedoch nur zu, wenn sie glaubhaft machen, dass durch die Verschmelzung die Erfüllung ihrer Forderung gefährdet wird."
    },
    {
      "date": "2024-11-22",
      "id": "94410",
      "original_text": "Registerbekanntmachung nach dem Umwandlungsgesetz\nNordrhein-Westfalen Amtsgericht Arnsberg HRA 4573\nAmecke-Mönnighof GmbH & Co. KG – Menden",
      "type": "Registerbekanntmachung nach dem Umwandlungsgesetz",
      "state": "Nordrhein-Westfalen",
      "amtsgericht": "Amtsgericht Arnsberg",
      "registernummer": "HRA 4573",
      "registerart": "HRA",
      "company_name": "Amecke-Mönnighof GmbH & Co. KG",
      "company_seat": "Menden",
      "details": "22.11.2024 (Bekanntmachungsdatum)\n\nNordrhein-Westfalen Amtsgericht Arnsberg HRA 4573\nRegisterbekanntmachung nach dem Umwandlungsgesetz 21.11.2024 (Eintragungsdatum)\n\nAmecke-Mönnighof GmbH & Co. KG\nKommanditgesellschaft\nMenden\n\nDen Gläubigern der an der Verschmelzung beteiligten Rechtsträger ist, wenn sie binnen sechs Monaten nach dem Tag, an dem die Eintragung der Verschmelzung in das Register des Sitzes desjenigen Rechtsträgers, dessen Gläubiger sie sind, nach § 19 Absatz 3 UmwG als bekanntgemacht gilt, ihren Anspruch nach Grund und Höhe schriftlich anmelden, Sicherheit zu leisten, soweit sie nicht Befriedigung verlangen können. Dieses Recht steht den Gläubigern jedoch nur zu, wenn sie glaubhaft machen, dass durch die Verschmelzung die Erfüllung ihrer Forderung gefährdet wird."
    },
    {
      "date": "2024-11-22",
      "id": "94412",
      "original_text": "Löschungsankündigung\nHessen Amtsgericht Frankfurt am Main HRB 90654\nAntagor GmbH – Frankfurt am Main",
      "type": "Löschungsankündigung",
      "state": "Hessen",
      "amtsgericht": "Amtsgericht Frankfurt am Main",
      "registernummer": "HRB 90654",
      "registerart": "HRB",
      "company_name": "Antagor GmbH",
      "company_seat": "Frankfurt am Main",
      "details": "22.11.2024 (Bekanntmachungsdatum)\n\nHessen Amtsgericht Frankfurt am Main HRB 90654\nLöschungsankündigung\n\nAntagor GmbH\nGesellschaft mit beschränkter Haftung\nFrankfurt am Main\n\nEs ist beabsichtigt, die Gesellschaft wegen Vermögenslosigkeit gemäß § 394 FamFG von Amts wegen im Handelsregister zu löschen. Hiergegen kann innerhalb eines Monats nach dieser Veröffentlichung Widerspruch bei dem Amtsgericht Frankfurt am Main eingelegt werden."
    },
    {
      "date": "2024-11-22",
      "id": "94406",
      "original_text": "Registerbekanntmachung nach dem Umwandlungsgesetz\nNordrhein-Westfalen Amtsgericht Düsseldorf HRB 62526\nArt of Travel GmbH Düsseldorf – Düsseldorf",
      "type": "Registerbekanntmachung nach dem Umwandlungsgesetz",
      "state": "Nordrhein-Westfalen",
      "amtsgericht": "Amtsgericht Düsseldorf",
      "registernummer": "HRB 62526",
      "registerart": "HRB",
      "company_name": "Art of Travel GmbH Düsseldorf",
      "company_seat": "Düsseldorf",
      "details": "22.11.2024 (Bekanntmachungsdatum)\n\nNordrhein-Westfalen Amtsgericht Düsseldorf HRB 62526\nRegisterbekanntmachung nach dem Umwandlungsgesetz 22.11.2024 (Eintragungsdatum)\n\nArt of Travel GmbH Düsseldorf\nGesellschaft mit beschränkter Haftung\nDüsseldorf\n\nDen Gläubigern der an der Verschmelzung beteiligten Rechtsträger ist, wenn sie binnen sechs Monaten nach dem Tag, an dem die Eintragung der Verschmelzung in das Register des Sitzes desjenigen Rechtsträgers, dessen Gläubiger sie sind, nach § 19 Absatz 3 UmwG als bekanntgemacht gilt, ihren Anspruch nach Grund und Höhe schriftlich anmelden, Sicherheit zu leisten, soweit sie nicht Befriedigung verlangen können. Dieses Recht steht den Gläubigern jedoch nur zu, wenn sie glaubhaft machen, dass durch die Verschmelzung die Erfüllung ihrer Forderung gefährdet wird."
    },
    {
      "date": "2024-11-22",
      "id": "94371",
      "original_text": "Löschungsankündigung\nBerlin Amtsgericht Berlin (Charlottenburg) HRB 82444\nB 32 Media Management GmbH – Berlin",
      "type": "Löschungsankündigung",
      "state": "Berlin",
      "amtsgericht": "Amtsgericht Berlin (Charlottenburg)",
      "registernummer": "HRB 82444",
      "registerart": "HRB",
      "company_name": "B 32 Media Management GmbH",
      "company_seat": "Berlin",
      "details": "22.11.2024 (Bekanntmachungsdatum)\n\nBerlin Amtsgericht Berlin (Charlottenburg) HRB 82444\nLöschungsankündigung\n\nB 32 Media Management GmbH\nGesellschaft mit beschränkter Haftung\nBerlin\n\nBei der nachstehenden Gesellschaft wird das Amtslöschungsverfahren gemäß § 394 FamFG eingeleitet. Widerspruchsfrist 6 Wochen"
    },
    {
      "date": "2024-11-22",
      "id": "94398",
      "original_text": "Registerbekanntmachung nach dem Umwandlungsgesetz\nNordrhein-Westfalen Amtsgericht Hamm HRB 10616\nBC Deutschland GmbH – Hamm",
      "type": "Registerbekanntmachung nach dem Umwandlungsgesetz",
      "state": "Nordrhein-Westfalen",
      "amtsgericht": "Amtsgericht Hamm",
      "registernummer": "HRB 10616",
      "registerart": "HRB",
      "company_name": "BC Deutschland GmbH",
      "company_seat": "Hamm",
      "details": "22.11.2024 (Bekanntmachungsdatum)\n\nNordrhein-Westfalen Amtsgericht Hamm HRB 10616\nRegisterbekanntmachung nach dem Umwandlungsgesetz 22.11.2024 (Eintragungsdatum)\n\nBC Deutschland GmbH\nGesellschaft mit beschränkter Haftung\nHamm\n\nDen Gläubigern der an der Verschmelzung beteiligten Rechtsträger ist, wenn sie binnen sechs Monaten nach dem Tag, an dem die Eintragung der Verschmelzung in das Register des Sitzes desjenigen Rechtsträgers, dessen Gläubiger sie sind, nach § 19 Absatz 3 UmwG als bekanntgemacht gilt, ihren Anspruch nach Grund und Höhe schriftlich anmelden, Sicherheit zu leisten, soweit sie nicht Befriedigung verlangen können. Dieses Recht steht den Gläubigern jedoch nur zu, wenn sie glaubhaft machen, dass durch die Verschmelzung die Erfüllung ihrer Forderung gefährdet wird."
    },
    {
      "date": "2024-11-22",
      "id": "94337",
      "original_text": "Löschungsankündigung\nBayern Amtsgericht Fürth HRB 11995\nBNI 42 GmbH – Eckental",
      "type": "Löschungsankündigung",
      "state": "Bayern",
      "amtsgericht": "Amtsgericht Fürth",
      "registernummer": "HRB 11995",
      "registerart": "HRB",
      "company_name": "BNI 42 GmbH",
      "company_seat": "Eckental",
      "details": "22.11.2024 (Bekanntmachungsdatum)\n\nBayern Amtsgericht Fürth HRB 11995\nLöschungsankündigung 21.11.2024 (Eintragungsdatum)\n\nBNI 42 GmbH\nGesellschaft mit beschränkter Haftung\nEckental\n\nDas Registergericht beabsichtigt, die im Handelsregister eingetragene Gesellschaft wegen Vermögenslosigkeit von Amts wegen nach § 394 FamFG zu löschen. Die Frist zur Erhebung eines Widerspruchs ist auf drei Monate festgesetzt."
    },
    {
      "date": "2024-11-22",
      "id": "94413",
      "original_text": "Löschungsankündigung\nHessen Amtsgericht Offenbach am Main HRB 51060\nBS-Zeichenatelier UG (haftungsbeschränkt) – Dietzenbach",
      "type": "Löschungsankündigung",
      "state": "Hessen",
      "amtsgericht": "Amtsgericht Offenbach am Main",
      "registernummer": "HRB 51060",
      "registerart": "HRB",
      "company_name": "BS-Zeichenatelier UG (haftungsbeschränkt)",
      "company_seat": "Dietzenbach",
      "details": "22.11.2024 (Bekanntmachungsdatum)\n\nHessen Amtsgericht Offenbach am Main HRB 51060\nLöschungsankündigung\n\nBS-Zeichenatelier UG (haftungsbeschränkt)\nGesellschaft mit beschränkter Haftung\nDietzenbach\n\nDas Registergericht beabsichtigt die im Handelsregister eingetragene Gesellschaft von Amts wegen nach § 394 FamFG zu löschen. Die Frist zur Erhebung eines Widerspruchs gegen die beabsichtigte Löschung wird auf 3 Monate festgesetzt"
    },
    {
      "date": "2024-11-22",
      "id": "94328",
      "original_text": "Einreichung neuer Dokumente\nBayern Amtsgericht München HRB 75534\nBSH Hausgeräte GmbH – München",
      "type": "Einreichung neuer Dokumente",
      "state": "Bayern",
      "amtsgericht": "Amtsgericht München",
      "registernummer": "HRB 75534",
      "registerart": "HRB",
      "company_name": "BSH Hausgeräte GmbH",
      "company_seat": "München",
      "details": "22.11.2024 (Bekanntmachungsdatum)\n\nBayern Amtsgericht München HRB 75534\nEinreichung neuer Dokumente\n\nBSH Hausgeräte GmbH\nGesellschaft mit beschränkter Haftung\nMünchen\n\nDem Handelsregister HRB 75534 beim Amtsgericht München ist eine Liste der Mitglieder des Aufsichtsrats eingereicht worden, § 52 Abs. 3 S. 2 GmbHG."
    },
    {
      "date": "2024-11-22",
      "id": "94353",
      "original_text": "Registerbekanntmachung nach dem Umwandlungsgesetz\nBerlin Amtsgericht Berlin (Charlottenburg) HRA 63255\nBar Elisabeth e.K. – Berlin",
      "type": "Registerbekanntmachung nach dem Umwandlungsgesetz",
      "state": "Berlin",
      "amtsgericht": "Amtsgericht Berlin (Charlottenburg)",
      "registernummer": "HRA 63255",
      "registerart": "HRA",
      "company_name": "Bar Elisabeth e.K.",
      "company_seat": "Berlin",
      "details": "22.11.2024 (Bekanntmachungsdatum)\n\nBerlin Amtsgericht Berlin (Charlottenburg) HRA 63255\nRegisterbekanntmachung nach dem Umwandlungsgesetz 21.11.2024 (Eintragungsdatum)\n\nBar Elisabeth e.K.\nEinzelkaufmann / Einzelkauffrau\nBerlin\n\nZu Eintragungsnummer 2 vom 21.11.2024 wird als nicht eingetragen veröffentlicht: Den Gläubigern der an der Spaltung beteiligten Rechtsträger ist, wenn sie binnen sechs Monaten nach dem Tag, an dem die Eintragung der Spaltung in das Register des Sitzes desjenigen Rechtsträgers, dessen Gläubiger sie sind, als bekannt gemacht gilt, ihren Anspruch nach Grund und Höhe schriftlich anmelden, Sicherheit zu leisten, soweit sie nicht Befriedigung verlangen können. Dieses Recht steht den Gläubigern jedoch nur zu, wenn sie glaubhaft machen, dass durch die Spaltung die Erfüllung ihrer Forderung gefährdet wird. Das Recht, Sicherheitsleistung zu verlangen, steht Gläubigern nicht zu, die im Falle der Insolvenz ein Recht auf vorzugsweise Befriedigung aus einer Deckungsmasse haben, die nach gesetzlicher Vorschrift zu ihrem Schutz errichtet und staatlich überwacht ist."
    },
    {
      "date": "2024-11-22",
      "id": "94391",
      "original_text": "Einreichung neuer Dokumente\nNordrhein-Westfalen Amtsgericht Wuppertal HRB 28475\nBarmenia Krankenversicherung AG – Wuppertal",
      "type": "Einreichung neuer Dokumente",
      "state": "Nordrhein-Westfalen",
      "amtsgericht": "Amtsgericht Wuppertal",
      "registernummer": "HRB 28475",
      "registerart": "HRB",
      "company_name": "Barmenia Krankenversicherung AG",
      "company_seat": "Wuppertal",
      "details": "22.11.2024 (Bekanntmachungsdatum)\n\nNordrhein-Westfalen Amtsgericht Wuppertal HRB 28475\nEinreichung neuer Dokumente 22.11.2024 (Eintragungsdatum)\n\nBarmenia Krankenversicherung AG\nAktiengesellschaft\nWuppertal\n\nDem Registergericht ist eine neue Liste der Mitglieder des Aufsichtsrates eingereicht worden."
    },
    {
      "date": "2024-11-22",
      "id": "94402",
      "original_text": "Registerbekanntmachung nach dem Umwandlungsgesetz\nNordrhein-Westfalen Amtsgericht Köln HRB 91489\nBauwertPlus GmbH – Köln",
      "type": "Registerbekanntmachung nach dem Umwandlungsgesetz",
      "state": "Nordrhein-Westfalen",
      "amtsgericht": "Amtsgericht Köln",
      "registernummer": "HRB 91489",
      "registerart": "HRB",
      "company_name": "BauwertPlus GmbH",
      "company_seat": "Köln",
      "details": "22.11.2024 (Bekanntmachungsdatum)\n\nNordrhein-Westfalen Amtsgericht Köln HRB 91489\nRegisterbekanntmachung nach dem Umwandlungsgesetz 22.11.2024 (Eintragungsdatum)\n\nBauwertPlus GmbH\nGesellschaft mit beschränkter Haftung\nKöln\n\nDen Gläubigern der an der Verschmelzung beteiligten Rechtsträger ist, wenn sie binnen sechs Monaten nach dem Tag, an dem die Eintragung der Verschmelzung in das Register des Sitzes derjenigen Rechtsträger deren Gläubiger sie sind, nach § 19 Absatz 3 UmwG als bekanntgemacht gilt, ihren Anspruch nach Grund und Höhe schriftlich anmelden, Sicherheit zu leisten, soweit sie nicht Befriedigung verlangen können. Dieses Recht steht den Gläubigern jedoch nur zu, wenn sie glaubhaft machen, dass durch die Verschmelzung die Erfüllung ihrer Forderung gefährdet wird."
    },
    {
      "date": "2024-11-22",
      "id": "94358",
      "original_text": "Sonstige Registerbekanntmachung\nSchleswig-Holstein Amtsgericht Lübeck HRB 158 SB\nBicher und Partner GmbH Steuerberatungsgesellschaft – Schwarzenbek",
      "type": "Sonstige Registerbekanntmachung",
      "state": "Schleswig-Holstein",
      "amtsgericht": "Amtsgericht Lübeck",
      "registernummer": "HRB 158 SB",
      "registerart": "HRB",
      "company_name": "Bicher und Partner GmbH Steuerberatungsgesellschaft",
      "company_seat": "Schwarzenbek",
      "details": "22.11.2024 (Bekanntmachungsdatum)\n\nSchleswig-Holstein Amtsgericht Lübeck HRB 158 SB\nSonstige Registerbekanntmachung\n\nBicher und Partner GmbH Steuerberatungsgesellschaft\nGesellschaft mit beschränkter Haftung\nSchwarzenbek\n\nAls nicht eingetragen wird veröffentlicht:\nAls nicht eingetragen wird veröffentlicht: Der andere Vertragsteil hat den Gläubigern dieses Rechtsträgers, dessen Forderungen begründet worden sind, bevor die Eintragung der Änderung dieses Vertrages in das Handelsregister nach § 10 des Handelsgesetzbuches als bekannt gemacht gilt, Sicherheit zu leisten, wenn sie sich binnen sechs Monaten nach der Bekanntmachung der Eintragung zu diesem Zweck bei ihm melden. Dieses Recht steht den Gläubigern nicht zu, die im Fall des Insolvenzverfahrens ein Recht auf vorzugsweise Befriedigung aus der Deckungsmasse haben, die nach gesetzlicher Vorschrift zu ihrem Schutz errichtet und staatlich überwacht ist."
    },
    {
      "date": "2024-11-22",
      "id": "94369",
      "original_text": "Einreichung neuer Dokumente\nBaden-Württemberg Amtsgericht Mannheim HRB 230108\nBruchsaler Wohnungsbaugesellschaft mit beschränkter Haftung – Bruchsal",
      "type": "Einreichung neuer Dokumente",
      "state": "Baden-Württemberg",
      "amtsgericht": "Amtsgericht Mannheim",
      "registernummer": "HRB 230108",
      "registerart": "HRB",
      "company_name": "Bruchsaler Wohnungsbaugesellschaft mit beschränkter Haftung",
      "company_seat": "Bruchsal",
      "details": "22.11.2024 (Bekanntmachungsdatum)\n\nBaden-Württemberg Amtsgericht Mannheim HRB 230108\nEinreichung neuer Dokumente\n\nBruchsaler Wohnungsbaugesellschaft mit beschränkter Haftung\nGesellschaft mit beschränkter Haftung\nBruchsal\n\nDie Gesellschaft hat am 20.11.2024 die Liste über die Zusammensetzung des Aufsichtsrats zum Handelsregister eingereicht."
    },
    {
      "date": "2024-11-22",
      "id": "94363",
      "original_text": "Sonstige Registerbekanntmachung\nHamburg Amtsgericht Hamburg HRB 69127\nCAS CONCEPTS AND SOLUTIONS Aktiengesellschaft – Hamburg",
      "type": "Sonstige Registerbekanntmachung",
      "state": "Hamburg",
      "amtsgericht": "Amtsgericht Hamburg",
      "registernummer": "HRB 69127",
      "registerart": "HRB",
      "company_name": "CAS CONCEPTS AND SOLUTIONS Aktiengesellschaft",
      "company_seat": "Hamburg",
      "details": "22.11.2024 (Bekanntmachungsdatum)\n\nHamburg Amtsgericht Hamburg HRB 69127\nSonstige Registerbekanntmachung\n\nCAS CONCEPTS AND SOLUTIONS Aktiengesellschaft\nAktiengesellschaft\nHamburg\n\nAls nicht eingetragen wird bekannt gemacht: Liste des Aufsichtsrats wurde eingereicht."
    },
    {
      "date": "2024-11-22",
      "id": "94322",
      "original_text": "Registerbekanntmachung nach dem Umwandlungsgesetz\nBayern Amtsgericht München HRB 290520\nCLEVIS CONSULT GmbH – München",
      "type": "Registerbekanntmachung nach dem Umwandlungsgesetz",
      "state": "Bayern",
      "amtsgericht": "Amtsgericht München",
      "registernummer": "HRB 290520",
      "registerart": "HRB",
      "company_name": "CLEVIS CONSULT GmbH",
      "company_seat": "München",
      "details": "22.11.2024 (Bekanntmachungsdatum)\n\nBayern Amtsgericht München HRB 290520\nRegisterbekanntmachung nach dem Umwandlungsgesetz 21.11.2024 (Eintragungsdatum)\n\nCLEVIS CONSULT GmbH\nGesellschaft mit beschränkter Haftung\nMünchen\n\nDen Gläubigern der an der Spaltung beteiligten Rechtsträger ist, wenn sie binnen sechs Monaten nach dem Tag, an dem die Eintragung der Spaltung in das Register des Sitzes desjenigen Rechtsträgers, dessen Gläubiger sie sind, nach §§ 125, 19 Abs. 3 UmwG als bekannt gemacht gilt, ihren Anspruch nach Grund und Höhe schriftlich anmelden, Sicherheit zu leisten, soweit sie nicht Befriedigung verlangen können. Dieses Recht steht den Gläubigern jedoch nur zu, wenn sie glaubhaft machen, dass durch die Spaltung die Erfüllung ihrer Forderung gefährdet wird."
    },
    {
      "date": "2024-11-22",
      "id": "94326",
      "original_text": "Löschungsankündigung\nBayern Amtsgericht München HRB 285121\nCMG Handel UG (haftungsbeschränkt) – München",
      "type": "Löschungsankündigung",
      "state": "Bayern",
      "amtsgericht": "Amtsgericht München",
      "registernummer": "HRB 285121",
      "registerart": "HRB",
      "company_name": "CMG Handel UG (haftungsbeschränkt)",
      "company_seat": "München",
      "details": "22.11.2024 (Bekanntmachungsdatum)\n\nBayern Amtsgericht München HRB 285121\nLöschungsankündigung 21.11.2024 (Eintragungsdatum)\n\nCMG Handel UG (haftungsbeschränkt)\nGesellschaft mit beschränkter Haftung\nMünchen\n\nDas Registergericht beabsichtigt, die im Handelsregister eingetragene Firma von Amts wegen nach § 31 Abs. 2 HGB, § 393 FamFG zu löschen. Die Frist zur Erhebung eines Widerspruchs ist auf drei Monate festgesetzt."
    },
    {
      "date": "2024-11-22",
      "id": "94393",
      "original_text": "Löschungsankündigung\nNordrhein-Westfalen Amtsgericht Köln HRB 117909\nCandy Town Beteiligungs GmbH – Köln",
      "type": "Löschungsankündigung",
      "state": "Nordrhein-Westfalen",
      "amtsgericht": "Amtsgericht Köln",
      "registernummer": "HRB 117909",
      "registerart": "HRB",
      "company_name": "Candy Town Beteiligungs GmbH",
      "company_seat": "Köln",
      "details": "22.11.2024 (Bekanntmachungsdatum)\n\nNordrhein-Westfalen Amtsgericht Köln HRB 117909\nLöschungsankündigung\n\nCandy Town Beteiligungs GmbH\nGesellschaft mit beschränkter Haftung\nKöln\n\nDas Registergericht beabsichtigt die Gesellschaft von Amts wegen nach § 394 FamFG zu löschen. Die Frist zur Erhebung eines Widerspruchs ist auf einen Monat festgesetzt."
    },
    {
      "date": "2024-11-22",
      "id": "94352",
      "original_text": "Löschungsankündigung\nBerlin Amtsgericht Berlin (Charlottenburg) HRB 239349\nCapitalgreen24 GmbH – Berlin",
      "type": "Löschungsankündigung",
      "state": "Berlin",
      "amtsgericht": "Amtsgericht Berlin (Charlottenburg)",
      "registernummer": "HRB 239349",
      "registerart": "HRB",
      "company_name": "Capitalgreen24 GmbH",
      "company_seat": "Berlin",
      "details": "22.11.2024 (Bekanntmachungsdatum)\n\nBerlin Amtsgericht Berlin (Charlottenburg) HRB 239349\nLöschungsankündigung\n\nCapitalgreen24 GmbH\nGesellschaft mit beschränkter Haftung\nBerlin\n\nBei der nachstehenden Gesellschaft wird das Amtslöschungsverfahren gemäß § 394 FamFG eingeleitet. Widerspruchsfrist 6 Wochen"
    },
    {
      "date": "2024-11-22",
      "id": "94376",
      "original_text": "Einreichung neuer Dokumente\nSachsen Amtsgericht Leipzig HRB 23761\nCollmed GmbH – Oschatz",
      "type": "Einreichung neuer Dokumente",
      "state": "Sachsen",
      "amtsgericht": "Amtsgericht Leipzig",
      "registernummer": "HRB 23761",
      "registerart": "HRB",
      "company_name": "Collmed GmbH",
      "company_seat": "Oschatz",
      "details": "22.11.2024 (Bekanntmachungsdatum)\n\nSachsen Amtsgericht Leipzig HRB 23761\nEinreichung neuer Dokumente\n\nCollmed GmbH\nGesellschaft mit beschränkter Haftung\nOschatz\n\nAm 06.11.2024 wurde beim Handelsregister des Amtsgerichts Leipzig die Liste der Mitglieder des Aufsichtsrats gemäß § 52 GmbHG eingereicht."
    },
    {
      "date": "2024-11-22",
      "id": "94383",
      "original_text": "Einreichung neuer Dokumente\nNiedersachsen Amtsgericht Hannover HRB 52028\nContiTech Luftfedersysteme GmbH – Hannover",
      "type": "Einreichung neuer Dokumente",
      "state": "Niedersachsen",
      "amtsgericht": "Amtsgericht Hannover",
      "registernummer": "HRB 52028",
      "registerart": "HRB",
      "company_name": "ContiTech Luftfedersysteme GmbH",
      "company_seat": "Hannover",
      "details": "22.11.2024 (Bekanntmachungsdatum)\n\nNiedersachsen Amtsgericht Hannover HRB 52028\nEinreichung neuer Dokumente\n\nContiTech Luftfedersysteme GmbH\nGesellschaft mit beschränkter Haftung\nHannover\n\nDie Liste der Mitglieder des Aufsichtsrats wurde beim Registergericht eingereicht."
    },
    {
      "date": "2024-11-22",
      "id": "94382",
      "original_text": "Einreichung neuer Dokumente\nNiedersachsen Amtsgericht Hannover HRB 52025\nContiTech Transportbandsysteme GmbH – Hannover",
      "type": "Einreichung neuer Dokumente",
      "state": "Niedersachsen",
      "amtsgericht": "Amtsgericht Hannover",
      "registernummer": "HRB 52025",
      "registerart": "HRB",
      "company_name": "ContiTech Transportbandsysteme GmbH",
      "company_seat": "Hannover",
      "details": "22.11.2024 (Bekanntmachungsdatum)\n\nNiedersachsen Amtsgericht Hannover HRB 52025\nEinreichung neuer Dokumente\n\nContiTech Transportbandsysteme GmbH\nGesellschaft mit beschränkter Haftung\nHannover\n\nDie Liste der Mitglieder des Aufsichtsrats wurde beim Registergericht eingereicht."
    },
    {
      "date": "2024-11-22",
      "id": "94334",
      "original_text": "Löschungsankündigung\nBayern Amtsgericht München HRB 162564\nDa Rosa GmbH – Kirchheim",
      "type": "Löschungsankündigung",
      "state": "Bayern",
      "amtsgericht": "Amtsgericht München",
      "registernummer": "HRB 162564",
      "registerart": "HRB",
      "company_name": "Da Rosa GmbH",
      "company_seat": "Kirchheim",
      "details": "22.11.2024 (Bekanntmachungsdatum)\n\nBayern Amtsgericht München HRB 162564\nLöschungsankündigung 21.11.2024 (Eintragungsdatum)\n\nDa Rosa GmbH\nGesellschaft mit beschränkter Haftung\nKirchheim\n\nDas Registergericht beabsichtigt, die im Handelsregister eingetragene Gesellschaft wegen Vermögenslosigkeit von Amts wegen nach § 394 FamFG zu löschen. Die Frist zur Erhebung eines Widerspruchs ist auf drei Monate festgesetzt."
    },
    {
      "date": "2024-11-22",
      "id": "94324",
      "original_text": "Registerbekanntmachung nach dem Umwandlungsgesetz\nBayern Amtsgericht Nürnberg HRB 28189\nDeufol Nürnberg GmbH – Nürnberg",
      "type": "Registerbekanntmachung nach dem Umwandlungsgesetz",
      "state": "Bayern",
      "amtsgericht": "Amtsgericht Nürnberg",
      "registernummer": "HRB 28189",
      "registerart": "HRB",
      "company_name": "Deufol Nürnberg GmbH",
      "company_seat": "Nürnberg",
      "details": "22.11.2024 (Bekanntmachungsdatum)\n\nBayern Amtsgericht Nürnberg HRB 28189\nRegisterbekanntmachung nach dem Umwandlungsgesetz 21.11.2024 (Eintragungsdatum)\n\nDeufol Nürnberg GmbH\nGesellschaft mit beschränkter Haftung\nNürnberg\n\nDen Gläubigern der an der Verschmelzung beteiligten Rechtsträger ist, wenn sie binnen sechs Monaten nach dem Tag, an dem die Eintragung der Verschmelzung in das Register des Sitzes desjenigen Rechtsträgers, dessen Gläubiger sie sind, nach § 19 Abs. 3 UmwG als bekannt gemacht gilt, ihren Anspruch nach Grund und Höhe schriftlich anmelden, Sicherheit zu leisten, soweit sie nicht Befriedigung verlangen können. Dieses Recht steht den Gläubigern jedoch nur zu, wenn sie glaubhaft machen, dass durch die Verschmelzung die Erfüllung ihrer Forderung gefährdet wird."
    },
    {
      "date": "2024-11-22",
      "id": "94335",
      "original_text": "Registerbekanntmachung nach dem Umwandlungsgesetz\nBayern Amtsgericht Nürnberg HRA 15320\nDi Dio Fisch OHG – Nürnberg",
      "type": "Registerbekanntmachung nach dem Umwandlungsgesetz",
      "state": "Bayern",
      "amtsgericht": "Amtsgericht Nürnberg",
      "registernummer": "HRA 15320",
      "registerart": "HRA",
      "company_name": "Di Dio Fisch OHG",
      "company_seat": "Nürnberg",
      "details": "22.11.2024 (Bekanntmachungsdatum)\n\nBayern Amtsgericht Nürnberg HRA 15320\nRegisterbekanntmachung nach dem Umwandlungsgesetz 21.11.2024 (Eintragungsdatum)\n\nDi Dio Fisch OHG\nOffene Handelsgesellschaft\nNürnberg\n\nDen Gläubigern der an der Verschmelzung beteiligten Rechtsträger ist, wenn sie binnen sechs Monaten nach dem Tag, an dem die Eintragung der Verschmelzung in das Register des Sitzes desjenigen Rechtsträgers, dessen Gläubiger sie sind, nach § 19 Abs. 3 UmwG als bekannt gemacht gilt, ihren Anspruch nach Grund und Höhe schriftlich anmelden, Sicherheit zu leisten, soweit sie nicht Befriedigung verlangen können. Dieses Recht steht den Gläubigern jedoch nur zu, wenn sie glaubhaft machen, dass durch die Verschmelzung die Erfüllung ihrer Forderung gefährdet wird."
    },
    {
      "date": "2024-11-22",
      "id": "94320",
      "original_text": "Registerbekanntmachung nach dem Umwandlungsgesetz\nBayern Amtsgericht Bamberg GsR 134\nDi Dio Grundstücksverwaltungs eGbR – Bamberg",
      "type": "Registerbekanntmachung nach dem Umwandlungsgesetz",
      "state": "Bayern",
      "amtsgericht": "Amtsgericht Bamberg",
      "registernummer": "GsR 134",
      "registerart": "GsR",
      "company_name": "Di Dio Grundstücksverwaltungs eGbR",
      "company_seat": "Bamberg",
      "details": "22.11.2024 (Bekanntmachungsdatum)\n\nBayern Amtsgericht Bamberg GsR 134\nRegisterbekanntmachung nach dem Umwandlungsgesetz 21.11.2024 (Eintragungsdatum)\n\nDi Dio Grundstücksverwaltungs eGbR\nGesellschaft bürgerlichen Rechts\nBamberg\n\nDen Gläubigern der an der Verschmelzung beteiligten Rechtsträger ist, wenn sie binnen sechs Monaten nach dem Tag, an dem die Eintragung der Verschmelzung in das Register des Sitzes desjenigen Rechtsträgers, dessen Gläubiger sie sind, nach § 19 Abs. 3 UmwG als bekannt gemacht gilt, ihren Anspruch nach Grund und Höhe schriftlich anmelden, Sicherheit zu leisten, soweit sie nicht Befriedigung verlangen können. Dieses Recht steht den Gläubigern jedoch nur zu, wenn sie glaubhaft machen, dass durch die Verschmelzung die Erfüllung ihrer Forderung gefährdet wird."
    },
    {
      "date": "2024-11-22",
      "id": "94399",
      "original_text": "Löschungsankündigung\nNordrhein-Westfalen Amtsgericht Köln HRB 105775\nDonsali DE UG (haftungsbeschränkt) – Köln",
      "type": "Löschungsankündigung",
      "state": "Nordrhein-Westfalen",
      "amtsgericht": "Amtsgericht Köln",
      "registernummer": "HRB 105775",
      "registerart": "HRB",
      "company_name": "Donsali DE UG (haftungsbeschränkt)",
      "company_seat": "Köln",
      "details": "22.11.2024 (Bekanntmachungsdatum)\n\nNordrhein-Westfalen Amtsgericht Köln HRB 105775\nLöschungsankündigung\n\nDonsali DE UG (haftungsbeschränkt)\nGesellschaft mit beschränkter Haftung\nKöln\n\nDas Registergericht beabsichtigt die Gesellschaft von Amts wegen nach § 394 FamFG zu löschen. Die Frist zur Erhebung eines Widerspruchs ist auf einen Monat festgesetzt."
    },
    {
      "date": "2024-11-22",
      "id": "94349",
      "original_text": "Registerbekanntmachung nach dem Umwandlungsgesetz\nBrandenburg Amtsgericht Potsdam HRB 24421\nDouglas Marken- und Lizenzen Verwaltungsgesellschaft mbH – Zossen",
      "type": "Registerbekanntmachung nach dem Umwandlungsgesetz",
      "state": "Brandenburg",
      "amtsgericht": "Amtsgericht Potsdam",
      "registernummer": "HRB 24421",
      "registerart": "HRB",
      "company_name": "Douglas Marken- und Lizenzen Verwaltungsgesellschaft mbH",
      "company_seat": "Zossen",
      "details": "22.11.2024 (Bekanntmachungsdatum)\n\nBrandenburg Amtsgericht Potsdam HRB 24421\nRegisterbekanntmachung nach dem Umwandlungsgesetz 21.11.2024 (Eintragungsdatum)\n\nDouglas Marken- und Lizenzen Verwaltungsgesellschaft mbH\nGesellschaft mit beschränkter Haftung\nZossen\n\nZu Eintragungsnummer 19 vom 21.11.2024 wird als nicht eingetragen veröffentlicht:\nDen Gläubigern der an der Verschmelzung beteiligten Rechtsträger ist, wenn sie binnen sechs Monaten nach dem Tag, an dem die Eintragung der Verschmelzung in das Register des Sitzes desjenigen Rechtsträgers, dessen Gläubiger sie sind, als bekannt gemacht gilt, ihren Anspruch nach Grund und Höhe schriftlich anmelden, Sicherheit zu leisten, soweit sie nicht Befriedigung verlangen können. Dieses Recht steht den Gläubigern jedoch nur zu, wenn sie glaubhaft machen, dass durch die Verschmelzung die Erfüllung ihrer Forderung gefährdet wird"
    },
    {
      "date": "2024-11-22",
      "id": "94366",
      "original_text": "Löschungsankündigung\nThüringen Amtsgericht Jena HRB 511692\nEMD UG (haftungsbeschränkt) – Suhl",
      "type": "Löschungsankündigung",
      "state": "Thüringen",
      "amtsgericht": "Amtsgericht Jena",
      "registernummer": "HRB 511692",
      "registerart": "HRB",
      "company_name": "EMD UG (haftungsbeschränkt)",
      "company_seat": "Suhl",
      "details": "22.11.2024 (Bekanntmachungsdatum)\n\nThüringen Amtsgericht Jena HRB 511692\nLöschungsankündigung\n\nEMD UG (haftungsbeschränkt)\nGesellschaft mit beschränkter Haftung\nSuhl\n\nDas Registergericht beabsichtigt, die im Handelsregister eingetragene Gesellschaft wegen Vermögenslosigkeit nach § 394 FamFG von Amts wegen zu löschen. Die Frist zur Erhebung eines Widerspruchs gegen die beabsichtigte Löschung wird auf 6 Wochen festgesetzt."
    },
    {
      "date": "2024-11-22",
      "id": "94374",
      "original_text": "Löschungsankündigung\nBrandenburg Amtsgericht Frankfurt/Oder HRB 18523\nEWERK STUDIOS UG (haftungsbeschränkt) – Eberswalde",
      "type": "Löschungsankündigung",
      "state": "Brandenburg",
      "amtsgericht": "Amtsgericht Frankfurt/Oder",
      "registernummer": "HRB 18523",
      "registerart": "HRB",
      "company_name": "EWERK STUDIOS UG (haftungsbeschränkt)",
      "company_seat": "Eberswalde",
      "details": "22.11.2024 (Bekanntmachungsdatum)\n\nBrandenburg Amtsgericht Frankfurt/Oder HRB 18523\nLöschungsankündigung\n\nEWERK STUDIOS UG (haftungsbeschränkt)\nGesellschaft mit beschränkter Haftung\nEberswalde\n\nBei der nachstehenden Gesellschaft wird das Amtslöschungsverfahren gemäß § 394 FamFG eingeleitet."
    },
    {
      "date": "2024-11-22",
      "id": "94325",
      "original_text": "Löschungsankündigung\nBayern Amtsgericht München HRB 261221\nEnzian Clean Services GmbH – Pfaffenhofen a.d.Glonn",
      "type": "Löschungsankündigung",
      "state": "Bayern",
      "amtsgericht": "Amtsgericht München",
      "registernummer": "HRB 261221",
      "registerart": "HRB",
      "company_name": "Enzian Clean Services GmbH",
      "company_seat": "Pfaffenhofen a.d.Glonn",
      "details": "22.11.2024 (Bekanntmachungsdatum)\n\nBayern Amtsgericht München HRB 261221\nLöschungsankündigung 21.11.2024 (Eintragungsdatum)\n\nEnzian Clean Services GmbH\nGesellschaft mit beschränkter Haftung\nPfaffenhofen a.d.Glonn\n\nDas Registergericht beabsichtigt, die im Handelsregister eingetragene Gesellschaft wegen Vermögenslosigkeit von Amts wegen nach § 394 FamFG zu löschen. Die Frist zur Erhebung eines Widerspruchs ist auf drei Monate festgesetzt."
    },
    {
      "date": "2024-11-22",
      "id": "94394",
      "original_text": "Einreichung neuer Dokumente\nNordrhein-Westfalen Amtsgericht Bielefeld HRB 40407\nFNEXT AG – Bielefeld",
      "type": "Einreichung neuer Dokumente",
      "state": "Nordrhein-Westfalen",
      "amtsgericht": "Amtsgericht Bielefeld",
      "registernummer": "HRB 40407",
      "registerart": "HRB",
      "company_name": "FNEXT AG",
      "company_seat": "Bielefeld",
      "details": "22.11.2024 (Bekanntmachungsdatum)\n\nNordrhein-Westfalen Amtsgericht Bielefeld HRB 40407\nEinreichung neuer Dokumente\n\nFNEXT AG\nAktiengesellschaft\nBielefeld\n\nDem Registergericht ist eine neue Liste der Mitglieder des Aufsichtsrates eingereicht worden."
    },
    {
      "date": "2024-11-22",
      "id": "94342",
      "original_text": "Löschungsankündigung\nBayern Amtsgericht Regensburg HRB 14755\nFTP GmbH – Regensburg",
      "type": "Löschungsankündigung",
      "state": "Bayern",
      "amtsgericht": "Amtsgericht Regensburg",
      "registernummer": "HRB 14755",
      "registerart": "HRB",
      "company_name": "FTP GmbH",
      "company_seat": "Regensburg",
      "details": "22.11.2024 (Bekanntmachungsdatum)\n\nBayern Amtsgericht Regensburg HRB 14755\nLöschungsankündigung\n\nFTP GmbH\nGesellschaft mit beschränkter Haftung\nRegensburg\n\nDas Registergericht beabsichtigt, die im Handelsregister eingetragene Gesellschaft wegen Vermögenslosigkeit von Amts wegen nach § 394 FamFG zu löschen. Die Frist zur Erhebung eines Widerspruchs ist auf einen Monat festgesetzt."
    },
    {
      "date": "2024-11-22",
      "id": "94414",
      "original_text": "Sonstige Registerbekanntmachung\nHessen Amtsgericht Wiesbaden HRB 7013\nFink & Fuchs AG – Wiesbaden",
      "type": "Sonstige Registerbekanntmachung",
      "state": "Hessen",
      "amtsgericht": "Amtsgericht Wiesbaden",
      "registernummer": "HRB 7013",
      "registerart": "HRB",
      "company_name": "Fink & Fuchs AG",
      "company_seat": "Wiesbaden",
      "details": "22.11.2024 (Bekanntmachungsdatum)\n\nHessen Amtsgericht Wiesbaden HRB 7013\nSonstige Registerbekanntmachung\n\nFink & Fuchs AG\nAktiengesellschaft\nWiesbaden\n\nDurch eine Änderung in den Personen der Aufsichtsratsmitglieder ist eine Liste der Mitglieder des Aufsichtsrates zum Handelsregister eingereicht worden."
    },
    {
      "date": "2024-11-22",
      "id": "94323",
      "original_text": "Registerbekanntmachung nach dem Umwandlungsgesetz\nBayern Amtsgericht Traunstein HRB 3108\nFliegl Agro-Center GmbH – Kastl",
      "type": "Registerbekanntmachung nach dem Umwandlungsgesetz",
      "state": "Bayern",
      "amtsgericht": "Amtsgericht Traunstein",
      "registernummer": "HRB 3108",
      "registerart": "HRB",
      "company_name": "Fliegl Agro-Center GmbH",
      "company_seat": "Kastl",
      "details": "22.11.2024 (Bekanntmachungsdatum)\n\nBayern Amtsgericht Traunstein HRB 3108\nRegisterbekanntmachung nach dem Umwandlungsgesetz 21.11.2024 (Eintragungsdatum)\n\nFliegl Agro-Center GmbH\nGesellschaft mit beschränkter Haftung\nKastl\n\nDen Gläubigern der an der Spaltung beteiligten Rechtsträger ist, wenn sie binnen sechs Monaten nach dem Tag, an dem die Eintragung der Spaltung in das Register des Sitzes desjenigen Rechtsträgers, dessen Gläubiger sie sind, nach §§ 125, 19 Abs. 3 UmwG als bekannt gemacht gilt, ihren Anspruch nach Grund und Höhe schriftlich anmelden, Sicherheit zu leisten, soweit sie nicht Befriedigung verlangen können. Dieses Recht steht den Gläubigern jedoch nur zu, wenn sie glaubhaft machen, dass durch die Spaltung die Erfüllung ihrer Forderung gefährdet wird."
    },
    {
      "date": "2024-11-22",
      "id": "94360",
      "original_text": "Löschungsankündigung\nMecklenburg-Vorpommern Amtsgericht Stralsund HRB 8275\nForsthaus Teschenhagen GmbH – Sehlen",
      "type": "Löschungsankündigung",
      "state": "Mecklenburg-Vorpommern",
      "amtsgericht": "Amtsgericht Stralsund",
      "registernummer": "HRB 8275",
      "registerart": "HRB",
      "company_name": "Forsthaus Teschenhagen GmbH",
      "company_seat": "Sehlen",
      "details": "22.11.2024 (Bekanntmachungsdatum)\n\nMecklenburg-Vorpommern Amtsgericht Stralsund HRB 8275\nLöschungsankündigung\n\nForsthaus Teschenhagen GmbH\nGesellschaft mit beschränkter Haftung\nSehlen\n\nDas Registergericht beabsichtigt, die im Handelsregister eingetragene Gesellschaft von Amts wegen nach § 394 FamFG zu löschen. Die Frist zur Erhebung eines Widerspruchs gegen die beabsichtigte Löschung wird auf 1 Monat festgesetzt."
    },
    {
      "date": "2024-11-22",
      "id": "94373",
      "original_text": "Registerbekanntmachung nach dem Umwandlungsgesetz\nSchleswig-Holstein Amtsgericht Kiel HRA 445 SE\nFrommer oHG – Bad Segeberg",
      "type": "Registerbekanntmachung nach dem Umwandlungsgesetz",
      "state": "Schleswig-Holstein",
      "amtsgericht": "Amtsgericht Kiel",
      "registernummer": "HRA 445 SE",
      "registerart": "HRA",
      "company_name": "Frommer oHG",
      "company_seat": "Bad Segeberg",
      "details": "22.11.2024 (Bekanntmachungsdatum)\n\nSchleswig-Holstein Amtsgericht Kiel HRA 445 SE\nRegisterbekanntmachung nach dem Umwandlungsgesetz 09.09.2024 (Eintragungsdatum)\n\nFrommer oHG\nOffene Handelsgesellschaft\nBad Segeberg\n\nZu Eintragungsnummer 8 vom 09.09.2024 wird als nicht eingetragen veröffentlicht: Den Gläubigern der an der Verschmelzung beteiligten Rechtsträger ist, wenn sie binnen sechs Monaten nach dem Tag, an dem die Eintragung der Verschmelzung in das Register des Sitzes desjenigen Rechtsträgers, dessen Gläubiger sie sind, nach § 19 Abs. 3 UmwG bekannt gemacht worden ist, ihren Anspruch nach Grund und Höhe schriftlich anmelden, Sicherheit zu leisten, soweit sie nicht Befriedigung verlangen können. Dieses Recht steht den Gläubigern jedoch nur zu, wenn sie glaubhaft machen, dass durch die Verschmelzung die Erfüllung ihrer Forderung gefährdet wird."
    },
    {
      "date": "2024-11-22",
      "id": "94330",
      "original_text": "Löschungsankündigung\nBayern Amtsgericht München HRB 142309\nGALIZIA GROUP AG – München",
      "type": "Löschungsankündigung",
      "state": "Bayern",
      "amtsgericht": "Amtsgericht München",
      "registernummer": "HRB 142309",
      "registerart": "HRB",
      "company_name": "GALIZIA GROUP AG",
      "company_seat": "München",
      "details": "22.11.2024 (Bekanntmachungsdatum)\n\nBayern Amtsgericht München HRB 142309\nLöschungsankündigung 21.11.2024 (Eintragungsdatum)\n\nGALIZIA GROUP AG\nAktiengesellschaft\nMünchen\n\nDas Registergericht beabsichtigt, die im Handelsregister eingetragene Gesellschaft wegen Vermögenslosigkeit von Amts wegen nach § 394 FamFG zu löschen. Die Frist zur Erhebung eines Widerspruchs ist auf drei Monate festgesetzt."
    },
    {
      "date": "2024-11-22",
      "id": "94415",
      "original_text": "Einreichung neuer Dokumente\nHessen Amtsgericht Darmstadt HRB 1528\nGSI Helmholtzzentrum für Schwerionenforschung GmbH – Darmstadt",
      "type": "Einreichung neuer Dokumente",
      "state": "Hessen",
      "amtsgericht": "Amtsgericht Darmstadt",
      "registernummer": "HRB 1528",
      "registerart": "HRB",
      "company_name": "GSI Helmholtzzentrum für Schwerionenforschung GmbH",
      "company_seat": "Darmstadt",
      "details": "22.11.2024 (Bekanntmachungsdatum)\n\nHessen Amtsgericht Darmstadt HRB 1528\nEinreichung neuer Dokumente 22.11.2024 (Eintragungsdatum)\n\nGSI Helmholtzzentrum für Schwerionenforschung GmbH\nGesellschaft mit beschränkter Haftung\nDarmstadt\n\nWegen Änderungen in den Personen der Aufsichtsratsmitglieder ist eine Liste der Mitglieder des Aufsichtsrates zum Handelsregister eingereicht worden."
    },
    {
      "date": "2024-11-22",
      "id": "94341",
      "original_text": "Löschungsankündigung\nBayern Amtsgericht Regensburg HRB 16260\nGarten Green Verwaltungs UG (haftungsbeschränkt) – Cham",
      "type": "Löschungsankündigung",
      "state": "Bayern",
      "amtsgericht": "Amtsgericht Regensburg",
      "registernummer": "HRB 16260",
      "registerart": "HRB",
      "company_name": "Garten Green Verwaltungs UG (haftungsbeschränkt)",
      "company_seat": "Cham",
      "details": "22.11.2024 (Bekanntmachungsdatum)\n\nBayern Amtsgericht Regensburg HRB 16260\nLöschungsankündigung\n\nGarten Green Verwaltungs UG (haftungsbeschränkt)\nGesellschaft mit beschränkter Haftung\nCham\n\nDas Registergericht beabsichtigt, die im Handelsregister eingetragene Gesellschaft wegen Vermögenslosigkeit von Amts wegen nach § 394 FamFG zu löschen. Die Frist zur Erhebung eines Widerspruchs ist auf einen Monat festgesetzt."
    },
    {
      "date": "2024-11-22",
      "id": "94327",
      "original_text": "Löschungsankündigung\nBayern Amtsgericht München HRB 44202\nGrecia-Import-Export Gesellschaft mit beschränkter Haftung – München",
      "type": "Löschungsankündigung",
      "state": "Bayern",
      "amtsgericht": "Amtsgericht München",
      "registernummer": "HRB 44202",
      "registerart": "HRB",
      "company_name": "Grecia-Import-Export Gesellschaft mit beschränkter Haftung",
      "company_seat": "München",
      "details": "22.11.2024 (Bekanntmachungsdatum)\n\nBayern Amtsgericht München HRB 44202\nLöschungsankündigung 21.11.2024 (Eintragungsdatum)\n\nGrecia-Import-Export Gesellschaft mit beschränkter Haftung\nGesellschaft mit beschränkter Haftung\nMünchen\n\nDas Registergericht beabsichtigt, die im Handelsregister eingetragene Gesellschaft wegen Vermögenslosigkeit von Amts wegen nach § 394 FamFG zu löschen. Die Frist zur Erhebung eines Widerspruchs ist auf drei Monate festgesetzt."
    },
    {
      "date": "2024-11-22",
      "id": "94396",
      "original_text": "Löschungsankündigung\nNordrhein-Westfalen Amtsgericht Düsseldorf HRB 82171\nH&D Dienstleistungen GmbH – Düsseldorf",
      "type": "Löschungsankündigung",
      "state": "Nordrhein-Westfalen",
      "amtsgericht": "Amtsgericht Düsseldorf",
      "registernummer": "HRB 82171",
      "registerart": "HRB",
      "company_name": "H&D Dienstleistungen GmbH",
      "company_seat": "Düsseldorf",
      "details": "22.11.2024 (Bekanntmachungsdatum)\n\nNordrhein-Westfalen Amtsgericht Düsseldorf HRB 82171\nLöschungsankündigung\n\nH&D Dienstleistungen GmbH\nGesellschaft mit beschränkter Haftung\nDüsseldorf\n\nDas Registergericht beabsichtigt die Gesellschaft von Amts wegen nach § 394 FamFG zu löschen. Die Frist zur Erhebung eines Widerspruchs ist auf 3 Wochen festgesetzt.\n\nRechtsbehelfsbelehrung:\nDas Widerspruchsrecht steht jedem zu, der an der Unterlassung der Löschung ein berechtigtes Interesse hat. Der Widerspruch ist bei dem Amtsgericht Düsseldorf -Registergericht-, Werdener Straße 1, 40227 Düsseldorf schriftlich in deutscher Sprache oder zur Niederschrift der Geschäftsstelle einzulegen. Der Widerspruch kann auch zur Niederschrift der Geschäftsstelle eines jeden Amtsgerichtes abgegeben werden. Die Einlegung ist auch durch Übertragung eines elektronischen Dokuments an die elektronische Poststelle des Gerichts möglich. Das elektronische Dokument muss für die Bearbeitung durch das Gericht geeignet und mit einer qualifizierten elektronischen Signatur der verantwortenden Person versehen sein oder von der verantwortenden Person signiert und auf einem sicheren Übermittlungsweg gemäß § 130a ZPO nach näherer Maßgabe der Verordnung über die technischen Rahmenbedingungen des elektronischen Rechtsverkehrs und über das besondere elektronische Behördenpostfach (BGBl. I, S.3803) eingereicht werden. Weitere Informationen erhalten Sie auf der Internetseite www.justiz.de.\nDer Widerspruch muss spätestens innerhalb der gesetzten Frist nach dem Datum der Bekanntmachung der Löschungsankündigung bei dem Amtsgericht - Registergericht - Düsseldorf eingegangen sein.  Dies gilt auch dann, wenn der Widerspruch zur Niederschrift der Geschäftsstelle eines anderen Amtsgerichtes abgegeben wurde. Die Frist beginnt mit dem Tage der Bekanntmachung der Löschungsankündigung in dem für die Bekanntmachung der Eintragungen in das Handelsregister bestimmten elektronischen Informations- und Kommunikationssystem nach § 10 des Handelsgesetzbuches. Fällt das Ende der Frist auf einen Sonntag, einen allgemeinen Feiertag oder Sonnabend, so endet die Frist mit Ablauf des nächsten Werktages.\nDer Widerspruch muss die Bezeichnung der angefochtenen Löschungsankündigung sowie die Erklärung enthalten, dass Widerspruch gegen diese Löschungsankündigung eingelegt wird. Er ist zu unterzeichnen und soll begründet werden."
    },
    {
      "date": "2024-11-22",
      "id": "94351",
      "original_text": "Löschungsankündigung\nSachsen-Anhalt Amtsgericht Stendal HRB 17817\nHDS Dienstleistungsservice UG (haftungsbeschränkt) – Mansfeld",
      "type": "Löschungsankündigung",
      "state": "Sachsen-Anhalt",
      "amtsgericht": "Amtsgericht Stendal",
      "registernummer": "HRB 17817",
      "registerart": "HRB",
      "company_name": "HDS Dienstleistungsservice UG (haftungsbeschränkt)",
      "company_seat": "Mansfeld",
      "details": "22.11.2024 (Bekanntmachungsdatum)\n\nSachsen-Anhalt Amtsgericht Stendal HRB 17817\nLöschungsankündigung\n\nHDS Dienstleistungsservice UG (haftungsbeschränkt)\nGesellschaft mit beschränkter Haftung\nMansfeld\n\nDas Registergericht beabsichtigt, nachfolgende im Handelregister eingetragenen Firmen von Amts wegen nach § 394 FamFG zu löschen. Die Frist zu Erhebung eines Widerspruchs wird auf drei Monate festgesetzt."
    },
    {
      "date": "2024-11-22",
      "id": "94357",
      "original_text": "Löschungsankündigung\nBerlin Amtsgericht Berlin (Charlottenburg) HRB 191533\nHGT Hinterhof Gastro- und Tourismusprojekte GmbH – Berlin",
      "type": "Löschungsankündigung",
      "state": "Berlin",
      "amtsgericht": "Amtsgericht Berlin (Charlottenburg)",
      "registernummer": "HRB 191533",
      "registerart": "HRB",
      "company_name": "HGT Hinterhof Gastro- und Tourismusprojekte GmbH",
      "company_seat": "Berlin",
      "details": "22.11.2024 (Bekanntmachungsdatum)\n\nBerlin Amtsgericht Berlin (Charlottenburg) HRB 191533\nLöschungsankündigung\n\nHGT Hinterhof Gastro- und Tourismusprojekte GmbH\nGesellschaft mit beschränkter Haftung\nBerlin\n\nBei der nachstehenden Gesellschaft wird das Amtslöschungsverfahren gemäß § 394 FamFG eingeleitet. Widerspruchsfrist 6 Wochen"
    },
    {
      "date": "2024-11-22",
      "id": "94384",
      "original_text": "Löschungsankündigung\nNiedersachsen Amtsgericht Oldenburg (Oldenburg) HRB 214244\nHL Agrar UG (haftungsbeschränkt) – Friesoythe",
      "type": "Löschungsankündigung",
      "state": "Niedersachsen",
      "amtsgericht": "Amtsgericht Oldenburg (Oldenburg)",
      "registernummer": "HRB 214244",
      "registerart": "HRB",
      "company_name": "HL Agrar UG (haftungsbeschränkt)",
      "company_seat": "Friesoythe",
      "details": "22.11.2024 (Bekanntmachungsdatum)\n\nNiedersachsen Amtsgericht Oldenburg (Oldenburg) HRB 214244\nLöschungsankündigung\n\nHL Agrar UG (haftungsbeschränkt)\nGesellschaft mit beschränkter Haftung\nFriesoythe\n\nDas Registergericht beabsichtigt, die Gesellschaft von Amts wegen nach § 394 FamFG zu löschen. Die Frist zur Erhebung eines Widerspruchs ist auf 1 Monat ab dieser Registerbekanntmachung festgesetzt."
    },
    {
      "date": "2024-11-22",
      "id": "94417",
      "original_text": "Sonstige Registerbekanntmachung\nHessen Amtsgericht Wiesbaden HRB 23533\nHase Feuerhaus Wiesbaden AG – Wiesbaden",
      "type": "Sonstige Registerbekanntmachung",
      "state": "Hessen",
      "amtsgericht": "Amtsgericht Wiesbaden",
      "registernummer": "HRB 23533",
      "registerart": "HRB",
      "company_name": "Hase Feuerhaus Wiesbaden AG",
      "company_seat": "Wiesbaden",
      "details": "22.11.2024 (Bekanntmachungsdatum)\n\nHessen Amtsgericht Wiesbaden HRB 23533\nSonstige Registerbekanntmachung\n\nHase Feuerhaus Wiesbaden AG\nAktiengesellschaft\nWiesbaden\n\nDurch eine Änderung in den Personen der Aufsichtsratsmitglieder ist eine Liste der Mitglieder des Aufsichtsrates zum Handelsregister eingereicht worden."
    },
    {
      "date": "2024-11-22",
      "id": "94346",
      "original_text": "Löschungsankündigung\nBaden-Württemberg Amtsgericht Stuttgart HRA 400137\nHeinrich Fischer GmbH & Co KG – Winterlingen",
      "type": "Löschungsankündigung",
      "state": "Baden-Württemberg",
      "amtsgericht": "Amtsgericht Stuttgart",
      "registernummer": "HRA 400137",
      "registerart": "HRA",
      "company_name": "Heinrich Fischer GmbH & Co KG",
      "company_seat": "Winterlingen",
      "details": "22.11.2024 (Bekanntmachungsdatum)\n\nBaden-Württemberg Amtsgericht Stuttgart HRA 400137\nLöschungsankündigung\n\nHeinrich Fischer GmbH & Co KG\nKommanditgesellschaft\nWinterlingen\n\nDas Gericht beabsichtigt, die Gesellschaft wegen Vermögenslosigkeit im Handelsregister von Amts wegen nach § 394 FamFG zu löschen. Die Frist zur Geltendmachung eines Widerspruchs gegen die beabsichtigte Löschung ist auf zwei Monate ab Veröffentlichung bestimmt."
    },
    {
      "date": "2024-11-22",
      "id": "94375",
      "original_text": "Registerbekanntmachung nach dem Umwandlungsgesetz\nMecklenburg-Vorpommern Amtsgericht Schwerin HRB 13373\nHelios Logistik Nord GmbH – Schwerin",
      "type": "Registerbekanntmachung nach dem Umwandlungsgesetz",
      "state": "Mecklenburg-Vorpommern",
      "amtsgericht": "Amtsgericht Schwerin",
      "registernummer": "HRB 13373",
      "registerart": "HRB",
      "company_name": "Helios Logistik Nord GmbH",
      "company_seat": "Schwerin",
      "details": "22.11.2024 (Bekanntmachungsdatum)\n\nMecklenburg-Vorpommern Amtsgericht Schwerin HRB 13373\nRegisterbekanntmachung nach dem Umwandlungsgesetz 22.11.2024 (Eintragungsdatum)\n\nHelios Logistik Nord GmbH\nGesellschaft mit beschränkter Haftung\nSchwerin\n\nDie Gesellschaft hat Gläubigern, deren Forderungen vor dieser Bekanntmachung begründet worden sind, Sicherheit zu leisten, soweit sie nicht Befriedigung verlangen können, wenn sie sich binnen sechs Monaten zu diesem Zweck melden."
    },
    {
      "date": "2024-11-22",
      "id": "94419",
      "original_text": "Löschungsankündigung\nHessen Amtsgericht Frankfurt am Main HRB 117074\nHualong Test Instruments AG – Frankfurt am Main",
      "type": "Löschungsankündigung",
      "state": "Hessen",
      "amtsgericht": "Amtsgericht Frankfurt am Main",
      "registernummer": "HRB 117074",
      "registerart": "HRB",
      "company_name": "Hualong Test Instruments AG",
      "company_seat": "Frankfurt am Main",
      "details": "22.11.2024 (Bekanntmachungsdatum)\n\nHessen Amtsgericht Frankfurt am Main HRB 117074\nLöschungsankündigung 22.11.2024 (Eintragungsdatum)\n\nHualong Test Instruments AG\nAktiengesellschaft\nFrankfurt am Main\n\nDas Registergericht beabsichtigt die im Handelsregister eingetragene Gesellschaft von Amts wegen nach § 394 FamFG zu löschen. Die Frist zur Erhebung eines Widerspruchs gegen die beabsichtigte Löschung wird auf 1 Monat festgesetzt."
    },
    {
      "date": "2024-11-22",
      "id": "94403",
      "original_text": "Löschungsankündigung\nNordrhein-Westfalen Amtsgericht Köln HRA 34206\nIBN Rheinland e.K. – Elsdorf",
      "type": "Löschungsankündigung",
      "state": "Nordrhein-Westfalen",
      "amtsgericht": "Amtsgericht Köln",
      "registernummer": "HRA 34206",
      "registerart": "HRA",
      "company_name": "IBN Rheinland e.K.",
      "company_seat": "Elsdorf",
      "details": "22.11.2024 (Bekanntmachungsdatum)\n\nNordrhein-Westfalen Amtsgericht Köln HRA 34206\nLöschungsankündigung\n\nIBN Rheinland e.K.\nEinzelkaufmann / Einzelkauffrau\nElsdorf\n\nDas Registergericht beabsichtigt die Firma von Amts wegen nach § 394 FamFG zu löschen. Die Frist zur Erhebung eines Widerspruchs ist auf einen Monat festgesetzt."
    },
    {
      "date": "2024-11-22",
      "id": "94405",
      "original_text": "Registerbekanntmachung nach dem Umwandlungsgesetz\nNordrhein-Westfalen Amtsgericht Köln HRB 68227\nImmoPlus Holding GmbH – Köln",
      "type": "Registerbekanntmachung nach dem Umwandlungsgesetz",
      "state": "Nordrhein-Westfalen",
      "amtsgericht": "Amtsgericht Köln",
      "registernummer": "HRB 68227",
      "registerart": "HRB",
      "company_name": "ImmoPlus Holding GmbH",
      "company_seat": "Köln",
      "details": "22.11.2024 (Bekanntmachungsdatum)\n\nNordrhein-Westfalen Amtsgericht Köln HRB 68227\nRegisterbekanntmachung nach dem Umwandlungsgesetz 22.11.2024 (Eintragungsdatum)\n\nImmoPlus Holding GmbH\nGesellschaft mit beschränkter Haftung\nKöln\n\nDen Gläubigern der an der Verschmelzung beteiligten Rechtsträger ist, wenn sie binnen sechs Monaten nach dem Tag, an dem die Eintragung der Verschmelzung in das Register des Sitzes derjenigen Rechtsträger deren Gläubiger sie sind, nach § 19 Absatz 3 UmwG als bekanntgemacht gilt, ihren Anspruch nach Grund und Höhe schriftlich anmelden, Sicherheit zu leisten, soweit sie nicht Befriedigung verlangen können. Dieses Recht steht den Gläubigern jedoch nur zu, wenn sie glaubhaft machen, dass durch die Verschmelzung die Erfüllung ihrer Forderung gefährdet wird."
    },
    {
      "date": "2024-11-22",
      "id": "94356",
      "original_text": "Registerbekanntmachung nach dem Umwandlungsgesetz\nBerlin Amtsgericht Berlin (Charlottenburg) HRB 173684\nInsitu Immobilien Konzepte GmbH – Berlin",
      "type": "Registerbekanntmachung nach dem Umwandlungsgesetz",
      "state": "Berlin",
      "amtsgericht": "Amtsgericht Berlin (Charlottenburg)",
      "registernummer": "HRB 173684",
      "registerart": "HRB",
      "company_name": "Insitu Immobilien Konzepte GmbH",
      "company_seat": "Berlin",
      "details": "22.11.2024 (Bekanntmachungsdatum)\n\nBerlin Amtsgericht Berlin (Charlottenburg) HRB 173684\nRegisterbekanntmachung nach dem Umwandlungsgesetz 21.11.2024 (Eintragungsdatum)\n\nInsitu Immobilien Konzepte GmbH\nGesellschaft mit beschränkter Haftung\nBerlin\n\nZu Eintragungsnummer 3 vom 21.11.2024 wird als nicht eingetragen veröffentlicht: Den Gläubigern der an der Verschmelzung beteiligten Rechtsträger ist, wenn sie binnen sechs Monaten nach dem Tag, an dem die Eintragung der Verschmelzung in das Register des Sitzes desjenigen Rechtsträgers, dessen Gläubiger sie sind, als bekannt gemacht gilt, ihren Anspruch nach Grund und Höhe schriftlich anmelden, Sicherheit zu leisten, soweit sie nicht Befriedigung verlangen können. Dieses Recht steht den Gläubigern jedoch nur zu, wenn sie glaubhaft machen, dass durch die Verschmelzung die Erfüllung ihrer Forderung gefährdet wird. Das Recht, Sicherheitsleistung zu verlangen, steht Gläubigern nicht zu, die im Falle der Insolvenz ein Recht auf vorzugsweise Befriedigung aus einer Deckungsmasse haben, die nach gesetzlicher Vorschrift zu ihrem Schutz errichtet und staatlich überwacht ist."
    },
    {
      "date": "2024-11-22",
      "id": "94392",
      "original_text": "Registerbekanntmachung nach dem Umwandlungsgesetz\nNordrhein-Westfalen Amtsgericht Paderborn HRA 892\nIntern Heizcontroll-Gesellschaft K. Weber e. K. – Paderborn",
      "type": "Registerbekanntmachung nach dem Umwandlungsgesetz",
      "state": "Nordrhein-Westfalen",
      "amtsgericht": "Amtsgericht Paderborn",
      "registernummer": "HRA 892",
      "registerart": "HRA",
      "company_name": "Intern Heizcontroll-Gesellschaft K. Weber e. K.",
      "company_seat": "Paderborn",
      "details": "22.11.2024 (Bekanntmachungsdatum)\n\nNordrhein-Westfalen Amtsgericht Paderborn HRA 892\nRegisterbekanntmachung nach dem Umwandlungsgesetz 22.11.2024 (Eintragungsdatum)\n\nIntern Heizcontroll-Gesellschaft K. Weber e. K.\nEinzelkaufmann / Einzelkauffrau\nPaderborn\n\nDen Gläubigern der an der Ausgliederung beteiligten Rechtsträger ist, wenn sie binnen sechs Monaten nach dem Tag, an dem die Eintragung der Ausgliederung in das Register des Sitzes desjenigen Rechtsträgers, dessen Gläubiger sie sind, nach § 19 Absatz 3 UmwG als bekanntgemacht gilt, ihren Anspruch nach Grund und Höhe schriftlich anmelden, Sicherheit zu leisten, soweit sie nicht Befriedigung verlangen können. Dieses Recht steht den Gläubigern jedoch nur zu, wenn sie glaubhaft machen, dass durch die Ausgliederung die Erfüllung ihrer Forderung gefährdet wird."
    },
    {
      "date": "2024-11-22",
      "id": "94345",
      "original_text": "Löschungsankündigung\nBerlin Amtsgericht Berlin (Charlottenburg) HRB 239385\nJT Distribution GmbH – Berlin",
      "type": "Löschungsankündigung",
      "state": "Berlin",
      "amtsgericht": "Amtsgericht Berlin (Charlottenburg)",
      "registernummer": "HRB 239385",
      "registerart": "HRB",
      "company_name": "JT Distribution GmbH",
      "company_seat": "Berlin",
      "details": "22.11.2024 (Bekanntmachungsdatum)\n\nBerlin Amtsgericht Berlin (Charlottenburg) HRB 239385\nLöschungsankündigung\n\nJT Distribution GmbH\nGesellschaft mit beschränkter Haftung\nBerlin\n\nBei der nachstehenden Gesellschaft wird das Amtslöschungsverfahren gemäß § 394 FamFG eingeleitet. Widerspruchsfrist 6 Wochen"
    },
    {
      "date": "2024-11-22",
      "id": "94348",
      "original_text": "Löschungsankündigung\nSaarland Amtsgericht Saarbrücken HRB 103829\nJouliard UG (haftungsbeschränkt) – Saarbrücken",
      "type": "Löschungsankündigung",
      "state": "Saarland",
      "amtsgericht": "Amtsgericht Saarbrücken",
      "registernummer": "HRB 103829",
      "registerart": "HRB",
      "company_name": "Jouliard UG (haftungsbeschränkt)",
      "company_seat": "Saarbrücken",
      "details": "22.11.2024 (Bekanntmachungsdatum)\n\nSaarland Amtsgericht Saarbrücken HRB 103829\nLöschungsankündigung\n\nJouliard UG (haftungsbeschränkt)\nGesellschaft mit beschränkter Haftung\nSaarbrücken\n\nEs ist beabsichtigt, die Gesellschaft von Amts wegen gemäß § 394 FamFG wegen Vermögenslosigkeit zu löschen.\nGegen die Löschung von Amts wegen ist das Rechtsmittel des Widerspruchs statthaft. Der Widerspruch ist binnen einer Frist zwei Monaten beginnend mit dem Tag dieser Veröffentlichung durch Einreichen eines Widerspruchsschreibens -schriftlich oder zur Niederschrift der Geschäftsstelle beim Amtsgericht Saarbrücken, -zentrales Handelsregister-, Mainzerstr.178, 66121 Saarbrücken einzulegen.\nDer Widerspruch muss die Bezeichnung der angefochtenen Löschungsankündigung enthalten sowie die Erklärung, dass Widerspruch eingelegt wird. Er ist vom Widerspruchsführer oder seinem Bevollmächtigten zu unterzeichnen.\nDas Widerspruchsschreiben kann auch in der Form eines elektronischen Dokumentes eingereicht werden, das mit einer qualifizierten elektronischen Signatur nach dem Signaturgesetz versehen sein muss (§§ 14 Abs. 2 FamFG, 130a, 298 ZPO)."
    },
    {
      "date": "2024-11-22",
      "id": "94418",
      "original_text": "Registerbekanntmachung nach dem Umwandlungsgesetz\nHessen Amtsgericht Gießen HRB 8641\nK M Getränke-Handels GmbH – Hungen",
      "type": "Registerbekanntmachung nach dem Umwandlungsgesetz",
      "state": "Hessen",
      "amtsgericht": "Amtsgericht Gießen",
      "registernummer": "HRB 8641",
      "registerart": "HRB",
      "company_name": "K M Getränke-Handels GmbH",
      "company_seat": "Hungen",
      "details": "22.11.2024 (Bekanntmachungsdatum)\n\nHessen Amtsgericht Gießen HRB 8641\nRegisterbekanntmachung nach dem Umwandlungsgesetz 22.11.2024 (Eintragungsdatum)\n\nK M Getränke-Handels GmbH\nGesellschaft mit beschränkter Haftung\nHungen\n\nDen Gläubigern der an der Verschmelzung beteiligten Rechtsträger ist, wenn sie binnen sechs Monaten nach dem Tag, an dem die Eintragung der Verschmelzung in das Register des Sitzes desjenigen Rechtsträgers, dessen Gläubiger sie sind, nach § 19 Absatz 3 UmwG bekannt gemacht worden ist, ihren Anspruch nach Grund und Höhe schriftlich anmelden, Sicherheit zu leisten, soweit sie nicht Befriedigung verlangen können. Dieses Recht steht den Gläubigern jedoch nur zu, wenn sie glaubhaft machen, dass durch die Verschmelzung die Erfüllung ihrer Forderung gefährdet wird."
    },
    {
      "date": "2024-11-22",
      "id": "94372",
      "original_text": "Löschungsankündigung\nBerlin Amtsgericht Berlin (Charlottenburg) HRB 216856\nK-S 24 Bauservice UG (haftungsbeschränkt) – Berlin",
      "type": "Löschungsankündigung",
      "state": "Berlin",
      "amtsgericht": "Amtsgericht Berlin (Charlottenburg)",
      "registernummer": "HRB 216856",
      "registerart": "HRB",
      "company_name": "K-S 24 Bauservice UG (haftungsbeschränkt)",
      "company_seat": "Berlin",
      "details": "22.11.2024 (Bekanntmachungsdatum)\n\nBerlin Amtsgericht Berlin (Charlottenburg) HRB 216856\nLöschungsankündigung\n\nK-S 24 Bauservice UG (haftungsbeschränkt)\nGesellschaft mit beschränkter Haftung\nBerlin\n\nBei der nachstehenden Gesellschaft wird das Amtslöschungsverfahren gemäß § 394 FamFG eingeleitet. Widerspruchsfrist 6 Wochen"
    },
    {
      "date": "2024-11-22",
      "id": "94377",
      "original_text": "Einreichung neuer Dokumente\nSachsen Amtsgericht Leipzig HRB 25657\nKELL Kommunalentsorgung Landkreis Leipzig GmbH – Großpösna",
      "type": "Einreichung neuer Dokumente",
      "state": "Sachsen",
      "amtsgericht": "Amtsgericht Leipzig",
      "registernummer": "HRB 25657",
      "registerart": "HRB",
      "company_name": "KELL Kommunalentsorgung Landkreis Leipzig GmbH",
      "company_seat": "Großpösna",
      "details": "22.11.2024 (Bekanntmachungsdatum)\n\nSachsen Amtsgericht Leipzig HRB 25657\nEinreichung neuer Dokumente\n\nKELL Kommunalentsorgung Landkreis Leipzig GmbH\nGesellschaft mit beschränkter Haftung\nGroßpösna\n\nAm 08.11.2024 wurde beim Handelsregister des Amtsgerichts Leipzig die Liste der Mitglieder des Aufsichtsrats gemäß § 52 GmbHG eingereicht."
    },
    {
      "date": "2024-11-22",
      "id": "94365",
      "original_text": "Einreichung neuer Dokumente\nSachsen-Anhalt Amtsgericht Stendal HRB 11285\nKreisverkehrsgesellschaft Salzland mbH – Bernburg (Saale)",
      "type": "Einreichung neuer Dokumente",
      "state": "Sachsen-Anhalt",
      "amtsgericht": "Amtsgericht Stendal",
      "registernummer": "HRB 11285",
      "registerart": "HRB",
      "company_name": "Kreisverkehrsgesellschaft Salzland mbH",
      "company_seat": "Bernburg (Saale)",
      "details": "22.11.2024 (Bekanntmachungsdatum)\n\nSachsen-Anhalt Amtsgericht Stendal HRB 11285\nEinreichung neuer Dokumente 21.11.2024 (Eintragungsdatum)\n\nKreisverkehrsgesellschaft Salzland mbH\nGesellschaft mit beschränkter Haftung\nBernburg (Saale)\n\nEine Liste der Mitglieder des Aufsichtsrates wurde zum Handelsregister eingereicht."
    },
    {
      "date": "2024-11-22",
      "id": "94411",
      "original_text": "Löschungsankündigung\nNordrhein-Westfalen Amtsgericht Mönchengladbach HRB 7573\nKüx Transporte GmbH – Rommerskirchen",
      "type": "Löschungsankündigung",
      "state": "Nordrhein-Westfalen",
      "amtsgericht": "Amtsgericht Mönchengladbach",
      "registernummer": "HRB 7573",
      "registerart": "HRB",
      "company_name": "Küx Transporte GmbH",
      "company_seat": "Rommerskirchen",
      "details": "22.11.2024 (Bekanntmachungsdatum)\n\nNordrhein-Westfalen Amtsgericht Mönchengladbach HRB 7573\nLöschungsankündigung\n\nKüx Transporte GmbH\nGesellschaft mit beschränkter Haftung\nRommerskirchen\n\nKüx Transporte GmbH, Rommerskirchen (Amtsgericht Mönchengladbach, HRB 7573).\nDas Registergericht beabsichtigt, die im Handelsregister eingetragene Gesellschaft gemäß § 394 Absatz 1 FamFG wegen Vermögenslosigkeit von Amts wegen zu löschen. Gegen diese Verfügung kann Widerspruch eingelegt werden. Die Frist zur Erhebung eines Widerspruchs gegen die beabsichtigte Löschung von Amts wegen ist auf zwei Monate festgesetzt."
    },
    {
      "date": "2024-11-22",
      "id": "94364",
      "original_text": "Löschungsankündigung\nSchleswig-Holstein Amtsgericht Lübeck HRB 12790\nLBN Baukontor GmbH – Lütjensee",
      "type": "Löschungsankündigung",
      "state": "Schleswig-Holstein",
      "amtsgericht": "Amtsgericht Lübeck",
      "registernummer": "HRB 12790",
      "registerart": "HRB",
      "company_name": "LBN Baukontor GmbH",
      "company_seat": "Lütjensee",
      "details": "22.11.2024 (Bekanntmachungsdatum)\n\nSchleswig-Holstein Amtsgericht Lübeck HRB 12790\nLöschungsankündigung\n\nLBN Baukontor GmbH\nGesellschaft mit beschränkter Haftung\nLütjensee\n\nEs ist die Löschung der nachstehenden Gesellschaft wegen Vermögenslosigkeit gemäß § 394 FamFG beabsichtigt."
    },
    {
      "date": "2024-11-22",
      "id": "94368",
      "original_text": "Löschungsankündigung\nBrandenburg Amtsgericht Frankfurt/Oder HRB 15183\nLHR Projektentwicklung & Projektmanagement GmbH – Hoppegarten",
      "type": "Löschungsankündigung",
      "state": "Brandenburg",
      "amtsgericht": "Amtsgericht Frankfurt/Oder",
      "registernummer": "HRB 15183",
      "registerart": "HRB",
      "company_name": "LHR Projektentwicklung & Projektmanagement GmbH",
      "company_seat": "Hoppegarten",
      "details": "22.11.2024 (Bekanntmachungsdatum)\n\nBrandenburg Amtsgericht Frankfurt/Oder HRB 15183\nLöschungsankündigung\n\nLHR Projektentwicklung & Projektmanagement GmbH\nGesellschaft mit beschränkter Haftung\nHoppegarten\n\nBei der nachstehenden Gesellschaft wird das Amtslöschungsverfahren gemäß § 394 FamFG eingeleitet."
    },
    {
      "date": "2024-11-22",
      "id": "94379",
      "original_text": "Einreichung neuer Dokumente\nNiedersachsen Amtsgericht Hildesheim HRB 2534\nLambertinum Seniorenwohnanlage gemeinnützige GmbH – Hildesheim",
      "type": "Einreichung neuer Dokumente",
      "state": "Niedersachsen",
      "amtsgericht": "Amtsgericht Hildesheim",
      "registernummer": "HRB 2534",
      "registerart": "HRB",
      "company_name": "Lambertinum Seniorenwohnanlage gemeinnützige GmbH",
      "company_seat": "Hildesheim",
      "details": "22.11.2024 (Bekanntmachungsdatum)\n\nNiedersachsen Amtsgericht Hildesheim HRB 2534\nEinreichung neuer Dokumente\n\nLambertinum Seniorenwohnanlage gemeinnützige GmbH\nGesellschaft mit beschränkter Haftung\nHildesheim\n\nDie Liste der Mitglieder des Aufsichtsrats wurde beim Registergericht eingereicht."
    },
    {
      "date": "2024-11-22",
      "id": "94378",
      "original_text": "Einreichung neuer Dokumente\nNiedersachsen Amtsgericht Braunschweig HRB 100007 früher Amtsgericht Wolfsburg\nLandE GmbH – Wolfsburg-Fallersleben",
      "type": "Einreichung neuer Dokumente",
      "state": "Niedersachsen",
      "amtsgericht": "Amtsgericht Braunschweig",
      "registernummer": "HRB 100007",
      "registerart": "HRB",
      "company_name": "LandE GmbH",
      "company_seat": "Wolfsburg-Fallersleben",
      "former_amtsgericht": "Wolfsburg",
      "details": "22.11.2024 (Bekanntmachungsdatum)\n\nNiedersachsen Amtsgericht Braunschweig HRB 100007 früher Amtsgericht Wolfsburg\nEinreichung neuer Dokumente\n\nLandE GmbH\nGesellschaft mit beschränkter Haftung\nWolfsburg-Fallersleben\n\nDie aktuelle Liste der Mitglieder des Aufsichtsrats wurde beim Registergericht eingereicht."
    },
    {
      "date": "2024-11-22",
      "id": "94380",
      "original_text": "Löschungsankündigung\nNiedersachsen Amtsgericht Oldenburg (Oldenburg) HRB 215657\nLichtpunkt GmbH – Oldenburg",
      "type": "Löschungsankündigung",
      "state": "Niedersachsen",
      "amtsgericht": "Amtsgericht Oldenburg (Oldenburg)",
      "registernummer": "HRB 215657",
      "registerart": "HRB",
      "company_name": "Lichtpunkt GmbH",
      "company_seat": "Oldenburg",
      "details": "22.11.2024 (Bekanntmachungsdatum)\n\nNiedersachsen Amtsgericht Oldenburg (Oldenburg) HRB 215657\nLöschungsankündigung\n\nLichtpunkt GmbH\nGesellschaft mit beschränkter Haftung\nOldenburg\n\nDas Registergericht beabsichtigt, die Gesellschaft von Amts wegen nach § 394 FamFG zu löschen. Die Frist zur Erhebung eines Widerspruchs ist auf 1 Monat ab dieser Registerbekanntmachung festgesetzt."
    },
    {
      "date": "2024-11-22",
      "id": "94340",
      "original_text": "Registerbekanntmachung nach dem Umwandlungsgesetz\nBayern Amtsgericht Nürnberg HRB 40940\nMDCW Clickwise DE UG (haftungsbeschränkt) – Nürnberg",
      "type": "Registerbekanntmachung nach dem Umwandlungsgesetz",
      "state": "Bayern",
      "amtsgericht": "Amtsgericht Nürnberg",
      "registernummer": "HRB 40940",
      "registerart": "HRB",
      "company_name": "MDCW Clickwise DE UG (haftungsbeschränkt)",
      "company_seat": "Nürnberg",
      "details": "22.11.2024 (Bekanntmachungsdatum)\n\nBayern Amtsgericht Nürnberg HRB 40940\nRegisterbekanntmachung nach dem Umwandlungsgesetz 21.11.2024 (Eintragungsdatum)\n\nMDCW Clickwise DE UG (haftungsbeschränkt)\nGesellschaft mit beschränkter Haftung\nNürnberg\n\nDen Gläubigern der an der Verschmelzung beteiligten Rechtsträger ist, wenn sie binnen sechs Monaten nach dem Tag, an dem die Eintragung der Verschmelzung in das Register des Sitzes desjenigen Rechtsträgers, dessen Gläubiger sie sind, nach § 19 Abs. 3 UmwG als bekannt gemacht gilt, ihren Anspruch nach Grund und Höhe schriftlich anmelden, Sicherheit zu leisten, soweit sie nicht Befriedigung verlangen können. Dieses Recht steht den Gläubigern jedoch nur zu, wenn sie glaubhaft machen, dass durch die Verschmelzung die Erfüllung ihrer Forderung gefährdet wird."
    },
    {
      "date": "2024-11-22",
      "id": "94420",
      "original_text": "Löschungsankündigung\nHessen Amtsgericht Frankfurt am Main HRB 85931\nMarketTV GmbH – Frankfurt am Main",
      "type": "Löschungsankündigung",
      "state": "Hessen",
      "amtsgericht": "Amtsgericht Frankfurt am Main",
      "registernummer": "HRB 85931",
      "registerart": "HRB",
      "company_name": "MarketTV GmbH",
      "company_seat": "Frankfurt am Main",
      "details": "22.11.2024 (Bekanntmachungsdatum)\n\nHessen Amtsgericht Frankfurt am Main HRB 85931\nLöschungsankündigung\n\nMarketTV GmbH\nGesellschaft mit beschränkter Haftung\nFrankfurt am Main\n\nEs ist beabsichtigt die Gesellschaft wegen Vermögenslosigkeit gemäß § 394 FamFG von Amts wegen zu löschen. Hiergegen kann innerhalb eines Monats nach dieser Veröffentlichung Widerspruch bei dem Amtsgericht Frankfurt am Main eingelegt werden."
    },
    {
      "date": "2024-11-22",
      "id": "94386",
      "original_text": "Löschungsankündigung\nBremen Amtsgericht Bremen HRA 21365\nMartin Niebank GmbH & Co. KG – Bremen",
      "type": "Löschungsankündigung",
      "state": "Bremen",
      "amtsgericht": "Amtsgericht Bremen",
      "registernummer": "HRA 21365",
      "registerart": "HRA",
      "company_name": "Martin Niebank GmbH & Co. KG",
      "company_seat": "Bremen",
      "details": "22.11.2024 (Bekanntmachungsdatum)\n\nBremen Amtsgericht Bremen HRA 21365\nLöschungsankündigung\n\nMartin Niebank GmbH & Co. KG\nKommanditgesellschaft\nBremen\n\nEs ist beabsichtigt die im Handelsregister eingetragene Firma von Amts wegen gemäß § 31 Abs.2 HGB zu löschen. Gegen die Löschung kann beim AG Bremen schriftlich oder zu Protokoll der Geschäftsstelle Widerspruch eingelegt werden. Widerspruchsfrist 4 Wochen."
    },
    {
      "date": "2024-11-22",
      "id": "94416",
      "original_text": "Registerbekanntmachung nach dem Umwandlungsgesetz\nHessen Amtsgericht Wiesbaden HRB 35364\nMesa Germany GmbH – Waldems",
      "type": "Registerbekanntmachung nach dem Umwandlungsgesetz",
      "state": "Hessen",
      "amtsgericht": "Amtsgericht Wiesbaden",
      "registernummer": "HRB 35364",
      "registerart": "HRB",
      "company_name": "Mesa Germany GmbH",
      "company_seat": "Waldems",
      "details": "22.11.2024 (Bekanntmachungsdatum)\n\nHessen Amtsgericht Wiesbaden HRB 35364\nRegisterbekanntmachung nach dem Umwandlungsgesetz 22.11.2024 (Eintragungsdatum)\n\nMesa Germany GmbH\nGesellschaft mit beschränkter Haftung\nWaldems\n\nDen Gläubigern der an der Verschmelzung beteiligten Rechtsträger ist, wenn sie binnen sechs Monaten nach dem Tag, an dem die Eintragung der Verschmelzung in das Register des Sitzes derjenigen Rechtsträger deren Gläubiger sie sind, nach § 19 Absatz 3 UmwG bekannt gemacht worden ist, ihren Anspruch nach Grund und Höhe schriftlich anmelden, Sicherheit zu leisten, soweit sie nicht Befriedigung verlangen können. Dieses Recht steht den Gläubigern jedoch nur zu, wenn sie glaubhaft machen, dass durch die Verschmelzung die Erfüllung ihrer Forderung gefährdet wird."
    },
    {
      "date": "2024-11-22",
      "id": "94361",
      "original_text": "Registerbekanntmachung nach dem Umwandlungsgesetz\nBaden-Württemberg Amtsgericht Freiburg HRA 708803\nMonika Bauer e.K. – Villingen-Schwenningen",
      "type": "Registerbekanntmachung nach dem Umwandlungsgesetz",
      "state": "Baden-Württemberg",
      "amtsgericht": "Amtsgericht Freiburg",
      "registernummer": "HRA 708803",
      "registerart": "HRA",
      "company_name": "Monika Bauer e.K.",
      "company_seat": "Villingen-Schwenningen",
      "details": "22.11.2024 (Bekanntmachungsdatum)\n\nBaden-Württemberg Amtsgericht Freiburg HRA 708803\nRegisterbekanntmachung nach dem Umwandlungsgesetz 22.11.2024 (Eintragungsdatum)\n\nMonika Bauer e.K.\nEinzelkaufmann / Einzelkauffrau\nVillingen-Schwenningen\n\nDen Gläubigern der an der Ausgliederung beteiligten Rechtsträger ist, wenn sie binnen sechs Monaten nach dem Tag, an dem die Eintragung der Ausgliederung in das Register des Sitzes desjenigen Rechtsträgers, dessen Gläubiger sie sind, nach § 19 Abs. 3 UmwG als bekanntgemacht gilt, ihren Anspruch nach Grund und Höhe schriftlich anmelden, Sicherheit zu leisten, soweit sie nicht Befriedigung verlangen können. Dieses Recht steht den Gläubigern jedoch nur zu, wenn sie glaubhaft machen, dass durch die Ausgliederung die Erfüllung ihrer Forderung gefährdet wird."
    },
    {
      "date": "2024-11-22",
      "id": "94359",
      "original_text": "Registerbekanntmachung nach dem Umwandlungsgesetz\nBaden-Württemberg Amtsgericht Stuttgart HRB 104011\nNeuffer Malerwerkstätte GmbH – Heilbronn",
      "type": "Registerbekanntmachung nach dem Umwandlungsgesetz",
      "state": "Baden-Württemberg",
      "amtsgericht": "Amtsgericht Stuttgart",
      "registernummer": "HRB 104011",
      "registerart": "HRB",
      "company_name": "Neuffer Malerwerkstätte GmbH",
      "company_seat": "Heilbronn",
      "details": "22.11.2024 (Bekanntmachungsdatum)\n\nBaden-Württemberg Amtsgericht Stuttgart HRB 104011\nRegisterbekanntmachung nach dem Umwandlungsgesetz 22.11.2024 (Eintragungsdatum)\n\nNeuffer Malerwerkstätte GmbH\nGesellschaft mit beschränkter Haftung\nHeilbronn\n\nAls nicht eingetragen wird bekanntgemacht:\nDen Gläubigern der an der Verschmelzung beteiligten Rechtsträger ist, wenn sie binnen sechs Monaten nach dem Tag, an dem die Eintragung der Verschmelzung in das Register des Sitzes desjenigen Rechtsträgers, dessen Gläubiger sie sind, nach § 19 Abs. 3 UmwG als bekanntgemacht gilt, ihren Anspruch nach Grund und Höhe schriftlich anmelden, Sicherheit zu leisten, soweit sie nicht Befriedigung verlangen können. Dieses Recht steht den Gläubigern jedoch nur zu, wenn sie glaubhaft machen, dass durch die Verschmelzung die Erfüllung ihrer Forderung gefährdet wird."
    },
    {
      "date": "2024-11-22",
      "id": "94421",
      "original_text": "Löschungsankündigung\nHessen Amtsgericht Königstein HRB 8121\nNew City Company d.o.o – Bad Soden am Taunus",
      "type": "Löschungsankündigung",
      "state": "Hessen",
      "amtsgericht": "Amtsgericht Königstein",
      "registernummer": "HRB 8121",
      "registerart": "HRB",
      "company_name": "New City Company d.o.o",
      "company_seat": "Bad Soden am Taunus",
      "details": "22.11.2024 (Bekanntmachungsdatum)\n\nHessen Amtsgericht Königstein HRB 8121\nLöschungsankündigung 22.11.2024 (Eintragungsdatum)\n\nNew City Company d.o.o\nRechtsform ausländischen Rechts HRB\nBad Soden am Taunus\n\nDas Registergericht beabsichtigt die im Handelsregister eingetragene Gesellschaft von Amts wegen nach § 394 FamFG zu löschen. Die Frist zur Erhebung eines Widerspruchs gegen die beabsichtigte Löschung wird auf 3 Monate festgesetzt."
    },
    {
      "date": "2024-11-22",
      "id": "94389",
      "original_text": "Sonstige Registerbekanntmachung\nRheinland-Pfalz Amtsgericht Mainz HRB 3685\nNewa - Vertriebs GmbH – Mainz",
      "type": "Sonstige Registerbekanntmachung",
      "state": "Rheinland-Pfalz",
      "amtsgericht": "Amtsgericht Mainz",
      "registernummer": "HRB 3685",
      "registerart": "HRB",
      "company_name": "Newa - Vertriebs GmbH",
      "company_seat": "Mainz",
      "details": "22.11.2024 (Bekanntmachungsdatum)\n\nRheinland-Pfalz Amtsgericht Mainz HRB 3685\nSonstige Registerbekanntmachung 20.11.2024 (Eintragungsdatum)\n\nNewa - Vertriebs GmbH\nGesellschaft mit beschränkter Haftung\nMainz\n\nAls nicht eingetragen wird veröffentlicht:\nDen Gläubigern der Gesellschaft, deren Forderungen begründet worden sind, bevor die Eintragung der Beendigung des Gewinnabführungsvertrages vom 30.11.2017 und des Beherrschungsvertrages vom 03.12.2018 in das Handelsregister nach § 10 des Handelsgesetzbuches als bekanntgemacht gilt, hat der andere Vertragsteil Sicherheit zu leisten, wenn sie sich binnen sechs Monaten nach der Bekanntmachung der Eintragung zu diesem Zweck bei ihm melden."
    },
    {
      "date": "2024-11-22",
      "id": "94397",
      "original_text": "Registerbekanntmachung nach dem Umwandlungsgesetz\nNordrhein-Westfalen Amtsgericht Dortmund HRB 30442\nNicLen Holding GmbH – Dortmund",
      "type": "Registerbekanntmachung nach dem Umwandlungsgesetz",
      "state": "Nordrhein-Westfalen",
      "amtsgericht": "Amtsgericht Dortmund",
      "registernummer": "HRB 30442",
      "registerart": "HRB",
      "company_name": "NicLen Holding GmbH",
      "company_seat": "Dortmund",
      "details": "22.11.2024 (Bekanntmachungsdatum)\n\nNordrhein-Westfalen Amtsgericht Dortmund HRB 30442\nRegisterbekanntmachung nach dem Umwandlungsgesetz 22.11.2024 (Eintragungsdatum)\n\nNicLen Holding GmbH\nGesellschaft mit beschränkter Haftung\nDortmund\n\nDen Gläubigern der an der Verschmelzung beteiligten Rechtsträger ist, wenn sie binnen sechs Monaten nach dem Tag, an dem die Eintragung der Verschmelzung in das Register des Sitzes desjenigen Rechtsträgers, dessen Gläubiger sie sind, nach § 19 Absatz 3 UmwG als bekanntgemacht gilt, ihren Anspruch nach Grund und Höhe schriftlich anmelden, Sicherheit zu leisten, soweit sie nicht Befriedigung verlangen können. Dieses Recht steht den Gläubigern jedoch nur zu, wenn sie glaubhaft machen, dass durch die Verschmelzung die Erfüllung ihrer Forderung gefährdet wird."
    },
    {
      "date": "2024-11-22",
      "id": "94385",
      "original_text": "Registerbekanntmachung nach dem Umwandlungsgesetz\nNiedersachsen Amtsgericht Oldenburg (Oldenburg) HRB 201738\nOmni-Pac GmbH Verpackungsmittel – Elsfleth",
      "type": "Registerbekanntmachung nach dem Umwandlungsgesetz",
      "state": "Niedersachsen",
      "amtsgericht": "Amtsgericht Oldenburg (Oldenburg)",
      "registernummer": "HRB 201738",
      "registerart": "HRB",
      "company_name": "Omni-Pac GmbH Verpackungsmittel",
      "company_seat": "Elsfleth",
      "details": "22.11.2024 (Bekanntmachungsdatum)\n\nNiedersachsen Amtsgericht Oldenburg (Oldenburg) HRB 201738\nRegisterbekanntmachung nach dem Umwandlungsgesetz 22.11.2024 (Eintragungsdatum)\n\nOmni-Pac GmbH Verpackungsmittel\nGesellschaft mit beschränkter Haftung\nElsfleth\n\nDen Gläubigern der an der Verschmelzung beteiligten Rechtsträger ist, wenn sie binnen sechs Monaten nach dem Tag, an dem die Eintragung der Verschmelzung in das Register des Sitzes desjenigen Rechtsträgers, dessen Gläubiger sie sind, nach § 19  Abs.  3 UmwG als bekannt gemacht gilt, ihren Anspruch nach Grund und Höhe schriftlich anmelden, Sicherheit zu leisten, soweit sie nicht Befriedigung verlangen können. Dieses Recht steht den Gläubigern jedoch nur zu, wenn sie glaubhaft machen, dass durch die Verschmelzung die Erfüllung der Forderung gefährdet wird."
    },
    {
      "date": "2024-11-22",
      "id": "94362",
      "original_text": "Registerbekanntmachung nach dem Umwandlungsgesetz\nBaden-Württemberg Amtsgericht Freiburg HRB 731811\nPflegedienst Bauer GmbH – Villingen-Schwenningen",
      "type": "Registerbekanntmachung nach dem Umwandlungsgesetz",
      "state": "Baden-Württemberg",
      "amtsgericht": "Amtsgericht Freiburg",
      "registernummer": "HRB 731811",
      "registerart": "HRB",
      "company_name": "Pflegedienst Bauer GmbH",
      "company_seat": "Villingen-Schwenningen",
      "details": "22.11.2024 (Bekanntmachungsdatum)\n\nBaden-Württemberg Amtsgericht Freiburg HRB 731811\nRegisterbekanntmachung nach dem Umwandlungsgesetz 22.11.2024 (Eintragungsdatum)\n\nPflegedienst Bauer GmbH\nGesellschaft mit beschränkter Haftung\nVillingen-Schwenningen\n\nAls nicht eingetragen wird bekanntgemacht:\nDen Gläubigern der an der Ausgliederung beteiligten Rechtsträger ist, wenn sie binnen sechs Monaten nach dem Tag, an dem die Eintragung der Ausgliederung in das Register des Sitzes desjenigen Rechtsträgers, dessen Gläubiger sie sind, nach § 19 Abs. 3 UmwG als bekanntgemacht gilt, ihren Anspruch nach Grund und Höhe schriftlich anmelden, Sicherheit zu leisten, soweit sie nicht Befriedigung verlangen können. Dieses Recht steht den Gläubigern jedoch nur zu, wenn sie glaubhaft machen, dass durch die Ausgliederung die Erfüllung ihrer Forderung gefährdet wird."
    },
    {
      "date": "2024-11-22",
      "id": "94344",
      "original_text": "Registerbekanntmachung nach dem Umwandlungsgesetz\nBerlin Amtsgericht Berlin (Charlottenburg) HRB 259868\nPflegedienst Vohrer GmbH – Berlin",
      "type": "Registerbekanntmachung nach dem Umwandlungsgesetz",
      "state": "Berlin",
      "amtsgericht": "Amtsgericht Berlin (Charlottenburg)",
      "registernummer": "HRB 259868",
      "registerart": "HRB",
      "company_name": "Pflegedienst Vohrer GmbH",
      "company_seat": "Berlin",
      "details": "22.11.2024 (Bekanntmachungsdatum)\n\nBerlin Amtsgericht Berlin (Charlottenburg) HRB 259868\nRegisterbekanntmachung nach dem Umwandlungsgesetz 21.11.2024 (Eintragungsdatum)\n\nPflegedienst Vohrer GmbH\nGesellschaft mit beschränkter Haftung\nBerlin\n\nZu Eintragungsnummer 2 vom 21.11.2024 wird als nicht eingetragen veröffentlicht: Den Gläubigern der an der Ausgliederung beteiligten Rechtsträger ist, wenn sie binnen sechs Monaten nach dem Tag, an dem die Eintragung der Ausgliederung in das Register des Sitzes desjenigen Rechtsträgers, dessen Gläubiger sie sind, als bekannt gemacht gilt, ihren Anspruch nach Grund und Höhe schriftlich anmelden, Sicherheit zu leisten, soweit sie nicht Befriedigung verlangen können. Dieses Recht steht den Gläubigern jedoch nur zu, wenn sie glaubhaft machen, dass durch die Ausgliederung die Erfüllung ihrer Forderung gefährdet wird. Das Recht, Sicherheitsleistung zu verlangen, steht Gläubigern nicht zu, die im Falle der Insolvenz ein Recht auf vorzugsweise Befriedigung aus einer Deckungsmasse haben, die nach gesetzlicher Vorschrift zu ihrem Schutz errichtet und staatlich überwacht ist."
    },
    {
      "date": "2024-11-22",
      "id": "94343",
      "original_text": "Registerbekanntmachung nach dem Umwandlungsgesetz\nBerlin Amtsgericht Berlin (Charlottenburg) HRA 62442\nPflegedienst Vohrer Helena Vohrer e.K. – Berlin",
      "type": "Registerbekanntmachung nach dem Umwandlungsgesetz",
      "state": "Berlin",
      "amtsgericht": "Amtsgericht Berlin (Charlottenburg)",
      "registernummer": "HRA 62442",
      "registerart": "HRA",
      "company_name": "Pflegedienst Vohrer Helena Vohrer e.K.",
      "company_seat": "Berlin",
      "details": "22.11.2024 (Bekanntmachungsdatum)\n\nBerlin Amtsgericht Berlin (Charlottenburg) HRA 62442\nRegisterbekanntmachung nach dem Umwandlungsgesetz 21.11.2024 (Eintragungsdatum)\n\nPflegedienst Vohrer Helena Vohrer e.K.\nEinzelkaufmann / Einzelkauffrau\nBerlin\n\nZu Eintragungsnummer 2 vom 21.11.2024 wird als nicht eingetragen veröffentlicht: Den Gläubigern der an der Ausgliederung beteiligten Rechtsträger ist, wenn sie binnen sechs Monaten nach dem Tag, an dem die Eintragung der Ausgliederung in das Register des Sitzes desjenigen Rechtsträgers, dessen Gläubiger sie sind, als bekannt gemacht gilt, ihren Anspruch nach Grund und Höhe schriftlich anmelden, Sicherheit zu leisten, soweit sie nicht Befriedigung verlangen können. Dieses Recht steht den Gläubigern jedoch nur zu, wenn sie glaubhaft machen, dass durch die Ausgliederung die Erfüllung ihrer Forderung gefährdet wird. Das Recht, Sicherheitsleistung zu verlangen, steht Gläubigern nicht zu, die im Falle der Insolvenz ein Recht auf vorzugsweise Befriedigung aus einer Deckungsmasse haben, die nach gesetzlicher Vorschrift zu ihrem Schutz errichtet und staatlich überwacht ist."
    },
    {
      "date": "2024-11-22",
      "id": "94329",
      "original_text": "Registerbekanntmachung nach dem Umwandlungsgesetz\nBayern Amtsgericht Fürth HRA 12403\nPhilipp Schneider Hotel Riesengebirge e.K. – Neuhof a.d.Zenn",
      "type": "Registerbekanntmachung nach dem Umwandlungsgesetz",
      "state": "Bayern",
      "amtsgericht": "Amtsgericht Fürth",
      "registernummer": "HRA 12403",
      "registerart": "HRA",
      "company_name": "Philipp Schneider Hotel Riesengebirge e.K.",
      "company_seat": "Neuhof a.d.Zenn",
      "details": "22.11.2024 (Bekanntmachungsdatum)\n\nBayern Amtsgericht Fürth HRA 12403\nRegisterbekanntmachung nach dem Umwandlungsgesetz 21.11.2024 (Eintragungsdatum)\n\nPhilipp Schneider Hotel Riesengebirge e.K.\nEinzelkaufmann / Einzelkauffrau\nNeuhof a.d.Zenn\n\nDen Gläubigern der an der Ausgliederung beteiligten Rechtsträger ist, wenn sie binnen sechs Monaten nach dem Tag, an dem die Eintragung der Ausgliederung in das Register des Sitzes desjenigen Rechtsträgers, dessen Gläubiger sie sind, nach §§ 125, 19 Abs. 3 UmwG als bekannt gemacht gilt, ihren Anspruch nach Grund und Höhe schriftlich anmelden, Sicherheit zu leisten, soweit sie nicht Befriedigung verlangen können. Dieses Recht steht den Gläubigern jedoch nur zu, wenn sie glaubhaft machen, dass durch die Ausgliederung die Erfüllung ihrer Forderung gefährdet wird."
    },
    {
      "date": "2024-11-22",
      "id": "94404",
      "original_text": "Löschungsankündigung\nNordrhein-Westfalen Amtsgericht Gelsenkirchen HRB 3294\nPichottka Verwaltungs-GmbH – Gelsenkirchen",
      "type": "Löschungsankündigung",
      "state": "Nordrhein-Westfalen",
      "amtsgericht": "Amtsgericht Gelsenkirchen",
      "registernummer": "HRB 3294",
      "registerart": "HRB",
      "company_name": "Pichottka Verwaltungs-GmbH",
      "company_seat": "Gelsenkirchen",
      "details": "22.11.2024 (Bekanntmachungsdatum)\n\nNordrhein-Westfalen Amtsgericht Gelsenkirchen HRB 3294\nLöschungsankündigung\n\nPichottka Verwaltungs-GmbH\nGesellschaft mit beschränkter Haftung\nGelsenkirchen\n\nDas Amtsgericht Gelsenkirchen als Registergericht beabsichtigt, die Eintragung der Frau Edeltraud Pichottka als alleinige Geschäftsführerin der in seinem Handelsregister unter HRB 3294 eingetragenen Gesellschaft Pichottka Verwaltungs-GmbH mit Sitz in Gelsenkirchen gemäß § 395 Abs. 1 FamFG wegen Unrichtigkeit von Amts wegen zu löschen.\n\nHiermit wird denjenigen, die an der Unterlassung der Löschung ein berechtigtes Interesse haben, gem. §§ 395 Abs. 2 Satz 2, 394 Abs. 2 FamFG Gelegenheit gegeben, gegen dieses Vorhaben binnen eines Monats nach dieser Bekanntmachung Widerspruch einzulegen. Der Widerspruch kann schriftlich oder zu Protokoll der Geschäftsstelle erhoben werden."
    },
    {
      "date": "2024-11-22",
      "id": "94400",
      "original_text": "Löschungsankündigung\nNordrhein-Westfalen Amtsgericht Duisburg HRA 10702\nPort Textilvertriebs-GmbH & Co. KG – Duisburg",
      "type": "Löschungsankündigung",
      "state": "Nordrhein-Westfalen",
      "amtsgericht": "Amtsgericht Duisburg",
      "registernummer": "HRA 10702",
      "registerart": "HRA",
      "company_name": "Port Textilvertriebs-GmbH & Co. KG",
      "company_seat": "Duisburg",
      "details": "22.11.2024 (Bekanntmachungsdatum)\n\nNordrhein-Westfalen Amtsgericht Duisburg HRA 10702\nLöschungsankündigung\n\nPort Textilvertriebs-GmbH & Co. KG\nKommanditgesellschaft\nDuisburg\n\nDas Registergericht beabsichtigt die Firma von Amts wegen nach §§ 31, 6 HGB, § 393 FamFG zu löschen. Die Frist zur Erhebung eines Widerspruchs ist auf zwei Monate festgesetzt."
    },
    {
      "date": "2024-11-22",
      "id": "94347",
      "original_text": "Löschungsankündigung\nSchleswig-Holstein Amtsgericht Flensburg HRB 12320\nPretty Woman Flensburg GmbH – Harrislee",
      "type": "Löschungsankündigung",
      "state": "Schleswig-Holstein",
      "amtsgericht": "Amtsgericht Flensburg",
      "registernummer": "HRB 12320",
      "registerart": "HRB",
      "company_name": "Pretty Woman Flensburg GmbH",
      "company_seat": "Harrislee",
      "details": "22.11.2024 (Bekanntmachungsdatum)\n\nSchleswig-Holstein Amtsgericht Flensburg HRB 12320\nLöschungsankündigung\n\nPretty Woman Flensburg GmbH\nGesellschaft mit beschränkter Haftung\nHarrislee\n\nEs ist die Löschung der nachstehenden Gesellschaft wegen Vermögenslosigkeit gemäß § 394 FamFG beabsichtigt.\nWiderspruchsfrist: 2 Monate."
    },
    {
      "date": "2024-11-22",
      "id": "94336",
      "original_text": "Löschungsankündigung\nBayern Amtsgericht München HRB 150944\nRenner Marketing GmbH – München",
      "type": "Löschungsankündigung",
      "state": "Bayern",
      "amtsgericht": "Amtsgericht München",
      "registernummer": "HRB 150944",
      "registerart": "HRB",
      "company_name": "Renner Marketing GmbH",
      "company_seat": "München",
      "details": "22.11.2024 (Bekanntmachungsdatum)\n\nBayern Amtsgericht München HRB 150944\nLöschungsankündigung 21.11.2021 (Eintragungsdatum)\n\nRenner Marketing GmbH\nGesellschaft mit beschränkter Haftung\nMünchen\n\nDas Registergericht beabsichtigt, die im Handelsregister eingetragene Gesellschaft wegen Vermögenslosigkeit von Amts wegen nach § 394 FamFG zu löschen. Die Frist zur Erhebung eines Widerspruchs ist auf drei Monate festgesetzt."
    },
    {
      "date": "2024-11-22",
      "id": "94388",
      "original_text": "Löschungsankündigung\nRheinland-Pfalz Amtsgericht Ludwigshafen a.Rhein (Ludwigshafen) HRB 62142\nSB 114 Spielotheken-Betriebsgesellschaft Unternehmergesellschaft (haftungsbeschränkt) – Ludwigshafen am Rhein",
      "type": "Löschungsankündigung",
      "state": "Rheinland-Pfalz",
      "amtsgericht": "Amtsgericht Ludwigshafen a.Rhein (Ludwigshafen)",
      "registernummer": "HRB 62142",
      "registerart": "HRB",
      "company_name": "SB 114 Spielotheken-Betriebsgesellschaft Unternehmergesellschaft (haftungsbeschränkt)",
      "company_seat": "Ludwigshafen am Rhein",
      "details": "22.11.2024 (Bekanntmachungsdatum)\n\nRheinland-Pfalz Amtsgericht Ludwigshafen a.Rhein (Ludwigshafen) HRB 62142\nLöschungsankündigung\n\nSB 114 Spielotheken-Betriebsgesellschaft Unternehmergesellschaft (haftungsbeschränkt)\nGesellschaft mit beschränkter Haftung\nLudwigshafen am Rhein\n\nDas Registergericht beabsichtigt die Gesellschaft von Amts wegen nach § 394 FamFG zu löschen. Die Frist zur Erhebung eines Widerspruchs ist auf einen Monat festgesetzt."
    },
    {
      "date": "2024-11-22",
      "id": "94367",
      "original_text": "Einreichung neuer Dokumente\nBaden-Württemberg Amtsgericht Mannheim HRB 725128\nSOU AG – Schwetzingen",
      "type": "Einreichung neuer Dokumente",
      "state": "Baden-Württemberg",
      "amtsgericht": "Amtsgericht Mannheim",
      "registernummer": "HRB 725128",
      "registerart": "HRB",
      "company_name": "SOU AG",
      "company_seat": "Schwetzingen",
      "details": "22.11.2024 (Bekanntmachungsdatum)\n\nBaden-Württemberg Amtsgericht Mannheim HRB 725128\nEinreichung neuer Dokumente\n\nSOU AG\nAktiengesellschaft\nSchwetzingen\n\nDie Gesellschaft hat am 21.11.2024 die Liste über die Zusammensetzung des Aufsichtsrats zum Handelsregister eingereicht."
    },
    {
      "date": "2024-11-22",
      "id": "94401",
      "original_text": "Registerbekanntmachung nach dem Umwandlungsgesetz\nNordrhein-Westfalen Amtsgericht Düsseldorf HRB 94609\nSagitta Verwaltungs UG (haftungsbeschränkt) – Düsseldorf",
      "type": "Registerbekanntmachung nach dem Umwandlungsgesetz",
      "state": "Nordrhein-Westfalen",
      "amtsgericht": "Amtsgericht Düsseldorf",
      "registernummer": "HRB 94609",
      "registerart": "HRB",
      "company_name": "Sagitta Verwaltungs UG (haftungsbeschränkt)",
      "company_seat": "Düsseldorf",
      "details": "22.11.2024 (Bekanntmachungsdatum)\n\nNordrhein-Westfalen Amtsgericht Düsseldorf HRB 94609\nRegisterbekanntmachung nach dem Umwandlungsgesetz 22.11.2024 (Eintragungsdatum)\n\nSagitta Verwaltungs UG (haftungsbeschränkt)\nGesellschaft mit beschränkter Haftung\nDüsseldorf\n\nDen Gläubigern der an der Verschmelzung beteiligten Rechtsträger ist, wenn sie binnen sechs Monaten nach dem Tag, an dem die Eintragung der Verschmelzung in das Register des Sitzes desjenigen Rechtsträgers, dessen Gläubiger sie sind, nach § 19 Absatz 3 UmwG als bekanntgemacht gilt, ihren Anspruch nach Grund und Höhe schriftlich anmelden, Sicherheit zu leisten, soweit sie nicht Befriedigung verlangen können. Dieses Recht steht den Gläubigern jedoch nur zu, wenn sie glaubhaft machen, dass durch die Verschmelzung die Erfüllung ihrer Forderung gefährdet wird."
    },
    {
      "date": "2024-11-22",
      "id": "94390",
      "original_text": "Registerbekanntmachung nach dem Umwandlungsgesetz\nRheinland-Pfalz Amtsgericht Mainz HRB 49135\nTourexpi GmbH – Bingen am Rhein",
      "type": "Registerbekanntmachung nach dem Umwandlungsgesetz",
      "state": "Rheinland-Pfalz",
      "amtsgericht": "Amtsgericht Mainz",
      "registernummer": "HRB 49135",
      "registerart": "HRB",
      "company_name": "Tourexpi GmbH",
      "company_seat": "Bingen am Rhein",
      "details": "22.11.2024 (Bekanntmachungsdatum)\n\nRheinland-Pfalz Amtsgericht Mainz HRB 49135\nRegisterbekanntmachung nach dem Umwandlungsgesetz 22.11.2024 (Eintragungsdatum)\n\nTourexpi GmbH\nGesellschaft mit beschränkter Haftung\nBingen am Rhein\n\nAls nicht eingetragen wird veröffentlicht:\nDen Gläubigern der an der Verschmelzung beteiligten Rechtsträger ist, wenn sie binnen sechs Monaten nach dem Tag, an dem die Eintragung der Verschmelzung in das Register des Sitzes desjenigen Rechtsträgers, dessen Gläubiger sie sind, nach § 19 Abs. 3 UmwG als bekannt gemacht gilt, ihren Anspruch nach Grund und Höhe schriftlich anmelden, Sicherheit zu leisten, soweit sie nicht Befriedigung verlangen können. Dieses Recht steht den Gläubigern jedoch nur zu, wenn sie glaubhaft machen, dass durch die Verschmelzung die Erfüllung der Forderung gefährdet wird."
    },
    {
      "date": "2024-11-22",
      "id": "94338",
      "original_text": "Registerbekanntmachung nach dem Umwandlungsgesetz\nBayern Amtsgericht München HRB 261120\nTribeca Group GmbH – München",
      "type": "Registerbekanntmachung nach dem Umwandlungsgesetz",
      "state": "Bayern",
      "amtsgericht": "Amtsgericht München",
      "registernummer": "HRB 261120",
      "registerart": "HRB",
      "company_name": "Tribeca Group GmbH",
      "company_seat": "München",
      "details": "22.11.2024 (Bekanntmachungsdatum)\n\nBayern Amtsgericht München HRB 261120\nRegisterbekanntmachung nach dem Umwandlungsgesetz 21.11.2024 (Eintragungsdatum)\n\nTribeca Group GmbH\nGesellschaft mit beschränkter Haftung\nMünchen\n\nDen Gläubigern der an der Verschmelzung beteiligten Rechtsträger ist, wenn sie binnen sechs Monaten nach dem Tag, an dem die Eintragung der Verschmelzung in das Register des Sitzes desjenigen Rechtsträgers, dessen Gläubiger sie sind, nach § 19 Abs. 3 UmwG als bekannt gemacht gilt, ihren Anspruch nach Grund und Höhe schriftlich anmelden, Sicherheit zu leisten, soweit sie nicht Befriedigung verlangen können. Dieses Recht steht den Gläubigern jedoch nur zu, wenn sie glaubhaft machen, dass durch die Verschmelzung die Erfüllung ihrer Forderung gefährdet wird."
    },
    {
      "date": "2024-11-22",
      "id": "94407",
      "original_text": "Sonstige Registerbekanntmachung\nNordrhein-Westfalen Amtsgericht Köln HRB 64869\nVDV-Akademie (Verband Deutscher Verkehrsunternehmen-Akademie) GmbH – Köln",
      "type": "Sonstige Registerbekanntmachung",
      "state": "Nordrhein-Westfalen",
      "amtsgericht": "Amtsgericht Köln",
      "registernummer": "HRB 64869",
      "registerart": "HRB",
      "company_name": "VDV-Akademie (Verband Deutscher Verkehrsunternehmen-Akademie) GmbH",
      "company_seat": "Köln",
      "details": "22.11.2024 (Bekanntmachungsdatum)\n\nNordrhein-Westfalen Amtsgericht Köln HRB 64869\nSonstige Registerbekanntmachung\n\nVDV-Akademie (Verband Deutscher Verkehrsunternehmen-Akademie) GmbH\nGesellschaft mit beschränkter Haftung\nKöln\n\nDem Registergericht ist eine Liste der Mitglieder des Aufsichtsrates eingereicht worden."
    },
    {
      "date": "2024-11-22",
      "id": "94332",
      "original_text": "Registerbekanntmachung nach dem Umwandlungsgesetz\nBayern Amtsgericht München HRB 170668\nVTC Agrar GmbH – Gräfelfing",
      "type": "Registerbekanntmachung nach dem Umwandlungsgesetz",
      "state": "Bayern",
      "amtsgericht": "Amtsgericht München",
      "registernummer": "HRB 170668",
      "registerart": "HRB",
      "company_name": "VTC Agrar GmbH",
      "company_seat": "Gräfelfing",
      "details": "22.11.2024 (Bekanntmachungsdatum)\n\nBayern Amtsgericht München HRB 170668\nRegisterbekanntmachung nach dem Umwandlungsgesetz 21.11.2024 (Eintragungsdatum)\n\nVTC Agrar GmbH\nGesellschaft mit beschränkter Haftung\nGräfelfing\n\nDen Gläubigern der an der Verschmelzung beteiligten Rechtsträger ist, wenn sie binnen sechs Monaten nach dem Tag, an dem die Eintragung der Verschmelzung in das Register des Sitzes desjenigen Rechtsträgers, dessen Gläubiger sie sind, nach § 19 Abs. 3 UmwG als bekannt gemacht gilt, ihren Anspruch nach Grund und Höhe schriftlich anmelden, Sicherheit zu leisten, soweit sie nicht Befriedigung verlangen können. Dieses Recht steht den Gläubigern jedoch nur zu, wenn sie glaubhaft machen, dass durch die Verschmelzung die Erfüllung ihrer Forderung gefährdet wird."
    },
    {
      "date": "2024-11-22",
      "id": "94408",
      "original_text": "Löschungsankündigung\nNordrhein-Westfalen Amtsgericht Gelsenkirchen HRB 17916\nWUM GmbH – Gelsenkirchen",
      "type": "Löschungsankündigung",
      "state": "Nordrhein-Westfalen",
      "amtsgericht": "Amtsgericht Gelsenkirchen",
      "registernummer": "HRB 17916",
      "registerart": "HRB",
      "company_name": "WUM GmbH",
      "company_seat": "Gelsenkirchen",
      "details": "22.11.2024 (Bekanntmachungsdatum)\n\nNordrhein-Westfalen Amtsgericht Gelsenkirchen HRB 17916\nLöschungsankündigung\n\nWUM GmbH\nGesellschaft mit beschränkter Haftung\nGelsenkirchen\n\nDas Gericht beabsichtigt, die eingetragene WUM GmbH mit Sitz in Gelsenkirchen, HRB 17916, Amtsgericht Gelsenkirchen, wegen Vermögenslosigkeit zu löschen.\nHiermit wird denjenigen, die an der Unterlassung der Löschung ein berechtigtes Interesse haben, gem. § 394 Abs. 2 FamFG Gelegenheit gegeben, gegen dieses Vorhaben binnen eines Monats nach dieser Bekanntmachung Widerspruch einzulegen. Der Widerspruch kann schriftlich oder zu Protokoll der Geschäftsstelle erhoben werden."
    },
    {
      "date": "2024-11-22",
      "id": "94339",
      "original_text": "Registerbekanntmachung nach dem Umwandlungsgesetz\nBayern Amtsgericht München HRB 227081\nWealthCap Objekt-Vorrat 20 Komplementär GmbH – München",
      "type": "Registerbekanntmachung nach dem Umwandlungsgesetz",
      "state": "Bayern",
      "amtsgericht": "Amtsgericht München",
      "registernummer": "HRB 227081",
      "registerart": "HRB",
      "company_name": "WealthCap Objekt-Vorrat 20 Komplementär GmbH",
      "company_seat": "München",
      "details": "22.11.2024 (Bekanntmachungsdatum)\n\nBayern Amtsgericht München HRB 227081\nRegisterbekanntmachung nach dem Umwandlungsgesetz 21.11.2024 (Eintragungsdatum)\n\nWealthCap Objekt-Vorrat 20 Komplementär GmbH\nGesellschaft mit beschränkter Haftung\nMünchen\n\nDen Gläubigern der an der Verschmelzung beteiligten Rechtsträger ist, wenn sie binnen sechs Monaten nach dem Tag, an dem die Eintragung der Verschmelzung in das Register des Sitzes desjenigen Rechtsträgers, dessen Gläubiger sie sind, nach § 19 Abs. 3 UmwG als bekannt gemacht gilt, ihren Anspruch nach Grund und Höhe schriftlich anmelden, Sicherheit zu leisten, soweit sie nicht Befriedigung verlangen können. Dieses Recht steht den Gläubigern jedoch nur zu, wenn sie glaubhaft machen, dass durch die Verschmelzung die Erfüllung ihrer Forderung gefährdet wird."
    },
    {
      "date": "2024-11-22",
      "id": "94354",
      "original_text": "Registerbekanntmachung nach dem Umwandlungsgesetz\nBerlin Amtsgericht Berlin (Charlottenburg) HRB 266878\nWiechern & Fricke Gastro GmbH – Berlin",
      "type": "Registerbekanntmachung nach dem Umwandlungsgesetz",
      "state": "Berlin",
      "amtsgericht": "Amtsgericht Berlin (Charlottenburg)",
      "registernummer": "HRB 266878",
      "registerart": "HRB",
      "company_name": "Wiechern & Fricke Gastro GmbH",
      "company_seat": "Berlin",
      "details": "22.11.2024 (Bekanntmachungsdatum)\n\nBerlin Amtsgericht Berlin (Charlottenburg) HRB 266878\nRegisterbekanntmachung nach dem Umwandlungsgesetz 21.11.2024 (Eintragungsdatum)\n\nWiechern & Fricke Gastro GmbH\nGesellschaft mit beschränkter Haftung\nBerlin\n\nDen Gläubigern der an der Spaltung beteiligten Rechtsträger ist, wenn sie binnen sechs Monaten nach dem Tag, an dem die Eintragung der Spaltung in das Register des Sitzes desjenigen Rechtsträgers, dessen Gläubiger sie sind, als bekannt gemacht gilt, ihren Anspruch nach Grund und Höhe schriftlich anmelden, Sicherheit zu leisten, soweit sie nicht Befriedigung verlangen können. Dieses Recht steht den Gläubigern jedoch nur zu, wenn sie glaubhaft machen, dass durch die Spaltung die Erfüllung ihrer Forderung gefährdet wird. Das Recht, Sicherheitsleistung zu verlangen, steht Gläubigern nicht zu, die im Falle der Insolvenz ein Recht auf vorzugsweise Befriedigung aus einer Deckungsmasse haben, die nach gesetzlicher Vorschrift zu ihrem Schutz errichtet und staatlich überwacht ist.Zu Eintragungsnummer 2 vom 21.11.2024 wird als nicht eingetragen veröffentlicht:"
    },
    {
      "date": "2024-11-22",
      "id": "94355",
      "original_text": "Registerbekanntmachung nach dem Umwandlungsgesetz\nBerlin Amtsgericht Berlin (Charlottenburg) HRB 266878\nWiechern & Fricke Gastro GmbH – Berlin",
      "type": "Registerbekanntmachung nach dem Umwandlungsgesetz",
      "state": "Berlin",
      "amtsgericht": "Amtsgericht Berlin (Charlottenburg)",
      "registernummer": "HRB 266878",
      "registerart": "HRB",
      "company_name": "Wiechern & Fricke Gastro GmbH",
      "company_seat": "Berlin",
      "details": "22.11.2024 (Bekanntmachungsdatum)\n\nBerlin Amtsgericht Berlin (Charlottenburg) HRB 266878\nRegisterbekanntmachung nach dem Umwandlungsgesetz 21.11.2024 (Eintragungsdatum)\n\nWiechern & Fricke Gastro GmbH\nGesellschaft mit beschränkter Haftung\nBerlin\n\nZu Eintragungsnummer 2 vom 21.11.2024 wird als nicht eingetragen veröffentlicht: Den Gläubigern der an der Spaltung beteiligten Rechtsträger ist, wenn sie binnen sechs Monaten nach dem Tag, an dem die Eintragung der Spaltung in das Register des Sitzes desjenigen Rechtsträgers, dessen Gläubiger sie sind, als bekannt gemacht gilt, ihren Anspruch nach Grund und Höhe schriftlich anmelden, Sicherheit zu leisten, soweit sie nicht Befriedigung verlangen können. Dieses Recht steht den Gläubigern jedoch nur zu, wenn sie glaubhaft machen, dass durch die Spaltung die Erfüllung ihrer Forderung gefährdet wird. Das Recht, Sicherheitsleistung zu verlangen, steht Gläubigern nicht zu, die im Falle der Insolvenz ein Recht auf vorzugsweise Befriedigung aus einer Deckungsmasse haben, die nach gesetzlicher Vorschrift zu ihrem Schutz errichtet und staatlich überwacht ist."
    },
    {
      "date": "2024-11-22",
      "id": "94331",
      "original_text": "Einreichung neuer Dokumente\nBayern Amtsgericht Kempten (Allgäu) HRB 5058\nZAK Holding GmbH – Kempten (Allgäu)",
      "type": "Einreichung neuer Dokumente",
      "state": "Bayern",
      "amtsgericht": "Amtsgericht Kempten (Allgäu)",
      "registernummer": "HRB 5058",
      "registerart": "HRB",
      "company_name": "ZAK Holding GmbH",
      "company_seat": "Kempten (Allgäu)",
      "details": "22.11.2024 (Bekanntmachungsdatum)\n\nBayern Amtsgericht Kempten (Allgäu) HRB 5058\nEinreichung neuer Dokumente 21.11.2024 (Eintragungsdatum)\n\nZAK Holding GmbH\nGesellschaft mit beschränkter Haftung\nKempten (Allgäu)\n\nDem Amtsgericht Kempten (Allgäu) -Registergericht- ist eine Liste der Mitglieder des Aufsichtsrats eingereicht worden, § 52 Abs. 3 S. 2 GmbHG."
    },
    {
      "date": "2024-11-22",
      "id": "94350",
      "original_text": "Löschungsankündigung\nBerlin Amtsgericht Berlin (Charlottenburg) HRB 228422\ncyan transport GmbH – Berlin",
      "type": "Löschungsankündigung",
      "state": "Berlin",
      "amtsgericht": "Amtsgericht Berlin (Charlottenburg)",
      "registernummer": "HRB 228422",
      "registerart": "HRB",
      "company_name": "cyan transport GmbH",
      "company_seat": "Berlin",
      "details": "22.11.2024 (Bekanntmachungsdatum)\n\nBerlin Amtsgericht Berlin (Charlottenburg) HRB 228422\nLöschungsankündigung\n\ncyan transport GmbH\nGesellschaft mit beschränkter Haftung\nBerlin\n\nBei der nachstehenden Gesellschaft wird das Amtslöschungsverfahren gemäß § 394 FamFG eingeleitet. Widerspruchsfrist 6 Wochen"
    },
    {
      "date": "2024-11-22",
      "id": "94370",
      "original_text": "Registerbekanntmachung nach dem Umwandlungsgesetz\nSchleswig-Holstein Amtsgericht Kiel HRA 541 SE\npely-plastic GmbH & Co. KG – Wahlstedt",
      "type": "Registerbekanntmachung nach dem Umwandlungsgesetz",
      "state": "Schleswig-Holstein",
      "amtsgericht": "Amtsgericht Kiel",
      "registernummer": "HRA 541 SE",
      "registerart": "HRA",
      "company_name": "pely-plastic GmbH & Co. KG",
      "company_seat": "Wahlstedt",
      "details": "22.11.2024 (Bekanntmachungsdatum)\n\nSchleswig-Holstein Amtsgericht Kiel HRA 541 SE\nRegisterbekanntmachung nach dem Umwandlungsgesetz 18.11.2024 (Eintragungsdatum)\n\npely-plastic GmbH & Co. KG\nKommanditgesellschaft\nWahlstedt\n\nZu Eintragungsnummer 13 vom 18.11.2024 wird als nicht eingetragen veröffentlicht:  Als nicht eingetragen wird veröffentlicht: Den Gläubigern der an der Verschmelzung beteiligten Rechtsträger ist, wenn sie binnen sechs Monaten nach dem Tag, an dem die Eintragung der Verschmelzung in das Register des Sitzes desjenigen Rechtsträgers, dessen Gläubiger sie sind, nach § 19 Abs. 3 UmwG bekannt gemacht worden ist, ihren Anspruch nach Grund und Höhe schriftlich anmelden, Sicherheit zu leisten, soweit sie nicht Befriedigung verlangen können. Dieses Recht steht den Gläubigern jedoch nur zu, wenn sie glaubhaft machen, dass durch die Verschmelzung die Erfüllung ihrer Forderung gefährdet wird."
    },
    {
      "date": "2024-11-22",
      "id": "94333",
      "original_text": "Registerbekanntmachung nach dem Umwandlungsgesetz\nBayern Amtsgericht München HRA 96446\npetitini GmbH & Co. KG – München",
      "type": "Registerbekanntmachung nach dem Umwandlungsgesetz",
      "state": "Bayern",
      "amtsgericht": "Amtsgericht München",
      "registernummer": "HRA 96446",
      "registerart": "HRA",
      "company_name": "petitini GmbH & Co. KG",
      "company_seat": "München",
      "details": "22.11.2024 (Bekanntmachungsdatum)\n\nBayern Amtsgericht München HRA 96446\nRegisterbekanntmachung nach dem Umwandlungsgesetz 21.11.2024 (Eintragungsdatum)\n\npetitini GmbH & Co. KG\nKommanditgesellschaft\nMünchen\n\nDen Gläubigern der an der Verschmelzung beteiligten Rechtsträger ist, wenn sie binnen sechs Monaten nach dem Tag, an dem die Eintragung der Verschmelzung in das Register des Sitzes desjenigen Rechtsträgers, dessen Gläubiger sie sind, nach § 19 Abs. 3 UmwG als bekannt gemacht gilt, ihren Anspruch nach Grund und Höhe schriftlich anmelden, Sicherheit zu leisten, soweit sie nicht Befriedigung verlangen können. Dieses Recht steht den Gläubigern jedoch nur zu, wenn sie glaubhaft machen, dass durch die Verschmelzung die Erfüllung ihrer Forderung gefährdet wird."
    },
    {
      "date": "2024-11-22",
      "id": "94395",
      "original_text": "Registerbekanntmachung nach dem Umwandlungsgesetz\nNordrhein-Westfalen Amtsgericht Düsseldorf HRB 94125\nvast limits GmbH – Monheim am Rhein",
      "type": "Registerbekanntmachung nach dem Umwandlungsgesetz",
      "state": "Nordrhein-Westfalen",
      "amtsgericht": "Amtsgericht Düsseldorf",
      "registernummer": "HRB 94125",
      "registerart": "HRB",
      "company_name": "vast limits GmbH",
      "company_seat": "Monheim am Rhein",
      "details": "22.11.2024 (Bekanntmachungsdatum)\n\nNordrhein-Westfalen Amtsgericht Düsseldorf HRB 94125\nRegisterbekanntmachung nach dem Umwandlungsgesetz 22.11.2024 (Eintragungsdatum)\n\nvast limits GmbH\nGesellschaft mit beschränkter Haftung\nMonheim am Rhein\n\nDen Gläubigern der an der Verschmelzung beteiligten Rechtsträger ist, wenn sie binnen sechs Monaten nach dem Tag, an dem die Eintragung der Verschmelzung in das Register des Sitzes desjenigen Rechtsträgers, dessen Gläubiger sie sind, nach § 19 Absatz 3 UmwG als bekanntgemacht gilt, ihren Anspruch nach Grund und Höhe schriftlich anmelden, Sicherheit zu leisten, soweit sie nicht Befriedigung verlangen können. Dieses Recht steht den Gläubigern jedoch nur zu, wenn sie glaubhaft machen, dass durch die Verschmelzung die Erfüllung ihrer Forderung gefährdet wird."
    }
  ]
}