{
  "date": "2024-11-30",
  "date_of_scrape": "2024-12-01T04:06:14.492Z",
  "tool_version": "0.2.0",
  "number_of_announcements": 22,
  "announcements": [
    {
      "date": "2024-11-30",
      "id": "95061",
      "original_text": "Registerbekanntmachung nach dem Umwandlungsgesetz\nBayern Amtsgericht Fürth HRB 15604\nLeonidas XIX Verwaltungs GmbH – Kalchreuth",
      "type": "Registerbekanntmachung nach dem Umwandlungsgesetz",
      "state": "Bayern",
      "amtsgericht": "Amtsgericht Fürth",
      "registernummer": "HRB 15604",
      "registerart": "HRB",
      "company_name": "Leonidas XIX Verwaltungs GmbH",
      "company_seat": "Kalchreuth",
      "details": "30.11.2024 (Bekanntmachungsdatum)\n\nBayern Amtsgericht Fürth HRB 15604\nRegisterbekanntmachung nach dem Umwandlungsgesetz 29.11.2024 (Eintragungsdatum)\n\nLeonidas XIX Verwaltungs GmbH\nGesellschaft mit beschränkter Haftung\nKalchreuth\n\nDen Gläubigern #dv.auswahl(Text=\"Bitte zutreffendes auswählen:\",Eingabe=\n\n\"der an der Verschmelzung beteiligten Rechtsträger ist, wenn sie binnen sechs Monaten nach dem Tag, an dem die Eintragung der Verschmelzung in das Register des Sitzes desjenigen Rechtsträgers, dessen Gläubiger sie sind, nach § 19 Abs. 3 UmwG als bekannt gemacht gilt, ihren Anspruch nach Grund und Höhe schriftlich anmelden, Sicherheit zu leisten, soweit sie nicht Befriedigung verlangen können. Dieses Recht steht den Gläubigern jedoch nur zu, wenn sie glaubhaft machen, dass durch die Verschmelzung die Erfüllung ihrer Forderung gefährdet wird.\"|\"Verschmelzung\",\n\n\"der an der Spaltung beteiligten Rechtsträger ist, wenn sie binnen sechs Monaten nach dem Tag, an dem die Eintragung der Spaltung in das Register des Sitzes desjenigen Rechtsträgers, dessen Gläubiger sie sind, nach §§ 125, 19 Abs. 3 UmwG als bekannt gemacht gilt, ihren Anspruch nach Grund und Höhe schriftlich anmelden, Sicherheit zu leisten, soweit sie nicht Befriedigung verlangen können. Dieses Recht steht den Gläubigern jedoch nur zu, wenn sie glaubhaft machen, dass durch die Spaltung die Erfüllung ihrer Forderung gefährdet wird.\"|\"Spaltung\",\n\n\"des formwechselnden Rechtsträgers ist, wenn sie binnen sechs Monaten nach dem Tag, an dem die Eintragung des Formwechsels nach § 201 UmwG als bekannt gemacht gilt, ihren Anspruch nach Grund und Höhe schriftlich anmelden, Sicherheit zu leisten, soweit sie nicht Befriedigung verlangen können. Dieses Recht steht den Gläubigern jedoch nur zu, wenn sie glaubhaft machen, dass durch den Formwechsel die Erfüllung ihrer Forderung gefährdet wird.\"|\"formwechselnde Umwandlung\",\n\n\"der an der Ausgliederung beteiligten Rechtsträger ist, wenn sie binnen sechs Monaten nach dem Tag, an dem die Eintragung der Ausgliederung in das Register des Sitzes desjenigen Rechtsträgers, dessen Gläubiger sie sind, nach §§ 125, 19 Abs. 3 UmwG als bekannt gemacht gilt, ihren Anspruch nach Grund und Höhe schriftlich anmelden, Sicherheit zu leisten, soweit sie nicht Befriedigung verlangen können. Dieses Recht steht den Gläubigern jedoch nur zu, wenn sie glaubhaft machen, dass durch die Ausgliederung die Erfüllung ihrer Forderung gefährdet wird.\"|\"Ausgliederung\")"
    },
    {
      "date": "2024-11-30",
      "id": "95062",
      "original_text": "Registerbekanntmachung nach dem Umwandlungsgesetz\nBayern Amtsgericht Fürth HRB 21461\ndreZiKüBa GmbH – Roßtal",
      "type": "Registerbekanntmachung nach dem Umwandlungsgesetz",
      "state": "Bayern",
      "amtsgericht": "Amtsgericht Fürth",
      "registernummer": "HRB 21461",
      "registerart": "HRB",
      "company_name": "dreZiKüBa GmbH",
      "company_seat": "Roßtal",
      "details": "30.11.2024 (Bekanntmachungsdatum)\n\nBayern Amtsgericht Fürth HRB 21461\nRegisterbekanntmachung nach dem Umwandlungsgesetz 29.11.2024 (Eintragungsdatum)\n\ndreZiKüBa GmbH\nGesellschaft mit beschränkter Haftung\nRoßtal\n\nDen Gläubigern des formwechselnden Rechtsträgers ist, wenn sie binnen sechs Monaten nach dem Tag, an dem die Eintragung des Formwechsels nach § 201 UmwG als bekannt gemacht gilt, ihren Anspruch nach Grund und Höhe schriftlich anmelden, Sicherheit zu leisten, soweit sie nicht Befriedigung verlangen können. Dieses Recht steht den Gläubigern jedoch nur zu, wenn sie glaubhaft machen, dass durch den Formwechsel die Erfüllung ihrer Forderung gefährdet wird."
    },
    {
      "date": "2024-11-30",
      "id": "95063",
      "original_text": "Registerbekanntmachung nach dem Umwandlungsgesetz\nBayern Amtsgericht Würzburg HRA 6804\nBDSK Handels GmbH & Co. KG – Würzburg",
      "type": "Registerbekanntmachung nach dem Umwandlungsgesetz",
      "state": "Bayern",
      "amtsgericht": "Amtsgericht Würzburg",
      "registernummer": "HRA 6804",
      "registerart": "HRA",
      "company_name": "BDSK Handels GmbH & Co. KG",
      "company_seat": "Würzburg",
      "details": "30.11.2024 (Bekanntmachungsdatum)\n\nBayern Amtsgericht Würzburg HRA 6804\nRegisterbekanntmachung nach dem Umwandlungsgesetz 29.11.2024 (Eintragungsdatum)\n\nBDSK Handels GmbH & Co. KG\nKommanditgesellschaft\nWürzburg\n\nDen Gläubigern der an der Verschmelzung beteiligten Rechtsträger ist, wenn sie binnen sechs Monaten nach dem Tag, an dem die Eintragung der Verschmelzung in das Register des Sitzes desjenigen Rechtsträgers, dessen Gläubiger sie sind, nach § 19 Abs. 3 UmwG als bekannt gemacht gilt, ihren Anspruch nach Grund und Höhe schriftlich anmelden, Sicherheit zu leisten, soweit sie nicht Befriedigung verlangen können. Dieses Recht steht den Gläubigern jedoch nur zu, wenn sie glaubhaft machen, dass durch die Verschmelzung die Erfüllung ihrer Forderung gefährdet wird."
    },
    {
      "date": "2024-11-30",
      "id": "95064",
      "original_text": "Registerbekanntmachung nach dem Umwandlungsgesetz\nBayern Amtsgericht Regensburg HRB 16226\nBachner Holding GmbH – Mainburg",
      "type": "Registerbekanntmachung nach dem Umwandlungsgesetz",
      "state": "Bayern",
      "amtsgericht": "Amtsgericht Regensburg",
      "registernummer": "HRB 16226",
      "registerart": "HRB",
      "company_name": "Bachner Holding GmbH",
      "company_seat": "Mainburg",
      "details": "30.11.2024 (Bekanntmachungsdatum)\n\nBayern Amtsgericht Regensburg HRB 16226\nRegisterbekanntmachung nach dem Umwandlungsgesetz 29.11.2024 (Eintragungsdatum)\n\nBachner Holding GmbH\nGesellschaft mit beschränkter Haftung\nMainburg\n\nDen Gläubigern der an der Verschmelzung beteiligten Rechtsträger ist, wenn sie binnen sechs Monaten nach dem Tag, an dem die Eintragung der Verschmelzung in das Register des Sitzes desjenigen Rechtsträgers, dessen Gläubiger sie sind, nach § 19 Abs. 3 UmwG als bekannt gemacht gilt, ihren Anspruch nach Grund und Höhe schriftlich anmelden, Sicherheit zu leisten, soweit sie nicht Befriedigung verlangen können. Dieses Recht steht den Gläubigern jedoch nur zu, wenn sie glaubhaft machen, dass durch die Verschmelzung die Erfüllung ihrer Forderung gefährdet wird."
    },
    {
      "date": "2024-11-30",
      "id": "95065",
      "original_text": "Registerbekanntmachung nach dem Umwandlungsgesetz\nBayern Amtsgericht Regensburg HRB 15617\nCR Verwaltungs GmbH – Mainburg",
      "type": "Registerbekanntmachung nach dem Umwandlungsgesetz",
      "state": "Bayern",
      "amtsgericht": "Amtsgericht Regensburg",
      "registernummer": "HRB 15617",
      "registerart": "HRB",
      "company_name": "CR Verwaltungs GmbH",
      "company_seat": "Mainburg",
      "details": "30.11.2024 (Bekanntmachungsdatum)\n\nBayern Amtsgericht Regensburg HRB 15617\nRegisterbekanntmachung nach dem Umwandlungsgesetz 29.11.2024 (Eintragungsdatum)\n\nCR Verwaltungs GmbH\nGesellschaft mit beschränkter Haftung\nMainburg\n\nDen Gläubigern der an der Verschmelzung beteiligten Rechtsträger ist, wenn sie binnen sechs Monaten nach dem Tag, an dem die Eintragung der Verschmelzung in das Register des Sitzes desjenigen Rechtsträgers, dessen Gläubiger sie sind, nach § 19 Abs. 3 UmwG als bekannt gemacht gilt, ihren Anspruch nach Grund und Höhe schriftlich anmelden, Sicherheit zu leisten, soweit sie nicht Befriedigung verlangen können. Dieses Recht steht den Gläubigern jedoch nur zu, wenn sie glaubhaft machen, dass durch die Verschmelzung die Erfüllung ihrer Forderung gefährdet wird."
    },
    {
      "date": "2024-11-30",
      "id": "95066",
      "original_text": "Löschungsankündigung\nBayern Amtsgericht München HRB 164213\nProvital GmbH Niederlassung Deutschland – Taufkirchen",
      "type": "Löschungsankündigung",
      "state": "Bayern",
      "amtsgericht": "Amtsgericht München",
      "registernummer": "HRB 164213",
      "registerart": "HRB",
      "company_name": "Provital GmbH Niederlassung Deutschland",
      "company_seat": "Taufkirchen",
      "details": "30.11.2024 (Bekanntmachungsdatum)\n\nBayern Amtsgericht München HRB 164213\nLöschungsankündigung 29.11.2024 (Eintragungsdatum)\n\nProvital GmbH Niederlassung Deutschland\nRechtsform ausländischen Rechts HRB\nTaufkirchen\n\nDas Registergericht beabsichtigt, die im Handelsregister B eingetragene Zweigniederlassung von Amts wegen nach § 395 FamFG zu löschen. Die Frist zur Erhebung eines Widerspruchs ist auf drei Monate festgesetzt."
    },
    {
      "date": "2024-11-30",
      "id": "95067",
      "original_text": "Löschungsankündigung\nBayern Amtsgericht Landshut VR 892\nEishockey Verein Piflas e.V. – Ergolding",
      "type": "Löschungsankündigung",
      "state": "Bayern",
      "amtsgericht": "Amtsgericht Landshut",
      "registernummer": "VR 892",
      "registerart": "VR",
      "company_name": "Eishockey Verein Piflas e.V.",
      "company_seat": "Ergolding",
      "details": "30.11.2024 (Bekanntmachungsdatum)\n\nBayern Amtsgericht Landshut VR 892\nLöschungsankündigung\n\nEishockey Verein Piflas e.V.\neingetragener Verein\nErgolding\n\nDas Registergericht beabsichtigt, den im Vereinsregister eingetragenen Verein von Amts wegen nach § 395 wegen Mitgliederlosigkeit zu löschen. Die Frist zur Erhebung eines Widerspruchs ist auf einen Monat festgesetzt."
    },
    {
      "date": "2024-11-30",
      "id": "95068",
      "original_text": "Registerbekanntmachung nach dem Umwandlungsgesetz\nBayern Amtsgericht Augsburg HRA 21722\nWeichenberger Schreinerwerkstätte GmbH & Co. KG – Dasing",
      "type": "Registerbekanntmachung nach dem Umwandlungsgesetz",
      "state": "Bayern",
      "amtsgericht": "Amtsgericht Augsburg",
      "registernummer": "HRA 21722",
      "registerart": "HRA",
      "company_name": "Weichenberger Schreinerwerkstätte GmbH & Co. KG",
      "company_seat": "Dasing",
      "details": "30.11.2024 (Bekanntmachungsdatum)\n\nBayern Amtsgericht Augsburg HRA 21722\nRegisterbekanntmachung nach dem Umwandlungsgesetz 29.11.2024 (Eintragungsdatum)\n\nWeichenberger Schreinerwerkstätte GmbH & Co. KG\nKommanditgesellschaft\nDasing\n\nDen Gläubigern der an der Ausgliederung beteiligten Rechtsträger ist, wenn sie binnen sechs Monaten nach dem Tag, an dem die Eintragung der Ausgliederung in das Register des Sitzes desjenigen Rechtsträgers, dessen Gläubiger sie sind, nach §§ 125, 19 Abs. 3 UmwG als bekannt gemacht gilt, ihren Anspruch nach Grund und Höhe schriftlich anmelden, Sicherheit zu leisten, soweit sie nicht Befriedigung verlangen können. Dieses Recht steht den Gläubigern jedoch nur zu, wenn sie glaubhaft machen, dass durch die Ausgliederung die Erfüllung ihrer Forderung gefährdet wird."
    },
    {
      "date": "2024-11-30",
      "id": "95069",
      "original_text": "Registerbekanntmachung nach dem Umwandlungsgesetz\nBayern Amtsgericht Fürth HRA 7064\nStürmer GmbH & Co. KG – Roßtal",
      "type": "Registerbekanntmachung nach dem Umwandlungsgesetz",
      "state": "Bayern",
      "amtsgericht": "Amtsgericht Fürth",
      "registernummer": "HRA 7064",
      "registerart": "HRA",
      "company_name": "Stürmer GmbH & Co. KG",
      "company_seat": "Roßtal",
      "details": "30.11.2024 (Bekanntmachungsdatum)\n\nBayern Amtsgericht Fürth HRA 7064\nRegisterbekanntmachung nach dem Umwandlungsgesetz 29.11.2024 (Eintragungsdatum)\n\nStürmer GmbH & Co. KG\nKommanditgesellschaft\nRoßtal\n\nDen Gläubigern des formwechselnden Rechtsträgers ist, wenn sie binnen sechs Monaten nach dem Tag, an dem die Eintragung des Formwechsels nach § 201 UmwG als bekannt gemacht gilt, ihren Anspruch nach Grund und Höhe schriftlich anmelden, Sicherheit zu leisten, soweit sie nicht Befriedigung verlangen können. Dieses Recht steht den Gläubigern jedoch nur zu, wenn sie glaubhaft machen, dass durch den Formwechsel die Erfüllung ihrer Forderung gefährdet wird."
    },
    {
      "date": "2024-11-30",
      "id": "95070",
      "original_text": "Sonstige Registerbekanntmachung\nBayern Amtsgericht München HRB 245441\nTKN Telekabel - Nord GmbH – Unterföhring",
      "type": "Sonstige Registerbekanntmachung",
      "state": "Bayern",
      "amtsgericht": "Amtsgericht München",
      "registernummer": "HRB 245441",
      "registerart": "HRB",
      "company_name": "TKN Telekabel - Nord GmbH",
      "company_seat": "Unterföhring",
      "details": "30.11.2024 (Bekanntmachungsdatum)\n\nBayern Amtsgericht München HRB 245441\nSonstige Registerbekanntmachung 29.11.2024 (Eintragungsdatum)\n\nTKN Telekabel - Nord GmbH\nGesellschaft mit beschränkter Haftung\nUnterföhring\n\nDen Gläubigern der Gesellschaft, deren Forderungen begründet worden sind, bevor die Eintragung der Beendigung des Gewinnabführungsvertrages in das Handelsregister nach § 10 des Handelsgesetzbuches als bekanntgemacht gilt, hat der andere Vertragsteil Sicherheit zu leisten, wenn sie sich binnen sechs Monaten nach der Bekanntmachung der Eintragung zu diesem Zweck bei ihm melden."
    },
    {
      "date": "2024-11-30",
      "id": "95071",
      "original_text": "Registerbekanntmachung nach dem Umwandlungsgesetz\nBayern Amtsgericht München HRB 127485\nRelax Media Aktiengesellschaft – München",
      "type": "Registerbekanntmachung nach dem Umwandlungsgesetz",
      "state": "Bayern",
      "amtsgericht": "Amtsgericht München",
      "registernummer": "HRB 127485",
      "registerart": "HRB",
      "company_name": "Relax Media Aktiengesellschaft",
      "company_seat": "München",
      "details": "30.11.2024 (Bekanntmachungsdatum)\n\nBayern Amtsgericht München HRB 127485\nRegisterbekanntmachung nach dem Umwandlungsgesetz 29.11.2024 (Eintragungsdatum)\n\nRelax Media Aktiengesellschaft\nAktiengesellschaft\nMünchen\n\nDen Gläubigern des formwechselnden Rechtsträgers ist, wenn sie binnen sechs Monaten nach dem Tag, an dem die Eintragung des Formwechsels nach § 201 UmwG als bekannt gemacht gilt, ihren Anspruch nach Grund und Höhe schriftlich anmelden, Sicherheit zu leisten, soweit sie nicht Befriedigung verlangen können. Dieses Recht steht den Gläubigern jedoch nur zu, wenn sie glaubhaft machen, dass durch den Formwechsel die Erfüllung ihrer Forderung gefährdet wird."
    },
    {
      "date": "2024-11-30",
      "id": "95072",
      "original_text": "Registerbekanntmachung nach dem Umwandlungsgesetz\nBayern Amtsgericht Fürth HRB 12868\naConTech GmbH – Fürth",
      "type": "Registerbekanntmachung nach dem Umwandlungsgesetz",
      "state": "Bayern",
      "amtsgericht": "Amtsgericht Fürth",
      "registernummer": "HRB 12868",
      "registerart": "HRB",
      "company_name": "aConTech GmbH",
      "company_seat": "Fürth",
      "details": "30.11.2024 (Bekanntmachungsdatum)\n\nBayern Amtsgericht Fürth HRB 12868\nRegisterbekanntmachung nach dem Umwandlungsgesetz 29.11.2024 (Eintragungsdatum)\n\naConTech GmbH\nGesellschaft mit beschränkter Haftung\nFürth\n\nDen Gläubigern der an der Verschmelzung beteiligten Rechtsträger ist, wenn sie binnen sechs Monaten nach dem Tag, an dem die Eintragung der Verschmelzung in das Register des Sitzes desjenigen Rechtsträgers, dessen Gläubiger sie sind, nach § 19 Abs. 3 UmwG als bekannt gemacht gilt, ihren Anspruch nach Grund und Höhe schriftlich anmelden, Sicherheit zu leisten, soweit sie nicht Befriedigung verlangen können. Dieses Recht steht den Gläubigern jedoch nur zu, wenn sie glaubhaft machen, dass durch die Verschmelzung die Erfüllung ihrer Forderung gefährdet wird."
    },
    {
      "date": "2024-11-30",
      "id": "95073",
      "original_text": "Registerbekanntmachung nach dem Umwandlungsgesetz\nBayern Amtsgericht Augsburg HRA 19330\nSchreinereiwerkstätte Weichenberger e.K. – Dasing",
      "type": "Registerbekanntmachung nach dem Umwandlungsgesetz",
      "state": "Bayern",
      "amtsgericht": "Amtsgericht Augsburg",
      "registernummer": "HRA 19330",
      "registerart": "HRA",
      "company_name": "Schreinereiwerkstätte Weichenberger e.K.",
      "company_seat": "Dasing",
      "details": "30.11.2024 (Bekanntmachungsdatum)\n\nBayern Amtsgericht Augsburg HRA 19330\nRegisterbekanntmachung nach dem Umwandlungsgesetz 29.11.2024 (Eintragungsdatum)\n\nSchreinereiwerkstätte Weichenberger e.K.\nEinzelkaufmann / Einzelkauffrau\nDasing\n\nDen Gläubigern der an der Ausgliederung beteiligten Rechtsträger ist, wenn sie binnen sechs Monaten nach dem Tag, an dem die Eintragung der Ausgliederung in das Register des Sitzes desjenigen Rechtsträgers, dessen Gläubiger sie sind, nach §§ 125, 19 Abs. 3 UmwG als bekannt gemacht gilt, ihren Anspruch nach Grund und Höhe schriftlich anmelden, Sicherheit zu leisten, soweit sie nicht Befriedigung verlangen können. Dieses Recht steht den Gläubigern jedoch nur zu, wenn sie glaubhaft machen, dass durch die Ausgliederung die Erfüllung ihrer Forderung gefährdet wird."
    },
    {
      "date": "2024-11-30",
      "id": "95074",
      "original_text": "Registerbekanntmachung nach dem Umwandlungsgesetz\nBayern Amtsgericht München HRB 170404\nVodafone Customer Care GmbH – Unterföhring",
      "type": "Registerbekanntmachung nach dem Umwandlungsgesetz",
      "state": "Bayern",
      "amtsgericht": "Amtsgericht München",
      "registernummer": "HRB 170404",
      "registerart": "HRB",
      "company_name": "Vodafone Customer Care GmbH",
      "company_seat": "Unterföhring",
      "details": "30.11.2024 (Bekanntmachungsdatum)\n\nBayern Amtsgericht München HRB 170404\nRegisterbekanntmachung nach dem Umwandlungsgesetz 29.11.2024 (Eintragungsdatum)\n\nVodafone Customer Care GmbH\nGesellschaft mit beschränkter Haftung\nUnterföhring\n\nDen Gläubigern der an der Verschmelzung beteiligten Rechtsträger ist, wenn sie binnen sechs Monaten nach dem Tag, an dem die Eintragung der Verschmelzung in das Register des Sitzes desjenigen Rechtsträgers, dessen Gläubiger sie sind, nach § 19 Abs. 3 UmwG als bekannt gemacht gilt, ihren Anspruch nach Grund und Höhe schriftlich anmelden, Sicherheit zu leisten, soweit sie nicht Befriedigung verlangen können. Dieses Recht steht den Gläubigern jedoch nur zu, wenn sie glaubhaft machen, dass durch die Verschmelzung die Erfüllung ihrer Forderung gefährdet wird."
    },
    {
      "date": "2024-11-30",
      "id": "95075",
      "original_text": "Registerbekanntmachung nach dem Umwandlungsgesetz\nBayern Amtsgericht München HRB 455\nAstellas Deutschland GmbH – München",
      "type": "Registerbekanntmachung nach dem Umwandlungsgesetz",
      "state": "Bayern",
      "amtsgericht": "Amtsgericht München",
      "registernummer": "HRB 455",
      "registerart": "HRB",
      "company_name": "Astellas Deutschland GmbH",
      "company_seat": "München",
      "details": "30.11.2024 (Bekanntmachungsdatum)\n\nBayern Amtsgericht München HRB 455\nRegisterbekanntmachung nach dem Umwandlungsgesetz 29.11.2024 (Eintragungsdatum)\n\nAstellas Deutschland GmbH\nGesellschaft mit beschränkter Haftung\nMünchen\n\nDen Gläubigern der an der Verschmelzung beteiligten Rechtsträger ist, wenn sie binnen sechs Monaten nach dem Tag, an dem die Eintragung der Verschmelzung in das Register des Sitzes desjenigen Rechtsträgers, dessen Gläubiger sie sind, nach § 19 Abs. 3 UmwG als bekannt gemacht gilt, ihren Anspruch nach Grund und Höhe schriftlich anmelden, Sicherheit zu leisten, soweit sie nicht Befriedigung verlangen können. Dieses Recht steht den Gläubigern jedoch nur zu, wenn sie glaubhaft machen, dass durch die Verschmelzung die Erfüllung ihrer Forderung gefährdet wird."
    },
    {
      "date": "2024-11-30",
      "id": "95076",
      "original_text": "Registerbekanntmachung nach dem Umwandlungsgesetz\nBayern Amtsgericht Nürnberg HRB 25861\nDFP Deutsche Finanz Portfolioverwaltung GmbH – Nürnberg",
      "type": "Registerbekanntmachung nach dem Umwandlungsgesetz",
      "state": "Bayern",
      "amtsgericht": "Amtsgericht Nürnberg",
      "registernummer": "HRB 25861",
      "registerart": "HRB",
      "company_name": "DFP Deutsche Finanz Portfolioverwaltung GmbH",
      "company_seat": "Nürnberg",
      "details": "30.11.2024 (Bekanntmachungsdatum)\n\nBayern Amtsgericht Nürnberg HRB 25861\nRegisterbekanntmachung nach dem Umwandlungsgesetz 29.11.2024 (Eintragungsdatum)\n\nDFP Deutsche Finanz Portfolioverwaltung GmbH\nGesellschaft mit beschränkter Haftung\nNürnberg\n\nDen Gläubigern der an der Verschmelzung beteiligten Rechtsträger ist, wenn sie binnen sechs Monaten nach dem Tag, an dem die Eintragung der Verschmelzung in das Register des Sitzes desjenigen Rechtsträgers, dessen Gläubiger sie sind, nach § 19 Abs. 3 UmwG als bekannt gemacht gilt, ihren Anspruch nach Grund und Höhe schriftlich anmelden, Sicherheit zu leisten, soweit sie nicht Befriedigung verlangen können. Dieses Recht steht den Gläubigern jedoch nur zu, wenn sie glaubhaft machen, dass durch die Verschmelzung die Erfüllung ihrer Forderung gefährdet wird."
    },
    {
      "date": "2024-11-30",
      "id": "95077",
      "original_text": "Löschungsankündigung\nBayern Amtsgericht München HRB 272119\nMondial Marketing UG (haftungsbeschränkt) – München",
      "type": "Löschungsankündigung",
      "state": "Bayern",
      "amtsgericht": "Amtsgericht München",
      "registernummer": "HRB 272119",
      "registerart": "HRB",
      "company_name": "Mondial Marketing UG (haftungsbeschränkt)",
      "company_seat": "München",
      "details": "30.11.2024 (Bekanntmachungsdatum)\n\nBayern Amtsgericht München HRB 272119\nLöschungsankündigung 29.11.2024 (Eintragungsdatum)\n\nMondial Marketing UG (haftungsbeschränkt)\nGesellschaft mit beschränkter Haftung\nMünchen\n\nDas Registergericht beabsichtigt, die im Handelsregister eingetragene Gesellschaft wegen Vermögenslosigkeit von Amts wegen nach § 394 FamFG zu löschen. Die Frist zur Erhebung eines Widerspruchs ist auf drei Monate festgesetzt."
    },
    {
      "date": "2024-11-30",
      "id": "95078",
      "original_text": "Einreichung neuer Dokumente\nBayern Amtsgericht München HRB 4921\nBayWa Aktiengesellschaft – München",
      "type": "Einreichung neuer Dokumente",
      "state": "Bayern",
      "amtsgericht": "Amtsgericht München",
      "registernummer": "HRB 4921",
      "registerart": "HRB",
      "company_name": "BayWa Aktiengesellschaft",
      "company_seat": "München",
      "details": "30.11.2024 (Bekanntmachungsdatum)\n\nBayern Amtsgericht München HRB 4921\nEinreichung neuer Dokumente 29.11.2024 (Eintragungsdatum)\n\nBayWa Aktiengesellschaft\nAktiengesellschaft\nMünchen\n\nDem Amtsgericht München -Registergericht- ist eine Liste der Mitglieder des Aufsichtsrats eingereicht worden, § 106 AktG."
    },
    {
      "date": "2024-11-30",
      "id": "95079",
      "original_text": "Registerbekanntmachung nach dem Umwandlungsgesetz\nBayern Amtsgericht Würzburg HRB 11744\nXXXL Marketing GmbH – Würzburg",
      "type": "Registerbekanntmachung nach dem Umwandlungsgesetz",
      "state": "Bayern",
      "amtsgericht": "Amtsgericht Würzburg",
      "registernummer": "HRB 11744",
      "registerart": "HRB",
      "company_name": "XXXL Marketing GmbH",
      "company_seat": "Würzburg",
      "details": "30.11.2024 (Bekanntmachungsdatum)\n\nBayern Amtsgericht Würzburg HRB 11744\nRegisterbekanntmachung nach dem Umwandlungsgesetz 29.11.2024 (Eintragungsdatum)\n\nXXXL Marketing GmbH\nGesellschaft mit beschränkter Haftung\nWürzburg\n\nDen Gläubigern der an der Verschmelzung beteiligten Rechtsträger ist, wenn sie binnen sechs Monaten nach dem Tag, an dem die Eintragung der Verschmelzung in das Register des Sitzes desjenigen Rechtsträgers, dessen Gläubiger sie sind, nach § 19 Abs. 3 UmwG als bekannt gemacht gilt, ihren Anspruch nach Grund und Höhe schriftlich anmelden, Sicherheit zu leisten, soweit sie nicht Befriedigung verlangen können. Dieses Recht steht den Gläubigern jedoch nur zu, wenn sie glaubhaft machen, dass durch die Verschmelzung die Erfüllung ihrer Forderung gefährdet wird."
    },
    {
      "date": "2024-11-30",
      "id": "95080",
      "original_text": "Registerbekanntmachung nach dem Umwandlungsgesetz\nNiedersachsen Amtsgericht Hildesheim HRB 209724\nAmbergau Projekt GmbH – Bockenem OT Schlewecke",
      "type": "Registerbekanntmachung nach dem Umwandlungsgesetz",
      "state": "Niedersachsen",
      "amtsgericht": "Amtsgericht Hildesheim",
      "registernummer": "HRB 209724",
      "registerart": "HRB",
      "company_name": "Ambergau Projekt GmbH",
      "company_seat": "Bockenem OT Schlewecke",
      "details": "30.11.2024 (Bekanntmachungsdatum)\n\nNiedersachsen Amtsgericht Hildesheim HRB 209724\nRegisterbekanntmachung nach dem Umwandlungsgesetz 30.11.2024 (Eintragungsdatum)\n\nAmbergau Projekt GmbH\nGesellschaft mit beschränkter Haftung\nBockenem OT Schlewecke\n\nDen Gläubigern der an der formwechselnden Umwandlung beteiligten Rechtsträger ist, wenn sie binnen sechs Monaten nach dem Tag, an dem die Eintragung der Umwandlung in das Register des Sitzes desjenigen Rechtsträgers, dessen Gläubiger sie sind, nach § 19 Abs. 3 UmwG als bekannt gemacht gilt, ihren Anspruch nach Grund und Höhe schriftlich anmelden, Sicherheit zu leisten, soweit sie nicht Befriedigung verlangen können. Dieses Recht steht den Gläubigern jedoch nur zu, wenn sie glaubhaft machen, dass durch die formwechselnde Umwandlung die Erfüllung der Forderung gefährdet wird."
    },
    {
      "date": "2024-11-30",
      "id": "95081",
      "original_text": "Registerbekanntmachung nach dem Umwandlungsgesetz\nNiedersachsen Amtsgericht Hildesheim GsR 158\nAmbergau Solar eGbR – Bockenem",
      "type": "Registerbekanntmachung nach dem Umwandlungsgesetz",
      "state": "Niedersachsen",
      "amtsgericht": "Amtsgericht Hildesheim",
      "registernummer": "GsR 158",
      "registerart": "GsR",
      "company_name": "Ambergau Solar eGbR",
      "company_seat": "Bockenem",
      "details": "30.11.2024 (Bekanntmachungsdatum)\n\nNiedersachsen Amtsgericht Hildesheim GsR 158\nRegisterbekanntmachung nach dem Umwandlungsgesetz 30.11.2024 (Eintragungsdatum)\n\nAmbergau Solar eGbR\nGesellschaft bürgerlichen Rechts\nBockenem\n\nDen Gläubigern der an der formwechselnden Umwandlung beteiligten Rechtsträger ist, wenn sie binnen sechs Monaten nach dem Tag, an dem die Eintragung der Umwandlung in das Register des Sitzes desjenigen Rechtsträgers, dessen Gläubiger sie sind, nach § 19 Abs. 3 UmwG als bekannt gemacht gilt, ihren Anspruch nach Grund und Höhe schriftlich anmelden, Sicherheit zu leisten, soweit sie nicht Befriedigung verlangen können. Dieses Recht steht den Gläubigern jedoch nur zu, wenn sie glaubhaft machen, dass durch die formwechselnde Umwandlung die Erfüllung der Forderung gefährdet wird."
    },
    {
      "date": "2024-11-30",
      "id": "95082",
      "original_text": "Löschungsankündigung\nNordrhein-Westfalen Amtsgericht Köln HRB 99499\nDachwerk Wegener GmbH – Köln",
      "type": "Löschungsankündigung",
      "state": "Nordrhein-Westfalen",
      "amtsgericht": "Amtsgericht Köln",
      "registernummer": "HRB 99499",
      "registerart": "HRB",
      "company_name": "Dachwerk Wegener GmbH",
      "company_seat": "Köln",
      "details": "30.11.2024 (Bekanntmachungsdatum)\n\nNordrhein-Westfalen Amtsgericht Köln HRB 99499\nLöschungsankündigung\n\nDachwerk Wegener GmbH\nGesellschaft mit beschränkter Haftung\nKöln\n\nDas Registergericht beabsichtigt die Gesellschaft von Amts wegen nach § 394 FamFG zu löschen. Die Frist zur Erhebung eines Widerspruchs ist auf einen Monat festgesetzt."
    }
  ]
}