{
  "date": "2024-11-13",
  "date_of_scrape": "2024-11-30T13:12:17.518Z",
  "tool_version": "0.2.0",
  "number_of_announcements": 122,
  "announcements": [
    {
      "date": "2024-11-13",
      "id": "93320",
      "original_text": "Registerbekanntmachung nach dem Umwandlungsgesetz\nBayern Amtsgericht München HRB 291810\nAIG Diana II GmbH – Grünwald",
      "type": "Registerbekanntmachung nach dem Umwandlungsgesetz",
      "state": "Bayern",
      "amtsgericht": "Amtsgericht München",
      "registernummer": "HRB 291810",
      "registerart": "HRB",
      "company_name": "AIG Diana II GmbH",
      "company_seat": "Grünwald",
      "details": "13.11.2024 (Bekanntmachungsdatum)\n\nBayern Amtsgericht München HRB 291810\nRegisterbekanntmachung nach dem Umwandlungsgesetz 12.11.2024 (Eintragungsdatum)\n\nAIG Diana II GmbH\nGesellschaft mit beschränkter Haftung\nGrünwald\n\nDen Gläubigern des formwechselnden Rechtsträgers ist, wenn sie binnen sechs Monaten nach dem Tag, an dem die Eintragung des Formwechsels nach § 201 UmwG als bekannt gemacht gilt, ihren Anspruch nach Grund und Höhe schriftlich anmelden, Sicherheit zu leisten, soweit sie nicht Befriedigung verlangen können. Dieses Recht steht den Gläubigern jedoch nur zu, wenn sie glaubhaft machen, dass durch den Formwechsel die Erfüllung ihrer Forderung gefährdet wird."
    },
    {
      "date": "2024-11-13",
      "id": "93409",
      "original_text": "Einreichung neuer Dokumente\nHessen Amtsgericht Darmstadt HRB 100330\nALDI Mörfelden Verwaltungs-SE – Mörfelden",
      "type": "Einreichung neuer Dokumente",
      "state": "Hessen",
      "amtsgericht": "Amtsgericht Darmstadt",
      "registernummer": "HRB 100330",
      "registerart": "HRB",
      "company_name": "ALDI Mörfelden Verwaltungs-SE",
      "company_seat": "Mörfelden",
      "details": "13.11.2024 (Bekanntmachungsdatum)\n\nHessen Amtsgericht Darmstadt HRB 100330\nEinreichung neuer Dokumente\n\nALDI Mörfelden Verwaltungs-SE\nEuropäische Aktiengesellschaft (SE)\nMörfelden\n\nDurch eine Änderung in den Personen der Aufsichtsratsmitglieder ist eine Liste der Mitglieder des Aufsichtsrates zum Handelsregister eingereicht worden."
    },
    {
      "date": "2024-11-13",
      "id": "93343",
      "original_text": "Registerbekanntmachung nach dem Umwandlungsgesetz\nBerlin Amtsgericht Berlin (Charlottenburg) HRB 209607\nAMBOSS GmbH – Berlin",
      "type": "Registerbekanntmachung nach dem Umwandlungsgesetz",
      "state": "Berlin",
      "amtsgericht": "Amtsgericht Berlin (Charlottenburg)",
      "registernummer": "HRB 209607",
      "registerart": "HRB",
      "company_name": "AMBOSS GmbH",
      "company_seat": "Berlin",
      "details": "13.11.2024 (Bekanntmachungsdatum)\n\nBerlin Amtsgericht Berlin (Charlottenburg) HRB 209607\nRegisterbekanntmachung nach dem Umwandlungsgesetz\n\nAMBOSS GmbH\nGesellschaft mit beschränkter Haftung\nBerlin\n\nZu Eintragungsnummer  vom  wird als nicht eingetragen veröffentlicht: Die Gesellschaft soll im Wege des Kettenformwechsels in eine Aktiengesellschaft nach deutschem Recht und im unmittelbaren Anschluss hieran in eine Europäische Gesellschaft (SE) umgewandelt werden. Hierzu hat die Gesellschaft gemäß Art. 37 Abs. 5 SE-VO den Entwurf eines Umwandlungsplans zum Handelsregister des Amtsgerichts Charlottenburg, HRB 209607 B, eingereicht."
    },
    {
      "date": "2024-11-13",
      "id": "93418",
      "original_text": "Löschungsankündigung\nHessen Amtsgericht Frankfurt am Main HRB 91312\nARIVAX GmbH – Frankfurt am Main",
      "type": "Löschungsankündigung",
      "state": "Hessen",
      "amtsgericht": "Amtsgericht Frankfurt am Main",
      "registernummer": "HRB 91312",
      "registerart": "HRB",
      "company_name": "ARIVAX GmbH",
      "company_seat": "Frankfurt am Main",
      "details": "13.11.2024 (Bekanntmachungsdatum)\n\nHessen Amtsgericht Frankfurt am Main HRB 91312\nLöschungsankündigung\n\nARIVAX GmbH\nGesellschaft mit beschränkter Haftung\nFrankfurt am Main\n\nDas Registergericht beabsichtigt die im Handelsregister eingetragene Gesellschaft von Amts wegen nach § 394 FamFG zu löschen. Die Frist zur Erhebung eines Widerspruchs gegen die beabsichtigte Löschung wird auf 1 Monat festgesetzt."
    },
    {
      "date": "2024-11-13",
      "id": "93316",
      "original_text": "Registerbekanntmachung nach dem Umwandlungsgesetz\nBayern Amtsgericht München HRB 237644\nASMPT EU Holding GmbH – München",
      "type": "Registerbekanntmachung nach dem Umwandlungsgesetz",
      "state": "Bayern",
      "amtsgericht": "Amtsgericht München",
      "registernummer": "HRB 237644",
      "registerart": "HRB",
      "company_name": "ASMPT EU Holding GmbH",
      "company_seat": "München",
      "details": "13.11.2024 (Bekanntmachungsdatum)\n\nBayern Amtsgericht München HRB 237644\nRegisterbekanntmachung nach dem Umwandlungsgesetz 12.11.2024 (Eintragungsdatum)\n\nASMPT EU Holding GmbH\nGesellschaft mit beschränkter Haftung\nMünchen\n\nDen Gläubigern des formwechselnden Rechtsträgers ist, wenn sie binnen sechs Monaten nach dem Tag, an dem die Eintragung des Formwechsels nach § 201 UmwG als bekannt gemacht gilt, ihren Anspruch nach Grund und Höhe schriftlich anmelden, Sicherheit zu leisten, soweit sie nicht Befriedigung verlangen können. Dieses Recht steht den Gläubigern jedoch nur zu, wenn sie glaubhaft machen, dass durch den Formwechsel die Erfüllung ihrer Forderung gefährdet wird."
    },
    {
      "date": "2024-11-13",
      "id": "93397",
      "original_text": "Löschungsankündigung\nNordrhein-Westfalen Amtsgericht Köln HRB 59548\nAndromeda Vertriebs GmbH – Köln",
      "type": "Löschungsankündigung",
      "state": "Nordrhein-Westfalen",
      "amtsgericht": "Amtsgericht Köln",
      "registernummer": "HRB 59548",
      "registerart": "HRB",
      "company_name": "Andromeda Vertriebs GmbH",
      "company_seat": "Köln",
      "details": "13.11.2024 (Bekanntmachungsdatum)\n\nNordrhein-Westfalen Amtsgericht Köln HRB 59548\nLöschungsankündigung\n\nAndromeda Vertriebs GmbH\nGesellschaft mit beschränkter Haftung\nKöln\n\nDas Registergericht beabsichtigt die Gesellschaft von Amts wegen nach § 394 FamFG zu löschen. Die Frist zur Erhebung eines Widerspruchs ist auf einen Monat festgesetzt."
    },
    {
      "date": "2024-11-13",
      "id": "93407",
      "original_text": "Registerbekanntmachung nach dem Umwandlungsgesetz\nThüringen Amtsgericht Jena HRB 504786\nArbeitsbühnen LINDIG GmbH – Krauthausen",
      "type": "Registerbekanntmachung nach dem Umwandlungsgesetz",
      "state": "Thüringen",
      "amtsgericht": "Amtsgericht Jena",
      "registernummer": "HRB 504786",
      "registerart": "HRB",
      "company_name": "Arbeitsbühnen LINDIG GmbH",
      "company_seat": "Krauthausen",
      "details": "13.11.2024 (Bekanntmachungsdatum)\n\nThüringen Amtsgericht Jena HRB 504786\nRegisterbekanntmachung nach dem Umwandlungsgesetz 13.11.2024 (Eintragungsdatum)\n\nArbeitsbühnen LINDIG GmbH\nGesellschaft mit beschränkter Haftung\nKrauthausen\n\nNicht eingetragen: Den Gläubigern der an der Verschmelzung beteiligten Rechtsträger, ist wenn sie binnen sechs Monaten nach dem Tag, an dem die Eintragung der Verschmelzung in das Register des Sitzes desjenigen Rechtsträgers, dessen Gläubiger sie sind,  nach § 19 Abs. 3 UmwG als bekanntgemacht gilt, ihren Anspruch nach Grund und Höhe schriftlich anmelden, Sicherheit zu leisten, soweit sie nicht Befriedigung verlangen können. Dieses Recht steht ihnen jedoch nur zu, wenn sie glaubhaft machen, daß durch die Verschmelzung die Erfüllung ihrer Forderung gefährdet wird."
    },
    {
      "date": "2024-11-13",
      "id": "93405",
      "original_text": "Sonstige Registerbekanntmachung\nThüringen Amtsgericht Jena HRB 200372\nAutohaus JENTRA GmbH – Neuengönna",
      "type": "Sonstige Registerbekanntmachung",
      "state": "Thüringen",
      "amtsgericht": "Amtsgericht Jena",
      "registernummer": "HRB 200372",
      "registerart": "HRB",
      "company_name": "Autohaus JENTRA GmbH",
      "company_seat": "Neuengönna",
      "details": "13.11.2024 (Bekanntmachungsdatum)\n\nThüringen Amtsgericht Jena HRB 200372\nSonstige Registerbekanntmachung 13.11.2024 (Eintragungsdatum)\n\nAutohaus JENTRA GmbH\nGesellschaft mit beschränkter Haftung\nNeuengönna\n\nNicht eingetragen: Den Gläubigern der Gesellschaft ist, wenn sie binnen sechs Monaten nach dieser Bekanntmachung ihren Anspruch nach Grund und Höhe schriftlich anmelden, Sicherheit zu leisten, soweit sie nicht Befriedigung verlangen können. Dieses Recht steht ihnen jedoch nicht zu, wenn sie im Falle des Insolvenzverfahrens ein Recht auf vorzugsweise Befriedigung aus einer Deckungsmasse haben, die nach gesetzlicher Vorschrift zu ihrem Schutz errichtet und staatlich überwacht ist."
    },
    {
      "date": "2024-11-13",
      "id": "93402",
      "original_text": "Löschungsankündigung\nNordrhein-Westfalen Amtsgericht Kleve HRB 12881\nB.v.B. GmbH – Kleve",
      "type": "Löschungsankündigung",
      "state": "Nordrhein-Westfalen",
      "amtsgericht": "Amtsgericht Kleve",
      "registernummer": "HRB 12881",
      "registerart": "HRB",
      "company_name": "B.v.B. GmbH",
      "company_seat": "Kleve",
      "details": "13.11.2024 (Bekanntmachungsdatum)\n\nNordrhein-Westfalen Amtsgericht Kleve HRB 12881\nLöschungsankündigung\n\nB.v.B. GmbH\nGesellschaft mit beschränkter Haftung\nKleve\n\nDas Registergericht beabsichtigt die Gesellschaft von Amts wegen nach § 394 FamFG zu löschen. Die Frist zur Erhebung eines Widerspruchs ist auf einen Monat festgesetzt."
    },
    {
      "date": "2024-11-13",
      "id": "93305",
      "original_text": "Einreichung neuer Dokumente\nBayern Amtsgericht München HRB 42243\nBayerische Motoren Werke Aktiengesellschaft – München",
      "type": "Einreichung neuer Dokumente",
      "state": "Bayern",
      "amtsgericht": "Amtsgericht München",
      "registernummer": "HRB 42243",
      "registerart": "HRB",
      "company_name": "Bayerische Motoren Werke Aktiengesellschaft",
      "company_seat": "München",
      "details": "13.11.2024 (Bekanntmachungsdatum)\n\nBayern Amtsgericht München HRB 42243\nEinreichung neuer Dokumente\n\nBayerische Motoren Werke Aktiengesellschaft\nAktiengesellschaft\nMünchen\n\nDem Amtsgericht München -Registergericht- ist eine Liste der Mitglieder des Aufsichtsrats eingereicht worden, § 106 AktG."
    },
    {
      "date": "2024-11-13",
      "id": "93342",
      "original_text": "Registerbekanntmachung nach dem Umwandlungsgesetz\nBerlin Amtsgericht Berlin (Charlottenburg) HRB 249439\nBellevue Holding GmbH – Berlin",
      "type": "Registerbekanntmachung nach dem Umwandlungsgesetz",
      "state": "Berlin",
      "amtsgericht": "Amtsgericht Berlin (Charlottenburg)",
      "registernummer": "HRB 249439",
      "registerart": "HRB",
      "company_name": "Bellevue Holding GmbH",
      "company_seat": "Berlin",
      "details": "13.11.2024 (Bekanntmachungsdatum)\n\nBerlin Amtsgericht Berlin (Charlottenburg) HRB 249439\nRegisterbekanntmachung nach dem Umwandlungsgesetz 13.11.2024 (Eintragungsdatum)\n\nBellevue Holding GmbH\nGesellschaft mit beschränkter Haftung\nBerlin\n\nZu Eintragungsnummer 3 vom 13.11.2024 wird als nicht eingetragen veröffentlicht: Den Gläubigern der an der Verschmelzung beteiligten Rechtsträger ist, wenn sie binnen sechs Monaten nach dem Tag, an dem die Eintragung der Verschmelzung in das Register des Sitzes desjenigen Rechtsträgers, dessen Gläubiger sie sind, als bekannt gemacht gilt, ihren Anspruch nach Grund und Höhe schriftlich anmelden, Sicherheit zu leisten, soweit sie nicht Befriedigung verlangen können. Dieses Recht steht den Gläubigern jedoch nur zu, wenn sie glaubhaft machen, dass durch die Verschmelzung die Erfüllung ihrer Forderung gefährdet wird. Das Recht, Sicherheitsleistung zu verlangen, steht Gläubigern nicht zu, die im Falle der Insolvenz ein Recht auf vorzugsweise Befriedigung aus einer Deckungsmasse haben, die nach gesetzlicher Vorschrift zu ihrem Schutz errichtet und staatlich überwacht ist."
    },
    {
      "date": "2024-11-13",
      "id": "93324",
      "original_text": "Registerbekanntmachung nach dem Umwandlungsgesetz\nBrandenburg Amtsgericht Potsdam HRB 28264\nBellevue Immobilien 1 GmbH – Zossen",
      "type": "Registerbekanntmachung nach dem Umwandlungsgesetz",
      "state": "Brandenburg",
      "amtsgericht": "Amtsgericht Potsdam",
      "registernummer": "HRB 28264",
      "registerart": "HRB",
      "company_name": "Bellevue Immobilien 1 GmbH",
      "company_seat": "Zossen",
      "details": "13.11.2024 (Bekanntmachungsdatum)\n\nBrandenburg Amtsgericht Potsdam HRB 28264\nRegisterbekanntmachung nach dem Umwandlungsgesetz 01.11.2024 (Eintragungsdatum)\n\nBellevue Immobilien 1 GmbH\nGesellschaft mit beschränkter Haftung\nZossen\n\nZu Eintragungsnummer 3 vom 01.11.2024 wird als nicht eingetragen veröffentlicht: Den Gläubigern der an der Verschmelzung beteiligten Rechtsträger ist, wenn sie binnen sechs Monaten nach dem Tag, an dem die Eintragung der Verschmelzung in das Register des Sitzes desjenigen Rechtsträgers, dessen Gläubiger sie sind, als bekannt gemacht gilt, ihren Anspruch nach Grund und Höhe schriftlich anmelden, Sicherheit zu leisten, soweit sie nicht Befriedigung verlangen können. Dieses Recht steht den Gläubigern jedoch nur zu, wenn sie glaubhaft machen, dass durch die Verschmelzung die Erfüllung ihrer Forderung gefährdet wird"
    },
    {
      "date": "2024-11-13",
      "id": "93364",
      "original_text": "Sonstige Registerbekanntmachung\nNiedersachsen Amtsgericht Hannover HRB 50169\nBenecke-Kaliko Aktiengesellschaft – Hannover",
      "type": "Sonstige Registerbekanntmachung",
      "state": "Niedersachsen",
      "amtsgericht": "Amtsgericht Hannover",
      "registernummer": "HRB 50169",
      "registerart": "HRB",
      "company_name": "Benecke-Kaliko Aktiengesellschaft",
      "company_seat": "Hannover",
      "details": "13.11.2024 (Bekanntmachungsdatum)\n\nNiedersachsen Amtsgericht Hannover HRB 50169\nSonstige Registerbekanntmachung\n\nBenecke-Kaliko Aktiengesellschaft\nAktiengesellschaft\nHannover\n\nDie Liste der Mitglieder des Aufsichtsrats wurde beim Registergericht eingereicht."
    },
    {
      "date": "2024-11-13",
      "id": "93318",
      "original_text": "Löschungsankündigung\nBayern Amtsgericht München HRB 250409\nBeta Bau GmbH – München",
      "type": "Löschungsankündigung",
      "state": "Bayern",
      "amtsgericht": "Amtsgericht München",
      "registernummer": "HRB 250409",
      "registerart": "HRB",
      "company_name": "Beta Bau GmbH",
      "company_seat": "München",
      "details": "13.11.2024 (Bekanntmachungsdatum)\n\nBayern Amtsgericht München HRB 250409\nLöschungsankündigung 12.11.2024 (Eintragungsdatum)\n\nBeta Bau GmbH\nGesellschaft mit beschränkter Haftung\nMünchen\n\nDas Registergericht beabsichtigt, die im Handelsregister eingetragene Gesellschaft wegen Vermögenslosigkeit von Amts wegen nach § 394 FamFG zu löschen. Die Frist zur Erhebung eines Widerspruchs ist auf drei Monate festgesetzt."
    },
    {
      "date": "2024-11-13",
      "id": "93392",
      "original_text": "Löschungsankündigung\nBremen Amtsgericht Bremen HRA 26937\nBetreibergesellschaft H1615A GmbH & Co. KG – Bremen",
      "type": "Löschungsankündigung",
      "state": "Bremen",
      "amtsgericht": "Amtsgericht Bremen",
      "registernummer": "HRA 26937",
      "registerart": "HRA",
      "company_name": "Betreibergesellschaft H1615A GmbH & Co. KG",
      "company_seat": "Bremen",
      "details": "13.11.2024 (Bekanntmachungsdatum)\n\nBremen Amtsgericht Bremen HRA 26937\nLöschungsankündigung\n\nBetreibergesellschaft H1615A GmbH & Co. KG\nKommanditgesellschaft\nBremen\n\nEs ist beabsichtigt die im Handelsregister eingetragene Gesellschaft von Amts wegen gemäß § 394 FamFG zu löschen. Gegen die Löschung kann beim AG Bremen schriftlich oder zu Protokoll der Geschäftsstelle Widerspruch eingelegt werden. Widerspruchsfrist 4 Wochen."
    },
    {
      "date": "2024-11-13",
      "id": "93378",
      "original_text": "Löschungsankündigung\nNordrhein-Westfalen Amtsgericht Dortmund HRB 30489\nCC GRP GmbH – Dortmund",
      "type": "Löschungsankündigung",
      "state": "Nordrhein-Westfalen",
      "amtsgericht": "Amtsgericht Dortmund",
      "registernummer": "HRB 30489",
      "registerart": "HRB",
      "company_name": "CC GRP GmbH",
      "company_seat": "Dortmund",
      "details": "13.11.2024 (Bekanntmachungsdatum)\n\nNordrhein-Westfalen Amtsgericht Dortmund HRB 30489\nLöschungsankündigung\n\nCC GRP GmbH\nGesellschaft mit beschränkter Haftung\nDortmund\n\nDas Registergericht beabsichtigt die Gesellschaft von Amts wegen nach § 394 FamFG zu löschen. Die Frist zur Erhebung eines Widerspruchs ist auf zwei Monate festgesetzt."
    },
    {
      "date": "2024-11-13",
      "id": "93350",
      "original_text": "Löschungsankündigung\nSchleswig-Holstein Amtsgericht Flensburg HRA 8765\nCFO Management GmbH & Co. KG – Freienwill",
      "type": "Löschungsankündigung",
      "state": "Schleswig-Holstein",
      "amtsgericht": "Amtsgericht Flensburg",
      "registernummer": "HRA 8765",
      "registerart": "HRA",
      "company_name": "CFO Management GmbH & Co. KG",
      "company_seat": "Freienwill",
      "details": "13.11.2024 (Bekanntmachungsdatum)\n\nSchleswig-Holstein Amtsgericht Flensburg HRA 8765\nLöschungsankündigung\n\nCFO Management GmbH & Co. KG\nKommanditgesellschaft\nFreienwill\n\nEs ist die Löschung der nachstehenden Gesellschaft wegen Vermögenslosigkeit gemäß § 394 FamFG beabsichtigt.\nWiderspruchsfrist: 2 Monate."
    },
    {
      "date": "2024-11-13",
      "id": "93358",
      "original_text": "Einreichung neuer Dokumente\nSachsen Amtsgericht Leipzig HRB 14016\nCOLLM KLINIK OSCHATZ GmbH – Oschatz",
      "type": "Einreichung neuer Dokumente",
      "state": "Sachsen",
      "amtsgericht": "Amtsgericht Leipzig",
      "registernummer": "HRB 14016",
      "registerart": "HRB",
      "company_name": "COLLM KLINIK OSCHATZ GmbH",
      "company_seat": "Oschatz",
      "details": "13.11.2024 (Bekanntmachungsdatum)\n\nSachsen Amtsgericht Leipzig HRB 14016\nEinreichung neuer Dokumente 13.11.2024 (Eintragungsdatum)\n\nCOLLM KLINIK OSCHATZ GmbH\nGesellschaft mit beschränkter Haftung\nOschatz\n\nAm 05.11.2024 wurde beim Handelsregister des Amtsgerichts Leipzig die Liste der Mitglieder des Aufsichtsrats gemäß § 52 GmbHG eingereicht."
    },
    {
      "date": "2024-11-13",
      "id": "93411",
      "original_text": "Sonstige Registerbekanntmachung\nHessen Amtsgericht Kassel GnR 875\nCURAPRO Wohnungsbaugenossenschaft eG – Vellmar",
      "type": "Sonstige Registerbekanntmachung",
      "state": "Hessen",
      "amtsgericht": "Amtsgericht Kassel",
      "registernummer": "GnR 875",
      "registerart": "GnR",
      "company_name": "CURAPRO Wohnungsbaugenossenschaft eG",
      "company_seat": "Vellmar",
      "details": "13.11.2024 (Bekanntmachungsdatum)\n\nHessen Amtsgericht Kassel GnR 875\nSonstige Registerbekanntmachung\n\nCURAPRO Wohnungsbaugenossenschaft eG\neingetragene Genossenschaft\nVellmar\n\nDem Registergericht ist ein Verschmelzungsplan vom 29.10.2024 über die geplante grenzüberschreitende Verschmelzung der CURAPRO Wohnungsbaugenossenschaft eG mit Sitz in Vellmar (Genossenschaft nach deutschem Recht, Waldstraße 8, 34246 Vellmar, unter GnR 875 eingetragen im Genossenschaftsregister des Amtsgerichts Kassel, Frankfurter Straße 9, 34117 Kassel) -übernehmender Rechtsträger- mit der CURAPRO Wohnungsbau, druzstvo mit Sitz in Prag (Genossenschaft nach tschechischem Recht, Ovocny trh 1096/8, Stare Mesto, 110 00 Prag 1, unter Az. Dr 9117 und Identifikationsnummer 219 69 981 eingetragen im Handelsregister des Stadtgerichts Prag, nám. Kinských 234, 150 00 Praha 5-Smíchov) -übertragender Rechtsträger- eingereicht worden.\n\nHinweis auf Modalitäten für die Ausübung der Rechte der Gläubiger der betreffenden Genossenschaft (geregelt in § 8 Abs. 3 des Verschmelzungsplans):\nDie Gläubigerrechte, die sich aus einschlägigen Bestimmungen der tschechischen und deutschen Rechtsvorschriften ergeben, bleiben von dem Verschmelzungsplan unberührt, bzw. Stellung und Rechte der Gläubiger werden durch Umsetzung der Verschmelzung besser. Aus diesem Grund sind die Maßnahmen zum Schutz der Gläubigerrechte der beteiligten Genossenschaften nicht näher analysiert. Die Gläubiger der beteiligten Genossenschaften können ausreichende Sicherheitsleistung fordern, falls die Einbringlichkeit ihrer bisher nicht fällig gewordenen Forderungen aus Verbindlichkeiten vor der Veröffentlichung (oder sonstige Bekanntmachung) des Umwandlungsplans infolge der Umwandlung beeinträchtigt wird; sinngemäß gilt dies auch für künftige oder bedingte Forderungen.\nAuskünfte über diese Modalitäten können kostenlos eingeholt werden unter:\n- 34246 Vellmar, Waldstraße 8, Bundesrepublik Deutschland;\n- Ovocny trh 1096/8, Stare Mesto, 110 00 Prag 1, Tschechische Republik.\n\nHinweis auf Modalitäten für die Ausübung der Rechte der Mitglieder der betreffenden Genossenschaft (geregelt in § 3 Abs. 3 und § 8 Abs. 1 des Verschmelzungsplans):\nDer Genossenschaftsanteil eines jeden Mitglieds der übertragenden Curapro Wohnungsbau, družstvo, in Höhe von je 1.270 CZK wird gegen einen Anteil an der entstehenden CURAPRO Wohnungsbau SCE mit beschränkter Haftung von je 50 EUR umgetauscht. Alle Mitglieder der übertragenden Genossenschaft Curapro Wohnungsbau, družstvo haben vor der Genehmigung des Verschmelzungsplans auf das Recht auf Gewährung einer Zuzahlung verzichtet. Alle Mitglieder der CURAPRO Wohnungsbaugenossenschaft eG haben vor der Genehmigung des Verschmelzungsplans auf alle Rechte auf mögliche Zuzahlung verzichtet.\nBesondere Rechte i.S.d. Art. 22 Abs. 1 lit. g) SCE-VO bestehen bei der Curapro Wohnungsbau, družstvo nicht. Einzelnen Genossenschaftsmitgliedern werden im Rahmen der Verschmelzung auch keine besonderen Rechte an der CURAPRO Wohnungsbaugenossenschaft eG im Sinne dieser Vorschrift gewährt.\nAuskünfte über diese Modalitäten können kostenlos eingeholt werden unter:\n- 34246 Vellmar, Waldstraße 8, Bundesrepublik Deutschland;\n- Ovocny trh 1096/8, Stare Mesto, 110 00 Prag 1, Tschechische Republik.\n\nDie für die SCE vorgesehene Firma und ihr künftiger Sitz lauten:\nCURAPRO Wohnungsbau SCE mit beschränkter Haftung mit Sitz in Vellmar,\nWaldstraße 8, 34246 Vellmar, Bundesrepublik Deutschland.\n\nNach den Verschmelzungsbeschlüssen in den Generalversammlungen der beteiligten Rechtsträger (vgl. Art. 27 SCE-VO) und dem Gründungsbeschluss über die Errichtung der CURAPRO Wohnungsbau SCE mit beschränkter Haftung ist die Eintragung in das Genossenschaftsregister bei dem Amtsgericht Kassel zu GnR 875 zur Wirksamkeit erforderlich."
    },
    {
      "date": "2024-11-13",
      "id": "93366",
      "original_text": "Sonstige Registerbekanntmachung\nNiedersachsen Amtsgericht Hannover HRB 52032\nContiTech Schlauch GmbH – Hannover",
      "type": "Sonstige Registerbekanntmachung",
      "state": "Niedersachsen",
      "amtsgericht": "Amtsgericht Hannover",
      "registernummer": "HRB 52032",
      "registerart": "HRB",
      "company_name": "ContiTech Schlauch GmbH",
      "company_seat": "Hannover",
      "details": "13.11.2024 (Bekanntmachungsdatum)\n\nNiedersachsen Amtsgericht Hannover HRB 52032\nSonstige Registerbekanntmachung\n\nContiTech Schlauch GmbH\nGesellschaft mit beschränkter Haftung\nHannover\n\nDie Liste der Mitglieder des Aufsichtsrats wurde beim Registergericht eingereicht."
    },
    {
      "date": "2024-11-13",
      "id": "93325",
      "original_text": "Löschungsankündigung\nMecklenburg-Vorpommern Amtsgericht Rostock HRB 9307\nDATAMARIS Gesellschaft für Informations- und Kommunikationssyteme mbH – Bentwisch",
      "type": "Löschungsankündigung",
      "state": "Mecklenburg-Vorpommern",
      "amtsgericht": "Amtsgericht Rostock",
      "registernummer": "HRB 9307",
      "registerart": "HRB",
      "company_name": "DATAMARIS Gesellschaft für Informations- und Kommunikationssyteme mbH",
      "company_seat": "Bentwisch",
      "details": "13.11.2024 (Bekanntmachungsdatum)\n\nMecklenburg-Vorpommern Amtsgericht Rostock HRB 9307\nLöschungsankündigung\n\nDATAMARIS Gesellschaft für Informations- und Kommunikationssyteme mbH\nGesellschaft mit beschränkter Haftung\nBentwisch\n\nDas Registergericht beabsichtigt, die im Handelsregister eingetragene Gesellschaft von Amts wegen nach § 394 FamFG zu löschen. Die Frist zur Erhebung eines Widerspruchs gegen die beabsichtigte Löschung wird auf einen Monat festgesetzt."
    },
    {
      "date": "2024-11-13",
      "id": "93344",
      "original_text": "Einreichung neuer Dokumente\nBaden-Württemberg Amtsgericht Stuttgart HRB 796728\nDELPHI Unternehmensberatung Aktiengesellschaft – Stuttgart",
      "type": "Einreichung neuer Dokumente",
      "state": "Baden-Württemberg",
      "amtsgericht": "Amtsgericht Stuttgart",
      "registernummer": "HRB 796728",
      "registerart": "HRB",
      "company_name": "DELPHI Unternehmensberatung Aktiengesellschaft",
      "company_seat": "Stuttgart",
      "details": "13.11.2024 (Bekanntmachungsdatum)\n\nBaden-Württemberg Amtsgericht Stuttgart HRB 796728\nEinreichung neuer Dokumente\n\nDELPHI Unternehmensberatung Aktiengesellschaft\nAktiengesellschaft\nStuttgart\n\nDie Gesellschaft hat am 24.10.2024 den Entwurf des Verschmelzungsvertrages zwischen \"YVAL Idiosynkratische Investments SE\", Stuttgart (Amtsgericht Amtsgericht Stuttgart HRB 796778)\nund der hiesigen Gesellschaft (übernehmender Rechtsträger) zum Handelsregister eingereicht."
    },
    {
      "date": "2024-11-13",
      "id": "93356",
      "original_text": "Löschungsankündigung\nSachsen Amtsgericht Dresden HRB 27049\nDI Design Immobilien GmbH – Dresden",
      "type": "Löschungsankündigung",
      "state": "Sachsen",
      "amtsgericht": "Amtsgericht Dresden",
      "registernummer": "HRB 27049",
      "registerart": "HRB",
      "company_name": "DI Design Immobilien GmbH",
      "company_seat": "Dresden",
      "details": "13.11.2024 (Bekanntmachungsdatum)\n\nSachsen Amtsgericht Dresden HRB 27049\nLöschungsankündigung\n\nDI Design Immobilien GmbH\nGesellschaft mit beschränkter Haftung\nDresden\n\nDas Registergericht beabsichtigt, die im Handelsregister eingetragene Gesellschaft von Amts wegen nach § 394 FamFG zu löschen. Die Frist zu Erhebung eines Widerspruchs gegen die beabsichtigte Löschung wird auf einen Monat festgesetzt."
    },
    {
      "date": "2024-11-13",
      "id": "93379",
      "original_text": "Registerbekanntmachung nach dem Umwandlungsgesetz\nNordrhein-Westfalen Amtsgericht Hagen HRB 1051\nDOUGLAS INFORMATIK & SERVICE GMBH – Hagen",
      "type": "Registerbekanntmachung nach dem Umwandlungsgesetz",
      "state": "Nordrhein-Westfalen",
      "amtsgericht": "Amtsgericht Hagen",
      "registernummer": "HRB 1051",
      "registerart": "HRB",
      "company_name": "DOUGLAS INFORMATIK & SERVICE GMBH",
      "company_seat": "Hagen",
      "details": "13.11.2024 (Bekanntmachungsdatum)\n\nNordrhein-Westfalen Amtsgericht Hagen HRB 1051\nRegisterbekanntmachung nach dem Umwandlungsgesetz 13.11.2024 (Eintragungsdatum)\n\nDOUGLAS INFORMATIK & SERVICE GMBH\nGesellschaft mit beschränkter Haftung\nHagen\n\nDen Gläubigern der an der formwechselnden Umwandlung beteiligten Rechtsträger ist, wenn sie binnen sechs Monaten nach dem Tag, an dem die Eintragung der formwechselnden Umwandlung in das Register des Sitzes derjenigen Rechtsträger deren Gläubiger sie sind, nach § 19 Absatz 3 UmwG als bekanntgemacht gilt, ihren Anspruch nach Grund und Höhe schriftlich anmelden, Sicherheit zu leisten, soweit sie nicht Befriedigung verlangen können. Dieses Recht steht den Gläubigern jedoch nur zu, wenn sie glaubhaft machen, dass durch die formwechselnden Umwandlung die Erfüllung ihrer Forderung gefährdet wird."
    },
    {
      "date": "2024-11-13",
      "id": "93371",
      "original_text": "Löschungsankündigung\nNiedersachsen Amtsgericht Walsrode HRA 203921\nDas-Taxi-Team Oyten GmbH & Co.KG – Oyten",
      "type": "Löschungsankündigung",
      "state": "Niedersachsen",
      "amtsgericht": "Amtsgericht Walsrode",
      "registernummer": "HRA 203921",
      "registerart": "HRA",
      "company_name": "Das-Taxi-Team Oyten GmbH & Co.KG",
      "company_seat": "Oyten",
      "details": "13.11.2024 (Bekanntmachungsdatum)\n\nNiedersachsen Amtsgericht Walsrode HRA 203921\nLöschungsankündigung\n\nDas-Taxi-Team Oyten GmbH & Co.KG\nKommanditgesellschaft\nOyten\n\nDas Registergericht beabsichtigt, die Firma von Amts wegen nach § 395 FamFG zu löschen. Die Frist zur Erhebung eines Widerspruchs ist auf 1 Monat ab dieser Registerbekanntmachung festgesetzt."
    },
    {
      "date": "2024-11-13",
      "id": "93312",
      "original_text": "Löschungsankündigung\nBayern Amtsgericht Nürnberg HRB 40843\nDecor by Bori Takacs GmbH – Nürnberg",
      "type": "Löschungsankündigung",
      "state": "Bayern",
      "amtsgericht": "Amtsgericht Nürnberg",
      "registernummer": "HRB 40843",
      "registerart": "HRB",
      "company_name": "Decor by Bori Takacs GmbH",
      "company_seat": "Nürnberg",
      "details": "13.11.2024 (Bekanntmachungsdatum)\n\nBayern Amtsgericht Nürnberg HRB 40843\nLöschungsankündigung\n\nDecor by Bori Takacs GmbH\nGesellschaft mit beschränkter Haftung\nNürnberg\n\nDas Registergericht beabsichtigt, die im Handelsregister eingetragene Gesellschaft wegen Vermögenslosigkeit von Amts wegen nach § 394 FamFG zu löschen. Die Frist zur Erhebung eines Widerspruchs ist auf einen Monat festgesetzt."
    },
    {
      "date": "2024-11-13",
      "id": "93327",
      "original_text": "Löschungsankündigung\nBerlin Amtsgericht Berlin (Charlottenburg) HRA 30469\nDieter Melchert GmbH & Co. KG – Berlin",
      "type": "Löschungsankündigung",
      "state": "Berlin",
      "amtsgericht": "Amtsgericht Berlin (Charlottenburg)",
      "registernummer": "HRA 30469",
      "registerart": "HRA",
      "company_name": "Dieter Melchert GmbH & Co. KG",
      "company_seat": "Berlin",
      "details": "13.11.2024 (Bekanntmachungsdatum)\n\nBerlin Amtsgericht Berlin (Charlottenburg) HRA 30469\nLöschungsankündigung\n\nDieter Melchert GmbH & Co. KG\nKommanditgesellschaft\nBerlin\n\nBei dem nachstehenden Unternehmen / der nachstehenden Gesellschaft wird das Amtslöschungsverfahren gemäß § 31 Abs. 2 HGB eingeleitet. Widerspruchsfrist 2 Monate"
    },
    {
      "date": "2024-11-13",
      "id": "93304",
      "original_text": "Registerbekanntmachung nach dem Umwandlungsgesetz\nBayern Amtsgericht München HRB 189377\nDziki Investment GmbH – München",
      "type": "Registerbekanntmachung nach dem Umwandlungsgesetz",
      "state": "Bayern",
      "amtsgericht": "Amtsgericht München",
      "registernummer": "HRB 189377",
      "registerart": "HRB",
      "company_name": "Dziki Investment GmbH",
      "company_seat": "München",
      "details": "13.11.2024 (Bekanntmachungsdatum)\n\nBayern Amtsgericht München HRB 189377\nRegisterbekanntmachung nach dem Umwandlungsgesetz 12.11.2024 (Eintragungsdatum)\n\nDziki Investment GmbH\nGesellschaft mit beschränkter Haftung\nMünchen\n\nDen Gläubigern der an der Spaltung beteiligten Rechtsträger ist, wenn sie binnen sechs Monaten nach dem Tag, an dem die Eintragung der Spaltung in das Register des Sitzes desjenigen Rechtsträgers, dessen Gläubiger sie sind, nach §§ 125, 19 Abs. 3 UmwG als bekannt gemacht gilt, ihren Anspruch nach Grund und Höhe schriftlich anmelden, Sicherheit zu leisten, soweit sie nicht Befriedigung verlangen können. Dieses Recht steht den Gläubigern jedoch nur zu, wenn sie glaubhaft machen, dass durch die Spaltung die Erfüllung ihrer Forderung gefährdet wird."
    },
    {
      "date": "2024-11-13",
      "id": "93413",
      "original_text": "Löschungsankündigung\nHessen Amtsgericht Frankfurt am Main HRB 113740\nELPE Hochbau GmbH – Frankfurt am Main",
      "type": "Löschungsankündigung",
      "state": "Hessen",
      "amtsgericht": "Amtsgericht Frankfurt am Main",
      "registernummer": "HRB 113740",
      "registerart": "HRB",
      "company_name": "ELPE Hochbau GmbH",
      "company_seat": "Frankfurt am Main",
      "details": "13.11.2024 (Bekanntmachungsdatum)\n\nHessen Amtsgericht Frankfurt am Main HRB 113740\nLöschungsankündigung 13.11.2024 (Eintragungsdatum)\n\nELPE Hochbau GmbH\nGesellschaft mit beschränkter Haftung\nFrankfurt am Main\n\nDas Registergericht beabsichtigt die im Handelsregister eingetragene Gesellschaft von Amts wegen nach § 394 FamFG zu löschen. Die Frist zur Erhebung eines Widerspruchs gegen die beabsichtigte Löschung wird auf 1 Monat festgesetzt."
    },
    {
      "date": "2024-11-13",
      "id": "93377",
      "original_text": "Registerbekanntmachung nach dem Umwandlungsgesetz\nNordrhein-Westfalen Amtsgericht Bad Oeynhausen HRB 3896\nEnergieservice Westfalen Weser GmbH – Kirchlengern",
      "type": "Registerbekanntmachung nach dem Umwandlungsgesetz",
      "state": "Nordrhein-Westfalen",
      "amtsgericht": "Amtsgericht Bad Oeynhausen",
      "registernummer": "HRB 3896",
      "registerart": "HRB",
      "company_name": "Energieservice Westfalen Weser GmbH",
      "company_seat": "Kirchlengern",
      "details": "13.11.2024 (Bekanntmachungsdatum)\n\nNordrhein-Westfalen Amtsgericht Bad Oeynhausen HRB 3896\nRegisterbekanntmachung nach dem Umwandlungsgesetz 13.11.2024 (Eintragungsdatum)\n\nEnergieservice Westfalen Weser GmbH\nGesellschaft mit beschränkter Haftung\nKirchlengern\n\nDen Gläubigern der an der Abspaltung beteiligten Rechtsträger ist, wenn sie binnen sechs Monaten nach dem Tag, an dem die Eintragung der Abspaltung in das Register des Sitzes desjenigen Rechtsträgers, dessen Gläubiger sie sind, nach § 19 Absatz 3 UmwG als bekanntgemacht gilt, ihren Anspruch nach Grund und Höhe schriftlich anmelden, Sicherheit zu leisten, soweit sie nicht Befriedigung verlangen können. Dieses Recht steht den Gläubigern jedoch nur zu, wenn sie glaubhaft machen, dass durch die Abspaltung die Erfüllung ihrer Forderung gefährdet wird."
    },
    {
      "date": "2024-11-13",
      "id": "93361",
      "original_text": "Löschungsankündigung\nNiedersachsen Amtsgericht Hildesheim HRB 206699\nEstelpower UG (haftungsbeschränkt) – Lengede",
      "type": "Löschungsankündigung",
      "state": "Niedersachsen",
      "amtsgericht": "Amtsgericht Hildesheim",
      "registernummer": "HRB 206699",
      "registerart": "HRB",
      "company_name": "Estelpower UG (haftungsbeschränkt)",
      "company_seat": "Lengede",
      "details": "13.11.2024 (Bekanntmachungsdatum)\n\nNiedersachsen Amtsgericht Hildesheim HRB 206699\nLöschungsankündigung\n\nEstelpower UG (haftungsbeschränkt)\nGesellschaft mit beschränkter Haftung\nLengede\n\nDas Registergericht beabsichtigt, die Gesellschaft von Amts wegen nach § 394 FamFG zu löschen. Die Frist zur Erhebung eines Widerspruchs ist auf 1 Monat ab dieser Registerbekanntmachung festgesetzt."
    },
    {
      "date": "2024-11-13",
      "id": "93306",
      "original_text": "Löschungsankündigung\nBayern Amtsgericht München HRB 226518\nEuphoria Productions GmbH – München",
      "type": "Löschungsankündigung",
      "state": "Bayern",
      "amtsgericht": "Amtsgericht München",
      "registernummer": "HRB 226518",
      "registerart": "HRB",
      "company_name": "Euphoria Productions GmbH",
      "company_seat": "München",
      "details": "13.11.2024 (Bekanntmachungsdatum)\n\nBayern Amtsgericht München HRB 226518\nLöschungsankündigung 12.11.2024 (Eintragungsdatum)\n\nEuphoria Productions GmbH\nGesellschaft mit beschränkter Haftung\nMünchen\n\nDas Registergericht beabsichtigt, die im Handelsregister eingetragene Gesellschaft wegen Vermögenslosigkeit von Amts wegen nach § 394 FamFG zu löschen. Die Frist zur Erhebung eines Widerspruchs ist auf drei Monate festgesetzt."
    },
    {
      "date": "2024-11-13",
      "id": "93373",
      "original_text": "Löschungsankündigung\nNordrhein-Westfalen Amtsgericht Köln HRB 116722\nFF Filoteig Food GmbH – Köln",
      "type": "Löschungsankündigung",
      "state": "Nordrhein-Westfalen",
      "amtsgericht": "Amtsgericht Köln",
      "registernummer": "HRB 116722",
      "registerart": "HRB",
      "company_name": "FF Filoteig Food GmbH",
      "company_seat": "Köln",
      "details": "13.11.2024 (Bekanntmachungsdatum)\n\nNordrhein-Westfalen Amtsgericht Köln HRB 116722\nLöschungsankündigung\n\nFF Filoteig Food GmbH\nGesellschaft mit beschränkter Haftung\nKöln\n\nDas Registergericht beabsichtigt die Gesellschaft von Amts wegen nach § 394 FamFG zu löschen. Die Frist zur Erhebung eines Widerspruchs ist auf zwei Monate festgesetzt."
    },
    {
      "date": "2024-11-13",
      "id": "93354",
      "original_text": "Einreichung neuer Dokumente\nHamburg Amtsgericht Hamburg HRB 12316\nFFG Fahrzeugwerkstätten Falkenried GmbH – Hamburg",
      "type": "Einreichung neuer Dokumente",
      "state": "Hamburg",
      "amtsgericht": "Amtsgericht Hamburg",
      "registernummer": "HRB 12316",
      "registerart": "HRB",
      "company_name": "FFG Fahrzeugwerkstätten Falkenried GmbH",
      "company_seat": "Hamburg",
      "details": "13.11.2024 (Bekanntmachungsdatum)\n\nHamburg Amtsgericht Hamburg HRB 12316\nEinreichung neuer Dokumente\n\nFFG Fahrzeugwerkstätten Falkenried GmbH\nGesellschaft mit beschränkter Haftung\nHamburg\n\nAls nicht eingetragen wird bekannt gemacht: Liste des Aufsichtsrats wurde eingereicht."
    },
    {
      "date": "2024-11-13",
      "id": "93310",
      "original_text": "Registerbekanntmachung nach dem Umwandlungsgesetz\nBayern Amtsgericht München HRB 289271\nFNZ Bank SE – Aschheim",
      "type": "Registerbekanntmachung nach dem Umwandlungsgesetz",
      "state": "Bayern",
      "amtsgericht": "Amtsgericht München",
      "registernummer": "HRB 289271",
      "registerart": "HRB",
      "company_name": "FNZ Bank SE",
      "company_seat": "Aschheim",
      "details": "13.11.2024 (Bekanntmachungsdatum)\n\nBayern Amtsgericht München HRB 289271\nRegisterbekanntmachung nach dem Umwandlungsgesetz 12.11.2024 (Eintragungsdatum)\n\nFNZ Bank SE\nEuropäische Aktiengesellschaft (SE)\nAschheim\n\nDen Gläubigern der an der Spaltung beteiligten Rechtsträger ist, wenn sie binnen sechs Monaten nach dem Tag, an dem die Eintragung der Spaltung in das Register des Sitzes desjenigen Rechtsträgers, dessen Gläubiger sie sind, nach §§ 125, 19 Abs. 3 UmwG als bekannt gemacht gilt, ihren Anspruch nach Grund und Höhe schriftlich anmelden, Sicherheit zu leisten, soweit sie nicht Befriedigung verlangen können. Dieses Recht steht den Gläubigern jedoch nur zu, wenn sie glaubhaft machen, dass durch die Spaltung die Erfüllung ihrer Forderung gefährdet wird."
    },
    {
      "date": "2024-11-13",
      "id": "93308",
      "original_text": "Löschungsankündigung\nBayern Amtsgericht München HRB 216720\nFidan Transport GmbH – München",
      "type": "Löschungsankündigung",
      "state": "Bayern",
      "amtsgericht": "Amtsgericht München",
      "registernummer": "HRB 216720",
      "registerart": "HRB",
      "company_name": "Fidan Transport GmbH",
      "company_seat": "München",
      "details": "13.11.2024 (Bekanntmachungsdatum)\n\nBayern Amtsgericht München HRB 216720\nLöschungsankündigung 12.11.2024 (Eintragungsdatum)\n\nFidan Transport GmbH\nGesellschaft mit beschränkter Haftung\nMünchen\n\nDas Registergericht beabsichtigt, die im Handelsregister eingetragene Gesellschaft wegen Vermögenslosigkeit von Amts wegen nach § 394 FamFG zu löschen. Die Frist zur Erhebung eines Widerspruchs ist auf drei Monate festgesetzt."
    },
    {
      "date": "2024-11-13",
      "id": "93368",
      "original_text": "Registerbekanntmachung nach dem Umwandlungsgesetz\nNiedersachsen Amtsgericht Osnabrück HRB 209325\nFlexiWarm GmbH – Bad Bentheim-Gildehaus",
      "type": "Registerbekanntmachung nach dem Umwandlungsgesetz",
      "state": "Niedersachsen",
      "amtsgericht": "Amtsgericht Osnabrück",
      "registernummer": "HRB 209325",
      "registerart": "HRB",
      "company_name": "FlexiWarm GmbH",
      "company_seat": "Bad Bentheim-Gildehaus",
      "details": "13.11.2024 (Bekanntmachungsdatum)\n\nNiedersachsen Amtsgericht Osnabrück HRB 209325\nRegisterbekanntmachung nach dem Umwandlungsgesetz 13.11.2024 (Eintragungsdatum)\n\nFlexiWarm GmbH\nGesellschaft mit beschränkter Haftung\nBad Bentheim-Gildehaus\n\nDen Gläubigern der an der Verschmelzung beteiligten Rechtsträger ist, wenn sie binnen sechs Monaten nach dem Tag, an dem die Eintragung der Verschmelzung in das Register des Sitzes desjenigen Rechtsträgers, dessen Gläubiger sie sind, nach § 19  Abs.  3 UmwG als bekannt gemacht gilt, ihren Anspruch nach Grund und Höhe schriftlich anmelden, Sicherheit zu leisten, soweit sie nicht Befriedigung verlangen können. Dieses Recht steht den Gläubigern jedoch nur zu, wenn sie glaubhaft machen, dass durch die Verschmelzung die Erfüllung der Forderung gefährdet wird."
    },
    {
      "date": "2024-11-13",
      "id": "93313",
      "original_text": "Löschungsankündigung\nBayern Amtsgericht München HRB 265282\nFlower Embassy GmbH – München",
      "type": "Löschungsankündigung",
      "state": "Bayern",
      "amtsgericht": "Amtsgericht München",
      "registernummer": "HRB 265282",
      "registerart": "HRB",
      "company_name": "Flower Embassy GmbH",
      "company_seat": "München",
      "details": "13.11.2024 (Bekanntmachungsdatum)\n\nBayern Amtsgericht München HRB 265282\nLöschungsankündigung\n\nFlower Embassy GmbH\nGesellschaft mit beschränkter Haftung\nMünchen\n\nDas Registergericht beabsichtigt, die im Handelsregister eingetragene Gesellschaft wegen Vermögenslosigkeit von Amts wegen nach § 394 FamFG zu löschen. Die Frist zur Erhebung eines Widerspruchs ist auf drei Monate festgesetzt."
    },
    {
      "date": "2024-11-13",
      "id": "93393",
      "original_text": "Löschungsankündigung\nBremen Amtsgericht Bremen HRB 27453\nGillwald Umzüge UG (haftungsbeschränkt) – Bremen",
      "type": "Löschungsankündigung",
      "state": "Bremen",
      "amtsgericht": "Amtsgericht Bremen",
      "registernummer": "HRB 27453",
      "registerart": "HRB",
      "company_name": "Gillwald Umzüge UG (haftungsbeschränkt)",
      "company_seat": "Bremen",
      "details": "13.11.2024 (Bekanntmachungsdatum)\n\nBremen Amtsgericht Bremen HRB 27453\nLöschungsankündigung\n\nGillwald Umzüge UG (haftungsbeschränkt)\nGesellschaft mit beschränkter Haftung\nBremen\n\nEs ist beabsichtigt die im Handelsregister eingetragene Gesellschaft von Amts wegen gemäß § 394 FamFG zu löschen. Gegen die Löschung kann beim AG Bremen schriftlich oder zu Protokoll der Geschäftsstelle Widerspruch eingelegt werden. Widerspruchsfrist 4 Wochen."
    },
    {
      "date": "2024-11-13",
      "id": "93420",
      "original_text": "Löschungsankündigung\nHessen Amtsgericht Wiesbaden HRB 27398\nHAMZA GmbH – Wiesbaden",
      "type": "Löschungsankündigung",
      "state": "Hessen",
      "amtsgericht": "Amtsgericht Wiesbaden",
      "registernummer": "HRB 27398",
      "registerart": "HRB",
      "company_name": "HAMZA GmbH",
      "company_seat": "Wiesbaden",
      "details": "13.11.2024 (Bekanntmachungsdatum)\n\nHessen Amtsgericht Wiesbaden HRB 27398\nLöschungsankündigung\n\nHAMZA GmbH\nGesellschaft mit beschränkter Haftung\nWiesbaden\n\nDas Registergericht beabsichtigt die im Handelsregister eingetragene Gesellschaft von Amts wegen nach § 394 FamFG zu löschen. Die Frist zur Erhebung eines Widerspruchs gegen die beabsichtigte Löschung wird auf 3 Monate festgesetzt."
    },
    {
      "date": "2024-11-13",
      "id": "93389",
      "original_text": "Löschungsankündigung\nNordrhein-Westfalen Amtsgericht Neuss HRB 20356\nHello Miss GmbH – Neuss",
      "type": "Löschungsankündigung",
      "state": "Nordrhein-Westfalen",
      "amtsgericht": "Amtsgericht Neuss",
      "registernummer": "HRB 20356",
      "registerart": "HRB",
      "company_name": "Hello Miss GmbH",
      "company_seat": "Neuss",
      "details": "13.11.2024 (Bekanntmachungsdatum)\n\nNordrhein-Westfalen Amtsgericht Neuss HRB 20356\nLöschungsankündigung 11.11.2024 (Eintragungsdatum)\n\nHello Miss GmbH\nGesellschaft mit beschränkter Haftung\nNeuss\n\nDas Registergericht beabsichtigt die Gesellschaft von Amts wegen nach § 394 FamFG zu löschen. Die Frist zur Erhebung eines Widerspruchs ist auf einen Monat festgesetzt. Rechtsbehelfsbelehrung: Gegen diese Verfügung können Sie Widerspruch einlegen. Der Widerspruch ist bei dem Amtsgericht Neuss - Registergericht -, Breite Str. 48, 41460 Neuss schriftlich in deutscher Sprache oder zur Niederschrift der Geschäftsstelle einzulegen.Der Widerspruch kann auch zur Niederschrift der Geschäftsstelle eines jeden Amtsgerichtes abgegeben werden.Die Einlegung ist auch durch Übertragung eines elektronischen Dokuments an die elektronische Poststelle des Gerichts möglich. Das elektronische Dokument muss für die Bearbeitung durch das Gericht geeignet und mit einer qualifizierten elektronischen Signatur der verantwortenden Person versehen sein oder von der verantwortenden Person signiert und auf einem sicheren Übermittlungsweg gemäß § 130a ZPO nach näherer Maßgabe der Verordnung über die technischen Rahmenbedingungen des elektronischen Rechtsverkehrs und über das besondere elektronische Behördenpostfach (BGBl. I, S.3803) eingereicht werden. Weitere Informationen erhalten Sie auf der Internetseite www.justiz.de.Der Widerspruch muss spätestens innerhalb der gesetzten Frist nach der schriftlichen Bekanntgabe der Verfügung bei dem Amtsgericht - Registergericht - Neuss eingegangen sein. Dies gilt auch dann, wenn der Widerspruch zur Niederschrift der Geschäftsstelle eines anderen Amtsgerichtes abgegeben wurde. Die Frist beginnt mit der schriftlichen Bekanntgabe der Verfügung. Die Bekanntgabe ist entweder durch Zustellung oder am dritten Tage nach Aufgabe zur Post bewirkt. Fällt das Ende der Frist auf einen Sonntag, einen allgemeinen Feiertag oder Sonnabend, so endet die Frist mit Ablauf des nächsten Werktages. Der Widerspruch muss die Bezeichnung der angefochtenen Verfügung sowie die Erklärung enthalten, dass Widerspruch gegen diese Verfügung eingelegt wird. Er ist zu unterzeichnen und soll begründet werden."
    },
    {
      "date": "2024-11-13",
      "id": "93351",
      "original_text": "Löschungsankündigung\nBrandenburg Amtsgericht Potsdam HRB 9245\nHelmich + Helmich GmbH – Potsdam",
      "type": "Löschungsankündigung",
      "state": "Brandenburg",
      "amtsgericht": "Amtsgericht Potsdam",
      "registernummer": "HRB 9245",
      "registerart": "HRB",
      "company_name": "Helmich + Helmich GmbH",
      "company_seat": "Potsdam",
      "details": "13.11.2024 (Bekanntmachungsdatum)\n\nBrandenburg Amtsgericht Potsdam HRB 9245\nLöschungsankündigung\n\nHelmich + Helmich GmbH\nGesellschaft mit beschränkter Haftung\nPotsdam\n\nBei der nachstehenden Gesellschaft wird das Amtslöschungsverfahren gemäß § 394 FamFG eingeleitet. Widerspruchsfrist 8 Wochen."
    },
    {
      "date": "2024-11-13",
      "id": "93333",
      "original_text": "Löschungsankündigung\nBaden-Württemberg Amtsgericht Mannheim HRB 726506\nImpact-Holz GmbH – Pforzheim",
      "type": "Löschungsankündigung",
      "state": "Baden-Württemberg",
      "amtsgericht": "Amtsgericht Mannheim",
      "registernummer": "HRB 726506",
      "registerart": "HRB",
      "company_name": "Impact-Holz GmbH",
      "company_seat": "Pforzheim",
      "details": "13.11.2024 (Bekanntmachungsdatum)\n\nBaden-Württemberg Amtsgericht Mannheim HRB 726506\nLöschungsankündigung\n\nImpact-Holz GmbH\nGesellschaft mit beschränkter Haftung\nPforzheim\n\nDas Gericht beabsichtigt, die Gesellschaft wegen Vermögenslosigkeit im Handelsregister von Amts wegen nach § 394 FamFG zu löschen. Die Frist zur Geltendmachung eines Widerspruchs gegen die beabsichtigte Löschung ist auf einen Monat ab Veröffentlichung bestimmt."
    },
    {
      "date": "2024-11-13",
      "id": "93416",
      "original_text": "Löschungsankündigung\nHessen Amtsgericht Darmstadt HRB 62155\nInlatec Gesellschaft für Industrie- und Labortechnik mbH – Bürstadt",
      "type": "Löschungsankündigung",
      "state": "Hessen",
      "amtsgericht": "Amtsgericht Darmstadt",
      "registernummer": "HRB 62155",
      "registerart": "HRB",
      "company_name": "Inlatec Gesellschaft für Industrie- und Labortechnik mbH",
      "company_seat": "Bürstadt",
      "details": "13.11.2024 (Bekanntmachungsdatum)\n\nHessen Amtsgericht Darmstadt HRB 62155\nLöschungsankündigung\n\nInlatec Gesellschaft für Industrie- und Labortechnik mbH\nGesellschaft mit beschränkter Haftung\nBürstadt\n\nDas Registergericht beabsichtigt die im Handelsregister eingetragene Gesellschaft von Amts wegen nach § 394 FamFG zu löschen. Die Frist zur Erhebung eines Widerspruchs gegen die beabsichtigte Löschung wird auf 3 Monate festgesetzt."
    },
    {
      "date": "2024-11-13",
      "id": "93367",
      "original_text": "Löschungsankündigung\nNiedersachsen Amtsgericht Aurich HRB 200307\nJanßen Elektro- und Baggerbetrieb GmbH – Wittmund",
      "type": "Löschungsankündigung",
      "state": "Niedersachsen",
      "amtsgericht": "Amtsgericht Aurich",
      "registernummer": "HRB 200307",
      "registerart": "HRB",
      "company_name": "Janßen Elektro- und Baggerbetrieb GmbH",
      "company_seat": "Wittmund",
      "details": "13.11.2024 (Bekanntmachungsdatum)\n\nNiedersachsen Amtsgericht Aurich HRB 200307\nLöschungsankündigung\n\nJanßen Elektro- und Baggerbetrieb GmbH\nGesellschaft mit beschränkter Haftung\nWittmund\n\nDas Registergericht beabsichtigt, die Gesellschaft von Amts wegen nach § 394 FamFG zu löschen. Die Frist zur Erhebung eines Widerspruchs ist auf 1 Monat ab dieser Registerbekanntmachung festgesetzt."
    },
    {
      "date": "2024-11-13",
      "id": "93386",
      "original_text": "Löschungsankündigung\nNordrhein-Westfalen Amtsgericht Dortmund HRA 18222\nK+P Vermietungs GmbH & Co. KG – Dortmund",
      "type": "Löschungsankündigung",
      "state": "Nordrhein-Westfalen",
      "amtsgericht": "Amtsgericht Dortmund",
      "registernummer": "HRA 18222",
      "registerart": "HRA",
      "company_name": "K+P Vermietungs GmbH & Co. KG",
      "company_seat": "Dortmund",
      "details": "13.11.2024 (Bekanntmachungsdatum)\n\nNordrhein-Westfalen Amtsgericht Dortmund HRA 18222\nLöschungsankündigung 13.11.2024 (Eintragungsdatum)\n\nK+P Vermietungs GmbH & Co. KG\nKommanditgesellschaft\nDortmund\n\nDas Registergericht beabsichtigt die Firma von Amts wegen nach § 394 FamFG zu löschen. Die Frist zur Erhebung eines Widerspruchs ist auf zwei Monate festgesetzt."
    },
    {
      "date": "2024-11-13",
      "id": "93323",
      "original_text": "Löschungsankündigung\nBaden-Württemberg Amtsgericht Stuttgart HRB 737579\nKLEWOS GmbH – Stuttgart",
      "type": "Löschungsankündigung",
      "state": "Baden-Württemberg",
      "amtsgericht": "Amtsgericht Stuttgart",
      "registernummer": "HRB 737579",
      "registerart": "HRB",
      "company_name": "KLEWOS GmbH",
      "company_seat": "Stuttgart",
      "details": "13.11.2024 (Bekanntmachungsdatum)\n\nBaden-Württemberg Amtsgericht Stuttgart HRB 737579\nLöschungsankündigung\n\nKLEWOS GmbH\nGesellschaft mit beschränkter Haftung\nStuttgart\n\nDas Gericht beabsichtigt, die Gesellschaft wegen Vermögenslosigkeit im Handelsregister von Amts wegen nach § 394 FamFG zu löschen. Die Frist zur Geltendmachung eines Widerspruchs gegen die beabsichtigte Löschung ist auf einen Monat ab Veröffentlichung bestimmt."
    },
    {
      "date": "2024-11-13",
      "id": "93352",
      "original_text": "Löschungsankündigung\nMecklenburg-Vorpommern Amtsgericht Schwerin HRB 14445\nKUBIA NORD GmbH – Neustadt Glewe",
      "type": "Löschungsankündigung",
      "state": "Mecklenburg-Vorpommern",
      "amtsgericht": "Amtsgericht Schwerin",
      "registernummer": "HRB 14445",
      "registerart": "HRB",
      "company_name": "KUBIA NORD GmbH",
      "company_seat": "Neustadt Glewe",
      "details": "13.11.2024 (Bekanntmachungsdatum)\n\nMecklenburg-Vorpommern Amtsgericht Schwerin HRB 14445\nLöschungsankündigung\n\nKUBIA NORD GmbH\nGesellschaft mit beschränkter Haftung\nNeustadt Glewe\n\nDas Registergericht beabsichtigt, die im Handelsregister eingetragene Gesellschaft von Amts wegen nach § 394 FamFG zu löschen. Die Frist zur Erhebung eines Widerspruchs gegen die beabsichtigte Löschung wird auf 1 Monat festgesetzt."
    },
    {
      "date": "2024-11-13",
      "id": "93383",
      "original_text": "Registerbekanntmachung nach dem Umwandlungsgesetz\nNordrhein-Westfalen Amtsgericht Köln HRA 37821\nKaufhof Aachen II GmbH & Co. KG – Köln",
      "type": "Registerbekanntmachung nach dem Umwandlungsgesetz",
      "state": "Nordrhein-Westfalen",
      "amtsgericht": "Amtsgericht Köln",
      "registernummer": "HRA 37821",
      "registerart": "HRA",
      "company_name": "Kaufhof Aachen II GmbH & Co. KG",
      "company_seat": "Köln",
      "details": "13.11.2024 (Bekanntmachungsdatum)\n\nNordrhein-Westfalen Amtsgericht Köln HRA 37821\nRegisterbekanntmachung nach dem Umwandlungsgesetz 13.11.2024 (Eintragungsdatum)\n\nKaufhof Aachen II GmbH & Co. KG\nKommanditgesellschaft\nKöln\n\nDen Gläubigern der an der formwechselnden Umwandlung beteiligten Rechtsträger ist, wenn sie binnen sechs Monaten nach dem Tag, an dem die Eintragung der formwechselnden Umwandlung in das Register des Sitzes derjenigen Rechtsträger deren Gläubiger sie sind, nach § 19 Absatz 3 UmwG als bekanntgemacht gilt, ihren Anspruch nach Grund und Höhe schriftlich anmelden, Sicherheit zu leisten, soweit sie nicht Befriedigung verlangen können. Dieses Recht steht den Gläubigern jedoch nur zu, wenn sie glaubhaft machen, dass durch die formwechselnden Umwandlung die Erfüllung ihrer Forderung gefährdet wird."
    },
    {
      "date": "2024-11-13",
      "id": "93398",
      "original_text": "Registerbekanntmachung nach dem Umwandlungsgesetz\nNordrhein-Westfalen Amtsgericht Köln HRA 37820\nKaufhof Mainz Schusterstraße GmbH & Co. KG – Köln",
      "type": "Registerbekanntmachung nach dem Umwandlungsgesetz",
      "state": "Nordrhein-Westfalen",
      "amtsgericht": "Amtsgericht Köln",
      "registernummer": "HRA 37820",
      "registerart": "HRA",
      "company_name": "Kaufhof Mainz Schusterstraße GmbH & Co. KG",
      "company_seat": "Köln",
      "details": "13.11.2024 (Bekanntmachungsdatum)\n\nNordrhein-Westfalen Amtsgericht Köln HRA 37820\nRegisterbekanntmachung nach dem Umwandlungsgesetz 13.11.2024 (Eintragungsdatum)\n\nKaufhof Mainz Schusterstraße GmbH & Co. KG\nKommanditgesellschaft\nKöln\n\nDen Gläubigern der an der formwechselnden Umwandlung beteiligten Rechtsträger ist, wenn sie binnen sechs Monaten nach dem Tag, an dem die Eintragung der formwechselnden Umwandlung in das Register des Sitzes derjenigen Rechtsträger deren Gläubiger sie sind, nach § 19 Absatz 3 UmwG als bekanntgemacht gilt, ihren Anspruch nach Grund und Höhe schriftlich anmelden, Sicherheit zu leisten, soweit sie nicht Befriedigung verlangen können. Dieses Recht steht den Gläubigern jedoch nur zu, wenn sie glaubhaft machen, dass durch die formwechselnden Umwandlung die Erfüllung ihrer Forderung gefährdet wird."
    },
    {
      "date": "2024-11-13",
      "id": "93419",
      "original_text": "Löschungsankündigung\nHessen Amtsgericht Hanau HRB 94187\nKinderwelt Regenbogen GmbH – Niederdorfelden",
      "type": "Löschungsankündigung",
      "state": "Hessen",
      "amtsgericht": "Amtsgericht Hanau",
      "registernummer": "HRB 94187",
      "registerart": "HRB",
      "company_name": "Kinderwelt Regenbogen GmbH",
      "company_seat": "Niederdorfelden",
      "details": "13.11.2024 (Bekanntmachungsdatum)\n\nHessen Amtsgericht Hanau HRB 94187\nLöschungsankündigung\n\nKinderwelt Regenbogen GmbH\nGesellschaft mit beschränkter Haftung\nNiederdorfelden\n\nDas Registergericht beabsichtigt die im Handelsregister eingetragene Gesellschaft von Amts wegen nach § 394 FamFG zu löschen. Die Frist zur Erhebung eines Widerspruchs gegen die beabsichtigte Löschung wird auf 3 Monate festgesetzt."
    },
    {
      "date": "2024-11-13",
      "id": "93326",
      "original_text": "Registerbekanntmachung nach dem Umwandlungsgesetz\nBaden-Württemberg Amtsgericht Stuttgart HRB 792589\nKolbenschmidt Pistons Germany GmbH – Neckarsulm",
      "type": "Registerbekanntmachung nach dem Umwandlungsgesetz",
      "state": "Baden-Württemberg",
      "amtsgericht": "Amtsgericht Stuttgart",
      "registernummer": "HRB 792589",
      "registerart": "HRB",
      "company_name": "Kolbenschmidt Pistons Germany GmbH",
      "company_seat": "Neckarsulm",
      "details": "13.11.2024 (Bekanntmachungsdatum)\n\nBaden-Württemberg Amtsgericht Stuttgart HRB 792589\nRegisterbekanntmachung nach dem Umwandlungsgesetz 13.11.2024 (Eintragungsdatum)\n\nKolbenschmidt Pistons Germany GmbH\nGesellschaft mit beschränkter Haftung\nNeckarsulm\n\nAls nicht eingetragen wird bekanntgemacht:\nDen Gläubigern der an der Verschmelzung beteiligten Rechtsträger ist, wenn sie binnen sechs Monaten nach dem Tag, an dem die Eintragung der Verschmelzung in das Register des Sitzes desjenigen Rechtsträgers, dessen Gläubiger sie sind, nach § 19 Abs. 3 UmwG als bekanntgemacht gilt, ihren Anspruch nach Grund und Höhe schriftlich anmelden, Sicherheit zu leisten, soweit sie nicht Befriedigung verlangen können. Dieses Recht steht den Gläubigern jedoch nur zu, wenn sie glaubhaft machen, dass durch die Verschmelzung die Erfüllung ihrer Forderung gefährdet wird."
    },
    {
      "date": "2024-11-13",
      "id": "93334",
      "original_text": "Registerbekanntmachung nach dem Umwandlungsgesetz\nHamburg Amtsgericht Hamburg HRB 169831\nKontrast Vermögensverwaltung GmbH – Hamburg",
      "type": "Registerbekanntmachung nach dem Umwandlungsgesetz",
      "state": "Hamburg",
      "amtsgericht": "Amtsgericht Hamburg",
      "registernummer": "HRB 169831",
      "registerart": "HRB",
      "company_name": "Kontrast Vermögensverwaltung GmbH",
      "company_seat": "Hamburg",
      "details": "13.11.2024 (Bekanntmachungsdatum)\n\nHamburg Amtsgericht Hamburg HRB 169831\nRegisterbekanntmachung nach dem Umwandlungsgesetz 13.11.2024 (Eintragungsdatum)\n\nKontrast Vermögensverwaltung GmbH\nGesellschaft mit beschränkter Haftung\nHamburg\n\nAls nicht eingetragen wird bekannt gemacht:\nDen Gläubigern der an der Verschmelzung beteiligten Gesellschaften ist, wenn sie binnen sechs Monaten nach dem Tag, an dem die Eintragung der Verschmelzung in das Register des Sitzes desjenigen Rechtsträgers, dessen Gläubiger sie sind, nach § 19 Absatz 3 UmwG als bekannt gemacht gilt, ihren Anspruch nach Grund und Höhe schriftlich anmelden, Sicherheit zu leisten, soweit sie nicht Befriedigung verlangen können. Dieses Recht steht den Gläubigern jedoch nur zu, wenn sie glaubhaft machen, dass durch die Verschmelzung die Erfüllung ihrer Forderung gefährdet wird."
    },
    {
      "date": "2024-11-13",
      "id": "93338",
      "original_text": "Einreichung neuer Dokumente\nHamburg Amtsgericht Hamburg HRB 75492\nLAIQON AG – Hamburg",
      "type": "Einreichung neuer Dokumente",
      "state": "Hamburg",
      "amtsgericht": "Amtsgericht Hamburg",
      "registernummer": "HRB 75492",
      "registerart": "HRB",
      "company_name": "LAIQON AG",
      "company_seat": "Hamburg",
      "details": "13.11.2024 (Bekanntmachungsdatum)\n\nHamburg Amtsgericht Hamburg HRB 75492\nEinreichung neuer Dokumente\n\nLAIQON AG\nAktiengesellschaft\nHamburg\n\nAls nicht eingetragen wird bekannt gemacht: Liste des Aufsichtsrats wurde eingereicht."
    },
    {
      "date": "2024-11-13",
      "id": "93408",
      "original_text": "Registerbekanntmachung nach dem Umwandlungsgesetz\nThüringen Amtsgericht Jena HRB 401431\nLINDIG Fördertechnik GmbH – Krauthausen",
      "type": "Registerbekanntmachung nach dem Umwandlungsgesetz",
      "state": "Thüringen",
      "amtsgericht": "Amtsgericht Jena",
      "registernummer": "HRB 401431",
      "registerart": "HRB",
      "company_name": "LINDIG Fördertechnik GmbH",
      "company_seat": "Krauthausen",
      "details": "13.11.2024 (Bekanntmachungsdatum)\n\nThüringen Amtsgericht Jena HRB 401431\nRegisterbekanntmachung nach dem Umwandlungsgesetz 13.11.2024 (Eintragungsdatum)\n\nLINDIG Fördertechnik GmbH\nGesellschaft mit beschränkter Haftung\nKrauthausen\n\nNicht eingetragen: Den Gläubigern der an der Verschmelzung beteiligten Rechtsträger, ist wenn sie binnen sechs Monaten nach dem Tag, an dem die Eintragung der Verschmelzung in das Register des Sitzes desjenigen Rechtsträgers, dessen Gläubiger sie sind,  nach § 19 Abs. 3 UmwG als bekanntgemacht gilt, ihren Anspruch nach Grund und Höhe schriftlich anmelden, Sicherheit zu leisten, soweit sie nicht Befriedigung verlangen können. Dieses Recht steht ihnen jedoch nur zu, wenn sie glaubhaft machen, daß durch die Verschmelzung die Erfüllung ihrer Forderung gefährdet wird."
    },
    {
      "date": "2024-11-13",
      "id": "93340",
      "original_text": "Einreichung neuer Dokumente\nThüringen Amtsgericht Jena HRB 306799\nLSIM Lerchenberg Service und Immobilienmanagement GmbH – Zella-Mehlis",
      "type": "Einreichung neuer Dokumente",
      "state": "Thüringen",
      "amtsgericht": "Amtsgericht Jena",
      "registernummer": "HRB 306799",
      "registerart": "HRB",
      "company_name": "LSIM Lerchenberg Service und Immobilienmanagement GmbH",
      "company_seat": "Zella-Mehlis",
      "details": "13.11.2024 (Bekanntmachungsdatum)\n\nThüringen Amtsgericht Jena HRB 306799\nEinreichung neuer Dokumente\n\nLSIM Lerchenberg Service und Immobilienmanagement GmbH\nGesellschaft mit beschränkter Haftung\nZella-Mehlis\n\nBekanntmachung gem. § 52 Abs. 3 Satz 2 GmbHG: Aufgrund einer Veränderung in den Personen der Aufsichtsratsmitglieder ist durch die Geschäftsführer eine neue Liste zum Handelsregister eingereicht worden."
    },
    {
      "date": "2024-11-13",
      "id": "93335",
      "original_text": "Löschungsankündigung\nBerlin Amtsgericht Berlin (Charlottenburg) HRB 156296\nLavastar Entertainment UG (haftungsbeschränkt) – Berlin",
      "type": "Löschungsankündigung",
      "state": "Berlin",
      "amtsgericht": "Amtsgericht Berlin (Charlottenburg)",
      "registernummer": "HRB 156296",
      "registerart": "HRB",
      "company_name": "Lavastar Entertainment UG (haftungsbeschränkt)",
      "company_seat": "Berlin",
      "details": "13.11.2024 (Bekanntmachungsdatum)\n\nBerlin Amtsgericht Berlin (Charlottenburg) HRB 156296\nLöschungsankündigung\n\nLavastar Entertainment UG (haftungsbeschränkt)\nGesellschaft mit beschränkter Haftung\nBerlin\n\nBei der nachstehenden Gesellschaft wird das Amtslöschungsverfahren gemäß § 394 FamFG eingeleitet. Widerspruchsfrist 6 Wochen"
    },
    {
      "date": "2024-11-13",
      "id": "93425",
      "original_text": "Registerbekanntmachung nach dem Umwandlungsgesetz\nHessen Amtsgericht Frankfurt am Main HRB 128865\nLifeFit Group MidCo GmbH – Frankfurt am Main",
      "type": "Registerbekanntmachung nach dem Umwandlungsgesetz",
      "state": "Hessen",
      "amtsgericht": "Amtsgericht Frankfurt am Main",
      "registernummer": "HRB 128865",
      "registerart": "HRB",
      "company_name": "LifeFit Group MidCo GmbH",
      "company_seat": "Frankfurt am Main",
      "details": "13.11.2024 (Bekanntmachungsdatum)\n\nHessen Amtsgericht Frankfurt am Main HRB 128865\nRegisterbekanntmachung nach dem Umwandlungsgesetz 13.11.2024 (Eintragungsdatum)\n\nLifeFit Group MidCo GmbH\nGesellschaft mit beschränkter Haftung\nFrankfurt am Main\n\nDen Gläubigern der an der Verschmelzung beteiligten Rechtsträger ist, wenn sie binnen sechs Monaten nach dem Tag, an dem die Eintragung der Verschmelzung in das Register des Sitzes desjenigen Rechtsträgers, dessen Gläubiger sie sind, nach § 19 Absatz 3 UmwG bekannt gemacht worden ist, ihren Anspruch nach Grund und Höhe schriftlich anmelden, Sicherheit zu leisten, soweit sie nicht Befriedigung verlangen können. Dieses Recht steht den Gläubigern jedoch nur zu, wenn sie glaubhaft machen, dass durch die Verschmelzung die Erfüllung ihrer Forderung gefährdet wird."
    },
    {
      "date": "2024-11-13",
      "id": "93391",
      "original_text": "Registerbekanntmachung nach dem Umwandlungsgesetz\nBremen Amtsgericht Bremen HRB 27199\nLittelfuse Europe GmbH – Bremen",
      "type": "Registerbekanntmachung nach dem Umwandlungsgesetz",
      "state": "Bremen",
      "amtsgericht": "Amtsgericht Bremen",
      "registernummer": "HRB 27199",
      "registerart": "HRB",
      "company_name": "Littelfuse Europe GmbH",
      "company_seat": "Bremen",
      "details": "13.11.2024 (Bekanntmachungsdatum)\n\nBremen Amtsgericht Bremen HRB 27199\nRegisterbekanntmachung nach dem Umwandlungsgesetz 12.11.2024 (Eintragungsdatum)\n\nLittelfuse Europe GmbH\nGesellschaft mit beschränkter Haftung\nBremen\n\nZu Eintragungsnummer 15 vom 12.11.2024 wird als nicht eingetragen veröffentlicht: Den Gläubigern der an der Verschmelzung beteiligten Rechtsträger ist, wenn sie binnen sechs Monaten nach dem Tag, an dem die Eintragung der Verschmelzung in das Register des Sitzes desjenigen Rechtsträgers, dessen Gläubiger sie sind, als bekannt gemacht gilt, ihren Anspruch nach Grund und Höhe schriftlich anmelden, Sicherheit zu leisten, soweit sie nicht Befriedigung verlangen können. Dieses Recht steht den Gläubigern jedoch nur zu, wenn sie glaubhaft machen, dass durch die Verschmelzung die Erfüllung ihrer Forderung gefährdet wird. Das Recht, Sicherheitsleistung zu verlangen, steht Gläubigern nicht zu, die im Falle der Insolvenz ein Recht auf vorzugsweise Befriedigung aus einer Deckungsmasse haben, die nach gesetzlicher Vorschrift zu ihrem Schutz errichtet und staatlich überwacht ist."
    },
    {
      "date": "2024-11-13",
      "id": "93321",
      "original_text": "Löschungsankündigung\nBaden-Württemberg Amtsgericht Stuttgart HRB 757273\nM.A. Dienstleistungen und Logistik GmbH – Renningen",
      "type": "Löschungsankündigung",
      "state": "Baden-Württemberg",
      "amtsgericht": "Amtsgericht Stuttgart",
      "registernummer": "HRB 757273",
      "registerart": "HRB",
      "company_name": "M.A. Dienstleistungen und Logistik GmbH",
      "company_seat": "Renningen",
      "details": "13.11.2024 (Bekanntmachungsdatum)\n\nBaden-Württemberg Amtsgericht Stuttgart HRB 757273\nLöschungsankündigung\n\nM.A. Dienstleistungen und Logistik GmbH\nGesellschaft mit beschränkter Haftung\nRenningen\n\nDas Gericht beabsichtigt, die Gesellschaft wegen Vermögenslosigkeit im Handelsregister von Amts wegen nach § 394 FamFG zu löschen. Die Frist zur Geltendmachung eines Widerspruchs gegen die beabsichtigte Löschung ist auf zwei Monate ab Veröffentlichung bestimmt."
    },
    {
      "date": "2024-11-13",
      "id": "93421",
      "original_text": "Registerbekanntmachung nach dem Umwandlungsgesetz\nHessen Amtsgericht Frankfurt am Main HRB 111370\nMAGIX Warehouse GmbH – Frankfurt am Main",
      "type": "Registerbekanntmachung nach dem Umwandlungsgesetz",
      "state": "Hessen",
      "amtsgericht": "Amtsgericht Frankfurt am Main",
      "registernummer": "HRB 111370",
      "registerart": "HRB",
      "company_name": "MAGIX Warehouse GmbH",
      "company_seat": "Frankfurt am Main",
      "details": "13.11.2024 (Bekanntmachungsdatum)\n\nHessen Amtsgericht Frankfurt am Main HRB 111370\nRegisterbekanntmachung nach dem Umwandlungsgesetz 13.11.2024 (Eintragungsdatum)\n\nMAGIX Warehouse GmbH\nGesellschaft mit beschränkter Haftung\nFrankfurt am Main\n\nDen Gläubigern der an der Verschmelzung beteiligten Rechtsträger ist, wenn sie binnen sechs Monaten nach dem Tag, an dem die Eintragung der Verschmelzung in das Register des Sitzes desjenigen Rechtsträgers, dessen Gläubiger sie sind, nach § 19 Absatz 3 UmwG bekannt gemacht worden ist, ihren Anspruch nach Grund und Höhe schriftlich anmelden, Sicherheit zu leisten, soweit sie nicht Befriedigung verlangen können. Dieses Recht steht den Gläubigern jedoch nur zu, wenn sie glaubhaft machen, dass durch die Verschmelzung die Erfüllung ihrer Forderung gefährdet wird."
    },
    {
      "date": "2024-11-13",
      "id": "93414",
      "original_text": "Löschungsankündigung\nHessen Amtsgericht Hanau HRA 92522\nMD Kommunikations GmbH & Co. KG – Bad Soden-Salmünster",
      "type": "Löschungsankündigung",
      "state": "Hessen",
      "amtsgericht": "Amtsgericht Hanau",
      "registernummer": "HRA 92522",
      "registerart": "HRA",
      "company_name": "MD Kommunikations GmbH & Co. KG",
      "company_seat": "Bad Soden-Salmünster",
      "details": "13.11.2024 (Bekanntmachungsdatum)\n\nHessen Amtsgericht Hanau HRA 92522\nLöschungsankündigung\n\nMD Kommunikations GmbH & Co. KG\nKommanditgesellschaft\nBad Soden-Salmünster\n\nDas Registergericht beabsichtigt die im Handelsregister eingetragene Firma von Amts wegen nach § 394 FamFG zu löschen. Die Frist zur Erhebung eines Widerspruchs gegen die beabsichtigte Löschung wird auf 3 Monate festgesetzt."
    },
    {
      "date": "2024-11-13",
      "id": "93403",
      "original_text": "Sonstige Registerbekanntmachung\nNordrhein-Westfalen Amtsgericht Mönchengladbach HRB 5672\nMEDIA CENTRAL Gesellschaft für Handelskommunikation und Marketing mbH – Mönchengladbach",
      "type": "Sonstige Registerbekanntmachung",
      "state": "Nordrhein-Westfalen",
      "amtsgericht": "Amtsgericht Mönchengladbach",
      "registernummer": "HRB 5672",
      "registerart": "HRB",
      "company_name": "MEDIA CENTRAL Gesellschaft für Handelskommunikation und Marketing mbH",
      "company_seat": "Mönchengladbach",
      "details": "13.11.2024 (Bekanntmachungsdatum)\n\nNordrhein-Westfalen Amtsgericht Mönchengladbach HRB 5672\nSonstige Registerbekanntmachung 13.11.2024 (Eintragungsdatum)\n\nMEDIA CENTRAL Gesellschaft für Handelskommunikation und Marketing mbH\nGesellschaft mit beschränkter Haftung\nMönchengladbach\n\nAls nicht eingetragen wird veröffentlicht: Den Gläubigern der Gesellschaft, deren Forderungen begründet worden sind bevor die Eintragung der Beendigung des Ergebnisabführungsvertrags in das Handelsregister nach § 10 des Handelsgesetzbuches als bekanntgemacht gilt, hat der andere Vertragsteil Sicherheit zu leisten, wenn sie sich binnen sechs Monaten nach der Bekanntmachung der Eintragung zu diesem Zweck bei ihm melden."
    },
    {
      "date": "2024-11-13",
      "id": "93372",
      "original_text": "Löschungsankündigung\nRheinland-Pfalz Amtsgericht Mainz HRB 6950\nMV Holiday Verwaltungsgesellschaft mbH – Mainz",
      "type": "Löschungsankündigung",
      "state": "Rheinland-Pfalz",
      "amtsgericht": "Amtsgericht Mainz",
      "registernummer": "HRB 6950",
      "registerart": "HRB",
      "company_name": "MV Holiday Verwaltungsgesellschaft mbH",
      "company_seat": "Mainz",
      "details": "13.11.2024 (Bekanntmachungsdatum)\n\nRheinland-Pfalz Amtsgericht Mainz HRB 6950\nLöschungsankündigung\n\nMV Holiday Verwaltungsgesellschaft mbH\nGesellschaft mit beschränkter Haftung\nMainz\n\nDas Registergericht beabsichtigt die Gesellschaft von Amts wegen nach § 394 FamFG zu löschen. Die Frist zur Erhebung eines Widerspruchs ist auf einen Monat festgesetzt."
    },
    {
      "date": "2024-11-13",
      "id": "93369",
      "original_text": "Löschungsankündigung\nNiedersachsen Amtsgericht Hildesheim HRB 208692\nMZ Gastro UG (haftungsbeschränkt) – Hildesheim",
      "type": "Löschungsankündigung",
      "state": "Niedersachsen",
      "amtsgericht": "Amtsgericht Hildesheim",
      "registernummer": "HRB 208692",
      "registerart": "HRB",
      "company_name": "MZ Gastro UG (haftungsbeschränkt)",
      "company_seat": "Hildesheim",
      "details": "13.11.2024 (Bekanntmachungsdatum)\n\nNiedersachsen Amtsgericht Hildesheim HRB 208692\nLöschungsankündigung\n\nMZ Gastro UG (haftungsbeschränkt)\nGesellschaft mit beschränkter Haftung\nHildesheim\n\nDas Registergericht beabsichtigt, die Gesellschaft von Amts wegen nach § 394 FamFG zu löschen. Die Frist zur Erhebung eines Widerspruchs ist auf 1 Monat ab dieser Registerbekanntmachung festgesetzt."
    },
    {
      "date": "2024-11-13",
      "id": "93331",
      "original_text": "Registerbekanntmachung nach dem Umwandlungsgesetz\nSchleswig-Holstein Amtsgericht Pinneberg HRA 9806\nMengel GmbH & Co. KG – Vaale",
      "type": "Registerbekanntmachung nach dem Umwandlungsgesetz",
      "state": "Schleswig-Holstein",
      "amtsgericht": "Amtsgericht Pinneberg",
      "registernummer": "HRA 9806",
      "registerart": "HRA",
      "company_name": "Mengel GmbH & Co. KG",
      "company_seat": "Vaale",
      "details": "13.11.2024 (Bekanntmachungsdatum)\n\nSchleswig-Holstein Amtsgericht Pinneberg HRA 9806\nRegisterbekanntmachung nach dem Umwandlungsgesetz 06.11.2024 (Eintragungsdatum)\n\nMengel GmbH & Co. KG\nKommanditgesellschaft\nVaale\n\nZu Eintragungsnummer 2 vom 06.11.2024 wird als nicht eingetragen veröffentlicht: Den Gläubigern der an der Spaltung beteiligten Rechtsträger ist, wenn sie binnen sechs Monaten nach dem Tag, an dem die Eintragung der Spaltung in das Register des Sitzes desjenigen Rechtsträgers, dessen Gläubiger sie sind, als bekannt gemacht gilt, ihren Anspruch nach Grund und Höhe schriftlich anmelden, Sicherheit zu leisten, soweit sie nicht Befriedigung verlangen können. Dieses Recht steht den Gläubigern jedoch nur zu, wenn sie glaubhaft machen, dass durch die Spaltung die Erfüllung ihrer Forderung gefährdet wird. Das Recht, Sicherheitsleistung zu verlangen, steht Gläubigern nicht zu, die im Falle der Insolvenz ein Recht auf vorzugsweise Befriedigung aus einer Deckungsmasse haben, die nach gesetzlicher Vorschrift zu ihrem Schutz errichtet und staatlich überwacht ist."
    },
    {
      "date": "2024-11-13",
      "id": "93319",
      "original_text": "Löschungsankündigung\nBayern Amtsgericht Traunstein HRA 2687\nModerne Lagertechnik Michael-Lohs & Neubert OHG – Traunreut",
      "type": "Löschungsankündigung",
      "state": "Bayern",
      "amtsgericht": "Amtsgericht Traunstein",
      "registernummer": "HRA 2687",
      "registerart": "HRA",
      "company_name": "Moderne Lagertechnik Michael-Lohs & Neubert OHG",
      "company_seat": "Traunreut",
      "details": "13.11.2024 (Bekanntmachungsdatum)\n\nBayern Amtsgericht Traunstein HRA 2687\nLöschungsankündigung\n\nModerne Lagertechnik Michael-Lohs & Neubert OHG\nOffene Handelsgesellschaft\nTraunreut\n\nDas Registergericht beabsichtigt, die im Handelsregister eingetragene Firma von Amts wegen nach § 31 Abs. 2 HGB zu löschen. Die Frist zur Erhebung eines Widerspruchs ist auf 2 Monate festgesetzt."
    },
    {
      "date": "2024-11-13",
      "id": "93381",
      "original_text": "Löschungsankündigung\nNordrhein-Westfalen Amtsgericht Köln HRB 93666\nNES Speichersysteme GmbH – Erftstadt",
      "type": "Löschungsankündigung",
      "state": "Nordrhein-Westfalen",
      "amtsgericht": "Amtsgericht Köln",
      "registernummer": "HRB 93666",
      "registerart": "HRB",
      "company_name": "NES Speichersysteme GmbH",
      "company_seat": "Erftstadt",
      "details": "13.11.2024 (Bekanntmachungsdatum)\n\nNordrhein-Westfalen Amtsgericht Köln HRB 93666\nLöschungsankündigung\n\nNES Speichersysteme GmbH\nGesellschaft mit beschränkter Haftung\nErftstadt\n\nDas Registergericht beabsichtigt die Gesellschaft von Amts wegen nach § 394 FamFG zu löschen. Die Frist zur Erhebung eines Widerspruchs ist auf einen Monat festgesetzt."
    },
    {
      "date": "2024-11-13",
      "id": "93317",
      "original_text": "Einreichung neuer Dokumente\nBayern Amtsgericht München HRB 234740\nNOVENTI Health SE – München",
      "type": "Einreichung neuer Dokumente",
      "state": "Bayern",
      "amtsgericht": "Amtsgericht München",
      "registernummer": "HRB 234740",
      "registerart": "HRB",
      "company_name": "NOVENTI Health SE",
      "company_seat": "München",
      "details": "13.11.2024 (Bekanntmachungsdatum)\n\nBayern Amtsgericht München HRB 234740\nEinreichung neuer Dokumente 01.11.2024 (Eintragungsdatum)\n\nNOVENTI Health SE\nEuropäische Aktiengesellschaft (SE)\nMünchen\n\nDem Amtsgericht München -Registergericht- ist eine Liste der Mitglieder des Aufsichtsrats eingereicht worden, Art. 9 Abs. 1 Buchst. c (ii) SE-VO i.V.m. § 106 AktG."
    },
    {
      "date": "2024-11-13",
      "id": "93422",
      "original_text": "Registerbekanntmachung nach dem Umwandlungsgesetz\nHessen Amtsgericht Frankfurt am Main HRB 108357\nNeapco Europe Service GmbH – Frankfurt am Main",
      "type": "Registerbekanntmachung nach dem Umwandlungsgesetz",
      "state": "Hessen",
      "amtsgericht": "Amtsgericht Frankfurt am Main",
      "registernummer": "HRB 108357",
      "registerart": "HRB",
      "company_name": "Neapco Europe Service GmbH",
      "company_seat": "Frankfurt am Main",
      "details": "13.11.2024 (Bekanntmachungsdatum)\n\nHessen Amtsgericht Frankfurt am Main HRB 108357\nRegisterbekanntmachung nach dem Umwandlungsgesetz 25.09.2024 (Eintragungsdatum)\n\nNeapco Europe Service GmbH\nGesellschaft mit beschränkter Haftung\nFrankfurt am Main\n\nDen Gläubigern der an der Verschmelzung beteiligten Rechtsträger ist, wenn sie binnen sechs Monaten nach dem Tag, an dem die Eintragung der Verschmelzung in das Register des Sitzes desjenigen Rechtsträgers, dessen Gläubiger sie sind, nach § 19 Absatz 3 UmwG bekannt gemacht worden ist, ihren Anspruch nach Grund und Höhe schriftlich anmelden, Sicherheit zu leisten, soweit sie nicht Befriedigung verlangen können. Dieses Recht steht den Gläubigern jedoch nur zu, wenn sie glaubhaft machen, dass durch die Verschmelzung die Erfüllung ihrer Forderung gefährdet wird."
    },
    {
      "date": "2024-11-13",
      "id": "93339",
      "original_text": "Registerbekanntmachung nach dem Umwandlungsgesetz\nBaden-Württemberg Amtsgericht Stuttgart HRB 104011\nNeuffer Malerwerkstätte GmbH – Heilbronn",
      "type": "Registerbekanntmachung nach dem Umwandlungsgesetz",
      "state": "Baden-Württemberg",
      "amtsgericht": "Amtsgericht Stuttgart",
      "registernummer": "HRB 104011",
      "registerart": "HRB",
      "company_name": "Neuffer Malerwerkstätte GmbH",
      "company_seat": "Heilbronn",
      "details": "13.11.2024 (Bekanntmachungsdatum)\n\nBaden-Württemberg Amtsgericht Stuttgart HRB 104011\nRegisterbekanntmachung nach dem Umwandlungsgesetz 13.11.2024 (Eintragungsdatum)\n\nNeuffer Malerwerkstätte GmbH\nGesellschaft mit beschränkter Haftung\nHeilbronn\n\nAls nicht eingetragen wird bekanntgemacht:\nDen Gläubigern der an der Verschmelzung beteiligten Rechtsträger ist, wenn sie binnen sechs Monaten nach dem Tag, an dem die Eintragung der Verschmelzung in das Register des Sitzes desjenigen Rechtsträgers, dessen Gläubiger sie sind, nach § 19 Abs. 3 UmwG als bekanntgemacht gilt, ihren Anspruch nach Grund und Höhe schriftlich anmelden, Sicherheit zu leisten, soweit sie nicht Befriedigung verlangen können. Dieses Recht steht den Gläubigern jedoch nur zu, wenn sie glaubhaft machen, dass durch die Verschmelzung die Erfüllung ihrer Forderung gefährdet wird."
    },
    {
      "date": "2024-11-13",
      "id": "93394",
      "original_text": "Löschungsankündigung\nNordrhein-Westfalen Amtsgericht Gütersloh HRB 11836\nOWL Fassaden GmbH – Gütersloh",
      "type": "Löschungsankündigung",
      "state": "Nordrhein-Westfalen",
      "amtsgericht": "Amtsgericht Gütersloh",
      "registernummer": "HRB 11836",
      "registerart": "HRB",
      "company_name": "OWL Fassaden GmbH",
      "company_seat": "Gütersloh",
      "details": "13.11.2024 (Bekanntmachungsdatum)\n\nNordrhein-Westfalen Amtsgericht Gütersloh HRB 11836\nLöschungsankündigung 13.11.2024 (Eintragungsdatum)\n\nOWL Fassaden GmbH\nGesellschaft mit beschränkter Haftung\nGütersloh\n\nDas Registergericht beabsichtigt die Gesellschaft von Amts wegen nach § 394 FamFG zu löschen. Die Frist zur Erhebung eines Widerspruchs ist auf einen Monat festgesetzt."
    },
    {
      "date": "2024-11-13",
      "id": "93388",
      "original_text": "Einreichung neuer Dokumente\nNordrhein-Westfalen Amtsgericht Essen HRB 27613\nPCC Services GmbH der Deutschen Bank – Essen",
      "type": "Einreichung neuer Dokumente",
      "state": "Nordrhein-Westfalen",
      "amtsgericht": "Amtsgericht Essen",
      "registernummer": "HRB 27613",
      "registerart": "HRB",
      "company_name": "PCC Services GmbH der Deutschen Bank",
      "company_seat": "Essen",
      "details": "13.11.2024 (Bekanntmachungsdatum)\n\nNordrhein-Westfalen Amtsgericht Essen HRB 27613\nEinreichung neuer Dokumente\n\nPCC Services GmbH der Deutschen Bank\nGesellschaft mit beschränkter Haftung\nEssen\n\nDem Registergericht ist eine neue Liste der Mitglieder des Aufsichtsrates eingereicht worden."
    },
    {
      "date": "2024-11-13",
      "id": "93406",
      "original_text": "Registerbekanntmachung nach dem Umwandlungsgesetz\nThüringen Amtsgericht Jena HRB 521684\nPRINT Medien- und Verlagsgesellschaft mbH – Zeulenroda-Triebes",
      "type": "Registerbekanntmachung nach dem Umwandlungsgesetz",
      "state": "Thüringen",
      "amtsgericht": "Amtsgericht Jena",
      "registernummer": "HRB 521684",
      "registerart": "HRB",
      "company_name": "PRINT Medien- und Verlagsgesellschaft mbH",
      "company_seat": "Zeulenroda-Triebes",
      "details": "13.11.2024 (Bekanntmachungsdatum)\n\nThüringen Amtsgericht Jena HRB 521684\nRegisterbekanntmachung nach dem Umwandlungsgesetz 13.11.2024 (Eintragungsdatum)\n\nPRINT Medien- und Verlagsgesellschaft mbH\nGesellschaft mit beschränkter Haftung\nZeulenroda-Triebes\n\nNicht eingetragen: Den Gläubigern der an der Verschmelzung beteiligten Rechtsträger, ist wenn sie binnen sechs Monaten nach dem Tag, an dem die Eintragung der Verschmelzung in das Register des Sitzes desjenigen Rechtsträgers, dessen Gläubiger sie sind,  nach § 19 Abs. 3 UmwG als bekanntgemacht gilt, ihren Anspruch nach Grund und Höhe schriftlich anmelden, Sicherheit zu leisten, soweit sie nicht Befriedigung verlangen können. Dieses Recht steht ihnen jedoch nur zu, wenn sie glaubhaft machen, daß durch die Verschmelzung die Erfüllung ihrer Forderung gefährdet wird."
    },
    {
      "date": "2024-11-13",
      "id": "93337",
      "original_text": "Registerbekanntmachung nach dem Umwandlungsgesetz\nBaden-Württemberg Amtsgericht Mannheim HRB 107658\nPSI GridConnect GmbH – Karlsruhe",
      "type": "Registerbekanntmachung nach dem Umwandlungsgesetz",
      "state": "Baden-Württemberg",
      "amtsgericht": "Amtsgericht Mannheim",
      "registernummer": "HRB 107658",
      "registerart": "HRB",
      "company_name": "PSI GridConnect GmbH",
      "company_seat": "Karlsruhe",
      "details": "13.11.2024 (Bekanntmachungsdatum)\n\nBaden-Württemberg Amtsgericht Mannheim HRB 107658\nRegisterbekanntmachung nach dem Umwandlungsgesetz 13.11.2024 (Eintragungsdatum)\n\nPSI GridConnect GmbH\nGesellschaft mit beschränkter Haftung\nKarlsruhe\n\nAls nicht eingetragen wird bekanntgemacht: Den Gläubigern der an der Verschmelzung beteiligten Rechtsträger ist, wenn sie binnen sechs Monaten nach dem Tag, an dem die Eintragung der Verschmelzung in das Register des Sitzes desjenigen Rechtsträgers, dessen Gläubiger sie sind, nach § 19 Abs. 3 UmwG als bekanntgemacht gilt, ihren Anspruch nach Grund und Höhe schriftlich anmelden, Sicherheit zu leisten, soweit sie nicht Befriedigung verlangen können. Dieses Recht steht den Gläubigern jedoch nur zu, wenn sie glaubhaft machen, dass durch die Verschmelzung die Erfüllung ihrer Forderung gefährdet wird."
    },
    {
      "date": "2024-11-13",
      "id": "93357",
      "original_text": "Löschungsankündigung\nSachsen Amtsgericht Dresden HRB 13216\nPhänomen Maschinen- und Vorrichtungsbau GmbH – Zittau",
      "type": "Löschungsankündigung",
      "state": "Sachsen",
      "amtsgericht": "Amtsgericht Dresden",
      "registernummer": "HRB 13216",
      "registerart": "HRB",
      "company_name": "Phänomen Maschinen- und Vorrichtungsbau GmbH",
      "company_seat": "Zittau",
      "details": "13.11.2024 (Bekanntmachungsdatum)\n\nSachsen Amtsgericht Dresden HRB 13216\nLöschungsankündigung\n\nPhänomen Maschinen- und Vorrichtungsbau GmbH\nGesellschaft mit beschränkter Haftung\nZittau\n\nDas Registergericht beabsichtigt, die im Handelsregister eingetragene Gesellschaft von Amts wegen nach § 394 FamFG zu löschen. Die Frist zu Erhebung eines Widerspruchs gegen die beabsichtigte Löschung wird auf einen Monat festgesetzt."
    },
    {
      "date": "2024-11-13",
      "id": "93330",
      "original_text": "Löschungsankündigung\nBerlin Amtsgericht Berlin (Charlottenburg) HRB 162512\nPrime Vertrieb UG (haftungsbeschränkt) – Berlin",
      "type": "Löschungsankündigung",
      "state": "Berlin",
      "amtsgericht": "Amtsgericht Berlin (Charlottenburg)",
      "registernummer": "HRB 162512",
      "registerart": "HRB",
      "company_name": "Prime Vertrieb UG (haftungsbeschränkt)",
      "company_seat": "Berlin",
      "details": "13.11.2024 (Bekanntmachungsdatum)\n\nBerlin Amtsgericht Berlin (Charlottenburg) HRB 162512\nLöschungsankündigung\n\nPrime Vertrieb UG (haftungsbeschränkt)\nGesellschaft mit beschränkter Haftung\nBerlin\n\nBei der nachstehenden Gesellschaft wird das Amtslöschungsverfahren gemäß § 394 FamFG eingeleitet. Widerspruchsfrist 6 Wochen"
    },
    {
      "date": "2024-11-13",
      "id": "93365",
      "original_text": "Löschungsankündigung\nNiedersachsen Amtsgericht Tostedt HRB 206666\nPrint for Friends UG (haftungsbeschränkt) – Buchholz in der Nordheide",
      "type": "Löschungsankündigung",
      "state": "Niedersachsen",
      "amtsgericht": "Amtsgericht Tostedt",
      "registernummer": "HRB 206666",
      "registerart": "HRB",
      "company_name": "Print for Friends UG (haftungsbeschränkt)",
      "company_seat": "Buchholz in der Nordheide",
      "details": "13.11.2024 (Bekanntmachungsdatum)\n\nNiedersachsen Amtsgericht Tostedt HRB 206666\nLöschungsankündigung\n\nPrint for Friends UG (haftungsbeschränkt)\nGesellschaft mit beschränkter Haftung\nBuchholz in der Nordheide\n\nDas Registergericht beabsichtigt, die Gesellschaft von Amts wegen nach § 394 FamFG zu löschen. Die Frist zur Erhebung eines Widerspruchs ist auf 1 Monat ab dieser Registerbekanntmachung festgesetzt."
    },
    {
      "date": "2024-11-13",
      "id": "93380",
      "original_text": "Löschungsankündigung\nNordrhein-Westfalen Amtsgericht Gütersloh HRB 11636\nProAster GmbH – Verl",
      "type": "Löschungsankündigung",
      "state": "Nordrhein-Westfalen",
      "amtsgericht": "Amtsgericht Gütersloh",
      "registernummer": "HRB 11636",
      "registerart": "HRB",
      "company_name": "ProAster GmbH",
      "company_seat": "Verl",
      "details": "13.11.2024 (Bekanntmachungsdatum)\n\nNordrhein-Westfalen Amtsgericht Gütersloh HRB 11636\nLöschungsankündigung\n\nProAster GmbH\nGesellschaft mit beschränkter Haftung\nVerl\n\nDas Registergericht beabsichtigt die Gesellschaft von Amts wegen nach § 394 FamFG zu löschen. Die Frist zur Erhebung eines Widerspruchs ist auf einen Monat festgesetzt."
    },
    {
      "date": "2024-11-13",
      "id": "93362",
      "original_text": "Löschungsankündigung\nNiedersachsen Amtsgericht Tostedt HRB 206050\nProveritec GmbH – Otterndorf",
      "type": "Löschungsankündigung",
      "state": "Niedersachsen",
      "amtsgericht": "Amtsgericht Tostedt",
      "registernummer": "HRB 206050",
      "registerart": "HRB",
      "company_name": "Proveritec GmbH",
      "company_seat": "Otterndorf",
      "details": "13.11.2024 (Bekanntmachungsdatum)\n\nNiedersachsen Amtsgericht Tostedt HRB 206050\nLöschungsankündigung\n\nProveritec GmbH\nGesellschaft mit beschränkter Haftung\nOtterndorf\n\nDas Registergericht beabsichtigt, die Gesellschaft von Amts wegen nach § 394 FamFG zu löschen. Die Frist zur Erhebung eines Widerspruchs ist auf 1 Monat ab dieser Registerbekanntmachung festgesetzt."
    },
    {
      "date": "2024-11-13",
      "id": "93360",
      "original_text": "Löschungsankündigung\nNiedersachsen Amtsgericht Hannover HRB 210757\nQabel GmbH – Hannover",
      "type": "Löschungsankündigung",
      "state": "Niedersachsen",
      "amtsgericht": "Amtsgericht Hannover",
      "registernummer": "HRB 210757",
      "registerart": "HRB",
      "company_name": "Qabel GmbH",
      "company_seat": "Hannover",
      "details": "13.11.2024 (Bekanntmachungsdatum)\n\nNiedersachsen Amtsgericht Hannover HRB 210757\nLöschungsankündigung\n\nQabel GmbH\nGesellschaft mit beschränkter Haftung\nHannover\n\nDas Registergericht beabsichtigt, die Gesellschaft von Amts wegen nach § 394 FamFG zu löschen. Die Frist zur Erhebung eines Widerspruchs ist auf 1 Monat ab dieser Registerbekanntmachung festgesetzt."
    },
    {
      "date": "2024-11-13",
      "id": "93307",
      "original_text": "Registerbekanntmachung nach dem Umwandlungsgesetz\nBayern Amtsgericht München HRA 85583\nQuadient Germany GmbH & Co. KG – München",
      "type": "Registerbekanntmachung nach dem Umwandlungsgesetz",
      "state": "Bayern",
      "amtsgericht": "Amtsgericht München",
      "registernummer": "HRA 85583",
      "registerart": "HRA",
      "company_name": "Quadient Germany GmbH & Co. KG",
      "company_seat": "München",
      "details": "13.11.2024 (Bekanntmachungsdatum)\n\nBayern Amtsgericht München HRA 85583\nRegisterbekanntmachung nach dem Umwandlungsgesetz 12.11.2024 (Eintragungsdatum)\n\nQuadient Germany GmbH & Co. KG\nKommanditgesellschaft\nMünchen\n\nDen Gläubigern der an der Verschmelzung beteiligten Rechtsträger ist, wenn sie binnen sechs Monaten nach dem Tag, an dem die Eintragung der Verschmelzung in das Register des Sitzes desjenigen Rechtsträgers, dessen Gläubiger sie sind, nach § 19 Abs. 3 UmwG als bekannt gemacht gilt, ihren Anspruch nach Grund und Höhe schriftlich anmelden, Sicherheit zu leisten, soweit sie nicht Befriedigung verlangen können. Dieses Recht steht den Gläubigern jedoch nur zu, wenn sie glaubhaft machen, dass durch die Verschmelzung die Erfüllung ihrer Forderung gefährdet wird."
    },
    {
      "date": "2024-11-13",
      "id": "93370",
      "original_text": "Löschungsankündigung\nNiedersachsen Amtsgericht Aurich HRA 202647\nREAL Immobilien Investment GmbH & Co. KG – Großefehn",
      "type": "Löschungsankündigung",
      "state": "Niedersachsen",
      "amtsgericht": "Amtsgericht Aurich",
      "registernummer": "HRA 202647",
      "registerart": "HRA",
      "company_name": "REAL Immobilien Investment GmbH & Co. KG",
      "company_seat": "Großefehn",
      "details": "13.11.2024 (Bekanntmachungsdatum)\n\nNiedersachsen Amtsgericht Aurich HRA 202647\nLöschungsankündigung\n\nREAL Immobilien Investment GmbH & Co. KG\nKommanditgesellschaft\nGroßefehn\n\nDas Registergericht beabsichtigt, die Firma von Amts wegen nach § 394 Abs. 4 FamFG zu löschen. Die Frist zur Erhebung eines Widerspruchs ist auf 1 Monat ab dieser Registerbekanntmachung festgesetzt."
    },
    {
      "date": "2024-11-13",
      "id": "93348",
      "original_text": "Registerbekanntmachung nach dem Umwandlungsgesetz\nBrandenburg Amtsgericht Potsdam HRB 36336\nRecktenwald Holding GmbH – Zossen",
      "type": "Registerbekanntmachung nach dem Umwandlungsgesetz",
      "state": "Brandenburg",
      "amtsgericht": "Amtsgericht Potsdam",
      "registernummer": "HRB 36336",
      "registerart": "HRB",
      "company_name": "Recktenwald Holding GmbH",
      "company_seat": "Zossen",
      "details": "13.11.2024 (Bekanntmachungsdatum)\n\nBrandenburg Amtsgericht Potsdam HRB 36336\nRegisterbekanntmachung nach dem Umwandlungsgesetz 09.11.2024 (Eintragungsdatum)\n\nRecktenwald Holding GmbH\nGesellschaft mit beschränkter Haftung\nZossen\n\nZu Eintragungsnummer 3 vom 09.11.2024 wird als nicht eingetragen veröffentlicht:\nDen Gläubigern der an der Verschmelzung beteiligten Rechtsträger ist, wenn sie binnen sechs Monaten nach dem Tag, an dem die Eintragung der Verschmelzung in das Register des Sitzes desjenigen Rechtsträgers, dessen Gläubiger sie sind, als bekannt gemacht gilt, ihren Anspruch nach Grund und Höhe schriftlich anmelden, Sicherheit zu leisten, soweit sie nicht Befriedigung verlangen können. Dieses Recht steht den Gläubigern jedoch nur zu, wenn sie glaubhaft machen, dass durch die Verschmelzung die Erfüllung ihrer Forderung gefährdet wird"
    },
    {
      "date": "2024-11-13",
      "id": "93346",
      "original_text": "Registerbekanntmachung nach dem Umwandlungsgesetz\nBrandenburg Amtsgericht Potsdam HRB 36342\nRecktenwald Real Estate GmbH – Zossen",
      "type": "Registerbekanntmachung nach dem Umwandlungsgesetz",
      "state": "Brandenburg",
      "amtsgericht": "Amtsgericht Potsdam",
      "registernummer": "HRB 36342",
      "registerart": "HRB",
      "company_name": "Recktenwald Real Estate GmbH",
      "company_seat": "Zossen",
      "details": "13.11.2024 (Bekanntmachungsdatum)\n\nBrandenburg Amtsgericht Potsdam HRB 36342\nRegisterbekanntmachung nach dem Umwandlungsgesetz 09.11.2024 (Eintragungsdatum)\n\nRecktenwald Real Estate GmbH\nGesellschaft mit beschränkter Haftung\nZossen\n\nZu Eintragungsnummer 3 vom 09.11.2024 wird als nicht eingetragen veröffentlicht:\nDen Gläubigern der an der Verschmelzung beteiligten Rechtsträger ist, wenn sie binnen sechs Monaten nach dem Tag, an dem die Eintragung der Verschmelzung in das Register des Sitzes desjenigen Rechtsträgers, dessen Gläubiger sie sind, als bekannt gemacht gilt, ihren Anspruch nach Grund und Höhe schriftlich anmelden, Sicherheit zu leisten, soweit sie nicht Befriedigung verlangen können. Dieses Recht steht den Gläubigern jedoch nur zu, wenn sie glaubhaft machen, dass durch die Verschmelzung die Erfüllung ihrer Forderung gefährdet wird"
    },
    {
      "date": "2024-11-13",
      "id": "93400",
      "original_text": "Sonstige Registerbekanntmachung\nNordrhein-Westfalen Amtsgericht Düsseldorf HRB 33029\nRhein-Taxi Datenfunkzentrale 21 21 21 GmbH – Düsseldorf",
      "type": "Sonstige Registerbekanntmachung",
      "state": "Nordrhein-Westfalen",
      "amtsgericht": "Amtsgericht Düsseldorf",
      "registernummer": "HRB 33029",
      "registerart": "HRB",
      "company_name": "Rhein-Taxi Datenfunkzentrale 21 21 21 GmbH",
      "company_seat": "Düsseldorf",
      "details": "13.11.2024 (Bekanntmachungsdatum)\n\nNordrhein-Westfalen Amtsgericht Düsseldorf HRB 33029\nSonstige Registerbekanntmachung 13.11.2024 (Eintragungsdatum)\n\nRhein-Taxi Datenfunkzentrale 21 21 21 GmbH\nGesellschaft mit beschränkter Haftung\nDüsseldorf\n\nDie Gesellschaft ist aufgelöst. Von Amts wegen eingetragen."
    },
    {
      "date": "2024-11-13",
      "id": "93341",
      "original_text": "Löschungsankündigung\nThüringen Amtsgericht Jena HRB 509180\nSADO Verwaltungs GmbH – Weimar",
      "type": "Löschungsankündigung",
      "state": "Thüringen",
      "amtsgericht": "Amtsgericht Jena",
      "registernummer": "HRB 509180",
      "registerart": "HRB",
      "company_name": "SADO Verwaltungs GmbH",
      "company_seat": "Weimar",
      "details": "13.11.2024 (Bekanntmachungsdatum)\n\nThüringen Amtsgericht Jena HRB 509180\nLöschungsankündigung\n\nSADO Verwaltungs GmbH\nGesellschaft mit beschränkter Haftung\nWeimar\n\nDas Registergericht beabsichtigt, die im Handelsregister eingetragene Gesellschaft wegen Vermögenslosigkeit nach § 394 FamFG von Amts wegen zu löschen. Die Frist zur Erhebung eines Widerspruchs gegen die beabsichtigte Löschung wird auf 6 Wochen festgesetzt."
    },
    {
      "date": "2024-11-13",
      "id": "93404",
      "original_text": "Löschungsankündigung\nNordrhein-Westfalen Amtsgericht Düsseldorf HRB 102695\nSB Bau GmbH – Düsseldorf",
      "type": "Löschungsankündigung",
      "state": "Nordrhein-Westfalen",
      "amtsgericht": "Amtsgericht Düsseldorf",
      "registernummer": "HRB 102695",
      "registerart": "HRB",
      "company_name": "SB Bau GmbH",
      "company_seat": "Düsseldorf",
      "details": "13.11.2024 (Bekanntmachungsdatum)\n\nNordrhein-Westfalen Amtsgericht Düsseldorf HRB 102695\nLöschungsankündigung\n\nSB Bau GmbH\nGesellschaft mit beschränkter Haftung\nDüsseldorf\n\nDas Registergericht beabsichtigt die Gesellschaft von Amts wegen nach § 394 FamFG zu löschen. Die Frist zur Erhebung eines Widerspruchs ist auf 3 Wochen festgesetzt.\n\nRechtsbehelfsbelehrung:\nDas Widerspruchsrecht steht jedem zu, der an der Unterlassung der Löschung ein berechtigtes Interesse hat. Der Widerspruch ist bei dem Amtsgericht Düsseldorf -Registergericht-, Werdener Straße 1, 40227 Düsseldorf schriftlich in deutscher Sprache oder zur Niederschrift der Geschäftsstelle einzulegen. Der Widerspruch kann auch zur Niederschrift der Geschäftsstelle eines jeden Amtsgerichtes abgegeben werden. Die Einlegung ist auch durch Übertragung eines elektronischen Dokuments an die elektronische Poststelle des Gerichts möglich. Das elektronische Dokument muss für die Bearbeitung durch das Gericht geeignet und mit einer qualifizierten elektronischen Signatur der verantwortenden Person versehen sein oder von der verantwortenden Person signiert und auf einem sicheren Übermittlungsweg gemäß § 130a ZPO nach näherer Maßgabe der Verordnung über die technischen Rahmenbedingungen des elektronischen Rechtsverkehrs und über das besondere elektronische Behördenpostfach (BGBl. I, S.3803) eingereicht werden. Weitere Informationen erhalten Sie auf der Internetseite www.justiz.de.\nDer Widerspruch muss spätestens innerhalb der gesetzten Frist nach dem Datum der Bekanntmachung der Löschungsankündigung bei dem Amtsgericht - Registergericht - Düsseldorf eingegangen sein.  Dies gilt auch dann, wenn der Widerspruch zur Niederschrift der Geschäftsstelle eines anderen Amtsgerichtes abgegeben wurde. Die Frist beginnt mit dem Tage der Bekanntmachung der Löschungsankündigung in dem für die Bekanntmachung der Eintragungen in das Handelsregister bestimmten elektronischen Informations- und Kommunikationssystem nach § 10 des Handelsgesetzbuches. Fällt das Ende der Frist auf einen Sonntag, einen allgemeinen Feiertag oder Sonnabend, so endet die Frist mit Ablauf des nächsten Werktages.\nDer Widerspruch muss die Bezeichnung der angefochtenen Löschungsankündigung sowie die Erklärung enthalten, dass Widerspruch gegen diese Löschungsankündigung eingelegt wird. Er ist zu unterzeichnen und soll begründet werden."
    },
    {
      "date": "2024-11-13",
      "id": "93329",
      "original_text": "Löschungsankündigung\nBaden-Württemberg Amtsgericht Mannheim HRB 724172\nSEPA Card GmbH – Wiesloch",
      "type": "Löschungsankündigung",
      "state": "Baden-Württemberg",
      "amtsgericht": "Amtsgericht Mannheim",
      "registernummer": "HRB 724172",
      "registerart": "HRB",
      "company_name": "SEPA Card GmbH",
      "company_seat": "Wiesloch",
      "details": "13.11.2024 (Bekanntmachungsdatum)\n\nBaden-Württemberg Amtsgericht Mannheim HRB 724172\nLöschungsankündigung\n\nSEPA Card GmbH\nGesellschaft mit beschränkter Haftung\nWiesloch\n\nDas Gericht beabsichtigt, die Gesellschaft wegen Vermögenslosigkeit im Handelsregister von Amts wegen nach § 394 FamFG zu löschen. Die Frist zur Geltendmachung eines Widerspruchs gegen die beabsichtigte Löschung ist auf einen Monat ab Veröffentlichung bestimmt."
    },
    {
      "date": "2024-11-13",
      "id": "93384",
      "original_text": "Löschungsankündigung\nNordrhein-Westfalen Amtsgericht Dortmund HRB 33208\nSSE GmbH – Dortmund",
      "type": "Löschungsankündigung",
      "state": "Nordrhein-Westfalen",
      "amtsgericht": "Amtsgericht Dortmund",
      "registernummer": "HRB 33208",
      "registerart": "HRB",
      "company_name": "SSE GmbH",
      "company_seat": "Dortmund",
      "details": "13.11.2024 (Bekanntmachungsdatum)\n\nNordrhein-Westfalen Amtsgericht Dortmund HRB 33208\nLöschungsankündigung 12.11.2024 (Eintragungsdatum)\n\nSSE GmbH\nGesellschaft mit beschränkter Haftung\nDortmund\n\nDas Registergericht beabsichtigt die Gesellschaft von Amts wegen nach § 394 FamFG zu löschen. Die Frist zur Erhebung eines Widerspruchs ist auf zwei Monate festgesetzt."
    },
    {
      "date": "2024-11-13",
      "id": "93401",
      "original_text": "Registerbekanntmachung nach dem Umwandlungsgesetz\nNordrhein-Westfalen Amtsgericht Köln HRA 37634\nSamir Mulasalihovic e.K. – Wermelskirchen",
      "type": "Registerbekanntmachung nach dem Umwandlungsgesetz",
      "state": "Nordrhein-Westfalen",
      "amtsgericht": "Amtsgericht Köln",
      "registernummer": "HRA 37634",
      "registerart": "HRA",
      "company_name": "Samir Mulasalihovic e.K.",
      "company_seat": "Wermelskirchen",
      "details": "13.11.2024 (Bekanntmachungsdatum)\n\nNordrhein-Westfalen Amtsgericht Köln HRA 37634\nRegisterbekanntmachung nach dem Umwandlungsgesetz 13.11.2024 (Eintragungsdatum)\n\nSamir Mulasalihovic e.K.\nEinzelkaufmann / Einzelkauffrau\nWermelskirchen\n\nDen Gläubigern der an der Ausgliederung beteiligten Rechtsträger ist, wenn sie binnen sechs Monaten nach dem Tag, an dem die Eintragung der Ausgliederung in das Register des Sitzes desjenigen Rechtsträgers, dessen Gläubiger sie sind, nach § 19 Absatz 3 UmwG als bekanntgemacht gilt, ihren Anspruch nach Grund und Höhe schriftlich anmelden, Sicherheit zu leisten, soweit sie nicht Befriedigung verlangen können. Dieses Recht steht den Gläubigern jedoch nur zu, wenn sie glaubhaft machen, dass durch die Ausgliederung die Erfüllung ihrer Forderung gefährdet wird."
    },
    {
      "date": "2024-11-13",
      "id": "93396",
      "original_text": "Registerbekanntmachung nach dem Umwandlungsgesetz\nNordrhein-Westfalen Amtsgericht Bad Oeynhausen HRB 19371\nSanitätshaus Schröer GmbH – Vlotho",
      "type": "Registerbekanntmachung nach dem Umwandlungsgesetz",
      "state": "Nordrhein-Westfalen",
      "amtsgericht": "Amtsgericht Bad Oeynhausen",
      "registernummer": "HRB 19371",
      "registerart": "HRB",
      "company_name": "Sanitätshaus Schröer GmbH",
      "company_seat": "Vlotho",
      "details": "13.11.2024 (Bekanntmachungsdatum)\n\nNordrhein-Westfalen Amtsgericht Bad Oeynhausen HRB 19371\nRegisterbekanntmachung nach dem Umwandlungsgesetz 13.11.2024 (Eintragungsdatum)\n\nSanitätshaus Schröer GmbH\nGesellschaft mit beschränkter Haftung\nVlotho\n\nDen Gläubigern der an der Ausgliederung beteiligten Rechtsträger ist, wenn sie binnen sechs Monaten nach dem Tag, an dem die Eintragung der Ausgliederung in das Register des Sitzes desjenigen Rechtsträgers, dessen Gläubiger sie sind, nach § 19 Absatz 3 UmwG als bekanntgemacht gilt, ihren Anspruch nach Grund und Höhe schriftlich anmelden, Sicherheit zu leisten, soweit sie nicht Befriedigung verlangen können. Dieses Recht steht den Gläubigern jedoch nur zu, wenn sie glaubhaft machen, dass durch die Ausgliederung die Erfüllung ihrer Forderung gefährdet wird."
    },
    {
      "date": "2024-11-13",
      "id": "93345",
      "original_text": "Einreichung neuer Dokumente\nBaden-Württemberg Amtsgericht Ulm HRB 726465\nSchuler Pressen GmbH – Göppingen",
      "type": "Einreichung neuer Dokumente",
      "state": "Baden-Württemberg",
      "amtsgericht": "Amtsgericht Ulm",
      "registernummer": "HRB 726465",
      "registerart": "HRB",
      "company_name": "Schuler Pressen GmbH",
      "company_seat": "Göppingen",
      "details": "13.11.2024 (Bekanntmachungsdatum)\n\nBaden-Württemberg Amtsgericht Ulm HRB 726465\nEinreichung neuer Dokumente\n\nSchuler Pressen GmbH\nGesellschaft mit beschränkter Haftung\nGöppingen\n\nDie Gesellschaft hat am 08.11.2024 die Liste über die Zusammensetzung des Aufsichtsrats zum Handelsregister eingereicht."
    },
    {
      "date": "2024-11-13",
      "id": "93412",
      "original_text": "Sonstige Registerbekanntmachung\nHessen Amtsgericht Wiesbaden VR 1382\nSchullandheimverein Wiesbaden e.V. – Wiesbaden",
      "type": "Sonstige Registerbekanntmachung",
      "state": "Hessen",
      "amtsgericht": "Amtsgericht Wiesbaden",
      "registernummer": "VR 1382",
      "registerart": "VR",
      "company_name": "Schullandheimverein Wiesbaden e.V.",
      "company_seat": "Wiesbaden",
      "details": "13.11.2024 (Bekanntmachungsdatum)\n\nHessen Amtsgericht Wiesbaden VR 1382\nSonstige Registerbekanntmachung 13.11.2024 (Eintragungsdatum)\n\nSchullandheimverein Wiesbaden e.V.\neingetragener Verein\nWiesbaden\n\nDer Verein ist aufgelöst."
    },
    {
      "date": "2024-11-13",
      "id": "93353",
      "original_text": "Löschungsankündigung\nBrandenburg Amtsgericht Frankfurt/Oder HRB 13344\nSchuster Heizung-Sanitär-Photovoltaik GmbH – Grünheide (Mark)",
      "type": "Löschungsankündigung",
      "state": "Brandenburg",
      "amtsgericht": "Amtsgericht Frankfurt/Oder",
      "registernummer": "HRB 13344",
      "registerart": "HRB",
      "company_name": "Schuster Heizung-Sanitär-Photovoltaik GmbH",
      "company_seat": "Grünheide (Mark)",
      "details": "13.11.2024 (Bekanntmachungsdatum)\n\nBrandenburg Amtsgericht Frankfurt/Oder HRB 13344\nLöschungsankündigung\n\nSchuster Heizung-Sanitär-Photovoltaik GmbH\nGesellschaft mit beschränkter Haftung\nGrünheide (Mark)\n\nBei der nachstehenden Gesellschaft wird das Amtslöschungsverfahren gemäß § 394 FamFG eingeleitet."
    },
    {
      "date": "2024-11-13",
      "id": "93417",
      "original_text": "Löschungsankündigung\nHessen Amtsgericht Darmstadt HRA 83606\nSchüchen Cargo Equipment UG (haftungsbeschränkt) & Co. KG – Raunheim",
      "type": "Löschungsankündigung",
      "state": "Hessen",
      "amtsgericht": "Amtsgericht Darmstadt",
      "registernummer": "HRA 83606",
      "registerart": "HRA",
      "company_name": "Schüchen Cargo Equipment UG (haftungsbeschränkt) & Co. KG",
      "company_seat": "Raunheim",
      "details": "13.11.2024 (Bekanntmachungsdatum)\n\nHessen Amtsgericht Darmstadt HRA 83606\nLöschungsankündigung\n\nSchüchen Cargo Equipment UG (haftungsbeschränkt) & Co. KG\nKommanditgesellschaft\nRaunheim\n\nDas Registergericht beabsichtigt die im Handelsregister eingetragene Firma von Amts wegen nach § 394 FamFG zu löschen. Die Frist zur Erhebung eines Widerspruchs gegen die beabsichtigte Löschung wird auf 3 Monate festgesetzt."
    },
    {
      "date": "2024-11-13",
      "id": "93399",
      "original_text": "Registerbekanntmachung nach dem Umwandlungsgesetz\nNordrhein-Westfalen Amtsgericht Düsseldorf HRB 86458\nShow Management Investor Beteiligungs GmbH – Düsseldorf",
      "type": "Registerbekanntmachung nach dem Umwandlungsgesetz",
      "state": "Nordrhein-Westfalen",
      "amtsgericht": "Amtsgericht Düsseldorf",
      "registernummer": "HRB 86458",
      "registerart": "HRB",
      "company_name": "Show Management Investor Beteiligungs GmbH",
      "company_seat": "Düsseldorf",
      "details": "13.11.2024 (Bekanntmachungsdatum)\n\nNordrhein-Westfalen Amtsgericht Düsseldorf HRB 86458\nRegisterbekanntmachung nach dem Umwandlungsgesetz 13.11.2024 (Eintragungsdatum)\n\nShow Management Investor Beteiligungs GmbH\nGesellschaft mit beschränkter Haftung\nDüsseldorf\n\nDen Gläubigern der an der Verschmelzung beteiligten Rechtsträger ist, wenn sie binnen sechs Monaten nach dem Tag, an dem die Eintragung der Verschmelzung in das Register des Sitzes desjenigen Rechtsträgers, dessen Gläubiger sie sind, nach § 19 Absatz 3 UmwG als bekanntgemacht gilt, ihren Anspruch nach Grund und Höhe schriftlich anmelden, Sicherheit zu leisten, soweit sie nicht Befriedigung verlangen können. Dieses Recht steht den Gläubigern jedoch nur zu, wenn sie glaubhaft machen, dass durch die Verschmelzung die Erfüllung ihrer Forderung gefährdet wird."
    },
    {
      "date": "2024-11-13",
      "id": "93375",
      "original_text": "Registerbekanntmachung nach dem Umwandlungsgesetz\nNordrhein-Westfalen Amtsgericht Düsseldorf HRB 86674\nShow Management Investor Verwaltungs GmbH – Düsseldorf",
      "type": "Registerbekanntmachung nach dem Umwandlungsgesetz",
      "state": "Nordrhein-Westfalen",
      "amtsgericht": "Amtsgericht Düsseldorf",
      "registernummer": "HRB 86674",
      "registerart": "HRB",
      "company_name": "Show Management Investor Verwaltungs GmbH",
      "company_seat": "Düsseldorf",
      "details": "13.11.2024 (Bekanntmachungsdatum)\n\nNordrhein-Westfalen Amtsgericht Düsseldorf HRB 86674\nRegisterbekanntmachung nach dem Umwandlungsgesetz 13.11.2024 (Eintragungsdatum)\n\nShow Management Investor Verwaltungs GmbH\nGesellschaft mit beschränkter Haftung\nDüsseldorf\n\nDen Gläubigern der an der Verschmelzung beteiligten Rechtsträger ist, wenn sie binnen sechs Monaten nach dem Tag, an dem die Eintragung der Verschmelzung in das Register des Sitzes desjenigen Rechtsträgers, dessen Gläubiger sie sind, nach § 19 Absatz 3 UmwG als bekanntgemacht gilt, ihren Anspruch nach Grund und Höhe schriftlich anmelden, Sicherheit zu leisten, soweit sie nicht Befriedigung verlangen können. Dieses Recht steht den Gläubigern jedoch nur zu, wenn sie glaubhaft machen, dass durch die Verschmelzung die Erfüllung ihrer Forderung gefährdet wird."
    },
    {
      "date": "2024-11-13",
      "id": "93423",
      "original_text": "Einreichung neuer Dokumente\nHessen Amtsgericht Offenbach am Main HRB 53321\nSkandia Lebensversicherung Aktiengesellschaft – Neu-Isenburg",
      "type": "Einreichung neuer Dokumente",
      "state": "Hessen",
      "amtsgericht": "Amtsgericht Offenbach am Main",
      "registernummer": "HRB 53321",
      "registerart": "HRB",
      "company_name": "Skandia Lebensversicherung Aktiengesellschaft",
      "company_seat": "Neu-Isenburg",
      "details": "13.11.2024 (Bekanntmachungsdatum)\n\nHessen Amtsgericht Offenbach am Main HRB 53321\nEinreichung neuer Dokumente\n\nSkandia Lebensversicherung Aktiengesellschaft\nAktiengesellschaft\nNeu-Isenburg\n\nDurch eine Änderung in den Personen der Aufsichtsratsmitglieder ist eine Liste der Mitglieder des Aufsichtsrates zum Handelsregister eingereicht worden."
    },
    {
      "date": "2024-11-13",
      "id": "93309",
      "original_text": "Registerbekanntmachung nach dem Umwandlungsgesetz\nBayern Amtsgericht München HRB 296297\nSoftware GmbH – München",
      "type": "Registerbekanntmachung nach dem Umwandlungsgesetz",
      "state": "Bayern",
      "amtsgericht": "Amtsgericht München",
      "registernummer": "HRB 296297",
      "registerart": "HRB",
      "company_name": "Software GmbH",
      "company_seat": "München",
      "details": "13.11.2024 (Bekanntmachungsdatum)\n\nBayern Amtsgericht München HRB 296297\nRegisterbekanntmachung nach dem Umwandlungsgesetz 12.11.2024 (Eintragungsdatum)\n\nSoftware GmbH\nGesellschaft mit beschränkter Haftung\nMünchen\n\nDen Gläubigern der an der Spaltung beteiligten Rechtsträger ist, wenn sie binnen sechs Monaten nach dem Tag, an dem die Eintragung der Spaltung in das Register des Sitzes desjenigen Rechtsträgers, dessen Gläubiger sie sind, nach §§ 125, 19 Abs. 3 UmwG als bekannt gemacht gilt, ihren Anspruch nach Grund und Höhe schriftlich anmelden, Sicherheit zu leisten, soweit sie nicht Befriedigung verlangen können. Dieses Recht steht den Gläubigern jedoch nur zu, wenn sie glaubhaft machen, dass durch die Spaltung die Erfüllung ihrer Forderung gefährdet wird."
    },
    {
      "date": "2024-11-13",
      "id": "93347",
      "original_text": "Löschungsankündigung\nBerlin Amtsgericht Berlin (Charlottenburg) HRB 241932\nStorch Bau GmbH – Berlin",
      "type": "Löschungsankündigung",
      "state": "Berlin",
      "amtsgericht": "Amtsgericht Berlin (Charlottenburg)",
      "registernummer": "HRB 241932",
      "registerart": "HRB",
      "company_name": "Storch Bau GmbH",
      "company_seat": "Berlin",
      "details": "13.11.2024 (Bekanntmachungsdatum)\n\nBerlin Amtsgericht Berlin (Charlottenburg) HRB 241932\nLöschungsankündigung\n\nStorch Bau GmbH\nGesellschaft mit beschränkter Haftung\nBerlin\n\nBei der nachstehenden Gesellschaft wird das Amtslöschungsverfahren gemäß § 394 FamFG eingeleitet. Widerspruchsfrist 6 Wochen"
    },
    {
      "date": "2024-11-13",
      "id": "93410",
      "original_text": "Einreichung neuer Dokumente\nHessen Amtsgericht Königstein HRB 1250\nStädtebauliche Entwicklungs- und Verwaltungsgesellschaft Kelkheim (Taunus) mbH – Kelkheim (Taunus)",
      "type": "Einreichung neuer Dokumente",
      "state": "Hessen",
      "amtsgericht": "Amtsgericht Königstein",
      "registernummer": "HRB 1250",
      "registerart": "HRB",
      "company_name": "Städtebauliche Entwicklungs- und Verwaltungsgesellschaft Kelkheim (Taunus) mbH",
      "company_seat": "Kelkheim (Taunus)",
      "details": "13.11.2024 (Bekanntmachungsdatum)\n\nHessen Amtsgericht Königstein HRB 1250\nEinreichung neuer Dokumente\n\nStädtebauliche Entwicklungs- und Verwaltungsgesellschaft Kelkheim (Taunus) mbH\nGesellschaft mit beschränkter Haftung\nKelkheim (Taunus)\n\nDurch eine Änderung in den Personen der Aufsichtsratsmitglieder ist eine Liste der Mitglieder des Aufsichtsrates zum Handelsregister eingereicht worden."
    },
    {
      "date": "2024-11-13",
      "id": "93349",
      "original_text": "Registerbekanntmachung nach dem Umwandlungsgesetz\nBaden-Württemberg Amtsgericht Stuttgart HRA 741425\nThomas Neuffer Malerwerkstätte e.K. – Heilbronn",
      "type": "Registerbekanntmachung nach dem Umwandlungsgesetz",
      "state": "Baden-Württemberg",
      "amtsgericht": "Amtsgericht Stuttgart",
      "registernummer": "HRA 741425",
      "registerart": "HRA",
      "company_name": "Thomas Neuffer Malerwerkstätte e.K.",
      "company_seat": "Heilbronn",
      "details": "13.11.2024 (Bekanntmachungsdatum)\n\nBaden-Württemberg Amtsgericht Stuttgart HRA 741425\nRegisterbekanntmachung nach dem Umwandlungsgesetz 13.11.2024 (Eintragungsdatum)\n\nThomas Neuffer Malerwerkstätte e.K.\nEinzelkaufmann / Einzelkauffrau\nHeilbronn\n\nAls nicht eingetragen wird bekanntgemacht:\nDen Gläubigern der an der Verschmelzung beteiligten Rechtsträger ist, wenn sie binnen sechs Monaten nach dem Tag, an dem die Eintragung der Verschmelzung in das Register des Sitzes desjenigen Rechtsträgers, dessen Gläubiger sie sind, nach § 19 Abs. 3 UmwG als bekanntgemacht gilt, ihren Anspruch nach Grund und Höhe schriftlich anmelden, Sicherheit zu leisten, soweit sie nicht Befriedigung verlangen können. Dieses Recht steht den Gläubigern jedoch nur zu, wenn sie glaubhaft machen, dass durch die Verschmelzung die Erfüllung ihrer Forderung gefährdet wird."
    },
    {
      "date": "2024-11-13",
      "id": "93385",
      "original_text": "Registerbekanntmachung nach dem Umwandlungsgesetz\nNordrhein-Westfalen Amtsgericht Düsseldorf HRB 92304\nTop Lein Consulting UG (haftungsbeschränkt) – Düsseldorf",
      "type": "Registerbekanntmachung nach dem Umwandlungsgesetz",
      "state": "Nordrhein-Westfalen",
      "amtsgericht": "Amtsgericht Düsseldorf",
      "registernummer": "HRB 92304",
      "registerart": "HRB",
      "company_name": "Top Lein Consulting UG (haftungsbeschränkt)",
      "company_seat": "Düsseldorf",
      "details": "13.11.2024 (Bekanntmachungsdatum)\n\nNordrhein-Westfalen Amtsgericht Düsseldorf HRB 92304\nRegisterbekanntmachung nach dem Umwandlungsgesetz 13.11.2024 (Eintragungsdatum)\n\nTop Lein Consulting UG (haftungsbeschränkt)\nGesellschaft mit beschränkter Haftung\nDüsseldorf\n\nDie Gesellschaft hat Gläubigern, deren Forderungen vor dieser Bekanntmachung begründet worden sind, Sicherheit zu leisten, soweit sie nicht Befriedigung verlangen können, wenn sie sich binnen sechs Monaten zu diesem Zweck melden."
    },
    {
      "date": "2024-11-13",
      "id": "93363",
      "original_text": "Registerbekanntmachung nach dem Umwandlungsgesetz\nNiedersachsen Amtsgericht Osnabrück HRA 207715\nTreelivery GmbH & Co. KG – Georgsmarienhütte",
      "type": "Registerbekanntmachung nach dem Umwandlungsgesetz",
      "state": "Niedersachsen",
      "amtsgericht": "Amtsgericht Osnabrück",
      "registernummer": "HRA 207715",
      "registerart": "HRA",
      "company_name": "Treelivery GmbH & Co. KG",
      "company_seat": "Georgsmarienhütte",
      "details": "13.11.2024 (Bekanntmachungsdatum)\n\nNiedersachsen Amtsgericht Osnabrück HRA 207715\nRegisterbekanntmachung nach dem Umwandlungsgesetz 13.11.2024 (Eintragungsdatum)\n\nTreelivery GmbH & Co. KG\nKommanditgesellschaft\nGeorgsmarienhütte\n\nDen Gläubigern der an der formwechselnden Umwandlung beteiligten Rechtsträger ist, wenn sie binnen sechs Monaten nach dem Tag, an dem die Eintragung der Umwandlung in das Register des Sitzes desjenigen Rechtsträgers, dessen Gläubiger sie sind, nach § 19 Abs. 3 UmwG als bekannt gemacht gilt, ihren Anspruch nach Grund und Höhe schriftlich anmelden, Sicherheit zu leisten, soweit sie nicht Befriedigung verlangen können. Dieses Recht steht den Gläubigern jedoch nur zu, wenn sie glaubhaft machen, dass durch die formwechselnde Umwandlung die Erfüllung der Forderung gefährdet wird."
    },
    {
      "date": "2024-11-13",
      "id": "93395",
      "original_text": "Löschungsankündigung\nNordrhein-Westfalen Amtsgericht Aachen HRB 19551\nTreuplan Immobilien- und Beteiligungsgesellschaft mit beschränkter Haftung – Aachen",
      "type": "Löschungsankündigung",
      "state": "Nordrhein-Westfalen",
      "amtsgericht": "Amtsgericht Aachen",
      "registernummer": "HRB 19551",
      "registerart": "HRB",
      "company_name": "Treuplan Immobilien- und Beteiligungsgesellschaft mit beschränkter Haftung",
      "company_seat": "Aachen",
      "details": "13.11.2024 (Bekanntmachungsdatum)\n\nNordrhein-Westfalen Amtsgericht Aachen HRB 19551\nLöschungsankündigung\n\nTreuplan Immobilien- und Beteiligungsgesellschaft mit beschränkter Haftung\nGesellschaft mit beschränkter Haftung\nAachen\n\nDas Registergericht beabsichtigt, von Amts wegen die Gesellschaft wegen Vermögenslosigkeit nach § 394 FamFG zu löschen, weil das Finanzamt Aachen-Stadt mit Schreiben vom 06.11.2024 Umstände mitgeteilt hat, aufgrund derer das Gericht davon überzeugt ist, dass die Gesellschaft vollständig vermögenslos ist.\n\nZur Geltendmachung des Widerspruchs gegen die beabsichtigte Löschung wird hiermit eine Frist von einem Monat ab Veröffentlichung dieser Ankündigung bestimmt.\n\nRechtsbehelfsbelehrung:\n\nGegen diese Verfügung kann Widerspruch eingelegt werden. Zum Widerspruch ist jeder berechtigt, der an der Unterlassung der Löschung ein berechtigtes Interesse hat.\n\nDer Widerspruch ist bei dem Amtsgericht Aachen, Adalbertsteinweg 92, 52070 Aachen schriftlich in deutscher Sprache oder zur Niederschrift der Geschäftsstelle einzulegen. Der Widerspruch kann auch zur Niederschrift der Geschäftsstelle eines jeden Amtsgerichtes abgegeben werden.\n\nDer Widerspruch muss spätestens innerhalb der gesetzten Frist nach der Bekanntgabe der Verfügung bei dem Amtsgericht Aachen eingegangen sein. Dies gilt auch dann, wenn der Widerspruch zur Niederschrift der Geschäftsstelle eines anderen Amtsgerichtes abgegeben wurde. Die Frist beginnt mit der Bekanntgabe der Verfügung durch Veröffentlichung. Fällt das Ende der Frist auf einen Sonntag, einen allgemeinen Feiertag oder Sonnabend, so endet die Frist mit Ablauf des nächsten Werktages.\n\nDer Widerspruch muss die Bezeichnung der angefochtenen Verfügung sowie die Erklärung enthalten, dass Widerspruch gegen diese Verfügung eingelegt wird. Er ist zu unterzeichnen und soll begründet werden.\n\nDie Einlegung ist auch durch Übertragung eines elektronischen Dokuments an die elektronische Poststelle des Gerichts möglich. Das elektronische Dokument muss für die Bearbeitung durch das Gericht geeignet und mit einer qualifizierten elektronischen Signatur der verantwortenden Person versehen sein oder von der verantwortenden Person signiert und auf einem sicheren Übermittlungsweg gemäß § 130 a ZPO nach näherer Maßgabe der Verordnung über die technischen Rahmenbedingungen des elektronischen Rechtsverkehrs und über das besondere elektronische Behördenpostfach (BGBl. I, S. 3803) eingereicht werden. Weitere Informationen erhalten Sie auf der Internetseite www.justiz.de."
    },
    {
      "date": "2024-11-13",
      "id": "93359",
      "original_text": "Registerbekanntmachung nach dem Umwandlungsgesetz\nNiedersachsen Amtsgericht Tostedt HRB 205649\nVG 57. Verwaltungsgesellschaft mbH – Stade",
      "type": "Registerbekanntmachung nach dem Umwandlungsgesetz",
      "state": "Niedersachsen",
      "amtsgericht": "Amtsgericht Tostedt",
      "registernummer": "HRB 205649",
      "registerart": "HRB",
      "company_name": "VG 57. Verwaltungsgesellschaft mbH",
      "company_seat": "Stade",
      "details": "13.11.2024 (Bekanntmachungsdatum)\n\nNiedersachsen Amtsgericht Tostedt HRB 205649\nRegisterbekanntmachung nach dem Umwandlungsgesetz 13.11.2024 (Eintragungsdatum)\n\nVG 57. Verwaltungsgesellschaft mbH\nGesellschaft mit beschränkter Haftung\nStade\n\nDen Gläubigern der an der Verschmelzung beteiligten Rechtsträger ist, wenn sie binnen sechs Monaten nach dem Tag, an dem die Eintragung der Verschmelzung in das Register des Sitzes desjenigen Rechtsträgers, dessen Gläubiger sie sind, nach § 19  Abs.  3 UmwG als bekannt gemacht gilt, ihren Anspruch nach Grund und Höhe schriftlich anmelden, Sicherheit zu leisten, soweit sie nicht Befriedigung verlangen können. Dieses Recht steht den Gläubigern jedoch nur zu, wenn sie glaubhaft machen, dass durch die Verschmelzung die Erfüllung der Forderung gefährdet wird."
    },
    {
      "date": "2024-11-13",
      "id": "93415",
      "original_text": "Einreichung neuer Dokumente\nHessen Amtsgericht Darmstadt HRB 7359\nVWR International GmbH – Darmstadt",
      "type": "Einreichung neuer Dokumente",
      "state": "Hessen",
      "amtsgericht": "Amtsgericht Darmstadt",
      "registernummer": "HRB 7359",
      "registerart": "HRB",
      "company_name": "VWR International GmbH",
      "company_seat": "Darmstadt",
      "details": "13.11.2024 (Bekanntmachungsdatum)\n\nHessen Amtsgericht Darmstadt HRB 7359\nEinreichung neuer Dokumente\n\nVWR International GmbH\nGesellschaft mit beschränkter Haftung\nDarmstadt\n\nWegen Änderungen in den Personen der Aufsichtsratsmitglieder ist eine Liste der Mitglieder des Aufsichtsrates zum Handelsregister eingereicht worden."
    },
    {
      "date": "2024-11-13",
      "id": "93328",
      "original_text": "Einreichung neuer Dokumente\nBaden-Württemberg Amtsgericht Stuttgart HRB 741544\nWERU GmbH – Rudersberg",
      "type": "Einreichung neuer Dokumente",
      "state": "Baden-Württemberg",
      "amtsgericht": "Amtsgericht Stuttgart",
      "registernummer": "HRB 741544",
      "registerart": "HRB",
      "company_name": "WERU GmbH",
      "company_seat": "Rudersberg",
      "details": "13.11.2024 (Bekanntmachungsdatum)\n\nBaden-Württemberg Amtsgericht Stuttgart HRB 741544\nEinreichung neuer Dokumente\n\nWERU GmbH\nGesellschaft mit beschränkter Haftung\nRudersberg\n\nDie Gesellschaft hat am 11.11.2024 die Liste über die Zusammensetzung des Aufsichtsrats zum Handelsregister eingereicht."
    },
    {
      "date": "2024-11-13",
      "id": "93382",
      "original_text": "Sonstige Registerbekanntmachung\nNordrhein-Westfalen Amtsgericht Münster GnR 457\nWiGe eG – Warendorf",
      "type": "Sonstige Registerbekanntmachung",
      "state": "Nordrhein-Westfalen",
      "amtsgericht": "Amtsgericht Münster",
      "registernummer": "GnR 457",
      "registerart": "GnR",
      "company_name": "WiGe eG",
      "company_seat": "Warendorf",
      "details": "13.11.2024 (Bekanntmachungsdatum)\n\nNordrhein-Westfalen Amtsgericht Münster GnR 457\nSonstige Registerbekanntmachung 13.11.2024 (Eintragungsdatum)\n\nWiGe eG\neingetragene Genossenschaft\nWarendorf\n\nAls nicht eingetragen wird veröffentlicht: Den Gläubigern der Genossenschaft ist gemäß § 22 GenG, wenn sie sich binnen sechs Monaten nach der Bekanntmachung bei der Genossenschaft  zu diesem Zweck  melden, Sicherheit zu leisten, soweit sie nicht Befriedigung verlangen können."
    },
    {
      "date": "2024-11-13",
      "id": "93390",
      "original_text": "Löschungsankündigung\nNordrhein-Westfalen Amtsgericht Köln HRB 106440\nWohnwagenmarkt Cobo GmbH – Köln",
      "type": "Löschungsankündigung",
      "state": "Nordrhein-Westfalen",
      "amtsgericht": "Amtsgericht Köln",
      "registernummer": "HRB 106440",
      "registerart": "HRB",
      "company_name": "Wohnwagenmarkt Cobo GmbH",
      "company_seat": "Köln",
      "details": "13.11.2024 (Bekanntmachungsdatum)\n\nNordrhein-Westfalen Amtsgericht Köln HRB 106440\nLöschungsankündigung\n\nWohnwagenmarkt Cobo GmbH\nGesellschaft mit beschränkter Haftung\nKöln\n\nDas Registergericht beabsichtigt die Gesellschaft von Amts wegen nach § 394 FamFG zu löschen. Die Frist zur Erhebung eines Widerspruchs ist auf einen Monat festgesetzt."
    },
    {
      "date": "2024-11-13",
      "id": "93387",
      "original_text": "Löschungsankündigung\nNordrhein-Westfalen Amtsgericht Düsseldorf HRA 22825\nWolffen Zöllmener Str. 26 GmbH & Co KG – Hilden",
      "type": "Löschungsankündigung",
      "state": "Nordrhein-Westfalen",
      "amtsgericht": "Amtsgericht Düsseldorf",
      "registernummer": "HRA 22825",
      "registerart": "HRA",
      "company_name": "Wolffen Zöllmener Str. 26 GmbH & Co KG",
      "company_seat": "Hilden",
      "details": "13.11.2024 (Bekanntmachungsdatum)\n\nNordrhein-Westfalen Amtsgericht Düsseldorf HRA 22825\nLöschungsankündigung\n\nWolffen Zöllmener Str. 26 GmbH & Co KG\nKommanditgesellschaft\nHilden\n\nDas Registergericht beabsichtigt die Firma von Amts wegen nach § 394 FamFG zu löschen, da offenbar keine Vermögenswerte mehr vorhanden sind und bereits die persönlich haftende Gesellschafterin wegen Vermögenslosigkeit gelöscht worden ist.. Die Frist zur Erhebung eines Widerspruchs ist auf einen Monat festgesetzt.\n\nRechtsbehelfsbelehrung:\nDas Widerspruchsrecht steht jedem zu, der an der Unterlassung der Löschung ein berechtigtes Interesse hat. Der Widerspruch ist bei dem Amtsgericht Düsseldorf -Registergericht-, Werdener Straße 1, 40227 Düsseldorf schriftlich in deutscher Sprache oder zur Niederschrift der Geschäftsstelle einzulegen. Der Widerspruch kann auch zur Niederschrift der Geschäftsstelle eines jeden Amtsgerichtes abgegeben werden. Die Einlegung ist auch durch Übertragung eines elektronischen Dokuments an die elektronische Poststelle des Gerichts möglich. Das elektronische Dokument muss für die Bearbeitung durch das Gericht geeignet und mit einer qualifizierten elektronischen Signatur der verantwortenden Person versehen sein oder von der verantwortenden Person signiert und auf einem sicheren Übermittlungsweg gemäß § 130a ZPO nach näherer Maßgabe der Verordnung über die technischen Rahmenbedingungen des elektronischen Rechtsverkehrs und über das besondere elektronische Behördenpostfach (BGBl. I, S.3803) eingereicht werden. Weitere Informationen erhalten Sie auf der Internetseite www.justiz.de.\nDer Widerspruch muss spätestens innerhalb der gesetzten Frist nach dem Datum der Bekanntmachung der Löschungsankündigung bei dem Amtsgericht - Registergericht - Düsseldorf eingegangen sein.  Dies gilt auch dann, wenn der Widerspruch zur Niederschrift der Geschäftsstelle eines anderen Amtsgerichtes abgegeben wurde. Die Frist beginnt mit dem Tage der Bekanntmachung der Löschungsankündigung in dem für die Bekanntmachung der Eintragungen in das Handelsregister bestimmten elektronischen Informations- und Kommunikationssystem nach § 10 des Handelsgesetzbuches. Fällt das Ende der Frist auf einen Sonntag, einen allgemeinen Feiertag oder Sonnabend, so endet die Frist mit Ablauf des nächsten Werktages.\nDer Widerspruch muss die Bezeichnung der angefochtenen Löschungsankündigung sowie die Erklärung enthalten, dass Widerspruch gegen diese Löschungsankündigung eingelegt wird. Er ist zu unterzeichnen und soll begründet werden."
    },
    {
      "date": "2024-11-13",
      "id": "93374",
      "original_text": "Löschungsankündigung\nNordrhein-Westfalen Amtsgericht Düsseldorf HRB 76516\nYang Shi GERMANY INVEST & CONSULT GmbH – Düsseldorf",
      "type": "Löschungsankündigung",
      "state": "Nordrhein-Westfalen",
      "amtsgericht": "Amtsgericht Düsseldorf",
      "registernummer": "HRB 76516",
      "registerart": "HRB",
      "company_name": "Yang Shi GERMANY INVEST & CONSULT GmbH",
      "company_seat": "Düsseldorf",
      "details": "13.11.2024 (Bekanntmachungsdatum)\n\nNordrhein-Westfalen Amtsgericht Düsseldorf HRB 76516\nLöschungsankündigung\n\nYang Shi GERMANY INVEST & CONSULT GmbH\nGesellschaft mit beschränkter Haftung\nDüsseldorf\n\nDas Registergericht beabsichtigt die Gesellschaft von Amts wegen nach § 394 Abs. 1 FamFG zu löschen. Die Frist zur Erhebung eines Widerspruchs ist auf einen Monat festgesetzt.\n\nRechtsbehelfsbelehrung:\nDas Widerspruchsrecht steht jedem zu, der an der Unterlassung der Löschung ein berechtigtes Interesse hat. Der Widerspruch ist bei dem Amtsgericht Düsseldorf -Registergericht-, Werdener Straße 1, 40227 Düsseldorf schriftlich in deutscher Sprache oder zur Niederschrift der Geschäftsstelle einzulegen. Der Widerspruch kann auch zur Niederschrift der Geschäftsstelle eines jeden Amtsgerichtes abgegeben werden. Die Einlegung ist auch durch Übertragung eines elektronischen Dokuments an die elektronische Poststelle des Gerichts möglich. Das elektronische Dokument muss für die Bearbeitung durch das Gericht geeignet und mit einer qualifizierten elektronischen Signatur der verantwortenden Person versehen sein oder von der verantwortenden Person signiert und auf einem sicheren Übermittlungsweg gemäß § 130a ZPO nach näherer Maßgabe der Verordnung über die technischen Rahmenbedingungen des elektronischen Rechtsverkehrs und über das besondere elektronische Behördenpostfach (BGBl. I, S.3803) eingereicht werden. Weitere Informationen erhalten Sie auf der Internetseite www.justiz.de.\nDer Widerspruch muss spätestens innerhalb der gesetzten Frist nach dem Datum der Bekanntmachung der Löschungsankündigung bei dem Amtsgericht - Registergericht - Düsseldorf eingegangen sein.  Dies gilt auch dann, wenn der Widerspruch zur Niederschrift der Geschäftsstelle eines anderen Amtsgerichtes abgegeben wurde. Die Frist beginnt mit dem Tage der Bekanntmachung der Löschungsankündigung in dem für die Bekanntmachung der Eintragungen in das Handelsregister bestimmten elektronischen Informations- und Kommunikationssystem nach § 10 des Handelsgesetzbuches. Fällt das Ende der Frist auf einen Sonntag, einen allgemeinen Feiertag oder Sonnabend, so endet die Frist mit Ablauf des nächsten Werktages.\nDer Widerspruch muss die Bezeichnung der angefochtenen Löschungsankündigung sowie die Erklärung enthalten, dass Widerspruch gegen diese Löschungsankündigung eingelegt wird. Er ist zu unterzeichnen und soll begründet werden."
    },
    {
      "date": "2024-11-13",
      "id": "93355",
      "original_text": "Löschungsankündigung\nBrandenburg Amtsgericht Potsdam HRB 25537\nZweitwohnsitz GmbH – Potsdam",
      "type": "Löschungsankündigung",
      "state": "Brandenburg",
      "amtsgericht": "Amtsgericht Potsdam",
      "registernummer": "HRB 25537",
      "registerart": "HRB",
      "company_name": "Zweitwohnsitz GmbH",
      "company_seat": "Potsdam",
      "details": "13.11.2024 (Bekanntmachungsdatum)\n\nBrandenburg Amtsgericht Potsdam HRB 25537\nLöschungsankündigung\n\nZweitwohnsitz GmbH\nGesellschaft mit beschränkter Haftung\nPotsdam\n\nBei der nachstehenden Gesellschaft wird das Amtslöschungsverfahren gemäß § 394 FamFG eingeleitet. Widerspruchsfrist 8 Wochen."
    },
    {
      "date": "2024-11-13",
      "id": "93322",
      "original_text": "Löschungsankündigung\nBaden-Württemberg Amtsgericht Mannheim HRB 725768\nffs fit for sports UG (haftungsbeschränkt) – Mannheim",
      "type": "Löschungsankündigung",
      "state": "Baden-Württemberg",
      "amtsgericht": "Amtsgericht Mannheim",
      "registernummer": "HRB 725768",
      "registerart": "HRB",
      "company_name": "ffs fit for sports UG (haftungsbeschränkt)",
      "company_seat": "Mannheim",
      "details": "13.11.2024 (Bekanntmachungsdatum)\n\nBaden-Württemberg Amtsgericht Mannheim HRB 725768\nLöschungsankündigung\n\nffs fit for sports UG (haftungsbeschränkt)\nGesellschaft mit beschränkter Haftung\nMannheim\n\nDas Gericht beabsichtigt, die Gesellschaft wegen Vermögenslosigkeit im Handelsregister von Amts wegen nach § 394 FamFG zu löschen. Die Frist zur Geltendmachung eines Widerspruchs gegen die beabsichtigte Löschung ist auf einen Monat ab Veröffentlichung bestimmt."
    },
    {
      "date": "2024-11-13",
      "id": "93424",
      "original_text": "Registerbekanntmachung nach dem Umwandlungsgesetz\nHessen Amtsgericht Wiesbaden HRB 19430\ngke-GmbH – Waldems",
      "type": "Registerbekanntmachung nach dem Umwandlungsgesetz",
      "state": "Hessen",
      "amtsgericht": "Amtsgericht Wiesbaden",
      "registernummer": "HRB 19430",
      "registerart": "HRB",
      "company_name": "gke-GmbH",
      "company_seat": "Waldems",
      "details": "13.11.2024 (Bekanntmachungsdatum)\n\nHessen Amtsgericht Wiesbaden HRB 19430\nRegisterbekanntmachung nach dem Umwandlungsgesetz 13.11.2024 (Eintragungsdatum)\n\ngke-GmbH\nGesellschaft mit beschränkter Haftung\nWaldems\n\nDen Gläubigern der an der Verschmelzung beteiligten Rechtsträger ist, wenn sie binnen sechs Monaten nach dem Tag, an dem die Eintragung der Verschmelzung in das Register des Sitzes derjenigen Rechtsträger deren Gläubiger sie sind, nach § 19 Absatz 3 UmwG bekannt gemacht worden ist, ihren Anspruch nach Grund und Höhe schriftlich anmelden, Sicherheit zu leisten, soweit sie nicht Befriedigung verlangen können. Dieses Recht steht den Gläubigern jedoch nur zu, wenn sie glaubhaft machen, dass durch die Verschmelzung die Erfüllung ihrer Forderung gefährdet wird."
    },
    {
      "date": "2024-11-13",
      "id": "93332",
      "original_text": "Registerbekanntmachung nach dem Umwandlungsgesetz\nHamburg Amtsgericht Hamburg HRB 186683\nkaala objects GmbH – Hamburg",
      "type": "Registerbekanntmachung nach dem Umwandlungsgesetz",
      "state": "Hamburg",
      "amtsgericht": "Amtsgericht Hamburg",
      "registernummer": "HRB 186683",
      "registerart": "HRB",
      "company_name": "kaala objects GmbH",
      "company_seat": "Hamburg",
      "details": "13.11.2024 (Bekanntmachungsdatum)\n\nHamburg Amtsgericht Hamburg HRB 186683\nRegisterbekanntmachung nach dem Umwandlungsgesetz 13.11.2024 (Eintragungsdatum)\n\nkaala objects GmbH\nGesellschaft mit beschränkter Haftung\nHamburg\n\nAls nicht eingetragen wird bekannt gemacht:\nDen Gläubigern der an der Verschmelzung beteiligten Gesellschaften ist, wenn sie binnen sechs Monaten nach dem Tag, an dem die Eintragung der Verschmelzung in das Register des Sitzes desjenigen Rechtsträgers, dessen Gläubiger sie sind, nach § 19 Absatz 3 UmwG als bekannt gemacht gilt, ihren Anspruch nach Grund und Höhe schriftlich anmelden, Sicherheit zu leisten, soweit sie nicht Befriedigung verlangen können. Dieses Recht steht den Gläubigern jedoch nur zu, wenn sie glaubhaft machen, dass durch die Verschmelzung die Erfüllung ihrer Forderung gefährdet wird."
    },
    {
      "date": "2024-11-13",
      "id": "93336",
      "original_text": "Einreichung neuer Dokumente\nBerlin Amtsgericht Berlin (Charlottenburg) HRB 183287\nmHealth Pioneers GmbH – Berlin",
      "type": "Einreichung neuer Dokumente",
      "state": "Berlin",
      "amtsgericht": "Amtsgericht Berlin (Charlottenburg)",
      "registernummer": "HRB 183287",
      "registerart": "HRB",
      "company_name": "mHealth Pioneers GmbH",
      "company_seat": "Berlin",
      "details": "13.11.2024 (Bekanntmachungsdatum)\n\nBerlin Amtsgericht Berlin (Charlottenburg) HRB 183287\nEinreichung neuer Dokumente\n\nmHealth Pioneers GmbH\nGesellschaft mit beschränkter Haftung\nBerlin\n\nAls nicht eingetragen wird veröffentlicht: Es wurde eine neue Liste der Beiratsmitglieder eingereicht (§ 52 GmbHG)"
    },
    {
      "date": "2024-11-13",
      "id": "93315",
      "original_text": "Sonstige Registerbekanntmachung\nBayern Amtsgericht Nürnberg HRB 584\nuniVersa Allgemeine Versicherung AG – Nürnberg",
      "type": "Sonstige Registerbekanntmachung",
      "state": "Bayern",
      "amtsgericht": "Amtsgericht Nürnberg",
      "registernummer": "HRB 584",
      "registerart": "HRB",
      "company_name": "uniVersa Allgemeine Versicherung AG",
      "company_seat": "Nürnberg",
      "details": "13.11.2024 (Bekanntmachungsdatum)\n\nBayern Amtsgericht Nürnberg HRB 584\nSonstige Registerbekanntmachung\n\nuniVersa Allgemeine Versicherung AG\nAktiengesellschaft\nNürnberg\n\nDem Amtsgericht Nürnberg -Registergericht- ist eine Liste der Mitglieder des Aufsichtsrats eingereicht worden, § 106 AktG."
    },
    {
      "date": "2024-11-13",
      "id": "93311",
      "original_text": "Einreichung neuer Dokumente\nBayern Amtsgericht Nürnberg HRB 12737\nuniVersa Beteiligungs-AG – Nürnberg",
      "type": "Einreichung neuer Dokumente",
      "state": "Bayern",
      "amtsgericht": "Amtsgericht Nürnberg",
      "registernummer": "HRB 12737",
      "registerart": "HRB",
      "company_name": "uniVersa Beteiligungs-AG",
      "company_seat": "Nürnberg",
      "details": "13.11.2024 (Bekanntmachungsdatum)\n\nBayern Amtsgericht Nürnberg HRB 12737\nEinreichung neuer Dokumente\n\nuniVersa Beteiligungs-AG\nAktiengesellschaft\nNürnberg\n\nDem Amtsgericht Nürnberg -Registergericht- ist eine Liste der Mitglieder des Aufsichtsrats eingereicht worden, § 106 AktG."
    },
    {
      "date": "2024-11-13",
      "id": "93314",
      "original_text": "Löschungsankündigung\nBayern Amtsgericht Augsburg HRB 27909\nwild wash UG (haftungsbeschränkt) – Augsburg",
      "type": "Löschungsankündigung",
      "state": "Bayern",
      "amtsgericht": "Amtsgericht Augsburg",
      "registernummer": "HRB 27909",
      "registerart": "HRB",
      "company_name": "wild wash UG (haftungsbeschränkt)",
      "company_seat": "Augsburg",
      "details": "13.11.2024 (Bekanntmachungsdatum)\n\nBayern Amtsgericht Augsburg HRB 27909\nLöschungsankündigung\n\nwild wash UG (haftungsbeschränkt)\nGesellschaft mit beschränkter Haftung\nAugsburg\n\nDas Registergericht beabsichtigt, die im Handelsregister eingetragene Gesellschaft wegen Vermögenslosigkeit von Amts wegen nach § 394 FamFG zu löschen. Die Frist zur Erhebung eines Widerspruchs ist auf einen Monat festgesetzt."
    },
    {
      "date": "2024-11-13",
      "id": "93376",
      "original_text": "Löschungsankündigung\nNordrhein-Westfalen Amtsgericht Gelsenkirchen HRB 14778\nÖrszigeti UG (haftungsbeschränkt) – Gelsenkirchen",
      "type": "Löschungsankündigung",
      "state": "Nordrhein-Westfalen",
      "amtsgericht": "Amtsgericht Gelsenkirchen",
      "registernummer": "HRB 14778",
      "registerart": "HRB",
      "company_name": "Örszigeti UG (haftungsbeschränkt)",
      "company_seat": "Gelsenkirchen",
      "details": "13.11.2024 (Bekanntmachungsdatum)\n\nNordrhein-Westfalen Amtsgericht Gelsenkirchen HRB 14778\nLöschungsankündigung\n\nÖrszigeti UG (haftungsbeschränkt)\nGesellschaft mit beschränkter Haftung\nGelsenkirchen\n\nDas Gericht beabsichtigt, die eingetragene Örszigeti UG (haftungsbeschränkt) mit Sitz in Gelsenkirchen, HRB 14778, Amtsgericht Gelsenkirchen, wegen Vermögenslosigkeit zu löschen.\nHiermit wird denjenigen, die an der Unterlassung der Löschung ein berechtigtes Interesse haben, gem. § 394 Abs. 2 FamFG Gelegenheit gegeben, gegen dieses Vorhaben binnen eines Monats nach dieser Bekanntmachung Widerspruch einzulegen. Der Widerspruch kann schriftlich oder zu Protokoll der Geschäftsstelle erhoben werden."
    }
  ]
}