{
  "date": "2024-11-07",
  "date_of_scrape": "2024-12-07T11:30:18.255Z",
  "tool_version": "0.2.0",
  "number_of_announcements": 132,
  "announcements": [
    {
      "date": "2024-11-07",
      "id": "92788",
      "original_text": "Löschungsankündigung\nBayern Amtsgericht München HRB 248260\nCFG Unternehmensberatung UG (haftungsbeschränkt) – München",
      "type": "Löschungsankündigung",
      "state": "Bayern",
      "amtsgericht": "Amtsgericht München",
      "registernummer": "HRB 248260",
      "registerart": "HRB",
      "company_name": "CFG Unternehmensberatung UG (haftungsbeschränkt)",
      "company_seat": "München",
      "details": "07.11.2024 (Bekanntmachungsdatum)\n\nBayern Amtsgericht München HRB 248260\nLöschungsankündigung 06.11.2024 (Eintragungsdatum)\n\nCFG Unternehmensberatung UG (haftungsbeschränkt)\nGesellschaft mit beschränkter Haftung\nMünchen\n\nDas Registergericht beabsichtigt, die im Handelsregister eingetragene Gesellschaft wegen Vermögenslosigkeit von Amts wegen nach § 394 FamFG zu löschen. Die Frist zur Erhebung eines Widerspruchs ist auf drei Monate festgesetzt."
    },
    {
      "date": "2024-11-07",
      "id": "92789",
      "original_text": "Einreichung neuer Dokumente\nBayern Amtsgericht München HRB 270166\nInnomotics GmbH – München",
      "type": "Einreichung neuer Dokumente",
      "state": "Bayern",
      "amtsgericht": "Amtsgericht München",
      "registernummer": "HRB 270166",
      "registerart": "HRB",
      "company_name": "Innomotics GmbH",
      "company_seat": "München",
      "details": "07.11.2024 (Bekanntmachungsdatum)\n\nBayern Amtsgericht München HRB 270166\nEinreichung neuer Dokumente\n\nInnomotics GmbH\nGesellschaft mit beschränkter Haftung\nMünchen\n\nDem Amtsgericht München -Registergericht- ist eine Liste der Mitglieder des Aufsichtsrats eingereicht worden, § 52 Abs. 3 S. 2 GmbHG."
    },
    {
      "date": "2024-11-07",
      "id": "92790",
      "original_text": "Registerbekanntmachung nach dem Umwandlungsgesetz\nBayern Amtsgericht Bamberg HRA 13279\nFliesen-Hauck e.K. – Zeil am Main, OT Ziegelanger",
      "type": "Registerbekanntmachung nach dem Umwandlungsgesetz",
      "state": "Bayern",
      "amtsgericht": "Amtsgericht Bamberg",
      "registernummer": "HRA 13279",
      "registerart": "HRA",
      "company_name": "Fliesen-Hauck e.K.",
      "company_seat": "Zeil am Main, OT Ziegelanger",
      "details": "07.11.2024 (Bekanntmachungsdatum)\n\nBayern Amtsgericht Bamberg HRA 13279\nRegisterbekanntmachung nach dem Umwandlungsgesetz 06.11.2024 (Eintragungsdatum)\n\nFliesen-Hauck e.K.\nEinzelkaufmann / Einzelkauffrau\nZeil am Main, OT Ziegelanger\n\nDen Gläubigern der an der Ausgliederung beteiligten Rechtsträger ist, wenn sie binnen sechs Monaten nach dem Tag, an dem die Eintragung der Ausgliederung in das Register des Sitzes desjenigen Rechtsträgers, dessen Gläubiger sie sind, nach §§ 125, 19 Abs. 3 UmwG als bekannt gemacht gilt, ihren Anspruch nach Grund und Höhe schriftlich anmelden, Sicherheit zu leisten, soweit sie nicht Befriedigung verlangen können. Dieses Recht steht den Gläubigern jedoch nur zu, wenn sie glaubhaft machen, dass durch die Ausgliederung die Erfüllung ihrer Forderung gefährdet wird."
    },
    {
      "date": "2024-11-07",
      "id": "92791",
      "original_text": "Registerbekanntmachung nach dem Umwandlungsgesetz\nBayern Amtsgericht Fürth HRB 14051\nMedical Valley International Cooperation GmbH – Erlangen",
      "type": "Registerbekanntmachung nach dem Umwandlungsgesetz",
      "state": "Bayern",
      "amtsgericht": "Amtsgericht Fürth",
      "registernummer": "HRB 14051",
      "registerart": "HRB",
      "company_name": "Medical Valley International Cooperation GmbH",
      "company_seat": "Erlangen",
      "details": "07.11.2024 (Bekanntmachungsdatum)\n\nBayern Amtsgericht Fürth HRB 14051\nRegisterbekanntmachung nach dem Umwandlungsgesetz 06.11.2024 (Eintragungsdatum)\n\nMedical Valley International Cooperation GmbH\nGesellschaft mit beschränkter Haftung\nErlangen\n\nDen Gläubigern der an der Verschmelzung beteiligten Rechtsträger ist, wenn sie binnen sechs Monaten nach dem Tag, an dem die Eintragung der Verschmelzung in das Register des Sitzes desjenigen Rechtsträgers, dessen Gläubiger sie sind, nach § 19 Abs. 3 UmwG als bekannt gemacht gilt, ihren Anspruch nach Grund und Höhe schriftlich anmelden, Sicherheit zu leisten, soweit sie nicht Befriedigung verlangen können. Dieses Recht steht den Gläubigern jedoch nur zu, wenn sie glaubhaft machen, dass durch die Verschmelzung die Erfüllung ihrer Forderung gefährdet wird."
    },
    {
      "date": "2024-11-07",
      "id": "92792",
      "original_text": "Registerbekanntmachung nach dem Umwandlungsgesetz\nBayern Amtsgericht Ansbach HRB 7062\nLemodo GmbH – Bechhofen",
      "type": "Registerbekanntmachung nach dem Umwandlungsgesetz",
      "state": "Bayern",
      "amtsgericht": "Amtsgericht Ansbach",
      "registernummer": "HRB 7062",
      "registerart": "HRB",
      "company_name": "Lemodo GmbH",
      "company_seat": "Bechhofen",
      "details": "07.11.2024 (Bekanntmachungsdatum)\n\nBayern Amtsgericht Ansbach HRB 7062\nRegisterbekanntmachung nach dem Umwandlungsgesetz 06.11.2024 (Eintragungsdatum)\n\nLemodo GmbH\nGesellschaft mit beschränkter Haftung\nBechhofen\n\nDen Gläubigern der an der Verschmelzung beteiligten Rechtsträger ist, wenn sie binnen sechs Monaten nach dem Tag, an dem die Eintragung der Verschmelzung in das Register des Sitzes desjenigen Rechtsträgers, dessen Gläubiger sie sind, nach § 19 Abs. 3 UmwG als bekannt gemacht gilt, ihren Anspruch nach Grund und Höhe schriftlich anmelden, Sicherheit zu leisten, soweit sie nicht Befriedigung verlangen können. Dieses Recht steht den Gläubigern jedoch nur zu, wenn sie glaubhaft machen, dass durch die Verschmelzung die Erfüllung ihrer Forderung gefährdet wird."
    },
    {
      "date": "2024-11-07",
      "id": "92793",
      "original_text": "Registerbekanntmachung nach dem Umwandlungsgesetz\nBayern Amtsgericht München HRB 55352\nTV 60 Filmproduktion GmbH – München",
      "type": "Registerbekanntmachung nach dem Umwandlungsgesetz",
      "state": "Bayern",
      "amtsgericht": "Amtsgericht München",
      "registernummer": "HRB 55352",
      "registerart": "HRB",
      "company_name": "TV 60 Filmproduktion GmbH",
      "company_seat": "München",
      "details": "07.11.2024 (Bekanntmachungsdatum)\n\nBayern Amtsgericht München HRB 55352\nRegisterbekanntmachung nach dem Umwandlungsgesetz 06.11.2024 (Eintragungsdatum)\n\nTV 60 Filmproduktion GmbH\nGesellschaft mit beschränkter Haftung\nMünchen\n\nDen Gläubigern der an der Verschmelzung beteiligten Rechtsträger ist, wenn sie binnen sechs Monaten nach dem Tag, an dem die Eintragung der Verschmelzung in das Register des Sitzes desjenigen Rechtsträgers, dessen Gläubiger sie sind, nach § 19 Abs. 3 UmwG als bekannt gemacht gilt, ihren Anspruch nach Grund und Höhe schriftlich anmelden, Sicherheit zu leisten, soweit sie nicht Befriedigung verlangen können. Dieses Recht steht den Gläubigern jedoch nur zu, wenn sie glaubhaft machen, dass durch die Verschmelzung die Erfüllung ihrer Forderung gefährdet wird."
    },
    {
      "date": "2024-11-07",
      "id": "92794",
      "original_text": "Registerbekanntmachung nach dem Umwandlungsgesetz\nBayern Amtsgericht München HRB 246083\nIT4Business UG (haftungsbeschränkt) – München",
      "type": "Registerbekanntmachung nach dem Umwandlungsgesetz",
      "state": "Bayern",
      "amtsgericht": "Amtsgericht München",
      "registernummer": "HRB 246083",
      "registerart": "HRB",
      "company_name": "IT4Business UG (haftungsbeschränkt)",
      "company_seat": "München",
      "details": "07.11.2024 (Bekanntmachungsdatum)\n\nBayern Amtsgericht München HRB 246083\nRegisterbekanntmachung nach dem Umwandlungsgesetz 06.11.2024 (Eintragungsdatum)\n\nIT4Business UG (haftungsbeschränkt)\nGesellschaft mit beschränkter Haftung\nMünchen\n\nDen Gläubigern der an der Verschmelzung beteiligten Rechtsträger ist, wenn sie binnen sechs Monaten nach dem Tag, an dem die Eintragung der Verschmelzung in das Register des Sitzes desjenigen Rechtsträgers, dessen Gläubiger sie sind, nach § 19 Abs. 3 UmwG als bekannt gemacht gilt, ihren Anspruch nach Grund und Höhe schriftlich anmelden, Sicherheit zu leisten, soweit sie nicht Befriedigung verlangen können. Dieses Recht steht den Gläubigern jedoch nur zu, wenn sie glaubhaft machen, dass durch die Verschmelzung die Erfüllung ihrer Forderung gefährdet wird."
    },
    {
      "date": "2024-11-07",
      "id": "92795",
      "original_text": "Registerbekanntmachung nach dem Umwandlungsgesetz\nBayern Amtsgericht Nürnberg HRB 40215\nACTAQUA Nürnberg GmbH – Nürnberg",
      "type": "Registerbekanntmachung nach dem Umwandlungsgesetz",
      "state": "Bayern",
      "amtsgericht": "Amtsgericht Nürnberg",
      "registernummer": "HRB 40215",
      "registerart": "HRB",
      "company_name": "ACTAQUA Nürnberg GmbH",
      "company_seat": "Nürnberg",
      "details": "07.11.2024 (Bekanntmachungsdatum)\n\nBayern Amtsgericht Nürnberg HRB 40215\nRegisterbekanntmachung nach dem Umwandlungsgesetz 06.11.2024 (Eintragungsdatum)\n\nACTAQUA Nürnberg GmbH\nGesellschaft mit beschränkter Haftung\nNürnberg\n\nDen Gläubigern der an der Verschmelzung beteiligten Rechtsträger ist, wenn sie binnen sechs Monaten nach dem Tag, an dem die Eintragung der Verschmelzung in das Register des Sitzes desjenigen Rechtsträgers, dessen Gläubiger sie sind, nach § 19 Abs. 3 UmwG als bekannt gemacht gilt, ihren Anspruch nach Grund und Höhe schriftlich anmelden, Sicherheit zu leisten, soweit sie nicht Befriedigung verlangen können. Dieses Recht steht den Gläubigern jedoch nur zu, wenn sie glaubhaft machen, dass durch die Verschmelzung die Erfüllung ihrer Forderung gefährdet wird."
    },
    {
      "date": "2024-11-07",
      "id": "92796",
      "original_text": "Registerbekanntmachung nach dem Umwandlungsgesetz\nBayern Amtsgericht Fürth HRB 14046\nMedical Valley GmbH – Erlangen",
      "type": "Registerbekanntmachung nach dem Umwandlungsgesetz",
      "state": "Bayern",
      "amtsgericht": "Amtsgericht Fürth",
      "registernummer": "HRB 14046",
      "registerart": "HRB",
      "company_name": "Medical Valley GmbH",
      "company_seat": "Erlangen",
      "details": "07.11.2024 (Bekanntmachungsdatum)\n\nBayern Amtsgericht Fürth HRB 14046\nRegisterbekanntmachung nach dem Umwandlungsgesetz 06.11.2024 (Eintragungsdatum)\n\nMedical Valley GmbH\nGesellschaft mit beschränkter Haftung\nErlangen\n\nDen Gläubigern der an der Verschmelzung beteiligten Rechtsträger ist, wenn sie binnen sechs Monaten nach dem Tag, an dem die Eintragung der Verschmelzung in das Register des Sitzes desjenigen Rechtsträgers, dessen Gläubiger sie sind, nach § 19 Abs. 3 UmwG als bekannt gemacht gilt, ihren Anspruch nach Grund und Höhe schriftlich anmelden, Sicherheit zu leisten, soweit sie nicht Befriedigung verlangen können. Dieses Recht steht den Gläubigern jedoch nur zu, wenn sie glaubhaft machen, dass durch die Verschmelzung die Erfüllung ihrer Forderung gefährdet wird."
    },
    {
      "date": "2024-11-07",
      "id": "92797",
      "original_text": "Registerbekanntmachung nach dem Umwandlungsgesetz\nBayern Amtsgericht Fürth HRB 17023\nDRX Pack GmbH – Fürth",
      "type": "Registerbekanntmachung nach dem Umwandlungsgesetz",
      "state": "Bayern",
      "amtsgericht": "Amtsgericht Fürth",
      "registernummer": "HRB 17023",
      "registerart": "HRB",
      "company_name": "DRX Pack GmbH",
      "company_seat": "Fürth",
      "details": "07.11.2024 (Bekanntmachungsdatum)\n\nBayern Amtsgericht Fürth HRB 17023\nRegisterbekanntmachung nach dem Umwandlungsgesetz 06.11.2024 (Eintragungsdatum)\n\nDRX Pack GmbH\nGesellschaft mit beschränkter Haftung\nFürth\n\nDen Gläubigern der an der Verschmelzung beteiligten Rechtsträger ist, wenn sie binnen sechs Monaten nach dem Tag, an dem die Eintragung der Verschmelzung in das Register des Sitzes desjenigen Rechtsträgers, dessen Gläubiger sie sind, nach § 19 Abs. 3 UmwG als bekannt gemacht gilt, ihren Anspruch nach Grund und Höhe schriftlich anmelden, Sicherheit zu leisten, soweit sie nicht Befriedigung verlangen können. Dieses Recht steht den Gläubigern jedoch nur zu, wenn sie glaubhaft machen, dass durch die Verschmelzung die Erfüllung ihrer Forderung gefährdet wird."
    },
    {
      "date": "2024-11-07",
      "id": "92798",
      "original_text": "Registerbekanntmachung nach dem Umwandlungsgesetz\nBayern Amtsgericht Fürth HRB 7621\nMAM GmbH Herstellung und Vertrieb von elektronischen Geräten – Erlangen",
      "type": "Registerbekanntmachung nach dem Umwandlungsgesetz",
      "state": "Bayern",
      "amtsgericht": "Amtsgericht Fürth",
      "registernummer": "HRB 7621",
      "registerart": "HRB",
      "company_name": "MAM GmbH Herstellung und Vertrieb von elektronischen Geräten",
      "company_seat": "Erlangen",
      "details": "07.11.2024 (Bekanntmachungsdatum)\n\nBayern Amtsgericht Fürth HRB 7621\nRegisterbekanntmachung nach dem Umwandlungsgesetz 06.11.2024 (Eintragungsdatum)\n\nMAM GmbH Herstellung und Vertrieb von elektronischen Geräten\nGesellschaft mit beschränkter Haftung\nErlangen\n\nDen Gläubigern der an der Verschmelzung beteiligten Rechtsträger ist, wenn sie binnen sechs Monaten nach dem Tag, an dem die Eintragung der Verschmelzung in das Register des Sitzes desjenigen Rechtsträgers, dessen Gläubiger sie sind, nach § 19 Abs. 3 UmwG als bekannt gemacht gilt, ihren Anspruch nach Grund und Höhe schriftlich anmelden, Sicherheit zu leisten, soweit sie nicht Befriedigung verlangen können. Dieses Recht steht den Gläubigern jedoch nur zu, wenn sie glaubhaft machen, dass durch die Verschmelzung die Erfüllung ihrer Forderung gefährdet wird."
    },
    {
      "date": "2024-11-07",
      "id": "92799",
      "original_text": "Registerbekanntmachung nach dem Umwandlungsgesetz\nBayern Amtsgericht Fürth HRB 8946\nPantel Service + Holding GmbH – Erlangen",
      "type": "Registerbekanntmachung nach dem Umwandlungsgesetz",
      "state": "Bayern",
      "amtsgericht": "Amtsgericht Fürth",
      "registernummer": "HRB 8946",
      "registerart": "HRB",
      "company_name": "Pantel Service + Holding GmbH",
      "company_seat": "Erlangen",
      "details": "07.11.2024 (Bekanntmachungsdatum)\n\nBayern Amtsgericht Fürth HRB 8946\nRegisterbekanntmachung nach dem Umwandlungsgesetz 06.11.2024 (Eintragungsdatum)\n\nPantel Service + Holding GmbH\nGesellschaft mit beschränkter Haftung\nErlangen\n\nDen Gläubigern der an der Verschmelzung beteiligten Rechtsträger ist, wenn sie binnen sechs Monaten nach dem Tag, an dem die Eintragung der Verschmelzung in das Register des Sitzes desjenigen Rechtsträgers, dessen Gläubiger sie sind, nach § 19 Abs. 3 UmwG als bekannt gemacht gilt, ihren Anspruch nach Grund und Höhe schriftlich anmelden, Sicherheit zu leisten, soweit sie nicht Befriedigung verlangen können. Dieses Recht steht den Gläubigern jedoch nur zu, wenn sie glaubhaft machen, dass durch die Verschmelzung die Erfüllung ihrer Forderung gefährdet wird."
    },
    {
      "date": "2024-11-07",
      "id": "92800",
      "original_text": "Registerbekanntmachung nach dem Umwandlungsgesetz\nBayern Amtsgericht Fürth HRA 10567\nXtema - Thomas Lebherz Textilmaschinen e.K. – Baiersdorf",
      "type": "Registerbekanntmachung nach dem Umwandlungsgesetz",
      "state": "Bayern",
      "amtsgericht": "Amtsgericht Fürth",
      "registernummer": "HRA 10567",
      "registerart": "HRA",
      "company_name": "Xtema - Thomas Lebherz Textilmaschinen e.K.",
      "company_seat": "Baiersdorf",
      "details": "07.11.2024 (Bekanntmachungsdatum)\n\nBayern Amtsgericht Fürth HRA 10567\nRegisterbekanntmachung nach dem Umwandlungsgesetz 06.11.2024 (Eintragungsdatum)\n\nXtema - Thomas Lebherz Textilmaschinen e.K.\nEinzelkaufmann / Einzelkauffrau\nBaiersdorf\n\nDen Gläubigern der an der Ausgliederung beteiligten Rechtsträger ist, wenn sie binnen sechs Monaten nach dem Tag, an dem die Eintragung der Ausgliederung in das Register des Sitzes desjenigen Rechtsträgers, dessen Gläubiger sie sind, nach §§ 125, 19 Abs. 3 UmwG als bekannt gemacht gilt, ihren Anspruch nach Grund und Höhe schriftlich anmelden, Sicherheit zu leisten, soweit sie nicht Befriedigung verlangen können. Dieses Recht steht den Gläubigern jedoch nur zu, wenn sie glaubhaft machen, dass durch die Ausgliederung die Erfüllung ihrer Forderung gefährdet wird."
    },
    {
      "date": "2024-11-07",
      "id": "92801",
      "original_text": "Löschungsankündigung\nBayern Amtsgericht München HRB 228575\nDWM Beratungs- & Vertriebsdienstleistungen GmbH – München",
      "type": "Löschungsankündigung",
      "state": "Bayern",
      "amtsgericht": "Amtsgericht München",
      "registernummer": "HRB 228575",
      "registerart": "HRB",
      "company_name": "DWM Beratungs- & Vertriebsdienstleistungen GmbH",
      "company_seat": "München",
      "details": "07.11.2024 (Bekanntmachungsdatum)\n\nBayern Amtsgericht München HRB 228575\nLöschungsankündigung\n\nDWM Beratungs- & Vertriebsdienstleistungen GmbH\nGesellschaft mit beschränkter Haftung\nMünchen\n\nDie Frist zur Erhebung eines Widerspruchs ist auf drei Monate festgesetzt.Das Registergericht beabsichtigt, die im Handelsregister eingetragene Gesellschaft wegen Vermögenslosigkeit von Amts wegen nach § 394 FamFG zu löschen. Die Frist zur Erhebung eines Widerspruchs ist auf drei Monate festgesetzt."
    },
    {
      "date": "2024-11-07",
      "id": "92802",
      "original_text": "Registerbekanntmachung nach dem Umwandlungsgesetz\nBayern Amtsgericht Ansbach HRB 4282\nNovel-Tech GmbH – Bechhofen",
      "type": "Registerbekanntmachung nach dem Umwandlungsgesetz",
      "state": "Bayern",
      "amtsgericht": "Amtsgericht Ansbach",
      "registernummer": "HRB 4282",
      "registerart": "HRB",
      "company_name": "Novel-Tech GmbH",
      "company_seat": "Bechhofen",
      "details": "07.11.2024 (Bekanntmachungsdatum)\n\nBayern Amtsgericht Ansbach HRB 4282\nRegisterbekanntmachung nach dem Umwandlungsgesetz 06.11.2024 (Eintragungsdatum)\n\nNovel-Tech GmbH\nGesellschaft mit beschränkter Haftung\nBechhofen\n\nDen Gläubigern der an der Verschmelzung beteiligten Rechtsträger ist, wenn sie binnen sechs Monaten nach dem Tag, an dem die Eintragung der Verschmelzung in das Register des Sitzes desjenigen Rechtsträgers, dessen Gläubiger sie sind, nach § 19 Abs. 3 UmwG als bekannt gemacht gilt, ihren Anspruch nach Grund und Höhe schriftlich anmelden, Sicherheit zu leisten, soweit sie nicht Befriedigung verlangen können. Dieses Recht steht den Gläubigern jedoch nur zu, wenn sie glaubhaft machen, dass durch die Verschmelzung die Erfüllung ihrer Forderung gefährdet wird."
    },
    {
      "date": "2024-11-07",
      "id": "92803",
      "original_text": "Registerbekanntmachung nach dem Umwandlungsgesetz\nBayern Amtsgericht Fürth HRB 17005\nFlaekkvy Holding GmbH – Fürth",
      "type": "Registerbekanntmachung nach dem Umwandlungsgesetz",
      "state": "Bayern",
      "amtsgericht": "Amtsgericht Fürth",
      "registernummer": "HRB 17005",
      "registerart": "HRB",
      "company_name": "Flaekkvy Holding GmbH",
      "company_seat": "Fürth",
      "details": "07.11.2024 (Bekanntmachungsdatum)\n\nBayern Amtsgericht Fürth HRB 17005\nRegisterbekanntmachung nach dem Umwandlungsgesetz 06.11.2024 (Eintragungsdatum)\n\nFlaekkvy Holding GmbH\nGesellschaft mit beschränkter Haftung\nFürth\n\nDen Gläubigern der an der Verschmelzung beteiligten Rechtsträger ist, wenn sie binnen sechs Monaten nach dem Tag, an dem die Eintragung der Verschmelzung in das Register des Sitzes desjenigen Rechtsträgers, dessen Gläubiger sie sind, nach § 19 Abs. 3 UmwG als bekannt gemacht gilt, ihren Anspruch nach Grund und Höhe schriftlich anmelden, Sicherheit zu leisten, soweit sie nicht Befriedigung verlangen können. Dieses Recht steht den Gläubigern jedoch nur zu, wenn sie glaubhaft machen, dass durch die Verschmelzung die Erfüllung ihrer Forderung gefährdet wird."
    },
    {
      "date": "2024-11-07",
      "id": "92804",
      "original_text": "Registerbekanntmachung nach dem Umwandlungsgesetz\nBayern Amtsgericht Nürnberg HRA 8337\nFantasia Film GmbH u. Co. Verleih KG – Nürnberg",
      "type": "Registerbekanntmachung nach dem Umwandlungsgesetz",
      "state": "Bayern",
      "amtsgericht": "Amtsgericht Nürnberg",
      "registernummer": "HRA 8337",
      "registerart": "HRA",
      "company_name": "Fantasia Film GmbH u. Co. Verleih KG",
      "company_seat": "Nürnberg",
      "details": "07.11.2024 (Bekanntmachungsdatum)\n\nBayern Amtsgericht Nürnberg HRA 8337\nRegisterbekanntmachung nach dem Umwandlungsgesetz 06.11.2024 (Eintragungsdatum)\n\nFantasia Film GmbH u. Co. Verleih KG\nKommanditgesellschaft\nNürnberg\n\nDen Gläubigern der an der Verschmelzung beteiligten Rechtsträger ist, wenn sie binnen sechs Monaten nach dem Tag, an dem die Eintragung der Verschmelzung in das Register des Sitzes desjenigen Rechtsträgers, dessen Gläubiger sie sind, nach § 19 Abs. 3 UmwG als bekannt gemacht gilt, ihren Anspruch nach Grund und Höhe schriftlich anmelden, Sicherheit zu leisten, soweit sie nicht Befriedigung verlangen können. Dieses Recht steht den Gläubigern jedoch nur zu, wenn sie glaubhaft machen, dass durch die Verschmelzung die Erfüllung ihrer Forderung gefährdet wird."
    },
    {
      "date": "2024-11-07",
      "id": "92805",
      "original_text": "Sonstige Registerbekanntmachung\nBayern Amtsgericht München HRB 185340\nArabella Hospitality SE – München",
      "type": "Sonstige Registerbekanntmachung",
      "state": "Bayern",
      "amtsgericht": "Amtsgericht München",
      "registernummer": "HRB 185340",
      "registerart": "HRB",
      "company_name": "Arabella Hospitality SE",
      "company_seat": "München",
      "details": "07.11.2024 (Bekanntmachungsdatum)\n\nBayern Amtsgericht München HRB 185340\nSonstige Registerbekanntmachung 06.11.2024 (Eintragungsdatum)\n\nArabella Hospitality SE\nEuropäische Aktiengesellschaft (SE)\nMünchen\n\nDem Amtsgericht München -Registergericht- ist eine Liste der Mitglieder des Aufsichtsrats eingereicht worden, Art. 9 Abs. 1 Buchst. c (ii) SE-VO i.V.m. § 106 AktG."
    },
    {
      "date": "2024-11-07",
      "id": "92806",
      "original_text": "Löschungsankündigung\nBayern Amtsgericht Augsburg HRB 32966\nCoffeemoments UG (haftungsbeschränkt) – Augsburg",
      "type": "Löschungsankündigung",
      "state": "Bayern",
      "amtsgericht": "Amtsgericht Augsburg",
      "registernummer": "HRB 32966",
      "registerart": "HRB",
      "company_name": "Coffeemoments UG (haftungsbeschränkt)",
      "company_seat": "Augsburg",
      "details": "07.11.2024 (Bekanntmachungsdatum)\n\nBayern Amtsgericht Augsburg HRB 32966\nLöschungsankündigung\n\nCoffeemoments UG (haftungsbeschränkt)\nGesellschaft mit beschränkter Haftung\nAugsburg\n\nDas Registergericht beabsichtigt, die im Handelsregister eingetragene Gesellschaft wegen Vermögenslosigkeit von Amts wegen nach § 394 FamFG zu löschen. Die Frist zur Erhebung eines Widerspruchs ist auf einen Monat festgesetzt."
    },
    {
      "date": "2024-11-07",
      "id": "92807",
      "original_text": "Löschungsankündigung\nBayern Amtsgericht Bayreuth HRB 3551\nDFAG GmbH – Bayreuth",
      "type": "Löschungsankündigung",
      "state": "Bayern",
      "amtsgericht": "Amtsgericht Bayreuth",
      "registernummer": "HRB 3551",
      "registerart": "HRB",
      "company_name": "DFAG GmbH",
      "company_seat": "Bayreuth",
      "details": "07.11.2024 (Bekanntmachungsdatum)\n\nBayern Amtsgericht Bayreuth HRB 3551\nLöschungsankündigung\n\nDFAG GmbH\nGesellschaft mit beschränkter Haftung\nBayreuth\n\nDas Registergericht beabsichtigt, die im Handelsregister eingetragene Gesellschaft wegen Vermögenslosigkeit von Amts wegen nach § 394 FamFG zu löschen. Die Frist zur Erhebung eines Widerspruchs ist auf drei Monate festgesetzt."
    },
    {
      "date": "2024-11-07",
      "id": "92808",
      "original_text": "Registerbekanntmachung nach dem Umwandlungsgesetz\nBayern Amtsgericht Nürnberg HRA 16760\nCINECITTA MULTIPLEXKINO GmbH & Co. KG – Nürnberg",
      "type": "Registerbekanntmachung nach dem Umwandlungsgesetz",
      "state": "Bayern",
      "amtsgericht": "Amtsgericht Nürnberg",
      "registernummer": "HRA 16760",
      "registerart": "HRA",
      "company_name": "CINECITTA MULTIPLEXKINO GmbH & Co. KG",
      "company_seat": "Nürnberg",
      "details": "07.11.2024 (Bekanntmachungsdatum)\n\nBayern Amtsgericht Nürnberg HRA 16760\nRegisterbekanntmachung nach dem Umwandlungsgesetz 06.11.2024 (Eintragungsdatum)\n\nCINECITTA MULTIPLEXKINO GmbH & Co. KG\nKommanditgesellschaft\nNürnberg\n\nDen Gläubigern der an der Verschmelzung beteiligten Rechtsträger ist, wenn sie binnen sechs Monaten nach dem Tag, an dem die Eintragung der Verschmelzung in das Register des Sitzes desjenigen Rechtsträgers, dessen Gläubiger sie sind, nach § 19 Abs. 3 UmwG als bekannt gemacht gilt, ihren Anspruch nach Grund und Höhe schriftlich anmelden, Sicherheit zu leisten, soweit sie nicht Befriedigung verlangen können. Dieses Recht steht den Gläubigern jedoch nur zu, wenn sie glaubhaft machen, dass durch die Verschmelzung die Erfüllung ihrer Forderung gefährdet wird."
    },
    {
      "date": "2024-11-07",
      "id": "92809",
      "original_text": "Registerbekanntmachung nach dem Umwandlungsgesetz\nBayern Amtsgericht München HRB 184488\nGrit 62. Vermögensverwaltungs GmbH – München",
      "type": "Registerbekanntmachung nach dem Umwandlungsgesetz",
      "state": "Bayern",
      "amtsgericht": "Amtsgericht München",
      "registernummer": "HRB 184488",
      "registerart": "HRB",
      "company_name": "Grit 62. Vermögensverwaltungs GmbH",
      "company_seat": "München",
      "details": "07.11.2024 (Bekanntmachungsdatum)\n\nBayern Amtsgericht München HRB 184488\nRegisterbekanntmachung nach dem Umwandlungsgesetz\n\nGrit 62. Vermögensverwaltungs GmbH\nGesellschaft mit beschränkter Haftung\nMünchen\n\nBeim Handelsregister ist nach § 308 Abs. 1 Satz 1 UmwG der Entwurf des Verschmelzungsplans über die grenzüberschreitende Verschmelzung der Grit 62. Vermögensverwaltungs GmbH mit Sitz in München, Deutschland sowie der Grit 61. Vermögensverwaltungs GmbH mit Sitz in München, Deutschland, und der El Estero Haftungs GmbH mit Sitz in München, Deutschland, alle als übertragende Rechtsträger auf die INVERSIONES CAECIUS, S.L.U. mit Sitz in Madrid, Spanien, als übernehmenden Rechtsträger eingereicht worden. An der grenzüberschreitenden Verschmelzung sind die folgenden Gesellschaften beteiligt: Die Grit 62. Vermögensverwaltungs GmbH, eine Gesellschaft mit beschränkter Haftung nach deutschem Recht mit Sitz in München, Deutschland als übertragender Rechtsträger.  Die Grit 61. Vermögensverwaltungs GmbH, eine Gesellschaft mit beschränkter Haftung nach deutschem Recht mit Sitz in München, Deutschland, als weiterer übertragender Rechtsträger.  Die El Estero Haftungs GmbH, eine Gesellschaft mit beschränkter Haftung nach deutschem Recht mit Sitz in München, Deutschland, ebenfalls als weiterer übertragender Rechtsträger. Die INVERSIONES CAE-CIUS, S.L.U., eine Gesellschaft mit beschränkter Haftung und nur einem Gesellschafter nach spanischem Recht mit Sitz in Madrid, Spanien, als übernehmender Rechtsträger. Die an der grenzüberschreitenden Verschmelzung beteiligten Gesellschaften sind wie folgt im jeweiligen nationalen Register eingetragen:  Die Grit 62. Vermögensverwaltungs GmbH als übertragender Rechtsträger ist eingetragen im Handelsregister des Amtsgerichts München unter HRB 184488. Die Grit 61. Vermögensverwaltungs GmbH als weiterer übertragender Rechtsträger ist eingetragen im Handelsregister des Amtsgerichts München unter HRB 184523. Die El Estero Haftungs GmbH als weiterer  übertragender Rechtsträger ist eingetragen im Handelsregister des Amtsgerichts München unter HRB 187218.Die INVERSIONES CAE-CIUS, S.L.U. als übernehmender Rechtsträger ist eingetragen im Gesellschaftsregister von Madrid (Registro Mercantil de Madrid) unter Band 36.007, Seite 147, Blatt M-646.981. Weder bei dem übernehmenden Rechtsträger noch bei den übertragenden Rechtsträgern besteht ein Betriebsrat, und weder der übernehmende Rechtsträger noch die übertragenden Rechtsträger beschäftigen Arbeitnehmer. Die Anteilsinhaber und Gläubiger der an der grenzüberschreitenden Verschmelzung beteiligten Rechtsträger werden darauf hingewiesen, dass sie der Gesellschaft spätestens fünf Arbeitstage vor dem Tag der Beurkundung des gemeinsamen Verschmelzungsplans Bemerkungen zum gemeinsamen Verschmelzungsplan übermitteln können. Sämtliche Bemerkungen sind bis zum 10. Dezember 2024 unmittelbar an die Grit 62. Vermögensverwaltungs GmbH an ihre Geschäftsanschrift Eschersheimer Landstraße 14, 60322 Frankfurt am Main, Deutschland, (E-Mail: vrodriguez@ga-p.com) zu übermitteln."
    },
    {
      "date": "2024-11-07",
      "id": "92810",
      "original_text": "Einreichung neuer Dokumente\nBayern Amtsgericht München HRB 283006\ninnoscripta AG – München",
      "type": "Einreichung neuer Dokumente",
      "state": "Bayern",
      "amtsgericht": "Amtsgericht München",
      "registernummer": "HRB 283006",
      "registerart": "HRB",
      "company_name": "innoscripta AG",
      "company_seat": "München",
      "details": "07.11.2024 (Bekanntmachungsdatum)\n\nBayern Amtsgericht München HRB 283006\nEinreichung neuer Dokumente 06.11.2024 (Eintragungsdatum)\n\ninnoscripta AG\nAktiengesellschaft\nMünchen\n\nDem Amtsgericht München -Registergericht- ist eine Liste der Mitglieder des Aufsichtsrats eingereicht worden, § 106 AktG."
    },
    {
      "date": "2024-11-07",
      "id": "92811",
      "original_text": "Löschungsankündigung\nBerlin Amtsgericht Berlin (Charlottenburg) HRB 135347\nVolksdiamant GmbH – Berlin",
      "type": "Löschungsankündigung",
      "state": "Berlin",
      "amtsgericht": "Amtsgericht Berlin (Charlottenburg)",
      "registernummer": "HRB 135347",
      "registerart": "HRB",
      "company_name": "Volksdiamant GmbH",
      "company_seat": "Berlin",
      "details": "07.11.2024 (Bekanntmachungsdatum)\n\nBerlin Amtsgericht Berlin (Charlottenburg) HRB 135347\nLöschungsankündigung\n\nVolksdiamant GmbH\nGesellschaft mit beschränkter Haftung\nBerlin\n\nBei der nachstehenden Gesellschaft wird das Amtslöschungsverfahren gemäß § 394 FamFG eingeleitet. Widerspruchsfrist 6 Wochen"
    },
    {
      "date": "2024-11-07",
      "id": "92812",
      "original_text": "Registerbekanntmachung nach dem Umwandlungsgesetz\nBaden-Württemberg Amtsgericht Stuttgart HRB 102383\nPelzhaus Barth GmbH – Neckarsulm",
      "type": "Registerbekanntmachung nach dem Umwandlungsgesetz",
      "state": "Baden-Württemberg",
      "amtsgericht": "Amtsgericht Stuttgart",
      "registernummer": "HRB 102383",
      "registerart": "HRB",
      "company_name": "Pelzhaus Barth GmbH",
      "company_seat": "Neckarsulm",
      "details": "07.11.2024 (Bekanntmachungsdatum)\n\nBaden-Württemberg Amtsgericht Stuttgart HRB 102383\nRegisterbekanntmachung nach dem Umwandlungsgesetz 07.11.2024 (Eintragungsdatum)\n\nPelzhaus Barth GmbH\nGesellschaft mit beschränkter Haftung\nNeckarsulm\n\nAls nicht eingetragen wird bekanntgemacht:\nDen Gläubigern der an der Verschmelzung beteiligten Rechtsträger ist, wenn sie binnen sechs Monaten nach dem Tag, an dem die Eintragung der Verschmelzung in das Register des Sitzes desjenigen Rechtsträgers, dessen Gläubiger sie sind, nach § 19 Abs. 3 UmwG als bekanntgemacht gilt, ihren Anspruch nach Grund und Höhe schriftlich anmelden, Sicherheit zu leisten, soweit sie nicht Befriedigung verlangen können. Dieses Recht steht den Gläubigern jedoch nur zu, wenn sie glaubhaft machen, dass durch die Verschmelzung die Erfüllung ihrer Forderung gefährdet wird."
    },
    {
      "date": "2024-11-07",
      "id": "92813",
      "original_text": "Registerbekanntmachung nach dem Umwandlungsgesetz\nBaden-Württemberg Amtsgericht Stuttgart HRA 741757\nWerner Barth, Die Pelzwerkstatt e.K. – Neckarsulm",
      "type": "Registerbekanntmachung nach dem Umwandlungsgesetz",
      "state": "Baden-Württemberg",
      "amtsgericht": "Amtsgericht Stuttgart",
      "registernummer": "HRA 741757",
      "registerart": "HRA",
      "company_name": "Werner Barth, Die Pelzwerkstatt e.K.",
      "company_seat": "Neckarsulm",
      "details": "07.11.2024 (Bekanntmachungsdatum)\n\nBaden-Württemberg Amtsgericht Stuttgart HRA 741757\nRegisterbekanntmachung nach dem Umwandlungsgesetz 07.11.2024 (Eintragungsdatum)\n\nWerner Barth, Die Pelzwerkstatt e.K.\nEinzelkaufmann / Einzelkauffrau\nNeckarsulm\n\nAls nicht eingetragen wird bekanntgemacht:\nDen Gläubigern der an der Verschmelzung beteiligten Rechtsträger ist, wenn sie binnen sechs Monaten nach dem Tag, an dem die Eintragung der Verschmelzung in das Register des Sitzes desjenigen Rechtsträgers, dessen Gläubiger sie sind, nach § 19 Abs. 3 UmwG als bekanntgemacht gilt, ihren Anspruch nach Grund und Höhe schriftlich anmelden, Sicherheit zu leisten, soweit sie nicht Befriedigung verlangen können. Dieses Recht steht den Gläubigern jedoch nur zu, wenn sie glaubhaft machen, dass durch die Verschmelzung die Erfüllung ihrer Forderung gefährdet wird."
    },
    {
      "date": "2024-11-07",
      "id": "92814",
      "original_text": "Einreichung neuer Dokumente\nBaden-Württemberg Amtsgericht Mannheim HRB 703230\nnora systems GmbH – Weinheim",
      "type": "Einreichung neuer Dokumente",
      "state": "Baden-Württemberg",
      "amtsgericht": "Amtsgericht Mannheim",
      "registernummer": "HRB 703230",
      "registerart": "HRB",
      "company_name": "nora systems GmbH",
      "company_seat": "Weinheim",
      "details": "07.11.2024 (Bekanntmachungsdatum)\n\nBaden-Württemberg Amtsgericht Mannheim HRB 703230\nEinreichung neuer Dokumente\n\nnora systems GmbH\nGesellschaft mit beschränkter Haftung\nWeinheim\n\nDie Gesellschaft hat am 29.10.2024 die Liste über die Zusammensetzung des Aufsichtsrats zum Handelsregister eingereicht."
    },
    {
      "date": "2024-11-07",
      "id": "92815",
      "original_text": "Einreichung neuer Dokumente\nBaden-Württemberg Amtsgericht Mannheim HRB 703230\nnora systems GmbH – Weinheim",
      "type": "Einreichung neuer Dokumente",
      "state": "Baden-Württemberg",
      "amtsgericht": "Amtsgericht Mannheim",
      "registernummer": "HRB 703230",
      "registerart": "HRB",
      "company_name": "nora systems GmbH",
      "company_seat": "Weinheim",
      "details": "07.11.2024 (Bekanntmachungsdatum)\n\nBaden-Württemberg Amtsgericht Mannheim HRB 703230\nEinreichung neuer Dokumente\n\nnora systems GmbH\nGesellschaft mit beschränkter Haftung\nWeinheim\n\nDie Gesellschaft hat am 05.11.2024 die Liste über die Zusammensetzung des Aufsichtsrats zum Handelsregister eingereicht."
    },
    {
      "date": "2024-11-07",
      "id": "92816",
      "original_text": "Einreichung neuer Dokumente\nBrandenburg Amtsgericht Cottbus HRB 2174\nWohnungsbaugesellschaft Elsteraue mbH – Herzberg (Elster)",
      "type": "Einreichung neuer Dokumente",
      "state": "Brandenburg",
      "amtsgericht": "Amtsgericht Cottbus",
      "registernummer": "HRB 2174",
      "registerart": "HRB",
      "company_name": "Wohnungsbaugesellschaft Elsteraue mbH",
      "company_seat": "Herzberg (Elster)",
      "details": "07.11.2024 (Bekanntmachungsdatum)\n\nBrandenburg Amtsgericht Cottbus HRB 2174\nEinreichung neuer Dokumente\n\nWohnungsbaugesellschaft Elsteraue mbH\nGesellschaft mit beschränkter Haftung\nHerzberg (Elster)\n\nAls nicht eingetragen wird veröffentlicht:\nDer Geschäftsführer hat eine Liste der Aufsichtsratsmitglieder gem. § 52 Abs. 3 Satz 2 GmbHG zum Handelsregister eingereicht"
    },
    {
      "date": "2024-11-07",
      "id": "92817",
      "original_text": "Löschungsankündigung\nSaarland Amtsgericht Saarbrücken HRB 92065\nTERRA-NOVA Immobilienvermittlungsgesellschaft mbH – Ottweiler",
      "type": "Löschungsankündigung",
      "state": "Saarland",
      "amtsgericht": "Amtsgericht Saarbrücken",
      "registernummer": "HRB 92065",
      "registerart": "HRB",
      "company_name": "TERRA-NOVA Immobilienvermittlungsgesellschaft mbH",
      "company_seat": "Ottweiler",
      "details": "07.11.2024 (Bekanntmachungsdatum)\n\nSaarland Amtsgericht Saarbrücken HRB 92065\nLöschungsankündigung\n\nTERRA-NOVA Immobilienvermittlungsgesellschaft mbH\nGesellschaft mit beschränkter Haftung\nOttweiler\n\nEs ist beabsichtigt, die Gesellschaft von Amts wegen gemäß § 394 FamFG wegen Vermögenslosigkeit zu löschen.\nGegen die Löschung von Amts wegen ist das Rechtsmittel des Widerspruchs statthaft. Der Widerspruch ist binnen einer Frist drei Monaten beginnend mit dem Tag dieser Veröffentlichung durch Einreichen eines Widerspruchsschreibens -schriftlich oder zur Niederschrift der Geschäftsstelle beim Amtsgericht Saarbrücken, -zentrales Handelsregister-, Mainzerstr.178, 66121 Saarbrücken einzulegen.\nDer Widerspruch muss die Bezeichnung der angefochtenen Löschungsankündigung enthalten sowie die Erklärung, dass Widerspruch eingelegt wird. Er ist vom Widerspruchsführer oder seinem Bevollmächtigten zu unterzeichnen.\nDas Widerspruchsschreiben kann auch in der Form eines elektronischen Dokumentes eingereicht werden, das mit einer qualifizierten elektronischen Signatur nach dem Signaturgesetz versehen sein muss (§§ 14 Abs. 2 FamFG, 130a, 298 ZPO)."
    },
    {
      "date": "2024-11-07",
      "id": "92818",
      "original_text": "Löschungsankündigung\nBerlin Amtsgericht Berlin (Charlottenburg) HRB 246457\nBAS Sicherheitsdienst Berlin GmbH – Berlin",
      "type": "Löschungsankündigung",
      "state": "Berlin",
      "amtsgericht": "Amtsgericht Berlin (Charlottenburg)",
      "registernummer": "HRB 246457",
      "registerart": "HRB",
      "company_name": "BAS Sicherheitsdienst Berlin GmbH",
      "company_seat": "Berlin",
      "details": "07.11.2024 (Bekanntmachungsdatum)\n\nBerlin Amtsgericht Berlin (Charlottenburg) HRB 246457\nLöschungsankündigung\n\nBAS Sicherheitsdienst Berlin GmbH\nGesellschaft mit beschränkter Haftung\nBerlin\n\nBei der nachstehenden Gesellschaft wird das Amtslöschungsverfahren gemäß § 394 FamFG eingeleitet. Widerspruchsfrist 6 Wochen"
    },
    {
      "date": "2024-11-07",
      "id": "92819",
      "original_text": "Einreichung neuer Dokumente\nMecklenburg-Vorpommern Amtsgericht Neubrandenburg HRB 1742\nGemeinnützige Wohnungsbaugesellschaft mbH Strasburg – Strasburg",
      "type": "Einreichung neuer Dokumente",
      "state": "Mecklenburg-Vorpommern",
      "amtsgericht": "Amtsgericht Neubrandenburg",
      "registernummer": "HRB 1742",
      "registerart": "HRB",
      "company_name": "Gemeinnützige Wohnungsbaugesellschaft mbH Strasburg",
      "company_seat": "Strasburg",
      "details": "07.11.2024 (Bekanntmachungsdatum)\n\nMecklenburg-Vorpommern Amtsgericht Neubrandenburg HRB 1742\nEinreichung neuer Dokumente\n\nGemeinnützige Wohnungsbaugesellschaft mbH Strasburg\nGesellschaft mit beschränkter Haftung\nStrasburg\n\nEine Liste der Mitglieder des Aufsichtsrats ist zum Handelsregister eingereicht worden."
    },
    {
      "date": "2024-11-07",
      "id": "92820",
      "original_text": "Sonstige Registerbekanntmachung\nSachsen-Anhalt Amtsgericht Stendal GnR 2402\nHarzer Volksbank eG – Wernigerode",
      "type": "Sonstige Registerbekanntmachung",
      "state": "Sachsen-Anhalt",
      "amtsgericht": "Amtsgericht Stendal",
      "registernummer": "GnR 2402",
      "registerart": "GnR",
      "company_name": "Harzer Volksbank eG",
      "company_seat": "Wernigerode",
      "details": "07.11.2024 (Bekanntmachungsdatum)\n\nSachsen-Anhalt Amtsgericht Stendal GnR 2402\nSonstige Registerbekanntmachung 20.12.2021 (Eintragungsdatum)\n\nHarzer Volksbank eG\neingetragene Genossenschaft\nWernigerode\n\nBis 31.12.2021: beschränkte Nachschusspflicht. Haftsumme je Geschäftsanteil: ab 01.01.2002: 200,- EUR Ab 01.01.2022: Keine NachschusspflichtAls nicht eingetragen wird veröffentlicht:\n\nDen Gläubigern der Genossenschaft ist, wenn sie sich binnen 6 Monaten nach der Bekanntmachung bei der Genossenschaft zu diesem Zweck melden, Sicherheit zu leisten, soweit sie nicht Befriedigung verlangen können (§ 22 Abs. 1 bis 3 GenG)."
    },
    {
      "date": "2024-11-07",
      "id": "92821",
      "original_text": "Registerbekanntmachung nach dem Umwandlungsgesetz\nBaden-Württemberg Amtsgericht Stuttgart HRB 796771\nAKENO Ludwigsburg GmbH – Ludwigsburg",
      "type": "Registerbekanntmachung nach dem Umwandlungsgesetz",
      "state": "Baden-Württemberg",
      "amtsgericht": "Amtsgericht Stuttgart",
      "registernummer": "HRB 796771",
      "registerart": "HRB",
      "company_name": "AKENO Ludwigsburg GmbH",
      "company_seat": "Ludwigsburg",
      "details": "07.11.2024 (Bekanntmachungsdatum)\n\nBaden-Württemberg Amtsgericht Stuttgart HRB 796771\nRegisterbekanntmachung nach dem Umwandlungsgesetz 07.11.2024 (Eintragungsdatum)\n\nAKENO Ludwigsburg GmbH\nGesellschaft mit beschränkter Haftung\nLudwigsburg\n\nDen Gläubigern der an der Ausgliederung beteiligten Rechtsträger ist, wenn sie binnen sechs Monaten nach dem Tag, an dem die Eintragung der Ausgliederung in das Register des Sitzes desjenigen Rechtsträgers, dessen Gläubiger sie sind, nach § 19 Abs. 3 UmwG als bekanntgemacht gilt, ihren Anspruch nach Grund und Höhe schriftlich anmelden, Sicherheit zu leisten, soweit sie nicht Befriedigung verlangen können. Dieses Recht steht den Gläubigern jedoch nur zu, wenn sie glaubhaft machen, dass durch die Ausgliederung die Erfüllung ihrer Forderung gefährdet wird."
    },
    {
      "date": "2024-11-07",
      "id": "92822",
      "original_text": "Sonstige Registerbekanntmachung\nHamburg Amtsgericht Hamburg HRB 159581\nZEAL Network SE – Hamburg",
      "type": "Sonstige Registerbekanntmachung",
      "state": "Hamburg",
      "amtsgericht": "Amtsgericht Hamburg",
      "registernummer": "HRB 159581",
      "registerart": "HRB",
      "company_name": "ZEAL Network SE",
      "company_seat": "Hamburg",
      "details": "07.11.2024 (Bekanntmachungsdatum)\n\nHamburg Amtsgericht Hamburg HRB 159581\nSonstige Registerbekanntmachung\n\nZEAL Network SE\nEuropäische Aktiengesellschaft (SE)\nHamburg\n\nAls nicht eingetragen wird bekannt gemacht: Liste des Aufsichtsrats wurde eingereicht."
    },
    {
      "date": "2024-11-07",
      "id": "92823",
      "original_text": "Registerbekanntmachung nach dem Umwandlungsgesetz\nBaden-Württemberg Amtsgericht Stuttgart HRA 741624\nTrinh Viet Hoa AKENO e.K. – Ludwigsburg",
      "type": "Registerbekanntmachung nach dem Umwandlungsgesetz",
      "state": "Baden-Württemberg",
      "amtsgericht": "Amtsgericht Stuttgart",
      "registernummer": "HRA 741624",
      "registerart": "HRA",
      "company_name": "Trinh Viet Hoa AKENO e.K.",
      "company_seat": "Ludwigsburg",
      "details": "07.11.2024 (Bekanntmachungsdatum)\n\nBaden-Württemberg Amtsgericht Stuttgart HRA 741624\nRegisterbekanntmachung nach dem Umwandlungsgesetz 07.11.2024 (Eintragungsdatum)\n\nTrinh Viet Hoa AKENO e.K.\nEinzelkaufmann / Einzelkauffrau\nLudwigsburg\n\nAls nicht eingetragen wird bekanntgemacht:\nDen Gläubigern der an der Ausgliederung beteiligten Rechtsträger ist, wenn sie binnen sechs Monaten nach dem Tag, an dem die Eintragung der Ausgliederung in das Register des Sitzes desjenigen Rechtsträgers, dessen Gläubiger sie sind, nach § 19 Abs. 3 UmwG als bekanntgemacht gilt, ihren Anspruch nach Grund und Höhe schriftlich anmelden, Sicherheit zu leisten, soweit sie nicht Befriedigung verlangen können. Dieses Recht steht den Gläubigern jedoch nur zu, wenn sie glaubhaft machen, dass durch die Ausgliederung die Erfüllung ihrer Forderung gefährdet wird."
    },
    {
      "date": "2024-11-07",
      "id": "92824",
      "original_text": "Löschungsankündigung\nBerlin Amtsgericht Berlin (Charlottenburg) HRB 185051\nKontrastClean UG (haftungsbeschränkt) – Berlin",
      "type": "Löschungsankündigung",
      "state": "Berlin",
      "amtsgericht": "Amtsgericht Berlin (Charlottenburg)",
      "registernummer": "HRB 185051",
      "registerart": "HRB",
      "company_name": "KontrastClean UG (haftungsbeschränkt)",
      "company_seat": "Berlin",
      "details": "07.11.2024 (Bekanntmachungsdatum)\n\nBerlin Amtsgericht Berlin (Charlottenburg) HRB 185051\nLöschungsankündigung\n\nKontrastClean UG (haftungsbeschränkt)\nGesellschaft mit beschränkter Haftung\nBerlin\n\nBei der nachstehenden Gesellschaft wird das Amtslöschungsverfahren gemäß § 394 FamFG eingeleitet. Widerspruchsfrist 6 Wochen"
    },
    {
      "date": "2024-11-07",
      "id": "92825",
      "original_text": "Sonstige Registerbekanntmachung\nSachsen-Anhalt Amtsgericht Stendal GnR 2162\nVolksbank Magdeburg eG – Magdeburg",
      "type": "Sonstige Registerbekanntmachung",
      "state": "Sachsen-Anhalt",
      "amtsgericht": "Amtsgericht Stendal",
      "registernummer": "GnR 2162",
      "registerart": "GnR",
      "company_name": "Volksbank Magdeburg eG",
      "company_seat": "Magdeburg",
      "details": "07.11.2024 (Bekanntmachungsdatum)\n\nSachsen-Anhalt Amtsgericht Stendal GnR 2162\nSonstige Registerbekanntmachung 13.07.2022 (Eintragungsdatum)\n\nVolksbank Magdeburg eG\neingetragene Genossenschaft\nMagdeburg\n\nAls nicht eingetragen wird veröffentlicht:\n\nAb dem 01.01.2022 ist die Nachschusspflicht der Mitglieder ausgeschlossen.\n\nDen Gläubigern der Genossenschaft ist, wenn sie sich binnen 6 Monaten nach der Bekanntmachung bei der Genossenschaft zu diesem Zweck melden, Sicherheit zu leisten, soweit sie nicht Befriedigung verlangen können (§ 22 Abs. 1 bis 3 GenG)."
    },
    {
      "date": "2024-11-07",
      "id": "92826",
      "original_text": "Sonstige Registerbekanntmachung\nSachsen-Anhalt Amtsgericht Stendal GnR 2402\nHarzer Volksbank eG – Wernigerode",
      "type": "Sonstige Registerbekanntmachung",
      "state": "Sachsen-Anhalt",
      "amtsgericht": "Amtsgericht Stendal",
      "registernummer": "GnR 2402",
      "registerart": "GnR",
      "company_name": "Harzer Volksbank eG",
      "company_seat": "Wernigerode",
      "details": "07.11.2024 (Bekanntmachungsdatum)\n\nSachsen-Anhalt Amtsgericht Stendal GnR 2402\nSonstige Registerbekanntmachung 20.12.2021 (Eintragungsdatum)\n\nHarzer Volksbank eG\neingetragene Genossenschaft\nWernigerode\n\nBis 31.12.2021: beschränkte Nachschusspflicht. Haftsumme je Geschäftsanteil: ab 01.01.2002: 200,- EUR Ab 01.01.2022: Keine Nachschusspflicht\nAls nicht eingetragen wird veröffentlicht:\n\nDen Gläubigern der Genossenschaft ist, wenn sie sich binnen 6 Monaten nach der Bekanntmachung bei der Genossenschaft zu diesem Zweck melden, Sicherheit zu leisten, soweit sie nicht Befriedigung verlangen können (§ 22 Abs. 1 bis 3 GenG)."
    },
    {
      "date": "2024-11-07",
      "id": "92827",
      "original_text": "Löschungsankündigung\nSaarland Amtsgericht Saarbrücken HRB 104559\nD2FA-Consulting UG (haftungsbeschränkt) – Saarbrücken",
      "type": "Löschungsankündigung",
      "state": "Saarland",
      "amtsgericht": "Amtsgericht Saarbrücken",
      "registernummer": "HRB 104559",
      "registerart": "HRB",
      "company_name": "D2FA-Consulting UG (haftungsbeschränkt)",
      "company_seat": "Saarbrücken",
      "details": "07.11.2024 (Bekanntmachungsdatum)\n\nSaarland Amtsgericht Saarbrücken HRB 104559\nLöschungsankündigung 19.07.2024 (Eintragungsdatum)\n\nD2FA-Consulting UG (haftungsbeschränkt)\nGesellschaft mit beschränkter Haftung\nSaarbrücken\n\nEs ist beabsichtigt, die Gesellschaft von Amts wegen gemäß § 394 FamFG wegen Vermögenslosigkeit zu löschen.\nGegen die Löschung von Amts wegen ist das Rechtsmittel des Widerspruchs statthaft. Der Widerspruch ist binnen einer Frist von 1 Monat beginnend mit dem Tag dieser Veröffentlichung durch Einreichen eines Widerspruchsschreibens -schriftlich oder zur Niederschrift der Geschäftsstelle beim Amtsgericht Saarbrücken, -zentrales Handelsregister-, Mainzerstr.178, 66121 Saarbrücken einzulegen.\nDer Widerspruch muss die Bezeichnung der angefochtenen Löschungsankündigung enthalten sowie die Erklärung, dass Widerspruch eingelegt wird. Er ist vom Widerspruchsführer oder seinem Bevollmächtigten zu unterzeichnen.\nDas Widerspruchsschreiben kann auch in der Form eines elektronischen Dokumentes eingereicht werden, das mit einer qualifizierten elektronischen Signatur nach dem Signaturgesetz versehen sein muss (§§ 14 Abs. 2 FamFG, 130a, 298 ZPO)."
    },
    {
      "date": "2024-11-07",
      "id": "92828",
      "original_text": "Löschungsankündigung\nBerlin Amtsgericht Berlin (Charlottenburg) HRB 164074\nFûkei UG (haftungsbeschränkt) – Berlin",
      "type": "Löschungsankündigung",
      "state": "Berlin",
      "amtsgericht": "Amtsgericht Berlin (Charlottenburg)",
      "registernummer": "HRB 164074",
      "registerart": "HRB",
      "company_name": "Fûkei UG (haftungsbeschränkt)",
      "company_seat": "Berlin",
      "details": "07.11.2024 (Bekanntmachungsdatum)\n\nBerlin Amtsgericht Berlin (Charlottenburg) HRB 164074\nLöschungsankündigung\n\nFûkei UG (haftungsbeschränkt)\nGesellschaft mit beschränkter Haftung\nBerlin\n\nBei der nachstehenden Gesellschaft wird das Amtslöschungsverfahren gemäß § 394 FamFG eingeleitet. Widerspruchsfrist 6 Wochen"
    },
    {
      "date": "2024-11-07",
      "id": "92829",
      "original_text": "Registerbekanntmachung nach dem Umwandlungsgesetz\nBaden-Württemberg Amtsgericht Stuttgart HRB 754912\nEPPLEZWEI GmbH – Stuttgart",
      "type": "Registerbekanntmachung nach dem Umwandlungsgesetz",
      "state": "Baden-Württemberg",
      "amtsgericht": "Amtsgericht Stuttgart",
      "registernummer": "HRB 754912",
      "registerart": "HRB",
      "company_name": "EPPLEZWEI GmbH",
      "company_seat": "Stuttgart",
      "details": "07.11.2024 (Bekanntmachungsdatum)\n\nBaden-Württemberg Amtsgericht Stuttgart HRB 754912\nRegisterbekanntmachung nach dem Umwandlungsgesetz 07.11.2024 (Eintragungsdatum)\n\nEPPLEZWEI GmbH\nGesellschaft mit beschränkter Haftung\nStuttgart\n\nAls nicht eingetragen wird bekanntgemacht:\nDen Gläubigern der an der Verschmelzung beteiligten Rechtsträger ist, wenn sie binnen sechs Monaten nach dem Tag, an dem die Eintragung der Verschmelzung in das Register des Sitzes desjenigen Rechtsträgers, dessen Gläubiger sie sind, nach § 19 Abs. 3 UmwG als bekanntgemacht gilt, ihren Anspruch nach Grund und Höhe schriftlich anmelden, Sicherheit zu leisten, soweit sie nicht Befriedigung verlangen können. Dieses Recht steht den Gläubigern jedoch nur zu, wenn sie glaubhaft machen, dass durch die Verschmelzung die Erfüllung ihrer Forderung gefährdet wird."
    },
    {
      "date": "2024-11-07",
      "id": "92830",
      "original_text": "Löschungsankündigung\nBrandenburg Amtsgericht Potsdam HRB 27962\nDS Textilhandels GmbH – Nauen",
      "type": "Löschungsankündigung",
      "state": "Brandenburg",
      "amtsgericht": "Amtsgericht Potsdam",
      "registernummer": "HRB 27962",
      "registerart": "HRB",
      "company_name": "DS Textilhandels GmbH",
      "company_seat": "Nauen",
      "details": "07.11.2024 (Bekanntmachungsdatum)\n\nBrandenburg Amtsgericht Potsdam HRB 27962\nLöschungsankündigung\n\nDS Textilhandels GmbH\nGesellschaft mit beschränkter Haftung\nNauen\n\nBei der nachstehenden Gesellschaft wird das Amtslöschungsverfahren gemäß § 394 FamFG eingeleitet. Widerspruchsfrist: 8 Wochen."
    },
    {
      "date": "2024-11-07",
      "id": "92831",
      "original_text": "Löschungsankündigung\nBerlin Amtsgericht Berlin (Charlottenburg) HRB 184567\nKlaus Grebe GmbH – Berlin",
      "type": "Löschungsankündigung",
      "state": "Berlin",
      "amtsgericht": "Amtsgericht Berlin (Charlottenburg)",
      "registernummer": "HRB 184567",
      "registerart": "HRB",
      "company_name": "Klaus Grebe GmbH",
      "company_seat": "Berlin",
      "details": "07.11.2024 (Bekanntmachungsdatum)\n\nBerlin Amtsgericht Berlin (Charlottenburg) HRB 184567\nLöschungsankündigung\n\nKlaus Grebe GmbH\nGesellschaft mit beschränkter Haftung\nBerlin\n\nBei der nachstehenden Gesellschaft wird das Amtslöschungsverfahren gemäß § 394 FamFG eingeleitet. Widerspruchsfrist 6 Wochen"
    },
    {
      "date": "2024-11-07",
      "id": "92832",
      "original_text": "Registerbekanntmachung nach dem Umwandlungsgesetz\nBrandenburg Amtsgericht Potsdam HRB 22136\nIMTEC GmbH – Schönwalde-Glien",
      "type": "Registerbekanntmachung nach dem Umwandlungsgesetz",
      "state": "Brandenburg",
      "amtsgericht": "Amtsgericht Potsdam",
      "registernummer": "HRB 22136",
      "registerart": "HRB",
      "company_name": "IMTEC GmbH",
      "company_seat": "Schönwalde-Glien",
      "details": "07.11.2024 (Bekanntmachungsdatum)\n\nBrandenburg Amtsgericht Potsdam HRB 22136\nRegisterbekanntmachung nach dem Umwandlungsgesetz 30.10.2024 (Eintragungsdatum)\n\nIMTEC GmbH\nGesellschaft mit beschränkter Haftung\nSchönwalde-Glien\n\nZu Eintragungsnummer 7 vom 30.10.2024 wird als nicht eingetragen veröffentlicht: Den Gläubigern der an der Verschmelzung beteiligten Rechtsträger ist, wenn sie binnen sechs Monaten nach dem Tag, an dem die Eintragung der Verschmelzung in das Register des Sitzes desjenigen Rechtsträgers, dessen Gläubiger sie sind, als bekannt gemacht gilt, ihren Anspruch nach Grund und Höhe schriftlich anmelden, Sicherheit zu leisten, soweit sie nicht Befriedigung verlangen können. Dieses Recht steht den Gläubigern jedoch nur zu, wenn sie glaubhaft machen, dass durch die Verschmelzung die Erfüllung ihrer Forderung gefährdet wird."
    },
    {
      "date": "2024-11-07",
      "id": "92833",
      "original_text": "Löschungsankündigung\nBaden-Württemberg Amtsgericht Stuttgart HRB 768465\nMPS Security Services GmbH – Steinheim an der Murr",
      "type": "Löschungsankündigung",
      "state": "Baden-Württemberg",
      "amtsgericht": "Amtsgericht Stuttgart",
      "registernummer": "HRB 768465",
      "registerart": "HRB",
      "company_name": "MPS Security Services GmbH",
      "company_seat": "Steinheim an der Murr",
      "details": "07.11.2024 (Bekanntmachungsdatum)\n\nBaden-Württemberg Amtsgericht Stuttgart HRB 768465\nLöschungsankündigung\n\nMPS Security Services GmbH\nGesellschaft mit beschränkter Haftung\nSteinheim an der Murr\n\nDas Gericht beabsichtigt, die Gesellschaft wegen Vermögenslosigkeit im Handelsregister von Amts wegen nach § 394 FamFG zu löschen. Die Frist zur Geltendmachung eines Widerspruchs gegen die beabsichtigte Löschung ist auf zwei Monate ab Veröffentlichung bestimmt."
    },
    {
      "date": "2024-11-07",
      "id": "92834",
      "original_text": "Löschungsankündigung\nBerlin Amtsgericht Berlin (Charlottenburg) HRB 68592\nMikroM GmbH – Berlin",
      "type": "Löschungsankündigung",
      "state": "Berlin",
      "amtsgericht": "Amtsgericht Berlin (Charlottenburg)",
      "registernummer": "HRB 68592",
      "registerart": "HRB",
      "company_name": "MikroM GmbH",
      "company_seat": "Berlin",
      "details": "07.11.2024 (Bekanntmachungsdatum)\n\nBerlin Amtsgericht Berlin (Charlottenburg) HRB 68592\nLöschungsankündigung\n\nMikroM GmbH\nGesellschaft mit beschränkter Haftung\nBerlin\n\nBei der nachstehenden Gesellschaft wird das Amtslöschungsverfahren gemäß § 394 FamFG eingeleitet. Widerspruchsfrist 6 Wochen"
    },
    {
      "date": "2024-11-07",
      "id": "92835",
      "original_text": "Löschungsankündigung\nBerlin Amtsgericht Berlin (Charlottenburg) HRB 237359\nProtection Impuls Manufacturing GmbH – Berlin",
      "type": "Löschungsankündigung",
      "state": "Berlin",
      "amtsgericht": "Amtsgericht Berlin (Charlottenburg)",
      "registernummer": "HRB 237359",
      "registerart": "HRB",
      "company_name": "Protection Impuls Manufacturing GmbH",
      "company_seat": "Berlin",
      "details": "07.11.2024 (Bekanntmachungsdatum)\n\nBerlin Amtsgericht Berlin (Charlottenburg) HRB 237359\nLöschungsankündigung\n\nProtection Impuls Manufacturing GmbH\nGesellschaft mit beschränkter Haftung\nBerlin\n\nBei der nachstehenden Gesellschaft wird das Amtslöschungsverfahren gemäß § 394 FamFG eingeleitet. Widerspruchsfrist 6 Wochen"
    },
    {
      "date": "2024-11-07",
      "id": "92836",
      "original_text": "Löschungsankündigung\nBerlin Amtsgericht Berlin (Charlottenburg) HRB 123533\nDEKORATO GmbH – Berlin",
      "type": "Löschungsankündigung",
      "state": "Berlin",
      "amtsgericht": "Amtsgericht Berlin (Charlottenburg)",
      "registernummer": "HRB 123533",
      "registerart": "HRB",
      "company_name": "DEKORATO GmbH",
      "company_seat": "Berlin",
      "details": "07.11.2024 (Bekanntmachungsdatum)\n\nBerlin Amtsgericht Berlin (Charlottenburg) HRB 123533\nLöschungsankündigung\n\nDEKORATO GmbH\nGesellschaft mit beschränkter Haftung\nBerlin\n\nBei der nachstehenden Gesellschaft wird das Amtslöschungsverfahren gemäß § 394 FamFG eingeleitet. Widerspruchsfrist 6 Wochen"
    },
    {
      "date": "2024-11-07",
      "id": "92837",
      "original_text": "Einreichung neuer Dokumente\nBaden-Württemberg Amtsgericht Stuttgart HRB 226105\nLandesmesse Stuttgart Verwaltungs-GmbH – Stuttgart",
      "type": "Einreichung neuer Dokumente",
      "state": "Baden-Württemberg",
      "amtsgericht": "Amtsgericht Stuttgart",
      "registernummer": "HRB 226105",
      "registerart": "HRB",
      "company_name": "Landesmesse Stuttgart Verwaltungs-GmbH",
      "company_seat": "Stuttgart",
      "details": "07.11.2024 (Bekanntmachungsdatum)\n\nBaden-Württemberg Amtsgericht Stuttgart HRB 226105\nEinreichung neuer Dokumente\n\nLandesmesse Stuttgart Verwaltungs-GmbH\nGesellschaft mit beschränkter Haftung\nStuttgart\n\nDie Gesellschaft hat am 04.11.2024 die Liste über die Zusammensetzung des Aufsichtsrats zum Handelsregister eingereicht."
    },
    {
      "date": "2024-11-07",
      "id": "92838",
      "original_text": "Löschungsankündigung\nBerlin Amtsgericht Berlin (Charlottenburg) HRB 243271\nFix Logo Trans 88 GmbH – Berlin",
      "type": "Löschungsankündigung",
      "state": "Berlin",
      "amtsgericht": "Amtsgericht Berlin (Charlottenburg)",
      "registernummer": "HRB 243271",
      "registerart": "HRB",
      "company_name": "Fix Logo Trans 88 GmbH",
      "company_seat": "Berlin",
      "details": "07.11.2024 (Bekanntmachungsdatum)\n\nBerlin Amtsgericht Berlin (Charlottenburg) HRB 243271\nLöschungsankündigung\n\nFix Logo Trans 88 GmbH\nGesellschaft mit beschränkter Haftung\nBerlin\n\nBei der nachstehenden Gesellschaft wird das Amtslöschungsverfahren gemäß § 394 FamFG eingeleitet. Widerspruchsfrist 6 Wochen"
    },
    {
      "date": "2024-11-07",
      "id": "92839",
      "original_text": "Registerbekanntmachung nach dem Umwandlungsgesetz\nSchleswig-Holstein Amtsgericht Kiel HRB 10235\nNeon Paintball GmbH – Henstedt-Ulzburg",
      "type": "Registerbekanntmachung nach dem Umwandlungsgesetz",
      "state": "Schleswig-Holstein",
      "amtsgericht": "Amtsgericht Kiel",
      "registernummer": "HRB 10235",
      "registerart": "HRB",
      "company_name": "Neon Paintball GmbH",
      "company_seat": "Henstedt-Ulzburg",
      "details": "07.11.2024 (Bekanntmachungsdatum)\n\nSchleswig-Holstein Amtsgericht Kiel HRB 10235\nRegisterbekanntmachung nach dem Umwandlungsgesetz 05.11.2024 (Eintragungsdatum)\n\nNeon Paintball GmbH\nGesellschaft mit beschränkter Haftung\nHenstedt-Ulzburg\n\nZu Eintragungsnummer 7 vom 05.11.2024 wird als nicht eingetragen veröffentlicht: Den Gläubigern der an der Verschmelzung beteiligten Rechtsträger ist, wenn sie binnen sechs Monaten nach dem Tag, an dem die Eintragung der Verschmelzung in das Register des Sitzes desjenigen Rechtsträgers, dessen Gläubiger sie sind, nach § 19 Abs. 3 UmwG bekannt gemacht worden ist, ihren Anspruch nach Grund und Höhe schriftlich anmelden, Sicherheit zu leisten, soweit sie nicht Befriedigung verlangen können. Dieses Recht steht den Gläubigern jedoch nur zu, wenn sie glaubhaft machen, dass durch die Verschmelzung die Erfüllung ihrer Forderung gefährdet wird."
    },
    {
      "date": "2024-11-07",
      "id": "92840",
      "original_text": "Registerbekanntmachung nach dem Umwandlungsgesetz\nSchleswig-Holstein Amtsgericht Lübeck HRB 828 EU\nReinhardt GmbH – Eutin",
      "type": "Registerbekanntmachung nach dem Umwandlungsgesetz",
      "state": "Schleswig-Holstein",
      "amtsgericht": "Amtsgericht Lübeck",
      "registernummer": "HRB 828 EU",
      "registerart": "HRB",
      "company_name": "Reinhardt GmbH",
      "company_seat": "Eutin",
      "details": "07.11.2024 (Bekanntmachungsdatum)\n\nSchleswig-Holstein Amtsgericht Lübeck HRB 828 EU\nRegisterbekanntmachung nach dem Umwandlungsgesetz 05.11.2024 (Eintragungsdatum)\n\nReinhardt GmbH\nGesellschaft mit beschränkter Haftung\nEutin\n\nZu Eintragungsnummer 10 vom 05.11.2024 wird als nicht eingetragen veröffentlicht: Den Gläubigern ist, wenn sie binnen sechs Monaten nach dem Tag, an dem die Eintragung der Umwandlung als bekannt gemacht gilt, ihren Anspruch nach Grund und Höhe schriftlich anmelden, Sicherheit zu leisten, soweit sie nicht Befriedigung verlangen können. Dieses Recht steht den Gläubigern jedoch nur zu, wenn sie glaubhaft machen, dass durch die Umwandlung die Erfüllung ihrer Forderung gefährdet wird."
    },
    {
      "date": "2024-11-07",
      "id": "92841",
      "original_text": "Einreichung neuer Dokumente\nThüringen Amtsgericht Jena HRB 102585\nKoWo-Kommunale Wohnungsgesellschaft mbH Erfurt – Erfurt",
      "type": "Einreichung neuer Dokumente",
      "state": "Thüringen",
      "amtsgericht": "Amtsgericht Jena",
      "registernummer": "HRB 102585",
      "registerart": "HRB",
      "company_name": "KoWo-Kommunale Wohnungsgesellschaft mbH Erfurt",
      "company_seat": "Erfurt",
      "details": "07.11.2024 (Bekanntmachungsdatum)\n\nThüringen Amtsgericht Jena HRB 102585\nEinreichung neuer Dokumente\n\nKoWo-Kommunale Wohnungsgesellschaft mbH Erfurt\nGesellschaft mit beschränkter Haftung\nErfurt\n\nBekanntmachung gem. § 52 Abs. 3 Satz 2 GmbHG: Aufgrund einer Veränderung in den Personen der Aufsichtsratsmitglieder ist durch die Geschäftsführer eine neue Liste zum Handelsregister eingereicht worden."
    },
    {
      "date": "2024-11-07",
      "id": "92842",
      "original_text": "Einreichung neuer Dokumente\nThüringen Amtsgericht Jena HRB 400993\nStadtwerke Nordhausen - Holding für Versorgung und Verkehr GmbH – Nordhausen",
      "type": "Einreichung neuer Dokumente",
      "state": "Thüringen",
      "amtsgericht": "Amtsgericht Jena",
      "registernummer": "HRB 400993",
      "registerart": "HRB",
      "company_name": "Stadtwerke Nordhausen - Holding für Versorgung und Verkehr GmbH",
      "company_seat": "Nordhausen",
      "details": "07.11.2024 (Bekanntmachungsdatum)\n\nThüringen Amtsgericht Jena HRB 400993\nEinreichung neuer Dokumente 18.10.2024 (Eintragungsdatum)\n\nStadtwerke Nordhausen - Holding für Versorgung und Verkehr GmbH\nGesellschaft mit beschränkter Haftung\nNordhausen\n\nBekanntmachung gem. § 52 Abs. 3 Satz 2 GmbHG: Aufgrund einer Veränderung in den Personen der Aufsichtsratsmitglieder ist durch die Geschäftsführer eine neue Liste zum Handelsregister eingereicht worden."
    },
    {
      "date": "2024-11-07",
      "id": "92843",
      "original_text": "Registerbekanntmachung nach dem Umwandlungsgesetz\nSaarland Amtsgericht Saarbrücken HRB 52908\nPOE GmbH – Schmelz",
      "type": "Registerbekanntmachung nach dem Umwandlungsgesetz",
      "state": "Saarland",
      "amtsgericht": "Amtsgericht Saarbrücken",
      "registernummer": "HRB 52908",
      "registerart": "HRB",
      "company_name": "POE GmbH",
      "company_seat": "Schmelz",
      "details": "07.11.2024 (Bekanntmachungsdatum)\n\nSaarland Amtsgericht Saarbrücken HRB 52908\nRegisterbekanntmachung nach dem Umwandlungsgesetz 23.08.2024 (Eintragungsdatum)\n\nPOE GmbH\nGesellschaft mit beschränkter Haftung\nSchmelz\n\nAls nicht eingetragen wird bekannt gemacht: Den Gläubigern der an der Verschmelzung beteiligten Gesellschaften ist, wenn sie binnen sechs Monaten nach dem Tag, an dem die Eintragung der Verschmelzung in das Register des Sitzes derjenigen Rechtsträger deren Gläubiger sie sind, nach § 19 Absatz 3 UmwG bekannt gemacht worden ist, ihren Anspruch nach Grund und Höhe schriftlich anmelden, Sicherheit zu leisten, soweit sie nicht Befriedigung verlangen können. Dieses Recht steht den Gläubigern jedoch nur zu, wenn sie glaubhaft machen, dass durch die Verschmelzung die Erfüllung ihrer Forderung gefährdet wird."
    },
    {
      "date": "2024-11-07",
      "id": "92844",
      "original_text": "Einreichung neuer Dokumente\nHamburg Amtsgericht Hamburg HRB 82399\nDELACAMP Aktiengesellschaft – Hamburg",
      "type": "Einreichung neuer Dokumente",
      "state": "Hamburg",
      "amtsgericht": "Amtsgericht Hamburg",
      "registernummer": "HRB 82399",
      "registerart": "HRB",
      "company_name": "DELACAMP Aktiengesellschaft",
      "company_seat": "Hamburg",
      "details": "07.11.2024 (Bekanntmachungsdatum)\n\nHamburg Amtsgericht Hamburg HRB 82399\nEinreichung neuer Dokumente\n\nDELACAMP Aktiengesellschaft\nAktiengesellschaft\nHamburg\n\nAls nicht eingetragen wird bekannt gemacht: Liste des Aufsichtsrats wurde eingereicht."
    },
    {
      "date": "2024-11-07",
      "id": "92845",
      "original_text": "Löschungsankündigung\nNordrhein-Westfalen Amtsgericht Coesfeld HRB 18154\nBau & Haus GmbH – Bocholt",
      "type": "Löschungsankündigung",
      "state": "Nordrhein-Westfalen",
      "amtsgericht": "Amtsgericht Coesfeld",
      "registernummer": "HRB 18154",
      "registerart": "HRB",
      "company_name": "Bau & Haus GmbH",
      "company_seat": "Bocholt",
      "details": "07.11.2024 (Bekanntmachungsdatum)\n\nNordrhein-Westfalen Amtsgericht Coesfeld HRB 18154\nLöschungsankündigung\n\nBau & Haus GmbH\nGesellschaft mit beschränkter Haftung\nBocholt\n\nDas Registergericht beabsichtigt, den Rechtsträger wegen Vermögenslosigkeit gemäß § 394 FamFG von Amts wegen zu löschen.\n\nGegen diese Verfügung kann Widerspruch eingelegt werden. Die Frist zur Erhebung eines Widerspruchs gegen die beabsichtigte Löschung ist auf drei Monate ab Veröffentlichung festgesetzt."
    },
    {
      "date": "2024-11-07",
      "id": "92846",
      "original_text": "Löschungsankündigung\nMecklenburg-Vorpommern Amtsgericht Stralsund HRB 20189\nNorddeutsche Bau- & Verwaltungs GmbH – Stralsund",
      "type": "Löschungsankündigung",
      "state": "Mecklenburg-Vorpommern",
      "amtsgericht": "Amtsgericht Stralsund",
      "registernummer": "HRB 20189",
      "registerart": "HRB",
      "company_name": "Norddeutsche Bau- & Verwaltungs GmbH",
      "company_seat": "Stralsund",
      "details": "07.11.2024 (Bekanntmachungsdatum)\n\nMecklenburg-Vorpommern Amtsgericht Stralsund HRB 20189\nLöschungsankündigung\n\nNorddeutsche Bau- & Verwaltungs GmbH\nGesellschaft mit beschränkter Haftung\nStralsund\n\nDas Registergericht beabsichtigt, die im Handelsregister eingetragene Gesellschaft von Amts wegen nach § 394 FamFG zu löschen. Die Frist zur Erhebung eines Widerspruchs gegen die beabsichtigte Löschung wird auf 1 Monat festgesetzt."
    },
    {
      "date": "2024-11-07",
      "id": "92847",
      "original_text": "Registerbekanntmachung nach dem Umwandlungsgesetz\nNordrhein-Westfalen Amtsgericht Coesfeld HRB 19804\naddhucate Beteiligungsgesellschaft mit beschränkter Haftung – Gescher",
      "type": "Registerbekanntmachung nach dem Umwandlungsgesetz",
      "state": "Nordrhein-Westfalen",
      "amtsgericht": "Amtsgericht Coesfeld",
      "registernummer": "HRB 19804",
      "registerart": "HRB",
      "company_name": "addhucate Beteiligungsgesellschaft mit beschränkter Haftung",
      "company_seat": "Gescher",
      "details": "07.11.2024 (Bekanntmachungsdatum)\n\nNordrhein-Westfalen Amtsgericht Coesfeld HRB 19804\nRegisterbekanntmachung nach dem Umwandlungsgesetz 07.11.2024 (Eintragungsdatum)\n\naddhucate Beteiligungsgesellschaft mit beschränkter Haftung\nGesellschaft mit beschränkter Haftung\nGescher\n\nDen Gläubigern der an der Verschmelzung beteiligten Rechtsträger ist, wenn sie binnen sechs Monaten nach dem Tag, an dem die Eintragung der Verschmelzung in das Register des Sitzes derjenigen Rechtsträger deren Gläubiger sie sind, nach § 19 Absatz 3 UmwG als bekanntgemacht gilt, ihren Anspruch nach Grund und Höhe schriftlich anmelden, Sicherheit zu leisten, soweit sie nicht Befriedigung verlangen können. Dieses Recht steht den Gläubigern jedoch nur zu, wenn sie glaubhaft machen, dass durch die Verschmelzung die Erfüllung ihrer Forderung gefährdet wird."
    },
    {
      "date": "2024-11-07",
      "id": "92848",
      "original_text": "Löschungsankündigung\nMecklenburg-Vorpommern Amtsgericht Rostock HRB 13858\nadcada.finance GmbH – Bentwisch",
      "type": "Löschungsankündigung",
      "state": "Mecklenburg-Vorpommern",
      "amtsgericht": "Amtsgericht Rostock",
      "registernummer": "HRB 13858",
      "registerart": "HRB",
      "company_name": "adcada.finance GmbH",
      "company_seat": "Bentwisch",
      "details": "07.11.2024 (Bekanntmachungsdatum)\n\nMecklenburg-Vorpommern Amtsgericht Rostock HRB 13858\nLöschungsankündigung\n\nadcada.finance GmbH\nGesellschaft mit beschränkter Haftung\nBentwisch\n\nDas Registergericht beabsichtigt, die im Handelsregister eingetragene Gesellschaft von Amts wegen nach § 394 FamFG zu löschen. Die Frist zur Erhebung eines Widerspruchs gegen die beabsichtigte Löschung wird auf einen Monat festgesetzt."
    },
    {
      "date": "2024-11-07",
      "id": "92849",
      "original_text": "Einreichung neuer Dokumente\nBaden-Württemberg Amtsgericht Stuttgart HRB 184\nStuttgarter Wohnungs- und Städtebaugesellschaft mit beschränkter Haftung – Stuttgart",
      "type": "Einreichung neuer Dokumente",
      "state": "Baden-Württemberg",
      "amtsgericht": "Amtsgericht Stuttgart",
      "registernummer": "HRB 184",
      "registerart": "HRB",
      "company_name": "Stuttgarter Wohnungs- und Städtebaugesellschaft mit beschränkter Haftung",
      "company_seat": "Stuttgart",
      "details": "07.11.2024 (Bekanntmachungsdatum)\n\nBaden-Württemberg Amtsgericht Stuttgart HRB 184\nEinreichung neuer Dokumente\n\nStuttgarter Wohnungs- und Städtebaugesellschaft mit beschränkter Haftung\nGesellschaft mit beschränkter Haftung\nStuttgart\n\nDie Gesellschaft hat am 06.11.2024 die Liste über die Zusammensetzung des Aufsichtsrats zum Handelsregister eingereicht."
    },
    {
      "date": "2024-11-07",
      "id": "92850",
      "original_text": "Löschungsankündigung\nBaden-Württemberg Amtsgericht Stuttgart HRB 760475\nRed-Gold Media & Print GmbH – Ostfildern",
      "type": "Löschungsankündigung",
      "state": "Baden-Württemberg",
      "amtsgericht": "Amtsgericht Stuttgart",
      "registernummer": "HRB 760475",
      "registerart": "HRB",
      "company_name": "Red-Gold Media & Print GmbH",
      "company_seat": "Ostfildern",
      "details": "07.11.2024 (Bekanntmachungsdatum)\n\nBaden-Württemberg Amtsgericht Stuttgart HRB 760475\nLöschungsankündigung\n\nRed-Gold Media & Print GmbH\nGesellschaft mit beschränkter Haftung\nOstfildern\n\nDas Gericht beabsichtigt, die Gesellschaft wegen Vermögenslosigkeit im Handelsregister von Amts wegen nach § 394 FamFG zu löschen. Die Frist zur Geltendmachung eines Widerspruchs gegen die beabsichtigte Löschung ist auf einen Monat ab Veröffentlichung bestimmt."
    },
    {
      "date": "2024-11-07",
      "id": "92851",
      "original_text": "Einreichung neuer Dokumente\nSaarland Amtsgericht Saarbrücken HRB 17782\nStadtwerke Dillingen/Saar Netzgesellschaft mbH – Dillingen/Saar",
      "type": "Einreichung neuer Dokumente",
      "state": "Saarland",
      "amtsgericht": "Amtsgericht Saarbrücken",
      "registernummer": "HRB 17782",
      "registerart": "HRB",
      "company_name": "Stadtwerke Dillingen/Saar Netzgesellschaft mbH",
      "company_seat": "Dillingen/Saar",
      "details": "07.11.2024 (Bekanntmachungsdatum)\n\nSaarland Amtsgericht Saarbrücken HRB 17782\nEinreichung neuer Dokumente\n\nStadtwerke Dillingen/Saar Netzgesellschaft mbH\nGesellschaft mit beschränkter Haftung\nDillingen/Saar\n\nDie Geschäftsführung der Gesellschaft hat eine Liste der Mitglieder des Aufsichtsrats zum Handelsregister eingereicht (§ 52 Abs. 3 Satz 2 GmbHG)."
    },
    {
      "date": "2024-11-07",
      "id": "92852",
      "original_text": "Löschungsankündigung\nBerlin Amtsgericht Berlin (Charlottenburg) HRB 164864\nexeclabs GmbH – Berlin",
      "type": "Löschungsankündigung",
      "state": "Berlin",
      "amtsgericht": "Amtsgericht Berlin (Charlottenburg)",
      "registernummer": "HRB 164864",
      "registerart": "HRB",
      "company_name": "execlabs GmbH",
      "company_seat": "Berlin",
      "details": "07.11.2024 (Bekanntmachungsdatum)\n\nBerlin Amtsgericht Berlin (Charlottenburg) HRB 164864\nLöschungsankündigung\n\nexeclabs GmbH\nGesellschaft mit beschränkter Haftung\nBerlin\n\nBei der nachstehenden Gesellschaft wird das Amtslöschungsverfahren gemäß § 394 FamFG eingeleitet. Widerspruchsfrist 8 Wochen"
    },
    {
      "date": "2024-11-07",
      "id": "92853",
      "original_text": "Registerbekanntmachung nach dem Umwandlungsgesetz\nBrandenburg Amtsgericht Potsdam HRB 39915\nKolibri Beteiligung GmbH – Kleinmachnow",
      "type": "Registerbekanntmachung nach dem Umwandlungsgesetz",
      "state": "Brandenburg",
      "amtsgericht": "Amtsgericht Potsdam",
      "registernummer": "HRB 39915",
      "registerart": "HRB",
      "company_name": "Kolibri Beteiligung GmbH",
      "company_seat": "Kleinmachnow",
      "details": "07.11.2024 (Bekanntmachungsdatum)\n\nBrandenburg Amtsgericht Potsdam HRB 39915\nRegisterbekanntmachung nach dem Umwandlungsgesetz 29.10.2024 (Eintragungsdatum)\n\nKolibri Beteiligung GmbH\nGesellschaft mit beschränkter Haftung\nKleinmachnow\n\nZu Eintragungsnummer 2 vom 29.10.2024 wird als nicht eingetragen veröffentlicht: Den Gläubigern der an der Verschmelzung beteiligten Rechtsträger ist, wenn sie binnen sechs Monaten nach dem Tag, an dem die Eintragung der Verschmelzung in das Register des Sitzes desjenigen Rechtsträgers, dessen Gläubiger sie sind, als bekannt gemacht gilt, ihren Anspruch nach Grund und Höhe schriftlich anmelden, Sicherheit zu leisten, soweit sie nicht Befriedigung verlangen können. Dieses Recht steht den Gläubigern jedoch nur zu, wenn sie glaubhaft machen, dass durch die Verschmelzung die Erfüllung ihrer Forderung gefährdet wird"
    },
    {
      "date": "2024-11-07",
      "id": "92854",
      "original_text": "Registerbekanntmachung nach dem Umwandlungsgesetz\nBrandenburg Amtsgericht Potsdam HRB 38778\nSkyfall Capital GmbH – Kleinmachnow",
      "type": "Registerbekanntmachung nach dem Umwandlungsgesetz",
      "state": "Brandenburg",
      "amtsgericht": "Amtsgericht Potsdam",
      "registernummer": "HRB 38778",
      "registerart": "HRB",
      "company_name": "Skyfall Capital GmbH",
      "company_seat": "Kleinmachnow",
      "details": "07.11.2024 (Bekanntmachungsdatum)\n\nBrandenburg Amtsgericht Potsdam HRB 38778\nRegisterbekanntmachung nach dem Umwandlungsgesetz 29.10.2024 (Eintragungsdatum)\n\nSkyfall Capital GmbH\nGesellschaft mit beschränkter Haftung\nKleinmachnow\n\nZu Eintragungsnummer 3 vom 29.10.2024 wird als nicht eingetragen veröffentlicht: Den Gläubigern der an der Verschmelzung beteiligten Rechtsträger ist, wenn sie binnen sechs Monaten nach dem Tag, an dem die Eintragung der Verschmelzung in das Register des Sitzes desjenigen Rechtsträgers, dessen Gläubiger sie sind, als bekannt gemacht gilt, ihren Anspruch nach Grund und Höhe schriftlich anmelden, Sicherheit zu leisten, soweit sie nicht Befriedigung verlangen können. Dieses Recht steht den Gläubigern jedoch nur zu, wenn sie glaubhaft machen, dass durch die Verschmelzung die Erfüllung ihrer Forderung gefährdet wird"
    },
    {
      "date": "2024-11-07",
      "id": "92855",
      "original_text": "Registerbekanntmachung nach dem Umwandlungsgesetz\nSachsen Amtsgericht Dresden HRB 3435\nSICK Engineering GmbH – Ottendorf-Okrilla",
      "type": "Registerbekanntmachung nach dem Umwandlungsgesetz",
      "state": "Sachsen",
      "amtsgericht": "Amtsgericht Dresden",
      "registernummer": "HRB 3435",
      "registerart": "HRB",
      "company_name": "SICK Engineering GmbH",
      "company_seat": "Ottendorf-Okrilla",
      "details": "07.11.2024 (Bekanntmachungsdatum)\n\nSachsen Amtsgericht Dresden HRB 3435\nRegisterbekanntmachung nach dem Umwandlungsgesetz 07.11.2024 (Eintragungsdatum)\n\nSICK Engineering GmbH\nGesellschaft mit beschränkter Haftung\nOttendorf-Okrilla\n\nDen Gläubigern der an der Umwandlung beteiligten Rechtsträger ist, wenn sie binnen sechs Monaten nach dem Tag, an dem die Eintragung der Umwandlung  in das Register des Sitzes desjenigen Rechtsträgers, dessen Gläubiger sie sind, nach § 19 Abs. 3 UmwG als bekannt gemacht gilt, ihren Anspruch nach Grund und Höhe schriftlich anmelden, Sicherheit zu leisten, soweit sie nicht Befriedigung verlangen können. Dieses Recht steht den Gläubigern jedoch nur zu, wenn sie glaubhaft machen, dass durch die Umwandlung die Erfüllung der Forderung gefährdet wird."
    },
    {
      "date": "2024-11-07",
      "id": "92856",
      "original_text": "Sonstige Registerbekanntmachung\nSachsen Amtsgericht Dresden HRB 3435\nSICK Engineering GmbH – Ottendorf-Okrilla",
      "type": "Sonstige Registerbekanntmachung",
      "state": "Sachsen",
      "amtsgericht": "Amtsgericht Dresden",
      "registernummer": "HRB 3435",
      "registerart": "HRB",
      "company_name": "SICK Engineering GmbH",
      "company_seat": "Ottendorf-Okrilla",
      "details": "07.11.2024 (Bekanntmachungsdatum)\n\nSachsen Amtsgericht Dresden HRB 3435\nSonstige Registerbekanntmachung 07.11.2024 (Eintragungsdatum)\n\nSICK Engineering GmbH\nGesellschaft mit beschränkter Haftung\nOttendorf-Okrilla\n\nDen Gläubigern der Gesellschaft, deren Forderungen begründet worden sind bevor die Eintragung der Beendigung des Beherrschungs- und Gewinnabführungsvertrages in das Handelsregister nach § 10 des Handelsgesetzbuches als bekanntgemacht gilt, hat der andere Vertragsteil Sicherheit zu leisten, wenn sie sich binnen sechs Monaten nach der Bekanntmachung der Eintragung zu diesem Zweck bei ihm melden."
    },
    {
      "date": "2024-11-07",
      "id": "92857",
      "original_text": "Löschungsankündigung\nSachsen Amtsgericht Chemnitz HRB 30571\nASCANA Grundbesitzgesellschaft mbH – Plauen",
      "type": "Löschungsankündigung",
      "state": "Sachsen",
      "amtsgericht": "Amtsgericht Chemnitz",
      "registernummer": "HRB 30571",
      "registerart": "HRB",
      "company_name": "ASCANA Grundbesitzgesellschaft mbH",
      "company_seat": "Plauen",
      "details": "07.11.2024 (Bekanntmachungsdatum)\n\nSachsen Amtsgericht Chemnitz HRB 30571\nLöschungsankündigung\n\nASCANA Grundbesitzgesellschaft mbH\nGesellschaft mit beschränkter Haftung\nPlauen\n\nDas Registergericht beabsichtigt, die im Handelsregister eingetragene Gesellschaft von Amts wegen nach § 394 FamFG zu löschen. Die Frist zu Erhebung eines Widerspruchs gegen die beabsichtigte Löschung wird auf einen Monat festgesetzt."
    },
    {
      "date": "2024-11-07",
      "id": "92858",
      "original_text": "Einreichung neuer Dokumente\nSachsen Amtsgericht Dresden HRB 20602\newag kamenz Energie und Wasserversorgung Aktiengesellschaft Kamenz – Kamenz",
      "type": "Einreichung neuer Dokumente",
      "state": "Sachsen",
      "amtsgericht": "Amtsgericht Dresden",
      "registernummer": "HRB 20602",
      "registerart": "HRB",
      "company_name": "ewag kamenz Energie und Wasserversorgung Aktiengesellschaft Kamenz",
      "company_seat": "Kamenz",
      "details": "07.11.2024 (Bekanntmachungsdatum)\n\nSachsen Amtsgericht Dresden HRB 20602\nEinreichung neuer Dokumente\n\newag kamenz Energie und Wasserversorgung Aktiengesellschaft Kamenz\nAktiengesellschaft\nKamenz\n\nAm 05.11.2024 wurde beim Handelsregister des Amtsgerichts Dresden die Liste der Mitglieder des Aufsichtsrats gemäß § 106 AktG eingereicht."
    },
    {
      "date": "2024-11-07",
      "id": "92859",
      "original_text": "Löschungsankündigung\nSachsen Amtsgericht Leipzig HRB 31414\nSolidField GmbH – Leipzig",
      "type": "Löschungsankündigung",
      "state": "Sachsen",
      "amtsgericht": "Amtsgericht Leipzig",
      "registernummer": "HRB 31414",
      "registerart": "HRB",
      "company_name": "SolidField GmbH",
      "company_seat": "Leipzig",
      "details": "07.11.2024 (Bekanntmachungsdatum)\n\nSachsen Amtsgericht Leipzig HRB 31414\nLöschungsankündigung\n\nSolidField GmbH\nGesellschaft mit beschränkter Haftung\nLeipzig\n\nDas Registergericht beabsichtigt, den im Handelsregister eingetragenen Das Registergericht beabsichtigt, die im Handelsregister eingetragene Gesellschaft von Amts wegen nach § 394 FamFG zu löschen. Die Frist zu Erhebung eines Widerspruchs gegen die beabsichtigte Löschung wird auf einen Monat festgesetzt."
    },
    {
      "date": "2024-11-07",
      "id": "92860",
      "original_text": "Registerbekanntmachung nach dem Umwandlungsgesetz\nSachsen Amtsgericht Dresden HRA 12129\nEndress+Hauser SICK GmbH+Co. KG – Ottendorf-Okrilla",
      "type": "Registerbekanntmachung nach dem Umwandlungsgesetz",
      "state": "Sachsen",
      "amtsgericht": "Amtsgericht Dresden",
      "registernummer": "HRA 12129",
      "registerart": "HRA",
      "company_name": "Endress+Hauser SICK GmbH+Co. KG",
      "company_seat": "Ottendorf-Okrilla",
      "details": "07.11.2024 (Bekanntmachungsdatum)\n\nSachsen Amtsgericht Dresden HRA 12129\nRegisterbekanntmachung nach dem Umwandlungsgesetz 07.11.2024 (Eintragungsdatum)\n\nEndress+Hauser SICK GmbH+Co. KG\nKommanditgesellschaft\nOttendorf-Okrilla\n\nDen Gläubigern der an der Umwandlung beteiligten Rechtsträger ist, wenn sie binnen sechs Monaten nach dem Tag, an dem die Eintragung der Umwandlung  in das Register des Sitzes desjenigen Rechtsträgers, dessen Gläubiger sie sind, nach § 19 Abs. 3 UmwG als bekannt gemacht gilt, ihren Anspruch nach Grund und Höhe schriftlich anmelden, Sicherheit zu leisten, soweit sie nicht Befriedigung verlangen können. Dieses Recht steht den Gläubigern jedoch nur zu, wenn sie glaubhaft machen, dass durch die Umwandlung die Erfüllung der Forderung gefährdet wird."
    },
    {
      "date": "2024-11-07",
      "id": "92861",
      "original_text": "Registerbekanntmachung nach dem Umwandlungsgesetz\nBaden-Württemberg Amtsgericht Stuttgart HRB 796681\nTress Brüder Gastronomie GmbH – Hayingen",
      "type": "Registerbekanntmachung nach dem Umwandlungsgesetz",
      "state": "Baden-Württemberg",
      "amtsgericht": "Amtsgericht Stuttgart",
      "registernummer": "HRB 796681",
      "registerart": "HRB",
      "company_name": "Tress Brüder Gastronomie GmbH",
      "company_seat": "Hayingen",
      "details": "07.11.2024 (Bekanntmachungsdatum)\n\nBaden-Württemberg Amtsgericht Stuttgart HRB 796681\nRegisterbekanntmachung nach dem Umwandlungsgesetz 07.11.2024 (Eintragungsdatum)\n\nTress Brüder Gastronomie GmbH\nGesellschaft mit beschränkter Haftung\nHayingen\n\nDen Gläubigern der an der Verschmelzung beteiligten Rechtsträger ist, wenn sie binnen sechs Monaten nach dem Tag, an dem die Eintragung der Verschmelzung in das Register des Sitzes desjenigen Rechtsträgers, dessen Gläubiger sie sind, nach § 19 Abs. 3 UmwG als bekanntgemacht gilt, ihren Anspruch nach Grund und Höhe schriftlich anmelden, Sicherheit zu leisten, soweit sie nicht Befriedigung verlangen können. Dieses Recht steht den Gläubigern jedoch nur zu, wenn sie glaubhaft machen, dass durch die Verschmelzung die Erfüllung ihrer Forderung gefährdet wird."
    },
    {
      "date": "2024-11-07",
      "id": "92862",
      "original_text": "Einreichung neuer Dokumente\nNiedersachsen Amtsgericht Oldenburg (Oldenburg) HRB 5451\nSeaports of Niedersachsen GmbH – Oldenburg",
      "type": "Einreichung neuer Dokumente",
      "state": "Niedersachsen",
      "amtsgericht": "Amtsgericht Oldenburg (Oldenburg)",
      "registernummer": "HRB 5451",
      "registerart": "HRB",
      "company_name": "Seaports of Niedersachsen GmbH",
      "company_seat": "Oldenburg",
      "details": "07.11.2024 (Bekanntmachungsdatum)\n\nNiedersachsen Amtsgericht Oldenburg (Oldenburg) HRB 5451\nEinreichung neuer Dokumente\n\nSeaports of Niedersachsen GmbH\nGesellschaft mit beschränkter Haftung\nOldenburg\n\nDie Liste der Mitglieder des Aufsichtsrats wurde beim Registergericht eingereicht."
    },
    {
      "date": "2024-11-07",
      "id": "92863",
      "original_text": "Registerbekanntmachung nach dem Umwandlungsgesetz\nNiedersachsen Amtsgericht Aurich HRA 110842 früher Amtsgericht Leer (Ostfriesland) (Leer)\nLeda Immobilien GmbH & Co. KG – Leer",
      "type": "Registerbekanntmachung nach dem Umwandlungsgesetz",
      "state": "Niedersachsen",
      "amtsgericht": "Amtsgericht Aurich",
      "registernummer": "HRA 110842",
      "registerart": "HRA",
      "company_name": "Leda Immobilien GmbH & Co. KG",
      "company_seat": "Leer",
      "former_amtsgericht": "Leer (Ostfriesland) (Leer)",
      "details": "07.11.2024 (Bekanntmachungsdatum)\n\nNiedersachsen Amtsgericht Aurich HRA 110842 früher Amtsgericht Leer (Ostfriesland) (Leer)\nRegisterbekanntmachung nach dem Umwandlungsgesetz 07.11.2024 (Eintragungsdatum)\n\nLeda Immobilien GmbH & Co. KG\nKommanditgesellschaft\nLeer\n\nDen Gläubigern der an der Verschmelzung beteiligten Rechtsträger ist, wenn sie binnen sechs Monaten nach dem Tag, an dem die Eintragung der Verschmelzung in das Register des Sitzes desjenigen Rechtsträgers, dessen Gläubiger sie sind, nach § 19  Abs.  3 UmwG als bekannt gemacht gilt, ihren Anspruch nach Grund und Höhe schriftlich anmelden, Sicherheit zu leisten, soweit sie nicht Befriedigung verlangen können. Dieses Recht steht den Gläubigern jedoch nur zu, wenn sie glaubhaft machen, dass durch die Verschmelzung die Erfüllung der Forderung gefährdet wird."
    },
    {
      "date": "2024-11-07",
      "id": "92864",
      "original_text": "Einreichung neuer Dokumente\nNiedersachsen Amtsgericht Hannover HRB 62522\nTUI Deutschland GmbH – Hannover",
      "type": "Einreichung neuer Dokumente",
      "state": "Niedersachsen",
      "amtsgericht": "Amtsgericht Hannover",
      "registernummer": "HRB 62522",
      "registerart": "HRB",
      "company_name": "TUI Deutschland GmbH",
      "company_seat": "Hannover",
      "details": "07.11.2024 (Bekanntmachungsdatum)\n\nNiedersachsen Amtsgericht Hannover HRB 62522\nEinreichung neuer Dokumente\n\nTUI Deutschland GmbH\nGesellschaft mit beschränkter Haftung\nHannover\n\nDie Liste der Mitglieder des Aufsichtsrats wurde beim Registergericht eingereicht."
    },
    {
      "date": "2024-11-07",
      "id": "92865",
      "original_text": "Registerbekanntmachung nach dem Umwandlungsgesetz\nNiedersachsen Amtsgericht Walsrode HRA 205406\nAutohaus Neeman e.K. – Syke",
      "type": "Registerbekanntmachung nach dem Umwandlungsgesetz",
      "state": "Niedersachsen",
      "amtsgericht": "Amtsgericht Walsrode",
      "registernummer": "HRA 205406",
      "registerart": "HRA",
      "company_name": "Autohaus Neeman e.K.",
      "company_seat": "Syke",
      "details": "07.11.2024 (Bekanntmachungsdatum)\n\nNiedersachsen Amtsgericht Walsrode HRA 205406\nRegisterbekanntmachung nach dem Umwandlungsgesetz 30.10.2024 (Eintragungsdatum)\n\nAutohaus Neeman e.K.\nEinzelkaufmann / Einzelkauffrau\nSyke\n\nDen Gläubigern der an der Ausgliederung beteiligten Rechtsträger ist, wenn sie binnen sechs Monaten nach dem Tag, an dem die Eintragung der Ausgliederung in das Register des Sitzes desjenigen Rechtsträgers, dessen Gläubiger sie sind, nach § 19 Abs. 3 UmwG als bekannt gemacht gilt, ihren Anspruch nach Grund und Höhe schriftlich anmelden, Sicherheit zu leisten, soweit sie nicht Befriedigung verlangen können. Dieses Recht steht den Gläubigern jedoch nur zu, wenn sie glaubhaft machen, dass durch die Ausgliederung die Erfüllung der Forderung gefährdet wird."
    },
    {
      "date": "2024-11-07",
      "id": "92866",
      "original_text": "Registerbekanntmachung nach dem Umwandlungsgesetz\nNiedersachsen Amtsgericht Oldenburg (Oldenburg) HRB 120409 früher Amtsgericht Westerstede\nGerdes Wohnraum GmbH – Apen",
      "type": "Registerbekanntmachung nach dem Umwandlungsgesetz",
      "state": "Niedersachsen",
      "amtsgericht": "Amtsgericht Oldenburg (Oldenburg)",
      "registernummer": "HRB 120409",
      "registerart": "HRB",
      "company_name": "Gerdes Wohnraum GmbH",
      "company_seat": "Apen",
      "former_amtsgericht": "Westerstede",
      "details": "07.11.2024 (Bekanntmachungsdatum)\n\nNiedersachsen Amtsgericht Oldenburg (Oldenburg) HRB 120409 früher Amtsgericht Westerstede\nRegisterbekanntmachung nach dem Umwandlungsgesetz 07.11.2024 (Eintragungsdatum)\n\nGerdes Wohnraum GmbH\nGesellschaft mit beschränkter Haftung\nApen\n\nDen Gläubigern der an der Verschmelzung beteiligten Rechtsträger ist, wenn sie binnen sechs Monaten nach dem Tag, an dem die Eintragung der Verschmelzung in das Register des Sitzes desjenigen Rechtsträgers, dessen Gläubiger sie sind, nach § 19  Abs.  3 UmwG als bekannt gemacht gilt, ihren Anspruch nach Grund und Höhe schriftlich anmelden, Sicherheit zu leisten, soweit sie nicht Befriedigung verlangen können. Dieses Recht steht den Gläubigern jedoch nur zu, wenn sie glaubhaft machen, dass durch die Verschmelzung die Erfüllung der Forderung gefährdet wird."
    },
    {
      "date": "2024-11-07",
      "id": "92867",
      "original_text": "Registerbekanntmachung nach dem Umwandlungsgesetz\nNiedersachsen Amtsgericht Braunschweig HRB 100481 früher Amtsgericht Wolfsburg\nFELS RECYCLING GmbH – Wolfsburg",
      "type": "Registerbekanntmachung nach dem Umwandlungsgesetz",
      "state": "Niedersachsen",
      "amtsgericht": "Amtsgericht Braunschweig",
      "registernummer": "HRB 100481",
      "registerart": "HRB",
      "company_name": "FELS RECYCLING GmbH",
      "company_seat": "Wolfsburg",
      "former_amtsgericht": "Wolfsburg",
      "details": "07.11.2024 (Bekanntmachungsdatum)\n\nNiedersachsen Amtsgericht Braunschweig HRB 100481 früher Amtsgericht Wolfsburg\nRegisterbekanntmachung nach dem Umwandlungsgesetz 07.11.2024 (Eintragungsdatum)\n\nFELS RECYCLING GmbH\nGesellschaft mit beschränkter Haftung\nWolfsburg\n\nDen Gläubigern der an der Verschmelzung beteiligten Rechtsträger ist, wenn sie binnen sechs Monaten nach dem Tag, an dem die Eintragung der Verschmelzung in das Register des Sitzes desjenigen Rechtsträgers, dessen Gläubiger sie sind, nach § 19  Abs.  3 UmwG als bekannt gemacht gilt, ihren Anspruch nach Grund und Höhe schriftlich anmelden, Sicherheit zu leisten, soweit sie nicht Befriedigung verlangen können. Dieses Recht steht den Gläubigern jedoch nur zu, wenn sie glaubhaft machen, dass durch die Verschmelzung die Erfüllung der Forderung gefährdet wird."
    },
    {
      "date": "2024-11-07",
      "id": "92868",
      "original_text": "Löschungsankündigung\nNiedersachsen Amtsgericht Aurich HRB 201350\nJLO Schiffahrtsverwaltungs GmbH – Leer",
      "type": "Löschungsankündigung",
      "state": "Niedersachsen",
      "amtsgericht": "Amtsgericht Aurich",
      "registernummer": "HRB 201350",
      "registerart": "HRB",
      "company_name": "JLO Schiffahrtsverwaltungs GmbH",
      "company_seat": "Leer",
      "details": "07.11.2024 (Bekanntmachungsdatum)\n\nNiedersachsen Amtsgericht Aurich HRB 201350\nLöschungsankündigung 07.11.2024 (Eintragungsdatum)\n\nJLO Schiffahrtsverwaltungs GmbH\nGesellschaft mit beschränkter Haftung\nLeer\n\nDas Registergericht beabsichtigt, die Gesellschaft von Amts wegen nach § 394 FamFG zu löschen. Die Frist zur Erhebung eines Widerspruchs ist auf 1 Monat ab dieser Registerbekanntmachung festgesetzt."
    },
    {
      "date": "2024-11-07",
      "id": "92869",
      "original_text": "Löschungsankündigung\nRheinland-Pfalz Amtsgericht Zweibrücken HRB 31508\nLISCO GmbH – Ramstein-Miesenbach",
      "type": "Löschungsankündigung",
      "state": "Rheinland-Pfalz",
      "amtsgericht": "Amtsgericht Zweibrücken",
      "registernummer": "HRB 31508",
      "registerart": "HRB",
      "company_name": "LISCO GmbH",
      "company_seat": "Ramstein-Miesenbach",
      "details": "07.11.2024 (Bekanntmachungsdatum)\n\nRheinland-Pfalz Amtsgericht Zweibrücken HRB 31508\nLöschungsankündigung\n\nLISCO GmbH\nGesellschaft mit beschränkter Haftung\nRamstein-Miesenbach\n\nDas Registergericht beabsichtigt die Gesellschaft von Amts wegen nach § 394 FamFG zu löschen. Die Frist zur Erhebung eines Widerspruchs ist auf einen Monat festgesetzt."
    },
    {
      "date": "2024-11-07",
      "id": "92870",
      "original_text": "Registerbekanntmachung nach dem Umwandlungsgesetz\nRheinland-Pfalz Amtsgericht Koblenz HRB 13725\nSHD Holding GmbH. – Andernach",
      "type": "Registerbekanntmachung nach dem Umwandlungsgesetz",
      "state": "Rheinland-Pfalz",
      "amtsgericht": "Amtsgericht Koblenz",
      "registernummer": "HRB 13725",
      "registerart": "HRB",
      "company_name": "SHD Holding GmbH.",
      "company_seat": "Andernach",
      "details": "07.11.2024 (Bekanntmachungsdatum)\n\nRheinland-Pfalz Amtsgericht Koblenz HRB 13725\nRegisterbekanntmachung nach dem Umwandlungsgesetz 07.11.2024 (Eintragungsdatum)\n\nSHD Holding GmbH.\nGesellschaft mit beschränkter Haftung\nAndernach\n\nAls nicht eingetragen wird veröffentlicht: Den Gläubigern der an der Verschmelzung beteiligten Rechtsträger ist, wenn sie binnen sechs Monaten nach dem Tag, an dem die Eintragung der Verschmelzung in das Register des Sitzes desjenigen Rechtsträgers,dessen Gläubiger sie sind, nach § 19 Abs. 3 UmwG als bekannt gemacht gilt, ihren Anspruch nach Grund und Höhe schriftlich anmelden, Sicherheit zu leisten, soweit sie nicht Befriedigung verlangen können. Dieses Recht steht den Gläubigern jedoch nur zu, wenn sie glaubhaft machen, dass durch die Verschmelzung die Erfüllungd er Forderung gefährdet wird."
    },
    {
      "date": "2024-11-07",
      "id": "92871",
      "original_text": "Registerbekanntmachung nach dem Umwandlungsgesetz\nRheinland-Pfalz Amtsgericht Wittlich HRB 46915\nKB Vermögensverwaltung GmbH – Hermeskeil",
      "type": "Registerbekanntmachung nach dem Umwandlungsgesetz",
      "state": "Rheinland-Pfalz",
      "amtsgericht": "Amtsgericht Wittlich",
      "registernummer": "HRB 46915",
      "registerart": "HRB",
      "company_name": "KB Vermögensverwaltung GmbH",
      "company_seat": "Hermeskeil",
      "details": "07.11.2024 (Bekanntmachungsdatum)\n\nRheinland-Pfalz Amtsgericht Wittlich HRB 46915\nRegisterbekanntmachung nach dem Umwandlungsgesetz 07.11.2024 (Eintragungsdatum)\n\nKB Vermögensverwaltung GmbH\nGesellschaft mit beschränkter Haftung\nHermeskeil\n\nAls nicht eingetragen wird veröffentlicht: Den Gläubigern der an der Ausgliederung beteiligten Rechtsträger ist, wenn sie binnen sechs Monaten nac hdem Tag, an dem die Eintragung der Ausgliederung in das Register des Sitzes desjenigen Rechtsträgers,dessen Gläubiger sie sind, nach § 19 Abs. 3 UmwG als bekannt gemacht gilt, ihren Anspruch nach Grund und Höhe schriftlich anmelden, Sicherheit zu leisten, soweit sie nicht Befriedigung verlangen können. Dieses Recht steht den Gläubigern jedoch nur zu, wenn sie glaubhaft machen, dass durch die Ausgliederung die Erfüllung der Forderung gefährdet wird."
    },
    {
      "date": "2024-11-07",
      "id": "92872",
      "original_text": "Registerbekanntmachung nach dem Umwandlungsgesetz\nRheinland-Pfalz Amtsgericht Bad Kreuznach HRB 24518\nFensterhelden F & T GmbH – Kastellaun",
      "type": "Registerbekanntmachung nach dem Umwandlungsgesetz",
      "state": "Rheinland-Pfalz",
      "amtsgericht": "Amtsgericht Bad Kreuznach",
      "registernummer": "HRB 24518",
      "registerart": "HRB",
      "company_name": "Fensterhelden F & T GmbH",
      "company_seat": "Kastellaun",
      "details": "07.11.2024 (Bekanntmachungsdatum)\n\nRheinland-Pfalz Amtsgericht Bad Kreuznach HRB 24518\nRegisterbekanntmachung nach dem Umwandlungsgesetz 07.11.2024 (Eintragungsdatum)\n\nFensterhelden F & T GmbH\nGesellschaft mit beschränkter Haftung\nKastellaun\n\nAls nicht eingetragen wird veröffentlicht: Den Gläubigern der an der Ausgliederung beteiligten Rechtsträger ist, wenn sie binnen sechs Monaten nach dem Tag, an dem die Eintragung der Ausgliederung in das Register des Sitzes desjenigen Rechtsträgers, dessen Gläubiger sie sind, nach § 19 Abs. 3 UmwG als bekannt gemacht gilt, ihren Anspruch nach Grund und Höhe schriftlich anmelden, Sicherheit zu leisten, soweit sie nicht Befriedigung verlangen können. Dieses Recht steht den Gläubigern jedoch nur zu, wenn sie glaubhaft machen, dass durch die Ausgliederung die Erfüllung der Forderung gefährdet wird."
    },
    {
      "date": "2024-11-07",
      "id": "92873",
      "original_text": "Löschungsankündigung\nRheinland-Pfalz Amtsgericht Ludwigshafen a.Rhein (Ludwigshafen) HRB 5216\nTA Bau GmbH – Ludwigshafen/Rh.",
      "type": "Löschungsankündigung",
      "state": "Rheinland-Pfalz",
      "amtsgericht": "Amtsgericht Ludwigshafen a.Rhein (Ludwigshafen)",
      "registernummer": "HRB 5216",
      "registerart": "HRB",
      "company_name": "TA Bau GmbH",
      "company_seat": "Ludwigshafen/Rh.",
      "details": "07.11.2024 (Bekanntmachungsdatum)\n\nRheinland-Pfalz Amtsgericht Ludwigshafen a.Rhein (Ludwigshafen) HRB 5216\nLöschungsankündigung\n\nTA Bau GmbH\nGesellschaft mit beschränkter Haftung\nLudwigshafen/Rh.\n\nDas Registergericht beabsichtigt die Gesellschaft von Amts wegen nach § 394 FamFG zu löschen. Die Frist zur Erhebung eines Widerspruchs ist auf einen Monat festgesetzt."
    },
    {
      "date": "2024-11-07",
      "id": "92874",
      "original_text": "Löschungsankündigung\nRheinland-Pfalz Amtsgericht Koblenz HRB 21887\nBK Interior GmbH – Mülheim-Kärlich",
      "type": "Löschungsankündigung",
      "state": "Rheinland-Pfalz",
      "amtsgericht": "Amtsgericht Koblenz",
      "registernummer": "HRB 21887",
      "registerart": "HRB",
      "company_name": "BK Interior GmbH",
      "company_seat": "Mülheim-Kärlich",
      "details": "07.11.2024 (Bekanntmachungsdatum)\n\nRheinland-Pfalz Amtsgericht Koblenz HRB 21887\nLöschungsankündigung\n\nBK Interior GmbH\nGesellschaft mit beschränkter Haftung\nMülheim-Kärlich\n\nDas Registergericht beabsichtigt die Gesellschaft von Amts wegen nach § 394 FamFG zu löschen. Die Frist zur Erhebung eines Widerspruchs ist auf zwei Monate festgesetzt."
    },
    {
      "date": "2024-11-07",
      "id": "92875",
      "original_text": "Registerbekanntmachung nach dem Umwandlungsgesetz\nRheinland-Pfalz Amtsgericht Koblenz HRA 22709\nComiCora Consulting GmbH & Co. KG Steuerberatungsgesellschaft – Koblenz",
      "type": "Registerbekanntmachung nach dem Umwandlungsgesetz",
      "state": "Rheinland-Pfalz",
      "amtsgericht": "Amtsgericht Koblenz",
      "registernummer": "HRA 22709",
      "registerart": "HRA",
      "company_name": "ComiCora Consulting GmbH & Co. KG Steuerberatungsgesellschaft",
      "company_seat": "Koblenz",
      "details": "07.11.2024 (Bekanntmachungsdatum)\n\nRheinland-Pfalz Amtsgericht Koblenz HRA 22709\nRegisterbekanntmachung nach dem Umwandlungsgesetz 07.11.2024 (Eintragungsdatum)\n\nComiCora Consulting GmbH & Co. KG Steuerberatungsgesellschaft\nKommanditgesellschaft\nKoblenz\n\nAls nicht eingetragen wird veröffentlicht: Den Gläubigern der an der Spaltung beteiligten Rechtsträger ist, wenn sie binnen sechs Monaten nach dem Tag, an dem die Eintragung der Spaltung in das Register des Sitzes desjenigen Rechtsträgers, dessen Gläubiger sie sind, nach § 19 Abs. 3 UmwG als bekanntgemacht gilt, ihren Anspruch nach Grund und Höhe schriftlich anmelden, Sicherheit zu leisten, soweit sie nicht Befriedigung verlangen können. Dieses Recht steht den Gläubigern jedoch nur zu, wenn sie glaubhaft machen, dass durch die Spaltung die Erfüllung der orderung gefährdet wird."
    },
    {
      "date": "2024-11-07",
      "id": "92876",
      "original_text": "Löschungsankündigung\nRheinland-Pfalz Amtsgericht Zweibrücken HRB 30566\nWasheim Baubetreuungs- und Bauträgerunternehmergesellschaft (haftungsbeschränkt) – Ramstein-Miesenbach",
      "type": "Löschungsankündigung",
      "state": "Rheinland-Pfalz",
      "amtsgericht": "Amtsgericht Zweibrücken",
      "registernummer": "HRB 30566",
      "registerart": "HRB",
      "company_name": "Washeim Baubetreuungs- und Bauträgerunternehmergesellschaft (haftungsbeschränkt)",
      "company_seat": "Ramstein-Miesenbach",
      "details": "07.11.2024 (Bekanntmachungsdatum)\n\nRheinland-Pfalz Amtsgericht Zweibrücken HRB 30566\nLöschungsankündigung\n\nWasheim Baubetreuungs- und Bauträgerunternehmergesellschaft (haftungsbeschränkt)\nGesellschaft mit beschränkter Haftung\nRamstein-Miesenbach\n\nDas Registergericht beabsichtigt die Gesellschaft von Amts wegen nach § 394 FamFG zu löschen. Die Frist zur Erhebung eines Widerspruchs ist auf einen Monat festgesetzt."
    },
    {
      "date": "2024-11-07",
      "id": "92877",
      "original_text": "Löschungsankündigung\nRheinland-Pfalz Amtsgericht Ludwigshafen a.Rhein (Ludwigshafen) HRB 67416\nGEORGE Verwaltungs- und Beteiligungsgesellschaft mbH – Frankenthal",
      "type": "Löschungsankündigung",
      "state": "Rheinland-Pfalz",
      "amtsgericht": "Amtsgericht Ludwigshafen a.Rhein (Ludwigshafen)",
      "registernummer": "HRB 67416",
      "registerart": "HRB",
      "company_name": "GEORGE Verwaltungs- und Beteiligungsgesellschaft mbH",
      "company_seat": "Frankenthal",
      "details": "07.11.2024 (Bekanntmachungsdatum)\n\nRheinland-Pfalz Amtsgericht Ludwigshafen a.Rhein (Ludwigshafen) HRB 67416\nLöschungsankündigung\n\nGEORGE Verwaltungs- und Beteiligungsgesellschaft mbH\nGesellschaft mit beschränkter Haftung\nFrankenthal\n\nDas Registergericht beabsichtigt die Gesellschaft von Amts wegen nach § 394 FamFG zu löschen. Die Frist zur Erhebung eines Widerspruchs ist auf einen Monat festgesetzt."
    },
    {
      "date": "2024-11-07",
      "id": "92878",
      "original_text": "Einreichung neuer Dokumente\nRheinland-Pfalz Amtsgericht Koblenz HRB 27343\nCompuGroup Medical Management SE – Koblenz",
      "type": "Einreichung neuer Dokumente",
      "state": "Rheinland-Pfalz",
      "amtsgericht": "Amtsgericht Koblenz",
      "registernummer": "HRB 27343",
      "registerart": "HRB",
      "company_name": "CompuGroup Medical Management SE",
      "company_seat": "Koblenz",
      "details": "07.11.2024 (Bekanntmachungsdatum)\n\nRheinland-Pfalz Amtsgericht Koblenz HRB 27343\nEinreichung neuer Dokumente\n\nCompuGroup Medical Management SE\nEuropäische Aktiengesellschaft (SE)\nKoblenz\n\nDem Registergericht ist eine Liste der Mitglieder des Verwaltungsrates eingereicht worden."
    },
    {
      "date": "2024-11-07",
      "id": "92879",
      "original_text": "Registerbekanntmachung nach dem Umwandlungsgesetz\nRheinland-Pfalz Amtsgericht Bad Kreuznach HRA 21300\nFensterhelden - Inhaber Waldemar Tews e.K. – Kastellaun",
      "type": "Registerbekanntmachung nach dem Umwandlungsgesetz",
      "state": "Rheinland-Pfalz",
      "amtsgericht": "Amtsgericht Bad Kreuznach",
      "registernummer": "HRA 21300",
      "registerart": "HRA",
      "company_name": "Fensterhelden - Inhaber Waldemar Tews e.K.",
      "company_seat": "Kastellaun",
      "details": "07.11.2024 (Bekanntmachungsdatum)\n\nRheinland-Pfalz Amtsgericht Bad Kreuznach HRA 21300\nRegisterbekanntmachung nach dem Umwandlungsgesetz 07.11.2024 (Eintragungsdatum)\n\nFensterhelden - Inhaber Waldemar Tews e.K.\nEinzelkaufmann / Einzelkauffrau\nKastellaun\n\nAls nicht eingetragen wird veröffentlicht: Den Gläubigern der an der Ausgliederung beteiligten Rechtsträger ist, wenn sie binnen sechs Monaten nach dem Tag, an dem die Eintragung der Ausgliederung in das Register des Sitzes desjenigen Rechtsträgers, dessen Gläubiger sie sind, nach § 19 Abs. 3 UmwG als bekannt gemacht gilt, ihren Anspruch nach Grund und Höhe schriftlich anmelden, Sicherheit zu leisten, soweit sie nicht Befriedigung verlangen können. Dieses Recht steht den Gläubigern jedoch nur zu, wenn sie glaubhaft machen, dass durch die Ausgliederung die Erfüllung der Forderung gefährdet wird."
    },
    {
      "date": "2024-11-07",
      "id": "92880",
      "original_text": "Registerbekanntmachung nach dem Umwandlungsgesetz\nRheinland-Pfalz Amtsgericht Koblenz HRB 20603\nOsterburg & Keßler Steuerberatungsgesellschaft mbH – Rhens",
      "type": "Registerbekanntmachung nach dem Umwandlungsgesetz",
      "state": "Rheinland-Pfalz",
      "amtsgericht": "Amtsgericht Koblenz",
      "registernummer": "HRB 20603",
      "registerart": "HRB",
      "company_name": "Osterburg & Keßler Steuerberatungsgesellschaft mbH",
      "company_seat": "Rhens",
      "details": "07.11.2024 (Bekanntmachungsdatum)\n\nRheinland-Pfalz Amtsgericht Koblenz HRB 20603\nRegisterbekanntmachung nach dem Umwandlungsgesetz 07.11.2024 (Eintragungsdatum)\n\nOsterburg & Keßler Steuerberatungsgesellschaft mbH\nGesellschaft mit beschränkter Haftung\nRhens\n\nAls nicht eingetragen wird veröffentlicht: Den Gläubigern der an der Spaltung beteiligten Rechtsträger ist, wenn sie binnen sechs Monaten nach dem Tag, an dem die Eintragung der Spaltung in das Register des Sitzes desjenigen Rechtsträgers, dessen Gläubiger sie sind, nach § 19 Abs. 3 UmwG als bekanntgemacht gilt, ihren Anspruch nach Grund und Höhe schriftlich anmelden, Sicherheit zu leisten, soweit sie nicht Befriedigung verlangen können. Dieses Recht steht den Gläubigern jedoch nur zu, wenn sie glaubhaft machen, dass durch die Spaltung die Erfüllung der orderung gefährdet wird."
    },
    {
      "date": "2024-11-07",
      "id": "92881",
      "original_text": "Registerbekanntmachung nach dem Umwandlungsgesetz\nNordrhein-Westfalen Amtsgericht Köln HRA 37507\nAbschlepp-, Pannen- und Bergungsdienst Klahr e.K. – Köln",
      "type": "Registerbekanntmachung nach dem Umwandlungsgesetz",
      "state": "Nordrhein-Westfalen",
      "amtsgericht": "Amtsgericht Köln",
      "registernummer": "HRA 37507",
      "registerart": "HRA",
      "company_name": "Abschlepp-, Pannen- und Bergungsdienst Klahr e.K.",
      "company_seat": "Köln",
      "details": "07.11.2024 (Bekanntmachungsdatum)\n\nNordrhein-Westfalen Amtsgericht Köln HRA 37507\nRegisterbekanntmachung nach dem Umwandlungsgesetz 07.11.2024 (Eintragungsdatum)\n\nAbschlepp-, Pannen- und Bergungsdienst Klahr e.K.\nEinzelkaufmann / Einzelkauffrau\nKöln\n\nDen Gläubigern der an der Ausgliederung beteiligten Rechtsträger ist, wenn sie binnen sechs Monaten nach dem Tag, an dem die Eintragung der Ausgliederung in das Register des Sitzes desjenigen Rechtsträgers, dessen Gläubiger sie sind, nach § 19 Absatz 3 UmwG als bekanntgemacht gilt, ihren Anspruch nach Grund und Höhe schriftlich anmelden, Sicherheit zu leisten, soweit sie nicht Befriedigung verlangen können. Dieses Recht steht den Gläubigern jedoch nur zu, wenn sie glaubhaft machen, dass durch die Ausgliederung die Erfüllung ihrer Forderung gefährdet wird."
    },
    {
      "date": "2024-11-07",
      "id": "92882",
      "original_text": "Einreichung neuer Dokumente\nNordrhein-Westfalen Amtsgericht Wuppertal HRB 7619\nWuppertal Institut für Klima, Umwelt, Energie gGmbH – Wuppertal",
      "type": "Einreichung neuer Dokumente",
      "state": "Nordrhein-Westfalen",
      "amtsgericht": "Amtsgericht Wuppertal",
      "registernummer": "HRB 7619",
      "registerart": "HRB",
      "company_name": "Wuppertal Institut für Klima, Umwelt, Energie gGmbH",
      "company_seat": "Wuppertal",
      "details": "07.11.2024 (Bekanntmachungsdatum)\n\nNordrhein-Westfalen Amtsgericht Wuppertal HRB 7619\nEinreichung neuer Dokumente\n\nWuppertal Institut für Klima, Umwelt, Energie gGmbH\nGesellschaft mit beschränkter Haftung\nWuppertal\n\nDem Registergericht ist eine Liste der Mitglieder des Aufsichtsrates eingereicht worden."
    },
    {
      "date": "2024-11-07",
      "id": "92883",
      "original_text": "Einreichung neuer Dokumente\nNordrhein-Westfalen Amtsgericht Bonn HRB 17337\nPostbank Direkt GmbH – Bonn",
      "type": "Einreichung neuer Dokumente",
      "state": "Nordrhein-Westfalen",
      "amtsgericht": "Amtsgericht Bonn",
      "registernummer": "HRB 17337",
      "registerart": "HRB",
      "company_name": "Postbank Direkt GmbH",
      "company_seat": "Bonn",
      "details": "07.11.2024 (Bekanntmachungsdatum)\n\nNordrhein-Westfalen Amtsgericht Bonn HRB 17337\nEinreichung neuer Dokumente\n\nPostbank Direkt GmbH\nGesellschaft mit beschränkter Haftung\nBonn\n\nDem Registergericht ist eine neue Liste der Mitglieder des Aufsichtsrates eingereicht worden."
    },
    {
      "date": "2024-11-07",
      "id": "92884",
      "original_text": "Löschungsankündigung\nNordrhein-Westfalen Amtsgericht Düsseldorf HRB 91115\nAKSU GmbH – Düsseldorf",
      "type": "Löschungsankündigung",
      "state": "Nordrhein-Westfalen",
      "amtsgericht": "Amtsgericht Düsseldorf",
      "registernummer": "HRB 91115",
      "registerart": "HRB",
      "company_name": "AKSU GmbH",
      "company_seat": "Düsseldorf",
      "details": "07.11.2024 (Bekanntmachungsdatum)\n\nNordrhein-Westfalen Amtsgericht Düsseldorf HRB 91115\nLöschungsankündigung\n\nAKSU GmbH\nGesellschaft mit beschränkter Haftung\nDüsseldorf\n\nBetr.: AKSU GmbH, Königsallee 92 A, 40212 Düsseldorf\n\nDas Registergericht beabsichtigt die Gesellschaft von Amts wegen nach § 394 FamFG zu löschen. Die Frist zur Erhebung eines Widerspruchs ist auf 3 Wochen festgesetzt.\n\nRechtsbehelfsbelehrung:\n\nDas Widerspruchsrecht steht jedem zu, der an der Unterlassung der Löschung ein berechtigtes Interesse hat. Der Widerspruch ist bei dem Amtsgericht Düsseldorf -Registergericht-, Werdener Straße 1, 40227 Düsseldorf schriftlich in deutscher Sprache oder zur Niederschrift der Geschäftsstelle einzulegen. Der Widerspruch kann auch zur Niederschrift der Geschäftsstelle eines jeden Amtsgerichtes abgegeben werden. Die Einlegung ist auch durch Übertragung eines elektronischen Dokuments an die elektronische Poststelle des Gerichts möglich. Das elektronische Dokument muss für die Bearbeitung durch das Gericht geeignet und mit einer qualifizierten elektronischen Signatur der verantwortenden Person versehen sein oder von der verantwortenden Person signiert und auf einem sicheren Übermittlungsweg gemäß § 130a ZPO nach näherer Maßgabe der Verordnung über die technischen Rahmenbedingungen des elektronischen Rechtsverkehrs und über das besondere elektronische Behördenpostfach (BGBl. I, S.3803) eingereicht werden. Weitere Informationen erhalten Sie auf der Internetseite www.justiz.de.\nDer Widerspruch muss spätestens innerhalb der gesetzten Frist nach dem Datum der Bekanntmachung der Löschungsankündigung bei dem Amtsgericht - Registergericht - Düsseldorf eingegangen sein.  Dies gilt auch dann, wenn der Widerspruch zur Niederschrift der Geschäftsstelle eines anderen Amtsgerichtes abgegeben wurde. Die Frist beginnt mit dem Tage der Bekanntmachung der Löschungsankündigung in dem für die Bekanntmachung der Eintragungen in das Handelsregister bestimmten elektronischen Informations- und Kommunikationssystem nach § 10 des Handelsgesetzbuches. Fällt das Ende der Frist auf einen Sonntag, einen allgemeinen Feiertag oder Sonnabend, so endet die Frist mit Ablauf des nächsten Werktages.\nDer Widerspruch muss die Bezeichnung der angefochtenen Löschungsankündigung sowie die Erklärung enthalten, dass Widerspruch gegen diese Löschungsankündigung eingelegt wird. Er ist zu unterzeichnen und soll begründet werden."
    },
    {
      "date": "2024-11-07",
      "id": "92885",
      "original_text": "Sonstige Registerbekanntmachung\nNordrhein-Westfalen Amtsgericht Gütersloh HRB 11203\nGründer und Tönjes Invest GmbH – Rheda-Wiedenbrück",
      "type": "Sonstige Registerbekanntmachung",
      "state": "Nordrhein-Westfalen",
      "amtsgericht": "Amtsgericht Gütersloh",
      "registernummer": "HRB 11203",
      "registerart": "HRB",
      "company_name": "Gründer und Tönjes Invest GmbH",
      "company_seat": "Rheda-Wiedenbrück",
      "details": "07.11.2024 (Bekanntmachungsdatum)\n\nNordrhein-Westfalen Amtsgericht Gütersloh HRB 11203\nSonstige Registerbekanntmachung\n\nGründer und Tönjes Invest GmbH\nGesellschaft mit beschränkter Haftung\nRheda-Wiedenbrück\n\nIn der Handelsregistersache\nGründer und Tönjes Invest GmbH\nwird aufgrund der am 26.05.2023 durch den Bürgermeister der Stadt Lippstadt (Fachbereich Recht und Ordnung) gegen den alleinigen Geschäftsführer Johannes Gründer angeordneten Gewerbeuntersagung und der diesbezüglichen Eintragung im Gewerbezentralregister\ndie Eintragung des Herrn Johannes Gründer, geb. 28.04.1966, als Geschäftsführer der Gründer und Tönjes Invest GmbH gem. 395 FamFG gelöscht."
    },
    {
      "date": "2024-11-07",
      "id": "92886",
      "original_text": "Löschungsankündigung\nNordrhein-Westfalen Amtsgericht Düsseldorf HRB 48806\nMN Vermietungsgesellschaft mbH – Düsseldorf",
      "type": "Löschungsankündigung",
      "state": "Nordrhein-Westfalen",
      "amtsgericht": "Amtsgericht Düsseldorf",
      "registernummer": "HRB 48806",
      "registerart": "HRB",
      "company_name": "MN Vermietungsgesellschaft mbH",
      "company_seat": "Düsseldorf",
      "details": "07.11.2024 (Bekanntmachungsdatum)\n\nNordrhein-Westfalen Amtsgericht Düsseldorf HRB 48806\nLöschungsankündigung\n\nMN Vermietungsgesellschaft mbH\nGesellschaft mit beschränkter Haftung\nDüsseldorf\n\nDas Registergericht beabsichtigt die Gesellschaft von Amts wegen nach § 394 Abs. 1 FamFG zu löschen. Die Frist zur Erhebung eines Widerspruchs ist auf einen Monat festgesetzt.\n\nRechtsbehelfsbelehrung:\nDas Widerspruchsrecht steht jedem zu, der an der Unterlassung der Löschung ein berechtigtes Interesse hat. Der Widerspruch ist bei dem Amtsgericht Düsseldorf -Registergericht-, Werdener Straße 1, 40227 Düsseldorf schriftlich in deutscher Sprache oder zur Niederschrift der Geschäftsstelle einzulegen. Der Widerspruch kann auch zur Niederschrift der Geschäftsstelle eines jeden Amtsgerichtes abgegeben werden. Die Einlegung ist auch durch Übertragung eines elektronischen Dokuments an die elektronische Poststelle des Gerichts möglich. Das elektronische Dokument muss für die Bearbeitung durch das Gericht geeignet und mit einer qualifizierten elektronischen Signatur der verantwortenden Person versehen sein oder von der verantwortenden Person signiert und auf einem sicheren Übermittlungsweg gemäß § 130a ZPO nach näherer Maßgabe der Verordnung über die technischen Rahmenbedingungen des elektronischen Rechtsverkehrs und über das besondere elektronische Behördenpostfach (BGBl. I, S.3803) eingereicht werden. Weitere Informationen erhalten Sie auf der Internetseite www.justiz.de.\nDer Widerspruch muss spätestens innerhalb der gesetzten Frist nach dem Datum der Bekanntmachung der Löschungsankündigung bei dem Amtsgericht - Registergericht - Düsseldorf eingegangen sein.  Dies gilt auch dann, wenn der Widerspruch zur Niederschrift der Geschäftsstelle eines anderen Amtsgerichtes abgegeben wurde. Die Frist beginnt mit dem Tage der Bekanntmachung der Löschungsankündigung in dem für die Bekanntmachung der Eintragungen in das Handelsregister bestimmten elektronischen Informations- und Kommunikationssystem nach § 10 des Handelsgesetzbuches. Fällt das Ende der Frist auf einen Sonntag, einen allgemeinen Feiertag oder Sonnabend, so endet die Frist mit Ablauf des nächsten Werktages.\nDer Widerspruch muss die Bezeichnung der angefochtenen Löschungsankündigung sowie die Erklärung enthalten, dass Widerspruch gegen diese Löschungsankündigung eingelegt wird. Er ist zu unterzeichnen und soll begründet werden."
    },
    {
      "date": "2024-11-07",
      "id": "92887",
      "original_text": "Registerbekanntmachung nach dem Umwandlungsgesetz\nNordrhein-Westfalen Amtsgericht Siegen HRA 9479\nARTIS UG (haftungsbeschränkt) & Co. KG – Hilchenbach",
      "type": "Registerbekanntmachung nach dem Umwandlungsgesetz",
      "state": "Nordrhein-Westfalen",
      "amtsgericht": "Amtsgericht Siegen",
      "registernummer": "HRA 9479",
      "registerart": "HRA",
      "company_name": "ARTIS UG (haftungsbeschränkt) & Co. KG",
      "company_seat": "Hilchenbach",
      "details": "07.11.2024 (Bekanntmachungsdatum)\n\nNordrhein-Westfalen Amtsgericht Siegen HRA 9479\nRegisterbekanntmachung nach dem Umwandlungsgesetz 07.11.2024 (Eintragungsdatum)\n\nARTIS UG (haftungsbeschränkt) & Co. KG\nKommanditgesellschaft\nHilchenbach\n\nDen Gläubigern der an der Verschmelzung beteiligten Rechtsträger ist, wenn sie binnen sechs Monaten nach dem Tag, an dem die Eintragung der Verschmelzung in das Register des Sitzes desjenigen Rechtsträgers, dessen Gläubiger sie sind, nach § 19 Absatz 3 UmwG als bekanntgemacht gilt, ihren Anspruch nach Grund und Höhe schriftlich anmelden, Sicherheit zu leisten, soweit sie nicht Befriedigung verlangen können. Dieses Recht steht den Gläubigern jedoch nur zu, wenn sie glaubhaft machen, dass durch die Verschmelzung die Erfüllung ihrer Forderung gefährdet wird."
    },
    {
      "date": "2024-11-07",
      "id": "92888",
      "original_text": "Registerbekanntmachung nach dem Umwandlungsgesetz\nNordrhein-Westfalen Amtsgericht Bad Oeynhausen VR 21481 früher Amtsgericht Herford\nVersorgungswerk der im Bezirk der Kreishandwerkerschaft Herford zusammengeschlossenen Innungen e.V. – Lübbecke",
      "type": "Registerbekanntmachung nach dem Umwandlungsgesetz",
      "state": "Nordrhein-Westfalen",
      "amtsgericht": "Amtsgericht Bad Oeynhausen",
      "registernummer": "VR 21481",
      "registerart": "VR",
      "company_name": "Versorgungswerk der im Bezirk der Kreishandwerkerschaft Herford zusammengeschlossenen Innungen e.V.",
      "company_seat": "Lübbecke",
      "former_amtsgericht": "Herford",
      "details": "07.11.2024 (Bekanntmachungsdatum)\n\nNordrhein-Westfalen Amtsgericht Bad Oeynhausen VR 21481 früher Amtsgericht Herford\nRegisterbekanntmachung nach dem Umwandlungsgesetz 07.11.2024 (Eintragungsdatum)\n\nVersorgungswerk der im Bezirk der Kreishandwerkerschaft Herford zusammengeschlossenen Innungen e.V.\neingetragener Verein\nLübbecke\n\nDen Gläubigern der an der Verschmelzung beteiligten Rechtsträger ist, wenn sie binnen sechs Monaten nach dem Tag, an dem die Eintragung der Verschmelzung in das Register des Sitzes desjenigen Rechtsträgers, dessen Gläubiger sie sind, nach § 19 Absatz 3 UmwG als bekanntgemacht gilt, ihren Anspruch nach Grund und Höhe schriftlich anmelden, Sicherheit zu leisten, soweit sie nicht Befriedigung verlangen können. Dieses Recht steht den Gläubigern jedoch nur zu, wenn sie glaubhaft machen, dass durch die Verschmelzung die Erfüllung ihrer Forderung gefährdet wird."
    },
    {
      "date": "2024-11-07",
      "id": "92889",
      "original_text": "Registerbekanntmachung nach dem Umwandlungsgesetz\nNordrhein-Westfalen Amtsgericht Dortmund HRA 19620\nHorst Georg e. K. – Werne",
      "type": "Registerbekanntmachung nach dem Umwandlungsgesetz",
      "state": "Nordrhein-Westfalen",
      "amtsgericht": "Amtsgericht Dortmund",
      "registernummer": "HRA 19620",
      "registerart": "HRA",
      "company_name": "Horst Georg e. K.",
      "company_seat": "Werne",
      "details": "07.11.2024 (Bekanntmachungsdatum)\n\nNordrhein-Westfalen Amtsgericht Dortmund HRA 19620\nRegisterbekanntmachung nach dem Umwandlungsgesetz 07.11.2024 (Eintragungsdatum)\n\nHorst Georg e. K.\nEinzelkaufmann / Einzelkauffrau\nWerne\n\nDen Gläubigern der an der Ausgliederung beteiligten Rechtsträger ist, wenn sie binnen sechs Monaten nach dem Tag, an dem die Eintragung der Ausgliederung in das Register des Sitzes derjenigen Rechtsträger deren Gläubiger sie sind, nach § 19 Absatz 3 UmwG als bekanntgemacht gilt, ihren Anspruch nach Grund und Höhe schriftlich anmelden, Sicherheit zu leisten, soweit sie nicht Befriedigung verlangen können. Dieses Recht steht den Gläubigern jedoch nur zu, wenn sie glaubhaft machen, dass durch die Ausgliederung die Erfüllung ihrer Forderung gefährdet wird."
    },
    {
      "date": "2024-11-07",
      "id": "92890",
      "original_text": "Registerbekanntmachung nach dem Umwandlungsgesetz\nNordrhein-Westfalen Amtsgericht Siegen HRB 12914\nCAD Systemtechnik Böhne GmbH – Hilchenbach",
      "type": "Registerbekanntmachung nach dem Umwandlungsgesetz",
      "state": "Nordrhein-Westfalen",
      "amtsgericht": "Amtsgericht Siegen",
      "registernummer": "HRB 12914",
      "registerart": "HRB",
      "company_name": "CAD Systemtechnik Böhne GmbH",
      "company_seat": "Hilchenbach",
      "details": "07.11.2024 (Bekanntmachungsdatum)\n\nNordrhein-Westfalen Amtsgericht Siegen HRB 12914\nRegisterbekanntmachung nach dem Umwandlungsgesetz 07.11.2024 (Eintragungsdatum)\n\nCAD Systemtechnik Böhne GmbH\nGesellschaft mit beschränkter Haftung\nHilchenbach\n\nDen Gläubigern der an der Verschmelzung beteiligten Rechtsträger ist, wenn sie binnen sechs Monaten nach dem Tag, an dem die Eintragung der Verschmelzung in das Register des Sitzes desjenigen Rechtsträgers, dessen Gläubiger sie sind, nach § 19 Absatz 3 UmwG als bekanntgemacht gilt, ihren Anspruch nach Grund und Höhe schriftlich anmelden, Sicherheit zu leisten, soweit sie nicht Befriedigung verlangen können. Dieses Recht steht den Gläubigern jedoch nur zu, wenn sie glaubhaft machen, dass durch die Verschmelzung die Erfüllung ihrer Forderung gefährdet wird."
    },
    {
      "date": "2024-11-07",
      "id": "92891",
      "original_text": "Löschungsankündigung\nNordrhein-Westfalen Amtsgericht Köln HRB 92643\nWIED Deutschland GmbH – Kerpen",
      "type": "Löschungsankündigung",
      "state": "Nordrhein-Westfalen",
      "amtsgericht": "Amtsgericht Köln",
      "registernummer": "HRB 92643",
      "registerart": "HRB",
      "company_name": "WIED Deutschland GmbH",
      "company_seat": "Kerpen",
      "details": "07.11.2024 (Bekanntmachungsdatum)\n\nNordrhein-Westfalen Amtsgericht Köln HRB 92643\nLöschungsankündigung\n\nWIED Deutschland GmbH\nGesellschaft mit beschränkter Haftung\nKerpen\n\nDas Registergericht beabsichtigt die Gesellschaft von Amts wegen nach § 394 FamFG zu löschen. Die Frist zur Erhebung eines Widerspruchs ist auf einen Monat festgesetzt."
    },
    {
      "date": "2024-11-07",
      "id": "92892",
      "original_text": "Registerbekanntmachung nach dem Umwandlungsgesetz\nNordrhein-Westfalen Amtsgericht Siegen HRA 3744\nErich Althaus Spedition - Güter - Nah- und Fernverkehr GmbH & Co. KG – Kreuztal",
      "type": "Registerbekanntmachung nach dem Umwandlungsgesetz",
      "state": "Nordrhein-Westfalen",
      "amtsgericht": "Amtsgericht Siegen",
      "registernummer": "HRA 3744",
      "registerart": "HRA",
      "company_name": "Erich Althaus Spedition - Güter - Nah- und Fernverkehr GmbH & Co. KG",
      "company_seat": "Kreuztal",
      "details": "07.11.2024 (Bekanntmachungsdatum)\n\nNordrhein-Westfalen Amtsgericht Siegen HRA 3744\nRegisterbekanntmachung nach dem Umwandlungsgesetz 07.11.2024 (Eintragungsdatum)\n\nErich Althaus Spedition - Güter - Nah- und Fernverkehr GmbH & Co. KG\nKommanditgesellschaft\nKreuztal\n\nDen Gläubigern der an der Verschmelzung beteiligten Rechtsträger ist, wenn sie binnen sechs Monaten nach dem Tag, an dem die Eintragung der Verschmelzung in das Register des Sitzes desjenigen Rechtsträgers, dessen Gläubiger sie sind, nach § 19 Absatz 3 UmwG als bekanntgemacht gilt, ihren Anspruch nach Grund und Höhe schriftlich anmelden, Sicherheit zu leisten, soweit sie nicht Befriedigung verlangen können. Dieses Recht steht den Gläubigern jedoch nur zu, wenn sie glaubhaft machen, dass durch die Verschmelzung die Erfüllung ihrer Forderung gefährdet wird."
    },
    {
      "date": "2024-11-07",
      "id": "92893",
      "original_text": "Einreichung neuer Dokumente\nNordrhein-Westfalen Amtsgericht Mönchengladbach HRB 22737\nSpeira Midco Management GmbH – Grevenbroich",
      "type": "Einreichung neuer Dokumente",
      "state": "Nordrhein-Westfalen",
      "amtsgericht": "Amtsgericht Mönchengladbach",
      "registernummer": "HRB 22737",
      "registerart": "HRB",
      "company_name": "Speira Midco Management GmbH",
      "company_seat": "Grevenbroich",
      "details": "07.11.2024 (Bekanntmachungsdatum)\n\nNordrhein-Westfalen Amtsgericht Mönchengladbach HRB 22737\nEinreichung neuer Dokumente\n\nSpeira Midco Management GmbH\nGesellschaft mit beschränkter Haftung\nGrevenbroich\n\nDem Registergericht ist eine neue Liste der Mitglieder des Aufsichtsrates eingereicht worden."
    },
    {
      "date": "2024-11-07",
      "id": "92894",
      "original_text": "Löschungsankündigung\nNordrhein-Westfalen Amtsgericht Dortmund HRB 27314\nweiss service UG (haftungsbeschränkt) – Selm",
      "type": "Löschungsankündigung",
      "state": "Nordrhein-Westfalen",
      "amtsgericht": "Amtsgericht Dortmund",
      "registernummer": "HRB 27314",
      "registerart": "HRB",
      "company_name": "weiss service UG (haftungsbeschränkt)",
      "company_seat": "Selm",
      "details": "07.11.2024 (Bekanntmachungsdatum)\n\nNordrhein-Westfalen Amtsgericht Dortmund HRB 27314\nLöschungsankündigung\n\nweiss service UG (haftungsbeschränkt)\nGesellschaft mit beschränkter Haftung\nSelm\n\nDas Registergericht beabsichtigt die Gesellschaft von Amts wegen nach § 394 FamFG zu löschen. Die Frist zur Erhebung eines Widerspruchs ist auf zwei Monate festgesetzt."
    },
    {
      "date": "2024-11-07",
      "id": "92895",
      "original_text": "Registerbekanntmachung nach dem Umwandlungsgesetz\nNordrhein-Westfalen Amtsgericht Siegen HRB 4833\nDornseiff Arbeitsbühnen GmbH – Burbach",
      "type": "Registerbekanntmachung nach dem Umwandlungsgesetz",
      "state": "Nordrhein-Westfalen",
      "amtsgericht": "Amtsgericht Siegen",
      "registernummer": "HRB 4833",
      "registerart": "HRB",
      "company_name": "Dornseiff Arbeitsbühnen GmbH",
      "company_seat": "Burbach",
      "details": "07.11.2024 (Bekanntmachungsdatum)\n\nNordrhein-Westfalen Amtsgericht Siegen HRB 4833\nRegisterbekanntmachung nach dem Umwandlungsgesetz 06.11.2024 (Eintragungsdatum)\n\nDornseiff Arbeitsbühnen GmbH\nGesellschaft mit beschränkter Haftung\nBurbach\n\nDen Gläubigern der an der Verschmelzung beteiligten Rechtsträger ist, wenn sie binnen sechs Monaten nach dem Tag, an dem die Eintragung der Verschmelzung in das Register des Sitzes desjenigen Rechtsträgers, dessen Gläubiger sie sind, nach § 19 Absatz 3 UmwG als bekanntgemacht gilt, ihren Anspruch nach Grund und Höhe schriftlich anmelden, Sicherheit zu leisten, soweit sie nicht Befriedigung verlangen können. Dieses Recht steht den Gläubigern jedoch nur zu, wenn sie glaubhaft machen, dass durch die Verschmelzung die Erfüllung ihrer Forderung gefährdet wird."
    },
    {
      "date": "2024-11-07",
      "id": "92896",
      "original_text": "Registerbekanntmachung nach dem Umwandlungsgesetz\nNordrhein-Westfalen Amtsgericht Köln HRB 35224\nBVI Bauträger und Vermittlungsgesellschaft für Immobilien mbH – Köln",
      "type": "Registerbekanntmachung nach dem Umwandlungsgesetz",
      "state": "Nordrhein-Westfalen",
      "amtsgericht": "Amtsgericht Köln",
      "registernummer": "HRB 35224",
      "registerart": "HRB",
      "company_name": "BVI Bauträger und Vermittlungsgesellschaft für Immobilien mbH",
      "company_seat": "Köln",
      "details": "07.11.2024 (Bekanntmachungsdatum)\n\nNordrhein-Westfalen Amtsgericht Köln HRB 35224\nRegisterbekanntmachung nach dem Umwandlungsgesetz 07.11.2024 (Eintragungsdatum)\n\nBVI Bauträger und Vermittlungsgesellschaft für Immobilien mbH\nGesellschaft mit beschränkter Haftung\nKöln\n\nDen Gläubigern der an der Verschmelzung beteiligten Rechtsträger ist, wenn sie binnen sechs Monaten nach dem Tag, an dem die Eintragung der Verschmelzung in das Register des Sitzes desjenigen Rechtsträgers, dessen Gläubiger sie sind, nach § 19 Absatz 3 UmwG als bekanntgemacht gilt, ihren Anspruch nach Grund und Höhe schriftlich anmelden, Sicherheit zu leisten, soweit sie nicht Befriedigung verlangen können. Dieses Recht steht den Gläubigern jedoch nur zu, wenn sie glaubhaft machen, dass durch die Verschmelzung die Erfüllung ihrer Forderung gefährdet wird."
    },
    {
      "date": "2024-11-07",
      "id": "92897",
      "original_text": "Löschungsankündigung\nNordrhein-Westfalen Amtsgericht Mönchengladbach HRB 16750\nBrands Collection UG (haftungsbeschränkt) – Wegberg",
      "type": "Löschungsankündigung",
      "state": "Nordrhein-Westfalen",
      "amtsgericht": "Amtsgericht Mönchengladbach",
      "registernummer": "HRB 16750",
      "registerart": "HRB",
      "company_name": "Brands Collection UG (haftungsbeschränkt)",
      "company_seat": "Wegberg",
      "details": "07.11.2024 (Bekanntmachungsdatum)\n\nNordrhein-Westfalen Amtsgericht Mönchengladbach HRB 16750\nLöschungsankündigung 07.11.2024 (Eintragungsdatum)\n\nBrands Collection UG (haftungsbeschränkt)\nGesellschaft mit beschränkter Haftung\nWegberg\n\nDas Registergericht beabsichtigt die Gesellschaft von Amts wegen nach § 394 FamFG zu löschen. Die Frist zur Erhebung eines Widerspruchs ist auf drei Monate festgesetzt."
    },
    {
      "date": "2024-11-07",
      "id": "92898",
      "original_text": "Sonstige Registerbekanntmachung\nNordrhein-Westfalen Amtsgericht Münster HRB 9712\neCAPITAL ENTREPRENEURIAL PARTNERS AG – Münster",
      "type": "Sonstige Registerbekanntmachung",
      "state": "Nordrhein-Westfalen",
      "amtsgericht": "Amtsgericht Münster",
      "registernummer": "HRB 9712",
      "registerart": "HRB",
      "company_name": "eCAPITAL ENTREPRENEURIAL PARTNERS AG",
      "company_seat": "Münster",
      "details": "07.11.2024 (Bekanntmachungsdatum)\n\nNordrhein-Westfalen Amtsgericht Münster HRB 9712\nSonstige Registerbekanntmachung\n\neCAPITAL ENTREPRENEURIAL PARTNERS AG\nAktiengesellschaft\nMünster\n\nDem Registergericht ist eine neue Liste der Mitglieder des Aufsichtsrates eingereicht worden."
    },
    {
      "date": "2024-11-07",
      "id": "92899",
      "original_text": "Registerbekanntmachung nach dem Umwandlungsgesetz\nNordrhein-Westfalen Amtsgericht Bad Oeynhausen VR 40902 früher Amtsgericht Minden\nVersorgungswerk der im Bezirk der Kreishandwerkschaft Minden-Lübbecke zusammengeschlossenen Innungen – Minden",
      "type": "Registerbekanntmachung nach dem Umwandlungsgesetz",
      "state": "Nordrhein-Westfalen",
      "amtsgericht": "Amtsgericht Bad Oeynhausen",
      "registernummer": "VR 40902",
      "registerart": "VR",
      "company_name": "Versorgungswerk der im Bezirk der Kreishandwerkschaft Minden-Lübbecke zusammengeschlossenen Innungen",
      "company_seat": "Minden",
      "former_amtsgericht": "Minden",
      "details": "07.11.2024 (Bekanntmachungsdatum)\n\nNordrhein-Westfalen Amtsgericht Bad Oeynhausen VR 40902 früher Amtsgericht Minden\nRegisterbekanntmachung nach dem Umwandlungsgesetz 07.11.2024 (Eintragungsdatum)\n\nVersorgungswerk der im Bezirk der Kreishandwerkschaft Minden-Lübbecke zusammengeschlossenen Innungen\neingetragener Verein\nMinden\n\nDen Gläubigern der an der Verschmelzung beteiligten Rechtsträger ist, wenn sie binnen sechs Monaten nach dem Tag, an dem die Eintragung der Verschmelzung in das Register des Sitzes desjenigen Rechtsträgers, dessen Gläubiger sie sind, nach § 19 Absatz 3 UmwG als bekanntgemacht gilt, ihren Anspruch nach Grund und Höhe schriftlich anmelden, Sicherheit zu leisten, soweit sie nicht Befriedigung verlangen können. Dieses Recht steht den Gläubigern jedoch nur zu, wenn sie glaubhaft machen, dass durch die Verschmelzung die Erfüllung ihrer Forderung gefährdet wird."
    },
    {
      "date": "2024-11-07",
      "id": "92900",
      "original_text": "Löschungsankündigung\nNordrhein-Westfalen Amtsgericht Essen HRB 33842\nGajos Trockenbau GmbH – Essen",
      "type": "Löschungsankündigung",
      "state": "Nordrhein-Westfalen",
      "amtsgericht": "Amtsgericht Essen",
      "registernummer": "HRB 33842",
      "registerart": "HRB",
      "company_name": "Gajos Trockenbau GmbH",
      "company_seat": "Essen",
      "details": "07.11.2024 (Bekanntmachungsdatum)\n\nNordrhein-Westfalen Amtsgericht Essen HRB 33842\nLöschungsankündigung\n\nGajos Trockenbau GmbH\nGesellschaft mit beschränkter Haftung\nEssen\n\nDas Registergericht beabsichtigt die Gesellschaft von Amts wegen nach § 394 FamFG zu löschen. Die Frist zur Erhebung eines Widerspruchs ist auf einen Monat festgesetzt."
    },
    {
      "date": "2024-11-07",
      "id": "92901",
      "original_text": "Löschungsankündigung\nNordrhein-Westfalen Amtsgericht Dortmund HRB 19273\nSEXTRO ENGINEERING Verwaltungs GmbH – Werne",
      "type": "Löschungsankündigung",
      "state": "Nordrhein-Westfalen",
      "amtsgericht": "Amtsgericht Dortmund",
      "registernummer": "HRB 19273",
      "registerart": "HRB",
      "company_name": "SEXTRO ENGINEERING Verwaltungs GmbH",
      "company_seat": "Werne",
      "details": "07.11.2024 (Bekanntmachungsdatum)\n\nNordrhein-Westfalen Amtsgericht Dortmund HRB 19273\nLöschungsankündigung\n\nSEXTRO ENGINEERING Verwaltungs GmbH\nGesellschaft mit beschränkter Haftung\nWerne\n\nDas Registergericht beabsichtigt die Gesellschaft von Amts wegen nach § 394 FamFG zu löschen. Die Frist zur Erhebung eines Widerspruchs ist auf zwei Monate festgesetzt."
    },
    {
      "date": "2024-11-07",
      "id": "92902",
      "original_text": "Registerbekanntmachung nach dem Umwandlungsgesetz\nNordrhein-Westfalen Amtsgericht Siegen HRA 6333\nDornseiff GmbH u.Co.KG – Burbach",
      "type": "Registerbekanntmachung nach dem Umwandlungsgesetz",
      "state": "Nordrhein-Westfalen",
      "amtsgericht": "Amtsgericht Siegen",
      "registernummer": "HRA 6333",
      "registerart": "HRA",
      "company_name": "Dornseiff GmbH u.Co.KG",
      "company_seat": "Burbach",
      "details": "07.11.2024 (Bekanntmachungsdatum)\n\nNordrhein-Westfalen Amtsgericht Siegen HRA 6333\nRegisterbekanntmachung nach dem Umwandlungsgesetz 06.11.2024 (Eintragungsdatum)\n\nDornseiff GmbH u.Co.KG\nKommanditgesellschaft\nBurbach\n\nDen Gläubigern der an der Verschmelzung beteiligten Rechtsträger ist, wenn sie binnen sechs Monaten nach dem Tag, an dem die Eintragung der Verschmelzung in das Register des Sitzes desjenigen Rechtsträgers, dessen Gläubiger sie sind, nach § 19 Absatz 3 UmwG als bekanntgemacht gilt, ihren Anspruch nach Grund und Höhe schriftlich anmelden, Sicherheit zu leisten, soweit sie nicht Befriedigung verlangen können. Dieses Recht steht den Gläubigern jedoch nur zu, wenn sie glaubhaft machen, dass durch die Verschmelzung die Erfüllung ihrer Forderung gefährdet wird."
    },
    {
      "date": "2024-11-07",
      "id": "92903",
      "original_text": "Löschungsankündigung\nNordrhein-Westfalen Amtsgericht Siegen HRB 9782\nSK Logistik GmbH – Drolshagen",
      "type": "Löschungsankündigung",
      "state": "Nordrhein-Westfalen",
      "amtsgericht": "Amtsgericht Siegen",
      "registernummer": "HRB 9782",
      "registerart": "HRB",
      "company_name": "SK Logistik GmbH",
      "company_seat": "Drolshagen",
      "details": "07.11.2024 (Bekanntmachungsdatum)\n\nNordrhein-Westfalen Amtsgericht Siegen HRB 9782\nLöschungsankündigung\n\nSK Logistik GmbH\nGesellschaft mit beschränkter Haftung\nDrolshagen\n\nDas Registergericht beabsichtigt die Gesellschaft von Amts wegen nach § 394 FamFG zu löschen. Die Frist zur Erhebung eines Widerspruchs ist auf drei Monate festgesetzt."
    },
    {
      "date": "2024-11-07",
      "id": "92904",
      "original_text": "Registerbekanntmachung nach dem Umwandlungsgesetz\nNordrhein-Westfalen Amtsgericht Köln HRA 37704\nSven Klahr GmbH & Co KG – Köln",
      "type": "Registerbekanntmachung nach dem Umwandlungsgesetz",
      "state": "Nordrhein-Westfalen",
      "amtsgericht": "Amtsgericht Köln",
      "registernummer": "HRA 37704",
      "registerart": "HRA",
      "company_name": "Sven Klahr GmbH & Co KG",
      "company_seat": "Köln",
      "details": "07.11.2024 (Bekanntmachungsdatum)\n\nNordrhein-Westfalen Amtsgericht Köln HRA 37704\nRegisterbekanntmachung nach dem Umwandlungsgesetz 07.11.2024 (Eintragungsdatum)\n\nSven Klahr GmbH & Co KG\nKommanditgesellschaft\nKöln\n\nDen Gläubigern der an der Ausgliederung beteiligten Rechtsträger ist, wenn sie binnen sechs Monaten nach dem Tag, an dem die Eintragung der Ausgliederung in das Register des Sitzes desjenigen Rechtsträgers, dessen Gläubiger sie sind, nach § 19 Absatz 3 UmwG als bekanntgemacht gilt, ihren Anspruch nach Grund und Höhe schriftlich anmelden, Sicherheit zu leisten, soweit sie nicht Befriedigung verlangen können. Dieses Recht steht den Gläubigern jedoch nur zu, wenn sie glaubhaft machen, dass durch die Ausgliederung die Erfüllung ihrer Forderung gefährdet wird."
    },
    {
      "date": "2024-11-07",
      "id": "92905",
      "original_text": "Löschungsankündigung\nNordrhein-Westfalen Amtsgericht Hagen VR 2930\nNihon Kai Martial Arts Organization e.V. – Hagen",
      "type": "Löschungsankündigung",
      "state": "Nordrhein-Westfalen",
      "amtsgericht": "Amtsgericht Hagen",
      "registernummer": "VR 2930",
      "registerart": "VR",
      "company_name": "Nihon Kai Martial Arts Organization e.V.",
      "company_seat": "Hagen",
      "details": "07.11.2024 (Bekanntmachungsdatum)\n\nNordrhein-Westfalen Amtsgericht Hagen VR 2930\nLöschungsankündigung\n\nNihon Kai Martial Arts Organization e.V.\neingetragener Verein\nHagen\n\nNach Mitteilung sind alle Vereinsmitglieder ausgetreten und es ist kein Vermögen  mehr vorhanden.\nDas Gericht beabsichtigt daher, den Verein mangels Mitglieder  von Amts wegen im Vereinsregister zu löschen, da die Voraussetzungen für eine Amtslöschung vorliegen.\nEs wird hiermit Gelegenheit gegeben, binnen eines Monats ab Zustellung dieses Schreibens gegen die beabsichtigte Löschung Widerspruch beim Registergericht einzulegen.\nNach Ablauf der Frist erfolgt die für den Verein kostenfreie Löschung im Vereinsregister."
    },
    {
      "date": "2024-11-07",
      "id": "92906",
      "original_text": "Registerbekanntmachung nach dem Umwandlungsgesetz\nNordrhein-Westfalen Amtsgericht Siegen HRB 9748\nDücker & Setzer GmbH – Kreuztal",
      "type": "Registerbekanntmachung nach dem Umwandlungsgesetz",
      "state": "Nordrhein-Westfalen",
      "amtsgericht": "Amtsgericht Siegen",
      "registernummer": "HRB 9748",
      "registerart": "HRB",
      "company_name": "Dücker & Setzer GmbH",
      "company_seat": "Kreuztal",
      "details": "07.11.2024 (Bekanntmachungsdatum)\n\nNordrhein-Westfalen Amtsgericht Siegen HRB 9748\nRegisterbekanntmachung nach dem Umwandlungsgesetz 07.11.2024 (Eintragungsdatum)\n\nDücker & Setzer GmbH\nGesellschaft mit beschränkter Haftung\nKreuztal\n\nDen Gläubigern der an der Verschmelzung beteiligten Rechtsträger ist, wenn sie binnen sechs Monaten nach dem Tag, an dem die Eintragung der Verschmelzung in das Register des Sitzes desjenigen Rechtsträgers, dessen Gläubiger sie sind, nach § 19 Absatz 3 UmwG als bekanntgemacht gilt, ihren Anspruch nach Grund und Höhe schriftlich anmelden, Sicherheit zu leisten, soweit sie nicht Befriedigung verlangen können. Dieses Recht steht den Gläubigern jedoch nur zu, wenn sie glaubhaft machen, dass durch die Verschmelzung die Erfüllung ihrer Forderung gefährdet wird."
    },
    {
      "date": "2024-11-07",
      "id": "92907",
      "original_text": "Registerbekanntmachung nach dem Umwandlungsgesetz\nNordrhein-Westfalen Amtsgericht Essen HRB 14662\nBaginski Vermögensverwaltungsgesellschaft mbH – Essen",
      "type": "Registerbekanntmachung nach dem Umwandlungsgesetz",
      "state": "Nordrhein-Westfalen",
      "amtsgericht": "Amtsgericht Essen",
      "registernummer": "HRB 14662",
      "registerart": "HRB",
      "company_name": "Baginski Vermögensverwaltungsgesellschaft mbH",
      "company_seat": "Essen",
      "details": "07.11.2024 (Bekanntmachungsdatum)\n\nNordrhein-Westfalen Amtsgericht Essen HRB 14662\nRegisterbekanntmachung nach dem Umwandlungsgesetz 07.11.2024 (Eintragungsdatum)\n\nBaginski Vermögensverwaltungsgesellschaft mbH\nGesellschaft mit beschränkter Haftung\nEssen\n\nDen Gläubigern der an der Verschmelzung beteiligten Rechtsträger ist, wenn sie binnen sechs Monaten nach dem Tag, an dem die Eintragung der Verschmelzung in das Register des Sitzes desjenigen Rechtsträgers, dessen Gläubiger sie sind, nach § 19 Absatz 3 UmwG als bekanntgemacht gilt, ihren Anspruch nach Grund und Höhe schriftlich anmelden, Sicherheit zu leisten, soweit sie nicht Befriedigung verlangen können. Dieses Recht steht den Gläubigern jedoch nur zu, wenn sie glaubhaft machen, dass durch die Verschmelzung die Erfüllung ihrer Forderung gefährdet wird."
    },
    {
      "date": "2024-11-07",
      "id": "92908",
      "original_text": "Einreichung neuer Dokumente\nNordrhein-Westfalen Amtsgericht Bonn HRB 14654\nPostbank Filialvertrieb AG – Bonn",
      "type": "Einreichung neuer Dokumente",
      "state": "Nordrhein-Westfalen",
      "amtsgericht": "Amtsgericht Bonn",
      "registernummer": "HRB 14654",
      "registerart": "HRB",
      "company_name": "Postbank Filialvertrieb AG",
      "company_seat": "Bonn",
      "details": "07.11.2024 (Bekanntmachungsdatum)\n\nNordrhein-Westfalen Amtsgericht Bonn HRB 14654\nEinreichung neuer Dokumente\n\nPostbank Filialvertrieb AG\nAktiengesellschaft\nBonn\n\nDem Registergericht ist eine neue Liste der Mitglieder des Aufsichtsrates eingereicht worden."
    },
    {
      "date": "2024-11-07",
      "id": "92909",
      "original_text": "Löschungsankündigung\nNordrhein-Westfalen Amtsgericht Duisburg HRB 29914\nKami Sushi UG (haftungsbeschränkt) – Mülheim an der Ruhr",
      "type": "Löschungsankündigung",
      "state": "Nordrhein-Westfalen",
      "amtsgericht": "Amtsgericht Duisburg",
      "registernummer": "HRB 29914",
      "registerart": "HRB",
      "company_name": "Kami Sushi UG (haftungsbeschränkt)",
      "company_seat": "Mülheim an der Ruhr",
      "details": "07.11.2024 (Bekanntmachungsdatum)\n\nNordrhein-Westfalen Amtsgericht Duisburg HRB 29914\nLöschungsankündigung\n\nKami Sushi UG (haftungsbeschränkt)\nGesellschaft mit beschränkter Haftung\nMülheim an der Ruhr\n\nDas Registergericht beabsichtigt, die im Handelsregister eingetragene Gesellschaft Kami Sushi UG (haftungsbeschränkt) gemäß § 394 Absatz 1 FamFG wegen Vermögenslosigkeit von Amts wegen zu löschen. Gegen diese Verfügung kann Widerspruch eingelegt werden. Die Frist zur Erhebung eines Widerspruchs gegen die beabsichtigte Löschung von Amts wegen ist auf drei Monate festgesetzt. Rechtsbehelfsbelehrung Der Widerspruch ist bei dem Amtsgericht Duisburg, Kardinal-Galen-Str. 124-132, 47058 Duisburg schriftlich in deutscher Sprache oder zur Niederschrift der Geschäftsstelle einzulegen. Der Widerspruch kann auch zur Niederschrift der Geschäftsstelle eines jeden Amtsgerichtes abgegeben werden. Die Einlegung ist auch durch Übertragung eines elektronischen Dokuments an die elektronische Poststelle des Gerichts möglich. Das elektronische Dokument muss für die Bearbeitung durch das Gericht geeignet und mit einer qualifizierten elektronischen Signatur der verantwortenden Person versehen sein oder von der verantwortenden Person signiert und auf einem sicheren Übermittlungsweg gemäß § 130 a ZPO nach näherer Maßgabe der Verordnung über die technischen Rahmenbedingungen des elektronischen Rechtsverkehrs und über das besondere elektronische Behördenpostfach (BGBl. I, S. 3803) eingereicht werden. Weitere Informationen erhalten Sie auf der Internetseite www.justiz.de <http://www.justiz.de>. Der Widerspruch muss spätestens innerhalb der gesetzten Frist bei dem Amtsgericht Duisburg eingegangen sein. Dies gilt auch dann, wenn der Widerspruch zur Niederschrift der Geschäftsstelle eines anderen Amtsgerichtes abgegeben wurde. Die Frist beginnt mit der Veröffentlichung. Fällt das Ende der Frist auf einen Sonntag, einen allgemeinen Feiertag oder Sonnabend, so endet die Frist mit Ablauf des nächsten Werktages. Der Widerspruch muss die Bezeichnung der angefochtenen Verfügung sowie die Erklärung enthalten, dass Widerspruch gegen diese Verfügung eingelegt wird. Er ist zu unterzeichnen und soll begründet werden."
    },
    {
      "date": "2024-11-07",
      "id": "92910",
      "original_text": "Einreichung neuer Dokumente\nNordrhein-Westfalen Amtsgericht Gelsenkirchen HRB 9635\nAtos IT-Dienstleistung und Beratung GmbH – Gelsenkirchen",
      "type": "Einreichung neuer Dokumente",
      "state": "Nordrhein-Westfalen",
      "amtsgericht": "Amtsgericht Gelsenkirchen",
      "registernummer": "HRB 9635",
      "registerart": "HRB",
      "company_name": "Atos IT-Dienstleistung und Beratung GmbH",
      "company_seat": "Gelsenkirchen",
      "details": "07.11.2024 (Bekanntmachungsdatum)\n\nNordrhein-Westfalen Amtsgericht Gelsenkirchen HRB 9635\nEinreichung neuer Dokumente\n\nAtos IT-Dienstleistung und Beratung GmbH\nGesellschaft mit beschränkter Haftung\nGelsenkirchen\n\nDem Registergericht ist eine Liste der Mitglieder des Aufsichtsrates eingereicht worden."
    },
    {
      "date": "2024-11-07",
      "id": "92911",
      "original_text": "Registerbekanntmachung nach dem Umwandlungsgesetz\nHessen Amtsgericht Frankfurt am Main HRB 134085\nHVF Hausverwaltung Frankfurt GmbH – Frankfurt am Main",
      "type": "Registerbekanntmachung nach dem Umwandlungsgesetz",
      "state": "Hessen",
      "amtsgericht": "Amtsgericht Frankfurt am Main",
      "registernummer": "HRB 134085",
      "registerart": "HRB",
      "company_name": "HVF Hausverwaltung Frankfurt GmbH",
      "company_seat": "Frankfurt am Main",
      "details": "07.11.2024 (Bekanntmachungsdatum)\n\nHessen Amtsgericht Frankfurt am Main HRB 134085\nRegisterbekanntmachung nach dem Umwandlungsgesetz 07.11.2024 (Eintragungsdatum)\n\nHVF Hausverwaltung Frankfurt GmbH\nGesellschaft mit beschränkter Haftung\nFrankfurt am Main\n\nDen Gläubigern der an der Ausgliederung beteiligten Rechtsträger ist, wenn sie binnen sechs Monaten nach dem Tag, an dem die Eintragung der Ausgliederung in das Register des Sitzes desjenigen Rechtsträgers, dessen Gläubiger sie sind, nach § 19 Absatz 3 UmwG bekannt gemacht worden ist, ihren Anspruch nach Grund und Höhe schriftlich anmelden, Sicherheit zu leisten, soweit sie nicht Befriedigung verlangen können. Dieses Recht steht den Gläubigern jedoch nur zu, wenn sie glaubhaft machen, dass durch die Ausgliederung die Erfüllung ihrer Forderung gefährdet wird."
    },
    {
      "date": "2024-11-07",
      "id": "92912",
      "original_text": "Registerbekanntmachung nach dem Umwandlungsgesetz\nHessen Amtsgericht Frankfurt am Main HRA 53593\nHVF Hausverwaltung Nikolic e. K. – Frankfurt am Main",
      "type": "Registerbekanntmachung nach dem Umwandlungsgesetz",
      "state": "Hessen",
      "amtsgericht": "Amtsgericht Frankfurt am Main",
      "registernummer": "HRA 53593",
      "registerart": "HRA",
      "company_name": "HVF Hausverwaltung Nikolic e. K.",
      "company_seat": "Frankfurt am Main",
      "details": "07.11.2024 (Bekanntmachungsdatum)\n\nHessen Amtsgericht Frankfurt am Main HRA 53593\nRegisterbekanntmachung nach dem Umwandlungsgesetz 07.11.2024 (Eintragungsdatum)\n\nHVF Hausverwaltung Nikolic e. K.\nEinzelkaufmann / Einzelkauffrau\nFrankfurt am Main\n\nDen Gläubigern der an der Ausgliederung beteiligten Rechtsträger ist, wenn sie binnen sechs Monaten nach dem Tag, an dem die Eintragung der Ausgliederung in das Register des Sitzes desjenigen Rechtsträgers, dessen Gläubiger sie sind, nach § 19 Absatz 3 UmwG bekannt gemacht worden ist, ihren Anspruch nach Grund und Höhe schriftlich anmelden, Sicherheit zu leisten, soweit sie nicht Befriedigung verlangen können. Dieses Recht steht den Gläubigern jedoch nur zu, wenn sie glaubhaft machen, dass durch die Ausgliederung die Erfüllung ihrer Forderung gefährdet wird."
    },
    {
      "date": "2024-11-07",
      "id": "92913",
      "original_text": "Sonstige Registerbekanntmachung\nHessen Amtsgericht Frankfurt am Main HRB 32232\nDeutsche Börse Aktiengesellschaft – Frankfurt am Main",
      "type": "Sonstige Registerbekanntmachung",
      "state": "Hessen",
      "amtsgericht": "Amtsgericht Frankfurt am Main",
      "registernummer": "HRB 32232",
      "registerart": "HRB",
      "company_name": "Deutsche Börse Aktiengesellschaft",
      "company_seat": "Frankfurt am Main",
      "details": "07.11.2024 (Bekanntmachungsdatum)\n\nHessen Amtsgericht Frankfurt am Main HRB 32232\nSonstige Registerbekanntmachung 07.11.2024 (Eintragungsdatum)\n\nDeutsche Börse Aktiengesellschaft\nAktiengesellschaft\nFrankfurt am Main\n\nDas Grundkapital der Gesellschaft ist durch Einziehung eigener Aktien, welche die Gesellschaft auf Grund des Ermächtigungsbeschlusses vom 14.05.2024 erworben hat, um 1.700.000,00 EUR auf 188.300.000,00 EUR herabgesetzt. Die Kapitalherabsetzung ist durchgeführt.\nDurch Beschluss des Aufsichtsrates vom 19.09.2024 ist die Satzung in § 4 (Einteilung und Höhe des Grundkapitals) geändert. Neues Grundkapital: 188.300.000,00 EUR."
    },
    {
      "date": "2024-11-07",
      "id": "92914",
      "original_text": "Einreichung neuer Dokumente\nHessen Amtsgericht Marburg HRB 2189\nHBH Telemedia AG – Wetter",
      "type": "Einreichung neuer Dokumente",
      "state": "Hessen",
      "amtsgericht": "Amtsgericht Marburg",
      "registernummer": "HRB 2189",
      "registerart": "HRB",
      "company_name": "HBH Telemedia AG",
      "company_seat": "Wetter",
      "details": "07.11.2024 (Bekanntmachungsdatum)\n\nHessen Amtsgericht Marburg HRB 2189\nEinreichung neuer Dokumente\n\nHBH Telemedia AG\nAktiengesellschaft\nWetter\n\nDurch eine Änderung in den Personen der Aufsichtsratsmitglieder ist eine Liste der Mitglieder des Aufsichtsrates zum Handelsregister eingereicht worden."
    },
    {
      "date": "2024-11-07",
      "id": "92915",
      "original_text": "Löschungsankündigung\nHessen Amtsgericht Darmstadt HRB 100708\nVR Grand Village GmbH – Fischbachtal",
      "type": "Löschungsankündigung",
      "state": "Hessen",
      "amtsgericht": "Amtsgericht Darmstadt",
      "registernummer": "HRB 100708",
      "registerart": "HRB",
      "company_name": "VR Grand Village GmbH",
      "company_seat": "Fischbachtal",
      "details": "07.11.2024 (Bekanntmachungsdatum)\n\nHessen Amtsgericht Darmstadt HRB 100708\nLöschungsankündigung\n\nVR Grand Village GmbH\nGesellschaft mit beschränkter Haftung\nFischbachtal\n\nDas Registergericht beabsichtigt die im Handelsregister eingetragene Gesellschaft von Amts wegen nach § 394 FamFG zu löschen. Die Frist zur Erhebung eines Widerspruchs gegen die beabsichtigte Löschung wird auf 3 Monate festgesetzt."
    },
    {
      "date": "2024-11-07",
      "id": "92916",
      "original_text": "Einreichung neuer Dokumente\nHessen Amtsgericht Frankfurt am Main HRB 121570\nFiera Capital (Germany) GmbH – Frankfurt am Main",
      "type": "Einreichung neuer Dokumente",
      "state": "Hessen",
      "amtsgericht": "Amtsgericht Frankfurt am Main",
      "registernummer": "HRB 121570",
      "registerart": "HRB",
      "company_name": "Fiera Capital (Germany) GmbH",
      "company_seat": "Frankfurt am Main",
      "details": "07.11.2024 (Bekanntmachungsdatum)\n\nHessen Amtsgericht Frankfurt am Main HRB 121570\nEinreichung neuer Dokumente\n\nFiera Capital (Germany) GmbH\nGesellschaft mit beschränkter Haftung\nFrankfurt am Main\n\nDurch eine Änderung in den Personen der Beiratsmitglieder ist eine Liste der Mitglieder des Beirates zum Handelsregister eingereicht worden."
    },
    {
      "date": "2024-11-07",
      "id": "92917",
      "original_text": "Löschungsankündigung\nHessen Amtsgericht Friedberg HRB 8110\nSanner GmbH – Hirzenhain",
      "type": "Löschungsankündigung",
      "state": "Hessen",
      "amtsgericht": "Amtsgericht Friedberg",
      "registernummer": "HRB 8110",
      "registerart": "HRB",
      "company_name": "Sanner GmbH",
      "company_seat": "Hirzenhain",
      "details": "07.11.2024 (Bekanntmachungsdatum)\n\nHessen Amtsgericht Friedberg HRB 8110\nLöschungsankündigung\n\nSanner GmbH\nGesellschaft mit beschränkter Haftung\nHirzenhain\n\nDas Registergericht beabsichtigt die im Handelsregister eingetragene Gesellschaft von Amts wegen nach § 394 FamFG zu löschen. Die Frist zur Erhebung eines Widerspruchs gegen die beabsichtigte Löschung wird auf 3 Monate festgesetzt."
    },
    {
      "date": "2024-11-07",
      "id": "92918",
      "original_text": "Löschungsankündigung\nHessen Amtsgericht Frankfurt am Main HRB 106679\nMFA Sicherheit GmbH – Eschborn",
      "type": "Löschungsankündigung",
      "state": "Hessen",
      "amtsgericht": "Amtsgericht Frankfurt am Main",
      "registernummer": "HRB 106679",
      "registerart": "HRB",
      "company_name": "MFA Sicherheit GmbH",
      "company_seat": "Eschborn",
      "details": "07.11.2024 (Bekanntmachungsdatum)\n\nHessen Amtsgericht Frankfurt am Main HRB 106679\nLöschungsankündigung\n\nMFA Sicherheit GmbH\nGesellschaft mit beschränkter Haftung\nEschborn\n\nDas Registergericht beabsichtigt die im Handelsregister eingetragene Gesellschaft von Amts wegen nach § 394 FamFG zu löschen. Die Frist zur Erhebung eines Widerspruchs gegen die beabsichtigte Löschung wird auf 1 Monat festgesetzt."
    },
    {
      "date": "2024-11-07",
      "id": "92919",
      "original_text": "Sonstige Registerbekanntmachung\nHessen Amtsgericht Frankfurt am Main HRB 112087\ncreditshelf Aktiengesellschaft – Frankfurt am Main",
      "type": "Sonstige Registerbekanntmachung",
      "state": "Hessen",
      "amtsgericht": "Amtsgericht Frankfurt am Main",
      "registernummer": "HRB 112087",
      "registerart": "HRB",
      "company_name": "creditshelf Aktiengesellschaft",
      "company_seat": "Frankfurt am Main",
      "details": "07.11.2024 (Bekanntmachungsdatum)\n\nHessen Amtsgericht Frankfurt am Main HRB 112087\nSonstige Registerbekanntmachung 07.11.2024 (Eintragungsdatum)\n\ncreditshelf Aktiengesellschaft\nAktiengesellschaft\nFrankfurt am Main\n\nDurch eine Änderung in den Personen der Aufsichtsratsmitglieder ist eine Liste der Mitglieder des Aufsichtsrates zum Handelsregister eingereicht worden."
    }
  ]
}