{
  "date": "2024-11-06",
  "date_of_scrape": "2024-12-07T10:33:24.767Z",
  "tool_version": "0.2.0",
  "number_of_announcements": 147,
  "announcements": [
    {
      "date": "2024-11-06",
      "id": "92641",
      "original_text": "Registerbekanntmachung nach dem Umwandlungsgesetz\nBayern Amtsgericht Bamberg HRB 11817\nTaxi Junghans Forchheim GmbH – Forchheim",
      "type": "Registerbekanntmachung nach dem Umwandlungsgesetz",
      "state": "Bayern",
      "amtsgericht": "Amtsgericht Bamberg",
      "registernummer": "HRB 11817",
      "registerart": "HRB",
      "company_name": "Taxi Junghans Forchheim GmbH",
      "company_seat": "Forchheim",
      "details": "06.11.2024 (Bekanntmachungsdatum)\n\nBayern Amtsgericht Bamberg HRB 11817\nRegisterbekanntmachung nach dem Umwandlungsgesetz 05.11.2024 (Eintragungsdatum)\n\nTaxi Junghans Forchheim GmbH\nGesellschaft mit beschränkter Haftung\nForchheim\n\nDen Gläubigern der an der Ausgliederung beteiligten Rechtsträger ist, wenn sie binnen sechs Monaten nach dem Tag, an dem die Eintragung der Ausgliederung in das Register des Sitzes desjenigen Rechtsträgers, dessen Gläubiger sie sind, nach §§ 125, 19 Abs. 3 UmwG als bekannt gemacht gilt, ihren Anspruch nach Grund und Höhe schriftlich anmelden, Sicherheit zu leisten, soweit sie nicht Befriedigung verlangen können. Dieses Recht steht den Gläubigern jedoch nur zu, wenn sie glaubhaft machen, dass durch die Ausgliederung die Erfüllung ihrer Forderung gefährdet wird."
    },
    {
      "date": "2024-11-06",
      "id": "92642",
      "original_text": "Registerbekanntmachung nach dem Umwandlungsgesetz\nBayern Amtsgericht Traunstein HRB 4836\nCarl Zeiss Optotechnik GmbH – Neubeuern",
      "type": "Registerbekanntmachung nach dem Umwandlungsgesetz",
      "state": "Bayern",
      "amtsgericht": "Amtsgericht Traunstein",
      "registernummer": "HRB 4836",
      "registerart": "HRB",
      "company_name": "Carl Zeiss Optotechnik GmbH",
      "company_seat": "Neubeuern",
      "details": "06.11.2024 (Bekanntmachungsdatum)\n\nBayern Amtsgericht Traunstein HRB 4836\nRegisterbekanntmachung nach dem Umwandlungsgesetz 05.11.2024 (Eintragungsdatum)\n\nCarl Zeiss Optotechnik GmbH\nGesellschaft mit beschränkter Haftung\nNeubeuern\n\nDen Gläubigern der an der Verschmelzung beteiligten Rechtsträger ist, wenn sie binnen sechs Monaten nach dem Tag, an dem die Eintragung der Verschmelzung in das Register des Sitzes desjenigen Rechtsträgers, dessen Gläubiger sie sind, nach § 19 Abs. 3 UmwG als bekannt gemacht gilt, ihren Anspruch nach Grund und Höhe schriftlich anmelden, Sicherheit zu leisten, soweit sie nicht Befriedigung verlangen können. Dieses Recht steht den Gläubigern jedoch nur zu, wenn sie glaubhaft machen, dass durch die Verschmelzung die Erfüllung ihrer Forderung gefährdet wird."
    },
    {
      "date": "2024-11-06",
      "id": "92643",
      "original_text": "Registerbekanntmachung nach dem Umwandlungsgesetz\nBayern Amtsgericht Fürth HRB 18300\nSRH WLH GmbH – Fürth",
      "type": "Registerbekanntmachung nach dem Umwandlungsgesetz",
      "state": "Bayern",
      "amtsgericht": "Amtsgericht Fürth",
      "registernummer": "HRB 18300",
      "registerart": "HRB",
      "company_name": "SRH WLH GmbH",
      "company_seat": "Fürth",
      "details": "06.11.2024 (Bekanntmachungsdatum)\n\nBayern Amtsgericht Fürth HRB 18300\nRegisterbekanntmachung nach dem Umwandlungsgesetz 05.11.2024 (Eintragungsdatum)\n\nSRH WLH GmbH\nGesellschaft mit beschränkter Haftung\nFürth\n\nDen Gläubigern der an der Verschmelzung beteiligten Rechtsträger ist, wenn sie binnen sechs Monaten nach dem Tag, an dem die Eintragung der Verschmelzung in das Register des Sitzes desjenigen Rechtsträgers, dessen Gläubiger sie sind, nach § 19 Abs. 3 UmwG als bekannt gemacht gilt, ihren Anspruch nach Grund und Höhe schriftlich anmelden, Sicherheit zu leisten, soweit sie nicht Befriedigung verlangen können. Dieses Recht steht den Gläubigern jedoch nur zu, wenn sie glaubhaft machen, dass durch die Verschmelzung die Erfüllung ihrer Forderung gefährdet wird."
    },
    {
      "date": "2024-11-06",
      "id": "92644",
      "original_text": "Einreichung neuer Dokumente\nBayern Amtsgericht Nürnberg HRB 36438\nMartha-Maria MVZ Süd gemeinnützige GmbH – Nürnberg",
      "type": "Einreichung neuer Dokumente",
      "state": "Bayern",
      "amtsgericht": "Amtsgericht Nürnberg",
      "registernummer": "HRB 36438",
      "registerart": "HRB",
      "company_name": "Martha-Maria MVZ Süd gemeinnützige GmbH",
      "company_seat": "Nürnberg",
      "details": "06.11.2024 (Bekanntmachungsdatum)\n\nBayern Amtsgericht Nürnberg HRB 36438\nEinreichung neuer Dokumente\n\nMartha-Maria MVZ Süd gemeinnützige GmbH\nGesellschaft mit beschränkter Haftung\nNürnberg\n\nDem Amtsgericht Nürnberg -Registergericht- ist eine Liste der Mitglieder des Aufsichtsrats eingereicht worden, § 52 Abs. 3 S. 2 GmbHG."
    },
    {
      "date": "2024-11-06",
      "id": "92645",
      "original_text": "Registerbekanntmachung nach dem Umwandlungsgesetz\nBayern Amtsgericht Augsburg HRB 16544\nWagner Fassaden GmbH – Affing",
      "type": "Registerbekanntmachung nach dem Umwandlungsgesetz",
      "state": "Bayern",
      "amtsgericht": "Amtsgericht Augsburg",
      "registernummer": "HRB 16544",
      "registerart": "HRB",
      "company_name": "Wagner Fassaden GmbH",
      "company_seat": "Affing",
      "details": "06.11.2024 (Bekanntmachungsdatum)\n\nBayern Amtsgericht Augsburg HRB 16544\nRegisterbekanntmachung nach dem Umwandlungsgesetz 05.11.2024 (Eintragungsdatum)\n\nWagner Fassaden GmbH\nGesellschaft mit beschränkter Haftung\nAffing\n\nDen Gläubigern der an der Ausgliederung beteiligten Rechtsträger ist, wenn sie binnen sechs Monaten nach dem Tag, an dem die Eintragung der Ausgliederung in das Register des Sitzes desjenigen Rechtsträgers, dessen Gläubiger sie sind, nach §§ 125, 19 Abs. 3 UmwG als bekannt gemacht gilt, ihren Anspruch nach Grund und Höhe schriftlich anmelden, Sicherheit zu leisten, soweit sie nicht Befriedigung verlangen können. Dieses Recht steht den Gläubigern jedoch nur zu, wenn sie glaubhaft machen, dass durch die Ausgliederung die Erfüllung ihrer Forderung gefährdet wird.Den Gläubigern der an der Ausgliederung beteiligten Rechtsträger ist, wenn sie binnen sechs Monaten nach dem Tag, an dem die Eintragung der Ausgliederung in das Register des Sitzes desjenigen Rechtsträgers, dessen Gläubiger sie sind, nach §§ 125, 19 Abs. 3 UmwG als bekannt gemacht gilt, ihren Anspruch nach Grund und Höhe schriftlich anmelden, Sicherheit zu leisten, soweit sie nicht Befriedigung verlangen können. Dieses Recht steht den Gläubigern jedoch nur zu, wenn sie glaubhaft machen, dass durch die Ausgliederung die Erfüllung ihrer Forderung gefährdet wird."
    },
    {
      "date": "2024-11-06",
      "id": "92646",
      "original_text": "Registerbekanntmachung nach dem Umwandlungsgesetz\nBayern Amtsgericht München HRA 106001\nStefan Alex e. K. – Höhenkirchen-Siegertsbrunn",
      "type": "Registerbekanntmachung nach dem Umwandlungsgesetz",
      "state": "Bayern",
      "amtsgericht": "Amtsgericht München",
      "registernummer": "HRA 106001",
      "registerart": "HRA",
      "company_name": "Stefan Alex e. K.",
      "company_seat": "Höhenkirchen-Siegertsbrunn",
      "details": "06.11.2024 (Bekanntmachungsdatum)\n\nBayern Amtsgericht München HRA 106001\nRegisterbekanntmachung nach dem Umwandlungsgesetz 05.11.2024 (Eintragungsdatum)\n\nStefan Alex e. K.\nEinzelkaufmann / Einzelkauffrau\nHöhenkirchen-Siegertsbrunn\n\nDen Gläubigern der an der Ausgliederung beteiligten Rechtsträger ist, wenn sie binnen sechs Monaten nach dem Tag, an dem die Eintragung der Ausgliederung in das Register des Sitzes desjenigen Rechtsträgers, dessen Gläubiger sie sind, nach §§ 125, 19 Abs. 3 UmwG als bekannt gemacht gilt, ihren Anspruch nach Grund und Höhe schriftlich anmelden, Sicherheit zu leisten, soweit sie nicht Befriedigung verlangen können. Dieses Recht steht den Gläubigern jedoch nur zu, wenn sie glaubhaft machen, dass durch die Ausgliederung die Erfüllung ihrer Forderung gefährdet wird."
    },
    {
      "date": "2024-11-06",
      "id": "92647",
      "original_text": "Löschungsankündigung\nBayern Amtsgericht Ingolstadt HRB 8163\nKOCON ContainerSelfStorage UG (haftungsbeschränkt) – Wolnzach",
      "type": "Löschungsankündigung",
      "state": "Bayern",
      "amtsgericht": "Amtsgericht Ingolstadt",
      "registernummer": "HRB 8163",
      "registerart": "HRB",
      "company_name": "KOCON ContainerSelfStorage UG (haftungsbeschränkt)",
      "company_seat": "Wolnzach",
      "details": "06.11.2024 (Bekanntmachungsdatum)\n\nBayern Amtsgericht Ingolstadt HRB 8163\nLöschungsankündigung\n\nKOCON ContainerSelfStorage UG (haftungsbeschränkt)\nGesellschaft mit beschränkter Haftung\nWolnzach\n\nDas Registergericht beabsichtigt, die im Handelsregister eingetragene Gesellschaft wegen Vermögenslosigkeit von Amts wegen nach § 394 FamFG zu löschen. #insert(Text=\"zztb_V_Widerspruchsfrist\")"
    },
    {
      "date": "2024-11-06",
      "id": "92648",
      "original_text": "Registerbekanntmachung nach dem Umwandlungsgesetz\nBayern Amtsgericht Nürnberg HRB 36629\nFlemingOperationsHolding GmbH – Nürnberg",
      "type": "Registerbekanntmachung nach dem Umwandlungsgesetz",
      "state": "Bayern",
      "amtsgericht": "Amtsgericht Nürnberg",
      "registernummer": "HRB 36629",
      "registerart": "HRB",
      "company_name": "FlemingOperationsHolding GmbH",
      "company_seat": "Nürnberg",
      "details": "06.11.2024 (Bekanntmachungsdatum)\n\nBayern Amtsgericht Nürnberg HRB 36629\nRegisterbekanntmachung nach dem Umwandlungsgesetz 05.11.2024 (Eintragungsdatum)\n\nFlemingOperationsHolding GmbH\nGesellschaft mit beschränkter Haftung\nNürnberg\n\nDen Gläubigern der an der Verschmelzung beteiligten Rechtsträger ist, wenn sie binnen sechs Monaten nach dem Tag, an dem die Eintragung der Verschmelzung in das Register des Sitzes desjenigen Rechtsträgers, dessen Gläubiger sie sind, nach § 19 Abs. 3 UmwG als bekannt gemacht gilt, ihren Anspruch nach Grund und Höhe schriftlich anmelden, Sicherheit zu leisten, soweit sie nicht Befriedigung verlangen können. Dieses Recht steht den Gläubigern jedoch nur zu, wenn sie glaubhaft machen, dass durch die Verschmelzung die Erfüllung ihrer Forderung gefährdet wird."
    },
    {
      "date": "2024-11-06",
      "id": "92649",
      "original_text": "Registerbekanntmachung nach dem Umwandlungsgesetz\nBayern Amtsgericht Hof HRB 50\nHOFTEX GROUP AG – Hof",
      "type": "Registerbekanntmachung nach dem Umwandlungsgesetz",
      "state": "Bayern",
      "amtsgericht": "Amtsgericht Hof",
      "registernummer": "HRB 50",
      "registerart": "HRB",
      "company_name": "HOFTEX GROUP AG",
      "company_seat": "Hof",
      "details": "06.11.2024 (Bekanntmachungsdatum)\n\nBayern Amtsgericht Hof HRB 50\nRegisterbekanntmachung nach dem Umwandlungsgesetz 05.11.2024 (Eintragungsdatum)\n\nHOFTEX GROUP AG\nAktiengesellschaft\nHof\n\nDen Gläubigern der an der Verschmelzung beteiligten Rechtsträger ist, wenn sie binnen sechs Monaten nach dem Tag, an dem die Eintragung der Verschmelzung in das Register des Sitzes desjenigen Rechtsträgers, dessen Gläubiger sie sind, nach § 19 Abs. 3 UmwG als bekannt gemacht gilt, ihren Anspruch nach Grund und Höhe schriftlich anmelden, Sicherheit zu leisten, soweit sie nicht Befriedigung verlangen können. Dieses Recht steht den Gläubigern jedoch nur zu, wenn sie glaubhaft machen, dass durch die Verschmelzung die Erfüllung ihrer Forderung gefährdet wird."
    },
    {
      "date": "2024-11-06",
      "id": "92650",
      "original_text": "Einreichung neuer Dokumente\nBayern Amtsgericht München HRB 236945\nNCG - NUCOM GROUP SE – Unterföhring",
      "type": "Einreichung neuer Dokumente",
      "state": "Bayern",
      "amtsgericht": "Amtsgericht München",
      "registernummer": "HRB 236945",
      "registerart": "HRB",
      "company_name": "NCG - NUCOM GROUP SE",
      "company_seat": "Unterföhring",
      "details": "06.11.2024 (Bekanntmachungsdatum)\n\nBayern Amtsgericht München HRB 236945\nEinreichung neuer Dokumente\n\nNCG - NUCOM GROUP SE\nEuropäische Aktiengesellschaft (SE)\nUnterföhring\n\nDem Amtsgericht München -Registergericht- ist eine Liste der Mitglieder des Aufsichtsrats eingereicht worden, Art. 9 Abs. 1 Buchst. c (ii) SE-VO i.V.m. § 106 AktG."
    },
    {
      "date": "2024-11-06",
      "id": "92651",
      "original_text": "Einreichung neuer Dokumente\nBayern Amtsgericht München HRB 236945\nNCG - NUCOM GROUP SE – Unterföhring",
      "type": "Einreichung neuer Dokumente",
      "state": "Bayern",
      "amtsgericht": "Amtsgericht München",
      "registernummer": "HRB 236945",
      "registerart": "HRB",
      "company_name": "NCG - NUCOM GROUP SE",
      "company_seat": "Unterföhring",
      "details": "06.11.2024 (Bekanntmachungsdatum)\n\nBayern Amtsgericht München HRB 236945\nEinreichung neuer Dokumente 05.11.2024 (Eintragungsdatum)\n\nNCG - NUCOM GROUP SE\nEuropäische Aktiengesellschaft (SE)\nUnterföhring\n\nDem Amtsgericht München -Registergericht- ist eine Liste der Mitglieder des Aufsichtsrats eingereicht worden, Art. 9 Abs. 1 Buchst. c (ii) SE-VO i.V.m. § 106 AktG."
    },
    {
      "date": "2024-11-06",
      "id": "92652",
      "original_text": "Registerbekanntmachung nach dem Umwandlungsgesetz\nBayern Amtsgericht Memmingen HRB 18423\ntwentyone GmbH – Neu-Ulm",
      "type": "Registerbekanntmachung nach dem Umwandlungsgesetz",
      "state": "Bayern",
      "amtsgericht": "Amtsgericht Memmingen",
      "registernummer": "HRB 18423",
      "registerart": "HRB",
      "company_name": "twentyone GmbH",
      "company_seat": "Neu-Ulm",
      "details": "06.11.2024 (Bekanntmachungsdatum)\n\nBayern Amtsgericht Memmingen HRB 18423\nRegisterbekanntmachung nach dem Umwandlungsgesetz 05.11.2024 (Eintragungsdatum)\n\ntwentyone GmbH\nGesellschaft mit beschränkter Haftung\nNeu-Ulm\n\nDen Gläubigern der an der Verschmelzung beteiligten Rechtsträger ist, wenn sie binnen sechs Monaten nach dem Tag, an dem die Eintragung der Verschmelzung in das Register des Sitzes desjenigen Rechtsträgers, dessen Gläubiger sie sind, nach § 19 Abs. 3 UmwG als bekannt gemacht gilt, ihren Anspruch nach Grund und Höhe schriftlich anmelden, Sicherheit zu leisten, soweit sie nicht Befriedigung verlangen können. Dieses Recht steht den Gläubigern jedoch nur zu, wenn sie glaubhaft machen, dass durch die Verschmelzung die Erfüllung ihrer Forderung gefährdet wird."
    },
    {
      "date": "2024-11-06",
      "id": "92653",
      "original_text": "Registerbekanntmachung nach dem Umwandlungsgesetz\nBayern Amtsgericht München HRB 297334\nMVZ-Fachärzte Fürstenrieder Straße GmbH – München",
      "type": "Registerbekanntmachung nach dem Umwandlungsgesetz",
      "state": "Bayern",
      "amtsgericht": "Amtsgericht München",
      "registernummer": "HRB 297334",
      "registerart": "HRB",
      "company_name": "MVZ-Fachärzte Fürstenrieder Straße GmbH",
      "company_seat": "München",
      "details": "06.11.2024 (Bekanntmachungsdatum)\n\nBayern Amtsgericht München HRB 297334\nRegisterbekanntmachung nach dem Umwandlungsgesetz 05.11.2024 (Eintragungsdatum)\n\nMVZ-Fachärzte Fürstenrieder Straße GmbH\nGesellschaft mit beschränkter Haftung\nMünchen\n\nDen Gläubigern des formwechselnden Rechtsträgers ist, wenn sie binnen sechs Monaten nach dem Tag, an dem die Eintragung des Formwechsels nach § 201 UmwG als bekannt gemacht gilt, ihren Anspruch nach Grund und Höhe schriftlich anmelden, Sicherheit zu leisten, soweit sie nicht Befriedigung verlangen können. Dieses Recht steht den Gläubigern jedoch nur zu, wenn sie glaubhaft machen, dass durch den Formwechsel die Erfüllung ihrer Forderung gefährdet wird."
    },
    {
      "date": "2024-11-06",
      "id": "92654",
      "original_text": "Registerbekanntmachung nach dem Umwandlungsgesetz\nBayern Amtsgericht München HRB 191302\nelement14 UG (haftungsbeschränkt) – Aschheim",
      "type": "Registerbekanntmachung nach dem Umwandlungsgesetz",
      "state": "Bayern",
      "amtsgericht": "Amtsgericht München",
      "registernummer": "HRB 191302",
      "registerart": "HRB",
      "company_name": "element14 UG (haftungsbeschränkt)",
      "company_seat": "Aschheim",
      "details": "06.11.2024 (Bekanntmachungsdatum)\n\nBayern Amtsgericht München HRB 191302\nRegisterbekanntmachung nach dem Umwandlungsgesetz 05.11.2024 (Eintragungsdatum)\n\nelement14 UG (haftungsbeschränkt)\nGesellschaft mit beschränkter Haftung\nAschheim\n\nDen Gläubigern der an der Verschmelzung beteiligten Rechtsträger ist, wenn sie binnen sechs Monaten nach dem Tag, an dem die Eintragung der Verschmelzung in das Register des Sitzes desjenigen Rechtsträgers, dessen Gläubiger sie sind, nach § 19 Abs. 3 UmwG als bekannt gemacht gilt, ihren Anspruch nach Grund und Höhe schriftlich anmelden, Sicherheit zu leisten, soweit sie nicht Befriedigung verlangen können. Dieses Recht steht den Gläubigern jedoch nur zu, wenn sie glaubhaft machen, dass durch die Verschmelzung die Erfüllung ihrer Forderung gefährdet wird."
    },
    {
      "date": "2024-11-06",
      "id": "92655",
      "original_text": "Registerbekanntmachung nach dem Umwandlungsgesetz\nBayern Amtsgericht Bamberg HRA 12592\nFirma Taxi Junghans e.K. – Forchheim",
      "type": "Registerbekanntmachung nach dem Umwandlungsgesetz",
      "state": "Bayern",
      "amtsgericht": "Amtsgericht Bamberg",
      "registernummer": "HRA 12592",
      "registerart": "HRA",
      "company_name": "Firma Taxi Junghans e.K.",
      "company_seat": "Forchheim",
      "details": "06.11.2024 (Bekanntmachungsdatum)\n\nBayern Amtsgericht Bamberg HRA 12592\nRegisterbekanntmachung nach dem Umwandlungsgesetz 05.11.2024 (Eintragungsdatum)\n\nFirma Taxi Junghans e.K.\nEinzelkaufmann / Einzelkauffrau\nForchheim\n\nDen Gläubigern der an der Ausgliederung beteiligten Rechtsträger ist, wenn sie binnen sechs Monaten nach dem Tag, an dem die Eintragung der Ausgliederung in das Register des Sitzes desjenigen Rechtsträgers, dessen Gläubiger sie sind, nach §§ 125, 19 Abs. 3 UmwG als bekannt gemacht gilt, ihren Anspruch nach Grund und Höhe schriftlich anmelden, Sicherheit zu leisten, soweit sie nicht Befriedigung verlangen können. Dieses Recht steht den Gläubigern jedoch nur zu, wenn sie glaubhaft machen, dass durch die Ausgliederung die Erfüllung ihrer Forderung gefährdet wird."
    },
    {
      "date": "2024-11-06",
      "id": "92656",
      "original_text": "Registerbekanntmachung nach dem Umwandlungsgesetz\nBayern Amtsgericht Bamberg HRB 11821\nHauck Holding GmbH – Zeil am Main, OT Ziegelanger",
      "type": "Registerbekanntmachung nach dem Umwandlungsgesetz",
      "state": "Bayern",
      "amtsgericht": "Amtsgericht Bamberg",
      "registernummer": "HRB 11821",
      "registerart": "HRB",
      "company_name": "Hauck Holding GmbH",
      "company_seat": "Zeil am Main, OT Ziegelanger",
      "details": "06.11.2024 (Bekanntmachungsdatum)\n\nBayern Amtsgericht Bamberg HRB 11821\nRegisterbekanntmachung nach dem Umwandlungsgesetz 05.11.2024 (Eintragungsdatum)\n\nHauck Holding GmbH\nGesellschaft mit beschränkter Haftung\nZeil am Main, OT Ziegelanger\n\nDen Gläubigern der an der Ausgliederung beteiligten Rechtsträger ist, wenn sie binnen sechs Monaten nach dem Tag, an dem die Eintragung der Ausgliederung in das Register des Sitzes desjenigen Rechtsträgers, dessen Gläubiger sie sind, nach §§ 125, 19 Abs. 3 UmwG als bekannt gemacht gilt, ihren Anspruch nach Grund und Höhe schriftlich anmelden, Sicherheit zu leisten, soweit sie nicht Befriedigung verlangen können. Dieses Recht steht den Gläubigern jedoch nur zu, wenn sie glaubhaft machen, dass durch die Ausgliederung die Erfüllung ihrer Forderung gefährdet wird."
    },
    {
      "date": "2024-11-06",
      "id": "92657",
      "original_text": "Löschungsankündigung\nBayern Amtsgericht München HRB 209885\nRestaurant Taj Mahal München GmbH – München",
      "type": "Löschungsankündigung",
      "state": "Bayern",
      "amtsgericht": "Amtsgericht München",
      "registernummer": "HRB 209885",
      "registerart": "HRB",
      "company_name": "Restaurant Taj Mahal München GmbH",
      "company_seat": "München",
      "details": "06.11.2024 (Bekanntmachungsdatum)\n\nBayern Amtsgericht München HRB 209885\nLöschungsankündigung\n\nRestaurant Taj Mahal München GmbH\nGesellschaft mit beschränkter Haftung\nMünchen\n\nDas Registergericht beabsichtigt, die im Handelsregister eingetragene Gesellschaft wegen Vermögenslosigkeit von Amts wegen nach § 394 FamFG zu löschen. Die Frist zur Erhebung eines Widerspruchs ist auf drei Monate festgesetzt."
    },
    {
      "date": "2024-11-06",
      "id": "92658",
      "original_text": "Registerbekanntmachung nach dem Umwandlungsgesetz\nBayern Amtsgericht Ingolstadt HRA 4062\nBäckerei Fall Inh. U. Kopold e. K. – Karlskron",
      "type": "Registerbekanntmachung nach dem Umwandlungsgesetz",
      "state": "Bayern",
      "amtsgericht": "Amtsgericht Ingolstadt",
      "registernummer": "HRA 4062",
      "registerart": "HRA",
      "company_name": "Bäckerei Fall Inh. U. Kopold e. K.",
      "company_seat": "Karlskron",
      "details": "06.11.2024 (Bekanntmachungsdatum)\n\nBayern Amtsgericht Ingolstadt HRA 4062\nRegisterbekanntmachung nach dem Umwandlungsgesetz 05.11.2024 (Eintragungsdatum)\n\nBäckerei Fall Inh. U. Kopold e. K.\nEinzelkaufmann / Einzelkauffrau\nKarlskron\n\nDen Gläubigern der an der Ausgliederung beteiligten Rechtsträger ist, wenn sie binnen sechs Monaten nach dem Tag, an dem die Eintragung der Ausgliederung in das Register des Sitzes desjenigen Rechtsträgers, dessen Gläubiger sie sind, nach §§ 125, 19 Abs. 3 UmwG als bekannt gemacht gilt, ihren Anspruch nach Grund und Höhe schriftlich anmelden, Sicherheit zu leisten, soweit sie nicht Befriedigung verlangen können. Dieses Recht steht den Gläubigern jedoch nur zu, wenn sie glaubhaft machen, dass durch die Ausgliederung die Erfüllung ihrer Forderung gefährdet wird."
    },
    {
      "date": "2024-11-06",
      "id": "92659",
      "original_text": "Registerbekanntmachung nach dem Umwandlungsgesetz\nBayern Amtsgericht München HRA 120136\nAdlwarth Bauen und Wohnen KG – Lenggries",
      "type": "Registerbekanntmachung nach dem Umwandlungsgesetz",
      "state": "Bayern",
      "amtsgericht": "Amtsgericht München",
      "registernummer": "HRA 120136",
      "registerart": "HRA",
      "company_name": "Adlwarth Bauen und Wohnen KG",
      "company_seat": "Lenggries",
      "details": "06.11.2024 (Bekanntmachungsdatum)\n\nBayern Amtsgericht München HRA 120136\nRegisterbekanntmachung nach dem Umwandlungsgesetz 05.11.2024 (Eintragungsdatum)\n\nAdlwarth Bauen und Wohnen KG\nKommanditgesellschaft\nLenggries\n\nDen Gläubigern des formwechselnden Rechtsträgers ist, wenn sie binnen sechs Monaten nach dem Tag, an dem die Eintragung des Formwechsels nach § 201 UmwG als bekannt gemacht gilt, ihren Anspruch nach Grund und Höhe schriftlich anmelden, Sicherheit zu leisten, soweit sie nicht Befriedigung verlangen können. Dieses Recht steht den Gläubigern jedoch nur zu, wenn sie glaubhaft machen, dass durch den Formwechsel die Erfüllung ihrer Forderung gefährdet wird."
    },
    {
      "date": "2024-11-06",
      "id": "92660",
      "original_text": "Löschungsankündigung\nBayern Amtsgericht München HRB 191415\nGelderland Grundbesitz GmbH – München",
      "type": "Löschungsankündigung",
      "state": "Bayern",
      "amtsgericht": "Amtsgericht München",
      "registernummer": "HRB 191415",
      "registerart": "HRB",
      "company_name": "Gelderland Grundbesitz GmbH",
      "company_seat": "München",
      "details": "06.11.2024 (Bekanntmachungsdatum)\n\nBayern Amtsgericht München HRB 191415\nLöschungsankündigung 05.11.2024 (Eintragungsdatum)\n\nGelderland Grundbesitz GmbH\nGesellschaft mit beschränkter Haftung\nMünchen\n\nDas Registergericht beabsichtigt, die im Handelsregister eingetragene Gesellschaft wegen Vermögenslosigkeit von Amts wegen nach § 394 FamFG zu löschen. Die Frist zur Erhebung eines Widerspruchs ist auf drei Monate festgesetzt."
    },
    {
      "date": "2024-11-06",
      "id": "92661",
      "original_text": "Registerbekanntmachung nach dem Umwandlungsgesetz\nBayern Amtsgericht Kempten (Allgäu) HRB 11544\nK + L Transporte GmbH – Kempten (Allgäu)",
      "type": "Registerbekanntmachung nach dem Umwandlungsgesetz",
      "state": "Bayern",
      "amtsgericht": "Amtsgericht Kempten (Allgäu)",
      "registernummer": "HRB 11544",
      "registerart": "HRB",
      "company_name": "K + L Transporte GmbH",
      "company_seat": "Kempten (Allgäu)",
      "details": "06.11.2024 (Bekanntmachungsdatum)\n\nBayern Amtsgericht Kempten (Allgäu) HRB 11544\nRegisterbekanntmachung nach dem Umwandlungsgesetz 05.11.2024 (Eintragungsdatum)\n\nK + L Transporte GmbH\nGesellschaft mit beschränkter Haftung\nKempten (Allgäu)\n\nDen Gläubigern der an der Verschmelzung beteiligten Rechtsträger ist, wenn sie binnen sechs Monaten nach dem Tag, an dem die Eintragung der Verschmelzung in das Register des Sitzes desjenigen Rechtsträgers, dessen Gläubiger sie sind, nach § 19 Abs. 3 UmwG als bekannt gemacht gilt, ihren Anspruch nach Grund und Höhe schriftlich anmelden, Sicherheit zu leisten, soweit sie nicht Befriedigung verlangen können. Dieses Recht steht den Gläubigern jedoch nur zu, wenn sie glaubhaft machen, dass durch die Verschmelzung die Erfüllung ihrer Forderung gefährdet wird."
    },
    {
      "date": "2024-11-06",
      "id": "92662",
      "original_text": "Einreichung neuer Dokumente\nBayern Amtsgericht Nürnberg HRB 540\nuniVersa Krankenversicherung a.G. – Nürnberg",
      "type": "Einreichung neuer Dokumente",
      "state": "Bayern",
      "amtsgericht": "Amtsgericht Nürnberg",
      "registernummer": "HRB 540",
      "registerart": "HRB",
      "company_name": "uniVersa Krankenversicherung a.G.",
      "company_seat": "Nürnberg",
      "details": "06.11.2024 (Bekanntmachungsdatum)\n\nBayern Amtsgericht Nürnberg HRB 540\nEinreichung neuer Dokumente\n\nuniVersa Krankenversicherung a.G.\nVersicherungsverein auf Gegenseitigkeit\nNürnberg\n\nDem Amtsgericht Nürnberg -Registergericht- ist eine Liste der Mitglieder des Aufsichtsrats eingereicht worden, §§ 189 Abs. 3 Satz 1 VAG, 106 AktG."
    },
    {
      "date": "2024-11-06",
      "id": "92663",
      "original_text": "Einreichung neuer Dokumente\nBayern Amtsgericht Nürnberg HRB 1865\nIGARASHI Motoren GmbH – Ezelsdorf",
      "type": "Einreichung neuer Dokumente",
      "state": "Bayern",
      "amtsgericht": "Amtsgericht Nürnberg",
      "registernummer": "HRB 1865",
      "registerart": "HRB",
      "company_name": "IGARASHI Motoren GmbH",
      "company_seat": "Ezelsdorf",
      "details": "06.11.2024 (Bekanntmachungsdatum)\n\nBayern Amtsgericht Nürnberg HRB 1865\nEinreichung neuer Dokumente\n\nIGARASHI Motoren GmbH\nGesellschaft mit beschränkter Haftung\nEzelsdorf\n\nDem Amtsgericht Nürnberg -Registergericht- ist eine Liste der Mitglieder des Aufsichtsrats eingereicht worden, § 52 Abs. 3 S. 2 GmbHG."
    },
    {
      "date": "2024-11-06",
      "id": "92664",
      "original_text": "Registerbekanntmachung nach dem Umwandlungsgesetz\nBayern Amtsgericht Ingolstadt HRB 1852\nGVZ Konsolidierungszentrum Betreibergesellschaft mbH – Ingolstadt",
      "type": "Registerbekanntmachung nach dem Umwandlungsgesetz",
      "state": "Bayern",
      "amtsgericht": "Amtsgericht Ingolstadt",
      "registernummer": "HRB 1852",
      "registerart": "HRB",
      "company_name": "GVZ Konsolidierungszentrum Betreibergesellschaft mbH",
      "company_seat": "Ingolstadt",
      "details": "06.11.2024 (Bekanntmachungsdatum)\n\nBayern Amtsgericht Ingolstadt HRB 1852\nRegisterbekanntmachung nach dem Umwandlungsgesetz 05.11.2024 (Eintragungsdatum)\n\nGVZ Konsolidierungszentrum Betreibergesellschaft mbH\nGesellschaft mit beschränkter Haftung\nIngolstadt\n\nDen Gläubigern der an der Verschmelzung beteiligten Rechtsträger ist, wenn sie binnen sechs Monaten nach dem Tag, an dem die Eintragung der Verschmelzung in das Register des Sitzes desjenigen Rechtsträgers, dessen Gläubiger sie sind, nach § 19 Abs. 3 UmwG als bekannt gemacht gilt, ihren Anspruch nach Grund und Höhe schriftlich anmelden, Sicherheit zu leisten, soweit sie nicht Befriedigung verlangen können. Dieses Recht steht den Gläubigern jedoch nur zu, wenn sie glaubhaft machen, dass durch die Verschmelzung die Erfüllung ihrer Forderung gefährdet wird."
    },
    {
      "date": "2024-11-06",
      "id": "92665",
      "original_text": "Registerbekanntmachung nach dem Umwandlungsgesetz\nBayern Amtsgericht Ingolstadt HRB 2219\nLGI Logistikzentrum im Güterverkehrszentrum Ingolstadt Betreibergesellschaft mbH – Ingolstadt",
      "type": "Registerbekanntmachung nach dem Umwandlungsgesetz",
      "state": "Bayern",
      "amtsgericht": "Amtsgericht Ingolstadt",
      "registernummer": "HRB 2219",
      "registerart": "HRB",
      "company_name": "LGI Logistikzentrum im Güterverkehrszentrum Ingolstadt Betreibergesellschaft mbH",
      "company_seat": "Ingolstadt",
      "details": "06.11.2024 (Bekanntmachungsdatum)\n\nBayern Amtsgericht Ingolstadt HRB 2219\nRegisterbekanntmachung nach dem Umwandlungsgesetz 05.11.2024 (Eintragungsdatum)\n\nLGI Logistikzentrum im Güterverkehrszentrum Ingolstadt Betreibergesellschaft mbH\nGesellschaft mit beschränkter Haftung\nIngolstadt\n\nDen Gläubigern der an der Verschmelzung beteiligten Rechtsträger ist, wenn sie binnen sechs Monaten nach dem Tag, an dem die Eintragung der Verschmelzung in das Register des Sitzes desjenigen Rechtsträgers, dessen Gläubiger sie sind, nach § 19 Abs. 3 UmwG als bekannt gemacht gilt, ihren Anspruch nach Grund und Höhe schriftlich anmelden, Sicherheit zu leisten, soweit sie nicht Befriedigung verlangen können. Dieses Recht steht den Gläubigern jedoch nur zu, wenn sie glaubhaft machen, dass durch die Verschmelzung die Erfüllung ihrer Forderung gefährdet wird."
    },
    {
      "date": "2024-11-06",
      "id": "92666",
      "original_text": "Registerbekanntmachung nach dem Umwandlungsgesetz\nBayern Amtsgericht Augsburg HRA 20920\nHans-Georg Wagner Malerbetrieb e.K. – Affing",
      "type": "Registerbekanntmachung nach dem Umwandlungsgesetz",
      "state": "Bayern",
      "amtsgericht": "Amtsgericht Augsburg",
      "registernummer": "HRA 20920",
      "registerart": "HRA",
      "company_name": "Hans-Georg Wagner Malerbetrieb e.K.",
      "company_seat": "Affing",
      "details": "06.11.2024 (Bekanntmachungsdatum)\n\nBayern Amtsgericht Augsburg HRA 20920\nRegisterbekanntmachung nach dem Umwandlungsgesetz 05.11.2024 (Eintragungsdatum)\n\nHans-Georg Wagner Malerbetrieb e.K.\nEinzelkaufmann / Einzelkauffrau\nAffing\n\nDen Gläubigern der an der Ausgliederung beteiligten Rechtsträger ist, wenn sie binnen sechs Monaten nach dem Tag, an dem die Eintragung der Ausgliederung in das Register des Sitzes desjenigen Rechtsträgers, dessen Gläubiger sie sind, nach §§ 125, 19 Abs. 3 UmwG als bekannt gemacht gilt, ihren Anspruch nach Grund und Höhe schriftlich anmelden, Sicherheit zu leisten, soweit sie nicht Befriedigung verlangen können. Dieses Recht steht den Gläubigern jedoch nur zu, wenn sie glaubhaft machen, dass durch die Ausgliederung die Erfüllung ihrer Forderung gefährdet wird."
    },
    {
      "date": "2024-11-06",
      "id": "92667",
      "original_text": "Registerbekanntmachung nach dem Umwandlungsgesetz\nBayern Amtsgericht Bamberg HRA 13273\nArbeitssicherheit & Brandschutz GÖB e.K. – Ebelsbach",
      "type": "Registerbekanntmachung nach dem Umwandlungsgesetz",
      "state": "Bayern",
      "amtsgericht": "Amtsgericht Bamberg",
      "registernummer": "HRA 13273",
      "registerart": "HRA",
      "company_name": "Arbeitssicherheit & Brandschutz GÖB e.K.",
      "company_seat": "Ebelsbach",
      "details": "06.11.2024 (Bekanntmachungsdatum)\n\nBayern Amtsgericht Bamberg HRA 13273\nRegisterbekanntmachung nach dem Umwandlungsgesetz 05.11.2024 (Eintragungsdatum)\n\nArbeitssicherheit & Brandschutz GÖB e.K.\nEinzelkaufmann / Einzelkauffrau\nEbelsbach\n\nDen Gläubigern der an der Ausgliederung beteiligten Rechtsträger ist, wenn sie binnen sechs Monaten nach dem Tag, an dem die Eintragung der Ausgliederung in das Register des Sitzes desjenigen Rechtsträgers, dessen Gläubiger sie sind, nach §§ 125, 19 Abs. 3 UmwG als bekannt gemacht gilt, ihren Anspruch nach Grund und Höhe schriftlich anmelden, Sicherheit zu leisten, soweit sie nicht Befriedigung verlangen können. Dieses Recht steht den Gläubigern jedoch nur zu, wenn sie glaubhaft machen, dass durch die Ausgliederung die Erfüllung ihrer Forderung gefährdet wird."
    },
    {
      "date": "2024-11-06",
      "id": "92668",
      "original_text": "Löschungsankündigung\nBayern Amtsgericht München HRB 278962\nFortuna Electronics GmbH – Erding",
      "type": "Löschungsankündigung",
      "state": "Bayern",
      "amtsgericht": "Amtsgericht München",
      "registernummer": "HRB 278962",
      "registerart": "HRB",
      "company_name": "Fortuna Electronics GmbH",
      "company_seat": "Erding",
      "details": "06.11.2024 (Bekanntmachungsdatum)\n\nBayern Amtsgericht München HRB 278962\nLöschungsankündigung 05.11.2024 (Eintragungsdatum)\n\nFortuna Electronics GmbH\nGesellschaft mit beschränkter Haftung\nErding\n\nDas Registergericht beabsichtigt, die im Handelsregister eingetragene Gesellschaft wegen Vermögenslosigkeit von Amts wegen nach § 394 FamFG zu löschen. #insert(Text=\"zztb_V_Widerspruchsfrist\")"
    },
    {
      "date": "2024-11-06",
      "id": "92669",
      "original_text": "Registerbekanntmachung nach dem Umwandlungsgesetz\nBayern Amtsgericht München HRB 279173\nGreen and Energy Holding GmbH – München",
      "type": "Registerbekanntmachung nach dem Umwandlungsgesetz",
      "state": "Bayern",
      "amtsgericht": "Amtsgericht München",
      "registernummer": "HRB 279173",
      "registerart": "HRB",
      "company_name": "Green and Energy Holding GmbH",
      "company_seat": "München",
      "details": "06.11.2024 (Bekanntmachungsdatum)\n\nBayern Amtsgericht München HRB 279173\nRegisterbekanntmachung nach dem Umwandlungsgesetz 05.11.2024 (Eintragungsdatum)\n\nGreen and Energy Holding GmbH\nGesellschaft mit beschränkter Haftung\nMünchen\n\nDen Gläubigern der an der Verschmelzung beteiligten Rechtsträger ist, wenn sie binnen sechs Monaten nach dem Tag, an dem die Eintragung der Verschmelzung in das Register des Sitzes desjenigen Rechtsträgers, dessen Gläubiger sie sind, nach § 19 Abs. 3 UmwG als bekannt gemacht gilt, ihren Anspruch nach Grund und Höhe schriftlich anmelden, Sicherheit zu leisten, soweit sie nicht Befriedigung verlangen können. Dieses Recht steht den Gläubigern jedoch nur zu, wenn sie glaubhaft machen, dass durch die Verschmelzung die Erfüllung ihrer Forderung gefährdet wird."
    },
    {
      "date": "2024-11-06",
      "id": "92670",
      "original_text": "Registerbekanntmachung nach dem Umwandlungsgesetz\nBayern Amtsgericht Nürnberg HRB 30936\nFlemingEnterpriseHolding GmbH – Nürnberg",
      "type": "Registerbekanntmachung nach dem Umwandlungsgesetz",
      "state": "Bayern",
      "amtsgericht": "Amtsgericht Nürnberg",
      "registernummer": "HRB 30936",
      "registerart": "HRB",
      "company_name": "FlemingEnterpriseHolding GmbH",
      "company_seat": "Nürnberg",
      "details": "06.11.2024 (Bekanntmachungsdatum)\n\nBayern Amtsgericht Nürnberg HRB 30936\nRegisterbekanntmachung nach dem Umwandlungsgesetz 05.11.2024 (Eintragungsdatum)\n\nFlemingEnterpriseHolding GmbH\nGesellschaft mit beschränkter Haftung\nNürnberg\n\nDen Gläubigern der an der Verschmelzung beteiligten Rechtsträger ist, wenn sie binnen sechs Monaten nach dem Tag, an dem die Eintragung der Verschmelzung in das Register des Sitzes desjenigen Rechtsträgers, dessen Gläubiger sie sind, nach § 19 Abs. 3 UmwG als bekannt gemacht gilt, ihren Anspruch nach Grund und Höhe schriftlich anmelden, Sicherheit zu leisten, soweit sie nicht Befriedigung verlangen können. Dieses Recht steht den Gläubigern jedoch nur zu, wenn sie glaubhaft machen, dass durch die Verschmelzung die Erfüllung ihrer Forderung gefährdet wird."
    },
    {
      "date": "2024-11-06",
      "id": "92671",
      "original_text": "Registerbekanntmachung nach dem Umwandlungsgesetz\nBayern Amtsgericht Hof HRB 173\nFeinspinnerei Hof Gesellschaft mit beschränkter Haftung – Hof (Saale)",
      "type": "Registerbekanntmachung nach dem Umwandlungsgesetz",
      "state": "Bayern",
      "amtsgericht": "Amtsgericht Hof",
      "registernummer": "HRB 173",
      "registerart": "HRB",
      "company_name": "Feinspinnerei Hof Gesellschaft mit beschränkter Haftung",
      "company_seat": "Hof (Saale)",
      "details": "06.11.2024 (Bekanntmachungsdatum)\n\nBayern Amtsgericht Hof HRB 173\nRegisterbekanntmachung nach dem Umwandlungsgesetz 05.11.2024 (Eintragungsdatum)\n\nFeinspinnerei Hof Gesellschaft mit beschränkter Haftung\nGesellschaft mit beschränkter Haftung\nHof (Saale)\n\nDen Gläubigern der an der Verschmelzung beteiligten Rechtsträger ist, wenn sie binnen sechs Monaten nach dem Tag, an dem die Eintragung der Verschmelzung in das Register des Sitzes desjenigen Rechtsträgers, dessen Gläubiger sie sind, nach § 19 Abs. 3 UmwG als bekannt gemacht gilt, ihren Anspruch nach Grund und Höhe schriftlich anmelden, Sicherheit zu leisten, soweit sie nicht Befriedigung verlangen können. Dieses Recht steht den Gläubigern jedoch nur zu, wenn sie glaubhaft machen, dass durch die Verschmelzung die Erfüllung ihrer Forderung gefährdet wird."
    },
    {
      "date": "2024-11-06",
      "id": "92672",
      "original_text": "Registerbekanntmachung nach dem Umwandlungsgesetz\nBayern Amtsgericht München HRB 121565\nPeter Fink ArchitektenGmbH – München",
      "type": "Registerbekanntmachung nach dem Umwandlungsgesetz",
      "state": "Bayern",
      "amtsgericht": "Amtsgericht München",
      "registernummer": "HRB 121565",
      "registerart": "HRB",
      "company_name": "Peter Fink ArchitektenGmbH",
      "company_seat": "München",
      "details": "06.11.2024 (Bekanntmachungsdatum)\n\nBayern Amtsgericht München HRB 121565\nRegisterbekanntmachung nach dem Umwandlungsgesetz 05.11.2024 (Eintragungsdatum)\n\nPeter Fink ArchitektenGmbH\nGesellschaft mit beschränkter Haftung\nMünchen\n\nDen Gläubigern der an der Verschmelzung beteiligten Rechtsträger ist, wenn sie binnen sechs Monaten nach dem Tag, an dem die Eintragung der Verschmelzung in das Register des Sitzes desjenigen Rechtsträgers, dessen Gläubiger sie sind, nach § 19 Abs. 3 UmwG als bekannt gemacht gilt, ihren Anspruch nach Grund und Höhe schriftlich anmelden, Sicherheit zu leisten, soweit sie nicht Befriedigung verlangen können. Dieses Recht steht den Gläubigern jedoch nur zu, wenn sie glaubhaft machen, dass durch die Verschmelzung die Erfüllung ihrer Forderung gefährdet wird."
    },
    {
      "date": "2024-11-06",
      "id": "92673",
      "original_text": "Registerbekanntmachung nach dem Umwandlungsgesetz\nBayern Amtsgericht Bamberg HRB 11818\nArbeitssicherheit & Brandschutz GÖB GmbH – Ebelsbach",
      "type": "Registerbekanntmachung nach dem Umwandlungsgesetz",
      "state": "Bayern",
      "amtsgericht": "Amtsgericht Bamberg",
      "registernummer": "HRB 11818",
      "registerart": "HRB",
      "company_name": "Arbeitssicherheit & Brandschutz GÖB GmbH",
      "company_seat": "Ebelsbach",
      "details": "06.11.2024 (Bekanntmachungsdatum)\n\nBayern Amtsgericht Bamberg HRB 11818\nRegisterbekanntmachung nach dem Umwandlungsgesetz 05.11.2024 (Eintragungsdatum)\n\nArbeitssicherheit & Brandschutz GÖB GmbH\nGesellschaft mit beschränkter Haftung\nEbelsbach\n\nDen Gläubigern der an der Ausgliederung beteiligten Rechtsträger ist, wenn sie binnen sechs Monaten nach dem Tag, an dem die Eintragung der Ausgliederung in das Register des Sitzes desjenigen Rechtsträgers, dessen Gläubiger sie sind, nach §§ 125, 19 Abs. 3 UmwG als bekannt gemacht gilt, ihren Anspruch nach Grund und Höhe schriftlich anmelden, Sicherheit zu leisten, soweit sie nicht Befriedigung verlangen können. Dieses Recht steht den Gläubigern jedoch nur zu, wenn sie glaubhaft machen, dass durch die Ausgliederung die Erfüllung ihrer Forderung gefährdet wird."
    },
    {
      "date": "2024-11-06",
      "id": "92674",
      "original_text": "Registerbekanntmachung nach dem Umwandlungsgesetz\nBayern Amtsgericht Fürth HRB 19686\nT-Stream GmbH – Oberasbach",
      "type": "Registerbekanntmachung nach dem Umwandlungsgesetz",
      "state": "Bayern",
      "amtsgericht": "Amtsgericht Fürth",
      "registernummer": "HRB 19686",
      "registerart": "HRB",
      "company_name": "T-Stream GmbH",
      "company_seat": "Oberasbach",
      "details": "06.11.2024 (Bekanntmachungsdatum)\n\nBayern Amtsgericht Fürth HRB 19686\nRegisterbekanntmachung nach dem Umwandlungsgesetz 05.11.2024 (Eintragungsdatum)\n\nT-Stream GmbH\nGesellschaft mit beschränkter Haftung\nOberasbach\n\nDen Gläubigern der an der Verschmelzung beteiligten Rechtsträger ist, wenn sie binnen sechs Monaten nach dem Tag, an dem die Eintragung der Verschmelzung in das Register des Sitzes desjenigen Rechtsträgers, dessen Gläubiger sie sind, nach § 19 Abs. 3 UmwG als bekannt gemacht gilt, ihren Anspruch nach Grund und Höhe schriftlich anmelden, Sicherheit zu leisten, soweit sie nicht Befriedigung verlangen können. Dieses Recht steht den Gläubigern jedoch nur zu, wenn sie glaubhaft machen, dass durch die Verschmelzung die Erfüllung ihrer Forderung gefährdet wird."
    },
    {
      "date": "2024-11-06",
      "id": "92675",
      "original_text": "Registerbekanntmachung nach dem Umwandlungsgesetz\nBayern Amtsgericht Würzburg HRA 8884\nHilpert MAWI 4 GmbH & Co. KG – Würzburg",
      "type": "Registerbekanntmachung nach dem Umwandlungsgesetz",
      "state": "Bayern",
      "amtsgericht": "Amtsgericht Würzburg",
      "registernummer": "HRA 8884",
      "registerart": "HRA",
      "company_name": "Hilpert MAWI 4 GmbH & Co. KG",
      "company_seat": "Würzburg",
      "details": "06.11.2024 (Bekanntmachungsdatum)\n\nBayern Amtsgericht Würzburg HRA 8884\nRegisterbekanntmachung nach dem Umwandlungsgesetz 05.11.2024 (Eintragungsdatum)\n\nHilpert MAWI 4 GmbH & Co. KG\nKommanditgesellschaft\nWürzburg\n\nDen Gläubigern des formwechselnden Rechtsträgers ist, wenn sie binnen sechs Monaten nach dem Tag, an dem die Eintragung des Formwechsels nach § 201 UmwG als bekannt gemacht gilt, ihren Anspruch nach Grund und Höhe schriftlich anmelden, Sicherheit zu leisten, soweit sie nicht Befriedigung verlangen können. Dieses Recht steht den Gläubigern jedoch nur zu, wenn sie glaubhaft machen, dass durch den Formwechsel die Erfüllung ihrer Forderung gefährdet wird."
    },
    {
      "date": "2024-11-06",
      "id": "92676",
      "original_text": "Registerbekanntmachung nach dem Umwandlungsgesetz\nBayern Amtsgericht Würzburg HRB 16216\nHilpert MAWI 4 GmbH – Würzburg",
      "type": "Registerbekanntmachung nach dem Umwandlungsgesetz",
      "state": "Bayern",
      "amtsgericht": "Amtsgericht Würzburg",
      "registernummer": "HRB 16216",
      "registerart": "HRB",
      "company_name": "Hilpert MAWI 4 GmbH",
      "company_seat": "Würzburg",
      "details": "06.11.2024 (Bekanntmachungsdatum)\n\nBayern Amtsgericht Würzburg HRB 16216\nRegisterbekanntmachung nach dem Umwandlungsgesetz 05.11.2024 (Eintragungsdatum)\n\nHilpert MAWI 4 GmbH\nGesellschaft mit beschränkter Haftung\nWürzburg\n\nDen Gläubigern des formwechselnden Rechtsträgers ist, wenn sie binnen sechs Monaten nach dem Tag, an dem die Eintragung des Formwechsels nach § 201 UmwG als bekannt gemacht gilt, ihren Anspruch nach Grund und Höhe schriftlich anmelden, Sicherheit zu leisten, soweit sie nicht Befriedigung verlangen können. Dieses Recht steht den Gläubigern jedoch nur zu, wenn sie glaubhaft machen, dass durch den Formwechsel die Erfüllung ihrer Forderung gefährdet wird."
    },
    {
      "date": "2024-11-06",
      "id": "92677",
      "original_text": "Registerbekanntmachung nach dem Umwandlungsgesetz\nBayern Amtsgericht Nürnberg HRB 30263\nablaro. UG (haftungsbeschränkt) – Nürnberg",
      "type": "Registerbekanntmachung nach dem Umwandlungsgesetz",
      "state": "Bayern",
      "amtsgericht": "Amtsgericht Nürnberg",
      "registernummer": "HRB 30263",
      "registerart": "HRB",
      "company_name": "ablaro. UG (haftungsbeschränkt)",
      "company_seat": "Nürnberg",
      "details": "06.11.2024 (Bekanntmachungsdatum)\n\nBayern Amtsgericht Nürnberg HRB 30263\nRegisterbekanntmachung nach dem Umwandlungsgesetz 05.11.2024 (Eintragungsdatum)\n\nablaro. UG (haftungsbeschränkt)\nGesellschaft mit beschränkter Haftung\nNürnberg\n\nDen Gläubigern der an der Verschmelzung beteiligten Rechtsträger ist, wenn sie binnen sechs Monaten nach dem Tag, an dem die Eintragung der Verschmelzung in das Register des Sitzes desjenigen Rechtsträgers, dessen Gläubiger sie sind, nach § 19 Abs. 3 UmwG als bekannt gemacht gilt, ihren Anspruch nach Grund und Höhe schriftlich anmelden, Sicherheit zu leisten, soweit sie nicht Befriedigung verlangen können. Dieses Recht steht den Gläubigern jedoch nur zu, wenn sie glaubhaft machen, dass durch die Verschmelzung die Erfüllung ihrer Forderung gefährdet wird."
    },
    {
      "date": "2024-11-06",
      "id": "92678",
      "original_text": "Registerbekanntmachung nach dem Umwandlungsgesetz\nBayern Amtsgericht München GsR 551\nMedizinisches Versorgungszentrum Fiehl und Feuchtgruber eGbR – München",
      "type": "Registerbekanntmachung nach dem Umwandlungsgesetz",
      "state": "Bayern",
      "amtsgericht": "Amtsgericht München",
      "registernummer": "GsR 551",
      "registerart": "GsR",
      "company_name": "Medizinisches Versorgungszentrum Fiehl und Feuchtgruber eGbR",
      "company_seat": "München",
      "details": "06.11.2024 (Bekanntmachungsdatum)\n\nBayern Amtsgericht München GsR 551\nRegisterbekanntmachung nach dem Umwandlungsgesetz 05.11.2024 (Eintragungsdatum)\n\nMedizinisches Versorgungszentrum Fiehl und Feuchtgruber eGbR\nGesellschaft bürgerlichen Rechts\nMünchen\n\nDen Gläubigern des formwechselnden Rechtsträgers ist, wenn sie binnen sechs Monaten nach dem Tag, an dem die Eintragung des Formwechsels nach § 201 UmwG als bekannt gemacht gilt, ihren Anspruch nach Grund und Höhe schriftlich anmelden, Sicherheit zu leisten, soweit sie nicht Befriedigung verlangen können. Dieses Recht steht den Gläubigern jedoch nur zu, wenn sie glaubhaft machen, dass durch den Formwechsel die Erfüllung ihrer Forderung gefährdet wird."
    },
    {
      "date": "2024-11-06",
      "id": "92679",
      "original_text": "Registerbekanntmachung nach dem Umwandlungsgesetz\nBayern Amtsgericht Regensburg GnR 667\nBürger-Energie-Genossenschaft im Landkreis Kelheim (Bengel-KEH) eG – Abensberg",
      "type": "Registerbekanntmachung nach dem Umwandlungsgesetz",
      "state": "Bayern",
      "amtsgericht": "Amtsgericht Regensburg",
      "registernummer": "GnR 667",
      "registerart": "GnR",
      "company_name": "Bürger-Energie-Genossenschaft im Landkreis Kelheim (Bengel-KEH) eG",
      "company_seat": "Abensberg",
      "details": "06.11.2024 (Bekanntmachungsdatum)\n\nBayern Amtsgericht Regensburg GnR 667\nRegisterbekanntmachung nach dem Umwandlungsgesetz 05.11.2024 (Eintragungsdatum)\n\nBürger-Energie-Genossenschaft im Landkreis Kelheim (Bengel-KEH) eG\neingetragene Genossenschaft\nAbensberg\n\nDen Gläubigern der an der Verschmelzung beteiligten Rechtsträger ist, wenn sie binnen sechs Monaten nach dem Tag, an dem die Eintragung der Verschmelzung in das Register des Sitzes desjenigen Rechtsträgers, dessen Gläubiger sie sind, nach § 19 Abs. 3 UmwG als bekannt gemacht gilt, ihren Anspruch nach Grund und Höhe schriftlich anmelden, Sicherheit zu leisten, soweit sie nicht Befriedigung verlangen können. Dieses Recht steht den Gläubigern jedoch nur zu, wenn sie glaubhaft machen, dass durch die Verschmelzung die Erfüllung ihrer Forderung gefährdet wird."
    },
    {
      "date": "2024-11-06",
      "id": "92680",
      "original_text": "Registerbekanntmachung nach dem Umwandlungsgesetz\nBayern Amtsgericht Nürnberg HRB 38751\nFlemingLI Holding GmbH – Nürnberg",
      "type": "Registerbekanntmachung nach dem Umwandlungsgesetz",
      "state": "Bayern",
      "amtsgericht": "Amtsgericht Nürnberg",
      "registernummer": "HRB 38751",
      "registerart": "HRB",
      "company_name": "FlemingLI Holding GmbH",
      "company_seat": "Nürnberg",
      "details": "06.11.2024 (Bekanntmachungsdatum)\n\nBayern Amtsgericht Nürnberg HRB 38751\nRegisterbekanntmachung nach dem Umwandlungsgesetz 05.11.2024 (Eintragungsdatum)\n\nFlemingLI Holding GmbH\nGesellschaft mit beschränkter Haftung\nNürnberg\n\nDen Gläubigern der an der Verschmelzung beteiligten Rechtsträger ist, wenn sie binnen sechs Monaten nach dem Tag, an dem die Eintragung der Verschmelzung in das Register des Sitzes desjenigen Rechtsträgers, dessen Gläubiger sie sind, nach § 19 Abs. 3 UmwG als bekannt gemacht gilt, ihren Anspruch nach Grund und Höhe schriftlich anmelden, Sicherheit zu leisten, soweit sie nicht Befriedigung verlangen können. Dieses Recht steht den Gläubigern jedoch nur zu, wenn sie glaubhaft machen, dass durch die Verschmelzung die Erfüllung ihrer Forderung gefährdet wird."
    },
    {
      "date": "2024-11-06",
      "id": "92681",
      "original_text": "Löschungsankündigung\nBayern Amtsgericht München HRB 225363\nEmisys GmbH – München",
      "type": "Löschungsankündigung",
      "state": "Bayern",
      "amtsgericht": "Amtsgericht München",
      "registernummer": "HRB 225363",
      "registerart": "HRB",
      "company_name": "Emisys GmbH",
      "company_seat": "München",
      "details": "06.11.2024 (Bekanntmachungsdatum)\n\nBayern Amtsgericht München HRB 225363\nLöschungsankündigung 05.11.2024 (Eintragungsdatum)\n\nEmisys GmbH\nGesellschaft mit beschränkter Haftung\nMünchen\n\nDas Registergericht beabsichtigt, die im Handelsregister eingetragene Gesellschaft wegen Vermögenslosigkeit von Amts wegen nach § 394 FamFG zu löschen. Die Frist zur Erhebung eines Widerspruchs ist auf drei Monate festgesetzt."
    },
    {
      "date": "2024-11-06",
      "id": "92682",
      "original_text": "Löschungsankündigung\nBayern Amtsgericht Amberg HRB 1017\nOPTOLYTH-OPTIK Walter Roth Verwaltungs-GmbH – Weigendorf",
      "type": "Löschungsankündigung",
      "state": "Bayern",
      "amtsgericht": "Amtsgericht Amberg",
      "registernummer": "HRB 1017",
      "registerart": "HRB",
      "company_name": "OPTOLYTH-OPTIK Walter Roth Verwaltungs-GmbH",
      "company_seat": "Weigendorf",
      "details": "06.11.2024 (Bekanntmachungsdatum)\n\nBayern Amtsgericht Amberg HRB 1017\nLöschungsankündigung\n\nOPTOLYTH-OPTIK Walter Roth Verwaltungs-GmbH\nGesellschaft mit beschränkter Haftung\nWeigendorf\n\nDas Registergericht beabsichtigt, die im Handelsregister eingetragene Gesellschaft wegen Vermögenslosigkeit von Amts wegen nach § 394 FamFG zu löschen. Die Frist zur Erhebung eines Widerspruchs ist auf einen Monat festgesetzt."
    },
    {
      "date": "2024-11-06",
      "id": "92683",
      "original_text": "Registerbekanntmachung nach dem Umwandlungsgesetz\nBayern Amtsgericht Ingolstadt HRA 4073\nUK Immobilien GmbH & Co. KG – Karlskron",
      "type": "Registerbekanntmachung nach dem Umwandlungsgesetz",
      "state": "Bayern",
      "amtsgericht": "Amtsgericht Ingolstadt",
      "registernummer": "HRA 4073",
      "registerart": "HRA",
      "company_name": "UK Immobilien GmbH & Co. KG",
      "company_seat": "Karlskron",
      "details": "06.11.2024 (Bekanntmachungsdatum)\n\nBayern Amtsgericht Ingolstadt HRA 4073\nRegisterbekanntmachung nach dem Umwandlungsgesetz 05.11.2024 (Eintragungsdatum)\n\nUK Immobilien GmbH & Co. KG\nKommanditgesellschaft\nKarlskron\n\nDen Gläubigern der an der Ausgliederung beteiligten Rechtsträger ist, wenn sie binnen sechs Monaten nach dem Tag, an dem die Eintragung der Ausgliederung in das Register des Sitzes desjenigen Rechtsträgers, dessen Gläubiger sie sind, nach §§ 125, 19 Abs. 3 UmwG als bekannt gemacht gilt, ihren Anspruch nach Grund und Höhe schriftlich anmelden, Sicherheit zu leisten, soweit sie nicht Befriedigung verlangen können. Dieses Recht steht den Gläubigern jedoch nur zu, wenn sie glaubhaft machen, dass durch die Ausgliederung die Erfüllung ihrer Forderung gefährdet wird."
    },
    {
      "date": "2024-11-06",
      "id": "92684",
      "original_text": "Löschungsankündigung\nBrandenburg Amtsgericht Potsdam HRB 28168\nBios Transporte GmbH – Teltow",
      "type": "Löschungsankündigung",
      "state": "Brandenburg",
      "amtsgericht": "Amtsgericht Potsdam",
      "registernummer": "HRB 28168",
      "registerart": "HRB",
      "company_name": "Bios Transporte GmbH",
      "company_seat": "Teltow",
      "details": "06.11.2024 (Bekanntmachungsdatum)\n\nBrandenburg Amtsgericht Potsdam HRB 28168\nLöschungsankündigung\n\nBios Transporte GmbH\nGesellschaft mit beschränkter Haftung\nTeltow\n\nBei der nachstehenden Gesellschaft wird das Amtslöschungsverfahren gemäß § 394 FamFG eingeleitet. Widerspruchsfrist: 8 Wochen"
    },
    {
      "date": "2024-11-06",
      "id": "92685",
      "original_text": "Registerbekanntmachung nach dem Umwandlungsgesetz\nBaden-Württemberg Amtsgericht Stuttgart HRB 731302\nDBFP Deutsche Beratungsgesellschaft für Finanzplanung GmbH – Stuttgart",
      "type": "Registerbekanntmachung nach dem Umwandlungsgesetz",
      "state": "Baden-Württemberg",
      "amtsgericht": "Amtsgericht Stuttgart",
      "registernummer": "HRB 731302",
      "registerart": "HRB",
      "company_name": "DBFP Deutsche Beratungsgesellschaft für Finanzplanung GmbH",
      "company_seat": "Stuttgart",
      "details": "06.11.2024 (Bekanntmachungsdatum)\n\nBaden-Württemberg Amtsgericht Stuttgart HRB 731302\nRegisterbekanntmachung nach dem Umwandlungsgesetz 06.11.2024 (Eintragungsdatum)\n\nDBFP Deutsche Beratungsgesellschaft für Finanzplanung GmbH\nGesellschaft mit beschränkter Haftung\nStuttgart\n\nDen Gläubigern des an dem Formwechsel beteiligten Rechtsträgers ist, wenn sie binnen sechs Monaten nach dem Tag, an dem die Eintragung des Formwechsels in das Register des Sitzes desjenigen Rechtsträgers, dessen Gläubiger sie sind, nach § 19 Abs. 3 UmwG als bekanntgemacht gilt, ihren Anspruch nach Grund und Höhe schriftlich anmelden, Sicherheit zu leisten, soweit sie nicht Befriedigung verlangen können. Dieses Recht steht den Gläubigern jedoch nur zu, wenn sie glaubhaft machen, dass durch den Formwechsel die Erfüllung ihrer Forderung gefährdet wird."
    },
    {
      "date": "2024-11-06",
      "id": "92686",
      "original_text": "Registerbekanntmachung nach dem Umwandlungsgesetz\nBaden-Württemberg Amtsgericht Stuttgart HRB 796983\nDBFP Deutsche Beratungsgesellschaft für Finanzplanung AG – Stuttgart",
      "type": "Registerbekanntmachung nach dem Umwandlungsgesetz",
      "state": "Baden-Württemberg",
      "amtsgericht": "Amtsgericht Stuttgart",
      "registernummer": "HRB 796983",
      "registerart": "HRB",
      "company_name": "DBFP Deutsche Beratungsgesellschaft für Finanzplanung AG",
      "company_seat": "Stuttgart",
      "details": "06.11.2024 (Bekanntmachungsdatum)\n\nBaden-Württemberg Amtsgericht Stuttgart HRB 796983\nRegisterbekanntmachung nach dem Umwandlungsgesetz 06.11.2024 (Eintragungsdatum)\n\nDBFP Deutsche Beratungsgesellschaft für Finanzplanung AG\nAktiengesellschaft\nStuttgart\n\nDen Gläubigern des an dem Formwechsel beteiligten Rechtsträgers ist, wenn sie binnen sechs Monaten nach dem Tag, an dem die Eintragung des Formwechsels in das Register des Sitzes desjenigen Rechtsträgers, dessen Gläubiger sie sind, nach § 19 Abs. 3 UmwG als bekanntgemacht gilt, ihren Anspruch nach Grund und Höhe schriftlich anmelden, Sicherheit zu leisten, soweit sie nicht Befriedigung verlangen können. Dieses Recht steht den Gläubigern jedoch nur zu, wenn sie glaubhaft machen, dass durch den Formwechsel die Erfüllung ihrer Forderung gefährdet wird."
    },
    {
      "date": "2024-11-06",
      "id": "92687",
      "original_text": "Registerbekanntmachung nach dem Umwandlungsgesetz\nSchleswig-Holstein Amtsgericht Lübeck HRA 8592\nMeyer Menü GmbH & Co. KG – Siek",
      "type": "Registerbekanntmachung nach dem Umwandlungsgesetz",
      "state": "Schleswig-Holstein",
      "amtsgericht": "Amtsgericht Lübeck",
      "registernummer": "HRA 8592",
      "registerart": "HRA",
      "company_name": "Meyer Menü GmbH & Co. KG",
      "company_seat": "Siek",
      "details": "06.11.2024 (Bekanntmachungsdatum)\n\nSchleswig-Holstein Amtsgericht Lübeck HRA 8592\nRegisterbekanntmachung nach dem Umwandlungsgesetz 05.11.2024 (Eintragungsdatum)\n\nMeyer Menü GmbH & Co. KG\nKommanditgesellschaft\nSiek\n\nZu Eintragungsnummer 3 vom 05.11.2024 wird als nicht eingetragen veröffentlicht:   Den Gläubigern ist, wenn sie binnen sechs Monaten nach dem Tag, an dem die Eintragung der Umwandlung als bekannt gemacht gilt, ihren Anspruch nach Grund und Höhe schriftlich anmelden, Sicherheit zu leisten, soweit sie nicht Befriedigung verlangen können. Dieses Recht steht den Gläubigern jedoch nur zu, wenn sie glaubhaft machen, dass durch die Umwandlung die Erfüllung ihrer Forderung gefährdet wird."
    },
    {
      "date": "2024-11-06",
      "id": "92688",
      "original_text": "Löschungsankündigung\nSaarland Amtsgericht Saarbrücken HRB 10236\nWinkelmann GmbH – Saarbrücken",
      "type": "Löschungsankündigung",
      "state": "Saarland",
      "amtsgericht": "Amtsgericht Saarbrücken",
      "registernummer": "HRB 10236",
      "registerart": "HRB",
      "company_name": "Winkelmann GmbH",
      "company_seat": "Saarbrücken",
      "details": "06.11.2024 (Bekanntmachungsdatum)\n\nSaarland Amtsgericht Saarbrücken HRB 10236\nLöschungsankündigung\n\nWinkelmann GmbH\nGesellschaft mit beschränkter Haftung\nSaarbrücken\n\nEs ist beabsichtigt, die Gesellschaft von Amts wegen gemäß § 394 FamFG wegen Vermögenslosigkeit zu löschen.\nGegen die Löschung von Amts wegen ist das Rechtsmittel des Widerspruchs statthaft. Der Widerspruch ist binnen einer Frist zwei Monaten beginnend mit dem Tag dieser Veröffentlichung durch Einreichen eines Widerspruchsschreibens -schriftlich oder zur Niederschrift der Geschäftsstelle beim Amtsgericht Saarbrücken, -zentrales Handelsregister-, Mainzerstr.178, 66121 Saarbrücken einzulegen.\nDer Widerspruch muss die Bezeichnung der angefochtenen Löschungsankündigung enthalten sowie die Erklärung, dass Widerspruch eingelegt wird. Er ist vom Widerspruchsführer oder seinem Bevollmächtigten zu unterzeichnen.\nDas Widerspruchsschreiben kann auch in der Form eines elektronischen Dokumentes eingereicht werden, das mit einer qualifizierten elektronischen Signatur nach dem Signaturgesetz versehen sein muss (§§ 14 Abs. 2 FamFG, 130a, 298 ZPO)."
    },
    {
      "date": "2024-11-06",
      "id": "92689",
      "original_text": "Registerbekanntmachung nach dem Umwandlungsgesetz\nSchleswig-Holstein Amtsgericht Lübeck HRA 11312\nReinhardt GmbH & Co.KG – Eutin",
      "type": "Registerbekanntmachung nach dem Umwandlungsgesetz",
      "state": "Schleswig-Holstein",
      "amtsgericht": "Amtsgericht Lübeck",
      "registernummer": "HRA 11312",
      "registerart": "HRA",
      "company_name": "Reinhardt GmbH & Co.KG",
      "company_seat": "Eutin",
      "details": "06.11.2024 (Bekanntmachungsdatum)\n\nSchleswig-Holstein Amtsgericht Lübeck HRA 11312\nRegisterbekanntmachung nach dem Umwandlungsgesetz 05.11.2024 (Eintragungsdatum)\n\nReinhardt GmbH & Co.KG\nKommanditgesellschaft\nEutin\n\nZu Eintragungsnummer 1 vom 05.11.2024 wird als nicht eingetragen veröffentlicht: Den Gläubigern ist, wenn sie binnen sechs Monaten nach dem Tag, an dem die Eintragung der Umwandlung als bekannt gemacht gilt, ihren Anspruch nach Grund und Höhe schriftlich anmelden, Sicherheit zu leisten, soweit sie nicht Befriedigung verlangen können. Dieses Recht steht den Gläubigern jedoch nur zu, wenn sie glaubhaft machen, dass durch die Umwandlung die Erfüllung ihrer Forderung gefährdet wird."
    },
    {
      "date": "2024-11-06",
      "id": "92690",
      "original_text": "Löschungsankündigung\nBrandenburg Amtsgericht Potsdam HRB 27501\nKAIYÜ Immobilien GmbH – Potsdam",
      "type": "Löschungsankündigung",
      "state": "Brandenburg",
      "amtsgericht": "Amtsgericht Potsdam",
      "registernummer": "HRB 27501",
      "registerart": "HRB",
      "company_name": "KAIYÜ Immobilien GmbH",
      "company_seat": "Potsdam",
      "details": "06.11.2024 (Bekanntmachungsdatum)\n\nBrandenburg Amtsgericht Potsdam HRB 27501\nLöschungsankündigung\n\nKAIYÜ Immobilien GmbH\nGesellschaft mit beschränkter Haftung\nPotsdam\n\nBei der nachstehenden Gesellschaft wird das Amtslöschungsverfahren gemäß § 394 FamFG eingeleitet. Widerspruchsfrist: 8 Wochen"
    },
    {
      "date": "2024-11-06",
      "id": "92691",
      "original_text": "Löschungsankündigung\nBerlin Amtsgericht Berlin (Charlottenburg) HRB 141464\nNiceTime GmbH – Berlin",
      "type": "Löschungsankündigung",
      "state": "Berlin",
      "amtsgericht": "Amtsgericht Berlin (Charlottenburg)",
      "registernummer": "HRB 141464",
      "registerart": "HRB",
      "company_name": "NiceTime GmbH",
      "company_seat": "Berlin",
      "details": "06.11.2024 (Bekanntmachungsdatum)\n\nBerlin Amtsgericht Berlin (Charlottenburg) HRB 141464\nLöschungsankündigung\n\nNiceTime GmbH\nGesellschaft mit beschränkter Haftung\nBerlin\n\nBei der nachstehenden Gesellschaft wird das Amtslöschungsverfahren gemäß § 394 FamFG eingeleitet. Widerspruchsfrist 6 Wochen"
    },
    {
      "date": "2024-11-06",
      "id": "92692",
      "original_text": "Registerbekanntmachung nach dem Umwandlungsgesetz\nNordrhein-Westfalen Amtsgericht Coesfeld HRA 9975\nManfred Schöttler e.K. – Velen",
      "type": "Registerbekanntmachung nach dem Umwandlungsgesetz",
      "state": "Nordrhein-Westfalen",
      "amtsgericht": "Amtsgericht Coesfeld",
      "registernummer": "HRA 9975",
      "registerart": "HRA",
      "company_name": "Manfred Schöttler e.K.",
      "company_seat": "Velen",
      "details": "06.11.2024 (Bekanntmachungsdatum)\n\nNordrhein-Westfalen Amtsgericht Coesfeld HRA 9975\nRegisterbekanntmachung nach dem Umwandlungsgesetz 16.10.2024 (Eintragungsdatum)\n\nManfred Schöttler e.K.\nEinzelkaufmann\nVelen\n\nDen Gläubigern der an der Ausgliederung beteiligten Rechtsträger ist, wenn sie binnen sechs Monaten nach dem Tag, an dem die Eintragung der Ausgliederung in das Register des Sitzes desjenigen Rechtsträgers, dessen Gläubiger sie sind, nach § 19 Absatz 3 UmwG als bekanntgemacht gilt, ihren Anspruch nach Grund und Höhe schriftlich anmelden, Sicherheit zu leisten, soweit sie nicht Befriedigung verlangen können. Dieses Recht steht den Gläubigern jedoch nur zu, wenn sie glaubhaft machen, dass durch die Erfüllung ihrer Forderung gefährdet wird."
    },
    {
      "date": "2024-11-06",
      "id": "92693",
      "original_text": "Registerbekanntmachung nach dem Umwandlungsgesetz\nSaarland Amtsgericht Saarbrücken HRB 16784\nKlos Automobile GmbH – Marpingen",
      "type": "Registerbekanntmachung nach dem Umwandlungsgesetz",
      "state": "Saarland",
      "amtsgericht": "Amtsgericht Saarbrücken",
      "registernummer": "HRB 16784",
      "registerart": "HRB",
      "company_name": "Klos Automobile GmbH",
      "company_seat": "Marpingen",
      "details": "06.11.2024 (Bekanntmachungsdatum)\n\nSaarland Amtsgericht Saarbrücken HRB 16784\nRegisterbekanntmachung nach dem Umwandlungsgesetz 06.11.2024 (Eintragungsdatum)\n\nKlos Automobile GmbH\nGesellschaft mit beschränkter Haftung\nMarpingen\n\nAls nicht eingetragen wird bekannt gemacht: Den Gläubigern der an der Verschmelzung beteiligten Gesellschaften ist, wenn sie binnen sechs Monaten nach dem Tag, an dem die Eintragung der Verschmelzung in das Register des Sitzes desjenigen Rechtsträgers, dessen Gläubiger sie sind, nach § 19 Absatz 3 UmwG bekannt gemacht worden ist, ihren Anspruch nach Grund und Höhe schriftlich anmelden, Sicherheit zu leisten, soweit sie nicht Befriedigung verlangen können. Dieses Recht steht den Gläubigern jedoch nur zu, wenn sie glaubhaft machen, dass durch die Verschmelzung die Erfüllung ihrer Forderung gefährdet wird."
    },
    {
      "date": "2024-11-06",
      "id": "92694",
      "original_text": "Registerbekanntmachung nach dem Umwandlungsgesetz\nHamburg Amtsgericht Hamburg HRB 189278\nKrasniqi Garten- und Landschaftsbau GmbH – Hamburg",
      "type": "Registerbekanntmachung nach dem Umwandlungsgesetz",
      "state": "Hamburg",
      "amtsgericht": "Amtsgericht Hamburg",
      "registernummer": "HRB 189278",
      "registerart": "HRB",
      "company_name": "Krasniqi Garten- und Landschaftsbau GmbH",
      "company_seat": "Hamburg",
      "details": "06.11.2024 (Bekanntmachungsdatum)\n\nHamburg Amtsgericht Hamburg HRB 189278\nRegisterbekanntmachung nach dem Umwandlungsgesetz 06.11.2024 (Eintragungsdatum)\n\nKrasniqi Garten- und Landschaftsbau GmbH\nGesellschaft mit beschränkter Haftung\nHamburg\n\nAls nicht eingetragen wird bekannt gemacht:\nDen Gläubigern der an der Ausgliederung beteiligten Gesellschaften ist, wenn sie binnen sechs Monaten nach dem Tag, an dem die Eintragung der Ausgliederung in das Register des Sitzes desjenigen Rechtsträgers, dessen Gläubiger sie sind, nach § 19 Absatz 3 UmwG als bekannt gemacht gilt, ihren Anspruch nach Grund und Höhe schriftlich anmelden, Sicherheit zu leisten, soweit sie nicht Befriedigung verlangen können. Dieses Recht steht den Gläubigern jedoch nur zu, wenn sie glaubhaft machen, dass durch die Ausgliederung die Erfüllung ihrer Forderung gefährdet wird."
    },
    {
      "date": "2024-11-06",
      "id": "92695",
      "original_text": "Löschungsankündigung\nSachsen-Anhalt Amtsgericht Stendal HRA 5435\nCfM Energie KG – Halle (Saale)",
      "type": "Löschungsankündigung",
      "state": "Sachsen-Anhalt",
      "amtsgericht": "Amtsgericht Stendal",
      "registernummer": "HRA 5435",
      "registerart": "HRA",
      "company_name": "CfM Energie KG",
      "company_seat": "Halle (Saale)",
      "details": "06.11.2024 (Bekanntmachungsdatum)\n\nSachsen-Anhalt Amtsgericht Stendal HRA 5435\nLöschungsankündigung\n\nCfM Energie KG\nKommanditgesellschaft\nHalle (Saale)\n\nDas Registergericht beabsichtigt, nachfolgende im Handelregister eingetragenen Firmen von Amts wegen nach § 394 FamFG zu löschen. Die Frist zu Erhebung eines Widerspruchs wird auf drei Monate festgesetzt."
    },
    {
      "date": "2024-11-06",
      "id": "92696",
      "original_text": "Registerbekanntmachung nach dem Umwandlungsgesetz\nHamburg Amtsgericht Hamburg HRA 131410\nKrasniqi Garten- und Landschaftsbau e.K. – Hamburg",
      "type": "Registerbekanntmachung nach dem Umwandlungsgesetz",
      "state": "Hamburg",
      "amtsgericht": "Amtsgericht Hamburg",
      "registernummer": "HRA 131410",
      "registerart": "HRA",
      "company_name": "Krasniqi Garten- und Landschaftsbau e.K.",
      "company_seat": "Hamburg",
      "details": "06.11.2024 (Bekanntmachungsdatum)\n\nHamburg Amtsgericht Hamburg HRA 131410\nRegisterbekanntmachung nach dem Umwandlungsgesetz 06.11.2024 (Eintragungsdatum)\n\nKrasniqi Garten- und Landschaftsbau e.K.\nEinzelkaufmann\nHamburg\n\nAls nicht eingetragen wird bekannt gemacht:\nDen Gläubigern der an der Ausgliederung beteiligten Gesellschaften ist, wenn sie binnen sechs Monaten nach dem Tag, an dem die Eintragung der Ausgliederung in das Register des Sitzes desjenigen Rechtsträgers, dessen Gläubiger sie sind, nach § 19 Absatz 3 UmwG als bekannt gemacht gilt, ihren Anspruch nach Grund und Höhe schriftlich anmelden, Sicherheit zu leisten, soweit sie nicht Befriedigung verlangen können. Dieses Recht steht den Gläubigern jedoch nur zu, wenn sie glaubhaft machen, dass durch die Ausgliederung die Erfüllung ihrer Forderung gefährdet wird."
    },
    {
      "date": "2024-11-06",
      "id": "92697",
      "original_text": "Registerbekanntmachung nach dem Umwandlungsgesetz\nBaden-Württemberg Amtsgericht Mannheim HRB 703835\nArcanda GmbH – Heidelberg",
      "type": "Registerbekanntmachung nach dem Umwandlungsgesetz",
      "state": "Baden-Württemberg",
      "amtsgericht": "Amtsgericht Mannheim",
      "registernummer": "HRB 703835",
      "registerart": "HRB",
      "company_name": "Arcanda GmbH",
      "company_seat": "Heidelberg",
      "details": "06.11.2024 (Bekanntmachungsdatum)\n\nBaden-Württemberg Amtsgericht Mannheim HRB 703835\nRegisterbekanntmachung nach dem Umwandlungsgesetz 06.11.2024 (Eintragungsdatum)\n\nArcanda GmbH\nGesellschaft mit beschränkter Haftung\nHeidelberg\n\nDen Gläubigern der an der Verschmelzung beteiligten Rechtsträger ist, wenn sie binnen sechs Monaten nach dem Tag, an dem die Eintragung der Verschmelzung in das Register des Sitzes desjenigen Rechtsträgers, dessen Gläubiger sie sind, nach § 19 Abs. 3 UmwG als bekanntgemacht gilt, ihren Anspruch nach Grund und Höhe schriftlich anmelden, Sicherheit zu leisten, soweit sie nicht Befriedigung verlangen können. Dieses Recht steht den Gläubigern jedoch nur zu, wenn sie glaubhaft machen, dass durch die Verschmelzung die Erfüllung ihrer Forderung gefährdet wird."
    },
    {
      "date": "2024-11-06",
      "id": "92698",
      "original_text": "Registerbekanntmachung nach dem Umwandlungsgesetz\nBaden-Württemberg Amtsgericht Mannheim HRB 708530\nTaurus Aktiengesellschaft – Heidelberg",
      "type": "Registerbekanntmachung nach dem Umwandlungsgesetz",
      "state": "Baden-Württemberg",
      "amtsgericht": "Amtsgericht Mannheim",
      "registernummer": "HRB 708530",
      "registerart": "HRB",
      "company_name": "Taurus Aktiengesellschaft",
      "company_seat": "Heidelberg",
      "details": "06.11.2024 (Bekanntmachungsdatum)\n\nBaden-Württemberg Amtsgericht Mannheim HRB 708530\nRegisterbekanntmachung nach dem Umwandlungsgesetz 06.11.2024 (Eintragungsdatum)\n\nTaurus Aktiengesellschaft\nAktiengesellschaft\nHeidelberg\n\nDen Gläubigern der an der Verschmelzung beteiligten Rechtsträger ist, wenn sie binnen sechs Monaten nach dem Tag, an dem die Eintragung der Verschmelzung in das Register des Sitzes desjenigen Rechtsträgers, dessen Gläubiger sie sind, nach § 19 Abs. 3 UmwG als bekanntgemacht gilt, ihren Anspruch nach Grund und Höhe schriftlich anmelden, Sicherheit zu leisten, soweit sie nicht Befriedigung verlangen können. Dieses Recht steht den Gläubigern jedoch nur zu, wenn sie glaubhaft machen, dass durch die Verschmelzung die Erfüllung ihrer Forderung gefährdet wird."
    },
    {
      "date": "2024-11-06",
      "id": "92699",
      "original_text": "Löschungsankündigung\nBrandenburg Amtsgericht Cottbus HRA 3029\nEVITA Sachwert GmbH & Co. KG – Cottbus",
      "type": "Löschungsankündigung",
      "state": "Brandenburg",
      "amtsgericht": "Amtsgericht Cottbus",
      "registernummer": "HRA 3029",
      "registerart": "HRA",
      "company_name": "EVITA Sachwert GmbH & Co. KG",
      "company_seat": "Cottbus",
      "details": "06.11.2024 (Bekanntmachungsdatum)\n\nBrandenburg Amtsgericht Cottbus HRA 3029\nLöschungsankündigung\n\nEVITA Sachwert GmbH & Co. KG\nKommanditgesellschaft\nCottbus\n\nIm Handelsregister des Amtsgerichts Cottbus ist unter dem Aktenzeichen HRA 3029 CB die EVITA Sachwert GmbH & Co. KG mit Sitz in Cottbus eingetragen.\n\nEs ist beabsichtigt, die Gesellschaft gem. § 394 FamFG aufgrund Vermögenslosigkeit von Amts wegen zu löschen.\nHiergegen kann innerhalb von 1 Monat Widerspruch eingelegt werden. Der Widerspruch ist durch schriftliche Eingabe oder zu Protokoll der Geschäftsstelle beim Amtsgericht Cottbus zu erheben.\nDie Einreichung kann auch elektronisch erfolgen (allerdings nicht per Email). Weitere Informationen zum elektronischen Rechtsverkehr finden Sie auf der Internetseite des Amtsgerichts Cottbus."
    },
    {
      "date": "2024-11-06",
      "id": "92700",
      "original_text": "Löschungsankündigung\nBerlin Amtsgericht Berlin (Charlottenburg) HRB 173797\nUnited Music Berlin UG (haftungsbeschränkt) – Berlin",
      "type": "Löschungsankündigung",
      "state": "Berlin",
      "amtsgericht": "Amtsgericht Berlin (Charlottenburg)",
      "registernummer": "HRB 173797",
      "registerart": "HRB",
      "company_name": "United Music Berlin UG (haftungsbeschränkt)",
      "company_seat": "Berlin",
      "details": "06.11.2024 (Bekanntmachungsdatum)\n\nBerlin Amtsgericht Berlin (Charlottenburg) HRB 173797\nLöschungsankündigung\n\nUnited Music Berlin UG (haftungsbeschränkt)\nGesellschaft mit beschränkter Haftung\nBerlin\n\nBei der nachstehenden Gesellschaft wird das Amtslöschungsverfahren gemäß § 394 FamFG eingeleitet. Widerspruchsfrist 6 Wochen"
    },
    {
      "date": "2024-11-06",
      "id": "92701",
      "original_text": "Löschungsankündigung\nBerlin Amtsgericht Berlin (Charlottenburg) HRA 52976\nSpree SD GmbH & Co. KG – Berlin",
      "type": "Löschungsankündigung",
      "state": "Berlin",
      "amtsgericht": "Amtsgericht Berlin (Charlottenburg)",
      "registernummer": "HRA 52976",
      "registerart": "HRA",
      "company_name": "Spree SD GmbH & Co. KG",
      "company_seat": "Berlin",
      "details": "06.11.2024 (Bekanntmachungsdatum)\n\nBerlin Amtsgericht Berlin (Charlottenburg) HRA 52976\nLöschungsankündigung\n\nSpree SD GmbH & Co. KG\nKommanditgesellschaft\nBerlin\n\nBei dem nachstehenden Unternehmen / der nachstehenden Gesellschaft wird das Amtslöschungsverfahren gemäß § 31 Abs. 2 HGB eingeleitet. Widerspruchsfrist 1 Monat"
    },
    {
      "date": "2024-11-06",
      "id": "92702",
      "original_text": "Löschungsankündigung\nSaarland Amtsgericht Saarbrücken HRB 19929\nRenad Kunststoffe und Entwicklung GmbH – Bexbach",
      "type": "Löschungsankündigung",
      "state": "Saarland",
      "amtsgericht": "Amtsgericht Saarbrücken",
      "registernummer": "HRB 19929",
      "registerart": "HRB",
      "company_name": "Renad Kunststoffe und Entwicklung GmbH",
      "company_seat": "Bexbach",
      "details": "06.11.2024 (Bekanntmachungsdatum)\n\nSaarland Amtsgericht Saarbrücken HRB 19929\nLöschungsankündigung\n\nRenad Kunststoffe und Entwicklung GmbH\nGesellschaft mit beschränkter Haftung\nBexbach\n\nEs ist beabsichtigt, die Gesellschaft von Amts wegen gemäß § 394 FamFG wegen Vermögenslosigkeit zu löschen.\nGegen die Löschung von Amts wegen ist das Rechtsmittel des Widerspruchs statthaft. Der Widerspruch ist binnen einer Frist zwei Monaten beginnend mit dem Tag dieser Veröffentlichung durch Einreichen eines Widerspruchsschreibens -schriftlich oder zur Niederschrift der Geschäftsstelle beim Amtsgericht Saarbrücken, -zentrales Handelsregister-, Mainzerstr.178, 66121 Saarbrücken einzulegen.\nDer Widerspruch muss die Bezeichnung der angefochtenen Löschungsankündigung enthalten sowie die Erklärung, dass Widerspruch eingelegt wird. Er ist vom Widerspruchsführer oder seinem Bevollmächtigten zu unterzeichnen.\nDas Widerspruchsschreiben kann auch in der Form eines elektronischen Dokumentes eingereicht werden, das mit einer qualifizierten elektronischen Signatur nach dem Signaturgesetz versehen sein muss (§§ 14 Abs. 2 FamFG, 130a, 298 ZPO)."
    },
    {
      "date": "2024-11-06",
      "id": "92703",
      "original_text": "Löschungsankündigung\nBaden-Württemberg Amtsgericht Freiburg HRB 371263\nGrimm + Litterst GmbH – Rheinau",
      "type": "Löschungsankündigung",
      "state": "Baden-Württemberg",
      "amtsgericht": "Amtsgericht Freiburg",
      "registernummer": "HRB 371263",
      "registerart": "HRB",
      "company_name": "Grimm + Litterst GmbH",
      "company_seat": "Rheinau",
      "details": "06.11.2024 (Bekanntmachungsdatum)\n\nBaden-Württemberg Amtsgericht Freiburg HRB 371263\nLöschungsankündigung 06.11.2024 (Eintragungsdatum)\n\nGrimm + Litterst GmbH\nGesellschaft mit beschränkter Haftung\nRheinau\n\nAls nicht eingetragen wird bekanntgemacht:\nDas Gericht beabsichtigt, die Gesellschaft wegen Vermögenslosigkeit im Handelsregister von Amts wegen nach § 394 FamFG zu löschen. Die Frist zur Geltendmachung eines Widerspruchs gegen die beabsichtigte Löschung ist auf einen Monat ab Veröffentlichung bestimmt."
    },
    {
      "date": "2024-11-06",
      "id": "92704",
      "original_text": "Sonstige Registerbekanntmachung\nBaden-Württemberg Amtsgericht Mannheim HRB 107846\nStadtwerke Karlsruhe GmbH – Karlsruhe",
      "type": "Sonstige Registerbekanntmachung",
      "state": "Baden-Württemberg",
      "amtsgericht": "Amtsgericht Mannheim",
      "registernummer": "HRB 107846",
      "registerart": "HRB",
      "company_name": "Stadtwerke Karlsruhe GmbH",
      "company_seat": "Karlsruhe",
      "details": "06.11.2024 (Bekanntmachungsdatum)\n\nBaden-Württemberg Amtsgericht Mannheim HRB 107846\nSonstige Registerbekanntmachung\n\nStadtwerke Karlsruhe GmbH\nGesellschaft mit beschränkter Haftung\nKarlsruhe\n\nDie Gesellschaft hat am 30.10.2024 die Liste über die Zusammensetzung des Aufsichtsrats zum Handelsregister eingereicht."
    },
    {
      "date": "2024-11-06",
      "id": "92705",
      "original_text": "Löschungsankündigung\nBerlin Amtsgericht Berlin (Charlottenburg) HRB 207286\nBK Bau Service UG (haftungsbeschränkt) – Berlin",
      "type": "Löschungsankündigung",
      "state": "Berlin",
      "amtsgericht": "Amtsgericht Berlin (Charlottenburg)",
      "registernummer": "HRB 207286",
      "registerart": "HRB",
      "company_name": "BK Bau Service UG (haftungsbeschränkt)",
      "company_seat": "Berlin",
      "details": "06.11.2024 (Bekanntmachungsdatum)\n\nBerlin Amtsgericht Berlin (Charlottenburg) HRB 207286\nLöschungsankündigung\n\nBK Bau Service UG  (haftungsbeschränkt)\nGesellschaft mit beschränkter Haftung\nBerlin\n\nBei der nachstehenden Gesellschaft wird das Amtslöschungsverfahren gemäß § 394 FamFG eingeleitet. Widerspruchsfrist 6 Wochen"
    },
    {
      "date": "2024-11-06",
      "id": "92706",
      "original_text": "Löschungsankündigung\nSachsen-Anhalt Amtsgericht Stendal HRA 11805\nLothar Hanisch GmbH & Co. KG – Sandersdorf-Brehna",
      "type": "Löschungsankündigung",
      "state": "Sachsen-Anhalt",
      "amtsgericht": "Amtsgericht Stendal",
      "registernummer": "HRA 11805",
      "registerart": "HRA",
      "company_name": "Lothar Hanisch GmbH & Co. KG",
      "company_seat": "Sandersdorf-Brehna",
      "details": "06.11.2024 (Bekanntmachungsdatum)\n\nSachsen-Anhalt Amtsgericht Stendal HRA 11805\nLöschungsankündigung 29.06.2021 (Eintragungsdatum)\n\nLothar Hanisch GmbH & Co. KG\nKommanditgesellschaft\nSandersdorf-Brehna\n\nDas Registergericht beabsichtigt, nachfolgende im Handelsregister eingetragenen Firmen von Amts wegen nach § 394 FamFG zu löschen. Die Frist zu Erhebung eines Widerspruchs wird auf einen Monat festgesetzt."
    },
    {
      "date": "2024-11-06",
      "id": "92707",
      "original_text": "Registerbekanntmachung nach dem Umwandlungsgesetz\nBerlin Amtsgericht Berlin (Charlottenburg) HRA 63423\nTarek Askar e.K. – Berlin",
      "type": "Registerbekanntmachung nach dem Umwandlungsgesetz",
      "state": "Berlin",
      "amtsgericht": "Amtsgericht Berlin (Charlottenburg)",
      "registernummer": "HRA 63423",
      "registerart": "HRA",
      "company_name": "Tarek Askar e.K.",
      "company_seat": "Berlin",
      "details": "06.11.2024 (Bekanntmachungsdatum)\n\nBerlin Amtsgericht Berlin (Charlottenburg) HRA 63423\nRegisterbekanntmachung nach dem Umwandlungsgesetz 05.11.2024 (Eintragungsdatum)\n\nTarek Askar e.K.\nEinzelkaufmann / Einzelkauffrau\nBerlin\n\nZu Eintragungsnummer 2 vom 05.11.2024 wird als nicht eingetragen veröffentlicht: Den Gläubigern der an der Verschmelzung beteiligten Rechtsträger ist, wenn sie binnen sechs Monaten nach dem Tag, an dem die Eintragung der Verschmelzung in das Register des Sitzes desjenigen Rechtsträgers, dessen Gläubiger sie sind, als bekannt gemacht gilt, ihren Anspruch nach Grund und Höhe schriftlich anmelden, Sicherheit zu leisten, soweit sie nicht Befriedigung verlangen können. Dieses Recht steht den Gläubigern jedoch nur zu, wenn sie glaubhaft machen, dass durch die Verschmelzung die Erfüllung ihrer Forderung gefährdet wird. Das Recht, Sicherheitsleistung zu verlangen, steht Gläubigern nicht zu, die im Falle der Insolvenz ein Recht auf vorzugsweise Befriedigung aus einer Deckungsmasse haben, die nach gesetzlicher Vorschrift zu ihrem Schutz errichtet und staatlich überwacht ist."
    },
    {
      "date": "2024-11-06",
      "id": "92708",
      "original_text": "Registerbekanntmachung nach dem Umwandlungsgesetz\nBerlin Amtsgericht Berlin (Charlottenburg) HRB 174383\nKadorf GmbH – Berlin",
      "type": "Registerbekanntmachung nach dem Umwandlungsgesetz",
      "state": "Berlin",
      "amtsgericht": "Amtsgericht Berlin (Charlottenburg)",
      "registernummer": "HRB 174383",
      "registerart": "HRB",
      "company_name": "Kadorf GmbH",
      "company_seat": "Berlin",
      "details": "06.11.2024 (Bekanntmachungsdatum)\n\nBerlin Amtsgericht Berlin (Charlottenburg) HRB 174383\nRegisterbekanntmachung nach dem Umwandlungsgesetz 05.11.2024 (Eintragungsdatum)\n\nKadorf GmbH\nGesellschaft mit beschränkter Haftung\nBerlin\n\nZu Eintragungsnummer 7 vom 05.11.2024 wird als nicht eingetragen veröffentlicht: Den Gläubigern der an der Verschmelzung beteiligten Rechtsträger ist, wenn sie binnen sechs Monaten nach dem Tag, an dem die Eintragung der Verschmelzung in das Register des Sitzes desjenigen Rechtsträgers, dessen Gläubiger sie sind, als bekannt gemacht gilt, ihren Anspruch nach Grund und Höhe schriftlich anmelden, Sicherheit zu leisten, soweit sie nicht Befriedigung verlangen können. Dieses Recht steht den Gläubigern jedoch nur zu, wenn sie glaubhaft machen, dass durch die Verschmelzung die Erfüllung ihrer Forderung gefährdet wird. Das Recht, Sicherheitsleistung zu verlangen, steht Gläubigern nicht zu, die im Falle der Insolvenz ein Recht auf vorzugsweise Befriedigung aus einer Deckungsmasse haben, die nach gesetzlicher Vorschrift zu ihrem Schutz errichtet und staatlich überwacht ist."
    },
    {
      "date": "2024-11-06",
      "id": "92709",
      "original_text": "Löschungsankündigung\nBerlin Amtsgericht Berlin (Charlottenburg) HRB 122791\naviare consult GmbH – Berlin",
      "type": "Löschungsankündigung",
      "state": "Berlin",
      "amtsgericht": "Amtsgericht Berlin (Charlottenburg)",
      "registernummer": "HRB 122791",
      "registerart": "HRB",
      "company_name": "aviare consult GmbH",
      "company_seat": "Berlin",
      "details": "06.11.2024 (Bekanntmachungsdatum)\n\nBerlin Amtsgericht Berlin (Charlottenburg) HRB 122791\nLöschungsankündigung\n\naviare consult GmbH\nGesellschaft mit beschränkter Haftung\nBerlin\n\nBei der nachstehenden Gesellschaft wird das Amtslöschungsverfahren gemäß § 394 FamFG eingeleitet. Widerspruchsfrist 6 Wochen"
    },
    {
      "date": "2024-11-06",
      "id": "92710",
      "original_text": "Löschungsankündigung\nBaden-Württemberg Amtsgericht Freiburg HRB 706591\nDentaCore GmbH – Murg",
      "type": "Löschungsankündigung",
      "state": "Baden-Württemberg",
      "amtsgericht": "Amtsgericht Freiburg",
      "registernummer": "HRB 706591",
      "registerart": "HRB",
      "company_name": "DentaCore GmbH",
      "company_seat": "Murg",
      "details": "06.11.2024 (Bekanntmachungsdatum)\n\nBaden-Württemberg Amtsgericht Freiburg HRB 706591\nLöschungsankündigung\n\nDentaCore GmbH\nGesellschaft mit beschränkter Haftung\nMurg\n\nDas Gericht beabsichtigt, die Gesellschaft wegen Vermögenslosigkeit im Handelsregister von Amts wegen nach § 394 FamFG zu löschen. Die Frist zur Geltendmachung eines Widerspruchs gegen die beabsichtigte Löschung ist auf einen Monat ab Veröffentlichung bestimmt."
    },
    {
      "date": "2024-11-06",
      "id": "92711",
      "original_text": "Sonstige Registerbekanntmachung\nBerlin Amtsgericht Berlin (Charlottenburg) HRB 264097\nO & I Autovermietung GmbH – Berlin",
      "type": "Sonstige Registerbekanntmachung",
      "state": "Berlin",
      "amtsgericht": "Amtsgericht Berlin (Charlottenburg)",
      "registernummer": "HRB 264097",
      "registerart": "HRB",
      "company_name": "O & I Autovermietung GmbH",
      "company_seat": "Berlin",
      "details": "06.11.2024 (Bekanntmachungsdatum)\n\nBerlin Amtsgericht Berlin (Charlottenburg) HRB 264097\nSonstige Registerbekanntmachung\n\nO & I Autovermietung GmbH\nGesellschaft mit beschränkter Haftung\nBerlin\n\nAls nicht eingetragen wird veröffentlicht: Den Gläubigern der an der Verschmelzung beteiligten Rechtsträger ist, wenn sie binnen sechs Monaten nach dem Tag, an dem die Eintragung der Verschmelzung in das Register des Sitzes desjenigen Rechtsträgers, dessen Gläubiger sie sind, als bekannt gemacht gilt, ihren Anspruch nach Grund und Höhe schriftlich anmelden, Sicherheit zu leisten, soweit sie nicht Befriedigung verlangen können. Dieses Recht steht den Gläubigern jedoch nur zu, wenn sie glaubhaft machen, dass durch die Verschmelzung die Erfüllung ihrer Forderung gefährdet wird. Das Recht, Sicherheitsleistung zu verlangen, steht Gläubigern nicht zu, die im Falle der Insolvenz ein Recht auf vorzugsweise Befriedigung aus einer Deckungsmasse haben, die nach gesetzlicher Vorschrift zu ihrem Schutz errichtet und staatlich überwacht ist."
    },
    {
      "date": "2024-11-06",
      "id": "92712",
      "original_text": "Registerbekanntmachung nach dem Umwandlungsgesetz\nBerlin Amtsgericht Berlin (Charlottenburg) HRB 128182\nalma Vermögensverwaltung GmbH – Berlin",
      "type": "Registerbekanntmachung nach dem Umwandlungsgesetz",
      "state": "Berlin",
      "amtsgericht": "Amtsgericht Berlin (Charlottenburg)",
      "registernummer": "HRB 128182",
      "registerart": "HRB",
      "company_name": "alma Vermögensverwaltung GmbH",
      "company_seat": "Berlin",
      "details": "06.11.2024 (Bekanntmachungsdatum)\n\nBerlin Amtsgericht Berlin (Charlottenburg) HRB 128182\nRegisterbekanntmachung nach dem Umwandlungsgesetz 05.11.2024 (Eintragungsdatum)\n\nalma Vermögensverwaltung GmbH\nGesellschaft mit beschränkter Haftung\nBerlin\n\nZu Eintragungsnummer 8 vom 05.11.2024 wird als nicht eingetragen veröffentlicht:Den Gläubigern der an der Verschmelzung beteiligten Rechtsträger ist, wenn sie binnen sechs Monaten nach dem Tag, an dem die Eintragung der Verschmelzung in das Register des Sitzes desjenigen Rechtsträgers, dessen Gläubiger sie sind, als bekannt gemacht gilt, ihren Anspruch nach Grund und Höhe schriftlich anmelden, Sicherheit zu leisten, soweit sie nicht Befriedigung verlangen können. Dieses Recht steht den Gläubigern jedoch nur zu, wenn sie glaubhaft machen, dass durch die Verschmelzung die Erfüllung ihrer Forderung gefährdet wird. Das Recht, Sicherheitsleistung zu verlangen, steht Gläubigern nicht zu, die im Falle der Insolvenz ein Recht auf vorzugsweise Befriedigung aus einer Deckungsmasse haben, die nach gesetzlicher Vorschrift zu ihrem Schutz errichtet und staatlich überwacht ist."
    },
    {
      "date": "2024-11-06",
      "id": "92713",
      "original_text": "Löschungsankündigung\nSchleswig-Holstein Amtsgericht Kiel HRA 5857\nTischendorf Möbeltransport & Service GmbH & Co. KG – Kiel",
      "type": "Löschungsankündigung",
      "state": "Schleswig-Holstein",
      "amtsgericht": "Amtsgericht Kiel",
      "registernummer": "HRA 5857",
      "registerart": "HRA",
      "company_name": "Tischendorf Möbeltransport & Service GmbH & Co. KG",
      "company_seat": "Kiel",
      "details": "06.11.2024 (Bekanntmachungsdatum)\n\nSchleswig-Holstein Amtsgericht Kiel HRA 5857\nLöschungsankündigung\n\nTischendorf Möbeltransport & Service GmbH & Co. KG\nKommanditgesellschaft\nKiel\n\nEs ist die Löschung der nachstehenden Gesellschaft wegen Vermögenslosigkeit gemäß § 394 FamFG beabsichtigt. Widerspruchsfrist: 2 Monate."
    },
    {
      "date": "2024-11-06",
      "id": "92714",
      "original_text": "Registerbekanntmachung nach dem Umwandlungsgesetz\nBaden-Württemberg Amtsgericht Stuttgart HRB 745931\nMedCon GmbH – Stuttgart",
      "type": "Registerbekanntmachung nach dem Umwandlungsgesetz",
      "state": "Baden-Württemberg",
      "amtsgericht": "Amtsgericht Stuttgart",
      "registernummer": "HRB 745931",
      "registerart": "HRB",
      "company_name": "MedCon GmbH",
      "company_seat": "Stuttgart",
      "details": "06.11.2024 (Bekanntmachungsdatum)\n\nBaden-Württemberg Amtsgericht Stuttgart HRB 745931\nRegisterbekanntmachung nach dem Umwandlungsgesetz 06.11.2024 (Eintragungsdatum)\n\nMedCon GmbH\nGesellschaft mit beschränkter Haftung\nStuttgart\n\nAls nicht eingetragen wird bekanntgemacht:\nDen Gläubigern der an der Verschmelzung beteiligten Rechtsträger ist, wenn sie binnen sechs Monaten nach dem Tag, an dem die Eintragung der Verschmelzung in das Register des Sitzes desjenigen Rechtsträgers, dessen Gläubiger sie sind, nach § 19 Abs. 3 UmwG als bekanntgemacht gilt, ihren Anspruch nach Grund und Höhe schriftlich anmelden, Sicherheit zu leisten, soweit sie nicht Befriedigung verlangen können. Dieses Recht steht den Gläubigern jedoch nur zu, wenn sie glaubhaft machen, dass durch die Verschmelzung die Erfüllung ihrer Forderung gefährdet wird."
    },
    {
      "date": "2024-11-06",
      "id": "92715",
      "original_text": "Registerbekanntmachung nach dem Umwandlungsgesetz\nBerlin Amtsgericht Berlin (Charlottenburg) HRB 212648\nAlmafa Immobilien Zweiunddreißig GmbH – Berlin",
      "type": "Registerbekanntmachung nach dem Umwandlungsgesetz",
      "state": "Berlin",
      "amtsgericht": "Amtsgericht Berlin (Charlottenburg)",
      "registernummer": "HRB 212648",
      "registerart": "HRB",
      "company_name": "Almafa Immobilien Zweiunddreißig GmbH",
      "company_seat": "Berlin",
      "details": "06.11.2024 (Bekanntmachungsdatum)\n\nBerlin Amtsgericht Berlin (Charlottenburg) HRB 212648\nRegisterbekanntmachung nach dem Umwandlungsgesetz 05.11.2024 (Eintragungsdatum)\n\nAlmafa Immobilien Zweiunddreißig GmbH\nGesellschaft mit beschränkter Haftung\nBerlin\n\nZu Eintragungsnummer 3 vom 05.11.2024 wird als nicht eingetragen veröffentlicht:Den Gläubigern der an der Verschmelzung beteiligten Rechtsträger ist, wenn sie binnen sechs Monaten nach dem Tag, an dem die Eintragung der Verschmelzung in das Register des Sitzes desjenigen Rechtsträgers, dessen Gläubiger sie sind, als bekannt gemacht gilt, ihren Anspruch nach Grund und Höhe schriftlich anmelden, Sicherheit zu leisten, soweit sie nicht Befriedigung verlangen können. Dieses Recht steht den Gläubigern jedoch nur zu, wenn sie glaubhaft machen, dass durch die Verschmelzung die Erfüllung ihrer Forderung gefährdet wird. Das Recht, Sicherheitsleistung zu verlangen, steht Gläubigern nicht zu, die im Falle der Insolvenz ein Recht auf vorzugsweise Befriedigung aus einer Deckungsmasse haben, die nach gesetzlicher Vorschrift zu ihrem Schutz errichtet und staatlich überwacht ist."
    },
    {
      "date": "2024-11-06",
      "id": "92716",
      "original_text": "Registerbekanntmachung nach dem Umwandlungsgesetz\nBerlin Amtsgericht Berlin (Charlottenburg) HRB 234198\nCCN Beteiligung UG (haftungsbeschränkt) – Berlin",
      "type": "Registerbekanntmachung nach dem Umwandlungsgesetz",
      "state": "Berlin",
      "amtsgericht": "Amtsgericht Berlin (Charlottenburg)",
      "registernummer": "HRB 234198",
      "registerart": "HRB",
      "company_name": "CCN Beteiligung UG (haftungsbeschränkt)",
      "company_seat": "Berlin",
      "details": "06.11.2024 (Bekanntmachungsdatum)\n\nBerlin Amtsgericht Berlin (Charlottenburg) HRB 234198\nRegisterbekanntmachung nach dem Umwandlungsgesetz 04.11.2024 (Eintragungsdatum)\n\nCCN Beteiligung UG (haftungsbeschränkt)\nGesellschaft mit beschränkter Haftung\nBerlin\n\nZu Eintragungsnummer 2 vom 04.11.2024 wird als nicht eingetragen veröffentlicht:Den Gläubigern der an der Verschmelzung beteiligten Rechtsträger ist, wenn sie binnen sechs Monaten nach dem Tag, an dem die Eintragung der Verschmelzung in das Register des Sitzes desjenigen Rechtsträgers, dessen Gläubiger sie sind, als bekannt gemacht gilt, ihren Anspruch nach Grund und Höhe schriftlich anmelden, Sicherheit zu leisten, soweit sie nicht Befriedigung verlangen können. Dieses Recht steht den Gläubigern jedoch nur zu, wenn sie glaubhaft machen, dass durch die Verschmelzung die Erfüllung ihrer Forderung gefährdet wird. Das Recht, Sicherheitsleistung zu verlangen, steht Gläubigern nicht zu, die im Falle der Insolvenz ein Recht auf vorzugsweise Befriedigung aus einer Deckungsmasse haben, die nach gesetzlicher Vorschrift zu ihrem Schutz errichtet und staatlich überwacht ist."
    },
    {
      "date": "2024-11-06",
      "id": "92717",
      "original_text": "Registerbekanntmachung nach dem Umwandlungsgesetz\nSachsen-Anhalt Amtsgericht Stendal HRB 113929\nISKIA-Verwaltungs-GmbH – Harsleben",
      "type": "Registerbekanntmachung nach dem Umwandlungsgesetz",
      "state": "Sachsen-Anhalt",
      "amtsgericht": "Amtsgericht Stendal",
      "registernummer": "HRB 113929",
      "registerart": "HRB",
      "company_name": "ISKIA-Verwaltungs-GmbH",
      "company_seat": "Harsleben",
      "details": "06.11.2024 (Bekanntmachungsdatum)\n\nSachsen-Anhalt Amtsgericht Stendal HRB 113929\nRegisterbekanntmachung nach dem Umwandlungsgesetz 06.11.2024 (Eintragungsdatum)\n\nISKIA-Verwaltungs-GmbH\nGesellschaft mit beschränkter Haftung\nHarsleben\n\nNicht eingetragen:\nDen Gläubigern der an der Verschmelzung beteiligten Rechtsträger ist, wenn sie binnen sechs Monaten nach dem Tag, an dem die Eintragung der Verschmelzung nach § 19 Abs. 3 UmwG als bekanntgemacht gilt, ihren Anspruch nach Grund und Höhe schriftlich anmelden, Sicherheit zu leisten, soweit sie nicht Befriedigung verlangen können. Dieses Recht steht ihnen jedoch nur zu, wenn sie glaubhaft machen, dass durch die Verschmelzung die Erfüllung ihrer Forderung gefährdet wird."
    },
    {
      "date": "2024-11-06",
      "id": "92718",
      "original_text": "Einreichung neuer Dokumente\nBaden-Württemberg Amtsgericht Ulm HRB 701860\nStadtwerke Schwäbisch Gmünd GmbH – Schwäbisch Gmünd",
      "type": "Einreichung neuer Dokumente",
      "state": "Baden-Württemberg",
      "amtsgericht": "Amtsgericht Ulm",
      "registernummer": "HRB 701860",
      "registerart": "HRB",
      "company_name": "Stadtwerke Schwäbisch Gmünd GmbH",
      "company_seat": "Schwäbisch Gmünd",
      "details": "06.11.2024 (Bekanntmachungsdatum)\n\nBaden-Württemberg Amtsgericht Ulm HRB 701860\nEinreichung neuer Dokumente 06.11.2024 (Eintragungsdatum)\n\nStadtwerke Schwäbisch Gmünd GmbH\nGesellschaft mit beschränkter Haftung\nSchwäbisch Gmünd\n\nDie Gesellschaft hat am 29.10.2024 die Liste über die Zusammensetzung des Aufsichtsrats zum Handelsregister eingereicht."
    },
    {
      "date": "2024-11-06",
      "id": "92719",
      "original_text": "Einreichung neuer Dokumente\nMecklenburg-Vorpommern Amtsgericht Neubrandenburg HRB 589\nW O G E W A Wohnungsbaugesellschaft Waren mbH – Waren",
      "type": "Einreichung neuer Dokumente",
      "state": "Mecklenburg-Vorpommern",
      "amtsgericht": "Amtsgericht Neubrandenburg",
      "registernummer": "HRB 589",
      "registerart": "HRB",
      "company_name": "W O G E W A Wohnungsbaugesellschaft Waren mbH",
      "company_seat": "Waren",
      "details": "06.11.2024 (Bekanntmachungsdatum)\n\nMecklenburg-Vorpommern Amtsgericht Neubrandenburg HRB 589\nEinreichung neuer Dokumente\n\nW O G E W A Wohnungsbaugesellschaft Waren mbH\nGesellschaft mit beschränkter Haftung\nWaren\n\nEine Liste der Mitglieder des Aufsichtsrats ist zum Handelsregister eingereicht worden."
    },
    {
      "date": "2024-11-06",
      "id": "92720",
      "original_text": "Sonstige Registerbekanntmachung\nBerlin Amtsgericht Berlin (Charlottenburg) HRB 195754\n123versichert.de GmbH – Berlin",
      "type": "Sonstige Registerbekanntmachung",
      "state": "Berlin",
      "amtsgericht": "Amtsgericht Berlin (Charlottenburg)",
      "registernummer": "HRB 195754",
      "registerart": "HRB",
      "company_name": "123versichert.de GmbH",
      "company_seat": "Berlin",
      "details": "06.11.2024 (Bekanntmachungsdatum)\n\nBerlin Amtsgericht Berlin (Charlottenburg) HRB 195754\nSonstige Registerbekanntmachung\n\n123versichert.de GmbH\nGesellschaft mit beschränkter Haftung\nBerlin\n\nAls nicht eingetragen wird veröffentlicht: Den Gläubigern der an der Verschmelzung beteiligten Rechtsträger ist, wenn sie binnen sechs Monaten nach dem Tag, an dem die Eintragung der Verschmelzung in das Register des Sitzes desjenigen Rechtsträgers, dessen Gläubiger sie sind, als bekannt gemacht gilt, ihren Anspruch nach Grund und Höhe schriftlich anmelden, Sicherheit zu leisten, soweit sie nicht Befriedigung verlangen können. Dieses Recht steht den Gläubigern jedoch nur zu, wenn sie glaubhaft machen, dass durch die Verschmelzung die Erfüllung ihrer Forderung gefährdet wird. Das Recht, Sicherheitsleistung zu verlangen, steht Gläubigern nicht zu, die im Falle der Insolvenz ein Recht auf vorzugsweise Befriedigung aus einer Deckungsmasse haben, die nach gesetzlicher Vorschrift zu ihrem Schutz errichtet und staatlich überwacht ist."
    },
    {
      "date": "2024-11-06",
      "id": "92721",
      "original_text": "Sonstige Registerbekanntmachung\nBerlin Amtsgericht Berlin (Charlottenburg) HRB 170236\nwefox Germany Holding GmbH – Berlin",
      "type": "Sonstige Registerbekanntmachung",
      "state": "Berlin",
      "amtsgericht": "Amtsgericht Berlin (Charlottenburg)",
      "registernummer": "HRB 170236",
      "registerart": "HRB",
      "company_name": "wefox Germany Holding GmbH",
      "company_seat": "Berlin",
      "details": "06.11.2024 (Bekanntmachungsdatum)\n\nBerlin Amtsgericht Berlin (Charlottenburg) HRB 170236\nSonstige Registerbekanntmachung\n\nwefox Germany Holding GmbH\nGesellschaft mit beschränkter Haftung\nBerlin\n\nAls nicht eingetragen wird veröffentlicht: Den Gläubigern der an der Verschmelzung beteiligten Rechtsträger ist, wenn sie binnen sechs Monaten nach dem Tag, an dem die Eintragung der Verschmelzung in das Register des Sitzes desjenigen Rechtsträgers, dessen Gläubiger sie sind, als bekannt gemacht gilt, ihren Anspruch nach Grund und Höhe schriftlich anmelden, Sicherheit zu leisten, soweit sie nicht Befriedigung verlangen können. Dieses Recht steht den Gläubigern jedoch nur zu, wenn sie glaubhaft machen, dass durch die Verschmelzung die Erfüllung ihrer Forderung gefährdet wird. Das Recht, Sicherheitsleistung zu verlangen, steht Gläubigern nicht zu, die im Falle der Insolvenz ein Recht auf vorzugsweise Befriedigung aus einer Deckungsmasse haben, die nach gesetzlicher Vorschrift zu ihrem Schutz errichtet und staatlich überwacht ist."
    },
    {
      "date": "2024-11-06",
      "id": "92722",
      "original_text": "Einreichung neuer Dokumente\nBaden-Württemberg Amtsgericht Ulm HRB 641260\nÖchsle - Bahn Aktiengesellschaft – Biberach an der Riß",
      "type": "Einreichung neuer Dokumente",
      "state": "Baden-Württemberg",
      "amtsgericht": "Amtsgericht Ulm",
      "registernummer": "HRB 641260",
      "registerart": "HRB",
      "company_name": "Öchsle - Bahn Aktiengesellschaft",
      "company_seat": "Biberach an der Riß",
      "details": "06.11.2024 (Bekanntmachungsdatum)\n\nBaden-Württemberg Amtsgericht Ulm HRB 641260\nEinreichung neuer Dokumente\n\nÖchsle - Bahn Aktiengesellschaft\nAktiengesellschaft\nBiberach an der Riß\n\nDie Gesellschaft hat am 26.09.2024 die Liste über die Zusammensetzung des Aufsichtsrats zum Handelsregister eingereicht."
    },
    {
      "date": "2024-11-06",
      "id": "92723",
      "original_text": "Sonstige Registerbekanntmachung\nBaden-Württemberg Amtsgericht Mannheim HRB 330082\nHeidelberg Materials AG – Heidelberg",
      "type": "Sonstige Registerbekanntmachung",
      "state": "Baden-Württemberg",
      "amtsgericht": "Amtsgericht Mannheim",
      "registernummer": "HRB 330082",
      "registerart": "HRB",
      "company_name": "Heidelberg Materials AG",
      "company_seat": "Heidelberg",
      "details": "06.11.2024 (Bekanntmachungsdatum)\n\nBaden-Württemberg Amtsgericht Mannheim HRB 330082\nSonstige Registerbekanntmachung\n\nHeidelberg Materials AG\nAktiengesellschaft\nHeidelberg\n\nDie Gesellschaft hat am 05.11.2024 die Liste über die Zusammensetzung des Aufsichtsrats zum Handelsregister eingereicht."
    },
    {
      "date": "2024-11-06",
      "id": "92724",
      "original_text": "Löschungsankündigung\nBrandenburg Amtsgericht Frankfurt/Oder HRB 6138\nStregel Bauklempnerei + Dachdecker GmbH – Fürstenwalde/Spree",
      "type": "Löschungsankündigung",
      "state": "Brandenburg",
      "amtsgericht": "Amtsgericht Frankfurt/Oder",
      "registernummer": "HRB 6138",
      "registerart": "HRB",
      "company_name": "Stregel Bauklempnerei + Dachdecker GmbH",
      "company_seat": "Fürstenwalde/Spree",
      "details": "06.11.2024 (Bekanntmachungsdatum)\n\nBrandenburg Amtsgericht Frankfurt/Oder HRB 6138\nLöschungsankündigung\n\nStregel Bauklempnerei + Dachdecker GmbH\nGesellschaft mit beschränkter Haftung\nFürstenwalde/Spree\n\nBei der nachstehenden Gesellschaft wird das Amtslöschungsverfahren gemäß § 394 FamFG eingeleitet."
    },
    {
      "date": "2024-11-06",
      "id": "92725",
      "original_text": "Registerbekanntmachung nach dem Umwandlungsgesetz\nBrandenburg Amtsgericht Potsdam HRB 28988\nGSG Grundstücks- Sanierungs und Entwicklungs GmbH – Brandenburg an der Havel",
      "type": "Registerbekanntmachung nach dem Umwandlungsgesetz",
      "state": "Brandenburg",
      "amtsgericht": "Amtsgericht Potsdam",
      "registernummer": "HRB 28988",
      "registerart": "HRB",
      "company_name": "GSG Grundstücks- Sanierungs und Entwicklungs GmbH",
      "company_seat": "Brandenburg an der Havel",
      "details": "06.11.2024 (Bekanntmachungsdatum)\n\nBrandenburg Amtsgericht Potsdam HRB 28988\nRegisterbekanntmachung nach dem Umwandlungsgesetz 06.11.2024 (Eintragungsdatum)\n\nGSG Grundstücks- Sanierungs und Entwicklungs GmbH\nGesellschaft mit beschränkter Haftung\nBrandenburg an der Havel\n\nZu Eintragungsnummer 3 vom 06.11.2024 wird als nicht eingetragen veröffentlicht:\nDen Gläubigern der an der Verschmelzung beteiligten Rechtsträger ist, wenn sie binnen sechs Monaten nach dem Tag, an dem die Eintragung der Verschmelzung in das Register des Sitzes desjenigen Rechtsträgers, dessen Gläubiger sie sind, als bekannt gemacht gilt, ihren Anspruch nach Grund und Höhe schriftlich anmelden, Sicherheit zu leisten, soweit sie nicht Befriedigung verlangen können. Dieses Recht steht den Gläubigern jedoch nur zu, wenn sie glaubhaft machen, dass durch die Verschmelzung die Erfüllung ihrer Forderung gefährdet wird"
    },
    {
      "date": "2024-11-06",
      "id": "92726",
      "original_text": "Sonstige Registerbekanntmachung\nHamburg Amtsgericht Hamburg HRB 21343\nSVG Steinwerder Verwaltungsgesellschaft mbH – Hamburg",
      "type": "Sonstige Registerbekanntmachung",
      "state": "Hamburg",
      "amtsgericht": "Amtsgericht Hamburg",
      "registernummer": "HRB 21343",
      "registerart": "HRB",
      "company_name": "SVG Steinwerder Verwaltungsgesellschaft mbH",
      "company_seat": "Hamburg",
      "details": "06.11.2024 (Bekanntmachungsdatum)\n\nHamburg Amtsgericht Hamburg HRB 21343\nSonstige Registerbekanntmachung 06.11.2024 (Eintragungsdatum)\n\nSVG Steinwerder Verwaltungsgesellschaft mbH\nGesellschaft mit beschränkter Haftung\nHamburg\n\nAls nicht eingetragen wird bekannt gemacht:  Den Gläubigern der Gesellschaft, deren Forderungen begründet worden sind, bevor die Eintragung der Vertragsbeendigung in das Handelsregister nach § 10 HGB als bekannt gemacht gilt, ist vom anderen Vertragsteil Sicherheit zu leisten, wenn sie sich binnen 6 Monaten nach Bekanntmachung der Eintragung zu diesem Zweck bei ihm melden."
    },
    {
      "date": "2024-11-06",
      "id": "92727",
      "original_text": "Einreichung neuer Dokumente\nBrandenburg Amtsgericht Frankfurt/Oder HRB 2851\nKommunale Wohnungsverwaltungsgesellschaft Hennickendorf mbH – Rüdersdorf b. Berlin",
      "type": "Einreichung neuer Dokumente",
      "state": "Brandenburg",
      "amtsgericht": "Amtsgericht Frankfurt/Oder",
      "registernummer": "HRB 2851",
      "registerart": "HRB",
      "company_name": "Kommunale Wohnungsverwaltungsgesellschaft Hennickendorf mbH",
      "company_seat": "Rüdersdorf b. Berlin",
      "details": "06.11.2024 (Bekanntmachungsdatum)\n\nBrandenburg Amtsgericht Frankfurt/Oder HRB 2851\nEinreichung neuer Dokumente\n\nKommunale Wohnungsverwaltungsgesellschaft Hennickendorf mbH\nGesellschaft mit beschränkter Haftung\nRüdersdorf b. Berlin\n\nAls nicht eingetragen wird veröffentlicht: Die Gesellschaft hat Änderungen im Aufsichtsrat angezeigt."
    },
    {
      "date": "2024-11-06",
      "id": "92728",
      "original_text": "Einreichung neuer Dokumente\nSachsen Amtsgericht Leipzig HRB 1874\nFlughafen Leipzig/Halle Gesellschaft mit beschränkter Haftung – Leipzig",
      "type": "Einreichung neuer Dokumente",
      "state": "Sachsen",
      "amtsgericht": "Amtsgericht Leipzig",
      "registernummer": "HRB 1874",
      "registerart": "HRB",
      "company_name": "Flughafen Leipzig/Halle Gesellschaft mit beschränkter Haftung",
      "company_seat": "Leipzig",
      "details": "06.11.2024 (Bekanntmachungsdatum)\n\nSachsen Amtsgericht Leipzig HRB 1874\nEinreichung neuer Dokumente\n\nFlughafen Leipzig/Halle Gesellschaft mit beschränkter Haftung\nGesellschaft mit beschränkter Haftung\nLeipzig\n\nAm 04.11.2024 wurde beim Handelsregister des Amtsgerichts Leipzig die Liste der Mitglieder des Aufsichtsrats gemäß § 52 GmbHG eingereicht."
    },
    {
      "date": "2024-11-06",
      "id": "92729",
      "original_text": "Löschungsankündigung\nSachsen Amtsgericht Chemnitz HRB 21290\nMüller-Wetzel Haustechnik GmbH – Jöhstadt",
      "type": "Löschungsankündigung",
      "state": "Sachsen",
      "amtsgericht": "Amtsgericht Chemnitz",
      "registernummer": "HRB 21290",
      "registerart": "HRB",
      "company_name": "Müller-Wetzel Haustechnik GmbH",
      "company_seat": "Jöhstadt",
      "details": "06.11.2024 (Bekanntmachungsdatum)\n\nSachsen Amtsgericht Chemnitz HRB 21290\nLöschungsankündigung\n\nMüller-Wetzel Haustechnik GmbH\nGesellschaft mit beschränkter Haftung\nJöhstadt\n\nDas Registergericht beabsichtigt, die im Handelsregister eingetragene Gesellschaft von Amts wegen nach § 394 FamFG zu löschen. Die Frist zu Erhebung eines Widerspruchs gegen die beabsichtigte Löschung wird auf einen Monat festgesetzt."
    },
    {
      "date": "2024-11-06",
      "id": "92730",
      "original_text": "Einreichung neuer Dokumente\nSachsen Amtsgericht Dresden HRB 8720\nVer- und Entsorgungswerke Bad Muskau GmbH – Bad Muskau",
      "type": "Einreichung neuer Dokumente",
      "state": "Sachsen",
      "amtsgericht": "Amtsgericht Dresden",
      "registernummer": "HRB 8720",
      "registerart": "HRB",
      "company_name": "Ver- und Entsorgungswerke Bad Muskau GmbH",
      "company_seat": "Bad Muskau",
      "details": "06.11.2024 (Bekanntmachungsdatum)\n\nSachsen Amtsgericht Dresden HRB 8720\nEinreichung neuer Dokumente\n\nVer- und Entsorgungswerke Bad Muskau GmbH\nGesellschaft mit beschränkter Haftung\nBad Muskau\n\nAm 05.11.2024 wurde beim Handelsregister des Amtsgerichts Dresden die Liste der Mitglieder des Aufsichtsrats gemäß § 52 GmbHG eingereicht."
    },
    {
      "date": "2024-11-06",
      "id": "92731",
      "original_text": "Einreichung neuer Dokumente\nSachsen Amtsgericht Dresden HRB 1187\nFlughafen Dresden Gesellschaft mit beschränkter Haftung – Dresden",
      "type": "Einreichung neuer Dokumente",
      "state": "Sachsen",
      "amtsgericht": "Amtsgericht Dresden",
      "registernummer": "HRB 1187",
      "registerart": "HRB",
      "company_name": "Flughafen Dresden Gesellschaft mit beschränkter Haftung",
      "company_seat": "Dresden",
      "details": "06.11.2024 (Bekanntmachungsdatum)\n\nSachsen Amtsgericht Dresden HRB 1187\nEinreichung neuer Dokumente\n\nFlughafen Dresden Gesellschaft mit beschränkter Haftung\nGesellschaft mit beschränkter Haftung\nDresden\n\nAm 05.11.2024 wurde beim Handelsregister des Amtsgerichts Dresden die Liste der Mitglieder des Aufsichtsrats gemäß § 52 GmbHG eingereicht."
    },
    {
      "date": "2024-11-06",
      "id": "92732",
      "original_text": "Einreichung neuer Dokumente\nSachsen Amtsgericht Chemnitz HRB 589\nWohnungsbaugesellschaft Plauen mbH – Plauen",
      "type": "Einreichung neuer Dokumente",
      "state": "Sachsen",
      "amtsgericht": "Amtsgericht Chemnitz",
      "registernummer": "HRB 589",
      "registerart": "HRB",
      "company_name": "Wohnungsbaugesellschaft Plauen mbH",
      "company_seat": "Plauen",
      "details": "06.11.2024 (Bekanntmachungsdatum)\n\nSachsen Amtsgericht Chemnitz HRB 589\nEinreichung neuer Dokumente\n\nWohnungsbaugesellschaft Plauen mbH\nGesellschaft mit beschränkter Haftung\nPlauen\n\nAm 30.10.2024 wurde beim Handelsregister des Amtsgerichts Chemnitz die Liste der Mitglieder des Aufsichtsrats gemäß § 52 GmbHG eingereicht."
    },
    {
      "date": "2024-11-06",
      "id": "92733",
      "original_text": "Einreichung neuer Dokumente\nSachsen Amtsgericht Chemnitz HRB 4179\nStadtwerke Schneeberg GmbH – Schneeberg",
      "type": "Einreichung neuer Dokumente",
      "state": "Sachsen",
      "amtsgericht": "Amtsgericht Chemnitz",
      "registernummer": "HRB 4179",
      "registerart": "HRB",
      "company_name": "Stadtwerke Schneeberg GmbH",
      "company_seat": "Schneeberg",
      "details": "06.11.2024 (Bekanntmachungsdatum)\n\nSachsen Amtsgericht Chemnitz HRB 4179\nEinreichung neuer Dokumente\n\nStadtwerke Schneeberg GmbH\nGesellschaft mit beschränkter Haftung\nSchneeberg\n\nAm 05.11.2024 wurde beim Handelsregister des Amtsgerichts Chemnitz die Liste der Mitglieder des Aufsichtsrats gemäß § 52 GmbHG eingereicht."
    },
    {
      "date": "2024-11-06",
      "id": "92734",
      "original_text": "Registerbekanntmachung nach dem Umwandlungsgesetz\nNiedersachsen Amtsgericht Osnabrück HRA 7305\nCoors ..... Ihre Bäckerei GmbH & Co. KG – Osnabrück",
      "type": "Registerbekanntmachung nach dem Umwandlungsgesetz",
      "state": "Niedersachsen",
      "amtsgericht": "Amtsgericht Osnabrück",
      "registernummer": "HRA 7305",
      "registerart": "HRA",
      "company_name": "Coors ..... Ihre Bäckerei GmbH & Co. KG",
      "company_seat": "Osnabrück",
      "details": "06.11.2024 (Bekanntmachungsdatum)\n\nNiedersachsen Amtsgericht Osnabrück HRA 7305\nRegisterbekanntmachung nach dem Umwandlungsgesetz 06.11.2024 (Eintragungsdatum)\n\nCoors ..... Ihre Bäckerei GmbH & Co. KG\nKommanditgesellschaft\nOsnabrück\n\nDen Gläubigern der an der formwechselnden Umwandlung beteiligten Rechtsträger ist, wenn sie binnen sechs Monaten nach dem Tag, an dem die Eintragung der Umwandlung in das Register des Sitzes desjenigen Rechtsträgers, dessen Gläubiger sie sind, nach § 19 Abs. 3 UmwG als bekannt gemacht gilt, ihren Anspruch nach Grund und Höhe schriftlich anmelden, Sicherheit zu leisten, soweit sie nicht Befriedigung verlangen können. Dieses Recht steht den Gläubigern jedoch nur zu, wenn sie glaubhaft machen, dass durch die formwechselnde Umwandlung die Erfüllung der Forderung gefährdet wird."
    },
    {
      "date": "2024-11-06",
      "id": "92735",
      "original_text": "Registerbekanntmachung nach dem Umwandlungsgesetz\nNiedersachsen Amtsgericht Göttingen HRA 130556 früher Amtsgericht Northeim\nFritz Sauerbrey e.K. – Lerbach (Oberharz)",
      "type": "Registerbekanntmachung nach dem Umwandlungsgesetz",
      "state": "Niedersachsen",
      "amtsgericht": "Amtsgericht Göttingen",
      "registernummer": "HRA 130556",
      "registerart": "HRA",
      "company_name": "Fritz Sauerbrey e.K.",
      "company_seat": "Lerbach (Oberharz)",
      "former_amtsgericht": "Northeim",
      "details": "06.11.2024 (Bekanntmachungsdatum)\n\nNiedersachsen Amtsgericht Göttingen HRA 130556 früher Amtsgericht Northeim\nRegisterbekanntmachung nach dem Umwandlungsgesetz 06.11.2024 (Eintragungsdatum)\n\nFritz Sauerbrey e.K.\nEinzelkaufmann / Einzelkauffrau\nLerbach (Oberharz)\n\nDen Gläubigern der an der Ausgliederung beteiligten Rechtsträger ist, wenn sie binnen sechs Monaten nach dem Tag, an dem die Eintragung der Ausgliederung in das Register des Sitzes desjenigen Rechtsträgers, dessen Gläubiger sie sind, nach § 19 Abs. 3 UmwG als bekannt gemacht gilt, ihren Anspruch nach Grund und Höhe schriftlich anmelden, Sicherheit zu leisten, soweit sie nicht Befriedigung verlangen können. Dieses Recht steht den Gläubigern jedoch nur zu, wenn sie glaubhaft machen, dass durch die Ausgliederung die Erfüllung der Forderung gefährdet wird."
    },
    {
      "date": "2024-11-06",
      "id": "92736",
      "original_text": "Registerbekanntmachung nach dem Umwandlungsgesetz\nNiedersachsen Amtsgericht Osnabrück HRB 200171\nSievert Baustoffe Auslandsbeteiligungen GmbH – Osnabrück",
      "type": "Registerbekanntmachung nach dem Umwandlungsgesetz",
      "state": "Niedersachsen",
      "amtsgericht": "Amtsgericht Osnabrück",
      "registernummer": "HRB 200171",
      "registerart": "HRB",
      "company_name": "Sievert Baustoffe Auslandsbeteiligungen GmbH",
      "company_seat": "Osnabrück",
      "details": "06.11.2024 (Bekanntmachungsdatum)\n\nNiedersachsen Amtsgericht Osnabrück HRB 200171\nRegisterbekanntmachung nach dem Umwandlungsgesetz 06.11.2024 (Eintragungsdatum)\n\nSievert Baustoffe Auslandsbeteiligungen GmbH\nGesellschaft mit beschränkter Haftung\nOsnabrück\n\nDen Gläubigern der an der Abspaltung beteiligten Rechtsträger ist, wenn sie binnen sechs Monaten nach dem Tag, an dem die Eintragung der Abspaltung in das Register des Sitzes desjenigen Rechtsträgers, dessen Gläubiger sie sind, nach § 19 Abs. 3 UmwG als bekannt gemacht gilt, ihren Anspruch nach Grund und Höhe schriftlich anmelden, Sicherheit zu leisten, soweit sie nicht Befriedigung verlangen können. Dieses Recht steht den Gläubigern jedoch nur zu, wenn sie glaubhaft machen, dass durch die Abspaltung die Erfüllung der Forderung gefährdet wird."
    },
    {
      "date": "2024-11-06",
      "id": "92737",
      "original_text": "Registerbekanntmachung nach dem Umwandlungsgesetz\nNiedersachsen Amtsgericht Hannover HRA 206312\nCODO Street Kitchen e. K. – Hannover",
      "type": "Registerbekanntmachung nach dem Umwandlungsgesetz",
      "state": "Niedersachsen",
      "amtsgericht": "Amtsgericht Hannover",
      "registernummer": "HRA 206312",
      "registerart": "HRA",
      "company_name": "CODO Street Kitchen e. K.",
      "company_seat": "Hannover",
      "details": "06.11.2024 (Bekanntmachungsdatum)\n\nNiedersachsen Amtsgericht Hannover HRA 206312\nRegisterbekanntmachung nach dem Umwandlungsgesetz 06.11.2024 (Eintragungsdatum)\n\nCODO Street Kitchen e. K.\nEinzelkaufmann / Einzelkauffrau\nHannover\n\nDen Gläubigern der an der Ausgliederung beteiligten Rechtsträger ist, wenn sie binnen sechs Monaten nach dem Tag, an dem die Eintragung der Ausgliederung in das Register des Sitzes desjenigen Rechtsträgers, dessen Gläubiger sie sind, nach § 19 Abs. 3 UmwG als bekannt gemacht gilt, ihren Anspruch nach Grund und Höhe schriftlich anmelden, Sicherheit zu leisten, soweit sie nicht Befriedigung verlangen können. Dieses Recht steht den Gläubigern jedoch nur zu, wenn sie glaubhaft machen, dass durch die Ausgliederung die Erfüllung der Forderung gefährdet wird."
    },
    {
      "date": "2024-11-06",
      "id": "92738",
      "original_text": "Löschungsankündigung\nNiedersachsen Amtsgericht Lüneburg HRB 211341\nDB Bus UG (haftungsbeschränkt) – Bardowick",
      "type": "Löschungsankündigung",
      "state": "Niedersachsen",
      "amtsgericht": "Amtsgericht Lüneburg",
      "registernummer": "HRB 211341",
      "registerart": "HRB",
      "company_name": "DB Bus UG (haftungsbeschränkt)",
      "company_seat": "Bardowick",
      "details": "06.11.2024 (Bekanntmachungsdatum)\n\nNiedersachsen Amtsgericht Lüneburg HRB 211341\nLöschungsankündigung\n\nDB Bus UG (haftungsbeschränkt)\nGesellschaft mit beschränkter Haftung\nBardowick\n\nDas Registergericht beabsichtigt, die Gesellschaft von Amts wegen nach § 394 FamFG zu löschen. Die Frist zur Erhebung eines Widerspruchs ist auf 1 Monat ab dieser Registerbekanntmachung festgesetzt."
    },
    {
      "date": "2024-11-06",
      "id": "92739",
      "original_text": "Registerbekanntmachung nach dem Umwandlungsgesetz\nNiedersachsen Amtsgericht Walsrode HRB 212316\neFuel Syngas GmbH – Hoya",
      "type": "Registerbekanntmachung nach dem Umwandlungsgesetz",
      "state": "Niedersachsen",
      "amtsgericht": "Amtsgericht Walsrode",
      "registernummer": "HRB 212316",
      "registerart": "HRB",
      "company_name": "eFuel Syngas GmbH",
      "company_seat": "Hoya",
      "details": "06.11.2024 (Bekanntmachungsdatum)\n\nNiedersachsen Amtsgericht Walsrode HRB 212316\nRegisterbekanntmachung nach dem Umwandlungsgesetz 06.11.2024 (Eintragungsdatum)\n\neFuel Syngas GmbH\nGesellschaft mit beschränkter Haftung\nHoya\n\nDen Gläubigern der an der Abspaltung beteiligten Rechtsträger ist, wenn sie binnen sechs Monaten nach dem Tag, an dem die Eintragung der Abspaltung in das Register des Sitzes desjenigen Rechtsträgers, dessen Gläubiger sie sind, nach § 19 Abs. 3 UmwG als bekannt gemacht gilt, ihren Anspruch nach Grund und Höhe schriftlich anmelden, Sicherheit zu leisten, soweit sie nicht Befriedigung verlangen können. Dieses Recht steht den Gläubigern jedoch nur zu, wenn sie glaubhaft machen, dass durch die Abspaltung die Erfüllung der Forderung gefährdet wird."
    },
    {
      "date": "2024-11-06",
      "id": "92740",
      "original_text": "Sonstige Registerbekanntmachung\nNiedersachsen Amtsgericht Hildesheim HRB 3271\nLurch AG – Hildesheim",
      "type": "Sonstige Registerbekanntmachung",
      "state": "Niedersachsen",
      "amtsgericht": "Amtsgericht Hildesheim",
      "registernummer": "HRB 3271",
      "registerart": "HRB",
      "company_name": "Lurch AG",
      "company_seat": "Hildesheim",
      "details": "06.11.2024 (Bekanntmachungsdatum)\n\nNiedersachsen Amtsgericht Hildesheim HRB 3271\nSonstige Registerbekanntmachung 06.11.2024 (Eintragungsdatum)\n\nLurch AG\nAktiengesellschaft\nHildesheim\n\nDie Hauptversammlung vom 22.08.2024 hat die Herabsetzung des Grundkapitals durch Einziehung von Aktien um 37.800,00 Euro beschlossen.\nDie am 22.08.2024 beschlossene Herabsetzung des Grundkapitals ist i.Höhe von 37.800,00 EUR durchgeführt.\nDie Gesellschaft hat Gläubigern, deren Forderungen vor dieser Bekanntmachung begründet worden sind, Sicherheit zu leisten, soweit sie nicht Befriedigung verlangen können, wenn sie sich binnen sechs Monaten zu diesem Zweck melden."
    },
    {
      "date": "2024-11-06",
      "id": "92741",
      "original_text": "Registerbekanntmachung nach dem Umwandlungsgesetz\nNiedersachsen Amtsgericht Hildesheim HRB 207469\nHannes Camper GmbH – Ilsede",
      "type": "Registerbekanntmachung nach dem Umwandlungsgesetz",
      "state": "Niedersachsen",
      "amtsgericht": "Amtsgericht Hildesheim",
      "registernummer": "HRB 207469",
      "registerart": "HRB",
      "company_name": "Hannes Camper GmbH",
      "company_seat": "Ilsede",
      "details": "06.11.2024 (Bekanntmachungsdatum)\n\nNiedersachsen Amtsgericht Hildesheim HRB 207469\nRegisterbekanntmachung nach dem Umwandlungsgesetz 06.11.2024 (Eintragungsdatum)\n\nHannes Camper GmbH\nGesellschaft mit beschränkter Haftung\nIlsede\n\nDen Gläubigern der an der Verschmelzung beteiligten Rechtsträger ist, wenn sie binnen sechs Monaten nach dem Tag, an dem die Eintragung der Verschmelzung in das Register des Sitzes desjenigen Rechtsträgers, dessen Gläubiger sie sind, nach § 19  Abs.  3 UmwG als bekannt gemacht gilt, ihren Anspruch nach Grund und Höhe schriftlich anmelden, Sicherheit zu leisten, soweit sie nicht Befriedigung verlangen können. Dieses Recht steht den Gläubigern jedoch nur zu, wenn sie glaubhaft machen, dass durch die Verschmelzung die Erfüllung der Forderung gefährdet wird."
    },
    {
      "date": "2024-11-06",
      "id": "92742",
      "original_text": "Registerbekanntmachung nach dem Umwandlungsgesetz\nNiedersachsen Amtsgericht Göttingen HRA 202207\nHotel Sauerbrey KG – Osterode am Harz",
      "type": "Registerbekanntmachung nach dem Umwandlungsgesetz",
      "state": "Niedersachsen",
      "amtsgericht": "Amtsgericht Göttingen",
      "registernummer": "HRA 202207",
      "registerart": "HRA",
      "company_name": "Hotel Sauerbrey KG",
      "company_seat": "Osterode am Harz",
      "details": "06.11.2024 (Bekanntmachungsdatum)\n\nNiedersachsen Amtsgericht Göttingen HRA 202207\nRegisterbekanntmachung nach dem Umwandlungsgesetz\n\nHotel Sauerbrey KG\nKommanditgesellschaft\nOsterode am Harz\n\nDen Gläubigern der an der Ausgliederung beteiligten Rechtsträger ist, wenn sie binnen sechs Monaten nach dem Tag, an dem die Eintragung der Ausgliederung in das Register des Sitzes desjenigen Rechtsträgers, dessen Gläubiger sie sind, nach § 19 Abs. 3 UmwG als bekannt gemacht gilt, ihren Anspruch nach Grund und Höhe schriftlich anmelden, Sicherheit zu leisten, soweit sie nicht Befriedigung verlangen können. Dieses Recht steht den Gläubigern jedoch nur zu, wenn sie glaubhaft machen, dass durch die Ausgliederung die Erfüllung der Forderung gefährdet wird."
    },
    {
      "date": "2024-11-06",
      "id": "92743",
      "original_text": "Registerbekanntmachung nach dem Umwandlungsgesetz\nNiedersachsen Amtsgericht Walsrode HRB 210003\neFuel GmbH – Hoya",
      "type": "Registerbekanntmachung nach dem Umwandlungsgesetz",
      "state": "Niedersachsen",
      "amtsgericht": "Amtsgericht Walsrode",
      "registernummer": "HRB 210003",
      "registerart": "HRB",
      "company_name": "eFuel GmbH",
      "company_seat": "Hoya",
      "details": "06.11.2024 (Bekanntmachungsdatum)\n\nNiedersachsen Amtsgericht Walsrode HRB 210003\nRegisterbekanntmachung nach dem Umwandlungsgesetz 06.11.2024 (Eintragungsdatum)\n\neFuel GmbH\nGesellschaft mit beschränkter Haftung\nHoya\n\nDen Gläubigern der an der Abspaltung beteiligten Rechtsträger ist, wenn sie binnen sechs Monaten nach dem Tag, an dem die Eintragung der Abspaltung in das Register des Sitzes desjenigen Rechtsträgers, dessen Gläubiger sie sind, nach § 19 Abs. 3 UmwG als bekannt gemacht gilt, ihren Anspruch nach Grund und Höhe schriftlich anmelden, Sicherheit zu leisten, soweit sie nicht Befriedigung verlangen können. Dieses Recht steht den Gläubigern jedoch nur zu, wenn sie glaubhaft machen, dass durch die Abspaltung die Erfüllung der Forderung gefährdet wird."
    },
    {
      "date": "2024-11-06",
      "id": "92744",
      "original_text": "Registerbekanntmachung nach dem Umwandlungsgesetz\nNiedersachsen Amtsgericht Osnabrück HRB 200722\nHellmann Cheari Consulting Beteiligungsgesellschaft mbH – Osnabrück",
      "type": "Registerbekanntmachung nach dem Umwandlungsgesetz",
      "state": "Niedersachsen",
      "amtsgericht": "Amtsgericht Osnabrück",
      "registernummer": "HRB 200722",
      "registerart": "HRB",
      "company_name": "Hellmann Cheari Consulting Beteiligungsgesellschaft mbH",
      "company_seat": "Osnabrück",
      "details": "06.11.2024 (Bekanntmachungsdatum)\n\nNiedersachsen Amtsgericht Osnabrück HRB 200722\nRegisterbekanntmachung nach dem Umwandlungsgesetz 06.11.2024 (Eintragungsdatum)\n\nHellmann Cheari Consulting Beteiligungsgesellschaft mbH\nGesellschaft mit beschränkter Haftung\nOsnabrück\n\nDen Gläubigern der an der Verschmelzung beteiligten Rechtsträger ist, wenn sie binnen sechs Monaten nach dem Tag, an dem die Eintragung der Verschmelzung in das Register des Sitzes desjenigen Rechtsträgers, dessen Gläubiger sie sind, nach § 19  Abs.  3 UmwG als bekannt gemacht gilt, ihren Anspruch nach Grund und Höhe schriftlich anmelden, Sicherheit zu leisten, soweit sie nicht Befriedigung verlangen können. Dieses Recht steht den Gläubigern jedoch nur zu, wenn sie glaubhaft machen, dass durch die Verschmelzung die Erfüllung der Forderung gefährdet wird."
    },
    {
      "date": "2024-11-06",
      "id": "92745",
      "original_text": "Registerbekanntmachung nach dem Umwandlungsgesetz\nNiedersachsen Amtsgericht Braunschweig HRB 202029\nMentus GmbH – Braunschweig",
      "type": "Registerbekanntmachung nach dem Umwandlungsgesetz",
      "state": "Niedersachsen",
      "amtsgericht": "Amtsgericht Braunschweig",
      "registernummer": "HRB 202029",
      "registerart": "HRB",
      "company_name": "Mentus GmbH",
      "company_seat": "Braunschweig",
      "details": "06.11.2024 (Bekanntmachungsdatum)\n\nNiedersachsen Amtsgericht Braunschweig HRB 202029\nRegisterbekanntmachung nach dem Umwandlungsgesetz 06.11.2024 (Eintragungsdatum)\n\nMentus GmbH\nGesellschaft mit beschränkter Haftung\nBraunschweig\n\nDen Gläubigern der an der Verschmelzung beteiligten Rechtsträger ist, wenn sie binnen sechs Monaten nach dem Tag, an dem die Eintragung der Verschmelzung in das Register des Sitzes desjenigen Rechtsträgers, dessen Gläubiger sie sind, nach § 19  Abs.  3 UmwG als bekannt gemacht gilt, ihren Anspruch nach Grund und Höhe schriftlich anmelden, Sicherheit zu leisten, soweit sie nicht Befriedigung verlangen können. Dieses Recht steht den Gläubigern jedoch nur zu, wenn sie glaubhaft machen, dass durch die Verschmelzung die Erfüllung der Forderung gefährdet wird."
    },
    {
      "date": "2024-11-06",
      "id": "92746",
      "original_text": "Sonstige Registerbekanntmachung\nNiedersachsen Amtsgericht Hannover HRB 3669\nContinental Automotive Technologies GmbH – Hannover",
      "type": "Sonstige Registerbekanntmachung",
      "state": "Niedersachsen",
      "amtsgericht": "Amtsgericht Hannover",
      "registernummer": "HRB 3669",
      "registerart": "HRB",
      "company_name": "Continental Automotive Technologies GmbH",
      "company_seat": "Hannover",
      "details": "06.11.2024 (Bekanntmachungsdatum)\n\nNiedersachsen Amtsgericht Hannover HRB 3669\nSonstige Registerbekanntmachung\n\nContinental Automotive Technologies GmbH\nGesellschaft mit beschränkter Haftung\nHannover\n\nDie Liste der Mitglieder des Aufsichtsrats wurde beim Registergericht eingereicht."
    },
    {
      "date": "2024-11-06",
      "id": "92747",
      "original_text": "Löschungsankündigung\nNiedersachsen Amtsgericht Walsrode HRB 120798\n\"Freizeitsport GmbH\" – Ritterhude",
      "type": "Löschungsankündigung",
      "state": "Niedersachsen",
      "amtsgericht": "Amtsgericht Walsrode",
      "registernummer": "HRB 120798",
      "registerart": "HRB",
      "company_name": "\"Freizeitsport GmbH\"",
      "company_seat": "Ritterhude",
      "details": "06.11.2024 (Bekanntmachungsdatum)\n\nNiedersachsen Amtsgericht Walsrode HRB 120798\nLöschungsankündigung\n\n\"Freizeitsport GmbH\"\nGesellschaft mit beschränkter Haftung\nRitterhude\n\nDas Registergericht beabsichtigt, die Gesellschaft von Amts wegen nach § 394 FamFG zu löschen. Die Frist zur Erhebung eines Widerspruchs ist auf 3 Monate ab dieser Registerbekanntmachung festgesetzt."
    },
    {
      "date": "2024-11-06",
      "id": "92748",
      "original_text": "Löschungsankündigung\nNiedersachsen Amtsgericht Walsrode HRB 5773\nTHOWA Gastroservice Limited – Schwarmstedt",
      "type": "Löschungsankündigung",
      "state": "Niedersachsen",
      "amtsgericht": "Amtsgericht Walsrode",
      "registernummer": "HRB 5773",
      "registerart": "HRB",
      "company_name": "THOWA Gastroservice Limited",
      "company_seat": "Schwarmstedt",
      "details": "06.11.2024 (Bekanntmachungsdatum)\n\nNiedersachsen Amtsgericht Walsrode HRB 5773\nLöschungsankündigung\n\nTHOWA Gastroservice Limited\nRechtsform ausländischen Rechts HRB\nSchwarmstedt\n\nDas Registergericht beabsichtigt, die Zweigniederlassung von Amts wegen nach § 395 FamFG zu löschen. Die Frist zur Erhebung eines Widerspruchs ist auf 3 Monate ab dieser Registerbekanntmachung festgesetzt."
    },
    {
      "date": "2024-11-06",
      "id": "92749",
      "original_text": "Registerbekanntmachung nach dem Umwandlungsgesetz\nNiedersachsen Amtsgericht Hannover HRB 218133\nW.E.M. GmbH – Hannover",
      "type": "Registerbekanntmachung nach dem Umwandlungsgesetz",
      "state": "Niedersachsen",
      "amtsgericht": "Amtsgericht Hannover",
      "registernummer": "HRB 218133",
      "registerart": "HRB",
      "company_name": "W.E.M. GmbH",
      "company_seat": "Hannover",
      "details": "06.11.2024 (Bekanntmachungsdatum)\n\nNiedersachsen Amtsgericht Hannover HRB 218133\nRegisterbekanntmachung nach dem Umwandlungsgesetz 06.11.2024 (Eintragungsdatum)\n\nW.E.M. GmbH\nGesellschaft mit beschränkter Haftung\nHannover\n\nDen Gläubigern der an der Verschmelzung beteiligten Rechtsträger ist, wenn sie binnen sechs Monaten nach dem Tag, an dem die Eintragung der Verschmelzung in das Register des Sitzes desjenigen Rechtsträgers, dessen Gläubiger sie sind, nach § 19  Abs.  3 UmwG als bekannt gemacht gilt, ihren Anspruch nach Grund und Höhe schriftlich anmelden, Sicherheit zu leisten, soweit sie nicht Befriedigung verlangen können. Dieses Recht steht den Gläubigern jedoch nur zu, wenn sie glaubhaft machen, dass durch die Verschmelzung die Erfüllung der Forderung gefährdet wird."
    },
    {
      "date": "2024-11-06",
      "id": "92750",
      "original_text": "Registerbekanntmachung nach dem Umwandlungsgesetz\nRheinland-Pfalz Amtsgericht Zweibrücken HRA 30807\nFrank Breitenborn Baggerbetrieb e.K. – Oberarnbach",
      "type": "Registerbekanntmachung nach dem Umwandlungsgesetz",
      "state": "Rheinland-Pfalz",
      "amtsgericht": "Amtsgericht Zweibrücken",
      "registernummer": "HRA 30807",
      "registerart": "HRA",
      "company_name": "Frank Breitenborn Baggerbetrieb e.K.",
      "company_seat": "Oberarnbach",
      "details": "06.11.2024 (Bekanntmachungsdatum)\n\nRheinland-Pfalz Amtsgericht Zweibrücken HRA 30807\nRegisterbekanntmachung nach dem Umwandlungsgesetz 06.11.2024 (Eintragungsdatum)\n\nFrank Breitenborn Baggerbetrieb e.K.\nEinzelkaufmann / Einzelkauffrau\nOberarnbach\n\nAls nicht eingetragen wird veröffentlicht: Den Gläubigern der an der Ausgliederung beteiligten Rechtsträger ist, wenn sie binnen sechs Monaten nac hdem Tag, an dem die Eintragung der Ausgliederung in das Register des Sitzes desjenigen Rechtsträgers,dessen Gläubiger sie sind, nach § 19 Abs. 3 UmwG als bekannt gemacht gilt, ihren Anspruch nach Grund und Höhe schriftlich anmelden, Sicherheit zu leisten, soweit sie nicht Befriedigung verlangen können. Dieses Recht steht den Gläubigern jedoch nur zu, wenn sie glaubhaft machen, dass durch die Ausgliederung die Erfüllung der Forderung gefährdet wird."
    },
    {
      "date": "2024-11-06",
      "id": "92751",
      "original_text": "Löschungsankündigung\nBremen Amtsgericht Bremen HRB 31615\nAuguststraße 78 UG (haftungsbeschränkt) – Bremen",
      "type": "Löschungsankündigung",
      "state": "Bremen",
      "amtsgericht": "Amtsgericht Bremen",
      "registernummer": "HRB 31615",
      "registerart": "HRB",
      "company_name": "Auguststraße 78 UG (haftungsbeschränkt)",
      "company_seat": "Bremen",
      "details": "06.11.2024 (Bekanntmachungsdatum)\n\nBremen Amtsgericht Bremen HRB 31615\nLöschungsankündigung\n\nAuguststraße 78 UG (haftungsbeschränkt)\nGesellschaft mit beschränkter Haftung\nBremen\n\nEs ist beabsichtigt die im Handelsregister eingetragene Gesellschaft von Amts wegen gemäß § 394 FamFG zu löschen. Gegen die Löschung kann beim AG Bremen schriftlich oder zu Protokoll der Geschäftsstelle Widerspruch eingelegt werden. Widerspruchsfrist 4 Wochen."
    },
    {
      "date": "2024-11-06",
      "id": "92752",
      "original_text": "Löschungsankündigung\nNordrhein-Westfalen Amtsgericht Duisburg HRB 31710\nKR Consulting GmbH – Oberhausen",
      "type": "Löschungsankündigung",
      "state": "Nordrhein-Westfalen",
      "amtsgericht": "Amtsgericht Duisburg",
      "registernummer": "HRB 31710",
      "registerart": "HRB",
      "company_name": "KR Consulting GmbH",
      "company_seat": "Oberhausen",
      "details": "06.11.2024 (Bekanntmachungsdatum)\n\nNordrhein-Westfalen Amtsgericht Duisburg HRB 31710\nLöschungsankündigung\n\nKR Consulting GmbH\nGesellschaft mit beschränkter Haftung\nOberhausen\n\nHR B 31710\nKR Consulting GmbH, Oberhausen\nKnappenstraße 72,\n46047 Oberhausen.\nDas Registergericht beabsichtigt, die im Handelsregister eingetragene Gesellschaft gemäß § 394 Absatz 1 FamFG wegen Vermögenslosigkeit von Amts wegen zu löschen. Gegen diese Verfügung kann Widerspruch eingelegt werden. Die Frist zur Erhebung eines Widerspruchs gegen die beabsichtigte Löschung von Amts wegen ist auf drei Monate festgesetzt. Rechtsbehelfsbelehrung Der Widerspruch ist bei dem Amtsgericht Duisburg, Kardinal-Galen-Str. 124-132, 47058 Duisburg schriftlich in deutscher Sprache oder zur Niederschrift der Geschäftsstelle einzulegen. Der Widerspruch kann auch zur Niederschrift der Geschäftsstelle eines jeden Amtsgerichtes abgegeben werden. Die Einlegung ist auch durch Übertragung eines elektronischen Dokuments an die elektronische Poststelle des Gerichts möglich. Das elektronische Dokument muss für die Bearbeitung durch das Gericht geeignet und mit einer qualifizierten elektronischen Signatur der verantwortenden Person versehen sein oder von der verantwortenden Person signiert und auf einem sicheren Übermittlungsweg gemäß § 130 a ZPO nach näherer Maßgabe der Verordnung über die technischen Rahmenbedingungen des elektronischen Rechtsverkehrs und über das besondere elektronische Behördenpostfach (BGBl. I, S. 3803) eingereicht werden. Weitere Informationen erhalten Sie auf der Internetseite www.justiz.de <http://www.justiz.de>. Der Widerspruch muss spätestens innerhalb der gesetzten Frist bei dem Amtsgericht Duisburg eingegangen sein. Dies gilt auch dann, wenn der Widerspruch zur Niederschrift der Geschäftsstelle eines anderen Amtsgerichtes abgegeben wurde. Die Frist beginnt mit der Veröffentlichung. Fällt das Ende der Frist auf einen Sonntag, einen allgemeinen Feiertag oder Sonnabend, so endet die Frist mit Ablauf des nächsten Werktages. Der Widerspruch muss die Bezeichnung der angefochtenen Verfügung sowie die Erklärung enthalten, dass Widerspruch gegen diese Verfügung eingelegt wird. Er ist zu unterzeichnen und soll begründet werden."
    },
    {
      "date": "2024-11-06",
      "id": "92753",
      "original_text": "Einreichung neuer Dokumente\nNordrhein-Westfalen Amtsgericht Köln HRB 32677\nDSGF Deutsche Servicegesellschaft für Finanzdienstleister mbH – Köln",
      "type": "Einreichung neuer Dokumente",
      "state": "Nordrhein-Westfalen",
      "amtsgericht": "Amtsgericht Köln",
      "registernummer": "HRB 32677",
      "registerart": "HRB",
      "company_name": "DSGF Deutsche Servicegesellschaft für Finanzdienstleister mbH",
      "company_seat": "Köln",
      "details": "06.11.2024 (Bekanntmachungsdatum)\n\nNordrhein-Westfalen Amtsgericht Köln HRB 32677\nEinreichung neuer Dokumente\n\nDSGF Deutsche Servicegesellschaft für Finanzdienstleister mbH\nGesellschaft mit beschränkter Haftung\nKöln\n\nDem Registergericht ist eine Liste der Mitglieder des Aufsichtsrates eingereicht worden."
    },
    {
      "date": "2024-11-06",
      "id": "92754",
      "original_text": "Löschungsankündigung\nNordrhein-Westfalen Amtsgericht Wuppertal HRB 21484\nDiamond Beteiligungs GmbH – Wuppertal",
      "type": "Löschungsankündigung",
      "state": "Nordrhein-Westfalen",
      "amtsgericht": "Amtsgericht Wuppertal",
      "registernummer": "HRB 21484",
      "registerart": "HRB",
      "company_name": "Diamond Beteiligungs GmbH",
      "company_seat": "Wuppertal",
      "details": "06.11.2024 (Bekanntmachungsdatum)\n\nNordrhein-Westfalen Amtsgericht Wuppertal HRB 21484\nLöschungsankündigung\n\nDiamond Beteiligungs GmbH\nGesellschaft mit beschränkter Haftung\nWuppertal\n\nDas Registergericht beabsichtigt die Gesellschaft von Amts wegen nach § 394 FamFG zu löschen. Die Frist zur Erhebung eines Widerspruchs ist auf einen Monat festgesetzt."
    },
    {
      "date": "2024-11-06",
      "id": "92755",
      "original_text": "Einreichung neuer Dokumente\nNordrhein-Westfalen Amtsgericht Gelsenkirchen HRB 8997\nPilkington Holding GmbH – Gelsenkirchen",
      "type": "Einreichung neuer Dokumente",
      "state": "Nordrhein-Westfalen",
      "amtsgericht": "Amtsgericht Gelsenkirchen",
      "registernummer": "HRB 8997",
      "registerart": "HRB",
      "company_name": "Pilkington Holding GmbH",
      "company_seat": "Gelsenkirchen",
      "details": "06.11.2024 (Bekanntmachungsdatum)\n\nNordrhein-Westfalen Amtsgericht Gelsenkirchen HRB 8997\nEinreichung neuer Dokumente\n\nPilkington Holding GmbH\nGesellschaft mit beschränkter Haftung\nGelsenkirchen\n\nDem Registergericht ist eine Liste der Mitglieder des Aufsichtsrates eingereicht worden."
    },
    {
      "date": "2024-11-06",
      "id": "92756",
      "original_text": "Registerbekanntmachung nach dem Umwandlungsgesetz\nNordrhein-Westfalen Amtsgericht Dortmund HRB 2144\nTREMONIS Gesellschaft mit beschränkter Haftung Brauerei-Nebenerzeugnisse – Dortmund",
      "type": "Registerbekanntmachung nach dem Umwandlungsgesetz",
      "state": "Nordrhein-Westfalen",
      "amtsgericht": "Amtsgericht Dortmund",
      "registernummer": "HRB 2144",
      "registerart": "HRB",
      "company_name": "TREMONIS Gesellschaft mit beschränkter Haftung Brauerei-Nebenerzeugnisse",
      "company_seat": "Dortmund",
      "details": "06.11.2024 (Bekanntmachungsdatum)\n\nNordrhein-Westfalen Amtsgericht Dortmund HRB 2144\nRegisterbekanntmachung nach dem Umwandlungsgesetz 06.11.2024 (Eintragungsdatum)\n\nTREMONIS Gesellschaft mit beschränkter Haftung Brauerei-Nebenerzeugnisse\nGesellschaft mit beschränkter Haftung\nDortmund\n\nDen Gläubigern der an der Ausgliederung beteiligten Rechtsträger ist, wenn sie binnen sechs Monaten nach dem Tag, an dem die Eintragung der Ausgliederung in das Register des Sitzes desjenigen Rechtsträgers, dessen Gläubiger sie sind, nach § 19 Absatz 3 UmwG als bekanntgemacht gilt, ihren Anspruch nach Grund und Höhe schriftlich anmelden, Sicherheit zu leisten, soweit sie nicht Befriedigung verlangen können. Dieses Recht steht den Gläubigern jedoch nur zu, wenn sie glaubhaft machen, dass durch die Ausgliederung die Erfüllung ihrer Forderung gefährdet wird."
    },
    {
      "date": "2024-11-06",
      "id": "92757",
      "original_text": "Einreichung neuer Dokumente\nNordrhein-Westfalen Amtsgericht Hagen HRB 12207\nZTG Zentrum für Telematik und Telemedizin GmbH – Hagen",
      "type": "Einreichung neuer Dokumente",
      "state": "Nordrhein-Westfalen",
      "amtsgericht": "Amtsgericht Hagen",
      "registernummer": "HRB 12207",
      "registerart": "HRB",
      "company_name": "ZTG Zentrum für Telematik und Telemedizin GmbH",
      "company_seat": "Hagen",
      "details": "06.11.2024 (Bekanntmachungsdatum)\n\nNordrhein-Westfalen Amtsgericht Hagen HRB 12207\nEinreichung neuer Dokumente\n\nZTG Zentrum für Telematik und Telemedizin GmbH\nGesellschaft mit beschränkter Haftung\nHagen\n\nDem Registergericht ist eine neue Liste der Mitglieder des Aufsichtsrates eingereicht worden."
    },
    {
      "date": "2024-11-06",
      "id": "92758",
      "original_text": "Löschungsankündigung\nNordrhein-Westfalen Amtsgericht Köln HRB 61231\nLa Veranda GmbH – Köln",
      "type": "Löschungsankündigung",
      "state": "Nordrhein-Westfalen",
      "amtsgericht": "Amtsgericht Köln",
      "registernummer": "HRB 61231",
      "registerart": "HRB",
      "company_name": "La Veranda GmbH",
      "company_seat": "Köln",
      "details": "06.11.2024 (Bekanntmachungsdatum)\n\nNordrhein-Westfalen Amtsgericht Köln HRB 61231\nLöschungsankündigung\n\nLa Veranda GmbH\nGesellschaft mit beschränkter Haftung\nKöln\n\nDas Registergericht beabsichtigt die Gesellschaft von Amts wegen nach § 394 FamFG zu löschen. Die Frist zur Erhebung eines Widerspruchs ist auf einen Monat festgesetzt."
    },
    {
      "date": "2024-11-06",
      "id": "92759",
      "original_text": "Registerbekanntmachung nach dem Umwandlungsgesetz\nNordrhein-Westfalen Amtsgericht Düsseldorf HRB 104159\nEnetty Holding GmbH – Monheim am Rhein",
      "type": "Registerbekanntmachung nach dem Umwandlungsgesetz",
      "state": "Nordrhein-Westfalen",
      "amtsgericht": "Amtsgericht Düsseldorf",
      "registernummer": "HRB 104159",
      "registerart": "HRB",
      "company_name": "Enetty Holding GmbH",
      "company_seat": "Monheim am Rhein",
      "details": "06.11.2024 (Bekanntmachungsdatum)\n\nNordrhein-Westfalen Amtsgericht Düsseldorf HRB 104159\nRegisterbekanntmachung nach dem Umwandlungsgesetz 06.11.2024 (Eintragungsdatum)\n\nEnetty Holding GmbH\nGesellschaft mit beschränkter Haftung\nMonheim am Rhein\n\nDen Gläubigern der an der Verschmelzung beteiligten Rechtsträger ist, wenn sie binnen sechs Monaten nach dem Tag, an dem die Eintragung der Verschmelzung in das Register des Sitzes desjenigen Rechtsträgers, dessen Gläubiger sie sind, nach § 19 Absatz 3 UmwG als bekanntgemacht gilt, ihren Anspruch nach Grund und Höhe schriftlich anmelden, Sicherheit zu leisten, soweit sie nicht Befriedigung verlangen können. Dieses Recht steht den Gläubigern jedoch nur zu, wenn sie glaubhaft machen, dass durch die Verschmelzung die Erfüllung ihrer Forderung gefährdet wird."
    },
    {
      "date": "2024-11-06",
      "id": "92760",
      "original_text": "Registerbekanntmachung nach dem Umwandlungsgesetz\nNordrhein-Westfalen Amtsgericht Hagen HRA 6569\nFIM Feuerstack Immobilien- und Maschinenvermietung GmbH & Co. KG – Hagen",
      "type": "Registerbekanntmachung nach dem Umwandlungsgesetz",
      "state": "Nordrhein-Westfalen",
      "amtsgericht": "Amtsgericht Hagen",
      "registernummer": "HRA 6569",
      "registerart": "HRA",
      "company_name": "FIM Feuerstack Immobilien- und Maschinenvermietung GmbH & Co. KG",
      "company_seat": "Hagen",
      "details": "06.11.2024 (Bekanntmachungsdatum)\n\nNordrhein-Westfalen Amtsgericht Hagen HRA 6569\nRegisterbekanntmachung nach dem Umwandlungsgesetz 06.11.2024 (Eintragungsdatum)\n\nFIM Feuerstack Immobilien- und Maschinenvermietung GmbH & Co. KG\nKommanditgesellschaft\nHagen\n\nDen Gläubigern der an der Ausgliederung beteiligten Rechtsträger ist, wenn sie binnen sechs Monaten nach dem Tag, an dem die Eintragung der Ausgliederung in das Register des Sitzes derjenigen Rechtsträger deren Gläubiger sie sind, nach § 19 Absatz 3 UmwG als bekanntgemacht gilt, ihren Anspruch nach Grund und Höhe schriftlich anmelden, Sicherheit zu leisten, soweit sie nicht Befriedigung verlangen können. Dieses Recht steht den Gläubigern jedoch nur zu, wenn sie glaubhaft machen, dass durch die Ausgliederung die Erfüllung ihrer Forderung gefährdet wird."
    },
    {
      "date": "2024-11-06",
      "id": "92761",
      "original_text": "Einreichung neuer Dokumente\nNordrhein-Westfalen Amtsgericht Düsseldorf HRB 81054\nISS Communication Services GmbH – Düsseldorf",
      "type": "Einreichung neuer Dokumente",
      "state": "Nordrhein-Westfalen",
      "amtsgericht": "Amtsgericht Düsseldorf",
      "registernummer": "HRB 81054",
      "registerart": "HRB",
      "company_name": "ISS Communication Services GmbH",
      "company_seat": "Düsseldorf",
      "details": "06.11.2024 (Bekanntmachungsdatum)\n\nNordrhein-Westfalen Amtsgericht Düsseldorf HRB 81054\nEinreichung neuer Dokumente\n\nISS Communication Services GmbH\nGesellschaft mit beschränkter Haftung\nDüsseldorf\n\nDem Registergericht ist eine Liste der Mitglieder des Aufsichtsrates eingereicht worden."
    },
    {
      "date": "2024-11-06",
      "id": "92762",
      "original_text": "Löschungsankündigung\nNordrhein-Westfalen Amtsgericht Köln HRB 95231\nPALGIT GmbH – Köln",
      "type": "Löschungsankündigung",
      "state": "Nordrhein-Westfalen",
      "amtsgericht": "Amtsgericht Köln",
      "registernummer": "HRB 95231",
      "registerart": "HRB",
      "company_name": "PALGIT GmbH",
      "company_seat": "Köln",
      "details": "06.11.2024 (Bekanntmachungsdatum)\n\nNordrhein-Westfalen Amtsgericht Köln HRB 95231\nLöschungsankündigung\n\nPALGIT GmbH\nGesellschaft mit beschränkter Haftung\nKöln\n\nDas Registergericht beabsichtigt die Gesellschaft von Amts wegen nach § 394 FamFG zu löschen. Die Frist zur Erhebung eines Widerspruchs ist auf einen Monat festgesetzt."
    },
    {
      "date": "2024-11-06",
      "id": "92763",
      "original_text": "Löschungsankündigung\nNordrhein-Westfalen Amtsgericht Steinfurt HRB 12540\nPLAN Bau- und Handels GmbH – Ibbenbüren",
      "type": "Löschungsankündigung",
      "state": "Nordrhein-Westfalen",
      "amtsgericht": "Amtsgericht Steinfurt",
      "registernummer": "HRB 12540",
      "registerart": "HRB",
      "company_name": "PLAN Bau- und Handels GmbH",
      "company_seat": "Ibbenbüren",
      "details": "06.11.2024 (Bekanntmachungsdatum)\n\nNordrhein-Westfalen Amtsgericht Steinfurt HRB 12540\nLöschungsankündigung\n\nPLAN Bau- und Handels GmbH\nGesellschaft mit beschränkter Haftung\nIbbenbüren\n\nDas Registergericht beabsichtigt, die im Handelsregister eingetragene Gesellschaft gemäß § 394 Absatz 1 FamFG wegen Vermögenslosigkeit von Amts wegen zu löschen.\n\nGegen diese Verfügung kann Widerspruch eingelegt werden. Die Frist zur Erhebung eines Widerspruchs gegen die beabsichtigte Löschung von Amts wegen ist auf einen Monat festgesetzt.\n\nRechtsbehelfsbelehrung:\n\nGegen diese Verfügung können Sie Widerspruch einlegen.\n\nDer Widerspruch ist bei dem Amtsgericht Steinfurt, Gerichtstraße 2, 48565 Steinfurt schriftlich in deutscher Sprache oder zur Niederschrift der Geschäftsstelle einzulegen. Der Widerspruch kann auch zur Niederschrift der Geschäftsstelle eines jeden Amtsgerichtes abgegeben werden.\nDie Einlegung ist auch durch Übertragung eines elektronischen Dokuments an die elektronische Poststelle des Gerichts möglich. Das elektronische Dokument muss für die Bearbeitung durch das Gericht geeignet und mit einer qualifizierten elektronischen Signatur der verantwortenden Person versehen sein oder von der verantwortenden Person signiert und auf einem sicheren Übermittlungsweg gemäß § 130 a ZPO nach näherer Maßgabe der Verordnung über die technischen Rahmenbedingungen des elektronischen Rechtsverkehrs und über das besondere elektronische Behördenpostfach (BGBl. I, S.3803) eingereicht werden. Weitere Informationen erhalten Sie auf der Internetseite www.justiz.de.\n\nDer Widerspruch muss spätestens innerhalb der gesetzten Frist bei dem Amtsgericht Steinfurt eingegangen sein. Dies gilt auch dann, wenn der Widerspruch zur Niederschrift der Geschäftsstelle eines anderen Amtsgerichtes abgegeben wurde. Die Frist beginnt mit der Veröffentlichung. Fällt das Ende der Frist auf einen Sonntag, einen allgemeinen Feiertag oder Sonnabend, so endet die Frist mit Ablauf des nächsten Werktages.\n\nDer Widerspruch muss die Bezeichnung der angefochtenen Verfügung sowie die Erklärung enthalten, dass Widerspruch gegen diese Verfügung eingelegt wird. Er ist zu unterzeichnen und soll begründet werden."
    },
    {
      "date": "2024-11-06",
      "id": "92764",
      "original_text": "Löschungsankündigung\nNordrhein-Westfalen Amtsgericht Düsseldorf HRB 98972\nL&A Bau UG (haftungsbeschränkt) – Düsseldorf",
      "type": "Löschungsankündigung",
      "state": "Nordrhein-Westfalen",
      "amtsgericht": "Amtsgericht Düsseldorf",
      "registernummer": "HRB 98972",
      "registerart": "HRB",
      "company_name": "L&A Bau UG (haftungsbeschränkt)",
      "company_seat": "Düsseldorf",
      "details": "06.11.2024 (Bekanntmachungsdatum)\n\nNordrhein-Westfalen Amtsgericht Düsseldorf HRB 98972\nLöschungsankündigung\n\nL&A Bau UG (haftungsbeschränkt)\nGesellschaft mit beschränkter Haftung\nDüsseldorf\n\nDas Registergericht beabsichtigt die Gesellschaft von Amts wegen nach § 394 FamFG zu löschen. Die Frist zur Erhebung eines Widerspruchs ist auf 3 Wochen festgesetzt.\n\nRechtsbehelfsbelehrung:\nDas Widerspruchsrecht steht jedem zu, der an der Unterlassung der Löschung ein berechtigtes Interesse hat. Der Widerspruch ist bei dem Amtsgericht Düsseldorf -Registergericht-, Werdener Straße 1, 40227 Düsseldorf schriftlich in deutscher Sprache oder zur Niederschrift der Geschäftsstelle einzulegen. Der Widerspruch kann auch zur Niederschrift der Geschäftsstelle eines jeden Amtsgerichtes abgegeben werden. Die Einlegung ist auch durch Übertragung eines elektronischen Dokuments an die elektronische Poststelle des Gerichts möglich. Das elektronische Dokument muss für die Bearbeitung durch das Gericht geeignet und mit einer qualifizierten elektronischen Signatur der verantwortenden Person versehen sein oder von der verantwortenden Person signiert und auf einem sicheren Übermittlungsweg gemäß § 130a ZPO nach näherer Maßgabe der Verordnung über die technischen Rahmenbedingungen des elektronischen Rechtsverkehrs und über das besondere elektronische Behördenpostfach (BGBl. I, S.3803) eingereicht werden. Weitere Informationen erhalten Sie auf der Internetseite www.justiz.de.\nDer Widerspruch muss spätestens innerhalb der gesetzten Frist nach dem Datum der Bekanntmachung der Löschungsankündigung bei dem Amtsgericht - Registergericht - Düsseldorf eingegangen sein.  Dies gilt auch dann, wenn der Widerspruch zur Niederschrift der Geschäftsstelle eines anderen Amtsgerichtes abgegeben wurde. Die Frist beginnt mit dem Tage der Bekanntmachung der Löschungsankündigung in dem für die Bekanntmachung der Eintragungen in das Handelsregister bestimmten elektronischen Informations- und Kommunikationssystem nach § 10 des Handelsgesetzbuches. Fällt das Ende der Frist auf einen Sonntag, einen allgemeinen Feiertag oder Sonnabend, so endet die Frist mit Ablauf des nächsten Werktages.\nDer Widerspruch muss die Bezeichnung der angefochtenen Löschungsankündigung sowie die Erklärung enthalten, dass Widerspruch gegen diese Löschungsankündigung eingelegt wird. Er ist zu unterzeichnen und soll begründet werden."
    },
    {
      "date": "2024-11-06",
      "id": "92765",
      "original_text": "Registerbekanntmachung nach dem Umwandlungsgesetz\nNordrhein-Westfalen Amtsgericht Köln HRA 37661\nSusannah Mathieson eingetragene Kauffrau – Frechen",
      "type": "Registerbekanntmachung nach dem Umwandlungsgesetz",
      "state": "Nordrhein-Westfalen",
      "amtsgericht": "Amtsgericht Köln",
      "registernummer": "HRA 37661",
      "registerart": "HRA",
      "company_name": "Susannah Mathieson eingetragene Kauffrau",
      "company_seat": "Frechen",
      "details": "06.11.2024 (Bekanntmachungsdatum)\n\nNordrhein-Westfalen Amtsgericht Köln HRA 37661\nRegisterbekanntmachung nach dem Umwandlungsgesetz 06.11.2024 (Eintragungsdatum)\n\nSusannah Mathieson eingetragene Kauffrau\nEinzelkaufmann / Einzelkauffrau\nFrechen\n\nDen Gläubigern der an der Ausgliederung beteiligten Rechtsträger ist, wenn sie binnen sechs Monaten nach dem Tag, an dem die Eintragung der Ausgliederung in das Register des Sitzes desjenigen Rechtsträgers, dessen Gläubiger sie sind, nach § 19 Absatz 3 UmwG als bekanntgemacht gilt, ihren Anspruch nach Grund und Höhe schriftlich anmelden, Sicherheit zu leisten, soweit sie nicht Befriedigung verlangen können. Dieses Recht steht den Gläubigern jedoch nur zu, wenn sie glaubhaft machen, dass durch die Ausgliederung die Erfüllung ihrer Forderung gefährdet wird."
    },
    {
      "date": "2024-11-06",
      "id": "92766",
      "original_text": "Registerbekanntmachung nach dem Umwandlungsgesetz\nNordrhein-Westfalen Amtsgericht Gütersloh HRB 12750\nProjektgesellschaft Heerter Straße mbH – Gütersloh",
      "type": "Registerbekanntmachung nach dem Umwandlungsgesetz",
      "state": "Nordrhein-Westfalen",
      "amtsgericht": "Amtsgericht Gütersloh",
      "registernummer": "HRB 12750",
      "registerart": "HRB",
      "company_name": "Projektgesellschaft Heerter Straße mbH",
      "company_seat": "Gütersloh",
      "details": "06.11.2024 (Bekanntmachungsdatum)\n\nNordrhein-Westfalen Amtsgericht Gütersloh HRB 12750\nRegisterbekanntmachung nach dem Umwandlungsgesetz 06.11.2024 (Eintragungsdatum)\n\nProjektgesellschaft Heerter Straße mbH\nGesellschaft mit beschränkter Haftung\nGütersloh\n\nDen Gläubigern der an der formwechselnden Umwandlung beteiligten Rechtsträger ist, wenn sie binnen sechs Monaten nach dem Tag, an dem die Eintragung der formwechselnden Umwandlung in das Register des Sitzes desjenigen Rechtsträgers, dessen Gläubiger sie sind, nach § 19 Absatz 3 UmwG als bekanntgemacht gilt, ihren Anspruch nach Grund und Höhe schriftlich anmelden, Sicherheit zu leisten, soweit sie nicht Befriedigung verlangen können. Dieses Recht steht den Gläubigern jedoch nur zu, wenn sie glaubhaft machen, dass durch die formwechselnden Umwandlung die Erfüllung ihrer Forderung gefährdet wird."
    },
    {
      "date": "2024-11-06",
      "id": "92767",
      "original_text": "Registerbekanntmachung nach dem Umwandlungsgesetz\nNordrhein-Westfalen Amtsgericht Wuppertal HRA 24558\nBIKI Grundstücksverwaltungs-KG – Wuppertal",
      "type": "Registerbekanntmachung nach dem Umwandlungsgesetz",
      "state": "Nordrhein-Westfalen",
      "amtsgericht": "Amtsgericht Wuppertal",
      "registernummer": "HRA 24558",
      "registerart": "HRA",
      "company_name": "BIKI Grundstücksverwaltungs-KG",
      "company_seat": "Wuppertal",
      "details": "06.11.2024 (Bekanntmachungsdatum)\n\nNordrhein-Westfalen Amtsgericht Wuppertal HRA 24558\nRegisterbekanntmachung nach dem Umwandlungsgesetz 06.11.2024 (Eintragungsdatum)\n\nBIKI Grundstücksverwaltungs-KG\nKommanditgesellschaft\nWuppertal\n\nDen Gläubigern der an der formwechselnden Umwandlung beteiligten Rechtsträger ist, wenn sie binnen sechs Monaten nach dem Tag, an dem die Eintragung der formwechselnden Umwandlung in das Register des Sitzes desjenigen Rechtsträgers, dessen Gläubiger sie sind, nach § 19 Absatz 3 UmwG als bekanntgemacht gilt, ihren Anspruch nach Grund und Höhe schriftlich anmelden, Sicherheit zu leisten, soweit sie nicht Befriedigung verlangen können. Dieses Recht steht den Gläubigern jedoch nur zu, wenn sie glaubhaft machen, dass durch die formwechselnden Umwandlung die Erfüllung ihrer Forderung gefährdet wird."
    },
    {
      "date": "2024-11-06",
      "id": "92768",
      "original_text": "Löschungsankündigung\nNordrhein-Westfalen Amtsgericht Bochum HRB 20617\nBruno Bau GmbH – Herne",
      "type": "Löschungsankündigung",
      "state": "Nordrhein-Westfalen",
      "amtsgericht": "Amtsgericht Bochum",
      "registernummer": "HRB 20617",
      "registerart": "HRB",
      "company_name": "Bruno Bau GmbH",
      "company_seat": "Herne",
      "details": "06.11.2024 (Bekanntmachungsdatum)\n\nNordrhein-Westfalen Amtsgericht Bochum HRB 20617\nLöschungsankündigung 07.11.2024 (Eintragungsdatum)\n\nBruno Bau GmbH\nGesellschaft mit beschränkter Haftung\nHerne\n\nDas Registergericht beabsichtigt die Gesellschaft von Amts wegen nach § 394 FamFG zu löschen. Die Frist zur Erhebung eines Widerspruchs ist auf drei Monate festgesetzt."
    },
    {
      "date": "2024-11-06",
      "id": "92769",
      "original_text": "Registerbekanntmachung nach dem Umwandlungsgesetz\nNordrhein-Westfalen Amtsgericht Essen PR 3365\nWegen & Borkenhagen Partnerschaft Physiotherapeuten – Bonn",
      "type": "Registerbekanntmachung nach dem Umwandlungsgesetz",
      "state": "Nordrhein-Westfalen",
      "amtsgericht": "Amtsgericht Essen",
      "registernummer": "PR 3365",
      "registerart": "PR",
      "company_name": "Wegen & Borkenhagen Partnerschaft Physiotherapeuten",
      "company_seat": "Bonn",
      "details": "06.11.2024 (Bekanntmachungsdatum)\n\nNordrhein-Westfalen Amtsgericht Essen PR 3365\nRegisterbekanntmachung nach dem Umwandlungsgesetz 06.11.2024 (Eintragungsdatum)\n\nWegen & Borkenhagen Partnerschaft Physiotherapeuten\nPartnerschaftsgesellschaft\nBonn\n\nDen Gläubigern der an der formwechselnden Umwandlung  beteiligten Rechtsträger ist, wenn sie binnen sechs Monaten nach dem Tag, an dem die Eintragung der formwechselnden Umwandlung in das Register des Sitzes desjenigen Rechtsträgers, dessen Gläubiger sie sind, nach § 19 Absatz 3 UmwG als bekanntgemacht gilt, ihren Anspruch nach Grund und Höhe schriftlich anmelden, Sicherheit zu leisten, soweit sie nicht Befriedigung verlangen können. Dieses Recht steht den Gläubigern jedoch nur zu, wenn sie glaubhaft machen, dass durch die formwechselnde Umwandlung die Erfüllung ihrer Forderung gefährdet wird."
    },
    {
      "date": "2024-11-06",
      "id": "92770",
      "original_text": "Löschungsankündigung\nNordrhein-Westfalen Amtsgericht Köln HRB 112172\nD-TEAM GmbH – Aachen",
      "type": "Löschungsankündigung",
      "state": "Nordrhein-Westfalen",
      "amtsgericht": "Amtsgericht Köln",
      "registernummer": "HRB 112172",
      "registerart": "HRB",
      "company_name": "D-TEAM GmbH",
      "company_seat": "Aachen",
      "details": "06.11.2024 (Bekanntmachungsdatum)\n\nNordrhein-Westfalen Amtsgericht Köln HRB 112172\nLöschungsankündigung\n\nD-TEAM GmbH\nGesellschaft mit beschränkter Haftung\nAachen\n\nDas Registergericht beabsichtigt die Gesellschaft von Amts wegen nach § 394 FamFG zu löschen. Die Frist zur Erhebung eines Widerspruchs ist auf einen Monat festgesetzt."
    },
    {
      "date": "2024-11-06",
      "id": "92771",
      "original_text": "Sonstige Registerbekanntmachung\nNordrhein-Westfalen Amtsgericht Gütersloh HRB 11257\nGründer und Tönjes Holding GmbH – Rheda-Wiedenbrück",
      "type": "Sonstige Registerbekanntmachung",
      "state": "Nordrhein-Westfalen",
      "amtsgericht": "Amtsgericht Gütersloh",
      "registernummer": "HRB 11257",
      "registerart": "HRB",
      "company_name": "Gründer und Tönjes Holding GmbH",
      "company_seat": "Rheda-Wiedenbrück",
      "details": "06.11.2024 (Bekanntmachungsdatum)\n\nNordrhein-Westfalen Amtsgericht Gütersloh HRB 11257\nSonstige Registerbekanntmachung\n\nGründer und Tönjes Holding GmbH\nGesellschaft mit beschränkter Haftung\nRheda-Wiedenbrück\n\nIn der Handelsregistersache Gründer und Tönjes Holding GmbH\nwird aufgrund der am 26.05.2023 durch den Bürgermeister der Stadt Lippstadt (Fachbereich Recht und Ordnung) gegen den alleinigen Geschäftsführer Johannes Gründer angeordneten Gewerbeuntersagung und der diesbezüglichen Eintragung im Gewerbezentralregister\ndie Eintragung des Herrn Johannes Gründer, geb. 28.04.1966, als Geschäftsführer der Gründer und Tönjes Holding GmbH gem. 395 FamFG gelöscht."
    },
    {
      "date": "2024-11-06",
      "id": "92772",
      "original_text": "Löschungsankündigung\nNordrhein-Westfalen Amtsgericht Köln HRA 27300\nKAP 1 Parkgarage GmbH & Co. KG – Köln",
      "type": "Löschungsankündigung",
      "state": "Nordrhein-Westfalen",
      "amtsgericht": "Amtsgericht Köln",
      "registernummer": "HRA 27300",
      "registerart": "HRA",
      "company_name": "KAP 1 Parkgarage GmbH & Co. KG",
      "company_seat": "Köln",
      "details": "06.11.2024 (Bekanntmachungsdatum)\n\nNordrhein-Westfalen Amtsgericht Köln HRA 27300\nLöschungsankündigung\n\nKAP 1 Parkgarage GmbH & Co. KG\nKommanditgesellschaft\nKöln\n\nDas Registergericht beabsichtigt die Firma von Amts wegen , wegen Aufgabe des Geschäftsbetriebs, nach § 393 FamFG zu löschen. Die Frist zur Erhebung eines Widerspruchs ist auf einen Monat festgesetzt."
    },
    {
      "date": "2024-11-06",
      "id": "92773",
      "original_text": "Registerbekanntmachung nach dem Umwandlungsgesetz\nNordrhein-Westfalen Amtsgericht Bad Oeynhausen HRB 13458\nWehrmann Backwaren GmbH – Hiddenhausen",
      "type": "Registerbekanntmachung nach dem Umwandlungsgesetz",
      "state": "Nordrhein-Westfalen",
      "amtsgericht": "Amtsgericht Bad Oeynhausen",
      "registernummer": "HRB 13458",
      "registerart": "HRB",
      "company_name": "Wehrmann Backwaren GmbH",
      "company_seat": "Hiddenhausen",
      "details": "06.11.2024 (Bekanntmachungsdatum)\n\nNordrhein-Westfalen Amtsgericht Bad Oeynhausen HRB 13458\nRegisterbekanntmachung nach dem Umwandlungsgesetz 06.11.2024 (Eintragungsdatum)\n\nWehrmann Backwaren GmbH\nGesellschaft mit beschränkter Haftung\nHiddenhausen\n\nDen Gläubigern der an der Verschmelzung beteiligten Rechtsträger ist, wenn sie binnen sechs Monaten nach dem Tag, an dem die Eintragung der Verschmelzung in das Register des Sitzes desjenigen Rechtsträgers, dessen Gläubiger sie sind, nach § 19 Absatz 3 UmwG als bekanntgemacht gilt, ihren Anspruch nach Grund und Höhe schriftlich anmelden, Sicherheit zu leisten, soweit sie nicht Befriedigung verlangen können. Dieses Recht steht den Gläubigern jedoch nur zu, wenn sie glaubhaft machen, dass durch die Verschmelzung die Erfüllung ihrer Forderung gefährdet wird."
    },
    {
      "date": "2024-11-06",
      "id": "92774",
      "original_text": "Löschungsankündigung\nNordrhein-Westfalen Amtsgericht Bad Oeynhausen HRA 4130\nHagemeier GmbH & Co.KG – Enger",
      "type": "Löschungsankündigung",
      "state": "Nordrhein-Westfalen",
      "amtsgericht": "Amtsgericht Bad Oeynhausen",
      "registernummer": "HRA 4130",
      "registerart": "HRA",
      "company_name": "Hagemeier GmbH & Co.KG",
      "company_seat": "Enger",
      "details": "06.11.2024 (Bekanntmachungsdatum)\n\nNordrhein-Westfalen Amtsgericht Bad Oeynhausen HRA 4130\nLöschungsankündigung\n\nHagemeier GmbH & Co.KG\nKommanditgesellschaft\nEnger\n\nDas Registergericht beabsichtigt die Firma von Amts wegen nach § 394 FamFG zu löschen. Die Frist zur Erhebung eines Widerspruchs ist auf einen Monat festgesetzt."
    },
    {
      "date": "2024-11-06",
      "id": "92775",
      "original_text": "Löschungsankündigung\nNordrhein-Westfalen Amtsgericht Dortmund HRB 17966 früher Amtsgericht Lünen\nAtrium Enterprises GmbH – Lünen",
      "type": "Löschungsankündigung",
      "state": "Nordrhein-Westfalen",
      "amtsgericht": "Amtsgericht Dortmund",
      "registernummer": "HRB 17966",
      "registerart": "HRB",
      "company_name": "Atrium Enterprises GmbH",
      "company_seat": "Lünen",
      "former_amtsgericht": "Lünen",
      "details": "06.11.2024 (Bekanntmachungsdatum)\n\nNordrhein-Westfalen Amtsgericht Dortmund HRB 17966 früher Amtsgericht Lünen\nLöschungsankündigung\n\nAtrium Enterprises GmbH\nGesellschaft mit beschränkter Haftung\nLünen\n\nDas Registergericht beabsichtigt die Gesellschaft von Amts wegen nach § 394 FamFG zu löschen. Die Frist zur Erhebung eines Widerspruchs ist auf zwei Monate festgesetzt."
    },
    {
      "date": "2024-11-06",
      "id": "92776",
      "original_text": "Löschungsankündigung\nNordrhein-Westfalen Amtsgericht Aachen HRB 18943\nRheindorf GmbH – Würselen",
      "type": "Löschungsankündigung",
      "state": "Nordrhein-Westfalen",
      "amtsgericht": "Amtsgericht Aachen",
      "registernummer": "HRB 18943",
      "registerart": "HRB",
      "company_name": "Rheindorf GmbH",
      "company_seat": "Würselen",
      "details": "06.11.2024 (Bekanntmachungsdatum)\n\nNordrhein-Westfalen Amtsgericht Aachen HRB 18943\nLöschungsankündigung\n\nRheindorf GmbH\nGesellschaft mit beschränkter Haftung\nWürselen\n\nDas Registergericht beabsichtigt, von Amts wegen die Gesellschaft wegen Vermögenslosigkeit nach § 394 FamFG zu löschen, weil das Insolvenzverfahren Amtsgericht Aachen (Az.: 93 IN 156/18) beendet und Vermögen der Gesellschaft nicht mehr erkennbar ist.\n\nZur Geltendmachung des Widerspruchs gegen die beabsichtigte Löschung wird hiermit eine Frist von einem Monat ab Veröffentlichung dieser Ankündigung bestimmt.\n\nRechtsbehelfsbelehrung:\n\nGegen diese Verfügung kann Widerspruch eingelegt werden. Zum Widerspruch ist jeder berechtigt, der an der Unterlassung der Löschung ein berechtigtes Interesse hat.\n\nDer Widerspruch ist bei dem Amtsgericht Aachen, Adalbertsteinweg 92, 52070 Aachen schriftlich in deutscher Sprache oder zur Niederschrift der Geschäftsstelle einzulegen. Der Widerspruch kann auch zur Niederschrift der Geschäftsstelle eines jeden Amtsgerichtes abgegeben werden.\n\nDer Widerspruch muss spätestens innerhalb der gesetzten Frist nach der Bekanntgabe der Verfügung bei dem Amtsgericht Aachen eingegangen sein. Dies gilt auch dann, wenn der Widerspruch zur Niederschrift der Geschäftsstelle eines anderen Amtsgerichtes abgegeben wurde. Die Frist beginnt mit der Bekanntgabe der Verfügung durch Veröffentlichung. Fällt das Ende der Frist auf einen Sonntag, einen allgemeinen Feiertag oder Sonnabend, so endet die Frist mit Ablauf des nächsten Werktages.\n\nDer Widerspruch muss die Bezeichnung der angefochtenen Verfügung sowie die Erklärung enthalten, dass Widerspruch gegen diese Verfügung eingelegt wird. Er ist zu unterzeichnen und soll begründet werden.\n\nDie Einlegung ist auch durch Übertragung eines elektronischen Dokuments an die elektronische Poststelle des Gerichts möglich. Das elektronische Dokument muss für die Bearbeitung durch das Gericht geeignet und mit einer qualifizierten elektronischen Signatur der verantwortenden Person versehen sein oder von der verantwortenden Person signiert und auf einem sicheren Übermittlungsweg gemäß § 130 a ZPO nach näherer Maßgabe der Verordnung über die technischen Rahmenbedingungen des elektronischen Rechtsverkehrs und über das besondere elektronische Behördenpostfach (BGBl. I, S. 3803) eingereicht werden. Weitere Informationen erhalten Sie auf der Internetseite www.justiz.de."
    },
    {
      "date": "2024-11-06",
      "id": "92777",
      "original_text": "Löschungsankündigung\nNordrhein-Westfalen Amtsgericht Essen HRB 27025\nAlthuraya GPS Ortungssysteme UG (haftungsbeschränkt) – Essen",
      "type": "Löschungsankündigung",
      "state": "Nordrhein-Westfalen",
      "amtsgericht": "Amtsgericht Essen",
      "registernummer": "HRB 27025",
      "registerart": "HRB",
      "company_name": "Althuraya GPS Ortungssysteme UG (haftungsbeschränkt)",
      "company_seat": "Essen",
      "details": "06.11.2024 (Bekanntmachungsdatum)\n\nNordrhein-Westfalen Amtsgericht Essen HRB 27025\nLöschungsankündigung\n\nAlthuraya GPS Ortungssysteme UG (haftungsbeschränkt)\nGesellschaft mit beschränkter Haftung\nEssen\n\nDas Registergericht beabsichtigt die Gesellschaft von Amts wegen nach § 394 FamFG zu löschen. Die Frist zur Erhebung eines Widerspruchs ist auf einen Monat festgesetzt."
    },
    {
      "date": "2024-11-06",
      "id": "92778",
      "original_text": "Einreichung neuer Dokumente\nHessen Amtsgericht Darmstadt HRB 4915\nTÜV Technische Überwachung Hessen GmbH – Darmstadt",
      "type": "Einreichung neuer Dokumente",
      "state": "Hessen",
      "amtsgericht": "Amtsgericht Darmstadt",
      "registernummer": "HRB 4915",
      "registerart": "HRB",
      "company_name": "TÜV Technische Überwachung Hessen GmbH",
      "company_seat": "Darmstadt",
      "details": "06.11.2024 (Bekanntmachungsdatum)\n\nHessen Amtsgericht Darmstadt HRB 4915\nEinreichung neuer Dokumente\n\nTÜV Technische Überwachung Hessen GmbH\nGesellschaft mit beschränkter Haftung\nDarmstadt\n\nDurch eine Änderung in den Personen der Aufsichtsratsmitglieder ist eine Liste der Mitglieder des Aufsichtsrates zum Handelsregister eingereicht worden."
    },
    {
      "date": "2024-11-06",
      "id": "92779",
      "original_text": "Sonstige Registerbekanntmachung\nHessen Amtsgericht Darmstadt VR 82701\nLebenskunst e. V. – Bensheim",
      "type": "Sonstige Registerbekanntmachung",
      "state": "Hessen",
      "amtsgericht": "Amtsgericht Darmstadt",
      "registernummer": "VR 82701",
      "registerart": "VR",
      "company_name": "Lebenskunst e. V.",
      "company_seat": "Bensheim",
      "details": "06.11.2024 (Bekanntmachungsdatum)\n\nHessen Amtsgericht Darmstadt VR 82701\nSonstige Registerbekanntmachung 06.11.2024 (Eintragungsdatum)\n\nLebenskunst e. V.\neingetragener Verein\nBensheim\n\nDer Verein ist aufgelöst."
    },
    {
      "date": "2024-11-06",
      "id": "92780",
      "original_text": "Registerbekanntmachung nach dem Umwandlungsgesetz\nHessen Amtsgericht Limburg HRA 3594\nMalerwerk Limburg GmbH & Co. KG – Limburg",
      "type": "Registerbekanntmachung nach dem Umwandlungsgesetz",
      "state": "Hessen",
      "amtsgericht": "Amtsgericht Limburg",
      "registernummer": "HRA 3594",
      "registerart": "HRA",
      "company_name": "Malerwerk Limburg GmbH & Co. KG",
      "company_seat": "Limburg",
      "details": "06.11.2024 (Bekanntmachungsdatum)\n\nHessen Amtsgericht Limburg HRA 3594\nRegisterbekanntmachung nach dem Umwandlungsgesetz 06.11.2024 (Eintragungsdatum)\n\nMalerwerk Limburg GmbH & Co. KG\nKommanditgesellschaft\nLimburg\n\nDen Gläubigern der an der Ausgliederung beteiligten Rechtsträger ist, wenn sie binnen sechs Monaten nach dem Tag, an dem die Eintragung der Ausgliederung in das Register des Sitzes derjenigen Rechtsträger deren Gläubiger sie sind, nach §§ 125, 19 Absatz 3 UmwG bekannt gemacht worden ist, ihren Anspruch nach Grund und Höhe schriftlich anmelden, Sicherheit zu leisten, soweit sie nicht Befriedigung verlangen können. Dieses Recht steht den Gläubigern jedoch nur zu, wenn sie glaubhaft machen, dass durch die Ausgliederung die Erfüllung ihrer Forderung gefährdet wird."
    },
    {
      "date": "2024-11-06",
      "id": "92781",
      "original_text": "Sonstige Registerbekanntmachung\nHessen Amtsgericht Wetzlar VR 1088\nIndustriemeister-Vereinigung Wetzlar e.V. – Wetzlar",
      "type": "Sonstige Registerbekanntmachung",
      "state": "Hessen",
      "amtsgericht": "Amtsgericht Wetzlar",
      "registernummer": "VR 1088",
      "registerart": "VR",
      "company_name": "Industriemeister-Vereinigung Wetzlar e.V.",
      "company_seat": "Wetzlar",
      "details": "06.11.2024 (Bekanntmachungsdatum)\n\nHessen Amtsgericht Wetzlar VR 1088\nSonstige Registerbekanntmachung 06.11.2024 (Eintragungsdatum)\n\nIndustriemeister-Vereinigung Wetzlar e.V.\neingetragener Verein\nWetzlar\n\nDer Verein ist aufgelöst."
    },
    {
      "date": "2024-11-06",
      "id": "92782",
      "original_text": "Einreichung neuer Dokumente\nHessen Amtsgericht Bad Homburg v.d.H. HRB 13940\nf-fex AG – Bad Homburg v. d. Höhe",
      "type": "Einreichung neuer Dokumente",
      "state": "Hessen",
      "amtsgericht": "Amtsgericht Bad Homburg v.d.H.",
      "registernummer": "HRB 13940",
      "registerart": "HRB",
      "company_name": "f-fex AG",
      "company_seat": "Bad Homburg v. d. Höhe",
      "details": "06.11.2024 (Bekanntmachungsdatum)\n\nHessen Amtsgericht Bad Homburg v.d.H. HRB 13940\nEinreichung neuer Dokumente\n\nf-fex AG\nAktiengesellschaft\nBad Homburg v. d. Höhe\n\nDurch eine Änderung in den Personen der Aufsichtsratsmitglieder ist eine Liste der Mitglieder des Aufsichtsrates zum Handelsregister eingereicht worden."
    },
    {
      "date": "2024-11-06",
      "id": "92783",
      "original_text": "Löschungsankündigung\nHessen Amtsgericht Gießen HRB 11289\nAKI-MONTAGE Deutschland GmbH – Allendorf (Lumda)",
      "type": "Löschungsankündigung",
      "state": "Hessen",
      "amtsgericht": "Amtsgericht Gießen",
      "registernummer": "HRB 11289",
      "registerart": "HRB",
      "company_name": "AKI-MONTAGE Deutschland GmbH",
      "company_seat": "Allendorf (Lumda)",
      "details": "06.11.2024 (Bekanntmachungsdatum)\n\nHessen Amtsgericht Gießen HRB 11289\nLöschungsankündigung\n\nAKI-MONTAGE Deutschland GmbH\nGesellschaft mit beschränkter Haftung\nAllendorf (Lumda)\n\nAuf Antrag des Finanzamts ist beabsichtigt, die Gesellschaft wegen Vermögenslosigkeit gemäß § 394 FamFG von Amts wegen zu löschen. Hiergegen kann innerhalb von drei Monaten nach dieser Veröffentlichung Widerspruch beim Amtsgericht Gießen eingelegt werden. Sollte Widerspruch eingelegt werden, dürfte dies nur mit Begründung erfolgversprechend sein. Insbesondere sollte vorhandenes Vermögen der Gesellschaft innerhalb der genannten Frist nachgewiesen werden."
    },
    {
      "date": "2024-11-06",
      "id": "92784",
      "original_text": "Löschungsankündigung\nHessen Amtsgericht Darmstadt HRA 84417\nBörner Montagen GmbH & Co. KG – Viernheim",
      "type": "Löschungsankündigung",
      "state": "Hessen",
      "amtsgericht": "Amtsgericht Darmstadt",
      "registernummer": "HRA 84417",
      "registerart": "HRA",
      "company_name": "Börner Montagen GmbH & Co. KG",
      "company_seat": "Viernheim",
      "details": "06.11.2024 (Bekanntmachungsdatum)\n\nHessen Amtsgericht Darmstadt HRA 84417\nLöschungsankündigung\n\nBörner Montagen GmbH & Co. KG\nKommanditgesellschaft\nViernheim\n\nDie oben genannte Firma ist nach hiesiger Erkenntnis erloschen.\nGemäß § 31 Abs. 2 S. 2 HGB soll das Erlöschen der Firma von Amts wegen in das Handelsregister eingetragen werden.\nVon diesem Vorhaben werden die bisherigen Gesellschafter oder deren Rechtsnachfolger auf diesem Wege unterrichtet.\nZugleich wird ihnen zur etwaigen Geltendmachung eines Widerspruchs eine Frist von 3 Monaten bestimmt."
    },
    {
      "date": "2024-11-06",
      "id": "92785",
      "original_text": "Registerbekanntmachung nach dem Umwandlungsgesetz\nHessen Amtsgericht Limburg HRA 3585\nYusuf Arslan e.K. – Limburg an der Lahn",
      "type": "Registerbekanntmachung nach dem Umwandlungsgesetz",
      "state": "Hessen",
      "amtsgericht": "Amtsgericht Limburg",
      "registernummer": "HRA 3585",
      "registerart": "HRA",
      "company_name": "Yusuf Arslan e.K.",
      "company_seat": "Limburg an der Lahn",
      "details": "06.11.2024 (Bekanntmachungsdatum)\n\nHessen Amtsgericht Limburg HRA 3585\nRegisterbekanntmachung nach dem Umwandlungsgesetz 06.11.2024 (Eintragungsdatum)\n\nYusuf Arslan e.K.\nEinzelkaufmann / Einzelkauffrau\nLimburg an der Lahn\n\nDen Gläubigern der an der Ausgliederung beteiligten Rechtsträger ist, wenn sie binnen sechs Monaten nach dem Tag, an dem die Eintragung der Ausgliederung in das Register des Sitzes derjenigen Rechtsträger deren Gläubiger sie sind, nach §§ 125, 19 Absatz 3 UmwG bekannt gemacht worden ist, ihren Anspruch nach Grund und Höhe schriftlich anmelden, Sicherheit zu leisten, soweit sie nicht Befriedigung verlangen können. Dieses Recht steht den Gläubigern jedoch nur zu, wenn sie glaubhaft machen, dass durch die Ausgliederung die Erfüllung ihrer Forderung gefährdet wird."
    },
    {
      "date": "2024-11-06",
      "id": "92786",
      "original_text": "Löschungsankündigung\nHessen Amtsgericht Frankfurt am Main HRB 125473\nSaeed GmbH – Frankfurt am Main",
      "type": "Löschungsankündigung",
      "state": "Hessen",
      "amtsgericht": "Amtsgericht Frankfurt am Main",
      "registernummer": "HRB 125473",
      "registerart": "HRB",
      "company_name": "Saeed GmbH",
      "company_seat": "Frankfurt am Main",
      "details": "06.11.2024 (Bekanntmachungsdatum)\n\nHessen Amtsgericht Frankfurt am Main HRB 125473\nLöschungsankündigung\n\nSaeed GmbH\nGesellschaft mit beschränkter Haftung\nFrankfurt am Main\n\nDas Registergericht beabsichtigt die im Handelsregister eingetragene Gesellschaft von Amts wegen nach § 394 FamFG zu löschen. Die Frist zur Erhebung eines Widerspruchs gegen die beabsichtigte Löschung wird auf 1 Monate festgesetzt."
    },
    {
      "date": "2024-11-06",
      "id": "92787",
      "original_text": "Löschungsankündigung\nHessen Amtsgericht Darmstadt HRB 101410\nOROSTA Personal GmbH – Breuberg",
      "type": "Löschungsankündigung",
      "state": "Hessen",
      "amtsgericht": "Amtsgericht Darmstadt",
      "registernummer": "HRB 101410",
      "registerart": "HRB",
      "company_name": "OROSTA Personal GmbH",
      "company_seat": "Breuberg",
      "details": "06.11.2024 (Bekanntmachungsdatum)\n\nHessen Amtsgericht Darmstadt HRB 101410\nLöschungsankündigung\n\nOROSTA Personal GmbH\nGesellschaft mit beschränkter Haftung\nBreuberg\n\nDas Registergericht beabsichtigt die im Handelsregister eingetragene Gesellschaft von Amts wegen nach § 394 FamFG zu löschen. Die Frist zur Erhebung eines Widerspruchs gegen die beabsichtigte Löschung wird auf 3 Monate festgesetzt."
    }
  ]
}