{
  "date": "2024-11-15",
  "date_of_scrape": "2024-11-30T13:11:11.217Z",
  "tool_version": "0.2.0",
  "number_of_announcements": 110,
  "announcements": [
    {
      "date": "2024-11-15",
      "id": "93675",
      "original_text": "Löschungsankündigung\nSachsen-Anhalt Amtsgericht Stendal VR 68350\n\"Colbitzer Heimatfreunde e.V.\" – Colbitz",
      "type": "Löschungsankündigung",
      "state": "Sachsen-Anhalt",
      "amtsgericht": "Amtsgericht Stendal",
      "registernummer": "VR 68350",
      "registerart": "VR",
      "company_name": "\"Colbitzer Heimatfreunde e.V.\"",
      "company_seat": "Colbitz",
      "details": "15.11.2024 (Bekanntmachungsdatum)\n\nSachsen-Anhalt Amtsgericht Stendal VR 68350\nLöschungsankündigung\n\n\"Colbitzer Heimatfreunde e.V.\"\neingetragener Verein\nColbitz\n\nDas Registergericht beabsichtigt, vorstehenden Verein infolge Wegfalls sämtlicher Mitglieder bzw. vollständiger Aufgabe des Vereinszwecks v.A.w. zu löschen. Die Frist zur Erhebung eines Widerspruchs gegen die beabsichtigte Löschung wird auf drei Monate festgesetzt."
    },
    {
      "date": "2024-11-15",
      "id": "93716",
      "original_text": "Löschungsankündigung\nHessen Amtsgericht Frankfurt am Main HRB 98852\nA & S Event & Marketing GmbH – Frankfurt am Main",
      "type": "Löschungsankündigung",
      "state": "Hessen",
      "amtsgericht": "Amtsgericht Frankfurt am Main",
      "registernummer": "HRB 98852",
      "registerart": "HRB",
      "company_name": "A & S Event & Marketing GmbH",
      "company_seat": "Frankfurt am Main",
      "details": "15.11.2024 (Bekanntmachungsdatum)\n\nHessen Amtsgericht Frankfurt am Main HRB 98852\nLöschungsankündigung\n\nA & S Event & Marketing GmbH\nGesellschaft mit beschränkter Haftung\nFrankfurt am Main\n\nEs ist beabsichtigt, die Gesellschaft wegen Vermögenslosigkeit gemäß § 394 FamFG von Amts wegen im Handelsregister zu löschen. Hiergegen kann innerhalb eines Monats nach dieser Veröffentlichung Widerspruch bei dem Amtsgericht Frankfurt am Main eingelegt werden."
    },
    {
      "date": "2024-11-15",
      "id": "93720",
      "original_text": "Löschungsankündigung\nHessen Amtsgericht Frankfurt am Main HRB 92092\nAHD Motion GmbH – Frankfurt am Main",
      "type": "Löschungsankündigung",
      "state": "Hessen",
      "amtsgericht": "Amtsgericht Frankfurt am Main",
      "registernummer": "HRB 92092",
      "registerart": "HRB",
      "company_name": "AHD Motion GmbH",
      "company_seat": "Frankfurt am Main",
      "details": "15.11.2024 (Bekanntmachungsdatum)\n\nHessen Amtsgericht Frankfurt am Main HRB 92092\nLöschungsankündigung\n\nAHD Motion GmbH\nGesellschaft mit beschränkter Haftung\nFrankfurt am Main\n\nDas Registergericht beabsichtigt die im Handelsregister eingetragene Gesellschaft von Amts wegen nach § 394 FamFG zu löschen. Die Frist zur Erhebung eines Widerspruchs gegen die beabsichtigte Löschung wird auf 1 Monat festgesetzt."
    },
    {
      "date": "2024-11-15",
      "id": "93646",
      "original_text": "Löschungsankündigung\nBaden-Württemberg Amtsgericht Mannheim HRB 715427\nAM Stahl- und Metallbau GmbH – Mannheim",
      "type": "Löschungsankündigung",
      "state": "Baden-Württemberg",
      "amtsgericht": "Amtsgericht Mannheim",
      "registernummer": "HRB 715427",
      "registerart": "HRB",
      "company_name": "AM Stahl- und Metallbau GmbH",
      "company_seat": "Mannheim",
      "details": "15.11.2024 (Bekanntmachungsdatum)\n\nBaden-Württemberg Amtsgericht Mannheim HRB 715427\nLöschungsankündigung\n\nAM Stahl- und Metallbau GmbH\nGesellschaft mit beschränkter Haftung\nMannheim\n\nDas Gericht beabsichtigt, die Gesellschaft wegen Vermögenslosigkeit im Handelsregister von Amts wegen nach § 394 FamFG zu löschen. Die Frist zur Geltendmachung eines Widerspruchs gegen die beabsichtigte Löschung ist auf einen Monat ab Veröffentlichung bestimmt."
    },
    {
      "date": "2024-11-15",
      "id": "93721",
      "original_text": "Einreichung neuer Dokumente\nHessen Amtsgericht Wiesbaden HRB 13184\nAareal Bank AG – Wiesbaden",
      "type": "Einreichung neuer Dokumente",
      "state": "Hessen",
      "amtsgericht": "Amtsgericht Wiesbaden",
      "registernummer": "HRB 13184",
      "registerart": "HRB",
      "company_name": "Aareal Bank AG",
      "company_seat": "Wiesbaden",
      "details": "15.11.2024 (Bekanntmachungsdatum)\n\nHessen Amtsgericht Wiesbaden HRB 13184\nEinreichung neuer Dokumente 15.11.2024 (Eintragungsdatum)\n\nAareal Bank AG\nAktiengesellschaft\nWiesbaden\n\nDurch eine Änderung in den Personen der Aufsichtsratsmitglieder ist eine Liste der Mitglieder des Aufsichtsrates zum Handelsregister eingereicht worden."
    },
    {
      "date": "2024-11-15",
      "id": "93661",
      "original_text": "Sonstige Registerbekanntmachung\nBerlin Amtsgericht Berlin (Charlottenburg) HRB 203114\nActemium Energy Projects GmbH – Berlin",
      "type": "Sonstige Registerbekanntmachung",
      "state": "Berlin",
      "amtsgericht": "Amtsgericht Berlin (Charlottenburg)",
      "registernummer": "HRB 203114",
      "registerart": "HRB",
      "company_name": "Actemium Energy Projects GmbH",
      "company_seat": "Berlin",
      "details": "15.11.2024 (Bekanntmachungsdatum)\n\nBerlin Amtsgericht Berlin (Charlottenburg) HRB 203114\nSonstige Registerbekanntmachung\n\nActemium Energy Projects GmbH\nGesellschaft mit beschränkter Haftung\nBerlin\n\nAls nicht eingetragen wird veröffentlicht: Den Gläubigern der an der Spaltung beteiligten Rechtsträger ist, wenn sie binnen sechs Monaten nach dem Tag, an dem die Eintragung der Spaltung in das Register des Sitzes desjenigen Rechtsträgers, dessen Gläubiger sie sind, als bekannt gemacht gilt, ihren Anspruch nach Grund und Höhe schriftlich anmelden, Sicherheit zu leisten, soweit sie nicht Befriedigung verlangen können. Dieses Recht steht den Gläubigern jedoch nur zu, wenn sie glaubhaft machen, dass durch die Spaltung die Erfüllung ihrer Forderung gefährdet wird. Das Recht, Sicherheitsleistung zu verlangen, steht Gläubigern nicht zu, die im Falle der Insolvenz ein Recht auf vorzugsweise Befriedigung aus einer Deckungsmasse haben, die nach gesetzlicher Vorschrift zu ihrem Schutz errichtet und staatlich überwacht ist."
    },
    {
      "date": "2024-11-15",
      "id": "93644",
      "original_text": "Löschungsankündigung\nSachsen-Anhalt Amtsgericht Stendal HRB 31177\nAngelstein GmbH – Halle (Saale)",
      "type": "Löschungsankündigung",
      "state": "Sachsen-Anhalt",
      "amtsgericht": "Amtsgericht Stendal",
      "registernummer": "HRB 31177",
      "registerart": "HRB",
      "company_name": "Angelstein GmbH",
      "company_seat": "Halle (Saale)",
      "details": "15.11.2024 (Bekanntmachungsdatum)\n\nSachsen-Anhalt Amtsgericht Stendal HRB 31177\nLöschungsankündigung\n\nAngelstein GmbH\nGesellschaft mit beschränkter Haftung\nHalle (Saale)\n\nDas Registergericht beabsichtigt, nachfolgende im Handelregister eingetragenen Firmen von Amts wegen nach § 394 FamFG zu löschen. Die Frist zu Erhebung eines Widerspruchs wird auf drei Monate festgesetzt."
    },
    {
      "date": "2024-11-15",
      "id": "93679",
      "original_text": "Löschungsankündigung\nSachsen Amtsgericht Leipzig HRA 17036\nAnisa UG (haftungsbeschränkt) & Co. KG – Leipzig",
      "type": "Löschungsankündigung",
      "state": "Sachsen",
      "amtsgericht": "Amtsgericht Leipzig",
      "registernummer": "HRA 17036",
      "registerart": "HRA",
      "company_name": "Anisa UG (haftungsbeschränkt) & Co. KG",
      "company_seat": "Leipzig",
      "details": "15.11.2024 (Bekanntmachungsdatum)\n\nSachsen Amtsgericht Leipzig HRA 17036\nLöschungsankündigung 15.11.2024 (Eintragungsdatum)\n\nAnisa UG (haftungsbeschränkt) & Co. KG\nKommanditgesellschaft\nLeipzig\n\nDas Registergericht beabsichtigt, die im Handelsregister eingetragene Firma von Amts wegen nach § 31 Abs. 2 HGB, 393 FamFG zu löschen. Die Frist zur Erhebung eines Widerspruchs gegen die beabsichtigte Löschung wird auf einen Monat festgesetzt."
    },
    {
      "date": "2024-11-15",
      "id": "93718",
      "original_text": "Löschungsankündigung\nHessen Amtsgericht Frankfurt am Main HRB 102772\nArey Fleisch GmbH – Frankfurt am Main",
      "type": "Löschungsankündigung",
      "state": "Hessen",
      "amtsgericht": "Amtsgericht Frankfurt am Main",
      "registernummer": "HRB 102772",
      "registerart": "HRB",
      "company_name": "Arey Fleisch GmbH",
      "company_seat": "Frankfurt am Main",
      "details": "15.11.2024 (Bekanntmachungsdatum)\n\nHessen Amtsgericht Frankfurt am Main HRB 102772\nLöschungsankündigung\n\nArey Fleisch GmbH\nGesellschaft mit beschränkter Haftung\nFrankfurt am Main\n\nDas Registergericht beabsichtigt die im Handelsregister eingetragene Gesellschaft von Amts wegen nach § 394 FamFG zu löschen. Die Frist zur Erhebung eines Widerspruchs gegen die beabsichtigte Löschung wird auf 1 Monate festgesetzt."
    },
    {
      "date": "2024-11-15",
      "id": "93614",
      "original_text": "Löschungsankündigung\nBayern Amtsgericht Nürnberg HRB 19510\nArvena GmbH – Nürnberg",
      "type": "Löschungsankündigung",
      "state": "Bayern",
      "amtsgericht": "Amtsgericht Nürnberg",
      "registernummer": "HRB 19510",
      "registerart": "HRB",
      "company_name": "Arvena GmbH",
      "company_seat": "Nürnberg",
      "details": "15.11.2024 (Bekanntmachungsdatum)\n\nBayern Amtsgericht Nürnberg HRB 19510\nLöschungsankündigung\n\nArvena GmbH\nGesellschaft mit beschränkter Haftung\nNürnberg\n\nDas Registergericht beabsichtigt, die im Handelsregister eingetragene Gesellschaft wegen Vermögenslosigkeit von Amts wegen nach § 394 FamFG zu löschen. Die Frist zur Erhebung eines Widerspruchs ist auf drei Monate festgesetzt."
    },
    {
      "date": "2024-11-15",
      "id": "93630",
      "original_text": "Registerbekanntmachung nach dem Umwandlungsgesetz\nBayern Amtsgericht Nürnberg HRA 18322\nAutohaus Stefan Fink GmbH & Co. KG – Nürnberg",
      "type": "Registerbekanntmachung nach dem Umwandlungsgesetz",
      "state": "Bayern",
      "amtsgericht": "Amtsgericht Nürnberg",
      "registernummer": "HRA 18322",
      "registerart": "HRA",
      "company_name": "Autohaus Stefan Fink GmbH & Co. KG",
      "company_seat": "Nürnberg",
      "details": "15.11.2024 (Bekanntmachungsdatum)\n\nBayern Amtsgericht Nürnberg HRA 18322\nRegisterbekanntmachung nach dem Umwandlungsgesetz 14.11.2024 (Eintragungsdatum)\n\nAutohaus Stefan Fink GmbH & Co. KG\nKommanditgesellschaft\nNürnberg\n\nDen Gläubigern der an der Ausgliederung beteiligten Rechtsträger ist, wenn sie binnen sechs Monaten nach dem Tag, an dem die Eintragung der Ausgliederung in das Register des Sitzes desjenigen Rechtsträgers, dessen Gläubiger sie sind, nach §§ 125, 19 Abs. 3 UmwG als bekannt gemacht gilt, ihren Anspruch nach Grund und Höhe schriftlich anmelden, Sicherheit zu leisten, soweit sie nicht Befriedigung verlangen können. Dieses Recht steht den Gläubigern jedoch nur zu, wenn sie glaubhaft machen, dass durch die Ausgliederung die Erfüllung ihrer Forderung gefährdet wird."
    },
    {
      "date": "2024-11-15",
      "id": "93717",
      "original_text": "Löschungsankündigung\nHessen Amtsgericht Bad Homburg v.d.H. HRB 2194\nB H N - ELEMENT - MASSIVBAU Gesellschaft mit beschränkter Haftung – Oberursel (Taunus)",
      "type": "Löschungsankündigung",
      "state": "Hessen",
      "amtsgericht": "Amtsgericht Bad Homburg v.d.H.",
      "registernummer": "HRB 2194",
      "registerart": "HRB",
      "company_name": "B H N - ELEMENT - MASSIVBAU Gesellschaft mit beschränkter Haftung",
      "company_seat": "Oberursel (Taunus)",
      "details": "15.11.2024 (Bekanntmachungsdatum)\n\nHessen Amtsgericht Bad Homburg v.d.H. HRB 2194\nLöschungsankündigung\n\nB H N - ELEMENT - MASSIVBAU Gesellschaft mit beschränkter Haftung\nGesellschaft mit beschränkter Haftung\nOberursel (Taunus)\n\nDas Registergericht beabsichtigt die im Handelsregister eingetragene Gesellschaft von Amts wegen nach § 394 FamFG zu löschen. Die Frist zur Erhebung eines Widerspruchs gegen die beabsichtigte Löschung wird auf 3 Monate festgesetzt."
    },
    {
      "date": "2024-11-15",
      "id": "93643",
      "original_text": "Löschungsankündigung\nBerlin Amtsgericht Berlin (Charlottenburg) HRB 255879\nB-M-S GmbH – Berlin",
      "type": "Löschungsankündigung",
      "state": "Berlin",
      "amtsgericht": "Amtsgericht Berlin (Charlottenburg)",
      "registernummer": "HRB 255879",
      "registerart": "HRB",
      "company_name": "B-M-S GmbH",
      "company_seat": "Berlin",
      "details": "15.11.2024 (Bekanntmachungsdatum)\n\nBerlin Amtsgericht Berlin (Charlottenburg) HRB 255879\nLöschungsankündigung\n\nB-M-S GmbH\nGesellschaft mit beschränkter Haftung\nBerlin\n\nBei der nachstehenden Gesellschaft wird das Amtslöschungsverfahren gemäß § 394 FamFG eingeleitet. Widerspruchsfrist 6 Wochen"
    },
    {
      "date": "2024-11-15",
      "id": "93672",
      "original_text": "Löschungsankündigung\nBrandenburg Amtsgericht Frankfurt/Oder HRB 16749\nBBL Logistik GmbH – Bernau bei Berlin",
      "type": "Löschungsankündigung",
      "state": "Brandenburg",
      "amtsgericht": "Amtsgericht Frankfurt/Oder",
      "registernummer": "HRB 16749",
      "registerart": "HRB",
      "company_name": "BBL Logistik GmbH",
      "company_seat": "Bernau bei Berlin",
      "details": "15.11.2024 (Bekanntmachungsdatum)\n\nBrandenburg Amtsgericht Frankfurt/Oder HRB 16749\nLöschungsankündigung\n\nBBL Logistik GmbH\nGesellschaft mit beschränkter Haftung\nBernau bei Berlin\n\nBei der nachstehenden Gesellschaft wird das Amtslöschungsverfahren gemäß § 394 FamFG eingeleitet."
    },
    {
      "date": "2024-11-15",
      "id": "93681",
      "original_text": "Einreichung neuer Dokumente\nSachsen Amtsgericht Dresden HRB 7136\nBUDISSA Agrarprodukte Aktiengesellschaft Niederkaina – Bautzen",
      "type": "Einreichung neuer Dokumente",
      "state": "Sachsen",
      "amtsgericht": "Amtsgericht Dresden",
      "registernummer": "HRB 7136",
      "registerart": "HRB",
      "company_name": "BUDISSA Agrarprodukte Aktiengesellschaft Niederkaina",
      "company_seat": "Bautzen",
      "details": "15.11.2024 (Bekanntmachungsdatum)\n\nSachsen Amtsgericht Dresden HRB 7136\nEinreichung neuer Dokumente\n\nBUDISSA Agrarprodukte Aktiengesellschaft Niederkaina\nAktiengesellschaft\nBautzen\n\nAm 13.11.2024 wurde beim Handelsregister des Amtsgerichts Dresden die Liste der Mitglieder des Aufsichtsrats gemäß § 106 AktG eingereicht."
    },
    {
      "date": "2024-11-15",
      "id": "93691",
      "original_text": "Registerbekanntmachung nach dem Umwandlungsgesetz\nRheinland-Pfalz Amtsgericht Ludwigshafen a.Rhein (Ludwigshafen) HRA 62366\nBauherren- und Immobilienberatung Ansorg e.K. – Waldsee",
      "type": "Registerbekanntmachung nach dem Umwandlungsgesetz",
      "state": "Rheinland-Pfalz",
      "amtsgericht": "Amtsgericht Ludwigshafen a.Rhein (Ludwigshafen)",
      "registernummer": "HRA 62366",
      "registerart": "HRA",
      "company_name": "Bauherren- und Immobilienberatung Ansorg e.K.",
      "company_seat": "Waldsee",
      "details": "15.11.2024 (Bekanntmachungsdatum)\n\nRheinland-Pfalz Amtsgericht Ludwigshafen a.Rhein (Ludwigshafen) HRA 62366\nRegisterbekanntmachung nach dem Umwandlungsgesetz 15.11.2024 (Eintragungsdatum)\n\nBauherren- und Immobilienberatung Ansorg e.K.\nEinzelkaufmann / Einzelkauffrau\nWaldsee\n\nAls nicht eingetragen wird veröffentlicht: Den Gläubigern der an der Verschmelzung beteiligten Rechtsträger ist, wenn sie binnen sechs Monaten nach dem Tag, an dem die Eintragung der Verschmelzung in das Register des Sitzes desjenigen Rechtsträgers, dessen Gläubiger sie sind, nach § 19 Abs. 3 UmwG als bekannt gemacht gilt, ihren Anspruch nach Grund und Höhe schriftlich anmelden, Sicherheit zu leisten, soweit sie nicht Befriedigung verlangen können. Dieses Recht steht den Gläubigern jedoch nur zu, wenn sie glaubhaft machen, dass durch die Verschmelzung die Erfüllungd er Forderung gefährdet wird."
    },
    {
      "date": "2024-11-15",
      "id": "93680",
      "original_text": "Einreichung neuer Dokumente\nSachsen Amtsgericht Dresden HRB 29024\nBreitband Hoyerswerda GmbH – Hoyerswerda",
      "type": "Einreichung neuer Dokumente",
      "state": "Sachsen",
      "amtsgericht": "Amtsgericht Dresden",
      "registernummer": "HRB 29024",
      "registerart": "HRB",
      "company_name": "Breitband Hoyerswerda GmbH",
      "company_seat": "Hoyerswerda",
      "details": "15.11.2024 (Bekanntmachungsdatum)\n\nSachsen Amtsgericht Dresden HRB 29024\nEinreichung neuer Dokumente\n\nBreitband Hoyerswerda GmbH\nGesellschaft mit beschränkter Haftung\nHoyerswerda\n\nAm 14.11.2024 wurde beim Handelsregister des Amtsgerichts Dresden die Liste der Mitglieder des Aufsichtsrats gemäß § 52 GmbHG eingereicht."
    },
    {
      "date": "2024-11-15",
      "id": "93618",
      "original_text": "Löschungsankündigung\nBayern Amtsgericht Bayreuth HRB 6669\nCS Integra gemeinnützige UG (haftungsbeschränkt) – Weidenberg",
      "type": "Löschungsankündigung",
      "state": "Bayern",
      "amtsgericht": "Amtsgericht Bayreuth",
      "registernummer": "HRB 6669",
      "registerart": "HRB",
      "company_name": "CS Integra gemeinnützige UG (haftungsbeschränkt)",
      "company_seat": "Weidenberg",
      "details": "15.11.2024 (Bekanntmachungsdatum)\n\nBayern Amtsgericht Bayreuth HRB 6669\nLöschungsankündigung\n\nCS Integra gemeinnützige UG (haftungsbeschränkt)\nGesellschaft mit beschränkter Haftung\nWeidenberg\n\nDas Registergericht beabsichtigt, die im Handelsregister eingetragene Gesellschaft wegen Vermögenslosigkeit von Amts wegen nach § 394 FamFG zu löschen. Die Frist zur Erhebung eines Widerspruchs ist auf drei Monate festgesetzt."
    },
    {
      "date": "2024-11-15",
      "id": "93657",
      "original_text": "Registerbekanntmachung nach dem Umwandlungsgesetz\nHamburg Amtsgericht Hamburg HRB 182008\nCapenergie 3 Wind GmbH – Hamburg",
      "type": "Registerbekanntmachung nach dem Umwandlungsgesetz",
      "state": "Hamburg",
      "amtsgericht": "Amtsgericht Hamburg",
      "registernummer": "HRB 182008",
      "registerart": "HRB",
      "company_name": "Capenergie 3 Wind GmbH",
      "company_seat": "Hamburg",
      "details": "15.11.2024 (Bekanntmachungsdatum)\n\nHamburg Amtsgericht Hamburg HRB 182008\nRegisterbekanntmachung nach dem Umwandlungsgesetz 15.11.2024 (Eintragungsdatum)\n\nCapenergie 3 Wind GmbH\nGesellschaft mit beschränkter Haftung\nHamburg\n\nAls nicht eingetragen wird bekannt gemacht:\nDen Gläubigern der an der Verschmelzung beteiligten Gesellschaften ist, wenn sie binnen sechs Monaten nach dem Tag, an dem die Eintragung der Verschmelzung in das Register des Sitzes desjenigen Rechtsträgers, dessen Gläubiger sie sind, nach § 19 Absatz 3 UmwG als bekannt gemacht gilt, ihren Anspruch nach Grund und Höhe schriftlich anmelden, Sicherheit zu leisten, soweit sie nicht Befriedigung verlangen können. Dieses Recht steht den Gläubigern jedoch nur zu, wenn sie glaubhaft machen, dass durch die Verschmelzung die Erfüllung ihrer Forderung gefährdet wird."
    },
    {
      "date": "2024-11-15",
      "id": "93649",
      "original_text": "Sonstige Registerbekanntmachung\nBaden-Württemberg Amtsgericht Ulm HRB 725667\nCarl Zeiss SMT GmbH – Oberkochen",
      "type": "Sonstige Registerbekanntmachung",
      "state": "Baden-Württemberg",
      "amtsgericht": "Amtsgericht Ulm",
      "registernummer": "HRB 725667",
      "registerart": "HRB",
      "company_name": "Carl Zeiss SMT GmbH",
      "company_seat": "Oberkochen",
      "details": "15.11.2024 (Bekanntmachungsdatum)\n\nBaden-Württemberg Amtsgericht Ulm HRB 725667\nSonstige Registerbekanntmachung\n\nCarl Zeiss SMT GmbH\nGesellschaft mit beschränkter Haftung\nOberkochen\n\nDie Gesellschaft hat am 15.11.2024 die Liste über die Zusammensetzung des Aufsichtsrats zum Handelsregister eingereicht."
    },
    {
      "date": "2024-11-15",
      "id": "93699",
      "original_text": "Löschungsankündigung\nNordrhein-Westfalen Amtsgericht Bochum HRB 19840\nCleanpeace GmbH – Bochum",
      "type": "Löschungsankündigung",
      "state": "Nordrhein-Westfalen",
      "amtsgericht": "Amtsgericht Bochum",
      "registernummer": "HRB 19840",
      "registerart": "HRB",
      "company_name": "Cleanpeace GmbH",
      "company_seat": "Bochum",
      "details": "15.11.2024 (Bekanntmachungsdatum)\n\nNordrhein-Westfalen Amtsgericht Bochum HRB 19840\nLöschungsankündigung\n\nCleanpeace GmbH\nGesellschaft mit beschränkter Haftung\nBochum\n\nDas Registergericht beabsichtigt die Gesellschaft von Amts wegen nach § 394 FamFG zu löschen. Die Frist zur Erhebung eines Widerspruchs ist auf drei Monate festgesetzt."
    },
    {
      "date": "2024-11-15",
      "id": "93696",
      "original_text": "Einreichung neuer Dokumente\nNordrhein-Westfalen Amtsgericht Bonn HRB 20077\nComfortcharge GmbH – Bonn",
      "type": "Einreichung neuer Dokumente",
      "state": "Nordrhein-Westfalen",
      "amtsgericht": "Amtsgericht Bonn",
      "registernummer": "HRB 20077",
      "registerart": "HRB",
      "company_name": "Comfortcharge GmbH",
      "company_seat": "Bonn",
      "details": "15.11.2024 (Bekanntmachungsdatum)\n\nNordrhein-Westfalen Amtsgericht Bonn HRB 20077\nEinreichung neuer Dokumente\n\nComfortcharge GmbH\nGesellschaft mit beschränkter Haftung\nBonn\n\nDem Registergericht ist eine neue Liste der Mitglieder des Aufsichtsrates eingereicht worden."
    },
    {
      "date": "2024-11-15",
      "id": "93708",
      "original_text": "Löschungsankündigung\nBremen Amtsgericht Bremen HRB 35982\nConvivo 51 GmbH – Bremen",
      "type": "Löschungsankündigung",
      "state": "Bremen",
      "amtsgericht": "Amtsgericht Bremen",
      "registernummer": "HRB 35982",
      "registerart": "HRB",
      "company_name": "Convivo 51 GmbH",
      "company_seat": "Bremen",
      "details": "15.11.2024 (Bekanntmachungsdatum)\n\nBremen Amtsgericht Bremen HRB 35982\nLöschungsankündigung\n\nConvivo 51 GmbH\nGesellschaft mit beschränkter Haftung\nBremen\n\nEs ist beabsichtigt die im Handelsregister eingetragene Gesellschaft von Amts wegen gemäß § 394 FamFG zu löschen. Gegen die Löschung kann beim AG Bremen schriftlich oder zu Protokoll der Geschäftsstelle Widerspruch eingelegt werden. Widerspruchsfrist 4 Wochen."
    },
    {
      "date": "2024-11-15",
      "id": "93700",
      "original_text": "Registerbekanntmachung nach dem Umwandlungsgesetz\nNordrhein-Westfalen Amtsgericht Gütersloh HRA 8483\nDATORA GmbH & Co. KG – Gütersloh",
      "type": "Registerbekanntmachung nach dem Umwandlungsgesetz",
      "state": "Nordrhein-Westfalen",
      "amtsgericht": "Amtsgericht Gütersloh",
      "registernummer": "HRA 8483",
      "registerart": "HRA",
      "company_name": "DATORA GmbH & Co. KG",
      "company_seat": "Gütersloh",
      "details": "15.11.2024 (Bekanntmachungsdatum)\n\nNordrhein-Westfalen Amtsgericht Gütersloh HRA 8483\nRegisterbekanntmachung nach dem Umwandlungsgesetz 15.11.2024 (Eintragungsdatum)\n\nDATORA GmbH & Co. KG\nKommanditgesellschaft\nGütersloh\n\nDen Gläubigern der an der Ausgliederung beteiligten Rechtsträger ist, wenn sie binnen sechs Monaten nach dem Tag, an dem die Eintragung der Ausgliederung in das Register des Sitzes desjenigen Rechtsträgers, dessen Gläubiger sie sind, nach § 19 Absatz 3 UmwG als bekanntgemacht gilt, ihren Anspruch nach Grund und Höhe schriftlich anmelden, Sicherheit zu leisten, soweit sie nicht Befriedigung verlangen können. Dieses Recht steht den Gläubigern jedoch nur zu, wenn sie glaubhaft machen, dass durch die Ausgliederung die Erfüllung ihrer Forderung gefährdet wird."
    },
    {
      "date": "2024-11-15",
      "id": "93701",
      "original_text": "Registerbekanntmachung nach dem Umwandlungsgesetz\nNordrhein-Westfalen Amtsgericht Gütersloh HRA 8439\nDechmann Softwareentwicklung, Inhaber Günter Dechmann e.K. – Gütersloh",
      "type": "Registerbekanntmachung nach dem Umwandlungsgesetz",
      "state": "Nordrhein-Westfalen",
      "amtsgericht": "Amtsgericht Gütersloh",
      "registernummer": "HRA 8439",
      "registerart": "HRA",
      "company_name": "Dechmann Softwareentwicklung, Inhaber Günter Dechmann e.K.",
      "company_seat": "Gütersloh",
      "details": "15.11.2024 (Bekanntmachungsdatum)\n\nNordrhein-Westfalen Amtsgericht Gütersloh HRA 8439\nRegisterbekanntmachung nach dem Umwandlungsgesetz 15.11.2024 (Eintragungsdatum)\n\nDechmann Softwareentwicklung, Inhaber Günter Dechmann e.K.\nEinzelkaufmann / Einzelkauffrau\nGütersloh\n\nDen Gläubigern der an der Ausgliederung beteiligten Rechtsträger ist, wenn sie binnen sechs Monaten nach dem Tag, an dem die Eintragung der Ausgliederung in das Register des Sitzes desjenigen Rechtsträgers, dessen Gläubiger sie sind, nach § 19 Absatz 3 UmwG als bekanntgemacht gilt, ihren Anspruch nach Grund und Höhe schriftlich anmelden, Sicherheit zu leisten, soweit sie nicht Befriedigung verlangen können. Dieses Recht steht den Gläubigern jedoch nur zu, wenn sie glaubhaft machen, dass durch die Ausgliederung die Erfüllung ihrer Forderung gefährdet wird."
    },
    {
      "date": "2024-11-15",
      "id": "93710",
      "original_text": "Sonstige Registerbekanntmachung\nThüringen Amtsgericht Jena HRB 202312\nEPSa-Elektronik & Präzisionsbau Saalfeld GmbH – Saalfeld",
      "type": "Sonstige Registerbekanntmachung",
      "state": "Thüringen",
      "amtsgericht": "Amtsgericht Jena",
      "registernummer": "HRB 202312",
      "registerart": "HRB",
      "company_name": "EPSa-Elektronik & Präzisionsbau Saalfeld GmbH",
      "company_seat": "Saalfeld",
      "details": "15.11.2024 (Bekanntmachungsdatum)\n\nThüringen Amtsgericht Jena HRB 202312\nSonstige Registerbekanntmachung 15.11.2024 (Eintragungsdatum)\n\nEPSa-Elektronik & Präzisionsbau Saalfeld GmbH\nGesellschaft mit beschränkter Haftung\nSaalfeld\n\nDer Gewinnabführungsvertrag vom  09.05.2016 mit der EPSa Holding GmbH mit dem Sitz in Saalfeld/Saale (Amtsgericht Jena HRB 512724) (ehemals Sitz in Karlsfeld, Amtsgericht München, HRB 510357) ist durch Kündigung zum 01.11.2024 beendet.\nNicht eingetragen: Den Gläubigern der Gesellschaft, deren Forderungen begründet worden sind, bevor die Eintragung der Beendigung des Vertrages in das Handelsregister nach § 10 des Handelsgesetzbuches als bekanntgemacht gilt, hat der andere Vertragsteil Sicherheit zu leisten, wenn sie sich binnen sechs Monaten nach der Bekanntmachung der Eintragung zu diesem Zweck bei ihm melden."
    },
    {
      "date": "2024-11-15",
      "id": "93703",
      "original_text": "Sonstige Registerbekanntmachung\nNordrhein-Westfalen Amtsgericht Köln HRB 91529\nESPG AG – Köln",
      "type": "Sonstige Registerbekanntmachung",
      "state": "Nordrhein-Westfalen",
      "amtsgericht": "Amtsgericht Köln",
      "registernummer": "HRB 91529",
      "registerart": "HRB",
      "company_name": "ESPG AG",
      "company_seat": "Köln",
      "details": "15.11.2024 (Bekanntmachungsdatum)\n\nNordrhein-Westfalen Amtsgericht Köln HRB 91529\nSonstige Registerbekanntmachung\n\nESPG AG\nAktiengesellschaft\nKöln\n\nDem Registergericht ist eine Liste der Mitglieder des Aufsichtsrates eingereicht worden."
    },
    {
      "date": "2024-11-15",
      "id": "93706",
      "original_text": "Registerbekanntmachung nach dem Umwandlungsgesetz\nNordrhein-Westfalen Amtsgericht Düsseldorf HRA 27754\nEis-Café Am Schloss e.K. – Düsseldorf",
      "type": "Registerbekanntmachung nach dem Umwandlungsgesetz",
      "state": "Nordrhein-Westfalen",
      "amtsgericht": "Amtsgericht Düsseldorf",
      "registernummer": "HRA 27754",
      "registerart": "HRA",
      "company_name": "Eis-Café Am Schloss e.K.",
      "company_seat": "Düsseldorf",
      "details": "15.11.2024 (Bekanntmachungsdatum)\n\nNordrhein-Westfalen Amtsgericht Düsseldorf HRA 27754\nRegisterbekanntmachung nach dem Umwandlungsgesetz 15.11.2024 (Eintragungsdatum)\n\nEis-Café Am Schloss e.K.\nEinzelkaufmann / Einzelkauffrau\nDüsseldorf\n\nDen Gläubigern der an der Ausgliederung beteiligten Rechtsträger ist, wenn sie binnen sechs Monaten nach dem Tag, an dem die Eintragung der Ausgliederung in das Register des Sitzes desjenigen Rechtsträgers, dessen Gläubiger sie sind, nach § 19 Absatz 3 UmwG als bekanntgemacht gilt, ihren Anspruch nach Grund und Höhe schriftlich anmelden, Sicherheit zu leisten, soweit sie nicht Befriedigung verlangen können. Dieses Recht steht den Gläubigern jedoch nur zu, wenn sie glaubhaft machen, dass durch die Ausgliederung die Erfüllung ihrer Forderung gefährdet wird."
    },
    {
      "date": "2024-11-15",
      "id": "93694",
      "original_text": "Registerbekanntmachung nach dem Umwandlungsgesetz\nNordrhein-Westfalen Amtsgericht Düsseldorf HRA 27750\nEiscafé La Crema e.K. – Düsseldorf",
      "type": "Registerbekanntmachung nach dem Umwandlungsgesetz",
      "state": "Nordrhein-Westfalen",
      "amtsgericht": "Amtsgericht Düsseldorf",
      "registernummer": "HRA 27750",
      "registerart": "HRA",
      "company_name": "Eiscafé La Crema e.K.",
      "company_seat": "Düsseldorf",
      "details": "15.11.2024 (Bekanntmachungsdatum)\n\nNordrhein-Westfalen Amtsgericht Düsseldorf HRA 27750\nRegisterbekanntmachung nach dem Umwandlungsgesetz 15.11.2024 (Eintragungsdatum)\n\nEiscafé La Crema e.K.\nEinzelkaufmann / Einzelkauffrau\nDüsseldorf\n\nDen Gläubigern der an der Ausgliederung beteiligten Rechtsträger ist, wenn sie binnen sechs Monaten nach dem Tag, an dem die Eintragung der Ausgliederung in das Register des Sitzes desjenigen Rechtsträgers, dessen Gläubiger sie sind, nach § 19 Absatz 3 UmwG als bekanntgemacht gilt, ihren Anspruch nach Grund und Höhe schriftlich anmelden, Sicherheit zu leisten, soweit sie nicht Befriedigung verlangen können. Dieses Recht steht den Gläubigern jedoch nur zu, wenn sie glaubhaft machen, dass durch die Ausgliederung die Erfüllung ihrer Forderung gefährdet wird."
    },
    {
      "date": "2024-11-15",
      "id": "93651",
      "original_text": "Sonstige Registerbekanntmachung\nBaden-Württemberg Amtsgericht Ulm HRB 501527\nFeuerbestattung Ostwürttemberg AG – Aalen",
      "type": "Sonstige Registerbekanntmachung",
      "state": "Baden-Württemberg",
      "amtsgericht": "Amtsgericht Ulm",
      "registernummer": "HRB 501527",
      "registerart": "HRB",
      "company_name": "Feuerbestattung Ostwürttemberg AG",
      "company_seat": "Aalen",
      "details": "15.11.2024 (Bekanntmachungsdatum)\n\nBaden-Württemberg Amtsgericht Ulm HRB 501527\nSonstige Registerbekanntmachung\n\nFeuerbestattung Ostwürttemberg AG\nAktiengesellschaft\nAalen\n\nDie Gesellschaft hat am 14.11.2024 die Liste über die Zusammensetzung des Aufsichtsrats zum Handelsregister eingereicht."
    },
    {
      "date": "2024-11-15",
      "id": "93687",
      "original_text": "Registerbekanntmachung nach dem Umwandlungsgesetz\nNiedersachsen Amtsgericht Braunschweig HRB 100145 früher Amtsgericht Wolfsburg\nFliesenfachgeschäft Gerhard Dehm GmbH – Wolfsburg",
      "type": "Registerbekanntmachung nach dem Umwandlungsgesetz",
      "state": "Niedersachsen",
      "amtsgericht": "Amtsgericht Braunschweig",
      "registernummer": "HRB 100145",
      "registerart": "HRB",
      "company_name": "Fliesenfachgeschäft Gerhard Dehm GmbH",
      "company_seat": "Wolfsburg",
      "former_amtsgericht": "Wolfsburg",
      "details": "15.11.2024 (Bekanntmachungsdatum)\n\nNiedersachsen Amtsgericht Braunschweig HRB 100145 früher Amtsgericht Wolfsburg\nRegisterbekanntmachung nach dem Umwandlungsgesetz 15.11.2024 (Eintragungsdatum)\n\nFliesenfachgeschäft Gerhard Dehm GmbH\nGesellschaft mit beschränkter Haftung\nWolfsburg\n\nDen Gläubigern der an der Verschmelzung beteiligten Rechtsträger ist, wenn sie binnen sechs Monaten nach dem Tag, an dem die Eintragung der Verschmelzung in das Register des Sitzes desjenigen Rechtsträgers, dessen Gläubiger sie sind, nach § 19  Abs.  3 UmwG als bekannt gemacht gilt, ihren Anspruch nach Grund und Höhe schriftlich anmelden, Sicherheit zu leisten, soweit sie nicht Befriedigung verlangen können. Dieses Recht steht den Gläubigern jedoch nur zu, wenn sie glaubhaft machen, dass durch die Verschmelzung die Erfüllung der Forderung gefährdet wird."
    },
    {
      "date": "2024-11-15",
      "id": "93625",
      "original_text": "Registerbekanntmachung nach dem Umwandlungsgesetz\nBayern Amtsgericht Bamberg HRA 10819\nGO BauManagement GmbH & Co. KG – Bamberg",
      "type": "Registerbekanntmachung nach dem Umwandlungsgesetz",
      "state": "Bayern",
      "amtsgericht": "Amtsgericht Bamberg",
      "registernummer": "HRA 10819",
      "registerart": "HRA",
      "company_name": "GO BauManagement GmbH & Co. KG",
      "company_seat": "Bamberg",
      "details": "15.11.2024 (Bekanntmachungsdatum)\n\nBayern Amtsgericht Bamberg HRA 10819\nRegisterbekanntmachung nach dem Umwandlungsgesetz 14.11.2024 (Eintragungsdatum)\n\nGO BauManagement GmbH & Co. KG\nKommanditgesellschaft\nBamberg\n\nDen Gläubigern der an der Verschmelzung beteiligten Rechtsträger ist, wenn sie binnen sechs Monaten nach dem Tag, an dem die Eintragung der Verschmelzung in das Register des Sitzes desjenigen Rechtsträgers, dessen Gläubiger sie sind, nach § 19 Abs. 3 UmwG als bekannt gemacht gilt, ihren Anspruch nach Grund und Höhe schriftlich anmelden, Sicherheit zu leisten, soweit sie nicht Befriedigung verlangen können. Dieses Recht steht den Gläubigern jedoch nur zu, wenn sie glaubhaft machen, dass durch die Verschmelzung die Erfüllung ihrer Forderung gefährdet wird."
    },
    {
      "date": "2024-11-15",
      "id": "93698",
      "original_text": "Einreichung neuer Dokumente\nNordrhein-Westfalen Amtsgericht Gelsenkirchen HRB 4798\nGVB-Gesellschaft zur Verwertung von Grün- und Bioabfällen mbH – Bottrop",
      "type": "Einreichung neuer Dokumente",
      "state": "Nordrhein-Westfalen",
      "amtsgericht": "Amtsgericht Gelsenkirchen",
      "registernummer": "HRB 4798",
      "registerart": "HRB",
      "company_name": "GVB-Gesellschaft zur Verwertung von Grün- und Bioabfällen mbH",
      "company_seat": "Bottrop",
      "details": "15.11.2024 (Bekanntmachungsdatum)\n\nNordrhein-Westfalen Amtsgericht Gelsenkirchen HRB 4798\nEinreichung neuer Dokumente 13.11.2024 (Eintragungsdatum)\n\nGVB-Gesellschaft zur Verwertung von Grün- und Bioabfällen mbH\nGesellschaft mit beschränkter Haftung\nBottrop\n\nDem Registergericht ist eine neue Liste der Mitglieder des Aufsichtsrates eingereicht worden."
    },
    {
      "date": "2024-11-15",
      "id": "93662",
      "original_text": "Einreichung neuer Dokumente\nMecklenburg-Vorpommern Amtsgericht Stralsund HRB 5040\nGreifswalder Parkraumbewirtschaftungsgesellschaft mbH – Greifswald",
      "type": "Einreichung neuer Dokumente",
      "state": "Mecklenburg-Vorpommern",
      "amtsgericht": "Amtsgericht Stralsund",
      "registernummer": "HRB 5040",
      "registerart": "HRB",
      "company_name": "Greifswalder Parkraumbewirtschaftungsgesellschaft mbH",
      "company_seat": "Greifswald",
      "details": "15.11.2024 (Bekanntmachungsdatum)\n\nMecklenburg-Vorpommern Amtsgericht Stralsund HRB 5040\nEinreichung neuer Dokumente\n\nGreifswalder Parkraumbewirtschaftungsgesellschaft mbH\nGesellschaft mit beschränkter Haftung\nGreifswald\n\nEine Liste der Mitglieder des Aufsichtsrats ist zum Handelsregister eingereicht worden."
    },
    {
      "date": "2024-11-15",
      "id": "93648",
      "original_text": "Registerbekanntmachung nach dem Umwandlungsgesetz\nBrandenburg Amtsgericht Cottbus HRB 18303\nGuTe GmbH – Forst (Lausitz)",
      "type": "Registerbekanntmachung nach dem Umwandlungsgesetz",
      "state": "Brandenburg",
      "amtsgericht": "Amtsgericht Cottbus",
      "registernummer": "HRB 18303",
      "registerart": "HRB",
      "company_name": "GuTe GmbH",
      "company_seat": "Forst (Lausitz)",
      "details": "15.11.2024 (Bekanntmachungsdatum)\n\nBrandenburg Amtsgericht Cottbus HRB 18303\nRegisterbekanntmachung nach dem Umwandlungsgesetz 13.11.2024 (Eintragungsdatum)\n\nGuTe GmbH\nGesellschaft mit beschränkter Haftung\nForst (Lausitz)\n\nDen Gläubigern der an der Umwandlung beteiligten Rechtsträger ist, wenn sie binnen sechs Monaten nach dem Tag, an dem die Eintragung der Umwandlung in das Register des Sitzes desjenigen Rechtsträgers, dessen Gläubiger sie sind, als bekannt gemacht gilt, ihren Anspruch nach Grund und Höhe schriftlich anmelden, Sicherheit zu leisten, soweit sie nicht Befriedigung verlangen können. Dieses Recht steht den Gläubigern jedoch nur zu, wenn sie glaubhaft machen, dass durch die Umwandlung die Erfüllung ihrer Forderung gefährdet wird."
    },
    {
      "date": "2024-11-15",
      "id": "93713",
      "original_text": "Registerbekanntmachung nach dem Umwandlungsgesetz\nHessen Amtsgericht Darmstadt HRA 87645\nHeinlein Vermögensverwaltungs GmbH & Co. KG – Babenhausen",
      "type": "Registerbekanntmachung nach dem Umwandlungsgesetz",
      "state": "Hessen",
      "amtsgericht": "Amtsgericht Darmstadt",
      "registernummer": "HRA 87645",
      "registerart": "HRA",
      "company_name": "Heinlein Vermögensverwaltungs GmbH & Co. KG",
      "company_seat": "Babenhausen",
      "details": "15.11.2024 (Bekanntmachungsdatum)\n\nHessen Amtsgericht Darmstadt HRA 87645\nRegisterbekanntmachung nach dem Umwandlungsgesetz 15.11.2024 (Eintragungsdatum)\n\nHeinlein Vermögensverwaltungs GmbH & Co. KG\nKommanditgesellschaft\nBabenhausen\n\nDen Gläubigern der an der Ausgliederung beteiligten Rechtsträger ist, wenn sie binnen sechs Monaten nach dem Tag, an dem die Eintragung der Ausgliederung in das Register des Sitzes derjenigen Rechtsträger deren Gläubiger sie sind, nach §§ 125, 19 Absatz 3 UmwG bekannt gemacht worden ist, ihren Anspruch nach Grund und Höhe schriftlich anmelden, Sicherheit zu leisten, soweit sie nicht Befriedigung verlangen können. Dieses Recht steht den Gläubigern jedoch nur zu, wenn sie glaubhaft machen, dass durch die Ausgliederung die Erfüllung ihrer Forderung gefährdet wird."
    },
    {
      "date": "2024-11-15",
      "id": "93711",
      "original_text": "Registerbekanntmachung nach dem Umwandlungsgesetz\nThüringen Amtsgericht Jena HRB 510596\nHelios Logistik Mitte GmbH – Erfurt",
      "type": "Registerbekanntmachung nach dem Umwandlungsgesetz",
      "state": "Thüringen",
      "amtsgericht": "Amtsgericht Jena",
      "registernummer": "HRB 510596",
      "registerart": "HRB",
      "company_name": "Helios Logistik Mitte GmbH",
      "company_seat": "Erfurt",
      "details": "15.11.2024 (Bekanntmachungsdatum)\n\nThüringen Amtsgericht Jena HRB 510596\nRegisterbekanntmachung nach dem Umwandlungsgesetz 15.11.2024 (Eintragungsdatum)\n\nHelios Logistik Mitte GmbH\nGesellschaft mit beschränkter Haftung\nErfurt\n\nNicht eingetragen: Den Gläubigern der an der Verschmelzung beteiligten Rechtsträger, ist wenn sie binnen sechs Monaten nach dem Tag, an dem die Eintragung der Verschmelzung in das Register des Sitzes desjenigen Rechtsträgers, dessen Gläubiger sie sind,  nach § 19 Abs. 3 UmwG als bekanntgemacht gilt, ihren Anspruch nach Grund und Höhe schriftlich anmelden, Sicherheit zu leisten, soweit sie nicht Befriedigung verlangen können. Dieses Recht steht ihnen jedoch nur zu, wenn sie glaubhaft machen, daß durch die Verschmelzung die Erfüllung ihrer Forderung gefährdet wird."
    },
    {
      "date": "2024-11-15",
      "id": "93659",
      "original_text": "Einreichung neuer Dokumente\nBaden-Württemberg Amtsgericht Stuttgart HRB 772644\nHepaRegeniX GmbH – Tübingen",
      "type": "Einreichung neuer Dokumente",
      "state": "Baden-Württemberg",
      "amtsgericht": "Amtsgericht Stuttgart",
      "registernummer": "HRB 772644",
      "registerart": "HRB",
      "company_name": "HepaRegeniX GmbH",
      "company_seat": "Tübingen",
      "details": "15.11.2024 (Bekanntmachungsdatum)\n\nBaden-Württemberg Amtsgericht Stuttgart HRB 772644\nEinreichung neuer Dokumente 15.11.2024 (Eintragungsdatum)\n\nHepaRegeniX GmbH\nGesellschaft mit beschränkter Haftung\nTübingen\n\nDie Gesellschaft hat am 14.11.2024 die Liste über die Zusammensetzung des Aufsichtsrats zum Handelsregister eingereicht."
    },
    {
      "date": "2024-11-15",
      "id": "93715",
      "original_text": "Sonstige Registerbekanntmachung\nHessen Amtsgericht Frankfurt am Main HRB 100126\nInfront Quant AG – Frankfurt am Main",
      "type": "Sonstige Registerbekanntmachung",
      "state": "Hessen",
      "amtsgericht": "Amtsgericht Frankfurt am Main",
      "registernummer": "HRB 100126",
      "registerart": "HRB",
      "company_name": "Infront Quant AG",
      "company_seat": "Frankfurt am Main",
      "details": "15.11.2024 (Bekanntmachungsdatum)\n\nHessen Amtsgericht Frankfurt am Main HRB 100126\nSonstige Registerbekanntmachung\n\nInfront Quant AG\nAktiengesellschaft\nFrankfurt am Main\n\nDurch eine Änderung in den Personen der Aufsichtsratsmitglieder ist eine Liste der Mitglieder des Aufsichtsrates zum Handelsregister eingereicht worden."
    },
    {
      "date": "2024-11-15",
      "id": "93650",
      "original_text": "Registerbekanntmachung nach dem Umwandlungsgesetz\nBaden-Württemberg Amtsgericht Mannheim HRB 362498\nKMTS Group GmbH – Ettlingen",
      "type": "Registerbekanntmachung nach dem Umwandlungsgesetz",
      "state": "Baden-Württemberg",
      "amtsgericht": "Amtsgericht Mannheim",
      "registernummer": "HRB 362498",
      "registerart": "HRB",
      "company_name": "KMTS Group GmbH",
      "company_seat": "Ettlingen",
      "details": "15.11.2024 (Bekanntmachungsdatum)\n\nBaden-Württemberg Amtsgericht Mannheim HRB 362498\nRegisterbekanntmachung nach dem Umwandlungsgesetz 15.11.2024 (Eintragungsdatum)\n\nKMTS Group GmbH\nGesellschaft mit beschränkter Haftung\nEttlingen\n\nAls nicht eingetragen wird bekanntgemacht:\nDen Gläubigern der an der Verschmelzung beteiligten Rechtsträger ist, wenn sie binnen sechs Monaten nach dem Tag, an dem die Eintragung der Verschmelzung in das Register des Sitzes desjenigen Rechtsträgers, dessen Gläubiger sie sind, nach § 19 Abs. 3 UmwG als bekanntgemacht gilt, ihren Anspruch nach Grund und Höhe schriftlich anmelden, Sicherheit zu leisten, soweit sie nicht Befriedigung verlangen können. Dieses Recht steht den Gläubigern jedoch nur zu, wenn sie glaubhaft machen, dass durch die Verschmelzung die Erfüllung ihrer Forderung gefährdet wird."
    },
    {
      "date": "2024-11-15",
      "id": "93638",
      "original_text": "Registerbekanntmachung nach dem Umwandlungsgesetz\nBayern Amtsgericht Bamberg HRA 10723\nKRE AssetManagement GmbH & Co. KG – Bamberg",
      "type": "Registerbekanntmachung nach dem Umwandlungsgesetz",
      "state": "Bayern",
      "amtsgericht": "Amtsgericht Bamberg",
      "registernummer": "HRA 10723",
      "registerart": "HRA",
      "company_name": "KRE AssetManagement GmbH & Co. KG",
      "company_seat": "Bamberg",
      "details": "15.11.2024 (Bekanntmachungsdatum)\n\nBayern Amtsgericht Bamberg HRA 10723\nRegisterbekanntmachung nach dem Umwandlungsgesetz 14.11.2024 (Eintragungsdatum)\n\nKRE AssetManagement GmbH & Co. KG\nKommanditgesellschaft\nBamberg\n\nDen Gläubigern der an der Verschmelzung beteiligten Rechtsträger ist, wenn sie binnen sechs Monaten nach dem Tag, an dem die Eintragung der Verschmelzung in das Register des Sitzes desjenigen Rechtsträgers, dessen Gläubiger sie sind, nach § 19 Abs. 3 UmwG als bekannt gemacht gilt, ihren Anspruch nach Grund und Höhe schriftlich anmelden, Sicherheit zu leisten, soweit sie nicht Befriedigung verlangen können. Dieses Recht steht den Gläubigern jedoch nur zu, wenn sie glaubhaft machen, dass durch die Verschmelzung die Erfüllung ihrer Forderung gefährdet wird."
    },
    {
      "date": "2024-11-15",
      "id": "93627",
      "original_text": "Registerbekanntmachung nach dem Umwandlungsgesetz\nBayern Amtsgericht Bamberg HRA 11932\nKRE Immo9 GmbH & Co. KG – Bamberg",
      "type": "Registerbekanntmachung nach dem Umwandlungsgesetz",
      "state": "Bayern",
      "amtsgericht": "Amtsgericht Bamberg",
      "registernummer": "HRA 11932",
      "registerart": "HRA",
      "company_name": "KRE Immo9 GmbH & Co. KG",
      "company_seat": "Bamberg",
      "details": "15.11.2024 (Bekanntmachungsdatum)\n\nBayern Amtsgericht Bamberg HRA 11932\nRegisterbekanntmachung nach dem Umwandlungsgesetz 14.11.2024 (Eintragungsdatum)\n\nKRE Immo9 GmbH & Co. KG\nKommanditgesellschaft\nBamberg\n\nDen Gläubigern der an der Verschmelzung beteiligten Rechtsträger ist, wenn sie binnen sechs Monaten nach dem Tag, an dem die Eintragung der Verschmelzung in das Register des Sitzes desjenigen Rechtsträgers, dessen Gläubiger sie sind, nach § 19 Abs. 3 UmwG als bekannt gemacht gilt, ihren Anspruch nach Grund und Höhe schriftlich anmelden, Sicherheit zu leisten, soweit sie nicht Befriedigung verlangen können. Dieses Recht steht den Gläubigern jedoch nur zu, wenn sie glaubhaft machen, dass durch die Verschmelzung die Erfüllung ihrer Forderung gefährdet wird."
    },
    {
      "date": "2024-11-15",
      "id": "93628",
      "original_text": "Registerbekanntmachung nach dem Umwandlungsgesetz\nBayern Amtsgericht Bamberg HRA 11369\nKRE Projekt1 GmbH & Co. KG – Bamberg",
      "type": "Registerbekanntmachung nach dem Umwandlungsgesetz",
      "state": "Bayern",
      "amtsgericht": "Amtsgericht Bamberg",
      "registernummer": "HRA 11369",
      "registerart": "HRA",
      "company_name": "KRE Projekt1 GmbH & Co. KG",
      "company_seat": "Bamberg",
      "details": "15.11.2024 (Bekanntmachungsdatum)\n\nBayern Amtsgericht Bamberg HRA 11369\nRegisterbekanntmachung nach dem Umwandlungsgesetz 14.11.2024 (Eintragungsdatum)\n\nKRE Projekt1 GmbH & Co. KG\nKommanditgesellschaft\nBamberg\n\nDen Gläubigern der an der Verschmelzung beteiligten Rechtsträger ist, wenn sie binnen sechs Monaten nach dem Tag, an dem die Eintragung der Verschmelzung in das Register des Sitzes desjenigen Rechtsträgers, dessen Gläubiger sie sind, nach § 19 Abs. 3 UmwG als bekannt gemacht gilt, ihren Anspruch nach Grund und Höhe schriftlich anmelden, Sicherheit zu leisten, soweit sie nicht Befriedigung verlangen können. Dieses Recht steht den Gläubigern jedoch nur zu, wenn sie glaubhaft machen, dass durch die Verschmelzung die Erfüllung ihrer Forderung gefährdet wird."
    },
    {
      "date": "2024-11-15",
      "id": "93624",
      "original_text": "Registerbekanntmachung nach dem Umwandlungsgesetz\nBayern Amtsgericht Bamberg HRA 11289\nKRE Projekt2 GmbH & Co. KG – Bamberg",
      "type": "Registerbekanntmachung nach dem Umwandlungsgesetz",
      "state": "Bayern",
      "amtsgericht": "Amtsgericht Bamberg",
      "registernummer": "HRA 11289",
      "registerart": "HRA",
      "company_name": "KRE Projekt2 GmbH & Co. KG",
      "company_seat": "Bamberg",
      "details": "15.11.2024 (Bekanntmachungsdatum)\n\nBayern Amtsgericht Bamberg HRA 11289\nRegisterbekanntmachung nach dem Umwandlungsgesetz 14.11.2024 (Eintragungsdatum)\n\nKRE Projekt2 GmbH & Co. KG\nKommanditgesellschaft\nBamberg"
    },
    {
      "date": "2024-11-15",
      "id": "93633",
      "original_text": "Registerbekanntmachung nach dem Umwandlungsgesetz\nBayern Amtsgericht Bamberg HRA 10615\nKRE ProjektEntwicklung GmbH & Co. KG – Bamberg",
      "type": "Registerbekanntmachung nach dem Umwandlungsgesetz",
      "state": "Bayern",
      "amtsgericht": "Amtsgericht Bamberg",
      "registernummer": "HRA 10615",
      "registerart": "HRA",
      "company_name": "KRE ProjektEntwicklung GmbH & Co. KG",
      "company_seat": "Bamberg",
      "details": "15.11.2024 (Bekanntmachungsdatum)\n\nBayern Amtsgericht Bamberg HRA 10615\nRegisterbekanntmachung nach dem Umwandlungsgesetz 14.11.2024 (Eintragungsdatum)\n\nKRE ProjektEntwicklung GmbH & Co. KG\nKommanditgesellschaft\nBamberg\n\nDen Gläubigern der an der Verschmelzung beteiligten Rechtsträger ist, wenn sie binnen sechs Monaten nach dem Tag, an dem die Eintragung der Verschmelzung in das Register des Sitzes desjenigen Rechtsträgers, dessen Gläubiger sie sind, nach § 19 Abs. 3 UmwG als bekannt gemacht gilt, ihren Anspruch nach Grund und Höhe schriftlich anmelden, Sicherheit zu leisten, soweit sie nicht Befriedigung verlangen können. Dieses Recht steht den Gläubigern jedoch nur zu, wenn sie glaubhaft machen, dass durch die Verschmelzung die Erfüllung ihrer Forderung gefährdet wird."
    },
    {
      "date": "2024-11-15",
      "id": "93647",
      "original_text": "Einreichung neuer Dokumente\nBaden-Württemberg Amtsgericht Mannheim HRB 107865\nKVVH - Karlsruher Versorgungs-, Verkehrs- und Hafen GmbH – Karlsruhe",
      "type": "Einreichung neuer Dokumente",
      "state": "Baden-Württemberg",
      "amtsgericht": "Amtsgericht Mannheim",
      "registernummer": "HRB 107865",
      "registerart": "HRB",
      "company_name": "KVVH - Karlsruher Versorgungs-, Verkehrs- und Hafen GmbH",
      "company_seat": "Karlsruhe",
      "details": "15.11.2024 (Bekanntmachungsdatum)\n\nBaden-Württemberg Amtsgericht Mannheim HRB 107865\nEinreichung neuer Dokumente\n\nKVVH - Karlsruher Versorgungs-, Verkehrs- und Hafen GmbH\nGesellschaft mit beschränkter Haftung\nKarlsruhe\n\nDie Gesellschaft hat am 30.10.2024 die Liste über die Zusammensetzung des Aufsichtsrats zum Handelsregister eingereicht."
    },
    {
      "date": "2024-11-15",
      "id": "93645",
      "original_text": "Einreichung neuer Dokumente\nBaden-Württemberg Amtsgericht Stuttgart HRB 260035\nKreisbaugesellschaft Waiblingen mit beschränkter Haftung – Waiblingen",
      "type": "Einreichung neuer Dokumente",
      "state": "Baden-Württemberg",
      "amtsgericht": "Amtsgericht Stuttgart",
      "registernummer": "HRB 260035",
      "registerart": "HRB",
      "company_name": "Kreisbaugesellschaft Waiblingen mit beschränkter Haftung",
      "company_seat": "Waiblingen",
      "details": "15.11.2024 (Bekanntmachungsdatum)\n\nBaden-Württemberg Amtsgericht Stuttgart HRB 260035\nEinreichung neuer Dokumente\n\nKreisbaugesellschaft Waiblingen mit beschränkter Haftung\nGesellschaft mit beschränkter Haftung\nWaiblingen\n\nDie Gesellschaft hat am 14.11.2024 die Liste über die Zusammensetzung des Aufsichtsrats zum Handelsregister eingereicht."
    },
    {
      "date": "2024-11-15",
      "id": "93666",
      "original_text": "Löschungsankündigung\nBerlin Amtsgericht Berlin (Charlottenburg) HRB 257267\nLEAL AUTO UG (haftungsbeschränkt) – Berlin",
      "type": "Löschungsankündigung",
      "state": "Berlin",
      "amtsgericht": "Amtsgericht Berlin (Charlottenburg)",
      "registernummer": "HRB 257267",
      "registerart": "HRB",
      "company_name": "LEAL AUTO UG (haftungsbeschränkt)",
      "company_seat": "Berlin",
      "details": "15.11.2024 (Bekanntmachungsdatum)\n\nBerlin Amtsgericht Berlin (Charlottenburg) HRB 257267\nLöschungsankündigung\n\nLEAL AUTO UG (haftungsbeschränkt)\nGesellschaft mit beschränkter Haftung\nBerlin\n\nBei der nachstehenden Gesellschaft wird das Amtslöschungsverfahren gemäß § 394 FamFG eingeleitet. Widerspruchsfrist 6 Wochen"
    },
    {
      "date": "2024-11-15",
      "id": "93686",
      "original_text": "Einreichung neuer Dokumente\nNiedersachsen Amtsgericht Braunschweig HRB 204131\nLSW Holding Verwaltungs-GmbH – Wolfsburg",
      "type": "Einreichung neuer Dokumente",
      "state": "Niedersachsen",
      "amtsgericht": "Amtsgericht Braunschweig",
      "registernummer": "HRB 204131",
      "registerart": "HRB",
      "company_name": "LSW Holding Verwaltungs-GmbH",
      "company_seat": "Wolfsburg",
      "details": "15.11.2024 (Bekanntmachungsdatum)\n\nNiedersachsen Amtsgericht Braunschweig HRB 204131\nEinreichung neuer Dokumente\n\nLSW Holding Verwaltungs-GmbH\nGesellschaft mit beschränkter Haftung\nWolfsburg\n\nEine neue Liste der Mitglieder des Aufsichtsrats wurde beim Registergericht eingereicht."
    },
    {
      "date": "2024-11-15",
      "id": "93684",
      "original_text": "Sonstige Registerbekanntmachung\nSachsen Amtsgericht Dresden HRB 31116\nLandesbühnen Sachsen GmbH – Radebeul",
      "type": "Sonstige Registerbekanntmachung",
      "state": "Sachsen",
      "amtsgericht": "Amtsgericht Dresden",
      "registernummer": "HRB 31116",
      "registerart": "HRB",
      "company_name": "Landesbühnen Sachsen GmbH",
      "company_seat": "Radebeul",
      "details": "15.11.2024 (Bekanntmachungsdatum)\n\nSachsen Amtsgericht Dresden HRB 31116\nSonstige Registerbekanntmachung\n\nLandesbühnen Sachsen GmbH\nGesellschaft mit beschränkter Haftung\nRadebeul\n\nAm 14.11.2024 wurde beim Handelsregister des Amtsgerichts Dresden die Liste der Mitglieder des Aufsichtsrats gemäß § 52 GmbHG eingereicht."
    },
    {
      "date": "2024-11-15",
      "id": "93616",
      "original_text": "Registerbekanntmachung nach dem Umwandlungsgesetz\nBayern Amtsgericht Nürnberg HRB 43747\nLatemar GmbH – Nürnberg",
      "type": "Registerbekanntmachung nach dem Umwandlungsgesetz",
      "state": "Bayern",
      "amtsgericht": "Amtsgericht Nürnberg",
      "registernummer": "HRB 43747",
      "registerart": "HRB",
      "company_name": "Latemar GmbH",
      "company_seat": "Nürnberg",
      "details": "15.11.2024 (Bekanntmachungsdatum)\n\nBayern Amtsgericht Nürnberg HRB 43747\nRegisterbekanntmachung nach dem Umwandlungsgesetz 14.11.2024 (Eintragungsdatum)\n\nLatemar GmbH\nGesellschaft mit beschränkter Haftung\nNürnberg\n\nDen Gläubigern der an der Ausgliederung beteiligten Rechtsträger ist, wenn sie binnen sechs Monaten nach dem Tag, an dem die Eintragung der Ausgliederung in das Register des Sitzes desjenigen Rechtsträgers, dessen Gläubiger sie sind, nach §§ 125, 19 Abs. 3 UmwG als bekannt gemacht gilt, ihren Anspruch nach Grund und Höhe schriftlich anmelden, Sicherheit zu leisten, soweit sie nicht Befriedigung verlangen können. Dieses Recht steht den Gläubigern jedoch nur zu, wenn sie glaubhaft machen, dass durch die Ausgliederung die Erfüllung ihrer Forderung gefährdet wird."
    },
    {
      "date": "2024-11-15",
      "id": "93707",
      "original_text": "Registerbekanntmachung nach dem Umwandlungsgesetz\nNordrhein-Westfalen Amtsgericht Siegburg HRB 16256\nLernhacks GmbH – Bad Honnef",
      "type": "Registerbekanntmachung nach dem Umwandlungsgesetz",
      "state": "Nordrhein-Westfalen",
      "amtsgericht": "Amtsgericht Siegburg",
      "registernummer": "HRB 16256",
      "registerart": "HRB",
      "company_name": "Lernhacks GmbH",
      "company_seat": "Bad Honnef",
      "details": "15.11.2024 (Bekanntmachungsdatum)\n\nNordrhein-Westfalen Amtsgericht Siegburg HRB 16256\nRegisterbekanntmachung nach dem Umwandlungsgesetz 15.11.2024 (Eintragungsdatum)\n\nLernhacks GmbH\nGesellschaft mit beschränkter Haftung\nBad Honnef\n\nDen Gläubigern der an der Verschmelzung beteiligten Rechtsträger ist, wenn sie binnen sechs Monaten nach dem Tag, an dem die Eintragung der Verschmelzung in das Register des Sitzes desjenigen Rechtsträgers, dessen Gläubiger sie sind, nach § 19 Absatz 3 UmwG als bekanntgemacht gilt, ihren Anspruch nach Grund und Höhe schriftlich anmelden, Sicherheit zu leisten, soweit sie nicht Befriedigung verlangen können. Dieses Recht steht den Gläubigern jedoch nur zu, wenn sie glaubhaft machen, dass durch die Verschmelzung die Erfüllung ihrer Forderung gefährdet wird."
    },
    {
      "date": "2024-11-15",
      "id": "93677",
      "original_text": "Löschungsankündigung\nSchleswig-Holstein Amtsgericht Flensburg HRB 14638\nLimitless Service GmbH – Freienwill",
      "type": "Löschungsankündigung",
      "state": "Schleswig-Holstein",
      "amtsgericht": "Amtsgericht Flensburg",
      "registernummer": "HRB 14638",
      "registerart": "HRB",
      "company_name": "Limitless Service GmbH",
      "company_seat": "Freienwill",
      "details": "15.11.2024 (Bekanntmachungsdatum)\n\nSchleswig-Holstein Amtsgericht Flensburg HRB 14638\nLöschungsankündigung\n\nLimitless Service GmbH\nGesellschaft mit beschränkter Haftung\nFreienwill\n\nEs ist die Löschung der nachstehenden Gesellschaft wegen Vermögenslosigkeit gemäß § 394 FamFG beabsichtigt.\nWiderspruchsfrist: 2 Monate"
    },
    {
      "date": "2024-11-15",
      "id": "93664",
      "original_text": "Registerbekanntmachung nach dem Umwandlungsgesetz\nBrandenburg Amtsgericht Frankfurt/Oder HRB 20731\nM. R. Bauservice Berlin Brandenburg GmbH – Ahrensfelde",
      "type": "Registerbekanntmachung nach dem Umwandlungsgesetz",
      "state": "Brandenburg",
      "amtsgericht": "Amtsgericht Frankfurt/Oder",
      "registernummer": "HRB 20731",
      "registerart": "HRB",
      "company_name": "M. R. Bauservice Berlin Brandenburg GmbH",
      "company_seat": "Ahrensfelde",
      "details": "15.11.2024 (Bekanntmachungsdatum)\n\nBrandenburg Amtsgericht Frankfurt/Oder HRB 20731\nRegisterbekanntmachung nach dem Umwandlungsgesetz 28.08.2024 (Eintragungsdatum)\n\nM. R. Bauservice Berlin Brandenburg GmbH\nGesellschaft mit beschränkter Haftung\nAhrensfelde\n\nZu Eintragungsnummer 3 vom 28.08.2024 wird als nicht eingetragen veröffentlicht:\nDen Gläubigern der an der Verschmelzung beteiligten Rechtsträger ist, wenn sie binnen sechs Monaten nach dem Tag, an dem die Eintragung der Verschmelzung in das Register des Sitzes desjenigen Rechtsträgers, dessen Gläubiger sie sind, als bekannt gemacht gilt, ihren Anspruch nach Grund und Höhe schriftlich anmelden, Sicherheit zu leisten, soweit sie nicht Befriedigung verlangen können. Dieses Recht steht den Gläubigern jedoch nur zu, wenn sie glaubhaft machen, dass durch die Verschmelzung die Erfüllung ihrer Forderung gefährdet wird"
    },
    {
      "date": "2024-11-15",
      "id": "93653",
      "original_text": "Einreichung neuer Dokumente\nSachsen-Anhalt Amtsgericht Stendal HRB 33088\nMIDEWA Dienstleistungsgesellschaft mbH – Köthen (Anhalt)",
      "type": "Einreichung neuer Dokumente",
      "state": "Sachsen-Anhalt",
      "amtsgericht": "Amtsgericht Stendal",
      "registernummer": "HRB 33088",
      "registerart": "HRB",
      "company_name": "MIDEWA Dienstleistungsgesellschaft mbH",
      "company_seat": "Köthen (Anhalt)",
      "details": "15.11.2024 (Bekanntmachungsdatum)\n\nSachsen-Anhalt Amtsgericht Stendal HRB 33088\nEinreichung neuer Dokumente\n\nMIDEWA Dienstleistungsgesellschaft mbH\nGesellschaft mit beschränkter Haftung\nKöthen (Anhalt)\n\nEine Liste der Mitglieder des Aufsichtsrates wurde zum Handelsregister eingereicht."
    },
    {
      "date": "2024-11-15",
      "id": "93693",
      "original_text": "Registerbekanntmachung nach dem Umwandlungsgesetz\nNordrhein-Westfalen Amtsgericht Paderborn HRB 16287\nMVZ Kieferorthopädie Paderborn Dres. Paddenberg + Kollegen GmbH – Paderborn",
      "type": "Registerbekanntmachung nach dem Umwandlungsgesetz",
      "state": "Nordrhein-Westfalen",
      "amtsgericht": "Amtsgericht Paderborn",
      "registernummer": "HRB 16287",
      "registerart": "HRB",
      "company_name": "MVZ Kieferorthopädie Paderborn Dres. Paddenberg + Kollegen GmbH",
      "company_seat": "Paderborn",
      "details": "15.11.2024 (Bekanntmachungsdatum)\n\nNordrhein-Westfalen Amtsgericht Paderborn HRB 16287\nRegisterbekanntmachung nach dem Umwandlungsgesetz 15.11.2024 (Eintragungsdatum)\n\nMVZ Kieferorthopädie Paderborn Dres. Paddenberg + Kollegen GmbH\nGesellschaft mit beschränkter Haftung\nPaderborn\n\nDen Gläubigern der an der Abspaltung beteiligten Rechtsträger ist, wenn sie binnen sechs Monaten nach dem Tag, an dem die Eintragung der Abspaltung in das Register des Sitzes desjenigen Rechtsträgers, dessen Gläubiger sie sind, nach § 19 Absatz 3 UmwG als bekanntgemacht gilt, ihren Anspruch nach Grund und Höhe schriftlich anmelden, Sicherheit zu leisten, soweit sie nicht Befriedigung verlangen können. Dieses Recht steht den Gläubigern jedoch nur zu, wenn sie glaubhaft machen, dass durch die Abspaltung die Erfüllung ihrer Forderung gefährdet wird."
    },
    {
      "date": "2024-11-15",
      "id": "93678",
      "original_text": "Registerbekanntmachung nach dem Umwandlungsgesetz\nBaden-Württemberg Amtsgericht Stuttgart HRB 17945\nMetaComp GmbH Computer + Netzwerke – Stuttgart",
      "type": "Registerbekanntmachung nach dem Umwandlungsgesetz",
      "state": "Baden-Württemberg",
      "amtsgericht": "Amtsgericht Stuttgart",
      "registernummer": "HRB 17945",
      "registerart": "HRB",
      "company_name": "MetaComp GmbH Computer + Netzwerke",
      "company_seat": "Stuttgart",
      "details": "15.11.2024 (Bekanntmachungsdatum)\n\nBaden-Württemberg Amtsgericht Stuttgart HRB 17945\nRegisterbekanntmachung nach dem Umwandlungsgesetz 15.11.2024 (Eintragungsdatum)\n\nMetaComp GmbH Computer + Netzwerke\nGesellschaft mit beschränkter Haftung\nStuttgart\n\nAls nicht eingetragen wird bekanntgemacht:\nDen Gläubigern der an der Verschmelzung beteiligten Rechtsträger ist, wenn sie binnen sechs Monaten nach dem Tag, an dem die Eintragung der Verschmelzung in das Register des Sitzes desjenigen Rechtsträgers, dessen Gläubiger sie sind, nach § 19 Abs. 3 UmwG als bekanntgemacht gilt, ihren Anspruch nach Grund und Höhe schriftlich anmelden, Sicherheit zu leisten, soweit sie nicht Befriedigung verlangen können. Dieses Recht steht den Gläubigern jedoch nur zu, wenn sie glaubhaft machen, dass durch die Verschmelzung die Erfüllung ihrer Forderung gefährdet wird."
    },
    {
      "date": "2024-11-15",
      "id": "93688",
      "original_text": "Registerbekanntmachung nach dem Umwandlungsgesetz\nRheinland-Pfalz Amtsgericht Ludwigshafen a.Rhein (Ludwigshafen) HRB 64099\nMetropol Makler GmbH – Waldsee",
      "type": "Registerbekanntmachung nach dem Umwandlungsgesetz",
      "state": "Rheinland-Pfalz",
      "amtsgericht": "Amtsgericht Ludwigshafen a.Rhein (Ludwigshafen)",
      "registernummer": "HRB 64099",
      "registerart": "HRB",
      "company_name": "Metropol Makler GmbH",
      "company_seat": "Waldsee",
      "details": "15.11.2024 (Bekanntmachungsdatum)\n\nRheinland-Pfalz Amtsgericht Ludwigshafen a.Rhein (Ludwigshafen) HRB 64099\nRegisterbekanntmachung nach dem Umwandlungsgesetz 15.11.2024 (Eintragungsdatum)\n\nMetropol Makler GmbH\nGesellschaft mit beschränkter Haftung\nWaldsee\n\nAls nicht eingetragen wird veröffentlicht: Den Gläubigern der an der Verschmelzung beteiligten Rechtsträger ist, wenn sie binnen sechs Monaten nach dem Tag, an dem die Eintragung der Verschmelzung in das Register des Sitzes desjenigen Rechtsträgers, dessen Gläubiger sie sind, nach § 19 Abs. 3 UmwG als bekannt gemacht gilt, ihren Anspruch nach Grund und Höhe schriftlich anmelden, Sicherheit zu leisten, soweit sie nicht Befriedigung verlangen können. Dieses Recht steht den Gläubigern jedoch nur zu, wenn sie glaubhaft machen, dass durch die Verschmelzung die Erfüllungd er Forderung gefährdet wird."
    },
    {
      "date": "2024-11-15",
      "id": "93612",
      "original_text": "Registerbekanntmachung nach dem Umwandlungsgesetz\nBayern Amtsgericht München HRB 200653\nMocho UG (haftungsbeschränkt) – München",
      "type": "Registerbekanntmachung nach dem Umwandlungsgesetz",
      "state": "Bayern",
      "amtsgericht": "Amtsgericht München",
      "registernummer": "HRB 200653",
      "registerart": "HRB",
      "company_name": "Mocho UG (haftungsbeschränkt)",
      "company_seat": "München",
      "details": "15.11.2024 (Bekanntmachungsdatum)\n\nBayern Amtsgericht München HRB 200653\nRegisterbekanntmachung nach dem Umwandlungsgesetz 14.11.2024 (Eintragungsdatum)\n\nMocho UG (haftungsbeschränkt)\nGesellschaft mit beschränkter Haftung\nMünchen\n\nDen Gläubigern der an der Verschmelzung beteiligten Rechtsträger ist, wenn sie binnen sechs Monaten nach dem Tag, an dem die Eintragung der Verschmelzung in das Register des Sitzes desjenigen Rechtsträgers, dessen Gläubiger sie sind, nach § 19 Abs. 3 UmwG als bekannt gemacht gilt, ihren Anspruch nach Grund und Höhe schriftlich anmelden, Sicherheit zu leisten, soweit sie nicht Befriedigung verlangen können. Dieses Recht steht den Gläubigern jedoch nur zu, wenn sie glaubhaft machen, dass durch die Verschmelzung die Erfüllung ihrer Forderung gefährdet wird."
    },
    {
      "date": "2024-11-15",
      "id": "93719",
      "original_text": "Löschungsankündigung\nHessen Amtsgericht Wetzlar HRA 5121\nModehaus Horn, Inh. Wilhelm C. Horn – Dillenburg",
      "type": "Löschungsankündigung",
      "state": "Hessen",
      "amtsgericht": "Amtsgericht Wetzlar",
      "registernummer": "HRA 5121",
      "registerart": "HRA",
      "company_name": "Modehaus Horn, Inh. Wilhelm C. Horn",
      "company_seat": "Dillenburg",
      "details": "15.11.2024 (Bekanntmachungsdatum)\n\nHessen Amtsgericht Wetzlar HRA 5121\nLöschungsankündigung\n\nModehaus Horn, Inh. Wilhelm C. Horn\nEinzelkaufmann / Einzelkauffrau\nDillenburg\n\nDas Registergericht beabsichtigt die im Handelsregister eingetragene Firma von Amts wegen nach § 31 Abs. 2 HGB zu löschen. Die Frist zur Erhebung eines Widerspruchs gegen die beabsichtigte Löschung wird auf 3 Monate festgesetzt."
    },
    {
      "date": "2024-11-15",
      "id": "93637",
      "original_text": "Löschungsankündigung\nBayern Amtsgericht München HRB 247379\nMulema UG (haftungsbeschränkt) – München",
      "type": "Löschungsankündigung",
      "state": "Bayern",
      "amtsgericht": "Amtsgericht München",
      "registernummer": "HRB 247379",
      "registerart": "HRB",
      "company_name": "Mulema UG (haftungsbeschränkt)",
      "company_seat": "München",
      "details": "15.11.2024 (Bekanntmachungsdatum)\n\nBayern Amtsgericht München HRB 247379\nLöschungsankündigung\n\nMulema UG (haftungsbeschränkt)\nGesellschaft mit beschränkter Haftung\nMünchen\n\nDas Registergericht beabsichtigt, die im Handelsregister eingetragene Gesellschaft wegen Vermögenslosigkeit von Amts wegen nach § 394 FamFG zu löschen. Die Frist zur Erhebung eines Widerspruchs ist auf drei Monate festgesetzt."
    },
    {
      "date": "2024-11-15",
      "id": "93656",
      "original_text": "Einreichung neuer Dokumente\nBerlin Amtsgericht Berlin (Charlottenburg) HRB 247469\nN26 AG – Berlin",
      "type": "Einreichung neuer Dokumente",
      "state": "Berlin",
      "amtsgericht": "Amtsgericht Berlin (Charlottenburg)",
      "registernummer": "HRB 247469",
      "registerart": "HRB",
      "company_name": "N26 AG",
      "company_seat": "Berlin",
      "details": "15.11.2024 (Bekanntmachungsdatum)\n\nBerlin Amtsgericht Berlin (Charlottenburg) HRB 247469\nEinreichung neuer Dokumente\n\nN26 AG\nAktiengesellschaft\nBerlin\n\nAls nicht eingetragen wird veröffentlicht: Es wurde eine neue Liste der Aufsichtsratsmitglieder eingereicht (§ 106 AktG)."
    },
    {
      "date": "2024-11-15",
      "id": "93683",
      "original_text": "Löschungsankündigung\nSachsen Amtsgericht Dresden HRB 26008\nNF Nickel Fenster Beteiligungs GmbH – Weißwasser",
      "type": "Löschungsankündigung",
      "state": "Sachsen",
      "amtsgericht": "Amtsgericht Dresden",
      "registernummer": "HRB 26008",
      "registerart": "HRB",
      "company_name": "NF Nickel Fenster Beteiligungs GmbH",
      "company_seat": "Weißwasser",
      "details": "15.11.2024 (Bekanntmachungsdatum)\n\nSachsen Amtsgericht Dresden HRB 26008\nLöschungsankündigung\n\nNF Nickel Fenster Beteiligungs GmbH\nGesellschaft mit beschränkter Haftung\nWeißwasser\n\nDas Registergericht beabsichtigt, die im Handelsregister eingetragene Gesellschaft von Amts wegen nach § 394 FamFG zu löschen. Die Frist zu Erhebung eines Widerspruchs gegen die beabsichtigte Löschung wird auf einen Monat festgesetzt."
    },
    {
      "date": "2024-11-15",
      "id": "93663",
      "original_text": "Löschungsankündigung\nHamburg Amtsgericht Hamburg HRB 156733\nNOOR FOOD GmbH – Hamburg",
      "type": "Löschungsankündigung",
      "state": "Hamburg",
      "amtsgericht": "Amtsgericht Hamburg",
      "registernummer": "HRB 156733",
      "registerart": "HRB",
      "company_name": "NOOR FOOD GmbH",
      "company_seat": "Hamburg",
      "details": "15.11.2024 (Bekanntmachungsdatum)\n\nHamburg Amtsgericht Hamburg HRB 156733\nLöschungsankündigung\n\nNOOR FOOD GmbH\nGesellschaft mit beschränkter Haftung\nHamburg\n\nDas Registergericht beabsichtigt, die im Handelsregister eingetragene Gesellschaft von Amts wegen nach § 394 FamFG zu löschen. Die Frist zur Erhebung eines Widerspruchs gegen die beabsichtigte Löschung wird auf 3 Monate festgesetzt."
    },
    {
      "date": "2024-11-15",
      "id": "93671",
      "original_text": "Einreichung neuer Dokumente\nMecklenburg-Vorpommern Amtsgericht Neubrandenburg HRB 1194\nNeubrandenburger Stadtwerke GmbH – Neubrandenburg",
      "type": "Einreichung neuer Dokumente",
      "state": "Mecklenburg-Vorpommern",
      "amtsgericht": "Amtsgericht Neubrandenburg",
      "registernummer": "HRB 1194",
      "registerart": "HRB",
      "company_name": "Neubrandenburger Stadtwerke GmbH",
      "company_seat": "Neubrandenburg",
      "details": "15.11.2024 (Bekanntmachungsdatum)\n\nMecklenburg-Vorpommern Amtsgericht Neubrandenburg HRB 1194\nEinreichung neuer Dokumente\n\nNeubrandenburger Stadtwerke GmbH\nGesellschaft mit beschränkter Haftung\nNeubrandenburg\n\nEine Liste der Mitglieder des Aufsichtsrats ist zum Handelsregister eingereicht worden."
    },
    {
      "date": "2024-11-15",
      "id": "93705",
      "original_text": "Einreichung neuer Dokumente\nNordrhein-Westfalen Amtsgericht Düsseldorf HRB 68709\nNewEase AG – Düsseldorf",
      "type": "Einreichung neuer Dokumente",
      "state": "Nordrhein-Westfalen",
      "amtsgericht": "Amtsgericht Düsseldorf",
      "registernummer": "HRB 68709",
      "registerart": "HRB",
      "company_name": "NewEase AG",
      "company_seat": "Düsseldorf",
      "details": "15.11.2024 (Bekanntmachungsdatum)\n\nNordrhein-Westfalen Amtsgericht Düsseldorf HRB 68709\nEinreichung neuer Dokumente\n\nNewEase AG\nAktiengesellschaft\nDüsseldorf\n\nDem Registergericht ist eine neue Liste der Mitglieder des Aufsichtsrates eingereicht worden."
    },
    {
      "date": "2024-11-15",
      "id": "93714",
      "original_text": "Sonstige Registerbekanntmachung\nHessen Amtsgericht Marburg VR 2691\nOrtsbund der Gehörlosen Biedenkopf e.V. – Biedenkopf",
      "type": "Sonstige Registerbekanntmachung",
      "state": "Hessen",
      "amtsgericht": "Amtsgericht Marburg",
      "registernummer": "VR 2691",
      "registerart": "VR",
      "company_name": "Ortsbund der Gehörlosen Biedenkopf e.V.",
      "company_seat": "Biedenkopf",
      "details": "15.11.2024 (Bekanntmachungsdatum)\n\nHessen Amtsgericht Marburg VR 2691\nSonstige Registerbekanntmachung 14.11.2024 (Eintragungsdatum)\n\nOrtsbund der Gehörlosen Biedenkopf e.V.\neingetragener Verein\nBiedenkopf\n\nDer Verein ist aufgelöst."
    },
    {
      "date": "2024-11-15",
      "id": "93676",
      "original_text": "Löschungsankündigung\nSchleswig-Holstein Amtsgericht Kiel HRA 7216\nOtrombowsky Makler für Versicherungen und Finanzen e. K. – Norderstedt",
      "type": "Löschungsankündigung",
      "state": "Schleswig-Holstein",
      "amtsgericht": "Amtsgericht Kiel",
      "registernummer": "HRA 7216",
      "registerart": "HRA",
      "company_name": "Otrombowsky Makler für Versicherungen und Finanzen e. K.",
      "company_seat": "Norderstedt",
      "details": "15.11.2024 (Bekanntmachungsdatum)\n\nSchleswig-Holstein Amtsgericht Kiel HRA 7216\nLöschungsankündigung\n\nOtrombowsky Makler für Versicherungen und Finanzen e. K.\nEinzelkaufmann / Einzelkauffrau\nNorderstedt\n\nBei der nachstehenden Firma wird das Amtslöschungsverfahren gemäß § 31 Abs. 2 HGB eingeleitet. Widerspruchsfrist: 2 Monate."
    },
    {
      "date": "2024-11-15",
      "id": "93690",
      "original_text": "Registerbekanntmachung nach dem Umwandlungsgesetz\nRheinland-Pfalz Amtsgericht Ludwigshafen a.Rhein (Ludwigshafen) HRB 67586\nPK Immobilienverwaltung Pfalz GmbH – Fußgönheim",
      "type": "Registerbekanntmachung nach dem Umwandlungsgesetz",
      "state": "Rheinland-Pfalz",
      "amtsgericht": "Amtsgericht Ludwigshafen a.Rhein (Ludwigshafen)",
      "registernummer": "HRB 67586",
      "registerart": "HRB",
      "company_name": "PK Immobilienverwaltung Pfalz GmbH",
      "company_seat": "Fußgönheim",
      "details": "15.11.2024 (Bekanntmachungsdatum)\n\nRheinland-Pfalz Amtsgericht Ludwigshafen a.Rhein (Ludwigshafen) HRB 67586\nRegisterbekanntmachung nach dem Umwandlungsgesetz 15.11.2024 (Eintragungsdatum)\n\nPK Immobilienverwaltung Pfalz GmbH\nGesellschaft mit beschränkter Haftung\nFußgönheim\n\nAls nicht eingetragen wird veröffentlicht: Den Gläubigern der an der Verschmelzung beteiligten Rechtsträger ist, wenn sie binnen sechs Monaten nach dem Tag, an dem die Eintragung der Verschmelzung in das Register des Sitzes desjenigen Rechtsträgers, dessen Gläubiger sie sind, nach § 19 Abs. 3 UmwG als bekannt gemacht gilt, ihren Anspruch nach Grund und Höhe schriftlich anmelden, Sicherheit zu leisten, soweit sie nicht Befriedigung verlangen können. Dieses Recht steht den Gläubigern jedoch nur zu, wenn sie glaubhaft machen, dass durch die Verschmelzung die Erfüllung der Forderung gefährdet wird."
    },
    {
      "date": "2024-11-15",
      "id": "93623",
      "original_text": "Registerbekanntmachung nach dem Umwandlungsgesetz\nBayern Amtsgericht Kempten (Allgäu) HRB 17774\nPaul Pfanzelt Besitz GmbH – Rettenbach a. Auerberg",
      "type": "Registerbekanntmachung nach dem Umwandlungsgesetz",
      "state": "Bayern",
      "amtsgericht": "Amtsgericht Kempten (Allgäu)",
      "registernummer": "HRB 17774",
      "registerart": "HRB",
      "company_name": "Paul Pfanzelt Besitz GmbH",
      "company_seat": "Rettenbach a. Auerberg",
      "details": "15.11.2024 (Bekanntmachungsdatum)\n\nBayern Amtsgericht Kempten (Allgäu) HRB 17774\nRegisterbekanntmachung nach dem Umwandlungsgesetz 14.11.2024 (Eintragungsdatum)\n\nPaul Pfanzelt Besitz GmbH\nGesellschaft mit beschränkter Haftung\nRettenbach a. Auerberg\n\nDen Gläubigern der an der Verschmelzung beteiligten Rechtsträger ist, wenn sie binnen sechs Monaten nach dem Tag, an dem die Eintragung der Verschmelzung in das Register des Sitzes desjenigen Rechtsträgers, dessen Gläubiger sie sind, nach § 19 Abs. 3 UmwG als bekannt gemacht gilt, ihren Anspruch nach Grund und Höhe schriftlich anmelden, Sicherheit zu leisten, soweit sie nicht Befriedigung verlangen können. Dieses Recht steht den Gläubigern jedoch nur zu, wenn sie glaubhaft machen, dass durch die Verschmelzung die Erfüllung ihrer Forderung gefährdet wird."
    },
    {
      "date": "2024-11-15",
      "id": "93622",
      "original_text": "Registerbekanntmachung nach dem Umwandlungsgesetz\nBayern Amtsgericht Kempten (Allgäu) HRB 14505\nPaul Pfanzelt Beteiligungsgesellschaft mbH – Rettenbach a. Auerberg",
      "type": "Registerbekanntmachung nach dem Umwandlungsgesetz",
      "state": "Bayern",
      "amtsgericht": "Amtsgericht Kempten (Allgäu)",
      "registernummer": "HRB 14505",
      "registerart": "HRB",
      "company_name": "Paul Pfanzelt Beteiligungsgesellschaft mbH",
      "company_seat": "Rettenbach a. Auerberg",
      "details": "15.11.2024 (Bekanntmachungsdatum)\n\nBayern Amtsgericht Kempten (Allgäu) HRB 14505\nRegisterbekanntmachung nach dem Umwandlungsgesetz 14.11.2024 (Eintragungsdatum)\n\nPaul Pfanzelt Beteiligungsgesellschaft mbH\nGesellschaft mit beschränkter Haftung\nRettenbach a. Auerberg\n\nDen Gläubigern der an der Verschmelzung beteiligten Rechtsträger ist, wenn sie binnen sechs Monaten nach dem Tag, an dem die Eintragung der Verschmelzung in das Register des Sitzes desjenigen Rechtsträgers, dessen Gläubiger sie sind, nach § 19 Abs. 3 UmwG als bekannt gemacht gilt, ihren Anspruch nach Grund und Höhe schriftlich anmelden, Sicherheit zu leisten, soweit sie nicht Befriedigung verlangen können. Dieses Recht steht den Gläubigern jedoch nur zu, wenn sie glaubhaft machen, dass durch die Verschmelzung die Erfüllung ihrer Forderung gefährdet wird."
    },
    {
      "date": "2024-11-15",
      "id": "93709",
      "original_text": "Löschungsankündigung\nBremen Amtsgericht Bremen HRB 25301\nPersoGroup GmbH – Bremen",
      "type": "Löschungsankündigung",
      "state": "Bremen",
      "amtsgericht": "Amtsgericht Bremen",
      "registernummer": "HRB 25301",
      "registerart": "HRB",
      "company_name": "PersoGroup GmbH",
      "company_seat": "Bremen",
      "details": "15.11.2024 (Bekanntmachungsdatum)\n\nBremen Amtsgericht Bremen HRB 25301\nLöschungsankündigung\n\nPersoGroup GmbH\nGesellschaft mit beschränkter Haftung\nBremen\n\nEs ist beabsichtigt die im Handelsregister eingetragene Gesellschaft von Amts wegen gemäß § 394 FamFG zu löschen. Gegen die Löschung kann beim AG Bremen schriftlich oder zu Protokoll der Geschäftsstelle Widerspruch eingelegt werden. Widerspruchsfrist 4 Wochen."
    },
    {
      "date": "2024-11-15",
      "id": "93617",
      "original_text": "Einreichung neuer Dokumente\nBayern Amtsgericht Augsburg HRB 82\nPeschel Holding Aktiengesellschaft – Augsburg",
      "type": "Einreichung neuer Dokumente",
      "state": "Bayern",
      "amtsgericht": "Amtsgericht Augsburg",
      "registernummer": "HRB 82",
      "registerart": "HRB",
      "company_name": "Peschel Holding Aktiengesellschaft",
      "company_seat": "Augsburg",
      "details": "15.11.2024 (Bekanntmachungsdatum)\n\nBayern Amtsgericht Augsburg HRB 82\nEinreichung neuer Dokumente\n\nPeschel Holding Aktiengesellschaft\nAktiengesellschaft\nAugsburg\n\nDem Amtsgericht Augsburg -Registergericht- ist eine Liste der Mitglieder des Aufsichtsrats eingereicht worden, § 106 AktG."
    },
    {
      "date": "2024-11-15",
      "id": "93639",
      "original_text": "Registerbekanntmachung nach dem Umwandlungsgesetz\nBerlin Amtsgericht Berlin (Charlottenburg) HRB 138248\nProfil Investment GmbH – Berlin",
      "type": "Registerbekanntmachung nach dem Umwandlungsgesetz",
      "state": "Berlin",
      "amtsgericht": "Amtsgericht Berlin (Charlottenburg)",
      "registernummer": "HRB 138248",
      "registerart": "HRB",
      "company_name": "Profil Investment GmbH",
      "company_seat": "Berlin",
      "details": "15.11.2024 (Bekanntmachungsdatum)\n\nBerlin Amtsgericht Berlin (Charlottenburg) HRB 138248\nRegisterbekanntmachung nach dem Umwandlungsgesetz 13.11.2024 (Eintragungsdatum)\n\nProfil Investment GmbH\nGesellschaft mit beschränkter Haftung\nBerlin\n\nZu Eintragungsnummer 12 vom 13.11.2024 wird als nicht eingetragen veröffentlicht: Den Gläubigern der an der Verschmelzung beteiligten Rechtsträger ist, wenn sie binnen sechs Monaten nach dem Tag, an dem die Eintragung der Verschmelzung in das Register des Sitzes desjenigen Rechtsträgers, dessen Gläubiger sie sind, als bekannt gemacht gilt, ihren Anspruch nach Grund und Höhe schriftlich anmelden, Sicherheit zu leisten, soweit sie nicht Befriedigung verlangen können. Dieses Recht steht den Gläubigern jedoch nur zu, wenn sie glaubhaft machen, dass durch die Verschmelzung die Erfüllung ihrer Forderung gefährdet wird. Das Recht, Sicherheitsleistung zu verlangen, steht Gläubigern nicht zu, die im Falle der Insolvenz ein Recht auf vorzugsweise Befriedigung aus einer Deckungsmasse haben, die nach gesetzlicher Vorschrift zu ihrem Schutz errichtet und staatlich überwacht ist."
    },
    {
      "date": "2024-11-15",
      "id": "93619",
      "original_text": "Einreichung neuer Dokumente\nBayern Amtsgericht Ingolstadt HRB 7931\nProlignis AG – Ingolstadt",
      "type": "Einreichung neuer Dokumente",
      "state": "Bayern",
      "amtsgericht": "Amtsgericht Ingolstadt",
      "registernummer": "HRB 7931",
      "registerart": "HRB",
      "company_name": "Prolignis AG",
      "company_seat": "Ingolstadt",
      "details": "15.11.2024 (Bekanntmachungsdatum)\n\nBayern Amtsgericht Ingolstadt HRB 7931\nEinreichung neuer Dokumente 14.11.2024 (Eintragungsdatum)\n\nProlignis AG\nAktiengesellschaft\nIngolstadt\n\nDem Registergericht Ingolstadt ist der Entwurf eines Verschmelzungsvertrages zwischen der Gesellschaft als übernehmendem Rechtsträger und der Prolignis International GmbH, Amtsgericht Ingolstad HRB 10313, zur Einsichtnahme eingereicht worden."
    },
    {
      "date": "2024-11-15",
      "id": "93620",
      "original_text": "Löschungsankündigung\nBayern Amtsgericht Landshut HRB 11421\nRomax UG (haftungsbeschränkt) – Landshut",
      "type": "Löschungsankündigung",
      "state": "Bayern",
      "amtsgericht": "Amtsgericht Landshut",
      "registernummer": "HRB 11421",
      "registerart": "HRB",
      "company_name": "Romax UG (haftungsbeschränkt)",
      "company_seat": "Landshut",
      "details": "15.11.2024 (Bekanntmachungsdatum)\n\nBayern Amtsgericht Landshut HRB 11421\nLöschungsankündigung\n\nRomax UG (haftungsbeschränkt)\nGesellschaft mit beschränkter Haftung\nLandshut\n\nDas Registergericht beabsichtigt, die im Handelsregister eingetragene Gesellschaft wegen Vermögenslosigkeit von Amts wegen nach § 394 FamFG zu löschen. Die Frist zur Erhebung eines Widerspruchs ist auf einen Monat festgesetzt."
    },
    {
      "date": "2024-11-15",
      "id": "93660",
      "original_text": "Löschungsankündigung\nSchleswig-Holstein Amtsgericht Flensburg HRB 11865\nSM - BAU GmbH Garten- und Landschaftsbau – Böklund",
      "type": "Löschungsankündigung",
      "state": "Schleswig-Holstein",
      "amtsgericht": "Amtsgericht Flensburg",
      "registernummer": "HRB 11865",
      "registerart": "HRB",
      "company_name": "SM - BAU GmbH Garten- und Landschaftsbau",
      "company_seat": "Böklund",
      "details": "15.11.2024 (Bekanntmachungsdatum)\n\nSchleswig-Holstein Amtsgericht Flensburg HRB 11865\nLöschungsankündigung\n\nSM - BAU GmbH Garten- und Landschaftsbau\nGesellschaft mit beschränkter Haftung\nBöklund\n\nEs ist die Löschung der nachstehenden Gesellschaft wegen Vermögenslosigkeit gemäß § 394 FamFG beabsichtigt.\nWiderspruchsfrist: 2 Monate."
    },
    {
      "date": "2024-11-15",
      "id": "93697",
      "original_text": "Registerbekanntmachung nach dem Umwandlungsgesetz\nNordrhein-Westfalen Amtsgericht Duisburg HRA 12065\nSeewiesen Power GmbH & Co. KG 3 – Mülheim an der Ruhr",
      "type": "Registerbekanntmachung nach dem Umwandlungsgesetz",
      "state": "Nordrhein-Westfalen",
      "amtsgericht": "Amtsgericht Duisburg",
      "registernummer": "HRA 12065",
      "registerart": "HRA",
      "company_name": "Seewiesen Power GmbH & Co. KG 3",
      "company_seat": "Mülheim an der Ruhr",
      "details": "15.11.2024 (Bekanntmachungsdatum)\n\nNordrhein-Westfalen Amtsgericht Duisburg HRA 12065\nRegisterbekanntmachung nach dem Umwandlungsgesetz 15.11.2024 (Eintragungsdatum)\n\nSeewiesen Power GmbH & Co. KG 3\nKommanditgesellschaft\nMülheim an der Ruhr\n\nDen Gläubigern der an der Verschmelzung zur Aufnahme beteiligten Rechtsträger ist, wenn sie binnen sechs Monaten nach dem Tag, an dem die Eintragung der Verschmelzung in das Register des Sitzes derjenigen Rechtsträger deren Gläubiger sie sind, nach § 19 Abs. 3 UmwG als bekannt gemacht gilt, ihren Anspruch nach Grund und Höhe schriftlich anmelden, Sicherheit zu leisten, soweit sie nicht Befriedigung verlangen können. Dieses Recht steht den Gläubigern jedoch nur zu, wenn sie glaubhaft machen, dass durch die Verschmelzung die Erfüllung ihrer Forderung gefährdet wird."
    },
    {
      "date": "2024-11-15",
      "id": "93704",
      "original_text": "Registerbekanntmachung nach dem Umwandlungsgesetz\nNordrhein-Westfalen Amtsgericht Düsseldorf HRB 86604\nShow MEP Verwaltungs GmbH – Düsseldorf",
      "type": "Registerbekanntmachung nach dem Umwandlungsgesetz",
      "state": "Nordrhein-Westfalen",
      "amtsgericht": "Amtsgericht Düsseldorf",
      "registernummer": "HRB 86604",
      "registerart": "HRB",
      "company_name": "Show MEP Verwaltungs GmbH",
      "company_seat": "Düsseldorf",
      "details": "15.11.2024 (Bekanntmachungsdatum)\n\nNordrhein-Westfalen Amtsgericht Düsseldorf HRB 86604\nRegisterbekanntmachung nach dem Umwandlungsgesetz 15.11.2024 (Eintragungsdatum)\n\nShow MEP Verwaltungs GmbH\nGesellschaft mit beschränkter Haftung\nDüsseldorf\n\nDen Gläubigern der an der Verschmelzung beteiligten Rechtsträger ist, wenn sie binnen sechs Monaten nach dem Tag, an dem die Eintragung der Verschmelzung in das Register des Sitzes desjenigen Rechtsträgers, dessen Gläubiger sie sind, nach § 19 Absatz 3 UmwG als bekanntgemacht gilt, ihren Anspruch nach Grund und Höhe schriftlich anmelden, Sicherheit zu leisten, soweit sie nicht Befriedigung verlangen können. Dieses Recht steht den Gläubigern jedoch nur zu, wenn sie glaubhaft machen, dass durch die Verschmelzung die Erfüllung ihrer Forderung gefährdet wird."
    },
    {
      "date": "2024-11-15",
      "id": "93629",
      "original_text": "Löschungsankündigung\nBayern Amtsgericht München HRB 227415\nSiGa Tech GmbH – Hohenbrunn",
      "type": "Löschungsankündigung",
      "state": "Bayern",
      "amtsgericht": "Amtsgericht München",
      "registernummer": "HRB 227415",
      "registerart": "HRB",
      "company_name": "SiGa Tech GmbH",
      "company_seat": "Hohenbrunn",
      "details": "15.11.2024 (Bekanntmachungsdatum)\n\nBayern Amtsgericht München HRB 227415\nLöschungsankündigung 14.11.2024 (Eintragungsdatum)\n\nSiGa Tech GmbH\nGesellschaft mit beschränkter Haftung\nHohenbrunn\n\nDas Registergericht beabsichtigt, die im Handelsregister eingetragene Gesellschaft wegen Vermögenslosigkeit von Amts wegen nach § 394 FamFG zu löschen. Die Frist zur Erhebung eines Widerspruchs ist auf drei Monate festgesetzt."
    },
    {
      "date": "2024-11-15",
      "id": "93655",
      "original_text": "Einreichung neuer Dokumente\nBaden-Württemberg Amtsgericht Ulm HRB 728622\nSonnenhof-Therme Bad Saulgau GmbH – Bad Saulgau",
      "type": "Einreichung neuer Dokumente",
      "state": "Baden-Württemberg",
      "amtsgericht": "Amtsgericht Ulm",
      "registernummer": "HRB 728622",
      "registerart": "HRB",
      "company_name": "Sonnenhof-Therme Bad Saulgau GmbH",
      "company_seat": "Bad Saulgau",
      "details": "15.11.2024 (Bekanntmachungsdatum)\n\nBaden-Württemberg Amtsgericht Ulm HRB 728622\nEinreichung neuer Dokumente\n\nSonnenhof-Therme Bad Saulgau GmbH\nGesellschaft mit beschränkter Haftung\nBad Saulgau\n\nDie Gesellschaft hat am 07.11.2024 die Liste über die Zusammensetzung des Aufsichtsrats zum Handelsregister eingereicht."
    },
    {
      "date": "2024-11-15",
      "id": "93658",
      "original_text": "Einreichung neuer Dokumente\nBrandenburg Amtsgericht Potsdam HRB 28205\nStWB Verwaltungs GmbH – Brandenburg an der Havel",
      "type": "Einreichung neuer Dokumente",
      "state": "Brandenburg",
      "amtsgericht": "Amtsgericht Potsdam",
      "registernummer": "HRB 28205",
      "registerart": "HRB",
      "company_name": "StWB Verwaltungs GmbH",
      "company_seat": "Brandenburg an der Havel",
      "details": "15.11.2024 (Bekanntmachungsdatum)\n\nBrandenburg Amtsgericht Potsdam HRB 28205\nEinreichung neuer Dokumente\n\nStWB Verwaltungs GmbH\nGesellschaft mit beschränkter Haftung\nBrandenburg an der Havel\n\nAls nicht eingetragen wird bekanntgemacht: Eine Liste der Mitglieder des Aufsichtsrates wurde zum Handelsregister eingereicht."
    },
    {
      "date": "2024-11-15",
      "id": "93642",
      "original_text": "Einreichung neuer Dokumente\nSaarland Amtsgericht Saarbrücken HRB 23304\nStadtwerke Dillingen/Saar GmbH – Dillingen",
      "type": "Einreichung neuer Dokumente",
      "state": "Saarland",
      "amtsgericht": "Amtsgericht Saarbrücken",
      "registernummer": "HRB 23304",
      "registerart": "HRB",
      "company_name": "Stadtwerke Dillingen/Saar GmbH",
      "company_seat": "Dillingen",
      "details": "15.11.2024 (Bekanntmachungsdatum)\n\nSaarland Amtsgericht Saarbrücken HRB 23304\nEinreichung neuer Dokumente\n\nStadtwerke Dillingen/Saar GmbH\nGesellschaft mit beschränkter Haftung\nDillingen\n\nDie Geschäftsführung der Gesellschaft hat eine Liste der Mitglieder des Aufsichtsrats zum Handelsregister eingereicht (§ 52 Abs. 3 Satz 2 GmbHG)."
    },
    {
      "date": "2024-11-15",
      "id": "93626",
      "original_text": "Löschungsankündigung\nBayern Amtsgericht München HRB 255898\nStar Drive GmbH – München",
      "type": "Löschungsankündigung",
      "state": "Bayern",
      "amtsgericht": "Amtsgericht München",
      "registernummer": "HRB 255898",
      "registerart": "HRB",
      "company_name": "Star Drive GmbH",
      "company_seat": "München",
      "details": "15.11.2024 (Bekanntmachungsdatum)\n\nBayern Amtsgericht München HRB 255898\nLöschungsankündigung\n\nStar Drive GmbH\nGesellschaft mit beschränkter Haftung\nMünchen\n\nDas Registergericht beabsichtigt, die im Handelsregister eingetragene Gesellschaft wegen Vermögenslosigkeit von Amts wegen nach § 394 FamFG zu löschen. Die Frist zur Erhebung eines Widerspruchs ist auf drei Monate festgesetzt."
    },
    {
      "date": "2024-11-15",
      "id": "93712",
      "original_text": "Registerbekanntmachung nach dem Umwandlungsgesetz\nHessen Amtsgericht Darmstadt HRA 87599\nSteffen Heinlein e.K. – Babenhausen",
      "type": "Registerbekanntmachung nach dem Umwandlungsgesetz",
      "state": "Hessen",
      "amtsgericht": "Amtsgericht Darmstadt",
      "registernummer": "HRA 87599",
      "registerart": "HRA",
      "company_name": "Steffen Heinlein e.K.",
      "company_seat": "Babenhausen",
      "details": "15.11.2024 (Bekanntmachungsdatum)\n\nHessen Amtsgericht Darmstadt HRA 87599\nRegisterbekanntmachung nach dem Umwandlungsgesetz 15.11.2024 (Eintragungsdatum)\n\nSteffen Heinlein e.K.\nEinzelkaufmann / Einzelkauffrau\nBabenhausen\n\nDen Gläubigern der an der Ausgliederung beteiligten Rechtsträger ist, wenn sie binnen sechs Monaten nach dem Tag, an dem die Eintragung der Ausgliederung in das Register des Sitzes derjenigen Rechtsträger deren Gläubiger sie sind, nach §§ 125, 19 Absatz 3 UmwG bekannt gemacht worden ist, ihren Anspruch nach Grund und Höhe schriftlich anmelden, Sicherheit zu leisten, soweit sie nicht Befriedigung verlangen können. Dieses Recht steht den Gläubigern jedoch nur zu, wenn sie glaubhaft machen, dass durch die Ausgliederung die Erfüllung ihrer Forderung gefährdet wird."
    },
    {
      "date": "2024-11-15",
      "id": "93665",
      "original_text": "Löschungsankündigung\nBerlin Amtsgericht Berlin (Charlottenburg) HRA 57842\nSteinkeller UG (haftungsbeschränkt) & Co. KG – Berlin",
      "type": "Löschungsankündigung",
      "state": "Berlin",
      "amtsgericht": "Amtsgericht Berlin (Charlottenburg)",
      "registernummer": "HRA 57842",
      "registerart": "HRA",
      "company_name": "Steinkeller UG (haftungsbeschränkt) & Co. KG",
      "company_seat": "Berlin",
      "details": "15.11.2024 (Bekanntmachungsdatum)\n\nBerlin Amtsgericht Berlin (Charlottenburg) HRA 57842\nLöschungsankündigung\n\nSteinkeller UG (haftungsbeschränkt) & Co. KG\nKommanditgesellschaft\nBerlin\n\nBei dem nachstehenden Unternehmen / der nachstehenden Gesellschaft wird das Amtslöschungsverfahren gemäß § 31 Abs. 2 HGB eingeleitet. Widerspruchsfrist 1 Monat"
    },
    {
      "date": "2024-11-15",
      "id": "93635",
      "original_text": "Einreichung neuer Dokumente\nBayern Amtsgericht Nürnberg HRB 1070\nStädtische Werke Nürnberg Gesellschaft mit beschränkter Haftung – Nürnberg",
      "type": "Einreichung neuer Dokumente",
      "state": "Bayern",
      "amtsgericht": "Amtsgericht Nürnberg",
      "registernummer": "HRB 1070",
      "registerart": "HRB",
      "company_name": "Städtische Werke Nürnberg Gesellschaft mit beschränkter Haftung",
      "company_seat": "Nürnberg",
      "details": "15.11.2024 (Bekanntmachungsdatum)\n\nBayern Amtsgericht Nürnberg HRB 1070\nEinreichung neuer Dokumente\n\nStädtische Werke Nürnberg Gesellschaft mit beschränkter Haftung\nGesellschaft mit beschränkter Haftung\nNürnberg\n\nDem #Re.Name ist eine Liste der Mitglieder des Aufsichtsrats eingereicht worden, § 52 Abs. 3 S. 2 GmbHG."
    },
    {
      "date": "2024-11-15",
      "id": "93613",
      "original_text": "Einreichung neuer Dokumente\nBayern Amtsgericht Traunstein HRB 15063\nSüddeutsche Truthahn Aktiengesellschaft Handelsgesellschaft – Ampfing",
      "type": "Einreichung neuer Dokumente",
      "state": "Bayern",
      "amtsgericht": "Amtsgericht Traunstein",
      "registernummer": "HRB 15063",
      "registerart": "HRB",
      "company_name": "Süddeutsche Truthahn Aktiengesellschaft Handelsgesellschaft",
      "company_seat": "Ampfing",
      "details": "15.11.2024 (Bekanntmachungsdatum)\n\nBayern Amtsgericht Traunstein HRB 15063\nEinreichung neuer Dokumente\n\nSüddeutsche Truthahn Aktiengesellschaft Handelsgesellschaft\nAktiengesellschaft\nAmpfing\n\nDem Amtsgericht Traunstein -Registergericht- ist eine Liste der Mitglieder des Aufsichtsrats eingereicht worden, § 106 AktG."
    },
    {
      "date": "2024-11-15",
      "id": "93640",
      "original_text": "Registerbekanntmachung nach dem Umwandlungsgesetz\nBerlin Amtsgericht Berlin (Charlottenburg) HRB 188463\nTOV-Immo GmbH – Berlin",
      "type": "Registerbekanntmachung nach dem Umwandlungsgesetz",
      "state": "Berlin",
      "amtsgericht": "Amtsgericht Berlin (Charlottenburg)",
      "registernummer": "HRB 188463",
      "registerart": "HRB",
      "company_name": "TOV-Immo GmbH",
      "company_seat": "Berlin",
      "details": "15.11.2024 (Bekanntmachungsdatum)\n\nBerlin Amtsgericht Berlin (Charlottenburg) HRB 188463\nRegisterbekanntmachung nach dem Umwandlungsgesetz 13.11.2024 (Eintragungsdatum)\n\nTOV-Immo GmbH\nGesellschaft mit beschränkter Haftung\nBerlin\n\nZu Eintragungsnummer 6 vom 13.11.2024 wird als nicht eingetragen veröffentlicht: Den Gläubigern der an der Verschmelzung beteiligten Rechtsträger ist, wenn sie binnen sechs Monaten nach dem Tag, an dem die Eintragung der Verschmelzung in das Register des Sitzes desjenigen Rechtsträgers, dessen Gläubiger sie sind, als bekannt gemacht gilt, ihren Anspruch nach Grund und Höhe schriftlich anmelden, Sicherheit zu leisten, soweit sie nicht Befriedigung verlangen können. Dieses Recht steht den Gläubigern jedoch nur zu, wenn sie glaubhaft machen, dass durch die Verschmelzung die Erfüllung ihrer Forderung gefährdet wird. Das Recht, Sicherheitsleistung zu verlangen, steht Gläubigern nicht zu, die im Falle der Insolvenz ein Recht auf vorzugsweise Befriedigung aus einer Deckungsmasse haben, die nach gesetzlicher Vorschrift zu ihrem Schutz errichtet und staatlich überwacht ist."
    },
    {
      "date": "2024-11-15",
      "id": "93695",
      "original_text": "Löschungsankündigung\nNordrhein-Westfalen Amtsgericht Düsseldorf HRB 92787\nTWP Verwaltungs GmbH – Monheim am Rhein",
      "type": "Löschungsankündigung",
      "state": "Nordrhein-Westfalen",
      "amtsgericht": "Amtsgericht Düsseldorf",
      "registernummer": "HRB 92787",
      "registerart": "HRB",
      "company_name": "TWP Verwaltungs GmbH",
      "company_seat": "Monheim am Rhein",
      "details": "15.11.2024 (Bekanntmachungsdatum)\n\nNordrhein-Westfalen Amtsgericht Düsseldorf HRB 92787\nLöschungsankündigung\n\nTWP Verwaltungs GmbH\nGesellschaft mit beschränkter Haftung\nMonheim am Rhein\n\nDas Registergericht beabsichtigt die Gesellschaft von Amts wegen nach § 394 FamFG zu löschen. Die Frist zur Erhebung eines Widerspruchs ist auf 3 Wochen festgesetzt.\n\nRechtsbehelfsbelehrung:\nDas Widerspruchsrecht steht jedem zu, der an der Unterlassung der Löschung ein berechtigtes Interesse hat. Der Widerspruch ist bei dem Amtsgericht Düsseldorf -Registergericht-, Werdener Straße 1, 40227 Düsseldorf schriftlich in deutscher Sprache oder zur Niederschrift der Geschäftsstelle einzulegen. Der Widerspruch kann auch zur Niederschrift der Geschäftsstelle eines jeden Amtsgerichtes abgegeben werden. Die Einlegung ist auch durch Übertragung eines elektronischen Dokuments an die elektronische Poststelle des Gerichts möglich. Das elektronische Dokument muss für die Bearbeitung durch das Gericht geeignet und mit einer qualifizierten elektronischen Signatur der verantwortenden Person versehen sein oder von der verantwortenden Person signiert und auf einem sicheren Übermittlungsweg gemäß § 130a ZPO nach näherer Maßgabe der Verordnung über die technischen Rahmenbedingungen des elektronischen Rechtsverkehrs und über das besondere elektronische Behördenpostfach (BGBl. I, S.3803) eingereicht werden. Weitere Informationen erhalten Sie auf der Internetseite www.justiz.de.\nDer Widerspruch muss spätestens innerhalb der gesetzten Frist nach dem Datum der Bekanntmachung der Löschungsankündigung bei dem Amtsgericht - Registergericht - Düsseldorf eingegangen sein.  Dies gilt auch dann, wenn der Widerspruch zur Niederschrift der Geschäftsstelle eines anderen Amtsgerichtes abgegeben wurde. Die Frist beginnt mit dem Tage der Bekanntmachung der Löschungsankündigung in dem für die Bekanntmachung der Eintragungen in das Handelsregister bestimmten elektronischen Informations- und Kommunikationssystem nach § 10 des Handelsgesetzbuches. Fällt das Ende der Frist auf einen Sonntag, einen allgemeinen Feiertag oder Sonnabend, so endet die Frist mit Ablauf des nächsten Werktages.\nDer Widerspruch muss die Bezeichnung der angefochtenen Löschungsankündigung sowie die Erklärung enthalten, dass Widerspruch gegen diese Löschungsankündigung eingelegt wird. Er ist zu unterzeichnen und soll begründet werden."
    },
    {
      "date": "2024-11-15",
      "id": "93669",
      "original_text": "Löschungsankündigung\nBaden-Württemberg Amtsgericht Mannheim HRB 730958\nThe Joy GmbH – Karlsruhe",
      "type": "Löschungsankündigung",
      "state": "Baden-Württemberg",
      "amtsgericht": "Amtsgericht Mannheim",
      "registernummer": "HRB 730958",
      "registerart": "HRB",
      "company_name": "The Joy GmbH",
      "company_seat": "Karlsruhe",
      "details": "15.11.2024 (Bekanntmachungsdatum)\n\nBaden-Württemberg Amtsgericht Mannheim HRB 730958\nLöschungsankündigung\n\nThe Joy GmbH\nGesellschaft mit beschränkter Haftung\nKarlsruhe\n\nAls nicht eingetragen wird bekanntgemacht: Das Gericht beabsichtigt, die Gesellschaft wegen Vermögenslosigkeit im Handelsregister von Amts wegen nach § 394 FamFG zu löschen. Die Frist zur Geltendmachung eines Widerspruchs gegen die beabsichtigte Löschung ist auf einen Monat ab Veröffentlichung bestimmt."
    },
    {
      "date": "2024-11-15",
      "id": "93652",
      "original_text": "Löschungsankündigung\nHamburg Amtsgericht Hamburg HRA 120398\nTransport Service Nord e.K. Inh. Davis Fischer – Hamburg",
      "type": "Löschungsankündigung",
      "state": "Hamburg",
      "amtsgericht": "Amtsgericht Hamburg",
      "registernummer": "HRA 120398",
      "registerart": "HRA",
      "company_name": "Transport Service Nord e.K. Inh. Davis Fischer",
      "company_seat": "Hamburg",
      "details": "15.11.2024 (Bekanntmachungsdatum)\n\nHamburg Amtsgericht Hamburg HRA 120398\nLöschungsankündigung\n\nTransport Service Nord e.K. Inh. Davis Fischer\nEinzelkaufmann\nHamburg\n\nDas Registergericht beabsichtigt, die im Handelsregister eingetragene Firma von Amts wegen nach § 31 Abs. 2 HGB zu löschen. Die Frist zur Erhebung eines Widerspruchs gegen die beabsichtigte Löschung wird auf 3 Monate festgesetzt."
    },
    {
      "date": "2024-11-15",
      "id": "93689",
      "original_text": "Registerbekanntmachung nach dem Umwandlungsgesetz\nRheinland-Pfalz Amtsgericht Landau VR 974\nTrägerverein Ökumenische Sozialstation im Bereich der Verbandsgemeinden Edenkoben-Herxheim-Offenbach e.V. – Herxheim",
      "type": "Registerbekanntmachung nach dem Umwandlungsgesetz",
      "state": "Rheinland-Pfalz",
      "amtsgericht": "Amtsgericht Landau",
      "registernummer": "VR 974",
      "registerart": "VR",
      "company_name": "Trägerverein Ökumenische Sozialstation im Bereich der Verbandsgemeinden Edenkoben-Herxheim-Offenbach e.V.",
      "company_seat": "Herxheim",
      "details": "15.11.2024 (Bekanntmachungsdatum)\n\nRheinland-Pfalz Amtsgericht Landau VR 974\nRegisterbekanntmachung nach dem Umwandlungsgesetz 15.11.2024 (Eintragungsdatum)\n\nTrägerverein Ökumenische Sozialstation im Bereich der Verbandsgemeinden Edenkoben-Herxheim-Offenbach e.V.\neingetragener Verein\nHerxheim\n\nAls nicht eingetragen wird veröffentlicht: Den Gläubigern der an der Ausgliederung beteiligten Rechtsträger ist, wenn sie binnen sechs Monaten nach dem Tag, an dem die Eintragung der Ausgliederung in das Register des Sitzes desjenigen Rechtsträgers, dessen Gläubiger sie sind, nach § 19 Abs. 3 UmwG als bekannt gemacht gilt, ihren Anspruch nach Grund und Höhe schriftlich anmelden, Sicherheit zu leisten, soweit sie nicht Befriedigung verlangen können. Dieses Recht steht den Gläubigern jedoch nur zu, wenn sie glaubhaft machen, dass durch die Ausgliederung die Erfüllung der Forderung gefährdet wird."
    },
    {
      "date": "2024-11-15",
      "id": "93641",
      "original_text": "Sonstige Registerbekanntmachung\nSchleswig-Holstein Amtsgericht Flensburg HRB 1289 SL\nVAMED Fachpflege Schleswig GmbH – Schleswig",
      "type": "Sonstige Registerbekanntmachung",
      "state": "Schleswig-Holstein",
      "amtsgericht": "Amtsgericht Flensburg",
      "registernummer": "HRB 1289 SL",
      "registerart": "HRB",
      "company_name": "VAMED Fachpflege Schleswig GmbH",
      "company_seat": "Schleswig",
      "details": "15.11.2024 (Bekanntmachungsdatum)\n\nSchleswig-Holstein Amtsgericht Flensburg HRB 1289 SL\nSonstige Registerbekanntmachung 11.11.2024 (Eintragungsdatum)\n\nVAMED Fachpflege Schleswig GmbH\nGesellschaft mit beschränkter Haftung\nSchleswig\n\nAls nicht eingetragen wird veröffentlicht: Der andere Vertragsteil hat den Gläubigern dieses Rechtsträgers, dessen Forderungen begründet worden sind, bevor die Eintragung der Beendigung dieses Vertrages in das Handelsregister nach § 10 des Handelsgesetzbuches als bekannt gemacht gilt, Sicherheit zu leisten, wenn sie sich binnen sechs Monaten nach der Bekanntmachung der Eintragung zu diesem Zweck bei ihm melden."
    },
    {
      "date": "2024-11-15",
      "id": "93682",
      "original_text": "Einreichung neuer Dokumente\nSachsen Amtsgericht Dresden HRB 8333\nVersorgungsbetriebe Hoyerswerda GmbH – Hoyerswerda",
      "type": "Einreichung neuer Dokumente",
      "state": "Sachsen",
      "amtsgericht": "Amtsgericht Dresden",
      "registernummer": "HRB 8333",
      "registerart": "HRB",
      "company_name": "Versorgungsbetriebe Hoyerswerda GmbH",
      "company_seat": "Hoyerswerda",
      "details": "15.11.2024 (Bekanntmachungsdatum)\n\nSachsen Amtsgericht Dresden HRB 8333\nEinreichung neuer Dokumente\n\nVersorgungsbetriebe Hoyerswerda GmbH\nGesellschaft mit beschränkter Haftung\nHoyerswerda\n\nAm 14.11.2024 wurde beim Handelsregister des Amtsgerichts Dresden die Liste der Mitglieder des Aufsichtsrats gemäß § 52 GmbHG eingereicht."
    },
    {
      "date": "2024-11-15",
      "id": "93636",
      "original_text": "Registerbekanntmachung nach dem Umwandlungsgesetz\nBayern Amtsgericht München HRA 62253\nWickenhäuser GmbH & Co. KG – München",
      "type": "Registerbekanntmachung nach dem Umwandlungsgesetz",
      "state": "Bayern",
      "amtsgericht": "Amtsgericht München",
      "registernummer": "HRA 62253",
      "registerart": "HRA",
      "company_name": "Wickenhäuser GmbH & Co. KG",
      "company_seat": "München",
      "details": "15.11.2024 (Bekanntmachungsdatum)\n\nBayern Amtsgericht München HRA 62253\nRegisterbekanntmachung nach dem Umwandlungsgesetz 14.11.2024 (Eintragungsdatum)\n\nWickenhäuser GmbH & Co. KG\nKommanditgesellschaft\nMünchen\n\nDen Gläubigern der an der Verschmelzung beteiligten Rechtsträger ist, wenn sie binnen sechs Monaten nach dem Tag, an dem die Eintragung der Verschmelzung in das Register des Sitzes desjenigen Rechtsträgers, dessen Gläubiger sie sind, nach § 19 Abs. 3 UmwG als bekannt gemacht gilt, ihren Anspruch nach Grund und Höhe schriftlich anmelden, Sicherheit zu leisten, soweit sie nicht Befriedigung verlangen können. Dieses Recht steht den Gläubigern jedoch nur zu, wenn sie glaubhaft machen, dass durch die Verschmelzung die Erfüllung ihrer Forderung gefährdet wird."
    },
    {
      "date": "2024-11-15",
      "id": "93674",
      "original_text": "Sonstige Registerbekanntmachung\nBrandenburg Amtsgericht Frankfurt/Oder HRB 529\nWohnungs- und Baugesellschaft mbH Bernau – Bernau bei Berlin",
      "type": "Sonstige Registerbekanntmachung",
      "state": "Brandenburg",
      "amtsgericht": "Amtsgericht Frankfurt/Oder",
      "registernummer": "HRB 529",
      "registerart": "HRB",
      "company_name": "Wohnungs- und Baugesellschaft mbH Bernau",
      "company_seat": "Bernau bei Berlin",
      "details": "15.11.2024 (Bekanntmachungsdatum)\n\nBrandenburg Amtsgericht Frankfurt/Oder HRB 529\nSonstige Registerbekanntmachung\n\nWohnungs- und Baugesellschaft mbH Bernau\nGesellschaft mit beschränkter Haftung\nBernau bei Berlin\n\nAls nicht eingetragen wird veröffentlicht: Die Listen der Aufsichtsratsmitglieder Stand 06.05.2024 und 04.07.2024 jeweils vom 04.11.2024 sind zum Handelsregister eingereicht worden"
    },
    {
      "date": "2024-11-15",
      "id": "93670",
      "original_text": "Einreichung neuer Dokumente\nMecklenburg-Vorpommern Amtsgericht Neubrandenburg HRB 1325\nWohnungsbaugesellschaft mbH Röbel – Röbel/Müritz",
      "type": "Einreichung neuer Dokumente",
      "state": "Mecklenburg-Vorpommern",
      "amtsgericht": "Amtsgericht Neubrandenburg",
      "registernummer": "HRB 1325",
      "registerart": "HRB",
      "company_name": "Wohnungsbaugesellschaft mbH Röbel",
      "company_seat": "Röbel/Müritz",
      "details": "15.11.2024 (Bekanntmachungsdatum)\n\nMecklenburg-Vorpommern Amtsgericht Neubrandenburg HRB 1325\nEinreichung neuer Dokumente\n\nWohnungsbaugesellschaft mbH Röbel\nGesellschaft mit beschränkter Haftung\nRöbel/Müritz\n\nEine Liste der Mitglieder des Aufsichtsrats ist zum Handelsregister eingereicht worden."
    },
    {
      "date": "2024-11-15",
      "id": "93654",
      "original_text": "Einreichung neuer Dokumente\nBaden-Württemberg Amtsgericht Stuttgart HRB 741253\nXactools GmbH – Bönnigheim",
      "type": "Einreichung neuer Dokumente",
      "state": "Baden-Württemberg",
      "amtsgericht": "Amtsgericht Stuttgart",
      "registernummer": "HRB 741253",
      "registerart": "HRB",
      "company_name": "Xactools GmbH",
      "company_seat": "Bönnigheim",
      "details": "15.11.2024 (Bekanntmachungsdatum)\n\nBaden-Württemberg Amtsgericht Stuttgart HRB 741253\nEinreichung neuer Dokumente\n\nXactools GmbH\nGesellschaft mit beschränkter Haftung\nBönnigheim\n\nDie Gesellschaft hat am 14.11.2014 die Liste über die Zusammensetzung des Aufsichtsrats zum Handelsregister eingereicht."
    },
    {
      "date": "2024-11-15",
      "id": "93667",
      "original_text": "Löschungsankündigung\nBrandenburg Amtsgericht Frankfurt/Oder HRB 15497\nZ & W Eventservice UG (haftungsbeschränkt) – Schöneiche bei Berlin",
      "type": "Löschungsankündigung",
      "state": "Brandenburg",
      "amtsgericht": "Amtsgericht Frankfurt/Oder",
      "registernummer": "HRB 15497",
      "registerart": "HRB",
      "company_name": "Z & W Eventservice UG (haftungsbeschränkt)",
      "company_seat": "Schöneiche bei Berlin",
      "details": "15.11.2024 (Bekanntmachungsdatum)\n\nBrandenburg Amtsgericht Frankfurt/Oder HRB 15497\nLöschungsankündigung\n\nZ & W Eventservice UG (haftungsbeschränkt)\nGesellschaft mit beschränkter Haftung\nSchöneiche bei Berlin\n\nBei der nachstehenden Gesellschaft wird das Amtslöschungsverfahren gemäß § 394 Abs. 1 FamFG eingeleitet."
    },
    {
      "date": "2024-11-15",
      "id": "93631",
      "original_text": "Löschungsankündigung\nBayern Amtsgericht München HRB 105472\nZORRO Filmproduktions- und -vertriebsgesellschaft mbH – München",
      "type": "Löschungsankündigung",
      "state": "Bayern",
      "amtsgericht": "Amtsgericht München",
      "registernummer": "HRB 105472",
      "registerart": "HRB",
      "company_name": "ZORRO Filmproduktions- und -vertriebsgesellschaft mbH",
      "company_seat": "München",
      "details": "15.11.2024 (Bekanntmachungsdatum)\n\nBayern Amtsgericht München HRB 105472\nLöschungsankündigung 14.11.2024 (Eintragungsdatum)\n\nZORRO Filmproduktions- und -vertriebsgesellschaft mbH\nGesellschaft mit beschränkter Haftung\nMünchen\n\nDas Registergericht beabsichtigt, die im Handelsregister eingetragene Gesellschaft wegen Vermögenslosigkeit von Amts wegen nach § 394 FamFG zu löschen. Die Frist zur Erhebung eines Widerspruchs ist auf drei Monate festgesetzt."
    },
    {
      "date": "2024-11-15",
      "id": "93702",
      "original_text": "Registerbekanntmachung nach dem Umwandlungsgesetz\nNordrhein-Westfalen Amtsgericht Duisburg HRA 12013\nZero Emission People Windstrom CO2frei GmbH & Co. KG – Mülheim an der Ruhr",
      "type": "Registerbekanntmachung nach dem Umwandlungsgesetz",
      "state": "Nordrhein-Westfalen",
      "amtsgericht": "Amtsgericht Duisburg",
      "registernummer": "HRA 12013",
      "registerart": "HRA",
      "company_name": "Zero Emission People Windstrom CO2frei GmbH & Co. KG",
      "company_seat": "Mülheim an der Ruhr",
      "details": "15.11.2024 (Bekanntmachungsdatum)\n\nNordrhein-Westfalen Amtsgericht Duisburg HRA 12013\nRegisterbekanntmachung nach dem Umwandlungsgesetz 15.11.2024 (Eintragungsdatum)\n\nZero Emission People Windstrom CO2frei GmbH & Co. KG\nKommanditgesellschaft\nMülheim an der Ruhr\n\nDen Gläubigern der an der Verschmelzung zur Aufnahme beteiligten Rechtsträger ist, wenn sie binnen sechs Monaten nach dem Tag, an dem die Eintragung der Verschmelzung in das Register des Sitzes derjenigen Rechtsträger deren Gläubiger sie sind, nach § 19 Abs. 3 UmwG als bekannt gemacht gilt, ihren Anspruch nach Grund und Höhe schriftlich anmelden, Sicherheit zu leisten, soweit sie nicht Befriedigung verlangen können. Dieses Recht steht den Gläubigern jedoch nur zu, wenn sie glaubhaft machen, dass durch die Verschmelzung die Erfüllung ihrer Forderung gefährdet wird."
    },
    {
      "date": "2024-11-15",
      "id": "93668",
      "original_text": "Sonstige Registerbekanntmachung\nBerlin Amtsgericht Berlin (Charlottenburg) HRB 264067\nconiugo.bes.tech GmbH – Berlin",
      "type": "Sonstige Registerbekanntmachung",
      "state": "Berlin",
      "amtsgericht": "Amtsgericht Berlin (Charlottenburg)",
      "registernummer": "HRB 264067",
      "registerart": "HRB",
      "company_name": "coniugo.bes.tech GmbH",
      "company_seat": "Berlin",
      "details": "15.11.2024 (Bekanntmachungsdatum)\n\nBerlin Amtsgericht Berlin (Charlottenburg) HRB 264067\nSonstige Registerbekanntmachung\n\nconiugo.bes.tech GmbH\nGesellschaft mit beschränkter Haftung\nBerlin\n\nAls nicht eingetragen wird veröffentlicht: Den Gläubigern der an der Verschmelzung beteiligten Rechtsträger ist, wenn sie binnen sechs Monaten nach dem Tag, an dem die Eintragung der Verschmelzung in das Register des Sitzes desjenigen Rechtsträgers, dessen Gläubiger sie sind, als bekannt gemacht gilt, ihren Anspruch nach Grund und Höhe schriftlich anmelden, Sicherheit zu leisten, soweit sie nicht Befriedigung verlangen können. Dieses Recht steht den Gläubigern jedoch nur zu, wenn sie glaubhaft machen, dass durch die Verschmelzung die Erfüllung ihrer Forderung gefährdet wird. Das Recht, Sicherheitsleistung zu verlangen, steht Gläubigern nicht zu, die im Falle der Insolvenz ein Recht auf vorzugsweise Befriedigung aus einer Deckungsmasse haben, die nach gesetzlicher Vorschrift zu ihrem Schutz errichtet und staatlich überwacht ist."
    },
    {
      "date": "2024-11-15",
      "id": "93621",
      "original_text": "Registerbekanntmachung nach dem Umwandlungsgesetz\nBayern Amtsgericht Aschaffenburg HRA 6658\no-soft Klaus Stumpf e.K. – Kleinwallstadt",
      "type": "Registerbekanntmachung nach dem Umwandlungsgesetz",
      "state": "Bayern",
      "amtsgericht": "Amtsgericht Aschaffenburg",
      "registernummer": "HRA 6658",
      "registerart": "HRA",
      "company_name": "o-soft Klaus Stumpf e.K.",
      "company_seat": "Kleinwallstadt",
      "details": "15.11.2024 (Bekanntmachungsdatum)\n\nBayern Amtsgericht Aschaffenburg HRA 6658\nRegisterbekanntmachung nach dem Umwandlungsgesetz 14.11.2024 (Eintragungsdatum)\n\no-soft Klaus Stumpf e.K.\nEinzelkaufmann / Einzelkauffrau\nKleinwallstadt\n\nDen Gläubigern der an der Verschmelzung beteiligten Rechtsträger ist, wenn sie binnen sechs Monaten nach dem Tag, an dem die Eintragung der Verschmelzung in das Register des Sitzes desjenigen Rechtsträgers, dessen Gläubiger sie sind, nach § 19 Abs. 3 UmwG als bekannt gemacht gilt, ihren Anspruch nach Grund und Höhe schriftlich anmelden, Sicherheit zu leisten, soweit sie nicht Befriedigung verlangen können. Dieses Recht steht den Gläubigern jedoch nur zu, wenn sie glaubhaft machen, dass durch die Verschmelzung die Erfüllung ihrer Forderung gefährdet wird."
    },
    {
      "date": "2024-11-15",
      "id": "93615",
      "original_text": "Registerbekanntmachung nach dem Umwandlungsgesetz\nBayern Amtsgericht Aschaffenburg HRB 6943\no-soft Organisations- und Softwarelösungen Klaus Stumpf GmbH – Kleinwallstadt",
      "type": "Registerbekanntmachung nach dem Umwandlungsgesetz",
      "state": "Bayern",
      "amtsgericht": "Amtsgericht Aschaffenburg",
      "registernummer": "HRB 6943",
      "registerart": "HRB",
      "company_name": "o-soft Organisations- und Softwarelösungen Klaus Stumpf GmbH",
      "company_seat": "Kleinwallstadt",
      "details": "15.11.2024 (Bekanntmachungsdatum)\n\nBayern Amtsgericht Aschaffenburg HRB 6943\nRegisterbekanntmachung nach dem Umwandlungsgesetz 14.11.2024 (Eintragungsdatum)\n\no-soft Organisations- und Softwarelösungen Klaus Stumpf GmbH\nGesellschaft mit beschränkter Haftung\nKleinwallstadt\n\nDen Gläubigern der an der Verschmelzung beteiligten Rechtsträger ist, wenn sie binnen sechs Monaten nach dem Tag, an dem die Eintragung der Verschmelzung in das Register des Sitzes desjenigen Rechtsträgers, dessen Gläubiger sie sind, nach § 19 Abs. 3 UmwG als bekannt gemacht gilt, ihren Anspruch nach Grund und Höhe schriftlich anmelden, Sicherheit zu leisten, soweit sie nicht Befriedigung verlangen können. Dieses Recht steht den Gläubigern jedoch nur zu, wenn sie glaubhaft machen, dass durch die Verschmelzung die Erfüllung ihrer Forderung gefährdet wird."
    },
    {
      "date": "2024-11-15",
      "id": "93634",
      "original_text": "Registerbekanntmachung nach dem Umwandlungsgesetz\nBayern Amtsgericht Nürnberg HRB 43748\nsolarpower project-invest GmbH – Nürnberg",
      "type": "Registerbekanntmachung nach dem Umwandlungsgesetz",
      "state": "Bayern",
      "amtsgericht": "Amtsgericht Nürnberg",
      "registernummer": "HRB 43748",
      "registerart": "HRB",
      "company_name": "solarpower project-invest GmbH",
      "company_seat": "Nürnberg",
      "details": "15.11.2024 (Bekanntmachungsdatum)\n\nBayern Amtsgericht Nürnberg HRB 43748\nRegisterbekanntmachung nach dem Umwandlungsgesetz 14.11.2024 (Eintragungsdatum)\n\nsolarpower project-invest GmbH\nGesellschaft mit beschränkter Haftung\nNürnberg\n\nDen Gläubigern des formwechselnden Rechtsträgers ist, wenn sie binnen sechs Monaten nach dem Tag, an dem die Eintragung des Formwechsels nach § 201 UmwG als bekannt gemacht gilt, ihren Anspruch nach Grund und Höhe schriftlich anmelden, Sicherheit zu leisten, soweit sie nicht Befriedigung verlangen können. Dieses Recht steht den Gläubigern jedoch nur zu, wenn sie glaubhaft machen, dass durch den Formwechsel die Erfüllung ihrer Forderung gefährdet wird."
    },
    {
      "date": "2024-11-15",
      "id": "93673",
      "original_text": "Löschungsankündigung\nBerlin Amtsgericht Berlin (Charlottenburg) HRB 165627\nstromtown GmbH – Berlin",
      "type": "Löschungsankündigung",
      "state": "Berlin",
      "amtsgericht": "Amtsgericht Berlin (Charlottenburg)",
      "registernummer": "HRB 165627",
      "registerart": "HRB",
      "company_name": "stromtown GmbH",
      "company_seat": "Berlin",
      "details": "15.11.2024 (Bekanntmachungsdatum)\n\nBerlin Amtsgericht Berlin (Charlottenburg) HRB 165627\nLöschungsankündigung\n\nstromtown GmbH\nGesellschaft mit beschränkter Haftung\nBerlin\n\nBei der nachstehenden Gesellschaft wird das Amtslöschungsverfahren gemäß § 394 FamFG eingeleitet. Widerspruchsfrist 6 Wochen"
    },
    {
      "date": "2024-11-15",
      "id": "93632",
      "original_text": "Sonstige Registerbekanntmachung\nBayern Amtsgericht Nürnberg HRB 355\nuniVersa Lebensversicherung a. G. – Nürnberg",
      "type": "Sonstige Registerbekanntmachung",
      "state": "Bayern",
      "amtsgericht": "Amtsgericht Nürnberg",
      "registernummer": "HRB 355",
      "registerart": "HRB",
      "company_name": "uniVersa Lebensversicherung a. G.",
      "company_seat": "Nürnberg",
      "details": "15.11.2024 (Bekanntmachungsdatum)\n\nBayern Amtsgericht Nürnberg HRB 355\nSonstige Registerbekanntmachung\n\nuniVersa Lebensversicherung a. G.\nVersicherungsverein auf Gegenseitigkeit\nNürnberg\n\nDem Amtsgericht Nürnberg -Registergericht- ist eine Liste der Mitglieder des Aufsichtsrats eingereicht worden, §§ 189 Abs. 3 Satz 1 VAG, 106 AktG."
    },
    {
      "date": "2024-11-15",
      "id": "93685",
      "original_text": "Löschungsankündigung\nSachsen Amtsgericht Dresden HRB 33614\nwms - Wohnen mit Services GmbH – Löbau",
      "type": "Löschungsankündigung",
      "state": "Sachsen",
      "amtsgericht": "Amtsgericht Dresden",
      "registernummer": "HRB 33614",
      "registerart": "HRB",
      "company_name": "wms - Wohnen mit Services GmbH",
      "company_seat": "Löbau",
      "details": "15.11.2024 (Bekanntmachungsdatum)\n\nSachsen Amtsgericht Dresden HRB 33614\nLöschungsankündigung\n\nwms - Wohnen mit Services GmbH\nGesellschaft mit beschränkter Haftung\nLöbau\n\nDas Registergericht beabsichtigt, die im Handelsregister eingetragene Gesellschaft von Amts wegen nach § 394 FamFG zu löschen. Die Frist zu Erhebung eines Widerspruchs gegen die beabsichtigte Löschung wird auf einen Monat festgesetzt."
    },
    {
      "date": "2024-11-15",
      "id": "93692",
      "original_text": "Registerbekanntmachung nach dem Umwandlungsgesetz\nRheinland-Pfalz Amtsgericht Landau HRB 34138\nÖkumenische Sozialstation Edenkoben-Herxheim-Offenbach gemeinnützige Gesellschaft mit beschränkter Haftung – Herxheim bei Landau",
      "type": "Registerbekanntmachung nach dem Umwandlungsgesetz",
      "state": "Rheinland-Pfalz",
      "amtsgericht": "Amtsgericht Landau",
      "registernummer": "HRB 34138",
      "registerart": "HRB",
      "company_name": "Ökumenische Sozialstation Edenkoben-Herxheim-Offenbach gemeinnützige Gesellschaft mit beschränkter Haftung",
      "company_seat": "Herxheim bei Landau",
      "details": "15.11.2024 (Bekanntmachungsdatum)\n\nRheinland-Pfalz Amtsgericht Landau HRB 34138\nRegisterbekanntmachung nach dem Umwandlungsgesetz 15.11.2024 (Eintragungsdatum)\n\nÖkumenische Sozialstation Edenkoben-Herxheim-Offenbach gemeinnützige Gesellschaft mit beschränkter Haftung\nGesellschaft mit beschränkter Haftung\nHerxheim bei Landau\n\nAls nicht eingetragen wird veröffentlicht: Den Gläubigern der an der Ausgliederung beteiligten Rechtsträger ist, wenn sie binnen sechs Monaten nach dem Tag, an dem die Eintragung der Ausgliederung in das Register des Sitzes desjenigen Rechtsträgers, dessen Gläubiger sie sind, nach § 19 Abs. 3 UmwG als bekannt gemacht gilt, ihren Anspruch nach Grund und Höhe schriftlich anmelden, Sicherheit zu leisten, soweit sie nicht Befriedigung verlangen können. Dieses Recht steht den Gläubigern jedoch nur zu, wenn sie glaubhaft machen, dass durch die Ausgliederung die Erfüllung der Forderung gefährdet wird."
    }
  ]
}