{
  "date": "2024-11-11",
  "date_of_scrape": "2024-11-22",
  "tool_version": "0.1.0",
  "announcements": [
    {
      "date": "2024-11-11",
      "original_text": "Löschungsankündigung\nBerlin Amtsgericht Berlin (Charlottenburg) HRB 109565\nA.l.p.-Clean & More Dienstleistung GmbH – Berlin",
      "type": "Löschungsankündigung",
      "state": "Berlin",
      "amtsgericht": "Amtsgericht Berlin (Charlottenburg)",
      "registernummer": "HRB 109565",
      "registerart": "HRB",
      "company_name": "A.l.p.-Clean & More Dienstleistung GmbH",
      "company_seat": "Berlin",
      "details": "11.11.2024 (Bekanntmachungsdatum)\n\nBerlin Amtsgericht Berlin (Charlottenburg) HRB 109565\nLöschungsankündigung\n\nA.l.p.-Clean & More Dienstleistung GmbH\nGesellschaft mit beschränkter Haftung\nBerlin\n\nBei der nachstehenden Gesellschaft wird das Amtslöschungsverfahren gemäß § 394 FamFG eingeleitet. Widerspruchsfrist 6 Wochen"
    },
    {
      "date": "2024-11-11",
      "original_text": "Löschungsankündigung\nHessen Amtsgericht Frankfurt am Main HRB 93762\nALFONS Bau GmbH – Frankfurt am Main",
      "type": "Löschungsankündigung",
      "state": "Hessen",
      "amtsgericht": "Amtsgericht Frankfurt am Main",
      "registernummer": "HRB 93762",
      "registerart": "HRB",
      "company_name": "ALFONS Bau GmbH",
      "company_seat": "Frankfurt am Main",
      "details": "11.11.2024 (Bekanntmachungsdatum)\n\nHessen Amtsgericht Frankfurt am Main HRB 93762\nLöschungsankündigung\n\nALFONS Bau GmbH\nGesellschaft mit beschränkter Haftung\nFrankfurt am Main\n\nDas Registergericht beabsichtigt die im Handelsregister eingetragene Gesellschaft von Amts wegen nach § 394 FamFG zu löschen. Die Frist zur Erhebung eines Widerspruchs gegen die beabsichtigte Löschung wird auf 1 Monat festgesetzt."
    },
    {
      "date": "2024-11-11",
      "original_text": "Registerbekanntmachung nach dem Umwandlungsgesetz\nBaden-Württemberg Amtsgericht Stuttgart HRB 779549\nAVL Finanzvermittlung GmbH – Weinstadt",
      "type": "Registerbekanntmachung nach dem Umwandlungsgesetz",
      "state": "Baden-Württemberg",
      "amtsgericht": "Amtsgericht Stuttgart",
      "registernummer": "HRB 779549",
      "registerart": "HRB",
      "company_name": "AVL Finanzvermittlung GmbH",
      "company_seat": "Weinstadt",
      "details": "11.11.2024 (Bekanntmachungsdatum)\n\nBaden-Württemberg Amtsgericht Stuttgart HRB 779549\nRegisterbekanntmachung nach dem Umwandlungsgesetz 11.11.2024 (Eintragungsdatum)\n\nAVL Finanzvermittlung GmbH\nGesellschaft mit beschränkter Haftung\nWeinstadt\n\nAls nicht eingetragen wird bekanntgemacht:\nDen Gläubigern der an der Verschmelzung beteiligten Rechtsträger ist, wenn sie binnen sechs Monaten nach dem Tag, an dem die Eintragung der Verschmelzung in das Register des Sitzes desjenigen Rechtsträgers, dessen Gläubiger sie sind, nach § 19 Abs. 3 UmwG als bekanntgemacht gilt, ihren Anspruch nach Grund und Höhe schriftlich anmelden, Sicherheit zu leisten, soweit sie nicht Befriedigung verlangen können. Dieses Recht steht den Gläubigern jedoch nur zu, wenn sie glaubhaft machen, dass durch die Verschmelzung die Erfüllung ihrer Forderung gefährdet wird."
    },
    {
      "date": "2024-11-11",
      "original_text": "Registerbekanntmachung nach dem Umwandlungsgesetz\nBaden-Württemberg Amtsgericht Stuttgart HRB 769761\nAVL Versicherungsvergleich GmbH – Weinstadt",
      "type": "Registerbekanntmachung nach dem Umwandlungsgesetz",
      "state": "Baden-Württemberg",
      "amtsgericht": "Amtsgericht Stuttgart",
      "registernummer": "HRB 769761",
      "registerart": "HRB",
      "company_name": "AVL Versicherungsvergleich GmbH",
      "company_seat": "Weinstadt",
      "details": "11.11.2024 (Bekanntmachungsdatum)\n\nBaden-Württemberg Amtsgericht Stuttgart HRB 769761\nRegisterbekanntmachung nach dem Umwandlungsgesetz 11.11.2024 (Eintragungsdatum)\n\nAVL Versicherungsvergleich GmbH\nGesellschaft mit beschränkter Haftung\nWeinstadt\n\nAls nicht eingetragen wird bekanntgemacht:\nDen Gläubigern der an der Verschmelzung beteiligten Rechtsträger ist, wenn sie binnen sechs Monaten nach dem Tag, an dem die Eintragung der Verschmelzung in das Register des Sitzes desjenigen Rechtsträgers, dessen Gläubiger sie sind, nach § 19 Abs. 3 UmwG als bekanntgemacht gilt, ihren Anspruch nach Grund und Höhe schriftlich anmelden, Sicherheit zu leisten, soweit sie nicht Befriedigung verlangen können. Dieses Recht steht den Gläubigern jedoch nur zu, wenn sie glaubhaft machen, dass durch die Verschmelzung die Erfüllung ihrer Forderung gefährdet wird."
    },
    {
      "date": "2024-11-11",
      "original_text": "Einreichung neuer Dokumente\nNiedersachsen Amtsgericht Göttingen HRB 206555\nAdelebser Immobilien GmbH – Adelebsen",
      "type": "Einreichung neuer Dokumente",
      "state": "Niedersachsen",
      "amtsgericht": "Amtsgericht Göttingen",
      "registernummer": "HRB 206555",
      "registerart": "HRB",
      "company_name": "Adelebser Immobilien GmbH",
      "company_seat": "Adelebsen",
      "details": "11.11.2024 (Bekanntmachungsdatum)\n\nNiedersachsen Amtsgericht Göttingen HRB 206555\nEinreichung neuer Dokumente\n\nAdelebser Immobilien GmbH\nGesellschaft mit beschränkter Haftung\nAdelebsen\n\nDie Liste der Mitglieder des Aufsichtsrats wurde beim Registergericht eingereicht."
    },
    {
      "date": "2024-11-11",
      "original_text": "Löschungsankündigung\nHessen Amtsgericht Frankfurt am Main HRA 17969\nAkademische Buchhandlung Irene Wötzel – Frankfurt am Main",
      "type": "Löschungsankündigung",
      "state": "Hessen",
      "amtsgericht": "Amtsgericht Frankfurt am Main",
      "registernummer": "HRA 17969",
      "registerart": "HRA",
      "company_name": "Akademische Buchhandlung Irene Wötzel",
      "company_seat": "Frankfurt am Main",
      "details": "11.11.2024 (Bekanntmachungsdatum)\n\nHessen Amtsgericht Frankfurt am Main HRA 17969\nLöschungsankündigung\n\nAkademische Buchhandlung Irene Wötzel\nEinzelkaufmann / Einzelkauffrau\nFrankfurt am Main\n\nDas Registergericht beabsichtigt die im Handelsregister eingetragene Kauffrau von Amts wegen nach § 31 Abs. 2 HGB zu löschen. Die Frist zur Erhebung eines Widerspruchs gegen die beabsichtigte Löschung wird auf 1 Monate festgesetzt."
    },
    {
      "date": "2024-11-11",
      "original_text": "Löschungsankündigung\nHessen Amtsgericht Frankfurt am Main HRB 100165\nAlcor Spirits GmbH – Frankfurt am Main",
      "type": "Löschungsankündigung",
      "state": "Hessen",
      "amtsgericht": "Amtsgericht Frankfurt am Main",
      "registernummer": "HRB 100165",
      "registerart": "HRB",
      "company_name": "Alcor Spirits GmbH",
      "company_seat": "Frankfurt am Main",
      "details": "11.11.2024 (Bekanntmachungsdatum)\n\nHessen Amtsgericht Frankfurt am Main HRB 100165\nLöschungsankündigung\n\nAlcor Spirits GmbH\nGesellschaft mit beschränkter Haftung\nFrankfurt am Main\n\nDas Registergericht beabsichtigt die im Handelsregister eingetragene Gesellschaft von Amts wegen nach § 394 FamFG zu löschen. Die Frist zur Erhebung eines Widerspruchs gegen die beabsichtigte Löschung wird auf 1 Monate festgesetzt."
    },
    {
      "date": "2024-11-11",
      "original_text": "Löschungsankündigung\nSachsen-Anhalt Amtsgericht Stendal VR 1252\nAnfangBeginingAnza (ABA) e.V. – Wernigerode",
      "type": "Löschungsankündigung",
      "state": "Sachsen-Anhalt",
      "amtsgericht": "Amtsgericht Stendal",
      "registernummer": "VR 1252",
      "registerart": "VR",
      "company_name": "AnfangBeginingAnza (ABA) e.V.",
      "company_seat": "Wernigerode",
      "details": "11.11.2024 (Bekanntmachungsdatum)\n\nSachsen-Anhalt Amtsgericht Stendal VR 1252\nLöschungsankündigung\n\nAnfangBeginingAnza (ABA) e.V.\neingetragener Verein\nWernigerode\n\nDas Registergericht beabsichtigt, vorstehenden Verein infolge Wegfalls sämtlicher Mitglieder bzw. vollständiger Aufgabe des Vereinszwecks v.A.w. zu löschen. Die Frist zur Erhebung eines Widerspruchs gegen die beabsichtigte Löschung wird auf 2 Monate festgesetzt."
    },
    {
      "date": "2024-11-11",
      "original_text": "Löschungsankündigung\nSchleswig-Holstein Amtsgericht Lübeck HRA 9779\nAnporis Gesundheitshafen GmbH & Co. KG – Timmendorfer Strand",
      "type": "Löschungsankündigung",
      "state": "Schleswig-Holstein",
      "amtsgericht": "Amtsgericht Lübeck",
      "registernummer": "HRA 9779",
      "registerart": "HRA",
      "company_name": "Anporis Gesundheitshafen GmbH & Co. KG",
      "company_seat": "Timmendorfer Strand",
      "details": "11.11.2024 (Bekanntmachungsdatum)\n\nSchleswig-Holstein Amtsgericht Lübeck HRA 9779\nLöschungsankündigung\n\nAnporis Gesundheitshafen GmbH & Co. KG\nKommanditgesellschaft\nTimmendorfer Strand\n\nBei der nachstehenden Firma wird das Amtslöschungsverfahren gemäß § 31 Abs. 2 HGB eingeleitet.\nWiderspruchsfrist: 1 Monat"
    },
    {
      "date": "2024-11-11",
      "original_text": "Sonstige Registerbekanntmachung\nHamburg Amtsgericht Hamburg HRB 1775\nAurubis AG – Hamburg",
      "type": "Sonstige Registerbekanntmachung",
      "state": "Hamburg",
      "amtsgericht": "Amtsgericht Hamburg",
      "registernummer": "HRB 1775",
      "registerart": "HRB",
      "company_name": "Aurubis AG",
      "company_seat": "Hamburg",
      "details": "11.11.2024 (Bekanntmachungsdatum)\n\nHamburg Amtsgericht Hamburg HRB 1775\nSonstige Registerbekanntmachung 11.11.2024 (Eintragungsdatum)\n\nAurubis AG\nAktiengesellschaft\nHamburg\n\nAls nicht eingetragen wird bekannt gemacht: Liste des Aufsichtsrats wurde eingereicht."
    },
    {
      "date": "2024-11-11",
      "original_text": "Registerbekanntmachung nach dem Umwandlungsgesetz\nNiedersachsen Amtsgericht Walsrode HRA 205362\nAusbildungsstätte Rahn Töchter OHG – Nienburg",
      "type": "Registerbekanntmachung nach dem Umwandlungsgesetz",
      "state": "Niedersachsen",
      "amtsgericht": "Amtsgericht Walsrode",
      "registernummer": "HRA 205362",
      "registerart": "HRA",
      "company_name": "Ausbildungsstätte Rahn Töchter OHG",
      "company_seat": "Nienburg",
      "details": "11.11.2024 (Bekanntmachungsdatum)\n\nNiedersachsen Amtsgericht Walsrode HRA 205362\nRegisterbekanntmachung nach dem Umwandlungsgesetz 11.11.2024 (Eintragungsdatum)\n\nAusbildungsstätte Rahn Töchter OHG\nOffene Handelsgesellschaft\nNienburg\n\nDen Gläubigern der an der Ausgliederung beteiligten Rechtsträger ist, wenn sie binnen sechs Monaten nach dem Tag, an dem die Eintragung der Ausgliederung in das Register des Sitzes desjenigen Rechtsträgers, dessen Gläubiger sie sind, nach § 19 Abs. 3 UmwG als bekannt gemacht gilt, ihren Anspruch nach Grund und Höhe schriftlich anmelden, Sicherheit zu leisten, soweit sie nicht Befriedigung verlangen können. Dieses Recht steht den Gläubigern jedoch nur zu, wenn sie glaubhaft machen, dass durch die Ausgliederung die Erfüllung der Forderung gefährdet wird."
    },
    {
      "date": "2024-11-11",
      "original_text": "Registerbekanntmachung nach dem Umwandlungsgesetz\nNiedersachsen Amtsgericht Walsrode HRA 205318\nAusbildungsstätte Silke Rahn e.K. – Nienburg/Weser",
      "type": "Registerbekanntmachung nach dem Umwandlungsgesetz",
      "state": "Niedersachsen",
      "amtsgericht": "Amtsgericht Walsrode",
      "registernummer": "HRA 205318",
      "registerart": "HRA",
      "company_name": "Ausbildungsstätte Silke Rahn e.K.",
      "company_seat": "Nienburg/Weser",
      "details": "11.11.2024 (Bekanntmachungsdatum)\n\nNiedersachsen Amtsgericht Walsrode HRA 205318\nRegisterbekanntmachung nach dem Umwandlungsgesetz 11.11.2024 (Eintragungsdatum)\n\nAusbildungsstätte Silke Rahn e.K.\nEinzelkaufmann / Einzelkauffrau\nNienburg/Weser\n\nDen Gläubigern der an der Ausgliederung beteiligten Rechtsträger ist, wenn sie binnen sechs Monaten nach dem Tag, an dem die Eintragung der Ausgliederung in das Register des Sitzes desjenigen Rechtsträgers, dessen Gläubiger sie sind, nach § 19 Abs. 3 UmwG als bekannt gemacht gilt, ihren Anspruch nach Grund und Höhe schriftlich anmelden, Sicherheit zu leisten, soweit sie nicht Befriedigung verlangen können. Dieses Recht steht den Gläubigern jedoch nur zu, wenn sie glaubhaft machen, dass durch die Ausgliederung die Erfüllung der Forderung gefährdet wird."
    },
    {
      "date": "2024-11-11",
      "original_text": "Löschungsankündigung\nBerlin Amtsgericht Berlin (Charlottenburg) HRB 219643\nBasler Bau GmbH – Berlin",
      "type": "Löschungsankündigung",
      "state": "Berlin",
      "amtsgericht": "Amtsgericht Berlin (Charlottenburg)",
      "registernummer": "HRB 219643",
      "registerart": "HRB",
      "company_name": "Basler Bau GmbH",
      "company_seat": "Berlin",
      "details": "11.11.2024 (Bekanntmachungsdatum)\n\nBerlin Amtsgericht Berlin (Charlottenburg) HRB 219643\nLöschungsankündigung\n\nBasler Bau GmbH\nGesellschaft mit beschränkter Haftung\nBerlin\n\nBei der nachstehenden Gesellschaft wird das Amtslöschungsverfahren gemäß § 394 FamFG eingeleitet. Widerspruchsfrist 6 Wochen"
    },
    {
      "date": "2024-11-11",
      "original_text": "Registerbekanntmachung nach dem Umwandlungsgesetz\nNiedersachsen Amtsgericht Oldenburg (Oldenburg) HRA 130818 früher Amtsgericht Wilhelmshaven\nBio Pin Naturfarben GmbH & Co. KG – Jever",
      "type": "Registerbekanntmachung nach dem Umwandlungsgesetz",
      "state": "Niedersachsen",
      "amtsgericht": "Amtsgericht Oldenburg (Oldenburg)",
      "registernummer": "HRA 130818",
      "registerart": "HRA",
      "company_name": "Bio Pin Naturfarben GmbH & Co. KG",
      "company_seat": "Jever",
      "former_amtsgericht": "Wilhelmshaven",
      "details": "11.11.2024 (Bekanntmachungsdatum)\n\nNiedersachsen Amtsgericht Oldenburg (Oldenburg) HRA 130818 früher Amtsgericht Wilhelmshaven\nRegisterbekanntmachung nach dem Umwandlungsgesetz 11.11.2024 (Eintragungsdatum)\n\nBio Pin Naturfarben GmbH & Co. KG\nKommanditgesellschaft\nJever\n\nDen Gläubigern der an der Verschmelzung beteiligten Rechtsträger ist, wenn sie binnen sechs Monaten nach dem Tag, an dem die Eintragung der Verschmelzung in das Register des Sitzes desjenigen Rechtsträgers, dessen Gläubiger sie sind, nach § 19  Abs.  3 UmwG als bekannt gemacht gilt, ihren Anspruch nach Grund und Höhe schriftlich anmelden, Sicherheit zu leisten, soweit sie nicht Befriedigung verlangen können. Dieses Recht steht den Gläubigern jedoch nur zu, wenn sie glaubhaft machen, dass durch die Verschmelzung die Erfüllung der Forderung gefährdet wird."
    },
    {
      "date": "2024-11-11",
      "original_text": "Einreichung neuer Dokumente\nNordrhein-Westfalen Amtsgericht Düsseldorf HRB 94946\nDKV MOBILITY GROUP SE – Ratingen",
      "type": "Einreichung neuer Dokumente",
      "state": "Nordrhein-Westfalen",
      "amtsgericht": "Amtsgericht Düsseldorf",
      "registernummer": "HRB 94946",
      "registerart": "HRB",
      "company_name": "DKV MOBILITY GROUP SE",
      "company_seat": "Ratingen",
      "details": "11.11.2024 (Bekanntmachungsdatum)\n\nNordrhein-Westfalen Amtsgericht Düsseldorf HRB 94946\nEinreichung neuer Dokumente 11.11.2024 (Eintragungsdatum)\n\nDKV MOBILITY GROUP SE\nEuropäische Aktiengesellschaft (SE)\nRatingen\n\nDem Registergericht ist eine Liste der Mitglieder des Aufsichtsrates eingereicht worden."
    },
    {
      "date": "2024-11-11",
      "original_text": "Registerbekanntmachung nach dem Umwandlungsgesetz\nRheinland-Pfalz Amtsgericht Koblenz HRB 4831\nDeGeKom GmbH – Koblenz",
      "type": "Registerbekanntmachung nach dem Umwandlungsgesetz",
      "state": "Rheinland-Pfalz",
      "amtsgericht": "Amtsgericht Koblenz",
      "registernummer": "HRB 4831",
      "registerart": "HRB",
      "company_name": "DeGeKom GmbH",
      "company_seat": "Koblenz",
      "details": "11.11.2024 (Bekanntmachungsdatum)\n\nRheinland-Pfalz Amtsgericht Koblenz HRB 4831\nRegisterbekanntmachung nach dem Umwandlungsgesetz 11.11.2024 (Eintragungsdatum)\n\nDeGeKom GmbH\nGesellschaft mit beschränkter Haftung\nKoblenz\n\nAls nicht eingetragen wird veröffentlicht: Den Gläubigern der an der Verschmelzung beteiligten Rechtsträger ist, wenn sie binnen sechs Monaten nach dem Tag, an dem die Eintragung der Verschmelzung in das Register des Sitzes desjenigen Rechtsträgers,dessen Gläubiger sie sind, nach § 19 Abs. 3 UmwG als bekannt gemacht gilt, ihren Anspruch nach Grund und Höhe schriftlich anmelden, Sicherheit zu leisten, soweit sie nicht Befriedigung verlangen können. Dieses Recht steht den Gläubigern jedoch nur zu, wenn sie glaubhaft machen, dass durch die Verschmelzung die Erfüllungd er Forderung gefährdet wird."
    },
    {
      "date": "2024-11-11",
      "original_text": "Sonstige Registerbekanntmachung\nBaden-Württemberg Amtsgericht Stuttgart HRB 220205\nDeutsche Sporflex GmbH – Nürtingen",
      "type": "Sonstige Registerbekanntmachung",
      "state": "Baden-Württemberg",
      "amtsgericht": "Amtsgericht Stuttgart",
      "registernummer": "HRB 220205",
      "registerart": "HRB",
      "company_name": "Deutsche Sporflex GmbH",
      "company_seat": "Nürtingen",
      "details": "11.11.2024 (Bekanntmachungsdatum)\n\nBaden-Württemberg Amtsgericht Stuttgart HRB 220205\nSonstige Registerbekanntmachung 11.11.2024 (Eintragungsdatum)\n\nDeutsche Sporflex GmbH\nGesellschaft mit beschränkter Haftung\nNürtingen\n\nDen Gläubigern der Gesellschaft, deren Forderungen begründet worden sind, bevor die Eintragung der Beendigung des Vertrages in das Handelsregister nach § 10 HGB als bekanntgemacht gilt, ist vom anderen Vertragsteil Sicherheit zu leisten, wenn sie sich binnen sechs Monaten nach der Bekanntmachung zu diesem Zweck bei ihm melden."
    },
    {
      "date": "2024-11-11",
      "original_text": "Löschungsankündigung\nHessen Amtsgericht Frankfurt am Main HRB 104976\nDingler Wasser GmbH – Frankfurt am Main",
      "type": "Löschungsankündigung",
      "state": "Hessen",
      "amtsgericht": "Amtsgericht Frankfurt am Main",
      "registernummer": "HRB 104976",
      "registerart": "HRB",
      "company_name": "Dingler Wasser GmbH",
      "company_seat": "Frankfurt am Main",
      "details": "11.11.2024 (Bekanntmachungsdatum)\n\nHessen Amtsgericht Frankfurt am Main HRB 104976\nLöschungsankündigung\n\nDingler Wasser GmbH\nGesellschaft mit beschränkter Haftung\nFrankfurt am Main\n\nEs ist beabsichtigt, die Gesellschaft wegen Vermögenslosigkeit gemäß § 394 FamFG von Amts wegen im Handelsregister zu löschen. Hiergegen kann innerhalb eines Monats nach dieser Veröffentlichung Widerspruch bei dem Amtsgericht Frankfurt am Main eingelegt werden."
    },
    {
      "date": "2024-11-11",
      "original_text": "Registerbekanntmachung nach dem Umwandlungsgesetz\nRheinland-Pfalz Amtsgericht Mainz HRA 41565\nDr. med. Kasten GmbH & Co. KG – Mainz",
      "type": "Registerbekanntmachung nach dem Umwandlungsgesetz",
      "state": "Rheinland-Pfalz",
      "amtsgericht": "Amtsgericht Mainz",
      "registernummer": "HRA 41565",
      "registerart": "HRA",
      "company_name": "Dr. med. Kasten GmbH & Co. KG",
      "company_seat": "Mainz",
      "details": "11.11.2024 (Bekanntmachungsdatum)\n\nRheinland-Pfalz Amtsgericht Mainz HRA 41565\nRegisterbekanntmachung nach dem Umwandlungsgesetz 11.11.2024 (Eintragungsdatum)\n\nDr. med. Kasten GmbH & Co. KG\nKommanditgesellschaft\nMainz\n\nAls nicht eingetragen wird veröffentlicht:\nDen Gläubigern der an der Ausgliederung beteiligten Rechtsträger ist, wenn sie binnen sechs Monaten nach dem Tag, an dem die Eintragung der Ausgliederung in das Register des Sitzes desjenigen Rechtsträgers, dessen Gläubiger sie sind, nach § 19 Abs. 3 UmwG als bekannt gemacht gilt, ihren Anspruch nach Grund und Höhe schriftlich anmelden, Sicherheit zu leisten, soweit sie nicht Befriedigung verlangen können. Dieses Recht steht den Gläubigern jedoch nur zu, wenn sie glaubhaft machen, dass durch die Ausgliederung die Erfüllung der Forderung gefährdet wird."
    },
    {
      "date": "2024-11-11",
      "original_text": "Registerbekanntmachung nach dem Umwandlungsgesetz\nRheinland-Pfalz Amtsgericht Mainz HRA 44696\nDr. med. Robert Kasten Vermietung e.K. – Mainz",
      "type": "Registerbekanntmachung nach dem Umwandlungsgesetz",
      "state": "Rheinland-Pfalz",
      "amtsgericht": "Amtsgericht Mainz",
      "registernummer": "HRA 44696",
      "registerart": "HRA",
      "company_name": "Dr. med. Robert Kasten Vermietung e.K.",
      "company_seat": "Mainz",
      "details": "11.11.2024 (Bekanntmachungsdatum)\n\nRheinland-Pfalz Amtsgericht Mainz HRA 44696\nRegisterbekanntmachung nach dem Umwandlungsgesetz 11.11.2024 (Eintragungsdatum)\n\nDr. med. Robert Kasten Vermietung e.K.\nEinzelkaufmann / Einzelkauffrau\nMainz\n\nAls nicht eingetragen wird veröffentlicht:\nDen Gläubigern der an der Ausgliederung beteiligten Rechtsträger ist, wenn sie binnen sechs Monaten nach dem Tag, an dem die Eintragung der Ausgliederung in das Register des Sitzes desjenigen Rechtsträgers, dessen Gläubiger sie sind, nach § 19 Abs. 3 UmwG als bekannt gemacht gilt, ihren Anspruch nach Grund und Höhe schriftlich anmelden, Sicherheit zu leisten, soweit sie nicht Befriedigung verlangen können. Dieses Recht steht den Gläubigern jedoch nur zu, wenn sie glaubhaft machen, dass durch die Ausgliederung die Erfüllung der Forderung gefährdet wird."
    },
    {
      "date": "2024-11-11",
      "original_text": "Registerbekanntmachung nach dem Umwandlungsgesetz\nBaden-Württemberg Amtsgericht Ulm HRB 748856\nDürr & Feil Gebäudetechnik GmbH – Ellwangen Jagst",
      "type": "Registerbekanntmachung nach dem Umwandlungsgesetz",
      "state": "Baden-Württemberg",
      "amtsgericht": "Amtsgericht Ulm",
      "registernummer": "HRB 748856",
      "registerart": "HRB",
      "company_name": "Dürr & Feil Gebäudetechnik GmbH",
      "company_seat": "Ellwangen Jagst",
      "details": "11.11.2024 (Bekanntmachungsdatum)\n\nBaden-Württemberg Amtsgericht Ulm HRB 748856\nRegisterbekanntmachung nach dem Umwandlungsgesetz 11.11.2024 (Eintragungsdatum)\n\nDürr & Feil Gebäudetechnik GmbH\nGesellschaft mit beschränkter Haftung\nEllwangen Jagst\n\nAls nicht eingetragen wird bekanntgemacht:\nDen Gläubigern des an dem Formwechsel beteiligten Rechtsträgers ist, wenn sie binnen sechs Monaten nach dem Tag, an dem die Eintragung des Formwechsels in das Register des Sitzes desjenigen Rechtsträgers, dessen Gläubiger sie sind, nach § 19 Abs. 3 UmwG als bekanntgemacht gilt, ihren Anspruch nach Grund und Höhe schriftlich anmelden, Sicherheit zu leisten, soweit sie nicht Befriedigung verlangen können. Dieses Recht steht den Gläubigern jedoch nur zu, wenn sie glaubhaft machen, dass durch den Formwechsel die Erfüllung ihrer Forderung gefährdet wird."
    },
    {
      "date": "2024-11-11",
      "original_text": "Registerbekanntmachung nach dem Umwandlungsgesetz\nBaden-Württemberg Amtsgericht Ulm HRA 510419\nDürr & Feil GmbH & Co. KG Gebäude- und Energietechnik – Ellwangen Jagst",
      "type": "Registerbekanntmachung nach dem Umwandlungsgesetz",
      "state": "Baden-Württemberg",
      "amtsgericht": "Amtsgericht Ulm",
      "registernummer": "HRA 510419",
      "registerart": "HRA",
      "company_name": "Dürr & Feil GmbH & Co. KG Gebäude- und Energietechnik",
      "company_seat": "Ellwangen Jagst",
      "details": "11.11.2024 (Bekanntmachungsdatum)\n\nBaden-Württemberg Amtsgericht Ulm HRA 510419\nRegisterbekanntmachung nach dem Umwandlungsgesetz 11.11.2024 (Eintragungsdatum)\n\nDürr & Feil GmbH & Co. KG Gebäude- und Energietechnik\nKommanditgesellschaft\nEllwangen Jagst\n\nAls nicht eingetragen wird bekanntgemacht:\nDen Gläubigern des an dem Formwechsel beteiligten Rechtsträgers ist, wenn sie binnen sechs Monaten nach dem Tag, an dem die Eintragung des Formwechsels in das Register des Sitzes desjenigen Rechtsträgers, dessen Gläubiger sie sind, nach § 19 Abs. 3 UmwG als bekanntgemacht gilt, ihren Anspruch nach Grund und Höhe schriftlich anmelden, Sicherheit zu leisten, soweit sie nicht Befriedigung verlangen können. Dieses Recht steht den Gläubigern jedoch nur zu, wenn sie glaubhaft machen, dass durch den Formwechsel die Erfüllung ihrer Forderung gefährdet wird."
    },
    {
      "date": "2024-11-11",
      "original_text": "Löschungsankündigung\nNordrhein-Westfalen Amtsgericht Neuss HRB 15642\nENERGON-Systems GmbH – Meerbusch",
      "type": "Löschungsankündigung",
      "state": "Nordrhein-Westfalen",
      "amtsgericht": "Amtsgericht Neuss",
      "registernummer": "HRB 15642",
      "registerart": "HRB",
      "company_name": "ENERGON-Systems GmbH",
      "company_seat": "Meerbusch",
      "details": "11.11.2024 (Bekanntmachungsdatum)\n\nNordrhein-Westfalen Amtsgericht Neuss HRB 15642\nLöschungsankündigung 11.11.2024 (Eintragungsdatum)\n\nENERGON-Systems GmbH\nGesellschaft mit beschränkter Haftung\nMeerbusch\n\nEs ist beabsichtigt, die Gesellschaft wegen Vermögenslosigkeit aufgrund des § 394 Abs. 1 FamFG zu löschen. Frist zur Geltendmachung eines Widerspruchs: 1 Monat.\n\nRechtsbehelfsbelehrung:\nGegen diese Verfügung können Sie Widerspruch einlegen.\nDer Widerspruch ist bei dem Amtsgericht Neuss - Registergericht -, Breite Str. 48, 41460 Neuss schriftlich in deutscher Sprache oder zur Niederschrift der Geschäftsstelle einzulegen.\nDer Widerspruch kann auch zur Niederschrift der Geschäftsstelle eines jeden Amtsgerichtes abgegeben werden.\nDie Einlegung ist auch durch Übertragung eines elektronischen Dokuments an die elektronische Poststelle des Gerichts möglich. Das elektronische Dokument muss für die Bearbeitung durch das Gericht geeignet und mit einer qualifizierten elektronischen Signatur der verantwortenden Person versehen sein oder von der verantwortenden Person signiert und auf einem sicheren Übermittlungsweg gemäß § 130a ZPO nach näherer Maßgabe der Verordnung über die technischen Rahmenbedingungen des elektronischen Rechtsverkehrs und über das besondere elektronische Behördenpostfach (BGBl. I, S.3803) eingereicht werden. Weitere Informationen erhalten Sie auf der Internetseite www.justiz.de.\nDer Widerspruch muss spätestens innerhalb der gesetzten Frist nach der schriftlichen Bekanntgabe der Verfügung bei dem Amtsgericht - Registergericht - Neuss eingegangen sein. Dies gilt auch dann, wenn der Widerspruch zur Niederschrift der Geschäftsstelle eines anderen Amtsgerichtes abgegeben wurde. Die Frist beginnt mit der schriftlichen Bekanntgabe der Verfügung. Die Bekanntgabe ist entweder durch Zustellung oder am dritten Tage nach Aufgabe zur Post bewirkt. Fällt das Ende der Frist auf einen Sonntag, einen allgemeinen Feiertag oder Sonnabend, so endet die Frist mit Ablauf des nächsten Werktages.\n\nDer Widerspruch muss die Bezeichnung der angefochtenen Verfügung sowie die Erklärung enthalten, dass Widerspruch gegen diese Verfügung eingelegt wird. Er ist zu unterzeichnen und soll begründet werden."
    },
    {
      "date": "2024-11-11",
      "original_text": "Einreichung neuer Dokumente\nBaden-Württemberg Amtsgericht Mannheim HRB 364\nElektro-Siedlung Baugesellschaft mbH – Mannheim",
      "type": "Einreichung neuer Dokumente",
      "state": "Baden-Württemberg",
      "amtsgericht": "Amtsgericht Mannheim",
      "registernummer": "HRB 364",
      "registerart": "HRB",
      "company_name": "Elektro-Siedlung Baugesellschaft mbH",
      "company_seat": "Mannheim",
      "details": "11.11.2024 (Bekanntmachungsdatum)\n\nBaden-Württemberg Amtsgericht Mannheim HRB 364\nEinreichung neuer Dokumente\n\nElektro-Siedlung Baugesellschaft mbH\nGesellschaft mit beschränkter Haftung\nMannheim\n\nDie Gesellschaft hat am 07.11.2024 die Liste über die Zusammensetzung des Aufsichtsrats zum Handelsregister eingereicht."
    },
    {
      "date": "2024-11-11",
      "original_text": "Registerbekanntmachung nach dem Umwandlungsgesetz\nSchleswig-Holstein Amtsgericht Pinneberg HRB 1725 IZ\nEmil Stark GmbH – Schenefeld/Krs. Steinburg",
      "type": "Registerbekanntmachung nach dem Umwandlungsgesetz",
      "state": "Schleswig-Holstein",
      "amtsgericht": "Amtsgericht Pinneberg",
      "registernummer": "HRB 1725 IZ",
      "registerart": "HRB",
      "company_name": "Emil Stark GmbH",
      "company_seat": "Schenefeld/Krs. Steinburg",
      "details": "11.11.2024 (Bekanntmachungsdatum)\n\nSchleswig-Holstein Amtsgericht Pinneberg HRB 1725 IZ\nRegisterbekanntmachung nach dem Umwandlungsgesetz 07.11.2024 (Eintragungsdatum)\n\nEmil Stark GmbH\nGesellschaft mit beschränkter Haftung\nSchenefeld/Krs. Steinburg\n\nZu Eintragungsnummer 4 vom 07.11.2024 wird als nicht eingetragen veröffentlicht: Den Gläubigern der an der Verschmelzung beteiligten Rechtsträger ist, wenn sie binnen sechs Monaten nach dem Tag, an dem die Eintragung der Verschmelzung in das Register des Sitzes desjenigen Rechtsträgers, dessen Gläubiger sie sind, als bekannt gemacht gilt, ihren Anspruch nach Grund und Höhe schriftlich anmelden, Sicherheit zu leisten, soweit sie nicht Befriedigung verlangen können. Dieses Recht steht den Gläubigern jedoch nur zu, wenn sie glaubhaft machen, dass durch die Verschmelzung die Erfüllung ihrer Forderung gefährdet wird. Das Recht, Sicherheitsleistung zu verlangen, steht Gläubigern nicht zu, die im Falle der Insolvenz ein Recht auf vorzugsweise Befriedigung aus einer Deckungsmasse haben, die nach gesetzlicher Vorschrift zu ihrem Schutz errichtet und staatlich überwacht ist."
    },
    {
      "date": "2024-11-11",
      "original_text": "Sonstige Registerbekanntmachung\nMecklenburg-Vorpommern Amtsgericht Schwerin HRA 3123\nEnergieversorgung Schwerin GmbH & Co. Erzeugung KG – Schwerin",
      "type": "Sonstige Registerbekanntmachung",
      "state": "Mecklenburg-Vorpommern",
      "amtsgericht": "Amtsgericht Schwerin",
      "registernummer": "HRA 3123",
      "registerart": "HRA",
      "company_name": "Energieversorgung Schwerin GmbH & Co. Erzeugung KG",
      "company_seat": "Schwerin",
      "details": "11.11.2024 (Bekanntmachungsdatum)\n\nMecklenburg-Vorpommern Amtsgericht Schwerin HRA 3123\nSonstige Registerbekanntmachung 11.11.2024 (Eintragungsdatum)\n\nEnergieversorgung Schwerin GmbH & Co. Erzeugung KG\nKommanditgesellschaft\nSchwerin"
    },
    {
      "date": "2024-11-11",
      "original_text": "Einreichung neuer Dokumente\nHessen Amtsgericht Bad Homburg v.d.H. HRB 12290\nEquita GmbH & Co. CoVest KGaA – Bad Homburg v. d. Höhe",
      "type": "Einreichung neuer Dokumente",
      "state": "Hessen",
      "amtsgericht": "Amtsgericht Bad Homburg v.d.H.",
      "registernummer": "HRB 12290",
      "registerart": "HRB",
      "company_name": "Equita GmbH & Co. CoVest KGaA",
      "company_seat": "Bad Homburg v. d. Höhe",
      "details": "11.11.2024 (Bekanntmachungsdatum)\n\nHessen Amtsgericht Bad Homburg v.d.H. HRB 12290\nEinreichung neuer Dokumente\n\nEquita GmbH & Co. CoVest KGaA\nKommanditgesellschaft auf Aktien\nBad Homburg v. d. Höhe\n\nDurch eine Änderung in den Personen der Aufsichtsratsmitglieder ist eine Liste der Mitglieder des Aufsichtsrates zum Handelsregister eingereicht worden."
    },
    {
      "date": "2024-11-11",
      "original_text": "Löschungsankündigung\nNiedersachsen Amtsgericht Hildesheim HRB 207505\nEuromatik GmbH – Hildesheim",
      "type": "Löschungsankündigung",
      "state": "Niedersachsen",
      "amtsgericht": "Amtsgericht Hildesheim",
      "registernummer": "HRB 207505",
      "registerart": "HRB",
      "company_name": "Euromatik GmbH",
      "company_seat": "Hildesheim",
      "details": "11.11.2024 (Bekanntmachungsdatum)\n\nNiedersachsen Amtsgericht Hildesheim HRB 207505\nLöschungsankündigung\n\nEuromatik GmbH\nGesellschaft mit beschränkter Haftung\nHildesheim\n\nDas Registergericht beabsichtigt, die Gesellschaft von Amts wegen nach § 394 FamFG zu löschen. Die Frist zur Erhebung eines Widerspruchs ist auf 1 Monat ab dieser Registerbekanntmachung festgesetzt."
    },
    {
      "date": "2024-11-11",
      "original_text": "Registerbekanntmachung nach dem Umwandlungsgesetz\nThüringen Amtsgericht Jena HRA 506507\nFaupel Bad & Wärme e.K. – Unstrut-Hainich",
      "type": "Registerbekanntmachung nach dem Umwandlungsgesetz",
      "state": "Thüringen",
      "amtsgericht": "Amtsgericht Jena",
      "registernummer": "HRA 506507",
      "registerart": "HRA",
      "company_name": "Faupel Bad & Wärme e.K.",
      "company_seat": "Unstrut-Hainich",
      "details": "11.11.2024 (Bekanntmachungsdatum)\n\nThüringen Amtsgericht Jena HRA 506507\nRegisterbekanntmachung nach dem Umwandlungsgesetz 11.11.2024 (Eintragungsdatum)\n\nFaupel Bad & Wärme e.K.\nEinzelkaufmann / Einzelkauffrau\nUnstrut-Hainich\n\nNicht eingetragen: Den Gläubigern der an der Ausgliederung beteiligten Rechtsträger, ist wenn sie binnen sechs Monaten nach dem Tag, an dem die Eintragung der Ausgliederung in das Register des Sitzes desjenigen Rechtsträgers, dessen Gläubiger sie sind, nach §§125, 19 Abs. 3 UmwG als bekanntgemacht gilt, ihren Anspruch nach Grund und Höhe schriftlich anmelden, Sicherheit zu leisten, soweit sie nicht Befriedigung verlangen können. Dieses Recht steht ihnen jedoch nur zu, wenn sie glaubhaft machen, daß durch die Ausgliederung die Erfüllung ihrer Forderung gefährdet wird."
    },
    {
      "date": "2024-11-11",
      "original_text": "Registerbekanntmachung nach dem Umwandlungsgesetz\nThüringen Amtsgericht Jena HRB 521864\nFaupel GmbH – Unstrut-Hainich",
      "type": "Registerbekanntmachung nach dem Umwandlungsgesetz",
      "state": "Thüringen",
      "amtsgericht": "Amtsgericht Jena",
      "registernummer": "HRB 521864",
      "registerart": "HRB",
      "company_name": "Faupel GmbH",
      "company_seat": "Unstrut-Hainich",
      "details": "11.11.2024 (Bekanntmachungsdatum)\n\nThüringen Amtsgericht Jena HRB 521864\nRegisterbekanntmachung nach dem Umwandlungsgesetz 11.11.2024 (Eintragungsdatum)\n\nFaupel GmbH\nGesellschaft mit beschränkter Haftung\nUnstrut-Hainich\n\nNicht eingetragen: Den Gläubigern der an der Ausgliederung beteiligten Rechtsträger, ist wenn sie binnen sechs Monaten nach dem Tag, an dem die Eintragung der Ausgliederung in das Register des Sitzes desjenigen Rechtsträgers, dessen Gläubiger sie sind, nach §§125, 19 Abs. 3 UmwG als bekanntgemacht gilt, ihren Anspruch nach Grund und Höhe schriftlich anmelden, Sicherheit zu leisten, soweit sie nicht Befriedigung verlangen können. Dieses Recht steht ihnen jedoch nur zu, wenn sie glaubhaft machen, daß durch die Ausgliederung die Erfüllung ihrer Forderung gefährdet wird."
    },
    {
      "date": "2024-11-11",
      "original_text": "Sonstige Registerbekanntmachung\nBerlin Amtsgericht Berlin (Charlottenburg) HRB 95026\nFliesen Discount GmbH – Berlin",
      "type": "Sonstige Registerbekanntmachung",
      "state": "Berlin",
      "amtsgericht": "Amtsgericht Berlin (Charlottenburg)",
      "registernummer": "HRB 95026",
      "registerart": "HRB",
      "company_name": "Fliesen Discount GmbH",
      "company_seat": "Berlin",
      "details": "11.11.2024 (Bekanntmachungsdatum)\n\nBerlin Amtsgericht Berlin (Charlottenburg) HRB 95026\nSonstige Registerbekanntmachung\n\nFliesen Discount GmbH\nGesellschaft mit beschränkter Haftung\nBerlin\n\nZu Eintragungsnummer 32 vom 08.11.2024 wird als nicht eingetragen veröffentlicht: Der andere Vertragsteil hat den Gläubigern dieses Rechtsträgers, deren Forderungen begründet worden sind, bevor die Eintragung der Beendigung dieses Vertrages in das Handelsregister nach § 10 des Handelsgesetzbuches als bekannt gemacht gilt, Sicherheit zu leisten, wenn sie sich binnen sechs Monaten nach der Bekanntmachung der Eintragung zu diesem Zweck bei ihm melden. Dieses Recht steht den Gläubigern nicht zu, die im Fall des Insolvenzverfahrens ein Recht auf vorzugsweise Befriedigung aus der Deckungsmasse haben, die nach gesetzlicher Vorschrift zu ihrem Schutz errichtet und staatlich überwacht ist."
    },
    {
      "date": "2024-11-11",
      "original_text": "Registerbekanntmachung nach dem Umwandlungsgesetz\nHessen Amtsgericht Kassel VR 4405\nForum Vita e.V. – Kassel",
      "type": "Registerbekanntmachung nach dem Umwandlungsgesetz",
      "state": "Hessen",
      "amtsgericht": "Amtsgericht Kassel",
      "registernummer": "VR 4405",
      "registerart": "VR",
      "company_name": "Forum Vita e.V.",
      "company_seat": "Kassel",
      "details": "11.11.2024 (Bekanntmachungsdatum)\n\nHessen Amtsgericht Kassel VR 4405\nRegisterbekanntmachung nach dem Umwandlungsgesetz 11.11.2024 (Eintragungsdatum)\n\nForum Vita e.V.\neingetragener Verein\nKassel\n\nDen Gläubigern der an der formwechselnden Umwandlung beteiligten Rechtsträger ist, wenn sie binnen sechs Monaten nach dem Tag, an dem die Eintragung der formwechselnden Umwandlung in das Register des Sitzes desjenigen Rechtsträgers, dessen Gläubiger sie sind, nach § 201 UmwG bekannt gemacht worden ist, ihren Anspruch nach Grund und Höhe schriftlich anmelden, Sicherheit zu leisten, soweit sie nicht Befriedigung verlangen können. Dieses Recht steht den Gläubigern jedoch nur zu, wenn sie glaubhaft machen, dass durch die formwechselnden Umwandlung die Erfüllung ihrer Forderung gefährdet wird."
    },
    {
      "date": "2024-11-11",
      "original_text": "Registerbekanntmachung nach dem Umwandlungsgesetz\nHessen Amtsgericht Kassel HRB 19993\nForum Vita gGmbH – Kassel",
      "type": "Registerbekanntmachung nach dem Umwandlungsgesetz",
      "state": "Hessen",
      "amtsgericht": "Amtsgericht Kassel",
      "registernummer": "HRB 19993",
      "registerart": "HRB",
      "company_name": "Forum Vita gGmbH",
      "company_seat": "Kassel",
      "details": "11.11.2024 (Bekanntmachungsdatum)\n\nHessen Amtsgericht Kassel HRB 19993\nRegisterbekanntmachung nach dem Umwandlungsgesetz 11.11.2024 (Eintragungsdatum)\n\nForum Vita gGmbH\nGesellschaft mit beschränkter Haftung\nKassel\n\nDie Gesellschaft hat Gläubigern, deren Forderungen vor dieser Bekanntmachung begründet worden sind, Sicherheit zu leisten, soweit sie nicht Befriedigung verlangen können, wenn sie sich binnen sechs Monaten nach dieser Bekanntmachung zu diesem Zweck melden.\nDen Gläubigern der an der formwechselnden Umwandlung beteiligten Rechtsträger ist, wenn sie binnen sechs Monaten nach dem Tag, an dem die Eintragung der formwechselnden Umwandlung in das Register des Sitzes desjenigen Rechtsträgers, dessen Gläubiger sie sind, nach § 201 UmwG bekannt gemacht worden ist, ihren Anspruch nach Grund und Höhe schriftlich anmelden, Sicherheit zu leisten, soweit sie nicht Befriedigung verlangen können. Dieses Recht steht den Gläubigern jedoch nur zu, wenn sie glaubhaft machen, dass durch die formwechselnden Umwandlung die Erfüllung ihrer Forderung gefährdet wird."
    },
    {
      "date": "2024-11-11",
      "original_text": "Registerbekanntmachung nach dem Umwandlungsgesetz\nHessen Amtsgericht Frankfurt am Main HRB 39490\nGAP, Gesellschaft für Ausbildung in Psychotherapie mbH – Frankfurt am Main",
      "type": "Registerbekanntmachung nach dem Umwandlungsgesetz",
      "state": "Hessen",
      "amtsgericht": "Amtsgericht Frankfurt am Main",
      "registernummer": "HRB 39490",
      "registerart": "HRB",
      "company_name": "GAP, Gesellschaft für Ausbildung in Psychotherapie mbH",
      "company_seat": "Frankfurt am Main",
      "details": "11.11.2024 (Bekanntmachungsdatum)\n\nHessen Amtsgericht Frankfurt am Main HRB 39490\nRegisterbekanntmachung nach dem Umwandlungsgesetz 11.11.2024 (Eintragungsdatum)\n\nGAP, Gesellschaft für Ausbildung in Psychotherapie mbH\nGesellschaft mit beschränkter Haftung\nFrankfurt am Main\n\nDen Gläubigern der an der Verschmelzung beteiligten Rechtsträger ist, wenn sie binnen sechs Monaten nach dem Tag, an dem die Eintragung der Verschmelzung in das Register des Sitzes desjenigen Rechtsträgers, dessen Gläubiger sie sind, nach § 19 Absatz 3 UmwG bekannt gemacht worden ist, ihren Anspruch nach Grund und Höhe schriftlich anmelden, Sicherheit zu leisten, soweit sie nicht Befriedigung verlangen können. Dieses Recht steht den Gläubigern jedoch nur zu, wenn sie glaubhaft machen, dass durch die Verschmelzung die Erfüllung ihrer Forderung gefährdet wird."
    },
    {
      "date": "2024-11-11",
      "original_text": "Einreichung neuer Dokumente\nThüringen Amtsgericht Jena HRB 403188\nGFG Gesellschaft zur Förderung des Gesundheits- und Sozialwesens in der Wartburgregion GmbH – Eisenach",
      "type": "Einreichung neuer Dokumente",
      "state": "Thüringen",
      "amtsgericht": "Amtsgericht Jena",
      "registernummer": "HRB 403188",
      "registerart": "HRB",
      "company_name": "GFG Gesellschaft zur Förderung des Gesundheits- und Sozialwesens in der Wartburgregion GmbH",
      "company_seat": "Eisenach",
      "details": "11.11.2024 (Bekanntmachungsdatum)\n\nThüringen Amtsgericht Jena HRB 403188\nEinreichung neuer Dokumente\n\nGFG Gesellschaft zur Förderung des Gesundheits- und Sozialwesens in der Wartburgregion GmbH\nGesellschaft mit beschränkter Haftung\nEisenach\n\nBekanntmachung gem. § 52 Abs. 3 Satz 2 GmbHG: Aufgrund einer Veränderung in den Personen der Aufsichtsratsmitglieder ist durch die Geschäftsführer eine neue Liste zum Handelsregister eingereicht worden."
    },
    {
      "date": "2024-11-11",
      "original_text": "Löschungsankündigung\nHessen Amtsgericht Wiesbaden HRB 33000\nGIGA-LOGISTIK GMBH – Wiesbaden",
      "type": "Löschungsankündigung",
      "state": "Hessen",
      "amtsgericht": "Amtsgericht Wiesbaden",
      "registernummer": "HRB 33000",
      "registerart": "HRB",
      "company_name": "GIGA-LOGISTIK GMBH",
      "company_seat": "Wiesbaden",
      "details": "11.11.2024 (Bekanntmachungsdatum)\n\nHessen Amtsgericht Wiesbaden HRB 33000\nLöschungsankündigung\n\nGIGA-LOGISTIK GMBH\nGesellschaft mit beschränkter Haftung\nWiesbaden\n\nDas Registergericht beabsichtigt die im Handelsregister eingetragene Gesellschaft von Amts wegen nach § 394 FamFG zu löschen. Die Frist zur Erhebung eines Widerspruchs gegen die beabsichtigte Löschung wird auf 3 Monate festgesetzt."
    },
    {
      "date": "2024-11-11",
      "original_text": "Einreichung neuer Dokumente\nNordrhein-Westfalen Amtsgericht Siegen HRB 6720\nGemeinnützige Gesellschaft der Franziskanerinnen zu Olpe mbH – Olpe",
      "type": "Einreichung neuer Dokumente",
      "state": "Nordrhein-Westfalen",
      "amtsgericht": "Amtsgericht Siegen",
      "registernummer": "HRB 6720",
      "registerart": "HRB",
      "company_name": "Gemeinnützige Gesellschaft der Franziskanerinnen zu Olpe mbH",
      "company_seat": "Olpe",
      "details": "11.11.2024 (Bekanntmachungsdatum)\n\nNordrhein-Westfalen Amtsgericht Siegen HRB 6720\nEinreichung neuer Dokumente\n\nGemeinnützige Gesellschaft der Franziskanerinnen zu Olpe mbH\nGesellschaft mit beschränkter Haftung\nOlpe\n\nDem Registergericht ist eine neue Liste der Mitglieder des Aufsichtsrates eingereicht worden."
    },
    {
      "date": "2024-11-11",
      "original_text": "Löschungsankündigung\nNordrhein-Westfalen Amtsgericht Duisburg HRB 34746\nGmc Elite GmbH – Oberhausen",
      "type": "Löschungsankündigung",
      "state": "Nordrhein-Westfalen",
      "amtsgericht": "Amtsgericht Duisburg",
      "registernummer": "HRB 34746",
      "registerart": "HRB",
      "company_name": "Gmc Elite GmbH",
      "company_seat": "Oberhausen",
      "details": "11.11.2024 (Bekanntmachungsdatum)\n\nNordrhein-Westfalen Amtsgericht Duisburg HRB 34746\nLöschungsankündigung\n\nGmc Elite GmbH\nGesellschaft mit beschränkter Haftung\nOberhausen\n\nHR B 34746\nGmc Elite GmbH,\nDuisburg,\nNeubreisacher Straße 17 b,\n47137 Duisburg.\nDas Registergericht beabsichtigt, die im Handelsregister eingetragene Gesellschaft gemäß § 394 Absatz 1 FamFG wegen Vermögenslosigkeit von Amts wegen zu löschen. Gegen diese Verfügung kann Widerspruch eingelegt werden. Die Frist zur Erhebung eines Widerspruchs gegen die beabsichtigte Löschung von Amts wegen ist auf drei Monate festgesetzt. Rechtsbehelfsbelehrung Der Widerspruch ist bei dem Amtsgericht Duisburg, Kardinal-Galen-Str. 124-132, 47058 Duisburg schriftlich in deutscher Sprache oder zur Niederschrift der Geschäftsstelle einzulegen. Der Widerspruch kann auch zur Niederschrift der Geschäftsstelle eines jeden Amtsgerichtes abgegeben werden. Die Einlegung ist auch durch Übertragung eines elektronischen Dokuments an die elektronische Poststelle des Gerichts möglich. Das elektronische Dokument muss für die Bearbeitung durch das Gericht geeignet und mit einer qualifizierten elektronischen Signatur der verantwortenden Person versehen sein oder von der verantwortenden Person signiert und auf einem sicheren Übermittlungsweg gemäß § 130 a ZPO nach näherer Maßgabe der Verordnung über die technischen Rahmenbedingungen des elektronischen Rechtsverkehrs und über das besondere elektronische Behördenpostfach (BGBl. I, S. 3803) eingereicht werden. Weitere Informationen erhalten Sie auf der Internetseite www.justiz.de <http://www.justiz.de>. Der Widerspruch muss spätestens innerhalb der gesetzten Frist bei dem Amtsgericht Duisburg eingegangen sein. Dies gilt auch dann, wenn der Widerspruch zur Niederschrift der Geschäftsstelle eines anderen Amtsgerichtes abgegeben wurde. Die Frist beginnt mit der Veröffentlichung. Fällt das Ende der Frist auf einen Sonntag, einen allgemeinen Feiertag oder Sonnabend, so endet die Frist mit Ablauf des nächsten Werktages. Der Widerspruch muss die Bezeichnung der angefochtenen Verfügung sowie die Erklärung enthalten, dass Widerspruch gegen diese Verfügung eingelegt wird. Er ist zu unterzeichnen und soll begründet werden."
    },
    {
      "date": "2024-11-11",
      "original_text": "Löschungsankündigung\nNiedersachsen Amtsgericht Walsrode HRB 209079\nHBI Verwaltungs GmbH – Scheeßel-Hetzwege",
      "type": "Löschungsankündigung",
      "state": "Niedersachsen",
      "amtsgericht": "Amtsgericht Walsrode",
      "registernummer": "HRB 209079",
      "registerart": "HRB",
      "company_name": "HBI Verwaltungs GmbH",
      "company_seat": "Scheeßel-Hetzwege",
      "details": "11.11.2024 (Bekanntmachungsdatum)\n\nNiedersachsen Amtsgericht Walsrode HRB 209079\nLöschungsankündigung 15.11.2022 (Eintragungsdatum)\n\nHBI Verwaltungs GmbH\nGesellschaft mit beschränkter Haftung\nScheeßel-Hetzwege\n\nDas Registergericht beabsichtigt, die Eintragung der Geschäftsführerin Nicola Thaler von Amts wegen nach § 395 FamFG zu löschen. Die Frist zur Erhebung eines Widerspruchs ist auf 2 Wochen ab dieser Registerbekanntmachung festgesetzt."
    },
    {
      "date": "2024-11-11",
      "original_text": "Löschungsankündigung\nNiedersachsen Amtsgericht Walsrode HRB 209079\nHBI Verwaltungs GmbH – Scheeßel-Hetzwege",
      "type": "Löschungsankündigung",
      "state": "Niedersachsen",
      "amtsgericht": "Amtsgericht Walsrode",
      "registernummer": "HRB 209079",
      "registerart": "HRB",
      "company_name": "HBI Verwaltungs GmbH",
      "company_seat": "Scheeßel-Hetzwege",
      "details": "11.11.2024 (Bekanntmachungsdatum)\n\nNiedersachsen Amtsgericht Walsrode HRB 209079\nLöschungsankündigung\n\nHBI Verwaltungs GmbH\nGesellschaft mit beschränkter Haftung\nScheeßel-Hetzwege\n\nDas Registergericht beabsichtigt, die Gesellschaft von Amts wegen nach § 394 FamFG zu löschen. Die Frist zur Erhebung eines Widerspruchs ist auf 1 Monat ab dieser Registerbekanntmachung festgesetzt."
    },
    {
      "date": "2024-11-11",
      "original_text": "Registerbekanntmachung nach dem Umwandlungsgesetz\nBerlin Amtsgericht Berlin (Charlottenburg) HRB 269285\nHOWOGE High Deck Siedlung GmbH – Berlin",
      "type": "Registerbekanntmachung nach dem Umwandlungsgesetz",
      "state": "Berlin",
      "amtsgericht": "Amtsgericht Berlin (Charlottenburg)",
      "registernummer": "HRB 269285",
      "registerart": "HRB",
      "company_name": "HOWOGE High Deck Siedlung GmbH",
      "company_seat": "Berlin",
      "details": "11.11.2024 (Bekanntmachungsdatum)\n\nBerlin Amtsgericht Berlin (Charlottenburg) HRB 269285\nRegisterbekanntmachung nach dem Umwandlungsgesetz 08.11.2024 (Eintragungsdatum)\n\nHOWOGE High Deck Siedlung GmbH\nGesellschaft mit beschränkter Haftung\nBerlin\n\nZu Eintragungsnummer 1 vom 08.11.2024 wird als nicht eingetragen veröffentlicht:Den Gläubigern ist, wenn sie binnen sechs Monaten nach dem Tag, an dem die Eintragung der Umwandlung als bekannt gemacht gilt, ihren Anspruch nach Grund und Höhe schriftlich anmelden, Sicherheit zu leisten, soweit sie nicht Befriedigung verlangen können. Dieses Recht steht den Gläubigern jedoch nur zu, wenn sie glaubhaft machen, dass durch die Umwandlung die Erfüllung ihrer Forderung gefährdet wird. Das Recht, Sicherheitsleistung zu verlangen, steht Gläubigern nicht zu, die im Falle der Insolvenz ein Recht auf vorzugsweise Befriedigung aus einer Deckungsmasse haben, die nach gesetzlicher Vorschrift zu ihrem Schutz errichtet und staatlich überwacht ist."
    },
    {
      "date": "2024-11-11",
      "original_text": "Einreichung neuer Dokumente\nNiedersachsen Amtsgericht Aurich HRB 111121 früher Amtsgericht Leer (Ostfriesland) (Leer)\nHartmann AG – Leer",
      "type": "Einreichung neuer Dokumente",
      "state": "Niedersachsen",
      "amtsgericht": "Amtsgericht Aurich",
      "registernummer": "HRB 111121",
      "registerart": "HRB",
      "company_name": "Hartmann AG",
      "company_seat": "Leer",
      "former_amtsgericht": "Leer (Ostfriesland) (Leer)",
      "details": "11.11.2024 (Bekanntmachungsdatum)\n\nNiedersachsen Amtsgericht Aurich HRB 111121 früher Amtsgericht Leer (Ostfriesland) (Leer)\nEinreichung neuer Dokumente\n\nHartmann AG\nAktiengesellschaft\nLeer\n\nDie Liste der Mitglieder des Aufsichtsrats wurde beim Registergericht eingereicht."
    },
    {
      "date": "2024-11-11",
      "original_text": "Registerbekanntmachung nach dem Umwandlungsgesetz\nNordrhein-Westfalen Amtsgericht Bonn HRA 72\nJ. Karl Vollmar GmbH & Co. KG – Bonn",
      "type": "Registerbekanntmachung nach dem Umwandlungsgesetz",
      "state": "Nordrhein-Westfalen",
      "amtsgericht": "Amtsgericht Bonn",
      "registernummer": "HRA 72",
      "registerart": "HRA",
      "company_name": "J. Karl Vollmar GmbH & Co. KG",
      "company_seat": "Bonn",
      "details": "11.11.2024 (Bekanntmachungsdatum)\n\nNordrhein-Westfalen Amtsgericht Bonn HRA 72\nRegisterbekanntmachung nach dem Umwandlungsgesetz 11.11.2024 (Eintragungsdatum)\n\nJ. Karl Vollmar GmbH & Co. KG\nKommanditgesellschaft\nBonn\n\nDen Gläubigern der an der Verschmelzung beteiligten Rechtsträger ist, wenn sie binnen sechs Monaten nach dem Tag, an dem die Eintragung der Verschmelzung in das Register des Sitzes desjenigen Rechtsträgers, dessen Gläubiger sie sind, nach § 19 Absatz 3 UmwG als bekanntgemacht gilt, ihren Anspruch nach Grund und Höhe schriftlich anmelden, Sicherheit zu leisten, soweit sie nicht Befriedigung verlangen können. Dieses Recht steht den Gläubigern jedoch nur zu, wenn sie glaubhaft machen, dass durch die Verschmelzung die Erfüllung ihrer Forderung gefährdet wird."
    },
    {
      "date": "2024-11-11",
      "original_text": "Registerbekanntmachung nach dem Umwandlungsgesetz\nSachsen Amtsgericht Dresden VR 7186\nJagdverband Hoyerswerda e.V. – Hoyerswerda",
      "type": "Registerbekanntmachung nach dem Umwandlungsgesetz",
      "state": "Sachsen",
      "amtsgericht": "Amtsgericht Dresden",
      "registernummer": "VR 7186",
      "registerart": "VR",
      "company_name": "Jagdverband Hoyerswerda e.V.",
      "company_seat": "Hoyerswerda",
      "details": "11.11.2024 (Bekanntmachungsdatum)\n\nSachsen Amtsgericht Dresden VR 7186\nRegisterbekanntmachung nach dem Umwandlungsgesetz 11.11.2024 (Eintragungsdatum)\n\nJagdverband Hoyerswerda e.V.\neingetragener Verein\nHoyerswerda\n\nDen Gläubigern der an der Verschmelzung beteiligten Rechtsträger ist, wenn sie binnen sechs Monaten nach dem Tag, an dem die Eintragung der Verschmelzung in das Register des Sitzes desjenigen Rechtsträgers, dessen Gläubiger sie sind, nach § 19 Abs. 3 UmwG als bekannt gemacht gilt, ihren Anspruch nach Grund und Höhe schriftlich anmelden, Sicherheit zu leisten, soweit sie nicht Befriedigung verlangen können. Dieses Recht steht den Gläubigern jedoch nur zu, wenn sie glaubhaft machen, dass durch die Verschmelzung die Erfüllung der Forderung gefährdet wird."
    },
    {
      "date": "2024-11-11",
      "original_text": "Einreichung neuer Dokumente\nBaden-Württemberg Amtsgericht Mannheim HRB 336562\nJanitos Versicherung Aktiengesellschaft – Heidelberg",
      "type": "Einreichung neuer Dokumente",
      "state": "Baden-Württemberg",
      "amtsgericht": "Amtsgericht Mannheim",
      "registernummer": "HRB 336562",
      "registerart": "HRB",
      "company_name": "Janitos Versicherung Aktiengesellschaft",
      "company_seat": "Heidelberg",
      "details": "11.11.2024 (Bekanntmachungsdatum)\n\nBaden-Württemberg Amtsgericht Mannheim HRB 336562\nEinreichung neuer Dokumente\n\nJanitos Versicherung Aktiengesellschaft\nAktiengesellschaft\nHeidelberg\n\nDie Gesellschaft hat am 08.11.2024 die Liste über die Zusammensetzung des Aufsichtsrats zum Handelsregister eingereicht."
    },
    {
      "date": "2024-11-11",
      "original_text": "Löschungsankündigung\nNordrhein-Westfalen Amtsgericht Aachen HRB 23859\nK-Betonexpert GmbH – Aachen",
      "type": "Löschungsankündigung",
      "state": "Nordrhein-Westfalen",
      "amtsgericht": "Amtsgericht Aachen",
      "registernummer": "HRB 23859",
      "registerart": "HRB",
      "company_name": "K-Betonexpert GmbH",
      "company_seat": "Aachen",
      "details": "11.11.2024 (Bekanntmachungsdatum)\n\nNordrhein-Westfalen Amtsgericht Aachen HRB 23859\nLöschungsankündigung\n\nK-Betonexpert GmbH\nGesellschaft mit beschränkter Haftung\nAachen\n\nDas Registergericht beabsichtigt, von Amts wegen die Gesellschaft wegen Vermögenslosigkeit nach § 394 FamFG zu löschen, weil das Finanzamt Aachen-Stadt mit Schreiben vom 15.07.2024 Umstände mitgeteilt hat, aufgrund derer das Gericht davon überzeugt ist, dass die Gesellschaft vollständig vermögenslos ist.\n\nZur Geltendmachung des Widerspruchs gegen die beabsichtigte Löschung wird hiermit eine Frist von einem Monat ab Veröffentlichung dieser Ankündigung bestimmt.\n\nRechtsbehelfsbelehrung:\n\nGegen diese Verfügung kann Widerspruch eingelegt werden. Zum Widerspruch ist jeder berechtigt, der an der Unterlassung der Löschung ein berechtigtes Interesse hat.\n\nDer Widerspruch ist bei dem Amtsgericht Aachen, Adalbertsteinweg 92, 52070 Aachen schriftlich in deutscher Sprache oder zur Niederschrift der Geschäftsstelle einzulegen. Der Widerspruch kann auch zur Niederschrift der Geschäftsstelle eines jeden Amtsgerichtes abgegeben werden.\n\nDer Widerspruch muss spätestens innerhalb der gesetzten Frist nach der Bekanntgabe der Verfügung bei dem Amtsgericht Aachen eingegangen sein. Dies gilt auch dann, wenn der Widerspruch zur Niederschrift der Geschäftsstelle eines anderen Amtsgerichtes abgegeben wurde. Die Frist beginnt mit der Bekanntgabe der Verfügung durch Veröffentlichung. Fällt das Ende der Frist auf einen Sonntag, einen allgemeinen Feiertag oder Sonnabend, so endet die Frist mit Ablauf des nächsten Werktages.\n\nDer Widerspruch muss die Bezeichnung der angefochtenen Verfügung sowie die Erklärung enthalten, dass Widerspruch gegen diese Verfügung eingelegt wird. Er ist zu unterzeichnen und soll begründet werden.\n\nDie Einlegung ist auch durch Übertragung eines elektronischen Dokuments an die elektronische Poststelle des Gerichts möglich. Das elektronische Dokument muss für die Bearbeitung durch das Gericht geeignet und mit einer qualifizierten elektronischen Signatur der verantwortenden Person versehen sein oder von der verantwortenden Person signiert und auf einem sicheren Übermittlungsweg gemäß § 130 a ZPO nach näherer Maßgabe der Verordnung über die technischen Rahmenbedingungen des elektronischen Rechtsverkehrs und über das besondere elektronische Behördenpostfach (BGBl. I, S. 3803) eingereicht werden. Weitere Informationen erhalten Sie auf der Internetseite www.justiz.de."
    },
    {
      "date": "2024-11-11",
      "original_text": "Löschungsankündigung\nBerlin Amtsgericht Berlin (Charlottenburg) HRB 152711\nKALINA Verwaltungs Aktiengesellschaft – Berlin",
      "type": "Löschungsankündigung",
      "state": "Berlin",
      "amtsgericht": "Amtsgericht Berlin (Charlottenburg)",
      "registernummer": "HRB 152711",
      "registerart": "HRB",
      "company_name": "KALINA Verwaltungs Aktiengesellschaft",
      "company_seat": "Berlin",
      "details": "11.11.2024 (Bekanntmachungsdatum)\n\nBerlin Amtsgericht Berlin (Charlottenburg) HRB 152711\nLöschungsankündigung\n\nKALINA Verwaltungs Aktiengesellschaft\nAktiengesellschaft\nBerlin\n\nBei der nachstehenden Gesellschaft wird das Amtslöschungsverfahren gemäß § 394 FamFG eingeleitet. Widerspruchsfrist 6 Wochen"
    },
    {
      "date": "2024-11-11",
      "original_text": "Löschungsankündigung\nMecklenburg-Vorpommern Amtsgericht Rostock HRA 3449\nKNE Windpark Nr. 28 GmbH & Co. KG – Rerik",
      "type": "Löschungsankündigung",
      "state": "Mecklenburg-Vorpommern",
      "amtsgericht": "Amtsgericht Rostock",
      "registernummer": "HRA 3449",
      "registerart": "HRA",
      "company_name": "KNE Windpark Nr. 28 GmbH & Co. KG",
      "company_seat": "Rerik",
      "details": "11.11.2024 (Bekanntmachungsdatum)\n\nMecklenburg-Vorpommern Amtsgericht Rostock HRA 3449\nLöschungsankündigung\n\nKNE Windpark Nr. 28 GmbH & Co. KG\nKommanditgesellschaft\nRerik\n\nDas Registergericht beabsichtigt, die im Handelsregister eingetragene Gesellschaft von Amts wegen nach § 394 FamFG zu löschen. Die Frist zur Erhebung eines Widerspruchs gegen die beabsichtigte Löschung wird auf einen Monat festgesetzt."
    },
    {
      "date": "2024-11-11",
      "original_text": "Registerbekanntmachung nach dem Umwandlungsgesetz\nNordrhein-Westfalen Amtsgericht Iserlohn HRB 10781\nKOSTAL Beteiligungen AG – Lüdenscheid",
      "type": "Registerbekanntmachung nach dem Umwandlungsgesetz",
      "state": "Nordrhein-Westfalen",
      "amtsgericht": "Amtsgericht Iserlohn",
      "registernummer": "HRB 10781",
      "registerart": "HRB",
      "company_name": "KOSTAL Beteiligungen AG",
      "company_seat": "Lüdenscheid",
      "details": "11.11.2024 (Bekanntmachungsdatum)\n\nNordrhein-Westfalen Amtsgericht Iserlohn HRB 10781\nRegisterbekanntmachung nach dem Umwandlungsgesetz 07.11.2024 (Eintragungsdatum)\n\nKOSTAL Beteiligungen AG\nAktiengesellschaft\nLüdenscheid\n\nDen Gläubigern der an der formwechselnden Umwandlung beteiligten Rechtsträger ist, wenn sie binnen sechs Monaten nach dem Tag, an dem die Eintragung der formwechselnden Umwandlung in das Register des Sitzes desjenigen Rechtsträgers, dessen Gläubiger sie sind, nach § 19 Absatz 3 UmwG als bekanntgemacht gilt, ihren Anspruch nach Grund und Höhe schriftlich anmelden, Sicherheit zu leisten, soweit sie nicht Befriedigung verlangen können. Dieses Recht steht den Gläubigern jedoch nur zu, wenn sie glaubhaft machen, dass durch die formwechselnden Umwandlung die Erfüllung ihrer Forderung gefährdet wird."
    },
    {
      "date": "2024-11-11",
      "original_text": "Registerbekanntmachung nach dem Umwandlungsgesetz\nNordrhein-Westfalen Amtsgericht Iserlohn HRB 11125\nKOSTAL Industriegrundbesitz Drei GmbH – Lüdenscheid",
      "type": "Registerbekanntmachung nach dem Umwandlungsgesetz",
      "state": "Nordrhein-Westfalen",
      "amtsgericht": "Amtsgericht Iserlohn",
      "registernummer": "HRB 11125",
      "registerart": "HRB",
      "company_name": "KOSTAL Industriegrundbesitz Drei GmbH",
      "company_seat": "Lüdenscheid",
      "details": "11.11.2024 (Bekanntmachungsdatum)\n\nNordrhein-Westfalen Amtsgericht Iserlohn HRB 11125\nRegisterbekanntmachung nach dem Umwandlungsgesetz 08.11.2024 (Eintragungsdatum)\n\nKOSTAL Industriegrundbesitz Drei GmbH\nGesellschaft mit beschränkter Haftung\nLüdenscheid\n\nDen Gläubigern der an der Ausgliederung beteiligten Rechtsträger ist, wenn sie binnen sechs Monaten nach dem Tag, an dem die Eintragung der Ausgliederung in das Register des Sitzes desjenigen Rechtsträgers, dessen Gläubiger sie sind, nach § 19 Absatz 3 UmwG als bekanntgemacht gilt, ihren Anspruch nach Grund und Höhe schriftlich anmelden, Sicherheit zu leisten, soweit sie nicht Befriedigung verlangen können. Dieses Recht steht den Gläubigern jedoch nur zu, wenn sie glaubhaft machen, dass durch die Ausgliederung die Erfüllung ihrer Forderung gefährdet wird."
    },
    {
      "date": "2024-11-11",
      "original_text": "Registerbekanntmachung nach dem Umwandlungsgesetz\nRheinland-Pfalz Amtsgericht Wittlich HRA 42043\nKlaus Baasch e. K. – Hermeskeil",
      "type": "Registerbekanntmachung nach dem Umwandlungsgesetz",
      "state": "Rheinland-Pfalz",
      "amtsgericht": "Amtsgericht Wittlich",
      "registernummer": "HRA 42043",
      "registerart": "HRA",
      "company_name": "Klaus Baasch e. K.",
      "company_seat": "Hermeskeil",
      "details": "11.11.2024 (Bekanntmachungsdatum)\n\nRheinland-Pfalz Amtsgericht Wittlich HRA 42043\nRegisterbekanntmachung nach dem Umwandlungsgesetz 11.11.2024 (Eintragungsdatum)\n\nKlaus Baasch e. K.\nEinzelkaufmann / Einzelkauffrau\nHermeskeil\n\nAls nicht eingetragen wird veröffentlicht: Den Gläubigern der an der Ausgliederung beteiligten Rechtsträger ist, wenn sie binnen sechs Monaten nac hdem Tag, an dem die Eintragung der Ausgliederung in das Register des Sitzes desjenigen Rechtsträgers,dessen Gläubiger sie sind, nach § 19 Abs. 3 UmwG als bekannt gemacht gilt, ihren Anspruch nach Grund und Höhe schriftlich anmelden, Sicherheit zu leisten, soweit sie nicht Befriedigung verlangen können. Dieses Recht steht den Gläubigern jedoch nur zu, wenn sie glaubhaft machen, dass durch die Ausgliederung die Erfüllung der Forderung gefährdet wird."
    },
    {
      "date": "2024-11-11",
      "original_text": "Sonstige Registerbekanntmachung\nSachsen Amtsgericht Leipzig HRB 3775\nKommunale Wasserwerke Leipzig GmbH – Leipzig",
      "type": "Sonstige Registerbekanntmachung",
      "state": "Sachsen",
      "amtsgericht": "Amtsgericht Leipzig",
      "registernummer": "HRB 3775",
      "registerart": "HRB",
      "company_name": "Kommunale Wasserwerke Leipzig GmbH",
      "company_seat": "Leipzig",
      "details": "11.11.2024 (Bekanntmachungsdatum)\n\nSachsen Amtsgericht Leipzig HRB 3775\nSonstige Registerbekanntmachung\n\nKommunale Wasserwerke Leipzig GmbH\nGesellschaft mit beschränkter Haftung\nLeipzig\n\nAm 08.11.2024 wurde beim Handelsregister des Amtsgerichts Leipzig die Liste der Mitglieder des Aufsichtsrats gemäß § 52 GmbHG eingereicht."
    },
    {
      "date": "2024-11-11",
      "original_text": "Registerbekanntmachung nach dem Umwandlungsgesetz\nHessen Amtsgericht Königstein HRB 12036\nKonrad-Adenauer-Ufer GmbH – Kelkheim (Taunus)",
      "type": "Registerbekanntmachung nach dem Umwandlungsgesetz",
      "state": "Hessen",
      "amtsgericht": "Amtsgericht Königstein",
      "registernummer": "HRB 12036",
      "registerart": "HRB",
      "company_name": "Konrad-Adenauer-Ufer GmbH",
      "company_seat": "Kelkheim (Taunus)",
      "details": "11.11.2024 (Bekanntmachungsdatum)\n\nHessen Amtsgericht Königstein HRB 12036\nRegisterbekanntmachung nach dem Umwandlungsgesetz 11.11.2024 (Eintragungsdatum)\n\nKonrad-Adenauer-Ufer GmbH\nGesellschaft mit beschränkter Haftung\nKelkheim (Taunus)\n\nEs wird darauf hingewiesen, dass ein Formwechselplan oder sein Entwurf über einen grenzüberschreitenden Formwechsel in die Konrad-Adenauer-Ufer GmbH mit Sitz in Kelkheim (Taunus) beim Handelsregister eingereicht worden ist.\n\nDie Anteilsinhaber, die Gläubiger sowie die zuständigen Betriebsräte der an dem grenzüberschreitenden Formwechsel beteiligten Gesellschaft oder, soweit es keinen Betriebsrat gibt, die Arbeitnehmer der an dem grenzüberschreitenden Formwechsel beteiligten Gesellschaft, können der Gesellschaft spätestens fünf Arbeitstage vor dem Tag der Gesellschafterversammlung Bemerkungen zum Formwechselplan übermitteln."
    },
    {
      "date": "2024-11-11",
      "original_text": "Registerbekanntmachung nach dem Umwandlungsgesetz\nSachsen Amtsgericht Dresden VR 30303\nKreisjagdverband Bautzen e.V. – Bautzen",
      "type": "Registerbekanntmachung nach dem Umwandlungsgesetz",
      "state": "Sachsen",
      "amtsgericht": "Amtsgericht Dresden",
      "registernummer": "VR 30303",
      "registerart": "VR",
      "company_name": "Kreisjagdverband Bautzen e.V.",
      "company_seat": "Bautzen",
      "details": "11.11.2024 (Bekanntmachungsdatum)\n\nSachsen Amtsgericht Dresden VR 30303\nRegisterbekanntmachung nach dem Umwandlungsgesetz 11.11.2024 (Eintragungsdatum)\n\nKreisjagdverband Bautzen e.V.\neingetragener Verein\nBautzen\n\nDen Gläubigern der an der Verschmelzung beteiligten Rechtsträger ist, wenn sie binnen sechs Monaten nach dem Tag, an dem die Eintragung der Verschmelzung in das Register des Sitzes desjenigen Rechtsträgers, dessen Gläubiger sie sind, nach § 19 Abs. 3 UmwG als bekannt gemacht gilt, ihren Anspruch nach Grund und Höhe schriftlich anmelden, Sicherheit zu leisten, soweit sie nicht Befriedigung verlangen können. Dieses Recht steht den Gläubigern jedoch nur zu, wenn sie glaubhaft machen, dass durch die Verschmelzung die Erfüllung der Forderung gefährdet wird."
    },
    {
      "date": "2024-11-11",
      "original_text": "Löschungsankündigung\nRheinland-Pfalz Amtsgericht Koblenz HRA 21263\nKunst Hoch Tief GmbH & Co. KG – Kaisersesch",
      "type": "Löschungsankündigung",
      "state": "Rheinland-Pfalz",
      "amtsgericht": "Amtsgericht Koblenz",
      "registernummer": "HRA 21263",
      "registerart": "HRA",
      "company_name": "Kunst Hoch Tief GmbH & Co. KG",
      "company_seat": "Kaisersesch",
      "details": "11.11.2024 (Bekanntmachungsdatum)\n\nRheinland-Pfalz Amtsgericht Koblenz HRA 21263\nLöschungsankündigung\n\nKunst Hoch Tief GmbH & Co. KG\nKommanditgesellschaft\nKaisersesch\n\nDas Registergericht beabsichtigt die Firma von Amts wegen nach § 394 FamFG zu löschen. Die Frist zur Erhebung eines Widerspruchs ist auf einen Monat festgesetzt."
    },
    {
      "date": "2024-11-11",
      "original_text": "Löschungsankündigung\nThüringen Amtsgericht Jena HRB 506862\nL & N Globalservice UG (haftungsbeschränkt) – Am Ettersberg",
      "type": "Löschungsankündigung",
      "state": "Thüringen",
      "amtsgericht": "Amtsgericht Jena",
      "registernummer": "HRB 506862",
      "registerart": "HRB",
      "company_name": "L & N Globalservice UG (haftungsbeschränkt)",
      "company_seat": "Am Ettersberg",
      "details": "11.11.2024 (Bekanntmachungsdatum)\n\nThüringen Amtsgericht Jena HRB 506862\nLöschungsankündigung\n\nL & N Globalservice UG (haftungsbeschränkt)\nGesellschaft mit beschränkter Haftung\nAm Ettersberg\n\nDas Registergericht beabsichtigt, die im Handelsregister eingetragene Gesellschaft wegen Vermögenslosigkeit nach § 394 FamFG von Amts wegen zu löschen. Die Frist zur Erhebung eines Widerspruchs gegen die beabsichtigte Löschung wird auf 6 Wochen festgesetzt."
    },
    {
      "date": "2024-11-11",
      "original_text": "Registerbekanntmachung nach dem Umwandlungsgesetz\nNiedersachsen Amtsgericht Tostedt VR 201203\nLebenshilfe Landkreis Harburg e.V. – Tostedt",
      "type": "Registerbekanntmachung nach dem Umwandlungsgesetz",
      "state": "Niedersachsen",
      "amtsgericht": "Amtsgericht Tostedt",
      "registernummer": "VR 201203",
      "registerart": "VR",
      "company_name": "Lebenshilfe Landkreis Harburg e.V.",
      "company_seat": "Tostedt",
      "details": "11.11.2024 (Bekanntmachungsdatum)\n\nNiedersachsen Amtsgericht Tostedt VR 201203\nRegisterbekanntmachung nach dem Umwandlungsgesetz 11.11.2024 (Eintragungsdatum)\n\nLebenshilfe Landkreis Harburg e.V.\neingetragener Verein\nTostedt\n\nDen Gläubigern der an der Verschmelzung beteiligten Rechtsträger ist, wenn sie binnen sechs Monaten nach dem Tag, an dem die Eintragung der Verschmelzung in das Register des Sitzes desjenigen Rechtsträgers, dessen Gläubiger sie sind, nach § 19  Abs.  3 UmwG als bekannt gemacht gilt, ihren Anspruch nach Grund und Höhe schriftlich anmelden, Sicherheit zu leisten, soweit sie nicht Befriedigung verlangen können. Dieses Recht steht den Gläubigern jedoch nur zu, wenn sie glaubhaft machen, dass durch die Verschmelzung die Erfüllung der Forderung gefährdet wird."
    },
    {
      "date": "2024-11-11",
      "original_text": "Löschungsankündigung\nBerlin Amtsgericht Berlin (Charlottenburg) HRB 237025\nLehmann Europa 2.0 GmbH – Berlin",
      "type": "Löschungsankündigung",
      "state": "Berlin",
      "amtsgericht": "Amtsgericht Berlin (Charlottenburg)",
      "registernummer": "HRB 237025",
      "registerart": "HRB",
      "company_name": "Lehmann Europa 2.0 GmbH",
      "company_seat": "Berlin",
      "details": "11.11.2024 (Bekanntmachungsdatum)\n\nBerlin Amtsgericht Berlin (Charlottenburg) HRB 237025\nLöschungsankündigung\n\nLehmann Europa 2.0 GmbH\nGesellschaft mit beschränkter Haftung\nBerlin\n\nBei der nachstehenden Gesellschaft wird das Amtslöschungsverfahren gemäß § 394 FamFG eingeleitet. Widerspruchsfrist 6 Wochen"
    },
    {
      "date": "2024-11-11",
      "original_text": "Registerbekanntmachung nach dem Umwandlungsgesetz\nThüringen Amtsgericht Jena HRB 522506\nLeinotel GmbH – Leinefelde-Worbis",
      "type": "Registerbekanntmachung nach dem Umwandlungsgesetz",
      "state": "Thüringen",
      "amtsgericht": "Amtsgericht Jena",
      "registernummer": "HRB 522506",
      "registerart": "HRB",
      "company_name": "Leinotel GmbH",
      "company_seat": "Leinefelde-Worbis",
      "details": "11.11.2024 (Bekanntmachungsdatum)\n\nThüringen Amtsgericht Jena HRB 522506\nRegisterbekanntmachung nach dem Umwandlungsgesetz 11.11.2024 (Eintragungsdatum)\n\nLeinotel GmbH\nGesellschaft mit beschränkter Haftung\nLeinefelde-Worbis\n\nNicht eingetragen: Den Gläubigern der an der Ausgliederung beteiligten Rechtsträger, ist wenn sie binnen sechs Monaten nach dem Tag, an dem die Eintragung der Ausgliederung in das Register des Sitzes desjenigen Rechtsträgers, dessen Gläubiger sie sind, nach §§125, 19 Abs. 3 UmwG als bekanntgemacht gilt, ihren Anspruch nach Grund und Höhe schriftlich anmelden, Sicherheit zu leisten, soweit sie nicht Befriedigung verlangen können. Dieses Recht steht ihnen jedoch nur zu, wenn sie glaubhaft machen, daß durch die Ausgliederung die Erfüllung ihrer Forderung gefährdet wird."
    },
    {
      "date": "2024-11-11",
      "original_text": "Registerbekanntmachung nach dem Umwandlungsgesetz\nThüringen Amtsgericht Jena HRA 506881\nLeinotel e.K. – Leinefelde-Worbis",
      "type": "Registerbekanntmachung nach dem Umwandlungsgesetz",
      "state": "Thüringen",
      "amtsgericht": "Amtsgericht Jena",
      "registernummer": "HRA 506881",
      "registerart": "HRA",
      "company_name": "Leinotel e.K.",
      "company_seat": "Leinefelde-Worbis",
      "details": "11.11.2024 (Bekanntmachungsdatum)\n\nThüringen Amtsgericht Jena HRA 506881\nRegisterbekanntmachung nach dem Umwandlungsgesetz 11.11.2024 (Eintragungsdatum)\n\nLeinotel e.K.\nEinzelkaufmann / Einzelkauffrau\nLeinefelde-Worbis\n\nNicht eingetragen: Den Gläubigern der an der Ausgliederung beteiligten Rechtsträger, ist wenn sie binnen sechs Monaten nach dem Tag, an dem die Eintragung der Ausgliederung in das Register des Sitzes desjenigen Rechtsträgers, dessen Gläubiger sie sind, nach §§125, 19 Abs. 3 UmwG als bekanntgemacht gilt, ihren Anspruch nach Grund und Höhe schriftlich anmelden, Sicherheit zu leisten, soweit sie nicht Befriedigung verlangen können. Dieses Recht steht ihnen jedoch nur zu, wenn sie glaubhaft machen, daß durch die Ausgliederung die Erfüllung ihrer Forderung gefährdet wird."
    },
    {
      "date": "2024-11-11",
      "original_text": "Einreichung neuer Dokumente\nNordrhein-Westfalen Amtsgericht Düsseldorf HRB 106862\nLevy Holding AG – Düsseldorf",
      "type": "Einreichung neuer Dokumente",
      "state": "Nordrhein-Westfalen",
      "amtsgericht": "Amtsgericht Düsseldorf",
      "registernummer": "HRB 106862",
      "registerart": "HRB",
      "company_name": "Levy Holding AG",
      "company_seat": "Düsseldorf",
      "details": "11.11.2024 (Bekanntmachungsdatum)\n\nNordrhein-Westfalen Amtsgericht Düsseldorf HRB 106862\nEinreichung neuer Dokumente\n\nLevy Holding AG\nAktiengesellschaft\nDüsseldorf\n\nDem Registergericht ist eine Liste der Mitglieder des Aufsichtsrates eingereicht worden."
    },
    {
      "date": "2024-11-11",
      "original_text": "Löschungsankündigung\nThüringen Amtsgericht Jena HRB 106484\nLiebeskind-Druck GmbH – Apolda",
      "type": "Löschungsankündigung",
      "state": "Thüringen",
      "amtsgericht": "Amtsgericht Jena",
      "registernummer": "HRB 106484",
      "registerart": "HRB",
      "company_name": "Liebeskind-Druck GmbH",
      "company_seat": "Apolda",
      "details": "11.11.2024 (Bekanntmachungsdatum)\n\nThüringen Amtsgericht Jena HRB 106484\nLöschungsankündigung\n\nLiebeskind-Druck GmbH\nGesellschaft mit beschränkter Haftung\nApolda\n\nDas Registergericht beabsichtigt, die im Handelsregister eingetragene Gesellschaft wegen Vermögenslosigkeit nach § 394 FamFG von Amts wegen zu löschen. Die Frist zur Erhebung eines Widerspruchs gegen die beabsichtigte Löschung wird auf 6 Wochen festgesetzt."
    },
    {
      "date": "2024-11-11",
      "original_text": "Einreichung neuer Dokumente\nNordrhein-Westfalen Amtsgericht Dortmund HRB 17101 früher Amtsgericht Lünen\nLinz u. Co., Gesellschaft mit beschränkter Haftung – Lünen",
      "type": "Einreichung neuer Dokumente",
      "state": "Nordrhein-Westfalen",
      "amtsgericht": "Amtsgericht Dortmund",
      "registernummer": "HRB 17101",
      "registerart": "HRB",
      "company_name": "Linz u. Co., Gesellschaft mit beschränkter Haftung",
      "company_seat": "Lünen",
      "former_amtsgericht": "Lünen",
      "details": "11.11.2024 (Bekanntmachungsdatum)\n\nNordrhein-Westfalen Amtsgericht Dortmund HRB 17101 früher Amtsgericht Lünen\nEinreichung neuer Dokumente 08.11.2024 (Eintragungsdatum)\n\nLinz u. Co., Gesellschaft mit beschränkter Haftung\nGesellschaft mit beschränkter Haftung\nLünen\n\nDem Registergericht ist eine Liste der Mitglieder des Aufsichtsrates eingereicht worden."
    },
    {
      "date": "2024-11-11",
      "original_text": "Löschungsankündigung\nNordrhein-Westfalen Amtsgericht Duisburg HRB 35996\nM-Port Handelsgesellschaft mbH – Duisburg",
      "type": "Löschungsankündigung",
      "state": "Nordrhein-Westfalen",
      "amtsgericht": "Amtsgericht Duisburg",
      "registernummer": "HRB 35996",
      "registerart": "HRB",
      "company_name": "M-Port Handelsgesellschaft mbH",
      "company_seat": "Duisburg",
      "details": "11.11.2024 (Bekanntmachungsdatum)\n\nNordrhein-Westfalen Amtsgericht Duisburg HRB 35996\nLöschungsankündigung 11.11.2024 (Eintragungsdatum)\n\nM-Port Handelsgesellschaft mbH\nGesellschaft mit beschränkter Haftung\nDuisburg\n\nHRB 35996:\nM-Port Handelsgesellschaft mbH, Duisburg\nHofgasse 9, 47178 Duisburg.\nDas Registergericht beabsichtigt, die im Handelsregister eingetragene Gesellschaft gemäß § 394 FamFG wegen Vermögenslosigkeit von Amts wegen zu löschen. Gegen diese Verfügung kann Widerspruch eingelegt werden. Die Frist zur Erhebung eines Widerspruchs gegen die beabsichtigte Löschung von Amts wegen ist auf drei Monate festgesetzt. Rechtsbehelfsbelehrung Der Widerspruch ist bei dem Amtsgericht Duisburg, Kardinal-Galen-Str. 124-132, 47058 Duisburg schriftlich in deutscher Sprache oder zur Niederschrift der Geschäftsstelle einzulegen. Der Widerspruch kann auch zur Niederschrift der Geschäftsstelle eines jeden Amtsgerichtes abgegeben werden. Die Einlegung ist auch durch Übertragung eines elektronischen Dokuments an die elektronische Poststelle des Gerichts möglich. Das elektronische Dokument muss für die Bearbeitung durch das Gericht geeignet und mit einer qualifizierten elektronischen Signatur der verantwortenden Person versehen sein oder von der verantwortenden Person signiert und auf einem sicheren Übermittlungsweg gemäß § 130 a ZPO nach näherer Maßgabe der Verordnung über die technischen Rahmenbedingungen des elektronischen Rechtsverkehrs und über das besondere elektronische Behördenpostfach (BGBl. I, S. 3803) eingereicht werden. Weitere Informationen erhalten Sie auf der Internetseite www.justiz.de. Der Widerspruch muss spätestens innerhalb der gesetzten Frist bei dem Amtsgericht Duisburg eingegangen sein. Dies gilt auch dann, wenn der Widerspruch zur Niederschrift der Geschäftsstelle eines anderen Amtsgerichtes abgegeben wurde. Die Frist beginnt mit der Veröffentlichung. Fällt das Ende der Frist auf einen Sonntag, einen allgemeinen Feiertag oder Sonnabend, so endet die Frist mit Ablauf des nächsten Werktages. Der Widerspruch muss die Bezeichnung der angefochtenen Verfügung sowie die Erklärung enthalten, dass Widerspruch gegen diese Verfügung eingelegt wird. Er ist zu unterzeichnen und soll begründet werden."
    },
    {
      "date": "2024-11-11",
      "original_text": "Registerbekanntmachung nach dem Umwandlungsgesetz\nNiedersachsen Amtsgericht Stadthagen HRA 1793\nMGS Vermögensholding GmbH & Co. KG – Messenkamp",
      "type": "Registerbekanntmachung nach dem Umwandlungsgesetz",
      "state": "Niedersachsen",
      "amtsgericht": "Amtsgericht Stadthagen",
      "registernummer": "HRA 1793",
      "registerart": "HRA",
      "company_name": "MGS Vermögensholding GmbH & Co. KG",
      "company_seat": "Messenkamp",
      "details": "11.11.2024 (Bekanntmachungsdatum)\n\nNiedersachsen Amtsgericht Stadthagen HRA 1793\nRegisterbekanntmachung nach dem Umwandlungsgesetz 29.10.2024 (Eintragungsdatum)\n\nMGS Vermögensholding GmbH & Co. KG\nKommanditgesellschaft\nMessenkamp\n\nDen Gläubigern der an der formwechselnden Umwandlung beteiligten Rechtsträger ist, wenn sie binnen sechs Monaten nach dem Tag, an dem die Eintragung der Umwandlung in das Register des Sitzes desjenigen Rechtsträgers, dessen Gläubiger sie sind, nach § 19 Abs. 3 UmwG als bekannt gemacht gilt, ihren Anspruch nach Grund und Höhe schriftlich anmelden, Sicherheit zu leisten, soweit sie nicht Befriedigung verlangen können. Dieses Recht steht den Gläubigern jedoch nur zu, wenn sie glaubhaft machen, dass durch die formwechselnde Umwandlung die Erfüllung der Forderung gefährdet wird."
    },
    {
      "date": "2024-11-11",
      "original_text": "Registerbekanntmachung nach dem Umwandlungsgesetz\nNiedersachsen Amtsgericht Stadthagen HRB 202353\nMGS Verwaltungs GmbH – Messenkamp",
      "type": "Registerbekanntmachung nach dem Umwandlungsgesetz",
      "state": "Niedersachsen",
      "amtsgericht": "Amtsgericht Stadthagen",
      "registernummer": "HRB 202353",
      "registerart": "HRB",
      "company_name": "MGS Verwaltungs GmbH",
      "company_seat": "Messenkamp",
      "details": "11.11.2024 (Bekanntmachungsdatum)\n\nNiedersachsen Amtsgericht Stadthagen HRB 202353\nRegisterbekanntmachung nach dem Umwandlungsgesetz 29.10.2024 (Eintragungsdatum)\n\nMGS Verwaltungs GmbH\nGesellschaft mit beschränkter Haftung\nMessenkamp\n\nDen Gläubigern der an der formwechselnden Umwandlung beteiligten Rechtsträger ist, wenn sie binnen sechs Monaten nach dem Tag, an dem die Eintragung der Umwandlung in das Register des Sitzes desjenigen Rechtsträgers, dessen Gläubiger sie sind, nach § 19 Abs. 3 UmwG als bekannt gemacht gilt, ihren Anspruch nach Grund und Höhe schriftlich anmelden, Sicherheit zu leisten, soweit sie nicht Befriedigung verlangen können. Dieses Recht steht den Gläubigern jedoch nur zu, wenn sie glaubhaft machen, dass durch die formwechselnde Umwandlung die Erfüllung der Forderung gefährdet wird."
    },
    {
      "date": "2024-11-11",
      "original_text": "Registerbekanntmachung nach dem Umwandlungsgesetz\nSachsen Amtsgericht Dresden HRB 38865\nMST GmbH – Bautzen",
      "type": "Registerbekanntmachung nach dem Umwandlungsgesetz",
      "state": "Sachsen",
      "amtsgericht": "Amtsgericht Dresden",
      "registernummer": "HRB 38865",
      "registerart": "HRB",
      "company_name": "MST GmbH",
      "company_seat": "Bautzen",
      "details": "11.11.2024 (Bekanntmachungsdatum)\n\nSachsen Amtsgericht Dresden HRB 38865\nRegisterbekanntmachung nach dem Umwandlungsgesetz 11.11.2024 (Eintragungsdatum)\n\nMST GmbH\nGesellschaft mit beschränkter Haftung\nBautzen\n\nDen Gläubigern der an der #DV.Auswahl(Text=\"Betreffende Alternative auswählen\",Eingabe=\"Verschmelzung beteiligten Rechtsträger ist, wenn sie binnen sechs Monaten nach dem Tag, an dem die Eintragung der Verschmelzung in das Register des Sitzes desjenigen Rechtsträgers, dessen Gläubiger sie sind, nach § 19 Abs. 3 UmwG als bekannt gemacht gilt, ihren Anspruch nach Grund und Höhe schriftlich anmelden, Sicherheit zu leisten, soweit sie nicht Befriedigung verlangen können. Dieses Recht steht den Gläubigern jedoch nur zu, wenn sie glaubhaft machen, dass durch die Verschmelzung die Erfüllung der Forderung gefährdet wird.\"|\"Verschmelzung\",\"Spaltung beteiligten Rechtsträger ist, wenn sie binnen sechs Monaten nach dem Tag, an dem die Eintragung der Spaltung in das Register des Sitzes desjenigen Rechtsträgers, dessen Gläubiger sie sind, nach § 19 Abs. 3 UmwG als bekannt gemacht gilt, ihren Anspruch nach Grund und Höhe schriftlich anmelden, Sicherheit zu leisten, soweit sie nicht Befriedigung verlangen können. Dieses Recht steht den Gläubigern jedoch nur zu, wenn sie glaubhaft machen, dass durch die Spaltung die Erfüllung der Forderung gefährdet wird.\"|\"Spaltung\",\"Umwandlung beteiligten Rechtsträger ist, wenn sie binnen sechs Monaten nach dem Tag, an dem die Eintragung der Umwandlung  in das Register des Sitzes desjenigen Rechtsträgers, dessen Gläubiger sie sind, nach § 19 Abs. 3 UmwG als bekannt gemacht gilt, ihren Anspruch nach Grund und Höhe schriftlich anmelden, Sicherheit zu leisten, soweit sie nicht Befriedigung verlangen können. Dieses Recht steht den Gläubigern jedoch nur zu, wenn sie glaubhaft machen, dass durch die Umwandlung die Erfüllung der Forderung gefährdet wird.\"|\"Umwandlung\",\"Ausgliederung beteiligten Rechtsträger ist, wenn sie binnen sechs Monaten nach dem Tag, an dem die Eintragung der Ausgliederung in das Register des Sitzes desjenigen Rechtsträgers, dessen Gläubiger sie sind, nach § 19 Abs. 3 UmwG als bekannt gemacht gilt, ihren Anspruch nach Grund und Höhe schriftlich anmelden, Sicherheit zu leisten, soweit sie nicht Befriedigung verlangen können. Dieses Recht steht den Gläubigern jedoch nur zu, wenn sie glaubhaft machen, dass durch die Ausgliederung die Erfüllung der Forderung gefährdet wird.\"|\"Ausgliederung\")"
    },
    {
      "date": "2024-11-11",
      "original_text": "Registerbekanntmachung nach dem Umwandlungsgesetz\nBaden-Württemberg Amtsgericht Stuttgart HRB 797046\nMedizinisches Versorgungszentrum Schelztor-Klinik Esslingen GmbH – Esslingen am Neckar",
      "type": "Registerbekanntmachung nach dem Umwandlungsgesetz",
      "state": "Baden-Württemberg",
      "amtsgericht": "Amtsgericht Stuttgart",
      "registernummer": "HRB 797046",
      "registerart": "HRB",
      "company_name": "Medizinisches Versorgungszentrum Schelztor-Klinik Esslingen GmbH",
      "company_seat": "Esslingen am Neckar",
      "details": "11.11.2024 (Bekanntmachungsdatum)\n\nBaden-Württemberg Amtsgericht Stuttgart HRB 797046\nRegisterbekanntmachung nach dem Umwandlungsgesetz 11.11.2024 (Eintragungsdatum)\n\nMedizinisches Versorgungszentrum Schelztor-Klinik Esslingen GmbH\nGesellschaft mit beschränkter Haftung\nEsslingen am Neckar\n\nDen Gläubigern des an dem Formwechsel beteiligten Rechtsträgers ist, wenn sie binnen sechs Monaten nach dem Tag, an dem die Eintragung des Formwechsels in das Register des Sitzes desjenigen Rechtsträgers, dessen Gläubiger sie sind, nach § 19 Abs. 3 UmwG als bekanntgemacht gilt, ihren Anspruch nach Grund und Höhe schriftlich anmelden, Sicherheit zu leisten, soweit sie nicht Befriedigung verlangen können. Dieses Recht steht den Gläubigern jedoch nur zu, wenn sie glaubhaft machen, dass durch den Formwechsel die Erfüllung ihrer Forderung gefährdet wird."
    },
    {
      "date": "2024-11-11",
      "original_text": "Registerbekanntmachung nach dem Umwandlungsgesetz\nSachsen Amtsgericht Dresden HRB 13705\nMetzner GmbH – Oßling",
      "type": "Registerbekanntmachung nach dem Umwandlungsgesetz",
      "state": "Sachsen",
      "amtsgericht": "Amtsgericht Dresden",
      "registernummer": "HRB 13705",
      "registerart": "HRB",
      "company_name": "Metzner GmbH",
      "company_seat": "Oßling",
      "details": "11.11.2024 (Bekanntmachungsdatum)\n\nSachsen Amtsgericht Dresden HRB 13705\nRegisterbekanntmachung nach dem Umwandlungsgesetz 11.11.2024 (Eintragungsdatum)\n\nMetzner GmbH\nGesellschaft mit beschränkter Haftung\nOßling\n\nDen Gläubigern der an der #DV.Auswahl(Text=\"Betreffende Alternative auswählen\",Eingabe=\"Verschmelzung beteiligten Rechtsträger ist, wenn sie binnen sechs Monaten nach dem Tag, an dem die Eintragung der Verschmelzung in das Register des Sitzes desjenigen Rechtsträgers, dessen Gläubiger sie sind, nach § 19 Abs. 3 UmwG als bekannt gemacht gilt, ihren Anspruch nach Grund und Höhe schriftlich anmelden, Sicherheit zu leisten, soweit sie nicht Befriedigung verlangen können. Dieses Recht steht den Gläubigern jedoch nur zu, wenn sie glaubhaft machen, dass durch die Verschmelzung die Erfüllung der Forderung gefährdet wird.\"|\"Verschmelzung\",\"Spaltung beteiligten Rechtsträger ist, wenn sie binnen sechs Monaten nach dem Tag, an dem die Eintragung der Spaltung in das Register des Sitzes desjenigen Rechtsträgers, dessen Gläubiger sie sind, nach § 19 Abs. 3 UmwG als bekannt gemacht gilt, ihren Anspruch nach Grund und Höhe schriftlich anmelden, Sicherheit zu leisten, soweit sie nicht Befriedigung verlangen können. Dieses Recht steht den Gläubigern jedoch nur zu, wenn sie glaubhaft machen, dass durch die Spaltung die Erfüllung der Forderung gefährdet wird.\"|\"Spaltung\",\"Umwandlung beteiligten Rechtsträger ist, wenn sie binnen sechs Monaten nach dem Tag, an dem die Eintragung der Umwandlung  in das Register des Sitzes desjenigen Rechtsträgers, dessen Gläubiger sie sind, nach § 19 Abs. 3 UmwG als bekannt gemacht gilt, ihren Anspruch nach Grund und Höhe schriftlich anmelden, Sicherheit zu leisten, soweit sie nicht Befriedigung verlangen können. Dieses Recht steht den Gläubigern jedoch nur zu, wenn sie glaubhaft machen, dass durch die Umwandlung die Erfüllung der Forderung gefährdet wird.\"|\"Umwandlung\",\"Ausgliederung beteiligten Rechtsträger ist, wenn sie binnen sechs Monaten nach dem Tag, an dem die Eintragung der Ausgliederung in das Register des Sitzes desjenigen Rechtsträgers, dessen Gläubiger sie sind, nach § 19 Abs. 3 UmwG als bekannt gemacht gilt, ihren Anspruch nach Grund und Höhe schriftlich anmelden, Sicherheit zu leisten, soweit sie nicht Befriedigung verlangen können. Dieses Recht steht den Gläubigern jedoch nur zu, wenn sie glaubhaft machen, dass durch die Ausgliederung die Erfüllung der Forderung gefährdet wird.\"|\"Ausgliederung\")"
    },
    {
      "date": "2024-11-11",
      "original_text": "Löschungsankündigung\nBerlin Amtsgericht Berlin (Charlottenburg) HRB 211392\nNegrescu Gebäudetechnik UG (haftungsbeschränkt) – Berlin",
      "type": "Löschungsankündigung",
      "state": "Berlin",
      "amtsgericht": "Amtsgericht Berlin (Charlottenburg)",
      "registernummer": "HRB 211392",
      "registerart": "HRB",
      "company_name": "Negrescu Gebäudetechnik UG (haftungsbeschränkt)",
      "company_seat": "Berlin",
      "details": "11.11.2024 (Bekanntmachungsdatum)\n\nBerlin Amtsgericht Berlin (Charlottenburg) HRB 211392\nLöschungsankündigung\n\nNegrescu Gebäudetechnik UG (haftungsbeschränkt)\nGesellschaft mit beschränkter Haftung\nBerlin\n\nBei der nachstehenden Gesellschaft wird das Amtslöschungsverfahren gemäß § 394 FamFG eingeleitet. Widerspruchsfrist 6 Wochen"
    },
    {
      "date": "2024-11-11",
      "original_text": "Einreichung neuer Dokumente\nSachsen Amtsgericht Dresden HRB 20191\nNiederschlesische Entsorgungsgesellschaft mbH – Weißwasser",
      "type": "Einreichung neuer Dokumente",
      "state": "Sachsen",
      "amtsgericht": "Amtsgericht Dresden",
      "registernummer": "HRB 20191",
      "registerart": "HRB",
      "company_name": "Niederschlesische Entsorgungsgesellschaft mbH",
      "company_seat": "Weißwasser",
      "details": "11.11.2024 (Bekanntmachungsdatum)\n\nSachsen Amtsgericht Dresden HRB 20191\nEinreichung neuer Dokumente\n\nNiederschlesische Entsorgungsgesellschaft mbH\nGesellschaft mit beschränkter Haftung\nWeißwasser\n\nAm 08.11.2024 wurde beim Handelsregister des Amtsgerichts Dresden die Liste der Mitglieder des Aufsichtsrats gemäß § 52 GmbHG eingereicht."
    },
    {
      "date": "2024-11-11",
      "original_text": "Löschungsankündigung\nBaden-Württemberg Amtsgericht Mannheim HRB 341905\nOLHO Sinsheim GmbH – Sinsheim",
      "type": "Löschungsankündigung",
      "state": "Baden-Württemberg",
      "amtsgericht": "Amtsgericht Mannheim",
      "registernummer": "HRB 341905",
      "registerart": "HRB",
      "company_name": "OLHO Sinsheim GmbH",
      "company_seat": "Sinsheim",
      "details": "11.11.2024 (Bekanntmachungsdatum)\n\nBaden-Württemberg Amtsgericht Mannheim HRB 341905\nLöschungsankündigung\n\nOLHO Sinsheim GmbH\nGesellschaft mit beschränkter Haftung\nSinsheim\n\nAls nicht eingetragen wird bekanntgemacht:\nDas Gericht beabsichtigt, die Gesellschaft wegen Vermögenslosigkeit im Handelsregister von Amts wegen nach § 394 FamFG zu löschen. Die Frist zur Geltendmachung eines Widerspruchs gegen die beabsichtigte Löschung ist auf einen Monat ab Veröffentlichung bestimmt."
    },
    {
      "date": "2024-11-11",
      "original_text": "Löschungsankündigung\nBerlin Amtsgericht Berlin (Charlottenburg) HRB 181329\nOkazaki Event & Spa UG (haftungsbeschränkt) – Berlin",
      "type": "Löschungsankündigung",
      "state": "Berlin",
      "amtsgericht": "Amtsgericht Berlin (Charlottenburg)",
      "registernummer": "HRB 181329",
      "registerart": "HRB",
      "company_name": "Okazaki Event & Spa UG (haftungsbeschränkt)",
      "company_seat": "Berlin",
      "details": "11.11.2024 (Bekanntmachungsdatum)\n\nBerlin Amtsgericht Berlin (Charlottenburg) HRB 181329\nLöschungsankündigung\n\nOkazaki Event & Spa UG (haftungsbeschränkt)\nGesellschaft mit beschränkter Haftung\nBerlin\n\nBei der nachstehenden Gesellschaft wird das Amtslöschungsverfahren gemäß § 394 FamFG eingeleitet. Widerspruchsfrist 6 Wochen"
    },
    {
      "date": "2024-11-11",
      "original_text": "Sonstige Registerbekanntmachung\nBrandenburg Amtsgericht Neuruppin HRB 12384\nOranienburg Holding GmbH – Oranienburg",
      "type": "Sonstige Registerbekanntmachung",
      "state": "Brandenburg",
      "amtsgericht": "Amtsgericht Neuruppin",
      "registernummer": "HRB 12384",
      "registerart": "HRB",
      "company_name": "Oranienburg Holding GmbH",
      "company_seat": "Oranienburg",
      "details": "11.11.2024 (Bekanntmachungsdatum)\n\nBrandenburg Amtsgericht Neuruppin HRB 12384\nSonstige Registerbekanntmachung\n\nOranienburg Holding GmbH\nGesellschaft mit beschränkter Haftung\nOranienburg\n\nAls nicht eingetragen wird bekannt gemacht: Eine Liste der Mitglieder des Aufsichtsrates wurde zum Handelsregister eingereicht."
    },
    {
      "date": "2024-11-11",
      "original_text": "Sonstige Registerbekanntmachung\nSachsen Amtsgericht Leipzig HRB 27108\nOschatzer Wärme- und Servicegesellschaft mbH – Oschatz",
      "type": "Sonstige Registerbekanntmachung",
      "state": "Sachsen",
      "amtsgericht": "Amtsgericht Leipzig",
      "registernummer": "HRB 27108",
      "registerart": "HRB",
      "company_name": "Oschatzer Wärme- und Servicegesellschaft mbH",
      "company_seat": "Oschatz",
      "details": "11.11.2024 (Bekanntmachungsdatum)\n\nSachsen Amtsgericht Leipzig HRB 27108\nSonstige Registerbekanntmachung\n\nOschatzer Wärme- und Servicegesellschaft mbH\nGesellschaft mit beschränkter Haftung\nOschatz\n\nAm 06.11.2024 wurde beim Handelsregister des Amtsgerichts Leipzig die Liste der Mitglieder des Aufsichtsrats gemäß § 52 GmbHG eingereicht."
    },
    {
      "date": "2024-11-11",
      "original_text": "Löschungsankündigung\nHessen Amtsgericht Frankfurt am Main HRB 91711\nPANTHERA Asset Management Service GmbH – Frankfurt am Main",
      "type": "Löschungsankündigung",
      "state": "Hessen",
      "amtsgericht": "Amtsgericht Frankfurt am Main",
      "registernummer": "HRB 91711",
      "registerart": "HRB",
      "company_name": "PANTHERA Asset Management Service GmbH",
      "company_seat": "Frankfurt am Main",
      "details": "11.11.2024 (Bekanntmachungsdatum)\n\nHessen Amtsgericht Frankfurt am Main HRB 91711\nLöschungsankündigung\n\nPANTHERA Asset Management Service GmbH\nGesellschaft mit beschränkter Haftung\nFrankfurt am Main\n\nDas Registergericht beabsichtigt die im Handelsregister eingetragene Gesellschaft von Amts wegen nach § 394 FamFG zu löschen. Die Frist zur Erhebung eines Widerspruchs gegen die beabsichtigte Löschung wird auf 1 Monat festgesetzt."
    },
    {
      "date": "2024-11-11",
      "original_text": "Registerbekanntmachung nach dem Umwandlungsgesetz\nNordrhein-Westfalen Amtsgericht Paderborn HRA 7970\nPBS Pipper Brandschutz Service, Inhaber Heinrich Pipper e.K. – Bad Wünnenberg",
      "type": "Registerbekanntmachung nach dem Umwandlungsgesetz",
      "state": "Nordrhein-Westfalen",
      "amtsgericht": "Amtsgericht Paderborn",
      "registernummer": "HRA 7970",
      "registerart": "HRA",
      "company_name": "PBS Pipper Brandschutz Service, Inhaber Heinrich Pipper e.K.",
      "company_seat": "Bad Wünnenberg",
      "details": "11.11.2024 (Bekanntmachungsdatum)\n\nNordrhein-Westfalen Amtsgericht Paderborn HRA 7970\nRegisterbekanntmachung nach dem Umwandlungsgesetz 11.11.2024 (Eintragungsdatum)\n\nPBS Pipper Brandschutz Service, Inhaber Heinrich Pipper e.K.\nEinzelkaufmann / Einzelkauffrau\nBad Wünnenberg\n\nDen Gläubigern der an der Ausgliederung beteiligten Rechtsträger ist, wenn sie binnen sechs Monaten nach dem Tag, an dem die Eintragung der Ausgliederung in das Register des Sitzes desjenigen Rechtsträgers, dessen Gläubiger sie sind, nach § 19 Absatz 3 UmwG als bekanntgemacht gilt, ihren Anspruch nach Grund und Höhe schriftlich anmelden, Sicherheit zu leisten, soweit sie nicht Befriedigung verlangen können. Dieses Recht steht den Gläubigern jedoch nur zu, wenn sie glaubhaft machen, dass durch die Ausgliederung die Erfüllung ihrer Forderung gefährdet wird."
    },
    {
      "date": "2024-11-11",
      "original_text": "Registerbekanntmachung nach dem Umwandlungsgesetz\nBaden-Württemberg Amtsgericht Mannheim HRB 720105\nPEKKIP Oncology Alliance AG – Heidelberg",
      "type": "Registerbekanntmachung nach dem Umwandlungsgesetz",
      "state": "Baden-Württemberg",
      "amtsgericht": "Amtsgericht Mannheim",
      "registernummer": "HRB 720105",
      "registerart": "HRB",
      "company_name": "PEKKIP Oncology Alliance AG",
      "company_seat": "Heidelberg",
      "details": "11.11.2024 (Bekanntmachungsdatum)\n\nBaden-Württemberg Amtsgericht Mannheim HRB 720105\nRegisterbekanntmachung nach dem Umwandlungsgesetz 11.11.2024 (Eintragungsdatum)\n\nPEKKIP Oncology Alliance AG\nAktiengesellschaft\nHeidelberg\n\nAls nicht eingetragen wird bekanntgemacht:\nDen Gläubigern des an dem Formwechsel beteiligten Rechtsträgers ist, wenn sie binnen sechs Monaten nach dem Tag, an dem die Eintragung des Formwechsels in das Register des Sitzes desjenigen Rechtsträgers, dessen Gläubiger sie sind, nach § 19 Abs. 3 UmwG als bekanntgemacht gilt, ihren Anspruch nach Grund und Höhe schriftlich anmelden, Sicherheit zu leisten, soweit sie nicht Befriedigung verlangen können. Dieses Recht steht den Gläubigern jedoch nur zu, wenn sie glaubhaft machen, dass durch den Formwechsel die Erfüllung ihrer Forderung gefährdet wird."
    },
    {
      "date": "2024-11-11",
      "original_text": "Einreichung neuer Dokumente\nNordrhein-Westfalen Amtsgericht Recklinghausen HRB 3307\nPROSOZ Herten Softwareentwicklungs- und Beratungsgesellschaft für Gemeinden, Städte und Kreise mbH – Herten",
      "type": "Einreichung neuer Dokumente",
      "state": "Nordrhein-Westfalen",
      "amtsgericht": "Amtsgericht Recklinghausen",
      "registernummer": "HRB 3307",
      "registerart": "HRB",
      "company_name": "PROSOZ Herten Softwareentwicklungs- und Beratungsgesellschaft für Gemeinden, Städte und Kreise mbH",
      "company_seat": "Herten",
      "details": "11.11.2024 (Bekanntmachungsdatum)\n\nNordrhein-Westfalen Amtsgericht Recklinghausen HRB 3307\nEinreichung neuer Dokumente 11.11.2024 (Eintragungsdatum)\n\nPROSOZ Herten Softwareentwicklungs- und Beratungsgesellschaft für Gemeinden, Städte und Kreise mbH\nGesellschaft mit beschränkter Haftung\nHerten\n\nDem Registergericht ist eine neue Liste der Mitglieder des Aufsichtsrates eingereicht worden."
    },
    {
      "date": "2024-11-11",
      "original_text": "Registerbekanntmachung nach dem Umwandlungsgesetz\nNiedersachsen Amtsgericht Oldenburg (Oldenburg) HRB 208750\nPalm Norge GmbH – Bad Zwischenahn",
      "type": "Registerbekanntmachung nach dem Umwandlungsgesetz",
      "state": "Niedersachsen",
      "amtsgericht": "Amtsgericht Oldenburg (Oldenburg)",
      "registernummer": "HRB 208750",
      "registerart": "HRB",
      "company_name": "Palm Norge GmbH",
      "company_seat": "Bad Zwischenahn",
      "details": "11.11.2024 (Bekanntmachungsdatum)\n\nNiedersachsen Amtsgericht Oldenburg (Oldenburg) HRB 208750\nRegisterbekanntmachung nach dem Umwandlungsgesetz 11.11.2024 (Eintragungsdatum)\n\nPalm Norge GmbH\nGesellschaft mit beschränkter Haftung\nBad Zwischenahn\n\nDen Gläubigern der an der Verschmelzung beteiligten Rechtsträger ist, wenn sie binnen sechs Monaten nach dem Tag, an dem die Eintragung der Verschmelzung in das Register des Sitzes desjenigen Rechtsträgers, dessen Gläubiger sie sind, nach § 19  Abs.  3 UmwG als bekannt gemacht gilt, ihren Anspruch nach Grund und Höhe schriftlich anmelden, Sicherheit zu leisten, soweit sie nicht Befriedigung verlangen können. Dieses Recht steht den Gläubigern jedoch nur zu, wenn sie glaubhaft machen, dass durch die Verschmelzung die Erfüllung der Forderung gefährdet wird."
    },
    {
      "date": "2024-11-11",
      "original_text": "Einreichung neuer Dokumente\nBerlin Amtsgericht Berlin (Charlottenburg) HRB 262201\nPentixapharm Holding AG – Berlin",
      "type": "Einreichung neuer Dokumente",
      "state": "Berlin",
      "amtsgericht": "Amtsgericht Berlin (Charlottenburg)",
      "registernummer": "HRB 262201",
      "registerart": "HRB",
      "company_name": "Pentixapharm Holding AG",
      "company_seat": "Berlin",
      "details": "11.11.2024 (Bekanntmachungsdatum)\n\nBerlin Amtsgericht Berlin (Charlottenburg) HRB 262201\nEinreichung neuer Dokumente\n\nPentixapharm Holding AG\nAktiengesellschaft\nBerlin\n\nAls nicht eingetragen wird veröffentlicht:Es wurde eine neue Liste der Aufsichtsratsmitglieder eingereicht (§ 106 AktG)."
    },
    {
      "date": "2024-11-11",
      "original_text": "Einreichung neuer Dokumente\nHessen Amtsgericht Königstein HRB 5465\nProcter & Gamble Manufacturing GmbH – Schwalbach am Taunus",
      "type": "Einreichung neuer Dokumente",
      "state": "Hessen",
      "amtsgericht": "Amtsgericht Königstein",
      "registernummer": "HRB 5465",
      "registerart": "HRB",
      "company_name": "Procter & Gamble Manufacturing GmbH",
      "company_seat": "Schwalbach am Taunus",
      "details": "11.11.2024 (Bekanntmachungsdatum)\n\nHessen Amtsgericht Königstein HRB 5465\nEinreichung neuer Dokumente 04.11.2024 (Eintragungsdatum)\n\nProcter & Gamble Manufacturing GmbH\nGesellschaft mit beschränkter Haftung\nSchwalbach am Taunus\n\nDurch eine Änderung in den Personen der Aufsichtsratsmitglieder ist eine Liste der Mitglieder des Aufsichtsrates zum Handelsregister eingereicht worden."
    },
    {
      "date": "2024-11-11",
      "original_text": "Löschungsankündigung\nBaden-Württemberg Amtsgericht Freiburg HRB 719570\nPure Extracts GmbH – Schliengen",
      "type": "Löschungsankündigung",
      "state": "Baden-Württemberg",
      "amtsgericht": "Amtsgericht Freiburg",
      "registernummer": "HRB 719570",
      "registerart": "HRB",
      "company_name": "Pure Extracts GmbH",
      "company_seat": "Schliengen",
      "details": "11.11.2024 (Bekanntmachungsdatum)\n\nBaden-Württemberg Amtsgericht Freiburg HRB 719570\nLöschungsankündigung 11.11.2024 (Eintragungsdatum)\n\nPure Extracts GmbH\nGesellschaft mit beschränkter Haftung\nSchliengen\n\nAls nicht eingetragen wird bekanntgemacht:\nDas Gericht beabsichtigt, die Gesellschaft wegen Vermögenslosigkeit im Handelsregister von Amts wegen nach § 394 FamFG zu löschen. Die Frist zur Geltendmachung eines Widerspruchs gegen die beabsichtigte Löschung ist auf einen Monat ab Veröffentlichung bestimmt."
    },
    {
      "date": "2024-11-11",
      "original_text": "Registerbekanntmachung nach dem Umwandlungsgesetz\nBerlin Amtsgericht Berlin (Charlottenburg) HRB 200620\nREALPORT AG – Berlin",
      "type": "Registerbekanntmachung nach dem Umwandlungsgesetz",
      "state": "Berlin",
      "amtsgericht": "Amtsgericht Berlin (Charlottenburg)",
      "registernummer": "HRB 200620",
      "registerart": "HRB",
      "company_name": "REALPORT AG",
      "company_seat": "Berlin",
      "details": "11.11.2024 (Bekanntmachungsdatum)\n\nBerlin Amtsgericht Berlin (Charlottenburg) HRB 200620\nRegisterbekanntmachung nach dem Umwandlungsgesetz\n\nREALPORT AG\nAktiengesellschaft\nBerlin\n\nZu Eintragungsnummer  vom  wird als nicht eingetragen veröffentlicht: Die Gesellschaft hat einen Verschmelzungsvertrag vom 06.11.2024 zwischen der Gesellschaft als übernehmender Rechtsträger und der Realport Services GmbH mit Sitz in Berlin (Amtsgericht Charlottenburg, HRB 205891 B) als übertragender Rechtsträger zum Handelsregister des Amtsgerichts Charlottenburg eingereicht."
    },
    {
      "date": "2024-11-11",
      "original_text": "Registerbekanntmachung nach dem Umwandlungsgesetz\nBerlin Amtsgericht Berlin (Charlottenburg) HRB 200620\nREALPORT AG – Berlin",
      "type": "Registerbekanntmachung nach dem Umwandlungsgesetz",
      "state": "Berlin",
      "amtsgericht": "Amtsgericht Berlin (Charlottenburg)",
      "registernummer": "HRB 200620",
      "registerart": "HRB",
      "company_name": "REALPORT AG",
      "company_seat": "Berlin",
      "details": "11.11.2024 (Bekanntmachungsdatum)\n\nBerlin Amtsgericht Berlin (Charlottenburg) HRB 200620\nRegisterbekanntmachung nach dem Umwandlungsgesetz\n\nREALPORT AG\nAktiengesellschaft\nBerlin\n\nZu Eintragungsnummer  vom  wird als nicht eingetragen veröffentlicht: Die Gesellschaft hat einen Verschmelzungsvertrag vom 06.11.2024 zwischen der Gesellschaft als übernehmender Rechtsträger und der Realport Broker GmbH mit Sitz in Berlin (Amtsgericht Charlottenburg, HRB 204285 B) als übertragender Rechtsträger zum Handelsregister des Amtsgerichts Charlottenburg eingereicht."
    },
    {
      "date": "2024-11-11",
      "original_text": "Registerbekanntmachung nach dem Umwandlungsgesetz\nRheinland-Pfalz Amtsgericht Koblenz HRB 28324\nRaiffeisen Forst GmbH – Lingerhahn",
      "type": "Registerbekanntmachung nach dem Umwandlungsgesetz",
      "state": "Rheinland-Pfalz",
      "amtsgericht": "Amtsgericht Koblenz",
      "registernummer": "HRB 28324",
      "registerart": "HRB",
      "company_name": "Raiffeisen Forst GmbH",
      "company_seat": "Lingerhahn",
      "details": "11.11.2024 (Bekanntmachungsdatum)\n\nRheinland-Pfalz Amtsgericht Koblenz HRB 28324\nRegisterbekanntmachung nach dem Umwandlungsgesetz 11.11.2024 (Eintragungsdatum)\n\nRaiffeisen Forst GmbH\nGesellschaft mit beschränkter Haftung\nLingerhahn\n\nAls nicht eingetragen wird veröffentlicht: Den Gläubigern der an der Verschmelzung beteiligten Rechtsträger ist, wenn sie binnen sechs Monaten nach dem Tag, an dem die Eintragung der Verschmelzung in das Register des Sitzes desjenigen Rechtsträgers,dessen Gläubiger sie sind, nach § 19 Abs. 3 UmwG als bekannt gemacht gilt, ihren Anspruch nach Grund und Höhe schriftlich anmelden, Sicherheit zu leisten, soweit sie nicht Befriedigung verlangen können. Dieses Recht steht den Gläubigern jedoch nur zu, wenn sie glaubhaft machen, dass durch die Verschmelzung die Erfüllungd er Forderung gefährdet wird."
    },
    {
      "date": "2024-11-11",
      "original_text": "Einreichung neuer Dokumente\nBaden-Württemberg Amtsgericht Stuttgart HRB 16873\nRegio Stuttgart Marketing- und Tourismus GmbH – Stuttgart",
      "type": "Einreichung neuer Dokumente",
      "state": "Baden-Württemberg",
      "amtsgericht": "Amtsgericht Stuttgart",
      "registernummer": "HRB 16873",
      "registerart": "HRB",
      "company_name": "Regio Stuttgart Marketing- und Tourismus GmbH",
      "company_seat": "Stuttgart",
      "details": "11.11.2024 (Bekanntmachungsdatum)\n\nBaden-Württemberg Amtsgericht Stuttgart HRB 16873\nEinreichung neuer Dokumente\n\nRegio Stuttgart Marketing- und Tourismus GmbH\nGesellschaft mit beschränkter Haftung\nStuttgart\n\nDie Gesellschaft hat am 07.11.2024 die Liste über die Zusammensetzung des Aufsichtsrats zum Handelsregister eingereicht."
    },
    {
      "date": "2024-11-11",
      "original_text": "Löschungsankündigung\nBaden-Württemberg Amtsgericht Mannheim HRB 734398\nSLS Immobilien und Wertanlagen GmbH – Pforzheim",
      "type": "Löschungsankündigung",
      "state": "Baden-Württemberg",
      "amtsgericht": "Amtsgericht Mannheim",
      "registernummer": "HRB 734398",
      "registerart": "HRB",
      "company_name": "SLS Immobilien und Wertanlagen GmbH",
      "company_seat": "Pforzheim",
      "details": "11.11.2024 (Bekanntmachungsdatum)\n\nBaden-Württemberg Amtsgericht Mannheim HRB 734398\nLöschungsankündigung\n\nSLS Immobilien und Wertanlagen GmbH\nGesellschaft mit beschränkter Haftung\nPforzheim\n\nDas Gericht beabsichtigt, die Gesellschaft wegen Vermögenslosigkeit im Handelsregister von Amts wegen nach § 394 FamFG zu löschen. Die Frist zur Geltendmachung eines Widerspruchs gegen die beabsichtigte Löschung ist auf einen Monat ab Veröffentlichung bestimmt."
    },
    {
      "date": "2024-11-11",
      "original_text": "Sonstige Registerbekanntmachung\nSachsen Amtsgericht Leipzig HRB 17905\nSaxess AG – Leipzig",
      "type": "Sonstige Registerbekanntmachung",
      "state": "Sachsen",
      "amtsgericht": "Amtsgericht Leipzig",
      "registernummer": "HRB 17905",
      "registerart": "HRB",
      "company_name": "Saxess AG",
      "company_seat": "Leipzig",
      "details": "11.11.2024 (Bekanntmachungsdatum)\n\nSachsen Amtsgericht Leipzig HRB 17905\nSonstige Registerbekanntmachung\n\nSaxess AG\nAktiengesellschaft\nLeipzig\n\nAm 05.11.2024 wurde beim Handelsregister des Amtsgerichts Leipzig die Liste der Mitglieder des Aufsichtsrats gemäß § 106 AktG eingereicht."
    },
    {
      "date": "2024-11-11",
      "original_text": "Sonstige Registerbekanntmachung\nMecklenburg-Vorpommern Amtsgericht Schwerin HRB 1603\nStadtwerke Schwerin GmbH (SWS) – Schwerin",
      "type": "Sonstige Registerbekanntmachung",
      "state": "Mecklenburg-Vorpommern",
      "amtsgericht": "Amtsgericht Schwerin",
      "registernummer": "HRB 1603",
      "registerart": "HRB",
      "company_name": "Stadtwerke Schwerin GmbH (SWS)",
      "company_seat": "Schwerin",
      "details": "11.11.2024 (Bekanntmachungsdatum)\n\nMecklenburg-Vorpommern Amtsgericht Schwerin HRB 1603\nSonstige Registerbekanntmachung 11.11.2024 (Eintragungsdatum)\n\nStadtwerke Schwerin GmbH (SWS)\nGesellschaft mit beschränkter Haftung\nSchwerin\n\nEine Liste der Mitglieder des Aufsichtsrats ist zum Handelsregister eingereicht worden."
    },
    {
      "date": "2024-11-11",
      "original_text": "Einreichung neuer Dokumente\nSachsen-Anhalt Amtsgericht Stendal HRB 382\nStendaler Wohnungsbaugesellschaft mit beschränkter Haftung – Stendal",
      "type": "Einreichung neuer Dokumente",
      "state": "Sachsen-Anhalt",
      "amtsgericht": "Amtsgericht Stendal",
      "registernummer": "HRB 382",
      "registerart": "HRB",
      "company_name": "Stendaler Wohnungsbaugesellschaft mit beschränkter Haftung",
      "company_seat": "Stendal",
      "details": "11.11.2024 (Bekanntmachungsdatum)\n\nSachsen-Anhalt Amtsgericht Stendal HRB 382\nEinreichung neuer Dokumente\n\nStendaler Wohnungsbaugesellschaft mit beschränkter Haftung\nGesellschaft mit beschränkter Haftung\nStendal\n\nEine Liste der Mitglieder des Aufsichtsrates wurde zum Handelsregister eingereicht."
    },
    {
      "date": "2024-11-11",
      "original_text": "Löschungsankündigung\nBaden-Württemberg Amtsgericht Freiburg HRB 724784\nSwissOrganicInternational UG (haftungsbeschränkt) – Lörrach",
      "type": "Löschungsankündigung",
      "state": "Baden-Württemberg",
      "amtsgericht": "Amtsgericht Freiburg",
      "registernummer": "HRB 724784",
      "registerart": "HRB",
      "company_name": "SwissOrganicInternational UG (haftungsbeschränkt)",
      "company_seat": "Lörrach",
      "details": "11.11.2024 (Bekanntmachungsdatum)\n\nBaden-Württemberg Amtsgericht Freiburg HRB 724784\nLöschungsankündigung\n\nSwissOrganicInternational UG (haftungsbeschränkt)\nGesellschaft mit beschränkter Haftung\nLörrach\n\nDas Gericht beabsichtigt, die Gesellschaft wegen Vermögenslosigkeit im Handelsregister von Amts wegen nach § 394 FamFG zu löschen. Die Frist zur Geltendmachung eines Widerspruchs gegen die beabsichtigte Löschung ist auf einen Monat ab Veröffentlichung bestimmt."
    },
    {
      "date": "2024-11-11",
      "original_text": "Registerbekanntmachung nach dem Umwandlungsgesetz\nNordrhein-Westfalen Amtsgericht Bielefeld HRB 42086\nThe Gym GmbH – Bielefeld",
      "type": "Registerbekanntmachung nach dem Umwandlungsgesetz",
      "state": "Nordrhein-Westfalen",
      "amtsgericht": "Amtsgericht Bielefeld",
      "registernummer": "HRB 42086",
      "registerart": "HRB",
      "company_name": "The Gym GmbH",
      "company_seat": "Bielefeld",
      "details": "11.11.2024 (Bekanntmachungsdatum)\n\nNordrhein-Westfalen Amtsgericht Bielefeld HRB 42086\nRegisterbekanntmachung nach dem Umwandlungsgesetz 11.11.2024 (Eintragungsdatum)\n\nThe Gym GmbH\nGesellschaft mit beschränkter Haftung\nBielefeld\n\nDen Gläubigern der an der Verschmelzung beteiligten Rechtsträger ist, wenn sie binnen sechs Monaten nach dem Tag, an dem die Eintragung der Verschmelzung in das Register des Sitzes desjenigen Rechtsträgers, dessen Gläubiger sie sind, nach § 19 Absatz 3 UmwG als bekanntgemacht gilt, ihren Anspruch nach Grund und Höhe schriftlich anmelden, Sicherheit zu leisten, soweit sie nicht Befriedigung verlangen können. Dieses Recht steht den Gläubigern jedoch nur zu, wenn sie glaubhaft machen, dass durch die Verschmelzung die Erfüllung ihrer Forderung gefährdet wird."
    },
    {
      "date": "2024-11-11",
      "original_text": "Löschungsankündigung\nNordrhein-Westfalen Amtsgericht Bad Oeynhausen HRB 3360\nThies Immobiliengesellschaft mbH – Bad Oeynhausen",
      "type": "Löschungsankündigung",
      "state": "Nordrhein-Westfalen",
      "amtsgericht": "Amtsgericht Bad Oeynhausen",
      "registernummer": "HRB 3360",
      "registerart": "HRB",
      "company_name": "Thies Immobiliengesellschaft mbH",
      "company_seat": "Bad Oeynhausen",
      "details": "11.11.2024 (Bekanntmachungsdatum)\n\nNordrhein-Westfalen Amtsgericht Bad Oeynhausen HRB 3360\nLöschungsankündigung\n\nThies Immobiliengesellschaft mbH\nGesellschaft mit beschränkter Haftung\nBad Oeynhausen\n\nDas Registergericht beabsichtigt die Gesellschaft von Amts wegen nach § 394 FamFG zu löschen. Die Frist zur Erhebung eines Widerspruchs ist auf einen Monat festgesetzt."
    },
    {
      "date": "2024-11-11",
      "original_text": "Löschungsankündigung\nNordrhein-Westfalen Amtsgericht Bad Oeynhausen HRB 3360\nThies Immobiliengesellschaft mbH – Bad Oeynhausen",
      "type": "Löschungsankündigung",
      "state": "Nordrhein-Westfalen",
      "amtsgericht": "Amtsgericht Bad Oeynhausen",
      "registernummer": "HRB 3360",
      "registerart": "HRB",
      "company_name": "Thies Immobiliengesellschaft mbH",
      "company_seat": "Bad Oeynhausen",
      "details": "11.11.2024 (Bekanntmachungsdatum)\n\nNordrhein-Westfalen Amtsgericht Bad Oeynhausen HRB 3360\nLöschungsankündigung\n\nThies Immobiliengesellschaft mbH\nGesellschaft mit beschränkter Haftung\nBad Oeynhausen\n\nDas Registergericht beabsichtigt die Gesellschaft von Amts wegen nach § 394 FamFG zu löschen. Die Frist zur Erhebung eines Widerspruchs ist auf einen Monat festgesetzt."
    },
    {
      "date": "2024-11-11",
      "original_text": "Einreichung neuer Dokumente\nRheinland-Pfalz Amtsgericht Koblenz HRB 13990\nThyssenKrupp Rasselstein GmbH – Andernach",
      "type": "Einreichung neuer Dokumente",
      "state": "Rheinland-Pfalz",
      "amtsgericht": "Amtsgericht Koblenz",
      "registernummer": "HRB 13990",
      "registerart": "HRB",
      "company_name": "ThyssenKrupp Rasselstein GmbH",
      "company_seat": "Andernach",
      "details": "11.11.2024 (Bekanntmachungsdatum)\n\nRheinland-Pfalz Amtsgericht Koblenz HRB 13990\nEinreichung neuer Dokumente\n\nThyssenKrupp Rasselstein GmbH\nGesellschaft mit beschränkter Haftung\nAndernach\n\nDem Registergericht ist eine neue Liste der Mitglieder des Aufsichtsrates eingereicht worden."
    },
    {
      "date": "2024-11-11",
      "original_text": "Registerbekanntmachung nach dem Umwandlungsgesetz\nNiedersachsen Amtsgericht Stadthagen HRB 202000\nW.B. Gewerbebau Stadthagen GmbH – Stadthagen",
      "type": "Registerbekanntmachung nach dem Umwandlungsgesetz",
      "state": "Niedersachsen",
      "amtsgericht": "Amtsgericht Stadthagen",
      "registernummer": "HRB 202000",
      "registerart": "HRB",
      "company_name": "W.B. Gewerbebau Stadthagen GmbH",
      "company_seat": "Stadthagen",
      "details": "11.11.2024 (Bekanntmachungsdatum)\n\nNiedersachsen Amtsgericht Stadthagen HRB 202000\nRegisterbekanntmachung nach dem Umwandlungsgesetz 30.10.2024 (Eintragungsdatum)\n\nW.B. Gewerbebau Stadthagen GmbH\nGesellschaft mit beschränkter Haftung\nStadthagen\n\nDen Gläubigern der an der Verschmelzung beteiligten Rechtsträger ist, wenn sie binnen sechs Monaten nach dem Tag, an dem die Eintragung der Verschmelzung in das Register des Sitzes desjenigen Rechtsträgers, dessen Gläubiger sie sind, nach § 19  Abs.  3 UmwG als bekannt gemacht gilt, ihren Anspruch nach Grund und Höhe schriftlich anmelden, Sicherheit zu leisten, soweit sie nicht Befriedigung verlangen können. Dieses Recht steht den Gläubigern jedoch nur zu, wenn sie glaubhaft machen, dass durch die Verschmelzung die Erfüllung der Forderung gefährdet wird."
    },
    {
      "date": "2024-11-11",
      "original_text": "Registerbekanntmachung nach dem Umwandlungsgesetz\nNordrhein-Westfalen Amtsgericht Bad Oeynhausen HRA 9542\nWehrmann GmbH & Co. KG – Hiddenhausen",
      "type": "Registerbekanntmachung nach dem Umwandlungsgesetz",
      "state": "Nordrhein-Westfalen",
      "amtsgericht": "Amtsgericht Bad Oeynhausen",
      "registernummer": "HRA 9542",
      "registerart": "HRA",
      "company_name": "Wehrmann GmbH & Co. KG",
      "company_seat": "Hiddenhausen",
      "details": "11.11.2024 (Bekanntmachungsdatum)\n\nNordrhein-Westfalen Amtsgericht Bad Oeynhausen HRA 9542\nRegisterbekanntmachung nach dem Umwandlungsgesetz 11.11.2024 (Eintragungsdatum)\n\nWehrmann GmbH & Co. KG\nKommanditgesellschaft\nHiddenhausen\n\nDen Gläubigern der an der Verschmelzung beteiligten Rechtsträger ist, wenn sie binnen sechs Monaten nach dem Tag, an dem die Eintragung der Verschmelzung in das Register des Sitzes desjenigen Rechtsträgers, dessen Gläubiger sie sind, nach § 19 Absatz 3 UmwG als bekanntgemacht gilt, ihren Anspruch nach Grund und Höhe schriftlich anmelden, Sicherheit zu leisten, soweit sie nicht Befriedigung verlangen können. Dieses Recht steht den Gläubigern jedoch nur zu, wenn sie glaubhaft machen, dass durch die Verschmelzung die Erfüllung ihrer Forderung gefährdet wird."
    },
    {
      "date": "2024-11-11",
      "original_text": "Registerbekanntmachung nach dem Umwandlungsgesetz\nNiedersachsen Amtsgericht Göttingen HRA 202219\nWenig - Schirutschke OHG – Göttingen",
      "type": "Registerbekanntmachung nach dem Umwandlungsgesetz",
      "state": "Niedersachsen",
      "amtsgericht": "Amtsgericht Göttingen",
      "registernummer": "HRA 202219",
      "registerart": "HRA",
      "company_name": "Wenig - Schirutschke OHG",
      "company_seat": "Göttingen",
      "details": "11.11.2024 (Bekanntmachungsdatum)\n\nNiedersachsen Amtsgericht Göttingen HRA 202219\nRegisterbekanntmachung nach dem Umwandlungsgesetz 11.11.2024 (Eintragungsdatum)\n\nWenig - Schirutschke OHG\nOffene Handelsgesellschaft\nGöttingen\n\nDen Gläubigern der an der Ausgliederung beteiligten Rechtsträger ist, wenn sie binnen sechs Monaten nach dem Tag, an dem die Eintragung der Ausgliederung in das Register des Sitzes desjenigen Rechtsträgers, dessen Gläubiger sie sind, nach § 19 Abs. 3 UmwG als bekannt gemacht gilt, ihren Anspruch nach Grund und Höhe schriftlich anmelden, Sicherheit zu leisten, soweit sie nicht Befriedigung verlangen können. Dieses Recht steht den Gläubigern jedoch nur zu, wenn sie glaubhaft machen, dass durch die Ausgliederung die Erfüllung der Forderung gefährdet wird."
    },
    {
      "date": "2024-11-11",
      "original_text": "Registerbekanntmachung nach dem Umwandlungsgesetz\nNordrhein-Westfalen Amtsgericht Paderborn HRB 11572\nWestfalen Weser Netz GmbH – Paderborn",
      "type": "Registerbekanntmachung nach dem Umwandlungsgesetz",
      "state": "Nordrhein-Westfalen",
      "amtsgericht": "Amtsgericht Paderborn",
      "registernummer": "HRB 11572",
      "registerart": "HRB",
      "company_name": "Westfalen Weser Netz GmbH",
      "company_seat": "Paderborn",
      "details": "11.11.2024 (Bekanntmachungsdatum)\n\nNordrhein-Westfalen Amtsgericht Paderborn HRB 11572\nRegisterbekanntmachung nach dem Umwandlungsgesetz 11.11.2024 (Eintragungsdatum)\n\nWestfalen Weser Netz GmbH\nGesellschaft mit beschränkter Haftung\nPaderborn\n\nDen Gläubigern der an der Abspaltung beteiligten Rechtsträger ist, wenn sie binnen sechs Monaten nach dem Tag, an dem die Eintragung der Abspaltung in das Register des Sitzes desjenigen Rechtsträgers, dessen Gläubiger sie sind, nach § 19 Absatz 3 UmwG als bekanntgemacht gilt, ihren Anspruch nach Grund und Höhe schriftlich anmelden, Sicherheit zu leisten, soweit sie nicht Befriedigung verlangen können. Dieses Recht steht den Gläubigern jedoch nur zu, wenn sie glaubhaft machen, dass durch die Abspaltung die Erfüllung ihrer Forderung gefährdet wird."
    },
    {
      "date": "2024-11-11",
      "original_text": "Sonstige Registerbekanntmachung\nThüringen Amtsgericht Jena HRB 517216\ne:tec Pohle GmbH – Schmölln",
      "type": "Sonstige Registerbekanntmachung",
      "state": "Thüringen",
      "amtsgericht": "Amtsgericht Jena",
      "registernummer": "HRB 517216",
      "registerart": "HRB",
      "company_name": "e:tec Pohle GmbH",
      "company_seat": "Schmölln",
      "details": "11.11.2024 (Bekanntmachungsdatum)\n\nThüringen Amtsgericht Jena HRB 517216\nSonstige Registerbekanntmachung 11.11.2024 (Eintragungsdatum)\n\ne:tec Pohle GmbH\nGesellschaft mit beschränkter Haftung\nSchmölln\n\nNicht eingetragen: Den Gläubigern der Gesellschaft, deren Forderungen begründet worden sind, bevor die Eintragung der Beendigung des Vertrages in das Handelsregister nach § 10 des Handelsgesetzbuches als bekanntgemacht gilt, hat der andere Vertragsteil Sicherheit zu leisten, wenn sie sich binnen sechs Monaten nach der Bekanntmachung der Eintragung zu diesem Zweck bei ihm melden."
    },
    {
      "date": "2024-11-11",
      "original_text": "Einreichung neuer Dokumente\nNiedersachsen Amtsgericht Braunschweig HRB 206337\nrealkapital Mittelstand KGaA – Braunschweig",
      "type": "Einreichung neuer Dokumente",
      "state": "Niedersachsen",
      "amtsgericht": "Amtsgericht Braunschweig",
      "registernummer": "HRB 206337",
      "registerart": "HRB",
      "company_name": "realkapital Mittelstand KGaA",
      "company_seat": "Braunschweig",
      "details": "11.11.2024 (Bekanntmachungsdatum)\n\nNiedersachsen Amtsgericht Braunschweig HRB 206337\nEinreichung neuer Dokumente\n\nrealkapital Mittelstand KGaA\nKommanditgesellschaft auf Aktien\nBraunschweig\n\nDie aktuelle Liste der Mitglieder des Aufsichtsrats wurde beim Registergericht eingereicht."
    },
    {
      "date": "2024-11-11",
      "original_text": "Registerbekanntmachung nach dem Umwandlungsgesetz\nNiedersachsen Amtsgericht Lüneburg HRB 207688\nresidenzidee Verwaltungs GmbH – Celle",
      "type": "Registerbekanntmachung nach dem Umwandlungsgesetz",
      "state": "Niedersachsen",
      "amtsgericht": "Amtsgericht Lüneburg",
      "registernummer": "HRB 207688",
      "registerart": "HRB",
      "company_name": "residenzidee Verwaltungs GmbH",
      "company_seat": "Celle",
      "details": "11.11.2024 (Bekanntmachungsdatum)\n\nNiedersachsen Amtsgericht Lüneburg HRB 207688\nRegisterbekanntmachung nach dem Umwandlungsgesetz 11.11.2024 (Eintragungsdatum)\n\nresidenzidee Verwaltungs GmbH\nGesellschaft mit beschränkter Haftung\nCelle\n\nDen Gläubigern der an der Verschmelzung beteiligten Rechtsträger ist, wenn sie binnen sechs Monaten nach dem Tag, an dem die Eintragung der Verschmelzung in das Register des Sitzes desjenigen Rechtsträgers, dessen Gläubiger sie sind, nach § 19  Abs.  3 UmwG als bekannt gemacht gilt, ihren Anspruch nach Grund und Höhe schriftlich anmelden, Sicherheit zu leisten, soweit sie nicht Befriedigung verlangen können. Dieses Recht steht den Gläubigern jedoch nur zu, wenn sie glaubhaft machen, dass durch die Verschmelzung die Erfüllung der Forderung gefährdet wird."
    },
    {
      "date": "2024-11-11",
      "original_text": "Registerbekanntmachung nach dem Umwandlungsgesetz\nBaden-Württemberg Amtsgericht Stuttgart HRB 737796\nviastore International GmbH – Stuttgart",
      "type": "Registerbekanntmachung nach dem Umwandlungsgesetz",
      "state": "Baden-Württemberg",
      "amtsgericht": "Amtsgericht Stuttgart",
      "registernummer": "HRB 737796",
      "registerart": "HRB",
      "company_name": "viastore International GmbH",
      "company_seat": "Stuttgart",
      "details": "11.11.2024 (Bekanntmachungsdatum)\n\nBaden-Württemberg Amtsgericht Stuttgart HRB 737796\nRegisterbekanntmachung nach dem Umwandlungsgesetz 11.11.2024 (Eintragungsdatum)\n\nviastore International GmbH\nGesellschaft mit beschränkter Haftung\nStuttgart\n\nDen Gläubigern der an der Verschmelzung beteiligten Rechtsträger ist, wenn sie binnen sechs Monaten nach dem Tag, an dem die Eintragung der Verschmelzung in das Register des Sitzes desjenigen Rechtsträgers, dessen Gläubiger sie sind, nach § 19 Abs. 3 UmwG als bekanntgemacht gilt, ihren Anspruch nach Grund und Höhe schriftlich anmelden, Sicherheit zu leisten, soweit sie nicht Befriedigung verlangen können. Dieses Recht steht den Gläubigern jedoch nur zu, wenn sie glaubhaft machen, dass durch die Verschmelzung die Erfüllung ihrer Forderung gefährdet wird."
    },
    {
      "date": "2024-11-11",
      "original_text": "Registerbekanntmachung nach dem Umwandlungsgesetz\nBaden-Württemberg Amtsgericht Stuttgart HRB 741907\nviastore SOFTWARE GmbH – Stuttgart",
      "type": "Registerbekanntmachung nach dem Umwandlungsgesetz",
      "state": "Baden-Württemberg",
      "amtsgericht": "Amtsgericht Stuttgart",
      "registernummer": "HRB 741907",
      "registerart": "HRB",
      "company_name": "viastore SOFTWARE GmbH",
      "company_seat": "Stuttgart",
      "details": "11.11.2024 (Bekanntmachungsdatum)\n\nBaden-Württemberg Amtsgericht Stuttgart HRB 741907\nRegisterbekanntmachung nach dem Umwandlungsgesetz 11.11.2024 (Eintragungsdatum)\n\nviastore SOFTWARE GmbH\nGesellschaft mit beschränkter Haftung\nStuttgart\n\nAls nicht eingetragen wird bekanntgemacht:\nDen Gläubigern der an der Verschmelzung beteiligten Rechtsträger ist, wenn sie binnen sechs Monaten nach dem Tag, an dem die Eintragung der Verschmelzung in das Register des Sitzes desjenigen Rechtsträgers, dessen Gläubiger sie sind, nach § 19 Abs. 3 UmwG als bekanntgemacht gilt, ihren Anspruch nach Grund und Höhe schriftlich anmelden, Sicherheit zu leisten, soweit sie nicht Befriedigung verlangen können. Dieses Recht steht den Gläubigern jedoch nur zu, wenn sie glaubhaft machen, dass durch die Verschmelzung die Erfüllung ihrer Forderung gefährdet wird."
    },
    {
      "date": "2024-11-11",
      "original_text": "Registerbekanntmachung nach dem Umwandlungsgesetz\nBaden-Württemberg Amtsgericht Stuttgart PR 721176\nÄrztliche Partnerschaftsgesellschaft Medizinisches Versorgungszentrum Schelztor-Klinik Esslingen Dr. Wolfram Reithmeier und Dr. Rainer Seiz – Esslingen am Neckar",
      "type": "Registerbekanntmachung nach dem Umwandlungsgesetz",
      "state": "Baden-Württemberg",
      "amtsgericht": "Amtsgericht Stuttgart",
      "registernummer": "PR 721176",
      "registerart": "PR",
      "company_name": "Ärztliche Partnerschaftsgesellschaft Medizinisches Versorgungszentrum Schelztor-Klinik Esslingen Dr. Wolfram Reithmeier und Dr. Rainer Seiz",
      "company_seat": "Esslingen am Neckar",
      "details": "11.11.2024 (Bekanntmachungsdatum)\n\nBaden-Württemberg Amtsgericht Stuttgart PR 721176\nRegisterbekanntmachung nach dem Umwandlungsgesetz 11.11.2024 (Eintragungsdatum)\n\nÄrztliche Partnerschaftsgesellschaft Medizinisches Versorgungszentrum Schelztor-Klinik Esslingen Dr. Wolfram Reithmeier und Dr. Rainer Seiz\nPartnerschaftsgesellschaft\nEsslingen am Neckar\n\nDen Gläubigern des an dem Formwechsel beteiligten Rechtsträgers ist, wenn sie binnen sechs Monaten nach dem Tag, an dem die Eintragung des Formwechsels in das Register des Sitzes desjenigen Rechtsträgers, dessen Gläubiger sie sind, nach § 19 Abs. 3 UmwG als bekanntgemacht gilt, ihren Anspruch nach Grund und Höhe schriftlich anmelden, Sicherheit zu leisten, soweit sie nicht Befriedigung verlangen können. Dieses Recht steht den Gläubigern jedoch nur zu, wenn sie glaubhaft machen, dass durch den Formwechsel die Erfüllung ihrer Forderung gefährdet wird."
    }
  ]
}