{
  "date": "2024-11-18",
  "date_of_scrape": "2024-11-30T13:11:00.378Z",
  "tool_version": "0.2.0",
  "number_of_announcements": 135,
  "announcements": [
    {
      "date": "2024-11-18",
      "id": "93736",
      "original_text": "Registerbekanntmachung nach dem Umwandlungsgesetz\nSaarland Amtsgericht Saarbrücken HRA 13530\n\"Café Ausblick\" e.K. – Saarlouis",
      "type": "Registerbekanntmachung nach dem Umwandlungsgesetz",
      "state": "Saarland",
      "amtsgericht": "Amtsgericht Saarbrücken",
      "registernummer": "HRA 13530",
      "registerart": "HRA",
      "company_name": "\"Café Ausblick\" e.K.",
      "company_seat": "Saarlouis",
      "details": "18.11.2024 (Bekanntmachungsdatum)\n\nSaarland Amtsgericht Saarbrücken HRA 13530\nRegisterbekanntmachung nach dem Umwandlungsgesetz 18.11.2024 (Eintragungsdatum)\n\n\"Café Ausblick\" e.K.\nEinzelkaufmann / Einzelkauffrau\nSaarlouis\n\nAls nicht eingetragen wird bekannt gemacht: Den Gläubigern der an der Verschmelzung beteiligten Gesellschaften ist, wenn sie binnen sechs Monaten nach dem Tag, an dem die Eintragung der Verschmelzung in das Register des Sitzes desjenigen Rechtsträgers, dessen Gläubiger sie sind, nach § 19 Absatz 3 UmwG bekannt gemacht worden ist, ihren Anspruch nach Grund und Höhe schriftlich anmelden, Sicherheit zu leisten, soweit sie nicht Befriedigung verlangen können. Dieses Recht steht den Gläubigern jedoch nur zu, wenn sie glaubhaft machen, dass durch die Verschmelzung die Erfüllung ihrer Forderung gefährdet wird."
    },
    {
      "date": "2024-11-18",
      "id": "93845",
      "original_text": "Sonstige Registerbekanntmachung\nHessen Amtsgericht Kassel VR 3150\n\"Cool tour\" Kultur und Tourismus in der Gemeinde Helsa – Helsa",
      "type": "Sonstige Registerbekanntmachung",
      "state": "Hessen",
      "amtsgericht": "Amtsgericht Kassel",
      "registernummer": "VR 3150",
      "registerart": "VR",
      "company_name": "\"Cool tour\" Kultur und Tourismus in der Gemeinde Helsa",
      "company_seat": "Helsa",
      "details": "18.11.2024 (Bekanntmachungsdatum)\n\nHessen Amtsgericht Kassel VR 3150\nSonstige Registerbekanntmachung 18.11.2024 (Eintragungsdatum)\n\n\"Cool tour\" Kultur und Tourismus in der Gemeinde Helsa\neingetragener Verein\nHelsa\n\nDer Verein ist aufgelöst."
    },
    {
      "date": "2024-11-18",
      "id": "93807",
      "original_text": "Löschungsankündigung\nBremen Amtsgericht Bremen HRA 27377\n1. SAM Service GmbH & Co. KG – Bremen",
      "type": "Löschungsankündigung",
      "state": "Bremen",
      "amtsgericht": "Amtsgericht Bremen",
      "registernummer": "HRA 27377",
      "registerart": "HRA",
      "company_name": "1. SAM Service GmbH & Co. KG",
      "company_seat": "Bremen",
      "details": "18.11.2024 (Bekanntmachungsdatum)\n\nBremen Amtsgericht Bremen HRA 27377\nLöschungsankündigung\n\n1. SAM Service GmbH & Co. KG\nKommanditgesellschaft\nBremen\n\nEs ist beabsichtigt die im Handelsregister eingetragene Gesellschaft von Amts wegen gemäß § 394 FamFG zu löschen. Gegen die Löschung kann beim AG Bremen schriftlich oder zu Protokoll der Geschäftsstelle Widerspruch eingelegt werden. Widerspruchsfrist 4 Wochen."
    },
    {
      "date": "2024-11-18",
      "id": "93808",
      "original_text": "Löschungsankündigung\nBremen Amtsgericht Bremen HRB 32616\nA1-Autovermietung GmbH – Bremen",
      "type": "Löschungsankündigung",
      "state": "Bremen",
      "amtsgericht": "Amtsgericht Bremen",
      "registernummer": "HRB 32616",
      "registerart": "HRB",
      "company_name": "A1-Autovermietung GmbH",
      "company_seat": "Bremen",
      "details": "18.11.2024 (Bekanntmachungsdatum)\n\nBremen Amtsgericht Bremen HRB 32616\nLöschungsankündigung\n\nA1-Autovermietung GmbH\nGesellschaft mit beschränkter Haftung\nBremen\n\nEs ist beabsichtigt die im Handelsregister eingetragene Gesellschaft von Amts wegen gemäß § 394 FamFG zu löschen. Gegen die Löschung kann beim AG Bremen schriftlich oder zu Protokoll der Geschäftsstelle Widerspruch eingelegt werden. Widerspruchsfrist 4 Wochen."
    },
    {
      "date": "2024-11-18",
      "id": "93803",
      "original_text": "Einreichung neuer Dokumente\nRheinland-Pfalz Amtsgericht Mainz HRB 50443\nALDI Bingen Verwaltungs-SE – Bingen am Rhein",
      "type": "Einreichung neuer Dokumente",
      "state": "Rheinland-Pfalz",
      "amtsgericht": "Amtsgericht Mainz",
      "registernummer": "HRB 50443",
      "registerart": "HRB",
      "company_name": "ALDI Bingen Verwaltungs-SE",
      "company_seat": "Bingen am Rhein",
      "details": "18.11.2024 (Bekanntmachungsdatum)\n\nRheinland-Pfalz Amtsgericht Mainz HRB 50443\nEinreichung neuer Dokumente\n\nALDI Bingen Verwaltungs-SE\nEuropäische Aktiengesellschaft (SE)\nBingen am Rhein\n\nDem Registergericht ist eine Liste der Mitglieder des Verwaltungsrates eingereicht worden."
    },
    {
      "date": "2024-11-18",
      "id": "93812",
      "original_text": "Registerbekanntmachung nach dem Umwandlungsgesetz\nBremen Amtsgericht Bremen HRB 29977\nARTDOCKS GmbH – Bremen",
      "type": "Registerbekanntmachung nach dem Umwandlungsgesetz",
      "state": "Bremen",
      "amtsgericht": "Amtsgericht Bremen",
      "registernummer": "HRB 29977",
      "registerart": "HRB",
      "company_name": "ARTDOCKS GmbH",
      "company_seat": "Bremen",
      "details": "18.11.2024 (Bekanntmachungsdatum)\n\nBremen Amtsgericht Bremen HRB 29977\nRegisterbekanntmachung nach dem Umwandlungsgesetz 18.11.2024 (Eintragungsdatum)\n\nARTDOCKS GmbH\nGesellschaft mit beschränkter Haftung\nBremen\n\nZu Eintragungsnummer 3 vom 18.11.2024 wird als nicht eingetragen veröffentlicht:  Den Gläubigern der an der Verschmelzung beteiligten Rechtsträger ist, wenn sie binnen sechs Monaten nach dem Tag, an dem die Eintragung der Verschmelzung in das Register des Sitzes desjenigen Rechtsträgers, dessen Gläubiger sie sind, als bekannt gemacht gilt, ihren Anspruch nach Grund und Höhe schriftlich anmelden, Sicherheit zu leisten, soweit sie nicht Befriedigung verlangen können. Dieses Recht steht den Gläubigern jedoch nur zu, wenn sie glaubhaft machen, dass durch die Verschmelzung die Erfüllung ihrer Forderung gefährdet wird. Das Recht, Sicherheitsleistung zu verlangen, steht Gläubigern nicht zu, die im Falle der Insolvenz ein Recht auf vorzugsweise Befriedigung aus einer Deckungsmasse haben, die nach gesetzlicher Vorschrift zu ihrem Schutz errichtet und staatlich überwacht ist."
    },
    {
      "date": "2024-11-18",
      "id": "93743",
      "original_text": "Löschungsankündigung\nSchleswig-Holstein Amtsgericht Lübeck HRB 2747 RE\nAUDIT CONSULT Bergemann & Lamp GmbH Steuerberatungsgesellschaft – Reinbek",
      "type": "Löschungsankündigung",
      "state": "Schleswig-Holstein",
      "amtsgericht": "Amtsgericht Lübeck",
      "registernummer": "HRB 2747 RE",
      "registerart": "HRB",
      "company_name": "AUDIT CONSULT Bergemann & Lamp GmbH Steuerberatungsgesellschaft",
      "company_seat": "Reinbek",
      "details": "18.11.2024 (Bekanntmachungsdatum)\n\nSchleswig-Holstein Amtsgericht Lübeck HRB 2747 RE\nLöschungsankündigung\n\nAUDIT CONSULT Bergemann & Lamp GmbH Steuerberatungsgesellschaft\nGesellschaft mit beschränkter Haftung\nReinbek\n\nEs ist die Löschung der nachstehenden Gesellschaft wegen Vermögenslosigkeit gemäß § 394 FamFG beabsichtigt. Widerspruchsfrist: 1 Monat."
    },
    {
      "date": "2024-11-18",
      "id": "93746",
      "original_text": "Löschungsankündigung\nSaarland Amtsgericht Saarbrücken HRB 7963\nAWT Wirtschafts-Treuhand GmbH – Saarbrücken",
      "type": "Löschungsankündigung",
      "state": "Saarland",
      "amtsgericht": "Amtsgericht Saarbrücken",
      "registernummer": "HRB 7963",
      "registerart": "HRB",
      "company_name": "AWT Wirtschafts-Treuhand GmbH",
      "company_seat": "Saarbrücken",
      "details": "18.11.2024 (Bekanntmachungsdatum)\n\nSaarland Amtsgericht Saarbrücken HRB 7963\nLöschungsankündigung\n\nAWT Wirtschafts-Treuhand GmbH\nGesellschaft mit beschränkter Haftung\nSaarbrücken\n\nEs ist beabsichtigt, die Gesellschaft von Amts wegen gemäß § 394 FamFG wegen Vermögenslosigkeit zu löschen. Gegen die Löschung von Amts wegen ist das Rechtsmittel des Widerspruchs statthaft. Der Widerspruch ist binnen einer Frist von 2 Monaten beginnend mit dem Tag dieser Veröffentlichung durch Einreichen eines Widerspruchsschreibens -schriftlich oder zur Niederschrift der Geschäftsstelle- beim Amtsgericht Saarbrücken, -zentrales Handelsregister-, Mainzerstr.178, 66121 Saarbrücken einzulegen. Der Widerspruch muss die Bezeichnung der angefochtenen Löschungsankündigung enthalten sowie die Erklärung, dass Widerspruch eingelegt wird. Er ist vom Widerspruchsführer oder seinem Bevollmächtigten zu unterzeichnen."
    },
    {
      "date": "2024-11-18",
      "id": "93839",
      "original_text": "Registerbekanntmachung nach dem Umwandlungsgesetz\nNordrhein-Westfalen Amtsgericht Aachen HRB 26177\nAccedora Beteiligungsgesellschaft mbH – Aachen",
      "type": "Registerbekanntmachung nach dem Umwandlungsgesetz",
      "state": "Nordrhein-Westfalen",
      "amtsgericht": "Amtsgericht Aachen",
      "registernummer": "HRB 26177",
      "registerart": "HRB",
      "company_name": "Accedora Beteiligungsgesellschaft mbH",
      "company_seat": "Aachen",
      "details": "18.11.2024 (Bekanntmachungsdatum)\n\nNordrhein-Westfalen Amtsgericht Aachen HRB 26177\nRegisterbekanntmachung nach dem Umwandlungsgesetz 18.11.2024 (Eintragungsdatum)\n\nAccedora Beteiligungsgesellschaft mbH\nGesellschaft mit beschränkter Haftung\nAachen\n\nDen Gläubigern der an der formwechselnden Umwandlung beteiligten Rechtsträger ist, wenn sie binnen sechs Monaten nach dem Tag, an dem die Eintragung der formwechselnden Umwandlung in das Register des Sitzes desjenigen Rechtsträgers, dessen Gläubiger sie sind, nach § 19 Absatz 3 UmwG als bekanntgemacht gilt, ihren Anspruch nach Grund und Höhe schriftlich anmelden, Sicherheit zu leisten, soweit sie nicht Befriedigung verlangen können. Dieses Recht steht den Gläubigern jedoch nur zu, wenn sie glaubhaft machen, dass durch die formwechselnden Umwandlung die Erfüllung ihrer Forderung gefährdet wird."
    },
    {
      "date": "2024-11-18",
      "id": "93847",
      "original_text": "Registerbekanntmachung nach dem Umwandlungsgesetz\nHessen Amtsgericht Darmstadt HRA 87585\nAndreas Gobst e.K. – Münster",
      "type": "Registerbekanntmachung nach dem Umwandlungsgesetz",
      "state": "Hessen",
      "amtsgericht": "Amtsgericht Darmstadt",
      "registernummer": "HRA 87585",
      "registerart": "HRA",
      "company_name": "Andreas Gobst e.K.",
      "company_seat": "Münster",
      "details": "18.11.2024 (Bekanntmachungsdatum)\n\nHessen Amtsgericht Darmstadt HRA 87585\nRegisterbekanntmachung nach dem Umwandlungsgesetz 18.11.2024 (Eintragungsdatum)\n\nAndreas Gobst e.K.\nEinzelkaufmann / Einzelkauffrau\nMünster\n\nDen Gläubigern der an der Ausgliederung beteiligten Rechtsträger ist, wenn sie binnen sechs Monaten nach dem Tag, an dem die Eintragung der Ausgliederung in das Register des Sitzes derjenigen Rechtsträger deren Gläubiger sie sind, nach §§ 125, 19 Absatz 3 UmwG bekannt gemacht worden ist, ihren Anspruch nach Grund und Höhe schriftlich anmelden, Sicherheit zu leisten, soweit sie nicht Befriedigung verlangen können. Dieses Recht steht den Gläubigern jedoch nur zu, wenn sie glaubhaft machen, dass durch die Ausgliederung die Erfüllung ihrer Forderung gefährdet wird."
    },
    {
      "date": "2024-11-18",
      "id": "93729",
      "original_text": "Löschungsankündigung\nBerlin Amtsgericht Berlin (Charlottenburg) HRB 227324\nArba Bauleistung GmbH – Berlin",
      "type": "Löschungsankündigung",
      "state": "Berlin",
      "amtsgericht": "Amtsgericht Berlin (Charlottenburg)",
      "registernummer": "HRB 227324",
      "registerart": "HRB",
      "company_name": "Arba Bauleistung GmbH",
      "company_seat": "Berlin",
      "details": "18.11.2024 (Bekanntmachungsdatum)\n\nBerlin Amtsgericht Berlin (Charlottenburg) HRB 227324\nLöschungsankündigung\n\nArba Bauleistung GmbH\nGesellschaft mit beschränkter Haftung\nBerlin\n\nBei der nachstehenden Gesellschaft wird das Amtslöschungsverfahren gemäß § 394 FamFG eingeleitet. Widerspruchsfrist 6 Wochen"
    },
    {
      "date": "2024-11-18",
      "id": "93782",
      "original_text": "Registerbekanntmachung nach dem Umwandlungsgesetz\nBrandenburg Amtsgericht Frankfurt/Oder HRB 20141\nArtprojekt Bauvorhaben Saarow Zentrum GmbH – Bad Saarow",
      "type": "Registerbekanntmachung nach dem Umwandlungsgesetz",
      "state": "Brandenburg",
      "amtsgericht": "Amtsgericht Frankfurt/Oder",
      "registernummer": "HRB 20141",
      "registerart": "HRB",
      "company_name": "Artprojekt Bauvorhaben Saarow Zentrum GmbH",
      "company_seat": "Bad Saarow",
      "details": "18.11.2024 (Bekanntmachungsdatum)\n\nBrandenburg Amtsgericht Frankfurt/Oder HRB 20141\nRegisterbekanntmachung nach dem Umwandlungsgesetz 15.11.2024 (Eintragungsdatum)\n\nArtprojekt Bauvorhaben Saarow Zentrum GmbH\nGesellschaft mit beschränkter Haftung\nBad Saarow\n\nZu Eintragungsnummer 5 vom 15.11.2024 wird als nicht eingetragen veröffentlicht: Als nicht eingetragen wird veröffentlicht:\nDen Gläubigern der an der Verschmelzung beteiligten Rechtsträger ist, wenn sie binnen sechs Monaten nach dem Tag, an dem die Eintragung der Verschmelzung in das Register des Sitzes desjenigen Rechtsträgers, dessen Gläubiger sie sind, als bekannt gemacht gilt, ihren Anspruch nach Grund und Höhe schriftlich anmelden, Sicherheit zu leisten, soweit sie nicht Befriedigung verlangen können. Dieses Recht steht den Gläubigern jedoch nur zu, wenn sie glaubhaft machen, dass durch die Verschmelzung die Erfüllung ihrer Forderung gefährdet wird"
    },
    {
      "date": "2024-11-18",
      "id": "93852",
      "original_text": "Löschungsankündigung\nHessen Amtsgericht Frankfurt am Main HRB 92966\nAtlas Dienstleistungs GmbH – Frankfurt am Main",
      "type": "Löschungsankündigung",
      "state": "Hessen",
      "amtsgericht": "Amtsgericht Frankfurt am Main",
      "registernummer": "HRB 92966",
      "registerart": "HRB",
      "company_name": "Atlas Dienstleistungs GmbH",
      "company_seat": "Frankfurt am Main",
      "details": "18.11.2024 (Bekanntmachungsdatum)\n\nHessen Amtsgericht Frankfurt am Main HRB 92966\nLöschungsankündigung\n\nAtlas Dienstleistungs GmbH\nGesellschaft mit beschränkter Haftung\nFrankfurt am Main\n\nDas Registergericht beabsichtigt die im Handelsregister eingetragene Gesellschaft von Amts wegen nach § 394 FamFG zu löschen. Die Frist zur Erhebung eines Widerspruchs gegen die beabsichtigte Löschung wird auf 3 Monate festgesetzt."
    },
    {
      "date": "2024-11-18",
      "id": "93851",
      "original_text": "Registerbekanntmachung nach dem Umwandlungsgesetz\nHessen Amtsgericht Darmstadt HRB 91957\nAvaloq Services Deutschland GmbH – Rüsselsheim",
      "type": "Registerbekanntmachung nach dem Umwandlungsgesetz",
      "state": "Hessen",
      "amtsgericht": "Amtsgericht Darmstadt",
      "registernummer": "HRB 91957",
      "registerart": "HRB",
      "company_name": "Avaloq Services Deutschland GmbH",
      "company_seat": "Rüsselsheim",
      "details": "18.11.2024 (Bekanntmachungsdatum)\n\nHessen Amtsgericht Darmstadt HRB 91957\nRegisterbekanntmachung nach dem Umwandlungsgesetz 18.11.2024 (Eintragungsdatum)\n\nAvaloq Services Deutschland GmbH\nGesellschaft mit beschränkter Haftung\nRüsselsheim\n\nDen Gläubigern der an der Verschmelzung beteiligten Rechtsträger ist, wenn sie binnen sechs Monaten nach dem Tag, an dem die Eintragung der Verschmelzung in das Register des Sitzes derjenigen Rechtsträger deren Gläubiger sie sind, nach § 19 Absatz 3 UmwG bekannt gemacht worden ist, ihren Anspruch nach Grund und Höhe schriftlich anmelden, Sicherheit zu leisten, soweit sie nicht Befriedigung verlangen können. Dieses Recht steht den Gläubigern jedoch nur zu, wenn sie glaubhaft machen, dass durch die Verschmelzung die Erfüllung ihrer Forderung gefährdet wird."
    },
    {
      "date": "2024-11-18",
      "id": "93835",
      "original_text": "Sonstige Registerbekanntmachung\nNordrhein-Westfalen Amtsgericht Dortmund GnR 470\nBank für Kirche und Diakonie eG - KD-Bank – Dortmund",
      "type": "Sonstige Registerbekanntmachung",
      "state": "Nordrhein-Westfalen",
      "amtsgericht": "Amtsgericht Dortmund",
      "registernummer": "GnR 470",
      "registerart": "GnR",
      "company_name": "Bank für Kirche und Diakonie eG - KD-Bank",
      "company_seat": "Dortmund",
      "details": "18.11.2024 (Bekanntmachungsdatum)\n\nNordrhein-Westfalen Amtsgericht Dortmund GnR 470\nSonstige Registerbekanntmachung 18.11.2024 (Eintragungsdatum)\n\nBank für Kirche und Diakonie eG - KD-Bank\neingetragene Genossenschaft\nDortmund\n\nAls nicht eingetragen wird veröffentlicht: Den Gläubigern der Genossenschaft ist gemäß § 22 GenG, wenn sie sich binnen sechs Monaten nach der Bekanntmachung bei der Genossenschaft  zu diesem Zweck  melden, Sicherheit zu leisten, soweit sie nicht Befriedigung verlangen können."
    },
    {
      "date": "2024-11-18",
      "id": "93821",
      "original_text": "Sonstige Registerbekanntmachung\nNordrhein-Westfalen Amtsgericht Düsseldorf HRB 91551\nBasha Dienstleistungen GmbH – Düsseldorf",
      "type": "Sonstige Registerbekanntmachung",
      "state": "Nordrhein-Westfalen",
      "amtsgericht": "Amtsgericht Düsseldorf",
      "registernummer": "HRB 91551",
      "registerart": "HRB",
      "company_name": "Basha Dienstleistungen GmbH",
      "company_seat": "Düsseldorf",
      "details": "18.11.2024 (Bekanntmachungsdatum)\n\nNordrhein-Westfalen Amtsgericht Düsseldorf HRB 91551\nSonstige Registerbekanntmachung 18.11.2024 (Eintragungsdatum)\n\nBasha Dienstleistungen GmbH\nGesellschaft mit beschränkter Haftung\nDüsseldorf\n\nDie Gesellschaft ist aufgelöst. Von Amts wegen eingetragen."
    },
    {
      "date": "2024-11-18",
      "id": "93802",
      "original_text": "Einreichung neuer Dokumente\nNiedersachsen Amtsgericht Braunschweig HRB 205934\nBornemann AG – Goslar",
      "type": "Einreichung neuer Dokumente",
      "state": "Niedersachsen",
      "amtsgericht": "Amtsgericht Braunschweig",
      "registernummer": "HRB 205934",
      "registerart": "HRB",
      "company_name": "Bornemann AG",
      "company_seat": "Goslar",
      "details": "18.11.2024 (Bekanntmachungsdatum)\n\nNiedersachsen Amtsgericht Braunschweig HRB 205934\nEinreichung neuer Dokumente\n\nBornemann AG\nAktiengesellschaft\nGoslar\n\nDie Liste der Mitglieder des Aufsichtsrats wurde beim Registergericht eingereicht."
    },
    {
      "date": "2024-11-18",
      "id": "93783",
      "original_text": "Einreichung neuer Dokumente\nSachsen Amtsgericht Leipzig HRB 36766\nBreitband GmbH Landkreis Leipzig – Borna",
      "type": "Einreichung neuer Dokumente",
      "state": "Sachsen",
      "amtsgericht": "Amtsgericht Leipzig",
      "registernummer": "HRB 36766",
      "registerart": "HRB",
      "company_name": "Breitband GmbH Landkreis Leipzig",
      "company_seat": "Borna",
      "details": "18.11.2024 (Bekanntmachungsdatum)\n\nSachsen Amtsgericht Leipzig HRB 36766\nEinreichung neuer Dokumente\n\nBreitband GmbH Landkreis Leipzig\nGesellschaft mit beschränkter Haftung\nBorna\n\nAm 15.11.2024 wurde beim Handelsregister des Amtsgerichts Leipzig die Liste der Mitglieder des Aufsichtsrats gemäß § 52 GmbHG eingereicht."
    },
    {
      "date": "2024-11-18",
      "id": "93755",
      "original_text": "Registerbekanntmachung nach dem Umwandlungsgesetz\nSaarland Amtsgericht Saarbrücken HRB 109126\nC4 Immobilien GmbH – Homburg",
      "type": "Registerbekanntmachung nach dem Umwandlungsgesetz",
      "state": "Saarland",
      "amtsgericht": "Amtsgericht Saarbrücken",
      "registernummer": "HRB 109126",
      "registerart": "HRB",
      "company_name": "C4 Immobilien GmbH",
      "company_seat": "Homburg",
      "details": "18.11.2024 (Bekanntmachungsdatum)\n\nSaarland Amtsgericht Saarbrücken HRB 109126\nRegisterbekanntmachung nach dem Umwandlungsgesetz 18.11.2024 (Eintragungsdatum)\n\nC4 Immobilien GmbH\nGesellschaft mit beschränkter Haftung\nHomburg\n\nAls nicht eingetragen wird bekannt gemacht: Den Gläubigern der an der Verschmelzung beteiligten Gesellschaften ist, wenn sie binnen sechs Monaten nach dem Tag, an dem die Eintragung der Verschmelzung in das Register des Sitzes desjenigen Rechtsträgers, dessen Gläubiger sie sind, nach § 19 Absatz 3 UmwG bekannt gemacht worden ist, ihren Anspruch nach Grund und Höhe schriftlich anmelden, Sicherheit zu leisten, soweit sie nicht Befriedigung verlangen können. Dieses Recht steht den Gläubigern jedoch nur zu, wenn sie glaubhaft machen, dass durch die Verschmelzung die Erfüllung ihrer Forderung gefährdet wird."
    },
    {
      "date": "2024-11-18",
      "id": "93762",
      "original_text": "Registerbekanntmachung nach dem Umwandlungsgesetz\nSaarland Amtsgericht Saarbrücken HRB 109126\nC4 Immobilien GmbH – Homburg",
      "type": "Registerbekanntmachung nach dem Umwandlungsgesetz",
      "state": "Saarland",
      "amtsgericht": "Amtsgericht Saarbrücken",
      "registernummer": "HRB 109126",
      "registerart": "HRB",
      "company_name": "C4 Immobilien GmbH",
      "company_seat": "Homburg",
      "details": "18.11.2024 (Bekanntmachungsdatum)\n\nSaarland Amtsgericht Saarbrücken HRB 109126\nRegisterbekanntmachung nach dem Umwandlungsgesetz 18.11.2024 (Eintragungsdatum)\n\nC4 Immobilien GmbH\nGesellschaft mit beschränkter Haftung\nHomburg\n\nAls nicht eingetragen wird bekannt gemacht: Den Gläubigern der an der Verschmelzung beteiligten Gesellschaften ist, wenn sie binnen sechs Monaten nach dem Tag, an dem die Eintragung der Verschmelzung in das Register des Sitzes desjenigen Rechtsträgers, dessen Gläubiger sie sind, nach § 19 Absatz 3 UmwG bekannt gemacht worden ist, ihren Anspruch nach Grund und Höhe schriftlich anmelden, Sicherheit zu leisten, soweit sie nicht Befriedigung verlangen können. Dieses Recht steht den Gläubigern jedoch nur zu, wenn sie glaubhaft machen, dass durch die Verschmelzung die Erfüllung ihrer Forderung gefährdet wird."
    },
    {
      "date": "2024-11-18",
      "id": "93768",
      "original_text": "Registerbekanntmachung nach dem Umwandlungsgesetz\nSaarland Amtsgericht Saarbrücken HRB 109126\nC4 Immobilien GmbH – Homburg",
      "type": "Registerbekanntmachung nach dem Umwandlungsgesetz",
      "state": "Saarland",
      "amtsgericht": "Amtsgericht Saarbrücken",
      "registernummer": "HRB 109126",
      "registerart": "HRB",
      "company_name": "C4 Immobilien GmbH",
      "company_seat": "Homburg",
      "details": "18.11.2024 (Bekanntmachungsdatum)\n\nSaarland Amtsgericht Saarbrücken HRB 109126\nRegisterbekanntmachung nach dem Umwandlungsgesetz 18.11.2024 (Eintragungsdatum)\n\nC4 Immobilien GmbH\nGesellschaft mit beschränkter Haftung\nHomburg\n\nAls nicht eingetragen wird bekannt gemacht: Den Gläubigern der an der Verschmelzung beteiligten Gesellschaften ist, wenn sie binnen sechs Monaten nach dem Tag, an dem die Eintragung der Verschmelzung in das Register des Sitzes desjenigen Rechtsträgers, dessen Gläubiger sie sind, nach § 19 Absatz 3 UmwG bekannt gemacht worden ist, ihren Anspruch nach Grund und Höhe schriftlich anmelden, Sicherheit zu leisten, soweit sie nicht Befriedigung verlangen können. Dieses Recht steht den Gläubigern jedoch nur zu, wenn sie glaubhaft machen, dass durch die Verschmelzung die Erfüllung ihrer Forderung gefährdet wird."
    },
    {
      "date": "2024-11-18",
      "id": "93754",
      "original_text": "Registerbekanntmachung nach dem Umwandlungsgesetz\nSaarland Amtsgericht Saarbrücken HRB 109872\nC4 Media GmbH – Homburg",
      "type": "Registerbekanntmachung nach dem Umwandlungsgesetz",
      "state": "Saarland",
      "amtsgericht": "Amtsgericht Saarbrücken",
      "registernummer": "HRB 109872",
      "registerart": "HRB",
      "company_name": "C4 Media GmbH",
      "company_seat": "Homburg",
      "details": "18.11.2024 (Bekanntmachungsdatum)\n\nSaarland Amtsgericht Saarbrücken HRB 109872\nRegisterbekanntmachung nach dem Umwandlungsgesetz 18.11.2024 (Eintragungsdatum)\n\nC4 Media GmbH\nGesellschaft mit beschränkter Haftung\nHomburg\n\nAls nicht eingetragen wird bekannt gemacht: Den Gläubigern der an der Verschmelzung beteiligten Gesellschaften ist, wenn sie binnen sechs Monaten nach dem Tag, an dem die Eintragung der Verschmelzung in das Register des Sitzes desjenigen Rechtsträgers, dessen Gläubiger sie sind, nach § 19 Absatz 3 UmwG bekannt gemacht worden ist, ihren Anspruch nach Grund und Höhe schriftlich anmelden, Sicherheit zu leisten, soweit sie nicht Befriedigung verlangen können. Dieses Recht steht den Gläubigern jedoch nur zu, wenn sie glaubhaft machen, dass durch die Verschmelzung die Erfüllung ihrer Forderung gefährdet wird."
    },
    {
      "date": "2024-11-18",
      "id": "93763",
      "original_text": "Registerbekanntmachung nach dem Umwandlungsgesetz\nSaarland Amtsgericht Saarbrücken HRB 109128\nC4 Service GmbH – Homburg",
      "type": "Registerbekanntmachung nach dem Umwandlungsgesetz",
      "state": "Saarland",
      "amtsgericht": "Amtsgericht Saarbrücken",
      "registernummer": "HRB 109128",
      "registerart": "HRB",
      "company_name": "C4 Service GmbH",
      "company_seat": "Homburg",
      "details": "18.11.2024 (Bekanntmachungsdatum)\n\nSaarland Amtsgericht Saarbrücken HRB 109128\nRegisterbekanntmachung nach dem Umwandlungsgesetz 18.11.2024 (Eintragungsdatum)\n\nC4 Service GmbH\nGesellschaft mit beschränkter Haftung\nHomburg\n\nAls nicht eingetragen wird bekannt gemacht: Den Gläubigern der an der Verschmelzung beteiligten Gesellschaften ist, wenn sie binnen sechs Monaten nach dem Tag, an dem die Eintragung der Verschmelzung in das Register des Sitzes desjenigen Rechtsträgers, dessen Gläubiger sie sind, nach § 19 Absatz 3 UmwG bekannt gemacht worden ist, ihren Anspruch nach Grund und Höhe schriftlich anmelden, Sicherheit zu leisten, soweit sie nicht Befriedigung verlangen können. Dieses Recht steht den Gläubigern jedoch nur zu, wenn sie glaubhaft machen, dass durch die Verschmelzung die Erfüllung ihrer Forderung gefährdet wird."
    },
    {
      "date": "2024-11-18",
      "id": "93761",
      "original_text": "Löschungsankündigung\nSchleswig-Holstein Amtsgericht Kiel HRA 5432\nCL Leasing GmbH & Co. Vermietung KG – Kiel",
      "type": "Löschungsankündigung",
      "state": "Schleswig-Holstein",
      "amtsgericht": "Amtsgericht Kiel",
      "registernummer": "HRA 5432",
      "registerart": "HRA",
      "company_name": "CL Leasing GmbH & Co. Vermietung KG",
      "company_seat": "Kiel",
      "details": "18.11.2024 (Bekanntmachungsdatum)\n\nSchleswig-Holstein Amtsgericht Kiel HRA 5432\nLöschungsankündigung\n\nCL Leasing GmbH & Co. Vermietung KG\nKommanditgesellschaft\nKiel\n\nBei der nachstehenden Firma wird das Amtslöschungsverfahren gemäß § 31 Abs. 2 HGB und § 393 FamFG von Amts wegen eingeleitet. Widerspruchsfrist: 2 Monate."
    },
    {
      "date": "2024-11-18",
      "id": "93744",
      "original_text": "Löschungsankündigung\nBerlin Amtsgericht Berlin (Charlottenburg) HRA 45683\nColibri UmweltReisen GmbH & Co. KG – Berlin",
      "type": "Löschungsankündigung",
      "state": "Berlin",
      "amtsgericht": "Amtsgericht Berlin (Charlottenburg)",
      "registernummer": "HRA 45683",
      "registerart": "HRA",
      "company_name": "Colibri UmweltReisen GmbH & Co. KG",
      "company_seat": "Berlin",
      "details": "18.11.2024 (Bekanntmachungsdatum)\n\nBerlin Amtsgericht Berlin (Charlottenburg) HRA 45683\nLöschungsankündigung\n\nColibri UmweltReisen GmbH & Co. KG\nKommanditgesellschaft\nBerlin\n\nBei dem nachstehenden Unternehmen / der nachstehenden Gesellschaft wird das Amtslöschungsverfahren gemäß § 31 Abs. 2 HGB eingeleitet. Widerspruchsfrist 2 Monate."
    },
    {
      "date": "2024-11-18",
      "id": "93733",
      "original_text": "Löschungsankündigung\nSchleswig-Holstein Amtsgericht Flensburg HRA 6923\nDANTYS Marketing GmbH & Co. KG – Norderfriedrichskoog",
      "type": "Löschungsankündigung",
      "state": "Schleswig-Holstein",
      "amtsgericht": "Amtsgericht Flensburg",
      "registernummer": "HRA 6923",
      "registerart": "HRA",
      "company_name": "DANTYS Marketing GmbH & Co. KG",
      "company_seat": "Norderfriedrichskoog",
      "details": "18.11.2024 (Bekanntmachungsdatum)\n\nSchleswig-Holstein Amtsgericht Flensburg HRA 6923\nLöschungsankündigung\n\nDANTYS Marketing GmbH & Co. KG\nKommanditgesellschaft\nNorderfriedrichskoog\n\nBei der nachstehenden Firma wird das Amtslöschungsverfahren gemäß § 31 Abs. 2 HGB eingeleitet.\nWiderspruchsfrist: 3 Monate"
    },
    {
      "date": "2024-11-18",
      "id": "93843",
      "original_text": "Einreichung neuer Dokumente\nHessen Amtsgericht Frankfurt am Main HRB 83173\nDB Fernverkehr Aktiengesellschaft – Frankfurt am Main",
      "type": "Einreichung neuer Dokumente",
      "state": "Hessen",
      "amtsgericht": "Amtsgericht Frankfurt am Main",
      "registernummer": "HRB 83173",
      "registerart": "HRB",
      "company_name": "DB Fernverkehr Aktiengesellschaft",
      "company_seat": "Frankfurt am Main",
      "details": "18.11.2024 (Bekanntmachungsdatum)\n\nHessen Amtsgericht Frankfurt am Main HRB 83173\nEinreichung neuer Dokumente\n\nDB Fernverkehr Aktiengesellschaft\nAktiengesellschaft\nFrankfurt am Main\n\nDurch eine Änderung in den Personen der Aufsichtsratsmitglieder ist eine Liste der Mitglieder des Aufsichtsrates zum Handelsregister eingereicht worden."
    },
    {
      "date": "2024-11-18",
      "id": "93752",
      "original_text": "Registerbekanntmachung nach dem Umwandlungsgesetz\nBerlin Amtsgericht Berlin (Charlottenburg) HRB 269492\nDFM Deutsche Filament Masken GmbH – Berlin",
      "type": "Registerbekanntmachung nach dem Umwandlungsgesetz",
      "state": "Berlin",
      "amtsgericht": "Amtsgericht Berlin (Charlottenburg)",
      "registernummer": "HRB 269492",
      "registerart": "HRB",
      "company_name": "DFM Deutsche Filament Masken GmbH",
      "company_seat": "Berlin",
      "details": "18.11.2024 (Bekanntmachungsdatum)\n\nBerlin Amtsgericht Berlin (Charlottenburg) HRB 269492\nRegisterbekanntmachung nach dem Umwandlungsgesetz 15.11.2024 (Eintragungsdatum)\n\nDFM Deutsche Filament Masken GmbH\nGesellschaft mit beschränkter Haftung\nBerlin\n\nZu Eintragungsnummer 1 vom 15.11.2024 wird als nicht eingetragen veröffentlicht:Den Gläubigern ist, wenn sie binnen sechs Monaten nach dem Tag, an dem die Eintragung der Umwandlung als bekannt gemacht gilt, ihren Anspruch nach Grund und Höhe schriftlich anmelden, Sicherheit zu leisten, soweit sie nicht Befriedigung verlangen können. Dieses Recht steht den Gläubigern jedoch nur zu, wenn sie glaubhaft machen, dass durch die Umwandlung die Erfüllung ihrer Forderung gefährdet wird. Das Recht, Sicherheitsleistung zu verlangen, steht Gläubigern nicht zu, die im Falle der Insolvenz ein Recht auf vorzugsweise Befriedigung aus einer Deckungsmasse haben, die nach gesetzlicher Vorschrift zu ihrem Schutz errichtet und staatlich überwacht ist."
    },
    {
      "date": "2024-11-18",
      "id": "93837",
      "original_text": "Registerbekanntmachung nach dem Umwandlungsgesetz\nNordrhein-Westfalen Amtsgericht Hagen HRB 1051\nDOUGLAS INFORMATIK & SERVICE GMBH – Hagen",
      "type": "Registerbekanntmachung nach dem Umwandlungsgesetz",
      "state": "Nordrhein-Westfalen",
      "amtsgericht": "Amtsgericht Hagen",
      "registernummer": "HRB 1051",
      "registerart": "HRB",
      "company_name": "DOUGLAS INFORMATIK & SERVICE GMBH",
      "company_seat": "Hagen",
      "details": "18.11.2024 (Bekanntmachungsdatum)\n\nNordrhein-Westfalen Amtsgericht Hagen HRB 1051\nRegisterbekanntmachung nach dem Umwandlungsgesetz 18.11.2024 (Eintragungsdatum)\n\nDOUGLAS INFORMATIK & SERVICE GMBH\nGesellschaft mit beschränkter Haftung\nHagen\n\nDen Gläubigern der an der formwechselnden Umwandlung beteiligten Rechtsträger ist, wenn sie binnen sechs Monaten nach dem Tag, an dem die Eintragung der formwechselnden Umwandlung in das Register des Sitzes derjenigen Rechtsträger deren Gläubiger sie sind, nach § 19 Absatz 3 UmwG als bekanntgemacht gilt, ihren Anspruch nach Grund und Höhe schriftlich anmelden, Sicherheit zu leisten, soweit sie nicht Befriedigung verlangen können. Dieses Recht steht den Gläubigern jedoch nur zu, wenn sie glaubhaft machen, dass durch die formwechselnden Umwandlung die Erfüllung ihrer Forderung gefährdet wird."
    },
    {
      "date": "2024-11-18",
      "id": "93792",
      "original_text": "Löschungsankündigung\nNiedersachsen Amtsgericht Braunschweig HRB 203750\nDSH UG (haftungsbeschränkt) – Wolfenbüttel",
      "type": "Löschungsankündigung",
      "state": "Niedersachsen",
      "amtsgericht": "Amtsgericht Braunschweig",
      "registernummer": "HRB 203750",
      "registerart": "HRB",
      "company_name": "DSH UG (haftungsbeschränkt)",
      "company_seat": "Wolfenbüttel",
      "details": "18.11.2024 (Bekanntmachungsdatum)\n\nNiedersachsen Amtsgericht Braunschweig HRB 203750\nLöschungsankündigung\n\nDSH UG (haftungsbeschränkt)\nGesellschaft mit beschränkter Haftung\nWolfenbüttel\n\nDas Registergericht beabsichtigt, die Gesellschaft von Amts wegen nach § 394 FamFG zu löschen. Die Frist zur Erhebung eines Widerspruchs ist auf 1 Monat ab dieser Registerbekanntmachung festgesetzt."
    },
    {
      "date": "2024-11-18",
      "id": "93804",
      "original_text": "Registerbekanntmachung nach dem Umwandlungsgesetz\nRheinland-Pfalz Amtsgericht Koblenz HRB 4831\nDeGeKom GmbH – Koblenz",
      "type": "Registerbekanntmachung nach dem Umwandlungsgesetz",
      "state": "Rheinland-Pfalz",
      "amtsgericht": "Amtsgericht Koblenz",
      "registernummer": "HRB 4831",
      "registerart": "HRB",
      "company_name": "DeGeKom GmbH",
      "company_seat": "Koblenz",
      "details": "18.11.2024 (Bekanntmachungsdatum)\n\nRheinland-Pfalz Amtsgericht Koblenz HRB 4831\nRegisterbekanntmachung nach dem Umwandlungsgesetz 18.11.2024 (Eintragungsdatum)\n\nDeGeKom GmbH\nGesellschaft mit beschränkter Haftung\nKoblenz\n\nAls nicht eingetragen wird veröffentlicht: Den Gläubigern der an der Verschmelzung beteiligten Rechtsträger ist, wenn sie binnen sechs Monaten nach dem Tag, an dem die Eintragung der Verschmelzung in das Register des Sitzes desjenigen Rechtsträgers,dessen Gläubiger sie sind, nach § 19 Abs. 3 UmwG als bekannt gemacht gilt, ihren Anspruch nach Grund und Höhe schriftlich anmelden, Sicherheit zu leisten, soweit sie nicht Befriedigung verlangen können. Dieses Recht steht den Gläubigern jedoch nur zu, wenn sie glaubhaft machen, dass durch die Verschmelzung die Erfüllungd er Forderung gefährdet wird."
    },
    {
      "date": "2024-11-18",
      "id": "93844",
      "original_text": "Registerbekanntmachung nach dem Umwandlungsgesetz\nHessen Amtsgericht Frankfurt am Main HRB 116900\nDeufol Real Estate GmbH – Hofheim am Taunus",
      "type": "Registerbekanntmachung nach dem Umwandlungsgesetz",
      "state": "Hessen",
      "amtsgericht": "Amtsgericht Frankfurt am Main",
      "registernummer": "HRB 116900",
      "registerart": "HRB",
      "company_name": "Deufol Real Estate GmbH",
      "company_seat": "Hofheim am Taunus",
      "details": "18.11.2024 (Bekanntmachungsdatum)\n\nHessen Amtsgericht Frankfurt am Main HRB 116900\nRegisterbekanntmachung nach dem Umwandlungsgesetz 18.11.2024 (Eintragungsdatum)\n\nDeufol Real Estate GmbH\nGesellschaft mit beschränkter Haftung\nHofheim am Taunus\n\nDen Gläubigern der an der Abspaltung beteiligten Rechtsträger ist, wenn sie binnen sechs Monaten nach dem Tag, an dem die Eintragung der Abspaltung in das Register des Sitzes desjenigen Rechtsträgers, dessen Gläubiger sie sind, nach §§ 125, 19 Absatz 3 UmwG bekannt gemacht worden ist, ihren Anspruch nach Grund und Höhe schriftlich anmelden, Sicherheit zu leisten, soweit sie nicht Befriedigung verlangen können. Dieses Recht steht den Gläubigern jedoch nur zu, wenn sie glaubhaft machen, dass durch die Abspaltung die Erfüllung ihrer Forderung gefährdet wird."
    },
    {
      "date": "2024-11-18",
      "id": "93724",
      "original_text": "Löschungsankündigung\nBerlin Amtsgericht Berlin (Charlottenburg) HRB 109392\nDie Fans Media GmbH – Berlin",
      "type": "Löschungsankündigung",
      "state": "Berlin",
      "amtsgericht": "Amtsgericht Berlin (Charlottenburg)",
      "registernummer": "HRB 109392",
      "registerart": "HRB",
      "company_name": "Die Fans Media GmbH",
      "company_seat": "Berlin",
      "details": "18.11.2024 (Bekanntmachungsdatum)\n\nBerlin Amtsgericht Berlin (Charlottenburg) HRB 109392\nLöschungsankündigung\n\nDie Fans Media GmbH\nGesellschaft mit beschränkter Haftung\nBerlin\n\nBei der nachstehenden Gesellschaft wird das Amtslöschungsverfahren gemäß § 394 FamFG eingeleitet. Widerspruchsfrist 6 Wochen"
    },
    {
      "date": "2024-11-18",
      "id": "93822",
      "original_text": "Sonstige Registerbekanntmachung\nNordrhein-Westfalen Amtsgericht Düsseldorf HRB 71337\nEntgelt und Rente AG – Langenfeld",
      "type": "Sonstige Registerbekanntmachung",
      "state": "Nordrhein-Westfalen",
      "amtsgericht": "Amtsgericht Düsseldorf",
      "registernummer": "HRB 71337",
      "registerart": "HRB",
      "company_name": "Entgelt und Rente AG",
      "company_seat": "Langenfeld",
      "details": "18.11.2024 (Bekanntmachungsdatum)\n\nNordrhein-Westfalen Amtsgericht Düsseldorf HRB 71337\nSonstige Registerbekanntmachung\n\nEntgelt und Rente AG\nAktiengesellschaft\nLangenfeld\n\nDem Registergericht ist eine Liste der Mitglieder des Aufsichtsrates eingereicht worden."
    },
    {
      "date": "2024-11-18",
      "id": "93849",
      "original_text": "Löschungsankündigung\nHessen Amtsgericht Frankfurt am Main HRB 128815\nFIT Dienstleistungen GmbH – Frankfurt am Main",
      "type": "Löschungsankündigung",
      "state": "Hessen",
      "amtsgericht": "Amtsgericht Frankfurt am Main",
      "registernummer": "HRB 128815",
      "registerart": "HRB",
      "company_name": "FIT Dienstleistungen GmbH",
      "company_seat": "Frankfurt am Main",
      "details": "18.11.2024 (Bekanntmachungsdatum)\n\nHessen Amtsgericht Frankfurt am Main HRB 128815\nLöschungsankündigung\n\nFIT Dienstleistungen GmbH\nGesellschaft mit beschränkter Haftung\nFrankfurt am Main\n\nDas Registergericht beabsichtigt die im Handelsregister eingetragene Gesellschaft von Amts wegen nach § 394 FamFG zu löschen. Die Frist zur Erhebung eines Widerspruchs gegen die beabsichtigte Löschung wird auf 1 Monat festgesetzt."
    },
    {
      "date": "2024-11-18",
      "id": "93772",
      "original_text": "Registerbekanntmachung nach dem Umwandlungsgesetz\nHamburg Amtsgericht Hamburg HRB 10627\nFRG Hansa Dienstleistungsgesellschaft mbH – Hamburg",
      "type": "Registerbekanntmachung nach dem Umwandlungsgesetz",
      "state": "Hamburg",
      "amtsgericht": "Amtsgericht Hamburg",
      "registernummer": "HRB 10627",
      "registerart": "HRB",
      "company_name": "FRG Hansa Dienstleistungsgesellschaft mbH",
      "company_seat": "Hamburg",
      "details": "18.11.2024 (Bekanntmachungsdatum)\n\nHamburg Amtsgericht Hamburg HRB 10627\nRegisterbekanntmachung nach dem Umwandlungsgesetz 18.11.2024 (Eintragungsdatum)\n\nFRG Hansa Dienstleistungsgesellschaft mbH\nGesellschaft mit beschränkter Haftung\nHamburg\n\nAls nicht eingetragen wird bekannt gemacht:\nDen Gläubigern der an der Verschmelzung beteiligten Gesellschaften ist, wenn sie binnen sechs Monaten nach dem Tag, an dem die Eintragung der Verschmelzung in das Register des Sitzes desjenigen Rechtsträgers, dessen Gläubiger sie sind, nach § 19 Absatz 3 UmwG als bekannt gemacht gilt, ihren Anspruch nach Grund und Höhe schriftlich anmelden, Sicherheit zu leisten, soweit sie nicht Befriedigung verlangen können. Dieses Recht steht den Gläubigern jedoch nur zu, wenn sie glaubhaft machen, dass durch die Verschmelzung die Erfüllung ihrer Forderung gefährdet wird."
    },
    {
      "date": "2024-11-18",
      "id": "93780",
      "original_text": "Einreichung neuer Dokumente\nHamburg Amtsgericht Hamburg HRB 153232\nFinexity AG – Hamburg",
      "type": "Einreichung neuer Dokumente",
      "state": "Hamburg",
      "amtsgericht": "Amtsgericht Hamburg",
      "registernummer": "HRB 153232",
      "registerart": "HRB",
      "company_name": "Finexity AG",
      "company_seat": "Hamburg",
      "details": "18.11.2024 (Bekanntmachungsdatum)\n\nHamburg Amtsgericht Hamburg HRB 153232\nEinreichung neuer Dokumente 18.11.2024 (Eintragungsdatum)\n\nFinexity AG\nAktiengesellschaft\nHamburg\n\nAls nicht eingetragen wird bekannt gemacht: Liste des Aufsichtsrats wurde eingereicht."
    },
    {
      "date": "2024-11-18",
      "id": "93785",
      "original_text": "Einreichung neuer Dokumente\nSachsen Amtsgericht Chemnitz HRB 12783\nFreizeitbad An der Silberstraße GmbH – Geyer",
      "type": "Einreichung neuer Dokumente",
      "state": "Sachsen",
      "amtsgericht": "Amtsgericht Chemnitz",
      "registernummer": "HRB 12783",
      "registerart": "HRB",
      "company_name": "Freizeitbad An der Silberstraße GmbH",
      "company_seat": "Geyer",
      "details": "18.11.2024 (Bekanntmachungsdatum)\n\nSachsen Amtsgericht Chemnitz HRB 12783\nEinreichung neuer Dokumente\n\nFreizeitbad An der Silberstraße GmbH\nGesellschaft mit beschränkter Haftung\nGeyer\n\nAm 13.11.2024 wurde beim Handelsregister des Amtsgerichts Chemnitz die Liste der Mitglieder des Aufsichtsrats gemäß § 52 GmbHG eingereicht."
    },
    {
      "date": "2024-11-18",
      "id": "93793",
      "original_text": "Löschungsankündigung\nNiedersachsen Amtsgericht Osnabrück HRB 209505\nFrick Bau UG (haftungsbeschränkt) – Papenburg",
      "type": "Löschungsankündigung",
      "state": "Niedersachsen",
      "amtsgericht": "Amtsgericht Osnabrück",
      "registernummer": "HRB 209505",
      "registerart": "HRB",
      "company_name": "Frick Bau UG (haftungsbeschränkt)",
      "company_seat": "Papenburg",
      "details": "18.11.2024 (Bekanntmachungsdatum)\n\nNiedersachsen Amtsgericht Osnabrück HRB 209505\nLöschungsankündigung\n\nFrick Bau UG (haftungsbeschränkt)\nGesellschaft mit beschränkter Haftung\nPapenburg\n\nDas Registergericht beabsichtigt, die Gesellschaft von Amts wegen nach § 394 FamFG wegen Vermögenslosigkeit zu löschen. Die Frist zur Erhebung eines Widerspruchs ist auf 1 Monat ab dieser Registerbekanntmachung festgesetzt."
    },
    {
      "date": "2024-11-18",
      "id": "93756",
      "original_text": "Sonstige Registerbekanntmachung\nSchleswig-Holstein Amtsgericht Lübeck HRB 1063 SB\nFriederichs Beteiligungs GmbH – Büchen",
      "type": "Sonstige Registerbekanntmachung",
      "state": "Schleswig-Holstein",
      "amtsgericht": "Amtsgericht Lübeck",
      "registernummer": "HRB 1063 SB",
      "registerart": "HRB",
      "company_name": "Friederichs Beteiligungs GmbH",
      "company_seat": "Büchen",
      "details": "18.11.2024 (Bekanntmachungsdatum)\n\nSchleswig-Holstein Amtsgericht Lübeck HRB 1063 SB\nSonstige Registerbekanntmachung\n\nFriederichs Beteiligungs GmbH\nGesellschaft mit beschränkter Haftung\nBüchen\n\nAls nicht eingetragen wird veröffentlicht:\n\nAmtsgericht Lübeck, Am Burgfeld 7, 23568 Lübeck\n\nErben nach\nKnut Friederichs\n\nUnser Zeichen: HRB 1063 SB\n\nDatum: 15.11.2024\n\nSehr geehrte Damen und Herren,\n\nin der Handelsregistersache der\n\nFriederichs Beteiligungs GmbH\n\nergeben sich aus den vorliegenden Unterlagen Anhaltspunkte dafür, dass die obige Gesellschaft vermögenslos ist. Das Finanzamt Lübeck hat mit Schreiben vom 05.11.2024 die Löschung der Gesellschaft gemäß § 394 FamFG beantragt.\n\nEs ist daher beabsichtigt, die Gesellschaft wegen Vermögenslosigkeit gemäß § 394 FamFG zu löschen.\n\nEs wird eine Frist von zwei Monaten zur Geltendmachung eines Widerspruchs gegen die Löschung bestimmt, § 394 Abs. 2 S. 1 FamFG.\n\nNach Fristablauf ohne Widerspruch wird die Gesellschaft gelöscht.\n\nMit freundlichen Grüßen\n\nSchuppenhauer\nDipl.-Rechtspflegerin (FH)"
    },
    {
      "date": "2024-11-18",
      "id": "93757",
      "original_text": "Löschungsankündigung\nSchleswig-Holstein Amtsgericht Lübeck HRB 1063 SB\nFriederichs Beteiligungs GmbH – Büchen",
      "type": "Löschungsankündigung",
      "state": "Schleswig-Holstein",
      "amtsgericht": "Amtsgericht Lübeck",
      "registernummer": "HRB 1063 SB",
      "registerart": "HRB",
      "company_name": "Friederichs Beteiligungs GmbH",
      "company_seat": "Büchen",
      "details": "18.11.2024 (Bekanntmachungsdatum)\n\nSchleswig-Holstein Amtsgericht Lübeck HRB 1063 SB\nLöschungsankündigung\n\nFriederichs Beteiligungs GmbH\nGesellschaft mit beschränkter Haftung\nBüchen\n\nEs ist die Löschung der nachstehenden Gesellschaft wegen Vermögenslosigkeit gemäß § 394 FamFG beabsichtigt. Widerspruchsfrist: 2 Monate."
    },
    {
      "date": "2024-11-18",
      "id": "93838",
      "original_text": "Registerbekanntmachung nach dem Umwandlungsgesetz\nNordrhein-Westfalen Amtsgericht Bonn HRB 6154\nFroesch Labor Verwaltungs GmbH – Bonn",
      "type": "Registerbekanntmachung nach dem Umwandlungsgesetz",
      "state": "Nordrhein-Westfalen",
      "amtsgericht": "Amtsgericht Bonn",
      "registernummer": "HRB 6154",
      "registerart": "HRB",
      "company_name": "Froesch Labor Verwaltungs GmbH",
      "company_seat": "Bonn",
      "details": "18.11.2024 (Bekanntmachungsdatum)\n\nNordrhein-Westfalen Amtsgericht Bonn HRB 6154\nRegisterbekanntmachung nach dem Umwandlungsgesetz 18.11.2024 (Eintragungsdatum)\n\nFroesch Labor Verwaltungs GmbH\nGesellschaft mit beschränkter Haftung\nBonn\n\nDen Gläubigern der an der Ausgliederung beteiligten Rechtsträger ist, wenn sie binnen sechs Monaten nach dem Tag, an dem die Eintragung der Ausgliederung in das Register des Sitzes desjenigen Rechtsträgers, dessen Gläubiger sie sind, nach § 19 Absatz 3 UmwG als bekanntgemacht gilt, ihren Anspruch nach Grund und Höhe schriftlich anmelden, Sicherheit zu leisten, soweit sie nicht Befriedigung verlangen können. Dieses Recht steht den Gläubigern jedoch nur zu, wenn sie glaubhaft machen, dass durch die Ausgliederung die Erfüllung ihrer Forderung gefährdet wird."
    },
    {
      "date": "2024-11-18",
      "id": "93778",
      "original_text": "Sonstige Registerbekanntmachung\nBrandenburg Amtsgericht Frankfurt/Oder HRB 3784\nGGAB-Gemeinnützige Gesellschaft für Alten- und Behindertenpflege mbH Bernau – Bernau bei Berlin",
      "type": "Sonstige Registerbekanntmachung",
      "state": "Brandenburg",
      "amtsgericht": "Amtsgericht Frankfurt/Oder",
      "registernummer": "HRB 3784",
      "registerart": "HRB",
      "company_name": "GGAB-Gemeinnützige Gesellschaft für Alten- und Behindertenpflege mbH Bernau",
      "company_seat": "Bernau bei Berlin",
      "details": "18.11.2024 (Bekanntmachungsdatum)\n\nBrandenburg Amtsgericht Frankfurt/Oder HRB 3784\nSonstige Registerbekanntmachung\n\nGGAB-Gemeinnützige Gesellschaft für Alten- und Behindertenpflege mbH Bernau\nGesellschaft mit beschränkter Haftung\nBernau bei Berlin\n\nAls nicht eingetragen wird veröffentlicht: Als nicht eingetragen wird veröffentlicht: Eine Liste der Mitglieder des Aufsichtsrates wurde zum Handelsregister eingereicht."
    },
    {
      "date": "2024-11-18",
      "id": "93787",
      "original_text": "Registerbekanntmachung nach dem Umwandlungsgesetz\nSachsen Amtsgericht Dresden HRB 44855\nGalvanoplast Surface Technologies GmbH – Krauschwitz",
      "type": "Registerbekanntmachung nach dem Umwandlungsgesetz",
      "state": "Sachsen",
      "amtsgericht": "Amtsgericht Dresden",
      "registernummer": "HRB 44855",
      "registerart": "HRB",
      "company_name": "Galvanoplast Surface Technologies GmbH",
      "company_seat": "Krauschwitz",
      "details": "18.11.2024 (Bekanntmachungsdatum)\n\nSachsen Amtsgericht Dresden HRB 44855\nRegisterbekanntmachung nach dem Umwandlungsgesetz 18.11.2024 (Eintragungsdatum)\n\nGalvanoplast Surface Technologies GmbH\nGesellschaft mit beschränkter Haftung\nKrauschwitz\n\nDen Gläubigern der an der #DV.Auswahl(Text=\"Betreffende Alternative auswählen\",Eingabe=\"Verschmelzung beteiligten Rechtsträger ist, wenn sie binnen sechs Monaten nach dem Tag, an dem die Eintragung der Verschmelzung in das Register des Sitzes desjenigen Rechtsträgers, dessen Gläubiger sie sind, nach § 19 Abs. 3 UmwG als bekannt gemacht gilt, ihren Anspruch nach Grund und Höhe schriftlich anmelden, Sicherheit zu leisten, soweit sie nicht Befriedigung verlangen können. Dieses Recht steht den Gläubigern jedoch nur zu, wenn sie glaubhaft machen, dass durch die Verschmelzung die Erfüllung der Forderung gefährdet wird.\"|\"Verschmelzung\",\"Spaltung beteiligten Rechtsträger ist, wenn sie binnen sechs Monaten nach dem Tag, an dem die Eintragung der Spaltung in das Register des Sitzes desjenigen Rechtsträgers, dessen Gläubiger sie sind, nach § 19 Abs. 3 UmwG als bekannt gemacht gilt, ihren Anspruch nach Grund und Höhe schriftlich anmelden, Sicherheit zu leisten, soweit sie nicht Befriedigung verlangen können. Dieses Recht steht den Gläubigern jedoch nur zu, wenn sie glaubhaft machen, dass durch die Spaltung die Erfüllung der Forderung gefährdet wird.\"|\"Spaltung\",\"Umwandlung beteiligten Rechtsträger ist, wenn sie binnen sechs Monaten nach dem Tag, an dem die Eintragung der Umwandlung  in das Register des Sitzes desjenigen Rechtsträgers, dessen Gläubiger sie sind, nach § 19 Abs. 3 UmwG als bekannt gemacht gilt, ihren Anspruch nach Grund und Höhe schriftlich anmelden, Sicherheit zu leisten, soweit sie nicht Befriedigung verlangen können. Dieses Recht steht den Gläubigern jedoch nur zu, wenn sie glaubhaft machen, dass durch die Umwandlung die Erfüllung der Forderung gefährdet wird.\"|\"Umwandlung\",\"Ausgliederung beteiligten Rechtsträger ist, wenn sie binnen sechs Monaten nach dem Tag, an dem die Eintragung der Ausgliederung in das Register des Sitzes desjenigen Rechtsträgers, dessen Gläubiger sie sind, nach § 19 Abs. 3 UmwG als bekannt gemacht gilt, ihren Anspruch nach Grund und Höhe schriftlich anmelden, Sicherheit zu leisten, soweit sie nicht Befriedigung verlangen können. Dieses Recht steht den Gläubigern jedoch nur zu, wenn sie glaubhaft machen, dass durch die Ausgliederung die Erfüllung der Forderung gefährdet wird.\"|\"Ausgliederung\")"
    },
    {
      "date": "2024-11-18",
      "id": "63",
      "original_text": "Sonderregisterbekanntmachung OHNE Bezug zum elektr. Register\nNordrhein-Westfalen Amtsgericht Münster\nHRA 1152\nGebrüder Becker GmbH & Co.",
      "type": "Sonderregisterbekanntmachung OHNE Bezug zum elektr. Register",
      "state": "Nordrhein-Westfalen",
      "amtsgericht": "Amtsgericht Münster",
      "company_name": "Gebrüder Becker GmbH & Co.",
      "sonderegister_referenz": "HRA 1152",
      "details": "18.11.2024 (Bekanntmachungsdatum)\n\nNordrhein-Westfalen Amtsgericht Münster\nHRA 1152\nSonderregisterbekanntmachung OHNE Bezug zum elektr. Register\n\nGebrüder Becker GmbH & Co.\n\nDas Registergericht hat die Nachtragsliquidation angeordnet.\nZum Nachtragsliquidator wird Frau Antje Benkelberg,dienstansässig: Sparkassen lmmobilien GmbH, Poststraße 4 in 59269 Beckum bestellt."
    },
    {
      "date": "2024-11-18",
      "id": "93791",
      "original_text": "Registerbekanntmachung nach dem Umwandlungsgesetz\nNiedersachsen Amtsgericht Osnabrück HRB 20073\nGemmula Beteiligungs- und Grundbesitz GmbH – Bramsche",
      "type": "Registerbekanntmachung nach dem Umwandlungsgesetz",
      "state": "Niedersachsen",
      "amtsgericht": "Amtsgericht Osnabrück",
      "registernummer": "HRB 20073",
      "registerart": "HRB",
      "company_name": "Gemmula Beteiligungs- und Grundbesitz GmbH",
      "company_seat": "Bramsche",
      "details": "18.11.2024 (Bekanntmachungsdatum)\n\nNiedersachsen Amtsgericht Osnabrück HRB 20073\nRegisterbekanntmachung nach dem Umwandlungsgesetz 18.11.2024 (Eintragungsdatum)\n\nGemmula Beteiligungs- und Grundbesitz GmbH\nGesellschaft mit beschränkter Haftung\nBramsche\n\nDen Gläubigern der an der Verschmelzung beteiligten Rechtsträger ist, wenn sie binnen sechs Monaten nach dem Tag, an dem die Eintragung der Verschmelzung in das Register des Sitzes desjenigen Rechtsträgers, dessen Gläubiger sie sind, nach § 19  Abs.  3 UmwG als bekannt gemacht gilt, ihren Anspruch nach Grund und Höhe schriftlich anmelden, Sicherheit zu leisten, soweit sie nicht Befriedigung verlangen können. Dieses Recht steht den Gläubigern jedoch nur zu, wenn sie glaubhaft machen, dass durch die Verschmelzung die Erfüllung der Forderung gefährdet wird."
    },
    {
      "date": "2024-11-18",
      "id": "93749",
      "original_text": "Einreichung neuer Dokumente\nSachsen-Anhalt Amtsgericht Stendal HRB 5540\nGesundheitszentrum Bitterfeld/Wolfen gGmbH – Bitterfeld-Wolfen",
      "type": "Einreichung neuer Dokumente",
      "state": "Sachsen-Anhalt",
      "amtsgericht": "Amtsgericht Stendal",
      "registernummer": "HRB 5540",
      "registerart": "HRB",
      "company_name": "Gesundheitszentrum Bitterfeld/Wolfen gGmbH",
      "company_seat": "Bitterfeld-Wolfen",
      "details": "18.11.2024 (Bekanntmachungsdatum)\n\nSachsen-Anhalt Amtsgericht Stendal HRB 5540\nEinreichung neuer Dokumente\n\nGesundheitszentrum Bitterfeld/Wolfen gGmbH\nGesellschaft mit beschränkter Haftung\nBitterfeld-Wolfen\n\nEine Liste der Mitglieder des Aufsichtsrates wurde zum Handelsregister eingereicht."
    },
    {
      "date": "2024-11-18",
      "id": "93760",
      "original_text": "Einreichung neuer Dokumente\nBrandenburg Amtsgericht Neuruppin HRB 1300\nGesundheitszentrum Wittenberge GmbH – Wittenberge",
      "type": "Einreichung neuer Dokumente",
      "state": "Brandenburg",
      "amtsgericht": "Amtsgericht Neuruppin",
      "registernummer": "HRB 1300",
      "registerart": "HRB",
      "company_name": "Gesundheitszentrum Wittenberge GmbH",
      "company_seat": "Wittenberge",
      "details": "18.11.2024 (Bekanntmachungsdatum)\n\nBrandenburg Amtsgericht Neuruppin HRB 1300\nEinreichung neuer Dokumente\n\nGesundheitszentrum Wittenberge GmbH\nGesellschaft mit beschränkter Haftung\nWittenberge\n\nAls nicht eingetragen wird veröffentlicht: Eine Liste der Mitglieder des Aufsichtsrates wurde zum Handelsregister eingereicht."
    },
    {
      "date": "2024-11-18",
      "id": "93722",
      "original_text": "Einreichung neuer Dokumente\nBaden-Württemberg Amtsgericht Freiburg HRB 581544\nHELIOS Spital Überlingen GmbH – Überlingen",
      "type": "Einreichung neuer Dokumente",
      "state": "Baden-Württemberg",
      "amtsgericht": "Amtsgericht Freiburg",
      "registernummer": "HRB 581544",
      "registerart": "HRB",
      "company_name": "HELIOS Spital Überlingen GmbH",
      "company_seat": "Überlingen",
      "details": "18.11.2024 (Bekanntmachungsdatum)\n\nBaden-Württemberg Amtsgericht Freiburg HRB 581544\nEinreichung neuer Dokumente 18.11.2024 (Eintragungsdatum)\n\nHELIOS Spital Überlingen GmbH\nGesellschaft mit beschränkter Haftung\nÜberlingen\n\nAls nicht eingetragen wird bekanntgemacht:\nDie Gesellschaft hat am 15.11.2024 die Liste über die Zusammensetzung des Aufsichtsrats zum Handelsregister eingereicht."
    },
    {
      "date": "2024-11-18",
      "id": "93786",
      "original_text": "Registerbekanntmachung nach dem Umwandlungsgesetz\nSachsen Amtsgericht Leipzig HRB 43394\nHIG Grundbesitz- und Hausverwaltungs GmbH – Elstertrebnitz",
      "type": "Registerbekanntmachung nach dem Umwandlungsgesetz",
      "state": "Sachsen",
      "amtsgericht": "Amtsgericht Leipzig",
      "registernummer": "HRB 43394",
      "registerart": "HRB",
      "company_name": "HIG Grundbesitz- und Hausverwaltungs GmbH",
      "company_seat": "Elstertrebnitz",
      "details": "18.11.2024 (Bekanntmachungsdatum)\n\nSachsen Amtsgericht Leipzig HRB 43394\nRegisterbekanntmachung nach dem Umwandlungsgesetz 18.11.2024 (Eintragungsdatum)\n\nHIG Grundbesitz- und Hausverwaltungs GmbH\nGesellschaft mit beschränkter Haftung\nElstertrebnitz\n\nDen Gläubigern der an der Spaltung beteiligten Rechtsträger ist, wenn sie binnen sechs Monaten nach dem Tag, an dem die Eintragung der Spaltung in das Register des Sitzes desjenigen Rechtsträgers, dessen Gläubiger sie sind, nach § 19 Abs. 3 UmwG als bekannt gemacht gilt, ihren Anspruch nach Grund und Höhe schriftlich anmelden, Sicherheit zu leisten, soweit sie nicht Befriedigung verlangen können. Dieses Recht steht den Gläubigern jedoch nur zu, wenn sie glaubhaft machen, dass durch die Spaltung die Erfüllung der Forderung gefährdet wird."
    },
    {
      "date": "2024-11-18",
      "id": "93753",
      "original_text": "Registerbekanntmachung nach dem Umwandlungsgesetz\nThüringen Amtsgericht Jena HRB 522522\nHIG Hoch- und Ingenieurbau GmbH – Gera",
      "type": "Registerbekanntmachung nach dem Umwandlungsgesetz",
      "state": "Thüringen",
      "amtsgericht": "Amtsgericht Jena",
      "registernummer": "HRB 522522",
      "registerart": "HRB",
      "company_name": "HIG Hoch- und Ingenieurbau GmbH",
      "company_seat": "Gera",
      "details": "18.11.2024 (Bekanntmachungsdatum)\n\nThüringen Amtsgericht Jena HRB 522522\nRegisterbekanntmachung nach dem Umwandlungsgesetz 18.11.2024 (Eintragungsdatum)\n\nHIG Hoch- und Ingenieurbau GmbH\nGesellschaft mit beschränkter Haftung\nGera\n\nNicht eingetragen: Den Gläubigern der an der Spaltung beteiligten Rechtsträger, ist wenn sie binnen sechs Monaten nach dem Tag, an dem die Eintragung der Spaltung in das Register des Sitzes desjenigen Rechtsträgers, dessen Gläubiger sie sind,  nach §§ 125, 19 Abs. 3 UmwG als bekanntgemacht gilt, ihren Anspruch nach Grund und Höhe schriftlich anmelden, Sicherheit zu leisten, soweit sie nicht Befriedigung verlangen können. Dieses Recht steht ihnen jedoch nur zu, wenn sie glaubhaft machen, daß durch die Spaltung die Erfüllung ihrer Forderung gefährdet wird."
    },
    {
      "date": "2024-11-18",
      "id": "93735",
      "original_text": "Einreichung neuer Dokumente\nHamburg Amtsgericht Hamburg HRB 56097\nHamburger Feuerkasse Versicherungs-Aktiengesellschaft – Hamburg",
      "type": "Einreichung neuer Dokumente",
      "state": "Hamburg",
      "amtsgericht": "Amtsgericht Hamburg",
      "registernummer": "HRB 56097",
      "registerart": "HRB",
      "company_name": "Hamburger Feuerkasse Versicherungs-Aktiengesellschaft",
      "company_seat": "Hamburg",
      "details": "18.11.2024 (Bekanntmachungsdatum)\n\nHamburg Amtsgericht Hamburg HRB 56097\nEinreichung neuer Dokumente\n\nHamburger Feuerkasse Versicherungs-Aktiengesellschaft\nAktiengesellschaft\nHamburg\n\nAls nicht eingetragen wird bekannt gemacht: Liste des Aufsichtsrats wurde eingereicht."
    },
    {
      "date": "2024-11-18",
      "id": "93750",
      "original_text": "Sonstige Registerbekanntmachung\nBaden-Württemberg Amtsgericht Stuttgart HRB 220578\nHauber Internationale Mode GmbH – Nürtingen",
      "type": "Sonstige Registerbekanntmachung",
      "state": "Baden-Württemberg",
      "amtsgericht": "Amtsgericht Stuttgart",
      "registernummer": "HRB 220578",
      "registerart": "HRB",
      "company_name": "Hauber Internationale Mode GmbH",
      "company_seat": "Nürtingen",
      "details": "18.11.2024 (Bekanntmachungsdatum)\n\nBaden-Württemberg Amtsgericht Stuttgart HRB 220578\nSonstige Registerbekanntmachung 18.11.2024 (Eintragungsdatum)\n\nHauber Internationale Mode GmbH\nGesellschaft mit beschränkter Haftung\nNürtingen\n\nAls nicht eingetragen wird bekanntgemacht:\nDen Gläubigern der Gesellschaft, deren Forderungen begründet worden sind, bevor die Eintragung der Beendigung des Vertrages in das Handelsregister nach § 10 HGB als bekanntgemacht gilt, ist vom anderen Vertragsteil Sicherheit zu leisten, wenn sie sich binnen sechs Monaten nach der Bekanntmachung zu diesem Zweck bei ihm melden."
    },
    {
      "date": "2024-11-18",
      "id": "93846",
      "original_text": "Registerbekanntmachung nach dem Umwandlungsgesetz\nHessen Amtsgericht Darmstadt HRB 105575\nHausverwaltung Merkur GmbH – Münster",
      "type": "Registerbekanntmachung nach dem Umwandlungsgesetz",
      "state": "Hessen",
      "amtsgericht": "Amtsgericht Darmstadt",
      "registernummer": "HRB 105575",
      "registerart": "HRB",
      "company_name": "Hausverwaltung Merkur GmbH",
      "company_seat": "Münster",
      "details": "18.11.2024 (Bekanntmachungsdatum)\n\nHessen Amtsgericht Darmstadt HRB 105575\nRegisterbekanntmachung nach dem Umwandlungsgesetz 18.11.2024 (Eintragungsdatum)\n\nHausverwaltung Merkur GmbH\nGesellschaft mit beschränkter Haftung\nMünster\n\nDen Gläubigern der an der Ausgliederung beteiligten Rechtsträger ist, wenn sie binnen sechs Monaten nach dem Tag, an dem die Eintragung der Ausgliederung in das Register des Sitzes derjenigen Rechtsträger deren Gläubiger sie sind, nach §§ 125, 19 Absatz 3 UmwG bekannt gemacht worden ist, ihren Anspruch nach Grund und Höhe schriftlich anmelden, Sicherheit zu leisten, soweit sie nicht Befriedigung verlangen können. Dieses Recht steht den Gläubigern jedoch nur zu, wenn sie glaubhaft machen, dass durch die Ausgliederung die Erfüllung ihrer Forderung gefährdet wird."
    },
    {
      "date": "2024-11-18",
      "id": "93741",
      "original_text": "Registerbekanntmachung nach dem Umwandlungsgesetz\nBaden-Württemberg Amtsgericht Stuttgart HRA 261967\nHeidenwag Besitz GmbH & Co. KG – Winnenden",
      "type": "Registerbekanntmachung nach dem Umwandlungsgesetz",
      "state": "Baden-Württemberg",
      "amtsgericht": "Amtsgericht Stuttgart",
      "registernummer": "HRA 261967",
      "registerart": "HRA",
      "company_name": "Heidenwag Besitz GmbH & Co. KG",
      "company_seat": "Winnenden",
      "details": "18.11.2024 (Bekanntmachungsdatum)\n\nBaden-Württemberg Amtsgericht Stuttgart HRA 261967\nRegisterbekanntmachung nach dem Umwandlungsgesetz 18.11.2024 (Eintragungsdatum)\n\nHeidenwag Besitz GmbH & Co. KG\nKommanditgesellschaft\nWinnenden\n\nDen Gläubigern der an der Abspaltung beteiligten Rechtsträger ist, wenn sie binnen sechs Monaten nach dem Tag, an dem die Eintragung der Abspaltung in das Register des Sitzes desjenigen Rechtsträgers, dessen Gläubiger sie sind, nach § 19 Abs. 3 UmwG als bekanntgemacht gilt, ihren Anspruch nach Grund und Höhe schriftlich anmelden, Sicherheit zu leisten, soweit sie nicht Befriedigung verlangen können. Dieses Recht steht den Gläubigern jedoch nur zu, wenn sie glaubhaft machen, dass durch die Abspaltung die Erfüllung ihrer Forderung gefährdet wird."
    },
    {
      "date": "2024-11-18",
      "id": "93773",
      "original_text": "Registerbekanntmachung nach dem Umwandlungsgesetz\nSchleswig-Holstein Amtsgericht Pinneberg HRA 9123\nHerbert Kock UG (haftungsbeschränkt) & Co. KG – Schenefeld/Krs. Steinburg",
      "type": "Registerbekanntmachung nach dem Umwandlungsgesetz",
      "state": "Schleswig-Holstein",
      "amtsgericht": "Amtsgericht Pinneberg",
      "registernummer": "HRA 9123",
      "registerart": "HRA",
      "company_name": "Herbert Kock UG (haftungsbeschränkt) & Co. KG",
      "company_seat": "Schenefeld/Krs. Steinburg",
      "details": "18.11.2024 (Bekanntmachungsdatum)\n\nSchleswig-Holstein Amtsgericht Pinneberg HRA 9123\nRegisterbekanntmachung nach dem Umwandlungsgesetz 07.11.2024 (Eintragungsdatum)\n\nHerbert Kock UG (haftungsbeschränkt) & Co. KG\nKommanditgesellschaft\nSchenefeld/Krs. Steinburg\n\nZu Eintragungsnummer 3 vom 07.11.2024 wird als nicht eingetragen veröffentlicht: Den Gläubigern der an der Verschmelzung beteiligten Rechtsträger ist, wenn sie binnen sechs Monaten nach dem Tag, an dem die Eintragung der Verschmelzung in das Register des Sitzes desjenigen Rechtsträgers, dessen Gläubiger sie sind, als bekannt gemacht gilt, ihren Anspruch nach Grund und Höhe schriftlich anmelden, Sicherheit zu leisten, soweit sie nicht Befriedigung verlangen können. Dieses Recht steht den Gläubigern jedoch nur zu, wenn sie glaubhaft machen, dass durch die Verschmelzung die Erfüllung ihrer Forderung gefährdet wird. Das Recht, Sicherheitsleistung zu verlangen, steht Gläubigern nicht zu, die im Falle der Insolvenz ein Recht auf vorzugsweise Befriedigung aus einer Deckungsmasse haben, die nach gesetzlicher Vorschrift zu ihrem Schutz errichtet und staatlich überwacht ist."
    },
    {
      "date": "2024-11-18",
      "id": "93766",
      "original_text": "Löschungsankündigung\nBaden-Württemberg Amtsgericht Stuttgart HRB 724568\nHitzler Energiesysteme GmbH – Wurmlingen",
      "type": "Löschungsankündigung",
      "state": "Baden-Württemberg",
      "amtsgericht": "Amtsgericht Stuttgart",
      "registernummer": "HRB 724568",
      "registerart": "HRB",
      "company_name": "Hitzler Energiesysteme GmbH",
      "company_seat": "Wurmlingen",
      "details": "18.11.2024 (Bekanntmachungsdatum)\n\nBaden-Württemberg Amtsgericht Stuttgart HRB 724568\nLöschungsankündigung\n\nHitzler Energiesysteme GmbH\nGesellschaft mit beschränkter Haftung\nWurmlingen\n\nDas Gericht beabsichtigt, die Gesellschaft wegen Vermögenslosigkeit im Handelsregister von Amts wegen nach § 394 FamFG zu löschen. Die Frist zur Geltendmachung eines Widerspruchs gegen die beabsichtigte Löschung ist auf zwei Monate ab Veröffentlichung bestimmt."
    },
    {
      "date": "2024-11-18",
      "id": "93796",
      "original_text": "Löschungsankündigung\nNiedersachsen Amtsgericht Lüneburg HRB 211035\nHomeport Water HR GmbH – Celle",
      "type": "Löschungsankündigung",
      "state": "Niedersachsen",
      "amtsgericht": "Amtsgericht Lüneburg",
      "registernummer": "HRB 211035",
      "registerart": "HRB",
      "company_name": "Homeport Water HR GmbH",
      "company_seat": "Celle",
      "details": "18.11.2024 (Bekanntmachungsdatum)\n\nNiedersachsen Amtsgericht Lüneburg HRB 211035\nLöschungsankündigung\n\nHomeport Water HR GmbH\nGesellschaft mit beschränkter Haftung\nCelle\n\nDas Registergericht beabsichtigt, vorstehende Gesellschaft gemäß § 394 Abs. 1 FamFG wegen Vermögenslosigkeit zu löschen. Die Frist zur Erhebung eines Widerspruchs ist auf 1 Monat ab Veröffentlichung festgesetzt."
    },
    {
      "date": "2024-11-18",
      "id": "93832",
      "original_text": "Sonstige Registerbekanntmachung\nNordrhein-Westfalen Amtsgericht Düsseldorf HRB 82256\nIQ Consulting GmbH – Düsseldorf",
      "type": "Sonstige Registerbekanntmachung",
      "state": "Nordrhein-Westfalen",
      "amtsgericht": "Amtsgericht Düsseldorf",
      "registernummer": "HRB 82256",
      "registerart": "HRB",
      "company_name": "IQ Consulting GmbH",
      "company_seat": "Düsseldorf",
      "details": "18.11.2024 (Bekanntmachungsdatum)\n\nNordrhein-Westfalen Amtsgericht Düsseldorf HRB 82256\nSonstige Registerbekanntmachung 18.11.2024 (Eintragungsdatum)\n\nIQ Consulting GmbH\nGesellschaft mit beschränkter Haftung\nDüsseldorf\n\nDie Gesellschaft ist aufgelöst. Von Amts wegen eingetragen."
    },
    {
      "date": "2024-11-18",
      "id": "93726",
      "original_text": "Einreichung neuer Dokumente\nBrandenburg Amtsgericht Cottbus HRB 6224\nISS Energy Services GmbH – Lübbenau/Spreewald",
      "type": "Einreichung neuer Dokumente",
      "state": "Brandenburg",
      "amtsgericht": "Amtsgericht Cottbus",
      "registernummer": "HRB 6224",
      "registerart": "HRB",
      "company_name": "ISS Energy Services GmbH",
      "company_seat": "Lübbenau/Spreewald",
      "details": "18.11.2024 (Bekanntmachungsdatum)\n\nBrandenburg Amtsgericht Cottbus HRB 6224\nEinreichung neuer Dokumente\n\nISS Energy Services GmbH\nGesellschaft mit beschränkter Haftung\nLübbenau/Spreewald\n\nAls nicht eingetragen wird veröffentlicht:\nDie Geschäftsführer haben eine Liste der Aufsichtsratsmitglieder gem. § 52 Abs. 3 Satz 2 GmbHG zum Handelsregister eingereicht."
    },
    {
      "date": "2024-11-18",
      "id": "93748",
      "original_text": "Löschungsankündigung\nBaden-Württemberg Amtsgericht Ulm HRB 743968\nInselDerEnergie GmbH – Göppingen",
      "type": "Löschungsankündigung",
      "state": "Baden-Württemberg",
      "amtsgericht": "Amtsgericht Ulm",
      "registernummer": "HRB 743968",
      "registerart": "HRB",
      "company_name": "InselDerEnergie GmbH",
      "company_seat": "Göppingen",
      "details": "18.11.2024 (Bekanntmachungsdatum)\n\nBaden-Württemberg Amtsgericht Ulm HRB 743968\nLöschungsankündigung\n\nInselDerEnergie GmbH\nGesellschaft mit beschränkter Haftung\nGöppingen\n\nAls nicht eingetragen wird bekanntgemacht:\nDas Gericht beabsichtigt, die Gesellschaft wegen Vermögenslosigkeit im Handelsregister von Amts wegen nach § 394 FamFG zu löschen. Die Frist zur Geltendmachung eines Widerspruchs gegen die beabsichtigte Löschung ist auf  einen Monat ab Veröffentlichung bestimmt."
    },
    {
      "date": "2024-11-18",
      "id": "93850",
      "original_text": "Löschungsankündigung\nHessen Amtsgericht Frankfurt am Main HRB 116629\nJinlong GmbH – Frankfurt am Main",
      "type": "Löschungsankündigung",
      "state": "Hessen",
      "amtsgericht": "Amtsgericht Frankfurt am Main",
      "registernummer": "HRB 116629",
      "registerart": "HRB",
      "company_name": "Jinlong GmbH",
      "company_seat": "Frankfurt am Main",
      "details": "18.11.2024 (Bekanntmachungsdatum)\n\nHessen Amtsgericht Frankfurt am Main HRB 116629\nLöschungsankündigung\n\nJinlong GmbH\nGesellschaft mit beschränkter Haftung\nFrankfurt am Main\n\nEs ist beabsichtigt die Gesellschaft wegen Vermögenslosigkeit gemäß § 394 FamFG von Amts wegen zu löschen. Hiergegen kann innerhalb eines Monats nach dieser Veröffentlichung Widerspruch bei dem Amtsgericht Frankfurt am Main eingelegt werden."
    },
    {
      "date": "2024-11-18",
      "id": "93841",
      "original_text": "Löschungsankündigung\nNordrhein-Westfalen Amtsgericht Bochum HRA 6349\nKALLISTA GmbH & Co. KG – Witten",
      "type": "Löschungsankündigung",
      "state": "Nordrhein-Westfalen",
      "amtsgericht": "Amtsgericht Bochum",
      "registernummer": "HRA 6349",
      "registerart": "HRA",
      "company_name": "KALLISTA GmbH & Co. KG",
      "company_seat": "Witten",
      "details": "18.11.2024 (Bekanntmachungsdatum)\n\nNordrhein-Westfalen Amtsgericht Bochum HRA 6349\nLöschungsankündigung\n\nKALLISTA GmbH & Co. KG\nKommanditgesellschaft\nWitten\n\nDas Registergericht beabsichtigt die Firma von Amts wegen nach § 394 FamFG zu löschen. Die Frist zur Erhebung eines Widerspruchs ist auf drei Monate festgesetzt."
    },
    {
      "date": "2024-11-18",
      "id": "93827",
      "original_text": "Löschungsankündigung\nNordrhein-Westfalen Amtsgericht Hamm HRB 7115\nKNK Service UG (haftungsbeschränkt) – Hamm",
      "type": "Löschungsankündigung",
      "state": "Nordrhein-Westfalen",
      "amtsgericht": "Amtsgericht Hamm",
      "registernummer": "HRB 7115",
      "registerart": "HRB",
      "company_name": "KNK Service UG (haftungsbeschränkt)",
      "company_seat": "Hamm",
      "details": "18.11.2024 (Bekanntmachungsdatum)\n\nNordrhein-Westfalen Amtsgericht Hamm HRB 7115\nLöschungsankündigung\n\nKNK Service UG (haftungsbeschränkt)\nGesellschaft mit beschränkter Haftung\nHamm\n\nDas Registergericht beabsichtigt die Gesellschaft von Amts wegen nach § 394 FamFG zu löschen. Die Frist zur Erhebung eines Widerspruchs ist auf drei Monate festgesetzt."
    },
    {
      "date": "2024-11-18",
      "id": "93742",
      "original_text": "Registerbekanntmachung nach dem Umwandlungsgesetz\nBaden-Württemberg Amtsgericht Stuttgart HRA 741170\nKaroLack Beteiligungs UG (haftungsbeschränkt) & Co.KG – Winnenden",
      "type": "Registerbekanntmachung nach dem Umwandlungsgesetz",
      "state": "Baden-Württemberg",
      "amtsgericht": "Amtsgericht Stuttgart",
      "registernummer": "HRA 741170",
      "registerart": "HRA",
      "company_name": "KaroLack Beteiligungs UG (haftungsbeschränkt) & Co.KG",
      "company_seat": "Winnenden",
      "details": "18.11.2024 (Bekanntmachungsdatum)\n\nBaden-Württemberg Amtsgericht Stuttgart HRA 741170\nRegisterbekanntmachung nach dem Umwandlungsgesetz 18.11.2024 (Eintragungsdatum)\n\nKaroLack Beteiligungs UG (haftungsbeschränkt) & Co.KG\nKommanditgesellschaft\nWinnenden\n\nDen Gläubigern der an der Abspaltung beteiligten Rechtsträger ist, wenn sie binnen sechs Monaten nach dem Tag, an dem die Eintragung der Abspaltung in das Register des Sitzes desjenigen Rechtsträgers, dessen Gläubiger sie sind, nach § 19 Abs. 3 UmwG als bekanntgemacht gilt, ihren Anspruch nach Grund und Höhe schriftlich anmelden, Sicherheit zu leisten, soweit sie nicht Befriedigung verlangen können. Dieses Recht steht den Gläubigern jedoch nur zu, wenn sie glaubhaft machen, dass durch die Abspaltung die Erfüllung ihrer Forderung gefährdet wird."
    },
    {
      "date": "2024-11-18",
      "id": "93759",
      "original_text": "Einreichung neuer Dokumente\nBrandenburg Amtsgericht Neuruppin HRB 9510\nKreiskrankenhaus Prignitz Gesundheitszentrum GmbH – Perleberg",
      "type": "Einreichung neuer Dokumente",
      "state": "Brandenburg",
      "amtsgericht": "Amtsgericht Neuruppin",
      "registernummer": "HRB 9510",
      "registerart": "HRB",
      "company_name": "Kreiskrankenhaus Prignitz Gesundheitszentrum GmbH",
      "company_seat": "Perleberg",
      "details": "18.11.2024 (Bekanntmachungsdatum)\n\nBrandenburg Amtsgericht Neuruppin HRB 9510\nEinreichung neuer Dokumente\n\nKreiskrankenhaus Prignitz Gesundheitszentrum GmbH\nGesellschaft mit beschränkter Haftung\nPerleberg\n\nAls nicht eingetragen wird veröffentlicht: Eine Liste der Mitglieder des Aufsichtsrates wurde zum Handelsregister eingereicht."
    },
    {
      "date": "2024-11-18",
      "id": "93809",
      "original_text": "Registerbekanntmachung nach dem Umwandlungsgesetz\nBremen Amtsgericht Bremen HRB 40899\nKöhlenbeck GmbH – Bremen",
      "type": "Registerbekanntmachung nach dem Umwandlungsgesetz",
      "state": "Bremen",
      "amtsgericht": "Amtsgericht Bremen",
      "registernummer": "HRB 40899",
      "registerart": "HRB",
      "company_name": "Köhlenbeck GmbH",
      "company_seat": "Bremen",
      "details": "18.11.2024 (Bekanntmachungsdatum)\n\nBremen Amtsgericht Bremen HRB 40899\nRegisterbekanntmachung nach dem Umwandlungsgesetz 15.11.2024 (Eintragungsdatum)\n\nKöhlenbeck GmbH\nGesellschaft mit beschränkter Haftung\nBremen\n\nZu Eintragungsnummer 1 vom 15.11.2024 wird als nicht eingetragen veröffentlicht: Den Gläubigern ist, wenn sie binnen sechs Monaten nach dem Tag, an dem die Eintragung der Umwandlung als bekannt gemacht gilt, ihren Anspruch nach Grund und Höhe schriftlich anmelden, Sicherheit zu leisten, soweit sie nicht Befriedigung verlangen können. Dieses Recht steht den Gläubigern jedoch nur zu, wenn sie glaubhaft machen, dass durch die Umwandlung die Erfüllung ihrer Forderung gefährdet wird. Das Recht, Sicherheitsleistung zu verlangen, steht Gläubigern nicht zu, die im Falle der Insolvenz ein Recht auf vorzugsweise Befriedigung aus einer Deckungsmasse haben, die nach gesetzlicher Vorschrift zu ihrem Schutz errichtet und staatlich überwacht ist."
    },
    {
      "date": "2024-11-18",
      "id": "93811",
      "original_text": "Registerbekanntmachung nach dem Umwandlungsgesetz\nBremen Amtsgericht Bremen HRA 21742\nKöhlenbeck OHG – Bremen",
      "type": "Registerbekanntmachung nach dem Umwandlungsgesetz",
      "state": "Bremen",
      "amtsgericht": "Amtsgericht Bremen",
      "registernummer": "HRA 21742",
      "registerart": "HRA",
      "company_name": "Köhlenbeck OHG",
      "company_seat": "Bremen",
      "details": "18.11.2024 (Bekanntmachungsdatum)\n\nBremen Amtsgericht Bremen HRA 21742\nRegisterbekanntmachung nach dem Umwandlungsgesetz 15.11.2024 (Eintragungsdatum)\n\nKöhlenbeck OHG\nOffene Handelsgesellschaft\nBremen\n\nZu Eintragungsnummer 5 vom 15.11.2024 wird als nicht eingetragen veröffentlicht:\nDen Gläubigern ist, wenn sie binnen sechs Monaten nach dem Tag, an dem die Eintragung der formwechselnden Umwandlung als bekannt gemacht gilt, ihren Anspruch nach Grund und Höhe schriftlich anmelden, Sicherheit zu leisten, soweit sie nicht Befriedigung verlangen können. Dieses Recht steht den Gläubigern jedoch nur zu, wenn sie glaubhaft machen, dass durch die formwechselnde Umwandlung die Erfüllung ihrer Forderung gefährdet wird. Das Recht, Sicherheitsleistung zu verlangen, steht Gläubigern nicht zu, die im Falle der Insolvenz ein Recht auf vorzugsweise Befriedigung aus einer Deckungsmasse haben, die nach gesetzlicher Vorschrift zu ihrem Schutz errichtet und staatlich überwacht ist."
    },
    {
      "date": "2024-11-18",
      "id": "93739",
      "original_text": "Löschungsankündigung\nBaden-Württemberg Amtsgericht Ulm HRB 735652\nLeBu Restaurant GmbH – Ulm",
      "type": "Löschungsankündigung",
      "state": "Baden-Württemberg",
      "amtsgericht": "Amtsgericht Ulm",
      "registernummer": "HRB 735652",
      "registerart": "HRB",
      "company_name": "LeBu Restaurant GmbH",
      "company_seat": "Ulm",
      "details": "18.11.2024 (Bekanntmachungsdatum)\n\nBaden-Württemberg Amtsgericht Ulm HRB 735652\nLöschungsankündigung\n\nLeBu Restaurant GmbH\nGesellschaft mit beschränkter Haftung\nUlm\n\nDas Gericht beabsichtigt, die Gesellschaft wegen Vermögenslosigkeit im Handelsregister von Amts wegen nach § 394 FamFG zu löschen. Die Frist zur Geltendmachung eines Widerspruchs gegen die beabsichtigte Löschung ist auf  einen Monat ab Veröffentlichung bestimmt."
    },
    {
      "date": "2024-11-18",
      "id": "93797",
      "original_text": "Registerbekanntmachung nach dem Umwandlungsgesetz\nNiedersachsen Amtsgericht Lüneburg VR 623\nLebenshilfe Lüneburg e.V. – Lüneburg",
      "type": "Registerbekanntmachung nach dem Umwandlungsgesetz",
      "state": "Niedersachsen",
      "amtsgericht": "Amtsgericht Lüneburg",
      "registernummer": "VR 623",
      "registerart": "VR",
      "company_name": "Lebenshilfe Lüneburg e.V.",
      "company_seat": "Lüneburg",
      "details": "18.11.2024 (Bekanntmachungsdatum)\n\nNiedersachsen Amtsgericht Lüneburg VR 623\nRegisterbekanntmachung nach dem Umwandlungsgesetz 18.11.2024 (Eintragungsdatum)\n\nLebenshilfe Lüneburg e.V.\neingetragener Verein\nLüneburg\n\nDen Gläubigern der an der Verschmelzung beteiligten Rechtsträger ist, wenn sie binnen sechs Monaten nach dem Tag, an dem die Eintragung der Verschmelzung in das Register des Sitzes desjenigen Rechtsträgers, dessen Gläubiger sie sind, nach § 19  Abs.  3 UmwG als bekannt gemacht gilt, ihren Anspruch nach Grund und Höhe schriftlich anmelden, Sicherheit zu leisten, soweit sie nicht Befriedigung verlangen können. Dieses Recht steht den Gläubigern jedoch nur zu, wenn sie glaubhaft machen, dass durch die Verschmelzung die Erfüllung der Forderung gefährdet wird."
    },
    {
      "date": "2024-11-18",
      "id": "93765",
      "original_text": "Registerbekanntmachung nach dem Umwandlungsgesetz\nBerlin Amtsgericht Berlin (Charlottenburg) HRB 202355\nLikeminded GmbH – Berlin",
      "type": "Registerbekanntmachung nach dem Umwandlungsgesetz",
      "state": "Berlin",
      "amtsgericht": "Amtsgericht Berlin (Charlottenburg)",
      "registernummer": "HRB 202355",
      "registerart": "HRB",
      "company_name": "Likeminded GmbH",
      "company_seat": "Berlin",
      "details": "18.11.2024 (Bekanntmachungsdatum)\n\nBerlin Amtsgericht Berlin (Charlottenburg) HRB 202355\nRegisterbekanntmachung nach dem Umwandlungsgesetz 16.11.2024 (Eintragungsdatum)\n\nLikeminded GmbH\nGesellschaft mit beschränkter Haftung\nBerlin\n\nZu Eintragungsnummer 16 vom 16.11.2024 wird als nicht eingetragen veröffentlicht:\n\nDen Gläubigern der an der Verschmelzung beteiligten Rechtsträger ist, wenn sie binnen sechs Monaten nach dem Tag, an dem die Eintragung der Verschmelzung in das Register des Sitzes desjenigen Rechtsträgers, dessen Gläubiger sie sind, als bekannt gemacht gilt, ihren Anspruch nach Grund und Höhe schriftlich anmelden, Sicherheit zu leisten, soweit sie nicht Befriedigung verlangen können. Dieses Recht steht den Gläubigern jedoch nur zu, wenn sie glaubhaft machen, dass durch die Verschmelzung die Erfüllung ihrer Forderung gefährdet wird. Das Recht, Sicherheitsleistung zu verlangen, steht Gläubigern nicht zu, die im Falle der Insolvenz ein Recht auf vorzugsweise Befriedigung aus einer Deckungsmasse haben, die nach gesetzlicher Vorschrift zu ihrem Schutz errichtet und staatlich überwacht ist."
    },
    {
      "date": "2024-11-18",
      "id": "93764",
      "original_text": "Registerbekanntmachung nach dem Umwandlungsgesetz\nBerlin Amtsgericht Berlin (Charlottenburg) HRB 216878\nLikenilo GmbH – Berlin",
      "type": "Registerbekanntmachung nach dem Umwandlungsgesetz",
      "state": "Berlin",
      "amtsgericht": "Amtsgericht Berlin (Charlottenburg)",
      "registernummer": "HRB 216878",
      "registerart": "HRB",
      "company_name": "Likenilo GmbH",
      "company_seat": "Berlin",
      "details": "18.11.2024 (Bekanntmachungsdatum)\n\nBerlin Amtsgericht Berlin (Charlottenburg) HRB 216878\nRegisterbekanntmachung nach dem Umwandlungsgesetz 16.11.2024 (Eintragungsdatum)\n\nLikenilo GmbH\nGesellschaft mit beschränkter Haftung\nBerlin\n\nZu Eintragungsnummer 9 vom 16.11.2024 wird als nicht eingetragen veröffentlicht:\n\nDen Gläubigern der an der Verschmelzung beteiligten Rechtsträger ist, wenn sie binnen sechs Monaten nach dem Tag, an dem die Eintragung der Verschmelzung in das Register des Sitzes desjenigen Rechtsträgers, dessen Gläubiger sie sind, als bekannt gemacht gilt, ihren Anspruch nach Grund und Höhe schriftlich anmelden, Sicherheit zu leisten, soweit sie nicht Befriedigung verlangen können. Dieses Recht steht den Gläubigern jedoch nur zu, wenn sie glaubhaft machen, dass durch die Verschmelzung die Erfüllung ihrer Forderung gefährdet wird. Das Recht, Sicherheitsleistung zu verlangen, steht Gläubigern nicht zu, die im Falle der Insolvenz ein Recht auf vorzugsweise Befriedigung aus einer Deckungsmasse haben, die nach gesetzlicher Vorschrift zu ihrem Schutz errichtet und staatlich überwacht ist."
    },
    {
      "date": "2024-11-18",
      "id": "93795",
      "original_text": "Registerbekanntmachung nach dem Umwandlungsgesetz\nNiedersachsen Amtsgericht Oldenburg (Oldenburg) HRB 215494\nLivest Management Verwaltungs GmbH – Westerstede",
      "type": "Registerbekanntmachung nach dem Umwandlungsgesetz",
      "state": "Niedersachsen",
      "amtsgericht": "Amtsgericht Oldenburg (Oldenburg)",
      "registernummer": "HRB 215494",
      "registerart": "HRB",
      "company_name": "Livest Management Verwaltungs GmbH",
      "company_seat": "Westerstede",
      "details": "18.11.2024 (Bekanntmachungsdatum)\n\nNiedersachsen Amtsgericht Oldenburg (Oldenburg) HRB 215494\nRegisterbekanntmachung nach dem Umwandlungsgesetz 18.11.2024 (Eintragungsdatum)\n\nLivest Management Verwaltungs GmbH\nGesellschaft mit beschränkter Haftung\nWesterstede\n\nDen Gläubigern der an der Verschmelzung beteiligten Rechtsträger ist, wenn sie binnen sechs Monaten nach dem Tag, an dem die Eintragung der Verschmelzung in das Register des Sitzes desjenigen Rechtsträgers, dessen Gläubiger sie sind, nach § 19  Abs.  3 UmwG als bekannt gemacht gilt, ihren Anspruch nach Grund und Höhe schriftlich anmelden, Sicherheit zu leisten, soweit sie nicht Befriedigung verlangen können. Dieses Recht steht den Gläubigern jedoch nur zu, wenn sie glaubhaft machen, dass durch die Verschmelzung die Erfüllung der Forderung gefährdet wird."
    },
    {
      "date": "2024-11-18",
      "id": "93745",
      "original_text": "Löschungsankündigung\nBerlin Amtsgericht Berlin (Charlottenburg) HRA 55863\nLogNet Mobility GmbH & Co. KG – Berlin",
      "type": "Löschungsankündigung",
      "state": "Berlin",
      "amtsgericht": "Amtsgericht Berlin (Charlottenburg)",
      "registernummer": "HRA 55863",
      "registerart": "HRA",
      "company_name": "LogNet Mobility GmbH & Co. KG",
      "company_seat": "Berlin",
      "details": "18.11.2024 (Bekanntmachungsdatum)\n\nBerlin Amtsgericht Berlin (Charlottenburg) HRA 55863\nLöschungsankündigung\n\nLogNet Mobility  GmbH & Co. KG\nKommanditgesellschaft\nBerlin\n\nBei dem nachstehenden Unternehmen / der nachstehenden Gesellschaft wird das Amtslöschungsverfahren gemäß § 31 Abs. 2 HGB eingeleitet. Widerspruchsfrist 2 Monate"
    },
    {
      "date": "2024-11-18",
      "id": "93727",
      "original_text": "Löschungsankündigung\nBaden-Württemberg Amtsgericht Mannheim HRB 734711\nMB Gastro GmbH – Karlsruhe",
      "type": "Löschungsankündigung",
      "state": "Baden-Württemberg",
      "amtsgericht": "Amtsgericht Mannheim",
      "registernummer": "HRB 734711",
      "registerart": "HRB",
      "company_name": "MB Gastro GmbH",
      "company_seat": "Karlsruhe",
      "details": "18.11.2024 (Bekanntmachungsdatum)\n\nBaden-Württemberg Amtsgericht Mannheim HRB 734711\nLöschungsankündigung\n\nMB Gastro GmbH\nGesellschaft mit beschränkter Haftung\nKarlsruhe\n\nAls nicht eingetragen wird bekanntgemacht:\nDas Gericht beabsichtigt, die Gesellschaft wegen Vermögenslosigkeit im Handelsregister von Amts wegen nach § 394 FamFG zu löschen. Die Frist zur Geltendmachung eines Widerspruchs gegen die beabsichtigte Löschung ist auf einen Monat ab Veröffentlichung bestimmt."
    },
    {
      "date": "2024-11-18",
      "id": "93806",
      "original_text": "Einreichung neuer Dokumente\nRheinland-Pfalz Amtsgericht Mainz HRB 7351\nMainzer Verkehrsgesellschaft mbH – Mainz",
      "type": "Einreichung neuer Dokumente",
      "state": "Rheinland-Pfalz",
      "amtsgericht": "Amtsgericht Mainz",
      "registernummer": "HRB 7351",
      "registerart": "HRB",
      "company_name": "Mainzer Verkehrsgesellschaft mbH",
      "company_seat": "Mainz",
      "details": "18.11.2024 (Bekanntmachungsdatum)\n\nRheinland-Pfalz Amtsgericht Mainz HRB 7351\nEinreichung neuer Dokumente\n\nMainzer Verkehrsgesellschaft mbH\nGesellschaft mit beschränkter Haftung\nMainz\n\nDem Registergericht ist eine neue Liste der Mitglieder des Aufsichtsrates eingereicht worden."
    },
    {
      "date": "2024-11-18",
      "id": "93853",
      "original_text": "Einreichung neuer Dokumente\nHessen Amtsgericht Darmstadt HRB 94724\nMaswer AG – Rüsselsheim",
      "type": "Einreichung neuer Dokumente",
      "state": "Hessen",
      "amtsgericht": "Amtsgericht Darmstadt",
      "registernummer": "HRB 94724",
      "registerart": "HRB",
      "company_name": "Maswer AG",
      "company_seat": "Rüsselsheim",
      "details": "18.11.2024 (Bekanntmachungsdatum)\n\nHessen Amtsgericht Darmstadt HRB 94724\nEinreichung neuer Dokumente\n\nMaswer AG\nAktiengesellschaft\nRüsselsheim\n\nDurch eine Änderung in den Personen der Aufsichtsratsmitglieder ist eine Liste der Mitglieder des Aufsichtsrates zum Handelsregister eingereicht worden."
    },
    {
      "date": "2024-11-18",
      "id": "93818",
      "original_text": "Löschungsankündigung\nNordrhein-Westfalen Amtsgericht Aachen HRB 16164\nMetra Energy Systems GmbH – Aachen",
      "type": "Löschungsankündigung",
      "state": "Nordrhein-Westfalen",
      "amtsgericht": "Amtsgericht Aachen",
      "registernummer": "HRB 16164",
      "registerart": "HRB",
      "company_name": "Metra Energy Systems GmbH",
      "company_seat": "Aachen",
      "details": "18.11.2024 (Bekanntmachungsdatum)\n\nNordrhein-Westfalen Amtsgericht Aachen HRB 16164\nLöschungsankündigung\n\nMetra Energy Systems GmbH\nGesellschaft mit beschränkter Haftung\nAachen\n\nDas Registergericht beabsichtigt, von Amts wegen die Gesellschaft wegen Vermögenslosigkeit nach § 394 FamFG zu löschen, weil das Finanzamt Aachen-Stadt Umstände mitgeteilt hat, aufgrund derer das Gericht davon überzeugt ist, dass die Gesellschaft vollständig vermögenslos ist.\n\nZur Geltendmachung des Widerspruchs gegen die beabsichtigte Löschung wird hiermit eine Frist von einem Monat ab Veröffentlichung dieser Ankündigung bestimmt.\n\nRechtsbehelfsbelehrung:\n\nGegen diese Verfügung kann Widerspruch eingelegt werden. Zum Widerspruch ist jeder berechtigt, der an der Unterlassung der Löschung ein berechtigtes Interesse hat.\n\nDer Widerspruch ist bei dem Amtsgericht Aachen, Adalbertsteinweg 92, 52070 Aachen schriftlich in deutscher Sprache oder zur Niederschrift der Geschäftsstelle einzulegen. Der Widerspruch kann auch zur Niederschrift der Geschäftsstelle eines jeden Amtsgerichtes abgegeben werden.\n\nDer Widerspruch muss spätestens innerhalb der gesetzten Frist nach der Bekanntgabe der Verfügung bei dem Amtsgericht Aachen eingegangen sein. Dies gilt auch dann, wenn der Widerspruch zur Niederschrift der Geschäftsstelle eines anderen Amtsgerichtes abgegeben wurde. Die Frist beginnt mit der Bekanntgabe der Verfügung durch Veröffentlichung. Fällt das Ende der Frist auf einen Sonntag, einen allgemeinen Feiertag oder Sonnabend, so endet die Frist mit Ablauf des nächsten Werktages.\n\nDer Widerspruch muss die Bezeichnung der angefochtenen Verfügung sowie die Erklärung enthalten, dass Widerspruch gegen diese Verfügung eingelegt wird. Er ist zu unterzeichnen und soll begründet werden.\n\nDie Einlegung ist auch durch Übertragung eines elektronischen Dokuments an die elektronische Poststelle des Gerichts möglich. Das elektronische Dokument muss für die Bearbeitung durch das Gericht geeignet und mit einer qualifizierten elektronischen Signatur der verantwortenden Person versehen sein oder von der verantwortenden Person signiert und auf einem sicheren Übermittlungsweg gemäß § 130 a ZPO nach näherer Maßgabe der Verordnung über die technischen Rahmenbedingungen des elektronischen Rechtsverkehrs und über das besondere elektronische Behördenpostfach (BGBl. I, S. 3803) eingereicht werden. Weitere Informationen erhalten Sie auf der Internetseite www.justiz.de."
    },
    {
      "date": "2024-11-18",
      "id": "93823",
      "original_text": "Registerbekanntmachung nach dem Umwandlungsgesetz\nNordrhein-Westfalen Amtsgericht Arnsberg GsR 10\nMirta und Simon Rothschild eGbR – Meschede",
      "type": "Registerbekanntmachung nach dem Umwandlungsgesetz",
      "state": "Nordrhein-Westfalen",
      "amtsgericht": "Amtsgericht Arnsberg",
      "registernummer": "GsR 10",
      "registerart": "GsR",
      "company_name": "Mirta und Simon Rothschild eGbR",
      "company_seat": "Meschede",
      "details": "18.11.2024 (Bekanntmachungsdatum)\n\nNordrhein-Westfalen Amtsgericht Arnsberg GsR 10\nRegisterbekanntmachung nach dem Umwandlungsgesetz 18.11.2024 (Eintragungsdatum)\n\nMirta und Simon Rothschild eGbR\nGesellschaft bürgerlichen Rechts\nMeschede\n\nDen Gläubigern der an der formwechselnden Umwandlung beteiligten Rechtsträger ist, wenn sie binnen sechs Monaten nach dem Tag, an dem die Eintragung der formwechselnden Umwandlung in das Register des Sitzes desjenigen Rechtsträgers, dessen Gläubiger sie sind, nach § 19 Absatz 3 UmwG als bekanntgemacht gilt, ihren Anspruch nach Grund und Höhe schriftlich anmelden, Sicherheit zu leisten, soweit sie nicht Befriedigung verlangen können. Dieses Recht steht den Gläubigern jedoch nur zu, wenn sie glaubhaft machen, dass durch die formwechselnden Umwandlung die Erfüllung ihrer Forderung gefährdet wird."
    },
    {
      "date": "2024-11-18",
      "id": "93732",
      "original_text": "Löschungsankündigung\nBerlin Amtsgericht Berlin (Charlottenburg) HRB 186914\nMylonas Food & Beverage GmbH – Berlin",
      "type": "Löschungsankündigung",
      "state": "Berlin",
      "amtsgericht": "Amtsgericht Berlin (Charlottenburg)",
      "registernummer": "HRB 186914",
      "registerart": "HRB",
      "company_name": "Mylonas Food & Beverage GmbH",
      "company_seat": "Berlin",
      "details": "18.11.2024 (Bekanntmachungsdatum)\n\nBerlin Amtsgericht Berlin (Charlottenburg) HRB 186914\nLöschungsankündigung\n\nMylonas Food & Beverage GmbH\nGesellschaft mit beschränkter Haftung\nBerlin\n\nBei der nachstehenden Gesellschaft wird das Amtslöschungsverfahren gemäß § 394 FamFG eingeleitet. Widerspruchsfrist 6 Wochen"
    },
    {
      "date": "2024-11-18",
      "id": "93731",
      "original_text": "Löschungsankündigung\nSchleswig-Holstein Amtsgericht Flensburg HRB 14466\nNORDIKDESIGN GmbH – Flensburg",
      "type": "Löschungsankündigung",
      "state": "Schleswig-Holstein",
      "amtsgericht": "Amtsgericht Flensburg",
      "registernummer": "HRB 14466",
      "registerart": "HRB",
      "company_name": "NORDIKDESIGN GmbH",
      "company_seat": "Flensburg",
      "details": "18.11.2024 (Bekanntmachungsdatum)\n\nSchleswig-Holstein Amtsgericht Flensburg HRB 14466\nLöschungsankündigung\n\nNORDIKDESIGN GmbH\nGesellschaft mit beschränkter Haftung\nFlensburg\n\nEs ist die Löschung der nachstehenden Gesellschaft wegen Vermögenslosigkeit gemäß § 394 FamFG beabsichtigt.\nWiderspruchsfrist: 2 Monate."
    },
    {
      "date": "2024-11-18",
      "id": "93817",
      "original_text": "Löschungsankündigung\nNordrhein-Westfalen Amtsgericht Dortmund HRB 25540\nNachtumschau GmbH – Dortmund",
      "type": "Löschungsankündigung",
      "state": "Nordrhein-Westfalen",
      "amtsgericht": "Amtsgericht Dortmund",
      "registernummer": "HRB 25540",
      "registerart": "HRB",
      "company_name": "Nachtumschau GmbH",
      "company_seat": "Dortmund",
      "details": "18.11.2024 (Bekanntmachungsdatum)\n\nNordrhein-Westfalen Amtsgericht Dortmund HRB 25540\nLöschungsankündigung\n\nNachtumschau GmbH\nGesellschaft mit beschränkter Haftung\nDortmund\n\nDas Registergericht beabsichtigt die Gesellschaft von Amts wegen nach § 394 FamFG zu löschen. Die Frist zur Erhebung eines Widerspruchs ist auf zwei Monate festgesetzt."
    },
    {
      "date": "2024-11-18",
      "id": "93751",
      "original_text": "Löschungsankündigung\nBerlin Amtsgericht Berlin (Charlottenburg) HRB 66376\nOMC Object Management Consulting Gesellschaft mit beschränkter Haftung – Berlin",
      "type": "Löschungsankündigung",
      "state": "Berlin",
      "amtsgericht": "Amtsgericht Berlin (Charlottenburg)",
      "registernummer": "HRB 66376",
      "registerart": "HRB",
      "company_name": "OMC Object Management Consulting Gesellschaft mit beschränkter Haftung",
      "company_seat": "Berlin",
      "details": "18.11.2024 (Bekanntmachungsdatum)\n\nBerlin Amtsgericht Berlin (Charlottenburg) HRB 66376\nLöschungsankündigung\n\nOMC Object Management Consulting Gesellschaft mit beschränkter Haftung\nGesellschaft mit beschränkter Haftung\nBerlin\n\nBei der nachstehenden Gesellschaft wird das Amtslöschungsverfahren gemäß § 394 FamFG eingeleitet. Widerspruchsfrist 6 Wochen"
    },
    {
      "date": "2024-11-18",
      "id": "93801",
      "original_text": "Löschungsankündigung\nNiedersachsen Amtsgericht Lüneburg HRB 208798\nOMG GmbH – Undeloh",
      "type": "Löschungsankündigung",
      "state": "Niedersachsen",
      "amtsgericht": "Amtsgericht Lüneburg",
      "registernummer": "HRB 208798",
      "registerart": "HRB",
      "company_name": "OMG GmbH",
      "company_seat": "Undeloh",
      "details": "18.11.2024 (Bekanntmachungsdatum)\n\nNiedersachsen Amtsgericht Lüneburg HRB 208798\nLöschungsankündigung\n\nOMG GmbH\nGesellschaft mit beschränkter Haftung\nUndeloh\n\nDas Registergericht beabsichtigt, die Gesellschaft von Amts wegen nach § 394 FamFG zu löschen. Die Frist zur Erhebung eines Widerspruchs ist auf 1 Monat ab dieser Registerbekanntmachung festgesetzt."
    },
    {
      "date": "2024-11-18",
      "id": "93775",
      "original_text": "Registerbekanntmachung nach dem Umwandlungsgesetz\nBaden-Württemberg Amtsgericht Ulm HRB 748882\nPIR Investments GmbH – Oberkochen",
      "type": "Registerbekanntmachung nach dem Umwandlungsgesetz",
      "state": "Baden-Württemberg",
      "amtsgericht": "Amtsgericht Ulm",
      "registernummer": "HRB 748882",
      "registerart": "HRB",
      "company_name": "PIR Investments GmbH",
      "company_seat": "Oberkochen",
      "details": "18.11.2024 (Bekanntmachungsdatum)\n\nBaden-Württemberg Amtsgericht Ulm HRB 748882\nRegisterbekanntmachung nach dem Umwandlungsgesetz 18.11.2024 (Eintragungsdatum)\n\nPIR Investments GmbH\nGesellschaft mit beschränkter Haftung\nOberkochen\n\nDen Gläubigern der an der Ausgliederung beteiligten Rechtsträger ist, wenn sie binnen sechs Monaten nach dem Tag, an dem die Eintragung der Ausgliederung in das Register des Sitzes desjenigen Rechtsträgers, dessen Gläubiger sie sind, nach § 19 Abs. 3 UmwG als bekanntgemacht gilt, ihren Anspruch nach Grund und Höhe schriftlich anmelden, Sicherheit zu leisten, soweit sie nicht Befriedigung verlangen können. Dieses Recht steht den Gläubigern jedoch nur zu, wenn sie glaubhaft machen, dass durch die Ausgliederung die Erfüllung ihrer Forderung gefährdet wird."
    },
    {
      "date": "2024-11-18",
      "id": "93776",
      "original_text": "Registerbekanntmachung nach dem Umwandlungsgesetz\nBaden-Württemberg Amtsgericht Ulm HRA 501011\nPIR Vermögensverwaltung GmbH & Co. KG – Oberkochen",
      "type": "Registerbekanntmachung nach dem Umwandlungsgesetz",
      "state": "Baden-Württemberg",
      "amtsgericht": "Amtsgericht Ulm",
      "registernummer": "HRA 501011",
      "registerart": "HRA",
      "company_name": "PIR Vermögensverwaltung GmbH & Co. KG",
      "company_seat": "Oberkochen",
      "details": "18.11.2024 (Bekanntmachungsdatum)\n\nBaden-Württemberg Amtsgericht Ulm HRA 501011\nRegisterbekanntmachung nach dem Umwandlungsgesetz 18.11.2024 (Eintragungsdatum)\n\nPIR Vermögensverwaltung GmbH & Co. KG\nKommanditgesellschaft\nOberkochen\n\nAls nicht eingetragen wird bekanntgemacht:\nDen Gläubigern der an der Ausgliederung beteiligten Rechtsträger ist, wenn sie binnen sechs Monaten nach dem Tag, an dem die Eintragung der Ausgliederung in das Register des Sitzes desjenigen Rechtsträgers, dessen Gläubiger sie sind, nach § 19 Abs. 3 UmwG als bekanntgemacht gilt, ihren Anspruch nach Grund und Höhe schriftlich anmelden, Sicherheit zu leisten, soweit sie nicht Befriedigung verlangen können. Dieses Recht steht den Gläubigern jedoch nur zu, wenn sie glaubhaft machen, dass durch die Ausgliederung die Erfüllung ihrer Forderung gefährdet wird."
    },
    {
      "date": "2024-11-18",
      "id": "93840",
      "original_text": "Löschungsankündigung\nNordrhein-Westfalen Amtsgericht Köln HRB 107455\nPLEWA BAU PROTECT UG (haftungsbeschränkt) – Erftstadt",
      "type": "Löschungsankündigung",
      "state": "Nordrhein-Westfalen",
      "amtsgericht": "Amtsgericht Köln",
      "registernummer": "HRB 107455",
      "registerart": "HRB",
      "company_name": "PLEWA BAU PROTECT UG (haftungsbeschränkt)",
      "company_seat": "Erftstadt",
      "details": "18.11.2024 (Bekanntmachungsdatum)\n\nNordrhein-Westfalen Amtsgericht Köln HRB 107455\nLöschungsankündigung\n\nPLEWA BAU PROTECT UG (haftungsbeschränkt)\nGesellschaft mit beschränkter Haftung\nErftstadt\n\nDas Registergericht beabsichtigt die Gesellschaft von Amts wegen nach § 394 FamFG zu löschen. Die Frist zur Erhebung eines Widerspruchs ist auf einen Monat festgesetzt."
    },
    {
      "date": "2024-11-18",
      "id": "93815",
      "original_text": "Löschungsankündigung\nNordrhein-Westfalen Amtsgericht Dortmund HRB 29599\nPROTELCOM GmbH – Lünen",
      "type": "Löschungsankündigung",
      "state": "Nordrhein-Westfalen",
      "amtsgericht": "Amtsgericht Dortmund",
      "registernummer": "HRB 29599",
      "registerart": "HRB",
      "company_name": "PROTELCOM GmbH",
      "company_seat": "Lünen",
      "details": "18.11.2024 (Bekanntmachungsdatum)\n\nNordrhein-Westfalen Amtsgericht Dortmund HRB 29599\nLöschungsankündigung 05.01.2022 (Eintragungsdatum)\n\nPROTELCOM GmbH\nGesellschaft mit beschränkter Haftung\nLünen\n\nDas Registergericht beabsichtigt die Gesellschaft von Amts wegen nach § 394 FamFG zu löschen. Die Frist zur Erhebung eines Widerspruchs ist auf zwei Monate festgesetzt."
    },
    {
      "date": "2024-11-18",
      "id": "93798",
      "original_text": "Registerbekanntmachung nach dem Umwandlungsgesetz\nNiedersachsen Amtsgericht Walsrode HRB 212342\nPalliativstützpunkt Rotenburg (Wümme) und Umgebung gemeinnützige GmbH – Rotenburg (Wümme)",
      "type": "Registerbekanntmachung nach dem Umwandlungsgesetz",
      "state": "Niedersachsen",
      "amtsgericht": "Amtsgericht Walsrode",
      "registernummer": "HRB 212342",
      "registerart": "HRB",
      "company_name": "Palliativstützpunkt Rotenburg (Wümme) und Umgebung gemeinnützige GmbH",
      "company_seat": "Rotenburg (Wümme)",
      "details": "18.11.2024 (Bekanntmachungsdatum)\n\nNiedersachsen Amtsgericht Walsrode HRB 212342\nRegisterbekanntmachung nach dem Umwandlungsgesetz 18.11.2024 (Eintragungsdatum)\n\nPalliativstützpunkt Rotenburg (Wümme) und Umgebung gemeinnützige GmbH\nGesellschaft mit beschränkter Haftung\nRotenburg (Wümme)\n\nDen Gläubigern der an der Ausgliederung beteiligten Rechtsträgern ist, wenn sie binnen sechs Monaten nach dem Tag, an dem die Eintragung der Ausgliederung in das Register des Sitzes desjenigen Rechtsträgers, dessen Gläubiger sie sind, nach § 19 Abs. 3 UmwG als bekannt gemacht gilt, ihren Anspruch nach Grund und Höhe schriftlich anmelden, Sicherheit zu leisten, soweit sie nicht Befriedigung verlangen können. Dieses Recht steht den Gläubigern jedoch nur zu, wenn sie glaubhaft machen, dass durch die Ausgliederung die Erfüllung der Forderung gefährdet wird."
    },
    {
      "date": "2024-11-18",
      "id": "93788",
      "original_text": "Registerbekanntmachung nach dem Umwandlungsgesetz\nNiedersachsen Amtsgericht Walsrode VR 200904\nPalliativstützpunkt Rotenburg/Wümme und Umgebung e.V. – Rotenburg (Wümme)",
      "type": "Registerbekanntmachung nach dem Umwandlungsgesetz",
      "state": "Niedersachsen",
      "amtsgericht": "Amtsgericht Walsrode",
      "registernummer": "VR 200904",
      "registerart": "VR",
      "company_name": "Palliativstützpunkt Rotenburg/Wümme und Umgebung e.V.",
      "company_seat": "Rotenburg (Wümme)",
      "details": "18.11.2024 (Bekanntmachungsdatum)\n\nNiedersachsen Amtsgericht Walsrode VR 200904\nRegisterbekanntmachung nach dem Umwandlungsgesetz 18.11.2024 (Eintragungsdatum)\n\nPalliativstützpunkt Rotenburg/Wümme und Umgebung e.V.\neingetragener Verein\nRotenburg (Wümme)\n\nDen Gläubigern der an der Ausgliederung beteiligten Rechtsträgern ist, wenn sie binnen sechs Monaten nach dem Tag, an dem die Eintragung der Ausgliederung in das Register des Sitzes desjenigen Rechtsträgers, dessen Gläubiger sie sind, nach § 19 Abs. 3 UmwG als bekannt gemacht gilt, ihren Anspruch nach Grund und Höhe schriftlich anmelden, Sicherheit zu leisten, soweit sie nicht Befriedigung verlangen können. Dieses Recht steht den Gläubigern jedoch nur zu, wenn sie glaubhaft machen, dass durch die Ausgliederung die Erfüllung der Forderung gefährdet wird."
    },
    {
      "date": "2024-11-18",
      "id": "93810",
      "original_text": "Löschungsankündigung\nRheinland-Pfalz Amtsgericht Ludwigshafen a.Rhein (Ludwigshafen) HRB 2711\nPokalvertrieb Wiebelskircher GmbH – Maxdorf",
      "type": "Löschungsankündigung",
      "state": "Rheinland-Pfalz",
      "amtsgericht": "Amtsgericht Ludwigshafen a.Rhein (Ludwigshafen)",
      "registernummer": "HRB 2711",
      "registerart": "HRB",
      "company_name": "Pokalvertrieb Wiebelskircher GmbH",
      "company_seat": "Maxdorf",
      "details": "18.11.2024 (Bekanntmachungsdatum)\n\nRheinland-Pfalz Amtsgericht Ludwigshafen a.Rhein (Ludwigshafen) HRB 2711\nLöschungsankündigung\n\nPokalvertrieb Wiebelskircher GmbH\nGesellschaft mit beschränkter Haftung\nMaxdorf\n\nDas Registergericht beabsichtigt die Gesellschaft von Amts wegen nach § 394 FamFG zu löschen. Die Frist zur Erhebung eines Widerspruchs ist auf einen Monat festgesetzt."
    },
    {
      "date": "2024-11-18",
      "id": "93854",
      "original_text": "Löschungsankündigung\nHessen Amtsgericht Wiesbaden HRB 31138\nPrasse GmbH – Idstein",
      "type": "Löschungsankündigung",
      "state": "Hessen",
      "amtsgericht": "Amtsgericht Wiesbaden",
      "registernummer": "HRB 31138",
      "registerart": "HRB",
      "company_name": "Prasse GmbH",
      "company_seat": "Idstein",
      "details": "18.11.2024 (Bekanntmachungsdatum)\n\nHessen Amtsgericht Wiesbaden HRB 31138\nLöschungsankündigung\n\nPrasse GmbH\nGesellschaft mit beschränkter Haftung\nIdstein\n\nDas Registergericht beabsichtigt die im Handelsregister eingetragene Gesellschaft von Amts wegen nach § 394 FamFG zu löschen. Die Frist zur Erhebung eines Widerspruchs gegen die beabsichtigte Löschung wird auf 3 Monate festgesetzt."
    },
    {
      "date": "2024-11-18",
      "id": "93825",
      "original_text": "Sonstige Registerbekanntmachung\nNordrhein-Westfalen Amtsgericht Düsseldorf HRB 84541\nR. U. P. Consulting UG (haftungsbeschränkt) – Düsseldorf",
      "type": "Sonstige Registerbekanntmachung",
      "state": "Nordrhein-Westfalen",
      "amtsgericht": "Amtsgericht Düsseldorf",
      "registernummer": "HRB 84541",
      "registerart": "HRB",
      "company_name": "R. U. P. Consulting UG (haftungsbeschränkt)",
      "company_seat": "Düsseldorf",
      "details": "18.11.2024 (Bekanntmachungsdatum)\n\nNordrhein-Westfalen Amtsgericht Düsseldorf HRB 84541\nSonstige Registerbekanntmachung 18.11.2024 (Eintragungsdatum)\n\nR. U. P. Consulting UG (haftungsbeschränkt)\nGesellschaft mit beschränkter Haftung\nDüsseldorf\n\nDie Gesellschaft ist aufgelöst. Von Amts wegen eingetragen."
    },
    {
      "date": "2024-11-18",
      "id": "93829",
      "original_text": "Registerbekanntmachung nach dem Umwandlungsgesetz\nNordrhein-Westfalen Amtsgericht Steinfurt HRB 15183\nRAWEAR GmbH – Laer",
      "type": "Registerbekanntmachung nach dem Umwandlungsgesetz",
      "state": "Nordrhein-Westfalen",
      "amtsgericht": "Amtsgericht Steinfurt",
      "registernummer": "HRB 15183",
      "registerart": "HRB",
      "company_name": "RAWEAR GmbH",
      "company_seat": "Laer",
      "details": "18.11.2024 (Bekanntmachungsdatum)\n\nNordrhein-Westfalen Amtsgericht Steinfurt HRB 15183\nRegisterbekanntmachung nach dem Umwandlungsgesetz 18.11.2024 (Eintragungsdatum)\n\nRAWEAR GmbH\nGesellschaft mit beschränkter Haftung\nLaer\n\nDen Gläubigern der an der Ausgliederung beteiligten Rechtsträger ist, wenn sie binnen sechs Monaten nach dem Tag, an dem die Eintragung der Ausgliederung in das Register des Sitzes desjenigen Rechtsträgers, dessen Gläubiger sie sind, nach § 19 Absatz 3 UmwG als bekanntgemacht gilt, ihren Anspruch nach Grund und Höhe schriftlich anmelden, Sicherheit zu leisten, soweit sie nicht Befriedigung verlangen können. Dieses Recht steht den Gläubigern jedoch nur zu, wenn sie glaubhaft machen, dass durch die Ausgliederung die Erfüllung ihrer Forderung gefährdet wird."
    },
    {
      "date": "2024-11-18",
      "id": "93830",
      "original_text": "Registerbekanntmachung nach dem Umwandlungsgesetz\nNordrhein-Westfalen Amtsgericht Steinfurt HRA 8098\nRAWEAR e.K. – Laer",
      "type": "Registerbekanntmachung nach dem Umwandlungsgesetz",
      "state": "Nordrhein-Westfalen",
      "amtsgericht": "Amtsgericht Steinfurt",
      "registernummer": "HRA 8098",
      "registerart": "HRA",
      "company_name": "RAWEAR e.K.",
      "company_seat": "Laer",
      "details": "18.11.2024 (Bekanntmachungsdatum)\n\nNordrhein-Westfalen Amtsgericht Steinfurt HRA 8098\nRegisterbekanntmachung nach dem Umwandlungsgesetz 18.11.2024 (Eintragungsdatum)\n\nRAWEAR e.K.\nEinzelkaufmann / Einzelkauffrau\nLaer\n\nDen Gläubigern der an der Ausgliederung beteiligten Rechtsträger ist, wenn sie binnen sechs Monaten nach dem Tag, an dem die Eintragung der Ausgliederung in das Register des Sitzes desjenigen Rechtsträgers, dessen Gläubiger sie sind, nach § 19 Absatz 3 UmwG als bekanntgemacht gilt, ihren Anspruch nach Grund und Höhe schriftlich anmelden, Sicherheit zu leisten, soweit sie nicht Befriedigung verlangen können. Dieses Recht steht den Gläubigern jedoch nur zu, wenn sie glaubhaft machen, dass durch die Ausgliederung die Erfüllung ihrer Forderung gefährdet wird."
    },
    {
      "date": "2024-11-18",
      "id": "93769",
      "original_text": "Registerbekanntmachung nach dem Umwandlungsgesetz\nSaarland Amtsgericht Saarbrücken HRB 106856\nRBH GmbH – Homburg",
      "type": "Registerbekanntmachung nach dem Umwandlungsgesetz",
      "state": "Saarland",
      "amtsgericht": "Amtsgericht Saarbrücken",
      "registernummer": "HRB 106856",
      "registerart": "HRB",
      "company_name": "RBH GmbH",
      "company_seat": "Homburg",
      "details": "18.11.2024 (Bekanntmachungsdatum)\n\nSaarland Amtsgericht Saarbrücken HRB 106856\nRegisterbekanntmachung nach dem Umwandlungsgesetz 18.11.2024 (Eintragungsdatum)\n\nRBH GmbH\nGesellschaft mit beschränkter Haftung\nHomburg\n\nAls nicht eingetragen wird bekannt gemacht: Den Gläubigern der an der Verschmelzung beteiligten Gesellschaften ist, wenn sie binnen sechs Monaten nach dem Tag, an dem die Eintragung der Verschmelzung in das Register des Sitzes desjenigen Rechtsträgers, dessen Gläubiger sie sind, nach § 19 Absatz 3 UmwG bekannt gemacht worden ist, ihren Anspruch nach Grund und Höhe schriftlich anmelden, Sicherheit zu leisten, soweit sie nicht Befriedigung verlangen können. Dieses Recht steht den Gläubigern jedoch nur zu, wenn sie glaubhaft machen, dass durch die Verschmelzung die Erfüllung ihrer Forderung gefährdet wird."
    },
    {
      "date": "2024-11-18",
      "id": "93758",
      "original_text": "Einreichung neuer Dokumente\nBaden-Württemberg Amtsgericht Stuttgart HRB 264976\nRMGV, Rems-Murr-Gesundheits-Verwaltungs GmbH – Waiblingen",
      "type": "Einreichung neuer Dokumente",
      "state": "Baden-Württemberg",
      "amtsgericht": "Amtsgericht Stuttgart",
      "registernummer": "HRB 264976",
      "registerart": "HRB",
      "company_name": "RMGV, Rems-Murr-Gesundheits-Verwaltungs GmbH",
      "company_seat": "Waiblingen",
      "details": "18.11.2024 (Bekanntmachungsdatum)\n\nBaden-Württemberg Amtsgericht Stuttgart HRB 264976\nEinreichung neuer Dokumente\n\nRMGV, Rems-Murr-Gesundheits-Verwaltungs GmbH\nGesellschaft mit beschränkter Haftung\nWaiblingen\n\nDie Gesellschaft hat am 14.11.2024 die Liste über die Zusammensetzung des Aufsichtsrats zum Handelsregister eingereicht."
    },
    {
      "date": "2024-11-18",
      "id": "93737",
      "original_text": "Einreichung neuer Dokumente\nBaden-Württemberg Amtsgericht Stuttgart HRB 265091\nRMIM, Rems-Murr-Kreis-Immobilien-Management GmbH – Waiblingen",
      "type": "Einreichung neuer Dokumente",
      "state": "Baden-Württemberg",
      "amtsgericht": "Amtsgericht Stuttgart",
      "registernummer": "HRB 265091",
      "registerart": "HRB",
      "company_name": "RMIM, Rems-Murr-Kreis-Immobilien-Management GmbH",
      "company_seat": "Waiblingen",
      "details": "18.11.2024 (Bekanntmachungsdatum)\n\nBaden-Württemberg Amtsgericht Stuttgart HRB 265091\nEinreichung neuer Dokumente\n\nRMIM, Rems-Murr-Kreis-Immobilien-Management GmbH\nGesellschaft mit beschränkter Haftung\nWaiblingen\n\nAls nicht eingetragen wird bekanntgemacht:\nDie Gesellschaft hat am 14.11.2024 die Liste über die Zusammensetzung des Aufsichtsrats zum Handelsregister eingereicht."
    },
    {
      "date": "2024-11-18",
      "id": "93831",
      "original_text": "Löschungsankündigung\nNordrhein-Westfalen Amtsgericht Dortmund HRB 34108\nRRA-Dienste UG (haftungsbeschränkt) – Dortmund",
      "type": "Löschungsankündigung",
      "state": "Nordrhein-Westfalen",
      "amtsgericht": "Amtsgericht Dortmund",
      "registernummer": "HRB 34108",
      "registerart": "HRB",
      "company_name": "RRA-Dienste UG (haftungsbeschränkt)",
      "company_seat": "Dortmund",
      "details": "18.11.2024 (Bekanntmachungsdatum)\n\nNordrhein-Westfalen Amtsgericht Dortmund HRB 34108\nLöschungsankündigung 18.11.2024 (Eintragungsdatum)\n\nRRA-Dienste UG (haftungsbeschränkt)\nGesellschaft mit beschränkter Haftung\nDortmund\n\nDas Registergericht beabsichtigt die Gesellschaft von Amts wegen nach § 394 FamFG zu löschen. Die Frist zur Erhebung eines Widerspruchs ist auf zwei Monate festgesetzt."
    },
    {
      "date": "2024-11-18",
      "id": "93848",
      "original_text": "Löschungsankündigung\nHessen Amtsgericht Darmstadt HRB 88761\nRegenergy24 GmbH – Griesheim",
      "type": "Löschungsankündigung",
      "state": "Hessen",
      "amtsgericht": "Amtsgericht Darmstadt",
      "registernummer": "HRB 88761",
      "registerart": "HRB",
      "company_name": "Regenergy24 GmbH",
      "company_seat": "Griesheim",
      "details": "18.11.2024 (Bekanntmachungsdatum)\n\nHessen Amtsgericht Darmstadt HRB 88761\nLöschungsankündigung 18.11.2024 (Eintragungsdatum)\n\nRegenergy24 GmbH\nGesellschaft mit beschränkter Haftung\nGriesheim\n\nDas Registergericht beabsichtigt die im Handelsregister eingetragene Gesellschaft von Amts wegen nach § 394 FamFG zu löschen. Die Frist zur Erhebung eines Widerspruchs gegen die beabsichtigte Löschung wird auf 3 Monate festgesetzt."
    },
    {
      "date": "2024-11-18",
      "id": "93813",
      "original_text": "Einreichung neuer Dokumente\nBremen Amtsgericht Bremen HRB 21794\nRoland Mills United Verwaltungs-GmbH – Bremen",
      "type": "Einreichung neuer Dokumente",
      "state": "Bremen",
      "amtsgericht": "Amtsgericht Bremen",
      "registernummer": "HRB 21794",
      "registerart": "HRB",
      "company_name": "Roland Mills United Verwaltungs-GmbH",
      "company_seat": "Bremen",
      "details": "18.11.2024 (Bekanntmachungsdatum)\n\nBremen Amtsgericht Bremen HRB 21794\nEinreichung neuer Dokumente\n\nRoland Mills United Verwaltungs-GmbH\nGesellschaft mit beschränkter Haftung\nBremen\n\nAls nicht eingetragen wird bekannt gemacht: Liste des Aufsichtsrats wurde eingereicht."
    },
    {
      "date": "2024-11-18",
      "id": "93781",
      "original_text": "Löschungsankündigung\nBaden-Württemberg Amtsgericht Freiburg HRB 711691\nSAG GmbH – Gottmadingen",
      "type": "Löschungsankündigung",
      "state": "Baden-Württemberg",
      "amtsgericht": "Amtsgericht Freiburg",
      "registernummer": "HRB 711691",
      "registerart": "HRB",
      "company_name": "SAG GmbH",
      "company_seat": "Gottmadingen",
      "details": "18.11.2024 (Bekanntmachungsdatum)\n\nBaden-Württemberg Amtsgericht Freiburg HRB 711691\nLöschungsankündigung\n\nSAG GmbH\nGesellschaft mit beschränkter Haftung\nGottmadingen\n\nDas Gericht beabsichtigt, die Gesellschaft wegen Vermögenslosigkeit im Handelsregister von Amts wegen nach § 394 FamFG zu löschen. Die Frist zur Geltendmachung eines Widerspruchs gegen die beabsichtigte Löschung ist auf einen Monat ab Veröffentlichung bestimmt."
    },
    {
      "date": "2024-11-18",
      "id": "93834",
      "original_text": "Einreichung neuer Dokumente\nNordrhein-Westfalen Amtsgericht Hamm HRB 5845\nSMT Scharf AG – Hamm",
      "type": "Einreichung neuer Dokumente",
      "state": "Nordrhein-Westfalen",
      "amtsgericht": "Amtsgericht Hamm",
      "registernummer": "HRB 5845",
      "registerart": "HRB",
      "company_name": "SMT Scharf AG",
      "company_seat": "Hamm",
      "details": "18.11.2024 (Bekanntmachungsdatum)\n\nNordrhein-Westfalen Amtsgericht Hamm HRB 5845\nEinreichung neuer Dokumente 18.11.2024 (Eintragungsdatum)\n\nSMT Scharf AG\nAktiengesellschaft\nHamm\n\nDem Registergericht ist eine neue Liste der Mitglieder des Aufsichtsrates eingereicht worden."
    },
    {
      "date": "2024-11-18",
      "id": "93730",
      "original_text": "Registerbekanntmachung nach dem Umwandlungsgesetz\nBrandenburg Amtsgericht Cottbus HRB 16727\nSTEnergy GmbH – Cottbus",
      "type": "Registerbekanntmachung nach dem Umwandlungsgesetz",
      "state": "Brandenburg",
      "amtsgericht": "Amtsgericht Cottbus",
      "registernummer": "HRB 16727",
      "registerart": "HRB",
      "company_name": "STEnergy GmbH",
      "company_seat": "Cottbus",
      "details": "18.11.2024 (Bekanntmachungsdatum)\n\nBrandenburg Amtsgericht Cottbus HRB 16727\nRegisterbekanntmachung nach dem Umwandlungsgesetz 13.11.2024 (Eintragungsdatum)\n\nSTEnergy GmbH\nGesellschaft mit beschränkter Haftung\nCottbus\n\nAls nicht eingetragen wird veröffentlicht:\nDen Gläubigern der an der Verschmelzung beteiligten Rechtsträger ist, wenn sie binnen sechs Monaten nach dem Tag, an dem die Eintragung der Verschmelzung in das Register des Sitzes desjenigen Rechtsträgers, dessen Gläubiger sie sind, als bekannt gemacht gilt, ihren Anspruch nach Grund und Höhe schriftlich anmelden, Sicherheit zu leisten, soweit sie nicht Befriedigung verlangen können. Dieses Recht steht den Gläubigern jedoch nur zu, wenn sie glaubhaft machen, dass durch die Verschmelzung die Erfüllung ihrer Forderung gefährdet wird"
    },
    {
      "date": "2024-11-18",
      "id": "93790",
      "original_text": "Einreichung neuer Dokumente\nNiedersachsen Amtsgericht Braunschweig HRB 6609\nSalzgitter Flachstahl GmbH – Salzgitter",
      "type": "Einreichung neuer Dokumente",
      "state": "Niedersachsen",
      "amtsgericht": "Amtsgericht Braunschweig",
      "registernummer": "HRB 6609",
      "registerart": "HRB",
      "company_name": "Salzgitter Flachstahl GmbH",
      "company_seat": "Salzgitter",
      "details": "18.11.2024 (Bekanntmachungsdatum)\n\nNiedersachsen Amtsgericht Braunschweig HRB 6609\nEinreichung neuer Dokumente 18.11.2024 (Eintragungsdatum)\n\nSalzgitter Flachstahl GmbH\nGesellschaft mit beschränkter Haftung\nSalzgitter\n\nDie Liste der Mitglieder des Aufsichtsrats wurde beim Registergericht eingereicht."
    },
    {
      "date": "2024-11-18",
      "id": "93824",
      "original_text": "Registerbekanntmachung nach dem Umwandlungsgesetz\nNordrhein-Westfalen Amtsgericht Köln HRB 120230\nSaniverse Bathrooms AG – Köln",
      "type": "Registerbekanntmachung nach dem Umwandlungsgesetz",
      "state": "Nordrhein-Westfalen",
      "amtsgericht": "Amtsgericht Köln",
      "registernummer": "HRB 120230",
      "registerart": "HRB",
      "company_name": "Saniverse Bathrooms AG",
      "company_seat": "Köln",
      "details": "18.11.2024 (Bekanntmachungsdatum)\n\nNordrhein-Westfalen Amtsgericht Köln HRB 120230\nRegisterbekanntmachung nach dem Umwandlungsgesetz\n\nSaniverse Bathrooms AG\nAktiengesellschaft\nKöln\n\nDem Registergericht ist der Entwurf eines Vertrages über den geplanten Formwechsel der Sanivers Bathrooms AG in die Sanivers Bathrooms SE eingereicht worden."
    },
    {
      "date": "2024-11-18",
      "id": "93774",
      "original_text": "Löschungsankündigung\nSaarland Amtsgericht Saarbrücken HRB 105875\nSedna Bauunternehmung GmbH – Saarbrücken",
      "type": "Löschungsankündigung",
      "state": "Saarland",
      "amtsgericht": "Amtsgericht Saarbrücken",
      "registernummer": "HRB 105875",
      "registerart": "HRB",
      "company_name": "Sedna Bauunternehmung GmbH",
      "company_seat": "Saarbrücken",
      "details": "18.11.2024 (Bekanntmachungsdatum)\n\nSaarland Amtsgericht Saarbrücken HRB 105875\nLöschungsankündigung\n\nSedna Bauunternehmung GmbH\nGesellschaft mit beschränkter Haftung\nSaarbrücken\n\nEs ist beabsichtigt, die Gesellschaft von Amts wegen gemäß § 394 FamFG wegen Vermögenslosigkeit zu löschen.\nGegen die Löschung von Amts wegen ist das Rechtsmittel des Widerspruchs statthaft. Der Widerspruch ist binnen einer Frist drei Monaten beginnend mit dem Tag dieser Veröffentlichung durch Einreichen eines Widerspruchsschreibens -schriftlich oder zur Niederschrift der Geschäftsstelle beim Amtsgericht Saarbrücken, -zentrales Handelsregister-, Mainzerstr.178, 66121 Saarbrücken einzulegen.\nDer Widerspruch muss die Bezeichnung der angefochtenen Löschungsankündigung enthalten sowie die Erklärung, dass Widerspruch eingelegt wird. Er ist vom Widerspruchsführer oder seinem Bevollmächtigten zu unterzeichnen.\nDas Widerspruchsschreiben kann auch in der Form eines elektronischen Dokumentes eingereicht werden, das mit einer qualifizierten elektronischen Signatur nach dem Signaturgesetz versehen sein muss (§§ 14 Abs. 2 FamFG, 130a, 298 ZPO)."
    },
    {
      "date": "2024-11-18",
      "id": "93738",
      "original_text": "Sonstige Registerbekanntmachung\nMecklenburg-Vorpommern Amtsgericht Schwerin GnR 175\nSiggelkow Agrar eG – Siggelkow",
      "type": "Sonstige Registerbekanntmachung",
      "state": "Mecklenburg-Vorpommern",
      "amtsgericht": "Amtsgericht Schwerin",
      "registernummer": "GnR 175",
      "registerart": "GnR",
      "company_name": "Siggelkow Agrar eG",
      "company_seat": "Siggelkow",
      "details": "18.11.2024 (Bekanntmachungsdatum)\n\nMecklenburg-Vorpommern Amtsgericht Schwerin GnR 175\nSonstige Registerbekanntmachung 18.11.2024 (Eintragungsdatum)\n\nSiggelkow Agrar eG\neingetragene Genossenschaft\nSiggelkow\n\nEs ist eine neue Aufsichtsratsliste eingereicht worden."
    },
    {
      "date": "2024-11-18",
      "id": "93789",
      "original_text": "Löschungsankündigung\nNiedersachsen Amtsgericht Walsrode HRB 207389\nStabilbau-Walsrode GmbH – Walsrode",
      "type": "Löschungsankündigung",
      "state": "Niedersachsen",
      "amtsgericht": "Amtsgericht Walsrode",
      "registernummer": "HRB 207389",
      "registerart": "HRB",
      "company_name": "Stabilbau-Walsrode GmbH",
      "company_seat": "Walsrode",
      "details": "18.11.2024 (Bekanntmachungsdatum)\n\nNiedersachsen Amtsgericht Walsrode HRB 207389\nLöschungsankündigung\n\nStabilbau-Walsrode GmbH\nGesellschaft mit beschränkter Haftung\nWalsrode\n\nDas Registergericht beabsichtigt, die Gesellschaft von Amts wegen nach § 394 FamFG zu löschen. Die Frist zur Erhebung eines Widerspruchs ist auf 1 Monat ab dieser Registerbekanntmachung festgesetzt."
    },
    {
      "date": "2024-11-18",
      "id": "93805",
      "original_text": "Registerbekanntmachung nach dem Umwandlungsgesetz\nRheinland-Pfalz Amtsgericht Mainz HRA 44487\nStandout Media e.K. – Saulheim",
      "type": "Registerbekanntmachung nach dem Umwandlungsgesetz",
      "state": "Rheinland-Pfalz",
      "amtsgericht": "Amtsgericht Mainz",
      "registernummer": "HRA 44487",
      "registerart": "HRA",
      "company_name": "Standout Media e.K.",
      "company_seat": "Saulheim",
      "details": "18.11.2024 (Bekanntmachungsdatum)\n\nRheinland-Pfalz Amtsgericht Mainz HRA 44487\nRegisterbekanntmachung nach dem Umwandlungsgesetz\n\nStandout Media e.K.\nEinzelkaufmann / Einzelkauffrau\nSaulheim\n\nAls nicht eingetragen wird veröffentlicht: Den Gläubigern der an der Ausgliederung beteiligten Rechtsträger ist, wenn sie binnen sechs Monaten nach dem Tag, an dem die Eintragung der Ausgliederung in das Register des Sitzes desjenigen Rechtsträgers,dessen Gläubiger sie sind, nach § 19 Abs. 3 UmwG als bekannt gemacht gilt, ihren Anspruch nach Grund und Höhe schriftlich anmelden, Sicherheit zu leisten, soweit sie nicht Befriedigung verlangen können. Dieses Recht steht den Gläubigern jedoch nur zu, wenn sie glaubhaft machen, dass durch die Ausgliederung die Erfüllung der Forderung gefährdet wird."
    },
    {
      "date": "2024-11-18",
      "id": "93820",
      "original_text": "Löschungsankündigung\nNordrhein-Westfalen Amtsgericht Aachen VR 50748 früher Amtsgericht Eschweiler\nStolberger Tierschutzverein – Stolberg",
      "type": "Löschungsankündigung",
      "state": "Nordrhein-Westfalen",
      "amtsgericht": "Amtsgericht Aachen",
      "registernummer": "VR 50748",
      "registerart": "VR",
      "company_name": "Stolberger Tierschutzverein",
      "company_seat": "Stolberg",
      "former_amtsgericht": "Eschweiler",
      "details": "18.11.2024 (Bekanntmachungsdatum)\n\nNordrhein-Westfalen Amtsgericht Aachen VR 50748 früher Amtsgericht Eschweiler\nLöschungsankündigung 18.11.2024 (Eintragungsdatum)\n\nStolberger Tierschutzverein\neingetragener Verein\nStolberg\n\nDas Registergericht beabsichtigt, von Amts wegen den Verein wegen Wegfall aller Mitglieder wegen Unzulässigkeit nach § 395 FamFG zu löschen.\n\nZur Geltendmachung des Widerspruchs gegen die beabsichtigte Löschung wird hiermit eine Frist von einem Monat ab Veröffentlichung dieser Ankündigung bestimmt.\n\nRechtsbehelfsbelehrung:\n\nGegen diese Verfügung kann Widerspruch eingelegt werden. Zum Widerspruch ist jeder berechtigt, der an der Unterlassung der Löschung ein berechtigtes Interesse hat.\n\nDer Widerspruch ist bei dem Amtsgericht Aachen, Adalbertsteinweg 92, 52070 Aachen schriftlich in deutscher Sprache oder zur Niederschrift der Geschäftsstelle einzulegen. Der Widerspruch kann auch zur Niederschrift der Geschäftsstelle eines jeden Amtsgerichtes abgegeben werden.\n\nDer Widerspruch muss spätestens innerhalb der gesetzten Frist nach der Bekanntgabe der Verfügung bei dem Amtsgericht Aachen eingegangen sein. Dies gilt auch dann, wenn der Widerspruch zur Niederschrift der Geschäftsstelle eines anderen Amtsgerichtes abgegeben wurde. Die Frist beginnt mit der Bekanntgabe der Verfügung durch Veröffentlichung. Fällt das Ende der Frist auf einen Sonntag, einen allgemeinen Feiertag oder Sonnabend, so endet die Frist mit Ablauf des nächsten Werktages.\n\nDer Widerspruch muss die Bezeichnung der angefochtenen Verfügung sowie die Erklärung enthalten, dass Widerspruch gegen diese Verfügung eingelegt wird. Er ist zu unterzeichnen und soll begründet werden.\n\nDie Einlegung ist auch durch Übertragung eines elektronischen Dokuments an die elektronische Poststelle des Gerichts möglich. Das elektronische Dokument muss für die Bearbeitung durch das Gericht geeignet und mit einer qualifizierten elektronischen Signatur der verantwortenden Person versehen sein oder von der verantwortenden Person signiert und auf einem sicheren Übermittlungsweg gemäß § 130 a ZPO nach näherer Maßgabe der Verordnung über die technischen Rahmenbedingungen des elektronischen Rechtsverkehrs und über das besondere elektronische Behördenpostfach (BGBl. I, S. 3803) eingereicht werden. Weitere Informationen erhalten Sie auf der Internetseite www.justiz.de."
    },
    {
      "date": "2024-11-18",
      "id": "93767",
      "original_text": "Löschungsankündigung\nBaden-Württemberg Amtsgericht Mannheim HRB 734437\nToprak Fabrikmoebel GmbH – Bruchsal",
      "type": "Löschungsankündigung",
      "state": "Baden-Württemberg",
      "amtsgericht": "Amtsgericht Mannheim",
      "registernummer": "HRB 734437",
      "registerart": "HRB",
      "company_name": "Toprak Fabrikmoebel GmbH",
      "company_seat": "Bruchsal",
      "details": "18.11.2024 (Bekanntmachungsdatum)\n\nBaden-Württemberg Amtsgericht Mannheim HRB 734437\nLöschungsankündigung\n\nToprak Fabrikmoebel GmbH\nGesellschaft mit beschränkter Haftung\nBruchsal\n\nDas Gericht beabsichtigt, die Gesellschaft wegen Vermögenslosigkeit im Handelsregister von Amts wegen nach § 394 FamFG zu löschen. Die Frist zur Geltendmachung eines Widerspruchs gegen die beabsichtigte Löschung ist auf einen Monat ab Veröffentlichung bestimmt."
    },
    {
      "date": "2024-11-18",
      "id": "93725",
      "original_text": "Einreichung neuer Dokumente\nBaden-Württemberg Amtsgericht Ulm HRB 560712\nTourismusbetriebsgesellschaft Bad Saulgau mbH – Bad Saulgau",
      "type": "Einreichung neuer Dokumente",
      "state": "Baden-Württemberg",
      "amtsgericht": "Amtsgericht Ulm",
      "registernummer": "HRB 560712",
      "registerart": "HRB",
      "company_name": "Tourismusbetriebsgesellschaft Bad Saulgau mbH",
      "company_seat": "Bad Saulgau",
      "details": "18.11.2024 (Bekanntmachungsdatum)\n\nBaden-Württemberg Amtsgericht Ulm HRB 560712\nEinreichung neuer Dokumente\n\nTourismusbetriebsgesellschaft Bad Saulgau mbH\nGesellschaft mit beschränkter Haftung\nBad Saulgau\n\nDie Gesellschaft hat am 07.11.2024 die Liste über die Zusammensetzung des Aufsichtsrats zum Handelsregister eingereicht."
    },
    {
      "date": "2024-11-18",
      "id": "93734",
      "original_text": "Löschungsankündigung\nBerlin Amtsgericht Berlin (Charlottenburg) HRB 201917\nToy Toy GmbH – Berlin",
      "type": "Löschungsankündigung",
      "state": "Berlin",
      "amtsgericht": "Amtsgericht Berlin (Charlottenburg)",
      "registernummer": "HRB 201917",
      "registerart": "HRB",
      "company_name": "Toy Toy GmbH",
      "company_seat": "Berlin",
      "details": "18.11.2024 (Bekanntmachungsdatum)\n\nBerlin Amtsgericht Berlin (Charlottenburg) HRB 201917\nLöschungsankündigung\n\nToy Toy GmbH\nGesellschaft mit beschränkter Haftung\nBerlin\n\nBei der nachstehenden Gesellschaft wird das Amtslöschungsverfahren gemäß § 394 FamFG eingeleitet. Widerspruchsfrist 6 Wochen"
    },
    {
      "date": "2024-11-18",
      "id": "93842",
      "original_text": "Löschungsankündigung\nThüringen Amtsgericht Jena HRB 503707\nTrecinda Industriemontage UG (haftungsbeschränkt) – Dornheim",
      "type": "Löschungsankündigung",
      "state": "Thüringen",
      "amtsgericht": "Amtsgericht Jena",
      "registernummer": "HRB 503707",
      "registerart": "HRB",
      "company_name": "Trecinda Industriemontage UG (haftungsbeschränkt)",
      "company_seat": "Dornheim",
      "details": "18.11.2024 (Bekanntmachungsdatum)\n\nThüringen Amtsgericht Jena HRB 503707\nLöschungsankündigung\n\nTrecinda Industriemontage UG (haftungsbeschränkt)\nGesellschaft mit beschränkter Haftung\nDornheim\n\nDas Registergericht beabsichtigt, die im Handelsregister eingetragene Gesellschaft wegen Vermögenslosigkeit nach § 394 FamFG von Amts wegen zu löschen. Die Frist zur Erhebung eines Widerspruchs gegen die beabsichtigte Löschung wird auf 6 Wochen festgesetzt."
    },
    {
      "date": "2024-11-18",
      "id": "93771",
      "original_text": "Registerbekanntmachung nach dem Umwandlungsgesetz\nHamburg Amtsgericht Hamburg HRB 135692\nUwe Günther GmbH – Hamburg",
      "type": "Registerbekanntmachung nach dem Umwandlungsgesetz",
      "state": "Hamburg",
      "amtsgericht": "Amtsgericht Hamburg",
      "registernummer": "HRB 135692",
      "registerart": "HRB",
      "company_name": "Uwe Günther GmbH",
      "company_seat": "Hamburg",
      "details": "18.11.2024 (Bekanntmachungsdatum)\n\nHamburg Amtsgericht Hamburg HRB 135692\nRegisterbekanntmachung nach dem Umwandlungsgesetz 18.11.2024 (Eintragungsdatum)\n\nUwe Günther GmbH\nGesellschaft mit beschränkter Haftung\nHamburg\n\nAls nicht eingetragen wird bekannt gemacht:\nDen Gläubigern der an der Verschmelzung beteiligten Gesellschaften ist, wenn sie binnen sechs Monaten nach dem Tag, an dem die Eintragung der Verschmelzung in das Register des Sitzes desjenigen Rechtsträgers, dessen Gläubiger sie sind, nach § 19 Absatz 3 UmwG als bekannt gemacht gilt, ihren Anspruch nach Grund und Höhe schriftlich anmelden, Sicherheit zu leisten, soweit sie nicht Befriedigung verlangen können. Dieses Recht steht den Gläubigern jedoch nur zu, wenn sie glaubhaft machen, dass durch die Verschmelzung die Erfüllung ihrer Forderung gefährdet wird."
    },
    {
      "date": "2024-11-18",
      "id": "93723",
      "original_text": "Einreichung neuer Dokumente\nSaarland Amtsgericht Saarbrücken HRB 24845\nVerkehrs- und Energiebeteiligungsgesellschaft der Stadt Dillingen mbH – Dillingen",
      "type": "Einreichung neuer Dokumente",
      "state": "Saarland",
      "amtsgericht": "Amtsgericht Saarbrücken",
      "registernummer": "HRB 24845",
      "registerart": "HRB",
      "company_name": "Verkehrs- und Energiebeteiligungsgesellschaft der Stadt Dillingen mbH",
      "company_seat": "Dillingen",
      "details": "18.11.2024 (Bekanntmachungsdatum)\n\nSaarland Amtsgericht Saarbrücken HRB 24845\nEinreichung neuer Dokumente\n\nVerkehrs- und Energiebeteiligungsgesellschaft der Stadt Dillingen mbH\nGesellschaft mit beschränkter Haftung\nDillingen\n\nDie Geschäftsführung der Gesellschaft hat eine Liste der Mitglieder des Aufsichtsrats zum Handelsregister eingereicht (§ 52 Abs. 3 Satz 2 GmbHG)."
    },
    {
      "date": "2024-11-18",
      "id": "93799",
      "original_text": "Einreichung neuer Dokumente\nNiedersachsen Amtsgericht Tostedt HRB 100466 früher Amtsgericht Stade\nVerkehrsgesellschaft Nord-Ost-Niedersachsen mbH – Stade",
      "type": "Einreichung neuer Dokumente",
      "state": "Niedersachsen",
      "amtsgericht": "Amtsgericht Tostedt",
      "registernummer": "HRB 100466",
      "registerart": "HRB",
      "company_name": "Verkehrsgesellschaft Nord-Ost-Niedersachsen mbH",
      "company_seat": "Stade",
      "former_amtsgericht": "Stade",
      "details": "18.11.2024 (Bekanntmachungsdatum)\n\nNiedersachsen Amtsgericht Tostedt HRB 100466 früher Amtsgericht Stade\nEinreichung neuer Dokumente 18.11.2024 (Eintragungsdatum)\n\nVerkehrsgesellschaft Nord-Ost-Niedersachsen mbH\nGesellschaft mit beschränkter Haftung\nStade\n\nDie Liste der Mitglieder des Aufsichtsrats wurde beim Registergericht eingereicht."
    },
    {
      "date": "2024-11-18",
      "id": "93784",
      "original_text": "Einreichung neuer Dokumente\nSachsen Amtsgericht Dresden HRB 16223\nVersorgungs GmbH Königswartha – Königswartha",
      "type": "Einreichung neuer Dokumente",
      "state": "Sachsen",
      "amtsgericht": "Amtsgericht Dresden",
      "registernummer": "HRB 16223",
      "registerart": "HRB",
      "company_name": "Versorgungs GmbH Königswartha",
      "company_seat": "Königswartha",
      "details": "18.11.2024 (Bekanntmachungsdatum)\n\nSachsen Amtsgericht Dresden HRB 16223\nEinreichung neuer Dokumente\n\nVersorgungs GmbH Königswartha\nGesellschaft mit beschränkter Haftung\nKönigswartha\n\nAm 15.11.2024 wurde beim Handelsregister des Amtsgerichts Dresden die Liste der Mitglieder des Aufsichtsrats gemäß § 52 GmbHG eingereicht."
    },
    {
      "date": "2024-11-18",
      "id": "93779",
      "original_text": "Löschungsankündigung\nBaden-Württemberg Amtsgericht Mannheim HRB 727270\nVertex GmbH – Karlsruhe",
      "type": "Löschungsankündigung",
      "state": "Baden-Württemberg",
      "amtsgericht": "Amtsgericht Mannheim",
      "registernummer": "HRB 727270",
      "registerart": "HRB",
      "company_name": "Vertex GmbH",
      "company_seat": "Karlsruhe",
      "details": "18.11.2024 (Bekanntmachungsdatum)\n\nBaden-Württemberg Amtsgericht Mannheim HRB 727270\nLöschungsankündigung\n\nVertex GmbH\nGesellschaft mit beschränkter Haftung\nKarlsruhe\n\nDas Gericht beabsichtigt, die Gesellschaft wegen Vermögenslosigkeit im Handelsregister von Amts wegen nach § 394 FamFG zu löschen. Die Frist zur Geltendmachung eines Widerspruchs gegen die beabsichtigte Löschung ist auf einen Monat ab Veröffentlichung bestimmt."
    },
    {
      "date": "2024-11-18",
      "id": "93833",
      "original_text": "Registerbekanntmachung nach dem Umwandlungsgesetz\nNordrhein-Westfalen Amtsgericht Düsseldorf HRB 66570\nVodafone Institut für Gesellschaft und Kommunikation GmbH – Düsseldorf",
      "type": "Registerbekanntmachung nach dem Umwandlungsgesetz",
      "state": "Nordrhein-Westfalen",
      "amtsgericht": "Amtsgericht Düsseldorf",
      "registernummer": "HRB 66570",
      "registerart": "HRB",
      "company_name": "Vodafone Institut für Gesellschaft und Kommunikation GmbH",
      "company_seat": "Düsseldorf",
      "details": "18.11.2024 (Bekanntmachungsdatum)\n\nNordrhein-Westfalen Amtsgericht Düsseldorf HRB 66570\nRegisterbekanntmachung nach dem Umwandlungsgesetz 18.11.2024 (Eintragungsdatum)\n\nVodafone Institut für Gesellschaft und Kommunikation GmbH\nGesellschaft mit beschränkter Haftung\nDüsseldorf\n\nDen Gläubigern der an der Verschmelzung beteiligten Rechtsträger ist, wenn sie binnen sechs Monaten nach dem Tag, an dem die Eintragung der Verschmelzung in das Register des Sitzes desjenigen Rechtsträgers, dessen Gläubiger sie sind, nach § 19 Absatz 3 UmwG als bekanntgemacht gilt, ihren Anspruch nach Grund und Höhe schriftlich anmelden, Sicherheit zu leisten, soweit sie nicht Befriedigung verlangen können. Dieses Recht steht den Gläubigern jedoch nur zu, wenn sie glaubhaft machen, dass durch die Verschmelzung die Erfüllung ihrer Forderung gefährdet wird."
    },
    {
      "date": "2024-11-18",
      "id": "93819",
      "original_text": "Registerbekanntmachung nach dem Umwandlungsgesetz\nNordrhein-Westfalen Amtsgericht Wuppertal HRB 35187\nVollmer Montagen GmbH – Wuppertal",
      "type": "Registerbekanntmachung nach dem Umwandlungsgesetz",
      "state": "Nordrhein-Westfalen",
      "amtsgericht": "Amtsgericht Wuppertal",
      "registernummer": "HRB 35187",
      "registerart": "HRB",
      "company_name": "Vollmer Montagen GmbH",
      "company_seat": "Wuppertal",
      "details": "18.11.2024 (Bekanntmachungsdatum)\n\nNordrhein-Westfalen Amtsgericht Wuppertal HRB 35187\nRegisterbekanntmachung nach dem Umwandlungsgesetz 18.11.2024 (Eintragungsdatum)\n\nVollmer Montagen GmbH\nGesellschaft mit beschränkter Haftung\nWuppertal\n\nDen Gläubigern der an der Ausgliederung beteiligten Rechtsträger ist, wenn sie binnen sechs Monaten nach dem Tag, an dem die Eintragung der Ausgliederung in das Register des Sitzes desjenigen Rechtsträgers, dessen Gläubiger sie sind, nach § 19 Absatz 3 UmwG als bekanntgemacht gilt, ihren Anspruch nach Grund und Höhe schriftlich anmelden, Sicherheit zu leisten, soweit sie nicht Befriedigung verlangen können. Dieses Recht steht den Gläubigern jedoch nur zu, wenn sie glaubhaft machen, dass durch die Ausgliederung die Erfüllung ihrer Forderung gefährdet wird."
    },
    {
      "date": "2024-11-18",
      "id": "93826",
      "original_text": "Löschungsankündigung\nNordrhein-Westfalen Amtsgericht Neuss HRB 18501\nWERTH GmbH Galabau – Neuss",
      "type": "Löschungsankündigung",
      "state": "Nordrhein-Westfalen",
      "amtsgericht": "Amtsgericht Neuss",
      "registernummer": "HRB 18501",
      "registerart": "HRB",
      "company_name": "WERTH GmbH Galabau",
      "company_seat": "Neuss",
      "details": "18.11.2024 (Bekanntmachungsdatum)\n\nNordrhein-Westfalen Amtsgericht Neuss HRB 18501\nLöschungsankündigung 18.11.2024 (Eintragungsdatum)\n\nWERTH GmbH Galabau\nGesellschaft mit beschränkter Haftung\nNeuss\n\nEs ist beabsichtigt, die Gesellschaft wegen Vermögenslosigkeit aufgrund des § 394 Abs. 1 FamFG zu löschen. Frist zur Geltendmachung eines Widerspruchs: 1 Monat.\n\nRechtsbehelfsbelehrung:\nGegen diese Verfügung können Sie Widerspruch einlegen.\nDer Widerspruch ist bei dem Amtsgericht Neuss - Registergericht -, Breite Str. 48, 41460 Neuss schriftlich in deutscher Sprache oder zur Niederschrift der Geschäftsstelle einzulegen.\nDer Widerspruch kann auch zur Niederschrift der Geschäftsstelle eines jeden Amtsgerichtes abgegeben werden.\nDie Einlegung ist auch durch Übertragung eines elektronischen Dokuments an die elektronische Poststelle des Gerichts möglich. Das elektronische Dokument muss für die Bearbeitung durch das Gericht geeignet und mit einer qualifizierten elektronischen Signatur der verantwortenden Person versehen sein oder von der verantwortenden Person signiert und auf einem sicheren Übermittlungsweg gemäß § 130a ZPO nach näherer Maßgabe der Verordnung über die technischen Rahmenbedingungen des elektronischen Rechtsverkehrs und über das besondere elektronische Behördenpostfach (BGBl. I, S.3803) eingereicht werden. Weitere Informationen erhalten Sie auf der Internetseite www.justiz.de.\nDer Widerspruch muss spätestens innerhalb der gesetzten Frist nach der schriftlichen Bekanntgabe der Verfügung bei dem Amtsgericht - Registergericht - Neuss eingegangen sein. Dies gilt auch dann, wenn der Widerspruch zur Niederschrift der Geschäftsstelle eines anderen Amtsgerichtes abgegeben wurde. Die Frist beginnt mit der schriftlichen Bekanntgabe der Verfügung. Die Bekanntgabe ist entweder durch Zustellung oder am dritten Tage nach Aufgabe zur Post bewirkt. Fällt das Ende der Frist auf einen Sonntag, einen allgemeinen Feiertag oder Sonnabend, so endet die Frist mit Ablauf des nächsten Werktages.\n\nDer Widerspruch muss die Bezeichnung der angefochtenen Verfügung sowie die Erklärung enthalten, dass Widerspruch gegen diese Verfügung eingelegt wird. Er ist zu unterzeichnen und soll begründet werden."
    },
    {
      "date": "2024-11-18",
      "id": "93816",
      "original_text": "Löschungsankündigung\nNordrhein-Westfalen Amtsgericht Wuppertal HRB 13278\nWKP Guddorf Personal- und Unternehmensberatungsgesellschaft mbH – Erkrath",
      "type": "Löschungsankündigung",
      "state": "Nordrhein-Westfalen",
      "amtsgericht": "Amtsgericht Wuppertal",
      "registernummer": "HRB 13278",
      "registerart": "HRB",
      "company_name": "WKP Guddorf Personal- und Unternehmensberatungsgesellschaft mbH",
      "company_seat": "Erkrath",
      "details": "18.11.2024 (Bekanntmachungsdatum)\n\nNordrhein-Westfalen Amtsgericht Wuppertal HRB 13278\nLöschungsankündigung 15.11.2024 (Eintragungsdatum)\n\nWKP Guddorf Personal- und Unternehmensberatungsgesellschaft mbH\nGesellschaft mit beschränkter Haftung\nErkrath\n\nDas Registergericht beabsichtigt die Gesellschaft von Amts wegen nach § 394 FamFG zu löschen. Die Frist zur Erhebung eines Widerspruchs ist auf einen Monat festgesetzt."
    },
    {
      "date": "2024-11-18",
      "id": "93828",
      "original_text": "Löschungsankündigung\nNordrhein-Westfalen Amtsgericht Wuppertal HRB 14118\nWKP Media GmbH – Erkrath",
      "type": "Löschungsankündigung",
      "state": "Nordrhein-Westfalen",
      "amtsgericht": "Amtsgericht Wuppertal",
      "registernummer": "HRB 14118",
      "registerart": "HRB",
      "company_name": "WKP Media GmbH",
      "company_seat": "Erkrath",
      "details": "18.11.2024 (Bekanntmachungsdatum)\n\nNordrhein-Westfalen Amtsgericht Wuppertal HRB 14118\nLöschungsankündigung 15.11.2024 (Eintragungsdatum)\n\nWKP Media GmbH\nGesellschaft mit beschränkter Haftung\nErkrath\n\nDas Registergericht beabsichtigt die Gesellschaft von Amts wegen nach § 394 FamFG zu löschen. Die Frist zur Erhebung eines Widerspruchs ist auf einen Monat festgesetzt."
    },
    {
      "date": "2024-11-18",
      "id": "93800",
      "original_text": "Einreichung neuer Dokumente\nNiedersachsen Amtsgericht Lüneburg HRB 204846\nWerum Software & Systems AG – Lüneburg",
      "type": "Einreichung neuer Dokumente",
      "state": "Niedersachsen",
      "amtsgericht": "Amtsgericht Lüneburg",
      "registernummer": "HRB 204846",
      "registerart": "HRB",
      "company_name": "Werum Software & Systems AG",
      "company_seat": "Lüneburg",
      "details": "18.11.2024 (Bekanntmachungsdatum)\n\nNiedersachsen Amtsgericht Lüneburg HRB 204846\nEinreichung neuer Dokumente 18.11.2024 (Eintragungsdatum)\n\nWerum Software & Systems AG\nAktiengesellschaft\nLüneburg\n\nDie Liste der Mitglieder des Aufsichtsrats wurde beim Registergericht eingereicht."
    },
    {
      "date": "2024-11-18",
      "id": "93794",
      "original_text": "Registerbekanntmachung nach dem Umwandlungsgesetz\nNiedersachsen Amtsgericht Oldenburg (Oldenburg) HRB 120856 früher Amtsgericht Westerstede\nWestersteder ST GmbH – Westerstede",
      "type": "Registerbekanntmachung nach dem Umwandlungsgesetz",
      "state": "Niedersachsen",
      "amtsgericht": "Amtsgericht Oldenburg (Oldenburg)",
      "registernummer": "HRB 120856",
      "registerart": "HRB",
      "company_name": "Westersteder ST GmbH",
      "company_seat": "Westerstede",
      "former_amtsgericht": "Westerstede",
      "details": "18.11.2024 (Bekanntmachungsdatum)\n\nNiedersachsen Amtsgericht Oldenburg (Oldenburg) HRB 120856 früher Amtsgericht Westerstede\nRegisterbekanntmachung nach dem Umwandlungsgesetz 18.11.2024 (Eintragungsdatum)\n\nWestersteder ST GmbH\nGesellschaft mit beschränkter Haftung\nWesterstede\n\nDen Gläubigern der an der Verschmelzung beteiligten Rechtsträger ist, wenn sie binnen sechs Monaten nach dem Tag, an dem die Eintragung der Verschmelzung in das Register des Sitzes desjenigen Rechtsträgers, dessen Gläubiger sie sind, nach § 19  Abs.  3 UmwG als bekannt gemacht gilt, ihren Anspruch nach Grund und Höhe schriftlich anmelden, Sicherheit zu leisten, soweit sie nicht Befriedigung verlangen können. Dieses Recht steht den Gläubigern jedoch nur zu, wenn sie glaubhaft machen, dass durch die Verschmelzung die Erfüllung der Forderung gefährdet wird."
    },
    {
      "date": "2024-11-18",
      "id": "93770",
      "original_text": "Löschungsankündigung\nBrandenburg Amtsgericht Frankfurt/Oder HRB 308\nWäschereibetriebe Targatz GmbH – Eberswalde",
      "type": "Löschungsankündigung",
      "state": "Brandenburg",
      "amtsgericht": "Amtsgericht Frankfurt/Oder",
      "registernummer": "HRB 308",
      "registerart": "HRB",
      "company_name": "Wäschereibetriebe Targatz GmbH",
      "company_seat": "Eberswalde",
      "details": "18.11.2024 (Bekanntmachungsdatum)\n\nBrandenburg Amtsgericht Frankfurt/Oder HRB 308\nLöschungsankündigung\n\nWäschereibetriebe Targatz GmbH\nGesellschaft mit beschränkter Haftung\nEberswalde\n\nBei der nachstehenden Gesellschaft wird das Amtslöschungsverfahren gemäß § 394 FamFG eingeleitet."
    },
    {
      "date": "2024-11-18",
      "id": "93777",
      "original_text": "Einreichung neuer Dokumente\nBaden-Württemberg Amtsgericht Freiburg HRA 707372\ndeut EWIV – Heiligenberg",
      "type": "Einreichung neuer Dokumente",
      "state": "Baden-Württemberg",
      "amtsgericht": "Amtsgericht Freiburg",
      "registernummer": "HRA 707372",
      "registerart": "HRA",
      "company_name": "deut EWIV",
      "company_seat": "Heiligenberg",
      "details": "18.11.2024 (Bekanntmachungsdatum)\n\nBaden-Württemberg Amtsgericht Freiburg HRA 707372\nEinreichung neuer Dokumente\n\ndeut EWIV\nEuropäische wirtschaftliche Interessenvereinigung\nHeiligenberg\n\nBeim Handelsregister wurde am 25.09.2024 ein Verlegungsplan eingereicht, wonach der Sitz der \"deut EWIV\", eingetragen beim Registergericht Freiburg im Breisgau unter HRA 707372 von Heiligenberg nach Balzers, Fürstentum Liechtenstein verlegt werden soll."
    },
    {
      "date": "2024-11-18",
      "id": "93747",
      "original_text": "Registerbekanntmachung nach dem Umwandlungsgesetz\nBerlin Amtsgericht Berlin (Charlottenburg) HRB 76222\nebuero Aktiengesellschaft – Berlin",
      "type": "Registerbekanntmachung nach dem Umwandlungsgesetz",
      "state": "Berlin",
      "amtsgericht": "Amtsgericht Berlin (Charlottenburg)",
      "registernummer": "HRB 76222",
      "registerart": "HRB",
      "company_name": "ebuero Aktiengesellschaft",
      "company_seat": "Berlin",
      "details": "18.11.2024 (Bekanntmachungsdatum)\n\nBerlin Amtsgericht Berlin (Charlottenburg) HRB 76222\nRegisterbekanntmachung nach dem Umwandlungsgesetz 13.11.2024 (Eintragungsdatum)\n\nebuero Aktiengesellschaft\nAktiengesellschaft\nBerlin\n\nZu Eintragungsnummer 27 vom 13.11.2024 wird als nicht eingetragen veröffentlicht:Den Gläubigern der an der Verschmelzung beteiligten Rechtsträger ist, wenn sie binnen sechs Monaten nach dem Tag, an dem die Eintragung der Verschmelzung in das Register des Sitzes desjenigen Rechtsträgers, dessen Gläubiger sie sind, als bekannt gemacht gilt, ihren Anspruch nach Grund und Höhe schriftlich anmelden, Sicherheit zu leisten, soweit sie nicht Befriedigung verlangen können. Dieses Recht steht den Gläubigern jedoch nur zu, wenn sie glaubhaft machen, dass durch die Verschmelzung die Erfüllung ihrer Forderung gefährdet wird. Das Recht, Sicherheitsleistung zu verlangen, steht Gläubigern nicht zu, die im Falle der Insolvenz ein Recht auf vorzugsweise Befriedigung aus einer Deckungsmasse haben, die nach gesetzlicher Vorschrift zu ihrem Schutz errichtet und staatlich überwacht ist."
    },
    {
      "date": "2024-11-18",
      "id": "93728",
      "original_text": "Löschungsankündigung\nSaarland Amtsgericht Saarbrücken HRB 19731\nimade GmbH – Saarbrücken",
      "type": "Löschungsankündigung",
      "state": "Saarland",
      "amtsgericht": "Amtsgericht Saarbrücken",
      "registernummer": "HRB 19731",
      "registerart": "HRB",
      "company_name": "imade GmbH",
      "company_seat": "Saarbrücken",
      "details": "18.11.2024 (Bekanntmachungsdatum)\n\nSaarland Amtsgericht Saarbrücken HRB 19731\nLöschungsankündigung\n\nimade GmbH\nGesellschaft mit beschränkter Haftung\nSaarbrücken\n\nEs ist beabsichtigt, die Gesellschaft von Amts wegen gemäß § 394 FamFG wegen Vermögenslosigkeit zu löschen.\nGegen die Löschung von Amts wegen ist das Rechtsmittel des Widerspruchs statthaft. Der Widerspruch ist binnen einer Frist zwei Monaten beginnend mit dem Tag dieser Veröffentlichung durch Einreichen eines Widerspruchsschreibens -schriftlich oder zur Niederschrift der Geschäftsstelle beim Amtsgericht Saarbrücken, -zentrales Handelsregister-, Mainzerstr.178, 66121 Saarbrücken einzulegen.\nDer Widerspruch muss die Bezeichnung der angefochtenen Löschungsankündigung enthalten sowie die Erklärung, dass Widerspruch eingelegt wird. Er ist vom Widerspruchsführer oder seinem Bevollmächtigten zu unterzeichnen.\nDas Widerspruchsschreiben kann auch in der Form eines elektronischen Dokumentes eingereicht werden, das mit einer qualifizierten elektronischen Signatur nach dem Signaturgesetz versehen sein muss (§§ 14 Abs. 2 FamFG, 130a, 298 ZPO)."
    },
    {
      "date": "2024-11-18",
      "id": "93836",
      "original_text": "Einreichung neuer Dokumente\nNordrhein-Westfalen Amtsgericht Duisburg HRB 9207\nit-motive AG – Duisburg",
      "type": "Einreichung neuer Dokumente",
      "state": "Nordrhein-Westfalen",
      "amtsgericht": "Amtsgericht Duisburg",
      "registernummer": "HRB 9207",
      "registerart": "HRB",
      "company_name": "it-motive AG",
      "company_seat": "Duisburg",
      "details": "18.11.2024 (Bekanntmachungsdatum)\n\nNordrhein-Westfalen Amtsgericht Duisburg HRB 9207\nEinreichung neuer Dokumente\n\nit-motive AG\nAktiengesellschaft\nDuisburg\n\nDem Registergericht ist eine neue Liste der Mitglieder des Aufsichtsrates eingereicht worden."
    },
    {
      "date": "2024-11-18",
      "id": "93814",
      "original_text": "Registerbekanntmachung nach dem Umwandlungsgesetz\nBremen Amtsgericht Bremen HRB 14039\nneusta GmbH – Bremen",
      "type": "Registerbekanntmachung nach dem Umwandlungsgesetz",
      "state": "Bremen",
      "amtsgericht": "Amtsgericht Bremen",
      "registernummer": "HRB 14039",
      "registerart": "HRB",
      "company_name": "neusta GmbH",
      "company_seat": "Bremen",
      "details": "18.11.2024 (Bekanntmachungsdatum)\n\nBremen Amtsgericht Bremen HRB 14039\nRegisterbekanntmachung nach dem Umwandlungsgesetz 18.11.2024 (Eintragungsdatum)\n\nneusta GmbH\nGesellschaft mit beschränkter Haftung\nBremen\n\nAls nicht eingetragen wird veröffentlicht: Den Gläubigern der an der Verschmelzung beteiligten Rechtsträger ist, wenn sie binnen sechs Monaten nach dem Tag, an dem die Eintragung der Verschmelzung in das Register des Sitzes desjenigen Rechtsträgers, dessen Gläubiger sie sind, als bekannt gemacht gilt, ihren Anspruch nach Grund und Höhe schriftlich anmelden, Sicherheit zu leisten, soweit sie nicht Befriedigung verlangen können. Dieses Recht steht den Gläubigern jedoch nur zu, wenn sie glaubhaft machen, dass durch die Verschmelzung die Erfüllung ihrer Forderung gefährdet wird. Das Recht, Sicherheitsleistung zu verlangen, steht Gläubigern nicht zu, die im Falle der Insolvenz ein Recht auf vorzugsweise Befriedigung aus einer Deckungsmasse haben, die nach gesetzlicher Vorschrift zu ihrem Schutz errichtet und staatlich überwacht ist."
    },
    {
      "date": "2024-11-18",
      "id": "93740",
      "original_text": "Einreichung neuer Dokumente\nBaden-Württemberg Amtsgericht Stuttgart HRB 2480\nterranets bw GmbH – Stuttgart",
      "type": "Einreichung neuer Dokumente",
      "state": "Baden-Württemberg",
      "amtsgericht": "Amtsgericht Stuttgart",
      "registernummer": "HRB 2480",
      "registerart": "HRB",
      "company_name": "terranets bw GmbH",
      "company_seat": "Stuttgart",
      "details": "18.11.2024 (Bekanntmachungsdatum)\n\nBaden-Württemberg Amtsgericht Stuttgart HRB 2480\nEinreichung neuer Dokumente\n\nterranets bw GmbH\nGesellschaft mit beschränkter Haftung\nStuttgart\n\nAls nicht eingetragen wird bekanntgemacht:\nDie Gesellschaft hat am 12.11.2024 die Liste über die Zusammensetzung des Aufsichtsrats zum Handelsregister eingereicht."
    },
    {
      "date": "2024-11-18",
      "id": "93855",
      "original_text": "Löschungsankündigung\nHessen Amtsgericht Frankfurt am Main HRB 118139\nÖner Hoch- und Tiefbau GmbH – Frankfurt am Main",
      "type": "Löschungsankündigung",
      "state": "Hessen",
      "amtsgericht": "Amtsgericht Frankfurt am Main",
      "registernummer": "HRB 118139",
      "registerart": "HRB",
      "company_name": "Öner Hoch- und Tiefbau GmbH",
      "company_seat": "Frankfurt am Main",
      "details": "18.11.2024 (Bekanntmachungsdatum)\n\nHessen Amtsgericht Frankfurt am Main HRB 118139\nLöschungsankündigung\n\nÖner Hoch- und Tiefbau GmbH\nGesellschaft mit beschränkter Haftung\nFrankfurt am Main\n\nEs ist beabsichtigt die Gesellschaft wegen Vermögenslosigkeit gemäß § 394 FamFG von Amts wegen zu löschen. Hiergegen kann innerhalb eines Monats nach dieser Veröffentlichung Widerspruch bei dem Amtsgericht Frankfurt am Main eingelegt werden."
    }
  ]
}