{
  "date": "2024-11-20",
  "date_of_scrape": "2024-11-30T13:10:03.146Z",
  "tool_version": "0.2.0",
  "number_of_announcements": 130,
  "announcements": [
    {
      "date": "2024-11-20",
      "id": "94136",
      "original_text": "Löschungsankündigung\nNordrhein-Westfalen Amtsgericht Köln HRB 102573\nALIBI TRANS UG (haftungsbeschränkt) – Köln",
      "type": "Löschungsankündigung",
      "state": "Nordrhein-Westfalen",
      "amtsgericht": "Amtsgericht Köln",
      "registernummer": "HRB 102573",
      "registerart": "HRB",
      "company_name": "ALIBI TRANS UG (haftungsbeschränkt)",
      "company_seat": "Köln",
      "details": "20.11.2024 (Bekanntmachungsdatum)\n\nNordrhein-Westfalen Amtsgericht Köln HRB 102573\nLöschungsankündigung\n\nALIBI TRANS UG (haftungsbeschränkt)\nGesellschaft mit beschränkter Haftung\nKöln\n\nDas Registergericht beabsichtigt die Gesellschaft von Amts wegen nach § 394 FamFG zu löschen. Die Frist zur Erhebung eines Widerspruchs ist auf einen Monat festgesetzt."
    },
    {
      "date": "2024-11-20",
      "id": "94035",
      "original_text": "Registerbekanntmachung nach dem Umwandlungsgesetz\nBayern Amtsgericht München HRB 236843\nAMIDES GmbH – München",
      "type": "Registerbekanntmachung nach dem Umwandlungsgesetz",
      "state": "Bayern",
      "amtsgericht": "Amtsgericht München",
      "registernummer": "HRB 236843",
      "registerart": "HRB",
      "company_name": "AMIDES GmbH",
      "company_seat": "München",
      "details": "20.11.2024 (Bekanntmachungsdatum)\n\nBayern Amtsgericht München HRB 236843\nRegisterbekanntmachung nach dem Umwandlungsgesetz 19.11.2024 (Eintragungsdatum)\n\nAMIDES GmbH\nGesellschaft mit beschränkter Haftung\nMünchen\n\nDen Gläubigern der an der Verschmelzung beteiligten Rechtsträger ist, wenn sie binnen sechs Monaten nach dem Tag, an dem die Eintragung der Verschmelzung in das Register des Sitzes desjenigen Rechtsträgers, dessen Gläubiger sie sind, nach § 19 Abs. 3 UmwG als bekannt gemacht gilt, ihren Anspruch nach Grund und Höhe schriftlich anmelden, Sicherheit zu leisten, soweit sie nicht Befriedigung verlangen können. Dieses Recht steht den Gläubigern jedoch nur zu, wenn sie glaubhaft machen, dass durch die Verschmelzung die Erfüllung ihrer Forderung gefährdet wird."
    },
    {
      "date": "2024-11-20",
      "id": "94153",
      "original_text": "Einreichung neuer Dokumente\nHessen Amtsgericht Frankfurt am Main HRB 40446\nASG Airport Service Gesellschaft mbH – Frankfurt am Main",
      "type": "Einreichung neuer Dokumente",
      "state": "Hessen",
      "amtsgericht": "Amtsgericht Frankfurt am Main",
      "registernummer": "HRB 40446",
      "registerart": "HRB",
      "company_name": "ASG Airport Service Gesellschaft mbH",
      "company_seat": "Frankfurt am Main",
      "details": "20.11.2024 (Bekanntmachungsdatum)\n\nHessen Amtsgericht Frankfurt am Main HRB 40446\nEinreichung neuer Dokumente\n\nASG Airport Service Gesellschaft mbH\nGesellschaft mit beschränkter Haftung\nFrankfurt am Main\n\nDurch eine Änderung in den Personen der Aufsichtsratsmitglieder ist eine Liste der Mitglieder des Aufsichtsrates zum Handelsregister eingereicht worden."
    },
    {
      "date": "2024-11-20",
      "id": "94089",
      "original_text": "Registerbekanntmachung nach dem Umwandlungsgesetz\nThüringen Amtsgericht Jena GnR 300043\nAgrargenossenschaft \"Krayenburg\" Tiefenort eG – Tiefenort",
      "type": "Registerbekanntmachung nach dem Umwandlungsgesetz",
      "state": "Thüringen",
      "amtsgericht": "Amtsgericht Jena",
      "registernummer": "GnR 300043",
      "registerart": "GnR",
      "company_name": "Agrargenossenschaft \"Krayenburg\" Tiefenort eG",
      "company_seat": "Tiefenort",
      "details": "20.11.2024 (Bekanntmachungsdatum)\n\nThüringen Amtsgericht Jena GnR 300043\nRegisterbekanntmachung nach dem Umwandlungsgesetz 20.11.2024 (Eintragungsdatum)\n\nAgrargenossenschaft \"Krayenburg\" Tiefenort eG\neingetragene Genossenschaft\nTiefenort\n\nNicht eingetragen: Den Gläubigern der an der Verschmelzung beteiligten Rechtsträger, ist wenn sie binnen sechs Monaten nach dem Tag, an dem die Eintragung der Verschmelzung in das Register des Sitzes desjenigen Rechtsträgers, dessen Gläubiger sie sind,  nach § 19 Abs. 3 UmwG als bekanntgemacht gilt, ihren Anspruch nach Grund und Höhe schriftlich anmelden, Sicherheit zu leisten, soweit sie nicht Befriedigung verlangen können. Dieses Recht steht ihnen jedoch nur zu, wenn sie glaubhaft machen, daß durch die Verschmelzung die Erfüllung ihrer Forderung gefährdet wird."
    },
    {
      "date": "2024-11-20",
      "id": "94152",
      "original_text": "Einreichung neuer Dokumente\nHessen Amtsgericht Frankfurt am Main HRB 82129\nAir Liquide Global E&C Solutions Germany GmbH – Frankfurt am Main",
      "type": "Einreichung neuer Dokumente",
      "state": "Hessen",
      "amtsgericht": "Amtsgericht Frankfurt am Main",
      "registernummer": "HRB 82129",
      "registerart": "HRB",
      "company_name": "Air Liquide Global E&C Solutions Germany GmbH",
      "company_seat": "Frankfurt am Main",
      "details": "20.11.2024 (Bekanntmachungsdatum)\n\nHessen Amtsgericht Frankfurt am Main HRB 82129\nEinreichung neuer Dokumente 20.11.2024 (Eintragungsdatum)\n\nAir Liquide Global E&C Solutions Germany GmbH\nGesellschaft mit beschränkter Haftung\nFrankfurt am Main\n\nDurch eine Änderung in den Personen der Aufsichtsratsmitglieder ist eine Liste der Mitglieder des Aufsichtsrates zum Handelsregister eingereicht worden."
    },
    {
      "date": "2024-11-20",
      "id": "94148",
      "original_text": "Registerbekanntmachung nach dem Umwandlungsgesetz\nHessen Amtsgericht Frankfurt am Main HRB 54082\nAltania GmbH – Frankfurt am Main",
      "type": "Registerbekanntmachung nach dem Umwandlungsgesetz",
      "state": "Hessen",
      "amtsgericht": "Amtsgericht Frankfurt am Main",
      "registernummer": "HRB 54082",
      "registerart": "HRB",
      "company_name": "Altania GmbH",
      "company_seat": "Frankfurt am Main",
      "details": "20.11.2024 (Bekanntmachungsdatum)\n\nHessen Amtsgericht Frankfurt am Main HRB 54082\nRegisterbekanntmachung nach dem Umwandlungsgesetz 20.11.2024 (Eintragungsdatum)\n\nAltania GmbH\nGesellschaft mit beschränkter Haftung\nFrankfurt am Main\n\nDen Gläubigern der an der formwechselnden Umwandlung beteiligten Rechtsträger ist, wenn sie binnen sechs Monaten nach dem Tag, an dem die Eintragung der formwechselnden Umwandlung in das Register des Sitzes desjenigen Rechtsträgers, dessen Gläubiger sie sind, nach § 201 UmwG bekannt gemacht worden ist, ihren Anspruch nach Grund und Höhe schriftlich anmelden, Sicherheit zu leisten, soweit sie nicht Befriedigung verlangen können. Dieses Recht steht den Gläubigern jedoch nur zu, wenn sie glaubhaft machen, dass durch die formwechselnden Umwandlung die Erfüllung ihrer Forderung gefährdet wird."
    },
    {
      "date": "2024-11-20",
      "id": "94157",
      "original_text": "Registerbekanntmachung nach dem Umwandlungsgesetz\nHessen Amtsgericht Frankfurt am Main GsR 534\nAltania eGbR – Frankfurt am Main",
      "type": "Registerbekanntmachung nach dem Umwandlungsgesetz",
      "state": "Hessen",
      "amtsgericht": "Amtsgericht Frankfurt am Main",
      "registernummer": "GsR 534",
      "registerart": "GsR",
      "company_name": "Altania eGbR",
      "company_seat": "Frankfurt am Main",
      "details": "20.11.2024 (Bekanntmachungsdatum)\n\nHessen Amtsgericht Frankfurt am Main GsR 534\nRegisterbekanntmachung nach dem Umwandlungsgesetz 20.11.2024 (Eintragungsdatum)\n\nAltania eGbR\nGesellschaft bürgerlichen Rechts\nFrankfurt am Main\n\nDen Gläubigern der an der formwechselnden Umwandlung beteiligten Rechtsträger ist, wenn sie binnen sechs Monaten nach dem Tag, an dem die Eintragung der formwechselnden Umwandlung in das Register des Sitzes desjenigen Rechtsträgers, dessen Gläubiger sie sind, nach § 201 UmwG bekannt gemacht worden ist, ihren Anspruch nach Grund und Höhe schriftlich anmelden, Sicherheit zu leisten, soweit sie nicht Befriedigung verlangen können. Dieses Recht steht den Gläubigern jedoch nur zu, wenn sie glaubhaft machen, dass durch die formwechselnden Umwandlung die Erfüllung ihrer Forderung gefährdet wird."
    },
    {
      "date": "2024-11-20",
      "id": "94088",
      "original_text": "Einreichung neuer Dokumente\nThüringen Amtsgericht Jena HRB 111979\nApoldaer Beteiligungsgesellschaft mbH – Apolda",
      "type": "Einreichung neuer Dokumente",
      "state": "Thüringen",
      "amtsgericht": "Amtsgericht Jena",
      "registernummer": "HRB 111979",
      "registerart": "HRB",
      "company_name": "Apoldaer Beteiligungsgesellschaft mbH",
      "company_seat": "Apolda",
      "details": "20.11.2024 (Bekanntmachungsdatum)\n\nThüringen Amtsgericht Jena HRB 111979\nEinreichung neuer Dokumente\n\nApoldaer Beteiligungsgesellschaft mbH\nGesellschaft mit beschränkter Haftung\nApolda\n\nBekanntmachung gem. § 52 Abs. 3 Satz 2 GmbHG: Aufgrund einer Veränderung in den Personen der Aufsichtsratsmitglieder ist durch die Geschäftsführer eine neue Liste zum Handelsregister eingereicht worden."
    },
    {
      "date": "2024-11-20",
      "id": "94074",
      "original_text": "Löschungsankündigung\nBerlin Amtsgericht Berlin (Charlottenburg) HRB 194161\nAsgard Finance GmbH – Berlin",
      "type": "Löschungsankündigung",
      "state": "Berlin",
      "amtsgericht": "Amtsgericht Berlin (Charlottenburg)",
      "registernummer": "HRB 194161",
      "registerart": "HRB",
      "company_name": "Asgard Finance GmbH",
      "company_seat": "Berlin",
      "details": "20.11.2024 (Bekanntmachungsdatum)\n\nBerlin Amtsgericht Berlin (Charlottenburg) HRB 194161\nLöschungsankündigung\n\nAsgard Finance GmbH\nGesellschaft mit beschränkter Haftung\nBerlin\n\nBei der nachstehenden Gesellschaft wird das Amtslöschungsverfahren gemäß § 394 FamFG eingeleitet. Widerspruchsfrist 6 Wochen"
    },
    {
      "date": "2024-11-20",
      "id": "94145",
      "original_text": "Löschungsankündigung\nNordrhein-Westfalen Amtsgericht Essen HRB 34687\nAurora Handel und Transport GmbH – Essen",
      "type": "Löschungsankündigung",
      "state": "Nordrhein-Westfalen",
      "amtsgericht": "Amtsgericht Essen",
      "registernummer": "HRB 34687",
      "registerart": "HRB",
      "company_name": "Aurora Handel und Transport GmbH",
      "company_seat": "Essen",
      "details": "20.11.2024 (Bekanntmachungsdatum)\n\nNordrhein-Westfalen Amtsgericht Essen HRB 34687\nLöschungsankündigung\n\nAurora Handel und Transport GmbH\nGesellschaft mit beschränkter Haftung\nEssen\n\nDas Registergericht beabsichtigt die Gesellschaft von Amts wegen nach § 394 FamFG zu löschen. Die Frist zur Erhebung eines Widerspruchs ist auf einen Monat festgesetzt."
    },
    {
      "date": "2024-11-20",
      "id": "94159",
      "original_text": "Registerbekanntmachung nach dem Umwandlungsgesetz\nHessen Amtsgericht Bad Homburg v.d.H. HRB 5490\nBMI Deutschland GmbH – Oberursel (Taunus)",
      "type": "Registerbekanntmachung nach dem Umwandlungsgesetz",
      "state": "Hessen",
      "amtsgericht": "Amtsgericht Bad Homburg v.d.H.",
      "registernummer": "HRB 5490",
      "registerart": "HRB",
      "company_name": "BMI Deutschland GmbH",
      "company_seat": "Oberursel (Taunus)",
      "details": "20.11.2024 (Bekanntmachungsdatum)\n\nHessen Amtsgericht Bad Homburg v.d.H. HRB 5490\nRegisterbekanntmachung nach dem Umwandlungsgesetz 20.11.2024 (Eintragungsdatum)\n\nBMI Deutschland GmbH\nGesellschaft mit beschränkter Haftung\nOberursel (Taunus)\n\nDen Gläubigern der an der Verschmelzung beteiligten Rechtsträger ist, wenn sie binnen sechs Monaten nach dem Tag, an dem die Eintragung der Verschmelzung in das Register des Sitzes desjenigen Rechtsträgers, dessen Gläubiger sie sind, nach § 19 Absatz 3 UmwG bekannt gemacht worden ist, ihren Anspruch nach Grund und Höhe schriftlich anmelden, Sicherheit zu leisten, soweit sie nicht Befriedigung verlangen können. Dieses Recht steht den Gläubigern jedoch nur zu, wenn sie glaubhaft machen, dass durch die Verschmelzung die Erfüllung ihrer Forderung gefährdet wird."
    },
    {
      "date": "2024-11-20",
      "id": "94104",
      "original_text": "Löschungsankündigung\nBaden-Württemberg Amtsgericht Freiburg HRB 724206\nBaumann Freiburg UG (haftungsbeschränkt) – Freiburg im Breisgau",
      "type": "Löschungsankündigung",
      "state": "Baden-Württemberg",
      "amtsgericht": "Amtsgericht Freiburg",
      "registernummer": "HRB 724206",
      "registerart": "HRB",
      "company_name": "Baumann Freiburg UG (haftungsbeschränkt)",
      "company_seat": "Freiburg im Breisgau",
      "details": "20.11.2024 (Bekanntmachungsdatum)\n\nBaden-Württemberg Amtsgericht Freiburg HRB 724206\nLöschungsankündigung\n\nBaumann Freiburg UG (haftungsbeschränkt)\nGesellschaft mit beschränkter Haftung\nFreiburg im Breisgau\n\nDas Gericht beabsichtigt, die Gesellschaft wegen Vermögenslosigkeit im Handelsregister von Amts wegen nach § 394 FamFG zu löschen. Die Frist zur Geltendmachung eines Widerspruchs gegen die beabsichtigte Löschung ist auf einen Monat ab Veröffentlichung bestimmt."
    },
    {
      "date": "2024-11-20",
      "id": "94101",
      "original_text": "Löschungsankündigung\nBaden-Württemberg Amtsgericht Mannheim HRB 705234\nBel Air Betriebs GmbH – Brühl",
      "type": "Löschungsankündigung",
      "state": "Baden-Württemberg",
      "amtsgericht": "Amtsgericht Mannheim",
      "registernummer": "HRB 705234",
      "registerart": "HRB",
      "company_name": "Bel Air Betriebs GmbH",
      "company_seat": "Brühl",
      "details": "20.11.2024 (Bekanntmachungsdatum)\n\nBaden-Württemberg Amtsgericht Mannheim HRB 705234\nLöschungsankündigung\n\nBel Air Betriebs GmbH\nGesellschaft mit beschränkter Haftung\nBrühl\n\nDas Gericht beabsichtigt, die Gesellschaft wegen Vermögenslosigkeit im Handelsregister von Amts wegen nach § 394 FamFG zu löschen. Die Frist zur Geltendmachung eines Widerspruchs gegen die beabsichtigte Löschung ist auf einen Monat ab Veröffentlichung bestimmt."
    },
    {
      "date": "2024-11-20",
      "id": "94138",
      "original_text": "Löschungsankündigung\nNordrhein-Westfalen Amtsgericht Düsseldorf HRB 83534\nBeybaba UG (haftungsbeschränkt) – Düsseldorf",
      "type": "Löschungsankündigung",
      "state": "Nordrhein-Westfalen",
      "amtsgericht": "Amtsgericht Düsseldorf",
      "registernummer": "HRB 83534",
      "registerart": "HRB",
      "company_name": "Beybaba UG (haftungsbeschränkt)",
      "company_seat": "Düsseldorf",
      "details": "20.11.2024 (Bekanntmachungsdatum)\n\nNordrhein-Westfalen Amtsgericht Düsseldorf HRB 83534\nLöschungsankündigung\n\nBeybaba UG (haftungsbeschränkt)\nGesellschaft mit beschränkter Haftung\nDüsseldorf\n\nDas Registergericht beabsichtigt die Gesellschaft von Amts wegen nach § 394 FamFG zu löschen. Die Frist zur Erhebung eines Widerspruchs ist auf 3 Wochen festgesetzt.\n\nRechtsbehelfsbelehrung:\nDas Widerspruchsrecht steht jedem zu, der an der Unterlassung der Löschung ein berechtigtes Interesse hat. Der Widerspruch ist bei dem Amtsgericht Düsseldorf -Registergericht-, Werdener Straße 1, 40227 Düsseldorf schriftlich in deutscher Sprache oder zur Niederschrift der Geschäftsstelle einzulegen. Der Widerspruch kann auch zur Niederschrift der Geschäftsstelle eines jeden Amtsgerichtes abgegeben werden. Die Einlegung ist auch durch Übertragung eines elektronischen Dokuments an die elektronische Poststelle des Gerichts möglich. Das elektronische Dokument muss für die Bearbeitung durch das Gericht geeignet und mit einer qualifizierten elektronischen Signatur der verantwortenden Person versehen sein oder von der verantwortenden Person signiert und auf einem sicheren Übermittlungsweg gemäß § 130a ZPO nach näherer Maßgabe der Verordnung über die technischen Rahmenbedingungen des elektronischen Rechtsverkehrs und über das besondere elektronische Behördenpostfach (BGBl. I, S.3803) eingereicht werden. Weitere Informationen erhalten Sie auf der Internetseite www.justiz.de.\nDer Widerspruch muss spätestens innerhalb der gesetzten Frist nach dem Datum der Bekanntmachung der Löschungsankündigung bei dem Amtsgericht - Registergericht - Düsseldorf eingegangen sein.  Dies gilt auch dann, wenn der Widerspruch zur Niederschrift der Geschäftsstelle eines anderen Amtsgerichtes abgegeben wurde. Die Frist beginnt mit dem Tage der Bekanntmachung der Löschungsankündigung in dem für die Bekanntmachung der Eintragungen in das Handelsregister bestimmten elektronischen Informations- und Kommunikationssystem nach § 10 des Handelsgesetzbuches. Fällt das Ende der Frist auf einen Sonntag, einen allgemeinen Feiertag oder Sonnabend, so endet die Frist mit Ablauf des nächsten Werktages.\nDer Widerspruch muss die Bezeichnung der angefochtenen Löschungsankündigung sowie die Erklärung enthalten, dass Widerspruch gegen diese Löschungsankündigung eingelegt wird. Er ist zu unterzeichnen und soll begründet werden."
    },
    {
      "date": "2024-11-20",
      "id": "94072",
      "original_text": "Registerbekanntmachung nach dem Umwandlungsgesetz\nSchleswig-Holstein Amtsgericht Lübeck HRB 25554\nBockholdt GmbH – Lübeck",
      "type": "Registerbekanntmachung nach dem Umwandlungsgesetz",
      "state": "Schleswig-Holstein",
      "amtsgericht": "Amtsgericht Lübeck",
      "registernummer": "HRB 25554",
      "registerart": "HRB",
      "company_name": "Bockholdt GmbH",
      "company_seat": "Lübeck",
      "details": "20.11.2024 (Bekanntmachungsdatum)\n\nSchleswig-Holstein Amtsgericht Lübeck HRB 25554\nRegisterbekanntmachung nach dem Umwandlungsgesetz 19.11.2024 (Eintragungsdatum)\n\nBockholdt GmbH\nGesellschaft mit beschränkter Haftung\nLübeck\n\nZu Eintragungsnummer 1 vom 19.11.2024 wird als nicht eingetragen veröffentlicht: Den Gläubigern ist, wenn sie binnen sechs Monaten nach dem Tag, an dem die Eintragung der Umwandlung als bekannt gemacht gilt, ihren Anspruch nach Grund und Höhe schriftlich anmelden, Sicherheit zu leisten, soweit sie nicht Befriedigung verlangen können. Dieses Recht steht den Gläubigern jedoch nur zu, wenn sie glaubhaft machen, dass durch die Umwandlung die Erfüllung ihrer Forderung gefährdet wird."
    },
    {
      "date": "2024-11-20",
      "id": "94066",
      "original_text": "Registerbekanntmachung nach dem Umwandlungsgesetz\nSchleswig-Holstein Amtsgericht Lübeck HRA 881\nBockholdt GmbH & Co. KG – Lübeck",
      "type": "Registerbekanntmachung nach dem Umwandlungsgesetz",
      "state": "Schleswig-Holstein",
      "amtsgericht": "Amtsgericht Lübeck",
      "registernummer": "HRA 881",
      "registerart": "HRA",
      "company_name": "Bockholdt GmbH & Co. KG",
      "company_seat": "Lübeck",
      "details": "20.11.2024 (Bekanntmachungsdatum)\n\nSchleswig-Holstein Amtsgericht Lübeck HRA 881\nRegisterbekanntmachung nach dem Umwandlungsgesetz 19.11.2024 (Eintragungsdatum)\n\nBockholdt GmbH & Co. KG\nKommanditgesellschaft\nLübeck\n\nZu Eintragungsnummer 30 vom 19.11.2024 wird als nicht eingetragen veröffentlicht: Den Gläubigern ist, wenn sie binnen sechs Monaten nach dem Tag, an dem die Eintragung der Umwandlung als bekannt gemacht gilt, ihren Anspruch nach Grund und Höhe schriftlich anmelden, Sicherheit zu leisten, soweit sie nicht Befriedigung verlangen können. Dieses Recht steht den Gläubigern jedoch nur zu, wenn sie glaubhaft machen, dass durch die Umwandlung die Erfüllung ihrer Forderung gefährdet wird."
    },
    {
      "date": "2024-11-20",
      "id": "94039",
      "original_text": "Sonstige Registerbekanntmachung\nBayern Amtsgericht München HRB 203845\nCANCOM SE – München",
      "type": "Sonstige Registerbekanntmachung",
      "state": "Bayern",
      "amtsgericht": "Amtsgericht München",
      "registernummer": "HRB 203845",
      "registerart": "HRB",
      "company_name": "CANCOM SE",
      "company_seat": "München",
      "details": "20.11.2024 (Bekanntmachungsdatum)\n\nBayern Amtsgericht München HRB 203845\nSonstige Registerbekanntmachung 19.11.2024 (Eintragungsdatum)\n\nCANCOM SE\nEuropäische Aktiengesellschaft (SE)\nMünchen\n\nDen Gläubigern der Gesellschaft, deren Forderungen begründet worden sind, bevor die Eintragung des Beschlusses bekanntgemacht worden ist, ist, wenn sie sich binnen sechs Monaten nach der Bekanntmachung zu diesem Zweck melden, Sicherheit zu leisten, soweit sie nicht Befriedigung verlangen können. Das Recht, Sicherheitsleistung zu verlangen, steht Gläubigern nicht zu, die im Fall des Insolvenzverfahrens ein Recht auf vorzugsweise Befriedigung aus einer Deckungsmasse haben, die nach gesetzlicher Vorschrift zu ihrem Schutz errichtet und staatlich überwacht ist."
    },
    {
      "date": "2024-11-20",
      "id": "94040",
      "original_text": "Löschungsankündigung\nBayern Amtsgericht Augsburg HRB 24593\nCORVEX Life Science UG (haftungsbeschränkt) – Augsburg",
      "type": "Löschungsankündigung",
      "state": "Bayern",
      "amtsgericht": "Amtsgericht Augsburg",
      "registernummer": "HRB 24593",
      "registerart": "HRB",
      "company_name": "CORVEX Life Science UG (haftungsbeschränkt)",
      "company_seat": "Augsburg",
      "details": "20.11.2024 (Bekanntmachungsdatum)\n\nBayern Amtsgericht Augsburg HRB 24593\nLöschungsankündigung\n\nCORVEX Life Science UG (haftungsbeschränkt)\nGesellschaft mit beschränkter Haftung\nAugsburg\n\nDas Registergericht beabsichtigt, die im Handelsregister eingetragene Gesellschaft wegen Vermögenslosigkeit von Amts wegen nach § 394 FamFG zu löschen. Die Frist zur Erhebung eines Widerspruchs ist auf einen Monat festgesetzt."
    },
    {
      "date": "2024-11-20",
      "id": "94038",
      "original_text": "Sonstige Registerbekanntmachung\nBayern Amtsgericht Aschaffenburg HRB 9446\nCPS Handels- und Vertriebs GmbH – Karlstein",
      "type": "Sonstige Registerbekanntmachung",
      "state": "Bayern",
      "amtsgericht": "Amtsgericht Aschaffenburg",
      "registernummer": "HRB 9446",
      "registerart": "HRB",
      "company_name": "CPS Handels- und Vertriebs GmbH",
      "company_seat": "Karlstein",
      "details": "20.11.2024 (Bekanntmachungsdatum)\n\nBayern Amtsgericht Aschaffenburg HRB 9446\nSonstige Registerbekanntmachung 19.11.2024 (Eintragungsdatum)\n\nCPS Handels- und Vertriebs GmbH\nGesellschaft mit beschränkter Haftung\nKarlstein\n\nDen Gläubigern der Gesellschaft, deren Forderungen begründet worden sind, bevor die Eintragung der Beendigung des #DV.art(Text=\"Bitte Art des Vertrages auswählen\",Eingabe=\n\"Beherrschungs- und Gewinnabführungsvertrages\",\n\"Beherrschungsvertrages\",\n\"Gewinnabführungsvertrages\",\n\"Teilgewinnabführungsvertrages\") in das Handelsregister nach § 10 des Handelsgesetzbuches als bekanntgemacht gilt, hat der andere Vertragsteil Sicherheit zu leisten, wenn sie sich binnen sechs Monaten nach der Bekanntmachung der Eintragung zu diesem Zweck bei ihm melden."
    },
    {
      "date": "2024-11-20",
      "id": "94084",
      "original_text": "Sonstige Registerbekanntmachung\nBerlin Amtsgericht Berlin (Charlottenburg) HRB 179568\nCellbricks GmbH – Berlin",
      "type": "Sonstige Registerbekanntmachung",
      "state": "Berlin",
      "amtsgericht": "Amtsgericht Berlin (Charlottenburg)",
      "registernummer": "HRB 179568",
      "registerart": "HRB",
      "company_name": "Cellbricks GmbH",
      "company_seat": "Berlin",
      "details": "20.11.2024 (Bekanntmachungsdatum)\n\nBerlin Amtsgericht Berlin (Charlottenburg) HRB 179568\nSonstige Registerbekanntmachung\n\nCellbricks GmbH\nGesellschaft mit beschränkter Haftung\nBerlin\n\nAls nicht eingetragen wird veröffentlicht: Es wurde eine neue Liste der Beisratsmitglieder eingereicht (§52 GmbHG)."
    },
    {
      "date": "2024-11-20",
      "id": "94046",
      "original_text": "Löschungsankündigung\nBayern Amtsgericht München HRA 86757\nConti 171. Container Schiffahrts-GmbH & Co. KG Nr. 1 – München",
      "type": "Löschungsankündigung",
      "state": "Bayern",
      "amtsgericht": "Amtsgericht München",
      "registernummer": "HRA 86757",
      "registerart": "HRA",
      "company_name": "Conti 171. Container Schiffahrts-GmbH & Co. KG Nr. 1",
      "company_seat": "München",
      "details": "20.11.2024 (Bekanntmachungsdatum)\n\nBayern Amtsgericht München HRA 86757\nLöschungsankündigung 19.11.2024 (Eintragungsdatum)\n\nConti 171. Container Schiffahrts-GmbH & Co. KG Nr. 1\nKommanditgesellschaft\nMünchen\n\nDas Registergericht beabsichtigt, die im Handelsregister eingetragene Firma von Amts wegen nach § 31 Abs. 2 HGB zu löschen. Die Frist zur Erhebung eines Widerspruchs ist auf zwei Monate festgesetzt."
    },
    {
      "date": "2024-11-20",
      "id": "94158",
      "original_text": "Sonstige Registerbekanntmachung\nHessen Amtsgericht Frankfurt am Main HRB 79808\nDB Vertrieb GmbH – Frankfurt am Main",
      "type": "Sonstige Registerbekanntmachung",
      "state": "Hessen",
      "amtsgericht": "Amtsgericht Frankfurt am Main",
      "registernummer": "HRB 79808",
      "registerart": "HRB",
      "company_name": "DB Vertrieb GmbH",
      "company_seat": "Frankfurt am Main",
      "details": "20.11.2024 (Bekanntmachungsdatum)\n\nHessen Amtsgericht Frankfurt am Main HRB 79808\nSonstige Registerbekanntmachung\n\nDB Vertrieb GmbH\nGesellschaft mit beschränkter Haftung\nFrankfurt am Main\n\nDurch eine Änderung in den Personen der Aufsichtsratsmitglieder ist eine Liste der Mitglieder des Aufsichtsrates zum Handelsregister eingereicht worden."
    },
    {
      "date": "2024-11-20",
      "id": "94147",
      "original_text": "Sonstige Registerbekanntmachung\nHessen Amtsgericht Bad Homburg v.d.H. HRB 16004\nDie Energieperten UG (haftungsbeschränkt) – Bad Homburg v. d. Höhe",
      "type": "Sonstige Registerbekanntmachung",
      "state": "Hessen",
      "amtsgericht": "Amtsgericht Bad Homburg v.d.H.",
      "registernummer": "HRB 16004",
      "registerart": "HRB",
      "company_name": "Die Energieperten UG (haftungsbeschränkt)",
      "company_seat": "Bad Homburg v. d. Höhe",
      "details": "20.11.2024 (Bekanntmachungsdatum)\n\nHessen Amtsgericht Bad Homburg v.d.H. HRB 16004\nSonstige Registerbekanntmachung\n\nDie Energieperten UG (haftungsbeschränkt)\nGesellschaft mit beschränkter Haftung\nBad Homburg v. d. Höhe\n\nDas Registergericht beabsichtigt den im Handelsregister eingetragenen Geschäftsführer Menschner, Dustin, Bad Homburg v. d. Höhe, *22.10.1997 von Amts wegen nach § 395 FamFG zu löschen. Die Frist zur Erhebung eines Widerspruchs gegen die beabsichtigte Löschung wird auf 3 Monate festgesetzt."
    },
    {
      "date": "2024-11-20",
      "id": "94044",
      "original_text": "Löschungsankündigung\nBayern Amtsgericht Kempten (Allgäu) HRB 8001\nE & E Automobile GmbH – Buchloe",
      "type": "Löschungsankündigung",
      "state": "Bayern",
      "amtsgericht": "Amtsgericht Kempten (Allgäu)",
      "registernummer": "HRB 8001",
      "registerart": "HRB",
      "company_name": "E & E Automobile GmbH",
      "company_seat": "Buchloe",
      "details": "20.11.2024 (Bekanntmachungsdatum)\n\nBayern Amtsgericht Kempten (Allgäu) HRB 8001\nLöschungsankündigung\n\nE & E Automobile GmbH\nGesellschaft mit beschränkter Haftung\nBuchloe\n\nDas Registergericht beabsichtigt, die im Handelsregister eingetragene Gesellschaft wegen Vermögenslosigkeit von Amts wegen nach § 394 FamFG zu löschen. Die Frist zur Erhebung eines Widerspruchs ist auf einen Monat festgesetzt."
    },
    {
      "date": "2024-11-20",
      "id": "94099",
      "original_text": "Löschungsankündigung\nBerlin Amtsgericht Berlin (Charlottenburg) HRB 236482\nEEVENT Hospitality UG (haftungsbeschränkt) – Berlin",
      "type": "Löschungsankündigung",
      "state": "Berlin",
      "amtsgericht": "Amtsgericht Berlin (Charlottenburg)",
      "registernummer": "HRB 236482",
      "registerart": "HRB",
      "company_name": "EEVENT Hospitality UG (haftungsbeschränkt)",
      "company_seat": "Berlin",
      "details": "20.11.2024 (Bekanntmachungsdatum)\n\nBerlin Amtsgericht Berlin (Charlottenburg) HRB 236482\nLöschungsankündigung\n\nEEVENT Hospitality UG (haftungsbeschränkt)\nGesellschaft mit beschränkter Haftung\nBerlin\n\nBei der nachstehenden Gesellschaft wird das Amtslöschungsverfahren gemäß § 394 FamFG eingeleitet. Widerspruchsfrist 6 Wochen"
    },
    {
      "date": "2024-11-20",
      "id": "94106",
      "original_text": "Löschungsankündigung\nBrandenburg Amtsgericht Potsdam HRB 26805\nENAD Bau GmbH – Potsdam",
      "type": "Löschungsankündigung",
      "state": "Brandenburg",
      "amtsgericht": "Amtsgericht Potsdam",
      "registernummer": "HRB 26805",
      "registerart": "HRB",
      "company_name": "ENAD Bau GmbH",
      "company_seat": "Potsdam",
      "details": "20.11.2024 (Bekanntmachungsdatum)\n\nBrandenburg Amtsgericht Potsdam HRB 26805\nLöschungsankündigung\n\nENAD Bau GmbH\nGesellschaft mit beschränkter Haftung\nPotsdam\n\nBei der nachstehenden Gesellschaft wird das Amtslöschungsverfahren gemäß § 394 FamFG eingeleitet. Widerspruchfrist: 8 Wochen."
    },
    {
      "date": "2024-11-20",
      "id": "94049",
      "original_text": "Löschungsankündigung\nMecklenburg-Vorpommern Amtsgericht Rostock HRB 12455\nEisfeld Verwaltungs GmbH – Rostock",
      "type": "Löschungsankündigung",
      "state": "Mecklenburg-Vorpommern",
      "amtsgericht": "Amtsgericht Rostock",
      "registernummer": "HRB 12455",
      "registerart": "HRB",
      "company_name": "Eisfeld Verwaltungs GmbH",
      "company_seat": "Rostock",
      "details": "20.11.2024 (Bekanntmachungsdatum)\n\nMecklenburg-Vorpommern Amtsgericht Rostock HRB 12455\nLöschungsankündigung\n\nEisfeld Verwaltungs GmbH\nGesellschaft mit beschränkter Haftung\nRostock\n\nDas Registergericht beabsichtigt, die im Handelsregister eingetragene Gesellschaft von Amts wegen nach § 394 FamFG zu löschen. Die Frist zur Erhebung eines Widerspruchs gegen die beabsichtigte Löschung wird auf einen Monat festgesetzt."
    },
    {
      "date": "2024-11-20",
      "id": "94109",
      "original_text": "Einreichung neuer Dokumente\nNiedersachsen Amtsgericht Braunschweig HRB 6298\nEntsorgungszentrum Salzgitter GmbH – Salzgitter",
      "type": "Einreichung neuer Dokumente",
      "state": "Niedersachsen",
      "amtsgericht": "Amtsgericht Braunschweig",
      "registernummer": "HRB 6298",
      "registerart": "HRB",
      "company_name": "Entsorgungszentrum Salzgitter GmbH",
      "company_seat": "Salzgitter",
      "details": "20.11.2024 (Bekanntmachungsdatum)\n\nNiedersachsen Amtsgericht Braunschweig HRB 6298\nEinreichung neuer Dokumente 20.11.2024 (Eintragungsdatum)\n\nEntsorgungszentrum Salzgitter GmbH\nGesellschaft mit beschränkter Haftung\nSalzgitter\n\nDie Liste der Mitglieder des Aufsichtsrats wurde beim Registergericht eingereicht."
    },
    {
      "date": "2024-11-20",
      "id": "94082",
      "original_text": "Einreichung neuer Dokumente\nBrandenburg Amtsgericht Cottbus HRB 9494\nEntwicklungs- und Betreibungsgesellschaft mbH Königs Wusterhausen (EBEG mbH) – Königs Wusterhausen",
      "type": "Einreichung neuer Dokumente",
      "state": "Brandenburg",
      "amtsgericht": "Amtsgericht Cottbus",
      "registernummer": "HRB 9494",
      "registerart": "HRB",
      "company_name": "Entwicklungs- und Betreibungsgesellschaft mbH Königs Wusterhausen (EBEG mbH)",
      "company_seat": "Königs Wusterhausen",
      "details": "20.11.2024 (Bekanntmachungsdatum)\n\nBrandenburg Amtsgericht Cottbus HRB 9494\nEinreichung neuer Dokumente\n\nEntwicklungs- und Betreibungsgesellschaft mbH Königs Wusterhausen (EBEG mbH)\nGesellschaft mit beschränkter Haftung\nKönigs Wusterhausen\n\nAls nicht eingetragen wird veröffentlicht:\nDer Geschäftsführer hat eine Liste der Aufsichtsratsmitglieder gem. § 52 Abs. 3 Satz 2 GmbHG zum Handelsregister eingereicht"
    },
    {
      "date": "2024-11-20",
      "id": "94140",
      "original_text": "Registerbekanntmachung nach dem Umwandlungsgesetz\nNordrhein-Westfalen Amtsgericht Krefeld HRB 11945\nFAS Financial Accounting Services GmbH – Kempen",
      "type": "Registerbekanntmachung nach dem Umwandlungsgesetz",
      "state": "Nordrhein-Westfalen",
      "amtsgericht": "Amtsgericht Krefeld",
      "registernummer": "HRB 11945",
      "registerart": "HRB",
      "company_name": "FAS Financial Accounting Services GmbH",
      "company_seat": "Kempen",
      "details": "20.11.2024 (Bekanntmachungsdatum)\n\nNordrhein-Westfalen Amtsgericht Krefeld HRB 11945\nRegisterbekanntmachung nach dem Umwandlungsgesetz 20.11.2024 (Eintragungsdatum)\n\nFAS Financial Accounting Services GmbH\nGesellschaft mit beschränkter Haftung\nKempen\n\nDen Gläubigern der an der Verschmelzung beteiligten Rechtsträger ist, wenn sie binnen sechs Monaten nach dem Tag, an dem die Eintragung der Verschmelzung in das Register des Sitzes desjenigen Rechtsträgers, dessen Gläubiger sie sind, nach § 19 Absatz 3 UmwG als bekanntgemacht gilt, ihren Anspruch nach Grund und Höhe schriftlich anmelden, Sicherheit zu leisten, soweit sie nicht Befriedigung verlangen können. Dieses Recht steht den Gläubigern jedoch nur zu, wenn sie glaubhaft machen, dass durch die Verschmelzung die Erfüllung ihrer Forderung gefährdet wird."
    },
    {
      "date": "2024-11-20",
      "id": "94034",
      "original_text": "Sonstige Registerbekanntmachung\nBayern Amtsgericht Bamberg HRB 9922\nFRÄNKISCHE Group SE – Königsberg i. Bay.",
      "type": "Sonstige Registerbekanntmachung",
      "state": "Bayern",
      "amtsgericht": "Amtsgericht Bamberg",
      "registernummer": "HRB 9922",
      "registerart": "HRB",
      "company_name": "FRÄNKISCHE Group SE",
      "company_seat": "Königsberg i. Bay.",
      "details": "20.11.2024 (Bekanntmachungsdatum)\n\nBayern Amtsgericht Bamberg HRB 9922\nSonstige Registerbekanntmachung 19.11.2024 (Eintragungsdatum)\n\nFRÄNKISCHE Group SE\nEuropäische Aktiengesellschaft (SE)\nKönigsberg i. Bay.\n\nDem #Re.Name ist eine Liste der Mitglieder des Verwaltungsrats eingereicht worden, Art. 9 Abs. 1 Buchst. c (ii) SE-VO i.V.m. § 106 AktG."
    },
    {
      "date": "2024-11-20",
      "id": "94150",
      "original_text": "Registerbekanntmachung nach dem Umwandlungsgesetz\nHessen Amtsgericht Marburg HRA 5512\nFelix Kling e.K. – Kirchhain",
      "type": "Registerbekanntmachung nach dem Umwandlungsgesetz",
      "state": "Hessen",
      "amtsgericht": "Amtsgericht Marburg",
      "registernummer": "HRA 5512",
      "registerart": "HRA",
      "company_name": "Felix Kling e.K.",
      "company_seat": "Kirchhain",
      "details": "20.11.2024 (Bekanntmachungsdatum)\n\nHessen Amtsgericht Marburg HRA 5512\nRegisterbekanntmachung nach dem Umwandlungsgesetz 20.11.2024 (Eintragungsdatum)\n\nFelix Kling e.K.\nEinzelkaufmann / Einzelkauffrau\nKirchhain\n\nDen Gläubigern der an der Ausgliederung beteiligten Rechtsträger ist, wenn sie binnen sechs Monaten nach dem Tag, an dem die Eintragung der Ausgliederung in das Register des Sitzes desjenigen Rechtsträgers, dessen Gläubiger sie sind, nach §§ 125, 19 Absatz 3 UmwG bekannt gemacht worden ist, ihren Anspruch nach Grund und Höhe schriftlich anmelden, Sicherheit zu leisten, soweit sie nicht Befriedigung verlangen können. Dieses Recht steht den Gläubigern jedoch nur zu, wenn sie glaubhaft machen, dass durch die Ausgliederung die Erfüllung ihrer Forderung gefährdet wird."
    },
    {
      "date": "2024-11-20",
      "id": "94062",
      "original_text": "Löschungsankündigung\nSchleswig-Holstein Amtsgericht Pinneberg HRA 7172\nFuture Internetseiten Betreibungs GmbH & Co. KG – Heide",
      "type": "Löschungsankündigung",
      "state": "Schleswig-Holstein",
      "amtsgericht": "Amtsgericht Pinneberg",
      "registernummer": "HRA 7172",
      "registerart": "HRA",
      "company_name": "Future Internetseiten Betreibungs GmbH & Co. KG",
      "company_seat": "Heide",
      "details": "20.11.2024 (Bekanntmachungsdatum)\n\nSchleswig-Holstein Amtsgericht Pinneberg HRA 7172\nLöschungsankündigung\n\nFuture Internetseiten Betreibungs GmbH & Co. KG\nKommanditgesellschaft\nHeide\n\nEs ist die Löschung der nachstehenden Gesellschaft wegen Vermögenslosigkeit gemäß § 394 FamFG beabsichtigt. Widerspruchsfrist: 2 Monate."
    },
    {
      "date": "2024-11-20",
      "id": "94048",
      "original_text": "Löschungsankündigung\nBayern Amtsgericht Bayreuth HRB 5216\nGTS German Technology Systems GmbH – Bayreuth",
      "type": "Löschungsankündigung",
      "state": "Bayern",
      "amtsgericht": "Amtsgericht Bayreuth",
      "registernummer": "HRB 5216",
      "registerart": "HRB",
      "company_name": "GTS German Technology Systems GmbH",
      "company_seat": "Bayreuth",
      "details": "20.11.2024 (Bekanntmachungsdatum)\n\nBayern Amtsgericht Bayreuth HRB 5216\nLöschungsankündigung\n\nGTS German Technology Systems GmbH\nGesellschaft mit beschränkter Haftung\nBayreuth\n\nDas Registergericht beabsichtigt, die im Handelsregister eingetragene Gesellschaft wegen Vermögenslosigkeit von Amts wegen nach § 394 FamFG zu löschen. Die Frist zur Erhebung eines Widerspruchs ist auf drei Monate festgesetzt."
    },
    {
      "date": "2024-11-20",
      "id": "94108",
      "original_text": "Registerbekanntmachung nach dem Umwandlungsgesetz\nSachsen Amtsgericht Dresden HRB 44855\nGalvanoplast Surface Technologies GmbH – Krauschwitz",
      "type": "Registerbekanntmachung nach dem Umwandlungsgesetz",
      "state": "Sachsen",
      "amtsgericht": "Amtsgericht Dresden",
      "registernummer": "HRB 44855",
      "registerart": "HRB",
      "company_name": "Galvanoplast Surface Technologies GmbH",
      "company_seat": "Krauschwitz",
      "details": "20.11.2024 (Bekanntmachungsdatum)\n\nSachsen Amtsgericht Dresden HRB 44855\nRegisterbekanntmachung nach dem Umwandlungsgesetz 20.11.2024 (Eintragungsdatum)\n\nGalvanoplast Surface Technologies GmbH\nGesellschaft mit beschränkter Haftung\nKrauschwitz\n\nDen Gläubigern der an der Verschmelzung beteiligten Rechtsträger ist, wenn sie binnen sechs Monaten nach dem Tag, an dem die Eintragung der Verschmelzung in das Register des Sitzes desjenigen Rechtsträgers, dessen Gläubiger sie sind, nach § 19 Abs. 3 UmwG als bekannt gemacht gilt, ihren Anspruch nach Grund und Höhe schriftlich anmelden, Sicherheit zu leisten, soweit sie nicht Befriedigung verlangen können. Dieses Recht steht den Gläubigern jedoch nur zu, wenn sie glaubhaft machen, dass durch die Verschmelzung die Erfüllung der Forderung gefährdet wird."
    },
    {
      "date": "2024-11-20",
      "id": "94087",
      "original_text": "Einreichung neuer Dokumente\nSachsen-Anhalt Amtsgericht Stendal HRB 13127\nGasstadtwerke Zerbst GmbH – Zerbst",
      "type": "Einreichung neuer Dokumente",
      "state": "Sachsen-Anhalt",
      "amtsgericht": "Amtsgericht Stendal",
      "registernummer": "HRB 13127",
      "registerart": "HRB",
      "company_name": "Gasstadtwerke Zerbst GmbH",
      "company_seat": "Zerbst",
      "details": "20.11.2024 (Bekanntmachungsdatum)\n\nSachsen-Anhalt Amtsgericht Stendal HRB 13127\nEinreichung neuer Dokumente\n\nGasstadtwerke Zerbst GmbH\nGesellschaft mit beschränkter Haftung\nZerbst\n\nEine Liste der Mitglieder des Aufsichtsrates wurde zum Handelsregister eingereicht."
    },
    {
      "date": "2024-11-20",
      "id": "94116",
      "original_text": "Einreichung neuer Dokumente\nRheinland-Pfalz Amtsgericht Montabaur HRB 1194\nGasversorgung Westerwald GmbH – Höhr-Grenzhausen",
      "type": "Einreichung neuer Dokumente",
      "state": "Rheinland-Pfalz",
      "amtsgericht": "Amtsgericht Montabaur",
      "registernummer": "HRB 1194",
      "registerart": "HRB",
      "company_name": "Gasversorgung Westerwald GmbH",
      "company_seat": "Höhr-Grenzhausen",
      "details": "20.11.2024 (Bekanntmachungsdatum)\n\nRheinland-Pfalz Amtsgericht Montabaur HRB 1194\nEinreichung neuer Dokumente\n\nGasversorgung Westerwald GmbH\nGesellschaft mit beschränkter Haftung\nHöhr-Grenzhausen\n\nDem Registergericht ist eine neue Liste der Mitglieder des Aufsichtsrates eingereicht worden."
    },
    {
      "date": "2024-11-20",
      "id": "94115",
      "original_text": "Registerbekanntmachung nach dem Umwandlungsgesetz\nRheinland-Pfalz Amtsgericht Ludwigshafen a.Rhein (Ludwigshafen) HRA 2606\nGebr. Stephan GmbH & Co KG – Ludwigshafen a.Rh.-Oppau",
      "type": "Registerbekanntmachung nach dem Umwandlungsgesetz",
      "state": "Rheinland-Pfalz",
      "amtsgericht": "Amtsgericht Ludwigshafen a.Rhein (Ludwigshafen)",
      "registernummer": "HRA 2606",
      "registerart": "HRA",
      "company_name": "Gebr. Stephan GmbH & Co KG",
      "company_seat": "Ludwigshafen a.Rh.-Oppau",
      "details": "20.11.2024 (Bekanntmachungsdatum)\n\nRheinland-Pfalz Amtsgericht Ludwigshafen a.Rhein (Ludwigshafen) HRA 2606\nRegisterbekanntmachung nach dem Umwandlungsgesetz 20.11.2024 (Eintragungsdatum)\n\nGebr. Stephan GmbH & Co KG\nKommanditgesellschaft\nLudwigshafen a.Rh.-Oppau\n\nAls nicht eingetragen wird veröffentlicht: Den Gläubigern der an der Verschmelzung beteiligten Rechtsträger ist, wenn sie binnen sechs Monaten nach dem Tag, an dem die Eintragung der Verschmelzung in das Register des Sitzes desjenigen Rechtsträgers, dessen Gläubiger sie sind, nach § 19 Abs. 3 UmwG als bekannt gemacht gilt, ihren Anspruch nach Grund und Höhe schriftlich anmelden, Sicherheit zu leisten, soweit sie nicht Befriedigung verlangen können. Dieses Recht steht den Gläubigern jedoch nur zu, wenn sie glaubhaft machen, dass durch die Verschmelzung die Erfüllung der Forderung gefährdet wird."
    },
    {
      "date": "2024-11-20",
      "id": "94113",
      "original_text": "Einreichung neuer Dokumente\nRheinland-Pfalz Amtsgericht Landau HRB 1089\nGemeinnützige Wohnungsbaugesellschaft mit beschränkter Haftung Annweiler am Trifels – Annweiler am Trifels",
      "type": "Einreichung neuer Dokumente",
      "state": "Rheinland-Pfalz",
      "amtsgericht": "Amtsgericht Landau",
      "registernummer": "HRB 1089",
      "registerart": "HRB",
      "company_name": "Gemeinnützige Wohnungsbaugesellschaft mit beschränkter Haftung Annweiler am Trifels",
      "company_seat": "Annweiler am Trifels",
      "details": "20.11.2024 (Bekanntmachungsdatum)\n\nRheinland-Pfalz Amtsgericht Landau HRB 1089\nEinreichung neuer Dokumente 20.11.2024 (Eintragungsdatum)\n\nGemeinnützige Wohnungsbaugesellschaft mit beschränkter Haftung Annweiler am Trifels\nGesellschaft mit beschränkter Haftung\nAnnweiler am Trifels\n\nDem Registergericht ist eine neue Liste der Mitglieder des Aufsichtsrates eingereicht worden."
    },
    {
      "date": "2024-11-20",
      "id": "94073",
      "original_text": "Registerbekanntmachung nach dem Umwandlungsgesetz\nHamburg Amtsgericht Hamburg HRB 107797\nGlobal Assekuranz Nord GmbH Versicherungsmakler – Hamburg",
      "type": "Registerbekanntmachung nach dem Umwandlungsgesetz",
      "state": "Hamburg",
      "amtsgericht": "Amtsgericht Hamburg",
      "registernummer": "HRB 107797",
      "registerart": "HRB",
      "company_name": "Global Assekuranz Nord GmbH Versicherungsmakler",
      "company_seat": "Hamburg",
      "details": "20.11.2024 (Bekanntmachungsdatum)\n\nHamburg Amtsgericht Hamburg HRB 107797\nRegisterbekanntmachung nach dem Umwandlungsgesetz 20.11.2024 (Eintragungsdatum)\n\nGlobal Assekuranz Nord GmbH Versicherungsmakler\nGesellschaft mit beschränkter Haftung\nHamburg\n\nAls nicht eingetragen wird bekannt gemacht:\nDen Gläubigern der an der Verschmelzung beteiligten Gesellschaften ist, wenn sie binnen sechs Monaten nach dem Tag, an dem die Eintragung der Verschmelzung in das Register des Sitzes desjenigen Rechtsträgers, dessen Gläubiger sie sind, nach § 19 Absatz 3 UmwG als bekannt gemacht gilt, ihren Anspruch nach Grund und Höhe schriftlich anmelden, Sicherheit zu leisten, soweit sie nicht Befriedigung verlangen können. Dieses Recht steht den Gläubigern jedoch nur zu, wenn sie glaubhaft machen, dass durch die Verschmelzung die Erfüllung ihrer Forderung gefährdet wird."
    },
    {
      "date": "2024-11-20",
      "id": "94065",
      "original_text": "Registerbekanntmachung nach dem Umwandlungsgesetz\nSchleswig-Holstein Amtsgericht Pinneberg HRA 7972\nGrundstücksverwaltung Peter Matzen e.K. – Marne",
      "type": "Registerbekanntmachung nach dem Umwandlungsgesetz",
      "state": "Schleswig-Holstein",
      "amtsgericht": "Amtsgericht Pinneberg",
      "registernummer": "HRA 7972",
      "registerart": "HRA",
      "company_name": "Grundstücksverwaltung Peter Matzen e.K.",
      "company_seat": "Marne",
      "details": "20.11.2024 (Bekanntmachungsdatum)\n\nSchleswig-Holstein Amtsgericht Pinneberg HRA 7972\nRegisterbekanntmachung nach dem Umwandlungsgesetz 18.11.2024 (Eintragungsdatum)\n\nGrundstücksverwaltung Peter Matzen e.K.\nEinzelkaufmann / Einzelkauffrau\nMarne\n\nZu Eintragungsnummer 2 vom 18.11.2024 wird als nicht eingetragen veröffentlicht: Als nicht eingetragen wird veröffentlicht: Den Gläubigern der an der Spaltung beteiligten Rechtsträger ist, wenn sie binnen sechs Monaten nach dem Tag, an dem die Eintragung der Spaltung in das Register des Sitzes desjenigen Rechtsträgers, dessen Gläubiger sie sind, als bekannt gemacht gilt, ihren Anspruch nach Grund und Höhe schriftlich anmelden, Sicherheit zu leisten, soweit sie nicht Befriedigung verlangen können. Dieses Recht steht den Gläubigern jedoch nur zu, wenn sie glaubhaft machen, dass durch die Spaltung die Erfüllung ihrer Forderung gefährdet wird. Das Recht, Sicherheitsleistung zu verlangen, steht Gläubigern nicht zu, die im Falle der Insolvenz ein Recht auf vorzugsweise Befriedigung aus einer Deckungsmasse haben, die nach gesetzlicher Vorschrift zu ihrem Schutz errichtet und staatlich überwacht ist."
    },
    {
      "date": "2024-11-20",
      "id": "94090",
      "original_text": "Registerbekanntmachung nach dem Umwandlungsgesetz\nThüringen Amtsgericht Jena HRB 304504\nGrünland Frauensee GmbH – Bad Salzungen",
      "type": "Registerbekanntmachung nach dem Umwandlungsgesetz",
      "state": "Thüringen",
      "amtsgericht": "Amtsgericht Jena",
      "registernummer": "HRB 304504",
      "registerart": "HRB",
      "company_name": "Grünland Frauensee GmbH",
      "company_seat": "Bad Salzungen",
      "details": "20.11.2024 (Bekanntmachungsdatum)\n\nThüringen Amtsgericht Jena HRB 304504\nRegisterbekanntmachung nach dem Umwandlungsgesetz 20.11.2024 (Eintragungsdatum)\n\nGrünland Frauensee GmbH\nGesellschaft mit beschränkter Haftung\nBad Salzungen\n\nNicht eingetragen: Den Gläubigern der an der Verschmelzung beteiligten Rechtsträger, ist wenn sie binnen sechs Monaten nach dem Tag, an dem die Eintragung der Verschmelzung in das Register des Sitzes desjenigen Rechtsträgers, dessen Gläubiger sie sind,  nach § 19 Abs. 3 UmwG als bekanntgemacht gilt, ihren Anspruch nach Grund und Höhe schriftlich anmelden, Sicherheit zu leisten, soweit sie nicht Befriedigung verlangen können. Dieses Recht steht ihnen jedoch nur zu, wenn sie glaubhaft machen, daß durch die Verschmelzung die Erfüllung ihrer Forderung gefährdet wird."
    },
    {
      "date": "2024-11-20",
      "id": "94120",
      "original_text": "Löschungsankündigung\nNordrhein-Westfalen Amtsgericht Düsseldorf HRB 35224\nHYDROMENT CONTROLS GmbH – Düsseldorf",
      "type": "Löschungsankündigung",
      "state": "Nordrhein-Westfalen",
      "amtsgericht": "Amtsgericht Düsseldorf",
      "registernummer": "HRB 35224",
      "registerart": "HRB",
      "company_name": "HYDROMENT CONTROLS GmbH",
      "company_seat": "Düsseldorf",
      "details": "20.11.2024 (Bekanntmachungsdatum)\n\nNordrhein-Westfalen Amtsgericht Düsseldorf HRB 35224\nLöschungsankündigung\n\nHYDROMENT CONTROLS GmbH\nGesellschaft mit beschränkter Haftung\nDüsseldorf\n\nDas Registergericht beabsichtigt die Gesellschaft von Amts wegen nach § 394 FamFG zu löschen. Die Frist zur Erhebung eines Widerspruchs ist auf 3 Wochen festgesetzt.\n\nRechtsbehelfsbelehrung:\nDas Widerspruchsrecht steht jedem zu, der an der Unterlassung der Löschung ein berechtigtes Interesse hat. Der Widerspruch ist bei dem Amtsgericht Düsseldorf -Registergericht-, Werdener Straße 1, 40227 Düsseldorf schriftlich in deutscher Sprache oder zur Niederschrift der Geschäftsstelle einzulegen. Der Widerspruch kann auch zur Niederschrift der Geschäftsstelle eines jeden Amtsgerichtes abgegeben werden. Die Einlegung ist auch durch Übertragung eines elektronischen Dokuments an die elektronische Poststelle des Gerichts möglich. Das elektronische Dokument muss für die Bearbeitung durch das Gericht geeignet und mit einer qualifizierten elektronischen Signatur der verantwortenden Person versehen sein oder von der verantwortenden Person signiert und auf einem sicheren Übermittlungsweg gemäß § 130a ZPO nach näherer Maßgabe der Verordnung über die technischen Rahmenbedingungen des elektronischen Rechtsverkehrs und über das besondere elektronische Behördenpostfach (BGBl. I, S.3803) eingereicht werden. Weitere Informationen erhalten Sie auf der Internetseite www.justiz.de.\nDer Widerspruch muss spätestens innerhalb der gesetzten Frist nach dem Datum der Bekanntmachung der Löschungsankündigung bei dem Amtsgericht - Registergericht - Düsseldorf eingegangen sein.  Dies gilt auch dann, wenn der Widerspruch zur Niederschrift der Geschäftsstelle eines anderen Amtsgerichtes abgegeben wurde. Die Frist beginnt mit dem Tage der Bekanntmachung der Löschungsankündigung in dem für die Bekanntmachung der Eintragungen in das Handelsregister bestimmten elektronischen Informations- und Kommunikationssystem nach § 10 des Handelsgesetzbuches. Fällt das Ende der Frist auf einen Sonntag, einen allgemeinen Feiertag oder Sonnabend, so endet die Frist mit Ablauf des nächsten Werktages.\nDer Widerspruch muss die Bezeichnung der angefochtenen Löschungsankündigung sowie die Erklärung enthalten, dass Widerspruch gegen diese Löschungsankündigung eingelegt wird. Er ist zu unterzeichnen und soll begründet werden."
    },
    {
      "date": "2024-11-20",
      "id": "94125",
      "original_text": "Registerbekanntmachung nach dem Umwandlungsgesetz\nNordrhein-Westfalen Amtsgericht Bad Oeynhausen HRB 7818\nHellmeier Tief- und Rohrbau GmbH – Rödinghausen",
      "type": "Registerbekanntmachung nach dem Umwandlungsgesetz",
      "state": "Nordrhein-Westfalen",
      "amtsgericht": "Amtsgericht Bad Oeynhausen",
      "registernummer": "HRB 7818",
      "registerart": "HRB",
      "company_name": "Hellmeier Tief- und Rohrbau GmbH",
      "company_seat": "Rödinghausen",
      "details": "20.11.2024 (Bekanntmachungsdatum)\n\nNordrhein-Westfalen Amtsgericht Bad Oeynhausen HRB 7818\nRegisterbekanntmachung nach dem Umwandlungsgesetz 20.11.2024 (Eintragungsdatum)\n\nHellmeier Tief- und Rohrbau GmbH\nGesellschaft mit beschränkter Haftung\nRödinghausen\n\nDen Gläubigern der an der Verschmelzung beteiligten Rechtsträger ist, wenn sie binnen sechs Monaten nach dem Tag, an dem die Eintragung der Verschmelzung in das Register des Sitzes desjenigen Rechtsträgers, dessen Gläubiger sie sind, nach § 19 Absatz 3 UmwG als bekanntgemacht gilt, ihren Anspruch nach Grund und Höhe schriftlich anmelden, Sicherheit zu leisten, soweit sie nicht Befriedigung verlangen können. Dieses Recht steht den Gläubigern jedoch nur zu, wenn sie glaubhaft machen, dass durch die Verschmelzung die Erfüllung ihrer Forderung gefährdet wird."
    },
    {
      "date": "2024-11-20",
      "id": "94121",
      "original_text": "Registerbekanntmachung nach dem Umwandlungsgesetz\nNordrhein-Westfalen Amtsgericht Siegen HRA 8143\nHenrich GmbH & Co. KG – Burbach",
      "type": "Registerbekanntmachung nach dem Umwandlungsgesetz",
      "state": "Nordrhein-Westfalen",
      "amtsgericht": "Amtsgericht Siegen",
      "registernummer": "HRA 8143",
      "registerart": "HRA",
      "company_name": "Henrich GmbH & Co. KG",
      "company_seat": "Burbach",
      "details": "20.11.2024 (Bekanntmachungsdatum)\n\nNordrhein-Westfalen Amtsgericht Siegen HRA 8143\nRegisterbekanntmachung nach dem Umwandlungsgesetz 20.11.2024 (Eintragungsdatum)\n\nHenrich GmbH & Co. KG\nKommanditgesellschaft\nBurbach\n\nDen Gläubigern der an der formwechselnden Umwandlung beteiligten Rechtsträger ist, wenn sie binnen sechs Monaten nach dem Tag, an dem die Eintragung der formwechselnden Umwandlung in das Register des Sitzes desjenigen Rechtsträgers, dessen Gläubiger sie sind, nach § 19 Absatz 3 UmwG als bekanntgemacht gilt, ihren Anspruch nach Grund und Höhe schriftlich anmelden, Sicherheit zu leisten, soweit sie nicht Befriedigung verlangen können. Dieses Recht steht den Gläubigern jedoch nur zu, wenn sie glaubhaft machen, dass durch die formwechselnden Umwandlung die Erfüllung ihrer Forderung gefährdet wird."
    },
    {
      "date": "2024-11-20",
      "id": "94037",
      "original_text": "Registerbekanntmachung nach dem Umwandlungsgesetz\nBayern Amtsgericht München HRB 214205\nHutchinson Holding GmbH – München",
      "type": "Registerbekanntmachung nach dem Umwandlungsgesetz",
      "state": "Bayern",
      "amtsgericht": "Amtsgericht München",
      "registernummer": "HRB 214205",
      "registerart": "HRB",
      "company_name": "Hutchinson Holding GmbH",
      "company_seat": "München",
      "details": "20.11.2024 (Bekanntmachungsdatum)\n\nBayern Amtsgericht München HRB 214205\nRegisterbekanntmachung nach dem Umwandlungsgesetz 19.11.2024 (Eintragungsdatum)\n\nHutchinson Holding GmbH\nGesellschaft mit beschränkter Haftung\nMünchen\n\nDen Gläubigern der an der Verschmelzung beteiligten Rechtsträger ist, wenn sie binnen sechs Monaten nach dem Tag, an dem die Eintragung der Verschmelzung in das Register des Sitzes desjenigen Rechtsträgers, dessen Gläubiger sie sind, nach § 19 Abs. 3 UmwG als bekannt gemacht gilt, ihren Anspruch nach Grund und Höhe schriftlich anmelden, Sicherheit zu leisten, soweit sie nicht Befriedigung verlangen können. Dieses Recht steht den Gläubigern jedoch nur zu, wenn sie glaubhaft machen, dass durch die Verschmelzung die Erfüllung ihrer Forderung gefährdet wird."
    },
    {
      "date": "2024-11-20",
      "id": "94143",
      "original_text": "Löschungsankündigung\nNordrhein-Westfalen Amtsgericht Dortmund HRB 31528\nI.S.T. GmbH – Dortmund",
      "type": "Löschungsankündigung",
      "state": "Nordrhein-Westfalen",
      "amtsgericht": "Amtsgericht Dortmund",
      "registernummer": "HRB 31528",
      "registerart": "HRB",
      "company_name": "I.S.T. GmbH",
      "company_seat": "Dortmund",
      "details": "20.11.2024 (Bekanntmachungsdatum)\n\nNordrhein-Westfalen Amtsgericht Dortmund HRB 31528\nLöschungsankündigung 19.11.2024 (Eintragungsdatum)\n\nI.S.T. GmbH\nGesellschaft mit beschränkter Haftung\nDortmund\n\nDas Registergericht beabsichtigt die Gesellschaft von Amts wegen nach § 394 FamFG zu löschen. Die Frist zur Erhebung eines Widerspruchs ist auf zwei Monate festgesetzt."
    },
    {
      "date": "2024-11-20",
      "id": "94091",
      "original_text": "Sonstige Registerbekanntmachung\nThüringen Amtsgericht Jena HRB 516855\nIBYKUS Aktiengesellschaft für Informationstechnologie – Erfurt",
      "type": "Sonstige Registerbekanntmachung",
      "state": "Thüringen",
      "amtsgericht": "Amtsgericht Jena",
      "registernummer": "HRB 516855",
      "registerart": "HRB",
      "company_name": "IBYKUS Aktiengesellschaft für Informationstechnologie",
      "company_seat": "Erfurt",
      "details": "20.11.2024 (Bekanntmachungsdatum)\n\nThüringen Amtsgericht Jena HRB 516855\nSonstige Registerbekanntmachung 20.11.2024 (Eintragungsdatum)\n\nIBYKUS Aktiengesellschaft für Informationstechnologie\nAktiengesellschaft\nErfurt\n\nNicht eingetragen: Den Gläubigern der Gesellschaft ist, wenn sie binnen sechs Monaten nach dieser Bekanntmachung ihren Anspruch nach Grund und Höhe schriftlich anmelden, Sicherheit zu leisten, soweit sie nicht Befriedigung verlangen können. Dieses Recht steht ihnen jedoch nicht zu, wenn sie im Falle des Insolvenzverfahrens ein Recht auf vorzugsweise Befriedigung aus einer Deckungsmasse haben, die nach gesetzlicher Vorschrift zu ihrem Schutz errichtet und staatlich überwacht ist."
    },
    {
      "date": "2024-11-20",
      "id": "94086",
      "original_text": "Löschungsankündigung\nBaden-Württemberg Amtsgericht Stuttgart HRB 782468\nIntervit GmbH – Sindelfingen",
      "type": "Löschungsankündigung",
      "state": "Baden-Württemberg",
      "amtsgericht": "Amtsgericht Stuttgart",
      "registernummer": "HRB 782468",
      "registerart": "HRB",
      "company_name": "Intervit GmbH",
      "company_seat": "Sindelfingen",
      "details": "20.11.2024 (Bekanntmachungsdatum)\n\nBaden-Württemberg Amtsgericht Stuttgart HRB 782468\nLöschungsankündigung\n\nIntervit GmbH\nGesellschaft mit beschränkter Haftung\nSindelfingen\n\nDas Gericht beabsichtigt, die Gesellschaft wegen Vermögenslosigkeit im Handelsregister von Amts wegen nach § 394 FamFG zu löschen. Die Frist zur Geltendmachung eines Widerspruchs gegen die beabsichtigte Löschung ist auf einen Monat ab Veröffentlichung bestimmt."
    },
    {
      "date": "2024-11-20",
      "id": "94041",
      "original_text": "Löschungsankündigung\nBayern Amtsgericht München HRA 115641\nKEA319 LLC & Co. KG – München",
      "type": "Löschungsankündigung",
      "state": "Bayern",
      "amtsgericht": "Amtsgericht München",
      "registernummer": "HRA 115641",
      "registerart": "HRA",
      "company_name": "KEA319 LLC & Co. KG",
      "company_seat": "München",
      "details": "20.11.2024 (Bekanntmachungsdatum)\n\nBayern Amtsgericht München HRA 115641\nLöschungsankündigung 19.11.2024 (Eintragungsdatum)\n\nKEA319 LLC & Co. KG\nKommanditgesellschaft\nMünchen\n\nDas Registergericht beabsichtigt, die im Handelsregister eingetragene Firma von Amts wegen nach § 31 Abs. 2 HGB zu löschen. Die Frist zur Erhebung eines Widerspruchs ist auf drei Monate festgesetzt."
    },
    {
      "date": "2024-11-20",
      "id": "94060",
      "original_text": "Löschungsankündigung\nBaden-Württemberg Amtsgericht Stuttgart HRB 792448\nKFZ-Schadensregulierung24 Verwaltungs GmbH – Tübingen",
      "type": "Löschungsankündigung",
      "state": "Baden-Württemberg",
      "amtsgericht": "Amtsgericht Stuttgart",
      "registernummer": "HRB 792448",
      "registerart": "HRB",
      "company_name": "KFZ-Schadensregulierung24 Verwaltungs GmbH",
      "company_seat": "Tübingen",
      "details": "20.11.2024 (Bekanntmachungsdatum)\n\nBaden-Württemberg Amtsgericht Stuttgart HRB 792448\nLöschungsankündigung\n\nKFZ-Schadensregulierung24 Verwaltungs GmbH\nGesellschaft mit beschränkter Haftung\nTübingen\n\nDas Gericht beabsichtigt, die Gesellschaft wegen Vermögenslosigkeit im Handelsregister von Amts wegen nach § 394 FamFG zu löschen. Die Frist zur Geltendmachung eines Widerspruchs gegen die beabsichtigte Löschung ist auf zwei Monate ab Veröffentlichung bestimmt."
    },
    {
      "date": "2024-11-20",
      "id": "94127",
      "original_text": "Registerbekanntmachung nach dem Umwandlungsgesetz\nNordrhein-Westfalen Amtsgericht Iserlohn HRB 10796\nKIRCHHOFF Automotive Holding Verwaltungs AG – Iserlohn",
      "type": "Registerbekanntmachung nach dem Umwandlungsgesetz",
      "state": "Nordrhein-Westfalen",
      "amtsgericht": "Amtsgericht Iserlohn",
      "registernummer": "HRB 10796",
      "registerart": "HRB",
      "company_name": "KIRCHHOFF Automotive Holding Verwaltungs AG",
      "company_seat": "Iserlohn",
      "details": "20.11.2024 (Bekanntmachungsdatum)\n\nNordrhein-Westfalen Amtsgericht Iserlohn HRB 10796\nRegisterbekanntmachung nach dem Umwandlungsgesetz 13.11.2024 (Eintragungsdatum)\n\nKIRCHHOFF Automotive Holding Verwaltungs AG\nAktiengesellschaft\nIserlohn\n\nDen Gläubigern der an der Verschmelzung beteiligten Rechtsträger ist, wenn sie binnen sechs Monaten nach dem Tag, an dem die Eintragung der Verschmelzung in das Register des Sitzes desjenigen Rechtsträgers, dessen Gläubiger sie sind, nach § 19 Absatz 3 UmwG als bekanntgemacht gilt, ihren Anspruch nach Grund und Höhe schriftlich anmelden, Sicherheit zu leisten, soweit sie nicht Befriedigung verlangen können. Dieses Recht steht den Gläubigern jedoch nur zu, wenn sie glaubhaft machen, dass durch die Verschmelzung die Erfüllung ihrer Forderung gefährdet wird."
    },
    {
      "date": "2024-11-20",
      "id": "94144",
      "original_text": "Registerbekanntmachung nach dem Umwandlungsgesetz\nNordrhein-Westfalen Amtsgericht Iserlohn HRB 10797\nKIRCHHOFF Ecotec Holding Verwaltungs AG – Iserlohn",
      "type": "Registerbekanntmachung nach dem Umwandlungsgesetz",
      "state": "Nordrhein-Westfalen",
      "amtsgericht": "Amtsgericht Iserlohn",
      "registernummer": "HRB 10797",
      "registerart": "HRB",
      "company_name": "KIRCHHOFF Ecotec Holding Verwaltungs AG",
      "company_seat": "Iserlohn",
      "details": "20.11.2024 (Bekanntmachungsdatum)\n\nNordrhein-Westfalen Amtsgericht Iserlohn HRB 10797\nRegisterbekanntmachung nach dem Umwandlungsgesetz 13.11.2024 (Eintragungsdatum)\n\nKIRCHHOFF Ecotec Holding Verwaltungs AG\nAktiengesellschaft\nIserlohn\n\nDen Gläubigern der an der Verschmelzung beteiligten Rechtsträger ist, wenn sie binnen sechs Monaten nach dem Tag, an dem die Eintragung der Verschmelzung in das Register des Sitzes desjenigen Rechtsträgers, dessen Gläubiger sie sind, nach § 19 Absatz 3 UmwG als bekanntgemacht gilt, ihren Anspruch nach Grund und Höhe schriftlich anmelden, Sicherheit zu leisten, soweit sie nicht Befriedigung verlangen können. Dieses Recht steht den Gläubigern jedoch nur zu, wenn sie glaubhaft machen, dass durch die Verschmelzung die Erfüllung ihrer Forderung gefährdet wird."
    },
    {
      "date": "2024-11-20",
      "id": "94132",
      "original_text": "Sonstige Registerbekanntmachung\nNordrhein-Westfalen Amtsgericht Kleve HRB 1414\nKKA Kreis-Kleve-Abfallwirtschaftsgesellschaft mbH – Uedem",
      "type": "Sonstige Registerbekanntmachung",
      "state": "Nordrhein-Westfalen",
      "amtsgericht": "Amtsgericht Kleve",
      "registernummer": "HRB 1414",
      "registerart": "HRB",
      "company_name": "KKA Kreis-Kleve-Abfallwirtschaftsgesellschaft mbH",
      "company_seat": "Uedem",
      "details": "20.11.2024 (Bekanntmachungsdatum)\n\nNordrhein-Westfalen Amtsgericht Kleve HRB 1414\nSonstige Registerbekanntmachung\n\nKKA Kreis-Kleve-Abfallwirtschaftsgesellschaft mbH\nGesellschaft mit beschränkter Haftung\nUedem\n\nDem Registergericht ist eine Liste der Mitglieder des Aufsichtsrates eingereicht worden."
    },
    {
      "date": "2024-11-20",
      "id": "94161",
      "original_text": "Löschungsankündigung\nHessen Amtsgericht Darmstadt HRA 31243\nKarl Meisenbach Abwicklungsgesellschaft mbH & Co. KG i.L. – Fischbachtal",
      "type": "Löschungsankündigung",
      "state": "Hessen",
      "amtsgericht": "Amtsgericht Darmstadt",
      "registernummer": "HRA 31243",
      "registerart": "HRA",
      "company_name": "Karl Meisenbach Abwicklungsgesellschaft mbH & Co. KG i.L.",
      "company_seat": "Fischbachtal",
      "details": "20.11.2024 (Bekanntmachungsdatum)\n\nHessen Amtsgericht Darmstadt HRA 31243\nLöschungsankündigung 20.11.2024 (Eintragungsdatum)\n\nKarl Meisenbach Abwicklungsgesellschaft mbH & Co. KG i.L.\nKommanditgesellschaft\nFischbachtal\n\nDas Registergericht beabsichtigt die im Handelsregister eingetragene Firma von Amts wegen nach § 394 FamFG zu löschen. Die Frist zur Erhebung eines Widerspruchs gegen die beabsichtigte Löschung wird auf 3 Monate festgesetzt."
    },
    {
      "date": "2024-11-20",
      "id": "94124",
      "original_text": "Sonstige Registerbekanntmachung\nNordrhein-Westfalen Amtsgericht Düsseldorf HRA 23811\nKita 3 GmbH & Co. KG – Düsseldorf",
      "type": "Sonstige Registerbekanntmachung",
      "state": "Nordrhein-Westfalen",
      "amtsgericht": "Amtsgericht Düsseldorf",
      "registernummer": "HRA 23811",
      "registerart": "HRA",
      "company_name": "Kita 3 GmbH & Co. KG",
      "company_seat": "Düsseldorf",
      "details": "20.11.2024 (Bekanntmachungsdatum)\n\nNordrhein-Westfalen Amtsgericht Düsseldorf HRA 23811\nSonstige Registerbekanntmachung 20.11.2024 (Eintragungsdatum)\n\nKita 3 GmbH & Co. KG\nKommanditgesellschaft\nDüsseldorf\n\nDie Gesellschaft ist aufgelöst. Von Amts wegen eingetragen."
    },
    {
      "date": "2024-11-20",
      "id": "94047",
      "original_text": "Löschungsankündigung\nBayern Amtsgericht München HRA 96875\nKovacs Fassadenbau und Raumausstattung GmbH & Co. KG – München",
      "type": "Löschungsankündigung",
      "state": "Bayern",
      "amtsgericht": "Amtsgericht München",
      "registernummer": "HRA 96875",
      "registerart": "HRA",
      "company_name": "Kovacs Fassadenbau und Raumausstattung GmbH & Co. KG",
      "company_seat": "München",
      "details": "20.11.2024 (Bekanntmachungsdatum)\n\nBayern Amtsgericht München HRA 96875\nLöschungsankündigung\n\nKovacs Fassadenbau und Raumausstattung GmbH & Co. KG\nKommanditgesellschaft\nMünchen\n\nDas Registergericht beabsichtigt, die im Handelsregister eingetragene Firma von Amts wegen nach § 31 Abs. 2 HGB zu löschen. Die Frist zur Erhebung eines Widerspruchs ist auf drei Monate festgesetzt."
    },
    {
      "date": "2024-11-20",
      "id": "94070",
      "original_text": "Registerbekanntmachung nach dem Umwandlungsgesetz\nMecklenburg-Vorpommern Amtsgericht Neubrandenburg HRB 21811\nKranich Vital-Balance GmbH – Waren (Müritz)",
      "type": "Registerbekanntmachung nach dem Umwandlungsgesetz",
      "state": "Mecklenburg-Vorpommern",
      "amtsgericht": "Amtsgericht Neubrandenburg",
      "registernummer": "HRB 21811",
      "registerart": "HRB",
      "company_name": "Kranich Vital-Balance GmbH",
      "company_seat": "Waren (Müritz)",
      "details": "20.11.2024 (Bekanntmachungsdatum)\n\nMecklenburg-Vorpommern Amtsgericht Neubrandenburg HRB 21811\nRegisterbekanntmachung nach dem Umwandlungsgesetz 20.11.2024 (Eintragungsdatum)\n\nKranich Vital-Balance GmbH\nGesellschaft mit beschränkter Haftung\nWaren (Müritz)\n\nAls nicht eingetragen wird veröffentlicht: Den Gläubigern der an der Verschmelzung beteiligten Rechtsträger ist, wenn sie binnen sechs Monaten nach dem Tag, an dem die Eintragung der Verschmelzung in das Register des Sitzes desjenigen Rechtsträgers, dessen Gläubiger sie sind, nach § 19 Abs. 3 UmwG als bekannt gemacht gilt,\nihren Anspruch nach Grund und Höhe schriftlich anmelden, Sicherheit zu leisten, soweit sie nicht Befriedigung verlangen können. Dieses Recht steht den Gläubigern jedoch nur zu, wenn sie glaubhaft machen, dass durch die Verschmelzung die Erfüllung der Forderung gefährdet wird."
    },
    {
      "date": "2024-11-20",
      "id": "94092",
      "original_text": "Sonstige Registerbekanntmachung\nSchleswig-Holstein Amtsgericht Lübeck HRB 12345\nKurbau UG (haftungsbeschränkt) – Malente",
      "type": "Sonstige Registerbekanntmachung",
      "state": "Schleswig-Holstein",
      "amtsgericht": "Amtsgericht Lübeck",
      "registernummer": "HRB 12345",
      "registerart": "HRB",
      "company_name": "Kurbau UG (haftungsbeschränkt)",
      "company_seat": "Malente",
      "details": "20.11.2024 (Bekanntmachungsdatum)\n\nSchleswig-Holstein Amtsgericht Lübeck HRB 12345\nSonstige Registerbekanntmachung\n\nKurbau UG (haftungsbeschränkt)\nGesellschaft mit beschränkter Haftung\nMalente\n\nAls nicht eingetragen wird veröffentlicht:\n\nAmtsgericht Lübeck, Am Burgfeld 7, 23568 Lübeck\n\nKurbau UG (haftungsbeschränkt)\nHarringsredder 4\n23714 Malente\n\nUnser Zeichen: HRB 12345 HL\n\nDatum: 14.11.2024\n\nSehr geehrte Damen und Herren,\n\nin der Handelsregistersache der\n\nKurbau UG (haftungsbeschränkt)\n\nergeben sich aus den mir vorliegenden Unterlagen Anhaltspunkte dafür, dass die Gesellschaft, als deren Geschäftsführer Sie noch eingetragen sind, vermögenslos ist:\n\nAufhebungsbeschluss des Amtsgerichts Eutin vom 17.05.2024 (51 IN 57/22).\n\nIch beabsichtige daher, die Gesellschaft wegen Vermögenslosigkeit gemäß § 394 FamFG zu löschen.\n\nIch bestimme eine Frist von einem Monat zur Geltendmachung eines Widerspruchs gegen die Löschung, § 394 Abs. 2 S. 1 FamFG.\n\nWeiter bitte ich, mir binnen derselben Frist mitzuteilen, ob die genannte Gesellschaft noch Vermögen hat, ggf. welche Vermögensgegenstände sie besitzt, ob die Gesellschaft noch Partei eines noch nicht rechtskräftig abgeschlossenen Rechtsstreits ist oder ob sonst noch eine Abwicklung stattfindet.\n\nNach Fristablauf ohne Widerspruch wird die Gesellschaft gelöscht.\n\nMit freundlichen Grüßen\n\nWolski,\nDipl.-Rechtspflegerin (FH)"
    },
    {
      "date": "2024-11-20",
      "id": "94093",
      "original_text": "Löschungsankündigung\nSchleswig-Holstein Amtsgericht Lübeck HRB 12345\nKurbau UG (haftungsbeschränkt) – Malente",
      "type": "Löschungsankündigung",
      "state": "Schleswig-Holstein",
      "amtsgericht": "Amtsgericht Lübeck",
      "registernummer": "HRB 12345",
      "registerart": "HRB",
      "company_name": "Kurbau UG (haftungsbeschränkt)",
      "company_seat": "Malente",
      "details": "20.11.2024 (Bekanntmachungsdatum)\n\nSchleswig-Holstein Amtsgericht Lübeck HRB 12345\nLöschungsankündigung\n\nKurbau UG (haftungsbeschränkt)\nGesellschaft mit beschränkter Haftung\nMalente\n\nEs ist die Löschung der nachstehenden Gesellschaft wegen Vermögenslosigkeit gemäß § 394 FamFG beabsichtigt. Widerspruchfrist: 1 Monat."
    },
    {
      "date": "2024-11-20",
      "id": "94102",
      "original_text": "Einreichung neuer Dokumente\nHamburg Amtsgericht Hamburg HRB 185204\nLBS Landesbausparkasse NordOst AG – Potsdam und Hamburg",
      "type": "Einreichung neuer Dokumente",
      "state": "Hamburg",
      "amtsgericht": "Amtsgericht Hamburg",
      "registernummer": "HRB 185204",
      "registerart": "HRB",
      "company_name": "LBS Landesbausparkasse NordOst AG",
      "company_seat": "Potsdam und Hamburg",
      "details": "20.11.2024 (Bekanntmachungsdatum)\n\nHamburg Amtsgericht Hamburg HRB 185204\nEinreichung neuer Dokumente\n\nLBS Landesbausparkasse NordOst AG\nAktiengesellschaft\nPotsdam und Hamburg\n\nAls nicht eingetragen wird bekannt gemacht: Liste des Aufsichtsrats wurde eingereicht."
    },
    {
      "date": "2024-11-20",
      "id": "94077",
      "original_text": "Löschungsankündigung\nBerlin Amtsgericht Berlin (Charlottenburg) HRB 216186\nLINGNAU Thermoform UG (haftungsbeschränkt) – Berlin",
      "type": "Löschungsankündigung",
      "state": "Berlin",
      "amtsgericht": "Amtsgericht Berlin (Charlottenburg)",
      "registernummer": "HRB 216186",
      "registerart": "HRB",
      "company_name": "LINGNAU Thermoform UG (haftungsbeschränkt)",
      "company_seat": "Berlin",
      "details": "20.11.2024 (Bekanntmachungsdatum)\n\nBerlin Amtsgericht Berlin (Charlottenburg) HRB 216186\nLöschungsankündigung\n\nLINGNAU Thermoform UG (haftungsbeschränkt)\nGesellschaft mit beschränkter Haftung\nBerlin\n\nBei der nachstehenden Gesellschaft wird das Amtslöschungsverfahren gemäß § 394 FamFG eingeleitet. Widerspruchsfrist 6 Wochen"
    },
    {
      "date": "2024-11-20",
      "id": "94083",
      "original_text": "Registerbekanntmachung nach dem Umwandlungsgesetz\nMecklenburg-Vorpommern Amtsgericht Rostock GnR 158\nLandwirtschaftliches Unternehmen Sarmstorf eG – Sarmstorf",
      "type": "Registerbekanntmachung nach dem Umwandlungsgesetz",
      "state": "Mecklenburg-Vorpommern",
      "amtsgericht": "Amtsgericht Rostock",
      "registernummer": "GnR 158",
      "registerart": "GnR",
      "company_name": "Landwirtschaftliches Unternehmen Sarmstorf eG",
      "company_seat": "Sarmstorf",
      "details": "20.11.2024 (Bekanntmachungsdatum)\n\nMecklenburg-Vorpommern Amtsgericht Rostock GnR 158\nRegisterbekanntmachung nach dem Umwandlungsgesetz 20.11.2024 (Eintragungsdatum)\n\nLandwirtschaftliches Unternehmen Sarmstorf  eG\neingetragene Genossenschaft\nSarmstorf\n\nDen Gläubigern der Gesellschaft ist, wenn sie binnen sechs Monaten nach dem Tag, an dem die Eintragung des Formwechsels nach § 201 UmwG bekannt gemacht worden ist, ihren Anspruch nach Grund und Höhe schriftlich anmelden, Sicherheit zu leisten, soweit sie nicht Befriedigung erlangen können. Dieses Recht steht den Gläubigern jedoch nur zu, wenn sie glaubhaft machen, dass durch den Formwechsel die Erfüllung der Forderung gefährdet wird."
    },
    {
      "date": "2024-11-20",
      "id": "94068",
      "original_text": "Einreichung neuer Dokumente\nBaden-Württemberg Amtsgericht Stuttgart HRB 777882\nLeibinger SE – Ditzingen",
      "type": "Einreichung neuer Dokumente",
      "state": "Baden-Württemberg",
      "amtsgericht": "Amtsgericht Stuttgart",
      "registernummer": "HRB 777882",
      "registerart": "HRB",
      "company_name": "Leibinger SE",
      "company_seat": "Ditzingen",
      "details": "20.11.2024 (Bekanntmachungsdatum)\n\nBaden-Württemberg Amtsgericht Stuttgart HRB 777882\nEinreichung neuer Dokumente\n\nLeibinger SE\nEuropäische Aktiengesellschaft (SE)\nDitzingen\n\nDie Gesellschaft hat am 19.11.2024 die Liste über die Zusammensetzung des Aufsichtsrats zum Handelsregister eingereicht."
    },
    {
      "date": "2024-11-20",
      "id": "94141",
      "original_text": "Löschungsankündigung\nNordrhein-Westfalen Amtsgericht Essen HRB 35627\nLingnau Spedition GmbH – Essen",
      "type": "Löschungsankündigung",
      "state": "Nordrhein-Westfalen",
      "amtsgericht": "Amtsgericht Essen",
      "registernummer": "HRB 35627",
      "registerart": "HRB",
      "company_name": "Lingnau Spedition GmbH",
      "company_seat": "Essen",
      "details": "20.11.2024 (Bekanntmachungsdatum)\n\nNordrhein-Westfalen Amtsgericht Essen HRB 35627\nLöschungsankündigung\n\nLingnau Spedition GmbH\nGesellschaft mit beschränkter Haftung\nEssen\n\nDas Registergericht beabsichtigt die Gesellschaft von Amts wegen nach § 394 FamFG zu löschen. Die Frist zur Erhebung eines Widerspruchs ist auf einen Monat festgesetzt."
    },
    {
      "date": "2024-11-20",
      "id": "94052",
      "original_text": "Registerbekanntmachung nach dem Umwandlungsgesetz\nBerlin Amtsgericht Berlin (Charlottenburg) HRB 239111\nLinus CORE Financing GmbH – Berlin",
      "type": "Registerbekanntmachung nach dem Umwandlungsgesetz",
      "state": "Berlin",
      "amtsgericht": "Amtsgericht Berlin (Charlottenburg)",
      "registernummer": "HRB 239111",
      "registerart": "HRB",
      "company_name": "Linus CORE Financing GmbH",
      "company_seat": "Berlin",
      "details": "20.11.2024 (Bekanntmachungsdatum)\n\nBerlin Amtsgericht Berlin (Charlottenburg) HRB 239111\nRegisterbekanntmachung nach dem Umwandlungsgesetz 19.11.2024 (Eintragungsdatum)\n\nLinus CORE Financing GmbH\nGesellschaft mit beschränkter Haftung\nBerlin\n\nZu Eintragungsnummer 6 vom 19.11.2024 wird als nicht eingetragen veröffentlicht:Den Gläubigern der an der Verschmelzung beteiligten Rechtsträger ist, wenn sie binnen sechs Monaten nach dem Tag, an dem die Eintragung der Verschmelzung in das Register des Sitzes desjenigen Rechtsträgers, dessen Gläubiger sie sind, als bekannt gemacht gilt, ihren Anspruch nach Grund und Höhe schriftlich anmelden, Sicherheit zu leisten, soweit sie nicht Befriedigung verlangen können. Dieses Recht steht den Gläubigern jedoch nur zu, wenn sie glaubhaft machen, dass durch die Verschmelzung die Erfüllung ihrer Forderung gefährdet wird. Das Recht, Sicherheitsleistung zu verlangen, steht Gläubigern nicht zu, die im Falle der Insolvenz ein Recht auf vorzugsweise Befriedigung aus einer Deckungsmasse haben, die nach gesetzlicher Vorschrift zu ihrem Schutz errichtet und staatlich überwacht ist."
    },
    {
      "date": "2024-11-20",
      "id": "94053",
      "original_text": "Registerbekanntmachung nach dem Umwandlungsgesetz\nBerlin Amtsgericht Berlin (Charlottenburg) HRB 239199\nLinus Co-Investment UK I GmbH – Berlin",
      "type": "Registerbekanntmachung nach dem Umwandlungsgesetz",
      "state": "Berlin",
      "amtsgericht": "Amtsgericht Berlin (Charlottenburg)",
      "registernummer": "HRB 239199",
      "registerart": "HRB",
      "company_name": "Linus Co-Investment UK I GmbH",
      "company_seat": "Berlin",
      "details": "20.11.2024 (Bekanntmachungsdatum)\n\nBerlin Amtsgericht Berlin (Charlottenburg) HRB 239199\nRegisterbekanntmachung nach dem Umwandlungsgesetz 19.11.2024 (Eintragungsdatum)\n\nLinus Co-Investment UK I GmbH\nGesellschaft mit beschränkter Haftung\nBerlin\n\nZu Eintragungsnummer 6 vom 19.11.2024 wird als nicht eingetragen veröffentlicht:Den Gläubigern der an der Verschmelzung beteiligten Rechtsträger ist, wenn sie binnen sechs Monaten nach dem Tag, an dem die Eintragung der Verschmelzung in das Register des Sitzes desjenigen Rechtsträgers, dessen Gläubiger sie sind, als bekannt gemacht gilt, ihren Anspruch nach Grund und Höhe schriftlich anmelden, Sicherheit zu leisten, soweit sie nicht Befriedigung verlangen können. Dieses Recht steht den Gläubigern jedoch nur zu, wenn sie glaubhaft machen, dass durch die Verschmelzung die Erfüllung ihrer Forderung gefährdet wird. Das Recht, Sicherheitsleistung zu verlangen, steht Gläubigern nicht zu, die im Falle der Insolvenz ein Recht auf vorzugsweise Befriedigung aus einer Deckungsmasse haben, die nach gesetzlicher Vorschrift zu ihrem Schutz errichtet und staatlich überwacht ist."
    },
    {
      "date": "2024-11-20",
      "id": "94050",
      "original_text": "Registerbekanntmachung nach dem Umwandlungsgesetz\nBerlin Amtsgericht Berlin (Charlottenburg) HRB 199890\nLinus Feondor Invest UG (haftungsbeschränkt) – Berlin",
      "type": "Registerbekanntmachung nach dem Umwandlungsgesetz",
      "state": "Berlin",
      "amtsgericht": "Amtsgericht Berlin (Charlottenburg)",
      "registernummer": "HRB 199890",
      "registerart": "HRB",
      "company_name": "Linus Feondor Invest UG (haftungsbeschränkt)",
      "company_seat": "Berlin",
      "details": "20.11.2024 (Bekanntmachungsdatum)\n\nBerlin Amtsgericht Berlin (Charlottenburg) HRB 199890\nRegisterbekanntmachung nach dem Umwandlungsgesetz 19.11.2024 (Eintragungsdatum)\n\nLinus Feondor Invest UG (haftungsbeschränkt)\nGesellschaft mit beschränkter Haftung\nBerlin\n\nZu Eintragungsnummer 11 vom 19.11.2024 wird als nicht eingetragen veröffentlicht:Den Gläubigern der an der Verschmelzung beteiligten Rechtsträger ist, wenn sie binnen sechs Monaten nach dem Tag, an dem die Eintragung der Verschmelzung in das Register des Sitzes desjenigen Rechtsträgers, dessen Gläubiger sie sind, als bekannt gemacht gilt, ihren Anspruch nach Grund und Höhe schriftlich anmelden, Sicherheit zu leisten, soweit sie nicht Befriedigung verlangen können. Dieses Recht steht den Gläubigern jedoch nur zu, wenn sie glaubhaft machen, dass durch die Verschmelzung die Erfüllung ihrer Forderung gefährdet wird. Das Recht, Sicherheitsleistung zu verlangen, steht Gläubigern nicht zu, die im Falle der Insolvenz ein Recht auf vorzugsweise Befriedigung aus einer Deckungsmasse haben, die nach gesetzlicher Vorschrift zu ihrem Schutz errichtet und staatlich überwacht ist."
    },
    {
      "date": "2024-11-20",
      "id": "94051",
      "original_text": "Registerbekanntmachung nach dem Umwandlungsgesetz\nBerlin Amtsgericht Berlin (Charlottenburg) HRB 199890\nLinus Feondor Invest UG (haftungsbeschränkt) – Berlin",
      "type": "Registerbekanntmachung nach dem Umwandlungsgesetz",
      "state": "Berlin",
      "amtsgericht": "Amtsgericht Berlin (Charlottenburg)",
      "registernummer": "HRB 199890",
      "registerart": "HRB",
      "company_name": "Linus Feondor Invest UG (haftungsbeschränkt)",
      "company_seat": "Berlin",
      "details": "20.11.2024 (Bekanntmachungsdatum)\n\nBerlin Amtsgericht Berlin (Charlottenburg) HRB 199890\nRegisterbekanntmachung nach dem Umwandlungsgesetz 19.11.2024 (Eintragungsdatum)\n\nLinus Feondor Invest UG (haftungsbeschränkt)\nGesellschaft mit beschränkter Haftung\nBerlin\n\nZu Eintragungsnummer 10 vom 19.11.2024 wird als nicht eingetragen veröffentlicht: Den Gläubigern der an der Verschmelzung beteiligten Rechtsträger ist, wenn sie binnen sechs Monaten nach dem Tag, an dem die Eintragung der Verschmelzung in das Register des Sitzes desjenigen Rechtsträgers, dessen Gläubiger sie sind, als bekannt gemacht gilt, ihren Anspruch nach Grund und Höhe schriftlich anmelden, Sicherheit zu leisten, soweit sie nicht Befriedigung verlangen können. Dieses Recht steht den Gläubigern jedoch nur zu, wenn sie glaubhaft machen, dass durch die Verschmelzung die Erfüllung ihrer Forderung gefährdet wird. Das Recht, Sicherheitsleistung zu verlangen, steht Gläubigern nicht zu, die im Falle der Insolvenz ein Recht auf vorzugsweise Befriedigung aus einer Deckungsmasse haben, die nach gesetzlicher Vorschrift zu ihrem Schutz errichtet und staatlich überwacht ist."
    },
    {
      "date": "2024-11-20",
      "id": "94058",
      "original_text": "Löschungsankündigung\nBerlin Amtsgericht Berlin (Charlottenburg) HRB 165765\nLowel Trade GmbH – Berlin",
      "type": "Löschungsankündigung",
      "state": "Berlin",
      "amtsgericht": "Amtsgericht Berlin (Charlottenburg)",
      "registernummer": "HRB 165765",
      "registerart": "HRB",
      "company_name": "Lowel Trade GmbH",
      "company_seat": "Berlin",
      "details": "20.11.2024 (Bekanntmachungsdatum)\n\nBerlin Amtsgericht Berlin (Charlottenburg) HRB 165765\nLöschungsankündigung\n\nLowel Trade GmbH\nGesellschaft mit beschränkter Haftung\nBerlin\n\nBei der nachstehenden Gesellschaft wird das Amtslöschungsverfahren gemäß § 394 FamFG eingeleitet. Widerspruchsfrist 6 Wochen"
    },
    {
      "date": "2024-11-20",
      "id": "94156",
      "original_text": "Löschungsankündigung\nHessen Amtsgericht Frankfurt am Main HRB 115539\nM.A.D. Dienstleistungen GmbH – Frankfurt am Main",
      "type": "Löschungsankündigung",
      "state": "Hessen",
      "amtsgericht": "Amtsgericht Frankfurt am Main",
      "registernummer": "HRB 115539",
      "registerart": "HRB",
      "company_name": "M.A.D. Dienstleistungen GmbH",
      "company_seat": "Frankfurt am Main",
      "details": "20.11.2024 (Bekanntmachungsdatum)\n\nHessen Amtsgericht Frankfurt am Main HRB 115539\nLöschungsankündigung 20.11.2024 (Eintragungsdatum)\n\nM.A.D. Dienstleistungen GmbH\nGesellschaft mit beschränkter Haftung\nFrankfurt am Main\n\nDas Registergericht beabsichtigt die im Handelsregister eingetragene Gesellschaft von Amts wegen nach § 394 FamFG zu löschen. Die Frist zur Erhebung eines Widerspruchs gegen die beabsichtigte Löschung wird auf 1 Monat festgesetzt."
    },
    {
      "date": "2024-11-20",
      "id": "94118",
      "original_text": "Löschungsankündigung\nNordrhein-Westfalen Amtsgericht Düsseldorf HRB 83780\nMDS Management GmbH – Monheim am Rhein",
      "type": "Löschungsankündigung",
      "state": "Nordrhein-Westfalen",
      "amtsgericht": "Amtsgericht Düsseldorf",
      "registernummer": "HRB 83780",
      "registerart": "HRB",
      "company_name": "MDS Management GmbH",
      "company_seat": "Monheim am Rhein",
      "details": "20.11.2024 (Bekanntmachungsdatum)\n\nNordrhein-Westfalen Amtsgericht Düsseldorf HRB 83780\nLöschungsankündigung\n\nMDS Management GmbH\nGesellschaft mit beschränkter Haftung\nMonheim am Rhein\n\nDas Registergericht beabsichtigt die Gesellschaft von Amts wegen nach § 394 Abs. 1 FamFG zu löschen. Die Frist zur Erhebung eines Widerspruchs ist auf 3 Wochen festgesetzt.\n\nRechtsbehelfsbelehrung:\nDas Widerspruchsrecht steht jedem zu, der an der Unterlassung der Löschung ein berechtigtes Interesse hat. Der Widerspruch ist bei dem Amtsgericht Düsseldorf -Registergericht-, Werdener Straße 1, 40227 Düsseldorf schriftlich in deutscher Sprache oder zur Niederschrift der Geschäftsstelle einzulegen. Der Widerspruch kann auch zur Niederschrift der Geschäftsstelle eines jeden Amtsgerichtes abgegeben werden. Die Einlegung ist auch durch Übertragung eines elektronischen Dokuments an die elektronische Poststelle des Gerichts möglich. Das elektronische Dokument muss für die Bearbeitung durch das Gericht geeignet und mit einer qualifizierten elektronischen Signatur der verantwortenden Person versehen sein oder von der verantwortenden Person signiert und auf einem sicheren Übermittlungsweg gemäß § 130a ZPO nach näherer Maßgabe der Verordnung über die technischen Rahmenbedingungen des elektronischen Rechtsverkehrs und über das besondere elektronische Behördenpostfach (BGBl. I, S.3803) eingereicht werden. Weitere Informationen erhalten Sie auf der Internetseite www.justiz.de.\nDer Widerspruch muss spätestens innerhalb der gesetzten Frist nach dem Datum der Bekanntmachung der Löschungsankündigung bei dem Amtsgericht - Registergericht - Düsseldorf eingegangen sein.  Dies gilt auch dann, wenn der Widerspruch zur Niederschrift der Geschäftsstelle eines anderen Amtsgerichtes abgegeben wurde. Die Frist beginnt mit dem Tage der Bekanntmachung der Löschungsankündigung in dem für die Bekanntmachung der Eintragungen in das Handelsregister bestimmten elektronischen Informations- und Kommunikationssystem nach § 10 des Handelsgesetzbuches. Fällt das Ende der Frist auf einen Sonntag, einen allgemeinen Feiertag oder Sonnabend, so endet die Frist mit Ablauf des nächsten Werktages.\nDer Widerspruch muss die Bezeichnung der angefochtenen Löschungsankündigung sowie die Erklärung enthalten, dass Widerspruch gegen diese Löschungsankündigung eingelegt wird. Er ist zu unterzeichnen und soll begründet werden."
    },
    {
      "date": "2024-11-20",
      "id": "94042",
      "original_text": "Registerbekanntmachung nach dem Umwandlungsgesetz\nBayern Amtsgericht Nürnberg HRB 28386\nMFG Mobile Freizeit Gestaltung für Senioren Dorothea Geißelbrecht UG (haftungsbeschränkt) – Nürnberg",
      "type": "Registerbekanntmachung nach dem Umwandlungsgesetz",
      "state": "Bayern",
      "amtsgericht": "Amtsgericht Nürnberg",
      "registernummer": "HRB 28386",
      "registerart": "HRB",
      "company_name": "MFG Mobile Freizeit Gestaltung für Senioren Dorothea Geißelbrecht UG (haftungsbeschränkt)",
      "company_seat": "Nürnberg",
      "details": "20.11.2024 (Bekanntmachungsdatum)\n\nBayern Amtsgericht Nürnberg HRB 28386\nRegisterbekanntmachung nach dem Umwandlungsgesetz 19.11.2024 (Eintragungsdatum)\n\nMFG Mobile Freizeit Gestaltung für Senioren Dorothea Geißelbrecht UG (haftungsbeschränkt)\nGesellschaft mit beschränkter Haftung\nNürnberg\n\nDen Gläubigern der an der Verschmelzung beteiligten Rechtsträger ist, wenn sie binnen sechs Monaten nach dem Tag, an dem die Eintragung der Verschmelzung in das Register des Sitzes desjenigen Rechtsträgers, dessen Gläubiger sie sind, nach § 19 Abs. 3 UmwG als bekannt gemacht gilt, ihren Anspruch nach Grund und Höhe schriftlich anmelden, Sicherheit zu leisten, soweit sie nicht Befriedigung verlangen können. Dieses Recht steht den Gläubigern jedoch nur zu, wenn sie glaubhaft machen, dass durch die Verschmelzung die Erfüllung ihrer Forderung gefährdet wird."
    },
    {
      "date": "2024-11-20",
      "id": "94134",
      "original_text": "Löschungsankündigung\nNordrhein-Westfalen Amtsgericht Essen HRB 31021\nMORKAN Import-Export-Trading GmbH – Essen",
      "type": "Löschungsankündigung",
      "state": "Nordrhein-Westfalen",
      "amtsgericht": "Amtsgericht Essen",
      "registernummer": "HRB 31021",
      "registerart": "HRB",
      "company_name": "MORKAN Import-Export-Trading GmbH",
      "company_seat": "Essen",
      "details": "20.11.2024 (Bekanntmachungsdatum)\n\nNordrhein-Westfalen Amtsgericht Essen HRB 31021\nLöschungsankündigung\n\nMORKAN Import-Export-Trading GmbH\nGesellschaft mit beschränkter Haftung\nEssen\n\nDas Registergericht beabsichtigt die Gesellschaft von Amts wegen nach § 394 FamFG zu löschen. Die Frist zur Erhebung eines Widerspruchs ist auf einen Monat festgesetzt."
    },
    {
      "date": "2024-11-20",
      "id": "94142",
      "original_text": "Löschungsankündigung\nNordrhein-Westfalen Amtsgericht Essen HRB 23375\nMV-Security GmbH – Essen",
      "type": "Löschungsankündigung",
      "state": "Nordrhein-Westfalen",
      "amtsgericht": "Amtsgericht Essen",
      "registernummer": "HRB 23375",
      "registerart": "HRB",
      "company_name": "MV-Security GmbH",
      "company_seat": "Essen",
      "details": "20.11.2024 (Bekanntmachungsdatum)\n\nNordrhein-Westfalen Amtsgericht Essen HRB 23375\nLöschungsankündigung\n\nMV-Security GmbH\nGesellschaft mit beschränkter Haftung\nEssen\n\nDas Registergericht beabsichtigt die Gesellschaft von Amts wegen nach § 394 FamFG zu löschen. Die Frist zur Erhebung eines Widerspruchs ist auf einen Monat festgesetzt."
    },
    {
      "date": "2024-11-20",
      "id": "94146",
      "original_text": "Registerbekanntmachung nach dem Umwandlungsgesetz\nThüringen Amtsgericht Jena HRA 506878\nMartin Olbrich e.K. – Gera",
      "type": "Registerbekanntmachung nach dem Umwandlungsgesetz",
      "state": "Thüringen",
      "amtsgericht": "Amtsgericht Jena",
      "registernummer": "HRA 506878",
      "registerart": "HRA",
      "company_name": "Martin Olbrich e.K.",
      "company_seat": "Gera",
      "details": "20.11.2024 (Bekanntmachungsdatum)\n\nThüringen Amtsgericht Jena HRA 506878\nRegisterbekanntmachung nach dem Umwandlungsgesetz 20.11.2024 (Eintragungsdatum)\n\nMartin Olbrich e.K.\nEinzelkaufmann / Einzelkauffrau\nGera\n\nNicht eingetragen: Den Gläubigern der an der Ausgliederung beteiligten Rechtsträger, ist wenn sie binnen sechs Monaten nach dem Tag, an dem die Eintragung der Ausgliederung in das Register des Sitzes desjenigen Rechtsträgers, dessen Gläubiger sie sind, nach §§125, 19 Abs. 3 UmwG als bekanntgemacht gilt, ihren Anspruch nach Grund und Höhe schriftlich anmelden, Sicherheit zu leisten, soweit sie nicht Befriedigung verlangen können. Dieses Recht steht ihnen jedoch nur zu, wenn sie glaubhaft machen, daß durch die Ausgliederung die Erfüllung ihrer Forderung gefährdet wird."
    },
    {
      "date": "2024-11-20",
      "id": "94078",
      "original_text": "Registerbekanntmachung nach dem Umwandlungsgesetz\nBaden-Württemberg Amtsgericht Stuttgart HRB 749665\nMeyer Menü HN Verwaltungs GmbH – Neuenstadt am Kocher",
      "type": "Registerbekanntmachung nach dem Umwandlungsgesetz",
      "state": "Baden-Württemberg",
      "amtsgericht": "Amtsgericht Stuttgart",
      "registernummer": "HRB 749665",
      "registerart": "HRB",
      "company_name": "Meyer Menü HN Verwaltungs GmbH",
      "company_seat": "Neuenstadt am Kocher",
      "details": "20.11.2024 (Bekanntmachungsdatum)\n\nBaden-Württemberg Amtsgericht Stuttgart HRB 749665\nRegisterbekanntmachung nach dem Umwandlungsgesetz 20.11.2024 (Eintragungsdatum)\n\nMeyer Menü HN Verwaltungs GmbH\nGesellschaft mit beschränkter Haftung\nNeuenstadt am Kocher\n\nDen Gläubigern der an der Verschmelzung beteiligten Rechtsträger ist, wenn sie binnen sechs Monaten nach dem Tag, an dem die Eintragung der Verschmelzung in das Register des Sitzes desjenigen Rechtsträgers, dessen Gläubiger sie sind, nach § 19 Abs. 3 UmwG als bekanntgemacht gilt, ihren Anspruch nach Grund und Höhe schriftlich anmelden, Sicherheit zu leisten, soweit sie nicht Befriedigung verlangen können. Dieses Recht steht den Gläubigern jedoch nur zu, wenn sie glaubhaft machen, dass durch die Verschmelzung die Erfüllung ihrer Forderung gefährdet wird."
    },
    {
      "date": "2024-11-20",
      "id": "94123",
      "original_text": "Löschungsankündigung\nNordrhein-Westfalen Amtsgericht Dortmund HRB 30267\nMoveFit GmbH – Lünen",
      "type": "Löschungsankündigung",
      "state": "Nordrhein-Westfalen",
      "amtsgericht": "Amtsgericht Dortmund",
      "registernummer": "HRB 30267",
      "registerart": "HRB",
      "company_name": "MoveFit GmbH",
      "company_seat": "Lünen",
      "details": "20.11.2024 (Bekanntmachungsdatum)\n\nNordrhein-Westfalen Amtsgericht Dortmund HRB 30267\nLöschungsankündigung 20.11.2024 (Eintragungsdatum)\n\nMoveFit GmbH\nGesellschaft mit beschränkter Haftung\nLünen\n\nDas Registergericht beabsichtigt die Gesellschaft von Amts wegen nach § 394 FamFG zu löschen. Die Frist zur Erhebung eines Widerspruchs ist auf zwei Monate festgesetzt."
    },
    {
      "date": "2024-11-20",
      "id": "94112",
      "original_text": "Registerbekanntmachung nach dem Umwandlungsgesetz\nRheinland-Pfalz Amtsgericht Ludwigshafen a.Rhein (Ludwigshafen) HRB 2314\nMühlenberg GmbH – Gönnheim",
      "type": "Registerbekanntmachung nach dem Umwandlungsgesetz",
      "state": "Rheinland-Pfalz",
      "amtsgericht": "Amtsgericht Ludwigshafen a.Rhein (Ludwigshafen)",
      "registernummer": "HRB 2314",
      "registerart": "HRB",
      "company_name": "Mühlenberg GmbH",
      "company_seat": "Gönnheim",
      "details": "20.11.2024 (Bekanntmachungsdatum)\n\nRheinland-Pfalz Amtsgericht Ludwigshafen a.Rhein (Ludwigshafen) HRB 2314\nRegisterbekanntmachung nach dem Umwandlungsgesetz 18.11.2024 (Eintragungsdatum)\n\nMühlenberg GmbH\nGesellschaft mit beschränkter Haftung\nGönnheim\n\nAls nicht eingetragen wird veröffentlicht: Den Gläubigern der an der Verschmelzung beteiligten Rechtsträger ist, wenn sie binnen sechs Monaten nach dem Tag, an dem die Eintragung der Verschmelzung in das Register des Sitzes desjenigen Rechtsträgers,dessen Gläubiger sie sind, nach § 19 Abs. 3 UmwG als bekannt gemacht gilt, ihren Anspruch nach Grund und Höhe schriftlich anmelden, Sicherheit zu leisten, soweit sie nicht Befriedigung verlangen können. Dieses Recht steht den Gläubigern jedoch nur zu, wenn sie glaubhaft machen, dass durch die Verschmelzung die Erfüllungd er Forderung gefährdet wird."
    },
    {
      "date": "2024-11-20",
      "id": "94095",
      "original_text": "Registerbekanntmachung nach dem Umwandlungsgesetz\nBaden-Württemberg Amtsgericht Ulm HRB 748385\nNoerpel SE – Ulm",
      "type": "Registerbekanntmachung nach dem Umwandlungsgesetz",
      "state": "Baden-Württemberg",
      "amtsgericht": "Amtsgericht Ulm",
      "registernummer": "HRB 748385",
      "registerart": "HRB",
      "company_name": "Noerpel SE",
      "company_seat": "Ulm",
      "details": "20.11.2024 (Bekanntmachungsdatum)\n\nBaden-Württemberg Amtsgericht Ulm HRB 748385\nRegisterbekanntmachung nach dem Umwandlungsgesetz 20.11.2024 (Eintragungsdatum)\n\nNoerpel SE\nEuropäische Aktiengesellschaft (SE)\nUlm\n\nAls nicht eingetragen wird bekanntgemacht:\nDen Gläubigern der an der Verschmelzung beteiligten Rechtsträger ist, wenn sie binnen sechs Monaten nach dem Tag, an dem die Eintragung der Verschmelzung in das Register des Sitzes desjenigen Rechtsträgers, dessen Gläubiger sie sind, nach § 19 Abs. 3 UmwG als bekanntgemacht gilt, ihren Anspruch nach Grund und Höhe schriftlich anmelden, Sicherheit zu leisten, soweit sie nicht Befriedigung verlangen können. Dieses Recht steht den Gläubigern jedoch nur zu, wenn sie glaubhaft machen, dass durch die Verschmelzung die Erfüllung ihrer Forderung gefährdet wird."
    },
    {
      "date": "2024-11-20",
      "id": "94114",
      "original_text": "Registerbekanntmachung nach dem Umwandlungsgesetz\nRheinland-Pfalz Amtsgericht Ludwigshafen a.Rhein (Ludwigshafen) HRB 66363\nP+W Verwaltungs GmbH – Ludwigshafen",
      "type": "Registerbekanntmachung nach dem Umwandlungsgesetz",
      "state": "Rheinland-Pfalz",
      "amtsgericht": "Amtsgericht Ludwigshafen a.Rhein (Ludwigshafen)",
      "registernummer": "HRB 66363",
      "registerart": "HRB",
      "company_name": "P+W Verwaltungs GmbH",
      "company_seat": "Ludwigshafen",
      "details": "20.11.2024 (Bekanntmachungsdatum)\n\nRheinland-Pfalz Amtsgericht Ludwigshafen a.Rhein (Ludwigshafen) HRB 66363\nRegisterbekanntmachung nach dem Umwandlungsgesetz 20.11.2024 (Eintragungsdatum)\n\nP+W Verwaltungs GmbH\nGesellschaft mit beschränkter Haftung\nLudwigshafen\n\nAls nicht eingetragen wird veröffentlicht: Den Gläubigern der an der Verschmelzung beteiligten Rechtsträger ist, wenn sie binnen sechs Monaten nach dem Tag, an dem die Eintragung der Verschmelzung in das Register des Sitzes desjenigen Rechtsträgers, dessen Gläubiger sie sind, nach § 19 Abs. 3 UmwG als bekannt gemacht gilt, ihren Anspruch nach Grund und Höhe schriftlich anmelden, Sicherheit zu leisten, soweit sie nicht Befriedigung verlangen können. Dieses Recht steht den Gläubigern jedoch nur zu, wenn sie glaubhaft machen, dass durch die Verschmelzung die Erfüllung der Forderung gefährdet wird."
    },
    {
      "date": "2024-11-20",
      "id": "94085",
      "original_text": "Löschungsankündigung\nBrandenburg Amtsgericht Potsdam HRB 32896\nPLH Handels UG (haftungsbeschränkt) – Luckenwalde",
      "type": "Löschungsankündigung",
      "state": "Brandenburg",
      "amtsgericht": "Amtsgericht Potsdam",
      "registernummer": "HRB 32896",
      "registerart": "HRB",
      "company_name": "PLH Handels UG (haftungsbeschränkt)",
      "company_seat": "Luckenwalde",
      "details": "20.11.2024 (Bekanntmachungsdatum)\n\nBrandenburg Amtsgericht Potsdam HRB 32896\nLöschungsankündigung\n\nPLH Handels UG (haftungsbeschränkt)\nGesellschaft mit beschränkter Haftung\nLuckenwalde\n\nBei der nachstehenden Gesellschaft wird das Amtslöschungsverfahren gemäß § 394 FamFG eingeleitet. Widerspruchsfrist: 8 Wochen"
    },
    {
      "date": "2024-11-20",
      "id": "94056",
      "original_text": "Registerbekanntmachung nach dem Umwandlungsgesetz\nBaden-Württemberg Amtsgericht Mannheim HRB 210623\nPROKUR Verwaltungsgesellschaft mbH – Achern",
      "type": "Registerbekanntmachung nach dem Umwandlungsgesetz",
      "state": "Baden-Württemberg",
      "amtsgericht": "Amtsgericht Mannheim",
      "registernummer": "HRB 210623",
      "registerart": "HRB",
      "company_name": "PROKUR Verwaltungsgesellschaft mbH",
      "company_seat": "Achern",
      "details": "20.11.2024 (Bekanntmachungsdatum)\n\nBaden-Württemberg Amtsgericht Mannheim HRB 210623\nRegisterbekanntmachung nach dem Umwandlungsgesetz 20.11.2024 (Eintragungsdatum)\n\nPROKUR Verwaltungsgesellschaft mbH\nGesellschaft mit beschränkter Haftung\nAchern\n\nDen Gläubigern der an der Ausgliederung beteiligten Rechtsträger ist, wenn sie binnen sechs Monaten nach dem Tag, an dem die Eintragung der Ausgliederung in das Register des Sitzes desjenigen Rechtsträgers, dessen Gläubiger sie sind, nach § 19 Abs. 3 UmwG als bekanntgemacht gilt, ihren Anspruch nach Grund und Höhe schriftlich anmelden, Sicherheit zu leisten, soweit sie nicht Befriedigung verlangen können. Dieses Recht steht den Gläubigern jedoch nur zu, wenn sie glaubhaft machen, dass durch die Ausgliederung die Erfüllung ihrer Forderung gefährdet wird."
    },
    {
      "date": "2024-11-20",
      "id": "94076",
      "original_text": "Löschungsankündigung\nBerlin Amtsgericht Berlin (Charlottenburg) HRB 235163\nPflegescoutDBE GmbH – Berlin",
      "type": "Löschungsankündigung",
      "state": "Berlin",
      "amtsgericht": "Amtsgericht Berlin (Charlottenburg)",
      "registernummer": "HRB 235163",
      "registerart": "HRB",
      "company_name": "PflegescoutDBE GmbH",
      "company_seat": "Berlin",
      "details": "20.11.2024 (Bekanntmachungsdatum)\n\nBerlin Amtsgericht Berlin (Charlottenburg) HRB 235163\nLöschungsankündigung\n\nPflegescoutDBE GmbH\nGesellschaft mit beschränkter Haftung\nBerlin\n\nBei der nachstehenden Gesellschaft wird das Amtslöschungsverfahren gemäß § 394 FamFG eingeleitet. Widerspruchsfrist 6 Wochen"
    },
    {
      "date": "2024-11-20",
      "id": "94130",
      "original_text": "Löschungsankündigung\nNordrhein-Westfalen Amtsgericht Köln HRB 95889\nPixcoin UG (haftungsbeschränkt) – Köln",
      "type": "Löschungsankündigung",
      "state": "Nordrhein-Westfalen",
      "amtsgericht": "Amtsgericht Köln",
      "registernummer": "HRB 95889",
      "registerart": "HRB",
      "company_name": "Pixcoin UG (haftungsbeschränkt)",
      "company_seat": "Köln",
      "details": "20.11.2024 (Bekanntmachungsdatum)\n\nNordrhein-Westfalen Amtsgericht Köln HRB 95889\nLöschungsankündigung\n\nPixcoin UG (haftungsbeschränkt)\nGesellschaft mit beschränkter Haftung\nKöln\n\nDas Registergericht beabsichtigt die Gesellschaft von Amts wegen nach § 394 FamFG zu löschen. Die Frist zur Erhebung eines Widerspruchs ist auf einen Monat festgesetzt. Rechtsbehelfsbelehrung: Gegen diese Verfügung können Sie Widerspruch einlegen. Der Widerspruch ist bei dem Amtsgericht Köln, Reichenspergerplatz 1, 50670 Köln schriftlich in deutscher Sprache oder zur Niederschrift der Geschäftsstelle einzulegen. Der Widerspruch kann auch zur Niederschrift der Geschäftsstelle eines jeden Amtsgerichtes abgegeben werden. Die Einlegung ist auch durch Übertragung eines elektronischen Dokuments an die elektronische Poststelle des Gerichts möglich. Das elektronische Dokument muss für die Bearbeitung durch das Gericht geeignet und mit einer qualifizierten elektronischen Signatur der verantwortenden Person versehen sein oder von der verantwortenden Person signiert und auf einem sicheren Übermittlungsweg gemäß § 130a ZPO nach näherer Maßgabe der Verordnung über die technischen Rahmenbedingungen des elektronischen Rechtsverkehrs und über das besondere elektronische Behördenpostfach (BGBl. I, S.3803) eingereicht werden. Weitere Informationen erhalten Sie auf der Internetseite www.justiz.de.Der Widerspruch muss spätestens innerhalb der gesetzten Frist bei dem Amtsgericht Köln eingegangen sein. Dies gilt auch dann, wenn der Widerspruch zur Niederschrift der Geschäftsstelle eines anderen Amtsgerichtes abgegeben wurde. Die Frist beginnt mit der Veröffentlichung. Fällt das Ende der Frist auf einen Sonntag, einen allgemeinen Feiertag oder Sonnabend, so endet die Frist mit Ablauf des nächsten Werktages. Der Widerspruch muss die Bezeichnung der angefochtenen Verfügung sowie die Erklärung enthalten, dass Widerspruch gegen diese Verfügung eingelegt wird. Er ist zu unterzeichnen und soll begründet werden."
    },
    {
      "date": "2024-11-20",
      "id": "94129",
      "original_text": "Löschungsankündigung\nNordrhein-Westfalen Amtsgericht Dortmund HRB 31216\nPlaza Tech UG (haftungsbeschränkt) – Dortmund",
      "type": "Löschungsankündigung",
      "state": "Nordrhein-Westfalen",
      "amtsgericht": "Amtsgericht Dortmund",
      "registernummer": "HRB 31216",
      "registerart": "HRB",
      "company_name": "Plaza Tech UG (haftungsbeschränkt)",
      "company_seat": "Dortmund",
      "details": "20.11.2024 (Bekanntmachungsdatum)\n\nNordrhein-Westfalen Amtsgericht Dortmund HRB 31216\nLöschungsankündigung\n\nPlaza Tech UG (haftungsbeschränkt)\nGesellschaft mit beschränkter Haftung\nDortmund\n\nDas Registergericht beabsichtigt die Gesellschaft von Amts wegen nach § 394 FamFG zu löschen. Die Frist zur Erhebung eines Widerspruchs ist auf zwei Monate festgesetzt."
    },
    {
      "date": "2024-11-20",
      "id": "94154",
      "original_text": "Löschungsankündigung\nHessen Amtsgericht Eschwege HRB 3322\nPoolprofi Nordhessen GmbH – Meinhard",
      "type": "Löschungsankündigung",
      "state": "Hessen",
      "amtsgericht": "Amtsgericht Eschwege",
      "registernummer": "HRB 3322",
      "registerart": "HRB",
      "company_name": "Poolprofi Nordhessen GmbH",
      "company_seat": "Meinhard",
      "details": "20.11.2024 (Bekanntmachungsdatum)\n\nHessen Amtsgericht Eschwege HRB 3322\nLöschungsankündigung\n\nPoolprofi Nordhessen GmbH\nGesellschaft mit beschränkter Haftung\nMeinhard\n\nDas Registergericht beabsichtigt den im Handelsregister eingetragenen Geschäftsführer Mario Kuntze, *29.09.1978, Kassel, von Amts wegen nach § 395 FamFG zu löschen.\nDie Frist zur Erhebung eines Widerspruchs gegen die beabsichtigte Löschung wird auf 1 Monat festgesetzt."
    },
    {
      "date": "2024-11-20",
      "id": "94110",
      "original_text": "Registerbekanntmachung nach dem Umwandlungsgesetz\nNiedersachsen Amtsgericht Oldenburg (Oldenburg) HRB 206733\nREHA Verwaltungsgesellschaft mbH – Edewecht",
      "type": "Registerbekanntmachung nach dem Umwandlungsgesetz",
      "state": "Niedersachsen",
      "amtsgericht": "Amtsgericht Oldenburg (Oldenburg)",
      "registernummer": "HRB 206733",
      "registerart": "HRB",
      "company_name": "REHA Verwaltungsgesellschaft mbH",
      "company_seat": "Edewecht",
      "details": "20.11.2024 (Bekanntmachungsdatum)\n\nNiedersachsen Amtsgericht Oldenburg (Oldenburg) HRB 206733\nRegisterbekanntmachung nach dem Umwandlungsgesetz 20.11.2024 (Eintragungsdatum)\n\nREHA Verwaltungsgesellschaft mbH\nGesellschaft mit beschränkter Haftung\nEdewecht\n\nDen Gläubigern der an der Verschmelzung beteiligten Rechtsträger ist, wenn sie binnen sechs Monaten nach dem Tag, an dem die Eintragung der Verschmelzung in das Register des Sitzes desjenigen Rechtsträgers, dessen Gläubiger sie sind, nach § 19  Abs.  3 UmwG als bekannt gemacht gilt, ihren Anspruch nach Grund und Höhe schriftlich anmelden, Sicherheit zu leisten, soweit sie nicht Befriedigung verlangen können. Dieses Recht steht den Gläubigern jedoch nur zu, wenn sie glaubhaft machen, dass durch die Verschmelzung die Erfüllung der Forderung gefährdet wird."
    },
    {
      "date": "2024-11-20",
      "id": "94137",
      "original_text": "Registerbekanntmachung nach dem Umwandlungsgesetz\nNordrhein-Westfalen Amtsgericht Gelsenkirchen HRB 10535\nREZIPROK Konzept GmbH – Dorsten",
      "type": "Registerbekanntmachung nach dem Umwandlungsgesetz",
      "state": "Nordrhein-Westfalen",
      "amtsgericht": "Amtsgericht Gelsenkirchen",
      "registernummer": "HRB 10535",
      "registerart": "HRB",
      "company_name": "REZIPROK Konzept GmbH",
      "company_seat": "Dorsten",
      "details": "20.11.2024 (Bekanntmachungsdatum)\n\nNordrhein-Westfalen Amtsgericht Gelsenkirchen HRB 10535\nRegisterbekanntmachung nach dem Umwandlungsgesetz 20.11.2024 (Eintragungsdatum)\n\nREZIPROK Konzept GmbH\nGesellschaft mit beschränkter Haftung\nDorsten\n\nDen Gläubigern der an der Verschmelzung beteiligten Rechtsträger ist, wenn sie binnen sechs Monaten nach dem Tag, an dem die Eintragung der Verschmelzung in das Register des Sitzes desjenigen Rechtsträgers, dessen Gläubiger sie sind, nach § 19 Absatz 3 UmwG als bekanntgemacht gilt, ihren Anspruch nach Grund und Höhe schriftlich anmelden, Sicherheit zu leisten, soweit sie nicht Befriedigung verlangen können. Dieses Recht steht den Gläubigern jedoch nur zu, wenn sie glaubhaft machen, dass durch die Verschmelzung die Erfüllung ihrer Forderung gefährdet wird."
    },
    {
      "date": "2024-11-20",
      "id": "94069",
      "original_text": "Einreichung neuer Dokumente\nBaden-Württemberg Amtsgericht Stuttgart HRB 793309\nRSBNA Erms-Neckar-Bahn Schieneninfrastruktur GmbH – Bad Urach",
      "type": "Einreichung neuer Dokumente",
      "state": "Baden-Württemberg",
      "amtsgericht": "Amtsgericht Stuttgart",
      "registernummer": "HRB 793309",
      "registerart": "HRB",
      "company_name": "RSBNA Erms-Neckar-Bahn Schieneninfrastruktur GmbH",
      "company_seat": "Bad Urach",
      "details": "20.11.2024 (Bekanntmachungsdatum)\n\nBaden-Württemberg Amtsgericht Stuttgart HRB 793309\nEinreichung neuer Dokumente\n\nRSBNA Erms-Neckar-Bahn Schieneninfrastruktur GmbH\nGesellschaft mit beschränkter Haftung\nBad Urach\n\nDie Gesellschaft hat am 19.11.2024 die Liste über die Zusammensetzung des Aufsichtsrats zum Handelsregister eingereicht."
    },
    {
      "date": "2024-11-20",
      "id": "94107",
      "original_text": "Einreichung neuer Dokumente\nBaden-Württemberg Amtsgericht Ulm HRB 540903\nRationelle Energie Süd GmbH – Geislingen an der Steige",
      "type": "Einreichung neuer Dokumente",
      "state": "Baden-Württemberg",
      "amtsgericht": "Amtsgericht Ulm",
      "registernummer": "HRB 540903",
      "registerart": "HRB",
      "company_name": "Rationelle Energie Süd GmbH",
      "company_seat": "Geislingen an der Steige",
      "details": "20.11.2024 (Bekanntmachungsdatum)\n\nBaden-Württemberg Amtsgericht Ulm HRB 540903\nEinreichung neuer Dokumente\n\nRationelle Energie Süd GmbH\nGesellschaft mit beschränkter Haftung\nGeislingen an der Steige\n\nDie Gesellschaft hat am 19.11.2024 die Liste über die Zusammensetzung des Aufsichtsrats zum Handelsregister eingereicht."
    },
    {
      "date": "2024-11-20",
      "id": "94111",
      "original_text": "Registerbekanntmachung nach dem Umwandlungsgesetz\nNiedersachsen Amtsgericht Oldenburg (Oldenburg) HRB 121605\nReha Automobile Bad Zwischenahn GmbH – Edewecht",
      "type": "Registerbekanntmachung nach dem Umwandlungsgesetz",
      "state": "Niedersachsen",
      "amtsgericht": "Amtsgericht Oldenburg (Oldenburg)",
      "registernummer": "HRB 121605",
      "registerart": "HRB",
      "company_name": "Reha Automobile Bad Zwischenahn GmbH",
      "company_seat": "Edewecht",
      "details": "20.11.2024 (Bekanntmachungsdatum)\n\nNiedersachsen Amtsgericht Oldenburg (Oldenburg) HRB 121605\nRegisterbekanntmachung nach dem Umwandlungsgesetz 20.11.2024 (Eintragungsdatum)\n\nReha Automobile Bad Zwischenahn GmbH\nGesellschaft mit beschränkter Haftung\nEdewecht\n\nDen Gläubigern der an der Verschmelzung beteiligten Rechtsträger ist, wenn sie binnen sechs Monaten nach dem Tag, an dem die Eintragung der Verschmelzung in das Register des Sitzes desjenigen Rechtsträgers, dessen Gläubiger sie sind, nach § 19  Abs.  3 UmwG als bekannt gemacht gilt, ihren Anspruch nach Grund und Höhe schriftlich anmelden, Sicherheit zu leisten, soweit sie nicht Befriedigung verlangen können. Dieses Recht steht den Gläubigern jedoch nur zu, wenn sie glaubhaft machen, dass durch die Verschmelzung die Erfüllung der Forderung gefährdet wird."
    },
    {
      "date": "2024-11-20",
      "id": "94139",
      "original_text": "Löschungsankündigung\nNordrhein-Westfalen Amtsgericht Mönchengladbach HRB 16998\nRioniz Co GmbH – Mönchengladbach",
      "type": "Löschungsankündigung",
      "state": "Nordrhein-Westfalen",
      "amtsgericht": "Amtsgericht Mönchengladbach",
      "registernummer": "HRB 16998",
      "registerart": "HRB",
      "company_name": "Rioniz Co GmbH",
      "company_seat": "Mönchengladbach",
      "details": "20.11.2024 (Bekanntmachungsdatum)\n\nNordrhein-Westfalen Amtsgericht Mönchengladbach HRB 16998\nLöschungsankündigung\n\nRioniz Co GmbH\nGesellschaft mit beschränkter Haftung\nMönchengladbach\n\nDas Registergericht beabsichtigt die Gesellschaft von Amts wegen nach § 394 FamFG zu löschen. Die Frist zur Erhebung eines Widerspruchs ist auf einen Monat festgesetzt."
    },
    {
      "date": "2024-11-20",
      "id": "94122",
      "original_text": "Registerbekanntmachung nach dem Umwandlungsgesetz\nNordrhein-Westfalen Amtsgericht Bad Oeynhausen HRB 7832\nRohrbau Rödinghausen GmbH – Rödinghausen",
      "type": "Registerbekanntmachung nach dem Umwandlungsgesetz",
      "state": "Nordrhein-Westfalen",
      "amtsgericht": "Amtsgericht Bad Oeynhausen",
      "registernummer": "HRB 7832",
      "registerart": "HRB",
      "company_name": "Rohrbau Rödinghausen GmbH",
      "company_seat": "Rödinghausen",
      "details": "20.11.2024 (Bekanntmachungsdatum)\n\nNordrhein-Westfalen Amtsgericht Bad Oeynhausen HRB 7832\nRegisterbekanntmachung nach dem Umwandlungsgesetz 20.11.2024 (Eintragungsdatum)\n\nRohrbau Rödinghausen GmbH\nGesellschaft mit beschränkter Haftung\nRödinghausen\n\nDen Gläubigern der an der Verschmelzung beteiligten Rechtsträger ist, wenn sie binnen sechs Monaten nach dem Tag, an dem die Eintragung der Verschmelzung in das Register des Sitzes desjenigen Rechtsträgers, dessen Gläubiger sie sind, nach § 19 Absatz 3 UmwG als bekanntgemacht gilt, ihren Anspruch nach Grund und Höhe schriftlich anmelden, Sicherheit zu leisten, soweit sie nicht Befriedigung verlangen können. Dieses Recht steht den Gläubigern jedoch nur zu, wenn sie glaubhaft machen, dass durch die Verschmelzung die Erfüllung ihrer Forderung gefährdet wird."
    },
    {
      "date": "2024-11-20",
      "id": "94160",
      "original_text": "Registerbekanntmachung nach dem Umwandlungsgesetz\nHessen Amtsgericht Bad Homburg v.d.H. HRB 7744\nRupp Keramik GmbH – Oberursel (Taunus)",
      "type": "Registerbekanntmachung nach dem Umwandlungsgesetz",
      "state": "Hessen",
      "amtsgericht": "Amtsgericht Bad Homburg v.d.H.",
      "registernummer": "HRB 7744",
      "registerart": "HRB",
      "company_name": "Rupp Keramik GmbH",
      "company_seat": "Oberursel (Taunus)",
      "details": "20.11.2024 (Bekanntmachungsdatum)\n\nHessen Amtsgericht Bad Homburg v.d.H. HRB 7744\nRegisterbekanntmachung nach dem Umwandlungsgesetz 20.11.2024 (Eintragungsdatum)\n\nRupp Keramik GmbH\nGesellschaft mit beschränkter Haftung\nOberursel (Taunus)\n\nDen Gläubigern der an der Verschmelzung beteiligten Rechtsträger ist, wenn sie binnen sechs Monaten nach dem Tag, an dem die Eintragung der Verschmelzung in das Register des Sitzes desjenigen Rechtsträgers, dessen Gläubiger sie sind, nach § 19 Absatz 3 UmwG bekannt gemacht worden ist, ihren Anspruch nach Grund und Höhe schriftlich anmelden, Sicherheit zu leisten, soweit sie nicht Befriedigung verlangen können. Dieses Recht steht den Gläubigern jedoch nur zu, wenn sie glaubhaft machen, dass durch die Verschmelzung die Erfüllung ihrer Forderung gefährdet wird."
    },
    {
      "date": "2024-11-20",
      "id": "94151",
      "original_text": "Sonstige Registerbekanntmachung\nHessen Amtsgericht Darmstadt VR 82772\nRäume für Bäume – Weiterstadt",
      "type": "Sonstige Registerbekanntmachung",
      "state": "Hessen",
      "amtsgericht": "Amtsgericht Darmstadt",
      "registernummer": "VR 82772",
      "registerart": "VR",
      "company_name": "Räume für Bäume",
      "company_seat": "Weiterstadt",
      "details": "20.11.2024 (Bekanntmachungsdatum)\n\nHessen Amtsgericht Darmstadt VR 82772\nSonstige Registerbekanntmachung 20.11.2024 (Eintragungsdatum)\n\nRäume für Bäume\neingetragener Verein\nWeiterstadt\n\nDer Verein ist aufgelöst."
    },
    {
      "date": "2024-11-20",
      "id": "94059",
      "original_text": "Löschungsankündigung\nBerlin Amtsgericht Berlin (Charlottenburg) HRB 176912\nSTELLWERK Gastro-Betriebe GmbH – Berlin",
      "type": "Löschungsankündigung",
      "state": "Berlin",
      "amtsgericht": "Amtsgericht Berlin (Charlottenburg)",
      "registernummer": "HRB 176912",
      "registerart": "HRB",
      "company_name": "STELLWERK Gastro-Betriebe GmbH",
      "company_seat": "Berlin",
      "details": "20.11.2024 (Bekanntmachungsdatum)\n\nBerlin Amtsgericht Berlin (Charlottenburg) HRB 176912\nLöschungsankündigung\n\nSTELLWERK Gastro-Betriebe GmbH\nGesellschaft mit beschränkter Haftung\nBerlin\n\nBei der nachstehenden Gesellschaft wird das Amtslöschungsverfahren gemäß § 394 FamFG eingeleitet. Widerspruchsfrist 6 Wochen"
    },
    {
      "date": "2024-11-20",
      "id": "94133",
      "original_text": "Löschungsankündigung\nNordrhein-Westfalen Amtsgericht Wuppertal HRB 6799\nSaga-Team Reisen GmbH – Wuppertal",
      "type": "Löschungsankündigung",
      "state": "Nordrhein-Westfalen",
      "amtsgericht": "Amtsgericht Wuppertal",
      "registernummer": "HRB 6799",
      "registerart": "HRB",
      "company_name": "Saga-Team Reisen GmbH",
      "company_seat": "Wuppertal",
      "details": "20.11.2024 (Bekanntmachungsdatum)\n\nNordrhein-Westfalen Amtsgericht Wuppertal HRB 6799\nLöschungsankündigung\n\nSaga-Team Reisen GmbH\nGesellschaft mit beschränkter Haftung\nWuppertal\n\nDas Registergericht beabsichtigt die Gesellschaft von Amts wegen nach § 394 FamFG zu löschen. Die Frist zur Erhebung eines Widerspruchs ist auf einen Monat festgesetzt."
    },
    {
      "date": "2024-11-20",
      "id": "94098",
      "original_text": "Einreichung neuer Dokumente\nBerlin Amtsgericht Berlin (Charlottenburg) HRB 43259\nSana Kliniken Berlin-Brandenburg GmbH – Berlin",
      "type": "Einreichung neuer Dokumente",
      "state": "Berlin",
      "amtsgericht": "Amtsgericht Berlin (Charlottenburg)",
      "registernummer": "HRB 43259",
      "registerart": "HRB",
      "company_name": "Sana Kliniken Berlin-Brandenburg GmbH",
      "company_seat": "Berlin",
      "details": "20.11.2024 (Bekanntmachungsdatum)\n\nBerlin Amtsgericht Berlin (Charlottenburg) HRB 43259\nEinreichung neuer Dokumente\n\nSana Kliniken Berlin-Brandenburg GmbH\nGesellschaft mit beschränkter Haftung\nBerlin\n\nAls nicht eingetragen wird veröffentlicht:Es wurde eine neue Liste der Aufsichtsratsmitglieder eingereicht (§52 GmbHG)."
    },
    {
      "date": "2024-11-20",
      "id": "94057",
      "original_text": "Registerbekanntmachung nach dem Umwandlungsgesetz\nBaden-Württemberg Amtsgericht Stuttgart HRB 794675\nSchell & Richter Steuerberatungsgesellschaft mbH – Ludwigsburg",
      "type": "Registerbekanntmachung nach dem Umwandlungsgesetz",
      "state": "Baden-Württemberg",
      "amtsgericht": "Amtsgericht Stuttgart",
      "registernummer": "HRB 794675",
      "registerart": "HRB",
      "company_name": "Schell & Richter Steuerberatungsgesellschaft mbH",
      "company_seat": "Ludwigsburg",
      "details": "20.11.2024 (Bekanntmachungsdatum)\n\nBaden-Württemberg Amtsgericht Stuttgart HRB 794675\nRegisterbekanntmachung nach dem Umwandlungsgesetz 20.11.2024 (Eintragungsdatum)\n\nSchell & Richter Steuerberatungsgesellschaft mbH\nGesellschaft mit beschränkter Haftung\nLudwigsburg\n\nDen Gläubigern der an der Abspaltung beteiligten Rechtsträger ist, wenn sie binnen sechs Monaten nach dem Tag, an dem die Eintragung der Abspaltung in das Register des Sitzes desjenigen Rechtsträgers, dessen Gläubiger sie sind, nach § 19 Abs. 3 UmwG als bekanntgemacht gilt, ihren Anspruch nach Grund und Höhe schriftlich anmelden, Sicherheit zu leisten, soweit sie nicht Befriedigung verlangen können. Dieses Recht steht den Gläubigern jedoch nur zu, wenn sie glaubhaft machen, dass durch die Abspaltung die Erfüllung ihrer Forderung gefährdet wird."
    },
    {
      "date": "2024-11-20",
      "id": "94128",
      "original_text": "Registerbekanntmachung nach dem Umwandlungsgesetz\nNordrhein-Westfalen Amtsgericht Düsseldorf HRB 96433\nSenerTec Center Düsseldorf GmbH – Ratingen",
      "type": "Registerbekanntmachung nach dem Umwandlungsgesetz",
      "state": "Nordrhein-Westfalen",
      "amtsgericht": "Amtsgericht Düsseldorf",
      "registernummer": "HRB 96433",
      "registerart": "HRB",
      "company_name": "SenerTec Center Düsseldorf GmbH",
      "company_seat": "Ratingen",
      "details": "20.11.2024 (Bekanntmachungsdatum)\n\nNordrhein-Westfalen Amtsgericht Düsseldorf HRB 96433\nRegisterbekanntmachung nach dem Umwandlungsgesetz 20.11.2024 (Eintragungsdatum)\n\nSenerTec Center Düsseldorf GmbH\nGesellschaft mit beschränkter Haftung\nRatingen\n\nDen Gläubigern der an der Verschmelzung beteiligten Rechtsträger ist, wenn sie binnen sechs Monaten nach dem Tag, an dem die Eintragung der Verschmelzung in das Register des Sitzes desjenigen Rechtsträgers, dessen Gläubiger sie sind, nach § 19 Absatz 3 UmwG als bekanntgemacht gilt, ihren Anspruch nach Grund und Höhe schriftlich anmelden, Sicherheit zu leisten, soweit sie nicht Befriedigung verlangen können. Dieses Recht steht den Gläubigern jedoch nur zu, wenn sie glaubhaft machen, dass durch die Verschmelzung die Erfüllung ihrer Forderung gefährdet wird."
    },
    {
      "date": "2024-11-20",
      "id": "94045",
      "original_text": "Registerbekanntmachung nach dem Umwandlungsgesetz\nBayern Amtsgericht München HRB 297073\nSeokratie GmbH – München",
      "type": "Registerbekanntmachung nach dem Umwandlungsgesetz",
      "state": "Bayern",
      "amtsgericht": "Amtsgericht München",
      "registernummer": "HRB 297073",
      "registerart": "HRB",
      "company_name": "Seokratie GmbH",
      "company_seat": "München",
      "details": "20.11.2024 (Bekanntmachungsdatum)\n\nBayern Amtsgericht München HRB 297073\nRegisterbekanntmachung nach dem Umwandlungsgesetz 19.11.2024 (Eintragungsdatum)\n\nSeokratie GmbH\nGesellschaft mit beschränkter Haftung\nMünchen\n\nDen Gläubigern der an der Spaltung beteiligten Rechtsträger ist, wenn sie binnen sechs Monaten nach dem Tag, an dem die Eintragung der Spaltung in das Register des Sitzes desjenigen Rechtsträgers, dessen Gläubiger sie sind, nach §§ 125, 19 Abs. 3 UmwG als bekannt gemacht gilt, ihren Anspruch nach Grund und Höhe schriftlich anmelden, Sicherheit zu leisten, soweit sie nicht Befriedigung verlangen können. Dieses Recht steht den Gläubigern jedoch nur zu, wenn sie glaubhaft machen, dass durch die Spaltung die Erfüllung ihrer Forderung gefährdet wird."
    },
    {
      "date": "2024-11-20",
      "id": "94064",
      "original_text": "Registerbekanntmachung nach dem Umwandlungsgesetz\nBaden-Württemberg Amtsgericht Mannheim VR 530100\nSozialstation der Evangelischen und Katholischen Kirchengemeinden Gernsbach e.V. – Gernsbach",
      "type": "Registerbekanntmachung nach dem Umwandlungsgesetz",
      "state": "Baden-Württemberg",
      "amtsgericht": "Amtsgericht Mannheim",
      "registernummer": "VR 530100",
      "registerart": "VR",
      "company_name": "Sozialstation der Evangelischen und Katholischen Kirchengemeinden Gernsbach e.V.",
      "company_seat": "Gernsbach",
      "details": "20.11.2024 (Bekanntmachungsdatum)\n\nBaden-Württemberg Amtsgericht Mannheim VR 530100\nRegisterbekanntmachung nach dem Umwandlungsgesetz 20.11.2024 (Eintragungsdatum)\n\nSozialstation der Evangelischen und Katholischen Kirchengemeinden Gernsbach e.V.\neingetragener Verein\nGernsbach\n\nAls nicht eingetragen wird bekanntgemacht: Den Gläubigern des an dem Formwechsel beteiligten Rechtsträgers ist, wenn sie binnen sechs Monaten nach dem Tag, an dem die Eintragung des Formwechsels in das Register des Sitzes desjenigen Rechtsträgers, dessen Gläubiger sie sind, nach § 19 Abs. 3 UmwG als bekanntgemacht gilt, ihren Anspruch nach Grund und Höhe schriftlich anmelden, Sicherheit zu leisten, soweit sie nicht Befriedigung verlangen können. Dieses Recht steht den Gläubigern jedoch nur zu, wenn sie glaubhaft machen, dass durch den Formwechsel die Erfüllung ihrer Forderung gefährdet wird."
    },
    {
      "date": "2024-11-20",
      "id": "94061",
      "original_text": "Registerbekanntmachung nach dem Umwandlungsgesetz\nBaden-Württemberg Amtsgericht Mannheim HRB 752685\nSozialstation der Evangelischen und Katholischen Kirchengemeinden Gernsbach gGmbH – Gernsbach",
      "type": "Registerbekanntmachung nach dem Umwandlungsgesetz",
      "state": "Baden-Württemberg",
      "amtsgericht": "Amtsgericht Mannheim",
      "registernummer": "HRB 752685",
      "registerart": "HRB",
      "company_name": "Sozialstation der Evangelischen und Katholischen Kirchengemeinden Gernsbach gGmbH",
      "company_seat": "Gernsbach",
      "details": "20.11.2024 (Bekanntmachungsdatum)\n\nBaden-Württemberg Amtsgericht Mannheim HRB 752685\nRegisterbekanntmachung nach dem Umwandlungsgesetz 20.11.2024 (Eintragungsdatum)\n\nSozialstation der Evangelischen und Katholischen Kirchengemeinden Gernsbach gGmbH\nGesellschaft mit beschränkter Haftung\nGernsbach\n\nAls nicht eingetragen wird bekanntgemacht: Den Gläubigern des an dem Formwechsel beteiligten Rechtsträgers ist, wenn sie binnen sechs Monaten nach dem Tag, an dem die Eintragung des Formwechsels in das Register des Sitzes desjenigen Rechtsträgers, dessen Gläubiger sie sind, nach § 19 Abs. 3 UmwG als bekanntgemacht gilt, ihren Anspruch nach Grund und Höhe schriftlich anmelden, Sicherheit zu leisten, soweit sie nicht Befriedigung verlangen können. Dieses Recht steht den Gläubigern jedoch nur zu, wenn sie glaubhaft machen, dass durch den Formwechsel die Erfüllung ihrer Forderung gefährdet wird."
    },
    {
      "date": "2024-11-20",
      "id": "94063",
      "original_text": "Löschungsankündigung\nBrandenburg Amtsgericht Potsdam HRB 31049\nSpargelhof Bardenitz GmbH – Treuenbrietzen",
      "type": "Löschungsankündigung",
      "state": "Brandenburg",
      "amtsgericht": "Amtsgericht Potsdam",
      "registernummer": "HRB 31049",
      "registerart": "HRB",
      "company_name": "Spargelhof Bardenitz GmbH",
      "company_seat": "Treuenbrietzen",
      "details": "20.11.2024 (Bekanntmachungsdatum)\n\nBrandenburg Amtsgericht Potsdam HRB 31049\nLöschungsankündigung\n\nSpargelhof Bardenitz GmbH\nGesellschaft mit beschränkter Haftung\nTreuenbrietzen\n\nBei der nachstehenden Gesellschaft wird das Amtslöschungsverfahren gemäß § 394 FamFG eingeleitet. Widerspruchsfrist: 8 Wochen."
    },
    {
      "date": "2024-11-20",
      "id": "94097",
      "original_text": "Löschungsankündigung\nBaden-Württemberg Amtsgericht Mannheim HRB 735905\nSpectra-Express GmbH – Karlsruhe",
      "type": "Löschungsankündigung",
      "state": "Baden-Württemberg",
      "amtsgericht": "Amtsgericht Mannheim",
      "registernummer": "HRB 735905",
      "registerart": "HRB",
      "company_name": "Spectra-Express GmbH",
      "company_seat": "Karlsruhe",
      "details": "20.11.2024 (Bekanntmachungsdatum)\n\nBaden-Württemberg Amtsgericht Mannheim HRB 735905\nLöschungsankündigung\n\nSpectra-Express GmbH\nGesellschaft mit beschränkter Haftung\nKarlsruhe\n\nAls nicht eingetragen wird bekanntgemacht:\nDas Gericht beabsichtigt, die Gesellschaft wegen Vermögenslosigkeit im Handelsregister von Amts wegen nach § 394 FamFG zu löschen. Die Frist zur Geltendmachung eines Widerspruchs gegen die beabsichtigte Löschung ist auf einen Monat ab Veröffentlichung bestimmt."
    },
    {
      "date": "2024-11-20",
      "id": "94117",
      "original_text": "Sonstige Registerbekanntmachung\nRheinland-Pfalz Amtsgericht Ludwigshafen a.Rhein (Ludwigshafen) HRB 11424\nStadt Freinsheim Sanierungsträger GmbH – Freinshein",
      "type": "Sonstige Registerbekanntmachung",
      "state": "Rheinland-Pfalz",
      "amtsgericht": "Amtsgericht Ludwigshafen a.Rhein (Ludwigshafen)",
      "registernummer": "HRB 11424",
      "registerart": "HRB",
      "company_name": "Stadt Freinsheim Sanierungsträger GmbH",
      "company_seat": "Freinshein",
      "details": "20.11.2024 (Bekanntmachungsdatum)\n\nRheinland-Pfalz Amtsgericht Ludwigshafen a.Rhein (Ludwigshafen) HRB 11424\nSonstige Registerbekanntmachung\n\nStadt Freinsheim Sanierungsträger GmbH\nGesellschaft mit beschränkter Haftung\nFreinshein\n\nDem Registergericht ist eine neue Liste der Mitglieder des Aufsichtsrates eingereicht worden."
    },
    {
      "date": "2024-11-20",
      "id": "94067",
      "original_text": "Einreichung neuer Dokumente\nSachsen-Anhalt Amtsgericht Stendal HRB 208913\nStadtwerke Lutherstadt Eisleben GmbH – Lutherstadt Eisleben",
      "type": "Einreichung neuer Dokumente",
      "state": "Sachsen-Anhalt",
      "amtsgericht": "Amtsgericht Stendal",
      "registernummer": "HRB 208913",
      "registerart": "HRB",
      "company_name": "Stadtwerke Lutherstadt Eisleben GmbH",
      "company_seat": "Lutherstadt Eisleben",
      "details": "20.11.2024 (Bekanntmachungsdatum)\n\nSachsen-Anhalt Amtsgericht Stendal HRB 208913\nEinreichung neuer Dokumente\n\nStadtwerke Lutherstadt Eisleben GmbH\nGesellschaft mit beschränkter Haftung\nLutherstadt Eisleben\n\nEine Liste der Mitglieder des Aufsichtsrates wurde zum Handelsregister eingereicht."
    },
    {
      "date": "2024-11-20",
      "id": "94080",
      "original_text": "Sonstige Registerbekanntmachung\nMecklenburg-Vorpommern Amtsgericht Rostock HRB 2962\nStadtwerke Neubukow GmbH – Neubukow",
      "type": "Sonstige Registerbekanntmachung",
      "state": "Mecklenburg-Vorpommern",
      "amtsgericht": "Amtsgericht Rostock",
      "registernummer": "HRB 2962",
      "registerart": "HRB",
      "company_name": "Stadtwerke Neubukow GmbH",
      "company_seat": "Neubukow",
      "details": "20.11.2024 (Bekanntmachungsdatum)\n\nMecklenburg-Vorpommern Amtsgericht Rostock HRB 2962\nSonstige Registerbekanntmachung\n\nStadtwerke Neubukow GmbH\nGesellschaft mit beschränkter Haftung\nNeubukow\n\nEine Liste der Mitglieder des Aufsichtsrats ist zum Handelsregister eingereicht worden."
    },
    {
      "date": "2024-11-20",
      "id": "94162",
      "original_text": "Registerbekanntmachung nach dem Umwandlungsgesetz\nHessen Amtsgericht Hanau HRA 94314\nStrauss IP GmbH & Co. KG – Biebergemünd",
      "type": "Registerbekanntmachung nach dem Umwandlungsgesetz",
      "state": "Hessen",
      "amtsgericht": "Amtsgericht Hanau",
      "registernummer": "HRA 94314",
      "registerart": "HRA",
      "company_name": "Strauss IP GmbH & Co. KG",
      "company_seat": "Biebergemünd",
      "details": "20.11.2024 (Bekanntmachungsdatum)\n\nHessen Amtsgericht Hanau HRA 94314\nRegisterbekanntmachung nach dem Umwandlungsgesetz 20.11.2024 (Eintragungsdatum)\n\nStrauss IP GmbH & Co. KG\nKommanditgesellschaft\nBiebergemünd\n\nDen Gläubigern der an der formwechselnden Umwandlung beteiligten Rechtsträger ist, wenn sie binnen sechs Monaten nach dem Tag, an dem die Eintragung der formwechselnden Umwandlung in das Register des Sitzes desjenigen Rechtsträgers, dessen Gläubiger sie sind, nach § 201 UmwG bekannt gemacht worden ist, ihren Anspruch nach Grund und Höhe schriftlich anmelden, Sicherheit zu leisten, soweit sie nicht Befriedigung verlangen können. Dieses Recht steht den Gläubigern jedoch nur zu, wenn sie glaubhaft machen, dass durch die formwechselnden Umwandlung die Erfüllung ihrer Forderung gefährdet wird."
    },
    {
      "date": "2024-11-20",
      "id": "94155",
      "original_text": "Registerbekanntmachung nach dem Umwandlungsgesetz\nHessen Amtsgericht Hanau HRB 96155\nStrauss Lizenz GmbH – Biebergemünd",
      "type": "Registerbekanntmachung nach dem Umwandlungsgesetz",
      "state": "Hessen",
      "amtsgericht": "Amtsgericht Hanau",
      "registernummer": "HRB 96155",
      "registerart": "HRB",
      "company_name": "Strauss Lizenz GmbH",
      "company_seat": "Biebergemünd",
      "details": "20.11.2024 (Bekanntmachungsdatum)\n\nHessen Amtsgericht Hanau HRB 96155\nRegisterbekanntmachung nach dem Umwandlungsgesetz 20.11.2024 (Eintragungsdatum)\n\nStrauss Lizenz GmbH\nGesellschaft mit beschränkter Haftung\nBiebergemünd\n\nDen Gläubigern der an der formwechselnden Umwandlung beteiligten Rechtsträger ist, wenn sie binnen sechs Monaten nach dem Tag, an dem die Eintragung der formwechselnden Umwandlung in das Register des Sitzes desjenigen Rechtsträgers, dessen Gläubiger sie sind, nach § 201 UmwG bekannt gemacht worden ist, ihren Anspruch nach Grund und Höhe schriftlich anmelden, Sicherheit zu leisten, soweit sie nicht Befriedigung verlangen können. Dieses Recht steht den Gläubigern jedoch nur zu, wenn sie glaubhaft machen, dass durch die formwechselnden Umwandlung die Erfüllung ihrer Forderung gefährdet wird."
    },
    {
      "date": "2024-11-20",
      "id": "94043",
      "original_text": "Löschungsankündigung\nBayern Amtsgericht Coburg HRB 859\nStraßner Innenausbau GmbH – Steinbach am Wald",
      "type": "Löschungsankündigung",
      "state": "Bayern",
      "amtsgericht": "Amtsgericht Coburg",
      "registernummer": "HRB 859",
      "registerart": "HRB",
      "company_name": "Straßner Innenausbau GmbH",
      "company_seat": "Steinbach am Wald",
      "details": "20.11.2024 (Bekanntmachungsdatum)\n\nBayern Amtsgericht Coburg HRB 859\nLöschungsankündigung 14.11.2024 (Eintragungsdatum)\n\nStraßner Innenausbau GmbH\nGesellschaft mit beschränkter Haftung\nSteinbach am Wald\n\nDas Registergericht beabsichtigt, die im Handelsregister eingetragene Gesellschaft wegen Vermögenslosigkeit von Amts wegen nach § 394 FamFG zu löschen. Die Frist zur Erhebung eines Widerspruchs ist auf sechs Wochen festgesetzt."
    },
    {
      "date": "2024-11-20",
      "id": "94149",
      "original_text": "Löschungsankündigung\nHessen Amtsgericht Darmstadt HRB 94816\nSustainable Providence UG (haftungsbeschränkt) – Darmstadt",
      "type": "Löschungsankündigung",
      "state": "Hessen",
      "amtsgericht": "Amtsgericht Darmstadt",
      "registernummer": "HRB 94816",
      "registerart": "HRB",
      "company_name": "Sustainable Providence UG (haftungsbeschränkt)",
      "company_seat": "Darmstadt",
      "details": "20.11.2024 (Bekanntmachungsdatum)\n\nHessen Amtsgericht Darmstadt HRB 94816\nLöschungsankündigung\n\nSustainable Providence UG (haftungsbeschränkt)\nGesellschaft mit beschränkter Haftung\nDarmstadt\n\nDas Registergericht beabsichtigt die im Handelsregister eingetragene Gesellschaft von Amts wegen nach § 394 FamFG zu löschen. Die Frist zur Erhebung eines Widerspruchs gegen die beabsichtigte Löschung wird auf 3 Monate festgesetzt."
    },
    {
      "date": "2024-11-20",
      "id": "94131",
      "original_text": "Löschungsankündigung\nNordrhein-Westfalen Amtsgericht Dortmund HRB 29747\nTPA UG (haftungsbeschränkt) – Dortmund",
      "type": "Löschungsankündigung",
      "state": "Nordrhein-Westfalen",
      "amtsgericht": "Amtsgericht Dortmund",
      "registernummer": "HRB 29747",
      "registerart": "HRB",
      "company_name": "TPA UG (haftungsbeschränkt)",
      "company_seat": "Dortmund",
      "details": "20.11.2024 (Bekanntmachungsdatum)\n\nNordrhein-Westfalen Amtsgericht Dortmund HRB 29747\nLöschungsankündigung 20.11.2024 (Eintragungsdatum)\n\nTPA UG (haftungsbeschränkt)\nGesellschaft mit beschränkter Haftung\nDortmund\n\nDas Registergericht beabsichtigt die Gesellschaft von Amts wegen nach § 394 FamFG zu löschen. Die Frist zur Erhebung eines Widerspruchs ist auf zwei Monate festgesetzt."
    },
    {
      "date": "2024-11-20",
      "id": "94105",
      "original_text": "Löschungsankündigung\nBaden-Württemberg Amtsgericht Stuttgart HRB 781386\nTulbure Transport UG (haftungsbeschränkt) – Besigheim",
      "type": "Löschungsankündigung",
      "state": "Baden-Württemberg",
      "amtsgericht": "Amtsgericht Stuttgart",
      "registernummer": "HRB 781386",
      "registerart": "HRB",
      "company_name": "Tulbure Transport UG (haftungsbeschränkt)",
      "company_seat": "Besigheim",
      "details": "20.11.2024 (Bekanntmachungsdatum)\n\nBaden-Württemberg Amtsgericht Stuttgart HRB 781386\nLöschungsankündigung\n\nTulbure Transport UG (haftungsbeschränkt)\nGesellschaft mit beschränkter Haftung\nBesigheim\n\nAls nicht eingetragen wird bekanntgemacht:\nDas Gericht beabsichtigt, die Gesellschaft wegen Vermögenslosigkeit im Handelsregister von Amts wegen nach § 394 FamFG zu löschen. Die Frist zur Geltendmachung eines Widerspruchs gegen die beabsichtigte Löschung ist auf zwei Monate ab Veröffentlichung bestimmt."
    },
    {
      "date": "2024-11-20",
      "id": "94094",
      "original_text": "Registerbekanntmachung nach dem Umwandlungsgesetz\nSchleswig-Holstein Amtsgericht Lübeck HRA 9900\nURäume Ahrensburg GmbH & Cie KG – Ahrensburg",
      "type": "Registerbekanntmachung nach dem Umwandlungsgesetz",
      "state": "Schleswig-Holstein",
      "amtsgericht": "Amtsgericht Lübeck",
      "registernummer": "HRA 9900",
      "registerart": "HRA",
      "company_name": "URäume Ahrensburg GmbH & Cie KG",
      "company_seat": "Ahrensburg",
      "details": "20.11.2024 (Bekanntmachungsdatum)\n\nSchleswig-Holstein Amtsgericht Lübeck HRA 9900\nRegisterbekanntmachung nach dem Umwandlungsgesetz 20.11.2024 (Eintragungsdatum)\n\nURäume Ahrensburg GmbH & Cie KG\nKommanditgesellschaft\nAhrensburg\n\nZu Eintragungsnummer 7 vom 20.11.2024 wird als nicht eingetragen veröffentlicht:  Den Gläubigern ist, wenn sie binnen sechs Monaten nach dem Tag, an dem die Eintragung der Umwandlung als bekannt gemacht gilt, ihren Anspruch nach Grund und Höhe schriftlich anmelden, Sicherheit zu leisten, soweit sie nicht Befriedigung verlangen können. Dieses Recht steht den Gläubigern jedoch nur zu, wenn sie glaubhaft machen, dass durch die Umwandlung die Erfüllung ihrer Forderung gefährdet wird."
    },
    {
      "date": "2024-11-20",
      "id": "94100",
      "original_text": "Registerbekanntmachung nach dem Umwandlungsgesetz\nSchleswig-Holstein Amtsgericht Lübeck HRB 25565\nURäume GmbH – Hammoor",
      "type": "Registerbekanntmachung nach dem Umwandlungsgesetz",
      "state": "Schleswig-Holstein",
      "amtsgericht": "Amtsgericht Lübeck",
      "registernummer": "HRB 25565",
      "registerart": "HRB",
      "company_name": "URäume GmbH",
      "company_seat": "Hammoor",
      "details": "20.11.2024 (Bekanntmachungsdatum)\n\nSchleswig-Holstein Amtsgericht Lübeck HRB 25565\nRegisterbekanntmachung nach dem Umwandlungsgesetz 20.11.2024 (Eintragungsdatum)\n\nURäume GmbH\nGesellschaft mit beschränkter Haftung\nHammoor\n\nZu Eintragungsnummer 1 vom 20.11.2024 wird als nicht eingetragen veröffentlicht:  Den Gläubigern ist, wenn sie binnen sechs Monaten nach dem Tag, an dem die Eintragung der Umwandlung als bekannt gemacht gilt, ihren Anspruch nach Grund und Höhe schriftlich anmelden, Sicherheit zu leisten, soweit sie nicht Befriedigung verlangen können. Dieses Recht steht den Gläubigern jedoch nur zu, wenn sie glaubhaft machen, dass durch die Umwandlung die Erfüllung ihrer Forderung gefährdet wird."
    },
    {
      "date": "2024-11-20",
      "id": "94033",
      "original_text": "Registerbekanntmachung nach dem Umwandlungsgesetz\nBayern Amtsgericht München HRB 270050\nV1 SportsHouse Verwaltungs GmbH – München",
      "type": "Registerbekanntmachung nach dem Umwandlungsgesetz",
      "state": "Bayern",
      "amtsgericht": "Amtsgericht München",
      "registernummer": "HRB 270050",
      "registerart": "HRB",
      "company_name": "V1 SportsHouse Verwaltungs GmbH",
      "company_seat": "München",
      "details": "20.11.2024 (Bekanntmachungsdatum)\n\nBayern Amtsgericht München HRB 270050\nRegisterbekanntmachung nach dem Umwandlungsgesetz 19.11.2024 (Eintragungsdatum)\n\nV1 SportsHouse Verwaltungs GmbH\nGesellschaft mit beschränkter Haftung\nMünchen\n\nDen Gläubigern der an der Verschmelzung beteiligten Rechtsträger ist, wenn sie binnen sechs Monaten nach dem Tag, an dem die Eintragung der Verschmelzung in das Register des Sitzes desjenigen Rechtsträgers, dessen Gläubiger sie sind, nach § 19 Abs. 3 UmwG als bekannt gemacht gilt, ihren Anspruch nach Grund und Höhe schriftlich anmelden, Sicherheit zu leisten, soweit sie nicht Befriedigung verlangen können. Dieses Recht steht den Gläubigern jedoch nur zu, wenn sie glaubhaft machen, dass durch die Verschmelzung die Erfüllung ihrer Forderung gefährdet wird."
    },
    {
      "date": "2024-11-20",
      "id": "94055",
      "original_text": "Registerbekanntmachung nach dem Umwandlungsgesetz\nBaden-Württemberg Amtsgericht Mannheim HRA 711952\nVBH-Immobilien e.K. – Achern",
      "type": "Registerbekanntmachung nach dem Umwandlungsgesetz",
      "state": "Baden-Württemberg",
      "amtsgericht": "Amtsgericht Mannheim",
      "registernummer": "HRA 711952",
      "registerart": "HRA",
      "company_name": "VBH-Immobilien e.K.",
      "company_seat": "Achern",
      "details": "20.11.2024 (Bekanntmachungsdatum)\n\nBaden-Württemberg Amtsgericht Mannheim HRA 711952\nRegisterbekanntmachung nach dem Umwandlungsgesetz 20.11.2024 (Eintragungsdatum)\n\nVBH-Immobilien e.K.\nEinzelkaufmann / Einzelkauffrau\nAchern\n\nDen Gläubigern der an der Ausgliederung beteiligten Rechtsträger ist, wenn sie binnen sechs Monaten nach dem Tag, an dem die Eintragung der Ausgliederung in das Register des Sitzes desjenigen Rechtsträgers, dessen Gläubiger sie sind, nach § 19 Abs. 3 UmwG als bekanntgemacht gilt, ihren Anspruch nach Grund und Höhe schriftlich anmelden, Sicherheit zu leisten, soweit sie nicht Befriedigung verlangen können. Dieses Recht steht den Gläubigern jedoch nur zu, wenn sie glaubhaft machen, dass durch die Ausgliederung die Erfüllung ihrer Forderung gefährdet wird."
    },
    {
      "date": "2024-11-20",
      "id": "94075",
      "original_text": "Einreichung neuer Dokumente\nSachsen-Anhalt Amtsgericht Stendal HRB 207126\nVGS Verkehrsgesellschaft Südharz mit beschränkter Haftung – Hettstedt",
      "type": "Einreichung neuer Dokumente",
      "state": "Sachsen-Anhalt",
      "amtsgericht": "Amtsgericht Stendal",
      "registernummer": "HRB 207126",
      "registerart": "HRB",
      "company_name": "VGS Verkehrsgesellschaft Südharz mit beschränkter Haftung",
      "company_seat": "Hettstedt",
      "details": "20.11.2024 (Bekanntmachungsdatum)\n\nSachsen-Anhalt Amtsgericht Stendal HRB 207126\nEinreichung neuer Dokumente\n\nVGS Verkehrsgesellschaft Südharz mit beschränkter Haftung\nGesellschaft mit beschränkter Haftung\nHettstedt\n\nEine Liste der Mitglieder des Aufsichtsrates wurde zum Handelsregister eingereicht."
    },
    {
      "date": "2024-11-20",
      "id": "94119",
      "original_text": "Registerbekanntmachung nach dem Umwandlungsgesetz\nNordrhein-Westfalen Amtsgericht Bielefeld HRA 17458\nVITALutions Inhaberin: Kathrin Wittler e. Kffr. – Bielefeld",
      "type": "Registerbekanntmachung nach dem Umwandlungsgesetz",
      "state": "Nordrhein-Westfalen",
      "amtsgericht": "Amtsgericht Bielefeld",
      "registernummer": "HRA 17458",
      "registerart": "HRA",
      "company_name": "VITALutions Inhaberin: Kathrin Wittler e. Kffr.",
      "company_seat": "Bielefeld",
      "details": "20.11.2024 (Bekanntmachungsdatum)\n\nNordrhein-Westfalen Amtsgericht Bielefeld HRA 17458\nRegisterbekanntmachung nach dem Umwandlungsgesetz 20.11.2024 (Eintragungsdatum)\n\nVITALutions Inhaberin: Kathrin Wittler e. Kffr.\nEinzelkaufmann / Einzelkauffrau\nBielefeld\n\nDen Gläubigern der an der Verschmelzung beteiligten Rechtsträger ist, wenn sie binnen sechs Monaten nach dem Tag, an dem die Eintragung der Verschmelzung in das Register des Sitzes desjenigen Rechtsträgers, dessen Gläubiger sie sind, nach § 19 Absatz 3 UmwG als bekanntgemacht gilt, ihren Anspruch nach Grund und Höhe schriftlich anmelden, Sicherheit zu leisten, soweit sie nicht Befriedigung verlangen können. Dieses Recht steht den Gläubigern jedoch nur zu, wenn sie glaubhaft machen, dass durch die Verschmelzung die Erfüllung ihrer Forderung gefährdet wird."
    },
    {
      "date": "2024-11-20",
      "id": "94081",
      "original_text": "Registerbekanntmachung nach dem Umwandlungsgesetz\nSchleswig-Holstein Amtsgericht Kiel VR 3464\nVerein der Ehemaligen der Max-Planck-Schule Kiel e. V. – Kiel",
      "type": "Registerbekanntmachung nach dem Umwandlungsgesetz",
      "state": "Schleswig-Holstein",
      "amtsgericht": "Amtsgericht Kiel",
      "registernummer": "VR 3464",
      "registerart": "VR",
      "company_name": "Verein der Ehemaligen der Max-Planck-Schule Kiel e. V.",
      "company_seat": "Kiel",
      "details": "20.11.2024 (Bekanntmachungsdatum)\n\nSchleswig-Holstein Amtsgericht Kiel VR 3464\nRegisterbekanntmachung nach dem Umwandlungsgesetz 19.11.2024 (Eintragungsdatum)\n\nVerein der Ehemaligen der Max-Planck-Schule Kiel e. V.\neingetragener Verein\nKiel\n\nZu Eintragungsnummer 8 vom 19.11.2024 wird als nicht eingetragen veröffentlicht: Den Gläubigern der an der Verschmelzung beteiligten Rechtsträger ist, wenn sie binnen sechs Monaten nach dem Tag, an dem die Eintragung der Verschmelzung in das Register des Sitzes desjenigen Rechtsträgers, dessen Gläubiger sie sind, nach § 19 Abs. 3 UmwG bekannt gemacht worden ist, ihren Anspruch nach Grund und Höhe schriftlich anmelden, Sicherheit zu leisten, soweit sie nicht Befriedigung verlangen können. Dieses Recht steht den Gläubigern jedoch nur zu, wenn sie glaubhaft machen, dass durch die Verschmelzung die Erfüllung ihrer Forderung gefährdet wird."
    },
    {
      "date": "2024-11-20",
      "id": "94135",
      "original_text": "Einreichung neuer Dokumente\nNordrhein-Westfalen Amtsgericht Hagen HRB 62\nWebac Immobilien AG – Hagen-Kabel",
      "type": "Einreichung neuer Dokumente",
      "state": "Nordrhein-Westfalen",
      "amtsgericht": "Amtsgericht Hagen",
      "registernummer": "HRB 62",
      "registerart": "HRB",
      "company_name": "Webac Immobilien AG",
      "company_seat": "Hagen-Kabel",
      "details": "20.11.2024 (Bekanntmachungsdatum)\n\nNordrhein-Westfalen Amtsgericht Hagen HRB 62\nEinreichung neuer Dokumente\n\nWebac Immobilien AG\nAktiengesellschaft\nHagen-Kabel\n\nDem Registergericht ist eine Liste der Mitglieder des Aufsichtsrates eingereicht worden."
    },
    {
      "date": "2024-11-20",
      "id": "94096",
      "original_text": "Sonstige Registerbekanntmachung\nMecklenburg-Vorpommern Amtsgericht Rostock HRB 6696\nWohnungsverwaltungs GmbH Neubukow, WVN – Neubukow",
      "type": "Sonstige Registerbekanntmachung",
      "state": "Mecklenburg-Vorpommern",
      "amtsgericht": "Amtsgericht Rostock",
      "registernummer": "HRB 6696",
      "registerart": "HRB",
      "company_name": "Wohnungsverwaltungs GmbH Neubukow, WVN",
      "company_seat": "Neubukow",
      "details": "20.11.2024 (Bekanntmachungsdatum)\n\nMecklenburg-Vorpommern Amtsgericht Rostock HRB 6696\nSonstige Registerbekanntmachung\n\nWohnungsverwaltungs GmbH Neubukow, WVN\nGesellschaft mit beschränkter Haftung\nNeubukow\n\nEine Liste der Mitglieder des Aufsichtsrats ist zum Handelsregister eingereicht worden."
    },
    {
      "date": "2024-11-20",
      "id": "94071",
      "original_text": "Sonstige Registerbekanntmachung\nBaden-Württemberg Amtsgericht Mannheim HRB 738474\nabtis Holding AG – Pforzheim",
      "type": "Sonstige Registerbekanntmachung",
      "state": "Baden-Württemberg",
      "amtsgericht": "Amtsgericht Mannheim",
      "registernummer": "HRB 738474",
      "registerart": "HRB",
      "company_name": "abtis Holding AG",
      "company_seat": "Pforzheim",
      "details": "20.11.2024 (Bekanntmachungsdatum)\n\nBaden-Württemberg Amtsgericht Mannheim HRB 738474\nSonstige Registerbekanntmachung\n\nabtis Holding AG\nAktiengesellschaft\nPforzheim\n\nDie Gesellschaft hat am 30.10.2024 die Liste über die Zusammensetzung des Aufsichtsrats zum Handelsregister eingereicht."
    },
    {
      "date": "2024-11-20",
      "id": "94126",
      "original_text": "Löschungsankündigung\nNordrhein-Westfalen Amtsgericht Wuppertal HRB 30492\nercoteq Dienstleistungen GmbH – Erkrath",
      "type": "Löschungsankündigung",
      "state": "Nordrhein-Westfalen",
      "amtsgericht": "Amtsgericht Wuppertal",
      "registernummer": "HRB 30492",
      "registerart": "HRB",
      "company_name": "ercoteq Dienstleistungen GmbH",
      "company_seat": "Erkrath",
      "details": "20.11.2024 (Bekanntmachungsdatum)\n\nNordrhein-Westfalen Amtsgericht Wuppertal HRB 30492\nLöschungsankündigung\n\nercoteq Dienstleistungen GmbH\nGesellschaft mit beschränkter Haftung\nErkrath\n\nDas Registergericht beabsichtigt die Gesellschaft von Amts wegen nach § 394 FamFG zu löschen. Die Frist zur Erhebung eines Widerspruchs ist auf einen Monat festgesetzt."
    },
    {
      "date": "2024-11-20",
      "id": "94054",
      "original_text": "Löschungsankündigung\nSaarland Amtsgericht Saarbrücken HRB 107510\nkanahana press UG (haftungsbeschränkt) – Kirkel",
      "type": "Löschungsankündigung",
      "state": "Saarland",
      "amtsgericht": "Amtsgericht Saarbrücken",
      "registernummer": "HRB 107510",
      "registerart": "HRB",
      "company_name": "kanahana press UG (haftungsbeschränkt)",
      "company_seat": "Kirkel",
      "details": "20.11.2024 (Bekanntmachungsdatum)\n\nSaarland Amtsgericht Saarbrücken HRB 107510\nLöschungsankündigung\n\nkanahana press UG (haftungsbeschränkt)\nGesellschaft mit beschränkter Haftung\nKirkel\n\nEs ist beabsichtigt, die Gesellschaft von Amts wegen gemäß § 394 FamFG wegen Vermögenslosigkeit zu löschen.\nGegen die Löschung von Amts wegen ist das Rechtsmittel des Widerspruchs statthaft. Der Widerspruch ist binnen einer Frist zwei Monaten beginnend mit dem Tag dieser Veröffentlichung durch Einreichen eines Widerspruchsschreibens -schriftlich oder zur Niederschrift der Geschäftsstelle beim Amtsgericht Saarbrücken, -zentrales Handelsregister-, Mainzer Str.178, 66121 Saarbrücken einzulegen.\nDer Widerspruch muss die Bezeichnung der angefochtenen Löschungsankündigung enthalten sowie die Erklärung, dass Widerspruch eingelegt wird. Er ist vom Widerspruchsführer oder seinem Bevollmächtigten zu unterzeichnen.\nDas Widerspruchsschreiben kann auch in der Form eines elektronischen Dokumentes eingereicht werden, das mit einer qualifizierten elektronischen Signatur nach dem Signaturgesetz versehen sein muss (§§ 14 Abs. 2 FamFG, 130a, 298 ZPO)."
    },
    {
      "date": "2024-11-20",
      "id": "94103",
      "original_text": "Löschungsankündigung\nBaden-Württemberg Amtsgericht Ulm HRB 722455\nsüdflügel gmbh werbeagentur – Eislingen",
      "type": "Löschungsankündigung",
      "state": "Baden-Württemberg",
      "amtsgericht": "Amtsgericht Ulm",
      "registernummer": "HRB 722455",
      "registerart": "HRB",
      "company_name": "südflügel gmbh werbeagentur",
      "company_seat": "Eislingen",
      "details": "20.11.2024 (Bekanntmachungsdatum)\n\nBaden-Württemberg Amtsgericht Ulm HRB 722455\nLöschungsankündigung\n\nsüdflügel gmbh werbeagentur\nGesellschaft mit beschränkter Haftung\nEislingen\n\nDas Gericht beabsichtigt, die Gesellschaft wegen Vermögenslosigkeit im Handelsregister von Amts wegen nach § 394 FamFG zu löschen. Die Frist zur Geltendmachung eines Widerspruchs gegen die beabsichtigte Löschung ist auf  einen Monat ab Veröffentlichung bestimmt."
    },
    {
      "date": "2024-11-20",
      "id": "94079",
      "original_text": "Registerbekanntmachung nach dem Umwandlungsgesetz\nBaden-Württemberg Amtsgericht Stuttgart HRA 738655\nverwaltenmitgestalten Hauschverwaltung Petra Hausch e.K. – Kirchheim unter Teck",
      "type": "Registerbekanntmachung nach dem Umwandlungsgesetz",
      "state": "Baden-Württemberg",
      "amtsgericht": "Amtsgericht Stuttgart",
      "registernummer": "HRA 738655",
      "registerart": "HRA",
      "company_name": "verwaltenmitgestalten Hauschverwaltung Petra Hausch e.K.",
      "company_seat": "Kirchheim unter Teck",
      "details": "20.11.2024 (Bekanntmachungsdatum)\n\nBaden-Württemberg Amtsgericht Stuttgart HRA 738655\nRegisterbekanntmachung nach dem Umwandlungsgesetz 20.11.2024 (Eintragungsdatum)\n\nverwaltenmitgestalten Hauschverwaltung Petra Hausch e.K.\nEinzelkaufmann / Einzelkauffrau\nKirchheim unter Teck\n\nAls nicht eingetragen wird bekanntgemacht:\nDen Gläubigern der an der Ausgliederung beteiligten Rechtsträger ist, wenn sie binnen sechs Monaten nach dem Tag, an dem die Eintragung der Ausgliederung in das Register des Sitzes desjenigen Rechtsträgers, dessen Gläubiger sie sind, nach § 19 Abs. 3 UmwG als bekanntgemacht gilt, ihren Anspruch nach Grund und Höhe schriftlich anmelden, Sicherheit zu leisten, soweit sie nicht Befriedigung verlangen können. Dieses Recht steht den Gläubigern jedoch nur zu, wenn sie glaubhaft machen, dass durch die Ausgliederung die Erfüllung ihrer Forderung gefährdet wird."
    },
    {
      "date": "2024-11-20",
      "id": "94036",
      "original_text": "Einreichung neuer Dokumente\nBayern Amtsgericht München HRB 273759\nzooplus SE – München",
      "type": "Einreichung neuer Dokumente",
      "state": "Bayern",
      "amtsgericht": "Amtsgericht München",
      "registernummer": "HRB 273759",
      "registerart": "HRB",
      "company_name": "zooplus SE",
      "company_seat": "München",
      "details": "20.11.2024 (Bekanntmachungsdatum)\n\nBayern Amtsgericht München HRB 273759\nEinreichung neuer Dokumente\n\nzooplus SE\nEuropäische Aktiengesellschaft (SE)\nMünchen\n\nDem Amtsgericht München -Registergericht- ist eine Liste der Mitglieder des Aufsichtsrats eingereicht worden, Art. 9 Abs. 1 Buchst. c (ii) SE-VO i.V.m. § 106 AktG."
    }
  ]
}