{
  "date": "2024-11-29",
  "date_of_scrape": "2024-11-30T09:54:15.686Z",
  "tool_version": "0.1.0",
  "number_of_announcements": 96,
  "announcements": [
    {
      "date": "2024-11-29",
      "id": "94993",
      "original_text": "Sonstige Registerbekanntmachung\nBrandenburg Amtsgericht Neuruppin HRB 1043\nA.G.U. Agrargesellschaft Uckermark AG – Prenzlau",
      "type": "Sonstige Registerbekanntmachung",
      "state": "Brandenburg",
      "amtsgericht": "Amtsgericht Neuruppin",
      "registernummer": "HRB 1043",
      "registerart": "HRB",
      "company_name": "A.G.U. Agrargesellschaft Uckermark AG",
      "company_seat": "Prenzlau",
      "details": "29.11.2024 (Bekanntmachungsdatum)\n\nBrandenburg Amtsgericht Neuruppin HRB 1043\nSonstige Registerbekanntmachung\n\nA.G.U. Agrargesellschaft Uckermark AG\nAktiengesellschaft\nPrenzlau\n\nAls nicht eingetragen wird veröffentlicht: Eine Liste der Mitglieder des Aufsichtsrates wurde zum Handelsregister eingereicht."
    },
    {
      "date": "2024-11-29",
      "id": "94972",
      "original_text": "Registerbekanntmachung nach dem Umwandlungsgesetz\nBayern Amtsgericht Würzburg HRB 7913\nALK Augen-Laser-Klinik Lohr GmbH – Lohr am Main",
      "type": "Registerbekanntmachung nach dem Umwandlungsgesetz",
      "state": "Bayern",
      "amtsgericht": "Amtsgericht Würzburg",
      "registernummer": "HRB 7913",
      "registerart": "HRB",
      "company_name": "ALK Augen-Laser-Klinik Lohr GmbH",
      "company_seat": "Lohr am Main",
      "details": "29.11.2024 (Bekanntmachungsdatum)\n\nBayern Amtsgericht Würzburg HRB 7913\nRegisterbekanntmachung nach dem Umwandlungsgesetz 28.11.2024 (Eintragungsdatum)\n\nALK Augen-Laser-Klinik Lohr GmbH\nGesellschaft mit beschränkter Haftung\nLohr am Main\n\nDen Gläubigern der an der Verschmelzung beteiligten Rechtsträger ist, wenn sie binnen sechs Monaten nach dem Tag, an dem die Eintragung der Verschmelzung in das Register des Sitzes desjenigen Rechtsträgers, dessen Gläubiger sie sind, nach § 19 Abs. 3 UmwG als bekannt gemacht gilt, ihren Anspruch nach Grund und Höhe schriftlich anmelden, Sicherheit zu leisten, soweit sie nicht Befriedigung verlangen können. Dieses Recht steht den Gläubigern jedoch nur zu, wenn sie glaubhaft machen, dass durch die Verschmelzung die Erfüllung ihrer Forderung gefährdet wird."
    },
    {
      "date": "2024-11-29",
      "id": "94969",
      "original_text": "Registerbekanntmachung nach dem Umwandlungsgesetz\nBayern Amtsgericht Würzburg HRB 17266\nAUGEN LOHR MVZ GmbH – Lohr a.Main",
      "type": "Registerbekanntmachung nach dem Umwandlungsgesetz",
      "state": "Bayern",
      "amtsgericht": "Amtsgericht Würzburg",
      "registernummer": "HRB 17266",
      "registerart": "HRB",
      "company_name": "AUGEN LOHR MVZ GmbH",
      "company_seat": "Lohr a.Main",
      "details": "29.11.2024 (Bekanntmachungsdatum)\n\nBayern Amtsgericht Würzburg HRB 17266\nRegisterbekanntmachung nach dem Umwandlungsgesetz 28.11.2024 (Eintragungsdatum)\n\nAUGEN LOHR MVZ GmbH\nGesellschaft mit beschränkter Haftung\nLohr a.Main\n\nDen Gläubigern der an der Verschmelzung beteiligten Rechtsträger ist, wenn sie binnen sechs Monaten nach dem Tag, an dem die Eintragung der Verschmelzung in das Register des Sitzes desjenigen Rechtsträgers, dessen Gläubiger sie sind, nach § 19 Abs. 3 UmwG als bekannt gemacht gilt, ihren Anspruch nach Grund und Höhe schriftlich anmelden, Sicherheit zu leisten, soweit sie nicht Befriedigung verlangen können. Dieses Recht steht den Gläubigern jedoch nur zu, wenn sie glaubhaft machen, dass durch die Verschmelzung die Erfüllung ihrer Forderung gefährdet wird."
    },
    {
      "date": "2024-11-29",
      "id": "95059",
      "original_text": "Löschungsankündigung\nHessen Amtsgericht Frankfurt am Main HRB 79892\nAWG GmbH – Frankfurt am Main",
      "type": "Löschungsankündigung",
      "state": "Hessen",
      "amtsgericht": "Amtsgericht Frankfurt am Main",
      "registernummer": "HRB 79892",
      "registerart": "HRB",
      "company_name": "AWG GmbH",
      "company_seat": "Frankfurt am Main",
      "details": "29.11.2024 (Bekanntmachungsdatum)\n\nHessen Amtsgericht Frankfurt am Main HRB 79892\nLöschungsankündigung\n\nAWG GmbH\nGesellschaft mit beschränkter Haftung\nFrankfurt am Main\n\nDas Registergericht beabsichtigt die im Handelsregister eingetragene Gesellschaft von Amts wegen nach § 394 FamFG zu löschen. Die Frist zur Erhebung eines Widerspruchs gegen die beabsichtigte Löschung wird auf 1 Monat festgesetzt."
    },
    {
      "date": "2024-11-29",
      "id": "94967",
      "original_text": "Registerbekanntmachung nach dem Umwandlungsgesetz\nBayern Amtsgericht München HRA 120133\nAngelika Schwienbacher Steuerberatung GmbH & Co.KG – Moorenweis",
      "type": "Registerbekanntmachung nach dem Umwandlungsgesetz",
      "state": "Bayern",
      "amtsgericht": "Amtsgericht München",
      "registernummer": "HRA 120133",
      "registerart": "HRA",
      "company_name": "Angelika Schwienbacher Steuerberatung GmbH & Co.KG",
      "company_seat": "Moorenweis",
      "details": "29.11.2024 (Bekanntmachungsdatum)\n\nBayern Amtsgericht München HRA 120133\nRegisterbekanntmachung nach dem Umwandlungsgesetz 28.11.2024 (Eintragungsdatum)\n\nAngelika Schwienbacher Steuerberatung GmbH & Co.KG\nKommanditgesellschaft\nMoorenweis\n\nDen Gläubigern der an der Ausgliederung beteiligten Rechtsträger ist, wenn sie binnen sechs Monaten nach dem Tag, an dem die Eintragung der Ausgliederung in das Register des Sitzes desjenigen Rechtsträgers, dessen Gläubiger sie sind, nach §§ 125, 19 Abs. 3 UmwG als bekannt gemacht gilt, ihren Anspruch nach Grund und Höhe schriftlich anmelden, Sicherheit zu leisten, soweit sie nicht Befriedigung verlangen können. Dieses Recht steht den Gläubigern jedoch nur zu, wenn sie glaubhaft machen, dass durch die Ausgliederung die Erfüllung ihrer Forderung gefährdet wird."
    },
    {
      "date": "2024-11-29",
      "id": "94965",
      "original_text": "Registerbekanntmachung nach dem Umwandlungsgesetz\nBayern Amtsgericht München HRA 120087\nAngelika Schwienbacher e.K. – Moorenweis",
      "type": "Registerbekanntmachung nach dem Umwandlungsgesetz",
      "state": "Bayern",
      "amtsgericht": "Amtsgericht München",
      "registernummer": "HRA 120087",
      "registerart": "HRA",
      "company_name": "Angelika Schwienbacher e.K.",
      "company_seat": "Moorenweis",
      "details": "29.11.2024 (Bekanntmachungsdatum)\n\nBayern Amtsgericht München HRA 120087\nRegisterbekanntmachung nach dem Umwandlungsgesetz 28.11.2024 (Eintragungsdatum)\n\nAngelika Schwienbacher e.K.\nEinzelkaufmann / Einzelkauffrau\nMoorenweis\n\nDen Gläubigern der an der Ausgliederung beteiligten Rechtsträger ist, wenn sie binnen sechs Monaten nach dem Tag, an dem die Eintragung der Ausgliederung in das Register des Sitzes desjenigen Rechtsträgers, dessen Gläubiger sie sind, nach §§ 125, 19 Abs. 3 UmwG als bekannt gemacht gilt, ihren Anspruch nach Grund und Höhe schriftlich anmelden, Sicherheit zu leisten, soweit sie nicht Befriedigung verlangen können. Dieses Recht steht den Gläubigern jedoch nur zu, wenn sie glaubhaft machen, dass durch die Ausgliederung die Erfüllung ihrer Forderung gefährdet wird."
    },
    {
      "date": "2024-11-29",
      "id": "95005",
      "original_text": "Löschungsankündigung\nBerlin Amtsgericht Berlin (Charlottenburg) HRB 171779\nAnthropool 24 GmbH – Berlin",
      "type": "Löschungsankündigung",
      "state": "Berlin",
      "amtsgericht": "Amtsgericht Berlin (Charlottenburg)",
      "registernummer": "HRB 171779",
      "registerart": "HRB",
      "company_name": "Anthropool 24 GmbH",
      "company_seat": "Berlin",
      "details": "29.11.2024 (Bekanntmachungsdatum)\n\nBerlin Amtsgericht Berlin (Charlottenburg) HRB 171779\nLöschungsankündigung\n\nAnthropool 24 GmbH\nGesellschaft mit beschränkter Haftung\nBerlin\n\nBei der nachstehenden Gesellschaft wird das Amtslöschungsverfahren gemäß § 394 FamFG eingeleitet. Widerspruchsfrist 6 Wochen"
    },
    {
      "date": "2024-11-29",
      "id": "95029",
      "original_text": "Löschungsankündigung\nBremen Amtsgericht Bremen HRB 23812\nAriane Logistik GmbH – Bremen",
      "type": "Löschungsankündigung",
      "state": "Bremen",
      "amtsgericht": "Amtsgericht Bremen",
      "registernummer": "HRB 23812",
      "registerart": "HRB",
      "company_name": "Ariane Logistik GmbH",
      "company_seat": "Bremen",
      "details": "29.11.2024 (Bekanntmachungsdatum)\n\nBremen Amtsgericht Bremen HRB 23812\nLöschungsankündigung\n\nAriane Logistik GmbH\nGesellschaft mit beschränkter Haftung\nBremen\n\nEs ist beabsichtigt die im Handelsregister eingetragene Gesellschaft von Amts wegen gemäß § 394 FamFG zu löschen. Gegen die Löschung kann beim AG Bremen schriftlich oder zu Protokoll der Geschäftsstelle Widerspruch eingelegt werden. Widerspruchsfrist 4 Wochen."
    },
    {
      "date": "2024-11-29",
      "id": "95053",
      "original_text": "Einreichung neuer Dokumente\nHessen Amtsgericht Frankfurt am Main HRB 136824\nAtrium 307. Europäische VV SE – Frankfurt am Main",
      "type": "Einreichung neuer Dokumente",
      "state": "Hessen",
      "amtsgericht": "Amtsgericht Frankfurt am Main",
      "registernummer": "HRB 136824",
      "registerart": "HRB",
      "company_name": "Atrium 307. Europäische VV SE",
      "company_seat": "Frankfurt am Main",
      "details": "29.11.2024 (Bekanntmachungsdatum)\n\nHessen Amtsgericht Frankfurt am Main HRB 136824\nEinreichung neuer Dokumente 29.11.2024 (Eintragungsdatum)\n\nAtrium 307. Europäische VV SE\nEuropäische Aktiengesellschaft (SE)\nFrankfurt am Main\n\nDurch eine Änderung in den Personen der Aufsichtsratsmitglieder ist eine Liste der Mitglieder des Aufsichtsrates zum Handelsregister eingereicht worden."
    },
    {
      "date": "2024-11-29",
      "id": "95036",
      "original_text": "Registerbekanntmachung nach dem Umwandlungsgesetz\nNordrhein-Westfalen Amtsgericht Arnsberg HRA 3778\nAutohaus Schmidt e. K. – Meschede",
      "type": "Registerbekanntmachung nach dem Umwandlungsgesetz",
      "state": "Nordrhein-Westfalen",
      "amtsgericht": "Amtsgericht Arnsberg",
      "registernummer": "HRA 3778",
      "registerart": "HRA",
      "company_name": "Autohaus Schmidt e. K.",
      "company_seat": "Meschede",
      "details": "29.11.2024 (Bekanntmachungsdatum)\n\nNordrhein-Westfalen Amtsgericht Arnsberg HRA 3778\nRegisterbekanntmachung nach dem Umwandlungsgesetz 29.11.2024 (Eintragungsdatum)\n\nAutohaus Schmidt e. K.\nEinzelkaufmann / Einzelkauffrau\nMeschede\n\nDen Gläubigern der an der Ausgliederung beteiligten Rechtsträger ist, wenn sie binnen sechs Monaten nach dem Tag, an dem die Eintragung der Ausgliederung in das Register des Sitzes desjenigen Rechtsträgers, dessen Gläubiger sie sind, nach § 19 Absatz 3 UmwG als bekanntgemacht gilt, ihren Anspruch nach Grund und Höhe schriftlich anmelden, Sicherheit zu leisten, soweit sie nicht Befriedigung verlangen können. Dieses Recht steht den Gläubigern jedoch nur zu, wenn sie glaubhaft machen, dass durch die Ausgliederung die Erfüllung ihrer Forderung gefährdet wird."
    },
    {
      "date": "2024-11-29",
      "id": "95052",
      "original_text": "Einreichung neuer Dokumente\nHessen Amtsgericht Frankfurt am Main HRB 136815\nBlitz F24-917 AG – Frankfurt am Main",
      "type": "Einreichung neuer Dokumente",
      "state": "Hessen",
      "amtsgericht": "Amtsgericht Frankfurt am Main",
      "registernummer": "HRB 136815",
      "registerart": "HRB",
      "company_name": "Blitz F24-917 AG",
      "company_seat": "Frankfurt am Main",
      "details": "29.11.2024 (Bekanntmachungsdatum)\n\nHessen Amtsgericht Frankfurt am Main HRB 136815\nEinreichung neuer Dokumente 29.11.2024 (Eintragungsdatum)\n\nBlitz F24-917 AG\nAktiengesellschaft\nFrankfurt am Main\n\nDurch eine Änderung in den Personen der Aufsichtsratsmitglieder ist eine Liste der Mitglieder des Aufsichtsrates zum Handelsregister eingereicht worden."
    },
    {
      "date": "2024-11-29",
      "id": "95023",
      "original_text": "Registerbekanntmachung nach dem Umwandlungsgesetz\nNiedersachsen Amtsgericht Hildesheim HRB 101050 früher Amtsgericht Gifhorn\nBodenstedt Metallgießerei und Dreherei GmbH – Hohenhameln",
      "type": "Registerbekanntmachung nach dem Umwandlungsgesetz",
      "state": "Niedersachsen",
      "amtsgericht": "Amtsgericht Hildesheim",
      "registernummer": "HRB 101050",
      "registerart": "HRB",
      "company_name": "Bodenstedt Metallgießerei und Dreherei GmbH",
      "company_seat": "Hohenhameln",
      "former_amtsgericht": "Gifhorn",
      "details": "29.11.2024 (Bekanntmachungsdatum)\n\nNiedersachsen Amtsgericht Hildesheim HRB 101050 früher Amtsgericht Gifhorn\nRegisterbekanntmachung nach dem Umwandlungsgesetz 29.11.2024 (Eintragungsdatum)\n\nBodenstedt Metallgießerei und Dreherei GmbH\nGesellschaft mit beschränkter Haftung\nHohenhameln\n\nDen Gläubigern der an der Verschmelzung beteiligten Rechtsträger ist, wenn sie binnen sechs Monaten nach dem Tag, an dem die Eintragung der Verschmelzung in das Register des Sitzes desjenigen Rechtsträgers, dessen Gläubiger sie sind, nach § 19  Abs.  3 UmwG als bekannt gemacht gilt, ihren Anspruch nach Grund und Höhe schriftlich anmelden, Sicherheit zu leisten, soweit sie nicht Befriedigung verlangen können. Dieses Recht steht den Gläubigern jedoch nur zu, wenn sie glaubhaft machen, dass durch die Verschmelzung die Erfüllung der Forderung gefährdet wird."
    },
    {
      "date": "2024-11-29",
      "id": "94975",
      "original_text": "Registerbekanntmachung nach dem Umwandlungsgesetz\nBayern Amtsgericht Nürnberg HRB 33087\nBokma Dienstleistungen GmbH – Nürnberg",
      "type": "Registerbekanntmachung nach dem Umwandlungsgesetz",
      "state": "Bayern",
      "amtsgericht": "Amtsgericht Nürnberg",
      "registernummer": "HRB 33087",
      "registerart": "HRB",
      "company_name": "Bokma Dienstleistungen GmbH",
      "company_seat": "Nürnberg",
      "details": "29.11.2024 (Bekanntmachungsdatum)\n\nBayern Amtsgericht Nürnberg HRB 33087\nRegisterbekanntmachung nach dem Umwandlungsgesetz 28.11.2024 (Eintragungsdatum)\n\nBokma Dienstleistungen GmbH\nGesellschaft mit beschränkter Haftung\nNürnberg\n\nDen Gläubigern der an der Verschmelzung beteiligten Rechtsträger ist, wenn sie binnen sechs Monaten nach dem Tag, an dem die Eintragung der Verschmelzung in das Register des Sitzes desjenigen Rechtsträgers, dessen Gläubiger sie sind, nach § 19 Abs. 3 UmwG als bekannt gemacht gilt, ihren Anspruch nach Grund und Höhe schriftlich anmelden, Sicherheit zu leisten, soweit sie nicht Befriedigung verlangen können. Dieses Recht steht den Gläubigern jedoch nur zu, wenn sie glaubhaft machen, dass durch die Verschmelzung die Erfüllung ihrer Forderung gefährdet wird."
    },
    {
      "date": "2024-11-29",
      "id": "94994",
      "original_text": "Einreichung neuer Dokumente\nBaden-Württemberg Amtsgericht Stuttgart HRB 746374\nBosch Engineering GmbH – Abstatt",
      "type": "Einreichung neuer Dokumente",
      "state": "Baden-Württemberg",
      "amtsgericht": "Amtsgericht Stuttgart",
      "registernummer": "HRB 746374",
      "registerart": "HRB",
      "company_name": "Bosch Engineering GmbH",
      "company_seat": "Abstatt",
      "details": "29.11.2024 (Bekanntmachungsdatum)\n\nBaden-Württemberg Amtsgericht Stuttgart HRB 746374\nEinreichung neuer Dokumente 29.11.2024 (Eintragungsdatum)\n\nBosch Engineering GmbH\nGesellschaft mit beschränkter Haftung\nAbstatt\n\nDie Gesellschaft hat am 28.11.2024 die Liste über die Zusammensetzung des Aufsichtsrats zum Handelsregister eingereicht."
    },
    {
      "date": "2024-11-29",
      "id": "94986",
      "original_text": "Registerbekanntmachung nach dem Umwandlungsgesetz\nMecklenburg-Vorpommern Amtsgericht Rostock HRB 3609\nBrinkmann GmbH – Güstrow",
      "type": "Registerbekanntmachung nach dem Umwandlungsgesetz",
      "state": "Mecklenburg-Vorpommern",
      "amtsgericht": "Amtsgericht Rostock",
      "registernummer": "HRB 3609",
      "registerart": "HRB",
      "company_name": "Brinkmann GmbH",
      "company_seat": "Güstrow",
      "details": "29.11.2024 (Bekanntmachungsdatum)\n\nMecklenburg-Vorpommern Amtsgericht Rostock HRB 3609\nRegisterbekanntmachung nach dem Umwandlungsgesetz 29.11.2024 (Eintragungsdatum)\n\nBrinkmann GmbH\nGesellschaft mit beschränkter Haftung\nGüstrow\n\nDen Gläubigern der an der Verschmelzung beteiligten Rechtsträger ist, wenn sie binnen sechs Monaten nach dem Tag, an dem die Eintragung der Verschmelzung in das Register des Sitzes desjenigen Rechtsträgers, dessen Gläubiger sie sind, nach § 19 Abs. 3 UmwG als bekannt gemacht gilt, ihren Anspruch nach Grund und Höhe schriftlich anmelden, Sicherheit zu leisten, soweit sie nicht Befriedigung verlangen können. Dieses Recht steht den Gläubigern jedoch nur zu, wenn sie glaubhaft machen, dass durch die Verschmelzung die Erfüllung der Forderung gefährdet wird."
    },
    {
      "date": "2024-11-29",
      "id": "94999",
      "original_text": "Einreichung neuer Dokumente\nBerlin Amtsgericht Berlin (Charlottenburg) HRB 151518\nChristburg Campus gemeinnützige GmbH – Berlin",
      "type": "Einreichung neuer Dokumente",
      "state": "Berlin",
      "amtsgericht": "Amtsgericht Berlin (Charlottenburg)",
      "registernummer": "HRB 151518",
      "registerart": "HRB",
      "company_name": "Christburg Campus gemeinnützige GmbH",
      "company_seat": "Berlin",
      "details": "29.11.2024 (Bekanntmachungsdatum)\n\nBerlin Amtsgericht Berlin (Charlottenburg) HRB 151518\nEinreichung neuer Dokumente\n\nChristburg Campus gemeinnützige GmbH\nGesellschaft mit beschränkter Haftung\nBerlin\n\nAls nicht eingetragen wird veröffentlicht: Es wurde eine neue Liste der Aufsichtsratsmitglieder eingereicht (§52 GmbHG)."
    },
    {
      "date": "2024-11-29",
      "id": "94971",
      "original_text": "Registerbekanntmachung nach dem Umwandlungsgesetz\nBayern Amtsgericht Nürnberg HRB 26176\nClean Express GmbH – Nürnberg",
      "type": "Registerbekanntmachung nach dem Umwandlungsgesetz",
      "state": "Bayern",
      "amtsgericht": "Amtsgericht Nürnberg",
      "registernummer": "HRB 26176",
      "registerart": "HRB",
      "company_name": "Clean Express GmbH",
      "company_seat": "Nürnberg",
      "details": "29.11.2024 (Bekanntmachungsdatum)\n\nBayern Amtsgericht Nürnberg HRB 26176\nRegisterbekanntmachung nach dem Umwandlungsgesetz 28.11.2024 (Eintragungsdatum)\n\nClean Express GmbH\nGesellschaft mit beschränkter Haftung\nNürnberg\n\nDen Gläubigern der an der Verschmelzung beteiligten Rechtsträger ist, wenn sie binnen sechs Monaten nach dem Tag, an dem die Eintragung der Verschmelzung in das Register des Sitzes desjenigen Rechtsträgers, dessen Gläubiger sie sind, nach § 19 Abs. 3 UmwG als bekannt gemacht gilt, ihren Anspruch nach Grund und Höhe schriftlich anmelden, Sicherheit zu leisten, soweit sie nicht Befriedigung verlangen können. Dieses Recht steht den Gläubigern jedoch nur zu, wenn sie glaubhaft machen, dass durch die Verschmelzung die Erfüllung ihrer Forderung gefährdet wird."
    },
    {
      "date": "2024-11-29",
      "id": "94974",
      "original_text": "Registerbekanntmachung nach dem Umwandlungsgesetz\nBayern Amtsgericht Nürnberg HRB 40873\nCloud Mates GmbH – Nürnberg",
      "type": "Registerbekanntmachung nach dem Umwandlungsgesetz",
      "state": "Bayern",
      "amtsgericht": "Amtsgericht Nürnberg",
      "registernummer": "HRB 40873",
      "registerart": "HRB",
      "company_name": "Cloud Mates GmbH",
      "company_seat": "Nürnberg",
      "details": "29.11.2024 (Bekanntmachungsdatum)\n\nBayern Amtsgericht Nürnberg HRB 40873\nRegisterbekanntmachung nach dem Umwandlungsgesetz 28.11.2024 (Eintragungsdatum)\n\nCloud Mates GmbH\nGesellschaft mit beschränkter Haftung\nNürnberg\n\nDen Gläubigern der an der Verschmelzung beteiligten Rechtsträger ist, wenn sie binnen sechs Monaten nach dem Tag, an dem die Eintragung der Verschmelzung in das Register des Sitzes desjenigen Rechtsträgers, dessen Gläubiger sie sind, nach § 19 Abs. 3 UmwG als bekannt gemacht gilt, ihren Anspruch nach Grund und Höhe schriftlich anmelden, Sicherheit zu leisten, soweit sie nicht Befriedigung verlangen können. Dieses Recht steht den Gläubigern jedoch nur zu, wenn sie glaubhaft machen, dass durch die Verschmelzung die Erfüllung ihrer Forderung gefährdet wird."
    },
    {
      "date": "2024-11-29",
      "id": "95017",
      "original_text": "Einreichung neuer Dokumente\nSachsen Amtsgericht Chemnitz HRB 18986\nDGS Dienstleistungsgesellschaft Stollberg mbH – Stollberg/Erzgeb.",
      "type": "Einreichung neuer Dokumente",
      "state": "Sachsen",
      "amtsgericht": "Amtsgericht Chemnitz",
      "registernummer": "HRB 18986",
      "registerart": "HRB",
      "company_name": "DGS Dienstleistungsgesellschaft Stollberg mbH",
      "company_seat": "Stollberg/Erzgeb.",
      "details": "29.11.2024 (Bekanntmachungsdatum)\n\nSachsen Amtsgericht Chemnitz HRB 18986\nEinreichung neuer Dokumente\n\nDGS Dienstleistungsgesellschaft Stollberg mbH\nGesellschaft mit beschränkter Haftung\nStollberg/Erzgeb.\n\nAm 12.11.2024 wurde beim Handelsregister des Amtsgerichts Chemnitz die Liste der Mitglieder des Aufsichtsrats gemäß § 52 GmbHG eingereicht."
    },
    {
      "date": "2024-11-29",
      "id": "95011",
      "original_text": "Registerbekanntmachung nach dem Umwandlungsgesetz\nSachsen-Anhalt Amtsgericht Stendal HRB 215479\nDHS Daten- und Systemservice GmbH – Kayna",
      "type": "Registerbekanntmachung nach dem Umwandlungsgesetz",
      "state": "Sachsen-Anhalt",
      "amtsgericht": "Amtsgericht Stendal",
      "registernummer": "HRB 215479",
      "registerart": "HRB",
      "company_name": "DHS Daten- und Systemservice GmbH",
      "company_seat": "Kayna",
      "details": "29.11.2024 (Bekanntmachungsdatum)\n\nSachsen-Anhalt Amtsgericht Stendal HRB 215479\nRegisterbekanntmachung nach dem Umwandlungsgesetz 29.11.2024 (Eintragungsdatum)\n\nDHS Daten- und Systemservice GmbH\nGesellschaft mit beschränkter Haftung\nKayna\n\nNicht eingetragen:\nDen Gläubigern der an der Verschmelzung beteiligten Rechtsträger ist, wenn sie binnen sechs Monaten nach dem Tag, an dem die Eintragung der Verschmelzung nach § 19 Abs. 3 UmwG als bekanntgemacht gilt, ihren Anspruch nach Grund und Höhe schriftlich anmelden, Sicherheit zu leisten, soweit sie nicht Befriedigung verlangen können. Dieses Recht steht ihnen jedoch nur zu, wenn sie glaubhaft machen, dass durch die Verschmelzung die Erfüllung ihrer Forderung gefährdet wird."
    },
    {
      "date": "2024-11-29",
      "id": "95014",
      "original_text": "Löschungsankündigung\nSachsen Amtsgericht Dresden HRB 44591\nDragonstars Studios UG (haftungsbeschränkt) – Dresden",
      "type": "Löschungsankündigung",
      "state": "Sachsen",
      "amtsgericht": "Amtsgericht Dresden",
      "registernummer": "HRB 44591",
      "registerart": "HRB",
      "company_name": "Dragonstars Studios UG (haftungsbeschränkt)",
      "company_seat": "Dresden",
      "details": "29.11.2024 (Bekanntmachungsdatum)\n\nSachsen Amtsgericht Dresden HRB 44591\nLöschungsankündigung\n\nDragonstars Studios UG (haftungsbeschränkt)\nGesellschaft mit beschränkter Haftung\nDresden\n\nDas Registergericht beabsichtigt, die im Handelsregister eingetragene Gesellschaft von Amts wegen nach § 394 FamFG zu löschen. Die Frist zu Erhebung eines Widerspruchs gegen die beabsichtigte Löschung wird auf einen Monat festgesetzt."
    },
    {
      "date": "2024-11-29",
      "id": "95050",
      "original_text": "Registerbekanntmachung nach dem Umwandlungsgesetz\nHessen Amtsgericht Hanau HRB 98677\nEdison 8 GmbH – Maintal",
      "type": "Registerbekanntmachung nach dem Umwandlungsgesetz",
      "state": "Hessen",
      "amtsgericht": "Amtsgericht Hanau",
      "registernummer": "HRB 98677",
      "registerart": "HRB",
      "company_name": "Edison 8 GmbH",
      "company_seat": "Maintal",
      "details": "29.11.2024 (Bekanntmachungsdatum)\n\nHessen Amtsgericht Hanau HRB 98677\nRegisterbekanntmachung nach dem Umwandlungsgesetz 29.11.2024 (Eintragungsdatum)\n\nEdison 8 GmbH\nGesellschaft mit beschränkter Haftung\nMaintal\n\nDen Gläubigern der an der Verschmelzung beteiligten Rechtsträger ist, wenn sie binnen sechs Monaten nach dem Tag, an dem die Eintragung der Verschmelzung in das Register des Sitzes desjenigen Rechtsträgers, dessen Gläubiger sie sind, nach § 19 Absatz 3 UmwG bekannt gemacht worden ist, ihren Anspruch nach Grund und Höhe schriftlich anmelden, Sicherheit zu leisten, soweit sie nicht Befriedigung verlangen können. Dieses Recht steht den Gläubigern jedoch nur zu, wenn sie glaubhaft machen, dass durch die Verschmelzung die Erfüllung ihrer Forderung gefährdet wird."
    },
    {
      "date": "2024-11-29",
      "id": "94992",
      "original_text": "Einreichung neuer Dokumente\nBaden-Württemberg Amtsgericht Mannheim HRB 441806\nEnBW Kernkraft GmbH – Obrigheim",
      "type": "Einreichung neuer Dokumente",
      "state": "Baden-Württemberg",
      "amtsgericht": "Amtsgericht Mannheim",
      "registernummer": "HRB 441806",
      "registerart": "HRB",
      "company_name": "EnBW Kernkraft GmbH",
      "company_seat": "Obrigheim",
      "details": "29.11.2024 (Bekanntmachungsdatum)\n\nBaden-Württemberg Amtsgericht Mannheim HRB 441806\nEinreichung neuer Dokumente\n\nEnBW Kernkraft GmbH\nGesellschaft mit beschränkter Haftung\nObrigheim\n\nDie Gesellschaft hat am 29.11.2024 die Liste über die Zusammensetzung des Aufsichtsrats zum Handelsregister eingereicht."
    },
    {
      "date": "2024-11-29",
      "id": "94979",
      "original_text": "Einreichung neuer Dokumente\nBayern Amtsgericht Aschaffenburg HRB 7021\nEnergieversorgung Alzenau GmbH (EVA) – Alzenau",
      "type": "Einreichung neuer Dokumente",
      "state": "Bayern",
      "amtsgericht": "Amtsgericht Aschaffenburg",
      "registernummer": "HRB 7021",
      "registerart": "HRB",
      "company_name": "Energieversorgung Alzenau GmbH (EVA)",
      "company_seat": "Alzenau",
      "details": "29.11.2024 (Bekanntmachungsdatum)\n\nBayern Amtsgericht Aschaffenburg HRB 7021\nEinreichung neuer Dokumente 28.11.2024 (Eintragungsdatum)\n\nEnergieversorgung Alzenau GmbH (EVA)\nGesellschaft mit beschränkter Haftung\nAlzenau\n\nDem Amtsgericht Aschaffenburg -Registergericht- ist eine Liste der Mitglieder des Aufsichtsrats eingereicht worden, § 52 Abs. 3 S. 2 GmbHG."
    },
    {
      "date": "2024-11-29",
      "id": "95049",
      "original_text": "Einreichung neuer Dokumente\nHessen Amtsgericht Bad Homburg v.d.H. HRB 10025\nEquita GmbH & Co. Holding KGaA – Bad Homburg v.d.Höhe",
      "type": "Einreichung neuer Dokumente",
      "state": "Hessen",
      "amtsgericht": "Amtsgericht Bad Homburg v.d.H.",
      "registernummer": "HRB 10025",
      "registerart": "HRB",
      "company_name": "Equita GmbH & Co. Holding KGaA",
      "company_seat": "Bad Homburg v.d.Höhe",
      "details": "29.11.2024 (Bekanntmachungsdatum)\n\nHessen Amtsgericht Bad Homburg v.d.H. HRB 10025\nEinreichung neuer Dokumente\n\nEquita GmbH & Co. Holding KGaA\nKommanditgesellschaft auf Aktien\nBad Homburg v.d.Höhe\n\nDurch eine Änderung in den Personen der Aufsichtsratsmitglieder ist eine Liste der Mitglieder des Aufsichtsrates zum Handelsregister eingereicht worden."
    },
    {
      "date": "2024-11-29",
      "id": "95002",
      "original_text": "Sonstige Registerbekanntmachung\nThüringen Amtsgericht Jena HRB 109791\nErfurt Tourismus und Marketing GmbH – Erfurt",
      "type": "Sonstige Registerbekanntmachung",
      "state": "Thüringen",
      "amtsgericht": "Amtsgericht Jena",
      "registernummer": "HRB 109791",
      "registerart": "HRB",
      "company_name": "Erfurt Tourismus und Marketing GmbH",
      "company_seat": "Erfurt",
      "details": "29.11.2024 (Bekanntmachungsdatum)\n\nThüringen Amtsgericht Jena HRB 109791\nSonstige Registerbekanntmachung\n\nErfurt Tourismus und Marketing GmbH\nGesellschaft mit beschränkter Haftung\nErfurt\n\nBekanntmachung gem. § 52 Abs. 3 Satz 2 GmbHG: Aufgrund einer Veränderung in den Personen der Aufsichtsratsmitglieder ist durch die Geschäftsführer eine neue Liste zum Handelsregister eingereicht worden."
    },
    {
      "date": "2024-11-29",
      "id": "95031",
      "original_text": "Registerbekanntmachung nach dem Umwandlungsgesetz\nNordrhein-Westfalen Amtsgericht Recklinghausen HRA 892\nErlmann GmbH & Co. KG – Herten",
      "type": "Registerbekanntmachung nach dem Umwandlungsgesetz",
      "state": "Nordrhein-Westfalen",
      "amtsgericht": "Amtsgericht Recklinghausen",
      "registernummer": "HRA 892",
      "registerart": "HRA",
      "company_name": "Erlmann GmbH & Co. KG",
      "company_seat": "Herten",
      "details": "29.11.2024 (Bekanntmachungsdatum)\n\nNordrhein-Westfalen Amtsgericht Recklinghausen HRA 892\nRegisterbekanntmachung nach dem Umwandlungsgesetz 29.11.2024 (Eintragungsdatum)\n\nErlmann GmbH & Co. KG\nKommanditgesellschaft\nHerten\n\nDen Gläubigern der an der Verschmelzung beteiligten Rechtsträger ist, wenn sie binnen sechs Monaten nach dem Tag, an dem die Eintragung der Verschmelzung in das Register des Sitzes desjenigen Rechtsträgers, dessen Gläubiger sie sind, nach § 19 Absatz 3 UmwG als bekanntgemacht gilt, ihren Anspruch nach Grund und Höhe schriftlich anmelden, Sicherheit zu leisten, soweit sie nicht Befriedigung verlangen können. Dieses Recht steht den Gläubigern jedoch nur zu, wenn sie glaubhaft machen, dass durch die Verschmelzung die Erfüllung ihrer Forderung gefährdet wird."
    },
    {
      "date": "2024-11-29",
      "id": "94983",
      "original_text": "Löschungsankündigung\nBaden-Württemberg Amtsgericht Stuttgart HRB 770991\nFair Foods GmbH – Heilbronn",
      "type": "Löschungsankündigung",
      "state": "Baden-Württemberg",
      "amtsgericht": "Amtsgericht Stuttgart",
      "registernummer": "HRB 770991",
      "registerart": "HRB",
      "company_name": "Fair Foods GmbH",
      "company_seat": "Heilbronn",
      "details": "29.11.2024 (Bekanntmachungsdatum)\n\nBaden-Württemberg Amtsgericht Stuttgart HRB 770991\nLöschungsankündigung\n\nFair Foods GmbH\nGesellschaft mit beschränkter Haftung\nHeilbronn\n\nAls nicht eingetragen wird bekanntgemacht:\nDas Gericht beabsichtigt, die Gesellschaft wegen Vermögenslosigkeit im Handelsregister von Amts wegen nach § 394 FamFG zu löschen. Die Frist zur Geltendmachung eines Widerspruchs gegen die beabsichtigte Löschung ist auf zwei Monate ab Veröffentlichung bestimmt."
    },
    {
      "date": "2024-11-29",
      "id": "95019",
      "original_text": "Einreichung neuer Dokumente\nSachsen Amtsgericht Dresden HRB 1187\nFlughafen Dresden Gesellschaft mit beschränkter Haftung – Dresden",
      "type": "Einreichung neuer Dokumente",
      "state": "Sachsen",
      "amtsgericht": "Amtsgericht Dresden",
      "registernummer": "HRB 1187",
      "registerart": "HRB",
      "company_name": "Flughafen Dresden Gesellschaft mit beschränkter Haftung",
      "company_seat": "Dresden",
      "details": "29.11.2024 (Bekanntmachungsdatum)\n\nSachsen Amtsgericht Dresden HRB 1187\nEinreichung neuer Dokumente\n\nFlughafen Dresden Gesellschaft mit beschränkter Haftung\nGesellschaft mit beschränkter Haftung\nDresden\n\nAm 28.11.2024 wurde beim Handelsregister des Amtsgerichts Dresden die Liste der Mitglieder des Aufsichtsrats gemäß § 52 GmbHG eingereicht."
    },
    {
      "date": "2024-11-29",
      "id": "95021",
      "original_text": "Registerbekanntmachung nach dem Umwandlungsgesetz\nSachsen Amtsgericht Chemnitz VR 6709\nFörderverein Schloss Wildeck e.V. – Zschopau",
      "type": "Registerbekanntmachung nach dem Umwandlungsgesetz",
      "state": "Sachsen",
      "amtsgericht": "Amtsgericht Chemnitz",
      "registernummer": "VR 6709",
      "registerart": "VR",
      "company_name": "Förderverein Schloss Wildeck e.V.",
      "company_seat": "Zschopau",
      "details": "29.11.2024 (Bekanntmachungsdatum)\n\nSachsen Amtsgericht Chemnitz VR 6709\nRegisterbekanntmachung nach dem Umwandlungsgesetz 29.11.2024 (Eintragungsdatum)\n\nFörderverein Schloss Wildeck e.V.\neingetragener Verein\nZschopau\n\nDen Gläubigern der an der Verschmelzung beteiligten Rechtsträger ist, wenn sie binnen sechs Monaten nach dem Tag, an dem die Eintragung der Verschmelzung in das Register des Sitzes desjenigen Rechtsträgers, dessen Gläubiger sie sind, nach § 19 Abs. 3 UmwG als bekannt gemacht gilt, ihren Anspruch nach Grund und Höhe schriftlich anmelden, Sicherheit zu leisten, soweit sie nicht Befriedigung verlangen können. Dieses Recht steht den Gläubigern jedoch nur zu, wenn sie glaubhaft machen, dass durch die Verschmelzung die Erfüllung der Forderung gefährdet wird."
    },
    {
      "date": "2024-11-29",
      "id": "95042",
      "original_text": "Löschungsankündigung\nNordrhein-Westfalen Amtsgericht Hamm HRB 8786\nG M M Gesellschaft für Media Marketing mbH – Hamm",
      "type": "Löschungsankündigung",
      "state": "Nordrhein-Westfalen",
      "amtsgericht": "Amtsgericht Hamm",
      "registernummer": "HRB 8786",
      "registerart": "HRB",
      "company_name": "G M M Gesellschaft für Media Marketing mbH",
      "company_seat": "Hamm",
      "details": "29.11.2024 (Bekanntmachungsdatum)\n\nNordrhein-Westfalen Amtsgericht Hamm HRB 8786\nLöschungsankündigung\n\nG M M Gesellschaft für Media Marketing mbH\nGesellschaft mit beschränkter Haftung\nHamm\n\nDas Registergericht beabsichtigt die Gesellschaft von Amts wegen nach § 394 FamFG zu löschen. Die Frist zur Erhebung eines Widerspruchs ist auf drei Monate festgesetzt."
    },
    {
      "date": "2024-11-29",
      "id": "95024",
      "original_text": "Registerbekanntmachung nach dem Umwandlungsgesetz\nNiedersachsen Amtsgericht Osnabrück HRB 218906\nGTM Beteiligungen GmbH – Werlte",
      "type": "Registerbekanntmachung nach dem Umwandlungsgesetz",
      "state": "Niedersachsen",
      "amtsgericht": "Amtsgericht Osnabrück",
      "registernummer": "HRB 218906",
      "registerart": "HRB",
      "company_name": "GTM Beteiligungen GmbH",
      "company_seat": "Werlte",
      "details": "29.11.2024 (Bekanntmachungsdatum)\n\nNiedersachsen Amtsgericht Osnabrück HRB 218906\nRegisterbekanntmachung nach dem Umwandlungsgesetz 29.11.2024 (Eintragungsdatum)\n\nGTM Beteiligungen GmbH\nGesellschaft mit beschränkter Haftung\nWerlte\n\nDen Gläubigern der an der formwechselnden Umwandlung beteiligten Rechtsträger ist, wenn sie binnen sechs Monaten nach dem Tag, an dem die Eintragung der Umwandlung in das Register des Sitzes desjenigen Rechtsträgers, dessen Gläubiger sie sind, nach § 19 Abs. 3 UmwG als bekannt gemacht gilt, ihren Anspruch nach Grund und Höhe schriftlich anmelden, Sicherheit zu leisten, soweit sie nicht Befriedigung verlangen können. Dieses Recht steht den Gläubigern jedoch nur zu, wenn sie glaubhaft machen, dass durch die formwechselnde Umwandlung die Erfüllung der Forderung gefährdet wird."
    },
    {
      "date": "2024-11-29",
      "id": "95018",
      "original_text": "Einreichung neuer Dokumente\nSachsen Amtsgericht Chemnitz HRB 4485\nGesellschaft für Wohnungsbau mbH Stollberg – Stollberg/Erzgeb.",
      "type": "Einreichung neuer Dokumente",
      "state": "Sachsen",
      "amtsgericht": "Amtsgericht Chemnitz",
      "registernummer": "HRB 4485",
      "registerart": "HRB",
      "company_name": "Gesellschaft für Wohnungsbau mbH Stollberg",
      "company_seat": "Stollberg/Erzgeb.",
      "details": "29.11.2024 (Bekanntmachungsdatum)\n\nSachsen Amtsgericht Chemnitz HRB 4485\nEinreichung neuer Dokumente\n\nGesellschaft für Wohnungsbau mbH Stollberg\nGesellschaft mit beschränkter Haftung\nStollberg/Erzgeb.\n\nAm 12.11.2024 wurde beim Handelsregister des Amtsgerichts Chemnitz die Liste der Mitglieder des Aufsichtsrats gemäß § 52 GmbHG eingereicht."
    },
    {
      "date": "2024-11-29",
      "id": "95048",
      "original_text": "Löschungsankündigung\nHessen Amtsgericht Frankfurt am Main HRB 120073\nGylines GmbH – Frankfurt am Main",
      "type": "Löschungsankündigung",
      "state": "Hessen",
      "amtsgericht": "Amtsgericht Frankfurt am Main",
      "registernummer": "HRB 120073",
      "registerart": "HRB",
      "company_name": "Gylines GmbH",
      "company_seat": "Frankfurt am Main",
      "details": "29.11.2024 (Bekanntmachungsdatum)\n\nHessen Amtsgericht Frankfurt am Main HRB 120073\nLöschungsankündigung\n\nGylines GmbH\nGesellschaft mit beschränkter Haftung\nFrankfurt am Main\n\nDas Registergericht beabsichtigt die im Handelsregister eingetragene Gesellschaft von Amts wegen nach § 394 FamFG zu löschen. Die Frist zur Erhebung eines Widerspruchs gegen die beabsichtigte Löschung wird auf 1 Monate festgesetzt."
    },
    {
      "date": "2024-11-29",
      "id": "95025",
      "original_text": "Löschungsankündigung\nNiedersachsen Amtsgericht Hildesheim HRB 206008\nHCP Verwaltungs GmbH – Peine",
      "type": "Löschungsankündigung",
      "state": "Niedersachsen",
      "amtsgericht": "Amtsgericht Hildesheim",
      "registernummer": "HRB 206008",
      "registerart": "HRB",
      "company_name": "HCP Verwaltungs GmbH",
      "company_seat": "Peine",
      "details": "29.11.2024 (Bekanntmachungsdatum)\n\nNiedersachsen Amtsgericht Hildesheim HRB 206008\nLöschungsankündigung\n\nHCP Verwaltungs GmbH\nGesellschaft mit beschränkter Haftung\nPeine\n\nDas Registergericht beabsichtigt, die Gesellschaft von Amts wegen nach § 394 FamFG zu löschen. Die Frist zur Erhebung eines Widerspruchs ist auf 1 Monat ab dieser Registerbekanntmachung festgesetzt."
    },
    {
      "date": "2024-11-29",
      "id": "94997",
      "original_text": "Sonstige Registerbekanntmachung\nBaden-Württemberg Amtsgericht Stuttgart HRB 751763\nHP Deutschland GmbH – Böblingen",
      "type": "Sonstige Registerbekanntmachung",
      "state": "Baden-Württemberg",
      "amtsgericht": "Amtsgericht Stuttgart",
      "registernummer": "HRB 751763",
      "registerart": "HRB",
      "company_name": "HP Deutschland GmbH",
      "company_seat": "Böblingen",
      "details": "29.11.2024 (Bekanntmachungsdatum)\n\nBaden-Württemberg Amtsgericht Stuttgart HRB 751763\nSonstige Registerbekanntmachung 29.11.2024 (Eintragungsdatum)\n\nHP Deutschland GmbH\nGesellschaft mit beschränkter Haftung\nBöblingen\n\nDen Gläubigern der Gesellschaft, deren Forderungen begründet worden sind, bevor die Eintragung der Beendigung des Vertrages in das Handelsregister nach § 10 HGB als bekanntgemacht gilt, ist vom anderen Vertragsteil Sicherheit zu leisten, wenn sie sich binnen sechs Monaten nach der Bekanntmachung zu diesem Zweck bei ihm melden."
    },
    {
      "date": "2024-11-29",
      "id": "95003",
      "original_text": "Einreichung neuer Dokumente\nThüringen Amtsgericht Jena HRB 522294\nHenneberg-Kliniken-Management GmbH – Hildburghausen",
      "type": "Einreichung neuer Dokumente",
      "state": "Thüringen",
      "amtsgericht": "Amtsgericht Jena",
      "registernummer": "HRB 522294",
      "registerart": "HRB",
      "company_name": "Henneberg-Kliniken-Management GmbH",
      "company_seat": "Hildburghausen",
      "details": "29.11.2024 (Bekanntmachungsdatum)\n\nThüringen Amtsgericht Jena HRB 522294\nEinreichung neuer Dokumente 25.11.2024 (Eintragungsdatum)\n\nHenneberg-Kliniken-Management GmbH\nGesellschaft mit beschränkter Haftung\nHildburghausen\n\nBekanntmachung gem. § 52 Abs. 3 Satz 2 GmbHG: Aufgrund einer Veränderung in den Personen der Aufsichtsratsmitglieder ist durch die Geschäftsführer eine neue Liste zum Handelsregister eingereicht worden."
    },
    {
      "date": "2024-11-29",
      "id": "94970",
      "original_text": "Registerbekanntmachung nach dem Umwandlungsgesetz\nBayern Amtsgericht Passau HRB 9821\nHistory Trader AG – Windorf",
      "type": "Registerbekanntmachung nach dem Umwandlungsgesetz",
      "state": "Bayern",
      "amtsgericht": "Amtsgericht Passau",
      "registernummer": "HRB 9821",
      "registerart": "HRB",
      "company_name": "History Trader AG",
      "company_seat": "Windorf",
      "details": "29.11.2024 (Bekanntmachungsdatum)\n\nBayern Amtsgericht Passau HRB 9821\nRegisterbekanntmachung nach dem Umwandlungsgesetz 28.11.2024 (Eintragungsdatum)\n\nHistory Trader AG\nAktiengesellschaft\nWindorf\n\nDen Gläubigern der an der Spaltung beteiligten Rechtsträger ist, wenn sie binnen sechs Monaten nach dem Tag, an dem die Eintragung der Spaltung in das Register des Sitzes desjenigen Rechtsträgers, dessen Gläubiger sie sind, nach §§ 125, 19 Abs. 3 UmwG als bekannt gemacht gilt, ihren Anspruch nach Grund und Höhe schriftlich anmelden, Sicherheit zu leisten, soweit sie nicht Befriedigung verlangen können. Dieses Recht steht den Gläubigern jedoch nur zu, wenn sie glaubhaft machen, dass durch die Spaltung die Erfüllung ihrer Forderung gefährdet wird."
    },
    {
      "date": "2024-11-29",
      "id": "95035",
      "original_text": "Registerbekanntmachung nach dem Umwandlungsgesetz\nNordrhein-Westfalen Amtsgericht Bad Oeynhausen HRA 9126\nHäusliche Kranken- und Altenpflege, Inh. Britta Lehmann e.K. – Löhne",
      "type": "Registerbekanntmachung nach dem Umwandlungsgesetz",
      "state": "Nordrhein-Westfalen",
      "amtsgericht": "Amtsgericht Bad Oeynhausen",
      "registernummer": "HRA 9126",
      "registerart": "HRA",
      "company_name": "Häusliche Kranken- und Altenpflege, Inh. Britta Lehmann e.K.",
      "company_seat": "Löhne",
      "details": "29.11.2024 (Bekanntmachungsdatum)\n\nNordrhein-Westfalen Amtsgericht Bad Oeynhausen HRA 9126\nRegisterbekanntmachung nach dem Umwandlungsgesetz 29.11.2024 (Eintragungsdatum)\n\nHäusliche Kranken- und Altenpflege, Inh. Britta Lehmann e.K.\nEinzelkaufmann / Einzelkauffrau\nLöhne\n\nDen Gläubigern der an der Ausgliederung beteiligten Rechtsträger ist, wenn sie binnen sechs Monaten nach dem Tag, an dem die Eintragung der Ausgliederung in das Register des Sitzes desjenigen Rechtsträgers, dessen Gläubiger sie sind, nach § 19 Absatz 3 UmwG als bekanntgemacht gilt, ihren Anspruch nach Grund und Höhe schriftlich anmelden, Sicherheit zu leisten, soweit sie nicht Befriedigung verlangen können. Dieses Recht steht den Gläubigern jedoch nur zu, wenn sie glaubhaft machen, dass durch die Ausgliederung die Erfüllung ihrer Forderung gefährdet wird."
    },
    {
      "date": "2024-11-29",
      "id": "94991",
      "original_text": "Registerbekanntmachung nach dem Umwandlungsgesetz\nBaden-Württemberg Amtsgericht Mannheim HRB 723887\nINTER Krankenversicherung AG – Mannheim",
      "type": "Registerbekanntmachung nach dem Umwandlungsgesetz",
      "state": "Baden-Württemberg",
      "amtsgericht": "Amtsgericht Mannheim",
      "registernummer": "HRB 723887",
      "registerart": "HRB",
      "company_name": "INTER Krankenversicherung AG",
      "company_seat": "Mannheim",
      "details": "29.11.2024 (Bekanntmachungsdatum)\n\nBaden-Württemberg Amtsgericht Mannheim HRB 723887\nRegisterbekanntmachung nach dem Umwandlungsgesetz 29.11.2024 (Eintragungsdatum)\n\nINTER Krankenversicherung AG\nAktiengesellschaft\nMannheim\n\nDen Gläubigern der an der Vermögensübertragung beteiligten Rechtsträger ist, wenn sie binnen sechs Monaten nach dem Tag, an dem die Eintragung der Vermögensübertragung in das Register des Sitzes desjenigen Rechtsträgers, dessen Gläubiger sie sind, nach § 19 Abs. 3 UmwG als bekanntgemacht gilt, ihren Anspruch nach Grund und Höhe schriftlich anmelden, Sicherheit zu leisten, soweit sie nicht Befriedigung verlangen können. Dieses Recht steht den Gläubigern jedoch nur zu, wenn sie glaubhaft machen, dass durch die Vermögensübertragung die Erfüllung ihrer Forderung gefährdet wird."
    },
    {
      "date": "2024-11-29",
      "id": "95004",
      "original_text": "Löschungsankündigung\nBerlin Amtsgericht Berlin (Charlottenburg) HRB 149239\nIUP Vermögensverwaltungs GmbH – Berlin",
      "type": "Löschungsankündigung",
      "state": "Berlin",
      "amtsgericht": "Amtsgericht Berlin (Charlottenburg)",
      "registernummer": "HRB 149239",
      "registerart": "HRB",
      "company_name": "IUP Vermögensverwaltungs GmbH",
      "company_seat": "Berlin",
      "details": "29.11.2024 (Bekanntmachungsdatum)\n\nBerlin Amtsgericht Berlin (Charlottenburg) HRB 149239\nLöschungsankündigung\n\nIUP Vermögensverwaltungs GmbH\nGesellschaft mit beschränkter Haftung\nBerlin\n\nBei der nachstehenden Gesellschaft wird das Amtslöschungsverfahren gemäß § 394 FamFG eingeleitet. Widerspruchsfrist 6 Wochen"
    },
    {
      "date": "2024-11-29",
      "id": "94985",
      "original_text": "Löschungsankündigung\nBaden-Württemberg Amtsgericht Mannheim HRB 709530\nKK Verwaltungs- und Beteiligungs AG – Karlsruhe",
      "type": "Löschungsankündigung",
      "state": "Baden-Württemberg",
      "amtsgericht": "Amtsgericht Mannheim",
      "registernummer": "HRB 709530",
      "registerart": "HRB",
      "company_name": "KK Verwaltungs- und Beteiligungs AG",
      "company_seat": "Karlsruhe",
      "details": "29.11.2024 (Bekanntmachungsdatum)\n\nBaden-Württemberg Amtsgericht Mannheim HRB 709530\nLöschungsankündigung\n\nKK Verwaltungs- und Beteiligungs AG\nAktiengesellschaft\nKarlsruhe\n\nDas Gericht beabsichtigt, die Gesellschaft wegen Vermögenslosigkeit im Handelsregister von Amts wegen nach § 394 FamFG zu löschen. Die Frist zur Geltendmachung eines Widerspruchs gegen die beabsichtigte Löschung ist auf einen Monat ab Veröffentlichung bestimmt."
    },
    {
      "date": "2024-11-29",
      "id": "95027",
      "original_text": "Löschungsankündigung\nRheinland-Pfalz Amtsgericht Landau HRB 32194\nKK-Bausanierung GmbH – Edenkoben",
      "type": "Löschungsankündigung",
      "state": "Rheinland-Pfalz",
      "amtsgericht": "Amtsgericht Landau",
      "registernummer": "HRB 32194",
      "registerart": "HRB",
      "company_name": "KK-Bausanierung GmbH",
      "company_seat": "Edenkoben",
      "details": "29.11.2024 (Bekanntmachungsdatum)\n\nRheinland-Pfalz Amtsgericht Landau HRB 32194\nLöschungsankündigung\n\nKK-Bausanierung GmbH\nGesellschaft mit beschränkter Haftung\nEdenkoben\n\nDas Registergericht beabsichtigt die Gesellschaft von Amts wegen nach § 394 FamFG zu löschen. Die Frist zur Erhebung eines Widerspruchs ist auf einen Monat festgesetzt."
    },
    {
      "date": "2024-11-29",
      "id": "95007",
      "original_text": "Löschungsankündigung\nSchleswig-Holstein Amtsgericht Flensburg HRB 1433\nKRISTRONICS GmbH – Harrislee",
      "type": "Löschungsankündigung",
      "state": "Schleswig-Holstein",
      "amtsgericht": "Amtsgericht Flensburg",
      "registernummer": "HRB 1433",
      "registerart": "HRB",
      "company_name": "KRISTRONICS GmbH",
      "company_seat": "Harrislee",
      "details": "29.11.2024 (Bekanntmachungsdatum)\n\nSchleswig-Holstein Amtsgericht Flensburg HRB 1433\nLöschungsankündigung\n\nKRISTRONICS GmbH\nGesellschaft mit beschränkter Haftung\nHarrislee\n\nBerichtigung\nAm 25.11.2024 wurde eine Löschungsankündigung bekannt gemacht.\nDiese Löschungsankündigung wurde fälschlicherweise zu dieser Gesellschaft veröffentlicht. Durch einen Zahlendreher wurde die für eine andere Gesellschaft bestimmte Löschungsankündigung bei der KRISTRONICS GmbH mit dem Sitz in Harrislee veröffentlicht.\nDie KRISTRONICS GmbH mit dem Sitz in Harrislee, eingetragen im Handelsregister des Amtsgerichts Flensburg unter HRB 1433 FL, soll NICHT gelöscht werden. Es ist kein Verfahren anhängig, insbesondere kein Löschungsverfahren."
    },
    {
      "date": "2024-11-29",
      "id": "95033",
      "original_text": "Sonstige Registerbekanntmachung\nNordrhein-Westfalen Amtsgericht Köln HRB 87208\nKaufhof Düsseldorf Königsallee GmbH – Köln",
      "type": "Sonstige Registerbekanntmachung",
      "state": "Nordrhein-Westfalen",
      "amtsgericht": "Amtsgericht Köln",
      "registernummer": "HRB 87208",
      "registerart": "HRB",
      "company_name": "Kaufhof Düsseldorf Königsallee GmbH",
      "company_seat": "Köln",
      "details": "29.11.2024 (Bekanntmachungsdatum)\n\nNordrhein-Westfalen Amtsgericht Köln HRB 87208\nSonstige Registerbekanntmachung 29.11.2024 (Eintragungsdatum)\n\nKaufhof Düsseldorf Königsallee GmbH\nGesellschaft mit beschränkter Haftung\nKöln\n\nAls nicht eingetragen wird veröffentlicht: Den Gläubigern der Gesellschaft, deren Forderungen begründet worden sind bevor die Eintragung der Beendigung des Gewinnabführungsvertrages  in das Handelsregister nach § 10 des Handelsgesetzbuches als bekanntgemacht gilt, hat der andere Vertragsteil Sicherheit zu leisten, wenn sie sich binnen sechs Monaten nach der Bekanntmachung der Eintragung zu diesem Zweck bei ihm melden."
    },
    {
      "date": "2024-11-29",
      "id": "95006",
      "original_text": "Löschungsankündigung\nBerlin Amtsgericht Berlin (Charlottenburg) HRB 236847\nKoc Bauausführungen GmbH – Berlin",
      "type": "Löschungsankündigung",
      "state": "Berlin",
      "amtsgericht": "Amtsgericht Berlin (Charlottenburg)",
      "registernummer": "HRB 236847",
      "registerart": "HRB",
      "company_name": "Koc Bauausführungen GmbH",
      "company_seat": "Berlin",
      "details": "29.11.2024 (Bekanntmachungsdatum)\n\nBerlin Amtsgericht Berlin (Charlottenburg) HRB 236847\nLöschungsankündigung\n\nKoc Bauausführungen GmbH\nGesellschaft mit beschränkter Haftung\nBerlin\n\nBei der nachstehenden Gesellschaft wird das Amtslöschungsverfahren gemäß § 394 FamFG eingeleitet. Widerspruchsfrist 6 Wochen"
    },
    {
      "date": "2024-11-29",
      "id": "95016",
      "original_text": "Registerbekanntmachung nach dem Umwandlungsgesetz\nSachsen Amtsgericht Chemnitz VR 5877\nKultur und Begegnung Zschopau e.V. – Zschopau",
      "type": "Registerbekanntmachung nach dem Umwandlungsgesetz",
      "state": "Sachsen",
      "amtsgericht": "Amtsgericht Chemnitz",
      "registernummer": "VR 5877",
      "registerart": "VR",
      "company_name": "Kultur und Begegnung Zschopau e.V.",
      "company_seat": "Zschopau",
      "details": "29.11.2024 (Bekanntmachungsdatum)\n\nSachsen Amtsgericht Chemnitz VR 5877\nRegisterbekanntmachung nach dem Umwandlungsgesetz 29.11.2024 (Eintragungsdatum)\n\nKultur und Begegnung Zschopau e.V.\neingetragener Verein\nZschopau\n\nDen Gläubigern der an der Verschmelzung beteiligten Rechtsträger ist, wenn sie binnen sechs Monaten nach dem Tag, an dem die Eintragung der Verschmelzung in das Register des Sitzes desjenigen Rechtsträgers, dessen Gläubiger sie sind, nach § 19 Abs. 3 UmwG als bekannt gemacht gilt, ihren Anspruch nach Grund und Höhe schriftlich anmelden, Sicherheit zu leisten, soweit sie nicht Befriedigung verlangen können. Dieses Recht steht den Gläubigern jedoch nur zu, wenn sie glaubhaft machen, dass durch die Verschmelzung die Erfüllung der Forderung gefährdet wird."
    },
    {
      "date": "2024-11-29",
      "id": "95012",
      "original_text": "Löschungsankündigung\nBrandenburg Amtsgericht Frankfurt/Oder VR 6477\nKulturLINIEN e. V. – Oderberg",
      "type": "Löschungsankündigung",
      "state": "Brandenburg",
      "amtsgericht": "Amtsgericht Frankfurt/Oder",
      "registernummer": "VR 6477",
      "registerart": "VR",
      "company_name": "KulturLINIEN e. V.",
      "company_seat": "Oderberg",
      "details": "29.11.2024 (Bekanntmachungsdatum)\n\nBrandenburg Amtsgericht Frankfurt/Oder VR 6477\nLöschungsankündigung\n\nKulturLINIEN e. V.\neingetragener Verein\nOderberg\n\nBei dem nachstehenden Verein wird das Amtslöschungsverfahren gemäß § 395 FamFG eingeleitet."
    },
    {
      "date": "2024-11-29",
      "id": "95026",
      "original_text": "Registerbekanntmachung nach dem Umwandlungsgesetz\nRheinland-Pfalz Amtsgericht Wittlich HRA 42100\nL'Angolo Hotel e.K. – Trier",
      "type": "Registerbekanntmachung nach dem Umwandlungsgesetz",
      "state": "Rheinland-Pfalz",
      "amtsgericht": "Amtsgericht Wittlich",
      "registernummer": "HRA 42100",
      "registerart": "HRA",
      "company_name": "L'Angolo Hotel e.K.",
      "company_seat": "Trier",
      "details": "29.11.2024 (Bekanntmachungsdatum)\n\nRheinland-Pfalz Amtsgericht Wittlich HRA 42100\nRegisterbekanntmachung nach dem Umwandlungsgesetz 29.11.2024 (Eintragungsdatum)\n\nL'Angolo Hotel e.K.\nEinzelkaufmann / Einzelkauffrau\nTrier\n\nAls nicht eingetragen wird veröffentlicht: Den Gläubigern der an der Ausgliederung beteiligten Rechtsträger ist, wenn sie binnen sechs Monaten nach dem Tag, an dem die Eintragung der Ausgliederung in das Register des Sitzes desjenigen Rechtsträgers,dessen Gläubiger sie sind, nach § 19 Abs. 3 UmwG als bekannt gemacht gilt, ihren Anspruch nach Grund und Höhe schriftlich anmelden, Sicherheit zu leisten, soweit sie nicht Befriedigung verlangen können. Dieses Recht steht den Gläubigern jedoch nur zu, wenn sie glaubhaft machen, dass durch die Ausgliederung die Erfüllung der Forderung gefährdet wird."
    },
    {
      "date": "2024-11-29",
      "id": "94995",
      "original_text": "Löschungsankündigung\nBaden-Württemberg Amtsgericht Freiburg HRB 722329\nLA Prestige GmbH – Kehl",
      "type": "Löschungsankündigung",
      "state": "Baden-Württemberg",
      "amtsgericht": "Amtsgericht Freiburg",
      "registernummer": "HRB 722329",
      "registerart": "HRB",
      "company_name": "LA Prestige GmbH",
      "company_seat": "Kehl",
      "details": "29.11.2024 (Bekanntmachungsdatum)\n\nBaden-Württemberg Amtsgericht Freiburg HRB 722329\nLöschungsankündigung\n\nLA Prestige GmbH\nGesellschaft mit beschränkter Haftung\nKehl\n\nDas Gericht beabsichtigt, die Gesellschaft wegen Vermögenslosigkeit im Handelsregister von Amts wegen nach § 394 FamFG zu löschen. Die Frist zur Geltendmachung eines Widerspruchs gegen die beabsichtigte Löschung ist auf einen Monat ab Veröffentlichung bestimmt."
    },
    {
      "date": "2024-11-29",
      "id": "95015",
      "original_text": "Löschungsankündigung\nSachsen Amtsgericht Leipzig HRB 35775\nLa Cabilla UG (haftungsbeschränkt) – Böhlen",
      "type": "Löschungsankündigung",
      "state": "Sachsen",
      "amtsgericht": "Amtsgericht Leipzig",
      "registernummer": "HRB 35775",
      "registerart": "HRB",
      "company_name": "La Cabilla UG (haftungsbeschränkt)",
      "company_seat": "Böhlen",
      "details": "29.11.2024 (Bekanntmachungsdatum)\n\nSachsen Amtsgericht Leipzig HRB 35775\nLöschungsankündigung 29.11.2024 (Eintragungsdatum)\n\nLa Cabilla UG (haftungsbeschränkt)\nGesellschaft mit beschränkter Haftung\nBöhlen\n\nDas Registergericht beabsichtigt, die im Handelsregister eingetragene Gesellschaft von Amts wegen nach § 394 FamFG zu löschen. Die Frist zu Erhebung eines Widerspruchs gegen die beabsichtigte Löschung wird auf einen Monat festgesetzt."
    },
    {
      "date": "2024-11-29",
      "id": "95057",
      "original_text": "Registerbekanntmachung nach dem Umwandlungsgesetz\nHessen Amtsgericht Frankfurt am Main HRB 128865\nLifeFit Group MidCo GmbH – Frankfurt am Main",
      "type": "Registerbekanntmachung nach dem Umwandlungsgesetz",
      "state": "Hessen",
      "amtsgericht": "Amtsgericht Frankfurt am Main",
      "registernummer": "HRB 128865",
      "registerart": "HRB",
      "company_name": "LifeFit Group MidCo GmbH",
      "company_seat": "Frankfurt am Main",
      "details": "29.11.2024 (Bekanntmachungsdatum)\n\nHessen Amtsgericht Frankfurt am Main HRB 128865\nRegisterbekanntmachung nach dem Umwandlungsgesetz 29.11.2024 (Eintragungsdatum)\n\nLifeFit Group MidCo GmbH\nGesellschaft mit beschränkter Haftung\nFrankfurt am Main\n\nDen Gläubigern der an der Verschmelzung beteiligten Rechtsträger ist, wenn sie binnen sechs Monaten nach dem Tag, an dem die Eintragung der Verschmelzung in das Register des Sitzes desjenigen Rechtsträgers, dessen Gläubiger sie sind, nach § 19 Absatz 3 UmwG bekannt gemacht worden ist, ihren Anspruch nach Grund und Höhe schriftlich anmelden, Sicherheit zu leisten, soweit sie nicht Befriedigung verlangen können. Dieses Recht steht den Gläubigern jedoch nur zu, wenn sie glaubhaft machen, dass durch die Verschmelzung die Erfüllung ihrer Forderung gefährdet wird."
    },
    {
      "date": "2024-11-29",
      "id": "94978",
      "original_text": "Registerbekanntmachung nach dem Umwandlungsgesetz\nBayern Amtsgericht München HRB 294679\nM.R. Finanzplanung GmbH – Polling",
      "type": "Registerbekanntmachung nach dem Umwandlungsgesetz",
      "state": "Bayern",
      "amtsgericht": "Amtsgericht München",
      "registernummer": "HRB 294679",
      "registerart": "HRB",
      "company_name": "M.R. Finanzplanung GmbH",
      "company_seat": "Polling",
      "details": "29.11.2024 (Bekanntmachungsdatum)\n\nBayern Amtsgericht München HRB 294679\nRegisterbekanntmachung nach dem Umwandlungsgesetz 28.11.2024 (Eintragungsdatum)\n\nM.R. Finanzplanung GmbH\nGesellschaft mit beschränkter Haftung\nPolling\n\nDen Gläubigern der an der Ausgliederung beteiligten Rechtsträger ist, wenn sie binnen sechs Monaten nach dem Tag, an dem die Eintragung der Ausgliederung in das Register des Sitzes desjenigen Rechtsträgers, dessen Gläubiger sie sind, nach §§ 125, 19 Abs. 3 UmwG als bekannt gemacht gilt, ihren Anspruch nach Grund und Höhe schriftlich anmelden, Sicherheit zu leisten, soweit sie nicht Befriedigung verlangen können. Dieses Recht steht den Gläubigern jedoch nur zu, wenn sie glaubhaft machen, dass durch die Ausgliederung die Erfüllung ihrer Forderung gefährdet wird."
    },
    {
      "date": "2024-11-29",
      "id": "95058",
      "original_text": "Registerbekanntmachung nach dem Umwandlungsgesetz\nHessen Amtsgericht Frankfurt am Main HRB 134608\nMainsee 1544. V V GmbH – Frankfurt am Main",
      "type": "Registerbekanntmachung nach dem Umwandlungsgesetz",
      "state": "Hessen",
      "amtsgericht": "Amtsgericht Frankfurt am Main",
      "registernummer": "HRB 134608",
      "registerart": "HRB",
      "company_name": "Mainsee 1544. V V GmbH",
      "company_seat": "Frankfurt am Main",
      "details": "29.11.2024 (Bekanntmachungsdatum)\n\nHessen Amtsgericht Frankfurt am Main HRB 134608\nRegisterbekanntmachung nach dem Umwandlungsgesetz 29.11.2024 (Eintragungsdatum)\n\nMainsee 1544. V V GmbH\nGesellschaft mit beschränkter Haftung\nFrankfurt am Main\n\nDen Gläubigern der an der Verschmelzung beteiligten Rechtsträger ist, wenn sie binnen sechs Monaten nach dem Tag, an dem die Eintragung der Verschmelzung in das Register des Sitzes derjenigen Rechtsträger deren Gläubiger sie sind, nach § 19 Absatz 3 UmwG bekannt gemacht worden ist, ihren Anspruch nach Grund und Höhe schriftlich anmelden, Sicherheit zu leisten, soweit sie nicht Befriedigung verlangen können. Dieses Recht steht den Gläubigern jedoch nur zu, wenn sie glaubhaft machen, dass durch die Verschmelzung die Erfüllung ihrer Forderung gefährdet wird."
    },
    {
      "date": "2024-11-29",
      "id": "95043",
      "original_text": "Löschungsankündigung\nNordrhein-Westfalen Amtsgericht Münster HRB 19301\nMarina Plaue Projekt UG (haftungsbeschränkt) – Münster",
      "type": "Löschungsankündigung",
      "state": "Nordrhein-Westfalen",
      "amtsgericht": "Amtsgericht Münster",
      "registernummer": "HRB 19301",
      "registerart": "HRB",
      "company_name": "Marina Plaue Projekt UG (haftungsbeschränkt)",
      "company_seat": "Münster",
      "details": "29.11.2024 (Bekanntmachungsdatum)\n\nNordrhein-Westfalen Amtsgericht Münster HRB 19301\nLöschungsankündigung\n\nMarina Plaue Projekt UG (haftungsbeschränkt)\nGesellschaft mit beschränkter Haftung\nMünster\n\nDas Registergericht beabsichtigt die Gesellschaft von Amts wegen nach § 394 FamFG zu löschen. Die Frist zur Erhebung eines Widerspruchs ist auf drei Wochen festgesetzt."
    },
    {
      "date": "2024-11-29",
      "id": "95032",
      "original_text": "Löschungsankündigung\nNordrhein-Westfalen Amtsgericht Duisburg HRB 27375\nPK Unternehmensberatung UG (haftungsbeschränkt) – Duisburg",
      "type": "Löschungsankündigung",
      "state": "Nordrhein-Westfalen",
      "amtsgericht": "Amtsgericht Duisburg",
      "registernummer": "HRB 27375",
      "registerart": "HRB",
      "company_name": "PK Unternehmensberatung UG (haftungsbeschränkt)",
      "company_seat": "Duisburg",
      "details": "29.11.2024 (Bekanntmachungsdatum)\n\nNordrhein-Westfalen Amtsgericht Duisburg HRB 27375\nLöschungsankündigung\n\nPK Unternehmensberatung UG (haftungsbeschränkt)\nGesellschaft mit beschränkter Haftung\nDuisburg\n\nDas Registergericht beabsichtigt, die im Handelsregister Duisburg unter HRB 27375 eingetragene Gesellschaft PK Unternehmensberatung UG (haftungsbeschränkt) mit Sitz in Duisburg gemäß § 394 Absatz 1 FamFG wegen Vermögenslosigkeit von Amts wegen zu löschen. Gegen diese Verfügung kann Widerspruch eingelegt werden. Die Frist zur Erhebung eines Widerspruchs gegen die beabsichtigte Löschung von Amts wegen ist auf drei Monate festgesetzt. Rechtsbehelfsbelehrung Der Widerspruch ist bei dem Amtsgericht Duisburg, Kardinal-Galen-Str. 124-132, 47058 Duisburg schriftlich in deutscher Sprache oder zur Niederschrift der Geschäftsstelle einzulegen. Der Widerspruch kann auch zur Niederschrift der Geschäftsstelle eines jeden Amtsgerichtes abgegeben werden. Die Einlegung ist auch durch Übertragung eines elektronischen Dokuments an die elektronische Poststelle des Gerichts möglich. Das elektronische Dokument muss für die Bearbeitung durch das Gericht geeignet und mit einer qualifizierten elektronischen Signatur der verantwortenden Person versehen sein oder von der verantwortenden Person signiert und auf einem sicheren Übermittlungsweg gemäß § 130 a ZPO nach näherer Maßgabe der Verordnung über die technischen Rahmenbedingungen des elektronischen Rechtsverkehrs und über das besondere elektronische Behördenpostfach (BGBl. I, S. 3803) eingereicht werden. Weitere Informationen erhalten Sie auf der Internetseite www.justiz.de <http://www.justiz.de>. Der Widerspruch muss spätestens innerhalb der gesetzten Frist bei dem Amtsgericht Duisburg eingegangen sein. Dies gilt auch dann, wenn der Widerspruch zur Niederschrift der Geschäftsstelle eines anderen Amtsgerichtes abgegeben wurde. Die Frist beginnt mit der Veröffentlichung. Fällt das Ende der Frist auf einen Sonntag, einen allgemeinen Feiertag oder Sonnabend, so endet die Frist mit Ablauf des nächsten Werktages. Der Widerspruch muss die Bezeichnung der angefochtenen Verfügung sowie die Erklärung enthalten, dass Widerspruch gegen diese Verfügung eingelegt wird. Er ist zu unterzeichnen und soll begründet werden."
    },
    {
      "date": "2024-11-29",
      "id": "95060",
      "original_text": "Registerbekanntmachung nach dem Umwandlungsgesetz\nHessen Amtsgericht Frankfurt am Main HRB 129095\nPaccard eight GmbH – Frankfurt am Main",
      "type": "Registerbekanntmachung nach dem Umwandlungsgesetz",
      "state": "Hessen",
      "amtsgericht": "Amtsgericht Frankfurt am Main",
      "registernummer": "HRB 129095",
      "registerart": "HRB",
      "company_name": "Paccard eight GmbH",
      "company_seat": "Frankfurt am Main",
      "details": "29.11.2024 (Bekanntmachungsdatum)\n\nHessen Amtsgericht Frankfurt am Main HRB 129095\nRegisterbekanntmachung nach dem Umwandlungsgesetz 29.11.2024 (Eintragungsdatum)\n\nPaccard eight GmbH\nGesellschaft mit beschränkter Haftung\nFrankfurt am Main\n\nDen Gläubigern der an der formwechselnden Umwandlung beteiligten Rechtsträger ist, wenn sie binnen sechs Monaten nach dem Tag, an dem die Eintragung der formwechselnden Umwandlung in das Register des Sitzes desjenigen Rechtsträgers, dessen Gläubiger sie sind, nach § 201 UmwG bekannt gemacht worden ist, ihren Anspruch nach Grund und Höhe schriftlich anmelden, Sicherheit zu leisten, soweit sie nicht Befriedigung verlangen können. Dieses Recht steht den Gläubigern jedoch nur zu, wenn sie glaubhaft machen, dass durch die formwechselnden Umwandlung die Erfüllung ihrer Forderung gefährdet wird."
    },
    {
      "date": "2024-11-29",
      "id": "94976",
      "original_text": "Löschungsankündigung\nBayern Amtsgericht München HRB 136230\nPenzberger Autoreisen GmbH – Penzberg",
      "type": "Löschungsankündigung",
      "state": "Bayern",
      "amtsgericht": "Amtsgericht München",
      "registernummer": "HRB 136230",
      "registerart": "HRB",
      "company_name": "Penzberger Autoreisen GmbH",
      "company_seat": "Penzberg",
      "details": "29.11.2024 (Bekanntmachungsdatum)\n\nBayern Amtsgericht München HRB 136230\nLöschungsankündigung 28.11.2024 (Eintragungsdatum)\n\nPenzberger Autoreisen GmbH\nGesellschaft mit beschränkter Haftung\nPenzberg\n\nDas Registergericht beabsichtigt, die im Handelsregister eingetragene Gesellschaft wegen Vermögenslosigkeit von Amts wegen nach § 394 FamFG zu löschen. Die Frist zur Erhebung eines Widerspruchs ist auf drei Monate festgesetzt."
    },
    {
      "date": "2024-11-29",
      "id": "95028",
      "original_text": "Löschungsankündigung\nRheinland-Pfalz Amtsgericht Montabaur HRB 12363\nPersonenschiffahrt Collée Verwaltungs-GmbH – Neuwied",
      "type": "Löschungsankündigung",
      "state": "Rheinland-Pfalz",
      "amtsgericht": "Amtsgericht Montabaur",
      "registernummer": "HRB 12363",
      "registerart": "HRB",
      "company_name": "Personenschiffahrt Collée Verwaltungs-GmbH",
      "company_seat": "Neuwied",
      "details": "29.11.2024 (Bekanntmachungsdatum)\n\nRheinland-Pfalz Amtsgericht Montabaur HRB 12363\nLöschungsankündigung 21.11.2024 (Eintragungsdatum)\n\nPersonenschiffahrt Collée Verwaltungs-GmbH\nGesellschaft mit beschränkter Haftung\nNeuwied\n\nDas Registergericht beabsichtigt die Gesellschaft von Amts wegen nach § 394 FamFG zu löschen. Die Frist zur Erhebung eines Widerspruchs ist auf einen Monat festgesetzt."
    },
    {
      "date": "2024-11-29",
      "id": "95040",
      "original_text": "Registerbekanntmachung nach dem Umwandlungsgesetz\nNordrhein-Westfalen Amtsgericht Krefeld HRB 17990\nPharmatch GmbH – Krefeld",
      "type": "Registerbekanntmachung nach dem Umwandlungsgesetz",
      "state": "Nordrhein-Westfalen",
      "amtsgericht": "Amtsgericht Krefeld",
      "registernummer": "HRB 17990",
      "registerart": "HRB",
      "company_name": "Pharmatch GmbH",
      "company_seat": "Krefeld",
      "details": "29.11.2024 (Bekanntmachungsdatum)\n\nNordrhein-Westfalen Amtsgericht Krefeld HRB 17990\nRegisterbekanntmachung nach dem Umwandlungsgesetz 29.11.2024 (Eintragungsdatum)\n\nPharmatch GmbH\nGesellschaft mit beschränkter Haftung\nKrefeld\n\nDen Gläubigern der an der Verschmelzung beteiligten Rechtsträger ist, wenn sie binnen sechs Monaten nach dem Tag, an dem die Eintragung der Verschmelzung in das Register des Sitzes desjenigen Rechtsträgers, dessen Gläubiger sie sind, nach § 19 Absatz 3 UmwG als bekanntgemacht gilt, ihren Anspruch nach Grund und Höhe schriftlich anmelden, Sicherheit zu leisten, soweit sie nicht Befriedigung verlangen können. Dieses Recht steht den Gläubigern jedoch nur zu, wenn sie glaubhaft machen, dass durch die Verschmelzung die Erfüllung ihrer Forderung gefährdet wird."
    },
    {
      "date": "2024-11-29",
      "id": "95054",
      "original_text": "Einreichung neuer Dokumente\nHessen Amtsgericht Offenbach am Main HRB 30169\nPittler Maschinenfabrik Aktiengesellschaft – Langen (Hessen)",
      "type": "Einreichung neuer Dokumente",
      "state": "Hessen",
      "amtsgericht": "Amtsgericht Offenbach am Main",
      "registernummer": "HRB 30169",
      "registerart": "HRB",
      "company_name": "Pittler Maschinenfabrik Aktiengesellschaft",
      "company_seat": "Langen (Hessen)",
      "details": "29.11.2024 (Bekanntmachungsdatum)\n\nHessen Amtsgericht Offenbach am Main HRB 30169\nEinreichung neuer Dokumente\n\nPittler Maschinenfabrik Aktiengesellschaft\nAktiengesellschaft\nLangen (Hessen)\n\nDurch eine Änderung in den Personen der Aufsichtsratsmitglieder ist eine Liste der Mitglieder des Aufsichtsrates zum Handelsregister eingereicht worden."
    },
    {
      "date": "2024-11-29",
      "id": "94988",
      "original_text": "Einreichung neuer Dokumente\nHamburg Amtsgericht Hamburg HRB 183205\nPort of Hamburg Beteiligungsgesellschaft SE – Hamburg",
      "type": "Einreichung neuer Dokumente",
      "state": "Hamburg",
      "amtsgericht": "Amtsgericht Hamburg",
      "registernummer": "HRB 183205",
      "registerart": "HRB",
      "company_name": "Port of Hamburg Beteiligungsgesellschaft SE",
      "company_seat": "Hamburg",
      "details": "29.11.2024 (Bekanntmachungsdatum)\n\nHamburg Amtsgericht Hamburg HRB 183205\nEinreichung neuer Dokumente 29.11.2024 (Eintragungsdatum)\n\nPort of Hamburg Beteiligungsgesellschaft SE\nEuropäische Aktiengesellschaft (SE)\nHamburg\n\nAls nicht eingetragen wird bekannt gemacht: Liste des Verwaltungsrats wurde eingereicht."
    },
    {
      "date": "2024-11-29",
      "id": "95055",
      "original_text": "Löschungsankündigung\nHessen Amtsgericht Gießen HRB 8777\nProspero Baumaschinen GmbH – Grünberg",
      "type": "Löschungsankündigung",
      "state": "Hessen",
      "amtsgericht": "Amtsgericht Gießen",
      "registernummer": "HRB 8777",
      "registerart": "HRB",
      "company_name": "Prospero Baumaschinen GmbH",
      "company_seat": "Grünberg",
      "details": "29.11.2024 (Bekanntmachungsdatum)\n\nHessen Amtsgericht Gießen HRB 8777\nLöschungsankündigung\n\nProspero Baumaschinen GmbH\nGesellschaft mit beschränkter Haftung\nGrünberg\n\nEs ist beabsichtigt die Gesellschaft wegen Vermögenslosigkeit gem. § 394 FamFG von Amts wegen zu löschen.\n\nHiergegen kann innerhalb eines Monats nach dieser Veröffentlichung Widerspruch bei dem Amtsgericht Gießen eingelegt werden.\n\nSollte Widerspruch eingelegt werden, dürfte dies nur mit Begründung erfolgsversprechend sein. Insbesondere sollte vorhandenes Vermögen der Gesellschaft innerhalb der genannten Frist nachgewiesen werden."
    },
    {
      "date": "2024-11-29",
      "id": "95047",
      "original_text": "Löschungsankündigung\nHessen Amtsgericht Wiesbaden HRB 28703\nRR Raumausstattung & Raumdesign UG (haftungsbeschränkt) – Wiesbaden",
      "type": "Löschungsankündigung",
      "state": "Hessen",
      "amtsgericht": "Amtsgericht Wiesbaden",
      "registernummer": "HRB 28703",
      "registerart": "HRB",
      "company_name": "RR Raumausstattung & Raumdesign UG (haftungsbeschränkt)",
      "company_seat": "Wiesbaden",
      "details": "29.11.2024 (Bekanntmachungsdatum)\n\nHessen Amtsgericht Wiesbaden HRB 28703\nLöschungsankündigung\n\nRR Raumausstattung & Raumdesign UG (haftungsbeschränkt)\nGesellschaft mit beschränkter Haftung\nWiesbaden\n\nDas Registergericht beabsichtigt die im Handelsregister eingetragene Gesellschaft von Amts wegen nach § 394 FamFG zu löschen. Die Frist zur Erhebung eines Widerspruchs gegen die beabsichtigte Löschung wird auf 3 Monate festgesetzt."
    },
    {
      "date": "2024-11-29",
      "id": "95044",
      "original_text": "Registerbekanntmachung nach dem Umwandlungsgesetz\nHessen Amtsgericht Bad Homburg v.d.H. HRB 14644\nRotorflug GmbH – Friedrichsdorf",
      "type": "Registerbekanntmachung nach dem Umwandlungsgesetz",
      "state": "Hessen",
      "amtsgericht": "Amtsgericht Bad Homburg v.d.H.",
      "registernummer": "HRB 14644",
      "registerart": "HRB",
      "company_name": "Rotorflug GmbH",
      "company_seat": "Friedrichsdorf",
      "details": "29.11.2024 (Bekanntmachungsdatum)\n\nHessen Amtsgericht Bad Homburg v.d.H. HRB 14644\nRegisterbekanntmachung nach dem Umwandlungsgesetz 29.11.2024 (Eintragungsdatum)\n\nRotorflug GmbH\nGesellschaft mit beschränkter Haftung\nFriedrichsdorf\n\nDen Gläubigern der an der Verschmelzung beteiligten Rechtsträger ist, wenn sie binnen sechs Monaten nach dem Tag, an dem die Eintragung der Verschmelzung in das Register des Sitzes desjenigen Rechtsträgers, dessen Gläubiger sie sind, nach § 19 Absatz 3 UmwG bekannt gemacht worden ist, ihren Anspruch nach Grund und Höhe schriftlich anmelden, Sicherheit zu leisten, soweit sie nicht Befriedigung verlangen können. Dieses Recht steht den Gläubigern jedoch nur zu, wenn sie glaubhaft machen, dass durch die Verschmelzung die Erfüllung ihrer Forderung gefährdet wird."
    },
    {
      "date": "2024-11-29",
      "id": "94998",
      "original_text": "Sonstige Registerbekanntmachung\nBaden-Württemberg Amtsgericht Mannheim HRB 739820\nSPARTA AG – Heidelberg",
      "type": "Sonstige Registerbekanntmachung",
      "state": "Baden-Württemberg",
      "amtsgericht": "Amtsgericht Mannheim",
      "registernummer": "HRB 739820",
      "registerart": "HRB",
      "company_name": "SPARTA AG",
      "company_seat": "Heidelberg",
      "details": "29.11.2024 (Bekanntmachungsdatum)\n\nBaden-Württemberg Amtsgericht Mannheim HRB 739820\nSonstige Registerbekanntmachung 12.08.2024 (Eintragungsdatum)\n\nSPARTA AG\nAktiengesellschaft\nHeidelberg\n\nAls nicht eingetragen wird bekanntgemacht:\nDen Gläubigern, deren Forderungen begründet worden sind, bevor die Eintragung des Beschlusses bekanntgemacht worden ist, ist, wenn sie sich binnen sechs Monaten nach der Bekanntmachung zu diesem Zweck melden, Sicherheit zu leisten, soweit sie nicht Befriedigung verlangen können."
    },
    {
      "date": "2024-11-29",
      "id": "95000",
      "original_text": "Sonstige Registerbekanntmachung\nBaden-Württemberg Amtsgericht Mannheim HRB 739820\nSPARTA AG – Heidelberg",
      "type": "Sonstige Registerbekanntmachung",
      "state": "Baden-Württemberg",
      "amtsgericht": "Amtsgericht Mannheim",
      "registernummer": "HRB 739820",
      "registerart": "HRB",
      "company_name": "SPARTA AG",
      "company_seat": "Heidelberg",
      "details": "29.11.2024 (Bekanntmachungsdatum)\n\nBaden-Württemberg Amtsgericht Mannheim HRB 739820\nSonstige Registerbekanntmachung 27.08.2024 (Eintragungsdatum)\n\nSPARTA AG\nAktiengesellschaft\nHeidelberg\n\nAls nicht eingetragen wird bekanntgemacht:\nDen Gläubigern, deren Forderungen begründet worden sind, bevor die Eintragung des Beschlusses bekanntgemacht worden ist, ist, wenn sie sich binnen sechs Monaten nach der Bekanntmachung zu diesem Zweck melden, Sicherheit zu leisten, soweit sie nicht Befriedigung verlangen können."
    },
    {
      "date": "2024-11-29",
      "id": "95009",
      "original_text": "Löschungsankündigung\nBerlin Amtsgericht Berlin (Charlottenburg) HRB 230491\nSPK Handels und Vermittlungs GmbH – Berlin",
      "type": "Löschungsankündigung",
      "state": "Berlin",
      "amtsgericht": "Amtsgericht Berlin (Charlottenburg)",
      "registernummer": "HRB 230491",
      "registerart": "HRB",
      "company_name": "SPK Handels und Vermittlungs GmbH",
      "company_seat": "Berlin",
      "details": "29.11.2024 (Bekanntmachungsdatum)\n\nBerlin Amtsgericht Berlin (Charlottenburg) HRB 230491\nLöschungsankündigung\n\nSPK Handels und Vermittlungs GmbH\nGesellschaft mit beschränkter Haftung\nBerlin\n\nBei der nachstehenden Gesellschaft wird das Amtslöschungsverfahren gemäß § 394 FamFG eingeleitet. Widerspruchsfrist 6 Wochen"
    },
    {
      "date": "2024-11-29",
      "id": "94990",
      "original_text": "Löschungsankündigung\nBerlin Amtsgericht Berlin (Charlottenburg) HRB 146706\nSalirt Gebäudemanagement GmbH – Berlin",
      "type": "Löschungsankündigung",
      "state": "Berlin",
      "amtsgericht": "Amtsgericht Berlin (Charlottenburg)",
      "registernummer": "HRB 146706",
      "registerart": "HRB",
      "company_name": "Salirt Gebäudemanagement GmbH",
      "company_seat": "Berlin",
      "details": "29.11.2024 (Bekanntmachungsdatum)\n\nBerlin Amtsgericht Berlin (Charlottenburg) HRB 146706\nLöschungsankündigung\n\nSalirt Gebäudemanagement GmbH\nGesellschaft mit beschränkter Haftung\nBerlin\n\nBei der nachstehenden Gesellschaft wird das Amtslöschungsverfahren gemäß § 394 FamFG eingeleitet. Widerspruchsfrist 6 Wochen"
    },
    {
      "date": "2024-11-29",
      "id": "94968",
      "original_text": "Registerbekanntmachung nach dem Umwandlungsgesetz\nBayern Amtsgericht München HRB 264358\nSchön Klinik Medizinisches Versorgungszentrum GmbH – München",
      "type": "Registerbekanntmachung nach dem Umwandlungsgesetz",
      "state": "Bayern",
      "amtsgericht": "Amtsgericht München",
      "registernummer": "HRB 264358",
      "registerart": "HRB",
      "company_name": "Schön Klinik Medizinisches Versorgungszentrum GmbH",
      "company_seat": "München",
      "details": "29.11.2024 (Bekanntmachungsdatum)\n\nBayern Amtsgericht München HRB 264358\nRegisterbekanntmachung nach dem Umwandlungsgesetz 28.11.2024 (Eintragungsdatum)\n\nSchön Klinik Medizinisches Versorgungszentrum GmbH\nGesellschaft mit beschränkter Haftung\nMünchen\n\nDen Gläubigern des formwechselnden Rechtsträgers ist, wenn sie binnen sechs Monaten nach dem Tag, an dem die Eintragung des Formwechsels nach § 201 UmwG als bekannt gemacht gilt, ihren Anspruch nach Grund und Höhe schriftlich anmelden, Sicherheit zu leisten, soweit sie nicht Befriedigung verlangen können. Dieses Recht steht den Gläubigern jedoch nur zu, wenn sie glaubhaft machen, dass durch den Formwechsel die Erfüllung ihrer Forderung gefährdet wird."
    },
    {
      "date": "2024-11-29",
      "id": "94966",
      "original_text": "Registerbekanntmachung nach dem Umwandlungsgesetz\nBayern Amtsgericht München GsR 1473\nSchön Klinik Medizinisches Versorgungszentrum eGbR – München",
      "type": "Registerbekanntmachung nach dem Umwandlungsgesetz",
      "state": "Bayern",
      "amtsgericht": "Amtsgericht München",
      "registernummer": "GsR 1473",
      "registerart": "GsR",
      "company_name": "Schön Klinik Medizinisches Versorgungszentrum eGbR",
      "company_seat": "München",
      "details": "29.11.2024 (Bekanntmachungsdatum)\n\nBayern Amtsgericht München GsR 1473\nRegisterbekanntmachung nach dem Umwandlungsgesetz 28.11.2024 (Eintragungsdatum)\n\nSchön Klinik Medizinisches Versorgungszentrum eGbR\nGesellschaft bürgerlichen Rechts\nMünchen\n\nDen Gläubigern des formwechselnden Rechtsträgers ist, wenn sie binnen sechs Monaten nach dem Tag, an dem die Eintragung des Formwechsels nach § 201 UmwG als bekannt gemacht gilt, ihren Anspruch nach Grund und Höhe schriftlich anmelden, Sicherheit zu leisten, soweit sie nicht Befriedigung verlangen können. Dieses Recht steht den Gläubigern jedoch nur zu, wenn sie glaubhaft machen, dass durch den Formwechsel die Erfüllung ihrer Forderung gefährdet wird."
    },
    {
      "date": "2024-11-29",
      "id": "95008",
      "original_text": "Löschungsankündigung\nBerlin Amtsgericht Berlin (Charlottenburg) HRB 248849\nSmart Repair and Sales GmbH – Berlin",
      "type": "Löschungsankündigung",
      "state": "Berlin",
      "amtsgericht": "Amtsgericht Berlin (Charlottenburg)",
      "registernummer": "HRB 248849",
      "registerart": "HRB",
      "company_name": "Smart Repair and Sales GmbH",
      "company_seat": "Berlin",
      "details": "29.11.2024 (Bekanntmachungsdatum)\n\nBerlin Amtsgericht Berlin (Charlottenburg) HRB 248849\nLöschungsankündigung\n\nSmart Repair and Sales GmbH\nGesellschaft mit beschränkter Haftung\nBerlin\n\nBei der nachstehenden Gesellschaft wird das Amtslöschungsverfahren gemäß § 394 FamFG eingeleitet. Widerspruchsfrist 6 Wochen"
    },
    {
      "date": "2024-11-29",
      "id": "95038",
      "original_text": "Löschungsankündigung\nNordrhein-Westfalen Amtsgericht Dortmund HRB 34022\nSonnel Energiesysteme GmbH – Dortumund",
      "type": "Löschungsankündigung",
      "state": "Nordrhein-Westfalen",
      "amtsgericht": "Amtsgericht Dortmund",
      "registernummer": "HRB 34022",
      "registerart": "HRB",
      "company_name": "Sonnel Energiesysteme GmbH",
      "company_seat": "Dortumund",
      "details": "29.11.2024 (Bekanntmachungsdatum)\n\nNordrhein-Westfalen Amtsgericht Dortmund HRB 34022\nLöschungsankündigung 29.11.2024 (Eintragungsdatum)\n\nSonnel Energiesysteme GmbH\nGesellschaft mit beschränkter Haftung\nDortumund\n\nDas Registergericht beabsichtigt, die Eintragung des Herrn Michael Wufert als Geschäftsführer gemäß § 395 FamFG zu löschen.\nGegen die beabsichtigte Löschung kann innerhalb von 6 Wochen Widerspruch eingelegt werden."
    },
    {
      "date": "2024-11-29",
      "id": "95030",
      "original_text": "Löschungsankündigung\nNordrhein-Westfalen Amtsgericht Düsseldorf HRB 86329\nSteinthal Spirituosen GmbH – Langenfeld",
      "type": "Löschungsankündigung",
      "state": "Nordrhein-Westfalen",
      "amtsgericht": "Amtsgericht Düsseldorf",
      "registernummer": "HRB 86329",
      "registerart": "HRB",
      "company_name": "Steinthal Spirituosen GmbH",
      "company_seat": "Langenfeld",
      "details": "29.11.2024 (Bekanntmachungsdatum)\n\nNordrhein-Westfalen Amtsgericht Düsseldorf HRB 86329\nLöschungsankündigung\n\nSteinthal Spirituosen GmbH\nGesellschaft mit beschränkter Haftung\nLangenfeld\n\nDas Registergericht beabsichtigt die Gesellschaft von Amts wegen nach § 394 FamFG zu löschen. Die Frist zur Erhebung eines Widerspruchs ist auf 3 Wochen festgesetzt.\n\nRechtsbehelfsbelehrung:\nDas Widerspruchsrecht steht jedem zu, der an der Unterlassung der Löschung ein berechtigtes Interesse hat. Der Widerspruch ist bei dem Amtsgericht Düsseldorf -Registergericht-, Werdener Straße 1, 40227 Düsseldorf schriftlich in deutscher Sprache oder zur Niederschrift der Geschäftsstelle einzulegen. Der Widerspruch kann auch zur Niederschrift der Geschäftsstelle eines jeden Amtsgerichtes abgegeben werden. Die Einlegung ist auch durch Übertragung eines elektronischen Dokuments an die elektronische Poststelle des Gerichts möglich. Das elektronische Dokument muss für die Bearbeitung durch das Gericht geeignet und mit einer qualifizierten elektronischen Signatur der verantwortenden Person versehen sein oder von der verantwortenden Person signiert und auf einem sicheren Übermittlungsweg gemäß § 130a ZPO nach näherer Maßgabe der Verordnung über die technischen Rahmenbedingungen des elektronischen Rechtsverkehrs und über das besondere elektronische Behördenpostfach (BGBl. I, S.3803) eingereicht werden. Weitere Informationen erhalten Sie auf der Internetseite www.justiz.de.\nDer Widerspruch muss spätestens innerhalb der gesetzten Frist nach dem Datum der Bekanntmachung der Löschungsankündigung bei dem Amtsgericht - Registergericht - Düsseldorf eingegangen sein.  Dies gilt auch dann, wenn der Widerspruch zur Niederschrift der Geschäftsstelle eines anderen Amtsgerichtes abgegeben wurde. Die Frist beginnt mit dem Tage der Bekanntmachung der Löschungsankündigung in dem für die Bekanntmachung der Eintragungen in das Handelsregister bestimmten elektronischen Informations- und Kommunikationssystem nach § 10 des Handelsgesetzbuches. Fällt das Ende der Frist auf einen Sonntag, einen allgemeinen Feiertag oder Sonnabend, so endet die Frist mit Ablauf des nächsten Werktages.\nDer Widerspruch muss die Bezeichnung der angefochtenen Löschungsankündigung sowie die Erklärung enthalten, dass Widerspruch gegen diese Löschungsankündigung eingelegt wird. Er ist zu unterzeichnen und soll begründet werden."
    },
    {
      "date": "2024-11-29",
      "id": "95037",
      "original_text": "Löschungsankündigung\nNordrhein-Westfalen Amtsgericht Duisburg HRB 25382\nSumo GmbH – Duisburg",
      "type": "Löschungsankündigung",
      "state": "Nordrhein-Westfalen",
      "amtsgericht": "Amtsgericht Duisburg",
      "registernummer": "HRB 25382",
      "registerart": "HRB",
      "company_name": "Sumo GmbH",
      "company_seat": "Duisburg",
      "details": "29.11.2024 (Bekanntmachungsdatum)\n\nNordrhein-Westfalen Amtsgericht Duisburg HRB 25382\nLöschungsankündigung\n\nSumo GmbH\nGesellschaft mit beschränkter Haftung\nDuisburg\n\nDas Registergericht beabsichtigt, die im Handelsregister eingetragene Gesellschaft Sumo GmbH gemäß § 394 Absatz 1 FamFG wegen Vermögenslosigkeit von Amts wegen zu löschen. Gegen diese Verfügung kann Widerspruch eingelegt werden. Die Frist zur Erhebung eines Widerspruchs gegen die beabsichtigte Löschung von Amts wegen ist auf drei Monate festgesetzt. Rechtsbehelfsbelehrung Der Widerspruch ist bei dem Amtsgericht Duisburg, Kardinal-Galen-Str. 124-132, 47058 Duisburg schriftlich in deutscher Sprache oder zur Niederschrift der Geschäftsstelle einzulegen. Der Widerspruch kann auch zur Niederschrift der Geschäftsstelle eines jeden Amtsgerichtes abgegeben werden. Die Einlegung ist auch durch Übertragung eines elektronischen Dokuments an die elektronische Poststelle des Gerichts möglich. Das elektronische Dokument muss für die Bearbeitung durch das Gericht geeignet und mit einer qualifizierten elektronischen Signatur der verantwortenden Person versehen sein oder von der verantwortenden Person signiert und auf einem sicheren Übermittlungsweg gemäß § 130 a ZPO nach näherer Maßgabe der Verordnung über die technischen Rahmenbedingungen des elektronischen Rechtsverkehrs und über das besondere elektronische Behördenpostfach (BGBl. I, S. 3803) eingereicht werden. Weitere Informationen erhalten Sie auf der Internetseite www.justiz.de <http://www.justiz.de>. Der Widerspruch muss spätestens innerhalb der gesetzten Frist bei dem Amtsgericht Duisburg eingegangen sein. Dies gilt auch dann, wenn der Widerspruch zur Niederschrift der Geschäftsstelle eines anderen Amtsgerichtes abgegeben wurde. Die Frist beginnt mit der Veröffentlichung. Fällt das Ende der Frist auf einen Sonntag, einen allgemeinen Feiertag oder Sonnabend, so endet die Frist mit Ablauf des nächsten Werktages. Der Widerspruch muss die Bezeichnung der angefochtenen Verfügung sowie die Erklärung enthalten, dass Widerspruch gegen diese Verfügung eingelegt wird. Er ist zu unterzeichnen und soll begründet werden."
    },
    {
      "date": "2024-11-29",
      "id": "94984",
      "original_text": "Löschungsankündigung\nBerlin Amtsgericht Berlin (Charlottenburg) HRB 121404\nTEG-Berlin GmbH, Tanz-, Erlebnis- und Freizeitgastronomie – Berlin",
      "type": "Löschungsankündigung",
      "state": "Berlin",
      "amtsgericht": "Amtsgericht Berlin (Charlottenburg)",
      "registernummer": "HRB 121404",
      "registerart": "HRB",
      "company_name": "TEG-Berlin GmbH, Tanz-, Erlebnis- und Freizeitgastronomie",
      "company_seat": "Berlin",
      "details": "29.11.2024 (Bekanntmachungsdatum)\n\nBerlin Amtsgericht Berlin (Charlottenburg) HRB 121404\nLöschungsankündigung\n\nTEG-Berlin GmbH, Tanz-, Erlebnis- und Freizeitgastronomie\nGesellschaft mit beschränkter Haftung\nBerlin\n\nBei der nachstehenden Gesellschaft wird das Amtslöschungsverfahren gemäß § 394 FamFG eingeleitet. Widerspruchsfrist 6 Wochen"
    },
    {
      "date": "2024-11-29",
      "id": "94996",
      "original_text": "Löschungsankündigung\nBrandenburg Amtsgericht Potsdam HRB 31766\nTLC Transformation Leadership Consulting UG (haftungsbeschränkt) – Falkensee",
      "type": "Löschungsankündigung",
      "state": "Brandenburg",
      "amtsgericht": "Amtsgericht Potsdam",
      "registernummer": "HRB 31766",
      "registerart": "HRB",
      "company_name": "TLC Transformation Leadership Consulting UG (haftungsbeschränkt)",
      "company_seat": "Falkensee",
      "details": "29.11.2024 (Bekanntmachungsdatum)\n\nBrandenburg Amtsgericht Potsdam HRB 31766\nLöschungsankündigung\n\nTLC Transformation Leadership Consulting UG (haftungsbeschränkt)\nGesellschaft mit beschränkter Haftung\nFalkensee\n\nBei der nachstehenden Gesellschaft wird das Amtslöschungsverfahren gemäß § 394 FamFG eingeleitet. Widerspruchsfrist: 8 Wochen"
    },
    {
      "date": "2024-11-29",
      "id": "95013",
      "original_text": "Registerbekanntmachung nach dem Umwandlungsgesetz\nHamburg Amtsgericht Hamburg HRB 148435\nTOP Immobilien GmbH – Hamburg",
      "type": "Registerbekanntmachung nach dem Umwandlungsgesetz",
      "state": "Hamburg",
      "amtsgericht": "Amtsgericht Hamburg",
      "registernummer": "HRB 148435",
      "registerart": "HRB",
      "company_name": "TOP Immobilien GmbH",
      "company_seat": "Hamburg",
      "details": "29.11.2024 (Bekanntmachungsdatum)\n\nHamburg Amtsgericht Hamburg HRB 148435\nRegisterbekanntmachung nach dem Umwandlungsgesetz 29.11.2024 (Eintragungsdatum)\n\nTOP Immobilien GmbH\nGesellschaft mit beschränkter Haftung\nHamburg\n\nAls nicht eingetragen wird bekannt gemacht:\nDen Gläubigern der an der Verschmelzung beteiligten Gesellschaften ist, wenn sie binnen sechs Monaten nach dem Tag, an dem die Eintragung der Verschmelzung in das Register des Sitzes desjenigen Rechtsträgers, dessen Gläubiger sie sind, nach § 19 Absatz 3 UmwG als bekannt gemacht gilt, ihren Anspruch nach Grund und Höhe schriftlich anmelden, Sicherheit zu leisten, soweit sie nicht Befriedigung verlangen können. Dieses Recht steht den Gläubigern jedoch nur zu, wenn sie glaubhaft machen, dass durch die Verschmelzung die Erfüllung ihrer Forderung gefährdet wird."
    },
    {
      "date": "2024-11-29",
      "id": "95022",
      "original_text": "Einreichung neuer Dokumente\nSachsen Amtsgericht Chemnitz HRB 19206\nTUCed - An-Institut für Transfer und Weiterbildung GmbH – Chemnitz",
      "type": "Einreichung neuer Dokumente",
      "state": "Sachsen",
      "amtsgericht": "Amtsgericht Chemnitz",
      "registernummer": "HRB 19206",
      "registerart": "HRB",
      "company_name": "TUCed - An-Institut für Transfer und Weiterbildung GmbH",
      "company_seat": "Chemnitz",
      "details": "29.11.2024 (Bekanntmachungsdatum)\n\nSachsen Amtsgericht Chemnitz HRB 19206\nEinreichung neuer Dokumente 28.11.2024 (Eintragungsdatum)\n\nTUCed - An-Institut für Transfer und Weiterbildung GmbH\nGesellschaft mit beschränkter Haftung\nChemnitz\n\nAm 28.11.2024 wurde beim Handelsregister des Amtsgerichts Chemnitz die Liste der Mitglieder des Aufsichtsrats gemäß § 52 GmbHG eingereicht."
    },
    {
      "date": "2024-11-29",
      "id": "94989",
      "original_text": "Löschungsankündigung\nBerlin Amtsgericht Berlin (Charlottenburg) HRB 165314\nTempo Bau GmbH – Berlin",
      "type": "Löschungsankündigung",
      "state": "Berlin",
      "amtsgericht": "Amtsgericht Berlin (Charlottenburg)",
      "registernummer": "HRB 165314",
      "registerart": "HRB",
      "company_name": "Tempo Bau GmbH",
      "company_seat": "Berlin",
      "details": "29.11.2024 (Bekanntmachungsdatum)\n\nBerlin Amtsgericht Berlin (Charlottenburg) HRB 165314\nLöschungsankündigung\n\nTempo Bau GmbH\nGesellschaft mit beschränkter Haftung\nBerlin\n\nBei der nachstehenden Gesellschaft wird das Amtslöschungsverfahren gemäß § 394 FamFG eingeleitet. Widerspruchsfrist 6 Wochen"
    },
    {
      "date": "2024-11-29",
      "id": "95039",
      "original_text": "Löschungsankündigung\nNordrhein-Westfalen Amtsgericht Düsseldorf HRB 66495\nTerrasystems GmbH – Düsseldorf",
      "type": "Löschungsankündigung",
      "state": "Nordrhein-Westfalen",
      "amtsgericht": "Amtsgericht Düsseldorf",
      "registernummer": "HRB 66495",
      "registerart": "HRB",
      "company_name": "Terrasystems GmbH",
      "company_seat": "Düsseldorf",
      "details": "29.11.2024 (Bekanntmachungsdatum)\n\nNordrhein-Westfalen Amtsgericht Düsseldorf HRB 66495\nLöschungsankündigung\n\nTerrasystems GmbH\nGesellschaft mit beschränkter Haftung\nDüsseldorf\n\nDas Registergericht beabsichtigt die Gesellschaft von Amts wegen nach § 394 FamFG zu löschen. Die Frist zur Erhebung eines Widerspruchs ist auf 3 Wochen festgesetzt.\n\nRechtsbehelfsbelehrung:\nDas Widerspruchsrecht steht jedem zu, der an der Unterlassung der Löschung ein berechtigtes Interesse hat. Der Widerspruch ist bei dem Amtsgericht Düsseldorf -Registergericht-, Werdener Straße 1, 40227 Düsseldorf schriftlich in deutscher Sprache oder zur Niederschrift der Geschäftsstelle einzulegen. Der Widerspruch kann auch zur Niederschrift der Geschäftsstelle eines jeden Amtsgerichtes abgegeben werden. Die Einlegung ist auch durch Übertragung eines elektronischen Dokuments an die elektronische Poststelle des Gerichts möglich. Das elektronische Dokument muss für die Bearbeitung durch das Gericht geeignet und mit einer qualifizierten elektronischen Signatur der verantwortenden Person versehen sein oder von der verantwortenden Person signiert und auf einem sicheren Übermittlungsweg gemäß § 130a ZPO nach näherer Maßgabe der Verordnung über die technischen Rahmenbedingungen des elektronischen Rechtsverkehrs und über das besondere elektronische Behördenpostfach (BGBl. I, S.3803) eingereicht werden. Weitere Informationen erhalten Sie auf der Internetseite www.justiz.de.\nDer Widerspruch muss spätestens innerhalb der gesetzten Frist nach dem Datum der Bekanntmachung der Löschungsankündigung bei dem Amtsgericht - Registergericht - Düsseldorf eingegangen sein.  Dies gilt auch dann, wenn der Widerspruch zur Niederschrift der Geschäftsstelle eines anderen Amtsgerichtes abgegeben wurde. Die Frist beginnt mit dem Tage der Bekanntmachung der Löschungsankündigung in dem für die Bekanntmachung der Eintragungen in das Handelsregister bestimmten elektronischen Informations- und Kommunikationssystem nach § 10 des Handelsgesetzbuches. Fällt das Ende der Frist auf einen Sonntag, einen allgemeinen Feiertag oder Sonnabend, so endet die Frist mit Ablauf des nächsten Werktages.\nDer Widerspruch muss die Bezeichnung der angefochtenen Löschungsankündigung sowie die Erklärung enthalten, dass Widerspruch gegen diese Löschungsankündigung eingelegt wird. Er ist zu unterzeichnen und soll begründet werden."
    },
    {
      "date": "2024-11-29",
      "id": "95010",
      "original_text": "Sonstige Registerbekanntmachung\nBerlin Amtsgericht Berlin (Charlottenburg) HRB 117092\nThe Nature Conservancy in Europe gemeinnützige GmbH – Berlin",
      "type": "Sonstige Registerbekanntmachung",
      "state": "Berlin",
      "amtsgericht": "Amtsgericht Berlin (Charlottenburg)",
      "registernummer": "HRB 117092",
      "registerart": "HRB",
      "company_name": "The Nature Conservancy in Europe gemeinnützige GmbH",
      "company_seat": "Berlin",
      "details": "29.11.2024 (Bekanntmachungsdatum)\n\nBerlin Amtsgericht Berlin (Charlottenburg) HRB 117092\nSonstige Registerbekanntmachung\n\nThe Nature Conservancy in Europe gemeinnützige GmbH\nGesellschaft mit beschränkter Haftung\nBerlin\n\nAls nicht eingetragen wird veröffentlicht: Es wurde eine neue Liste der Aufsichtsratsmitglieder eingereicht (§52 GmbHG)."
    },
    {
      "date": "2024-11-29",
      "id": "94982",
      "original_text": "Einreichung neuer Dokumente\nBerlin Amtsgericht Berlin (Charlottenburg) HRB 77849\nVivantes - Netzwerk für Gesundheit GmbH – Berlin",
      "type": "Einreichung neuer Dokumente",
      "state": "Berlin",
      "amtsgericht": "Amtsgericht Berlin (Charlottenburg)",
      "registernummer": "HRB 77849",
      "registerart": "HRB",
      "company_name": "Vivantes - Netzwerk für Gesundheit GmbH",
      "company_seat": "Berlin",
      "details": "29.11.2024 (Bekanntmachungsdatum)\n\nBerlin Amtsgericht Berlin (Charlottenburg) HRB 77849\nEinreichung neuer Dokumente\n\nVivantes - Netzwerk für Gesundheit GmbH\nGesellschaft mit beschränkter Haftung\nBerlin\n\nAls nicht eingetragen wird veröffentlicht:\n\nEs wurde eine neue Liste der Aufsichtsratsmitglieder eingereicht (§52 GmbHG)."
    },
    {
      "date": "2024-11-29",
      "id": "94977",
      "original_text": "Registerbekanntmachung nach dem Umwandlungsgesetz\nBayern Amtsgericht Passau HRB 12591\nWKM Verwaltungsgesellschaft mbH – Windorf",
      "type": "Registerbekanntmachung nach dem Umwandlungsgesetz",
      "state": "Bayern",
      "amtsgericht": "Amtsgericht Passau",
      "registernummer": "HRB 12591",
      "registerart": "HRB",
      "company_name": "WKM Verwaltungsgesellschaft mbH",
      "company_seat": "Windorf",
      "details": "29.11.2024 (Bekanntmachungsdatum)\n\nBayern Amtsgericht Passau HRB 12591\nRegisterbekanntmachung nach dem Umwandlungsgesetz 28.11.2024 (Eintragungsdatum)\n\nWKM Verwaltungsgesellschaft mbH\nGesellschaft mit beschränkter Haftung\nWindorf\n\nDen Gläubigern der an der Spaltung beteiligten Rechtsträger ist, wenn sie binnen sechs Monaten nach dem Tag, an dem die Eintragung der Spaltung in das Register des Sitzes desjenigen Rechtsträgers, dessen Gläubiger sie sind, nach §§ 125, 19 Abs. 3 UmwG als bekannt gemacht gilt, ihren Anspruch nach Grund und Höhe schriftlich anmelden, Sicherheit zu leisten, soweit sie nicht Befriedigung verlangen können. Dieses Recht steht den Gläubigern jedoch nur zu, wenn sie glaubhaft machen, dass durch die Spaltung die Erfüllung ihrer Forderung gefährdet wird."
    },
    {
      "date": "2024-11-29",
      "id": "94980",
      "original_text": "Registerbekanntmachung nach dem Umwandlungsgesetz\nBayern Amtsgericht Nürnberg HRB 41590\nWavecon GmbH – Nürnberg",
      "type": "Registerbekanntmachung nach dem Umwandlungsgesetz",
      "state": "Bayern",
      "amtsgericht": "Amtsgericht Nürnberg",
      "registernummer": "HRB 41590",
      "registerart": "HRB",
      "company_name": "Wavecon GmbH",
      "company_seat": "Nürnberg",
      "details": "29.11.2024 (Bekanntmachungsdatum)\n\nBayern Amtsgericht Nürnberg HRB 41590\nRegisterbekanntmachung nach dem Umwandlungsgesetz 28.11.2024 (Eintragungsdatum)\n\nWavecon GmbH\nGesellschaft mit beschränkter Haftung\nNürnberg\n\nDen Gläubigern der an der Verschmelzung beteiligten Rechtsträger ist, wenn sie binnen sechs Monaten nach dem Tag, an dem die Eintragung der Verschmelzung in das Register des Sitzes desjenigen Rechtsträgers, dessen Gläubiger sie sind, nach § 19 Abs. 3 UmwG als bekannt gemacht gilt, ihren Anspruch nach Grund und Höhe schriftlich anmelden, Sicherheit zu leisten, soweit sie nicht Befriedigung verlangen können. Dieses Recht steht den Gläubigern jedoch nur zu, wenn sie glaubhaft machen, dass durch die Verschmelzung die Erfüllung ihrer Forderung gefährdet wird."
    },
    {
      "date": "2024-11-29",
      "id": "94987",
      "original_text": "Einreichung neuer Dokumente\nBaden-Württemberg Amtsgericht Mannheim HRB 570074\nWohnbau Wertheim GmbH – Wertheim",
      "type": "Einreichung neuer Dokumente",
      "state": "Baden-Württemberg",
      "amtsgericht": "Amtsgericht Mannheim",
      "registernummer": "HRB 570074",
      "registerart": "HRB",
      "company_name": "Wohnbau Wertheim GmbH",
      "company_seat": "Wertheim",
      "details": "29.11.2024 (Bekanntmachungsdatum)\n\nBaden-Württemberg Amtsgericht Mannheim HRB 570074\nEinreichung neuer Dokumente\n\nWohnbau Wertheim GmbH\nGesellschaft mit beschränkter Haftung\nWertheim\n\nDie Gesellschaft hat am 28.11.2024 die Liste über die Zusammensetzung des Aufsichtsrats zum Handelsregister eingereicht."
    },
    {
      "date": "2024-11-29",
      "id": "95001",
      "original_text": "Sonstige Registerbekanntmachung\nThüringen Amtsgericht Jena HRB 106235\nWohnungsgesellschaft Apolda mbH – Apolda",
      "type": "Sonstige Registerbekanntmachung",
      "state": "Thüringen",
      "amtsgericht": "Amtsgericht Jena",
      "registernummer": "HRB 106235",
      "registerart": "HRB",
      "company_name": "Wohnungsgesellschaft Apolda mbH",
      "company_seat": "Apolda",
      "details": "29.11.2024 (Bekanntmachungsdatum)\n\nThüringen Amtsgericht Jena HRB 106235\nSonstige Registerbekanntmachung\n\nWohnungsgesellschaft Apolda mbH\nGesellschaft mit beschränkter Haftung\nApolda\n\nBekanntmachung gem. § 52 Abs. 3 Satz 2 GmbHG: Aufgrund einer Veränderung in den Personen der Aufsichtsratsmitglieder ist durch die Geschäftsführer eine neue Liste zum Handelsregister eingereicht worden."
    },
    {
      "date": "2024-11-29",
      "id": "95041",
      "original_text": "Einreichung neuer Dokumente\nNordrhein-Westfalen Amtsgericht Duisburg HRB 406\nWohnungsgesellschaft Ruhrgebiet mbH – Dinslaken",
      "type": "Einreichung neuer Dokumente",
      "state": "Nordrhein-Westfalen",
      "amtsgericht": "Amtsgericht Duisburg",
      "registernummer": "HRB 406",
      "registerart": "HRB",
      "company_name": "Wohnungsgesellschaft Ruhrgebiet mbH",
      "company_seat": "Dinslaken",
      "details": "29.11.2024 (Bekanntmachungsdatum)\n\nNordrhein-Westfalen Amtsgericht Duisburg HRB 406\nEinreichung neuer Dokumente\n\nWohnungsgesellschaft Ruhrgebiet mbH\nGesellschaft mit beschränkter Haftung\nDinslaken\n\nDem Registergericht ist eine Liste der Mitglieder des Aufsichtsrates eingereicht worden."
    },
    {
      "date": "2024-11-29",
      "id": "95051",
      "original_text": "Registerbekanntmachung nach dem Umwandlungsgesetz\nHessen Amtsgericht Hanau HRB 94171\nbright! GmbH – Maintal",
      "type": "Registerbekanntmachung nach dem Umwandlungsgesetz",
      "state": "Hessen",
      "amtsgericht": "Amtsgericht Hanau",
      "registernummer": "HRB 94171",
      "registerart": "HRB",
      "company_name": "bright! GmbH",
      "company_seat": "Maintal",
      "details": "29.11.2024 (Bekanntmachungsdatum)\n\nHessen Amtsgericht Hanau HRB 94171\nRegisterbekanntmachung nach dem Umwandlungsgesetz 29.11.2024 (Eintragungsdatum)\n\nbright! GmbH\nGesellschaft mit beschränkter Haftung\nMaintal\n\nDen Gläubigern der an der Verschmelzung beteiligten Rechtsträger ist, wenn sie binnen sechs Monaten nach dem Tag, an dem die Eintragung der Verschmelzung in das Register des Sitzes desjenigen Rechtsträgers, dessen Gläubiger sie sind, nach § 19 Absatz 3 UmwG bekannt gemacht worden ist, ihren Anspruch nach Grund und Höhe schriftlich anmelden, Sicherheit zu leisten, soweit sie nicht Befriedigung verlangen können. Dieses Recht steht den Gläubigern jedoch nur zu, wenn sie glaubhaft machen, dass durch die Verschmelzung die Erfüllung ihrer Forderung gefährdet wird."
    },
    {
      "date": "2024-11-29",
      "id": "95046",
      "original_text": "Registerbekanntmachung nach dem Umwandlungsgesetz\nHessen Amtsgericht Hanau HRB 94180\nbright! management GmbH – Maintal",
      "type": "Registerbekanntmachung nach dem Umwandlungsgesetz",
      "state": "Hessen",
      "amtsgericht": "Amtsgericht Hanau",
      "registernummer": "HRB 94180",
      "registerart": "HRB",
      "company_name": "bright! management GmbH",
      "company_seat": "Maintal",
      "details": "29.11.2024 (Bekanntmachungsdatum)\n\nHessen Amtsgericht Hanau HRB 94180\nRegisterbekanntmachung nach dem Umwandlungsgesetz 29.11.2024 (Eintragungsdatum)\n\nbright! management GmbH\nGesellschaft mit beschränkter Haftung\nMaintal\n\nDen Gläubigern der Gesellschaft, deren Forderungen begründet worden sind, bevor die Eintragung der Beendigung des Vertrags in das Handelsregister nach § 10 HGB bekannt gemacht worden ist, ist vom anderen Vertragsteil Sicherheit zu leisten, wenn sie sich binnen sechs Monaten nach dieser Bekanntmachung zu diesem Zweck bei ihm melden.Den Gläubigern der an der Verschmelzung beteiligten Rechtsträger ist, wenn sie binnen sechs Monaten nach dem Tag, an dem die Eintragung der Verschmelzung in das Register des Sitzes desjenigen Rechtsträgers, dessen Gläubiger sie sind, nach § 19 Absatz 3 UmwG bekannt gemacht worden ist, ihren Anspruch nach Grund und Höhe schriftlich anmelden, Sicherheit zu leisten, soweit sie nicht Befriedigung verlangen können. Dieses Recht steht den Gläubigern jedoch nur zu, wenn sie glaubhaft machen, dass durch die Verschmelzung die Erfüllung ihrer Forderung gefährdet wird."
    },
    {
      "date": "2024-11-29",
      "id": "94981",
      "original_text": "Einreichung neuer Dokumente\nBayern Amtsgericht München HRB 187615\nfmc Immobilien AG – Erding",
      "type": "Einreichung neuer Dokumente",
      "state": "Bayern",
      "amtsgericht": "Amtsgericht München",
      "registernummer": "HRB 187615",
      "registerart": "HRB",
      "company_name": "fmc Immobilien AG",
      "company_seat": "Erding",
      "details": "29.11.2024 (Bekanntmachungsdatum)\n\nBayern Amtsgericht München HRB 187615\nEinreichung neuer Dokumente\n\nfmc Immobilien AG\nAktiengesellschaft\nErding\n\nDem Amtsgericht München -Registergericht- ist eine Liste der Mitglieder des Aufsichtsrats eingereicht worden, § 106 AktG."
    },
    {
      "date": "2024-11-29",
      "id": "94973",
      "original_text": "Einreichung neuer Dokumente\nBayern Amtsgericht München HRB 283006\ninnoscripta AG – München",
      "type": "Einreichung neuer Dokumente",
      "state": "Bayern",
      "amtsgericht": "Amtsgericht München",
      "registernummer": "HRB 283006",
      "registerart": "HRB",
      "company_name": "innoscripta AG",
      "company_seat": "München",
      "details": "29.11.2024 (Bekanntmachungsdatum)\n\nBayern Amtsgericht München HRB 283006\nEinreichung neuer Dokumente 28.11.2024 (Eintragungsdatum)\n\ninnoscripta AG\nAktiengesellschaft\nMünchen\n\nDem Amtsgericht München -Registergericht- ist eine Liste der Mitglieder des Aufsichtsrats eingereicht worden, § 106 AktG."
    },
    {
      "date": "2024-11-29",
      "id": "95020",
      "original_text": "Löschungsankündigung\nSachsen Amtsgericht Leipzig HRB 20993\nmy communications GmbH – Leipzig",
      "type": "Löschungsankündigung",
      "state": "Sachsen",
      "amtsgericht": "Amtsgericht Leipzig",
      "registernummer": "HRB 20993",
      "registerart": "HRB",
      "company_name": "my communications GmbH",
      "company_seat": "Leipzig",
      "details": "29.11.2024 (Bekanntmachungsdatum)\n\nSachsen Amtsgericht Leipzig HRB 20993\nLöschungsankündigung 29.11.2024 (Eintragungsdatum)\n\nmy communications GmbH\nGesellschaft mit beschränkter Haftung\nLeipzig\n\nDas Registergericht beabsichtigt, die im Handelsregister eingetragene Gesellschaft von Amts wegen nach § 394 FamFG zu löschen. Die Frist zu Erhebung eines Widerspruchs gegen die beabsichtigte Löschung wird auf einen Monat festgesetzt."
    },
    {
      "date": "2024-11-29",
      "id": "95045",
      "original_text": "Registerbekanntmachung nach dem Umwandlungsgesetz\nHessen Amtsgericht Frankfurt am Main HRB 135127\nschneider+schumacher Aktiengesellschaft – Frankfurt am Main",
      "type": "Registerbekanntmachung nach dem Umwandlungsgesetz",
      "state": "Hessen",
      "amtsgericht": "Amtsgericht Frankfurt am Main",
      "registernummer": "HRB 135127",
      "registerart": "HRB",
      "company_name": "schneider+schumacher Aktiengesellschaft",
      "company_seat": "Frankfurt am Main",
      "details": "29.11.2024 (Bekanntmachungsdatum)\n\nHessen Amtsgericht Frankfurt am Main HRB 135127\nRegisterbekanntmachung nach dem Umwandlungsgesetz 29.11.2024 (Eintragungsdatum)\n\nschneider+schumacher Aktiengesellschaft\nAktiengesellschaft\nFrankfurt am Main\n\nDen Gläubigern der an der Verschmelzung beteiligten Rechtsträger ist, wenn sie binnen sechs Monaten nach dem Tag, an dem die Eintragung der Verschmelzung in das Register des Sitzes desjenigen Rechtsträgers, dessen Gläubiger sie sind, nach § 19 Absatz 3 UmwG bekannt gemacht worden ist, ihren Anspruch nach Grund und Höhe schriftlich anmelden, Sicherheit zu leisten, soweit sie nicht Befriedigung verlangen können. Dieses Recht steht den Gläubigern jedoch nur zu, wenn sie glaubhaft machen, dass durch die Verschmelzung die Erfüllung ihrer Forderung gefährdet wird."
    },
    {
      "date": "2024-11-29",
      "id": "95056",
      "original_text": "Registerbekanntmachung nach dem Umwandlungsgesetz\nHessen Amtsgericht Frankfurt am Main HRB 82281\nschneider+schumacher Verwaltungsgesellschaft mbH – Frankfurt am Main",
      "type": "Registerbekanntmachung nach dem Umwandlungsgesetz",
      "state": "Hessen",
      "amtsgericht": "Amtsgericht Frankfurt am Main",
      "registernummer": "HRB 82281",
      "registerart": "HRB",
      "company_name": "schneider+schumacher Verwaltungsgesellschaft mbH",
      "company_seat": "Frankfurt am Main",
      "details": "29.11.2024 (Bekanntmachungsdatum)\n\nHessen Amtsgericht Frankfurt am Main HRB 82281\nRegisterbekanntmachung nach dem Umwandlungsgesetz 29.11.2024 (Eintragungsdatum)\n\nschneider+schumacher Verwaltungsgesellschaft mbH\nGesellschaft mit beschränkter Haftung\nFrankfurt am Main\n\nDen Gläubigern der an der Verschmelzung beteiligten Rechtsträger ist, wenn sie binnen sechs Monaten nach dem Tag, an dem die Eintragung der Verschmelzung in das Register des Sitzes desjenigen Rechtsträgers, dessen Gläubiger sie sind, nach § 19 Absatz 3 UmwG bekannt gemacht worden ist, ihren Anspruch nach Grund und Höhe schriftlich anmelden, Sicherheit zu leisten, soweit sie nicht Befriedigung verlangen können. Dieses Recht steht den Gläubigern jedoch nur zu, wenn sie glaubhaft machen, dass durch die Verschmelzung die Erfüllung ihrer Forderung gefährdet wird."
    },
    {
      "date": "2024-11-29",
      "id": "95034",
      "original_text": "Löschungsankündigung\nNordrhein-Westfalen Amtsgericht Bad Oeynhausen HRA 8504\ntrenoria GmbH & Co.KG – Lübbecke",
      "type": "Löschungsankündigung",
      "state": "Nordrhein-Westfalen",
      "amtsgericht": "Amtsgericht Bad Oeynhausen",
      "registernummer": "HRA 8504",
      "registerart": "HRA",
      "company_name": "trenoria GmbH & Co.KG",
      "company_seat": "Lübbecke",
      "details": "29.11.2024 (Bekanntmachungsdatum)\n\nNordrhein-Westfalen Amtsgericht Bad Oeynhausen HRA 8504\nLöschungsankündigung\n\ntrenoria GmbH & Co.KG\nKommanditgesellschaft\nLübbecke\n\nDas Registergericht beabsichtigt die Firma von Amts wegen nach § 394 FamFG zu löschen. Die Frist zur Erhebung eines Widerspruchs ist auf einen Monat festgesetzt."
    }
  ]
}