{
  "date": "2024-11-09",
  "date_of_scrape": "2024-11-30T13:12:57.020Z",
  "tool_version": "0.2.0",
  "number_of_announcements": 21,
  "announcements": [
    {
      "date": "2024-11-09",
      "id": "93068",
      "original_text": "Löschungsankündigung\nBayern Amtsgericht München HRB 222918\n3A-BAD Verwaltungs GmbH – Inning a.Ammersee",
      "type": "Löschungsankündigung",
      "state": "Bayern",
      "amtsgericht": "Amtsgericht München",
      "registernummer": "HRB 222918",
      "registerart": "HRB",
      "company_name": "3A-BAD Verwaltungs GmbH",
      "company_seat": "Inning a.Ammersee",
      "details": "09.11.2024 (Bekanntmachungsdatum)\n\nBayern Amtsgericht München HRB 222918\nLöschungsankündigung 08.11.2024 (Eintragungsdatum)\n\n3A-BAD Verwaltungs GmbH\nGesellschaft mit beschränkter Haftung\nInning a.Ammersee\n\nDas Registergericht beabsichtigt, die im Handelsregister eingetragene Gesellschaft wegen Vermögenslosigkeit von Amts wegen nach § 394 FamFG zu löschen. Die Frist zur Erhebung eines Widerspruchs ist auf drei Monate festgesetzt."
    },
    {
      "date": "2024-11-09",
      "id": "93063",
      "original_text": "Registerbekanntmachung nach dem Umwandlungsgesetz\nBayern Amtsgericht Nürnberg HRB 43734\nAnytest Engineering GmbH – Nürnberg",
      "type": "Registerbekanntmachung nach dem Umwandlungsgesetz",
      "state": "Bayern",
      "amtsgericht": "Amtsgericht Nürnberg",
      "registernummer": "HRB 43734",
      "registerart": "HRB",
      "company_name": "Anytest Engineering GmbH",
      "company_seat": "Nürnberg",
      "details": "09.11.2024 (Bekanntmachungsdatum)\n\nBayern Amtsgericht Nürnberg HRB 43734\nRegisterbekanntmachung nach dem Umwandlungsgesetz 08.11.2024 (Eintragungsdatum)\n\nAnytest Engineering GmbH\nGesellschaft mit beschränkter Haftung\nNürnberg\n\nDen Gläubigern der an der Spaltung beteiligten Rechtsträger ist, wenn sie binnen sechs Monaten nach dem Tag, an dem die Eintragung der Spaltung in das Register des Sitzes desjenigen Rechtsträgers, dessen Gläubiger sie sind, nach §§ 125, 19 Abs. 3 UmwG als bekannt gemacht gilt, ihren Anspruch nach Grund und Höhe schriftlich anmelden, Sicherheit zu leisten, soweit sie nicht Befriedigung verlangen können. Dieses Recht steht den Gläubigern jedoch nur zu, wenn sie glaubhaft machen, dass durch die Spaltung die Erfüllung ihrer Forderung gefährdet wird."
    },
    {
      "date": "2024-11-09",
      "id": "93073",
      "original_text": "Löschungsankündigung\nBayern Amtsgericht München HRB 227418\nBavaria Export Handels GmbH – München",
      "type": "Löschungsankündigung",
      "state": "Bayern",
      "amtsgericht": "Amtsgericht München",
      "registernummer": "HRB 227418",
      "registerart": "HRB",
      "company_name": "Bavaria Export Handels GmbH",
      "company_seat": "München",
      "details": "09.11.2024 (Bekanntmachungsdatum)\n\nBayern Amtsgericht München HRB 227418\nLöschungsankündigung 08.11.2024 (Eintragungsdatum)\n\nBavaria Export Handels GmbH\nGesellschaft mit beschränkter Haftung\nMünchen\n\nDas Registergericht beabsichtigt, die im Handelsregister eingetragene Gesellschaft wegen Vermögenslosigkeit von Amts wegen nach § 394 FamFG zu löschen. Die Frist zur Erhebung eines Widerspruchs ist auf drei Monate festgesetzt."
    },
    {
      "date": "2024-11-09",
      "id": "93069",
      "original_text": "Registerbekanntmachung nach dem Umwandlungsgesetz\nBayern Amtsgericht Nürnberg HRB 29506\nDORI Vermögensverwaltungs GmbH – Schwaig bei Nürnberg",
      "type": "Registerbekanntmachung nach dem Umwandlungsgesetz",
      "state": "Bayern",
      "amtsgericht": "Amtsgericht Nürnberg",
      "registernummer": "HRB 29506",
      "registerart": "HRB",
      "company_name": "DORI Vermögensverwaltungs GmbH",
      "company_seat": "Schwaig bei Nürnberg",
      "details": "09.11.2024 (Bekanntmachungsdatum)\n\nBayern Amtsgericht Nürnberg HRB 29506\nRegisterbekanntmachung nach dem Umwandlungsgesetz 08.11.2024 (Eintragungsdatum)\n\nDORI Vermögensverwaltungs GmbH\nGesellschaft mit beschränkter Haftung\nSchwaig bei Nürnberg\n\nDen Gläubigern der an der Verschmelzung beteiligten Rechtsträger ist, wenn sie binnen sechs Monaten nach dem Tag, an dem die Eintragung der Verschmelzung in das Register des Sitzes desjenigen Rechtsträgers, dessen Gläubiger sie sind, nach § 19 Abs. 3 UmwG als bekannt gemacht gilt, ihren Anspruch nach Grund und Höhe schriftlich anmelden, Sicherheit zu leisten, soweit sie nicht Befriedigung verlangen können. Dieses Recht steht den Gläubigern jedoch nur zu, wenn sie glaubhaft machen, dass durch die Verschmelzung die Erfüllung ihrer Forderung gefährdet wird."
    },
    {
      "date": "2024-11-09",
      "id": "93066",
      "original_text": "Löschungsankündigung\nBayern Amtsgericht Fürth HRA 6895\nECKA Granulate GmbH & Co. KG – Fürth",
      "type": "Löschungsankündigung",
      "state": "Bayern",
      "amtsgericht": "Amtsgericht Fürth",
      "registernummer": "HRA 6895",
      "registerart": "HRA",
      "company_name": "ECKA Granulate GmbH & Co. KG",
      "company_seat": "Fürth",
      "details": "09.11.2024 (Bekanntmachungsdatum)\n\nBayern Amtsgericht Fürth HRA 6895\nLöschungsankündigung 08.11.2024 (Eintragungsdatum)\n\nECKA Granulate GmbH & Co. KG\nKommanditgesellschaft\nFürth\n\nDas Registergericht beabsichtigt, die im Handelsregister eingetragene Firma wegen Vermögenslosigkeit von Amts wegen nach § 394 FamFG zu löschen. Die Frist zur Erhebung eines Widerspruchs ist auf einen Monat festgesetzt."
    },
    {
      "date": "2024-11-09",
      "id": "93053",
      "original_text": "Löschungsankündigung\nBayern Amtsgericht Augsburg HRB 26901\nEEG Europium Energie Gesellschaft mbH – Eching am Ammersee",
      "type": "Löschungsankündigung",
      "state": "Bayern",
      "amtsgericht": "Amtsgericht Augsburg",
      "registernummer": "HRB 26901",
      "registerart": "HRB",
      "company_name": "EEG Europium Energie Gesellschaft mbH",
      "company_seat": "Eching am Ammersee",
      "details": "09.11.2024 (Bekanntmachungsdatum)\n\nBayern Amtsgericht Augsburg HRB 26901\nLöschungsankündigung\n\nEEG Europium Energie Gesellschaft mbH\nGesellschaft mit beschränkter Haftung\nEching am Ammersee\n\nDas Registergericht beabsichtigt, die im Handelsregister eingetragene Gesellschaft wegen Vermögenslosigkeit von Amts wegen nach § 394 FamFG zu löschen. Die Frist zur Erhebung eines Widerspruchs ist auf einen Monat festgesetzt."
    },
    {
      "date": "2024-11-09",
      "id": "93067",
      "original_text": "Registerbekanntmachung nach dem Umwandlungsgesetz\nBayern Amtsgericht Nürnberg HRB 29015\nFG Leasing Holding GmbH – Schwaig b. Nürnberg",
      "type": "Registerbekanntmachung nach dem Umwandlungsgesetz",
      "state": "Bayern",
      "amtsgericht": "Amtsgericht Nürnberg",
      "registernummer": "HRB 29015",
      "registerart": "HRB",
      "company_name": "FG Leasing Holding GmbH",
      "company_seat": "Schwaig b. Nürnberg",
      "details": "09.11.2024 (Bekanntmachungsdatum)\n\nBayern Amtsgericht Nürnberg HRB 29015\nRegisterbekanntmachung nach dem Umwandlungsgesetz 08.11.2024 (Eintragungsdatum)\n\nFG Leasing Holding GmbH\nGesellschaft mit beschränkter Haftung\nSchwaig b. Nürnberg\n\nDen Gläubigern der an der Verschmelzung beteiligten Rechtsträger ist, wenn sie binnen sechs Monaten nach dem Tag, an dem die Eintragung der Verschmelzung in das Register des Sitzes desjenigen Rechtsträgers, dessen Gläubiger sie sind, nach § 19 Abs. 3 UmwG als bekannt gemacht gilt, ihren Anspruch nach Grund und Höhe schriftlich anmelden, Sicherheit zu leisten, soweit sie nicht Befriedigung verlangen können. Dieses Recht steht den Gläubigern jedoch nur zu, wenn sie glaubhaft machen, dass durch die Verschmelzung die Erfüllung ihrer Forderung gefährdet wird."
    },
    {
      "date": "2024-11-09",
      "id": "93062",
      "original_text": "Löschungsankündigung\nBayern Amtsgericht München HRB 202908\nFreeship UG (haftungsbeschränkt) – Hohenbrunn",
      "type": "Löschungsankündigung",
      "state": "Bayern",
      "amtsgericht": "Amtsgericht München",
      "registernummer": "HRB 202908",
      "registerart": "HRB",
      "company_name": "Freeship UG (haftungsbeschränkt)",
      "company_seat": "Hohenbrunn",
      "details": "09.11.2024 (Bekanntmachungsdatum)\n\nBayern Amtsgericht München HRB 202908\nLöschungsankündigung 08.11.2024 (Eintragungsdatum)\n\nFreeship UG (haftungsbeschränkt)\nGesellschaft mit beschränkter Haftung\nHohenbrunn\n\nDas Registergericht beabsichtigt, die im Handelsregister eingetragene Gesellschaft wegen Vermögenslosigkeit von Amts wegen nach § 394 FamFG zu löschen. Die Frist zur Erhebung eines Widerspruchs ist auf drei Monate festgesetzt."
    },
    {
      "date": "2024-11-09",
      "id": "93059",
      "original_text": "Registerbekanntmachung nach dem Umwandlungsgesetz\nBayern Amtsgericht Bamberg HRA 9928\nGfI - Gesellschaft für Industrieförderung mbH & Co. Verwaltungs KG – Buttenheim",
      "type": "Registerbekanntmachung nach dem Umwandlungsgesetz",
      "state": "Bayern",
      "amtsgericht": "Amtsgericht Bamberg",
      "registernummer": "HRA 9928",
      "registerart": "HRA",
      "company_name": "GfI - Gesellschaft für Industrieförderung mbH & Co. Verwaltungs KG",
      "company_seat": "Buttenheim",
      "details": "09.11.2024 (Bekanntmachungsdatum)\n\nBayern Amtsgericht Bamberg HRA 9928\nRegisterbekanntmachung nach dem Umwandlungsgesetz 08.11.2024 (Eintragungsdatum)\n\nGfI - Gesellschaft für Industrieförderung mbH & Co. Verwaltungs KG\nKommanditgesellschaft\nButtenheim\n\nDen Gläubigern der an der Verschmelzung beteiligten Rechtsträger ist, wenn sie binnen sechs Monaten nach dem Tag, an dem die Eintragung der Verschmelzung in das Register des Sitzes desjenigen Rechtsträgers, dessen Gläubiger sie sind, nach § 19 Abs. 3 UmwG als bekannt gemacht gilt, ihren Anspruch nach Grund und Höhe schriftlich anmelden, Sicherheit zu leisten, soweit sie nicht Befriedigung verlangen können. Dieses Recht steht den Gläubigern jedoch nur zu, wenn sie glaubhaft machen, dass durch die Verschmelzung die Erfüllung ihrer Forderung gefährdet wird."
    },
    {
      "date": "2024-11-09",
      "id": "93058",
      "original_text": "Registerbekanntmachung nach dem Umwandlungsgesetz\nBayern Amtsgericht Bamberg HRB 8798\nGlobus Development GmbH – Buttenheim",
      "type": "Registerbekanntmachung nach dem Umwandlungsgesetz",
      "state": "Bayern",
      "amtsgericht": "Amtsgericht Bamberg",
      "registernummer": "HRB 8798",
      "registerart": "HRB",
      "company_name": "Globus Development GmbH",
      "company_seat": "Buttenheim",
      "details": "09.11.2024 (Bekanntmachungsdatum)\n\nBayern Amtsgericht Bamberg HRB 8798\nRegisterbekanntmachung nach dem Umwandlungsgesetz 08.11.2024 (Eintragungsdatum)\n\nGlobus Development GmbH\nGesellschaft mit beschränkter Haftung\nButtenheim\n\nDen Gläubigern der an der Verschmelzung beteiligten Rechtsträger ist, wenn sie binnen sechs Monaten nach dem Tag, an dem die Eintragung der Verschmelzung in das Register des Sitzes desjenigen Rechtsträgers, dessen Gläubiger sie sind, nach § 19 Abs. 3 UmwG als bekannt gemacht gilt, ihren Anspruch nach Grund und Höhe schriftlich anmelden, Sicherheit zu leisten, soweit sie nicht Befriedigung verlangen können. Dieses Recht steht den Gläubigern jedoch nur zu, wenn sie glaubhaft machen, dass durch die Verschmelzung die Erfüllung ihrer Forderung gefährdet wird."
    },
    {
      "date": "2024-11-09",
      "id": "93054",
      "original_text": "Löschungsankündigung\nBayern Amtsgericht Regensburg HRB 14741\nHGKS UG (haftungsbeschränkt) – Cham",
      "type": "Löschungsankündigung",
      "state": "Bayern",
      "amtsgericht": "Amtsgericht Regensburg",
      "registernummer": "HRB 14741",
      "registerart": "HRB",
      "company_name": "HGKS UG (haftungsbeschränkt)",
      "company_seat": "Cham",
      "details": "09.11.2024 (Bekanntmachungsdatum)\n\nBayern Amtsgericht Regensburg HRB 14741\nLöschungsankündigung\n\nHGKS UG (haftungsbeschränkt)\nGesellschaft mit beschränkter Haftung\nCham\n\nDas Registergericht beabsichtigt, die im Handelsregister eingetragene Gesellschaft wegen Vermögenslosigkeit von Amts wegen nach § 394 FamFG zu löschen. Die Frist zur Erhebung eines Widerspruchs ist auf einen Monat festgesetzt."
    },
    {
      "date": "2024-11-09",
      "id": "93055",
      "original_text": "Löschungsankündigung\nBayern Amtsgericht München HRB 138466\nLightspeed Media GmbH – München",
      "type": "Löschungsankündigung",
      "state": "Bayern",
      "amtsgericht": "Amtsgericht München",
      "registernummer": "HRB 138466",
      "registerart": "HRB",
      "company_name": "Lightspeed Media GmbH",
      "company_seat": "München",
      "details": "09.11.2024 (Bekanntmachungsdatum)\n\nBayern Amtsgericht München HRB 138466\nLöschungsankündigung\n\nLightspeed Media GmbH\nGesellschaft mit beschränkter Haftung\nMünchen\n\nDas Registergericht beabsichtigt, die im Handelsregister eingetragene Gesellschaft wegen Vermögenslosigkeit von Amts wegen nach § 394 FamFG zu löschen. Die Frist zur Erhebung eines Widerspruchs ist auf drei Monate festgesetzt."
    },
    {
      "date": "2024-11-09",
      "id": "93060",
      "original_text": "Löschungsankündigung\nBayern Amtsgericht Regensburg HRB 17869\nLocatYa GmbH – Regensburg",
      "type": "Löschungsankündigung",
      "state": "Bayern",
      "amtsgericht": "Amtsgericht Regensburg",
      "registernummer": "HRB 17869",
      "registerart": "HRB",
      "company_name": "LocatYa GmbH",
      "company_seat": "Regensburg",
      "details": "09.11.2024 (Bekanntmachungsdatum)\n\nBayern Amtsgericht Regensburg HRB 17869\nLöschungsankündigung\n\nLocatYa GmbH\nGesellschaft mit beschränkter Haftung\nRegensburg\n\nDas Registergericht beabsichtigt, die im Handelsregister eingetragene Gesellschaft wegen Vermögenslosigkeit von Amts wegen nach § 394 FamFG zu löschen. Die Frist zur Erhebung eines Widerspruchs ist auf einen Monat festgesetzt."
    },
    {
      "date": "2024-11-09",
      "id": "93070",
      "original_text": "Sonstige Registerbekanntmachung\nBayern Amtsgericht Nürnberg HRB 2288\nMartha-Maria Krankenhaus gemeinnützige GmbH – Nürnberg",
      "type": "Sonstige Registerbekanntmachung",
      "state": "Bayern",
      "amtsgericht": "Amtsgericht Nürnberg",
      "registernummer": "HRB 2288",
      "registerart": "HRB",
      "company_name": "Martha-Maria Krankenhaus gemeinnützige GmbH",
      "company_seat": "Nürnberg",
      "details": "09.11.2024 (Bekanntmachungsdatum)\n\nBayern Amtsgericht Nürnberg HRB 2288\nSonstige Registerbekanntmachung\n\nMartha-Maria Krankenhaus gemeinnützige GmbH\nGesellschaft mit beschränkter Haftung\nNürnberg\n\nDem Amtsgericht Nürnberg -Registergericht- ist eine Liste der Mitglieder des Aufsichtsrats eingereicht worden, § 52 Abs. 3 S. 2 GmbHG."
    },
    {
      "date": "2024-11-09",
      "id": "93064",
      "original_text": "Löschungsankündigung\nBayern Amtsgericht München HRB 251619\nMondo Clean & Coring GmbH – München",
      "type": "Löschungsankündigung",
      "state": "Bayern",
      "amtsgericht": "Amtsgericht München",
      "registernummer": "HRB 251619",
      "registerart": "HRB",
      "company_name": "Mondo Clean & Coring GmbH",
      "company_seat": "München",
      "details": "09.11.2024 (Bekanntmachungsdatum)\n\nBayern Amtsgericht München HRB 251619\nLöschungsankündigung 08.11.2024 (Eintragungsdatum)\n\nMondo Clean & Coring GmbH\nGesellschaft mit beschränkter Haftung\nMünchen\n\nDas Registergericht beabsichtigt, die im Handelsregister eingetragene Gesellschaft wegen Vermögenslosigkeit von Amts wegen nach § 394 FamFG zu löschen. Die Frist zur Erhebung eines Widerspruchs ist auf drei Monate festgesetzt."
    },
    {
      "date": "2024-11-09",
      "id": "93072",
      "original_text": "Registerbekanntmachung nach dem Umwandlungsgesetz\nBayern Amtsgericht Nürnberg HRB 6644\nNürnberger Beamten Lebensversicherung Aktiengesellschaft – Nürnberg",
      "type": "Registerbekanntmachung nach dem Umwandlungsgesetz",
      "state": "Bayern",
      "amtsgericht": "Amtsgericht Nürnberg",
      "registernummer": "HRB 6644",
      "registerart": "HRB",
      "company_name": "Nürnberger Beamten Lebensversicherung Aktiengesellschaft",
      "company_seat": "Nürnberg",
      "details": "09.11.2024 (Bekanntmachungsdatum)\n\nBayern Amtsgericht Nürnberg HRB 6644\nRegisterbekanntmachung nach dem Umwandlungsgesetz 08.11.2024 (Eintragungsdatum)\n\nNürnberger Beamten Lebensversicherung Aktiengesellschaft\nAktiengesellschaft\nNürnberg\n\nDen Gläubigern der an der Verschmelzung beteiligten Rechtsträger ist, wenn sie binnen sechs Monaten nach dem Tag, an dem die Eintragung der Verschmelzung in das Register des Sitzes desjenigen Rechtsträgers, dessen Gläubiger sie sind, nach § 19 Abs. 3 UmwG als bekannt gemacht gilt, ihren Anspruch nach Grund und Höhe schriftlich anmelden, Sicherheit zu leisten, soweit sie nicht Befriedigung verlangen können. Dieses Recht steht den Gläubigern jedoch nur zu, wenn sie glaubhaft machen, dass durch die Verschmelzung die Erfüllung ihrer Forderung gefährdet wird."
    },
    {
      "date": "2024-11-09",
      "id": "93065",
      "original_text": "Registerbekanntmachung nach dem Umwandlungsgesetz\nBayern Amtsgericht Nürnberg HRB 9342\nNürnberger Lebensversicherung AG – Nürnberg",
      "type": "Registerbekanntmachung nach dem Umwandlungsgesetz",
      "state": "Bayern",
      "amtsgericht": "Amtsgericht Nürnberg",
      "registernummer": "HRB 9342",
      "registerart": "HRB",
      "company_name": "Nürnberger Lebensversicherung AG",
      "company_seat": "Nürnberg",
      "details": "09.11.2024 (Bekanntmachungsdatum)\n\nBayern Amtsgericht Nürnberg HRB 9342\nRegisterbekanntmachung nach dem Umwandlungsgesetz 08.11.2024 (Eintragungsdatum)\n\nNürnberger Lebensversicherung AG\nAktiengesellschaft\nNürnberg\n\nDen Gläubigern der an der Verschmelzung beteiligten Rechtsträger ist, wenn sie binnen sechs Monaten nach dem Tag, an dem die Eintragung der Verschmelzung in das Register des Sitzes desjenigen Rechtsträgers, dessen Gläubiger sie sind, nach § 19 Abs. 3 UmwG als bekannt gemacht gilt, ihren Anspruch nach Grund und Höhe schriftlich anmelden, Sicherheit zu leisten, soweit sie nicht Befriedigung verlangen können. Dieses Recht steht den Gläubigern jedoch nur zu, wenn sie glaubhaft machen, dass durch die Verschmelzung die Erfüllung ihrer Forderung gefährdet wird."
    },
    {
      "date": "2024-11-09",
      "id": "93071",
      "original_text": "Sonstige Registerbekanntmachung\nBayern Amtsgericht München HRB 270499\nReal I.S. Property Management GmbH – München",
      "type": "Sonstige Registerbekanntmachung",
      "state": "Bayern",
      "amtsgericht": "Amtsgericht München",
      "registernummer": "HRB 270499",
      "registerart": "HRB",
      "company_name": "Real I.S. Property Management GmbH",
      "company_seat": "München",
      "details": "09.11.2024 (Bekanntmachungsdatum)\n\nBayern Amtsgericht München HRB 270499\nSonstige Registerbekanntmachung 08.11.2024 (Eintragungsdatum)\n\nReal I.S. Property Management GmbH\nGesellschaft mit beschränkter Haftung\nMünchen\n\nDem Amtsgericht München -Registergericht- ist eine Liste der Mitglieder des Aufsichtsrats eingereicht worden, § 52 Abs. 3 S. 2 GmbHG."
    },
    {
      "date": "2024-11-09",
      "id": "93056",
      "original_text": "Löschungsankündigung\nBayern Amtsgericht München HRB 188666\nRigo GmbH – München",
      "type": "Löschungsankündigung",
      "state": "Bayern",
      "amtsgericht": "Amtsgericht München",
      "registernummer": "HRB 188666",
      "registerart": "HRB",
      "company_name": "Rigo GmbH",
      "company_seat": "München",
      "details": "09.11.2024 (Bekanntmachungsdatum)\n\nBayern Amtsgericht München HRB 188666\nLöschungsankündigung\n\nRigo GmbH\nGesellschaft mit beschränkter Haftung\nMünchen\n\nDas Registergericht beabsichtigt, die im Handelsregister eingetragene Gesellschaft wegen Vermögenslosigkeit von Amts wegen nach § 394 FamFG zu löschen. Die Frist zur Erhebung eines Widerspruchs ist auf drei Monate festgesetzt."
    },
    {
      "date": "2024-11-09",
      "id": "93061",
      "original_text": "Einreichung neuer Dokumente\nBayern Amtsgericht Augsburg HRB 18093\nStadtwerke Augsburg Holding GmbH – Augsburg",
      "type": "Einreichung neuer Dokumente",
      "state": "Bayern",
      "amtsgericht": "Amtsgericht Augsburg",
      "registernummer": "HRB 18093",
      "registerart": "HRB",
      "company_name": "Stadtwerke Augsburg Holding GmbH",
      "company_seat": "Augsburg",
      "details": "09.11.2024 (Bekanntmachungsdatum)\n\nBayern Amtsgericht Augsburg HRB 18093\nEinreichung neuer Dokumente\n\nStadtwerke Augsburg Holding GmbH\nGesellschaft mit beschränkter Haftung\nAugsburg\n\nDem Amtsgericht Augsburg -Registergericht- ist eine Liste der Mitglieder des Aufsichtsrats eingereicht worden, § 52 Abs. 3 S. 2 GmbHG."
    },
    {
      "date": "2024-11-09",
      "id": "93057",
      "original_text": "Registerbekanntmachung nach dem Umwandlungsgesetz\nBayern Amtsgericht Nürnberg HRB 23509\nnorisTEC GmbH – Nürnberg",
      "type": "Registerbekanntmachung nach dem Umwandlungsgesetz",
      "state": "Bayern",
      "amtsgericht": "Amtsgericht Nürnberg",
      "registernummer": "HRB 23509",
      "registerart": "HRB",
      "company_name": "norisTEC GmbH",
      "company_seat": "Nürnberg",
      "details": "09.11.2024 (Bekanntmachungsdatum)\n\nBayern Amtsgericht Nürnberg HRB 23509\nRegisterbekanntmachung nach dem Umwandlungsgesetz 08.11.2024 (Eintragungsdatum)\n\nnorisTEC GmbH\nGesellschaft mit beschränkter Haftung\nNürnberg\n\nDen Gläubigern der an der Spaltung beteiligten Rechtsträger ist, wenn sie binnen sechs Monaten nach dem Tag, an dem die Eintragung der Spaltung in das Register des Sitzes desjenigen Rechtsträgers, dessen Gläubiger sie sind, nach §§ 125, 19 Abs. 3 UmwG als bekannt gemacht gilt, ihren Anspruch nach Grund und Höhe schriftlich anmelden, Sicherheit zu leisten, soweit sie nicht Befriedigung verlangen können. Dieses Recht steht den Gläubigern jedoch nur zu, wenn sie glaubhaft machen, dass durch die Spaltung die Erfüllung ihrer Forderung gefährdet wird."
    }
  ]
}