{
  "date": "2024-11-28",
  "date_of_scrape": "2024-11-30T13:07:02.337Z",
  "tool_version": "0.2.0",
  "number_of_announcements": 118,
  "announcements": [
    {
      "date": "2024-11-28",
      "id": "94878",
      "original_text": "Registerbekanntmachung nach dem Umwandlungsgesetz\nBerlin Amtsgericht Berlin (Charlottenburg) HRB 125565\n1000shapes GmbH – Berlin",
      "type": "Registerbekanntmachung nach dem Umwandlungsgesetz",
      "state": "Berlin",
      "amtsgericht": "Amtsgericht Berlin (Charlottenburg)",
      "registernummer": "HRB 125565",
      "registerart": "HRB",
      "company_name": "1000shapes GmbH",
      "company_seat": "Berlin",
      "details": "28.11.2024 (Bekanntmachungsdatum)\n\nBerlin Amtsgericht Berlin (Charlottenburg) HRB 125565\nRegisterbekanntmachung nach dem Umwandlungsgesetz 27.11.2024 (Eintragungsdatum)\n\n1000shapes GmbH\nGesellschaft mit beschränkter Haftung\nBerlin\n\nZu Eintragungsnummer 4 vom 27.11.2024 wird als nicht eingetragen veröffentlicht: Den Gläubigern der an der Verschmelzung beteiligten Rechtsträger ist, wenn sie binnen sechs Monaten nach dem Tag, an dem die Eintragung der Verschmelzung in das Register des Sitzes desjenigen Rechtsträgers, dessen Gläubiger sie sind, als bekannt gemacht gilt, ihren Anspruch nach Grund und Höhe schriftlich anmelden, Sicherheit zu leisten, soweit sie nicht Befriedigung verlangen können. Dieses Recht steht den Gläubigern jedoch nur zu, wenn sie glaubhaft machen, dass durch die Verschmelzung die Erfüllung ihrer Forderung gefährdet wird. Das Recht, Sicherheitsleistung zu verlangen, steht Gläubigern nicht zu, die im Falle der Insolvenz ein Recht auf vorzugsweise Befriedigung aus einer Deckungsmasse haben, die nach gesetzlicher Vorschrift zu ihrem Schutz errichtet und staatlich überwacht ist."
    },
    {
      "date": "2024-11-28",
      "id": "94851",
      "original_text": "Löschungsankündigung\nBayern Amtsgericht München HRA 106440\n11RED GmbH & Co. KG – Haar",
      "type": "Löschungsankündigung",
      "state": "Bayern",
      "amtsgericht": "Amtsgericht München",
      "registernummer": "HRA 106440",
      "registerart": "HRA",
      "company_name": "11RED GmbH & Co. KG",
      "company_seat": "Haar",
      "details": "28.11.2024 (Bekanntmachungsdatum)\n\nBayern Amtsgericht München HRA 106440\nLöschungsankündigung 11.07.2024 (Eintragungsdatum)\n\n11RED GmbH & Co. KG\nKommanditgesellschaft\nHaar\n\nDas Registergericht beabsichtigt, die im Handelsregister eingetragene Firma von Amts wegen nach § 31 Abs. 2 HGB zu löschen. #insert(Text=\"zztb_V_Widerspruchsfrist\")"
    },
    {
      "date": "2024-11-28",
      "id": "94898",
      "original_text": "Registerbekanntmachung nach dem Umwandlungsgesetz\nSchleswig-Holstein Amtsgericht Lübeck HRB 25224\nAGA.PIE GmbH – Ahrensburg",
      "type": "Registerbekanntmachung nach dem Umwandlungsgesetz",
      "state": "Schleswig-Holstein",
      "amtsgericht": "Amtsgericht Lübeck",
      "registernummer": "HRB 25224",
      "registerart": "HRB",
      "company_name": "AGA.PIE GmbH",
      "company_seat": "Ahrensburg",
      "details": "28.11.2024 (Bekanntmachungsdatum)\n\nSchleswig-Holstein Amtsgericht Lübeck HRB 25224\nRegisterbekanntmachung nach dem Umwandlungsgesetz 28.11.2024 (Eintragungsdatum)\n\nAGA.PIE GmbH\nGesellschaft mit beschränkter Haftung\nAhrensburg\n\nZu Eintragungsnummer 3 vom 28.11.2024 wird als nicht eingetragen veröffentlicht: Den Gläubigern ist, wenn sie binnen sechs Monaten nach dem Tag, an dem die Eintragung der Umwandlung als bekannt gemacht gilt, ihren Anspruch nach Grund und Höhe schriftlich anmelden, Sicherheit zu leisten, soweit sie nicht Befriedigung verlangen können. Dieses Recht steht den Gläubigern jedoch nur zu, wenn sie glaubhaft machen, dass durch die Umwandlung die Erfüllung ihrer Forderung gefährdet wird."
    },
    {
      "date": "2024-11-28",
      "id": "94857",
      "original_text": "Registerbekanntmachung nach dem Umwandlungsgesetz\nBayern Amtsgericht München HRB 141043\nATK Abwasser-Sanitärtechnik Kellermann GmbH – Gräfelfing",
      "type": "Registerbekanntmachung nach dem Umwandlungsgesetz",
      "state": "Bayern",
      "amtsgericht": "Amtsgericht München",
      "registernummer": "HRB 141043",
      "registerart": "HRB",
      "company_name": "ATK Abwasser-Sanitärtechnik Kellermann GmbH",
      "company_seat": "Gräfelfing",
      "details": "28.11.2024 (Bekanntmachungsdatum)\n\nBayern Amtsgericht München HRB 141043\nRegisterbekanntmachung nach dem Umwandlungsgesetz 27.11.2024 (Eintragungsdatum)\n\nATK Abwasser-Sanitärtechnik Kellermann GmbH\nGesellschaft mit beschränkter Haftung\nGräfelfing\n\nDen Gläubigern der an der Verschmelzung beteiligten Rechtsträger ist, wenn sie binnen sechs Monaten nach dem Tag, an dem die Eintragung der Verschmelzung in das Register des Sitzes desjenigen Rechtsträgers, dessen Gläubiger sie sind, nach § 19 Abs. 3 UmwG als bekannt gemacht gilt, ihren Anspruch nach Grund und Höhe schriftlich anmelden, Sicherheit zu leisten, soweit sie nicht Befriedigung verlangen können. Dieses Recht steht den Gläubigern jedoch nur zu, wenn sie glaubhaft machen, dass durch die Verschmelzung die Erfüllung ihrer Forderung gefährdet wird."
    },
    {
      "date": "2024-11-28",
      "id": "94942",
      "original_text": "Löschungsankündigung\nNordrhein-Westfalen Amtsgericht Düsseldorf HRA 22600\nAVH Büroobjekt Berlin GmbH & Co. KG – Düsseldorf",
      "type": "Löschungsankündigung",
      "state": "Nordrhein-Westfalen",
      "amtsgericht": "Amtsgericht Düsseldorf",
      "registernummer": "HRA 22600",
      "registerart": "HRA",
      "company_name": "AVH Büroobjekt Berlin GmbH & Co. KG",
      "company_seat": "Düsseldorf",
      "details": "28.11.2024 (Bekanntmachungsdatum)\n\nNordrhein-Westfalen Amtsgericht Düsseldorf HRA 22600\nLöschungsankündigung\n\nAVH Büroobjekt Berlin GmbH & Co. KG\nKommanditgesellschaft\nDüsseldorf\n\nEs ist beabsichtigt, die Firma gemäß § 31 Abs. 2 HGB von Amts wegen zu löschen, da kein Gewerbe mehr betrieben wird. Frist zur Geltendmachung eines Widerspruchs: 3 Monate.\n\nRechtsbehelfsbelehrung:\nDas Widerspruchsrecht steht jedem zu, der an der Unterlassung der Löschung ein berechtigtes Interesse hat. Der Widerspruch ist bei dem Amtsgericht Düsseldorf -Registergericht-, Werdener Straße 1, 40227 Düsseldorf schriftlich in deutscher Sprache oder zur Niederschrift der Geschäftsstelle einzulegen. Der Widerspruch kann auch zur Niederschrift der Geschäftsstelle eines jeden Amtsgerichtes abgegeben werden. Die Einlegung ist auch durch Übertragung eines elektronischen Dokuments an die elektronische Poststelle des Gerichts möglich. Das elektronische Dokument muss für die Bearbeitung durch das Gericht geeignet und mit einer qualifizierten elektronischen Signatur der verantwortenden Person versehen sein oder von der verantwortenden Person signiert und auf einem sicheren Übermittlungsweg gemäß § 130a ZPO nach näherer Maßgabe der Verordnung über die technischen Rahmenbedingungen des elektronischen Rechtsverkehrs und über das besondere elektronische Behördenpostfach (BGBl. I, S.3803) eingereicht werden. Weitere Informationen erhalten Sie auf der Internetseite www.justiz.de.\nDer Widerspruch muss spätestens innerhalb der gesetzten Frist nach dem Datum der Bekanntmachung der Löschungsankündigung bei dem Amtsgericht - Registergericht - Düsseldorf eingegangen sein.  Dies gilt auch dann, wenn der Widerspruch zur Niederschrift der Geschäftsstelle eines anderen Amtsgerichtes abgegeben wurde. Die Frist beginnt mit dem Tage der Bekanntmachung der Löschungsankündigung in dem für die Bekanntmachung der Eintragungen in das Handelsregister bestimmten elektronischen Informations- und Kommunikationssystem nach § 10 des Handelsgesetzbuches. Fällt das Ende der Frist auf einen Sonntag, einen allgemeinen Feiertag oder Sonnabend, so endet die Frist mit Ablauf des nächsten Werktages.\nDer Widerspruch muss die Bezeichnung der angefochtenen Löschungsankündigung sowie die Erklärung enthalten, dass Widerspruch gegen diese Löschungsankündigung eingelegt wird. Er ist zu unterzeichnen und soll begründet werden."
    },
    {
      "date": "2024-11-28",
      "id": "94861",
      "original_text": "Löschungsankündigung\nBayern Amtsgericht München HRA 86014\nAWG Group GmbH & Co. KG – München",
      "type": "Löschungsankündigung",
      "state": "Bayern",
      "amtsgericht": "Amtsgericht München",
      "registernummer": "HRA 86014",
      "registerart": "HRA",
      "company_name": "AWG Group GmbH & Co. KG",
      "company_seat": "München",
      "details": "28.11.2024 (Bekanntmachungsdatum)\n\nBayern Amtsgericht München HRA 86014\nLöschungsankündigung 27.11.2024 (Eintragungsdatum)\n\nAWG Group GmbH & Co. KG\nKommanditgesellschaft\nMünchen\n\nDas Registergericht beabsichtigt, die im Handelsregister eingetragene Firma von Amts wegen nach § 31 Abs. 2 HGB zu löschen. Die Frist zur Erhebung eines Widerspruchs ist auf drei Monate festgesetzt."
    },
    {
      "date": "2024-11-28",
      "id": "94915",
      "original_text": "Registerbekanntmachung nach dem Umwandlungsgesetz\nNiedersachsen Amtsgericht Walsrode HRA 61821\nApotheke Große In der Stadtmitte e.K. – Rotenburg (Wümme)",
      "type": "Registerbekanntmachung nach dem Umwandlungsgesetz",
      "state": "Niedersachsen",
      "amtsgericht": "Amtsgericht Walsrode",
      "registernummer": "HRA 61821",
      "registerart": "HRA",
      "company_name": "Apotheke Große In der Stadtmitte e.K.",
      "company_seat": "Rotenburg (Wümme)",
      "details": "28.11.2024 (Bekanntmachungsdatum)\n\nNiedersachsen Amtsgericht Walsrode HRA 61821\nRegisterbekanntmachung nach dem Umwandlungsgesetz 28.11.2024 (Eintragungsdatum)\n\nApotheke Große In der Stadtmitte e.K.\nEinzelkaufmann / Einzelkauffrau\nRotenburg (Wümme)\n\nDen Gläubigern der an der Ausgliederung beteiligten Rechtsträger ist, wenn sie binnen sechs Monaten nach dem Tag, an dem die Eintragung der Ausgliederung in das Register des Sitzes desjenigen Rechtsträgers, dessen Gläubiger sie sind, nach § 19 Abs. 3 UmwG als bekannt gemacht gilt, ihren Anspruch nach Grund und Höhe schriftlich anmelden, Sicherheit zu leisten, soweit sie nicht Befriedigung verlangen können. Dieses Recht steht den Gläubigern jedoch nur zu, wenn sie glaubhaft machen, dass durch die Ausgliederung die Erfüllung der Forderung gefährdet wird."
    },
    {
      "date": "2024-11-28",
      "id": "94860",
      "original_text": "Löschungsankündigung\nBayern Amtsgericht München HRB 234691\nAtlantic Seafood GmbH – Grünwald",
      "type": "Löschungsankündigung",
      "state": "Bayern",
      "amtsgericht": "Amtsgericht München",
      "registernummer": "HRB 234691",
      "registerart": "HRB",
      "company_name": "Atlantic Seafood GmbH",
      "company_seat": "Grünwald",
      "details": "28.11.2024 (Bekanntmachungsdatum)\n\nBayern Amtsgericht München HRB 234691\nLöschungsankündigung\n\nAtlantic Seafood GmbH\nGesellschaft mit beschränkter Haftung\nGrünwald\n\nDas Registergericht beabsichtigt, die im Handelsregister eingetragene Gesellschaft wegen Vermögenslosigkeit von Amts wegen nach § 394 FamFG zu löschen. Die Frist zur Erhebung eines Widerspruchs ist auf drei Monate festgesetzt."
    },
    {
      "date": "2024-11-28",
      "id": "94916",
      "original_text": "Registerbekanntmachung nach dem Umwandlungsgesetz\nNiedersachsen Amtsgericht Tostedt HRB 101369 früher Amtsgericht Stade\nBAREBO Beteiligungs GmbH – Stade",
      "type": "Registerbekanntmachung nach dem Umwandlungsgesetz",
      "state": "Niedersachsen",
      "amtsgericht": "Amtsgericht Tostedt",
      "registernummer": "HRB 101369",
      "registerart": "HRB",
      "company_name": "BAREBO Beteiligungs GmbH",
      "company_seat": "Stade",
      "former_amtsgericht": "Stade",
      "details": "28.11.2024 (Bekanntmachungsdatum)\n\nNiedersachsen Amtsgericht Tostedt HRB 101369 früher Amtsgericht Stade\nRegisterbekanntmachung nach dem Umwandlungsgesetz 28.11.2024 (Eintragungsdatum)\n\nBAREBO Beteiligungs GmbH\nGesellschaft mit beschränkter Haftung\nStade\n\nDen Gläubigern der an der Verschmelzung beteiligten Rechtsträger ist, wenn sie binnen sechs Monaten nach dem Tag, an dem die Eintragung der Verschmelzung in das Register des Sitzes desjenigen Rechtsträgers, dessen Gläubiger sie sind, nach § 19  Abs.  3 UmwG als bekannt gemacht gilt, ihren Anspruch nach Grund und Höhe schriftlich anmelden, Sicherheit zu leisten, soweit sie nicht Befriedigung verlangen können. Dieses Recht steht den Gläubigern jedoch nur zu, wenn sie glaubhaft machen, dass durch die Verschmelzung die Erfüllung der Forderung gefährdet wird."
    },
    {
      "date": "2024-11-28",
      "id": "94910",
      "original_text": "Registerbekanntmachung nach dem Umwandlungsgesetz\nHamburg Amtsgericht Hamburg HRB 113611\nBP Europa SE – Hamburg",
      "type": "Registerbekanntmachung nach dem Umwandlungsgesetz",
      "state": "Hamburg",
      "amtsgericht": "Amtsgericht Hamburg",
      "registernummer": "HRB 113611",
      "registerart": "HRB",
      "company_name": "BP Europa SE",
      "company_seat": "Hamburg",
      "details": "28.11.2024 (Bekanntmachungsdatum)\n\nHamburg Amtsgericht Hamburg HRB 113611\nRegisterbekanntmachung nach dem Umwandlungsgesetz 28.11.2024 (Eintragungsdatum)\n\nBP Europa SE\nEuropäische Aktiengesellschaft (SE)\nHamburg\n\nAls nicht eingetragen wird bekannt gemacht:\nDen Gläubigern der an der Verschmelzung beteiligten Gesellschaften ist, wenn sie binnen sechs Monaten nach dem Tag, an dem die Eintragung der Verschmelzung in das Register des Sitzes desjenigen Rechtsträgers, dessen Gläubiger sie sind, nach § 19 Absatz 3 UmwG als bekannt gemacht gilt, ihren Anspruch nach Grund und Höhe schriftlich anmelden, Sicherheit zu leisten, soweit sie nicht Befriedigung verlangen können. Dieses Recht steht den Gläubigern jedoch nur zu, wenn sie glaubhaft machen, dass durch die Verschmelzung die Erfüllung ihrer Forderung gefährdet wird."
    },
    {
      "date": "2024-11-28",
      "id": "94911",
      "original_text": "Registerbekanntmachung nach dem Umwandlungsgesetz\nHamburg Amtsgericht Hamburg HRB 81693\nBP Fuels Deutschland GmbH – Hamburg",
      "type": "Registerbekanntmachung nach dem Umwandlungsgesetz",
      "state": "Hamburg",
      "amtsgericht": "Amtsgericht Hamburg",
      "registernummer": "HRB 81693",
      "registerart": "HRB",
      "company_name": "BP Fuels Deutschland GmbH",
      "company_seat": "Hamburg",
      "details": "28.11.2024 (Bekanntmachungsdatum)\n\nHamburg Amtsgericht Hamburg HRB 81693\nRegisterbekanntmachung nach dem Umwandlungsgesetz 28.11.2024 (Eintragungsdatum)\n\nBP Fuels Deutschland GmbH\nGesellschaft mit beschränkter Haftung\nHamburg\n\nAls nicht eingetragen wird bekannt gemacht:\nDen Gläubigern der an der Verschmelzung beteiligten Gesellschaften ist, wenn sie binnen sechs Monaten nach dem Tag, an dem die Eintragung der Verschmelzung in das Register des Sitzes desjenigen Rechtsträgers, dessen Gläubiger sie sind, nach § 19 Absatz 3 UmwG als bekannt gemacht gilt, ihren Anspruch nach Grund und Höhe schriftlich anmelden, Sicherheit zu leisten, soweit sie nicht Befriedigung verlangen können. Dieses Recht steht den Gläubigern jedoch nur zu, wenn sie glaubhaft machen, dass durch die Verschmelzung die Erfüllung ihrer Forderung gefährdet wird."
    },
    {
      "date": "2024-11-28",
      "id": "94924",
      "original_text": "Löschungsankündigung\nRheinland-Pfalz Amtsgericht Landau HRB 31616\nBP-Transporte GmbH – Zeiskam",
      "type": "Löschungsankündigung",
      "state": "Rheinland-Pfalz",
      "amtsgericht": "Amtsgericht Landau",
      "registernummer": "HRB 31616",
      "registerart": "HRB",
      "company_name": "BP-Transporte GmbH",
      "company_seat": "Zeiskam",
      "details": "28.11.2024 (Bekanntmachungsdatum)\n\nRheinland-Pfalz Amtsgericht Landau HRB 31616\nLöschungsankündigung\n\nBP-Transporte GmbH\nGesellschaft mit beschränkter Haftung\nZeiskam\n\nDas Registergericht beabsichtigt die Gesellschaft von Amts wegen nach § 394 FamFG zu löschen. Die Frist zur Erhebung eines Widerspruchs ist auf einen Monat festgesetzt."
    },
    {
      "date": "2024-11-28",
      "id": "94901",
      "original_text": "Löschungsankündigung\nMecklenburg-Vorpommern Amtsgericht Schwerin HRB 14353\nBackhaltestelle GmbH – Sternberg",
      "type": "Löschungsankündigung",
      "state": "Mecklenburg-Vorpommern",
      "amtsgericht": "Amtsgericht Schwerin",
      "registernummer": "HRB 14353",
      "registerart": "HRB",
      "company_name": "Backhaltestelle GmbH",
      "company_seat": "Sternberg",
      "details": "28.11.2024 (Bekanntmachungsdatum)\n\nMecklenburg-Vorpommern Amtsgericht Schwerin HRB 14353\nLöschungsankündigung\n\nBackhaltestelle GmbH\nGesellschaft mit beschränkter Haftung\nSternberg\n\nDas Registergericht beabsichtigt, die im Handelsregister eingetragene Gesellschaft von Amts wegen nach § 394 FamFG zu löschen. Die Frist zur Erhebung eines Widerspruchs gegen die beabsichtigte Löschung wird auf 1 Monat festgesetzt."
    },
    {
      "date": "2024-11-28",
      "id": "94930",
      "original_text": "Registerbekanntmachung nach dem Umwandlungsgesetz\nRheinland-Pfalz Amtsgericht Bad Kreuznach HRB 21979\nBeWa Control GmbH – Simmern",
      "type": "Registerbekanntmachung nach dem Umwandlungsgesetz",
      "state": "Rheinland-Pfalz",
      "amtsgericht": "Amtsgericht Bad Kreuznach",
      "registernummer": "HRB 21979",
      "registerart": "HRB",
      "company_name": "BeWa Control GmbH",
      "company_seat": "Simmern",
      "details": "28.11.2024 (Bekanntmachungsdatum)\n\nRheinland-Pfalz Amtsgericht Bad Kreuznach HRB 21979\nRegisterbekanntmachung nach dem Umwandlungsgesetz 28.11.2024 (Eintragungsdatum)\n\nBeWa Control GmbH\nGesellschaft mit beschränkter Haftung\nSimmern\n\nAls nicht eingetragen wird veröffentlicht: Den Gläubigern der an der Verschmelzung beteiligten Rechtsträger ist, wenn sie binnen sechs Monaten nach dem Tag, an dem die Eintragung der Verschmelzung in das Register des Sitzes desjenigen Rechtsträgers, dessen Gläubiger sie sind, nach § 19 Abs. 3 UmwG als bekannt gemacht gilt, ihren Anspruch nach Grund und Höhe schriftlich anmelden, Sicherheit zu leisten, soweit sie nicht Befriedigung verlangen können. Dieses Recht steht den Gläubigern jedoch nur zu, wenn sie glaubhaft machen, dass durch die Verschmelzung die Erfüllung der Forderung gefährdet wird."
    },
    {
      "date": "2024-11-28",
      "id": "94866",
      "original_text": "Registerbekanntmachung nach dem Umwandlungsgesetz\nBayern Amtsgericht Nürnberg HRB 43021\nBeckert & Dömel Versicherungsmakler GmbH – Nürnberg",
      "type": "Registerbekanntmachung nach dem Umwandlungsgesetz",
      "state": "Bayern",
      "amtsgericht": "Amtsgericht Nürnberg",
      "registernummer": "HRB 43021",
      "registerart": "HRB",
      "company_name": "Beckert & Dömel Versicherungsmakler GmbH",
      "company_seat": "Nürnberg",
      "details": "28.11.2024 (Bekanntmachungsdatum)\n\nBayern Amtsgericht Nürnberg HRB 43021\nRegisterbekanntmachung nach dem Umwandlungsgesetz 27.11.2024 (Eintragungsdatum)\n\nBeckert & Dömel Versicherungsmakler GmbH\nGesellschaft mit beschränkter Haftung\nNürnberg\n\nDen Gläubigern der an der Verschmelzung beteiligten Rechtsträger ist, wenn sie binnen sechs Monaten nach dem Tag, an dem die Eintragung der Verschmelzung in das Register des Sitzes desjenigen Rechtsträgers, dessen Gläubiger sie sind, nach § 19 Abs. 3 UmwG als bekannt gemacht gilt, ihren Anspruch nach Grund und Höhe schriftlich anmelden, Sicherheit zu leisten, soweit sie nicht Befriedigung verlangen können. Dieses Recht steht den Gläubigern jedoch nur zu, wenn sie glaubhaft machen, dass durch die Verschmelzung die Erfüllung ihrer Forderung gefährdet wird."
    },
    {
      "date": "2024-11-28",
      "id": "94870",
      "original_text": "Registerbekanntmachung nach dem Umwandlungsgesetz\nBayern Amtsgericht Nürnberg HRB 43021\nBeckert & Dömel Versicherungsmakler GmbH – Nürnberg",
      "type": "Registerbekanntmachung nach dem Umwandlungsgesetz",
      "state": "Bayern",
      "amtsgericht": "Amtsgericht Nürnberg",
      "registernummer": "HRB 43021",
      "registerart": "HRB",
      "company_name": "Beckert & Dömel Versicherungsmakler GmbH",
      "company_seat": "Nürnberg",
      "details": "28.11.2024 (Bekanntmachungsdatum)\n\nBayern Amtsgericht Nürnberg HRB 43021\nRegisterbekanntmachung nach dem Umwandlungsgesetz 27.11.2024 (Eintragungsdatum)\n\nBeckert & Dömel Versicherungsmakler GmbH\nGesellschaft mit beschränkter Haftung\nNürnberg\n\nDen Gläubigern der an der Verschmelzung beteiligten Rechtsträger ist, wenn sie binnen sechs Monaten nach dem Tag, an dem die Eintragung der Verschmelzung in das Register des Sitzes desjenigen Rechtsträgers, dessen Gläubiger sie sind, nach § 19 Abs. 3 UmwG als bekannt gemacht gilt, ihren Anspruch nach Grund und Höhe schriftlich anmelden, Sicherheit zu leisten, soweit sie nicht Befriedigung verlangen können. Dieses Recht steht den Gläubigern jedoch nur zu, wenn sie glaubhaft machen, dass durch die Verschmelzung die Erfüllung ihrer Forderung gefährdet wird."
    },
    {
      "date": "2024-11-28",
      "id": "94949",
      "original_text": "Registerbekanntmachung nach dem Umwandlungsgesetz\nHessen Amtsgericht Frankfurt am Main HRB 129735\nBerthold Klein GmbH – Frankfurt am Main",
      "type": "Registerbekanntmachung nach dem Umwandlungsgesetz",
      "state": "Hessen",
      "amtsgericht": "Amtsgericht Frankfurt am Main",
      "registernummer": "HRB 129735",
      "registerart": "HRB",
      "company_name": "Berthold Klein GmbH",
      "company_seat": "Frankfurt am Main",
      "details": "28.11.2024 (Bekanntmachungsdatum)\n\nHessen Amtsgericht Frankfurt am Main HRB 129735\nRegisterbekanntmachung nach dem Umwandlungsgesetz 28.11.2024 (Eintragungsdatum)\n\nBerthold Klein GmbH\nGesellschaft mit beschränkter Haftung\nFrankfurt am Main\n\nDen Gläubigern der an der Verschmelzung beteiligten Rechtsträger ist, wenn sie binnen sechs Monaten nach dem Tag, an dem die Eintragung der Verschmelzung in das Register des Sitzes desjenigen Rechtsträgers, dessen Gläubiger sie sind, nach § 19 Absatz 3 UmwG bekannt gemacht worden ist, ihren Anspruch nach Grund und Höhe schriftlich anmelden, Sicherheit zu leisten, soweit sie nicht Befriedigung verlangen können. Dieses Recht steht den Gläubigern jedoch nur zu, wenn sie glaubhaft machen, dass durch die Verschmelzung die Erfüllung ihrer Forderung gefährdet wird."
    },
    {
      "date": "2024-11-28",
      "id": "94938",
      "original_text": "Löschungsankündigung\nNordrhein-Westfalen Amtsgericht Bad Oeynhausen HRB 13807\nBike Building GmbH – Löhne",
      "type": "Löschungsankündigung",
      "state": "Nordrhein-Westfalen",
      "amtsgericht": "Amtsgericht Bad Oeynhausen",
      "registernummer": "HRB 13807",
      "registerart": "HRB",
      "company_name": "Bike Building GmbH",
      "company_seat": "Löhne",
      "details": "28.11.2024 (Bekanntmachungsdatum)\n\nNordrhein-Westfalen Amtsgericht Bad Oeynhausen HRB 13807\nLöschungsankündigung 28.11.2024 (Eintragungsdatum)\n\nBike Building GmbH\nGesellschaft mit beschränkter Haftung\nLöhne\n\nDas Registergericht beabsichtigt die Gesellschaft von Amts wegen nach § 394 FamFG zu löschen. Die Frist zur Erhebung eines Widerspruchs ist auf zwei Monate festgesetzt."
    },
    {
      "date": "2024-11-28",
      "id": "94859",
      "original_text": "Löschungsankündigung\nBayern Amtsgericht Hof HRB 3895\nBioenergie Sechsämterland GmbH – Arzberg",
      "type": "Löschungsankündigung",
      "state": "Bayern",
      "amtsgericht": "Amtsgericht Hof",
      "registernummer": "HRB 3895",
      "registerart": "HRB",
      "company_name": "Bioenergie Sechsämterland GmbH",
      "company_seat": "Arzberg",
      "details": "28.11.2024 (Bekanntmachungsdatum)\n\nBayern Amtsgericht Hof HRB 3895\nLöschungsankündigung\n\nBioenergie Sechsämterland GmbH\nGesellschaft mit beschränkter Haftung\nArzberg\n\nDas Registergericht beabsichtigt, die im Handelsregister eingetragene Gesellschaft wegen Vermögenslosigkeit von Amts wegen nach § 394 FamFG zu löschen. Die Frist zur Erhebung eines Widerspruchs ist auf sechs Wochen festgesetzt."
    },
    {
      "date": "2024-11-28",
      "id": "94888",
      "original_text": "Registerbekanntmachung nach dem Umwandlungsgesetz\nHamburg Amtsgericht Hamburg HRB 101712\nCATO Service GmbH – Hamburg",
      "type": "Registerbekanntmachung nach dem Umwandlungsgesetz",
      "state": "Hamburg",
      "amtsgericht": "Amtsgericht Hamburg",
      "registernummer": "HRB 101712",
      "registerart": "HRB",
      "company_name": "CATO Service GmbH",
      "company_seat": "Hamburg",
      "details": "28.11.2024 (Bekanntmachungsdatum)\n\nHamburg Amtsgericht Hamburg HRB 101712\nRegisterbekanntmachung nach dem Umwandlungsgesetz 28.11.2024 (Eintragungsdatum)\n\nCATO Service GmbH\nGesellschaft mit beschränkter Haftung\nHamburg\n\nAls nicht eingetragen wird bekannt gemacht:\nDen Gläubigern der an der Verschmelzung beteiligten Gesellschaften ist, wenn sie binnen sechs Monaten nach dem Tag, an dem die Eintragung der Verschmelzung in das Register des Sitzes derjenigen Rechtsträger deren Gläubiger sie sind, nach § 19 Absatz 3 UmwG als bekannt gemacht gilt, ihren Anspruch nach Grund und Höhe schriftlich anmelden, Sicherheit zu leisten, soweit sie nicht Befriedigung verlangen können. Dieses Recht steht den Gläubigern jedoch nur zu, wenn sie glaubhaft machen, dass durch die Verschmelzung die Erfüllung ihrer Forderung gefährdet wird."
    },
    {
      "date": "2024-11-28",
      "id": "94887",
      "original_text": "Registerbekanntmachung nach dem Umwandlungsgesetz\nHamburg Amtsgericht Hamburg HRB 142533\nCato24 GmbH – Hamburg",
      "type": "Registerbekanntmachung nach dem Umwandlungsgesetz",
      "state": "Hamburg",
      "amtsgericht": "Amtsgericht Hamburg",
      "registernummer": "HRB 142533",
      "registerart": "HRB",
      "company_name": "Cato24 GmbH",
      "company_seat": "Hamburg",
      "details": "28.11.2024 (Bekanntmachungsdatum)\n\nHamburg Amtsgericht Hamburg HRB 142533\nRegisterbekanntmachung nach dem Umwandlungsgesetz 28.11.2024 (Eintragungsdatum)\n\nCato24 GmbH\nGesellschaft mit beschränkter Haftung\nHamburg\n\nAls nicht eingetragen wird bekannt gemacht:\nDen Gläubigern der an der Verschmelzung beteiligten Gesellschaften ist, wenn sie binnen sechs Monaten nach dem Tag, an dem die Eintragung der Verschmelzung in das Register des Sitzes desjenigen Rechtsträgers, dessen Gläubiger sie sind, nach § 19 Absatz 3 UmwG als bekannt gemacht gilt, ihren Anspruch nach Grund und Höhe schriftlich anmelden, Sicherheit zu leisten, soweit sie nicht Befriedigung verlangen können. Dieses Recht steht den Gläubigern jedoch nur zu, wenn sie glaubhaft machen, dass durch die Verschmelzung die Erfüllung ihrer Forderung gefährdet wird."
    },
    {
      "date": "2024-11-28",
      "id": "94852",
      "original_text": "Löschungsankündigung\nBayern Amtsgericht Passau HRB 10917\nDAFE Technologie GmbH – Waldkirchen",
      "type": "Löschungsankündigung",
      "state": "Bayern",
      "amtsgericht": "Amtsgericht Passau",
      "registernummer": "HRB 10917",
      "registerart": "HRB",
      "company_name": "DAFE Technologie GmbH",
      "company_seat": "Waldkirchen",
      "details": "28.11.2024 (Bekanntmachungsdatum)\n\nBayern Amtsgericht Passau HRB 10917\nLöschungsankündigung\n\nDAFE Technologie GmbH\nGesellschaft mit beschränkter Haftung\nWaldkirchen\n\nDas Registergericht beabsichtigt, die im Handelsregister eingetragene Gesellschaft wegen Vermögenslosigkeit von Amts wegen nach § 394 FamFG zu löschen. Die Frist zur Erhebung eines Widerspruchs ist auf einen Monat festgesetzt."
    },
    {
      "date": "2024-11-28",
      "id": "94885",
      "original_text": "Löschungsankündigung\nBerlin Amtsgericht Berlin (Charlottenburg) HRB 184807\nDAKO Personal GmbH – Berlin",
      "type": "Löschungsankündigung",
      "state": "Berlin",
      "amtsgericht": "Amtsgericht Berlin (Charlottenburg)",
      "registernummer": "HRB 184807",
      "registerart": "HRB",
      "company_name": "DAKO Personal GmbH",
      "company_seat": "Berlin",
      "details": "28.11.2024 (Bekanntmachungsdatum)\n\nBerlin Amtsgericht Berlin (Charlottenburg) HRB 184807\nLöschungsankündigung\n\nDAKO Personal GmbH\nGesellschaft mit beschränkter Haftung\nBerlin\n\nBei der nachstehenden Gesellschaft wird das Amtslöschungsverfahren gemäß § 394 FamFG eingeleitet. Widerspruchsfrist 6 Wochen"
    },
    {
      "date": "2024-11-28",
      "id": "94947",
      "original_text": "Registerbekanntmachung nach dem Umwandlungsgesetz\nHessen Amtsgericht Wetzlar HRB 7811\nDH Holdings Germany GmbH – Wetzlar",
      "type": "Registerbekanntmachung nach dem Umwandlungsgesetz",
      "state": "Hessen",
      "amtsgericht": "Amtsgericht Wetzlar",
      "registernummer": "HRB 7811",
      "registerart": "HRB",
      "company_name": "DH Holdings Germany GmbH",
      "company_seat": "Wetzlar",
      "details": "28.11.2024 (Bekanntmachungsdatum)\n\nHessen Amtsgericht Wetzlar HRB 7811\nRegisterbekanntmachung nach dem Umwandlungsgesetz 28.11.2024 (Eintragungsdatum)\n\nDH Holdings Germany GmbH\nGesellschaft mit beschränkter Haftung\nWetzlar\n\nDen Gläubigern der an der Verschmelzung beteiligten Rechtsträger ist, wenn sie binnen sechs Monaten nach dem Tag, an dem die Eintragung der Verschmelzung in das Register des Sitzes desjenigen Rechtsträgers, dessen Gläubiger sie sind, nach § 19 Absatz 3 UmwG bekannt gemacht worden ist, ihren Anspruch nach Grund und Höhe schriftlich anmelden, Sicherheit zu leisten, soweit sie nicht Befriedigung verlangen können. Dieses Recht steht den Gläubigern jedoch nur zu, wenn sie glaubhaft machen, dass durch die Verschmelzung die Erfüllung ihrer Forderung gefährdet wird."
    },
    {
      "date": "2024-11-28",
      "id": "94952",
      "original_text": "Registerbekanntmachung nach dem Umwandlungsgesetz\nHessen Amtsgericht Wetzlar HRB 7829\nDH Verwaltungs GmbH – Wetzlar",
      "type": "Registerbekanntmachung nach dem Umwandlungsgesetz",
      "state": "Hessen",
      "amtsgericht": "Amtsgericht Wetzlar",
      "registernummer": "HRB 7829",
      "registerart": "HRB",
      "company_name": "DH Verwaltungs GmbH",
      "company_seat": "Wetzlar",
      "details": "28.11.2024 (Bekanntmachungsdatum)\n\nHessen Amtsgericht Wetzlar HRB 7829\nRegisterbekanntmachung nach dem Umwandlungsgesetz 28.11.2024 (Eintragungsdatum)\n\nDH Verwaltungs GmbH\nGesellschaft mit beschränkter Haftung\nWetzlar\n\nDen Gläubigern der an der Verschmelzung beteiligten Rechtsträger ist, wenn sie binnen sechs Monaten nach dem Tag, an dem die Eintragung der Verschmelzung in das Register des Sitzes desjenigen Rechtsträgers, dessen Gläubiger sie sind, nach § 19 Absatz 3 UmwG bekannt gemacht worden ist, ihren Anspruch nach Grund und Höhe schriftlich anmelden, Sicherheit zu leisten, soweit sie nicht Befriedigung verlangen können. Dieses Recht steht den Gläubigern jedoch nur zu, wenn sie glaubhaft machen, dass durch die Verschmelzung die Erfüllung ihrer Forderung gefährdet wird."
    },
    {
      "date": "2024-11-28",
      "id": "94950",
      "original_text": "Löschungsankündigung\nHessen Amtsgericht Offenbach am Main HRB 50916\nDLSF GmbH – Offenbach am Main",
      "type": "Löschungsankündigung",
      "state": "Hessen",
      "amtsgericht": "Amtsgericht Offenbach am Main",
      "registernummer": "HRB 50916",
      "registerart": "HRB",
      "company_name": "DLSF GmbH",
      "company_seat": "Offenbach am Main",
      "details": "28.11.2024 (Bekanntmachungsdatum)\n\nHessen Amtsgericht Offenbach am Main HRB 50916\nLöschungsankündigung 28.11.2024 (Eintragungsdatum)\n\nDLSF GmbH\nGesellschaft mit beschränkter Haftung\nOffenbach am Main\n\nDas Registergericht beabsichtigt die im Handelsregister eingetragene Gesellschaft von Amts wegen nach § 394 FamFG zu löschen. Die Frist zur Erhebung eines Widerspruchs gegen die beabsichtigte Löschung wird auf 3 Monate festgesetzt."
    },
    {
      "date": "2024-11-28",
      "id": "94931",
      "original_text": "Löschungsankündigung\nNordrhein-Westfalen Amtsgericht Mönchengladbach HRB 11204\nDeko Christ Beteiligungs GmbH – Mönchengladbach",
      "type": "Löschungsankündigung",
      "state": "Nordrhein-Westfalen",
      "amtsgericht": "Amtsgericht Mönchengladbach",
      "registernummer": "HRB 11204",
      "registerart": "HRB",
      "company_name": "Deko Christ Beteiligungs GmbH",
      "company_seat": "Mönchengladbach",
      "details": "28.11.2024 (Bekanntmachungsdatum)\n\nNordrhein-Westfalen Amtsgericht Mönchengladbach HRB 11204\nLöschungsankündigung 28.11.2024 (Eintragungsdatum)\n\nDeko Christ Beteiligungs GmbH\nGesellschaft mit beschränkter Haftung\nMönchengladbach\n\nDas Registergericht beabsichtigt die Gesellschaft von Amts wegen nach § 394 FamFG zu löschen. Die Frist zur Erhebung eines Widerspruchs ist auf drei Monate festgesetzt."
    },
    {
      "date": "2024-11-28",
      "id": "94892",
      "original_text": "Löschungsankündigung\nBrandenburg Amtsgericht Potsdam HRB 12752\nDie Schulzendorfer GmbH – Falkensee",
      "type": "Löschungsankündigung",
      "state": "Brandenburg",
      "amtsgericht": "Amtsgericht Potsdam",
      "registernummer": "HRB 12752",
      "registerart": "HRB",
      "company_name": "Die Schulzendorfer GmbH",
      "company_seat": "Falkensee",
      "details": "28.11.2024 (Bekanntmachungsdatum)\n\nBrandenburg Amtsgericht Potsdam HRB 12752\nLöschungsankündigung\n\nDie Schulzendorfer GmbH\nGesellschaft mit beschränkter Haftung\nFalkensee\n\nBei der nachstehenden Gesellschaft/dem nachstehenden Verein wird das Amtslöschungsverfahren gemäß § 395 FamFG eingeleitet."
    },
    {
      "date": "2024-11-28",
      "id": "94943",
      "original_text": "Einreichung neuer Dokumente\nThüringen Amtsgericht Jena HRB 520056\nELGO Elektrotechnik GmbH – Apolda",
      "type": "Einreichung neuer Dokumente",
      "state": "Thüringen",
      "amtsgericht": "Amtsgericht Jena",
      "registernummer": "HRB 520056",
      "registerart": "HRB",
      "company_name": "ELGO Elektrotechnik GmbH",
      "company_seat": "Apolda",
      "details": "28.11.2024 (Bekanntmachungsdatum)\n\nThüringen Amtsgericht Jena HRB 520056\nEinreichung neuer Dokumente\n\nELGO Elektrotechnik GmbH\nGesellschaft mit beschränkter Haftung\nApolda\n\nBekanntmachung gem. § 52 Abs. 3 Satz 2 GmbHG: Aufgrund einer Veränderung in den Personen der Aufsichtsratsmitglieder ist durch die Geschäftsführer eine neue Liste zum Handelsregister eingereicht worden."
    },
    {
      "date": "2024-11-28",
      "id": "94854",
      "original_text": "Registerbekanntmachung nach dem Umwandlungsgesetz\nBayern Amtsgericht München HRB 128727\nEdwards Lifesciences GmbH – Garching b.München",
      "type": "Registerbekanntmachung nach dem Umwandlungsgesetz",
      "state": "Bayern",
      "amtsgericht": "Amtsgericht München",
      "registernummer": "HRB 128727",
      "registerart": "HRB",
      "company_name": "Edwards Lifesciences GmbH",
      "company_seat": "Garching b.München",
      "details": "28.11.2024 (Bekanntmachungsdatum)\n\nBayern Amtsgericht München HRB 128727\nRegisterbekanntmachung nach dem Umwandlungsgesetz 27.11.2024 (Eintragungsdatum)\n\nEdwards Lifesciences GmbH\nGesellschaft mit beschränkter Haftung\nGarching b.München\n\nDen Gläubigern der an der Verschmelzung beteiligten Rechtsträger ist, wenn sie binnen sechs Monaten nach dem Tag, an dem die Eintragung der Verschmelzung in das Register des Sitzes desjenigen Rechtsträgers, dessen Gläubiger sie sind, nach § 19 Abs. 3 UmwG als bekannt gemacht gilt, ihren Anspruch nach Grund und Höhe schriftlich anmelden, Sicherheit zu leisten, soweit sie nicht Befriedigung verlangen können. Dieses Recht steht den Gläubigern jedoch nur zu, wenn sie glaubhaft machen, dass durch die Verschmelzung die Erfüllung ihrer Forderung gefährdet wird."
    },
    {
      "date": "2024-11-28",
      "id": "94937",
      "original_text": "Registerbekanntmachung nach dem Umwandlungsgesetz\nNordrhein-Westfalen Amtsgericht Essen PR 3\nEggesiecker und Partner Rechtsanwälte Steuerberater Wirtschaftsprüfer Rechtsbeistand – Köln",
      "type": "Registerbekanntmachung nach dem Umwandlungsgesetz",
      "state": "Nordrhein-Westfalen",
      "amtsgericht": "Amtsgericht Essen",
      "registernummer": "PR 3",
      "registerart": "PR",
      "company_name": "Eggesiecker und Partner Rechtsanwälte Steuerberater Wirtschaftsprüfer Rechtsbeistand",
      "company_seat": "Köln",
      "details": "28.11.2024 (Bekanntmachungsdatum)\n\nNordrhein-Westfalen Amtsgericht Essen PR 3\nRegisterbekanntmachung nach dem Umwandlungsgesetz 28.11.2024 (Eintragungsdatum)\n\nEggesiecker und Partner Rechtsanwälte Steuerberater Wirtschaftsprüfer Rechtsbeistand\nPartnerschaftsgesellschaft\nKöln\n\nDen Gläubigern der an der Abspaltung beteiligten Rechtsträger ist, wenn sie binnen sechs Monaten nach dem Tag, an dem die Eintragung der Abspaltung in das Register des Sitzes desjenigen Rechtsträgers, dessen Gläubiger sie sind, nach § 19 Absatz 3 UmwG als bekanntgemacht gilt, ihren Anspruch nach Grund und Höhe schriftlich anmelden, Sicherheit zu leisten, soweit sie nicht Befriedigung verlangen können. Dieses Recht steht den Gläubigern jedoch nur zu, wenn sie glaubhaft machen, dass durch die Abspaltung die Erfüllung ihrer Forderung gefährdet wird."
    },
    {
      "date": "2024-11-28",
      "id": "94958",
      "original_text": "Löschungsankündigung\nHessen Amtsgericht Offenbach am Main HRA 40682\nFITNESS_CONCEPT OHG – Hainburg",
      "type": "Löschungsankündigung",
      "state": "Hessen",
      "amtsgericht": "Amtsgericht Offenbach am Main",
      "registernummer": "HRA 40682",
      "registerart": "HRA",
      "company_name": "FITNESS_CONCEPT OHG",
      "company_seat": "Hainburg",
      "details": "28.11.2024 (Bekanntmachungsdatum)\n\nHessen Amtsgericht Offenbach am Main HRA 40682\nLöschungsankündigung 28.11.2024 (Eintragungsdatum)\n\nFITNESS_CONCEPT OHG\nOffene Handelsgesellschaft\nHainburg\n\nDas Registergericht beabsichtigt die im Handelsregister eingetragene Firma von Amts wegen nach § 31 Abs. 2 HGB  i. V. m. § 393 FamFG zu löschen. Die Frist zur Erhebung eines Widerspruchs gegen die beabsichtigte Löschung wird auf 3 Monate festgesetzt."
    },
    {
      "date": "2024-11-28",
      "id": "94928",
      "original_text": "Registerbekanntmachung nach dem Umwandlungsgesetz\nRheinland-Pfalz Amtsgericht Montabaur HRB 25453\nFischer Management Company GmbH – Katzenelnbogen",
      "type": "Registerbekanntmachung nach dem Umwandlungsgesetz",
      "state": "Rheinland-Pfalz",
      "amtsgericht": "Amtsgericht Montabaur",
      "registernummer": "HRB 25453",
      "registerart": "HRB",
      "company_name": "Fischer Management Company GmbH",
      "company_seat": "Katzenelnbogen",
      "details": "28.11.2024 (Bekanntmachungsdatum)\n\nRheinland-Pfalz Amtsgericht Montabaur HRB 25453\nRegisterbekanntmachung nach dem Umwandlungsgesetz 28.11.2024 (Eintragungsdatum)\n\nFischer Management Company GmbH\nGesellschaft mit beschränkter Haftung\nKatzenelnbogen\n\nAls nicht eingetragen wird veröffentlicht: Den Gläubigern der an der Verschmelzung beteiligten Rechtsträger ist, wenn sie binnen sechs Monaten nach dem Tag, an dem die Eintragung der Verschmelzung in das Register des Sitzes desjenigen Rechtsträgers,dessen Gläubiger sie sind, nach § 19 Abs. 3 UmwG als bekannt gemacht gilt, ihren Anspruch nach Grund und Höhe schriftlich anmelden, Sicherheit zu leisten, soweit sie nicht Befriedigung verlangen können. Dieses Recht steht den Gläubigern jedoch nur zu, wenn sie glaubhaft machen, dass durch die Verschmelzung die Erfüllungd er Forderung gefährdet wird.\"wird."
    },
    {
      "date": "2024-11-28",
      "id": "94961",
      "original_text": "Löschungsankündigung\nHessen Amtsgericht Frankfurt am Main HRB 118311\nFrankfurter Projekt- und Entwicklungsgesellschaft mbH – Frankfurt am Main",
      "type": "Löschungsankündigung",
      "state": "Hessen",
      "amtsgericht": "Amtsgericht Frankfurt am Main",
      "registernummer": "HRB 118311",
      "registerart": "HRB",
      "company_name": "Frankfurter Projekt- und Entwicklungsgesellschaft mbH",
      "company_seat": "Frankfurt am Main",
      "details": "28.11.2024 (Bekanntmachungsdatum)\n\nHessen Amtsgericht Frankfurt am Main HRB 118311\nLöschungsankündigung\n\nFrankfurter Projekt- und Entwicklungsgesellschaft mbH\nGesellschaft mit beschränkter Haftung\nFrankfurt am Main\n\nDas Registergericht beabsichtigt die im Handelsregister eingetragene Gesellschaft von Amts wegen nach § 394 FamFG zu löschen. Die Frist zur Erhebung eines Widerspruchs gegen die beabsichtigte Löschung wird auf 1 Monat festgesetzt."
    },
    {
      "date": "2024-11-28",
      "id": "94875",
      "original_text": "Einreichung neuer Dokumente\nBaden-Württemberg Amtsgericht Mannheim HRB 433058\nFreudenberg Rückversicherung AG – Weinheim",
      "type": "Einreichung neuer Dokumente",
      "state": "Baden-Württemberg",
      "amtsgericht": "Amtsgericht Mannheim",
      "registernummer": "HRB 433058",
      "registerart": "HRB",
      "company_name": "Freudenberg Rückversicherung AG",
      "company_seat": "Weinheim",
      "details": "28.11.2024 (Bekanntmachungsdatum)\n\nBaden-Württemberg Amtsgericht Mannheim HRB 433058\nEinreichung neuer Dokumente\n\nFreudenberg Rückversicherung AG\nAktiengesellschaft\nWeinheim\n\nDie Gesellschaft hat am 26.11.2024 die Liste über die Zusammensetzung des Aufsichtsrats zum Handelsregister eingereicht."
    },
    {
      "date": "2024-11-28",
      "id": "94872",
      "original_text": "Registerbekanntmachung nach dem Umwandlungsgesetz\nBaden-Württemberg Amtsgericht Stuttgart HRA 723793\nG-S Assekuranz GmbH & Co. KG Versicherungsmakler – Heilbronn",
      "type": "Registerbekanntmachung nach dem Umwandlungsgesetz",
      "state": "Baden-Württemberg",
      "amtsgericht": "Amtsgericht Stuttgart",
      "registernummer": "HRA 723793",
      "registerart": "HRA",
      "company_name": "G-S Assekuranz GmbH & Co. KG Versicherungsmakler",
      "company_seat": "Heilbronn",
      "details": "28.11.2024 (Bekanntmachungsdatum)\n\nBaden-Württemberg Amtsgericht Stuttgart HRA 723793\nRegisterbekanntmachung nach dem Umwandlungsgesetz 28.11.2024 (Eintragungsdatum)\n\nG-S Assekuranz GmbH & Co. KG Versicherungsmakler\nKommanditgesellschaft\nHeilbronn\n\nAls nicht eingetragen wird bekanntgemacht:\nDen Gläubigern des an dem Formwechsel beteiligten Rechtsträgers ist, wenn sie binnen sechs Monaten nach dem Tag, an dem die Eintragung des Formwechsels in das Register des Sitzes desjenigen Rechtsträgers, dessen Gläubiger sie sind, nach § 19 Abs. 3 UmwG als bekanntgemacht gilt, ihren Anspruch nach Grund und Höhe schriftlich anmelden, Sicherheit zu leisten, soweit sie nicht Befriedigung verlangen können. Dieses Recht steht den Gläubigern jedoch nur zu, wenn sie glaubhaft machen, dass durch den Formwechsel die Erfüllung ihrer Forderung gefährdet wird."
    },
    {
      "date": "2024-11-28",
      "id": "94963",
      "original_text": "Löschungsankündigung\nHessen Amtsgericht Offenbach am Main HRB 48405\nGreat Prospect GmbH – Neu-Isenburg",
      "type": "Löschungsankündigung",
      "state": "Hessen",
      "amtsgericht": "Amtsgericht Offenbach am Main",
      "registernummer": "HRB 48405",
      "registerart": "HRB",
      "company_name": "Great Prospect GmbH",
      "company_seat": "Neu-Isenburg",
      "details": "28.11.2024 (Bekanntmachungsdatum)\n\nHessen Amtsgericht Offenbach am Main HRB 48405\nLöschungsankündigung 28.11.2024 (Eintragungsdatum)\n\nGreat Prospect GmbH\nGesellschaft mit beschränkter Haftung\nNeu-Isenburg\n\nDas Registergericht beabsichtigt die im Handelsregister eingetragene Gesellschaft von Amts wegen nach § 394 FamFG zu löschen. Die Frist zur Erhebung eines Widerspruchs gegen die beabsichtigte Löschung wird auf 3 Monate festgesetzt."
    },
    {
      "date": "2024-11-28",
      "id": "94946",
      "original_text": "Löschungsankündigung\nHessen Amtsgericht Offenbach am Main HRB 51905\nH & K Service GmbH – Neu-Isenburg",
      "type": "Löschungsankündigung",
      "state": "Hessen",
      "amtsgericht": "Amtsgericht Offenbach am Main",
      "registernummer": "HRB 51905",
      "registerart": "HRB",
      "company_name": "H & K Service GmbH",
      "company_seat": "Neu-Isenburg",
      "details": "28.11.2024 (Bekanntmachungsdatum)\n\nHessen Amtsgericht Offenbach am Main HRB 51905\nLöschungsankündigung 28.11.2024 (Eintragungsdatum)\n\nH & K Service GmbH\nGesellschaft mit beschränkter Haftung\nNeu-Isenburg\n\nDas Registergericht beabsichtigt die im Handelsregister eingetragene Gesellschaft von Amts wegen nach § 394 FamFG zu löschen. Die Frist zur Erhebung eines Widerspruchs gegen die beabsichtigte Löschung wird auf 3 Monate festgesetzt."
    },
    {
      "date": "2024-11-28",
      "id": "94883",
      "original_text": "Löschungsankündigung\nBerlin Amtsgericht Berlin (Charlottenburg) HRB 147283\nHVS Stahlhandel GmbH – Berlin",
      "type": "Löschungsankündigung",
      "state": "Berlin",
      "amtsgericht": "Amtsgericht Berlin (Charlottenburg)",
      "registernummer": "HRB 147283",
      "registerart": "HRB",
      "company_name": "HVS Stahlhandel GmbH",
      "company_seat": "Berlin",
      "details": "28.11.2024 (Bekanntmachungsdatum)\n\nBerlin Amtsgericht Berlin (Charlottenburg) HRB 147283\nLöschungsankündigung\n\nHVS Stahlhandel GmbH\nGesellschaft mit beschränkter Haftung\nBerlin\n\nBei der nachstehenden Gesellschaft wird das Amtslöschungsverfahren gemäß § 394 FamFG eingeleitet. Widerspruchsfrist 6 Wochen"
    },
    {
      "date": "2024-11-28",
      "id": "94926",
      "original_text": "Registerbekanntmachung nach dem Umwandlungsgesetz\nRheinland-Pfalz Amtsgericht Bad Kreuznach HRB 24595\nHahn Bau GmbH – Idar-Oberstein",
      "type": "Registerbekanntmachung nach dem Umwandlungsgesetz",
      "state": "Rheinland-Pfalz",
      "amtsgericht": "Amtsgericht Bad Kreuznach",
      "registernummer": "HRB 24595",
      "registerart": "HRB",
      "company_name": "Hahn Bau GmbH",
      "company_seat": "Idar-Oberstein",
      "details": "28.11.2024 (Bekanntmachungsdatum)\n\nRheinland-Pfalz Amtsgericht Bad Kreuznach HRB 24595\nRegisterbekanntmachung nach dem Umwandlungsgesetz 28.11.2024 (Eintragungsdatum)\n\nHahn Bau GmbH\nGesellschaft mit beschränkter Haftung\nIdar-Oberstein\n\nAls nicht eingetragen wird veröffentlicht:\nDen Gläubigern des formwechselnden Rechtsträgers ist, wenn sie binnen sechs Monaten nach dem Tag, an dem die Eintragung des Formwechsels nach § 201 UmwG als bekannt gemacht gilt, ihren Anspruch nach Grund und Höhe schriftlich anmelden, Sicherheit zu leisten, soweit sie nicht Befriedigung verlangen können. Dieses Recht steht den Gläubigern jedoch nur zu, wenn sie glaubhaft machen, dass durch den Formwechsel die Erfüllung der Forderung gefährdet wird."
    },
    {
      "date": "2024-11-28",
      "id": "94927",
      "original_text": "Registerbekanntmachung nach dem Umwandlungsgesetz\nRheinland-Pfalz Amtsgericht Bad Kreuznach HRA 21155\nHahn Bau GmbH & Co. KG – Idar-Oberstein",
      "type": "Registerbekanntmachung nach dem Umwandlungsgesetz",
      "state": "Rheinland-Pfalz",
      "amtsgericht": "Amtsgericht Bad Kreuznach",
      "registernummer": "HRA 21155",
      "registerart": "HRA",
      "company_name": "Hahn Bau GmbH & Co. KG",
      "company_seat": "Idar-Oberstein",
      "details": "28.11.2024 (Bekanntmachungsdatum)\n\nRheinland-Pfalz Amtsgericht Bad Kreuznach HRA 21155\nRegisterbekanntmachung nach dem Umwandlungsgesetz 28.11.2024 (Eintragungsdatum)\n\nHahn Bau GmbH & Co. KG\nKommanditgesellschaft\nIdar-Oberstein\n\nAls nicht eingetragen wird veröffentlicht:\nDen Gläubigern des formwechselnden Rechtsträgers ist, wenn sie binnen sechs Monaten nach dem Tag, an dem die Eintragung des Formwechsels nach § 201 UmwG als bekannt gemacht gilt, ihren Anspruch nach Grund und Höhe schriftlich anmelden, Sicherheit zu leisten, soweit sie nicht Befriedigung verlangen können. Dieses Recht steht den Gläubigern jedoch nur zu, wenn sie glaubhaft machen, dass durch den Formwechsel die Erfüllung der Forderung gefährdet wird."
    },
    {
      "date": "2024-11-28",
      "id": "94936",
      "original_text": "Registerbekanntmachung nach dem Umwandlungsgesetz\nNordrhein-Westfalen Amtsgericht Köln GsR 1127\nHausmeister Karakulidis eGbR – Bergisch Gladbach",
      "type": "Registerbekanntmachung nach dem Umwandlungsgesetz",
      "state": "Nordrhein-Westfalen",
      "amtsgericht": "Amtsgericht Köln",
      "registernummer": "GsR 1127",
      "registerart": "GsR",
      "company_name": "Hausmeister Karakulidis eGbR",
      "company_seat": "Bergisch Gladbach",
      "details": "28.11.2024 (Bekanntmachungsdatum)\n\nNordrhein-Westfalen Amtsgericht Köln GsR 1127\nRegisterbekanntmachung nach dem Umwandlungsgesetz 28.11.2024 (Eintragungsdatum)\n\nHausmeister Karakulidis eGbR\nGesellschaft bürgerlichen Rechts\nBergisch Gladbach\n\nDen Gläubigern der an der Verschmelzung beteiligten Rechtsträger ist, wenn sie binnen sechs Monaten nach dem Tag, an dem die Eintragung der Verschmelzung in das Register des Sitzes desjenigen Rechtsträgers, dessen Gläubiger sie sind, nach § 19 Absatz 3 UmwG als bekanntgemacht gilt, ihren Anspruch nach Grund und Höhe schriftlich anmelden, Sicherheit zu leisten, soweit sie nicht Befriedigung verlangen können. Dieses Recht steht den Gläubigern jedoch nur zu, wenn sie glaubhaft machen, dass durch die Verschmelzung die Erfüllung ihrer Forderung gefährdet wird."
    },
    {
      "date": "2024-11-28",
      "id": "94886",
      "original_text": "Registerbekanntmachung nach dem Umwandlungsgesetz\nHamburg Amtsgericht Hamburg HRB 160009\nHermes Druckerservice GmbH – Hamburg",
      "type": "Registerbekanntmachung nach dem Umwandlungsgesetz",
      "state": "Hamburg",
      "amtsgericht": "Amtsgericht Hamburg",
      "registernummer": "HRB 160009",
      "registerart": "HRB",
      "company_name": "Hermes Druckerservice GmbH",
      "company_seat": "Hamburg",
      "details": "28.11.2024 (Bekanntmachungsdatum)\n\nHamburg Amtsgericht Hamburg HRB 160009\nRegisterbekanntmachung nach dem Umwandlungsgesetz 28.11.2024 (Eintragungsdatum)\n\nHermes Druckerservice GmbH\nGesellschaft mit beschränkter Haftung\nHamburg\n\nAls nicht eingetragen wird bekannt gemacht:\nDen Gläubigern der an der Verschmelzung beteiligten Gesellschaften ist, wenn sie binnen sechs Monaten nach dem Tag, an dem die Eintragung der Verschmelzung in das Register des Sitzes desjenigen Rechtsträgers, dessen Gläubiger sie sind, nach § 19 Absatz 3 UmwG als bekannt gemacht gilt, ihren Anspruch nach Grund und Höhe schriftlich anmelden, Sicherheit zu leisten, soweit sie nicht Befriedigung verlangen können. Dieses Recht steht den Gläubigern jedoch nur zu, wenn sie glaubhaft machen, dass durch die Verschmelzung die Erfüllung ihrer Forderung gefährdet wird."
    },
    {
      "date": "2024-11-28",
      "id": "94873",
      "original_text": "Registerbekanntmachung nach dem Umwandlungsgesetz\nBaden-Württemberg Amtsgericht Stuttgart HRB 797275\nHörtkorn Marine + Cargo GmbH – Heilbronn",
      "type": "Registerbekanntmachung nach dem Umwandlungsgesetz",
      "state": "Baden-Württemberg",
      "amtsgericht": "Amtsgericht Stuttgart",
      "registernummer": "HRB 797275",
      "registerart": "HRB",
      "company_name": "Hörtkorn Marine + Cargo GmbH",
      "company_seat": "Heilbronn",
      "details": "28.11.2024 (Bekanntmachungsdatum)\n\nBaden-Württemberg Amtsgericht Stuttgart HRB 797275\nRegisterbekanntmachung nach dem Umwandlungsgesetz 28.11.2024 (Eintragungsdatum)\n\nHörtkorn Marine + Cargo GmbH\nGesellschaft mit beschränkter Haftung\nHeilbronn\n\nAls nicht eingetragen wird bekanntgemacht:\nDen Gläubigern des an dem Formwechsel beteiligten Rechtsträgers ist, wenn sie binnen sechs Monaten nach dem Tag, an dem die Eintragung des Formwechsels in das Register des Sitzes desjenigen Rechtsträgers, dessen Gläubiger sie sind, nach § 19 Abs. 3 UmwG als bekanntgemacht gilt, ihren Anspruch nach Grund und Höhe schriftlich anmelden, Sicherheit zu leisten, soweit sie nicht Befriedigung verlangen können. Dieses Recht steht den Gläubigern jedoch nur zu, wenn sie glaubhaft machen, dass durch den Formwechsel die Erfüllung ihrer Forderung gefährdet wird."
    },
    {
      "date": "2024-11-28",
      "id": "94853",
      "original_text": "Registerbekanntmachung nach dem Umwandlungsgesetz\nBayern Amtsgericht München HRB 249181\nINOS 19-025 GmbH – München",
      "type": "Registerbekanntmachung nach dem Umwandlungsgesetz",
      "state": "Bayern",
      "amtsgericht": "Amtsgericht München",
      "registernummer": "HRB 249181",
      "registerart": "HRB",
      "company_name": "INOS 19-025 GmbH",
      "company_seat": "München",
      "details": "28.11.2024 (Bekanntmachungsdatum)\n\nBayern Amtsgericht München HRB 249181\nRegisterbekanntmachung nach dem Umwandlungsgesetz 27.11.2024 (Eintragungsdatum)\n\nINOS 19-025 GmbH\nGesellschaft mit beschränkter Haftung\nMünchen\n\nDen Gläubigern der an der Verschmelzung beteiligten Rechtsträger ist, wenn sie binnen sechs Monaten nach dem Tag, an dem die Eintragung der Verschmelzung in das Register des Sitzes desjenigen Rechtsträgers, dessen Gläubiger sie sind, nach § 19 Abs. 3 UmwG als bekannt gemacht gilt, ihren Anspruch nach Grund und Höhe schriftlich anmelden, Sicherheit zu leisten, soweit sie nicht Befriedigung verlangen können. Dieses Recht steht den Gläubigern jedoch nur zu, wenn sie glaubhaft machen, dass durch die Verschmelzung die Erfüllung ihrer Forderung gefährdet wird."
    },
    {
      "date": "2024-11-28",
      "id": "94905",
      "original_text": "Registerbekanntmachung nach dem Umwandlungsgesetz\nHamburg Amtsgericht Hamburg HRB 77103\nINTERSOFT Aktiengesellschaft – Hamburg",
      "type": "Registerbekanntmachung nach dem Umwandlungsgesetz",
      "state": "Hamburg",
      "amtsgericht": "Amtsgericht Hamburg",
      "registernummer": "HRB 77103",
      "registerart": "HRB",
      "company_name": "INTERSOFT Aktiengesellschaft",
      "company_seat": "Hamburg",
      "details": "28.11.2024 (Bekanntmachungsdatum)\n\nHamburg Amtsgericht Hamburg HRB 77103\nRegisterbekanntmachung nach dem Umwandlungsgesetz 28.11.2024 (Eintragungsdatum)\n\nINTERSOFT Aktiengesellschaft\nAktiengesellschaft\nHamburg\n\nAls nicht eingetragen wird bekannt gemacht:\nDen Gläubigern der an der formwechselnden Umwandlung beteiligten Gesellschaften ist, wenn sie binnen sechs Monaten nach dem Tag, an dem die Eintragung der formwechselnden Umwandlung in das Register des Sitzes desjenigen Rechtsträgers, dessen Gläubiger sie sind, nach § 19 Absatz 3 UmwG als bekannt gemacht gilt, ihren Anspruch nach Grund und Höhe schriftlich anmelden, Sicherheit zu leisten, soweit sie nicht Befriedigung verlangen können. Dieses Recht steht den Gläubigern jedoch nur zu, wenn sie glaubhaft machen, dass durch die formwechselnde Umwandlung die Erfüllung ihrer Forderung gefährdet wird."
    },
    {
      "date": "2024-11-28",
      "id": "94850",
      "original_text": "Löschungsankündigung\nBayern Amtsgericht Kempten (Allgäu) HRB 11717\nINTRA GmbH – Kempten (Allgäu)",
      "type": "Löschungsankündigung",
      "state": "Bayern",
      "amtsgericht": "Amtsgericht Kempten (Allgäu)",
      "registernummer": "HRB 11717",
      "registerart": "HRB",
      "company_name": "INTRA GmbH",
      "company_seat": "Kempten (Allgäu)",
      "details": "28.11.2024 (Bekanntmachungsdatum)\n\nBayern Amtsgericht Kempten (Allgäu) HRB 11717\nLöschungsankündigung\n\nINTRA GmbH\nGesellschaft mit beschränkter Haftung\nKempten (Allgäu)\n\nDas Registergericht beabsichtigt, die im Handelsregister eingetragene Gesellschaft wegen Vermögenslosigkeit von Amts wegen nach § 394 FamFG zu löschen. Die Frist zur Erhebung eines Widerspruchs ist auf einen Monat festgesetzt."
    },
    {
      "date": "2024-11-28",
      "id": "66",
      "original_text": "Sonderregisterbekanntmachung OHNE Bezug zum elektr. Register\nBerlin Amtsgericht Berlin (Charlottenburg)\n99 AR 11086/24 (Altgericht: AG Handelsregisteramt des Kantons Zug/CHE 103.302.780\nJML Holding AG mit Sitz in Zug/Schweiz",
      "type": "Sonderregisterbekanntmachung OHNE Bezug zum elektr. Register",
      "state": "Berlin",
      "amtsgericht": "Amtsgericht Berlin (Charlottenburg)",
      "company_name": "JML Holding AG mit Sitz in Zug/Schweiz",
      "sonderegister_referenz": "99 AR 11086/24 (Altgericht: AG Handelsregisteramt des Kantons Zug/CHE 103.302.780",
      "details": "28.11.2024 (Bekanntmachungsdatum)\n\nBerlin Amtsgericht Berlin (Charlottenburg)\n99 AR 11086/24 (Altgericht: AG Handelsregisteramt des Kantons Zug/CHE 103.302.780\nSonderregisterbekanntmachung OHNE Bezug zum elektr. Register\n\nJML Holding AG mit Sitz in Zug/Schweiz\n\nIn dem unternehmensrechtlichen Verfahren der JML Holding AG mit Sitz in Zug (AG Handelsregisteramt des Kantons Zug, CHE 103.302.780)\nliegt dem Registergericht ein Antrag vom 29.10.2024, ergänzt am 19.11.2024, des Herrn Dr. Tilo Wend, Geschäftsführer der knowledgeTools International GmbH mit Sitz in Berlin (Amtsgericht Charlottenburg HRB 86378 B), vor.\nDarin wird beantragt, zur Abwicklung der JML Holding AG mit Sitz in Zug Nachtragsliquidation anzuordnen und Herrn Rechtsanwalt Andreas von Schorlemer Habsburgerstr. 9, 80801 München zum Nachtragsliquidator zu bestellen.\nDer Nachtragsliquidator soll die Rechte der Gesellschaft JML AG Zug beim Entzug der Gesellschaftsanteile und der Auskehr der entsprechenden Abfindung wahrnehmen.\n\nBEGRÜNDUNG:\nDie gelöschte JML Holding AG hat weiterhin Vermögen. Sie ist mit 25% an der knowledgeTools International GmbH, Friedrichstr. 123, 10117 Berlin (HRB 86378) beteiligt.\nDie JML AG ist seit dem 04.08.2015 gelöscht. Damit liegen die Voraussetzungen vor, den Gesellschaftsanteil einzuziehen. Der gelöschten Gesellschaft steht ein Abfindungsanspruch zu.\nDie knowledgeTools International GmbH hat ein berechtigtes Interesse an der Nachtragsliquidation. Mangels Zustellungsmöglichkeit kann die Einziehung des Gesellschaftsanteils nicht erfolgen. Darüber hinaus fällt der Abfindungsanspruch an, der bisher nicht abgewickelt werden kann. Da der Abfindungsanspruch in der Bundesrepublik Deutschland besteht, wird hier die Nachtragsliquidation beantragt.\n\nDas Registergericht beabsichtigt zum jetzigen Zeitpunkt, diesem Antrag auf Bestellung des Nachtragsliquidators stattzugeben, soweit nicht binnen einer Frist von einem Monat ab Veröffentlichung Widerspruch erhoben wird. Ein Widerspruch ist entsprechend schriftlich oder elektronisch bei dem Amtsgericht Charlottenburg, DG Hardenbergstraße 31, 10623 Berlin, zum o.g. Aktenzeichen einzureichen. Der Widerspruch ist zu begründen, da eine Berücksichtigung im Verfahren andernfalls nicht erfolgen kann."
    },
    {
      "date": "2024-11-28",
      "id": "94904",
      "original_text": "Löschungsankündigung\nMecklenburg-Vorpommern Amtsgericht Schwerin HRB 13295\nJP Bau GmbH – Banzkow",
      "type": "Löschungsankündigung",
      "state": "Mecklenburg-Vorpommern",
      "amtsgericht": "Amtsgericht Schwerin",
      "registernummer": "HRB 13295",
      "registerart": "HRB",
      "company_name": "JP Bau GmbH",
      "company_seat": "Banzkow",
      "details": "28.11.2024 (Bekanntmachungsdatum)\n\nMecklenburg-Vorpommern Amtsgericht Schwerin HRB 13295\nLöschungsankündigung\n\nJP Bau GmbH\nGesellschaft mit beschränkter Haftung\nBanzkow\n\nDas Registergericht beabsichtigt, die im Handelsregister eingetragene Gesellschaft von Amts wegen nach § 394 FamFG zu löschen. Die Frist zur Erhebung eines Widerspruchs gegen die beabsichtigte Löschung wird auf 1 Monat festgesetzt."
    },
    {
      "date": "2024-11-28",
      "id": "94912",
      "original_text": "Registerbekanntmachung nach dem Umwandlungsgesetz\nBrandenburg Amtsgericht Neuruppin HRA 3864\nJeanett und Oliver Giese Vermietung Havelstrasse oHG – Liebenwalde",
      "type": "Registerbekanntmachung nach dem Umwandlungsgesetz",
      "state": "Brandenburg",
      "amtsgericht": "Amtsgericht Neuruppin",
      "registernummer": "HRA 3864",
      "registerart": "HRA",
      "company_name": "Jeanett und Oliver Giese Vermietung Havelstrasse oHG",
      "company_seat": "Liebenwalde",
      "details": "28.11.2024 (Bekanntmachungsdatum)\n\nBrandenburg Amtsgericht Neuruppin HRA 3864\nRegisterbekanntmachung nach dem Umwandlungsgesetz 27.11.2024 (Eintragungsdatum)\n\nJeanett und Oliver Giese Vermietung Havelstrasse oHG\nOffene Handelsgesellschaft\nLiebenwalde\n\nZu Eintragungsnummer 2 vom 27.11.2024 wird als nicht eingetragen veröffentlicht:\nDen Gläubigern der an der Umwandlung beteiligten Rechtsträger ist, wenn sie binnen sechs Monaten nach dem Tag, an dem die Eintragung der Umwandlung in das Register des Sitzes desjenigen Rechtsträgers, dessen Gläubiger sie sind, als bekannt gemacht gilt, ihren Anspruch nach Grund und Höhe schriftlich anmelden, Sicherheit zu leisten, soweit sie nicht Befriedigung verlangen können. Dieses Recht steht den Gläubigern jedoch nur zu, wenn sie glaubhaft machen, dass durch die Umwandlung die Erfüllung ihrer Forderung gefährdet wird"
    },
    {
      "date": "2024-11-28",
      "id": "94890",
      "original_text": "Einreichung neuer Dokumente\nBerlin Amtsgericht Berlin (Charlottenburg) HRB 127258\nJoblinge gemeinnützige AG Berlin – Berlin",
      "type": "Einreichung neuer Dokumente",
      "state": "Berlin",
      "amtsgericht": "Amtsgericht Berlin (Charlottenburg)",
      "registernummer": "HRB 127258",
      "registerart": "HRB",
      "company_name": "Joblinge gemeinnützige AG Berlin",
      "company_seat": "Berlin",
      "details": "28.11.2024 (Bekanntmachungsdatum)\n\nBerlin Amtsgericht Berlin (Charlottenburg) HRB 127258\nEinreichung neuer Dokumente\n\nJoblinge gemeinnützige AG Berlin\nAktiengesellschaft\nBerlin\n\nAls nicht eingetragen wird veröffentlicht:Es wurde eine neue Liste der Aufsichtsratsmitglieder eingereicht (§ 106 AktG)."
    },
    {
      "date": "2024-11-28",
      "id": "94894",
      "original_text": "Löschungsankündigung\nBaden-Württemberg Amtsgericht Mannheim HRA 1009\nJohann Stahl, Kessel-Apparatebau, GmbH & Co. KG. – Mannheim",
      "type": "Löschungsankündigung",
      "state": "Baden-Württemberg",
      "amtsgericht": "Amtsgericht Mannheim",
      "registernummer": "HRA 1009",
      "registerart": "HRA",
      "company_name": "Johann Stahl, Kessel-Apparatebau, GmbH & Co. KG.",
      "company_seat": "Mannheim",
      "details": "28.11.2024 (Bekanntmachungsdatum)\n\nBaden-Württemberg Amtsgericht Mannheim HRA 1009\nLöschungsankündigung\n\nJohann Stahl, Kessel-Apparatebau, GmbH & Co. KG.\nKommanditgesellschaft\nMannheim\n\nDas Gericht beabsichtigt, die Gesellschaft wegen Vermögenslosigkeit im Handelsregister von Amts wegen nach § 394 FamFG zu löschen. Die Frist zur Geltendmachung eines Widerspruchs gegen die beabsichtigte Löschung ist auf einen Monat ab Veröffentlichung bestimmt."
    },
    {
      "date": "2024-11-28",
      "id": "94945",
      "original_text": "Registerbekanntmachung nach dem Umwandlungsgesetz\nHessen Amtsgericht Frankfurt am Main HRB 134375\nJohnson Matthey Battery Materials GmbH – Sulzbach (Taunus)",
      "type": "Registerbekanntmachung nach dem Umwandlungsgesetz",
      "state": "Hessen",
      "amtsgericht": "Amtsgericht Frankfurt am Main",
      "registernummer": "HRB 134375",
      "registerart": "HRB",
      "company_name": "Johnson Matthey Battery Materials GmbH",
      "company_seat": "Sulzbach (Taunus)",
      "details": "28.11.2024 (Bekanntmachungsdatum)\n\nHessen Amtsgericht Frankfurt am Main HRB 134375\nRegisterbekanntmachung nach dem Umwandlungsgesetz 28.11.2024 (Eintragungsdatum)\n\nJohnson Matthey Battery Materials GmbH\nGesellschaft mit beschränkter Haftung\nSulzbach (Taunus)\n\nDen Gläubigern der an der Verschmelzung beteiligten Rechtsträger ist, wenn sie binnen sechs Monaten nach dem Tag, an dem die Eintragung der Verschmelzung in das Register des Sitzes desjenigen Rechtsträgers, dessen Gläubiger sie sind, nach § 19 Absatz 3 UmwG bekannt gemacht worden ist, ihren Anspruch nach Grund und Höhe schriftlich anmelden, Sicherheit zu leisten, soweit sie nicht Befriedigung verlangen können. Dieses Recht steht den Gläubigern jedoch nur zu, wenn sie glaubhaft machen, dass durch die Verschmelzung die Erfüllung ihrer Forderung gefährdet wird."
    },
    {
      "date": "2024-11-28",
      "id": "94957",
      "original_text": "Registerbekanntmachung nach dem Umwandlungsgesetz\nHessen Amtsgericht Frankfurt am Main HRB 128720\nJohnson Matthey Deutschland GmbH – Sulzbach (Taunus)",
      "type": "Registerbekanntmachung nach dem Umwandlungsgesetz",
      "state": "Hessen",
      "amtsgericht": "Amtsgericht Frankfurt am Main",
      "registernummer": "HRB 128720",
      "registerart": "HRB",
      "company_name": "Johnson Matthey Deutschland GmbH",
      "company_seat": "Sulzbach (Taunus)",
      "details": "28.11.2024 (Bekanntmachungsdatum)\n\nHessen Amtsgericht Frankfurt am Main HRB 128720\nRegisterbekanntmachung nach dem Umwandlungsgesetz 28.11.2024 (Eintragungsdatum)\n\nJohnson Matthey Deutschland GmbH\nGesellschaft mit beschränkter Haftung\nSulzbach (Taunus)\n\nDen Gläubigern der an der Verschmelzung beteiligten Rechtsträger ist, wenn sie binnen sechs Monaten nach dem Tag, an dem die Eintragung der Verschmelzung in das Register des Sitzes desjenigen Rechtsträgers, dessen Gläubiger sie sind, nach § 19 Absatz 3 UmwG bekannt gemacht worden ist, ihren Anspruch nach Grund und Höhe schriftlich anmelden, Sicherheit zu leisten, soweit sie nicht Befriedigung verlangen können. Dieses Recht steht den Gläubigern jedoch nur zu, wenn sie glaubhaft machen, dass durch die Verschmelzung die Erfüllung ihrer Forderung gefährdet wird."
    },
    {
      "date": "2024-11-28",
      "id": "94956",
      "original_text": "Registerbekanntmachung nach dem Umwandlungsgesetz\nHessen Amtsgericht Frankfurt am Main HRB 103410\nJohnson Matthey Management GmbH – Sulzbach",
      "type": "Registerbekanntmachung nach dem Umwandlungsgesetz",
      "state": "Hessen",
      "amtsgericht": "Amtsgericht Frankfurt am Main",
      "registernummer": "HRB 103410",
      "registerart": "HRB",
      "company_name": "Johnson Matthey Management GmbH",
      "company_seat": "Sulzbach",
      "details": "28.11.2024 (Bekanntmachungsdatum)\n\nHessen Amtsgericht Frankfurt am Main HRB 103410\nRegisterbekanntmachung nach dem Umwandlungsgesetz 28.11.2024 (Eintragungsdatum)\n\nJohnson Matthey Management GmbH\nGesellschaft mit beschränkter Haftung\nSulzbach\n\nDen Gläubigern der an der Verschmelzung beteiligten Rechtsträger ist, wenn sie binnen sechs Monaten nach dem Tag, an dem die Eintragung der Verschmelzung in das Register des Sitzes desjenigen Rechtsträgers, dessen Gläubiger sie sind, nach § 19 Absatz 3 UmwG bekannt gemacht worden ist, ihren Anspruch nach Grund und Höhe schriftlich anmelden, Sicherheit zu leisten, soweit sie nicht Befriedigung verlangen können. Dieses Recht steht den Gläubigern jedoch nur zu, wenn sie glaubhaft machen, dass durch die Verschmelzung die Erfüllung ihrer Forderung gefährdet wird."
    },
    {
      "date": "2024-11-28",
      "id": "94962",
      "original_text": "Löschungsankündigung\nHessen Amtsgericht Frankfurt am Main HRB 94118\nKBS Dienstleistungen GmbH – Frankfurt am Main",
      "type": "Löschungsankündigung",
      "state": "Hessen",
      "amtsgericht": "Amtsgericht Frankfurt am Main",
      "registernummer": "HRB 94118",
      "registerart": "HRB",
      "company_name": "KBS Dienstleistungen GmbH",
      "company_seat": "Frankfurt am Main",
      "details": "28.11.2024 (Bekanntmachungsdatum)\n\nHessen Amtsgericht Frankfurt am Main HRB 94118\nLöschungsankündigung\n\nKBS Dienstleistungen GmbH\nGesellschaft mit beschränkter Haftung\nFrankfurt am Main\n\nDas Registergericht beabsichtigt die im Handelsregister eingetragene Gesellschaft von Amts wegen nach § 394 FamFG zu löschen. Die Frist zur Erhebung eines Widerspruchs gegen die beabsichtigte Löschung wird auf 1 Monat festgesetzt."
    },
    {
      "date": "2024-11-28",
      "id": "94934",
      "original_text": "Registerbekanntmachung nach dem Umwandlungsgesetz\nNordrhein-Westfalen Amtsgericht Köln HRA 29859\nKarakulidis GmbH & Co. KG – Bergisch Gladbach",
      "type": "Registerbekanntmachung nach dem Umwandlungsgesetz",
      "state": "Nordrhein-Westfalen",
      "amtsgericht": "Amtsgericht Köln",
      "registernummer": "HRA 29859",
      "registerart": "HRA",
      "company_name": "Karakulidis GmbH & Co. KG",
      "company_seat": "Bergisch Gladbach",
      "details": "28.11.2024 (Bekanntmachungsdatum)\n\nNordrhein-Westfalen Amtsgericht Köln HRA 29859\nRegisterbekanntmachung nach dem Umwandlungsgesetz 28.11.2024 (Eintragungsdatum)\n\nKarakulidis GmbH & Co. KG\nKommanditgesellschaft\nBergisch Gladbach\n\nDen Gläubigern der an der Verschmelzung beteiligten Rechtsträger ist, wenn sie binnen sechs Monaten nach dem Tag, an dem die Eintragung der Verschmelzung in das Register des Sitzes desjenigen Rechtsträgers, dessen Gläubiger sie sind, nach § 19 Absatz 3 UmwG als bekanntgemacht gilt, ihren Anspruch nach Grund und Höhe schriftlich anmelden, Sicherheit zu leisten, soweit sie nicht Befriedigung verlangen können. Dieses Recht steht den Gläubigern jedoch nur zu, wenn sie glaubhaft machen, dass durch die Verschmelzung die Erfüllung ihrer Forderung gefährdet wird."
    },
    {
      "date": "2024-11-28",
      "id": "94891",
      "original_text": "Löschungsankündigung\nBrandenburg Amtsgericht Frankfurt/Oder HRB 16580\nKraftlicht Verwaltungs-UG (haftungsbeschränkt) – Schöneiche bei Berlin",
      "type": "Löschungsankündigung",
      "state": "Brandenburg",
      "amtsgericht": "Amtsgericht Frankfurt/Oder",
      "registernummer": "HRB 16580",
      "registerart": "HRB",
      "company_name": "Kraftlicht Verwaltungs-UG (haftungsbeschränkt)",
      "company_seat": "Schöneiche bei Berlin",
      "details": "28.11.2024 (Bekanntmachungsdatum)\n\nBrandenburg Amtsgericht Frankfurt/Oder HRB 16580\nLöschungsankündigung\n\nKraftlicht Verwaltungs-UG (haftungsbeschränkt)\nGesellschaft mit beschränkter Haftung\nSchöneiche bei Berlin\n\nBei der nachstehenden Gesellschaft wird das Amtslöschungsverfahren gemäß § 394 FamFG eingeleitet."
    },
    {
      "date": "2024-11-28",
      "id": "94897",
      "original_text": "Registerbekanntmachung nach dem Umwandlungsgesetz\nBrandenburg Amtsgericht Neuruppin HRA 2488\nLandbäckerei Janke GmbH & Co. KG – Flecken Zechlin",
      "type": "Registerbekanntmachung nach dem Umwandlungsgesetz",
      "state": "Brandenburg",
      "amtsgericht": "Amtsgericht Neuruppin",
      "registernummer": "HRA 2488",
      "registerart": "HRA",
      "company_name": "Landbäckerei Janke GmbH & Co. KG",
      "company_seat": "Flecken Zechlin",
      "details": "28.11.2024 (Bekanntmachungsdatum)\n\nBrandenburg Amtsgericht Neuruppin HRA 2488\nRegisterbekanntmachung nach dem Umwandlungsgesetz 26.11.2024 (Eintragungsdatum)\n\nLandbäckerei Janke GmbH & Co. KG\nKommanditgesellschaft\nFlecken Zechlin\n\nZu Eintragungsnummer 7 vom 26.11.2024 wird als nicht eingetragen veröffentlicht:\n\nDen Gläubigern der an der Umwandlung beteiligten Rechtsträger ist, wenn sie binnen sechs Monaten nach dem Tag, an dem die Eintragung der Umwandlung in das Register des Sitzes desjenigen Rechtsträgers, dessen Gläubiger sie sind, als bekannt gemacht gilt, ihren Anspruch nach Grund und Höhe schriftlich anmelden, Sicherheit zu leisten, soweit sie nicht Befriedigung verlangen können. Dieses Recht steht den Gläubigern jedoch nur zu, wenn sie glaubhaft machen, dass durch die Umwandlung die Erfüllung ihrer Forderung gefährdet wird"
    },
    {
      "date": "2024-11-28",
      "id": "94948",
      "original_text": "Löschungsankündigung\nHessen Amtsgericht Offenbach am Main HRB 52526\nLion GmbH – Mühlheim am Main",
      "type": "Löschungsankündigung",
      "state": "Hessen",
      "amtsgericht": "Amtsgericht Offenbach am Main",
      "registernummer": "HRB 52526",
      "registerart": "HRB",
      "company_name": "Lion GmbH",
      "company_seat": "Mühlheim am Main",
      "details": "28.11.2024 (Bekanntmachungsdatum)\n\nHessen Amtsgericht Offenbach am Main HRB 52526\nLöschungsankündigung 28.11.2024 (Eintragungsdatum)\n\nLion GmbH\nGesellschaft mit beschränkter Haftung\nMühlheim am Main\n\nDas Registergericht beabsichtigt die im Handelsregister eingetragene Gesellschaft von Amts wegen nach § 394 FamFG zu löschen. Die Frist zur Erhebung eines Widerspruchs gegen die beabsichtigte Löschung wird auf 3 Monate festgesetzt."
    },
    {
      "date": "2024-11-28",
      "id": "94874",
      "original_text": "Löschungsankündigung\nBerlin Amtsgericht Berlin (Charlottenburg) HRB 243316\nM&M Yildirim Bau GmbH – Berlin",
      "type": "Löschungsankündigung",
      "state": "Berlin",
      "amtsgericht": "Amtsgericht Berlin (Charlottenburg)",
      "registernummer": "HRB 243316",
      "registerart": "HRB",
      "company_name": "M&M Yildirim Bau GmbH",
      "company_seat": "Berlin",
      "details": "28.11.2024 (Bekanntmachungsdatum)\n\nBerlin Amtsgericht Berlin (Charlottenburg) HRB 243316\nLöschungsankündigung\n\nM&M Yildirim Bau GmbH\nGesellschaft mit beschränkter Haftung\nBerlin\n\nBei der nachstehenden Gesellschaft wird das Amtslöschungsverfahren gemäß § 394 FamFG eingeleitet. Widerspruchsfrist 6 Wochen"
    },
    {
      "date": "2024-11-28",
      "id": "94933",
      "original_text": "Löschungsankündigung\nNordrhein-Westfalen Amtsgericht Bochum HRB 19650\nMK Objektservice UG (haftungsbeschränkt) – Bochum",
      "type": "Löschungsankündigung",
      "state": "Nordrhein-Westfalen",
      "amtsgericht": "Amtsgericht Bochum",
      "registernummer": "HRB 19650",
      "registerart": "HRB",
      "company_name": "MK Objektservice UG (haftungsbeschränkt)",
      "company_seat": "Bochum",
      "details": "28.11.2024 (Bekanntmachungsdatum)\n\nNordrhein-Westfalen Amtsgericht Bochum HRB 19650\nLöschungsankündigung 29.11.2024 (Eintragungsdatum)\n\nMK Objektservice UG (haftungsbeschränkt)\nGesellschaft mit beschränkter Haftung\nBochum\n\nDas Registergericht beabsichtigt die Gesellschaft von Amts wegen nach § 394 FamFG zu löschen. Die Frist zur Erhebung eines Widerspruchs ist auf drei Monate festgesetzt."
    },
    {
      "date": "2024-11-28",
      "id": "94935",
      "original_text": "Einreichung neuer Dokumente\nNordrhein-Westfalen Amtsgericht Dortmund HRB 31760\nMVZ Knappschaft Kliniken Ost GmbH – Dortmund",
      "type": "Einreichung neuer Dokumente",
      "state": "Nordrhein-Westfalen",
      "amtsgericht": "Amtsgericht Dortmund",
      "registernummer": "HRB 31760",
      "registerart": "HRB",
      "company_name": "MVZ Knappschaft Kliniken Ost GmbH",
      "company_seat": "Dortmund",
      "details": "28.11.2024 (Bekanntmachungsdatum)\n\nNordrhein-Westfalen Amtsgericht Dortmund HRB 31760\nEinreichung neuer Dokumente 28.11.2024 (Eintragungsdatum)\n\nMVZ Knappschaft Kliniken Ost GmbH\nGesellschaft mit beschränkter Haftung\nDortmund\n\nDem Registergericht ist eine neue Liste der Mitglieder des Aufsichtsrates eingereicht worden."
    },
    {
      "date": "2024-11-28",
      "id": "94929",
      "original_text": "Registerbekanntmachung nach dem Umwandlungsgesetz\nRheinland-Pfalz Amtsgericht Ludwigshafen a.Rhein (Ludwigshafen) HRB 65234\nMeisterbetrieb Richard Hetterich Fliesen & Design GmbH – Ludwigshafen am Rhein",
      "type": "Registerbekanntmachung nach dem Umwandlungsgesetz",
      "state": "Rheinland-Pfalz",
      "amtsgericht": "Amtsgericht Ludwigshafen a.Rhein (Ludwigshafen)",
      "registernummer": "HRB 65234",
      "registerart": "HRB",
      "company_name": "Meisterbetrieb Richard Hetterich Fliesen & Design GmbH",
      "company_seat": "Ludwigshafen am Rhein",
      "details": "28.11.2024 (Bekanntmachungsdatum)\n\nRheinland-Pfalz Amtsgericht Ludwigshafen a.Rhein (Ludwigshafen) HRB 65234\nRegisterbekanntmachung nach dem Umwandlungsgesetz 28.11.2024 (Eintragungsdatum)\n\nMeisterbetrieb Richard Hetterich Fliesen & Design GmbH\nGesellschaft mit beschränkter Haftung\nLudwigshafen am Rhein\n\nAls nicht eingetragen wird veröffentlicht: Den Gläubigern der an der Ausgliederung beteiligten Rechtsträger ist, wenn sie binnen sechs Monaten nach dem Tag, an dem die Eintragung der Ausgliederung in das Register des Sitzes desjenigen Rechtsträgers, dessen Gläubiger sie sind, nach § 19 Abs. 3 UmwG als bekannt gemacht gilt, ihren Anspruch nach Grund und Höhe schriftlich anmelden, Sicherheit zu leisten, soweit sie nicht Befriedigung verlangen können. Dieses Recht steht den Gläubigern jedoch nur zu, wenn sie glaubhaft machen, dass durch die Ausgliederung die Erfüllung der Forderung gefährdet wird."
    },
    {
      "date": "2024-11-28",
      "id": "94925",
      "original_text": "Registerbekanntmachung nach dem Umwandlungsgesetz\nRheinland-Pfalz Amtsgericht Ludwigshafen a.Rhein (Ludwigshafen) HRA 62309\nMeisterbetrieb Richard Hetterich Fliesen & Design e.K. – Ludwigshafen am Rhein",
      "type": "Registerbekanntmachung nach dem Umwandlungsgesetz",
      "state": "Rheinland-Pfalz",
      "amtsgericht": "Amtsgericht Ludwigshafen a.Rhein (Ludwigshafen)",
      "registernummer": "HRA 62309",
      "registerart": "HRA",
      "company_name": "Meisterbetrieb Richard Hetterich Fliesen & Design e.K.",
      "company_seat": "Ludwigshafen am Rhein",
      "details": "28.11.2024 (Bekanntmachungsdatum)\n\nRheinland-Pfalz Amtsgericht Ludwigshafen a.Rhein (Ludwigshafen) HRA 62309\nRegisterbekanntmachung nach dem Umwandlungsgesetz 28.11.2024 (Eintragungsdatum)\n\nMeisterbetrieb Richard Hetterich Fliesen & Design e.K.\nEinzelkaufmann / Einzelkauffrau\nLudwigshafen am Rhein\n\nAls nicht eingetragen wird veröffentlicht: Den Gläubigern der an der Ausgliederung beteiligten Rechtsträger ist, wenn sie binnen sechs Monaten nach dem Tag, an dem die Eintragung der Ausgliederung in das Register des Sitzes desjenigen Rechtsträgers, dessen Gläubiger sie sind, nach § 19 Abs. 3 UmwG als bekannt gemacht gilt, ihren Anspruch nach Grund und Höhe schriftlich anmelden, Sicherheit zu leisten, soweit sie nicht Befriedigung verlangen können. Dieses Recht steht den Gläubigern jedoch nur zu, wenn sie glaubhaft machen, dass durch die Ausgliederung die Erfüllung der Forderung gefährdet wird."
    },
    {
      "date": "2024-11-28",
      "id": "94908",
      "original_text": "Einreichung neuer Dokumente\nSchleswig-Holstein Amtsgericht Kiel HRB 7636\nNSH Nahverkehr Schleswig-Holstein GmbH – Kiel",
      "type": "Einreichung neuer Dokumente",
      "state": "Schleswig-Holstein",
      "amtsgericht": "Amtsgericht Kiel",
      "registernummer": "HRB 7636",
      "registerart": "HRB",
      "company_name": "NSH Nahverkehr Schleswig-Holstein GmbH",
      "company_seat": "Kiel",
      "details": "28.11.2024 (Bekanntmachungsdatum)\n\nSchleswig-Holstein Amtsgericht Kiel HRB 7636\nEinreichung neuer Dokumente\n\nNSH Nahverkehr Schleswig-Holstein GmbH\nGesellschaft mit beschränkter Haftung\nKiel\n\nAls nicht eingetragen wird veröffentlicht: Eine neue Liste der Aufsichtsratsmitglieder ist eingereicht worden."
    },
    {
      "date": "2024-11-28",
      "id": "94882",
      "original_text": "Einreichung neuer Dokumente\nSaarland Amtsgericht Saarbrücken HRB 16551\nNetzwerke Merzig GmbH – Merzig",
      "type": "Einreichung neuer Dokumente",
      "state": "Saarland",
      "amtsgericht": "Amtsgericht Saarbrücken",
      "registernummer": "HRB 16551",
      "registerart": "HRB",
      "company_name": "Netzwerke Merzig GmbH",
      "company_seat": "Merzig",
      "details": "28.11.2024 (Bekanntmachungsdatum)\n\nSaarland Amtsgericht Saarbrücken HRB 16551\nEinreichung neuer Dokumente\n\nNetzwerke Merzig GmbH\nGesellschaft mit beschränkter Haftung\nMerzig\n\nDie Geschäftsführung der Gesellschaft hat eine Liste der Mitglieder des Aufsichtsrats zum Handelsregister eingereicht (§ 52 Abs. 3 Satz 2 GmbHG)."
    },
    {
      "date": "2024-11-28",
      "id": "94868",
      "original_text": "Registerbekanntmachung nach dem Umwandlungsgesetz\nBayern Amtsgericht Nürnberg HRB 42861\nNeumann Versicherungsmakler GmbH – Nürnberg",
      "type": "Registerbekanntmachung nach dem Umwandlungsgesetz",
      "state": "Bayern",
      "amtsgericht": "Amtsgericht Nürnberg",
      "registernummer": "HRB 42861",
      "registerart": "HRB",
      "company_name": "Neumann Versicherungsmakler GmbH",
      "company_seat": "Nürnberg",
      "details": "28.11.2024 (Bekanntmachungsdatum)\n\nBayern Amtsgericht Nürnberg HRB 42861\nRegisterbekanntmachung nach dem Umwandlungsgesetz 27.11.2024 (Eintragungsdatum)\n\nNeumann Versicherungsmakler GmbH\nGesellschaft mit beschränkter Haftung\nNürnberg\n\nDen Gläubigern der an der Verschmelzung beteiligten Rechtsträger ist, wenn sie binnen sechs Monaten nach dem Tag, an dem die Eintragung der Verschmelzung in das Register des Sitzes desjenigen Rechtsträgers, dessen Gläubiger sie sind, nach § 19 Abs. 3 UmwG als bekannt gemacht gilt, ihren Anspruch nach Grund und Höhe schriftlich anmelden, Sicherheit zu leisten, soweit sie nicht Befriedigung verlangen können. Dieses Recht steht den Gläubigern jedoch nur zu, wenn sie glaubhaft machen, dass durch die Verschmelzung die Erfüllung ihrer Forderung gefährdet wird."
    },
    {
      "date": "2024-11-28",
      "id": "94959",
      "original_text": "Löschungsankündigung\nHessen Amtsgericht Frankfurt am Main HRB 109009\nOOGarden Deutschland GmbH – Frankfurt am Main",
      "type": "Löschungsankündigung",
      "state": "Hessen",
      "amtsgericht": "Amtsgericht Frankfurt am Main",
      "registernummer": "HRB 109009",
      "registerart": "HRB",
      "company_name": "OOGarden Deutschland GmbH",
      "company_seat": "Frankfurt am Main",
      "details": "28.11.2024 (Bekanntmachungsdatum)\n\nHessen Amtsgericht Frankfurt am Main HRB 109009\nLöschungsankündigung\n\nOOGarden Deutschland GmbH\nGesellschaft mit beschränkter Haftung\nFrankfurt am Main\n\nDas Registergericht beabsichtigt die im Handelsregister eingetragene Gesellschaft von Amts wegen nach § 394 FamFG zu löschen. Die Frist zur Erhebung eines Widerspruchs gegen die beabsichtigte Löschung wird auf 1 Monat festgesetzt."
    },
    {
      "date": "2024-11-28",
      "id": "94964",
      "original_text": "Sonstige Registerbekanntmachung\nHessen Amtsgericht Frankfurt am Main HRB 120708\nOberlindau Immobilien GmbH – Frankfurt am Main",
      "type": "Sonstige Registerbekanntmachung",
      "state": "Hessen",
      "amtsgericht": "Amtsgericht Frankfurt am Main",
      "registernummer": "HRB 120708",
      "registerart": "HRB",
      "company_name": "Oberlindau Immobilien GmbH",
      "company_seat": "Frankfurt am Main",
      "details": "28.11.2024 (Bekanntmachungsdatum)\n\nHessen Amtsgericht Frankfurt am Main HRB 120708\nSonstige Registerbekanntmachung 28.11.2024 (Eintragungsdatum)\n\nOberlindau Immobilien GmbH\nGesellschaft mit beschränkter Haftung\nFrankfurt am Main\n\nDie Gesellschaft hat Gläubigern, deren Forderungen vor dieser Bekanntmachung begründet worden sind, Sicherheit zu leisten, soweit sie nicht Befriedigung verlangen können, wenn sie sich binnen sechs Monaten nach dieser Bekanntmachung zu diesem Zweck melden."
    },
    {
      "date": "2024-11-28",
      "id": "94880",
      "original_text": "Löschungsankündigung\nBerlin Amtsgericht Berlin (Charlottenburg) HRB 215673\nOne Four Films GmbH – Berlin",
      "type": "Löschungsankündigung",
      "state": "Berlin",
      "amtsgericht": "Amtsgericht Berlin (Charlottenburg)",
      "registernummer": "HRB 215673",
      "registerart": "HRB",
      "company_name": "One Four Films GmbH",
      "company_seat": "Berlin",
      "details": "28.11.2024 (Bekanntmachungsdatum)\n\nBerlin Amtsgericht Berlin (Charlottenburg) HRB 215673\nLöschungsankündigung\n\nOne Four Films GmbH\nGesellschaft mit beschränkter Haftung\nBerlin\n\nBei der nachstehenden Gesellschaft wird das Amtslöschungsverfahren gemäß § 394 FamFG eingeleitet. Widerspruchsfrist 6 Wochen"
    },
    {
      "date": "2024-11-28",
      "id": "94954",
      "original_text": "Löschungsankündigung\nHessen Amtsgericht Offenbach am Main HRB 51432\nPIF Bau Service GmbH – Neu-Isenburg",
      "type": "Löschungsankündigung",
      "state": "Hessen",
      "amtsgericht": "Amtsgericht Offenbach am Main",
      "registernummer": "HRB 51432",
      "registerart": "HRB",
      "company_name": "PIF Bau Service GmbH",
      "company_seat": "Neu-Isenburg",
      "details": "28.11.2024 (Bekanntmachungsdatum)\n\nHessen Amtsgericht Offenbach am Main HRB 51432\nLöschungsankündigung 28.11.2024 (Eintragungsdatum)\n\nPIF Bau Service GmbH\nGesellschaft mit beschränkter Haftung\nNeu-Isenburg\n\nDas Registergericht beabsichtigt die im Handelsregister eingetragene Gesellschaft von Amts wegen nach § 394 FamFG zu löschen. Die Frist zur Erhebung eines Widerspruchs gegen die beabsichtigte Löschung wird auf 3 Monate festgesetzt."
    },
    {
      "date": "2024-11-28",
      "id": "94881",
      "original_text": "Registerbekanntmachung nach dem Umwandlungsgesetz\nBrandenburg Amtsgericht Cottbus HRB 6841\nPMJ-tec GmbH – Schönewalde",
      "type": "Registerbekanntmachung nach dem Umwandlungsgesetz",
      "state": "Brandenburg",
      "amtsgericht": "Amtsgericht Cottbus",
      "registernummer": "HRB 6841",
      "registerart": "HRB",
      "company_name": "PMJ-tec GmbH",
      "company_seat": "Schönewalde",
      "details": "28.11.2024 (Bekanntmachungsdatum)\n\nBrandenburg Amtsgericht Cottbus HRB 6841\nRegisterbekanntmachung nach dem Umwandlungsgesetz 27.11.2024 (Eintragungsdatum)\n\nPMJ-tec GmbH\nGesellschaft mit beschränkter Haftung\nSchönewalde\n\nZu Eintragungsnummer 7 vom 27.11.2024 wird als nicht eingetragen veröffentlicht: Als nicht eingetragen wird veröffentlicht:\nDen Gläubigern der an der Verschmelzung beteiligten Rechtsträger ist, wenn sie binnen sechs Monaten nach dem Tag, an dem die Eintragung der Verschmelzung in das Register des Sitzes desjenigen Rechtsträgers, dessen Gläubiger sie sind, als bekannt gemacht gilt, ihren Anspruch nach Grund und Höhe schriftlich anmelden, Sicherheit zu leisten, soweit sie nicht Befriedigung verlangen können. Dieses Recht steht den Gläubigern jedoch nur zu, wenn sie glaubhaft machen, dass durch die Verschmelzung die Erfüllung ihrer Forderung gefährdet wird"
    },
    {
      "date": "2024-11-28",
      "id": "94922",
      "original_text": "Sonstige Registerbekanntmachung\nNiedersachsen Amtsgericht Hannover HRB 227088\nPaladin Langfrist GmbH & Co. KGaA – Hannover",
      "type": "Sonstige Registerbekanntmachung",
      "state": "Niedersachsen",
      "amtsgericht": "Amtsgericht Hannover",
      "registernummer": "HRB 227088",
      "registerart": "HRB",
      "company_name": "Paladin Langfrist GmbH & Co. KGaA",
      "company_seat": "Hannover",
      "details": "28.11.2024 (Bekanntmachungsdatum)\n\nNiedersachsen Amtsgericht Hannover HRB 227088\nSonstige Registerbekanntmachung 28.11.2024 (Eintragungsdatum)\n\nPaladin Langfrist GmbH & Co. KGaA\nKommanditgesellschaft auf Aktien\nHannover\n\nDie Liste der Mitglieder des Aufsichtsrats wurde beim Registergericht eingereicht."
    },
    {
      "date": "2024-11-28",
      "id": "94955",
      "original_text": "Löschungsankündigung\nHessen Amtsgericht Frankfurt am Main HRB 106969\nPaul´s STALL Gastronomie und Event UG (haftungsbeschränkt) – Frankfurt am Main",
      "type": "Löschungsankündigung",
      "state": "Hessen",
      "amtsgericht": "Amtsgericht Frankfurt am Main",
      "registernummer": "HRB 106969",
      "registerart": "HRB",
      "company_name": "Paul´s STALL Gastronomie und Event UG (haftungsbeschränkt)",
      "company_seat": "Frankfurt am Main",
      "details": "28.11.2024 (Bekanntmachungsdatum)\n\nHessen Amtsgericht Frankfurt am Main HRB 106969\nLöschungsankündigung\n\nPaul´s STALL Gastronomie und Event UG (haftungsbeschränkt)\nGesellschaft mit beschränkter Haftung\nFrankfurt am Main\n\nDas Registergericht beabsichtigt die im Handelsregister eingetragene Gesellschaft von Amts wegen nach § 394 FamFG zu löschen. Die Frist zur Erhebung eines Widerspruchs gegen die beabsichtigte Löschung wird auf 1 Monat festgesetzt."
    },
    {
      "date": "2024-11-28",
      "id": "94876",
      "original_text": "Sonstige Registerbekanntmachung\nSachsen-Anhalt Amtsgericht Stendal HRB 19859\nPflegeheim Salzmünde GmbH – Salzatal",
      "type": "Sonstige Registerbekanntmachung",
      "state": "Sachsen-Anhalt",
      "amtsgericht": "Amtsgericht Stendal",
      "registernummer": "HRB 19859",
      "registerart": "HRB",
      "company_name": "Pflegeheim Salzmünde GmbH",
      "company_seat": "Salzatal",
      "details": "28.11.2024 (Bekanntmachungsdatum)\n\nSachsen-Anhalt Amtsgericht Stendal HRB 19859\nSonstige Registerbekanntmachung 28.11.2024 (Eintragungsdatum)\n\nPflegeheim Salzmünde GmbH\nGesellschaft mit beschränkter Haftung\nSalzatal\n\nNicht eingetragen:\nAls nicht eingetragen wird veröffentlicht: Den Gläubigern der Gesellschaft, deren Forderungen begründet worden sind bevor die Eintragung der Beendigung des #DV.Art(Text=\"Art des Vertrages auswählen\",Eingabe=\"Beherrschungs- und Gewinnabführungsvertrages\",\"Beherrschungsvertrages\",\"Gewinnabführungsvertrages\",\"Teilgewinnabführungsvertrages\")  in das Handelsregister nach § 10 des Handelsgesetzbuches als bekanntgemacht gilt, hat der andere Vertragsteil Sicherheit zu leisten, wenn sie sich binnen sechs Monaten nach der Bekanntmachung der Eintragung zu diesem Zweck bei ihm melden."
    },
    {
      "date": "2024-11-28",
      "id": "94902",
      "original_text": "Löschungsankündigung\nMecklenburg-Vorpommern Amtsgericht Schwerin HRB 14563\nPraesidium Service UG (haftungsbeschränkt) – Schwerin",
      "type": "Löschungsankündigung",
      "state": "Mecklenburg-Vorpommern",
      "amtsgericht": "Amtsgericht Schwerin",
      "registernummer": "HRB 14563",
      "registerart": "HRB",
      "company_name": "Praesidium Service UG (haftungsbeschränkt)",
      "company_seat": "Schwerin",
      "details": "28.11.2024 (Bekanntmachungsdatum)\n\nMecklenburg-Vorpommern Amtsgericht Schwerin HRB 14563\nLöschungsankündigung\n\nPraesidium Service UG (haftungsbeschränkt)\nGesellschaft mit beschränkter Haftung\nSchwerin\n\nDas Registergericht beabsichtigt, die im Handelsregister eingetragene Gesellschaft von Amts wegen nach § 394 FamFG zu löschen. Die Frist zur Erhebung eines Widerspruchs gegen die beabsichtigte Löschung wird auf 1 Monat festgesetzt."
    },
    {
      "date": "2024-11-28",
      "id": "94879",
      "original_text": "Löschungsankündigung\nBerlin Amtsgericht Berlin (Charlottenburg) HRB 212276\nProCabs GmbH – Berlin",
      "type": "Löschungsankündigung",
      "state": "Berlin",
      "amtsgericht": "Amtsgericht Berlin (Charlottenburg)",
      "registernummer": "HRB 212276",
      "registerart": "HRB",
      "company_name": "ProCabs GmbH",
      "company_seat": "Berlin",
      "details": "28.11.2024 (Bekanntmachungsdatum)\n\nBerlin Amtsgericht Berlin (Charlottenburg) HRB 212276\nLöschungsankündigung\n\nProCabs GmbH\nGesellschaft mit beschränkter Haftung\nBerlin\n\nBei der nachstehenden Gesellschaft wird das Amtslöschungsverfahren gemäß § 394 FamFG eingeleitet. Widerspruchsfrist 6 Wochen"
    },
    {
      "date": "2024-11-28",
      "id": "94896",
      "original_text": "Löschungsankündigung\nBrandenburg Amtsgericht Frankfurt/Oder HRB 10781\nR & T Gebäudeanlagentechnik GmbH – Schorfheide",
      "type": "Löschungsankündigung",
      "state": "Brandenburg",
      "amtsgericht": "Amtsgericht Frankfurt/Oder",
      "registernummer": "HRB 10781",
      "registerart": "HRB",
      "company_name": "R & T Gebäudeanlagentechnik GmbH",
      "company_seat": "Schorfheide",
      "details": "28.11.2024 (Bekanntmachungsdatum)\n\nBrandenburg Amtsgericht Frankfurt/Oder HRB 10781\nLöschungsankündigung\n\nR & T Gebäudeanlagentechnik GmbH\nGesellschaft mit beschränkter Haftung\nSchorfheide\n\nBei der nachstehenden Gesellschaft wird das Amtslöschungsverfahren gemäß § 394 FamFG eingeleitet."
    },
    {
      "date": "2024-11-28",
      "id": "94932",
      "original_text": "Registerbekanntmachung nach dem Umwandlungsgesetz\nNordrhein-Westfalen Amtsgericht Düsseldorf HRB 106534\nRIP-2409 GmbH – Düsseldorf",
      "type": "Registerbekanntmachung nach dem Umwandlungsgesetz",
      "state": "Nordrhein-Westfalen",
      "amtsgericht": "Amtsgericht Düsseldorf",
      "registernummer": "HRB 106534",
      "registerart": "HRB",
      "company_name": "RIP-2409 GmbH",
      "company_seat": "Düsseldorf",
      "details": "28.11.2024 (Bekanntmachungsdatum)\n\nNordrhein-Westfalen Amtsgericht Düsseldorf HRB 106534\nRegisterbekanntmachung nach dem Umwandlungsgesetz 28.11.2024 (Eintragungsdatum)\n\nRIP-2409 GmbH\nGesellschaft mit beschränkter Haftung\nDüsseldorf\n\nDen Gläubigern der an der Verschmelzung beteiligten Rechtsträger ist, wenn sie binnen sechs Monaten nach dem Tag, an dem die Eintragung der Verschmelzung in das Register des Sitzes desjenigen Rechtsträgers, dessen Gläubiger sie sind, nach § 19 Absatz 3 UmwG als bekanntgemacht gilt, ihren Anspruch nach Grund und Höhe schriftlich anmelden, Sicherheit zu leisten, soweit sie nicht Befriedigung verlangen können. Dieses Recht steht den Gläubigern jedoch nur zu, wenn sie glaubhaft machen, dass durch die Verschmelzung die Erfüllung ihrer Forderung gefährdet wird."
    },
    {
      "date": "2024-11-28",
      "id": "94855",
      "original_text": "Registerbekanntmachung nach dem Umwandlungsgesetz\nBayern Amtsgericht Traunstein HRB 18328\nRaiffeisen Vertriebs GmbH – Burghausen",
      "type": "Registerbekanntmachung nach dem Umwandlungsgesetz",
      "state": "Bayern",
      "amtsgericht": "Amtsgericht Traunstein",
      "registernummer": "HRB 18328",
      "registerart": "HRB",
      "company_name": "Raiffeisen Vertriebs GmbH",
      "company_seat": "Burghausen",
      "details": "28.11.2024 (Bekanntmachungsdatum)\n\nBayern Amtsgericht Traunstein HRB 18328\nRegisterbekanntmachung nach dem Umwandlungsgesetz 27.11.2024 (Eintragungsdatum)\n\nRaiffeisen Vertriebs GmbH\nGesellschaft mit beschränkter Haftung\nBurghausen\n\nDen Gläubigern der an der Verschmelzung beteiligten Rechtsträger ist, wenn sie binnen sechs Monaten nach dem Tag, an dem die Eintragung der Verschmelzung in das Register des Sitzes desjenigen Rechtsträgers, dessen Gläubiger sie sind, nach § 19 Abs. 3 UmwG als bekannt gemacht gilt, ihren Anspruch nach Grund und Höhe schriftlich anmelden, Sicherheit zu leisten, soweit sie nicht Befriedigung verlangen können. Dieses Recht steht den Gläubigern jedoch nur zu, wenn sie glaubhaft machen, dass durch die Verschmelzung die Erfüllung ihrer Forderung gefährdet wird."
    },
    {
      "date": "2024-11-28",
      "id": "94893",
      "original_text": "Registerbekanntmachung nach dem Umwandlungsgesetz\nBerlin Amtsgericht Berlin (Charlottenburg) HRB 146726\nRaisin GmbH – Berlin",
      "type": "Registerbekanntmachung nach dem Umwandlungsgesetz",
      "state": "Berlin",
      "amtsgericht": "Amtsgericht Berlin (Charlottenburg)",
      "registernummer": "HRB 146726",
      "registerart": "HRB",
      "company_name": "Raisin GmbH",
      "company_seat": "Berlin",
      "details": "28.11.2024 (Bekanntmachungsdatum)\n\nBerlin Amtsgericht Berlin (Charlottenburg) HRB 146726\nRegisterbekanntmachung nach dem Umwandlungsgesetz\n\nRaisin GmbH\nGesellschaft mit beschränkter Haftung\nBerlin\n\nAls nicht eingetragen wird veröffentlicht: Die Gesellschaft hat den Umwandlungsplan vom 25.11.2024 gemäß Art 2, 37 SE-VO betreffend den Kettenformwechsel in eine Aktiengesellschaft und anschließend die Umwandlung in eine Europäische Gesellschaft (SE) zur Offenlegung gemäß Art. 37 Absatz 5 SE-VO zum Handelsregister des Amtsgericht Charlottenburg eingereicht"
    },
    {
      "date": "2024-11-28",
      "id": "94918",
      "original_text": "Löschungsankündigung\nNiedersachsen Amtsgericht Hannover HRB 121334\nRalph Pillasch Bauunternehmen GmbH – Burgwedel",
      "type": "Löschungsankündigung",
      "state": "Niedersachsen",
      "amtsgericht": "Amtsgericht Hannover",
      "registernummer": "HRB 121334",
      "registerart": "HRB",
      "company_name": "Ralph Pillasch Bauunternehmen GmbH",
      "company_seat": "Burgwedel",
      "details": "28.11.2024 (Bekanntmachungsdatum)\n\nNiedersachsen Amtsgericht Hannover HRB 121334\nLöschungsankündigung\n\nRalph Pillasch Bauunternehmen GmbH\nGesellschaft mit beschränkter Haftung\nBurgwedel\n\nDas Registergericht beabsichtigt, die Gesellschaft von Amts wegen nach § 394 FamFG zu löschen. Die Frist zur Erhebung eines Widerspruchs ist auf 1 Monat ab dieser Registerbekanntmachung festgesetzt."
    },
    {
      "date": "2024-11-28",
      "id": "94920",
      "original_text": "Registerbekanntmachung nach dem Umwandlungsgesetz\nNiedersachsen Amtsgericht Walsrode HRA 205415\nRené Große und Sufian Osso Apotheken OHG – Rotenburg (Wümme)",
      "type": "Registerbekanntmachung nach dem Umwandlungsgesetz",
      "state": "Niedersachsen",
      "amtsgericht": "Amtsgericht Walsrode",
      "registernummer": "HRA 205415",
      "registerart": "HRA",
      "company_name": "René Große und Sufian Osso Apotheken OHG",
      "company_seat": "Rotenburg (Wümme)",
      "details": "28.11.2024 (Bekanntmachungsdatum)\n\nNiedersachsen Amtsgericht Walsrode HRA 205415\nRegisterbekanntmachung nach dem Umwandlungsgesetz 28.11.2024 (Eintragungsdatum)\n\nRené Große und Sufian Osso Apotheken OHG\nOffene Handelsgesellschaft\nRotenburg (Wümme)\n\nDen Gläubigern der an der Ausgliederung beteiligten Rechtsträger ist, wenn sie binnen sechs Monaten nach dem Tag, an dem die Eintragung der Ausgliederung in das Register des Sitzes desjenigen Rechtsträgers, dessen Gläubiger sie sind, nach § 19 Abs. 3 UmwG als bekannt gemacht gilt, ihren Anspruch nach Grund und Höhe schriftlich anmelden, Sicherheit zu leisten, soweit sie nicht Befriedigung verlangen können. Dieses Recht steht den Gläubigern jedoch nur zu, wenn sie glaubhaft machen, dass durch die Ausgliederung die Erfüllung der Forderung gefährdet wird."
    },
    {
      "date": "2024-11-28",
      "id": "94864",
      "original_text": "Registerbekanntmachung nach dem Umwandlungsgesetz\nBayern Amtsgericht Regensburg HRB 18751\nRupp & Bendel GmbH – Nittendorf",
      "type": "Registerbekanntmachung nach dem Umwandlungsgesetz",
      "state": "Bayern",
      "amtsgericht": "Amtsgericht Regensburg",
      "registernummer": "HRB 18751",
      "registerart": "HRB",
      "company_name": "Rupp & Bendel GmbH",
      "company_seat": "Nittendorf",
      "details": "28.11.2024 (Bekanntmachungsdatum)\n\nBayern Amtsgericht Regensburg HRB 18751\nRegisterbekanntmachung nach dem Umwandlungsgesetz 27.11.2024 (Eintragungsdatum)\n\nRupp & Bendel GmbH\nGesellschaft mit beschränkter Haftung\nNittendorf\n\nDen Gläubigern der an der Verschmelzung beteiligten Rechtsträger ist, wenn sie binnen sechs Monaten nach dem Tag, an dem die Eintragung der Verschmelzung in das Register des Sitzes desjenigen Rechtsträgers, dessen Gläubiger sie sind, nach § 19 Abs. 3 UmwG als bekannt gemacht gilt, ihren Anspruch nach Grund und Höhe schriftlich anmelden, Sicherheit zu leisten, soweit sie nicht Befriedigung verlangen können. Dieses Recht steht den Gläubigern jedoch nur zu, wenn sie glaubhaft machen, dass durch die Verschmelzung die Erfüllung ihrer Forderung gefährdet wird."
    },
    {
      "date": "2024-11-28",
      "id": "94944",
      "original_text": "Löschungsankündigung\nHessen Amtsgericht Frankfurt am Main HRB 120268\nSiM Baudekoration UG (haftungsbeschränkt) – Frankfurt am Main",
      "type": "Löschungsankündigung",
      "state": "Hessen",
      "amtsgericht": "Amtsgericht Frankfurt am Main",
      "registernummer": "HRB 120268",
      "registerart": "HRB",
      "company_name": "SiM Baudekoration UG (haftungsbeschränkt)",
      "company_seat": "Frankfurt am Main",
      "details": "28.11.2024 (Bekanntmachungsdatum)\n\nHessen Amtsgericht Frankfurt am Main HRB 120268\nLöschungsankündigung\n\nSiM Baudekoration UG (haftungsbeschränkt)\nGesellschaft mit beschränkter Haftung\nFrankfurt am Main\n\nDas Registergericht beabsichtigt die im Handelsregister eingetragene Gesellschaft von Amts wegen nach § 394 FamFG zu löschen. Die Frist zur Erhebung eines Widerspruchs gegen die beabsichtigte Löschung wird auf 1 Monate festgesetzt."
    },
    {
      "date": "2024-11-28",
      "id": "94951",
      "original_text": "Löschungsankündigung\nHessen Amtsgericht Frankfurt am Main HRA 49177\nStevan Nićetin e.K. – Frankfurt am Main",
      "type": "Löschungsankündigung",
      "state": "Hessen",
      "amtsgericht": "Amtsgericht Frankfurt am Main",
      "registernummer": "HRA 49177",
      "registerart": "HRA",
      "company_name": "Stevan Nićetin e.K.",
      "company_seat": "Frankfurt am Main",
      "details": "28.11.2024 (Bekanntmachungsdatum)\n\nHessen Amtsgericht Frankfurt am Main HRA 49177\nLöschungsankündigung\n\nStevan Nićetin e.K.\nEinzelkaufmann / Einzelkauffrau\nFrankfurt am Main\n\nDas Registergericht beabsichtigt die im Handelsregister eingetragene Firma von Amts wegen nach § 31 Abs. 2 HGB zu löschen. Die Frist zur Erhebung eines Widerspruchs gegen die beabsichtigte Löschung wird auf 1 Monat festgesetzt."
    },
    {
      "date": "2024-11-28",
      "id": "94877",
      "original_text": "Registerbekanntmachung nach dem Umwandlungsgesetz\nBerlin Amtsgericht Berlin (Charlottenburg) HRB 128315\nStryker Berlin GmbH – Berlin",
      "type": "Registerbekanntmachung nach dem Umwandlungsgesetz",
      "state": "Berlin",
      "amtsgericht": "Amtsgericht Berlin (Charlottenburg)",
      "registernummer": "HRB 128315",
      "registerart": "HRB",
      "company_name": "Stryker Berlin GmbH",
      "company_seat": "Berlin",
      "details": "28.11.2024 (Bekanntmachungsdatum)\n\nBerlin Amtsgericht Berlin (Charlottenburg) HRB 128315\nRegisterbekanntmachung nach dem Umwandlungsgesetz 27.11.2024 (Eintragungsdatum)\n\nStryker Berlin GmbH\nGesellschaft mit beschränkter Haftung\nBerlin\n\nZu Eintragungsnummer 12 vom 27.11.2024 wird als nicht eingetragen veröffentlicht: Den Gläubigern der an der Verschmelzung beteiligten Rechtsträger ist, wenn sie binnen sechs Monaten nach dem Tag, an dem die Eintragung der Verschmelzung in das Register des Sitzes desjenigen Rechtsträgers, dessen Gläubiger sie sind, als bekannt gemacht gilt, ihren Anspruch nach Grund und Höhe schriftlich anmelden, Sicherheit zu leisten, soweit sie nicht Befriedigung verlangen können. Dieses Recht steht den Gläubigern jedoch nur zu, wenn sie glaubhaft machen, dass durch die Verschmelzung die Erfüllung ihrer Forderung gefährdet wird. Das Recht, Sicherheitsleistung zu verlangen, steht Gläubigern nicht zu, die im Falle der Insolvenz ein Recht auf vorzugsweise Befriedigung aus einer Deckungsmasse haben, die nach gesetzlicher Vorschrift zu ihrem Schutz errichtet und staatlich überwacht ist."
    },
    {
      "date": "2024-11-28",
      "id": "94940",
      "original_text": "Einreichung neuer Dokumente\nNordrhein-Westfalen Amtsgericht Düsseldorf HRB 74421\nStröer Management SE – Düsseldorf",
      "type": "Einreichung neuer Dokumente",
      "state": "Nordrhein-Westfalen",
      "amtsgericht": "Amtsgericht Düsseldorf",
      "registernummer": "HRB 74421",
      "registerart": "HRB",
      "company_name": "Ströer Management SE",
      "company_seat": "Düsseldorf",
      "details": "28.11.2024 (Bekanntmachungsdatum)\n\nNordrhein-Westfalen Amtsgericht Düsseldorf HRB 74421\nEinreichung neuer Dokumente 28.11.2024 (Eintragungsdatum)\n\nStröer Management SE\nEuropäische Aktiengesellschaft (SE)\nDüsseldorf\n\nDem Registergericht ist eine Liste der Mitglieder des Aufsichtsrates eingereicht worden."
    },
    {
      "date": "2024-11-28",
      "id": "94907",
      "original_text": "Einreichung neuer Dokumente\nBaden-Württemberg Amtsgericht Stuttgart HRB 69\nStuttgarter Straßenbahnen Aktiengesellschaft – Stuttgart",
      "type": "Einreichung neuer Dokumente",
      "state": "Baden-Württemberg",
      "amtsgericht": "Amtsgericht Stuttgart",
      "registernummer": "HRB 69",
      "registerart": "HRB",
      "company_name": "Stuttgarter Straßenbahnen Aktiengesellschaft",
      "company_seat": "Stuttgart",
      "details": "28.11.2024 (Bekanntmachungsdatum)\n\nBaden-Württemberg Amtsgericht Stuttgart HRB 69\nEinreichung neuer Dokumente\n\nStuttgarter Straßenbahnen Aktiengesellschaft\nAktiengesellschaft\nStuttgart\n\nDie Gesellschaft hat am 26.11.2024 die Liste über die Zusammensetzung des Aufsichtsrats zum Handelsregister eingereicht."
    },
    {
      "date": "2024-11-28",
      "id": "94917",
      "original_text": "Einreichung neuer Dokumente\nNiedersachsen Amtsgericht Braunschweig HRB 205587\nSumitomo Electric Bordnetze SE – Wolfsburg",
      "type": "Einreichung neuer Dokumente",
      "state": "Niedersachsen",
      "amtsgericht": "Amtsgericht Braunschweig",
      "registernummer": "HRB 205587",
      "registerart": "HRB",
      "company_name": "Sumitomo Electric Bordnetze SE",
      "company_seat": "Wolfsburg",
      "details": "28.11.2024 (Bekanntmachungsdatum)\n\nNiedersachsen Amtsgericht Braunschweig HRB 205587\nEinreichung neuer Dokumente 28.11.2024 (Eintragungsdatum)\n\nSumitomo Electric Bordnetze SE\nEuropäische Aktiengesellschaft (SE)\nWolfsburg\n\nDie aktuelle Liste der Mitglieder des Verwaltungsrats wurde beim Registergericht eingereicht."
    },
    {
      "date": "2024-11-28",
      "id": "94884",
      "original_text": "Einreichung neuer Dokumente\nBerlin Amtsgericht Berlin (Charlottenburg) HRB 156673\nTION Health AG – Berlin",
      "type": "Einreichung neuer Dokumente",
      "state": "Berlin",
      "amtsgericht": "Amtsgericht Berlin (Charlottenburg)",
      "registernummer": "HRB 156673",
      "registerart": "HRB",
      "company_name": "TION Health AG",
      "company_seat": "Berlin",
      "details": "28.11.2024 (Bekanntmachungsdatum)\n\nBerlin Amtsgericht Berlin (Charlottenburg) HRB 156673\nEinreichung neuer Dokumente\n\nTION Health AG\nAktiengesellschaft\nBerlin\n\nAls nicht eingetragen wird veröffentlicht: Es wurde eine neue Liste der Aufsichtsratsmitglieder eingereicht (§ 106 AktG)."
    },
    {
      "date": "2024-11-28",
      "id": "94921",
      "original_text": "Sonstige Registerbekanntmachung\nNiedersachsen Amtsgericht Hannover HRB 62522\nTUI Deutschland GmbH – Hannover",
      "type": "Sonstige Registerbekanntmachung",
      "state": "Niedersachsen",
      "amtsgericht": "Amtsgericht Hannover",
      "registernummer": "HRB 62522",
      "registerart": "HRB",
      "company_name": "TUI Deutschland GmbH",
      "company_seat": "Hannover",
      "details": "28.11.2024 (Bekanntmachungsdatum)\n\nNiedersachsen Amtsgericht Hannover HRB 62522\nSonstige Registerbekanntmachung\n\nTUI Deutschland GmbH\nGesellschaft mit beschränkter Haftung\nHannover\n\nDie Liste der Mitglieder des Aufsichtsrats wurde beim Registergericht eingereicht."
    },
    {
      "date": "2024-11-28",
      "id": "94939",
      "original_text": "Registerbekanntmachung nach dem Umwandlungsgesetz\nNordrhein-Westfalen Amtsgericht Lemgo HRB 10850\nTeam OWL GmbH – Bad Salzuflen",
      "type": "Registerbekanntmachung nach dem Umwandlungsgesetz",
      "state": "Nordrhein-Westfalen",
      "amtsgericht": "Amtsgericht Lemgo",
      "registernummer": "HRB 10850",
      "registerart": "HRB",
      "company_name": "Team OWL GmbH",
      "company_seat": "Bad Salzuflen",
      "details": "28.11.2024 (Bekanntmachungsdatum)\n\nNordrhein-Westfalen Amtsgericht Lemgo HRB 10850\nRegisterbekanntmachung nach dem Umwandlungsgesetz 27.11.2024 (Eintragungsdatum)\n\nTeam OWL GmbH\nGesellschaft mit beschränkter Haftung\nBad Salzuflen\n\nDen Gläubigern der an der formwechselnden Umwandlung beteiligten Rechtsträger ist, wenn sie binnen sechs Monaten nach dem Tag, an dem die Eintragung der formwechselnden Umwandlung in das Register des Sitzes desjenigen Rechtsträgers, dessen Gläubiger sie sind, nach § 19 Absatz 3 UmwG als bekanntgemacht gilt, ihren Anspruch nach Grund und Höhe schriftlich anmelden, Sicherheit zu leisten, soweit sie nicht Befriedigung verlangen können. Dieses Recht steht den Gläubigern jedoch nur zu, wenn sie glaubhaft machen, dass durch die formwechselnden Umwandlung die Erfüllung ihrer Forderung gefährdet wird."
    },
    {
      "date": "2024-11-28",
      "id": "94941",
      "original_text": "Registerbekanntmachung nach dem Umwandlungsgesetz\nNordrhein-Westfalen Amtsgericht Lemgo GnR 152\nTeam OWL eG – Bad Salzuflen",
      "type": "Registerbekanntmachung nach dem Umwandlungsgesetz",
      "state": "Nordrhein-Westfalen",
      "amtsgericht": "Amtsgericht Lemgo",
      "registernummer": "GnR 152",
      "registerart": "GnR",
      "company_name": "Team OWL eG",
      "company_seat": "Bad Salzuflen",
      "details": "28.11.2024 (Bekanntmachungsdatum)\n\nNordrhein-Westfalen Amtsgericht Lemgo GnR 152\nRegisterbekanntmachung nach dem Umwandlungsgesetz 27.11.2024 (Eintragungsdatum)\n\nTeam OWL eG\neingetragene Genossenschaft\nBad Salzuflen\n\nDen Gläubigern der an der formwechselnden Umwandlung beteiligten Rechtsträger ist, wenn sie binnen sechs Monaten nach dem Tag, an dem die Eintragung der formwechselnden Umwandlung in das Register des Sitzes desjenigen Rechtsträgers, dessen Gläubiger sie sind, nach § 19 Absatz 3 UmwG als bekanntgemacht gilt, ihren Anspruch nach Grund und Höhe schriftlich anmelden, Sicherheit zu leisten, soweit sie nicht Befriedigung verlangen können. Dieses Recht steht den Gläubigern jedoch nur zu, wenn sie glaubhaft machen, dass durch die formwechselnden Umwandlung die Erfüllung ihrer Forderung gefährdet wird."
    },
    {
      "date": "2024-11-28",
      "id": "94900",
      "original_text": "Löschungsankündigung\nBerlin Amtsgericht Berlin (Charlottenburg) HRB 211033\nTransformer-Express GmbH – Berlin",
      "type": "Löschungsankündigung",
      "state": "Berlin",
      "amtsgericht": "Amtsgericht Berlin (Charlottenburg)",
      "registernummer": "HRB 211033",
      "registerart": "HRB",
      "company_name": "Transformer-Express GmbH",
      "company_seat": "Berlin",
      "details": "28.11.2024 (Bekanntmachungsdatum)\n\nBerlin Amtsgericht Berlin (Charlottenburg) HRB 211033\nLöschungsankündigung\n\nTransformer-Express GmbH\nGesellschaft mit beschränkter Haftung\nBerlin\n\nBei der nachstehenden Gesellschaft wird das Amtslöschungsverfahren gemäß § 394 FamFG eingeleitet. Widerspruchsfrist 6 Wochen"
    },
    {
      "date": "2024-11-28",
      "id": "94903",
      "original_text": "Löschungsankündigung\nMecklenburg-Vorpommern Amtsgericht Schwerin HRB 12345\nTransportgesellschaft Melchert UG (haftungsbeschränkt) – Schwerin",
      "type": "Löschungsankündigung",
      "state": "Mecklenburg-Vorpommern",
      "amtsgericht": "Amtsgericht Schwerin",
      "registernummer": "HRB 12345",
      "registerart": "HRB",
      "company_name": "Transportgesellschaft Melchert UG (haftungsbeschränkt)",
      "company_seat": "Schwerin",
      "details": "28.11.2024 (Bekanntmachungsdatum)\n\nMecklenburg-Vorpommern Amtsgericht Schwerin HRB 12345\nLöschungsankündigung\n\nTransportgesellschaft Melchert UG (haftungsbeschränkt)\nGesellschaft mit beschränkter Haftung\nSchwerin\n\nDas Registergericht beabsichtigt, die im Handelsregister eingetragene Gesellschaft von Amts wegen nach § 394 FamFG zu löschen. Die Frist zur Erhebung eines Widerspruchs gegen die beabsichtigte Löschung wird auf 1 Monat festgesetzt."
    },
    {
      "date": "2024-11-28",
      "id": "94914",
      "original_text": "Registerbekanntmachung nach dem Umwandlungsgesetz\nSachsen Amtsgericht Leipzig HRB 40743\nTrustUs Consulting GmbH – Leipzig",
      "type": "Registerbekanntmachung nach dem Umwandlungsgesetz",
      "state": "Sachsen",
      "amtsgericht": "Amtsgericht Leipzig",
      "registernummer": "HRB 40743",
      "registerart": "HRB",
      "company_name": "TrustUs Consulting GmbH",
      "company_seat": "Leipzig",
      "details": "28.11.2024 (Bekanntmachungsdatum)\n\nSachsen Amtsgericht Leipzig HRB 40743\nRegisterbekanntmachung nach dem Umwandlungsgesetz 28.11.2024 (Eintragungsdatum)\n\nTrustUs Consulting GmbH\nGesellschaft mit beschränkter Haftung\nLeipzig\n\nDen Gläubigern der an der Verschmelzung beteiligten Rechtsträger ist, wenn sie binnen sechs Monaten nach dem Tag, an dem die Eintragung der Verschmelzung in das Register des Sitzes desjenigen Rechtsträgers, dessen Gläubiger sie sind, nach § 19 Abs. 3 UmwG als bekannt gemacht gilt, ihren Anspruch nach Grund und Höhe schriftlich anmelden, Sicherheit zu leisten, soweit sie nicht Befriedigung verlangen können. Dieses Recht steht den Gläubigern jedoch nur zu, wenn sie glaubhaft machen, dass durch die Verschmelzung die Erfüllung der Forderung gefährdet wird."
    },
    {
      "date": "2024-11-28",
      "id": "94913",
      "original_text": "Registerbekanntmachung nach dem Umwandlungsgesetz\nSachsen Amtsgericht Leipzig HRB 40570\nTrustUs GmbH – Leipzig",
      "type": "Registerbekanntmachung nach dem Umwandlungsgesetz",
      "state": "Sachsen",
      "amtsgericht": "Amtsgericht Leipzig",
      "registernummer": "HRB 40570",
      "registerart": "HRB",
      "company_name": "TrustUs GmbH",
      "company_seat": "Leipzig",
      "details": "28.11.2024 (Bekanntmachungsdatum)\n\nSachsen Amtsgericht Leipzig HRB 40570\nRegisterbekanntmachung nach dem Umwandlungsgesetz 28.11.2024 (Eintragungsdatum)\n\nTrustUs GmbH\nGesellschaft mit beschränkter Haftung\nLeipzig\n\nDen Gläubigern der an der Verschmelzung beteiligten Rechtsträger ist, wenn sie binnen sechs Monaten nach dem Tag, an dem die Eintragung der Verschmelzung in das Register des Sitzes desjenigen Rechtsträgers, dessen Gläubiger sie sind, nach § 19 Abs. 3 UmwG als bekannt gemacht gilt, ihren Anspruch nach Grund und Höhe schriftlich anmelden, Sicherheit zu leisten, soweit sie nicht Befriedigung verlangen können. Dieses Recht steht den Gläubigern jedoch nur zu, wenn sie glaubhaft machen, dass durch die Verschmelzung die Erfüllung der Forderung gefährdet wird."
    },
    {
      "date": "2024-11-28",
      "id": "94889",
      "original_text": "Löschungsankündigung\nBaden-Württemberg Amtsgericht Stuttgart HRB 768350\nTrustimmoinvest GmbH – Nufringen",
      "type": "Löschungsankündigung",
      "state": "Baden-Württemberg",
      "amtsgericht": "Amtsgericht Stuttgart",
      "registernummer": "HRB 768350",
      "registerart": "HRB",
      "company_name": "Trustimmoinvest GmbH",
      "company_seat": "Nufringen",
      "details": "28.11.2024 (Bekanntmachungsdatum)\n\nBaden-Württemberg Amtsgericht Stuttgart HRB 768350\nLöschungsankündigung\n\nTrustimmoinvest GmbH\nGesellschaft mit beschränkter Haftung\nNufringen\n\nDas Gericht beabsichtigt, die Gesellschaft wegen Vermögenslosigkeit im Handelsregister von Amts wegen nach § 394 FamFG zu löschen. Die Frist zur Geltendmachung eines Widerspruchs gegen die beabsichtigte Löschung ist auf zwei Monate ab Veröffentlichung bestimmt."
    },
    {
      "date": "2024-11-28",
      "id": "94856",
      "original_text": "Registerbekanntmachung nach dem Umwandlungsgesetz\nBayern Amtsgericht Nürnberg HRB 43451\nTschernikl Versicherungsmakler GmbH – Nürnberg",
      "type": "Registerbekanntmachung nach dem Umwandlungsgesetz",
      "state": "Bayern",
      "amtsgericht": "Amtsgericht Nürnberg",
      "registernummer": "HRB 43451",
      "registerart": "HRB",
      "company_name": "Tschernikl Versicherungsmakler GmbH",
      "company_seat": "Nürnberg",
      "details": "28.11.2024 (Bekanntmachungsdatum)\n\nBayern Amtsgericht Nürnberg HRB 43451\nRegisterbekanntmachung nach dem Umwandlungsgesetz 27.11.2024 (Eintragungsdatum)\n\nTschernikl Versicherungsmakler GmbH\nGesellschaft mit beschränkter Haftung\nNürnberg\n\nDen Gläubigern der an der Verschmelzung beteiligten Rechtsträger ist, wenn sie binnen sechs Monaten nach dem Tag, an dem die Eintragung der Verschmelzung in das Register des Sitzes desjenigen Rechtsträgers, dessen Gläubiger sie sind, nach § 19 Abs. 3 UmwG als bekannt gemacht gilt, ihren Anspruch nach Grund und Höhe schriftlich anmelden, Sicherheit zu leisten, soweit sie nicht Befriedigung verlangen können. Dieses Recht steht den Gläubigern jedoch nur zu, wenn sie glaubhaft machen, dass durch die Verschmelzung die Erfüllung ihrer Forderung gefährdet wird."
    },
    {
      "date": "2024-11-28",
      "id": "94858",
      "original_text": "Einreichung neuer Dokumente\nBayern Amtsgericht München HRB 289472\nUniCredit Bank GmbH – München",
      "type": "Einreichung neuer Dokumente",
      "state": "Bayern",
      "amtsgericht": "Amtsgericht München",
      "registernummer": "HRB 289472",
      "registerart": "HRB",
      "company_name": "UniCredit Bank GmbH",
      "company_seat": "München",
      "details": "28.11.2024 (Bekanntmachungsdatum)\n\nBayern Amtsgericht München HRB 289472\nEinreichung neuer Dokumente\n\nUniCredit Bank GmbH\nGesellschaft mit beschränkter Haftung\nMünchen\n\nDem Amtsgericht München -Registergericht- ist eine Liste der Mitglieder des Aufsichtsrats eingereicht worden, § 52 Abs. 3 S. 2 GmbHG."
    },
    {
      "date": "2024-11-28",
      "id": "94923",
      "original_text": "Registerbekanntmachung nach dem Umwandlungsgesetz\nNiedersachsen Amtsgericht Tostedt HRB 205649\nVG 57. Verwaltungsgesellschaft mbH – Stade",
      "type": "Registerbekanntmachung nach dem Umwandlungsgesetz",
      "state": "Niedersachsen",
      "amtsgericht": "Amtsgericht Tostedt",
      "registernummer": "HRB 205649",
      "registerart": "HRB",
      "company_name": "VG 57. Verwaltungsgesellschaft mbH",
      "company_seat": "Stade",
      "details": "28.11.2024 (Bekanntmachungsdatum)\n\nNiedersachsen Amtsgericht Tostedt HRB 205649\nRegisterbekanntmachung nach dem Umwandlungsgesetz 28.11.2024 (Eintragungsdatum)\n\nVG 57. Verwaltungsgesellschaft mbH\nGesellschaft mit beschränkter Haftung\nStade\n\nDen Gläubigern der an der Verschmelzung beteiligten Rechtsträger ist, wenn sie binnen sechs Monaten nach dem Tag, an dem die Eintragung der Verschmelzung in das Register des Sitzes desjenigen Rechtsträgers, dessen Gläubiger sie sind, nach § 19  Abs.  3 UmwG als bekannt gemacht gilt, ihren Anspruch nach Grund und Höhe schriftlich anmelden, Sicherheit zu leisten, soweit sie nicht Befriedigung verlangen können. Dieses Recht steht den Gläubigern jedoch nur zu, wenn sie glaubhaft machen, dass durch die Verschmelzung die Erfüllung der Forderung gefährdet wird."
    },
    {
      "date": "2024-11-28",
      "id": "94919",
      "original_text": "Einreichung neuer Dokumente\nNiedersachsen Amtsgericht Oldenburg (Oldenburg) HRB 1843\nVerkehr und Wasser GmbH – Oldenburg",
      "type": "Einreichung neuer Dokumente",
      "state": "Niedersachsen",
      "amtsgericht": "Amtsgericht Oldenburg (Oldenburg)",
      "registernummer": "HRB 1843",
      "registerart": "HRB",
      "company_name": "Verkehr und Wasser GmbH",
      "company_seat": "Oldenburg",
      "details": "28.11.2024 (Bekanntmachungsdatum)\n\nNiedersachsen Amtsgericht Oldenburg (Oldenburg) HRB 1843\nEinreichung neuer Dokumente 28.11.2024 (Eintragungsdatum)\n\nVerkehr und Wasser GmbH\nGesellschaft mit beschränkter Haftung\nOldenburg\n\nDie Liste der Mitglieder des Aufsichtsrats wurde beim Registergericht eingereicht."
    },
    {
      "date": "2024-11-28",
      "id": "94895",
      "original_text": "Einreichung neuer Dokumente\nBaden-Württemberg Amtsgericht Mannheim HRB 709947\nWISTA Rechtsanwalts AG – Mannheim",
      "type": "Einreichung neuer Dokumente",
      "state": "Baden-Württemberg",
      "amtsgericht": "Amtsgericht Mannheim",
      "registernummer": "HRB 709947",
      "registerart": "HRB",
      "company_name": "WISTA Rechtsanwalts AG",
      "company_seat": "Mannheim",
      "details": "28.11.2024 (Bekanntmachungsdatum)\n\nBaden-Württemberg Amtsgericht Mannheim HRB 709947\nEinreichung neuer Dokumente\n\nWISTA Rechtsanwalts AG\nAktiengesellschaft\nMannheim\n\nDie Gesellschaft hat am 26.11.2024 die Liste über die Zusammensetzung des Aufsichtsrats zum Handelsregister eingereicht."
    },
    {
      "date": "2024-11-28",
      "id": "94863",
      "original_text": "Registerbekanntmachung nach dem Umwandlungsgesetz\nBayern Amtsgericht München HRB 286982\nWaldegg II Verwaltung GmbH – München",
      "type": "Registerbekanntmachung nach dem Umwandlungsgesetz",
      "state": "Bayern",
      "amtsgericht": "Amtsgericht München",
      "registernummer": "HRB 286982",
      "registerart": "HRB",
      "company_name": "Waldegg II Verwaltung GmbH",
      "company_seat": "München",
      "details": "28.11.2024 (Bekanntmachungsdatum)\n\nBayern Amtsgericht München HRB 286982\nRegisterbekanntmachung nach dem Umwandlungsgesetz 27.11.2024 (Eintragungsdatum)\n\nWaldegg II Verwaltung GmbH\nGesellschaft mit beschränkter Haftung\nMünchen\n\nDen Gläubigern des formwechselnden Rechtsträgers ist, wenn sie binnen sechs Monaten nach dem Tag, an dem die Eintragung des Formwechsels nach § 201 UmwG als bekannt gemacht gilt, ihren Anspruch nach Grund und Höhe schriftlich anmelden, Sicherheit zu leisten, soweit sie nicht Befriedigung verlangen können. Dieses Recht steht den Gläubigern jedoch nur zu, wenn sie glaubhaft machen, dass durch den Formwechsel die Erfüllung ihrer Forderung gefährdet wird."
    },
    {
      "date": "2024-11-28",
      "id": "94862",
      "original_text": "Registerbekanntmachung nach dem Umwandlungsgesetz\nBayern Amtsgericht München HRB 292159\nWaldegg III Verwaltung GmbH – München",
      "type": "Registerbekanntmachung nach dem Umwandlungsgesetz",
      "state": "Bayern",
      "amtsgericht": "Amtsgericht München",
      "registernummer": "HRB 292159",
      "registerart": "HRB",
      "company_name": "Waldegg III Verwaltung GmbH",
      "company_seat": "München",
      "details": "28.11.2024 (Bekanntmachungsdatum)\n\nBayern Amtsgericht München HRB 292159\nRegisterbekanntmachung nach dem Umwandlungsgesetz 27.11.2024 (Eintragungsdatum)\n\nWaldegg III Verwaltung GmbH\nGesellschaft mit beschränkter Haftung\nMünchen\n\nDen Gläubigern des formwechselnden Rechtsträgers ist, wenn sie binnen sechs Monaten nach dem Tag, an dem die Eintragung des Formwechsels nach § 201 UmwG als bekannt gemacht gilt, ihren Anspruch nach Grund und Höhe schriftlich anmelden, Sicherheit zu leisten, soweit sie nicht Befriedigung verlangen können. Dieses Recht steht den Gläubigern jedoch nur zu, wenn sie glaubhaft machen, dass durch den Formwechsel die Erfüllung ihrer Forderung gefährdet wird."
    },
    {
      "date": "2024-11-28",
      "id": "94906",
      "original_text": "Löschungsankündigung\nBaden-Württemberg Amtsgericht Freiburg HRB 730549\nWandelSolar UG (haftungsbeschränkt) – Freiburg im Breisgau",
      "type": "Löschungsankündigung",
      "state": "Baden-Württemberg",
      "amtsgericht": "Amtsgericht Freiburg",
      "registernummer": "HRB 730549",
      "registerart": "HRB",
      "company_name": "WandelSolar UG (haftungsbeschränkt)",
      "company_seat": "Freiburg im Breisgau",
      "details": "28.11.2024 (Bekanntmachungsdatum)\n\nBaden-Württemberg Amtsgericht Freiburg HRB 730549\nLöschungsankündigung\n\nWandelSolar UG (haftungsbeschränkt)\nGesellschaft mit beschränkter Haftung\nFreiburg im Breisgau\n\nDas Gericht beabsichtigt, die Gesellschaft wegen Vermögenslosigkeit im Handelsregister von Amts wegen nach § 394 FamFG zu löschen. Die Frist zur Geltendmachung eines Widerspruchs gegen die beabsichtigte Löschung ist auf einen Monat ab Veröffentlichung bestimmt."
    },
    {
      "date": "2024-11-28",
      "id": "94871",
      "original_text": "Registerbekanntmachung nach dem Umwandlungsgesetz\nBayern Amtsgericht München HRB 102967\nWirtshaus in der Au GmbH – München",
      "type": "Registerbekanntmachung nach dem Umwandlungsgesetz",
      "state": "Bayern",
      "amtsgericht": "Amtsgericht München",
      "registernummer": "HRB 102967",
      "registerart": "HRB",
      "company_name": "Wirtshaus in der Au GmbH",
      "company_seat": "München",
      "details": "28.11.2024 (Bekanntmachungsdatum)\n\nBayern Amtsgericht München HRB 102967\nRegisterbekanntmachung nach dem Umwandlungsgesetz 27.11.2024 (Eintragungsdatum)\n\nWirtshaus in der Au GmbH\nGesellschaft mit beschränkter Haftung\nMünchen\n\nDen Gläubigern der an der Ausgliederung beteiligten Rechtsträger ist, wenn sie binnen sechs Monaten nach dem Tag, an dem die Eintragung der Ausgliederung in das Register des Sitzes desjenigen Rechtsträgers, dessen Gläubiger sie sind, nach §§ 125, 19 Abs. 3 UmwG als bekannt gemacht gilt, ihren Anspruch nach Grund und Höhe schriftlich anmelden, Sicherheit zu leisten, soweit sie nicht Befriedigung verlangen können. Dieses Recht steht den Gläubigern jedoch nur zu, wenn sie glaubhaft machen, dass durch die Ausgliederung die Erfüllung ihrer Forderung gefährdet wird."
    },
    {
      "date": "2024-11-28",
      "id": "94849",
      "original_text": "Registerbekanntmachung nach dem Umwandlungsgesetz\nBayern Amtsgericht München HRA 120090\nWirtshaus in der Au Münchner Knödelei GmbH & Co. KG – München",
      "type": "Registerbekanntmachung nach dem Umwandlungsgesetz",
      "state": "Bayern",
      "amtsgericht": "Amtsgericht München",
      "registernummer": "HRA 120090",
      "registerart": "HRA",
      "company_name": "Wirtshaus in der Au Münchner Knödelei GmbH & Co. KG",
      "company_seat": "München",
      "details": "28.11.2024 (Bekanntmachungsdatum)\n\nBayern Amtsgericht München HRA 120090\nRegisterbekanntmachung nach dem Umwandlungsgesetz 27.11.2024 (Eintragungsdatum)\n\nWirtshaus in der Au Münchner Knödelei GmbH & Co. KG\nKommanditgesellschaft\nMünchen\n\nDen Gläubigern der an der Ausgliederung beteiligten Rechtsträger ist, wenn sie binnen sechs Monaten nach dem Tag, an dem die Eintragung der Ausgliederung in das Register des Sitzes desjenigen Rechtsträgers, dessen Gläubiger sie sind, nach §§ 125, 19 Abs. 3 UmwG als bekannt gemacht gilt, ihren Anspruch nach Grund und Höhe schriftlich anmelden, Sicherheit zu leisten, soweit sie nicht Befriedigung verlangen können. Dieses Recht steht den Gläubigern jedoch nur zu, wenn sie glaubhaft machen, dass durch die Ausgliederung die Erfüllung ihrer Forderung gefährdet wird."
    },
    {
      "date": "2024-11-28",
      "id": "94848",
      "original_text": "Löschungsankündigung\nBayern Amtsgericht München HRB 248621\nWolf GmbH – Geretsried",
      "type": "Löschungsankündigung",
      "state": "Bayern",
      "amtsgericht": "Amtsgericht München",
      "registernummer": "HRB 248621",
      "registerart": "HRB",
      "company_name": "Wolf GmbH",
      "company_seat": "Geretsried",
      "details": "28.11.2024 (Bekanntmachungsdatum)\n\nBayern Amtsgericht München HRB 248621\nLöschungsankündigung 27.11.2024 (Eintragungsdatum)\n\nWolf GmbH\nGesellschaft mit beschränkter Haftung\nGeretsried\n\nDas Registergericht beabsichtigt, die im Handelsregister eingetragene Gesellschaft wegen Vermögenslosigkeit von Amts wegen nach § 394 FamFG zu löschen. Die Frist zur Erhebung eines Widerspruchs ist auf drei Monate festgesetzt."
    },
    {
      "date": "2024-11-28",
      "id": "94953",
      "original_text": "Löschungsankündigung\nHessen Amtsgericht Offenbach am Main HRB 53242\nZBB GmbH – Heusenstamm",
      "type": "Löschungsankündigung",
      "state": "Hessen",
      "amtsgericht": "Amtsgericht Offenbach am Main",
      "registernummer": "HRB 53242",
      "registerart": "HRB",
      "company_name": "ZBB GmbH",
      "company_seat": "Heusenstamm",
      "details": "28.11.2024 (Bekanntmachungsdatum)\n\nHessen Amtsgericht Offenbach am Main HRB 53242\nLöschungsankündigung 28.11.2024 (Eintragungsdatum)\n\nZBB GmbH\nGesellschaft mit beschränkter Haftung\nHeusenstamm\n\nDas Registergericht beabsichtigt die im Handelsregister eingetragene Gesellschaft von Amts wegen nach § 394 FamFG zu löschen. Die Frist zur Erhebung eines Widerspruchs gegen die beabsichtigte Löschung wird auf 3 Monate festgesetzt."
    },
    {
      "date": "2024-11-28",
      "id": "94867",
      "original_text": "Einreichung neuer Dokumente\nBayern Amtsgericht Traunstein HRB 14505\nZF Airbag Germany GmbH – Aschau a. Inn",
      "type": "Einreichung neuer Dokumente",
      "state": "Bayern",
      "amtsgericht": "Amtsgericht Traunstein",
      "registernummer": "HRB 14505",
      "registerart": "HRB",
      "company_name": "ZF Airbag Germany GmbH",
      "company_seat": "Aschau a. Inn",
      "details": "28.11.2024 (Bekanntmachungsdatum)\n\nBayern Amtsgericht Traunstein HRB 14505\nEinreichung neuer Dokumente\n\nZF Airbag Germany GmbH\nGesellschaft mit beschränkter Haftung\nAschau a. Inn\n\nDem Amtsgericht Traunstein -Registergericht- ist eine Liste der Mitglieder des Aufsichtsrats eingereicht worden, § 52 Abs. 3 S. 2 GmbHG."
    },
    {
      "date": "2024-11-28",
      "id": "94865",
      "original_text": "Registerbekanntmachung nach dem Umwandlungsgesetz\nBayern Amtsgericht München HRB 227786\nifena GmbH – München",
      "type": "Registerbekanntmachung nach dem Umwandlungsgesetz",
      "state": "Bayern",
      "amtsgericht": "Amtsgericht München",
      "registernummer": "HRB 227786",
      "registerart": "HRB",
      "company_name": "ifena GmbH",
      "company_seat": "München",
      "details": "28.11.2024 (Bekanntmachungsdatum)\n\nBayern Amtsgericht München HRB 227786\nRegisterbekanntmachung nach dem Umwandlungsgesetz 27.11.2024 (Eintragungsdatum)\n\nifena GmbH\nGesellschaft mit beschränkter Haftung\nMünchen\n\nDen Gläubigern der an der Verschmelzung beteiligten Rechtsträger ist, wenn sie binnen sechs Monaten nach dem Tag, an dem die Eintragung der Verschmelzung in das Register des Sitzes desjenigen Rechtsträgers, dessen Gläubiger sie sind, nach § 19 Abs. 3 UmwG als bekannt gemacht gilt, ihren Anspruch nach Grund und Höhe schriftlich anmelden, Sicherheit zu leisten, soweit sie nicht Befriedigung verlangen können. Dieses Recht steht den Gläubigern jedoch nur zu, wenn sie glaubhaft machen, dass durch die Verschmelzung die Erfüllung ihrer Forderung gefährdet wird."
    },
    {
      "date": "2024-11-28",
      "id": "94869",
      "original_text": "Sonstige Registerbekanntmachung\nBayern Amtsgericht München HRB 129139\njambit GmbH – München",
      "type": "Sonstige Registerbekanntmachung",
      "state": "Bayern",
      "amtsgericht": "Amtsgericht München",
      "registernummer": "HRB 129139",
      "registerart": "HRB",
      "company_name": "jambit GmbH",
      "company_seat": "München",
      "details": "28.11.2024 (Bekanntmachungsdatum)\n\nBayern Amtsgericht München HRB 129139\nSonstige Registerbekanntmachung 21.11.2024 (Eintragungsdatum)\n\njambit GmbH\nGesellschaft mit beschränkter Haftung\nMünchen\n\nDem Amtsgericht München -Registergericht- ist eine Liste der Mitglieder des Aufsichtsrats eingereicht worden, § 52 Abs. 3 S. 2 GmbHG."
    },
    {
      "date": "2024-11-28",
      "id": "94909",
      "original_text": "Einreichung neuer Dokumente\nSchleswig-Holstein Amtsgericht Kiel HRB 22952\nlebensnah, Beratung und Pflege gGmbH – Rendsburg",
      "type": "Einreichung neuer Dokumente",
      "state": "Schleswig-Holstein",
      "amtsgericht": "Amtsgericht Kiel",
      "registernummer": "HRB 22952",
      "registerart": "HRB",
      "company_name": "lebensnah, Beratung und Pflege gGmbH",
      "company_seat": "Rendsburg",
      "details": "28.11.2024 (Bekanntmachungsdatum)\n\nSchleswig-Holstein Amtsgericht Kiel HRB 22952\nEinreichung neuer Dokumente\n\nlebensnah, Beratung und Pflege gGmbH\nGesellschaft mit beschränkter Haftung\nRendsburg\n\nAls nicht eingetragen wird veröffentlicht:Eine neue Liste der Aufsichtsratsmitglieder ist eingereicht worden."
    },
    {
      "date": "2024-11-28",
      "id": "94960",
      "original_text": "Registerbekanntmachung nach dem Umwandlungsgesetz\nHessen Amtsgericht Frankfurt am Main HRB 128796\npluradent dental bauer GmbH – Frankfurt am Main",
      "type": "Registerbekanntmachung nach dem Umwandlungsgesetz",
      "state": "Hessen",
      "amtsgericht": "Amtsgericht Frankfurt am Main",
      "registernummer": "HRB 128796",
      "registerart": "HRB",
      "company_name": "pluradent dental bauer GmbH",
      "company_seat": "Frankfurt am Main",
      "details": "28.11.2024 (Bekanntmachungsdatum)\n\nHessen Amtsgericht Frankfurt am Main HRB 128796\nRegisterbekanntmachung nach dem Umwandlungsgesetz 28.11.2024 (Eintragungsdatum)\n\npluradent dental bauer GmbH\nGesellschaft mit beschränkter Haftung\nFrankfurt am Main\n\nDen Gläubigern der an der Verschmelzung beteiligten Rechtsträger ist, wenn sie binnen sechs Monaten nach dem Tag, an dem die Eintragung der Verschmelzung in das Register des Sitzes desjenigen Rechtsträgers, dessen Gläubiger sie sind, nach § 19 Absatz 3 UmwG bekannt gemacht worden ist, ihren Anspruch nach Grund und Höhe schriftlich anmelden, Sicherheit zu leisten, soweit sie nicht Befriedigung verlangen können. Dieses Recht steht den Gläubigern jedoch nur zu, wenn sie glaubhaft machen, dass durch die Verschmelzung die Erfüllung ihrer Forderung gefährdet wird."
    },
    {
      "date": "2024-11-28",
      "id": "94899",
      "original_text": "Löschungsankündigung\nBerlin Amtsgericht Berlin (Charlottenburg) HRB 98013\npérez/preusker media production gmbH – Berlin",
      "type": "Löschungsankündigung",
      "state": "Berlin",
      "amtsgericht": "Amtsgericht Berlin (Charlottenburg)",
      "registernummer": "HRB 98013",
      "registerart": "HRB",
      "company_name": "pérez/preusker media production gmbH",
      "company_seat": "Berlin",
      "details": "28.11.2024 (Bekanntmachungsdatum)\n\nBerlin Amtsgericht Berlin (Charlottenburg) HRB 98013\nLöschungsankündigung\n\npérez/preusker media production gmbH\nGesellschaft mit beschränkter Haftung\nBerlin\n\nBei der nachstehenden Gesellschaft wird das Amtslöschungsverfahren gemäß § 394 FamFG eingeleitet. Widerspruchsfrist 6 Wochen"
    }
  ]
}