{
  "date": "2024-11-04",
  "date_of_scrape": "2024-12-07T09:49:33.730Z",
  "tool_version": "0.2.0",
  "number_of_announcements": 108,
  "announcements": [
    {
      "date": "2024-11-04",
      "id": "92376",
      "original_text": "Registerbekanntmachung nach dem Umwandlungsgesetz\nBaden-Württemberg Amtsgericht Stuttgart HRA 741667\nJannis Gerlinger e.K. – Backnang",
      "type": "Registerbekanntmachung nach dem Umwandlungsgesetz",
      "state": "Baden-Württemberg",
      "amtsgericht": "Amtsgericht Stuttgart",
      "registernummer": "HRA 741667",
      "registerart": "HRA",
      "company_name": "Jannis Gerlinger e.K.",
      "company_seat": "Backnang",
      "details": "04.11.2024 (Bekanntmachungsdatum)\n\nBaden-Württemberg Amtsgericht Stuttgart HRA 741667\nRegisterbekanntmachung nach dem Umwandlungsgesetz 04.11.2024 (Eintragungsdatum)\n\nJannis Gerlinger e.K.\nEinzelkaufmann / Einzelkauffrau\nBacknang\n\nDen Gläubigern der an der Ausgliederung beteiligten Rechtsträger ist, wenn sie binnen sechs Monaten nach dem Tag, an dem die Eintragung der Ausgliederung in das Register des Sitzes desjenigen Rechtsträgers, dessen Gläubiger sie sind, nach § 19 Abs. 3 UmwG als bekanntgemacht gilt, ihren Anspruch nach Grund und Höhe schriftlich anmelden, Sicherheit zu leisten, soweit sie nicht Befriedigung verlangen können. Dieses Recht steht den Gläubigern jedoch nur zu, wenn sie glaubhaft machen, dass durch die Ausgliederung die Erfüllung ihrer Forderung gefährdet wird."
    },
    {
      "date": "2024-11-04",
      "id": "92377",
      "original_text": "Registerbekanntmachung nach dem Umwandlungsgesetz\nBaden-Württemberg Amtsgericht Stuttgart HRB 796273\nJANGER GmbH – Backnang",
      "type": "Registerbekanntmachung nach dem Umwandlungsgesetz",
      "state": "Baden-Württemberg",
      "amtsgericht": "Amtsgericht Stuttgart",
      "registernummer": "HRB 796273",
      "registerart": "HRB",
      "company_name": "JANGER GmbH",
      "company_seat": "Backnang",
      "details": "04.11.2024 (Bekanntmachungsdatum)\n\nBaden-Württemberg Amtsgericht Stuttgart HRB 796273\nRegisterbekanntmachung nach dem Umwandlungsgesetz 04.11.2024 (Eintragungsdatum)\n\nJANGER GmbH\nGesellschaft mit beschränkter Haftung\nBacknang\n\nDen Gläubigern der an der Ausgliederung beteiligten Rechtsträger ist, wenn sie binnen sechs Monaten nach dem Tag, an dem die Eintragung der Ausgliederung in das Register des Sitzes desjenigen Rechtsträgers, dessen Gläubiger sie sind, nach § 19 Abs. 3 UmwG als bekanntgemacht gilt, ihren Anspruch nach Grund und Höhe schriftlich anmelden, Sicherheit zu leisten, soweit sie nicht Befriedigung verlangen können. Dieses Recht steht den Gläubigern jedoch nur zu, wenn sie glaubhaft machen, dass durch die Ausgliederung die Erfüllung ihrer Forderung gefährdet wird."
    },
    {
      "date": "2024-11-04",
      "id": "92378",
      "original_text": "Registerbekanntmachung nach dem Umwandlungsgesetz\nBaden-Württemberg Amtsgericht Freiburg GnR 630001\nVolksbank Rhein-Wehra eG – Bad Säckingen",
      "type": "Registerbekanntmachung nach dem Umwandlungsgesetz",
      "state": "Baden-Württemberg",
      "amtsgericht": "Amtsgericht Freiburg",
      "registernummer": "GnR 630001",
      "registerart": "GnR",
      "company_name": "Volksbank Rhein-Wehra eG",
      "company_seat": "Bad Säckingen",
      "details": "04.11.2024 (Bekanntmachungsdatum)\n\nBaden-Württemberg Amtsgericht Freiburg GnR 630001\nRegisterbekanntmachung nach dem Umwandlungsgesetz 04.11.2024 (Eintragungsdatum)\n\nVolksbank Rhein-Wehra eG\neingetragene Genossenschaft\nBad Säckingen\n\nAls nicht eingetragen wird bekanntgemacht:\nDen Gläubigern der an der Verschmelzung beteiligten Rechtsträger ist, wenn sie binnen sechs Monaten nach dem Tag, an dem die Eintragung der Verschmelzung in das Register des Sitzes desjenigen Rechtsträgers, dessen Gläubiger sie sind, nach § 19 Abs. 3 UmwG als bekanntgemacht gilt, ihren Anspruch nach Grund und Höhe schriftlich anmelden, Sicherheit zu leisten, soweit sie nicht Befriedigung verlangen können. Dieses Recht steht den Gläubigern jedoch nur zu, wenn sie glaubhaft machen, dass durch die Verschmelzung die Erfüllung ihrer Forderung gefährdet wird."
    },
    {
      "date": "2024-11-04",
      "id": "92379",
      "original_text": "Registerbekanntmachung nach dem Umwandlungsgesetz\nBaden-Württemberg Amtsgericht Freiburg GnR 600001\nVolksbank eG - Die Gestalterbank – Offenburg und Villingen-Schwenningen",
      "type": "Registerbekanntmachung nach dem Umwandlungsgesetz",
      "state": "Baden-Württemberg",
      "amtsgericht": "Amtsgericht Freiburg",
      "registernummer": "GnR 600001",
      "registerart": "GnR",
      "company_name": "Volksbank eG - Die Gestalterbank",
      "company_seat": "Offenburg und Villingen-Schwenningen",
      "details": "04.11.2024 (Bekanntmachungsdatum)\n\nBaden-Württemberg Amtsgericht Freiburg GnR 600001\nRegisterbekanntmachung nach dem Umwandlungsgesetz 04.11.2024 (Eintragungsdatum)\n\nVolksbank eG - Die Gestalterbank\neingetragene Genossenschaft\nOffenburg und Villingen-Schwenningen\n\nAls nicht eingetragen wird bekanntgemacht:\nDen Gläubigern der an der Verschmelzung beteiligten Rechtsträger ist, wenn sie binnen sechs Monaten nach dem Tag, an dem die Eintragung der Verschmelzung in das Register des Sitzes desjenigen Rechtsträgers, dessen Gläubiger sie sind, nach § 19 Abs. 3 UmwG als bekanntgemacht gilt, ihren Anspruch nach Grund und Höhe schriftlich anmelden, Sicherheit zu leisten, soweit sie nicht Befriedigung verlangen können. Dieses Recht steht den Gläubigern jedoch nur zu, wenn sie glaubhaft machen, dass durch die Verschmelzung die Erfüllung ihrer Forderung gefährdet wird."
    },
    {
      "date": "2024-11-04",
      "id": "92380",
      "original_text": "Löschungsankündigung\nSaarland Amtsgericht Saarbrücken HRB 110050\nEckert Fun GmbH – Homburg",
      "type": "Löschungsankündigung",
      "state": "Saarland",
      "amtsgericht": "Amtsgericht Saarbrücken",
      "registernummer": "HRB 110050",
      "registerart": "HRB",
      "company_name": "Eckert Fun GmbH",
      "company_seat": "Homburg",
      "details": "04.11.2024 (Bekanntmachungsdatum)\n\nSaarland Amtsgericht Saarbrücken HRB 110050\nLöschungsankündigung\n\nEckert Fun GmbH\nGesellschaft mit beschränkter Haftung\nHomburg\n\nEs ist beabsichtigt, die Gesellschaft von Amts wegen gemäß § 394 FamFG wegen Vermögenslosigkeit zu löschen.\nGegen die Löschung von Amts wegen ist das Rechtsmittel des Widerspruchs statthaft. Der Widerspruch ist binnen einer Frist zwei Monaten beginnend mit dem Tag dieser Veröffentlichung durch Einreichen eines Widerspruchsschreibens -schriftlich oder zur Niederschrift der Geschäftsstelle beim Amtsgericht Saarbrücken, -zentrales Handelsregister-, Mainzerstr.178, 66121 Saarbrücken einzulegen.\nDer Widerspruch muss die Bezeichnung der angefochtenen Löschungsankündigung enthalten sowie die Erklärung, dass Widerspruch eingelegt wird. Er ist vom Widerspruchsführer oder seinem Bevollmächtigten zu unterzeichnen.\nDas Widerspruchsschreiben kann auch in der Form eines elektronischen Dokumentes eingereicht werden, das mit einer qualifizierten elektronischen Signatur nach dem Signaturgesetz versehen sein muss (§§ 14 Abs. 2 FamFG, 130a, 298 ZPO)."
    },
    {
      "date": "2024-11-04",
      "id": "92381",
      "original_text": "Löschungsankündigung\nBaden-Württemberg Amtsgericht Mannheim HRB 704727\nBeauty Brands Vertriebs GmbH – Baden-Baden",
      "type": "Löschungsankündigung",
      "state": "Baden-Württemberg",
      "amtsgericht": "Amtsgericht Mannheim",
      "registernummer": "HRB 704727",
      "registerart": "HRB",
      "company_name": "Beauty Brands Vertriebs GmbH",
      "company_seat": "Baden-Baden",
      "details": "04.11.2024 (Bekanntmachungsdatum)\n\nBaden-Württemberg Amtsgericht Mannheim HRB 704727\nLöschungsankündigung\n\nBeauty Brands Vertriebs GmbH\nGesellschaft mit beschränkter Haftung\nBaden-Baden\n\nDas Gericht beabsichtigt, die Gesellschaft wegen Vermögenslosigkeit im Handelsregister von Amts wegen nach § 394 FamFG zu löschen. Die Frist zur Geltendmachung eines Widerspruchs gegen die beabsichtigte Löschung ist auf einen Monat ab Veröffentlichung bestimmt."
    },
    {
      "date": "2024-11-04",
      "id": "92382",
      "original_text": "Registerbekanntmachung nach dem Umwandlungsgesetz\nBaden-Württemberg Amtsgericht Ulm GnR 640086\nVolksbank Raiffeisenbank Laupheim-Illertal eG – Laupheim",
      "type": "Registerbekanntmachung nach dem Umwandlungsgesetz",
      "state": "Baden-Württemberg",
      "amtsgericht": "Amtsgericht Ulm",
      "registernummer": "GnR 640086",
      "registerart": "GnR",
      "company_name": "Volksbank Raiffeisenbank Laupheim-Illertal eG",
      "company_seat": "Laupheim",
      "details": "04.11.2024 (Bekanntmachungsdatum)\n\nBaden-Württemberg Amtsgericht Ulm GnR 640086\nRegisterbekanntmachung nach dem Umwandlungsgesetz 04.11.2024 (Eintragungsdatum)\n\nVolksbank Raiffeisenbank Laupheim-Illertal eG\neingetragene Genossenschaft\nLaupheim\n\nAls nicht eingetragen wird bekanntgemacht:\nDen Gläubigern der an der Verschmelzung beteiligten Rechtsträger ist, wenn sie binnen sechs Monaten nach dem Tag, an dem die Eintragung der Verschmelzung in das Register des Sitzes desjenigen Rechtsträgers, dessen Gläubiger sie sind, nach § 19 Abs. 3 UmwG als bekanntgemacht gilt, ihren Anspruch nach Grund und Höhe schriftlich anmelden, Sicherheit zu leisten, soweit sie nicht Befriedigung verlangen können. Dieses Recht steht den Gläubigern jedoch nur zu, wenn sie glaubhaft machen, dass durch die Verschmelzung die Erfüllung ihrer Forderung gefährdet wird."
    },
    {
      "date": "2024-11-04",
      "id": "92383",
      "original_text": "Registerbekanntmachung nach dem Umwandlungsgesetz\nMecklenburg-Vorpommern Amtsgericht Rostock HRB 14429\nARTEK Massivhaus GmbH – Rostock",
      "type": "Registerbekanntmachung nach dem Umwandlungsgesetz",
      "state": "Mecklenburg-Vorpommern",
      "amtsgericht": "Amtsgericht Rostock",
      "registernummer": "HRB 14429",
      "registerart": "HRB",
      "company_name": "ARTEK Massivhaus GmbH",
      "company_seat": "Rostock",
      "details": "04.11.2024 (Bekanntmachungsdatum)\n\nMecklenburg-Vorpommern Amtsgericht Rostock HRB 14429\nRegisterbekanntmachung nach dem Umwandlungsgesetz 04.11.2024 (Eintragungsdatum)\n\nARTEK Massivhaus GmbH\nGesellschaft mit beschränkter Haftung\nRostock\n\nDen Gläubigern der an der Ausgliederung beteiligten Rechtsträger ist, wenn sie binnen sechs Monaten nach dem Tag, an dem die Eintragung der Ausgliederung in das Register des Sitzes desjenigen Rechtsträgers, dessen Gläubiger sie sind, nach § 19 Abs. 3 UmwG als bekannt gemacht gilt, ihren Anspruch nach Grund und Höhe schriftlich anmelden, Sicherheit zu leisten, soweit sie nicht Befriedigung verlangen können. Dieses Recht steht den Gläubigern jedoch nur zu, wenn sie glaubhaft machen, dass durch die Ausgliederung die Erfüllung der Forderung gefährdet wird."
    },
    {
      "date": "2024-11-04",
      "id": "92384",
      "original_text": "Registerbekanntmachung nach dem Umwandlungsgesetz\nHamburg Amtsgericht Hamburg HRA 62024\nOtto (GmbH & Co KG) – Hamburg",
      "type": "Registerbekanntmachung nach dem Umwandlungsgesetz",
      "state": "Hamburg",
      "amtsgericht": "Amtsgericht Hamburg",
      "registernummer": "HRA 62024",
      "registerart": "HRA",
      "company_name": "Otto (GmbH & Co KG)",
      "company_seat": "Hamburg",
      "details": "04.11.2024 (Bekanntmachungsdatum)\n\nHamburg Amtsgericht Hamburg HRA 62024\nRegisterbekanntmachung nach dem Umwandlungsgesetz 29.10.2024 (Eintragungsdatum)\n\nOtto (GmbH & Co KG)\nKommanditgesellschaft\nHamburg\n\nAls nicht eingetragen wird bekannt gemacht:\nDen Gläubigern der an der Verschmelzung beteiligten Gesellschaften ist, wenn sie binnen sechs Monaten nach dem Tag, an dem die Eintragung der Verschmelzung in das Register des Sitzes desjenigen Rechtsträgers, dessen Gläubiger sie sind, nach § 19 Absatz 3 UmwG als bekannt gemacht gilt, ihren Anspruch nach Grund und Höhe schriftlich anmelden, Sicherheit zu leisten, soweit sie nicht Befriedigung verlangen können. Dieses Recht steht den Gläubigern jedoch nur zu, wenn sie glaubhaft machen, dass durch die Verschmelzung die Erfüllung ihrer Forderung gefährdet wird."
    },
    {
      "date": "2024-11-04",
      "id": "92385",
      "original_text": "Registerbekanntmachung nach dem Umwandlungsgesetz\nHamburg Amtsgericht Hamburg HRB 126586\nCPI2 - Carbon Performance Improvement Initiative GmbH – Hamburg",
      "type": "Registerbekanntmachung nach dem Umwandlungsgesetz",
      "state": "Hamburg",
      "amtsgericht": "Amtsgericht Hamburg",
      "registernummer": "HRB 126586",
      "registerart": "HRB",
      "company_name": "CPI2 - Carbon Performance Improvement Initiative GmbH",
      "company_seat": "Hamburg",
      "details": "04.11.2024 (Bekanntmachungsdatum)\n\nHamburg Amtsgericht Hamburg HRB 126586\nRegisterbekanntmachung nach dem Umwandlungsgesetz 29.10.2024 (Eintragungsdatum)\n\nCPI2 - Carbon Performance Improvement Initiative GmbH\nGesellschaft mit beschränkter Haftung\nHamburg\n\nAls nicht eingetragen wird bekannt gemacht:\nDen Gläubigern der an der Verschmelzung beteiligten Gesellschaften ist, wenn sie binnen sechs Monaten nach dem Tag, an dem die Eintragung der Verschmelzung in das Register des Sitzes desjenigen Rechtsträgers, dessen Gläubiger sie sind, nach § 19 Absatz 3 UmwG als bekannt gemacht gilt, ihren Anspruch nach Grund und Höhe schriftlich anmelden, Sicherheit zu leisten, soweit sie nicht Befriedigung verlangen können. Dieses Recht steht den Gläubigern jedoch nur zu, wenn sie glaubhaft machen, dass durch die Verschmelzung die Erfüllung ihrer Forderung gefährdet wird."
    },
    {
      "date": "2024-11-04",
      "id": "92386",
      "original_text": "Einreichung neuer Dokumente\nSaarland Amtsgericht Saarbrücken HRB 4261\nSaarbrücker gemeinnützige Siedlungsgesellschaft mit beschränkter Haftung – Saarbrücken",
      "type": "Einreichung neuer Dokumente",
      "state": "Saarland",
      "amtsgericht": "Amtsgericht Saarbrücken",
      "registernummer": "HRB 4261",
      "registerart": "HRB",
      "company_name": "Saarbrücker gemeinnützige Siedlungsgesellschaft mit beschränkter Haftung",
      "company_seat": "Saarbrücken",
      "details": "04.11.2024 (Bekanntmachungsdatum)\n\nSaarland Amtsgericht Saarbrücken HRB 4261\nEinreichung neuer Dokumente\n\nSaarbrücker gemeinnützige Siedlungsgesellschaft mit beschränkter Haftung\nGesellschaft mit beschränkter Haftung\nSaarbrücken\n\nDie Geschäftsführung der Gesellschaft hat eine Liste der Mitglieder des Aufsichtsrats zum Handelsregister eingereicht (§ 52 Abs. 3 Satz 2 GmbHG)."
    },
    {
      "date": "2024-11-04",
      "id": "92387",
      "original_text": "Registerbekanntmachung nach dem Umwandlungsgesetz\nMecklenburg-Vorpommern Amtsgericht Rostock HRA 4963\nArtek Massivbau Inhaber Andreas Schulz e.K. – Rostock",
      "type": "Registerbekanntmachung nach dem Umwandlungsgesetz",
      "state": "Mecklenburg-Vorpommern",
      "amtsgericht": "Amtsgericht Rostock",
      "registernummer": "HRA 4963",
      "registerart": "HRA",
      "company_name": "Artek Massivbau Inhaber Andreas Schulz e.K.",
      "company_seat": "Rostock",
      "details": "04.11.2024 (Bekanntmachungsdatum)\n\nMecklenburg-Vorpommern Amtsgericht Rostock HRA 4963\nRegisterbekanntmachung nach dem Umwandlungsgesetz 04.11.2024 (Eintragungsdatum)\n\nArtek Massivbau Inhaber Andreas Schulz e.K.\nEinzelkaufmann / Einzelkauffrau\nRostock\n\nDen Gläubigern der an der Ausgliederung beteiligten Rechtsträger ist, wenn sie binnen sechs Monaten nach dem Tag, an dem die Eintragung der Ausgliederung in das Register des Sitzes desjenigen Rechtsträgers, dessen Gläubiger sie sind, nach § 19 Abs. 3 UmwG als bekannt gemacht gilt, ihren Anspruch nach Grund und Höhe schriftlich anmelden, Sicherheit zu leisten, soweit sie nicht Befriedigung verlangen können. Dieses Recht steht den Gläubigern jedoch nur zu, wenn sie glaubhaft machen, dass durch die Ausgliederung die Erfüllung der Forderung gefährdet wird."
    },
    {
      "date": "2024-11-04",
      "id": "92388",
      "original_text": "Einreichung neuer Dokumente\nSaarland Amtsgericht Saarbrücken HRB 64406\nMerziger Verwaltungsgesellschaft für Wohnungswirtschaft mbH – Merzig",
      "type": "Einreichung neuer Dokumente",
      "state": "Saarland",
      "amtsgericht": "Amtsgericht Saarbrücken",
      "registernummer": "HRB 64406",
      "registerart": "HRB",
      "company_name": "Merziger Verwaltungsgesellschaft für Wohnungswirtschaft mbH",
      "company_seat": "Merzig",
      "details": "04.11.2024 (Bekanntmachungsdatum)\n\nSaarland Amtsgericht Saarbrücken HRB 64406\nEinreichung neuer Dokumente\n\nMerziger Verwaltungsgesellschaft für Wohnungswirtschaft mbH\nGesellschaft mit beschränkter Haftung\nMerzig\n\nDie Geschäftsführung der Gesellschaft hat eine Liste der Mitglieder des Aufsichtsrats zum Handelsregister eingereicht (§ 52 Abs. 3 Satz 2 GmbHG)."
    },
    {
      "date": "2024-11-04",
      "id": "92389",
      "original_text": "Registerbekanntmachung nach dem Umwandlungsgesetz\nBaden-Württemberg Amtsgericht Ulm GnR 610001\nVolksbank Allgäu-Oberschwaben eG – Leutkirch im Allgäu",
      "type": "Registerbekanntmachung nach dem Umwandlungsgesetz",
      "state": "Baden-Württemberg",
      "amtsgericht": "Amtsgericht Ulm",
      "registernummer": "GnR 610001",
      "registerart": "GnR",
      "company_name": "Volksbank Allgäu-Oberschwaben eG",
      "company_seat": "Leutkirch im Allgäu",
      "details": "04.11.2024 (Bekanntmachungsdatum)\n\nBaden-Württemberg Amtsgericht Ulm GnR 610001\nRegisterbekanntmachung nach dem Umwandlungsgesetz 04.11.2024 (Eintragungsdatum)\n\nVolksbank Allgäu-Oberschwaben eG\neingetragene Genossenschaft\nLeutkirch im Allgäu\n\nAls nicht eingetragen wird bekanntgemacht:\nDen Gläubigern der an der Verschmelzung beteiligten Rechtsträger ist, wenn sie binnen sechs Monaten nach dem Tag, an dem die Eintragung der Verschmelzung in das Register des Sitzes desjenigen Rechtsträgers, dessen Gläubiger sie sind, nach § 19 Abs. 3 UmwG als bekanntgemacht gilt, ihren Anspruch nach Grund und Höhe schriftlich anmelden, Sicherheit zu leisten, soweit sie nicht Befriedigung verlangen können. Dieses Recht steht den Gläubigern jedoch nur zu, wenn sie glaubhaft machen, dass durch die Verschmelzung die Erfüllung ihrer Forderung gefährdet wird."
    },
    {
      "date": "2024-11-04",
      "id": "92390",
      "original_text": "Registerbekanntmachung nach dem Umwandlungsgesetz\nHamburg Amtsgericht Hamburg HRB 105082\nARTHUR Holding GmbH – Hamburg",
      "type": "Registerbekanntmachung nach dem Umwandlungsgesetz",
      "state": "Hamburg",
      "amtsgericht": "Amtsgericht Hamburg",
      "registernummer": "HRB 105082",
      "registerart": "HRB",
      "company_name": "ARTHUR Holding GmbH",
      "company_seat": "Hamburg",
      "details": "04.11.2024 (Bekanntmachungsdatum)\n\nHamburg Amtsgericht Hamburg HRB 105082\nRegisterbekanntmachung nach dem Umwandlungsgesetz 29.10.2024 (Eintragungsdatum)\n\nARTHUR Holding GmbH\nGesellschaft mit beschränkter Haftung\nHamburg\n\nAls nicht eingetragen wird bekannt gemacht:\nDen Gläubigern der an der Verschmelzung beteiligten Gesellschaften ist, wenn sie binnen sechs Monaten nach dem Tag, an dem die Eintragung der Verschmelzung in das Register des Sitzes desjenigen Rechtsträgers, dessen Gläubiger sie sind, nach § 19 Absatz 3 UmwG als bekannt gemacht gilt, ihren Anspruch nach Grund und Höhe schriftlich anmelden, Sicherheit zu leisten, soweit sie nicht Befriedigung verlangen können. Dieses Recht steht den Gläubigern jedoch nur zu, wenn sie glaubhaft machen, dass durch die Verschmelzung die Erfüllung ihrer Forderung gefährdet wird."
    },
    {
      "date": "2024-11-04",
      "id": "92391",
      "original_text": "Registerbekanntmachung nach dem Umwandlungsgesetz\nSchleswig-Holstein Amtsgericht Kiel HRB 18189\nOS Geschäftsführungsgesellschaft mbH – Neumünster",
      "type": "Registerbekanntmachung nach dem Umwandlungsgesetz",
      "state": "Schleswig-Holstein",
      "amtsgericht": "Amtsgericht Kiel",
      "registernummer": "HRB 18189",
      "registerart": "HRB",
      "company_name": "OS Geschäftsführungsgesellschaft mbH",
      "company_seat": "Neumünster",
      "details": "04.11.2024 (Bekanntmachungsdatum)\n\nSchleswig-Holstein Amtsgericht Kiel HRB 18189\nRegisterbekanntmachung nach dem Umwandlungsgesetz 01.11.2024 (Eintragungsdatum)\n\nOS Geschäftsführungsgesellschaft mbH\nGesellschaft mit beschränkter Haftung\nNeumünster\n\nZu Eintragungsnummer 3 vom 01.11.2024 wird als nicht eingetragen veröffentlicht: Den Gläubigern der an der Verschmelzung beteiligten Rechtsträger ist, wenn sie binnen sechs Monaten nach dem Tag, an dem die Eintragung der Verschmelzung in das Register des Sitzes desjenigen Rechtsträgers, dessen Gläubiger sie sind, nach § 19 Abs. 3 UmwG bekannt gemacht worden ist, ihren Anspruch nach Grund und Höhe schriftlich anmelden, Sicherheit zu leisten, soweit sie nicht Befriedigung verlangen können. Dieses Recht steht den Gläubigern jedoch nur zu, wenn sie glaubhaft machen, dass durch die Verschmelzung die Erfüllung ihrer Forderung gefährdet wird."
    },
    {
      "date": "2024-11-04",
      "id": "92392",
      "original_text": "Löschungsankündigung\nSachsen-Anhalt Amtsgericht Stendal HRB 22197\nLowakk Technische Handels-GmbH – Halle (Saale)",
      "type": "Löschungsankündigung",
      "state": "Sachsen-Anhalt",
      "amtsgericht": "Amtsgericht Stendal",
      "registernummer": "HRB 22197",
      "registerart": "HRB",
      "company_name": "Lowakk Technische Handels-GmbH",
      "company_seat": "Halle (Saale)",
      "details": "04.11.2024 (Bekanntmachungsdatum)\n\nSachsen-Anhalt Amtsgericht Stendal HRB 22197\nLöschungsankündigung\n\nLowakk Technische Handels-GmbH\nGesellschaft mit beschränkter Haftung\nHalle (Saale)\n\nDas Registergericht beabsichtigt, nachfolgende im Handelregister eingetragenen Firmen von Amts wegen nach § 394 FamFG zu löschen. Die Frist zu Erhebung eines Widerspruchs wird auf drei Monate festgesetzt."
    },
    {
      "date": "2024-11-04",
      "id": "92393",
      "original_text": "Sonstige Registerbekanntmachung\nBerlin Amtsgericht Berlin (Charlottenburg) HRB 246075\nEuropace Ratenkredit GmbH – Berlin",
      "type": "Sonstige Registerbekanntmachung",
      "state": "Berlin",
      "amtsgericht": "Amtsgericht Berlin (Charlottenburg)",
      "registernummer": "HRB 246075",
      "registerart": "HRB",
      "company_name": "Europace Ratenkredit GmbH",
      "company_seat": "Berlin",
      "details": "04.11.2024 (Bekanntmachungsdatum)\n\nBerlin Amtsgericht Berlin (Charlottenburg) HRB 246075\nSonstige Registerbekanntmachung\n\nEuropace Ratenkredit GmbH\nGesellschaft mit beschränkter Haftung\nBerlin\n\nAls nicht eingetragen wird veröffentlicht: Den Gläubigern der an der Spaltung beteiligten Rechtsträger ist, wenn sie binnen sechs Monaten nach dem Tag, an dem die Eintragung der Spaltung in das Register des Sitzes desjenigen Rechtsträgers, dessen Gläubiger sie sind, als bekannt gemacht gilt, ihren Anspruch nach Grund und Höhe schriftlich anmelden, Sicherheit zu leisten, soweit sie nicht Befriedigung verlangen können. Dieses Recht steht den Gläubigern jedoch nur zu, wenn sie glaubhaft machen, dass durch die Spaltung die Erfüllung ihrer Forderung gefährdet wird. Das Recht, Sicherheitsleistung zu verlangen, steht Gläubigern nicht zu, die im Falle der Insolvenz ein Recht auf vorzugsweise Befriedigung aus einer Deckungsmasse haben, die nach gesetzlicher Vorschrift zu ihrem Schutz errichtet und staatlich überwacht ist."
    },
    {
      "date": "2024-11-04",
      "id": "92394",
      "original_text": "Einreichung neuer Dokumente\nHamburg Amtsgericht Hamburg HRB 139449\nHolcim (Deutschland) GmbH – Hamburg",
      "type": "Einreichung neuer Dokumente",
      "state": "Hamburg",
      "amtsgericht": "Amtsgericht Hamburg",
      "registernummer": "HRB 139449",
      "registerart": "HRB",
      "company_name": "Holcim (Deutschland) GmbH",
      "company_seat": "Hamburg",
      "details": "04.11.2024 (Bekanntmachungsdatum)\n\nHamburg Amtsgericht Hamburg HRB 139449\nEinreichung neuer Dokumente\n\nHolcim (Deutschland) GmbH\nGesellschaft mit beschränkter Haftung\nHamburg\n\nAls nicht eingetragen wird bekannt gemacht: Liste des Aufsichtsrats wurde eingereicht."
    },
    {
      "date": "2024-11-04",
      "id": "92395",
      "original_text": "Sonstige Registerbekanntmachung\nBerlin Amtsgericht Berlin (Charlottenburg) HRB 136078\nEuropace AG – Berlin",
      "type": "Sonstige Registerbekanntmachung",
      "state": "Berlin",
      "amtsgericht": "Amtsgericht Berlin (Charlottenburg)",
      "registernummer": "HRB 136078",
      "registerart": "HRB",
      "company_name": "Europace AG",
      "company_seat": "Berlin",
      "details": "04.11.2024 (Bekanntmachungsdatum)\n\nBerlin Amtsgericht Berlin (Charlottenburg) HRB 136078\nSonstige Registerbekanntmachung\n\nEuropace AG\nAktiengesellschaft\nBerlin\n\nAls nicht eingetragen wird veröffentlicht: Den Gläubigern der an der Spaltung beteiligten Rechtsträger ist, wenn sie binnen sechs Monaten nach dem Tag, an dem die Eintragung der Spaltung in das Register des Sitzes desjenigen Rechtsträgers, dessen Gläubiger sie sind, als bekannt gemacht gilt, ihren Anspruch nach Grund und Höhe schriftlich anmelden, Sicherheit zu leisten, soweit sie nicht Befriedigung verlangen können. Dieses Recht steht den Gläubigern jedoch nur zu, wenn sie glaubhaft machen, dass durch die Spaltung die Erfüllung ihrer Forderung gefährdet wird. Das Recht, Sicherheitsleistung zu verlangen, steht Gläubigern nicht zu, die im Falle der Insolvenz ein Recht auf vorzugsweise Befriedigung aus einer Deckungsmasse haben, die nach gesetzlicher Vorschrift zu ihrem Schutz errichtet und staatlich überwacht ist."
    },
    {
      "date": "2024-11-04",
      "id": "92396",
      "original_text": "Registerbekanntmachung nach dem Umwandlungsgesetz\nBaden-Württemberg Amtsgericht Mannheim HRB 752514\nBeck Verwaltungs-GmbH – Ölbronn-Dürrn",
      "type": "Registerbekanntmachung nach dem Umwandlungsgesetz",
      "state": "Baden-Württemberg",
      "amtsgericht": "Amtsgericht Mannheim",
      "registernummer": "HRB 752514",
      "registerart": "HRB",
      "company_name": "Beck Verwaltungs-GmbH",
      "company_seat": "Ölbronn-Dürrn",
      "details": "04.11.2024 (Bekanntmachungsdatum)\n\nBaden-Württemberg Amtsgericht Mannheim HRB 752514\nRegisterbekanntmachung nach dem Umwandlungsgesetz 04.11.2024 (Eintragungsdatum)\n\nBeck Verwaltungs-GmbH\nGesellschaft mit beschränkter Haftung\nÖlbronn-Dürrn\n\nDen Gläubigern des an dem Formwechsel beteiligten Rechtsträgers ist, wenn sie binnen sechs Monaten nach dem Tag, an dem die Eintragung des Formwechsels in das Register des Sitzes desjenigen Rechtsträgers, dessen Gläubiger sie sind, nach § 19 Abs. 3 UmwG als bekanntgemacht gilt, ihren Anspruch nach Grund und Höhe schriftlich anmelden, Sicherheit zu leisten, soweit sie nicht Befriedigung verlangen können. Dieses Recht steht den Gläubigern jedoch nur zu, wenn sie glaubhaft machen, dass durch den Formwechsel die Erfüllung ihrer Forderung gefährdet wird."
    },
    {
      "date": "2024-11-04",
      "id": "92397",
      "original_text": "Registerbekanntmachung nach dem Umwandlungsgesetz\nBaden-Württemberg Amtsgericht Mannheim HRB 735298\nRosch Finanzmanagement GmbH – Kämpfelbach",
      "type": "Registerbekanntmachung nach dem Umwandlungsgesetz",
      "state": "Baden-Württemberg",
      "amtsgericht": "Amtsgericht Mannheim",
      "registernummer": "HRB 735298",
      "registerart": "HRB",
      "company_name": "Rosch Finanzmanagement GmbH",
      "company_seat": "Kämpfelbach",
      "details": "04.11.2024 (Bekanntmachungsdatum)\n\nBaden-Württemberg Amtsgericht Mannheim HRB 735298\nRegisterbekanntmachung nach dem Umwandlungsgesetz 04.11.2024 (Eintragungsdatum)\n\nRosch Finanzmanagement GmbH\nGesellschaft mit beschränkter Haftung\nKämpfelbach\n\nAls nicht eingetragen wird bekanntgemacht:\nDen Gläubigern der an der Verschmelzung beteiligten Rechtsträger ist, wenn sie binnen sechs Monaten nach dem Tag, an dem die Eintragung der Verschmelzung in das Register des Sitzes desjenigen Rechtsträgers, dessen Gläubiger sie sind, nach § 19 Abs. 3 UmwG als bekanntgemacht gilt, ihren Anspruch nach Grund und Höhe schriftlich anmelden, Sicherheit zu leisten, soweit sie nicht Befriedigung verlangen können. Dieses Recht steht den Gläubigern jedoch nur zu, wenn sie glaubhaft machen, dass durch die Verschmelzung die Erfüllung ihrer Forderung gefährdet wird."
    },
    {
      "date": "2024-11-04",
      "id": "92398",
      "original_text": "Einreichung neuer Dokumente\nHamburg Amtsgericht Hamburg HRB 163774\nHOOU GmbH – Hamburg",
      "type": "Einreichung neuer Dokumente",
      "state": "Hamburg",
      "amtsgericht": "Amtsgericht Hamburg",
      "registernummer": "HRB 163774",
      "registerart": "HRB",
      "company_name": "HOOU GmbH",
      "company_seat": "Hamburg",
      "details": "04.11.2024 (Bekanntmachungsdatum)\n\nHamburg Amtsgericht Hamburg HRB 163774\nEinreichung neuer Dokumente\n\nHOOU GmbH\nGesellschaft mit beschränkter Haftung\nHamburg\n\nAls nicht eingetragen wird bekannt gemacht: Liste des Aufsichtsrats wurde eingereicht."
    },
    {
      "date": "2024-11-04",
      "id": "92399",
      "original_text": "Registerbekanntmachung nach dem Umwandlungsgesetz\nBaden-Württemberg Amtsgericht Mannheim HRB 735882\nPecunia GmbH – Kämpfelbach",
      "type": "Registerbekanntmachung nach dem Umwandlungsgesetz",
      "state": "Baden-Württemberg",
      "amtsgericht": "Amtsgericht Mannheim",
      "registernummer": "HRB 735882",
      "registerart": "HRB",
      "company_name": "Pecunia GmbH",
      "company_seat": "Kämpfelbach",
      "details": "04.11.2024 (Bekanntmachungsdatum)\n\nBaden-Württemberg Amtsgericht Mannheim HRB 735882\nRegisterbekanntmachung nach dem Umwandlungsgesetz 04.11.2024 (Eintragungsdatum)\n\nPecunia GmbH\nGesellschaft mit beschränkter Haftung\nKämpfelbach\n\nDen Gläubigern der an der Verschmelzung beteiligten Rechtsträger ist, wenn sie binnen sechs Monaten nach dem Tag, an dem die Eintragung der Verschmelzung in das Register des Sitzes desjenigen Rechtsträgers, dessen Gläubiger sie sind, nach § 19 Abs. 3 UmwG als bekanntgemacht gilt, ihren Anspruch nach Grund und Höhe schriftlich anmelden, Sicherheit zu leisten, soweit sie nicht Befriedigung verlangen können. Dieses Recht steht den Gläubigern jedoch nur zu, wenn sie glaubhaft machen, dass durch die Verschmelzung die Erfüllung ihrer Forderung gefährdet wird."
    },
    {
      "date": "2024-11-04",
      "id": "92400",
      "original_text": "Registerbekanntmachung nach dem Umwandlungsgesetz\nBaden-Württemberg Amtsgericht Mannheim HRA 701297\nBeck Verwaltungs-GmbH & Co. KG – Ölbronn-Dürrn",
      "type": "Registerbekanntmachung nach dem Umwandlungsgesetz",
      "state": "Baden-Württemberg",
      "amtsgericht": "Amtsgericht Mannheim",
      "registernummer": "HRA 701297",
      "registerart": "HRA",
      "company_name": "Beck Verwaltungs-GmbH & Co. KG",
      "company_seat": "Ölbronn-Dürrn",
      "details": "04.11.2024 (Bekanntmachungsdatum)\n\nBaden-Württemberg Amtsgericht Mannheim HRA 701297\nRegisterbekanntmachung nach dem Umwandlungsgesetz 04.11.2024 (Eintragungsdatum)\n\nBeck Verwaltungs-GmbH & Co. KG\nKommanditgesellschaft\nÖlbronn-Dürrn\n\nDen Gläubigern des an dem Formwechsel beteiligten Rechtsträgers ist, wenn sie binnen sechs Monaten nach dem Tag, an dem die Eintragung des Formwechsels in das Register des Sitzes desjenigen Rechtsträgers, dessen Gläubiger sie sind, nach § 19 Abs. 3 UmwG als bekanntgemacht gilt, ihren Anspruch nach Grund und Höhe schriftlich anmelden, Sicherheit zu leisten, soweit sie nicht Befriedigung verlangen können. Dieses Recht steht den Gläubigern jedoch nur zu, wenn sie glaubhaft machen, dass durch den Formwechsel die Erfüllung ihrer Forderung gefährdet wird."
    },
    {
      "date": "2024-11-04",
      "id": "92401",
      "original_text": "Registerbekanntmachung nach dem Umwandlungsgesetz\nBerlin Amtsgericht Berlin (Charlottenburg) HRB 76222\nebuero Aktiengesellschaft – Berlin",
      "type": "Registerbekanntmachung nach dem Umwandlungsgesetz",
      "state": "Berlin",
      "amtsgericht": "Amtsgericht Berlin (Charlottenburg)",
      "registernummer": "HRB 76222",
      "registerart": "HRB",
      "company_name": "ebuero Aktiengesellschaft",
      "company_seat": "Berlin",
      "details": "04.11.2024 (Bekanntmachungsdatum)\n\nBerlin Amtsgericht Berlin (Charlottenburg) HRB 76222\nRegisterbekanntmachung nach dem Umwandlungsgesetz 29.10.2024 (Eintragungsdatum)\n\nebuero Aktiengesellschaft\nAktiengesellschaft\nBerlin\n\nZu Eintragungsnummer 26 vom 29.10.2024 wird als nicht eingetragen veröffentlicht:Den Gläubigern der an der Verschmelzung beteiligten Rechtsträger ist, wenn sie binnen sechs Monaten nach dem Tag, an dem die Eintragung der Verschmelzung in das Register des Sitzes desjenigen Rechtsträgers, dessen Gläubiger sie sind, als bekannt gemacht gilt, ihren Anspruch nach Grund und Höhe schriftlich anmelden, Sicherheit zu leisten, soweit sie nicht Befriedigung verlangen können. Dieses Recht steht den Gläubigern jedoch nur zu, wenn sie glaubhaft machen, dass durch die Verschmelzung die Erfüllung ihrer Forderung gefährdet wird. Das Recht, Sicherheitsleistung zu verlangen, steht Gläubigern nicht zu, die im Falle der Insolvenz ein Recht auf vorzugsweise Befriedigung aus einer Deckungsmasse haben, die nach gesetzlicher Vorschrift zu ihrem Schutz errichtet und staatlich überwacht ist."
    },
    {
      "date": "2024-11-04",
      "id": "92402",
      "original_text": "Sonstige Registerbekanntmachung\nBerlin Amtsgericht Berlin (Charlottenburg) HRB 92036\nFiNUM.Private Finance AG – Berlin",
      "type": "Sonstige Registerbekanntmachung",
      "state": "Berlin",
      "amtsgericht": "Amtsgericht Berlin (Charlottenburg)",
      "registernummer": "HRB 92036",
      "registerart": "HRB",
      "company_name": "FiNUM.Private Finance AG",
      "company_seat": "Berlin",
      "details": "04.11.2024 (Bekanntmachungsdatum)\n\nBerlin Amtsgericht Berlin (Charlottenburg) HRB 92036\nSonstige Registerbekanntmachung\n\nFiNUM.Private Finance AG\nAktiengesellschaft\nBerlin\n\nAls nicht eingetragen wird veröffentlicht:\n\n1. Die Gesellschaft hat einen Verschmelzungsplan zum Handelsregister des Amtsgerichts Charlottenburg eingereicht.\n2. An der grenzüberschreitenden Verschmelzung sind die folgenden Gesellschaften beteiligt: a. Die TopTen Wertpapier GmbH mit Sitz in Wien, Österreich, ist eine österreichische Gesellschaft mit beschränkter Haftung und als übertragender Rechtsträger beteiligt.\nb. Die FiNUM.Private Finance AG mit dem Sitz in Berlin, Deutschland, ist eine deutsche Aktiengesellschaft und als übernehmender Rechtsträger beteiligt.\n3. Die beteiligten Rechtsträger sind wie folgt in Registern eingetragen: a. Die TopTen Wertpapier GmbH ist im österreichischen Firmenbuch des Handelsregisters Wien unter FN 259478 k eingetragen.\nb. Die FiNUM.Private Finance AG ist im Handelsregister des Amtsgerichts Charlottenburg unter HRB 92036 B eingetragen.\n4. Hinweis auf die Modalitäten zur Stellungnahme: Anteilsinhaber und Gläubiger der FiNUM.Private Finance AG und der TopTen Wertpapier GmbH sowie - da es weder bei der FiNUM.Private Finance AG noch bei der TopTen Wertpapier GmbH einen Betriebsrat gibt - deren Arbeitnehmer können bis spätestens fünf Arbeitstage vor dem 16. Dezember 2024 (Tag der Beurkundung des Verschmelzungsplans sowie Tag der Hauptversammlung der übernehmenden Gesellschaft) Bemerkungen zum Verschmelzungsplan übermitteln entweder an die TopTen Wertpapier GmbH, Krugerstraße 13 / 4. OG, 1010 Wien / Österreich oder die FiNUM.Private Finance AG, Kurfürstendamm 201, 10719 Berlin / Deutschland."
    },
    {
      "date": "2024-11-04",
      "id": "92403",
      "original_text": "Löschungsankündigung\nBerlin Amtsgericht Berlin (Charlottenburg) HRB 112535\nDie Zwei Services & Consulting GmbH – Berlin",
      "type": "Löschungsankündigung",
      "state": "Berlin",
      "amtsgericht": "Amtsgericht Berlin (Charlottenburg)",
      "registernummer": "HRB 112535",
      "registerart": "HRB",
      "company_name": "Die Zwei Services & Consulting GmbH",
      "company_seat": "Berlin",
      "details": "04.11.2024 (Bekanntmachungsdatum)\n\nBerlin Amtsgericht Berlin (Charlottenburg) HRB 112535\nLöschungsankündigung\n\nDie Zwei Services & Consulting GmbH\nGesellschaft mit beschränkter Haftung\nBerlin\n\nBei der nachstehenden Gesellschaft wird das Amtslöschungsverfahren gemäß § 394 FamFG eingeleitet. Widerspruchsfrist 6 Wochen"
    },
    {
      "date": "2024-11-04",
      "id": "92404",
      "original_text": "Löschungsankündigung\nBaden-Württemberg Amtsgericht Mannheim HRB 719359\nATX Oil & Gas Fonds Management GmbH – Pforzheim",
      "type": "Löschungsankündigung",
      "state": "Baden-Württemberg",
      "amtsgericht": "Amtsgericht Mannheim",
      "registernummer": "HRB 719359",
      "registerart": "HRB",
      "company_name": "ATX Oil & Gas Fonds Management GmbH",
      "company_seat": "Pforzheim",
      "details": "04.11.2024 (Bekanntmachungsdatum)\n\nBaden-Württemberg Amtsgericht Mannheim HRB 719359\nLöschungsankündigung\n\nATX Oil & Gas Fonds Management GmbH\nGesellschaft mit beschränkter Haftung\nPforzheim\n\nDas Gericht beabsichtigt, die Gesellschaft wegen Vermögenslosigkeit im Handelsregister von Amts wegen nach § 394 FamFG zu löschen. Die Frist zur Geltendmachung eines Widerspruchs gegen die beabsichtigte Löschung ist auf einen Monat ab Veröffentlichung bestimmt."
    },
    {
      "date": "2024-11-04",
      "id": "92405",
      "original_text": "Löschungsankündigung\nBerlin Amtsgericht Berlin (Charlottenburg) HRB 199613\nSimon & Co. Baubetreuung UG (haftungsbeschränkt) – Berlin",
      "type": "Löschungsankündigung",
      "state": "Berlin",
      "amtsgericht": "Amtsgericht Berlin (Charlottenburg)",
      "registernummer": "HRB 199613",
      "registerart": "HRB",
      "company_name": "Simon & Co. Baubetreuung UG (haftungsbeschränkt)",
      "company_seat": "Berlin",
      "details": "04.11.2024 (Bekanntmachungsdatum)\n\nBerlin Amtsgericht Berlin (Charlottenburg) HRB 199613\nLöschungsankündigung\n\nSimon & Co. Baubetreuung UG (haftungsbeschränkt)\nGesellschaft mit beschränkter Haftung\nBerlin\n\nEs ist beabsichtigt, die Eintragung des Geschäftsführers Simon Janicina wegen Mangels einer wesentlichen Voraussetzung gemäß § 395 FamFG von Amts wegen zu löschen. Widerspruchsfrist: 6 Wochen"
    },
    {
      "date": "2024-11-04",
      "id": "92406",
      "original_text": "Löschungsankündigung\nBerlin Amtsgericht Berlin (Charlottenburg) HRA 52388\nArBau Bau-und Handelsgesellschaft mbH & Co.KG – Berlin",
      "type": "Löschungsankündigung",
      "state": "Berlin",
      "amtsgericht": "Amtsgericht Berlin (Charlottenburg)",
      "registernummer": "HRA 52388",
      "registerart": "HRA",
      "company_name": "ArBau Bau-und Handelsgesellschaft mbH & Co.KG",
      "company_seat": "Berlin",
      "details": "04.11.2024 (Bekanntmachungsdatum)\n\nBerlin Amtsgericht Berlin (Charlottenburg) HRA 52388\nLöschungsankündigung\n\nArBau Bau-und Handelsgesellschaft mbH & Co.KG\nKommanditgesellschaft\nBerlin\n\nBei dem nachstehenden Unternehmen / der nachstehenden Gesellschaft wird das Amtslöschungsverfahren gemäß § 31 Abs. 2 HGB eingeleitet. Widerspruchsfrist 2 Monate"
    },
    {
      "date": "2024-11-04",
      "id": "92407",
      "original_text": "Registerbekanntmachung nach dem Umwandlungsgesetz\nMecklenburg-Vorpommern Amtsgericht Schwerin HRA 3529\nLandwirtschaftsbetrieb Babbe GmbH & Co. KG – Königsfeld OT Bülow",
      "type": "Registerbekanntmachung nach dem Umwandlungsgesetz",
      "state": "Mecklenburg-Vorpommern",
      "amtsgericht": "Amtsgericht Schwerin",
      "registernummer": "HRA 3529",
      "registerart": "HRA",
      "company_name": "Landwirtschaftsbetrieb Babbe GmbH & Co. KG",
      "company_seat": "Königsfeld OT Bülow",
      "details": "04.11.2024 (Bekanntmachungsdatum)\n\nMecklenburg-Vorpommern Amtsgericht Schwerin HRA 3529\nRegisterbekanntmachung nach dem Umwandlungsgesetz 04.11.2024 (Eintragungsdatum)\n\nLandwirtschaftsbetrieb Babbe GmbH & Co. KG\nKommanditgesellschaft\nKönigsfeld OT Bülow\n\nAls nicht eingetragen wird veröffentlicht: Den Gläubigern der an der Ausgliederung beteiligten Rechtsträger ist, wenn sie binnen sechs Monaten nach dem Tag, an dem die Eintragung der Ausgliederung in das Register des Sitzes desjenigen Rechtsträgers, dessen Gläubiger sie sind, nach § 19 Abs. 3 UmwG als bekannt gemacht gilt, ihren Anspruch nach Grund und Höhe schriftlich anmelden,\nSicherheit zu leisten, soweit sie nicht Befriedigung verlangen können. Dieses Recht steht den Gläubigern jedoch nur zu, wenn sie glaubhaft machen, dass durch die Ausgliederung die Erfüllung der Forderung gefährdet wird."
    },
    {
      "date": "2024-11-04",
      "id": "92408",
      "original_text": "Registerbekanntmachung nach dem Umwandlungsgesetz\nMecklenburg-Vorpommern Amtsgericht Schwerin HRA 3341\nBabbe GmbH & Co. KG – Bülow",
      "type": "Registerbekanntmachung nach dem Umwandlungsgesetz",
      "state": "Mecklenburg-Vorpommern",
      "amtsgericht": "Amtsgericht Schwerin",
      "registernummer": "HRA 3341",
      "registerart": "HRA",
      "company_name": "Babbe GmbH & Co. KG",
      "company_seat": "Bülow",
      "details": "04.11.2024 (Bekanntmachungsdatum)\n\nMecklenburg-Vorpommern Amtsgericht Schwerin HRA 3341\nRegisterbekanntmachung nach dem Umwandlungsgesetz 04.11.2024 (Eintragungsdatum)\n\nBabbe GmbH & Co. KG\nKommanditgesellschaft\nBülow\n\nAls nicht eingetragen wird veröffentlicht: Den Gläubigern der an der Ausgliederung beteiligten Rechtsträger ist, wenn sie binnen sechs Monaten nach dem Tag, an dem die Eintragung der Ausgliederung in das Register des Sitzes desjenigen Rechtsträgers, dessen Gläubiger sie sind, nach § 19 Abs. 3 UmwG als bekannt gemacht gilt, ihren Anspruch nach Grund und Höhe schriftlich anmelden,\nSicherheit zu leisten, soweit sie nicht Befriedigung verlangen können. Dieses Recht steht den Gläubigern jedoch nur zu, wenn sie glaubhaft machen, dass durch die Ausgliederung die Erfüllung der Forderung gefährdet wird."
    },
    {
      "date": "2024-11-04",
      "id": "92409",
      "original_text": "Löschungsankündigung\nBerlin Amtsgericht Berlin (Charlottenburg) HRB 186257\nBT Tieu UG (haftungsbeschränkt) – Berlin",
      "type": "Löschungsankündigung",
      "state": "Berlin",
      "amtsgericht": "Amtsgericht Berlin (Charlottenburg)",
      "registernummer": "HRB 186257",
      "registerart": "HRB",
      "company_name": "BT Tieu UG (haftungsbeschränkt)",
      "company_seat": "Berlin",
      "details": "04.11.2024 (Bekanntmachungsdatum)\n\nBerlin Amtsgericht Berlin (Charlottenburg) HRB 186257\nLöschungsankündigung\n\nBT Tieu UG (haftungsbeschränkt)\nGesellschaft mit beschränkter Haftung\nBerlin\n\nBei der nachstehenden Gesellschaft wird das Amtslöschungsverfahren gemäß § 394 FamFG eingeleitet. Widerspruchsfrist 6 Wochen"
    },
    {
      "date": "2024-11-04",
      "id": "92410",
      "original_text": "Löschungsankündigung\nMecklenburg-Vorpommern Amtsgericht Stralsund HRB 7350\nU.E. Management & Consulting GmbH – Samtens",
      "type": "Löschungsankündigung",
      "state": "Mecklenburg-Vorpommern",
      "amtsgericht": "Amtsgericht Stralsund",
      "registernummer": "HRB 7350",
      "registerart": "HRB",
      "company_name": "U.E. Management & Consulting GmbH",
      "company_seat": "Samtens",
      "details": "04.11.2024 (Bekanntmachungsdatum)\n\nMecklenburg-Vorpommern Amtsgericht Stralsund HRB 7350\nLöschungsankündigung\n\nU.E. Management & Consulting GmbH\nGesellschaft mit beschränkter Haftung\nSamtens\n\nDas Registergericht beabsichtigt, die im Handelsregister eingetragene Gesellschaft von Amts wegen nach § 394 FamFG zu löschen. Die Frist zur Erhebung eines Widerspruchs gegen die beabsichtigte Löschung wird auf ein Monat festgesetzt."
    },
    {
      "date": "2024-11-04",
      "id": "92411",
      "original_text": "Löschungsankündigung\nMecklenburg-Vorpommern Amtsgericht Stralsund HRB 20070\nWaterkanthus GmbH – Pruchten",
      "type": "Löschungsankündigung",
      "state": "Mecklenburg-Vorpommern",
      "amtsgericht": "Amtsgericht Stralsund",
      "registernummer": "HRB 20070",
      "registerart": "HRB",
      "company_name": "Waterkanthus GmbH",
      "company_seat": "Pruchten",
      "details": "04.11.2024 (Bekanntmachungsdatum)\n\nMecklenburg-Vorpommern Amtsgericht Stralsund HRB 20070\nLöschungsankündigung\n\nWaterkanthus GmbH\nGesellschaft mit beschränkter Haftung\nPruchten\n\nDas Registergericht beabsichtigt, die im Handelsregister eingetragene Gesellschaft von Amts wegen nach § 394 FamFG zu löschen. Die Frist zur Erhebung eines Widerspruchs gegen die beabsichtigte Löschung wird auf ein Monat festgesetzt."
    },
    {
      "date": "2024-11-04",
      "id": "92412",
      "original_text": "Registerbekanntmachung nach dem Umwandlungsgesetz\nSchleswig-Holstein Amtsgericht Lübeck HRB 24687\nMT International GmbH – Wesenberg",
      "type": "Registerbekanntmachung nach dem Umwandlungsgesetz",
      "state": "Schleswig-Holstein",
      "amtsgericht": "Amtsgericht Lübeck",
      "registernummer": "HRB 24687",
      "registerart": "HRB",
      "company_name": "MT International GmbH",
      "company_seat": "Wesenberg",
      "details": "04.11.2024 (Bekanntmachungsdatum)\n\nSchleswig-Holstein Amtsgericht Lübeck HRB 24687\nRegisterbekanntmachung nach dem Umwandlungsgesetz 04.11.2024 (Eintragungsdatum)\n\nMT International GmbH\nGesellschaft mit beschränkter Haftung\nWesenberg\n\nZu Eintragungsnummer 2 vom 04.11.2024 wird als nicht eingetragen veröffentlicht: Den Gläubigern der an der Spaltung beteiligten Rechtsträger ist, wenn sie binnen sechs Monaten nach dem Tag, an dem die Eintragung der Spaltung in das Register des Sitzes desjenigen Rechtsträgers, dessen Gläubiger sie sind, als bekannt gemacht gilt, ihren Anspruch nach Grund und Höhe schriftlich anmelden, Sicherheit zu leisten, soweit sie nicht Befriedigung verlangen können. Dieses Recht steht den Gläubigern jedoch nur zu, wenn sie glaubhaft machen, dass durch die Spaltung die Erfüllung ihrer Forderung gefährdet wird."
    },
    {
      "date": "2024-11-04",
      "id": "92413",
      "original_text": "Registerbekanntmachung nach dem Umwandlungsgesetz\nNordrhein-Westfalen Amtsgericht Coesfeld HRB 20505\ndigitalpush GmbH – Havixbeck",
      "type": "Registerbekanntmachung nach dem Umwandlungsgesetz",
      "state": "Nordrhein-Westfalen",
      "amtsgericht": "Amtsgericht Coesfeld",
      "registernummer": "HRB 20505",
      "registerart": "HRB",
      "company_name": "digitalpush GmbH",
      "company_seat": "Havixbeck",
      "details": "04.11.2024 (Bekanntmachungsdatum)\n\nNordrhein-Westfalen Amtsgericht Coesfeld HRB 20505\nRegisterbekanntmachung nach dem Umwandlungsgesetz 04.11.2024 (Eintragungsdatum)\n\ndigitalpush GmbH\nGesellschaft mit beschränkter Haftung\nHavixbeck\n\nDen Gläubigern der an der Verschmelzung beteiligten Rechtsträger ist, wenn sie binnen sechs Monaten nach dem Tag, an dem die Eintragung der Verschmelzung in das Register des Sitzes derjenigen Rechtsträger deren Gläubiger sie sind, nach § 19 Absatz 3 UmwG als bekanntgemacht gilt, ihren Anspruch nach Grund und Höhe schriftlich anmelden, Sicherheit zu leisten, soweit sie nicht Befriedigung verlangen können. Dieses Recht steht den Gläubigern jedoch nur zu, wenn sie glaubhaft machen, dass durch die Verschmelzung die Erfüllung ihrer Forderung gefährdet wird."
    },
    {
      "date": "2024-11-04",
      "id": "92414",
      "original_text": "Löschungsankündigung\nHamburg Amtsgericht Hamburg VR 20436\nMing Tang Foundation e.V. – Hamburg",
      "type": "Löschungsankündigung",
      "state": "Hamburg",
      "amtsgericht": "Amtsgericht Hamburg",
      "registernummer": "VR 20436",
      "registerart": "VR",
      "company_name": "Ming Tang Foundation e.V.",
      "company_seat": "Hamburg",
      "details": "04.11.2024 (Bekanntmachungsdatum)\n\nHamburg Amtsgericht Hamburg VR 20436\nLöschungsankündigung\n\nMing Tang Foundation e.V.\neingetragener Verein\nHamburg\n\nDas Gericht beabsichtigt den im Vereinsregister eingetragenen Verein von Amts wegen nach § 395 FamFG zu löschen, da nach den angestellten Ermittlungen dieser Verein offenbar nicht mehr besteht. Die Frist zur Erhebung eines Widerspruchs gegen die beabsichtigte Löschung wird auf 3 Monate festgesetzt."
    },
    {
      "date": "2024-11-04",
      "id": "92415",
      "original_text": "Registerbekanntmachung nach dem Umwandlungsgesetz\nBerlin Amtsgericht Berlin (Charlottenburg) HRB 141922\nAxel Springer Digital Classifieds GmbH – Berlin",
      "type": "Registerbekanntmachung nach dem Umwandlungsgesetz",
      "state": "Berlin",
      "amtsgericht": "Amtsgericht Berlin (Charlottenburg)",
      "registernummer": "HRB 141922",
      "registerart": "HRB",
      "company_name": "Axel Springer Digital Classifieds GmbH",
      "company_seat": "Berlin",
      "details": "04.11.2024 (Bekanntmachungsdatum)\n\nBerlin Amtsgericht Berlin (Charlottenburg) HRB 141922\nRegisterbekanntmachung nach dem Umwandlungsgesetz 04.11.2024 (Eintragungsdatum)\n\nAxel Springer Digital Classifieds GmbH\nGesellschaft mit beschränkter Haftung\nBerlin\n\nZu Eintragungsnummer 21 vom 04.11.2024 wird als nicht eingetragen veröffentlicht: Den Gläubigern der an der Verschmelzung beteiligten Rechtsträger ist, wenn sie binnen sechs Monaten nach dem Tag, an dem die Eintragung der Verschmelzung in das Register des Sitzes desjenigen Rechtsträgers, dessen Gläubiger sie sind, als bekannt gemacht gilt, ihren Anspruch nach Grund und Höhe schriftlich anmelden, Sicherheit zu leisten, soweit sie nicht Befriedigung verlangen können. Dieses Recht steht den Gläubigern jedoch nur zu, wenn sie glaubhaft machen, dass durch die Verschmelzung die Erfüllung ihrer Forderung gefährdet wird. Das Recht, Sicherheitsleistung zu verlangen, steht Gläubigern nicht zu, die im Falle der Insolvenz ein Recht auf vorzugsweise Befriedigung aus einer Deckungsmasse haben, die nach gesetzlicher Vorschrift zu ihrem Schutz errichtet und staatlich überwacht ist."
    },
    {
      "date": "2024-11-04",
      "id": "92416",
      "original_text": "Registerbekanntmachung nach dem Umwandlungsgesetz\nSaarland Amtsgericht Saarbrücken HRB 19105\nLaux Kundendienst GmbH – Losheim am See",
      "type": "Registerbekanntmachung nach dem Umwandlungsgesetz",
      "state": "Saarland",
      "amtsgericht": "Amtsgericht Saarbrücken",
      "registernummer": "HRB 19105",
      "registerart": "HRB",
      "company_name": "Laux Kundendienst GmbH",
      "company_seat": "Losheim am See",
      "details": "04.11.2024 (Bekanntmachungsdatum)\n\nSaarland Amtsgericht Saarbrücken HRB 19105\nRegisterbekanntmachung nach dem Umwandlungsgesetz 04.11.2024 (Eintragungsdatum)\n\nLaux Kundendienst GmbH\nGesellschaft mit beschränkter Haftung\nLosheim am See\n\nAls nicht eingetragen wird bekannt gemacht: Den Gläubigern der an der Verschmelzung beteiligten Gesellschaften ist, wenn sie binnen sechs Monaten nach dem Tag, an dem die Eintragung der Verschmelzung in das Register des Sitzes desjenigen Rechtsträgers, dessen Gläubiger sie sind, nach § 19 Absatz 3 UmwG bekannt gemacht worden ist, ihren Anspruch nach Grund und Höhe schriftlich anmelden, Sicherheit zu leisten, soweit sie nicht Befriedigung verlangen können. Dieses Recht steht den Gläubigern jedoch nur zu, wenn sie glaubhaft machen, dass durch die Verschmelzung die Erfüllung ihrer Forderung gefährdet wird."
    },
    {
      "date": "2024-11-04",
      "id": "92417",
      "original_text": "Registerbekanntmachung nach dem Umwandlungsgesetz\nSaarland Amtsgericht Saarbrücken HRB 63578\nFertigbau Laux GmbH – Losheim am See",
      "type": "Registerbekanntmachung nach dem Umwandlungsgesetz",
      "state": "Saarland",
      "amtsgericht": "Amtsgericht Saarbrücken",
      "registernummer": "HRB 63578",
      "registerart": "HRB",
      "company_name": "Fertigbau Laux GmbH",
      "company_seat": "Losheim am See",
      "details": "04.11.2024 (Bekanntmachungsdatum)\n\nSaarland Amtsgericht Saarbrücken HRB 63578\nRegisterbekanntmachung nach dem Umwandlungsgesetz 04.11.2024 (Eintragungsdatum)\n\nFertigbau Laux GmbH\nGesellschaft mit beschränkter Haftung\nLosheim am See\n\nAls nicht eingetragen wird bekannt gemacht: Den Gläubigern der an der Verschmelzung beteiligten Gesellschaften ist, wenn sie binnen sechs Monaten nach dem Tag, an dem die Eintragung der Verschmelzung in das Register des Sitzes desjenigen Rechtsträgers, dessen Gläubiger sie sind, nach § 19 Absatz 3 UmwG bekannt gemacht worden ist, ihren Anspruch nach Grund und Höhe schriftlich anmelden, Sicherheit zu leisten, soweit sie nicht Befriedigung verlangen können. Dieses Recht steht den Gläubigern jedoch nur zu, wenn sie glaubhaft machen, dass durch die Verschmelzung die Erfüllung ihrer Forderung gefährdet wird."
    },
    {
      "date": "2024-11-04",
      "id": "92418",
      "original_text": "Registerbekanntmachung nach dem Umwandlungsgesetz\nBerlin Amtsgericht Berlin (Charlottenburg) HRB 141303\nAxel Springer Digital Classifieds Holding GmbH – Berlin",
      "type": "Registerbekanntmachung nach dem Umwandlungsgesetz",
      "state": "Berlin",
      "amtsgericht": "Amtsgericht Berlin (Charlottenburg)",
      "registernummer": "HRB 141303",
      "registerart": "HRB",
      "company_name": "Axel Springer Digital Classifieds Holding GmbH",
      "company_seat": "Berlin",
      "details": "04.11.2024 (Bekanntmachungsdatum)\n\nBerlin Amtsgericht Berlin (Charlottenburg) HRB 141303\nRegisterbekanntmachung nach dem Umwandlungsgesetz 01.11.2024 (Eintragungsdatum)\n\nAxel Springer Digital Classifieds Holding GmbH\nGesellschaft mit beschränkter Haftung\nBerlin\n\nZu Eintragungsnummer 19 vom 01.11.2024 wird als nicht eingetragen veröffentlicht:Den Gläubigern der an der Verschmelzung beteiligten Rechtsträger ist, wenn sie binnen sechs Monaten nach dem Tag, an dem die Eintragung der Verschmelzung in das Register des Sitzes desjenigen Rechtsträgers, dessen Gläubiger sie sind, als bekannt gemacht gilt, ihren Anspruch nach Grund und Höhe schriftlich anmelden, Sicherheit zu leisten, soweit sie nicht Befriedigung verlangen können. Dieses Recht steht den Gläubigern jedoch nur zu, wenn sie glaubhaft machen, dass durch die Verschmelzung die Erfüllung ihrer Forderung gefährdet wird. Das Recht, Sicherheitsleistung zu verlangen, steht Gläubigern nicht zu, die im Falle der Insolvenz ein Recht auf vorzugsweise Befriedigung aus einer Deckungsmasse haben, die nach gesetzlicher Vorschrift zu ihrem Schutz errichtet und staatlich überwacht ist."
    },
    {
      "date": "2024-11-04",
      "id": "92419",
      "original_text": "Registerbekanntmachung nach dem Umwandlungsgesetz\nNordrhein-Westfalen Amtsgericht Coesfeld HRA 9943\nBerthold Strauch e.K. – Isselburg",
      "type": "Registerbekanntmachung nach dem Umwandlungsgesetz",
      "state": "Nordrhein-Westfalen",
      "amtsgericht": "Amtsgericht Coesfeld",
      "registernummer": "HRA 9943",
      "registerart": "HRA",
      "company_name": "Berthold Strauch e.K.",
      "company_seat": "Isselburg",
      "details": "04.11.2024 (Bekanntmachungsdatum)\n\nNordrhein-Westfalen Amtsgericht Coesfeld HRA 9943\nRegisterbekanntmachung nach dem Umwandlungsgesetz 04.11.2024 (Eintragungsdatum)\n\nBerthold Strauch e.K.\nEinzelkaufmann\nIsselburg\n\nDen Gläubigern der an der Ausgliederung beteiligten Rechtsträger ist, wenn sie binnen sechs Monaten nach dem Tag, an dem die Eintragung der Ausgliederung in das Register des Sitzes desjenigen Rechtsträgers, dessen Gläubiger sie sind, nach § 19 Absatz 3 UmwG als bekanntgemacht gilt, ihren Anspruch nach Grund und Höhe schriftlich anmelden, Sicherheit zu leisten, soweit sie nicht Befriedigung verlangen können. Dieses Recht steht den Gläubigern jedoch nur zu, wenn sie glaubhaft machen, dass durch die Ausgliederung die Erfüllung ihrer Forderung gefährdet wird."
    },
    {
      "date": "2024-11-04",
      "id": "92420",
      "original_text": "Registerbekanntmachung nach dem Umwandlungsgesetz\nBerlin Amtsgericht Berlin (Charlottenburg) HRB 141303\nAxel Springer Digital Classifieds Holding GmbH – Berlin",
      "type": "Registerbekanntmachung nach dem Umwandlungsgesetz",
      "state": "Berlin",
      "amtsgericht": "Amtsgericht Berlin (Charlottenburg)",
      "registernummer": "HRB 141303",
      "registerart": "HRB",
      "company_name": "Axel Springer Digital Classifieds Holding GmbH",
      "company_seat": "Berlin",
      "details": "04.11.2024 (Bekanntmachungsdatum)\n\nBerlin Amtsgericht Berlin (Charlottenburg) HRB 141303\nRegisterbekanntmachung nach dem Umwandlungsgesetz 01.11.2024 (Eintragungsdatum)\n\nAxel Springer Digital Classifieds Holding GmbH\nGesellschaft mit beschränkter Haftung\nBerlin\n\nZu Eintragungsnummer 19 vom 01.11.2024 wird als nicht eingetragen veröffentlicht:Der andere Vertragsteil hat den Gläubigern dieses Rechtsträgers, deren Forderungen begründet worden sind, bevor die Eintragung der Beendigung dieses Vertrages in das Handelsregister nach § 10 des Handelsgesetzbuches als bekannt gemacht gilt, Sicherheit zu leisten, wenn sie sich binnen sechs Monaten nach der Bekanntmachung der Eintragung zu diesem Zweck bei ihm melden. Dieses Recht steht den Gläubigern nicht zu, die im Fall des Insolvenzverfahrens ein Recht auf vorzugsweise Befriedigung aus der Deckungsmasse haben, die nach gesetzlicher Vorschrift zu ihrem Schutz errichtet und staatlich überwacht ist."
    },
    {
      "date": "2024-11-04",
      "id": "92421",
      "original_text": "Registerbekanntmachung nach dem Umwandlungsgesetz\nBaden-Württemberg Amtsgericht Mannheim HRB 723931\nJAB SERVICE GmbH – Mannheim",
      "type": "Registerbekanntmachung nach dem Umwandlungsgesetz",
      "state": "Baden-Württemberg",
      "amtsgericht": "Amtsgericht Mannheim",
      "registernummer": "HRB 723931",
      "registerart": "HRB",
      "company_name": "JAB SERVICE GmbH",
      "company_seat": "Mannheim",
      "details": "04.11.2024 (Bekanntmachungsdatum)\n\nBaden-Württemberg Amtsgericht Mannheim HRB 723931\nRegisterbekanntmachung nach dem Umwandlungsgesetz 04.11.2024 (Eintragungsdatum)\n\nJAB SERVICE GmbH\nGesellschaft mit beschränkter Haftung\nMannheim\n\nAls nicht eingetragen wird bekanntgemacht:\nDen Gläubigern der an der Verschmelzung beteiligten Rechtsträger ist, wenn sie binnen sechs Monaten nach dem Tag, an dem die Eintragung der Verschmelzung in das Register des Sitzes desjenigen Rechtsträgers, dessen Gläubiger sie sind, nach § 19 Abs. 3 UmwG als bekanntgemacht gilt, ihren Anspruch nach Grund und Höhe schriftlich anmelden, Sicherheit zu leisten, soweit sie nicht Befriedigung verlangen können. Dieses Recht steht den Gläubigern jedoch nur zu, wenn sie glaubhaft machen, dass durch die Verschmelzung die Erfüllung ihrer Forderung gefährdet wird."
    },
    {
      "date": "2024-11-04",
      "id": "92422",
      "original_text": "Sonstige Registerbekanntmachung\nSachsen Amtsgericht Leipzig HRB 36096\nTalkpool Deutschland AG – Leipzig",
      "type": "Sonstige Registerbekanntmachung",
      "state": "Sachsen",
      "amtsgericht": "Amtsgericht Leipzig",
      "registernummer": "HRB 36096",
      "registerart": "HRB",
      "company_name": "Talkpool Deutschland AG",
      "company_seat": "Leipzig",
      "details": "04.11.2024 (Bekanntmachungsdatum)\n\nSachsen Amtsgericht Leipzig HRB 36096\nSonstige Registerbekanntmachung\n\nTalkpool Deutschland AG\nAktiengesellschaft\nLeipzig\n\nAm 30.10.2024 wurde beim Handelsregister des Amtsgerichts Leipzig die Liste der Mitglieder des Aufsichtsrats gemäß § 106 AktG eingereicht."
    },
    {
      "date": "2024-11-04",
      "id": "92423",
      "original_text": "Löschungsankündigung\nSachsen Amtsgericht Chemnitz HRB 17765\n\"GEFIX\" Beratungs- und Dienstleistungs GmbH – Schwarzenberg/Erzgeb.",
      "type": "Löschungsankündigung",
      "state": "Sachsen",
      "amtsgericht": "Amtsgericht Chemnitz",
      "registernummer": "HRB 17765",
      "registerart": "HRB",
      "company_name": "\"GEFIX\" Beratungs- und Dienstleistungs GmbH",
      "company_seat": "Schwarzenberg/Erzgeb.",
      "details": "04.11.2024 (Bekanntmachungsdatum)\n\nSachsen Amtsgericht Chemnitz HRB 17765\nLöschungsankündigung\n\n\"GEFIX\" Beratungs- und Dienstleistungs GmbH\nGesellschaft mit beschränkter Haftung\nSchwarzenberg/Erzgeb.\n\nDas Registergericht beabsichtigt, die im Handelsregister eingetragene Gesellschaft von Amts wegen nach § 394 FamFG zu löschen. Die Frist zu Erhebung eines Widerspruchs gegen die beabsichtigte Löschung wird auf einen Monat festgesetzt."
    },
    {
      "date": "2024-11-04",
      "id": "92424",
      "original_text": "Sonstige Registerbekanntmachung\nSachsen Amtsgericht Leipzig HRB 23614\ncaplog-x GmbH – Leipzig",
      "type": "Sonstige Registerbekanntmachung",
      "state": "Sachsen",
      "amtsgericht": "Amtsgericht Leipzig",
      "registernummer": "HRB 23614",
      "registerart": "HRB",
      "company_name": "caplog-x GmbH",
      "company_seat": "Leipzig",
      "details": "04.11.2024 (Bekanntmachungsdatum)\n\nSachsen Amtsgericht Leipzig HRB 23614\nSonstige Registerbekanntmachung\n\ncaplog-x GmbH\nGesellschaft mit beschränkter Haftung\nLeipzig\n\nAm 30.10.2024 wurde beim Handelsregister des Amtsgerichts Leipzig die Liste der Mitglieder des Aufsichtsrats gemäß § 52 GmbHG eingereicht."
    },
    {
      "date": "2024-11-04",
      "id": "92425",
      "original_text": "Löschungsankündigung\nSachsen Amtsgericht Dresden HRB 29903\nPayback Sound & Design GmbH – Dresden",
      "type": "Löschungsankündigung",
      "state": "Sachsen",
      "amtsgericht": "Amtsgericht Dresden",
      "registernummer": "HRB 29903",
      "registerart": "HRB",
      "company_name": "Payback Sound & Design GmbH",
      "company_seat": "Dresden",
      "details": "04.11.2024 (Bekanntmachungsdatum)\n\nSachsen Amtsgericht Dresden HRB 29903\nLöschungsankündigung\n\nPayback Sound & Design GmbH\nGesellschaft mit beschränkter Haftung\nDresden\n\nDas Registergericht beabsichtigt, die im Handelsregister eingetragene Gesellschaft von Amts wegen nach § 394 FamFG zu löschen. Die Frist zu Erhebung eines Widerspruchs gegen die beabsichtigte Löschung wird auf einen Monat festgesetzt."
    },
    {
      "date": "2024-11-04",
      "id": "92426",
      "original_text": "Registerbekanntmachung nach dem Umwandlungsgesetz\nNiedersachsen Amtsgericht Oldenburg (Oldenburg) HRB 110515 früher Amtsgericht Vechta\nHöffmann Reisen GmbH – Vechta",
      "type": "Registerbekanntmachung nach dem Umwandlungsgesetz",
      "state": "Niedersachsen",
      "amtsgericht": "Amtsgericht Oldenburg (Oldenburg)",
      "registernummer": "HRB 110515",
      "registerart": "HRB",
      "company_name": "Höffmann Reisen GmbH",
      "company_seat": "Vechta",
      "former_amtsgericht": "Vechta",
      "details": "04.11.2024 (Bekanntmachungsdatum)\n\nNiedersachsen Amtsgericht Oldenburg (Oldenburg) HRB 110515 früher Amtsgericht Vechta\nRegisterbekanntmachung nach dem Umwandlungsgesetz 04.11.2024 (Eintragungsdatum)\n\nHöffmann Reisen GmbH\nGesellschaft mit beschränkter Haftung\nVechta\n\nDen Gläubigern der an der Verschmelzung beteiligten Rechtsträger ist, wenn sie binnen sechs Monaten nach dem Tag, an dem die Eintragung der Verschmelzung in das Register des Sitzes desjenigen Rechtsträgers, dessen Gläubiger sie sind, nach § 19  Abs.  3 UmwG als bekannt gemacht gilt, ihren Anspruch nach Grund und Höhe schriftlich anmelden, Sicherheit zu leisten, soweit sie nicht Befriedigung verlangen können. Dieses Recht steht den Gläubigern jedoch nur zu, wenn sie glaubhaft machen, dass durch die Verschmelzung die Erfüllung der Forderung gefährdet wird."
    },
    {
      "date": "2024-11-04",
      "id": "92427",
      "original_text": "Registerbekanntmachung nach dem Umwandlungsgesetz\nNiedersachsen Amtsgericht Aurich HRB 205730\ncyflenwad Dreiundachtzigste Vermögensverwaltungs GmbH – Schweindorf",
      "type": "Registerbekanntmachung nach dem Umwandlungsgesetz",
      "state": "Niedersachsen",
      "amtsgericht": "Amtsgericht Aurich",
      "registernummer": "HRB 205730",
      "registerart": "HRB",
      "company_name": "cyflenwad Dreiundachtzigste Vermögensverwaltungs GmbH",
      "company_seat": "Schweindorf",
      "details": "04.11.2024 (Bekanntmachungsdatum)\n\nNiedersachsen Amtsgericht Aurich HRB 205730\nRegisterbekanntmachung nach dem Umwandlungsgesetz 04.11.2024 (Eintragungsdatum)\n\ncyflenwad Dreiundachtzigste Vermögensverwaltungs GmbH\nGesellschaft mit beschränkter Haftung\nSchweindorf\n\nDen Gläubigern der an der Verschmelzung beteiligten Rechtsträger ist, wenn sie binnen sechs Monaten nach dem Tag, an dem die Eintragung der Verschmelzung in das Register des Sitzes desjenigen Rechtsträgers, dessen Gläubiger sie sind, nach § 19  Abs.  3 UmwG als bekannt gemacht gilt, ihren Anspruch nach Grund und Höhe schriftlich anmelden, Sicherheit zu leisten, soweit sie nicht Befriedigung verlangen können. Dieses Recht steht den Gläubigern jedoch nur zu, wenn sie glaubhaft machen, dass durch die Verschmelzung die Erfüllung der Forderung gefährdet wird."
    },
    {
      "date": "2024-11-04",
      "id": "92428",
      "original_text": "Einreichung neuer Dokumente\nNiedersachsen Amtsgericht Hannover HRB 3787\nKraussMaffei Extrusion GmbH – Laatzen",
      "type": "Einreichung neuer Dokumente",
      "state": "Niedersachsen",
      "amtsgericht": "Amtsgericht Hannover",
      "registernummer": "HRB 3787",
      "registerart": "HRB",
      "company_name": "KraussMaffei Extrusion GmbH",
      "company_seat": "Laatzen",
      "details": "04.11.2024 (Bekanntmachungsdatum)\n\nNiedersachsen Amtsgericht Hannover HRB 3787\nEinreichung neuer Dokumente\n\nKraussMaffei Extrusion GmbH\nGesellschaft mit beschränkter Haftung\nLaatzen\n\nDie Liste der Mitglieder des Aufsichtsrats wurde beim Registergericht eingereicht."
    },
    {
      "date": "2024-11-04",
      "id": "92429",
      "original_text": "Einreichung neuer Dokumente\nNiedersachsen Amtsgericht Hannover HRB 204803\nLenze SE – Aerzen",
      "type": "Einreichung neuer Dokumente",
      "state": "Niedersachsen",
      "amtsgericht": "Amtsgericht Hannover",
      "registernummer": "HRB 204803",
      "registerart": "HRB",
      "company_name": "Lenze SE",
      "company_seat": "Aerzen",
      "details": "04.11.2024 (Bekanntmachungsdatum)\n\nNiedersachsen Amtsgericht Hannover HRB 204803\nEinreichung neuer Dokumente\n\nLenze SE\nEuropäische Aktiengesellschaft (SE)\nAerzen\n\nDie Liste der Mitglieder des Aufsichtsrats wurde beim Registergericht eingereicht."
    },
    {
      "date": "2024-11-04",
      "id": "92430",
      "original_text": "Registerbekanntmachung nach dem Umwandlungsgesetz\nNiedersachsen Amtsgericht Hannover VR 3558\nKatholische ErwachsenenbiIdung Region Hannover e.V. – Hannover",
      "type": "Registerbekanntmachung nach dem Umwandlungsgesetz",
      "state": "Niedersachsen",
      "amtsgericht": "Amtsgericht Hannover",
      "registernummer": "VR 3558",
      "registerart": "VR",
      "company_name": "Katholische ErwachsenenbiIdung Region Hannover e.V.",
      "company_seat": "Hannover",
      "details": "04.11.2024 (Bekanntmachungsdatum)\n\nNiedersachsen Amtsgericht Hannover VR 3558\nRegisterbekanntmachung nach dem Umwandlungsgesetz 04.11.2024 (Eintragungsdatum)\n\nKatholische ErwachsenenbiIdung Region Hannover e.V.\neingetragener Verein\nHannover\n\nDen Gläubigern der an der Verschmelzung beteiligten Rechtsträger ist, wenn sie binnen sechs Monaten nach dem Tag, an dem die Eintragung der Verschmelzung in das Register des Sitzes desjenigen Rechtsträgers, dessen Gläubiger sie sind, nach § 19  Abs.  3 UmwG als bekannt gemacht gilt, ihren Anspruch nach Grund und Höhe schriftlich anmelden, Sicherheit zu leisten, soweit sie nicht Befriedigung verlangen können. Dieses Recht steht den Gläubigern jedoch nur zu, wenn sie glaubhaft machen, dass durch die Verschmelzung die Erfüllung der Forderung gefährdet wird."
    },
    {
      "date": "2024-11-04",
      "id": "92431",
      "original_text": "Registerbekanntmachung nach dem Umwandlungsgesetz\nNiedersachsen Amtsgericht Oldenburg (Oldenburg) HRB 201392\nReisebüro Höffmann GmbH – Vechta",
      "type": "Registerbekanntmachung nach dem Umwandlungsgesetz",
      "state": "Niedersachsen",
      "amtsgericht": "Amtsgericht Oldenburg (Oldenburg)",
      "registernummer": "HRB 201392",
      "registerart": "HRB",
      "company_name": "Reisebüro Höffmann GmbH",
      "company_seat": "Vechta",
      "details": "04.11.2024 (Bekanntmachungsdatum)\n\nNiedersachsen Amtsgericht Oldenburg (Oldenburg) HRB 201392\nRegisterbekanntmachung nach dem Umwandlungsgesetz 04.11.2024 (Eintragungsdatum)\n\nReisebüro Höffmann GmbH\nGesellschaft mit beschränkter Haftung\nVechta\n\nDen Gläubigern der an der Verschmelzung beteiligten Rechtsträger ist, wenn sie binnen sechs Monaten nach dem Tag, an dem die Eintragung der Verschmelzung in das Register des Sitzes desjenigen Rechtsträgers, dessen Gläubiger sie sind, nach § 19  Abs.  3 UmwG als bekannt gemacht gilt, ihren Anspruch nach Grund und Höhe schriftlich anmelden, Sicherheit zu leisten, soweit sie nicht Befriedigung verlangen können. Dieses Recht steht den Gläubigern jedoch nur zu, wenn sie glaubhaft machen, dass durch die Verschmelzung die Erfüllung der Forderung gefährdet wird."
    },
    {
      "date": "2024-11-04",
      "id": "92432",
      "original_text": "Registerbekanntmachung nach dem Umwandlungsgesetz\nNiedersachsen Amtsgericht Oldenburg (Oldenburg) HRB 208219\nHöffmann Akademie GmbH – Vechta",
      "type": "Registerbekanntmachung nach dem Umwandlungsgesetz",
      "state": "Niedersachsen",
      "amtsgericht": "Amtsgericht Oldenburg (Oldenburg)",
      "registernummer": "HRB 208219",
      "registerart": "HRB",
      "company_name": "Höffmann Akademie GmbH",
      "company_seat": "Vechta",
      "details": "04.11.2024 (Bekanntmachungsdatum)\n\nNiedersachsen Amtsgericht Oldenburg (Oldenburg) HRB 208219\nRegisterbekanntmachung nach dem Umwandlungsgesetz 04.11.2024 (Eintragungsdatum)\n\nHöffmann Akademie GmbH\nGesellschaft mit beschränkter Haftung\nVechta\n\nDen Gläubigern der an der Verschmelzung beteiligten Rechtsträger ist, wenn sie binnen sechs Monaten nach dem Tag, an dem die Eintragung der Verschmelzung in das Register des Sitzes desjenigen Rechtsträgers, dessen Gläubiger sie sind, nach § 19  Abs.  3 UmwG als bekannt gemacht gilt, ihren Anspruch nach Grund und Höhe schriftlich anmelden, Sicherheit zu leisten, soweit sie nicht Befriedigung verlangen können. Dieses Recht steht den Gläubigern jedoch nur zu, wenn sie glaubhaft machen, dass durch die Verschmelzung die Erfüllung der Forderung gefährdet wird."
    },
    {
      "date": "2024-11-04",
      "id": "92433",
      "original_text": "Registerbekanntmachung nach dem Umwandlungsgesetz\nNiedersachsen Amtsgericht Oldenburg (Oldenburg) HRB 212956\nHöffmann TV GmbH – Vechta",
      "type": "Registerbekanntmachung nach dem Umwandlungsgesetz",
      "state": "Niedersachsen",
      "amtsgericht": "Amtsgericht Oldenburg (Oldenburg)",
      "registernummer": "HRB 212956",
      "registerart": "HRB",
      "company_name": "Höffmann TV GmbH",
      "company_seat": "Vechta",
      "details": "04.11.2024 (Bekanntmachungsdatum)\n\nNiedersachsen Amtsgericht Oldenburg (Oldenburg) HRB 212956\nRegisterbekanntmachung nach dem Umwandlungsgesetz 04.11.2024 (Eintragungsdatum)\n\nHöffmann TV GmbH\nGesellschaft mit beschränkter Haftung\nVechta\n\nDen Gläubigern der an der Verschmelzung beteiligten Rechtsträger ist, wenn sie binnen sechs Monaten nach dem Tag, an dem die Eintragung der Verschmelzung in das Register des Sitzes desjenigen Rechtsträgers, dessen Gläubiger sie sind, nach § 19  Abs.  3 UmwG als bekannt gemacht gilt, ihren Anspruch nach Grund und Höhe schriftlich anmelden, Sicherheit zu leisten, soweit sie nicht Befriedigung verlangen können. Dieses Recht steht den Gläubigern jedoch nur zu, wenn sie glaubhaft machen, dass durch die Verschmelzung die Erfüllung der Forderung gefährdet wird."
    },
    {
      "date": "2024-11-04",
      "id": "92434",
      "original_text": "Registerbekanntmachung nach dem Umwandlungsgesetz\nNiedersachsen Amtsgericht Osnabrück HRA 7305\nCoors ..... Ihre Bäckerei GmbH & Co. KG – Osnabrück",
      "type": "Registerbekanntmachung nach dem Umwandlungsgesetz",
      "state": "Niedersachsen",
      "amtsgericht": "Amtsgericht Osnabrück",
      "registernummer": "HRA 7305",
      "registerart": "HRA",
      "company_name": "Coors ..... Ihre Bäckerei GmbH & Co. KG",
      "company_seat": "Osnabrück",
      "details": "04.11.2024 (Bekanntmachungsdatum)\n\nNiedersachsen Amtsgericht Osnabrück HRA 7305\nRegisterbekanntmachung nach dem Umwandlungsgesetz 04.11.2024 (Eintragungsdatum)\n\nCoors ..... Ihre Bäckerei GmbH & Co. KG\nKommanditgesellschaft\nOsnabrück\n\nDen Gläubigern der an der formwechselnden Umwandlung beteiligten Rechtsträger ist, wenn sie binnen sechs Monaten nach dem Tag, an dem die Eintragung der Umwandlung in das Register des Sitzes desjenigen Rechtsträgers, dessen Gläubiger sie sind, nach § 19 Abs. 3 UmwG als bekannt gemacht gilt, ihren Anspruch nach Grund und Höhe schriftlich anmelden, Sicherheit zu leisten, soweit sie nicht Befriedigung verlangen können. Dieses Recht steht den Gläubigern jedoch nur zu, wenn sie glaubhaft machen, dass durch die formwechselnde Umwandlung die Erfüllung der Forderung gefährdet wird."
    },
    {
      "date": "2024-11-04",
      "id": "92435",
      "original_text": "Registerbekanntmachung nach dem Umwandlungsgesetz\nNiedersachsen Amtsgericht Oldenburg (Oldenburg) HRB 217922\nHöffmann Go GmbH – Vechta",
      "type": "Registerbekanntmachung nach dem Umwandlungsgesetz",
      "state": "Niedersachsen",
      "amtsgericht": "Amtsgericht Oldenburg (Oldenburg)",
      "registernummer": "HRB 217922",
      "registerart": "HRB",
      "company_name": "Höffmann Go GmbH",
      "company_seat": "Vechta",
      "details": "04.11.2024 (Bekanntmachungsdatum)\n\nNiedersachsen Amtsgericht Oldenburg (Oldenburg) HRB 217922\nRegisterbekanntmachung nach dem Umwandlungsgesetz 04.11.2024 (Eintragungsdatum)\n\nHöffmann Go GmbH\nGesellschaft mit beschränkter Haftung\nVechta\n\nDen Gläubigern der an der Verschmelzung beteiligten Rechtsträger ist, wenn sie binnen sechs Monaten nach dem Tag, an dem die Eintragung der Verschmelzung in das Register des Sitzes desjenigen Rechtsträgers, dessen Gläubiger sie sind, nach § 19  Abs.  3 UmwG als bekannt gemacht gilt, ihren Anspruch nach Grund und Höhe schriftlich anmelden, Sicherheit zu leisten, soweit sie nicht Befriedigung verlangen können. Dieses Recht steht den Gläubigern jedoch nur zu, wenn sie glaubhaft machen, dass durch die Verschmelzung die Erfüllung der Forderung gefährdet wird."
    },
    {
      "date": "2024-11-04",
      "id": "92436",
      "original_text": "Registerbekanntmachung nach dem Umwandlungsgesetz\nNiedersachsen Amtsgericht Oldenburg (Oldenburg) HRB 201391\nHöffmann Touristik GmbH – Vechta",
      "type": "Registerbekanntmachung nach dem Umwandlungsgesetz",
      "state": "Niedersachsen",
      "amtsgericht": "Amtsgericht Oldenburg (Oldenburg)",
      "registernummer": "HRB 201391",
      "registerart": "HRB",
      "company_name": "Höffmann Touristik GmbH",
      "company_seat": "Vechta",
      "details": "04.11.2024 (Bekanntmachungsdatum)\n\nNiedersachsen Amtsgericht Oldenburg (Oldenburg) HRB 201391\nRegisterbekanntmachung nach dem Umwandlungsgesetz 04.11.2024 (Eintragungsdatum)\n\nHöffmann Touristik GmbH\nGesellschaft mit beschränkter Haftung\nVechta\n\nDen Gläubigern der an der Verschmelzung beteiligten Rechtsträger ist, wenn sie binnen sechs Monaten nach dem Tag, an dem die Eintragung der Verschmelzung in das Register des Sitzes desjenigen Rechtsträgers, dessen Gläubiger sie sind, nach § 19  Abs.  3 UmwG als bekannt gemacht gilt, ihren Anspruch nach Grund und Höhe schriftlich anmelden, Sicherheit zu leisten, soweit sie nicht Befriedigung verlangen können. Dieses Recht steht den Gläubigern jedoch nur zu, wenn sie glaubhaft machen, dass durch die Verschmelzung die Erfüllung der Forderung gefährdet wird."
    },
    {
      "date": "2024-11-04",
      "id": "92437",
      "original_text": "Löschungsankündigung\nNiedersachsen Amtsgericht Stadthagen HRB 201348\nFischbude Rusbend UG (haftungsbeschränkt) – Bückeburg",
      "type": "Löschungsankündigung",
      "state": "Niedersachsen",
      "amtsgericht": "Amtsgericht Stadthagen",
      "registernummer": "HRB 201348",
      "registerart": "HRB",
      "company_name": "Fischbude Rusbend UG (haftungsbeschränkt)",
      "company_seat": "Bückeburg",
      "details": "04.11.2024 (Bekanntmachungsdatum)\n\nNiedersachsen Amtsgericht Stadthagen HRB 201348\nLöschungsankündigung\n\nFischbude Rusbend UG (haftungsbeschränkt)\nGesellschaft mit beschränkter Haftung\nBückeburg\n\nDas Registergericht beabsichtigt, die Gesellschaft von Amts wegen nach § 394 FamFG zu löschen. Die Frist zur Erhebung eines Widerspruchs ist auf 1 Monat ab dieser Registerbekanntmachung festgesetzt."
    },
    {
      "date": "2024-11-04",
      "id": "92438",
      "original_text": "Löschungsankündigung\nNiedersachsen Amtsgericht Stadthagen HRB 201700\nCharisma UG (haftungsbeschränkt) – Bückeburg",
      "type": "Löschungsankündigung",
      "state": "Niedersachsen",
      "amtsgericht": "Amtsgericht Stadthagen",
      "registernummer": "HRB 201700",
      "registerart": "HRB",
      "company_name": "Charisma UG (haftungsbeschränkt)",
      "company_seat": "Bückeburg",
      "details": "04.11.2024 (Bekanntmachungsdatum)\n\nNiedersachsen Amtsgericht Stadthagen HRB 201700\nLöschungsankündigung\n\nCharisma UG (haftungsbeschränkt)\nGesellschaft mit beschränkter Haftung\nBückeburg\n\nDas Registergericht beabsichtigt, die Gesellschaft von Amts wegen nach § 394 FamFG zu löschen. Die Frist zur Erhebung eines Widerspruchs ist auf 1 Monat ab dieser Registerbekanntmachung festgesetzt."
    },
    {
      "date": "2024-11-04",
      "id": "92439",
      "original_text": "Löschungsankündigung\nNiedersachsen Amtsgericht Göttingen HRB 781\nMärz & Heinemann Verwaltungsgesellschaft mit beschränkter Haftung – Rosdorf",
      "type": "Löschungsankündigung",
      "state": "Niedersachsen",
      "amtsgericht": "Amtsgericht Göttingen",
      "registernummer": "HRB 781",
      "registerart": "HRB",
      "company_name": "März & Heinemann Verwaltungsgesellschaft mit beschränkter Haftung",
      "company_seat": "Rosdorf",
      "details": "04.11.2024 (Bekanntmachungsdatum)\n\nNiedersachsen Amtsgericht Göttingen HRB 781\nLöschungsankündigung\n\nMärz & Heinemann Verwaltungsgesellschaft mit beschränkter Haftung\nGesellschaft mit beschränkter Haftung\nRosdorf\n\nDas Registergericht beabsichtigt, die Gesellschaft von Amts wegen nach § 394 FamFG zu löschen. Die Frist zur Erhebung eines Widerspruchs ist auf 1 Monat ab dieser Registerbekanntmachung festgesetzt."
    },
    {
      "date": "2024-11-04",
      "id": "92440",
      "original_text": "Registerbekanntmachung nach dem Umwandlungsgesetz\nNiedersachsen Amtsgericht Aurich HRB 205720\nEisenhauer Invest GmbH – Schweindorf",
      "type": "Registerbekanntmachung nach dem Umwandlungsgesetz",
      "state": "Niedersachsen",
      "amtsgericht": "Amtsgericht Aurich",
      "registernummer": "HRB 205720",
      "registerart": "HRB",
      "company_name": "Eisenhauer Invest GmbH",
      "company_seat": "Schweindorf",
      "details": "04.11.2024 (Bekanntmachungsdatum)\n\nNiedersachsen Amtsgericht Aurich HRB 205720\nRegisterbekanntmachung nach dem Umwandlungsgesetz 04.11.2024 (Eintragungsdatum)\n\nEisenhauer Invest GmbH\nGesellschaft mit beschränkter Haftung\nSchweindorf\n\nDen Gläubigern der an der Verschmelzung beteiligten Rechtsträger ist, wenn sie binnen sechs Monaten nach dem Tag, an dem die Eintragung der Verschmelzung in das Register des Sitzes desjenigen Rechtsträgers, dessen Gläubiger sie sind, nach § 19  Abs.  3 UmwG als bekannt gemacht gilt, ihren Anspruch nach Grund und Höhe schriftlich anmelden, Sicherheit zu leisten, soweit sie nicht Befriedigung verlangen können. Dieses Recht steht den Gläubigern jedoch nur zu, wenn sie glaubhaft machen, dass durch die Verschmelzung die Erfüllung der Forderung gefährdet wird."
    },
    {
      "date": "2024-11-04",
      "id": "92441",
      "original_text": "Registerbekanntmachung nach dem Umwandlungsgesetz\nNiedersachsen Amtsgericht Oldenburg (Oldenburg) HRB 208225\nHöffmann Schulreisen GmbH – Vechta",
      "type": "Registerbekanntmachung nach dem Umwandlungsgesetz",
      "state": "Niedersachsen",
      "amtsgericht": "Amtsgericht Oldenburg (Oldenburg)",
      "registernummer": "HRB 208225",
      "registerart": "HRB",
      "company_name": "Höffmann Schulreisen GmbH",
      "company_seat": "Vechta",
      "details": "04.11.2024 (Bekanntmachungsdatum)\n\nNiedersachsen Amtsgericht Oldenburg (Oldenburg) HRB 208225\nRegisterbekanntmachung nach dem Umwandlungsgesetz 04.11.2024 (Eintragungsdatum)\n\nHöffmann Schulreisen GmbH\nGesellschaft mit beschränkter Haftung\nVechta\n\nDen Gläubigern der an der Verschmelzung beteiligten Rechtsträger ist, wenn sie binnen sechs Monaten nach dem Tag, an dem die Eintragung der Verschmelzung in das Register des Sitzes desjenigen Rechtsträgers, dessen Gläubiger sie sind, nach § 19  Abs.  3 UmwG als bekannt gemacht gilt, ihren Anspruch nach Grund und Höhe schriftlich anmelden, Sicherheit zu leisten, soweit sie nicht Befriedigung verlangen können. Dieses Recht steht den Gläubigern jedoch nur zu, wenn sie glaubhaft machen, dass durch die Verschmelzung die Erfüllung der Forderung gefährdet wird."
    },
    {
      "date": "2024-11-04",
      "id": "92442",
      "original_text": "Registerbekanntmachung nach dem Umwandlungsgesetz\nNiedersachsen Amtsgericht Oldenburg (Oldenburg) HRB 214854\nHöffmann Fernreisen GmbH – Vechta",
      "type": "Registerbekanntmachung nach dem Umwandlungsgesetz",
      "state": "Niedersachsen",
      "amtsgericht": "Amtsgericht Oldenburg (Oldenburg)",
      "registernummer": "HRB 214854",
      "registerart": "HRB",
      "company_name": "Höffmann Fernreisen GmbH",
      "company_seat": "Vechta",
      "details": "04.11.2024 (Bekanntmachungsdatum)\n\nNiedersachsen Amtsgericht Oldenburg (Oldenburg) HRB 214854\nRegisterbekanntmachung nach dem Umwandlungsgesetz 04.11.2024 (Eintragungsdatum)\n\nHöffmann Fernreisen GmbH\nGesellschaft mit beschränkter Haftung\nVechta\n\nDen Gläubigern der an der Verschmelzung beteiligten Rechtsträger ist, wenn sie binnen sechs Monaten nach dem Tag, an dem die Eintragung der Verschmelzung in das Register des Sitzes desjenigen Rechtsträgers, dessen Gläubiger sie sind, nach § 19  Abs.  3 UmwG als bekannt gemacht gilt, ihren Anspruch nach Grund und Höhe schriftlich anmelden, Sicherheit zu leisten, soweit sie nicht Befriedigung verlangen können. Dieses Recht steht den Gläubigern jedoch nur zu, wenn sie glaubhaft machen, dass durch die Verschmelzung die Erfüllung der Forderung gefährdet wird."
    },
    {
      "date": "2024-11-04",
      "id": "92443",
      "original_text": "Registerbekanntmachung nach dem Umwandlungsgesetz\nNiedersachsen Amtsgericht Oldenburg (Oldenburg) HRB 214801\nHöffmann Kreuzfahrten GmbH – Vechta",
      "type": "Registerbekanntmachung nach dem Umwandlungsgesetz",
      "state": "Niedersachsen",
      "amtsgericht": "Amtsgericht Oldenburg (Oldenburg)",
      "registernummer": "HRB 214801",
      "registerart": "HRB",
      "company_name": "Höffmann Kreuzfahrten GmbH",
      "company_seat": "Vechta",
      "details": "04.11.2024 (Bekanntmachungsdatum)\n\nNiedersachsen Amtsgericht Oldenburg (Oldenburg) HRB 214801\nRegisterbekanntmachung nach dem Umwandlungsgesetz 04.11.2024 (Eintragungsdatum)\n\nHöffmann Kreuzfahrten GmbH\nGesellschaft mit beschränkter Haftung\nVechta\n\nDen Gläubigern der an der Verschmelzung beteiligten Rechtsträger ist, wenn sie binnen sechs Monaten nach dem Tag, an dem die Eintragung der Verschmelzung in das Register des Sitzes desjenigen Rechtsträgers, dessen Gläubiger sie sind, nach § 19  Abs.  3 UmwG als bekannt gemacht gilt, ihren Anspruch nach Grund und Höhe schriftlich anmelden, Sicherheit zu leisten, soweit sie nicht Befriedigung verlangen können. Dieses Recht steht den Gläubigern jedoch nur zu, wenn sie glaubhaft machen, dass durch die Verschmelzung die Erfüllung der Forderung gefährdet wird."
    },
    {
      "date": "2024-11-04",
      "id": "92444",
      "original_text": "Registerbekanntmachung nach dem Umwandlungsgesetz\nNiedersachsen Amtsgericht Oldenburg (Oldenburg) HRB 215306\nHöffmann Touristik Oldenburg GmbH – Oldenburg",
      "type": "Registerbekanntmachung nach dem Umwandlungsgesetz",
      "state": "Niedersachsen",
      "amtsgericht": "Amtsgericht Oldenburg (Oldenburg)",
      "registernummer": "HRB 215306",
      "registerart": "HRB",
      "company_name": "Höffmann Touristik Oldenburg GmbH",
      "company_seat": "Oldenburg",
      "details": "04.11.2024 (Bekanntmachungsdatum)\n\nNiedersachsen Amtsgericht Oldenburg (Oldenburg) HRB 215306\nRegisterbekanntmachung nach dem Umwandlungsgesetz 04.11.2024 (Eintragungsdatum)\n\nHöffmann Touristik Oldenburg GmbH\nGesellschaft mit beschränkter Haftung\nOldenburg\n\nDen Gläubigern der an der Verschmelzung beteiligten Rechtsträger ist, wenn sie binnen sechs Monaten nach dem Tag, an dem die Eintragung der Verschmelzung in das Register des Sitzes desjenigen Rechtsträgers, dessen Gläubiger sie sind, nach § 19  Abs.  3 UmwG als bekannt gemacht gilt, ihren Anspruch nach Grund und Höhe schriftlich anmelden, Sicherheit zu leisten, soweit sie nicht Befriedigung verlangen können. Dieses Recht steht den Gläubigern jedoch nur zu, wenn sie glaubhaft machen, dass durch die Verschmelzung die Erfüllung der Forderung gefährdet wird."
    },
    {
      "date": "2024-11-04",
      "id": "92445",
      "original_text": "Registerbekanntmachung nach dem Umwandlungsgesetz\nNiedersachsen Amtsgericht Oldenburg (Oldenburg) HRB 217918\nHöffmann Jugendreisen GmbH – Vechta",
      "type": "Registerbekanntmachung nach dem Umwandlungsgesetz",
      "state": "Niedersachsen",
      "amtsgericht": "Amtsgericht Oldenburg (Oldenburg)",
      "registernummer": "HRB 217918",
      "registerart": "HRB",
      "company_name": "Höffmann Jugendreisen GmbH",
      "company_seat": "Vechta",
      "details": "04.11.2024 (Bekanntmachungsdatum)\n\nNiedersachsen Amtsgericht Oldenburg (Oldenburg) HRB 217918\nRegisterbekanntmachung nach dem Umwandlungsgesetz 04.11.2024 (Eintragungsdatum)\n\nHöffmann Jugendreisen GmbH\nGesellschaft mit beschränkter Haftung\nVechta\n\nDen Gläubigern der an der Verschmelzung beteiligten Rechtsträger ist, wenn sie binnen sechs Monaten nach dem Tag, an dem die Eintragung der Verschmelzung in das Register des Sitzes desjenigen Rechtsträgers, dessen Gläubiger sie sind, nach § 19  Abs.  3 UmwG als bekannt gemacht gilt, ihren Anspruch nach Grund und Höhe schriftlich anmelden, Sicherheit zu leisten, soweit sie nicht Befriedigung verlangen können. Dieses Recht steht den Gläubigern jedoch nur zu, wenn sie glaubhaft machen, dass durch die Verschmelzung die Erfüllung der Forderung gefährdet wird."
    },
    {
      "date": "2024-11-04",
      "id": "92446",
      "original_text": "Einreichung neuer Dokumente\nBaden-Württemberg Amtsgericht Freiburg HRB 590480\nKrankenhaus Stockach GmbH – Stockach",
      "type": "Einreichung neuer Dokumente",
      "state": "Baden-Württemberg",
      "amtsgericht": "Amtsgericht Freiburg",
      "registernummer": "HRB 590480",
      "registerart": "HRB",
      "company_name": "Krankenhaus Stockach GmbH",
      "company_seat": "Stockach",
      "details": "04.11.2024 (Bekanntmachungsdatum)\n\nBaden-Württemberg Amtsgericht Freiburg HRB 590480\nEinreichung neuer Dokumente\n\nKrankenhaus Stockach GmbH\nGesellschaft mit beschränkter Haftung\nStockach\n\nDie Gesellschaft hat am 30.10.2024 die Liste über die Zusammensetzung des Aufsichtsrats zum Handelsregister eingereicht."
    },
    {
      "date": "2024-11-04",
      "id": "92447",
      "original_text": "Registerbekanntmachung nach dem Umwandlungsgesetz\nRheinland-Pfalz Amtsgericht Koblenz HRB 25321\nCGM Mobile Services GmbH – Koblenz",
      "type": "Registerbekanntmachung nach dem Umwandlungsgesetz",
      "state": "Rheinland-Pfalz",
      "amtsgericht": "Amtsgericht Koblenz",
      "registernummer": "HRB 25321",
      "registerart": "HRB",
      "company_name": "CGM Mobile Services GmbH",
      "company_seat": "Koblenz",
      "details": "04.11.2024 (Bekanntmachungsdatum)\n\nRheinland-Pfalz Amtsgericht Koblenz HRB 25321\nRegisterbekanntmachung nach dem Umwandlungsgesetz 04.11.2024 (Eintragungsdatum)\n\nCGM Mobile Services GmbH\nGesellschaft mit beschränkter Haftung\nKoblenz\n\nAls nicht eingetragen wird veröffentlicht: Den Gläubigern der an der Verschmelzung beteiligten Rechtsträger ist, wenn sie binnen sechs Monaten nach dem Tag, an dem die Eintragung der Verschmelzung in das Register des Sitzes desjenigen Rechtsträgers,dessen Gläubiger sie sind, nach § 19 Abs. 3 UmwG als bekannt gemacht gilt, ihren Anspruch nach Grund und Höhe schriftlich anmelden, Sicherheit zu leisten, soweit sie nicht Befriedigung verlangen können. Dieses Recht steht den Gläubigern jedoch nur zu, wenn sie glaubhaft machen, dass durch die Verschmelzung die Erfüllungd er Forderung gefährdet wird."
    },
    {
      "date": "2024-11-04",
      "id": "92448",
      "original_text": "Einreichung neuer Dokumente\nBremen Amtsgericht Bremen HRB 22141\nGESTRA AG – Bremen",
      "type": "Einreichung neuer Dokumente",
      "state": "Bremen",
      "amtsgericht": "Amtsgericht Bremen",
      "registernummer": "HRB 22141",
      "registerart": "HRB",
      "company_name": "GESTRA AG",
      "company_seat": "Bremen",
      "details": "04.11.2024 (Bekanntmachungsdatum)\n\nBremen Amtsgericht Bremen HRB 22141\nEinreichung neuer Dokumente\n\nGESTRA AG\nAktiengesellschaft\nBremen\n\nAls nicht eingetragen wird bekannt gemacht: Liste des Aufsichtsrats wurde eingereicht."
    },
    {
      "date": "2024-11-04",
      "id": "92449",
      "original_text": "Löschungsankündigung\nNordrhein-Westfalen Amtsgericht Düsseldorf HRB 83415\nMJ Metals International GmbH – Düsseldorf",
      "type": "Löschungsankündigung",
      "state": "Nordrhein-Westfalen",
      "amtsgericht": "Amtsgericht Düsseldorf",
      "registernummer": "HRB 83415",
      "registerart": "HRB",
      "company_name": "MJ Metals International GmbH",
      "company_seat": "Düsseldorf",
      "details": "04.11.2024 (Bekanntmachungsdatum)\n\nNordrhein-Westfalen Amtsgericht Düsseldorf HRB 83415\nLöschungsankündigung\n\nMJ Metals International GmbH\nGesellschaft mit beschränkter Haftung\nDüsseldorf\n\nBetr.: MJ Metals International GmbH, Grugaplatz 2-4, 45131 Essen (Sitz Düsseldorf)\n\nDas Registergericht beabsichtigt die Gesellschaft von Amts wegen nach § 394 FamFG zu löschen. Die Frist zur Erhebung eines Widerspruchs ist auf 3 Wochen festgesetzt.\n\nRechtsbehelfsbelehrung:\n\nDas Widerspruchsrecht steht jedem zu, der an der Unterlassung der Löschung ein berechtigtes Interesse hat. Der Widerspruch ist bei dem Amtsgericht Düsseldorf -Registergericht-, Werdener Straße 1, 40227 Düsseldorf schriftlich in deutscher Sprache oder zur Niederschrift der Geschäftsstelle einzulegen. Der Widerspruch kann auch zur Niederschrift der Geschäftsstelle eines jeden Amtsgerichtes abgegeben werden. Die Einlegung ist auch durch Übertragung eines elektronischen Dokuments an die elektronische Poststelle des Gerichts möglich. Das elektronische Dokument muss für die Bearbeitung durch das Gericht geeignet und mit einer qualifizierten elektronischen Signatur der verantwortenden Person versehen sein oder von der verantwortenden Person signiert und auf einem sicheren Übermittlungsweg gemäß § 130a ZPO nach näherer Maßgabe der Verordnung über die technischen Rahmenbedingungen des elektronischen Rechtsverkehrs und über das besondere elektronische Behördenpostfach (BGBl. I, S.3803) eingereicht werden. Weitere Informationen erhalten Sie auf der Internetseite www.justiz.de.\nDer Widerspruch muss spätestens innerhalb der gesetzten Frist nach dem Datum der Bekanntmachung der Löschungsankündigung bei dem Amtsgericht - Registergericht - Düsseldorf eingegangen sein.  Dies gilt auch dann, wenn der Widerspruch zur Niederschrift der Geschäftsstelle eines anderen Amtsgerichtes abgegeben wurde. Die Frist beginnt mit dem Tage der Bekanntmachung der Löschungsankündigung in dem für die Bekanntmachung der Eintragungen in das Handelsregister bestimmten elektronischen Informations- und Kommunikationssystem nach § 10 des Handelsgesetzbuches. Fällt das Ende der Frist auf einen Sonntag, einen allgemeinen Feiertag oder Sonnabend, so endet die Frist mit Ablauf des nächsten Werktages.\nDer Widerspruch muss die Bezeichnung der angefochtenen Löschungsankündigung sowie die Erklärung enthalten, dass Widerspruch gegen diese Löschungsankündigung eingelegt wird. Er ist zu unterzeichnen und soll begründet werden."
    },
    {
      "date": "2024-11-04",
      "id": "92450",
      "original_text": "Einreichung neuer Dokumente\nNordrhein-Westfalen Amtsgericht Bad Oeynhausen HRB 12643\nDB Systemtechnik GmbH – Minden",
      "type": "Einreichung neuer Dokumente",
      "state": "Nordrhein-Westfalen",
      "amtsgericht": "Amtsgericht Bad Oeynhausen",
      "registernummer": "HRB 12643",
      "registerart": "HRB",
      "company_name": "DB Systemtechnik GmbH",
      "company_seat": "Minden",
      "details": "04.11.2024 (Bekanntmachungsdatum)\n\nNordrhein-Westfalen Amtsgericht Bad Oeynhausen HRB 12643\nEinreichung neuer Dokumente\n\nDB Systemtechnik GmbH\nGesellschaft mit beschränkter Haftung\nMinden\n\nDem Registergericht ist eine neue Liste der Mitglieder des Aufsichtsrates eingereicht worden."
    },
    {
      "date": "2024-11-04",
      "id": "92451",
      "original_text": "Löschungsankündigung\nNordrhein-Westfalen Amtsgericht Siegburg HRB 2938\n\"Fiore rosso\", Blumen, Textilien, Geschenke, Handelsgesellschaft mbH – Eitorf",
      "type": "Löschungsankündigung",
      "state": "Nordrhein-Westfalen",
      "amtsgericht": "Amtsgericht Siegburg",
      "registernummer": "HRB 2938",
      "registerart": "HRB",
      "company_name": "\"Fiore rosso\", Blumen, Textilien, Geschenke, Handelsgesellschaft mbH",
      "company_seat": "Eitorf",
      "details": "04.11.2024 (Bekanntmachungsdatum)\n\nNordrhein-Westfalen Amtsgericht Siegburg HRB 2938\nLöschungsankündigung\n\n\"Fiore rosso\", Blumen, Textilien, Geschenke, Handelsgesellschaft mbH\nGesellschaft mit beschränkter Haftung\nEitorf\n\nDas Registergericht hat glaubhafte Kenntnis erlangt, dass die Gesellschaft vermögenslos geworden ist, da ein Insolvenzverfahren durchgeführt und nach § 200 InsO aufgehoben wurde.\n\nEs ist daher beabsichtigt, die Gesellschaft nach § 394 FamFG im Handelsregister wegen Vermögenslosigkeit zu löschen.\nEinwände gegen die Löschung sind durch Widerspruch binnen einer Frist von 3 Monaten geltend zu machen, andernfalls die Löschung erfolgen wird.\n\nEinzulegen ist der Widerspruch bei dem Amtsgericht Siegburg, Neue Poststraße 16, 53721 Siegburg, und zwar entweder schriftlich in deutscher Sprache oder mündlich zur Niederschrift der Geschäftsstelle. Der Widerspruch kann auch zur Niederschrift der Geschäftsstelle eines jeden Amtsgerichts abgegeben werden. Der Widerspruch ist binnen der in der Verfügung bestimmten Frist einzulegen. Die Frist ist nur gewahrt, wenn der Widerspruch rechtzeitig bei dem Amtsgericht Siegburg eingeht, auch wenn der Widerspruch zur Niederschrift der Geschäftsstelle eines anderen Amtsgerichts abgegeben wurde. Die Frist beginnt jeweils mit der schriftlichen Bekanntgabe der Verfügung an die Beteiligten. Kann die schriftliche Bekanntgabe an einen Beteiligten nicht bewirkt werden, beginnt die Frist spätestens mit Ablauf von fünf Monaten nach Erlass der Verfügung. Die Bekanntgabe ist entweder durch Zustellung oder am dritten Tage nach Aufgabe zur Post bewirkt. Sofern die Löschung noch nicht erfolgt ist, kann der Widerspruch auch noch nach Ablauf der Frist eingelegt werden. Fällt das Ende der Frist auf einen Sonnabend, einen Sonntag oder einen allgemeinen Feiertag, endet die Frist mit Ablauf des nächsten Werktages. Der Widerspruch ist zu unterzeichnen. Eine Begründung des Widerspruchs ist nicht vorgeschrieben."
    },
    {
      "date": "2024-11-04",
      "id": "92452",
      "original_text": "Löschungsankündigung\nNordrhein-Westfalen Amtsgericht Dortmund HRB 30483\nJJ's Sicherheits Akademy GmbH – Dortmund",
      "type": "Löschungsankündigung",
      "state": "Nordrhein-Westfalen",
      "amtsgericht": "Amtsgericht Dortmund",
      "registernummer": "HRB 30483",
      "registerart": "HRB",
      "company_name": "JJ's Sicherheits Akademy GmbH",
      "company_seat": "Dortmund",
      "details": "04.11.2024 (Bekanntmachungsdatum)\n\nNordrhein-Westfalen Amtsgericht Dortmund HRB 30483\nLöschungsankündigung\n\nJJ's Sicherheits Akademy GmbH\nGesellschaft mit beschränkter Haftung\nDortmund\n\nDas Registergericht beabsichtigt die Gesellschaft von Amts wegen nach § 394 FamFG zu löschen. Die Frist zur Erhebung eines Widerspruchs ist auf zwei Monate festgesetzt."
    },
    {
      "date": "2024-11-04",
      "id": "92453",
      "original_text": "Löschungsankündigung\nNordrhein-Westfalen Amtsgericht Köln HRB 111676\nLI-YOUTH Trading UG (haftungsbeschränkt) – Köln",
      "type": "Löschungsankündigung",
      "state": "Nordrhein-Westfalen",
      "amtsgericht": "Amtsgericht Köln",
      "registernummer": "HRB 111676",
      "registerart": "HRB",
      "company_name": "LI-YOUTH Trading UG (haftungsbeschränkt)",
      "company_seat": "Köln",
      "details": "04.11.2024 (Bekanntmachungsdatum)\n\nNordrhein-Westfalen Amtsgericht Köln HRB 111676\nLöschungsankündigung\n\nLI-YOUTH Trading UG (haftungsbeschränkt)\nGesellschaft mit beschränkter Haftung\nKöln\n\nDas Registergericht beabsichtigt die Gesellschaft von Amts wegen nach § 394 FamFG zu löschen. Die Frist zur Erhebung eines Widerspruchs ist auf einen Monat festgesetzt."
    },
    {
      "date": "2024-11-04",
      "id": "92454",
      "original_text": "Löschungsankündigung\nNordrhein-Westfalen Amtsgericht Dortmund HRB 34114\nkritik-gestalten UG (haftungsbeschränkt) – Dortmund",
      "type": "Löschungsankündigung",
      "state": "Nordrhein-Westfalen",
      "amtsgericht": "Amtsgericht Dortmund",
      "registernummer": "HRB 34114",
      "registerart": "HRB",
      "company_name": "kritik-gestalten UG (haftungsbeschränkt)",
      "company_seat": "Dortmund",
      "details": "04.11.2024 (Bekanntmachungsdatum)\n\nNordrhein-Westfalen Amtsgericht Dortmund HRB 34114\nLöschungsankündigung\n\nkritik-gestalten UG (haftungsbeschränkt)\nGesellschaft mit beschränkter Haftung\nDortmund\n\nDas Registergericht beabsichtigt die Gesellschaft von Amts wegen nach § 394 FamFG zu löschen. Die Frist zur Erhebung eines Widerspruchs ist auf zwei Monate festgesetzt."
    },
    {
      "date": "2024-11-04",
      "id": "92455",
      "original_text": "Registerbekanntmachung nach dem Umwandlungsgesetz\nNordrhein-Westfalen Amtsgericht Iserlohn HRB 10805\nKIRCHHOFF Geschäftsführung AG – Iserlohn",
      "type": "Registerbekanntmachung nach dem Umwandlungsgesetz",
      "state": "Nordrhein-Westfalen",
      "amtsgericht": "Amtsgericht Iserlohn",
      "registernummer": "HRB 10805",
      "registerart": "HRB",
      "company_name": "KIRCHHOFF Geschäftsführung AG",
      "company_seat": "Iserlohn",
      "details": "04.11.2024 (Bekanntmachungsdatum)\n\nNordrhein-Westfalen Amtsgericht Iserlohn HRB 10805\nRegisterbekanntmachung nach dem Umwandlungsgesetz 23.10.2024 (Eintragungsdatum)\n\nKIRCHHOFF Geschäftsführung AG\nAktiengesellschaft\nIserlohn\n\nDen Gläubigern der an der Verschmelzung beteiligten Rechtsträger ist, wenn sie binnen sechs Monaten nach dem Tag, an dem die Eintragung der Verschmelzung in das Register des Sitzes desjenigen Rechtsträgers, dessen Gläubiger sie sind, nach § 19 Absatz 3 UmwG als bekanntgemacht gilt, ihren Anspruch nach Grund und Höhe schriftlich anmelden, Sicherheit zu leisten, soweit sie nicht Befriedigung verlangen können. Dieses Recht steht den Gläubigern jedoch nur zu, wenn sie glaubhaft machen, dass durch die Verschmelzung die Erfüllung ihrer Forderung gefährdet wird."
    },
    {
      "date": "2024-11-04",
      "id": "92456",
      "original_text": "Löschungsankündigung\nNordrhein-Westfalen Amtsgericht Dortmund HRB 35694\nVapeKönig UG (haftungsbeschränkt) – Dortmund",
      "type": "Löschungsankündigung",
      "state": "Nordrhein-Westfalen",
      "amtsgericht": "Amtsgericht Dortmund",
      "registernummer": "HRB 35694",
      "registerart": "HRB",
      "company_name": "VapeKönig UG (haftungsbeschränkt)",
      "company_seat": "Dortmund",
      "details": "04.11.2024 (Bekanntmachungsdatum)\n\nNordrhein-Westfalen Amtsgericht Dortmund HRB 35694\nLöschungsankündigung\n\nVapeKönig UG (haftungsbeschränkt)\nGesellschaft mit beschränkter Haftung\nDortmund\n\nDas Registergericht beabsichtigt die Gesellschaft von Amts wegen nach § 394 FamFG zu löschen. Die Frist zur Erhebung eines Widerspruchs ist auf zwei Monate festgesetzt."
    },
    {
      "date": "2024-11-04",
      "id": "92457",
      "original_text": "Löschungsankündigung\nNordrhein-Westfalen Amtsgericht Dortmund HRB 28465\nADcompo Verwaltung UG (haftungsbeschränkt) – Dortmund",
      "type": "Löschungsankündigung",
      "state": "Nordrhein-Westfalen",
      "amtsgericht": "Amtsgericht Dortmund",
      "registernummer": "HRB 28465",
      "registerart": "HRB",
      "company_name": "ADcompo Verwaltung UG (haftungsbeschränkt)",
      "company_seat": "Dortmund",
      "details": "04.11.2024 (Bekanntmachungsdatum)\n\nNordrhein-Westfalen Amtsgericht Dortmund HRB 28465\nLöschungsankündigung\n\nADcompo Verwaltung UG (haftungsbeschränkt)\nGesellschaft mit beschränkter Haftung\nDortmund\n\nDas Registergericht beabsichtigt die Gesellschaft von Amts wegen nach § 394 FamFG zu löschen. Die Frist zur Erhebung eines Widerspruchs ist auf zwei Monate festgesetzt."
    },
    {
      "date": "2024-11-04",
      "id": "92458",
      "original_text": "Registerbekanntmachung nach dem Umwandlungsgesetz\nNordrhein-Westfalen Amtsgericht Essen HRA 11767\nAndreas Häuser e. K. – Essen",
      "type": "Registerbekanntmachung nach dem Umwandlungsgesetz",
      "state": "Nordrhein-Westfalen",
      "amtsgericht": "Amtsgericht Essen",
      "registernummer": "HRA 11767",
      "registerart": "HRA",
      "company_name": "Andreas Häuser e. K.",
      "company_seat": "Essen",
      "details": "04.11.2024 (Bekanntmachungsdatum)\n\nNordrhein-Westfalen Amtsgericht Essen HRA 11767\nRegisterbekanntmachung nach dem Umwandlungsgesetz 04.11.2024 (Eintragungsdatum)\n\nAndreas Häuser e. K.\nEinzelkaufmann / Einzelkauffrau\nEssen\n\nDen Gläubigern der an der Ausgliederung beteiligten Rechtsträger ist, wenn sie binnen sechs Monaten nach dem Tag, an dem die Eintragung der Ausgliederung in das Register des Sitzes desjenigen Rechtsträgers, dessen Gläubiger sie sind, nach § 19 Absatz 3 UmwG als bekanntgemacht gilt, ihren Anspruch nach Grund und Höhe schriftlich anmelden, Sicherheit zu leisten, soweit sie nicht Befriedigung verlangen können. Dieses Recht steht den Gläubigern jedoch nur zu, wenn sie glaubhaft machen, dass durch die Ausgliederung die Erfüllung ihrer Forderung gefährdet wird."
    },
    {
      "date": "2024-11-04",
      "id": "92459",
      "original_text": "Löschungsankündigung\nNordrhein-Westfalen Amtsgericht Dortmund HRB 30324\nPinkyP GmbH – Dortmund",
      "type": "Löschungsankündigung",
      "state": "Nordrhein-Westfalen",
      "amtsgericht": "Amtsgericht Dortmund",
      "registernummer": "HRB 30324",
      "registerart": "HRB",
      "company_name": "PinkyP GmbH",
      "company_seat": "Dortmund",
      "details": "04.11.2024 (Bekanntmachungsdatum)\n\nNordrhein-Westfalen Amtsgericht Dortmund HRB 30324\nLöschungsankündigung\n\nPinkyP GmbH\nGesellschaft mit beschränkter Haftung\nDortmund\n\nDas Registergericht beabsichtigt die Gesellschaft von Amts wegen nach § 394 FamFG zu löschen. Die Frist zur Erhebung eines Widerspruchs ist auf zwei Monate festgesetzt."
    },
    {
      "date": "2024-11-04",
      "id": "92460",
      "original_text": "Einreichung neuer Dokumente\nNordrhein-Westfalen Amtsgericht Bochum HRB 16476\nCenter for Advanced Internet Studies (CAIS) gemeinnützige GmbH – Bochum",
      "type": "Einreichung neuer Dokumente",
      "state": "Nordrhein-Westfalen",
      "amtsgericht": "Amtsgericht Bochum",
      "registernummer": "HRB 16476",
      "registerart": "HRB",
      "company_name": "Center for Advanced Internet Studies (CAIS) gemeinnützige GmbH",
      "company_seat": "Bochum",
      "details": "04.11.2024 (Bekanntmachungsdatum)\n\nNordrhein-Westfalen Amtsgericht Bochum HRB 16476\nEinreichung neuer Dokumente 29.10.2024 (Eintragungsdatum)\n\nCenter for Advanced Internet Studies (CAIS) gemeinnützige GmbH\nGesellschaft mit beschränkter Haftung\nBochum\n\nDem Registergericht ist eine Liste der Mitglieder des Aufsichtsrates eingereicht worden."
    },
    {
      "date": "2024-11-04",
      "id": "92461",
      "original_text": "Registerbekanntmachung nach dem Umwandlungsgesetz\nNordrhein-Westfalen Amtsgericht Köln HRB 74934\nBeRdex Trans GmbH – Bergheim",
      "type": "Registerbekanntmachung nach dem Umwandlungsgesetz",
      "state": "Nordrhein-Westfalen",
      "amtsgericht": "Amtsgericht Köln",
      "registernummer": "HRB 74934",
      "registerart": "HRB",
      "company_name": "BeRdex Trans GmbH",
      "company_seat": "Bergheim",
      "details": "04.11.2024 (Bekanntmachungsdatum)\n\nNordrhein-Westfalen Amtsgericht Köln HRB 74934\nRegisterbekanntmachung nach dem Umwandlungsgesetz 04.11.2024 (Eintragungsdatum)\n\nBeRdex Trans GmbH\nGesellschaft mit beschränkter Haftung\nBergheim\n\nDen Gläubigern der an der Verschmelzung beteiligten Rechtsträger ist, wenn sie binnen sechs Monaten nach dem Tag, an dem die Eintragung der Verschmelzung in das Register des Sitzes desjenigen Rechtsträgers, dessen Gläubiger sie sind, nach § 19 Absatz 3 UmwG als bekanntgemacht gilt, ihren Anspruch nach Grund und Höhe schriftlich anmelden, Sicherheit zu leisten, soweit sie nicht Befriedigung verlangen können. Dieses Recht steht den Gläubigern jedoch nur zu, wenn sie glaubhaft machen, dass durch die Verschmelzung die Erfüllung ihrer Forderung gefährdet wird."
    },
    {
      "date": "2024-11-04",
      "id": "92462",
      "original_text": "Registerbekanntmachung nach dem Umwandlungsgesetz\nNordrhein-Westfalen Amtsgericht Dortmund HRA 19659\nGeorg UG (haftungsbeschränkt) & Co. KG – Werne",
      "type": "Registerbekanntmachung nach dem Umwandlungsgesetz",
      "state": "Nordrhein-Westfalen",
      "amtsgericht": "Amtsgericht Dortmund",
      "registernummer": "HRA 19659",
      "registerart": "HRA",
      "company_name": "Georg UG (haftungsbeschränkt) & Co. KG",
      "company_seat": "Werne",
      "details": "04.11.2024 (Bekanntmachungsdatum)\n\nNordrhein-Westfalen Amtsgericht Dortmund HRA 19659\nRegisterbekanntmachung nach dem Umwandlungsgesetz 04.11.2024 (Eintragungsdatum)\n\nGeorg UG (haftungsbeschränkt) & Co. KG\nKommanditgesellschaft\nWerne\n\nDen Gläubigern der an der Ausgliederung beteiligten Rechtsträger ist, wenn sie binnen sechs Monaten nach dem Tag, an dem die Eintragung der Ausgliederung in das Register des Sitzes desjenigen Rechtsträgers, dessen Gläubiger sie sind, nach § 19 Absatz 3 UmwG als bekanntgemacht gilt, ihren Anspruch nach Grund und Höhe schriftlich anmelden, Sicherheit zu leisten, soweit sie nicht Befriedigung verlangen können. Dieses Recht steht den Gläubigern jedoch nur zu, wenn sie glaubhaft machen, dass durch die Ausgliederung die Erfüllung ihrer Forderung gefährdet wird."
    },
    {
      "date": "2024-11-04",
      "id": "92463",
      "original_text": "Einreichung neuer Dokumente\nNordrhein-Westfalen Amtsgericht Essen HRB 28361\nRuhrbahn GmbH – Essen",
      "type": "Einreichung neuer Dokumente",
      "state": "Nordrhein-Westfalen",
      "amtsgericht": "Amtsgericht Essen",
      "registernummer": "HRB 28361",
      "registerart": "HRB",
      "company_name": "Ruhrbahn GmbH",
      "company_seat": "Essen",
      "details": "04.11.2024 (Bekanntmachungsdatum)\n\nNordrhein-Westfalen Amtsgericht Essen HRB 28361\nEinreichung neuer Dokumente\n\nRuhrbahn GmbH\nGesellschaft mit beschränkter Haftung\nEssen\n\nDem Registergericht ist eine neue Liste der Mitglieder des Aufsichtsrates eingereicht worden."
    },
    {
      "date": "2024-11-04",
      "id": "92464",
      "original_text": "Löschungsankündigung\nNordrhein-Westfalen Amtsgericht Düsseldorf HRB 94986\nSwgrow UG (haftungsbeschränkt) – Ratingen",
      "type": "Löschungsankündigung",
      "state": "Nordrhein-Westfalen",
      "amtsgericht": "Amtsgericht Düsseldorf",
      "registernummer": "HRB 94986",
      "registerart": "HRB",
      "company_name": "Swgrow UG (haftungsbeschränkt)",
      "company_seat": "Ratingen",
      "details": "04.11.2024 (Bekanntmachungsdatum)\n\nNordrhein-Westfalen Amtsgericht Düsseldorf HRB 94986\nLöschungsankündigung\n\nSwgrow UG (haftungsbeschränkt)\nGesellschaft mit beschränkter Haftung\nRatingen\n\nDas Registergericht beabsichtigt die Gesellschaft von Amts wegen nach § 394 Abs. 1 FamFG zu löschen. Die Frist zur Erhebung eines Widerspruchs ist auf einen Monat festgesetzt.\n\nRechtsbehelfsbelehrung:\nDas Widerspruchsrecht steht jedem zu, der an der Unterlassung der Löschung ein berechtigtes Interesse hat. Der Widerspruch ist bei dem Amtsgericht Düsseldorf -Registergericht-, Werdener Straße 1, 40227 Düsseldorf schriftlich in deutscher Sprache oder zur Niederschrift der Geschäftsstelle einzulegen. Der Widerspruch kann auch zur Niederschrift der Geschäftsstelle eines jeden Amtsgerichtes abgegeben werden. Die Einlegung ist auch durch Übertragung eines elektronischen Dokuments an die elektronische Poststelle des Gerichts möglich. Das elektronische Dokument muss für die Bearbeitung durch das Gericht geeignet und mit einer qualifizierten elektronischen Signatur der verantwortenden Person versehen sein oder von der verantwortenden Person signiert und auf einem sicheren Übermittlungsweg gemäß § 130a ZPO nach näherer Maßgabe der Verordnung über die technischen Rahmenbedingungen des elektronischen Rechtsverkehrs und über das besondere elektronische Behördenpostfach (BGBl. I, S.3803) eingereicht werden. Weitere Informationen erhalten Sie auf der Internetseite www.justiz.de.\nDer Widerspruch muss spätestens innerhalb der gesetzten Frist nach dem Datum der Bekanntmachung der Löschungsankündigung bei dem Amtsgericht - Registergericht - Düsseldorf eingegangen sein.  Dies gilt auch dann, wenn der Widerspruch zur Niederschrift der Geschäftsstelle eines anderen Amtsgerichtes abgegeben wurde. Die Frist beginnt mit dem Tage der Bekanntmachung der Löschungsankündigung in dem für die Bekanntmachung der Eintragungen in das Handelsregister bestimmten elektronischen Informations- und Kommunikationssystem nach § 10 des Handelsgesetzbuches. Fällt das Ende der Frist auf einen Sonntag, einen allgemeinen Feiertag oder Sonnabend, so endet die Frist mit Ablauf des nächsten Werktages.\nDer Widerspruch muss die Bezeichnung der angefochtenen Löschungsankündigung sowie die Erklärung enthalten, dass Widerspruch gegen diese Löschungsankündigung eingelegt wird. Er ist zu unterzeichnen und soll begründet werden."
    },
    {
      "date": "2024-11-04",
      "id": "92465",
      "original_text": "Löschungsankündigung\nNordrhein-Westfalen Amtsgericht Düsseldorf HRB 97302\nVirugo UG (haftungsbeschränkt) – Düsseldorf",
      "type": "Löschungsankündigung",
      "state": "Nordrhein-Westfalen",
      "amtsgericht": "Amtsgericht Düsseldorf",
      "registernummer": "HRB 97302",
      "registerart": "HRB",
      "company_name": "Virugo UG (haftungsbeschränkt)",
      "company_seat": "Düsseldorf",
      "details": "04.11.2024 (Bekanntmachungsdatum)\n\nNordrhein-Westfalen Amtsgericht Düsseldorf HRB 97302\nLöschungsankündigung\n\nVirugo UG (haftungsbeschränkt)\nGesellschaft mit beschränkter Haftung\nDüsseldorf\n\nDas Registergericht beabsichtigt die Gesellschaft von Amts wegen nach § 394 FamFG zu löschen. Die Frist zur Erhebung eines Widerspruchs ist auf 3 Wochen festgesetzt.\n\nRechtsbehelfsbelehrung:\nDas Widerspruchsrecht steht jedem zu, der an der Unterlassung der Löschung ein berechtigtes Interesse hat. Der Widerspruch ist bei dem Amtsgericht Düsseldorf -Registergericht-, Werdener Straße 1, 40227 Düsseldorf schriftlich in deutscher Sprache oder zur Niederschrift der Geschäftsstelle einzulegen. Der Widerspruch kann auch zur Niederschrift der Geschäftsstelle eines jeden Amtsgerichtes abgegeben werden. Die Einlegung ist auch durch Übertragung eines elektronischen Dokuments an die elektronische Poststelle des Gerichts möglich. Das elektronische Dokument muss für die Bearbeitung durch das Gericht geeignet und mit einer qualifizierten elektronischen Signatur der verantwortenden Person versehen sein oder von der verantwortenden Person signiert und auf einem sicheren Übermittlungsweg gemäß § 130a ZPO nach näherer Maßgabe der Verordnung über die technischen Rahmenbedingungen des elektronischen Rechtsverkehrs und über das besondere elektronische Behördenpostfach (BGBl. I, S.3803) eingereicht werden. Weitere Informationen erhalten Sie auf der Internetseite www.justiz.de.\nDer Widerspruch muss spätestens innerhalb der gesetzten Frist nach dem Datum der Bekanntmachung der Löschungsankündigung bei dem Amtsgericht - Registergericht - Düsseldorf eingegangen sein.  Dies gilt auch dann, wenn der Widerspruch zur Niederschrift der Geschäftsstelle eines anderen Amtsgerichtes abgegeben wurde. Die Frist beginnt mit dem Tage der Bekanntmachung der Löschungsankündigung in dem für die Bekanntmachung der Eintragungen in das Handelsregister bestimmten elektronischen Informations- und Kommunikationssystem nach § 10 des Handelsgesetzbuches. Fällt das Ende der Frist auf einen Sonntag, einen allgemeinen Feiertag oder Sonnabend, so endet die Frist mit Ablauf des nächsten Werktages.\nDer Widerspruch muss die Bezeichnung der angefochtenen Löschungsankündigung sowie die Erklärung enthalten, dass Widerspruch gegen diese Löschungsankündigung eingelegt wird. Er ist zu unterzeichnen und soll begründet werden."
    },
    {
      "date": "2024-11-04",
      "id": "92466",
      "original_text": "Registerbekanntmachung nach dem Umwandlungsgesetz\nNordrhein-Westfalen Amtsgericht Köln HRB 102541\nRadon GmbH – Bergheim",
      "type": "Registerbekanntmachung nach dem Umwandlungsgesetz",
      "state": "Nordrhein-Westfalen",
      "amtsgericht": "Amtsgericht Köln",
      "registernummer": "HRB 102541",
      "registerart": "HRB",
      "company_name": "Radon GmbH",
      "company_seat": "Bergheim",
      "details": "04.11.2024 (Bekanntmachungsdatum)\n\nNordrhein-Westfalen Amtsgericht Köln HRB 102541\nRegisterbekanntmachung nach dem Umwandlungsgesetz 04.11.2024 (Eintragungsdatum)\n\nRadon GmbH\nGesellschaft mit beschränkter Haftung\nBergheim\n\nDen Gläubigern der an der Verschmelzung beteiligten Rechtsträger ist, wenn sie binnen sechs Monaten nach dem Tag, an dem die Eintragung der Verschmelzung in das Register des Sitzes desjenigen Rechtsträgers, dessen Gläubiger sie sind, nach § 19 Absatz 3 UmwG als bekanntgemacht gilt, ihren Anspruch nach Grund und Höhe schriftlich anmelden, Sicherheit zu leisten, soweit sie nicht Befriedigung verlangen können. Dieses Recht steht den Gläubigern jedoch nur zu, wenn sie glaubhaft machen, dass durch die Verschmelzung die Erfüllung ihrer Forderung gefährdet wird."
    },
    {
      "date": "2024-11-04",
      "id": "92467",
      "original_text": "Einreichung neuer Dokumente\nNordrhein-Westfalen Amtsgericht Hagen HRB 9591\ndormakaba Holding GmbH + Co. Kommanditgesellschaft auf Aktien – Ennepetal",
      "type": "Einreichung neuer Dokumente",
      "state": "Nordrhein-Westfalen",
      "amtsgericht": "Amtsgericht Hagen",
      "registernummer": "HRB 9591",
      "registerart": "HRB",
      "company_name": "dormakaba Holding GmbH + Co. Kommanditgesellschaft auf Aktien",
      "company_seat": "Ennepetal",
      "details": "04.11.2024 (Bekanntmachungsdatum)\n\nNordrhein-Westfalen Amtsgericht Hagen HRB 9591\nEinreichung neuer Dokumente\n\ndormakaba Holding GmbH + Co. Kommanditgesellschaft auf Aktien\nKommanditgesellschaft auf Aktien\nEnnepetal\n\nDem Registergericht ist eine Liste der Mitglieder des Aufsichtsrates eingereicht worden."
    },
    {
      "date": "2024-11-04",
      "id": "92468",
      "original_text": "Einreichung neuer Dokumente\nNordrhein-Westfalen Amtsgericht Essen HRB 22760\nthyssenkrupp Materials Services GmbH – Essen",
      "type": "Einreichung neuer Dokumente",
      "state": "Nordrhein-Westfalen",
      "amtsgericht": "Amtsgericht Essen",
      "registernummer": "HRB 22760",
      "registerart": "HRB",
      "company_name": "thyssenkrupp Materials Services GmbH",
      "company_seat": "Essen",
      "details": "04.11.2024 (Bekanntmachungsdatum)\n\nNordrhein-Westfalen Amtsgericht Essen HRB 22760\nEinreichung neuer Dokumente\n\nthyssenkrupp Materials Services GmbH\nGesellschaft mit beschränkter Haftung\nEssen\n\nDem Registergericht ist eine Liste der Mitglieder des Aufsichtsrates eingereicht worden."
    },
    {
      "date": "2024-11-04",
      "id": "92469",
      "original_text": "Einreichung neuer Dokumente\nNordrhein-Westfalen Amtsgericht Essen HRB 32275\nthyssenkrupp Uhde GmbH – Essen",
      "type": "Einreichung neuer Dokumente",
      "state": "Nordrhein-Westfalen",
      "amtsgericht": "Amtsgericht Essen",
      "registernummer": "HRB 32275",
      "registerart": "HRB",
      "company_name": "thyssenkrupp Uhde GmbH",
      "company_seat": "Essen",
      "details": "04.11.2024 (Bekanntmachungsdatum)\n\nNordrhein-Westfalen Amtsgericht Essen HRB 32275\nEinreichung neuer Dokumente\n\nthyssenkrupp Uhde GmbH\nGesellschaft mit beschränkter Haftung\nEssen\n\nDem Registergericht ist eine Liste der Mitglieder des Aufsichtsrates eingereicht worden."
    },
    {
      "date": "2024-11-04",
      "id": "92470",
      "original_text": "Einreichung neuer Dokumente\nNordrhein-Westfalen Amtsgericht Bonn HRB 8184\nWohnbau Service Bonn GmbH – Bonn",
      "type": "Einreichung neuer Dokumente",
      "state": "Nordrhein-Westfalen",
      "amtsgericht": "Amtsgericht Bonn",
      "registernummer": "HRB 8184",
      "registerart": "HRB",
      "company_name": "Wohnbau Service Bonn GmbH",
      "company_seat": "Bonn",
      "details": "04.11.2024 (Bekanntmachungsdatum)\n\nNordrhein-Westfalen Amtsgericht Bonn HRB 8184\nEinreichung neuer Dokumente\n\nWohnbau Service Bonn GmbH\nGesellschaft mit beschränkter Haftung\nBonn\n\nDem Registergericht ist eine neue Liste der Mitglieder des Aufsichtsrates eingereicht worden."
    },
    {
      "date": "2024-11-04",
      "id": "92471",
      "original_text": "Einreichung neuer Dokumente\nNordrhein-Westfalen Amtsgericht Düsseldorf HRB 98685\nFinchain Capital Partners AG – Düsseldorf",
      "type": "Einreichung neuer Dokumente",
      "state": "Nordrhein-Westfalen",
      "amtsgericht": "Amtsgericht Düsseldorf",
      "registernummer": "HRB 98685",
      "registerart": "HRB",
      "company_name": "Finchain Capital Partners AG",
      "company_seat": "Düsseldorf",
      "details": "04.11.2024 (Bekanntmachungsdatum)\n\nNordrhein-Westfalen Amtsgericht Düsseldorf HRB 98685\nEinreichung neuer Dokumente\n\nFinchain Capital Partners AG\nAktiengesellschaft\nDüsseldorf\n\nDem Registergericht ist eine Liste der Mitglieder des Aufsichtsrates eingereicht worden."
    },
    {
      "date": "2024-11-04",
      "id": "92472",
      "original_text": "Löschungsankündigung\nNordrhein-Westfalen Amtsgericht Dortmund HRB 15314\nTheodor Rasche GmbH – Dortmund",
      "type": "Löschungsankündigung",
      "state": "Nordrhein-Westfalen",
      "amtsgericht": "Amtsgericht Dortmund",
      "registernummer": "HRB 15314",
      "registerart": "HRB",
      "company_name": "Theodor Rasche GmbH",
      "company_seat": "Dortmund",
      "details": "04.11.2024 (Bekanntmachungsdatum)\n\nNordrhein-Westfalen Amtsgericht Dortmund HRB 15314\nLöschungsankündigung\n\nTheodor Rasche GmbH\nGesellschaft mit beschränkter Haftung\nDortmund\n\nDas Registergericht beabsichtigt die Gesellschaft von Amts wegen nach § 394 FamFG zu löschen. Die Frist zur Erhebung eines Widerspruchs ist auf zwei Monate festgesetzt."
    },
    {
      "date": "2024-11-04",
      "id": "92473",
      "original_text": "Registerbekanntmachung nach dem Umwandlungsgesetz\nNordrhein-Westfalen Amtsgericht Köln HRB 120703\ncompetence exclusive ec GmbH – Bedburg",
      "type": "Registerbekanntmachung nach dem Umwandlungsgesetz",
      "state": "Nordrhein-Westfalen",
      "amtsgericht": "Amtsgericht Köln",
      "registernummer": "HRB 120703",
      "registerart": "HRB",
      "company_name": "competence exclusive ec GmbH",
      "company_seat": "Bedburg",
      "details": "04.11.2024 (Bekanntmachungsdatum)\n\nNordrhein-Westfalen Amtsgericht Köln HRB 120703\nRegisterbekanntmachung nach dem Umwandlungsgesetz 04.11.2024 (Eintragungsdatum)\n\ncompetence exclusive ec GmbH\nGesellschaft mit beschränkter Haftung\nBedburg\n\nDen Gläubigern der an der Ausgliederung beteiligten Rechtsträger ist, wenn sie binnen sechs Monaten nach dem Tag, an dem die Eintragung der Ausgliederung in das Register des Sitzes desjenigen Rechtsträgers, dessen Gläubiger sie sind, nach § 19 Absatz 3 UmwG als bekanntgemacht gilt, ihren Anspruch nach Grund und Höhe schriftlich anmelden, Sicherheit zu leisten, soweit sie nicht Befriedigung verlangen können. Dieses Recht steht den Gläubigern jedoch nur zu, wenn sie glaubhaft machen, dass durch die Ausgliederung die Erfüllung ihrer Forderung gefährdet wird."
    },
    {
      "date": "2024-11-04",
      "id": "92474",
      "original_text": "Registerbekanntmachung nach dem Umwandlungsgesetz\nHessen Amtsgericht Frankfurt am Main HRB 75566\nvon der Heydt & Co. AG – Frankfurt am Main",
      "type": "Registerbekanntmachung nach dem Umwandlungsgesetz",
      "state": "Hessen",
      "amtsgericht": "Amtsgericht Frankfurt am Main",
      "registernummer": "HRB 75566",
      "registerart": "HRB",
      "company_name": "von der Heydt & Co. AG",
      "company_seat": "Frankfurt am Main",
      "details": "04.11.2024 (Bekanntmachungsdatum)\n\nHessen Amtsgericht Frankfurt am Main HRB 75566\nRegisterbekanntmachung nach dem Umwandlungsgesetz 04.11.2024 (Eintragungsdatum)\n\nvon der Heydt & Co. AG\nAktiengesellschaft\nFrankfurt am Main\n\nDen Gläubigern der an der formwechselnden Umwandlung beteiligten Rechtsträger ist, wenn sie binnen sechs Monaten nach dem Tag, an dem die Eintragung der formwechselnden Umwandlung in das Register des Sitzes desjenigen Rechtsträgers, dessen Gläubiger sie sind, nach § 201 UmwG bekannt gemacht worden ist, ihren Anspruch nach Grund und Höhe schriftlich anmelden, Sicherheit zu leisten, soweit sie nicht Befriedigung verlangen können. Dieses Recht steht den Gläubigern jedoch nur zu, wenn sie glaubhaft machen, dass durch die formwechselnden Umwandlung die Erfüllung ihrer Forderung gefährdet wird."
    },
    {
      "date": "2024-11-04",
      "id": "92475",
      "original_text": "Löschungsankündigung\nHessen Amtsgericht Darmstadt HRB 93404\nBEK - Lampertheimer Schweißtechnik GmbH – Lampertheim",
      "type": "Löschungsankündigung",
      "state": "Hessen",
      "amtsgericht": "Amtsgericht Darmstadt",
      "registernummer": "HRB 93404",
      "registerart": "HRB",
      "company_name": "BEK - Lampertheimer Schweißtechnik GmbH",
      "company_seat": "Lampertheim",
      "details": "04.11.2024 (Bekanntmachungsdatum)\n\nHessen Amtsgericht Darmstadt HRB 93404\nLöschungsankündigung 04.11.2024 (Eintragungsdatum)\n\nBEK - Lampertheimer Schweißtechnik GmbH\nGesellschaft mit beschränkter Haftung\nLampertheim\n\nDas Registergericht beabsichtigt die im Handelsregister eingetragene Gesellschaft von Amts wegen nach § 394 FamFG zu löschen. Die Frist zur Erhebung eines Widerspruchs gegen die beabsichtigte Löschung wird auf 3 Monate festgesetzt."
    },
    {
      "date": "2024-11-04",
      "id": "92476",
      "original_text": "Einreichung neuer Dokumente\nHessen Amtsgericht Bad Homburg v.d.H. HRB 6877\nSyzygy AG – Bad Homburg v. d. Höhe",
      "type": "Einreichung neuer Dokumente",
      "state": "Hessen",
      "amtsgericht": "Amtsgericht Bad Homburg v.d.H.",
      "registernummer": "HRB 6877",
      "registerart": "HRB",
      "company_name": "Syzygy AG",
      "company_seat": "Bad Homburg v. d. Höhe",
      "details": "04.11.2024 (Bekanntmachungsdatum)\n\nHessen Amtsgericht Bad Homburg v.d.H. HRB 6877\nEinreichung neuer Dokumente 23.07.2024 (Eintragungsdatum)\n\nSyzygy AG\nAktiengesellschaft\nBad Homburg v. d. Höhe\n\nDurch eine Änderung in den Personen der Aufsichtsratsmitglieder ist eine Liste der Mitglieder des Aufsichtsrates zum Handelsregister eingereicht worden."
    },
    {
      "date": "2024-11-04",
      "id": "92477",
      "original_text": "Löschungsankündigung\nHessen Amtsgericht Frankfurt am Main HRB 93793\nFirstextile AG – Frankfurt am Main",
      "type": "Löschungsankündigung",
      "state": "Hessen",
      "amtsgericht": "Amtsgericht Frankfurt am Main",
      "registernummer": "HRB 93793",
      "registerart": "HRB",
      "company_name": "Firstextile AG",
      "company_seat": "Frankfurt am Main",
      "details": "04.11.2024 (Bekanntmachungsdatum)\n\nHessen Amtsgericht Frankfurt am Main HRB 93793\nLöschungsankündigung\n\nFirstextile AG\nAktiengesellschaft\nFrankfurt am Main\n\nDas Registergericht beabsichtigt die im Handelsregister eingetragene Gesellschaft von Amts wegen nach § 394 FamFG zu löschen. Die Frist zur Erhebung eines Widerspruchs gegen die beabsichtigte Löschung wird auf 1 Monat festgesetzt."
    },
    {
      "date": "2024-11-04",
      "id": "92478",
      "original_text": "Registerbekanntmachung nach dem Umwandlungsgesetz\nHessen Amtsgericht Gießen HRA 5496\nS. J. Immobilienbewirtschaftung e.K. – Freiensteinau",
      "type": "Registerbekanntmachung nach dem Umwandlungsgesetz",
      "state": "Hessen",
      "amtsgericht": "Amtsgericht Gießen",
      "registernummer": "HRA 5496",
      "registerart": "HRA",
      "company_name": "S. J. Immobilienbewirtschaftung e.K.",
      "company_seat": "Freiensteinau",
      "details": "04.11.2024 (Bekanntmachungsdatum)\n\nHessen Amtsgericht Gießen HRA 5496\nRegisterbekanntmachung nach dem Umwandlungsgesetz 04.11.2024 (Eintragungsdatum)\n\nS. J. Immobilienbewirtschaftung e.K.\nEinzelkaufmann / Einzelkauffrau\nFreiensteinau\n\nDen Gläubigern der an der Ausgliederung beteiligten Rechtsträger ist, wenn sie binnen sechs Monaten nach dem Tag, an dem die Eintragung der Ausgliederung in das Register des Sitzes desjenigen Rechtsträgers, dessen Gläubiger sie sind, nach §§ 125, 19 Absatz 3 UmwG bekannt gemacht worden ist, ihren Anspruch nach Grund und Höhe schriftlich anmelden, Sicherheit zu leisten, soweit sie nicht Befriedigung verlangen können. Dieses Recht steht den Gläubigern jedoch nur zu, wenn sie glaubhaft machen, dass durch die Ausgliederung die Erfüllung ihrer Forderung gefährdet wird."
    },
    {
      "date": "2024-11-04",
      "id": "92479",
      "original_text": "Registerbekanntmachung nach dem Umwandlungsgesetz\nHessen Amtsgericht Frankfurt am Main HRB 136521\nvon der Heydt & Co. Vermögensverwaltungs GmbH – Frankfurt am Main",
      "type": "Registerbekanntmachung nach dem Umwandlungsgesetz",
      "state": "Hessen",
      "amtsgericht": "Amtsgericht Frankfurt am Main",
      "registernummer": "HRB 136521",
      "registerart": "HRB",
      "company_name": "von der Heydt & Co. Vermögensverwaltungs GmbH",
      "company_seat": "Frankfurt am Main",
      "details": "04.11.2024 (Bekanntmachungsdatum)\n\nHessen Amtsgericht Frankfurt am Main HRB 136521\nRegisterbekanntmachung nach dem Umwandlungsgesetz 04.11.2024 (Eintragungsdatum)\n\nvon der Heydt & Co. Vermögensverwaltungs GmbH\nGesellschaft mit beschränkter Haftung\nFrankfurt am Main\n\nDen Gläubigern der an der formwechselnden Umwandlung beteiligten Rechtsträger ist, wenn sie binnen sechs Monaten nach dem Tag, an dem die Eintragung der formwechselnden Umwandlung in das Register des Sitzes desjenigen Rechtsträgers, dessen Gläubiger sie sind, nach § 201 UmwG bekannt gemacht worden ist, ihren Anspruch nach Grund und Höhe schriftlich anmelden, Sicherheit zu leisten, soweit sie nicht Befriedigung verlangen können. Dieses Recht steht den Gläubigern jedoch nur zu, wenn sie glaubhaft machen, dass durch die formwechselnden Umwandlung die Erfüllung ihrer Forderung gefährdet wird."
    },
    {
      "date": "2024-11-04",
      "id": "92480",
      "original_text": "Löschungsankündigung\nHessen Amtsgericht Friedberg HRB 9359\nGolden Brothers Services GmbH – Rosbach v. d. Höhe",
      "type": "Löschungsankündigung",
      "state": "Hessen",
      "amtsgericht": "Amtsgericht Friedberg",
      "registernummer": "HRB 9359",
      "registerart": "HRB",
      "company_name": "Golden Brothers Services GmbH",
      "company_seat": "Rosbach v. d. Höhe",
      "details": "04.11.2024 (Bekanntmachungsdatum)\n\nHessen Amtsgericht Friedberg HRB 9359\nLöschungsankündigung\n\nGolden Brothers Services GmbH\nGesellschaft mit beschränkter Haftung\nRosbach v. d. Höhe\n\nDas Registergericht beabsichtigt die im Handelsregister eingetragene Gesellschaft von Amts wegen nach § 394 FamFG zu löschen. Die Frist zur Erhebung eines Widerspruchs gegen die beabsichtigte Löschung wird auf 3 Monate festgesetzt."
    },
    {
      "date": "2024-11-04",
      "id": "92481",
      "original_text": "Einreichung neuer Dokumente\nHessen Amtsgericht Bad Homburg v.d.H. HRB 13051\nCarat Fonds Service Aktiengesellschaft – Oberursel (Taunus)",
      "type": "Einreichung neuer Dokumente",
      "state": "Hessen",
      "amtsgericht": "Amtsgericht Bad Homburg v.d.H.",
      "registernummer": "HRB 13051",
      "registerart": "HRB",
      "company_name": "Carat Fonds Service Aktiengesellschaft",
      "company_seat": "Oberursel (Taunus)",
      "details": "04.11.2024 (Bekanntmachungsdatum)\n\nHessen Amtsgericht Bad Homburg v.d.H. HRB 13051\nEinreichung neuer Dokumente 04.11.2024 (Eintragungsdatum)\n\nCarat Fonds Service Aktiengesellschaft\nAktiengesellschaft\nOberursel (Taunus)\n\nDurch eine Änderung in den Personen der Aufsichtsratsmitglieder ist eine Liste der Mitglieder des Aufsichtsrates zum Handelsregister eingereicht worden."
    },
    {
      "date": "2024-11-04",
      "id": "92482",
      "original_text": "Registerbekanntmachung nach dem Umwandlungsgesetz\nHessen Amtsgericht Gießen HRA 5502\nGrundeigentum Jöckel GmbH & Co. KG – Freiensteinau",
      "type": "Registerbekanntmachung nach dem Umwandlungsgesetz",
      "state": "Hessen",
      "amtsgericht": "Amtsgericht Gießen",
      "registernummer": "HRA 5502",
      "registerart": "HRA",
      "company_name": "Grundeigentum Jöckel GmbH & Co. KG",
      "company_seat": "Freiensteinau",
      "details": "04.11.2024 (Bekanntmachungsdatum)\n\nHessen Amtsgericht Gießen HRA 5502\nRegisterbekanntmachung nach dem Umwandlungsgesetz 04.11.2024 (Eintragungsdatum)\n\nGrundeigentum Jöckel GmbH & Co. KG\nKommanditgesellschaft\nFreiensteinau\n\nDen Gläubigern der an der Ausgliederung beteiligten Rechtsträger ist, wenn sie binnen sechs Monaten nach dem Tag, an dem die Eintragung der Ausgliederung in das Register des Sitzes desjenigen Rechtsträgers, dessen Gläubiger sie sind, nach §§ 125, 19 Absatz 3 UmwG bekannt gemacht worden ist, ihren Anspruch nach Grund und Höhe schriftlich anmelden, Sicherheit zu leisten, soweit sie nicht Befriedigung verlangen können. Dieses Recht steht den Gläubigern jedoch nur zu, wenn sie glaubhaft machen, dass durch die Ausgliederung die Erfüllung ihrer Forderung gefährdet wird."
    },
    {
      "date": "2024-11-04",
      "id": "92483",
      "original_text": "Löschungsankündigung\nHessen Amtsgericht Offenbach am Main HRB 49386\nTalento Europe UG (haftungsbeschränkt) – Offenbach am Main",
      "type": "Löschungsankündigung",
      "state": "Hessen",
      "amtsgericht": "Amtsgericht Offenbach am Main",
      "registernummer": "HRB 49386",
      "registerart": "HRB",
      "company_name": "Talento Europe UG (haftungsbeschränkt)",
      "company_seat": "Offenbach am Main",
      "details": "04.11.2024 (Bekanntmachungsdatum)\n\nHessen Amtsgericht Offenbach am Main HRB 49386\nLöschungsankündigung\n\nTalento Europe UG (haftungsbeschränkt)\nGesellschaft mit beschränkter Haftung\nOffenbach am Main\n\nDas Registergericht beabsichtigt die im Handelsregister eingetragene Gesellschaft von Amts wegen nach § 394 FamFG zu löschen. Die Frist zur Erhebung eines Widerspruchs gegen die beabsichtigte Löschung wird auf 3 Monate festgesetzt."
    }
  ]
}