{
  "date": "2024-11-01",
  "date_of_scrape": "2024-12-01T11:06:53.920Z",
  "tool_version": "0.2.0",
  "number_of_announcements": 70,
  "announcements": [
    {
      "date": "2024-11-01",
      "id": "92305",
      "original_text": "Registerbekanntmachung nach dem Umwandlungsgesetz\nBayern Amtsgericht München HRB 187218\nEl Estero Haftungs GmbH – München",
      "type": "Registerbekanntmachung nach dem Umwandlungsgesetz",
      "state": "Bayern",
      "amtsgericht": "Amtsgericht München",
      "registernummer": "HRB 187218",
      "registerart": "HRB",
      "company_name": "El Estero Haftungs GmbH",
      "company_seat": "München",
      "details": "01.11.2024 (Bekanntmachungsdatum)\n\nBayern Amtsgericht München HRB 187218\nRegisterbekanntmachung nach dem Umwandlungsgesetz 31.10.2024 (Eintragungsdatum)\n\nEl Estero Haftungs GmbH\nGesellschaft mit beschränkter Haftung\nMünchen\n\nBeim Handelsregister ist nach § 308 Abs. 1 Satz 1 UmwG der Entwurf des Verschmelzungsplans über die grenzüberschreitende Verschmelzung der El Estero Haftungs GmbH mit Sitz in München, Deutschland, sowie der Grit 61. Vermögensverwaltungs GmbH mit Sitz in München, Deutschland, und der Grit 62. Vermögensverwaltungs GmbH mit Sitz in München, Deutschland, alle als übertragende Rechtsträger auf die INVERSIONES CAECIUS, S.L.U. mit Sitz in Madrid, Spanien, als übernehmendem Rechtsträger, eingetragen im Gesellschaftsregister von Madrid (Registro Mercantil de Madrid) unter Band 36.007, Seite 147, Blatt M-646.981, eingereicht worden. Die Anteilsinhaber, die Gläubiger sowie die zuständigen Betriebsräte der an der grenzüberschreitenden Verschmelzung beteiligten Gesellschaften oder, soweit es keinen Betriebsrat gibt, die Arbeitnehmer der an der grenzüberschreitenden Verschmelzung beteiligten Gesellschaften, können der Gesellschaft spätestens fünf Arbeitstage vor dem Tag der Gesellschafterversammlung Bemerkungen zum Verschmelzungsplan übermitteln."
    },
    {
      "date": "2024-11-01",
      "id": "92306",
      "original_text": "Einreichung neuer Dokumente\nBayern Amtsgericht München HRB 7684\nWohnbau GmbH – München",
      "type": "Einreichung neuer Dokumente",
      "state": "Bayern",
      "amtsgericht": "Amtsgericht München",
      "registernummer": "HRB 7684",
      "registerart": "HRB",
      "company_name": "Wohnbau GmbH",
      "company_seat": "München",
      "details": "01.11.2024 (Bekanntmachungsdatum)\n\nBayern Amtsgericht München HRB 7684\nEinreichung neuer Dokumente\n\nWohnbau GmbH\nGesellschaft mit beschränkter Haftung\nMünchen\n\nDem Amtsgericht München -Registergericht- ist eine Liste der Mitglieder des Aufsichtsrats eingereicht worden, § 52 Abs. 3 S. 2 GmbHG."
    },
    {
      "date": "2024-11-01",
      "id": "92307",
      "original_text": "Registerbekanntmachung nach dem Umwandlungsgesetz\nBayern Amtsgericht Bamberg HRA 9110\nReifen-Wagner GmbH & Co. KG – Bamberg",
      "type": "Registerbekanntmachung nach dem Umwandlungsgesetz",
      "state": "Bayern",
      "amtsgericht": "Amtsgericht Bamberg",
      "registernummer": "HRA 9110",
      "registerart": "HRA",
      "company_name": "Reifen-Wagner GmbH & Co. KG",
      "company_seat": "Bamberg",
      "details": "01.11.2024 (Bekanntmachungsdatum)\n\nBayern Amtsgericht Bamberg HRA 9110\nRegisterbekanntmachung nach dem Umwandlungsgesetz 31.10.2024 (Eintragungsdatum)\n\nReifen-Wagner GmbH & Co. KG\nKommanditgesellschaft\nBamberg\n\nDen Gläubigern der an der Verschmelzung beteiligten Rechtsträger ist, wenn sie binnen sechs Monaten nach dem Tag, an dem die Eintragung der Verschmelzung in das Register des Sitzes desjenigen Rechtsträgers, dessen Gläubiger sie sind, nach § 19 Abs. 3 UmwG als bekannt gemacht gilt, ihren Anspruch nach Grund und Höhe schriftlich anmelden, Sicherheit zu leisten, soweit sie nicht Befriedigung verlangen können. Dieses Recht steht den Gläubigern jedoch nur zu, wenn sie glaubhaft machen, dass durch die Verschmelzung die Erfüllung ihrer Forderung gefährdet wird."
    },
    {
      "date": "2024-11-01",
      "id": "92308",
      "original_text": "Löschungsankündigung\nBayern Amtsgericht München HRB 215084\nStedman Stark UG (haftungsbeschränkt) – München",
      "type": "Löschungsankündigung",
      "state": "Bayern",
      "amtsgericht": "Amtsgericht München",
      "registernummer": "HRB 215084",
      "registerart": "HRB",
      "company_name": "Stedman Stark UG (haftungsbeschränkt)",
      "company_seat": "München",
      "details": "01.11.2024 (Bekanntmachungsdatum)\n\nBayern Amtsgericht München HRB 215084\nLöschungsankündigung\n\nStedman Stark UG (haftungsbeschränkt)\nGesellschaft mit beschränkter Haftung\nMünchen\n\nDas Registergericht beabsichtigt, die im Handelsregister eingetragene Gesellschaft wegen Vermögenslosigkeit von Amts wegen nach § 394 FamFG zu löschen. Die Frist zur Erhebung eines Widerspruchs ist auf drei Monate festgesetzt."
    },
    {
      "date": "2024-11-01",
      "id": "92309",
      "original_text": "Registerbekanntmachung nach dem Umwandlungsgesetz\nBayern Amtsgericht Fürth HRB 20432\nMountain30 UG (haftungsbeschränkt) – Langenzenn",
      "type": "Registerbekanntmachung nach dem Umwandlungsgesetz",
      "state": "Bayern",
      "amtsgericht": "Amtsgericht Fürth",
      "registernummer": "HRB 20432",
      "registerart": "HRB",
      "company_name": "Mountain30 UG (haftungsbeschränkt)",
      "company_seat": "Langenzenn",
      "details": "01.11.2024 (Bekanntmachungsdatum)\n\nBayern Amtsgericht Fürth HRB 20432\nRegisterbekanntmachung nach dem Umwandlungsgesetz 31.10.2024 (Eintragungsdatum)\n\nMountain30 UG (haftungsbeschränkt)\nGesellschaft mit beschränkter Haftung\nLangenzenn\n\nDen Gläubigern der an der Ausgliederung/Aufspaltung beteiligten Rechtsträger ist, wenn sie binnen sechs Monaten nach dem Tag, an dem die Eintragung der Ausgliederung/Aufspaltung in das Register des Sitzes desjenigen Rechtsträgers, dessen Gläubiger sie sind, nach §§ 125, 19 Abs. 3 UmwG als bekannt gemacht gilt, ihren Anspruch nach Grund und Höhe schriftlich anmelden, Sicherheit zu leisten, soweit sie nicht Befriedigung verlangen können. Dieses Recht steht den Gläubigern jedoch nur zu, wenn sie glaubhaft machen, dass durch die Ausgliederung/ Aufspaltung die Erfüllung ihrer Forderung gefährdet wird."
    },
    {
      "date": "2024-11-01",
      "id": "92310",
      "original_text": "Registerbekanntmachung nach dem Umwandlungsgesetz\nBayern Amtsgericht Bamberg HRA 9379\nWagner Reifenhandelsgesellschaft KG. – Bamberg",
      "type": "Registerbekanntmachung nach dem Umwandlungsgesetz",
      "state": "Bayern",
      "amtsgericht": "Amtsgericht Bamberg",
      "registernummer": "HRA 9379",
      "registerart": "HRA",
      "company_name": "Wagner Reifenhandelsgesellschaft KG.",
      "company_seat": "Bamberg",
      "details": "01.11.2024 (Bekanntmachungsdatum)\n\nBayern Amtsgericht Bamberg HRA 9379\nRegisterbekanntmachung nach dem Umwandlungsgesetz 31.10.2024 (Eintragungsdatum)\n\nWagner Reifenhandelsgesellschaft KG.\nKommanditgesellschaft\nBamberg\n\nDen Gläubigern der an der Verschmelzung beteiligten Rechtsträger ist, wenn sie binnen sechs Monaten nach dem Tag, an dem die Eintragung der Verschmelzung in das Register des Sitzes desjenigen Rechtsträgers, dessen Gläubiger sie sind, nach § 19 Abs. 3 UmwG als bekannt gemacht gilt, ihren Anspruch nach Grund und Höhe schriftlich anmelden, Sicherheit zu leisten, soweit sie nicht Befriedigung verlangen können. Dieses Recht steht den Gläubigern jedoch nur zu, wenn sie glaubhaft machen, dass durch die Verschmelzung die Erfüllung ihrer Forderung gefährdet wird."
    },
    {
      "date": "2024-11-01",
      "id": "92311",
      "original_text": "Registerbekanntmachung nach dem Umwandlungsgesetz\nBayern Amtsgericht München HRB 206358\nAdlwarth Bauen und Wohnen GmbH – Lenggries",
      "type": "Registerbekanntmachung nach dem Umwandlungsgesetz",
      "state": "Bayern",
      "amtsgericht": "Amtsgericht München",
      "registernummer": "HRB 206358",
      "registerart": "HRB",
      "company_name": "Adlwarth Bauen und Wohnen GmbH",
      "company_seat": "Lenggries",
      "details": "01.11.2024 (Bekanntmachungsdatum)\n\nBayern Amtsgericht München HRB 206358\nRegisterbekanntmachung nach dem Umwandlungsgesetz 31.10.2024 (Eintragungsdatum)\n\nAdlwarth Bauen und Wohnen GmbH\nGesellschaft mit beschränkter Haftung\nLenggries\n\nDen Gläubigern des formwechselnden Rechtsträgers ist, wenn sie binnen sechs Monaten nach dem Tag, an dem die Eintragung des Formwechsels nach § 201 UmwG als bekannt gemacht gilt, ihren Anspruch nach Grund und Höhe schriftlich anmelden, Sicherheit zu leisten, soweit sie nicht Befriedigung verlangen können. Dieses Recht steht den Gläubigern jedoch nur zu, wenn sie glaubhaft machen, dass durch den Formwechsel die Erfüllung ihrer Forderung gefährdet wird."
    },
    {
      "date": "2024-11-01",
      "id": "92312",
      "original_text": "Einreichung neuer Dokumente\nBayern Amtsgericht München HRB 158981\nPaulaner Brauerei Gruppe GmbH & Co. KGaA – München",
      "type": "Einreichung neuer Dokumente",
      "state": "Bayern",
      "amtsgericht": "Amtsgericht München",
      "registernummer": "HRB 158981",
      "registerart": "HRB",
      "company_name": "Paulaner Brauerei Gruppe GmbH & Co. KGaA",
      "company_seat": "München",
      "details": "01.11.2024 (Bekanntmachungsdatum)\n\nBayern Amtsgericht München HRB 158981\nEinreichung neuer Dokumente\n\nPaulaner Brauerei Gruppe GmbH & Co. KGaA\nKommanditgesellschaft auf Aktien\nMünchen\n\nDem Amtsgericht München -Registergericht- isteine Liste der Mitglieder des Aufsichtsrats eingereicht worden, §§ 278 Abs. 3, 106 AktG."
    },
    {
      "date": "2024-11-01",
      "id": "92313",
      "original_text": "Einreichung neuer Dokumente\nBayern Amtsgericht Memmingen HRB 17309\nBildungszentrum für Familie, Umwelt und Kultur am Kloster Roggenburg gGmbH – Roggenburg",
      "type": "Einreichung neuer Dokumente",
      "state": "Bayern",
      "amtsgericht": "Amtsgericht Memmingen",
      "registernummer": "HRB 17309",
      "registerart": "HRB",
      "company_name": "Bildungszentrum für Familie, Umwelt und Kultur am Kloster Roggenburg gGmbH",
      "company_seat": "Roggenburg",
      "details": "01.11.2024 (Bekanntmachungsdatum)\n\nBayern Amtsgericht Memmingen HRB 17309\nEinreichung neuer Dokumente\n\nBildungszentrum für Familie, Umwelt und Kultur am Kloster Roggenburg gGmbH\nGesellschaft mit beschränkter Haftung\nRoggenburg\n\nDem Amtsgericht Memmingen -Registergericht- ist eine Liste der Mitglieder des Aufsichtsrats eingereicht worden, § 52 Abs. 3 S. 2 GmbHG."
    },
    {
      "date": "2024-11-01",
      "id": "92314",
      "original_text": "Registerbekanntmachung nach dem Umwandlungsgesetz\nBayern Amtsgericht Bamberg HRB 11324\nBW Sonnenenergie Regio GmbH – Hofheim",
      "type": "Registerbekanntmachung nach dem Umwandlungsgesetz",
      "state": "Bayern",
      "amtsgericht": "Amtsgericht Bamberg",
      "registernummer": "HRB 11324",
      "registerart": "HRB",
      "company_name": "BW Sonnenenergie Regio GmbH",
      "company_seat": "Hofheim",
      "details": "01.11.2024 (Bekanntmachungsdatum)\n\nBayern Amtsgericht Bamberg HRB 11324\nRegisterbekanntmachung nach dem Umwandlungsgesetz 31.10.2024 (Eintragungsdatum)\n\nBW Sonnenenergie Regio GmbH\nGesellschaft mit beschränkter Haftung\nHofheim\n\nDen Gläubigern der an der Verschmelzung beteiligten Rechtsträger ist, wenn sie binnen sechs Monaten nach dem Tag, an dem die Eintragung der Verschmelzung in das Register des Sitzes desjenigen Rechtsträgers, dessen Gläubiger sie sind, nach § 19 Abs. 3 UmwG als bekannt gemacht gilt, ihren Anspruch nach Grund und Höhe schriftlich anmelden, Sicherheit zu leisten, soweit sie nicht Befriedigung verlangen können. Dieses Recht steht den Gläubigern jedoch nur zu, wenn sie glaubhaft machen, dass durch die Verschmelzung die Erfüllung ihrer Forderung gefährdet wird."
    },
    {
      "date": "2024-11-01",
      "id": "92315",
      "original_text": "Löschungsankündigung\nSchleswig-Holstein Amtsgericht Flensburg HRB 13176\nMaler Ohlsen UG (haftungsbeschränkt) – Viöl",
      "type": "Löschungsankündigung",
      "state": "Schleswig-Holstein",
      "amtsgericht": "Amtsgericht Flensburg",
      "registernummer": "HRB 13176",
      "registerart": "HRB",
      "company_name": "Maler Ohlsen UG (haftungsbeschränkt)",
      "company_seat": "Viöl",
      "details": "01.11.2024 (Bekanntmachungsdatum)\n\nSchleswig-Holstein Amtsgericht Flensburg HRB 13176\nLöschungsankündigung\n\nMaler Ohlsen UG (haftungsbeschränkt)\nGesellschaft mit beschränkter Haftung\nViöl\n\nEs ist die Löschung der nachstehenden Gesellschaft wegen Vermögenslosigkeit gemäß § 394 FamFG beabsichtigt.\nWiderspruchsfrist: 2 Monate."
    },
    {
      "date": "2024-11-01",
      "id": "92316",
      "original_text": "Einreichung neuer Dokumente\nHamburg Amtsgericht Hamburg HRB 56865\nLufthansa Technik Aktiengesellschaft – Hamburg",
      "type": "Einreichung neuer Dokumente",
      "state": "Hamburg",
      "amtsgericht": "Amtsgericht Hamburg",
      "registernummer": "HRB 56865",
      "registerart": "HRB",
      "company_name": "Lufthansa Technik Aktiengesellschaft",
      "company_seat": "Hamburg",
      "details": "01.11.2024 (Bekanntmachungsdatum)\n\nHamburg Amtsgericht Hamburg HRB 56865\nEinreichung neuer Dokumente\n\nLufthansa Technik Aktiengesellschaft\nAktiengesellschaft\nHamburg\n\nAls nicht eingetragen wird bekannt gemacht: Liste des Aufsichtsrats wurde eingereicht."
    },
    {
      "date": "2024-11-01",
      "id": "92317",
      "original_text": "Sonstige Registerbekanntmachung\nBerlin Amtsgericht Berlin (Charlottenburg) HRB 123297\nSUPERIUS GmbH – Berlin",
      "type": "Sonstige Registerbekanntmachung",
      "state": "Berlin",
      "amtsgericht": "Amtsgericht Berlin (Charlottenburg)",
      "registernummer": "HRB 123297",
      "registerart": "HRB",
      "company_name": "SUPERIUS GmbH",
      "company_seat": "Berlin",
      "details": "01.11.2024 (Bekanntmachungsdatum)\n\nBerlin Amtsgericht Berlin (Charlottenburg) HRB 123297\nSonstige Registerbekanntmachung\n\nSUPERIUS GmbH\nGesellschaft mit beschränkter Haftung\nBerlin\n\nAls nicht eingetragen wird veröffentlicht: Es ist beabsichtigt, die Geschäftsführerin Mariia Veber wegen Mangels einer wesentlichen Voraussetzung  gemäß § 395 FamFG von Amts wegen zu löschen; Widerspruchsfrist: 2 Wochen"
    },
    {
      "date": "2024-11-01",
      "id": "92318",
      "original_text": "Sonstige Registerbekanntmachung\nHamburg Amtsgericht Hamburg HRB 178246\nWTE AG – Hamburg",
      "type": "Sonstige Registerbekanntmachung",
      "state": "Hamburg",
      "amtsgericht": "Amtsgericht Hamburg",
      "registernummer": "HRB 178246",
      "registerart": "HRB",
      "company_name": "WTE AG",
      "company_seat": "Hamburg",
      "details": "01.11.2024 (Bekanntmachungsdatum)\n\nHamburg Amtsgericht Hamburg HRB 178246\nSonstige Registerbekanntmachung\n\nWTE AG\nAktiengesellschaft\nHamburg\n\nAls nicht eingetragen wird bekannt gemacht: Liste des Aufsichtsrats wurde eingereicht."
    },
    {
      "date": "2024-11-01",
      "id": "92319",
      "original_text": "Löschungsankündigung\nBerlin Amtsgericht Berlin (Charlottenburg) HRB 206538\nHand in Hanf UG (haftungsbeschränkt) – Berlin",
      "type": "Löschungsankündigung",
      "state": "Berlin",
      "amtsgericht": "Amtsgericht Berlin (Charlottenburg)",
      "registernummer": "HRB 206538",
      "registerart": "HRB",
      "company_name": "Hand in Hanf UG (haftungsbeschränkt)",
      "company_seat": "Berlin",
      "details": "01.11.2024 (Bekanntmachungsdatum)\n\nBerlin Amtsgericht Berlin (Charlottenburg) HRB 206538\nLöschungsankündigung\n\nHand in Hanf UG (haftungsbeschränkt)\nGesellschaft mit beschränkter Haftung\nBerlin\n\nBei der nachstehenden Gesellschaft wird das Amtslöschungsverfahren gemäß § 394 FamFG eingeleitet. Widerspruchsfrist 6 Wochen"
    },
    {
      "date": "2024-11-01",
      "id": "92320",
      "original_text": "Löschungsankündigung\nHamburg Amtsgericht Hamburg HRA 105569\nRosenquartier Hannover Grundstücksgesellschaft mbH & Co. KG – Hamburg",
      "type": "Löschungsankündigung",
      "state": "Hamburg",
      "amtsgericht": "Amtsgericht Hamburg",
      "registernummer": "HRA 105569",
      "registerart": "HRA",
      "company_name": "Rosenquartier Hannover Grundstücksgesellschaft mbH & Co. KG",
      "company_seat": "Hamburg",
      "details": "01.11.2024 (Bekanntmachungsdatum)\n\nHamburg Amtsgericht Hamburg HRA 105569\nLöschungsankündigung\n\nRosenquartier Hannover Grundstücksgesellschaft mbH & Co. KG\nKommanditgesellschaft\nHamburg\n\nDas Registergericht beabsichtigt, die im Handelsregister eingetragene Gesellschaft von Amts wegen nach § 394 Abs. 4 FamFG zu löschen. Die Frist zur Erhebung eines Widerspruchs gegen die beabsichtigte Löschung wird auf 3 Monate festgesetzt."
    },
    {
      "date": "2024-11-01",
      "id": "92321",
      "original_text": "Registerbekanntmachung nach dem Umwandlungsgesetz\nSchleswig-Holstein Amtsgericht Kiel HRA 12369\nHansen + Klümpen GmbH & Co. KG – Neumünster",
      "type": "Registerbekanntmachung nach dem Umwandlungsgesetz",
      "state": "Schleswig-Holstein",
      "amtsgericht": "Amtsgericht Kiel",
      "registernummer": "HRA 12369",
      "registerart": "HRA",
      "company_name": "Hansen + Klümpen GmbH & Co. KG",
      "company_seat": "Neumünster",
      "details": "01.11.2024 (Bekanntmachungsdatum)\n\nSchleswig-Holstein Amtsgericht Kiel HRA 12369\nRegisterbekanntmachung nach dem Umwandlungsgesetz 30.10.2024 (Eintragungsdatum)\n\nHansen + Klümpen GmbH & Co. KG\nKommanditgesellschaft\nNeumünster\n\nZu Eintragungsnummer 2 vom 30.10.2024 wird als nicht eingetragen veröffentlicht: Den Gläubigern der an der Spaltung beteiligten Rechtsträger ist, wenn sie binnen sechs Monaten nach dem Tag, an dem die Eintragung der Spaltung in das Register des Sitzes desjenigen Rechtsträgers, dessen Gläubiger sie sind,  bekannt gemacht worden ist, ihren Anspruch nach Grund und Höhe schriftlich anmelden, Sicherheit zu leisten, soweit sie nicht Befriedigung verlangen können. Dieses Recht steht den Gläubigern jedoch nur zu, wenn sie glaubhaft machen, dass durch die Spaltung die Erfüllung ihrer Forderung gefährdet wird."
    },
    {
      "date": "2024-11-01",
      "id": "92322",
      "original_text": "Registerbekanntmachung nach dem Umwandlungsgesetz\nSachsen-Anhalt Amtsgericht Stendal HRA 7896\nHeinrich Kruse Landwirtschaft e.K. – Quedlinburg",
      "type": "Registerbekanntmachung nach dem Umwandlungsgesetz",
      "state": "Sachsen-Anhalt",
      "amtsgericht": "Amtsgericht Stendal",
      "registernummer": "HRA 7896",
      "registerart": "HRA",
      "company_name": "Heinrich Kruse Landwirtschaft e.K.",
      "company_seat": "Quedlinburg",
      "details": "01.11.2024 (Bekanntmachungsdatum)\n\nSachsen-Anhalt Amtsgericht Stendal HRA 7896\nRegisterbekanntmachung nach dem Umwandlungsgesetz 01.11.2024 (Eintragungsdatum)\n\nHeinrich Kruse Landwirtschaft e.K.\nEinzelkaufmann / Einzelkauffrau\nQuedlinburg\n\nNicht eingetragen:\nDen Gläubigern der an der Ausgliederung beteiligten Rechtsträger, ist wenn sie binnen sechs Monaten nach dem Tag, an dem die Eintragung der Ausgliederung nach §§125, 19 Abs. 3 UmwG als bekanntgemacht gilt, ihren Anspruch nach Grund und Höhe schriftlich anmelden, Sicherheit zu leisten, soweit sie nicht Befriedigung verlangen können. Diese Recht steht ihnen jedoch nur zu, wenn sie glaubhaft machen, dass durch die Ausgliederung die Erfüllung ihrer Forderung gefährdet wird."
    },
    {
      "date": "2024-11-01",
      "id": "92323",
      "original_text": "Löschungsankündigung\nBrandenburg Amtsgericht Neuruppin HRB 12771\nMRS Projektentwicklungs GmbH – Hohen Neuendorf",
      "type": "Löschungsankündigung",
      "state": "Brandenburg",
      "amtsgericht": "Amtsgericht Neuruppin",
      "registernummer": "HRB 12771",
      "registerart": "HRB",
      "company_name": "MRS Projektentwicklungs GmbH",
      "company_seat": "Hohen Neuendorf",
      "details": "01.11.2024 (Bekanntmachungsdatum)\n\nBrandenburg Amtsgericht Neuruppin HRB 12771\nLöschungsankündigung\n\nMRS Projektentwicklungs GmbH\nGesellschaft mit beschränkter Haftung\nHohen Neuendorf\n\nBei der nachstehenden Gesellschaft wird das Amtslöschungsverfahren gemäß § 394 FamFG eingeleitet.\nWiderspruchsfrist: 1 Monat"
    },
    {
      "date": "2024-11-01",
      "id": "92324",
      "original_text": "Löschungsankündigung\nBerlin Amtsgericht Berlin (Charlottenburg) HRB 9867\nLawrenz Gesellschaft mit beschränkter Haftung – Berlin",
      "type": "Löschungsankündigung",
      "state": "Berlin",
      "amtsgericht": "Amtsgericht Berlin (Charlottenburg)",
      "registernummer": "HRB 9867",
      "registerart": "HRB",
      "company_name": "Lawrenz Gesellschaft mit beschränkter Haftung",
      "company_seat": "Berlin",
      "details": "01.11.2024 (Bekanntmachungsdatum)\n\nBerlin Amtsgericht Berlin (Charlottenburg) HRB 9867\nLöschungsankündigung\n\nLawrenz Gesellschaft mit beschränkter Haftung\nGesellschaft mit beschränkter Haftung\nBerlin\n\nBei der nachstehenden Gesellschaft wird das Amtslöschungsverfahren gemäß § 394 FamFG eingeleitet. Widerspruchsfrist 6 Wochen"
    },
    {
      "date": "2024-11-01",
      "id": "92325",
      "original_text": "Sonstige Registerbekanntmachung\nBerlin Amtsgericht Berlin (Charlottenburg) HRB 223199\nWire Group Holdings GmbH – Berlin",
      "type": "Sonstige Registerbekanntmachung",
      "state": "Berlin",
      "amtsgericht": "Amtsgericht Berlin (Charlottenburg)",
      "registernummer": "HRB 223199",
      "registerart": "HRB",
      "company_name": "Wire Group Holdings GmbH",
      "company_seat": "Berlin",
      "details": "01.11.2024 (Bekanntmachungsdatum)\n\nBerlin Amtsgericht Berlin (Charlottenburg) HRB 223199\nSonstige Registerbekanntmachung\n\nWire Group Holdings GmbH\nGesellschaft mit beschränkter Haftung\nBerlin\n\nAls nicht eingetragen wird veröffentlicht: Es wurde eine neue Liste der Aufsichtsratsmitglieder eingereicht (§52 GmbHG)."
    },
    {
      "date": "2024-11-01",
      "id": "92326",
      "original_text": "Einreichung neuer Dokumente\nThüringen Amtsgericht Jena HRB 403167\nWohnbau GmbH der Stadt Schlotheim – Nottertal-Heilinger Höhen",
      "type": "Einreichung neuer Dokumente",
      "state": "Thüringen",
      "amtsgericht": "Amtsgericht Jena",
      "registernummer": "HRB 403167",
      "registerart": "HRB",
      "company_name": "Wohnbau GmbH der Stadt Schlotheim",
      "company_seat": "Nottertal-Heilinger Höhen",
      "details": "01.11.2024 (Bekanntmachungsdatum)\n\nThüringen Amtsgericht Jena HRB 403167\nEinreichung neuer Dokumente\n\nWohnbau GmbH der Stadt Schlotheim\nGesellschaft mit beschränkter Haftung\nNottertal-Heilinger Höhen\n\nBekanntmachung gem. § 52 Abs. 3 Satz 2 GmbHG: Aufgrund einer Veränderung in den Personen der Aufsichtsratsmitglieder ist durch die Geschäftsführer eine neue Liste zum Handelsregister eingereicht worden."
    },
    {
      "date": "2024-11-01",
      "id": "92327",
      "original_text": "Einreichung neuer Dokumente\nThüringen Amtsgericht Jena HRB 401954\nSollstedter Wohnungsbaugesellschaft mbH – Sollstedt",
      "type": "Einreichung neuer Dokumente",
      "state": "Thüringen",
      "amtsgericht": "Amtsgericht Jena",
      "registernummer": "HRB 401954",
      "registerart": "HRB",
      "company_name": "Sollstedter Wohnungsbaugesellschaft mbH",
      "company_seat": "Sollstedt",
      "details": "01.11.2024 (Bekanntmachungsdatum)\n\nThüringen Amtsgericht Jena HRB 401954\nEinreichung neuer Dokumente 17.09.2024 (Eintragungsdatum)\n\nSollstedter Wohnungsbaugesellschaft mbH\nGesellschaft mit beschränkter Haftung\nSollstedt\n\nBekanntmachung gem. § 52 Abs. 3 Satz 2 GmbHG: Aufgrund einer Veränderung in den Personen der Aufsichtsratsmitglieder ist durch die Geschäftsführer eine neue Liste zum Handelsregister eingereicht worden."
    },
    {
      "date": "2024-11-01",
      "id": "92328",
      "original_text": "Einreichung neuer Dokumente\nMecklenburg-Vorpommern Amtsgericht Stralsund HRB 989 früher Amtsgericht Rostock\nWohnungsbaugesellschaft mbH Richtenberg – Richtenberg",
      "type": "Einreichung neuer Dokumente",
      "state": "Mecklenburg-Vorpommern",
      "amtsgericht": "Amtsgericht Stralsund",
      "registernummer": "HRB 989",
      "registerart": "HRB",
      "company_name": "Wohnungsbaugesellschaft mbH Richtenberg",
      "company_seat": "Richtenberg",
      "former_amtsgericht": "Rostock",
      "details": "01.11.2024 (Bekanntmachungsdatum)\n\nMecklenburg-Vorpommern Amtsgericht Stralsund HRB 989 früher Amtsgericht Rostock\nEinreichung neuer Dokumente\n\nWohnungsbaugesellschaft mbH Richtenberg\nGesellschaft mit beschränkter Haftung\nRichtenberg\n\nEine Liste der Mitglieder des Aufsichtsrats ist zum Handelsregister eingereicht worden."
    },
    {
      "date": "2024-11-01",
      "id": "92329",
      "original_text": "Einreichung neuer Dokumente\nMecklenburg-Vorpommern Amtsgericht Stralsund HRB 1009 früher Amtsgericht Rostock\nLiegenschaftsentwicklungsgesellschaft der Hansestadt Stralsund mbH – Stralsund",
      "type": "Einreichung neuer Dokumente",
      "state": "Mecklenburg-Vorpommern",
      "amtsgericht": "Amtsgericht Stralsund",
      "registernummer": "HRB 1009",
      "registerart": "HRB",
      "company_name": "Liegenschaftsentwicklungsgesellschaft der Hansestadt Stralsund mbH",
      "company_seat": "Stralsund",
      "former_amtsgericht": "Rostock",
      "details": "01.11.2024 (Bekanntmachungsdatum)\n\nMecklenburg-Vorpommern Amtsgericht Stralsund HRB 1009 früher Amtsgericht Rostock\nEinreichung neuer Dokumente\n\nLiegenschaftsentwicklungsgesellschaft der Hansestadt Stralsund mbH\nGesellschaft mit beschränkter Haftung\nStralsund\n\nEine Liste der Mitglieder des Aufsichtsrats ist zum Handelsregister eingereicht worden."
    },
    {
      "date": "2024-11-01",
      "id": "92330",
      "original_text": "Löschungsankündigung\nBerlin Amtsgericht Berlin (Charlottenburg) HRB 142617\nProbastor 316 UG (haftungsbeschränkt) – Berlin",
      "type": "Löschungsankündigung",
      "state": "Berlin",
      "amtsgericht": "Amtsgericht Berlin (Charlottenburg)",
      "registernummer": "HRB 142617",
      "registerart": "HRB",
      "company_name": "Probastor 316 UG (haftungsbeschränkt)",
      "company_seat": "Berlin",
      "details": "01.11.2024 (Bekanntmachungsdatum)\n\nBerlin Amtsgericht Berlin (Charlottenburg) HRB 142617\nLöschungsankündigung\n\nProbastor 316 UG (haftungsbeschränkt)\nGesellschaft mit beschränkter Haftung\nBerlin\n\nBei der nachstehenden Gesellschaft wird das Amtslöschungsverfahren gemäß § 394 FamFG eingeleitet. Widerspruchsfrist 6 Wochen"
    },
    {
      "date": "2024-11-01",
      "id": "92331",
      "original_text": "Löschungsankündigung\nBerlin Amtsgericht Berlin (Charlottenburg) HRB 206748\nStahlnetz Baustahl GmbH – Berlin",
      "type": "Löschungsankündigung",
      "state": "Berlin",
      "amtsgericht": "Amtsgericht Berlin (Charlottenburg)",
      "registernummer": "HRB 206748",
      "registerart": "HRB",
      "company_name": "Stahlnetz Baustahl GmbH",
      "company_seat": "Berlin",
      "details": "01.11.2024 (Bekanntmachungsdatum)\n\nBerlin Amtsgericht Berlin (Charlottenburg) HRB 206748\nLöschungsankündigung\n\nStahlnetz Baustahl GmbH\nGesellschaft mit beschränkter Haftung\nBerlin\n\nBei der nachstehenden Gesellschaft wird das Amtslöschungsverfahren gemäß § 394 FamFG eingeleitet. Widerspruchsfrist 6 Wochen"
    },
    {
      "date": "2024-11-01",
      "id": "92332",
      "original_text": "Registerbekanntmachung nach dem Umwandlungsgesetz\nSchleswig-Holstein Amtsgericht Kiel HRB 17322\nOSH GmbH – Neumünster",
      "type": "Registerbekanntmachung nach dem Umwandlungsgesetz",
      "state": "Schleswig-Holstein",
      "amtsgericht": "Amtsgericht Kiel",
      "registernummer": "HRB 17322",
      "registerart": "HRB",
      "company_name": "OSH GmbH",
      "company_seat": "Neumünster",
      "details": "01.11.2024 (Bekanntmachungsdatum)\n\nSchleswig-Holstein Amtsgericht Kiel HRB 17322\nRegisterbekanntmachung nach dem Umwandlungsgesetz 01.11.2024 (Eintragungsdatum)\n\nOSH GmbH\nGesellschaft mit beschränkter Haftung\nNeumünster\n\nZu Eintragungsnummer 5 vom 01.11.2024 wird als nicht eingetragen veröffentlicht: Den Gläubigern der an der Verschmelzung beteiligten Rechtsträger ist, wenn sie binnen sechs Monaten nach dem Tag, an dem die Eintragung der Verschmelzung in das Register des Sitzes desjenigen Rechtsträgers, dessen Gläubiger sie sind, nach § 19 Abs. 3 UmwG bekannt gemacht worden ist, ihren Anspruch nach Grund und Höhe schriftlich anmelden, Sicherheit zu leisten, soweit sie nicht Befriedigung verlangen können. Dieses Recht steht den Gläubigern jedoch nur zu, wenn sie glaubhaft machen, dass durch die Verschmelzung die Erfüllung ihrer Forderung gefährdet wird."
    },
    {
      "date": "2024-11-01",
      "id": "92333",
      "original_text": "Registerbekanntmachung nach dem Umwandlungsgesetz\nHamburg Amtsgericht Hamburg HRB 78259\nHermes General Service Beteiligungs-Verwaltungsgesellschaft mbH – Hamburg",
      "type": "Registerbekanntmachung nach dem Umwandlungsgesetz",
      "state": "Hamburg",
      "amtsgericht": "Amtsgericht Hamburg",
      "registernummer": "HRB 78259",
      "registerart": "HRB",
      "company_name": "Hermes General Service Beteiligungs-Verwaltungsgesellschaft mbH",
      "company_seat": "Hamburg",
      "details": "01.11.2024 (Bekanntmachungsdatum)\n\nHamburg Amtsgericht Hamburg HRB 78259\nRegisterbekanntmachung nach dem Umwandlungsgesetz 01.11.2024 (Eintragungsdatum)\n\nHermes General Service Beteiligungs-Verwaltungsgesellschaft mbH\nGesellschaft mit beschränkter Haftung\nHamburg\n\nAls nicht eingetragen wird bekannt gemacht:\nDen Gläubigern der an der Verschmelzung beteiligten Gesellschaften ist, wenn sie binnen sechs Monaten nach dem Tag, an dem die Eintragung der Verschmelzung in das Register des Sitzes desjenigen Rechtsträgers, dessen Gläubiger sie sind, nach § 19 Absatz 3 UmwG als bekannt gemacht gilt, ihren Anspruch nach Grund und Höhe schriftlich anmelden, Sicherheit zu leisten, soweit sie nicht Befriedigung verlangen können. Dieses Recht steht den Gläubigern jedoch nur zu, wenn sie glaubhaft machen, dass durch die Verschmelzung die Erfüllung ihrer Forderung gefährdet wird."
    },
    {
      "date": "2024-11-01",
      "id": "92334",
      "original_text": "Registerbekanntmachung nach dem Umwandlungsgesetz\nHamburg Amtsgericht Hamburg HRB 62761\nOTTO-CHEER Beteiligungs-Verwaltungsgesellschaft mbH – Hamburg",
      "type": "Registerbekanntmachung nach dem Umwandlungsgesetz",
      "state": "Hamburg",
      "amtsgericht": "Amtsgericht Hamburg",
      "registernummer": "HRB 62761",
      "registerart": "HRB",
      "company_name": "OTTO-CHEER Beteiligungs-Verwaltungsgesellschaft mbH",
      "company_seat": "Hamburg",
      "details": "01.11.2024 (Bekanntmachungsdatum)\n\nHamburg Amtsgericht Hamburg HRB 62761\nRegisterbekanntmachung nach dem Umwandlungsgesetz 01.11.2024 (Eintragungsdatum)\n\nOTTO-CHEER Beteiligungs-Verwaltungsgesellschaft mbH\nGesellschaft mit beschränkter Haftung\nHamburg\n\nAls nicht eingetragen wird bekannt gemacht:\nDen Gläubigern der an der Verschmelzung beteiligten Gesellschaften ist, wenn sie binnen sechs Monaten nach dem Tag, an dem die Eintragung der Verschmelzung in das Register des Sitzes derjenigen Rechtsträger deren Gläubiger sie sind, nach § 19 Absatz 3 UmwG als bekannt gemacht gilt, ihren Anspruch nach Grund und Höhe schriftlich anmelden, Sicherheit zu leisten, soweit sie nicht Befriedigung verlangen können. Dieses Recht steht den Gläubigern jedoch nur zu, wenn sie glaubhaft machen, dass durch die Verschmelzung die Erfüllung ihrer Forderung gefährdet wird."
    },
    {
      "date": "2024-11-01",
      "id": "92335",
      "original_text": "Registerbekanntmachung nach dem Umwandlungsgesetz\nHamburg Amtsgericht Hamburg HRB 119674\nB2C Russia Holding GmbH – Hamburg",
      "type": "Registerbekanntmachung nach dem Umwandlungsgesetz",
      "state": "Hamburg",
      "amtsgericht": "Amtsgericht Hamburg",
      "registernummer": "HRB 119674",
      "registerart": "HRB",
      "company_name": "B2C Russia Holding GmbH",
      "company_seat": "Hamburg",
      "details": "01.11.2024 (Bekanntmachungsdatum)\n\nHamburg Amtsgericht Hamburg HRB 119674\nRegisterbekanntmachung nach dem Umwandlungsgesetz 01.11.2024 (Eintragungsdatum)\n\nB2C Russia Holding GmbH\nGesellschaft mit beschränkter Haftung\nHamburg\n\nAls nicht eingetragen wird bekannt gemacht:\nDen Gläubigern der an der Verschmelzung beteiligten Gesellschaften ist, wenn sie binnen sechs Monaten nach dem Tag, an dem die Eintragung der Verschmelzung in das Register des Sitzes desjenigen Rechtsträgers, dessen Gläubiger sie sind, nach § 19 Absatz 3 UmwG als bekannt gemacht gilt, ihren Anspruch nach Grund und Höhe schriftlich anmelden, Sicherheit zu leisten, soweit sie nicht Befriedigung verlangen können. Dieses Recht steht den Gläubigern jedoch nur zu, wenn sie glaubhaft machen, dass durch die Verschmelzung die Erfüllung ihrer Forderung gefährdet wird."
    },
    {
      "date": "2024-11-01",
      "id": "92336",
      "original_text": "Registerbekanntmachung nach dem Umwandlungsgesetz\nHamburg Amtsgericht Hamburg HRB 136555\nmedaceum gmbh – Hamburg",
      "type": "Registerbekanntmachung nach dem Umwandlungsgesetz",
      "state": "Hamburg",
      "amtsgericht": "Amtsgericht Hamburg",
      "registernummer": "HRB 136555",
      "registerart": "HRB",
      "company_name": "medaceum gmbh",
      "company_seat": "Hamburg",
      "details": "01.11.2024 (Bekanntmachungsdatum)\n\nHamburg Amtsgericht Hamburg HRB 136555\nRegisterbekanntmachung nach dem Umwandlungsgesetz 01.11.2024 (Eintragungsdatum)\n\nmedaceum gmbh\nGesellschaft mit beschränkter Haftung\nHamburg\n\nAls nicht eingetragen wird bekannt gemacht:\nDen Gläubigern der an der Verschmelzung beteiligten Gesellschaften ist, wenn sie binnen sechs Monaten nach dem Tag, an dem die Eintragung der Verschmelzung in das Register des Sitzes desjenigen Rechtsträgers, dessen Gläubiger sie sind, nach § 19 Absatz 3 UmwG als bekannt gemacht gilt, ihren Anspruch nach Grund und Höhe schriftlich anmelden, Sicherheit zu leisten, soweit sie nicht Befriedigung verlangen können. Dieses Recht steht den Gläubigern jedoch nur zu, wenn sie glaubhaft machen, dass durch die Verschmelzung die Erfüllung ihrer Forderung gefährdet wird."
    },
    {
      "date": "2024-11-01",
      "id": "92337",
      "original_text": "Registerbekanntmachung nach dem Umwandlungsgesetz\nHamburg Amtsgericht Hamburg HRB 139042\nVerwaltungsgesellschaft Hanse Residenzen GmbH – Hamburg",
      "type": "Registerbekanntmachung nach dem Umwandlungsgesetz",
      "state": "Hamburg",
      "amtsgericht": "Amtsgericht Hamburg",
      "registernummer": "HRB 139042",
      "registerart": "HRB",
      "company_name": "Verwaltungsgesellschaft Hanse Residenzen GmbH",
      "company_seat": "Hamburg",
      "details": "01.11.2024 (Bekanntmachungsdatum)\n\nHamburg Amtsgericht Hamburg HRB 139042\nRegisterbekanntmachung nach dem Umwandlungsgesetz 01.11.2024 (Eintragungsdatum)\n\nVerwaltungsgesellschaft Hanse Residenzen GmbH\nGesellschaft mit beschränkter Haftung\nHamburg\n\nAls nicht eingetragen wird bekannt gemacht:\nDen Gläubigern der an der Verschmelzung beteiligten Gesellschaften ist, wenn sie binnen sechs Monaten nach dem Tag, an dem die Eintragung der Verschmelzung in das Register des Sitzes desjenigen Rechtsträgers, dessen Gläubiger sie sind, nach § 19 Absatz 3 UmwG als bekannt gemacht gilt, ihren Anspruch nach Grund und Höhe schriftlich anmelden, Sicherheit zu leisten, soweit sie nicht Befriedigung verlangen können. Dieses Recht steht den Gläubigern jedoch nur zu, wenn sie glaubhaft machen, dass durch die Verschmelzung die Erfüllung ihrer Forderung gefährdet wird."
    },
    {
      "date": "2024-11-01",
      "id": "92338",
      "original_text": "Registerbekanntmachung nach dem Umwandlungsgesetz\nSchleswig-Holstein Amtsgericht Kiel HRB 1882\nKröger + INTASS Verwaltungs GmbH – Kiel",
      "type": "Registerbekanntmachung nach dem Umwandlungsgesetz",
      "state": "Schleswig-Holstein",
      "amtsgericht": "Amtsgericht Kiel",
      "registernummer": "HRB 1882",
      "registerart": "HRB",
      "company_name": "Kröger + INTASS Verwaltungs GmbH",
      "company_seat": "Kiel",
      "details": "01.11.2024 (Bekanntmachungsdatum)\n\nSchleswig-Holstein Amtsgericht Kiel HRB 1882\nRegisterbekanntmachung nach dem Umwandlungsgesetz 01.11.2024 (Eintragungsdatum)\n\nKröger + INTASS Verwaltungs GmbH\nGesellschaft mit beschränkter Haftung\nKiel\n\nAls nicht eingetragen wird veröffentlicht: Den Gläubigern der an der Verschmelzung beteiligten Rechtsträger ist, wenn sie binnen sechs Monaten nach dem Tag, an dem die Eintragung der Verschmelzung in das Register des Sitzes desjenigen Rechtsträgers, dessen Gläubiger sie sind, nach § 19 Abs. 3 UmwG bekannt gemacht worden ist, ihren Anspruch nach Grund und Höhe schriftlich anmelden, Sicherheit zu leisten, soweit sie nicht Befriedigung verlangen können. Dieses Recht steht den Gläubigern jedoch nur zu, wenn sie glaubhaft machen, dass durch die Verschmelzung die Erfüllung ihrer Forderung gefährdet wird.ummer 4 vom 01.11.2024 wird als nicht eingetragen veröffentlicht:"
    },
    {
      "date": "2024-11-01",
      "id": "92339",
      "original_text": "Registerbekanntmachung nach dem Umwandlungsgesetz\nHamburg Amtsgericht Hamburg HRB 164578\nStrong-Self GmbH – Hamburg",
      "type": "Registerbekanntmachung nach dem Umwandlungsgesetz",
      "state": "Hamburg",
      "amtsgericht": "Amtsgericht Hamburg",
      "registernummer": "HRB 164578",
      "registerart": "HRB",
      "company_name": "Strong-Self GmbH",
      "company_seat": "Hamburg",
      "details": "01.11.2024 (Bekanntmachungsdatum)\n\nHamburg Amtsgericht Hamburg HRB 164578\nRegisterbekanntmachung nach dem Umwandlungsgesetz 01.11.2024 (Eintragungsdatum)\n\nStrong-Self GmbH\nGesellschaft mit beschränkter Haftung\nHamburg\n\nAls nicht eingetragen wird bekannt gemacht:\nDen Gläubigern der an der Verschmelzung beteiligten Gesellschaften ist, wenn sie binnen sechs Monaten nach dem Tag, an dem die Eintragung der Verschmelzung in das Register des Sitzes desjenigen Rechtsträgers, dessen Gläubiger sie sind, nach § 19 Absatz 3 UmwG als bekannt gemacht gilt, ihren Anspruch nach Grund und Höhe schriftlich anmelden, Sicherheit zu leisten, soweit sie nicht Befriedigung verlangen können. Dieses Recht steht den Gläubigern jedoch nur zu, wenn sie glaubhaft machen, dass durch die Verschmelzung die Erfüllung ihrer Forderung gefährdet wird."
    },
    {
      "date": "2024-11-01",
      "id": "92340",
      "original_text": "Einreichung neuer Dokumente\nHamburg Amtsgericht Hamburg HRB 83767\nFondsbörse Deutschland Beteiligungsmakler AG – Hamburg",
      "type": "Einreichung neuer Dokumente",
      "state": "Hamburg",
      "amtsgericht": "Amtsgericht Hamburg",
      "registernummer": "HRB 83767",
      "registerart": "HRB",
      "company_name": "Fondsbörse Deutschland Beteiligungsmakler AG",
      "company_seat": "Hamburg",
      "details": "01.11.2024 (Bekanntmachungsdatum)\n\nHamburg Amtsgericht Hamburg HRB 83767\nEinreichung neuer Dokumente\n\nFondsbörse Deutschland Beteiligungsmakler AG\nAktiengesellschaft\nHamburg\n\nAls nicht eingetragen wird bekannt gemacht: Liste des Aufsichtsrats wurde eingereicht."
    },
    {
      "date": "2024-11-01",
      "id": "92341",
      "original_text": "Registerbekanntmachung nach dem Umwandlungsgesetz\nSachsen Amtsgericht Chemnitz HRB 24346\ncproject ingenieure gmbh – Chemnitz",
      "type": "Registerbekanntmachung nach dem Umwandlungsgesetz",
      "state": "Sachsen",
      "amtsgericht": "Amtsgericht Chemnitz",
      "registernummer": "HRB 24346",
      "registerart": "HRB",
      "company_name": "cproject ingenieure gmbh",
      "company_seat": "Chemnitz",
      "details": "01.11.2024 (Bekanntmachungsdatum)\n\nSachsen Amtsgericht Chemnitz HRB 24346\nRegisterbekanntmachung nach dem Umwandlungsgesetz 01.11.2024 (Eintragungsdatum)\n\ncproject ingenieure gmbh\nGesellschaft mit beschränkter Haftung\nChemnitz\n\nDen Gläubigern der an der Verschmelzung beteiligten Rechtsträger ist, wenn sie binnen sechs Monaten nach dem Tag, an dem die Eintragung der Verschmelzung in das Register des Sitzes desjenigen Rechtsträgers, dessen Gläubiger sie sind, nach § 19 Abs. 3 UmwG als bekannt gemacht gilt, ihren Anspruch nach Grund und Höhe schriftlich anmelden, Sicherheit zu leisten, soweit sie nicht Befriedigung verlangen können. Dieses Recht steht den Gläubigern jedoch nur zu, wenn sie glaubhaft machen, dass durch die Verschmelzung die Erfüllung der Forderung gefährdet wird."
    },
    {
      "date": "2024-11-01",
      "id": "92342",
      "original_text": "Registerbekanntmachung nach dem Umwandlungsgesetz\nSachsen Amtsgericht Dresden HRB 33258\nEnergieWerk Ost GmbH – Klingenberg",
      "type": "Registerbekanntmachung nach dem Umwandlungsgesetz",
      "state": "Sachsen",
      "amtsgericht": "Amtsgericht Dresden",
      "registernummer": "HRB 33258",
      "registerart": "HRB",
      "company_name": "EnergieWerk Ost GmbH",
      "company_seat": "Klingenberg",
      "details": "01.11.2024 (Bekanntmachungsdatum)\n\nSachsen Amtsgericht Dresden HRB 33258\nRegisterbekanntmachung nach dem Umwandlungsgesetz 01.11.2024 (Eintragungsdatum)\n\nEnergieWerk Ost GmbH\nGesellschaft mit beschränkter Haftung\nKlingenberg\n\nDen Gläubigern der an der Verschmelzung beteiligten Rechtsträger ist, wenn sie binnen sechs Monaten nach dem Tag, an dem die Eintragung der Verschmelzung in das Register des Sitzes desjenigen Rechtsträgers, dessen Gläubiger sie sind, nach § 19 Abs. 3 UmwG als bekannt gemacht gilt, ihren Anspruch nach Grund und Höhe schriftlich anmelden, Sicherheit zu leisten, soweit sie nicht Befriedigung verlangen können. Dieses Recht steht den Gläubigern jedoch nur zu, wenn sie glaubhaft machen, dass durch die Verschmelzung die Erfüllung der Forderung gefährdet wird."
    },
    {
      "date": "2024-11-01",
      "id": "92343",
      "original_text": "Einreichung neuer Dokumente\nNiedersachsen Amtsgericht Braunschweig HRA 200936\nWEVG Salzgitter GmbH & Co. KG – Salzgitter",
      "type": "Einreichung neuer Dokumente",
      "state": "Niedersachsen",
      "amtsgericht": "Amtsgericht Braunschweig",
      "registernummer": "HRA 200936",
      "registerart": "HRA",
      "company_name": "WEVG Salzgitter GmbH & Co. KG",
      "company_seat": "Salzgitter",
      "details": "01.11.2024 (Bekanntmachungsdatum)\n\nNiedersachsen Amtsgericht Braunschweig HRA 200936\nEinreichung neuer Dokumente\n\nWEVG Salzgitter GmbH & Co. KG\nKommanditgesellschaft\nSalzgitter\n\nHRA200936 - WEVG Salzgitter GmbH & Co. KG, 38226 Salzgitter. Die Gesellschaft hat eine neue Liste der Aufsichtsratsmitglieder am 29.10.2024 beim Amtsgericht Braunschweig eingereicht."
    },
    {
      "date": "2024-11-01",
      "id": "92344",
      "original_text": "Registerbekanntmachung nach dem Umwandlungsgesetz\nNiedersachsen Amtsgericht Hildesheim HRB 208075\nSchlieker Immobilien GmbH – Holzminden",
      "type": "Registerbekanntmachung nach dem Umwandlungsgesetz",
      "state": "Niedersachsen",
      "amtsgericht": "Amtsgericht Hildesheim",
      "registernummer": "HRB 208075",
      "registerart": "HRB",
      "company_name": "Schlieker Immobilien GmbH",
      "company_seat": "Holzminden",
      "details": "01.11.2024 (Bekanntmachungsdatum)\n\nNiedersachsen Amtsgericht Hildesheim HRB 208075\nRegisterbekanntmachung nach dem Umwandlungsgesetz 01.11.2024 (Eintragungsdatum)\n\nSchlieker Immobilien GmbH\nGesellschaft mit beschränkter Haftung\nHolzminden\n\nDen Gläubigern der an der formwechselnden Umwandlung beteiligten Rechtsträger ist, wenn sie binnen sechs Monaten nach dem Tag, an dem die Eintragung der Umwandlung in das Register des Sitzes desjenigen Rechtsträgers, dessen Gläubiger sie sind, nach § 19 Abs. 3 UmwG als bekannt gemacht gilt, ihren Anspruch nach Grund und Höhe schriftlich anmelden, Sicherheit zu leisten, soweit sie nicht Befriedigung verlangen können. Dieses Recht steht den Gläubigern jedoch nur zu, wenn sie glaubhaft machen, dass durch die formwechselnde Umwandlung die Erfüllung der Forderung gefährdet wird."
    },
    {
      "date": "2024-11-01",
      "id": "92345",
      "original_text": "Löschungsankündigung\nNiedersachsen Amtsgericht Lüneburg HRB 206896\nBS Drabner GmbH – Lüneburg",
      "type": "Löschungsankündigung",
      "state": "Niedersachsen",
      "amtsgericht": "Amtsgericht Lüneburg",
      "registernummer": "HRB 206896",
      "registerart": "HRB",
      "company_name": "BS Drabner GmbH",
      "company_seat": "Lüneburg",
      "details": "01.11.2024 (Bekanntmachungsdatum)\n\nNiedersachsen Amtsgericht Lüneburg HRB 206896\nLöschungsankündigung\n\nBS Drabner GmbH\nGesellschaft mit beschränkter Haftung\nLüneburg\n\nDas Registergericht beabsichtigt, die Gesellschaft von Amts wegen nach § 394 FamFG zu löschen. Die Frist zur Erhebung eines Widerspruchs ist auf 1 Monat ab dieser Registerbekanntmachung festgesetzt."
    },
    {
      "date": "2024-11-01",
      "id": "92346",
      "original_text": "Registerbekanntmachung nach dem Umwandlungsgesetz\nNiedersachsen Amtsgericht Braunschweig HRB 1858\nVolkswagen Leasing Gesellschaft mit beschränkter Haftung – Braunschweig",
      "type": "Registerbekanntmachung nach dem Umwandlungsgesetz",
      "state": "Niedersachsen",
      "amtsgericht": "Amtsgericht Braunschweig",
      "registernummer": "HRB 1858",
      "registerart": "HRB",
      "company_name": "Volkswagen Leasing Gesellschaft mit beschränkter Haftung",
      "company_seat": "Braunschweig",
      "details": "01.11.2024 (Bekanntmachungsdatum)\n\nNiedersachsen Amtsgericht Braunschweig HRB 1858\nRegisterbekanntmachung nach dem Umwandlungsgesetz 01.11.2024 (Eintragungsdatum)\n\nVolkswagen Leasing Gesellschaft mit beschränkter Haftung\nGesellschaft mit beschränkter Haftung\nBraunschweig\n\nDen Gläubigern der an der grenzüberschreitenden Verschmelzung beteiligten übernehmenden Rechtsträger ist, wenn sie binnen sechs Monaten nach dem Tag, an dem die Eintragung der Verschmelzung in das Register des Sitzes desjenigen Rechtsträgers, dessen Gläubiger sie sind, nach § 19 Absatz 3 UmwG als bekanntgemacht gilt, ihren Anspruch nach Grund und Höhe schriftlich anmelden, Sicherheit zu leisten, soweit sie nicht Befriedigung verlangen können.\n\nDieses Recht steht den Gläubigern jedoch nur zu, wenn sie glaubhaft machen, dass durch die Verschmelzung die Erfüllung ihrer Forderung gefährdet wird."
    },
    {
      "date": "2024-11-01",
      "id": "92347",
      "original_text": "Registerbekanntmachung nach dem Umwandlungsgesetz\nNiedersachsen Amtsgericht Tostedt HRB 121608 früher Amtsgericht Buxtehude\nBuxliberty Verwaltungs- und Bereederungs GmbH – Buxtehude",
      "type": "Registerbekanntmachung nach dem Umwandlungsgesetz",
      "state": "Niedersachsen",
      "amtsgericht": "Amtsgericht Tostedt",
      "registernummer": "HRB 121608",
      "registerart": "HRB",
      "company_name": "Buxliberty Verwaltungs- und Bereederungs GmbH",
      "company_seat": "Buxtehude",
      "former_amtsgericht": "Buxtehude",
      "details": "01.11.2024 (Bekanntmachungsdatum)\n\nNiedersachsen Amtsgericht Tostedt HRB 121608 früher Amtsgericht Buxtehude\nRegisterbekanntmachung nach dem Umwandlungsgesetz 01.11.2024 (Eintragungsdatum)\n\nBuxliberty Verwaltungs- und Bereederungs GmbH\nGesellschaft mit beschränkter Haftung\nBuxtehude\n\nDen Gläubigern der an der Verschmelzung beteiligten Rechtsträger ist, wenn sie binnen sechs Monaten nach dem Tag, an dem die Eintragung der Verschmelzung in das Register des Sitzes desjenigen Rechtsträgers, dessen Gläubiger sie sind, nach § 19  Abs.  3 UmwG als bekannt gemacht gilt, ihren Anspruch nach Grund und Höhe schriftlich anmelden, Sicherheit zu leisten, soweit sie nicht Befriedigung verlangen können. Dieses Recht steht den Gläubigern jedoch nur zu, wenn sie glaubhaft machen, dass durch die Verschmelzung die Erfüllung der Forderung gefährdet wird."
    },
    {
      "date": "2024-11-01",
      "id": "92348",
      "original_text": "Einreichung neuer Dokumente\nNiedersachsen Amtsgericht Braunschweig HRB 100486 früher Amtsgericht Wolfsburg\nVfL Wolfsburg-Fußball GmbH – Wolfsburg",
      "type": "Einreichung neuer Dokumente",
      "state": "Niedersachsen",
      "amtsgericht": "Amtsgericht Braunschweig",
      "registernummer": "HRB 100486",
      "registerart": "HRB",
      "company_name": "VfL Wolfsburg-Fußball GmbH",
      "company_seat": "Wolfsburg",
      "former_amtsgericht": "Wolfsburg",
      "details": "01.11.2024 (Bekanntmachungsdatum)\n\nNiedersachsen Amtsgericht Braunschweig HRB 100486 früher Amtsgericht Wolfsburg\nEinreichung neuer Dokumente\n\nVfL Wolfsburg-Fußball GmbH\nGesellschaft mit beschränkter Haftung\nWolfsburg\n\nEine neue Liste der Mitglieder des Aufsichtsrats wurde beim Registergericht eingereicht."
    },
    {
      "date": "2024-11-01",
      "id": "92349",
      "original_text": "Registerbekanntmachung nach dem Umwandlungsgesetz\nNiedersachsen Amtsgericht Hildesheim GnR 200062\nDie Wohnvisionäre eG – Holzminden",
      "type": "Registerbekanntmachung nach dem Umwandlungsgesetz",
      "state": "Niedersachsen",
      "amtsgericht": "Amtsgericht Hildesheim",
      "registernummer": "GnR 200062",
      "registerart": "GnR",
      "company_name": "Die Wohnvisionäre eG",
      "company_seat": "Holzminden",
      "details": "01.11.2024 (Bekanntmachungsdatum)\n\nNiedersachsen Amtsgericht Hildesheim GnR 200062\nRegisterbekanntmachung nach dem Umwandlungsgesetz 01.11.2024 (Eintragungsdatum)\n\nDie Wohnvisionäre eG\neingetragene Genossenschaft\nHolzminden\n\nDen Gläubigern der an der formwechselnden Umwandlung beteiligten Rechtsträger ist, wenn sie binnen sechs Monaten nach dem Tag, an dem die Eintragung der Umwandlung in das Register des Sitzes desjenigen Rechtsträgers, dessen Gläubiger sie sind, nach § 19 Abs. 3 UmwG als bekannt gemacht gilt, ihren Anspruch nach Grund und Höhe schriftlich anmelden, Sicherheit zu leisten, soweit sie nicht Befriedigung verlangen können. Dieses Recht steht den Gläubigern jedoch nur zu, wenn sie glaubhaft machen, dass durch die formwechselnde Umwandlung die Erfüllung der Forderung gefährdet wird."
    },
    {
      "date": "2024-11-01",
      "id": "92350",
      "original_text": "Registerbekanntmachung nach dem Umwandlungsgesetz\nBremen Amtsgericht Bremen HRA 22149\nMC-Fuhrparkmanagement GmbH & Co.KG – Bremen",
      "type": "Registerbekanntmachung nach dem Umwandlungsgesetz",
      "state": "Bremen",
      "amtsgericht": "Amtsgericht Bremen",
      "registernummer": "HRA 22149",
      "registerart": "HRA",
      "company_name": "MC-Fuhrparkmanagement GmbH & Co.KG",
      "company_seat": "Bremen",
      "details": "01.11.2024 (Bekanntmachungsdatum)\n\nBremen Amtsgericht Bremen HRA 22149\nRegisterbekanntmachung nach dem Umwandlungsgesetz 30.10.2024 (Eintragungsdatum)\n\nMC-Fuhrparkmanagement GmbH & Co.KG\nKommanditgesellschaft\nBremen\n\nZu Eintragungsnummer 4 vom 30.10.2024 wird als nicht eingetragen veröffentlicht:\nDen Gläubigern der an der Verschmelzung beteiligten Rechtsträger ist, wenn sie binnen sechs Monaten nach dem Tag, an dem die Eintragung der Verschmelzung in das Register des Sitzes desjenigen Rechtsträgers, dessen Gläubiger sie sind, als bekannt gemacht gilt, ihren Anspruch nach Grund und Höhe schriftlich anmelden, Sicherheit zu leisten, soweit sie nicht Befriedigung verlangen können. Dieses Recht steht den Gläubigern jedoch nur zu, wenn sie glaubhaft machen, dass durch die Verschmelzung die Erfüllung ihrer Forderung gefährdet wird. Das Recht, Sicherheitsleistung zu verlangen, steht Gläubigern nicht zu, die im Falle der Insolvenz ein Recht auf vorzugsweise Befriedigung aus einer Deckungsmasse haben, die nach gesetzlicher Vorschrift zu ihrem Schutz errichtet und staatlich überwacht ist."
    },
    {
      "date": "2024-11-01",
      "id": "92351",
      "original_text": "Löschungsankündigung\nBremen Amtsgericht Bremen HRB 38200\nBMS Büromöbel Montage Service UG (haftungsbeschränkt) – Bremen",
      "type": "Löschungsankündigung",
      "state": "Bremen",
      "amtsgericht": "Amtsgericht Bremen",
      "registernummer": "HRB 38200",
      "registerart": "HRB",
      "company_name": "BMS Büromöbel Montage Service UG (haftungsbeschränkt)",
      "company_seat": "Bremen",
      "details": "01.11.2024 (Bekanntmachungsdatum)\n\nBremen Amtsgericht Bremen HRB 38200\nLöschungsankündigung\n\nBMS Büromöbel Montage Service UG (haftungsbeschränkt)\nGesellschaft mit beschränkter Haftung\nBremen\n\nEs ist beabsichtigt die im Handelsregister eingetragene Gesellschaft von Amts wegen gemäß § 394 FamFG zu löschen. Gegen die Löschung kann beim AG Bremen schriftlich oder zu Protokoll der Geschäftsstelle Widerspruch eingelegt werden. Widerspruchsfrist 4 Wochen."
    },
    {
      "date": "2024-11-01",
      "id": "92352",
      "original_text": "Registerbekanntmachung nach dem Umwandlungsgesetz\nBremen Amtsgericht Bremen HRA 23699\nA.M.L.-Anlagen Mobilien Leasing GmbH & Co. KG – Bremen",
      "type": "Registerbekanntmachung nach dem Umwandlungsgesetz",
      "state": "Bremen",
      "amtsgericht": "Amtsgericht Bremen",
      "registernummer": "HRA 23699",
      "registerart": "HRA",
      "company_name": "A.M.L.-Anlagen Mobilien Leasing GmbH & Co. KG",
      "company_seat": "Bremen",
      "details": "01.11.2024 (Bekanntmachungsdatum)\n\nBremen Amtsgericht Bremen HRA 23699\nRegisterbekanntmachung nach dem Umwandlungsgesetz 30.10.2024 (Eintragungsdatum)\n\nA.M.L.-Anlagen Mobilien Leasing GmbH & Co. KG\nKommanditgesellschaft\nBremen\n\nZu Eintragungsnummer 4 vom 30.10.2024 wird als nicht eingetragen veröffentlicht: Den Gläubigern der an der Verschmelzung beteiligten Rechtsträger ist, wenn sie binnen sechs Monaten nach dem Tag, an dem die Eintragung der Verschmelzung in das Register des Sitzes desjenigen Rechtsträgers, dessen Gläubiger sie sind, als bekannt gemacht gilt, ihren Anspruch nach Grund und Höhe schriftlich anmelden, Sicherheit zu leisten, soweit sie nicht Befriedigung verlangen können. Dieses Recht steht den Gläubigern jedoch nur zu, wenn sie glaubhaft machen, dass durch die Verschmelzung die Erfüllung ihrer Forderung gefährdet wird. Das Recht, Sicherheitsleistung zu verlangen, steht Gläubigern nicht zu, die im Falle der Insolvenz ein Recht auf vorzugsweise Befriedigung aus einer Deckungsmasse haben, die nach gesetzlicher Vorschrift zu ihrem Schutz errichtet und staatlich überwacht ist."
    },
    {
      "date": "2024-11-01",
      "id": "92353",
      "original_text": "Einreichung neuer Dokumente\nBremen Amtsgericht Bremen HRB 21549\nFreese AG – Bremen",
      "type": "Einreichung neuer Dokumente",
      "state": "Bremen",
      "amtsgericht": "Amtsgericht Bremen",
      "registernummer": "HRB 21549",
      "registerart": "HRB",
      "company_name": "Freese AG",
      "company_seat": "Bremen",
      "details": "01.11.2024 (Bekanntmachungsdatum)\n\nBremen Amtsgericht Bremen HRB 21549\nEinreichung neuer Dokumente\n\nFreese AG\nAktiengesellschaft\nBremen\n\nAls nicht eingetragen wird bekannt gemacht: Liste des Aufsichtsrats wurde eingereicht."
    },
    {
      "date": "2024-11-01",
      "id": "92354",
      "original_text": "Einreichung neuer Dokumente\nBremen Amtsgericht Bremen HRB 4413\nBREMER LAGERHAUS-GESELLSCHAFT -Aktiengesellschaft von 1877- – Bremen",
      "type": "Einreichung neuer Dokumente",
      "state": "Bremen",
      "amtsgericht": "Amtsgericht Bremen",
      "registernummer": "HRB 4413",
      "registerart": "HRB",
      "company_name": "BREMER LAGERHAUS-GESELLSCHAFT -Aktiengesellschaft von 1877-",
      "company_seat": "Bremen",
      "details": "01.11.2024 (Bekanntmachungsdatum)\n\nBremen Amtsgericht Bremen HRB 4413\nEinreichung neuer Dokumente\n\nBREMER LAGERHAUS-GESELLSCHAFT -Aktiengesellschaft von 1877-\nAktiengesellschaft\nBremen\n\nAls nicht eingetragen wird veröffentlicht: Liste des Aufsichtsrats wurde eingereicht."
    },
    {
      "date": "2024-11-01",
      "id": "92355",
      "original_text": "Sonstige Registerbekanntmachung\nThüringen Amtsgericht Jena HRB 516640\nVAMED Campus Reha Bleicherode GmbH – Bleicherode",
      "type": "Sonstige Registerbekanntmachung",
      "state": "Thüringen",
      "amtsgericht": "Amtsgericht Jena",
      "registernummer": "HRB 516640",
      "registerart": "HRB",
      "company_name": "VAMED Campus Reha Bleicherode GmbH",
      "company_seat": "Bleicherode",
      "details": "01.11.2024 (Bekanntmachungsdatum)\n\nThüringen Amtsgericht Jena HRB 516640\nSonstige Registerbekanntmachung 01.11.2024 (Eintragungsdatum)\n\nVAMED Campus Reha Bleicherode GmbH\nGesellschaft mit beschränkter Haftung\nBleicherode\n\nNicht eingetragen: Den Gläubigern der Gesellschaft, deren Forderungen begründet worden sind, bevor die Eintragung der Beendigung des Vertrages in das Handelsregister nach § 10 des Handelsgesetzbuches als bekanntgemacht gilt, hat der andere Vertragsteil Sicherheit zu leisten, wenn sie sich binnen sechs Monaten nach der Bekanntmachung der Eintragung zu diesem Zweck bei ihm melden."
    },
    {
      "date": "2024-11-01",
      "id": "92356",
      "original_text": "Einreichung neuer Dokumente\nThüringen Amtsgericht Jena HRB 502720\nae group ag – Gerstungen",
      "type": "Einreichung neuer Dokumente",
      "state": "Thüringen",
      "amtsgericht": "Amtsgericht Jena",
      "registernummer": "HRB 502720",
      "registerart": "HRB",
      "company_name": "ae group ag",
      "company_seat": "Gerstungen",
      "details": "01.11.2024 (Bekanntmachungsdatum)\n\nThüringen Amtsgericht Jena HRB 502720\nEinreichung neuer Dokumente\n\nae group ag\nAktiengesellschaft\nGerstungen\n\nBekanntmachung gem. § 106 AktG: Aufgrund einer Veränderung in den Personen der Aufsichtsratsmitglieder ist durch den Vorstand eine neue Liste zum Handelsregister eingereicht worden."
    },
    {
      "date": "2024-11-01",
      "id": "92357",
      "original_text": "Einreichung neuer Dokumente\nThüringen Amtsgericht Jena HRB 512700\nNahverkehrsgesellschaft des Landkreises Gotha mbH (NVG) – Gotha",
      "type": "Einreichung neuer Dokumente",
      "state": "Thüringen",
      "amtsgericht": "Amtsgericht Jena",
      "registernummer": "HRB 512700",
      "registerart": "HRB",
      "company_name": "Nahverkehrsgesellschaft des Landkreises Gotha mbH (NVG)",
      "company_seat": "Gotha",
      "details": "01.11.2024 (Bekanntmachungsdatum)\n\nThüringen Amtsgericht Jena HRB 512700\nEinreichung neuer Dokumente\n\nNahverkehrsgesellschaft des Landkreises Gotha mbH (NVG)\nGesellschaft mit beschränkter Haftung\nGotha\n\nBekanntmachung gem. § 52 Abs. 3 Satz 2 GmbHG: Aufgrund einer Veränderung in den Personen der Aufsichtsratsmitglieder ist durch die Geschäftsführer eine neue Liste zum Handelsregister eingereicht worden."
    },
    {
      "date": "2024-11-01",
      "id": "92358",
      "original_text": "Einreichung neuer Dokumente\nThüringen Amtsgericht Jena HRB 103909\nStadtwirtschaft Weimar GmbH – Weimar",
      "type": "Einreichung neuer Dokumente",
      "state": "Thüringen",
      "amtsgericht": "Amtsgericht Jena",
      "registernummer": "HRB 103909",
      "registerart": "HRB",
      "company_name": "Stadtwirtschaft Weimar GmbH",
      "company_seat": "Weimar",
      "details": "01.11.2024 (Bekanntmachungsdatum)\n\nThüringen Amtsgericht Jena HRB 103909\nEinreichung neuer Dokumente 23.10.2024 (Eintragungsdatum)\n\nStadtwirtschaft Weimar GmbH\nGesellschaft mit beschränkter Haftung\nWeimar\n\nBekanntmachung gem. § 52 Abs. 3 Satz 2 GmbHG: Aufgrund einer Veränderung in den Personen der Aufsichtsratsmitglieder ist durch die Geschäftsführer eine neue Liste zum Handelsregister eingereicht worden."
    },
    {
      "date": "2024-11-01",
      "id": "92359",
      "original_text": "Löschungsankündigung\nHessen Amtsgericht Frankfurt am Main HRB 77771\nIntermedco GmbH – Frankfurt am Main",
      "type": "Löschungsankündigung",
      "state": "Hessen",
      "amtsgericht": "Amtsgericht Frankfurt am Main",
      "registernummer": "HRB 77771",
      "registerart": "HRB",
      "company_name": "Intermedco GmbH",
      "company_seat": "Frankfurt am Main",
      "details": "01.11.2024 (Bekanntmachungsdatum)\n\nHessen Amtsgericht Frankfurt am Main HRB 77771\nLöschungsankündigung\n\nIntermedco GmbH\nGesellschaft mit beschränkter Haftung\nFrankfurt am Main\n\nDas Registergericht beabsichtigt die im Handelsregister eingetragene Gesellschaft von Amts wegen nach § 394 FamFG zu löschen. Die Frist zur Erhebung eines Widerspruchs gegen die beabsichtigte Löschung wird auf 3 Monate festgesetzt."
    },
    {
      "date": "2024-11-01",
      "id": "92360",
      "original_text": "Löschungsankündigung\nHessen Amtsgericht Wiesbaden HRB 27763\nME Mühlhausen Entertainment UG (haftungsbeschränkt) – Wiesbaden",
      "type": "Löschungsankündigung",
      "state": "Hessen",
      "amtsgericht": "Amtsgericht Wiesbaden",
      "registernummer": "HRB 27763",
      "registerart": "HRB",
      "company_name": "ME Mühlhausen Entertainment UG (haftungsbeschränkt)",
      "company_seat": "Wiesbaden",
      "details": "01.11.2024 (Bekanntmachungsdatum)\n\nHessen Amtsgericht Wiesbaden HRB 27763\nLöschungsankündigung\n\nME Mühlhausen Entertainment UG (haftungsbeschränkt)\nGesellschaft mit beschränkter Haftung\nWiesbaden\n\nDas Registergericht beabsichtigt die im Handelsregister eingetragene Gesellschaft von Amts wegen nach § 394 FamFG zu löschen. Die Frist zur Erhebung eines Widerspruchs gegen die beabsichtigte Löschung wird auf 3 Monate festgesetzt."
    },
    {
      "date": "2024-11-01",
      "id": "92361",
      "original_text": "Löschungsankündigung\nHessen Amtsgericht Wetzlar HRB 7970\nGGH UG (haftungsbeschränkt) – Haiger",
      "type": "Löschungsankündigung",
      "state": "Hessen",
      "amtsgericht": "Amtsgericht Wetzlar",
      "registernummer": "HRB 7970",
      "registerart": "HRB",
      "company_name": "GGH UG (haftungsbeschränkt)",
      "company_seat": "Haiger",
      "details": "01.11.2024 (Bekanntmachungsdatum)\n\nHessen Amtsgericht Wetzlar HRB 7970\nLöschungsankündigung\n\nGGH UG (haftungsbeschränkt)\nGesellschaft mit beschränkter Haftung\nHaiger\n\nDas Registergericht beabsichtigt die im Handelsregister eingetragene Gesellschaft von Amts wegen nach § 394 FamFG zu löschen. Die Frist zur Erhebung eines Widerspruchs gegen die beabsichtigte Löschung wird auf 2 Monate festgesetzt."
    },
    {
      "date": "2024-11-01",
      "id": "92362",
      "original_text": "Löschungsankündigung\nHessen Amtsgericht Offenbach am Main HRB 11223\nHAJA Steuerberatungsgesellschaft mbH – Dietzenbach",
      "type": "Löschungsankündigung",
      "state": "Hessen",
      "amtsgericht": "Amtsgericht Offenbach am Main",
      "registernummer": "HRB 11223",
      "registerart": "HRB",
      "company_name": "HAJA Steuerberatungsgesellschaft mbH",
      "company_seat": "Dietzenbach",
      "details": "01.11.2024 (Bekanntmachungsdatum)\n\nHessen Amtsgericht Offenbach am Main HRB 11223\nLöschungsankündigung\n\nHAJA Steuerberatungsgesellschaft mbH\nGesellschaft mit beschränkter Haftung\nDietzenbach\n\nDas Registergericht beabsichtigt, die im Handelsregister eingetragene Gesellschaft von Amts wegen nach § 395 und § 394 FamFG zu löschen. Die Gesellschaft ist nicht mehr befugt, geschäftsmäßige Hilfeleistung in Steuersachen anzubieten und auszüben. Zudem ist diese vermögenslos. Die Frist zur Erhebung eines Widerspruchs gegen die beabsichtigte Löschung wird auf 3 Monate festgesetzt."
    },
    {
      "date": "2024-11-01",
      "id": "92363",
      "original_text": "Löschungsankündigung\nHessen Amtsgericht Wetzlar HRB 8938\nSOLIDO TINY HOUSE GmbH – Herborn",
      "type": "Löschungsankündigung",
      "state": "Hessen",
      "amtsgericht": "Amtsgericht Wetzlar",
      "registernummer": "HRB 8938",
      "registerart": "HRB",
      "company_name": "SOLIDO TINY HOUSE GmbH",
      "company_seat": "Herborn",
      "details": "01.11.2024 (Bekanntmachungsdatum)\n\nHessen Amtsgericht Wetzlar HRB 8938\nLöschungsankündigung\n\nSOLIDO TINY HOUSE GmbH\nGesellschaft mit beschränkter Haftung\nHerborn\n\nDas Registergericht beabsichtigt die im Handelsregister eingetragene Gesellschaft von Amts wegen nach § 394 FamFG zu löschen. Die Frist zur Erhebung eines Widerspruchs gegen die beabsichtigte Löschung wird auf 3 Monate festgesetzt."
    },
    {
      "date": "2024-11-01",
      "id": "92364",
      "original_text": "Registerbekanntmachung nach dem Umwandlungsgesetz\nHessen Amtsgericht Frankfurt am Main HRB 122294\nDMH Management GmbH – Frankfurt am Main",
      "type": "Registerbekanntmachung nach dem Umwandlungsgesetz",
      "state": "Hessen",
      "amtsgericht": "Amtsgericht Frankfurt am Main",
      "registernummer": "HRB 122294",
      "registerart": "HRB",
      "company_name": "DMH Management GmbH",
      "company_seat": "Frankfurt am Main",
      "details": "01.11.2024 (Bekanntmachungsdatum)\n\nHessen Amtsgericht Frankfurt am Main HRB 122294\nRegisterbekanntmachung nach dem Umwandlungsgesetz 01.11.2024 (Eintragungsdatum)\n\nDMH Management GmbH\nGesellschaft mit beschränkter Haftung\nFrankfurt am Main\n\nDen Gläubigern der an der Verschmelzung beteiligten Rechtsträger ist, wenn sie binnen sechs Monaten nach dem Tag, an dem die Eintragung der Verschmelzung in das Register des Sitzes desjenigen Rechtsträgers, dessen Gläubiger sie sind, nach § 19 Absatz 3 UmwG bekannt gemacht worden ist, ihren Anspruch nach Grund und Höhe schriftlich anmelden, Sicherheit zu leisten, soweit sie nicht Befriedigung verlangen können. Dieses Recht steht den Gläubigern jedoch nur zu, wenn sie glaubhaft machen, dass durch die Verschmelzung die Erfüllung ihrer Forderung gefährdet wird."
    },
    {
      "date": "2024-11-01",
      "id": "92365",
      "original_text": "Sonstige Registerbekanntmachung\nHessen Amtsgericht Bad Hersfeld HRB 604\nVerifone GmbH – Bad Hersfeld",
      "type": "Sonstige Registerbekanntmachung",
      "state": "Hessen",
      "amtsgericht": "Amtsgericht Bad Hersfeld",
      "registernummer": "HRB 604",
      "registerart": "HRB",
      "company_name": "Verifone GmbH",
      "company_seat": "Bad Hersfeld",
      "details": "01.11.2024 (Bekanntmachungsdatum)\n\nHessen Amtsgericht Bad Hersfeld HRB 604\nSonstige Registerbekanntmachung 01.11.2024 (Eintragungsdatum)\n\nVerifone GmbH\nGesellschaft mit beschränkter Haftung\nBad Hersfeld\n\nDen Gläubigern der Gesellschaft, deren Forderungen begründet worden sind, bevor die Eintragung der Beendigung des Vertrags in das Handelsregister nach § 10 HGB bekannt gemacht worden ist, ist vom anderen Vertragsteil Sicherheit zu leisten, wenn sie sich binnen sechs Monaten nach dieser Bekanntmachung zu diesem Zweck bei ihm melden."
    },
    {
      "date": "2024-11-01",
      "id": "92366",
      "original_text": "Sonstige Registerbekanntmachung\nHessen Amtsgericht Frankfurt am Main HRB 117855\nIndorama Germany GmbH – Hattersheim am Main",
      "type": "Sonstige Registerbekanntmachung",
      "state": "Hessen",
      "amtsgericht": "Amtsgericht Frankfurt am Main",
      "registernummer": "HRB 117855",
      "registerart": "HRB",
      "company_name": "Indorama Germany GmbH",
      "company_seat": "Hattersheim am Main",
      "details": "01.11.2024 (Bekanntmachungsdatum)\n\nHessen Amtsgericht Frankfurt am Main HRB 117855\nSonstige Registerbekanntmachung\n\nIndorama Germany GmbH\nGesellschaft mit beschränkter Haftung\nHattersheim am Main\n\nDurch eine Änderung in den Personen der Aufsichtsratsmitglieder ist eine Liste der Mitglieder des Aufsichtsrates zum Handelsregister eingereicht worden."
    },
    {
      "date": "2024-11-01",
      "id": "92367",
      "original_text": "Registerbekanntmachung nach dem Umwandlungsgesetz\nHessen Amtsgericht Frankfurt am Main HRB 92953\nDeutsche Mittelstandsholding GmbH – Frankfurt am Main",
      "type": "Registerbekanntmachung nach dem Umwandlungsgesetz",
      "state": "Hessen",
      "amtsgericht": "Amtsgericht Frankfurt am Main",
      "registernummer": "HRB 92953",
      "registerart": "HRB",
      "company_name": "Deutsche Mittelstandsholding GmbH",
      "company_seat": "Frankfurt am Main",
      "details": "01.11.2024 (Bekanntmachungsdatum)\n\nHessen Amtsgericht Frankfurt am Main HRB 92953\nRegisterbekanntmachung nach dem Umwandlungsgesetz 01.11.2024 (Eintragungsdatum)\n\nDeutsche Mittelstandsholding GmbH\nGesellschaft mit beschränkter Haftung\nFrankfurt am Main\n\nDen Gläubigern der an der Verschmelzung beteiligten Rechtsträger ist, wenn sie binnen sechs Monaten nach dem Tag, an dem die Eintragung der Verschmelzung in das Register des Sitzes desjenigen Rechtsträgers, dessen Gläubiger sie sind, nach § 19 Absatz 3 UmwG bekannt gemacht worden ist, ihren Anspruch nach Grund und Höhe schriftlich anmelden, Sicherheit zu leisten, soweit sie nicht Befriedigung verlangen können. Dieses Recht steht den Gläubigern jedoch nur zu, wenn sie glaubhaft machen, dass durch die Verschmelzung die Erfüllung ihrer Forderung gefährdet wird."
    },
    {
      "date": "2024-11-01",
      "id": "92368",
      "original_text": "Registerbekanntmachung nach dem Umwandlungsgesetz\nHessen Amtsgericht Frankfurt am Main HRB 136510\nXTP GmbH – Frankfurt am Main",
      "type": "Registerbekanntmachung nach dem Umwandlungsgesetz",
      "state": "Hessen",
      "amtsgericht": "Amtsgericht Frankfurt am Main",
      "registernummer": "HRB 136510",
      "registerart": "HRB",
      "company_name": "XTP GmbH",
      "company_seat": "Frankfurt am Main",
      "details": "01.11.2024 (Bekanntmachungsdatum)\n\nHessen Amtsgericht Frankfurt am Main HRB 136510\nRegisterbekanntmachung nach dem Umwandlungsgesetz 01.11.2024 (Eintragungsdatum)\n\nXTP GmbH\nGesellschaft mit beschränkter Haftung\nFrankfurt am Main\n\nDen Gläubigern der an der formwechselnden Umwandlung beteiligten Rechtsträger ist, wenn sie binnen sechs Monaten nach dem Tag, an dem die Eintragung der formwechselnden Umwandlung in das Register des Sitzes desjenigen Rechtsträgers, dessen Gläubiger sie sind, nach § 201 UmwG bekannt gemacht worden ist, ihren Anspruch nach Grund und Höhe schriftlich anmelden, Sicherheit zu leisten, soweit sie nicht Befriedigung verlangen können. Dieses Recht steht den Gläubigern jedoch nur zu, wenn sie glaubhaft machen, dass durch die formwechselnden Umwandlung die Erfüllung ihrer Forderung gefährdet wird."
    },
    {
      "date": "2024-11-01",
      "id": "92369",
      "original_text": "Registerbekanntmachung nach dem Umwandlungsgesetz\nHessen Amtsgericht Frankfurt am Main HRB 105646\nXTP AG – Frankfurt am Main",
      "type": "Registerbekanntmachung nach dem Umwandlungsgesetz",
      "state": "Hessen",
      "amtsgericht": "Amtsgericht Frankfurt am Main",
      "registernummer": "HRB 105646",
      "registerart": "HRB",
      "company_name": "XTP AG",
      "company_seat": "Frankfurt am Main",
      "details": "01.11.2024 (Bekanntmachungsdatum)\n\nHessen Amtsgericht Frankfurt am Main HRB 105646\nRegisterbekanntmachung nach dem Umwandlungsgesetz 01.11.2024 (Eintragungsdatum)\n\nXTP AG\nAktiengesellschaft\nFrankfurt am Main\n\nDen Gläubigern der an der formwechselnden Umwandlung beteiligten Rechtsträger ist, wenn sie binnen sechs Monaten nach dem Tag, an dem die Eintragung der formwechselnden Umwandlung in das Register des Sitzes desjenigen Rechtsträgers, dessen Gläubiger sie sind, nach § 201 UmwG bekannt gemacht worden ist, ihren Anspruch nach Grund und Höhe schriftlich anmelden, Sicherheit zu leisten, soweit sie nicht Befriedigung verlangen können. Dieses Recht steht den Gläubigern jedoch nur zu, wenn sie glaubhaft machen, dass durch die formwechselnden Umwandlung die Erfüllung ihrer Forderung gefährdet wird."
    },
    {
      "date": "2024-11-01",
      "id": "92370",
      "original_text": "Löschungsankündigung\nHessen Amtsgericht Offenbach am Main HRB 54417\nVALENTO Dienstleistung UG (haftungsbeschränkt) – Neu-Isenburg",
      "type": "Löschungsankündigung",
      "state": "Hessen",
      "amtsgericht": "Amtsgericht Offenbach am Main",
      "registernummer": "HRB 54417",
      "registerart": "HRB",
      "company_name": "VALENTO Dienstleistung UG (haftungsbeschränkt)",
      "company_seat": "Neu-Isenburg",
      "details": "01.11.2024 (Bekanntmachungsdatum)\n\nHessen Amtsgericht Offenbach am Main HRB 54417\nLöschungsankündigung\n\nVALENTO Dienstleistung UG (haftungsbeschränkt)\nGesellschaft mit beschränkter Haftung\nNeu-Isenburg\n\nDas Registergericht beabsichtigt die im Handelsregister eingetragene Gesellschaft von Amts wegen nach § 394 FamFG zu löschen. Die Frist zur Erhebung eines Widerspruchs gegen die beabsichtigte Löschung wird auf 3 Monate festgesetzt."
    },
    {
      "date": "2024-11-01",
      "id": "92371",
      "original_text": "Löschungsankündigung\nHessen Amtsgericht Offenbach am Main HRB 52576\nRHB GmbH – Rödermark",
      "type": "Löschungsankündigung",
      "state": "Hessen",
      "amtsgericht": "Amtsgericht Offenbach am Main",
      "registernummer": "HRB 52576",
      "registerart": "HRB",
      "company_name": "RHB GmbH",
      "company_seat": "Rödermark",
      "details": "01.11.2024 (Bekanntmachungsdatum)\n\nHessen Amtsgericht Offenbach am Main HRB 52576\nLöschungsankündigung\n\nRHB GmbH\nGesellschaft mit beschränkter Haftung\nRödermark\n\nDas Registergericht beabsichtigt die im Handelsregister eingetragene Gesellschaft von Amts wegen nach § 394 FamFG zu löschen. Die Frist zur Erhebung eines Widerspruchs gegen die beabsichtigte Löschung wird auf 3 Monate festgesetzt."
    },
    {
      "date": "2024-11-01",
      "id": "92372",
      "original_text": "Löschungsankündigung\nHessen Amtsgericht Wiesbaden HRB 16583\nMEDIABEST GmbH – Schlangenbad",
      "type": "Löschungsankündigung",
      "state": "Hessen",
      "amtsgericht": "Amtsgericht Wiesbaden",
      "registernummer": "HRB 16583",
      "registerart": "HRB",
      "company_name": "MEDIABEST GmbH",
      "company_seat": "Schlangenbad",
      "details": "01.11.2024 (Bekanntmachungsdatum)\n\nHessen Amtsgericht Wiesbaden HRB 16583\nLöschungsankündigung\n\nMEDIABEST GmbH\nGesellschaft mit beschränkter Haftung\nSchlangenbad\n\nDas Registergericht beabsichtigt die im Handelsregister eingetragene Gesellschaft von Amts wegen nach § 394 FamFG zu löschen. Die Frist zur Erhebung eines Widerspruchs gegen die beabsichtigte Löschung wird auf 3 Monate festgesetzt."
    },
    {
      "date": "2024-11-01",
      "id": "92373",
      "original_text": "Sonstige Registerbekanntmachung\nHessen Amtsgericht Wiesbaden VR 5464\nDiakonieverein Geisenheim im Rheingau e.V. – Geisenheim",
      "type": "Sonstige Registerbekanntmachung",
      "state": "Hessen",
      "amtsgericht": "Amtsgericht Wiesbaden",
      "registernummer": "VR 5464",
      "registerart": "VR",
      "company_name": "Diakonieverein Geisenheim im Rheingau e.V.",
      "company_seat": "Geisenheim",
      "details": "01.11.2024 (Bekanntmachungsdatum)\n\nHessen Amtsgericht Wiesbaden VR 5464\nSonstige Registerbekanntmachung 01.11.2024 (Eintragungsdatum)\n\nDiakonieverein Geisenheim im Rheingau e.V.\neingetragener Verein\nGeisenheim\n\nDer Verein ist aufgelöst."
    },
    {
      "date": "2024-11-01",
      "id": "92374",
      "original_text": "Löschungsankündigung\nHessen Amtsgericht Friedberg HRB 9459\nVital 24 Ambulante Pflege GmbH – Ober-Mörlen",
      "type": "Löschungsankündigung",
      "state": "Hessen",
      "amtsgericht": "Amtsgericht Friedberg",
      "registernummer": "HRB 9459",
      "registerart": "HRB",
      "company_name": "Vital 24 Ambulante Pflege GmbH",
      "company_seat": "Ober-Mörlen",
      "details": "01.11.2024 (Bekanntmachungsdatum)\n\nHessen Amtsgericht Friedberg HRB 9459\nLöschungsankündigung\n\nVital 24 Ambulante Pflege GmbH\nGesellschaft mit beschränkter Haftung\nOber-Mörlen\n\nDas Registergericht beabsichtigt die im Handelsregister eingetragene Gesellschaft von Amts wegen nach § 394 FamFG zu löschen. Die Frist zur Erhebung eines Widerspruchs gegen die beabsichtigte Löschung wird auf 3 Monate festgesetzt."
    }
  ]
}