{
  "date": "2025-06-18",
  "date_of_scrape": "2025-06-19T04:14:44.957Z",
  "tool_version": "0.2.0",
  "number_of_announcements": 146,
  "announcements": [
    {
      "date": "2025-06-18",
      "id": "112540",
      "original_text": "Registerbekanntmachung nach dem Umwandlungsgesetz\nBayern Amtsgericht Würzburg HRB 11954\nXRX Franken GmbH – Estenfeld",
      "type": "Registerbekanntmachung nach dem Umwandlungsgesetz",
      "state": "Bayern",
      "amtsgericht": "Amtsgericht Würzburg",
      "registernummer": "HRB 11954",
      "registerart": "HRB",
      "company_name": "XRX Franken GmbH",
      "company_seat": "Estenfeld",
      "details": "18.06.2025 (Bekanntmachungsdatum)\n\nBayern Amtsgericht Würzburg HRB 11954\nRegisterbekanntmachung nach dem Umwandlungsgesetz 17.06.2025 (Eintragungsdatum)\n\nXRX Franken GmbH\nGesellschaft mit beschränkter Haftung\nEstenfeld\n\nDen Gläubigern der an der Verschmelzung beteiligten Rechtsträger ist, wenn sie binnen sechs Monaten nach dem Tag, an dem die Eintragung der Verschmelzung in das Register des Sitzes desjenigen Rechtsträgers, dessen Gläubiger sie sind, nach § 19 Abs. 3 UmwG als bekannt gemacht gilt, ihren Anspruch nach Grund und Höhe in Textform anmelden, Sicherheit zu leisten, soweit sie nicht Befriedigung verlangen können. Dieses Recht steht den Gläubigern jedoch nur zu, wenn sie glaubhaft machen, dass durch die Verschmelzung die Erfüllung ihrer Forderung gefährdet wird."
    },
    {
      "date": "2025-06-18",
      "id": "112541",
      "original_text": "Registerbekanntmachung nach dem Umwandlungsgesetz\nBayern Amtsgericht Bamberg HRB 10135\nSchlachthof Bamberg GmbH – Bamberg",
      "type": "Registerbekanntmachung nach dem Umwandlungsgesetz",
      "state": "Bayern",
      "amtsgericht": "Amtsgericht Bamberg",
      "registernummer": "HRB 10135",
      "registerart": "HRB",
      "company_name": "Schlachthof Bamberg GmbH",
      "company_seat": "Bamberg",
      "details": "18.06.2025 (Bekanntmachungsdatum)\n\nBayern Amtsgericht Bamberg HRB 10135\nRegisterbekanntmachung nach dem Umwandlungsgesetz 17.06.2025 (Eintragungsdatum)\n\nSchlachthof Bamberg GmbH\nGesellschaft mit beschränkter Haftung\nBamberg\n\nDen Gläubigern der an der Vollübertragung beteiligten Rechtsträger ist, wenn sie binnen sechs Monaten nach dem Tag, an dem die Eintragung der Verschmelzung in das Register des Sitzes desjenigen Rechtsträgers, dessen Gläubiger sie sind, nach § 19 Abs. 3 UmwG als bekannt gemacht gilt, ihren Anspruch nach Grund und Höhe in Textform anmelden, Sicherheit zu leisten, soweit sie nicht Befriedigung verlangen können. Dieses Recht steht den Gläubigern jedoch nur zu, wenn sie glaubhaft machen, dass durch die Verschmelzung die Erfüllung ihrer Forderung gefährdet wird."
    },
    {
      "date": "2025-06-18",
      "id": "112542",
      "original_text": "Registerbekanntmachung nach dem Umwandlungsgesetz\nBayern Amtsgericht Traunstein HRB 33670\nDOCUNIZE GmbH – Altötting",
      "type": "Registerbekanntmachung nach dem Umwandlungsgesetz",
      "state": "Bayern",
      "amtsgericht": "Amtsgericht Traunstein",
      "registernummer": "HRB 33670",
      "registerart": "HRB",
      "company_name": "DOCUNIZE GmbH",
      "company_seat": "Altötting",
      "details": "18.06.2025 (Bekanntmachungsdatum)\n\nBayern Amtsgericht Traunstein HRB 33670\nRegisterbekanntmachung nach dem Umwandlungsgesetz 17.06.2025 (Eintragungsdatum)\n\nDOCUNIZE GmbH\nGesellschaft mit beschränkter Haftung\nAltötting\n\nDen Gläubigern der an der Ausgliederung beteiligten Rechtsträger ist, wenn sie binnen sechs Monaten nach dem Tag, an dem die Eintragung der Ausgliederung in das Register des Sitzes desjenigen Rechtsträgers, dessen Gläubiger sie sind, nach §§ 125, 19 Abs. 3 UmwG als bekannt gemacht gilt, ihren Anspruch nach Grund und Höhe in Textform anmelden, Sicherheit zu leisten, soweit sie nicht Befriedigung verlangen können. Dieses Recht steht den Gläubigern jedoch nur zu, wenn sie glaubhaft machen, dass durch die Ausgliederung die Erfüllung ihrer Forderung gefährdet wird."
    },
    {
      "date": "2025-06-18",
      "id": "112543",
      "original_text": "Registerbekanntmachung nach dem Umwandlungsgesetz\nBayern Amtsgericht Aschaffenburg HRA 5763\nFAEDO GmbH & Co. KG – Großostheim",
      "type": "Registerbekanntmachung nach dem Umwandlungsgesetz",
      "state": "Bayern",
      "amtsgericht": "Amtsgericht Aschaffenburg",
      "registernummer": "HRA 5763",
      "registerart": "HRA",
      "company_name": "FAEDO GmbH & Co. KG",
      "company_seat": "Großostheim",
      "details": "18.06.2025 (Bekanntmachungsdatum)\n\nBayern Amtsgericht Aschaffenburg HRA 5763\nRegisterbekanntmachung nach dem Umwandlungsgesetz 17.06.2025 (Eintragungsdatum)\n\nFAEDO GmbH & Co. KG\nKommanditgesellschaft\nGroßostheim\n\nDen Gläubigern des formwechselnden Rechtsträgers ist, wenn sie binnen sechs Monaten nach dem Tag, an dem die Eintragung des Formwechsels nach § 201 UmwG als bekannt gemacht gilt, ihren Anspruch nach Grund und Höhe in Textform anmelden, Sicherheit zu leisten, soweit sie nicht Befriedigung verlangen können. Dieses Recht steht den Gläubigern jedoch nur zu, wenn sie glaubhaft machen, dass durch den Formwechsel die Erfüllung ihrer Forderung gefährdet wird."
    },
    {
      "date": "2025-06-18",
      "id": "112544",
      "original_text": "Registerbekanntmachung nach dem Umwandlungsgesetz\nBayern Amtsgericht Aschaffenburg HRB 17748\nW & N GmbH – Haibach",
      "type": "Registerbekanntmachung nach dem Umwandlungsgesetz",
      "state": "Bayern",
      "amtsgericht": "Amtsgericht Aschaffenburg",
      "registernummer": "HRB 17748",
      "registerart": "HRB",
      "company_name": "W & N GmbH",
      "company_seat": "Haibach",
      "details": "18.06.2025 (Bekanntmachungsdatum)\n\nBayern Amtsgericht Aschaffenburg HRB 17748\nRegisterbekanntmachung nach dem Umwandlungsgesetz 17.06.2025 (Eintragungsdatum)\n\nW & N GmbH\nGesellschaft mit beschränkter Haftung\nHaibach\n\nDen Gläubigern der an der Spaltung beteiligten Rechtsträger ist, wenn sie binnen sechs Monaten nach dem Tag, an dem die Eintragung der Spaltung in das Register des Sitzes desjenigen Rechtsträgers, dessen Gläubiger sie sind, nach §§ 125, 19 Abs. 3 UmwG als bekannt gemacht gilt, ihren Anspruch nach Grund und Höhe in Textform anmelden, Sicherheit zu leisten, soweit sie nicht Befriedigung verlangen können. Dieses Recht steht den Gläubigern jedoch nur zu, wenn sie glaubhaft machen, dass durch die Spaltung die Erfüllung ihrer Forderung gefährdet wird."
    },
    {
      "date": "2025-06-18",
      "id": "112545",
      "original_text": "Registerbekanntmachung nach dem Umwandlungsgesetz\nBayern Amtsgericht München HRB 119611\nLHI Capital Management GmbH – Pullach i. Isartal",
      "type": "Registerbekanntmachung nach dem Umwandlungsgesetz",
      "state": "Bayern",
      "amtsgericht": "Amtsgericht München",
      "registernummer": "HRB 119611",
      "registerart": "HRB",
      "company_name": "LHI Capital Management GmbH",
      "company_seat": "Pullach i. Isartal",
      "details": "18.06.2025 (Bekanntmachungsdatum)\n\nBayern Amtsgericht München HRB 119611\nRegisterbekanntmachung nach dem Umwandlungsgesetz 17.06.2025 (Eintragungsdatum)\n\nLHI Capital Management GmbH\nGesellschaft mit beschränkter Haftung\nPullach i. Isartal\n\nDen Gläubigern der an der Verschmelzung beteiligten Rechtsträger ist, wenn sie binnen sechs Monaten nach dem Tag, an dem die Eintragung der Verschmelzung in das Register des Sitzes desjenigen Rechtsträgers, dessen Gläubiger sie sind, nach § 19 Abs. 3 UmwG als bekannt gemacht gilt, ihren Anspruch nach Grund und Höhe in Textform anmelden, Sicherheit zu leisten, soweit sie nicht Befriedigung verlangen können. Dieses Recht steht den Gläubigern jedoch nur zu, wenn sie glaubhaft machen, dass durch die Verschmelzung die Erfüllung ihrer Forderung gefährdet wird."
    },
    {
      "date": "2025-06-18",
      "id": "112546",
      "original_text": "Sonstige Registerbekanntmachung\nBayern Amtsgericht Nürnberg HRB 9342\nNürnberger Lebensversicherung AG – Nürnberg",
      "type": "Sonstige Registerbekanntmachung",
      "state": "Bayern",
      "amtsgericht": "Amtsgericht Nürnberg",
      "registernummer": "HRB 9342",
      "registerart": "HRB",
      "company_name": "Nürnberger Lebensversicherung AG",
      "company_seat": "Nürnberg",
      "details": "18.06.2025 (Bekanntmachungsdatum)\n\nBayern Amtsgericht Nürnberg HRB 9342\nSonstige Registerbekanntmachung\n\nNürnberger Lebensversicherung AG\nAktiengesellschaft\nNürnberg\n\nDem Amtsgericht Nürnberg -Registergericht- ist eine Liste der Mitglieder des Aufsichtsrats eingereicht worden, § 106 AktG."
    },
    {
      "date": "2025-06-18",
      "id": "112547",
      "original_text": "Registerbekanntmachung nach dem Umwandlungsgesetz\nBayern Amtsgericht Aschaffenburg HRB 18110\nFAEDO GmbH – Aschaffenburg",
      "type": "Registerbekanntmachung nach dem Umwandlungsgesetz",
      "state": "Bayern",
      "amtsgericht": "Amtsgericht Aschaffenburg",
      "registernummer": "HRB 18110",
      "registerart": "HRB",
      "company_name": "FAEDO GmbH",
      "company_seat": "Aschaffenburg",
      "details": "18.06.2025 (Bekanntmachungsdatum)\n\nBayern Amtsgericht Aschaffenburg HRB 18110\nRegisterbekanntmachung nach dem Umwandlungsgesetz 17.06.2025 (Eintragungsdatum)\n\nFAEDO GmbH\nGesellschaft mit beschränkter Haftung\nAschaffenburg\n\nDen Gläubigern des formwechselnden Rechtsträgers ist, wenn sie binnen sechs Monaten nach dem Tag, an dem die Eintragung des Formwechsels nach § 201 UmwG als bekannt gemacht gilt, ihren Anspruch nach Grund und Höhe in Textform anmelden, Sicherheit zu leisten, soweit sie nicht Befriedigung verlangen können. Dieses Recht steht den Gläubigern jedoch nur zu, wenn sie glaubhaft machen, dass durch den Formwechsel die Erfüllung ihrer Forderung gefährdet wird."
    },
    {
      "date": "2025-06-18",
      "id": "112548",
      "original_text": "Registerbekanntmachung nach dem Umwandlungsgesetz\nBayern Amtsgericht München HRB 85872\nGräfe und Unzer Verlag GmbH – München",
      "type": "Registerbekanntmachung nach dem Umwandlungsgesetz",
      "state": "Bayern",
      "amtsgericht": "Amtsgericht München",
      "registernummer": "HRB 85872",
      "registerart": "HRB",
      "company_name": "Gräfe und Unzer Verlag GmbH",
      "company_seat": "München",
      "details": "18.06.2025 (Bekanntmachungsdatum)\n\nBayern Amtsgericht München HRB 85872\nRegisterbekanntmachung nach dem Umwandlungsgesetz 17.06.2025 (Eintragungsdatum)\n\nGräfe und Unzer Verlag GmbH\nGesellschaft mit beschränkter Haftung\nMünchen\n\nDen Gläubigern der an der Verschmelzung beteiligten Rechtsträger ist, wenn sie binnen sechs Monaten nach dem Tag, an dem die Eintragung der Verschmelzung in das Register des Sitzes desjenigen Rechtsträgers, dessen Gläubiger sie sind, nach § 19 Abs. 3 UmwG als bekannt gemacht gilt, ihren Anspruch nach Grund und Höhe in Textform anmelden, Sicherheit zu leisten, soweit sie nicht Befriedigung verlangen können. Dieses Recht steht den Gläubigern jedoch nur zu, wenn sie glaubhaft machen, dass durch die Verschmelzung die Erfüllung ihrer Forderung gefährdet wird."
    },
    {
      "date": "2025-06-18",
      "id": "112549",
      "original_text": "Löschungsankündigung\nBayern Amtsgericht München HRB 219689\nDirndlplatz GmbH – München",
      "type": "Löschungsankündigung",
      "state": "Bayern",
      "amtsgericht": "Amtsgericht München",
      "registernummer": "HRB 219689",
      "registerart": "HRB",
      "company_name": "Dirndlplatz GmbH",
      "company_seat": "München",
      "details": "18.06.2025 (Bekanntmachungsdatum)\n\nBayern Amtsgericht München HRB 219689\nLöschungsankündigung\n\nDirndlplatz GmbH\nGesellschaft mit beschränkter Haftung\nMünchen\n\nDas Registergericht beabsichtigt, die im Handelsregister eingetragene Gesellschaft wegen Vermögenslosigkeit von Amts wegen nach § 394 FamFG zu löschen. Die Frist zur Erhebung eines Widerspruchs ist auf drei Monate festgesetzt."
    },
    {
      "date": "2025-06-18",
      "id": "112550",
      "original_text": "Registerbekanntmachung nach dem Umwandlungsgesetz\nBayern Amtsgericht Bayreuth HRA 2041\nVeolia Umweltservice Süd GmbH & Co. KG – Pegnitz",
      "type": "Registerbekanntmachung nach dem Umwandlungsgesetz",
      "state": "Bayern",
      "amtsgericht": "Amtsgericht Bayreuth",
      "registernummer": "HRA 2041",
      "registerart": "HRA",
      "company_name": "Veolia Umweltservice Süd GmbH & Co. KG",
      "company_seat": "Pegnitz",
      "details": "18.06.2025 (Bekanntmachungsdatum)\n\nBayern Amtsgericht Bayreuth HRA 2041\nRegisterbekanntmachung nach dem Umwandlungsgesetz 17.06.2025 (Eintragungsdatum)\n\nVeolia Umweltservice Süd GmbH & Co. KG\nKommanditgesellschaft\nPegnitz\n\nDen Gläubigern der an der Verschmelzung beteiligten Rechtsträger ist, wenn sie binnen sechs Monaten nach dem Tag, an dem die Eintragung der Verschmelzung in das Register des Sitzes desjenigen Rechtsträgers, dessen Gläubiger sie sind, nach § 19 Abs. 3 UmwG als bekannt gemacht gilt, ihren Anspruch nach Grund und Höhe in Textform anmelden, Sicherheit zu leisten, soweit sie nicht Befriedigung verlangen können. Dieses Recht steht den Gläubigern jedoch nur zu, wenn sie glaubhaft machen, dass durch die Verschmelzung die Erfüllung ihrer Forderung gefährdet wird."
    },
    {
      "date": "2025-06-18",
      "id": "112551",
      "original_text": "Registerbekanntmachung nach dem Umwandlungsgesetz\nBayern Amtsgericht München HRB 180671\nTesTneT Engineering GmbH – Oberding",
      "type": "Registerbekanntmachung nach dem Umwandlungsgesetz",
      "state": "Bayern",
      "amtsgericht": "Amtsgericht München",
      "registernummer": "HRB 180671",
      "registerart": "HRB",
      "company_name": "TesTneT Engineering GmbH",
      "company_seat": "Oberding",
      "details": "18.06.2025 (Bekanntmachungsdatum)\n\nBayern Amtsgericht München HRB 180671\nRegisterbekanntmachung nach dem Umwandlungsgesetz 17.06.2025 (Eintragungsdatum)\n\nTesTneT Engineering GmbH\nGesellschaft mit beschränkter Haftung\nOberding\n\nDen Gläubigern der an der Verschmelzung beteiligten Rechtsträger ist, wenn sie binnen sechs Monaten nach dem Tag, an dem die Eintragung der Verschmelzung in das Register des Sitzes desjenigen Rechtsträgers, dessen Gläubiger sie sind, nach § 19 Abs. 3 UmwG als bekannt gemacht gilt, ihren Anspruch nach Grund und Höhe in Textform anmelden, Sicherheit zu leisten, soweit sie nicht Befriedigung verlangen können. Dieses Recht steht den Gläubigern jedoch nur zu, wenn sie glaubhaft machen, dass durch die Verschmelzung die Erfüllung ihrer Forderung gefährdet wird."
    },
    {
      "date": "2025-06-18",
      "id": "112552",
      "original_text": "Registerbekanntmachung nach dem Umwandlungsgesetz\nBayern Amtsgericht München HRA 120181\nKirschgärten 41 GmbH & Co. KG – Pullach i. Isartal",
      "type": "Registerbekanntmachung nach dem Umwandlungsgesetz",
      "state": "Bayern",
      "amtsgericht": "Amtsgericht München",
      "registernummer": "HRA 120181",
      "registerart": "HRA",
      "company_name": "Kirschgärten 41 GmbH & Co. KG",
      "company_seat": "Pullach i. Isartal",
      "details": "18.06.2025 (Bekanntmachungsdatum)\n\nBayern Amtsgericht München HRA 120181\nRegisterbekanntmachung nach dem Umwandlungsgesetz 17.06.2025 (Eintragungsdatum)\n\nKirschgärten 41 GmbH & Co. KG\nKommanditgesellschaft\nPullach i. Isartal\n\nDen Gläubigern der an der Spaltung beteiligten Rechtsträger ist, wenn sie binnen sechs Monaten nach dem Tag, an dem die Eintragung der Spaltung in das Register des Sitzes desjenigen Rechtsträgers, dessen Gläubiger sie sind, nach §§ 125, 19 Abs. 3 UmwG als bekannt gemacht gilt, ihren Anspruch nach Grund und Höhe in Textform anmelden, Sicherheit zu leisten, soweit sie nicht Befriedigung verlangen können. Dieses Recht steht den Gläubigern jedoch nur zu, wenn sie glaubhaft machen, dass durch die Spaltung die Erfüllung ihrer Forderung gefährdet wird."
    },
    {
      "date": "2025-06-18",
      "id": "112553",
      "original_text": "Registerbekanntmachung nach dem Umwandlungsgesetz\nBayern Amtsgericht Aschaffenburg HRB 2914\nSPS Schutzplanken GmbH – Großostheim",
      "type": "Registerbekanntmachung nach dem Umwandlungsgesetz",
      "state": "Bayern",
      "amtsgericht": "Amtsgericht Aschaffenburg",
      "registernummer": "HRB 2914",
      "registerart": "HRB",
      "company_name": "SPS Schutzplanken GmbH",
      "company_seat": "Großostheim",
      "details": "18.06.2025 (Bekanntmachungsdatum)\n\nBayern Amtsgericht Aschaffenburg HRB 2914\nRegisterbekanntmachung nach dem Umwandlungsgesetz 17.06.2025 (Eintragungsdatum)\n\nSPS Schutzplanken GmbH\nGesellschaft mit beschränkter Haftung\nGroßostheim\n\nDen Gläubigern der an der Spaltung beteiligten Rechtsträger ist, wenn sie binnen sechs Monaten nach dem Tag, an dem die Eintragung der Spaltung in das Register des Sitzes desjenigen Rechtsträgers, dessen Gläubiger sie sind, nach §§ 125, 19 Abs. 3 UmwG als bekannt gemacht gilt, ihren Anspruch nach Grund und Höhe in Textform anmelden, Sicherheit zu leisten, soweit sie nicht Befriedigung verlangen können. Dieses Recht steht den Gläubigern jedoch nur zu, wenn sie glaubhaft machen, dass durch die Spaltung die Erfüllung ihrer Forderung gefährdet wird."
    },
    {
      "date": "2025-06-18",
      "id": "112554",
      "original_text": "Löschungsankündigung\nBayern Amtsgericht Nürnberg HRB 32272\nARVO GmbH – Nürnberg",
      "type": "Löschungsankündigung",
      "state": "Bayern",
      "amtsgericht": "Amtsgericht Nürnberg",
      "registernummer": "HRB 32272",
      "registerart": "HRB",
      "company_name": "ARVO GmbH",
      "company_seat": "Nürnberg",
      "details": "18.06.2025 (Bekanntmachungsdatum)\n\nBayern Amtsgericht Nürnberg HRB 32272\nLöschungsankündigung\n\nARVO GmbH\nGesellschaft mit beschränkter Haftung\nNürnberg\n\nDas Registergericht beabsichtigt, die im Handelsregister eingetragene Gesellschaft wegen Vermögenslosigkeit von Amts wegen nach § 394 FamFG zu löschen. Die Frist zur Erhebung eines Widerspruchs ist auf einen Monat festgesetzt."
    },
    {
      "date": "2025-06-18",
      "id": "112555",
      "original_text": "Registerbekanntmachung nach dem Umwandlungsgesetz\nBayern Amtsgericht München HRB 257347\nrehaneo GmbH – München",
      "type": "Registerbekanntmachung nach dem Umwandlungsgesetz",
      "state": "Bayern",
      "amtsgericht": "Amtsgericht München",
      "registernummer": "HRB 257347",
      "registerart": "HRB",
      "company_name": "rehaneo GmbH",
      "company_seat": "München",
      "details": "18.06.2025 (Bekanntmachungsdatum)\n\nBayern Amtsgericht München HRB 257347\nRegisterbekanntmachung nach dem Umwandlungsgesetz 17.06.2025 (Eintragungsdatum)\n\nrehaneo GmbH\nGesellschaft mit beschränkter Haftung\nMünchen\n\nDen Gläubigern der an der Verschmelzung beteiligten Rechtsträger ist, wenn sie binnen sechs Monaten nach dem Tag, an dem die Eintragung der Verschmelzung in das Register des Sitzes desjenigen Rechtsträgers, dessen Gläubiger sie sind, nach § 19 Abs. 3 UmwG als bekannt gemacht gilt, ihren Anspruch nach Grund und Höhe in Textform anmelden, Sicherheit zu leisten, soweit sie nicht Befriedigung verlangen können. Dieses Recht steht den Gläubigern jedoch nur zu, wenn sie glaubhaft machen, dass durch die Verschmelzung die Erfüllung ihrer Forderung gefährdet wird."
    },
    {
      "date": "2025-06-18",
      "id": "112556",
      "original_text": "Registerbekanntmachung nach dem Umwandlungsgesetz\nBayern Amtsgericht München HRB 242577\nNIGELLA Verwaltungsgesellschaft mbH – Pullach i.Isartal",
      "type": "Registerbekanntmachung nach dem Umwandlungsgesetz",
      "state": "Bayern",
      "amtsgericht": "Amtsgericht München",
      "registernummer": "HRB 242577",
      "registerart": "HRB",
      "company_name": "NIGELLA Verwaltungsgesellschaft mbH",
      "company_seat": "Pullach i.Isartal",
      "details": "18.06.2025 (Bekanntmachungsdatum)\n\nBayern Amtsgericht München HRB 242577\nRegisterbekanntmachung nach dem Umwandlungsgesetz 17.06.2025 (Eintragungsdatum)\n\nNIGELLA Verwaltungsgesellschaft mbH\nGesellschaft mit beschränkter Haftung\nPullach i.Isartal\n\nDen Gläubigern der an der Verschmelzung beteiligten Rechtsträger ist, wenn sie binnen sechs Monaten nach dem Tag, an dem die Eintragung der Verschmelzung in das Register des Sitzes desjenigen Rechtsträgers, dessen Gläubiger sie sind, nach § 19 Abs. 3 UmwG als bekannt gemacht gilt, ihren Anspruch nach Grund und Höhe in Textform anmelden, Sicherheit zu leisten, soweit sie nicht Befriedigung verlangen können. Dieses Recht steht den Gläubigern jedoch nur zu, wenn sie glaubhaft machen, dass durch die Verschmelzung die Erfüllung ihrer Forderung gefährdet wird."
    },
    {
      "date": "2025-06-18",
      "id": "112557",
      "original_text": "Registerbekanntmachung nach dem Umwandlungsgesetz\nBayern Amtsgericht München HRB 166228\nPaula Grundstücksverwaltungsgesellschaft mbH – Pullach i. Isartal",
      "type": "Registerbekanntmachung nach dem Umwandlungsgesetz",
      "state": "Bayern",
      "amtsgericht": "Amtsgericht München",
      "registernummer": "HRB 166228",
      "registerart": "HRB",
      "company_name": "Paula Grundstücksverwaltungsgesellschaft mbH",
      "company_seat": "Pullach i. Isartal",
      "details": "18.06.2025 (Bekanntmachungsdatum)\n\nBayern Amtsgericht München HRB 166228\nRegisterbekanntmachung nach dem Umwandlungsgesetz 17.06.2025 (Eintragungsdatum)\n\nPaula Grundstücksverwaltungsgesellschaft mbH\nGesellschaft mit beschränkter Haftung\nPullach i. Isartal\n\nDen Gläubigern der an der Verschmelzung beteiligten Rechtsträger ist, wenn sie binnen sechs Monaten nach dem Tag, an dem die Eintragung der Verschmelzung in das Register des Sitzes desjenigen Rechtsträgers, dessen Gläubiger sie sind, nach § 19 Abs. 3 UmwG als bekannt gemacht gilt, ihren Anspruch nach Grund und Höhe in Textform anmelden, Sicherheit zu leisten, soweit sie nicht Befriedigung verlangen können. Dieses Recht steht den Gläubigern jedoch nur zu, wenn sie glaubhaft machen, dass durch die Verschmelzung die Erfüllung ihrer Forderung gefährdet wird."
    },
    {
      "date": "2025-06-18",
      "id": "112558",
      "original_text": "Löschungsankündigung\nBayern Amtsgericht München HRB 73673\nFilmton Service Heiko Hinderks GmbH – Starnberg",
      "type": "Löschungsankündigung",
      "state": "Bayern",
      "amtsgericht": "Amtsgericht München",
      "registernummer": "HRB 73673",
      "registerart": "HRB",
      "company_name": "Filmton Service Heiko Hinderks GmbH",
      "company_seat": "Starnberg",
      "details": "18.06.2025 (Bekanntmachungsdatum)\n\nBayern Amtsgericht München HRB 73673\nLöschungsankündigung\n\nFilmton Service Heiko Hinderks GmbH\nGesellschaft mit beschränkter Haftung\nStarnberg\n\nDas Registergericht beabsichtigt, die im Handelsregister eingetragene Gesellschaft wegen Vermögenslosigkeit von Amts wegen nach § 394 FamFG zu löschen. Die Frist zur Erhebung eines Widerspruchs ist auf drei Monate festgesetzt."
    },
    {
      "date": "2025-06-18",
      "id": "112559",
      "original_text": "Löschungsankündigung\nBayern Amtsgericht München HRB 161473\nDOMA BAU SERVICE GmbH – München",
      "type": "Löschungsankündigung",
      "state": "Bayern",
      "amtsgericht": "Amtsgericht München",
      "registernummer": "HRB 161473",
      "registerart": "HRB",
      "company_name": "DOMA BAU SERVICE GmbH",
      "company_seat": "München",
      "details": "18.06.2025 (Bekanntmachungsdatum)\n\nBayern Amtsgericht München HRB 161473\nLöschungsankündigung\n\nDOMA BAU SERVICE GmbH\nGesellschaft mit beschränkter Haftung\nMünchen\n\nDas Registergericht beabsichtigt, die im Handelsregister eingetragene Gesellschaft wegen Vermögenslosigkeit von Amts wegen nach § 394 FamFG zu löschen. Die Frist zur Erhebung eines Widerspruchs ist auf drei Monate festgesetzt."
    },
    {
      "date": "2025-06-18",
      "id": "112560",
      "original_text": "Löschungsankündigung\nBayern Amtsgericht Kempten (Allgäu) HRB 15950\nMIS-FOOD GmbH – Lindau (Bodensee)",
      "type": "Löschungsankündigung",
      "state": "Bayern",
      "amtsgericht": "Amtsgericht Kempten (Allgäu)",
      "registernummer": "HRB 15950",
      "registerart": "HRB",
      "company_name": "MIS-FOOD GmbH",
      "company_seat": "Lindau (Bodensee)",
      "details": "18.06.2025 (Bekanntmachungsdatum)\n\nBayern Amtsgericht Kempten (Allgäu) HRB 15950\nLöschungsankündigung\n\nMIS-FOOD GmbH\nGesellschaft mit beschränkter Haftung\nLindau (Bodensee)\n\nDas Registergericht beabsichtigt, die im Handelsregister eingetragene Gesellschaft wegen Vermögenslosigkeit von Amts wegen nach § 394 FamFG zu löschen. Die Frist zur Erhebung eines Widerspruchs ist auf einen Monat festgesetzt."
    },
    {
      "date": "2025-06-18",
      "id": "112561",
      "original_text": "Registerbekanntmachung nach dem Umwandlungsgesetz\nBayern Amtsgericht München HRB 242576\nEXPERTUS Verwaltungsgesellschaft mbH – Pullach i.Isartal",
      "type": "Registerbekanntmachung nach dem Umwandlungsgesetz",
      "state": "Bayern",
      "amtsgericht": "Amtsgericht München",
      "registernummer": "HRB 242576",
      "registerart": "HRB",
      "company_name": "EXPERTUS Verwaltungsgesellschaft mbH",
      "company_seat": "Pullach i.Isartal",
      "details": "18.06.2025 (Bekanntmachungsdatum)\n\nBayern Amtsgericht München HRB 242576\nRegisterbekanntmachung nach dem Umwandlungsgesetz 17.06.2025 (Eintragungsdatum)\n\nEXPERTUS Verwaltungsgesellschaft mbH\nGesellschaft mit beschränkter Haftung\nPullach i.Isartal\n\nDen Gläubigern der an der Verschmelzung beteiligten Rechtsträger ist, wenn sie binnen sechs Monaten nach dem Tag, an dem die Eintragung der Verschmelzung in das Register des Sitzes desjenigen Rechtsträgers, dessen Gläubiger sie sind, nach § 19 Abs. 3 UmwG als bekannt gemacht gilt, ihren Anspruch nach Grund und Höhe in Textform anmelden, Sicherheit zu leisten, soweit sie nicht Befriedigung verlangen können. Dieses Recht steht den Gläubigern jedoch nur zu, wenn sie glaubhaft machen, dass durch die Verschmelzung die Erfüllung ihrer Forderung gefährdet wird."
    },
    {
      "date": "2025-06-18",
      "id": "112562",
      "original_text": "Registerbekanntmachung nach dem Umwandlungsgesetz\nBayern Amtsgericht München HRB 275642\nISP Isar Sales Partner GmbH – München",
      "type": "Registerbekanntmachung nach dem Umwandlungsgesetz",
      "state": "Bayern",
      "amtsgericht": "Amtsgericht München",
      "registernummer": "HRB 275642",
      "registerart": "HRB",
      "company_name": "ISP Isar Sales Partner GmbH",
      "company_seat": "München",
      "details": "18.06.2025 (Bekanntmachungsdatum)\n\nBayern Amtsgericht München HRB 275642\nRegisterbekanntmachung nach dem Umwandlungsgesetz 17.06.2025 (Eintragungsdatum)\n\nISP Isar Sales Partner GmbH\nGesellschaft mit beschränkter Haftung\nMünchen\n\nDen Gläubigern der an der Verschmelzung beteiligten Rechtsträger ist, wenn sie binnen sechs Monaten nach dem Tag, an dem die Eintragung der Verschmelzung in das Register des Sitzes desjenigen Rechtsträgers, dessen Gläubiger sie sind, nach § 19 Abs. 3 UmwG als bekannt gemacht gilt, ihren Anspruch nach Grund und Höhe in Textform anmelden, Sicherheit zu leisten, soweit sie nicht Befriedigung verlangen können. Dieses Recht steht den Gläubigern jedoch nur zu, wenn sie glaubhaft machen, dass durch die Verschmelzung die Erfüllung ihrer Forderung gefährdet wird."
    },
    {
      "date": "2025-06-18",
      "id": "112563",
      "original_text": "Registerbekanntmachung nach dem Umwandlungsgesetz\nBayern Amtsgericht München HRA 120400\nKirschgärten 423 GmbH & Co. KG – Pullach i.Isartal",
      "type": "Registerbekanntmachung nach dem Umwandlungsgesetz",
      "state": "Bayern",
      "amtsgericht": "Amtsgericht München",
      "registernummer": "HRA 120400",
      "registerart": "HRA",
      "company_name": "Kirschgärten 423 GmbH & Co. KG",
      "company_seat": "Pullach i.Isartal",
      "details": "18.06.2025 (Bekanntmachungsdatum)\n\nBayern Amtsgericht München HRA 120400\nRegisterbekanntmachung nach dem Umwandlungsgesetz 17.06.2025 (Eintragungsdatum)\n\nKirschgärten 423 GmbH & Co. KG\nKommanditgesellschaft\nPullach i.Isartal\n\nDen Gläubigern der an der Spaltung beteiligten Rechtsträger ist, wenn sie binnen sechs Monaten nach dem Tag, an dem die Eintragung der Spaltung in das Register des Sitzes desjenigen Rechtsträgers, dessen Gläubiger sie sind, nach §§ 125, 19 Abs. 3 UmwG als bekannt gemacht gilt, ihren Anspruch nach Grund und Höhe in Textform anmelden, Sicherheit zu leisten, soweit sie nicht Befriedigung verlangen können. Dieses Recht steht den Gläubigern jedoch nur zu, wenn sie glaubhaft machen, dass durch die Spaltung die Erfüllung ihrer Forderung gefährdet wird."
    },
    {
      "date": "2025-06-18",
      "id": "112564",
      "original_text": "Löschungsankündigung\nBayern Amtsgericht Hof HRA 4457\nSunInvestGroup GmbH & Co. KG – Marktredwitz",
      "type": "Löschungsankündigung",
      "state": "Bayern",
      "amtsgericht": "Amtsgericht Hof",
      "registernummer": "HRA 4457",
      "registerart": "HRA",
      "company_name": "SunInvestGroup GmbH & Co. KG",
      "company_seat": "Marktredwitz",
      "details": "18.06.2025 (Bekanntmachungsdatum)\n\nBayern Amtsgericht Hof HRA 4457\nLöschungsankündigung\n\nSunInvestGroup GmbH & Co. KG\nKommanditgesellschaft\nMarktredwitz\n\nDas Registergericht beabsichtigt, die im Handelsregister eingetragene Firma wegen Vermögenslosigkeit von Amts wegen nach § 394 FamFG zu löschen. Die Frist zur Erhebung eines Widerspruchs ist auf sechs Wochen festgesetzt."
    },
    {
      "date": "2025-06-18",
      "id": "112565",
      "original_text": "Registerbekanntmachung nach dem Umwandlungsgesetz\nBayern Amtsgericht München HRB 204528\nRALOSA Verwaltung GmbH – Pullach i.Isartal",
      "type": "Registerbekanntmachung nach dem Umwandlungsgesetz",
      "state": "Bayern",
      "amtsgericht": "Amtsgericht München",
      "registernummer": "HRB 204528",
      "registerart": "HRB",
      "company_name": "RALOSA Verwaltung GmbH",
      "company_seat": "Pullach i.Isartal",
      "details": "18.06.2025 (Bekanntmachungsdatum)\n\nBayern Amtsgericht München HRB 204528\nRegisterbekanntmachung nach dem Umwandlungsgesetz 17.06.2025 (Eintragungsdatum)\n\nRALOSA Verwaltung GmbH\nGesellschaft mit beschränkter Haftung\nPullach i.Isartal\n\nDen Gläubigern der an der Verschmelzung beteiligten Rechtsträger ist, wenn sie binnen sechs Monaten nach dem Tag, an dem die Eintragung der Verschmelzung in das Register des Sitzes desjenigen Rechtsträgers, dessen Gläubiger sie sind, nach § 19 Abs. 3 UmwG als bekannt gemacht gilt, ihren Anspruch nach Grund und Höhe in Textform anmelden, Sicherheit zu leisten, soweit sie nicht Befriedigung verlangen können. Dieses Recht steht den Gläubigern jedoch nur zu, wenn sie glaubhaft machen, dass durch die Verschmelzung die Erfüllung ihrer Forderung gefährdet wird."
    },
    {
      "date": "2025-06-18",
      "id": "112566",
      "original_text": "Registerbekanntmachung nach dem Umwandlungsgesetz\nBayern Amtsgericht München HRB 153158\nArkaden Grundstücksverwaltungsgesellschaft mbH – München",
      "type": "Registerbekanntmachung nach dem Umwandlungsgesetz",
      "state": "Bayern",
      "amtsgericht": "Amtsgericht München",
      "registernummer": "HRB 153158",
      "registerart": "HRB",
      "company_name": "Arkaden Grundstücksverwaltungsgesellschaft mbH",
      "company_seat": "München",
      "details": "18.06.2025 (Bekanntmachungsdatum)\n\nBayern Amtsgericht München HRB 153158\nRegisterbekanntmachung nach dem Umwandlungsgesetz 17.06.2025 (Eintragungsdatum)\n\nArkaden Grundstücksverwaltungsgesellschaft mbH\nGesellschaft mit beschränkter Haftung\nMünchen\n\nDen Gläubigern der an der Verschmelzung beteiligten Rechtsträger ist, wenn sie binnen sechs Monaten nach dem Tag, an dem die Eintragung der Verschmelzung in das Register des Sitzes desjenigen Rechtsträgers, dessen Gläubiger sie sind, nach § 19 Abs. 3 UmwG als bekannt gemacht gilt, ihren Anspruch nach Grund und Höhe in Textform anmelden, Sicherheit zu leisten, soweit sie nicht Befriedigung verlangen können. Dieses Recht steht den Gläubigern jedoch nur zu, wenn sie glaubhaft machen, dass durch die Verschmelzung die Erfüllung ihrer Forderung gefährdet wird."
    },
    {
      "date": "2025-06-18",
      "id": "112567",
      "original_text": "Registerbekanntmachung nach dem Umwandlungsgesetz\nBayern Amtsgericht München HRB 214124\nincanto Haus- und Vermögensverwaltungs GmbH – München",
      "type": "Registerbekanntmachung nach dem Umwandlungsgesetz",
      "state": "Bayern",
      "amtsgericht": "Amtsgericht München",
      "registernummer": "HRB 214124",
      "registerart": "HRB",
      "company_name": "incanto Haus- und Vermögensverwaltungs GmbH",
      "company_seat": "München",
      "details": "18.06.2025 (Bekanntmachungsdatum)\n\nBayern Amtsgericht München HRB 214124\nRegisterbekanntmachung nach dem Umwandlungsgesetz 17.06.2025 (Eintragungsdatum)\n\nincanto Haus- und Vermögensverwaltungs GmbH\nGesellschaft mit beschränkter Haftung\nMünchen\n\nDen Gläubigern der an der Verschmelzung beteiligten Rechtsträger ist, wenn sie binnen sechs Monaten nach dem Tag, an dem die Eintragung der Verschmelzung in das Register des Sitzes desjenigen Rechtsträgers, dessen Gläubiger sie sind, nach § 19 Abs. 3 UmwG als bekannt gemacht gilt, ihren Anspruch nach Grund und Höhe in Textform anmelden, Sicherheit zu leisten, soweit sie nicht Befriedigung verlangen können. Dieses Recht steht den Gläubigern jedoch nur zu, wenn sie glaubhaft machen, dass durch die Verschmelzung die Erfüllung ihrer Forderung gefährdet wird."
    },
    {
      "date": "2025-06-18",
      "id": "112568",
      "original_text": "Löschungsankündigung\nBayern Amtsgericht München HRB 121775\nNew Mark Interactive Verwaltungs- und Beteiligungs GmbH – München",
      "type": "Löschungsankündigung",
      "state": "Bayern",
      "amtsgericht": "Amtsgericht München",
      "registernummer": "HRB 121775",
      "registerart": "HRB",
      "company_name": "New Mark Interactive Verwaltungs- und Beteiligungs GmbH",
      "company_seat": "München",
      "details": "18.06.2025 (Bekanntmachungsdatum)\n\nBayern Amtsgericht München HRB 121775\nLöschungsankündigung\n\nNew Mark Interactive Verwaltungs- und Beteiligungs GmbH\nGesellschaft mit beschränkter Haftung\nMünchen\n\nDas Registergericht beabsichtigt, die im Handelsregister eingetragene Gesellschaft wegen Vermögenslosigkeit von Amts wegen nach § 394 FamFG zu löschen. Die Frist zur Erhebung eines Widerspruchs ist auf drei Monate festgesetzt."
    },
    {
      "date": "2025-06-18",
      "id": "112569",
      "original_text": "Löschungsankündigung\nBayern Amtsgericht Nürnberg HRB 27364\nLVC Project GmbH – Nürnberg",
      "type": "Löschungsankündigung",
      "state": "Bayern",
      "amtsgericht": "Amtsgericht Nürnberg",
      "registernummer": "HRB 27364",
      "registerart": "HRB",
      "company_name": "LVC Project GmbH",
      "company_seat": "Nürnberg",
      "details": "18.06.2025 (Bekanntmachungsdatum)\n\nBayern Amtsgericht Nürnberg HRB 27364\nLöschungsankündigung\n\nLVC Project GmbH\nGesellschaft mit beschränkter Haftung\nNürnberg\n\nDas Registergericht beabsichtigt, die im Handelsregister eingetragene Gesellschaft wegen Vermögenslosigkeit von Amts wegen nach § 394 FamFG zu löschen. Die Frist zur Erhebung eines Widerspruchs ist auf einen Monat festgesetzt."
    },
    {
      "date": "2025-06-18",
      "id": "112570",
      "original_text": "Registerbekanntmachung nach dem Umwandlungsgesetz\nBayern Amtsgericht München HRB 285335\nIU Teaching Services 5 GmbH – München",
      "type": "Registerbekanntmachung nach dem Umwandlungsgesetz",
      "state": "Bayern",
      "amtsgericht": "Amtsgericht München",
      "registernummer": "HRB 285335",
      "registerart": "HRB",
      "company_name": "IU Teaching Services 5 GmbH",
      "company_seat": "München",
      "details": "18.06.2025 (Bekanntmachungsdatum)\n\nBayern Amtsgericht München HRB 285335\nRegisterbekanntmachung nach dem Umwandlungsgesetz 17.06.2025 (Eintragungsdatum)\n\nIU Teaching Services 5 GmbH\nGesellschaft mit beschränkter Haftung\nMünchen\n\nDen Gläubigern der an der Verschmelzung beteiligten Rechtsträger ist, wenn sie binnen sechs Monaten nach dem Tag, an dem die Eintragung der Verschmelzung in das Register des Sitzes desjenigen Rechtsträgers, dessen Gläubiger sie sind, nach § 19 Abs. 3 UmwG als bekannt gemacht gilt, ihren Anspruch nach Grund und Höhe in Textform anmelden, Sicherheit zu leisten, soweit sie nicht Befriedigung verlangen können. Dieses Recht steht den Gläubigern jedoch nur zu, wenn sie glaubhaft machen, dass durch die Verschmelzung die Erfüllung ihrer Forderung gefährdet wird."
    },
    {
      "date": "2025-06-18",
      "id": "112571",
      "original_text": "Registerbekanntmachung nach dem Umwandlungsgesetz\nBayern Amtsgericht München HRB 127746\nEQT Partners GmbH – München",
      "type": "Registerbekanntmachung nach dem Umwandlungsgesetz",
      "state": "Bayern",
      "amtsgericht": "Amtsgericht München",
      "registernummer": "HRB 127746",
      "registerart": "HRB",
      "company_name": "EQT Partners GmbH",
      "company_seat": "München",
      "details": "18.06.2025 (Bekanntmachungsdatum)\n\nBayern Amtsgericht München HRB 127746\nRegisterbekanntmachung nach dem Umwandlungsgesetz 17.06.2025 (Eintragungsdatum)\n\nEQT Partners GmbH\nGesellschaft mit beschränkter Haftung\nMünchen\n\nDen Gläubigern der an der Verschmelzung beteiligten Rechtsträger ist, wenn sie binnen sechs Monaten nach dem Tag, an dem die Eintragung der Verschmelzung in das Register des Sitzes desjenigen Rechtsträgers, dessen Gläubiger sie sind, nach § 19 Abs. 3 UmwG als bekannt gemacht gilt, ihren Anspruch nach Grund und Höhe in Textform anmelden, Sicherheit zu leisten, soweit sie nicht Befriedigung verlangen können. Dieses Recht steht den Gläubigern jedoch nur zu, wenn sie glaubhaft machen, dass durch die Verschmelzung die Erfüllung ihrer Forderung gefährdet wird."
    },
    {
      "date": "2025-06-18",
      "id": "112572",
      "original_text": "Registerbekanntmachung nach dem Umwandlungsgesetz\nBayern Amtsgericht München HRA 120929\nCAVOG LLC & Co. KG – München",
      "type": "Registerbekanntmachung nach dem Umwandlungsgesetz",
      "state": "Bayern",
      "amtsgericht": "Amtsgericht München",
      "registernummer": "HRA 120929",
      "registerart": "HRA",
      "company_name": "CAVOG LLC & Co. KG",
      "company_seat": "München",
      "details": "18.06.2025 (Bekanntmachungsdatum)\n\nBayern Amtsgericht München HRA 120929\nRegisterbekanntmachung nach dem Umwandlungsgesetz 17.06.2025 (Eintragungsdatum)\n\nCAVOG LLC & Co. KG\nKommanditgesellschaft\nMünchen\n\nDen Gläubigern der an der Verschmelzung beteiligten Rechtsträger ist, wenn sie binnen sechs Monaten nach dem Tag, an dem die Eintragung der Verschmelzung in das Register des Sitzes desjenigen Rechtsträgers, dessen Gläubiger sie sind, nach § 19 Abs. 3 UmwG als bekannt gemacht gilt, ihren Anspruch nach Grund und Höhe in Textform anmelden, Sicherheit zu leisten, soweit sie nicht Befriedigung verlangen können. Dieses Recht steht den Gläubigern jedoch nur zu, wenn sie glaubhaft machen, dass durch die Verschmelzung die Erfüllung ihrer Forderung gefährdet wird."
    },
    {
      "date": "2025-06-18",
      "id": "112573",
      "original_text": "Registerbekanntmachung nach dem Umwandlungsgesetz\nBayern Amtsgericht München HRA 105124\nALLPG Immobiliengesellschaft mbH & Co. KG – Pullach",
      "type": "Registerbekanntmachung nach dem Umwandlungsgesetz",
      "state": "Bayern",
      "amtsgericht": "Amtsgericht München",
      "registernummer": "HRA 105124",
      "registerart": "HRA",
      "company_name": "ALLPG Immobiliengesellschaft mbH & Co. KG",
      "company_seat": "Pullach",
      "details": "18.06.2025 (Bekanntmachungsdatum)\n\nBayern Amtsgericht München HRA 105124\nRegisterbekanntmachung nach dem Umwandlungsgesetz 17.06.2025 (Eintragungsdatum)\n\nALLPG Immobiliengesellschaft mbH & Co. KG\nKommanditgesellschaft\nPullach\n\nDen Gläubigern der an der Spaltung beteiligten Rechtsträger ist, wenn sie binnen sechs Monaten nach dem Tag, an dem die Eintragung der Spaltung in das Register des Sitzes desjenigen Rechtsträgers, dessen Gläubiger sie sind, nach §§ 125, 19 Abs. 3 UmwG als bekannt gemacht gilt, ihren Anspruch nach Grund und Höhe in Textform anmelden, Sicherheit zu leisten, soweit sie nicht Befriedigung verlangen können. Dieses Recht steht den Gläubigern jedoch nur zu, wenn sie glaubhaft machen, dass durch die Spaltung die Erfüllung ihrer Forderung gefährdet wird."
    },
    {
      "date": "2025-06-18",
      "id": "112574",
      "original_text": "Einreichung neuer Dokumente\nBerlin Amtsgericht Berlin (Charlottenburg) HRB 264843\nZentiva AG – Berlin",
      "type": "Einreichung neuer Dokumente",
      "state": "Berlin",
      "amtsgericht": "Amtsgericht Berlin (Charlottenburg)",
      "registernummer": "HRB 264843",
      "registerart": "HRB",
      "company_name": "Zentiva AG",
      "company_seat": "Berlin",
      "details": "18.06.2025 (Bekanntmachungsdatum)\n\nBerlin Amtsgericht Berlin (Charlottenburg) HRB 264843\nEinreichung neuer Dokumente\n\nZentiva AG\nAktiengesellschaft\nBerlin\n\nGemäß § 62 Abs. 3 Satz 2 i.V.m. § 61 Satz 2 UmwG, § 10 HGB  wird als nicht eingetragen veröffentlicht:\n\nDie Gesellschaft hat einen Verschmelzungsvertrag vom 13.06.2025 zwischen der Gesellschaft als übernehmenden Rechtsträger und der APONTIS PHARMA AG mit Sitz in Monheim am Rhein (Amtsgericht Düsseldorf, HRB 93162) als übertragendem Rechtsträger zum Handelsregister des Amtsgerichts Charlottenburg eingereicht."
    },
    {
      "date": "2025-06-18",
      "id": "112575",
      "original_text": "Sonstige Registerbekanntmachung\nBerlin Amtsgericht Berlin (Charlottenburg) HRB 276131\nConsus Real Estate GmbH – Berlin",
      "type": "Sonstige Registerbekanntmachung",
      "state": "Berlin",
      "amtsgericht": "Amtsgericht Berlin (Charlottenburg)",
      "registernummer": "HRB 276131",
      "registerart": "HRB",
      "company_name": "Consus Real Estate GmbH",
      "company_seat": "Berlin",
      "details": "18.06.2025 (Bekanntmachungsdatum)\n\nBerlin Amtsgericht Berlin (Charlottenburg) HRB 276131\nSonstige Registerbekanntmachung\n\nConsus Real Estate GmbH\nGesellschaft mit beschränkter Haftung\nBerlin\n\nAls nicht eingetragen wird veröffentlicht: Den Gläubigern ist, wenn sie binnen sechs Monaten nach dem Tag, an dem die Eintragung der Umwandlung als bekannt gemacht gilt, ihren Anspruch nach Grund und Höhe schriftlich anmelden, Sicherheit zu leisten, soweit sie nicht Befriedigung verlangen können. Dieses Recht steht den Gläubigern jedoch nur zu, wenn sie glaubhaft machen, dass durch die Umwandlung die Erfüllung ihrer Forderung gefährdet wird. Das Recht, Sicherheitsleistung zu verlangen, steht Gläubigern nicht zu, die im Falle der Insolvenz ein Recht auf vorzugsweise Befriedigung aus einer Deckungsmasse haben, die nach gesetzlicher Vorschrift zu ihrem Schutz errichtet und staatlich überwacht ist."
    },
    {
      "date": "2025-06-18",
      "id": "112576",
      "original_text": "Registerbekanntmachung nach dem Umwandlungsgesetz\nBerlin Amtsgericht Berlin (Charlottenburg) HRB 207757\nBevBox GmbH – Berlin",
      "type": "Registerbekanntmachung nach dem Umwandlungsgesetz",
      "state": "Berlin",
      "amtsgericht": "Amtsgericht Berlin (Charlottenburg)",
      "registernummer": "HRB 207757",
      "registerart": "HRB",
      "company_name": "BevBox GmbH",
      "company_seat": "Berlin",
      "details": "18.06.2025 (Bekanntmachungsdatum)\n\nBerlin Amtsgericht Berlin (Charlottenburg) HRB 207757\nRegisterbekanntmachung nach dem Umwandlungsgesetz 17.06.2025 (Eintragungsdatum)\n\nBevBox GmbH\nGesellschaft mit beschränkter Haftung\nBerlin\n\nZu Eintragungsnummer 10 vom 17.06.2025 wird als nicht eingetragen veröffentlicht: Den Gläubigern der an der Verschmelzung beteiligten Rechtsträger ist, wenn sie binnen sechs Monaten nach dem Tag, an dem die Eintragung der Verschmelzung in das Register des Sitzes desjenigen Rechtsträgers, dessen Gläubiger sie sind, als bekannt gemacht gilt, ihren Anspruch nach Grund und Höhe schriftlich anmelden, Sicherheit zu leisten, soweit sie nicht Befriedigung verlangen können. Dieses Recht steht den Gläubigern jedoch nur zu, wenn sie glaubhaft machen, dass durch die Verschmelzung die Erfüllung ihrer Forderung gefährdet wird. Das Recht, Sicherheitsleistung zu verlangen, steht Gläubigern nicht zu, die im Falle der Insolvenz ein Recht auf vorzugsweise Befriedigung aus einer Deckungsmasse haben, die nach gesetzlicher Vorschrift zu ihrem Schutz errichtet und staatlich überwacht ist."
    },
    {
      "date": "2025-06-18",
      "id": "112577",
      "original_text": "Löschungsankündigung\nBerlin Amtsgericht Berlin (Charlottenburg) HRB 190535\nCasa & Domum Bauausführung GmbH – Berlin",
      "type": "Löschungsankündigung",
      "state": "Berlin",
      "amtsgericht": "Amtsgericht Berlin (Charlottenburg)",
      "registernummer": "HRB 190535",
      "registerart": "HRB",
      "company_name": "Casa & Domum Bauausführung GmbH",
      "company_seat": "Berlin",
      "details": "18.06.2025 (Bekanntmachungsdatum)\n\nBerlin Amtsgericht Berlin (Charlottenburg) HRB 190535\nLöschungsankündigung\n\nCasa & Domum Bauausführung GmbH\nGesellschaft mit beschränkter Haftung\nBerlin\n\nBei der nachstehenden Gesellschaft wird das Amtslöschungsverfahren gemäß § 394 FamFG eingeleitet. Widerspruchsfrist 6 Wochen"
    },
    {
      "date": "2025-06-18",
      "id": "112578",
      "original_text": "Sonstige Registerbekanntmachung\nBerlin Amtsgericht Berlin (Charlottenburg) HRB 191887\nConsus Real Estate AG – Berlin",
      "type": "Sonstige Registerbekanntmachung",
      "state": "Berlin",
      "amtsgericht": "Amtsgericht Berlin (Charlottenburg)",
      "registernummer": "HRB 191887",
      "registerart": "HRB",
      "company_name": "Consus Real Estate AG",
      "company_seat": "Berlin",
      "details": "18.06.2025 (Bekanntmachungsdatum)\n\nBerlin Amtsgericht Berlin (Charlottenburg) HRB 191887\nSonstige Registerbekanntmachung\n\nConsus Real Estate AG\nAktiengesellschaft\nBerlin\n\nAls nicht eingetragen wird veröffentlicht: Den Gläubigern ist, wenn sie binnen sechs Monaten nach dem Tag, an dem die Eintragung der Umwandlung als bekannt gemacht gilt, ihren Anspruch nach Grund und Höhe schriftlich anmelden, Sicherheit zu leisten, soweit sie nicht Befriedigung verlangen können. Dieses Recht steht den Gläubigern jedoch nur zu, wenn sie glaubhaft machen, dass durch die Umwandlung die Erfüllung ihrer Forderung gefährdet wird. Das Recht, Sicherheitsleistung zu verlangen, steht Gläubigern nicht zu, die im Falle der Insolvenz ein Recht auf vorzugsweise Befriedigung aus einer Deckungsmasse haben, die nach gesetzlicher Vorschrift zu ihrem Schutz errichtet und staatlich überwacht ist."
    },
    {
      "date": "2025-06-18",
      "id": "112579",
      "original_text": "Sonstige Registerbekanntmachung\nBerlin Amtsgericht Berlin (Charlottenburg) HRB 239815\nEV Digital Invest AG – Berlin",
      "type": "Sonstige Registerbekanntmachung",
      "state": "Berlin",
      "amtsgericht": "Amtsgericht Berlin (Charlottenburg)",
      "registernummer": "HRB 239815",
      "registerart": "HRB",
      "company_name": "EV Digital Invest AG",
      "company_seat": "Berlin",
      "details": "18.06.2025 (Bekanntmachungsdatum)\n\nBerlin Amtsgericht Berlin (Charlottenburg) HRB 239815\nSonstige Registerbekanntmachung\n\nEV Digital Invest AG\nAktiengesellschaft\nBerlin\n\nAls nicht eingetragen wird veröffentlicht: Es wurde eine neue Liste der Aufsichtsratsmitglieder eingereicht (§ 106 AktG)."
    },
    {
      "date": "2025-06-18",
      "id": "112580",
      "original_text": "Registerbekanntmachung nach dem Umwandlungsgesetz\nSchleswig-Holstein Amtsgericht Kiel HRB 3202\nHugo Rost & Co. GmbH – Kiel",
      "type": "Registerbekanntmachung nach dem Umwandlungsgesetz",
      "state": "Schleswig-Holstein",
      "amtsgericht": "Amtsgericht Kiel",
      "registernummer": "HRB 3202",
      "registerart": "HRB",
      "company_name": "Hugo Rost & Co. GmbH",
      "company_seat": "Kiel",
      "details": "18.06.2025 (Bekanntmachungsdatum)\n\nSchleswig-Holstein Amtsgericht Kiel HRB 3202\nRegisterbekanntmachung nach dem Umwandlungsgesetz 17.06.2025 (Eintragungsdatum)\n\nHugo Rost & Co. GmbH\nGesellschaft mit beschränkter Haftung\nKiel\n\nAls nicht eingetragen wird veröffentlicht: Den Gläubigern der an der Verschmelzung beteiligten Rechtsträger ist, wenn sie binnen sechs Monaten nach dem Tag, an dem die Eintragung der Verschmelzung in das Register des Sitzes desjenigen Rechtsträgers, dessen Gläubiger sie sind, nach § 19 Abs. 3 UmwG bekannt gemacht worden ist, ihren Anspruch nach Grund und Höhe schriftlich anmelden, Sicherheit zu leisten, soweit sie nicht Befriedigung verlangen können. Dieses Recht steht den Gläubigern jedoch nur zu, wenn sie glaubhaft machen, dass durch die Verschmelzung die Erfüllung ihrer Forderung gefährdet wird."
    },
    {
      "date": "2025-06-18",
      "id": "112581",
      "original_text": "Einreichung neuer Dokumente\nSaarland Amtsgericht Saarbrücken HRB 4032\nSaarbrücker Zeitung Medienhaus GmbH – Saarbrücken",
      "type": "Einreichung neuer Dokumente",
      "state": "Saarland",
      "amtsgericht": "Amtsgericht Saarbrücken",
      "registernummer": "HRB 4032",
      "registerart": "HRB",
      "company_name": "Saarbrücker Zeitung Medienhaus GmbH",
      "company_seat": "Saarbrücken",
      "details": "18.06.2025 (Bekanntmachungsdatum)\n\nSaarland Amtsgericht Saarbrücken HRB 4032\nEinreichung neuer Dokumente\n\nSaarbrücker Zeitung Medienhaus GmbH\nGesellschaft mit beschränkter Haftung\nSaarbrücken\n\nDie Geschäftsführung der Gesellschaft hat eine Liste der Mitglieder des Aufsichtsrats zum Handelsregister eingereicht (§ 52 Abs. 3 Satz 2 GmbHG)."
    },
    {
      "date": "2025-06-18",
      "id": "112582",
      "original_text": "Registerbekanntmachung nach dem Umwandlungsgesetz\nBrandenburg Amtsgericht Cottbus HRB 7265\nKNICKMEIER STAHL-BLECH-FORMTEILE Verwaltungs GmbH – Forst (Lausitz)",
      "type": "Registerbekanntmachung nach dem Umwandlungsgesetz",
      "state": "Brandenburg",
      "amtsgericht": "Amtsgericht Cottbus",
      "registernummer": "HRB 7265",
      "registerart": "HRB",
      "company_name": "KNICKMEIER STAHL-BLECH-FORMTEILE Verwaltungs GmbH",
      "company_seat": "Forst (Lausitz)",
      "details": "18.06.2025 (Bekanntmachungsdatum)\n\nBrandenburg Amtsgericht Cottbus HRB 7265\nRegisterbekanntmachung nach dem Umwandlungsgesetz 17.06.2025 (Eintragungsdatum)\n\nKNICKMEIER STAHL-BLECH-FORMTEILE Verwaltungs GmbH\nGesellschaft mit beschränkter Haftung\nForst (Lausitz)\n\nZu Eintragungsnummer 5 vom 17.06.2025 wird als nicht eingetragen veröffentlicht:\nAls nicht eingetragen wird veröffentlicht:\nDen Gläubigern der an der Verschmelzung beteiligten Rechtsträger ist, wenn sie binnen sechs Monaten nach dem Tag, an dem die Eintragung der Verschmelzung in das Register des Sitzes desjenigen Rechtsträgers, dessen Gläubiger sie sind, als bekannt gemacht gilt, ihren Anspruch nach Grund und Höhe schriftlich anmelden, Sicherheit zu leisten, soweit sie nicht Befriedigung verlangen können. Dieses Recht steht den Gläubigern jedoch nur zu, wenn sie glaubhaft machen, dass durch die Verschmelzung die Erfüllung ihrer Forderung gefährdet wird"
    },
    {
      "date": "2025-06-18",
      "id": "112583",
      "original_text": "Registerbekanntmachung nach dem Umwandlungsgesetz\nBaden-Württemberg Amtsgericht Mannheim HRB 570545\nAH Austria Holding GmbH – Wertheim",
      "type": "Registerbekanntmachung nach dem Umwandlungsgesetz",
      "state": "Baden-Württemberg",
      "amtsgericht": "Amtsgericht Mannheim",
      "registernummer": "HRB 570545",
      "registerart": "HRB",
      "company_name": "AH Austria Holding GmbH",
      "company_seat": "Wertheim",
      "details": "18.06.2025 (Bekanntmachungsdatum)\n\nBaden-Württemberg Amtsgericht Mannheim HRB 570545\nRegisterbekanntmachung nach dem Umwandlungsgesetz 18.06.2025 (Eintragungsdatum)\n\nAH Austria Holding GmbH\nGesellschaft mit beschränkter Haftung\nWertheim\n\nAls nicht eingetragen wird bekanntgemacht:\nDen Gläubigern der Gesellschaft, deren Forderungen begründet worden sind, bevor die Eintragung der Beendigung des Vertrages in das Handelsregister nach § 10 HGB als bekanntgemacht gilt, ist vom anderen Vertragsteil Sicherheit zu leisten, wenn sie sich binnen sechs Monaten nach der Bekanntmachung zu diesem Zweck bei ihm melden.\nDen Gläubigern der an der Verschmelzung beteiligten Rechtsträger ist, wenn sie binnen sechs Monaten nach dem Tag, an dem die Eintragung der Verschmelzung in das Register des Sitzes desjenigen Rechtsträgers, dessen Gläubiger sie sind, nach § 19 Abs. 3 UmwG als bekanntgemacht gilt, ihren Anspruch nach Grund und Höhe schriftlich anmelden, Sicherheit zu leisten, soweit sie nicht Befriedigung verlangen können. Dieses Recht steht den Gläubigern jedoch nur zu, wenn sie glaubhaft machen, dass durch die Verschmelzung die Erfüllung ihrer Forderung gefährdet wird."
    },
    {
      "date": "2025-06-18",
      "id": "112584",
      "original_text": "Löschungsankündigung\nBrandenburg Amtsgericht Potsdam HRB 27051\nTK Betonsanierung GmbH – Potsdam",
      "type": "Löschungsankündigung",
      "state": "Brandenburg",
      "amtsgericht": "Amtsgericht Potsdam",
      "registernummer": "HRB 27051",
      "registerart": "HRB",
      "company_name": "TK Betonsanierung GmbH",
      "company_seat": "Potsdam",
      "details": "18.06.2025 (Bekanntmachungsdatum)\n\nBrandenburg Amtsgericht Potsdam HRB 27051\nLöschungsankündigung\n\nTK Betonsanierung GmbH\nGesellschaft mit beschränkter Haftung\nPotsdam\n\nBei der nachstehenden Gesellschaft wird das Amtslöschungsverfahren gemäß § 394 FamFG eingeleitet."
    },
    {
      "date": "2025-06-18",
      "id": "112585",
      "original_text": "Registerbekanntmachung nach dem Umwandlungsgesetz\nBaden-Württemberg Amtsgericht Mannheim HRB 732493\nBernhardt Holding GmbH – Heidelberg",
      "type": "Registerbekanntmachung nach dem Umwandlungsgesetz",
      "state": "Baden-Württemberg",
      "amtsgericht": "Amtsgericht Mannheim",
      "registernummer": "HRB 732493",
      "registerart": "HRB",
      "company_name": "Bernhardt Holding GmbH",
      "company_seat": "Heidelberg",
      "details": "18.06.2025 (Bekanntmachungsdatum)\n\nBaden-Württemberg Amtsgericht Mannheim HRB 732493\nRegisterbekanntmachung nach dem Umwandlungsgesetz 18.06.2025 (Eintragungsdatum)\n\nBernhardt Holding GmbH\nGesellschaft mit beschränkter Haftung\nHeidelberg\n\nAls nicht eingetragen wird bekanntgemacht:\nDen Gläubigern der an der Verschmelzung beteiligten Rechtsträger ist, wenn sie binnen sechs Monaten nach dem Tag, an dem die Eintragung der Verschmelzung in das Register des Sitzes desjenigen Rechtsträgers, dessen Gläubiger sie sind, nach § 19 Abs. 3 UmwG als bekanntgemacht gilt, ihren Anspruch nach Grund und Höhe schriftlich anmelden, Sicherheit zu leisten, soweit sie nicht Befriedigung verlangen können. Dieses Recht steht den Gläubigern jedoch nur zu, wenn sie glaubhaft machen, dass durch die Verschmelzung die Erfüllung ihrer Forderung gefährdet wird."
    },
    {
      "date": "2025-06-18",
      "id": "112586",
      "original_text": "Registerbekanntmachung nach dem Umwandlungsgesetz\nHamburg Amtsgericht Hamburg HRB 11788\nBerendsohn Aktiengesellschaft – Hamburg",
      "type": "Registerbekanntmachung nach dem Umwandlungsgesetz",
      "state": "Hamburg",
      "amtsgericht": "Amtsgericht Hamburg",
      "registernummer": "HRB 11788",
      "registerart": "HRB",
      "company_name": "Berendsohn Aktiengesellschaft",
      "company_seat": "Hamburg",
      "details": "18.06.2025 (Bekanntmachungsdatum)\n\nHamburg Amtsgericht Hamburg HRB 11788\nRegisterbekanntmachung nach dem Umwandlungsgesetz\n\nBerendsohn Aktiengesellschaft\nAktiengesellschaft\nHamburg\n\nDie Gesellschaft hat gemäß § 61 Satz 1 UmwG die Verschmelzungsverträge mit folgenden Gesellschaften als übernehmende Rechtsträger zum Handelsregister eingereicht:\na) HAA Hanseatische Außendienst Akademie GmbH mit Sitz in Hamburg (Amtsgericht Hamburg, HRB 38679);\nb) Euro-Gesellschaft für Verkaufsförderung mit beschränkter Haftung mit Sitz in Hamburg (Amtsgericht Hamburg, HRB 67849);\nc) Kleine & Jockers GmbH mit Sitz in Hamburg (Amtsgericht Hamburg, HRB 108936)."
    },
    {
      "date": "2025-06-18",
      "id": "112587",
      "original_text": "Registerbekanntmachung nach dem Umwandlungsgesetz\nBaden-Württemberg Amtsgericht Stuttgart HRB 763094\nHAFE GmbH – Aidlingen",
      "type": "Registerbekanntmachung nach dem Umwandlungsgesetz",
      "state": "Baden-Württemberg",
      "amtsgericht": "Amtsgericht Stuttgart",
      "registernummer": "HRB 763094",
      "registerart": "HRB",
      "company_name": "HAFE GmbH",
      "company_seat": "Aidlingen",
      "details": "18.06.2025 (Bekanntmachungsdatum)\n\nBaden-Württemberg Amtsgericht Stuttgart HRB 763094\nRegisterbekanntmachung nach dem Umwandlungsgesetz 18.06.2025 (Eintragungsdatum)\n\nHAFE GmbH\nGesellschaft mit beschränkter Haftung\nAidlingen\n\nAls nicht eingetragen wird bekanntgemacht:\nDen Gläubigern der an der Verschmelzung beteiligten Rechtsträger ist, wenn sie binnen sechs Monaten nach dem Tag, an dem die Eintragung der Verschmelzung in das Register des Sitzes desjenigen Rechtsträgers, dessen Gläubiger sie sind, nach § 19 Abs. 3 UmwG als bekanntgemacht gilt, ihren Anspruch nach Grund und Höhe schriftlich anmelden, Sicherheit zu leisten, soweit sie nicht Befriedigung verlangen können. Dieses Recht steht den Gläubigern jedoch nur zu, wenn sie glaubhaft machen, dass durch die Verschmelzung die Erfüllung ihrer Forderung gefährdet wird."
    },
    {
      "date": "2025-06-18",
      "id": "112588",
      "original_text": "Einreichung neuer Dokumente\nBaden-Württemberg Amtsgericht Ulm HRB 725931\nVARTA Microbattery GmbH – Ellwangen Jagst",
      "type": "Einreichung neuer Dokumente",
      "state": "Baden-Württemberg",
      "amtsgericht": "Amtsgericht Ulm",
      "registernummer": "HRB 725931",
      "registerart": "HRB",
      "company_name": "VARTA Microbattery GmbH",
      "company_seat": "Ellwangen Jagst",
      "details": "18.06.2025 (Bekanntmachungsdatum)\n\nBaden-Württemberg Amtsgericht Ulm HRB 725931\nEinreichung neuer Dokumente\n\nVARTA Microbattery GmbH\nGesellschaft mit beschränkter Haftung\nEllwangen Jagst\n\nDie Gesellschaft hat am 17.06.2025 die Liste über die Zusammensetzung des Aufsichtsrats zum Handelsregister eingereicht."
    },
    {
      "date": "2025-06-18",
      "id": "112589",
      "original_text": "Registerbekanntmachung nach dem Umwandlungsgesetz\nHamburg Amtsgericht Hamburg HRB 11788\nBerendsohn Aktiengesellschaft – Hamburg",
      "type": "Registerbekanntmachung nach dem Umwandlungsgesetz",
      "state": "Hamburg",
      "amtsgericht": "Amtsgericht Hamburg",
      "registernummer": "HRB 11788",
      "registerart": "HRB",
      "company_name": "Berendsohn Aktiengesellschaft",
      "company_seat": "Hamburg",
      "details": "18.06.2025 (Bekanntmachungsdatum)\n\nHamburg Amtsgericht Hamburg HRB 11788\nRegisterbekanntmachung nach dem Umwandlungsgesetz\n\nBerendsohn Aktiengesellschaft\nAktiengesellschaft\nHamburg\n\nDie Gesellschaft hat gemäß § 61 Satz 1 UmwG die Verschmelzungsverträge mit folgenden Gesellschaften als übernehmende Rechtsträger zum Handelsregister eingereicht:\na) HAA Hanseatische Außendienst Akademie GmbH mit Sitz in Hamburg (Amtsgericht Hamburg, HRB 38679);\nb) Euro-Gesellschaft für Verkaufsförderung mit beschränkter Haftung mit Sitz in Hamburg (Amtsgericht Hamburg, HRB 67849);\nc) Kleine & Jockers GmbH mit Sitz in Hamburg (Amtsgericht Hamburg, HRB 108936)."
    },
    {
      "date": "2025-06-18",
      "id": "112590",
      "original_text": "Löschungsankündigung\nBerlin Amtsgericht Berlin (Charlottenburg) HRA 57234\nKatina Gaststätten GmbH & Co. KG – Berlin",
      "type": "Löschungsankündigung",
      "state": "Berlin",
      "amtsgericht": "Amtsgericht Berlin (Charlottenburg)",
      "registernummer": "HRA 57234",
      "registerart": "HRA",
      "company_name": "Katina Gaststätten GmbH & Co. KG",
      "company_seat": "Berlin",
      "details": "18.06.2025 (Bekanntmachungsdatum)\n\nBerlin Amtsgericht Berlin (Charlottenburg) HRA 57234\nLöschungsankündigung\n\nKatina Gaststätten GmbH & Co. KG\nKommanditgesellschaft\nBerlin\n\nBei dem nachstehenden Unternehmen / der nachstehenden Gesellschaft wird das Amtslöschungsverfahren gemäß § 31 Abs. 2 HGB eingeleitet. Widerspruchsfrist 1 Monat"
    },
    {
      "date": "2025-06-18",
      "id": "112591",
      "original_text": "Löschungsankündigung\nBaden-Württemberg Amtsgericht Freiburg HRB 726506\nI-CON electric GmbH Industrieautomation & Steuerungstechnik – Radolfzell am Bodensee",
      "type": "Löschungsankündigung",
      "state": "Baden-Württemberg",
      "amtsgericht": "Amtsgericht Freiburg",
      "registernummer": "HRB 726506",
      "registerart": "HRB",
      "company_name": "I-CON electric GmbH Industrieautomation & Steuerungstechnik",
      "company_seat": "Radolfzell am Bodensee",
      "details": "18.06.2025 (Bekanntmachungsdatum)\n\nBaden-Württemberg Amtsgericht Freiburg HRB 726506\nLöschungsankündigung\n\nI-CON electric GmbH Industrieautomation & Steuerungstechnik\nGesellschaft mit beschränkter Haftung\nRadolfzell am Bodensee\n\nAls nicht eingetragen wird bekanntgemacht:\nDas Gericht beabsichtigt, die Gesellschaft wegen Vermögenslosigkeit im Handelsregister von Amts wegen nach § 394 FamFG zu löschen. Die Frist zur Geltendmachung eines Widerspruchs gegen die beabsichtigte Löschung ist auf einen Monat ab Veröffentlichung bestimmt."
    },
    {
      "date": "2025-06-18",
      "id": "112592",
      "original_text": "Registerbekanntmachung nach dem Umwandlungsgesetz\nBaden-Württemberg Amtsgericht Stuttgart HRB 21469\nRaumpflege AG Facility Management – Stuttgart",
      "type": "Registerbekanntmachung nach dem Umwandlungsgesetz",
      "state": "Baden-Württemberg",
      "amtsgericht": "Amtsgericht Stuttgart",
      "registernummer": "HRB 21469",
      "registerart": "HRB",
      "company_name": "Raumpflege AG Facility Management",
      "company_seat": "Stuttgart",
      "details": "18.06.2025 (Bekanntmachungsdatum)\n\nBaden-Württemberg Amtsgericht Stuttgart HRB 21469\nRegisterbekanntmachung nach dem Umwandlungsgesetz\n\nRaumpflege AG Facility Management\nAktiengesellschaft\nStuttgart\n\nDie Gesellschaft hat am 18.06.2025 den Entwurf des Spaltungsvertrages zwischen \"ABC All Best Clean GmbH\", Rutesheim (Amtsgericht Amtsgericht Stuttgart HRB 729259)\nund der hiesigen Gesellschaft (übertragender Rechtsträger) zum Handelsregister eingereicht."
    },
    {
      "date": "2025-06-18",
      "id": "112593",
      "original_text": "Einreichung neuer Dokumente\nSchleswig-Holstein Amtsgericht Kiel HRB 26101\nNEANDER MARINE SE – Kiel",
      "type": "Einreichung neuer Dokumente",
      "state": "Schleswig-Holstein",
      "amtsgericht": "Amtsgericht Kiel",
      "registernummer": "HRB 26101",
      "registerart": "HRB",
      "company_name": "NEANDER MARINE SE",
      "company_seat": "Kiel",
      "details": "18.06.2025 (Bekanntmachungsdatum)\n\nSchleswig-Holstein Amtsgericht Kiel HRB 26101\nEinreichung neuer Dokumente\n\nNEANDER MARINE SE\nEuropäische Aktiengesellschaft (SE)\nKiel\n\nEine neue Liste der Aufsichtsratsmitglieder ist eingereicht worden."
    },
    {
      "date": "2025-06-18",
      "id": "112594",
      "original_text": "Löschungsankündigung\nBerlin Amtsgericht Berlin (Charlottenburg) HRA 46774\nB30 Publishing GmbH & Co. KG – Berlin",
      "type": "Löschungsankündigung",
      "state": "Berlin",
      "amtsgericht": "Amtsgericht Berlin (Charlottenburg)",
      "registernummer": "HRA 46774",
      "registerart": "HRA",
      "company_name": "B30 Publishing GmbH & Co. KG",
      "company_seat": "Berlin",
      "details": "18.06.2025 (Bekanntmachungsdatum)\n\nBerlin Amtsgericht Berlin (Charlottenburg) HRA 46774\nLöschungsankündigung\n\nB30 Publishing GmbH & Co. KG\nKommanditgesellschaft\nBerlin\n\nBei dem nachstehenden Unternehmen / der nachstehenden Gesellschaft wird das Amtslöschungsverfahren gemäß § 31 Abs. 2 HGB eingeleitet. Widerspruchsfrist 1 Monat"
    },
    {
      "date": "2025-06-18",
      "id": "112595",
      "original_text": "Sonstige Registerbekanntmachung\nBaden-Württemberg Amtsgericht Stuttgart HRB 752719\nMS Ultraschall Technologie GmbH – Spaichingen",
      "type": "Sonstige Registerbekanntmachung",
      "state": "Baden-Württemberg",
      "amtsgericht": "Amtsgericht Stuttgart",
      "registernummer": "HRB 752719",
      "registerart": "HRB",
      "company_name": "MS Ultraschall Technologie GmbH",
      "company_seat": "Spaichingen",
      "details": "18.06.2025 (Bekanntmachungsdatum)\n\nBaden-Württemberg Amtsgericht Stuttgart HRB 752719\nSonstige Registerbekanntmachung 18.06.2025 (Eintragungsdatum)\n\nMS Ultraschall Technologie GmbH\nGesellschaft mit beschränkter Haftung\nSpaichingen\n\nAls nicht eingetragen wird bekanntgemacht:\nDen Gläubigern der Gesellschaft, deren Forderungen begründet worden sind, bevor die Eintragung der Beendigung des Vertrages in das Handelsregister nach § 10 HGB als bekanntgemacht gilt, ist vom anderen Vertragsteil Sicherheit zu leisten, wenn sie sich binnen sechs Monaten nach der Bekanntmachung zu diesem Zweck bei ihm melden."
    },
    {
      "date": "2025-06-18",
      "id": "112596",
      "original_text": "Sonstige Registerbekanntmachung\nBrandenburg Amtsgericht Frankfurt/Oder HRB 37\nMärkische Bautreuhand GmbH – Fürstenwalde/Spree",
      "type": "Sonstige Registerbekanntmachung",
      "state": "Brandenburg",
      "amtsgericht": "Amtsgericht Frankfurt/Oder",
      "registernummer": "HRB 37",
      "registerart": "HRB",
      "company_name": "Märkische Bautreuhand GmbH",
      "company_seat": "Fürstenwalde/Spree",
      "details": "18.06.2025 (Bekanntmachungsdatum)\n\nBrandenburg Amtsgericht Frankfurt/Oder HRB 37\nSonstige Registerbekanntmachung 17.06.2025 (Eintragungsdatum)\n\nMärkische Bautreuhand GmbH\nGesellschaft mit beschränkter Haftung\nFürstenwalde/Spree\n\nFrankfurt (Oder), den\n17.06.2025\nIn der Registersache Märkische Bautreuhand GmbH\nR.-Breitscheid-Str. 8\n15517 Fürstenwalde/Spree\nerfolgte unter Aktenzeichen HRB 37 FF mit der laufenden Nummer 2 die nachstehende\nRegistereintragung:\n1. Nummer der Eintragung\n2\n6.b) Sonstige Rechtsverhältnisse\nDie vermögenslose Gesellschaft ist auf Grund des § 394 FamFG von Amts wegen gelöscht.\n7.a) Tag der Eintragung\n17.06.2025"
    },
    {
      "date": "2025-06-18",
      "id": "112597",
      "original_text": "Registerbekanntmachung nach dem Umwandlungsgesetz\nBerlin Amtsgericht Berlin (Charlottenburg) HRB 217459\nDelphi BidCo GmbH – Berlin",
      "type": "Registerbekanntmachung nach dem Umwandlungsgesetz",
      "state": "Berlin",
      "amtsgericht": "Amtsgericht Berlin (Charlottenburg)",
      "registernummer": "HRB 217459",
      "registerart": "HRB",
      "company_name": "Delphi BidCo GmbH",
      "company_seat": "Berlin",
      "details": "18.06.2025 (Bekanntmachungsdatum)\n\nBerlin Amtsgericht Berlin (Charlottenburg) HRB 217459\nRegisterbekanntmachung nach dem Umwandlungsgesetz 17.06.2025 (Eintragungsdatum)\n\nDelphi BidCo GmbH\nGesellschaft mit beschränkter Haftung\nBerlin\n\nZu Eintragungsnummer 9 vom 17.06.2025 wird als nicht eingetragen veröffentlicht: Den Gläubigern der an der Verschmelzung beteiligten Rechtsträger ist, wenn sie binnen sechs Monaten nach dem Tag, an dem die Eintragung der Verschmelzung in das Register des Sitzes desjenigen Rechtsträgers, dessen Gläubiger sie sind, als bekannt gemacht gilt, ihren Anspruch nach Grund und Höhe schriftlich anmelden, Sicherheit zu leisten, soweit sie nicht Befriedigung verlangen können. Dieses Recht steht den Gläubigern jedoch nur zu, wenn sie glaubhaft machen, dass durch die Verschmelzung die Erfüllung ihrer Forderung gefährdet wird. Das Recht, Sicherheitsleistung zu verlangen, steht Gläubigern nicht zu, die im Falle der Insolvenz ein Recht auf vorzugsweise Befriedigung aus einer Deckungsmasse haben, die nach gesetzlicher Vorschrift zu ihrem Schutz errichtet und staatlich überwacht ist."
    },
    {
      "date": "2025-06-18",
      "id": "112598",
      "original_text": "Registerbekanntmachung nach dem Umwandlungsgesetz\nBerlin Amtsgericht Berlin (Charlottenburg) HRB 209447\nSodaSmart GmbH – Berlin",
      "type": "Registerbekanntmachung nach dem Umwandlungsgesetz",
      "state": "Berlin",
      "amtsgericht": "Amtsgericht Berlin (Charlottenburg)",
      "registernummer": "HRB 209447",
      "registerart": "HRB",
      "company_name": "SodaSmart GmbH",
      "company_seat": "Berlin",
      "details": "18.06.2025 (Bekanntmachungsdatum)\n\nBerlin Amtsgericht Berlin (Charlottenburg) HRB 209447\nRegisterbekanntmachung nach dem Umwandlungsgesetz 17.06.2025 (Eintragungsdatum)\n\nSodaSmart GmbH\nGesellschaft mit beschränkter Haftung\nBerlin\n\nZu Eintragungsnummer 6 vom 17.06.2025 wird als nicht eingetragen veröffentlicht: Den Gläubigern der an der Verschmelzung beteiligten Rechtsträger ist, wenn sie binnen sechs Monaten nach dem Tag, an dem die Eintragung der Verschmelzung in das Register des Sitzes desjenigen Rechtsträgers, dessen Gläubiger sie sind, als bekannt gemacht gilt, ihren Anspruch nach Grund und Höhe schriftlich anmelden, Sicherheit zu leisten, soweit sie nicht Befriedigung verlangen können. Dieses Recht steht den Gläubigern jedoch nur zu, wenn sie glaubhaft machen, dass durch die Verschmelzung die Erfüllung ihrer Forderung gefährdet wird. Das Recht, Sicherheitsleistung zu verlangen, steht Gläubigern nicht zu, die im Falle der Insolvenz ein Recht auf vorzugsweise Befriedigung aus einer Deckungsmasse haben, die nach gesetzlicher Vorschrift zu ihrem Schutz errichtet und staatlich überwacht ist."
    },
    {
      "date": "2025-06-18",
      "id": "112599",
      "original_text": "Löschungsankündigung\nThüringen Amtsgericht Jena HRB 513551\nErlenkönig Beteiligungen UG (haftungsbeschränkt) – Weida",
      "type": "Löschungsankündigung",
      "state": "Thüringen",
      "amtsgericht": "Amtsgericht Jena",
      "registernummer": "HRB 513551",
      "registerart": "HRB",
      "company_name": "Erlenkönig Beteiligungen UG (haftungsbeschränkt)",
      "company_seat": "Weida",
      "details": "18.06.2025 (Bekanntmachungsdatum)\n\nThüringen Amtsgericht Jena HRB 513551\nLöschungsankündigung\n\nErlenkönig Beteiligungen UG (haftungsbeschränkt)\nGesellschaft mit beschränkter Haftung\nWeida\n\nDas Registergericht beabsichtigt, die im Handelsregister eingetragene Gesellschaft wegen Vermögenslosigkeit nach § 394 FamFG von Amts wegen zu löschen. Die Frist zur Erhebung eines Widerspruchs gegen die beabsichtigte Löschung wird auf 6 Wochen festgesetzt."
    },
    {
      "date": "2025-06-18",
      "id": "112600",
      "original_text": "Registerbekanntmachung nach dem Umwandlungsgesetz\nBerlin Amtsgericht Berlin (Charlottenburg) HRB 214535\nGTB Berlin Elektrik GmbH – Berlin",
      "type": "Registerbekanntmachung nach dem Umwandlungsgesetz",
      "state": "Berlin",
      "amtsgericht": "Amtsgericht Berlin (Charlottenburg)",
      "registernummer": "HRB 214535",
      "registerart": "HRB",
      "company_name": "GTB Berlin Elektrik GmbH",
      "company_seat": "Berlin",
      "details": "18.06.2025 (Bekanntmachungsdatum)\n\nBerlin Amtsgericht Berlin (Charlottenburg) HRB 214535\nRegisterbekanntmachung nach dem Umwandlungsgesetz 17.06.2025 (Eintragungsdatum)\n\nGTB Berlin Elektrik GmbH\nGesellschaft mit beschränkter Haftung\nBerlin\n\nZu Eintragungsnummer 10 vom 17.06.2025 wird als nicht eingetragen veröffentlicht:Den Gläubigern der an der Verschmelzung beteiligten Rechtsträger ist, wenn sie binnen sechs Monaten nach dem Tag, an dem die Eintragung der Verschmelzung in das Register des Sitzes desjenigen Rechtsträgers, dessen Gläubiger sie sind, als bekannt gemacht gilt, ihren Anspruch nach Grund und Höhe schriftlich anmelden, Sicherheit zu leisten, soweit sie nicht Befriedigung verlangen können. Dieses Recht steht den Gläubigern jedoch nur zu, wenn sie glaubhaft machen, dass durch die Verschmelzung die Erfüllung ihrer Forderung gefährdet wird. Das Recht, Sicherheitsleistung zu verlangen, steht Gläubigern nicht zu, die im Falle der Insolvenz ein Recht auf vorzugsweise Befriedigung aus einer Deckungsmasse haben, die nach gesetzlicher Vorschrift zu ihrem Schutz errichtet und staatlich überwacht ist."
    },
    {
      "date": "2025-06-18",
      "id": "112601",
      "original_text": "Registerbekanntmachung nach dem Umwandlungsgesetz\nBerlin Amtsgericht Berlin (Charlottenburg) HRB 157381\nKai-Uwe Störig Elektrotechnik GmbH – Berlin",
      "type": "Registerbekanntmachung nach dem Umwandlungsgesetz",
      "state": "Berlin",
      "amtsgericht": "Amtsgericht Berlin (Charlottenburg)",
      "registernummer": "HRB 157381",
      "registerart": "HRB",
      "company_name": "Kai-Uwe Störig Elektrotechnik GmbH",
      "company_seat": "Berlin",
      "details": "18.06.2025 (Bekanntmachungsdatum)\n\nBerlin Amtsgericht Berlin (Charlottenburg) HRB 157381\nRegisterbekanntmachung nach dem Umwandlungsgesetz 17.06.2025 (Eintragungsdatum)\n\nKai-Uwe Störig Elektrotechnik GmbH\nGesellschaft mit beschränkter Haftung\nBerlin\n\nZu Eintragungsnummer 12 vom 17.06.2025 wird als nicht eingetragen veröffentlicht:Den Gläubigern der an der Verschmelzung beteiligten Rechtsträger ist, wenn sie binnen sechs Monaten nach dem Tag, an dem die Eintragung der Verschmelzung in das Register des Sitzes desjenigen Rechtsträgers, dessen Gläubiger sie sind, als bekannt gemacht gilt, ihren Anspruch nach Grund und Höhe schriftlich anmelden, Sicherheit zu leisten, soweit sie nicht Befriedigung verlangen können. Dieses Recht steht den Gläubigern jedoch nur zu, wenn sie glaubhaft machen, dass durch die Verschmelzung die Erfüllung ihrer Forderung gefährdet wird. Das Recht, Sicherheitsleistung zu verlangen, steht Gläubigern nicht zu, die im Falle der Insolvenz ein Recht auf vorzugsweise Befriedigung aus einer Deckungsmasse haben, die nach gesetzlicher Vorschrift zu ihrem Schutz errichtet und staatlich überwacht ist."
    },
    {
      "date": "2025-06-18",
      "id": "112602",
      "original_text": "Sonstige Registerbekanntmachung\nBerlin Amtsgericht Berlin (Charlottenburg) HRB 157381\nKai-Uwe Störig Elektrotechnik GmbH – Berlin",
      "type": "Sonstige Registerbekanntmachung",
      "state": "Berlin",
      "amtsgericht": "Amtsgericht Berlin (Charlottenburg)",
      "registernummer": "HRB 157381",
      "registerart": "HRB",
      "company_name": "Kai-Uwe Störig Elektrotechnik GmbH",
      "company_seat": "Berlin",
      "details": "18.06.2025 (Bekanntmachungsdatum)\n\nBerlin Amtsgericht Berlin (Charlottenburg) HRB 157381\nSonstige Registerbekanntmachung\n\nKai-Uwe Störig Elektrotechnik GmbH\nGesellschaft mit beschränkter Haftung\nBerlin\n\nAls nicht eingetragen wird veröffentlicht: Der andere Vertragsteil hat den Gläubigern dieses Rechtsträgers, deren Forderungen begründet worden sind, bevor die Eintragung der Beendigung dieses Vertrages in das Handelsregister nach § 10 des Handelsgesetzbuches als bekannt gemacht gilt, Sicherheit zu leisten, wenn sie sich binnen sechs Monaten nach der Bekanntmachung der Eintragung zu diesem Zweck bei ihm melden. Dieses Recht steht den Gläubigern nicht zu, die im Fall des Insolvenzverfahrens ein Recht auf vorzugsweise Befriedigung aus der Deckungsmasse haben, die nach gesetzlicher Vorschrift zu ihrem Schutz errichtet und staatlich überwacht ist."
    },
    {
      "date": "2025-06-18",
      "id": "112603",
      "original_text": "Registerbekanntmachung nach dem Umwandlungsgesetz\nBaden-Württemberg Amtsgericht Mannheim HRB 725563\nVMEK GmbH – Waghäusel",
      "type": "Registerbekanntmachung nach dem Umwandlungsgesetz",
      "state": "Baden-Württemberg",
      "amtsgericht": "Amtsgericht Mannheim",
      "registernummer": "HRB 725563",
      "registerart": "HRB",
      "company_name": "VMEK GmbH",
      "company_seat": "Waghäusel",
      "details": "18.06.2025 (Bekanntmachungsdatum)\n\nBaden-Württemberg Amtsgericht Mannheim HRB 725563\nRegisterbekanntmachung nach dem Umwandlungsgesetz 18.06.2025 (Eintragungsdatum)\n\nVMEK GmbH\nGesellschaft mit beschränkter Haftung\nWaghäusel\n\nAls nicht eingetragen wird bekanntgemacht:\nDen Gläubigern der an der Verschmelzung beteiligten Rechtsträger ist, wenn sie binnen sechs Monaten nach dem Tag, an dem die Eintragung der Verschmelzung in das Register des Sitzes desjenigen Rechtsträgers, dessen Gläubiger sie sind, nach § 19 Abs. 3 UmwG als bekanntgemacht gilt, ihren Anspruch nach Grund und Höhe schriftlich anmelden, Sicherheit zu leisten, soweit sie nicht Befriedigung verlangen können. Dieses Recht steht den Gläubigern jedoch nur zu, wenn sie glaubhaft machen, dass durch die Verschmelzung die Erfüllung ihrer Forderung gefährdet wird."
    },
    {
      "date": "2025-06-18",
      "id": "112604",
      "original_text": "Einreichung neuer Dokumente\nSchleswig-Holstein Amtsgericht Kiel HRB 7649\nBordesholmer Sparkasse Aktiengesellschaft – Bordesholm",
      "type": "Einreichung neuer Dokumente",
      "state": "Schleswig-Holstein",
      "amtsgericht": "Amtsgericht Kiel",
      "registernummer": "HRB 7649",
      "registerart": "HRB",
      "company_name": "Bordesholmer Sparkasse Aktiengesellschaft",
      "company_seat": "Bordesholm",
      "details": "18.06.2025 (Bekanntmachungsdatum)\n\nSchleswig-Holstein Amtsgericht Kiel HRB 7649\nEinreichung neuer Dokumente\n\nBordesholmer Sparkasse Aktiengesellschaft\nAktiengesellschaft\nBordesholm\n\nAls nicht eingetragen wird veröffentlicht: Eine neue Liste der Aufsichtsratsmitglieder ist eingereicht worden."
    },
    {
      "date": "2025-06-18",
      "id": "112605",
      "original_text": "Registerbekanntmachung nach dem Umwandlungsgesetz\nBerlin Amtsgericht Berlin (Charlottenburg) HRB 257178\nBeetz Brothers film production GmbH – Berlin",
      "type": "Registerbekanntmachung nach dem Umwandlungsgesetz",
      "state": "Berlin",
      "amtsgericht": "Amtsgericht Berlin (Charlottenburg)",
      "registernummer": "HRB 257178",
      "registerart": "HRB",
      "company_name": "Beetz Brothers film production GmbH",
      "company_seat": "Berlin",
      "details": "18.06.2025 (Bekanntmachungsdatum)\n\nBerlin Amtsgericht Berlin (Charlottenburg) HRB 257178\nRegisterbekanntmachung nach dem Umwandlungsgesetz 17.06.2025 (Eintragungsdatum)\n\nBeetz Brothers film production GmbH\nGesellschaft mit beschränkter Haftung\nBerlin\n\nZu Eintragungsnummer 4 vom 17.06.2025 wird als nicht eingetragen veröffentlicht:Den Gläubigern der an der Verschmelzung beteiligten Rechtsträger ist, wenn sie binnen sechs Monaten nach dem Tag, an dem die Eintragung der Verschmelzung in das Register des Sitzes desjenigen Rechtsträgers, dessen Gläubiger sie sind, als bekannt gemacht gilt, ihren Anspruch nach Grund und Höhe schriftlich anmelden, Sicherheit zu leisten, soweit sie nicht Befriedigung verlangen können. Dieses Recht steht den Gläubigern jedoch nur zu, wenn sie glaubhaft machen, dass durch die Verschmelzung die Erfüllung ihrer Forderung gefährdet wird. Das Recht, Sicherheitsleistung zu verlangen, steht Gläubigern nicht zu, die im Falle der Insolvenz ein Recht auf vorzugsweise Befriedigung aus einer Deckungsmasse haben, die nach gesetzlicher Vorschrift zu ihrem Schutz errichtet und staatlich überwacht ist."
    },
    {
      "date": "2025-06-18",
      "id": "112606",
      "original_text": "Löschungsankündigung\nNordrhein-Westfalen Amtsgericht Coesfeld HRB 20247\nBattaly GmbH – Gronau",
      "type": "Löschungsankündigung",
      "state": "Nordrhein-Westfalen",
      "amtsgericht": "Amtsgericht Coesfeld",
      "registernummer": "HRB 20247",
      "registerart": "HRB",
      "company_name": "Battaly GmbH",
      "company_seat": "Gronau",
      "details": "18.06.2025 (Bekanntmachungsdatum)\n\nNordrhein-Westfalen Amtsgericht Coesfeld HRB 20247\nLöschungsankündigung\n\nBattaly GmbH\nGesellschaft mit beschränkter Haftung\nGronau\n\nDas Registergericht beabsichtigt, den Rechtsträger wegen Vermögenslosigkeit gemäß § 394 FamFG von Amts wegen zu löschen.\n\nGegen diese Verfügung kann Widerspruch eingelegt werden. Die Frist zur Erhebung eines Widerspruchs gegen die beabsichtigte Löschung ist auf zwei Monate ab Veröffentlichung festgesetzt."
    },
    {
      "date": "2025-06-18",
      "id": "112607",
      "original_text": "Registerbekanntmachung nach dem Umwandlungsgesetz\nBaden-Württemberg Amtsgericht Stuttgart HRB 440707\nIngenieur-Büro Pflug GmbH – Horb am Neckar",
      "type": "Registerbekanntmachung nach dem Umwandlungsgesetz",
      "state": "Baden-Württemberg",
      "amtsgericht": "Amtsgericht Stuttgart",
      "registernummer": "HRB 440707",
      "registerart": "HRB",
      "company_name": "Ingenieur-Büro Pflug GmbH",
      "company_seat": "Horb am Neckar",
      "details": "18.06.2025 (Bekanntmachungsdatum)\n\nBaden-Württemberg Amtsgericht Stuttgart HRB 440707\nRegisterbekanntmachung nach dem Umwandlungsgesetz 18.06.2025 (Eintragungsdatum)\n\nIngenieur-Büro Pflug GmbH\nGesellschaft mit beschränkter Haftung\nHorb am Neckar\n\nDen Gläubigern der an der Verschmelzung beteiligten Rechtsträger ist, wenn sie binnen sechs Monaten nach dem Tag, an dem die Eintragung der Verschmelzung in das Register des Sitzes desjenigen Rechtsträgers, dessen Gläubiger sie sind, nach § 19 Abs. 3 UmwG als bekanntgemacht gilt, ihren Anspruch nach Grund und Höhe schriftlich anmelden, Sicherheit zu leisten, soweit sie nicht Befriedigung verlangen können. Dieses Recht steht den Gläubigern jedoch nur zu, wenn sie glaubhaft machen, dass durch die Verschmelzung die Erfüllung ihrer Forderung gefährdet wird."
    },
    {
      "date": "2025-06-18",
      "id": "112608",
      "original_text": "Registerbekanntmachung nach dem Umwandlungsgesetz\nNordrhein-Westfalen Amtsgericht Coesfeld HRB 22787\nMW-Effekt GmbH – Senden",
      "type": "Registerbekanntmachung nach dem Umwandlungsgesetz",
      "state": "Nordrhein-Westfalen",
      "amtsgericht": "Amtsgericht Coesfeld",
      "registernummer": "HRB 22787",
      "registerart": "HRB",
      "company_name": "MW-Effekt GmbH",
      "company_seat": "Senden",
      "details": "18.06.2025 (Bekanntmachungsdatum)\n\nNordrhein-Westfalen Amtsgericht Coesfeld HRB 22787\nRegisterbekanntmachung nach dem Umwandlungsgesetz 18.06.2025 (Eintragungsdatum)\n\nMW-Effekt GmbH\nGesellschaft mit beschränkter Haftung\nSenden\n\nDen Gläubigern der an der Ausgliederung beteiligten Rechtsträger ist, wenn sie binnen sechs Monaten nach dem Tag, an dem die Eintragung der Ausgliederung in das Register des Sitzes desjenigen Rechtsträgers, dessen Gläubiger sie sind, nach § 19 Absatz 3 UmwG als bekanntgemacht gilt, ihren Anspruch nach Grund und Höhe schriftlich anmelden, Sicherheit zu leisten, soweit sie nicht Befriedigung verlangen können. Dieses Recht steht den Gläubigern jedoch nur zu, wenn sie glaubhaft machen, dass durch die Ausgliederung die Erfüllung ihrer Forderung gefährdet wird."
    },
    {
      "date": "2025-06-18",
      "id": "112609",
      "original_text": "Registerbekanntmachung nach dem Umwandlungsgesetz\nSchleswig-Holstein Amtsgericht Kiel HRB 2564 RD\nSHAKE Handelsgesellschaft mbH – Bordesholm",
      "type": "Registerbekanntmachung nach dem Umwandlungsgesetz",
      "state": "Schleswig-Holstein",
      "amtsgericht": "Amtsgericht Kiel",
      "registernummer": "HRB 2564 RD",
      "registerart": "HRB",
      "company_name": "SHAKE Handelsgesellschaft mbH",
      "company_seat": "Bordesholm",
      "details": "18.06.2025 (Bekanntmachungsdatum)\n\nSchleswig-Holstein Amtsgericht Kiel HRB 2564 RD\nRegisterbekanntmachung nach dem Umwandlungsgesetz 17.06.2025 (Eintragungsdatum)\n\nSHAKE Handelsgesellschaft mbH\nGesellschaft mit beschränkter Haftung\nBordesholm\n\nZu Eintragungsnummer 5 vom 17.06.2025 wird als nicht eingetragen veröffentlicht: Als nicht eingetragen wird veröffentlicht: Den Gläubigern ist, wenn sie binnen sechs Monaten nach dem Tag, an dem die Eintragung der Umwandlung bekannt gemacht worden ist, ihren Anspruch nach Grund und Höhe schriftlich anmelden, Sicherheit zu leisten, soweit sie nicht Befriedigung verlangen können. Dieses Recht steht den Gläubigern jedoch nur zu, wenn sie glaubhaft machen, dass durch die Umwandlung die Erfüllung ihrer Forderung gefährdet wird."
    },
    {
      "date": "2025-06-18",
      "id": "112610",
      "original_text": "Löschungsankündigung\nBerlin Amtsgericht Berlin (Charlottenburg) HRB 65182\nZell & Co. GmbH International Management Consultants – Berlin",
      "type": "Löschungsankündigung",
      "state": "Berlin",
      "amtsgericht": "Amtsgericht Berlin (Charlottenburg)",
      "registernummer": "HRB 65182",
      "registerart": "HRB",
      "company_name": "Zell & Co. GmbH International Management Consultants",
      "company_seat": "Berlin",
      "details": "18.06.2025 (Bekanntmachungsdatum)\n\nBerlin Amtsgericht Berlin (Charlottenburg) HRB 65182\nLöschungsankündigung\n\nZell & Co. GmbH International Management Consultants\nGesellschaft mit beschränkter Haftung\nBerlin\n\nBei der nachstehenden Gesellschaft wird das Amtslöschungsverfahren gemäß § 394 FamFG eingeleitet. Widerspruchsfrist 6 Wochen"
    },
    {
      "date": "2025-06-18",
      "id": "112611",
      "original_text": "Registerbekanntmachung nach dem Umwandlungsgesetz\nHamburg Amtsgericht Hamburg HRB 122309\nGerroMed Pflege- und Medizintechnik GmbH – Hamburg",
      "type": "Registerbekanntmachung nach dem Umwandlungsgesetz",
      "state": "Hamburg",
      "amtsgericht": "Amtsgericht Hamburg",
      "registernummer": "HRB 122309",
      "registerart": "HRB",
      "company_name": "GerroMed Pflege- und Medizintechnik GmbH",
      "company_seat": "Hamburg",
      "details": "18.06.2025 (Bekanntmachungsdatum)\n\nHamburg Amtsgericht Hamburg HRB 122309\nRegisterbekanntmachung nach dem Umwandlungsgesetz 18.06.2025 (Eintragungsdatum)\n\nGerroMed Pflege- und Medizintechnik GmbH\nGesellschaft mit beschränkter Haftung\nHamburg\n\nAls nicht eingetragen wird bekannt gemacht:\nDen Gläubigern der an der Verschmelzung beteiligten Gesellschaften ist, wenn sie binnen sechs Monaten nach dem Tag, an dem die Eintragung der Verschmelzung in das Register des Sitzes desjenigen Rechtsträgers, dessen Gläubiger sie sind, nach § 19 Absatz 3 UmwG als bekannt gemacht gilt, ihren Anspruch nach Grund und Höhe schriftlich anmelden, Sicherheit zu leisten, soweit sie nicht Befriedigung verlangen können. Dieses Recht steht den Gläubigern jedoch nur zu, wenn sie glaubhaft machen, dass durch die Verschmelzung die Erfüllung ihrer Forderung gefährdet wird."
    },
    {
      "date": "2025-06-18",
      "id": "112612",
      "original_text": "Registerbekanntmachung nach dem Umwandlungsgesetz\nSchleswig-Holstein Amtsgericht Pinneberg HRB 8548\nCapol GmbH – Elmshorn",
      "type": "Registerbekanntmachung nach dem Umwandlungsgesetz",
      "state": "Schleswig-Holstein",
      "amtsgericht": "Amtsgericht Pinneberg",
      "registernummer": "HRB 8548",
      "registerart": "HRB",
      "company_name": "Capol GmbH",
      "company_seat": "Elmshorn",
      "details": "18.06.2025 (Bekanntmachungsdatum)\n\nSchleswig-Holstein Amtsgericht Pinneberg HRB 8548\nRegisterbekanntmachung nach dem Umwandlungsgesetz 10.06.2025 (Eintragungsdatum)\n\nCapol GmbH\nGesellschaft mit beschränkter Haftung\nElmshorn\n\nZu Eintragungsnummer 24 vom 10.06.2025 wird als nicht eingetragen veröffentlicht:  Den Gläubigern der an der Verschmelzung beteiligten Rechtsträger ist, wenn sie binnen sechs Monaten nach dem Tag, an dem die Eintragung der Verschmelzung in das Register des Sitzes desjenigen Rechtsträgers, dessen Gläubiger sie sind, als bekannt gemacht gilt, ihren Anspruch nach Grund und Höhe schriftlich anmelden, Sicherheit zu leisten, soweit sie nicht Befriedigung verlangen können. Dieses Recht steht den Gläubigern jedoch nur zu, wenn sie glaubhaft machen, dass durch die Verschmelzung die Erfüllung ihrer Forderung gefährdet wird. Das Recht, Sicherheitsleistung zu verlangen, steht Gläubigern nicht zu, die im Falle der Insolvenz ein Recht auf vorzugsweise Befriedigung aus einer Deckungsmasse haben, die nach gesetzlicher Vorschrift zu ihrem Schutz errichtet und staatlich überwacht ist."
    },
    {
      "date": "2025-06-18",
      "id": "112613",
      "original_text": "Löschungsankündigung\nBaden-Württemberg Amtsgericht Stuttgart HRB 787724\nUR Baudienstleistungen GmbH – Stuttgart",
      "type": "Löschungsankündigung",
      "state": "Baden-Württemberg",
      "amtsgericht": "Amtsgericht Stuttgart",
      "registernummer": "HRB 787724",
      "registerart": "HRB",
      "company_name": "UR Baudienstleistungen GmbH",
      "company_seat": "Stuttgart",
      "details": "18.06.2025 (Bekanntmachungsdatum)\n\nBaden-Württemberg Amtsgericht Stuttgart HRB 787724\nLöschungsankündigung\n\nUR Baudienstleistungen GmbH\nGesellschaft mit beschränkter Haftung\nStuttgart\n\nAls nicht eingetragen wird bekanntgemacht:\nDas Gericht beabsichtigt, die Gesellschaft wegen Vermögenslosigkeit im Handelsregister von Amts wegen nach § 394 FamFG zu löschen. Die Frist zur Geltendmachung eines Widerspruchs gegen die beabsichtigte Löschung ist auf zwei Monate ab Veröffentlichung bestimmt."
    },
    {
      "date": "2025-06-18",
      "id": "112614",
      "original_text": "Löschungsankündigung\nBerlin Amtsgericht Berlin (Charlottenburg) HRB 140082\nf3 Event GmbH – Berlin",
      "type": "Löschungsankündigung",
      "state": "Berlin",
      "amtsgericht": "Amtsgericht Berlin (Charlottenburg)",
      "registernummer": "HRB 140082",
      "registerart": "HRB",
      "company_name": "f3 Event GmbH",
      "company_seat": "Berlin",
      "details": "18.06.2025 (Bekanntmachungsdatum)\n\nBerlin Amtsgericht Berlin (Charlottenburg) HRB 140082\nLöschungsankündigung\n\nf3 Event GmbH\nGesellschaft mit beschränkter Haftung\nBerlin\n\nBei der nachstehenden Gesellschaft wird das Amtslöschungsverfahren gemäß § 394 FamFG eingeleitet. Widerspruchsfrist 6 Wochen"
    },
    {
      "date": "2025-06-18",
      "id": "112615",
      "original_text": "Registerbekanntmachung nach dem Umwandlungsgesetz\nBaden-Württemberg Amtsgericht Ulm HRA 560320\nKarl Späh GmbH & Co.KG – Scheer",
      "type": "Registerbekanntmachung nach dem Umwandlungsgesetz",
      "state": "Baden-Württemberg",
      "amtsgericht": "Amtsgericht Ulm",
      "registernummer": "HRA 560320",
      "registerart": "HRA",
      "company_name": "Karl Späh GmbH & Co.KG",
      "company_seat": "Scheer",
      "details": "18.06.2025 (Bekanntmachungsdatum)\n\nBaden-Württemberg Amtsgericht Ulm HRA 560320\nRegisterbekanntmachung nach dem Umwandlungsgesetz 18.06.2025 (Eintragungsdatum)\n\nKarl Späh GmbH & Co.KG\nKommanditgesellschaft\nScheer\n\nDen Gläubigern der an der Verschmelzung beteiligten Rechtsträger ist, wenn sie binnen sechs Monaten nach dem Tag, an dem die Eintragung der Verschmelzung in das Register des Sitzes desjenigen Rechtsträgers, dessen Gläubiger sie sind, nach § 19 Abs. 3 UmwG als bekanntgemacht gilt, ihren Anspruch nach Grund und Höhe schriftlich anmelden, Sicherheit zu leisten, soweit sie nicht Befriedigung verlangen können. Dieses Recht steht den Gläubigern jedoch nur zu, wenn sie glaubhaft machen, dass durch die Verschmelzung die Erfüllung ihrer Forderung gefährdet wird."
    },
    {
      "date": "2025-06-18",
      "id": "112616",
      "original_text": "Registerbekanntmachung nach dem Umwandlungsgesetz\nBerlin Amtsgericht Berlin (Charlottenburg) HRB 147027\nGEHAG Vierte Beteiligung SE – Berlin",
      "type": "Registerbekanntmachung nach dem Umwandlungsgesetz",
      "state": "Berlin",
      "amtsgericht": "Amtsgericht Berlin (Charlottenburg)",
      "registernummer": "HRB 147027",
      "registerart": "HRB",
      "company_name": "GEHAG Vierte Beteiligung SE",
      "company_seat": "Berlin",
      "details": "18.06.2025 (Bekanntmachungsdatum)\n\nBerlin Amtsgericht Berlin (Charlottenburg) HRB 147027\nRegisterbekanntmachung nach dem Umwandlungsgesetz 13.09.2024 (Eintragungsdatum)\n\nGEHAG Vierte Beteiligung SE\nEuropäische Aktiengesellschaft (SE)\nBerlin\n\nZu Eintragungsnummer 15 vom 13.09.2024 wird als nicht eingetragen veröffentlicht:\nDem Registergericht ist ein Umwandlungsplan vom 13.06.2025 betreffend die formwechselnde Umwandlung der Gesellschaft in die Rechtsform der (deutschen) Aktiengesellschaft unter der Firma GEHAG Vierte Beteiligung AG eingereicht worden."
    },
    {
      "date": "2025-06-18",
      "id": "112617",
      "original_text": "Registerbekanntmachung nach dem Umwandlungsgesetz\nBerlin Amtsgericht Berlin (Charlottenburg) HRA 29591\nMedia - Star Kabelversorgung GmbH & Co. KG – Berlin",
      "type": "Registerbekanntmachung nach dem Umwandlungsgesetz",
      "state": "Berlin",
      "amtsgericht": "Amtsgericht Berlin (Charlottenburg)",
      "registernummer": "HRA 29591",
      "registerart": "HRA",
      "company_name": "Media - Star Kabelversorgung GmbH & Co. KG",
      "company_seat": "Berlin",
      "details": "18.06.2025 (Bekanntmachungsdatum)\n\nBerlin Amtsgericht Berlin (Charlottenburg) HRA 29591\nRegisterbekanntmachung nach dem Umwandlungsgesetz 17.06.2025 (Eintragungsdatum)\n\nMedia - Star Kabelversorgung GmbH & Co. KG\nKommanditgesellschaft\nBerlin\n\nZu Eintragungsnummer 4 vom 17.06.2025 wird als nicht eingetragen veröffentlicht:\nDen Gläubigern der an der Verschmelzung beteiligten Rechtsträger ist, wenn sie binnen sechs Monaten nach dem Tag, an dem die Eintragung der Verschmelzung in das Register des Sitzes desjenigen Rechtsträgers, dessen Gläubiger sie sind, als bekannt gemacht gilt, ihren Anspruch nach Grund und Höhe schriftlich anmelden, Sicherheit zu leisten, soweit sie nicht Befriedigung verlangen können. Dieses Recht steht den Gläubigern jedoch nur zu, wenn sie glaubhaft machen, dass durch die Verschmelzung die Erfüllung ihrer Forderung gefährdet wird. Das Recht, Sicherheitsleistung zu verlangen, steht Gläubigern nicht zu, die im Falle der Insolvenz ein Recht auf vorzugsweise Befriedigung aus einer Deckungsmasse haben, die nach gesetzlicher Vorschrift zu ihrem Schutz errichtet und staatlich überwacht ist."
    },
    {
      "date": "2025-06-18",
      "id": "112618",
      "original_text": "Registerbekanntmachung nach dem Umwandlungsgesetz\nBerlin Amtsgericht Berlin (Charlottenburg) HRA 27421\nMüggelstr. 3 Grundstücks KG HNW Duske zweite Grundstücks GmbH & Co. – Berlin",
      "type": "Registerbekanntmachung nach dem Umwandlungsgesetz",
      "state": "Berlin",
      "amtsgericht": "Amtsgericht Berlin (Charlottenburg)",
      "registernummer": "HRA 27421",
      "registerart": "HRA",
      "company_name": "Müggelstr. 3 Grundstücks KG HNW Duske zweite Grundstücks GmbH & Co.",
      "company_seat": "Berlin",
      "details": "18.06.2025 (Bekanntmachungsdatum)\n\nBerlin Amtsgericht Berlin (Charlottenburg) HRA 27421\nRegisterbekanntmachung nach dem Umwandlungsgesetz 17.06.2025 (Eintragungsdatum)\n\nMüggelstr. 3 Grundstücks KG HNW Duske zweite Grundstücks GmbH & Co.\nKommanditgesellschaft\nBerlin\n\nZu Eintragungsnummer 6 vom 17.06.2025 wird als nicht eingetragen veröffentlicht:\nDen Gläubigern der an der Verschmelzung beteiligten Rechtsträger ist, wenn sie binnen sechs Monaten nach dem Tag, an dem die Eintragung der Verschmelzung in das Register des Sitzes desjenigen Rechtsträgers, dessen Gläubiger sie sind, als bekannt gemacht gilt, ihren Anspruch nach Grund und Höhe schriftlich anmelden, Sicherheit zu leisten, soweit sie nicht Befriedigung verlangen können. Dieses Recht steht den Gläubigern jedoch nur zu, wenn sie glaubhaft machen, dass durch die Verschmelzung die Erfüllung ihrer Forderung gefährdet wird. Das Recht, Sicherheitsleistung zu verlangen, steht Gläubigern nicht zu, die im Falle der Insolvenz ein Recht auf vorzugsweise Befriedigung aus einer Deckungsmasse haben, die nach gesetzlicher Vorschrift zu ihrem Schutz errichtet und staatlich überwacht ist."
    },
    {
      "date": "2025-06-18",
      "id": "112619",
      "original_text": "Einreichung neuer Dokumente\nBaden-Württemberg Amtsgericht Stuttgart HRB 1492\nFahrlehrerversicherung Verein auf Gegenseitigkeit – Stuttgart",
      "type": "Einreichung neuer Dokumente",
      "state": "Baden-Württemberg",
      "amtsgericht": "Amtsgericht Stuttgart",
      "registernummer": "HRB 1492",
      "registerart": "HRB",
      "company_name": "Fahrlehrerversicherung Verein auf Gegenseitigkeit",
      "company_seat": "Stuttgart",
      "details": "18.06.2025 (Bekanntmachungsdatum)\n\nBaden-Württemberg Amtsgericht Stuttgart HRB 1492\nEinreichung neuer Dokumente\n\nFahrlehrerversicherung Verein auf Gegenseitigkeit\nVersicherungsverein auf Gegenseitigkeit\nStuttgart\n\nDie Gesellschaft hat am 11.06.2025 die Liste über die Zusammensetzung des Aufsichtsrats zum Handelsregister eingereicht."
    },
    {
      "date": "2025-06-18",
      "id": "112620",
      "original_text": "Einreichung neuer Dokumente\nBaden-Württemberg Amtsgericht Ulm HRB 745906\nTeamViewer SE – Göppingen",
      "type": "Einreichung neuer Dokumente",
      "state": "Baden-Württemberg",
      "amtsgericht": "Amtsgericht Ulm",
      "registernummer": "HRB 745906",
      "registerart": "HRB",
      "company_name": "TeamViewer SE",
      "company_seat": "Göppingen",
      "details": "18.06.2025 (Bekanntmachungsdatum)\n\nBaden-Württemberg Amtsgericht Ulm HRB 745906\nEinreichung neuer Dokumente 18.06.2025 (Eintragungsdatum)\n\nTeamViewer SE\nEuropäische Aktiengesellschaft (SE)\nGöppingen\n\nDie Gesellschaft hat am 18.06.2025 die Liste über die Zusammensetzung des Aufsichtsrats zum Handelsregister eingereicht."
    },
    {
      "date": "2025-06-18",
      "id": "112621",
      "original_text": "Sonstige Registerbekanntmachung\nBerlin Amtsgericht Berlin (Charlottenburg) HRB 188032\nSpringer Nature Management Aktiengesellschaft – Berlin",
      "type": "Sonstige Registerbekanntmachung",
      "state": "Berlin",
      "amtsgericht": "Amtsgericht Berlin (Charlottenburg)",
      "registernummer": "HRB 188032",
      "registerart": "HRB",
      "company_name": "Springer Nature Management Aktiengesellschaft",
      "company_seat": "Berlin",
      "details": "18.06.2025 (Bekanntmachungsdatum)\n\nBerlin Amtsgericht Berlin (Charlottenburg) HRB 188032\nSonstige Registerbekanntmachung\n\nSpringer Nature Management Aktiengesellschaft\nAktiengesellschaft\nBerlin\n\nEs wurde eine neue Liste der Aufsichtsratsmitglieder eingereicht (§ 106 AktG)."
    },
    {
      "date": "2025-06-18",
      "id": "112622",
      "original_text": "Sonstige Registerbekanntmachung\nBaden-Württemberg Amtsgericht Mannheim HRB 1780\nMVV Energie AG – Mannheim",
      "type": "Sonstige Registerbekanntmachung",
      "state": "Baden-Württemberg",
      "amtsgericht": "Amtsgericht Mannheim",
      "registernummer": "HRB 1780",
      "registerart": "HRB",
      "company_name": "MVV Energie AG",
      "company_seat": "Mannheim",
      "details": "18.06.2025 (Bekanntmachungsdatum)\n\nBaden-Württemberg Amtsgericht Mannheim HRB 1780\nSonstige Registerbekanntmachung\n\nMVV  Energie AG\nAktiengesellschaft\nMannheim\n\nDie Gesellschaft hat am 17.06.2025 die Liste über die Zusammensetzung des Aufsichtsrats zum Handelsregister eingereicht."
    },
    {
      "date": "2025-06-18",
      "id": "112623",
      "original_text": "Registerbekanntmachung nach dem Umwandlungsgesetz\nBaden-Württemberg Amtsgericht Stuttgart GsR 1253\nFilbert Valikov eGbR Elerina - Immobilien & Home Staging – Heilbronn",
      "type": "Registerbekanntmachung nach dem Umwandlungsgesetz",
      "state": "Baden-Württemberg",
      "amtsgericht": "Amtsgericht Stuttgart",
      "registernummer": "GsR 1253",
      "registerart": "GsR",
      "company_name": "Filbert Valikov eGbR Elerina - Immobilien & Home Staging",
      "company_seat": "Heilbronn",
      "details": "18.06.2025 (Bekanntmachungsdatum)\n\nBaden-Württemberg Amtsgericht Stuttgart GsR 1253\nRegisterbekanntmachung nach dem Umwandlungsgesetz 18.06.2025 (Eintragungsdatum)\n\nFilbert Valikov eGbR Elerina - Immobilien & Home Staging\nGesellschaft bürgerlichen Rechts\nHeilbronn\n\nAls nicht eingetragen wird bekanntgemacht:\nDen Gläubigern des an dem Formwechsel beteiligten Rechtsträgers ist, wenn sie binnen sechs Monaten nach dem Tag, an dem die Eintragung des Formwechsels in das Register des Sitzes desjenigen Rechtsträgers, dessen Gläubiger sie sind, nach § 19 Abs. 3 UmwG als bekanntgemacht gilt, ihren Anspruch nach Grund und Höhe schriftlich anmelden, Sicherheit zu leisten, soweit sie nicht Befriedigung verlangen können. Dieses Recht steht den Gläubigern jedoch nur zu, wenn sie glaubhaft machen, dass durch den Formwechsel die Erfüllung ihrer Forderung gefährdet wird."
    },
    {
      "date": "2025-06-18",
      "id": "112624",
      "original_text": "Einreichung neuer Dokumente\nBaden-Württemberg Amtsgericht Mannheim HRB 107847\nVBK - Verkehrsbetriebe Karlsruhe GmbH – Karlsruhe",
      "type": "Einreichung neuer Dokumente",
      "state": "Baden-Württemberg",
      "amtsgericht": "Amtsgericht Mannheim",
      "registernummer": "HRB 107847",
      "registerart": "HRB",
      "company_name": "VBK - Verkehrsbetriebe Karlsruhe GmbH",
      "company_seat": "Karlsruhe",
      "details": "18.06.2025 (Bekanntmachungsdatum)\n\nBaden-Württemberg Amtsgericht Mannheim HRB 107847\nEinreichung neuer Dokumente\n\nVBK - Verkehrsbetriebe Karlsruhe GmbH\nGesellschaft mit beschränkter Haftung\nKarlsruhe\n\nDie Gesellschaft hat am 16.06.2025 die Liste über die Zusammensetzung des Aufsichtsrats zum Handelsregister eingereicht."
    },
    {
      "date": "2025-06-18",
      "id": "112625",
      "original_text": "Registerbekanntmachung nach dem Umwandlungsgesetz\nBaden-Württemberg Amtsgericht Stuttgart HRB 224492\nRaum-Braun GmbH – Filderstadt",
      "type": "Registerbekanntmachung nach dem Umwandlungsgesetz",
      "state": "Baden-Württemberg",
      "amtsgericht": "Amtsgericht Stuttgart",
      "registernummer": "HRB 224492",
      "registerart": "HRB",
      "company_name": "Raum-Braun GmbH",
      "company_seat": "Filderstadt",
      "details": "18.06.2025 (Bekanntmachungsdatum)\n\nBaden-Württemberg Amtsgericht Stuttgart HRB 224492\nRegisterbekanntmachung nach dem Umwandlungsgesetz 18.06.2025 (Eintragungsdatum)\n\nRaum-Braun GmbH\nGesellschaft mit beschränkter Haftung\nFilderstadt\n\nAls nicht eingetragen wird bekanntgemacht:\nDen Gläubigern der an der Verschmelzung beteiligten Rechtsträger ist, wenn sie binnen sechs Monaten nach dem Tag, an dem die Eintragung der Verschmelzung in das Register des Sitzes desjenigen Rechtsträgers, dessen Gläubiger sie sind, nach § 19 Abs. 3 UmwG als bekanntgemacht gilt, ihren Anspruch nach Grund und Höhe schriftlich anmelden, Sicherheit zu leisten, soweit sie nicht Befriedigung verlangen können. Dieses Recht steht den Gläubigern jedoch nur zu, wenn sie glaubhaft machen, dass durch die Verschmelzung die Erfüllung ihrer Forderung gefährdet wird."
    },
    {
      "date": "2025-06-18",
      "id": "112626",
      "original_text": "Einreichung neuer Dokumente\nBaden-Württemberg Amtsgericht Mannheim HRB 330004\nHeidelberger Druckmaschinen Aktiengesellschaft – Heidelberg",
      "type": "Einreichung neuer Dokumente",
      "state": "Baden-Württemberg",
      "amtsgericht": "Amtsgericht Mannheim",
      "registernummer": "HRB 330004",
      "registerart": "HRB",
      "company_name": "Heidelberger Druckmaschinen Aktiengesellschaft",
      "company_seat": "Heidelberg",
      "details": "18.06.2025 (Bekanntmachungsdatum)\n\nBaden-Württemberg Amtsgericht Mannheim HRB 330004\nEinreichung neuer Dokumente\n\nHeidelberger Druckmaschinen Aktiengesellschaft\nAktiengesellschaft\nHeidelberg\n\nDie Gesellschaft hat am 12.06.2025 die Liste über die Zusammensetzung des Aufsichtsrats zum Handelsregister eingereicht."
    },
    {
      "date": "2025-06-18",
      "id": "112627",
      "original_text": "Registerbekanntmachung nach dem Umwandlungsgesetz\nSachsen Amtsgericht Dresden HRB 39519\nPropella Properties GmbH – Dresden",
      "type": "Registerbekanntmachung nach dem Umwandlungsgesetz",
      "state": "Sachsen",
      "amtsgericht": "Amtsgericht Dresden",
      "registernummer": "HRB 39519",
      "registerart": "HRB",
      "company_name": "Propella Properties GmbH",
      "company_seat": "Dresden",
      "details": "18.06.2025 (Bekanntmachungsdatum)\n\nSachsen Amtsgericht Dresden HRB 39519\nRegisterbekanntmachung nach dem Umwandlungsgesetz 18.06.2025 (Eintragungsdatum)\n\nPropella Properties GmbH\nGesellschaft mit beschränkter Haftung\nDresden\n\nDen Gläubigern der an der Verschmelzung beteiligten Rechtsträger ist, wenn sie binnen sechs Monaten nach dem Tag, an dem die Eintragung der Verschmelzung in das Register des Sitzes desjenigen Rechtsträgers, dessen Gläubiger sie sind, nach § 19 Abs. 3 UmwG als bekannt gemacht gilt, ihren Anspruch nach Grund und Höhe in Textform anmelden, Sicherheit zu leisten, soweit sie nicht Befriedigung verlangen können. Dieses Recht steht den Gläubigern jedoch nur zu, wenn sie glaubhaft machen, dass durch die Verschmelzung die Erfüllung der Forderung gefährdet wird."
    },
    {
      "date": "2025-06-18",
      "id": "112628",
      "original_text": "Registerbekanntmachung nach dem Umwandlungsgesetz\nSachsen Amtsgericht Dresden HRB 34173\nPropella Heads GmbH – Dresden",
      "type": "Registerbekanntmachung nach dem Umwandlungsgesetz",
      "state": "Sachsen",
      "amtsgericht": "Amtsgericht Dresden",
      "registernummer": "HRB 34173",
      "registerart": "HRB",
      "company_name": "Propella Heads GmbH",
      "company_seat": "Dresden",
      "details": "18.06.2025 (Bekanntmachungsdatum)\n\nSachsen Amtsgericht Dresden HRB 34173\nRegisterbekanntmachung nach dem Umwandlungsgesetz 18.06.2025 (Eintragungsdatum)\n\nPropella Heads GmbH\nGesellschaft mit beschränkter Haftung\nDresden\n\nDen Gläubigern der an der Verschmelzung beteiligten Rechtsträger ist, wenn sie binnen sechs Monaten nach dem Tag, an dem die Eintragung der Verschmelzung in das Register des Sitzes desjenigen Rechtsträgers, dessen Gläubiger sie sind, nach § 19 Abs. 3 UmwG als bekannt gemacht gilt, ihren Anspruch nach Grund und Höhe in Textform anmelden, Sicherheit zu leisten, soweit sie nicht Befriedigung verlangen können. Dieses Recht steht den Gläubigern jedoch nur zu, wenn sie glaubhaft machen, dass durch die Verschmelzung die Erfüllung der Forderung gefährdet wird."
    },
    {
      "date": "2025-06-18",
      "id": "112629",
      "original_text": "Registerbekanntmachung nach dem Umwandlungsgesetz\nNiedersachsen Amtsgericht Oldenburg (Oldenburg) HRB 221446\nPAS Immobilien GmbH – Garrel",
      "type": "Registerbekanntmachung nach dem Umwandlungsgesetz",
      "state": "Niedersachsen",
      "amtsgericht": "Amtsgericht Oldenburg (Oldenburg)",
      "registernummer": "HRB 221446",
      "registerart": "HRB",
      "company_name": "PAS Immobilien GmbH",
      "company_seat": "Garrel",
      "details": "18.06.2025 (Bekanntmachungsdatum)\n\nNiedersachsen Amtsgericht Oldenburg (Oldenburg) HRB 221446\nRegisterbekanntmachung nach dem Umwandlungsgesetz 18.06.2025 (Eintragungsdatum)\n\nPAS Immobilien GmbH\nGesellschaft mit beschränkter Haftung\nGarrel\n\nDen Gläubigern der an der formwechselnden Umwandlung beteiligten Rechtsträger ist, wenn sie binnen sechs Monaten nach dem Tag, an dem die Eintragung der Umwandlung in das Register des Sitzes desjenigen Rechtsträgers, dessen Gläubiger sie sind, nach § 19 Abs. 3 UmwG als bekannt gemacht gilt, ihren Anspruch nach Grund und Höhe schriftlich anmelden, Sicherheit zu leisten, soweit sie nicht Befriedigung verlangen können. Dieses Recht steht den Gläubigern jedoch nur zu, wenn sie glaubhaft machen, dass durch die formwechselnde Umwandlung die Erfüllung der Forderung gefährdet wird."
    },
    {
      "date": "2025-06-18",
      "id": "112630",
      "original_text": "Einreichung neuer Dokumente\nNiedersachsen Amtsgericht Walsrode HRB 121917\nMASTERRIND GmbH – Verden/Aller",
      "type": "Einreichung neuer Dokumente",
      "state": "Niedersachsen",
      "amtsgericht": "Amtsgericht Walsrode",
      "registernummer": "HRB 121917",
      "registerart": "HRB",
      "company_name": "MASTERRIND GmbH",
      "company_seat": "Verden/Aller",
      "details": "18.06.2025 (Bekanntmachungsdatum)\n\nNiedersachsen Amtsgericht Walsrode HRB 121917\nEinreichung neuer Dokumente\n\nMASTERRIND GmbH\nGesellschaft mit beschränkter Haftung\nVerden/Aller\n\nDie Liste der Mitglieder des Aufsichtsrats wurde beim Registergericht eingereicht."
    },
    {
      "date": "2025-06-18",
      "id": "112631",
      "original_text": "Löschungsankündigung\nNiedersachsen Amtsgericht Tostedt HRB 208843\nW & W Vital GmbH – Bremervörde",
      "type": "Löschungsankündigung",
      "state": "Niedersachsen",
      "amtsgericht": "Amtsgericht Tostedt",
      "registernummer": "HRB 208843",
      "registerart": "HRB",
      "company_name": "W & W Vital GmbH",
      "company_seat": "Bremervörde",
      "details": "18.06.2025 (Bekanntmachungsdatum)\n\nNiedersachsen Amtsgericht Tostedt HRB 208843\nLöschungsankündigung 18.06.2025 (Eintragungsdatum)\n\nW & W Vital GmbH\nGesellschaft mit beschränkter Haftung\nBremervörde\n\nDas Registergericht beabsichtigt, die Gesellschaft von Amts wegen nach § 394 FamFG zu löschen. Die Frist zur Erhebung eines Widerspruchs ist auf 1 Monat ab dieser Registerbekanntmachung festgesetzt."
    },
    {
      "date": "2025-06-18",
      "id": "112632",
      "original_text": "Registerbekanntmachung nach dem Umwandlungsgesetz\nNiedersachsen Amtsgericht Hannover HRB 221281\nCOMPANIES24 GmbH – Hannover",
      "type": "Registerbekanntmachung nach dem Umwandlungsgesetz",
      "state": "Niedersachsen",
      "amtsgericht": "Amtsgericht Hannover",
      "registernummer": "HRB 221281",
      "registerart": "HRB",
      "company_name": "COMPANIES24 GmbH",
      "company_seat": "Hannover",
      "details": "18.06.2025 (Bekanntmachungsdatum)\n\nNiedersachsen Amtsgericht Hannover HRB 221281\nRegisterbekanntmachung nach dem Umwandlungsgesetz 18.06.2025 (Eintragungsdatum)\n\nCOMPANIES24 GmbH\nGesellschaft mit beschränkter Haftung\nHannover\n\nDen Gläubigern der an der Verschmelzung beteiligten Rechtsträger ist, wenn sie binnen sechs Monaten nach dem Tag, an dem die Eintragung der Verschmelzung in das Register des Sitzes desjenigen Rechtsträgers, dessen Gläubiger sie sind, nach § 19  Abs.  3 UmwG als bekannt gemacht gilt, ihren Anspruch nach Grund und Höhe schriftlich anmelden, Sicherheit zu leisten, soweit sie nicht Befriedigung verlangen können. Dieses Recht steht den Gläubigern jedoch nur zu, wenn sie glaubhaft machen, dass durch die Verschmelzung die Erfüllung der Forderung gefährdet wird."
    },
    {
      "date": "2025-06-18",
      "id": "112633",
      "original_text": "Einreichung neuer Dokumente\nNiedersachsen Amtsgericht Hannover HRB 209295\nGVH - Großraum-Verkehr Hannover GmbH – Hannover",
      "type": "Einreichung neuer Dokumente",
      "state": "Niedersachsen",
      "amtsgericht": "Amtsgericht Hannover",
      "registernummer": "HRB 209295",
      "registerart": "HRB",
      "company_name": "GVH - Großraum-Verkehr Hannover GmbH",
      "company_seat": "Hannover",
      "details": "18.06.2025 (Bekanntmachungsdatum)\n\nNiedersachsen Amtsgericht Hannover HRB 209295\nEinreichung neuer Dokumente\n\nGVH - Großraum-Verkehr Hannover GmbH\nGesellschaft mit beschränkter Haftung\nHannover\n\nDie Liste der Mitglieder des Verbundausschusses wurde beim Registergericht eingereicht."
    },
    {
      "date": "2025-06-18",
      "id": "112634",
      "original_text": "Einreichung neuer Dokumente\nNiedersachsen Amtsgericht Tostedt HRB 100466 früher Amtsgericht Stade\nVerkehrsgesellschaft Nord-Ost-Niedersachsen mbH – Stade",
      "type": "Einreichung neuer Dokumente",
      "state": "Niedersachsen",
      "amtsgericht": "Amtsgericht Tostedt",
      "registernummer": "HRB 100466",
      "registerart": "HRB",
      "company_name": "Verkehrsgesellschaft Nord-Ost-Niedersachsen mbH",
      "company_seat": "Stade",
      "former_amtsgericht": "Stade",
      "details": "18.06.2025 (Bekanntmachungsdatum)\n\nNiedersachsen Amtsgericht Tostedt HRB 100466 früher Amtsgericht Stade\nEinreichung neuer Dokumente 18.06.2025 (Eintragungsdatum)\n\nVerkehrsgesellschaft Nord-Ost-Niedersachsen mbH\nGesellschaft mit beschränkter Haftung\nStade\n\nDie Liste der Mitglieder des Aufsichtsrats wurde beim Registergericht eingereicht."
    },
    {
      "date": "2025-06-18",
      "id": "112635",
      "original_text": "Registerbekanntmachung nach dem Umwandlungsgesetz\nNiedersachsen Amtsgericht Hannover HRA 205965\nHWDS PARTNER LLC & Co. KG – Hannover",
      "type": "Registerbekanntmachung nach dem Umwandlungsgesetz",
      "state": "Niedersachsen",
      "amtsgericht": "Amtsgericht Hannover",
      "registernummer": "HRA 205965",
      "registerart": "HRA",
      "company_name": "HWDS PARTNER LLC & Co. KG",
      "company_seat": "Hannover",
      "details": "18.06.2025 (Bekanntmachungsdatum)\n\nNiedersachsen Amtsgericht Hannover HRA 205965\nRegisterbekanntmachung nach dem Umwandlungsgesetz 18.06.2025 (Eintragungsdatum)\n\nHWDS PARTNER LLC & Co. KG\nKommanditgesellschaft\nHannover\n\nDen Gläubigern der an der Verschmelzung beteiligten Rechtsträger ist, wenn sie binnen sechs Monaten nach dem Tag, an dem die Eintragung der Verschmelzung in das Register des Sitzes desjenigen Rechtsträgers, dessen Gläubiger sie sind, nach § 19  Abs.  3 UmwG als bekannt gemacht gilt, ihren Anspruch nach Grund und Höhe schriftlich anmelden, Sicherheit zu leisten, soweit sie nicht Befriedigung verlangen können. Dieses Recht steht den Gläubigern jedoch nur zu, wenn sie glaubhaft machen, dass durch die Verschmelzung die Erfüllung der Forderung gefährdet wird."
    },
    {
      "date": "2025-06-18",
      "id": "112636",
      "original_text": "Registerbekanntmachung nach dem Umwandlungsgesetz\nBremen Amtsgericht Bremen HRB 41560\nPaul Invest GmbH – Bremen",
      "type": "Registerbekanntmachung nach dem Umwandlungsgesetz",
      "state": "Bremen",
      "amtsgericht": "Amtsgericht Bremen",
      "registernummer": "HRB 41560",
      "registerart": "HRB",
      "company_name": "Paul Invest GmbH",
      "company_seat": "Bremen",
      "details": "18.06.2025 (Bekanntmachungsdatum)\n\nBremen Amtsgericht Bremen HRB 41560\nRegisterbekanntmachung nach dem Umwandlungsgesetz 13.06.2025 (Eintragungsdatum)\n\nPaul Invest GmbH\nGesellschaft mit beschränkter Haftung\nBremen\n\nZu Eintragungsnummer 1 vom 13.06.2025 wird als nicht eingetragen veröffentlicht: Den Gläubigern der an der Spaltung beteiligten Rechtsträger ist, wenn sie binnen sechs Monaten nach dem Tag, an dem die Eintragung der Spaltung in das Register des Sitzes desjenigen Rechtsträgers, dessen Gläubiger sie sind, als bekannt gemacht gilt, ihren Anspruch nach Grund und Höhe schriftlich anmelden, Sicherheit zu leisten, soweit sie nicht Befriedigung verlangen können. Dieses Recht steht den Gläubigern jedoch nur zu, wenn sie glaubhaft machen, dass durch die Spaltung die Erfüllung ihrer Forderung gefährdet wird. Das Recht, Sicherheitsleistung zu verlangen, steht Gläubigern nicht zu, die im Falle der Insolvenz ein Recht auf vorzugsweise Befriedigung aus einer Deckungsmasse haben, die nach gesetzlicher Vorschrift zu ihrem Schutz errichtet und staatlich überwacht ist."
    },
    {
      "date": "2025-06-18",
      "id": "112637",
      "original_text": "Registerbekanntmachung nach dem Umwandlungsgesetz\nRheinland-Pfalz Amtsgericht Mainz HRB 41059\nZabel Grundstücksverwaltungsgesellschaft mbH – Mainz",
      "type": "Registerbekanntmachung nach dem Umwandlungsgesetz",
      "state": "Rheinland-Pfalz",
      "amtsgericht": "Amtsgericht Mainz",
      "registernummer": "HRB 41059",
      "registerart": "HRB",
      "company_name": "Zabel Grundstücksverwaltungsgesellschaft mbH",
      "company_seat": "Mainz",
      "details": "18.06.2025 (Bekanntmachungsdatum)\n\nRheinland-Pfalz Amtsgericht Mainz HRB 41059\nRegisterbekanntmachung nach dem Umwandlungsgesetz 18.06.2025 (Eintragungsdatum)\n\nZabel Grundstücksverwaltungsgesellschaft mbH\nGesellschaft mit beschränkter Haftung\nMainz\n\nDen Gläubigern der an der Verschmelzung beteiligten Rechtsträger ist, wenn sie binnen sechs Monaten nach dem Tag, an dem die Eintragung der Verschmelzung in das Register des Sitzes desjenigen Rechtsträgers, dessen Gläubiger sie sind, nach § 19 Absatz 3 UmwG als bekanntgemacht gilt, ihren Anspruch nach Grund und Höhe schriftlich anmelden, Sicherheit zu leisten, soweit sie nicht Befriedigung verlangen können. Dieses Recht steht den Gläubigern jedoch nur zu, wenn sie glaubhaft machen, dass durch die Verschmelzung die Erfüllung ihrer Forderung gefährdet wird."
    },
    {
      "date": "2025-06-18",
      "id": "112638",
      "original_text": "Einreichung neuer Dokumente\nRheinland-Pfalz Amtsgericht Ludwigshafen a.Rhein (Ludwigshafen) HRB 5267\nLucura Versicherungs AG – Ludwigshafen/Rh.",
      "type": "Einreichung neuer Dokumente",
      "state": "Rheinland-Pfalz",
      "amtsgericht": "Amtsgericht Ludwigshafen a.Rhein (Ludwigshafen)",
      "registernummer": "HRB 5267",
      "registerart": "HRB",
      "company_name": "Lucura Versicherungs AG",
      "company_seat": "Ludwigshafen/Rh.",
      "details": "18.06.2025 (Bekanntmachungsdatum)\n\nRheinland-Pfalz Amtsgericht Ludwigshafen a.Rhein (Ludwigshafen) HRB 5267\nEinreichung neuer Dokumente\n\nLucura Versicherungs AG\nAktiengesellschaft\nLudwigshafen/Rh.\n\nDem Registergericht ist eine neue Liste der Mitglieder des Aufsichtsrates eingereicht worden."
    },
    {
      "date": "2025-06-18",
      "id": "112639",
      "original_text": "Registerbekanntmachung nach dem Umwandlungsgesetz\nRheinland-Pfalz Amtsgericht Montabaur HRB 20261\nRTP Rhöndorfer Turmpark GmbH – Vettelschoß",
      "type": "Registerbekanntmachung nach dem Umwandlungsgesetz",
      "state": "Rheinland-Pfalz",
      "amtsgericht": "Amtsgericht Montabaur",
      "registernummer": "HRB 20261",
      "registerart": "HRB",
      "company_name": "RTP Rhöndorfer Turmpark GmbH",
      "company_seat": "Vettelschoß",
      "details": "18.06.2025 (Bekanntmachungsdatum)\n\nRheinland-Pfalz Amtsgericht Montabaur HRB 20261\nRegisterbekanntmachung nach dem Umwandlungsgesetz 18.06.2025 (Eintragungsdatum)\n\nRTP Rhöndorfer Turmpark GmbH\nGesellschaft mit beschränkter Haftung\nVettelschoß\n\nAls nicht eingetragen wird veröffentlicht: Den Gläubigern der an der Verschmelzung beteiligten Rechtsträger ist, wenn sie binnen sechs Monaten nach dem Tag, an dem die Eintragung der Verschmelzung in das Register des Sitzes desjenigen Rechtsträgers, dessen Gläubiger sie sind, nach § 19 Abs. 3 UmwG als bekannt gemacht gilt, ihren Anspruch nach Grund und Höhe schriftlich anmelden, Sicherheit zu leisten, soweit sie nicht Befriedigung verlangen können. Dieses Recht steht den Gläubigern jedoch nur zu, wenn sie glaubhaft machen, dass durch die Verschmelzung die Erfüllung der Forderung gefährdet wird."
    },
    {
      "date": "2025-06-18",
      "id": "112640",
      "original_text": "Registerbekanntmachung nach dem Umwandlungsgesetz\nNordrhein-Westfalen Amtsgericht Essen HRA 11959\nfranky PropCo 1 GmbH & Co. KG – Essen",
      "type": "Registerbekanntmachung nach dem Umwandlungsgesetz",
      "state": "Nordrhein-Westfalen",
      "amtsgericht": "Amtsgericht Essen",
      "registernummer": "HRA 11959",
      "registerart": "HRA",
      "company_name": "franky PropCo 1 GmbH & Co. KG",
      "company_seat": "Essen",
      "details": "18.06.2025 (Bekanntmachungsdatum)\n\nNordrhein-Westfalen Amtsgericht Essen HRA 11959\nRegisterbekanntmachung nach dem Umwandlungsgesetz 18.06.2025 (Eintragungsdatum)\n\nfranky PropCo 1 GmbH & Co. KG\nKommanditgesellschaft\nEssen\n\nDen Gläubigern der an der formwechselnden Umwandlung beteiligten Rechtsträger ist, wenn sie binnen sechs Monaten nach dem Tag, an dem die Eintragung der formwechselnden Umwandlung in das Register des Sitzes desjenigen Rechtsträgers, dessen Gläubiger sie sind, nach § 19 Absatz 3 UmwG als bekanntgemacht gilt, ihren Anspruch nach Grund und Höhe schriftlich anmelden, Sicherheit zu leisten, soweit sie nicht Befriedigung verlangen können. Dieses Recht steht den Gläubigern jedoch nur zu, wenn sie glaubhaft machen, dass durch die formwechselnden Umwandlung die Erfüllung ihrer Forderung gefährdet wird."
    },
    {
      "date": "2025-06-18",
      "id": "112641",
      "original_text": "Löschungsankündigung\nNordrhein-Westfalen Amtsgericht Düsseldorf HRB 89361\nDentals pharma GmbH – Düsseldorf",
      "type": "Löschungsankündigung",
      "state": "Nordrhein-Westfalen",
      "amtsgericht": "Amtsgericht Düsseldorf",
      "registernummer": "HRB 89361",
      "registerart": "HRB",
      "company_name": "Dentals pharma GmbH",
      "company_seat": "Düsseldorf",
      "details": "18.06.2025 (Bekanntmachungsdatum)\n\nNordrhein-Westfalen Amtsgericht Düsseldorf HRB 89361\nLöschungsankündigung\n\nDentals pharma GmbH\nGesellschaft mit beschränkter Haftung\nDüsseldorf\n\nDas Registergericht beabsichtigt die Gesellschaft von Amts wegen nach § 394 FamFG zu löschen. Die Frist zur Erhebung eines Widerspruchs ist auf 3 Wochen festgesetzt.\n\nRechtsbehelfsbelehrung:\nDas Widerspruchsrecht steht jedem zu, der an der Unterlassung der Löschung ein berechtigtes Interesse hat. Der Widerspruch ist bei dem Amtsgericht Düsseldorf -Registergericht-, Werdener Straße 1, 40227 Düsseldorf schriftlich in deutscher Sprache oder zur Niederschrift der Geschäftsstelle einzulegen. Der Widerspruch kann auch zur Niederschrift der Geschäftsstelle eines jeden Amtsgerichtes abgegeben werden. Die Einlegung ist auch durch Übertragung eines elektronischen Dokuments an die elektronische Poststelle des Gerichts möglich. Das elektronische Dokument muss für die Bearbeitung durch das Gericht geeignet und mit einer qualifizierten elektronischen Signatur der verantwortenden Person versehen sein oder von der verantwortenden Person signiert und auf einem sicheren Übermittlungsweg gemäß § 130a ZPO nach näherer Maßgabe der Verordnung über die technischen Rahmenbedingungen des elektronischen Rechtsverkehrs und über das besondere elektronische Behördenpostfach (BGBl. I, S.3803) eingereicht werden. Weitere Informationen erhalten Sie auf der Internetseite www.justiz.de.\nDer Widerspruch muss spätestens innerhalb der gesetzten Frist nach dem Datum der Bekanntmachung der Löschungsankündigung bei dem Amtsgericht - Registergericht - Düsseldorf eingegangen sein.  Dies gilt auch dann, wenn der Widerspruch zur Niederschrift der Geschäftsstelle eines anderen Amtsgerichtes abgegeben wurde. Die Frist beginnt mit dem Tage der Bekanntmachung der Löschungsankündigung in dem für die Bekanntmachung der Eintragungen in das Handelsregister bestimmten elektronischen Informations- und Kommunikationssystem nach § 10 des Handelsgesetzbuches. Fällt das Ende der Frist auf einen Sonntag, einen allgemeinen Feiertag oder Sonnabend, so endet die Frist mit Ablauf des nächsten Werktages.\nDer Widerspruch muss die Bezeichnung der angefochtenen Löschungsankündigung sowie die Erklärung enthalten, dass Widerspruch gegen diese Löschungsankündigung eingelegt wird. Er ist zu unterzeichnen und soll begründet werden."
    },
    {
      "date": "2025-06-18",
      "id": "112642",
      "original_text": "Einreichung neuer Dokumente\nNordrhein-Westfalen Amtsgericht Gütersloh HRB 5560\nKHW Kommunale Haus und Wohnen GmbH – Rheda-Wiedenbrück",
      "type": "Einreichung neuer Dokumente",
      "state": "Nordrhein-Westfalen",
      "amtsgericht": "Amtsgericht Gütersloh",
      "registernummer": "HRB 5560",
      "registerart": "HRB",
      "company_name": "KHW Kommunale Haus und Wohnen GmbH",
      "company_seat": "Rheda-Wiedenbrück",
      "details": "18.06.2025 (Bekanntmachungsdatum)\n\nNordrhein-Westfalen Amtsgericht Gütersloh HRB 5560\nEinreichung neuer Dokumente\n\nKHW Kommunale Haus und Wohnen GmbH\nGesellschaft mit beschränkter Haftung\nRheda-Wiedenbrück\n\nDem Registergericht ist eine neue Liste der Mitglieder des Aufsichtsrates eingereicht worden."
    },
    {
      "date": "2025-06-18",
      "id": "112643",
      "original_text": "Löschungsankündigung\nNordrhein-Westfalen Amtsgericht Mönchengladbach HRB 18398\ni-cut Haftungs-GmbH – Mönchengladbach",
      "type": "Löschungsankündigung",
      "state": "Nordrhein-Westfalen",
      "amtsgericht": "Amtsgericht Mönchengladbach",
      "registernummer": "HRB 18398",
      "registerart": "HRB",
      "company_name": "i-cut Haftungs-GmbH",
      "company_seat": "Mönchengladbach",
      "details": "18.06.2025 (Bekanntmachungsdatum)\n\nNordrhein-Westfalen Amtsgericht Mönchengladbach HRB 18398\nLöschungsankündigung\n\ni-cut Haftungs-GmbH\nGesellschaft mit beschränkter Haftung\nMönchengladbach\n\ni-cut Haftungs-GmbH, Mönchengladbach (Amtsgericht Mönchengladbach, HRB 18398)\nDas Registergericht beabsichtigt, die im Handelsregister eingetragene Gesellschaft gemäß § 394 Absatz 1 FamFG wegen Vermögenslosigkeit von Amts wegen zu löschen. Gegen diese Verfügung kann Widerspruch eingelegt werden. Die Frist zur Erhebung eines Widerspruchs gegen die beabsichtigte Löschung von Amts wegen ist auf drei Monate festgesetzt."
    },
    {
      "date": "2025-06-18",
      "id": "112644",
      "original_text": "Registerbekanntmachung nach dem Umwandlungsgesetz\nNordrhein-Westfalen Amtsgericht Bochum HRB 10950\nETABO Energietechnik und Anlagenservice GmbH – Bochum",
      "type": "Registerbekanntmachung nach dem Umwandlungsgesetz",
      "state": "Nordrhein-Westfalen",
      "amtsgericht": "Amtsgericht Bochum",
      "registernummer": "HRB 10950",
      "registerart": "HRB",
      "company_name": "ETABO Energietechnik und Anlagenservice GmbH",
      "company_seat": "Bochum",
      "details": "18.06.2025 (Bekanntmachungsdatum)\n\nNordrhein-Westfalen Amtsgericht Bochum HRB 10950\nRegisterbekanntmachung nach dem Umwandlungsgesetz 27.02.2025 (Eintragungsdatum)\n\nETABO Energietechnik und Anlagenservice GmbH\nGesellschaft mit beschränkter Haftung\nBochum\n\nDen Gläubigern der an der Verschmelzung beteiligten Rechtsträger ist, wenn sie binnen sechs Monaten nach dem Tag, an dem die Eintragung der Verschmelzung in das Register des Sitzes derjenigen Rechtsträger deren Gläubiger sie sind, nach § 19 Absatz 3 UmwG als bekanntgemacht gilt, ihren Anspruch nach Grund und Höhe schriftlich anmelden, Sicherheit zu leisten, soweit sie nicht Befriedigung verlangen können. Dieses Recht steht den Gläubigern jedoch nur zu, wenn sie glaubhaft machen, dass durch die Verschmelzung die Erfüllung ihrer Forderung gefährdet wird."
    },
    {
      "date": "2025-06-18",
      "id": "112645",
      "original_text": "Registerbekanntmachung nach dem Umwandlungsgesetz\nNordrhein-Westfalen Amtsgericht Köln HRB 56998\nKlinikum Oberberg Gesellschaft mit beschränkter Haftung – Gummersbach",
      "type": "Registerbekanntmachung nach dem Umwandlungsgesetz",
      "state": "Nordrhein-Westfalen",
      "amtsgericht": "Amtsgericht Köln",
      "registernummer": "HRB 56998",
      "registerart": "HRB",
      "company_name": "Klinikum Oberberg Gesellschaft mit beschränkter Haftung",
      "company_seat": "Gummersbach",
      "details": "18.06.2025 (Bekanntmachungsdatum)\n\nNordrhein-Westfalen Amtsgericht Köln HRB 56998\nRegisterbekanntmachung nach dem Umwandlungsgesetz 18.06.2025 (Eintragungsdatum)\n\nKlinikum Oberberg Gesellschaft mit beschränkter Haftung\nGesellschaft mit beschränkter Haftung\nGummersbach\n\nDen Gläubigern der an der Verschmelzung beteiligten Rechtsträger ist, wenn sie binnen sechs Monaten nach dem Tag, an dem die Eintragung der Verschmelzung in das Register des Sitzes derjenigen Rechtsträger deren Gläubiger sie sind, nach § 19 Absatz 3 UmwG als bekanntgemacht gilt, ihren Anspruch nach Grund und Höhe schriftlich anmelden, Sicherheit zu leisten, soweit sie nicht Befriedigung verlangen können. Dieses Recht steht den Gläubigern jedoch nur zu, wenn sie glaubhaft machen, dass durch die Verschmelzung die Erfüllung ihrer Forderung gefährdet wird."
    },
    {
      "date": "2025-06-18",
      "id": "112646",
      "original_text": "Registerbekanntmachung nach dem Umwandlungsgesetz\nNordrhein-Westfalen Amtsgericht Düsseldorf HRB 73790\nBaucon Projekt- und Beteiligungsgesellschaft mbH – Langenfeld",
      "type": "Registerbekanntmachung nach dem Umwandlungsgesetz",
      "state": "Nordrhein-Westfalen",
      "amtsgericht": "Amtsgericht Düsseldorf",
      "registernummer": "HRB 73790",
      "registerart": "HRB",
      "company_name": "Baucon Projekt- und Beteiligungsgesellschaft mbH",
      "company_seat": "Langenfeld",
      "details": "18.06.2025 (Bekanntmachungsdatum)\n\nNordrhein-Westfalen Amtsgericht Düsseldorf HRB 73790\nRegisterbekanntmachung nach dem Umwandlungsgesetz 18.06.2025 (Eintragungsdatum)\n\nBaucon Projekt- und Beteiligungsgesellschaft mbH\nGesellschaft mit beschränkter Haftung\nLangenfeld\n\nDen Gläubigern der an der Verschmelzung beteiligten Rechtsträger ist, wenn sie binnen sechs Monaten nach dem Tag, an dem die Eintragung der Verschmelzung in das Register des Sitzes desjenigen Rechtsträgers, dessen Gläubiger sie sind, nach § 19 Absatz 3 UmwG als bekanntgemacht gilt, ihren Anspruch nach Grund und Höhe schriftlich anmelden, Sicherheit zu leisten, soweit sie nicht Befriedigung verlangen können. Dieses Recht steht den Gläubigern jedoch nur zu, wenn sie glaubhaft machen, dass durch die Verschmelzung die Erfüllung ihrer Forderung gefährdet wird."
    },
    {
      "date": "2025-06-18",
      "id": "112647",
      "original_text": "Einreichung neuer Dokumente\nNordrhein-Westfalen Amtsgericht Düsseldorf HRB 67410\nDeloitte Consulting GmbH – Düsseldorf",
      "type": "Einreichung neuer Dokumente",
      "state": "Nordrhein-Westfalen",
      "amtsgericht": "Amtsgericht Düsseldorf",
      "registernummer": "HRB 67410",
      "registerart": "HRB",
      "company_name": "Deloitte Consulting GmbH",
      "company_seat": "Düsseldorf",
      "details": "18.06.2025 (Bekanntmachungsdatum)\n\nNordrhein-Westfalen Amtsgericht Düsseldorf HRB 67410\nEinreichung neuer Dokumente\n\nDeloitte Consulting GmbH\nGesellschaft mit beschränkter Haftung\nDüsseldorf\n\nDem Registergericht ist eine Liste der Mitglieder des Aufsichtsrates eingereicht worden."
    },
    {
      "date": "2025-06-18",
      "id": "112648",
      "original_text": "Registerbekanntmachung nach dem Umwandlungsgesetz\nNordrhein-Westfalen Amtsgericht Dortmund HRA 13640\nEGU Elektro Großhandels Union Rhein-Ruhr GmbH & Co. KG – Dortmund",
      "type": "Registerbekanntmachung nach dem Umwandlungsgesetz",
      "state": "Nordrhein-Westfalen",
      "amtsgericht": "Amtsgericht Dortmund",
      "registernummer": "HRA 13640",
      "registerart": "HRA",
      "company_name": "EGU Elektro Großhandels Union Rhein-Ruhr GmbH & Co. KG",
      "company_seat": "Dortmund",
      "details": "18.06.2025 (Bekanntmachungsdatum)\n\nNordrhein-Westfalen Amtsgericht Dortmund HRA 13640\nRegisterbekanntmachung nach dem Umwandlungsgesetz 18.06.2025 (Eintragungsdatum)\n\nEGU Elektro Großhandels Union Rhein-Ruhr GmbH & Co. KG\nKommanditgesellschaft\nDortmund\n\nDen Gläubigern der an der Verschmelzung beteiligten Rechtsträger ist, wenn sie binnen sechs Monaten nach dem Tag, an dem die Eintragung der Verschmelzung in das Register des Sitzes desjenigen Rechtsträgers, dessen Gläubiger sie sind, nach § 19 Absatz 3 UmwG als bekanntgemacht gilt, ihren Anspruch nach Grund und Höhe schriftlich anmelden, Sicherheit zu leisten, soweit sie nicht Befriedigung verlangen können. Dieses Recht steht den Gläubigern jedoch nur zu, wenn sie glaubhaft machen, dass durch die Verschmelzung die Erfüllung ihrer Forderung gefährdet wird."
    },
    {
      "date": "2025-06-18",
      "id": "112649",
      "original_text": "Einreichung neuer Dokumente\nNordrhein-Westfalen Amtsgericht Hagen HRB 5575\nAVU Aktiengesellschaft für Versorgungs-Unternehmen – Gevelsberg",
      "type": "Einreichung neuer Dokumente",
      "state": "Nordrhein-Westfalen",
      "amtsgericht": "Amtsgericht Hagen",
      "registernummer": "HRB 5575",
      "registerart": "HRB",
      "company_name": "AVU Aktiengesellschaft für Versorgungs-Unternehmen",
      "company_seat": "Gevelsberg",
      "details": "18.06.2025 (Bekanntmachungsdatum)\n\nNordrhein-Westfalen Amtsgericht Hagen HRB 5575\nEinreichung neuer Dokumente\n\nAVU Aktiengesellschaft für Versorgungs-Unternehmen\nAktiengesellschaft\nGevelsberg\n\nDem Registergericht ist eine Liste der Mitglieder des Aufsichtsrates eingereicht worden."
    },
    {
      "date": "2025-06-18",
      "id": "112650",
      "original_text": "Registerbekanntmachung nach dem Umwandlungsgesetz\nNordrhein-Westfalen Amtsgericht Düsseldorf HRB 53402\nHeimatTBWA Düsseldorf GmbH – Düsseldorf",
      "type": "Registerbekanntmachung nach dem Umwandlungsgesetz",
      "state": "Nordrhein-Westfalen",
      "amtsgericht": "Amtsgericht Düsseldorf",
      "registernummer": "HRB 53402",
      "registerart": "HRB",
      "company_name": "HeimatTBWA Düsseldorf GmbH",
      "company_seat": "Düsseldorf",
      "details": "18.06.2025 (Bekanntmachungsdatum)\n\nNordrhein-Westfalen Amtsgericht Düsseldorf HRB 53402\nRegisterbekanntmachung nach dem Umwandlungsgesetz 18.06.2025 (Eintragungsdatum)\n\nHeimatTBWA Düsseldorf GmbH\nGesellschaft mit beschränkter Haftung\nDüsseldorf\n\nDen Gläubigern der an der Verschmelzung beteiligten Rechtsträger ist, wenn sie binnen sechs Monaten nach dem Tag, an dem die Eintragung der Verschmelzung in das Register des Sitzes desjenigen Rechtsträgers, dessen Gläubiger sie sind, nach § 19 Absatz 3 UmwG als bekanntgemacht gilt, ihren Anspruch nach Grund und Höhe schriftlich anmelden, Sicherheit zu leisten, soweit sie nicht Befriedigung verlangen können. Dieses Recht steht den Gläubigern jedoch nur zu, wenn sie glaubhaft machen, dass durch die Verschmelzung die Erfüllung ihrer Forderung gefährdet wird."
    },
    {
      "date": "2025-06-18",
      "id": "112651",
      "original_text": "Registerbekanntmachung nach dem Umwandlungsgesetz\nNordrhein-Westfalen Amtsgericht Düsseldorf HRB 93162\nAPONTIS PHARMA AG – Monheim am Rhein",
      "type": "Registerbekanntmachung nach dem Umwandlungsgesetz",
      "state": "Nordrhein-Westfalen",
      "amtsgericht": "Amtsgericht Düsseldorf",
      "registernummer": "HRB 93162",
      "registerart": "HRB",
      "company_name": "APONTIS PHARMA AG",
      "company_seat": "Monheim am Rhein",
      "details": "18.06.2025 (Bekanntmachungsdatum)\n\nNordrhein-Westfalen Amtsgericht Düsseldorf HRB 93162\nRegisterbekanntmachung nach dem Umwandlungsgesetz\n\nAPONTIS PHARMA AG\nAktiengesellschaft\nMonheim am Rhein\n\nDem Registergericht ist ein Vertrag über die geplante Verschmelzung der APONTIS PHARMA  AG  mit der Zentiva AG eingereicht worden."
    },
    {
      "date": "2025-06-18",
      "id": "112652",
      "original_text": "Registerbekanntmachung nach dem Umwandlungsgesetz\nNordrhein-Westfalen Amtsgericht Düsseldorf HRB 43650\nINTOCAST Aktiengesellschaft Feuerfestprodukte und Gießhilfsmittel – Ratingen",
      "type": "Registerbekanntmachung nach dem Umwandlungsgesetz",
      "state": "Nordrhein-Westfalen",
      "amtsgericht": "Amtsgericht Düsseldorf",
      "registernummer": "HRB 43650",
      "registerart": "HRB",
      "company_name": "INTOCAST Aktiengesellschaft Feuerfestprodukte und Gießhilfsmittel",
      "company_seat": "Ratingen",
      "details": "18.06.2025 (Bekanntmachungsdatum)\n\nNordrhein-Westfalen Amtsgericht Düsseldorf HRB 43650\nRegisterbekanntmachung nach dem Umwandlungsgesetz\n\nINTOCAST Aktiengesellschaft Feuerfestprodukte und Gießhilfsmittel\nAktiengesellschaft\nRatingen\n\nDem Registergericht ist ein Vertrag über die geplante Verschmelzung der Intocast Iron & Coke GmbH mit der INTOCAST Aktiengesellschaft Feuerfestprodukte und Gießhilfsmittel eingereicht worden."
    },
    {
      "date": "2025-06-18",
      "id": "112653",
      "original_text": "Löschungsankündigung\nNordrhein-Westfalen Amtsgericht Neuss HRB 20987\nM & B GmbH – Neuss",
      "type": "Löschungsankündigung",
      "state": "Nordrhein-Westfalen",
      "amtsgericht": "Amtsgericht Neuss",
      "registernummer": "HRB 20987",
      "registerart": "HRB",
      "company_name": "M & B GmbH",
      "company_seat": "Neuss",
      "details": "18.06.2025 (Bekanntmachungsdatum)\n\nNordrhein-Westfalen Amtsgericht Neuss HRB 20987\nLöschungsankündigung\n\nM & B GmbH\nGesellschaft mit beschränkter Haftung\nNeuss\n\nEs ist beabsichtigt, die Gesellschaft wegen Vermögenslosigkeit aufgrund des § 394 Abs. 1 FamFG zu löschen. Frist zur Geltendmachung eines Widerspruchs: 1 Monat.\n\nRechtsbehelfsbelehrung:\nGegen diese Verfügung können Sie Widerspruch einlegen.\nDer Widerspruch ist bei dem Amtsgericht Neuss - Registergericht -, Breite Str. 48, 41460 Neuss schriftlich in deutscher Sprache oder zur Niederschrift der Geschäftsstelle einzulegen.\nDer Widerspruch kann auch zur Niederschrift der Geschäftsstelle eines jeden Amtsgerichtes abgegeben werden.\nDie Einlegung ist auch durch Übertragung eines elektronischen Dokuments an die elektronische Poststelle des Gerichts möglich. Das elektronische Dokument muss für die Bearbeitung durch das Gericht geeignet und mit einer qualifizierten elektronischen Signatur der verantwortenden Person versehen sein oder von der verantwortenden Person signiert und auf einem sicheren Übermittlungsweg gemäß § 130a ZPO nach näherer Maßgabe der Verordnung über die technischen Rahmenbedingungen des elektronischen Rechtsverkehrs und über das besondere elektronische Behördenpostfach (BGBl. I, S.3803) eingereicht werden. Weitere Informationen erhalten Sie auf der Internetseite www.justiz.de.\nDer Widerspruch muss spätestens innerhalb der gesetzten Frist nach der schriftlichen Bekanntgabe der Verfügung bei dem Amtsgericht - Registergericht - Neuss eingegangen sein. Dies gilt auch dann, wenn der Widerspruch zur Niederschrift der Geschäftsstelle eines anderen Amtsgerichtes abgegeben wurde. Die Frist beginnt mit der schriftlichen Bekanntgabe der Verfügung. Die Bekanntgabe ist entweder durch Zustellung oder am dritten Tage nach Aufgabe zur Post bewirkt. Fällt das Ende der Frist auf einen Sonntag, einen allgemeinen Feiertag oder Sonnabend, so endet die Frist mit Ablauf des nächsten Werktages.\n\nDer Widerspruch muss die Bezeichnung der angefochtenen Verfügung sowie die Erklärung enthalten, dass Widerspruch gegen diese Verfügung eingelegt wird. Er ist zu unterzeichnen und soll begründet werden."
    },
    {
      "date": "2025-06-18",
      "id": "112654",
      "original_text": "Registerbekanntmachung nach dem Umwandlungsgesetz\nNordrhein-Westfalen Amtsgericht Paderborn HRB 12068\nRollladen Füser GmbH – Büren",
      "type": "Registerbekanntmachung nach dem Umwandlungsgesetz",
      "state": "Nordrhein-Westfalen",
      "amtsgericht": "Amtsgericht Paderborn",
      "registernummer": "HRB 12068",
      "registerart": "HRB",
      "company_name": "Rollladen Füser GmbH",
      "company_seat": "Büren",
      "details": "18.06.2025 (Bekanntmachungsdatum)\n\nNordrhein-Westfalen Amtsgericht Paderborn HRB 12068\nRegisterbekanntmachung nach dem Umwandlungsgesetz 18.06.2025 (Eintragungsdatum)\n\nRollladen Füser GmbH\nGesellschaft mit beschränkter Haftung\nBüren\n\nDen Gläubigern der an der Abspaltung beteiligten Rechtsträger ist, wenn sie binnen sechs Monaten nach dem Tag, an dem die Eintragung der Abspaltung in das Register des Sitzes desjenigen Rechtsträgers, dessen Gläubiger sie sind, nach § 19 Absatz 3 UmwG als bekanntgemacht gilt, ihren Anspruch nach Grund und Höhe schriftlich anmelden, Sicherheit zu leisten, soweit sie nicht Befriedigung verlangen können. Dieses Recht steht den Gläubigern jedoch nur zu, wenn sie glaubhaft machen, dass durch die Abspaltung die Erfüllung ihrer Forderung gefährdet wird."
    },
    {
      "date": "2025-06-18",
      "id": "112655",
      "original_text": "Löschungsankündigung\nNordrhein-Westfalen Amtsgericht Münster HRA 11325\nKAA86 Projekt GmbH & Co KG – Münster",
      "type": "Löschungsankündigung",
      "state": "Nordrhein-Westfalen",
      "amtsgericht": "Amtsgericht Münster",
      "registernummer": "HRA 11325",
      "registerart": "HRA",
      "company_name": "KAA86 Projekt GmbH & Co KG",
      "company_seat": "Münster",
      "details": "18.06.2025 (Bekanntmachungsdatum)\n\nNordrhein-Westfalen Amtsgericht Münster HRA 11325\nLöschungsankündigung\n\nKAA86 Projekt GmbH & Co KG\nKommanditgesellschaft\nMünster\n\nDas Registergericht beabsichtigt die Firma von Amts wegen nach § 394 FamFG zu löschen. Die Frist zur Erhebung eines Widerspruchs ist auf zwei Monate festgesetzt."
    },
    {
      "date": "2025-06-18",
      "id": "112656",
      "original_text": "Registerbekanntmachung nach dem Umwandlungsgesetz\nNordrhein-Westfalen Amtsgericht Bochum HRB 20844\nNiehusmann GmbH – Bochum",
      "type": "Registerbekanntmachung nach dem Umwandlungsgesetz",
      "state": "Nordrhein-Westfalen",
      "amtsgericht": "Amtsgericht Bochum",
      "registernummer": "HRB 20844",
      "registerart": "HRB",
      "company_name": "Niehusmann GmbH",
      "company_seat": "Bochum",
      "details": "18.06.2025 (Bekanntmachungsdatum)\n\nNordrhein-Westfalen Amtsgericht Bochum HRB 20844\nRegisterbekanntmachung nach dem Umwandlungsgesetz 18.06.2025 (Eintragungsdatum)\n\nNiehusmann GmbH\nGesellschaft mit beschränkter Haftung\nBochum\n\nDen Gläubigern der an der Verschmelzung beteiligten Rechtsträger ist, wenn sie binnen sechs Monaten nach dem Tag, an dem die Eintragung der Verschmelzung in das Register des Sitzes derjenigen Rechtsträger deren Gläubiger sie sind, nach § 19 Absatz 3 UmwG als bekanntgemacht gilt, ihren Anspruch nach Grund und Höhe schriftlich anmelden, Sicherheit zu leisten, soweit sie nicht Befriedigung verlangen können. Dieses Recht steht den Gläubigern jedoch nur zu, wenn sie glaubhaft machen, dass durch die Verschmelzung die Erfüllung ihrer Forderung gefährdet wird."
    },
    {
      "date": "2025-06-18",
      "id": "112657",
      "original_text": "Registerbekanntmachung nach dem Umwandlungsgesetz\nNordrhein-Westfalen Amtsgericht Düsseldorf HRB 106897\nKohlsmann Bürobedarf + EDV-Zubehör GmbH – Düsseldorf",
      "type": "Registerbekanntmachung nach dem Umwandlungsgesetz",
      "state": "Nordrhein-Westfalen",
      "amtsgericht": "Amtsgericht Düsseldorf",
      "registernummer": "HRB 106897",
      "registerart": "HRB",
      "company_name": "Kohlsmann Bürobedarf + EDV-Zubehör GmbH",
      "company_seat": "Düsseldorf",
      "details": "18.06.2025 (Bekanntmachungsdatum)\n\nNordrhein-Westfalen Amtsgericht Düsseldorf HRB 106897\nRegisterbekanntmachung nach dem Umwandlungsgesetz 18.06.2025 (Eintragungsdatum)\n\nKohlsmann Bürobedarf + EDV-Zubehör GmbH\nGesellschaft mit beschränkter Haftung\nDüsseldorf\n\nDen Gläubigern der an der Verschmelzung beteiligten Rechtsträger ist, wenn sie binnen sechs Monaten nach dem Tag, an dem die Eintragung der Verschmelzung in das Register des Sitzes desjenigen Rechtsträgers, dessen Gläubiger sie sind, nach § 19 Absatz 3 UmwG als bekanntgemacht gilt, ihren Anspruch nach Grund und Höhe schriftlich anmelden, Sicherheit zu leisten, soweit sie nicht Befriedigung verlangen können. Dieses Recht steht den Gläubigern jedoch nur zu, wenn sie glaubhaft machen, dass durch die Verschmelzung die Erfüllung ihrer Forderung gefährdet wird."
    },
    {
      "date": "2025-06-18",
      "id": "112658",
      "original_text": "Registerbekanntmachung nach dem Umwandlungsgesetz\nNordrhein-Westfalen Amtsgericht Köln HRB 104317\nLekkerland SE – Köln",
      "type": "Registerbekanntmachung nach dem Umwandlungsgesetz",
      "state": "Nordrhein-Westfalen",
      "amtsgericht": "Amtsgericht Köln",
      "registernummer": "HRB 104317",
      "registerart": "HRB",
      "company_name": "Lekkerland SE",
      "company_seat": "Köln",
      "details": "18.06.2025 (Bekanntmachungsdatum)\n\nNordrhein-Westfalen Amtsgericht Köln HRB 104317\nRegisterbekanntmachung nach dem Umwandlungsgesetz\n\nLekkerland SE\nEuropäische Aktiengesellschaft (SE)\nKöln\n\nDem Registergericht ist der Entwurf eines Vertrages über die geplante Verschmelzung der Lekkerland information Systems GmbH mit der Lekkerland SE eingereicht worden."
    },
    {
      "date": "2025-06-18",
      "id": "112659",
      "original_text": "Registerbekanntmachung nach dem Umwandlungsgesetz\nNordrhein-Westfalen Amtsgericht Düsseldorf HRB 108159\nKK Infrastruktur GmbH – Düsseldorf",
      "type": "Registerbekanntmachung nach dem Umwandlungsgesetz",
      "state": "Nordrhein-Westfalen",
      "amtsgericht": "Amtsgericht Düsseldorf",
      "registernummer": "HRB 108159",
      "registerart": "HRB",
      "company_name": "KK Infrastruktur GmbH",
      "company_seat": "Düsseldorf",
      "details": "18.06.2025 (Bekanntmachungsdatum)\n\nNordrhein-Westfalen Amtsgericht Düsseldorf HRB 108159\nRegisterbekanntmachung nach dem Umwandlungsgesetz 18.06.2025 (Eintragungsdatum)\n\nKK Infrastruktur GmbH\nGesellschaft mit beschränkter Haftung\nDüsseldorf\n\nDen Gläubigern der an der Verschmelzung beteiligten Rechtsträger ist, wenn sie binnen sechs Monaten nach dem Tag, an dem die Eintragung der Verschmelzung in das Register des Sitzes desjenigen Rechtsträgers, dessen Gläubiger sie sind, nach § 19 Absatz 3 UmwG als bekanntgemacht gilt, ihren Anspruch nach Grund und Höhe schriftlich anmelden, Sicherheit zu leisten, soweit sie nicht Befriedigung verlangen können. Dieses Recht steht den Gläubigern jedoch nur zu, wenn sie glaubhaft machen, dass durch die Verschmelzung die Erfüllung ihrer Forderung gefährdet wird."
    },
    {
      "date": "2025-06-18",
      "id": "112660",
      "original_text": "Registerbekanntmachung nach dem Umwandlungsgesetz\nNordrhein-Westfalen Amtsgericht Essen HRA 11483\nOptik & Akustik Frank Klötgen e.K. – Essen",
      "type": "Registerbekanntmachung nach dem Umwandlungsgesetz",
      "state": "Nordrhein-Westfalen",
      "amtsgericht": "Amtsgericht Essen",
      "registernummer": "HRA 11483",
      "registerart": "HRA",
      "company_name": "Optik & Akustik Frank Klötgen e.K.",
      "company_seat": "Essen",
      "details": "18.06.2025 (Bekanntmachungsdatum)\n\nNordrhein-Westfalen Amtsgericht Essen HRA 11483\nRegisterbekanntmachung nach dem Umwandlungsgesetz 18.06.2025 (Eintragungsdatum)\n\nOptik & Akustik Frank Klötgen e.K.\nEinzelkaufmann / Einzelkauffrau\nEssen\n\nDen Gläubigern der an der Ausgliederung beteiligten Rechtsträger ist, wenn sie binnen sechs Monaten nach dem Tag, an dem die Eintragung der Ausgliederung in das Register des Sitzes desjenigen Rechtsträgers, dessen Gläubiger sie sind, nach § 19 Absatz 3 UmwG als bekanntgemacht gilt, ihren Anspruch nach Grund und Höhe schriftlich anmelden, Sicherheit zu leisten, soweit sie nicht Befriedigung verlangen können. Dieses Recht steht den Gläubigern jedoch nur zu, wenn sie glaubhaft machen, dass durch die Ausgliederung die Erfüllung ihrer Forderung gefährdet wird."
    },
    {
      "date": "2025-06-18",
      "id": "112661",
      "original_text": "Einreichung neuer Dokumente\nNordrhein-Westfalen Amtsgericht Essen HRB 25782\nB Solution AG – Sprockhövel",
      "type": "Einreichung neuer Dokumente",
      "state": "Nordrhein-Westfalen",
      "amtsgericht": "Amtsgericht Essen",
      "registernummer": "HRB 25782",
      "registerart": "HRB",
      "company_name": "B Solution AG",
      "company_seat": "Sprockhövel",
      "details": "18.06.2025 (Bekanntmachungsdatum)\n\nNordrhein-Westfalen Amtsgericht Essen HRB 25782\nEinreichung neuer Dokumente\n\nB Solution AG\nAktiengesellschaft\nSprockhövel\n\nDem Registergericht ist eine neue Liste der Mitglieder des Aufsichtsrates eingereicht worden."
    },
    {
      "date": "2025-06-18",
      "id": "112662",
      "original_text": "Registerbekanntmachung nach dem Umwandlungsgesetz\nNordrhein-Westfalen Amtsgericht Dortmund HRA 13640\nEGU Elektro Großhandels Union Rhein-Ruhr GmbH & Co. KG – Dortmund",
      "type": "Registerbekanntmachung nach dem Umwandlungsgesetz",
      "state": "Nordrhein-Westfalen",
      "amtsgericht": "Amtsgericht Dortmund",
      "registernummer": "HRA 13640",
      "registerart": "HRA",
      "company_name": "EGU Elektro Großhandels Union Rhein-Ruhr GmbH & Co. KG",
      "company_seat": "Dortmund",
      "details": "18.06.2025 (Bekanntmachungsdatum)\n\nNordrhein-Westfalen Amtsgericht Dortmund HRA 13640\nRegisterbekanntmachung nach dem Umwandlungsgesetz 18.06.2025 (Eintragungsdatum)\n\nEGU Elektro Großhandels Union Rhein-Ruhr GmbH & Co. KG\nKommanditgesellschaft\nDortmund\n\nDen Gläubigern der an der Verschmelzung beteiligten Rechtsträger ist, wenn sie binnen sechs Monaten nach dem Tag, an dem die Eintragung der Verschmelzung in das Register des Sitzes desjenigen Rechtsträgers, dessen Gläubiger sie sind, nach § 19 Absatz 3 UmwG als bekanntgemacht gilt, ihren Anspruch nach Grund und Höhe schriftlich anmelden, Sicherheit zu leisten, soweit sie nicht Befriedigung verlangen können. Dieses Recht steht den Gläubigern jedoch nur zu, wenn sie glaubhaft machen, dass durch die Verschmelzung die Erfüllung ihrer Forderung gefährdet wird."
    },
    {
      "date": "2025-06-18",
      "id": "112663",
      "original_text": "Registerbekanntmachung nach dem Umwandlungsgesetz\nNordrhein-Westfalen Amtsgericht Köln HRB 51915\nDeutsche Ärzte Finanz Beratungs- und Vermittlungs-Aktiengesellschaft – Köln",
      "type": "Registerbekanntmachung nach dem Umwandlungsgesetz",
      "state": "Nordrhein-Westfalen",
      "amtsgericht": "Amtsgericht Köln",
      "registernummer": "HRB 51915",
      "registerart": "HRB",
      "company_name": "Deutsche Ärzte Finanz Beratungs- und Vermittlungs-Aktiengesellschaft",
      "company_seat": "Köln",
      "details": "18.06.2025 (Bekanntmachungsdatum)\n\nNordrhein-Westfalen Amtsgericht Köln HRB 51915\nRegisterbekanntmachung nach dem Umwandlungsgesetz\n\nDeutsche Ärzte Finanz Beratungs- und Vermittlungs-Aktiengesellschaft\nAktiengesellschaft\nKöln\n\nDem Registergericht ist der Entwurf eines Vertrages über die geplante Verschmelzung der Finanz-Service GmbH der APO-Bank mit der Deutsche Arzte Finanz Beratungs- und Vermittlungs-Aktiengesellschaft eingereicht worden."
    },
    {
      "date": "2025-06-18",
      "id": "112664",
      "original_text": "Registerbekanntmachung nach dem Umwandlungsgesetz\nNordrhein-Westfalen Amtsgericht Köln HRB 38464\nKlinikum Oberberg GmbH – Gummersbach",
      "type": "Registerbekanntmachung nach dem Umwandlungsgesetz",
      "state": "Nordrhein-Westfalen",
      "amtsgericht": "Amtsgericht Köln",
      "registernummer": "HRB 38464",
      "registerart": "HRB",
      "company_name": "Klinikum Oberberg GmbH",
      "company_seat": "Gummersbach",
      "details": "18.06.2025 (Bekanntmachungsdatum)\n\nNordrhein-Westfalen Amtsgericht Köln HRB 38464\nRegisterbekanntmachung nach dem Umwandlungsgesetz 18.06.2025 (Eintragungsdatum)\n\nKlinikum Oberberg GmbH\nGesellschaft mit beschränkter Haftung\nGummersbach\n\nDen Gläubigern der an der Verschmelzung beteiligten Rechtsträger ist, wenn sie binnen sechs Monaten nach dem Tag, an dem die Eintragung der Verschmelzung in das Register des Sitzes derjenigen Rechtsträger deren Gläubiger sie sind, nach § 19 Absatz 3 UmwG als bekanntgemacht gilt, ihren Anspruch nach Grund und Höhe schriftlich anmelden, Sicherheit zu leisten, soweit sie nicht Befriedigung verlangen können. Dieses Recht steht den Gläubigern jedoch nur zu, wenn sie glaubhaft machen, dass durch die Verschmelzung die Erfüllung ihrer Forderung gefährdet wird."
    },
    {
      "date": "2025-06-18",
      "id": "112665",
      "original_text": "Einreichung neuer Dokumente\nNiedersachsen Amtsgericht Oldenburg (Oldenburg) HRB 202516\nBAD Bäderbetriebsgesellschaft mbH – Delmenhorst",
      "type": "Einreichung neuer Dokumente",
      "state": "Niedersachsen",
      "amtsgericht": "Amtsgericht Oldenburg (Oldenburg)",
      "registernummer": "HRB 202516",
      "registerart": "HRB",
      "company_name": "BAD Bäderbetriebsgesellschaft mbH",
      "company_seat": "Delmenhorst",
      "details": "18.06.2025 (Bekanntmachungsdatum)\n\nNiedersachsen Amtsgericht Oldenburg (Oldenburg) HRB 202516\nEinreichung neuer Dokumente\n\nBAD Bäderbetriebsgesellschaft mbH\nGesellschaft mit beschränkter Haftung\nDelmenhorst\n\nDie Liste der Mitglieder des Aufsichtsrats wurde beim Registergericht eingereicht."
    },
    {
      "date": "2025-06-18",
      "id": "112666",
      "original_text": "Einreichung neuer Dokumente\nThüringen Amtsgericht Jena HRB 111661\nX-FAB Semiconductor Foundries GmbH – Erfurt",
      "type": "Einreichung neuer Dokumente",
      "state": "Thüringen",
      "amtsgericht": "Amtsgericht Jena",
      "registernummer": "HRB 111661",
      "registerart": "HRB",
      "company_name": "X-FAB Semiconductor Foundries GmbH",
      "company_seat": "Erfurt",
      "details": "18.06.2025 (Bekanntmachungsdatum)\n\nThüringen Amtsgericht Jena HRB 111661\nEinreichung neuer Dokumente\n\nX-FAB Semiconductor Foundries GmbH\nGesellschaft mit beschränkter Haftung\nErfurt\n\nBekanntmachung gem. § 52 Abs. 3 Satz 2 GmbHG: Aufgrund einer Veränderung in den Personen der Aufsichtsratsmitglieder ist durch die Geschäftsführer eine neue Liste zum Handelsregister eingereicht worden."
    },
    {
      "date": "2025-06-18",
      "id": "112667",
      "original_text": "Einreichung neuer Dokumente\nHessen Amtsgericht Kassel HRB 20101\nVOLKSWAGEN GROUP Original Teile Logistik, Vertrieb & Services GmbH – Baunatal",
      "type": "Einreichung neuer Dokumente",
      "state": "Hessen",
      "amtsgericht": "Amtsgericht Kassel",
      "registernummer": "HRB 20101",
      "registerart": "HRB",
      "company_name": "VOLKSWAGEN GROUP Original Teile Logistik, Vertrieb & Services GmbH",
      "company_seat": "Baunatal",
      "details": "18.06.2025 (Bekanntmachungsdatum)\n\nHessen Amtsgericht Kassel HRB 20101\nEinreichung neuer Dokumente\n\nVOLKSWAGEN GROUP Original Teile Logistik, Vertrieb & Services GmbH\nGesellschaft mit beschränkter Haftung\nBaunatal\n\nDurch eine Änderung in den Personen der Aufsichtsratsmitglieder ist eine Liste der Mitglieder des Aufsichtsrates zum Handelsregister eingereicht worden."
    },
    {
      "date": "2025-06-18",
      "id": "112668",
      "original_text": "Sonstige Registerbekanntmachung\nHessen Amtsgericht Wiesbaden VR 2208\nSki-Club-Auringen e.V. – Wiesbaden",
      "type": "Sonstige Registerbekanntmachung",
      "state": "Hessen",
      "amtsgericht": "Amtsgericht Wiesbaden",
      "registernummer": "VR 2208",
      "registerart": "VR",
      "company_name": "Ski-Club-Auringen e.V.",
      "company_seat": "Wiesbaden",
      "details": "18.06.2025 (Bekanntmachungsdatum)\n\nHessen Amtsgericht Wiesbaden VR 2208\nSonstige Registerbekanntmachung 18.06.2025 (Eintragungsdatum)\n\nSki-Club-Auringen e.V.\neingetragener Verein\nWiesbaden\n\nDer Verein ist aufgelöst."
    },
    {
      "date": "2025-06-18",
      "id": "112669",
      "original_text": "Sonstige Registerbekanntmachung\nHessen Amtsgericht Frankfurt am Main HRB 49135\nShareholder Value Management Aktiengesellschaft – Frankfurt am Main",
      "type": "Sonstige Registerbekanntmachung",
      "state": "Hessen",
      "amtsgericht": "Amtsgericht Frankfurt am Main",
      "registernummer": "HRB 49135",
      "registerart": "HRB",
      "company_name": "Shareholder Value Management Aktiengesellschaft",
      "company_seat": "Frankfurt am Main",
      "details": "18.06.2025 (Bekanntmachungsdatum)\n\nHessen Amtsgericht Frankfurt am Main HRB 49135\nSonstige Registerbekanntmachung\n\nShareholder Value Management Aktiengesellschaft\nAktiengesellschaft\nFrankfurt am Main\n\nDurch eine Änderung in den Personen der Aufsichtsratsmitglieder ist eine Liste der Mitglieder des Aufsichtsrates zum Handelsregister eingereicht worden."
    },
    {
      "date": "2025-06-18",
      "id": "112670",
      "original_text": "Registerbekanntmachung nach dem Umwandlungsgesetz\nHessen Amtsgericht Friedberg HRB 1444\nVogtländische Reifenwerke Sitz Bad Nauheim GmbH – Bad Nauheim",
      "type": "Registerbekanntmachung nach dem Umwandlungsgesetz",
      "state": "Hessen",
      "amtsgericht": "Amtsgericht Friedberg",
      "registernummer": "HRB 1444",
      "registerart": "HRB",
      "company_name": "Vogtländische Reifenwerke Sitz Bad Nauheim GmbH",
      "company_seat": "Bad Nauheim",
      "details": "18.06.2025 (Bekanntmachungsdatum)\n\nHessen Amtsgericht Friedberg HRB 1444\nRegisterbekanntmachung nach dem Umwandlungsgesetz 18.06.2025 (Eintragungsdatum)\n\nVogtländische Reifenwerke Sitz Bad Nauheim GmbH\nGesellschaft mit beschränkter Haftung\nBad Nauheim\n\nDen Gläubigern der an der Verschmelzung beteiligten Rechtsträger ist, wenn sie binnen sechs Monaten nach dem Tag, an dem die Eintragung der Verschmelzung in das Register des Sitzes desjenigen Rechtsträgers, dessen Gläubiger sie sind, nach § 19 Absatz 3 UmwG bekannt gemacht worden ist, ihren Anspruch nach Grund und Höhe schriftlich anmelden, Sicherheit zu leisten, soweit sie nicht Befriedigung verlangen können. Dieses Recht steht den Gläubigern jedoch nur zu, wenn sie glaubhaft machen, dass durch die Verschmelzung die Erfüllung ihrer Forderung gefährdet wird."
    },
    {
      "date": "2025-06-18",
      "id": "112671",
      "original_text": "Registerbekanntmachung nach dem Umwandlungsgesetz\nHessen Amtsgericht Hanau HRB 93725\nGlöckner Gesellschaft mit beschränkter Haftung – Maintal",
      "type": "Registerbekanntmachung nach dem Umwandlungsgesetz",
      "state": "Hessen",
      "amtsgericht": "Amtsgericht Hanau",
      "registernummer": "HRB 93725",
      "registerart": "HRB",
      "company_name": "Glöckner Gesellschaft mit beschränkter Haftung",
      "company_seat": "Maintal",
      "details": "18.06.2025 (Bekanntmachungsdatum)\n\nHessen Amtsgericht Hanau HRB 93725\nRegisterbekanntmachung nach dem Umwandlungsgesetz 18.06.2025 (Eintragungsdatum)\n\nGlöckner Gesellschaft mit beschränkter Haftung\nGesellschaft mit beschränkter Haftung\nMaintal\n\nDen Gläubigern der an der Verschmelzung beteiligten Rechtsträger ist, wenn sie binnen sechs Monaten nach dem Tag, an dem die Eintragung der Verschmelzung in das Register des Sitzes desjenigen Rechtsträgers, dessen Gläubiger sie sind, nach § 19 Absatz 3 UmwG bekannt gemacht worden ist, ihren Anspruch nach Grund und Höhe schriftlich anmelden, Sicherheit zu leisten, soweit sie nicht Befriedigung verlangen können. Dieses Recht steht den Gläubigern jedoch nur zu, wenn sie glaubhaft machen, dass durch die Verschmelzung die Erfüllung ihrer Forderung gefährdet wird."
    },
    {
      "date": "2025-06-18",
      "id": "112672",
      "original_text": "Löschungsankündigung\nHessen Amtsgericht Darmstadt HRB 90491\nNATURE WAY GmbH – Riedstadt",
      "type": "Löschungsankündigung",
      "state": "Hessen",
      "amtsgericht": "Amtsgericht Darmstadt",
      "registernummer": "HRB 90491",
      "registerart": "HRB",
      "company_name": "NATURE WAY GmbH",
      "company_seat": "Riedstadt",
      "details": "18.06.2025 (Bekanntmachungsdatum)\n\nHessen Amtsgericht Darmstadt HRB 90491\nLöschungsankündigung 18.06.2025 (Eintragungsdatum)\n\nNATURE WAY GmbH\nGesellschaft mit beschränkter Haftung\nRiedstadt\n\nDas Registergericht beabsichtigt die im Handelsregister eingetragene Gesellschaft von Amts wegen nach § 394 FamFG zu löschen. Die Frist zur Erhebung eines Widerspruchs gegen die beabsichtigte Löschung wird auf 3 Monate festgesetzt."
    },
    {
      "date": "2025-06-18",
      "id": "112673",
      "original_text": "Registerbekanntmachung nach dem Umwandlungsgesetz\nHessen Amtsgericht Darmstadt HRB 103242\nsyntect RE GmbH – Bensheim",
      "type": "Registerbekanntmachung nach dem Umwandlungsgesetz",
      "state": "Hessen",
      "amtsgericht": "Amtsgericht Darmstadt",
      "registernummer": "HRB 103242",
      "registerart": "HRB",
      "company_name": "syntect RE GmbH",
      "company_seat": "Bensheim",
      "details": "18.06.2025 (Bekanntmachungsdatum)\n\nHessen Amtsgericht Darmstadt HRB 103242\nRegisterbekanntmachung nach dem Umwandlungsgesetz 18.06.2025 (Eintragungsdatum)\n\nsyntect RE GmbH\nGesellschaft mit beschränkter Haftung\nBensheim\n\nDen Gläubigern der an der Verschmelzung beteiligten Rechtsträger ist, wenn sie binnen sechs Monaten nach dem Tag, an dem die Eintragung der Verschmelzung in das Register des Sitzes derjenigen Rechtsträger deren Gläubiger sie sind, nach § 19 Absatz 3 UmwG bekannt gemacht worden ist, ihren Anspruch nach Grund und Höhe schriftlich anmelden, Sicherheit zu leisten, soweit sie nicht Befriedigung verlangen können. Dieses Recht steht den Gläubigern jedoch nur zu, wenn sie glaubhaft machen, dass durch die Verschmelzung die Erfüllung ihrer Forderung gefährdet wird."
    },
    {
      "date": "2025-06-18",
      "id": "112674",
      "original_text": "Registerbekanntmachung nach dem Umwandlungsgesetz\nHessen Amtsgericht Darmstadt HRB 61324\npead - software GmbH – Viernheim",
      "type": "Registerbekanntmachung nach dem Umwandlungsgesetz",
      "state": "Hessen",
      "amtsgericht": "Amtsgericht Darmstadt",
      "registernummer": "HRB 61324",
      "registerart": "HRB",
      "company_name": "pead - software GmbH",
      "company_seat": "Viernheim",
      "details": "18.06.2025 (Bekanntmachungsdatum)\n\nHessen Amtsgericht Darmstadt HRB 61324\nRegisterbekanntmachung nach dem Umwandlungsgesetz 18.06.2025 (Eintragungsdatum)\n\npead - software GmbH\nGesellschaft mit beschränkter Haftung\nViernheim\n\nDen Gläubigern der an der Abspaltung beteiligten Rechtsträger ist, wenn sie binnen sechs Monaten nach dem Tag, an dem die Eintragung der Abspaltung in das Register des Sitzes derjenigen Rechtsträger deren Gläubiger sie sind, nach §§ 125, 19 Absatz 3 UmwG bekannt gemacht worden ist, ihren Anspruch nach Grund und Höhe schriftlich anmelden, Sicherheit zu leisten, soweit sie nicht Befriedigung verlangen können. Dieses Recht steht den Gläubigern jedoch nur zu, wenn sie glaubhaft machen, dass durch die Abspaltung die Erfüllung ihrer Forderung gefährdet wird."
    },
    {
      "date": "2025-06-18",
      "id": "112675",
      "original_text": "Registerbekanntmachung nach dem Umwandlungsgesetz\nHessen Amtsgericht Limburg HRB 7275\nKartonplus GmbH – Villmar",
      "type": "Registerbekanntmachung nach dem Umwandlungsgesetz",
      "state": "Hessen",
      "amtsgericht": "Amtsgericht Limburg",
      "registernummer": "HRB 7275",
      "registerart": "HRB",
      "company_name": "Kartonplus GmbH",
      "company_seat": "Villmar",
      "details": "18.06.2025 (Bekanntmachungsdatum)\n\nHessen Amtsgericht Limburg HRB 7275\nRegisterbekanntmachung nach dem Umwandlungsgesetz 18.06.2025 (Eintragungsdatum)\n\nKartonplus GmbH\nGesellschaft mit beschränkter Haftung\nVillmar\n\nDen Gläubigern der an der Verschmelzung beteiligten Rechtsträger ist, wenn sie binnen sechs Monaten nach dem Tag, an dem die Eintragung der Verschmelzung in das Register des Sitzes desjenigen Rechtsträgers, dessen Gläubiger sie sind, nach § 19 Absatz 3 UmwG bekannt gemacht worden ist, ihren Anspruch nach Grund und Höhe schriftlich anmelden, Sicherheit zu leisten, soweit sie nicht Befriedigung verlangen können. Dieses Recht steht den Gläubigern jedoch nur zu, wenn sie glaubhaft machen, dass durch die Verschmelzung die Erfüllung ihrer Forderung gefährdet wird."
    },
    {
      "date": "2025-06-18",
      "id": "112676",
      "original_text": "Sonstige Registerbekanntmachung\nHessen Amtsgericht Frankfurt am Main HRB 74234\nSyna GmbH – Frankfurt am Main",
      "type": "Sonstige Registerbekanntmachung",
      "state": "Hessen",
      "amtsgericht": "Amtsgericht Frankfurt am Main",
      "registernummer": "HRB 74234",
      "registerart": "HRB",
      "company_name": "Syna GmbH",
      "company_seat": "Frankfurt am Main",
      "details": "18.06.2025 (Bekanntmachungsdatum)\n\nHessen Amtsgericht Frankfurt am Main HRB 74234\nSonstige Registerbekanntmachung\n\nSyna GmbH\nGesellschaft mit beschränkter Haftung\nFrankfurt am Main\n\nDurch eine Änderung in den Personen der Aufsichtsratsmitglieder ist eine Liste der Mitglieder des Aufsichtsrates zum Handelsregister eingereicht worden."
    },
    {
      "date": "2025-06-18",
      "id": "112677",
      "original_text": "Registerbekanntmachung nach dem Umwandlungsgesetz\nHessen Amtsgericht Marburg HRB 5319\nMV I Beteiligungs GmbH – Battenberg",
      "type": "Registerbekanntmachung nach dem Umwandlungsgesetz",
      "state": "Hessen",
      "amtsgericht": "Amtsgericht Marburg",
      "registernummer": "HRB 5319",
      "registerart": "HRB",
      "company_name": "MV I Beteiligungs GmbH",
      "company_seat": "Battenberg",
      "details": "18.06.2025 (Bekanntmachungsdatum)\n\nHessen Amtsgericht Marburg HRB 5319\nRegisterbekanntmachung nach dem Umwandlungsgesetz 18.06.2025 (Eintragungsdatum)\n\nMV I Beteiligungs GmbH\nGesellschaft mit beschränkter Haftung\nBattenberg\n\nDen Gläubigern der an der formwechselnden Umwandlung beteiligten Rechtsträger ist, wenn sie binnen sechs Monaten nach dem Tag, an dem die Eintragung der formwechselnden Umwandlung in das Register des Sitzes desjenigen Rechtsträgers, dessen Gläubiger sie sind, nach § 201 UmwG bekannt gemacht worden ist, ihren Anspruch nach Grund und Höhe schriftlich anmelden, Sicherheit zu leisten, soweit sie nicht Befriedigung verlangen können. Dieses Recht steht den Gläubigern jedoch nur zu, wenn sie glaubhaft machen, dass durch die formwechselnden Umwandlung die Erfüllung ihrer Forderung gefährdet wird."
    },
    {
      "date": "2025-06-18",
      "id": "112678",
      "original_text": "Registerbekanntmachung nach dem Umwandlungsgesetz\nHessen Amtsgericht Wiesbaden GsR 318\nEasyRent24 eGbR – Hochheim am Main",
      "type": "Registerbekanntmachung nach dem Umwandlungsgesetz",
      "state": "Hessen",
      "amtsgericht": "Amtsgericht Wiesbaden",
      "registernummer": "GsR 318",
      "registerart": "GsR",
      "company_name": "EasyRent24 eGbR",
      "company_seat": "Hochheim am Main",
      "details": "18.06.2025 (Bekanntmachungsdatum)\n\nHessen Amtsgericht Wiesbaden GsR 318\nRegisterbekanntmachung nach dem Umwandlungsgesetz 18.06.2025 (Eintragungsdatum)\n\nEasyRent24 eGbR\nGesellschaft bürgerlichen Rechts\nHochheim am Main\n\nDen Gläubigern der an der formwechselnden Umwandlung beteiligten Rechtsträger ist, wenn sie binnen sechs Monaten nach dem Tag, an dem die Eintragung der formwechselnden Umwandlung in das Register des Sitzes desjenigen Rechtsträgers, dessen Gläubiger sie sind, nach § 201 UmwG bekannt gemacht worden ist, ihren Anspruch nach Grund und Höhe schriftlich anmelden, Sicherheit zu leisten, soweit sie nicht Befriedigung verlangen können. Dieses Recht steht den Gläubigern jedoch nur zu, wenn sie glaubhaft machen, dass durch die formwechselnden Umwandlung die Erfüllung ihrer Forderung gefährdet wird."
    },
    {
      "date": "2025-06-18",
      "id": "112679",
      "original_text": "Registerbekanntmachung nach dem Umwandlungsgesetz\nHessen Amtsgericht Limburg HRB 4003\nPacken mit System GmbH – Villmar",
      "type": "Registerbekanntmachung nach dem Umwandlungsgesetz",
      "state": "Hessen",
      "amtsgericht": "Amtsgericht Limburg",
      "registernummer": "HRB 4003",
      "registerart": "HRB",
      "company_name": "Packen mit System GmbH",
      "company_seat": "Villmar",
      "details": "18.06.2025 (Bekanntmachungsdatum)\n\nHessen Amtsgericht Limburg HRB 4003\nRegisterbekanntmachung nach dem Umwandlungsgesetz 18.06.2025 (Eintragungsdatum)\n\nPacken mit System GmbH\nGesellschaft mit beschränkter Haftung\nVillmar\n\nDen Gläubigern der an der Verschmelzung beteiligten Rechtsträger ist, wenn sie binnen sechs Monaten nach dem Tag, an dem die Eintragung der Verschmelzung in das Register des Sitzes desjenigen Rechtsträgers, dessen Gläubiger sie sind, nach § 19 Absatz 3 UmwG bekannt gemacht worden ist, ihren Anspruch nach Grund und Höhe schriftlich anmelden, Sicherheit zu leisten, soweit sie nicht Befriedigung verlangen können. Dieses Recht steht den Gläubigern jedoch nur zu, wenn sie glaubhaft machen, dass durch die Verschmelzung die Erfüllung ihrer Forderung gefährdet wird."
    },
    {
      "date": "2025-06-18",
      "id": "112680",
      "original_text": "Registerbekanntmachung nach dem Umwandlungsgesetz\nHessen Amtsgericht Darmstadt HRB 96883\nsyntect service GmbH – Bensheim",
      "type": "Registerbekanntmachung nach dem Umwandlungsgesetz",
      "state": "Hessen",
      "amtsgericht": "Amtsgericht Darmstadt",
      "registernummer": "HRB 96883",
      "registerart": "HRB",
      "company_name": "syntect service GmbH",
      "company_seat": "Bensheim",
      "details": "18.06.2025 (Bekanntmachungsdatum)\n\nHessen Amtsgericht Darmstadt HRB 96883\nRegisterbekanntmachung nach dem Umwandlungsgesetz 18.06.2025 (Eintragungsdatum)\n\nsyntect service GmbH\nGesellschaft mit beschränkter Haftung\nBensheim\n\nDen Gläubigern der Gesellschaft, deren Forderungen begründet worden sind,Den Gläubigern der an der Verschmelzung beteiligten Rechtsträger ist, wenn sie binnen sechs Monaten nach dem Tag, an dem die Eintragung der Verschmelzung in das Register des Sitzes derjenigen Rechtsträger deren Gläubiger sie sind, nach § 19 Absatz 3 UmwG bekannt gemacht worden ist, ihren Anspruch nach Grund und Höhe schriftlich anmelden, Sicherheit zu leisten, soweit sie nicht Befriedigung verlangen können. Dieses Recht steht den Gläubigern jedoch nur zu, wenn sie glaubhaft machen, dass durch die Verschmelzung die Erfüllung ihrer Forderung gefährdet wird."
    },
    {
      "date": "2025-06-18",
      "id": "112681",
      "original_text": "Einreichung neuer Dokumente\nHessen Amtsgericht Frankfurt am Main HRB 103782\nClariant Plastics & Coatings (Deutschland) GmbH – Frankfurt am Main",
      "type": "Einreichung neuer Dokumente",
      "state": "Hessen",
      "amtsgericht": "Amtsgericht Frankfurt am Main",
      "registernummer": "HRB 103782",
      "registerart": "HRB",
      "company_name": "Clariant Plastics & Coatings (Deutschland) GmbH",
      "company_seat": "Frankfurt am Main",
      "details": "18.06.2025 (Bekanntmachungsdatum)\n\nHessen Amtsgericht Frankfurt am Main HRB 103782\nEinreichung neuer Dokumente 18.06.2025 (Eintragungsdatum)\n\nClariant Plastics & Coatings (Deutschland) GmbH\nGesellschaft mit beschränkter Haftung\nFrankfurt am Main\n\nDurch eine Änderung in den Personen der Aufsichtsratsmitglieder ist eine Liste der Mitglieder des Aufsichtsrates zum Handelsregister eingereicht worden."
    },
    {
      "date": "2025-06-18",
      "id": "112682",
      "original_text": "Einreichung neuer Dokumente\nHessen Amtsgericht Frankfurt am Main HRB 100695\nCHEMETALL GMBH – Frankfurt am Main",
      "type": "Einreichung neuer Dokumente",
      "state": "Hessen",
      "amtsgericht": "Amtsgericht Frankfurt am Main",
      "registernummer": "HRB 100695",
      "registerart": "HRB",
      "company_name": "CHEMETALL GMBH",
      "company_seat": "Frankfurt am Main",
      "details": "18.06.2025 (Bekanntmachungsdatum)\n\nHessen Amtsgericht Frankfurt am Main HRB 100695\nEinreichung neuer Dokumente\n\nCHEMETALL GMBH\nGesellschaft mit beschränkter Haftung\nFrankfurt am Main\n\nDurch eine Änderung in den Personen der Aufsichtsratsmitglieder ist eine Liste der Mitglieder des Aufsichtsrates zum Handelsregister eingereicht worden."
    },
    {
      "date": "2025-06-18",
      "id": "112683",
      "original_text": "Registerbekanntmachung nach dem Umwandlungsgesetz\nHessen Amtsgericht Hanau HRB 99255\nVENDID GmbH – Nidderau",
      "type": "Registerbekanntmachung nach dem Umwandlungsgesetz",
      "state": "Hessen",
      "amtsgericht": "Amtsgericht Hanau",
      "registernummer": "HRB 99255",
      "registerart": "HRB",
      "company_name": "VENDID GmbH",
      "company_seat": "Nidderau",
      "details": "18.06.2025 (Bekanntmachungsdatum)\n\nHessen Amtsgericht Hanau HRB 99255\nRegisterbekanntmachung nach dem Umwandlungsgesetz 18.06.2025 (Eintragungsdatum)\n\nVENDID GmbH\nGesellschaft mit beschränkter Haftung\nNidderau\n\nDen Gläubigern der an der Verschmelzung beteiligten Rechtsträger ist, wenn sie binnen sechs Monaten nach dem Tag, an dem die Eintragung der Verschmelzung in das Register des Sitzes desjenigen Rechtsträgers, dessen Gläubiger sie sind, nach § 19 Absatz 3 UmwG bekannt gemacht worden ist, ihren Anspruch nach Grund und Höhe schriftlich anmelden, Sicherheit zu leisten, soweit sie nicht Befriedigung verlangen können. Dieses Recht steht den Gläubigern jedoch nur zu, wenn sie glaubhaft machen, dass durch die Verschmelzung die Erfüllung ihrer Forderung gefährdet wird."
    },
    {
      "date": "2025-06-18",
      "id": "112684",
      "original_text": "Sonstige Registerbekanntmachung\nHessen Amtsgericht Marburg VR 5340\nAlmada Mata Atlantica Project – Marburg",
      "type": "Sonstige Registerbekanntmachung",
      "state": "Hessen",
      "amtsgericht": "Amtsgericht Marburg",
      "registernummer": "VR 5340",
      "registerart": "VR",
      "company_name": "Almada Mata Atlantica Project",
      "company_seat": "Marburg",
      "details": "18.06.2025 (Bekanntmachungsdatum)\n\nHessen Amtsgericht Marburg VR 5340\nSonstige Registerbekanntmachung 13.06.2025 (Eintragungsdatum)\n\nAlmada Mata Atlantica Project\neingetragener Verein\nMarburg\n\nDer Verein ist aufgelöst."
    },
    {
      "date": "2025-06-18",
      "id": "112685",
      "original_text": "Sonstige Registerbekanntmachung\nHessen Amtsgericht Wiesbaden HRB 26523\nWiBau GmbH – Wiesbaden",
      "type": "Sonstige Registerbekanntmachung",
      "state": "Hessen",
      "amtsgericht": "Amtsgericht Wiesbaden",
      "registernummer": "HRB 26523",
      "registerart": "HRB",
      "company_name": "WiBau GmbH",
      "company_seat": "Wiesbaden",
      "details": "18.06.2025 (Bekanntmachungsdatum)\n\nHessen Amtsgericht Wiesbaden HRB 26523\nSonstige Registerbekanntmachung 18.06.2025 (Eintragungsdatum)\n\nWiBau GmbH\nGesellschaft mit beschränkter Haftung\nWiesbaden\n\nDurch eine Änderung in den Personen der Aufsichtsratsmitglieder ist eine Liste der Mitglieder des Aufsichtsrates zum Handelsregister eingereicht worden."
    }
  ]
}