{
  "date": "2025-06-11",
  "date_of_scrape": "2025-06-13T08:44:05.682Z",
  "tool_version": "0.2.0",
  "number_of_announcements": 149,
  "announcements": [
    {
      "date": "2025-06-11",
      "id": "111740",
      "original_text": "Registerbekanntmachung nach dem Umwandlungsgesetz\nBayern Amtsgericht München HRB 183124\nEKART Holding Germany GmbH – München",
      "type": "Registerbekanntmachung nach dem Umwandlungsgesetz",
      "state": "Bayern",
      "amtsgericht": "Amtsgericht München",
      "registernummer": "HRB 183124",
      "registerart": "HRB",
      "company_name": "EKART Holding Germany GmbH",
      "company_seat": "München",
      "details": "11.06.2025 (Bekanntmachungsdatum)\n\nBayern Amtsgericht München HRB 183124\nRegisterbekanntmachung nach dem Umwandlungsgesetz 10.06.2025 (Eintragungsdatum)\n\nEKART Holding Germany GmbH\nGesellschaft mit beschränkter Haftung\nMünchen\n\nDen Gläubigern der an der Verschmelzung beteiligten Rechtsträger ist, wenn sie binnen sechs Monaten nach dem Tag, an dem die Eintragung der Verschmelzung in das Register des Sitzes desjenigen Rechtsträgers, dessen Gläubiger sie sind, nach § 19 Abs. 3 UmwG als bekannt gemacht gilt, ihren Anspruch nach Grund und Höhe in Textform anmelden, Sicherheit zu leisten, soweit sie nicht Befriedigung verlangen können. Dieses Recht steht den Gläubigern jedoch nur zu, wenn sie glaubhaft machen, dass durch die Verschmelzung die Erfüllung ihrer Forderung gefährdet wird."
    },
    {
      "date": "2025-06-11",
      "id": "111741",
      "original_text": "Löschungsankündigung\nBayern Amtsgericht München HRB 279370\nINTRACON GmbH – München",
      "type": "Löschungsankündigung",
      "state": "Bayern",
      "amtsgericht": "Amtsgericht München",
      "registernummer": "HRB 279370",
      "registerart": "HRB",
      "company_name": "INTRACON GmbH",
      "company_seat": "München",
      "details": "11.06.2025 (Bekanntmachungsdatum)\n\nBayern Amtsgericht München HRB 279370\nLöschungsankündigung\n\nINTRACON GmbH\nGesellschaft mit beschränkter Haftung\nMünchen\n\nDas Registergericht beabsichtigt, die im Handelsregister eingetragene Gesellschaft wegen Vermögenslosigkeit von Amts wegen nach § 394 FamFG zu löschen. Die Frist zur Erhebung eines Widerspruchs ist auf drei Monate festgesetzt."
    },
    {
      "date": "2025-06-11",
      "id": "111742",
      "original_text": "Einreichung neuer Dokumente\nBayern Amtsgericht Augsburg HRB 6164\nLechwerke AG – Augsburg",
      "type": "Einreichung neuer Dokumente",
      "state": "Bayern",
      "amtsgericht": "Amtsgericht Augsburg",
      "registernummer": "HRB 6164",
      "registerart": "HRB",
      "company_name": "Lechwerke AG",
      "company_seat": "Augsburg",
      "details": "11.06.2025 (Bekanntmachungsdatum)\n\nBayern Amtsgericht Augsburg HRB 6164\nEinreichung neuer Dokumente 10.06.2025 (Eintragungsdatum)\n\nLechwerke AG\nAktiengesellschaft\nAugsburg\n\nDem Amtsgericht Augsburg -Registergericht- ist eine Liste der Mitglieder des Aufsichtsrats eingereicht worden, § 106 AktG."
    },
    {
      "date": "2025-06-11",
      "id": "111743",
      "original_text": "Löschungsankündigung\nBayern Amtsgericht München HRB 131785\nEuro Biogen Pharma AG – München",
      "type": "Löschungsankündigung",
      "state": "Bayern",
      "amtsgericht": "Amtsgericht München",
      "registernummer": "HRB 131785",
      "registerart": "HRB",
      "company_name": "Euro Biogen Pharma AG",
      "company_seat": "München",
      "details": "11.06.2025 (Bekanntmachungsdatum)\n\nBayern Amtsgericht München HRB 131785\nLöschungsankündigung 10.06.2025 (Eintragungsdatum)\n\nEuro Biogen Pharma AG\nAktiengesellschaft\nMünchen\n\nDas Registergericht beabsichtigt, die im Handelsregister eingetragene Gesellschaft wegen Vermögenslosigkeit von Amts wegen nach § 394 FamFG zu löschen. Die Frist zur Erhebung eines Widerspruchs ist auf drei Monate festgesetzt."
    },
    {
      "date": "2025-06-11",
      "id": "111744",
      "original_text": "Einreichung neuer Dokumente\nBayern Amtsgericht München HRB 42872\nState Street Bank International GmbH – München",
      "type": "Einreichung neuer Dokumente",
      "state": "Bayern",
      "amtsgericht": "Amtsgericht München",
      "registernummer": "HRB 42872",
      "registerart": "HRB",
      "company_name": "State Street Bank International GmbH",
      "company_seat": "München",
      "details": "11.06.2025 (Bekanntmachungsdatum)\n\nBayern Amtsgericht München HRB 42872\nEinreichung neuer Dokumente\n\nState Street Bank International GmbH\nGesellschaft mit beschränkter Haftung\nMünchen\n\nDem Amtsgericht München -Registergericht- ist eine Liste der Mitglieder des Aufsichtsrats eingereicht worden, § 52 Abs. 3 S. 2 GmbHG."
    },
    {
      "date": "2025-06-11",
      "id": "111745",
      "original_text": "Löschungsankündigung\nBayern Amtsgericht Traunstein HRB 30751\nThorservice GmbH – Laufen",
      "type": "Löschungsankündigung",
      "state": "Bayern",
      "amtsgericht": "Amtsgericht Traunstein",
      "registernummer": "HRB 30751",
      "registerart": "HRB",
      "company_name": "Thorservice GmbH",
      "company_seat": "Laufen",
      "details": "11.06.2025 (Bekanntmachungsdatum)\n\nBayern Amtsgericht Traunstein HRB 30751\nLöschungsankündigung\n\nThorservice GmbH\nGesellschaft mit beschränkter Haftung\nLaufen\n\nDas Registergericht beabsichtigt, die im Handelsregister eingetragene Gesellschaft wegen Vermögenslosigkeit von Amts wegen nach § 394 FamFG zu löschen. Die Frist zur Erhebung eines Widerspruchs ist auf einen Monat festgesetzt."
    },
    {
      "date": "2025-06-11",
      "id": "111746",
      "original_text": "Registerbekanntmachung nach dem Umwandlungsgesetz\nBayern Amtsgericht Regensburg HRA 11126\nTS Metallbau e.K. – Neustadt a.d.Donau",
      "type": "Registerbekanntmachung nach dem Umwandlungsgesetz",
      "state": "Bayern",
      "amtsgericht": "Amtsgericht Regensburg",
      "registernummer": "HRA 11126",
      "registerart": "HRA",
      "company_name": "TS Metallbau e.K.",
      "company_seat": "Neustadt a.d.Donau",
      "details": "11.06.2025 (Bekanntmachungsdatum)\n\nBayern Amtsgericht Regensburg HRA 11126\nRegisterbekanntmachung nach dem Umwandlungsgesetz 10.06.2025 (Eintragungsdatum)\n\nTS Metallbau e.K.\nEinzelkaufmann / Einzelkauffrau\nNeustadt a.d.Donau\n\nDen Gläubigern der an der Ausgliederung beteiligten Rechtsträger ist, wenn sie binnen sechs Monaten nach dem Tag, an dem die Eintragung der Ausgliederung in das Register des Sitzes desjenigen Rechtsträgers, dessen Gläubiger sie sind, nach §§ 125, 19 Abs. 3 UmwG als bekannt gemacht gilt, ihren Anspruch nach Grund und Höhe in Textform anmelden, Sicherheit zu leisten, soweit sie nicht Befriedigung verlangen können. Dieses Recht steht den Gläubigern jedoch nur zu, wenn sie glaubhaft machen, dass durch die Ausgliederung die Erfüllung ihrer Forderung gefährdet wird."
    },
    {
      "date": "2025-06-11",
      "id": "111747",
      "original_text": "Löschungsankündigung\nBayern Amtsgericht Nürnberg HRB 21948\nLEXUS-HOUSE-DEUTSCHLAND GmbH – Winkelhaid",
      "type": "Löschungsankündigung",
      "state": "Bayern",
      "amtsgericht": "Amtsgericht Nürnberg",
      "registernummer": "HRB 21948",
      "registerart": "HRB",
      "company_name": "LEXUS-HOUSE-DEUTSCHLAND GmbH",
      "company_seat": "Winkelhaid",
      "details": "11.06.2025 (Bekanntmachungsdatum)\n\nBayern Amtsgericht Nürnberg HRB 21948\nLöschungsankündigung\n\nLEXUS-HOUSE-DEUTSCHLAND GmbH\nGesellschaft mit beschränkter Haftung\nWinkelhaid\n\nDas Registergericht beabsichtigt, die im Handelsregister eingetragene Gesellschaft wegen Vermögenslosigkeit von Amts wegen nach § 394 FamFG zu löschen. Die Frist zur Erhebung eines Widerspruchs ist auf einen Monat festgesetzt."
    },
    {
      "date": "2025-06-11",
      "id": "111748",
      "original_text": "Registerbekanntmachung nach dem Umwandlungsgesetz\nBayern Amtsgericht Hof HRB 6057\nAquanique GmbH – Hof",
      "type": "Registerbekanntmachung nach dem Umwandlungsgesetz",
      "state": "Bayern",
      "amtsgericht": "Amtsgericht Hof",
      "registernummer": "HRB 6057",
      "registerart": "HRB",
      "company_name": "Aquanique GmbH",
      "company_seat": "Hof",
      "details": "11.06.2025 (Bekanntmachungsdatum)\n\nBayern Amtsgericht Hof HRB 6057\nRegisterbekanntmachung nach dem Umwandlungsgesetz 10.06.2025 (Eintragungsdatum)\n\nAquanique GmbH\nGesellschaft mit beschränkter Haftung\nHof\n\nDen Gläubigern der an der Verschmelzung beteiligten Rechtsträger ist, wenn sie binnen sechs Monaten nach dem Tag, an dem die Eintragung der Verschmelzung in das Register des Sitzes desjenigen Rechtsträgers, dessen Gläubiger sie sind, nach § 19 Abs. 3 UmwG als bekannt gemacht gilt, ihren Anspruch nach Grund und Höhe in Textform anmelden, Sicherheit zu leisten, soweit sie nicht Befriedigung verlangen können. Dieses Recht steht den Gläubigern jedoch nur zu, wenn sie glaubhaft machen, dass durch die Verschmelzung die Erfüllung ihrer Forderung gefährdet wird."
    },
    {
      "date": "2025-06-11",
      "id": "111749",
      "original_text": "Registerbekanntmachung nach dem Umwandlungsgesetz\nBayern Amtsgericht München HRB 123355\nCloud SG Germany GmbH – München",
      "type": "Registerbekanntmachung nach dem Umwandlungsgesetz",
      "state": "Bayern",
      "amtsgericht": "Amtsgericht München",
      "registernummer": "HRB 123355",
      "registerart": "HRB",
      "company_name": "Cloud SG Germany GmbH",
      "company_seat": "München",
      "details": "11.06.2025 (Bekanntmachungsdatum)\n\nBayern Amtsgericht München HRB 123355\nRegisterbekanntmachung nach dem Umwandlungsgesetz 10.06.2025 (Eintragungsdatum)\n\nCloud SG Germany GmbH\nGesellschaft mit beschränkter Haftung\nMünchen\n\nDen Gläubigern der an der Verschmelzung beteiligten Rechtsträger ist, wenn sie binnen sechs Monaten nach dem Tag, an dem die Eintragung der Verschmelzung in das Register des Sitzes desjenigen Rechtsträgers, dessen Gläubiger sie sind, nach § 19 Abs. 3 UmwG als bekannt gemacht gilt, ihren Anspruch nach Grund und Höhe in Textform anmelden, Sicherheit zu leisten, soweit sie nicht Befriedigung verlangen können. Dieses Recht steht den Gläubigern jedoch nur zu, wenn sie glaubhaft machen, dass durch die Verschmelzung die Erfüllung ihrer Forderung gefährdet wird."
    },
    {
      "date": "2025-06-11",
      "id": "111750",
      "original_text": "Registerbekanntmachung nach dem Umwandlungsgesetz\nBayern Amtsgericht München HRB 291284\nAIRE München Hohenlindener 1 Beteiligungs GmbH – München",
      "type": "Registerbekanntmachung nach dem Umwandlungsgesetz",
      "state": "Bayern",
      "amtsgericht": "Amtsgericht München",
      "registernummer": "HRB 291284",
      "registerart": "HRB",
      "company_name": "AIRE München Hohenlindener 1 Beteiligungs GmbH",
      "company_seat": "München",
      "details": "11.06.2025 (Bekanntmachungsdatum)\n\nBayern Amtsgericht München HRB 291284\nRegisterbekanntmachung nach dem Umwandlungsgesetz 10.06.2025 (Eintragungsdatum)\n\nAIRE München Hohenlindener 1 Beteiligungs GmbH\nGesellschaft mit beschränkter Haftung\nMünchen\n\nDen Gläubigern der an der Verschmelzung beteiligten Rechtsträger ist, wenn sie binnen sechs Monaten nach dem Tag, an dem die Eintragung der Verschmelzung in das Register des Sitzes desjenigen Rechtsträgers, dessen Gläubiger sie sind, nach § 19 Abs. 3 UmwG als bekannt gemacht gilt, ihren Anspruch nach Grund und Höhe in Textform anmelden, Sicherheit zu leisten, soweit sie nicht Befriedigung verlangen können. Dieses Recht steht den Gläubigern jedoch nur zu, wenn sie glaubhaft machen, dass durch die Verschmelzung die Erfüllung ihrer Forderung gefährdet wird."
    },
    {
      "date": "2025-06-11",
      "id": "111751",
      "original_text": "Registerbekanntmachung nach dem Umwandlungsgesetz\nBayern Amtsgericht Nürnberg HRB 27202\nInline Services GmbH – Nürnberg",
      "type": "Registerbekanntmachung nach dem Umwandlungsgesetz",
      "state": "Bayern",
      "amtsgericht": "Amtsgericht Nürnberg",
      "registernummer": "HRB 27202",
      "registerart": "HRB",
      "company_name": "Inline Services GmbH",
      "company_seat": "Nürnberg",
      "details": "11.06.2025 (Bekanntmachungsdatum)\n\nBayern Amtsgericht Nürnberg HRB 27202\nRegisterbekanntmachung nach dem Umwandlungsgesetz 10.06.2025 (Eintragungsdatum)\n\nInline Services GmbH\nGesellschaft mit beschränkter Haftung\nNürnberg\n\nDen Gläubigern der an der Verschmelzung beteiligten Rechtsträger ist, wenn sie binnen sechs Monaten nach dem Tag, an dem die Eintragung der Verschmelzung in das Register des Sitzes desjenigen Rechtsträgers, dessen Gläubiger sie sind, nach § 19 Abs. 3 UmwG als bekannt gemacht gilt, ihren Anspruch nach Grund und Höhe in Textform anmelden, Sicherheit zu leisten, soweit sie nicht Befriedigung verlangen können. Dieses Recht steht den Gläubigern jedoch nur zu, wenn sie glaubhaft machen, dass durch die Verschmelzung die Erfüllung ihrer Forderung gefährdet wird."
    },
    {
      "date": "2025-06-11",
      "id": "111752",
      "original_text": "Löschungsankündigung\nBayern Amtsgericht München HRB 195689\nJafari Taxi GmbH – München",
      "type": "Löschungsankündigung",
      "state": "Bayern",
      "amtsgericht": "Amtsgericht München",
      "registernummer": "HRB 195689",
      "registerart": "HRB",
      "company_name": "Jafari Taxi GmbH",
      "company_seat": "München",
      "details": "11.06.2025 (Bekanntmachungsdatum)\n\nBayern Amtsgericht München HRB 195689\nLöschungsankündigung\n\nJafari Taxi GmbH\nGesellschaft mit beschränkter Haftung\nMünchen\n\nDas Registergericht beabsichtigt, die im Handelsregister eingetragene Gesellschaft wegen Vermögenslosigkeit von Amts wegen nach § 394 FamFG zu löschen. Die Frist zur Erhebung eines Widerspruchs ist auf drei Monate festgesetzt."
    },
    {
      "date": "2025-06-11",
      "id": "111753",
      "original_text": "Löschungsankündigung\nBayern Amtsgericht Schweinfurt HRB 7207\nDHG Dachdeckermeisterbetrieb GmbH – Mellrichstadt",
      "type": "Löschungsankündigung",
      "state": "Bayern",
      "amtsgericht": "Amtsgericht Schweinfurt",
      "registernummer": "HRB 7207",
      "registerart": "HRB",
      "company_name": "DHG Dachdeckermeisterbetrieb GmbH",
      "company_seat": "Mellrichstadt",
      "details": "11.06.2025 (Bekanntmachungsdatum)\n\nBayern Amtsgericht Schweinfurt HRB 7207\nLöschungsankündigung\n\nDHG Dachdeckermeisterbetrieb GmbH\nGesellschaft mit beschränkter Haftung\nMellrichstadt\n\nDas Registergericht beabsichtigt, die im Handelsregister eingetragene Gesellschaft wegen Vermögenslosigkeit von Amts wegen nach § 394 FamFG zu löschen. Die Frist zur Erhebung eines Widerspruchs ist auf einen Monat festgesetzt."
    },
    {
      "date": "2025-06-11",
      "id": "111754",
      "original_text": "Löschungsankündigung\nBayern Amtsgericht Traunstein HRB 24464\nDieselpartikelfilterreinigung DPFClean24 GmbH – Halsbach",
      "type": "Löschungsankündigung",
      "state": "Bayern",
      "amtsgericht": "Amtsgericht Traunstein",
      "registernummer": "HRB 24464",
      "registerart": "HRB",
      "company_name": "Dieselpartikelfilterreinigung DPFClean24 GmbH",
      "company_seat": "Halsbach",
      "details": "11.06.2025 (Bekanntmachungsdatum)\n\nBayern Amtsgericht Traunstein HRB 24464\nLöschungsankündigung\n\nDieselpartikelfilterreinigung DPFClean24 GmbH\nGesellschaft mit beschränkter Haftung\nHalsbach\n\nDas Registergericht beabsichtigt, die im Handelsregister eingetragene Gesellschaft wegen Vermögenslosigkeit von Amts wegen nach § 394 FamFG zu löschen. Die Frist zur Erhebung eines Widerspruchs ist auf einen Monat festgesetzt."
    },
    {
      "date": "2025-06-11",
      "id": "111755",
      "original_text": "Löschungsankündigung\nBayern Amtsgericht München HRB 226903\nLokato GmbH – München",
      "type": "Löschungsankündigung",
      "state": "Bayern",
      "amtsgericht": "Amtsgericht München",
      "registernummer": "HRB 226903",
      "registerart": "HRB",
      "company_name": "Lokato GmbH",
      "company_seat": "München",
      "details": "11.06.2025 (Bekanntmachungsdatum)\n\nBayern Amtsgericht München HRB 226903\nLöschungsankündigung 10.06.2025 (Eintragungsdatum)\n\nLokato GmbH\nGesellschaft mit beschränkter Haftung\nMünchen\n\nDas Registergericht beabsichtigt, die im Handelsregister eingetragene Gesellschaft wegen Vermögenslosigkeit von Amts wegen nach § 394 FamFG zu löschen. Die Frist zur Erhebung eines Widerspruchs ist auf drei Monate festgesetzt."
    },
    {
      "date": "2025-06-11",
      "id": "111756",
      "original_text": "Löschungsankündigung\nBayern Amtsgericht München HRB 241469\neurotax Buchhaltungsservice UG (haftungsbeschränkt) – Unterhaching",
      "type": "Löschungsankündigung",
      "state": "Bayern",
      "amtsgericht": "Amtsgericht München",
      "registernummer": "HRB 241469",
      "registerart": "HRB",
      "company_name": "eurotax Buchhaltungsservice UG (haftungsbeschränkt)",
      "company_seat": "Unterhaching",
      "details": "11.06.2025 (Bekanntmachungsdatum)\n\nBayern Amtsgericht München HRB 241469\nLöschungsankündigung\n\neurotax Buchhaltungsservice UG (haftungsbeschränkt)\nGesellschaft mit beschränkter Haftung\nUnterhaching\n\nDas Registergericht beabsichtigt, die im Handelsregister eingetragene Gesellschaft wegen Vermögenslosigkeit von Amts wegen nach § 394 FamFG zu löschen. Die Frist zur Erhebung eines Widerspruchs ist auf drei Monate festgesetzt."
    },
    {
      "date": "2025-06-11",
      "id": "111757",
      "original_text": "Registerbekanntmachung nach dem Umwandlungsgesetz\nBayern Amtsgericht München HRB 144921\nBISTALLO Beteiligungs GmbH – Pullach i. Isartal",
      "type": "Registerbekanntmachung nach dem Umwandlungsgesetz",
      "state": "Bayern",
      "amtsgericht": "Amtsgericht München",
      "registernummer": "HRB 144921",
      "registerart": "HRB",
      "company_name": "BISTALLO Beteiligungs GmbH",
      "company_seat": "Pullach i. Isartal",
      "details": "11.06.2025 (Bekanntmachungsdatum)\n\nBayern Amtsgericht München HRB 144921\nRegisterbekanntmachung nach dem Umwandlungsgesetz 10.06.2025 (Eintragungsdatum)\n\nBISTALLO Beteiligungs GmbH\nGesellschaft mit beschränkter Haftung\nPullach i. Isartal\n\nDen Gläubigern der an der Verschmelzung beteiligten Rechtsträger ist, wenn sie binnen sechs Monaten nach dem Tag, an dem die Eintragung der Verschmelzung in das Register des Sitzes desjenigen Rechtsträgers, dessen Gläubiger sie sind, nach § 19 Abs. 3 UmwG als bekannt gemacht gilt, ihren Anspruch nach Grund und Höhe in Textform anmelden, Sicherheit zu leisten, soweit sie nicht Befriedigung verlangen können. Dieses Recht steht den Gläubigern jedoch nur zu, wenn sie glaubhaft machen, dass durch die Verschmelzung die Erfüllung ihrer Forderung gefährdet wird."
    },
    {
      "date": "2025-06-11",
      "id": "111758",
      "original_text": "Registerbekanntmachung nach dem Umwandlungsgesetz\nBayern Amtsgericht München HRB 276360\nFT Innovation GmbH – München",
      "type": "Registerbekanntmachung nach dem Umwandlungsgesetz",
      "state": "Bayern",
      "amtsgericht": "Amtsgericht München",
      "registernummer": "HRB 276360",
      "registerart": "HRB",
      "company_name": "FT Innovation GmbH",
      "company_seat": "München",
      "details": "11.06.2025 (Bekanntmachungsdatum)\n\nBayern Amtsgericht München HRB 276360\nRegisterbekanntmachung nach dem Umwandlungsgesetz 10.06.2025 (Eintragungsdatum)\n\nFT Innovation GmbH\nGesellschaft mit beschränkter Haftung\nMünchen\n\nDen Gläubigern der an der Verschmelzung beteiligten Rechtsträger ist, wenn sie binnen sechs Monaten nach dem Tag, an dem die Eintragung der Verschmelzung in das Register des Sitzes desjenigen Rechtsträgers, dessen Gläubiger sie sind, nach § 19 Abs. 3 UmwG als bekannt gemacht gilt, ihren Anspruch nach Grund und Höhe in Textform anmelden, Sicherheit zu leisten, soweit sie nicht Befriedigung verlangen können. Dieses Recht steht den Gläubigern jedoch nur zu, wenn sie glaubhaft machen, dass durch die Verschmelzung die Erfüllung ihrer Forderung gefährdet wird."
    },
    {
      "date": "2025-06-11",
      "id": "111759",
      "original_text": "Löschungsankündigung\nBayern Amtsgericht München HRB 225818\nKATONA METAL GmbH – München",
      "type": "Löschungsankündigung",
      "state": "Bayern",
      "amtsgericht": "Amtsgericht München",
      "registernummer": "HRB 225818",
      "registerart": "HRB",
      "company_name": "KATONA METAL GmbH",
      "company_seat": "München",
      "details": "11.06.2025 (Bekanntmachungsdatum)\n\nBayern Amtsgericht München HRB 225818\nLöschungsankündigung 10.06.2025 (Eintragungsdatum)\n\nKATONA METAL GmbH\nGesellschaft mit beschränkter Haftung\nMünchen\n\nDas Registergericht beabsichtigt, die im Handelsregister eingetragene Gesellschaft wegen Vermögenslosigkeit von Amts wegen nach § 394 FamFG zu löschen. Die Frist zur Erhebung eines Widerspruchs ist auf drei Monate festgesetzt."
    },
    {
      "date": "2025-06-11",
      "id": "111760",
      "original_text": "Löschungsankündigung\nBayern Amtsgericht Amberg HRB 5840\nEpipur Consulting GmbH – Teublitz",
      "type": "Löschungsankündigung",
      "state": "Bayern",
      "amtsgericht": "Amtsgericht Amberg",
      "registernummer": "HRB 5840",
      "registerart": "HRB",
      "company_name": "Epipur Consulting GmbH",
      "company_seat": "Teublitz",
      "details": "11.06.2025 (Bekanntmachungsdatum)\n\nBayern Amtsgericht Amberg HRB 5840\nLöschungsankündigung\n\nEpipur Consulting GmbH\nGesellschaft mit beschränkter Haftung\nTeublitz\n\nDas Registergericht beabsichtigt, die im Handelsregister eingetragene Gesellschaft wegen Vermögenslosigkeit von Amts wegen nach § 394 FamFG zu löschen. Die Frist zur Erhebung eines Widerspruchs ist auf einen Monat festgesetzt."
    },
    {
      "date": "2025-06-11",
      "id": "111761",
      "original_text": "Registerbekanntmachung nach dem Umwandlungsgesetz\nBayern Amtsgericht München HRB 116548\nSeeGrund TEG GmbH – Tegernsee",
      "type": "Registerbekanntmachung nach dem Umwandlungsgesetz",
      "state": "Bayern",
      "amtsgericht": "Amtsgericht München",
      "registernummer": "HRB 116548",
      "registerart": "HRB",
      "company_name": "SeeGrund TEG GmbH",
      "company_seat": "Tegernsee",
      "details": "11.06.2025 (Bekanntmachungsdatum)\n\nBayern Amtsgericht München HRB 116548\nRegisterbekanntmachung nach dem Umwandlungsgesetz 10.06.2025 (Eintragungsdatum)\n\nSeeGrund TEG GmbH\nGesellschaft mit beschränkter Haftung\nTegernsee\n\nDen Gläubigern der an der Verschmelzung beteiligten Rechtsträger ist, wenn sie binnen sechs Monaten nach dem Tag, an dem die Eintragung der Verschmelzung in das Register des Sitzes desjenigen Rechtsträgers, dessen Gläubiger sie sind, nach § 19 Abs. 3 UmwG als bekannt gemacht gilt, ihren Anspruch nach Grund und Höhe in Textform anmelden, Sicherheit zu leisten, soweit sie nicht Befriedigung verlangen können. Dieses Recht steht den Gläubigern jedoch nur zu, wenn sie glaubhaft machen, dass durch die Verschmelzung die Erfüllung ihrer Forderung gefährdet wird."
    },
    {
      "date": "2025-06-11",
      "id": "111762",
      "original_text": "Registerbekanntmachung nach dem Umwandlungsgesetz\nBayern Amtsgericht Nürnberg HRB 20656\nPortformance GmbH – Neumarkt",
      "type": "Registerbekanntmachung nach dem Umwandlungsgesetz",
      "state": "Bayern",
      "amtsgericht": "Amtsgericht Nürnberg",
      "registernummer": "HRB 20656",
      "registerart": "HRB",
      "company_name": "Portformance GmbH",
      "company_seat": "Neumarkt",
      "details": "11.06.2025 (Bekanntmachungsdatum)\n\nBayern Amtsgericht Nürnberg HRB 20656\nRegisterbekanntmachung nach dem Umwandlungsgesetz 10.06.2025 (Eintragungsdatum)\n\nPortformance GmbH\nGesellschaft mit beschränkter Haftung\nNeumarkt\n\nDen Gläubigern der an der Verschmelzung beteiligten Rechtsträger ist, wenn sie binnen sechs Monaten nach dem Tag, an dem die Eintragung der Verschmelzung in das Register des Sitzes desjenigen Rechtsträgers, dessen Gläubiger sie sind, nach § 19 Abs. 3 UmwG als bekannt gemacht gilt, ihren Anspruch nach Grund und Höhe in Textform anmelden, Sicherheit zu leisten, soweit sie nicht Befriedigung verlangen können. Dieses Recht steht den Gläubigern jedoch nur zu, wenn sie glaubhaft machen, dass durch die Verschmelzung die Erfüllung ihrer Forderung gefährdet wird."
    },
    {
      "date": "2025-06-11",
      "id": "111763",
      "original_text": "Löschungsankündigung\nBayern Amtsgericht Passau HRB 3713\nb.a.v.a.r.i.a.n - m.a.d.e gmbh – Röhrnbach",
      "type": "Löschungsankündigung",
      "state": "Bayern",
      "amtsgericht": "Amtsgericht Passau",
      "registernummer": "HRB 3713",
      "registerart": "HRB",
      "company_name": "b.a.v.a.r.i.a.n - m.a.d.e gmbh",
      "company_seat": "Röhrnbach",
      "details": "11.06.2025 (Bekanntmachungsdatum)\n\nBayern Amtsgericht Passau HRB 3713\nLöschungsankündigung\n\nb.a.v.a.r.i.a.n - m.a.d.e gmbh\nGesellschaft mit beschränkter Haftung\nRöhrnbach\n\nDas Registergericht beabsichtigt, die im Handelsregister eingetragene Gesellschaft wegen Vermögenslosigkeit von Amts wegen nach § 394 FamFG zu löschen. Die Frist zur Erhebung eines Widerspruchs ist auf einen Monat festgesetzt."
    },
    {
      "date": "2025-06-11",
      "id": "111764",
      "original_text": "Einreichung neuer Dokumente\nBayern Amtsgericht München HRB 301575\nFUTRUE 7 SE – München",
      "type": "Einreichung neuer Dokumente",
      "state": "Bayern",
      "amtsgericht": "Amtsgericht München",
      "registernummer": "HRB 301575",
      "registerart": "HRB",
      "company_name": "FUTRUE 7 SE",
      "company_seat": "München",
      "details": "11.06.2025 (Bekanntmachungsdatum)\n\nBayern Amtsgericht München HRB 301575\nEinreichung neuer Dokumente 10.06.2025 (Eintragungsdatum)\n\nFUTRUE 7 SE\nEuropäische Aktiengesellschaft (SE)\nMünchen\n\nDem Amtsgericht München -Registergericht- ist eine Liste der Mitglieder des Aufsichtsrats eingereicht worden, Art. 9 Abs. 1 Buchst. c (ii) SE-VO i.V.m. § 106 AktG."
    },
    {
      "date": "2025-06-11",
      "id": "111765",
      "original_text": "Registerbekanntmachung nach dem Umwandlungsgesetz\nBayern Amtsgericht München HRB 262997\nElbe BidCo AG – München",
      "type": "Registerbekanntmachung nach dem Umwandlungsgesetz",
      "state": "Bayern",
      "amtsgericht": "Amtsgericht München",
      "registernummer": "HRB 262997",
      "registerart": "HRB",
      "company_name": "Elbe BidCo AG",
      "company_seat": "München",
      "details": "11.06.2025 (Bekanntmachungsdatum)\n\nBayern Amtsgericht München HRB 262997\nRegisterbekanntmachung nach dem Umwandlungsgesetz 10.06.2025 (Eintragungsdatum)\n\nElbe BidCo AG\nAktiengesellschaft\nMünchen\n\nDem Amtsgericht München -Registergericht- ist ein Verschmelzungsvertrag zwischen der Gesellschaft als übernehmendem Rechtsträger und der ENCAVIS AG, Hamburg (Amtsgericht Hamburg HRB 63197) zur Einsichtnahme eingereicht worden."
    },
    {
      "date": "2025-06-11",
      "id": "111766",
      "original_text": "Einreichung neuer Dokumente\nBayern Amtsgericht München HRB 210311\nKBee AG – München",
      "type": "Einreichung neuer Dokumente",
      "state": "Bayern",
      "amtsgericht": "Amtsgericht München",
      "registernummer": "HRB 210311",
      "registerart": "HRB",
      "company_name": "KBee AG",
      "company_seat": "München",
      "details": "11.06.2025 (Bekanntmachungsdatum)\n\nBayern Amtsgericht München HRB 210311\nEinreichung neuer Dokumente\n\nKBee AG\nAktiengesellschaft\nMünchen\n\nDem Amtsgericht München -Registergericht- ist eine Liste der Mitglieder des Aufsichtsrats eingereicht worden, § 106 AktG."
    },
    {
      "date": "2025-06-11",
      "id": "111767",
      "original_text": "Registerbekanntmachung nach dem Umwandlungsgesetz\nBaden-Württemberg Amtsgericht Mannheim HRB 750172\nEpta Kältetechnik GmbH – Mannheim",
      "type": "Registerbekanntmachung nach dem Umwandlungsgesetz",
      "state": "Baden-Württemberg",
      "amtsgericht": "Amtsgericht Mannheim",
      "registernummer": "HRB 750172",
      "registerart": "HRB",
      "company_name": "Epta Kältetechnik GmbH",
      "company_seat": "Mannheim",
      "details": "11.06.2025 (Bekanntmachungsdatum)\n\nBaden-Württemberg Amtsgericht Mannheim HRB 750172\nRegisterbekanntmachung nach dem Umwandlungsgesetz 11.06.2025 (Eintragungsdatum)\n\nEpta Kältetechnik GmbH\nGesellschaft mit beschränkter Haftung\nMannheim\n\nAls nicht eingetragen wird bekanntgemacht:\nDen Gläubigern der an der Verschmelzung beteiligten Rechtsträger ist, wenn sie binnen sechs Monaten nach dem Tag, an dem die Eintragung der Verschmelzung in das Register des Sitzes desjenigen Rechtsträgers, dessen Gläubiger sie sind, nach § 19 Abs. 3 UmwG als bekanntgemacht gilt, ihren Anspruch nach Grund und Höhe schriftlich anmelden, Sicherheit zu leisten, soweit sie nicht Befriedigung verlangen können. Dieses Recht steht den Gläubigern jedoch nur zu, wenn sie glaubhaft machen, dass durch die Verschmelzung die Erfüllung ihrer Forderung gefährdet wird."
    },
    {
      "date": "2025-06-11",
      "id": "111768",
      "original_text": "Löschungsankündigung\nBrandenburg Amtsgericht Potsdam HRB 33069\nC&M Trading UG (haftungsbeschränkt) – Ludwigsfelde",
      "type": "Löschungsankündigung",
      "state": "Brandenburg",
      "amtsgericht": "Amtsgericht Potsdam",
      "registernummer": "HRB 33069",
      "registerart": "HRB",
      "company_name": "C&M Trading UG (haftungsbeschränkt)",
      "company_seat": "Ludwigsfelde",
      "details": "11.06.2025 (Bekanntmachungsdatum)\n\nBrandenburg Amtsgericht Potsdam HRB 33069\nLöschungsankündigung\n\nC&M Trading UG (haftungsbeschränkt)\nGesellschaft mit beschränkter Haftung\nLudwigsfelde\n\nBei der nachstehenden Gesellschaft wird das Amtslöschungsverfahren gemäß § 394 FamFG eingeleitet. Widerspruchsfrist 8 Wochen."
    },
    {
      "date": "2025-06-11",
      "id": "111769",
      "original_text": "Registerbekanntmachung nach dem Umwandlungsgesetz\nBaden-Württemberg Amtsgericht Stuttgart HRB 778415\nLOP Consulting GmbH – Schwäbisch Hall",
      "type": "Registerbekanntmachung nach dem Umwandlungsgesetz",
      "state": "Baden-Württemberg",
      "amtsgericht": "Amtsgericht Stuttgart",
      "registernummer": "HRB 778415",
      "registerart": "HRB",
      "company_name": "LOP Consulting GmbH",
      "company_seat": "Schwäbisch Hall",
      "details": "11.06.2025 (Bekanntmachungsdatum)\n\nBaden-Württemberg Amtsgericht Stuttgart HRB 778415\nRegisterbekanntmachung nach dem Umwandlungsgesetz 11.06.2025 (Eintragungsdatum)\n\nLOP Consulting GmbH\nGesellschaft mit beschränkter Haftung\nSchwäbisch Hall\n\nAls nicht eingetragen wird bekanntgemacht:\nDen Gläubigern der an der Verschmelzung beteiligten Rechtsträger ist, wenn sie binnen sechs Monaten nach dem Tag, an dem die Eintragung der Verschmelzung in das Register des Sitzes desjenigen Rechtsträgers, dessen Gläubiger sie sind, nach § 19 Abs. 3 UmwG als bekanntgemacht gilt, ihren Anspruch nach Grund und Höhe schriftlich anmelden, Sicherheit zu leisten, soweit sie nicht Befriedigung verlangen können. Dieses Recht steht den Gläubigern jedoch nur zu, wenn sie glaubhaft machen, dass durch die Verschmelzung die Erfüllung ihrer Forderung gefährdet wird."
    },
    {
      "date": "2025-06-11",
      "id": "111770",
      "original_text": "Löschungsankündigung\nBaden-Württemberg Amtsgericht Mannheim HRB 745273\nHomesto UG (haftungsbeschränkt) – Karlsruhe",
      "type": "Löschungsankündigung",
      "state": "Baden-Württemberg",
      "amtsgericht": "Amtsgericht Mannheim",
      "registernummer": "HRB 745273",
      "registerart": "HRB",
      "company_name": "Homesto UG (haftungsbeschränkt)",
      "company_seat": "Karlsruhe",
      "details": "11.06.2025 (Bekanntmachungsdatum)\n\nBaden-Württemberg Amtsgericht Mannheim HRB 745273\nLöschungsankündigung\n\nHomesto UG (haftungsbeschränkt)\nGesellschaft mit beschränkter Haftung\nKarlsruhe\n\nAls nicht eingetragen wird bekanntgemacht:\nDas Gericht beabsichtigt, die am 26.10.2022 vorgenommene Eintragung der Bestellung von Herrn Hannes Maria Seider als Geschäftsführer der Gesellschaft gemäß § 395 FamFG von Amts wegen im Handelsregister wegen des Mangels einer wesentlichen Voraussetzung zu löschen. Die Frist zur Geltendmachung eines Widerspruchs gegen die beabsichtigte Löschung ist auf einen Monat ab Veröffentlichung bestimmt."
    },
    {
      "date": "2025-06-11",
      "id": "111771",
      "original_text": "Löschungsankündigung\nBerlin Amtsgericht Berlin (Charlottenburg) HRB 229740\nE & Y - Logistik GmbH – Berlin",
      "type": "Löschungsankündigung",
      "state": "Berlin",
      "amtsgericht": "Amtsgericht Berlin (Charlottenburg)",
      "registernummer": "HRB 229740",
      "registerart": "HRB",
      "company_name": "E & Y - Logistik GmbH",
      "company_seat": "Berlin",
      "details": "11.06.2025 (Bekanntmachungsdatum)\n\nBerlin Amtsgericht Berlin (Charlottenburg) HRB 229740\nLöschungsankündigung\n\nE & Y - Logistik GmbH\nGesellschaft mit beschränkter Haftung\nBerlin\n\nBei der nachstehenden Gesellschaft wird das Amtslöschungsverfahren gemäß § 394 FamFG eingeleitet. Widerspruchsfrist 6 Wochen"
    },
    {
      "date": "2025-06-11",
      "id": "111772",
      "original_text": "Registerbekanntmachung nach dem Umwandlungsgesetz\nSchleswig-Holstein Amtsgericht Pinneberg HRB 8569\nKaul GmbH – Elmshorn",
      "type": "Registerbekanntmachung nach dem Umwandlungsgesetz",
      "state": "Schleswig-Holstein",
      "amtsgericht": "Amtsgericht Pinneberg",
      "registernummer": "HRB 8569",
      "registerart": "HRB",
      "company_name": "Kaul GmbH",
      "company_seat": "Elmshorn",
      "details": "11.06.2025 (Bekanntmachungsdatum)\n\nSchleswig-Holstein Amtsgericht Pinneberg HRB 8569\nRegisterbekanntmachung nach dem Umwandlungsgesetz 10.06.2025 (Eintragungsdatum)\n\nKaul GmbH\nGesellschaft mit beschränkter Haftung\nElmshorn\n\nZu Eintragungsnummer 8 vom 10.06.2025 wird als nicht eingetragen veröffentlich Als nicht eingetragen wird veröffentlicht: Den Gläubigern der an der Verschmelzung beteiligten Rechtsträger ist, wenn sie binnen sechs Monaten nach dem Tag, an dem die Eintragung der Verschmelzung in das Register des Sitzes desjenigen Rechtsträgers, dessen Gläubiger sie sind, als bekannt gemacht gilt, ihren Anspruch nach Grund und Höhe schriftlich anmelden, Sicherheit zu leisten, soweit sie nicht Befriedigung verlangen können. Dieses Recht steht den Gläubigern jedoch nur zu, wenn sie glaubhaft machen, dass durch die Verschmelzung die Erfüllung ihrer Forderung gefährdet wird. Das Recht, Sicherheitsleistung zu verlangen, steht Gläubigern nicht zu, die im Falle der Insolvenz ein Recht auf vorzugsweise Befriedigung aus einer Deckungsmasse haben, die nach gesetzlicher Vorschrift zu ihrem Schutz errichtet und staatlich überwacht ist."
    },
    {
      "date": "2025-06-11",
      "id": "111773",
      "original_text": "Löschungsankündigung\nBerlin Amtsgericht Berlin (Charlottenburg) HRB 207089\nNedo Bau & Service GmbH – Berlin",
      "type": "Löschungsankündigung",
      "state": "Berlin",
      "amtsgericht": "Amtsgericht Berlin (Charlottenburg)",
      "registernummer": "HRB 207089",
      "registerart": "HRB",
      "company_name": "Nedo Bau & Service GmbH",
      "company_seat": "Berlin",
      "details": "11.06.2025 (Bekanntmachungsdatum)\n\nBerlin Amtsgericht Berlin (Charlottenburg) HRB 207089\nLöschungsankündigung\n\nNedo Bau & Service GmbH\nGesellschaft mit beschränkter Haftung\nBerlin\n\nBei der nachstehenden Gesellschaft wird das Amtslöschungsverfahren gemäß § 394 FamFG eingeleitet. Widerspruchsfrist 6 Wochen"
    },
    {
      "date": "2025-06-11",
      "id": "111774",
      "original_text": "Löschungsankündigung\nBrandenburg Amtsgericht Potsdam HRB 35371\nPreußischer Immobilien Kontor GmbH – Teltow",
      "type": "Löschungsankündigung",
      "state": "Brandenburg",
      "amtsgericht": "Amtsgericht Potsdam",
      "registernummer": "HRB 35371",
      "registerart": "HRB",
      "company_name": "Preußischer Immobilien Kontor GmbH",
      "company_seat": "Teltow",
      "details": "11.06.2025 (Bekanntmachungsdatum)\n\nBrandenburg Amtsgericht Potsdam HRB 35371\nLöschungsankündigung\n\nPreußischer Immobilien Kontor GmbH\nGesellschaft mit beschränkter Haftung\nTeltow\n\nBei der nachstehenden Gesellschaft wird das Amtslöschungsverfahren gemäß § 394 FamFG eingeleitet."
    },
    {
      "date": "2025-06-11",
      "id": "111775",
      "original_text": "Registerbekanntmachung nach dem Umwandlungsgesetz\nHamburg Amtsgericht Hamburg HRB 145765\nKaupe-Bender II GmbH – Hamburg",
      "type": "Registerbekanntmachung nach dem Umwandlungsgesetz",
      "state": "Hamburg",
      "amtsgericht": "Amtsgericht Hamburg",
      "registernummer": "HRB 145765",
      "registerart": "HRB",
      "company_name": "Kaupe-Bender II GmbH",
      "company_seat": "Hamburg",
      "details": "11.06.2025 (Bekanntmachungsdatum)\n\nHamburg Amtsgericht Hamburg HRB 145765\nRegisterbekanntmachung nach dem Umwandlungsgesetz 11.06.2025 (Eintragungsdatum)\n\nKaupe-Bender II GmbH\nGesellschaft mit beschränkter Haftung\nHamburg\n\nAls nicht eingetragen wird bekannt gemacht:\nDen Gläubigern der an der Verschmelzung beteiligten Gesellschaften ist, wenn sie binnen sechs Monaten nach dem Tag, an dem die Eintragung der Verschmelzung in das Register des Sitzes desjenigen Rechtsträgers, dessen Gläubiger sie sind, nach § 19 Absatz 3 UmwG als bekannt gemacht gilt, ihren Anspruch nach Grund und Höhe schriftlich anmelden, Sicherheit zu leisten, soweit sie nicht Befriedigung verlangen können. Dieses Recht steht den Gläubigern jedoch nur zu, wenn sie glaubhaft machen, dass durch die Verschmelzung die Erfüllung ihrer Forderung gefährdet wird."
    },
    {
      "date": "2025-06-11",
      "id": "111776",
      "original_text": "Registerbekanntmachung nach dem Umwandlungsgesetz\nHamburg Amtsgericht Hamburg HRB 31890\nKaupe-Bender GmbH – Hamburg",
      "type": "Registerbekanntmachung nach dem Umwandlungsgesetz",
      "state": "Hamburg",
      "amtsgericht": "Amtsgericht Hamburg",
      "registernummer": "HRB 31890",
      "registerart": "HRB",
      "company_name": "Kaupe-Bender GmbH",
      "company_seat": "Hamburg",
      "details": "11.06.2025 (Bekanntmachungsdatum)\n\nHamburg Amtsgericht Hamburg HRB 31890\nRegisterbekanntmachung nach dem Umwandlungsgesetz 11.06.2025 (Eintragungsdatum)\n\nKaupe-Bender GmbH\nGesellschaft mit beschränkter Haftung\nHamburg\n\nAls nicht eingetragen wird bekannt gemacht:\nDen Gläubigern der an der Verschmelzung beteiligten Gesellschaften ist, wenn sie binnen sechs Monaten nach dem Tag, an dem die Eintragung der Verschmelzung in das Register des Sitzes desjenigen Rechtsträgers, dessen Gläubiger sie sind, nach § 19 Absatz 3 UmwG als bekannt gemacht gilt, ihren Anspruch nach Grund und Höhe schriftlich anmelden, Sicherheit zu leisten, soweit sie nicht Befriedigung verlangen können. Dieses Recht steht den Gläubigern jedoch nur zu, wenn sie glaubhaft machen, dass durch die Verschmelzung die Erfüllung ihrer Forderung gefährdet wird."
    },
    {
      "date": "2025-06-11",
      "id": "111777",
      "original_text": "Löschungsankündigung\nMecklenburg-Vorpommern Amtsgericht Rostock HRB 16500\nHMS Kunter UG (haftungsbeschränkt) – Gelbensande",
      "type": "Löschungsankündigung",
      "state": "Mecklenburg-Vorpommern",
      "amtsgericht": "Amtsgericht Rostock",
      "registernummer": "HRB 16500",
      "registerart": "HRB",
      "company_name": "HMS Kunter UG (haftungsbeschränkt)",
      "company_seat": "Gelbensande",
      "details": "11.06.2025 (Bekanntmachungsdatum)\n\nMecklenburg-Vorpommern Amtsgericht Rostock HRB 16500\nLöschungsankündigung\n\nHMS Kunter UG (haftungsbeschränkt)\nGesellschaft mit beschränkter Haftung\nGelbensande\n\nDas Registergericht beabsichtigt, die im Handelsregister eingetragene Gesellschaft von Amts wegen nach § 394 FamFG zu löschen. Die Frist zur Erhebung eines Widerspruchs gegen die beabsichtigte Löschung wird auf 1 Monat festgesetzt."
    },
    {
      "date": "2025-06-11",
      "id": "111778",
      "original_text": "Registerbekanntmachung nach dem Umwandlungsgesetz\nBaden-Württemberg Amtsgericht Stuttgart HRB 213575\nTK Aufzugswerke GmbH – Neuhausen auf den Fildern",
      "type": "Registerbekanntmachung nach dem Umwandlungsgesetz",
      "state": "Baden-Württemberg",
      "amtsgericht": "Amtsgericht Stuttgart",
      "registernummer": "HRB 213575",
      "registerart": "HRB",
      "company_name": "TK Aufzugswerke GmbH",
      "company_seat": "Neuhausen auf den Fildern",
      "details": "11.06.2025 (Bekanntmachungsdatum)\n\nBaden-Württemberg Amtsgericht Stuttgart HRB 213575\nRegisterbekanntmachung nach dem Umwandlungsgesetz 11.06.2025 (Eintragungsdatum)\n\nTK Aufzugswerke GmbH\nGesellschaft mit beschränkter Haftung\nNeuhausen auf den Fildern\n\nDen Gläubigern der an der Verschmelzung beteiligten Rechtsträger ist, wenn sie binnen sechs Monaten nach dem Tag, an dem die Eintragung der Verschmelzung in das Register des Sitzes desjenigen Rechtsträgers, dessen Gläubiger sie sind, nach § 19 Abs. 3 UmwG als bekanntgemacht gilt, ihren Anspruch nach Grund und Höhe schriftlich anmelden, Sicherheit zu leisten, soweit sie nicht Befriedigung verlangen können. Dieses Recht steht den Gläubigern jedoch nur zu, wenn sie glaubhaft machen, dass durch die Verschmelzung die Erfüllung ihrer Forderung gefährdet wird."
    },
    {
      "date": "2025-06-11",
      "id": "111779",
      "original_text": "Registerbekanntmachung nach dem Umwandlungsgesetz\nHamburg Amtsgericht Hamburg HRB 46277\nKH Boddin GmbH – Hamburg",
      "type": "Registerbekanntmachung nach dem Umwandlungsgesetz",
      "state": "Hamburg",
      "amtsgericht": "Amtsgericht Hamburg",
      "registernummer": "HRB 46277",
      "registerart": "HRB",
      "company_name": "KH Boddin GmbH",
      "company_seat": "Hamburg",
      "details": "11.06.2025 (Bekanntmachungsdatum)\n\nHamburg Amtsgericht Hamburg HRB 46277\nRegisterbekanntmachung nach dem Umwandlungsgesetz 11.06.2025 (Eintragungsdatum)\n\nKH Boddin GmbH\nGesellschaft mit beschränkter Haftung\nHamburg\n\nAls nicht eingetragen wird bekannt gemacht:\nDen Gläubigern der an der Verschmelzung beteiligten Gesellschaften ist, wenn sie binnen sechs Monaten nach dem Tag, an dem die Eintragung der Verschmelzung in das Register des Sitzes desjenigen Rechtsträgers, dessen Gläubiger sie sind, nach § 19 Absatz 3 UmwG als bekannt gemacht gilt, ihren Anspruch nach Grund und Höhe schriftlich anmelden, Sicherheit zu leisten, soweit sie nicht Befriedigung verlangen können. Dieses Recht steht den Gläubigern jedoch nur zu, wenn sie glaubhaft machen, dass durch die Verschmelzung die Erfüllung ihrer Forderung gefährdet wird."
    },
    {
      "date": "2025-06-11",
      "id": "111780",
      "original_text": "Registerbekanntmachung nach dem Umwandlungsgesetz\nBaden-Württemberg Amtsgericht Mannheim HRB 754731\nOneUp Sales GmbH – Mannheim",
      "type": "Registerbekanntmachung nach dem Umwandlungsgesetz",
      "state": "Baden-Württemberg",
      "amtsgericht": "Amtsgericht Mannheim",
      "registernummer": "HRB 754731",
      "registerart": "HRB",
      "company_name": "OneUp Sales GmbH",
      "company_seat": "Mannheim",
      "details": "11.06.2025 (Bekanntmachungsdatum)\n\nBaden-Württemberg Amtsgericht Mannheim HRB 754731\nRegisterbekanntmachung nach dem Umwandlungsgesetz 11.06.2025 (Eintragungsdatum)\n\nOneUp Sales GmbH\nGesellschaft mit beschränkter Haftung\nMannheim\n\nDen Gläubigern der an der Ausgliederung beteiligten Rechtsträger ist, wenn sie binnen sechs Monaten nach dem Tag, an dem die Eintragung der Ausgliederung in das Register des Sitzes desjenigen Rechtsträgers, dessen Gläubiger sie sind, nach § 19 Abs. 3 UmwG als bekanntgemacht gilt, ihren Anspruch nach Grund und Höhe schriftlich anmelden, Sicherheit zu leisten, soweit sie nicht Befriedigung verlangen können. Dieses Recht steht den Gläubigern jedoch nur zu, wenn sie glaubhaft machen, dass durch die Ausgliederung die Erfüllung ihrer Forderung gefährdet wird."
    },
    {
      "date": "2025-06-11",
      "id": "111781",
      "original_text": "Einreichung neuer Dokumente\nBaden-Württemberg Amtsgericht Ulm HRB 732253\nWMF GmbH – Geislingen an der Steige",
      "type": "Einreichung neuer Dokumente",
      "state": "Baden-Württemberg",
      "amtsgericht": "Amtsgericht Ulm",
      "registernummer": "HRB 732253",
      "registerart": "HRB",
      "company_name": "WMF GmbH",
      "company_seat": "Geislingen an der Steige",
      "details": "11.06.2025 (Bekanntmachungsdatum)\n\nBaden-Württemberg Amtsgericht Ulm HRB 732253\nEinreichung neuer Dokumente 11.06.2025 (Eintragungsdatum)\n\nWMF GmbH\nGesellschaft mit beschränkter Haftung\nGeislingen an der Steige\n\nDie Gesellschaft hat am 10.06.2025 die Liste über die Zusammensetzung des Aufsichtsrats zum Handelsregister eingereicht."
    },
    {
      "date": "2025-06-11",
      "id": "111782",
      "original_text": "Löschungsankündigung\nSchleswig-Holstein Amtsgericht Kiel PR 12\nPark-Kolleg Jobs & Partner -Freiberufliche Lehrer- – Kiel",
      "type": "Löschungsankündigung",
      "state": "Schleswig-Holstein",
      "amtsgericht": "Amtsgericht Kiel",
      "registernummer": "PR 12",
      "registerart": "PR",
      "company_name": "Park-Kolleg Jobs & Partner -Freiberufliche Lehrer-",
      "company_seat": "Kiel",
      "details": "11.06.2025 (Bekanntmachungsdatum)\n\nSchleswig-Holstein Amtsgericht Kiel PR 12\nLöschungsankündigung\n\nPark-Kolleg Jobs & Partner -Freiberufliche Lehrer-\nPartnerschaftsgesellschaft\nKiel\n\nBei der nachstehenden Firma wird das Amtslöschungsverfahren gemäß § 31 Abs. 2 HGB eingeleitet. Widerspruchsfrist: 3 Monate."
    },
    {
      "date": "2025-06-11",
      "id": "111783",
      "original_text": "Löschungsankündigung\nMecklenburg-Vorpommern Amtsgericht Stralsund HRA 2415\nProra Projektentwicklungs GmbH & Co. Haus Rostock KG – Buschvitz",
      "type": "Löschungsankündigung",
      "state": "Mecklenburg-Vorpommern",
      "amtsgericht": "Amtsgericht Stralsund",
      "registernummer": "HRA 2415",
      "registerart": "HRA",
      "company_name": "Prora Projektentwicklungs GmbH & Co. Haus Rostock KG",
      "company_seat": "Buschvitz",
      "details": "11.06.2025 (Bekanntmachungsdatum)\n\nMecklenburg-Vorpommern Amtsgericht Stralsund HRA 2415\nLöschungsankündigung 11.06.2025 (Eintragungsdatum)\n\nProra Projektentwicklungs GmbH & Co. Haus Rostock KG\nKommanditgesellschaft\nBuschvitz\n\nDas Registergericht beabsichtigt, die im Handelsregister eingetragene Gesellschaft von Amts wegen nach § 394 FamFG zu löschen. Die Frist zur Erhebung eines Widerspruchs gegen die beabsichtigte Löschung wird auf 1 Monat festgesetzt."
    },
    {
      "date": "2025-06-11",
      "id": "111784",
      "original_text": "Einreichung neuer Dokumente\nBaden-Württemberg Amtsgericht Ulm HRB 490647\nSappi Ehingen GmbH – Ehingen Donau",
      "type": "Einreichung neuer Dokumente",
      "state": "Baden-Württemberg",
      "amtsgericht": "Amtsgericht Ulm",
      "registernummer": "HRB 490647",
      "registerart": "HRB",
      "company_name": "Sappi Ehingen GmbH",
      "company_seat": "Ehingen Donau",
      "details": "11.06.2025 (Bekanntmachungsdatum)\n\nBaden-Württemberg Amtsgericht Ulm HRB 490647\nEinreichung neuer Dokumente\n\nSappi Ehingen GmbH\nGesellschaft mit beschränkter Haftung\nEhingen Donau\n\nDie Gesellschaft hat am 05.06.2025 die Liste über die Zusammensetzung des Aufsichtsrats zum Handelsregister eingereicht."
    },
    {
      "date": "2025-06-11",
      "id": "111785",
      "original_text": "Registerbekanntmachung nach dem Umwandlungsgesetz\nSchleswig-Holstein Amtsgericht Kiel HRB 813 NM\nbrückner büro systeme gmbh – Neumünster",
      "type": "Registerbekanntmachung nach dem Umwandlungsgesetz",
      "state": "Schleswig-Holstein",
      "amtsgericht": "Amtsgericht Kiel",
      "registernummer": "HRB 813 NM",
      "registerart": "HRB",
      "company_name": "brückner büro systeme gmbh",
      "company_seat": "Neumünster",
      "details": "11.06.2025 (Bekanntmachungsdatum)\n\nSchleswig-Holstein Amtsgericht Kiel HRB 813 NM\nRegisterbekanntmachung nach dem Umwandlungsgesetz 05.06.2025 (Eintragungsdatum)\n\nbrückner büro systeme gmbh\nGesellschaft mit beschränkter Haftung\nNeumünster\n\nZu Eintragungsnummer 8 vom 05.06.2025 wird als nicht eingetragen veröffentlicht: Den Gläubigern der an der Verschmelzung beteiligten Rechtsträger ist, wenn sie binnen sechs Monaten nach dem Tag, an dem die Eintragung der Verschmelzung in das Register des Sitzes desjenigen Rechtsträgers, dessen Gläubiger sie sind, nach § 19 Abs. 3 UmwG bekannt gemacht worden ist, ihren Anspruch nach Grund und Höhe schriftlich anmelden, Sicherheit zu leisten, soweit sie nicht Befriedigung verlangen können. Dieses Recht steht den Gläubigern jedoch nur zu, wenn sie glaubhaft machen, dass durch die Verschmelzung die Erfüllung ihrer Forderung gefährdet wird."
    },
    {
      "date": "2025-06-11",
      "id": "111786",
      "original_text": "Löschungsankündigung\nBerlin Amtsgericht Berlin (Charlottenburg) HRB 111344\nSztandera Internationale Immobilien GmbH – Berlin",
      "type": "Löschungsankündigung",
      "state": "Berlin",
      "amtsgericht": "Amtsgericht Berlin (Charlottenburg)",
      "registernummer": "HRB 111344",
      "registerart": "HRB",
      "company_name": "Sztandera Internationale Immobilien GmbH",
      "company_seat": "Berlin",
      "details": "11.06.2025 (Bekanntmachungsdatum)\n\nBerlin Amtsgericht Berlin (Charlottenburg) HRB 111344\nLöschungsankündigung\n\nSztandera Internationale Immobilien GmbH\nGesellschaft mit beschränkter Haftung\nBerlin\n\nBei der nachstehenden Gesellschaft wird das Amtslöschungsverfahren gemäß § 394 FamFG eingeleitet. Widerspruchsfrist 6 Wochen"
    },
    {
      "date": "2025-06-11",
      "id": "111787",
      "original_text": "Einreichung neuer Dokumente\nSaarland Amtsgericht Saarbrücken HRB 18320\nGerman Technologies AG – Riegelsberg",
      "type": "Einreichung neuer Dokumente",
      "state": "Saarland",
      "amtsgericht": "Amtsgericht Saarbrücken",
      "registernummer": "HRB 18320",
      "registerart": "HRB",
      "company_name": "German Technologies AG",
      "company_seat": "Riegelsberg",
      "details": "11.06.2025 (Bekanntmachungsdatum)\n\nSaarland Amtsgericht Saarbrücken HRB 18320\nEinreichung neuer Dokumente 11.06.2025 (Eintragungsdatum)\n\nGerman Technologies AG\nAktiengesellschaft\nRiegelsberg\n\nDer Vorstand der Gesellschaft hat eine Liste der Mitglieder des Aufsichtsrats zum Handelsregister eingereicht (§ 106 AktG)."
    },
    {
      "date": "2025-06-11",
      "id": "111788",
      "original_text": "Einreichung neuer Dokumente\nBaden-Württemberg Amtsgericht Freiburg HRB 410432\nBade- und Kurverwaltung Bad Bellingen Gesellschaft mit beschränkter Haftung – Bad Bellingen",
      "type": "Einreichung neuer Dokumente",
      "state": "Baden-Württemberg",
      "amtsgericht": "Amtsgericht Freiburg",
      "registernummer": "HRB 410432",
      "registerart": "HRB",
      "company_name": "Bade- und Kurverwaltung Bad Bellingen Gesellschaft mit beschränkter Haftung",
      "company_seat": "Bad Bellingen",
      "details": "11.06.2025 (Bekanntmachungsdatum)\n\nBaden-Württemberg Amtsgericht Freiburg HRB 410432\nEinreichung neuer Dokumente\n\nBade- und Kurverwaltung Bad Bellingen Gesellschaft mit beschränkter Haftung\nGesellschaft mit beschränkter Haftung\nBad Bellingen\n\nDie Gesellschaft hat am 07.05.2025 die Liste über die Zusammensetzung des Aufsichtsrats zum Handelsregister eingereicht."
    },
    {
      "date": "2025-06-11",
      "id": "111789",
      "original_text": "Einreichung neuer Dokumente\nBerlin Amtsgericht Berlin (Charlottenburg) HRB 201346\nHomaris AG – Berlin",
      "type": "Einreichung neuer Dokumente",
      "state": "Berlin",
      "amtsgericht": "Amtsgericht Berlin (Charlottenburg)",
      "registernummer": "HRB 201346",
      "registerart": "HRB",
      "company_name": "Homaris AG",
      "company_seat": "Berlin",
      "details": "11.06.2025 (Bekanntmachungsdatum)\n\nBerlin Amtsgericht Berlin (Charlottenburg) HRB 201346\nEinreichung neuer Dokumente\n\nHomaris AG\nAktiengesellschaft\nBerlin\n\nAls nicht eingetragen wird veröffentlicht:Es wurde eine neue Liste der Aufsichtsratsmitglieder eingereicht (§ 106 AktG)."
    },
    {
      "date": "2025-06-11",
      "id": "111790",
      "original_text": "Registerbekanntmachung nach dem Umwandlungsgesetz\nBerlin Amtsgericht Berlin (Charlottenburg) HRB 89715\nRedwood Holding GmbH – Berlin",
      "type": "Registerbekanntmachung nach dem Umwandlungsgesetz",
      "state": "Berlin",
      "amtsgericht": "Amtsgericht Berlin (Charlottenburg)",
      "registernummer": "HRB 89715",
      "registerart": "HRB",
      "company_name": "Redwood Holding GmbH",
      "company_seat": "Berlin",
      "details": "11.06.2025 (Bekanntmachungsdatum)\n\nBerlin Amtsgericht Berlin (Charlottenburg) HRB 89715\nRegisterbekanntmachung nach dem Umwandlungsgesetz 11.06.2025 (Eintragungsdatum)\n\nRedwood Holding GmbH\nGesellschaft mit beschränkter Haftung\nBerlin\n\nZu Eintragungsnummer 25 vom 11.06.2025 wird als nicht eingetragen veröffentlicht: Den Gläubigern der an der Verschmelzung beteiligten Rechtsträger ist, wenn sie binnen sechs Monaten nach dem Tag, an dem die Eintragung der Verschmelzung in das Register des Sitzes desjenigen Rechtsträgers, dessen Gläubiger sie sind, als bekannt gemacht gilt, ihren Anspruch nach Grund und Höhe schriftlich anmelden, Sicherheit zu leisten, soweit sie nicht Befriedigung verlangen können. Dieses Recht steht den Gläubigern jedoch nur zu, wenn sie glaubhaft machen, dass durch die Verschmelzung die Erfüllung ihrer Forderung gefährdet wird. Das Recht, Sicherheitsleistung zu verlangen, steht Gläubigern nicht zu, die im Falle der Insolvenz ein Recht auf vorzugsweise Befriedigung aus einer Deckungsmasse haben, die nach gesetzlicher Vorschrift zu ihrem Schutz errichtet und staatlich überwacht ist."
    },
    {
      "date": "2025-06-11",
      "id": "111791",
      "original_text": "Registerbekanntmachung nach dem Umwandlungsgesetz\nBerlin Amtsgericht Berlin (Charlottenburg) HRB 69045\nOtis Management GmbH – Berlin",
      "type": "Registerbekanntmachung nach dem Umwandlungsgesetz",
      "state": "Berlin",
      "amtsgericht": "Amtsgericht Berlin (Charlottenburg)",
      "registernummer": "HRB 69045",
      "registerart": "HRB",
      "company_name": "Otis Management GmbH",
      "company_seat": "Berlin",
      "details": "11.06.2025 (Bekanntmachungsdatum)\n\nBerlin Amtsgericht Berlin (Charlottenburg) HRB 69045\nRegisterbekanntmachung nach dem Umwandlungsgesetz 11.06.2025 (Eintragungsdatum)\n\nOtis Management GmbH\nGesellschaft mit beschränkter Haftung\nBerlin\n\nZu Eintragungsnummer 29 vom 11.06.2025 wird als nicht eingetragen veröffentlicht: Den Gläubigern der an der Verschmelzung beteiligten Rechtsträger ist, wenn sie binnen sechs Monaten nach dem Tag, an dem die Eintragung der Verschmelzung in das Register des Sitzes desjenigen Rechtsträgers, dessen Gläubiger sie sind, als bekannt gemacht gilt, ihren Anspruch nach Grund und Höhe schriftlich anmelden, Sicherheit zu leisten, soweit sie nicht Befriedigung verlangen können. Dieses Recht steht den Gläubigern jedoch nur zu, wenn sie glaubhaft machen, dass durch die Verschmelzung die Erfüllung ihrer Forderung gefährdet wird. Das Recht, Sicherheitsleistung zu verlangen, steht Gläubigern nicht zu, die im Falle der Insolvenz ein Recht auf vorzugsweise Befriedigung aus einer Deckungsmasse haben, die nach gesetzlicher Vorschrift zu ihrem Schutz errichtet und staatlich überwacht ist."
    },
    {
      "date": "2025-06-11",
      "id": "111792",
      "original_text": "Löschungsankündigung\nBaden-Württemberg Amtsgericht Ulm HRB 737662\nGoldcar Drive GmbH – Göppingen",
      "type": "Löschungsankündigung",
      "state": "Baden-Württemberg",
      "amtsgericht": "Amtsgericht Ulm",
      "registernummer": "HRB 737662",
      "registerart": "HRB",
      "company_name": "Goldcar Drive GmbH",
      "company_seat": "Göppingen",
      "details": "11.06.2025 (Bekanntmachungsdatum)\n\nBaden-Württemberg Amtsgericht Ulm HRB 737662\nLöschungsankündigung\n\nGoldcar Drive GmbH\nGesellschaft mit beschränkter Haftung\nGöppingen\n\nDas Gericht beabsichtigt, die Gesellschaft wegen Vermögenslosigkeit im Handelsregister von Amts wegen nach § 394 FamFG zu löschen. Die Frist zur Geltendmachung eines Widerspruchs gegen die beabsichtigte Löschung ist auf  einen Monat ab Veröffentlichung bestimmt."
    },
    {
      "date": "2025-06-11",
      "id": "111793",
      "original_text": "Einreichung neuer Dokumente\nBaden-Württemberg Amtsgericht Stuttgart HRB 12931\nBülow Aktiengesellschaft – Stuttgart",
      "type": "Einreichung neuer Dokumente",
      "state": "Baden-Württemberg",
      "amtsgericht": "Amtsgericht Stuttgart",
      "registernummer": "HRB 12931",
      "registerart": "HRB",
      "company_name": "Bülow Aktiengesellschaft",
      "company_seat": "Stuttgart",
      "details": "11.06.2025 (Bekanntmachungsdatum)\n\nBaden-Württemberg Amtsgericht Stuttgart HRB 12931\nEinreichung neuer Dokumente 11.06.2025 (Eintragungsdatum)\n\nBülow Aktiengesellschaft\nAktiengesellschaft\nStuttgart\n\nDie Gesellschaft hat am 03.06.2025 die Liste über die Zusammensetzung des Aufsichtsrats zum Handelsregister eingereicht."
    },
    {
      "date": "2025-06-11",
      "id": "111794",
      "original_text": "Registerbekanntmachung nach dem Umwandlungsgesetz\nBerlin Amtsgericht Berlin (Charlottenburg) HRA 38843\nThe G Zweite Immobilien GmbH & Co. KG – Berlin",
      "type": "Registerbekanntmachung nach dem Umwandlungsgesetz",
      "state": "Berlin",
      "amtsgericht": "Amtsgericht Berlin (Charlottenburg)",
      "registernummer": "HRA 38843",
      "registerart": "HRA",
      "company_name": "The G Zweite Immobilien GmbH & Co. KG",
      "company_seat": "Berlin",
      "details": "11.06.2025 (Bekanntmachungsdatum)\n\nBerlin Amtsgericht Berlin (Charlottenburg) HRA 38843\nRegisterbekanntmachung nach dem Umwandlungsgesetz 10.06.2025 (Eintragungsdatum)\n\nThe G Zweite Immobilien GmbH & Co. KG\nKommanditgesellschaft\nBerlin\n\nZu Eintragungsnummer 8 vom 10.06.2025 wird als nicht eingetragen veröffentlicht: Den Gläubigern ist, wenn sie binnen sechs Monaten nach dem Tag, an dem die Eintragung der Umwandlung als bekannt gemacht gilt, ihren Anspruch nach Grund und Höhe schriftlich anmelden, Sicherheit zu leisten, soweit sie nicht Befriedigung verlangen können. Dieses Recht steht den Gläubigern jedoch nur zu, wenn sie glaubhaft machen, dass durch die Umwandlung die Erfüllung ihrer Forderung gefährdet wird. Das Recht, Sicherheitsleistung zu verlangen, steht Gläubigern nicht zu, die im Falle der Insolvenz ein Recht auf vorzugsweise Befriedigung aus einer Deckungsmasse haben, die nach gesetzlicher Vorschrift zu ihrem Schutz errichtet und staatlich überwacht ist."
    },
    {
      "date": "2025-06-11",
      "id": "111795",
      "original_text": "Registerbekanntmachung nach dem Umwandlungsgesetz\nBaden-Württemberg Amtsgericht Mannheim VR 100895\nCLUB DER TENNISFREUNDE Karlsruhe e.V. – Karlsruhe",
      "type": "Registerbekanntmachung nach dem Umwandlungsgesetz",
      "state": "Baden-Württemberg",
      "amtsgericht": "Amtsgericht Mannheim",
      "registernummer": "VR 100895",
      "registerart": "VR",
      "company_name": "CLUB DER TENNISFREUNDE Karlsruhe e.V.",
      "company_seat": "Karlsruhe",
      "details": "11.06.2025 (Bekanntmachungsdatum)\n\nBaden-Württemberg Amtsgericht Mannheim VR 100895\nRegisterbekanntmachung nach dem Umwandlungsgesetz 11.06.2025 (Eintragungsdatum)\n\nCLUB DER TENNISFREUNDE Karlsruhe e.V.\neingetragener Verein\nKarlsruhe\n\nAls nicht eingetragen wird bekanntgemacht:\nDen Gläubigern der an der Verschmelzung beteiligten Rechtsträger ist, wenn sie binnen sechs Monaten nach dem Tag, an dem die Eintragung der Verschmelzung in das Register des Sitzes desjenigen Rechtsträgers, dessen Gläubiger sie sind, nach § 19 Abs. 3 UmwG als bekanntgemacht gilt, ihren Anspruch nach Grund und Höhe schriftlich anmelden, Sicherheit zu leisten, soweit sie nicht Befriedigung verlangen können. Dieses Recht steht den Gläubigern jedoch nur zu, wenn sie glaubhaft machen, dass durch die Verschmelzung die Erfüllung ihrer Forderung gefährdet wird."
    },
    {
      "date": "2025-06-11",
      "id": "111796",
      "original_text": "Registerbekanntmachung nach dem Umwandlungsgesetz\nBerlin Amtsgericht Berlin (Charlottenburg) HRB 275885\nThe G Zweite Immobilien GmbH – Berlin",
      "type": "Registerbekanntmachung nach dem Umwandlungsgesetz",
      "state": "Berlin",
      "amtsgericht": "Amtsgericht Berlin (Charlottenburg)",
      "registernummer": "HRB 275885",
      "registerart": "HRB",
      "company_name": "The G Zweite Immobilien GmbH",
      "company_seat": "Berlin",
      "details": "11.06.2025 (Bekanntmachungsdatum)\n\nBerlin Amtsgericht Berlin (Charlottenburg) HRB 275885\nRegisterbekanntmachung nach dem Umwandlungsgesetz 10.06.2025 (Eintragungsdatum)\n\nThe G Zweite Immobilien GmbH\nGesellschaft mit beschränkter Haftung\nBerlin\n\nZu Eintragungsnummer 1 vom 10.06.2025 wird als nicht eingetragen veröffentlicht: Den Gläubigern ist, wenn sie binnen sechs Monaten nach dem Tag, an dem die Eintragung der Umwandlung als bekannt gemacht gilt, ihren Anspruch nach Grund und Höhe schriftlich anmelden, Sicherheit zu leisten, soweit sie nicht Befriedigung verlangen können. Dieses Recht steht den Gläubigern jedoch nur zu, wenn sie glaubhaft machen, dass durch die Umwandlung die Erfüllung ihrer Forderung gefährdet wird. Das Recht, Sicherheitsleistung zu verlangen, steht Gläubigern nicht zu, die im Falle der Insolvenz ein Recht auf vorzugsweise Befriedigung aus einer Deckungsmasse haben, die nach gesetzlicher Vorschrift zu ihrem Schutz errichtet und staatlich überwacht ist."
    },
    {
      "date": "2025-06-11",
      "id": "111797",
      "original_text": "Einreichung neuer Dokumente\nBaden-Württemberg Amtsgericht Stuttgart HRB 361242\nElringKlinger AG – Dettingen an der Erms",
      "type": "Einreichung neuer Dokumente",
      "state": "Baden-Württemberg",
      "amtsgericht": "Amtsgericht Stuttgart",
      "registernummer": "HRB 361242",
      "registerart": "HRB",
      "company_name": "ElringKlinger AG",
      "company_seat": "Dettingen an der Erms",
      "details": "11.06.2025 (Bekanntmachungsdatum)\n\nBaden-Württemberg Amtsgericht Stuttgart HRB 361242\nEinreichung neuer Dokumente\n\nElringKlinger AG\nAktiengesellschaft\nDettingen an der Erms\n\nDie Gesellschaft hat am 10.06.2025 die Liste über die Zusammensetzung des Aufsichtsrats zum Handelsregister eingereicht."
    },
    {
      "date": "2025-06-11",
      "id": "111798",
      "original_text": "Löschungsankündigung\nBerlin Amtsgericht Berlin (Charlottenburg) HRB 146060\nMr. Fips Dog Collection UG (haftungsbeschränkt) – Berlin",
      "type": "Löschungsankündigung",
      "state": "Berlin",
      "amtsgericht": "Amtsgericht Berlin (Charlottenburg)",
      "registernummer": "HRB 146060",
      "registerart": "HRB",
      "company_name": "Mr. Fips Dog Collection UG (haftungsbeschränkt)",
      "company_seat": "Berlin",
      "details": "11.06.2025 (Bekanntmachungsdatum)\n\nBerlin Amtsgericht Berlin (Charlottenburg) HRB 146060\nLöschungsankündigung\n\nMr. Fips Dog Collection UG (haftungsbeschränkt)\nGesellschaft mit beschränkter Haftung\nBerlin\n\nBei der nachstehenden Gesellschaft wird das Amtslöschungsverfahren gemäß § 394 FamFG eingeleitet. Widerspruchsfrist 6 Wochen"
    },
    {
      "date": "2025-06-11",
      "id": "111799",
      "original_text": "Löschungsankündigung\nBerlin Amtsgericht Berlin (Charlottenburg) HRB 197191\nAS Bauregie GmbH – Berlin",
      "type": "Löschungsankündigung",
      "state": "Berlin",
      "amtsgericht": "Amtsgericht Berlin (Charlottenburg)",
      "registernummer": "HRB 197191",
      "registerart": "HRB",
      "company_name": "AS Bauregie GmbH",
      "company_seat": "Berlin",
      "details": "11.06.2025 (Bekanntmachungsdatum)\n\nBerlin Amtsgericht Berlin (Charlottenburg) HRB 197191\nLöschungsankündigung\n\nAS Bauregie GmbH\nGesellschaft mit beschränkter Haftung\nBerlin\n\nBei der nachstehenden Gesellschaft wird das Amtslöschungsverfahren gemäß § 394 FamFG eingeleitet. Widerspruchsfrist 6 Wochen"
    },
    {
      "date": "2025-06-11",
      "id": "111800",
      "original_text": "Löschungsankündigung\nSachsen-Anhalt Amtsgericht Stendal HRB 26183\nBTSM Servicecenter GmbH – Lützen",
      "type": "Löschungsankündigung",
      "state": "Sachsen-Anhalt",
      "amtsgericht": "Amtsgericht Stendal",
      "registernummer": "HRB 26183",
      "registerart": "HRB",
      "company_name": "BTSM Servicecenter GmbH",
      "company_seat": "Lützen",
      "details": "11.06.2025 (Bekanntmachungsdatum)\n\nSachsen-Anhalt Amtsgericht Stendal HRB 26183\nLöschungsankündigung\n\nBTSM Servicecenter GmbH\nGesellschaft mit beschränkter Haftung\nLützen\n\nDas Registergericht beabsichtigt, nachfolgende im Handelregister eingetragenen Firmen von Amts wegen nach § 394 FamFG zu löschen. Die Frist zu Erhebung eines Widerspruchs wird auf drei Monate festgesetzt."
    },
    {
      "date": "2025-06-11",
      "id": "111801",
      "original_text": "Registerbekanntmachung nach dem Umwandlungsgesetz\nBaden-Württemberg Amtsgericht Stuttgart HRB 762316\nExyte Europe Holding GmbH – Stuttgart",
      "type": "Registerbekanntmachung nach dem Umwandlungsgesetz",
      "state": "Baden-Württemberg",
      "amtsgericht": "Amtsgericht Stuttgart",
      "registernummer": "HRB 762316",
      "registerart": "HRB",
      "company_name": "Exyte Europe Holding GmbH",
      "company_seat": "Stuttgart",
      "details": "11.06.2025 (Bekanntmachungsdatum)\n\nBaden-Württemberg Amtsgericht Stuttgart HRB 762316\nRegisterbekanntmachung nach dem Umwandlungsgesetz 11.06.2025 (Eintragungsdatum)\n\nExyte Europe Holding GmbH\nGesellschaft mit beschränkter Haftung\nStuttgart\n\nAls nicht eingetragen wird bekanntgemacht:\nDen Gläubigern der an der Verschmelzung beteiligten Rechtsträger ist, wenn sie binnen sechs Monaten nach dem Tag, an dem die Eintragung der Verschmelzung in das Register des Sitzes desjenigen Rechtsträgers, dessen Gläubiger sie sind, nach § 19 Abs. 3 UmwG als bekanntgemacht gilt, ihren Anspruch nach Grund und Höhe schriftlich anmelden, Sicherheit zu leisten, soweit sie nicht Befriedigung verlangen können. Dieses Recht steht den Gläubigern jedoch nur zu, wenn sie glaubhaft machen, dass durch die Verschmelzung die Erfüllung ihrer Forderung gefährdet wird."
    },
    {
      "date": "2025-06-11",
      "id": "111802",
      "original_text": "Löschungsankündigung\nBrandenburg Amtsgericht Frankfurt/Oder HRB 16163\nGlobal-Mobile Reparaturservice GmbH – Neuenhagen bei Berlin",
      "type": "Löschungsankündigung",
      "state": "Brandenburg",
      "amtsgericht": "Amtsgericht Frankfurt/Oder",
      "registernummer": "HRB 16163",
      "registerart": "HRB",
      "company_name": "Global-Mobile Reparaturservice GmbH",
      "company_seat": "Neuenhagen bei Berlin",
      "details": "11.06.2025 (Bekanntmachungsdatum)\n\nBrandenburg Amtsgericht Frankfurt/Oder HRB 16163\nLöschungsankündigung\n\nGlobal-Mobile Reparaturservice GmbH\nGesellschaft mit beschränkter Haftung\nNeuenhagen bei Berlin\n\nBei der nachstehenden Gesellschaft wird das Amtslöschungsverfahren gemäß § 394 FamFG eingeleitet."
    },
    {
      "date": "2025-06-11",
      "id": "111803",
      "original_text": "Registerbekanntmachung nach dem Umwandlungsgesetz\nBaden-Württemberg Amtsgericht Stuttgart HRB 784981\nHermann-Löns-Weg Projektentwicklungs- GmbH – Fellbach",
      "type": "Registerbekanntmachung nach dem Umwandlungsgesetz",
      "state": "Baden-Württemberg",
      "amtsgericht": "Amtsgericht Stuttgart",
      "registernummer": "HRB 784981",
      "registerart": "HRB",
      "company_name": "Hermann-Löns-Weg Projektentwicklungs- GmbH",
      "company_seat": "Fellbach",
      "details": "11.06.2025 (Bekanntmachungsdatum)\n\nBaden-Württemberg Amtsgericht Stuttgart HRB 784981\nRegisterbekanntmachung nach dem Umwandlungsgesetz 11.06.2025 (Eintragungsdatum)\n\nHermann-Löns-Weg Projektentwicklungs- GmbH\nGesellschaft mit beschränkter Haftung\nFellbach\n\nDen Gläubigern der an der Verschmelzung beteiligten Rechtsträger ist, wenn sie binnen sechs Monaten nach dem Tag, an dem die Eintragung der Verschmelzung in das Register des Sitzes desjenigen Rechtsträgers, dessen Gläubiger sie sind, nach § 19 Abs. 3 UmwG als bekanntgemacht gilt, ihren Anspruch nach Grund und Höhe schriftlich anmelden, Sicherheit zu leisten, soweit sie nicht Befriedigung verlangen können. Dieses Recht steht den Gläubigern jedoch nur zu, wenn sie glaubhaft machen, dass durch die Verschmelzung die Erfüllung ihrer Forderung gefährdet wird."
    },
    {
      "date": "2025-06-11",
      "id": "111804",
      "original_text": "Einreichung neuer Dokumente\nSchleswig-Holstein Amtsgericht Kiel HRB 5956\nknk Business Software AG – Kiel",
      "type": "Einreichung neuer Dokumente",
      "state": "Schleswig-Holstein",
      "amtsgericht": "Amtsgericht Kiel",
      "registernummer": "HRB 5956",
      "registerart": "HRB",
      "company_name": "knk Business Software AG",
      "company_seat": "Kiel",
      "details": "11.06.2025 (Bekanntmachungsdatum)\n\nSchleswig-Holstein Amtsgericht Kiel HRB 5956\nEinreichung neuer Dokumente\n\nknk Business Software AG\nAktiengesellschaft\nKiel\n\nAls nicht eingetragen wird veröffentlicht:Eine neue Liste der Aufsichtsratsmitglieder ist eingereicht worden."
    },
    {
      "date": "2025-06-11",
      "id": "111805",
      "original_text": "Sonstige Registerbekanntmachung\nHamburg Amtsgericht Hamburg HRA 128132\nMesa Pro Bau GmbH & Co. KG – Hamburg",
      "type": "Sonstige Registerbekanntmachung",
      "state": "Hamburg",
      "amtsgericht": "Amtsgericht Hamburg",
      "registernummer": "HRA 128132",
      "registerart": "HRA",
      "company_name": "Mesa Pro Bau GmbH & Co. KG",
      "company_seat": "Hamburg",
      "details": "11.06.2025 (Bekanntmachungsdatum)\n\nHamburg Amtsgericht Hamburg HRA 128132\nSonstige Registerbekanntmachung\n\nMesa Pro Bau GmbH & Co. KG\nKommanditgesellschaft\nHamburg\n\nDas Registergericht beabsichtigt, die im Handelsregister eingetragene Firma von Amts wegen nach § 31 Abs. 2 HBG zu löschen. Die Frist zur Erhebung eines Widerspruchs gegen die beabsichtigte Löschung wird auf 3 Monate festgesetzt."
    },
    {
      "date": "2025-06-11",
      "id": "111806",
      "original_text": "Einreichung neuer Dokumente\nSchleswig-Holstein Amtsgericht Kiel HRB 12095\nBio-Abfall-Verwertungsgesellschaft mbH – Neumünster",
      "type": "Einreichung neuer Dokumente",
      "state": "Schleswig-Holstein",
      "amtsgericht": "Amtsgericht Kiel",
      "registernummer": "HRB 12095",
      "registerart": "HRB",
      "company_name": "Bio-Abfall-Verwertungsgesellschaft mbH",
      "company_seat": "Neumünster",
      "details": "11.06.2025 (Bekanntmachungsdatum)\n\nSchleswig-Holstein Amtsgericht Kiel HRB 12095\nEinreichung neuer Dokumente\n\nBio-Abfall-Verwertungsgesellschaft mbH\nGesellschaft mit beschränkter Haftung\nNeumünster\n\nAls nicht eingetragen wird veröffentlicht: Eine neue Liste der Aufsichtsratsmitglieder ist eingereicht worden."
    },
    {
      "date": "2025-06-11",
      "id": "111807",
      "original_text": "Sonstige Registerbekanntmachung\nBerlin Amtsgericht Berlin (Charlottenburg) HRB 110758\nBAUDIS Aktiengesellschaft – Berlin",
      "type": "Sonstige Registerbekanntmachung",
      "state": "Berlin",
      "amtsgericht": "Amtsgericht Berlin (Charlottenburg)",
      "registernummer": "HRB 110758",
      "registerart": "HRB",
      "company_name": "BAUDIS Aktiengesellschaft",
      "company_seat": "Berlin",
      "details": "11.06.2025 (Bekanntmachungsdatum)\n\nBerlin Amtsgericht Berlin (Charlottenburg) HRB 110758\nSonstige Registerbekanntmachung\n\nBAUDIS Aktiengesellschaft\nAktiengesellschaft\nBerlin\n\nAls nicht eingetragen wird veröffentlicht: Die Gesellschaft hat den Entwurf eines Verschmelzungsvertrages betreffend die Verschmelzung der Gesellschaft mit der Baudis Generalplanungs UG (haftungsbeschränkt) mit dem Sitz in Berlin (Amtsgericht Charlottenburg, HRB 211645 B), der BAUDIS Planungsund Bauleitungs GmbH mit dem Sitz in Berlin (Amtsgericht Charlottenburg, HRB 149145 B) und der Baudis TGA UG (haftungsbeschränkt) mit dem Sitz in Berlin (Amtsgericht Charlottenburg, HRB 238192 B) ) jeweils als übertragender Rechtsträger zum Handelsregister des Amtsgericht Charlottenburg eingereicht."
    },
    {
      "date": "2025-06-11",
      "id": "111808",
      "original_text": "Einreichung neuer Dokumente\nBaden-Württemberg Amtsgericht Ulm HRB 748647\nRapp SE – Weingarten",
      "type": "Einreichung neuer Dokumente",
      "state": "Baden-Württemberg",
      "amtsgericht": "Amtsgericht Ulm",
      "registernummer": "HRB 748647",
      "registerart": "HRB",
      "company_name": "Rapp SE",
      "company_seat": "Weingarten",
      "details": "11.06.2025 (Bekanntmachungsdatum)\n\nBaden-Württemberg Amtsgericht Ulm HRB 748647\nEinreichung neuer Dokumente\n\nRapp SE\nEuropäische Aktiengesellschaft (SE)\nWeingarten\n\nDie Gesellschaft hat am 06.06.2025 die Liste über die Zusammensetzung des Aufsichtsrats zum Handelsregister eingereicht."
    },
    {
      "date": "2025-06-11",
      "id": "111809",
      "original_text": "Löschungsankündigung\nBaden-Württemberg Amtsgericht Mannheim HRB 715460\nGISA Gesellschaft für Industriemontage, Schweißtechnik und Anlagenbau mbH – Mannheim",
      "type": "Löschungsankündigung",
      "state": "Baden-Württemberg",
      "amtsgericht": "Amtsgericht Mannheim",
      "registernummer": "HRB 715460",
      "registerart": "HRB",
      "company_name": "GISA Gesellschaft für Industriemontage, Schweißtechnik und Anlagenbau mbH",
      "company_seat": "Mannheim",
      "details": "11.06.2025 (Bekanntmachungsdatum)\n\nBaden-Württemberg Amtsgericht Mannheim HRB 715460\nLöschungsankündigung\n\nGISA Gesellschaft für Industriemontage, Schweißtechnik und Anlagenbau mbH\nGesellschaft mit beschränkter Haftung\nMannheim\n\nDas Gericht beabsichtigt, die Gesellschaft wegen Vermögenslosigkeit im Handelsregister von Amts wegen nach § 394 FamFG zu löschen. Die Frist zur Geltendmachung eines Widerspruchs gegen die beabsichtigte Löschung ist auf einen Monat ab Veröffentlichung bestimmt."
    },
    {
      "date": "2025-06-11",
      "id": "111810",
      "original_text": "Löschungsankündigung\nBerlin Amtsgericht Berlin (Charlottenburg) HRB 164563\nfirsteight GmbH – Berlin",
      "type": "Löschungsankündigung",
      "state": "Berlin",
      "amtsgericht": "Amtsgericht Berlin (Charlottenburg)",
      "registernummer": "HRB 164563",
      "registerart": "HRB",
      "company_name": "firsteight GmbH",
      "company_seat": "Berlin",
      "details": "11.06.2025 (Bekanntmachungsdatum)\n\nBerlin Amtsgericht Berlin (Charlottenburg) HRB 164563\nLöschungsankündigung\n\nfirsteight GmbH\nGesellschaft mit beschränkter Haftung\nBerlin\n\nBei der nachstehenden Gesellschaft wird das Amtslöschungsverfahren gemäß § 394 FamFG eingeleitet. Widerspruchsfrist 6 Wochen"
    },
    {
      "date": "2025-06-11",
      "id": "111811",
      "original_text": "Sonstige Registerbekanntmachung\nMecklenburg-Vorpommern Amtsgericht Rostock HRB 13072\nDeutsche Konsum REIT-AG – Broderstorf",
      "type": "Sonstige Registerbekanntmachung",
      "state": "Mecklenburg-Vorpommern",
      "amtsgericht": "Amtsgericht Rostock",
      "registernummer": "HRB 13072",
      "registerart": "HRB",
      "company_name": "Deutsche Konsum REIT-AG",
      "company_seat": "Broderstorf",
      "details": "11.06.2025 (Bekanntmachungsdatum)\n\nMecklenburg-Vorpommern Amtsgericht Rostock HRB 13072\nSonstige Registerbekanntmachung\n\nDeutsche Konsum REIT-AG\nAktiengesellschaft\nBroderstorf\n\nEine Liste der Mitglieder des Aufsichtsrats ist zum Handelsregister eingereicht worden."
    },
    {
      "date": "2025-06-11",
      "id": "111812",
      "original_text": "Einreichung neuer Dokumente\nBaden-Württemberg Amtsgericht Ulm HRB 552230\nWIR - Gesellschaft für Wirtschafts- und Innovationsförderung Landkreis Ravensburg mbH – Ravensburg",
      "type": "Einreichung neuer Dokumente",
      "state": "Baden-Württemberg",
      "amtsgericht": "Amtsgericht Ulm",
      "registernummer": "HRB 552230",
      "registerart": "HRB",
      "company_name": "WIR - Gesellschaft für Wirtschafts- und Innovationsförderung Landkreis Ravensburg mbH",
      "company_seat": "Ravensburg",
      "details": "11.06.2025 (Bekanntmachungsdatum)\n\nBaden-Württemberg Amtsgericht Ulm HRB 552230\nEinreichung neuer Dokumente\n\nWIR - Gesellschaft für Wirtschafts- und Innovationsförderung Landkreis Ravensburg mbH\nGesellschaft mit beschränkter Haftung\nRavensburg\n\nDie Gesellschaft hat am 10.06.2025 die Liste über die Zusammensetzung des Aufsichtsrats zum Handelsregister eingereicht."
    },
    {
      "date": "2025-06-11",
      "id": "111813",
      "original_text": "Löschungsankündigung\nBrandenburg Amtsgericht Potsdam HRB 36353\nCP Management und Network GmbH – Teltow",
      "type": "Löschungsankündigung",
      "state": "Brandenburg",
      "amtsgericht": "Amtsgericht Potsdam",
      "registernummer": "HRB 36353",
      "registerart": "HRB",
      "company_name": "CP Management und Network GmbH",
      "company_seat": "Teltow",
      "details": "11.06.2025 (Bekanntmachungsdatum)\n\nBrandenburg Amtsgericht Potsdam HRB 36353\nLöschungsankündigung\n\nCP Management und Network GmbH\nGesellschaft mit beschränkter Haftung\nTeltow\n\nBei der nachstehenden Gesellschaft wird das Amtslöschungsverfahren gemäß § 394 FamFG eingeleitet. Widerspruchsfrist: 8 Wochen"
    },
    {
      "date": "2025-06-11",
      "id": "111814",
      "original_text": "Einreichung neuer Dokumente\nBaden-Württemberg Amtsgericht Ulm HRB 743370\nRegionalwert AG Bodensee-Oberschwaben – Ravensburg",
      "type": "Einreichung neuer Dokumente",
      "state": "Baden-Württemberg",
      "amtsgericht": "Amtsgericht Ulm",
      "registernummer": "HRB 743370",
      "registerart": "HRB",
      "company_name": "Regionalwert AG Bodensee-Oberschwaben",
      "company_seat": "Ravensburg",
      "details": "11.06.2025 (Bekanntmachungsdatum)\n\nBaden-Württemberg Amtsgericht Ulm HRB 743370\nEinreichung neuer Dokumente\n\nRegionalwert AG Bodensee-Oberschwaben\nAktiengesellschaft\nRavensburg\n\nDie Gesellschaft hat am 10.06.2025 die Liste über die Zusammensetzung des Aufsichtsrats zum Handelsregister eingereicht."
    },
    {
      "date": "2025-06-11",
      "id": "111815",
      "original_text": "Sonstige Registerbekanntmachung\nSchleswig-Holstein Amtsgericht Lübeck HRB 23762\nLLD Lager & Logistik Dienstleistung GmbH – Glinde",
      "type": "Sonstige Registerbekanntmachung",
      "state": "Schleswig-Holstein",
      "amtsgericht": "Amtsgericht Lübeck",
      "registernummer": "HRB 23762",
      "registerart": "HRB",
      "company_name": "LLD Lager & Logistik Dienstleistung GmbH",
      "company_seat": "Glinde",
      "details": "11.06.2025 (Bekanntmachungsdatum)\n\nSchleswig-Holstein Amtsgericht Lübeck HRB 23762\nSonstige Registerbekanntmachung\n\nLLD Lager & Logistik Dienstleistung GmbH\nGesellschaft mit beschränkter Haftung\nGlinde\n\nAls nicht eingetragen wird veröffentlicht:\nAmtsgericht Lübeck, Am Burgfeld 7, 23568 Lübeck\n\nHerr\nAndrejs Visockis\nMöllner Landrstr. 89\n21509 Glinde\n\nUnser Zeichen: HRB 23762 HL\n\nDatum: 10.06.2025\n\nSehr geehrter Herr Visockis,\n\nin der Handelsregistersache der\n\nLLD Lager & Logistik Dienstleistung GmbH\n\nergeben sich aus den mir vorliegenden Unterlagen Anhaltspunkte dafür, dass die Gesellschaft, als deren Geschäftsführer Sie noch eingetragen sind, vermögenslos ist:\n\nSchreiben der IHK vom 25.03.2025 und 04.06.2025.\n\nIch beabsichtige daher, die Gesellschaft wegen Vermögenslosigkeit gemäß § 394 FamFG zu löschen.\n\nIch bestimme eine Frist von einem Monat zur Geltendmachung eines Widerspruchs gegen die Löschung, § 394 Abs. 2 S. 1 FamFG.\nGgf. bitte ich Sie, mir binnen derselben Frist mitzuteilen, ob die genannte Gesellschaft noch Vermögen hat, welche Vermögensgegenstände sie besitzt, ob die Gesellschaft noch Partei eines noch nicht rechtskräftig abgeschlossenen Rechtsstreits ist, ob noch Rückforderungen der Gesellschaft gegenüber dem Finanzamt bestehen, ob die Gesellschaft noch an einer anderen Gesellschaft beteiligt ist, ob Grundbucheintragungen der Gesellschaft bestehen oder ob sonst noch eine Abwicklung stattfindet.\n\nNach Fristablauf ohne Widerspruch von Ihnen oder anderer Seite wird die Gesellschaft gelöscht.\n\nMit freundlichen Grüßen\n\nDammann\nDipl.-Rechtspflegerin (FH)"
    },
    {
      "date": "2025-06-11",
      "id": "111816",
      "original_text": "Einreichung neuer Dokumente\nBaden-Württemberg Amtsgericht Ulm HRB 701337\nLEICHT KÜCHEN Aktiengesellschaft – Waldstetten",
      "type": "Einreichung neuer Dokumente",
      "state": "Baden-Württemberg",
      "amtsgericht": "Amtsgericht Ulm",
      "registernummer": "HRB 701337",
      "registerart": "HRB",
      "company_name": "LEICHT KÜCHEN Aktiengesellschaft",
      "company_seat": "Waldstetten",
      "details": "11.06.2025 (Bekanntmachungsdatum)\n\nBaden-Württemberg Amtsgericht Ulm HRB 701337\nEinreichung neuer Dokumente\n\nLEICHT KÜCHEN Aktiengesellschaft\nAktiengesellschaft\nWaldstetten\n\nDie Gesellschaft hat am 10.06.2025 die Liste über die Zusammensetzung des Aufsichtsrats zum Handelsregister eingereicht."
    },
    {
      "date": "2025-06-11",
      "id": "111817",
      "original_text": "Registerbekanntmachung nach dem Umwandlungsgesetz\nMecklenburg-Vorpommern Amtsgericht Rostock HRB 16156\nCarl Zeiss Microscopy Software Center Rostock GmbH – Rostock",
      "type": "Registerbekanntmachung nach dem Umwandlungsgesetz",
      "state": "Mecklenburg-Vorpommern",
      "amtsgericht": "Amtsgericht Rostock",
      "registernummer": "HRB 16156",
      "registerart": "HRB",
      "company_name": "Carl Zeiss Microscopy Software Center Rostock GmbH",
      "company_seat": "Rostock",
      "details": "11.06.2025 (Bekanntmachungsdatum)\n\nMecklenburg-Vorpommern Amtsgericht Rostock HRB 16156\nRegisterbekanntmachung nach dem Umwandlungsgesetz 11.06.2025 (Eintragungsdatum)\n\nCarl Zeiss Microscopy Software Center Rostock GmbH\nGesellschaft mit beschränkter Haftung\nRostock\n\nAls nicht eingetragen wird veröffentlicht: Den Gläubigern der an der Verschmelzung beteiligten Rechtsträger ist, wenn sie binnen sechs Monaten nach dem Tag, an dem die Eintragung der Verschmelzung in das Register des Sitzes desjenigen Rechtsträgers, dessen Gläubiger sie sind, nach § 19 Abs. 3 UmwG als bekannt gemacht gilt,\nihren Anspruch nach Grund und Höhe in Textform anmelden, Sicherheit zu leisten, soweit sie nicht Befriedigung verlangen können. Dieses Recht steht den Gläubigern jedoch nur zu, wenn sie glaubhaft machen, dass durch die Verschmelzung die Erfüllung der Forderung gefährdet wird."
    },
    {
      "date": "2025-06-11",
      "id": "111818",
      "original_text": "Einreichung neuer Dokumente\nMecklenburg-Vorpommern Amtsgericht Stralsund HRB 1743\nREWA Regionale Wasser- und Abwassergesellschaft Stralsund mbH – Stralsund",
      "type": "Einreichung neuer Dokumente",
      "state": "Mecklenburg-Vorpommern",
      "amtsgericht": "Amtsgericht Stralsund",
      "registernummer": "HRB 1743",
      "registerart": "HRB",
      "company_name": "REWA Regionale Wasser- und Abwassergesellschaft Stralsund mbH",
      "company_seat": "Stralsund",
      "details": "11.06.2025 (Bekanntmachungsdatum)\n\nMecklenburg-Vorpommern Amtsgericht Stralsund HRB 1743\nEinreichung neuer Dokumente\n\nREWA Regionale Wasser- und Abwassergesellschaft Stralsund mbH\nGesellschaft mit beschränkter Haftung\nStralsund\n\nEine Liste der Mitglieder des Aufsichtsrats ist zum Handelsregister eingereicht worden."
    },
    {
      "date": "2025-06-11",
      "id": "111819",
      "original_text": "Registerbekanntmachung nach dem Umwandlungsgesetz\nSachsen Amtsgericht Leipzig HRB 32473\nVICUS GROUP AG – Leipzig",
      "type": "Registerbekanntmachung nach dem Umwandlungsgesetz",
      "state": "Sachsen",
      "amtsgericht": "Amtsgericht Leipzig",
      "registernummer": "HRB 32473",
      "registerart": "HRB",
      "company_name": "VICUS GROUP AG",
      "company_seat": "Leipzig",
      "details": "11.06.2025 (Bekanntmachungsdatum)\n\nSachsen Amtsgericht Leipzig HRB 32473\nRegisterbekanntmachung nach dem Umwandlungsgesetz 11.06.2025 (Eintragungsdatum)\n\nVICUS GROUP AG\nAktiengesellschaft\nLeipzig\n\nDen Gläubigern der an der Verschmelzung beteiligten Rechtsträger ist, wenn sie binnen sechs Monaten nach dem Tag, an dem die Eintragung der Verschmelzung in das Register des Sitzes desjenigen Rechtsträgers, dessen Gläubiger sie sind, nach § 19 Abs. 3 UmwG als bekannt gemacht gilt, ihren Anspruch nach Grund und Höhe in Textform anmelden, Sicherheit zu leisten, soweit sie nicht Befriedigung verlangen können. Dieses Recht steht den Gläubigern jedoch nur zu, wenn sie glaubhaft machen, dass durch die Verschmelzung die Erfüllung der Forderung gefährdet wird."
    },
    {
      "date": "2025-06-11",
      "id": "111820",
      "original_text": "Registerbekanntmachung nach dem Umwandlungsgesetz\nSachsen Amtsgericht Leipzig HRB 32473\nVICUS GROUP AG – Leipzig",
      "type": "Registerbekanntmachung nach dem Umwandlungsgesetz",
      "state": "Sachsen",
      "amtsgericht": "Amtsgericht Leipzig",
      "registernummer": "HRB 32473",
      "registerart": "HRB",
      "company_name": "VICUS GROUP AG",
      "company_seat": "Leipzig",
      "details": "11.06.2025 (Bekanntmachungsdatum)\n\nSachsen Amtsgericht Leipzig HRB 32473\nRegisterbekanntmachung nach dem Umwandlungsgesetz 11.06.2025 (Eintragungsdatum)\n\nVICUS GROUP AG\nAktiengesellschaft\nLeipzig\n\nDen Gläubigern der an der Verschmelzung beteiligten Rechtsträger ist, wenn sie binnen sechs Monaten nach dem Tag, an dem die Eintragung der Verschmelzung in das Register des Sitzes desjenigen Rechtsträgers, dessen Gläubiger sie sind, nach § 19 Abs. 3 UmwG als bekannt gemacht gilt, ihren Anspruch nach Grund und Höhe in Textform anmelden, Sicherheit zu leisten, soweit sie nicht Befriedigung verlangen können. Dieses Recht steht den Gläubigern jedoch nur zu, wenn sie glaubhaft machen, dass durch die Verschmelzung die Erfüllung der Forderung gefährdet wird."
    },
    {
      "date": "2025-06-11",
      "id": "111821",
      "original_text": "Registerbekanntmachung nach dem Umwandlungsgesetz\nSachsen Amtsgericht Leipzig HRB 33215\nVicus Real Estate Berlin 5 GmbH – Leipzig",
      "type": "Registerbekanntmachung nach dem Umwandlungsgesetz",
      "state": "Sachsen",
      "amtsgericht": "Amtsgericht Leipzig",
      "registernummer": "HRB 33215",
      "registerart": "HRB",
      "company_name": "Vicus Real Estate Berlin 5 GmbH",
      "company_seat": "Leipzig",
      "details": "11.06.2025 (Bekanntmachungsdatum)\n\nSachsen Amtsgericht Leipzig HRB 33215\nRegisterbekanntmachung nach dem Umwandlungsgesetz 11.06.2025 (Eintragungsdatum)\n\nVicus Real Estate Berlin 5 GmbH\nGesellschaft mit beschränkter Haftung\nLeipzig\n\nDen Gläubigern der an der Verschmelzung beteiligten Rechtsträger ist, wenn sie binnen sechs Monaten nach dem Tag, an dem die Eintragung der Verschmelzung in das Register des Sitzes desjenigen Rechtsträgers, dessen Gläubiger sie sind, nach § 19 Abs. 3 UmwG als bekannt gemacht gilt, ihren Anspruch nach Grund und Höhe in Textform anmelden, Sicherheit zu leisten, soweit sie nicht Befriedigung verlangen können. Dieses Recht steht den Gläubigern jedoch nur zu, wenn sie glaubhaft machen, dass durch die Verschmelzung die Erfüllung der Forderung gefährdet wird."
    },
    {
      "date": "2025-06-11",
      "id": "111822",
      "original_text": "Registerbekanntmachung nach dem Umwandlungsgesetz\nSachsen Amtsgericht Dresden HRB 28203\nAuto-Bruhns GmbH – Dresden",
      "type": "Registerbekanntmachung nach dem Umwandlungsgesetz",
      "state": "Sachsen",
      "amtsgericht": "Amtsgericht Dresden",
      "registernummer": "HRB 28203",
      "registerart": "HRB",
      "company_name": "Auto-Bruhns GmbH",
      "company_seat": "Dresden",
      "details": "11.06.2025 (Bekanntmachungsdatum)\n\nSachsen Amtsgericht Dresden HRB 28203\nRegisterbekanntmachung nach dem Umwandlungsgesetz 11.06.2025 (Eintragungsdatum)\n\nAuto-Bruhns GmbH\nGesellschaft mit beschränkter Haftung\nDresden\n\nDen Gläubigern der an der Verschmelzung beteiligten Rechtsträger ist, wenn sie binnen sechs Monaten nach dem Tag, an dem die Eintragung der Verschmelzung in das Register des Sitzes desjenigen Rechtsträgers, dessen Gläubiger sie sind, nach § 19 Abs. 3 UmwG als bekannt gemacht gilt, ihren Anspruch nach Grund und Höhe in Textform anmelden, Sicherheit zu leisten, soweit sie nicht Befriedigung verlangen können. Dieses Recht steht den Gläubigern jedoch nur zu, wenn sie glaubhaft machen, dass durch die Verschmelzung die Erfüllung der Forderung gefährdet wird."
    },
    {
      "date": "2025-06-11",
      "id": "111823",
      "original_text": "Einreichung neuer Dokumente\nSachsen Amtsgericht Chemnitz HRB 23591\nADLATUS AKTIENGESELLSCHAFT – Chemnitz",
      "type": "Einreichung neuer Dokumente",
      "state": "Sachsen",
      "amtsgericht": "Amtsgericht Chemnitz",
      "registernummer": "HRB 23591",
      "registerart": "HRB",
      "company_name": "ADLATUS AKTIENGESELLSCHAFT",
      "company_seat": "Chemnitz",
      "details": "11.06.2025 (Bekanntmachungsdatum)\n\nSachsen Amtsgericht Chemnitz HRB 23591\nEinreichung neuer Dokumente\n\nADLATUS AKTIENGESELLSCHAFT\nAktiengesellschaft\nChemnitz\n\nAm 10.06.2025 wurde beim Handelsregister des Amtsgerichts Chemnitz die Liste der Mitglieder des Aufsichtsrats gemäß § 106 AktG eingereicht."
    },
    {
      "date": "2025-06-11",
      "id": "111824",
      "original_text": "Löschungsankündigung\nSachsen Amtsgericht Dresden HRB 42643\nSkala Immobilien GmbH – Löbau",
      "type": "Löschungsankündigung",
      "state": "Sachsen",
      "amtsgericht": "Amtsgericht Dresden",
      "registernummer": "HRB 42643",
      "registerart": "HRB",
      "company_name": "Skala Immobilien GmbH",
      "company_seat": "Löbau",
      "details": "11.06.2025 (Bekanntmachungsdatum)\n\nSachsen Amtsgericht Dresden HRB 42643\nLöschungsankündigung\n\nSkala Immobilien GmbH\nGesellschaft mit beschränkter Haftung\nLöbau\n\nDas Registergericht beabsichtigt, die im Handelsregister eingetragene Gesellschaft von Amts wegen nach § 394 FamFG zu löschen. Die Frist zu Erhebung eines Widerspruchs gegen die beabsichtigte Löschung wird auf einen Monat festgesetzt."
    },
    {
      "date": "2025-06-11",
      "id": "111825",
      "original_text": "Einreichung neuer Dokumente\nSachsen Amtsgericht Leipzig HRB 32473\nVICUS GROUP AG – Leipzig",
      "type": "Einreichung neuer Dokumente",
      "state": "Sachsen",
      "amtsgericht": "Amtsgericht Leipzig",
      "registernummer": "HRB 32473",
      "registerart": "HRB",
      "company_name": "VICUS GROUP AG",
      "company_seat": "Leipzig",
      "details": "11.06.2025 (Bekanntmachungsdatum)\n\nSachsen Amtsgericht Leipzig HRB 32473\nEinreichung neuer Dokumente\n\nVICUS GROUP AG\nAktiengesellschaft\nLeipzig\n\nAm 06.06.2025 wurde beim Handelsregister des Amtsgerichts Leipzig die Liste der Mitglieder des Aufsichtsrats gemäß § 106 AktG eingereicht."
    },
    {
      "date": "2025-06-11",
      "id": "111826",
      "original_text": "Registerbekanntmachung nach dem Umwandlungsgesetz\nSachsen Amtsgericht Leipzig HRB 33461\nKohlrabizirkus Eventlocation GmbH – Leipzig",
      "type": "Registerbekanntmachung nach dem Umwandlungsgesetz",
      "state": "Sachsen",
      "amtsgericht": "Amtsgericht Leipzig",
      "registernummer": "HRB 33461",
      "registerart": "HRB",
      "company_name": "Kohlrabizirkus Eventlocation GmbH",
      "company_seat": "Leipzig",
      "details": "11.06.2025 (Bekanntmachungsdatum)\n\nSachsen Amtsgericht Leipzig HRB 33461\nRegisterbekanntmachung nach dem Umwandlungsgesetz 11.06.2025 (Eintragungsdatum)\n\nKohlrabizirkus Eventlocation GmbH\nGesellschaft mit beschränkter Haftung\nLeipzig\n\nDen Gläubigern der an der Verschmelzung beteiligten Rechtsträger ist, wenn sie binnen sechs Monaten nach dem Tag, an dem die Eintragung der Verschmelzung in das Register des Sitzes desjenigen Rechtsträgers, dessen Gläubiger sie sind, nach § 19 Abs. 3 UmwG als bekannt gemacht gilt, ihren Anspruch nach Grund und Höhe in Textform anmelden, Sicherheit zu leisten, soweit sie nicht Befriedigung verlangen können. Dieses Recht steht den Gläubigern jedoch nur zu, wenn sie glaubhaft machen, dass durch die Verschmelzung die Erfüllung der Forderung gefährdet wird."
    },
    {
      "date": "2025-06-11",
      "id": "111827",
      "original_text": "Einreichung neuer Dokumente\nNiedersachsen Amtsgericht Oldenburg (Oldenburg) HRB 5236\nEWE NETZ GmbH – Oldenburg",
      "type": "Einreichung neuer Dokumente",
      "state": "Niedersachsen",
      "amtsgericht": "Amtsgericht Oldenburg (Oldenburg)",
      "registernummer": "HRB 5236",
      "registerart": "HRB",
      "company_name": "EWE NETZ GmbH",
      "company_seat": "Oldenburg",
      "details": "11.06.2025 (Bekanntmachungsdatum)\n\nNiedersachsen Amtsgericht Oldenburg (Oldenburg) HRB 5236\nEinreichung neuer Dokumente 11.06.2025 (Eintragungsdatum)\n\nEWE NETZ GmbH\nGesellschaft mit beschränkter Haftung\nOldenburg\n\nDie Liste der Mitglieder des Aufsichtsrats wurde beim Registergericht eingereicht."
    },
    {
      "date": "2025-06-11",
      "id": "111828",
      "original_text": "Registerbekanntmachung nach dem Umwandlungsgesetz\nNiedersachsen Amtsgericht Göttingen HRB 1481\nELIOS GmbH – Göttingen",
      "type": "Registerbekanntmachung nach dem Umwandlungsgesetz",
      "state": "Niedersachsen",
      "amtsgericht": "Amtsgericht Göttingen",
      "registernummer": "HRB 1481",
      "registerart": "HRB",
      "company_name": "ELIOS GmbH",
      "company_seat": "Göttingen",
      "details": "11.06.2025 (Bekanntmachungsdatum)\n\nNiedersachsen Amtsgericht Göttingen HRB 1481\nRegisterbekanntmachung nach dem Umwandlungsgesetz 11.06.2025 (Eintragungsdatum)\n\nELIOS GmbH\nGesellschaft mit beschränkter Haftung\nGöttingen\n\nDen Gläubigern der an der Verschmelzung beteiligten Rechtsträger ist, wenn sie binnen sechs Monaten nach dem Tag, an dem die Eintragung der Verschmelzung in das Register des Sitzes desjenigen Rechtsträgers, dessen Gläubiger sie sind, nach § 19  Abs.  3 UmwG als bekannt gemacht gilt, ihren Anspruch nach Grund und Höhe schriftlich anmelden, Sicherheit zu leisten, soweit sie nicht Befriedigung verlangen können. Dieses Recht steht den Gläubigern jedoch nur zu, wenn sie glaubhaft machen, dass durch die Verschmelzung die Erfüllung der Forderung gefährdet wird."
    },
    {
      "date": "2025-06-11",
      "id": "111829",
      "original_text": "Einreichung neuer Dokumente\nNiedersachsen Amtsgericht Braunschweig HRB 268\nSigert-Verlag GmbH – Braunschweig",
      "type": "Einreichung neuer Dokumente",
      "state": "Niedersachsen",
      "amtsgericht": "Amtsgericht Braunschweig",
      "registernummer": "HRB 268",
      "registerart": "HRB",
      "company_name": "Sigert-Verlag GmbH",
      "company_seat": "Braunschweig",
      "details": "11.06.2025 (Bekanntmachungsdatum)\n\nNiedersachsen Amtsgericht Braunschweig HRB 268\nEinreichung neuer Dokumente\n\nSigert-Verlag GmbH\nGesellschaft mit beschränkter Haftung\nBraunschweig\n\nEine neue Liste der Mitglieder des Aufsichtsrats wurde beim Registergericht eingereicht."
    },
    {
      "date": "2025-06-11",
      "id": "111830",
      "original_text": "Einreichung neuer Dokumente\nNiedersachsen Amtsgericht Hannover HRB 110532 früher Amtsgericht Neustadt a. Rbge. (Neustadt)\nStadtwerke Garbsen GmbH – Garbsen",
      "type": "Einreichung neuer Dokumente",
      "state": "Niedersachsen",
      "amtsgericht": "Amtsgericht Hannover",
      "registernummer": "HRB 110532",
      "registerart": "HRB",
      "company_name": "Stadtwerke Garbsen GmbH",
      "company_seat": "Garbsen",
      "former_amtsgericht": "Neustadt a. Rbge. (Neustadt)",
      "details": "11.06.2025 (Bekanntmachungsdatum)\n\nNiedersachsen Amtsgericht Hannover HRB 110532 früher Amtsgericht Neustadt a. Rbge. (Neustadt)\nEinreichung neuer Dokumente 11.06.2025 (Eintragungsdatum)\n\nStadtwerke Garbsen GmbH\nGesellschaft mit beschränkter Haftung\nGarbsen\n\nDie Liste der Mitglieder des Aufsichtsrats wurde beim Registergericht eingereicht."
    },
    {
      "date": "2025-06-11",
      "id": "111831",
      "original_text": "Löschungsankündigung\nNiedersachsen Amtsgericht Lüneburg HRB 211806\nLucacelli Systemgastronomie GmbH – Seevetal",
      "type": "Löschungsankündigung",
      "state": "Niedersachsen",
      "amtsgericht": "Amtsgericht Lüneburg",
      "registernummer": "HRB 211806",
      "registerart": "HRB",
      "company_name": "Lucacelli Systemgastronomie GmbH",
      "company_seat": "Seevetal",
      "details": "11.06.2025 (Bekanntmachungsdatum)\n\nNiedersachsen Amtsgericht Lüneburg HRB 211806\nLöschungsankündigung\n\nLucacelli Systemgastronomie GmbH\nGesellschaft mit beschränkter Haftung\nSeevetal\n\nDas Registergericht beabsichtigt, die unzutreffende Geschäftsanschrift der Gesellschaft von Amts wegen nach § 395 FamFG zu löschen. Die Frist zur Erhebung eines Widerspruchs ist auf 1 Monat ab dieser Registerbekanntmachung festgesetzt."
    },
    {
      "date": "2025-06-11",
      "id": "111832",
      "original_text": "Einreichung neuer Dokumente\nNiedersachsen Amtsgericht Hannover HRB 52032\nContiTech Schlauch GmbH – Hannover",
      "type": "Einreichung neuer Dokumente",
      "state": "Niedersachsen",
      "amtsgericht": "Amtsgericht Hannover",
      "registernummer": "HRB 52032",
      "registerart": "HRB",
      "company_name": "ContiTech Schlauch GmbH",
      "company_seat": "Hannover",
      "details": "11.06.2025 (Bekanntmachungsdatum)\n\nNiedersachsen Amtsgericht Hannover HRB 52032\nEinreichung neuer Dokumente 11.06.2025 (Eintragungsdatum)\n\nContiTech Schlauch GmbH\nGesellschaft mit beschränkter Haftung\nHannover\n\nDie Liste der Mitglieder des Aufsichtsrats wurde beim Registergericht eingereicht."
    },
    {
      "date": "2025-06-11",
      "id": "111833",
      "original_text": "Einreichung neuer Dokumente\nNiedersachsen Amtsgericht Osnabrück HRB 213773\nBischof + Klein New Business SE – Osnabrück",
      "type": "Einreichung neuer Dokumente",
      "state": "Niedersachsen",
      "amtsgericht": "Amtsgericht Osnabrück",
      "registernummer": "HRB 213773",
      "registerart": "HRB",
      "company_name": "Bischof + Klein New Business SE",
      "company_seat": "Osnabrück",
      "details": "11.06.2025 (Bekanntmachungsdatum)\n\nNiedersachsen Amtsgericht Osnabrück HRB 213773\nEinreichung neuer Dokumente\n\nBischof + Klein New Business SE\nEuropäische Aktiengesellschaft (SE)\nOsnabrück\n\nDie Liste der Mitglieder des Aufsichtsrats wurde beim Registergericht eingereicht."
    },
    {
      "date": "2025-06-11",
      "id": "111834",
      "original_text": "Löschungsankündigung\nNiedersachsen Amtsgericht Hannover HRA 201161\nbcb bückeburger classic bau Beteiligungs GmbH & Co. KG – Hannover",
      "type": "Löschungsankündigung",
      "state": "Niedersachsen",
      "amtsgericht": "Amtsgericht Hannover",
      "registernummer": "HRA 201161",
      "registerart": "HRA",
      "company_name": "bcb bückeburger classic bau Beteiligungs GmbH & Co. KG",
      "company_seat": "Hannover",
      "details": "11.06.2025 (Bekanntmachungsdatum)\n\nNiedersachsen Amtsgericht Hannover HRA 201161\nLöschungsankündigung 11.06.2025 (Eintragungsdatum)\n\nbcb bückeburger classic bau Beteiligungs GmbH & Co. KG\nKommanditgesellschaft\nHannover\n\nbcb bückeburger classic bau Beteiligungs GmbH & Co. KG, Hannover\nDas Registergericht beabsichtigt, die Firma von Amts wegen nach § 394 FamFG zu löschen. Die Frist zur Erhebung eines Widerspruchs ist auf 1 Monat ab dieser Registerbekanntmachung festgesetzt."
    },
    {
      "date": "2025-06-11",
      "id": "111835",
      "original_text": "Löschungsankündigung\nBremen Amtsgericht Bremen HRB 39175\nSA BAU GmbH – Bremen",
      "type": "Löschungsankündigung",
      "state": "Bremen",
      "amtsgericht": "Amtsgericht Bremen",
      "registernummer": "HRB 39175",
      "registerart": "HRB",
      "company_name": "SA BAU GmbH",
      "company_seat": "Bremen",
      "details": "11.06.2025 (Bekanntmachungsdatum)\n\nBremen Amtsgericht Bremen HRB 39175\nLöschungsankündigung\n\nSA BAU GmbH\nGesellschaft mit beschränkter Haftung\nBremen\n\nEs ist beabsichtigt die im Handelsregister eingetragene Gesellschaft von Amts wegen gemäß § 394 FamFG zu löschen. Gegen die Löschung kann beim AG Bremen schriftlich oder zu Protokoll der Geschäftsstelle Widerspruch eingelegt werden. Widerspruchsfrist 4 Wochen."
    },
    {
      "date": "2025-06-11",
      "id": "111836",
      "original_text": "Löschungsankündigung\nBremen Amtsgericht Bremen HRB 35945\nSSB Industrieservice GmbH – Bremerhaven",
      "type": "Löschungsankündigung",
      "state": "Bremen",
      "amtsgericht": "Amtsgericht Bremen",
      "registernummer": "HRB 35945",
      "registerart": "HRB",
      "company_name": "SSB Industrieservice GmbH",
      "company_seat": "Bremerhaven",
      "details": "11.06.2025 (Bekanntmachungsdatum)\n\nBremen Amtsgericht Bremen HRB 35945\nLöschungsankündigung\n\nSSB Industrieservice GmbH\nGesellschaft mit beschränkter Haftung\nBremerhaven\n\nEs ist beabsichtigt die im Handelsregister eingetragene Gesellschaft von Amts wegen gemäß § 394 FamFG zu löschen. Gegen die Löschung kann beim AG Bremen schriftlich oder zu Protokoll der Geschäftsstelle Widerspruch eingelegt werden. Widerspruchsfrist 4 Wochen."
    },
    {
      "date": "2025-06-11",
      "id": "111837",
      "original_text": "Registerbekanntmachung nach dem Umwandlungsgesetz\nBremen Amtsgericht Bremen HRA 30696\nBjarne Klapper e.K. – Bremen",
      "type": "Registerbekanntmachung nach dem Umwandlungsgesetz",
      "state": "Bremen",
      "amtsgericht": "Amtsgericht Bremen",
      "registernummer": "HRA 30696",
      "registerart": "HRA",
      "company_name": "Bjarne Klapper e.K.",
      "company_seat": "Bremen",
      "details": "11.06.2025 (Bekanntmachungsdatum)\n\nBremen Amtsgericht Bremen HRA 30696\nRegisterbekanntmachung nach dem Umwandlungsgesetz 05.06.2025 (Eintragungsdatum)\n\nBjarne Klapper e.K.\nEinzelkaufmann / Einzelkauffrau\nBremen\n\nZu Eintragungsnummer 1 vom 05.06.2025 wird als nicht eingetragen veröffentlicht: Den Gläubigern der an der Verschmelzung beteiligten Rechtsträger ist, wenn sie binnen sechs Monaten nach dem Tag, an dem die Eintragung der Verschmelzung in das Register des Sitzes desjenigen Rechtsträgers, dessen Gläubiger sie sind, als bekannt gemacht gilt, ihren Anspruch nach Grund und Höhe schriftlich anmelden, Sicherheit zu leisten, soweit sie nicht Befriedigung verlangen können. Dieses Recht steht den Gläubigern jedoch nur zu, wenn sie glaubhaft machen, dass durch die Verschmelzung die Erfüllung ihrer Forderung gefährdet wird. Das Recht, Sicherheitsleistung zu verlangen, steht Gläubigern nicht zu, die im Falle der Insolvenz ein Recht auf vorzugsweise Befriedigung aus einer Deckungsmasse haben, die nach gesetzlicher Vorschrift zu ihrem Schutz errichtet und staatlich überwacht ist."
    },
    {
      "date": "2025-06-11",
      "id": "111838",
      "original_text": "Löschungsankündigung\nRheinland-Pfalz Amtsgericht Ludwigshafen a.Rhein (Ludwigshafen) HRB 67314\nM.A.S. Anlagenbau UG (haftungsbeschränkt) – Ludwigshafen am Rhein",
      "type": "Löschungsankündigung",
      "state": "Rheinland-Pfalz",
      "amtsgericht": "Amtsgericht Ludwigshafen a.Rhein (Ludwigshafen)",
      "registernummer": "HRB 67314",
      "registerart": "HRB",
      "company_name": "M.A.S. Anlagenbau UG (haftungsbeschränkt)",
      "company_seat": "Ludwigshafen am Rhein",
      "details": "11.06.2025 (Bekanntmachungsdatum)\n\nRheinland-Pfalz Amtsgericht Ludwigshafen a.Rhein (Ludwigshafen) HRB 67314\nLöschungsankündigung\n\nM.A.S. Anlagenbau UG (haftungsbeschränkt)\nGesellschaft mit beschränkter Haftung\nLudwigshafen am Rhein\n\nDas Registergericht beabsichtigt die Genossenschaft von Amts wegen nach § 395 FamFG zu löschen. Die Frist zur Erhebung eines Widerspruchs ist auf drei Monate festgesetzt."
    },
    {
      "date": "2025-06-11",
      "id": "111839",
      "original_text": "Löschungsankündigung\nRheinland-Pfalz Amtsgericht Ludwigshafen a.Rhein (Ludwigshafen) HRB 31177\nWolfgang Maurer Maschinenservice GmbH – Ebertsheim",
      "type": "Löschungsankündigung",
      "state": "Rheinland-Pfalz",
      "amtsgericht": "Amtsgericht Ludwigshafen a.Rhein (Ludwigshafen)",
      "registernummer": "HRB 31177",
      "registerart": "HRB",
      "company_name": "Wolfgang Maurer Maschinenservice GmbH",
      "company_seat": "Ebertsheim",
      "details": "11.06.2025 (Bekanntmachungsdatum)\n\nRheinland-Pfalz Amtsgericht Ludwigshafen a.Rhein (Ludwigshafen) HRB 31177\nLöschungsankündigung\n\nWolfgang Maurer Maschinenservice GmbH\nGesellschaft mit beschränkter Haftung\nEbertsheim\n\nDas Registergericht beabsichtigt die Gesellschaft von Amts wegen nach § 394 FamFG zu löschen. Die Frist zur Erhebung eines Widerspruchs ist auf einen Monat festgesetzt."
    },
    {
      "date": "2025-06-11",
      "id": "111840",
      "original_text": "Registerbekanntmachung nach dem Umwandlungsgesetz\nRheinland-Pfalz Amtsgericht Bad Kreuznach HRA 11559\nWORLD WIDE GEMS Edelsteinhandel Inh. Ramesh Agrawal – Idar-Oberstein",
      "type": "Registerbekanntmachung nach dem Umwandlungsgesetz",
      "state": "Rheinland-Pfalz",
      "amtsgericht": "Amtsgericht Bad Kreuznach",
      "registernummer": "HRA 11559",
      "registerart": "HRA",
      "company_name": "WORLD WIDE GEMS Edelsteinhandel Inh. Ramesh Agrawal",
      "company_seat": "Idar-Oberstein",
      "details": "11.06.2025 (Bekanntmachungsdatum)\n\nRheinland-Pfalz Amtsgericht Bad Kreuznach HRA 11559\nRegisterbekanntmachung nach dem Umwandlungsgesetz 11.06.2025 (Eintragungsdatum)\n\nWORLD WIDE GEMS Edelsteinhandel Inh. Ramesh Agrawal\nEinzelkaufmann / Einzelkauffrau\nIdar-Oberstein\n\nAls nicht eingetragen wird veröffentlicht: Den Gläubigern der an der Ausgliederung beteiligten Rechtsträger ist, wenn sie binnen sechs Monaten nach dem Tag, an dem die Eintragung der Ausgliederung in das Register des Sitzes desjenigen Rechtsträgers, dessen Gläubiger sie sind, nach § 19 Abs. 3 UmwG als bekannt gemacht gilt, ihren Anspruch nach Grund und Höhe schriftlich anmelden, Sicherheit zu leisten, soweit sie nicht Befriedigung verlangen können. Dieses Recht steht den Gläubigern jedoch nur zu, wenn sie glaubhaft machen, dass durch die Ausgliederung die Erfüllung der Forderung gefährdet wird."
    },
    {
      "date": "2025-06-11",
      "id": "111841",
      "original_text": "Registerbekanntmachung nach dem Umwandlungsgesetz\nRheinland-Pfalz Amtsgericht Montabaur HRB 21802\nNiedax CMS (Cable Management Systems) GmbH – Linz",
      "type": "Registerbekanntmachung nach dem Umwandlungsgesetz",
      "state": "Rheinland-Pfalz",
      "amtsgericht": "Amtsgericht Montabaur",
      "registernummer": "HRB 21802",
      "registerart": "HRB",
      "company_name": "Niedax CMS (Cable Management Systems) GmbH",
      "company_seat": "Linz",
      "details": "11.06.2025 (Bekanntmachungsdatum)\n\nRheinland-Pfalz Amtsgericht Montabaur HRB 21802\nRegisterbekanntmachung nach dem Umwandlungsgesetz 11.06.2025 (Eintragungsdatum)\n\nNiedax CMS (Cable Management Systems) GmbH\nGesellschaft mit beschränkter Haftung\nLinz\n\nAls nicht eingetragen wird veröffentlicht: Den Gläubigern der an der Verschmelzung beteiligten Rechtsträger ist, wenn sie binnen sechs Monaten nach dem Tag, an dem die Eintragung der Verschmelzung in das Register des Sitzes desjenigen Rechtsträgers, dessen Gläubiger sie sind, nach § 19 Abs. 3 UmwG als bekannt gemacht gilt, ihren Anspruch nach Grund und Höhe schriftlich anmelden, Sicherheit zu leisten, soweit sie nicht Befriedigung verlangen können. Dieses Recht steht den Gläubigern jedoch nur zu, wenn sie glaubhaft machen, dass durch die Verschmelzung die Erfüllung der Forderung gefährdet wird."
    },
    {
      "date": "2025-06-11",
      "id": "111842",
      "original_text": "Registerbekanntmachung nach dem Umwandlungsgesetz\nRheinland-Pfalz Amtsgericht Bad Kreuznach HRA 21355\nWORLD WIDE GEMS Edelsteinhandel OHG – Idar-Oberstein",
      "type": "Registerbekanntmachung nach dem Umwandlungsgesetz",
      "state": "Rheinland-Pfalz",
      "amtsgericht": "Amtsgericht Bad Kreuznach",
      "registernummer": "HRA 21355",
      "registerart": "HRA",
      "company_name": "WORLD WIDE GEMS Edelsteinhandel OHG",
      "company_seat": "Idar-Oberstein",
      "details": "11.06.2025 (Bekanntmachungsdatum)\n\nRheinland-Pfalz Amtsgericht Bad Kreuznach HRA 21355\nRegisterbekanntmachung nach dem Umwandlungsgesetz 11.06.2025 (Eintragungsdatum)\n\nWORLD WIDE GEMS Edelsteinhandel OHG\nOffene Handelsgesellschaft\nIdar-Oberstein\n\nAls nicht eingetragen wird veröffentlicht: Den Gläubigern der an der Ausgliederung beteiligten Rechtsträger ist, wenn sie binnen sechs Monaten nach dem Tag, an dem die Eintragung der Ausgliederung in das Register des Sitzes desjenigen Rechtsträgers, dessen Gläubiger sie sind, nach § 19 Abs. 3 UmwG als bekannt gemacht gilt, ihren Anspruch nach Grund und Höhe schriftlich anmelden, Sicherheit zu leisten, soweit sie nicht Befriedigung verlangen können. Dieses Recht steht den Gläubigern jedoch nur zu, wenn sie glaubhaft machen, dass durch die Ausgliederung die Erfüllung der Forderung gefährdet wird."
    },
    {
      "date": "2025-06-11",
      "id": "111843",
      "original_text": "Löschungsankündigung\nRheinland-Pfalz Amtsgericht Bad Kreuznach HRB 24040\nAkce GmbH – Bad Kreuznach",
      "type": "Löschungsankündigung",
      "state": "Rheinland-Pfalz",
      "amtsgericht": "Amtsgericht Bad Kreuznach",
      "registernummer": "HRB 24040",
      "registerart": "HRB",
      "company_name": "Akce GmbH",
      "company_seat": "Bad Kreuznach",
      "details": "11.06.2025 (Bekanntmachungsdatum)\n\nRheinland-Pfalz Amtsgericht Bad Kreuznach HRB 24040\nLöschungsankündigung\n\nAkce GmbH\nGesellschaft mit beschränkter Haftung\nBad Kreuznach\n\nDas Registergericht beabsichtigt die Gesellschaft wegen Vermögenslosigkeit im Handelsregister von Amts wegen nach § 394 FamFG zu löschen. Die Frist zur Erhebung eines Widerspruchs gegen die beabsichtigte Löschung ist auf einen Monat ab Veröffentlichung bestimmt."
    },
    {
      "date": "2025-06-11",
      "id": "111844",
      "original_text": "Registerbekanntmachung nach dem Umwandlungsgesetz\nNordrhein-Westfalen Amtsgericht Aachen HRB 28677\nWest Pharmaceutical Services European Holdings I GmbH – Eschweiler",
      "type": "Registerbekanntmachung nach dem Umwandlungsgesetz",
      "state": "Nordrhein-Westfalen",
      "amtsgericht": "Amtsgericht Aachen",
      "registernummer": "HRB 28677",
      "registerart": "HRB",
      "company_name": "West Pharmaceutical Services European Holdings I GmbH",
      "company_seat": "Eschweiler",
      "details": "11.06.2025 (Bekanntmachungsdatum)\n\nNordrhein-Westfalen Amtsgericht Aachen HRB 28677\nRegisterbekanntmachung nach dem Umwandlungsgesetz\n\nWest Pharmaceutical Services European Holdings I GmbH\nGesellschaft mit beschränkter Haftung\nEschweiler\n\nDem Registergericht ist der Entwurf eines Verschmelzungsplanes über die geplante Verschmelzung der S.A.S. eine vereinfachte\nAktiengesellschaft nach französischem\nRecht unter Firma West\nPharmaceutical Services Holding France\nS.A.S mit Sitz in Le Nouvion-en-Thiérache, Frankreich (Handelsgerichts\nSaint-Quentin, Frankreich, unter der Nummer SIREN 428 747 760) mit der Gesellschaft mit beschränkter Haftung nach deutschem\nRecht unter Firma West Pharmaceutical Services European\nHoldings I GmbH mit Sitz in Eschweiler (Amtsgerichts Aachen HRB 28677) eingereicht worden."
    },
    {
      "date": "2025-06-11",
      "id": "111845",
      "original_text": "Einreichung neuer Dokumente\nRheinland-Pfalz Amtsgericht Landau HRB 31978\nNolte GmbH & Co. KGaA – Germersheim",
      "type": "Einreichung neuer Dokumente",
      "state": "Rheinland-Pfalz",
      "amtsgericht": "Amtsgericht Landau",
      "registernummer": "HRB 31978",
      "registerart": "HRB",
      "company_name": "Nolte GmbH & Co. KGaA",
      "company_seat": "Germersheim",
      "details": "11.06.2025 (Bekanntmachungsdatum)\n\nRheinland-Pfalz Amtsgericht Landau HRB 31978\nEinreichung neuer Dokumente\n\nNolte GmbH & Co. KGaA\nKommanditgesellschaft auf Aktien\nGermersheim\n\nDem Registergericht ist eine neue Liste der Mitglieder des Aufsichtsrates eingereicht worden."
    },
    {
      "date": "2025-06-11",
      "id": "111846",
      "original_text": "Registerbekanntmachung nach dem Umwandlungsgesetz\nNordrhein-Westfalen Amtsgericht Siegburg HRB 6832\nMartin Nickel GmbH – Bad Honnef",
      "type": "Registerbekanntmachung nach dem Umwandlungsgesetz",
      "state": "Nordrhein-Westfalen",
      "amtsgericht": "Amtsgericht Siegburg",
      "registernummer": "HRB 6832",
      "registerart": "HRB",
      "company_name": "Martin Nickel GmbH",
      "company_seat": "Bad Honnef",
      "details": "11.06.2025 (Bekanntmachungsdatum)\n\nNordrhein-Westfalen Amtsgericht Siegburg HRB 6832\nRegisterbekanntmachung nach dem Umwandlungsgesetz 11.06.2025 (Eintragungsdatum)\n\nMartin Nickel GmbH\nGesellschaft mit beschränkter Haftung\nBad Honnef\n\nDen Gläubigern der an der Verschmelzung beteiligten Rechtsträger ist, wenn sie binnen sechs Monaten nach dem Tag, an dem die Eintragung der Verschmelzung in das Register des Sitzes desjenigen Rechtsträgers, dessen Gläubiger sie sind, nach § 19 Absatz 3 UmwG als bekanntgemacht gilt, ihren Anspruch nach Grund und Höhe schriftlich anmelden, Sicherheit zu leisten, soweit sie nicht Befriedigung verlangen können. Dieses Recht steht den Gläubigern jedoch nur zu, wenn sie glaubhaft machen, dass durch die Verschmelzung die Erfüllung ihrer Forderung gefährdet wird."
    },
    {
      "date": "2025-06-11",
      "id": "111847",
      "original_text": "Löschungsankündigung\nNordrhein-Westfalen Amtsgericht Kleve HRB 17468\nKLG Vermögensverwaltungs GmbH – Rees",
      "type": "Löschungsankündigung",
      "state": "Nordrhein-Westfalen",
      "amtsgericht": "Amtsgericht Kleve",
      "registernummer": "HRB 17468",
      "registerart": "HRB",
      "company_name": "KLG Vermögensverwaltungs GmbH",
      "company_seat": "Rees",
      "details": "11.06.2025 (Bekanntmachungsdatum)\n\nNordrhein-Westfalen Amtsgericht Kleve HRB 17468\nLöschungsankündigung\n\nKLG Vermögensverwaltungs GmbH\nGesellschaft mit beschränkter Haftung\nRees\n\nDas Registergericht beabsichtigt die Gesellschaft von Amts wegen nach § 394 FamFG zu löschen. Die Frist zur Erhebung eines Widerspruchs ist auf einen Monat festgesetzt."
    },
    {
      "date": "2025-06-11",
      "id": "111848",
      "original_text": "Löschungsankündigung\nNordrhein-Westfalen Amtsgericht Köln HRB 108800\nM.D.M Food GmbH – Wesseling",
      "type": "Löschungsankündigung",
      "state": "Nordrhein-Westfalen",
      "amtsgericht": "Amtsgericht Köln",
      "registernummer": "HRB 108800",
      "registerart": "HRB",
      "company_name": "M.D.M Food GmbH",
      "company_seat": "Wesseling",
      "details": "11.06.2025 (Bekanntmachungsdatum)\n\nNordrhein-Westfalen Amtsgericht Köln HRB 108800\nLöschungsankündigung\n\nM.D.M Food GmbH\nGesellschaft mit beschränkter Haftung\nWesseling\n\nDas Registergericht beabsichtigt die Gesellschaft von Amts wegen nach § 394 FamFG zu löschen. Die Frist zur Erhebung eines Widerspruchs ist auf einen Monat festgesetzt."
    },
    {
      "date": "2025-06-11",
      "id": "111849",
      "original_text": "Registerbekanntmachung nach dem Umwandlungsgesetz\nNordrhein-Westfalen Amtsgericht Arnsberg HRB 12261\nM & H Grundbesitz UG (haftungsbeschränkt) – Werl",
      "type": "Registerbekanntmachung nach dem Umwandlungsgesetz",
      "state": "Nordrhein-Westfalen",
      "amtsgericht": "Amtsgericht Arnsberg",
      "registernummer": "HRB 12261",
      "registerart": "HRB",
      "company_name": "M & H Grundbesitz UG (haftungsbeschränkt)",
      "company_seat": "Werl",
      "details": "11.06.2025 (Bekanntmachungsdatum)\n\nNordrhein-Westfalen Amtsgericht Arnsberg HRB 12261\nRegisterbekanntmachung nach dem Umwandlungsgesetz 11.06.2025 (Eintragungsdatum)\n\nM & H Grundbesitz UG (haftungsbeschränkt)\nGesellschaft mit beschränkter Haftung\nWerl\n\nDen Gläubigern der an der Verschmelzung beteiligten Rechtsträger ist, wenn sie binnen sechs Monaten nach dem Tag, an dem die Eintragung der Verschmelzung in das Register des Sitzes desjenigen Rechtsträgers, dessen Gläubiger sie sind, nach § 19 Absatz 3 UmwG als bekanntgemacht gilt, ihren Anspruch nach Grund und Höhe schriftlich anmelden, Sicherheit zu leisten, soweit sie nicht Befriedigung verlangen können. Dieses Recht steht den Gläubigern jedoch nur zu, wenn sie glaubhaft machen, dass durch die Verschmelzung die Erfüllung ihrer Forderung gefährdet wird."
    },
    {
      "date": "2025-06-11",
      "id": "111850",
      "original_text": "Löschungsankündigung\nNordrhein-Westfalen Amtsgericht Aachen HRB 15564\nYOURS GmbH – Aachen",
      "type": "Löschungsankündigung",
      "state": "Nordrhein-Westfalen",
      "amtsgericht": "Amtsgericht Aachen",
      "registernummer": "HRB 15564",
      "registerart": "HRB",
      "company_name": "YOURS GmbH",
      "company_seat": "Aachen",
      "details": "11.06.2025 (Bekanntmachungsdatum)\n\nNordrhein-Westfalen Amtsgericht Aachen HRB 15564\nLöschungsankündigung\n\nYOURS GmbH\nGesellschaft mit beschränkter Haftung\nAachen\n\nDas Registergericht beabsichtigt, von Amts wegen die Gesellschaft wegen Vermögenslosigkeit nach § 394 FamFG zu löschen, nachdem der Geschäftsführer van Mil mit Schreiben vom\t03.01.2025 mitgeteilt hat, dass die Gesellschaft vollständig vermögenslos ist und auch das Finanzamt Aachen-Stadt keine Bedenken gegen eine Löschung geäußert hat.\nZur Geltendmachung des Widerspruchs gegen die beabsichtigte Löschung wird hiermit eine Frist von einem Monat ab Veröffentlichung dieser Ankündigung bestimmt.\nRechtsbehelfsbelehrung:\nGegen diese Verfügung kann Widerspruch eingelegt werden. Zum Widerspruch ist jeder berechtigt, der an der Unterlassung der Löschung ein berechtigtes Interesse hat.\nDer Widerspruch ist bei dem Amtsgericht Aachen, Adalbertsteinweg 92, 52070 Aachen schriftlich in deutscher Sprache oder zur Niederschrift der Geschäftsstelle einzulegen. Der Widerspruch kann auch zur Niederschrift der Geschäftsstelle eines jeden Amtsgerichtes abgegeben werden.\nDer Widerspruch muss spätestens innerhalb der gesetzten Frist nach der Bekanntgabe der Verfügung bei dem Amtsgericht Aachen eingegangen sein. Dies gilt auch dann, wenn der Widerspruch zur Niederschrift der Geschäftsstelle eines anderen Amtsgerichtes abgegeben wurde. Die Frist beginnt mit der Bekanntgabe der Verfügung durch Veröffentlichung. Fällt das Ende der Frist auf einen Sonntag, einen allgemeinen Feiertag oder Sonnabend, so endet die Frist mit Ablauf des nächsten Werktages.\nDer Widerspruch muss die Bezeichnung der angefochtenen Verfügung sowie die Erklärung enthalten, dass Widerspruch gegen diese Verfügung eingelegt wird. Er ist zu unterzeichnen und soll begründet werden.\nDie Einlegung ist auch durch Übertragung eines elektronischen Dokuments an die elektronische Poststelle des Gerichts möglich. Das elektronische Dokument muss für die Bearbeitung durch das Gericht geeignet und mit einer qualifizierten elektronischen Signatur der verantwortenden Person versehen sein oder von der verantwortenden Person signiert und auf einem sicheren Übermittlungsweg gemäß § 130 a ZPO nach näherer Maßgabe der Verordnung über die technischen Rahmenbedingungen des elektronischen Rechtsverkehrs und über das besondere elektronische Behördenpostfach (BGBl. I, S. 3803) eingereicht werden. Weitere Informationen erhalten Sie auf der Internetseite www.justiz.de."
    },
    {
      "date": "2025-06-11",
      "id": "111851",
      "original_text": "Löschungsankündigung\nNordrhein-Westfalen Amtsgericht Köln HRB 95388\nTT Bau und Handel GmbH – Köln",
      "type": "Löschungsankündigung",
      "state": "Nordrhein-Westfalen",
      "amtsgericht": "Amtsgericht Köln",
      "registernummer": "HRB 95388",
      "registerart": "HRB",
      "company_name": "TT Bau und Handel GmbH",
      "company_seat": "Köln",
      "details": "11.06.2025 (Bekanntmachungsdatum)\n\nNordrhein-Westfalen Amtsgericht Köln HRB 95388\nLöschungsankündigung\n\nTT Bau und Handel GmbH\nGesellschaft mit beschränkter Haftung\nKöln\n\nDas Registergericht beabsichtigt die Gesellschaft von Amts wegen nach § 394 FamFG zu löschen. Die Frist zur Erhebung eines Widerspruchs ist auf einen Monat festgesetzt."
    },
    {
      "date": "2025-06-11",
      "id": "111852",
      "original_text": "Löschungsankündigung\nNordrhein-Westfalen Amtsgericht Duisburg HRB 34743\nTaco Security, Detektei und Dienstleistung GmbH – Dinslaken",
      "type": "Löschungsankündigung",
      "state": "Nordrhein-Westfalen",
      "amtsgericht": "Amtsgericht Duisburg",
      "registernummer": "HRB 34743",
      "registerart": "HRB",
      "company_name": "Taco Security, Detektei und Dienstleistung GmbH",
      "company_seat": "Dinslaken",
      "details": "11.06.2025 (Bekanntmachungsdatum)\n\nNordrhein-Westfalen Amtsgericht Duisburg HRB 34743\nLöschungsankündigung\n\nTaco Security, Detektei und Dienstleistung GmbH\nGesellschaft mit beschränkter Haftung\nDinslaken\n\nDas Registergericht beabsichtigt, die im Handelsregister unter HRB 34743  eingetragene Gesellschaft Taco Security, Detektei und Dienstleistung GmbH gemäß § 394 FamFG wegen Vermögenslosigkeit von Amts wegen zu löschen. Gegen diese Verfügung kann Widerspruch eingelegt werden. Die Frist zur Erhebung eines Widerspruchs gegen die beabsichtigte Löschung von Amts wegen ist auf drei Monate festgesetzt. Rechtsbehelfsbelehrung Der Widerspruch ist bei dem Amtsgericht Duisburg, Kardinal-Galen-Str. 124-132, 47058 Duisburg schriftlich in deutscher Sprache oder zur Niederschrift der Geschäftsstelle einzulegen. Der Widerspruch kann auch zur Niederschrift der Geschäftsstelle eines jeden Amtsgerichtes abgegeben werden. Die Einlegung ist auch durch Übertragung eines elektronischen Dokuments an die elektronische Poststelle des Gerichts möglich. Das elektronische Dokument muss für die Bearbeitung durch das Gericht geeignet und mit einer qualifizierten elektronischen Signatur der verantwortenden Person versehen sein oder von der verantwortenden Person signiert und auf einem sicheren Übermittlungsweg gemäß § 130 a ZPO nach näherer Maßgabe der Verordnung über die technischen Rahmenbedingungen des elektronischen Rechtsverkehrs und über das besondere elektronische Behördenpostfach (BGBl. I, S. 3803) eingereicht werden. Weitere Informationen erhalten Sie auf der Internetseite www.justiz.de <http://www.justiz.de>. Der Widerspruch muss spätestens innerhalb der gesetzten Frist bei dem Amtsgericht Duisburg eingegangen sein. Dies gilt auch dann, wenn der Widerspruch zur Niederschrift der Geschäftsstelle eines anderen Amtsgerichtes abgegeben wurde. Die Frist beginnt mit der Veröffentlichung. Fällt das Ende der Frist auf einen Sonntag, einen allgemeinen Feiertag oder Sonnabend, so endet die Frist mit Ablauf des nächsten Werktages. Der Widerspruch muss die Bezeichnung der angefochtenen Verfügung sowie die Erklärung enthalten, dass Widerspruch gegen diese Verfügung eingelegt wird. Er ist zu unterzeichnen und soll begründet werden."
    },
    {
      "date": "2025-06-11",
      "id": "111853",
      "original_text": "Löschungsankündigung\nNordrhein-Westfalen Amtsgericht Köln HRB 102860\nMIW Immobilien GmbH – Kerpen",
      "type": "Löschungsankündigung",
      "state": "Nordrhein-Westfalen",
      "amtsgericht": "Amtsgericht Köln",
      "registernummer": "HRB 102860",
      "registerart": "HRB",
      "company_name": "MIW Immobilien GmbH",
      "company_seat": "Kerpen",
      "details": "11.06.2025 (Bekanntmachungsdatum)\n\nNordrhein-Westfalen Amtsgericht Köln HRB 102860\nLöschungsankündigung\n\nMIW Immobilien GmbH\nGesellschaft mit beschränkter Haftung\nKerpen\n\nDas Registergericht beabsichtigt die Gesellschaft von Amts wegen nach § 394 FamFG zu löschen. Die Frist zur Erhebung eines Widerspruchs ist auf einen Monat festgesetzt."
    },
    {
      "date": "2025-06-11",
      "id": "111854",
      "original_text": "Einreichung neuer Dokumente\nNordrhein-Westfalen Amtsgericht Duisburg HRB 1140\nStadtwerke Duisburg Aktiengesellschaft – Duisburg",
      "type": "Einreichung neuer Dokumente",
      "state": "Nordrhein-Westfalen",
      "amtsgericht": "Amtsgericht Duisburg",
      "registernummer": "HRB 1140",
      "registerart": "HRB",
      "company_name": "Stadtwerke Duisburg Aktiengesellschaft",
      "company_seat": "Duisburg",
      "details": "11.06.2025 (Bekanntmachungsdatum)\n\nNordrhein-Westfalen Amtsgericht Duisburg HRB 1140\nEinreichung neuer Dokumente\n\nStadtwerke Duisburg Aktiengesellschaft\nAktiengesellschaft\nDuisburg\n\nDem Registergericht sind neue Listen der Mitglieder des Aufsichtsrates eingereicht worden."
    },
    {
      "date": "2025-06-11",
      "id": "111855",
      "original_text": "Löschungsankündigung\nNordrhein-Westfalen Amtsgericht Köln HRB 113588\nbrightByte GmbH – Köln",
      "type": "Löschungsankündigung",
      "state": "Nordrhein-Westfalen",
      "amtsgericht": "Amtsgericht Köln",
      "registernummer": "HRB 113588",
      "registerart": "HRB",
      "company_name": "brightByte GmbH",
      "company_seat": "Köln",
      "details": "11.06.2025 (Bekanntmachungsdatum)\n\nNordrhein-Westfalen Amtsgericht Köln HRB 113588\nLöschungsankündigung\n\nbrightByte GmbH\nGesellschaft mit beschränkter Haftung\nKöln\n\nDas Registergericht beabsichtigt die Gesellschaft von Amts wegen nach § 394 FamFG zu löschen. Die Frist zur Erhebung eines Widerspruchs ist auf einen Monat festgesetzt."
    },
    {
      "date": "2025-06-11",
      "id": "111856",
      "original_text": "Einreichung neuer Dokumente\nNordrhein-Westfalen Amtsgericht Münster HRB 9692\nAGRAVIS RAIFFEISEN AG – Münster",
      "type": "Einreichung neuer Dokumente",
      "state": "Nordrhein-Westfalen",
      "amtsgericht": "Amtsgericht Münster",
      "registernummer": "HRB 9692",
      "registerart": "HRB",
      "company_name": "AGRAVIS RAIFFEISEN AG",
      "company_seat": "Münster",
      "details": "11.06.2025 (Bekanntmachungsdatum)\n\nNordrhein-Westfalen Amtsgericht Münster HRB 9692\nEinreichung neuer Dokumente\n\nAGRAVIS RAIFFEISEN AG\nAktiengesellschaft\nMünster\n\nDem Registergericht ist eine neue Liste der Mitglieder des Aufsichtsrates eingereicht worden."
    },
    {
      "date": "2025-06-11",
      "id": "111857",
      "original_text": "Löschungsankündigung\nNordrhein-Westfalen Amtsgericht Wuppertal HRB 32901\nBASGON GmbH – Remscheid",
      "type": "Löschungsankündigung",
      "state": "Nordrhein-Westfalen",
      "amtsgericht": "Amtsgericht Wuppertal",
      "registernummer": "HRB 32901",
      "registerart": "HRB",
      "company_name": "BASGON GmbH",
      "company_seat": "Remscheid",
      "details": "11.06.2025 (Bekanntmachungsdatum)\n\nNordrhein-Westfalen Amtsgericht Wuppertal HRB 32901\nLöschungsankündigung\n\nBASGON GmbH\nGesellschaft mit beschränkter Haftung\nRemscheid\n\nDas Registergericht beabsichtigt die Gesellschaft von Amts wegen nach § 394 FamFG zu löschen. Die Frist zur Erhebung eines Widerspruchs ist auf einen Monat festgesetzt."
    },
    {
      "date": "2025-06-11",
      "id": "111858",
      "original_text": "Registerbekanntmachung nach dem Umwandlungsgesetz\nNordrhein-Westfalen Amtsgericht Siegburg HRB 8325\nDIVE4LIFE GmbH – Siegburg",
      "type": "Registerbekanntmachung nach dem Umwandlungsgesetz",
      "state": "Nordrhein-Westfalen",
      "amtsgericht": "Amtsgericht Siegburg",
      "registernummer": "HRB 8325",
      "registerart": "HRB",
      "company_name": "DIVE4LIFE GmbH",
      "company_seat": "Siegburg",
      "details": "11.06.2025 (Bekanntmachungsdatum)\n\nNordrhein-Westfalen Amtsgericht Siegburg HRB 8325\nRegisterbekanntmachung nach dem Umwandlungsgesetz 11.06.2025 (Eintragungsdatum)\n\nDIVE4LIFE GmbH\nGesellschaft mit beschränkter Haftung\nSiegburg\n\nDen Gläubigern der an der Verschmelzung beteiligten Rechtsträger ist, wenn sie binnen sechs Monaten nach dem Tag, an dem die Eintragung der Verschmelzung in das Register des Sitzes desjenigen Rechtsträgers, dessen Gläubiger sie sind, nach § 19 Absatz 3 UmwG als bekanntgemacht gilt, ihren Anspruch nach Grund und Höhe schriftlich anmelden, Sicherheit zu leisten, soweit sie nicht Befriedigung verlangen können. Dieses Recht steht den Gläubigern jedoch nur zu, wenn sie glaubhaft machen, dass durch die Verschmelzung die Erfüllung ihrer Forderung gefährdet wird."
    },
    {
      "date": "2025-06-11",
      "id": "111859",
      "original_text": "Löschungsankündigung\nNordrhein-Westfalen Amtsgericht Kleve HRB 18093\nTaurus Baukonzept GmbH – Moers",
      "type": "Löschungsankündigung",
      "state": "Nordrhein-Westfalen",
      "amtsgericht": "Amtsgericht Kleve",
      "registernummer": "HRB 18093",
      "registerart": "HRB",
      "company_name": "Taurus Baukonzept GmbH",
      "company_seat": "Moers",
      "details": "11.06.2025 (Bekanntmachungsdatum)\n\nNordrhein-Westfalen Amtsgericht Kleve HRB 18093\nLöschungsankündigung\n\nTaurus Baukonzept GmbH\nGesellschaft mit beschränkter Haftung\nMoers\n\nDas Registergericht beabsichtigt die Gesellschaft von Amts wegen nach § 394 FamFG zu löschen. Die Frist zur Erhebung eines Widerspruchs ist auf einen Monat festgesetzt."
    },
    {
      "date": "2025-06-11",
      "id": "111860",
      "original_text": "Registerbekanntmachung nach dem Umwandlungsgesetz\nNordrhein-Westfalen Amtsgericht Duisburg HRB 39194\nlK Umwelt Duisburg GmbH – Duisburg",
      "type": "Registerbekanntmachung nach dem Umwandlungsgesetz",
      "state": "Nordrhein-Westfalen",
      "amtsgericht": "Amtsgericht Duisburg",
      "registernummer": "HRB 39194",
      "registerart": "HRB",
      "company_name": "lK Umwelt Duisburg GmbH",
      "company_seat": "Duisburg",
      "details": "11.06.2025 (Bekanntmachungsdatum)\n\nNordrhein-Westfalen Amtsgericht Duisburg HRB 39194\nRegisterbekanntmachung nach dem Umwandlungsgesetz 11.06.2025 (Eintragungsdatum)\n\nlK Umwelt Duisburg GmbH\nGesellschaft mit beschränkter Haftung\nDuisburg\n\nDie Gesellschaft hat Gläubigern, deren Forderungen vor dieser Bekanntmachung begründet worden sind, Sicherheit zu leisten, soweit sie nicht Befriedigung verlangen können, wenn sie sich binnen sechs Monaten zu diesem Zweck melden."
    },
    {
      "date": "2025-06-11",
      "id": "111861",
      "original_text": "Löschungsankündigung\nNordrhein-Westfalen Amtsgericht Köln HRB 116161\nFurana Fullmoon UG (haftungsbeschränkt) – Köln",
      "type": "Löschungsankündigung",
      "state": "Nordrhein-Westfalen",
      "amtsgericht": "Amtsgericht Köln",
      "registernummer": "HRB 116161",
      "registerart": "HRB",
      "company_name": "Furana Fullmoon UG (haftungsbeschränkt)",
      "company_seat": "Köln",
      "details": "11.06.2025 (Bekanntmachungsdatum)\n\nNordrhein-Westfalen Amtsgericht Köln HRB 116161\nLöschungsankündigung\n\nFurana Fullmoon UG (haftungsbeschränkt)\nGesellschaft mit beschränkter Haftung\nKöln\n\nDas Registergericht beabsichtigt die Gesellschaft von Amts wegen nach § 394 FamFG zu löschen. Die Frist zur Erhebung eines Widerspruchs ist auf einen Monat festgesetzt."
    },
    {
      "date": "2025-06-11",
      "id": "111862",
      "original_text": "Sonstige Registerbekanntmachung\nNordrhein-Westfalen Amtsgericht Paderborn HRB 8515\nSeniorat Bad Driburg GmbH – Bad Driburg",
      "type": "Sonstige Registerbekanntmachung",
      "state": "Nordrhein-Westfalen",
      "amtsgericht": "Amtsgericht Paderborn",
      "registernummer": "HRB 8515",
      "registerart": "HRB",
      "company_name": "Seniorat Bad Driburg GmbH",
      "company_seat": "Bad Driburg",
      "details": "11.06.2025 (Bekanntmachungsdatum)\n\nNordrhein-Westfalen Amtsgericht Paderborn HRB 8515\nSonstige Registerbekanntmachung 11.06.2025 (Eintragungsdatum)\n\nSeniorat Bad Driburg GmbH\nGesellschaft mit beschränkter Haftung\nBad Driburg\n\nAls nicht eingetragen wird veröffentlicht: Den Gläubigern der Gesellschaft, deren Forderungen begründet worden sind bevor die Eintragung der Beendigung des Beherrschungs- und Gewinnabführungsvertrages  in das Handelsregister nach § 10 des Handelsgesetzbuches als bekanntgemacht gilt, hat der andere Vertragsteil Sicherheit zu leisten, wenn sie sich binnen sechs Monaten nach der Bekanntmachung der Eintragung zu diesem Zweck bei ihm melden."
    },
    {
      "date": "2025-06-11",
      "id": "111863",
      "original_text": "Löschungsankündigung\nNordrhein-Westfalen Amtsgericht Gelsenkirchen HRB 15233\nAcolor UG (haftungsbeschränkt) – Gelsenkirchen",
      "type": "Löschungsankündigung",
      "state": "Nordrhein-Westfalen",
      "amtsgericht": "Amtsgericht Gelsenkirchen",
      "registernummer": "HRB 15233",
      "registerart": "HRB",
      "company_name": "Acolor UG (haftungsbeschränkt)",
      "company_seat": "Gelsenkirchen",
      "details": "11.06.2025 (Bekanntmachungsdatum)\n\nNordrhein-Westfalen Amtsgericht Gelsenkirchen HRB 15233\nLöschungsankündigung\n\nAcolor UG (haftungsbeschränkt)\nGesellschaft mit beschränkter Haftung\nGelsenkirchen\n\nDas Gericht beabsichtigt, die Gesellschaft Acolor UG (haftungsbeschränkt) mit Sitz in Gelsenkirchen, HRB 15233 Amtsgericht Gelsenkirchen, wegen Vermögenslosigkeit zu löschen.\n\nHiermit wird denjenigen, die an der Unterlassung der Löschung ein berechtigtes Interesse haben, gem. § 394 Abs. 2 FamFG Gelegenheit gegeben, gegen dieses Vorhaben binnen eines Monats nach dieser Bekanntmachung Widerspruch einzulegen. Der Widerspruch kann schriftlich oder zu Protokoll der Geschäftsstelle erhoben werden."
    },
    {
      "date": "2025-06-11",
      "id": "111864",
      "original_text": "Löschungsankündigung\nNordrhein-Westfalen Amtsgericht Köln HRB 93740\nNBP NeuBauProjekt GmbH – Köln",
      "type": "Löschungsankündigung",
      "state": "Nordrhein-Westfalen",
      "amtsgericht": "Amtsgericht Köln",
      "registernummer": "HRB 93740",
      "registerart": "HRB",
      "company_name": "NBP NeuBauProjekt GmbH",
      "company_seat": "Köln",
      "details": "11.06.2025 (Bekanntmachungsdatum)\n\nNordrhein-Westfalen Amtsgericht Köln HRB 93740\nLöschungsankündigung\n\nNBP NeuBauProjekt GmbH\nGesellschaft mit beschränkter Haftung\nKöln\n\nDas Registergericht beabsichtigt die Gesellschaft von Amts wegen nach § 394 FamFG zu löschen. Die Frist zur Erhebung eines Widerspruchs ist auf einen Monat festgesetzt."
    },
    {
      "date": "2025-06-11",
      "id": "111865",
      "original_text": "Löschungsankündigung\nNordrhein-Westfalen Amtsgericht Wuppertal HRB 28807\nDPW Demolition Patrick Wuppertal UG (haftungsbeschränkt) – Wuppertal",
      "type": "Löschungsankündigung",
      "state": "Nordrhein-Westfalen",
      "amtsgericht": "Amtsgericht Wuppertal",
      "registernummer": "HRB 28807",
      "registerart": "HRB",
      "company_name": "DPW Demolition Patrick Wuppertal UG (haftungsbeschränkt)",
      "company_seat": "Wuppertal",
      "details": "11.06.2025 (Bekanntmachungsdatum)\n\nNordrhein-Westfalen Amtsgericht Wuppertal HRB 28807\nLöschungsankündigung\n\nDPW Demolition Patrick Wuppertal UG (haftungsbeschränkt)\nGesellschaft mit beschränkter Haftung\nWuppertal\n\nDas Registergericht beabsichtigt die Gesellschaft von Amts wegen nach § 394 FamFG zu löschen. Die Frist zur Erhebung eines Widerspruchs ist auf einen Monat festgesetzt."
    },
    {
      "date": "2025-06-11",
      "id": "111866",
      "original_text": "Löschungsankündigung\nNordrhein-Westfalen Amtsgericht Dortmund HRA 13103\nDS-Rendite-Fonds Nr. 47 MS Cape Norman GmbH & Co. Containerschiff KG – Dortmund",
      "type": "Löschungsankündigung",
      "state": "Nordrhein-Westfalen",
      "amtsgericht": "Amtsgericht Dortmund",
      "registernummer": "HRA 13103",
      "registerart": "HRA",
      "company_name": "DS-Rendite-Fonds Nr. 47 MS Cape Norman GmbH & Co. Containerschiff KG",
      "company_seat": "Dortmund",
      "details": "11.06.2025 (Bekanntmachungsdatum)\n\nNordrhein-Westfalen Amtsgericht Dortmund HRA 13103\nLöschungsankündigung\n\nDS-Rendite-Fonds Nr. 47 MS Cape Norman GmbH & Co. Containerschiff KG\nKommanditgesellschaft\nDortmund\n\nDas Registergericht beabsichtigt die Firma von Amts wegen nach § 394 FamFG zu löschen. Die Frist zur Erhebung eines Widerspruchs ist auf drei Monate festgesetzt."
    },
    {
      "date": "2025-06-11",
      "id": "111867",
      "original_text": "Löschungsankündigung\nNordrhein-Westfalen Amtsgericht Gütersloh HRB 5846\nThase GmbH – Rheda-Wiedenbrück",
      "type": "Löschungsankündigung",
      "state": "Nordrhein-Westfalen",
      "amtsgericht": "Amtsgericht Gütersloh",
      "registernummer": "HRB 5846",
      "registerart": "HRB",
      "company_name": "Thase GmbH",
      "company_seat": "Rheda-Wiedenbrück",
      "details": "11.06.2025 (Bekanntmachungsdatum)\n\nNordrhein-Westfalen Amtsgericht Gütersloh HRB 5846\nLöschungsankündigung\n\nThase GmbH\nGesellschaft mit beschränkter Haftung\nRheda-Wiedenbrück\n\nDas Registergericht beabsichtigt die Gesellschaft von Amts wegen nach § 394 FamFG zu löschen. Die Frist zur Erhebung eines Widerspruchs ist auf einen Monat festgesetzt."
    },
    {
      "date": "2025-06-11",
      "id": "111868",
      "original_text": "Registerbekanntmachung nach dem Umwandlungsgesetz\nHessen Amtsgericht Frankfurt am Main HRB 137573\nFREY Berlin Property 3 GmbH – Frankfurt am Main",
      "type": "Registerbekanntmachung nach dem Umwandlungsgesetz",
      "state": "Hessen",
      "amtsgericht": "Amtsgericht Frankfurt am Main",
      "registernummer": "HRB 137573",
      "registerart": "HRB",
      "company_name": "FREY Berlin Property 3 GmbH",
      "company_seat": "Frankfurt am Main",
      "details": "11.06.2025 (Bekanntmachungsdatum)\n\nHessen Amtsgericht Frankfurt am Main HRB 137573\nRegisterbekanntmachung nach dem Umwandlungsgesetz\n\nFREY Berlin Property 3 GmbH\nGesellschaft mit beschränkter Haftung\nFrankfurt am Main\n\nHRB 137573: FREY Berlin Property 3 GmbH, Frankfurt am Main, Rahrsberg 7, 29614 Soltau. Dem Registergericht ist der Entwurf eines Formwechselplans über die geplante grenzüberschreitende Umwandlung der FREY Berlin Property 3 GmbH mit Sitz in Frankfurt am Main (Gesellschaft mit beschränkter Haftung, eingetragen beim Amtsgericht Frankfurt am Main unter HRB 137573) in eine soci6t responsabilit6 Iimite (Gesellschaft mit beschränkter Haftung) nach dem Recht des Großherzogtums Luxemburg mit voraussichtlicher Firma FREY Berlin Property 3 S.ä r.l., unter gleichzeitiger Sitzverlegung nach Luxemburg, einzutragen in das Handelsregister von Luxemburg (Registre de Commerce et des Socits), eingereicht worden. Die Gesellschaft hat darauf hingewiesen, dass Gläubiger, Anteilsinhaber und etwaige andere Berechtigte gemäß § 336, § 308 Abs. 1 Satz 2 Nr. 4 a) und b) UmwG, der Gesellschaft spätestens fünf (5) Arbeitstage vor dem Tag der Gesellschafterversammlung Bemerkungen zum Formwechselplan übermitteln können.\n\nDen Gläubigern der übertragenden Gesellschaft ist Sicherheit zu leisten, wenn sie innerhalb einer Frist von drei Monaten nach Bekanntmachung des Formwechselplans glaubhaft machen, dass durch de  Formwechsel die Erfüllung ihrer Forderung gefährdet wird. Die Anteilseigner der übertragenden Gesellschaft haben bei grenzüberschreitenden Formwechseln einen Anspruch auf angemessene Abfindung, sofern sie dem Formwechselwidersprochen haben; gegebenenfalls steht ihnen auch ein Anspruch auf bare Zuzahlung zu; §§ 341, 314 UmwG.\n\nDie Gesellschaft hat weder Arbeitnehmer noch einen Betriebsrat. Den Gläubigern der Gesellschaft stehen hinsichtlich der grenzüberschreitenden Umwandlung (Formwechsel) die folgenden Rechte zu: Den Gläubigern der die Rechtsform wechselnden Gesellschaft ist, wenn sie binnen sechs (6) Monaten nach dem Tag, an dem die Eintragung der formwechselnden Umwandlung in das Register des Sitzes desjenigen Rechtsträgers, dessen Gläubiger sie sind, nach § 336, § 308 Abs. 1 Satz 2 UmwG bekannt gemacht worden ist, ihren Anspruch nach Grund und Höhe schriftlich bei der Gesellschaft unter der Anschrift: 16 Rue Eugne Ruppert, 2453 Luxemburg, Großherzogtum Luxemburg, anmelden, Sicherheit zu leisten, soweit sie nicht Befriedigung verlangen können.\nDieses Recht steht den Gläubigern jedoch nur zu, wenn sie glaubhaft machen, dass durch die grenzüberschreitende formwechselnde Umwandlung die Erfüllung ihrer Forderung gefährdet wird. Bei der Gesellschaft, unter der Anschrift 16 Rue Eugne Ruppert, 2453 Luxemburg,\nGroßherzogtum Luxemburg, können vollständige Auskünfte über die Modalitäten für die Ausübung der Rechte der Gläubiger kostenlos eingeholt werden."
    },
    {
      "date": "2025-06-11",
      "id": "111869",
      "original_text": "Einreichung neuer Dokumente\nHessen Amtsgericht Frankfurt am Main HRB 7042\nFraport AG Frankfurt Airport Services Worldwide – Frankfurt am Main",
      "type": "Einreichung neuer Dokumente",
      "state": "Hessen",
      "amtsgericht": "Amtsgericht Frankfurt am Main",
      "registernummer": "HRB 7042",
      "registerart": "HRB",
      "company_name": "Fraport AG Frankfurt Airport Services Worldwide",
      "company_seat": "Frankfurt am Main",
      "details": "11.06.2025 (Bekanntmachungsdatum)\n\nHessen Amtsgericht Frankfurt am Main HRB 7042\nEinreichung neuer Dokumente\n\nFraport AG Frankfurt Airport Services Worldwide\nAktiengesellschaft\nFrankfurt am Main\n\nDurch eine Änderung in den Personen der Aufsichtsratsmitglieder ist eine Liste der Mitglieder des Aufsichtsrates zum Handelsregister eingereicht worden."
    },
    {
      "date": "2025-06-11",
      "id": "111870",
      "original_text": "Registerbekanntmachung nach dem Umwandlungsgesetz\nHessen Amtsgericht Frankfurt am Main HRB 90198\nGazit Immobilien Motorama München GmbH – Eschborn",
      "type": "Registerbekanntmachung nach dem Umwandlungsgesetz",
      "state": "Hessen",
      "amtsgericht": "Amtsgericht Frankfurt am Main",
      "registernummer": "HRB 90198",
      "registerart": "HRB",
      "company_name": "Gazit Immobilien Motorama München GmbH",
      "company_seat": "Eschborn",
      "details": "11.06.2025 (Bekanntmachungsdatum)\n\nHessen Amtsgericht Frankfurt am Main HRB 90198\nRegisterbekanntmachung nach dem Umwandlungsgesetz 11.06.2025 (Eintragungsdatum)\n\nGazit Immobilien Motorama München GmbH\nGesellschaft mit beschränkter Haftung\nEschborn\n\nDen Gläubigern der an der Verschmelzung beteiligten Rechtsträger ist, wenn sie binnen sechs Monaten nach dem Tag, an dem die Eintragung der Verschmelzung in das Register des Sitzes desjenigen Rechtsträgers, dessen Gläubiger sie sind, nach § 19 Absatz 3 UmwG bekannt gemacht worden ist, ihren Anspruch nach Grund und Höhe schriftlich anmelden, Sicherheit zu leisten, soweit sie nicht Befriedigung verlangen können. Dieses Recht steht den Gläubigern jedoch nur zu, wenn sie glaubhaft machen, dass durch die Verschmelzung die Erfüllung ihrer Forderung gefährdet wird."
    },
    {
      "date": "2025-06-11",
      "id": "111871",
      "original_text": "Registerbekanntmachung nach dem Umwandlungsgesetz\nHessen Amtsgericht Frankfurt am Main HRA 47187\nGazit Germany Beteiligungs GmbH & Co. KG – Eschborn",
      "type": "Registerbekanntmachung nach dem Umwandlungsgesetz",
      "state": "Hessen",
      "amtsgericht": "Amtsgericht Frankfurt am Main",
      "registernummer": "HRA 47187",
      "registerart": "HRA",
      "company_name": "Gazit Germany Beteiligungs GmbH & Co. KG",
      "company_seat": "Eschborn",
      "details": "11.06.2025 (Bekanntmachungsdatum)\n\nHessen Amtsgericht Frankfurt am Main HRA 47187\nRegisterbekanntmachung nach dem Umwandlungsgesetz 11.06.2025 (Eintragungsdatum)\n\nGazit Germany Beteiligungs GmbH & Co. KG\nKommanditgesellschaft\nEschborn\n\nDen Gläubigern der an der Verschmelzung beteiligten Rechtsträger ist, wenn sie binnen sechs Monaten nach dem Tag, an dem die Eintragung der Verschmelzung in das Register des Sitzes desjenigen Rechtsträgers, dessen Gläubiger sie sind, nach § 19 Absatz 3 UmwG bekannt gemacht worden ist, ihren Anspruch nach Grund und Höhe schriftlich anmelden, Sicherheit zu leisten, soweit sie nicht Befriedigung verlangen können. Dieses Recht steht den Gläubigern jedoch nur zu, wenn sie glaubhaft machen, dass durch die Verschmelzung die Erfüllung ihrer Forderung gefährdet wird."
    },
    {
      "date": "2025-06-11",
      "id": "111872",
      "original_text": "Sonstige Registerbekanntmachung\nHessen Amtsgericht Darmstadt VR 20386\nArbeitskreis Jugend und Gesellschaft e.V. - Jugendberatungsstellen und Wohngemeinschaften im Landkreis Bergstraße - – Bensheim",
      "type": "Sonstige Registerbekanntmachung",
      "state": "Hessen",
      "amtsgericht": "Amtsgericht Darmstadt",
      "registernummer": "VR 20386",
      "registerart": "VR",
      "company_name": "Arbeitskreis Jugend und Gesellschaft e.V. - Jugendberatungsstellen und Wohngemeinschaften im Landkreis Bergstraße -",
      "company_seat": "Bensheim",
      "details": "11.06.2025 (Bekanntmachungsdatum)\n\nHessen Amtsgericht Darmstadt VR 20386\nSonstige Registerbekanntmachung 11.06.2025 (Eintragungsdatum)\n\nArbeitskreis Jugend und Gesellschaft e.V. - Jugendberatungsstellen und Wohngemeinschaften im Landkreis Bergstraße -\neingetragener Verein\nBensheim\n\nDer Verein ist aufgelöst."
    },
    {
      "date": "2025-06-11",
      "id": "111873",
      "original_text": "Registerbekanntmachung nach dem Umwandlungsgesetz\nHessen Amtsgericht Friedberg HRB 10799\nFritzel Immobilien GmbH – Florstadt",
      "type": "Registerbekanntmachung nach dem Umwandlungsgesetz",
      "state": "Hessen",
      "amtsgericht": "Amtsgericht Friedberg",
      "registernummer": "HRB 10799",
      "registerart": "HRB",
      "company_name": "Fritzel Immobilien GmbH",
      "company_seat": "Florstadt",
      "details": "11.06.2025 (Bekanntmachungsdatum)\n\nHessen Amtsgericht Friedberg HRB 10799\nRegisterbekanntmachung nach dem Umwandlungsgesetz 11.06.2025 (Eintragungsdatum)\n\nFritzel Immobilien GmbH\nGesellschaft mit beschränkter Haftung\nFlorstadt\n\nDen Gläubigern der an der Ausgliederung beteiligten Rechtsträger ist, wenn sie binnen sechs Monaten nach dem Tag, an dem die Eintragung der Ausgliederung in das Register des Sitzes desjenigen Rechtsträgers, dessen Gläubiger sie sind, nach §§ 125, 19 Absatz 3 UmwG bekannt gemacht worden ist, ihren Anspruch nach Grund und Höhe schriftlich anmelden, Sicherheit zu leisten, soweit sie nicht Befriedigung verlangen können. Dieses Recht steht den Gläubigern jedoch nur zu, wenn sie glaubhaft machen, dass durch die Ausgliederung die Erfüllung ihrer Forderung gefährdet wird."
    },
    {
      "date": "2025-06-11",
      "id": "111874",
      "original_text": "Registerbekanntmachung nach dem Umwandlungsgesetz\nHessen Amtsgericht Offenbach am Main HRB 53469\nRandan UG (haftungsbeschränkt) – Dreieich",
      "type": "Registerbekanntmachung nach dem Umwandlungsgesetz",
      "state": "Hessen",
      "amtsgericht": "Amtsgericht Offenbach am Main",
      "registernummer": "HRB 53469",
      "registerart": "HRB",
      "company_name": "Randan UG (haftungsbeschränkt)",
      "company_seat": "Dreieich",
      "details": "11.06.2025 (Bekanntmachungsdatum)\n\nHessen Amtsgericht Offenbach am Main HRB 53469\nRegisterbekanntmachung nach dem Umwandlungsgesetz 11.06.2025 (Eintragungsdatum)\n\nRandan UG (haftungsbeschränkt)\nGesellschaft mit beschränkter Haftung\nDreieich\n\nDen Gläubigern der an der Verschmelzung beteiligten Rechtsträger ist, wenn sie binnen sechs Monaten nach dem Tag, an dem die Eintragung der Verschmelzung in das Register des Sitzes desjenigen Rechtsträgers, dessen Gläubiger sie sind, nach § 19 Absatz 3 UmwG bekannt gemacht worden ist, ihren Anspruch nach Grund und Höhe schriftlich anmelden, Sicherheit zu leisten, soweit sie nicht Befriedigung verlangen können. Dieses Recht steht den Gläubigern jedoch nur zu, wenn sie glaubhaft machen, dass durch die Verschmelzung die Erfüllung ihrer Forderung gefährdet wird."
    },
    {
      "date": "2025-06-11",
      "id": "111875",
      "original_text": "Registerbekanntmachung nach dem Umwandlungsgesetz\nHessen Amtsgericht Frankfurt am Main HRB 90322\nGazit Immobilien Fachmarktzentrum Groß Gerau GmbH – Eschborn",
      "type": "Registerbekanntmachung nach dem Umwandlungsgesetz",
      "state": "Hessen",
      "amtsgericht": "Amtsgericht Frankfurt am Main",
      "registernummer": "HRB 90322",
      "registerart": "HRB",
      "company_name": "Gazit Immobilien Fachmarktzentrum Groß Gerau GmbH",
      "company_seat": "Eschborn",
      "details": "11.06.2025 (Bekanntmachungsdatum)\n\nHessen Amtsgericht Frankfurt am Main HRB 90322\nRegisterbekanntmachung nach dem Umwandlungsgesetz 11.06.2025 (Eintragungsdatum)\n\nGazit Immobilien Fachmarktzentrum Groß Gerau GmbH\nGesellschaft mit beschränkter Haftung\nEschborn\n\nDen Gläubigern der an der Verschmelzung beteiligten Rechtsträger ist, wenn sie binnen sechs Monaten nach dem Tag, an dem die Eintragung der Verschmelzung in das Register des Sitzes derjenigen Rechtsträger deren Gläubiger sie sind, nach § 19 Absatz 3 UmwG bekannt gemacht worden ist, ihren Anspruch nach Grund und Höhe schriftlich anmelden, Sicherheit zu leisten, soweit sie nicht Befriedigung verlangen können. Dieses Recht steht den Gläubigern jedoch nur zu, wenn sie glaubhaft machen, dass durch die Verschmelzung die Erfüllung ihrer Forderung gefährdet wird."
    },
    {
      "date": "2025-06-11",
      "id": "111876",
      "original_text": "Einreichung neuer Dokumente\nHessen Amtsgericht Friedberg HRB 9047\nMMD Automobile GmbH – Friedberg (Hessen)",
      "type": "Einreichung neuer Dokumente",
      "state": "Hessen",
      "amtsgericht": "Amtsgericht Friedberg",
      "registernummer": "HRB 9047",
      "registerart": "HRB",
      "company_name": "MMD Automobile GmbH",
      "company_seat": "Friedberg (Hessen)",
      "details": "11.06.2025 (Bekanntmachungsdatum)\n\nHessen Amtsgericht Friedberg HRB 9047\nEinreichung neuer Dokumente 05.06.2025 (Eintragungsdatum)\n\nMMD Automobile GmbH\nGesellschaft mit beschränkter Haftung\nFriedberg (Hessen)"
    },
    {
      "date": "2025-06-11",
      "id": "111877",
      "original_text": "Registerbekanntmachung nach dem Umwandlungsgesetz\nHessen Amtsgericht Frankfurt am Main HRB 137581\nFREY Berlin Property 4 GmbH – Frankfurt am Main",
      "type": "Registerbekanntmachung nach dem Umwandlungsgesetz",
      "state": "Hessen",
      "amtsgericht": "Amtsgericht Frankfurt am Main",
      "registernummer": "HRB 137581",
      "registerart": "HRB",
      "company_name": "FREY Berlin Property 4 GmbH",
      "company_seat": "Frankfurt am Main",
      "details": "11.06.2025 (Bekanntmachungsdatum)\n\nHessen Amtsgericht Frankfurt am Main HRB 137581\nRegisterbekanntmachung nach dem Umwandlungsgesetz 11.06.2025 (Eintragungsdatum)\n\nFREY Berlin Property 4 GmbH\nGesellschaft mit beschränkter Haftung\nFrankfurt am Main\n\nEs wird darauf hingewiesen, dass ein Formwechselplan oder sein Entwurf über einen grenzüberschreitenden Formwechsel in die FREY Berlin Property 4 S.á r.l. mit Sitz in Luxemburg/Deutschland, Bundesrepublik beim Handelsregister eingereicht worden ist.\n\nDie Anteilsinhaber, die Gläubiger sowie die zuständigen Betriebsräte der an dem grenzüberschreitenden Formwechsel beteiligten Gesellschaft oder, soweit es keinen Betriebsrat gibt, die Arbeitnehmer der an dem grenzüberschreitenden Formwechsel beteiligten Gesellschaft, können der Gesellschaft spätestens fünf Arbeitstage vor dem Tag der Gesellschafterversammlung Bemerkungen zum Formwechselplan übermitteln."
    },
    {
      "date": "2025-06-11",
      "id": "111878",
      "original_text": "Registerbekanntmachung nach dem Umwandlungsgesetz\nHessen Amtsgericht Gießen GnR 302\nVolksbank Mittelhessen eG – Gießen",
      "type": "Registerbekanntmachung nach dem Umwandlungsgesetz",
      "state": "Hessen",
      "amtsgericht": "Amtsgericht Gießen",
      "registernummer": "GnR 302",
      "registerart": "GnR",
      "company_name": "Volksbank Mittelhessen eG",
      "company_seat": "Gießen",
      "details": "11.06.2025 (Bekanntmachungsdatum)\n\nHessen Amtsgericht Gießen GnR 302\nRegisterbekanntmachung nach dem Umwandlungsgesetz 11.06.2025 (Eintragungsdatum)\n\nVolksbank Mittelhessen eG\neingetragene Genossenschaft\nGießen\n\nDen Gläubigern der an der Verschmelzung beteiligten Rechtsträger ist, wenn sie binnen sechs Monaten nach dem Tag, an dem die Eintragung der Verschmelzung in das Register des Sitzes desjenigen Rechtsträgers, dessen Gläubiger sie sind, nach § 19 Absatz 3 UmwG bekannt gemacht worden ist, ihren Anspruch nach Grund und Höhe schriftlich anmelden, Sicherheit zu leisten, soweit sie nicht Befriedigung verlangen können. Dieses Recht steht den Gläubigern jedoch nur zu, wenn sie glaubhaft machen, dass durch die Verschmelzung die Erfüllung ihrer Forderung gefährdet wird."
    },
    {
      "date": "2025-06-11",
      "id": "111879",
      "original_text": "Registerbekanntmachung nach dem Umwandlungsgesetz\nHessen Amtsgericht Friedberg HRA 5158\nMax Fritzel Immobilien e. K. – Florstadt",
      "type": "Registerbekanntmachung nach dem Umwandlungsgesetz",
      "state": "Hessen",
      "amtsgericht": "Amtsgericht Friedberg",
      "registernummer": "HRA 5158",
      "registerart": "HRA",
      "company_name": "Max Fritzel Immobilien e. K.",
      "company_seat": "Florstadt",
      "details": "11.06.2025 (Bekanntmachungsdatum)\n\nHessen Amtsgericht Friedberg HRA 5158\nRegisterbekanntmachung nach dem Umwandlungsgesetz 11.06.2025 (Eintragungsdatum)\n\nMax Fritzel Immobilien e. K.\nEinzelkaufmann / Einzelkauffrau\nFlorstadt\n\nDen Gläubigern der an der Ausgliederung beteiligten Rechtsträger ist, wenn sie binnen sechs Monaten nach dem Tag, an dem die Eintragung der Ausgliederung in das Register des Sitzes desjenigen Rechtsträgers, dessen Gläubiger sie sind, nach §§ 125, 19 Absatz 3 UmwG bekannt gemacht worden ist, ihren Anspruch nach Grund und Höhe schriftlich anmelden, Sicherheit zu leisten, soweit sie nicht Befriedigung verlangen können. Dieses Recht steht den Gläubigern jedoch nur zu, wenn sie glaubhaft machen, dass durch die Ausgliederung die Erfüllung ihrer Forderung gefährdet wird."
    },
    {
      "date": "2025-06-11",
      "id": "111880",
      "original_text": "Registerbekanntmachung nach dem Umwandlungsgesetz\nHessen Amtsgericht Kassel HRB 13142\nGBI Planung und Baumanagement GmbH – Kassel",
      "type": "Registerbekanntmachung nach dem Umwandlungsgesetz",
      "state": "Hessen",
      "amtsgericht": "Amtsgericht Kassel",
      "registernummer": "HRB 13142",
      "registerart": "HRB",
      "company_name": "GBI Planung und Baumanagement GmbH",
      "company_seat": "Kassel",
      "details": "11.06.2025 (Bekanntmachungsdatum)\n\nHessen Amtsgericht Kassel HRB 13142\nRegisterbekanntmachung nach dem Umwandlungsgesetz 11.06.2025 (Eintragungsdatum)\n\nGBI Planung und Baumanagement GmbH\nGesellschaft mit beschränkter Haftung\nKassel\n\nDen Gläubigern der an der Verschmelzung beteiligten Rechtsträger ist, wenn sie binnen sechs Monaten nach dem Tag, an dem die Eintragung der Verschmelzung in das Register des Sitzes desjenigen Rechtsträgers, dessen Gläubiger sie sind, nach § 19 Absatz 3 UmwG bekannt gemacht worden ist, ihren Anspruch nach Grund und Höhe schriftlich anmelden, Sicherheit zu leisten, soweit sie nicht Befriedigung verlangen können. Dieses Recht steht den Gläubigern jedoch nur zu, wenn sie glaubhaft machen, dass durch die Verschmelzung die Erfüllung ihrer Forderung gefährdet wird."
    },
    {
      "date": "2025-06-11",
      "id": "111881",
      "original_text": "Registerbekanntmachung nach dem Umwandlungsgesetz\nHessen Amtsgericht Fritzlar HRA 16613\nGerd Mausolf GmbH & Co. KG – Homberg (Efze)",
      "type": "Registerbekanntmachung nach dem Umwandlungsgesetz",
      "state": "Hessen",
      "amtsgericht": "Amtsgericht Fritzlar",
      "registernummer": "HRA 16613",
      "registerart": "HRA",
      "company_name": "Gerd Mausolf GmbH & Co. KG",
      "company_seat": "Homberg (Efze)",
      "details": "11.06.2025 (Bekanntmachungsdatum)\n\nHessen Amtsgericht Fritzlar HRA 16613\nRegisterbekanntmachung nach dem Umwandlungsgesetz 11.06.2025 (Eintragungsdatum)\n\nGerd Mausolf GmbH & Co. KG\nKommanditgesellschaft\nHomberg (Efze)\n\nDen Gläubigern der an der Ausgliederung beteiligten Rechtsträger ist, wenn sie binnen sechs Monaten nach dem Tag, an dem die Eintragung der Ausgliederung in das Register des Sitzes derjenigen Rechtsträger deren Gläubiger sie sind, nach §§ 125, 19 Absatz 3 UmwG bekannt gemacht worden ist, ihren Anspruch nach Grund und Höhe schriftlich anmelden, Sicherheit zu leisten, soweit sie nicht Befriedigung verlangen können. Dieses Recht steht den Gläubigern jedoch nur zu, wenn sie glaubhaft machen, dass durch die Ausgliederung die Erfüllung ihrer Forderung gefährdet wird."
    },
    {
      "date": "2025-06-11",
      "id": "111882",
      "original_text": "Registerbekanntmachung nach dem Umwandlungsgesetz\nHessen Amtsgericht Frankfurt am Main HRB 90198\nGazit Immobilien Motorama München GmbH – Eschborn",
      "type": "Registerbekanntmachung nach dem Umwandlungsgesetz",
      "state": "Hessen",
      "amtsgericht": "Amtsgericht Frankfurt am Main",
      "registernummer": "HRB 90198",
      "registerart": "HRB",
      "company_name": "Gazit Immobilien Motorama München GmbH",
      "company_seat": "Eschborn",
      "details": "11.06.2025 (Bekanntmachungsdatum)\n\nHessen Amtsgericht Frankfurt am Main HRB 90198\nRegisterbekanntmachung nach dem Umwandlungsgesetz 11.06.2025 (Eintragungsdatum)\n\nGazit Immobilien Motorama München GmbH\nGesellschaft mit beschränkter Haftung\nEschborn\n\nDen Gläubigern der an der Verschmelzung beteiligten Rechtsträger ist, wenn sie binnen sechs Monaten nach dem Tag, an dem die Eintragung der Verschmelzung in das Register des Sitzes derjenigen Rechtsträger deren Gläubiger sie sind, nach § 19 Absatz 3 UmwG bekannt gemacht worden ist, ihren Anspruch nach Grund und Höhe schriftlich anmelden, Sicherheit zu leisten, soweit sie nicht Befriedigung verlangen können. Dieses Recht steht den Gläubigern jedoch nur zu, wenn sie glaubhaft machen, dass durch die Verschmelzung die Erfüllung ihrer Forderung gefährdet wird."
    },
    {
      "date": "2025-06-11",
      "id": "111883",
      "original_text": "Registerbekanntmachung nach dem Umwandlungsgesetz\nHessen Amtsgericht Königstein HRB 5920\nAccenture GmbH – Kronberg im Taunus",
      "type": "Registerbekanntmachung nach dem Umwandlungsgesetz",
      "state": "Hessen",
      "amtsgericht": "Amtsgericht Königstein",
      "registernummer": "HRB 5920",
      "registerart": "HRB",
      "company_name": "Accenture GmbH",
      "company_seat": "Kronberg im Taunus",
      "details": "11.06.2025 (Bekanntmachungsdatum)\n\nHessen Amtsgericht Königstein HRB 5920\nRegisterbekanntmachung nach dem Umwandlungsgesetz 11.06.2025 (Eintragungsdatum)\n\nAccenture GmbH\nGesellschaft mit beschränkter Haftung\nKronberg im Taunus\n\nDen Gläubigern der an der Verschmelzung beteiligten Rechtsträger ist, wenn sie binnen sechs Monaten nach dem Tag, an dem die Eintragung der Verschmelzung in das Register des Sitzes desjenigen Rechtsträgers, dessen Gläubiger sie sind, nach § 19 Absatz 3 UmwG bekannt gemacht worden ist, ihren Anspruch nach Grund und Höhe schriftlich anmelden, Sicherheit zu leisten, soweit sie nicht Befriedigung verlangen können. Dieses Recht steht den Gläubigern jedoch nur zu, wenn sie glaubhaft machen, dass durch die Verschmelzung die Erfüllung ihrer Forderung gefährdet wird."
    },
    {
      "date": "2025-06-11",
      "id": "111884",
      "original_text": "Registerbekanntmachung nach dem Umwandlungsgesetz\nHessen Amtsgericht Frankfurt am Main HRB 90244\nGazit Germany Asset Management GmbH – Eschborn",
      "type": "Registerbekanntmachung nach dem Umwandlungsgesetz",
      "state": "Hessen",
      "amtsgericht": "Amtsgericht Frankfurt am Main",
      "registernummer": "HRB 90244",
      "registerart": "HRB",
      "company_name": "Gazit Germany Asset Management GmbH",
      "company_seat": "Eschborn",
      "details": "11.06.2025 (Bekanntmachungsdatum)\n\nHessen Amtsgericht Frankfurt am Main HRB 90244\nRegisterbekanntmachung nach dem Umwandlungsgesetz 11.06.2025 (Eintragungsdatum)\n\nGazit Germany Asset Management GmbH\nGesellschaft mit beschränkter Haftung\nEschborn\n\nDen Gläubigern der an der Verschmelzung beteiligten Rechtsträger ist, wenn sie binnen sechs Monaten nach dem Tag, an dem die Eintragung der Verschmelzung in das Register des Sitzes derjenigen Rechtsträger deren Gläubiger sie sind, nach § 19 Absatz 3 UmwG bekannt gemacht worden ist, ihren Anspruch nach Grund und Höhe schriftlich anmelden, Sicherheit zu leisten, soweit sie nicht Befriedigung verlangen können. Dieses Recht steht den Gläubigern jedoch nur zu, wenn sie glaubhaft machen, dass durch die Verschmelzung die Erfüllung ihrer Forderung gefährdet wird."
    },
    {
      "date": "2025-06-11",
      "id": "111885",
      "original_text": "Registerbekanntmachung nach dem Umwandlungsgesetz\nHessen Amtsgericht Fritzlar HRA 16606\nMausolf e.K. – Homberg (Efze)",
      "type": "Registerbekanntmachung nach dem Umwandlungsgesetz",
      "state": "Hessen",
      "amtsgericht": "Amtsgericht Fritzlar",
      "registernummer": "HRA 16606",
      "registerart": "HRA",
      "company_name": "Mausolf e.K.",
      "company_seat": "Homberg (Efze)",
      "details": "11.06.2025 (Bekanntmachungsdatum)\n\nHessen Amtsgericht Fritzlar HRA 16606\nRegisterbekanntmachung nach dem Umwandlungsgesetz 11.06.2025 (Eintragungsdatum)\n\nMausolf e.K.\nEinzelkaufmann / Einzelkauffrau\nHomberg (Efze)\n\nDen Gläubigern der an der Ausgliederung beteiligten Rechtsträger ist, wenn sie binnen sechs Monaten nach dem Tag, an dem die Eintragung der Ausgliederung in das Register des Sitzes derjenigen Rechtsträger deren Gläubiger sie sind, nach §§ 125, 19 Absatz 3 UmwG bekannt gemacht worden ist, ihren Anspruch nach Grund und Höhe schriftlich anmelden, Sicherheit zu leisten, soweit sie nicht Befriedigung verlangen können. Dieses Recht steht den Gläubigern jedoch nur zu, wenn sie glaubhaft machen, dass durch die Ausgliederung die Erfüllung ihrer Forderung gefährdet wird."
    },
    {
      "date": "2025-06-11",
      "id": "111886",
      "original_text": "Registerbekanntmachung nach dem Umwandlungsgesetz\nHessen Amtsgericht Limburg GnR 152\nVolksbank Schupbach eG – Beselich",
      "type": "Registerbekanntmachung nach dem Umwandlungsgesetz",
      "state": "Hessen",
      "amtsgericht": "Amtsgericht Limburg",
      "registernummer": "GnR 152",
      "registerart": "GnR",
      "company_name": "Volksbank Schupbach eG",
      "company_seat": "Beselich",
      "details": "11.06.2025 (Bekanntmachungsdatum)\n\nHessen Amtsgericht Limburg GnR 152\nRegisterbekanntmachung nach dem Umwandlungsgesetz 11.06.2025 (Eintragungsdatum)\n\nVolksbank Schupbach eG\neingetragene Genossenschaft\nBeselich\n\nDen Gläubigern der an der Verschmelzung beteiligten Rechtsträger ist, wenn sie binnen sechs Monaten nach dem Tag, an dem die Eintragung der Verschmelzung in das Register des Sitzes desjenigen Rechtsträgers, dessen Gläubiger sie sind, nach § 19 Absatz 3 UmwG bekannt gemacht worden ist, ihren Anspruch nach Grund und Höhe schriftlich anmelden, Sicherheit zu leisten, soweit sie nicht Befriedigung verlangen können. Dieses Recht steht den Gläubigern jedoch nur zu, wenn sie glaubhaft machen, dass durch die Verschmelzung die Erfüllung ihrer Forderung gefährdet wird."
    },
    {
      "date": "2025-06-11",
      "id": "111887",
      "original_text": "Löschungsankündigung\nHessen Amtsgericht Darmstadt HRB 104812\nLEMA Bauleistungen GmbH – Nauheim",
      "type": "Löschungsankündigung",
      "state": "Hessen",
      "amtsgericht": "Amtsgericht Darmstadt",
      "registernummer": "HRB 104812",
      "registerart": "HRB",
      "company_name": "LEMA Bauleistungen GmbH",
      "company_seat": "Nauheim",
      "details": "11.06.2025 (Bekanntmachungsdatum)\n\nHessen Amtsgericht Darmstadt HRB 104812\nLöschungsankündigung\n\nLEMA Bauleistungen GmbH\nGesellschaft mit beschränkter Haftung\nNauheim\n\nDas Registergericht beabsichtigt die im Handelsregister eingetragene Gesellschaft von Amts wegen nach § 394 FamFG zu löschen. Die Frist zur Erhebung eines Widerspruchs gegen die beabsichtigte Löschung wird auf 3 Monate festgesetzt."
    },
    {
      "date": "2025-06-11",
      "id": "111888",
      "original_text": "Registerbekanntmachung nach dem Umwandlungsgesetz\nHessen Amtsgericht Frankfurt am Main HRB 90189\nGazit Immobilien Groß Gerau Komplementär GmbH – Eschborn",
      "type": "Registerbekanntmachung nach dem Umwandlungsgesetz",
      "state": "Hessen",
      "amtsgericht": "Amtsgericht Frankfurt am Main",
      "registernummer": "HRB 90189",
      "registerart": "HRB",
      "company_name": "Gazit Immobilien Groß Gerau Komplementär GmbH",
      "company_seat": "Eschborn",
      "details": "11.06.2025 (Bekanntmachungsdatum)\n\nHessen Amtsgericht Frankfurt am Main HRB 90189\nRegisterbekanntmachung nach dem Umwandlungsgesetz 11.06.2025 (Eintragungsdatum)\n\nGazit Immobilien Groß Gerau Komplementär GmbH\nGesellschaft mit beschränkter Haftung\nEschborn\n\nDen Gläubigern der an der Verschmelzung beteiligten Rechtsträger ist, wenn sie binnen sechs Monaten nach dem Tag, an dem die Eintragung der Verschmelzung in das Register des Sitzes derjenigen Rechtsträger deren Gläubiger sie sind, nach § 19 Absatz 3 UmwG bekannt gemacht worden ist, ihren Anspruch nach Grund und Höhe schriftlich anmelden, Sicherheit zu leisten, soweit sie nicht Befriedigung verlangen können. Dieses Recht steht den Gläubigern jedoch nur zu, wenn sie glaubhaft machen, dass durch die Verschmelzung die Erfüllung ihrer Forderung gefährdet wird."
    }
  ]
}