{
  "date": "2025-06-21",
  "date_of_scrape": "2025-06-22T04:09:56.170Z",
  "tool_version": "0.2.0",
  "number_of_announcements": 12,
  "announcements": [
    {
      "date": "2025-06-21",
      "id": "112929",
      "original_text": "Löschungsankündigung\nBayern Amtsgericht München HRB 276841\nMK Erinnerungen UG (haftungsbeschränkt) – München",
      "type": "Löschungsankündigung",
      "state": "Bayern",
      "amtsgericht": "Amtsgericht München",
      "registernummer": "HRB 276841",
      "registerart": "HRB",
      "company_name": "MK Erinnerungen UG (haftungsbeschränkt)",
      "company_seat": "München",
      "details": "21.06.2025 (Bekanntmachungsdatum)\n\nBayern Amtsgericht München HRB 276841\nLöschungsankündigung 20.06.2025 (Eintragungsdatum)\n\nMK Erinnerungen UG (haftungsbeschränkt)\nGesellschaft mit beschränkter Haftung\nMünchen\n\nDas Registergericht beabsichtigt, die im Handelsregister eingetragene Gesellschaft wegen Vermögenslosigkeit von Amts wegen nach § 394 FamFG zu löschen. Die Frist zur Erhebung eines Widerspruchs ist auf drei Monate festgesetzt."
    },
    {
      "date": "2025-06-21",
      "id": "112930",
      "original_text": "Registerbekanntmachung nach dem Umwandlungsgesetz\nBayern Amtsgericht Fürth HRB 18577\ncoduco GmbH – Oberscheinfeld",
      "type": "Registerbekanntmachung nach dem Umwandlungsgesetz",
      "state": "Bayern",
      "amtsgericht": "Amtsgericht Fürth",
      "registernummer": "HRB 18577",
      "registerart": "HRB",
      "company_name": "coduco GmbH",
      "company_seat": "Oberscheinfeld",
      "details": "21.06.2025 (Bekanntmachungsdatum)\n\nBayern Amtsgericht Fürth HRB 18577\nRegisterbekanntmachung nach dem Umwandlungsgesetz 20.06.2025 (Eintragungsdatum)\n\ncoduco GmbH\nGesellschaft mit beschränkter Haftung\nOberscheinfeld\n\nDen Gläubigern der an der Verschmelzung beteiligten Rechtsträger ist, wenn sie binnen sechs Monaten nach dem Tag, an dem die Eintragung der Verschmelzung in das Register des Sitzes desjenigen Rechtsträgers, dessen Gläubiger sie sind, nach § 19 Abs. 3 UmwG als bekannt gemacht gilt, ihren Anspruch nach Grund und Höhe in Textform anmelden, Sicherheit zu leisten, soweit sie nicht Befriedigung verlangen können. Dieses Recht steht den Gläubigern jedoch nur zu, wenn sie glaubhaft machen, dass durch die Verschmelzung die Erfüllung ihrer Forderung gefährdet wird."
    },
    {
      "date": "2025-06-21",
      "id": "112931",
      "original_text": "Registerbekanntmachung nach dem Umwandlungsgesetz\nBayern Amtsgericht Aschaffenburg HRB 6736\nGGC Gesellschaft für Geo- und Umwelttechnik Consulting mbH – Aschaffenburg",
      "type": "Registerbekanntmachung nach dem Umwandlungsgesetz",
      "state": "Bayern",
      "amtsgericht": "Amtsgericht Aschaffenburg",
      "registernummer": "HRB 6736",
      "registerart": "HRB",
      "company_name": "GGC Gesellschaft für Geo- und Umwelttechnik Consulting mbH",
      "company_seat": "Aschaffenburg",
      "details": "21.06.2025 (Bekanntmachungsdatum)\n\nBayern Amtsgericht Aschaffenburg HRB 6736\nRegisterbekanntmachung nach dem Umwandlungsgesetz 20.06.2025 (Eintragungsdatum)\n\nGGC Gesellschaft für Geo- und Umwelttechnik Consulting mbH\nGesellschaft mit beschränkter Haftung\nAschaffenburg\n\nDen Gläubigern der an der Verschmelzung beteiligten Rechtsträger ist, wenn sie binnen sechs Monaten nach dem Tag, an dem die Eintragung der Verschmelzung in das Register des Sitzes desjenigen Rechtsträgers, dessen Gläubiger sie sind, nach § 19 Abs. 3 UmwG als bekannt gemacht gilt, ihren Anspruch nach Grund und Höhe in Textform anmelden, Sicherheit zu leisten, soweit sie nicht Befriedigung verlangen können. Dieses Recht steht den Gläubigern jedoch nur zu, wenn sie glaubhaft machen, dass durch die Verschmelzung die Erfüllung ihrer Forderung gefährdet wird."
    },
    {
      "date": "2025-06-21",
      "id": "112932",
      "original_text": "Löschungsankündigung\nBayern Amtsgericht Landshut HRB 6294\nROMED Austria GmbH Klinik Consulting – Simbach am Inn",
      "type": "Löschungsankündigung",
      "state": "Bayern",
      "amtsgericht": "Amtsgericht Landshut",
      "registernummer": "HRB 6294",
      "registerart": "HRB",
      "company_name": "ROMED Austria GmbH Klinik Consulting",
      "company_seat": "Simbach am Inn",
      "details": "21.06.2025 (Bekanntmachungsdatum)\n\nBayern Amtsgericht Landshut HRB 6294\nLöschungsankündigung\n\nROMED Austria GmbH Klinik Consulting\nGesellschaft mit beschränkter Haftung\nSimbach am Inn\n\nDas Registergericht beabsichtigt, die im Handelsregister eingetragene Gesellschaft wegen Vermögenslosigkeit von Amts wegen nach § 394 FamFG zu löschen. Die Frist zur Erhebung eines Widerspruchs ist auf einen Monat festgesetzt."
    },
    {
      "date": "2025-06-21",
      "id": "112933",
      "original_text": "Registerbekanntmachung nach dem Umwandlungsgesetz\nBayern Amtsgericht Aschaffenburg HRB 17903\nBaugrundinstitut Langer GmbH – Aschaffenburg",
      "type": "Registerbekanntmachung nach dem Umwandlungsgesetz",
      "state": "Bayern",
      "amtsgericht": "Amtsgericht Aschaffenburg",
      "registernummer": "HRB 17903",
      "registerart": "HRB",
      "company_name": "Baugrundinstitut Langer GmbH",
      "company_seat": "Aschaffenburg",
      "details": "21.06.2025 (Bekanntmachungsdatum)\n\nBayern Amtsgericht Aschaffenburg HRB 17903\nRegisterbekanntmachung nach dem Umwandlungsgesetz 20.06.2025 (Eintragungsdatum)\n\nBaugrundinstitut Langer GmbH\nGesellschaft mit beschränkter Haftung\nAschaffenburg\n\nDen Gläubigern der an der Verschmelzung beteiligten Rechtsträger ist, wenn sie binnen sechs Monaten nach dem Tag, an dem die Eintragung der Verschmelzung in das Register des Sitzes desjenigen Rechtsträgers, dessen Gläubiger sie sind, nach § 19 Abs. 3 UmwG als bekannt gemacht gilt, ihren Anspruch nach Grund und Höhe in Textform anmelden, Sicherheit zu leisten, soweit sie nicht Befriedigung verlangen können. Dieses Recht steht den Gläubigern jedoch nur zu, wenn sie glaubhaft machen, dass durch die Verschmelzung die Erfüllung ihrer Forderung gefährdet wird."
    },
    {
      "date": "2025-06-21",
      "id": "112934",
      "original_text": "Einreichung neuer Dokumente\nBayern Amtsgericht München HRB 214729\nLufthansa CityLine GmbH – München",
      "type": "Einreichung neuer Dokumente",
      "state": "Bayern",
      "amtsgericht": "Amtsgericht München",
      "registernummer": "HRB 214729",
      "registerart": "HRB",
      "company_name": "Lufthansa CityLine GmbH",
      "company_seat": "München",
      "details": "21.06.2025 (Bekanntmachungsdatum)\n\nBayern Amtsgericht München HRB 214729\nEinreichung neuer Dokumente\n\nLufthansa CityLine GmbH\nGesellschaft mit beschränkter Haftung\nMünchen\n\nDem Amtsgericht München -Registergericht- ist eine Liste der Mitglieder des Aufsichtsrats eingereicht worden, § 52 Abs. 3 S. 2 GmbHG."
    },
    {
      "date": "2025-06-21",
      "id": "112935",
      "original_text": "Löschungsankündigung\nBayern Amtsgericht München HRB 264210\nARSZ - Jara and Warraich Brothers - Unternehmergesellschaft (haftungsbeschränkt) – Puchheim",
      "type": "Löschungsankündigung",
      "state": "Bayern",
      "amtsgericht": "Amtsgericht München",
      "registernummer": "HRB 264210",
      "registerart": "HRB",
      "company_name": "ARSZ - Jara and Warraich Brothers - Unternehmergesellschaft (haftungsbeschränkt)",
      "company_seat": "Puchheim",
      "details": "21.06.2025 (Bekanntmachungsdatum)\n\nBayern Amtsgericht München HRB 264210\nLöschungsankündigung 20.06.2025 (Eintragungsdatum)\n\nARSZ - Jara and Warraich Brothers - Unternehmergesellschaft (haftungsbeschränkt)\nGesellschaft mit beschränkter Haftung\nPuchheim\n\nDas Registergericht beabsichtigt, die im Handelsregister eingetragene Gesellschaft wegen Vermögenslosigkeit von Amts wegen nach § 394 FamFG zu löschen. Die Frist zur Erhebung eines Widerspruchs ist auf drei Monate festgesetzt."
    },
    {
      "date": "2025-06-21",
      "id": "112936",
      "original_text": "Registerbekanntmachung nach dem Umwandlungsgesetz\nBayern Amtsgericht München HRB 204106\nSchäbitz GmbH – Garching",
      "type": "Registerbekanntmachung nach dem Umwandlungsgesetz",
      "state": "Bayern",
      "amtsgericht": "Amtsgericht München",
      "registernummer": "HRB 204106",
      "registerart": "HRB",
      "company_name": "Schäbitz GmbH",
      "company_seat": "Garching",
      "details": "21.06.2025 (Bekanntmachungsdatum)\n\nBayern Amtsgericht München HRB 204106\nRegisterbekanntmachung nach dem Umwandlungsgesetz 20.06.2025 (Eintragungsdatum)\n\nSchäbitz GmbH\nGesellschaft mit beschränkter Haftung\nGarching\n\nDen Gläubigern der an der Verschmelzung beteiligten Rechtsträger ist, wenn sie binnen sechs Monaten nach dem Tag, an dem die Eintragung der Verschmelzung in das Register des Sitzes desjenigen Rechtsträgers, dessen Gläubiger sie sind, nach § 19 Abs. 3 UmwG als bekannt gemacht gilt, ihren Anspruch nach Grund und Höhe in Textform anmelden, Sicherheit zu leisten, soweit sie nicht Befriedigung verlangen können. Dieses Recht steht den Gläubigern jedoch nur zu, wenn sie glaubhaft machen, dass durch die Verschmelzung die Erfüllung ihrer Forderung gefährdet wird."
    },
    {
      "date": "2025-06-21",
      "id": "112937",
      "original_text": "Löschungsankündigung\nBayern Amtsgericht München HRB 223342\nKurfürst 1447 GmbH – München",
      "type": "Löschungsankündigung",
      "state": "Bayern",
      "amtsgericht": "Amtsgericht München",
      "registernummer": "HRB 223342",
      "registerart": "HRB",
      "company_name": "Kurfürst 1447 GmbH",
      "company_seat": "München",
      "details": "21.06.2025 (Bekanntmachungsdatum)\n\nBayern Amtsgericht München HRB 223342\nLöschungsankündigung 20.06.2025 (Eintragungsdatum)\n\nKurfürst 1447 GmbH\nGesellschaft mit beschränkter Haftung\nMünchen\n\nDas Registergericht beabsichtigt, die im Handelsregister eingetragene Gesellschaft wegen Vermögenslosigkeit von Amts wegen nach § 394 FamFG zu löschen. Die Frist zur Erhebung eines Widerspruchs ist auf drei Monate festgesetzt."
    },
    {
      "date": "2025-06-21",
      "id": "112938",
      "original_text": "Registerbekanntmachung nach dem Umwandlungsgesetz\nBayern Amtsgericht Fürth HRA 12571\ncoduco e.K. – Oberscheinfeld",
      "type": "Registerbekanntmachung nach dem Umwandlungsgesetz",
      "state": "Bayern",
      "amtsgericht": "Amtsgericht Fürth",
      "registernummer": "HRA 12571",
      "registerart": "HRA",
      "company_name": "coduco e.K.",
      "company_seat": "Oberscheinfeld",
      "details": "21.06.2025 (Bekanntmachungsdatum)\n\nBayern Amtsgericht Fürth HRA 12571\nRegisterbekanntmachung nach dem Umwandlungsgesetz 20.06.2025 (Eintragungsdatum)\n\ncoduco e.K.\nEinzelkaufmann / Einzelkauffrau\nOberscheinfeld\n\nDen Gläubigern der an der Verschmelzung beteiligten Rechtsträger ist, wenn sie binnen sechs Monaten nach dem Tag, an dem die Eintragung der Verschmelzung in das Register des Sitzes desjenigen Rechtsträgers, dessen Gläubiger sie sind, nach § 19 Abs. 3 UmwG als bekannt gemacht gilt, ihren Anspruch nach Grund und Höhe in Textform anmelden, Sicherheit zu leisten, soweit sie nicht Befriedigung verlangen können. Dieses Recht steht den Gläubigern jedoch nur zu, wenn sie glaubhaft machen, dass durch die Verschmelzung die Erfüllung ihrer Forderung gefährdet wird."
    },
    {
      "date": "2025-06-21",
      "id": "112939",
      "original_text": "Registerbekanntmachung nach dem Umwandlungsgesetz\nBayern Amtsgericht München HRB 297859\nRoland Berger Service GmbH & Co. KGaA – München",
      "type": "Registerbekanntmachung nach dem Umwandlungsgesetz",
      "state": "Bayern",
      "amtsgericht": "Amtsgericht München",
      "registernummer": "HRB 297859",
      "registerart": "HRB",
      "company_name": "Roland Berger Service GmbH & Co. KGaA",
      "company_seat": "München",
      "details": "21.06.2025 (Bekanntmachungsdatum)\n\nBayern Amtsgericht München HRB 297859\nRegisterbekanntmachung nach dem Umwandlungsgesetz\n\nRoland Berger Service GmbH & Co. KGaA\nKommanditgesellschaft auf Aktien\nMünchen\n\nDem Amtsgericht München -Registergericht- ist ein Ausgliederungs- und Übernahmevertrag zwischen der Gesellschaft als übernehmendem Rechtsträger und der Roland Berger Holding GmbH & Co. KGaA, München (Amtsgericht München HRB 283942) zur Einsichtnahme eingereicht worden."
    },
    {
      "date": "2025-06-21",
      "id": "112940",
      "original_text": "Löschungsankündigung\nBayern Amtsgericht Nürnberg HRB 30702\nBewell Medical GmbH – Ottensoos",
      "type": "Löschungsankündigung",
      "state": "Bayern",
      "amtsgericht": "Amtsgericht Nürnberg",
      "registernummer": "HRB 30702",
      "registerart": "HRB",
      "company_name": "Bewell Medical GmbH",
      "company_seat": "Ottensoos",
      "details": "21.06.2025 (Bekanntmachungsdatum)\n\nBayern Amtsgericht Nürnberg HRB 30702\nLöschungsankündigung\n\nBewell Medical GmbH\nGesellschaft mit beschränkter Haftung\nOttensoos\n\nDas Registergericht beabsichtigt, die im Handelsregister eingetragene Gesellschaft wegen Vermögenslosigkeit von Amts wegen nach § 394 FamFG zu löschen. Die Frist zur Erhebung eines Widerspruchs ist auf einen Monat festgesetzt."
    }
  ]
}