{
  "date": "2025-06-03",
  "date_of_scrape": "2025-06-04T04:13:46.900Z",
  "tool_version": "0.2.0",
  "number_of_announcements": 146,
  "announcements": [
    {
      "date": "2025-06-03",
      "id": "110933",
      "original_text": "Einreichung neuer Dokumente\nBayern Amtsgericht München HRB 236945\nNCG - NUCOM GROUP SE – Unterföhring",
      "type": "Einreichung neuer Dokumente",
      "state": "Bayern",
      "amtsgericht": "Amtsgericht München",
      "registernummer": "HRB 236945",
      "registerart": "HRB",
      "company_name": "NCG - NUCOM GROUP SE",
      "company_seat": "Unterföhring",
      "details": "03.06.2025 (Bekanntmachungsdatum)\n\nBayern Amtsgericht München HRB 236945\nEinreichung neuer Dokumente\n\nNCG - NUCOM GROUP SE\nEuropäische Aktiengesellschaft (SE)\nUnterföhring\n\nDem Amtsgericht München -Registergericht- ist eine Liste der Mitglieder des Aufsichtsrats eingereicht worden, Art. 9 Abs. 1 Buchst. c (ii) SE-VO i.V.m. § 106 AktG."
    },
    {
      "date": "2025-06-03",
      "id": "110934",
      "original_text": "Registerbekanntmachung nach dem Umwandlungsgesetz\nBayern Amtsgericht Augsburg HRB 31921\nAutovelop AG – Augsburg",
      "type": "Registerbekanntmachung nach dem Umwandlungsgesetz",
      "state": "Bayern",
      "amtsgericht": "Amtsgericht Augsburg",
      "registernummer": "HRB 31921",
      "registerart": "HRB",
      "company_name": "Autovelop AG",
      "company_seat": "Augsburg",
      "details": "03.06.2025 (Bekanntmachungsdatum)\n\nBayern Amtsgericht Augsburg HRB 31921\nRegisterbekanntmachung nach dem Umwandlungsgesetz 02.06.2025 (Eintragungsdatum)\n\nAutovelop AG\nAktiengesellschaft\nAugsburg\n\nDen Gläubigern des formwechselnden Rechtsträgers ist, wenn sie binnen sechs Monaten nach dem Tag, an dem die Eintragung des Formwechsels nach § 201 UmwG als bekannt gemacht gilt, ihren Anspruch nach Grund und Höhe in Textform anmelden, Sicherheit zu leisten, soweit sie nicht Befriedigung verlangen können. Dieses Recht steht den Gläubigern jedoch nur zu, wenn sie glaubhaft machen, dass durch den Formwechsel die Erfüllung ihrer Forderung gefährdet wird."
    },
    {
      "date": "2025-06-03",
      "id": "110935",
      "original_text": "Registerbekanntmachung nach dem Umwandlungsgesetz\nBayern Amtsgericht München HRB 269298\nGREENFORCE FUTURE FOOD AG – München",
      "type": "Registerbekanntmachung nach dem Umwandlungsgesetz",
      "state": "Bayern",
      "amtsgericht": "Amtsgericht München",
      "registernummer": "HRB 269298",
      "registerart": "HRB",
      "company_name": "GREENFORCE FUTURE FOOD AG",
      "company_seat": "München",
      "details": "03.06.2025 (Bekanntmachungsdatum)\n\nBayern Amtsgericht München HRB 269298\nRegisterbekanntmachung nach dem Umwandlungsgesetz 02.06.2025 (Eintragungsdatum)\n\nGREENFORCE FUTURE FOOD AG\nAktiengesellschaft\nMünchen\n\nDen Gläubigern der an der Verschmelzung beteiligten Rechtsträger ist, wenn sie binnen sechs Monaten nach dem Tag, an dem die Eintragung der Verschmelzung in das Register des Sitzes desjenigen Rechtsträgers, dessen Gläubiger sie sind, nach § 19 Abs. 3 UmwG als bekannt gemacht gilt, ihren Anspruch nach Grund und Höhe in Textform anmelden, Sicherheit zu leisten, soweit sie nicht Befriedigung verlangen können. Dieses Recht steht den Gläubigern jedoch nur zu, wenn sie glaubhaft machen, dass durch die Verschmelzung die Erfüllung ihrer Forderung gefährdet wird."
    },
    {
      "date": "2025-06-03",
      "id": "110936",
      "original_text": "Registerbekanntmachung nach dem Umwandlungsgesetz\nBayern Amtsgericht München HRB 271405\nPark Immobilien Projekt Verwaltungs III GmbH – Grünwald",
      "type": "Registerbekanntmachung nach dem Umwandlungsgesetz",
      "state": "Bayern",
      "amtsgericht": "Amtsgericht München",
      "registernummer": "HRB 271405",
      "registerart": "HRB",
      "company_name": "Park Immobilien Projekt Verwaltungs III GmbH",
      "company_seat": "Grünwald",
      "details": "03.06.2025 (Bekanntmachungsdatum)\n\nBayern Amtsgericht München HRB 271405\nRegisterbekanntmachung nach dem Umwandlungsgesetz 02.06.2025 (Eintragungsdatum)\n\nPark Immobilien Projekt Verwaltungs III GmbH\nGesellschaft mit beschränkter Haftung\nGrünwald\n\nDen Gläubigern der an der Verschmelzung beteiligten Rechtsträger ist, wenn sie binnen sechs Monaten nach dem Tag, an dem die Eintragung der Verschmelzung in das Register des Sitzes desjenigen Rechtsträgers, dessen Gläubiger sie sind, nach § 19 Abs. 3 UmwG als bekannt gemacht gilt, ihren Anspruch nach Grund und Höhe in Textform anmelden, Sicherheit zu leisten, soweit sie nicht Befriedigung verlangen können. Dieses Recht steht den Gläubigern jedoch nur zu, wenn sie glaubhaft machen, dass durch die Verschmelzung die Erfüllung ihrer Forderung gefährdet wird."
    },
    {
      "date": "2025-06-03",
      "id": "110937",
      "original_text": "Registerbekanntmachung nach dem Umwandlungsgesetz\nBayern Amtsgericht Bamberg HRB 7413\nworkforce express gmbh – Bamberg",
      "type": "Registerbekanntmachung nach dem Umwandlungsgesetz",
      "state": "Bayern",
      "amtsgericht": "Amtsgericht Bamberg",
      "registernummer": "HRB 7413",
      "registerart": "HRB",
      "company_name": "workforce express gmbh",
      "company_seat": "Bamberg",
      "details": "03.06.2025 (Bekanntmachungsdatum)\n\nBayern Amtsgericht Bamberg HRB 7413\nRegisterbekanntmachung nach dem Umwandlungsgesetz 02.06.2025 (Eintragungsdatum)\n\nworkforce express gmbh\nGesellschaft mit beschränkter Haftung\nBamberg\n\nDen Gläubigern der an der Verschmelzung beteiligten Rechtsträger ist, wenn sie binnen sechs Monaten nach dem Tag, an dem die Eintragung der Verschmelzung in das Register des Sitzes desjenigen Rechtsträgers, dessen Gläubiger sie sind, nach § 19 Abs. 3 UmwG als bekannt gemacht gilt, ihren Anspruch nach Grund und Höhe in Textform anmelden, Sicherheit zu leisten, soweit sie nicht Befriedigung verlangen können. Dieses Recht steht den Gläubigern jedoch nur zu, wenn sie glaubhaft machen, dass durch die Verschmelzung die Erfüllung ihrer Forderung gefährdet wird."
    },
    {
      "date": "2025-06-03",
      "id": "110938",
      "original_text": "Löschungsankündigung\nBayern Amtsgericht Bayreuth HRB 4730\nRentino Rio Ltd. Zweigniederlassung Deutschland – Bayreuth",
      "type": "Löschungsankündigung",
      "state": "Bayern",
      "amtsgericht": "Amtsgericht Bayreuth",
      "registernummer": "HRB 4730",
      "registerart": "HRB",
      "company_name": "Rentino Rio Ltd. Zweigniederlassung Deutschland",
      "company_seat": "Bayreuth",
      "details": "03.06.2025 (Bekanntmachungsdatum)\n\nBayern Amtsgericht Bayreuth HRB 4730\nLöschungsankündigung\n\nRentino Rio Ltd. Zweigniederlassung Deutschland\nRechtsform ausländischen Rechts HRB\nBayreuth\n\nDas Registergericht beabsichtigt, die im Handelsregister eingetragene Zweigniederlassung von Amts wegen nach § 395 FamFG zu löschen. Die Frist zur Erhebung eines Widerspruchs ist auf drei Monate festgesetzt."
    },
    {
      "date": "2025-06-03",
      "id": "110939",
      "original_text": "Registerbekanntmachung nach dem Umwandlungsgesetz\nBayern Amtsgericht Nürnberg HRA 20260\nFahrschule Günter Neun e.K. – Nürnberg",
      "type": "Registerbekanntmachung nach dem Umwandlungsgesetz",
      "state": "Bayern",
      "amtsgericht": "Amtsgericht Nürnberg",
      "registernummer": "HRA 20260",
      "registerart": "HRA",
      "company_name": "Fahrschule Günter Neun e.K.",
      "company_seat": "Nürnberg",
      "details": "03.06.2025 (Bekanntmachungsdatum)\n\nBayern Amtsgericht Nürnberg HRA 20260\nRegisterbekanntmachung nach dem Umwandlungsgesetz 30.05.2025 (Eintragungsdatum)\n\nFahrschule Günter Neun e.K.\nEinzelkaufmann / Einzelkauffrau\nNürnberg\n\nDen Gläubigern der an der Ausgliederung beteiligten Rechtsträger ist, wenn sie binnen sechs Monaten nach dem Tag, an dem die Eintragung der Ausgliederung in das Register des Sitzes desjenigen Rechtsträgers, dessen Gläubiger sie sind, nach §§ 125, 19 Abs. 3 UmwG als bekannt gemacht gilt, ihren Anspruch nach Grund und Höhe in Textform anmelden, Sicherheit zu leisten, soweit sie nicht Befriedigung verlangen können. Dieses Recht steht den Gläubigern jedoch nur zu, wenn sie glaubhaft machen, dass durch die Ausgliederung die Erfüllung ihrer Forderung gefährdet wird."
    },
    {
      "date": "2025-06-03",
      "id": "110940",
      "original_text": "Löschungsankündigung\nBayern Amtsgericht Fürth HRB 19428\nGrundstücksprojektierung-Fürth GmbH – Fürth",
      "type": "Löschungsankündigung",
      "state": "Bayern",
      "amtsgericht": "Amtsgericht Fürth",
      "registernummer": "HRB 19428",
      "registerart": "HRB",
      "company_name": "Grundstücksprojektierung-Fürth GmbH",
      "company_seat": "Fürth",
      "details": "03.06.2025 (Bekanntmachungsdatum)\n\nBayern Amtsgericht Fürth HRB 19428\nLöschungsankündigung\n\nGrundstücksprojektierung-Fürth GmbH\nGesellschaft mit beschränkter Haftung\nFürth\n\nDas Registergericht beabsichtigt, den Geschäftsführer Dipl.Ing. Laatz Lothar, geboren am 20.08.1966, gemäß § 395 FamFG aus dem Handelsregister von Amts wegen zu löschen. Die Frist zur Erhebung eines Widerspruchs ist auf einen Monat festgesetzt."
    },
    {
      "date": "2025-06-03",
      "id": "110941",
      "original_text": "Registerbekanntmachung nach dem Umwandlungsgesetz\nBayern Amtsgericht München HRB 67495\nDAGIP Verwaltung GmbH – Pullach i. Isartal",
      "type": "Registerbekanntmachung nach dem Umwandlungsgesetz",
      "state": "Bayern",
      "amtsgericht": "Amtsgericht München",
      "registernummer": "HRB 67495",
      "registerart": "HRB",
      "company_name": "DAGIP Verwaltung GmbH",
      "company_seat": "Pullach i. Isartal",
      "details": "03.06.2025 (Bekanntmachungsdatum)\n\nBayern Amtsgericht München HRB 67495\nRegisterbekanntmachung nach dem Umwandlungsgesetz 02.06.2025 (Eintragungsdatum)\n\nDAGIP Verwaltung GmbH\nGesellschaft mit beschränkter Haftung\nPullach i. Isartal\n\nDen Gläubigern der an der Verschmelzung beteiligten Rechtsträger ist, wenn sie binnen sechs Monaten nach dem Tag, an dem die Eintragung der Verschmelzung in das Register des Sitzes desjenigen Rechtsträgers, dessen Gläubiger sie sind, nach § 19 Abs. 3 UmwG als bekannt gemacht gilt, ihren Anspruch nach Grund und Höhe in Textform anmelden, Sicherheit zu leisten, soweit sie nicht Befriedigung verlangen können. Dieses Recht steht den Gläubigern jedoch nur zu, wenn sie glaubhaft machen, dass durch die Verschmelzung die Erfüllung ihrer Forderung gefährdet wird."
    },
    {
      "date": "2025-06-03",
      "id": "110942",
      "original_text": "Registerbekanntmachung nach dem Umwandlungsgesetz\nBayern Amtsgericht Traunstein HRB 640\nInntal-Nutzfahrzeug & Transport Zentrum Handels- und Service GmbH – Raubling",
      "type": "Registerbekanntmachung nach dem Umwandlungsgesetz",
      "state": "Bayern",
      "amtsgericht": "Amtsgericht Traunstein",
      "registernummer": "HRB 640",
      "registerart": "HRB",
      "company_name": "Inntal-Nutzfahrzeug & Transport Zentrum Handels- und Service GmbH",
      "company_seat": "Raubling",
      "details": "03.06.2025 (Bekanntmachungsdatum)\n\nBayern Amtsgericht Traunstein HRB 640\nRegisterbekanntmachung nach dem Umwandlungsgesetz 02.06.2025 (Eintragungsdatum)\n\nInntal-Nutzfahrzeug & Transport Zentrum Handels- und Service GmbH\nGesellschaft mit beschränkter Haftung\nRaubling\n\nDen Gläubigern der an der Verschmelzung beteiligten Rechtsträger ist, wenn sie binnen sechs Monaten nach dem Tag, an dem die Eintragung der Verschmelzung in das Register des Sitzes desjenigen Rechtsträgers, dessen Gläubiger sie sind, nach § 19 Abs. 3 UmwG als bekannt gemacht gilt, ihren Anspruch nach Grund und Höhe in Textform anmelden, Sicherheit zu leisten, soweit sie nicht Befriedigung verlangen können. Dieses Recht steht den Gläubigern jedoch nur zu, wenn sie glaubhaft machen, dass durch die Verschmelzung die Erfüllung ihrer Forderung gefährdet wird."
    },
    {
      "date": "2025-06-03",
      "id": "110943",
      "original_text": "Einreichung neuer Dokumente\nBayern Amtsgericht Traunstein HRB 22205\nROFA INDUSTRIAL AUTOMATION AG – Kolbermoor",
      "type": "Einreichung neuer Dokumente",
      "state": "Bayern",
      "amtsgericht": "Amtsgericht Traunstein",
      "registernummer": "HRB 22205",
      "registerart": "HRB",
      "company_name": "ROFA INDUSTRIAL AUTOMATION AG",
      "company_seat": "Kolbermoor",
      "details": "03.06.2025 (Bekanntmachungsdatum)\n\nBayern Amtsgericht Traunstein HRB 22205\nEinreichung neuer Dokumente\n\nROFA INDUSTRIAL AUTOMATION AG\nAktiengesellschaft\nKolbermoor\n\nDem Amtsgericht Traunstein -Registergericht- ist eine Liste der Mitglieder des Aufsichtsrats eingereicht worden, § 106 AktG."
    },
    {
      "date": "2025-06-03",
      "id": "110944",
      "original_text": "Einreichung neuer Dokumente\nBayern Amtsgericht Kempten (Allgäu) HRB 472\n\"SOZIALBAU KEMPTEN, Wohnungs- und Städtebaugesellschaft mit beschränkter Haftung\" – Kempten (Allgäu)",
      "type": "Einreichung neuer Dokumente",
      "state": "Bayern",
      "amtsgericht": "Amtsgericht Kempten (Allgäu)",
      "registernummer": "HRB 472",
      "registerart": "HRB",
      "company_name": "\"SOZIALBAU KEMPTEN, Wohnungs- und Städtebaugesellschaft mit beschränkter Haftung\"",
      "company_seat": "Kempten (Allgäu)",
      "details": "03.06.2025 (Bekanntmachungsdatum)\n\nBayern Amtsgericht Kempten (Allgäu) HRB 472\nEinreichung neuer Dokumente 02.06.2025 (Eintragungsdatum)\n\n\"SOZIALBAU KEMPTEN, Wohnungs- und Städtebaugesellschaft mit beschränkter Haftung\"\nGesellschaft mit beschränkter Haftung\nKempten (Allgäu)\n\nDem Amtsgericht Kempten (Allgäu) -Registergericht- ist eine Liste der Mitglieder des Aufsichtsrats eingereicht worden, § 52 Abs. 3 S. 2 GmbHG."
    },
    {
      "date": "2025-06-03",
      "id": "110945",
      "original_text": "Registerbekanntmachung nach dem Umwandlungsgesetz\nBayern Amtsgericht München HRB 188616\nFiene Holding GmbH – Münsing",
      "type": "Registerbekanntmachung nach dem Umwandlungsgesetz",
      "state": "Bayern",
      "amtsgericht": "Amtsgericht München",
      "registernummer": "HRB 188616",
      "registerart": "HRB",
      "company_name": "Fiene Holding GmbH",
      "company_seat": "Münsing",
      "details": "03.06.2025 (Bekanntmachungsdatum)\n\nBayern Amtsgericht München HRB 188616\nRegisterbekanntmachung nach dem Umwandlungsgesetz 02.06.2025 (Eintragungsdatum)\n\nFiene Holding GmbH\nGesellschaft mit beschränkter Haftung\nMünsing\n\nDen Gläubigern der an der Verschmelzung beteiligten Rechtsträger ist, wenn sie binnen sechs Monaten nach dem Tag, an dem die Eintragung der Verschmelzung in das Register des Sitzes desjenigen Rechtsträgers, dessen Gläubiger sie sind, nach § 19 Abs. 3 UmwG als bekannt gemacht gilt, ihren Anspruch nach Grund und Höhe in Textform anmelden, Sicherheit zu leisten, soweit sie nicht Befriedigung verlangen können. Dieses Recht steht den Gläubigern jedoch nur zu, wenn sie glaubhaft machen, dass durch die Verschmelzung die Erfüllung ihrer Forderung gefährdet wird."
    },
    {
      "date": "2025-06-03",
      "id": "110946",
      "original_text": "Registerbekanntmachung nach dem Umwandlungsgesetz\nBayern Amtsgericht München HRB 209327\nE.ON Energie Deutschland GmbH – München",
      "type": "Registerbekanntmachung nach dem Umwandlungsgesetz",
      "state": "Bayern",
      "amtsgericht": "Amtsgericht München",
      "registernummer": "HRB 209327",
      "registerart": "HRB",
      "company_name": "E.ON Energie Deutschland GmbH",
      "company_seat": "München",
      "details": "03.06.2025 (Bekanntmachungsdatum)\n\nBayern Amtsgericht München HRB 209327\nRegisterbekanntmachung nach dem Umwandlungsgesetz 02.06.2025 (Eintragungsdatum)\n\nE.ON Energie Deutschland GmbH\nGesellschaft mit beschränkter Haftung\nMünchen\n\nDen Gläubigern der an der Verschmelzung beteiligten Rechtsträger ist, wenn sie binnen sechs Monaten nach dem Tag, an dem die Eintragung der Verschmelzung in das Register des Sitzes desjenigen Rechtsträgers, dessen Gläubiger sie sind, nach § 19 Abs. 3 UmwG als bekannt gemacht gilt, ihren Anspruch nach Grund und Höhe in Textform anmelden, Sicherheit zu leisten, soweit sie nicht Befriedigung verlangen können. Dieses Recht steht den Gläubigern jedoch nur zu, wenn sie glaubhaft machen, dass durch die Verschmelzung die Erfüllung ihrer Forderung gefährdet wird."
    },
    {
      "date": "2025-06-03",
      "id": "110947",
      "original_text": "Registerbekanntmachung nach dem Umwandlungsgesetz\nBayern Amtsgericht München HRB 265202\nDygital Aktion GmbH – München",
      "type": "Registerbekanntmachung nach dem Umwandlungsgesetz",
      "state": "Bayern",
      "amtsgericht": "Amtsgericht München",
      "registernummer": "HRB 265202",
      "registerart": "HRB",
      "company_name": "Dygital Aktion GmbH",
      "company_seat": "München",
      "details": "03.06.2025 (Bekanntmachungsdatum)\n\nBayern Amtsgericht München HRB 265202\nRegisterbekanntmachung nach dem Umwandlungsgesetz 02.06.2025 (Eintragungsdatum)\n\nDygital Aktion GmbH\nGesellschaft mit beschränkter Haftung\nMünchen\n\nDen Gläubigern der an der Verschmelzung beteiligten Rechtsträger ist, wenn sie binnen sechs Monaten nach dem Tag, an dem die Eintragung der Verschmelzung in das Register des Sitzes desjenigen Rechtsträgers, dessen Gläubiger sie sind, nach § 19 Abs. 3 UmwG als bekannt gemacht gilt, ihren Anspruch nach Grund und Höhe in Textform anmelden, Sicherheit zu leisten, soweit sie nicht Befriedigung verlangen können. Dieses Recht steht den Gläubigern jedoch nur zu, wenn sie glaubhaft machen, dass durch die Verschmelzung die Erfüllung ihrer Forderung gefährdet wird."
    },
    {
      "date": "2025-06-03",
      "id": "110948",
      "original_text": "Registerbekanntmachung nach dem Umwandlungsgesetz\nBayern Amtsgericht München HRB 194689\nHORRESCO Grundstücks-Vermietungsgesellschaft mbH – Pullach i. Isartal",
      "type": "Registerbekanntmachung nach dem Umwandlungsgesetz",
      "state": "Bayern",
      "amtsgericht": "Amtsgericht München",
      "registernummer": "HRB 194689",
      "registerart": "HRB",
      "company_name": "HORRESCO Grundstücks-Vermietungsgesellschaft mbH",
      "company_seat": "Pullach i. Isartal",
      "details": "03.06.2025 (Bekanntmachungsdatum)\n\nBayern Amtsgericht München HRB 194689\nRegisterbekanntmachung nach dem Umwandlungsgesetz 02.06.2025 (Eintragungsdatum)\n\nHORRESCO Grundstücks-Vermietungsgesellschaft mbH\nGesellschaft mit beschränkter Haftung\nPullach i. Isartal\n\nDen Gläubigern der an der Verschmelzung beteiligten Rechtsträger ist, wenn sie binnen sechs Monaten nach dem Tag, an dem die Eintragung der Verschmelzung in das Register des Sitzes desjenigen Rechtsträgers, dessen Gläubiger sie sind, nach § 19 Abs. 3 UmwG als bekannt gemacht gilt, ihren Anspruch nach Grund und Höhe in Textform anmelden, Sicherheit zu leisten, soweit sie nicht Befriedigung verlangen können. Dieses Recht steht den Gläubigern jedoch nur zu, wenn sie glaubhaft machen, dass durch die Verschmelzung die Erfüllung ihrer Forderung gefährdet wird."
    },
    {
      "date": "2025-06-03",
      "id": "110949",
      "original_text": "Registerbekanntmachung nach dem Umwandlungsgesetz\nBayern Amtsgericht Nürnberg HRA 20309\nFahrschule Neun GmbH & Co. KG – Nürnberg",
      "type": "Registerbekanntmachung nach dem Umwandlungsgesetz",
      "state": "Bayern",
      "amtsgericht": "Amtsgericht Nürnberg",
      "registernummer": "HRA 20309",
      "registerart": "HRA",
      "company_name": "Fahrschule Neun GmbH & Co. KG",
      "company_seat": "Nürnberg",
      "details": "03.06.2025 (Bekanntmachungsdatum)\n\nBayern Amtsgericht Nürnberg HRA 20309\nRegisterbekanntmachung nach dem Umwandlungsgesetz 30.05.2025 (Eintragungsdatum)\n\nFahrschule Neun GmbH & Co. KG\nKommanditgesellschaft\nNürnberg\n\nDen Gläubigern der an der Ausgliederung beteiligten Rechtsträger ist, wenn sie binnen sechs Monaten nach dem Tag, an dem die Eintragung der Ausgliederung in das Register des Sitzes desjenigen Rechtsträgers, dessen Gläubiger sie sind, nach §§ 125, 19 Abs. 3 UmwG als bekannt gemacht gilt, ihren Anspruch nach Grund und Höhe in Textform anmelden, Sicherheit zu leisten, soweit sie nicht Befriedigung verlangen können. Dieses Recht steht den Gläubigern jedoch nur zu, wenn sie glaubhaft machen, dass durch die Ausgliederung die Erfüllung ihrer Forderung gefährdet wird."
    },
    {
      "date": "2025-06-03",
      "id": "110950",
      "original_text": "Registerbekanntmachung nach dem Umwandlungsgesetz\nBayern Amtsgericht München HRB 173784\nTANIAM Verwaltung GmbH – Pullach i. Isartal",
      "type": "Registerbekanntmachung nach dem Umwandlungsgesetz",
      "state": "Bayern",
      "amtsgericht": "Amtsgericht München",
      "registernummer": "HRB 173784",
      "registerart": "HRB",
      "company_name": "TANIAM Verwaltung GmbH",
      "company_seat": "Pullach i. Isartal",
      "details": "03.06.2025 (Bekanntmachungsdatum)\n\nBayern Amtsgericht München HRB 173784\nRegisterbekanntmachung nach dem Umwandlungsgesetz 02.06.2025 (Eintragungsdatum)\n\nTANIAM Verwaltung GmbH\nGesellschaft mit beschränkter Haftung\nPullach i. Isartal\n\nDen Gläubigern der an der Verschmelzung beteiligten Rechtsträger ist, wenn sie binnen sechs Monaten nach dem Tag, an dem die Eintragung der Verschmelzung in das Register des Sitzes desjenigen Rechtsträgers, dessen Gläubiger sie sind, nach § 19 Abs. 3 UmwG als bekannt gemacht gilt, ihren Anspruch nach Grund und Höhe in Textform anmelden, Sicherheit zu leisten, soweit sie nicht Befriedigung verlangen können. Dieses Recht steht den Gläubigern jedoch nur zu, wenn sie glaubhaft machen, dass durch die Verschmelzung die Erfüllung ihrer Forderung gefährdet wird."
    },
    {
      "date": "2025-06-03",
      "id": "110951",
      "original_text": "Registerbekanntmachung nach dem Umwandlungsgesetz\nBayern Amtsgericht München HRB 142283\nLEANDA Beteiligungs GmbH – Pullach i. Isartal",
      "type": "Registerbekanntmachung nach dem Umwandlungsgesetz",
      "state": "Bayern",
      "amtsgericht": "Amtsgericht München",
      "registernummer": "HRB 142283",
      "registerart": "HRB",
      "company_name": "LEANDA Beteiligungs GmbH",
      "company_seat": "Pullach i. Isartal",
      "details": "03.06.2025 (Bekanntmachungsdatum)\n\nBayern Amtsgericht München HRB 142283\nRegisterbekanntmachung nach dem Umwandlungsgesetz 02.06.2025 (Eintragungsdatum)\n\nLEANDA Beteiligungs GmbH\nGesellschaft mit beschränkter Haftung\nPullach i. Isartal\n\nDen Gläubigern der an der Verschmelzung beteiligten Rechtsträger ist, wenn sie binnen sechs Monaten nach dem Tag, an dem die Eintragung der Verschmelzung in das Register des Sitzes desjenigen Rechtsträgers, dessen Gläubiger sie sind, nach § 19 Abs. 3 UmwG als bekannt gemacht gilt, ihren Anspruch nach Grund und Höhe in Textform anmelden, Sicherheit zu leisten, soweit sie nicht Befriedigung verlangen können. Dieses Recht steht den Gläubigern jedoch nur zu, wenn sie glaubhaft machen, dass durch die Verschmelzung die Erfüllung ihrer Forderung gefährdet wird."
    },
    {
      "date": "2025-06-03",
      "id": "110952",
      "original_text": "Einreichung neuer Dokumente\nBayern Amtsgericht Regensburg HRB 10248\nSana Kliniken des Landkreises Cham GmbH – Cham",
      "type": "Einreichung neuer Dokumente",
      "state": "Bayern",
      "amtsgericht": "Amtsgericht Regensburg",
      "registernummer": "HRB 10248",
      "registerart": "HRB",
      "company_name": "Sana Kliniken des Landkreises Cham GmbH",
      "company_seat": "Cham",
      "details": "03.06.2025 (Bekanntmachungsdatum)\n\nBayern Amtsgericht Regensburg HRB 10248\nEinreichung neuer Dokumente\n\nSana Kliniken des Landkreises Cham GmbH\nGesellschaft mit beschränkter Haftung\nCham\n\nDem Amtsgericht Regensburg -Registergericht- ist eine Liste der Mitglieder des Aufsichtsrats eingereicht worden, § 52 Abs. 3 S. 2 GmbHG."
    },
    {
      "date": "2025-06-03",
      "id": "110953",
      "original_text": "Registerbekanntmachung nach dem Umwandlungsgesetz\nBayern Amtsgericht München HRB 145484\nBILUDIS Beteiligungs GmbH – Pullach i. Isartal, Lkr. München",
      "type": "Registerbekanntmachung nach dem Umwandlungsgesetz",
      "state": "Bayern",
      "amtsgericht": "Amtsgericht München",
      "registernummer": "HRB 145484",
      "registerart": "HRB",
      "company_name": "BILUDIS Beteiligungs GmbH",
      "company_seat": "Pullach i. Isartal, Lkr. München",
      "details": "03.06.2025 (Bekanntmachungsdatum)\n\nBayern Amtsgericht München HRB 145484\nRegisterbekanntmachung nach dem Umwandlungsgesetz 02.06.2025 (Eintragungsdatum)\n\nBILUDIS Beteiligungs GmbH\nGesellschaft mit beschränkter Haftung\nPullach i. Isartal, Lkr. München\n\nDen Gläubigern der an der Verschmelzung beteiligten Rechtsträger ist, wenn sie binnen sechs Monaten nach dem Tag, an dem die Eintragung der Verschmelzung in das Register des Sitzes desjenigen Rechtsträgers, dessen Gläubiger sie sind, nach § 19 Abs. 3 UmwG als bekannt gemacht gilt, ihren Anspruch nach Grund und Höhe in Textform anmelden, Sicherheit zu leisten, soweit sie nicht Befriedigung verlangen können. Dieses Recht steht den Gläubigern jedoch nur zu, wenn sie glaubhaft machen, dass durch die Verschmelzung die Erfüllung ihrer Forderung gefährdet wird."
    },
    {
      "date": "2025-06-03",
      "id": "110954",
      "original_text": "Registerbekanntmachung nach dem Umwandlungsgesetz\nBayern Amtsgericht München HRB 112427\nZEPAS Beteiligungs GmbH – Pullach i. Isartal",
      "type": "Registerbekanntmachung nach dem Umwandlungsgesetz",
      "state": "Bayern",
      "amtsgericht": "Amtsgericht München",
      "registernummer": "HRB 112427",
      "registerart": "HRB",
      "company_name": "ZEPAS Beteiligungs GmbH",
      "company_seat": "Pullach i. Isartal",
      "details": "03.06.2025 (Bekanntmachungsdatum)\n\nBayern Amtsgericht München HRB 112427\nRegisterbekanntmachung nach dem Umwandlungsgesetz 02.06.2025 (Eintragungsdatum)\n\nZEPAS Beteiligungs GmbH\nGesellschaft mit beschränkter Haftung\nPullach i. Isartal\n\nDen Gläubigern der an der Verschmelzung beteiligten Rechtsträger ist, wenn sie binnen sechs Monaten nach dem Tag, an dem die Eintragung der Verschmelzung in das Register des Sitzes desjenigen Rechtsträgers, dessen Gläubiger sie sind, nach § 19 Abs. 3 UmwG als bekannt gemacht gilt, ihren Anspruch nach Grund und Höhe in Textform anmelden, Sicherheit zu leisten, soweit sie nicht Befriedigung verlangen können. Dieses Recht steht den Gläubigern jedoch nur zu, wenn sie glaubhaft machen, dass durch die Verschmelzung die Erfüllung ihrer Forderung gefährdet wird."
    },
    {
      "date": "2025-06-03",
      "id": "110955",
      "original_text": "Registerbekanntmachung nach dem Umwandlungsgesetz\nBayern Amtsgericht München HRB 45396\nATALANTA Verwaltung GmbH – Pullach i. Isartal",
      "type": "Registerbekanntmachung nach dem Umwandlungsgesetz",
      "state": "Bayern",
      "amtsgericht": "Amtsgericht München",
      "registernummer": "HRB 45396",
      "registerart": "HRB",
      "company_name": "ATALANTA Verwaltung GmbH",
      "company_seat": "Pullach i. Isartal",
      "details": "03.06.2025 (Bekanntmachungsdatum)\n\nBayern Amtsgericht München HRB 45396\nRegisterbekanntmachung nach dem Umwandlungsgesetz 02.06.2025 (Eintragungsdatum)\n\nATALANTA Verwaltung GmbH\nGesellschaft mit beschränkter Haftung\nPullach i. Isartal\n\nDen Gläubigern der an der Verschmelzung beteiligten Rechtsträger ist, wenn sie binnen sechs Monaten nach dem Tag, an dem die Eintragung der Verschmelzung in das Register des Sitzes desjenigen Rechtsträgers, dessen Gläubiger sie sind, nach § 19 Abs. 3 UmwG als bekannt gemacht gilt, ihren Anspruch nach Grund und Höhe in Textform anmelden, Sicherheit zu leisten, soweit sie nicht Befriedigung verlangen können. Dieses Recht steht den Gläubigern jedoch nur zu, wenn sie glaubhaft machen, dass durch die Verschmelzung die Erfüllung ihrer Forderung gefährdet wird."
    },
    {
      "date": "2025-06-03",
      "id": "110956",
      "original_text": "Registerbekanntmachung nach dem Umwandlungsgesetz\nBayern Amtsgericht Aschaffenburg HRB 18010\nPadel Base GmbH – Stockstadt am Main",
      "type": "Registerbekanntmachung nach dem Umwandlungsgesetz",
      "state": "Bayern",
      "amtsgericht": "Amtsgericht Aschaffenburg",
      "registernummer": "HRB 18010",
      "registerart": "HRB",
      "company_name": "Padel Base GmbH",
      "company_seat": "Stockstadt am Main",
      "details": "03.06.2025 (Bekanntmachungsdatum)\n\nBayern Amtsgericht Aschaffenburg HRB 18010\nRegisterbekanntmachung nach dem Umwandlungsgesetz 02.06.2025 (Eintragungsdatum)\n\nPadel Base GmbH\nGesellschaft mit beschränkter Haftung\nStockstadt am Main\n\nDen Gläubigern der an der Verschmelzung beteiligten Rechtsträger ist, wenn sie binnen sechs Monaten nach dem Tag, an dem die Eintragung der Verschmelzung in das Register des Sitzes desjenigen Rechtsträgers, dessen Gläubiger sie sind, nach § 19 Abs. 3 UmwG als bekannt gemacht gilt, ihren Anspruch nach Grund und Höhe in Textform anmelden, Sicherheit zu leisten, soweit sie nicht Befriedigung verlangen können. Dieses Recht steht den Gläubigern jedoch nur zu, wenn sie glaubhaft machen, dass durch die Verschmelzung die Erfüllung ihrer Forderung gefährdet wird."
    },
    {
      "date": "2025-06-03",
      "id": "110957",
      "original_text": "Löschungsankündigung\nBayern Amtsgericht Fürth HRB 16758\nTKL Transportkontor-Logistik GmbH – Heroldsberg",
      "type": "Löschungsankündigung",
      "state": "Bayern",
      "amtsgericht": "Amtsgericht Fürth",
      "registernummer": "HRB 16758",
      "registerart": "HRB",
      "company_name": "TKL Transportkontor-Logistik GmbH",
      "company_seat": "Heroldsberg",
      "details": "03.06.2025 (Bekanntmachungsdatum)\n\nBayern Amtsgericht Fürth HRB 16758\nLöschungsankündigung\n\nTKL Transportkontor-Logistik GmbH\nGesellschaft mit beschränkter Haftung\nHeroldsberg\n\nDas Registergericht beabsichtigt, die im Handelsregister eingetragene Gesellschaft wegen Vermögenslosigkeit von Amts wegen nach § 394 FamFG zu löschen. Die Frist zur Erhebung eines Widerspruchs ist auf drei Monate festgesetzt."
    },
    {
      "date": "2025-06-03",
      "id": "110958",
      "original_text": "Registerbekanntmachung nach dem Umwandlungsgesetz\nBayern Amtsgericht Bamberg HRB 8699\n3i GmbH – Bamberg",
      "type": "Registerbekanntmachung nach dem Umwandlungsgesetz",
      "state": "Bayern",
      "amtsgericht": "Amtsgericht Bamberg",
      "registernummer": "HRB 8699",
      "registerart": "HRB",
      "company_name": "3i GmbH",
      "company_seat": "Bamberg",
      "details": "03.06.2025 (Bekanntmachungsdatum)\n\nBayern Amtsgericht Bamberg HRB 8699\nRegisterbekanntmachung nach dem Umwandlungsgesetz 02.06.2025 (Eintragungsdatum)\n\n3i GmbH\nGesellschaft mit beschränkter Haftung\nBamberg\n\nDen Gläubigern der an der Verschmelzung beteiligten Rechtsträger ist, wenn sie binnen sechs Monaten nach dem Tag, an dem die Eintragung der Verschmelzung in das Register des Sitzes desjenigen Rechtsträgers, dessen Gläubiger sie sind, nach § 19 Abs. 3 UmwG als bekannt gemacht gilt, ihren Anspruch nach Grund und Höhe in Textform anmelden, Sicherheit zu leisten, soweit sie nicht Befriedigung verlangen können. Dieses Recht steht den Gläubigern jedoch nur zu, wenn sie glaubhaft machen, dass durch die Verschmelzung die Erfüllung ihrer Forderung gefährdet wird."
    },
    {
      "date": "2025-06-03",
      "id": "110959",
      "original_text": "Registerbekanntmachung nach dem Umwandlungsgesetz\nBayern Amtsgericht Traunstein HRA 6421\nJohann Dettendorfer Spedition, Ferntrans GmbH & Co. KG – Nußdorf a.Inn",
      "type": "Registerbekanntmachung nach dem Umwandlungsgesetz",
      "state": "Bayern",
      "amtsgericht": "Amtsgericht Traunstein",
      "registernummer": "HRA 6421",
      "registerart": "HRA",
      "company_name": "Johann Dettendorfer Spedition, Ferntrans GmbH & Co. KG",
      "company_seat": "Nußdorf a.Inn",
      "details": "03.06.2025 (Bekanntmachungsdatum)\n\nBayern Amtsgericht Traunstein HRA 6421\nRegisterbekanntmachung nach dem Umwandlungsgesetz 02.06.2025 (Eintragungsdatum)\n\nJohann Dettendorfer Spedition, Ferntrans GmbH & Co. KG\nKommanditgesellschaft\nNußdorf a.Inn\n\nDen Gläubigern der an der Verschmelzung beteiligten Rechtsträger ist, wenn sie binnen sechs Monaten nach dem Tag, an dem die Eintragung der Verschmelzung in das Register des Sitzes desjenigen Rechtsträgers, dessen Gläubiger sie sind, nach § 19 Abs. 3 UmwG als bekannt gemacht gilt, ihren Anspruch nach Grund und Höhe in Textform anmelden, Sicherheit zu leisten, soweit sie nicht Befriedigung verlangen können. Dieses Recht steht den Gläubigern jedoch nur zu, wenn sie glaubhaft machen, dass durch die Verschmelzung die Erfüllung ihrer Forderung gefährdet wird."
    },
    {
      "date": "2025-06-03",
      "id": "110960",
      "original_text": "Löschungsankündigung\nBerlin Amtsgericht Berlin (Charlottenburg) HRB 125515\nMilk and Honey Tours GmbH – Berlin",
      "type": "Löschungsankündigung",
      "state": "Berlin",
      "amtsgericht": "Amtsgericht Berlin (Charlottenburg)",
      "registernummer": "HRB 125515",
      "registerart": "HRB",
      "company_name": "Milk and Honey Tours GmbH",
      "company_seat": "Berlin",
      "details": "03.06.2025 (Bekanntmachungsdatum)\n\nBerlin Amtsgericht Berlin (Charlottenburg) HRB 125515\nLöschungsankündigung\n\nMilk and Honey Tours GmbH\nGesellschaft mit beschränkter Haftung\nBerlin\n\nBei der nachstehenden Gesellschaft wird das Amtslöschungsverfahren gemäß § 394 FamFG eingeleitet. Widerspruchsfrist: 6 Wochen."
    },
    {
      "date": "2025-06-03",
      "id": "110961",
      "original_text": "Einreichung neuer Dokumente\nBerlin Amtsgericht Berlin (Charlottenburg) HRB 162426\nICE International Copyright Enterprise Germany GmbH – Berlin",
      "type": "Einreichung neuer Dokumente",
      "state": "Berlin",
      "amtsgericht": "Amtsgericht Berlin (Charlottenburg)",
      "registernummer": "HRB 162426",
      "registerart": "HRB",
      "company_name": "ICE International Copyright Enterprise Germany GmbH",
      "company_seat": "Berlin",
      "details": "03.06.2025 (Bekanntmachungsdatum)\n\nBerlin Amtsgericht Berlin (Charlottenburg) HRB 162426\nEinreichung neuer Dokumente\n\nICE International Copyright Enterprise Germany GmbH\nGesellschaft mit beschränkter Haftung\nBerlin\n\nAls nicht eingetragen wird veröffentlicht: Es wurde eine neue Liste der Aufsichtsratsmitglieder eingereicht (§52 GmbHG)."
    },
    {
      "date": "2025-06-03",
      "id": "110962",
      "original_text": "Registerbekanntmachung nach dem Umwandlungsgesetz\nBerlin Amtsgericht Berlin (Charlottenburg) HRB 118384\nCollignon Planung und Design GmbH – Berlin",
      "type": "Registerbekanntmachung nach dem Umwandlungsgesetz",
      "state": "Berlin",
      "amtsgericht": "Amtsgericht Berlin (Charlottenburg)",
      "registernummer": "HRB 118384",
      "registerart": "HRB",
      "company_name": "Collignon Planung und Design GmbH",
      "company_seat": "Berlin",
      "details": "03.06.2025 (Bekanntmachungsdatum)\n\nBerlin Amtsgericht Berlin (Charlottenburg) HRB 118384\nRegisterbekanntmachung nach dem Umwandlungsgesetz 30.05.2025 (Eintragungsdatum)\n\nCollignon Planung und Design GmbH\nGesellschaft mit beschränkter Haftung\nBerlin\n\nZu Eintragungsnummer 7 vom 30.05.2025 wird als nicht eingetragen veröffentlicht: Den Gläubigern der an der Verschmelzung beteiligten Rechtsträger ist, wenn sie binnen sechs Monaten nach dem Tag, an dem die Eintragung der Verschmelzung in das Register des Sitzes desjenigen Rechtsträgers, dessen Gläubiger sie sind, als bekannt gemacht gilt, ihren Anspruch nach Grund und Höhe schriftlich anmelden, Sicherheit zu leisten, soweit sie nicht Befriedigung verlangen können. Dieses Recht steht den Gläubigern jedoch nur zu, wenn sie glaubhaft machen, dass durch die Verschmelzung die Erfüllung ihrer Forderung gefährdet wird. Das Recht, Sicherheitsleistung zu verlangen, steht Gläubigern nicht zu, die im Falle der Insolvenz ein Recht auf vorzugsweise Befriedigung aus einer Deckungsmasse haben, die nach gesetzlicher Vorschrift zu ihrem Schutz errichtet und staatlich überwacht ist."
    },
    {
      "date": "2025-06-03",
      "id": "110963",
      "original_text": "Sonstige Registerbekanntmachung\nBerlin Amtsgericht Berlin (Charlottenburg) HRB 38874\nBeta Systems Software Aktiengesellschaft – Berlin",
      "type": "Sonstige Registerbekanntmachung",
      "state": "Berlin",
      "amtsgericht": "Amtsgericht Berlin (Charlottenburg)",
      "registernummer": "HRB 38874",
      "registerart": "HRB",
      "company_name": "Beta Systems Software Aktiengesellschaft",
      "company_seat": "Berlin",
      "details": "03.06.2025 (Bekanntmachungsdatum)\n\nBerlin Amtsgericht Berlin (Charlottenburg) HRB 38874\nSonstige Registerbekanntmachung\n\nBeta Systems Software Aktiengesellschaft\nAktiengesellschaft\nBerlin\n\nAls nicht eingetragen wird veröffentlicht:Es wurde eine neue Liste der Aufsichtsratsmitglieder eingereicht (§ 106 AktG)."
    },
    {
      "date": "2025-06-03",
      "id": "110964",
      "original_text": "Löschungsankündigung\nBerlin Amtsgericht Berlin (Charlottenburg) HRB 197509\nG.T.W. Service UG (haftungsbeschränkt) – Berlin",
      "type": "Löschungsankündigung",
      "state": "Berlin",
      "amtsgericht": "Amtsgericht Berlin (Charlottenburg)",
      "registernummer": "HRB 197509",
      "registerart": "HRB",
      "company_name": "G.T.W. Service UG (haftungsbeschränkt)",
      "company_seat": "Berlin",
      "details": "03.06.2025 (Bekanntmachungsdatum)\n\nBerlin Amtsgericht Berlin (Charlottenburg) HRB 197509\nLöschungsankündigung\n\nG.T.W. Service UG (haftungsbeschränkt)\nGesellschaft mit beschränkter Haftung\nBerlin\n\nBei der nachstehenden Gesellschaft wird das Amtslöschungsverfahren gemäß § 394 FamFG eingeleitet. Widerspruchsfrist: 6 Wochen."
    },
    {
      "date": "2025-06-03",
      "id": "110965",
      "original_text": "Löschungsankündigung\nBerlin Amtsgericht Berlin (Charlottenburg) HRB 188465\nParcheggio Verwaltungs UG (haftungsbeschränkt) – Berlin",
      "type": "Löschungsankündigung",
      "state": "Berlin",
      "amtsgericht": "Amtsgericht Berlin (Charlottenburg)",
      "registernummer": "HRB 188465",
      "registerart": "HRB",
      "company_name": "Parcheggio Verwaltungs UG (haftungsbeschränkt)",
      "company_seat": "Berlin",
      "details": "03.06.2025 (Bekanntmachungsdatum)\n\nBerlin Amtsgericht Berlin (Charlottenburg) HRB 188465\nLöschungsankündigung\n\nParcheggio Verwaltungs UG (haftungsbeschränkt)\nGesellschaft mit beschränkter Haftung\nBerlin\n\nBei der nachstehenden Gesellschaft wird das Amtslöschungsverfahren gemäß § 394 FamFG eingeleitet. Widerspruchsfrist: 6 Wochen."
    },
    {
      "date": "2025-06-03",
      "id": "110966",
      "original_text": "Registerbekanntmachung nach dem Umwandlungsgesetz\nBrandenburg Amtsgericht Potsdam HRB 33511\nHEM Consulting GmbH – Kleinmachnow",
      "type": "Registerbekanntmachung nach dem Umwandlungsgesetz",
      "state": "Brandenburg",
      "amtsgericht": "Amtsgericht Potsdam",
      "registernummer": "HRB 33511",
      "registerart": "HRB",
      "company_name": "HEM Consulting GmbH",
      "company_seat": "Kleinmachnow",
      "details": "03.06.2025 (Bekanntmachungsdatum)\n\nBrandenburg Amtsgericht Potsdam HRB 33511\nRegisterbekanntmachung nach dem Umwandlungsgesetz 02.06.2025 (Eintragungsdatum)\n\nHEM Consulting GmbH\nGesellschaft mit beschränkter Haftung\nKleinmachnow\n\nZu Eintragungsnummer 3 vom 02.06.2025 wird als nicht eingetragen veröffentlicht:\nDen Gläubigern der an der Verschmelzung beteiligten Rechtsträger ist, wenn sie binnen sechs Monaten nach dem Tag, an dem die Eintragung der Verschmelzung in das Register des Sitzes desjenigen Rechtsträgers, dessen Gläubiger sie sind, als bekannt gemacht gilt, ihren Anspruch nach Grund und Höhe schriftlich anmelden, Sicherheit zu leisten, soweit sie nicht Befriedigung verlangen können. Dieses Recht steht den Gläubigern jedoch nur zu, wenn sie glaubhaft machen, dass durch die Verschmelzung die Erfüllung ihrer Forderung gefährdet wird"
    },
    {
      "date": "2025-06-03",
      "id": "110967",
      "original_text": "Registerbekanntmachung nach dem Umwandlungsgesetz\nHamburg Amtsgericht Hamburg HRB 180005\nERG Hamburg Holding GmbH – Hamburg",
      "type": "Registerbekanntmachung nach dem Umwandlungsgesetz",
      "state": "Hamburg",
      "amtsgericht": "Amtsgericht Hamburg",
      "registernummer": "HRB 180005",
      "registerart": "HRB",
      "company_name": "ERG Hamburg Holding GmbH",
      "company_seat": "Hamburg",
      "details": "03.06.2025 (Bekanntmachungsdatum)\n\nHamburg Amtsgericht Hamburg HRB 180005\nRegisterbekanntmachung nach dem Umwandlungsgesetz\n\nERG Hamburg Holding GmbH\nGesellschaft mit beschränkter Haftung\nHamburg\n\nAls nicht eingetragen wird bekanntgemacht:\nEs wird darauf hingewiesen, dass ein Verschmelzungsplan oder sein Entwurf über eine grenzüberschreitende Verschmelzung zur Aufnahme mit der ERG Spain Holdco, S.L.U. mit Sitz in Madrid/Spanien (Registro Mercantil de Madrid B67715946) (sociedad de responsabilidad limitada - Gesellschaft mit beschränkter Haftung nach spanischem Recht) beim Handelsregister eingereicht worden ist.\nDie Anteilsinhaber, die Gläubiger sowie die zuständigen Betriebsräte der an der grenzüberschreitenden Verschmelzung beteiligten Gesellschaften oder, soweit es keinen Betriebsrat gibt, die Arbeitnehmer der an der grenzüberschreitenden Verschmelzung beteiligten Gesellschaften, können der jeweiligen Gesellschaft spätestens fünf Arbeitstage vor dem Tag der Gesellschafterversammlung Bemerkungen zum Verschmelzungsplan übermitteln."
    },
    {
      "date": "2025-06-03",
      "id": "110968",
      "original_text": "Löschungsankündigung\nBaden-Württemberg Amtsgericht Stuttgart HRB 410985\nGÜNTHER-LEHNER-STIFTUNG GmbH – Rosenfeld",
      "type": "Löschungsankündigung",
      "state": "Baden-Württemberg",
      "amtsgericht": "Amtsgericht Stuttgart",
      "registernummer": "HRB 410985",
      "registerart": "HRB",
      "company_name": "GÜNTHER-LEHNER-STIFTUNG GmbH",
      "company_seat": "Rosenfeld",
      "details": "03.06.2025 (Bekanntmachungsdatum)\n\nBaden-Württemberg Amtsgericht Stuttgart HRB 410985\nLöschungsankündigung\n\nGÜNTHER-LEHNER-STIFTUNG GmbH\nGesellschaft mit beschränkter Haftung\nRosenfeld\n\nAls nicht eingetragen wird bekanntgemacht:\nDas Gericht beabsichtigt, die Gesellschaft wegen Vermögenslosigkeit im Handelsregister von Amts wegen nach § 394 FamFG zu löschen. Die Frist zur Geltendmachung eines Widerspruchs gegen die beabsichtigte Löschung ist auf zwei Monate ab Veröffentlichung bestimmt."
    },
    {
      "date": "2025-06-03",
      "id": "110969",
      "original_text": "Registerbekanntmachung nach dem Umwandlungsgesetz\nBaden-Württemberg Amtsgericht Stuttgart HRB 222795\nLepper Pensions- und Verwaltungs GmbH – Nürtingen",
      "type": "Registerbekanntmachung nach dem Umwandlungsgesetz",
      "state": "Baden-Württemberg",
      "amtsgericht": "Amtsgericht Stuttgart",
      "registernummer": "HRB 222795",
      "registerart": "HRB",
      "company_name": "Lepper Pensions- und Verwaltungs GmbH",
      "company_seat": "Nürtingen",
      "details": "03.06.2025 (Bekanntmachungsdatum)\n\nBaden-Württemberg Amtsgericht Stuttgart HRB 222795\nRegisterbekanntmachung nach dem Umwandlungsgesetz 03.06.2025 (Eintragungsdatum)\n\nLepper Pensions- und Verwaltungs GmbH\nGesellschaft mit beschränkter Haftung\nNürtingen\n\nAls nicht eingetragen wird bekanntgemacht:\nDen Gläubigern der an der Ausgliederung beteiligten Rechtsträger ist, wenn sie binnen sechs Monaten nach dem Tag, an dem die Eintragung der Ausgliederung in das Register des Sitzes desjenigen Rechtsträgers, dessen Gläubiger sie sind, nach § 19 Abs. 3 UmwG als bekanntgemacht gilt, ihren Anspruch nach Grund und Höhe schriftlich anmelden, Sicherheit zu leisten, soweit sie nicht Befriedigung verlangen können. Dieses Recht steht den Gläubigern jedoch nur zu, wenn sie glaubhaft machen, dass durch die Ausgliederung die Erfüllung ihrer Forderung gefährdet wird."
    },
    {
      "date": "2025-06-03",
      "id": "110970",
      "original_text": "Löschungsankündigung\nBaden-Württemberg Amtsgericht Mannheim HRB 713070\nKURUBEY GmbH – Mannheim",
      "type": "Löschungsankündigung",
      "state": "Baden-Württemberg",
      "amtsgericht": "Amtsgericht Mannheim",
      "registernummer": "HRB 713070",
      "registerart": "HRB",
      "company_name": "KURUBEY GmbH",
      "company_seat": "Mannheim",
      "details": "03.06.2025 (Bekanntmachungsdatum)\n\nBaden-Württemberg Amtsgericht Mannheim HRB 713070\nLöschungsankündigung\n\nKURUBEY GmbH\nGesellschaft mit beschränkter Haftung\nMannheim\n\nDas Gericht beabsichtigt, die Gesellschaft wegen Vermögenslosigkeit im Handelsregister von Amts wegen nach § 394 FamFG zu löschen. Die Frist zur Geltendmachung eines Widerspruchs gegen die beabsichtigte Löschung ist auf einen Monat ab Veröffentlichung bestimmt."
    },
    {
      "date": "2025-06-03",
      "id": "110971",
      "original_text": "Registerbekanntmachung nach dem Umwandlungsgesetz\nBaden-Württemberg Amtsgericht Freiburg HRB 490633\nH + T Hotel und Touristik GmbH – Oberkirch",
      "type": "Registerbekanntmachung nach dem Umwandlungsgesetz",
      "state": "Baden-Württemberg",
      "amtsgericht": "Amtsgericht Freiburg",
      "registernummer": "HRB 490633",
      "registerart": "HRB",
      "company_name": "H + T Hotel und Touristik GmbH",
      "company_seat": "Oberkirch",
      "details": "03.06.2025 (Bekanntmachungsdatum)\n\nBaden-Württemberg Amtsgericht Freiburg HRB 490633\nRegisterbekanntmachung nach dem Umwandlungsgesetz 03.06.2025 (Eintragungsdatum)\n\nH + T Hotel und Touristik GmbH\nGesellschaft mit beschränkter Haftung\nOberkirch\n\nAls nicht eingetragen wird bekanntgemacht:\nDen Gläubigern der an der Verschmelzung beteiligten Rechtsträger ist, wenn sie binnen sechs Monaten nach dem Tag, an dem die Eintragung der Verschmelzung in das Register des Sitzes desjenigen Rechtsträgers, dessen Gläubiger sie sind, nach § 19 Abs. 3 UmwG als bekanntgemacht gilt, ihren Anspruch nach Grund und Höhe schriftlich anmelden, Sicherheit zu leisten, soweit sie nicht Befriedigung verlangen können. Dieses Recht steht den Gläubigern jedoch nur zu, wenn sie glaubhaft machen, dass durch die Verschmelzung die Erfüllung ihrer Forderung gefährdet wird."
    },
    {
      "date": "2025-06-03",
      "id": "110972",
      "original_text": "Registerbekanntmachung nach dem Umwandlungsgesetz\nBaden-Württemberg Amtsgericht Freiburg HRB 722631\nAOX Drive GmbH – Villingen-Schwenningen",
      "type": "Registerbekanntmachung nach dem Umwandlungsgesetz",
      "state": "Baden-Württemberg",
      "amtsgericht": "Amtsgericht Freiburg",
      "registernummer": "HRB 722631",
      "registerart": "HRB",
      "company_name": "AOX Drive GmbH",
      "company_seat": "Villingen-Schwenningen",
      "details": "03.06.2025 (Bekanntmachungsdatum)\n\nBaden-Württemberg Amtsgericht Freiburg HRB 722631\nRegisterbekanntmachung nach dem Umwandlungsgesetz 03.06.2025 (Eintragungsdatum)\n\nAOX Drive GmbH\nGesellschaft mit beschränkter Haftung\nVillingen-Schwenningen\n\nAls nicht eingetragen wird bekanntgemacht:\nDen Gläubigern der an der Verschmelzung beteiligten Rechtsträger ist, wenn sie binnen sechs Monaten nach dem Tag, an dem die Eintragung der Verschmelzung in das Register des Sitzes desjenigen Rechtsträgers, dessen Gläubiger sie sind, nach § 19 Abs. 3 UmwG als bekanntgemacht gilt, ihren Anspruch nach Grund und Höhe schriftlich anmelden, Sicherheit zu leisten, soweit sie nicht Befriedigung verlangen können. Dieses Recht steht den Gläubigern jedoch nur zu, wenn sie glaubhaft machen, dass durch die Verschmelzung die Erfüllung ihrer Forderung gefährdet wird."
    },
    {
      "date": "2025-06-03",
      "id": "110973",
      "original_text": "Löschungsankündigung\nMecklenburg-Vorpommern Amtsgericht Stralsund HRA 2670\nCamp Peenemünde GmbH & Co. KG – Peenemünde",
      "type": "Löschungsankündigung",
      "state": "Mecklenburg-Vorpommern",
      "amtsgericht": "Amtsgericht Stralsund",
      "registernummer": "HRA 2670",
      "registerart": "HRA",
      "company_name": "Camp Peenemünde GmbH & Co. KG",
      "company_seat": "Peenemünde",
      "details": "03.06.2025 (Bekanntmachungsdatum)\n\nMecklenburg-Vorpommern Amtsgericht Stralsund HRA 2670\nLöschungsankündigung 03.06.2025 (Eintragungsdatum)\n\nCamp Peenemünde GmbH & Co. KG\nKommanditgesellschaft\nPeenemünde\n\nDas Registergericht beabsichtigt, den/die im Handelsregister eingetragene/n Kaufmann/Kauffrau von Amts wegen nach § 393 FamFG zu löschen. Die Frist zur Erhebung eines Widerspruchs gegen die beabsichtigte Löschung wird auf einen Monat festgesetzt."
    },
    {
      "date": "2025-06-03",
      "id": "110974",
      "original_text": "Registerbekanntmachung nach dem Umwandlungsgesetz\nBaden-Württemberg Amtsgericht Freiburg HRB 700881\nFIDELITAS-BAU u. IMMOBILIEN Gesellschaft mit beschränkter Haftung – Oberkirch",
      "type": "Registerbekanntmachung nach dem Umwandlungsgesetz",
      "state": "Baden-Württemberg",
      "amtsgericht": "Amtsgericht Freiburg",
      "registernummer": "HRB 700881",
      "registerart": "HRB",
      "company_name": "FIDELITAS-BAU u. IMMOBILIEN Gesellschaft mit beschränkter Haftung",
      "company_seat": "Oberkirch",
      "details": "03.06.2025 (Bekanntmachungsdatum)\n\nBaden-Württemberg Amtsgericht Freiburg HRB 700881\nRegisterbekanntmachung nach dem Umwandlungsgesetz 03.06.2025 (Eintragungsdatum)\n\nFIDELITAS-BAU u. IMMOBILIEN Gesellschaft mit beschränkter Haftung\nGesellschaft mit beschränkter Haftung\nOberkirch\n\nDen Gläubigern der an der Verschmelzung beteiligten Rechtsträger ist, wenn sie binnen sechs Monaten nach dem Tag, an dem die Eintragung der Verschmelzung in das Register des Sitzes desjenigen Rechtsträgers, dessen Gläubiger sie sind, nach § 19 Abs. 3 UmwG als bekanntgemacht gilt, ihren Anspruch nach Grund und Höhe schriftlich anmelden, Sicherheit zu leisten, soweit sie nicht Befriedigung verlangen können. Dieses Recht steht den Gläubigern jedoch nur zu, wenn sie glaubhaft machen, dass durch die Verschmelzung die Erfüllung ihrer Forderung gefährdet wird."
    },
    {
      "date": "2025-06-03",
      "id": "110975",
      "original_text": "Einreichung neuer Dokumente\nBaden-Württemberg Amtsgericht Freiburg HRB 700881\nFIDELITAS-BAU u. IMMOBILIEN Gesellschaft mit beschränkter Haftung – Oberkirch",
      "type": "Einreichung neuer Dokumente",
      "state": "Baden-Württemberg",
      "amtsgericht": "Amtsgericht Freiburg",
      "registernummer": "HRB 700881",
      "registerart": "HRB",
      "company_name": "FIDELITAS-BAU u. IMMOBILIEN Gesellschaft mit beschränkter Haftung",
      "company_seat": "Oberkirch",
      "details": "03.06.2025 (Bekanntmachungsdatum)\n\nBaden-Württemberg Amtsgericht Freiburg HRB 700881\nEinreichung neuer Dokumente 03.06.2025 (Eintragungsdatum)\n\nFIDELITAS-BAU u. IMMOBILIEN Gesellschaft mit beschränkter Haftung\nGesellschaft mit beschränkter Haftung\nOberkirch\n\nDen Gläubigern der an der Verschmelzung beteiligten Rechtsträger ist, wenn sie binnen sechs Monaten nach dem Tag, an dem die Eintragung der Verschmelzung in das Register des Sitzes desjenigen Rechtsträgers, dessen Gläubiger sie sind, nach § 19 Abs. 3 UmwG als bekanntgemacht gilt, ihren Anspruch nach Grund und Höhe schriftlich anmelden, Sicherheit zu leisten, soweit sie nicht Befriedigung verlangen können. Dieses Recht steht den Gläubigern jedoch nur zu, wenn sie glaubhaft machen, dass durch die Verschmelzung die Erfüllung ihrer Forderung gefährdet wird."
    },
    {
      "date": "2025-06-03",
      "id": "110976",
      "original_text": "Registerbekanntmachung nach dem Umwandlungsgesetz\nBaden-Württemberg Amtsgericht Mannheim HRB 735518\ncf Fitness Mannheim Neckarau GmbH – Mannheim",
      "type": "Registerbekanntmachung nach dem Umwandlungsgesetz",
      "state": "Baden-Württemberg",
      "amtsgericht": "Amtsgericht Mannheim",
      "registernummer": "HRB 735518",
      "registerart": "HRB",
      "company_name": "cf Fitness Mannheim Neckarau GmbH",
      "company_seat": "Mannheim",
      "details": "03.06.2025 (Bekanntmachungsdatum)\n\nBaden-Württemberg Amtsgericht Mannheim HRB 735518\nRegisterbekanntmachung nach dem Umwandlungsgesetz 03.06.2025 (Eintragungsdatum)\n\ncf Fitness Mannheim Neckarau GmbH\nGesellschaft mit beschränkter Haftung\nMannheim\n\nDen Gläubigern der an der Verschmelzung beteiligten Rechtsträger ist, wenn sie binnen sechs Monaten nach dem Tag, an dem die Eintragung der Verschmelzung in das Register des Sitzes desjenigen Rechtsträgers, dessen Gläubiger sie sind, nach § 19 Abs. 3 UmwG als bekanntgemacht gilt, ihren Anspruch nach Grund und Höhe schriftlich anmelden, Sicherheit zu leisten, soweit sie nicht Befriedigung verlangen können. Dieses Recht steht den Gläubigern jedoch nur zu, wenn sie glaubhaft machen, dass durch die Verschmelzung die Erfüllung ihrer Forderung gefährdet wird."
    },
    {
      "date": "2025-06-03",
      "id": "110977",
      "original_text": "Registerbekanntmachung nach dem Umwandlungsgesetz\nBaden-Württemberg Amtsgericht Freiburg HRB 717356\nModularis Metering GmbH – Furtwangen im Schwarzwald",
      "type": "Registerbekanntmachung nach dem Umwandlungsgesetz",
      "state": "Baden-Württemberg",
      "amtsgericht": "Amtsgericht Freiburg",
      "registernummer": "HRB 717356",
      "registerart": "HRB",
      "company_name": "Modularis Metering GmbH",
      "company_seat": "Furtwangen im Schwarzwald",
      "details": "03.06.2025 (Bekanntmachungsdatum)\n\nBaden-Württemberg Amtsgericht Freiburg HRB 717356\nRegisterbekanntmachung nach dem Umwandlungsgesetz 03.06.2025 (Eintragungsdatum)\n\nModularis Metering GmbH\nGesellschaft mit beschränkter Haftung\nFurtwangen im Schwarzwald\n\nDen Gläubigern der an der Verschmelzung beteiligten Rechtsträger ist, wenn sie binnen sechs Monaten nach dem Tag, an dem die Eintragung der Verschmelzung in das Register des Sitzes desjenigen Rechtsträgers, dessen Gläubiger sie sind, nach § 19 Abs. 3 UmwG als bekanntgemacht gilt, ihren Anspruch nach Grund und Höhe schriftlich anmelden, Sicherheit zu leisten, soweit sie nicht Befriedigung verlangen können. Dieses Recht steht den Gläubigern jedoch nur zu, wenn sie glaubhaft machen, dass durch die Verschmelzung die Erfüllung ihrer Forderung gefährdet wird."
    },
    {
      "date": "2025-06-03",
      "id": "110978",
      "original_text": "Registerbekanntmachung nach dem Umwandlungsgesetz\nBaden-Württemberg Amtsgericht Freiburg HRB 611009\nE. Wehrle GmbH – Furtwangen im Schwarzwald",
      "type": "Registerbekanntmachung nach dem Umwandlungsgesetz",
      "state": "Baden-Württemberg",
      "amtsgericht": "Amtsgericht Freiburg",
      "registernummer": "HRB 611009",
      "registerart": "HRB",
      "company_name": "E. Wehrle GmbH",
      "company_seat": "Furtwangen im Schwarzwald",
      "details": "03.06.2025 (Bekanntmachungsdatum)\n\nBaden-Württemberg Amtsgericht Freiburg HRB 611009\nRegisterbekanntmachung nach dem Umwandlungsgesetz 03.06.2025 (Eintragungsdatum)\n\nE. Wehrle GmbH\nGesellschaft mit beschränkter Haftung\nFurtwangen im Schwarzwald\n\nAls nicht eingetragen wird bekanntgemacht:\nDen Gläubigern der an der Verschmelzung beteiligten Rechtsträger ist, wenn sie binnen sechs Monaten nach dem Tag, an dem die Eintragung der Verschmelzung in das Register des Sitzes desjenigen Rechtsträgers, dessen Gläubiger sie sind, nach § 19 Abs. 3 UmwG als bekanntgemacht gilt, ihren Anspruch nach Grund und Höhe schriftlich anmelden, Sicherheit zu leisten, soweit sie nicht Befriedigung verlangen können. Dieses Recht steht den Gläubigern jedoch nur zu, wenn sie glaubhaft machen, dass durch die Verschmelzung die Erfüllung ihrer Forderung gefährdet wird."
    },
    {
      "date": "2025-06-03",
      "id": "110979",
      "original_text": "Einreichung neuer Dokumente\nSaarland Amtsgericht Saarbrücken HRB 11706\nlivesystems aktiengesellschaft – Saarbrücken",
      "type": "Einreichung neuer Dokumente",
      "state": "Saarland",
      "amtsgericht": "Amtsgericht Saarbrücken",
      "registernummer": "HRB 11706",
      "registerart": "HRB",
      "company_name": "livesystems aktiengesellschaft",
      "company_seat": "Saarbrücken",
      "details": "03.06.2025 (Bekanntmachungsdatum)\n\nSaarland Amtsgericht Saarbrücken HRB 11706\nEinreichung neuer Dokumente\n\nlivesystems aktiengesellschaft\nAktiengesellschaft\nSaarbrücken\n\nDer Vorstand der Gesellschaft hat eine Liste der Mitglieder des Aufsichtsrats zum Handelsregister eingereicht (§ 106 AktG)."
    },
    {
      "date": "2025-06-03",
      "id": "110980",
      "original_text": "Registerbekanntmachung nach dem Umwandlungsgesetz\nBaden-Württemberg Amtsgericht Freiburg HRB 490579\nllbeca Vermögensverwaltung GmbH – Oberkirch",
      "type": "Registerbekanntmachung nach dem Umwandlungsgesetz",
      "state": "Baden-Württemberg",
      "amtsgericht": "Amtsgericht Freiburg",
      "registernummer": "HRB 490579",
      "registerart": "HRB",
      "company_name": "llbeca Vermögensverwaltung GmbH",
      "company_seat": "Oberkirch",
      "details": "03.06.2025 (Bekanntmachungsdatum)\n\nBaden-Württemberg Amtsgericht Freiburg HRB 490579\nRegisterbekanntmachung nach dem Umwandlungsgesetz 03.06.2025 (Eintragungsdatum)\n\nllbeca Vermögensverwaltung GmbH\nGesellschaft mit beschränkter Haftung\nOberkirch\n\nDen Gläubigern der an der Verschmelzung beteiligten Rechtsträger ist, wenn sie binnen sechs Monaten nach dem Tag, an dem die Eintragung der Verschmelzung in das Register des Sitzes desjenigen Rechtsträgers, dessen Gläubiger sie sind, nach § 19 Absatz 3 UmwG als bekanntgemacht gilt, ihren Anspruch nach Grund und Höhe schriftlich anmelden, Sicherheit zu leisten, soweit sie nicht Befriedigung verlangen können. Dieses Recht steht den Gläubigern jedoch nur zu, wenn sie glaubhaft machen, dass durch die Verschmelzung die Erfüllung ihrer Forderung gefährdet wird."
    },
    {
      "date": "2025-06-03",
      "id": "110981",
      "original_text": "Registerbekanntmachung nach dem Umwandlungsgesetz\nBaden-Württemberg Amtsgericht Stuttgart HRB 792381\nTE Immobilien GmbH – Kornwestheim",
      "type": "Registerbekanntmachung nach dem Umwandlungsgesetz",
      "state": "Baden-Württemberg",
      "amtsgericht": "Amtsgericht Stuttgart",
      "registernummer": "HRB 792381",
      "registerart": "HRB",
      "company_name": "TE Immobilien GmbH",
      "company_seat": "Kornwestheim",
      "details": "03.06.2025 (Bekanntmachungsdatum)\n\nBaden-Württemberg Amtsgericht Stuttgart HRB 792381\nRegisterbekanntmachung nach dem Umwandlungsgesetz 03.06.2025 (Eintragungsdatum)\n\nTE Immobilien GmbH\nGesellschaft mit beschränkter Haftung\nKornwestheim\n\nAls nicht eingetragen wird bekanntgemacht:\nDen Gläubigern der an der Verschmelzung beteiligten Rechtsträger ist, wenn sie binnen sechs Monaten nach dem Tag, an dem die Eintragung der Verschmelzung in das Register des Sitzes desjenigen Rechtsträgers, dessen Gläubiger sie sind, nach § 19 Abs. 3 UmwG als bekanntgemacht gilt, ihren Anspruch nach Grund und Höhe schriftlich anmelden, Sicherheit zu leisten, soweit sie nicht Befriedigung verlangen können. Dieses Recht steht den Gläubigern jedoch nur zu, wenn sie glaubhaft machen, dass durch die Verschmelzung die Erfüllung ihrer Forderung gefährdet wird."
    },
    {
      "date": "2025-06-03",
      "id": "110982",
      "original_text": "Registerbekanntmachung nach dem Umwandlungsgesetz\nBaden-Württemberg Amtsgericht Freiburg HRB 611009\nE. Wehrle GmbH – Furtwangen im Schwarzwald",
      "type": "Registerbekanntmachung nach dem Umwandlungsgesetz",
      "state": "Baden-Württemberg",
      "amtsgericht": "Amtsgericht Freiburg",
      "registernummer": "HRB 611009",
      "registerart": "HRB",
      "company_name": "E. Wehrle GmbH",
      "company_seat": "Furtwangen im Schwarzwald",
      "details": "03.06.2025 (Bekanntmachungsdatum)\n\nBaden-Württemberg Amtsgericht Freiburg HRB 611009\nRegisterbekanntmachung nach dem Umwandlungsgesetz 03.06.2025 (Eintragungsdatum)\n\nE. Wehrle GmbH\nGesellschaft mit beschränkter Haftung\nFurtwangen im Schwarzwald\n\nAls nicht eingetragen wird bekanntgemacht:\nDen Gläubigern der an der Verschmelzung beteiligten Rechtsträger ist, wenn sie binnen sechs Monaten nach dem Tag, an dem die Eintragung der Verschmelzung in das Register des Sitzes desjenigen Rechtsträgers, dessen Gläubiger sie sind, nach § 19 Abs. 3 UmwG als bekanntgemacht gilt, ihren Anspruch nach Grund und Höhe schriftlich anmelden, Sicherheit zu leisten, soweit sie nicht Befriedigung verlangen können. Dieses Recht steht den Gläubigern jedoch nur zu, wenn sie glaubhaft machen, dass durch die Verschmelzung die Erfüllung ihrer Forderung gefährdet wird."
    },
    {
      "date": "2025-06-03",
      "id": "110983",
      "original_text": "Registerbekanntmachung nach dem Umwandlungsgesetz\nSchleswig-Holstein Amtsgericht Kiel HRB 5438\nIKL Ingenieurkontor Lübeck GmbH – Kiel",
      "type": "Registerbekanntmachung nach dem Umwandlungsgesetz",
      "state": "Schleswig-Holstein",
      "amtsgericht": "Amtsgericht Kiel",
      "registernummer": "HRB 5438",
      "registerart": "HRB",
      "company_name": "IKL Ingenieurkontor Lübeck GmbH",
      "company_seat": "Kiel",
      "details": "03.06.2025 (Bekanntmachungsdatum)\n\nSchleswig-Holstein Amtsgericht Kiel HRB 5438\nRegisterbekanntmachung nach dem Umwandlungsgesetz 27.05.2025 (Eintragungsdatum)\n\nIKL Ingenieurkontor Lübeck GmbH\nGesellschaft mit beschränkter Haftung\nKiel\n\nZu Eintragungsnummer 10 vom 27.05.2025 wird als nicht eingetragen veröffentlicht: Den Gläubigern der an der Verschmelzung beteiligten Rechtsträger ist, wenn sie binnen sechs Monaten nach dem Tag, an dem die Eintragung der Verschmelzung in das Register des Sitzes desjenigen Rechtsträgers, dessen Gläubiger sie sind, nach § 19 Abs. 3 UmwG bekannt gemacht worden ist, ihren Anspruch nach Grund und Höhe schriftlich anmelden, Sicherheit zu leisten, soweit sie nicht Befriedigung verlangen können. Dieses Recht steht den Gläubigern jedoch nur zu, wenn sie glaubhaft machen, dass durch die Verschmelzung die Erfüllung ihrer Forderung gefährdet wird."
    },
    {
      "date": "2025-06-03",
      "id": "110984",
      "original_text": "Einreichung neuer Dokumente\nBerlin Amtsgericht Berlin (Charlottenburg) HRB 87890\nFriedrich von Bodelschwingh-Klinik gGmbH – Berlin",
      "type": "Einreichung neuer Dokumente",
      "state": "Berlin",
      "amtsgericht": "Amtsgericht Berlin (Charlottenburg)",
      "registernummer": "HRB 87890",
      "registerart": "HRB",
      "company_name": "Friedrich von Bodelschwingh-Klinik gGmbH",
      "company_seat": "Berlin",
      "details": "03.06.2025 (Bekanntmachungsdatum)\n\nBerlin Amtsgericht Berlin (Charlottenburg) HRB 87890\nEinreichung neuer Dokumente\n\nFriedrich von Bodelschwingh-Klinik gGmbH\nGesellschaft mit beschränkter Haftung\nBerlin\n\nAls nicht eingetragen wird veröffentlicht:\nEs wurde eine neue Liste der Aufsichtsratsmitglieder eingereicht (§52 GmbHG)."
    },
    {
      "date": "2025-06-03",
      "id": "110985",
      "original_text": "Registerbekanntmachung nach dem Umwandlungsgesetz\nBaden-Württemberg Amtsgericht Freiburg HRB 611711\nAndrae Wassertechnik GmbH – Furtwangen im Schwarzwald",
      "type": "Registerbekanntmachung nach dem Umwandlungsgesetz",
      "state": "Baden-Württemberg",
      "amtsgericht": "Amtsgericht Freiburg",
      "registernummer": "HRB 611711",
      "registerart": "HRB",
      "company_name": "Andrae Wassertechnik GmbH",
      "company_seat": "Furtwangen im Schwarzwald",
      "details": "03.06.2025 (Bekanntmachungsdatum)\n\nBaden-Württemberg Amtsgericht Freiburg HRB 611711\nRegisterbekanntmachung nach dem Umwandlungsgesetz 03.06.2025 (Eintragungsdatum)\n\nAndrae Wassertechnik GmbH\nGesellschaft mit beschränkter Haftung\nFurtwangen im Schwarzwald\n\nAls nicht eingetragen wird bekanntgemacht:\nDen Gläubigern der an der Verschmelzung beteiligten Rechtsträger ist, wenn sie binnen sechs Monaten nach dem Tag, an dem die Eintragung der Verschmelzung in das Register des Sitzes desjenigen Rechtsträgers, dessen Gläubiger sie sind, nach § 19 Abs. 3 UmwG als bekanntgemacht gilt, ihren Anspruch nach Grund und Höhe schriftlich anmelden, Sicherheit zu leisten, soweit sie nicht Befriedigung verlangen können. Dieses Recht steht den Gläubigern jedoch nur zu, wenn sie glaubhaft machen, dass durch die Verschmelzung die Erfüllung ihrer Forderung gefährdet wird."
    },
    {
      "date": "2025-06-03",
      "id": "110986",
      "original_text": "Einreichung neuer Dokumente\nBerlin Amtsgericht Berlin (Charlottenburg) HRB 234708\ntillit Management GmbH – Berlin",
      "type": "Einreichung neuer Dokumente",
      "state": "Berlin",
      "amtsgericht": "Amtsgericht Berlin (Charlottenburg)",
      "registernummer": "HRB 234708",
      "registerart": "HRB",
      "company_name": "tillit Management GmbH",
      "company_seat": "Berlin",
      "details": "03.06.2025 (Bekanntmachungsdatum)\n\nBerlin Amtsgericht Berlin (Charlottenburg) HRB 234708\nEinreichung neuer Dokumente\n\ntillit Management GmbH\nGesellschaft mit beschränkter Haftung\nBerlin\n\nAls nicht eingetragen wird veröffentlicht: Es wurde eine neue Beiratsliste eingereicht (§52 GmbHG)."
    },
    {
      "date": "2025-06-03",
      "id": "110987",
      "original_text": "Registerbekanntmachung nach dem Umwandlungsgesetz\nBerlin Amtsgericht Berlin (Charlottenburg) HRB 173764\nGraefewirtschaft GmbH – Berlin",
      "type": "Registerbekanntmachung nach dem Umwandlungsgesetz",
      "state": "Berlin",
      "amtsgericht": "Amtsgericht Berlin (Charlottenburg)",
      "registernummer": "HRB 173764",
      "registerart": "HRB",
      "company_name": "Graefewirtschaft GmbH",
      "company_seat": "Berlin",
      "details": "03.06.2025 (Bekanntmachungsdatum)\n\nBerlin Amtsgericht Berlin (Charlottenburg) HRB 173764\nRegisterbekanntmachung nach dem Umwandlungsgesetz 02.06.2025 (Eintragungsdatum)\n\nGraefewirtschaft GmbH\nGesellschaft mit beschränkter Haftung\nBerlin\n\nDen Gläubigern der an der Spaltung beteiligten Rechtsträger ist, wenn sie binnen sechs Monaten nach dem Tag, an dem die Eintragung der Spaltung in das Register des Sitzes desjenigen Rechtsträgers, dessen Gläubiger sie sind, als bekannt gemacht gilt, ihren Anspruch nach Grund und Höhe schriftlich anmelden, Sicherheit zu leisten, soweit sie nicht Befriedigung verlangen können. Dieses Recht steht den Gläubigern jedoch nur zu, wenn sie glaubhaft machen, dass durch die Spaltung die Erfüllung ihrer Forderung gefährdet wird. Das Recht, Sicherheitsleistung zu verlangen, steht Gläubigern nicht zu, die im Falle der Insolvenz ein Recht auf vorzugsweise Befriedigung aus einer Deckungsmasse haben, die nach gesetzlicher Vorschrift zu ihrem Schutz errichtet und staatlich überwacht ist.Zu Eintragungsnummer 6 vom 02.06.2025 wird als nicht eingetragen veröffentlicht:"
    },
    {
      "date": "2025-06-03",
      "id": "110988",
      "original_text": "Löschungsankündigung\nBerlin Amtsgericht Berlin (Charlottenburg) HRB 251700\nOne More Energy GmbH – Berlin",
      "type": "Löschungsankündigung",
      "state": "Berlin",
      "amtsgericht": "Amtsgericht Berlin (Charlottenburg)",
      "registernummer": "HRB 251700",
      "registerart": "HRB",
      "company_name": "One More Energy GmbH",
      "company_seat": "Berlin",
      "details": "03.06.2025 (Bekanntmachungsdatum)\n\nBerlin Amtsgericht Berlin (Charlottenburg) HRB 251700\nLöschungsankündigung\n\nOne More Energy GmbH\nGesellschaft mit beschränkter Haftung\nBerlin\n\nBei der nachstehenden Gesellschaft wird das Amtslöschungsverfahren gemäß § 394 FamFG eingeleitet. Widerspruchsfrist 6 Wochen"
    },
    {
      "date": "2025-06-03",
      "id": "110989",
      "original_text": "Sonstige Registerbekanntmachung\nBerlin Amtsgericht Berlin (Charlottenburg) HRB 245110\nPersoQua AG – Berlin",
      "type": "Sonstige Registerbekanntmachung",
      "state": "Berlin",
      "amtsgericht": "Amtsgericht Berlin (Charlottenburg)",
      "registernummer": "HRB 245110",
      "registerart": "HRB",
      "company_name": "PersoQua AG",
      "company_seat": "Berlin",
      "details": "03.06.2025 (Bekanntmachungsdatum)\n\nBerlin Amtsgericht Berlin (Charlottenburg) HRB 245110\nSonstige Registerbekanntmachung\n\nPersoQua AG\nAktiengesellschaft\nBerlin\n\nAls nicht eingetragen wird veröffentlicht:Es wurde eine neue Liste der Aufsichtsratsmitglieder eingereicht (§ 106 AktG)."
    },
    {
      "date": "2025-06-03",
      "id": "110990",
      "original_text": "Registerbekanntmachung nach dem Umwandlungsgesetz\nBaden-Württemberg Amtsgericht Ulm HRB 728918\nFitness United Crailsheim GmbH – Crailsheim",
      "type": "Registerbekanntmachung nach dem Umwandlungsgesetz",
      "state": "Baden-Württemberg",
      "amtsgericht": "Amtsgericht Ulm",
      "registernummer": "HRB 728918",
      "registerart": "HRB",
      "company_name": "Fitness United Crailsheim GmbH",
      "company_seat": "Crailsheim",
      "details": "03.06.2025 (Bekanntmachungsdatum)\n\nBaden-Württemberg Amtsgericht Ulm HRB 728918\nRegisterbekanntmachung nach dem Umwandlungsgesetz 03.06.2025 (Eintragungsdatum)\n\nFitness United Crailsheim GmbH\nGesellschaft mit beschränkter Haftung\nCrailsheim\n\nAls nicht eingetragen wird bekanntgemacht:\nDen Gläubigern der an der Verschmelzung beteiligten Rechtsträger ist, wenn sie binnen sechs Monaten nach dem Tag, an dem die Eintragung der Verschmelzung in das Register des Sitzes desjenigen Rechtsträgers, dessen Gläubiger sie sind, nach § 19 Abs. 3 UmwG als bekanntgemacht gilt, ihren Anspruch nach Grund und Höhe schriftlich anmelden, Sicherheit zu leisten, soweit sie nicht Befriedigung verlangen können. Dieses Recht steht den Gläubigern jedoch nur zu, wenn sie glaubhaft machen, dass durch die Verschmelzung die Erfüllung ihrer Forderung gefährdet wird."
    },
    {
      "date": "2025-06-03",
      "id": "110991",
      "original_text": "Sonstige Registerbekanntmachung\nBerlin Amtsgericht Berlin (Charlottenburg) HRB 199761\nB.C.M. Media-Adress GmbH – Berlin",
      "type": "Sonstige Registerbekanntmachung",
      "state": "Berlin",
      "amtsgericht": "Amtsgericht Berlin (Charlottenburg)",
      "registernummer": "HRB 199761",
      "registerart": "HRB",
      "company_name": "B.C.M. Media-Adress GmbH",
      "company_seat": "Berlin",
      "details": "03.06.2025 (Bekanntmachungsdatum)\n\nBerlin Amtsgericht Berlin (Charlottenburg) HRB 199761\nSonstige Registerbekanntmachung\n\nB.C.M. Media-Adress GmbH\nGesellschaft mit beschränkter Haftung\nBerlin\n\nAls nicht eingetragen wird veröffentlicht: Bitte Bekanntmachung gemäß §§ 10 HGB, 336, 308 Abs. 1 UmwG wie folgt:\nDie Gesellschaft hat einen notariell beurkundeten Formwechselplan vom 27.05.2025 betreffend die grenzüberschreitende Sitzverlegung der Gesellschaft nach Malta unter gleichzeitiger Umwandlung in eine Gesellschaft nach maltesischem Recht ( kumpannija privata/ private limited liability company nach dem Recht Maltas) mit der künftigen Firma B.C.M. Media Limited zum Handelsregister des Amtsgerichts Charlottenburg eingereicht.\nDer Sitz wird verlegt nach Centris Business Gateway, Level 4/W, Trig Is-Salib Tal-Imriehel, Zone 3, Central Business District, Birkirkara CBD3020, Malta.\n\nGesellschafter, Gläubiger und die Arbeitnehmer der Gesellschaft (einziger Arbeitnehmer ist der Geschäftsführer der Gesellschaft) werden auf die Möglichkeit hingewiesen, der Gesellschaft spätestens fünf Arbeitstage vor dem Tag der\nGesellschafterversammlung, die frühestens einen Monat nach der Bekanntmachung stattfinden darf, Bemerkungen zum Formwechselplan zu übermitteln.\n\nDie Bemerkungen zum Formwechselplan sind an folgende Adresse zu richten:\n\nB.C.M. Media-Adress GmbH\nFriedrichstraße 171,\n10117 Berlin"
    },
    {
      "date": "2025-06-03",
      "id": "110992",
      "original_text": "Registerbekanntmachung nach dem Umwandlungsgesetz\nBaden-Württemberg Amtsgericht Stuttgart HRB 736898\nbodyfit Fellbach GmbH – Fellbach",
      "type": "Registerbekanntmachung nach dem Umwandlungsgesetz",
      "state": "Baden-Württemberg",
      "amtsgericht": "Amtsgericht Stuttgart",
      "registernummer": "HRB 736898",
      "registerart": "HRB",
      "company_name": "bodyfit Fellbach GmbH",
      "company_seat": "Fellbach",
      "details": "03.06.2025 (Bekanntmachungsdatum)\n\nBaden-Württemberg Amtsgericht Stuttgart HRB 736898\nRegisterbekanntmachung nach dem Umwandlungsgesetz 03.06.2025 (Eintragungsdatum)\n\nbodyfit Fellbach GmbH\nGesellschaft mit beschränkter Haftung\nFellbach\n\nAls nicht eingetragen wird bekanntgemacht:\nDen Gläubigern der an der Verschmelzung beteiligten Rechtsträger ist, wenn sie binnen sechs Monaten nach dem Tag, an dem die Eintragung der Verschmelzung in das Register des Sitzes desjenigen Rechtsträgers, dessen Gläubiger sie sind, nach § 19 Abs. 3 UmwG als bekanntgemacht gilt, ihren Anspruch nach Grund und Höhe schriftlich anmelden, Sicherheit zu leisten, soweit sie nicht Befriedigung verlangen können. Dieses Recht steht den Gläubigern jedoch nur zu, wenn sie glaubhaft machen, dass durch die Verschmelzung die Erfüllung ihrer Forderung gefährdet wird."
    },
    {
      "date": "2025-06-03",
      "id": "110993",
      "original_text": "Registerbekanntmachung nach dem Umwandlungsgesetz\nHamburg Amtsgericht Hamburg HRB 188336\nWECOYA SERVICES & CLAIMS GmbH – Hamburg",
      "type": "Registerbekanntmachung nach dem Umwandlungsgesetz",
      "state": "Hamburg",
      "amtsgericht": "Amtsgericht Hamburg",
      "registernummer": "HRB 188336",
      "registerart": "HRB",
      "company_name": "WECOYA SERVICES & CLAIMS GmbH",
      "company_seat": "Hamburg",
      "details": "03.06.2025 (Bekanntmachungsdatum)\n\nHamburg Amtsgericht Hamburg HRB 188336\nRegisterbekanntmachung nach dem Umwandlungsgesetz 02.06.2025 (Eintragungsdatum)\n\nWECOYA SERVICES & CLAIMS GmbH\nGesellschaft mit beschränkter Haftung\nHamburg\n\nAls nicht eingetragen wird bekannt gemacht:\nDen Gläubigern der an der Verschmelzung beteiligten Gesellschaften ist, wenn sie binnen sechs Monaten nach dem Tag, an dem die Eintragung der Verschmelzung in das Register des Sitzes desjenigen Rechtsträgers, dessen Gläubiger sie sind, nach § 19 Absatz 3 UmwG als bekannt gemacht gilt, ihren Anspruch nach Grund und Höhe schriftlich anmelden, Sicherheit zu leisten, soweit sie nicht Befriedigung verlangen können. Dieses Recht steht den Gläubigern jedoch nur zu, wenn sie glaubhaft machen, dass durch die Verschmelzung die Erfüllung ihrer Forderung gefährdet wird."
    },
    {
      "date": "2025-06-03",
      "id": "110994",
      "original_text": "Registerbekanntmachung nach dem Umwandlungsgesetz\nHamburg Amtsgericht Hamburg HRB 189919\nConceptIF Group GmbH – Hamburg",
      "type": "Registerbekanntmachung nach dem Umwandlungsgesetz",
      "state": "Hamburg",
      "amtsgericht": "Amtsgericht Hamburg",
      "registernummer": "HRB 189919",
      "registerart": "HRB",
      "company_name": "ConceptIF Group GmbH",
      "company_seat": "Hamburg",
      "details": "03.06.2025 (Bekanntmachungsdatum)\n\nHamburg Amtsgericht Hamburg HRB 189919\nRegisterbekanntmachung nach dem Umwandlungsgesetz 02.06.2025 (Eintragungsdatum)\n\nConceptIF Group GmbH\nGesellschaft mit beschränkter Haftung\nHamburg\n\nAls nicht eingetragen wird bekannt gemacht:\nDen Gläubigern der an der Verschmelzung beteiligten Gesellschaften ist, wenn sie binnen sechs Monaten nach dem Tag, an dem die Eintragung der Verschmelzung in das Register des Sitzes desjenigen Rechtsträgers, dessen Gläubiger sie sind, nach § 19 Absatz 3 UmwG als bekannt gemacht gilt, ihren Anspruch nach Grund und Höhe schriftlich anmelden, Sicherheit zu leisten, soweit sie nicht Befriedigung verlangen können. Dieses Recht steht den Gläubigern jedoch nur zu, wenn sie glaubhaft machen, dass durch die Verschmelzung die Erfüllung ihrer Forderung gefährdet wird."
    },
    {
      "date": "2025-06-03",
      "id": "110995",
      "original_text": "Löschungsankündigung\nSchleswig-Holstein Amtsgericht Pinneberg HRB 15735\nAlpha Films UG (haftungsbeschränkt) – Rellingen",
      "type": "Löschungsankündigung",
      "state": "Schleswig-Holstein",
      "amtsgericht": "Amtsgericht Pinneberg",
      "registernummer": "HRB 15735",
      "registerart": "HRB",
      "company_name": "Alpha Films UG (haftungsbeschränkt)",
      "company_seat": "Rellingen",
      "details": "03.06.2025 (Bekanntmachungsdatum)\n\nSchleswig-Holstein Amtsgericht Pinneberg HRB 15735\nLöschungsankündigung\n\nAlpha Films UG (haftungsbeschränkt)\nGesellschaft mit beschränkter Haftung\nRellingen\n\nEs ist die Löschung der nachstehenden Gesellschaft wegen Vermögenslosigkeit gemäß § 394 FamFG beabsichtigt. Widerspruchsfrist: 2 Monate."
    },
    {
      "date": "2025-06-03",
      "id": "110996",
      "original_text": "Löschungsankündigung\nThüringen Amtsgericht Jena HRB 210090\nAutohaus Schuchardt GmbH – Jena",
      "type": "Löschungsankündigung",
      "state": "Thüringen",
      "amtsgericht": "Amtsgericht Jena",
      "registernummer": "HRB 210090",
      "registerart": "HRB",
      "company_name": "Autohaus Schuchardt GmbH",
      "company_seat": "Jena",
      "details": "03.06.2025 (Bekanntmachungsdatum)\n\nThüringen Amtsgericht Jena HRB 210090\nLöschungsankündigung\n\nAutohaus Schuchardt GmbH\nGesellschaft mit beschränkter Haftung\nJena\n\nDas Registergericht beabsichtigt, die im Handelsregister eingetragene Gesellschaft wegen Vermögenslosigkeit nach § 394 FamFG von Amts wegen zu löschen. Die Frist zur Erhebung eines Widerspruchs gegen die beabsichtigte Löschung wird auf 6 Wochen festgesetzt."
    },
    {
      "date": "2025-06-03",
      "id": "110997",
      "original_text": "Löschungsankündigung\nThüringen Amtsgericht Jena HRB 515064\nBaolingkang Yiliao Keji (BYK) GmbH – Bad Liebenstein",
      "type": "Löschungsankündigung",
      "state": "Thüringen",
      "amtsgericht": "Amtsgericht Jena",
      "registernummer": "HRB 515064",
      "registerart": "HRB",
      "company_name": "Baolingkang Yiliao Keji (BYK) GmbH",
      "company_seat": "Bad Liebenstein",
      "details": "03.06.2025 (Bekanntmachungsdatum)\n\nThüringen Amtsgericht Jena HRB 515064\nLöschungsankündigung\n\nBaolingkang Yiliao Keji (BYK) GmbH\nGesellschaft mit beschränkter Haftung\nBad Liebenstein\n\nDas Registergericht beabsichtigt, die im Handelsregister eingetragene Gesellschaft wegen Vermögenslosigkeit nach § 394 FamFG von Amts wegen zu löschen. Die Frist zur Erhebung eines Widerspruchs gegen die beabsichtigte Löschung wird auf 6 Wochen festgesetzt."
    },
    {
      "date": "2025-06-03",
      "id": "110998",
      "original_text": "Einreichung neuer Dokumente\nThüringen Amtsgericht Jena HRB 401809\nPRO Land Agrar GmbH Nägelstedt – Bad Langensalza",
      "type": "Einreichung neuer Dokumente",
      "state": "Thüringen",
      "amtsgericht": "Amtsgericht Jena",
      "registernummer": "HRB 401809",
      "registerart": "HRB",
      "company_name": "PRO Land Agrar GmbH Nägelstedt",
      "company_seat": "Bad Langensalza",
      "details": "03.06.2025 (Bekanntmachungsdatum)\n\nThüringen Amtsgericht Jena HRB 401809\nEinreichung neuer Dokumente 20.05.2025 (Eintragungsdatum)\n\nPRO Land Agrar GmbH Nägelstedt\nGesellschaft mit beschränkter Haftung\nBad Langensalza\n\nBekanntmachung gem. § 52 Abs. 3 Satz 2 GmbHG: Aufgrund einer Veränderung in den Personen der Aufsichtsratsmitglieder ist durch die Geschäftsführer eine neue Liste zum Handelsregister eingereicht worden."
    },
    {
      "date": "2025-06-03",
      "id": "110999",
      "original_text": "Löschungsankündigung\nThüringen Amtsgericht Jena HRB 514274\nEPDCO. GmbH – Gotha",
      "type": "Löschungsankündigung",
      "state": "Thüringen",
      "amtsgericht": "Amtsgericht Jena",
      "registernummer": "HRB 514274",
      "registerart": "HRB",
      "company_name": "EPDCO. GmbH",
      "company_seat": "Gotha",
      "details": "03.06.2025 (Bekanntmachungsdatum)\n\nThüringen Amtsgericht Jena HRB 514274\nLöschungsankündigung\n\nEPDCO. GmbH\nGesellschaft mit beschränkter Haftung\nGotha\n\nDas Registergericht beabsichtigt, die im Handelsregister eingetragene Gesellschaft wegen Vermögenslosigkeit nach § 394 FamFG von Amts wegen zu löschen. Die Frist zur Erhebung eines Widerspruchs gegen die beabsichtigte Löschung wird auf 6 Wochen festgesetzt."
    },
    {
      "date": "2025-06-03",
      "id": "111000",
      "original_text": "Einreichung neuer Dokumente\nBerlin Amtsgericht Berlin (Charlottenburg) HRB 113690\nBerlin Phil Media GmbH – Berlin",
      "type": "Einreichung neuer Dokumente",
      "state": "Berlin",
      "amtsgericht": "Amtsgericht Berlin (Charlottenburg)",
      "registernummer": "HRB 113690",
      "registerart": "HRB",
      "company_name": "Berlin Phil Media GmbH",
      "company_seat": "Berlin",
      "details": "03.06.2025 (Bekanntmachungsdatum)\n\nBerlin Amtsgericht Berlin (Charlottenburg) HRB 113690\nEinreichung neuer Dokumente\n\nBerlin Phil Media GmbH\nGesellschaft mit beschränkter Haftung\nBerlin\n\nAls nicht eingetragen wird veröffentlicht: Es wurde eine neue Liste der Aufsichtsratsmitglieder eingereicht (§52 GmbHG)."
    },
    {
      "date": "2025-06-03",
      "id": "111001",
      "original_text": "Registerbekanntmachung nach dem Umwandlungsgesetz\nBaden-Württemberg Amtsgericht Stuttgart HRB 790641\nDABA Investment Holding GmbH – Waiblingen",
      "type": "Registerbekanntmachung nach dem Umwandlungsgesetz",
      "state": "Baden-Württemberg",
      "amtsgericht": "Amtsgericht Stuttgart",
      "registernummer": "HRB 790641",
      "registerart": "HRB",
      "company_name": "DABA Investment Holding GmbH",
      "company_seat": "Waiblingen",
      "details": "03.06.2025 (Bekanntmachungsdatum)\n\nBaden-Württemberg Amtsgericht Stuttgart HRB 790641\nRegisterbekanntmachung nach dem Umwandlungsgesetz 03.06.2025 (Eintragungsdatum)\n\nDABA Investment Holding GmbH\nGesellschaft mit beschränkter Haftung\nWaiblingen\n\nAls nicht eingetragen wird bekanntgemacht: Den Gläubigern der an der Verschmelzung beteiligten Rechtsträger ist, wenn sie binnen sechs Monaten nach dem Tag, an dem die Eintragung der Verschmelzung in das Register des Sitzes desjenigen Rechtsträgers, dessen Gläubiger sie sind, nach § 19 Abs. 3 UmwG als bekanntgemacht gilt, ihren Anspruch nach Grund und Höhe schriftlich anmelden, Sicherheit zu leisten, soweit sie nicht Befriedigung verlangen können. Dieses Recht steht den Gläubigern jedoch nur zu, wenn sie glaubhaft machen, dass durch die Verschmelzung die Erfüllung ihrer Forderung gefährdet wird."
    },
    {
      "date": "2025-06-03",
      "id": "111002",
      "original_text": "Registerbekanntmachung nach dem Umwandlungsgesetz\nBerlin Amtsgericht Berlin (Charlottenburg) HRA 63223\nSchmidt-Schönberg Arbeitsmedizin e.K. – Berlin",
      "type": "Registerbekanntmachung nach dem Umwandlungsgesetz",
      "state": "Berlin",
      "amtsgericht": "Amtsgericht Berlin (Charlottenburg)",
      "registernummer": "HRA 63223",
      "registerart": "HRA",
      "company_name": "Schmidt-Schönberg Arbeitsmedizin e.K.",
      "company_seat": "Berlin",
      "details": "03.06.2025 (Bekanntmachungsdatum)\n\nBerlin Amtsgericht Berlin (Charlottenburg) HRA 63223\nRegisterbekanntmachung nach dem Umwandlungsgesetz 31.05.2025 (Eintragungsdatum)\n\nSchmidt-Schönberg Arbeitsmedizin e.K.\nEinzelkaufmann / Einzelkauffrau\nBerlin\n\nZu Eintragungsnummer 2 vom 31.05.2025 wird als nicht eingetragen veröffentlicht:\nDen Gläubigern der an der Spaltung beteiligten Rechtsträger ist, wenn sie binnen sechs Monaten nach dem Tag, an dem die Eintragung der Spaltung in das Register des Sitzes desjenigen Rechtsträgers, dessen Gläubiger sie sind, als bekannt gemacht gilt, ihren Anspruch nach Grund und Höhe schriftlich anmelden, Sicherheit zu leisten, soweit sie nicht Befriedigung verlangen können. Dieses Recht steht den Gläubigern jedoch nur zu, wenn sie glaubhaft machen, dass durch die Spaltung die Erfüllung ihrer Forderung gefährdet wird. Das Recht, Sicherheitsleistung zu verlangen, steht Gläubigern nicht zu, die im Falle der Insolvenz ein Recht auf vorzugsweise Befriedigung aus einer Deckungsmasse haben, die nach gesetzlicher Vorschrift zu ihrem Schutz errichtet und staatlich überwacht ist."
    },
    {
      "date": "2025-06-03",
      "id": "111003",
      "original_text": "Registerbekanntmachung nach dem Umwandlungsgesetz\nBerlin Amtsgericht Berlin (Charlottenburg) HRB 268935\nA-Betriebsarzt GmbH – Berlin",
      "type": "Registerbekanntmachung nach dem Umwandlungsgesetz",
      "state": "Berlin",
      "amtsgericht": "Amtsgericht Berlin (Charlottenburg)",
      "registernummer": "HRB 268935",
      "registerart": "HRB",
      "company_name": "A-Betriebsarzt GmbH",
      "company_seat": "Berlin",
      "details": "03.06.2025 (Bekanntmachungsdatum)\n\nBerlin Amtsgericht Berlin (Charlottenburg) HRB 268935\nRegisterbekanntmachung nach dem Umwandlungsgesetz 31.05.2025 (Eintragungsdatum)\n\nA-Betriebsarzt GmbH\nGesellschaft mit beschränkter Haftung\nBerlin\n\nZu Eintragungsnummer 4 vom 31.05.2025 wird als nicht eingetragen veröffentlicht:\nDen Gläubigern der an der Spaltung beteiligten Rechtsträger ist, wenn sie binnen sechs Monaten nach dem Tag, an dem die Eintragung der Spaltung in das Register des Sitzes desjenigen Rechtsträgers, dessen Gläubiger sie sind, als bekannt gemacht gilt, ihren Anspruch nach Grund und Höhe schriftlich anmelden, Sicherheit zu leisten, soweit sie nicht Befriedigung verlangen können. Dieses Recht steht den Gläubigern jedoch nur zu, wenn sie glaubhaft machen, dass durch die Spaltung die Erfüllung ihrer Forderung gefährdet wird. Das Recht, Sicherheitsleistung zu verlangen, steht Gläubigern nicht zu, die im Falle der Insolvenz ein Recht auf vorzugsweise Befriedigung aus einer Deckungsmasse haben, die nach gesetzlicher Vorschrift zu ihrem Schutz errichtet und staatlich überwacht ist."
    },
    {
      "date": "2025-06-03",
      "id": "111004",
      "original_text": "Registerbekanntmachung nach dem Umwandlungsgesetz\nSchleswig-Holstein Amtsgericht Kiel HRB 28193\nnils bans malermeister GmbH – Tangstedt",
      "type": "Registerbekanntmachung nach dem Umwandlungsgesetz",
      "state": "Schleswig-Holstein",
      "amtsgericht": "Amtsgericht Kiel",
      "registernummer": "HRB 28193",
      "registerart": "HRB",
      "company_name": "nils bans malermeister GmbH",
      "company_seat": "Tangstedt",
      "details": "03.06.2025 (Bekanntmachungsdatum)\n\nSchleswig-Holstein Amtsgericht Kiel HRB 28193\nRegisterbekanntmachung nach dem Umwandlungsgesetz 02.06.2025 (Eintragungsdatum)\n\nnils bans malermeister GmbH\nGesellschaft mit beschränkter Haftung\nTangstedt\n\nZu Eintragungsnummer 1 vom 02.06.2025 wird als nicht eingetragen veröffentlicht: Als nicht eingetragen wird veröffentlicht: Den Gläubigern der an der Spaltung beteiligten Rechtsträger ist, wenn sie binnen sechs Monaten nach dem Tag, an dem die Eintragung der Spaltung in das Register des Sitzes desjenigen Rechtsträgers, dessen Gläubiger sie sind,  bekannt gemacht worden ist, ihren Anspruch nach Grund und Höhe schriftlich anmelden, Sicherheit zu leisten, soweit sie nicht Befriedigung verlangen können. Dieses Recht steht den Gläubigern jedoch nur zu, wenn sie glaubhaft machen, dass durch die Spaltung die Erfüllung ihrer Forderung gefährdet wird."
    },
    {
      "date": "2025-06-03",
      "id": "111005",
      "original_text": "Registerbekanntmachung nach dem Umwandlungsgesetz\nSchleswig-Holstein Amtsgericht Kiel HRA 12725\nNils Bans - Malermeister e. K. – Tangstedt",
      "type": "Registerbekanntmachung nach dem Umwandlungsgesetz",
      "state": "Schleswig-Holstein",
      "amtsgericht": "Amtsgericht Kiel",
      "registernummer": "HRA 12725",
      "registerart": "HRA",
      "company_name": "Nils Bans - Malermeister e. K.",
      "company_seat": "Tangstedt",
      "details": "03.06.2025 (Bekanntmachungsdatum)\n\nSchleswig-Holstein Amtsgericht Kiel HRA 12725\nRegisterbekanntmachung nach dem Umwandlungsgesetz 02.06.2025 (Eintragungsdatum)\n\nNils Bans - Malermeister e. K.\nEinzelkaufmann / Einzelkauffrau\nTangstedt\n\nZu Eintragungsnummer 2 vom 02.06.2025 wird als nicht eingetragen veröffentlicht: Als nicht eingetragen wird veröffentlicht: Den Gläubigern der an der Spaltung beteiligten Rechtsträger ist, wenn sie binnen sechs Monaten nach dem Tag, an dem die Eintragung der Spaltung in das Register des Sitzes desjenigen Rechtsträgers, dessen Gläubiger sie sind,  bekannt gemacht worden ist, ihren Anspruch nach Grund und Höhe schriftlich anmelden, Sicherheit zu leisten, soweit sie nicht Befriedigung verlangen können. Dieses Recht steht den Gläubigern jedoch nur zu, wenn sie glaubhaft machen, dass durch die Spaltung die Erfüllung ihrer Forderung gefährdet wird."
    },
    {
      "date": "2025-06-03",
      "id": "111006",
      "original_text": "Registerbekanntmachung nach dem Umwandlungsgesetz\nBaden-Württemberg Amtsgericht Stuttgart HRB 767643\nDABA GmbH – Waiblingen",
      "type": "Registerbekanntmachung nach dem Umwandlungsgesetz",
      "state": "Baden-Württemberg",
      "amtsgericht": "Amtsgericht Stuttgart",
      "registernummer": "HRB 767643",
      "registerart": "HRB",
      "company_name": "DABA GmbH",
      "company_seat": "Waiblingen",
      "details": "03.06.2025 (Bekanntmachungsdatum)\n\nBaden-Württemberg Amtsgericht Stuttgart HRB 767643\nRegisterbekanntmachung nach dem Umwandlungsgesetz 03.06.2025 (Eintragungsdatum)\n\nDABA GmbH\nGesellschaft mit beschränkter Haftung\nWaiblingen\n\nAls nicht eingetragen wird bekanntgemacht:\nDen Gläubigern der an der Verschmelzung beteiligten Rechtsträger ist, wenn sie binnen sechs Monaten nach dem Tag, an dem die Eintragung der Verschmelzung in das Register des Sitzes desjenigen Rechtsträgers, dessen Gläubiger sie sind, nach § 19 Abs. 3 UmwG als bekanntgemacht gilt, ihren Anspruch nach Grund und Höhe schriftlich anmelden, Sicherheit zu leisten, soweit sie nicht Befriedigung verlangen können. Dieses Recht steht den Gläubigern jedoch nur zu, wenn sie glaubhaft machen, dass durch die Verschmelzung die Erfüllung ihrer Forderung gefährdet wird."
    },
    {
      "date": "2025-06-03",
      "id": "111007",
      "original_text": "Registerbekanntmachung nach dem Umwandlungsgesetz\nBaden-Württemberg Amtsgericht Stuttgart HRB 766653\nEG Electronics GmbH – Nagold",
      "type": "Registerbekanntmachung nach dem Umwandlungsgesetz",
      "state": "Baden-Württemberg",
      "amtsgericht": "Amtsgericht Stuttgart",
      "registernummer": "HRB 766653",
      "registerart": "HRB",
      "company_name": "EG Electronics GmbH",
      "company_seat": "Nagold",
      "details": "03.06.2025 (Bekanntmachungsdatum)\n\nBaden-Württemberg Amtsgericht Stuttgart HRB 766653\nRegisterbekanntmachung nach dem Umwandlungsgesetz 03.06.2025 (Eintragungsdatum)\n\nEG Electronics GmbH\nGesellschaft mit beschränkter Haftung\nNagold\n\nAls nicht eingetragen wird bekanntgemacht:\nDen Gläubigern der an der Verschmelzung beteiligten Rechtsträger ist, wenn sie binnen sechs Monaten nach dem Tag, an dem die Eintragung der Verschmelzung in das Register des Sitzes desjenigen Rechtsträgers, dessen Gläubiger sie sind, nach § 19 Abs. 3 UmwG als bekanntgemacht gilt, ihren Anspruch nach Grund und Höhe schriftlich anmelden, Sicherheit zu leisten, soweit sie nicht Befriedigung verlangen können. Dieses Recht steht den Gläubigern jedoch nur zu, wenn sie glaubhaft machen, dass durch die Verschmelzung die Erfüllung ihrer Forderung gefährdet wird."
    },
    {
      "date": "2025-06-03",
      "id": "111008",
      "original_text": "Registerbekanntmachung nach dem Umwandlungsgesetz\nBaden-Württemberg Amtsgericht Stuttgart HRB 755654\ncf Fitness Bietigheim-Bissingen GmbH – Bietigheim-Bissingen",
      "type": "Registerbekanntmachung nach dem Umwandlungsgesetz",
      "state": "Baden-Württemberg",
      "amtsgericht": "Amtsgericht Stuttgart",
      "registernummer": "HRB 755654",
      "registerart": "HRB",
      "company_name": "cf Fitness Bietigheim-Bissingen GmbH",
      "company_seat": "Bietigheim-Bissingen",
      "details": "03.06.2025 (Bekanntmachungsdatum)\n\nBaden-Württemberg Amtsgericht Stuttgart HRB 755654\nRegisterbekanntmachung nach dem Umwandlungsgesetz 03.06.2025 (Eintragungsdatum)\n\ncf Fitness Bietigheim-Bissingen GmbH\nGesellschaft mit beschränkter Haftung\nBietigheim-Bissingen\n\nAls nicht eingetragen wird bekanntgemacht:\nDen Gläubigern der an der Verschmelzung beteiligten Rechtsträger ist, wenn sie binnen sechs Monaten nach dem Tag, an dem die Eintragung der Verschmelzung in das Register des Sitzes desjenigen Rechtsträgers, dessen Gläubiger sie sind, nach § 19 Abs. 3 UmwG als bekanntgemacht gilt, ihren Anspruch nach Grund und Höhe schriftlich anmelden, Sicherheit zu leisten, soweit sie nicht Befriedigung verlangen können. Dieses Recht steht den Gläubigern jedoch nur zu, wenn sie glaubhaft machen, dass durch die Verschmelzung die Erfüllung ihrer Forderung gefährdet wird."
    },
    {
      "date": "2025-06-03",
      "id": "111009",
      "original_text": "Registerbekanntmachung nach dem Umwandlungsgesetz\nBerlin Amtsgericht Berlin (Charlottenburg) HRB 248190\nKOHLHEPP GmbH Wirtschaftsprüfungsgesellschaft – Berlin",
      "type": "Registerbekanntmachung nach dem Umwandlungsgesetz",
      "state": "Berlin",
      "amtsgericht": "Amtsgericht Berlin (Charlottenburg)",
      "registernummer": "HRB 248190",
      "registerart": "HRB",
      "company_name": "KOHLHEPP GmbH Wirtschaftsprüfungsgesellschaft",
      "company_seat": "Berlin",
      "details": "03.06.2025 (Bekanntmachungsdatum)\n\nBerlin Amtsgericht Berlin (Charlottenburg) HRB 248190\nRegisterbekanntmachung nach dem Umwandlungsgesetz 02.06.2025 (Eintragungsdatum)\n\nKOHLHEPP GmbH Wirtschaftsprüfungsgesellschaft\nGesellschaft mit beschränkter Haftung\nBerlin\n\nZu Eintragungsnummer 4 vom 02.06.2025 wird als nicht eingetragen veröffentlicht:Den Gläubigern der an der Verschmelzung beteiligten Rechtsträger ist, wenn sie binnen sechs Monaten nach dem Tag, an dem die Eintragung der Verschmelzung in das Register des Sitzes desjenigen Rechtsträgers, dessen Gläubiger sie sind, als bekannt gemacht gilt, ihren Anspruch nach Grund und Höhe schriftlich anmelden, Sicherheit zu leisten, soweit sie nicht Befriedigung verlangen können. Dieses Recht steht den Gläubigern jedoch nur zu, wenn sie glaubhaft machen, dass durch die Verschmelzung die Erfüllung ihrer Forderung gefährdet wird. Das Recht, Sicherheitsleistung zu verlangen, steht Gläubigern nicht zu, die im Falle der Insolvenz ein Recht auf vorzugsweise Befriedigung aus einer Deckungsmasse haben, die nach gesetzlicher Vorschrift zu ihrem Schutz errichtet und staatlich überwacht ist."
    },
    {
      "date": "2025-06-03",
      "id": "111010",
      "original_text": "Registerbekanntmachung nach dem Umwandlungsgesetz\nBaden-Württemberg Amtsgericht Stuttgart HRB 774241\nHAAS Kabeltechnik AG – Dunningen",
      "type": "Registerbekanntmachung nach dem Umwandlungsgesetz",
      "state": "Baden-Württemberg",
      "amtsgericht": "Amtsgericht Stuttgart",
      "registernummer": "HRB 774241",
      "registerart": "HRB",
      "company_name": "HAAS Kabeltechnik AG",
      "company_seat": "Dunningen",
      "details": "03.06.2025 (Bekanntmachungsdatum)\n\nBaden-Württemberg Amtsgericht Stuttgart HRB 774241\nRegisterbekanntmachung nach dem Umwandlungsgesetz 03.06.2025 (Eintragungsdatum)\n\nHAAS Kabeltechnik AG\nAktiengesellschaft\nDunningen\n\nAls nicht eingetragen wird bekanntgemacht: Den Gläubigern des an dem Formwechsel beteiligten Rechtsträgers ist, wenn sie binnen sechs Monaten nach dem Tag, an dem die Eintragung des Formwechsels in das Register des Sitzes desjenigen Rechtsträgers, dessen Gläubiger sie sind, nach § 19 Abs. 3 UmwG als bekanntgemacht gilt, ihren Anspruch nach Grund und Höhe schriftlich anmelden, Sicherheit zu leisten, soweit sie nicht Befriedigung verlangen können. Dieses Recht steht den Gläubigern jedoch nur zu, wenn sie glaubhaft machen, dass durch den Formwechsel die Erfüllung ihrer Forderung gefährdet wird."
    },
    {
      "date": "2025-06-03",
      "id": "111011",
      "original_text": "Löschungsankündigung\nBerlin Amtsgericht Berlin (Charlottenburg) HRB 228739\nOlcay Bau GmbH – Berlin",
      "type": "Löschungsankündigung",
      "state": "Berlin",
      "amtsgericht": "Amtsgericht Berlin (Charlottenburg)",
      "registernummer": "HRB 228739",
      "registerart": "HRB",
      "company_name": "Olcay Bau GmbH",
      "company_seat": "Berlin",
      "details": "03.06.2025 (Bekanntmachungsdatum)\n\nBerlin Amtsgericht Berlin (Charlottenburg) HRB 228739\nLöschungsankündigung\n\nOlcay Bau GmbH\nGesellschaft mit beschränkter Haftung\nBerlin\n\nBei der nachstehenden Gesellschaft wird das Amtslöschungsverfahren gemäß § 394 FamFG eingeleitet. Widerspruchsfrist 6 Wochen"
    },
    {
      "date": "2025-06-03",
      "id": "111012",
      "original_text": "Löschungsankündigung\nSchleswig-Holstein Amtsgericht Kiel HRB 14716\nKieler Bau Verwaltungs UG (haftungsbeschränkt) – Lehmkuhlen",
      "type": "Löschungsankündigung",
      "state": "Schleswig-Holstein",
      "amtsgericht": "Amtsgericht Kiel",
      "registernummer": "HRB 14716",
      "registerart": "HRB",
      "company_name": "Kieler Bau Verwaltungs UG (haftungsbeschränkt)",
      "company_seat": "Lehmkuhlen",
      "details": "03.06.2025 (Bekanntmachungsdatum)\n\nSchleswig-Holstein Amtsgericht Kiel HRB 14716\nLöschungsankündigung\n\nKieler Bau Verwaltungs UG (haftungsbeschränkt)\nGesellschaft mit beschränkter Haftung\nLehmkuhlen\n\nEs ist die Löschung der nachstehenden Gesellschaft wegen Vermögenslosigkeit gemäß § 394 FamFG beabsichtigt. Widerspruchsfrist: 2 Monate."
    },
    {
      "date": "2025-06-03",
      "id": "111013",
      "original_text": "Sonstige Registerbekanntmachung\nSchleswig-Holstein Amtsgericht Lübeck HRB 14899\nSpare Parts Supply International UG (haftungsbeschränkt) – Nienwohld",
      "type": "Sonstige Registerbekanntmachung",
      "state": "Schleswig-Holstein",
      "amtsgericht": "Amtsgericht Lübeck",
      "registernummer": "HRB 14899",
      "registerart": "HRB",
      "company_name": "Spare Parts Supply International UG (haftungsbeschränkt)",
      "company_seat": "Nienwohld",
      "details": "03.06.2025 (Bekanntmachungsdatum)\n\nSchleswig-Holstein Amtsgericht Lübeck HRB 14899\nSonstige Registerbekanntmachung\n\nSpare Parts Supply International UG (haftungsbeschränkt)\nGesellschaft mit beschränkter Haftung\nNienwohld\n\nAls nicht eingetragen wird veröffentlicht:\nErgeben sich aus den mir vorliegenden Unterlagen Anhaltspunkte dafür, dass die\nGesellschaft vermögenslos ist:\nEinstellung des Insolvenzverfahrens wegen Massunzulänglichkeiten.\nIch beabsichtige daher, die Gesellschaft wegen Vermögenslosigkeit gemäß\n§ 394 FamFG zu löschen.\nIch bestimme eine Frist von einem Monat zur Geltendmachung eines Widerspruchs\ngegen die Löschung, § 394 Abs. 2 S. 1 FamFG.\nWeiter bitte ich Sie, mir binnen derselben Frist mitzuteilen, ob die genannte Gesellschaft\nnoch Vermögen hat, ggf. welche Vermögensgegenstände sie besitzt, ob die Gesellschaft\nnoch Partei eines noch nicht rechtskräftig abgeschlossenen Rechtsstreits ist oder ob sonst\nnoch eine Abwicklung stattfindet.\nNach Fristablauf ohne Widerspruch von Ihnen oder anderer Seite wird die Gesellschaft\ngelöscht."
    },
    {
      "date": "2025-06-03",
      "id": "111014",
      "original_text": "Löschungsankündigung\nMecklenburg-Vorpommern Amtsgericht Neubrandenburg HRB 7781\nCW Reinigungstechnik GmbH – Penkun",
      "type": "Löschungsankündigung",
      "state": "Mecklenburg-Vorpommern",
      "amtsgericht": "Amtsgericht Neubrandenburg",
      "registernummer": "HRB 7781",
      "registerart": "HRB",
      "company_name": "CW Reinigungstechnik GmbH",
      "company_seat": "Penkun",
      "details": "03.06.2025 (Bekanntmachungsdatum)\n\nMecklenburg-Vorpommern Amtsgericht Neubrandenburg HRB 7781\nLöschungsankündigung 03.06.2025 (Eintragungsdatum)\n\nCW Reinigungstechnik GmbH\nGesellschaft mit beschränkter Haftung\nPenkun\n\nDas Registergericht beabsichtigt, die im Handelsregister eingetragene Gesellschaft von Amts wegen nach § 394 FamFG zu löschen. Die Frist zur Erhebung eines Widerspruchs gegen die beabsichtigte Löschung wird auf drei Monate festgesetzt."
    },
    {
      "date": "2025-06-03",
      "id": "111015",
      "original_text": "Sonstige Registerbekanntmachung\nBrandenburg Amtsgericht Frankfurt/Oder HRB 21517\nMGH Michels-Gruppe Holding SE – Bernau bei Berlin",
      "type": "Sonstige Registerbekanntmachung",
      "state": "Brandenburg",
      "amtsgericht": "Amtsgericht Frankfurt/Oder",
      "registernummer": "HRB 21517",
      "registerart": "HRB",
      "company_name": "MGH Michels-Gruppe Holding SE",
      "company_seat": "Bernau bei Berlin",
      "details": "03.06.2025 (Bekanntmachungsdatum)\n\nBrandenburg Amtsgericht Frankfurt/Oder HRB 21517\nSonstige Registerbekanntmachung\n\nMGH Michels-Gruppe Holding SE\nEuropäische Aktiengesellschaft (SE)\nBernau bei Berlin\n\nAls nicht eingetragen wird veröffentlicht: Es ist eine Liste der Aufsichtsratsmitglieder vom 21.05.2025 zum Registergericht eingereicht worden (§ 106 AktG)"
    },
    {
      "date": "2025-06-03",
      "id": "111016",
      "original_text": "Sonstige Registerbekanntmachung\nSachsen Amtsgericht Leipzig HRB 31458\nEVENT PARK GmbH – Leipzig",
      "type": "Sonstige Registerbekanntmachung",
      "state": "Sachsen",
      "amtsgericht": "Amtsgericht Leipzig",
      "registernummer": "HRB 31458",
      "registerart": "HRB",
      "company_name": "EVENT PARK GmbH",
      "company_seat": "Leipzig",
      "details": "03.06.2025 (Bekanntmachungsdatum)\n\nSachsen Amtsgericht Leipzig HRB 31458\nSonstige Registerbekanntmachung 03.06.2025 (Eintragungsdatum)\n\nEVENT PARK GmbH\nGesellschaft mit beschränkter Haftung\nLeipzig\n\nDen Gläubigern der Gesellschaft, deren Forderungen begründet worden sind bevor die Eintragung der Beendigung des Gewinnabführungsvertrages in das Handelsregister nach § 10 des Handelsgesetzbuches als bekanntgemacht gilt, hat der andere Vertragsteil Sicherheit zu leisten, wenn sie sich binnen sechs Monaten nach der Bekanntmachung der Eintragung zu diesem Zweck bei ihm melden."
    },
    {
      "date": "2025-06-03",
      "id": "111017",
      "original_text": "Löschungsankündigung\nSachsen Amtsgericht Dresden HRB 42505\nVERAPACK UG (haftungsbeschränkt) – Görlitz",
      "type": "Löschungsankündigung",
      "state": "Sachsen",
      "amtsgericht": "Amtsgericht Dresden",
      "registernummer": "HRB 42505",
      "registerart": "HRB",
      "company_name": "VERAPACK UG (haftungsbeschränkt)",
      "company_seat": "Görlitz",
      "details": "03.06.2025 (Bekanntmachungsdatum)\n\nSachsen Amtsgericht Dresden HRB 42505\nLöschungsankündigung\n\nVERAPACK UG (haftungsbeschränkt)\nGesellschaft mit beschränkter Haftung\nGörlitz\n\nDas Registergericht beabsichtigt, die im Handelsregister eingetragene Gesellschaft von Amts wegen nach § 394 FamFG zu löschen. Die Frist zu Erhebung eines Widerspruchs gegen die beabsichtigte Löschung wird auf einen Monat festgesetzt."
    },
    {
      "date": "2025-06-03",
      "id": "111018",
      "original_text": "Registerbekanntmachung nach dem Umwandlungsgesetz\nSachsen Amtsgericht Dresden HRB 46301\nDie Fahrschule DFS GmbH – Dresden",
      "type": "Registerbekanntmachung nach dem Umwandlungsgesetz",
      "state": "Sachsen",
      "amtsgericht": "Amtsgericht Dresden",
      "registernummer": "HRB 46301",
      "registerart": "HRB",
      "company_name": "Die Fahrschule DFS GmbH",
      "company_seat": "Dresden",
      "details": "03.06.2025 (Bekanntmachungsdatum)\n\nSachsen Amtsgericht Dresden HRB 46301\nRegisterbekanntmachung nach dem Umwandlungsgesetz 03.06.2025 (Eintragungsdatum)\n\nDie Fahrschule DFS GmbH\nGesellschaft mit beschränkter Haftung\nDresden\n\nDen Gläubigern der an der Ausgliederung beteiligten Rechtsträger ist, wenn sie binnen sechs Monaten nach dem Tag, an dem die Eintragung der Ausgliederung in das Register des Sitzes desjenigen Rechtsträgers, dessen Gläubiger sie sind, nach § 19 Abs. 3 UmwG als bekannt gemacht gilt, ihren Anspruch nach Grund und Höhe in Textform anmelden, Sicherheit zu leisten, soweit sie nicht Befriedigung verlangen können. Dieses Recht steht den Gläubigern jedoch nur zu, wenn sie glaubhaft machen, dass durch die Ausgliederung die Erfüllung der Forderung gefährdet wird."
    },
    {
      "date": "2025-06-03",
      "id": "111019",
      "original_text": "Löschungsankündigung\nSachsen Amtsgericht Dresden HRB 41095\nBERI ExIm GmbH – Dresden",
      "type": "Löschungsankündigung",
      "state": "Sachsen",
      "amtsgericht": "Amtsgericht Dresden",
      "registernummer": "HRB 41095",
      "registerart": "HRB",
      "company_name": "BERI ExIm GmbH",
      "company_seat": "Dresden",
      "details": "03.06.2025 (Bekanntmachungsdatum)\n\nSachsen Amtsgericht Dresden HRB 41095\nLöschungsankündigung\n\nBERI ExIm GmbH\nGesellschaft mit beschränkter Haftung\nDresden\n\nDas Registergericht beabsichtigt, die im Handelsregister eingetragene Gesellschaft von Amts wegen nach § 394 FamFG zu löschen. Die Frist zu Erhebung eines Widerspruchs gegen die beabsichtigte Löschung wird auf einen Monat festgesetzt."
    },
    {
      "date": "2025-06-03",
      "id": "111020",
      "original_text": "Registerbekanntmachung nach dem Umwandlungsgesetz\nSachsen Amtsgericht Dresden HRA 12250\nDie Fahrschule Steffen Wendlin e.K. – Dresden",
      "type": "Registerbekanntmachung nach dem Umwandlungsgesetz",
      "state": "Sachsen",
      "amtsgericht": "Amtsgericht Dresden",
      "registernummer": "HRA 12250",
      "registerart": "HRA",
      "company_name": "Die Fahrschule Steffen Wendlin e.K.",
      "company_seat": "Dresden",
      "details": "03.06.2025 (Bekanntmachungsdatum)\n\nSachsen Amtsgericht Dresden HRA 12250\nRegisterbekanntmachung nach dem Umwandlungsgesetz 03.06.2025 (Eintragungsdatum)\n\nDie Fahrschule Steffen Wendlin e.K.\nEinzelkaufmann / Einzelkauffrau\nDresden\n\nDen Gläubigern der an der Ausgliederung beteiligten Rechtsträger ist, wenn sie binnen sechs Monaten nach dem Tag, an dem die Eintragung der Ausgliederung in das Register des Sitzes desjenigen Rechtsträgers, dessen Gläubiger sie sind, nach § 19 Abs. 3 UmwG als bekannt gemacht gilt, ihren Anspruch nach Grund und Höhe in Textform anmelden, Sicherheit zu leisten, soweit sie nicht Befriedigung verlangen können. Dieses Recht steht den Gläubigern jedoch nur zu, wenn sie glaubhaft machen, dass durch die Ausgliederung die Erfüllung der Forderung gefährdet wird."
    },
    {
      "date": "2025-06-03",
      "id": "111021",
      "original_text": "Löschungsankündigung\nSachsen Amtsgericht Dresden HRB 5205\nHannemann GmbH – Königswartha",
      "type": "Löschungsankündigung",
      "state": "Sachsen",
      "amtsgericht": "Amtsgericht Dresden",
      "registernummer": "HRB 5205",
      "registerart": "HRB",
      "company_name": "Hannemann GmbH",
      "company_seat": "Königswartha",
      "details": "03.06.2025 (Bekanntmachungsdatum)\n\nSachsen Amtsgericht Dresden HRB 5205\nLöschungsankündigung\n\nHannemann GmbH\nGesellschaft mit beschränkter Haftung\nKönigswartha\n\nDas Registergericht beabsichtigt, die im Handelsregister eingetragene Gesellschaft von Amts wegen nach § 394 FamFG zu löschen. Die Frist zu Erhebung eines Widerspruchs gegen die beabsichtigte Löschung wird auf einen Monat festgesetzt."
    },
    {
      "date": "2025-06-03",
      "id": "111022",
      "original_text": "Registerbekanntmachung nach dem Umwandlungsgesetz\nSachsen Amtsgericht Dresden HRB 16239\nFB-Aufzüge Beteiligungs GmbH – Dresden",
      "type": "Registerbekanntmachung nach dem Umwandlungsgesetz",
      "state": "Sachsen",
      "amtsgericht": "Amtsgericht Dresden",
      "registernummer": "HRB 16239",
      "registerart": "HRB",
      "company_name": "FB-Aufzüge Beteiligungs GmbH",
      "company_seat": "Dresden",
      "details": "03.06.2025 (Bekanntmachungsdatum)\n\nSachsen Amtsgericht Dresden HRB 16239\nRegisterbekanntmachung nach dem Umwandlungsgesetz 03.06.2025 (Eintragungsdatum)\n\nFB-Aufzüge Beteiligungs GmbH\nGesellschaft mit beschränkter Haftung\nDresden\n\nDen Gläubigern der an der Verschmelzung beteiligten Rechtsträger ist, wenn sie binnen sechs Monaten nach dem Tag, an dem die Eintragung der Verschmelzung in das Register des Sitzes desjenigen Rechtsträgers, dessen Gläubiger sie sind, nach § 19 Abs. 3 UmwG als bekannt gemacht gilt, ihren Anspruch nach Grund und Höhe in Textform anmelden, Sicherheit zu leisten, soweit sie nicht Befriedigung verlangen können. Dieses Recht steht den Gläubigern jedoch nur zu, wenn sie glaubhaft machen, dass durch die Verschmelzung die Erfüllung der Forderung gefährdet wird."
    },
    {
      "date": "2025-06-03",
      "id": "111023",
      "original_text": "Löschungsankündigung\nSachsen Amtsgericht Leipzig HRB 21414\nBuchhandlung Georg Kossack Gesellschaft mit beschränkter Haftung – Leipzig",
      "type": "Löschungsankündigung",
      "state": "Sachsen",
      "amtsgericht": "Amtsgericht Leipzig",
      "registernummer": "HRB 21414",
      "registerart": "HRB",
      "company_name": "Buchhandlung Georg Kossack Gesellschaft mit beschränkter Haftung",
      "company_seat": "Leipzig",
      "details": "03.06.2025 (Bekanntmachungsdatum)\n\nSachsen Amtsgericht Leipzig HRB 21414\nLöschungsankündigung 03.06.2025 (Eintragungsdatum)\n\nBuchhandlung Georg Kossack Gesellschaft mit beschränkter Haftung\nGesellschaft mit beschränkter Haftung\nLeipzig\n\nDas Registergericht beabsichtigt, die im Handelsregister eingetragene Gesellschaft von Amts wegen nach § 394 FamFG zu löschen. Die Frist zu Erhebung eines Widerspruchs gegen die beabsichtigte Löschung wird auf einen Monat festgesetzt."
    },
    {
      "date": "2025-06-03",
      "id": "111024",
      "original_text": "Einreichung neuer Dokumente\nNiedersachsen Amtsgericht Hannover HRB 101146 früher Amtsgericht Hameln\nLenze Operations GmbH – Aerzen",
      "type": "Einreichung neuer Dokumente",
      "state": "Niedersachsen",
      "amtsgericht": "Amtsgericht Hannover",
      "registernummer": "HRB 101146",
      "registerart": "HRB",
      "company_name": "Lenze Operations GmbH",
      "company_seat": "Aerzen",
      "former_amtsgericht": "Hameln",
      "details": "03.06.2025 (Bekanntmachungsdatum)\n\nNiedersachsen Amtsgericht Hannover HRB 101146 früher Amtsgericht Hameln\nEinreichung neuer Dokumente 03.06.2025 (Eintragungsdatum)\n\nLenze Operations GmbH\nGesellschaft mit beschränkter Haftung\nAerzen\n\nDie Liste der Mitglieder des Aufsichtsrats wurde beim Registergericht eingereicht."
    },
    {
      "date": "2025-06-03",
      "id": "111025",
      "original_text": "Löschungsankündigung\nNiedersachsen Amtsgericht Tostedt HRA 120705 früher Amtsgericht Buxtehude\nPrime Commercial Properties (Bremen) GmbH & Co. KG – Buxtehude",
      "type": "Löschungsankündigung",
      "state": "Niedersachsen",
      "amtsgericht": "Amtsgericht Tostedt",
      "registernummer": "HRA 120705",
      "registerart": "HRA",
      "company_name": "Prime Commercial Properties (Bremen) GmbH & Co. KG",
      "company_seat": "Buxtehude",
      "former_amtsgericht": "Buxtehude",
      "details": "03.06.2025 (Bekanntmachungsdatum)\n\nNiedersachsen Amtsgericht Tostedt HRA 120705 früher Amtsgericht Buxtehude\nLöschungsankündigung 03.06.2025 (Eintragungsdatum)\n\nPrime Commercial Properties (Bremen) GmbH & Co. KG\nKommanditgesellschaft\nBuxtehude\n\nDas Registergericht beabsichtigt, die Firma von Amts wegen nach § 395 FamFG zu löschen. Die Frist zur Erhebung eines Widerspruchs ist auf 1 Monat ab dieser Registerbekanntmachung festgesetzt."
    },
    {
      "date": "2025-06-03",
      "id": "111026",
      "original_text": "Registerbekanntmachung nach dem Umwandlungsgesetz\nSchleswig-Holstein Amtsgericht Kiel HRA 9975\nLeibniz Privatschule Kaltenkirchen Fördergesellschaft mbH und Co . KG – Kaltenkirchen",
      "type": "Registerbekanntmachung nach dem Umwandlungsgesetz",
      "state": "Schleswig-Holstein",
      "amtsgericht": "Amtsgericht Kiel",
      "registernummer": "HRA 9975",
      "registerart": "HRA",
      "company_name": "Leibniz Privatschule Kaltenkirchen Fördergesellschaft mbH und Co . KG",
      "company_seat": "Kaltenkirchen",
      "details": "03.06.2025 (Bekanntmachungsdatum)\n\nSchleswig-Holstein Amtsgericht Kiel HRA 9975\nRegisterbekanntmachung nach dem Umwandlungsgesetz 02.06.2025 (Eintragungsdatum)\n\nLeibniz Privatschule Kaltenkirchen Fördergesellschaft mbH und Co . KG\nKommanditgesellschaft\nKaltenkirchen\n\nZu Eintragungsnummer 4 vom 02.06.2025 wird als nicht eingetragen veröffentlicht: Den Gläubigern der an der Verschmelzung beteiligten Rechtsträger ist, wenn sie binnen sechs Monaten nach dem Tag, an dem die Eintragung der Verschmelzung in das Register des Sitzes desjenigen Rechtsträgers, dessen Gläubiger sie sind, nach § 19 Abs. 3 UmwG bekannt gemacht worden ist, ihren Anspruch nach Grund und Höhe schriftlich anmelden, Sicherheit zu leisten, soweit sie nicht Befriedigung verlangen können. Dieses Recht steht den Gläubigern jedoch nur zu, wenn sie glaubhaft machen, dass durch die Verschmelzung die Erfüllung ihrer Forderung gefährdet wird."
    },
    {
      "date": "2025-06-03",
      "id": "111027",
      "original_text": "Registerbekanntmachung nach dem Umwandlungsgesetz\nRheinland-Pfalz Amtsgericht Wittlich HRB 46085\nc3e VV GmbH – Kell am See",
      "type": "Registerbekanntmachung nach dem Umwandlungsgesetz",
      "state": "Rheinland-Pfalz",
      "amtsgericht": "Amtsgericht Wittlich",
      "registernummer": "HRB 46085",
      "registerart": "HRB",
      "company_name": "c3e VV GmbH",
      "company_seat": "Kell am See",
      "details": "03.06.2025 (Bekanntmachungsdatum)\n\nRheinland-Pfalz Amtsgericht Wittlich HRB 46085\nRegisterbekanntmachung nach dem Umwandlungsgesetz 03.06.2025 (Eintragungsdatum)\n\nc3e VV GmbH\nGesellschaft mit beschränkter Haftung\nKell am See\n\nAls nicht eingetragen wird veröffentlicht: Den Gläubigern der an der Verschmelzung beteiligten Rechtsträger ist, wenn sie binnen sechs Monaten nach dem Tag, an dem die Eintragung der Verschmelzung in das Register des Sitzes desjenigen Rechtsträgers,dessen Gläubiger sie sind, nach § 19 Abs. 3 UmwG als bekannt gemacht gilt, ihren Anspruch nach Grund und Höhe schriftlich anmelden, Sicherheit zu leisten, soweit sie nicht Befriedigung verlangen können. Dieses Recht steht den Gläubigern jedoch nur zu, wenn sie glaubhaft machen, dass durch die Verschmelzung die Erfüllung der Forderung gefährdet wird."
    },
    {
      "date": "2025-06-03",
      "id": "111028",
      "original_text": "Löschungsankündigung\nRheinland-Pfalz Amtsgericht Koblenz HRB 25711\nAlltagsHeldenNetz UG (haftungsbeschränkt) – Koblenz",
      "type": "Löschungsankündigung",
      "state": "Rheinland-Pfalz",
      "amtsgericht": "Amtsgericht Koblenz",
      "registernummer": "HRB 25711",
      "registerart": "HRB",
      "company_name": "AlltagsHeldenNetz UG (haftungsbeschränkt)",
      "company_seat": "Koblenz",
      "details": "03.06.2025 (Bekanntmachungsdatum)\n\nRheinland-Pfalz Amtsgericht Koblenz HRB 25711\nLöschungsankündigung\n\nAlltagsHeldenNetz UG (haftungsbeschränkt)\nGesellschaft mit beschränkter Haftung\nKoblenz\n\nDas Registergericht beabsichtigt die Gesellschaft von Amts wegen nach § 394 FamFG zu löschen. Die Frist zur Erhebung eines Widerspruchs ist auf einen Monat festgesetzt."
    },
    {
      "date": "2025-06-03",
      "id": "111029",
      "original_text": "Einreichung neuer Dokumente\nRheinland-Pfalz Amtsgericht Ludwigshafen a.Rhein (Ludwigshafen) HRB 1196\nPFALZWERKE AKTIENGESELLSCHAFT – Ludwigshafen am Rhein",
      "type": "Einreichung neuer Dokumente",
      "state": "Rheinland-Pfalz",
      "amtsgericht": "Amtsgericht Ludwigshafen a.Rhein (Ludwigshafen)",
      "registernummer": "HRB 1196",
      "registerart": "HRB",
      "company_name": "PFALZWERKE AKTIENGESELLSCHAFT",
      "company_seat": "Ludwigshafen am Rhein",
      "details": "03.06.2025 (Bekanntmachungsdatum)\n\nRheinland-Pfalz Amtsgericht Ludwigshafen a.Rhein (Ludwigshafen) HRB 1196\nEinreichung neuer Dokumente\n\nPFALZWERKE AKTIENGESELLSCHAFT\nAktiengesellschaft\nLudwigshafen am Rhein\n\nDem Registergericht ist eine neue Liste der Mitglieder des Aufsichtsrates eingereicht worden."
    },
    {
      "date": "2025-06-03",
      "id": "111030",
      "original_text": "Registerbekanntmachung nach dem Umwandlungsgesetz\nBremen Amtsgericht Bremen HRA 30689\nMT Aerospace Holding GmbH & Co. KG – Bremen",
      "type": "Registerbekanntmachung nach dem Umwandlungsgesetz",
      "state": "Bremen",
      "amtsgericht": "Amtsgericht Bremen",
      "registernummer": "HRA 30689",
      "registerart": "HRA",
      "company_name": "MT Aerospace Holding GmbH & Co. KG",
      "company_seat": "Bremen",
      "details": "03.06.2025 (Bekanntmachungsdatum)\n\nBremen Amtsgericht Bremen HRA 30689\nRegisterbekanntmachung nach dem Umwandlungsgesetz 30.05.2025 (Eintragungsdatum)\n\nMT Aerospace Holding GmbH & Co. KG\nKommanditgesellschaft\nBremen\n\nZu Eintragungsnummer 1 vom 30.05.2025 wird als nicht eingetragen veröffentlicht: Den Gläubigern ist, wenn sie binnen sechs Monaten nach dem Tag, an dem die Eintragung der Umwandlung als bekannt gemacht gilt, ihren Anspruch nach Grund und Höhe schriftlich anmelden, Sicherheit zu leisten, soweit sie nicht Befriedigung verlangen können. Dieses Recht steht den Gläubigern jedoch nur zu, wenn sie glaubhaft machen, dass durch die Umwandlung die Erfüllung ihrer Forderung gefährdet wird. Das Recht, Sicherheitsleistung zu verlangen, steht Gläubigern nicht zu, die im Falle der Insolvenz ein Recht auf vorzugsweise Befriedigung aus einer Deckungsmasse haben, die nach gesetzlicher Vorschrift zu ihrem Schutz errichtet und staatlich überwacht ist."
    },
    {
      "date": "2025-06-03",
      "id": "111031",
      "original_text": "Registerbekanntmachung nach dem Umwandlungsgesetz\nBremen Amtsgericht Bremen HRB 23175\nMT Aerospace Holding GmbH – Bremen",
      "type": "Registerbekanntmachung nach dem Umwandlungsgesetz",
      "state": "Bremen",
      "amtsgericht": "Amtsgericht Bremen",
      "registernummer": "HRB 23175",
      "registerart": "HRB",
      "company_name": "MT Aerospace Holding GmbH",
      "company_seat": "Bremen",
      "details": "03.06.2025 (Bekanntmachungsdatum)\n\nBremen Amtsgericht Bremen HRB 23175\nRegisterbekanntmachung nach dem Umwandlungsgesetz 30.05.2025 (Eintragungsdatum)\n\nMT Aerospace Holding GmbH\nGesellschaft mit beschränkter Haftung\nBremen\n\nZu Eintragungsnummer 3 vom 30.05.2025 wird als nicht eingetragen veröffentlicht: Den Gläubigern ist, wenn sie binnen sechs Monaten nach dem Tag, an dem die Eintragung der Umwandlung als bekannt gemacht gilt, ihren Anspruch nach Grund und Höhe schriftlich anmelden, Sicherheit zu leisten, soweit sie nicht Befriedigung verlangen können. Dieses Recht steht den Gläubigern jedoch nur zu, wenn sie glaubhaft machen, dass durch die Umwandlung die Erfüllung ihrer Forderung gefährdet wird. Das Recht, Sicherheitsleistung zu verlangen, steht Gläubigern nicht zu, die im Falle der Insolvenz ein Recht auf vorzugsweise Befriedigung aus einer Deckungsmasse haben, die nach gesetzlicher Vorschrift zu ihrem Schutz errichtet und staatlich überwacht ist."
    },
    {
      "date": "2025-06-03",
      "id": "111032",
      "original_text": "Löschungsankündigung\nNordrhein-Westfalen Amtsgericht Düsseldorf HRB 99102\nWorkbase Platforms GmbH – Monheim am Rhein",
      "type": "Löschungsankündigung",
      "state": "Nordrhein-Westfalen",
      "amtsgericht": "Amtsgericht Düsseldorf",
      "registernummer": "HRB 99102",
      "registerart": "HRB",
      "company_name": "Workbase Platforms GmbH",
      "company_seat": "Monheim am Rhein",
      "details": "03.06.2025 (Bekanntmachungsdatum)\n\nNordrhein-Westfalen Amtsgericht Düsseldorf HRB 99102\nLöschungsankündigung\n\nWorkbase Platforms GmbH\nGesellschaft mit beschränkter Haftung\nMonheim am Rhein\n\nDas Registergericht beabsichtigt die Gesellschaft von Amts wegen nach § 394 FamFG zu löschen. Die Frist zur Erhebung eines Widerspruchs ist auf 3 Wochen festgesetzt.\n\nRechtsbehelfsbelehrung:\nDas Widerspruchsrecht steht jedem zu, der an der Unterlassung der Löschung ein berechtigtes Interesse hat. Der Widerspruch ist bei dem Amtsgericht Düsseldorf -Registergericht-, Werdener Straße 1, 40227 Düsseldorf schriftlich in deutscher Sprache oder zur Niederschrift der Geschäftsstelle einzulegen. Der Widerspruch kann auch zur Niederschrift der Geschäftsstelle eines jeden Amtsgerichtes abgegeben werden. Die Einlegung ist auch durch Übertragung eines elektronischen Dokuments an die elektronische Poststelle des Gerichts möglich. Das elektronische Dokument muss für die Bearbeitung durch das Gericht geeignet und mit einer qualifizierten elektronischen Signatur der verantwortenden Person versehen sein oder von der verantwortenden Person signiert und auf einem sicheren Übermittlungsweg gemäß § 130a ZPO nach näherer Maßgabe der Verordnung über die technischen Rahmenbedingungen des elektronischen Rechtsverkehrs und über das besondere elektronische Behördenpostfach (BGBl. I, S.3803) eingereicht werden. Weitere Informationen erhalten Sie auf der Internetseite www.justiz.de.\nDer Widerspruch muss spätestens innerhalb der gesetzten Frist nach dem Datum der Bekanntmachung der Löschungsankündigung bei dem Amtsgericht - Registergericht - Düsseldorf eingegangen sein.  Dies gilt auch dann, wenn der Widerspruch zur Niederschrift der Geschäftsstelle eines anderen Amtsgerichtes abgegeben wurde. Die Frist beginnt mit dem Tage der Bekanntmachung der Löschungsankündigung in dem für die Bekanntmachung der Eintragungen in das Handelsregister bestimmten elektronischen Informations- und Kommunikationssystem nach § 10 des Handelsgesetzbuches. Fällt das Ende der Frist auf einen Sonntag, einen allgemeinen Feiertag oder Sonnabend, so endet die Frist mit Ablauf des nächsten Werktages.\nDer Widerspruch muss die Bezeichnung der angefochtenen Löschungsankündigung sowie die Erklärung enthalten, dass Widerspruch gegen diese Löschungsankündigung eingelegt wird. Er ist zu unterzeichnen und soll begründet werden."
    },
    {
      "date": "2025-06-03",
      "id": "111033",
      "original_text": "Einreichung neuer Dokumente\nNordrhein-Westfalen Amtsgericht Dortmund HRB 25925\nAmazon Logistik Werne GmbH – Werne",
      "type": "Einreichung neuer Dokumente",
      "state": "Nordrhein-Westfalen",
      "amtsgericht": "Amtsgericht Dortmund",
      "registernummer": "HRB 25925",
      "registerart": "HRB",
      "company_name": "Amazon Logistik Werne GmbH",
      "company_seat": "Werne",
      "details": "03.06.2025 (Bekanntmachungsdatum)\n\nNordrhein-Westfalen Amtsgericht Dortmund HRB 25925\nEinreichung neuer Dokumente\n\nAmazon Logistik Werne GmbH\nGesellschaft mit beschränkter Haftung\nWerne\n\nDem Registergericht ist eine neue Liste der Mitglieder des Aufsichtsrates eingereicht worden."
    },
    {
      "date": "2025-06-03",
      "id": "111034",
      "original_text": "Löschungsankündigung\nNordrhein-Westfalen Amtsgericht Hamm HRA 3805\nRW Kinderwelten Samoastraße KG – Holzwickede",
      "type": "Löschungsankündigung",
      "state": "Nordrhein-Westfalen",
      "amtsgericht": "Amtsgericht Hamm",
      "registernummer": "HRA 3805",
      "registerart": "HRA",
      "company_name": "RW Kinderwelten Samoastraße KG",
      "company_seat": "Holzwickede",
      "details": "03.06.2025 (Bekanntmachungsdatum)\n\nNordrhein-Westfalen Amtsgericht Hamm HRA 3805\nLöschungsankündigung\n\nRW Kinderwelten Samoastraße KG\nKommanditgesellschaft\nHolzwickede\n\nDas Registergericht beabsichtigt die Firma von Amts wegen nach § 394 FamFG zu löschen. Die Frist zur Erhebung eines Widerspruchs ist auf drei Monate festgesetzt."
    },
    {
      "date": "2025-06-03",
      "id": "111035",
      "original_text": "Registerbekanntmachung nach dem Umwandlungsgesetz\nNordrhein-Westfalen Amtsgericht Düsseldorf HRA 27092\nPaxos Düsseldorf BA8 SARL & Co. KG – Düsseldorf",
      "type": "Registerbekanntmachung nach dem Umwandlungsgesetz",
      "state": "Nordrhein-Westfalen",
      "amtsgericht": "Amtsgericht Düsseldorf",
      "registernummer": "HRA 27092",
      "registerart": "HRA",
      "company_name": "Paxos Düsseldorf BA8 SARL & Co. KG",
      "company_seat": "Düsseldorf",
      "details": "03.06.2025 (Bekanntmachungsdatum)\n\nNordrhein-Westfalen Amtsgericht Düsseldorf HRA 27092\nRegisterbekanntmachung nach dem Umwandlungsgesetz\n\nPaxos Düsseldorf BA8 SARL & Co. KG\nKommanditgesellschaft\nDüsseldorf\n\nEs wird darauf hingewiesen, dass ein Entwurf des Formwechselplans vom 16.05.2025 über einen grenzüberschreitenden vollständigen Formwechsel der bisher binationalen Kommanditgesellschaft Paxos Düsseldorf BA8 SARL & Co. KG mit Sitz in Düsseldorf (Amtsgericht Düsseldorf, HRA 27092)  in die Paxos Düsseldorf BA8 SCS (société en commandite simple) mit Sitz in Luxemburg, Großherzogtum Luxemburg, (Registre de Commerce et des Sociétés de Luxembourg, B289942) beim Handelsregister eingereicht worden ist.\nDie Anteilsinhaber, die Gläubiger, sowie die zuständigen Betriebsräte der an dem grenzüberschreitenden Formwechsel beteiligten Gesellschaft oder, soweit es keinen Betriebsrat gibt, die Arbeitnehmer der an dem grenzüberschreitenden Formwechsel beteiligten Gesellschaft, können der Gesellschaft spätestens fünf Arbeitstage vor dem Tag der Gesellschafterversammlung Bemerkungen zum Formwechselplan übermitteln."
    },
    {
      "date": "2025-06-03",
      "id": "111036",
      "original_text": "Registerbekanntmachung nach dem Umwandlungsgesetz\nNordrhein-Westfalen Amtsgericht Münster HRA 12032\nDustin Malankowskie & Arthur Fischer OHG – Münster",
      "type": "Registerbekanntmachung nach dem Umwandlungsgesetz",
      "state": "Nordrhein-Westfalen",
      "amtsgericht": "Amtsgericht Münster",
      "registernummer": "HRA 12032",
      "registerart": "HRA",
      "company_name": "Dustin Malankowskie & Arthur Fischer OHG",
      "company_seat": "Münster",
      "details": "03.06.2025 (Bekanntmachungsdatum)\n\nNordrhein-Westfalen Amtsgericht Münster HRA 12032\nRegisterbekanntmachung nach dem Umwandlungsgesetz 03.06.2025 (Eintragungsdatum)\n\nDustin Malankowskie & Arthur Fischer OHG\nOffene Handelsgesellschaft\nMünster\n\nDen Gläubigern der an der formwechselnden Umwandlung beteiligten Rechtsträger ist, wenn sie binnen sechs Monaten nach dem Tag, an dem die Eintragung der formwechselnden Umwandlung in das Register des Sitzes desjenigen Rechtsträgers, dessen Gläubiger sie sind, nach § 19 Absatz 3 UmwG als bekanntgemacht gilt, ihren Anspruch nach Grund und Höhe schriftlich anmelden, Sicherheit zu leisten, soweit sie nicht Befriedigung verlangen können. Dieses Recht steht den Gläubigern jedoch nur zu, wenn sie glaubhaft machen, dass durch die formwechselnden Umwandlung die Erfüllung ihrer Forderung gefährdet wird."
    },
    {
      "date": "2025-06-03",
      "id": "111037",
      "original_text": "Löschungsankündigung\nNordrhein-Westfalen Amtsgericht Dortmund HRB 27845\nBmBe GmbH – Dortmund",
      "type": "Löschungsankündigung",
      "state": "Nordrhein-Westfalen",
      "amtsgericht": "Amtsgericht Dortmund",
      "registernummer": "HRB 27845",
      "registerart": "HRB",
      "company_name": "BmBe GmbH",
      "company_seat": "Dortmund",
      "details": "03.06.2025 (Bekanntmachungsdatum)\n\nNordrhein-Westfalen Amtsgericht Dortmund HRB 27845\nLöschungsankündigung\n\nBmBe GmbH\nGesellschaft mit beschränkter Haftung\nDortmund\n\nDas Registergericht beabsichtigt die Gesellschaft von Amts wegen nach § 394 FamFG zu löschen. Die Frist zur Erhebung eines Widerspruchs ist auf zwei Monate festgesetzt."
    },
    {
      "date": "2025-06-03",
      "id": "111038",
      "original_text": "Löschungsankündigung\nNordrhein-Westfalen Amtsgericht Aachen HRB 23783\nSiano GmbH – Aachen",
      "type": "Löschungsankündigung",
      "state": "Nordrhein-Westfalen",
      "amtsgericht": "Amtsgericht Aachen",
      "registernummer": "HRB 23783",
      "registerart": "HRB",
      "company_name": "Siano GmbH",
      "company_seat": "Aachen",
      "details": "03.06.2025 (Bekanntmachungsdatum)\n\nNordrhein-Westfalen Amtsgericht Aachen HRB 23783\nLöschungsankündigung\n\nSiano GmbH\nGesellschaft mit beschränkter Haftung\nAachen\n\nDas Registergericht beabsichtigt, von Amts wegen die Gesellschaft wegen Vermögenslosigkeit nach § 394 FamFG zu löschen, weil das Finanzamt Aachen-Stadt mit Schreiben vom 19.05.2025 Umstände mitgeteilt hat, aufgrund derer das Gericht davon überzeugt ist, dass die Gesellschaft vollständig vermögenslos ist.\n\nZur Geltendmachung des Widerspruchs gegen die beabsichtigte Löschung wird hiermit eine Frist von einem Monat ab Veröffentlichung dieser Ankündigung bestimmt.\n\nRechtsbehelfsbelehrung:\n\nGegen diese Verfügung kann Widerspruch eingelegt werden. Zum Widerspruch ist jeder berechtigt, der an der Unterlassung der Löschung ein berechtigtes Interesse hat.\n\nDer Widerspruch ist bei dem Amtsgericht Aachen, Adalbertsteinweg 92, 52070 Aachen schriftlich in deutscher Sprache oder zur Niederschrift der Geschäftsstelle einzulegen. Der Widerspruch kann auch zur Niederschrift der Geschäftsstelle eines jeden Amtsgerichtes abgegeben werden.\n\nDer Widerspruch muss spätestens innerhalb der gesetzten Frist nach der Bekanntgabe der Verfügung bei dem Amtsgericht Aachen eingegangen sein. Dies gilt auch dann, wenn der Widerspruch zur Niederschrift der Geschäftsstelle eines anderen Amtsgerichtes abgegeben wurde. Die Frist beginnt mit der Bekanntgabe der Verfügung durch Veröffentlichung. Fällt das Ende der Frist auf einen Sonntag, einen allgemeinen Feiertag oder Sonnabend, so endet die Frist mit Ablauf des nächsten Werktages.\n\nDer Widerspruch muss die Bezeichnung der angefochtenen Verfügung sowie die Erklärung enthalten, dass Widerspruch gegen diese Verfügung eingelegt wird. Er ist zu unterzeichnen und soll begründet werden.\n\nDie Einlegung ist auch durch Übertragung eines elektronischen Dokuments an die elektronische Poststelle des Gerichts möglich. Das elektronische Dokument muss für die Bearbeitung durch das Gericht geeignet und mit einer qualifizierten elektronischen Signatur der verantwortenden Person versehen sein oder von der verantwortenden Person signiert und auf einem sicheren Übermittlungsweg gemäß § 130 a ZPO nach näherer Maßgabe der Verordnung über die technischen Rahmenbedingungen des elektronischen Rechtsverkehrs und über das besondere elektronische Behördenpostfach (BGBl. I, S. 3803) eingereicht werden. Weitere Informationen erhalten Sie auf der Internetseite www.justiz.de."
    },
    {
      "date": "2025-06-03",
      "id": "111039",
      "original_text": "Löschungsankündigung\nNordrhein-Westfalen Amtsgericht Köln HRB 75005\nPantheon M.E.G. Company UG (haftungsbeschränkt) – Köln",
      "type": "Löschungsankündigung",
      "state": "Nordrhein-Westfalen",
      "amtsgericht": "Amtsgericht Köln",
      "registernummer": "HRB 75005",
      "registerart": "HRB",
      "company_name": "Pantheon M.E.G. Company UG (haftungsbeschränkt)",
      "company_seat": "Köln",
      "details": "03.06.2025 (Bekanntmachungsdatum)\n\nNordrhein-Westfalen Amtsgericht Köln HRB 75005\nLöschungsankündigung\n\nPantheon M.E.G. Company UG (haftungsbeschränkt)\nGesellschaft mit beschränkter Haftung\nKöln\n\nDas Registergericht beabsichtigt die Gesellschaft von Amts wegen nach § 394 FamFG zu löschen. Die Frist zur Erhebung eines Widerspruchs ist auf einen Monat festgesetzt."
    },
    {
      "date": "2025-06-03",
      "id": "111040",
      "original_text": "Registerbekanntmachung nach dem Umwandlungsgesetz\nNordrhein-Westfalen Amtsgericht Arnsberg HRB 4483\nhellweg Renovations Beteiligungsgesellschaft mbH – Ense",
      "type": "Registerbekanntmachung nach dem Umwandlungsgesetz",
      "state": "Nordrhein-Westfalen",
      "amtsgericht": "Amtsgericht Arnsberg",
      "registernummer": "HRB 4483",
      "registerart": "HRB",
      "company_name": "hellweg Renovations Beteiligungsgesellschaft mbH",
      "company_seat": "Ense",
      "details": "03.06.2025 (Bekanntmachungsdatum)\n\nNordrhein-Westfalen Amtsgericht Arnsberg HRB 4483\nRegisterbekanntmachung nach dem Umwandlungsgesetz 03.06.2025 (Eintragungsdatum)\n\nhellweg Renovations Beteiligungsgesellschaft mbH\nGesellschaft mit beschränkter Haftung\nEnse\n\nDen Gläubigern der an der Verschmelzung beteiligten Rechtsträger ist, wenn sie binnen sechs Monaten nach dem Tag, an dem die Eintragung der Verschmelzung in das Register des Sitzes desjenigen Rechtsträgers, dessen Gläubiger sie sind, nach § 19 Absatz 3 UmwG als bekanntgemacht gilt, ihren Anspruch nach Grund und Höhe schriftlich anmelden, Sicherheit zu leisten, soweit sie nicht Befriedigung verlangen können. Dieses Recht steht den Gläubigern jedoch nur zu, wenn sie glaubhaft machen, dass durch die Verschmelzung die Erfüllung ihrer Forderung gefährdet wird."
    },
    {
      "date": "2025-06-03",
      "id": "111041",
      "original_text": "Löschungsankündigung\nNordrhein-Westfalen Amtsgericht Dortmund HRB 29425\nOMNITRADE GmbH – Dortmund",
      "type": "Löschungsankündigung",
      "state": "Nordrhein-Westfalen",
      "amtsgericht": "Amtsgericht Dortmund",
      "registernummer": "HRB 29425",
      "registerart": "HRB",
      "company_name": "OMNITRADE GmbH",
      "company_seat": "Dortmund",
      "details": "03.06.2025 (Bekanntmachungsdatum)\n\nNordrhein-Westfalen Amtsgericht Dortmund HRB 29425\nLöschungsankündigung\n\nOMNITRADE GmbH\nGesellschaft mit beschränkter Haftung\nDortmund\n\nDas Registergericht beabsichtigt die Gesellschaft von Amts wegen nach § 394 FamFG zu löschen. Die Frist zur Erhebung eines Widerspruchs ist auf zwei Monate festgesetzt."
    },
    {
      "date": "2025-06-03",
      "id": "111042",
      "original_text": "Löschungsankündigung\nNordrhein-Westfalen Amtsgericht Hamm HRB 9144\nMandrake Pharma GmbH – Hamm",
      "type": "Löschungsankündigung",
      "state": "Nordrhein-Westfalen",
      "amtsgericht": "Amtsgericht Hamm",
      "registernummer": "HRB 9144",
      "registerart": "HRB",
      "company_name": "Mandrake Pharma GmbH",
      "company_seat": "Hamm",
      "details": "03.06.2025 (Bekanntmachungsdatum)\n\nNordrhein-Westfalen Amtsgericht Hamm HRB 9144\nLöschungsankündigung\n\nMandrake Pharma GmbH\nGesellschaft mit beschränkter Haftung\nHamm\n\nDas Registergericht beabsichtigt die Gesellschaft von Amts wegen nach § 394 FamFG zu löschen. Die Frist zur Erhebung eines Widerspruchs ist auf drei Monate festgesetzt."
    },
    {
      "date": "2025-06-03",
      "id": "111043",
      "original_text": "Löschungsankündigung\nNordrhein-Westfalen Amtsgericht Kleve HRB 19269\nMur Bau GmbH – Kamp-Lintfort",
      "type": "Löschungsankündigung",
      "state": "Nordrhein-Westfalen",
      "amtsgericht": "Amtsgericht Kleve",
      "registernummer": "HRB 19269",
      "registerart": "HRB",
      "company_name": "Mur Bau GmbH",
      "company_seat": "Kamp-Lintfort",
      "details": "03.06.2025 (Bekanntmachungsdatum)\n\nNordrhein-Westfalen Amtsgericht Kleve HRB 19269\nLöschungsankündigung\n\nMur Bau GmbH\nGesellschaft mit beschränkter Haftung\nKamp-Lintfort\n\nDas Registergericht beabsichtigt die Gesellschaft von Amts wegen nach § 394 FamFG zu löschen. Die Frist zur Erhebung eines Widerspruchs ist auf einen Monat festgesetzt."
    },
    {
      "date": "2025-06-03",
      "id": "111044",
      "original_text": "Registerbekanntmachung nach dem Umwandlungsgesetz\nNordrhein-Westfalen Amtsgericht Essen HRB 30271\nGerman Sports IPCo GmbH – Essen",
      "type": "Registerbekanntmachung nach dem Umwandlungsgesetz",
      "state": "Nordrhein-Westfalen",
      "amtsgericht": "Amtsgericht Essen",
      "registernummer": "HRB 30271",
      "registerart": "HRB",
      "company_name": "German Sports IPCo GmbH",
      "company_seat": "Essen",
      "details": "03.06.2025 (Bekanntmachungsdatum)\n\nNordrhein-Westfalen Amtsgericht Essen HRB 30271\nRegisterbekanntmachung nach dem Umwandlungsgesetz 03.06.2025 (Eintragungsdatum)\n\nGerman Sports IPCo GmbH\nGesellschaft mit beschränkter Haftung\nEssen\n\nDen Gläubigern der an der Verschmelzung beteiligten Rechtsträger ist, wenn sie binnen sechs Monaten nach dem Tag, an dem die Eintragung der Verschmelzung in das Register des Sitzes desjenigen Rechtsträgers, dessen Gläubiger sie sind, nach § 19 Absatz 3 UmwG als bekanntgemacht gilt, ihren Anspruch nach Grund und Höhe schriftlich anmelden, Sicherheit zu leisten, soweit sie nicht Befriedigung verlangen können. Dieses Recht steht den Gläubigern jedoch nur zu, wenn sie glaubhaft machen, dass durch die Verschmelzung die Erfüllung ihrer Forderung gefährdet wird."
    },
    {
      "date": "2025-06-03",
      "id": "111045",
      "original_text": "Löschungsankündigung\nNordrhein-Westfalen Amtsgericht Düsseldorf HRB 50524\nTechno Teile Products (Tuopu Group) GmbH – Düsseldorf",
      "type": "Löschungsankündigung",
      "state": "Nordrhein-Westfalen",
      "amtsgericht": "Amtsgericht Düsseldorf",
      "registernummer": "HRB 50524",
      "registerart": "HRB",
      "company_name": "Techno Teile Products (Tuopu Group) GmbH",
      "company_seat": "Düsseldorf",
      "details": "03.06.2025 (Bekanntmachungsdatum)\n\nNordrhein-Westfalen Amtsgericht Düsseldorf HRB 50524\nLöschungsankündigung\n\nTechno Teile Products (Tuopu Group) GmbH\nGesellschaft mit beschränkter Haftung\nDüsseldorf\n\nDas Registergericht beabsichtigt die Gesellschaft von Amts wegen nach § 394 FamFG zu löschen. Die Frist zur Erhebung eines Widerspruchs ist auf 3 Wochen festgesetzt.\n\nRechtsbehelfsbelehrung:\nDas Widerspruchsrecht steht jedem zu, der an der Unterlassung der Löschung ein berechtigtes Interesse hat. Der Widerspruch ist bei dem Amtsgericht Düsseldorf -Registergericht-, Werdener Straße 1, 40227 Düsseldorf schriftlich in deutscher Sprache oder zur Niederschrift der Geschäftsstelle einzulegen. Der Widerspruch kann auch zur Niederschrift der Geschäftsstelle eines jeden Amtsgerichtes abgegeben werden. Die Einlegung ist auch durch Übertragung eines elektronischen Dokuments an die elektronische Poststelle des Gerichts möglich. Das elektronische Dokument muss für die Bearbeitung durch das Gericht geeignet und mit einer qualifizierten elektronischen Signatur der verantwortenden Person versehen sein oder von der verantwortenden Person signiert und auf einem sicheren Übermittlungsweg gemäß § 130a ZPO nach näherer Maßgabe der Verordnung über die technischen Rahmenbedingungen des elektronischen Rechtsverkehrs und über das besondere elektronische Behördenpostfach (BGBl. I, S.3803) eingereicht werden. Weitere Informationen erhalten Sie auf der Internetseite www.justiz.de.\nDer Widerspruch muss spätestens innerhalb der gesetzten Frist nach dem Datum der Bekanntmachung der Löschungsankündigung bei dem Amtsgericht - Registergericht - Düsseldorf eingegangen sein.  Dies gilt auch dann, wenn der Widerspruch zur Niederschrift der Geschäftsstelle eines anderen Amtsgerichtes abgegeben wurde. Die Frist beginnt mit dem Tage der Bekanntmachung der Löschungsankündigung in dem für die Bekanntmachung der Eintragungen in das Handelsregister bestimmten elektronischen Informations- und Kommunikationssystem nach § 10 des Handelsgesetzbuches. Fällt das Ende der Frist auf einen Sonntag, einen allgemeinen Feiertag oder Sonnabend, so endet die Frist mit Ablauf des nächsten Werktages.\nDer Widerspruch muss die Bezeichnung der angefochtenen Löschungsankündigung sowie die Erklärung enthalten, dass Widerspruch gegen diese Löschungsankündigung eingelegt wird. Er ist zu unterzeichnen und soll begründet werden."
    },
    {
      "date": "2025-06-03",
      "id": "111046",
      "original_text": "Registerbekanntmachung nach dem Umwandlungsgesetz\nRheinland-Pfalz Amtsgericht Zweibrücken HRB 11761\nNardini Klinikum GmbH – Zweibrücken",
      "type": "Registerbekanntmachung nach dem Umwandlungsgesetz",
      "state": "Rheinland-Pfalz",
      "amtsgericht": "Amtsgericht Zweibrücken",
      "registernummer": "HRB 11761",
      "registerart": "HRB",
      "company_name": "Nardini Klinikum GmbH",
      "company_seat": "Zweibrücken",
      "details": "03.06.2025 (Bekanntmachungsdatum)\n\nRheinland-Pfalz Amtsgericht Zweibrücken HRB 11761\nRegisterbekanntmachung nach dem Umwandlungsgesetz 03.06.2025 (Eintragungsdatum)\n\nNardini Klinikum GmbH\nGesellschaft mit beschränkter Haftung\nZweibrücken\n\nAls nicht eingetragen wird veröffentlicht: Den Gläubigern der an der Verschmelzung beteiligten Rechtsträger ist, wenn sie binnen sechs Monaten nach dem Tag, an dem die Eintragung der Verschmelzung in das Register des Sitzes desjenigen Rechtsträgers,dessen Gläubiger sie sind, nach § 19 Abs. 3 UmwG als bekannt gemacht gilt, ihren Anspruch nach Grund und Höhe schriftlich anmelden, Sicherheit zu leisten, soweit sie nicht Befriedigung verlangen können. Dieses Recht steht den Gläubigern jedoch nur zu, wenn sie glaubhaft machen, dass durch die Verschmelzung die Erfüllungd er Forderung gefährdet wird."
    },
    {
      "date": "2025-06-03",
      "id": "111047",
      "original_text": "Registerbekanntmachung nach dem Umwandlungsgesetz\nNordrhein-Westfalen Amtsgericht Bielefeld HRB 44081\nBechtle GmbH – Bielefeld",
      "type": "Registerbekanntmachung nach dem Umwandlungsgesetz",
      "state": "Nordrhein-Westfalen",
      "amtsgericht": "Amtsgericht Bielefeld",
      "registernummer": "HRB 44081",
      "registerart": "HRB",
      "company_name": "Bechtle GmbH",
      "company_seat": "Bielefeld",
      "details": "03.06.2025 (Bekanntmachungsdatum)\n\nNordrhein-Westfalen Amtsgericht Bielefeld HRB 44081\nRegisterbekanntmachung nach dem Umwandlungsgesetz 03.06.2025 (Eintragungsdatum)\n\nBechtle GmbH\nGesellschaft mit beschränkter Haftung\nBielefeld\n\nDen Gläubigern der an der Verschmelzung beteiligten Rechtsträger ist, wenn sie binnen sechs Monaten nach dem Tag, an dem die Eintragung der Verschmelzung in das Register des Sitzes desjenigen Rechtsträgers, dessen Gläubiger sie sind, nach § 19 Absatz 3 UmwG als bekanntgemacht gilt, ihren Anspruch nach Grund und Höhe schriftlich anmelden, Sicherheit zu leisten, soweit sie nicht Befriedigung verlangen können. Dieses Recht steht den Gläubigern jedoch nur zu, wenn sie glaubhaft machen, dass durch die Verschmelzung die Erfüllung ihrer Forderung gefährdet wird."
    },
    {
      "date": "2025-06-03",
      "id": "111048",
      "original_text": "Registerbekanntmachung nach dem Umwandlungsgesetz\nNordrhein-Westfalen Amtsgericht Siegburg GsR 264\nNestler-Hauptmann eGbR – Hennef (Sieg)",
      "type": "Registerbekanntmachung nach dem Umwandlungsgesetz",
      "state": "Nordrhein-Westfalen",
      "amtsgericht": "Amtsgericht Siegburg",
      "registernummer": "GsR 264",
      "registerart": "GsR",
      "company_name": "Nestler-Hauptmann eGbR",
      "company_seat": "Hennef (Sieg)",
      "details": "03.06.2025 (Bekanntmachungsdatum)\n\nNordrhein-Westfalen Amtsgericht Siegburg GsR 264\nRegisterbekanntmachung nach dem Umwandlungsgesetz 03.06.2025 (Eintragungsdatum)\n\nNestler-Hauptmann eGbR\nGesellschaft bürgerlichen Rechts\nHennef (Sieg)\n\nDen Gläubigern der an der Verschmelzung beteiligten Rechtsträger ist, wenn sie binnen sechs Monaten nach dem Tag, an dem die Eintragung der Verschmelzung in das Register des Sitzes desjenigen Rechtsträgers, dessen Gläubiger sie sind, nach § 19 Absatz 3 UmwG als bekanntgemacht gilt, ihren Anspruch nach Grund und Höhe schriftlich anmelden, Sicherheit zu leisten, soweit sie nicht Befriedigung verlangen können. Dieses Recht steht den Gläubigern jedoch nur zu, wenn sie glaubhaft machen, dass durch die Verschmelzung die Erfüllung ihrer Forderung gefährdet wird."
    },
    {
      "date": "2025-06-03",
      "id": "111049",
      "original_text": "Einreichung neuer Dokumente\nRheinland-Pfalz Amtsgericht Koblenz HRB 3929\nTZK - TechnologieZentrum Koblenz GmbH – Koblenz",
      "type": "Einreichung neuer Dokumente",
      "state": "Rheinland-Pfalz",
      "amtsgericht": "Amtsgericht Koblenz",
      "registernummer": "HRB 3929",
      "registerart": "HRB",
      "company_name": "TZK - TechnologieZentrum Koblenz GmbH",
      "company_seat": "Koblenz",
      "details": "03.06.2025 (Bekanntmachungsdatum)\n\nRheinland-Pfalz Amtsgericht Koblenz HRB 3929\nEinreichung neuer Dokumente 03.06.2025 (Eintragungsdatum)\n\nTZK - TechnologieZentrum Koblenz GmbH\nGesellschaft mit beschränkter Haftung\nKoblenz\n\nDem Registergericht ist eine neue Liste der Mitglieder des Aufsichtsrates eingereicht worden."
    },
    {
      "date": "2025-06-03",
      "id": "111050",
      "original_text": "Einreichung neuer Dokumente\nNordrhein-Westfalen Amtsgericht Bielefeld HRB 30169\nEvangelisches Klinikum Bethel gGmbH – Bielefeld",
      "type": "Einreichung neuer Dokumente",
      "state": "Nordrhein-Westfalen",
      "amtsgericht": "Amtsgericht Bielefeld",
      "registernummer": "HRB 30169",
      "registerart": "HRB",
      "company_name": "Evangelisches Klinikum Bethel gGmbH",
      "company_seat": "Bielefeld",
      "details": "03.06.2025 (Bekanntmachungsdatum)\n\nNordrhein-Westfalen Amtsgericht Bielefeld HRB 30169\nEinreichung neuer Dokumente 03.06.2025 (Eintragungsdatum)\n\nEvangelisches Klinikum Bethel gGmbH\nGesellschaft mit beschränkter Haftung\nBielefeld\n\nDem Registergericht ist eine neue Liste der Mitglieder des Aufsichtsrates eingereicht worden."
    },
    {
      "date": "2025-06-03",
      "id": "111051",
      "original_text": "Löschungsankündigung\nNordrhein-Westfalen Amtsgericht Wuppertal HRB 30060\nWA Komplettausbau GmbH – Velbert",
      "type": "Löschungsankündigung",
      "state": "Nordrhein-Westfalen",
      "amtsgericht": "Amtsgericht Wuppertal",
      "registernummer": "HRB 30060",
      "registerart": "HRB",
      "company_name": "WA Komplettausbau GmbH",
      "company_seat": "Velbert",
      "details": "03.06.2025 (Bekanntmachungsdatum)\n\nNordrhein-Westfalen Amtsgericht Wuppertal HRB 30060\nLöschungsankündigung\n\nWA Komplettausbau GmbH\nGesellschaft mit beschränkter Haftung\nVelbert\n\nDas Registergericht beabsichtigt die Gesellschaft von Amts wegen nach § 394 FamFG zu löschen. Die Frist zur Erhebung eines Widerspruchs ist auf einen Monat festgesetzt."
    },
    {
      "date": "2025-06-03",
      "id": "111052",
      "original_text": "Einreichung neuer Dokumente\nNordrhein-Westfalen Amtsgericht Duisburg HRB 105\nGrillo-Werke Aktiengesellschaft – Duisburg",
      "type": "Einreichung neuer Dokumente",
      "state": "Nordrhein-Westfalen",
      "amtsgericht": "Amtsgericht Duisburg",
      "registernummer": "HRB 105",
      "registerart": "HRB",
      "company_name": "Grillo-Werke Aktiengesellschaft",
      "company_seat": "Duisburg",
      "details": "03.06.2025 (Bekanntmachungsdatum)\n\nNordrhein-Westfalen Amtsgericht Duisburg HRB 105\nEinreichung neuer Dokumente\n\nGrillo-Werke Aktiengesellschaft\nAktiengesellschaft\nDuisburg\n\nDem Registergericht ist eine neue Liste der Mitglieder des Aufsichtsrates eingereicht worden."
    },
    {
      "date": "2025-06-03",
      "id": "111053",
      "original_text": "Löschungsankündigung\nNordrhein-Westfalen Amtsgericht Wuppertal HRB 32576\nPaulina B GmbH – Erkrath",
      "type": "Löschungsankündigung",
      "state": "Nordrhein-Westfalen",
      "amtsgericht": "Amtsgericht Wuppertal",
      "registernummer": "HRB 32576",
      "registerart": "HRB",
      "company_name": "Paulina B GmbH",
      "company_seat": "Erkrath",
      "details": "03.06.2025 (Bekanntmachungsdatum)\n\nNordrhein-Westfalen Amtsgericht Wuppertal HRB 32576\nLöschungsankündigung\n\nPaulina B GmbH\nGesellschaft mit beschränkter Haftung\nErkrath\n\nDas Registergericht beabsichtigt die Gesellschaft von Amts wegen nach § 394 FamFG zu löschen. Die Frist zur Erhebung eines Widerspruchs ist auf einen Monat festgesetzt."
    },
    {
      "date": "2025-06-03",
      "id": "111054",
      "original_text": "Registerbekanntmachung nach dem Umwandlungsgesetz\nNordrhein-Westfalen Amtsgericht Duisburg HRB 37302\nKE Immobilien UG (haftungsbeschränkt) – Voerde",
      "type": "Registerbekanntmachung nach dem Umwandlungsgesetz",
      "state": "Nordrhein-Westfalen",
      "amtsgericht": "Amtsgericht Duisburg",
      "registernummer": "HRB 37302",
      "registerart": "HRB",
      "company_name": "KE Immobilien UG (haftungsbeschränkt)",
      "company_seat": "Voerde",
      "details": "03.06.2025 (Bekanntmachungsdatum)\n\nNordrhein-Westfalen Amtsgericht Duisburg HRB 37302\nRegisterbekanntmachung nach dem Umwandlungsgesetz 03.06.2025 (Eintragungsdatum)\n\nKE Immobilien UG (haftungsbeschränkt)\nGesellschaft mit beschränkter Haftung\nVoerde\n\nDie Gesellschaft hat Gläubigern, deren Forderungen vor dieser Bekanntmachung begründet worden sind, Sicherheit zu leisten, soweit sie nicht Befriedigung verlangen können, wenn sie sich binnen sechs Monaten zu diesem Zweck melden."
    },
    {
      "date": "2025-06-03",
      "id": "111055",
      "original_text": "Registerbekanntmachung nach dem Umwandlungsgesetz\nNordrhein-Westfalen Amtsgericht Duisburg HRA 13662\nKE Immobilien UG (haftungsbeschränkt) & Co. KG – Voerde",
      "type": "Registerbekanntmachung nach dem Umwandlungsgesetz",
      "state": "Nordrhein-Westfalen",
      "amtsgericht": "Amtsgericht Duisburg",
      "registernummer": "HRA 13662",
      "registerart": "HRA",
      "company_name": "KE Immobilien UG (haftungsbeschränkt) & Co. KG",
      "company_seat": "Voerde",
      "details": "03.06.2025 (Bekanntmachungsdatum)\n\nNordrhein-Westfalen Amtsgericht Duisburg HRA 13662\nRegisterbekanntmachung nach dem Umwandlungsgesetz 03.06.2025 (Eintragungsdatum)\n\nKE Immobilien UG (haftungsbeschränkt) & Co. KG\nKommanditgesellschaft\nVoerde\n\nDie Gesellschaft hat Gläubigern, deren Forderungen vor dieser Bekanntmachung begründet worden sind, Sicherheit zu leisten, soweit sie nicht Befriedigung verlangen können, wenn sie sich binnen sechs Monaten zu diesem Zweck melden."
    },
    {
      "date": "2025-06-03",
      "id": "111056",
      "original_text": "Einreichung neuer Dokumente\nNordrhein-Westfalen Amtsgericht Bielefeld HRB 39136\nKrankenhaus Mara gGmbH – Bielefeld",
      "type": "Einreichung neuer Dokumente",
      "state": "Nordrhein-Westfalen",
      "amtsgericht": "Amtsgericht Bielefeld",
      "registernummer": "HRB 39136",
      "registerart": "HRB",
      "company_name": "Krankenhaus Mara gGmbH",
      "company_seat": "Bielefeld",
      "details": "03.06.2025 (Bekanntmachungsdatum)\n\nNordrhein-Westfalen Amtsgericht Bielefeld HRB 39136\nEinreichung neuer Dokumente 03.06.2025 (Eintragungsdatum)\n\nKrankenhaus Mara gGmbH\nGesellschaft mit beschränkter Haftung\nBielefeld\n\nDem Registergericht ist eine neue Liste der Mitglieder des Aufsichtsrates eingereicht worden."
    },
    {
      "date": "2025-06-03",
      "id": "111057",
      "original_text": "Sonstige Registerbekanntmachung\nNordrhein-Westfalen Amtsgericht Düsseldorf HRA 27851\nPaxos Düsseldorf Goltstein19 SARL & Co. KG – Düsseldorf",
      "type": "Sonstige Registerbekanntmachung",
      "state": "Nordrhein-Westfalen",
      "amtsgericht": "Amtsgericht Düsseldorf",
      "registernummer": "HRA 27851",
      "registerart": "HRA",
      "company_name": "Paxos Düsseldorf Goltstein19 SARL & Co. KG",
      "company_seat": "Düsseldorf",
      "details": "03.06.2025 (Bekanntmachungsdatum)\n\nNordrhein-Westfalen Amtsgericht Düsseldorf HRA 27851\nSonstige Registerbekanntmachung 03.06.2025 (Eintragungsdatum)\n\nPaxos Düsseldorf Goltstein19 SARL & Co. KG\nKommanditgesellschaft\nDüsseldorf\n\nEs wird darauf hingewiesen, dass ein Entwurf des Formwechselplans vom 16.05.2025 über einen grenzüberschreitenden vollständigen Formwechsel der bisher binationalen Kommanditgesellschaft Paxos Düsseldorf Goldstein19 SARL & Co. KG mit Sitz in Düsseldorf (Amtsgericht Düsseldorf, HRA 27851  in die Paxos Düsseldorf Goldstein 19 SCS (société en commandite simple) mit Sitz in Luxemburg, Großherzogtum Luxemburg, (Registre de Commerce et des Sociétés de Luxembourg, B290722) beim Handelsregister eingereicht worden ist.\nDie Anteilsinhaber, die Gläubiger, sowie die zuständigen Betriebsräte der an dem grenzüberschreitenden Formwechsel beteiligten Gesellschaft oder, soweit es keinen Betriebsrat gibt, die Arbeitnehmer der an dem grenzüberschreitenden Formwechsel beteiligten Gesellschaft, können der Gesellschaft spätestens fünf Arbeitstage vor dem Tag der Gesellschafterversammlung Bemerkungen zum Formwechselplan übermitteln."
    },
    {
      "date": "2025-06-03",
      "id": "111058",
      "original_text": "Löschungsankündigung\nNordrhein-Westfalen Amtsgericht Wuppertal HRB 26363\nMetallschleiferei K&K UG (haftungsbeschränkt) – Wuppertal",
      "type": "Löschungsankündigung",
      "state": "Nordrhein-Westfalen",
      "amtsgericht": "Amtsgericht Wuppertal",
      "registernummer": "HRB 26363",
      "registerart": "HRB",
      "company_name": "Metallschleiferei K&K UG (haftungsbeschränkt)",
      "company_seat": "Wuppertal",
      "details": "03.06.2025 (Bekanntmachungsdatum)\n\nNordrhein-Westfalen Amtsgericht Wuppertal HRB 26363\nLöschungsankündigung\n\nMetallschleiferei K&K UG (haftungsbeschränkt)\nGesellschaft mit beschränkter Haftung\nWuppertal\n\nDas Registergericht beabsichtigt die Gesellschaft von Amts wegen nach § 394 FamFG zu löschen. Die Frist zur Erhebung eines Widerspruchs ist auf einen Monat festgesetzt."
    },
    {
      "date": "2025-06-03",
      "id": "111059",
      "original_text": "Löschungsankündigung\nNordrhein-Westfalen Amtsgericht Düsseldorf HRA 26359\nSKITA GmbH & Co. KG – Düsseldorf",
      "type": "Löschungsankündigung",
      "state": "Nordrhein-Westfalen",
      "amtsgericht": "Amtsgericht Düsseldorf",
      "registernummer": "HRA 26359",
      "registerart": "HRA",
      "company_name": "SKITA GmbH & Co. KG",
      "company_seat": "Düsseldorf",
      "details": "03.06.2025 (Bekanntmachungsdatum)\n\nNordrhein-Westfalen Amtsgericht Düsseldorf HRA 26359\nLöschungsankündigung\n\nSKITA GmbH & Co. KG\nKommanditgesellschaft\nDüsseldorf\n\nDas Registergericht beabsichtigt die Firma von Amts wegen nach § 31 Abs. 2 HGB zu löschen, da kein Gewerbe mehr betrieben wird. Die Frist zur Erhebung eines Widerspruchs ist auf drei Monate festgesetzt.\n\nRechtsbehelfsbelehrung:\nDas Widerspruchsrecht steht jedem zu, der an der Unterlassung der Löschung ein berechtigtes Interesse hat. Der Widerspruch ist bei dem Amtsgericht Düsseldorf -Registergericht-, Werdener Straße 1, 40227 Düsseldorf schriftlich in deutscher Sprache oder zur Niederschrift der Geschäftsstelle einzulegen. Der Widerspruch kann auch zur Niederschrift der Geschäftsstelle eines jeden Amtsgerichtes abgegeben werden. Die Einlegung ist auch durch Übertragung eines elektronischen Dokuments an die elektronische Poststelle des Gerichts möglich. Das elektronische Dokument muss für die Bearbeitung durch das Gericht geeignet und mit einer qualifizierten elektronischen Signatur der verantwortenden Person versehen sein oder von der verantwortenden Person signiert und auf einem sicheren Übermittlungsweg gemäß § 130a ZPO nach näherer Maßgabe der Verordnung über die technischen Rahmenbedingungen des elektronischen Rechtsverkehrs und über das besondere elektronische Behördenpostfach (BGBl. I, S.3803) eingereicht werden. Weitere Informationen erhalten Sie auf der Internetseite www.justiz.de.\nDer Widerspruch muss spätestens innerhalb der gesetzten Frist nach dem Datum der Bekanntmachung der Löschungsankündigung bei dem Amtsgericht - Registergericht - Düsseldorf eingegangen sein.  Dies gilt auch dann, wenn der Widerspruch zur Niederschrift der Geschäftsstelle eines anderen Amtsgerichtes abgegeben wurde. Die Frist beginnt mit dem Tage der Bekanntmachung der Löschungsankündigung in dem für die Bekanntmachung der Eintragungen in das Handelsregister bestimmten elektronischen Informations- und Kommunikationssystem nach § 10 des Handelsgesetzbuches. Fällt das Ende der Frist auf einen Sonntag, einen allgemeinen Feiertag oder Sonnabend, so endet die Frist mit Ablauf des nächsten Werktages.\nDer Widerspruch muss die Bezeichnung der angefochtenen Löschungsankündigung sowie die Erklärung enthalten, dass Widerspruch gegen diese Löschungsankündigung eingelegt wird. Er ist zu unterzeichnen und soll begründet werden."
    },
    {
      "date": "2025-06-03",
      "id": "111060",
      "original_text": "Registerbekanntmachung nach dem Umwandlungsgesetz\nNordrhein-Westfalen Amtsgericht Dortmund HRA 19863\nGökhan Akbal The Grey Hotel e.K. – Dortmund",
      "type": "Registerbekanntmachung nach dem Umwandlungsgesetz",
      "state": "Nordrhein-Westfalen",
      "amtsgericht": "Amtsgericht Dortmund",
      "registernummer": "HRA 19863",
      "registerart": "HRA",
      "company_name": "Gökhan Akbal The Grey Hotel e.K.",
      "company_seat": "Dortmund",
      "details": "03.06.2025 (Bekanntmachungsdatum)\n\nNordrhein-Westfalen Amtsgericht Dortmund HRA 19863\nRegisterbekanntmachung nach dem Umwandlungsgesetz 03.06.2025 (Eintragungsdatum)\n\nGökhan Akbal The Grey Hotel e.K.\nEinzelkaufmann / Einzelkauffrau\nDortmund\n\nDen Gläubigern der an der Ausgliederung beteiligten Rechtsträger ist, wenn sie binnen sechs Monaten nach dem Tag, an dem die Eintragung der Ausgliederung in das Register des Sitzes desjenigen Rechtsträgers, dessen Gläubiger sie sind, nach § 19 Absatz 3 UmwG als bekanntgemacht gilt, ihren Anspruch nach Grund und Höhe schriftlich anmelden, Sicherheit zu leisten, soweit sie nicht Befriedigung verlangen können. Dieses Recht steht den Gläubigern jedoch nur zu, wenn sie glaubhaft machen, dass durch die Ausgliederung die Erfüllung ihrer Forderung gefährdet wird."
    },
    {
      "date": "2025-06-03",
      "id": "111061",
      "original_text": "Einreichung neuer Dokumente\nNordrhein-Westfalen Amtsgericht Wuppertal HRB 21733\nZWILLING J. A. Henckels Aktiengesellschaft – Solingen",
      "type": "Einreichung neuer Dokumente",
      "state": "Nordrhein-Westfalen",
      "amtsgericht": "Amtsgericht Wuppertal",
      "registernummer": "HRB 21733",
      "registerart": "HRB",
      "company_name": "ZWILLING J. A. Henckels Aktiengesellschaft",
      "company_seat": "Solingen",
      "details": "03.06.2025 (Bekanntmachungsdatum)\n\nNordrhein-Westfalen Amtsgericht Wuppertal HRB 21733\nEinreichung neuer Dokumente 03.06.2025 (Eintragungsdatum)\n\nZWILLING J. A. Henckels Aktiengesellschaft\nAktiengesellschaft\nSolingen\n\nDem Registergericht ist eine neue Liste der Mitglieder des Aufsichtsrates eingereicht worden."
    },
    {
      "date": "2025-06-03",
      "id": "111062",
      "original_text": "Registerbekanntmachung nach dem Umwandlungsgesetz\nThüringen Amtsgericht Jena HRA 506843\nHP Meyersolar, Inh. Hans-Peter Meyer e.K. – Erfurt",
      "type": "Registerbekanntmachung nach dem Umwandlungsgesetz",
      "state": "Thüringen",
      "amtsgericht": "Amtsgericht Jena",
      "registernummer": "HRA 506843",
      "registerart": "HRA",
      "company_name": "HP Meyersolar, Inh. Hans-Peter Meyer e.K.",
      "company_seat": "Erfurt",
      "details": "03.06.2025 (Bekanntmachungsdatum)\n\nThüringen Amtsgericht Jena HRA 506843\nRegisterbekanntmachung nach dem Umwandlungsgesetz 03.06.2025 (Eintragungsdatum)\n\nHP Meyersolar, Inh. Hans-Peter Meyer e.K.\nEinzelkaufmann / Einzelkauffrau\nErfurt\n\nDas von dem Einzelkaufmann Meyer, Hans-Peter, Erfurt, *27.02.1953 unter der Firma HP Meyersolar, Inh. Hans-Peter Meyer e.K. mit dem Sitz in Erfurt betriebene Unternehmen ist aus dem Vermögen gemäß Ausgliederungsvertrag vom 17.02.2025 auf die Meyer Solar GmbH mit dem Sitz in Erfurt (Amtsgericht Jena HRB 522315) ausgegliedert.  Nicht eingetragen: Den Gläubigern der an der Ausgliederung beteiligten Rechtsträger, ist wenn sie binnen sechs Monaten nach dem Tag, an dem die Eintragung der Ausgliederung in das Register des Sitzes desjenigen Rechtsträgers, dessen Gläubiger sie sind, nach §§125, 19 Abs. 3 UmwG als bekanntgemacht gilt, ihren Anspruch nach Grund und Höhe schriftlich anmelden, Sicherheit zu leisten, soweit sie nicht Befriedigung verlangen können. Dieses Recht steht ihnen jedoch nur zu, wenn sie glaubhaft machen, daß durch die Ausgliederung die Erfüllung ihrer Forderung gefährdet wird.Die Firma ist erloschen. Von Amts wegen eingetragen aufgrund § 155 UmwG."
    },
    {
      "date": "2025-06-03",
      "id": "111063",
      "original_text": "Registerbekanntmachung nach dem Umwandlungsgesetz\nThüringen Amtsgericht Jena HRB 522315\nMeyer Solar GmbH – Erfurt",
      "type": "Registerbekanntmachung nach dem Umwandlungsgesetz",
      "state": "Thüringen",
      "amtsgericht": "Amtsgericht Jena",
      "registernummer": "HRB 522315",
      "registerart": "HRB",
      "company_name": "Meyer Solar GmbH",
      "company_seat": "Erfurt",
      "details": "03.06.2025 (Bekanntmachungsdatum)\n\nThüringen Amtsgericht Jena HRB 522315\nRegisterbekanntmachung nach dem Umwandlungsgesetz 03.06.2025 (Eintragungsdatum)\n\nMeyer Solar GmbH\nGesellschaft mit beschränkter Haftung\nErfurt\n\n5.000,00 EUR auf 30.000,00 EUR zum Zwecke der Ausgliederung aus dem Vermögen des Einzelkaufmanns betriebenen Unternehmens HP Meyersolar, Inh. Hans-Peter Meyer e.K. mit dem Sitz in Erfurt (Amtsgericht Jena HRA 506843) und die Änderung des § 3 (Stammkapital) des Gesellschaftsvertrages beschlossen.\nDie Gesellschaft hat im Wege der Ausgliederung gemäß Ausgliederungsvertrag vom 17.02.2025 sowie Beschluss ihrer Gesellschafterversammlung vom 17.02.2025 das Vermögen des als Einzelkaufmann betriebenen Unternehmens HP Meyersolar, Inh. Hans-Peter Meyer e.K. mit dem Sitz in Erfurt (Amtsgericht Jena HRA 506843) übernommen.\nDie Ausgliederung ist mit zeitgleicher Eintragung im Register des Sitzes des übertragenden Rechtsträgers wirksam geworden.\nNicht eingetragen: Den Gläubigern der an der Ausgliederung beteiligten Rechtsträger, ist wenn sie binnen sechs Monaten nach dem Tag, an dem die Eintragung der Ausgliederung in das Register des Sitzes desjenigen Rechtsträgers, dessen Gläubiger sie sind, nach §§125, 19 Abs. 3 UmwG als bekanntgemacht gilt, ihren Anspruch nach Grund und Höhe schriftlich anmelden, Sicherheit zu leisten, soweit sie nicht Befriedigung verlangen können. Dieses Recht steht ihnen jedoch nur zu, wenn sie glaubhaft machen, daß durch die Ausgliederung die Erfüllung ihrer Forderung gefährdet wird."
    },
    {
      "date": "2025-06-03",
      "id": "111064",
      "original_text": "Sonstige Registerbekanntmachung\nHessen Amtsgericht Kassel VR 1827\nHessisch-Waldeckischer Gebirgs- u. Heimatverein, Zweigverein Guntershausen/Guxhagen – Baunatal-Guntershausen",
      "type": "Sonstige Registerbekanntmachung",
      "state": "Hessen",
      "amtsgericht": "Amtsgericht Kassel",
      "registernummer": "VR 1827",
      "registerart": "VR",
      "company_name": "Hessisch-Waldeckischer Gebirgs- u. Heimatverein, Zweigverein Guntershausen/Guxhagen",
      "company_seat": "Baunatal-Guntershausen",
      "details": "03.06.2025 (Bekanntmachungsdatum)\n\nHessen Amtsgericht Kassel VR 1827\nSonstige Registerbekanntmachung 03.06.2025 (Eintragungsdatum)\n\nHessisch-Waldeckischer Gebirgs- u. Heimatverein, Zweigverein Guntershausen/Guxhagen\neingetragener Verein\nBaunatal-Guntershausen\n\nDer Verein ist aufgelöst."
    },
    {
      "date": "2025-06-03",
      "id": "111065",
      "original_text": "Einreichung neuer Dokumente\nHessen Amtsgericht Kassel HRB 14411\nVitos gemeinnützige GmbH – Kassel",
      "type": "Einreichung neuer Dokumente",
      "state": "Hessen",
      "amtsgericht": "Amtsgericht Kassel",
      "registernummer": "HRB 14411",
      "registerart": "HRB",
      "company_name": "Vitos gemeinnützige GmbH",
      "company_seat": "Kassel",
      "details": "03.06.2025 (Bekanntmachungsdatum)\n\nHessen Amtsgericht Kassel HRB 14411\nEinreichung neuer Dokumente 03.06.2025 (Eintragungsdatum)\n\nVitos gemeinnützige GmbH\nGesellschaft mit beschränkter Haftung\nKassel\n\nDurch eine Änderung in den Personen der Aufsichtsratsmitglieder ist eine Liste der Mitglieder des Aufsichtsrates zum Handelsregister eingereicht worden."
    },
    {
      "date": "2025-06-03",
      "id": "111066",
      "original_text": "Löschungsankündigung\nHessen Amtsgericht Offenbach am Main HRB 48195\nSGB Sbriscia Gastronomie-Betriebe GmbH – Rödermark",
      "type": "Löschungsankündigung",
      "state": "Hessen",
      "amtsgericht": "Amtsgericht Offenbach am Main",
      "registernummer": "HRB 48195",
      "registerart": "HRB",
      "company_name": "SGB Sbriscia Gastronomie-Betriebe GmbH",
      "company_seat": "Rödermark",
      "details": "03.06.2025 (Bekanntmachungsdatum)\n\nHessen Amtsgericht Offenbach am Main HRB 48195\nLöschungsankündigung\n\nSGB Sbriscia Gastronomie-Betriebe GmbH\nGesellschaft mit beschränkter Haftung\nRödermark\n\nDas Registergericht beabsichtigt die im Handelsregister eingetragene Gesellschaft von Amts wegen nach § 394 FamFG zu löschen. Die Frist zur Erhebung eines Widerspruchs gegen die beabsichtigte Löschung wird auf 3 Monate festgesetzt."
    },
    {
      "date": "2025-06-03",
      "id": "111067",
      "original_text": "Sonstige Registerbekanntmachung\nHessen Amtsgericht Fulda HRB 420\nKCL GmbH – Eichenzell",
      "type": "Sonstige Registerbekanntmachung",
      "state": "Hessen",
      "amtsgericht": "Amtsgericht Fulda",
      "registernummer": "HRB 420",
      "registerart": "HRB",
      "company_name": "KCL GmbH",
      "company_seat": "Eichenzell",
      "details": "03.06.2025 (Bekanntmachungsdatum)\n\nHessen Amtsgericht Fulda HRB 420\nSonstige Registerbekanntmachung 03.06.2025 (Eintragungsdatum)\n\nKCL GmbH\nGesellschaft mit beschränkter Haftung\nEichenzell\n\nDen Gläubigern der Gesellschaft, deren Forderungen begründet worden sind, bevor die Eintragung der Beendigung des Vertrags in das Handelsregister nach § 10 HGB bekannt gemacht worden ist, ist vom anderen Vertragsteil Sicherheit zu leisten, wenn sie sich binnen sechs Monaten nach dieser Bekanntmachung zu diesem Zweck bei ihm melden."
    },
    {
      "date": "2025-06-03",
      "id": "111068",
      "original_text": "Registerbekanntmachung nach dem Umwandlungsgesetz\nHessen Amtsgericht Wiesbaden HRB 34939\nM-Immo GmbH – Wiesbaden",
      "type": "Registerbekanntmachung nach dem Umwandlungsgesetz",
      "state": "Hessen",
      "amtsgericht": "Amtsgericht Wiesbaden",
      "registernummer": "HRB 34939",
      "registerart": "HRB",
      "company_name": "M-Immo GmbH",
      "company_seat": "Wiesbaden",
      "details": "03.06.2025 (Bekanntmachungsdatum)\n\nHessen Amtsgericht Wiesbaden HRB 34939\nRegisterbekanntmachung nach dem Umwandlungsgesetz 03.06.2025 (Eintragungsdatum)\n\nM-Immo GmbH\nGesellschaft mit beschränkter Haftung\nWiesbaden\n\nDen Gläubigern der an der Verschmelzung beteiligten Rechtsträger ist, wenn sie binnen sechs Monaten nach dem Tag, an dem die Eintragung der Verschmelzung in das Register des Sitzes desjenigen Rechtsträgers, dessen Gläubiger sie sind, nach § 19 Absatz 3 UmwG bekannt gemacht worden ist, ihren Anspruch nach Grund und Höhe schriftlich anmelden, Sicherheit zu leisten, soweit sie nicht Befriedigung verlangen können. Dieses Recht steht den Gläubigern jedoch nur zu, wenn sie glaubhaft machen, dass durch die Verschmelzung die Erfüllung ihrer Forderung gefährdet wird."
    },
    {
      "date": "2025-06-03",
      "id": "111069",
      "original_text": "Registerbekanntmachung nach dem Umwandlungsgesetz\nHessen Amtsgericht Wiesbaden HRB 30263\nG&V Grundstücks- und Verwaltungs- GmbH – Wiesbaden",
      "type": "Registerbekanntmachung nach dem Umwandlungsgesetz",
      "state": "Hessen",
      "amtsgericht": "Amtsgericht Wiesbaden",
      "registernummer": "HRB 30263",
      "registerart": "HRB",
      "company_name": "G&V Grundstücks- und Verwaltungs- GmbH",
      "company_seat": "Wiesbaden",
      "details": "03.06.2025 (Bekanntmachungsdatum)\n\nHessen Amtsgericht Wiesbaden HRB 30263\nRegisterbekanntmachung nach dem Umwandlungsgesetz 03.06.2025 (Eintragungsdatum)\n\nG&V Grundstücks- und Verwaltungs- GmbH\nGesellschaft mit beschränkter Haftung\nWiesbaden\n\nDen Gläubigern der an der Verschmelzung beteiligten Rechtsträger ist, wenn sie binnen sechs Monaten nach dem Tag, an dem die Eintragung der Verschmelzung in das Register des Sitzes desjenigen Rechtsträgers, dessen Gläubiger sie sind, nach § 19 Absatz 3 UmwG bekannt gemacht worden ist, ihren Anspruch nach Grund und Höhe schriftlich anmelden, Sicherheit zu leisten, soweit sie nicht Befriedigung verlangen können. Dieses Recht steht den Gläubigern jedoch nur zu, wenn sie glaubhaft machen, dass durch die Verschmelzung die Erfüllung ihrer Forderung gefährdet wird."
    },
    {
      "date": "2025-06-03",
      "id": "111070",
      "original_text": "Einreichung neuer Dokumente\nHessen Amtsgericht Frankfurt am Main HRB 123694\nK&K Holding AG – Frankfurt am Main",
      "type": "Einreichung neuer Dokumente",
      "state": "Hessen",
      "amtsgericht": "Amtsgericht Frankfurt am Main",
      "registernummer": "HRB 123694",
      "registerart": "HRB",
      "company_name": "K&K Holding AG",
      "company_seat": "Frankfurt am Main",
      "details": "03.06.2025 (Bekanntmachungsdatum)\n\nHessen Amtsgericht Frankfurt am Main HRB 123694\nEinreichung neuer Dokumente\n\nK&K Holding AG\nAktiengesellschaft\nFrankfurt am Main\n\nDurch eine Änderung in den Personen der Aufsichtsratsmitglieder ist eine Liste der Mitglieder des Aufsichtsrates zum Handelsregister eingereicht worden."
    },
    {
      "date": "2025-06-03",
      "id": "111071",
      "original_text": "Einreichung neuer Dokumente\nHessen Amtsgericht Frankfurt am Main HRB 45651\nDZ BANK AG Deutsche Zentral-Genossenschaftsbank, Frankfurt am Main – Frankfurt am Main",
      "type": "Einreichung neuer Dokumente",
      "state": "Hessen",
      "amtsgericht": "Amtsgericht Frankfurt am Main",
      "registernummer": "HRB 45651",
      "registerart": "HRB",
      "company_name": "DZ BANK AG Deutsche Zentral-Genossenschaftsbank, Frankfurt am Main",
      "company_seat": "Frankfurt am Main",
      "details": "03.06.2025 (Bekanntmachungsdatum)\n\nHessen Amtsgericht Frankfurt am Main HRB 45651\nEinreichung neuer Dokumente\n\nDZ BANK AG Deutsche Zentral-Genossenschaftsbank, Frankfurt am Main\nAktiengesellschaft\nFrankfurt am Main\n\nDurch eine Änderung in den Personen der Aufsichtsratsmitglieder ist eine Liste der Mitglieder des Aufsichtsrates zum Handelsregister eingereicht worden."
    },
    {
      "date": "2025-06-03",
      "id": "111072",
      "original_text": "Registerbekanntmachung nach dem Umwandlungsgesetz\nHessen Amtsgericht Wiesbaden HRB 30263\nG&V Grundstücks- und Verwaltungs- GmbH – Wiesbaden",
      "type": "Registerbekanntmachung nach dem Umwandlungsgesetz",
      "state": "Hessen",
      "amtsgericht": "Amtsgericht Wiesbaden",
      "registernummer": "HRB 30263",
      "registerart": "HRB",
      "company_name": "G&V Grundstücks- und Verwaltungs- GmbH",
      "company_seat": "Wiesbaden",
      "details": "03.06.2025 (Bekanntmachungsdatum)\n\nHessen Amtsgericht Wiesbaden HRB 30263\nRegisterbekanntmachung nach dem Umwandlungsgesetz 03.06.2025 (Eintragungsdatum)\n\nG&V Grundstücks- und Verwaltungs- GmbH\nGesellschaft mit beschränkter Haftung\nWiesbaden\n\nDen Gläubigern der an der Verschmelzung beteiligten Rechtsträger ist, wenn sie binnen sechs Monaten nach dem Tag, an dem die Eintragung der Verschmelzung in das Register des Sitzes desjenigen Rechtsträgers, dessen Gläubiger sie sind, nach § 19 Absatz 3 UmwG bekannt gemacht worden ist, ihren Anspruch nach Grund und Höhe schriftlich anmelden, Sicherheit zu leisten, soweit sie nicht Befriedigung verlangen können. Dieses Recht steht den Gläubigern jedoch nur zu, wenn sie glaubhaft machen, dass durch die Verschmelzung die Erfüllung ihrer Forderung gefährdet wird."
    },
    {
      "date": "2025-06-03",
      "id": "111073",
      "original_text": "Einreichung neuer Dokumente\nHessen Amtsgericht Bad Homburg v.d.H. HRB 1583\nAlte Leipziger Lebensversicherung auf Gegenseitigkeit – Oberursel (Taunus)",
      "type": "Einreichung neuer Dokumente",
      "state": "Hessen",
      "amtsgericht": "Amtsgericht Bad Homburg v.d.H.",
      "registernummer": "HRB 1583",
      "registerart": "HRB",
      "company_name": "Alte Leipziger Lebensversicherung auf Gegenseitigkeit",
      "company_seat": "Oberursel (Taunus)",
      "details": "03.06.2025 (Bekanntmachungsdatum)\n\nHessen Amtsgericht Bad Homburg v.d.H. HRB 1583\nEinreichung neuer Dokumente\n\nAlte Leipziger Lebensversicherung auf Gegenseitigkeit\nVersicherungsverein auf Gegenseitigkeit\nOberursel (Taunus)\n\nDurch eine Änderung in den Personen der Aufsichtsratsmitglieder ist eine Liste der Mitglieder des Aufsichtsrates zum Handelsregister eingereicht worden."
    },
    {
      "date": "2025-06-03",
      "id": "111074",
      "original_text": "Registerbekanntmachung nach dem Umwandlungsgesetz\nHessen Amtsgericht Frankfurt am Main HRA 54198\nCosmo Properties 4 (EST6) B.V. & Co. KG – Frankfurt am Main",
      "type": "Registerbekanntmachung nach dem Umwandlungsgesetz",
      "state": "Hessen",
      "amtsgericht": "Amtsgericht Frankfurt am Main",
      "registernummer": "HRA 54198",
      "registerart": "HRA",
      "company_name": "Cosmo Properties 4 (EST6) B.V. & Co. KG",
      "company_seat": "Frankfurt am Main",
      "details": "03.06.2025 (Bekanntmachungsdatum)\n\nHessen Amtsgericht Frankfurt am Main HRA 54198\nRegisterbekanntmachung nach dem Umwandlungsgesetz 03.06.2025 (Eintragungsdatum)\n\nCosmo Properties 4 (EST6) B.V. & Co. KG\nKommanditgesellschaft\nFrankfurt am Main\n\nDen Gläubigern der an der Ausgliederung beteiligten Rechtsträger ist, wenn sie binnen sechs Monaten nach dem Tag, an dem die Eintragung der Ausgliederung in das Register des Sitzes derjenigen Rechtsträger deren Gläubiger sie sind, nach §§ 125, 19 Absatz 3 UmwG bekannt gemacht worden ist, ihren Anspruch nach Grund und Höhe schriftlich anmelden, Sicherheit zu leisten, soweit sie nicht Befriedigung verlangen können. Dieses Recht steht den Gläubigern jedoch nur zu, wenn sie glaubhaft machen, dass durch die Ausgliederung die Erfüllung ihrer Forderung gefährdet wird."
    },
    {
      "date": "2025-06-03",
      "id": "111075",
      "original_text": "Löschungsankündigung\nHessen Amtsgericht Offenbach am Main HRA 40846\nUnguis Arts International GmbH & Co. KG – Heusenstamm",
      "type": "Löschungsankündigung",
      "state": "Hessen",
      "amtsgericht": "Amtsgericht Offenbach am Main",
      "registernummer": "HRA 40846",
      "registerart": "HRA",
      "company_name": "Unguis Arts International GmbH & Co. KG",
      "company_seat": "Heusenstamm",
      "details": "03.06.2025 (Bekanntmachungsdatum)\n\nHessen Amtsgericht Offenbach am Main HRA 40846\nLöschungsankündigung\n\nUnguis Arts International GmbH & Co. KG\nKommanditgesellschaft\nHeusenstamm\n\nDas Registergericht beabsichtigt die im Handelsregister eingetragene Firma von Amts wegen nach § 394 FamFG zu löschen. Die Frist zur Erhebung eines Widerspruchs gegen die beabsichtigte Löschung wird auf 3 Monate festgesetzt."
    },
    {
      "date": "2025-06-03",
      "id": "111076",
      "original_text": "Sonstige Registerbekanntmachung\nHessen Amtsgericht Frankfurt am Main HRB 52467\nSüwag Energie AG – Frankfurt am Main",
      "type": "Sonstige Registerbekanntmachung",
      "state": "Hessen",
      "amtsgericht": "Amtsgericht Frankfurt am Main",
      "registernummer": "HRB 52467",
      "registerart": "HRB",
      "company_name": "Süwag Energie AG",
      "company_seat": "Frankfurt am Main",
      "details": "03.06.2025 (Bekanntmachungsdatum)\n\nHessen Amtsgericht Frankfurt am Main HRB 52467\nSonstige Registerbekanntmachung 03.06.2025 (Eintragungsdatum)\n\nSüwag Energie AG\nAktiengesellschaft\nFrankfurt am Main\n\nDurch eine Änderung in den Personen der Aufsichtsratsmitglieder ist eine Liste der Mitglieder des Aufsichtsrates zum Handelsregister eingereicht worden."
    },
    {
      "date": "2025-06-03",
      "id": "111077",
      "original_text": "Löschungsankündigung\nHessen Amtsgericht Frankfurt am Main HRB 129861\nCA Global GmbH – Frankfurt am Main",
      "type": "Löschungsankündigung",
      "state": "Hessen",
      "amtsgericht": "Amtsgericht Frankfurt am Main",
      "registernummer": "HRB 129861",
      "registerart": "HRB",
      "company_name": "CA Global GmbH",
      "company_seat": "Frankfurt am Main",
      "details": "03.06.2025 (Bekanntmachungsdatum)\n\nHessen Amtsgericht Frankfurt am Main HRB 129861\nLöschungsankündigung\n\nCA Global GmbH\nGesellschaft mit beschränkter Haftung\nFrankfurt am Main\n\nEs ist beabsichtigt, die Gesellschaft wegen Vermögenslosigkeit gemäß § 394 FamFG von Amts wegen im Handelsregister zu löschen. Hiergegen kann innerhalb 3 Monaten nach dieser Veröffentlichung Widerspruch bei dem Amtsgericht Frankfurt am Main eingelegt werden."
    },
    {
      "date": "2025-06-03",
      "id": "111078",
      "original_text": "Löschungsankündigung\nHessen Amtsgericht Gießen HRB 35\nH.W. Rinn Hoch-, Tief- und Betonbau Gesellschaft mit beschränkter Haftung – Gießen",
      "type": "Löschungsankündigung",
      "state": "Hessen",
      "amtsgericht": "Amtsgericht Gießen",
      "registernummer": "HRB 35",
      "registerart": "HRB",
      "company_name": "H.W. Rinn Hoch-, Tief- und Betonbau Gesellschaft mit beschränkter Haftung",
      "company_seat": "Gießen",
      "details": "03.06.2025 (Bekanntmachungsdatum)\n\nHessen Amtsgericht Gießen HRB 35\nLöschungsankündigung\n\nH.W. Rinn Hoch-, Tief- und Betonbau Gesellschaft mit beschränkter Haftung\nGesellschaft mit beschränkter Haftung\nGießen\n\nAuf Antrag des Finanzamts ist beabsichtigt, die Gesellschaft wegen Vermögenslosigkeit gemäß § 394 FamFG von Amts wegen zu löschen. Hiergegen kann innerhalb von drei Monaten nach dieser Veröffentlichung Widerspruch beim Amtsgericht Gießen eingelegt werden. Sollte Widerspruch eingelegt werden, dürfte dies nur mit Begründung erfolgversprechend sein. Insbesondere sollte vorhandenes Vermögen der Gesellschaft innerhalb der genannten Frist nachgewiesen werden."
    }
  ]
}