{
  "date": "2025-06-14",
  "date_of_scrape": "2025-06-15T04:10:02.365Z",
  "tool_version": "0.2.0",
  "number_of_announcements": 30,
  "announcements": [
    {
      "date": "2025-06-14",
      "id": "112210",
      "original_text": "Löschungsankündigung\nBayern Amtsgericht München HRB 63073\nTAXCONTROL Treuhandgesellschaft Steuerberatungsgesellschaft mbH – München",
      "type": "Löschungsankündigung",
      "state": "Bayern",
      "amtsgericht": "Amtsgericht München",
      "registernummer": "HRB 63073",
      "registerart": "HRB",
      "company_name": "TAXCONTROL Treuhandgesellschaft Steuerberatungsgesellschaft mbH",
      "company_seat": "München",
      "details": "14.06.2025 (Bekanntmachungsdatum)\n\nBayern Amtsgericht München HRB 63073\nLöschungsankündigung\n\nTAXCONTROL Treuhandgesellschaft Steuerberatungsgesellschaft mbH\nGesellschaft mit beschränkter Haftung\nMünchen\n\nDas Registergericht beabsichtigt, die im Handelsregister eingetragene Firma von Amts wegen nach § 395 FamFG zu löschen. #insert(Text=\"zztb_V_Widerspruchsfrist\")"
    },
    {
      "date": "2025-06-14",
      "id": "112211",
      "original_text": "Registerbekanntmachung nach dem Umwandlungsgesetz\nBayern Amtsgericht München HRB 259744\nSAGEMÜLLER GmbH – Rottenbuch",
      "type": "Registerbekanntmachung nach dem Umwandlungsgesetz",
      "state": "Bayern",
      "amtsgericht": "Amtsgericht München",
      "registernummer": "HRB 259744",
      "registerart": "HRB",
      "company_name": "SAGEMÜLLER GmbH",
      "company_seat": "Rottenbuch",
      "details": "14.06.2025 (Bekanntmachungsdatum)\n\nBayern Amtsgericht München HRB 259744\nRegisterbekanntmachung nach dem Umwandlungsgesetz 13.06.2025 (Eintragungsdatum)\n\nSAGEMÜLLER GmbH\nGesellschaft mit beschränkter Haftung\nRottenbuch\n\nDen Gläubigern der an der Verschmelzung beteiligten Rechtsträger ist, wenn sie binnen sechs Monaten nach dem Tag, an dem die Eintragung der Verschmelzung in das Register des Sitzes desjenigen Rechtsträgers, dessen Gläubiger sie sind, nach § 19 Abs. 3 UmwG als bekannt gemacht gilt, ihren Anspruch nach Grund und Höhe in Textform anmelden, Sicherheit zu leisten, soweit sie nicht Befriedigung verlangen können. Dieses Recht steht den Gläubigern jedoch nur zu, wenn sie glaubhaft machen, dass durch die Verschmelzung die Erfüllung ihrer Forderung gefährdet wird."
    },
    {
      "date": "2025-06-14",
      "id": "112212",
      "original_text": "Löschungsankündigung\nBayern Amtsgericht München HRB 147574\nPR 10.181 Rossini Vermögensverwaltung GmbH – München",
      "type": "Löschungsankündigung",
      "state": "Bayern",
      "amtsgericht": "Amtsgericht München",
      "registernummer": "HRB 147574",
      "registerart": "HRB",
      "company_name": "PR 10.181 Rossini Vermögensverwaltung GmbH",
      "company_seat": "München",
      "details": "14.06.2025 (Bekanntmachungsdatum)\n\nBayern Amtsgericht München HRB 147574\nLöschungsankündigung\n\nPR 10.181 Rossini Vermögensverwaltung GmbH\nGesellschaft mit beschränkter Haftung\nMünchen\n\nDas Registergericht beabsichtigt, die im Handelsregister eingetragene Gesellschaft wegen Vermögenslosigkeit von Amts wegen nach § 394 FamFG zu löschen. Die Frist zur Erhebung eines Widerspruchs ist auf drei Monate festgesetzt."
    },
    {
      "date": "2025-06-14",
      "id": "112213",
      "original_text": "Registerbekanntmachung nach dem Umwandlungsgesetz\nBayern Amtsgericht München HRB 195285\nBayerisch Grund GmbH – München",
      "type": "Registerbekanntmachung nach dem Umwandlungsgesetz",
      "state": "Bayern",
      "amtsgericht": "Amtsgericht München",
      "registernummer": "HRB 195285",
      "registerart": "HRB",
      "company_name": "Bayerisch Grund GmbH",
      "company_seat": "München",
      "details": "14.06.2025 (Bekanntmachungsdatum)\n\nBayern Amtsgericht München HRB 195285\nRegisterbekanntmachung nach dem Umwandlungsgesetz 13.06.2025 (Eintragungsdatum)\n\nBayerisch Grund GmbH\nGesellschaft mit beschränkter Haftung\nMünchen\n\nDen Gläubigern der an der Verschmelzung beteiligten Rechtsträger ist, wenn sie binnen sechs Monaten nach dem Tag, an dem die Eintragung der Verschmelzung in das Register des Sitzes desjenigen Rechtsträgers, dessen Gläubiger sie sind, nach § 19 Abs. 3 UmwG als bekannt gemacht gilt, ihren Anspruch nach Grund und Höhe in Textform anmelden, Sicherheit zu leisten, soweit sie nicht Befriedigung verlangen können. Dieses Recht steht den Gläubigern jedoch nur zu, wenn sie glaubhaft machen, dass durch die Verschmelzung die Erfüllung ihrer Forderung gefährdet wird."
    },
    {
      "date": "2025-06-14",
      "id": "112214",
      "original_text": "Registerbekanntmachung nach dem Umwandlungsgesetz\nBayern Amtsgericht Würzburg HRB 15712\nALDI Helmstadt Verwaltungs-SE – Helmstadt",
      "type": "Registerbekanntmachung nach dem Umwandlungsgesetz",
      "state": "Bayern",
      "amtsgericht": "Amtsgericht Würzburg",
      "registernummer": "HRB 15712",
      "registerart": "HRB",
      "company_name": "ALDI Helmstadt Verwaltungs-SE",
      "company_seat": "Helmstadt",
      "details": "14.06.2025 (Bekanntmachungsdatum)\n\nBayern Amtsgericht Würzburg HRB 15712\nRegisterbekanntmachung nach dem Umwandlungsgesetz 13.06.2025 (Eintragungsdatum)\n\nALDI Helmstadt Verwaltungs-SE\nEuropäische Aktiengesellschaft (SE)\nHelmstadt\n\nDen Gläubigern der an der Verschmelzung beteiligten Rechtsträger ist, wenn sie binnen sechs Monaten nach dem Tag, an dem die Eintragung der Verschmelzung in das Register des Sitzes desjenigen Rechtsträgers, dessen Gläubiger sie sind, nach § 19 Abs. 3 UmwG als bekannt gemacht gilt, ihren Anspruch nach Grund und Höhe in Textform anmelden, Sicherheit zu leisten, soweit sie nicht Befriedigung verlangen können. Dieses Recht steht den Gläubigern jedoch nur zu, wenn sie glaubhaft machen, dass durch die Verschmelzung die Erfüllung ihrer Forderung gefährdet wird."
    },
    {
      "date": "2025-06-14",
      "id": "112215",
      "original_text": "Sonstige Registerbekanntmachung\nBayern Amtsgericht München HRB 101008\nUBS Real Estate GmbH – München",
      "type": "Sonstige Registerbekanntmachung",
      "state": "Bayern",
      "amtsgericht": "Amtsgericht München",
      "registernummer": "HRB 101008",
      "registerart": "HRB",
      "company_name": "UBS Real Estate GmbH",
      "company_seat": "München",
      "details": "14.06.2025 (Bekanntmachungsdatum)\n\nBayern Amtsgericht München HRB 101008\nSonstige Registerbekanntmachung\n\nUBS Real Estate GmbH\nGesellschaft mit beschränkter Haftung\nMünchen\n\nDem Amtsgericht München -Registergericht- ist eine Liste der Mitglieder des Aufsichtsrats eingereicht worden, § 52 Abs. 3 S. 2 GmbHG."
    },
    {
      "date": "2025-06-14",
      "id": "112216",
      "original_text": "Registerbekanntmachung nach dem Umwandlungsgesetz\nBayern Amtsgericht Nürnberg HRB 40714\nJobbiplace GmbH – Lauf a.d.Pegnitz",
      "type": "Registerbekanntmachung nach dem Umwandlungsgesetz",
      "state": "Bayern",
      "amtsgericht": "Amtsgericht Nürnberg",
      "registernummer": "HRB 40714",
      "registerart": "HRB",
      "company_name": "Jobbiplace GmbH",
      "company_seat": "Lauf a.d.Pegnitz",
      "details": "14.06.2025 (Bekanntmachungsdatum)\n\nBayern Amtsgericht Nürnberg HRB 40714\nRegisterbekanntmachung nach dem Umwandlungsgesetz 13.06.2025 (Eintragungsdatum)\n\nJobbiplace GmbH\nGesellschaft mit beschränkter Haftung\nLauf a.d.Pegnitz\n\nDen Gläubigern der an der Verschmelzung beteiligten Rechtsträger ist, wenn sie binnen sechs Monaten nach dem Tag, an dem die Eintragung der Verschmelzung in das Register des Sitzes desjenigen Rechtsträgers, dessen Gläubiger sie sind, nach § 19 Abs. 3 UmwG als bekannt gemacht gilt, ihren Anspruch nach Grund und Höhe in Textform anmelden, Sicherheit zu leisten, soweit sie nicht Befriedigung verlangen können. Dieses Recht steht den Gläubigern jedoch nur zu, wenn sie glaubhaft machen, dass durch die Verschmelzung die Erfüllung ihrer Forderung gefährdet wird."
    },
    {
      "date": "2025-06-14",
      "id": "112217",
      "original_text": "Registerbekanntmachung nach dem Umwandlungsgesetz\nBayern Amtsgericht München HRB 206219\nAutohaus Gromes GmbH – Wartenberg",
      "type": "Registerbekanntmachung nach dem Umwandlungsgesetz",
      "state": "Bayern",
      "amtsgericht": "Amtsgericht München",
      "registernummer": "HRB 206219",
      "registerart": "HRB",
      "company_name": "Autohaus Gromes GmbH",
      "company_seat": "Wartenberg",
      "details": "14.06.2025 (Bekanntmachungsdatum)\n\nBayern Amtsgericht München HRB 206219\nRegisterbekanntmachung nach dem Umwandlungsgesetz 13.06.2025 (Eintragungsdatum)\n\nAutohaus Gromes GmbH\nGesellschaft mit beschränkter Haftung\nWartenberg\n\nDen Gläubigern der an der Verschmelzung beteiligten Rechtsträger ist, wenn sie binnen sechs Monaten nach dem Tag, an dem die Eintragung der Verschmelzung in das Register des Sitzes desjenigen Rechtsträgers, dessen Gläubiger sie sind, nach § 19 Abs. 3 UmwG als bekannt gemacht gilt, ihren Anspruch nach Grund und Höhe in Textform anmelden, Sicherheit zu leisten, soweit sie nicht Befriedigung verlangen können. Dieses Recht steht den Gläubigern jedoch nur zu, wenn sie glaubhaft machen, dass durch die Verschmelzung die Erfüllung ihrer Forderung gefährdet wird."
    },
    {
      "date": "2025-06-14",
      "id": "112218",
      "original_text": "Registerbekanntmachung nach dem Umwandlungsgesetz\nBayern Amtsgericht Nürnberg HRB 31438\nFriedrich Hofmann Betriebsgesellschaft mbH – Büchenbach",
      "type": "Registerbekanntmachung nach dem Umwandlungsgesetz",
      "state": "Bayern",
      "amtsgericht": "Amtsgericht Nürnberg",
      "registernummer": "HRB 31438",
      "registerart": "HRB",
      "company_name": "Friedrich Hofmann Betriebsgesellschaft mbH",
      "company_seat": "Büchenbach",
      "details": "14.06.2025 (Bekanntmachungsdatum)\n\nBayern Amtsgericht Nürnberg HRB 31438\nRegisterbekanntmachung nach dem Umwandlungsgesetz 13.06.2025 (Eintragungsdatum)\n\nFriedrich Hofmann Betriebsgesellschaft mbH\nGesellschaft mit beschränkter Haftung\nBüchenbach\n\nDen Gläubigern der an der Verschmelzung beteiligten Rechtsträger ist, wenn sie binnen sechs Monaten nach dem Tag, an dem die Eintragung der Verschmelzung in das Register des Sitzes desjenigen Rechtsträgers, dessen Gläubiger sie sind, nach § 19 Abs. 3 UmwG als bekannt gemacht gilt, ihren Anspruch nach Grund und Höhe in Textform anmelden, Sicherheit zu leisten, soweit sie nicht Befriedigung verlangen können. Dieses Recht steht den Gläubigern jedoch nur zu, wenn sie glaubhaft machen, dass durch die Verschmelzung die Erfüllung ihrer Forderung gefährdet wird."
    },
    {
      "date": "2025-06-14",
      "id": "112219",
      "original_text": "Registerbekanntmachung nach dem Umwandlungsgesetz\nBayern Amtsgericht Regensburg HRB 15220\nSemmler Verwaltungs GmbH – Hemau",
      "type": "Registerbekanntmachung nach dem Umwandlungsgesetz",
      "state": "Bayern",
      "amtsgericht": "Amtsgericht Regensburg",
      "registernummer": "HRB 15220",
      "registerart": "HRB",
      "company_name": "Semmler Verwaltungs GmbH",
      "company_seat": "Hemau",
      "details": "14.06.2025 (Bekanntmachungsdatum)\n\nBayern Amtsgericht Regensburg HRB 15220\nRegisterbekanntmachung nach dem Umwandlungsgesetz 13.06.2025 (Eintragungsdatum)\n\nSemmler Verwaltungs GmbH\nGesellschaft mit beschränkter Haftung\nHemau\n\nDen Gläubigern der an der Verschmelzung beteiligten Rechtsträger ist, wenn sie binnen sechs Monaten nach dem Tag, an dem die Eintragung der Verschmelzung in das Register des Sitzes desjenigen Rechtsträgers, dessen Gläubiger sie sind, nach § 19 Abs. 3 UmwG als bekannt gemacht gilt, ihren Anspruch nach Grund und Höhe in Textform anmelden, Sicherheit zu leisten, soweit sie nicht Befriedigung verlangen können. Dieses Recht steht den Gläubigern jedoch nur zu, wenn sie glaubhaft machen, dass durch die Verschmelzung die Erfüllung ihrer Forderung gefährdet wird."
    },
    {
      "date": "2025-06-14",
      "id": "112220",
      "original_text": "Registerbekanntmachung nach dem Umwandlungsgesetz\nBayern Amtsgericht Regensburg HRB 9851\nHWZ Handwerkerzentrum GmbH – Hemau",
      "type": "Registerbekanntmachung nach dem Umwandlungsgesetz",
      "state": "Bayern",
      "amtsgericht": "Amtsgericht Regensburg",
      "registernummer": "HRB 9851",
      "registerart": "HRB",
      "company_name": "HWZ Handwerkerzentrum GmbH",
      "company_seat": "Hemau",
      "details": "14.06.2025 (Bekanntmachungsdatum)\n\nBayern Amtsgericht Regensburg HRB 9851\nRegisterbekanntmachung nach dem Umwandlungsgesetz 13.06.2025 (Eintragungsdatum)\n\nHWZ Handwerkerzentrum GmbH\nGesellschaft mit beschränkter Haftung\nHemau\n\nDen Gläubigern der an der Verschmelzung beteiligten Rechtsträger ist, wenn sie binnen sechs Monaten nach dem Tag, an dem die Eintragung der Verschmelzung in das Register des Sitzes desjenigen Rechtsträgers, dessen Gläubiger sie sind, nach § 19 Abs. 3 UmwG als bekannt gemacht gilt, ihren Anspruch nach Grund und Höhe in Textform anmelden, Sicherheit zu leisten, soweit sie nicht Befriedigung verlangen können. Dieses Recht steht den Gläubigern jedoch nur zu, wenn sie glaubhaft machen, dass durch die Verschmelzung die Erfüllung ihrer Forderung gefährdet wird."
    },
    {
      "date": "2025-06-14",
      "id": "112221",
      "original_text": "Registerbekanntmachung nach dem Umwandlungsgesetz\nBayern Amtsgericht München HRB 269339\nCBT Bonn MVZ GmbH – München",
      "type": "Registerbekanntmachung nach dem Umwandlungsgesetz",
      "state": "Bayern",
      "amtsgericht": "Amtsgericht München",
      "registernummer": "HRB 269339",
      "registerart": "HRB",
      "company_name": "CBT Bonn MVZ GmbH",
      "company_seat": "München",
      "details": "14.06.2025 (Bekanntmachungsdatum)\n\nBayern Amtsgericht München HRB 269339\nRegisterbekanntmachung nach dem Umwandlungsgesetz 13.06.2025 (Eintragungsdatum)\n\nCBT Bonn MVZ GmbH\nGesellschaft mit beschränkter Haftung\nMünchen\n\nDen Gläubigern der an der Verschmelzung beteiligten Rechtsträger ist, wenn sie binnen sechs Monaten nach dem Tag, an dem die Eintragung der Verschmelzung in das Register des Sitzes desjenigen Rechtsträgers, dessen Gläubiger sie sind, nach § 19 Abs. 3 UmwG als bekannt gemacht gilt, ihren Anspruch nach Grund und Höhe in Textform anmelden, Sicherheit zu leisten, soweit sie nicht Befriedigung verlangen können. Dieses Recht steht den Gläubigern jedoch nur zu, wenn sie glaubhaft machen, dass durch die Verschmelzung die Erfüllung ihrer Forderung gefährdet wird."
    },
    {
      "date": "2025-06-14",
      "id": "112222",
      "original_text": "Registerbekanntmachung nach dem Umwandlungsgesetz\nBayern Amtsgericht München HRB 300235\nCBT - Allgemeinmedizinische hausärtzliche Versorgug (AHV) MVZ-GmbH – München",
      "type": "Registerbekanntmachung nach dem Umwandlungsgesetz",
      "state": "Bayern",
      "amtsgericht": "Amtsgericht München",
      "registernummer": "HRB 300235",
      "registerart": "HRB",
      "company_name": "CBT - Allgemeinmedizinische hausärtzliche Versorgug (AHV) MVZ-GmbH",
      "company_seat": "München",
      "details": "14.06.2025 (Bekanntmachungsdatum)\n\nBayern Amtsgericht München HRB 300235\nRegisterbekanntmachung nach dem Umwandlungsgesetz 13.06.2025 (Eintragungsdatum)\n\nCBT - Allgemeinmedizinische hausärtzliche Versorgug (AHV) MVZ-GmbH\nGesellschaft mit beschränkter Haftung\nMünchen\n\nDen Gläubigern der an der Verschmelzung beteiligten Rechtsträger ist, wenn sie binnen sechs Monaten nach dem Tag, an dem die Eintragung der Verschmelzung in das Register des Sitzes desjenigen Rechtsträgers, dessen Gläubiger sie sind, nach § 19 Abs. 3 UmwG als bekannt gemacht gilt, ihren Anspruch nach Grund und Höhe in Textform anmelden, Sicherheit zu leisten, soweit sie nicht Befriedigung verlangen können. Dieses Recht steht den Gläubigern jedoch nur zu, wenn sie glaubhaft machen, dass durch die Verschmelzung die Erfüllung ihrer Forderung gefährdet wird."
    },
    {
      "date": "2025-06-14",
      "id": "112223",
      "original_text": "Registerbekanntmachung nach dem Umwandlungsgesetz\nBayern Amtsgericht Nürnberg HRB 38752\nHydrogen Now GmbH – Lauf a.d.Pegnitz",
      "type": "Registerbekanntmachung nach dem Umwandlungsgesetz",
      "state": "Bayern",
      "amtsgericht": "Amtsgericht Nürnberg",
      "registernummer": "HRB 38752",
      "registerart": "HRB",
      "company_name": "Hydrogen Now GmbH",
      "company_seat": "Lauf a.d.Pegnitz",
      "details": "14.06.2025 (Bekanntmachungsdatum)\n\nBayern Amtsgericht Nürnberg HRB 38752\nRegisterbekanntmachung nach dem Umwandlungsgesetz 13.06.2025 (Eintragungsdatum)\n\nHydrogen Now GmbH\nGesellschaft mit beschränkter Haftung\nLauf a.d.Pegnitz\n\nDen Gläubigern der an der Verschmelzung beteiligten Rechtsträger ist, wenn sie binnen sechs Monaten nach dem Tag, an dem die Eintragung der Verschmelzung in das Register des Sitzes desjenigen Rechtsträgers, dessen Gläubiger sie sind, nach § 19 Abs. 3 UmwG als bekannt gemacht gilt, ihren Anspruch nach Grund und Höhe in Textform anmelden, Sicherheit zu leisten, soweit sie nicht Befriedigung verlangen können. Dieses Recht steht den Gläubigern jedoch nur zu, wenn sie glaubhaft machen, dass durch die Verschmelzung die Erfüllung ihrer Forderung gefährdet wird."
    },
    {
      "date": "2025-06-14",
      "id": "112224",
      "original_text": "Registerbekanntmachung nach dem Umwandlungsgesetz\nBayern Amtsgericht München HRB 295176\nMy Cantine UG (haftungsbeschränkt) – München",
      "type": "Registerbekanntmachung nach dem Umwandlungsgesetz",
      "state": "Bayern",
      "amtsgericht": "Amtsgericht München",
      "registernummer": "HRB 295176",
      "registerart": "HRB",
      "company_name": "My Cantine UG (haftungsbeschränkt)",
      "company_seat": "München",
      "details": "14.06.2025 (Bekanntmachungsdatum)\n\nBayern Amtsgericht München HRB 295176\nRegisterbekanntmachung nach dem Umwandlungsgesetz 13.06.2025 (Eintragungsdatum)\n\nMy Cantine UG (haftungsbeschränkt)\nGesellschaft mit beschränkter Haftung\nMünchen\n\nDen Gläubigern der an der Verschmelzung beteiligten Rechtsträger ist, wenn sie binnen sechs Monaten nach dem Tag, an dem die Eintragung der Verschmelzung in das Register des Sitzes desjenigen Rechtsträgers, dessen Gläubiger sie sind, nach § 19 Abs. 3 UmwG als bekannt gemacht gilt, ihren Anspruch nach Grund und Höhe in Textform anmelden, Sicherheit zu leisten, soweit sie nicht Befriedigung verlangen können. Dieses Recht steht den Gläubigern jedoch nur zu, wenn sie glaubhaft machen, dass durch die Verschmelzung die Erfüllung ihrer Forderung gefährdet wird."
    },
    {
      "date": "2025-06-14",
      "id": "112225",
      "original_text": "Einreichung neuer Dokumente\nBayern Amtsgericht München HRB 269592\nITM Isotope Technologies Munich SE – Garching b.München",
      "type": "Einreichung neuer Dokumente",
      "state": "Bayern",
      "amtsgericht": "Amtsgericht München",
      "registernummer": "HRB 269592",
      "registerart": "HRB",
      "company_name": "ITM Isotope Technologies Munich SE",
      "company_seat": "Garching b.München",
      "details": "14.06.2025 (Bekanntmachungsdatum)\n\nBayern Amtsgericht München HRB 269592\nEinreichung neuer Dokumente\n\nITM Isotope Technologies Munich SE\nEuropäische Aktiengesellschaft (SE)\nGarching b.München\n\nDem #Re.Name ist eine Liste der Mitglieder des Aufsichtsrats eingereicht worden, Art. 9 Abs. 1 Buchst. c (ii) SE-VO i.V.m. § 106 AktG."
    },
    {
      "date": "2025-06-14",
      "id": "112226",
      "original_text": "Sonstige Registerbekanntmachung\nBayern Amtsgericht München HRB 165390\nReverse Logistics GmbH – Aschheim, Ortsteil Dornach",
      "type": "Sonstige Registerbekanntmachung",
      "state": "Bayern",
      "amtsgericht": "Amtsgericht München",
      "registernummer": "HRB 165390",
      "registerart": "HRB",
      "company_name": "Reverse Logistics GmbH",
      "company_seat": "Aschheim, Ortsteil Dornach",
      "details": "14.06.2025 (Bekanntmachungsdatum)\n\nBayern Amtsgericht München HRB 165390\nSonstige Registerbekanntmachung 13.06.2025 (Eintragungsdatum)\n\nReverse Logistics GmbH\nGesellschaft mit beschränkter Haftung\nAschheim, Ortsteil Dornach\n\nDen Gläubigern der an der Verschmelzung beteiligten Rechtsträger ist, wenn sie binnen sechs Monaten nach dem Tag, an dem die Eintragung der Verschmelzung in das Register des Sitzes desjenigen Rechtsträgers, dessen Gläubiger sie sind, nach § 19 Abs. 3 UmwG als bekannt gemacht gilt, ihren Anspruch nach Grund und Höhe in Textform anmelden, Sicherheit zu leisten, soweit sie nicht Befriedigung verlangen können. Dieses Recht steht den Gläubigern jedoch nur zu, wenn sie glaubhaft machen, dass durch die Verschmelzung die Erfüllung ihrer Forderung gefährdet wird."
    },
    {
      "date": "2025-06-14",
      "id": "112227",
      "original_text": "Registerbekanntmachung nach dem Umwandlungsgesetz\nBayern Amtsgericht München HRB 287483\nMahmud Gastronomie GmbH – Garmisch-Partenkirchen",
      "type": "Registerbekanntmachung nach dem Umwandlungsgesetz",
      "state": "Bayern",
      "amtsgericht": "Amtsgericht München",
      "registernummer": "HRB 287483",
      "registerart": "HRB",
      "company_name": "Mahmud Gastronomie GmbH",
      "company_seat": "Garmisch-Partenkirchen",
      "details": "14.06.2025 (Bekanntmachungsdatum)\n\nBayern Amtsgericht München HRB 287483\nRegisterbekanntmachung nach dem Umwandlungsgesetz 13.06.2025 (Eintragungsdatum)\n\nMahmud Gastronomie GmbH\nGesellschaft mit beschränkter Haftung\nGarmisch-Partenkirchen\n\nDen Gläubigern der an der Verschmelzung beteiligten Rechtsträger ist, wenn sie binnen sechs Monaten nach dem Tag, an dem die Eintragung der Verschmelzung in das Register des Sitzes desjenigen Rechtsträgers, dessen Gläubiger sie sind, nach § 19 Abs. 3 UmwG als bekannt gemacht gilt, ihren Anspruch nach Grund und Höhe in Textform anmelden, Sicherheit zu leisten, soweit sie nicht Befriedigung verlangen können. Dieses Recht steht den Gläubigern jedoch nur zu, wenn sie glaubhaft machen, dass durch die Verschmelzung die Erfüllung ihrer Forderung gefährdet wird."
    },
    {
      "date": "2025-06-14",
      "id": "112228",
      "original_text": "Registerbekanntmachung nach dem Umwandlungsgesetz\nBayern Amtsgericht München HRA 109791\nPlato Life Management & Service GmbH & Co. KG – Grünwald",
      "type": "Registerbekanntmachung nach dem Umwandlungsgesetz",
      "state": "Bayern",
      "amtsgericht": "Amtsgericht München",
      "registernummer": "HRA 109791",
      "registerart": "HRA",
      "company_name": "Plato Life Management & Service GmbH & Co. KG",
      "company_seat": "Grünwald",
      "details": "14.06.2025 (Bekanntmachungsdatum)\n\nBayern Amtsgericht München HRA 109791\nRegisterbekanntmachung nach dem Umwandlungsgesetz 13.06.2025 (Eintragungsdatum)\n\nPlato Life Management & Service GmbH & Co. KG\nKommanditgesellschaft\nGrünwald\n\nDen Gläubigern der an der Verschmelzung beteiligten Rechtsträger ist, wenn sie binnen sechs Monaten nach dem Tag, an dem die Eintragung der Verschmelzung in das Register des Sitzes desjenigen Rechtsträgers, dessen Gläubiger sie sind, nach § 19 Abs. 3 UmwG als bekannt gemacht gilt, ihren Anspruch nach Grund und Höhe in Textform anmelden, Sicherheit zu leisten, soweit sie nicht Befriedigung verlangen können. Dieses Recht steht den Gläubigern jedoch nur zu, wenn sie glaubhaft machen, dass durch die Verschmelzung die Erfüllung ihrer Forderung gefährdet wird."
    },
    {
      "date": "2025-06-14",
      "id": "112229",
      "original_text": "Registerbekanntmachung nach dem Umwandlungsgesetz\nBayern Amtsgericht München HRA 121196\nGeorg Michael Sagemüller e.K. – Rottenbuch",
      "type": "Registerbekanntmachung nach dem Umwandlungsgesetz",
      "state": "Bayern",
      "amtsgericht": "Amtsgericht München",
      "registernummer": "HRA 121196",
      "registerart": "HRA",
      "company_name": "Georg Michael Sagemüller e.K.",
      "company_seat": "Rottenbuch",
      "details": "14.06.2025 (Bekanntmachungsdatum)\n\nBayern Amtsgericht München HRA 121196\nRegisterbekanntmachung nach dem Umwandlungsgesetz 13.06.2025 (Eintragungsdatum)\n\nGeorg Michael Sagemüller e.K.\nEinzelkaufmann / Einzelkauffrau\nRottenbuch\n\nDen Gläubigern der an der Verschmelzung beteiligten Rechtsträger ist, wenn sie binnen sechs Monaten nach dem Tag, an dem die Eintragung der Verschmelzung in das Register des Sitzes desjenigen Rechtsträgers, dessen Gläubiger sie sind, nach § 19 Abs. 3 UmwG als bekannt gemacht gilt, ihren Anspruch nach Grund und Höhe in Textform anmelden, Sicherheit zu leisten, soweit sie nicht Befriedigung verlangen können. Dieses Recht steht den Gläubigern jedoch nur zu, wenn sie glaubhaft machen, dass durch die Verschmelzung die Erfüllung ihrer Forderung gefährdet wird."
    },
    {
      "date": "2025-06-14",
      "id": "112230",
      "original_text": "Registerbekanntmachung nach dem Umwandlungsgesetz\nBayern Amtsgericht München HRB 258106\nBlue Mountains Restaurants GmbH – Garmisch-Partenkirchen",
      "type": "Registerbekanntmachung nach dem Umwandlungsgesetz",
      "state": "Bayern",
      "amtsgericht": "Amtsgericht München",
      "registernummer": "HRB 258106",
      "registerart": "HRB",
      "company_name": "Blue Mountains Restaurants GmbH",
      "company_seat": "Garmisch-Partenkirchen",
      "details": "14.06.2025 (Bekanntmachungsdatum)\n\nBayern Amtsgericht München HRB 258106\nRegisterbekanntmachung nach dem Umwandlungsgesetz 13.06.2025 (Eintragungsdatum)\n\nBlue Mountains Restaurants GmbH\nGesellschaft mit beschränkter Haftung\nGarmisch-Partenkirchen\n\nDen Gläubigern der an der Verschmelzung beteiligten Rechtsträger ist, wenn sie binnen sechs Monaten nach dem Tag, an dem die Eintragung der Verschmelzung in das Register des Sitzes desjenigen Rechtsträgers, dessen Gläubiger sie sind, nach § 19 Abs. 3 UmwG als bekannt gemacht gilt, ihren Anspruch nach Grund und Höhe in Textform anmelden, Sicherheit zu leisten, soweit sie nicht Befriedigung verlangen können. Dieses Recht steht den Gläubigern jedoch nur zu, wenn sie glaubhaft machen, dass durch die Verschmelzung die Erfüllung ihrer Forderung gefährdet wird."
    },
    {
      "date": "2025-06-14",
      "id": "112231",
      "original_text": "Einreichung neuer Dokumente\nBayern Amtsgericht Passau HRB 1625\nAppartement-Hotel Rottaler Hof Betriebs GmbH – Bad Füssing",
      "type": "Einreichung neuer Dokumente",
      "state": "Bayern",
      "amtsgericht": "Amtsgericht Passau",
      "registernummer": "HRB 1625",
      "registerart": "HRB",
      "company_name": "Appartement-Hotel Rottaler Hof Betriebs GmbH",
      "company_seat": "Bad Füssing",
      "details": "14.06.2025 (Bekanntmachungsdatum)\n\nBayern Amtsgericht Passau HRB 1625\nEinreichung neuer Dokumente 13.06.2025 (Eintragungsdatum)\n\nAppartement-Hotel Rottaler Hof Betriebs GmbH\nGesellschaft mit beschränkter Haftung\nBad Füssing\n\nDem #Re.Name ist eine Liste der Mitglieder des Aufsichtsrats eingereicht worden, § 52 Abs. 3 S. 2 GmbHG."
    },
    {
      "date": "2025-06-14",
      "id": "112232",
      "original_text": "Registerbekanntmachung nach dem Umwandlungsgesetz\nBayern Amtsgericht München HRB 266600\nTRESEC Group GmbH – München",
      "type": "Registerbekanntmachung nach dem Umwandlungsgesetz",
      "state": "Bayern",
      "amtsgericht": "Amtsgericht München",
      "registernummer": "HRB 266600",
      "registerart": "HRB",
      "company_name": "TRESEC Group GmbH",
      "company_seat": "München",
      "details": "14.06.2025 (Bekanntmachungsdatum)\n\nBayern Amtsgericht München HRB 266600\nRegisterbekanntmachung nach dem Umwandlungsgesetz 13.06.2025 (Eintragungsdatum)\n\nTRESEC Group GmbH\nGesellschaft mit beschränkter Haftung\nMünchen\n\nDen Gläubigern der an der Verschmelzung beteiligten Rechtsträger ist, wenn sie binnen sechs Monaten nach dem Tag, an dem die Eintragung der Verschmelzung in das Register des Sitzes desjenigen Rechtsträgers, dessen Gläubiger sie sind, nach § 19 Abs. 3 UmwG als bekannt gemacht gilt, ihren Anspruch nach Grund und Höhe in Textform anmelden, Sicherheit zu leisten, soweit sie nicht Befriedigung verlangen können. Dieses Recht steht den Gläubigern jedoch nur zu, wenn sie glaubhaft machen, dass durch die Verschmelzung die Erfüllung ihrer Forderung gefährdet wird."
    },
    {
      "date": "2025-06-14",
      "id": "112233",
      "original_text": "Registerbekanntmachung nach dem Umwandlungsgesetz\nBayern Amtsgericht München HRA 109788\nFrankfurt Münchener Leben Management & Service GmbH & Co. KG – Grünwald",
      "type": "Registerbekanntmachung nach dem Umwandlungsgesetz",
      "state": "Bayern",
      "amtsgericht": "Amtsgericht München",
      "registernummer": "HRA 109788",
      "registerart": "HRA",
      "company_name": "Frankfurt Münchener Leben Management & Service GmbH & Co. KG",
      "company_seat": "Grünwald",
      "details": "14.06.2025 (Bekanntmachungsdatum)\n\nBayern Amtsgericht München HRA 109788\nRegisterbekanntmachung nach dem Umwandlungsgesetz 13.06.2025 (Eintragungsdatum)\n\nFrankfurt Münchener Leben Management & Service GmbH & Co. KG\nKommanditgesellschaft\nGrünwald\n\nDen Gläubigern der an der Verschmelzung beteiligten Rechtsträger ist, wenn sie binnen sechs Monaten nach dem Tag, an dem die Eintragung der Verschmelzung in das Register des Sitzes desjenigen Rechtsträgers, dessen Gläubiger sie sind, nach § 19 Abs. 3 UmwG als bekannt gemacht gilt, ihren Anspruch nach Grund und Höhe in Textform anmelden, Sicherheit zu leisten, soweit sie nicht Befriedigung verlangen können. Dieses Recht steht den Gläubigern jedoch nur zu, wenn sie glaubhaft machen, dass durch die Verschmelzung die Erfüllung ihrer Forderung gefährdet wird."
    },
    {
      "date": "2025-06-14",
      "id": "112234",
      "original_text": "Einreichung neuer Dokumente\nBayern Amtsgericht München HRB 223275\nottonova Holding AG – München",
      "type": "Einreichung neuer Dokumente",
      "state": "Bayern",
      "amtsgericht": "Amtsgericht München",
      "registernummer": "HRB 223275",
      "registerart": "HRB",
      "company_name": "ottonova Holding AG",
      "company_seat": "München",
      "details": "14.06.2025 (Bekanntmachungsdatum)\n\nBayern Amtsgericht München HRB 223275\nEinreichung neuer Dokumente 13.06.2025 (Eintragungsdatum)\n\nottonova Holding AG\nAktiengesellschaft\nMünchen\n\nDem Amtsgericht München -Registergericht- ist eine Liste der Mitglieder des Aufsichtsrats eingereicht worden, § 106 AktG."
    },
    {
      "date": "2025-06-14",
      "id": "112235",
      "original_text": "Registerbekanntmachung nach dem Umwandlungsgesetz\nBayern Amtsgericht München HRB 283336\nSchoberth Transport 24 GmbH – Wolfratshausen",
      "type": "Registerbekanntmachung nach dem Umwandlungsgesetz",
      "state": "Bayern",
      "amtsgericht": "Amtsgericht München",
      "registernummer": "HRB 283336",
      "registerart": "HRB",
      "company_name": "Schoberth Transport 24 GmbH",
      "company_seat": "Wolfratshausen",
      "details": "14.06.2025 (Bekanntmachungsdatum)\n\nBayern Amtsgericht München HRB 283336\nRegisterbekanntmachung nach dem Umwandlungsgesetz 13.06.2025 (Eintragungsdatum)\n\nSchoberth Transport 24 GmbH\nGesellschaft mit beschränkter Haftung\nWolfratshausen\n\nDen Gläubigern der an der Verschmelzung beteiligten Rechtsträger ist, wenn sie binnen sechs Monaten nach dem Tag, an dem die Eintragung der Verschmelzung in das Register des Sitzes desjenigen Rechtsträgers, dessen Gläubiger sie sind, nach § 19 Abs. 3 UmwG als bekannt gemacht gilt, ihren Anspruch nach Grund und Höhe in Textform anmelden, Sicherheit zu leisten, soweit sie nicht Befriedigung verlangen können. Dieses Recht steht den Gläubigern jedoch nur zu, wenn sie glaubhaft machen, dass durch die Verschmelzung die Erfüllung ihrer Forderung gefährdet wird."
    },
    {
      "date": "2025-06-14",
      "id": "112236",
      "original_text": "Registerbekanntmachung nach dem Umwandlungsgesetz\nBayern Amtsgericht Nürnberg HRB 43935\nProjekt Invest Bavaria GmbH – Nürnberg",
      "type": "Registerbekanntmachung nach dem Umwandlungsgesetz",
      "state": "Bayern",
      "amtsgericht": "Amtsgericht Nürnberg",
      "registernummer": "HRB 43935",
      "registerart": "HRB",
      "company_name": "Projekt Invest Bavaria GmbH",
      "company_seat": "Nürnberg",
      "details": "14.06.2025 (Bekanntmachungsdatum)\n\nBayern Amtsgericht Nürnberg HRB 43935\nRegisterbekanntmachung nach dem Umwandlungsgesetz 13.06.2025 (Eintragungsdatum)\n\nProjekt Invest Bavaria GmbH\nGesellschaft mit beschränkter Haftung\nNürnberg\n\nDen Gläubigern des formwechselnden Rechtsträgers ist, wenn sie binnen sechs Monaten nach dem Tag, an dem die Eintragung des Formwechsels nach § 201 UmwG als bekannt gemacht gilt, ihren Anspruch nach Grund und Höhe in Textform anmelden, Sicherheit zu leisten, soweit sie nicht Befriedigung verlangen können. Dieses Recht steht den Gläubigern jedoch nur zu, wenn sie glaubhaft machen, dass durch den Formwechsel die Erfüllung ihrer Forderung gefährdet wird."
    },
    {
      "date": "2025-06-14",
      "id": "112237",
      "original_text": "Registerbekanntmachung nach dem Umwandlungsgesetz\nBayern Amtsgericht München HRB 70290\nBayernwerk Natur GmbH – Unterschleißheim",
      "type": "Registerbekanntmachung nach dem Umwandlungsgesetz",
      "state": "Bayern",
      "amtsgericht": "Amtsgericht München",
      "registernummer": "HRB 70290",
      "registerart": "HRB",
      "company_name": "Bayernwerk Natur GmbH",
      "company_seat": "Unterschleißheim",
      "details": "14.06.2025 (Bekanntmachungsdatum)\n\nBayern Amtsgericht München HRB 70290\nRegisterbekanntmachung nach dem Umwandlungsgesetz 13.06.2025 (Eintragungsdatum)\n\nBayernwerk Natur GmbH\nGesellschaft mit beschränkter Haftung\nUnterschleißheim\n\nDen Gläubigern der an der Verschmelzung beteiligten Rechtsträger ist, wenn sie binnen sechs Monaten nach dem Tag, an dem die Eintragung der Verschmelzung in das Register des Sitzes desjenigen Rechtsträgers, dessen Gläubiger sie sind, nach § 19 Abs. 3 UmwG als bekannt gemacht gilt, ihren Anspruch nach Grund und Höhe in Textform anmelden, Sicherheit zu leisten, soweit sie nicht Befriedigung verlangen können. Dieses Recht steht den Gläubigern jedoch nur zu, wenn sie glaubhaft machen, dass durch die Verschmelzung die Erfüllung ihrer Forderung gefährdet wird."
    },
    {
      "date": "2025-06-14",
      "id": "112238",
      "original_text": "Einreichung neuer Dokumente\nBayern Amtsgericht München HRB 132321\nCuneo AG – Grünwald",
      "type": "Einreichung neuer Dokumente",
      "state": "Bayern",
      "amtsgericht": "Amtsgericht München",
      "registernummer": "HRB 132321",
      "registerart": "HRB",
      "company_name": "Cuneo AG",
      "company_seat": "Grünwald",
      "details": "14.06.2025 (Bekanntmachungsdatum)\n\nBayern Amtsgericht München HRB 132321\nEinreichung neuer Dokumente\n\nCuneo AG\nAktiengesellschaft\nGrünwald\n\nDem Amtsgericht München -Registergericht- ist eine Liste der Mitglieder des Aufsichtsrats eingereicht worden, § 106 AktG."
    },
    {
      "date": "2025-06-14",
      "id": "112239",
      "original_text": "Löschungsankündigung\nNiedersachsen Amtsgericht Hildesheim HRB 208016\nMini-Häuser Vertriebsgesellschaft mbH – Ilsede",
      "type": "Löschungsankündigung",
      "state": "Niedersachsen",
      "amtsgericht": "Amtsgericht Hildesheim",
      "registernummer": "HRB 208016",
      "registerart": "HRB",
      "company_name": "Mini-Häuser Vertriebsgesellschaft mbH",
      "company_seat": "Ilsede",
      "details": "14.06.2025 (Bekanntmachungsdatum)\n\nNiedersachsen Amtsgericht Hildesheim HRB 208016\nLöschungsankündigung\n\nMini-Häuser Vertriebsgesellschaft mbH\nGesellschaft mit beschränkter Haftung\nIlsede\n\nDas Registergericht beabsichtigt, die Gesellschaft von Amts wegen nach § 394 FamFG zu löschen. Die Frist zur Erhebung eines Widerspruchs ist auf 1 Monat ab dieser Registerbekanntmachung festgesetzt."
    }
  ]
}