{
  "date": "2025-06-05",
  "date_of_scrape": "2025-06-13T08:06:22.897Z",
  "tool_version": "0.2.0",
  "number_of_announcements": 178,
  "announcements": [
    {
      "date": "2025-06-05",
      "id": "111240",
      "original_text": "Registerbekanntmachung nach dem Umwandlungsgesetz\nBayern Amtsgericht Würzburg VR 30282\nSpielmannszug Markt Frammersbach e.V. – Frammersbach",
      "type": "Registerbekanntmachung nach dem Umwandlungsgesetz",
      "state": "Bayern",
      "amtsgericht": "Amtsgericht Würzburg",
      "registernummer": "VR 30282",
      "registerart": "VR",
      "company_name": "Spielmannszug Markt Frammersbach e.V.",
      "company_seat": "Frammersbach",
      "details": "05.06.2025 (Bekanntmachungsdatum)\n\nBayern Amtsgericht Würzburg VR 30282\nRegisterbekanntmachung nach dem Umwandlungsgesetz 04.06.2025 (Eintragungsdatum)\n\nSpielmannszug Markt Frammersbach e.V.\neingetragener Verein\nFrammersbach\n\nDen Gläubigern der an der Verschmelzung beteiligten Rechtsträger ist, wenn sie binnen sechs Monaten nach dem Tag, an dem die Eintragung der Verschmelzung in das Register des Sitzes desjenigen Rechtsträgers, dessen Gläubiger sie sind, nach § 19 Abs. 3 UmwG als bekannt gemacht gilt, ihren Anspruch nach Grund und Höhe in Textform anmelden, Sicherheit zu leisten, soweit sie nicht Befriedigung verlangen können. Dieses Recht steht den Gläubigern jedoch nur zu, wenn sie glaubhaft machen, dass durch die Verschmelzung die Erfüllung ihrer Forderung gefährdet wird."
    },
    {
      "date": "2025-06-05",
      "id": "111241",
      "original_text": "Sonstige Registerbekanntmachung\nBayern Amtsgericht Bayreuth HRB 4488\nAutohaus Zillig GmbH – Kulmbach",
      "type": "Sonstige Registerbekanntmachung",
      "state": "Bayern",
      "amtsgericht": "Amtsgericht Bayreuth",
      "registernummer": "HRB 4488",
      "registerart": "HRB",
      "company_name": "Autohaus Zillig GmbH",
      "company_seat": "Kulmbach",
      "details": "05.06.2025 (Bekanntmachungsdatum)\n\nBayern Amtsgericht Bayreuth HRB 4488\nSonstige Registerbekanntmachung 04.06.2025 (Eintragungsdatum)\n\nAutohaus Zillig GmbH\nGesellschaft mit beschränkter Haftung\nKulmbach\n\nDen Gläubigern des formwechselnden Rechtsträgers ist, wenn sie binnen sechs Monaten nach dem Tag, an dem die Eintragung des Formwechsels nach § 201 UmwG als bekannt gemacht gilt, ihren Anspruch nach Grund und Höhe in Textform anmelden, Sicherheit zu leisten, soweit sie nicht Befriedigung verlangen können. Dieses Recht steht den Gläubigern jedoch nur zu, wenn sie glaubhaft machen, dass durch den Formwechsel die Erfüllung ihrer Forderung gefährdet wird."
    },
    {
      "date": "2025-06-05",
      "id": "111242",
      "original_text": "Registerbekanntmachung nach dem Umwandlungsgesetz\nBayern Amtsgericht München HRB 192618\nRIBEMO Verwaltung GmbH – Pullach i. Isartal",
      "type": "Registerbekanntmachung nach dem Umwandlungsgesetz",
      "state": "Bayern",
      "amtsgericht": "Amtsgericht München",
      "registernummer": "HRB 192618",
      "registerart": "HRB",
      "company_name": "RIBEMO Verwaltung GmbH",
      "company_seat": "Pullach i. Isartal",
      "details": "05.06.2025 (Bekanntmachungsdatum)\n\nBayern Amtsgericht München HRB 192618\nRegisterbekanntmachung nach dem Umwandlungsgesetz 04.06.2025 (Eintragungsdatum)\n\nRIBEMO Verwaltung GmbH\nGesellschaft mit beschränkter Haftung\nPullach i. Isartal\n\nDen Gläubigern der an der Verschmelzung beteiligten Rechtsträger ist, wenn sie binnen sechs Monaten nach dem Tag, an dem die Eintragung der Verschmelzung in das Register des Sitzes desjenigen Rechtsträgers, dessen Gläubiger sie sind, nach § 19 Abs. 3 UmwG als bekannt gemacht gilt, ihren Anspruch nach Grund und Höhe in Textform anmelden, Sicherheit zu leisten, soweit sie nicht Befriedigung verlangen können. Dieses Recht steht den Gläubigern jedoch nur zu, wenn sie glaubhaft machen, dass durch die Verschmelzung die Erfüllung ihrer Forderung gefährdet wird."
    },
    {
      "date": "2025-06-05",
      "id": "111243",
      "original_text": "Registerbekanntmachung nach dem Umwandlungsgesetz\nBayern Amtsgericht Augsburg HRB 38356\nBENICA GmbH – Augsburg",
      "type": "Registerbekanntmachung nach dem Umwandlungsgesetz",
      "state": "Bayern",
      "amtsgericht": "Amtsgericht Augsburg",
      "registernummer": "HRB 38356",
      "registerart": "HRB",
      "company_name": "BENICA GmbH",
      "company_seat": "Augsburg",
      "details": "05.06.2025 (Bekanntmachungsdatum)\n\nBayern Amtsgericht Augsburg HRB 38356\nRegisterbekanntmachung nach dem Umwandlungsgesetz 04.06.2025 (Eintragungsdatum)\n\nBENICA GmbH\nGesellschaft mit beschränkter Haftung\nAugsburg\n\nDen Gläubigern der an der Verschmelzung beteiligten Rechtsträger ist, wenn sie binnen sechs Monaten nach dem Tag, an dem die Eintragung der Verschmelzung in das Register des Sitzes desjenigen Rechtsträgers, dessen Gläubiger sie sind, nach § 19 Abs. 3 UmwG als bekannt gemacht gilt, ihren Anspruch nach Grund und Höhe in Textform anmelden, Sicherheit zu leisten, soweit sie nicht Befriedigung verlangen können. Dieses Recht steht den Gläubigern jedoch nur zu, wenn sie glaubhaft machen, dass durch die Verschmelzung die Erfüllung ihrer Forderung gefährdet wird."
    },
    {
      "date": "2025-06-05",
      "id": "111244",
      "original_text": "Registerbekanntmachung nach dem Umwandlungsgesetz\nBayern Amtsgericht München HRB 203112\nMORULUS Grundstücks-Vermietungsgesellschaft mbH – Pullach i.Isartal",
      "type": "Registerbekanntmachung nach dem Umwandlungsgesetz",
      "state": "Bayern",
      "amtsgericht": "Amtsgericht München",
      "registernummer": "HRB 203112",
      "registerart": "HRB",
      "company_name": "MORULUS Grundstücks-Vermietungsgesellschaft mbH",
      "company_seat": "Pullach i.Isartal",
      "details": "05.06.2025 (Bekanntmachungsdatum)\n\nBayern Amtsgericht München HRB 203112\nRegisterbekanntmachung nach dem Umwandlungsgesetz 04.06.2025 (Eintragungsdatum)\n\nMORULUS Grundstücks-Vermietungsgesellschaft mbH\nGesellschaft mit beschränkter Haftung\nPullach i.Isartal\n\nDen Gläubigern der an der Verschmelzung beteiligten Rechtsträger ist, wenn sie binnen sechs Monaten nach dem Tag, an dem die Eintragung der Verschmelzung in das Register des Sitzes desjenigen Rechtsträgers, dessen Gläubiger sie sind, nach § 19 Abs. 3 UmwG als bekannt gemacht gilt, ihren Anspruch nach Grund und Höhe in Textform anmelden, Sicherheit zu leisten, soweit sie nicht Befriedigung verlangen können. Dieses Recht steht den Gläubigern jedoch nur zu, wenn sie glaubhaft machen, dass durch die Verschmelzung die Erfüllung ihrer Forderung gefährdet wird."
    },
    {
      "date": "2025-06-05",
      "id": "111245",
      "original_text": "Löschungsankündigung\nBayern Amtsgericht Deggendorf HRB 3528\nBayerischer Wald Resort GmbH – Habischried",
      "type": "Löschungsankündigung",
      "state": "Bayern",
      "amtsgericht": "Amtsgericht Deggendorf",
      "registernummer": "HRB 3528",
      "registerart": "HRB",
      "company_name": "Bayerischer Wald Resort GmbH",
      "company_seat": "Habischried",
      "details": "05.06.2025 (Bekanntmachungsdatum)\n\nBayern Amtsgericht Deggendorf HRB 3528\nLöschungsankündigung\n\nBayerischer Wald Resort GmbH\nGesellschaft mit beschränkter Haftung\nHabischried\n\nDas Registergericht beabsichtigt, die im Handelsregister eingetragene Gesellschaft wegen Vermögenslosigkeit von Amts wegen nach § 394 FamFG zu löschen. Die Frist zur Erhebung eines Widerspruchs ist auf einen Monat festgesetzt."
    },
    {
      "date": "2025-06-05",
      "id": "111246",
      "original_text": "Einreichung neuer Dokumente\nBayern Amtsgericht München HRB 256407\nLinde GmbH – Pullach i.Isartal",
      "type": "Einreichung neuer Dokumente",
      "state": "Bayern",
      "amtsgericht": "Amtsgericht München",
      "registernummer": "HRB 256407",
      "registerart": "HRB",
      "company_name": "Linde GmbH",
      "company_seat": "Pullach i.Isartal",
      "details": "05.06.2025 (Bekanntmachungsdatum)\n\nBayern Amtsgericht München HRB 256407\nEinreichung neuer Dokumente 04.06.2025 (Eintragungsdatum)\n\nLinde GmbH\nGesellschaft mit beschränkter Haftung\nPullach i.Isartal\n\nDem Amtsgericht München -Registergericht- ist eine Liste der Mitglieder des Aufsichtsrats eingereicht worden, § 52 Abs. 3 S. 2 GmbHG."
    },
    {
      "date": "2025-06-05",
      "id": "111247",
      "original_text": "Registerbekanntmachung nach dem Umwandlungsgesetz\nBayern Amtsgericht München HRB 171721\nMITESA Verwaltung GmbH – Pullach i. Isartal",
      "type": "Registerbekanntmachung nach dem Umwandlungsgesetz",
      "state": "Bayern",
      "amtsgericht": "Amtsgericht München",
      "registernummer": "HRB 171721",
      "registerart": "HRB",
      "company_name": "MITESA Verwaltung GmbH",
      "company_seat": "Pullach i. Isartal",
      "details": "05.06.2025 (Bekanntmachungsdatum)\n\nBayern Amtsgericht München HRB 171721\nRegisterbekanntmachung nach dem Umwandlungsgesetz 04.06.2025 (Eintragungsdatum)\n\nMITESA Verwaltung GmbH\nGesellschaft mit beschränkter Haftung\nPullach i. Isartal\n\nDen Gläubigern der an der Verschmelzung beteiligten Rechtsträger ist, wenn sie binnen sechs Monaten nach dem Tag, an dem die Eintragung der Verschmelzung in das Register des Sitzes desjenigen Rechtsträgers, dessen Gläubiger sie sind, nach § 19 Abs. 3 UmwG als bekannt gemacht gilt, ihren Anspruch nach Grund und Höhe in Textform anmelden, Sicherheit zu leisten, soweit sie nicht Befriedigung verlangen können. Dieses Recht steht den Gläubigern jedoch nur zu, wenn sie glaubhaft machen, dass durch die Verschmelzung die Erfüllung ihrer Forderung gefährdet wird."
    },
    {
      "date": "2025-06-05",
      "id": "111248",
      "original_text": "Registerbekanntmachung nach dem Umwandlungsgesetz\nBayern Amtsgericht Augsburg HRA 21831\nPala Gartenservice e.K. – Steindorf",
      "type": "Registerbekanntmachung nach dem Umwandlungsgesetz",
      "state": "Bayern",
      "amtsgericht": "Amtsgericht Augsburg",
      "registernummer": "HRA 21831",
      "registerart": "HRA",
      "company_name": "Pala Gartenservice e.K.",
      "company_seat": "Steindorf",
      "details": "05.06.2025 (Bekanntmachungsdatum)\n\nBayern Amtsgericht Augsburg HRA 21831\nRegisterbekanntmachung nach dem Umwandlungsgesetz 04.06.2025 (Eintragungsdatum)\n\nPala Gartenservice e.K.\nEinzelkaufmann / Einzelkauffrau\nSteindorf\n\nDen Gläubigern der an der Ausgliederung beteiligten Rechtsträger ist, wenn sie binnen sechs Monaten nach dem Tag, an dem die Eintragung der Ausgliederung in das Register des Sitzes desjenigen Rechtsträgers, dessen Gläubiger sie sind, nach §§ 125, 19 Abs. 3 UmwG als bekannt gemacht gilt, ihren Anspruch nach Grund und Höhe in Textform anmelden, Sicherheit zu leisten, soweit sie nicht Befriedigung verlangen können. Dieses Recht steht den Gläubigern jedoch nur zu, wenn sie glaubhaft machen, dass durch die Ausgliederung die Erfüllung ihrer Forderung gefährdet wird."
    },
    {
      "date": "2025-06-05",
      "id": "111249",
      "original_text": "Einreichung neuer Dokumente\nBayern Amtsgericht Würzburg HRB 162\nWürzburger Versorgungs- und Verkehrs - Gesellschaft mit beschränkter Haftung – Würzburg",
      "type": "Einreichung neuer Dokumente",
      "state": "Bayern",
      "amtsgericht": "Amtsgericht Würzburg",
      "registernummer": "HRB 162",
      "registerart": "HRB",
      "company_name": "Würzburger Versorgungs- und Verkehrs - Gesellschaft mit beschränkter Haftung",
      "company_seat": "Würzburg",
      "details": "05.06.2025 (Bekanntmachungsdatum)\n\nBayern Amtsgericht Würzburg HRB 162\nEinreichung neuer Dokumente\n\nWürzburger Versorgungs- und Verkehrs - Gesellschaft mit beschränkter Haftung\nGesellschaft mit beschränkter Haftung\nWürzburg\n\nDem Amtsgericht Würzburg -Registergericht- ist eine Liste der Mitglieder des Aufsichtsrats eingereicht worden, § 52 Abs. 3 S. 2 GmbHG."
    },
    {
      "date": "2025-06-05",
      "id": "111250",
      "original_text": "Einreichung neuer Dokumente\nBayern Amtsgericht München HRB 175195\nSt.Galler Kantonalbank Deutschland AG – München",
      "type": "Einreichung neuer Dokumente",
      "state": "Bayern",
      "amtsgericht": "Amtsgericht München",
      "registernummer": "HRB 175195",
      "registerart": "HRB",
      "company_name": "St.Galler Kantonalbank Deutschland AG",
      "company_seat": "München",
      "details": "05.06.2025 (Bekanntmachungsdatum)\n\nBayern Amtsgericht München HRB 175195\nEinreichung neuer Dokumente\n\nSt.Galler Kantonalbank Deutschland AG\nAktiengesellschaft\nMünchen\n\nDem #Re.Name ist eine Liste der Mitglieder des Aufsichtsrats eingereicht worden, § 106 AktG."
    },
    {
      "date": "2025-06-05",
      "id": "111251",
      "original_text": "Registerbekanntmachung nach dem Umwandlungsgesetz\nBayern Amtsgericht München HRB 302891\ndpmed GmbH – Germering",
      "type": "Registerbekanntmachung nach dem Umwandlungsgesetz",
      "state": "Bayern",
      "amtsgericht": "Amtsgericht München",
      "registernummer": "HRB 302891",
      "registerart": "HRB",
      "company_name": "dpmed GmbH",
      "company_seat": "Germering",
      "details": "05.06.2025 (Bekanntmachungsdatum)\n\nBayern Amtsgericht München HRB 302891\nRegisterbekanntmachung nach dem Umwandlungsgesetz 04.06.2025 (Eintragungsdatum)\n\ndpmed GmbH\nGesellschaft mit beschränkter Haftung\nGermering\n\nDen Gläubigern des formwechselnden Rechtsträgers ist, wenn sie binnen sechs Monaten nach dem Tag, an dem die Eintragung des Formwechsels nach § 201 UmwG als bekannt gemacht gilt, ihren Anspruch nach Grund und Höhe in Textform anmelden, Sicherheit zu leisten, soweit sie nicht Befriedigung verlangen können. Dieses Recht steht den Gläubigern jedoch nur zu, wenn sie glaubhaft machen, dass durch den Formwechsel die Erfüllung ihrer Forderung gefährdet wird."
    },
    {
      "date": "2025-06-05",
      "id": "111252",
      "original_text": "Registerbekanntmachung nach dem Umwandlungsgesetz\nBayern Amtsgericht Passau HRB 1372\nAlois Firmhofer GmbH, Bezirksleiter der Bausparkasse Schwäbisch Hall – St. Oswald-Riedlhütte",
      "type": "Registerbekanntmachung nach dem Umwandlungsgesetz",
      "state": "Bayern",
      "amtsgericht": "Amtsgericht Passau",
      "registernummer": "HRB 1372",
      "registerart": "HRB",
      "company_name": "Alois Firmhofer GmbH, Bezirksleiter der Bausparkasse Schwäbisch Hall",
      "company_seat": "St. Oswald-Riedlhütte",
      "details": "05.06.2025 (Bekanntmachungsdatum)\n\nBayern Amtsgericht Passau HRB 1372\nRegisterbekanntmachung nach dem Umwandlungsgesetz 04.06.2025 (Eintragungsdatum)\n\nAlois Firmhofer GmbH, Bezirksleiter der Bausparkasse Schwäbisch Hall\nGesellschaft mit beschränkter Haftung\nSt. Oswald-Riedlhütte\n\nDen Gläubigern der an der Verschmelzung beteiligten Rechtsträger ist, wenn sie binnen sechs Monaten nach dem Tag, an dem die Eintragung der Verschmelzung in das Register des Sitzes desjenigen Rechtsträgers, dessen Gläubiger sie sind, nach § 19 Abs. 3 UmwG als bekannt gemacht gilt, ihren Anspruch nach Grund und Höhe in Textform anmelden, Sicherheit zu leisten, soweit sie nicht Befriedigung verlangen können. Dieses Recht steht den Gläubigern jedoch nur zu, wenn sie glaubhaft machen, dass durch die Verschmelzung die Erfüllung ihrer Forderung gefährdet wird."
    },
    {
      "date": "2025-06-05",
      "id": "111253",
      "original_text": "Registerbekanntmachung nach dem Umwandlungsgesetz\nBayern Amtsgericht München HRB 247972\nPR Personal GmbH – Unterhaching",
      "type": "Registerbekanntmachung nach dem Umwandlungsgesetz",
      "state": "Bayern",
      "amtsgericht": "Amtsgericht München",
      "registernummer": "HRB 247972",
      "registerart": "HRB",
      "company_name": "PR Personal GmbH",
      "company_seat": "Unterhaching",
      "details": "05.06.2025 (Bekanntmachungsdatum)\n\nBayern Amtsgericht München HRB 247972\nRegisterbekanntmachung nach dem Umwandlungsgesetz 04.06.2025 (Eintragungsdatum)\n\nPR Personal GmbH\nGesellschaft mit beschränkter Haftung\nUnterhaching\n\nDen Gläubigern der an der Verschmelzung beteiligten Rechtsträger ist, wenn sie binnen sechs Monaten nach dem Tag, an dem die Eintragung der Verschmelzung in das Register des Sitzes desjenigen Rechtsträgers, dessen Gläubiger sie sind, nach § 19 Abs. 3 UmwG als bekannt gemacht gilt, ihren Anspruch nach Grund und Höhe in Textform anmelden, Sicherheit zu leisten, soweit sie nicht Befriedigung verlangen können. Dieses Recht steht den Gläubigern jedoch nur zu, wenn sie glaubhaft machen, dass durch die Verschmelzung die Erfüllung ihrer Forderung gefährdet wird."
    },
    {
      "date": "2025-06-05",
      "id": "111254",
      "original_text": "Registerbekanntmachung nach dem Umwandlungsgesetz\nBayern Amtsgericht Passau HRB 1369\nSF Hausverwaltung GmbH – St. Oswald-Riedlhütte",
      "type": "Registerbekanntmachung nach dem Umwandlungsgesetz",
      "state": "Bayern",
      "amtsgericht": "Amtsgericht Passau",
      "registernummer": "HRB 1369",
      "registerart": "HRB",
      "company_name": "SF Hausverwaltung GmbH",
      "company_seat": "St. Oswald-Riedlhütte",
      "details": "05.06.2025 (Bekanntmachungsdatum)\n\nBayern Amtsgericht Passau HRB 1369\nRegisterbekanntmachung nach dem Umwandlungsgesetz 04.06.2025 (Eintragungsdatum)\n\nSF Hausverwaltung GmbH\nGesellschaft mit beschränkter Haftung\nSt. Oswald-Riedlhütte\n\nDen Gläubigern der an der Verschmelzung beteiligten Rechtsträger ist, wenn sie binnen sechs Monaten nach dem Tag, an dem die Eintragung der Verschmelzung in das Register des Sitzes desjenigen Rechtsträgers, dessen Gläubiger sie sind, nach § 19 Abs. 3 UmwG als bekannt gemacht gilt, ihren Anspruch nach Grund und Höhe in Textform anmelden, Sicherheit zu leisten, soweit sie nicht Befriedigung verlangen können. Dieses Recht steht den Gläubigern jedoch nur zu, wenn sie glaubhaft machen, dass durch die Verschmelzung die Erfüllung ihrer Forderung gefährdet wird."
    },
    {
      "date": "2025-06-05",
      "id": "111255",
      "original_text": "Registerbekanntmachung nach dem Umwandlungsgesetz\nBayern Amtsgericht Bamberg HRB 11476\nBierothek Media GmbH – Bamberg",
      "type": "Registerbekanntmachung nach dem Umwandlungsgesetz",
      "state": "Bayern",
      "amtsgericht": "Amtsgericht Bamberg",
      "registernummer": "HRB 11476",
      "registerart": "HRB",
      "company_name": "Bierothek Media GmbH",
      "company_seat": "Bamberg",
      "details": "05.06.2025 (Bekanntmachungsdatum)\n\nBayern Amtsgericht Bamberg HRB 11476\nRegisterbekanntmachung nach dem Umwandlungsgesetz 04.06.2025 (Eintragungsdatum)\n\nBierothek Media GmbH\nGesellschaft mit beschränkter Haftung\nBamberg\n\nDen Gläubigern der an der Verschmelzung beteiligten Rechtsträger ist, wenn sie binnen sechs Monaten nach dem Tag, an dem die Eintragung der Verschmelzung in das Register des Sitzes desjenigen Rechtsträgers, dessen Gläubiger sie sind, nach § 19 Abs. 3 UmwG als bekannt gemacht gilt, ihren Anspruch nach Grund und Höhe in Textform anmelden, Sicherheit zu leisten, soweit sie nicht Befriedigung verlangen können. Dieses Recht steht den Gläubigern jedoch nur zu, wenn sie glaubhaft machen, dass durch die Verschmelzung die Erfüllung ihrer Forderung gefährdet wird."
    },
    {
      "date": "2025-06-05",
      "id": "111256",
      "original_text": "Registerbekanntmachung nach dem Umwandlungsgesetz\nBayern Amtsgericht Traunstein HRB 30652\nKarsten Ottenberg Beteiligungs UG (haftungsbeschränkt) – Frasdorf",
      "type": "Registerbekanntmachung nach dem Umwandlungsgesetz",
      "state": "Bayern",
      "amtsgericht": "Amtsgericht Traunstein",
      "registernummer": "HRB 30652",
      "registerart": "HRB",
      "company_name": "Karsten Ottenberg Beteiligungs UG (haftungsbeschränkt)",
      "company_seat": "Frasdorf",
      "details": "05.06.2025 (Bekanntmachungsdatum)\n\nBayern Amtsgericht Traunstein HRB 30652\nRegisterbekanntmachung nach dem Umwandlungsgesetz 04.06.2025 (Eintragungsdatum)\n\nKarsten Ottenberg Beteiligungs UG (haftungsbeschränkt)\nGesellschaft mit beschränkter Haftung\nFrasdorf\n\nDen Gläubigern der an der Verschmelzung beteiligten Rechtsträger ist, wenn sie binnen sechs Monaten nach dem Tag, an dem die Eintragung der Verschmelzung in das Register des Sitzes desjenigen Rechtsträgers, dessen Gläubiger sie sind, nach § 19 Abs. 3 UmwG als bekannt gemacht gilt, ihren Anspruch nach Grund und Höhe in Textform anmelden, Sicherheit zu leisten, soweit sie nicht Befriedigung verlangen können. Dieses Recht steht den Gläubigern jedoch nur zu, wenn sie glaubhaft machen, dass durch die Verschmelzung die Erfüllung ihrer Forderung gefährdet wird."
    },
    {
      "date": "2025-06-05",
      "id": "111257",
      "original_text": "Einreichung neuer Dokumente\nBayern Amtsgericht München HRB 234787\nLinde Holding GmbH – Pullach i.Isartal",
      "type": "Einreichung neuer Dokumente",
      "state": "Bayern",
      "amtsgericht": "Amtsgericht München",
      "registernummer": "HRB 234787",
      "registerart": "HRB",
      "company_name": "Linde Holding GmbH",
      "company_seat": "Pullach i.Isartal",
      "details": "05.06.2025 (Bekanntmachungsdatum)\n\nBayern Amtsgericht München HRB 234787\nEinreichung neuer Dokumente 04.06.2025 (Eintragungsdatum)\n\nLinde Holding GmbH\nGesellschaft mit beschränkter Haftung\nPullach i.Isartal\n\nDem Amtsgericht München -Registergericht- ist eine Liste der Mitglieder des Aufsichtsrats eingereicht worden, § 52 Abs. 3 S. 2 GmbHG."
    },
    {
      "date": "2025-06-05",
      "id": "111258",
      "original_text": "Registerbekanntmachung nach dem Umwandlungsgesetz\nBayern Amtsgericht München HRB 166165\nNena Grundstücksverwaltungsgesellschaft mbH – Pullach i. Isartal",
      "type": "Registerbekanntmachung nach dem Umwandlungsgesetz",
      "state": "Bayern",
      "amtsgericht": "Amtsgericht München",
      "registernummer": "HRB 166165",
      "registerart": "HRB",
      "company_name": "Nena Grundstücksverwaltungsgesellschaft mbH",
      "company_seat": "Pullach i. Isartal",
      "details": "05.06.2025 (Bekanntmachungsdatum)\n\nBayern Amtsgericht München HRB 166165\nRegisterbekanntmachung nach dem Umwandlungsgesetz 04.06.2025 (Eintragungsdatum)\n\nNena Grundstücksverwaltungsgesellschaft mbH\nGesellschaft mit beschränkter Haftung\nPullach i. Isartal\n\nDen Gläubigern der an der Verschmelzung beteiligten Rechtsträger ist, wenn sie binnen sechs Monaten nach dem Tag, an dem die Eintragung der Verschmelzung in das Register des Sitzes desjenigen Rechtsträgers, dessen Gläubiger sie sind, nach § 19 Abs. 3 UmwG als bekannt gemacht gilt, ihren Anspruch nach Grund und Höhe in Textform anmelden, Sicherheit zu leisten, soweit sie nicht Befriedigung verlangen können. Dieses Recht steht den Gläubigern jedoch nur zu, wenn sie glaubhaft machen, dass durch die Verschmelzung die Erfüllung ihrer Forderung gefährdet wird."
    },
    {
      "date": "2025-06-05",
      "id": "111259",
      "original_text": "Registerbekanntmachung nach dem Umwandlungsgesetz\nBayern Amtsgericht München HRB 171812\nDP-Medsystems AG – Germering",
      "type": "Registerbekanntmachung nach dem Umwandlungsgesetz",
      "state": "Bayern",
      "amtsgericht": "Amtsgericht München",
      "registernummer": "HRB 171812",
      "registerart": "HRB",
      "company_name": "DP-Medsystems AG",
      "company_seat": "Germering",
      "details": "05.06.2025 (Bekanntmachungsdatum)\n\nBayern Amtsgericht München HRB 171812\nRegisterbekanntmachung nach dem Umwandlungsgesetz 04.06.2025 (Eintragungsdatum)\n\nDP-Medsystems AG\nAktiengesellschaft\nGermering\n\nDen Gläubigern des formwechselnden Rechtsträgers ist, wenn sie binnen sechs Monaten nach dem Tag, an dem die Eintragung des Formwechsels nach § 201 UmwG als bekannt gemacht gilt, ihren Anspruch nach Grund und Höhe in Textform anmelden, Sicherheit zu leisten, soweit sie nicht Befriedigung verlangen können. Dieses Recht steht den Gläubigern jedoch nur zu, wenn sie glaubhaft machen, dass durch den Formwechsel die Erfüllung ihrer Forderung gefährdet wird."
    },
    {
      "date": "2025-06-05",
      "id": "111260",
      "original_text": "Registerbekanntmachung nach dem Umwandlungsgesetz\nBayern Amtsgericht München HRB 195869\nPAS GmbH – Penzberg",
      "type": "Registerbekanntmachung nach dem Umwandlungsgesetz",
      "state": "Bayern",
      "amtsgericht": "Amtsgericht München",
      "registernummer": "HRB 195869",
      "registerart": "HRB",
      "company_name": "PAS GmbH",
      "company_seat": "Penzberg",
      "details": "05.06.2025 (Bekanntmachungsdatum)\n\nBayern Amtsgericht München HRB 195869\nRegisterbekanntmachung nach dem Umwandlungsgesetz 04.06.2025 (Eintragungsdatum)\n\nPAS GmbH\nGesellschaft mit beschränkter Haftung\nPenzberg\n\nDen Gläubigern der an der Verschmelzung beteiligten Rechtsträger ist, wenn sie binnen sechs Monaten nach dem Tag, an dem die Eintragung der Verschmelzung in das Register des Sitzes desjenigen Rechtsträgers, dessen Gläubiger sie sind, nach § 19 Abs. 3 UmwG als bekannt gemacht gilt, ihren Anspruch nach Grund und Höhe in Textform anmelden, Sicherheit zu leisten, soweit sie nicht Befriedigung verlangen können. Dieses Recht steht den Gläubigern jedoch nur zu, wenn sie glaubhaft machen, dass durch die Verschmelzung die Erfüllung ihrer Forderung gefährdet wird."
    },
    {
      "date": "2025-06-05",
      "id": "111261",
      "original_text": "Registerbekanntmachung nach dem Umwandlungsgesetz\nBayern Amtsgericht München HRB 183603\nBUGENA Verwaltung GmbH – Pullach i. Isartal",
      "type": "Registerbekanntmachung nach dem Umwandlungsgesetz",
      "state": "Bayern",
      "amtsgericht": "Amtsgericht München",
      "registernummer": "HRB 183603",
      "registerart": "HRB",
      "company_name": "BUGENA Verwaltung GmbH",
      "company_seat": "Pullach i. Isartal",
      "details": "05.06.2025 (Bekanntmachungsdatum)\n\nBayern Amtsgericht München HRB 183603\nRegisterbekanntmachung nach dem Umwandlungsgesetz 04.06.2025 (Eintragungsdatum)\n\nBUGENA Verwaltung GmbH\nGesellschaft mit beschränkter Haftung\nPullach i. Isartal\n\nDen Gläubigern der an der Verschmelzung beteiligten Rechtsträger ist, wenn sie binnen sechs Monaten nach dem Tag, an dem die Eintragung der Verschmelzung in das Register des Sitzes desjenigen Rechtsträgers, dessen Gläubiger sie sind, nach § 19 Abs. 3 UmwG als bekannt gemacht gilt, ihren Anspruch nach Grund und Höhe in Textform anmelden, Sicherheit zu leisten, soweit sie nicht Befriedigung verlangen können. Dieses Recht steht den Gläubigern jedoch nur zu, wenn sie glaubhaft machen, dass durch die Verschmelzung die Erfüllung ihrer Forderung gefährdet wird."
    },
    {
      "date": "2025-06-05",
      "id": "111262",
      "original_text": "Registerbekanntmachung nach dem Umwandlungsgesetz\nBayern Amtsgericht Passau HRB 11738\nKHB 2. Wohnbau GmbH – Vilshofen an der Donau",
      "type": "Registerbekanntmachung nach dem Umwandlungsgesetz",
      "state": "Bayern",
      "amtsgericht": "Amtsgericht Passau",
      "registernummer": "HRB 11738",
      "registerart": "HRB",
      "company_name": "KHB 2. Wohnbau GmbH",
      "company_seat": "Vilshofen an der Donau",
      "details": "05.06.2025 (Bekanntmachungsdatum)\n\nBayern Amtsgericht Passau HRB 11738\nRegisterbekanntmachung nach dem Umwandlungsgesetz 04.06.2025 (Eintragungsdatum)\n\nKHB 2. Wohnbau GmbH\nGesellschaft mit beschränkter Haftung\nVilshofen an der Donau\n\nDen Gläubigern der an der Verschmelzung beteiligten Rechtsträger ist, wenn sie binnen sechs Monaten nach dem Tag, an dem die Eintragung der Verschmelzung in das Register des Sitzes desjenigen Rechtsträgers, dessen Gläubiger sie sind, nach § 19 Abs. 3 UmwG als bekannt gemacht gilt, ihren Anspruch nach Grund und Höhe in Textform anmelden, Sicherheit zu leisten, soweit sie nicht Befriedigung verlangen können. Dieses Recht steht den Gläubigern jedoch nur zu, wenn sie glaubhaft machen, dass durch die Verschmelzung die Erfüllung ihrer Forderung gefährdet wird."
    },
    {
      "date": "2025-06-05",
      "id": "111263",
      "original_text": "Registerbekanntmachung nach dem Umwandlungsgesetz\nBayern Amtsgericht München HRB 119612\nUGRON Beteiligungs GmbH – Pullach i. Isartal",
      "type": "Registerbekanntmachung nach dem Umwandlungsgesetz",
      "state": "Bayern",
      "amtsgericht": "Amtsgericht München",
      "registernummer": "HRB 119612",
      "registerart": "HRB",
      "company_name": "UGRON Beteiligungs GmbH",
      "company_seat": "Pullach i. Isartal",
      "details": "05.06.2025 (Bekanntmachungsdatum)\n\nBayern Amtsgericht München HRB 119612\nRegisterbekanntmachung nach dem Umwandlungsgesetz 04.06.2025 (Eintragungsdatum)\n\nUGRON Beteiligungs GmbH\nGesellschaft mit beschränkter Haftung\nPullach i. Isartal\n\nDen Gläubigern der an der Verschmelzung beteiligten Rechtsträger ist, wenn sie binnen sechs Monaten nach dem Tag, an dem die Eintragung der Verschmelzung in das Register des Sitzes desjenigen Rechtsträgers, dessen Gläubiger sie sind, nach § 19 Abs. 3 UmwG als bekannt gemacht gilt, ihren Anspruch nach Grund und Höhe in Textform anmelden, Sicherheit zu leisten, soweit sie nicht Befriedigung verlangen können. Dieses Recht steht den Gläubigern jedoch nur zu, wenn sie glaubhaft machen, dass durch die Verschmelzung die Erfüllung ihrer Forderung gefährdet wird."
    },
    {
      "date": "2025-06-05",
      "id": "111264",
      "original_text": "Löschungsankündigung\nBayern Amtsgericht München HRB 196762\nGAL GmbH – Valley",
      "type": "Löschungsankündigung",
      "state": "Bayern",
      "amtsgericht": "Amtsgericht München",
      "registernummer": "HRB 196762",
      "registerart": "HRB",
      "company_name": "GAL GmbH",
      "company_seat": "Valley",
      "details": "05.06.2025 (Bekanntmachungsdatum)\n\nBayern Amtsgericht München HRB 196762\nLöschungsankündigung 03.06.2025 (Eintragungsdatum)\n\nGAL GmbH\nGesellschaft mit beschränkter Haftung\nValley\n\nDas Registergericht beabsichtigt, die im Handelsregister eingetragene Gesellschaft wegen Vermögenslosigkeit von Amts wegen nach § 394 FamFG zu löschen. Die Frist zur Erhebung eines Widerspruchs ist auf drei Monate festgesetzt."
    },
    {
      "date": "2025-06-05",
      "id": "111265",
      "original_text": "Löschungsankündigung\nBayern Amtsgericht München HRB 258151\nBetter Shapes UG (haftungsbeschränkt) – München",
      "type": "Löschungsankündigung",
      "state": "Bayern",
      "amtsgericht": "Amtsgericht München",
      "registernummer": "HRB 258151",
      "registerart": "HRB",
      "company_name": "Better Shapes UG (haftungsbeschränkt)",
      "company_seat": "München",
      "details": "05.06.2025 (Bekanntmachungsdatum)\n\nBayern Amtsgericht München HRB 258151\nLöschungsankündigung 29.05.2025 (Eintragungsdatum)\n\nBetter Shapes UG (haftungsbeschränkt)\nGesellschaft mit beschränkter Haftung\nMünchen\n\nDas Registergericht beabsichtigt, die im Handelsregister eingetragene Gesellschaft wegen Vermögenslosigkeit von Amts wegen nach § 394 FamFG zu löschen. Die Frist zur Erhebung eines Widerspruchs ist auf drei Monate festgesetzt."
    },
    {
      "date": "2025-06-05",
      "id": "111266",
      "original_text": "Registerbekanntmachung nach dem Umwandlungsgesetz\nBayern Amtsgericht Bamberg HRB 7544\nTradero GmbH – Strullendorf",
      "type": "Registerbekanntmachung nach dem Umwandlungsgesetz",
      "state": "Bayern",
      "amtsgericht": "Amtsgericht Bamberg",
      "registernummer": "HRB 7544",
      "registerart": "HRB",
      "company_name": "Tradero GmbH",
      "company_seat": "Strullendorf",
      "details": "05.06.2025 (Bekanntmachungsdatum)\n\nBayern Amtsgericht Bamberg HRB 7544\nRegisterbekanntmachung nach dem Umwandlungsgesetz 04.06.2025 (Eintragungsdatum)\n\nTradero GmbH\nGesellschaft mit beschränkter Haftung\nStrullendorf\n\nDen Gläubigern der an der Verschmelzung beteiligten Rechtsträger ist, wenn sie binnen sechs Monaten nach dem Tag, an dem die Eintragung der Verschmelzung in das Register des Sitzes desjenigen Rechtsträgers, dessen Gläubiger sie sind, nach § 19 Abs. 3 UmwG als bekannt gemacht gilt, ihren Anspruch nach Grund und Höhe in Textform anmelden, Sicherheit zu leisten, soweit sie nicht Befriedigung verlangen können. Dieses Recht steht den Gläubigern jedoch nur zu, wenn sie glaubhaft machen, dass durch die Verschmelzung die Erfüllung ihrer Forderung gefährdet wird."
    },
    {
      "date": "2025-06-05",
      "id": "111267",
      "original_text": "Löschungsankündigung\nBayern Amtsgericht Regensburg HRB 17423\nB2BDEPOT GmbH – Waffenbrunn",
      "type": "Löschungsankündigung",
      "state": "Bayern",
      "amtsgericht": "Amtsgericht Regensburg",
      "registernummer": "HRB 17423",
      "registerart": "HRB",
      "company_name": "B2BDEPOT GmbH",
      "company_seat": "Waffenbrunn",
      "details": "05.06.2025 (Bekanntmachungsdatum)\n\nBayern Amtsgericht Regensburg HRB 17423\nLöschungsankündigung\n\nB2BDEPOT GmbH\nGesellschaft mit beschränkter Haftung\nWaffenbrunn\n\nDas Registergericht beabsichtigt, die im Handelsregister eingetragene Gesellschaft wegen Vermögenslosigkeit von Amts wegen nach § 394 FamFG zu löschen. Die Frist zur Erhebung eines Widerspruchs ist auf zwei Monate festgesetzt."
    },
    {
      "date": "2025-06-05",
      "id": "111268",
      "original_text": "Registerbekanntmachung nach dem Umwandlungsgesetz\nBayern Amtsgericht München HRB 195112\nTALIO Grundstücks-Vermietungsgesellschaft mbH – Pullach i. Isartal",
      "type": "Registerbekanntmachung nach dem Umwandlungsgesetz",
      "state": "Bayern",
      "amtsgericht": "Amtsgericht München",
      "registernummer": "HRB 195112",
      "registerart": "HRB",
      "company_name": "TALIO Grundstücks-Vermietungsgesellschaft mbH",
      "company_seat": "Pullach i. Isartal",
      "details": "05.06.2025 (Bekanntmachungsdatum)\n\nBayern Amtsgericht München HRB 195112\nRegisterbekanntmachung nach dem Umwandlungsgesetz 04.06.2025 (Eintragungsdatum)\n\nTALIO Grundstücks-Vermietungsgesellschaft mbH\nGesellschaft mit beschränkter Haftung\nPullach i. Isartal\n\nDen Gläubigern der an der Verschmelzung beteiligten Rechtsträger ist, wenn sie binnen sechs Monaten nach dem Tag, an dem die Eintragung der Verschmelzung in das Register des Sitzes desjenigen Rechtsträgers, dessen Gläubiger sie sind, nach § 19 Abs. 3 UmwG als bekannt gemacht gilt, ihren Anspruch nach Grund und Höhe in Textform anmelden, Sicherheit zu leisten, soweit sie nicht Befriedigung verlangen können. Dieses Recht steht den Gläubigern jedoch nur zu, wenn sie glaubhaft machen, dass durch die Verschmelzung die Erfüllung ihrer Forderung gefährdet wird."
    },
    {
      "date": "2025-06-05",
      "id": "111269",
      "original_text": "Registerbekanntmachung nach dem Umwandlungsgesetz\nBayern Amtsgericht München HRB 279638\nA.G.E. Service UG (haftungsbeschränkt) – Valley",
      "type": "Registerbekanntmachung nach dem Umwandlungsgesetz",
      "state": "Bayern",
      "amtsgericht": "Amtsgericht München",
      "registernummer": "HRB 279638",
      "registerart": "HRB",
      "company_name": "A.G.E. Service UG (haftungsbeschränkt)",
      "company_seat": "Valley",
      "details": "05.06.2025 (Bekanntmachungsdatum)\n\nBayern Amtsgericht München HRB 279638\nRegisterbekanntmachung nach dem Umwandlungsgesetz 04.06.2025 (Eintragungsdatum)\n\nA.G.E. Service UG (haftungsbeschränkt)\nGesellschaft mit beschränkter Haftung\nValley\n\nDen Gläubigern der an der Verschmelzung beteiligten Rechtsträger ist, wenn sie binnen sechs Monaten nach dem Tag, an dem die Eintragung der Verschmelzung in das Register des Sitzes desjenigen Rechtsträgers, dessen Gläubiger sie sind, nach § 19 Abs. 3 UmwG als bekannt gemacht gilt, ihren Anspruch nach Grund und Höhe in Textform anmelden, Sicherheit zu leisten, soweit sie nicht Befriedigung verlangen können. Dieses Recht steht den Gläubigern jedoch nur zu, wenn sie glaubhaft machen, dass durch die Verschmelzung die Erfüllung ihrer Forderung gefährdet wird."
    },
    {
      "date": "2025-06-05",
      "id": "111270",
      "original_text": "Registerbekanntmachung nach dem Umwandlungsgesetz\nBayern Amtsgericht München HRB 100345\nMaron Beteiligungs GmbH – Pullach i. Isartal",
      "type": "Registerbekanntmachung nach dem Umwandlungsgesetz",
      "state": "Bayern",
      "amtsgericht": "Amtsgericht München",
      "registernummer": "HRB 100345",
      "registerart": "HRB",
      "company_name": "Maron Beteiligungs GmbH",
      "company_seat": "Pullach i. Isartal",
      "details": "05.06.2025 (Bekanntmachungsdatum)\n\nBayern Amtsgericht München HRB 100345\nRegisterbekanntmachung nach dem Umwandlungsgesetz 04.06.2025 (Eintragungsdatum)\n\nMaron Beteiligungs GmbH\nGesellschaft mit beschränkter Haftung\nPullach i. Isartal\n\nDen Gläubigern der an der Verschmelzung beteiligten Rechtsträger ist, wenn sie binnen sechs Monaten nach dem Tag, an dem die Eintragung der Verschmelzung in das Register des Sitzes desjenigen Rechtsträgers, dessen Gläubiger sie sind, nach § 19 Abs. 3 UmwG als bekannt gemacht gilt, ihren Anspruch nach Grund und Höhe in Textform anmelden, Sicherheit zu leisten, soweit sie nicht Befriedigung verlangen können. Dieses Recht steht den Gläubigern jedoch nur zu, wenn sie glaubhaft machen, dass durch die Verschmelzung die Erfüllung ihrer Forderung gefährdet wird."
    },
    {
      "date": "2025-06-05",
      "id": "111271",
      "original_text": "Einreichung neuer Dokumente\nBayern Amtsgericht München HRB 124403\nH.L. Wahrendorf Betonwerke AG – Martinsried, Gemeinde Planegg",
      "type": "Einreichung neuer Dokumente",
      "state": "Bayern",
      "amtsgericht": "Amtsgericht München",
      "registernummer": "HRB 124403",
      "registerart": "HRB",
      "company_name": "H.L. Wahrendorf Betonwerke AG",
      "company_seat": "Martinsried, Gemeinde Planegg",
      "details": "05.06.2025 (Bekanntmachungsdatum)\n\nBayern Amtsgericht München HRB 124403\nEinreichung neuer Dokumente 04.06.2025 (Eintragungsdatum)\n\nH.L. Wahrendorf Betonwerke AG\nAktiengesellschaft\nMartinsried, Gemeinde Planegg\n\nDem Amtsgericht München -Registergericht- ist eine Liste der Mitglieder des Aufsichtsrats eingereicht worden, § 106 AktG."
    },
    {
      "date": "2025-06-05",
      "id": "111272",
      "original_text": "Registerbekanntmachung nach dem Umwandlungsgesetz\nBayern Amtsgericht München HRB 224964\nHeimatglück GmbH – München",
      "type": "Registerbekanntmachung nach dem Umwandlungsgesetz",
      "state": "Bayern",
      "amtsgericht": "Amtsgericht München",
      "registernummer": "HRB 224964",
      "registerart": "HRB",
      "company_name": "Heimatglück GmbH",
      "company_seat": "München",
      "details": "05.06.2025 (Bekanntmachungsdatum)\n\nBayern Amtsgericht München HRB 224964\nRegisterbekanntmachung nach dem Umwandlungsgesetz 04.06.2025 (Eintragungsdatum)\n\nHeimatglück GmbH\nGesellschaft mit beschränkter Haftung\nMünchen\n\nDen Gläubigern der an der Verschmelzung beteiligten Rechtsträger ist, wenn sie binnen sechs Monaten nach dem Tag, an dem die Eintragung der Verschmelzung in das Register des Sitzes desjenigen Rechtsträgers, dessen Gläubiger sie sind, nach § 19 Abs. 3 UmwG als bekannt gemacht gilt, ihren Anspruch nach Grund und Höhe in Textform anmelden, Sicherheit zu leisten, soweit sie nicht Befriedigung verlangen können. Dieses Recht steht den Gläubigern jedoch nur zu, wenn sie glaubhaft machen, dass durch die Verschmelzung die Erfüllung ihrer Forderung gefährdet wird."
    },
    {
      "date": "2025-06-05",
      "id": "111273",
      "original_text": "Registerbekanntmachung nach dem Umwandlungsgesetz\nBayern Amtsgericht München HRB 166921\nJulia Grundstücksverwaltungsgesellschaft mbH – Pullach i. Isartal",
      "type": "Registerbekanntmachung nach dem Umwandlungsgesetz",
      "state": "Bayern",
      "amtsgericht": "Amtsgericht München",
      "registernummer": "HRB 166921",
      "registerart": "HRB",
      "company_name": "Julia Grundstücksverwaltungsgesellschaft mbH",
      "company_seat": "Pullach i. Isartal",
      "details": "05.06.2025 (Bekanntmachungsdatum)\n\nBayern Amtsgericht München HRB 166921\nRegisterbekanntmachung nach dem Umwandlungsgesetz 04.06.2025 (Eintragungsdatum)\n\nJulia Grundstücksverwaltungsgesellschaft mbH\nGesellschaft mit beschränkter Haftung\nPullach i. Isartal\n\nDen Gläubigern der an der Verschmelzung beteiligten Rechtsträger ist, wenn sie binnen sechs Monaten nach dem Tag, an dem die Eintragung der Verschmelzung in das Register des Sitzes desjenigen Rechtsträgers, dessen Gläubiger sie sind, nach § 19 Abs. 3 UmwG als bekannt gemacht gilt, ihren Anspruch nach Grund und Höhe in Textform anmelden, Sicherheit zu leisten, soweit sie nicht Befriedigung verlangen können. Dieses Recht steht den Gläubigern jedoch nur zu, wenn sie glaubhaft machen, dass durch die Verschmelzung die Erfüllung ihrer Forderung gefährdet wird."
    },
    {
      "date": "2025-06-05",
      "id": "111274",
      "original_text": "Einreichung neuer Dokumente\nBayern Amtsgericht Augsburg HRB 81\nWashTec AG – Augsburg",
      "type": "Einreichung neuer Dokumente",
      "state": "Bayern",
      "amtsgericht": "Amtsgericht Augsburg",
      "registernummer": "HRB 81",
      "registerart": "HRB",
      "company_name": "WashTec AG",
      "company_seat": "Augsburg",
      "details": "05.06.2025 (Bekanntmachungsdatum)\n\nBayern Amtsgericht Augsburg HRB 81\nEinreichung neuer Dokumente\n\nWashTec AG\nAktiengesellschaft\nAugsburg\n\nDem Amtsgericht Augsburg -Registergericht- ist eine Liste der Mitglieder des Aufsichtsrats eingereicht worden, § 106 AktG."
    },
    {
      "date": "2025-06-05",
      "id": "111275",
      "original_text": "Registerbekanntmachung nach dem Umwandlungsgesetz\nBayern Amtsgericht Hof HRA 4547\nFischer Holding GmbH & Co. KG – Köditz",
      "type": "Registerbekanntmachung nach dem Umwandlungsgesetz",
      "state": "Bayern",
      "amtsgericht": "Amtsgericht Hof",
      "registernummer": "HRA 4547",
      "registerart": "HRA",
      "company_name": "Fischer Holding GmbH & Co. KG",
      "company_seat": "Köditz",
      "details": "05.06.2025 (Bekanntmachungsdatum)\n\nBayern Amtsgericht Hof HRA 4547\nRegisterbekanntmachung nach dem Umwandlungsgesetz 04.06.2025 (Eintragungsdatum)\n\nFischer Holding GmbH & Co. KG\nKommanditgesellschaft\nKöditz\n\nDen Gläubigern des formwechselnden Rechtsträgers ist, wenn sie binnen sechs Monaten nach dem Tag, an dem die Eintragung des Formwechsels nach § 201 UmwG als bekannt gemacht gilt, ihren Anspruch nach Grund und Höhe in Textform anmelden, Sicherheit zu leisten, soweit sie nicht Befriedigung verlangen können. Dieses Recht steht den Gläubigern jedoch nur zu, wenn sie glaubhaft machen, dass durch den Formwechsel die Erfüllung ihrer Forderung gefährdet wird."
    },
    {
      "date": "2025-06-05",
      "id": "111276",
      "original_text": "Registerbekanntmachung nach dem Umwandlungsgesetz\nBayern Amtsgericht Bamberg HRB 10463\nBierothek Marketplace GmbH – Bamberg",
      "type": "Registerbekanntmachung nach dem Umwandlungsgesetz",
      "state": "Bayern",
      "amtsgericht": "Amtsgericht Bamberg",
      "registernummer": "HRB 10463",
      "registerart": "HRB",
      "company_name": "Bierothek Marketplace GmbH",
      "company_seat": "Bamberg",
      "details": "05.06.2025 (Bekanntmachungsdatum)\n\nBayern Amtsgericht Bamberg HRB 10463\nRegisterbekanntmachung nach dem Umwandlungsgesetz 04.06.2025 (Eintragungsdatum)\n\nBierothek Marketplace GmbH\nGesellschaft mit beschränkter Haftung\nBamberg\n\nDen Gläubigern der an der Verschmelzung beteiligten Rechtsträger ist, wenn sie binnen sechs Monaten nach dem Tag, an dem die Eintragung der Verschmelzung in das Register des Sitzes desjenigen Rechtsträgers, dessen Gläubiger sie sind, nach § 19 Abs. 3 UmwG als bekannt gemacht gilt, ihren Anspruch nach Grund und Höhe in Textform anmelden, Sicherheit zu leisten, soweit sie nicht Befriedigung verlangen können. Dieses Recht steht den Gläubigern jedoch nur zu, wenn sie glaubhaft machen, dass durch die Verschmelzung die Erfüllung ihrer Forderung gefährdet wird."
    },
    {
      "date": "2025-06-05",
      "id": "111277",
      "original_text": "Registerbekanntmachung nach dem Umwandlungsgesetz\nBayern Amtsgericht Passau HRB 8854\nDelta Project GmbH – Vilshofen an der Donau",
      "type": "Registerbekanntmachung nach dem Umwandlungsgesetz",
      "state": "Bayern",
      "amtsgericht": "Amtsgericht Passau",
      "registernummer": "HRB 8854",
      "registerart": "HRB",
      "company_name": "Delta Project GmbH",
      "company_seat": "Vilshofen an der Donau",
      "details": "05.06.2025 (Bekanntmachungsdatum)\n\nBayern Amtsgericht Passau HRB 8854\nRegisterbekanntmachung nach dem Umwandlungsgesetz 04.06.2025 (Eintragungsdatum)\n\nDelta Project GmbH\nGesellschaft mit beschränkter Haftung\nVilshofen an der Donau\n\nDen Gläubigern der an der Verschmelzung beteiligten Rechtsträger ist, wenn sie binnen sechs Monaten nach dem Tag, an dem die Eintragung der Verschmelzung in das Register des Sitzes desjenigen Rechtsträgers, dessen Gläubiger sie sind, nach § 19 Abs. 3 UmwG als bekannt gemacht gilt, ihren Anspruch nach Grund und Höhe in Textform anmelden, Sicherheit zu leisten, soweit sie nicht Befriedigung verlangen können. Dieses Recht steht den Gläubigern jedoch nur zu, wenn sie glaubhaft machen, dass durch die Verschmelzung die Erfüllung ihrer Forderung gefährdet wird."
    },
    {
      "date": "2025-06-05",
      "id": "111278",
      "original_text": "Registerbekanntmachung nach dem Umwandlungsgesetz\nBayern Amtsgericht Bamberg HRB 9893\nTradero GmbH – Strullendorf",
      "type": "Registerbekanntmachung nach dem Umwandlungsgesetz",
      "state": "Bayern",
      "amtsgericht": "Amtsgericht Bamberg",
      "registernummer": "HRB 9893",
      "registerart": "HRB",
      "company_name": "Tradero GmbH",
      "company_seat": "Strullendorf",
      "details": "05.06.2025 (Bekanntmachungsdatum)\n\nBayern Amtsgericht Bamberg HRB 9893\nRegisterbekanntmachung nach dem Umwandlungsgesetz 04.06.2025 (Eintragungsdatum)\n\nTradero GmbH\nGesellschaft mit beschränkter Haftung\nStrullendorf\n\nDen Gläubigern der an der Verschmelzung beteiligten Rechtsträger ist, wenn sie binnen sechs Monaten nach dem Tag, an dem die Eintragung der Verschmelzung in das Register des Sitzes desjenigen Rechtsträgers, dessen Gläubiger sie sind, nach § 19 Abs. 3 UmwG als bekannt gemacht gilt, ihren Anspruch nach Grund und Höhe in Textform anmelden, Sicherheit zu leisten, soweit sie nicht Befriedigung verlangen können. Dieses Recht steht den Gläubigern jedoch nur zu, wenn sie glaubhaft machen, dass durch die Verschmelzung die Erfüllung ihrer Forderung gefährdet wird."
    },
    {
      "date": "2025-06-05",
      "id": "111279",
      "original_text": "Registerbekanntmachung nach dem Umwandlungsgesetz\nBayern Amtsgericht Würzburg VR 30703\nMusikverein Frammersbach. e.V. – Frammersbach",
      "type": "Registerbekanntmachung nach dem Umwandlungsgesetz",
      "state": "Bayern",
      "amtsgericht": "Amtsgericht Würzburg",
      "registernummer": "VR 30703",
      "registerart": "VR",
      "company_name": "Musikverein Frammersbach. e.V.",
      "company_seat": "Frammersbach",
      "details": "05.06.2025 (Bekanntmachungsdatum)\n\nBayern Amtsgericht Würzburg VR 30703\nRegisterbekanntmachung nach dem Umwandlungsgesetz 04.06.2025 (Eintragungsdatum)\n\nMusikverein Frammersbach. e.V.\neingetragener Verein\nFrammersbach\n\nDen Gläubigern der an der Verschmelzung beteiligten Rechtsträger ist, wenn sie binnen sechs Monaten nach dem Tag, an dem die Eintragung der Verschmelzung in das Register des Sitzes desjenigen Rechtsträgers, dessen Gläubiger sie sind, nach § 19 Abs. 3 UmwG als bekannt gemacht gilt, ihren Anspruch nach Grund und Höhe in Textform anmelden, Sicherheit zu leisten, soweit sie nicht Befriedigung verlangen können. Dieses Recht steht den Gläubigern jedoch nur zu, wenn sie glaubhaft machen, dass durch die Verschmelzung die Erfüllung ihrer Forderung gefährdet wird."
    },
    {
      "date": "2025-06-05",
      "id": "111280",
      "original_text": "Registerbekanntmachung nach dem Umwandlungsgesetz\nBaden-Württemberg Amtsgericht Stuttgart HRB 785574\nFitness United Ettlingen GmbH – Fellbach",
      "type": "Registerbekanntmachung nach dem Umwandlungsgesetz",
      "state": "Baden-Württemberg",
      "amtsgericht": "Amtsgericht Stuttgart",
      "registernummer": "HRB 785574",
      "registerart": "HRB",
      "company_name": "Fitness United Ettlingen GmbH",
      "company_seat": "Fellbach",
      "details": "05.06.2025 (Bekanntmachungsdatum)\n\nBaden-Württemberg Amtsgericht Stuttgart HRB 785574\nRegisterbekanntmachung nach dem Umwandlungsgesetz 05.06.2025 (Eintragungsdatum)\n\nFitness United Ettlingen GmbH\nGesellschaft mit beschränkter Haftung\nFellbach\n\nDen Gläubigern der an der Verschmelzung beteiligten Rechtsträger ist, wenn sie binnen sechs Monaten nach dem Tag, an dem die Eintragung der Verschmelzung in das Register des Sitzes desjenigen Rechtsträgers, dessen Gläubiger sie sind, nach § 19 Abs. 3 UmwG als bekanntgemacht gilt, ihren Anspruch nach Grund und Höhe schriftlich anmelden, Sicherheit zu leisten, soweit sie nicht Befriedigung verlangen können. Dieses Recht steht den Gläubigern jedoch nur zu, wenn sie glaubhaft machen, dass durch die Verschmelzung die Erfüllung ihrer Forderung gefährdet wird."
    },
    {
      "date": "2025-06-05",
      "id": "111281",
      "original_text": "Registerbekanntmachung nach dem Umwandlungsgesetz\nBaden-Württemberg Amtsgericht Stuttgart HRB 744176\ncf Fitness Bad Rappenau GmbH – Bad Rappenau",
      "type": "Registerbekanntmachung nach dem Umwandlungsgesetz",
      "state": "Baden-Württemberg",
      "amtsgericht": "Amtsgericht Stuttgart",
      "registernummer": "HRB 744176",
      "registerart": "HRB",
      "company_name": "cf Fitness Bad Rappenau GmbH",
      "company_seat": "Bad Rappenau",
      "details": "05.06.2025 (Bekanntmachungsdatum)\n\nBaden-Württemberg Amtsgericht Stuttgart HRB 744176\nRegisterbekanntmachung nach dem Umwandlungsgesetz 05.06.2025 (Eintragungsdatum)\n\ncf Fitness Bad Rappenau GmbH\nGesellschaft mit beschränkter Haftung\nBad Rappenau\n\nDen Gläubigern der an der Verschmelzung beteiligten Rechtsträger ist, wenn sie binnen sechs Monaten nach dem Tag, an dem die Eintragung der Verschmelzung in das Register des Sitzes desjenigen Rechtsträgers, dessen Gläubiger sie sind, nach § 19 Abs. 3 UmwG als bekanntgemacht gilt, ihren Anspruch nach Grund und Höhe schriftlich anmelden, Sicherheit zu leisten, soweit sie nicht Befriedigung verlangen können. Dieses Recht steht den Gläubigern jedoch nur zu, wenn sie glaubhaft machen, dass durch die Verschmelzung die Erfüllung ihrer Forderung gefährdet wird."
    },
    {
      "date": "2025-06-05",
      "id": "111282",
      "original_text": "Löschungsankündigung\nBaden-Württemberg Amtsgericht Mannheim HRB 717167\nCAPH GmbH – Achern",
      "type": "Löschungsankündigung",
      "state": "Baden-Württemberg",
      "amtsgericht": "Amtsgericht Mannheim",
      "registernummer": "HRB 717167",
      "registerart": "HRB",
      "company_name": "CAPH GmbH",
      "company_seat": "Achern",
      "details": "05.06.2025 (Bekanntmachungsdatum)\n\nBaden-Württemberg Amtsgericht Mannheim HRB 717167\nLöschungsankündigung\n\nCAPH GmbH\nGesellschaft mit beschränkter Haftung\nAchern\n\nDas Gericht beabsichtigt, die Gesellschaft wegen Vermögenslosigkeit im Handelsregister von Amts wegen nach § 394 FamFG zu löschen. Die Frist zur Geltendmachung eines Widerspruchs gegen die beabsichtigte Löschung ist auf einen Monat ab Veröffentlichung bestimmt."
    },
    {
      "date": "2025-06-05",
      "id": "111283",
      "original_text": "Löschungsankündigung\nMecklenburg-Vorpommern Amtsgericht Rostock HRB 16213\nMaBa Gastro Concepts UG (haftungsbeschränkt) – Rostock",
      "type": "Löschungsankündigung",
      "state": "Mecklenburg-Vorpommern",
      "amtsgericht": "Amtsgericht Rostock",
      "registernummer": "HRB 16213",
      "registerart": "HRB",
      "company_name": "MaBa Gastro Concepts UG (haftungsbeschränkt)",
      "company_seat": "Rostock",
      "details": "05.06.2025 (Bekanntmachungsdatum)\n\nMecklenburg-Vorpommern Amtsgericht Rostock HRB 16213\nLöschungsankündigung\n\nMaBa Gastro Concepts UG (haftungsbeschränkt)\nGesellschaft mit beschränkter Haftung\nRostock\n\nDas Registergericht beabsichtigt, die im Handelsregister eingetragene Gesellschaft von Amts wegen nach § 394 FamFG zu löschen. Die Frist zur Erhebung eines Widerspruchs gegen die beabsichtigte Löschung wird auf einen Monat festgesetzt."
    },
    {
      "date": "2025-06-05",
      "id": "111284",
      "original_text": "Einreichung neuer Dokumente\nBaden-Württemberg Amtsgericht Mannheim HRB 560227\nMichael Weinig Aktiengesellschaft – Tauberbischofsheim",
      "type": "Einreichung neuer Dokumente",
      "state": "Baden-Württemberg",
      "amtsgericht": "Amtsgericht Mannheim",
      "registernummer": "HRB 560227",
      "registerart": "HRB",
      "company_name": "Michael Weinig Aktiengesellschaft",
      "company_seat": "Tauberbischofsheim",
      "details": "05.06.2025 (Bekanntmachungsdatum)\n\nBaden-Württemberg Amtsgericht Mannheim HRB 560227\nEinreichung neuer Dokumente\n\nMichael Weinig Aktiengesellschaft\nAktiengesellschaft\nTauberbischofsheim\n\nDie Gesellschaft hat am 04.06.2025 die Liste über die Zusammensetzung des Aufsichtsrats zum Handelsregister eingereicht."
    },
    {
      "date": "2025-06-05",
      "id": "111285",
      "original_text": "Registerbekanntmachung nach dem Umwandlungsgesetz\nBerlin Amtsgericht Berlin (Charlottenburg) HRB 140968\nNihul Facility Services GmbH – Berlin",
      "type": "Registerbekanntmachung nach dem Umwandlungsgesetz",
      "state": "Berlin",
      "amtsgericht": "Amtsgericht Berlin (Charlottenburg)",
      "registernummer": "HRB 140968",
      "registerart": "HRB",
      "company_name": "Nihul Facility Services GmbH",
      "company_seat": "Berlin",
      "details": "05.06.2025 (Bekanntmachungsdatum)\n\nBerlin Amtsgericht Berlin (Charlottenburg) HRB 140968\nRegisterbekanntmachung nach dem Umwandlungsgesetz 04.06.2025 (Eintragungsdatum)\n\nNihul Facility Services GmbH\nGesellschaft mit beschränkter Haftung\nBerlin\n\nZu Eintragungsnummer 9 vom 04.06.2025 wird als nicht eingetragen veröffentlicht:Den Gläubigern der an der Verschmelzung beteiligten Rechtsträger ist, wenn sie binnen sechs Monaten nach dem Tag, an dem die Eintragung der Verschmelzung in das Register des Sitzes desjenigen Rechtsträgers, dessen Gläubiger sie sind, als bekannt gemacht gilt, ihren Anspruch nach Grund und Höhe schriftlich anmelden, Sicherheit zu leisten, soweit sie nicht Befriedigung verlangen können. Dieses Recht steht den Gläubigern jedoch nur zu, wenn sie glaubhaft machen, dass durch die Verschmelzung die Erfüllung ihrer Forderung gefährdet wird. Das Recht, Sicherheitsleistung zu verlangen, steht Gläubigern nicht zu, die im Falle der Insolvenz ein Recht auf vorzugsweise Befriedigung aus einer Deckungsmasse haben, die nach gesetzlicher Vorschrift zu ihrem Schutz errichtet und staatlich überwacht ist."
    },
    {
      "date": "2025-06-05",
      "id": "111286",
      "original_text": "Registerbekanntmachung nach dem Umwandlungsgesetz\nBaden-Württemberg Amtsgericht Mannheim HRA 712626\nPro Concept Projektbau Beethovenstraße GmbH & Co. KG – Mannheim",
      "type": "Registerbekanntmachung nach dem Umwandlungsgesetz",
      "state": "Baden-Württemberg",
      "amtsgericht": "Amtsgericht Mannheim",
      "registernummer": "HRA 712626",
      "registerart": "HRA",
      "company_name": "Pro Concept Projektbau Beethovenstraße GmbH & Co. KG",
      "company_seat": "Mannheim",
      "details": "05.06.2025 (Bekanntmachungsdatum)\n\nBaden-Württemberg Amtsgericht Mannheim HRA 712626\nRegisterbekanntmachung nach dem Umwandlungsgesetz 05.06.2025 (Eintragungsdatum)\n\nPro Concept Projektbau Beethovenstraße GmbH & Co. KG\nKommanditgesellschaft\nMannheim\n\nAls nicht eingetragen wird bekanntgemacht: Den Gläubigern des an dem Formwechsel beteiligten Rechtsträgers ist, wenn sie binnen sechs Monaten nach dem Tag, an dem die Eintragung des Formwechsels in das Register des Sitzes desjenigen Rechtsträgers, dessen Gläubiger sie sind, nach § 19 Abs. 3 UmwG als bekanntgemacht gilt, ihren Anspruch nach Grund und Höhe schriftlich anmelden, Sicherheit zu leisten, soweit sie nicht Befriedigung verlangen können. Dieses Recht steht den Gläubigern jedoch nur zu, wenn sie glaubhaft machen, dass durch den Formwechsel die Erfüllung ihrer Forderung gefährdet wird."
    },
    {
      "date": "2025-06-05",
      "id": "111287",
      "original_text": "Registerbekanntmachung nach dem Umwandlungsgesetz\nBaden-Württemberg Amtsgericht Stuttgart HRB 769026\naccipere GmbH – Heilbronn",
      "type": "Registerbekanntmachung nach dem Umwandlungsgesetz",
      "state": "Baden-Württemberg",
      "amtsgericht": "Amtsgericht Stuttgart",
      "registernummer": "HRB 769026",
      "registerart": "HRB",
      "company_name": "accipere GmbH",
      "company_seat": "Heilbronn",
      "details": "05.06.2025 (Bekanntmachungsdatum)\n\nBaden-Württemberg Amtsgericht Stuttgart HRB 769026\nRegisterbekanntmachung nach dem Umwandlungsgesetz 05.06.2025 (Eintragungsdatum)\n\naccipere GmbH\nGesellschaft mit beschränkter Haftung\nHeilbronn\n\nAls nicht eingetragen wird bekanntgemacht:\nDen Gläubigern der an der Verschmelzung beteiligten Rechtsträger ist, wenn sie binnen sechs Monaten nach dem Tag, an dem die Eintragung der Verschmelzung in das Register des Sitzes desjenigen Rechtsträgers, dessen Gläubiger sie sind, nach § 19 Abs. 3 UmwG als bekanntgemacht gilt, ihren Anspruch nach Grund und Höhe schriftlich anmelden, Sicherheit zu leisten, soweit sie nicht Befriedigung verlangen können. Dieses Recht steht den Gläubigern jedoch nur zu, wenn sie glaubhaft machen, dass durch die Verschmelzung die Erfüllung ihrer Forderung gefährdet wird."
    },
    {
      "date": "2025-06-05",
      "id": "111288",
      "original_text": "Registerbekanntmachung nach dem Umwandlungsgesetz\nBerlin Amtsgericht Berlin (Charlottenburg) HRB 124236\nGrand City Property GmbH – Berlin",
      "type": "Registerbekanntmachung nach dem Umwandlungsgesetz",
      "state": "Berlin",
      "amtsgericht": "Amtsgericht Berlin (Charlottenburg)",
      "registernummer": "HRB 124236",
      "registerart": "HRB",
      "company_name": "Grand City Property GmbH",
      "company_seat": "Berlin",
      "details": "05.06.2025 (Bekanntmachungsdatum)\n\nBerlin Amtsgericht Berlin (Charlottenburg) HRB 124236\nRegisterbekanntmachung nach dem Umwandlungsgesetz 04.06.2025 (Eintragungsdatum)\n\nGrand City Property GmbH\nGesellschaft mit beschränkter Haftung\nBerlin\n\nZu Eintragungsnummer 10 vom 04.06.2025 wird als nicht eingetragen veröffentlicht:Den Gläubigern der an der Verschmelzung beteiligten Rechtsträger ist, wenn sie binnen sechs Monaten nach dem Tag, an dem die Eintragung der Verschmelzung in das Register des Sitzes desjenigen Rechtsträgers, dessen Gläubiger sie sind, als bekannt gemacht gilt, ihren Anspruch nach Grund und Höhe schriftlich anmelden, Sicherheit zu leisten, soweit sie nicht Befriedigung verlangen können. Dieses Recht steht den Gläubigern jedoch nur zu, wenn sie glaubhaft machen, dass durch die Verschmelzung die Erfüllung ihrer Forderung gefährdet wird. Das Recht, Sicherheitsleistung zu verlangen, steht Gläubigern nicht zu, die im Falle der Insolvenz ein Recht auf vorzugsweise Befriedigung aus einer Deckungsmasse haben, die nach gesetzlicher Vorschrift zu ihrem Schutz errichtet und staatlich überwacht ist."
    },
    {
      "date": "2025-06-05",
      "id": "111289",
      "original_text": "Registerbekanntmachung nach dem Umwandlungsgesetz\nHamburg Amtsgericht Hamburg HRB 180005\nERG Hamburg Holding GmbH – Hamburg",
      "type": "Registerbekanntmachung nach dem Umwandlungsgesetz",
      "state": "Hamburg",
      "amtsgericht": "Amtsgericht Hamburg",
      "registernummer": "HRB 180005",
      "registerart": "HRB",
      "company_name": "ERG Hamburg Holding GmbH",
      "company_seat": "Hamburg",
      "details": "05.06.2025 (Bekanntmachungsdatum)\n\nHamburg Amtsgericht Hamburg HRB 180005\nRegisterbekanntmachung nach dem Umwandlungsgesetz\n\nERG Hamburg Holding GmbH\nGesellschaft mit beschränkter Haftung\nHamburg\n\nAls nicht eingetragen wird bekanntgemacht:\nEs wird darauf hingewiesen, dass ein Verschmelzungsplan oder sein Entwurf über eine grenzüberschreitende Verschmelzung zur Aufnahme mit der ERG Spain Holdco, S.L.U. mit Sitz in Madrid/Spanien (Registro Mercantil de Madrid 067715946) (sociedad de responsabilidad limitada - Gesellschaft mit beschränkter Haftung nach spanischem Recht) beim Handelsregister eingereicht worden ist.\nDie Anteilsinhaber, die Gläubiger sowie die zuständigen Betriebsräte der an der grenzüberschreitenden Verschmelzung beteiligten Gesellschaften oder, soweit es keinen Betriebsrat gibt, die Arbeitnehmer der an der grenzüberschreitenden Verschmelzung beteiligten Gesellschaften, können der jeweiligen Gesellschaft spätestens fünf Arbeitstage vor dem Tag der Beurkundung des Verschmelzungsplans Bemerkungen zum Verschmelzungsplan übermitteln."
    },
    {
      "date": "2025-06-05",
      "id": "111290",
      "original_text": "Registerbekanntmachung nach dem Umwandlungsgesetz\nBaden-Württemberg Amtsgericht Mannheim HRB 730968\nPro Concept Projektbau Beethovenstraße GmbH – Mannheim",
      "type": "Registerbekanntmachung nach dem Umwandlungsgesetz",
      "state": "Baden-Württemberg",
      "amtsgericht": "Amtsgericht Mannheim",
      "registernummer": "HRB 730968",
      "registerart": "HRB",
      "company_name": "Pro Concept Projektbau Beethovenstraße GmbH",
      "company_seat": "Mannheim",
      "details": "05.06.2025 (Bekanntmachungsdatum)\n\nBaden-Württemberg Amtsgericht Mannheim HRB 730968\nRegisterbekanntmachung nach dem Umwandlungsgesetz 05.06.2025 (Eintragungsdatum)\n\nPro Concept Projektbau Beethovenstraße GmbH\nGesellschaft mit beschränkter Haftung\nMannheim\n\nAls nicht eingetragen wird bekanntgemacht: Den Gläubigern des an dem Formwechsel beteiligten Rechtsträgers ist, wenn sie binnen sechs Monaten nach dem Tag, an dem die Eintragung des Formwechsels in das Register des Sitzes desjenigen Rechtsträgers, dessen Gläubiger sie sind, nach § 19 Abs. 3 UmwG als bekanntgemacht gilt, ihren Anspruch nach Grund und Höhe schriftlich anmelden, Sicherheit zu leisten, soweit sie nicht Befriedigung verlangen können. Dieses Recht steht den Gläubigern jedoch nur zu, wenn sie glaubhaft machen, dass durch den Formwechsel die Erfüllung ihrer Forderung gefährdet wird."
    },
    {
      "date": "2025-06-05",
      "id": "111291",
      "original_text": "Einreichung neuer Dokumente\nSaarland Amtsgericht Saarbrücken HRB 12702\nEnergie SaarLorLux AG – Saarbrücken",
      "type": "Einreichung neuer Dokumente",
      "state": "Saarland",
      "amtsgericht": "Amtsgericht Saarbrücken",
      "registernummer": "HRB 12702",
      "registerart": "HRB",
      "company_name": "Energie SaarLorLux AG",
      "company_seat": "Saarbrücken",
      "details": "05.06.2025 (Bekanntmachungsdatum)\n\nSaarland Amtsgericht Saarbrücken HRB 12702\nEinreichung neuer Dokumente\n\nEnergie SaarLorLux AG\nAktiengesellschaft\nSaarbrücken\n\nDer Vorstand der Gesellschaft hat eine Liste der Mitglieder des Aufsichtsrats zum Handelsregister eingereicht (§ 106 AktG)."
    },
    {
      "date": "2025-06-05",
      "id": "111292",
      "original_text": "Sonstige Registerbekanntmachung\nBaden-Württemberg Amtsgericht Mannheim HRB 709193\nAX Business Solutions AG – Karlsbad",
      "type": "Sonstige Registerbekanntmachung",
      "state": "Baden-Württemberg",
      "amtsgericht": "Amtsgericht Mannheim",
      "registernummer": "HRB 709193",
      "registerart": "HRB",
      "company_name": "AX Business Solutions AG",
      "company_seat": "Karlsbad",
      "details": "05.06.2025 (Bekanntmachungsdatum)\n\nBaden-Württemberg Amtsgericht Mannheim HRB 709193\nSonstige Registerbekanntmachung 05.06.2025 (Eintragungsdatum)\n\nAX Business Solutions AG\nAktiengesellschaft\nKarlsbad\n\nAls nicht eingetragen wird bekanntgemacht:\nDen Gläubigern, deren Forderungen begründet worden sind, bevor die Eintragung des Beschlusses bekanntgemacht worden ist, ist, wenn sie sich binnen sechs Monaten nach der Bekanntmachung zu diesem Zweck melden, Sicherheit zu leisten, soweit sie nicht Befriedigung verlangen können."
    },
    {
      "date": "2025-06-05",
      "id": "111293",
      "original_text": "Registerbekanntmachung nach dem Umwandlungsgesetz\nBaden-Württemberg Amtsgericht Mannheim HRA 712533\nES Catering Gemeinschaftsverpflegung, Catering Service e. K. – Weingarten Baden",
      "type": "Registerbekanntmachung nach dem Umwandlungsgesetz",
      "state": "Baden-Württemberg",
      "amtsgericht": "Amtsgericht Mannheim",
      "registernummer": "HRA 712533",
      "registerart": "HRA",
      "company_name": "ES Catering Gemeinschaftsverpflegung, Catering Service e. K.",
      "company_seat": "Weingarten Baden",
      "details": "05.06.2025 (Bekanntmachungsdatum)\n\nBaden-Württemberg Amtsgericht Mannheim HRA 712533\nRegisterbekanntmachung nach dem Umwandlungsgesetz 05.06.2025 (Eintragungsdatum)\n\nES Catering Gemeinschaftsverpflegung, Catering Service e. K.\nEinzelkaufmann / Einzelkauffrau\nWeingarten Baden\n\nAls nicht eingetragen wird bekanntgemacht:\nDen Gläubigern der an der Ausgliederung beteiligten Rechtsträger ist, wenn sie binnen sechs Monaten nach dem Tag, an dem die Eintragung der Ausgliederung in das Register des Sitzes desjenigen Rechtsträgers, dessen Gläubiger sie sind, nach § 19 Abs. 3 UmwG als bekanntgemacht gilt, ihren Anspruch nach Grund und Höhe schriftlich anmelden, Sicherheit zu leisten, soweit sie nicht Befriedigung verlangen können. Dieses Recht steht den Gläubigern jedoch nur zu, wenn sie glaubhaft machen, dass durch die Ausgliederung die Erfüllung ihrer Forderung gefährdet wird."
    },
    {
      "date": "2025-06-05",
      "id": "111294",
      "original_text": "Löschungsankündigung\nBerlin Amtsgericht Berlin (Charlottenburg) HRA 15621\nAnke Starmann Verlag – Berlin",
      "type": "Löschungsankündigung",
      "state": "Berlin",
      "amtsgericht": "Amtsgericht Berlin (Charlottenburg)",
      "registernummer": "HRA 15621",
      "registerart": "HRA",
      "company_name": "Anke Starmann Verlag",
      "company_seat": "Berlin",
      "details": "05.06.2025 (Bekanntmachungsdatum)\n\nBerlin Amtsgericht Berlin (Charlottenburg) HRA 15621\nLöschungsankündigung\n\nAnke Starmann Verlag\nEinzelkaufmann / Einzelkauffrau\nBerlin\n\nBei dem nachstehenden Unternehmen / der nachstehenden Gesellschaft wird das Amtslöschungsverfahren gemäß § 31 Abs. 2 HGB eingeleitet. Widerspruchsfrist 6 Wochen"
    },
    {
      "date": "2025-06-05",
      "id": "111295",
      "original_text": "Registerbekanntmachung nach dem Umwandlungsgesetz\nBaden-Württemberg Amtsgericht Mannheim HRB 739813\nES catering GmbH – Weingarten (Baden)",
      "type": "Registerbekanntmachung nach dem Umwandlungsgesetz",
      "state": "Baden-Württemberg",
      "amtsgericht": "Amtsgericht Mannheim",
      "registernummer": "HRB 739813",
      "registerart": "HRB",
      "company_name": "ES catering GmbH",
      "company_seat": "Weingarten (Baden)",
      "details": "05.06.2025 (Bekanntmachungsdatum)\n\nBaden-Württemberg Amtsgericht Mannheim HRB 739813\nRegisterbekanntmachung nach dem Umwandlungsgesetz 05.06.2025 (Eintragungsdatum)\n\nES catering GmbH\nGesellschaft mit beschränkter Haftung\nWeingarten (Baden)\n\nAls nicht eingetragen wird bekanntgemacht:\nDen Gläubigern der an der Ausgliederung beteiligten Rechtsträger ist, wenn sie binnen sechs Monaten nach dem Tag, an dem die Eintragung der Ausgliederung in das Register des Sitzes desjenigen Rechtsträgers, dessen Gläubiger sie sind, nach § 19 Abs. 3 UmwG als bekanntgemacht gilt, ihren Anspruch nach Grund und Höhe schriftlich anmelden, Sicherheit zu leisten, soweit sie nicht Befriedigung verlangen können. Dieses Recht steht den Gläubigern jedoch nur zu, wenn sie glaubhaft machen, dass durch die Ausgliederung die Erfüllung ihrer Forderung gefährdet wird."
    },
    {
      "date": "2025-06-05",
      "id": "111296",
      "original_text": "Registerbekanntmachung nach dem Umwandlungsgesetz\nBaden-Württemberg Amtsgericht Mannheim VR 100895\nCLUB DER TENNISFREUNDE Karlsruhe e.V. – Karlsruhe",
      "type": "Registerbekanntmachung nach dem Umwandlungsgesetz",
      "state": "Baden-Württemberg",
      "amtsgericht": "Amtsgericht Mannheim",
      "registernummer": "VR 100895",
      "registerart": "VR",
      "company_name": "CLUB DER TENNISFREUNDE Karlsruhe e.V.",
      "company_seat": "Karlsruhe",
      "details": "05.06.2025 (Bekanntmachungsdatum)\n\nBaden-Württemberg Amtsgericht Mannheim VR 100895\nRegisterbekanntmachung nach dem Umwandlungsgesetz 05.06.2025 (Eintragungsdatum)\n\nCLUB DER TENNISFREUNDE Karlsruhe e.V.\neingetragener Verein\nKarlsruhe\n\nAls nicht eingetragen wird bekanntgemacht:\nDen Gläubigern der an der Verschmelzung beteiligten Rechtsträger ist, wenn sie binnen sechs Monaten nach dem Tag, an dem die Eintragung der Verschmelzung in das Register des Sitzes desjenigen Rechtsträgers, dessen Gläubiger sie sind, nach § 19 Abs. 3 UmwG als bekanntgemacht gilt, ihren Anspruch nach Grund und Höhe schriftlich anmelden, Sicherheit zu leisten, soweit sie nicht Befriedigung verlangen können. Dieses Recht steht den Gläubigern jedoch nur zu, wenn sie glaubhaft machen, dass durch die Verschmelzung die Erfüllung ihrer Forderung gefährdet wird."
    },
    {
      "date": "2025-06-05",
      "id": "111297",
      "original_text": "Registerbekanntmachung nach dem Umwandlungsgesetz\nBaden-Württemberg Amtsgericht Stuttgart HRB 763146\nFitness United Fellbach GmbH – Fellbach",
      "type": "Registerbekanntmachung nach dem Umwandlungsgesetz",
      "state": "Baden-Württemberg",
      "amtsgericht": "Amtsgericht Stuttgart",
      "registernummer": "HRB 763146",
      "registerart": "HRB",
      "company_name": "Fitness United Fellbach GmbH",
      "company_seat": "Fellbach",
      "details": "05.06.2025 (Bekanntmachungsdatum)\n\nBaden-Württemberg Amtsgericht Stuttgart HRB 763146\nRegisterbekanntmachung nach dem Umwandlungsgesetz 05.06.2025 (Eintragungsdatum)\n\nFitness United Fellbach GmbH\nGesellschaft mit beschränkter Haftung\nFellbach\n\nAls nicht eingetragen wird bekanntgemacht:\nDen Gläubigern der an der Verschmelzung beteiligten Rechtsträger ist, wenn sie binnen sechs Monaten nach dem Tag, an dem die Eintragung der Verschmelzung in das Register des Sitzes desjenigen Rechtsträgers, dessen Gläubiger sie sind, nach § 19 Abs. 3 UmwG als bekanntgemacht gilt, ihren Anspruch nach Grund und Höhe schriftlich anmelden, Sicherheit zu leisten, soweit sie nicht Befriedigung verlangen können. Dieses Recht steht den Gläubigern jedoch nur zu, wenn sie glaubhaft machen, dass durch die Verschmelzung die Erfüllung ihrer Forderung gefährdet wird."
    },
    {
      "date": "2025-06-05",
      "id": "111298",
      "original_text": "Löschungsankündigung\nBerlin Amtsgericht Berlin (Charlottenburg) HRA 47336\nTrident Cars Export Service GmbH & Co. KG – Berlin",
      "type": "Löschungsankündigung",
      "state": "Berlin",
      "amtsgericht": "Amtsgericht Berlin (Charlottenburg)",
      "registernummer": "HRA 47336",
      "registerart": "HRA",
      "company_name": "Trident Cars Export Service GmbH & Co. KG",
      "company_seat": "Berlin",
      "details": "05.06.2025 (Bekanntmachungsdatum)\n\nBerlin Amtsgericht Berlin (Charlottenburg) HRA 47336\nLöschungsankündigung\n\nTrident Cars Export Service GmbH & Co. KG\nKommanditgesellschaft\nBerlin\n\nBei dem nachstehenden Unternehmen / der nachstehenden Gesellschaft wird das Amtslöschungsverfahren gemäß § 31 Abs. 2 HGB eingeleitet. Widerspruchsfrist 1 Monat"
    },
    {
      "date": "2025-06-05",
      "id": "111299",
      "original_text": "Registerbekanntmachung nach dem Umwandlungsgesetz\nHamburg Amtsgericht Hamburg HRB 14477\nCONFIDA Aktiengesellschaft Wirtschaftsprüfungsgesellschaft Steuerberatungsgesellschaft – Hamburg",
      "type": "Registerbekanntmachung nach dem Umwandlungsgesetz",
      "state": "Hamburg",
      "amtsgericht": "Amtsgericht Hamburg",
      "registernummer": "HRB 14477",
      "registerart": "HRB",
      "company_name": "CONFIDA Aktiengesellschaft Wirtschaftsprüfungsgesellschaft Steuerberatungsgesellschaft",
      "company_seat": "Hamburg",
      "details": "05.06.2025 (Bekanntmachungsdatum)\n\nHamburg Amtsgericht Hamburg HRB 14477\nRegisterbekanntmachung nach dem Umwandlungsgesetz 05.06.2025 (Eintragungsdatum)\n\nCONFIDA Aktiengesellschaft Wirtschaftsprüfungsgesellschaft Steuerberatungsgesellschaft\nAktiengesellschaft\nHamburg\n\nAls nicht eingetragen wird bekannt gemacht:\nDen Gläubigern der an der Verschmelzung beteiligten Gesellschaften ist, wenn sie binnen sechs Monaten nach dem Tag, an dem die Eintragung der Verschmelzung in das Register des Sitzes desjenigen Rechtsträgers, dessen Gläubiger sie sind, nach § 19 Absatz 3 UmwG als bekannt gemacht gilt, ihren Anspruch nach Grund und Höhe schriftlich anmelden, Sicherheit zu leisten, soweit sie nicht Befriedigung verlangen können. Dieses Recht steht den Gläubigern jedoch nur zu, wenn sie glaubhaft machen, dass durch die Verschmelzung die Erfüllung ihrer Forderung gefährdet wird."
    },
    {
      "date": "2025-06-05",
      "id": "111300",
      "original_text": "Registerbekanntmachung nach dem Umwandlungsgesetz\nHamburg Amtsgericht Hamburg HRB 11148\nHeinz Wiechert & Co. GmbH – Hamburg",
      "type": "Registerbekanntmachung nach dem Umwandlungsgesetz",
      "state": "Hamburg",
      "amtsgericht": "Amtsgericht Hamburg",
      "registernummer": "HRB 11148",
      "registerart": "HRB",
      "company_name": "Heinz Wiechert & Co. GmbH",
      "company_seat": "Hamburg",
      "details": "05.06.2025 (Bekanntmachungsdatum)\n\nHamburg Amtsgericht Hamburg HRB 11148\nRegisterbekanntmachung nach dem Umwandlungsgesetz 05.06.2025 (Eintragungsdatum)\n\nHeinz Wiechert & Co. GmbH\nGesellschaft mit beschränkter Haftung\nHamburg\n\nAls nicht eingetragen wird bekannt gemacht:\nDen Gläubigern der an der Verschmelzung beteiligten Gesellschaften ist, wenn sie binnen sechs Monaten nach dem Tag, an dem die Eintragung der Verschmelzung in das Register des Sitzes desjenigen Rechtsträgers, dessen Gläubiger sie sind, nach § 19 Absatz 3 UmwG als bekannt gemacht gilt, ihren Anspruch nach Grund und Höhe schriftlich anmelden, Sicherheit zu leisten, soweit sie nicht Befriedigung verlangen können. Dieses Recht steht den Gläubigern jedoch nur zu, wenn sie glaubhaft machen, dass durch die Verschmelzung die Erfüllung ihrer Forderung gefährdet wird."
    },
    {
      "date": "2025-06-05",
      "id": "111301",
      "original_text": "Registerbekanntmachung nach dem Umwandlungsgesetz\nBaden-Württemberg Amtsgericht Mannheim VR 100494\nTurn- und Sportverein 1889 Karlsruhe-Daxlanden e.V. – Karlsruhe",
      "type": "Registerbekanntmachung nach dem Umwandlungsgesetz",
      "state": "Baden-Württemberg",
      "amtsgericht": "Amtsgericht Mannheim",
      "registernummer": "VR 100494",
      "registerart": "VR",
      "company_name": "Turn- und Sportverein 1889 Karlsruhe-Daxlanden e.V.",
      "company_seat": "Karlsruhe",
      "details": "05.06.2025 (Bekanntmachungsdatum)\n\nBaden-Württemberg Amtsgericht Mannheim VR 100494\nRegisterbekanntmachung nach dem Umwandlungsgesetz 05.06.2025 (Eintragungsdatum)\n\nTurn- und Sportverein 1889 Karlsruhe-Daxlanden e.V.\neingetragener Verein\nKarlsruhe\n\nAls nicht eingetragen wird bekanntgemacht:\nDen Gläubigern der an der Verschmelzung beteiligten Rechtsträger ist, wenn sie binnen sechs Monaten nach dem Tag, an dem die Eintragung der Verschmelzung in das Register des Sitzes desjenigen Rechtsträgers, dessen Gläubiger sie sind, nach § 19 Abs. 3 UmwG als bekanntgemacht gilt, ihren Anspruch nach Grund und Höhe schriftlich anmelden, Sicherheit zu leisten, soweit sie nicht Befriedigung verlangen können. Dieses Recht steht den Gläubigern jedoch nur zu, wenn sie glaubhaft machen, dass durch die Verschmelzung die Erfüllung ihrer Forderung gefährdet wird."
    },
    {
      "date": "2025-06-05",
      "id": "111302",
      "original_text": "Registerbekanntmachung nach dem Umwandlungsgesetz\nBaden-Württemberg Amtsgericht Stuttgart HRB 745348\nFitness United Waiblingen GmbH – Waiblingen",
      "type": "Registerbekanntmachung nach dem Umwandlungsgesetz",
      "state": "Baden-Württemberg",
      "amtsgericht": "Amtsgericht Stuttgart",
      "registernummer": "HRB 745348",
      "registerart": "HRB",
      "company_name": "Fitness United Waiblingen GmbH",
      "company_seat": "Waiblingen",
      "details": "05.06.2025 (Bekanntmachungsdatum)\n\nBaden-Württemberg Amtsgericht Stuttgart HRB 745348\nRegisterbekanntmachung nach dem Umwandlungsgesetz 05.06.2025 (Eintragungsdatum)\n\nFitness United Waiblingen GmbH\nGesellschaft mit beschränkter Haftung\nWaiblingen\n\nAls nicht eingetragen wird bekanntgemacht:\nDen Gläubigern der an der Verschmelzung beteiligten Rechtsträger ist, wenn sie binnen sechs Monaten nach dem Tag, an dem die Eintragung der Verschmelzung in das Register des Sitzes desjenigen Rechtsträgers, dessen Gläubiger sie sind, nach § 19 Abs. 3 UmwG als bekanntgemacht gilt, ihren Anspruch nach Grund und Höhe schriftlich anmelden, Sicherheit zu leisten, soweit sie nicht Befriedigung verlangen können. Dieses Recht steht den Gläubigern jedoch nur zu, wenn sie glaubhaft machen, dass durch die Verschmelzung die Erfüllung ihrer Forderung gefährdet wird."
    },
    {
      "date": "2025-06-05",
      "id": "111303",
      "original_text": "Einreichung neuer Dokumente\nBerlin Amtsgericht Berlin (Charlottenburg) HRB 224354\nMusic Creation Group Midco I GmbH – Berlin",
      "type": "Einreichung neuer Dokumente",
      "state": "Berlin",
      "amtsgericht": "Amtsgericht Berlin (Charlottenburg)",
      "registernummer": "HRB 224354",
      "registerart": "HRB",
      "company_name": "Music Creation Group Midco I GmbH",
      "company_seat": "Berlin",
      "details": "05.06.2025 (Bekanntmachungsdatum)\n\nBerlin Amtsgericht Berlin (Charlottenburg) HRB 224354\nEinreichung neuer Dokumente\n\nMusic Creation Group Midco I GmbH\nGesellschaft mit beschränkter Haftung\nBerlin\n\nAls nicht eingetragen wird veröffentlicht:Es wurde eine neue Liste des Beirates eingereicht (§52 GmbHG)."
    },
    {
      "date": "2025-06-05",
      "id": "111304",
      "original_text": "Registerbekanntmachung nach dem Umwandlungsgesetz\nBaden-Württemberg Amtsgericht Mannheim HRB 742692\nUnicon GmbH – Karlsruhe",
      "type": "Registerbekanntmachung nach dem Umwandlungsgesetz",
      "state": "Baden-Württemberg",
      "amtsgericht": "Amtsgericht Mannheim",
      "registernummer": "HRB 742692",
      "registerart": "HRB",
      "company_name": "Unicon GmbH",
      "company_seat": "Karlsruhe",
      "details": "05.06.2025 (Bekanntmachungsdatum)\n\nBaden-Württemberg Amtsgericht Mannheim HRB 742692\nRegisterbekanntmachung nach dem Umwandlungsgesetz 05.06.2025 (Eintragungsdatum)\n\nUnicon GmbH\nGesellschaft mit beschränkter Haftung\nKarlsruhe\n\nAls nicht eingetragen wird bekanntgemacht:\nDen Gläubigern der an der Verschmelzung beteiligten Rechtsträger ist, wenn sie binnen sechs Monaten nach dem Tag, an dem die Eintragung der Verschmelzung in das Register des Sitzes desjenigen Rechtsträgers, dessen Gläubiger sie sind, nach § 19 Abs. 3 UmwG als bekanntgemacht gilt, ihren Anspruch nach Grund und Höhe schriftlich anmelden, Sicherheit zu leisten, soweit sie nicht Befriedigung verlangen können. Dieses Recht steht den Gläubigern jedoch nur zu, wenn sie glaubhaft machen, dass durch die Verschmelzung die Erfüllung ihrer Forderung gefährdet wird."
    },
    {
      "date": "2025-06-05",
      "id": "111305",
      "original_text": "Registerbekanntmachung nach dem Umwandlungsgesetz\nSchleswig-Holstein Amtsgericht Kiel HRA 12610\nEinar Erdt e.K. – Tüttendorf",
      "type": "Registerbekanntmachung nach dem Umwandlungsgesetz",
      "state": "Schleswig-Holstein",
      "amtsgericht": "Amtsgericht Kiel",
      "registernummer": "HRA 12610",
      "registerart": "HRA",
      "company_name": "Einar Erdt e.K.",
      "company_seat": "Tüttendorf",
      "details": "05.06.2025 (Bekanntmachungsdatum)\n\nSchleswig-Holstein Amtsgericht Kiel HRA 12610\nRegisterbekanntmachung nach dem Umwandlungsgesetz 04.06.2025 (Eintragungsdatum)\n\nEinar Erdt e.K.\nEinzelkaufmann / Einzelkauffrau\nTüttendorf\n\nZu Eintragungsnummer 2 vom 04.06.2025 wird als nicht eingetragen veröffentlicht:  Den Gläubigern der an der Spaltung beteiligten Rechtsträger ist, wenn sie binnen sechs Monaten nach dem Tag, an dem die Eintragung der Spaltung in das Register des Sitzes desjenigen Rechtsträgers, dessen Gläubiger sie sind,  bekannt gemacht worden ist, ihren Anspruch nach Grund und Höhe schriftlich anmelden, Sicherheit zu leisten, soweit sie nicht Befriedigung verlangen können. Dieses Recht steht den Gläubigern jedoch nur zu, wenn sie glaubhaft machen, dass durch die Spaltung die Erfüllung ihrer Forderung gefährdet wird."
    },
    {
      "date": "2025-06-05",
      "id": "111306",
      "original_text": "Registerbekanntmachung nach dem Umwandlungsgesetz\nBerlin Amtsgericht Berlin (Charlottenburg) HRA 58470\nNeXtWind Windpark Beteiligung VII GmbH & Co. KG – Berlin",
      "type": "Registerbekanntmachung nach dem Umwandlungsgesetz",
      "state": "Berlin",
      "amtsgericht": "Amtsgericht Berlin (Charlottenburg)",
      "registernummer": "HRA 58470",
      "registerart": "HRA",
      "company_name": "NeXtWind Windpark Beteiligung VII GmbH & Co. KG",
      "company_seat": "Berlin",
      "details": "05.06.2025 (Bekanntmachungsdatum)\n\nBerlin Amtsgericht Berlin (Charlottenburg) HRA 58470\nRegisterbekanntmachung nach dem Umwandlungsgesetz 03.06.2025 (Eintragungsdatum)\n\nNeXtWind Windpark Beteiligung VII GmbH & Co. KG\nKommanditgesellschaft\nBerlin\n\nZu Eintragungsnummer 4 vom 03.06.2025 wird als nicht eingetragen veröffentlicht: Den Gläubigern der an der Spaltung beteiligten Rechtsträger ist, wenn sie binnen sechs Monaten nach dem Tag, an dem die Eintragung der Spaltung in das Register des Sitzes desjenigen Rechtsträgers, dessen Gläubiger sie sind, als bekannt gemacht gilt, ihren Anspruch nach Grund und Höhe schriftlich anmelden, Sicherheit zu leisten, soweit sie nicht Befriedigung verlangen können. Dieses Recht steht den Gläubigern jedoch nur zu, wenn sie glaubhaft machen, dass durch die Spaltung die Erfüllung ihrer Forderung gefährdet wird. Das Recht, Sicherheitsleistung zu verlangen, steht Gläubigern nicht zu, die im Falle der Insolvenz ein Recht auf vorzugsweise Befriedigung aus einer Deckungsmasse haben, die nach gesetzlicher Vorschrift zu ihrem Schutz errichtet und staatlich überwacht ist."
    },
    {
      "date": "2025-06-05",
      "id": "111307",
      "original_text": "Registerbekanntmachung nach dem Umwandlungsgesetz\nHamburg Amtsgericht Hamburg HRB 68096\nMO Streetwear GmbH – Hamburg",
      "type": "Registerbekanntmachung nach dem Umwandlungsgesetz",
      "state": "Hamburg",
      "amtsgericht": "Amtsgericht Hamburg",
      "registernummer": "HRB 68096",
      "registerart": "HRB",
      "company_name": "MO Streetwear GmbH",
      "company_seat": "Hamburg",
      "details": "05.06.2025 (Bekanntmachungsdatum)\n\nHamburg Amtsgericht Hamburg HRB 68096\nRegisterbekanntmachung nach dem Umwandlungsgesetz 05.06.2025 (Eintragungsdatum)\n\nMO Streetwear GmbH\nGesellschaft mit beschränkter Haftung\nHamburg\n\nAls nicht eingetragen wird bekannt gemacht:\nDen Gläubigern der an der Verschmelzung beteiligten Gesellschaften ist, wenn sie binnen sechs Monaten nach dem Tag, an dem die Eintragung der Verschmelzung in das Register des Sitzes desjenigen Rechtsträgers, dessen Gläubiger sie sind, nach § 19 Absatz 3 UmwG als bekannt gemacht gilt, ihren Anspruch nach Grund und Höhe schriftlich anmelden, Sicherheit zu leisten, soweit sie nicht Befriedigung verlangen können. Dieses Recht steht den Gläubigern jedoch nur zu, wenn sie glaubhaft machen, dass durch die Verschmelzung die Erfüllung ihrer Forderung gefährdet wird."
    },
    {
      "date": "2025-06-05",
      "id": "111308",
      "original_text": "Registerbekanntmachung nach dem Umwandlungsgesetz\nHamburg Amtsgericht Hamburg HRB 192678\nLeo Lifestyle GmbH – Hamburg",
      "type": "Registerbekanntmachung nach dem Umwandlungsgesetz",
      "state": "Hamburg",
      "amtsgericht": "Amtsgericht Hamburg",
      "registernummer": "HRB 192678",
      "registerart": "HRB",
      "company_name": "Leo Lifestyle GmbH",
      "company_seat": "Hamburg",
      "details": "05.06.2025 (Bekanntmachungsdatum)\n\nHamburg Amtsgericht Hamburg HRB 192678\nRegisterbekanntmachung nach dem Umwandlungsgesetz 05.06.2025 (Eintragungsdatum)\n\nLeo Lifestyle GmbH\nGesellschaft mit beschränkter Haftung\nHamburg\n\nAls nicht eingetragen wird bekannt gemacht:\nDen Gläubigern der an der Verschmelzung beteiligten Gesellschaften ist, wenn sie binnen sechs Monaten nach dem Tag, an dem die Eintragung der Verschmelzung in das Register des Sitzes desjenigen Rechtsträgers, dessen Gläubiger sie sind, nach § 19 Absatz 3 UmwG als bekannt gemacht gilt, ihren Anspruch nach Grund und Höhe schriftlich anmelden, Sicherheit zu leisten, soweit sie nicht Befriedigung verlangen können. Dieses Recht steht den Gläubigern jedoch nur zu, wenn sie glaubhaft machen, dass durch die Verschmelzung die Erfüllung ihrer Forderung gefährdet wird."
    },
    {
      "date": "2025-06-05",
      "id": "111309",
      "original_text": "Registerbekanntmachung nach dem Umwandlungsgesetz\nHamburg Amtsgericht Hamburg HRB 63197\nENCAVIS AG – Hamburg",
      "type": "Registerbekanntmachung nach dem Umwandlungsgesetz",
      "state": "Hamburg",
      "amtsgericht": "Amtsgericht Hamburg",
      "registernummer": "HRB 63197",
      "registerart": "HRB",
      "company_name": "ENCAVIS AG",
      "company_seat": "Hamburg",
      "details": "05.06.2025 (Bekanntmachungsdatum)\n\nHamburg Amtsgericht Hamburg HRB 63197\nRegisterbekanntmachung nach dem Umwandlungsgesetz\n\nENCAVIS AG\nAktiengesellschaft\nHamburg\n\nDie Gesellschaft hat gemäß § 62 Abs. 4 S. 4, Abs. 3 S. 2 Hs. 2 i.V.m. § 61 S. 2 UmwG einen Verschmelzungsvertrag bei dem Handelsregister eingereicht: An der Verschmelzung beteiligte Gesellschaften: ENCAVIS AG, als übertragende Gesellschaft auf die Elbe BidCo AG, München (AG München, HRB 262997) als übernehmende Gesellschaft."
    },
    {
      "date": "2025-06-05",
      "id": "111310",
      "original_text": "Registerbekanntmachung nach dem Umwandlungsgesetz\nBerlin Amtsgericht Berlin (Charlottenburg) HRA 61743\nNeXtWind Windpark Beteiligung 32 GmbH & Co. KG – Berlin",
      "type": "Registerbekanntmachung nach dem Umwandlungsgesetz",
      "state": "Berlin",
      "amtsgericht": "Amtsgericht Berlin (Charlottenburg)",
      "registernummer": "HRA 61743",
      "registerart": "HRA",
      "company_name": "NeXtWind Windpark Beteiligung 32 GmbH & Co. KG",
      "company_seat": "Berlin",
      "details": "05.06.2025 (Bekanntmachungsdatum)\n\nBerlin Amtsgericht Berlin (Charlottenburg) HRA 61743\nRegisterbekanntmachung nach dem Umwandlungsgesetz 03.06.2025 (Eintragungsdatum)\n\nNeXtWind Windpark Beteiligung 32 GmbH & Co. KG\nKommanditgesellschaft\nBerlin\n\nZu Eintragungsnummer 4 vom 03.06.2025 wird als nicht eingetragen veröffentlicht:Den Gläubigern der an der Spaltung beteiligten Rechtsträger ist, wenn sie binnen sechs Monaten nach dem Tag, an dem die Eintragung der Spaltung in das Register des Sitzes desjenigen Rechtsträgers, dessen Gläubiger sie sind, als bekannt gemacht gilt, ihren Anspruch nach Grund und Höhe schriftlich anmelden, Sicherheit zu leisten, soweit sie nicht Befriedigung verlangen können. Dieses Recht steht den Gläubigern jedoch nur zu, wenn sie glaubhaft machen, dass durch die Spaltung die Erfüllung ihrer Forderung gefährdet wird. Das Recht, Sicherheitsleistung zu verlangen, steht Gläubigern nicht zu, die im Falle der Insolvenz ein Recht auf vorzugsweise Befriedigung aus einer Deckungsmasse haben, die nach gesetzlicher Vorschrift zu ihrem Schutz errichtet und staatlich überwacht ist."
    },
    {
      "date": "2025-06-05",
      "id": "111311",
      "original_text": "Registerbekanntmachung nach dem Umwandlungsgesetz\nHamburg Amtsgericht Hamburg HRA 86407\nDELTA MAX Grundstücksgesellschaft mbH & Co. KG – Hamburg",
      "type": "Registerbekanntmachung nach dem Umwandlungsgesetz",
      "state": "Hamburg",
      "amtsgericht": "Amtsgericht Hamburg",
      "registernummer": "HRA 86407",
      "registerart": "HRA",
      "company_name": "DELTA MAX Grundstücksgesellschaft mbH & Co. KG",
      "company_seat": "Hamburg",
      "details": "05.06.2025 (Bekanntmachungsdatum)\n\nHamburg Amtsgericht Hamburg HRA 86407\nRegisterbekanntmachung nach dem Umwandlungsgesetz 05.06.2025 (Eintragungsdatum)\n\nDELTA MAX Grundstücksgesellschaft mbH & Co. KG\nKommanditgesellschaft\nHamburg\n\nAls nicht eingetragen wird bekannt gemacht:\nDen Gläubigern der an der Verschmelzung beteiligten Gesellschaften ist, wenn sie binnen sechs Monaten nach dem Tag, an dem die Eintragung der Verschmelzung in das Register des Sitzes desjenigen Rechtsträgers, dessen Gläubiger sie sind, nach § 19 Absatz 3 UmwG als bekannt gemacht gilt, ihren Anspruch nach Grund und Höhe schriftlich anmelden, Sicherheit zu leisten, soweit sie nicht Befriedigung verlangen können. Dieses Recht steht den Gläubigern jedoch nur zu, wenn sie glaubhaft machen, dass durch die Verschmelzung die Erfüllung ihrer Forderung gefährdet wird."
    },
    {
      "date": "2025-06-05",
      "id": "111312",
      "original_text": "Registerbekanntmachung nach dem Umwandlungsgesetz\nHamburg Amtsgericht Hamburg HRB 120121\nB & L Hotel UKE Martinistraße Betriebsvorrichtungen GmbH – Hamburg",
      "type": "Registerbekanntmachung nach dem Umwandlungsgesetz",
      "state": "Hamburg",
      "amtsgericht": "Amtsgericht Hamburg",
      "registernummer": "HRB 120121",
      "registerart": "HRB",
      "company_name": "B & L Hotel UKE Martinistraße Betriebsvorrichtungen GmbH",
      "company_seat": "Hamburg",
      "details": "05.06.2025 (Bekanntmachungsdatum)\n\nHamburg Amtsgericht Hamburg HRB 120121\nRegisterbekanntmachung nach dem Umwandlungsgesetz 05.06.2025 (Eintragungsdatum)\n\nB & L Hotel UKE Martinistraße Betriebsvorrichtungen GmbH\nGesellschaft mit beschränkter Haftung\nHamburg\n\nAls nicht eingetragen wird bekannt gemacht:\nDen Gläubigern der an der Verschmelzung beteiligten Gesellschaften ist, wenn sie binnen sechs Monaten nach dem Tag, an dem die Eintragung der Verschmelzung in das Register des Sitzes desjenigen Rechtsträgers, dessen Gläubiger sie sind, nach § 19 Absatz 3 UmwG als bekannt gemacht gilt, ihren Anspruch nach Grund und Höhe schriftlich anmelden, Sicherheit zu leisten, soweit sie nicht Befriedigung verlangen können. Dieses Recht steht den Gläubigern jedoch nur zu, wenn sie glaubhaft machen, dass durch die Verschmelzung die Erfüllung ihrer Forderung gefährdet wird."
    },
    {
      "date": "2025-06-05",
      "id": "111313",
      "original_text": "Einreichung neuer Dokumente\nBerlin Amtsgericht Berlin (Charlottenburg) HRB 219919\nIHK DIGITAL GmbH – Berlin",
      "type": "Einreichung neuer Dokumente",
      "state": "Berlin",
      "amtsgericht": "Amtsgericht Berlin (Charlottenburg)",
      "registernummer": "HRB 219919",
      "registerart": "HRB",
      "company_name": "IHK DIGITAL GmbH",
      "company_seat": "Berlin",
      "details": "05.06.2025 (Bekanntmachungsdatum)\n\nBerlin Amtsgericht Berlin (Charlottenburg) HRB 219919\nEinreichung neuer Dokumente\n\nIHK DIGITAL GmbH\nGesellschaft mit beschränkter Haftung\nBerlin\n\nAls nicht eingetragen wird veröffentlicht:\n\nEs wurde eine neue Liste der Aufsichtsratsmitglieder eingereicht (§52 GmbHG)."
    },
    {
      "date": "2025-06-05",
      "id": "111314",
      "original_text": "Registerbekanntmachung nach dem Umwandlungsgesetz\nBerlin Amtsgericht Berlin (Charlottenburg) HRA 60296\nNeXtWind Windpark Beteiligung XII GmbH & Co. KG – Berlin",
      "type": "Registerbekanntmachung nach dem Umwandlungsgesetz",
      "state": "Berlin",
      "amtsgericht": "Amtsgericht Berlin (Charlottenburg)",
      "registernummer": "HRA 60296",
      "registerart": "HRA",
      "company_name": "NeXtWind Windpark Beteiligung XII GmbH & Co. KG",
      "company_seat": "Berlin",
      "details": "05.06.2025 (Bekanntmachungsdatum)\n\nBerlin Amtsgericht Berlin (Charlottenburg) HRA 60296\nRegisterbekanntmachung nach dem Umwandlungsgesetz 04.06.2025 (Eintragungsdatum)\n\nNeXtWind Windpark Beteiligung XII GmbH & Co. KG\nKommanditgesellschaft\nBerlin\n\nZu Eintragungsnummer 10 vom 04.06.2025 wird als nicht eingetragen veröffentlicht:\nDen Gläubigern der an der Verschmelzung beteiligten Rechtsträger ist, wenn sie binnen sechs Monaten nach dem Tag, an dem die Eintragung der Verschmelzung in das Register des Sitzes desjenigen Rechtsträgers, dessen Gläubiger sie sind, als bekannt gemacht gilt, ihren Anspruch nach Grund und Höhe schriftlich anmelden, Sicherheit zu leisten, soweit sie nicht Befriedigung verlangen können. Dieses Recht steht den Gläubigern jedoch nur zu, wenn sie glaubhaft machen, dass durch die Verschmelzung die Erfüllung ihrer Forderung gefährdet wird. Das Recht, Sicherheitsleistung zu verlangen, steht Gläubigern nicht zu, die im Falle der Insolvenz ein Recht auf vorzugsweise Befriedigung aus einer Deckungsmasse haben, die nach gesetzlicher Vorschrift zu ihrem Schutz errichtet und staatlich überwacht ist."
    },
    {
      "date": "2025-06-05",
      "id": "111315",
      "original_text": "Registerbekanntmachung nach dem Umwandlungsgesetz\nBerlin Amtsgericht Berlin (Charlottenburg) HRA 57826\nNeXtWind Windpark Beteiligung II GmbH & Co. KG – Berlin",
      "type": "Registerbekanntmachung nach dem Umwandlungsgesetz",
      "state": "Berlin",
      "amtsgericht": "Amtsgericht Berlin (Charlottenburg)",
      "registernummer": "HRA 57826",
      "registerart": "HRA",
      "company_name": "NeXtWind Windpark Beteiligung II GmbH & Co. KG",
      "company_seat": "Berlin",
      "details": "05.06.2025 (Bekanntmachungsdatum)\n\nBerlin Amtsgericht Berlin (Charlottenburg) HRA 57826\nRegisterbekanntmachung nach dem Umwandlungsgesetz 04.06.2025 (Eintragungsdatum)\n\nNeXtWind Windpark Beteiligung II GmbH & Co. KG\nKommanditgesellschaft\nBerlin\n\nZu Eintragungsnummer 7 vom 04.06.2025 wird als nicht eingetragen veröffentlicht:\nDen Gläubigern der an der Verschmelzung beteiligten Rechtsträger ist, wenn sie binnen sechs Monaten nach dem Tag, an dem die Eintragung der Verschmelzung in das Register des Sitzes desjenigen Rechtsträgers, dessen Gläubiger sie sind, als bekannt gemacht gilt, ihren Anspruch nach Grund und Höhe schriftlich anmelden, Sicherheit zu leisten, soweit sie nicht Befriedigung verlangen können. Dieses Recht steht den Gläubigern jedoch nur zu, wenn sie glaubhaft machen, dass durch die Verschmelzung die Erfüllung ihrer Forderung gefährdet wird. Das Recht, Sicherheitsleistung zu verlangen, steht Gläubigern nicht zu, die im Falle der Insolvenz ein Recht auf vorzugsweise Befriedigung aus einer Deckungsmasse haben, die nach gesetzlicher Vorschrift zu ihrem Schutz errichtet und staatlich überwacht ist."
    },
    {
      "date": "2025-06-05",
      "id": "111316",
      "original_text": "Registerbekanntmachung nach dem Umwandlungsgesetz\nBerlin Amtsgericht Berlin (Charlottenburg) HRA 58437\nNeXtWind Windpark Beteiligung III GmbH & Co. KG – Berlin",
      "type": "Registerbekanntmachung nach dem Umwandlungsgesetz",
      "state": "Berlin",
      "amtsgericht": "Amtsgericht Berlin (Charlottenburg)",
      "registernummer": "HRA 58437",
      "registerart": "HRA",
      "company_name": "NeXtWind Windpark Beteiligung III GmbH & Co. KG",
      "company_seat": "Berlin",
      "details": "05.06.2025 (Bekanntmachungsdatum)\n\nBerlin Amtsgericht Berlin (Charlottenburg) HRA 58437\nRegisterbekanntmachung nach dem Umwandlungsgesetz 04.06.2025 (Eintragungsdatum)\n\nNeXtWind Windpark Beteiligung III GmbH & Co. KG\nKommanditgesellschaft\nBerlin\n\nZu Eintragungsnummer 5 vom 04.06.2025 wird als nicht eingetragen veröffentlicht:\nDen Gläubigern der an der Verschmelzung beteiligten Rechtsträger ist, wenn sie binnen sechs Monaten nach dem Tag, an dem die Eintragung der Verschmelzung in das Register des Sitzes desjenigen Rechtsträgers, dessen Gläubiger sie sind, als bekannt gemacht gilt, ihren Anspruch nach Grund und Höhe schriftlich anmelden, Sicherheit zu leisten, soweit sie nicht Befriedigung verlangen können. Dieses Recht steht den Gläubigern jedoch nur zu, wenn sie glaubhaft machen, dass durch die Verschmelzung die Erfüllung ihrer Forderung gefährdet wird. Das Recht, Sicherheitsleistung zu verlangen, steht Gläubigern nicht zu, die im Falle der Insolvenz ein Recht auf vorzugsweise Befriedigung aus einer Deckungsmasse haben, die nach gesetzlicher Vorschrift zu ihrem Schutz errichtet und staatlich überwacht ist."
    },
    {
      "date": "2025-06-05",
      "id": "111317",
      "original_text": "Registerbekanntmachung nach dem Umwandlungsgesetz\nBerlin Amtsgericht Berlin (Charlottenburg) HRA 58319\nNeXtWind Windpark Beteiligung V GmbH & Co. KG – Berlin",
      "type": "Registerbekanntmachung nach dem Umwandlungsgesetz",
      "state": "Berlin",
      "amtsgericht": "Amtsgericht Berlin (Charlottenburg)",
      "registernummer": "HRA 58319",
      "registerart": "HRA",
      "company_name": "NeXtWind Windpark Beteiligung V GmbH & Co. KG",
      "company_seat": "Berlin",
      "details": "05.06.2025 (Bekanntmachungsdatum)\n\nBerlin Amtsgericht Berlin (Charlottenburg) HRA 58319\nRegisterbekanntmachung nach dem Umwandlungsgesetz 04.06.2025 (Eintragungsdatum)\n\nNeXtWind Windpark Beteiligung V GmbH & Co. KG\nKommanditgesellschaft\nBerlin\n\nZu Eintragungsnummer 4 vom 04.06.2025 wird als nicht eingetragen veröffentlicht:\nDen Gläubigern der an der Verschmelzung beteiligten Rechtsträger ist, wenn sie binnen sechs Monaten nach dem Tag, an dem die Eintragung der Verschmelzung in das Register des Sitzes desjenigen Rechtsträgers, dessen Gläubiger sie sind, als bekannt gemacht gilt, ihren Anspruch nach Grund und Höhe schriftlich anmelden, Sicherheit zu leisten, soweit sie nicht Befriedigung verlangen können. Dieses Recht steht den Gläubigern jedoch nur zu, wenn sie glaubhaft machen, dass durch die Verschmelzung die Erfüllung ihrer Forderung gefährdet wird. Das Recht, Sicherheitsleistung zu verlangen, steht Gläubigern nicht zu, die im Falle der Insolvenz ein Recht auf vorzugsweise Befriedigung aus einer Deckungsmasse haben, die nach gesetzlicher Vorschrift zu ihrem Schutz errichtet und staatlich überwacht ist."
    },
    {
      "date": "2025-06-05",
      "id": "111318",
      "original_text": "Registerbekanntmachung nach dem Umwandlungsgesetz\nBerlin Amtsgericht Berlin (Charlottenburg) HRA 58470\nNeXtWind Windpark Beteiligung VII GmbH & Co. KG – Berlin",
      "type": "Registerbekanntmachung nach dem Umwandlungsgesetz",
      "state": "Berlin",
      "amtsgericht": "Amtsgericht Berlin (Charlottenburg)",
      "registernummer": "HRA 58470",
      "registerart": "HRA",
      "company_name": "NeXtWind Windpark Beteiligung VII GmbH & Co. KG",
      "company_seat": "Berlin",
      "details": "05.06.2025 (Bekanntmachungsdatum)\n\nBerlin Amtsgericht Berlin (Charlottenburg) HRA 58470\nRegisterbekanntmachung nach dem Umwandlungsgesetz 04.06.2025 (Eintragungsdatum)\n\nNeXtWind Windpark Beteiligung VII GmbH & Co. KG\nKommanditgesellschaft\nBerlin\n\nZu Eintragungsnummer 5 vom 04.06.2025 wird als nicht eingetragen veröffentlicht:\nDen Gläubigern der an der Verschmelzung beteiligten Rechtsträger ist, wenn sie binnen sechs Monaten nach dem Tag, an dem die Eintragung der Verschmelzung in das Register des Sitzes desjenigen Rechtsträgers, dessen Gläubiger sie sind, als bekannt gemacht gilt, ihren Anspruch nach Grund und Höhe schriftlich anmelden, Sicherheit zu leisten, soweit sie nicht Befriedigung verlangen können. Dieses Recht steht den Gläubigern jedoch nur zu, wenn sie glaubhaft machen, dass durch die Verschmelzung die Erfüllung ihrer Forderung gefährdet wird. Das Recht, Sicherheitsleistung zu verlangen, steht Gläubigern nicht zu, die im Falle der Insolvenz ein Recht auf vorzugsweise Befriedigung aus einer Deckungsmasse haben, die nach gesetzlicher Vorschrift zu ihrem Schutz errichtet und staatlich überwacht ist."
    },
    {
      "date": "2025-06-05",
      "id": "111319",
      "original_text": "Registerbekanntmachung nach dem Umwandlungsgesetz\nBerlin Amtsgericht Berlin (Charlottenburg) HRA 60267\nNeXtWind Windpark Beteiligung VIII GmbH & Co. KG – Berlin",
      "type": "Registerbekanntmachung nach dem Umwandlungsgesetz",
      "state": "Berlin",
      "amtsgericht": "Amtsgericht Berlin (Charlottenburg)",
      "registernummer": "HRA 60267",
      "registerart": "HRA",
      "company_name": "NeXtWind Windpark Beteiligung VIII GmbH & Co. KG",
      "company_seat": "Berlin",
      "details": "05.06.2025 (Bekanntmachungsdatum)\n\nBerlin Amtsgericht Berlin (Charlottenburg) HRA 60267\nRegisterbekanntmachung nach dem Umwandlungsgesetz 04.06.2025 (Eintragungsdatum)\n\nNeXtWind Windpark Beteiligung VIII GmbH & Co. KG\nKommanditgesellschaft\nBerlin\n\nZu Eintragungsnummer 5 vom 04.06.2025 wird als nicht eingetragen veröffentlicht:\nDen Gläubigern der an der Verschmelzung beteiligten Rechtsträger ist, wenn sie binnen sechs Monaten nach dem Tag, an dem die Eintragung der Verschmelzung in das Register des Sitzes desjenigen Rechtsträgers, dessen Gläubiger sie sind, als bekannt gemacht gilt, ihren Anspruch nach Grund und Höhe schriftlich anmelden, Sicherheit zu leisten, soweit sie nicht Befriedigung verlangen können. Dieses Recht steht den Gläubigern jedoch nur zu, wenn sie glaubhaft machen, dass durch die Verschmelzung die Erfüllung ihrer Forderung gefährdet wird. Das Recht, Sicherheitsleistung zu verlangen, steht Gläubigern nicht zu, die im Falle der Insolvenz ein Recht auf vorzugsweise Befriedigung aus einer Deckungsmasse haben, die nach gesetzlicher Vorschrift zu ihrem Schutz errichtet und staatlich überwacht ist."
    },
    {
      "date": "2025-06-05",
      "id": "111320",
      "original_text": "Registerbekanntmachung nach dem Umwandlungsgesetz\nBerlin Amtsgericht Berlin (Charlottenburg) HRA 60261\nNeXtWind Windpark Beteiligung IX GmbH & Co. KG – Berlin",
      "type": "Registerbekanntmachung nach dem Umwandlungsgesetz",
      "state": "Berlin",
      "amtsgericht": "Amtsgericht Berlin (Charlottenburg)",
      "registernummer": "HRA 60261",
      "registerart": "HRA",
      "company_name": "NeXtWind Windpark Beteiligung IX GmbH & Co. KG",
      "company_seat": "Berlin",
      "details": "05.06.2025 (Bekanntmachungsdatum)\n\nBerlin Amtsgericht Berlin (Charlottenburg) HRA 60261\nRegisterbekanntmachung nach dem Umwandlungsgesetz 04.06.2025 (Eintragungsdatum)\n\nNeXtWind Windpark Beteiligung IX GmbH & Co. KG\nKommanditgesellschaft\nBerlin\n\nZu Eintragungsnummer 4 vom 04.06.2025 wird als nicht eingetragen veröffentlicht:\nDen Gläubigern der an der Verschmelzung beteiligten Rechtsträger ist, wenn sie binnen sechs Monaten nach dem Tag, an dem die Eintragung der Verschmelzung in das Register des Sitzes desjenigen Rechtsträgers, dessen Gläubiger sie sind, als bekannt gemacht gilt, ihren Anspruch nach Grund und Höhe schriftlich anmelden, Sicherheit zu leisten, soweit sie nicht Befriedigung verlangen können. Dieses Recht steht den Gläubigern jedoch nur zu, wenn sie glaubhaft machen, dass durch die Verschmelzung die Erfüllung ihrer Forderung gefährdet wird. Das Recht, Sicherheitsleistung zu verlangen, steht Gläubigern nicht zu, die im Falle der Insolvenz ein Recht auf vorzugsweise Befriedigung aus einer Deckungsmasse haben, die nach gesetzlicher Vorschrift zu ihrem Schutz errichtet und staatlich überwacht ist."
    },
    {
      "date": "2025-06-05",
      "id": "111321",
      "original_text": "Registerbekanntmachung nach dem Umwandlungsgesetz\nBerlin Amtsgericht Berlin (Charlottenburg) HRA 61764\nNeXtWind Windpark Beteiligung XVI GmbH & Co. KG – Berlin",
      "type": "Registerbekanntmachung nach dem Umwandlungsgesetz",
      "state": "Berlin",
      "amtsgericht": "Amtsgericht Berlin (Charlottenburg)",
      "registernummer": "HRA 61764",
      "registerart": "HRA",
      "company_name": "NeXtWind Windpark Beteiligung XVI GmbH & Co. KG",
      "company_seat": "Berlin",
      "details": "05.06.2025 (Bekanntmachungsdatum)\n\nBerlin Amtsgericht Berlin (Charlottenburg) HRA 61764\nRegisterbekanntmachung nach dem Umwandlungsgesetz 04.06.2025 (Eintragungsdatum)\n\nNeXtWind Windpark Beteiligung XVI GmbH & Co. KG\nKommanditgesellschaft\nBerlin\n\nZu Eintragungsnummer 4 vom 04.06.2025 wird als nicht eingetragen veröffentlicht:\nDen Gläubigern der an der Verschmelzung beteiligten Rechtsträger ist, wenn sie binnen sechs Monaten nach dem Tag, an dem die Eintragung der Verschmelzung in das Register des Sitzes desjenigen Rechtsträgers, dessen Gläubiger sie sind, als bekannt gemacht gilt, ihren Anspruch nach Grund und Höhe schriftlich anmelden, Sicherheit zu leisten, soweit sie nicht Befriedigung verlangen können. Dieses Recht steht den Gläubigern jedoch nur zu, wenn sie glaubhaft machen, dass durch die Verschmelzung die Erfüllung ihrer Forderung gefährdet wird. Das Recht, Sicherheitsleistung zu verlangen, steht Gläubigern nicht zu, die im Falle der Insolvenz ein Recht auf vorzugsweise Befriedigung aus einer Deckungsmasse haben, die nach gesetzlicher Vorschrift zu ihrem Schutz errichtet und staatlich überwacht ist."
    },
    {
      "date": "2025-06-05",
      "id": "111322",
      "original_text": "Registerbekanntmachung nach dem Umwandlungsgesetz\nBerlin Amtsgericht Berlin (Charlottenburg) HRA 58350\nNeXtWind Windpark Beteiligung IV GmbH & Co. KG – Berlin",
      "type": "Registerbekanntmachung nach dem Umwandlungsgesetz",
      "state": "Berlin",
      "amtsgericht": "Amtsgericht Berlin (Charlottenburg)",
      "registernummer": "HRA 58350",
      "registerart": "HRA",
      "company_name": "NeXtWind Windpark Beteiligung IV GmbH & Co. KG",
      "company_seat": "Berlin",
      "details": "05.06.2025 (Bekanntmachungsdatum)\n\nBerlin Amtsgericht Berlin (Charlottenburg) HRA 58350\nRegisterbekanntmachung nach dem Umwandlungsgesetz 04.06.2025 (Eintragungsdatum)\n\nNeXtWind Windpark Beteiligung IV GmbH & Co. KG\nKommanditgesellschaft\nBerlin\n\nZu Eintragungsnummer 5 vom 04.06.2025 wird als nicht eingetragen veröffentlicht:\nDen Gläubigern der an der Verschmelzung beteiligten Rechtsträger ist, wenn sie binnen sechs Monaten nach dem Tag, an dem die Eintragung der Verschmelzung in das Register des Sitzes desjenigen Rechtsträgers, dessen Gläubiger sie sind, als bekannt gemacht gilt, ihren Anspruch nach Grund und Höhe schriftlich anmelden, Sicherheit zu leisten, soweit sie nicht Befriedigung verlangen können. Dieses Recht steht den Gläubigern jedoch nur zu, wenn sie glaubhaft machen, dass durch die Verschmelzung die Erfüllung ihrer Forderung gefährdet wird. Das Recht, Sicherheitsleistung zu verlangen, steht Gläubigern nicht zu, die im Falle der Insolvenz ein Recht auf vorzugsweise Befriedigung aus einer Deckungsmasse haben, die nach gesetzlicher Vorschrift zu ihrem Schutz errichtet und staatlich überwacht ist."
    },
    {
      "date": "2025-06-05",
      "id": "111323",
      "original_text": "Registerbekanntmachung nach dem Umwandlungsgesetz\nBaden-Württemberg Amtsgericht Stuttgart HRB 785096\nTK Aufzugswerke Newco GmbH – Neuhausen auf den Fildern",
      "type": "Registerbekanntmachung nach dem Umwandlungsgesetz",
      "state": "Baden-Württemberg",
      "amtsgericht": "Amtsgericht Stuttgart",
      "registernummer": "HRB 785096",
      "registerart": "HRB",
      "company_name": "TK Aufzugswerke Newco GmbH",
      "company_seat": "Neuhausen auf den Fildern",
      "details": "05.06.2025 (Bekanntmachungsdatum)\n\nBaden-Württemberg Amtsgericht Stuttgart HRB 785096\nRegisterbekanntmachung nach dem Umwandlungsgesetz 05.06.2025 (Eintragungsdatum)\n\nTK Aufzugswerke Newco GmbH\nGesellschaft mit beschränkter Haftung\nNeuhausen auf den Fildern\n\nAls nicht eingetragen wird bekanntgemacht:\nDen Gläubigern der an der Verschmelzung beteiligten Rechtsträger ist, wenn sie binnen sechs Monaten nach dem Tag, an dem die Eintragung der Verschmelzung in das Register des Sitzes desjenigen Rechtsträgers, dessen Gläubiger sie sind, nach § 19 Abs. 3 UmwG als bekanntgemacht gilt, ihren Anspruch nach Grund und Höhe schriftlich anmelden, Sicherheit zu leisten, soweit sie nicht Befriedigung verlangen können. Dieses Recht steht den Gläubigern jedoch nur zu, wenn sie glaubhaft machen, dass durch die Verschmelzung die Erfüllung ihrer Forderung gefährdet wird."
    },
    {
      "date": "2025-06-05",
      "id": "111324",
      "original_text": "Einreichung neuer Dokumente\nBaden-Württemberg Amtsgericht Stuttgart HRB 570105\nBausparkasse Schwäbisch Hall Aktiengesellschaft - Bausparkasse der Volksbanken und Raiffeisenbanken - – Schwäbisch Hall",
      "type": "Einreichung neuer Dokumente",
      "state": "Baden-Württemberg",
      "amtsgericht": "Amtsgericht Stuttgart",
      "registernummer": "HRB 570105",
      "registerart": "HRB",
      "company_name": "Bausparkasse Schwäbisch Hall Aktiengesellschaft - Bausparkasse der Volksbanken und Raiffeisenbanken -",
      "company_seat": "Schwäbisch Hall",
      "details": "05.06.2025 (Bekanntmachungsdatum)\n\nBaden-Württemberg Amtsgericht Stuttgart HRB 570105\nEinreichung neuer Dokumente\n\nBausparkasse Schwäbisch Hall Aktiengesellschaft - Bausparkasse der Volksbanken und Raiffeisenbanken -\nAktiengesellschaft\nSchwäbisch Hall\n\nDie Gesellschaft hat am 04.06.2025 die Liste über die Zusammensetzung des Aufsichtsrats zum Handelsregister eingereicht."
    },
    {
      "date": "2025-06-05",
      "id": "111325",
      "original_text": "Registerbekanntmachung nach dem Umwandlungsgesetz\nBerlin Amtsgericht Berlin (Charlottenburg) HRB 139386\nmeinUnterricht GmbH – Berlin",
      "type": "Registerbekanntmachung nach dem Umwandlungsgesetz",
      "state": "Berlin",
      "amtsgericht": "Amtsgericht Berlin (Charlottenburg)",
      "registernummer": "HRB 139386",
      "registerart": "HRB",
      "company_name": "meinUnterricht GmbH",
      "company_seat": "Berlin",
      "details": "05.06.2025 (Bekanntmachungsdatum)\n\nBerlin Amtsgericht Berlin (Charlottenburg) HRB 139386\nRegisterbekanntmachung nach dem Umwandlungsgesetz 30.05.2025 (Eintragungsdatum)\n\nmeinUnterricht GmbH\nGesellschaft mit beschränkter Haftung\nBerlin\n\nZu Eintragungsnummer 14 vom 30.05.2025 wird als nicht eingetragen veröffentlicht: Den Gläubigern der an der Spaltung beteiligten Rechtsträger ist, wenn sie binnen sechs Monaten nach dem Tag, an dem die Eintragung der Spaltung in das Register des Sitzes desjenigen Rechtsträgers, dessen Gläubiger sie sind, als bekannt gemacht gilt, ihren Anspruch nach Grund und Höhe schriftlich anmelden, Sicherheit zu leisten, soweit sie nicht Befriedigung verlangen können. Dieses Recht steht den Gläubigern jedoch nur zu, wenn sie glaubhaft machen, dass durch die Spaltung die Erfüllung ihrer Forderung gefährdet wird. Das Recht, Sicherheitsleistung zu verlangen, steht Gläubigern nicht zu, die im Falle der Insolvenz ein Recht auf vorzugsweise Befriedigung aus einer Deckungsmasse haben, die nach gesetzlicher Vorschrift zu ihrem Schutz errichtet und staatlich überwacht ist."
    },
    {
      "date": "2025-06-05",
      "id": "111326",
      "original_text": "Löschungsankündigung\nBrandenburg Amtsgericht Cottbus HRA 2390\nNN Immobilien GmbH & Co. Bauträger KG – Königs Wusterhausen",
      "type": "Löschungsankündigung",
      "state": "Brandenburg",
      "amtsgericht": "Amtsgericht Cottbus",
      "registernummer": "HRA 2390",
      "registerart": "HRA",
      "company_name": "NN Immobilien GmbH & Co. Bauträger KG",
      "company_seat": "Königs Wusterhausen",
      "details": "05.06.2025 (Bekanntmachungsdatum)\n\nBrandenburg Amtsgericht Cottbus HRA 2390\nLöschungsankündigung\n\nNN Immobilien GmbH & Co. Bauträger KG\nKommanditgesellschaft\nKönigs Wusterhausen\n\nBei der nachstehenden Gesellschaft wird das Amtslöschungsverfahren gemäß § 394 FamFG eingeleitet."
    },
    {
      "date": "2025-06-05",
      "id": "111327",
      "original_text": "Löschungsankündigung\nBaden-Württemberg Amtsgericht Mannheim HRB 732796\nARCHI MADE GmbH – Baden-Baden",
      "type": "Löschungsankündigung",
      "state": "Baden-Württemberg",
      "amtsgericht": "Amtsgericht Mannheim",
      "registernummer": "HRB 732796",
      "registerart": "HRB",
      "company_name": "ARCHI MADE GmbH",
      "company_seat": "Baden-Baden",
      "details": "05.06.2025 (Bekanntmachungsdatum)\n\nBaden-Württemberg Amtsgericht Mannheim HRB 732796\nLöschungsankündigung\n\nARCHI MADE GmbH\nGesellschaft mit beschränkter Haftung\nBaden-Baden\n\nDas Gericht beabsichtigt, die Eintragung der Geschäftsführerin Brunello, Donatella, *17.02.1964, Schio/Italien im Handelsregister wegen des Mangels einer wesentlichen Voraussetzung von Amts wegen nach § 395 FamFG als unzulässig zu löschen. Die Frist zur Geltendmachung eines Widerspruchs gegen die beabsichtigte Löschung ist auf einen Monat ab Veröffentlichung bestimmt."
    },
    {
      "date": "2025-06-05",
      "id": "111328",
      "original_text": "Sonstige Registerbekanntmachung\nBaden-Württemberg Amtsgericht Stuttgart HRB 751599\nMartagon Family Office AG – Ludwigsburg",
      "type": "Sonstige Registerbekanntmachung",
      "state": "Baden-Württemberg",
      "amtsgericht": "Amtsgericht Stuttgart",
      "registernummer": "HRB 751599",
      "registerart": "HRB",
      "company_name": "Martagon Family Office AG",
      "company_seat": "Ludwigsburg",
      "details": "05.06.2025 (Bekanntmachungsdatum)\n\nBaden-Württemberg Amtsgericht Stuttgart HRB 751599\nSonstige Registerbekanntmachung 05.06.2025 (Eintragungsdatum)\n\nMartagon Family Office AG\nAktiengesellschaft\nLudwigsburg\n\nDen Gläubigern, deren Forderungen begründet worden sind, bevor die Eintragung des Beschlusses bekanntgemacht worden ist, ist, wenn sie sich binnen sechs Monaten nach der Bekanntmachung zu diesem Zweck melden, Sicherheit zu leisten, soweit sie nicht Befriedigung verlangen können."
    },
    {
      "date": "2025-06-05",
      "id": "111329",
      "original_text": "Registerbekanntmachung nach dem Umwandlungsgesetz\nSchleswig-Holstein Amtsgericht Kiel HRB 27891\nNordverschlauchung GmbH – Tüttendorf",
      "type": "Registerbekanntmachung nach dem Umwandlungsgesetz",
      "state": "Schleswig-Holstein",
      "amtsgericht": "Amtsgericht Kiel",
      "registernummer": "HRB 27891",
      "registerart": "HRB",
      "company_name": "Nordverschlauchung GmbH",
      "company_seat": "Tüttendorf",
      "details": "05.06.2025 (Bekanntmachungsdatum)\n\nSchleswig-Holstein Amtsgericht Kiel HRB 27891\nRegisterbekanntmachung nach dem Umwandlungsgesetz 04.06.2025 (Eintragungsdatum)\n\nNordverschlauchung GmbH\nGesellschaft mit beschränkter Haftung\nTüttendorf\n\nAls nicht eingetragen wird veröffentlicht: Den Gläubigern der an der Spaltung beteiligten Rechtsträger ist, wenn sie binnen sechs Monaten nach dem Tag, an dem die Eintragung der Spaltung in das Register des Sitzes desjenigen Rechtsträgers, dessen Gläubiger sie sind,  bekannt gemacht worden ist, ihren Anspruch nach Grund und Höhe schriftlich anmelden, Sicherheit zu leisten, soweit sie nicht Befriedigung verlangen können. Dieses Recht steht den Gläubigern jedoch nur zu, wenn sie glaubhaft machen, dass durch die Spaltung die Erfüllung ihrer Forderung gefährdet wird."
    },
    {
      "date": "2025-06-05",
      "id": "111330",
      "original_text": "Registerbekanntmachung nach dem Umwandlungsgesetz\nBerlin Amtsgericht Berlin (Charlottenburg) HRB 264268\nAufzugsverbund Deutschland Verwaltungs GmbH – Berlin",
      "type": "Registerbekanntmachung nach dem Umwandlungsgesetz",
      "state": "Berlin",
      "amtsgericht": "Amtsgericht Berlin (Charlottenburg)",
      "registernummer": "HRB 264268",
      "registerart": "HRB",
      "company_name": "Aufzugsverbund Deutschland Verwaltungs GmbH",
      "company_seat": "Berlin",
      "details": "05.06.2025 (Bekanntmachungsdatum)\n\nBerlin Amtsgericht Berlin (Charlottenburg) HRB 264268\nRegisterbekanntmachung nach dem Umwandlungsgesetz 04.06.2025 (Eintragungsdatum)\n\nAufzugsverbund Deutschland Verwaltungs GmbH\nGesellschaft mit beschränkter Haftung\nBerlin\n\nZu Eintragungsnummer 4 vom 04.06.2025 wird als nicht eingetragen veröffentlicht: Den Gläubigern der an der Verschmelzung beteiligten Rechtsträger ist, wenn sie binnen sechs Monaten nach dem Tag, an dem die Eintragung der Verschmelzung in das Register des Sitzes desjenigen Rechtsträgers, dessen Gläubiger sie sind, als bekannt gemacht gilt, ihren Anspruch nach Grund und Höhe schriftlich anmelden, Sicherheit zu leisten, soweit sie nicht Befriedigung verlangen können. Dieses Recht steht den Gläubigern jedoch nur zu, wenn sie glaubhaft machen, dass durch die Verschmelzung die Erfüllung ihrer Forderung gefährdet wird. Das Recht, Sicherheitsleistung zu verlangen, steht Gläubigern nicht zu, die im Falle der Insolvenz ein Recht auf vorzugsweise Befriedigung aus einer Deckungsmasse haben, die nach gesetzlicher Vorschrift zu ihrem Schutz errichtet und staatlich überwacht ist."
    },
    {
      "date": "2025-06-05",
      "id": "111331",
      "original_text": "Registerbekanntmachung nach dem Umwandlungsgesetz\nBaden-Württemberg Amtsgericht Stuttgart HRB 785232\nFitness United Biberach GmbH – Fellbach",
      "type": "Registerbekanntmachung nach dem Umwandlungsgesetz",
      "state": "Baden-Württemberg",
      "amtsgericht": "Amtsgericht Stuttgart",
      "registernummer": "HRB 785232",
      "registerart": "HRB",
      "company_name": "Fitness United Biberach GmbH",
      "company_seat": "Fellbach",
      "details": "05.06.2025 (Bekanntmachungsdatum)\n\nBaden-Württemberg Amtsgericht Stuttgart HRB 785232\nRegisterbekanntmachung nach dem Umwandlungsgesetz 05.06.2025 (Eintragungsdatum)\n\nFitness United Biberach GmbH\nGesellschaft mit beschränkter Haftung\nFellbach\n\nDen Gläubigern der an der Verschmelzung beteiligten Rechtsträger ist, wenn sie binnen sechs Monaten nach dem Tag, an dem die Eintragung der Verschmelzung in das Register des Sitzes desjenigen Rechtsträgers, dessen Gläubiger sie sind, nach § 19 Abs. 3 UmwG als bekanntgemacht gilt, ihren Anspruch nach Grund und Höhe schriftlich anmelden, Sicherheit zu leisten, soweit sie nicht Befriedigung verlangen können. Dieses Recht steht den Gläubigern jedoch nur zu, wenn sie glaubhaft machen, dass durch die Verschmelzung die Erfüllung ihrer Forderung gefährdet wird."
    },
    {
      "date": "2025-06-05",
      "id": "111332",
      "original_text": "Registerbekanntmachung nach dem Umwandlungsgesetz\nBerlin Amtsgericht Berlin (Charlottenburg) HRB 139386\nmeinUnterricht GmbH – Berlin",
      "type": "Registerbekanntmachung nach dem Umwandlungsgesetz",
      "state": "Berlin",
      "amtsgericht": "Amtsgericht Berlin (Charlottenburg)",
      "registernummer": "HRB 139386",
      "registerart": "HRB",
      "company_name": "meinUnterricht GmbH",
      "company_seat": "Berlin",
      "details": "05.06.2025 (Bekanntmachungsdatum)\n\nBerlin Amtsgericht Berlin (Charlottenburg) HRB 139386\nRegisterbekanntmachung nach dem Umwandlungsgesetz 04.06.2025 (Eintragungsdatum)\n\nmeinUnterricht GmbH\nGesellschaft mit beschränkter Haftung\nBerlin\n\nZu Eintragungsnummer 15 vom 04.06.2025 wird als nicht eingetragen veröffentlicht: Den Gläubigern der an der Verschmelzung beteiligten Rechtsträger ist, wenn sie binnen sechs Monaten nach dem Tag, an dem die Eintragung der Verschmelzung in das Register des Sitzes desjenigen Rechtsträgers, dessen Gläubiger sie sind, als bekannt gemacht gilt, ihren Anspruch nach Grund und Höhe schriftlich anmelden, Sicherheit zu leisten, soweit sie nicht Befriedigung verlangen können. Dieses Recht steht den Gläubigern jedoch nur zu, wenn sie glaubhaft machen, dass durch die Verschmelzung die Erfüllung ihrer Forderung gefährdet wird. Das Recht, Sicherheitsleistung zu verlangen, steht Gläubigern nicht zu, die im Falle der Insolvenz ein Recht auf vorzugsweise Befriedigung aus einer Deckungsmasse haben, die nach gesetzlicher Vorschrift zu ihrem Schutz errichtet und staatlich überwacht ist."
    },
    {
      "date": "2025-06-05",
      "id": "111333",
      "original_text": "Registerbekanntmachung nach dem Umwandlungsgesetz\nBerlin Amtsgericht Berlin (Charlottenburg) HRB 128273\nquipma GmbH – Berlin",
      "type": "Registerbekanntmachung nach dem Umwandlungsgesetz",
      "state": "Berlin",
      "amtsgericht": "Amtsgericht Berlin (Charlottenburg)",
      "registernummer": "HRB 128273",
      "registerart": "HRB",
      "company_name": "quipma GmbH",
      "company_seat": "Berlin",
      "details": "05.06.2025 (Bekanntmachungsdatum)\n\nBerlin Amtsgericht Berlin (Charlottenburg) HRB 128273\nRegisterbekanntmachung nach dem Umwandlungsgesetz 04.06.2025 (Eintragungsdatum)\n\nquipma GmbH\nGesellschaft mit beschränkter Haftung\nBerlin\n\nZu Eintragungsnummer 4 vom 04.06.2025 wird als nicht eingetragen veröffentlicht: Den Gläubigern der an der Verschmelzung beteiligten Rechtsträger ist, wenn sie binnen sechs Monaten nach dem Tag, an dem die Eintragung der Verschmelzung in das Register des Sitzes desjenigen Rechtsträgers, dessen Gläubiger sie sind, als bekannt gemacht gilt, ihren Anspruch nach Grund und Höhe schriftlich anmelden, Sicherheit zu leisten, soweit sie nicht Befriedigung verlangen können. Dieses Recht steht den Gläubigern jedoch nur zu, wenn sie glaubhaft machen, dass durch die Verschmelzung die Erfüllung ihrer Forderung gefährdet wird. Das Recht, Sicherheitsleistung zu verlangen, steht Gläubigern nicht zu, die im Falle der Insolvenz ein Recht auf vorzugsweise Befriedigung aus einer Deckungsmasse haben, die nach gesetzlicher Vorschrift zu ihrem Schutz errichtet und staatlich überwacht ist."
    },
    {
      "date": "2025-06-05",
      "id": "111334",
      "original_text": "Löschungsankündigung\nThüringen Amtsgericht Jena HRB 509031\nAspirius UG (haftungsbeschränkt) – Unstruttal",
      "type": "Löschungsankündigung",
      "state": "Thüringen",
      "amtsgericht": "Amtsgericht Jena",
      "registernummer": "HRB 509031",
      "registerart": "HRB",
      "company_name": "Aspirius UG (haftungsbeschränkt)",
      "company_seat": "Unstruttal",
      "details": "05.06.2025 (Bekanntmachungsdatum)\n\nThüringen Amtsgericht Jena HRB 509031\nLöschungsankündigung\n\nAspirius UG (haftungsbeschränkt)\nGesellschaft mit beschränkter Haftung\nUnstruttal\n\nDas Registergericht beabsichtigt, die im Handelsregister eingetragene Gesellschaft wegen Vermögenslosigkeit nach § 394 FamFG von Amts wegen zu löschen. Die Frist zur Erhebung eines Widerspruchs gegen die beabsichtigte Löschung wird auf 6 Wochen festgesetzt."
    },
    {
      "date": "2025-06-05",
      "id": "111335",
      "original_text": "Löschungsankündigung\nThüringen Amtsgericht Jena HRA 503364\nMB Promotion UG (haftungsbeschränkt) & Co. KG – Unstruttal",
      "type": "Löschungsankündigung",
      "state": "Thüringen",
      "amtsgericht": "Amtsgericht Jena",
      "registernummer": "HRA 503364",
      "registerart": "HRA",
      "company_name": "MB Promotion UG (haftungsbeschränkt) & Co. KG",
      "company_seat": "Unstruttal",
      "details": "05.06.2025 (Bekanntmachungsdatum)\n\nThüringen Amtsgericht Jena HRA 503364\nLöschungsankündigung\n\nMB Promotion UG (haftungsbeschränkt) & Co. KG\nKommanditgesellschaft\nUnstruttal\n\nDas Registergericht beabsichtigt, die im Handelsregister eingetragene Gesellschaft wegen Vermögenslosigkeit nach § 394 FamFG von Amts wegen zu löschen. Die Frist zur Erhebung eines Widerspruchs gegen die beabsichtigte Löschung wird auf 6 Wochen festgesetzt."
    },
    {
      "date": "2025-06-05",
      "id": "111336",
      "original_text": "Registerbekanntmachung nach dem Umwandlungsgesetz\nBerlin Amtsgericht Berlin (Charlottenburg) HRA 62969\nNeXtWind Windpark Beteiligung 33 GmbH & Co. KG – Berlin",
      "type": "Registerbekanntmachung nach dem Umwandlungsgesetz",
      "state": "Berlin",
      "amtsgericht": "Amtsgericht Berlin (Charlottenburg)",
      "registernummer": "HRA 62969",
      "registerart": "HRA",
      "company_name": "NeXtWind Windpark Beteiligung 33 GmbH & Co. KG",
      "company_seat": "Berlin",
      "details": "05.06.2025 (Bekanntmachungsdatum)\n\nBerlin Amtsgericht Berlin (Charlottenburg) HRA 62969\nRegisterbekanntmachung nach dem Umwandlungsgesetz 04.06.2025 (Eintragungsdatum)\n\nNeXtWind Windpark Beteiligung 33 GmbH & Co. KG\nKommanditgesellschaft\nBerlin\n\nZu Eintragungsnummer 4 vom 04.06.2025 wird als nicht eingetragen veröffentlicht:\nDen Gläubigern der an der Spaltung beteiligten Rechtsträger ist, wenn sie binnen sechs Monaten nach dem Tag, an dem die Eintragung der Spaltung in das Register des Sitzes desjenigen Rechtsträgers, dessen Gläubiger sie sind, als bekannt gemacht gilt, ihren Anspruch nach Grund und Höhe schriftlich anmelden, Sicherheit zu leisten, soweit sie nicht Befriedigung verlangen können. Dieses Recht steht den Gläubigern jedoch nur zu, wenn sie glaubhaft machen, dass durch die Spaltung die Erfüllung ihrer Forderung gefährdet wird. Das Recht, Sicherheitsleistung zu verlangen, steht Gläubigern nicht zu, die im Falle der Insolvenz ein Recht auf vorzugsweise Befriedigung aus einer Deckungsmasse haben, die nach gesetzlicher Vorschrift zu ihrem Schutz errichtet und staatlich überwacht ist."
    },
    {
      "date": "2025-06-05",
      "id": "111337",
      "original_text": "Registerbekanntmachung nach dem Umwandlungsgesetz\nBerlin Amtsgericht Berlin (Charlottenburg) HRA 60267\nNeXtWind Windpark Beteiligung VIII GmbH & Co. KG – Berlin",
      "type": "Registerbekanntmachung nach dem Umwandlungsgesetz",
      "state": "Berlin",
      "amtsgericht": "Amtsgericht Berlin (Charlottenburg)",
      "registernummer": "HRA 60267",
      "registerart": "HRA",
      "company_name": "NeXtWind Windpark Beteiligung VIII GmbH & Co. KG",
      "company_seat": "Berlin",
      "details": "05.06.2025 (Bekanntmachungsdatum)\n\nBerlin Amtsgericht Berlin (Charlottenburg) HRA 60267\nRegisterbekanntmachung nach dem Umwandlungsgesetz 04.06.2025 (Eintragungsdatum)\n\nNeXtWind Windpark Beteiligung VIII GmbH & Co. KG\nKommanditgesellschaft\nBerlin\n\nZu Eintragungsnummer 4 vom 04.06.2025 wird als nicht eingetragen veröffentlicht:\nDen Gläubigern der an der Spaltung beteiligten Rechtsträger ist, wenn sie binnen sechs Monaten nach dem Tag, an dem die Eintragung der Spaltung in das Register des Sitzes desjenigen Rechtsträgers, dessen Gläubiger sie sind, als bekannt gemacht gilt, ihren Anspruch nach Grund und Höhe schriftlich anmelden, Sicherheit zu leisten, soweit sie nicht Befriedigung verlangen können. Dieses Recht steht den Gläubigern jedoch nur zu, wenn sie glaubhaft machen, dass durch die Spaltung die Erfüllung ihrer Forderung gefährdet wird. Das Recht, Sicherheitsleistung zu verlangen, steht Gläubigern nicht zu, die im Falle der Insolvenz ein Recht auf vorzugsweise Befriedigung aus einer Deckungsmasse haben, die nach gesetzlicher Vorschrift zu ihrem Schutz errichtet und staatlich überwacht ist."
    },
    {
      "date": "2025-06-05",
      "id": "111338",
      "original_text": "Registerbekanntmachung nach dem Umwandlungsgesetz\nBerlin Amtsgericht Berlin (Charlottenburg) HRA 60261\nNeXtWind Windpark Beteiligung IX GmbH & Co. KG – Berlin",
      "type": "Registerbekanntmachung nach dem Umwandlungsgesetz",
      "state": "Berlin",
      "amtsgericht": "Amtsgericht Berlin (Charlottenburg)",
      "registernummer": "HRA 60261",
      "registerart": "HRA",
      "company_name": "NeXtWind Windpark Beteiligung IX GmbH & Co. KG",
      "company_seat": "Berlin",
      "details": "05.06.2025 (Bekanntmachungsdatum)\n\nBerlin Amtsgericht Berlin (Charlottenburg) HRA 60261\nRegisterbekanntmachung nach dem Umwandlungsgesetz 04.06.2025 (Eintragungsdatum)\n\nNeXtWind Windpark Beteiligung IX GmbH & Co. KG\nKommanditgesellschaft\nBerlin\n\nZu Eintragungsnummer 4 vom 04.06.2025 wird als nicht eingetragen veröffentlicht: Den Gläubigern der an der Verschmelzung beteiligten Rechtsträger ist, wenn sie binnen sechs Monaten nach dem Tag, an dem die Eintragung der Verschmelzung in das Register des Sitzes desjenigen Rechtsträgers, dessen Gläubiger sie sind, als bekannt gemacht gilt, ihren Anspruch nach Grund und Höhe schriftlich anmelden, Sicherheit zu leisten, soweit sie nicht Befriedigung verlangen können. Dieses Recht steht den Gläubigern jedoch nur zu, wenn sie glaubhaft machen, dass durch die Verschmelzung die Erfüllung ihrer Forderung gefährdet wird. Das Recht, Sicherheitsleistung zu verlangen, steht Gläubigern nicht zu, die im Falle der Insolvenz ein Recht auf vorzugsweise Befriedigung aus einer Deckungsmasse haben, die nach gesetzlicher Vorschrift zu ihrem Schutz errichtet und staatlich überwacht ist."
    },
    {
      "date": "2025-06-05",
      "id": "111339",
      "original_text": "Löschungsankündigung\nBaden-Württemberg Amtsgericht Stuttgart HRB 205875\nFrye Planen und Bauen Verwaltungsgesellschaft mbH – Asperg",
      "type": "Löschungsankündigung",
      "state": "Baden-Württemberg",
      "amtsgericht": "Amtsgericht Stuttgart",
      "registernummer": "HRB 205875",
      "registerart": "HRB",
      "company_name": "Frye Planen und Bauen Verwaltungsgesellschaft mbH",
      "company_seat": "Asperg",
      "details": "05.06.2025 (Bekanntmachungsdatum)\n\nBaden-Württemberg Amtsgericht Stuttgart HRB 205875\nLöschungsankündigung\n\nFrye Planen und Bauen Verwaltungsgesellschaft mbH\nGesellschaft mit beschränkter Haftung\nAsperg\n\nDas Gericht beabsichtigt, die Gesellschaft wegen Vermögenslosigkeit im Handelsregister von Amts wegen nach § 394 FamFG zu löschen. Die Frist zur Geltendmachung eines Widerspruchs gegen die beabsichtigte Löschung ist auf zwei Monate ab Veröffentlichung bestimmt."
    },
    {
      "date": "2025-06-05",
      "id": "111340",
      "original_text": "Registerbekanntmachung nach dem Umwandlungsgesetz\nBerlin Amtsgericht Berlin (Charlottenburg) HRA 61764\nNeXtWind Windpark Beteiligung XVI GmbH & Co. KG – Berlin",
      "type": "Registerbekanntmachung nach dem Umwandlungsgesetz",
      "state": "Berlin",
      "amtsgericht": "Amtsgericht Berlin (Charlottenburg)",
      "registernummer": "HRA 61764",
      "registerart": "HRA",
      "company_name": "NeXtWind Windpark Beteiligung XVI GmbH & Co. KG",
      "company_seat": "Berlin",
      "details": "05.06.2025 (Bekanntmachungsdatum)\n\nBerlin Amtsgericht Berlin (Charlottenburg) HRA 61764\nRegisterbekanntmachung nach dem Umwandlungsgesetz 04.06.2025 (Eintragungsdatum)\n\nNeXtWind Windpark Beteiligung XVI GmbH & Co. KG\nKommanditgesellschaft\nBerlin\n\nZu Eintragungsnummer 4 vom 04.06.2025 wird als nicht eingetragen veröffentlicht: Den Gläubigern der an der Verschmelzung beteiligten Rechtsträger ist, wenn sie binnen sechs Monaten nach dem Tag, an dem die Eintragung der Verschmelzung in das Register des Sitzes desjenigen Rechtsträgers, dessen Gläubiger sie sind, als bekannt gemacht gilt, ihren Anspruch nach Grund und Höhe schriftlich anmelden, Sicherheit zu leisten, soweit sie nicht Befriedigung verlangen können. Dieses Recht steht den Gläubigern jedoch nur zu, wenn sie glaubhaft machen, dass durch die Verschmelzung die Erfüllung ihrer Forderung gefährdet wird. Das Recht, Sicherheitsleistung zu verlangen, steht Gläubigern nicht zu, die im Falle der Insolvenz ein Recht auf vorzugsweise Befriedigung aus einer Deckungsmasse haben, die nach gesetzlicher Vorschrift zu ihrem Schutz errichtet und staatlich überwacht ist."
    },
    {
      "date": "2025-06-05",
      "id": "111341",
      "original_text": "Löschungsankündigung\nBerlin Amtsgericht Berlin (Charlottenburg) HRB 220433\nKönig Hoch- und Tiefbau GmbH – Berlin",
      "type": "Löschungsankündigung",
      "state": "Berlin",
      "amtsgericht": "Amtsgericht Berlin (Charlottenburg)",
      "registernummer": "HRB 220433",
      "registerart": "HRB",
      "company_name": "König Hoch- und Tiefbau GmbH",
      "company_seat": "Berlin",
      "details": "05.06.2025 (Bekanntmachungsdatum)\n\nBerlin Amtsgericht Berlin (Charlottenburg) HRB 220433\nLöschungsankündigung\n\nKönig Hoch- und Tiefbau GmbH\nGesellschaft mit beschränkter Haftung\nBerlin\n\nBei der nachstehenden Gesellschaft wird das Amtslöschungsverfahren gemäß § 394 FamFG eingeleitet. Widerspruchsfrist 6 Wochen"
    },
    {
      "date": "2025-06-05",
      "id": "111342",
      "original_text": "Einreichung neuer Dokumente\nBerlin Amtsgericht Berlin (Charlottenburg) HRB 239329\nClark Holding SE – Berlin",
      "type": "Einreichung neuer Dokumente",
      "state": "Berlin",
      "amtsgericht": "Amtsgericht Berlin (Charlottenburg)",
      "registernummer": "HRB 239329",
      "registerart": "HRB",
      "company_name": "Clark Holding SE",
      "company_seat": "Berlin",
      "details": "05.06.2025 (Bekanntmachungsdatum)\n\nBerlin Amtsgericht Berlin (Charlottenburg) HRB 239329\nEinreichung neuer Dokumente\n\nClark Holding SE\nEuropäische Aktiengesellschaft (SE)\nBerlin\n\nAls nicht eingetragen wird veröffentlicht: Es wurde eine neue Liste der Aufsichtsratsmitglieder eingereicht (§ 106 AktG)."
    },
    {
      "date": "2025-06-05",
      "id": "111343",
      "original_text": "Löschungsankündigung\nSaarland Amtsgericht Saarbrücken HRB 33000\nHüftgold Gastro GmbH – Saarbrücken",
      "type": "Löschungsankündigung",
      "state": "Saarland",
      "amtsgericht": "Amtsgericht Saarbrücken",
      "registernummer": "HRB 33000",
      "registerart": "HRB",
      "company_name": "Hüftgold Gastro GmbH",
      "company_seat": "Saarbrücken",
      "details": "05.06.2025 (Bekanntmachungsdatum)\n\nSaarland Amtsgericht Saarbrücken HRB 33000\nLöschungsankündigung\n\nHüftgold Gastro GmbH\nGesellschaft mit beschränkter Haftung\nSaarbrücken\n\nEs ist beabsichtigt, die Gesellschaft von Amts wegen gemäß § 394 FamFG wegen Vermögenslosigkeit zu löschen.\nGegen die Löschung von Amts wegen ist das Rechtsmittel des Widerspruchs statthaft. Der Widerspruch ist binnen einer Frist zwei Monaten beginnend mit dem Tag dieser Veröffentlichung durch Einreichen eines Widerspruchsschreibens -schriftlich oder zur Niederschrift der Geschäftsstelle beim Amtsgericht Saarbrücken, -zentrales Handelsregister-, Mainzerstr.178, 66121 Saarbrücken einzulegen.\nDer Widerspruch muss die Bezeichnung der angefochtenen Löschungsankündigung enthalten sowie die Erklärung, dass Widerspruch eingelegt wird. Er ist vom Widerspruchsführer oder seinem Bevollmächtigten zu unterzeichnen.\nDas Widerspruchsschreiben kann auch in der Form eines elektronischen Dokumentes eingereicht werden, das mit einer qualifizierten elektronischen Signatur nach dem Signaturgesetz versehen sein muss (§§ 14 Abs. 2 FamFG, 130a, 298 ZPO)."
    },
    {
      "date": "2025-06-05",
      "id": "111344",
      "original_text": "Einreichung neuer Dokumente\nBaden-Württemberg Amtsgericht Stuttgart HRB 245255\nWalter Knoll Management AG – Herrenberg",
      "type": "Einreichung neuer Dokumente",
      "state": "Baden-Württemberg",
      "amtsgericht": "Amtsgericht Stuttgart",
      "registernummer": "HRB 245255",
      "registerart": "HRB",
      "company_name": "Walter Knoll Management AG",
      "company_seat": "Herrenberg",
      "details": "05.06.2025 (Bekanntmachungsdatum)\n\nBaden-Württemberg Amtsgericht Stuttgart HRB 245255\nEinreichung neuer Dokumente\n\nWalter Knoll Management AG\nAktiengesellschaft\nHerrenberg\n\nDie Gesellschaft hat am 04.06.2025 die Liste über die Zusammensetzung des Aufsichtsrats zum Handelsregister eingereicht."
    },
    {
      "date": "2025-06-05",
      "id": "111345",
      "original_text": "Registerbekanntmachung nach dem Umwandlungsgesetz\nBaden-Württemberg Amtsgericht Stuttgart HRB 23029\nField Packaging Germany GmbH – Obersulm",
      "type": "Registerbekanntmachung nach dem Umwandlungsgesetz",
      "state": "Baden-Württemberg",
      "amtsgericht": "Amtsgericht Stuttgart",
      "registernummer": "HRB 23029",
      "registerart": "HRB",
      "company_name": "Field Packaging Germany GmbH",
      "company_seat": "Obersulm",
      "details": "05.06.2025 (Bekanntmachungsdatum)\n\nBaden-Württemberg Amtsgericht Stuttgart HRB 23029\nRegisterbekanntmachung nach dem Umwandlungsgesetz 05.06.2025 (Eintragungsdatum)\n\nField Packaging Germany GmbH\nGesellschaft mit beschränkter Haftung\nObersulm\n\nDen Gläubigern der an der Verschmelzung beteiligten Rechtsträger ist, wenn sie binnen sechs Monaten nach dem Tag, an dem die Eintragung der Verschmelzung in das Register des Sitzes desjenigen Rechtsträgers, dessen Gläubiger sie sind, nach § 19 Abs. 3 UmwG als bekanntgemacht gilt, ihren Anspruch nach Grund und Höhe schriftlich anmelden, Sicherheit zu leisten, soweit sie nicht Befriedigung verlangen können. Dieses Recht steht den Gläubigern jedoch nur zu, wenn sie glaubhaft machen, dass durch die Verschmelzung die Erfüllung ihrer Forderung gefährdet wird."
    },
    {
      "date": "2025-06-05",
      "id": "111346",
      "original_text": "Einreichung neuer Dokumente\nBaden-Württemberg Amtsgericht Mannheim HRB 560568\nWeinig International AG – Tauberbischofsheim",
      "type": "Einreichung neuer Dokumente",
      "state": "Baden-Württemberg",
      "amtsgericht": "Amtsgericht Mannheim",
      "registernummer": "HRB 560568",
      "registerart": "HRB",
      "company_name": "Weinig International AG",
      "company_seat": "Tauberbischofsheim",
      "details": "05.06.2025 (Bekanntmachungsdatum)\n\nBaden-Württemberg Amtsgericht Mannheim HRB 560568\nEinreichung neuer Dokumente\n\nWeinig International AG\nAktiengesellschaft\nTauberbischofsheim\n\nDie Gesellschaft hat am 04.06.2025 die Liste über die Zusammensetzung des Aufsichtsrats zum Handelsregister eingereicht."
    },
    {
      "date": "2025-06-05",
      "id": "111347",
      "original_text": "Einreichung neuer Dokumente\nBerlin Amtsgericht Berlin (Charlottenburg) HRB 527\nLandesbank Berlin Holding AG – Berlin",
      "type": "Einreichung neuer Dokumente",
      "state": "Berlin",
      "amtsgericht": "Amtsgericht Berlin (Charlottenburg)",
      "registernummer": "HRB 527",
      "registerart": "HRB",
      "company_name": "Landesbank Berlin Holding AG",
      "company_seat": "Berlin",
      "details": "05.06.2025 (Bekanntmachungsdatum)\n\nBerlin Amtsgericht Berlin (Charlottenburg) HRB 527\nEinreichung neuer Dokumente\n\nLandesbank Berlin Holding AG\nAktiengesellschaft\nBerlin\n\nAls nicht eingetragen wird veröffentlicht: Es wurde eine neue Liste der Aufsichtsratsmitglieder eingereicht (§ 106 AktG)."
    },
    {
      "date": "2025-06-05",
      "id": "111348",
      "original_text": "Registerbekanntmachung nach dem Umwandlungsgesetz\nNordrhein-Westfalen Amtsgericht Coesfeld HRB 2671\nRhenus Data Office GmbH – Nottuln",
      "type": "Registerbekanntmachung nach dem Umwandlungsgesetz",
      "state": "Nordrhein-Westfalen",
      "amtsgericht": "Amtsgericht Coesfeld",
      "registernummer": "HRB 2671",
      "registerart": "HRB",
      "company_name": "Rhenus Data Office GmbH",
      "company_seat": "Nottuln",
      "details": "05.06.2025 (Bekanntmachungsdatum)\n\nNordrhein-Westfalen Amtsgericht Coesfeld HRB 2671\nRegisterbekanntmachung nach dem Umwandlungsgesetz 05.06.2025 (Eintragungsdatum)\n\nRhenus Data Office GmbH\nGesellschaft mit beschränkter Haftung\nNottuln\n\nDen Gläubigern der an der Verschmelzung beteiligten Rechtsträger ist, wenn sie binnen sechs Monaten nach dem Tag, an dem die Eintragung der Verschmelzung in das Register des Sitzes derjenigen Rechtsträger deren Gläubiger sie sind, nach § 19 Absatz 3 UmwG als bekanntgemacht gilt, ihren Anspruch nach Grund und Höhe schriftlich anmelden, Sicherheit zu leisten, soweit sie nicht Befriedigung verlangen können. Dieses Recht steht den Gläubigern jedoch nur zu, wenn sie glaubhaft machen, dass durch die Verschmelzung die Erfüllung ihrer Forderung gefährdet wird."
    },
    {
      "date": "2025-06-05",
      "id": "111349",
      "original_text": "Registerbekanntmachung nach dem Umwandlungsgesetz\nBerlin Amtsgericht Berlin (Charlottenburg) HRB 170977\nS-Servicepartner Deutschland GmbH – Berlin",
      "type": "Registerbekanntmachung nach dem Umwandlungsgesetz",
      "state": "Berlin",
      "amtsgericht": "Amtsgericht Berlin (Charlottenburg)",
      "registernummer": "HRB 170977",
      "registerart": "HRB",
      "company_name": "S-Servicepartner Deutschland GmbH",
      "company_seat": "Berlin",
      "details": "05.06.2025 (Bekanntmachungsdatum)\n\nBerlin Amtsgericht Berlin (Charlottenburg) HRB 170977\nRegisterbekanntmachung nach dem Umwandlungsgesetz 03.06.2025 (Eintragungsdatum)\n\nS-Servicepartner Deutschland GmbH\nGesellschaft mit beschränkter Haftung\nBerlin\n\nZu Eintragungsnummer 19 vom 03.06.2025 wird als nicht eingetragen veröffentlicht: Den Gläubigern der an der Verschmelzung beteiligten Rechtsträger ist, wenn sie binnen sechs Monaten nach dem Tag, an dem die Eintragung der Verschmelzung in das Register des Sitzes desjenigen Rechtsträgers, dessen Gläubiger sie sind, als bekannt gemacht gilt, ihren Anspruch nach Grund und Höhe schriftlich anmelden, Sicherheit zu leisten, soweit sie nicht Befriedigung verlangen können. Dieses Recht steht den Gläubigern jedoch nur zu, wenn sie glaubhaft machen, dass durch die Verschmelzung die Erfüllung ihrer Forderung gefährdet wird. Das Recht, Sicherheitsleistung zu verlangen, steht Gläubigern nicht zu, die im Falle der Insolvenz ein Recht auf vorzugsweise Befriedigung aus einer Deckungsmasse haben, die nach gesetzlicher Vorschrift zu ihrem Schutz errichtet und staatlich überwacht ist."
    },
    {
      "date": "2025-06-05",
      "id": "111350",
      "original_text": "Registerbekanntmachung nach dem Umwandlungsgesetz\nBaden-Württemberg Amtsgericht Freiburg GsR 883\nKnobeloch Finn Zinedine Ragnar & Knobeloch Luke Simeon Adenci eGbR – Freiburg im Breisgau",
      "type": "Registerbekanntmachung nach dem Umwandlungsgesetz",
      "state": "Baden-Württemberg",
      "amtsgericht": "Amtsgericht Freiburg",
      "registernummer": "GsR 883",
      "registerart": "GsR",
      "company_name": "Knobeloch Finn Zinedine Ragnar & Knobeloch Luke Simeon Adenci eGbR",
      "company_seat": "Freiburg im Breisgau",
      "details": "05.06.2025 (Bekanntmachungsdatum)\n\nBaden-Württemberg Amtsgericht Freiburg GsR 883\nRegisterbekanntmachung nach dem Umwandlungsgesetz 05.06.2025 (Eintragungsdatum)\n\nKnobeloch Finn Zinedine Ragnar & Knobeloch Luke Simeon Adenci eGbR\nGesellschaft bürgerlichen Rechts\nFreiburg im Breisgau\n\nDen Gläubigern des an dem Formwechsel beteiligten Rechtsträgers ist, wenn sie binnen sechs Monaten nach dem Tag, an dem die Eintragung des Formwechsels in das Register des Sitzes desjenigen Rechtsträgers, dessen Gläubiger sie sind, nach § 19 Abs. 3 UmwG als bekanntgemacht gilt, ihren Anspruch nach Grund und Höhe schriftlich anmelden, Sicherheit zu leisten, soweit sie nicht Befriedigung verlangen können. Dieses Recht steht den Gläubigern jedoch nur zu, wenn sie glaubhaft machen, dass durch den Formwechsel die Erfüllung ihrer Forderung gefährdet wird."
    },
    {
      "date": "2025-06-05",
      "id": "111351",
      "original_text": "Löschungsankündigung\nBerlin Amtsgericht Berlin (Charlottenburg) HRB 173709\nHTS BERLIN BAU GmbH – Berlin",
      "type": "Löschungsankündigung",
      "state": "Berlin",
      "amtsgericht": "Amtsgericht Berlin (Charlottenburg)",
      "registernummer": "HRB 173709",
      "registerart": "HRB",
      "company_name": "HTS BERLIN BAU GmbH",
      "company_seat": "Berlin",
      "details": "05.06.2025 (Bekanntmachungsdatum)\n\nBerlin Amtsgericht Berlin (Charlottenburg) HRB 173709\nLöschungsankündigung\n\nHTS BERLIN BAU GmbH\nGesellschaft mit beschränkter Haftung\nBerlin\n\nBei der nachstehenden Gesellschaft wird das Amtslöschungsverfahren gemäß § 394 FamFG eingeleitet. Widerspruchsfrist 6 Wochen"
    },
    {
      "date": "2025-06-05",
      "id": "111352",
      "original_text": "Registerbekanntmachung nach dem Umwandlungsgesetz\nNordrhein-Westfalen Amtsgericht Coesfeld HRB 14492\nScheuten Solar Immobilien GmbH – Heiden",
      "type": "Registerbekanntmachung nach dem Umwandlungsgesetz",
      "state": "Nordrhein-Westfalen",
      "amtsgericht": "Amtsgericht Coesfeld",
      "registernummer": "HRB 14492",
      "registerart": "HRB",
      "company_name": "Scheuten Solar Immobilien GmbH",
      "company_seat": "Heiden",
      "details": "05.06.2025 (Bekanntmachungsdatum)\n\nNordrhein-Westfalen Amtsgericht Coesfeld HRB 14492\nRegisterbekanntmachung nach dem Umwandlungsgesetz 05.06.2025 (Eintragungsdatum)\n\nScheuten Solar Immobilien GmbH\nGesellschaft mit beschränkter Haftung\nHeiden\n\nDen Gläubigern der an der Verschmelzung beteiligten Rechtsträger ist, wenn sie binnen sechs Monaten nach dem Tag, an dem die Eintragung der Verschmelzung in das Register des Sitzes derjenigen Rechtsträger deren Gläubiger sie sind, nach § 19 Absatz 3 UmwG als bekanntgemacht gilt, ihren Anspruch nach Grund und Höhe schriftlich anmelden, Sicherheit zu leisten, soweit sie nicht Befriedigung verlangen können. Dieses Recht steht den Gläubigern jedoch nur zu, wenn sie glaubhaft machen, dass durch die Verschmelzung die Erfüllung ihrer Forderung gefährdet wird."
    },
    {
      "date": "2025-06-05",
      "id": "111353",
      "original_text": "Einreichung neuer Dokumente\nSaarland Amtsgericht Saarbrücken HRB 9613\nCaritas Trägergesellschaft Saarbrücken mbH (cts) – Saarbrücken",
      "type": "Einreichung neuer Dokumente",
      "state": "Saarland",
      "amtsgericht": "Amtsgericht Saarbrücken",
      "registernummer": "HRB 9613",
      "registerart": "HRB",
      "company_name": "Caritas Trägergesellschaft Saarbrücken mbH (cts)",
      "company_seat": "Saarbrücken",
      "details": "05.06.2025 (Bekanntmachungsdatum)\n\nSaarland Amtsgericht Saarbrücken HRB 9613\nEinreichung neuer Dokumente\n\nCaritas Trägergesellschaft Saarbrücken mbH (cts)\nGesellschaft mit beschränkter Haftung\nSaarbrücken\n\nDie Geschäftsführung der Gesellschaft hat eine Liste der Mitglieder des Aufsichtsrats zum Handelsregister eingereicht (§ 52 Abs. 3 Satz 2 GmbHG)."
    },
    {
      "date": "2025-06-05",
      "id": "111354",
      "original_text": "Löschungsankündigung\nBrandenburg Amtsgericht Potsdam HRB 29816\nPalme Wohnmobile GmbH – Werder (Havel)",
      "type": "Löschungsankündigung",
      "state": "Brandenburg",
      "amtsgericht": "Amtsgericht Potsdam",
      "registernummer": "HRB 29816",
      "registerart": "HRB",
      "company_name": "Palme Wohnmobile GmbH",
      "company_seat": "Werder (Havel)",
      "details": "05.06.2025 (Bekanntmachungsdatum)\n\nBrandenburg Amtsgericht Potsdam HRB 29816\nLöschungsankündigung\n\nPalme Wohnmobile GmbH\nGesellschaft mit beschränkter Haftung\nWerder (Havel)\n\nBei der nachstehenden Gesellschaft wird das Amtslöschungsverfahren gemäß § 394 FamFG eingeleitet. Widerspruchsfrist: 8 Wochen."
    },
    {
      "date": "2025-06-05",
      "id": "111355",
      "original_text": "Registerbekanntmachung nach dem Umwandlungsgesetz\nBrandenburg Amtsgericht Cottbus HRB 9463\nH.-P. Fischer Elektronik GmbH – Mittenwalde",
      "type": "Registerbekanntmachung nach dem Umwandlungsgesetz",
      "state": "Brandenburg",
      "amtsgericht": "Amtsgericht Cottbus",
      "registernummer": "HRB 9463",
      "registerart": "HRB",
      "company_name": "H.-P. Fischer Elektronik GmbH",
      "company_seat": "Mittenwalde",
      "details": "05.06.2025 (Bekanntmachungsdatum)\n\nBrandenburg Amtsgericht Cottbus HRB 9463\nRegisterbekanntmachung nach dem Umwandlungsgesetz 05.06.2025 (Eintragungsdatum)\n\nH.-P. Fischer Elektronik GmbH\nGesellschaft mit beschränkter Haftung\nMittenwalde\n\nDen Gläubigern der an der Verschmelzung beteiligten Rechtsträger ist, wenn sie binnen sechs Monaten nach dem Tag, an dem die Eintragung der Verschmelzung in das Register des Sitzes desjenigen Rechtsträgers, dessen Gläubiger sie sind, als bekannt gemacht gilt, ihren Anspruch nach Grund und Höhe schriftlich anmelden, Sicherheit zu leisten, soweit sie nicht Befriedigung verlangen können. Dieses Recht steht den Gläubigern jedoch nur zu, wenn sie glaubhaft machen, dass durch die Verschmelzung die Erfüllung ihrer Forderung gefährdet wirdom 05.06.2025 wird als nicht eingetragen veröffentlicht:"
    },
    {
      "date": "2025-06-05",
      "id": "111356",
      "original_text": "Registerbekanntmachung nach dem Umwandlungsgesetz\nBaden-Württemberg Amtsgericht Stuttgart HRA 460407\nKlaiber Bus GmbH & Co. KG – Spaichingen",
      "type": "Registerbekanntmachung nach dem Umwandlungsgesetz",
      "state": "Baden-Württemberg",
      "amtsgericht": "Amtsgericht Stuttgart",
      "registernummer": "HRA 460407",
      "registerart": "HRA",
      "company_name": "Klaiber Bus GmbH & Co. KG",
      "company_seat": "Spaichingen",
      "details": "05.06.2025 (Bekanntmachungsdatum)\n\nBaden-Württemberg Amtsgericht Stuttgart HRA 460407\nRegisterbekanntmachung nach dem Umwandlungsgesetz 05.06.2025 (Eintragungsdatum)\n\nKlaiber Bus GmbH & Co. KG\nKommanditgesellschaft\nSpaichingen\n\nDen Gläubigern der an der Verschmelzung beteiligten Rechtsträger ist, wenn sie binnen sechs Monaten nach dem Tag, an dem die Eintragung der Verschmelzung in das Register des Sitzes desjenigen Rechtsträgers, dessen Gläubiger sie sind, nach § 19 Abs. 3 UmwG als bekanntgemacht gilt, ihren Anspruch nach Grund und Höhe schriftlich anmelden, Sicherheit zu leisten, soweit sie nicht Befriedigung verlangen können. Dieses Recht steht den Gläubigern jedoch nur zu, wenn sie glaubhaft machen, dass durch die Verschmelzung die Erfüllung ihrer Forderung gefährdet wird."
    },
    {
      "date": "2025-06-05",
      "id": "111357",
      "original_text": "Löschungsankündigung\nMecklenburg-Vorpommern Amtsgericht Rostock HRB 13208\nRené Roß Transporte GmbH – Güstrow",
      "type": "Löschungsankündigung",
      "state": "Mecklenburg-Vorpommern",
      "amtsgericht": "Amtsgericht Rostock",
      "registernummer": "HRB 13208",
      "registerart": "HRB",
      "company_name": "René Roß Transporte GmbH",
      "company_seat": "Güstrow",
      "details": "05.06.2025 (Bekanntmachungsdatum)\n\nMecklenburg-Vorpommern Amtsgericht Rostock HRB 13208\nLöschungsankündigung\n\nRené Roß Transporte GmbH\nGesellschaft mit beschränkter Haftung\nGüstrow\n\nDas Registergericht beabsichtigt, die im Handelsregister eingetragene Gesellschaft von Amts wegen nach § 394 FamFG zu löschen. Die Frist zur Erhebung eines Widerspruchs gegen die beabsichtigte Löschung wird auf einen Monat festgesetzt."
    },
    {
      "date": "2025-06-05",
      "id": "111358",
      "original_text": "Löschungsankündigung\nMecklenburg-Vorpommern Amtsgericht Rostock HRB 526\nBOHN BAU GmbH – Rostock",
      "type": "Löschungsankündigung",
      "state": "Mecklenburg-Vorpommern",
      "amtsgericht": "Amtsgericht Rostock",
      "registernummer": "HRB 526",
      "registerart": "HRB",
      "company_name": "BOHN BAU GmbH",
      "company_seat": "Rostock",
      "details": "05.06.2025 (Bekanntmachungsdatum)\n\nMecklenburg-Vorpommern Amtsgericht Rostock HRB 526\nLöschungsankündigung\n\nBOHN BAU GmbH\nGesellschaft mit beschränkter Haftung\nRostock\n\nDas Registergericht beabsichtigt, die im Handelsregister eingetragene Gesellschaft von Amts wegen nach § 394 FamFG zu löschen. Die Frist zur Erhebung eines Widerspruchs gegen die beabsichtigte Löschung wird auf einen Monat festgesetzt."
    },
    {
      "date": "2025-06-05",
      "id": "111359",
      "original_text": "Löschungsankündigung\nSachsen Amtsgericht Leipzig HRB 24171\nMedizinisches Versorgungszentrum Listbogen GmbH – Leipzig",
      "type": "Löschungsankündigung",
      "state": "Sachsen",
      "amtsgericht": "Amtsgericht Leipzig",
      "registernummer": "HRB 24171",
      "registerart": "HRB",
      "company_name": "Medizinisches Versorgungszentrum Listbogen GmbH",
      "company_seat": "Leipzig",
      "details": "05.06.2025 (Bekanntmachungsdatum)\n\nSachsen Amtsgericht Leipzig HRB 24171\nLöschungsankündigung\n\nMedizinisches Versorgungszentrum Listbogen GmbH\nGesellschaft mit beschränkter Haftung\nLeipzig\n\nDas Registergericht beabsichtigt, die im Handelsregister eingetragene Gesellschaft von Amts wegen nach § 394 FamFG zu löschen. Die Frist zu Erhebung eines Widerspruchs gegen die beabsichtigte Löschung wird auf einen Monat festgesetzt."
    },
    {
      "date": "2025-06-05",
      "id": "111360",
      "original_text": "Einreichung neuer Dokumente\nSachsen Amtsgericht Chemnitz HRB 5022\nWohnungsverwaltungsgesellschaft Gemeindeverband Augustusburg mbH – Augustusburg",
      "type": "Einreichung neuer Dokumente",
      "state": "Sachsen",
      "amtsgericht": "Amtsgericht Chemnitz",
      "registernummer": "HRB 5022",
      "registerart": "HRB",
      "company_name": "Wohnungsverwaltungsgesellschaft Gemeindeverband Augustusburg mbH",
      "company_seat": "Augustusburg",
      "details": "05.06.2025 (Bekanntmachungsdatum)\n\nSachsen Amtsgericht Chemnitz HRB 5022\nEinreichung neuer Dokumente\n\nWohnungsverwaltungsgesellschaft Gemeindeverband Augustusburg mbH\nGesellschaft mit beschränkter Haftung\nAugustusburg\n\nAm 05.06.2025 wurde beim Handelsregister des Amtsgerichts Chemnitz die Liste der Mitglieder des Aufsichtsrats gemäß § 52 GmbHG eingereicht."
    },
    {
      "date": "2025-06-05",
      "id": "111361",
      "original_text": "Einreichung neuer Dokumente\nSachsen Amtsgericht Leipzig HRB 30774\ntelbes AG – Leipzig",
      "type": "Einreichung neuer Dokumente",
      "state": "Sachsen",
      "amtsgericht": "Amtsgericht Leipzig",
      "registernummer": "HRB 30774",
      "registerart": "HRB",
      "company_name": "telbes AG",
      "company_seat": "Leipzig",
      "details": "05.06.2025 (Bekanntmachungsdatum)\n\nSachsen Amtsgericht Leipzig HRB 30774\nEinreichung neuer Dokumente 05.06.2025 (Eintragungsdatum)\n\ntelbes AG\nAktiengesellschaft\nLeipzig\n\nAm 30.05.2025 wurde beim Handelsregister des Amtsgerichts Leipzig die Liste der Mitglieder des Aufsichtsrats gemäß § 106 AktG eingereicht."
    },
    {
      "date": "2025-06-05",
      "id": "111362",
      "original_text": "Löschungsankündigung\nBrandenburg Amtsgericht Potsdam HRB 30795\nPhytasia GmbH – Falkensee",
      "type": "Löschungsankündigung",
      "state": "Brandenburg",
      "amtsgericht": "Amtsgericht Potsdam",
      "registernummer": "HRB 30795",
      "registerart": "HRB",
      "company_name": "Phytasia GmbH",
      "company_seat": "Falkensee",
      "details": "05.06.2025 (Bekanntmachungsdatum)\n\nBrandenburg Amtsgericht Potsdam HRB 30795\nLöschungsankündigung\n\nPhytasia GmbH\nGesellschaft mit beschränkter Haftung\nFalkensee\n\nBei der nachstehenden Gesellschaft wird das Amtslöschungsverfahren gemäß § 394 FamFG eingeleitet."
    },
    {
      "date": "2025-06-05",
      "id": "111363",
      "original_text": "Löschungsankündigung\nNiedersachsen Amtsgericht Hannover HRB 223534\nDachdecker Innovative Verwaltungs GmbH – Hannover",
      "type": "Löschungsankündigung",
      "state": "Niedersachsen",
      "amtsgericht": "Amtsgericht Hannover",
      "registernummer": "HRB 223534",
      "registerart": "HRB",
      "company_name": "Dachdecker Innovative Verwaltungs GmbH",
      "company_seat": "Hannover",
      "details": "05.06.2025 (Bekanntmachungsdatum)\n\nNiedersachsen Amtsgericht Hannover HRB 223534\nLöschungsankündigung\n\nDachdecker Innovative Verwaltungs GmbH\nGesellschaft mit beschränkter Haftung\nHannover\n\nDas Registergericht beabsichtigt, den Geschäftsführer von Amts wegen nach § 395 FamFG i.V.m. § 6 Abs. 2 Satz 2 Nr. 3 GmbHG zu löschen. Die Frist zur Erhebung eines Widerspruchs ist auf 1 Monat ab dieser Registerbekanntmachung festgesetzt."
    },
    {
      "date": "2025-06-05",
      "id": "111364",
      "original_text": "Einreichung neuer Dokumente\nNiedersachsen Amtsgericht Walsrode HRB 207895\nDiesel Technic SE – Kirchdorf",
      "type": "Einreichung neuer Dokumente",
      "state": "Niedersachsen",
      "amtsgericht": "Amtsgericht Walsrode",
      "registernummer": "HRB 207895",
      "registerart": "HRB",
      "company_name": "Diesel Technic SE",
      "company_seat": "Kirchdorf",
      "details": "05.06.2025 (Bekanntmachungsdatum)\n\nNiedersachsen Amtsgericht Walsrode HRB 207895\nEinreichung neuer Dokumente\n\nDiesel Technic SE\nEuropäische Aktiengesellschaft (SE)\nKirchdorf\n\nDie Liste der Mitglieder des Aufsichtsrats wurde beim Registergericht eingereicht."
    },
    {
      "date": "2025-06-05",
      "id": "111365",
      "original_text": "Registerbekanntmachung nach dem Umwandlungsgesetz\nNiedersachsen Amtsgericht Lüneburg HRB 204363\nGebrüder Beetz Filmproduktion Lüneburg GmbH – Lüneburg",
      "type": "Registerbekanntmachung nach dem Umwandlungsgesetz",
      "state": "Niedersachsen",
      "amtsgericht": "Amtsgericht Lüneburg",
      "registernummer": "HRB 204363",
      "registerart": "HRB",
      "company_name": "Gebrüder Beetz Filmproduktion Lüneburg GmbH",
      "company_seat": "Lüneburg",
      "details": "05.06.2025 (Bekanntmachungsdatum)\n\nNiedersachsen Amtsgericht Lüneburg HRB 204363\nRegisterbekanntmachung nach dem Umwandlungsgesetz 05.06.2025 (Eintragungsdatum)\n\nGebrüder Beetz Filmproduktion Lüneburg GmbH\nGesellschaft mit beschränkter Haftung\nLüneburg\n\nDen Gläubigern der an der Verschmelzung beteiligten Rechtsträger ist, wenn sie binnen sechs Monaten nach dem Tag, an dem die Eintragung der Verschmelzung in das Register des Sitzes desjenigen Rechtsträgers, dessen Gläubiger sie sind, nach § 19  Abs.  3 UmwG als bekannt gemacht gilt, ihren Anspruch nach Grund und Höhe schriftlich anmelden, Sicherheit zu leisten, soweit sie nicht Befriedigung verlangen können. Dieses Recht steht den Gläubigern jedoch nur zu, wenn sie glaubhaft machen, dass durch die Verschmelzung die Erfüllung der Forderung gefährdet wird."
    },
    {
      "date": "2025-06-05",
      "id": "111366",
      "original_text": "Registerbekanntmachung nach dem Umwandlungsgesetz\nNiedersachsen Amtsgericht Osnabrück HRB 220321\nKB Industrial AG – Spelle",
      "type": "Registerbekanntmachung nach dem Umwandlungsgesetz",
      "state": "Niedersachsen",
      "amtsgericht": "Amtsgericht Osnabrück",
      "registernummer": "HRB 220321",
      "registerart": "HRB",
      "company_name": "KB Industrial AG",
      "company_seat": "Spelle",
      "details": "05.06.2025 (Bekanntmachungsdatum)\n\nNiedersachsen Amtsgericht Osnabrück HRB 220321\nRegisterbekanntmachung nach dem Umwandlungsgesetz\n\nKB Industrial AG\nAktiengesellschaft\nSpelle\n\nEs wird darauf hingewiesen, dass der Entwurf eines Verschmelzungsplanes über eine grenzüberschreitende Verschmelzung zur Neugründung der KB Industrial SE mit Sitz in Spelle/ Bundesrepublik Deutschland beim Handelsregister eingereicht worden ist.\nAn der Gründung der SE durch Verschmelzung sind folgende Rechtsträger beteiligt (§ 308\nAbs. 1 Satz 2 Nr. 2 UmwG):\n(a)  Firma  KB  Industrial  N.V.  (naamloze  vennootschap,  Aktiengesellschaft  nach  dem\nRecht  der  Niederlande),  Sitz  der  Gesellschaft  in  Deurne,  Niederlande,  als\nübertragender Rechtsträger\n(b)  Firma  KB  Industrial  AG  (Aktiengesellschaft  nach  dem  Recht  der  Bundesrepublik\nDeutschland),  Sitz  der  Gesellschaft  in  Spelle,  Bundesrepublik  Deutschland,  als\nübernehmender Rechtsträger.\nDie in Art. 3 Abs. 2 der RL 68/151/EWG (Publizitätsrichtlinie) genannten Urkunden sind für die\noben aufgeführten Rechtsträger wie folgt hinterlegt bzw. bei nachfolgenden Registern\nsind die an der Verschmelzung beteiligten Gesellschaften eingetragen:\n-   KB Industrial N.V., Handelsregister der Kamer van Koophandel, Niederlande, KVK-Nr.:\n95673997, RSIN 867234593,\n-   KB  Industrial  AG, Handelsregister  Amtsgericht  Osnabrück, Registernummer HRB 220321.\nAnteilsinhaber und Gläubiger der an der grenzüberschreitenden Verschmelzung beteiligten\nGesellschaften  sowie  zuständige  Betriebsräte  der  an  der  grenzüberschreitenden\nVerschmelzung  beteiligten  Gesellschaften  oder,  soweit  es  keinen  Betriebsrat  gibt,\nArbeitnehmer der an der grenzüberschreitenden Verschmelzung beteiligten Gesellschaften\nkönnen  der  jeweiligen  Gesellschaft  spätestens  fünf  Arbeitstage  vor  dem  Tag  der\nGesellschafterversammlung Bemerkungen zum Verschmelzungsplan übermitteln.\na)  Alleiniger Anteilsinhaber  der  KB  Industrial  N.V.  ist  die  KB  Industrial AG. Alleiniger\nAnteilsinhaber der KB Industrial AG ist die Bernard Krone Familienstiftung, Spelle. Die\nKB Industrial N.V. hat nach unserem Kenntnisstand keine Gläubiger.\nb)  Weder die KB Industrial N.V. noch die KB Industrial AG haben einen Betriebsrat. Beide\nvorgenannten Gesellschaften haben auch keine Arbeitnehmer.\nBemerkungen  zu  dem  Entwurf  des  Verschmelzungsplanes  können  an  die  Adresse  des\nübernehmenden Rechtsträgers, KB Industrial AG, Heinrich-Krone-Straße 10, 48480 Spelle,\nübermittelt werden.\nDie  Beurkundung  des  Verschmelzungsplanes  findet  am  15.07.2025  statt.  Auch  die\nVersammlungen der Anteilsinhaber der KB Industrial NV und der KB Industrial AG, die über\ndie Zustimmung zum Verschmelzungsplan beschließen, finden jeweils statt am 15.07.2025.\nGläubigern,  die  einen  Anspruch  gegen  die  Gründungsgesellschaft  haben,  wird  Sicherheit\ngeleistet, wenn sie binnen sechs Monaten (Art. 24 Abs. 1 SE-VO i.V.m. § 22 UmwG) nach\nOffenlegung der Eintragung (Art. 15 Abs. 2 SE-VO) ihre Forderung dem Grunde und der Höhe\nnach schriftlich geltend machen. Der Anspruch steht den Gläubigern nur insoweit zu, als dass\nsie glaubhaft machen können, dass ihre Ansprüche durch die Verschmelzung gefährdet sind\nund sie nicht bereits Befriedigung verlangen können. Die Anmeldung der Forderung ist an\nfolgende Adresse zu richten:\nKB Industrial AG, Heinrich-Krone-Straße 10, 48480 Spelle.\nDie Firma der Societas Europaea (SE) wird lauten: KB Industrial SE. Sitz der zukünftigen KB\nIndustrial SE, einzutragen im Handelsregister des Amtsgerichts Osnabrück, wird Spelle sein."
    },
    {
      "date": "2025-06-05",
      "id": "111367",
      "original_text": "Löschungsankündigung\nNiedersachsen Amtsgericht Lüneburg HRB 208965\nSchwichtenberg Hotel und Gastronomieservice GmbH – Soltau",
      "type": "Löschungsankündigung",
      "state": "Niedersachsen",
      "amtsgericht": "Amtsgericht Lüneburg",
      "registernummer": "HRB 208965",
      "registerart": "HRB",
      "company_name": "Schwichtenberg Hotel und Gastronomieservice GmbH",
      "company_seat": "Soltau",
      "details": "05.06.2025 (Bekanntmachungsdatum)\n\nNiedersachsen Amtsgericht Lüneburg HRB 208965\nLöschungsankündigung\n\nSchwichtenberg Hotel und Gastronomieservice GmbH\nGesellschaft mit beschränkter Haftung\nSoltau\n\nDas Registergericht beabsichtigt, die Gesellschaft von Amts wegen nach § 394 FamFG zu löschen. Die Frist zur Erhebung eines Widerspruchs ist auf 1 Monat ab dieser Registerbekanntmachung festgesetzt."
    },
    {
      "date": "2025-06-05",
      "id": "111368",
      "original_text": "Registerbekanntmachung nach dem Umwandlungsgesetz\nRheinland-Pfalz Amtsgericht Zweibrücken HRA 30816\nFranz-Josef Märdian e.K. – Hinterweidenthal",
      "type": "Registerbekanntmachung nach dem Umwandlungsgesetz",
      "state": "Rheinland-Pfalz",
      "amtsgericht": "Amtsgericht Zweibrücken",
      "registernummer": "HRA 30816",
      "registerart": "HRA",
      "company_name": "Franz-Josef Märdian e.K.",
      "company_seat": "Hinterweidenthal",
      "details": "05.06.2025 (Bekanntmachungsdatum)\n\nRheinland-Pfalz Amtsgericht Zweibrücken HRA 30816\nRegisterbekanntmachung nach dem Umwandlungsgesetz 03.06.2025 (Eintragungsdatum)\n\nFranz-Josef Märdian e.K.\nEinzelkaufmann / Einzelkauffrau\nHinterweidenthal\n\nAls nicht eingetragen wird veröffentlicht: Den Gläubigern der an der Verschmelzung beteiligten Rechtsträger ist, wenn sie binnen sechs Monaten nach dem Tag, an dem die Eintragung der Verschmelzung in das Register des Sitzes desjenigen Rechtsträgers,dessen Gläubiger sie sind, nach § 19 Abs. 3 UmwG als bekannt gemacht gilt, ihren Anspruch nach Grund und Höhe schriftlich anmelden, Sicherheit zu leisten, soweit sie nicht Befriedigung verlangen können. Dieses Recht steht den Gläubigern jedoch nur zu, wenn sie glaubhaft machen, dass durch die Verschmelzung die Erfüllungd er Forderung gefährdet wird."
    },
    {
      "date": "2025-06-05",
      "id": "111369",
      "original_text": "Registerbekanntmachung nach dem Umwandlungsgesetz\nRheinland-Pfalz Amtsgericht Landau HRB 2274\nStadler + Schaaf Industrieservice GmbH – Offenbach/Queich",
      "type": "Registerbekanntmachung nach dem Umwandlungsgesetz",
      "state": "Rheinland-Pfalz",
      "amtsgericht": "Amtsgericht Landau",
      "registernummer": "HRB 2274",
      "registerart": "HRB",
      "company_name": "Stadler + Schaaf Industrieservice GmbH",
      "company_seat": "Offenbach/Queich",
      "details": "05.06.2025 (Bekanntmachungsdatum)\n\nRheinland-Pfalz Amtsgericht Landau HRB 2274\nRegisterbekanntmachung nach dem Umwandlungsgesetz 05.06.2025 (Eintragungsdatum)\n\nStadler + Schaaf Industrieservice GmbH\nGesellschaft mit beschränkter Haftung\nOffenbach/Queich\n\nAls nicht eingetragen wird veröffentlicht: Den Gläubigern der an der Verschmelzung beteiligten Rechtsträger ist, wenn sie binnen sechs Monaten nach dem Tag, an dem die Eintragung der Verschmelzung in das Register des Sitzes desjenigen Rechtsträgers, dessen Gläubiger sie sind, nach § 19 Abs. 3 UmwG als bekannt gemacht gilt, ihren Anspruch nach Grund und Höhe schriftlich anmelden, Sicherheit zu leisten, soweit sie nicht Befriedigung verlangen können. Dieses Recht steht den Gläubigern jedoch nur zu, wenn sie glaubhaft machen, dass durch die Verschmelzung die Erfüllung der Forderung gefährdet wird."
    },
    {
      "date": "2025-06-05",
      "id": "111370",
      "original_text": "Registerbekanntmachung nach dem Umwandlungsgesetz\nRheinland-Pfalz Amtsgericht Zweibrücken HRB 23199\nMärdian Werkzeug- und Maschinenbau GmbH – Hinterweidenthal",
      "type": "Registerbekanntmachung nach dem Umwandlungsgesetz",
      "state": "Rheinland-Pfalz",
      "amtsgericht": "Amtsgericht Zweibrücken",
      "registernummer": "HRB 23199",
      "registerart": "HRB",
      "company_name": "Märdian Werkzeug- und Maschinenbau GmbH",
      "company_seat": "Hinterweidenthal",
      "details": "05.06.2025 (Bekanntmachungsdatum)\n\nRheinland-Pfalz Amtsgericht Zweibrücken HRB 23199\nRegisterbekanntmachung nach dem Umwandlungsgesetz 03.06.2025 (Eintragungsdatum)\n\nMärdian Werkzeug- und Maschinenbau GmbH\nGesellschaft mit beschränkter Haftung\nHinterweidenthal\n\nAls nicht eingetragen wird veröffentlicht: Den Gläubigern der an der Verschmelzung beteiligten Rechtsträger ist, wenn sie binnen sechs Monaten nach dem Tag, an dem die Eintragung der Verschmelzung in das Register des Sitzes desjenigen Rechtsträgers,dessen Gläubiger sie sind, nach § 19 Abs. 3 UmwG als bekannt gemacht gilt, ihren Anspruch nach Grund und Höhe schriftlich anmelden, Sicherheit zu leisten, soweit sie nicht Befriedigung verlangen können. Dieses Recht steht den Gläubigern jedoch nur zu, wenn sie glaubhaft machen, dass durch die Verschmelzung die Erfüllungd er Forderung gefährdet wird."
    },
    {
      "date": "2025-06-05",
      "id": "111371",
      "original_text": "Einreichung neuer Dokumente\nNordrhein-Westfalen Amtsgericht Bad Oeynhausen HRB 4772\nRodenberg Türsysteme AG – Porta Westfalica",
      "type": "Einreichung neuer Dokumente",
      "state": "Nordrhein-Westfalen",
      "amtsgericht": "Amtsgericht Bad Oeynhausen",
      "registernummer": "HRB 4772",
      "registerart": "HRB",
      "company_name": "Rodenberg Türsysteme AG",
      "company_seat": "Porta Westfalica",
      "details": "05.06.2025 (Bekanntmachungsdatum)\n\nNordrhein-Westfalen Amtsgericht Bad Oeynhausen HRB 4772\nEinreichung neuer Dokumente 05.06.2025 (Eintragungsdatum)\n\nRodenberg Türsysteme AG\nAktiengesellschaft\nPorta Westfalica\n\nDem Registergericht ist eine neue Liste der Mitglieder des Aufsichtsrates eingereicht worden."
    },
    {
      "date": "2025-06-05",
      "id": "111372",
      "original_text": "Löschungsankündigung\nNordrhein-Westfalen Amtsgericht Neuss HRB 22624\nGaLaBau Jovanović UG (haftungsbeschränkt) – Kaarst",
      "type": "Löschungsankündigung",
      "state": "Nordrhein-Westfalen",
      "amtsgericht": "Amtsgericht Neuss",
      "registernummer": "HRB 22624",
      "registerart": "HRB",
      "company_name": "GaLaBau Jovanović UG (haftungsbeschränkt)",
      "company_seat": "Kaarst",
      "details": "05.06.2025 (Bekanntmachungsdatum)\n\nNordrhein-Westfalen Amtsgericht Neuss HRB 22624\nLöschungsankündigung\n\nGaLaBau Jovanović UG (haftungsbeschränkt)\nGesellschaft mit beschränkter Haftung\nKaarst\n\nEs ist beabsichtigt, die Gesellschaft wegen Vermögenslosigkeit aufgrund des § 394 Abs. 1 FamFG zu löschen. Frist zur Geltendmachung eines Widerspruchs: 1 Monat.\n\nRechtsbehelfsbelehrung:\nGegen diese Verfügung können Sie Widerspruch einlegen.\nDer Widerspruch ist bei dem Amtsgericht Neuss - Registergericht -, Breite Str. 48, 41460 Neuss schriftlich in deutscher Sprache oder zur Niederschrift der Geschäftsstelle einzulegen.\nDer Widerspruch kann auch zur Niederschrift der Geschäftsstelle eines jeden Amtsgerichtes abgegeben werden.\nDie Einlegung ist auch durch Übertragung eines elektronischen Dokuments an die elektronische Poststelle des Gerichts möglich. Das elektronische Dokument muss für die Bearbeitung durch das Gericht geeignet und mit einer qualifizierten elektronischen Signatur der verantwortenden Person versehen sein oder von der verantwortenden Person signiert und auf einem sicheren Übermittlungsweg gemäß § 130a ZPO nach näherer Maßgabe der Verordnung über die technischen Rahmenbedingungen des elektronischen Rechtsverkehrs und über das besondere elektronische Behördenpostfach (BGBl. I, S.3803) eingereicht werden. Weitere Informationen erhalten Sie auf der Internetseite www.justiz.de.\nDer Widerspruch muss spätestens innerhalb der gesetzten Frist nach der schriftlichen Bekanntgabe der Verfügung bei dem Amtsgericht - Registergericht - Neuss eingegangen sein. Dies gilt auch dann, wenn der Widerspruch zur Niederschrift der Geschäftsstelle eines anderen Amtsgerichtes abgegeben wurde. Die Frist beginnt mit der schriftlichen Bekanntgabe der Verfügung. Die Bekanntgabe ist entweder durch Zustellung oder am dritten Tage nach Aufgabe zur Post bewirkt. Fällt das Ende der Frist auf einen Sonntag, einen allgemeinen Feiertag oder Sonnabend, so endet die Frist mit Ablauf des nächsten Werktages.\n\nDer Widerspruch muss die Bezeichnung der angefochtenen Verfügung sowie die Erklärung enthalten, dass Widerspruch gegen diese Verfügung eingelegt wird. Er ist zu unterzeichnen und soll begründet werden."
    },
    {
      "date": "2025-06-05",
      "id": "111373",
      "original_text": "Registerbekanntmachung nach dem Umwandlungsgesetz\nNordrhein-Westfalen Amtsgericht Düsseldorf HRB 81826\nILTS- FORWARDING- Trans & Trade GmbH – Monheim am Rhein",
      "type": "Registerbekanntmachung nach dem Umwandlungsgesetz",
      "state": "Nordrhein-Westfalen",
      "amtsgericht": "Amtsgericht Düsseldorf",
      "registernummer": "HRB 81826",
      "registerart": "HRB",
      "company_name": "ILTS- FORWARDING- Trans & Trade GmbH",
      "company_seat": "Monheim am Rhein",
      "details": "05.06.2025 (Bekanntmachungsdatum)\n\nNordrhein-Westfalen Amtsgericht Düsseldorf HRB 81826\nRegisterbekanntmachung nach dem Umwandlungsgesetz 05.06.2025 (Eintragungsdatum)\n\nILTS- FORWARDING- Trans & Trade GmbH\nGesellschaft mit beschränkter Haftung\nMonheim am Rhein\n\nDen Gläubigern der an der formwechselnden Umwandlung beteiligten Rechtsträger ist, wenn sie binnen sechs Monaten nach dem Tag, an dem die Eintragung der formwechselnden Umwandlung in das Register des Sitzes desjenigen Rechtsträgers, dessen Gläubiger sie sind, nach § 19 Absatz 3 UmwG als bekanntgemacht gilt, ihren Anspruch nach Grund und Höhe schriftlich anmelden, Sicherheit zu leisten, soweit sie nicht Befriedigung verlangen können. Dieses Recht steht den Gläubigern jedoch nur zu, wenn sie glaubhaft machen, dass durch die formwechselnden Umwandlung die Erfüllung ihrer Forderung gefährdet wird."
    },
    {
      "date": "2025-06-05",
      "id": "111374",
      "original_text": "Löschungsankündigung\nNordrhein-Westfalen Amtsgericht Köln HRB 103084\nMUR-KAAN GmbH – Köln",
      "type": "Löschungsankündigung",
      "state": "Nordrhein-Westfalen",
      "amtsgericht": "Amtsgericht Köln",
      "registernummer": "HRB 103084",
      "registerart": "HRB",
      "company_name": "MUR-KAAN GmbH",
      "company_seat": "Köln",
      "details": "05.06.2025 (Bekanntmachungsdatum)\n\nNordrhein-Westfalen Amtsgericht Köln HRB 103084\nLöschungsankündigung\n\nMUR-KAAN GmbH\nGesellschaft mit beschränkter Haftung\nKöln\n\nDas Registergericht beabsichtigt die Gesellschaft von Amts wegen nach § 394 FamFG zu löschen. Die Frist zur Erhebung eines Widerspruchs ist auf einen Monat festgesetzt."
    },
    {
      "date": "2025-06-05",
      "id": "111375",
      "original_text": "Sonstige Registerbekanntmachung\nNordrhein-Westfalen Amtsgericht Köln HRB 117469\nRäuberleiter Ventures SE – Köln",
      "type": "Sonstige Registerbekanntmachung",
      "state": "Nordrhein-Westfalen",
      "amtsgericht": "Amtsgericht Köln",
      "registernummer": "HRB 117469",
      "registerart": "HRB",
      "company_name": "Räuberleiter Ventures SE",
      "company_seat": "Köln",
      "details": "05.06.2025 (Bekanntmachungsdatum)\n\nNordrhein-Westfalen Amtsgericht Köln HRB 117469\nSonstige Registerbekanntmachung\n\nRäuberleiter Ventures SE\nEuropäische Aktiengesellschaft (SE)\nKöln\n\nDem Registergericht ist eine Liste der Mitglieder des Verwaltungsrates eingereicht worden."
    },
    {
      "date": "2025-06-05",
      "id": "111376",
      "original_text": "Löschungsankündigung\nNordrhein-Westfalen Amtsgericht Duisburg HRB 32375\nBauer Fleet Service GmbH – Mülheim an der Ruhr",
      "type": "Löschungsankündigung",
      "state": "Nordrhein-Westfalen",
      "amtsgericht": "Amtsgericht Duisburg",
      "registernummer": "HRB 32375",
      "registerart": "HRB",
      "company_name": "Bauer Fleet Service GmbH",
      "company_seat": "Mülheim an der Ruhr",
      "details": "05.06.2025 (Bekanntmachungsdatum)\n\nNordrhein-Westfalen Amtsgericht Duisburg HRB 32375\nLöschungsankündigung\n\nBauer Fleet Service GmbH\nGesellschaft mit beschränkter Haftung\nMülheim an der Ruhr\n\nDas Registergericht beabsichtigt, die im Handelsregister unter HRB 32375  eingetragene Gesellschaft Bauer Fleet Service GmbH gemäß § 394 FamFG wegen Vermögenslosigkeit von Amts wegen zu löschen. Gegen diese Verfügung kann Widerspruch eingelegt werden. Die Frist zur Erhebung eines Widerspruchs gegen die beabsichtigte Löschung von Amts wegen ist auf drei Monate festgesetzt. Rechtsbehelfsbelehrung Der Widerspruch ist bei dem Amtsgericht Duisburg, Kardinal-Galen-Str. 124-132, 47058 Duisburg schriftlich in deutscher Sprache oder zur Niederschrift der Geschäftsstelle einzulegen. Der Widerspruch kann auch zur Niederschrift der Geschäftsstelle eines jeden Amtsgerichtes abgegeben werden. Die Einlegung ist auch durch Übertragung eines elektronischen Dokuments an die elektronische Poststelle des Gerichts möglich. Das elektronische Dokument muss für die Bearbeitung durch das Gericht geeignet und mit einer qualifizierten elektronischen Signatur der verantwortenden Person versehen sein oder von der verantwortenden Person signiert und auf einem sicheren Übermittlungsweg gemäß § 130 a ZPO nach näherer Maßgabe der Verordnung über die technischen Rahmenbedingungen des elektronischen Rechtsverkehrs und über das besondere elektronische Behördenpostfach (BGBl. I, S. 3803) eingereicht werden. Weitere Informationen erhalten Sie auf der Internetseite www.justiz.de <http://www.justiz.de>. Der Widerspruch muss spätestens innerhalb der gesetzten Frist bei dem Amtsgericht Duisburg eingegangen sein. Dies gilt auch dann, wenn der Widerspruch zur Niederschrift der Geschäftsstelle eines anderen Amtsgerichtes abgegeben wurde. Die Frist beginnt mit der Veröffentlichung. Fällt das Ende der Frist auf einen Sonntag, einen allgemeinen Feiertag oder Sonnabend, so endet die Frist mit Ablauf des nächsten Werktages. Der Widerspruch muss die Bezeichnung der angefochtenen Verfügung sowie die Erklärung enthalten, dass Widerspruch gegen diese Verfügung eingelegt wird. Er ist zu unterzeichnen und soll begründet werden."
    },
    {
      "date": "2025-06-05",
      "id": "111377",
      "original_text": "Löschungsankündigung\nNordrhein-Westfalen Amtsgericht Düren HRB 7720\nclean24 GmbH – Düren",
      "type": "Löschungsankündigung",
      "state": "Nordrhein-Westfalen",
      "amtsgericht": "Amtsgericht Düren",
      "registernummer": "HRB 7720",
      "registerart": "HRB",
      "company_name": "clean24 GmbH",
      "company_seat": "Düren",
      "details": "05.06.2025 (Bekanntmachungsdatum)\n\nNordrhein-Westfalen Amtsgericht Düren HRB 7720\nLöschungsankündigung\n\nclean24 GmbH\nGesellschaft mit beschränkter Haftung\nDüren\n\nDas Registergericht beabsichtigt die Gesellschaft von Amts wegen nach § 394 FamFG zu löschen. Die Frist zur Erhebung eines Widerspruchs ist auf drei Monate festgesetzt."
    },
    {
      "date": "2025-06-05",
      "id": "111378",
      "original_text": "Registerbekanntmachung nach dem Umwandlungsgesetz\nNordrhein-Westfalen Amtsgericht Köln HRB 84332\nTKS Tierärztliche Klinik Stommeln GmbH – Köln",
      "type": "Registerbekanntmachung nach dem Umwandlungsgesetz",
      "state": "Nordrhein-Westfalen",
      "amtsgericht": "Amtsgericht Köln",
      "registernummer": "HRB 84332",
      "registerart": "HRB",
      "company_name": "TKS Tierärztliche Klinik Stommeln GmbH",
      "company_seat": "Köln",
      "details": "05.06.2025 (Bekanntmachungsdatum)\n\nNordrhein-Westfalen Amtsgericht Köln HRB 84332\nRegisterbekanntmachung nach dem Umwandlungsgesetz 05.06.2025 (Eintragungsdatum)\n\nTKS Tierärztliche Klinik Stommeln GmbH\nGesellschaft mit beschränkter Haftung\nKöln\n\nDen Gläubigern der an der Verschmelzung beteiligten Rechtsträger ist, wenn sie binnen sechs Monaten nach dem Tag, an dem die Eintragung der Verschmelzung in das Register des Sitzes desjenigen Rechtsträgers, dessen Gläubiger sie sind, nach § 19 Absatz 3 UmwG als bekanntgemacht gilt, ihren Anspruch nach Grund und Höhe schriftlich anmelden, Sicherheit zu leisten, soweit sie nicht Befriedigung verlangen können. Dieses Recht steht den Gläubigern jedoch nur zu, wenn sie glaubhaft machen, dass durch die Verschmelzung die Erfüllung ihrer Forderung gefährdet wird."
    },
    {
      "date": "2025-06-05",
      "id": "111379",
      "original_text": "Registerbekanntmachung nach dem Umwandlungsgesetz\nNordrhein-Westfalen Amtsgericht Paderborn HRB 16815\ndS Group Holding GmbH – Paderborn",
      "type": "Registerbekanntmachung nach dem Umwandlungsgesetz",
      "state": "Nordrhein-Westfalen",
      "amtsgericht": "Amtsgericht Paderborn",
      "registernummer": "HRB 16815",
      "registerart": "HRB",
      "company_name": "dS Group Holding GmbH",
      "company_seat": "Paderborn",
      "details": "05.06.2025 (Bekanntmachungsdatum)\n\nNordrhein-Westfalen Amtsgericht Paderborn HRB 16815\nRegisterbekanntmachung nach dem Umwandlungsgesetz 05.06.2025 (Eintragungsdatum)\n\ndS Group Holding GmbH\nGesellschaft mit beschränkter Haftung\nPaderborn\n\nDen Gläubigern der an der formwechselnden Umwandlung beteiligten Rechtsträger ist, wenn sie binnen sechs Monaten nach dem Tag, an dem die Eintragung der formwechselnden Umwandlung in das Register des Sitzes desjenigen Rechtsträgers, dessen Gläubiger sie sind, nach § 19 Absatz 3 UmwG als bekanntgemacht gilt, ihren Anspruch nach Grund und Höhe schriftlich anmelden, Sicherheit zu leisten, soweit sie nicht Befriedigung verlangen können. Dieses Recht steht den Gläubigern jedoch nur zu, wenn sie glaubhaft machen, dass durch die formwechselnden Umwandlung die Erfüllung ihrer Forderung gefährdet wird."
    },
    {
      "date": "2025-06-05",
      "id": "111380",
      "original_text": "Sonstige Registerbekanntmachung\nNordrhein-Westfalen Amtsgericht Düsseldorf HRB 97001\nSIERA SE – Düsseldorf",
      "type": "Sonstige Registerbekanntmachung",
      "state": "Nordrhein-Westfalen",
      "amtsgericht": "Amtsgericht Düsseldorf",
      "registernummer": "HRB 97001",
      "registerart": "HRB",
      "company_name": "SIERA SE",
      "company_seat": "Düsseldorf",
      "details": "05.06.2025 (Bekanntmachungsdatum)\n\nNordrhein-Westfalen Amtsgericht Düsseldorf HRB 97001\nSonstige Registerbekanntmachung 05.06.2025 (Eintragungsdatum)\n\nSIERA SE\nEuropäische Aktiengesellschaft (SE)\nDüsseldorf\n\nDie frühere Eintragung der SIERA SE im Handelsregister B des Registergerichts, Amtsgericht Düsseldorf (HRB 97001), ist gelöscht, Offenlegung gemäß Artikel 8 Absatz 12 in Verbindung mit Artikel 13 EG-Verordnung Nr. 2157/2001."
    },
    {
      "date": "2025-06-05",
      "id": "111381",
      "original_text": "Registerbekanntmachung nach dem Umwandlungsgesetz\nNordrhein-Westfalen Amtsgericht Düren HRA 4170\nWohntechnik Wolter e.K. – Schleiden",
      "type": "Registerbekanntmachung nach dem Umwandlungsgesetz",
      "state": "Nordrhein-Westfalen",
      "amtsgericht": "Amtsgericht Düren",
      "registernummer": "HRA 4170",
      "registerart": "HRA",
      "company_name": "Wohntechnik Wolter e.K.",
      "company_seat": "Schleiden",
      "details": "05.06.2025 (Bekanntmachungsdatum)\n\nNordrhein-Westfalen Amtsgericht Düren HRA 4170\nRegisterbekanntmachung nach dem Umwandlungsgesetz 05.06.2025 (Eintragungsdatum)\n\nWohntechnik Wolter e.K.\nEinzelkaufmann / Einzelkauffrau\nSchleiden\n\nDen Gläubigern der an der Ausgliederung beteiligten Rechtsträger ist, wenn sie binnen sechs Monaten nach dem Tag, an dem die Eintragung der Ausgliederung in das Register des Sitzes desjenigen Rechtsträgers, dessen Gläubiger sie sind, nach § 19 Absatz 3 UmwG als bekanntgemacht gilt, ihren Anspruch nach Grund und Höhe schriftlich anmelden, Sicherheit zu leisten, soweit sie nicht Befriedigung verlangen können. Dieses Recht steht den Gläubigern jedoch nur zu, wenn sie glaubhaft machen, dass durch die Ausgliederung die Erfüllung ihrer Forderung gefährdet wird."
    },
    {
      "date": "2025-06-05",
      "id": "111382",
      "original_text": "Löschungsankündigung\nNordrhein-Westfalen Amtsgericht Kleve HRB 2596\nDecarox GmbH – Kleve",
      "type": "Löschungsankündigung",
      "state": "Nordrhein-Westfalen",
      "amtsgericht": "Amtsgericht Kleve",
      "registernummer": "HRB 2596",
      "registerart": "HRB",
      "company_name": "Decarox GmbH",
      "company_seat": "Kleve",
      "details": "05.06.2025 (Bekanntmachungsdatum)\n\nNordrhein-Westfalen Amtsgericht Kleve HRB 2596\nLöschungsankündigung\n\nDecarox GmbH\nGesellschaft mit beschränkter Haftung\nKleve\n\nDas Registergericht beabsichtigt die Gesellschaft von Amts wegen nach § 394 FamFG zu löschen. Die Frist zur Erhebung eines Widerspruchs ist auf einen Monat festgesetzt."
    },
    {
      "date": "2025-06-05",
      "id": "111383",
      "original_text": "Einreichung neuer Dokumente\nNordrhein-Westfalen Amtsgericht Recklinghausen HRB 9319\nKnappschaft Kliniken GmbH – Recklinghausen",
      "type": "Einreichung neuer Dokumente",
      "state": "Nordrhein-Westfalen",
      "amtsgericht": "Amtsgericht Recklinghausen",
      "registernummer": "HRB 9319",
      "registerart": "HRB",
      "company_name": "Knappschaft Kliniken GmbH",
      "company_seat": "Recklinghausen",
      "details": "05.06.2025 (Bekanntmachungsdatum)\n\nNordrhein-Westfalen Amtsgericht Recklinghausen HRB 9319\nEinreichung neuer Dokumente 05.06.2025 (Eintragungsdatum)\n\nKnappschaft Kliniken GmbH\nGesellschaft mit beschränkter Haftung\nRecklinghausen\n\nDem Registergericht ist eine neue Liste der Mitglieder des Aufsichtsrates eingereicht worden."
    },
    {
      "date": "2025-06-05",
      "id": "111384",
      "original_text": "Registerbekanntmachung nach dem Umwandlungsgesetz\nNordrhein-Westfalen Amtsgericht Gütersloh HRB 11901\nProjektgesellschaft Anderter Str. mbH – Gütersloh",
      "type": "Registerbekanntmachung nach dem Umwandlungsgesetz",
      "state": "Nordrhein-Westfalen",
      "amtsgericht": "Amtsgericht Gütersloh",
      "registernummer": "HRB 11901",
      "registerart": "HRB",
      "company_name": "Projektgesellschaft Anderter Str. mbH",
      "company_seat": "Gütersloh",
      "details": "05.06.2025 (Bekanntmachungsdatum)\n\nNordrhein-Westfalen Amtsgericht Gütersloh HRB 11901\nRegisterbekanntmachung nach dem Umwandlungsgesetz 05.06.2025 (Eintragungsdatum)\n\nProjektgesellschaft Anderter Str. mbH\nGesellschaft mit beschränkter Haftung\nGütersloh\n\nDen Gläubigern der an der formwechselnden Umwandlung beteiligten Rechtsträger ist, wenn sie binnen sechs Monaten nach dem Tag, an dem die Eintragung der formwechselnden Umwandlung in das Register des Sitzes desjenigen Rechtsträgers, dessen Gläubiger sie sind, nach § 19 Absatz 3 UmwG als bekanntgemacht gilt, ihren Anspruch nach Grund und Höhe schriftlich anmelden, Sicherheit zu leisten, soweit sie nicht Befriedigung verlangen können. Dieses Recht steht den Gläubigern jedoch nur zu, wenn sie glaubhaft machen, dass durch die formwechselnden Umwandlung die Erfüllung ihrer Forderung gefährdet wird."
    },
    {
      "date": "2025-06-05",
      "id": "111385",
      "original_text": "Registerbekanntmachung nach dem Umwandlungsgesetz\nNordrhein-Westfalen Amtsgericht Duisburg HRB 24671\nMumme Handelsservice GmbH – Wesel",
      "type": "Registerbekanntmachung nach dem Umwandlungsgesetz",
      "state": "Nordrhein-Westfalen",
      "amtsgericht": "Amtsgericht Duisburg",
      "registernummer": "HRB 24671",
      "registerart": "HRB",
      "company_name": "Mumme Handelsservice GmbH",
      "company_seat": "Wesel",
      "details": "05.06.2025 (Bekanntmachungsdatum)\n\nNordrhein-Westfalen Amtsgericht Duisburg HRB 24671\nRegisterbekanntmachung nach dem Umwandlungsgesetz 05.06.2025 (Eintragungsdatum)\n\nMumme Handelsservice GmbH\nGesellschaft mit beschränkter Haftung\nWesel\n\nDem Registergericht ist eine Liste der Mitglieder des Aufsichtsrates eingereicht worden.Die Gesellschaft hat Gläubigern, deren Forderungen vor dieser Bekanntmachung begründet worden sind, Sicherheit zu leisten, soweit sie nicht Befriedigung verlangen können, wenn sie sich binnen sechs Monaten zu diesem Zweck melden."
    },
    {
      "date": "2025-06-05",
      "id": "111386",
      "original_text": "Registerbekanntmachung nach dem Umwandlungsgesetz\nNordrhein-Westfalen Amtsgericht Düsseldorf HRB 49333\nDATAGROUP BIT GmbH – Düsseldorf",
      "type": "Registerbekanntmachung nach dem Umwandlungsgesetz",
      "state": "Nordrhein-Westfalen",
      "amtsgericht": "Amtsgericht Düsseldorf",
      "registernummer": "HRB 49333",
      "registerart": "HRB",
      "company_name": "DATAGROUP BIT GmbH",
      "company_seat": "Düsseldorf",
      "details": "05.06.2025 (Bekanntmachungsdatum)\n\nNordrhein-Westfalen Amtsgericht Düsseldorf HRB 49333\nRegisterbekanntmachung nach dem Umwandlungsgesetz 05.06.2025 (Eintragungsdatum)\n\nDATAGROUP BIT GmbH\nGesellschaft mit beschränkter Haftung\nDüsseldorf\n\nDen Gläubigern der an der Verschmelzung beteiligten Rechtsträger ist, wenn sie binnen sechs Monaten nach dem Tag, an dem die Eintragung der Verschmelzung in das Register des Sitzes desjenigen Rechtsträgers, dessen Gläubiger sie sind, nach § 19 Absatz 3 UmwG als bekanntgemacht gilt, ihren Anspruch nach Grund und Höhe schriftlich anmelden, Sicherheit zu leisten, soweit sie nicht Befriedigung verlangen können. Dieses Recht steht den Gläubigern jedoch nur zu, wenn sie glaubhaft machen, dass durch die Verschmelzung die Erfüllung ihrer Forderung gefährdet wird."
    },
    {
      "date": "2025-06-05",
      "id": "111387",
      "original_text": "Registerbekanntmachung nach dem Umwandlungsgesetz\nNordrhein-Westfalen Amtsgericht Düsseldorf HRB 108519\nAST Deutschland GmbH – Düsseldorf",
      "type": "Registerbekanntmachung nach dem Umwandlungsgesetz",
      "state": "Nordrhein-Westfalen",
      "amtsgericht": "Amtsgericht Düsseldorf",
      "registernummer": "HRB 108519",
      "registerart": "HRB",
      "company_name": "AST Deutschland GmbH",
      "company_seat": "Düsseldorf",
      "details": "05.06.2025 (Bekanntmachungsdatum)\n\nNordrhein-Westfalen Amtsgericht Düsseldorf HRB 108519\nRegisterbekanntmachung nach dem Umwandlungsgesetz 05.06.2025 (Eintragungsdatum)\n\nAST Deutschland GmbH\nGesellschaft mit beschränkter Haftung\nDüsseldorf\n\nDen Gläubigern der an der Abspaltung beteiligten Rechtsträger ist, wenn sie binnen sechs Monaten nach dem Tag, an dem die Eintragung der Abspaltung in das Register des Sitzes desjenigen Rechtsträgers, dessen Gläubiger sie sind, nach § 19 Absatz 3 UmwG als bekanntgemacht gilt, ihren Anspruch nach Grund und Höhe schriftlich anmelden, Sicherheit zu leisten, soweit sie nicht Befriedigung verlangen können. Dieses Recht steht den Gläubigern jedoch nur zu, wenn sie glaubhaft machen, dass durch die Abspaltung die Erfüllung ihrer Forderung gefährdet wird."
    },
    {
      "date": "2025-06-05",
      "id": "111388",
      "original_text": "Löschungsankündigung\nNordrhein-Westfalen Amtsgericht Aachen HRB 22644\nRoniTas UG (haftungsbeschränkt) – Heinsberg",
      "type": "Löschungsankündigung",
      "state": "Nordrhein-Westfalen",
      "amtsgericht": "Amtsgericht Aachen",
      "registernummer": "HRB 22644",
      "registerart": "HRB",
      "company_name": "RoniTas UG (haftungsbeschränkt)",
      "company_seat": "Heinsberg",
      "details": "05.06.2025 (Bekanntmachungsdatum)\n\nNordrhein-Westfalen Amtsgericht Aachen HRB 22644\nLöschungsankündigung\n\nRoniTas UG (haftungsbeschränkt)\nGesellschaft mit beschränkter Haftung\nHeinsberg\n\nDas Registergericht beabsichtigt, von Amts wegen die Gesellschaft wegen Vermögenslosigkeit nach § 394 FamFG zu löschen, nachdem die Geschäftsführerin mit Schreiben vom 02.05.2025 und mit Anruf vom 02.06.2025 mitgeteilt hat, dass die Gesellschaft vollständig vermögenslos ist.\n\nZur Geltendmachung des Widerspruchs gegen die beabsichtigte Löschung wird hiermit eine Frist von einem Monat ab Veröffentlichung dieser Ankündigung bestimmt.\n\nRechtsbehelfsbelehrung:\n\nGegen diese Verfügung kann Widerspruch eingelegt werden. Zum Widerspruch ist jeder berechtigt, der an der Unterlassung der Löschung ein berechtigtes Interesse hat.\n\nDer Widerspruch ist bei dem Amtsgericht Aachen, Adalbertsteinweg 92, 52070 Aachen schriftlich in deutscher Sprache oder zur Niederschrift der Geschäftsstelle einzulegen. Der Widerspruch kann auch zur Niederschrift der Geschäftsstelle eines jeden Amtsgerichtes abgegeben werden.\n\nDer Widerspruch muss spätestens innerhalb der gesetzten Frist nach der Bekanntgabe der Verfügung bei dem Amtsgericht Aachen eingegangen sein. Dies gilt auch dann, wenn der Widerspruch zur Niederschrift der Geschäftsstelle eines anderen Amtsgerichtes abgegeben wurde. Die Frist beginnt mit der Bekanntgabe der Verfügung durch Veröffentlichung. Fällt das Ende der Frist auf einen Sonntag, einen allgemeinen Feiertag oder Sonnabend, so endet die Frist mit Ablauf des nächsten Werktages.\n\nDer Widerspruch muss die Bezeichnung der angefochtenen Verfügung sowie die Erklärung enthalten, dass Widerspruch gegen diese Verfügung eingelegt wird. Er ist zu unterzeichnen und soll begründet werden.\n\nDie Einlegung ist auch durch Übertragung eines elektronischen Dokuments an die elektronische Poststelle des Gerichts möglich. Das elektronische Dokument muss für die Bearbeitung durch das Gericht geeignet und mit einer qualifizierten elektronischen Signatur der verantwortenden Person versehen sein oder von der verantwortenden Person signiert und auf einem sicheren Übermittlungsweg gemäß § 130 a ZPO nach näherer Maßgabe der Verordnung über die technischen Rahmenbedingungen des elektronischen Rechtsverkehrs und über das besondere elektronische Behördenpostfach (BGBl. I, S. 3803) eingereicht werden. Weitere Informationen erhalten Sie auf der Internetseite www.justiz.de."
    },
    {
      "date": "2025-06-05",
      "id": "111389",
      "original_text": "Registerbekanntmachung nach dem Umwandlungsgesetz\nNordrhein-Westfalen Amtsgericht Köln HRA 37851\nProf. Dr. Manuel Tusch e. K. – Köln",
      "type": "Registerbekanntmachung nach dem Umwandlungsgesetz",
      "state": "Nordrhein-Westfalen",
      "amtsgericht": "Amtsgericht Köln",
      "registernummer": "HRA 37851",
      "registerart": "HRA",
      "company_name": "Prof. Dr. Manuel Tusch e. K.",
      "company_seat": "Köln",
      "details": "05.06.2025 (Bekanntmachungsdatum)\n\nNordrhein-Westfalen Amtsgericht Köln HRA 37851\nRegisterbekanntmachung nach dem Umwandlungsgesetz 05.06.2025 (Eintragungsdatum)\n\nProf. Dr. Manuel Tusch e. K.\nEinzelkaufmann / Einzelkauffrau\nKöln\n\nDen Gläubigern der an der Ausgliederung beteiligten Rechtsträger ist, wenn sie binnen sechs Monaten nach dem Tag, an dem die Eintragung der Ausgliederung in das Register des Sitzes desjenigen Rechtsträgers, dessen Gläubiger sie sind, nach § 19 Absatz 3 UmwG als bekanntgemacht gilt, ihren Anspruch nach Grund und Höhe schriftlich anmelden, Sicherheit zu leisten, soweit sie nicht Befriedigung verlangen können. Dieses Recht steht den Gläubigern jedoch nur zu, wenn sie glaubhaft machen, dass durch die Ausgliederung die Erfüllung ihrer Forderung gefährdet wird."
    },
    {
      "date": "2025-06-05",
      "id": "111390",
      "original_text": "Einreichung neuer Dokumente\nNordrhein-Westfalen Amtsgericht Bochum HRB 7650\nDGEG Bahnen und Reisen Bochum AG – Bochum",
      "type": "Einreichung neuer Dokumente",
      "state": "Nordrhein-Westfalen",
      "amtsgericht": "Amtsgericht Bochum",
      "registernummer": "HRB 7650",
      "registerart": "HRB",
      "company_name": "DGEG Bahnen und Reisen Bochum AG",
      "company_seat": "Bochum",
      "details": "05.06.2025 (Bekanntmachungsdatum)\n\nNordrhein-Westfalen Amtsgericht Bochum HRB 7650\nEinreichung neuer Dokumente\n\nDGEG Bahnen und Reisen Bochum AG\nAktiengesellschaft\nBochum\n\nDem Registergericht ist eine neue Liste der Mitglieder des Aufsichtsrates eingereicht worden."
    },
    {
      "date": "2025-06-05",
      "id": "111391",
      "original_text": "Registerbekanntmachung nach dem Umwandlungsgesetz\nNordrhein-Westfalen Amtsgericht Duisburg HRB 23368\nMumme Personalservice GmbH – Wesel",
      "type": "Registerbekanntmachung nach dem Umwandlungsgesetz",
      "state": "Nordrhein-Westfalen",
      "amtsgericht": "Amtsgericht Duisburg",
      "registernummer": "HRB 23368",
      "registerart": "HRB",
      "company_name": "Mumme Personalservice GmbH",
      "company_seat": "Wesel",
      "details": "05.06.2025 (Bekanntmachungsdatum)\n\nNordrhein-Westfalen Amtsgericht Duisburg HRB 23368\nRegisterbekanntmachung nach dem Umwandlungsgesetz 05.06.2025 (Eintragungsdatum)\n\nMumme Personalservice GmbH\nGesellschaft mit beschränkter Haftung\nWesel\n\nDie Gesellschaft hat Gläubigern, deren Forderungen vor dieser Bekanntmachung begründet worden sind, Sicherheit zu leisten, soweit sie nicht Befriedigung verlangen können, wenn sie sich binnen sechs Monaten zu diesem Zweck melden."
    },
    {
      "date": "2025-06-05",
      "id": "111392",
      "original_text": "Löschungsankündigung\nNordrhein-Westfalen Amtsgericht Wuppertal HRB 32361\nDECONAS GmbH – Wuppertal",
      "type": "Löschungsankündigung",
      "state": "Nordrhein-Westfalen",
      "amtsgericht": "Amtsgericht Wuppertal",
      "registernummer": "HRB 32361",
      "registerart": "HRB",
      "company_name": "DECONAS GmbH",
      "company_seat": "Wuppertal",
      "details": "05.06.2025 (Bekanntmachungsdatum)\n\nNordrhein-Westfalen Amtsgericht Wuppertal HRB 32361\nLöschungsankündigung\n\nDECONAS GmbH\nGesellschaft mit beschränkter Haftung\nWuppertal\n\nDas Registergericht beabsichtigt die Gesellschaft von Amts wegen nach § 394 FamFG zu löschen. Die Frist zur Erhebung eines Widerspruchs ist auf einen Monat festgesetzt."
    },
    {
      "date": "2025-06-05",
      "id": "111393",
      "original_text": "Löschungsankündigung\nNordrhein-Westfalen Amtsgericht Köln HRB 92304\nTrend Cologne GmbH – Köln",
      "type": "Löschungsankündigung",
      "state": "Nordrhein-Westfalen",
      "amtsgericht": "Amtsgericht Köln",
      "registernummer": "HRB 92304",
      "registerart": "HRB",
      "company_name": "Trend Cologne GmbH",
      "company_seat": "Köln",
      "details": "05.06.2025 (Bekanntmachungsdatum)\n\nNordrhein-Westfalen Amtsgericht Köln HRB 92304\nLöschungsankündigung\n\nTrend Cologne GmbH\nGesellschaft mit beschränkter Haftung\nKöln\n\nDas Registergericht beabsichtigt die Gesellschaft von Amts wegen nach § 394 FamFG zu löschen. Die Frist zur Erhebung eines Widerspruchs ist auf einen Monat festgesetzt."
    },
    {
      "date": "2025-06-05",
      "id": "111394",
      "original_text": "Einreichung neuer Dokumente\nNordrhein-Westfalen Amtsgericht Köln HRB 104911\nabiagenten AG – Köln",
      "type": "Einreichung neuer Dokumente",
      "state": "Nordrhein-Westfalen",
      "amtsgericht": "Amtsgericht Köln",
      "registernummer": "HRB 104911",
      "registerart": "HRB",
      "company_name": "abiagenten AG",
      "company_seat": "Köln",
      "details": "05.06.2025 (Bekanntmachungsdatum)\n\nNordrhein-Westfalen Amtsgericht Köln HRB 104911\nEinreichung neuer Dokumente 05.06.2025 (Eintragungsdatum)\n\nabiagenten AG\nAktiengesellschaft\nKöln\n\nDem Registergericht ist eine neue Liste der Mitglieder des Aufsichtsrates eingereicht worden."
    },
    {
      "date": "2025-06-05",
      "id": "111395",
      "original_text": "Einreichung neuer Dokumente\nNordrhein-Westfalen Amtsgericht Düsseldorf HRB 77425\nUniper SE – Düsseldorf",
      "type": "Einreichung neuer Dokumente",
      "state": "Nordrhein-Westfalen",
      "amtsgericht": "Amtsgericht Düsseldorf",
      "registernummer": "HRB 77425",
      "registerart": "HRB",
      "company_name": "Uniper SE",
      "company_seat": "Düsseldorf",
      "details": "05.06.2025 (Bekanntmachungsdatum)\n\nNordrhein-Westfalen Amtsgericht Düsseldorf HRB 77425\nEinreichung neuer Dokumente\n\nUniper SE\nEuropäische Aktiengesellschaft (SE)\nDüsseldorf\n\nDem Registergericht ist eine Liste der Mitglieder des Aufsichtsrates eingereicht worden."
    },
    {
      "date": "2025-06-05",
      "id": "111396",
      "original_text": "Löschungsankündigung\nNordrhein-Westfalen Amtsgericht Dortmund HRB 33016\nUDK Gleissicherung GmbH – Dortmund",
      "type": "Löschungsankündigung",
      "state": "Nordrhein-Westfalen",
      "amtsgericht": "Amtsgericht Dortmund",
      "registernummer": "HRB 33016",
      "registerart": "HRB",
      "company_name": "UDK Gleissicherung GmbH",
      "company_seat": "Dortmund",
      "details": "05.06.2025 (Bekanntmachungsdatum)\n\nNordrhein-Westfalen Amtsgericht Dortmund HRB 33016\nLöschungsankündigung\n\nUDK Gleissicherung GmbH\nGesellschaft mit beschränkter Haftung\nDortmund\n\nDas Registergericht beabsichtigt die Gesellschaft von Amts wegen nach § 394 FamFG zu löschen. Die Frist zur Erhebung eines Widerspruchs ist auf zwei Monate festgesetzt."
    },
    {
      "date": "2025-06-05",
      "id": "111397",
      "original_text": "Einreichung neuer Dokumente\nNordrhein-Westfalen Amtsgericht Düren HRB 328\nMetsä Tissue GmbH – Kreuzau",
      "type": "Einreichung neuer Dokumente",
      "state": "Nordrhein-Westfalen",
      "amtsgericht": "Amtsgericht Düren",
      "registernummer": "HRB 328",
      "registerart": "HRB",
      "company_name": "Metsä Tissue GmbH",
      "company_seat": "Kreuzau",
      "details": "05.06.2025 (Bekanntmachungsdatum)\n\nNordrhein-Westfalen Amtsgericht Düren HRB 328\nEinreichung neuer Dokumente 05.06.2025 (Eintragungsdatum)\n\nMetsä Tissue GmbH\nGesellschaft mit beschränkter Haftung\nKreuzau\n\nDem Registergericht ist eine neue Liste der Mitglieder des Aufsichtsrates eingereicht worden."
    },
    {
      "date": "2025-06-05",
      "id": "111398",
      "original_text": "Registerbekanntmachung nach dem Umwandlungsgesetz\nNordrhein-Westfalen Amtsgericht Köln HRB 107624\nYPS Agentur für Kommunikation GmbH – Köln",
      "type": "Registerbekanntmachung nach dem Umwandlungsgesetz",
      "state": "Nordrhein-Westfalen",
      "amtsgericht": "Amtsgericht Köln",
      "registernummer": "HRB 107624",
      "registerart": "HRB",
      "company_name": "YPS Agentur für Kommunikation GmbH",
      "company_seat": "Köln",
      "details": "05.06.2025 (Bekanntmachungsdatum)\n\nNordrhein-Westfalen Amtsgericht Köln HRB 107624\nRegisterbekanntmachung nach dem Umwandlungsgesetz 05.06.2025 (Eintragungsdatum)\n\nYPS Agentur für Kommunikation GmbH\nGesellschaft mit beschränkter Haftung\nKöln\n\nDen Gläubigern der an der Verschmelzung beteiligten Rechtsträger ist, wenn sie binnen sechs Monaten nach dem Tag, an dem die Eintragung der Verschmelzung in das Register des Sitzes desjenigen Rechtsträgers, dessen Gläubiger sie sind, nach § 19 Absatz 3 UmwG als bekanntgemacht gilt, ihren Anspruch nach Grund und Höhe schriftlich anmelden, Sicherheit zu leisten, soweit sie nicht Befriedigung verlangen können. Dieses Recht steht den Gläubigern jedoch nur zu, wenn sie glaubhaft machen, dass durch die Verschmelzung die Erfüllung ihrer Forderung gefährdet wird."
    },
    {
      "date": "2025-06-05",
      "id": "111399",
      "original_text": "Registerbekanntmachung nach dem Umwandlungsgesetz\nNordrhein-Westfalen Amtsgericht Düsseldorf HRB 81405\nEvidensia Tierkliniken und -praxen Nordrhein GmbH – Düsseldorf",
      "type": "Registerbekanntmachung nach dem Umwandlungsgesetz",
      "state": "Nordrhein-Westfalen",
      "amtsgericht": "Amtsgericht Düsseldorf",
      "registernummer": "HRB 81405",
      "registerart": "HRB",
      "company_name": "Evidensia Tierkliniken und -praxen Nordrhein GmbH",
      "company_seat": "Düsseldorf",
      "details": "05.06.2025 (Bekanntmachungsdatum)\n\nNordrhein-Westfalen Amtsgericht Düsseldorf HRB 81405\nRegisterbekanntmachung nach dem Umwandlungsgesetz 05.06.2025 (Eintragungsdatum)\n\nEvidensia Tierkliniken und -praxen Nordrhein GmbH\nGesellschaft mit beschränkter Haftung\nDüsseldorf\n\nDen Gläubigern der an der Verschmelzung beteiligten Rechtsträger ist, wenn sie binnen sechs Monaten nach dem Tag, an dem die Eintragung der Verschmelzung in das Register des Sitzes desjenigen Rechtsträgers, dessen Gläubiger sie sind, nach § 19 Absatz 3 UmwG als bekanntgemacht gilt, ihren Anspruch nach Grund und Höhe schriftlich anmelden, Sicherheit zu leisten, soweit sie nicht Befriedigung verlangen können. Dieses Recht steht den Gläubigern jedoch nur zu, wenn sie glaubhaft machen, dass durch die Verschmelzung die Erfüllung ihrer Forderung gefährdet wird."
    },
    {
      "date": "2025-06-05",
      "id": "111400",
      "original_text": "Registerbekanntmachung nach dem Umwandlungsgesetz\nNordrhein-Westfalen Amtsgericht Köln HRB 123498\nProfessor Dr. Manuel Tusch GmbH – Köln",
      "type": "Registerbekanntmachung nach dem Umwandlungsgesetz",
      "state": "Nordrhein-Westfalen",
      "amtsgericht": "Amtsgericht Köln",
      "registernummer": "HRB 123498",
      "registerart": "HRB",
      "company_name": "Professor Dr. Manuel Tusch GmbH",
      "company_seat": "Köln",
      "details": "05.06.2025 (Bekanntmachungsdatum)\n\nNordrhein-Westfalen Amtsgericht Köln HRB 123498\nRegisterbekanntmachung nach dem Umwandlungsgesetz 05.06.2025 (Eintragungsdatum)\n\nProfessor Dr. Manuel Tusch GmbH\nGesellschaft mit beschränkter Haftung\nKöln\n\nDen Gläubigern der an der Ausgliederung beteiligten Rechtsträger ist, wenn sie binnen sechs Monaten nach dem Tag, an dem die Eintragung der Ausgliederung in das Register des Sitzes desjenigen Rechtsträgers, dessen Gläubiger sie sind, nach § 19 Absatz 3 UmwG als bekanntgemacht gilt, ihren Anspruch nach Grund und Höhe schriftlich anmelden, Sicherheit zu leisten, soweit sie nicht Befriedigung verlangen können. Dieses Recht steht den Gläubigern jedoch nur zu, wenn sie glaubhaft machen, dass durch die Ausgliederung die Erfüllung ihrer Forderung gefährdet wird."
    },
    {
      "date": "2025-06-05",
      "id": "111401",
      "original_text": "Löschungsankündigung\nThüringen Amtsgericht Jena HRA 503034\nAutohaus Guri GmbH & Co. KG – Zella-Mehlis",
      "type": "Löschungsankündigung",
      "state": "Thüringen",
      "amtsgericht": "Amtsgericht Jena",
      "registernummer": "HRA 503034",
      "registerart": "HRA",
      "company_name": "Autohaus Guri GmbH & Co. KG",
      "company_seat": "Zella-Mehlis",
      "details": "05.06.2025 (Bekanntmachungsdatum)\n\nThüringen Amtsgericht Jena HRA 503034\nLöschungsankündigung\n\nAutohaus Guri GmbH & Co. KG\nKommanditgesellschaft\nZella-Mehlis\n\nDas Registergericht beabsichtigt, die im Handelsregister eingetragene Firma von Amts wegen nach § 31 Abs.2 HGB zu löschen. Die Frist zur Erhebung eines Widerspruchs gegen die beabsichtigte Löschung wird auf 6 Wochen festgesetzt."
    },
    {
      "date": "2025-06-05",
      "id": "111402",
      "original_text": "Löschungsankündigung\nThüringen Amtsgericht Jena HRA 505243\nWIMARI International GmbH & Co. KG – Weimar",
      "type": "Löschungsankündigung",
      "state": "Thüringen",
      "amtsgericht": "Amtsgericht Jena",
      "registernummer": "HRA 505243",
      "registerart": "HRA",
      "company_name": "WIMARI International GmbH & Co. KG",
      "company_seat": "Weimar",
      "details": "05.06.2025 (Bekanntmachungsdatum)\n\nThüringen Amtsgericht Jena HRA 505243\nLöschungsankündigung\n\nWIMARI International GmbH & Co. KG\nKommanditgesellschaft\nWeimar\n\nDas Registergericht beabsichtigt, die im Handelsregister eingetragene Firma von Amts wegen nach § 31 Abs.2 HGB zu löschen. Die Frist zur Erhebung eines Widerspruchs gegen die beabsichtigte Löschung wird auf 6 Wochen festgesetzt."
    },
    {
      "date": "2025-06-05",
      "id": "111403",
      "original_text": "Registerbekanntmachung nach dem Umwandlungsgesetz\nHessen Amtsgericht Wiesbaden HRB 29744\nDr. Jan Kemper GmbH – Wiesbaden",
      "type": "Registerbekanntmachung nach dem Umwandlungsgesetz",
      "state": "Hessen",
      "amtsgericht": "Amtsgericht Wiesbaden",
      "registernummer": "HRB 29744",
      "registerart": "HRB",
      "company_name": "Dr. Jan Kemper GmbH",
      "company_seat": "Wiesbaden",
      "details": "05.06.2025 (Bekanntmachungsdatum)\n\nHessen Amtsgericht Wiesbaden HRB 29744\nRegisterbekanntmachung nach dem Umwandlungsgesetz 05.06.2025 (Eintragungsdatum)\n\nDr. Jan Kemper GmbH\nGesellschaft mit beschränkter Haftung\nWiesbaden\n\nDen Gläubigern der an der Verschmelzung beteiligten Rechtsträger ist, wenn sie binnen sechs Monaten nach dem Tag, an dem die Eintragung der Verschmelzung in das Register des Sitzes desjenigen Rechtsträgers, dessen Gläubiger sie sind, nach § 19 Absatz 3 UmwG bekannt gemacht worden ist, ihren Anspruch nach Grund und Höhe schriftlich anmelden, Sicherheit zu leisten, soweit sie nicht Befriedigung verlangen können. Dieses Recht steht den Gläubigern jedoch nur zu, wenn sie glaubhaft machen, dass durch die Verschmelzung die Erfüllung ihrer Forderung gefährdet wird."
    },
    {
      "date": "2025-06-05",
      "id": "111404",
      "original_text": "Registerbekanntmachung nach dem Umwandlungsgesetz\nHessen Amtsgericht Frankfurt am Main HRB 138963\nJW Stückekontor GmbH – Frankfurt am Main",
      "type": "Registerbekanntmachung nach dem Umwandlungsgesetz",
      "state": "Hessen",
      "amtsgericht": "Amtsgericht Frankfurt am Main",
      "registernummer": "HRB 138963",
      "registerart": "HRB",
      "company_name": "JW Stückekontor GmbH",
      "company_seat": "Frankfurt am Main",
      "details": "05.06.2025 (Bekanntmachungsdatum)\n\nHessen Amtsgericht Frankfurt am Main HRB 138963\nRegisterbekanntmachung nach dem Umwandlungsgesetz 05.06.2025 (Eintragungsdatum)\n\nJW Stückekontor GmbH\nGesellschaft mit beschränkter Haftung\nFrankfurt am Main\n\nDen Gläubigern der an der formwechselnden Umwandlung beteiligten Rechtsträger ist, wenn sie binnen sechs Monaten nach dem Tag, an dem die Eintragung der formwechselnden Umwandlung in das Register des Sitzes desjenigen Rechtsträgers, dessen Gläubiger sie sind, nach § 201 UmwG bekannt gemacht worden ist, ihren Anspruch nach Grund und Höhe schriftlich anmelden, Sicherheit zu leisten, soweit sie nicht Befriedigung verlangen können. Dieses Recht steht den Gläubigern jedoch nur zu, wenn sie glaubhaft machen, dass durch die formwechselnden Umwandlung die Erfüllung ihrer Forderung gefährdet wird."
    },
    {
      "date": "2025-06-05",
      "id": "111405",
      "original_text": "Löschungsankündigung\nHessen Amtsgericht Darmstadt HRB 101395\nChronis Bau und Transport UG (haftungsbeschränkt) – Rüsselsheim",
      "type": "Löschungsankündigung",
      "state": "Hessen",
      "amtsgericht": "Amtsgericht Darmstadt",
      "registernummer": "HRB 101395",
      "registerart": "HRB",
      "company_name": "Chronis Bau und Transport UG (haftungsbeschränkt)",
      "company_seat": "Rüsselsheim",
      "details": "05.06.2025 (Bekanntmachungsdatum)\n\nHessen Amtsgericht Darmstadt HRB 101395\nLöschungsankündigung\n\nChronis Bau und Transport UG (haftungsbeschränkt)\nGesellschaft mit beschränkter Haftung\nRüsselsheim\n\nDas Registergericht beabsichtigt die im Handelsregister eingetragene Gesellschaft von Amts wegen nach § 394 FamFG zu löschen. Die Frist zur Erhebung eines Widerspruchs gegen die beabsichtigte Löschung wird auf 3 Monate festgesetzt."
    },
    {
      "date": "2025-06-05",
      "id": "111406",
      "original_text": "Löschungsankündigung\nHessen Amtsgericht Frankfurt am Main HRB 46418\nJuring GmbH – Hofheim am Taunus",
      "type": "Löschungsankündigung",
      "state": "Hessen",
      "amtsgericht": "Amtsgericht Frankfurt am Main",
      "registernummer": "HRB 46418",
      "registerart": "HRB",
      "company_name": "Juring GmbH",
      "company_seat": "Hofheim am Taunus",
      "details": "05.06.2025 (Bekanntmachungsdatum)\n\nHessen Amtsgericht Frankfurt am Main HRB 46418\nLöschungsankündigung\n\nJuring GmbH\nGesellschaft mit beschränkter Haftung\nHofheim am Taunus\n\nDas Registergericht beabsichtigt die im Handelsregister eingetragene Gesellschaft von Amts wegen nach § 394 FamFG zu löschen. Die Frist zur Erhebung eines Widerspruchs gegen die beabsichtigte Löschung wird auf 1 Monat festgesetzt."
    },
    {
      "date": "2025-06-05",
      "id": "111407",
      "original_text": "Registerbekanntmachung nach dem Umwandlungsgesetz\nHessen Amtsgericht Wiesbaden HRB 13474\nRadio Media Süd-West Wiesbaden GmbH – Wiesbaden",
      "type": "Registerbekanntmachung nach dem Umwandlungsgesetz",
      "state": "Hessen",
      "amtsgericht": "Amtsgericht Wiesbaden",
      "registernummer": "HRB 13474",
      "registerart": "HRB",
      "company_name": "Radio Media Süd-West Wiesbaden GmbH",
      "company_seat": "Wiesbaden",
      "details": "05.06.2025 (Bekanntmachungsdatum)\n\nHessen Amtsgericht Wiesbaden HRB 13474\nRegisterbekanntmachung nach dem Umwandlungsgesetz 05.06.2025 (Eintragungsdatum)\n\nRadio Media Süd-West Wiesbaden GmbH\nGesellschaft mit beschränkter Haftung\nWiesbaden\n\nDen Gläubigern der an der Verschmelzung beteiligten Rechtsträger ist, wenn sie binnen sechs Monaten nach dem Tag, an dem die Eintragung der Verschmelzung in das Register des Sitzes desjenigen Rechtsträgers, dessen Gläubiger sie sind, nach § 19 Absatz 3 UmwG bekannt gemacht worden ist, ihren Anspruch nach Grund und Höhe schriftlich anmelden, Sicherheit zu leisten, soweit sie nicht Befriedigung verlangen können. Dieses Recht steht den Gläubigern jedoch nur zu, wenn sie glaubhaft machen, dass durch die Verschmelzung die Erfüllung ihrer Forderung gefährdet wird."
    },
    {
      "date": "2025-06-05",
      "id": "111408",
      "original_text": "Registerbekanntmachung nach dem Umwandlungsgesetz\nHessen Amtsgericht Kassel HRB 13142\nGBI Planung und Baumanagement GmbH – Kassel",
      "type": "Registerbekanntmachung nach dem Umwandlungsgesetz",
      "state": "Hessen",
      "amtsgericht": "Amtsgericht Kassel",
      "registernummer": "HRB 13142",
      "registerart": "HRB",
      "company_name": "GBI Planung und Baumanagement GmbH",
      "company_seat": "Kassel",
      "details": "05.06.2025 (Bekanntmachungsdatum)\n\nHessen Amtsgericht Kassel HRB 13142\nRegisterbekanntmachung nach dem Umwandlungsgesetz 05.06.2025 (Eintragungsdatum)\n\nGBI Planung und Baumanagement GmbH\nGesellschaft mit beschränkter Haftung\nKassel\n\nDen Gläubigern der Gesellschaft, deren Forderungen begründet worden sind, bevor die Eintragung der Beendigung des Vertrags in das Handelsregister nach § 10 HGB bekannt gemacht worden ist, ist vom anderen Vertragsteil Sicherheit zu leisten, wenn sie sich binnen sechs Monaten nach dieser Bekanntmachung zu diesem Zweck bei ihm melden."
    },
    {
      "date": "2025-06-05",
      "id": "111409",
      "original_text": "Einreichung neuer Dokumente\nHessen Amtsgericht Gießen HRB 5466\nGemeinnützige Heimstättenbaugesellschaft mit beschränkter Haftung Schlitz – Schlitz",
      "type": "Einreichung neuer Dokumente",
      "state": "Hessen",
      "amtsgericht": "Amtsgericht Gießen",
      "registernummer": "HRB 5466",
      "registerart": "HRB",
      "company_name": "Gemeinnützige Heimstättenbaugesellschaft mit beschränkter Haftung Schlitz",
      "company_seat": "Schlitz",
      "details": "05.06.2025 (Bekanntmachungsdatum)\n\nHessen Amtsgericht Gießen HRB 5466\nEinreichung neuer Dokumente\n\nGemeinnützige Heimstättenbaugesellschaft mit beschränkter Haftung Schlitz\nGesellschaft mit beschränkter Haftung\nSchlitz\n\nAufgrund von Änderungen in den Personen der Aufsichtsratsmitglieder ist eine Liste der Mitglieder des Aufsichtsrates zum Handelsregister eingereicht worden."
    },
    {
      "date": "2025-06-05",
      "id": "111410",
      "original_text": "Registerbekanntmachung nach dem Umwandlungsgesetz\nHessen Amtsgericht Darmstadt GsR 603\nJJMB eGbR – Darmstadt",
      "type": "Registerbekanntmachung nach dem Umwandlungsgesetz",
      "state": "Hessen",
      "amtsgericht": "Amtsgericht Darmstadt",
      "registernummer": "GsR 603",
      "registerart": "GsR",
      "company_name": "JJMB eGbR",
      "company_seat": "Darmstadt",
      "details": "05.06.2025 (Bekanntmachungsdatum)\n\nHessen Amtsgericht Darmstadt GsR 603\nRegisterbekanntmachung nach dem Umwandlungsgesetz 05.06.2025 (Eintragungsdatum)\n\nJJMB eGbR\nGesellschaft bürgerlichen Rechts\nDarmstadt\n\nDen Gläubigern der an der Abspaltung beteiligten Rechtsträger ist, wenn sie binnen sechs Monaten nach dem Tag, an dem die Eintragung der Abspaltung in das Register des Sitzes derjenigen Rechtsträger deren Gläubiger sie sind, nach §§ 125, 19 Absatz 3 UmwG bekannt gemacht worden ist, ihren Anspruch nach Grund und Höhe schriftlich anmelden, Sicherheit zu leisten, soweit sie nicht Befriedigung verlangen können. Dieses Recht steht den Gläubigern jedoch nur zu, wenn sie glaubhaft machen, dass durch die Abspaltung die Erfüllung ihrer Forderung gefährdet wird."
    },
    {
      "date": "2025-06-05",
      "id": "111411",
      "original_text": "Registerbekanntmachung nach dem Umwandlungsgesetz\nHessen Amtsgericht Wiesbaden HRB 34939\nM-Immo GmbH – Wiesbaden",
      "type": "Registerbekanntmachung nach dem Umwandlungsgesetz",
      "state": "Hessen",
      "amtsgericht": "Amtsgericht Wiesbaden",
      "registernummer": "HRB 34939",
      "registerart": "HRB",
      "company_name": "M-Immo GmbH",
      "company_seat": "Wiesbaden",
      "details": "05.06.2025 (Bekanntmachungsdatum)\n\nHessen Amtsgericht Wiesbaden HRB 34939\nRegisterbekanntmachung nach dem Umwandlungsgesetz 05.06.2025 (Eintragungsdatum)\n\nM-Immo GmbH\nGesellschaft mit beschränkter Haftung\nWiesbaden\n\nDen Gläubigern der an der Verschmelzung beteiligten Rechtsträger ist, wenn sie binnen sechs Monaten nach dem Tag, an dem die Eintragung der Verschmelzung in das Register des Sitzes desjenigen Rechtsträgers, dessen Gläubiger sie sind, nach § 19 Absatz 3 UmwG bekannt gemacht worden ist, ihren Anspruch nach Grund und Höhe schriftlich anmelden, Sicherheit zu leisten, soweit sie nicht Befriedigung verlangen können. Dieses Recht steht den Gläubigern jedoch nur zu, wenn sie glaubhaft machen, dass durch die Verschmelzung die Erfüllung ihrer Forderung gefährdet wird."
    },
    {
      "date": "2025-06-05",
      "id": "111412",
      "original_text": "Einreichung neuer Dokumente\nHessen Amtsgericht Frankfurt am Main HRB 121570\nFiera Capital (Germany) GmbH – Frankfurt am Main",
      "type": "Einreichung neuer Dokumente",
      "state": "Hessen",
      "amtsgericht": "Amtsgericht Frankfurt am Main",
      "registernummer": "HRB 121570",
      "registerart": "HRB",
      "company_name": "Fiera Capital (Germany) GmbH",
      "company_seat": "Frankfurt am Main",
      "details": "05.06.2025 (Bekanntmachungsdatum)\n\nHessen Amtsgericht Frankfurt am Main HRB 121570\nEinreichung neuer Dokumente\n\nFiera Capital (Germany) GmbH\nGesellschaft mit beschränkter Haftung\nFrankfurt am Main\n\nDurch eine Änderung in den Personen der Beiratsmitglieder ist eine Liste der Mitglieder des Beirates zum Handelsregister eingereicht worden."
    },
    {
      "date": "2025-06-05",
      "id": "111413",
      "original_text": "Registerbekanntmachung nach dem Umwandlungsgesetz\nHessen Amtsgericht Kassel HRB 18094\nWintershall Dea TSC Management GmbH – Kassel",
      "type": "Registerbekanntmachung nach dem Umwandlungsgesetz",
      "state": "Hessen",
      "amtsgericht": "Amtsgericht Kassel",
      "registernummer": "HRB 18094",
      "registerart": "HRB",
      "company_name": "Wintershall Dea TSC Management GmbH",
      "company_seat": "Kassel",
      "details": "05.06.2025 (Bekanntmachungsdatum)\n\nHessen Amtsgericht Kassel HRB 18094\nRegisterbekanntmachung nach dem Umwandlungsgesetz 05.06.2025 (Eintragungsdatum)\n\nWintershall Dea TSC Management GmbH\nGesellschaft mit beschränkter Haftung\nKassel\n\nDen Gläubigern der an der Verschmelzung beteiligten Rechtsträger ist, wenn sie binnen sechs Monaten nach dem Tag, an dem die Eintragung der Verschmelzung in das Register des Sitzes desjenigen Rechtsträgers, dessen Gläubiger sie sind, nach § 19 Absatz 3 UmwG bekannt gemacht worden ist, ihren Anspruch nach Grund und Höhe schriftlich anmelden, Sicherheit zu leisten, soweit sie nicht Befriedigung verlangen können. Dieses Recht steht den Gläubigern jedoch nur zu, wenn sie glaubhaft machen, dass durch die Verschmelzung die Erfüllung ihrer Forderung gefährdet wird."
    },
    {
      "date": "2025-06-05",
      "id": "111414",
      "original_text": "Registerbekanntmachung nach dem Umwandlungsgesetz\nHessen Amtsgericht Kassel HRA 18381\nAPA med, ambulante soziale Dienste Inh. Frau Albena Petrova Stefanova-Priester e.K. – Kaufungen",
      "type": "Registerbekanntmachung nach dem Umwandlungsgesetz",
      "state": "Hessen",
      "amtsgericht": "Amtsgericht Kassel",
      "registernummer": "HRA 18381",
      "registerart": "HRA",
      "company_name": "APA med, ambulante soziale Dienste Inh. Frau Albena Petrova Stefanova-Priester e.K.",
      "company_seat": "Kaufungen",
      "details": "05.06.2025 (Bekanntmachungsdatum)\n\nHessen Amtsgericht Kassel HRA 18381\nRegisterbekanntmachung nach dem Umwandlungsgesetz 05.06.2025 (Eintragungsdatum)\n\nAPA med, ambulante soziale Dienste Inh. Frau Albena Petrova Stefanova-Priester e.K.\nEinzelkaufmann / Einzelkauffrau\nKaufungen\n\nDen Gläubigern der an der Ausgliederung beteiligten Rechtsträger ist, wenn sie binnen sechs Monaten nach dem Tag, an dem die Eintragung der Ausgliederung in das Register des Sitzes derjenigen Rechtsträger deren Gläubiger sie sind, nach §§ 125, 19 Absatz 3 UmwG bekannt gemacht worden ist, ihren Anspruch nach Grund und Höhe schriftlich anmelden, Sicherheit zu leisten, soweit sie nicht Befriedigung verlangen können. Dieses Recht steht den Gläubigern jedoch nur zu, wenn sie glaubhaft machen, dass durch die Ausgliederung die Erfüllung ihrer Forderung gefährdet wird."
    },
    {
      "date": "2025-06-05",
      "id": "111415",
      "original_text": "Registerbekanntmachung nach dem Umwandlungsgesetz\nHessen Amtsgericht Frankfurt am Main GsR 535\nStückekontor MB/JW eGbR – Frankfurt am Main",
      "type": "Registerbekanntmachung nach dem Umwandlungsgesetz",
      "state": "Hessen",
      "amtsgericht": "Amtsgericht Frankfurt am Main",
      "registernummer": "GsR 535",
      "registerart": "GsR",
      "company_name": "Stückekontor MB/JW eGbR",
      "company_seat": "Frankfurt am Main",
      "details": "05.06.2025 (Bekanntmachungsdatum)\n\nHessen Amtsgericht Frankfurt am Main GsR 535\nRegisterbekanntmachung nach dem Umwandlungsgesetz 05.06.2025 (Eintragungsdatum)\n\nStückekontor MB/JW eGbR\nGesellschaft bürgerlichen Rechts\nFrankfurt am Main\n\nDen Gläubigern der an der formwechselnden Umwandlung beteiligten Rechtsträger ist, wenn sie binnen sechs Monaten nach dem Tag, an dem die Eintragung der formwechselnden Umwandlung in das Register des Sitzes desjenigen Rechtsträgers, dessen Gläubiger sie sind, nach § 201 UmwG bekannt gemacht worden ist, ihren Anspruch nach Grund und Höhe schriftlich anmelden, Sicherheit zu leisten, soweit sie nicht Befriedigung verlangen können. Dieses Recht steht den Gläubigern jedoch nur zu, wenn sie glaubhaft machen, dass durch die formwechselnden Umwandlung die Erfüllung ihrer Forderung gefährdet wird."
    },
    {
      "date": "2025-06-05",
      "id": "111416",
      "original_text": "Registerbekanntmachung nach dem Umwandlungsgesetz\nHessen Amtsgericht Darmstadt GsR 522\nBMJJ eGbR – Darmstadt",
      "type": "Registerbekanntmachung nach dem Umwandlungsgesetz",
      "state": "Hessen",
      "amtsgericht": "Amtsgericht Darmstadt",
      "registernummer": "GsR 522",
      "registerart": "GsR",
      "company_name": "BMJJ eGbR",
      "company_seat": "Darmstadt",
      "details": "05.06.2025 (Bekanntmachungsdatum)\n\nHessen Amtsgericht Darmstadt GsR 522\nRegisterbekanntmachung nach dem Umwandlungsgesetz 05.06.2025 (Eintragungsdatum)\n\nBMJJ eGbR\nGesellschaft bürgerlichen Rechts\nDarmstadt\n\nDen Gläubigern der an der Abspaltung beteiligten Rechtsträger ist, wenn sie binnen sechs Monaten nach dem Tag, an dem die Eintragung der Abspaltung in das Register des Sitzes derjenigen Rechtsträger deren Gläubiger sie sind, nach §§ 125, 19 Absatz 3 UmwG bekannt gemacht worden ist, ihren Anspruch nach Grund und Höhe schriftlich anmelden, Sicherheit zu leisten, soweit sie nicht Befriedigung verlangen können. Dieses Recht steht den Gläubigern jedoch nur zu, wenn sie glaubhaft machen, dass durch die Abspaltung die Erfüllung ihrer Forderung gefährdet wird."
    },
    {
      "date": "2025-06-05",
      "id": "80",
      "original_text": "Sonderregisterbekanntmachung OHNE Bezug zum elektr. Register\nBrandenburg Amtsgericht Neuruppin\nHRB 12384 NP\nLE.O Gruppe GmbH",
      "type": "Sonderregisterbekanntmachung OHNE Bezug zum elektr. Register",
      "state": "Brandenburg",
      "amtsgericht": "Amtsgericht Neuruppin",
      "company_name": "LE.O Gruppe GmbH",
      "sonderegister_referenz": "HRB 12384 NP",
      "details": "05.06.2025 (Bekanntmachungsdatum)\n\nBrandenburg Amtsgericht Neuruppin\nHRB 12384 NP\nSonderregisterbekanntmachung OHNE Bezug zum elektr. Register\n\nLE.O Gruppe GmbH\n\nAls nicht eingetragen wird bekannt gemacht: Eine Liste der Mitglieder des Aufsichtsrates wurde zum Handelsregister eingereicht."
    }
  ]
}